[I 2025-12-05 16:30:42,495] Trial 79 finished with value: 0.0053610100132565515 and parameters: {'model_type': 'mlp', 'hidden_dims': '[512, 256]', 'dropout': 0.5973316608947344, 'batch_norm': False, 'lr': 2.4067683093567186e-05, 'weight_decay': 2.0697436633281606e-05, 'epochs': 276, 'loss': 'mse', 'optimizer': 'adam', 'graph_mode': 'off', 'use_snp_selection': True, 'num_snps': 23401}. Best is trial 31 with value: 0.05619280643669682.
[I 2025-12-05 16:30:44,195] Trial 80 finished with value: 0.001017514321280038 and parameters: {'model_type': 'mlp', 'hidden_dims': '[512, 128]', 'dropout': 0.11346624320974134, 'batch_norm': False, 'lr': 3.44394573468512e-05, 'weight_decay': 3.690606712541336e-06, 'epochs': 249, 'loss': 'mse', 'optimizer': 'adam', 'graph_mode': 'off', 'use_snp_selection': True, 'num_snps': 25601}. Best is trial 31 with value: 0.05619280643669682.
[I 2025-12-05 16:30:45,654] Trial 81 finished with value: 0.025329699328845115 and parameters: {'model_type': 'mlp', 'hidden_dims': '[512, 128]', 'dropout': 0.5052377013643348, 'batch_norm': False, 'lr': 8.501186418678499e-05, 'weight_decay': 3.519036493007126e-05, 'epochs': 318, 'loss': 'mse', 'optimizer': 'adam', 'graph_mode': 'off', 'use_snp_selection': True, 'num_snps': 18693}. Best is trial 31 with value: 0.05619280643669682.
[I 2025-12-05 16:30:46,997] Trial 82 finished with value: 0.010519148572765842 and parameters: {'model_type': 'mlp', 'hidden_dims': '[512, 128]', 'dropout': 0.517924257323283, 'batch_norm': False, 'lr': 7.139347398776294e-05, 'weight_decay': 4.7701348663481634e-05, 'epochs': 341, 'loss': 'mse', 'optimizer': 'adam', 'graph_mode': 'off', 'use_snp_selection': True, 'num_snps': 14277}. Best is trial 31 with value: 0.05619280643669682.
[I 2025-12-05 16:30:48,197] Trial 83 finished with value: 0.03949773512284627 and parameters: {'model_type': 'mlp', 'hidden_dims': '[512, 128]', 'dropout': 0.5259352663304128, 'batch_norm': False, 'lr': 4.415367852323232e-05, 'weight_decay': 7.752185599220816e-06, 'epochs': 305, 'loss': 'mse', 'optimizer': 'adam', 'graph_mode': 'off', 'use_snp_selection': True, 'num_snps': 10720}. Best is trial 31 with value: 0.05619280643669682.
[I 2025-12-05 16:30:50,258] Trial 84 finished with value: 0.014881681874867122 and parameters: {'model_type': 'mlp', 'hidden_dims': '[512, 128]', 'dropout': 0.4597677921142679, 'batch_norm': False, 'lr': 0.00012827315975458061, 'weight_decay': 5.306914059176239e-06, 'epochs': 318, 'loss': 'mse', 'optimizer': 'adam', 'graph_mode': 'off', 'use_snp_selection': True, 'num_snps': 29875}. Best is trial 31 with value: 0.05619280643669682.
[I 2025-12-05 16:30:51,559] Trial 85 finished with value: 0.016176515890501716 and parameters: {'model_type': 'mlp', 'hidden_dims': '[256, 128, 64]', 'dropout': 0.48458775370179175, 'batch_norm': False, 'lr': 9.684368367217224e-05, 'weight_decay': 2.945528426002689e-05, 'epochs': 294, 'loss': 'mse', 'optimizer': 'adam', 'graph_mode': 'off', 'use_snp_selection': True, 'num_snps': 15555}. Best is trial 31 with value: 0.05619280643669682.
[I 2025-12-05 16:30:53,150] Trial 86 finished with value: 0.007282162476340175 and parameters: {'model_type': 'mlp', 'hidden_dims': '[512, 128]', 'dropout': 0.5437215036243568, 'batch_norm': False, 'lr': 0.0008261517530180313, 'weight_decay': 1.1690229644204572e-05, 'epochs': 231, 'loss': 'mae', 'optimizer': 'adam', 'graph_mode': 'off', 'use_snp_selection': False}. Best is trial 31 with value: 0.05619280643669682.
[I 2025-12-05 16:30:55,629] Trial 87 finished with value: 0.02284414573242152 and parameters: {'model_type': 'mlp', 'hidden_dims': '[256, 128]', 'dropout': 0.5633962054076956, 'batch_norm': True, 'lr': 0.00015297597837274362, 'weight_decay': 1.863347880140274e-05, 'epochs': 215, 'loss': 'mse', 'optimizer': 'adam', 'graph_mode': 'off', 'use_snp_selection': True, 'num_snps': 49238}. Best is trial 31 with value: 0.05619280643669682.
[I 2025-12-05 16:30:57,476] Trial 88 finished with value: 0.03284622949033421 and parameters: {'model_type': 'mlp', 'hidden_dims': '[512, 128]', 'dropout': 0.1341657097594853, 'batch_norm': False, 'lr': 0.0002624875295841651, 'weight_decay': 1.5014769499373826e-06, 'epochs': 260, 'loss': 'mse', 'optimizer': 'adam', 'graph_mode': 'off', 'use_snp_selection': True, 'num_snps': 27175}. Best is trial 31 with value: 0.05619280643669682.
[I 2025-12-05 16:31:00,598] Trial 89 finished with value: 0.011987799585526933 and parameters: {'model_type': 'mlp', 'hidden_dims': '[512, 64]', 'dropout': 0.3262308396569387, 'batch_norm': False, 'lr': 0.0004068869073333875, 'weight_decay': 2.429465617224409e-05, 'epochs': 282, 'loss': 'mse', 'optimizer': 'adam', 'graph_mode': 'off', 'use_snp_selection': True, 'num_snps': 53246}. Best is trial 31 with value: 0.05619280643669682.
[I 2025-12-05 16:31:02,983] Trial 90 finished with value: 0.014960417981793157 and parameters: {'model_type': 'mlp', 'hidden_dims': '[256, 128, 64]', 'dropout': 0.5233505822294856, 'batch_norm': False, 'lr': 6.523964667212851e-05, 'weight_decay': 3.963515440794458e-05, 'epochs': 333, 'loss': 'mse', 'optimizer': 'adam', 'graph_mode': 'off', 'use_snp_selection': True, 'num_snps': 41862}. Best is trial 31 with value: 0.05619280643669682.
[I 2025-12-05 16:31:04,806] Trial 91 finished with value: 0.03969580533088706 and parameters: {'model_type': 'mlp', 'hidden_dims': '[256, 128]', 'dropout': 0.3963532721443272, 'batch_norm': False, 'lr': 5.156565354196934e-05, 'weight_decay': 4.802115403080253e-06, 'epochs': 162, 'loss': 'mse', 'optimizer': 'adam', 'graph_mode': 'off', 'use_snp_selection': True, 'num_snps': 34438}. Best is trial 31 with value: 0.05619280643669682.
[I 2025-12-05 16:31:06,366] Trial 92 finished with value: 0.0414397856142602 and parameters: {'model_type': 'mlp', 'hidden_dims': '[256, 128]', 'dropout': 0.41890292478379576, 'batch_norm': False, 'lr': 4.274950028760702e-05, 'weight_decay': 6.120424810661724e-06, 'epochs': 177, 'loss': 'mse', 'optimizer': 'adam', 'graph_mode': 'off', 'use_snp_selection': True, 'num_snps': 30612}. Best is trial 31 with value: 0.05619280643669682.
[I 2025-12-05 16:31:08,195] Trial 93 finished with value: 0.029589824803510786 and parameters: {'model_type': 'mlp', 'hidden_dims': '[256, 128]', 'dropout': 0.39620040683606683, 'batch_norm': False, 'lr': 7.910541343639387e-05, 'weight_decay': 2.8010570081346283e-06, 'epochs': 207, 'loss': 'mse', 'optimizer': 'adam', 'graph_mode': 'off', 'use_snp_selection': True, 'num_snps': 32262}. Best is trial 31 with value: 0.05619280643669682.
[I 2025-12-05 16:31:10,301] Trial 94 finished with value: 0.005050871464581553 and parameters: {'model_type': 'mlp', 'hidden_dims': '[256, 128]', 'dropout': 0.47105596535355154, 'batch_norm': False, 'lr': 0.00011655364573531444, 'weight_decay': 8.869921977296669e-06, 'epochs': 57, 'loss': 'mse', 'optimizer': 'adam', 'graph_mode': 'off', 'use_snp_selection': True, 'num_snps': 46439}. Best is trial 31 with value: 0.05619280643669682.
[I 2025-12-05 16:31:11,089] Trial 95 finished with value: 0.0021882796690248707 and parameters: {'model_type': 'mlp', 'hidden_dims': '[256, 128]', 'dropout': 0.49312528548906814, 'batch_norm': False, 'lr': 2.7008357994006963e-05, 'weight_decay': 4.747119186347667e-06, 'epochs': 182, 'loss': 'mse', 'optimizer': 'adam', 'graph_mode': 'off', 'use_snp_selection': True, 'num_snps': 4592}. Best is trial 31 with value: 0.05619280643669682.
[I 2025-12-05 16:31:12,749] Trial 96 finished with value: 0.02875028678964701 and parameters: {'model_type': 'mlp', 'hidden_dims': '[512, 128]', 'dropout': 0.18583341867034514, 'batch_norm': False, 'lr': 3.4062885783172275e-05, 'weight_decay': 1.402972002432927e-05, 'epochs': 240, 'loss': 'mse', 'optimizer': 'adam', 'graph_mode': 'off', 'use_snp_selection': True, 'num_snps': 23763}. Best is trial 31 with value: 0.05619280643669682.
[I 2025-12-05 16:31:14,750] Trial 97 finished with value: 0.029935006943518756 and parameters: {'model_type': 'mlp', 'hidden_dims': '[256, 128]', 'dropout': 0.3722532941448371, 'batch_norm': False, 'lr': 4.503646300904245e-05, 'weight_decay': 0.00032003935689661745, 'epochs': 195, 'loss': 'mse', 'optimizer': 'adam', 'graph_mode': 'off', 'use_snp_selection': True, 'num_snps': 37464}. Best is trial 31 with value: 0.05619280643669682.
[I 2025-12-05 16:31:16,436] Trial 98 finished with value: 0.010699225035050422 and parameters: {'model_type': 'mlp', 'hidden_dims': '[128, 64]', 'dropout': 0.5561446535569714, 'batch_norm': False, 'lr': 5.880759569329726e-05, 'weight_decay': 7.41665636348665e-06, 'epochs': 267, 'loss': 'mae', 'optimizer': 'adam', 'graph_mode': 'off', 'use_snp_selection': True, 'num_snps': 28811}. Best is trial 31 with value: 0.05619280643669682.
[I 2025-12-05 16:31:17,673] Trial 99 finished with value: -0.009962494170870044 and parameters: {'model_type': 'mlp', 'hidden_dims': '[512, 128]', 'dropout': 0.24340921964126694, 'batch_norm': True, 'lr': 0.0006561373519472235, 'weight_decay': 1.0374047366793609e-05, 'epochs': 122, 'loss': 'mse', 'optimizer': 'adam', 'graph_mode': 'off', 'use_snp_selection': False}. Best is trial 31 with value: 0.05619280643669682.
[I 2025-12-05 16:31:19,295] Trial 100 finished with value: 0.01477526151683651 and parameters: {'model_type': 'mlp', 'hidden_dims': '[512, 256]', 'dropout': 0.5865587682033604, 'batch_norm': False, 'lr': 9.595975257779207e-05, 'weight_decay': 1.648540157302049e-05, 'epochs': 160, 'loss': 'mse', 'optimizer': 'adam', 'graph_mode': 'off', 'use_snp_selection': True, 'num_snps': 26552}. Best is trial 31 with value: 0.05619280643669682.
[I 2025-12-05 16:31:20,933] Trial 101 finished with value: 0.0004010330648049019 and parameters: {'model_type': 'mlp', 'hidden_dims': '[256, 128]', 'dropout': 0.41467828027677944, 'batch_norm': False, 'lr': 3.755285604563689e-05, 'weight_decay': 6.417026081179867e-06, 'epochs': 168, 'loss': 'mse', 'optimizer': 'adam', 'graph_mode': 'off', 'use_snp_selection': True, 'num_snps': 31369}. Best is trial 31 with value: 0.05619280643669682.
[I 2025-12-05 16:31:22,609] Trial 102 finished with value: 0.024171425929852136 and parameters: {'model_type': 'mlp', 'hidden_dims': '[256, 128]', 'dropout': 0.4466874369678845, 'batch_norm': False, 'lr': 4.853695848834475e-05, 'weight_decay': 3.7038169958032265e-06, 'epochs': 154, 'loss': 'mse', 'optimizer': 'adam', 'graph_mode': 'off', 'use_snp_selection': True, 'num_snps': 30473}. Best is trial 31 with value: 0.05619280643669682.
[I 2025-12-05 16:31:24,448] Trial 103 finished with value: 0.037191948241364424 and parameters: {'model_type': 'mlp', 'hidden_dims': '[256, 128]', 'dropout': 0.42357355341394726, 'batch_norm': False, 'lr': 7.257739498378829e-05, 'weight_decay': 6.025819239658884e-06, 'epochs': 182, 'loss': 'mse', 'optimizer': 'adam', 'graph_mode': 'off', 'use_snp_selection': True, 'num_snps': 33329}. Best is trial 31 with value: 0.05619280643669682.
[I 2025-12-05 16:31:26,485] Trial 104 finished with value: 0.010849508215352442 and parameters: {'model_type': 'mlp', 'hidden_dims': '[256, 128]', 'dropout': 0.4455684938761589, 'batch_norm': False, 'lr': 4.445845420911327e-05, 'weight_decay': 2.9875110955270644e-06, 'epochs': 137, 'loss': 'mse', 'optimizer': 'adam', 'graph_mode': 'off', 'use_snp_selection': True, 'num_snps': 43319}. Best is trial 31 with value: 0.05619280643669682.
[I 2025-12-05 16:31:27,929] Trial 105 finished with value: -0.0005993961172107323 and parameters: {'model_type': 'mlp', 'hidden_dims': '[256, 128]', 'dropout': 0.3401679410004501, 'batch_norm': False, 'lr': 1.7996108660518624e-05, 'weight_decay': 4.413314800892357e-06, 'epochs': 95, 'loss': 'mse', 'optimizer': 'adam', 'graph_mode': 'off', 'use_snp_selection': True, 'num_snps': 28963}. Best is trial 31 with value: 0.05619280643669682.
[I 2025-12-05 16:31:30,039] Trial 106 finished with value: 0.028348064204612652 and parameters: {'model_type': 'mlp', 'hidden_dims': '[512, 128]', 'dropout': 0.10156832919071063, 'batch_norm': False, 'lr': 5.6361043135756995e-05, 'weight_decay': 1.2485677276762161e-05, 'epochs': 198, 'loss': 'mse', 'optimizer': 'adam', 'graph_mode': 'off', 'use_snp_selection': True, 'num_snps': 35943}. Best is trial 31 with value: 0.05619280643669682.
[I 2025-12-05 16:31:32,861] Trial 107 finished with value: 0.05874472689184193 and parameters: {'model_type': 'mlp', 'hidden_dims': '[512, 64]', 'dropout': 0.572669340247585, 'batch_norm': False, 'lr': 0.0005272922978340527, 'weight_decay': 8.477258125418437e-06, 'epochs': 255, 'loss': 'mse', 'optimizer': 'adam', 'graph_mode': 'off', 'use_snp_selection': True, 'num_snps': 47900}. Best is trial 107 with value: 0.05874472689184193.
[I 2025-12-05 16:31:35,584] Trial 108 finished with value: 0.013405394202553213 and parameters: {'model_type': 'mlp', 'hidden_dims': '[512, 64]', 'dropout': 0.5790623059432707, 'batch_norm': False, 'lr': 0.00022740803828223043, 'weight_decay': 0.0007566263502340557, 'epochs': 247, 'loss': 'mse', 'optimizer': 'adam', 'graph_mode': 'off', 'use_snp_selection': True, 'num_snps': 48773}. Best is trial 107 with value: 0.05874472689184193.
[I 2025-12-05 16:31:38,364] Trial 109 finished with value: 0.01571459511177286 and parameters: {'model_type': 'mlp', 'hidden_dims': '[512, 64]', 'dropout': 0.5353512827608184, 'batch_norm': False, 'lr': 0.0008925929172833229, 'weight_decay': 9.454509176146389e-06, 'epochs': 256, 'loss': 'mse', 'optimizer': 'adam', 'graph_mode': 'off', 'use_snp_selection': True, 'num_snps': 45601}. Best is trial 107 with value: 0.05874472689184193.
[I 2025-12-05 16:31:41,248] Trial 110 finished with value: -0.019396701263237413 and parameters: {'model_type': 'mlp', 'hidden_dims': '[512, 64]', 'dropout': 0.5744056249400323, 'batch_norm': False, 'lr': 0.0005364597694671195, 'weight_decay': 8.780603796693723e-05, 'epochs': 275, 'loss': 'mse', 'optimizer': 'adam', 'graph_mode': 'off', 'use_snp_selection': True, 'num_snps': 52050}. Best is trial 107 with value: 0.05874472689184193.
[I 2025-12-05 16:31:44,060] Trial 111 finished with value: 0.009787029606467344 and parameters: {'model_type': 'mlp', 'hidden_dims': '[512, 64]', 'dropout': 0.15809142175260182, 'batch_norm': False, 'lr': 0.0004395617524999288, 'weight_decay': 1.9505403114382e-06, 'epochs': 231, 'loss': 'mse', 'optimizer': 'adam', 'graph_mode': 'off', 'use_snp_selection': True, 'num_snps': 47396}. Best is trial 107 with value: 0.05874472689184193.
[I 2025-12-05 16:31:45,590] Trial 112 finished with value: 0.03161105225693503 and parameters: {'model_type': 'mlp', 'hidden_dims': '[256, 128, 64]', 'dropout': 0.4621104884378417, 'batch_norm': False, 'lr': 4.163801559107896e-05, 'weight_decay': 6.028118170701566e-06, 'epochs': 224, 'loss': 'mse', 'optimizer': 'adam', 'graph_mode': 'off', 'use_snp_selection': True, 'num_snps': 24311}. Best is trial 107 with value: 0.05874472689184193.
[I 2025-12-05 16:31:48,561] Trial 113 finished with value: 0.0110550939196145 and parameters: {'model_type': 'mlp', 'hidden_dims': '[512, 128]', 'dropout': 0.3862022398530729, 'batch_norm': False, 'lr': 0.0006230094891189407, 'weight_decay': 7.983103637702158e-06, 'epochs': 270, 'loss': 'mse', 'optimizer': 'adam', 'graph_mode': 'off', 'use_snp_selection': True, 'num_snps': 50140}. Best is trial 107 with value: 0.05874472689184193.
[I 2025-12-05 16:31:50,091] Trial 114 finished with value: 0.020354164913769377 and parameters: {'model_type': 'mlp', 'hidden_dims': '[256, 128]', 'dropout': 0.4793098179573602, 'batch_norm': False, 'lr': 3.0237926367578196e-05, 'weight_decay': 9.88762277583705e-06, 'epochs': 288, 'loss': 'mse', 'optimizer': 'adam', 'graph_mode': 'off', 'use_snp_selection': True, 'num_snps': 21746}. Best is trial 107 with value: 0.05874472689184193.
[I 2025-12-05 16:31:52,019] Trial 115 finished with value: 0.018155888946198753 and parameters: {'model_type': 'mlp', 'hidden_dims': '[512, 64]', 'dropout': 0.40601742859586326, 'batch_norm': False, 'lr': 0.0001466888499070679, 'weight_decay': 2.111456408166496e-05, 'epochs': 243, 'loss': 'mse', 'optimizer': 'adam', 'graph_mode': 'off', 'use_snp_selection': True, 'num_snps': 31568}. Best is trial 107 with value: 0.05874472689184193.
[I 2025-12-05 16:31:53,178] Trial 116 finished with value: 0.02859184112945208 and parameters: {'model_type': 'mlp', 'hidden_dims': '[512, 128]', 'dropout': 0.11979189821347463, 'batch_norm': False, 'lr': 6.364793948410914e-05, 'weight_decay': 6.840173433427527e-07, 'epochs': 253, 'loss': 'mse', 'optimizer': 'adam', 'graph_mode': 'off', 'use_snp_selection': True, 'num_snps': 12191}. Best is trial 107 with value: 0.05874472689184193.
[I 2025-12-05 16:31:55,549] Trial 117 finished with value: 0.022724945951803372 and parameters: {'model_type': 'mlp', 'hidden_dims': '[512, 128]', 'dropout': 0.5015470283178438, 'batch_norm': False, 'lr': 9.172306125238067e-05, 'weight_decay': 5.807121770208219e-05, 'epochs': 262, 'loss': 'mse', 'optimizer': 'adam', 'graph_mode': 'off', 'use_snp_selection': True, 'num_snps': 38516}. Best is trial 107 with value: 0.05874472689184193.
[I 2025-12-05 16:31:56,780] Trial 118 finished with value: -0.0025775302490448587 and parameters: {'model_type': 'mlp', 'hidden_dims': '[256, 128]', 'dropout': 0.587448788025449, 'batch_norm': False, 'lr': 8.077957690307224e-05, 'weight_decay': 2.6306846087831126e-05, 'epochs': 296, 'loss': 'mae', 'optimizer': 'adam', 'graph_mode': 'off', 'use_snp_selection': False}. Best is trial 107 with value: 0.05874472689184193.
[I 2025-12-05 16:31:58,259] Trial 119 finished with value: 0.010959431648171706 and parameters: {'model_type': 'mlp', 'hidden_dims': '[256, 128, 64]', 'dropout': 0.35330837514654895, 'batch_norm': True, 'lr': 0.00019497589438417488, 'weight_decay': 1.5830349821427183e-05, 'epochs': 236, 'loss': 'mse', 'optimizer': 'adam', 'graph_mode': 'off', 'use_snp_selection': True, 'num_snps': 19474}. Best is trial 107 with value: 0.05874472689184193.
[I 2025-12-05 16:31:59,165] Trial 120 finished with value: 0.05701130973636153 and parameters: {'model_type': 'mlp', 'hidden_dims': '[512, 128]', 'dropout': 0.5164030415514886, 'batch_norm': False, 'lr': 0.0003910287836688959, 'weight_decay': 5.49659679578955e-06, 'epochs': 180, 'loss': 'mse', 'optimizer': 'adam', 'graph_mode': 'off', 'use_snp_selection': True, 'num_snps': 6988}. Best is trial 107 with value: 0.05874472689184193.
[I 2025-12-05 16:32:00,059] Trial 121 finished with value: 0.018429491037244516 and parameters: {'model_type': 'mlp', 'hidden_dims': '[512, 128]', 'dropout': 0.5161777530721346, 'batch_norm': False, 'lr': 0.0009992204606644934, 'weight_decay': 5.083287029643028e-06, 'epochs': 183, 'loss': 'mse', 'optimizer': 'adam', 'graph_mode': 'off', 'use_snp_selection': True, 'num_snps': 6012}. Best is trial 107 with value: 0.05874472689184193.
[I 2025-12-05 16:32:00,890] Trial 122 finished with value: 0.032609843316325396 and parameters: {'model_type': 'mlp', 'hidden_dims': '[512, 128]', 'dropout': 0.5452291091140168, 'batch_norm': False, 'lr': 0.0003351346238617578, 'weight_decay': 4.152336663625713e-06, 'epochs': 217, 'loss': 'mse', 'optimizer': 'adam', 'graph_mode': 'off', 'use_snp_selection': True, 'num_snps': 3315}. Best is trial 107 with value: 0.05874472689184193.
[I 2025-12-05 16:32:01,845] Trial 123 finished with value: 0.020797141102330403 and parameters: {'model_type': 'mlp', 'hidden_dims': '[512, 128]', 'dropout': 0.4877605673376233, 'batch_norm': False, 'lr': 0.0003869049280551875, 'weight_decay': 6.66549730095702e-06, 'epochs': 172, 'loss': 'mse', 'optimizer': 'adam', 'graph_mode': 'off', 'use_snp_selection': True, 'num_snps': 8526}. Best is trial 107 with value: 0.05874472689184193.
[I 2025-12-05 16:32:02,657] Trial 124 finished with value: 0.011566237268705778 and parameters: {'model_type': 'mlp', 'hidden_dims': '[128, 64]', 'dropout': 0.5303204479556027, 'batch_norm': False, 'lr': 0.0002765678239568058, 'weight_decay': 8.18066200997337e-06, 'epochs': 186, 'loss': 'mse', 'optimizer': 'adam', 'graph_mode': 'off', 'use_snp_selection': True, 'num_snps': 3940}. Best is trial 107 with value: 0.05874472689184193.
[I 2025-12-05 16:32:03,606] Trial 125 finished with value: 0.044780971249192884 and parameters: {'model_type': 'mlp', 'hidden_dims': '[512, 128]', 'dropout': 0.5704050291161709, 'batch_norm': False, 'lr': 0.0007420753087790759, 'weight_decay': 3.101923102935105e-06, 'epochs': 177, 'loss': 'mse', 'optimizer': 'adam', 'graph_mode': 'off', 'use_snp_selection': True, 'num_snps': 7558}. Best is trial 107 with value: 0.05874472689184193.
[I 2025-12-05 16:32:04,542] Trial 126 finished with value: 0.03179182588261658 and parameters: {'model_type': 'mlp', 'hidden_dims': '[512, 128]', 'dropout': 0.5666849818834392, 'batch_norm': False, 'lr': 0.0007673046641216979, 'weight_decay': 2.6133614142422877e-06, 'epochs': 210, 'loss': 'mse', 'optimizer': 'adam', 'graph_mode': 'off', 'use_snp_selection': True, 'num_snps': 6292}. Best is trial 107 with value: 0.05874472689184193.
[I 2025-12-05 16:32:05,708] Trial 127 finished with value: 0.035178902823182305 and parameters: {'model_type': 'mlp', 'hidden_dims': '[512, 128]', 'dropout': 0.5507285606513658, 'batch_norm': False, 'lr': 0.0007072666061358244, 'weight_decay': 1.7344191006701825e-06, 'epochs': 169, 'loss': 'mse', 'optimizer': 'adam', 'graph_mode': 'off', 'use_snp_selection': True, 'num_snps': 14110}. Best is trial 107 with value: 0.05874472689184193.
[I 2025-12-05 16:32:06,683] Trial 128 finished with value: 0.047334709896988576 and parameters: {'model_type': 'mlp', 'hidden_dims': '[512, 128]', 'dropout': 0.5391160297202164, 'batch_norm': False, 'lr': 0.0005650449181859612, 'weight_decay': 1.1814506155624184e-06, 'epochs': 143, 'loss': 'mse', 'optimizer': 'adam', 'graph_mode': 'off', 'use_snp_selection': True, 'num_snps': 9208}. Best is trial 107 with value: 0.05874472689184193.
