[I 2025-12-05 16:32:57,301] Trial 46 finished with value: 0.053376329529567626 and parameters: {'model_type': 'mlp', 'hidden_dims': '[512, 128]', 'dropout': 0.12920870811539148, 'batch_norm': True, 'lr': 0.0005760171081436757, 'weight_decay': 1.0787189358038839e-05, 'epochs': 231, 'loss': 'mae', 'optimizer': 'adam', 'graph_mode': 'off', 'use_snp_selection': False}. Best is trial 45 with value: 0.09782401419539313.
[I 2025-12-05 16:32:58,712] Trial 47 finished with value: -0.007288169266100871 and parameters: {'model_type': 'mlp', 'hidden_dims': '[512, 128]', 'dropout': 0.13381801621319261, 'batch_norm': False, 'lr': 0.0004403541177937646, 'weight_decay': 0.00019270731355664042, 'epochs': 208, 'loss': 'mse', 'optimizer': 'adam', 'graph_mode': 'off', 'use_snp_selection': False}. Best is trial 45 with value: 0.09782401419539313.
[I 2025-12-05 16:33:00,050] Trial 48 finished with value: 0.06208945419162196 and parameters: {'model_type': 'mlp', 'hidden_dims': '[512, 128]', 'dropout': 0.22016897154835438, 'batch_norm': True, 'lr': 0.00022606098311093775, 'weight_decay': 0.0006963874766430621, 'epochs': 174, 'loss': 'mse', 'optimizer': 'adam', 'graph_mode': 'off', 'use_snp_selection': False}. Best is trial 45 with value: 0.09782401419539313.
[I 2025-12-05 16:33:02,642] Trial 49 finished with value: 0.0714561384844512 and parameters: {'model_type': 'mlp', 'hidden_dims': '[512, 128]', 'dropout': 0.17464540185725191, 'batch_norm': True, 'lr': 0.0006841207473177932, 'weight_decay': 1.639526541373067e-05, 'epochs': 249, 'loss': 'mae', 'optimizer': 'adam', 'graph_mode': 'off', 'use_snp_selection': True, 'num_snps': 46888}. Best is trial 45 with value: 0.09782401419539313.
[I 2025-12-05 16:33:04,290] Trial 50 finished with value: 0.08764608964085245 and parameters: {'model_type': 'mlp', 'hidden_dims': '[512, 128]', 'dropout': 0.10552835381219672, 'batch_norm': True, 'lr': 0.0003441472994837093, 'weight_decay': 9.104294315321059e-07, 'epochs': 273, 'loss': 'mse', 'optimizer': 'adam', 'graph_mode': 'off', 'use_snp_selection': False}. Best is trial 45 with value: 0.09782401419539313.
[I 2025-12-05 16:33:05,914] Trial 51 finished with value: 0.06439115624335191 and parameters: {'model_type': 'mlp', 'hidden_dims': '[512, 128]', 'dropout': 0.11736755841977586, 'batch_norm': True, 'lr': 0.0003379371093636321, 'weight_decay': 3.997575009564376e-07, 'epochs': 273, 'loss': 'mse', 'optimizer': 'adam', 'graph_mode': 'off', 'use_snp_selection': False}. Best is trial 45 with value: 0.09782401419539313.
[I 2025-12-05 16:33:07,464] Trial 52 finished with value: 0.08138074262044356 and parameters: {'model_type': 'mlp', 'hidden_dims': '[512, 128]', 'dropout': 0.1498978420752606, 'batch_norm': True, 'lr': 0.0004926545214424668, 'weight_decay': 9.588565691820519e-07, 'epochs': 254, 'loss': 'mse', 'optimizer': 'adam', 'graph_mode': 'off', 'use_snp_selection': False}. Best is trial 45 with value: 0.09782401419539313.
[I 2025-12-05 16:33:09,165] Trial 53 finished with value: 0.0933847580689976 and parameters: {'model_type': 'mlp', 'hidden_dims': '[512, 128]', 'dropout': 0.10065299236808255, 'batch_norm': True, 'lr': 0.0001949043691901086, 'weight_decay': 1.459787552514733e-07, 'epochs': 284, 'loss': 'mse', 'optimizer': 'adam', 'graph_mode': 'off', 'use_snp_selection': False}. Best is trial 45 with value: 0.09782401419539313.
[I 2025-12-05 16:33:10,701] Trial 54 finished with value: 0.04551844117323039 and parameters: {'model_type': 'mlp', 'hidden_dims': '[512, 128]', 'dropout': 0.11061425242959326, 'batch_norm': True, 'lr': 0.00019242822662527277, 'weight_decay': 1.6163186955243153e-07, 'epochs': 231, 'loss': 'mse', 'optimizer': 'adam', 'graph_mode': 'off', 'use_snp_selection': False}. Best is trial 45 with value: 0.09782401419539313.
[I 2025-12-05 16:33:12,418] Trial 55 finished with value: 0.08729976978475 and parameters: {'model_type': 'mlp', 'hidden_dims': '[512, 128]', 'dropout': 0.10403175772058434, 'batch_norm': True, 'lr': 6.348047937345018e-05, 'weight_decay': 1.053420459630701e-07, 'epochs': 286, 'loss': 'mse', 'optimizer': 'adam', 'graph_mode': 'off', 'use_snp_selection': False}. Best is trial 45 with value: 0.09782401419539313.
[I 2025-12-05 16:33:14,121] Trial 56 finished with value: 0.05681832451994462 and parameters: {'model_type': 'mlp', 'hidden_dims': '[512, 128]', 'dropout': 0.10434622904794764, 'batch_norm': True, 'lr': 7.144831209714233e-05, 'weight_decay': 1.1959692418793022e-07, 'epochs': 283, 'loss': 'mse', 'optimizer': 'adam', 'graph_mode': 'off', 'use_snp_selection': False}. Best is trial 45 with value: 0.09782401419539313.
[I 2025-12-05 16:33:15,058] Trial 57 finished with value: 0.0452106270310032 and parameters: {'model_type': 'mlp', 'hidden_dims': '[512, 128]', 'dropout': 0.13728028621144095, 'batch_norm': True, 'lr': 3.149193427352507e-05, 'weight_decay': 2.8312669380314084e-06, 'epochs': 42, 'loss': 'mse', 'optimizer': 'adam', 'graph_mode': 'off', 'use_snp_selection': False}. Best is trial 45 with value: 0.09782401419539313.
[I 2025-12-05 16:33:16,610] Trial 58 finished with value: 0.030822055946025037 and parameters: {'model_type': 'mlp', 'hidden_dims': '[512, 128]', 'dropout': 0.16525020182764005, 'batch_norm': False, 'lr': 5.1022607122252124e-05, 'weight_decay': 3.190504183680926e-05, 'epochs': 247, 'loss': 'mse', 'optimizer': 'adam', 'graph_mode': 'off', 'use_snp_selection': False}. Best is trial 45 with value: 0.09782401419539313.
[I 2025-12-05 16:33:17,979] Trial 59 finished with value: 0.051989787200122296 and parameters: {'model_type': 'mlp', 'hidden_dims': '[512, 128]', 'dropout': 0.20178686737700918, 'batch_norm': True, 'lr': 0.00015454187224242283, 'weight_decay': 1.0947315820791056e-07, 'epochs': 183, 'loss': 'mse', 'optimizer': 'adam', 'graph_mode': 'off', 'use_snp_selection': False}. Best is trial 45 with value: 0.09782401419539313.
[I 2025-12-05 16:33:19,635] Trial 60 finished with value: 0.07962968349645765 and parameters: {'model_type': 'mlp', 'hidden_dims': '[512, 128]', 'dropout': 0.1028458221006116, 'batch_norm': True, 'lr': 0.0002173796692959453, 'weight_decay': 2.7700247415711025e-07, 'epochs': 286, 'loss': 'mse', 'optimizer': 'adam', 'graph_mode': 'off', 'use_snp_selection': False}. Best is trial 45 with value: 0.09782401419539313.
[I 2025-12-05 16:33:21,361] Trial 61 finished with value: 0.08459249994837482 and parameters: {'model_type': 'mlp', 'hidden_dims': '[512, 128]', 'dropout': 0.14523833082334345, 'batch_norm': True, 'lr': 0.00035493320927297713, 'weight_decay': 1.4694310331514255e-07, 'epochs': 309, 'loss': 'mse', 'optimizer': 'adam', 'graph_mode': 'off', 'use_snp_selection': False}. Best is trial 45 with value: 0.09782401419539313.
[I 2025-12-05 16:33:22,979] Trial 62 finished with value: 0.08074688898157371 and parameters: {'model_type': 'mlp', 'hidden_dims': '[512, 128]', 'dropout': 0.11998324209595321, 'batch_norm': True, 'lr': 0.0002921546904399617, 'weight_decay': 2.0425573423301759e-07, 'epochs': 275, 'loss': 'mse', 'optimizer': 'adam', 'graph_mode': 'off', 'use_snp_selection': False}. Best is trial 45 with value: 0.09782401419539313.
[I 2025-12-05 16:33:23,891] Trial 63 finished with value: -0.0077470429232906575 and parameters: {'model_type': 'mlp', 'hidden_dims': '[128, 64]', 'dropout': 0.10006821438809275, 'batch_norm': True, 'lr': 9.300275050925982e-06, 'weight_decay': 4.713069888635688e-07, 'epochs': 262, 'loss': 'mse', 'optimizer': 'adam', 'graph_mode': 'off', 'use_snp_selection': False}. Best is trial 45 with value: 0.09782401419539313.
[I 2025-12-05 16:33:25,654] Trial 64 finished with value: 0.07175266567873699 and parameters: {'model_type': 'mlp', 'hidden_dims': '[512, 128]', 'dropout': 0.15681905344328706, 'batch_norm': True, 'lr': 0.0004296739444459408, 'weight_decay': 3.0428507901748993e-07, 'epochs': 304, 'loss': 'mse', 'optimizer': 'adam', 'graph_mode': 'off', 'use_snp_selection': False}. Best is trial 45 with value: 0.09782401419539313.
[I 2025-12-05 16:33:26,723] Trial 65 finished with value: 0.059891093212269327 and parameters: {'model_type': 'mlp', 'hidden_dims': '[256, 128, 64]', 'dropout': 0.13087745077921692, 'batch_norm': True, 'lr': 9.381711701947514e-05, 'weight_decay': 1.7650305948338437e-07, 'epochs': 210, 'loss': 'mse', 'optimizer': 'adam', 'graph_mode': 'off', 'use_snp_selection': False}. Best is trial 45 with value: 0.09782401419539313.
[I 2025-12-05 16:33:28,430] Trial 66 finished with value: 0.07399177140012692 and parameters: {'model_type': 'mlp', 'hidden_dims': '[512, 128]', 'dropout': 0.18169616015041035, 'batch_norm': True, 'lr': 0.0002269278141079213, 'weight_decay': 1.475908254589878e-05, 'epochs': 287, 'loss': 'mse', 'optimizer': 'adam', 'graph_mode': 'off', 'use_snp_selection': True, 'num_snps': 22881}. Best is trial 45 with value: 0.09782401419539313.
[I 2025-12-05 16:33:29,959] Trial 67 finished with value: -0.000711719477673937 and parameters: {'model_type': 'mlp', 'hidden_dims': '[512, 64]', 'dropout': 0.27974438705377114, 'batch_norm': True, 'lr': 1.038788092140181e-06, 'weight_decay': 7.366394783512833e-07, 'epochs': 232, 'loss': 'mse', 'optimizer': 'adam', 'graph_mode': 'off', 'use_snp_selection': False}. Best is trial 45 with value: 0.09782401419539313.
[I 2025-12-05 16:33:31,547] Trial 68 finished with value: 0.05939208969224393 and parameters: {'model_type': 'mlp', 'hidden_dims': '[512, 128]', 'dropout': 0.3326798987697642, 'batch_norm': True, 'lr': 7.432116984385524e-05, 'weight_decay': 1.3365661789006194e-06, 'epochs': 255, 'loss': 'mae', 'optimizer': 'adam', 'graph_mode': 'off', 'use_snp_selection': False}. Best is trial 45 with value: 0.09782401419539313.
[I 2025-12-05 16:33:33,150] Trial 69 finished with value: 0.06946477199785757 and parameters: {'model_type': 'mlp', 'hidden_dims': '[512, 128]', 'dropout': 0.2286827991071942, 'batch_norm': False, 'lr': 0.00018575183260139707, 'weight_decay': 1.0503581974088555e-07, 'epochs': 269, 'loss': 'mse', 'optimizer': 'adam', 'graph_mode': 'off', 'use_snp_selection': False}. Best is trial 45 with value: 0.09782401419539313.
[I 2025-12-05 16:33:33,897] Trial 70 finished with value: 0.07063555695435324 and parameters: {'model_type': 'mlp', 'hidden_dims': '[256, 128]', 'dropout': 0.188989505767585, 'batch_norm': True, 'lr': 0.00014029651608989642, 'weight_decay': 7.863448436212267e-06, 'epochs': 73, 'loss': 'mse', 'optimizer': 'adam', 'graph_mode': 'off', 'use_snp_selection': False}. Best is trial 45 with value: 0.09782401419539313.
[I 2025-12-05 16:33:35,617] Trial 71 finished with value: 0.07155648001778042 and parameters: {'model_type': 'mlp', 'hidden_dims': '[512, 128]', 'dropout': 0.13922731158030133, 'batch_norm': True, 'lr': 0.00036477131475434873, 'weight_decay': 1.5557630548598996e-07, 'epochs': 309, 'loss': 'mse', 'optimizer': 'adam', 'graph_mode': 'off', 'use_snp_selection': False}. Best is trial 45 with value: 0.09782401419539313.
[I 2025-12-05 16:33:37,410] Trial 72 finished with value: 0.057610296298551265 and parameters: {'model_type': 'mlp', 'hidden_dims': '[512, 128]', 'dropout': 0.14778926174236748, 'batch_norm': True, 'lr': 0.00047939325677098316, 'weight_decay': 2.386128749278431e-07, 'epochs': 320, 'loss': 'mse', 'optimizer': 'adam', 'graph_mode': 'off', 'use_snp_selection': False}. Best is trial 45 with value: 0.09782401419539313.
[I 2025-12-05 16:33:39,166] Trial 73 finished with value: 0.05086511808812786 and parameters: {'model_type': 'mlp', 'hidden_dims': '[512, 128]', 'dropout': 0.12149478287457438, 'batch_norm': True, 'lr': 0.00027462924934051295, 'weight_decay': 1.526070274251635e-07, 'epochs': 304, 'loss': 'mse', 'optimizer': 'adam', 'graph_mode': 'off', 'use_snp_selection': False}. Best is trial 45 with value: 0.09782401419539313.
[I 2025-12-05 16:33:40,185] Trial 74 finished with value: 0.06812693734760156 and parameters: {'model_type': 'mlp', 'hidden_dims': '[128, 64]', 'dropout': 0.14965037246958057, 'batch_norm': True, 'lr': 0.00036656208747653217, 'weight_decay': 1.2962548059913639e-07, 'epochs': 292, 'loss': 'mse', 'optimizer': 'adam', 'graph_mode': 'off', 'use_snp_selection': False}. Best is trial 45 with value: 0.09782401419539313.
[I 2025-12-05 16:33:41,843] Trial 75 finished with value: 0.07915799382946895 and parameters: {'model_type': 'mlp', 'hidden_dims': '[512, 128]', 'dropout': 0.2034984852027587, 'batch_norm': True, 'lr': 0.0007065399531437029, 'weight_decay': 2.2109333159350721e-07, 'epochs': 279, 'loss': 'mse', 'optimizer': 'adam', 'graph_mode': 'off', 'use_snp_selection': False}. Best is trial 45 with value: 0.09782401419539313.
[I 2025-12-05 16:33:43,054] Trial 76 finished with value: 0.05119609169256515 and parameters: {'model_type': 'mlp', 'hidden_dims': '[256, 128, 64]', 'dropout': 0.16552614979346408, 'batch_norm': True, 'lr': 0.0005392583214756625, 'weight_decay': 3.839737129354456e-07, 'epochs': 312, 'loss': 'mae', 'optimizer': 'adam', 'graph_mode': 'off', 'use_snp_selection': False}. Best is trial 45 with value: 0.09782401419539313.
[I 2025-12-05 16:33:44,600] Trial 77 finished with value: 0.08258858578715816 and parameters: {'model_type': 'mlp', 'hidden_dims': '[512, 128]', 'dropout': 0.11841371707043571, 'batch_norm': True, 'lr': 0.00030793719563666197, 'weight_decay': 1.0091607723340307e-07, 'epochs': 241, 'loss': 'mse', 'optimizer': 'adam', 'graph_mode': 'off', 'use_snp_selection': False}. Best is trial 45 with value: 0.09782401419539313.
[I 2025-12-05 16:33:45,614] Trial 78 finished with value: 0.021451764519730736 and parameters: {'model_type': 'mlp', 'hidden_dims': '[512, 128]', 'dropout': 0.13197089862247474, 'batch_norm': True, 'lr': 0.00011882128553146886, 'weight_decay': 4.114828002164368e-06, 'epochs': 340, 'loss': 'mse', 'optimizer': 'adam', 'graph_mode': 'off', 'use_snp_selection': True, 'num_snps': 2246}. Best is trial 45 with value: 0.09782401419539313.
[I 2025-12-05 16:33:47,336] Trial 79 finished with value: 0.09722092334354841 and parameters: {'model_type': 'mlp', 'hidden_dims': '[512, 128]', 'dropout': 0.10046016689933515, 'batch_norm': True, 'lr': 0.0008339247548566724, 'weight_decay': 2.842442751319193e-07, 'epochs': 295, 'loss': 'mse', 'optimizer': 'adam', 'graph_mode': 'off', 'use_snp_selection': False}. Best is trial 45 with value: 0.09782401419539313.
[I 2025-12-05 16:33:49,056] Trial 80 finished with value: 0.08564790778854751 and parameters: {'model_type': 'mlp', 'hidden_dims': '[512, 64]', 'dropout': 0.10177553399267657, 'batch_norm': True, 'lr': 0.0008495112812271363, 'weight_decay': 2.731687304263114e-07, 'epochs': 299, 'loss': 'mae', 'optimizer': 'adam', 'graph_mode': 'off', 'use_snp_selection': False}. Best is trial 45 with value: 0.09782401419539313.
[I 2025-12-05 16:33:50,795] Trial 81 finished with value: 0.05935372604446706 and parameters: {'model_type': 'mlp', 'hidden_dims': '[512, 64]', 'dropout': 0.10119890566172608, 'batch_norm': True, 'lr': 0.0008152031543997674, 'weight_decay': 2.739604350257137e-07, 'epochs': 299, 'loss': 'mae', 'optimizer': 'adam', 'graph_mode': 'off', 'use_snp_selection': False}. Best is trial 45 with value: 0.09782401419539313.
[I 2025-12-05 16:33:52,494] Trial 82 finished with value: 0.06988268130460122 and parameters: {'model_type': 'mlp', 'hidden_dims': '[512, 64]', 'dropout': 0.11311784421250605, 'batch_norm': True, 'lr': 0.0009667865301032673, 'weight_decay': 6.265100265866452e-07, 'epochs': 290, 'loss': 'mae', 'optimizer': 'adam', 'graph_mode': 'off', 'use_snp_selection': False}. Best is trial 45 with value: 0.09782401419539313.
[I 2025-12-05 16:33:54,125] Trial 83 finished with value: 0.07634886970546759 and parameters: {'model_type': 'mlp', 'hidden_dims': '[512, 64]', 'dropout': 0.12570599747915392, 'batch_norm': True, 'lr': 0.0006281873678309336, 'weight_decay': 3.7504181858845076e-07, 'epochs': 270, 'loss': 'mae', 'optimizer': 'adam', 'graph_mode': 'off', 'use_snp_selection': False}. Best is trial 45 with value: 0.09782401419539313.
[I 2025-12-05 16:33:55,959] Trial 84 finished with value: 0.07700706448820224 and parameters: {'model_type': 'mlp', 'hidden_dims': '[512, 64]', 'dropout': 0.11278338804304604, 'batch_norm': True, 'lr': 0.0007677318419794081, 'weight_decay': 1.997416480142833e-07, 'epochs': 332, 'loss': 'mae', 'optimizer': 'adam', 'graph_mode': 'off', 'use_snp_selection': False}. Best is trial 45 with value: 0.09782401419539313.
[I 2025-12-05 16:33:57,136] Trial 85 finished with value: 0.06740644558522561 and parameters: {'model_type': 'mlp', 'hidden_dims': '[256, 128]', 'dropout': 0.16204174380249198, 'batch_norm': True, 'lr': 0.0005265513588561182, 'weight_decay': 1.8105355925340846e-06, 'epochs': 319, 'loss': 'mae', 'optimizer': 'adam', 'graph_mode': 'off', 'use_snp_selection': False}. Best is trial 45 with value: 0.09782401419539313.
[I 2025-12-05 16:33:58,686] Trial 86 finished with value: 0.0415636376261129 and parameters: {'model_type': 'mlp', 'hidden_dims': '[512, 128]', 'dropout': 0.13887525720418056, 'batch_norm': False, 'lr': 0.00041515115142934215, 'weight_decay': 5.33058956652268e-06, 'epochs': 261, 'loss': 'mae', 'optimizer': 'adam', 'graph_mode': 'off', 'use_snp_selection': False}. Best is trial 45 with value: 0.09782401419539313.
[I 2025-12-05 16:34:00,371] Trial 87 finished with value: 0.08235686061411518 and parameters: {'model_type': 'mlp', 'hidden_dims': '[512, 128]', 'dropout': 0.2709370506762824, 'batch_norm': True, 'lr': 0.00026792010375188056, 'weight_decay': 4.7525723718017086e-07, 'epochs': 299, 'loss': 'mse', 'optimizer': 'adam', 'graph_mode': 'off', 'use_snp_selection': False}. Best is trial 45 with value: 0.09782401419539313.
[I 2025-12-05 16:34:02,029] Trial 88 finished with value: 0.0863903703127277 and parameters: {'model_type': 'mlp', 'hidden_dims': '[512, 64]', 'dropout': 0.10520847976470359, 'batch_norm': True, 'lr': 0.0006373080689407568, 'weight_decay': 1.0150907248282837e-06, 'epochs': 278, 'loss': 'mse', 'optimizer': 'adam', 'graph_mode': 'off', 'use_snp_selection': False}. Best is trial 45 with value: 0.09782401419539313.
[I 2025-12-05 16:34:04,756] Trial 89 finished with value: 0.0904854746281723 and parameters: {'model_type': 'mlp', 'hidden_dims': '[512, 64]', 'dropout': 0.11220465387407522, 'batch_norm': True, 'lr': 0.0007684248439035211, 'weight_decay': 1.0306443592152247e-06, 'epochs': 279, 'loss': 'mse', 'optimizer': 'adam', 'graph_mode': 'off', 'use_snp_selection': True, 'num_snps': 45058}. Best is trial 45 with value: 0.09782401419539313.
[I 2025-12-05 16:34:07,470] Trial 90 finished with value: 0.09879922542512554 and parameters: {'model_type': 'mlp', 'hidden_dims': '[512, 64]', 'dropout': 0.1762196313537463, 'batch_norm': True, 'lr': 0.0007565521271150821, 'weight_decay': 9.976962532684839e-07, 'epochs': 281, 'loss': 'mse', 'optimizer': 'adam', 'graph_mode': 'off', 'use_snp_selection': True, 'num_snps': 46815}. Best is trial 90 with value: 0.09879922542512554.
[I 2025-12-05 16:34:10,096] Trial 91 finished with value: 0.06968799270316031 and parameters: {'model_type': 'mlp', 'hidden_dims': '[512, 64]', 'dropout': 0.11063656311814737, 'batch_norm': True, 'lr': 0.000992573256272348, 'weight_decay': 1.0877043843311473e-06, 'epochs': 282, 'loss': 'mse', 'optimizer': 'adam', 'graph_mode': 'off', 'use_snp_selection': True, 'num_snps': 47869}. Best is trial 90 with value: 0.09879922542512554.
[I 2025-12-05 16:34:12,291] Trial 92 finished with value: 0.07564976739099895 and parameters: {'model_type': 'mlp', 'hidden_dims': '[512, 64]', 'dropout': 0.12808449146306317, 'batch_norm': True, 'lr': 0.0006535923530733491, 'weight_decay': 7.686871586543675e-07, 'epochs': 279, 'loss': 'mse', 'optimizer': 'adam', 'graph_mode': 'off', 'use_snp_selection': True, 'num_snps': 38741}. Best is trial 90 with value: 0.09879922542512554.
[I 2025-12-05 16:34:14,981] Trial 93 finished with value: 0.0745168240028098 and parameters: {'model_type': 'mlp', 'hidden_dims': '[512, 64]', 'dropout': 0.1791977241233308, 'batch_norm': True, 'lr': 0.0008248452470681459, 'weight_decay': 2.415228596522608e-06, 'epochs': 267, 'loss': 'mse', 'optimizer': 'adam', 'graph_mode': 'off', 'use_snp_selection': True, 'num_snps': 51581}. Best is trial 90 with value: 0.09879922542512554.
[I 2025-12-05 16:34:17,364] Trial 94 finished with value: 0.08212265531402418 and parameters: {'model_type': 'mlp', 'hidden_dims': '[512, 64]', 'dropout': 0.15427903724053682, 'batch_norm': True, 'lr': 0.00075786689181782, 'weight_decay': 9.24594084197495e-07, 'epochs': 289, 'loss': 'mse', 'optimizer': 'adam', 'graph_mode': 'off', 'use_snp_selection': True, 'num_snps': 39591}. Best is trial 90 with value: 0.09879922542512554.
[I 2025-12-05 16:34:19,247] Trial 95 finished with value: 0.07867665933109745 and parameters: {'model_type': 'mlp', 'hidden_dims': '[512, 64]', 'dropout': 0.10011786635579928, 'batch_norm': True, 'lr': 0.0006045324726810604, 'weight_decay': 1.3347991057604932e-06, 'epochs': 276, 'loss': 'mse', 'optimizer': 'adam', 'graph_mode': 'off', 'use_snp_selection': True, 'num_snps': 29107}. Best is trial 90 with value: 0.09879922542512554.
[I 2025-12-05 16:34:22,161] Trial 96 finished with value: 0.08375112628088177 and parameters: {'model_type': 'mlp', 'hidden_dims': '[512, 64]', 'dropout': 0.14056970836466495, 'batch_norm': True, 'lr': 0.0004934130811925431, 'weight_decay': 6.018840761719044e-07, 'epochs': 256, 'loss': 'mse', 'optimizer': 'adam', 'graph_mode': 'off', 'use_snp_selection': True, 'num_snps': 55082}. Best is trial 90 with value: 0.09879922542512554.
[I 2025-12-05 16:34:24,921] Trial 97 finished with value: 0.06993140359463344 and parameters: {'model_type': 'mlp', 'hidden_dims': '[512, 64]', 'dropout': 0.11466167065806315, 'batch_norm': True, 'lr': 0.0008222016968002903, 'weight_decay': 1.6181426631495294e-06, 'epochs': 293, 'loss': 'mse', 'optimizer': 'adam', 'graph_mode': 'off', 'use_snp_selection': True, 'num_snps': 50863}. Best is trial 90 with value: 0.09879922542512554.
