[I 2025-12-05 16:25:38,811] Trial 34 finished with value: 0.002206165617600144 and parameters: {'model_type': 'mlp', 'hidden_dims': '[256, 128, 64]', 'dropout': 0.545514460990332, 'batch_norm': False, 'lr': 3.7265111237023797e-06, 'weight_decay': 6.270141987717733e-06, 'epochs': 104, 'loss': 'mse', 'optimizer': 'adam', 'graph_mode': 'off', 'use_snp_selection': True, 'num_snps': 58283}. Best is trial 32 with value: 0.06902366905572252.
[I 2025-12-05 16:25:39,772] Trial 35 finished with value: 0.005518156190622445 and parameters: {'model_type': 'mlp', 'hidden_dims': '[256, 128]', 'dropout': 0.3936230057854052, 'batch_norm': True, 'lr': 1.2327410953042535e-05, 'weight_decay': 2.522103295234801e-07, 'epochs': 158, 'loss': 'mse', 'optimizer': 'adam', 'graph_mode': 'off', 'use_snp_selection': False}. Best is trial 32 with value: 0.06902366905572252.
[I 2025-12-05 16:25:41,719] Trial 36 finished with value: 0.028221105401017115 and parameters: {'model_type': 'mlp', 'hidden_dims': '[512, 64]', 'dropout': 0.4455372768431314, 'batch_norm': True, 'lr': 4.1155507064650564e-05, 'weight_decay': 1.462817974146231e-05, 'epochs': 338, 'loss': 'mse', 'optimizer': 'adam', 'graph_mode': 'off', 'use_snp_selection': False}. Best is trial 32 with value: 0.06902366905572252.
[I 2025-12-05 16:25:43,056] Trial 37 finished with value: 0.0594470230582925 and parameters: {'model_type': 'mlp', 'hidden_dims': '[512, 128]', 'dropout': 0.3932656934855805, 'batch_norm': False, 'lr': 8.482457308156251e-05, 'weight_decay': 0.00027176669497101704, 'epochs': 136, 'loss': 'mse', 'optimizer': 'adam', 'graph_mode': 'off', 'use_snp_selection': True, 'num_snps': 22282}. Best is trial 32 with value: 0.06902366905572252.
[I 2025-12-05 16:25:44,109] Trial 38 finished with value: 0.035281213956832334 and parameters: {'model_type': 'mlp', 'hidden_dims': '[256, 128]', 'dropout': 0.5867152014277068, 'batch_norm': True, 'lr': 2.4751275809333828e-06, 'weight_decay': 3.1839845617964235e-07, 'epochs': 205, 'loss': 'mae', 'optimizer': 'adam', 'graph_mode': 'off', 'use_snp_selection': False}. Best is trial 32 with value: 0.06902366905572252.
[I 2025-12-05 16:25:45,242] Trial 39 finished with value: 0.01326577113957973 and parameters: {'model_type': 'mlp', 'hidden_dims': '[512, 64]', 'dropout': 0.3188869140621371, 'batch_norm': True, 'lr': 2.115805969570646e-05, 'weight_decay': 1.8163127184750238e-06, 'epochs': 104, 'loss': 'mse', 'optimizer': 'adam', 'graph_mode': 'off', 'use_snp_selection': False}. Best is trial 32 with value: 0.06902366905572252.
[I 2025-12-05 16:25:46,196] Trial 40 finished with value: 0.023067155830398443 and parameters: {'model_type': 'mlp', 'hidden_dims': '[512, 256]', 'dropout': 0.3716202572889892, 'batch_norm': False, 'lr': 5.7489274108267205e-06, 'weight_decay': 7.444557577942366e-07, 'epochs': 56, 'loss': 'mae', 'optimizer': 'adam', 'graph_mode': 'off', 'use_snp_selection': False}. Best is trial 32 with value: 0.06902366905572252.
[I 2025-12-05 16:25:47,520] Trial 41 finished with value: 0.05914487605613436 and parameters: {'model_type': 'mlp', 'hidden_dims': '[512, 64]', 'dropout': 0.17046788189451503, 'batch_norm': True, 'lr': 5.764031206298402e-05, 'weight_decay': 5.625467810897815e-07, 'epochs': 162, 'loss': 'mse', 'optimizer': 'adam', 'graph_mode': 'off', 'use_snp_selection': False}. Best is trial 32 with value: 0.06902366905572252.
[I 2025-12-05 16:25:48,994] Trial 42 finished with value: 0.05143189217867661 and parameters: {'model_type': 'mlp', 'hidden_dims': '[512, 64]', 'dropout': 0.2606391892582905, 'batch_norm': True, 'lr': 5.093068511327379e-05, 'weight_decay': 1.0568979349388601e-06, 'epochs': 207, 'loss': 'mse', 'optimizer': 'adam', 'graph_mode': 'off', 'use_snp_selection': False}. Best is trial 32 with value: 0.06902366905572252.
[I 2025-12-05 16:25:50,203] Trial 43 finished with value: 0.04523284502118493 and parameters: {'model_type': 'mlp', 'hidden_dims': '[512, 64]', 'dropout': 0.4327717315013123, 'batch_norm': True, 'lr': 0.00016390049499530194, 'weight_decay': 1.8732729667799567e-07, 'epochs': 131, 'loss': 'mse', 'optimizer': 'adam', 'graph_mode': 'off', 'use_snp_selection': False}. Best is trial 32 with value: 0.06902366905572252.
[I 2025-12-05 16:25:51,535] Trial 44 finished with value: 0.03616925303872398 and parameters: {'model_type': 'mlp', 'hidden_dims': '[512, 64]', 'dropout': 0.19023029711473888, 'batch_norm': True, 'lr': 2.5567031955467787e-05, 'weight_decay': 2.803175846207319e-06, 'epochs': 176, 'loss': 'mse', 'optimizer': 'adam', 'graph_mode': 'off', 'use_snp_selection': False}. Best is trial 32 with value: 0.06902366905572252.
[I 2025-12-05 16:25:52,612] Trial 45 finished with value: 0.049486708889388276 and parameters: {'model_type': 'mlp', 'hidden_dims': '[256, 128]', 'dropout': 0.22958851189145052, 'batch_norm': True, 'lr': 7.845612851742704e-05, 'weight_decay': 4.128030863640301e-07, 'epochs': 249, 'loss': 'mse', 'optimizer': 'adam', 'graph_mode': 'off', 'use_snp_selection': False}. Best is trial 32 with value: 0.06902366905572252.
[I 2025-12-05 16:25:53,687] Trial 46 finished with value: -0.004885075917274215 and parameters: {'model_type': 'mlp', 'hidden_dims': '[512, 128]', 'dropout': 0.1141051681941766, 'batch_norm': True, 'lr': 1.6719728988998588e-05, 'weight_decay': 1.5813404955787173e-06, 'epochs': 88, 'loss': 'mse', 'optimizer': 'adam', 'graph_mode': 'off', 'use_snp_selection': False}. Best is trial 32 with value: 0.06902366905572252.
[I 2025-12-05 16:25:55,961] Trial 47 finished with value: 0.04239687821462749 and parameters: {'model_type': 'mlp', 'hidden_dims': '[512, 64]', 'dropout': 0.48616540151192206, 'batch_norm': True, 'lr': 0.0003368406379275874, 'weight_decay': 1.0186461232355326e-07, 'epochs': 114, 'loss': 'mse', 'optimizer': 'adam', 'graph_mode': 'off', 'use_snp_selection': True, 'num_snps': 45758}. Best is trial 32 with value: 0.06902366905572252.
[I 2025-12-05 16:25:57,050] Trial 48 finished with value: -0.029442554786679356 and parameters: {'model_type': 'mlp', 'hidden_dims': '[256, 128]', 'dropout': 0.2854753552972488, 'batch_norm': True, 'lr': 1.134910716000774e-06, 'weight_decay': 4.6363546553422125e-07, 'epochs': 225, 'loss': 'mae', 'optimizer': 'adam', 'graph_mode': 'off', 'use_snp_selection': False}. Best is trial 32 with value: 0.06902366905572252.
[I 2025-12-05 16:25:57,847] Trial 49 finished with value: 0.025867747933206287 and parameters: {'model_type': 'mlp', 'hidden_dims': '[128, 64]', 'dropout': 0.4030070997072191, 'batch_norm': True, 'lr': 0.00014533352300705443, 'weight_decay': 2.376799799345691e-05, 'epochs': 146, 'loss': 'mae', 'optimizer': 'adam', 'graph_mode': 'off', 'use_snp_selection': False}. Best is trial 32 with value: 0.06902366905572252.
[I 2025-12-05 16:25:58,612] Trial 50 finished with value: -0.016551712160207854 and parameters: {'model_type': 'mlp', 'hidden_dims': '[256, 128, 64]', 'dropout': 0.4579193794196349, 'batch_norm': False, 'lr': 3.985875079876693e-05, 'weight_decay': 1.1172729297024309e-05, 'epochs': 60, 'loss': 'mse', 'optimizer': 'adam', 'graph_mode': 'off', 'use_snp_selection': False}. Best is trial 32 with value: 0.06902366905572252.
[I 2025-12-05 16:25:59,459] Trial 51 finished with value: 0.03713478636432684 and parameters: {'model_type': 'mlp', 'hidden_dims': '[512, 128]', 'dropout': 0.41568722446694883, 'batch_norm': False, 'lr': 8.807011525358451e-05, 'weight_decay': 2.6857457754387325e-07, 'epochs': 215, 'loss': 'mse', 'optimizer': 'adam', 'graph_mode': 'off', 'use_snp_selection': True, 'num_snps': 3293}. Best is trial 32 with value: 0.06902366905572252.
[I 2025-12-05 16:26:00,284] Trial 52 finished with value: 0.05611249426814523 and parameters: {'model_type': 'mlp', 'hidden_dims': '[512, 128]', 'dropout': 0.3638024256905747, 'batch_norm': False, 'lr': 0.00024951458499013077, 'weight_decay': 2.3483984040918497e-07, 'epochs': 197, 'loss': 'mse', 'optimizer': 'adam', 'graph_mode': 'off', 'use_snp_selection': True, 'num_snps': 2241}. Best is trial 32 with value: 0.06902366905572252.
[I 2025-12-05 16:26:01,753] Trial 53 finished with value: 0.044988833039258325 and parameters: {'model_type': 'mlp', 'hidden_dims': '[512, 128]', 'dropout': 0.42858358176414846, 'batch_norm': False, 'lr': 0.00011321352905806536, 'weight_decay': 0.0008356601475880457, 'epochs': 290, 'loss': 'mse', 'optimizer': 'adam', 'graph_mode': 'off', 'use_snp_selection': True, 'num_snps': 18902}. Best is trial 32 with value: 0.06902366905572252.
[I 2025-12-05 16:26:02,872] Trial 54 finished with value: 0.05492177693103435 and parameters: {'model_type': 'mlp', 'hidden_dims': '[512, 128]', 'dropout': 0.5249814176223907, 'batch_norm': False, 'lr': 7.056842789178818e-05, 'weight_decay': 7.697681777190443e-07, 'epochs': 257, 'loss': 'mse', 'optimizer': 'adam', 'graph_mode': 'off', 'use_snp_selection': True, 'num_snps': 10336}. Best is trial 32 with value: 0.06902366905572252.
[I 2025-12-05 16:26:04,367] Trial 55 finished with value: 0.058356690278072144 and parameters: {'model_type': 'mlp', 'hidden_dims': '[256, 128]', 'dropout': 0.4555246823716664, 'batch_norm': False, 'lr': 5.0478111114630463e-05, 'weight_decay': 0.00015839119957744522, 'epochs': 188, 'loss': 'mse', 'optimizer': 'adam', 'graph_mode': 'off', 'use_snp_selection': True, 'num_snps': 27364}. Best is trial 32 with value: 0.06902366905572252.
[I 2025-12-05 16:26:05,461] Trial 56 finished with value: 0.029432150991351547 and parameters: {'model_type': 'mlp', 'hidden_dims': '[256, 128]', 'dropout': 0.34565883153242727, 'batch_norm': True, 'lr': 3.2967857497049866e-05, 'weight_decay': 1.764017794818347e-07, 'epochs': 230, 'loss': 'mae', 'optimizer': 'adam', 'graph_mode': 'off', 'use_snp_selection': False}. Best is trial 32 with value: 0.06902366905572252.
[I 2025-12-05 16:26:06,746] Trial 57 finished with value: 0.022396740543611165 and parameters: {'model_type': 'mlp', 'hidden_dims': '[512, 256]', 'dropout': 0.48118808841579763, 'batch_norm': True, 'lr': 7.837491459401929e-06, 'weight_decay': 4.5233139510374836e-05, 'epochs': 322, 'loss': 'mae', 'optimizer': 'adam', 'graph_mode': 'off', 'use_snp_selection': True, 'num_snps': 11522}. Best is trial 32 with value: 0.06902366905572252.
[I 2025-12-05 16:26:07,563] Trial 58 finished with value: 0.03331582388025381 and parameters: {'model_type': 'mlp', 'hidden_dims': '[256, 128]', 'dropout': 0.3831104161618209, 'batch_norm': True, 'lr': 1.4220232303163813e-05, 'weight_decay': 3.5095779917516237e-06, 'epochs': 111, 'loss': 'mse', 'optimizer': 'adam', 'graph_mode': 'off', 'use_snp_selection': False}. Best is trial 32 with value: 0.06902366905572252.
[I 2025-12-05 16:26:08,845] Trial 59 finished with value: 0.025902493295333933 and parameters: {'model_type': 'mlp', 'hidden_dims': '[512, 64]', 'dropout': 0.5573642658781512, 'batch_norm': False, 'lr': 2.3463946215901942e-05, 'weight_decay': 7.68221272496808e-06, 'epochs': 163, 'loss': 'mae', 'optimizer': 'adam', 'graph_mode': 'off', 'use_snp_selection': False}. Best is trial 32 with value: 0.06902366905572252.
[I 2025-12-05 16:26:09,662] Trial 60 finished with value: 0.007186162780913752 and parameters: {'model_type': 'mlp', 'hidden_dims': '[256, 128]', 'dropout': 0.29275957950537984, 'batch_norm': True, 'lr': 2.9541879852260108e-05, 'weight_decay': 3.6582013646014773e-07, 'epochs': 85, 'loss': 'mse', 'optimizer': 'adam', 'graph_mode': 'off', 'use_snp_selection': False}. Best is trial 32 with value: 0.06902366905572252.
[I 2025-12-05 16:26:11,137] Trial 61 finished with value: 0.032829979666489276 and parameters: {'model_type': 'mlp', 'hidden_dims': '[512, 128]', 'dropout': 0.3872359665104124, 'batch_norm': False, 'lr': 8.898520261407662e-05, 'weight_decay': 0.00037388044989791, 'epochs': 138, 'loss': 'mse', 'optimizer': 'adam', 'graph_mode': 'off', 'use_snp_selection': True, 'num_snps': 23824}. Best is trial 32 with value: 0.06902366905572252.
[I 2025-12-05 16:26:12,338] Trial 62 finished with value: 0.03425027017694736 and parameters: {'model_type': 'mlp', 'hidden_dims': '[512, 128]', 'dropout': 0.4134225673600069, 'batch_norm': False, 'lr': 0.00012577842036708844, 'weight_decay': 0.00030420138010379673, 'epochs': 129, 'loss': 'mse', 'optimizer': 'adam', 'graph_mode': 'off', 'use_snp_selection': True, 'num_snps': 17037}. Best is trial 32 with value: 0.06902366905572252.
[I 2025-12-05 16:26:14,213] Trial 63 finished with value: 0.03131573010671353 and parameters: {'model_type': 'mlp', 'hidden_dims': '[512, 128]', 'dropout': 0.4030814128600512, 'batch_norm': False, 'lr': 0.0002140376965674246, 'weight_decay': 0.0002187510237396008, 'epochs': 150, 'loss': 'mse', 'optimizer': 'adam', 'graph_mode': 'off', 'use_snp_selection': True, 'num_snps': 35889}. Best is trial 32 with value: 0.06902366905572252.
[I 2025-12-05 16:26:15,142] Trial 64 finished with value: 0.05650839359046421 and parameters: {'model_type': 'mlp', 'hidden_dims': '[512, 128]', 'dropout': 0.3292675897594625, 'batch_norm': False, 'lr': 4.26357075353588e-05, 'weight_decay': 0.0006150443156211765, 'epochs': 172, 'loss': 'mse', 'optimizer': 'adam', 'graph_mode': 'off', 'use_snp_selection': True, 'num_snps': 8729}. Best is trial 32 with value: 0.06902366905572252.
[I 2025-12-05 16:26:16,534] Trial 65 finished with value: 0.04899249301509275 and parameters: {'model_type': 'mlp', 'hidden_dims': '[512, 128]', 'dropout': 0.44483085588315624, 'batch_norm': False, 'lr': 6.655309931720985e-05, 'weight_decay': 7.86621714296323e-05, 'epochs': 100, 'loss': 'mse', 'optimizer': 'adam', 'graph_mode': 'off', 'use_snp_selection': True, 'num_snps': 23053}. Best is trial 32 with value: 0.06902366905572252.
[I 2025-12-05 16:26:18,694] Trial 66 finished with value: 0.02865049314590766 and parameters: {'model_type': 'mlp', 'hidden_dims': '[128, 64]', 'dropout': 0.4951870019556778, 'batch_norm': True, 'lr': 9.573713324578181e-05, 'weight_decay': 8.800040183425836e-07, 'epochs': 239, 'loss': 'mae', 'optimizer': 'adam', 'graph_mode': 'off', 'use_snp_selection': True, 'num_snps': 42001}. Best is trial 32 with value: 0.06902366905572252.
[I 2025-12-05 16:26:19,764] Trial 67 finished with value: 0.02059660700954962 and parameters: {'model_type': 'mlp', 'hidden_dims': '[256, 128]', 'dropout': 0.31035317197919154, 'batch_norm': True, 'lr': 1.7206818448966014e-05, 'weight_decay': 1.3071377412960198e-06, 'epochs': 216, 'loss': 'mse', 'optimizer': 'adam', 'graph_mode': 'off', 'use_snp_selection': False}. Best is trial 32 with value: 0.06902366905572252.
[I 2025-12-05 16:26:20,940] Trial 68 finished with value: 0.027065464846039222 and parameters: {'model_type': 'mlp', 'hidden_dims': '[256, 128, 64]', 'dropout': 0.3527563098192926, 'batch_norm': False, 'lr': 1.1266386635029277e-05, 'weight_decay': 5.109332555208991e-07, 'epochs': 277, 'loss': 'mae', 'optimizer': 'adam', 'graph_mode': 'off', 'use_snp_selection': False}. Best is trial 32 with value: 0.06902366905572252.
[I 2025-12-05 16:26:22,168] Trial 69 finished with value: 0.05638240576483495 and parameters: {'model_type': 'mlp', 'hidden_dims': '[512, 64]', 'dropout': 0.4677983436023713, 'batch_norm': True, 'lr': 5.203442252688713e-05, 'weight_decay': 2.8441798249854046e-05, 'epochs': 131, 'loss': 'mse', 'optimizer': 'adam', 'graph_mode': 'off', 'use_snp_selection': False}. Best is trial 32 with value: 0.06902366905572252.
[I 2025-12-05 16:26:24,190] Trial 70 finished with value: 0.016139102062173734 and parameters: {'model_type': 'mlp', 'hidden_dims': '[256, 128]', 'dropout': 0.2362694675403033, 'batch_norm': True, 'lr': 8.350063288159081e-06, 'weight_decay': 6.001270781004371e-07, 'epochs': 95, 'loss': 'mse', 'optimizer': 'adam', 'graph_mode': 'off', 'use_snp_selection': True, 'num_snps': 49907}. Best is trial 32 with value: 0.06902366905572252.
[I 2025-12-05 16:26:25,529] Trial 71 finished with value: 0.060406507023102046 and parameters: {'model_type': 'mlp', 'hidden_dims': '[512, 64]', 'dropout': 0.15866883792404804, 'batch_norm': True, 'lr': 5.6897271672969597e-05, 'weight_decay': 3.145865826372483e-07, 'epochs': 160, 'loss': 'mse', 'optimizer': 'adam', 'graph_mode': 'off', 'use_snp_selection': False}. Best is trial 32 with value: 0.06902366905572252.
[I 2025-12-05 16:26:26,969] Trial 72 finished with value: 0.05038819854660226 and parameters: {'model_type': 'mlp', 'hidden_dims': '[512, 64]', 'dropout': 0.11794410352350593, 'batch_norm': True, 'lr': 3.274421203727536e-05, 'weight_decay': 1.3352774157383694e-07, 'epochs': 187, 'loss': 'mse', 'optimizer': 'adam', 'graph_mode': 'off', 'use_snp_selection': False}. Best is trial 32 with value: 0.06902366905572252.
[I 2025-12-05 16:26:28,285] Trial 73 finished with value: 0.04162826571261443 and parameters: {'model_type': 'mlp', 'hidden_dims': '[512, 64]', 'dropout': 0.1804116732199043, 'batch_norm': True, 'lr': 6.853968763381003e-05, 'weight_decay': 3.3413242627214613e-07, 'epochs': 153, 'loss': 'mse', 'optimizer': 'adam', 'graph_mode': 'off', 'use_snp_selection': False}. Best is trial 32 with value: 0.06902366905572252.
[I 2025-12-05 16:26:29,481] Trial 74 finished with value: 0.06493978428031331 and parameters: {'model_type': 'mlp', 'hidden_dims': '[512, 64]', 'dropout': 0.15115957097674576, 'batch_norm': True, 'lr': 2.0864815433128998e-05, 'weight_decay': 2.5180102014200477e-07, 'epochs': 123, 'loss': 'mse', 'optimizer': 'adam', 'graph_mode': 'off', 'use_snp_selection': False}. Best is trial 32 with value: 0.06902366905572252.
[I 2025-12-05 16:26:30,632] Trial 75 finished with value: 0.03282400640558975 and parameters: {'model_type': 'mlp', 'hidden_dims': '[512, 64]', 'dropout': 0.15325162460037958, 'batch_norm': True, 'lr': 2.1898334070798683e-05, 'weight_decay': 1.996923081161444e-07, 'epochs': 110, 'loss': 'mse', 'optimizer': 'adam', 'graph_mode': 'off', 'use_snp_selection': False}. Best is trial 32 with value: 0.06902366905572252.
[I 2025-12-05 16:26:31,850] Trial 76 finished with value: 0.013273702517462904 and parameters: {'model_type': 'mlp', 'hidden_dims': '[512, 64]', 'dropout': 0.12878360862588575, 'batch_norm': True, 'lr': 1.4292632175420071e-05, 'weight_decay': 1.4584060595124964e-07, 'epochs': 123, 'loss': 'mae', 'optimizer': 'adam', 'graph_mode': 'off', 'use_snp_selection': False}. Best is trial 32 with value: 0.06902366905572252.
[I 2025-12-05 16:26:33,214] Trial 77 finished with value: 0.011679444039057423 and parameters: {'model_type': 'mlp', 'hidden_dims': '[512, 64]', 'dropout': 0.1533750040604659, 'batch_norm': True, 'lr': 1.8829903472530576e-05, 'weight_decay': 2.2752814504354895e-07, 'epochs': 165, 'loss': 'mse', 'optimizer': 'adam', 'graph_mode': 'off', 'use_snp_selection': False}. Best is trial 32 with value: 0.06902366905572252.
[I 2025-12-05 16:26:34,409] Trial 78 finished with value: 0.05999462209213613 and parameters: {'model_type': 'mlp', 'hidden_dims': '[512, 64]', 'dropout': 0.20993093200797688, 'batch_norm': True, 'lr': 2.8484304627253243e-05, 'weight_decay': 3.026576170557836e-07, 'epochs': 118, 'loss': 'mse', 'optimizer': 'adam', 'graph_mode': 'off', 'use_snp_selection': False}. Best is trial 32 with value: 0.06902366905572252.
[I 2025-12-05 16:26:35,428] Trial 79 finished with value: 0.06228321910562922 and parameters: {'model_type': 'mlp', 'hidden_dims': '[512, 256]', 'dropout': 0.1380477081847478, 'batch_norm': True, 'lr': 5.708434239449363e-05, 'weight_decay': 4.5564888916720724e-07, 'epochs': 69, 'loss': 'mae', 'optimizer': 'adam', 'graph_mode': 'off', 'use_snp_selection': False}. Best is trial 32 with value: 0.06902366905572252.
[I 2025-12-05 16:26:36,421] Trial 80 finished with value: 0.06960886845601078 and parameters: {'model_type': 'mlp', 'hidden_dims': '[512, 256]', 'dropout': 0.12593426928418996, 'batch_norm': True, 'lr': 3.977528267682058e-05, 'weight_decay': 4.3065117167361684e-07, 'epochs': 64, 'loss': 'mae', 'optimizer': 'adam', 'graph_mode': 'off', 'use_snp_selection': False}. Best is trial 80 with value: 0.06960886845601078.
[I 2025-12-05 16:26:37,435] Trial 81 finished with value: 0.06444863371937917 and parameters: {'model_type': 'mlp', 'hidden_dims': '[512, 256]', 'dropout': 0.10084497657228417, 'batch_norm': True, 'lr': 4.69652917770656e-05, 'weight_decay': 6.317141770367261e-07, 'epochs': 70, 'loss': 'mae', 'optimizer': 'adam', 'graph_mode': 'off', 'use_snp_selection': False}. Best is trial 80 with value: 0.06960886845601078.
[I 2025-12-05 16:26:38,423] Trial 82 finished with value: 0.037783502402339485 and parameters: {'model_type': 'mlp', 'hidden_dims': '[512, 256]', 'dropout': 0.10507407428860385, 'batch_norm': True, 'lr': 4.518629426609305e-05, 'weight_decay': 9.887679057237974e-07, 'epochs': 64, 'loss': 'mae', 'optimizer': 'adam', 'graph_mode': 'off', 'use_snp_selection': False}. Best is trial 80 with value: 0.06960886845601078.
[I 2025-12-05 16:26:39,315] Trial 83 finished with value: 0.030733739656039365 and parameters: {'model_type': 'mlp', 'hidden_dims': '[512, 256]', 'dropout': 0.14274038870356195, 'batch_norm': True, 'lr': 3.5433098941697105e-05, 'weight_decay': 5.917226824400114e-07, 'epochs': 45, 'loss': 'mae', 'optimizer': 'adam', 'graph_mode': 'off', 'use_snp_selection': False}. Best is trial 80 with value: 0.06960886845601078.
[I 2025-12-05 16:26:40,297] Trial 84 finished with value: 0.05266690108857026 and parameters: {'model_type': 'mlp', 'hidden_dims': '[512, 256]', 'dropout': 0.12736670515020249, 'batch_norm': True, 'lr': 2.5190842152179617e-05, 'weight_decay': 4.297263415728481e-07, 'epochs': 72, 'loss': 'mae', 'optimizer': 'adam', 'graph_mode': 'off', 'use_snp_selection': False}. Best is trial 80 with value: 0.06960886845601078.
[I 2025-12-05 16:26:41,386] Trial 85 finished with value: 0.07060291519117684 and parameters: {'model_type': 'mlp', 'hidden_dims': '[512, 256]', 'dropout': 0.16512291686060687, 'batch_norm': True, 'lr': 3.1714370947940504e-05, 'weight_decay': 5.06270726585624e-06, 'epochs': 87, 'loss': 'mae', 'optimizer': 'adam', 'graph_mode': 'off', 'use_snp_selection': False}. Best is trial 85 with value: 0.07060291519117684.
