[I 2025-12-06 06:19:35,280] Trial 19 finished with value: 0.2021562138088143 and parameters: {'model_type': 'mlp', 'hidden_dims': '[512, 64]', 'dropout': 0.3255732506546632, 'batch_norm': False, 'lr': 0.00013008907717271205, 'weight_decay': 6.12206267817511e-06, 'epochs': 320, 'loss': 'mae', 'optimizer': 'adam', 'graph_mode': 'off', 'use_snp_selection': False}. Best is trial 3 with value: 0.2077240439383361.
[I 2025-12-06 06:20:15,519] Trial 20 finished with value: 0.2072147179531008 and parameters: {'model_type': 'mlp', 'hidden_dims': '[512, 64]', 'dropout': 0.22720693584988713, 'batch_norm': False, 'lr': 2.3361432915417936e-05, 'weight_decay': 0.00013085730167205134, 'epochs': 126, 'loss': 'mae', 'optimizer': 'adam', 'graph_mode': 'off', 'use_snp_selection': False}. Best is trial 3 with value: 0.2077240439383361.
[I 2025-12-06 06:20:46,055] Trial 21 finished with value: 0.20458884706139108 and parameters: {'model_type': 'mlp', 'hidden_dims': '[512, 64]', 'dropout': 0.21684413910827155, 'batch_norm': False, 'lr': 1.6837211771752744e-05, 'weight_decay': 0.00013936186155550533, 'epochs': 88, 'loss': 'mae', 'optimizer': 'adam', 'graph_mode': 'off', 'use_snp_selection': False}. Best is trial 3 with value: 0.2077240439383361.
[I 2025-12-06 06:21:26,659] Trial 22 finished with value: 0.20699932628180195 and parameters: {'model_type': 'mlp', 'hidden_dims': '[512, 64]', 'dropout': 0.298388823040876, 'batch_norm': False, 'lr': 3.1111762071745376e-05, 'weight_decay': 2.7995357335812167e-05, 'epochs': 128, 'loss': 'mae', 'optimizer': 'adam', 'graph_mode': 'off', 'use_snp_selection': False}. Best is trial 3 with value: 0.2077240439383361.
[I 2025-12-06 06:22:08,120] Trial 23 finished with value: 0.19665571784179173 and parameters: {'model_type': 'mlp', 'hidden_dims': '[512, 64]', 'dropout': 0.23070381072043317, 'batch_norm': False, 'lr': 3.1703276651083563e-05, 'weight_decay': 2.573380789001785e-05, 'epochs': 131, 'loss': 'mae', 'optimizer': 'adam', 'graph_mode': 'off', 'use_snp_selection': False}. Best is trial 3 with value: 0.2077240439383361.
[I 2025-12-06 06:22:42,284] Trial 24 finished with value: 0.18648791942132184 and parameters: {'model_type': 'mlp', 'hidden_dims': '[512, 64]', 'dropout': 0.19259797128625922, 'batch_norm': False, 'lr': 3.858145390220422e-06, 'weight_decay': 0.0004985016474868397, 'epochs': 101, 'loss': 'mae', 'optimizer': 'adam', 'graph_mode': 'off', 'use_snp_selection': False}. Best is trial 3 with value: 0.2077240439383361.
[I 2025-12-06 06:23:07,412] Trial 25 finished with value: 0.19695394312882208 and parameters: {'model_type': 'mlp', 'hidden_dims': '[512, 64]', 'dropout': 0.28836112359597865, 'batch_norm': False, 'lr': 1.045391521875948e-05, 'weight_decay': 0.00010551842609068181, 'epochs': 67, 'loss': 'mae', 'optimizer': 'adam', 'graph_mode': 'off', 'use_snp_selection': False}. Best is trial 3 with value: 0.2077240439383361.
[I 2025-12-06 06:23:39,679] Trial 26 finished with value: 0.18837360354460714 and parameters: {'model_type': 'mlp', 'hidden_dims': '[512, 64]', 'dropout': 0.36524706842044125, 'batch_norm': False, 'lr': 3.0047897332554936e-05, 'weight_decay': 9.293583900648297e-06, 'epochs': 126, 'loss': 'mse', 'optimizer': 'adam', 'graph_mode': 'off', 'use_snp_selection': True, 'num_snps': 3842}. Best is trial 3 with value: 0.2077240439383361.
[I 2025-12-06 06:24:32,545] Trial 27 finished with value: 0.20450270627006756 and parameters: {'model_type': 'mlp', 'hidden_dims': '[512, 64]', 'dropout': 0.5260554932000863, 'batch_norm': False, 'lr': 5.760577887964887e-06, 'weight_decay': 3.387894027505382e-05, 'epochs': 174, 'loss': 'mae', 'optimizer': 'adam', 'graph_mode': 'off', 'use_snp_selection': False}. Best is trial 3 with value: 0.2077240439383361.
[I 2025-12-06 06:25:23,310] Trial 28 finished with value: 0.20576068653767043 and parameters: {'model_type': 'mlp', 'hidden_dims': '[512, 64]', 'dropout': 0.1602895116201787, 'batch_norm': False, 'lr': 2.7237758680766984e-05, 'weight_decay': 1.2889190633724646e-05, 'epochs': 167, 'loss': 'mae', 'optimizer': 'adam', 'graph_mode': 'off', 'use_snp_selection': False}. Best is trial 3 with value: 0.2077240439383361.
[I 2025-12-06 06:25:59,937] Trial 29 finished with value: 0.09862395983905976 and parameters: {'model_type': 'mlp', 'hidden_dims': '[128, 64]', 'dropout': 0.43782481337027646, 'batch_norm': False, 'lr': 2.4901607479996623e-06, 'weight_decay': 0.00012363202694194868, 'epochs': 78, 'loss': 'mae', 'optimizer': 'adam', 'graph_mode': 'off', 'use_snp_selection': True, 'num_snps': 19468}. Best is trial 3 with value: 0.2077240439383361.
[I 2025-12-06 06:26:20,982] Trial 30 finished with value: 0.19967754585200587 and parameters: {'model_type': 'mlp', 'hidden_dims': '[256, 128]', 'dropout': 0.24165460374989434, 'batch_norm': False, 'lr': 7.695207733665496e-06, 'weight_decay': 3.952266574146992e-05, 'epochs': 108, 'loss': 'mae', 'optimizer': 'adam', 'graph_mode': 'off', 'use_snp_selection': False}. Best is trial 3 with value: 0.2077240439383361.
[I 2025-12-06 06:27:24,801] Trial 31 finished with value: 0.20734573584979615 and parameters: {'model_type': 'mlp', 'hidden_dims': '[512, 256]', 'dropout': 0.32198389089083285, 'batch_norm': False, 'lr': 0.0001023962333731491, 'weight_decay': 6.734212893525889e-05, 'epochs': 219, 'loss': 'mae', 'optimizer': 'adam', 'graph_mode': 'off', 'use_snp_selection': False}. Best is trial 3 with value: 0.2077240439383361.
[I 2025-12-06 06:27:47,130] Trial 32 finished with value: 0.19619886979346587 and parameters: {'model_type': 'mlp', 'hidden_dims': '[256, 128, 64]', 'dropout': 0.2979864990462509, 'batch_norm': False, 'lr': 7.951307608184919e-05, 'weight_decay': 7.605662747995395e-05, 'epochs': 118, 'loss': 'mae', 'optimizer': 'adam', 'graph_mode': 'off', 'use_snp_selection': False}. Best is trial 3 with value: 0.2077240439383361.
[I 2025-12-06 06:28:03,386] Trial 33 finished with value: 0.20415199655726593 and parameters: {'model_type': 'mlp', 'hidden_dims': '[128, 64]', 'dropout': 0.35545482716486976, 'batch_norm': False, 'lr': 0.00010526266136748267, 'weight_decay': 0.0002690423577500251, 'epochs': 154, 'loss': 'mae', 'optimizer': 'adam', 'graph_mode': 'off', 'use_snp_selection': False}. Best is trial 3 with value: 0.2077240439383361.
[I 2025-12-06 06:28:21,958] Trial 34 finished with value: 0.1949934484695693 and parameters: {'model_type': 'mlp', 'hidden_dims': '[512, 256]', 'dropout': 0.19447599770626134, 'batch_norm': True, 'lr': 4.064837891093566e-05, 'weight_decay': 0.000523339875991667, 'epochs': 42, 'loss': 'mae', 'optimizer': 'adam', 'graph_mode': 'off', 'use_snp_selection': False}. Best is trial 3 with value: 0.2077240439383361.
[I 2025-12-06 06:29:36,147] Trial 35 finished with value: 0.2053183654826613 and parameters: {'model_type': 'mlp', 'hidden_dims': '[256, 128]', 'dropout': 0.43024169205778806, 'batch_norm': False, 'lr': 1.5119610685230605e-05, 'weight_decay': 1.027741154444049e-05, 'epochs': 217, 'loss': 'mse', 'optimizer': 'adam', 'graph_mode': 'off', 'use_snp_selection': True, 'num_snps': 57586}. Best is trial 3 with value: 0.2077240439383361.
[I 2025-12-06 06:30:54,791] Trial 36 finished with value: 0.19822078716502364 and parameters: {'model_type': 'mlp', 'hidden_dims': '[512, 64]', 'dropout': 0.4034008812529041, 'batch_norm': False, 'lr': 3.7565367101064262e-06, 'weight_decay': 0.00019009559896090284, 'epochs': 272, 'loss': 'mae', 'optimizer': 'adam', 'graph_mode': 'off', 'use_snp_selection': False}. Best is trial 3 with value: 0.2077240439383361.
[I 2025-12-06 06:31:37,984] Trial 37 finished with value: 0.053800918273338626 and parameters: {'model_type': 'mlp', 'hidden_dims': '[256, 128, 64]', 'dropout': 0.2612604744121134, 'batch_norm': True, 'lr': 1.0939747806359674e-06, 'weight_decay': 1.8555114070287397e-05, 'epochs': 142, 'loss': 'mse', 'optimizer': 'adam', 'graph_mode': 'off', 'use_snp_selection': True, 'num_snps': 22282}. Best is trial 3 with value: 0.2077240439383361.
[I 2025-12-06 06:32:35,217] Trial 38 finished with value: 0.19866751707194036 and parameters: {'model_type': 'mlp', 'hidden_dims': '[512, 64]', 'dropout': 0.4592884965967214, 'batch_norm': False, 'lr': 2.35919320424467e-06, 'weight_decay': 4.1715836474880196e-05, 'epochs': 190, 'loss': 'mae', 'optimizer': 'adam', 'graph_mode': 'off', 'use_snp_selection': False}. Best is trial 3 with value: 0.2077240439383361.
[I 2025-12-06 06:33:24,971] Trial 39 finished with value: 0.20722445641759774 and parameters: {'model_type': 'mlp', 'hidden_dims': '[512, 256]', 'dropout': 0.5494548635824186, 'batch_norm': True, 'lr': 8.760628955587082e-05, 'weight_decay': 3.2276060926628743e-06, 'epochs': 158, 'loss': 'mae', 'optimizer': 'adam', 'graph_mode': 'off', 'use_snp_selection': False}. Best is trial 3 with value: 0.2077240439383361.
[I 2025-12-06 06:34:14,033] Trial 40 finished with value: 0.1968773319196474 and parameters: {'model_type': 'mlp', 'hidden_dims': '[512, 256]', 'dropout': 0.5483582723552272, 'batch_norm': True, 'lr': 0.00021667036345374027, 'weight_decay': 1.375417500241776e-06, 'epochs': 155, 'loss': 'mse', 'optimizer': 'adam', 'graph_mode': 'off', 'use_snp_selection': False}. Best is trial 3 with value: 0.2077240439383361.
[I 2025-12-06 06:34:59,346] Trial 41 finished with value: 0.21028977208383987 and parameters: {'model_type': 'mlp', 'hidden_dims': '[512, 256]', 'dropout': 0.5588575477031879, 'batch_norm': True, 'lr': 7.383299161575895e-05, 'weight_decay': 4.186010005023668e-06, 'epochs': 141, 'loss': 'mae', 'optimizer': 'adam', 'graph_mode': 'off', 'use_snp_selection': False}. Best is trial 41 with value: 0.21028977208383987.
[I 2025-12-06 06:35:59,356] Trial 42 finished with value: 0.20399430171945818 and parameters: {'model_type': 'mlp', 'hidden_dims': '[512, 256]', 'dropout': 0.5618765411970099, 'batch_norm': True, 'lr': 8.57058467823943e-05, 'weight_decay': 2.487901881944725e-06, 'epochs': 196, 'loss': 'mae', 'optimizer': 'adam', 'graph_mode': 'off', 'use_snp_selection': False}. Best is trial 41 with value: 0.21028977208383987.
[I 2025-12-06 06:36:44,695] Trial 43 finished with value: 0.2098534609724941 and parameters: {'model_type': 'mlp', 'hidden_dims': '[512, 256]', 'dropout': 0.55369800438489, 'batch_norm': True, 'lr': 4.365203076600143e-05, 'weight_decay': 4.146427730806887e-06, 'epochs': 141, 'loss': 'mae', 'optimizer': 'adam', 'graph_mode': 'off', 'use_snp_selection': False}. Best is trial 41 with value: 0.21028977208383987.
[I 2025-12-06 06:37:40,425] Trial 44 finished with value: 0.1987129492152956 and parameters: {'model_type': 'mlp', 'hidden_dims': '[512, 256]', 'dropout': 0.595589144501505, 'batch_norm': True, 'lr': 5.379362505277277e-05, 'weight_decay': 3.676091073614463e-06, 'epochs': 180, 'loss': 'mae', 'optimizer': 'adam', 'graph_mode': 'off', 'use_snp_selection': False}. Best is trial 41 with value: 0.21028977208383987.
[I 2025-12-06 06:38:31,926] Trial 45 finished with value: 0.20387104356122793 and parameters: {'model_type': 'mlp', 'hidden_dims': '[512, 256]', 'dropout': 0.5577420880335299, 'batch_norm': True, 'lr': 0.00040559413392303543, 'weight_decay': 6.977468291566179e-07, 'epochs': 164, 'loss': 'mae', 'optimizer': 'adam', 'graph_mode': 'off', 'use_snp_selection': False}. Best is trial 41 with value: 0.21028977208383987.
[I 2025-12-06 06:39:18,034] Trial 46 finished with value: 0.20734092764219186 and parameters: {'model_type': 'mlp', 'hidden_dims': '[512, 256]', 'dropout': 0.5282482849023407, 'batch_norm': True, 'lr': 4.8645635985370195e-05, 'weight_decay': 1.2198570342742072e-06, 'epochs': 144, 'loss': 'mae', 'optimizer': 'adam', 'graph_mode': 'off', 'use_snp_selection': False}. Best is trial 41 with value: 0.21028977208383987.
[I 2025-12-06 06:40:52,073] Trial 47 finished with value: 0.2063976601383229 and parameters: {'model_type': 'mlp', 'hidden_dims': '[512, 256]', 'dropout': 0.528964453543356, 'batch_norm': True, 'lr': 4.1916318884073684e-05, 'weight_decay': 1.6211085096312889e-06, 'epochs': 323, 'loss': 'mae', 'optimizer': 'adam', 'graph_mode': 'off', 'use_snp_selection': False}. Best is trial 41 with value: 0.21028977208383987.
[I 2025-12-06 06:41:56,265] Trial 48 finished with value: 0.20308020550209166 and parameters: {'model_type': 'mlp', 'hidden_dims': '[512, 256]', 'dropout': 0.5727706953343409, 'batch_norm': True, 'lr': 6.130354356477954e-05, 'weight_decay': 2.207661748642272e-07, 'epochs': 211, 'loss': 'mse', 'optimizer': 'adam', 'graph_mode': 'off', 'use_snp_selection': False}. Best is trial 41 with value: 0.21028977208383987.
[I 2025-12-06 06:43:50,424] Trial 49 finished with value: 0.21312072578690286 and parameters: {'model_type': 'mlp', 'hidden_dims': '[512, 256]', 'dropout': 0.5251210900115694, 'batch_norm': True, 'lr': 0.0001577368513211633, 'weight_decay': 8.989790247127154e-07, 'epochs': 349, 'loss': 'mae', 'optimizer': 'adam', 'graph_mode': 'off', 'use_snp_selection': True, 'num_snps': 46888}. Best is trial 49 with value: 0.21312072578690286.
[I 2025-12-06 06:45:42,327] Trial 50 finished with value: 0.21296662714600173 and parameters: {'model_type': 'mlp', 'hidden_dims': '[512, 128]', 'dropout': 0.47766763760180053, 'batch_norm': True, 'lr': 0.00015514697332295462, 'weight_decay': 7.3062534988627246e-06, 'epochs': 344, 'loss': 'mae', 'optimizer': 'adam', 'graph_mode': 'off', 'use_snp_selection': True, 'num_snps': 46345}. Best is trial 49 with value: 0.21312072578690286.
[I 2025-12-06 06:47:34,961] Trial 51 finished with value: 0.2083642415805096 and parameters: {'model_type': 'mlp', 'hidden_dims': '[512, 128]', 'dropout': 0.4684587458864742, 'batch_norm': True, 'lr': 0.0001691324614230108, 'weight_decay': 7.405103911611724e-06, 'epochs': 350, 'loss': 'mae', 'optimizer': 'adam', 'graph_mode': 'off', 'use_snp_selection': True, 'num_snps': 46428}. Best is trial 49 with value: 0.21312072578690286.
[I 2025-12-06 06:49:26,550] Trial 52 finished with value: 0.2136954913941534 and parameters: {'model_type': 'mlp', 'hidden_dims': '[512, 128]', 'dropout': 0.46870710048920816, 'batch_norm': True, 'lr': 0.000193251117376108, 'weight_decay': 7.984655032678762e-06, 'epochs': 350, 'loss': 'mae', 'optimizer': 'adam', 'graph_mode': 'off', 'use_snp_selection': True, 'num_snps': 46096}. Best is trial 52 with value: 0.2136954913941534.
[I 2025-12-06 06:51:18,715] Trial 53 finished with value: 0.21127673301295397 and parameters: {'model_type': 'mlp', 'hidden_dims': '[512, 128]', 'dropout': 0.4621626913041857, 'batch_norm': True, 'lr': 0.00033909844653890505, 'weight_decay': 6.54538445626927e-06, 'epochs': 348, 'loss': 'mae', 'optimizer': 'adam', 'graph_mode': 'off', 'use_snp_selection': True, 'num_snps': 46404}. Best is trial 52 with value: 0.2136954913941534.
[I 2025-12-06 06:53:06,602] Trial 54 finished with value: 0.20850788597441694 and parameters: {'model_type': 'mlp', 'hidden_dims': '[512, 128]', 'dropout': 0.508527170944106, 'batch_norm': True, 'lr': 0.00036869312313305384, 'weight_decay': 4.603495480558336e-06, 'epochs': 338, 'loss': 'mae', 'optimizer': 'adam', 'graph_mode': 'off', 'use_snp_selection': True, 'num_snps': 45205}. Best is trial 52 with value: 0.2136954913941534.
[I 2025-12-06 06:54:54,136] Trial 55 finished with value: 0.20720467759594213 and parameters: {'model_type': 'mlp', 'hidden_dims': '[512, 128]', 'dropout': 0.4605145448218573, 'batch_norm': True, 'lr': 0.0006524923653477935, 'weight_decay': 2.2581266108811923e-06, 'epochs': 298, 'loss': 'mae', 'optimizer': 'adam', 'graph_mode': 'off', 'use_snp_selection': True, 'num_snps': 49597}. Best is trial 52 with value: 0.2136954913941534.
[I 2025-12-06 06:56:30,145] Trial 56 finished with value: 0.21139733458660642 and parameters: {'model_type': 'mlp', 'hidden_dims': '[512, 128]', 'dropout': 0.4803811290604097, 'batch_norm': True, 'lr': 0.0003020922828067566, 'weight_decay': 6.299082937718423e-07, 'epochs': 333, 'loss': 'mae', 'optimizer': 'adam', 'graph_mode': 'off', 'use_snp_selection': True, 'num_snps': 39077}. Best is trial 52 with value: 0.2136954913941534.
[I 2025-12-06 06:58:05,173] Trial 57 finished with value: 0.2114446001346785 and parameters: {'model_type': 'mlp', 'hidden_dims': '[512, 128]', 'dropout': 0.47622442424570743, 'batch_norm': True, 'lr': 0.0002879739894330491, 'weight_decay': 5.948655298444231e-07, 'epochs': 327, 'loss': 'mae', 'optimizer': 'adam', 'graph_mode': 'off', 'use_snp_selection': True, 'num_snps': 39353}. Best is trial 52 with value: 0.2136954913941534.
[I 2025-12-06 06:59:37,451] Trial 58 finished with value: 0.20978433702618898 and parameters: {'model_type': 'mlp', 'hidden_dims': '[512, 128]', 'dropout': 0.47907634613822125, 'batch_norm': True, 'lr': 0.0005361073973737166, 'weight_decay': 4.092442357498258e-07, 'epochs': 331, 'loss': 'mae', 'optimizer': 'adam', 'graph_mode': 'off', 'use_snp_selection': True, 'num_snps': 37450}. Best is trial 52 with value: 0.2136954913941534.
[I 2025-12-06 07:01:10,746] Trial 59 finished with value: 0.2114588863047891 and parameters: {'model_type': 'mlp', 'hidden_dims': '[512, 128]', 'dropout': 0.440405207166771, 'batch_norm': True, 'lr': 0.00029324462643785587, 'weight_decay': 8.536898938099115e-07, 'epochs': 306, 'loss': 'mae', 'optimizer': 'adam', 'graph_mode': 'off', 'use_snp_selection': True, 'num_snps': 40685}. Best is trial 52 with value: 0.2136954913941534.
[I 2025-12-06 07:02:45,958] Trial 60 finished with value: 0.21137636379702637 and parameters: {'model_type': 'mlp', 'hidden_dims': '[512, 128]', 'dropout': 0.42736876800479945, 'batch_norm': True, 'lr': 0.0002723334477485185, 'weight_decay': 9.214543742905201e-07, 'epochs': 309, 'loss': 'mae', 'optimizer': 'adam', 'graph_mode': 'off', 'use_snp_selection': True, 'num_snps': 41408}. Best is trial 52 with value: 0.2136954913941534.
[I 2025-12-06 07:04:17,103] Trial 61 finished with value: 0.20937948434295817 and parameters: {'model_type': 'mlp', 'hidden_dims': '[512, 128]', 'dropout': 0.42956453658579224, 'batch_norm': True, 'lr': 0.0002913947940192497, 'weight_decay': 8.26837810807546e-07, 'epochs': 307, 'loss': 'mae', 'optimizer': 'adam', 'graph_mode': 'off', 'use_snp_selection': True, 'num_snps': 39196}. Best is trial 52 with value: 0.2136954913941534.
[I 2025-12-06 07:05:54,738] Trial 62 finished with value: 0.20818284828786493 and parameters: {'model_type': 'mlp', 'hidden_dims': '[512, 128]', 'dropout': 0.3875427073305485, 'batch_norm': True, 'lr': 0.00019979096348433003, 'weight_decay': 4.233157656310319e-07, 'epochs': 333, 'loss': 'mae', 'optimizer': 'adam', 'graph_mode': 'off', 'use_snp_selection': True, 'num_snps': 40523}. Best is trial 52 with value: 0.2136954913941534.
[I 2025-12-06 07:07:47,424] Trial 63 finished with value: 0.2098999627058708 and parameters: {'model_type': 'mlp', 'hidden_dims': '[512, 128]', 'dropout': 0.44260864947678435, 'batch_norm': True, 'lr': 0.00045379074342298195, 'weight_decay': 2.310146118745975e-07, 'epochs': 314, 'loss': 'mae', 'optimizer': 'adam', 'graph_mode': 'off', 'use_snp_selection': True, 'num_snps': 51285}. Best is trial 52 with value: 0.2136954913941534.
[I 2025-12-06 07:09:19,089] Trial 64 finished with value: 0.20836851740243095 and parameters: {'model_type': 'mlp', 'hidden_dims': '[512, 128]', 'dropout': 0.5153890026998029, 'batch_norm': True, 'lr': 0.00013870444810810384, 'weight_decay': 1.034859782249382e-06, 'epochs': 284, 'loss': 'mae', 'optimizer': 'adam', 'graph_mode': 'off', 'use_snp_selection': True, 'num_snps': 41673}. Best is trial 52 with value: 0.2136954913941534.
[I 2025-12-06 07:10:41,026] Trial 65 finished with value: 0.21067280336853997 and parameters: {'model_type': 'mlp', 'hidden_dims': '[512, 128]', 'dropout': 0.4128241716790259, 'batch_norm': True, 'lr': 0.0002610880672858188, 'weight_decay': 2.8095162882534474e-07, 'epochs': 301, 'loss': 'mae', 'optimizer': 'adam', 'graph_mode': 'off', 'use_snp_selection': True, 'num_snps': 34223}. Best is trial 52 with value: 0.2136954913941534.
[I 2025-12-06 07:12:34,922] Trial 66 finished with value: 0.2093640421107728 and parameters: {'model_type': 'mlp', 'hidden_dims': '[512, 128]', 'dropout': 0.4848153272024346, 'batch_norm': True, 'lr': 0.0001825197304362437, 'weight_decay': 1.328924169698139e-07, 'epochs': 325, 'loss': 'mae', 'optimizer': 'adam', 'graph_mode': 'off', 'use_snp_selection': True, 'num_snps': 50591}. Best is trial 52 with value: 0.2136954913941534.
[I 2025-12-06 07:14:17,282] Trial 67 finished with value: 0.20807916949059582 and parameters: {'model_type': 'mlp', 'hidden_dims': '[512, 128]', 'dropout': 0.4470741019345549, 'batch_norm': True, 'lr': 0.000584562373852768, 'weight_decay': 5.684871578257109e-07, 'epochs': 339, 'loss': 'mae', 'optimizer': 'adam', 'graph_mode': 'off', 'use_snp_selection': True, 'num_snps': 42241}. Best is trial 52 with value: 0.2136954913941534.
[I 2025-12-06 07:16:06,761] Trial 68 finished with value: 0.19774255197206497 and parameters: {'model_type': 'mlp', 'hidden_dims': '[512, 128]', 'dropout': 0.5054086716353962, 'batch_norm': True, 'lr': 0.0008040328600812685, 'weight_decay': 1.6930271162725627e-06, 'epochs': 314, 'loss': 'mse', 'optimizer': 'adam', 'graph_mode': 'off', 'use_snp_selection': True, 'num_snps': 49138}. Best is trial 52 with value: 0.2136954913941534.
[I 2025-12-06 07:17:31,033] Trial 69 finished with value: 0.21041940205368115 and parameters: {'model_type': 'mlp', 'hidden_dims': '[512, 128]', 'dropout': 0.36782067042988087, 'batch_norm': True, 'lr': 0.0001265922080503053, 'weight_decay': 9.196391955333737e-07, 'epochs': 263, 'loss': 'mae', 'optimizer': 'adam', 'graph_mode': 'off', 'use_snp_selection': True, 'num_snps': 39052}. Best is trial 52 with value: 0.2136954913941534.
