[I 2025-12-05 14:32:27,791] Trial 58 finished with value: 0.06365221665398607 and parameters: {'model_type': 'mlp', 'hidden_dims': '[512, 256]', 'dropout': 0.5105259099137434, 'batch_norm': False, 'lr': 2.1471517342899457e-06, 'weight_decay': 1.353122312852851e-06, 'epochs': 174, 'loss': 'mae', 'optimizer': 'adam', 'graph_mode': 'off', 'use_snp_selection': False}. Best is trial 40 with value: 0.12012300035419853.
[I 2025-12-05 14:32:29,056] Trial 59 finished with value: 0.0971950849505793 and parameters: {'model_type': 'mlp', 'hidden_dims': '[512, 128]', 'dropout': 0.5695213053752921, 'batch_norm': True, 'lr': 0.0004422488504698786, 'weight_decay': 0.00014501509455894888, 'epochs': 127, 'loss': 'mae', 'optimizer': 'adam', 'graph_mode': 'off', 'use_snp_selection': False}. Best is trial 40 with value: 0.12012300035419853.
[I 2025-12-05 14:32:30,818] Trial 60 finished with value: 0.12124388502857328 and parameters: {'model_type': 'mlp', 'hidden_dims': '[512, 64]', 'dropout': 0.21939488529460893, 'batch_norm': True, 'lr': 0.0008003853986359719, 'weight_decay': 5.009377861440923e-07, 'epochs': 154, 'loss': 'mae', 'optimizer': 'adam', 'graph_mode': 'off', 'use_snp_selection': True, 'num_snps': 29227}. Best is trial 60 with value: 0.12124388502857328.
[I 2025-12-05 14:32:32,903] Trial 61 finished with value: 0.11873770589415221 and parameters: {'model_type': 'mlp', 'hidden_dims': '[512, 64]', 'dropout': 0.2245040287687427, 'batch_norm': True, 'lr': 0.0009998759701479029, 'weight_decay': 4.777267599671731e-07, 'epochs': 182, 'loss': 'mae', 'optimizer': 'adam', 'graph_mode': 'off', 'use_snp_selection': True, 'num_snps': 36642}. Best is trial 60 with value: 0.12124388502857328.
[I 2025-12-05 14:32:34,944] Trial 62 finished with value: 0.11323928038665204 and parameters: {'model_type': 'mlp', 'hidden_dims': '[512, 64]', 'dropout': 0.2754053457434977, 'batch_norm': True, 'lr': 0.0009651562199051379, 'weight_decay': 4.466663294924604e-07, 'epochs': 151, 'loss': 'mae', 'optimizer': 'adam', 'graph_mode': 'off', 'use_snp_selection': True, 'num_snps': 36981}. Best is trial 60 with value: 0.12124388502857328.
[I 2025-12-05 14:32:36,811] Trial 63 finished with value: 0.11119168464535958 and parameters: {'model_type': 'mlp', 'hidden_dims': '[512, 64]', 'dropout': 0.2122336462504285, 'batch_norm': True, 'lr': 0.0007048450315433005, 'weight_decay': 2.6173225443971606e-07, 'epochs': 200, 'loss': 'mae', 'optimizer': 'adam', 'graph_mode': 'off', 'use_snp_selection': True, 'num_snps': 30468}. Best is trial 60 with value: 0.12124388502857328.
[I 2025-12-05 14:32:39,609] Trial 64 finished with value: 0.11045420739547848 and parameters: {'model_type': 'mlp', 'hidden_dims': '[512, 64]', 'dropout': 0.3087273400693261, 'batch_norm': True, 'lr': 0.0005822904133922877, 'weight_decay': 5.809660132745674e-07, 'epochs': 216, 'loss': 'mae', 'optimizer': 'adam', 'graph_mode': 'off', 'use_snp_selection': True, 'num_snps': 50186}. Best is trial 60 with value: 0.12124388502857328.
[I 2025-12-05 14:32:41,427] Trial 65 finished with value: 0.10892276567398101 and parameters: {'model_type': 'mlp', 'hidden_dims': '[128, 64]', 'dropout': 0.2439123198285747, 'batch_norm': True, 'lr': 0.0007750821722607513, 'weight_decay': 3.048033086806155e-07, 'epochs': 112, 'loss': 'mae', 'optimizer': 'adam', 'graph_mode': 'off', 'use_snp_selection': True, 'num_snps': 36824}. Best is trial 60 with value: 0.12124388502857328.
[I 2025-12-05 14:32:43,768] Trial 66 finished with value: 0.12333954728254512 and parameters: {'model_type': 'mlp', 'hidden_dims': '[512, 64]', 'dropout': 0.22302098847804297, 'batch_norm': True, 'lr': 0.0005493010132499961, 'weight_decay': 1.8523540951527617e-07, 'epochs': 161, 'loss': 'mae', 'optimizer': 'adam', 'graph_mode': 'off', 'use_snp_selection': True, 'num_snps': 41623}. Best is trial 66 with value: 0.12333954728254512.
[I 2025-12-05 14:32:46,185] Trial 67 finished with value: 0.12224315353283603 and parameters: {'model_type': 'mlp', 'hidden_dims': '[512, 64]', 'dropout': 0.18784947215832418, 'batch_norm': True, 'lr': 0.0007907978252203, 'weight_decay': 1.8467845232079068e-07, 'epochs': 166, 'loss': 'mae', 'optimizer': 'adam', 'graph_mode': 'off', 'use_snp_selection': True, 'num_snps': 43388}. Best is trial 66 with value: 0.12333954728254512.
[I 2025-12-05 14:32:48,321] Trial 68 finished with value: 0.10703312935372448 and parameters: {'model_type': 'mlp', 'hidden_dims': '[256, 128]', 'dropout': 0.20775143783246697, 'batch_norm': True, 'lr': 0.0004887211544044006, 'weight_decay': 1.7501777268796954e-07, 'epochs': 94, 'loss': 'mae', 'optimizer': 'adam', 'graph_mode': 'off', 'use_snp_selection': True, 'num_snps': 47252}. Best is trial 66 with value: 0.12333954728254512.
[I 2025-12-05 14:32:50,647] Trial 69 finished with value: 0.12380048211606041 and parameters: {'model_type': 'mlp', 'hidden_dims': '[512, 128]', 'dropout': 0.18724208561627007, 'batch_norm': True, 'lr': 0.000553104107887888, 'weight_decay': 1.9214433974674622e-07, 'epochs': 157, 'loss': 'mae', 'optimizer': 'adam', 'graph_mode': 'off', 'use_snp_selection': True, 'num_snps': 41482}. Best is trial 69 with value: 0.12380048211606041.
[I 2025-12-05 14:32:53,009] Trial 70 finished with value: 0.11674818044541316 and parameters: {'model_type': 'mlp', 'hidden_dims': '[512, 64]', 'dropout': 0.18451793813190226, 'batch_norm': True, 'lr': 0.0008365618740283104, 'weight_decay': 1.295896109747352e-07, 'epochs': 163, 'loss': 'mse', 'optimizer': 'adam', 'graph_mode': 'off', 'use_snp_selection': True, 'num_snps': 42075}. Best is trial 69 with value: 0.12380048211606041.
[I 2025-12-05 14:32:55,461] Trial 71 finished with value: 0.1253960274163823 and parameters: {'model_type': 'mlp', 'hidden_dims': '[512, 128]', 'dropout': 0.19186281111593045, 'batch_norm': True, 'lr': 0.0005566560230540963, 'weight_decay': 1.0012420579034791e-07, 'epochs': 141, 'loss': 'mae', 'optimizer': 'adam', 'graph_mode': 'off', 'use_snp_selection': True, 'num_snps': 46667}. Best is trial 71 with value: 0.1253960274163823.
[I 2025-12-05 14:32:58,141] Trial 72 finished with value: 0.11053686277676597 and parameters: {'model_type': 'mlp', 'hidden_dims': '[512, 128]', 'dropout': 0.229872820551081, 'batch_norm': True, 'lr': 0.0005738307597824067, 'weight_decay': 1.0300462241815349e-07, 'epochs': 142, 'loss': 'mae', 'optimizer': 'adam', 'graph_mode': 'off', 'use_snp_selection': True, 'num_snps': 50923}. Best is trial 71 with value: 0.1253960274163823.
[I 2025-12-05 14:33:00,581] Trial 73 finished with value: 0.11328859282436025 and parameters: {'model_type': 'mlp', 'hidden_dims': '[512, 128]', 'dropout': 0.19594213370729474, 'batch_norm': True, 'lr': 0.00029898711533492034, 'weight_decay': 1.899025090188223e-07, 'epochs': 155, 'loss': 'mae', 'optimizer': 'adam', 'graph_mode': 'off', 'use_snp_selection': True, 'num_snps': 44949}. Best is trial 71 with value: 0.1253960274163823.
[I 2025-12-05 14:33:02,861] Trial 74 finished with value: 0.1108600076102436 and parameters: {'model_type': 'mlp', 'hidden_dims': '[512, 128]', 'dropout': 0.26530798840951164, 'batch_norm': True, 'lr': 0.0003967427113147137, 'weight_decay': 1.416701843449832e-07, 'epochs': 169, 'loss': 'mae', 'optimizer': 'adam', 'graph_mode': 'off', 'use_snp_selection': True, 'num_snps': 40314}. Best is trial 71 with value: 0.1253960274163823.
[I 2025-12-05 14:33:05,427] Trial 75 finished with value: 0.1049592269213701 and parameters: {'model_type': 'mlp', 'hidden_dims': '[256, 128, 64]', 'dropout': 0.19124969314035775, 'batch_norm': True, 'lr': 0.0007138570066694503, 'weight_decay': 3.296189424678808e-07, 'epochs': 193, 'loss': 'mae', 'optimizer': 'adam', 'graph_mode': 'off', 'use_snp_selection': True, 'num_snps': 54348}. Best is trial 71 with value: 0.1253960274163823.
[I 2025-12-05 14:33:07,936] Trial 76 finished with value: 0.11301427926583939 and parameters: {'model_type': 'mlp', 'hidden_dims': '[512, 128]', 'dropout': 0.1371220685963401, 'batch_norm': True, 'lr': 0.000539253765557674, 'weight_decay': 2.0114491265306043e-07, 'epochs': 150, 'loss': 'mae', 'optimizer': 'adam', 'graph_mode': 'off', 'use_snp_selection': True, 'num_snps': 45558}. Best is trial 71 with value: 0.1253960274163823.
[I 2025-12-05 14:33:09,904] Trial 77 finished with value: 0.12082696946115977 and parameters: {'model_type': 'mlp', 'hidden_dims': '[512, 64]', 'dropout': 0.17625001922085723, 'batch_norm': True, 'lr': 0.0008077143202764287, 'weight_decay': 1.235023352872649e-07, 'epochs': 139, 'loss': 'mae', 'optimizer': 'adam', 'graph_mode': 'off', 'use_snp_selection': True, 'num_snps': 33657}. Best is trial 71 with value: 0.1253960274163823.
[I 2025-12-05 14:33:11,782] Trial 78 finished with value: 0.123309944595671 and parameters: {'model_type': 'mlp', 'hidden_dims': '[512, 64]', 'dropout': 0.16242173384543393, 'batch_norm': True, 'lr': 0.0007987876363027151, 'weight_decay': 1.481863752980803e-07, 'epochs': 142, 'loss': 'mae', 'optimizer': 'adam', 'graph_mode': 'off', 'use_snp_selection': True, 'num_snps': 33499}. Best is trial 71 with value: 0.1253960274163823.
[I 2025-12-05 14:33:13,627] Trial 79 finished with value: 0.1226107342885496 and parameters: {'model_type': 'mlp', 'hidden_dims': '[512, 64]', 'dropout': 0.15432193622848148, 'batch_norm': True, 'lr': 0.0007885495041591586, 'weight_decay': 1.1622534064577939e-07, 'epochs': 119, 'loss': 'mae', 'optimizer': 'adam', 'graph_mode': 'off', 'use_snp_selection': True, 'num_snps': 33530}. Best is trial 71 with value: 0.1253960274163823.
[I 2025-12-05 14:33:15,470] Trial 80 finished with value: 0.12490284853244964 and parameters: {'model_type': 'mlp', 'hidden_dims': '[512, 64]', 'dropout': 0.16349589933778555, 'batch_norm': True, 'lr': 0.0008031418727897141, 'weight_decay': 1.2307301482743303e-07, 'epochs': 115, 'loss': 'mae', 'optimizer': 'adam', 'graph_mode': 'off', 'use_snp_selection': True, 'num_snps': 33303}. Best is trial 71 with value: 0.1253960274163823.
[I 2025-12-05 14:33:17,212] Trial 81 finished with value: 0.10661812742268735 and parameters: {'model_type': 'mlp', 'hidden_dims': '[512, 64]', 'dropout': 0.16120979890824688, 'batch_norm': True, 'lr': 0.0008422627442791567, 'weight_decay': 1.352981436541361e-07, 'epochs': 118, 'loss': 'mae', 'optimizer': 'adam', 'graph_mode': 'off', 'use_snp_selection': True, 'num_snps': 31635}. Best is trial 71 with value: 0.1253960274163823.
[I 2025-12-05 14:33:19,053] Trial 82 finished with value: 0.1183679806765541 and parameters: {'model_type': 'mlp', 'hidden_dims': '[512, 64]', 'dropout': 0.1762565131772954, 'batch_norm': True, 'lr': 0.0007690826290554546, 'weight_decay': 1.0467630679685662e-07, 'epochs': 97, 'loss': 'mae', 'optimizer': 'adam', 'graph_mode': 'off', 'use_snp_selection': True, 'num_snps': 34372}. Best is trial 71 with value: 0.1253960274163823.
[I 2025-12-05 14:33:21,164] Trial 83 finished with value: 0.11532086144733195 and parameters: {'model_type': 'mlp', 'hidden_dims': '[512, 64]', 'dropout': 0.20464363167240537, 'batch_norm': True, 'lr': 0.0008533919779717134, 'weight_decay': 1.5031793094208584e-07, 'epochs': 141, 'loss': 'mae', 'optimizer': 'adam', 'graph_mode': 'off', 'use_snp_selection': True, 'num_snps': 39030}. Best is trial 71 with value: 0.1253960274163823.
[I 2025-12-05 14:33:22,834] Trial 84 finished with value: 0.11531717573509227 and parameters: {'model_type': 'mlp', 'hidden_dims': '[512, 64]', 'dropout': 0.2353846816421128, 'batch_norm': True, 'lr': 0.0006323123779041094, 'weight_decay': 2.40869786468134e-07, 'epochs': 126, 'loss': 'mae', 'optimizer': 'adam', 'graph_mode': 'off', 'use_snp_selection': True, 'num_snps': 28598}. Best is trial 71 with value: 0.1253960274163823.
[I 2025-12-05 14:33:24,775] Trial 85 finished with value: 0.10232916765282997 and parameters: {'model_type': 'mlp', 'hidden_dims': '[512, 64]', 'dropout': 0.21756843285796462, 'batch_norm': True, 'lr': 0.0004144575147435073, 'weight_decay': 2.0364248242133194e-07, 'epochs': 118, 'loss': 'mse', 'optimizer': 'adam', 'graph_mode': 'off', 'use_snp_selection': True, 'num_snps': 34776}. Best is trial 71 with value: 0.1253960274163823.
[I 2025-12-05 14:33:27,077] Trial 86 finished with value: 0.12189718765654578 and parameters: {'model_type': 'mlp', 'hidden_dims': '[512, 64]', 'dropout': 0.15925437364437378, 'batch_norm': True, 'lr': 0.0009876481821821177, 'weight_decay': 1.2509784842301628e-07, 'epochs': 144, 'loss': 'mae', 'optimizer': 'adam', 'graph_mode': 'off', 'use_snp_selection': True, 'num_snps': 42595}. Best is trial 71 with value: 0.1253960274163823.
[I 2025-12-05 14:33:29,366] Trial 87 finished with value: 0.12241229607560718 and parameters: {'model_type': 'mlp', 'hidden_dims': '[512, 64]', 'dropout': 0.14302323108863838, 'batch_norm': True, 'lr': 0.000517107354349113, 'weight_decay': 1.66171784947278e-07, 'epochs': 100, 'loss': 'mae', 'optimizer': 'adam', 'graph_mode': 'off', 'use_snp_selection': True, 'num_snps': 43217}. Best is trial 71 with value: 0.1253960274163823.
[I 2025-12-05 14:33:31,584] Trial 88 finished with value: 0.019991090271518495 and parameters: {'model_type': 'mlp', 'hidden_dims': '[512, 64]', 'dropout': 0.1441131409234823, 'batch_norm': True, 'lr': 1.0140131075006902e-06, 'weight_decay': 2.704019988219088e-07, 'epochs': 83, 'loss': 'mae', 'optimizer': 'adam', 'graph_mode': 'off', 'use_snp_selection': True, 'num_snps': 43422}. Best is trial 71 with value: 0.1253960274163823.
[I 2025-12-05 14:33:33,914] Trial 89 finished with value: 0.12031379845294612 and parameters: {'model_type': 'mlp', 'hidden_dims': '[512, 64]', 'dropout': 0.16056176100456715, 'batch_norm': True, 'lr': 0.000526343262161613, 'weight_decay': 1.8564814957953407e-07, 'epochs': 60, 'loss': 'mae', 'optimizer': 'adam', 'graph_mode': 'off', 'use_snp_selection': True, 'num_snps': 47637}. Best is trial 71 with value: 0.1253960274163823.
[I 2025-12-05 14:33:36,036] Trial 90 finished with value: 0.10019157844486742 and parameters: {'model_type': 'mlp', 'hidden_dims': '[512, 64]', 'dropout': 0.15458792826529666, 'batch_norm': True, 'lr': 1.4524677045081567e-05, 'weight_decay': 1.1524470145981774e-07, 'epochs': 102, 'loss': 'mae', 'optimizer': 'adam', 'graph_mode': 'off', 'use_snp_selection': True, 'num_snps': 39138}. Best is trial 71 with value: 0.1253960274163823.
[I 2025-12-05 14:33:38,366] Trial 91 finished with value: 0.11104704057577992 and parameters: {'model_type': 'mlp', 'hidden_dims': '[512, 64]', 'dropout': 0.18597809988278802, 'batch_norm': True, 'lr': 0.0009793161727313696, 'weight_decay': 1.493786264429351e-07, 'epochs': 152, 'loss': 'mae', 'optimizer': 'adam', 'graph_mode': 'off', 'use_snp_selection': True, 'num_snps': 42063}. Best is trial 71 with value: 0.1253960274163823.
[I 2025-12-05 14:33:40,105] Trial 92 finished with value: 0.11017763370494672 and parameters: {'model_type': 'mlp', 'hidden_dims': '[512, 64]', 'dropout': 0.166731667274288, 'batch_norm': True, 'lr': 0.000674079770847761, 'weight_decay': 2.0855184316819455e-07, 'epochs': 113, 'loss': 'mae', 'optimizer': 'adam', 'graph_mode': 'off', 'use_snp_selection': True, 'num_snps': 30141}. Best is trial 71 with value: 0.1253960274163823.
[I 2025-12-05 14:33:42,686] Trial 93 finished with value: 0.12301528844686202 and parameters: {'model_type': 'mlp', 'hidden_dims': '[512, 64]', 'dropout': 0.13782327251418833, 'batch_norm': True, 'lr': 0.00033031071274905086, 'weight_decay': 2.967301787567936e-07, 'epochs': 168, 'loss': 'mae', 'optimizer': 'adam', 'graph_mode': 'off', 'use_snp_selection': True, 'num_snps': 47873}. Best is trial 71 with value: 0.1253960274163823.
[I 2025-12-05 14:33:45,328] Trial 94 finished with value: 0.11249246625367926 and parameters: {'model_type': 'mlp', 'hidden_dims': '[512, 64]', 'dropout': 0.1463133469229861, 'batch_norm': True, 'lr': 0.00034624174968959546, 'weight_decay': 2.755687401296241e-07, 'epochs': 176, 'loss': 'mae', 'optimizer': 'adam', 'graph_mode': 'off', 'use_snp_selection': True, 'num_snps': 47155}. Best is trial 71 with value: 0.1253960274163823.
[I 2025-12-05 14:33:47,962] Trial 95 finished with value: 0.12622076898715806 and parameters: {'model_type': 'mlp', 'hidden_dims': '[512, 64]', 'dropout': 0.13473744566104467, 'batch_norm': True, 'lr': 0.000499512705326246, 'weight_decay': 1.2279248794063848e-07, 'epochs': 130, 'loss': 'mae', 'optimizer': 'adam', 'graph_mode': 'off', 'use_snp_selection': True, 'num_snps': 49896}. Best is trial 95 with value: 0.12622076898715806.
[I 2025-12-05 14:33:50,489] Trial 96 finished with value: 0.11503019079371006 and parameters: {'model_type': 'mlp', 'hidden_dims': '[512, 64]', 'dropout': 0.11238975878391029, 'batch_norm': True, 'lr': 0.0004962562390272746, 'weight_decay': 3.5658292042908957e-07, 'epochs': 92, 'loss': 'mae', 'optimizer': 'adam', 'graph_mode': 'off', 'use_snp_selection': True, 'num_snps': 50053}. Best is trial 95 with value: 0.12622076898715806.
[I 2025-12-05 14:33:53,286] Trial 97 finished with value: 0.07458444477325606 and parameters: {'model_type': 'mlp', 'hidden_dims': '[512, 64]', 'dropout': 0.1325235676636904, 'batch_norm': True, 'lr': 7.424512570081482e-06, 'weight_decay': 1.5995374826521993e-07, 'epochs': 133, 'loss': 'mae', 'optimizer': 'adam', 'graph_mode': 'off', 'use_snp_selection': True, 'num_snps': 54071}. Best is trial 95 with value: 0.12622076898715806.
[I 2025-12-05 14:33:56,033] Trial 98 finished with value: 0.09833545356102874 and parameters: {'model_type': 'mlp', 'hidden_dims': '[512, 256]', 'dropout': 0.1359044518801968, 'batch_norm': True, 'lr': 0.0003298777398047248, 'weight_decay': 1.0173829521997908e-07, 'epochs': 127, 'loss': 'mse', 'optimizer': 'adam', 'graph_mode': 'off', 'use_snp_selection': True, 'num_snps': 52637}. Best is trial 95 with value: 0.12622076898715806.
[I 2025-12-05 14:33:58,580] Trial 99 finished with value: 0.12203148916474935 and parameters: {'model_type': 'mlp', 'hidden_dims': '[512, 64]', 'dropout': 0.11372761628153372, 'batch_norm': True, 'lr': 0.0004273316722532157, 'weight_decay': 2.210378813436368e-07, 'epochs': 166, 'loss': 'mae', 'optimizer': 'adam', 'graph_mode': 'off', 'use_snp_selection': True, 'num_snps': 44763}. Best is trial 95 with value: 0.12622076898715806.
[I 2025-12-05 14:34:01,005] Trial 100 finished with value: 0.13027580647726633 and parameters: {'model_type': 'mlp', 'hidden_dims': '[512, 64]', 'dropout': 0.17131876747528407, 'batch_norm': True, 'lr': 0.0006227981665036936, 'weight_decay': 1.7144013363518417e-07, 'epochs': 100, 'loss': 'mae', 'optimizer': 'adam', 'graph_mode': 'off', 'use_snp_selection': True, 'num_snps': 48312}. Best is trial 100 with value: 0.13027580647726633.
[I 2025-12-05 14:34:03,432] Trial 101 finished with value: 0.12037828223397404 and parameters: {'model_type': 'mlp', 'hidden_dims': '[512, 64]', 'dropout': 0.20090130666945175, 'batch_norm': True, 'lr': 0.0005729329876774642, 'weight_decay': 1.7431084926651147e-07, 'epochs': 75, 'loss': 'mae', 'optimizer': 'adam', 'graph_mode': 'off', 'use_snp_selection': True, 'num_snps': 48718}. Best is trial 100 with value: 0.13027580647726633.
[I 2025-12-05 14:34:05,850] Trial 102 finished with value: 0.11389296152284215 and parameters: {'model_type': 'mlp', 'hidden_dims': '[512, 64]', 'dropout': 0.1740373979196001, 'batch_norm': True, 'lr': 0.0006637101734212119, 'weight_decay': 1.2383678272459976e-07, 'epochs': 104, 'loss': 'mae', 'optimizer': 'adam', 'graph_mode': 'off', 'use_snp_selection': True, 'num_snps': 46118}. Best is trial 100 with value: 0.13027580647726633.
[I 2025-12-05 14:34:08,013] Trial 103 finished with value: 0.11381318712436246 and parameters: {'model_type': 'mlp', 'hidden_dims': '[512, 64]', 'dropout': 0.18826535429870045, 'batch_norm': True, 'lr': 0.0005019361170124712, 'weight_decay': 1.5202161194491295e-07, 'epochs': 113, 'loss': 'mae', 'optimizer': 'adam', 'graph_mode': 'off', 'use_snp_selection': True, 'num_snps': 40085}. Best is trial 100 with value: 0.13027580647726633.
[I 2025-12-05 14:34:10,587] Trial 104 finished with value: 0.09895728027339144 and parameters: {'model_type': 'mlp', 'hidden_dims': '[512, 64]', 'dropout': 0.14740497708220204, 'batch_norm': True, 'lr': 0.0003843997926816562, 'weight_decay': 3.128057524767543e-07, 'epochs': 122, 'loss': 'mae', 'optimizer': 'adam', 'graph_mode': 'off', 'use_snp_selection': True, 'num_snps': 49500}. Best is trial 100 with value: 0.13027580647726633.
[I 2025-12-05 14:34:12,563] Trial 105 finished with value: 0.11720747121114375 and parameters: {'model_type': 'mlp', 'hidden_dims': '[128, 64]', 'dropout': 0.16930714350329668, 'batch_norm': True, 'lr': 0.00030750598157623237, 'weight_decay': 2.25867808127441e-07, 'epochs': 102, 'loss': 'mae', 'optimizer': 'adam', 'graph_mode': 'off', 'use_snp_selection': True, 'num_snps': 43389}. Best is trial 100 with value: 0.13027580647726633.
[I 2025-12-05 14:34:14,920] Trial 106 finished with value: 0.10942370162008272 and parameters: {'model_type': 'mlp', 'hidden_dims': '[256, 128]', 'dropout': 0.14052768783776015, 'batch_norm': True, 'lr': 0.0006048889089923765, 'weight_decay': 1.1787965100537334e-07, 'epochs': 86, 'loss': 'mae', 'optimizer': 'adam', 'graph_mode': 'off', 'use_snp_selection': True, 'num_snps': 51772}. Best is trial 100 with value: 0.13027580647726633.
[I 2025-12-05 14:34:17,889] Trial 107 finished with value: 0.11435894984757312 and parameters: {'model_type': 'mlp', 'hidden_dims': '[512, 64]', 'dropout': 0.13008861623250834, 'batch_norm': True, 'lr': 0.0007515187696496076, 'weight_decay': 3.838567516490402e-07, 'epochs': 161, 'loss': 'mae', 'optimizer': 'adam', 'graph_mode': 'off', 'use_snp_selection': True, 'num_snps': 55644}. Best is trial 100 with value: 0.13027580647726633.
