[I 2025-12-05 15:00:39,866] Trial 87 finished with value: 0.06839086142414301 and parameters: {'model_type': 'mlp', 'hidden_dims': '[128, 64]', 'dropout': 0.2900090618397341, 'batch_norm': False, 'lr': 3.5662033364786044e-05, 'weight_decay': 0.00016764271813324934, 'epochs': 311, 'loss': 'mse', 'optimizer': 'adam', 'graph_mode': 'off', 'use_snp_selection': True, 'num_snps': 2032}. Best is trial 72 with value: 0.10602043593100756.
[I 2025-12-05 15:00:41,063] Trial 88 finished with value: 0.09029546916624082 and parameters: {'model_type': 'mlp', 'hidden_dims': '[128, 64]', 'dropout': 0.2658095179335864, 'batch_norm': False, 'lr': 3.156914560644375e-05, 'weight_decay': 0.0002839467776473825, 'epochs': 333, 'loss': 'mse', 'optimizer': 'adam', 'graph_mode': 'off', 'use_snp_selection': True, 'num_snps': 10839}. Best is trial 72 with value: 0.10602043593100756.
[I 2025-12-05 15:00:42,368] Trial 89 finished with value: 0.07835075237248693 and parameters: {'model_type': 'mlp', 'hidden_dims': '[128, 64]', 'dropout': 0.3833477446398244, 'batch_norm': False, 'lr': 6.541379423748594e-05, 'weight_decay': 0.00014200580818590398, 'epochs': 342, 'loss': 'mse', 'optimizer': 'adam', 'graph_mode': 'off', 'use_snp_selection': True, 'num_snps': 15368}. Best is trial 72 with value: 0.10602043593100756.
[I 2025-12-05 15:00:43,549] Trial 90 finished with value: 0.08603763538306516 and parameters: {'model_type': 'mlp', 'hidden_dims': '[512, 64]', 'dropout': 0.3323403568760941, 'batch_norm': False, 'lr': 2.6111551560722982e-05, 'weight_decay': 0.0004603199595664607, 'epochs': 328, 'loss': 'mse', 'optimizer': 'adam', 'graph_mode': 'off', 'use_snp_selection': True, 'num_snps': 9307}. Best is trial 72 with value: 0.10602043593100756.
[I 2025-12-05 15:00:44,573] Trial 91 finished with value: 0.11023223552186984 and parameters: {'model_type': 'mlp', 'hidden_dims': '[512, 256]', 'dropout': 0.344995681004918, 'batch_norm': False, 'lr': 4.280613532393892e-05, 'weight_decay': 0.0005871062611727924, 'epochs': 350, 'loss': 'mse', 'optimizer': 'adam', 'graph_mode': 'off', 'use_snp_selection': True, 'num_snps': 4877}. Best is trial 91 with value: 0.11023223552186984.
[I 2025-12-05 15:00:45,614] Trial 92 finished with value: 0.08132173934909753 and parameters: {'model_type': 'mlp', 'hidden_dims': '[128, 64]', 'dropout': 0.34475832739997875, 'batch_norm': False, 'lr': 4.092248910375962e-05, 'weight_decay': 0.00023337892989288894, 'epochs': 350, 'loss': 'mse', 'optimizer': 'adam', 'graph_mode': 'off', 'use_snp_selection': True, 'num_snps': 6484}. Best is trial 91 with value: 0.11023223552186984.
[I 2025-12-05 15:00:46,603] Trial 93 finished with value: 0.10624245319717324 and parameters: {'model_type': 'mlp', 'hidden_dims': '[128, 64]', 'dropout': 0.3167489065461714, 'batch_norm': False, 'lr': 7.888258344909371e-05, 'weight_decay': 0.0006004916659030816, 'epochs': 336, 'loss': 'mse', 'optimizer': 'adam', 'graph_mode': 'off', 'use_snp_selection': True, 'num_snps': 4445}. Best is trial 91 with value: 0.11023223552186984.
[I 2025-12-05 15:00:47,374] Trial 94 finished with value: 0.0889491810956163 and parameters: {'model_type': 'mlp', 'hidden_dims': '[128, 64]', 'dropout': 0.3047482689539976, 'batch_norm': False, 'lr': 8.045929655973934e-05, 'weight_decay': 0.000999437642180634, 'epochs': 134, 'loss': 'mse', 'optimizer': 'adam', 'graph_mode': 'off', 'use_snp_selection': True, 'num_snps': 4700}. Best is trial 91 with value: 0.11023223552186984.
[I 2025-12-05 15:00:48,327] Trial 95 finished with value: 0.08766440973342492 and parameters: {'model_type': 'mlp', 'hidden_dims': '[128, 64]', 'dropout': 0.3189542902783565, 'batch_norm': False, 'lr': 5.181640348543805e-05, 'weight_decay': 0.0006159698443057453, 'epochs': 335, 'loss': 'mse', 'optimizer': 'adam', 'graph_mode': 'off', 'use_snp_selection': True, 'num_snps': 3677}. Best is trial 91 with value: 0.11023223552186984.
[I 2025-12-05 15:00:49,563] Trial 96 finished with value: 0.10170160541980411 and parameters: {'model_type': 'mlp', 'hidden_dims': '[128, 64]', 'dropout': 0.3587503799892972, 'batch_norm': False, 'lr': 5.922343061470093e-05, 'weight_decay': 0.0004195732687657325, 'epochs': 342, 'loss': 'mse', 'optimizer': 'adam', 'graph_mode': 'off', 'use_snp_selection': True, 'num_snps': 12273}. Best is trial 91 with value: 0.11023223552186984.
[I 2025-12-05 15:00:50,709] Trial 97 finished with value: 0.08417531678993219 and parameters: {'model_type': 'mlp', 'hidden_dims': '[128, 64]', 'dropout': 0.2867881226551806, 'batch_norm': False, 'lr': 5.957468089324642e-05, 'weight_decay': 0.0007871142905656215, 'epochs': 342, 'loss': 'mse', 'optimizer': 'adam', 'graph_mode': 'off', 'use_snp_selection': True, 'num_snps': 9761}. Best is trial 91 with value: 0.11023223552186984.
[I 2025-12-05 15:00:52,041] Trial 98 finished with value: 0.08522626650561882 and parameters: {'model_type': 'mlp', 'hidden_dims': '[512, 256]', 'dropout': 0.38435770488291504, 'batch_norm': False, 'lr': 7.2779982311164e-05, 'weight_decay': 0.00043531970907544683, 'epochs': 350, 'loss': 'mse', 'optimizer': 'adam', 'graph_mode': 'off', 'use_snp_selection': True, 'num_snps': 14040}. Best is trial 91 with value: 0.11023223552186984.
[I 2025-12-05 15:00:53,021] Trial 99 finished with value: 0.09981556004903623 and parameters: {'model_type': 'mlp', 'hidden_dims': '[256, 128]', 'dropout': 0.32863268542756646, 'batch_norm': False, 'lr': 9.08644761594246e-05, 'weight_decay': 0.0005428378235965439, 'epochs': 316, 'loss': 'mse', 'optimizer': 'adam', 'graph_mode': 'off', 'use_snp_selection': True, 'num_snps': 4504}. Best is trial 91 with value: 0.11023223552186984.
[I 2025-12-05 15:00:54,341] Trial 100 finished with value: 0.08846173597160971 and parameters: {'model_type': 'mlp', 'hidden_dims': '[256, 128]', 'dropout': 0.30497114171503265, 'batch_norm': False, 'lr': 8.498417199401561e-05, 'weight_decay': 0.0005441167611046079, 'epochs': 333, 'loss': 'mse', 'optimizer': 'adam', 'graph_mode': 'off', 'use_snp_selection': False}. Best is trial 91 with value: 0.11023223552186984.
[I 2025-12-05 15:00:55,262] Trial 101 finished with value: 0.1025799640427838 and parameters: {'model_type': 'mlp', 'hidden_dims': '[256, 128]', 'dropout': 0.3504031654823662, 'batch_norm': False, 'lr': 9.500087249718987e-05, 'weight_decay': 0.0008177484339725052, 'epochs': 318, 'loss': 'mse', 'optimizer': 'adam', 'graph_mode': 'off', 'use_snp_selection': True, 'num_snps': 2583}. Best is trial 91 with value: 0.11023223552186984.
[I 2025-12-05 15:00:56,216] Trial 102 finished with value: 0.066394457176513 and parameters: {'model_type': 'mlp', 'hidden_dims': '[256, 128]', 'dropout': 0.34964193924849357, 'batch_norm': False, 'lr': 4.527494303893925e-05, 'weight_decay': 0.0008594126593660751, 'epochs': 342, 'loss': 'mse', 'optimizer': 'adam', 'graph_mode': 'off', 'use_snp_selection': True, 'num_snps': 2764}. Best is trial 91 with value: 0.11023223552186984.
[I 2025-12-05 15:00:57,446] Trial 103 finished with value: 0.09026086765955019 and parameters: {'model_type': 'mlp', 'hidden_dims': '[256, 128]', 'dropout': 0.3713971225979371, 'batch_norm': False, 'lr': 0.00012297191301175313, 'weight_decay': 0.00039807076822303303, 'epochs': 315, 'loss': 'mse', 'optimizer': 'adam', 'graph_mode': 'off', 'use_snp_selection': True, 'num_snps': 12926}. Best is trial 91 with value: 0.11023223552186984.
[I 2025-12-05 15:00:58,430] Trial 104 finished with value: 0.09568205884704077 and parameters: {'model_type': 'mlp', 'hidden_dims': '[256, 128]', 'dropout': 0.3273234987518496, 'batch_norm': False, 'lr': 9.832438286671644e-05, 'weight_decay': 1.8780470045495395e-05, 'epochs': 326, 'loss': 'mse', 'optimizer': 'adam', 'graph_mode': 'off', 'use_snp_selection': True, 'num_snps': 4406}. Best is trial 91 with value: 0.11023223552186984.
[I 2025-12-05 15:00:59,432] Trial 105 finished with value: 0.09330560105956613 and parameters: {'model_type': 'mlp', 'hidden_dims': '[256, 128]', 'dropout': 0.3503407100363536, 'batch_norm': False, 'lr': 0.00018115970618744944, 'weight_decay': 0.0007551810718287143, 'epochs': 337, 'loss': 'mse', 'optimizer': 'adam', 'graph_mode': 'off', 'use_snp_selection': True, 'num_snps': 4813}. Best is trial 91 with value: 0.11023223552186984.
[I 2025-12-05 15:01:00,461] Trial 106 finished with value: 0.10601817041138976 and parameters: {'model_type': 'mlp', 'hidden_dims': '[256, 128]', 'dropout': 0.4088179340673601, 'batch_norm': False, 'lr': 6.93337832482878e-05, 'weight_decay': 0.0006084811858214842, 'epochs': 308, 'loss': 'mse', 'optimizer': 'adam', 'graph_mode': 'off', 'use_snp_selection': True, 'num_snps': 7198}. Best is trial 91 with value: 0.11023223552186984.
[I 2025-12-05 15:01:01,516] Trial 107 finished with value: 0.09133581882860503 and parameters: {'model_type': 'mlp', 'hidden_dims': '[256, 128]', 'dropout': 0.42206130696630845, 'batch_norm': False, 'lr': 0.00010106336324405817, 'weight_decay': 0.0006300333381619722, 'epochs': 305, 'loss': 'mse', 'optimizer': 'adam', 'graph_mode': 'off', 'use_snp_selection': True, 'num_snps': 8287}. Best is trial 91 with value: 0.11023223552186984.
[I 2025-12-05 15:01:02,578] Trial 108 finished with value: 0.0998523861299289 and parameters: {'model_type': 'mlp', 'hidden_dims': '[256, 128]', 'dropout': 0.4041449407694197, 'batch_norm': False, 'lr': 6.998856796985772e-05, 'weight_decay': 0.0004915503374656009, 'epochs': 343, 'loss': 'mse', 'optimizer': 'adam', 'graph_mode': 'off', 'use_snp_selection': True, 'num_snps': 6547}. Best is trial 91 with value: 0.11023223552186984.
[I 2025-12-05 15:01:03,778] Trial 109 finished with value: 0.06544442829418 and parameters: {'model_type': 'mlp', 'hidden_dims': '[256, 128]', 'dropout': 0.452164288169676, 'batch_norm': False, 'lr': 7.005564795033204e-05, 'weight_decay': 0.0004998912384888311, 'epochs': 316, 'loss': 'mse', 'optimizer': 'adam', 'graph_mode': 'off', 'use_snp_selection': True, 'num_snps': 12211}. Best is trial 91 with value: 0.11023223552186984.
[I 2025-12-05 15:01:04,810] Trial 110 finished with value: 0.09862974154994536 and parameters: {'model_type': 'mlp', 'hidden_dims': '[256, 128]', 'dropout': 0.40387860738805625, 'batch_norm': False, 'lr': 4.073335448699038e-05, 'weight_decay': 0.000791873820692828, 'epochs': 332, 'loss': 'mse', 'optimizer': 'adam', 'graph_mode': 'off', 'use_snp_selection': True, 'num_snps': 6595}. Best is trial 91 with value: 0.11023223552186984.
[I 2025-12-05 15:01:05,837] Trial 111 finished with value: 0.09289804495005555 and parameters: {'model_type': 'mlp', 'hidden_dims': '[256, 128]', 'dropout': 0.44318897985232936, 'batch_norm': False, 'lr': 3.911250956959976e-05, 'weight_decay': 0.0008386359402359929, 'epochs': 331, 'loss': 'mse', 'optimizer': 'adam', 'graph_mode': 'off', 'use_snp_selection': True, 'num_snps': 6352}. Best is trial 91 with value: 0.11023223552186984.
[I 2025-12-05 15:01:07,029] Trial 112 finished with value: 0.07579238790251631 and parameters: {'model_type': 'mlp', 'hidden_dims': '[256, 128]', 'dropout': 0.39400539359498654, 'batch_norm': False, 'lr': 5.613215398271967e-05, 'weight_decay': 0.0006031428177457116, 'epochs': 344, 'loss': 'mse', 'optimizer': 'adam', 'graph_mode': 'off', 'use_snp_selection': True, 'num_snps': 10244}. Best is trial 91 with value: 0.11023223552186984.
[I 2025-12-05 15:01:08,107] Trial 113 finished with value: 0.09917844454237841 and parameters: {'model_type': 'mlp', 'hidden_dims': '[256, 128]', 'dropout': 0.40904075000718315, 'batch_norm': False, 'lr': 8.888948453571218e-05, 'weight_decay': 1.618570571416076e-07, 'epochs': 325, 'loss': 'mse', 'optimizer': 'adam', 'graph_mode': 'off', 'use_snp_selection': True, 'num_snps': 7287}. Best is trial 91 with value: 0.11023223552186984.
[I 2025-12-05 15:01:09,159] Trial 114 finished with value: 0.08580210652850201 and parameters: {'model_type': 'mlp', 'hidden_dims': '[256, 128]', 'dropout': 0.4075752452876805, 'batch_norm': False, 'lr': 9.156802250366721e-05, 'weight_decay': 0.0003970494792621774, 'epochs': 311, 'loss': 'mse', 'optimizer': 'adam', 'graph_mode': 'off', 'use_snp_selection': True, 'num_snps': 7529}. Best is trial 91 with value: 0.11023223552186984.
[I 2025-12-05 15:01:10,145] Trial 115 finished with value: 0.07532605656123764 and parameters: {'model_type': 'mlp', 'hidden_dims': '[256, 128]', 'dropout': 0.4577788519328298, 'batch_norm': False, 'lr': 7.052334959927239e-05, 'weight_decay': 0.0009080669852431614, 'epochs': 324, 'loss': 'mse', 'optimizer': 'adam', 'graph_mode': 'off', 'use_snp_selection': True, 'num_snps': 5210}. Best is trial 91 with value: 0.11023223552186984.
[I 2025-12-05 15:01:11,066] Trial 116 finished with value: 0.08947968134775802 and parameters: {'model_type': 'mlp', 'hidden_dims': '[256, 128]', 'dropout': 0.42414195619675493, 'batch_norm': False, 'lr': 0.00010952544521141818, 'weight_decay': 2.4588635280405057e-07, 'epochs': 335, 'loss': 'mse', 'optimizer': 'adam', 'graph_mode': 'off', 'use_snp_selection': True, 'num_snps': 2225}. Best is trial 91 with value: 0.11023223552186984.
[I 2025-12-05 15:01:12,324] Trial 117 finished with value: 0.08430219408758936 and parameters: {'model_type': 'mlp', 'hidden_dims': '[256, 128]', 'dropout': 0.4110717752367952, 'batch_norm': False, 'lr': 0.00013305381793746684, 'weight_decay': 0.0007434155406210706, 'epochs': 302, 'loss': 'mse', 'optimizer': 'adam', 'graph_mode': 'off', 'use_snp_selection': False}. Best is trial 91 with value: 0.11023223552186984.
[I 2025-12-05 15:01:13,258] Trial 118 finished with value: 0.07855840352483978 and parameters: {'model_type': 'mlp', 'hidden_dims': '[256, 128]', 'dropout': 0.40391935610571844, 'batch_norm': False, 'lr': 7.824424916181337e-05, 'weight_decay': 0.0004861372407970566, 'epochs': 316, 'loss': 'mse', 'optimizer': 'adam', 'graph_mode': 'off', 'use_snp_selection': True, 'num_snps': 3491}. Best is trial 91 with value: 0.11023223552186984.
[I 2025-12-05 15:01:14,297] Trial 119 finished with value: 0.08947670787187995 and parameters: {'model_type': 'mlp', 'hidden_dims': '[256, 128]', 'dropout': 0.37473656694199836, 'batch_norm': False, 'lr': 4.667704405761393e-05, 'weight_decay': 2.6086761372932024e-06, 'epochs': 327, 'loss': 'mse', 'optimizer': 'adam', 'graph_mode': 'off', 'use_snp_selection': True, 'num_snps': 6824}. Best is trial 91 with value: 0.11023223552186984.
[I 2025-12-05 15:01:15,378] Trial 120 finished with value: 0.09303752313050899 and parameters: {'model_type': 'mlp', 'hidden_dims': '[256, 128]', 'dropout': 0.3859354571840919, 'batch_norm': False, 'lr': 6.278049905802129e-05, 'weight_decay': 1.194993234390861e-06, 'epochs': 309, 'loss': 'mse', 'optimizer': 'adam', 'graph_mode': 'off', 'use_snp_selection': True, 'num_snps': 9116}. Best is trial 91 with value: 0.11023223552186984.
[I 2025-12-05 15:01:16,413] Trial 121 finished with value: 0.10243246478353527 and parameters: {'model_type': 'mlp', 'hidden_dims': '[256, 128]', 'dropout': 0.3625637997589633, 'batch_norm': False, 'lr': 2.8474062401918656e-05, 'weight_decay': 5.495505260413909e-06, 'epochs': 341, 'loss': 'mse', 'optimizer': 'adam', 'graph_mode': 'off', 'use_snp_selection': True, 'num_snps': 5418}. Best is trial 91 with value: 0.11023223552186984.
[I 2025-12-05 15:01:17,440] Trial 122 finished with value: 0.08532839856461598 and parameters: {'model_type': 'mlp', 'hidden_dims': '[256, 128]', 'dropout': 0.3634142976501857, 'batch_norm': False, 'lr': 3.0002675390908824e-05, 'weight_decay': 1.0683118750884828e-07, 'epochs': 341, 'loss': 'mse', 'optimizer': 'adam', 'graph_mode': 'off', 'use_snp_selection': True, 'num_snps': 5341}. Best is trial 91 with value: 0.11023223552186984.
[I 2025-12-05 15:01:18,414] Trial 123 finished with value: 0.09658445444927069 and parameters: {'model_type': 'mlp', 'hidden_dims': '[256, 128]', 'dropout': 0.4316872965869028, 'batch_norm': False, 'lr': 8.937067042407897e-05, 'weight_decay': 4.054614039560111e-06, 'epochs': 331, 'loss': 'mse', 'optimizer': 'adam', 'graph_mode': 'off', 'use_snp_selection': True, 'num_snps': 4291}. Best is trial 91 with value: 0.11023223552186984.
[I 2025-12-05 15:01:19,455] Trial 124 finished with value: 0.08750292481654046 and parameters: {'model_type': 'mlp', 'hidden_dims': '[256, 128]', 'dropout': 0.358817513107929, 'batch_norm': False, 'lr': 4.120502035246783e-05, 'weight_decay': 6.746554789213208e-07, 'epochs': 319, 'loss': 'mse', 'optimizer': 'adam', 'graph_mode': 'off', 'use_snp_selection': True, 'num_snps': 7384}. Best is trial 91 with value: 0.11023223552186984.
[I 2025-12-05 15:01:20,544] Trial 125 finished with value: 0.07961230596281868 and parameters: {'model_type': 'mlp', 'hidden_dims': '[256, 128]', 'dropout': 0.34289981413432336, 'batch_norm': False, 'lr': 5.5946920746480805e-05, 'weight_decay': 1.833341142967888e-07, 'epochs': 339, 'loss': 'mse', 'optimizer': 'adam', 'graph_mode': 'off', 'use_snp_selection': True, 'num_snps': 8316}. Best is trial 91 with value: 0.11023223552186984.
[I 2025-12-05 15:01:21,785] Trial 126 finished with value: 0.07850877813196172 and parameters: {'model_type': 'mlp', 'hidden_dims': '[512, 256]', 'dropout': 0.39096794278332153, 'batch_norm': False, 'lr': 0.00011100036451944921, 'weight_decay': 0.000993340139796952, 'epochs': 328, 'loss': 'mse', 'optimizer': 'adam', 'graph_mode': 'off', 'use_snp_selection': True, 'num_snps': 11490}. Best is trial 91 with value: 0.11023223552186984.
[I 2025-12-05 15:01:22,816] Trial 127 finished with value: 0.0726072491242697 and parameters: {'model_type': 'mlp', 'hidden_dims': '[256, 128]', 'dropout': 0.37692860517752413, 'batch_norm': False, 'lr': 3.5612844216390077e-05, 'weight_decay': 0.00032620036985092437, 'epochs': 344, 'loss': 'mse', 'optimizer': 'adam', 'graph_mode': 'off', 'use_snp_selection': True, 'num_snps': 5714}. Best is trial 91 with value: 0.11023223552186984.
[I 2025-12-05 15:01:23,791] Trial 128 finished with value: 0.07169654425623564 and parameters: {'model_type': 'mlp', 'hidden_dims': '[256, 128]', 'dropout': 0.32372529170939635, 'batch_norm': False, 'lr': 4.815946164890803e-05, 'weight_decay': 0.0005586103630186783, 'epochs': 336, 'loss': 'mse', 'optimizer': 'adam', 'graph_mode': 'off', 'use_snp_selection': True, 'num_snps': 3359}. Best is trial 91 with value: 0.11023223552186984.
[I 2025-12-05 15:01:25,216] Trial 129 finished with value: 0.07295710780291557 and parameters: {'model_type': 'mlp', 'hidden_dims': '[512, 256]', 'dropout': 0.5751817178258657, 'batch_norm': False, 'lr': 1.9798628522151306e-05, 'weight_decay': 6.418361197454823e-06, 'epochs': 322, 'loss': 'mse', 'optimizer': 'adam', 'graph_mode': 'off', 'use_snp_selection': True, 'num_snps': 17378}. Best is trial 91 with value: 0.11023223552186984.
[I 2025-12-05 15:01:26,151] Trial 130 finished with value: 0.10304430234292801 and parameters: {'model_type': 'mlp', 'hidden_dims': '[512, 128]', 'dropout': 0.41516620077413013, 'batch_norm': False, 'lr': 7.811561006145779e-05, 'weight_decay': 0.0004156381010879885, 'epochs': 350, 'loss': 'mse', 'optimizer': 'adam', 'graph_mode': 'off', 'use_snp_selection': True, 'num_snps': 2099}. Best is trial 91 with value: 0.11023223552186984.
[I 2025-12-05 15:01:27,165] Trial 131 finished with value: 0.06975378285560652 and parameters: {'model_type': 'mlp', 'hidden_dims': '[512, 128]', 'dropout': 0.41439296351691723, 'batch_norm': False, 'lr': 7.94939693212573e-05, 'weight_decay': 0.00041934675406841927, 'epochs': 345, 'loss': 'mse', 'optimizer': 'adam', 'graph_mode': 'off', 'use_snp_selection': True, 'num_snps': 4148}. Best is trial 91 with value: 0.11023223552186984.
[I 2025-12-05 15:01:28,088] Trial 132 finished with value: 0.1204660768663533 and parameters: {'model_type': 'mlp', 'hidden_dims': '[512, 128]', 'dropout': 0.4409967714508144, 'batch_norm': False, 'lr': 6.98605756062751e-05, 'weight_decay': 4.981125311732264e-07, 'epochs': 335, 'loss': 'mse', 'optimizer': 'adam', 'graph_mode': 'off', 'use_snp_selection': True, 'num_snps': 2196}. Best is trial 132 with value: 0.1204660768663533.
[I 2025-12-05 15:01:29,038] Trial 133 finished with value: 0.08207726472668538 and parameters: {'model_type': 'mlp', 'hidden_dims': '[512, 128]', 'dropout': 0.4729343839918581, 'batch_norm': False, 'lr': 6.571062521772196e-05, 'weight_decay': 4.6166027294151386e-07, 'epochs': 350, 'loss': 'mse', 'optimizer': 'adam', 'graph_mode': 'off', 'use_snp_selection': True, 'num_snps': 2584}. Best is trial 132 with value: 0.1204660768663533.
[I 2025-12-05 15:01:30,053] Trial 134 finished with value: 0.09716017362308454 and parameters: {'model_type': 'mlp', 'hidden_dims': '[512, 128]', 'dropout': 0.43936853705800577, 'batch_norm': False, 'lr': 9.461995092847215e-05, 'weight_decay': 1.5827981592261378e-07, 'epochs': 339, 'loss': 'mse', 'optimizer': 'adam', 'graph_mode': 'off', 'use_snp_selection': True, 'num_snps': 5302}. Best is trial 132 with value: 0.1204660768663533.
[I 2025-12-05 15:01:30,960] Trial 135 finished with value: 0.1022685301162791 and parameters: {'model_type': 'mlp', 'hidden_dims': '[512, 128]', 'dropout': 0.4627622917711671, 'batch_norm': False, 'lr': 7.159331476765144e-05, 'weight_decay': 9.955614336227577e-07, 'epochs': 325, 'loss': 'mse', 'optimizer': 'adam', 'graph_mode': 'off', 'use_snp_selection': True, 'num_snps': 2076}. Best is trial 132 with value: 0.1204660768663533.
[I 2025-12-05 15:01:31,879] Trial 136 finished with value: 0.09837766249908682 and parameters: {'model_type': 'mlp', 'hidden_dims': '[512, 128]', 'dropout': 0.5017886158172431, 'batch_norm': False, 'lr': 7.013188025579374e-05, 'weight_decay': 3.496646734992306e-07, 'epochs': 335, 'loss': 'mse', 'optimizer': 'adam', 'graph_mode': 'off', 'use_snp_selection': True, 'num_snps': 2170}. Best is trial 132 with value: 0.1204660768663533.
