[I 2025-12-05 14:54:01,258] Trial 132 finished with value: 0.03877551254083397 and parameters: {'model_type': 'mlp', 'hidden_dims': '[512, 256]', 'dropout': 0.23281376086937894, 'batch_norm': True, 'lr': 0.0003655559589450879, 'weight_decay': 9.393453516033277e-07, 'epochs': 72, 'loss': 'mse', 'optimizer': 'adam', 'graph_mode': 'off', 'use_snp_selection': False}. Best is trial 124 with value: 0.07475205604466417.
[I 2025-12-05 14:54:02,401] Trial 133 finished with value: 0.06038156903187222 and parameters: {'model_type': 'mlp', 'hidden_dims': '[512, 64]', 'dropout': 0.20264783507788175, 'batch_norm': True, 'lr': 0.0007244692332862265, 'weight_decay': 6.712017703643958e-07, 'epochs': 80, 'loss': 'mse', 'optimizer': 'adam', 'graph_mode': 'off', 'use_snp_selection': False}. Best is trial 124 with value: 0.07475205604466417.
[I 2025-12-05 14:54:03,281] Trial 134 finished with value: 0.054734908028468796 and parameters: {'model_type': 'mlp', 'hidden_dims': '[256, 128, 64]', 'dropout': 0.2261838326250061, 'batch_norm': True, 'lr': 0.0003056277458359626, 'weight_decay': 1.5297520036018576e-06, 'epochs': 87, 'loss': 'mse', 'optimizer': 'adam', 'graph_mode': 'off', 'use_snp_selection': False}. Best is trial 124 with value: 0.07475205604466417.
[I 2025-12-05 14:54:04,331] Trial 135 finished with value: 0.06427822977052576 and parameters: {'model_type': 'mlp', 'hidden_dims': '[512, 256]', 'dropout': 0.2505102918460649, 'batch_norm': True, 'lr': 0.0006040459234200937, 'weight_decay': 3.438737833574494e-07, 'epochs': 58, 'loss': 'mse', 'optimizer': 'adam', 'graph_mode': 'off', 'use_snp_selection': False}. Best is trial 124 with value: 0.07475205604466417.
[I 2025-12-05 14:54:05,390] Trial 136 finished with value: 0.06531057422148706 and parameters: {'model_type': 'mlp', 'hidden_dims': '[512, 256]', 'dropout': 0.24187568498456652, 'batch_norm': True, 'lr': 0.0008739456887431, 'weight_decay': 3.270163163634619e-07, 'epochs': 57, 'loss': 'mse', 'optimizer': 'adam', 'graph_mode': 'off', 'use_snp_selection': False}. Best is trial 124 with value: 0.07475205604466417.
[I 2025-12-05 14:54:06,421] Trial 137 finished with value: 0.05131761335668583 and parameters: {'model_type': 'mlp', 'hidden_dims': '[512, 256]', 'dropout': 0.28293771612562485, 'batch_norm': True, 'lr': 0.0009363466535012962, 'weight_decay': 3.2733335847463725e-07, 'epochs': 51, 'loss': 'mse', 'optimizer': 'adam', 'graph_mode': 'off', 'use_snp_selection': False}. Best is trial 124 with value: 0.07475205604466417.
[I 2025-12-05 14:54:07,480] Trial 138 finished with value: 0.06272642814200108 and parameters: {'model_type': 'mlp', 'hidden_dims': '[512, 256]', 'dropout': 0.25292474966495687, 'batch_norm': True, 'lr': 0.0005186454290152749, 'weight_decay': 5.610963859222243e-07, 'epochs': 60, 'loss': 'mse', 'optimizer': 'adam', 'graph_mode': 'off', 'use_snp_selection': False}. Best is trial 124 with value: 0.07475205604466417.
[I 2025-12-05 14:54:08,479] Trial 139 finished with value: 0.049131217237903736 and parameters: {'model_type': 'mlp', 'hidden_dims': '[512, 256]', 'dropout': 0.3001915306928304, 'batch_norm': True, 'lr': 0.0008101041470900722, 'weight_decay': 3.69548097738301e-07, 'epochs': 46, 'loss': 'mse', 'optimizer': 'adam', 'graph_mode': 'off', 'use_snp_selection': False}. Best is trial 124 with value: 0.07475205604466417.
[I 2025-12-05 14:54:09,529] Trial 140 finished with value: -0.06314090039466208 and parameters: {'model_type': 'mlp', 'hidden_dims': '[512, 256]', 'dropout': 0.25167775304136675, 'batch_norm': False, 'lr': 0.0006249835110274345, 'weight_decay': 5.102963252879193e-07, 'epochs': 59, 'loss': 'mse', 'optimizer': 'adam', 'graph_mode': 'off', 'use_snp_selection': False}. Best is trial 124 with value: 0.07475205604466417.
[I 2025-12-05 14:54:10,571] Trial 141 finished with value: 0.04585686089982363 and parameters: {'model_type': 'mlp', 'hidden_dims': '[512, 256]', 'dropout': 0.2632296023099541, 'batch_norm': True, 'lr': 0.0005159119898308642, 'weight_decay': 2.909145052506632e-07, 'epochs': 64, 'loss': 'mse', 'optimizer': 'adam', 'graph_mode': 'off', 'use_snp_selection': False}. Best is trial 124 with value: 0.07475205604466417.
[I 2025-12-05 14:54:11,580] Trial 142 finished with value: 0.05066466438995439 and parameters: {'model_type': 'mlp', 'hidden_dims': '[512, 256]', 'dropout': 0.24184087083045458, 'batch_norm': True, 'lr': 0.0004166876240605723, 'weight_decay': 8.238797671722351e-07, 'epochs': 57, 'loss': 'mse', 'optimizer': 'adam', 'graph_mode': 'off', 'use_snp_selection': False}. Best is trial 124 with value: 0.07475205604466417.
[I 2025-12-05 14:54:12,515] Trial 143 finished with value: 0.04612762839539228 and parameters: {'model_type': 'mlp', 'hidden_dims': '[512, 256]', 'dropout': 0.21828204433563594, 'batch_norm': True, 'lr': 0.0005942744934353353, 'weight_decay': 5.459276503067992e-07, 'epochs': 40, 'loss': 'mse', 'optimizer': 'adam', 'graph_mode': 'off', 'use_snp_selection': False}. Best is trial 124 with value: 0.07475205604466417.
[I 2025-12-05 14:54:13,590] Trial 144 finished with value: 0.04865525676073507 and parameters: {'model_type': 'mlp', 'hidden_dims': '[512, 256]', 'dropout': 0.27425580282798806, 'batch_norm': True, 'lr': 0.0007394450388074103, 'weight_decay': 3.6811599745881056e-07, 'epochs': 72, 'loss': 'mse', 'optimizer': 'adam', 'graph_mode': 'off', 'use_snp_selection': False}. Best is trial 124 with value: 0.07475205604466417.
[I 2025-12-05 14:54:14,580] Trial 145 finished with value: 0.061998315136966346 and parameters: {'model_type': 'mlp', 'hidden_dims': '[512, 64]', 'dropout': 0.33774962501152933, 'batch_norm': True, 'lr': 0.0004937108921931853, 'weight_decay': 2.728920768438452e-07, 'epochs': 53, 'loss': 'mse', 'optimizer': 'adam', 'graph_mode': 'off', 'use_snp_selection': False}. Best is trial 124 with value: 0.07475205604466417.
[I 2025-12-05 14:54:15,705] Trial 146 finished with value: 0.048845285382442934 and parameters: {'model_type': 'mlp', 'hidden_dims': '[512, 256]', 'dropout': 0.23519600637449312, 'batch_norm': True, 'lr': 0.0003459824332619009, 'weight_decay': 6.37929948145265e-07, 'epochs': 83, 'loss': 'mse', 'optimizer': 'adam', 'graph_mode': 'off', 'use_snp_selection': False}. Best is trial 124 with value: 0.07475205604466417.
[I 2025-12-05 14:54:16,745] Trial 147 finished with value: 0.05403685799043711 and parameters: {'model_type': 'mlp', 'hidden_dims': '[512, 256]', 'dropout': 0.20794544031598255, 'batch_norm': True, 'lr': 0.0002445504721207129, 'weight_decay': 9.055920873901616e-07, 'epochs': 64, 'loss': 'mse', 'optimizer': 'adam', 'graph_mode': 'off', 'use_snp_selection': False}. Best is trial 124 with value: 0.07475205604466417.
[I 2025-12-05 14:54:17,710] Trial 148 finished with value: 0.06632017383144655 and parameters: {'model_type': 'mlp', 'hidden_dims': '[512, 64]', 'dropout': 0.19534580749101854, 'batch_norm': True, 'lr': 0.0006623244361315412, 'weight_decay': 2.404723310675752e-07, 'epochs': 47, 'loss': 'mse', 'optimizer': 'adam', 'graph_mode': 'off', 'use_snp_selection': False}. Best is trial 124 with value: 0.07475205604466417.
[I 2025-12-05 14:54:18,670] Trial 149 finished with value: 0.07186419491304709 and parameters: {'model_type': 'mlp', 'hidden_dims': '[512, 64]', 'dropout': 0.19964897027769726, 'batch_norm': True, 'lr': 0.0008381652672592266, 'weight_decay': 2.1680545941914945e-07, 'epochs': 46, 'loss': 'mse', 'optimizer': 'adam', 'graph_mode': 'off', 'use_snp_selection': False}. Best is trial 124 with value: 0.07475205604466417.
[I 2025-12-05 14:54:20,971] Trial 0 finished with value: 0.052212242821585306 and parameters: {'model_type': 'mlp', 'hidden_dims': '[128, 64]', 'dropout': 0.199031432379812, 'batch_norm': True, 'lr': 1.8408544111075837e-06, 'weight_decay': 5.5136510071208614e-05, 'epochs': 336, 'loss': 'mae', 'optimizer': 'adam', 'graph_mode': 'off', 'use_snp_selection': True, 'num_snps': 43862}. Best is trial 0 with value: 0.052212242821585306.
[I 2025-12-05 14:54:22,058] Trial 1 finished with value: 0.13565292475818033 and parameters: {'model_type': 'mlp', 'hidden_dims': '[256, 128]', 'dropout': 0.4370668075331726, 'batch_norm': True, 'lr': 7.133471581159139e-05, 'weight_decay': 1.128633586803549e-05, 'epochs': 242, 'loss': 'mae', 'optimizer': 'adam', 'graph_mode': 'off', 'use_snp_selection': False}. Best is trial 1 with value: 0.13565292475818033.
[I 2025-12-05 14:54:23,055] Trial 2 finished with value: 0.045207758207593866 and parameters: {'model_type': 'mlp', 'hidden_dims': '[256, 128, 64]', 'dropout': 0.41314357415569625, 'batch_norm': False, 'lr': 3.952233718592101e-06, 'weight_decay': 0.00026754769258252603, 'epochs': 149, 'loss': 'mse', 'optimizer': 'adam', 'graph_mode': 'off', 'use_snp_selection': True, 'num_snps': 11571}. Best is trial 1 with value: 0.13565292475818033.
[I 2025-12-05 14:54:24,881] Trial 3 finished with value: 0.11228738216102917 and parameters: {'model_type': 'mlp', 'hidden_dims': '[512, 64]', 'dropout': 0.5938127374509361, 'batch_norm': False, 'lr': 5.67704586114731e-06, 'weight_decay': 2.4518087630137052e-05, 'epochs': 320, 'loss': 'mae', 'optimizer': 'adam', 'graph_mode': 'off', 'use_snp_selection': False}. Best is trial 1 with value: 0.13565292475818033.
[I 2025-12-05 14:54:27,041] Trial 4 finished with value: 0.012464834015461803 and parameters: {'model_type': 'mlp', 'hidden_dims': '[512, 128]', 'dropout': 0.25746343592134413, 'batch_norm': True, 'lr': 1.3467657668402788e-06, 'weight_decay': 0.00033087251918647806, 'epochs': 277, 'loss': 'mse', 'optimizer': 'adam', 'graph_mode': 'off', 'use_snp_selection': True, 'num_snps': 36675}. Best is trial 1 with value: 0.13565292475818033.
[I 2025-12-05 14:54:28,759] Trial 5 finished with value: 0.03784104336750711 and parameters: {'model_type': 'mlp', 'hidden_dims': '[512, 64]', 'dropout': 0.38275350994408375, 'batch_norm': True, 'lr': 1.5586664309232824e-06, 'weight_decay': 0.0008227664668621182, 'epochs': 145, 'loss': 'mae', 'optimizer': 'adam', 'graph_mode': 'off', 'use_snp_selection': True, 'num_snps': 32148}. Best is trial 1 with value: 0.13565292475818033.
[I 2025-12-05 14:54:29,740] Trial 6 finished with value: 0.12733500873352263 and parameters: {'model_type': 'mlp', 'hidden_dims': '[256, 128]', 'dropout': 0.3930109900265879, 'batch_norm': False, 'lr': 4.892964372128395e-05, 'weight_decay': 1.5809549317992182e-06, 'epochs': 199, 'loss': 'mse', 'optimizer': 'adam', 'graph_mode': 'off', 'use_snp_selection': False}. Best is trial 1 with value: 0.13565292475818033.
[I 2025-12-05 14:54:30,816] Trial 7 finished with value: 0.12750024078134795 and parameters: {'model_type': 'mlp', 'hidden_dims': '[512, 256]', 'dropout': 0.15343979219678458, 'batch_norm': True, 'lr': 6.234003099047341e-05, 'weight_decay': 3.894760610535477e-07, 'epochs': 97, 'loss': 'mse', 'optimizer': 'adam', 'graph_mode': 'off', 'use_snp_selection': False}. Best is trial 1 with value: 0.13565292475818033.
[I 2025-12-05 14:54:32,657] Trial 8 finished with value: 0.1580145905583642 and parameters: {'model_type': 'mlp', 'hidden_dims': '[512, 128]', 'dropout': 0.10743001231661406, 'batch_norm': True, 'lr': 0.00023728538449271062, 'weight_decay': 1.7629071578048637e-05, 'epochs': 312, 'loss': 'mae', 'optimizer': 'adam', 'graph_mode': 'off', 'use_snp_selection': False}. Best is trial 8 with value: 0.1580145905583642.
[I 2025-12-05 14:54:34,013] Trial 9 finished with value: 0.12926662817054366 and parameters: {'model_type': 'mlp', 'hidden_dims': '[512, 64]', 'dropout': 0.14505336736221927, 'batch_norm': True, 'lr': 5.8619638388111826e-05, 'weight_decay': 6.200156172669308e-07, 'epochs': 175, 'loss': 'mse', 'optimizer': 'adam', 'graph_mode': 'off', 'use_snp_selection': False}. Best is trial 8 with value: 0.1580145905583642.
[I 2025-12-05 14:54:34,949] Trial 10 finished with value: 0.03312680305962319 and parameters: {'model_type': 'mlp', 'hidden_dims': '[512, 128]', 'dropout': 0.2800030442581858, 'batch_norm': False, 'lr': 0.0004919806695968258, 'weight_decay': 2.9953888095455486e-06, 'epochs': 55, 'loss': 'mae', 'optimizer': 'adam', 'graph_mode': 'off', 'use_snp_selection': False}. Best is trial 8 with value: 0.1580145905583642.
[I 2025-12-05 14:54:36,023] Trial 11 finished with value: 0.1476736669391336 and parameters: {'model_type': 'mlp', 'hidden_dims': '[256, 128]', 'dropout': 0.5025533409127559, 'batch_norm': True, 'lr': 0.0004219456914890788, 'weight_decay': 7.0869802591332905e-06, 'epochs': 239, 'loss': 'mae', 'optimizer': 'adam', 'graph_mode': 'off', 'use_snp_selection': False}. Best is trial 8 with value: 0.1580145905583642.
[I 2025-12-05 14:54:37,696] Trial 12 finished with value: 0.14562656666536844 and parameters: {'model_type': 'mlp', 'hidden_dims': '[512, 128]', 'dropout': 0.5266996967984326, 'batch_norm': True, 'lr': 0.0006753264773209732, 'weight_decay': 4.19780668911197e-06, 'epochs': 268, 'loss': 'mae', 'optimizer': 'adam', 'graph_mode': 'off', 'use_snp_selection': False}. Best is trial 8 with value: 0.1580145905583642.
[I 2025-12-05 14:54:38,750] Trial 13 finished with value: 0.13597926932825494 and parameters: {'model_type': 'mlp', 'hidden_dims': '[256, 128]', 'dropout': 0.4928303937946425, 'batch_norm': True, 'lr': 0.00023284399572303963, 'weight_decay': 5.9577988329204815e-05, 'epochs': 229, 'loss': 'mae', 'optimizer': 'adam', 'graph_mode': 'off', 'use_snp_selection': False}. Best is trial 8 with value: 0.1580145905583642.
[I 2025-12-05 14:54:40,546] Trial 14 finished with value: 0.14109973596416336 and parameters: {'model_type': 'mlp', 'hidden_dims': '[512, 256]', 'dropout': 0.3136114216535987, 'batch_norm': True, 'lr': 0.0002108574938852793, 'weight_decay': 1.1414924884997386e-07, 'epochs': 303, 'loss': 'mae', 'optimizer': 'adam', 'graph_mode': 'off', 'use_snp_selection': False}. Best is trial 8 with value: 0.1580145905583642.
[I 2025-12-05 14:54:41,519] Trial 15 finished with value: 0.0970920558957868 and parameters: {'model_type': 'mlp', 'hidden_dims': '[128, 64]', 'dropout': 0.10515697852451877, 'batch_norm': True, 'lr': 1.5062894231391345e-05, 'weight_decay': 1.2913386141637801e-05, 'epochs': 288, 'loss': 'mae', 'optimizer': 'adam', 'graph_mode': 'off', 'use_snp_selection': False}. Best is trial 8 with value: 0.1580145905583642.
[I 2025-12-05 14:54:42,828] Trial 16 finished with value: 0.13594220983136338 and parameters: {'model_type': 'mlp', 'hidden_dims': '[256, 128, 64]', 'dropout': 0.5005119296100804, 'batch_norm': True, 'lr': 0.0002109405277580196, 'weight_decay': 3.394774551181372e-05, 'epochs': 350, 'loss': 'mae', 'optimizer': 'adam', 'graph_mode': 'off', 'use_snp_selection': False}. Best is trial 8 with value: 0.1580145905583642.
[I 2025-12-05 14:54:43,902] Trial 17 finished with value: 0.14663662623999926 and parameters: {'model_type': 'mlp', 'hidden_dims': '[256, 128]', 'dropout': 0.5880183703863877, 'batch_norm': True, 'lr': 0.000906375209920231, 'weight_decay': 4.89787697464901e-06, 'epochs': 239, 'loss': 'mae', 'optimizer': 'adam', 'graph_mode': 'off', 'use_snp_selection': False}. Best is trial 8 with value: 0.1580145905583642.
[I 2025-12-05 14:54:46,951] Trial 18 finished with value: 0.1403634571090623 and parameters: {'model_type': 'mlp', 'hidden_dims': '[512, 128]', 'dropout': 0.2312628506238401, 'batch_norm': False, 'lr': 0.00035236530245378494, 'weight_decay': 0.00014228638081031626, 'epochs': 219, 'loss': 'mae', 'optimizer': 'adam', 'graph_mode': 'off', 'use_snp_selection': True, 'num_snps': 58241}. Best is trial 8 with value: 0.1580145905583642.
[I 2025-12-05 14:54:48,630] Trial 19 finished with value: 0.15052170134716902 and parameters: {'model_type': 'mlp', 'hidden_dims': '[512, 128]', 'dropout': 0.32433267656546405, 'batch_norm': True, 'lr': 0.00011765466542116184, 'weight_decay': 1.2526486787416928e-06, 'epochs': 270, 'loss': 'mae', 'optimizer': 'adam', 'graph_mode': 'off', 'use_snp_selection': False}. Best is trial 8 with value: 0.1580145905583642.
[I 2025-12-05 14:54:50,450] Trial 20 finished with value: 0.08482264651232388 and parameters: {'model_type': 'mlp', 'hidden_dims': '[512, 128]', 'dropout': 0.32672274124528133, 'batch_norm': True, 'lr': 1.64655195956836e-05, 'weight_decay': 7.926000687424931e-07, 'epochs': 311, 'loss': 'mae', 'optimizer': 'adam', 'graph_mode': 'off', 'use_snp_selection': False}. Best is trial 8 with value: 0.1580145905583642.
[I 2025-12-05 14:54:52,086] Trial 21 finished with value: 0.13922937204603836 and parameters: {'model_type': 'mlp', 'hidden_dims': '[512, 128]', 'dropout': 0.4549617692632199, 'batch_norm': True, 'lr': 0.0001233861441709155, 'weight_decay': 1.793508350188934e-06, 'epochs': 258, 'loss': 'mae', 'optimizer': 'adam', 'graph_mode': 'off', 'use_snp_selection': False}. Best is trial 8 with value: 0.1580145905583642.
[I 2025-12-05 14:54:53,834] Trial 22 finished with value: 0.12287569336910659 and parameters: {'model_type': 'mlp', 'hidden_dims': '[512, 128]', 'dropout': 0.356763842330047, 'batch_norm': True, 'lr': 0.00011830056657880426, 'weight_decay': 7.1520648661748165e-06, 'epochs': 290, 'loss': 'mae', 'optimizer': 'adam', 'graph_mode': 'off', 'use_snp_selection': False}. Best is trial 8 with value: 0.1580145905583642.
[I 2025-12-05 14:54:54,838] Trial 23 finished with value: 0.13627332787316776 and parameters: {'model_type': 'mlp', 'hidden_dims': '[256, 128]', 'dropout': 0.5496778370509414, 'batch_norm': True, 'lr': 0.00033960901640007373, 'weight_decay': 1.6341257260541017e-05, 'epochs': 200, 'loss': 'mae', 'optimizer': 'adam', 'graph_mode': 'off', 'use_snp_selection': False}. Best is trial 8 with value: 0.1580145905583642.
[I 2025-12-05 14:54:56,483] Trial 24 finished with value: 0.14765718916508813 and parameters: {'model_type': 'mlp', 'hidden_dims': '[512, 128]', 'dropout': 0.1931388605747305, 'batch_norm': True, 'lr': 0.00012933696064794652, 'weight_decay': 3.1809187762604956e-07, 'epochs': 261, 'loss': 'mae', 'optimizer': 'adam', 'graph_mode': 'off', 'use_snp_selection': False}. Best is trial 8 with value: 0.1580145905583642.
[I 2025-12-05 14:54:58,408] Trial 25 finished with value: 0.13069607779971357 and parameters: {'model_type': 'mlp', 'hidden_dims': '[512, 256]', 'dropout': 0.29454585361009933, 'batch_norm': True, 'lr': 2.2168892545127015e-05, 'weight_decay': 1.574387895730515e-06, 'epochs': 327, 'loss': 'mae', 'optimizer': 'adam', 'graph_mode': 'off', 'use_snp_selection': False}. Best is trial 8 with value: 0.1580145905583642.
[I 2025-12-05 14:54:59,556] Trial 26 finished with value: 0.1434464797721469 and parameters: {'model_type': 'mlp', 'hidden_dims': '[256, 128, 64]', 'dropout': 0.10351500682854528, 'batch_norm': True, 'lr': 0.0004672235444146006, 'weight_decay': 1.0045875988581692e-07, 'epochs': 297, 'loss': 'mae', 'optimizer': 'adam', 'graph_mode': 'off', 'use_snp_selection': True, 'num_snps': 3842}. Best is trial 8 with value: 0.1580145905583642.
[I 2025-12-05 14:55:00,394] Trial 27 finished with value: 0.08502690064436647 and parameters: {'model_type': 'mlp', 'hidden_dims': '[128, 64]', 'dropout': 0.467597904148852, 'batch_norm': False, 'lr': 0.0009306514453180804, 'weight_decay': 2.502820389878854e-06, 'epochs': 213, 'loss': 'mse', 'optimizer': 'adam', 'graph_mode': 'off', 'use_snp_selection': False}. Best is trial 8 with value: 0.1580145905583642.
[I 2025-12-05 14:55:01,363] Trial 28 finished with value: 0.12064407923819356 and parameters: {'model_type': 'mlp', 'hidden_dims': '[256, 128]', 'dropout': 0.22313273524020316, 'batch_norm': True, 'lr': 2.9308644470163137e-05, 'weight_decay': 6.860721426230553e-06, 'epochs': 163, 'loss': 'mae', 'optimizer': 'adam', 'graph_mode': 'off', 'use_snp_selection': False}. Best is trial 8 with value: 0.1580145905583642.
[I 2025-12-05 14:55:02,798] Trial 29 finished with value: 0.12848031369445312 and parameters: {'model_type': 'mlp', 'hidden_dims': '[128, 64]', 'dropout': 0.35326367173312906, 'batch_norm': True, 'lr': 0.0001634563881496579, 'weight_decay': 7.556740997596572e-05, 'epochs': 249, 'loss': 'mae', 'optimizer': 'adam', 'graph_mode': 'off', 'use_snp_selection': True, 'num_snps': 19468}. Best is trial 8 with value: 0.1580145905583642.
[I 2025-12-05 14:55:04,676] Trial 30 finished with value: 0.1540880746039305 and parameters: {'model_type': 'mlp', 'hidden_dims': '[512, 128]', 'dropout': 0.17120640438582652, 'batch_norm': True, 'lr': 0.00028497071274528245, 'weight_decay': 2.921051526427599e-05, 'epochs': 327, 'loss': 'mae', 'optimizer': 'adam', 'graph_mode': 'off', 'use_snp_selection': False}. Best is trial 8 with value: 0.1580145905583642.
[I 2025-12-05 14:55:06,629] Trial 31 finished with value: 0.16121570367139137 and parameters: {'model_type': 'mlp', 'hidden_dims': '[512, 128]', 'dropout': 0.16182739119272377, 'batch_norm': True, 'lr': 0.0003494024594304256, 'weight_decay': 3.3406090670391176e-05, 'epochs': 350, 'loss': 'mae', 'optimizer': 'adam', 'graph_mode': 'off', 'use_snp_selection': False}. Best is trial 31 with value: 0.16121570367139137.
[I 2025-12-05 14:55:08,568] Trial 32 finished with value: 0.14541455439137124 and parameters: {'model_type': 'mlp', 'hidden_dims': '[512, 128]', 'dropout': 0.17288187695169338, 'batch_norm': True, 'lr': 0.0002751069568933992, 'weight_decay': 3.119466696355761e-05, 'epochs': 347, 'loss': 'mae', 'optimizer': 'adam', 'graph_mode': 'off', 'use_snp_selection': False}. Best is trial 31 with value: 0.16121570367139137.
[I 2025-12-05 14:55:10,521] Trial 33 finished with value: 0.13420610389505355 and parameters: {'model_type': 'mlp', 'hidden_dims': '[512, 128]', 'dropout': 0.1277890732175124, 'batch_norm': True, 'lr': 8.613404321373549e-05, 'weight_decay': 8.89659833191761e-05, 'epochs': 335, 'loss': 'mae', 'optimizer': 'adam', 'graph_mode': 'off', 'use_snp_selection': False}. Best is trial 31 with value: 0.16121570367139137.
