[I 2025-12-05 16:26:42,451] Trial 86 finished with value: 0.09221458129187819 and parameters: {'model_type': 'mlp', 'hidden_dims': '[512, 256]', 'dropout': 0.16955526288375655, 'batch_norm': True, 'lr': 1.8710181091967382e-05, 'weight_decay': 5.495620442273899e-06, 'epochs': 79, 'loss': 'mae', 'optimizer': 'adam', 'graph_mode': 'off', 'use_snp_selection': False}. Best is trial 86 with value: 0.09221458129187819.
[I 2025-12-05 16:26:43,521] Trial 87 finished with value: 0.019000124979578918 and parameters: {'model_type': 'mlp', 'hidden_dims': '[512, 256]', 'dropout': 0.177820974892246, 'batch_norm': True, 'lr': 1.5171877239724693e-05, 'weight_decay': 6.187293189236922e-06, 'epochs': 82, 'loss': 'mae', 'optimizer': 'adam', 'graph_mode': 'off', 'use_snp_selection': False}. Best is trial 86 with value: 0.09221458129187819.
[I 2025-12-05 16:26:44,536] Trial 88 finished with value: 0.0328693575925117 and parameters: {'model_type': 'mlp', 'hidden_dims': '[512, 256]', 'dropout': 0.10182193776286108, 'batch_norm': True, 'lr': 1.835983460921159e-05, 'weight_decay': 1.021351956204031e-05, 'epochs': 68, 'loss': 'mae', 'optimizer': 'adam', 'graph_mode': 'off', 'use_snp_selection': False}. Best is trial 86 with value: 0.09221458129187819.
[I 2025-12-05 16:26:45,620] Trial 89 finished with value: 0.047230889231916706 and parameters: {'model_type': 'mlp', 'hidden_dims': '[512, 256]', 'dropout': 0.16370429870314512, 'batch_norm': True, 'lr': 3.776729112365221e-05, 'weight_decay': 4.929399259393747e-06, 'epochs': 90, 'loss': 'mae', 'optimizer': 'adam', 'graph_mode': 'off', 'use_snp_selection': False}. Best is trial 86 with value: 0.09221458129187819.
[I 2025-12-05 16:26:46,561] Trial 90 finished with value: 0.07848011892884164 and parameters: {'model_type': 'mlp', 'hidden_dims': '[512, 256]', 'dropout': 0.20737995705455292, 'batch_norm': True, 'lr': 2.987912765097279e-05, 'weight_decay': 1.8497327513131547e-05, 'epochs': 49, 'loss': 'mae', 'optimizer': 'adam', 'graph_mode': 'off', 'use_snp_selection': False}. Best is trial 86 with value: 0.09221458129187819.
[I 2025-12-05 16:26:47,529] Trial 91 finished with value: 0.037183330965388145 and parameters: {'model_type': 'mlp', 'hidden_dims': '[512, 256]', 'dropout': 0.1958952727057789, 'batch_norm': True, 'lr': 2.9222308334261944e-05, 'weight_decay': 1.3080579804820148e-05, 'epochs': 57, 'loss': 'mae', 'optimizer': 'adam', 'graph_mode': 'off', 'use_snp_selection': False}. Best is trial 86 with value: 0.09221458129187819.
[I 2025-12-05 16:26:48,488] Trial 92 finished with value: 0.008715135550010822 and parameters: {'model_type': 'mlp', 'hidden_dims': '[512, 256]', 'dropout': 0.13884940650684247, 'batch_norm': True, 'lr': 9.931855410606852e-06, 'weight_decay': 2.318519008038464e-05, 'epochs': 49, 'loss': 'mae', 'optimizer': 'adam', 'graph_mode': 'off', 'use_snp_selection': False}. Best is trial 86 with value: 0.09221458129187819.
[I 2025-12-05 16:26:49,548] Trial 93 finished with value: 0.025151028701888383 and parameters: {'model_type': 'mlp', 'hidden_dims': '[512, 256]', 'dropout': 0.21014900774794248, 'batch_norm': True, 'lr': 2.057614612961182e-05, 'weight_decay': 1.9216525398476465e-05, 'epochs': 77, 'loss': 'mae', 'optimizer': 'adam', 'graph_mode': 'off', 'use_snp_selection': False}. Best is trial 86 with value: 0.09221458129187819.
[I 2025-12-05 16:26:50,522] Trial 94 finished with value: 0.06982022710255001 and parameters: {'model_type': 'mlp', 'hidden_dims': '[512, 256]', 'dropout': 0.12013363293752913, 'batch_norm': True, 'lr': 4.395936460200387e-05, 'weight_decay': 7.696518902803612e-06, 'epochs': 55, 'loss': 'mae', 'optimizer': 'adam', 'graph_mode': 'off', 'use_snp_selection': False}. Best is trial 86 with value: 0.09221458129187819.
[I 2025-12-05 16:26:51,494] Trial 95 finished with value: 0.030717020333460878 and parameters: {'model_type': 'mlp', 'hidden_dims': '[512, 256]', 'dropout': 0.12204993626494108, 'batch_norm': True, 'lr': 4.0859838618924036e-05, 'weight_decay': 8.0492547227036e-06, 'epochs': 55, 'loss': 'mae', 'optimizer': 'adam', 'graph_mode': 'off', 'use_snp_selection': False}. Best is trial 86 with value: 0.09221458129187819.
[I 2025-12-05 16:26:52,411] Trial 96 finished with value: 0.053459727451113874 and parameters: {'model_type': 'mlp', 'hidden_dims': '[512, 256]', 'dropout': 0.14646754321875394, 'batch_norm': True, 'lr': 4.793736247907733e-05, 'weight_decay': 4.214983562915881e-06, 'epochs': 42, 'loss': 'mae', 'optimizer': 'adam', 'graph_mode': 'off', 'use_snp_selection': False}. Best is trial 86 with value: 0.09221458129187819.
[I 2025-12-05 16:26:53,360] Trial 97 finished with value: 0.035609583306404596 and parameters: {'model_type': 'mlp', 'hidden_dims': '[512, 256]', 'dropout': 0.13268632049689358, 'batch_norm': True, 'lr': 7.454743999859084e-05, 'weight_decay': 1.7064258191728625e-05, 'epochs': 51, 'loss': 'mae', 'optimizer': 'adam', 'graph_mode': 'off', 'use_snp_selection': False}. Best is trial 86 with value: 0.09221458129187819.
[I 2025-12-05 16:26:54,368] Trial 98 finished with value: 0.08130526032539637 and parameters: {'model_type': 'mlp', 'hidden_dims': '[512, 256]', 'dropout': 0.16804329964499637, 'batch_norm': True, 'lr': 3.3597462258091394e-05, 'weight_decay': 1.3271081008306729e-05, 'epochs': 66, 'loss': 'mae', 'optimizer': 'adam', 'graph_mode': 'off', 'use_snp_selection': False}. Best is trial 86 with value: 0.09221458129187819.
[I 2025-12-05 16:26:55,335] Trial 99 finished with value: 0.060031497729893864 and parameters: {'model_type': 'mlp', 'hidden_dims': '[512, 256]', 'dropout': 0.16928829552026803, 'batch_norm': True, 'lr': 2.4693708202044885e-05, 'weight_decay': 1.2074069399203723e-05, 'epochs': 64, 'loss': 'mae', 'optimizer': 'adam', 'graph_mode': 'off', 'use_snp_selection': False}. Best is trial 86 with value: 0.09221458129187819.
[I 2025-12-05 16:26:56,387] Trial 100 finished with value: 0.04353455241864667 and parameters: {'model_type': 'mlp', 'hidden_dims': '[512, 256]', 'dropout': 0.11200334951355567, 'batch_norm': True, 'lr': 3.353628349723189e-05, 'weight_decay': 5.723687156721784e-06, 'epochs': 79, 'loss': 'mae', 'optimizer': 'adam', 'graph_mode': 'off', 'use_snp_selection': False}. Best is trial 86 with value: 0.09221458129187819.
[I 2025-12-05 16:26:57,396] Trial 101 finished with value: 0.0215508753581372 and parameters: {'model_type': 'mlp', 'hidden_dims': '[512, 256]', 'dropout': 0.18823315954174777, 'batch_norm': True, 'lr': 5.465700808689589e-05, 'weight_decay': 3.725376258967652e-05, 'epochs': 63, 'loss': 'mae', 'optimizer': 'adam', 'graph_mode': 'off', 'use_snp_selection': False}. Best is trial 86 with value: 0.09221458129187819.
[I 2025-12-05 16:26:58,443] Trial 102 finished with value: 0.04291623511473505 and parameters: {'model_type': 'mlp', 'hidden_dims': '[512, 256]', 'dropout': 0.14548293482983682, 'batch_norm': True, 'lr': 4.575185186832147e-05, 'weight_decay': 3.052169959972511e-06, 'epochs': 73, 'loss': 'mae', 'optimizer': 'adam', 'graph_mode': 'off', 'use_snp_selection': False}. Best is trial 86 with value: 0.09221458129187819.
[I 2025-12-05 16:26:59,525] Trial 103 finished with value: 0.05814371219876784 and parameters: {'model_type': 'mlp', 'hidden_dims': '[512, 256]', 'dropout': 0.17563072109780303, 'batch_norm': True, 'lr': 6.260696394371432e-05, 'weight_decay': 9.317894105406506e-06, 'epochs': 87, 'loss': 'mae', 'optimizer': 'adam', 'graph_mode': 'off', 'use_snp_selection': False}. Best is trial 86 with value: 0.09221458129187819.
[I 2025-12-05 16:27:00,474] Trial 104 finished with value: 0.021960993209479477 and parameters: {'model_type': 'mlp', 'hidden_dims': '[512, 256]', 'dropout': 0.11953581283761465, 'batch_norm': True, 'lr': 2.8314591081229084e-05, 'weight_decay': 1.9644124567088773e-06, 'epochs': 51, 'loss': 'mae', 'optimizer': 'adam', 'graph_mode': 'off', 'use_snp_selection': False}. Best is trial 86 with value: 0.09221458129187819.
[I 2025-12-05 16:27:01,486] Trial 105 finished with value: 0.048689305940398234 and parameters: {'model_type': 'mlp', 'hidden_dims': '[512, 256]', 'dropout': 0.16517262383769155, 'batch_norm': True, 'lr': 3.74830969886178e-05, 'weight_decay': 1.3930228164658442e-05, 'epochs': 69, 'loss': 'mae', 'optimizer': 'adam', 'graph_mode': 'off', 'use_snp_selection': False}. Best is trial 86 with value: 0.09221458129187819.
[I 2025-12-05 16:27:02,595] Trial 106 finished with value: 0.02610075972849018 and parameters: {'model_type': 'mlp', 'hidden_dims': '[512, 256]', 'dropout': 0.20260935644642358, 'batch_norm': True, 'lr': 2.0101832865233695e-05, 'weight_decay': 8.815306102831914e-06, 'epochs': 94, 'loss': 'mae', 'optimizer': 'adam', 'graph_mode': 'off', 'use_snp_selection': False}. Best is trial 86 with value: 0.09221458129187819.
[I 2025-12-05 16:27:03,621] Trial 107 finished with value: 0.03010861015794243 and parameters: {'model_type': 'mlp', 'hidden_dims': '[512, 256]', 'dropout': 0.10003080906003775, 'batch_norm': True, 'lr': 3.1863637183771074e-05, 'weight_decay': 1.8504999737558574e-05, 'epochs': 78, 'loss': 'mae', 'optimizer': 'adam', 'graph_mode': 'off', 'use_snp_selection': False}. Best is trial 86 with value: 0.09221458129187819.
[I 2025-12-05 16:27:04,558] Trial 108 finished with value: 0.0513715567989445 and parameters: {'model_type': 'mlp', 'hidden_dims': '[512, 256]', 'dropout': 0.13775818237476886, 'batch_norm': True, 'lr': 2.433155003890916e-05, 'weight_decay': 5.052848266983975e-06, 'epochs': 44, 'loss': 'mae', 'optimizer': 'adam', 'graph_mode': 'off', 'use_snp_selection': False}. Best is trial 86 with value: 0.09221458129187819.
[I 2025-12-05 16:27:05,549] Trial 109 finished with value: 0.06857370751829187 and parameters: {'model_type': 'mlp', 'hidden_dims': '[512, 256]', 'dropout': 0.1586657372828901, 'batch_norm': True, 'lr': 4.222725424471785e-05, 'weight_decay': 3.820162895547894e-06, 'epochs': 58, 'loss': 'mae', 'optimizer': 'adam', 'graph_mode': 'off', 'use_snp_selection': False}. Best is trial 86 with value: 0.09221458129187819.
[I 2025-12-05 16:27:06,548] Trial 110 finished with value: 0.07152771378346441 and parameters: {'model_type': 'mlp', 'hidden_dims': '[512, 256]', 'dropout': 0.18599042329949278, 'batch_norm': True, 'lr': 4.13631315717207e-05, 'weight_decay': 3.5786207759009703e-06, 'epochs': 59, 'loss': 'mae', 'optimizer': 'adam', 'graph_mode': 'off', 'use_snp_selection': False}. Best is trial 86 with value: 0.09221458129187819.
[I 2025-12-05 16:27:07,472] Trial 111 finished with value: 0.005841802682987228 and parameters: {'model_type': 'mlp', 'hidden_dims': '[512, 256]', 'dropout': 0.2214890921014029, 'batch_norm': True, 'lr': 4.047756699731421e-05, 'weight_decay': 3.870402198077276e-06, 'epochs': 40, 'loss': 'mae', 'optimizer': 'adam', 'graph_mode': 'off', 'use_snp_selection': False}. Best is trial 86 with value: 0.09221458129187819.
[I 2025-12-05 16:27:08,458] Trial 112 finished with value: 0.05125055097330247 and parameters: {'model_type': 'mlp', 'hidden_dims': '[512, 256]', 'dropout': 0.18635431837423688, 'batch_norm': True, 'lr': 4.445845420911327e-05, 'weight_decay': 6.807709632555041e-06, 'epochs': 61, 'loss': 'mae', 'optimizer': 'adam', 'graph_mode': 'off', 'use_snp_selection': False}. Best is trial 86 with value: 0.09221458129187819.
[I 2025-12-05 16:27:09,410] Trial 113 finished with value: -0.025578887059525126 and parameters: {'model_type': 'mlp', 'hidden_dims': '[512, 256]', 'dropout': 0.15576735963314708, 'batch_norm': True, 'lr': 1.2558072467931526e-05, 'weight_decay': 5.419016179463458e-06, 'epochs': 52, 'loss': 'mae', 'optimizer': 'adam', 'graph_mode': 'off', 'use_snp_selection': False}. Best is trial 86 with value: 0.09221458129187819.
[I 2025-12-05 16:27:10,390] Trial 114 finished with value: 0.055301088619085316 and parameters: {'model_type': 'mlp', 'hidden_dims': '[512, 256]', 'dropout': 0.12521720677802395, 'batch_norm': True, 'lr': 3.251476910180848e-05, 'weight_decay': 2.344669693512318e-06, 'epochs': 58, 'loss': 'mae', 'optimizer': 'adam', 'graph_mode': 'off', 'use_snp_selection': False}. Best is trial 86 with value: 0.09221458129187819.
[I 2025-12-05 16:27:11,099] Trial 115 finished with value: 0.009485028664362936 and parameters: {'model_type': 'mlp', 'hidden_dims': '[128, 64]', 'dropout': 0.24202886820187458, 'batch_norm': True, 'lr': 2.7178563463112008e-05, 'weight_decay': 4.5673484117235455e-06, 'epochs': 82, 'loss': 'mae', 'optimizer': 'adam', 'graph_mode': 'off', 'use_snp_selection': False}. Best is trial 86 with value: 0.09221458129187819.
[I 2025-12-05 16:27:12,111] Trial 116 finished with value: 0.029377100974736572 and parameters: {'model_type': 'mlp', 'hidden_dims': '[512, 256]', 'dropout': 0.20119775670241732, 'batch_norm': True, 'lr': 7.755568341856528e-05, 'weight_decay': 3.371420691846012e-06, 'epochs': 64, 'loss': 'mae', 'optimizer': 'adam', 'graph_mode': 'off', 'use_snp_selection': False}. Best is trial 86 with value: 0.09221458129187819.
[I 2025-12-05 16:27:12,985] Trial 117 finished with value: 0.012310650205064163 and parameters: {'model_type': 'mlp', 'hidden_dims': '[256, 128, 64]', 'dropout': 0.16742998191953495, 'batch_norm': True, 'lr': 3.641264184359204e-05, 'weight_decay': 7.0004116686761876e-06, 'epochs': 101, 'loss': 'mae', 'optimizer': 'adam', 'graph_mode': 'off', 'use_snp_selection': False}. Best is trial 86 with value: 0.09221458129187819.
[I 2025-12-05 16:27:14,091] Trial 118 finished with value: 0.03267149698951802 and parameters: {'model_type': 'mlp', 'hidden_dims': '[512, 256]', 'dropout': 0.15414950113139836, 'batch_norm': True, 'lr': 2.262353811117975e-05, 'weight_decay': 1.0876111606244995e-05, 'epochs': 90, 'loss': 'mae', 'optimizer': 'adam', 'graph_mode': 'off', 'use_snp_selection': False}. Best is trial 86 with value: 0.09221458129187819.
[I 2025-12-05 16:27:16,085] Trial 119 finished with value: 0.042269716024151895 and parameters: {'model_type': 'mlp', 'hidden_dims': '[512, 256]', 'dropout': 0.1825246838449594, 'batch_norm': True, 'lr': 4.886819882158954e-05, 'weight_decay': 1.5001627327231757e-06, 'epochs': 350, 'loss': 'mae', 'optimizer': 'adam', 'graph_mode': 'off', 'use_snp_selection': False}. Best is trial 86 with value: 0.09221458129187819.
[I 2025-12-05 16:27:17,119] Trial 120 finished with value: 0.05329712618720772 and parameters: {'model_type': 'mlp', 'hidden_dims': '[512, 256]', 'dropout': 0.11411052071450997, 'batch_norm': True, 'lr': 6.253913997511472e-05, 'weight_decay': 2.501163324463169e-06, 'epochs': 75, 'loss': 'mae', 'optimizer': 'adam', 'graph_mode': 'off', 'use_snp_selection': False}. Best is trial 86 with value: 0.09221458129187819.
[I 2025-12-05 16:27:18,137] Trial 121 finished with value: 0.048588448099023525 and parameters: {'model_type': 'mlp', 'hidden_dims': '[512, 256]', 'dropout': 0.13424645717099354, 'batch_norm': True, 'lr': 5.852641317000703e-05, 'weight_decay': 4.856655118475369e-07, 'epochs': 68, 'loss': 'mae', 'optimizer': 'adam', 'graph_mode': 'off', 'use_snp_selection': False}. Best is trial 86 with value: 0.09221458129187819.
[I 2025-12-05 16:27:19,063] Trial 122 finished with value: 0.06792873325833694 and parameters: {'model_type': 'mlp', 'hidden_dims': '[512, 256]', 'dropout': 0.14851676487393592, 'batch_norm': True, 'lr': 5.1898245884464153e-05, 'weight_decay': 3.892647164686001e-07, 'epochs': 46, 'loss': 'mae', 'optimizer': 'adam', 'graph_mode': 'off', 'use_snp_selection': False}. Best is trial 86 with value: 0.09221458129187819.
[I 2025-12-05 16:27:19,959] Trial 123 finished with value: 0.04668416384927415 and parameters: {'model_type': 'mlp', 'hidden_dims': '[512, 256]', 'dropout': 0.148088280289824, 'batch_norm': True, 'lr': 0.0001019487880434757, 'weight_decay': 4.0158342710876196e-07, 'epochs': 47, 'loss': 'mae', 'optimizer': 'adam', 'graph_mode': 'off', 'use_snp_selection': False}. Best is trial 86 with value: 0.09221458129187819.
[I 2025-12-05 16:27:20,938] Trial 124 finished with value: 0.0675572077858283 and parameters: {'model_type': 'mlp', 'hidden_dims': '[512, 256]', 'dropout': 0.2196401731363465, 'batch_norm': True, 'lr': 3.058744731643615e-05, 'weight_decay': 2.690259003184441e-07, 'epochs': 55, 'loss': 'mae', 'optimizer': 'adam', 'graph_mode': 'off', 'use_snp_selection': False}. Best is trial 86 with value: 0.09221458129187819.
[I 2025-12-05 16:27:21,921] Trial 125 finished with value: -0.016117577657894122 and parameters: {'model_type': 'mlp', 'hidden_dims': '[512, 256]', 'dropout': 0.2694526819309424, 'batch_norm': True, 'lr': 1.6425305461876357e-05, 'weight_decay': 2.1458774552103976e-07, 'epochs': 55, 'loss': 'mae', 'optimizer': 'adam', 'graph_mode': 'off', 'use_snp_selection': False}. Best is trial 86 with value: 0.09221458129187819.
[I 2025-12-05 16:27:22,854] Trial 126 finished with value: 0.019469579519022975 and parameters: {'model_type': 'mlp', 'hidden_dims': '[512, 256]', 'dropout': 0.2238340581795222, 'batch_norm': True, 'lr': 2.987118073692107e-05, 'weight_decay': 1.614193243847683e-07, 'epochs': 40, 'loss': 'mae', 'optimizer': 'adam', 'graph_mode': 'off', 'use_snp_selection': False}. Best is trial 86 with value: 0.09221458129187819.
[I 2025-12-05 16:27:23,535] Trial 127 finished with value: 0.045021159383046405 and parameters: {'model_type': 'mlp', 'hidden_dims': '[128, 64]', 'dropout': 0.19421891669059738, 'batch_norm': True, 'lr': 3.770768298483027e-05, 'weight_decay': 2.6297528436462146e-07, 'epochs': 48, 'loss': 'mae', 'optimizer': 'adam', 'graph_mode': 'off', 'use_snp_selection': False}. Best is trial 86 with value: 0.09221458129187819.
[I 2025-12-05 16:27:24,524] Trial 128 finished with value: -0.0030744067060680205 and parameters: {'model_type': 'mlp', 'hidden_dims': '[512, 256]', 'dropout': 0.17431051427847835, 'batch_norm': True, 'lr': 2.334368647315283e-05, 'weight_decay': 1.1376504374745175e-07, 'epochs': 60, 'loss': 'mae', 'optimizer': 'adam', 'graph_mode': 'off', 'use_snp_selection': False}. Best is trial 86 with value: 0.09221458129187819.
[I 2025-12-05 16:27:25,290] Trial 129 finished with value: 0.026249978588104187 and parameters: {'model_type': 'mlp', 'hidden_dims': '[256, 128, 64]', 'dropout': 0.21328684531501468, 'batch_norm': True, 'lr': 1.880233715350527e-05, 'weight_decay': 1.5840451511053633e-05, 'epochs': 55, 'loss': 'mae', 'optimizer': 'adam', 'graph_mode': 'off', 'use_snp_selection': False}. Best is trial 86 with value: 0.09221458129187819.
[I 2025-12-05 16:27:26,357] Trial 130 finished with value: 0.05892538033370771 and parameters: {'model_type': 'mlp', 'hidden_dims': '[512, 256]', 'dropout': 0.15910693411703894, 'batch_norm': True, 'lr': 2.8138224495723637e-05, 'weight_decay': 2.2223279633506164e-05, 'epochs': 84, 'loss': 'mae', 'optimizer': 'adam', 'graph_mode': 'off', 'use_snp_selection': False}. Best is trial 86 with value: 0.09221458129187819.
[I 2025-12-05 16:27:27,386] Trial 131 finished with value: 0.025466385549112302 and parameters: {'model_type': 'mlp', 'hidden_dims': '[512, 256]', 'dropout': 0.11055921885026901, 'batch_norm': True, 'lr': 4.4752912610198384e-05, 'weight_decay': 3.7857346892752243e-07, 'epochs': 67, 'loss': 'mae', 'optimizer': 'adam', 'graph_mode': 'off', 'use_snp_selection': False}. Best is trial 86 with value: 0.09221458129187819.
[I 2025-12-05 16:27:28,424] Trial 132 finished with value: 0.03839671723548319 and parameters: {'model_type': 'mlp', 'hidden_dims': '[512, 256]', 'dropout': 0.1264636637094883, 'batch_norm': True, 'lr': 5.310703808925889e-05, 'weight_decay': 1.2129774340292782e-05, 'epochs': 71, 'loss': 'mae', 'optimizer': 'adam', 'graph_mode': 'off', 'use_snp_selection': False}. Best is trial 86 with value: 0.09221458129187819.
[I 2025-12-05 16:27:29,421] Trial 133 finished with value: 0.050565296096269745 and parameters: {'model_type': 'mlp', 'hidden_dims': '[512, 256]', 'dropout': 0.24720187044854705, 'batch_norm': True, 'lr': 3.350397605032355e-05, 'weight_decay': 2.8952340733903816e-07, 'epochs': 58, 'loss': 'mae', 'optimizer': 'adam', 'graph_mode': 'off', 'use_snp_selection': False}. Best is trial 86 with value: 0.09221458129187819.
[I 2025-12-05 16:27:30,384] Trial 134 finished with value: 0.02014156172217891 and parameters: {'model_type': 'mlp', 'hidden_dims': '[512, 256]', 'dropout': 0.16915134275004878, 'batch_norm': True, 'lr': 4.953308334969567e-05, 'weight_decay': 6.660610529595739e-07, 'epochs': 49, 'loss': 'mae', 'optimizer': 'adam', 'graph_mode': 'off', 'use_snp_selection': False}. Best is trial 86 with value: 0.09221458129187819.
[I 2025-12-05 16:27:31,428] Trial 135 finished with value: 0.09721150571484476 and parameters: {'model_type': 'mlp', 'hidden_dims': '[512, 256]', 'dropout': 0.14640996543384185, 'batch_norm': True, 'lr': 4.0259776180126054e-05, 'weight_decay': 7.65356562167307e-06, 'epochs': 76, 'loss': 'mae', 'optimizer': 'adam', 'graph_mode': 'off', 'use_snp_selection': False}. Best is trial 135 with value: 0.09721150571484476.
[I 2025-12-05 16:27:32,467] Trial 136 finished with value: 0.023562031428321386 and parameters: {'model_type': 'mlp', 'hidden_dims': '[512, 256]', 'dropout': 0.18454982059623962, 'batch_norm': True, 'lr': 3.989400697590859e-05, 'weight_decay': 8.326387817633965e-06, 'epochs': 76, 'loss': 'mae', 'optimizer': 'adam', 'graph_mode': 'off', 'use_snp_selection': False}. Best is trial 135 with value: 0.09721150571484476.
[I 2025-12-05 16:27:33,451] Trial 137 finished with value: 0.05690003856664278 and parameters: {'model_type': 'mlp', 'hidden_dims': '[512, 64]', 'dropout': 0.1470331785572663, 'batch_norm': True, 'lr': 2.6241573402470408e-05, 'weight_decay': 6.057551563907795e-06, 'epochs': 61, 'loss': 'mae', 'optimizer': 'adam', 'graph_mode': 'off', 'use_snp_selection': False}. Best is trial 135 with value: 0.09721150571484476.
