[I 2025-12-06 02:06:39,700] Trial 62 finished with value: 0.23371992234303413 and parameters: {'model_type': 'mlp', 'hidden_dims': '[512, 64]', 'dropout': 0.32373567501654943, 'batch_norm': False, 'lr': 1.0663719008740583e-05, 'weight_decay': 2.865380847641754e-07, 'epochs': 136, 'loss': 'mae', 'optimizer': 'adam', 'graph_mode': 'off', 'use_snp_selection': True, 'num_snps': 35607}. Best is trial 61 with value: 0.23904441398023235.
[I 2025-12-06 02:07:25,740] Trial 63 finished with value: 0.2265111051718533 and parameters: {'model_type': 'mlp', 'hidden_dims': '[512, 64]', 'dropout': 0.2867185996104961, 'batch_norm': False, 'lr': 1.7349121606873896e-05, 'weight_decay': 3.3054001285832785e-07, 'epochs': 137, 'loss': 'mae', 'optimizer': 'adam', 'graph_mode': 'off', 'use_snp_selection': True, 'num_snps': 35048}. Best is trial 61 with value: 0.23904441398023235.
[I 2025-12-06 02:08:05,425] Trial 64 finished with value: 0.22509012446704868 and parameters: {'model_type': 'mlp', 'hidden_dims': '[512, 64]', 'dropout': 0.2662680633895031, 'batch_norm': False, 'lr': 8.907804809314207e-06, 'weight_decay': 5.311878484443143e-07, 'epochs': 115, 'loss': 'mae', 'optimizer': 'adam', 'graph_mode': 'off', 'use_snp_selection': True, 'num_snps': 28991}. Best is trial 61 with value: 0.23904441398023235.
[I 2025-12-06 02:08:53,849] Trial 65 finished with value: 0.23626430352762476 and parameters: {'model_type': 'mlp', 'hidden_dims': '[512, 64]', 'dropout': 0.3629666232503239, 'batch_norm': False, 'lr': 1.0487808133064983e-05, 'weight_decay': 2.0076512640116292e-07, 'epochs': 161, 'loss': 'mae', 'optimizer': 'adam', 'graph_mode': 'off', 'use_snp_selection': True, 'num_snps': 34920}. Best is trial 61 with value: 0.23904441398023235.
[I 2025-12-06 02:09:44,191] Trial 66 finished with value: 0.22743888578302524 and parameters: {'model_type': 'mlp', 'hidden_dims': '[512, 64]', 'dropout': 0.3716957238896995, 'batch_norm': False, 'lr': 1.0833278469181744e-05, 'weight_decay': 1.9102401305109e-07, 'epochs': 157, 'loss': 'mae', 'optimizer': 'adam', 'graph_mode': 'off', 'use_snp_selection': True, 'num_snps': 37412}. Best is trial 61 with value: 0.23904441398023235.
[I 2025-12-06 02:10:40,328] Trial 67 finished with value: 0.2111769215648817 and parameters: {'model_type': 'mlp', 'hidden_dims': '[512, 64]', 'dropout': 0.3910464607285916, 'batch_norm': True, 'lr': 1.1674935261641887e-05, 'weight_decay': 1.2889995022673375e-07, 'epochs': 182, 'loss': 'mae', 'optimizer': 'adam', 'graph_mode': 'off', 'use_snp_selection': True, 'num_snps': 40462}. Best is trial 61 with value: 0.23904441398023235.
[I 2025-12-06 02:11:26,731] Trial 68 finished with value: 0.22146502298651863 and parameters: {'model_type': 'mlp', 'hidden_dims': '[512, 64]', 'dropout': 0.3489154197916581, 'batch_norm': False, 'lr': 6.637478961229602e-06, 'weight_decay': 2.076156986983782e-07, 'epochs': 168, 'loss': 'mae', 'optimizer': 'adam', 'graph_mode': 'off', 'use_snp_selection': True, 'num_snps': 30959}. Best is trial 61 with value: 0.23904441398023235.
[I 2025-12-06 02:12:14,263] Trial 69 finished with value: 0.23024071937655707 and parameters: {'model_type': 'mlp', 'hidden_dims': '[512, 64]', 'dropout': 0.3048419873742936, 'batch_norm': False, 'lr': 1.8693077042999366e-05, 'weight_decay': 1.0413899484320122e-07, 'epochs': 147, 'loss': 'mae', 'optimizer': 'adam', 'graph_mode': 'off', 'use_snp_selection': True, 'num_snps': 35159}. Best is trial 61 with value: 0.23904441398023235.
[I 2025-12-06 02:13:07,664] Trial 70 finished with value: 0.2227682778768235 and parameters: {'model_type': 'mlp', 'hidden_dims': '[512, 64]', 'dropout': 0.30906479401383335, 'batch_norm': False, 'lr': 2.5346771078464277e-05, 'weight_decay': 1.2916325609573265e-07, 'epochs': 203, 'loss': 'mae', 'optimizer': 'adam', 'graph_mode': 'off', 'use_snp_selection': True, 'num_snps': 34737}. Best is trial 61 with value: 0.23904441398023235.
[I 2025-12-06 02:13:50,446] Trial 71 finished with value: 0.22781213397743477 and parameters: {'model_type': 'mlp', 'hidden_dims': '[512, 64]', 'dropout': 0.3288710839173965, 'batch_norm': False, 'lr': 1.7516221570353075e-05, 'weight_decay': 1.0685533622649104e-07, 'epochs': 147, 'loss': 'mae', 'optimizer': 'adam', 'graph_mode': 'off', 'use_snp_selection': True, 'num_snps': 28753}. Best is trial 61 with value: 0.23904441398023235.
[I 2025-12-06 02:14:37,896] Trial 72 finished with value: 0.23135881263743013 and parameters: {'model_type': 'mlp', 'hidden_dims': '[512, 64]', 'dropout': 0.29880171449903586, 'batch_norm': False, 'lr': 1.1372552091585494e-05, 'weight_decay': 3.0615547950579264e-07, 'epochs': 133, 'loss': 'mae', 'optimizer': 'adam', 'graph_mode': 'off', 'use_snp_selection': True, 'num_snps': 37640}. Best is trial 61 with value: 0.23904441398023235.
[I 2025-12-06 02:15:25,686] Trial 73 finished with value: 0.21089457411057871 and parameters: {'model_type': 'mlp', 'hidden_dims': '[512, 64]', 'dropout': 0.5682646150612471, 'batch_norm': False, 'lr': 3.505032864139003e-06, 'weight_decay': 2.9869264446272197e-07, 'epochs': 132, 'loss': 'mae', 'optimizer': 'adam', 'graph_mode': 'off', 'use_snp_selection': True, 'num_snps': 38129}. Best is trial 61 with value: 0.23904441398023235.
[I 2025-12-06 02:16:20,101] Trial 74 finished with value: 0.2272232783176536 and parameters: {'model_type': 'mlp', 'hidden_dims': '[512, 64]', 'dropout': 0.3536064130601065, 'batch_norm': False, 'lr': 1.0846878078406048e-05, 'weight_decay': 4.503470959946586e-07, 'epochs': 158, 'loss': 'mae', 'optimizer': 'adam', 'graph_mode': 'off', 'use_snp_selection': True, 'num_snps': 42435}. Best is trial 61 with value: 0.23904441398023235.
[I 2025-12-06 02:17:05,329] Trial 75 finished with value: 0.22161431034018117 and parameters: {'model_type': 'mlp', 'hidden_dims': '[512, 64]', 'dropout': 0.19974433902867, 'batch_norm': False, 'lr': 1.333450245142372e-05, 'weight_decay': 2.1703691362528342e-05, 'epochs': 141, 'loss': 'mae', 'optimizer': 'adam', 'graph_mode': 'off', 'use_snp_selection': True, 'num_snps': 32825}. Best is trial 61 with value: 0.23904441398023235.
[I 2025-12-06 02:17:56,417] Trial 76 finished with value: 0.22712865082995037 and parameters: {'model_type': 'mlp', 'hidden_dims': '[512, 64]', 'dropout': 0.29474224403546584, 'batch_norm': False, 'lr': 8.51694536876053e-06, 'weight_decay': 1.7442032404410912e-07, 'epochs': 174, 'loss': 'mae', 'optimizer': 'adam', 'graph_mode': 'off', 'use_snp_selection': True, 'num_snps': 36209}. Best is trial 61 with value: 0.23904441398023235.
[I 2025-12-06 02:18:44,277] Trial 77 finished with value: 0.22637357251171605 and parameters: {'model_type': 'mlp', 'hidden_dims': '[512, 64]', 'dropout': 0.2496745553000171, 'batch_norm': False, 'lr': 1.924233276763562e-05, 'weight_decay': 2.6990564318476116e-07, 'epochs': 126, 'loss': 'mae', 'optimizer': 'adam', 'graph_mode': 'off', 'use_snp_selection': True, 'num_snps': 39584}. Best is trial 61 with value: 0.23904441398023235.
[I 2025-12-06 02:19:27,837] Trial 78 finished with value: 0.21646324395345107 and parameters: {'model_type': 'mlp', 'hidden_dims': '[512, 64]', 'dropout': 0.33892101830629784, 'batch_norm': False, 'lr': 5.171217559003857e-06, 'weight_decay': 7.992305370673916e-07, 'epochs': 119, 'loss': 'mse', 'optimizer': 'adam', 'graph_mode': 'off', 'use_snp_selection': True, 'num_snps': 34224}. Best is trial 61 with value: 0.23904441398023235.
[I 2025-12-06 02:20:12,043] Trial 79 finished with value: 0.23702257683999126 and parameters: {'model_type': 'mlp', 'hidden_dims': '[512, 64]', 'dropout': 0.42510999336239463, 'batch_norm': False, 'lr': 9.161623655145948e-06, 'weight_decay': 3.7878688570994325e-07, 'epochs': 149, 'loss': 'mae', 'optimizer': 'adam', 'graph_mode': 'off', 'use_snp_selection': True, 'num_snps': 30599}. Best is trial 61 with value: 0.23904441398023235.
[I 2025-12-06 02:20:57,329] Trial 80 finished with value: 0.22903086587360638 and parameters: {'model_type': 'mlp', 'hidden_dims': '[512, 64]', 'dropout': 0.4214633908769001, 'batch_norm': False, 'lr': 9.178358140849196e-06, 'weight_decay': 3.69498965026629e-05, 'epochs': 150, 'loss': 'mae', 'optimizer': 'adam', 'graph_mode': 'off', 'use_snp_selection': True, 'num_snps': 32024}. Best is trial 61 with value: 0.23904441398023235.
[I 2025-12-06 02:21:39,499] Trial 81 finished with value: 0.23358986236174242 and parameters: {'model_type': 'mlp', 'hidden_dims': '[512, 64]', 'dropout': 0.458347167077046, 'batch_norm': False, 'lr': 1.4622166100444371e-05, 'weight_decay': 3.9953990008669366e-07, 'epochs': 132, 'loss': 'mae', 'optimizer': 'adam', 'graph_mode': 'off', 'use_snp_selection': True, 'num_snps': 30417}. Best is trial 61 with value: 0.23904441398023235.
[I 2025-12-06 02:22:19,590] Trial 82 finished with value: 0.225041943630446 and parameters: {'model_type': 'mlp', 'hidden_dims': '[512, 64]', 'dropout': 0.464978173357802, 'batch_norm': False, 'lr': 1.5243451796118637e-05, 'weight_decay': 4.035344740566809e-07, 'epochs': 132, 'loss': 'mae', 'optimizer': 'adam', 'graph_mode': 'off', 'use_snp_selection': True, 'num_snps': 27163}. Best is trial 61 with value: 0.23904441398023235.
[I 2025-12-06 02:23:02,914] Trial 83 finished with value: 0.21796691847005056 and parameters: {'model_type': 'mlp', 'hidden_dims': '[512, 64]', 'dropout': 0.46156989038226265, 'batch_norm': False, 'lr': 7.527927479671707e-06, 'weight_decay': 3.68967084778659e-07, 'epochs': 142, 'loss': 'mae', 'optimizer': 'adam', 'graph_mode': 'off', 'use_snp_selection': True, 'num_snps': 30211}. Best is trial 61 with value: 0.23904441398023235.
[I 2025-12-06 02:23:53,636] Trial 84 finished with value: 0.23320157866838925 and parameters: {'model_type': 'mlp', 'hidden_dims': '[512, 64]', 'dropout': 0.5270892747740886, 'batch_norm': False, 'lr': 2.3983395003784592e-05, 'weight_decay': 1.1419601074655704e-06, 'epochs': 166, 'loss': 'mae', 'optimizer': 'adam', 'graph_mode': 'off', 'use_snp_selection': True, 'num_snps': 36745}. Best is trial 61 with value: 0.23904441398023235.
[I 2025-12-06 02:24:40,752] Trial 85 finished with value: 0.2190940797603873 and parameters: {'model_type': 'mlp', 'hidden_dims': '[512, 64]', 'dropout': 0.5245671699422879, 'batch_norm': False, 'lr': 1.2446003778008706e-05, 'weight_decay': 9.710536198502018e-07, 'epochs': 109, 'loss': 'mae', 'optimizer': 'adam', 'graph_mode': 'off', 'use_snp_selection': True, 'num_snps': 41446}. Best is trial 61 with value: 0.23904441398023235.
[I 2025-12-06 02:25:33,877] Trial 86 finished with value: 0.2184540393311228 and parameters: {'model_type': 'mlp', 'hidden_dims': '[512, 64]', 'dropout': 0.5279700651407787, 'batch_norm': True, 'lr': 2.9670954395372532e-05, 'weight_decay': 5.211453128236553e-06, 'epochs': 182, 'loss': 'mae', 'optimizer': 'adam', 'graph_mode': 'off', 'use_snp_selection': True, 'num_snps': 37202}. Best is trial 61 with value: 0.23904441398023235.
[I 2025-12-06 02:26:13,060] Trial 87 finished with value: 0.20985529340184517 and parameters: {'model_type': 'mlp', 'hidden_dims': '[256, 128, 64]', 'dropout': 0.5510540932003309, 'batch_norm': False, 'lr': 2.4212185626537397e-05, 'weight_decay': 5.515043688360907e-07, 'epochs': 164, 'loss': 'mae', 'optimizer': 'adam', 'graph_mode': 'off', 'use_snp_selection': True, 'num_snps': 32153}. Best is trial 61 with value: 0.23904441398023235.
[I 2025-12-06 02:26:53,199] Trial 88 finished with value: 0.21872080450713116 and parameters: {'model_type': 'mlp', 'hidden_dims': '[512, 64]', 'dropout': 0.4740079997457335, 'batch_norm': False, 'lr': 9.928941706654705e-06, 'weight_decay': 1.1502844609304157e-06, 'epochs': 133, 'loss': 'mae', 'optimizer': 'adam', 'graph_mode': 'off', 'use_snp_selection': True, 'num_snps': 26384}. Best is trial 61 with value: 0.23904441398023235.
[I 2025-12-06 02:27:29,968] Trial 89 finished with value: 0.2319005367367512 and parameters: {'model_type': 'mlp', 'hidden_dims': '[256, 128]', 'dropout': 0.44862851581547913, 'batch_norm': False, 'lr': 1.5109322503577363e-05, 'weight_decay': 7.565291118632294e-07, 'epochs': 121, 'loss': 'mae', 'optimizer': 'adam', 'graph_mode': 'off', 'use_snp_selection': True, 'num_snps': 33018}. Best is trial 61 with value: 0.23904441398023235.
[I 2025-12-06 02:28:02,606] Trial 90 finished with value: 0.2124892178795203 and parameters: {'model_type': 'mlp', 'hidden_dims': '[256, 128]', 'dropout': 0.4402673855938474, 'batch_norm': False, 'lr': 6.127797931729228e-06, 'weight_decay': 1.422818899179965e-06, 'epochs': 121, 'loss': 'mae', 'optimizer': 'adam', 'graph_mode': 'off', 'use_snp_selection': True, 'num_snps': 23946}. Best is trial 61 with value: 0.23904441398023235.
[I 2025-12-06 02:28:41,634] Trial 91 finished with value: 0.22911759653660355 and parameters: {'model_type': 'mlp', 'hidden_dims': '[256, 128]', 'dropout': 0.4076956549979888, 'batch_norm': False, 'lr': 1.4855094534512628e-05, 'weight_decay': 7.605198966849174e-07, 'epochs': 154, 'loss': 'mae', 'optimizer': 'adam', 'graph_mode': 'off', 'use_snp_selection': True, 'num_snps': 33780}. Best is trial 61 with value: 0.23904441398023235.
[I 2025-12-06 02:29:18,695] Trial 92 finished with value: 0.22719953464567677 and parameters: {'model_type': 'mlp', 'hidden_dims': '[256, 128]', 'dropout': 0.4536624182881495, 'batch_norm': False, 'lr': 2.1333300355111666e-05, 'weight_decay': 2.6223021896451677e-07, 'epochs': 169, 'loss': 'mae', 'optimizer': 'adam', 'graph_mode': 'off', 'use_snp_selection': True, 'num_snps': 28196}. Best is trial 61 with value: 0.23904441398023235.
[I 2025-12-06 02:30:00,973] Trial 93 finished with value: 0.23059649424838335 and parameters: {'model_type': 'mlp', 'hidden_dims': '[512, 64]', 'dropout': 0.5109624042561063, 'batch_norm': False, 'lr': 1.2462568512838536e-05, 'weight_decay': 3.8883422093307824e-07, 'epochs': 129, 'loss': 'mae', 'optimizer': 'adam', 'graph_mode': 'off', 'use_snp_selection': True, 'num_snps': 30681}. Best is trial 61 with value: 0.23904441398023235.
[I 2025-12-06 02:30:40,152] Trial 94 finished with value: 0.22352610189762473 and parameters: {'model_type': 'mlp', 'hidden_dims': '[256, 128]', 'dropout': 0.4290112320078796, 'batch_norm': False, 'lr': 7.70562369923681e-06, 'weight_decay': 2.0799521559345867e-07, 'epochs': 139, 'loss': 'mae', 'optimizer': 'adam', 'graph_mode': 'off', 'use_snp_selection': True, 'num_snps': 36086}. Best is trial 61 with value: 0.23904441398023235.
[I 2025-12-06 02:31:36,833] Trial 95 finished with value: 0.22113038875530783 and parameters: {'model_type': 'mlp', 'hidden_dims': '[512, 64]', 'dropout': 0.37632210376103614, 'batch_norm': False, 'lr': 4.158254057615001e-06, 'weight_decay': 4.871461050073444e-07, 'epochs': 250, 'loss': 'mae', 'optimizer': 'adam', 'graph_mode': 'off', 'use_snp_selection': True, 'num_snps': 32960}. Best is trial 61 with value: 0.23904441398023235.
[I 2025-12-06 02:32:21,459] Trial 96 finished with value: 0.21727848790350293 and parameters: {'model_type': 'mlp', 'hidden_dims': '[512, 128]', 'dropout': 0.3926585660047741, 'batch_norm': False, 'lr': 1.0054948655599214e-05, 'weight_decay': 3.2924470191790177e-07, 'epochs': 104, 'loss': 'mse', 'optimizer': 'adam', 'graph_mode': 'off', 'use_snp_selection': True, 'num_snps': 38503}. Best is trial 61 with value: 0.23904441398023235.
[I 2025-12-06 02:33:16,521] Trial 97 finished with value: 0.2260159598781244 and parameters: {'model_type': 'mlp', 'hidden_dims': '[512, 64]', 'dropout': 0.4922885845903588, 'batch_norm': False, 'lr': 1.520167560151067e-05, 'weight_decay': 6.088120944444022e-07, 'epochs': 206, 'loss': 'mae', 'optimizer': 'adam', 'graph_mode': 'off', 'use_snp_selection': True, 'num_snps': 36494}. Best is trial 61 with value: 0.23904441398023235.
[I 2025-12-06 02:34:01,556] Trial 98 finished with value: 0.19905438630007438 and parameters: {'model_type': 'mlp', 'hidden_dims': '[512, 64]', 'dropout': 0.44987593801475295, 'batch_norm': True, 'lr': 2.688372656598643e-05, 'weight_decay': 1.560929749037153e-07, 'epochs': 159, 'loss': 'mae', 'optimizer': 'adam', 'graph_mode': 'off', 'use_snp_selection': True, 'num_snps': 30028}. Best is trial 61 with value: 0.23904441398023235.
[I 2025-12-06 02:34:48,982] Trial 99 finished with value: 0.22287841271001457 and parameters: {'model_type': 'mlp', 'hidden_dims': '[256, 128, 64]', 'dropout': 0.48225942881364203, 'batch_norm': False, 'lr': 3.312032659155967e-05, 'weight_decay': 6.96456815666518e-07, 'epochs': 301, 'loss': 'mae', 'optimizer': 'adam', 'graph_mode': 'off', 'use_snp_selection': True, 'num_snps': 33657}. Best is trial 61 with value: 0.23904441398023235.
[I 2025-12-06 02:35:31,224] Trial 100 finished with value: 0.22614509205391392 and parameters: {'model_type': 'mlp', 'hidden_dims': '[512, 64]', 'dropout': 0.4154804303219623, 'batch_norm': False, 'lr': 4.2327334371404096e-05, 'weight_decay': 1.2341655238483388e-05, 'epochs': 122, 'loss': 'mae', 'optimizer': 'adam', 'graph_mode': 'off', 'use_snp_selection': True, 'num_snps': 31930}. Best is trial 61 with value: 0.23904441398023235.
[I 2025-12-06 02:36:13,286] Trial 101 finished with value: 0.22209876451290875 and parameters: {'model_type': 'mlp', 'hidden_dims': '[512, 64]', 'dropout': 0.5098849117902313, 'batch_norm': False, 'lr': 1.22113365774581e-05, 'weight_decay': 4.394863167688197e-07, 'epochs': 129, 'loss': 'mae', 'optimizer': 'adam', 'graph_mode': 'off', 'use_snp_selection': True, 'num_snps': 30839}. Best is trial 61 with value: 0.23904441398023235.
[I 2025-12-06 02:36:51,035] Trial 102 finished with value: 0.22624815621259775 and parameters: {'model_type': 'mlp', 'hidden_dims': '[512, 64]', 'dropout': 0.5211488552818223, 'batch_norm': False, 'lr': 2.2184993554400346e-05, 'weight_decay': 2.7856527520397813e-07, 'epochs': 113, 'loss': 'mae', 'optimizer': 'adam', 'graph_mode': 'off', 'use_snp_selection': True, 'num_snps': 26017}. Best is trial 61 with value: 0.23904441398023235.
[I 2025-12-06 02:37:32,929] Trial 103 finished with value: 0.21801795601248447 and parameters: {'model_type': 'mlp', 'hidden_dims': '[512, 64]', 'dropout': 0.54967091884887, 'batch_norm': False, 'lr': 1.7193317984907932e-05, 'weight_decay': 4.096992053545803e-07, 'epochs': 145, 'loss': 'mae', 'optimizer': 'adam', 'graph_mode': 'off', 'use_snp_selection': True, 'num_snps': 28366}. Best is trial 61 with value: 0.23904441398023235.
[I 2025-12-06 02:38:18,422] Trial 104 finished with value: 0.23535887327518057 and parameters: {'model_type': 'mlp', 'hidden_dims': '[512, 64]', 'dropout': 0.5096437520058248, 'batch_norm': False, 'lr': 1.3510996596365565e-05, 'weight_decay': 3.6377944918766905e-07, 'epochs': 135, 'loss': 'mae', 'optimizer': 'adam', 'graph_mode': 'off', 'use_snp_selection': True, 'num_snps': 34938}. Best is trial 61 with value: 0.23904441398023235.
[I 2025-12-06 02:38:56,377] Trial 105 finished with value: 0.2221553739456231 and parameters: {'model_type': 'mlp', 'hidden_dims': '[256, 128]', 'dropout': 0.33032665244084464, 'batch_norm': False, 'lr': 8.213133934419259e-06, 'weight_decay': 1.8745204636929656e-07, 'epochs': 136, 'loss': 'mae', 'optimizer': 'adam', 'graph_mode': 'off', 'use_snp_selection': True, 'num_snps': 34496}. Best is trial 61 with value: 0.23904441398023235.
[I 2025-12-06 02:39:47,664] Trial 106 finished with value: 0.23024791926918553 and parameters: {'model_type': 'mlp', 'hidden_dims': '[512, 64]', 'dropout': 0.5398800355827578, 'batch_norm': False, 'lr': 1.6109594529891993e-05, 'weight_decay': 2.106524160986917e-06, 'epochs': 152, 'loss': 'mae', 'optimizer': 'adam', 'graph_mode': 'off', 'use_snp_selection': True, 'num_snps': 40293}. Best is trial 61 with value: 0.23904441398023235.
[I 2025-12-06 02:40:33,525] Trial 107 finished with value: 0.22896347035458967 and parameters: {'model_type': 'mlp', 'hidden_dims': '[512, 64]', 'dropout': 0.3196449955500518, 'batch_norm': False, 'lr': 1.059399034050421e-05, 'weight_decay': 5.388381642344376e-07, 'epochs': 117, 'loss': 'mae', 'optimizer': 'adam', 'graph_mode': 'off', 'use_snp_selection': True, 'num_snps': 38422}. Best is trial 61 with value: 0.23904441398023235.
[I 2025-12-06 02:41:20,434] Trial 108 finished with value: 0.22093871289250872 and parameters: {'model_type': 'mlp', 'hidden_dims': '[512, 64]', 'dropout': 0.36128149296764084, 'batch_norm': False, 'lr': 1.369104207819344e-05, 'weight_decay': 2.3199952042882818e-07, 'epochs': 144, 'loss': 'mae', 'optimizer': 'adam', 'graph_mode': 'off', 'use_snp_selection': True, 'num_snps': 35486}. Best is trial 61 with value: 0.23904441398023235.
[I 2025-12-06 02:42:13,763] Trial 109 finished with value: 0.22026896486273895 and parameters: {'model_type': 'mlp', 'hidden_dims': '[512, 64]', 'dropout': 0.5721903178190426, 'batch_norm': False, 'lr': 6.920257266591812e-06, 'weight_decay': 1.0730007484479162e-06, 'epochs': 189, 'loss': 'mse', 'optimizer': 'adam', 'graph_mode': 'off', 'use_snp_selection': True, 'num_snps': 37235}. Best is trial 61 with value: 0.23904441398023235.
[I 2025-12-06 02:42:55,326] Trial 110 finished with value: 0.21390436853516692 and parameters: {'model_type': 'mlp', 'hidden_dims': '[512, 128]', 'dropout': 0.47504139713205895, 'batch_norm': False, 'lr': 6.055864524990802e-06, 'weight_decay': 3.4245233253142184e-07, 'epochs': 107, 'loss': 'mae', 'optimizer': 'adam', 'graph_mode': 'off', 'use_snp_selection': True, 'num_snps': 33093}. Best is trial 61 with value: 0.23904441398023235.
[I 2025-12-06 02:43:37,128] Trial 111 finished with value: 0.2153303524670868 and parameters: {'model_type': 'mlp', 'hidden_dims': '[512, 64]', 'dropout': 0.5016490585421862, 'batch_norm': False, 'lr': 1.2311886034128606e-05, 'weight_decay': 3.8982212650496437e-07, 'epochs': 126, 'loss': 'mae', 'optimizer': 'adam', 'graph_mode': 'off', 'use_snp_selection': True, 'num_snps': 31005}. Best is trial 61 with value: 0.23904441398023235.
