[I 2025-12-05 14:44:40,688] Trial 118 finished with value: 0.09358261611443448 and parameters: {'model_type': 'mlp', 'hidden_dims': '[512, 64]', 'dropout': 0.21814486818657045, 'batch_norm': True, 'lr': 7.387850719309781e-05, 'weight_decay': 1.143850443169311e-06, 'epochs': 41, 'loss': 'mse', 'optimizer': 'adam', 'graph_mode': 'off', 'use_snp_selection': False}. Best is trial 85 with value: 0.1235808695724671.
[I 2025-12-05 14:44:42,021] Trial 119 finished with value: 0.09110227982538525 and parameters: {'model_type': 'mlp', 'hidden_dims': '[512, 64]', 'dropout': 0.17208711945287455, 'batch_norm': True, 'lr': 0.00013872096015682576, 'weight_decay': 8.937020429221194e-07, 'epochs': 47, 'loss': 'mse', 'optimizer': 'adam', 'graph_mode': 'off', 'use_snp_selection': False}. Best is trial 85 with value: 0.1235808695724671.
[I 2025-12-05 14:44:43,715] Trial 120 finished with value: 0.10075505976334657 and parameters: {'model_type': 'mlp', 'hidden_dims': '[512, 64]', 'dropout': 0.19103057614072466, 'batch_norm': True, 'lr': 0.00011601298015853426, 'weight_decay': 1.7779933594873073e-06, 'epochs': 75, 'loss': 'mse', 'optimizer': 'adam', 'graph_mode': 'off', 'use_snp_selection': False}. Best is trial 85 with value: 0.1235808695724671.
[I 2025-12-05 14:44:45,164] Trial 121 finished with value: 0.10563981635822609 and parameters: {'model_type': 'mlp', 'hidden_dims': '[512, 64]', 'dropout': 0.15512549088131872, 'batch_norm': True, 'lr': 0.00010211677702311333, 'weight_decay': 4.537349284421372e-06, 'epochs': 56, 'loss': 'mse', 'optimizer': 'adam', 'graph_mode': 'off', 'use_snp_selection': False}. Best is trial 85 with value: 0.1235808695724671.
[I 2025-12-05 14:44:46,677] Trial 122 finished with value: 0.09551494574555133 and parameters: {'model_type': 'mlp', 'hidden_dims': '[512, 64]', 'dropout': 0.20703940642066815, 'batch_norm': True, 'lr': 0.0001688429953122193, 'weight_decay': 2.419225523515706e-06, 'epochs': 62, 'loss': 'mse', 'optimizer': 'adam', 'graph_mode': 'off', 'use_snp_selection': False}. Best is trial 85 with value: 0.1235808695724671.
[I 2025-12-05 14:44:48,020] Trial 123 finished with value: 0.0992243424383771 and parameters: {'model_type': 'mlp', 'hidden_dims': '[512, 64]', 'dropout': 0.16398947570903274, 'batch_norm': True, 'lr': 0.00028024707299799156, 'weight_decay': 2.015155487133275e-06, 'epochs': 48, 'loss': 'mse', 'optimizer': 'adam', 'graph_mode': 'off', 'use_snp_selection': False}. Best is trial 85 with value: 0.1235808695724671.
[I 2025-12-05 14:44:51,038] Trial 124 finished with value: 0.0990206416758358 and parameters: {'model_type': 'mlp', 'hidden_dims': '[512, 64]', 'dropout': 0.14582246487529346, 'batch_norm': True, 'lr': 5.232254884294196e-05, 'weight_decay': 4.937179067954566e-07, 'epochs': 184, 'loss': 'mse', 'optimizer': 'adam', 'graph_mode': 'off', 'use_snp_selection': False}. Best is trial 85 with value: 0.1235808695724671.
[I 2025-12-05 14:44:51,841] Trial 125 finished with value: 0.07432579282400413 and parameters: {'model_type': 'mlp', 'hidden_dims': '[128, 64]', 'dropout': 0.18575337666973787, 'batch_norm': True, 'lr': 0.00020559254768985302, 'weight_decay': 1.416860794505534e-06, 'epochs': 69, 'loss': 'mse', 'optimizer': 'adam', 'graph_mode': 'off', 'use_snp_selection': False}. Best is trial 85 with value: 0.1235808695724671.
[I 2025-12-05 14:44:52,815] Trial 126 finished with value: 0.07628555091850417 and parameters: {'model_type': 'mlp', 'hidden_dims': '[256, 128]', 'dropout': 0.17213500340856108, 'batch_norm': False, 'lr': 6.196173501258267e-05, 'weight_decay': 2.594800259581375e-06, 'epochs': 51, 'loss': 'mse', 'optimizer': 'adam', 'graph_mode': 'off', 'use_snp_selection': False}. Best is trial 85 with value: 0.1235808695724671.
[I 2025-12-05 14:44:55,326] Trial 127 finished with value: 0.1091310496133206 and parameters: {'model_type': 'mlp', 'hidden_dims': '[512, 64]', 'dropout': 0.24889376032332397, 'batch_norm': True, 'lr': 0.00012356236278913152, 'weight_decay': 1.1550885408126075e-06, 'epochs': 139, 'loss': 'mse', 'optimizer': 'adam', 'graph_mode': 'off', 'use_snp_selection': False}. Best is trial 85 with value: 0.1235808695724671.
[I 2025-12-05 14:44:58,723] Trial 128 finished with value: 0.10673582843820613 and parameters: {'model_type': 'mlp', 'hidden_dims': '[512, 128]', 'dropout': 0.10953972046166902, 'batch_norm': True, 'lr': 8.776770459162761e-05, 'weight_decay': 1.6136867191824963e-06, 'epochs': 114, 'loss': 'mse', 'optimizer': 'adam', 'graph_mode': 'off', 'use_snp_selection': True, 'num_snps': 35550}. Best is trial 85 with value: 0.1235808695724671.
[I 2025-12-05 14:45:00,993] Trial 129 finished with value: 0.009957037089992894 and parameters: {'model_type': 'mlp', 'hidden_dims': '[512, 64]', 'dropout': 0.12916926999024625, 'batch_norm': True, 'lr': 3.2289382844579264e-06, 'weight_decay': 1.5350004162831647e-05, 'epochs': 120, 'loss': 'mse', 'optimizer': 'adam', 'graph_mode': 'off', 'use_snp_selection': False}. Best is trial 85 with value: 0.1235808695724671.
[I 2025-12-05 14:45:03,132] Trial 130 finished with value: 0.1209326160803332 and parameters: {'model_type': 'mlp', 'hidden_dims': '[512, 256]', 'dropout': 0.15248492841143318, 'batch_norm': True, 'lr': 0.0008542469677208379, 'weight_decay': 5.4478512018648955e-06, 'epochs': 107, 'loss': 'mse', 'optimizer': 'adam', 'graph_mode': 'off', 'use_snp_selection': False}. Best is trial 85 with value: 0.1235808695724671.
[I 2025-12-05 14:45:05,249] Trial 131 finished with value: 0.10488162113014672 and parameters: {'model_type': 'mlp', 'hidden_dims': '[512, 256]', 'dropout': 0.15569393217536398, 'batch_norm': True, 'lr': 0.0008374594635391616, 'weight_decay': 6.537549053755561e-06, 'epochs': 106, 'loss': 'mse', 'optimizer': 'adam', 'graph_mode': 'off', 'use_snp_selection': False}. Best is trial 85 with value: 0.1235808695724671.
[I 2025-12-05 14:45:07,262] Trial 132 finished with value: 0.11870827021366447 and parameters: {'model_type': 'mlp', 'hidden_dims': '[512, 256]', 'dropout': 0.14188218498073782, 'batch_norm': True, 'lr': 0.0006348223357926409, 'weight_decay': 5.036889789326028e-06, 'epochs': 98, 'loss': 'mse', 'optimizer': 'adam', 'graph_mode': 'off', 'use_snp_selection': False}. Best is trial 85 with value: 0.1235808695724671.
[I 2025-12-05 14:45:09,307] Trial 133 finished with value: 0.11199172531335216 and parameters: {'model_type': 'mlp', 'hidden_dims': '[512, 256]', 'dropout': 0.12124871831567254, 'batch_norm': True, 'lr': 0.0006158322582904828, 'weight_decay': 1.1116245251976274e-05, 'epochs': 102, 'loss': 'mse', 'optimizer': 'adam', 'graph_mode': 'off', 'use_snp_selection': False}. Best is trial 85 with value: 0.1235808695724671.
[I 2025-12-05 14:45:11,304] Trial 134 finished with value: 0.09456491791016258 and parameters: {'model_type': 'mlp', 'hidden_dims': '[512, 256]', 'dropout': 0.13835540627525345, 'batch_norm': True, 'lr': 0.0008152889593158699, 'weight_decay': 8.8683048062438e-06, 'epochs': 97, 'loss': 'mse', 'optimizer': 'adam', 'graph_mode': 'off', 'use_snp_selection': False}. Best is trial 85 with value: 0.1235808695724671.
[I 2025-12-05 14:45:12,233] Trial 135 finished with value: 0.09488896389428597 and parameters: {'model_type': 'mlp', 'hidden_dims': '[128, 64]', 'dropout': 0.1693597585754881, 'batch_norm': True, 'lr': 0.0004232959166185715, 'weight_decay': 5.51710460316447e-06, 'epochs': 94, 'loss': 'mse', 'optimizer': 'adam', 'graph_mode': 'off', 'use_snp_selection': False}. Best is trial 85 with value: 0.1235808695724671.
[I 2025-12-05 14:45:13,533] Trial 136 finished with value: 0.11167624948065037 and parameters: {'model_type': 'mlp', 'hidden_dims': '[512, 256]', 'dropout': 0.1803265439334048, 'batch_norm': True, 'lr': 0.00017557162480590167, 'weight_decay': 4.715109626297591e-06, 'epochs': 40, 'loss': 'mse', 'optimizer': 'adam', 'graph_mode': 'off', 'use_snp_selection': False}. Best is trial 85 with value: 0.1235808695724671.
[I 2025-12-05 14:45:15,238] Trial 137 finished with value: 0.09639874175981361 and parameters: {'model_type': 'mlp', 'hidden_dims': '[512, 256]', 'dropout': 0.3736493906406326, 'batch_norm': False, 'lr': 0.00014239855701485027, 'weight_decay': 3.950813531646215e-06, 'epochs': 75, 'loss': 'mse', 'optimizer': 'adam', 'graph_mode': 'off', 'use_snp_selection': False}. Best is trial 85 with value: 0.1235808695724671.
[I 2025-12-05 14:45:17,655] Trial 138 finished with value: 0.1055305945050584 and parameters: {'model_type': 'mlp', 'hidden_dims': '[512, 256]', 'dropout': 0.27714993431758145, 'batch_norm': True, 'lr': 0.00024129176222565152, 'weight_decay': 3.044703534167264e-06, 'epochs': 131, 'loss': 'mse', 'optimizer': 'adam', 'graph_mode': 'off', 'use_snp_selection': False}. Best is trial 85 with value: 0.1235808695724671.
[I 2025-12-05 14:45:20,007] Trial 139 finished with value: 0.08977623228934005 and parameters: {'model_type': 'mlp', 'hidden_dims': '[512, 256]', 'dropout': 0.3300293250289055, 'batch_norm': True, 'lr': 0.00011470939320053091, 'weight_decay': 2.350259145017422e-06, 'epochs': 125, 'loss': 'mse', 'optimizer': 'adam', 'graph_mode': 'off', 'use_snp_selection': False}. Best is trial 85 with value: 0.1235808695724671.
[I 2025-12-05 14:45:23,336] Trial 140 finished with value: 0.10949844545166257 and parameters: {'model_type': 'mlp', 'hidden_dims': '[512, 64]', 'dropout': 0.19889785586876288, 'batch_norm': True, 'lr': 0.00010211758682290209, 'weight_decay': 3.7656853968624506e-07, 'epochs': 205, 'loss': 'mse', 'optimizer': 'adam', 'graph_mode': 'off', 'use_snp_selection': False}. Best is trial 85 with value: 0.1235808695724671.
[I 2025-12-05 14:45:25,481] Trial 141 finished with value: 0.1121535996669308 and parameters: {'model_type': 'mlp', 'hidden_dims': '[512, 256]', 'dropout': 0.1485377435662523, 'batch_norm': True, 'lr': 0.0006132936202130842, 'weight_decay': 3.5712875327065154e-06, 'epochs': 110, 'loss': 'mse', 'optimizer': 'adam', 'graph_mode': 'off', 'use_snp_selection': False}. Best is trial 85 with value: 0.1235808695724671.
[I 2025-12-05 14:45:27,711] Trial 142 finished with value: 0.11286661115950457 and parameters: {'model_type': 'mlp', 'hidden_dims': '[512, 256]', 'dropout': 0.16042995050602113, 'batch_norm': True, 'lr': 0.0007786191153728961, 'weight_decay': 1.976389333454657e-06, 'epochs': 117, 'loss': 'mse', 'optimizer': 'adam', 'graph_mode': 'off', 'use_snp_selection': False}. Best is trial 85 with value: 0.1235808695724671.
[I 2025-12-05 14:45:29,801] Trial 143 finished with value: 0.11501139886999703 and parameters: {'model_type': 'mlp', 'hidden_dims': '[512, 256]', 'dropout': 0.13662629898315293, 'batch_norm': True, 'lr': 0.0009914503560310537, 'weight_decay': 2.7014062497994007e-06, 'epochs': 106, 'loss': 'mse', 'optimizer': 'adam', 'graph_mode': 'off', 'use_snp_selection': False}. Best is trial 85 with value: 0.1235808695724671.
[I 2025-12-05 14:45:31,617] Trial 144 finished with value: 0.10706498138333559 and parameters: {'model_type': 'mlp', 'hidden_dims': '[512, 256]', 'dropout': 0.11648010122024108, 'batch_norm': True, 'lr': 0.0009158599631387807, 'weight_decay': 2.7221247584314044e-06, 'epochs': 85, 'loss': 'mse', 'optimizer': 'adam', 'graph_mode': 'off', 'use_snp_selection': False}. Best is trial 85 with value: 0.1235808695724671.
[I 2025-12-05 14:45:33,628] Trial 145 finished with value: 0.11260912004929671 and parameters: {'model_type': 'mlp', 'hidden_dims': '[512, 256]', 'dropout': 0.10146434757774075, 'batch_norm': True, 'lr': 0.0009781683657945446, 'weight_decay': 6.780159741120552e-06, 'epochs': 101, 'loss': 'mse', 'optimizer': 'adam', 'graph_mode': 'off', 'use_snp_selection': False}. Best is trial 85 with value: 0.1235808695724671.
[I 2025-12-05 14:45:35,566] Trial 146 finished with value: 0.1095568148580148 and parameters: {'model_type': 'mlp', 'hidden_dims': '[512, 256]', 'dropout': 0.13266724947233483, 'batch_norm': True, 'lr': 0.0004724522577031448, 'weight_decay': 1.7531723558146003e-06, 'epochs': 93, 'loss': 'mse', 'optimizer': 'adam', 'graph_mode': 'off', 'use_snp_selection': False}. Best is trial 85 with value: 0.1235808695724671.
[I 2025-12-05 14:45:36,494] Trial 147 finished with value: 0.10563672710346986 and parameters: {'model_type': 'mlp', 'hidden_dims': '[128, 64]', 'dropout': 0.14166865237654203, 'batch_norm': True, 'lr': 0.0007225699866985929, 'weight_decay': 1.0180742903386757e-06, 'epochs': 107, 'loss': 'mse', 'optimizer': 'adam', 'graph_mode': 'off', 'use_snp_selection': False}. Best is trial 85 with value: 0.1235808695724671.
[I 2025-12-05 14:45:37,991] Trial 148 finished with value: 0.11324574456958349 and parameters: {'model_type': 'mlp', 'hidden_dims': '[256, 128]', 'dropout': 0.12601364620428826, 'batch_norm': True, 'lr': 0.00031374291951599844, 'weight_decay': 2.4663269343411345e-07, 'epochs': 122, 'loss': 'mse', 'optimizer': 'adam', 'graph_mode': 'off', 'use_snp_selection': False}. Best is trial 85 with value: 0.1235808695724671.
[I 2025-12-05 14:45:40,037] Trial 149 finished with value: 0.08311310578023293 and parameters: {'model_type': 'mlp', 'hidden_dims': '[512, 256]', 'dropout': 0.15704294820783857, 'batch_norm': False, 'lr': 0.0006456517354896112, 'weight_decay': 4.888652772057542e-06, 'epochs': 142, 'loss': 'mse', 'optimizer': 'adam', 'graph_mode': 'off', 'use_snp_selection': True, 'num_snps': 12822}. Best is trial 85 with value: 0.1235808695724671.
[I 2025-12-05 14:45:42,455] Trial 0 finished with value: 0.016710145723626016 and parameters: {'model_type': 'mlp', 'hidden_dims': '[128, 64]', 'dropout': 0.199031432379812, 'batch_norm': True, 'lr': 1.8408544111075837e-06, 'weight_decay': 5.5136510071208614e-05, 'epochs': 336, 'loss': 'mae', 'optimizer': 'adam', 'graph_mode': 'off', 'use_snp_selection': True, 'num_snps': 43862}. Best is trial 0 with value: 0.016710145723626016.
[I 2025-12-05 14:45:43,813] Trial 1 finished with value: 0.09116029363833074 and parameters: {'model_type': 'mlp', 'hidden_dims': '[256, 128]', 'dropout': 0.4370668075331726, 'batch_norm': True, 'lr': 7.133471581159139e-05, 'weight_decay': 1.128633586803549e-05, 'epochs': 242, 'loss': 'mae', 'optimizer': 'adam', 'graph_mode': 'off', 'use_snp_selection': False}. Best is trial 1 with value: 0.09116029363833074.
[I 2025-12-05 14:45:44,987] Trial 2 finished with value: 0.019583021880864967 and parameters: {'model_type': 'mlp', 'hidden_dims': '[256, 128, 64]', 'dropout': 0.41314357415569625, 'batch_norm': False, 'lr': 3.952233718592101e-06, 'weight_decay': 0.00026754769258252603, 'epochs': 149, 'loss': 'mse', 'optimizer': 'adam', 'graph_mode': 'off', 'use_snp_selection': True, 'num_snps': 11571}. Best is trial 1 with value: 0.09116029363833074.
[I 2025-12-05 14:45:47,647] Trial 3 finished with value: 0.03301445448527243 and parameters: {'model_type': 'mlp', 'hidden_dims': '[512, 64]', 'dropout': 0.5938127374509361, 'batch_norm': False, 'lr': 5.67704586114731e-06, 'weight_decay': 2.4518087630137052e-05, 'epochs': 320, 'loss': 'mae', 'optimizer': 'adam', 'graph_mode': 'off', 'use_snp_selection': False}. Best is trial 1 with value: 0.09116029363833074.
[I 2025-12-05 14:45:50,381] Trial 4 finished with value: 0.03098822405067802 and parameters: {'model_type': 'mlp', 'hidden_dims': '[512, 128]', 'dropout': 0.25746343592134413, 'batch_norm': True, 'lr': 1.3467657668402788e-06, 'weight_decay': 0.00033087251918647806, 'epochs': 277, 'loss': 'mse', 'optimizer': 'adam', 'graph_mode': 'off', 'use_snp_selection': True, 'num_snps': 36675}. Best is trial 1 with value: 0.09116029363833074.
[I 2025-12-05 14:45:52,557] Trial 5 finished with value: 0.05229037702403736 and parameters: {'model_type': 'mlp', 'hidden_dims': '[512, 64]', 'dropout': 0.38275350994408375, 'batch_norm': True, 'lr': 1.5586664309232824e-06, 'weight_decay': 0.0008227664668621182, 'epochs': 145, 'loss': 'mae', 'optimizer': 'adam', 'graph_mode': 'off', 'use_snp_selection': True, 'num_snps': 32148}. Best is trial 1 with value: 0.09116029363833074.
[I 2025-12-05 14:45:53,765] Trial 6 finished with value: 0.08987720624684899 and parameters: {'model_type': 'mlp', 'hidden_dims': '[256, 128]', 'dropout': 0.3930109900265879, 'batch_norm': False, 'lr': 4.892964372128395e-05, 'weight_decay': 1.5809549317992182e-06, 'epochs': 199, 'loss': 'mse', 'optimizer': 'adam', 'graph_mode': 'off', 'use_snp_selection': False}. Best is trial 1 with value: 0.09116029363833074.
[I 2025-12-05 14:45:55,097] Trial 7 finished with value: 0.07580044979683627 and parameters: {'model_type': 'mlp', 'hidden_dims': '[512, 256]', 'dropout': 0.15343979219678458, 'batch_norm': True, 'lr': 6.234003099047341e-05, 'weight_decay': 3.894760610535477e-07, 'epochs': 97, 'loss': 'mse', 'optimizer': 'adam', 'graph_mode': 'off', 'use_snp_selection': False}. Best is trial 1 with value: 0.09116029363833074.
[I 2025-12-05 14:45:57,708] Trial 8 finished with value: 0.0809436392252534 and parameters: {'model_type': 'mlp', 'hidden_dims': '[512, 128]', 'dropout': 0.10743001231661406, 'batch_norm': True, 'lr': 0.00023728538449271062, 'weight_decay': 1.7629071578048637e-05, 'epochs': 312, 'loss': 'mae', 'optimizer': 'adam', 'graph_mode': 'off', 'use_snp_selection': False}. Best is trial 1 with value: 0.09116029363833074.
[I 2025-12-05 14:45:59,498] Trial 9 finished with value: 0.08242217629186596 and parameters: {'model_type': 'mlp', 'hidden_dims': '[512, 64]', 'dropout': 0.14505336736221927, 'batch_norm': True, 'lr': 5.8619638388111826e-05, 'weight_decay': 6.200156172669308e-07, 'epochs': 175, 'loss': 'mse', 'optimizer': 'adam', 'graph_mode': 'off', 'use_snp_selection': False}. Best is trial 1 with value: 0.09116029363833074.
[I 2025-12-05 14:46:00,823] Trial 10 finished with value: 0.047402842323504106 and parameters: {'model_type': 'mlp', 'hidden_dims': '[256, 128]', 'dropout': 0.5365714961141473, 'batch_norm': False, 'lr': 0.00032955828969150785, 'weight_decay': 3.381683344261174e-06, 'epochs': 236, 'loss': 'mae', 'optimizer': 'adam', 'graph_mode': 'off', 'use_snp_selection': False}. Best is trial 1 with value: 0.09116029363833074.
[I 2025-12-05 14:46:02,124] Trial 11 finished with value: 0.10704062827266522 and parameters: {'model_type': 'mlp', 'hidden_dims': '[256, 128]', 'dropout': 0.4514665825009126, 'batch_norm': False, 'lr': 1.6474108386126448e-05, 'weight_decay': 2.805519019095577e-06, 'epochs': 222, 'loss': 'mse', 'optimizer': 'adam', 'graph_mode': 'off', 'use_snp_selection': False}. Best is trial 11 with value: 0.10704062827266522.
[I 2025-12-05 14:46:03,550] Trial 12 finished with value: 0.07512037288636944 and parameters: {'model_type': 'mlp', 'hidden_dims': '[256, 128]', 'dropout': 0.4779690972965961, 'batch_norm': False, 'lr': 1.3209655691727925e-05, 'weight_decay': 1.3081036432574914e-07, 'epochs': 257, 'loss': 'mae', 'optimizer': 'adam', 'graph_mode': 'off', 'use_snp_selection': False}. Best is trial 11 with value: 0.10704062827266522.
[I 2025-12-05 14:46:04,848] Trial 13 finished with value: 0.08192308189206013 and parameters: {'model_type': 'mlp', 'hidden_dims': '[256, 128]', 'dropout': 0.3041365173646664, 'batch_norm': False, 'lr': 1.8184704710575438e-05, 'weight_decay': 5.684519129837217e-06, 'epochs': 215, 'loss': 'mse', 'optimizer': 'adam', 'graph_mode': 'off', 'use_snp_selection': False}. Best is trial 11 with value: 0.10704062827266522.
[I 2025-12-05 14:46:05,632] Trial 14 finished with value: 0.08547605381941388 and parameters: {'model_type': 'mlp', 'hidden_dims': '[256, 128]', 'dropout': 0.47122472341281907, 'batch_norm': True, 'lr': 0.0001457690241539883, 'weight_decay': 6.9442169885097e-05, 'epochs': 42, 'loss': 'mse', 'optimizer': 'adam', 'graph_mode': 'off', 'use_snp_selection': False}. Best is trial 11 with value: 0.10704062827266522.
[I 2025-12-05 14:46:06,679] Trial 15 finished with value: 0.04876920018844047 and parameters: {'model_type': 'mlp', 'hidden_dims': '[128, 64]', 'dropout': 0.4682470153344183, 'batch_norm': False, 'lr': 0.0005897942264929748, 'weight_decay': 2.3807353114632773e-06, 'epochs': 278, 'loss': 'mae', 'optimizer': 'adam', 'graph_mode': 'off', 'use_snp_selection': False}. Best is trial 11 with value: 0.10704062827266522.
[I 2025-12-05 14:46:08,084] Trial 16 finished with value: 0.07184502508752387 and parameters: {'model_type': 'mlp', 'hidden_dims': '[256, 128, 64]', 'dropout': 0.32917331692935026, 'batch_norm': True, 'lr': 1.8574869464616778e-05, 'weight_decay': 9.430704911777773e-06, 'epochs': 240, 'loss': 'mse', 'optimizer': 'adam', 'graph_mode': 'off', 'use_snp_selection': False}. Best is trial 11 with value: 0.10704062827266522.
[I 2025-12-05 14:46:09,566] Trial 17 finished with value: 0.03382318639059055 and parameters: {'model_type': 'mlp', 'hidden_dims': '[512, 256]', 'dropout': 0.5691484440432828, 'batch_norm': False, 'lr': 0.00011250328318735081, 'weight_decay': 1.2403128387387171e-06, 'epochs': 119, 'loss': 'mae', 'optimizer': 'adam', 'graph_mode': 'off', 'use_snp_selection': False}. Best is trial 11 with value: 0.10704062827266522.
[I 2025-12-05 14:46:12,638] Trial 18 finished with value: 0.11411391432010902 and parameters: {'model_type': 'mlp', 'hidden_dims': '[256, 128]', 'dropout': 0.5139576333133464, 'batch_norm': False, 'lr': 0.0009735993119677173, 'weight_decay': 5.1284909832915915e-05, 'epochs': 184, 'loss': 'mse', 'optimizer': 'adam', 'graph_mode': 'off', 'use_snp_selection': True, 'num_snps': 58241}. Best is trial 18 with value: 0.11411391432010902.
[I 2025-12-05 14:46:15,595] Trial 19 finished with value: 0.03144449236238843 and parameters: {'model_type': 'mlp', 'hidden_dims': '[256, 128]', 'dropout': 0.5275348560301818, 'batch_norm': False, 'lr': 6.676999372390444e-06, 'weight_decay': 5.887593413324601e-05, 'epochs': 170, 'loss': 'mse', 'optimizer': 'adam', 'graph_mode': 'off', 'use_snp_selection': True, 'num_snps': 55667}. Best is trial 18 with value: 0.11411391432010902.
