[I 2025-12-05 14:31:32,156] Trial 109 finished with value: 0.045636771930542 and parameters: {'model_type': 'mlp', 'hidden_dims': '[512, 64]', 'dropout': 0.449692687099706, 'batch_norm': True, 'lr': 6.6774373531308735e-06, 'weight_decay': 2.915750164270475e-06, 'epochs': 213, 'loss': 'mae', 'optimizer': 'adam', 'graph_mode': 'off', 'use_snp_selection': True, 'num_snps': 13183}. Best is trial 99 with value: 0.06727357873478364.
[I 2025-12-05 14:31:33,045] Trial 110 finished with value: 0.03291264025251597 and parameters: {'model_type': 'mlp', 'hidden_dims': '[512, 64]', 'dropout': 0.34077740755980857, 'batch_norm': False, 'lr': 1.782847409382327e-05, 'weight_decay': 2.444439786582005e-06, 'epochs': 244, 'loss': 'mae', 'optimizer': 'adam', 'graph_mode': 'off', 'use_snp_selection': True, 'num_snps': 2595}. Best is trial 99 with value: 0.06727357873478364.
[I 2025-12-05 14:31:34,060] Trial 111 finished with value: 0.06174876188098539 and parameters: {'model_type': 'mlp', 'hidden_dims': '[512, 64]', 'dropout': 0.1198374255674711, 'batch_norm': True, 'lr': 2.7674356670936407e-05, 'weight_decay': 2.8381322379328814e-05, 'epochs': 196, 'loss': 'mae', 'optimizer': 'adam', 'graph_mode': 'off', 'use_snp_selection': True, 'num_snps': 6052}. Best is trial 99 with value: 0.06727357873478364.
[I 2025-12-05 14:31:35,021] Trial 112 finished with value: 0.06422080328184089 and parameters: {'model_type': 'mlp', 'hidden_dims': '[512, 64]', 'dropout': 0.12052252164763277, 'batch_norm': True, 'lr': 2.422740018003493e-05, 'weight_decay': 1.2520950742703936e-06, 'epochs': 181, 'loss': 'mae', 'optimizer': 'adam', 'graph_mode': 'off', 'use_snp_selection': True, 'num_snps': 5321}. Best is trial 99 with value: 0.06727357873478364.
[I 2025-12-05 14:31:35,993] Trial 113 finished with value: 0.05449775878689673 and parameters: {'model_type': 'mlp', 'hidden_dims': '[512, 64]', 'dropout': 0.1187576176156957, 'batch_norm': True, 'lr': 2.2644928691552617e-05, 'weight_decay': 9.229087817588251e-07, 'epochs': 178, 'loss': 'mae', 'optimizer': 'adam', 'graph_mode': 'off', 'use_snp_selection': True, 'num_snps': 6052}. Best is trial 99 with value: 0.06727357873478364.
[I 2025-12-05 14:31:37,094] Trial 114 finished with value: 0.05186914593563267 and parameters: {'model_type': 'mlp', 'hidden_dims': '[512, 64]', 'dropout': 0.11225463492886181, 'batch_norm': True, 'lr': 2.787296047786003e-05, 'weight_decay': 1.1734045807064906e-06, 'epochs': 185, 'loss': 'mae', 'optimizer': 'adam', 'graph_mode': 'off', 'use_snp_selection': True, 'num_snps': 10116}. Best is trial 99 with value: 0.06727357873478364.
[I 2025-12-05 14:31:38,058] Trial 115 finished with value: 0.034986152547227894 and parameters: {'model_type': 'mlp', 'hidden_dims': '[512, 64]', 'dropout': 0.2837022754926263, 'batch_norm': True, 'lr': 1.2999905564468468e-05, 'weight_decay': 5.827001742078128e-07, 'epochs': 195, 'loss': 'mae', 'optimizer': 'adam', 'graph_mode': 'off', 'use_snp_selection': True, 'num_snps': 5023}. Best is trial 99 with value: 0.06727357873478364.
[I 2025-12-05 14:31:39,055] Trial 116 finished with value: 0.06213208111947255 and parameters: {'model_type': 'mlp', 'hidden_dims': '[256, 128]', 'dropout': 0.17244951834779662, 'batch_norm': True, 'lr': 2.894702703607195e-05, 'weight_decay': 1.4492343915605816e-06, 'epochs': 158, 'loss': 'mae', 'optimizer': 'adam', 'graph_mode': 'off', 'use_snp_selection': True, 'num_snps': 8397}. Best is trial 99 with value: 0.06727357873478364.
[I 2025-12-05 14:31:40,097] Trial 117 finished with value: 0.08481684869569753 and parameters: {'model_type': 'mlp', 'hidden_dims': '[256, 128]', 'dropout': 0.13232565112788514, 'batch_norm': True, 'lr': 3.797088964046518e-05, 'weight_decay': 1.93634145655141e-06, 'epochs': 167, 'loss': 'mae', 'optimizer': 'adam', 'graph_mode': 'off', 'use_snp_selection': True, 'num_snps': 8530}. Best is trial 117 with value: 0.08481684869569753.
[I 2025-12-05 14:31:41,102] Trial 118 finished with value: 0.03825816278678752 and parameters: {'model_type': 'mlp', 'hidden_dims': '[256, 128]', 'dropout': 0.17279657168348855, 'batch_norm': True, 'lr': 2.854963715974574e-05, 'weight_decay': 7.646005547949324e-07, 'epochs': 159, 'loss': 'mae', 'optimizer': 'adam', 'graph_mode': 'off', 'use_snp_selection': True, 'num_snps': 8523}. Best is trial 117 with value: 0.08481684869569753.
[I 2025-12-05 14:31:42,066] Trial 119 finished with value: 0.061630984249177914 and parameters: {'model_type': 'mlp', 'hidden_dims': '[256, 128]', 'dropout': 0.13540170913757263, 'batch_norm': True, 'lr': 3.780028145880667e-05, 'weight_decay': 1.7930773746350444e-06, 'epochs': 167, 'loss': 'mae', 'optimizer': 'adam', 'graph_mode': 'off', 'use_snp_selection': True, 'num_snps': 6731}. Best is trial 117 with value: 0.08481684869569753.
[I 2025-12-05 14:31:43,020] Trial 120 finished with value: 0.048392722724893644 and parameters: {'model_type': 'mlp', 'hidden_dims': '[256, 128]', 'dropout': 0.1332495114128414, 'batch_norm': True, 'lr': 2.3165436270208865e-05, 'weight_decay': 1.3739827397639014e-06, 'epochs': 167, 'loss': 'mae', 'optimizer': 'adam', 'graph_mode': 'off', 'use_snp_selection': True, 'num_snps': 6405}. Best is trial 117 with value: 0.08481684869569753.
[I 2025-12-05 14:31:43,979] Trial 121 finished with value: 0.03794282511196322 and parameters: {'model_type': 'mlp', 'hidden_dims': '[256, 128]', 'dropout': 0.15834810451819947, 'batch_norm': True, 'lr': 3.618661215368565e-05, 'weight_decay': 3.462880584036737e-06, 'epochs': 149, 'loss': 'mae', 'optimizer': 'adam', 'graph_mode': 'off', 'use_snp_selection': True, 'num_snps': 7510}. Best is trial 117 with value: 0.08481684869569753.
[I 2025-12-05 14:31:45,089] Trial 122 finished with value: 0.07342373699663107 and parameters: {'model_type': 'mlp', 'hidden_dims': '[256, 128]', 'dropout': 0.10241556165004638, 'batch_norm': True, 'lr': 1.8617287077007692e-05, 'weight_decay': 1.8011593087781336e-06, 'epochs': 175, 'loss': 'mae', 'optimizer': 'adam', 'graph_mode': 'off', 'use_snp_selection': True, 'num_snps': 10934}. Best is trial 117 with value: 0.08481684869569753.
[I 2025-12-05 14:31:46,150] Trial 123 finished with value: 0.06217715992330153 and parameters: {'model_type': 'mlp', 'hidden_dims': '[256, 128]', 'dropout': 0.10613753863216323, 'batch_norm': True, 'lr': 1.6888741381645038e-05, 'weight_decay': 1.9976960382292336e-06, 'epochs': 137, 'loss': 'mae', 'optimizer': 'adam', 'graph_mode': 'off', 'use_snp_selection': True, 'num_snps': 11570}. Best is trial 117 with value: 0.08481684869569753.
[I 2025-12-05 14:31:47,230] Trial 124 finished with value: 0.07674478207370562 and parameters: {'model_type': 'mlp', 'hidden_dims': '[256, 128]', 'dropout': 0.10886448802106222, 'batch_norm': True, 'lr': 1.8055817928499574e-05, 'weight_decay': 2.236039570331851e-06, 'epochs': 137, 'loss': 'mae', 'optimizer': 'adam', 'graph_mode': 'off', 'use_snp_selection': True, 'num_snps': 12257}. Best is trial 117 with value: 0.08481684869569753.
[I 2025-12-05 14:31:48,062] Trial 125 finished with value: 0.058534035462847744 and parameters: {'model_type': 'mlp', 'hidden_dims': '[256, 128]', 'dropout': 0.1028896522660352, 'batch_norm': True, 'lr': 1.9406594987538652e-05, 'weight_decay': 1.960030419048676e-06, 'epochs': 134, 'loss': 'mae', 'optimizer': 'adam', 'graph_mode': 'off', 'use_snp_selection': True, 'num_snps': 3505}. Best is trial 117 with value: 0.08481684869569753.
[I 2025-12-05 14:31:49,026] Trial 126 finished with value: 0.026753721968251536 and parameters: {'model_type': 'mlp', 'hidden_dims': '[256, 128]', 'dropout': 0.120269870009826, 'batch_norm': True, 'lr': 2.0772322008149132e-05, 'weight_decay': 1.5725733099854217e-06, 'epochs': 115, 'loss': 'mae', 'optimizer': 'adam', 'graph_mode': 'off', 'use_snp_selection': True, 'num_snps': 9114}. Best is trial 117 with value: 0.08481684869569753.
[I 2025-12-05 14:31:50,260] Trial 127 finished with value: 0.028088520256064828 and parameters: {'model_type': 'mlp', 'hidden_dims': '[256, 128]', 'dropout': 0.14360812515881088, 'batch_norm': True, 'lr': 1.5085531725102098e-05, 'weight_decay': 1.2210257080011855e-06, 'epochs': 171, 'loss': 'mae', 'optimizer': 'adam', 'graph_mode': 'off', 'use_snp_selection': True, 'num_snps': 14731}. Best is trial 117 with value: 0.08481684869569753.
[I 2025-12-05 14:31:51,390] Trial 128 finished with value: 0.05823461894209795 and parameters: {'model_type': 'mlp', 'hidden_dims': '[256, 128]', 'dropout': 0.10043353725315966, 'batch_norm': True, 'lr': 1.1995078127979268e-05, 'weight_decay': 1.6405041676052245e-06, 'epochs': 152, 'loss': 'mae', 'optimizer': 'adam', 'graph_mode': 'off', 'use_snp_selection': True, 'num_snps': 13083}. Best is trial 117 with value: 0.08481684869569753.
[I 2025-12-05 14:31:52,441] Trial 129 finished with value: 0.06675824402521752 and parameters: {'model_type': 'mlp', 'hidden_dims': '[256, 128]', 'dropout': 0.11078936286550364, 'batch_norm': True, 'lr': 1.562340422178598e-05, 'weight_decay': 2.2128279364158524e-06, 'epochs': 139, 'loss': 'mae', 'optimizer': 'adam', 'graph_mode': 'off', 'use_snp_selection': True, 'num_snps': 11010}. Best is trial 117 with value: 0.08481684869569753.
[I 2025-12-05 14:31:53,493] Trial 130 finished with value: 0.03281882954160422 and parameters: {'model_type': 'mlp', 'hidden_dims': '[256, 128]', 'dropout': 0.11080014665053606, 'batch_norm': True, 'lr': 1.65132057246735e-05, 'weight_decay': 7.229721782825152e-07, 'epochs': 135, 'loss': 'mae', 'optimizer': 'adam', 'graph_mode': 'off', 'use_snp_selection': True, 'num_snps': 11303}. Best is trial 117 with value: 0.08481684869569753.
[I 2025-12-05 14:31:54,381] Trial 131 finished with value: 0.020361782347111168 and parameters: {'model_type': 'mlp', 'hidden_dims': '[256, 128]', 'dropout': 0.12497252502886165, 'batch_norm': True, 'lr': 3.052631315324429e-05, 'weight_decay': 2.007395915130605e-06, 'epochs': 141, 'loss': 'mae', 'optimizer': 'adam', 'graph_mode': 'off', 'use_snp_selection': True, 'num_snps': 5231}. Best is trial 117 with value: 0.08481684869569753.
[I 2025-12-05 14:31:55,379] Trial 132 finished with value: 0.017657340993821012 and parameters: {'model_type': 'mlp', 'hidden_dims': '[256, 128]', 'dropout': 0.1095091311213772, 'batch_norm': True, 'lr': 3.996334582008093e-05, 'weight_decay': 2.068667475713754e-06, 'epochs': 161, 'loss': 'mae', 'optimizer': 'adam', 'graph_mode': 'off', 'use_snp_selection': True, 'num_snps': 8430}. Best is trial 117 with value: 0.08481684869569753.
[I 2025-12-05 14:31:56,664] Trial 133 finished with value: 0.057377590185786004 and parameters: {'model_type': 'mlp', 'hidden_dims': '[256, 128]', 'dropout': 0.12262369011688516, 'batch_norm': True, 'lr': 2.512713806724229e-05, 'weight_decay': 1.0417538452451683e-06, 'epochs': 180, 'loss': 'mae', 'optimizer': 'adam', 'graph_mode': 'off', 'use_snp_selection': True, 'num_snps': 16601}. Best is trial 117 with value: 0.08481684869569753.
[I 2025-12-05 14:31:57,652] Trial 134 finished with value: 0.023196802792101314 and parameters: {'model_type': 'mlp', 'hidden_dims': '[256, 128]', 'dropout': 0.11344222901295889, 'batch_norm': True, 'lr': 2.4757670652549862e-05, 'weight_decay': 2.2727411403071126e-06, 'epochs': 167, 'loss': 'mae', 'optimizer': 'adam', 'graph_mode': 'off', 'use_snp_selection': True, 'num_snps': 7487}. Best is trial 117 with value: 0.08481684869569753.
[I 2025-12-05 14:31:58,501] Trial 135 finished with value: 0.04945761960304686 and parameters: {'model_type': 'mlp', 'hidden_dims': '[256, 128]', 'dropout': 0.14989592504172117, 'batch_norm': True, 'lr': 1.454644435104176e-05, 'weight_decay': 2.8723841760755066e-06, 'epochs': 143, 'loss': 'mae', 'optimizer': 'adam', 'graph_mode': 'off', 'use_snp_selection': True, 'num_snps': 3597}. Best is trial 117 with value: 0.08481684869569753.
[I 2025-12-05 14:31:59,598] Trial 136 finished with value: 0.04215689235503241 and parameters: {'model_type': 'mlp', 'hidden_dims': '[256, 128]', 'dropout': 0.12912864620174325, 'batch_norm': True, 'lr': 9.310183556479567e-06, 'weight_decay': 1.5138813642916067e-06, 'epochs': 176, 'loss': 'mae', 'optimizer': 'adam', 'graph_mode': 'off', 'use_snp_selection': True, 'num_snps': 10941}. Best is trial 117 with value: 0.08481684869569753.
[I 2025-12-05 14:32:00,576] Trial 137 finished with value: 0.02413944684945551 and parameters: {'model_type': 'mlp', 'hidden_dims': '[256, 128]', 'dropout': 0.1464569496609432, 'batch_norm': True, 'lr': 2.001007335458675e-05, 'weight_decay': 1.2245230991284067e-06, 'epochs': 127, 'loss': 'mae', 'optimizer': 'adam', 'graph_mode': 'off', 'use_snp_selection': True, 'num_snps': 9043}. Best is trial 117 with value: 0.08481684869569753.
[I 2025-12-05 14:32:01,686] Trial 138 finished with value: 0.047913867375030714 and parameters: {'model_type': 'mlp', 'hidden_dims': '[256, 128]', 'dropout': 0.16405233548883097, 'batch_norm': False, 'lr': 3.922103526300729e-05, 'weight_decay': 1.79174391655173e-06, 'epochs': 185, 'loss': 'mae', 'optimizer': 'adam', 'graph_mode': 'off', 'use_snp_selection': True, 'num_snps': 12753}. Best is trial 117 with value: 0.08481684869569753.
[I 2025-12-05 14:32:02,636] Trial 139 finished with value: 0.0684972594168801 and parameters: {'model_type': 'mlp', 'hidden_dims': '[256, 128]', 'dropout': 0.10095975739383137, 'batch_norm': True, 'lr': 3.417668839057097e-05, 'weight_decay': 3.7611231424496396e-06, 'epochs': 155, 'loss': 'mae', 'optimizer': 'adam', 'graph_mode': 'off', 'use_snp_selection': True, 'num_snps': 6159}. Best is trial 117 with value: 0.08481684869569753.
[I 2025-12-05 14:32:03,579] Trial 140 finished with value: 0.01204297906385671 and parameters: {'model_type': 'mlp', 'hidden_dims': '[256, 128]', 'dropout': 0.10085133406353332, 'batch_norm': True, 'lr': 3.2557728704333556e-05, 'weight_decay': 4.177620930087362e-06, 'epochs': 156, 'loss': 'mae', 'optimizer': 'adam', 'graph_mode': 'off', 'use_snp_selection': True, 'num_snps': 6443}. Best is trial 117 with value: 0.08481684869569753.
[I 2025-12-05 14:32:04,493] Trial 141 finished with value: 0.037393121433589034 and parameters: {'model_type': 'mlp', 'hidden_dims': '[256, 128]', 'dropout': 0.11903438122834137, 'batch_norm': True, 'lr': 1.8637392699138142e-05, 'weight_decay': 2.587659013652639e-06, 'epochs': 150, 'loss': 'mae', 'optimizer': 'adam', 'graph_mode': 'off', 'use_snp_selection': True, 'num_snps': 4944}. Best is trial 117 with value: 0.08481684869569753.
[I 2025-12-05 14:32:05,519] Trial 142 finished with value: 0.054921253274966275 and parameters: {'model_type': 'mlp', 'hidden_dims': '[256, 128]', 'dropout': 0.13794809648911188, 'batch_norm': True, 'lr': 4.543640105791724e-05, 'weight_decay': 3.536185612774613e-06, 'epochs': 140, 'loss': 'mae', 'optimizer': 'adam', 'graph_mode': 'off', 'use_snp_selection': True, 'num_snps': 9483}. Best is trial 117 with value: 0.08481684869569753.
[I 2025-12-05 14:32:06,482] Trial 143 finished with value: 0.06214238106769951 and parameters: {'model_type': 'mlp', 'hidden_dims': '[256, 128]', 'dropout': 0.11031634575805288, 'batch_norm': True, 'lr': 3.464095003732956e-05, 'weight_decay': 5.164112144889142e-06, 'epochs': 158, 'loss': 'mae', 'optimizer': 'adam', 'graph_mode': 'off', 'use_snp_selection': True, 'num_snps': 7002}. Best is trial 117 with value: 0.08481684869569753.
[I 2025-12-05 14:32:07,465] Trial 144 finished with value: 0.010878553449963555 and parameters: {'model_type': 'mlp', 'hidden_dims': '[256, 128]', 'dropout': 0.1000781863204669, 'batch_norm': True, 'lr': 3.363817399024315e-05, 'weight_decay': 1.358555319058343e-06, 'epochs': 170, 'loss': 'mae', 'optimizer': 'adam', 'graph_mode': 'off', 'use_snp_selection': True, 'num_snps': 7236}. Best is trial 117 with value: 0.08481684869569753.
[I 2025-12-05 14:32:08,425] Trial 145 finished with value: 0.013368350114316176 and parameters: {'model_type': 'mlp', 'hidden_dims': '[256, 128]', 'dropout': 0.1114854653636593, 'batch_norm': True, 'lr': 2.595601177693402e-05, 'weight_decay': 4.438162989555141e-06, 'epochs': 197, 'loss': 'mae', 'optimizer': 'adam', 'graph_mode': 'off', 'use_snp_selection': True, 'num_snps': 4195}. Best is trial 117 with value: 0.08481684869569753.
[I 2025-12-05 14:32:09,300] Trial 146 finished with value: 0.034819254318707735 and parameters: {'model_type': 'mlp', 'hidden_dims': '[256, 128]', 'dropout': 0.12794610778106086, 'batch_norm': True, 'lr': 2.2991580074547296e-05, 'weight_decay': 2.248835403103179e-06, 'epochs': 190, 'loss': 'mae', 'optimizer': 'adam', 'graph_mode': 'off', 'use_snp_selection': True, 'num_snps': 2294}. Best is trial 117 with value: 0.08481684869569753.
[I 2025-12-05 14:32:10,298] Trial 147 finished with value: 0.021665931858448315 and parameters: {'model_type': 'mlp', 'hidden_dims': '[256, 128]', 'dropout': 0.1182529693131692, 'batch_norm': True, 'lr': 4.9321125426360396e-05, 'weight_decay': 3.00284115852098e-06, 'epochs': 158, 'loss': 'mae', 'optimizer': 'adam', 'graph_mode': 'off', 'use_snp_selection': True, 'num_snps': 8283}. Best is trial 117 with value: 0.08481684869569753.
[I 2025-12-05 14:32:11,216] Trial 148 finished with value: 0.040983847706888864 and parameters: {'model_type': 'mlp', 'hidden_dims': '[256, 128]', 'dropout': 0.13969428527337835, 'batch_norm': True, 'lr': 1.3688806237316905e-05, 'weight_decay': 1.697693791571915e-06, 'epochs': 147, 'loss': 'mae', 'optimizer': 'adam', 'graph_mode': 'off', 'use_snp_selection': True, 'num_snps': 5973}. Best is trial 117 with value: 0.08481684869569753.
[I 2025-12-05 14:32:12,284] Trial 149 finished with value: 0.06333135694650413 and parameters: {'model_type': 'mlp', 'hidden_dims': '[256, 128]', 'dropout': 0.10770017849681544, 'batch_norm': True, 'lr': 1.6242213992942274e-05, 'weight_decay': 1.061844639011706e-06, 'epochs': 166, 'loss': 'mae', 'optimizer': 'adam', 'graph_mode': 'off', 'use_snp_selection': True, 'num_snps': 10208}. Best is trial 117 with value: 0.08481684869569753.
[I 2025-12-05 14:32:14,876] Trial 0 finished with value: 0.08656815034009041 and parameters: {'model_type': 'mlp', 'hidden_dims': '[128, 64]', 'dropout': 0.199031432379812, 'batch_norm': True, 'lr': 1.8408544111075837e-06, 'weight_decay': 5.5136510071208614e-05, 'epochs': 336, 'loss': 'mae', 'optimizer': 'adam', 'graph_mode': 'off', 'use_snp_selection': True, 'num_snps': 43862}. Best is trial 0 with value: 0.08656815034009041.
[I 2025-12-05 14:32:16,399] Trial 1 finished with value: 0.05619322510845172 and parameters: {'model_type': 'mlp', 'hidden_dims': '[256, 128]', 'dropout': 0.4370668075331726, 'batch_norm': True, 'lr': 7.133471581159139e-05, 'weight_decay': 1.128633586803549e-05, 'epochs': 242, 'loss': 'mae', 'optimizer': 'adam', 'graph_mode': 'off', 'use_snp_selection': False}. Best is trial 0 with value: 0.08656815034009041.
[I 2025-12-05 14:32:17,735] Trial 2 finished with value: -0.00929954131390122 and parameters: {'model_type': 'mlp', 'hidden_dims': '[256, 128, 64]', 'dropout': 0.41314357415569625, 'batch_norm': False, 'lr': 3.952233718592101e-06, 'weight_decay': 0.00026754769258252603, 'epochs': 149, 'loss': 'mse', 'optimizer': 'adam', 'graph_mode': 'off', 'use_snp_selection': True, 'num_snps': 11571}. Best is trial 0 with value: 0.08656815034009041.
[I 2025-12-05 14:32:20,871] Trial 3 finished with value: 0.06514117347923504 and parameters: {'model_type': 'mlp', 'hidden_dims': '[512, 64]', 'dropout': 0.5938127374509361, 'batch_norm': False, 'lr': 5.67704586114731e-06, 'weight_decay': 2.4518087630137052e-05, 'epochs': 320, 'loss': 'mae', 'optimizer': 'adam', 'graph_mode': 'off', 'use_snp_selection': False}. Best is trial 0 with value: 0.08656815034009041.
[I 2025-12-05 14:32:24,033] Trial 4 finished with value: 0.019645294435522567 and parameters: {'model_type': 'mlp', 'hidden_dims': '[512, 128]', 'dropout': 0.25746343592134413, 'batch_norm': True, 'lr': 1.3467657668402788e-06, 'weight_decay': 0.00033087251918647806, 'epochs': 277, 'loss': 'mse', 'optimizer': 'adam', 'graph_mode': 'off', 'use_snp_selection': True, 'num_snps': 36675}. Best is trial 0 with value: 0.08656815034009041.
[I 2025-12-05 14:32:26,440] Trial 5 finished with value: 0.016603388227979656 and parameters: {'model_type': 'mlp', 'hidden_dims': '[512, 64]', 'dropout': 0.38275350994408375, 'batch_norm': True, 'lr': 1.5586664309232824e-06, 'weight_decay': 0.0008227664668621182, 'epochs': 145, 'loss': 'mae', 'optimizer': 'adam', 'graph_mode': 'off', 'use_snp_selection': True, 'num_snps': 32148}. Best is trial 0 with value: 0.08656815034009041.
[I 2025-12-05 14:32:27,765] Trial 6 finished with value: 0.08727741910549842 and parameters: {'model_type': 'mlp', 'hidden_dims': '[256, 128]', 'dropout': 0.3930109900265879, 'batch_norm': False, 'lr': 4.892964372128395e-05, 'weight_decay': 1.5809549317992182e-06, 'epochs': 199, 'loss': 'mse', 'optimizer': 'adam', 'graph_mode': 'off', 'use_snp_selection': False}. Best is trial 6 with value: 0.08727741910549842.
[I 2025-12-05 14:32:29,188] Trial 7 finished with value: 0.04703998237256349 and parameters: {'model_type': 'mlp', 'hidden_dims': '[512, 256]', 'dropout': 0.15343979219678458, 'batch_norm': True, 'lr': 6.234003099047341e-05, 'weight_decay': 3.894760610535477e-07, 'epochs': 97, 'loss': 'mse', 'optimizer': 'adam', 'graph_mode': 'off', 'use_snp_selection': False}. Best is trial 6 with value: 0.08727741910549842.
[I 2025-12-05 14:32:32,312] Trial 8 finished with value: 0.0733992300173231 and parameters: {'model_type': 'mlp', 'hidden_dims': '[512, 128]', 'dropout': 0.10743001231661406, 'batch_norm': True, 'lr': 0.00023728538449271062, 'weight_decay': 1.7629071578048637e-05, 'epochs': 312, 'loss': 'mae', 'optimizer': 'adam', 'graph_mode': 'off', 'use_snp_selection': False}. Best is trial 6 with value: 0.08727741910549842.
