[I 2025-12-05 15:07:32,652] Trial 94 finished with value: 0.05661565603280673 and parameters: {'model_type': 'mlp', 'hidden_dims': '[512, 64]', 'dropout': 0.3702507769664947, 'batch_norm': False, 'lr': 1.4016077079224808e-05, 'weight_decay': 1.2863960038264748e-07, 'epochs': 107, 'loss': 'mse', 'optimizer': 'adam', 'graph_mode': 'off', 'use_snp_selection': False}. Best is trial 19 with value: 0.06757389302384245.
[I 2025-12-05 15:07:33,611] Trial 95 finished with value: 0.03022898672002629 and parameters: {'model_type': 'mlp', 'hidden_dims': '[512, 256]', 'dropout': 0.372129199402112, 'batch_norm': False, 'lr': 1.455216451401827e-05, 'weight_decay': 1.0475959550780632e-07, 'epochs': 79, 'loss': 'mse', 'optimizer': 'adam', 'graph_mode': 'off', 'use_snp_selection': False}. Best is trial 19 with value: 0.06757389302384245.
[I 2025-12-05 15:07:34,603] Trial 96 finished with value: -0.0035550005682439285 and parameters: {'model_type': 'mlp', 'hidden_dims': '[256, 128, 64]', 'dropout': 0.23420363748569567, 'batch_norm': True, 'lr': 6.934426481178233e-06, 'weight_decay': 1.2855476050953498e-07, 'epochs': 214, 'loss': 'mse', 'optimizer': 'adam', 'graph_mode': 'off', 'use_snp_selection': False}. Best is trial 19 with value: 0.06757389302384245.
[I 2025-12-05 15:07:35,707] Trial 97 finished with value: 0.038253385136534895 and parameters: {'model_type': 'mlp', 'hidden_dims': '[512, 256]', 'dropout': 0.2972777869028125, 'batch_norm': False, 'lr': 1.9197849060865574e-05, 'weight_decay': 2.7687305383866185e-07, 'epochs': 106, 'loss': 'mse', 'optimizer': 'adam', 'graph_mode': 'off', 'use_snp_selection': False}. Best is trial 19 with value: 0.06757389302384245.
[I 2025-12-05 15:07:36,908] Trial 98 finished with value: 0.039028598805726636 and parameters: {'model_type': 'mlp', 'hidden_dims': '[512, 64]', 'dropout': 0.3474956884557002, 'batch_norm': True, 'lr': 0.0006707142507370225, 'weight_decay': 1.8037636343037664e-07, 'epochs': 132, 'loss': 'mae', 'optimizer': 'adam', 'graph_mode': 'off', 'use_snp_selection': False}. Best is trial 19 with value: 0.06757389302384245.
[I 2025-12-05 15:07:38,177] Trial 99 finished with value: 0.02974710032930809 and parameters: {'model_type': 'mlp', 'hidden_dims': '[512, 64]', 'dropout': 0.2830170681263361, 'batch_norm': False, 'lr': 1.3949785405574673e-05, 'weight_decay': 1.0006896995868323e-07, 'epochs': 158, 'loss': 'mse', 'optimizer': 'adam', 'graph_mode': 'off', 'use_snp_selection': False}. Best is trial 19 with value: 0.06757389302384245.
[I 2025-12-05 15:07:39,283] Trial 100 finished with value: 0.04811234742724504 and parameters: {'model_type': 'mlp', 'hidden_dims': '[512, 256]', 'dropout': 0.5971631939042018, 'batch_norm': True, 'lr': 2.370143727042895e-05, 'weight_decay': 1.1021429672796684e-06, 'epochs': 111, 'loss': 'mse', 'optimizer': 'adam', 'graph_mode': 'off', 'use_snp_selection': False}. Best is trial 19 with value: 0.06757389302384245.
[I 2025-12-05 15:07:40,301] Trial 101 finished with value: 0.05281746957346835 and parameters: {'model_type': 'mlp', 'hidden_dims': '[512, 64]', 'dropout': 0.3909530127020574, 'batch_norm': False, 'lr': 4.14951403981625e-05, 'weight_decay': 1.5469610721334583e-07, 'epochs': 96, 'loss': 'mse', 'optimizer': 'adam', 'graph_mode': 'off', 'use_snp_selection': False}. Best is trial 19 with value: 0.06757389302384245.
[I 2025-12-05 15:07:41,150] Trial 102 finished with value: 0.022247797681302257 and parameters: {'model_type': 'mlp', 'hidden_dims': '[512, 64]', 'dropout': 0.36482704661826126, 'batch_norm': False, 'lr': 3.1507928026042564e-05, 'weight_decay': 3.2774305513563935e-06, 'epochs': 48, 'loss': 'mse', 'optimizer': 'adam', 'graph_mode': 'off', 'use_snp_selection': False}. Best is trial 19 with value: 0.06757389302384245.
[I 2025-12-05 15:07:42,215] Trial 103 finished with value: 0.026602682055965127 and parameters: {'model_type': 'mlp', 'hidden_dims': '[512, 64]', 'dropout': 0.26087399310364406, 'batch_norm': False, 'lr': 7.960369244707001e-06, 'weight_decay': 1.2425823062328614e-07, 'epochs': 110, 'loss': 'mse', 'optimizer': 'adam', 'graph_mode': 'off', 'use_snp_selection': False}. Best is trial 19 with value: 0.06757389302384245.
[I 2025-12-05 15:07:43,394] Trial 104 finished with value: 0.025971042497990964 and parameters: {'model_type': 'mlp', 'hidden_dims': '[512, 64]', 'dropout': 0.4118924920040252, 'batch_norm': False, 'lr': 2.1272363003535833e-05, 'weight_decay': 2.3519423711872466e-07, 'epochs': 143, 'loss': 'mse', 'optimizer': 'adam', 'graph_mode': 'off', 'use_snp_selection': False}. Best is trial 19 with value: 0.06757389302384245.
[I 2025-12-05 15:07:44,403] Trial 105 finished with value: -0.012315688539540945 and parameters: {'model_type': 'mlp', 'hidden_dims': '[512, 64]', 'dropout': 0.37993237381635003, 'batch_norm': False, 'lr': 0.0004920060241380058, 'weight_decay': 1.4678528557847186e-07, 'epochs': 94, 'loss': 'mse', 'optimizer': 'adam', 'graph_mode': 'off', 'use_snp_selection': False}. Best is trial 19 with value: 0.06757389302384245.
[I 2025-12-05 15:07:45,359] Trial 106 finished with value: 0.03455587322276662 and parameters: {'model_type': 'mlp', 'hidden_dims': '[512, 256]', 'dropout': 0.434798374760324, 'batch_norm': False, 'lr': 1.8254884482157134e-05, 'weight_decay': 7.139500092741731e-07, 'epochs': 64, 'loss': 'mse', 'optimizer': 'adam', 'graph_mode': 'off', 'use_snp_selection': False}. Best is trial 19 with value: 0.06757389302384245.
[I 2025-12-05 15:07:47,248] Trial 107 finished with value: 9.950119931029695e-05 and parameters: {'model_type': 'mlp', 'hidden_dims': '[512, 64]', 'dropout': 0.4759168819607118, 'batch_norm': True, 'lr': 1.1210607364709622e-05, 'weight_decay': 1.8302754702875696e-06, 'epochs': 40, 'loss': 'mse', 'optimizer': 'adam', 'graph_mode': 'off', 'use_snp_selection': True, 'num_snps': 37972}. Best is trial 19 with value: 0.06757389302384245.
[I 2025-12-05 15:07:48,385] Trial 108 finished with value: 0.058544528212724295 and parameters: {'model_type': 'mlp', 'hidden_dims': '[512, 256]', 'dropout': 0.3398644244095481, 'batch_norm': False, 'lr': 2.5620688834506466e-05, 'weight_decay': 1.7111732226318485e-07, 'epochs': 120, 'loss': 'mse', 'optimizer': 'adam', 'graph_mode': 'off', 'use_snp_selection': False}. Best is trial 19 with value: 0.06757389302384245.
[I 2025-12-05 15:07:49,380] Trial 109 finished with value: 0.007514136189758809 and parameters: {'model_type': 'mlp', 'hidden_dims': '[512, 256]', 'dropout': 0.34215339523761906, 'batch_norm': False, 'lr': 0.00037610220606246186, 'weight_decay': 3.7666365599936776e-07, 'epochs': 89, 'loss': 'mse', 'optimizer': 'adam', 'graph_mode': 'off', 'use_snp_selection': False}. Best is trial 19 with value: 0.06757389302384245.
[I 2025-12-05 15:07:50,493] Trial 110 finished with value: 0.03336811339887518 and parameters: {'model_type': 'mlp', 'hidden_dims': '[512, 256]', 'dropout': 0.3045900082091418, 'batch_norm': True, 'lr': 2.5408847252103675e-05, 'weight_decay': 2.031226892179982e-07, 'epochs': 122, 'loss': 'mse', 'optimizer': 'adam', 'graph_mode': 'off', 'use_snp_selection': False}. Best is trial 19 with value: 0.06757389302384245.
[I 2025-12-05 15:07:51,540] Trial 111 finished with value: 0.040725177890024514 and parameters: {'model_type': 'mlp', 'hidden_dims': '[512, 256]', 'dropout': 0.368741977312131, 'batch_norm': False, 'lr': 3.3935079207882243e-05, 'weight_decay': 1.6882655230558344e-07, 'epochs': 100, 'loss': 'mse', 'optimizer': 'adam', 'graph_mode': 'off', 'use_snp_selection': False}. Best is trial 19 with value: 0.06757389302384245.
[I 2025-12-05 15:07:52,681] Trial 112 finished with value: 0.03317236127528797 and parameters: {'model_type': 'mlp', 'hidden_dims': '[512, 256]', 'dropout': 0.3345647304305217, 'batch_norm': False, 'lr': 8.176063337678e-05, 'weight_decay': 1.242888120028729e-07, 'epochs': 132, 'loss': 'mse', 'optimizer': 'adam', 'graph_mode': 'off', 'use_snp_selection': False}. Best is trial 19 with value: 0.06757389302384245.
[I 2025-12-05 15:07:53,457] Trial 113 finished with value: 0.04239911617112836 and parameters: {'model_type': 'mlp', 'hidden_dims': '[256, 128]', 'dropout': 0.3229134411312853, 'batch_norm': False, 'lr': 2.8065404349252333e-05, 'weight_decay': 2.9043986583930603e-07, 'epochs': 114, 'loss': 'mse', 'optimizer': 'adam', 'graph_mode': 'off', 'use_snp_selection': False}. Best is trial 19 with value: 0.06757389302384245.
[I 2025-12-05 15:07:54,636] Trial 114 finished with value: 0.03092103047438577 and parameters: {'model_type': 'mlp', 'hidden_dims': '[512, 64]', 'dropout': 0.18053938419877508, 'batch_norm': False, 'lr': 1.7015957393967455e-05, 'weight_decay': 2.3462908674859313e-07, 'epochs': 128, 'loss': 'mse', 'optimizer': 'adam', 'graph_mode': 'off', 'use_snp_selection': False}. Best is trial 19 with value: 0.06757389302384245.
[I 2025-12-05 15:07:55,304] Trial 115 finished with value: 0.01951396497225566 and parameters: {'model_type': 'mlp', 'hidden_dims': '[128, 64]', 'dropout': 0.395969955767673, 'batch_norm': False, 'lr': 1.258613244465336e-05, 'weight_decay': 1.6762491046270608e-07, 'epochs': 73, 'loss': 'mse', 'optimizer': 'adam', 'graph_mode': 'off', 'use_snp_selection': False}. Best is trial 19 with value: 0.06757389302384245.
[I 2025-12-05 15:07:56,757] Trial 116 finished with value: 0.04218936888149252 and parameters: {'model_type': 'mlp', 'hidden_dims': '[512, 256]', 'dropout': 0.14014500223148083, 'batch_norm': False, 'lr': 5.867607767018387e-05, 'weight_decay': 1.209259944457052e-07, 'epochs': 209, 'loss': 'mse', 'optimizer': 'adam', 'graph_mode': 'off', 'use_snp_selection': False}. Best is trial 19 with value: 0.06757389302384245.
[I 2025-12-05 15:07:57,825] Trial 117 finished with value: 0.029962844955460644 and parameters: {'model_type': 'mlp', 'hidden_dims': '[512, 128]', 'dropout': 0.16843533203053368, 'batch_norm': True, 'lr': 0.00025713868548698235, 'weight_decay': 2.032337349952386e-07, 'epochs': 108, 'loss': 'mae', 'optimizer': 'adam', 'graph_mode': 'off', 'use_snp_selection': False}. Best is trial 19 with value: 0.06757389302384245.
[I 2025-12-05 15:07:58,938] Trial 118 finished with value: -0.0024061974968846087 and parameters: {'model_type': 'mlp', 'hidden_dims': '[512, 64]', 'dropout': 0.35795430101061787, 'batch_norm': False, 'lr': 0.0008515393041587702, 'weight_decay': 1.454834709168612e-07, 'epochs': 123, 'loss': 'mse', 'optimizer': 'adam', 'graph_mode': 'off', 'use_snp_selection': False}. Best is trial 19 with value: 0.06757389302384245.
[I 2025-12-05 15:07:59,665] Trial 119 finished with value: 0.03283275175357485 and parameters: {'model_type': 'mlp', 'hidden_dims': '[256, 128, 64]', 'dropout': 0.42404543895509245, 'batch_norm': False, 'lr': 2.3121029914267814e-05, 'weight_decay': 5.261783626674796e-07, 'epochs': 81, 'loss': 'mse', 'optimizer': 'adam', 'graph_mode': 'off', 'use_snp_selection': False}. Best is trial 19 with value: 0.06757389302384245.
[I 2025-12-05 15:08:00,666] Trial 120 finished with value: 0.03634802729590195 and parameters: {'model_type': 'mlp', 'hidden_dims': '[512, 256]', 'dropout': 0.3837236543751502, 'batch_norm': True, 'lr': 4.055590504778131e-05, 'weight_decay': 1.0032114257370476e-07, 'epochs': 89, 'loss': 'mse', 'optimizer': 'adam', 'graph_mode': 'off', 'use_snp_selection': False}. Best is trial 19 with value: 0.06757389302384245.
[I 2025-12-05 15:08:02,220] Trial 121 finished with value: 0.03168432284841489 and parameters: {'model_type': 'mlp', 'hidden_dims': '[512, 64]', 'dropout': 0.4811826711782286, 'batch_norm': False, 'lr': 5.811860713803634e-06, 'weight_decay': 0.0002794656949026859, 'epochs': 238, 'loss': 'mse', 'optimizer': 'adam', 'graph_mode': 'off', 'use_snp_selection': False}. Best is trial 19 with value: 0.06757389302384245.
[I 2025-12-05 15:08:03,794] Trial 122 finished with value: 0.03989448041478473 and parameters: {'model_type': 'mlp', 'hidden_dims': '[512, 64]', 'dropout': 0.4542945242738336, 'batch_norm': False, 'lr': 9.20710350957708e-06, 'weight_decay': 2.981187278816308e-05, 'epochs': 245, 'loss': 'mse', 'optimizer': 'adam', 'graph_mode': 'off', 'use_snp_selection': False}. Best is trial 19 with value: 0.06757389302384245.
[I 2025-12-05 15:08:05,304] Trial 123 finished with value: 0.004243413431422626 and parameters: {'model_type': 'mlp', 'hidden_dims': '[512, 64]', 'dropout': 0.4065967748515035, 'batch_norm': False, 'lr': 2.2142187164988173e-06, 'weight_decay': 3.5468482530921544e-05, 'epochs': 227, 'loss': 'mse', 'optimizer': 'adam', 'graph_mode': 'off', 'use_snp_selection': False}. Best is trial 19 with value: 0.06757389302384245.
[I 2025-12-05 15:08:06,672] Trial 124 finished with value: 0.02649254910107728 and parameters: {'model_type': 'mlp', 'hidden_dims': '[512, 64]', 'dropout': 0.5133911211870343, 'batch_norm': False, 'lr': 1.4504751778719533e-05, 'weight_decay': 1.4624734112782534e-05, 'epochs': 196, 'loss': 'mse', 'optimizer': 'adam', 'graph_mode': 'off', 'use_snp_selection': False}. Best is trial 19 with value: 0.06757389302384245.
[I 2025-12-05 15:08:08,249] Trial 125 finished with value: 0.04893644132591602 and parameters: {'model_type': 'mlp', 'hidden_dims': '[512, 64]', 'dropout': 0.5016121939539151, 'batch_norm': False, 'lr': 3.3118195324661556e-06, 'weight_decay': 6.665678696603394e-06, 'epochs': 259, 'loss': 'mse', 'optimizer': 'adam', 'graph_mode': 'off', 'use_snp_selection': False}. Best is trial 19 with value: 0.06757389302384245.
[I 2025-12-05 15:08:09,725] Trial 126 finished with value: 0.03072490284126386 and parameters: {'model_type': 'mlp', 'hidden_dims': '[512, 64]', 'dropout': 0.5437196642319234, 'batch_norm': False, 'lr': 4.8536289523353206e-05, 'weight_decay': 2.021297637170804e-05, 'epochs': 103, 'loss': 'mse', 'optimizer': 'adam', 'graph_mode': 'off', 'use_snp_selection': True, 'num_snps': 28304}. Best is trial 19 with value: 0.06757389302384245.
[I 2025-12-05 15:08:11,274] Trial 127 finished with value: 0.007540165973625301 and parameters: {'model_type': 'mlp', 'hidden_dims': '[512, 256]', 'dropout': 0.21133684091581367, 'batch_norm': True, 'lr': 4.665407970734032e-06, 'weight_decay': 1.6792786314455856e-07, 'epochs': 238, 'loss': 'mse', 'optimizer': 'adam', 'graph_mode': 'off', 'use_snp_selection': False}. Best is trial 19 with value: 0.06757389302384245.
[I 2025-12-05 15:08:12,400] Trial 128 finished with value: 0.01939208963436431 and parameters: {'model_type': 'mlp', 'hidden_dims': '[512, 64]', 'dropout': 0.4452694119621527, 'batch_norm': False, 'lr': 3.3176487182204594e-05, 'weight_decay': 3.0638240280057377e-07, 'epochs': 117, 'loss': 'mse', 'optimizer': 'adam', 'graph_mode': 'off', 'use_snp_selection': False}. Best is trial 19 with value: 0.06757389302384245.
[I 2025-12-05 15:08:13,904] Trial 129 finished with value: 0.010078794460830829 and parameters: {'model_type': 'mlp', 'hidden_dims': '[512, 256]', 'dropout': 0.4817021988431508, 'batch_norm': False, 'lr': 6.256231661529784e-06, 'weight_decay': 0.00014616747995536562, 'epochs': 231, 'loss': 'mse', 'optimizer': 'adam', 'graph_mode': 'off', 'use_snp_selection': False}. Best is trial 19 with value: 0.06757389302384245.
[I 2025-12-05 15:08:15,358] Trial 130 finished with value: 0.05395331764592599 and parameters: {'model_type': 'mlp', 'hidden_dims': '[512, 64]', 'dropout': 0.34761582481350134, 'batch_norm': True, 'lr': 0.00011417504195901742, 'weight_decay': 4.5616128447756275e-05, 'epochs': 221, 'loss': 'mse', 'optimizer': 'adam', 'graph_mode': 'off', 'use_snp_selection': False}. Best is trial 19 with value: 0.06757389302384245.
[I 2025-12-05 15:08:16,382] Trial 131 finished with value: 0.05014801151173366 and parameters: {'model_type': 'mlp', 'hidden_dims': '[512, 256]', 'dropout': 0.3267407048865199, 'batch_norm': True, 'lr': 0.0009820655780820656, 'weight_decay': 4.3122602701831234e-07, 'epochs': 98, 'loss': 'mse', 'optimizer': 'adam', 'graph_mode': 'off', 'use_snp_selection': False}. Best is trial 19 with value: 0.06757389302384245.
[I 2025-12-05 15:08:17,363] Trial 132 finished with value: 0.03870700384666592 and parameters: {'model_type': 'mlp', 'hidden_dims': '[512, 256]', 'dropout': 0.2853571095187615, 'batch_norm': True, 'lr': 0.0005760269107605534, 'weight_decay': 1.374577291235609e-07, 'epochs': 86, 'loss': 'mse', 'optimizer': 'adam', 'graph_mode': 'off', 'use_snp_selection': False}. Best is trial 19 with value: 0.06757389302384245.
[I 2025-12-05 15:08:18,233] Trial 133 finished with value: 0.040457463519104904 and parameters: {'model_type': 'mlp', 'hidden_dims': '[512, 256]', 'dropout': 0.5274407488625499, 'batch_norm': True, 'lr': 0.0006634715945248124, 'weight_decay': 8.749369358860407e-05, 'epochs': 53, 'loss': 'mse', 'optimizer': 'adam', 'graph_mode': 'off', 'use_snp_selection': False}. Best is trial 19 with value: 0.06757389302384245.
[I 2025-12-05 15:08:19,154] Trial 134 finished with value: 0.06322640628340838 and parameters: {'model_type': 'mlp', 'hidden_dims': '[512, 256]', 'dropout': 0.31561374336464976, 'batch_norm': True, 'lr': 0.0007326188972132644, 'weight_decay': 2.488301404615008e-07, 'epochs': 69, 'loss': 'mse', 'optimizer': 'adam', 'graph_mode': 'off', 'use_snp_selection': False}. Best is trial 19 with value: 0.06757389302384245.
[I 2025-12-05 15:08:20,050] Trial 135 finished with value: 0.0507648487416609 and parameters: {'model_type': 'mlp', 'hidden_dims': '[512, 256]', 'dropout': 0.3123226676022809, 'batch_norm': True, 'lr': 0.00041730957553024666, 'weight_decay': 2.320609154784211e-07, 'epochs': 57, 'loss': 'mse', 'optimizer': 'adam', 'graph_mode': 'off', 'use_snp_selection': False}. Best is trial 19 with value: 0.06757389302384245.
[I 2025-12-05 15:08:20,949] Trial 136 finished with value: 0.05320257877896504 and parameters: {'model_type': 'mlp', 'hidden_dims': '[512, 64]', 'dropout': 0.3039068672642205, 'batch_norm': True, 'lr': 0.00032073759261647453, 'weight_decay': 3.7263183492407426e-06, 'epochs': 50, 'loss': 'mse', 'optimizer': 'adam', 'graph_mode': 'off', 'use_snp_selection': False}. Best is trial 19 with value: 0.06757389302384245.
[I 2025-12-05 15:08:21,685] Trial 137 finished with value: -0.0027530504126359063 and parameters: {'model_type': 'mlp', 'hidden_dims': '[256, 128]', 'dropout': 0.33360281219444887, 'batch_norm': False, 'lr': 0.0005080774783597516, 'weight_decay': 1.1898859310670074e-07, 'epochs': 68, 'loss': 'mae', 'optimizer': 'adam', 'graph_mode': 'off', 'use_snp_selection': False}. Best is trial 19 with value: 0.06757389302384245.
[I 2025-12-05 15:08:22,659] Trial 138 finished with value: 0.026834629054841984 and parameters: {'model_type': 'mlp', 'hidden_dims': '[512, 256]', 'dropout': 0.47160840660572606, 'batch_norm': False, 'lr': 0.0006025350630480538, 'weight_decay': 1.777077762669438e-07, 'epochs': 78, 'loss': 'mse', 'optimizer': 'adam', 'graph_mode': 'off', 'use_snp_selection': False}. Best is trial 19 with value: 0.06757389302384245.
[I 2025-12-05 15:08:23,569] Trial 139 finished with value: 0.03932645114546087 and parameters: {'model_type': 'mlp', 'hidden_dims': '[512, 64]', 'dropout': 0.26694611316320943, 'batch_norm': True, 'lr': 7.759492202437944e-06, 'weight_decay': 0.0005586103630186783, 'epochs': 59, 'loss': 'mse', 'optimizer': 'adam', 'graph_mode': 'off', 'use_snp_selection': False}. Best is trial 19 with value: 0.06757389302384245.
[I 2025-12-05 15:08:24,391] Trial 140 finished with value: 0.025621107757689113 and parameters: {'model_type': 'mlp', 'hidden_dims': '[128, 64]', 'dropout': 0.5644426562598877, 'batch_norm': False, 'lr': 0.0001585245304801059, 'weight_decay': 2.681723779502298e-07, 'epochs': 254, 'loss': 'mse', 'optimizer': 'adam', 'graph_mode': 'off', 'use_snp_selection': False}. Best is trial 19 with value: 0.06757389302384245.
[I 2025-12-05 15:08:25,440] Trial 141 finished with value: 0.04479947867016586 and parameters: {'model_type': 'mlp', 'hidden_dims': '[512, 256]', 'dropout': 0.11345206828189808, 'batch_norm': True, 'lr': 0.0007864093005033365, 'weight_decay': 2.0628672580352532e-07, 'epochs': 106, 'loss': 'mse', 'optimizer': 'adam', 'graph_mode': 'off', 'use_snp_selection': False}. Best is trial 19 with value: 0.06757389302384245.
[I 2025-12-05 15:08:26,446] Trial 142 finished with value: 0.0391435816428398 and parameters: {'model_type': 'mlp', 'hidden_dims': '[512, 256]', 'dropout': 0.319807683306852, 'batch_norm': True, 'lr': 0.0008571643246342292, 'weight_decay': 3.753928720132653e-07, 'epochs': 93, 'loss': 'mse', 'optimizer': 'adam', 'graph_mode': 'off', 'use_snp_selection': False}. Best is trial 19 with value: 0.06757389302384245.
[I 2025-12-05 15:08:27,422] Trial 143 finished with value: 0.036063978890677036 and parameters: {'model_type': 'mlp', 'hidden_dims': '[512, 256]', 'dropout': 0.35139068579190935, 'batch_norm': True, 'lr': 0.0007125679929538134, 'weight_decay': 1.40838403688613e-07, 'epochs': 85, 'loss': 'mse', 'optimizer': 'adam', 'graph_mode': 'off', 'use_snp_selection': False}. Best is trial 19 with value: 0.06757389302384245.
[I 2025-12-05 15:08:28,850] Trial 144 finished with value: 0.02389522533096944 and parameters: {'model_type': 'mlp', 'hidden_dims': '[512, 256]', 'dropout': 0.31416530611473237, 'batch_norm': True, 'lr': 2.624871045222627e-05, 'weight_decay': 3.167324290833512e-07, 'epochs': 213, 'loss': 'mse', 'optimizer': 'adam', 'graph_mode': 'off', 'use_snp_selection': False}. Best is trial 19 with value: 0.06757389302384245.
[I 2025-12-05 15:08:29,710] Trial 145 finished with value: 0.06003509028367539 and parameters: {'model_type': 'mlp', 'hidden_dims': '[512, 128]', 'dropout': 0.13195673955979453, 'batch_norm': True, 'lr': 0.0008920344290502334, 'weight_decay': 1.5881988149891893e-07, 'epochs': 43, 'loss': 'mse', 'optimizer': 'adam', 'graph_mode': 'off', 'use_snp_selection': False}. Best is trial 19 with value: 0.06757389302384245.
