[I 2025-12-09 22:51:55,009] Trial 105 finished with value: 0.33590599463646015 and parameters: {'model_type': 'graphsage', 'hidden_dims': '[256, 128]', 'dropout': 0.3969086974296206, 'batch_norm': False, 'sage_aggr': 'mean', 'sage_normalize': False, 'sage_project': False, 'lr': 1.3006127171602414e-05, 'weight_decay': 2.080912549029499e-07, 'epochs': 189, 'loss': 'mse', 'optimizer': 'adam', 'graph_mode': 'knn', 'knn_k': 1, 'weighted_edges': True, 'symmetrize_mode': 'union', 'self_loops': True, 'use_snp_selection': False}. Best is trial 66 with value: 0.37695463223152365.
[I 2025-12-09 22:55:54,132] Trial 106 finished with value: 0.3633327455826118 and parameters: {'model_type': 'graphsage', 'hidden_dims': '[256, 128]', 'dropout': 0.4323072884615062, 'batch_norm': False, 'sage_aggr': 'mean', 'sage_normalize': False, 'sage_project': False, 'lr': 4.267470448582535e-05, 'weight_decay': 6.681637184013596e-07, 'epochs': 287, 'loss': 'mse', 'optimizer': 'adam', 'graph_mode': 'knn', 'knn_k': 9, 'weighted_edges': True, 'symmetrize_mode': 'union', 'self_loops': True, 'use_snp_selection': False}. Best is trial 66 with value: 0.37695463223152365.
[I 2025-12-09 22:57:25,904] Trial 107 finished with value: 0.36453661915591545 and parameters: {'model_type': 'graphsage', 'hidden_dims': '[256, 128]', 'dropout': 0.4139380039387758, 'batch_norm': False, 'sage_aggr': 'mean', 'sage_normalize': False, 'sage_project': False, 'lr': 3.140593336772275e-05, 'weight_decay': 3.561480278981349e-07, 'epochs': 213, 'loss': 'mse', 'optimizer': 'adam', 'graph_mode': 'knn', 'knn_k': 3, 'weighted_edges': True, 'symmetrize_mode': 'union', 'self_loops': True, 'use_snp_selection': False}. Best is trial 66 with value: 0.37695463223152365.
[I 2025-12-09 23:01:21,919] Trial 108 finished with value: 0.3604783430658133 and parameters: {'model_type': 'graphsage', 'hidden_dims': '[256, 128, 64]', 'dropout': 0.3560648165397735, 'batch_norm': False, 'sage_aggr': 'mean', 'sage_normalize': False, 'sage_project': False, 'lr': 2.3437249778621136e-05, 'weight_decay': 2.644766166824766e-07, 'epochs': 260, 'loss': 'mse', 'optimizer': 'adam', 'graph_mode': 'knn', 'knn_k': 10, 'weighted_edges': True, 'symmetrize_mode': 'union', 'self_loops': True, 'use_snp_selection': False}. Best is trial 66 with value: 0.37695463223152365.
[I 2025-12-09 23:04:50,794] Trial 109 finished with value: 0.3729479927982481 and parameters: {'model_type': 'graphsage', 'hidden_dims': '[256, 128]', 'dropout': 0.44753272736095295, 'batch_norm': False, 'sage_aggr': 'mean', 'sage_normalize': False, 'sage_project': False, 'lr': 1.5199223829102642e-05, 'weight_decay': 1.3459688883023855e-07, 'epochs': 250, 'loss': 'mse', 'optimizer': 'adam', 'graph_mode': 'knn', 'knn_k': 9, 'weighted_edges': True, 'symmetrize_mode': 'union', 'self_loops': True, 'use_snp_selection': False}. Best is trial 66 with value: 0.37695463223152365.
[I 2025-12-09 23:08:16,644] Trial 110 finished with value: 0.3743305497856732 and parameters: {'model_type': 'graphsage', 'hidden_dims': '[256, 128]', 'dropout': 0.44607341023948965, 'batch_norm': False, 'sage_aggr': 'mean', 'sage_normalize': False, 'sage_project': False, 'lr': 1.1449449939600103e-05, 'weight_decay': 1.4429828634351666e-07, 'epochs': 246, 'loss': 'mse', 'optimizer': 'adam', 'graph_mode': 'knn', 'knn_k': 9, 'weighted_edges': True, 'symmetrize_mode': 'union', 'self_loops': True, 'use_snp_selection': False}. Best is trial 66 with value: 0.37695463223152365.
[I 2025-12-09 23:11:27,220] Trial 111 finished with value: 0.37082822934990173 and parameters: {'model_type': 'graphsage', 'hidden_dims': '[256, 128]', 'dropout': 0.48435521792344527, 'batch_norm': False, 'sage_aggr': 'mean', 'sage_normalize': False, 'sage_project': False, 'lr': 1.1648669652074685e-05, 'weight_decay': 1.1893178945274815e-07, 'epochs': 227, 'loss': 'mse', 'optimizer': 'adam', 'graph_mode': 'knn', 'knn_k': 9, 'weighted_edges': True, 'symmetrize_mode': 'union', 'self_loops': True, 'use_snp_selection': False}. Best is trial 66 with value: 0.37695463223152365.
[I 2025-12-09 23:14:39,531] Trial 112 finished with value: 0.37395828771813666 and parameters: {'model_type': 'graphsage', 'hidden_dims': '[256, 128]', 'dropout': 0.44671144628071374, 'batch_norm': False, 'sage_aggr': 'mean', 'sage_normalize': False, 'sage_project': False, 'lr': 1.5085316861094885e-05, 'weight_decay': 1.71385463463253e-07, 'epochs': 251, 'loss': 'mse', 'optimizer': 'adam', 'graph_mode': 'knn', 'knn_k': 8, 'weighted_edges': True, 'symmetrize_mode': 'union', 'self_loops': True, 'use_snp_selection': False}. Best is trial 66 with value: 0.37695463223152365.
[I 2025-12-09 23:18:00,856] Trial 113 finished with value: 0.3703385379769817 and parameters: {'model_type': 'graphsage', 'hidden_dims': '[256, 128]', 'dropout': 0.4605139264421934, 'batch_norm': False, 'sage_aggr': 'mean', 'sage_normalize': False, 'sage_project': False, 'lr': 1.5690343858872156e-05, 'weight_decay': 1.4426658260017665e-07, 'epochs': 263, 'loss': 'mse', 'optimizer': 'adam', 'graph_mode': 'knn', 'knn_k': 8, 'weighted_edges': True, 'symmetrize_mode': 'union', 'self_loops': True, 'use_snp_selection': False}. Best is trial 66 with value: 0.37695463223152365.
[I 2025-12-09 23:21:44,499] Trial 114 finished with value: 0.3676526981088702 and parameters: {'model_type': 'graphsage', 'hidden_dims': '[256, 128]', 'dropout': 0.45017425452813165, 'batch_norm': False, 'sage_aggr': 'mean', 'sage_normalize': False, 'sage_project': False, 'lr': 1.3778974058046682e-05, 'weight_decay': 1.8625592509060218e-07, 'epochs': 247, 'loss': 'mse', 'optimizer': 'adam', 'graph_mode': 'knn', 'knn_k': 10, 'weighted_edges': True, 'symmetrize_mode': 'union', 'self_loops': True, 'use_snp_selection': False}. Best is trial 66 with value: 0.37695463223152365.
[I 2025-12-09 23:25:48,567] Trial 115 finished with value: 0.3685680584972556 and parameters: {'model_type': 'graphsage', 'hidden_dims': '[256, 128]', 'dropout': 0.47377791142737796, 'batch_norm': False, 'sage_aggr': 'mean', 'sage_normalize': False, 'sage_project': False, 'lr': 1.0692127389979591e-05, 'weight_decay': 1.1519052988509277e-07, 'epochs': 270, 'loss': 'mse', 'optimizer': 'adam', 'graph_mode': 'knn', 'knn_k': 10, 'weighted_edges': True, 'symmetrize_mode': 'union', 'self_loops': True, 'use_snp_selection': False}. Best is trial 66 with value: 0.37695463223152365.
[I 2025-12-09 23:28:19,184] Trial 116 finished with value: 0.3629350220450373 and parameters: {'model_type': 'graphsage', 'hidden_dims': '[256, 128]', 'dropout': 0.443637911680377, 'batch_norm': False, 'sage_aggr': 'mean', 'sage_normalize': False, 'sage_project': False, 'lr': 1.484028508635811e-05, 'weight_decay': 1.558997191624543e-07, 'epochs': 252, 'loss': 'mse', 'optimizer': 'adam', 'graph_mode': 'knn', 'knn_k': 10, 'weighted_edges': True, 'symmetrize_mode': 'mutual', 'self_loops': True, 'use_snp_selection': False}. Best is trial 66 with value: 0.37695463223152365.
[I 2025-12-09 23:31:19,696] Trial 117 finished with value: 0.33356918768723753 and parameters: {'model_type': 'graphsage', 'hidden_dims': '[256, 128]', 'dropout': 0.5120268708863095, 'batch_norm': True, 'sage_aggr': 'mean', 'sage_normalize': True, 'sage_project': False, 'lr': 1.2425777672689964e-05, 'weight_decay': 1.6777566201127578e-07, 'epochs': 249, 'loss': 'mse', 'optimizer': 'adam', 'graph_mode': 'knn', 'knn_k': 8, 'weighted_edges': True, 'symmetrize_mode': 'union', 'self_loops': False, 'use_snp_selection': False}. Best is trial 66 with value: 0.37695463223152365.
[I 2025-12-09 23:34:19,477] Trial 118 finished with value: 0.37179554611774307 and parameters: {'model_type': 'graphsage', 'hidden_dims': '[256, 128]', 'dropout': 0.4204404184211254, 'batch_norm': False, 'sage_aggr': 'mean', 'sage_normalize': False, 'sage_project': False, 'lr': 1.7809038722815354e-05, 'weight_decay': 2.551964944426251e-07, 'epochs': 214, 'loss': 'mse', 'optimizer': 'adam', 'graph_mode': 'knn', 'knn_k': 9, 'weighted_edges': True, 'symmetrize_mode': 'union', 'self_loops': True, 'use_snp_selection': False}. Best is trial 66 with value: 0.37695463223152365.
[I 2025-12-09 23:37:37,476] Trial 119 finished with value: 0.3744170473179659 and parameters: {'model_type': 'graphsage', 'hidden_dims': '[256, 128]', 'dropout': 0.4194797751987929, 'batch_norm': False, 'sage_aggr': 'mean', 'sage_normalize': False, 'sage_project': False, 'lr': 1.7312355681519363e-05, 'weight_decay': 2.2403401284766033e-07, 'epochs': 218, 'loss': 'mse', 'optimizer': 'adam', 'graph_mode': 'knn', 'knn_k': 10, 'weighted_edges': True, 'symmetrize_mode': 'union', 'self_loops': True, 'use_snp_selection': False}. Best is trial 66 with value: 0.37695463223152365.
[I 2025-12-09 23:41:01,229] Trial 120 finished with value: 0.3638503783504906 and parameters: {'model_type': 'graphsage', 'hidden_dims': '[512, 64]', 'dropout': 0.436358676038558, 'batch_norm': False, 'sage_aggr': 'mean', 'sage_normalize': False, 'sage_project': False, 'lr': 2.027417449936029e-05, 'weight_decay': 2.1732164980397722e-07, 'epochs': 213, 'loss': 'mse', 'optimizer': 'adam', 'graph_mode': 'knn', 'knn_k': 7, 'weighted_edges': True, 'symmetrize_mode': 'union', 'self_loops': True, 'use_snp_selection': False}. Best is trial 66 with value: 0.37695463223152365.
[I 2025-12-09 23:44:25,725] Trial 121 finished with value: 0.36501149480527195 and parameters: {'model_type': 'graphsage', 'hidden_dims': '[256, 128]', 'dropout': 0.41899879485663416, 'batch_norm': False, 'sage_aggr': 'mean', 'sage_normalize': False, 'sage_project': False, 'lr': 1.628777647470685e-05, 'weight_decay': 2.495615569068904e-07, 'epochs': 225, 'loss': 'mse', 'optimizer': 'adam', 'graph_mode': 'knn', 'knn_k': 10, 'weighted_edges': True, 'symmetrize_mode': 'union', 'self_loops': True, 'use_snp_selection': False}. Best is trial 66 with value: 0.37695463223152365.
[I 2025-12-09 23:47:45,954] Trial 122 finished with value: 0.3685411637023557 and parameters: {'model_type': 'graphsage', 'hidden_dims': '[256, 128]', 'dropout': 0.46489678049692373, 'batch_norm': False, 'sage_aggr': 'mean', 'sage_normalize': False, 'sage_project': False, 'lr': 1.0941236633334956e-05, 'weight_decay': 1.3702417498762588e-07, 'epochs': 220, 'loss': 'mse', 'optimizer': 'adam', 'graph_mode': 'knn', 'knn_k': 10, 'weighted_edges': True, 'symmetrize_mode': 'union', 'self_loops': True, 'use_snp_selection': False}. Best is trial 66 with value: 0.37695463223152365.
[I 2025-12-09 23:50:58,911] Trial 123 finished with value: 0.37349838268525 and parameters: {'model_type': 'graphsage', 'hidden_dims': '[256, 128]', 'dropout': 0.3851710042814934, 'batch_norm': False, 'sage_aggr': 'mean', 'sage_normalize': False, 'sage_project': False, 'lr': 1.338225573233204e-05, 'weight_decay': 2.0651170288700175e-07, 'epochs': 230, 'loss': 'mse', 'optimizer': 'adam', 'graph_mode': 'knn', 'knn_k': 9, 'weighted_edges': True, 'symmetrize_mode': 'union', 'self_loops': True, 'use_snp_selection': False}. Best is trial 66 with value: 0.37695463223152365.
[I 2025-12-09 23:54:15,035] Trial 124 finished with value: 0.37352201752051617 and parameters: {'model_type': 'graphsage', 'hidden_dims': '[256, 128]', 'dropout': 0.38916858480407923, 'batch_norm': False, 'sage_aggr': 'mean', 'sage_normalize': False, 'sage_project': False, 'lr': 2.199644570257877e-05, 'weight_decay': 1.9589147794728777e-07, 'epochs': 234, 'loss': 'mse', 'optimizer': 'adam', 'graph_mode': 'knn', 'knn_k': 9, 'weighted_edges': True, 'symmetrize_mode': 'union', 'self_loops': True, 'use_snp_selection': False}. Best is trial 66 with value: 0.37695463223152365.
[I 2025-12-09 23:57:27,985] Trial 125 finished with value: 0.35252853425087755 and parameters: {'model_type': 'graphsage', 'hidden_dims': '[256, 128]', 'dropout': 0.3790296366334799, 'batch_norm': False, 'sage_aggr': 'mean', 'sage_normalize': False, 'sage_project': False, 'lr': 0.00032043007030487305, 'weight_decay': 1.911845654651403e-07, 'epochs': 230, 'loss': 'mse', 'optimizer': 'adam', 'graph_mode': 'knn', 'knn_k': 9, 'weighted_edges': True, 'symmetrize_mode': 'union', 'self_loops': True, 'use_snp_selection': False}. Best is trial 66 with value: 0.37695463223152365.
[I 2025-12-10 00:00:48,365] Trial 126 finished with value: 0.3715405717159273 and parameters: {'model_type': 'graphsage', 'hidden_dims': '[256, 128]', 'dropout': 0.38473419852423496, 'batch_norm': False, 'sage_aggr': 'mean', 'sage_normalize': False, 'sage_project': False, 'lr': 3.065764630419262e-05, 'weight_decay': 1.2301218018572683e-07, 'epochs': 239, 'loss': 'mse', 'optimizer': 'adam', 'graph_mode': 'knn', 'knn_k': 9, 'weighted_edges': True, 'symmetrize_mode': 'union', 'self_loops': True, 'use_snp_selection': False}. Best is trial 66 with value: 0.37695463223152365.
[I 2025-12-10 00:04:19,067] Trial 127 finished with value: 0.3702678378955255 and parameters: {'model_type': 'graphsage', 'hidden_dims': '[256, 128]', 'dropout': 0.39038544575661405, 'batch_norm': False, 'sage_aggr': 'mean', 'sage_normalize': False, 'sage_project': False, 'lr': 1.3814587836263571e-05, 'weight_decay': 1.659453997278301e-07, 'epochs': 232, 'loss': 'mse', 'optimizer': 'adam', 'graph_mode': 'knn', 'knn_k': 10, 'weighted_edges': True, 'symmetrize_mode': 'union', 'self_loops': True, 'use_snp_selection': False}. Best is trial 66 with value: 0.37695463223152365.
[I 2025-12-10 00:07:34,204] Trial 128 finished with value: 0.3721402485485691 and parameters: {'model_type': 'graphsage', 'hidden_dims': '[256, 128]', 'dropout': 0.41105382033902654, 'batch_norm': False, 'sage_aggr': 'mean', 'sage_normalize': False, 'sage_project': False, 'lr': 2.5802736734402903e-05, 'weight_decay': 2.1602770700474873e-07, 'epochs': 255, 'loss': 'mse', 'optimizer': 'adam', 'graph_mode': 'knn', 'knn_k': 8, 'weighted_edges': True, 'symmetrize_mode': 'union', 'self_loops': True, 'use_snp_selection': False}. Best is trial 66 with value: 0.37695463223152365.
[I 2025-12-10 00:12:00,965] Trial 129 finished with value: 0.3762340828262311 and parameters: {'model_type': 'graphsage', 'hidden_dims': '[512, 256]', 'dropout': 0.4494375645362679, 'batch_norm': False, 'sage_aggr': 'mean', 'sage_normalize': False, 'sage_project': False, 'lr': 2.2033499025119225e-05, 'weight_decay': 3.543364254982592e-07, 'epochs': 246, 'loss': 'mse', 'optimizer': 'adam', 'graph_mode': 'knn', 'knn_k': 9, 'weighted_edges': True, 'symmetrize_mode': 'union', 'self_loops': True, 'use_snp_selection': False}. Best is trial 66 with value: 0.37695463223152365.
[I 2025-12-10 00:16:21,494] Trial 130 finished with value: 0.3708222765965607 and parameters: {'model_type': 'graphsage', 'hidden_dims': '[512, 256]', 'dropout': 0.4497651192474748, 'batch_norm': False, 'sage_aggr': 'mean', 'sage_normalize': False, 'sage_project': False, 'lr': 2.1574080787172366e-05, 'weight_decay': 1.036414480594052e-07, 'epochs': 240, 'loss': 'mse', 'optimizer': 'adam', 'graph_mode': 'knn', 'knn_k': 9, 'weighted_edges': True, 'symmetrize_mode': 'union', 'self_loops': True, 'use_snp_selection': False}. Best is trial 66 with value: 0.37695463223152365.
[I 2025-12-10 00:21:04,170] Trial 131 finished with value: 0.37107458161886514 and parameters: {'model_type': 'graphsage', 'hidden_dims': '[512, 256]', 'dropout': 0.43852196277863664, 'batch_norm': False, 'sage_aggr': 'mean', 'sage_normalize': False, 'sage_project': False, 'lr': 2.28891405706746e-05, 'weight_decay': 2.92116173375379e-07, 'epochs': 261, 'loss': 'mse', 'optimizer': 'adam', 'graph_mode': 'knn', 'knn_k': 9, 'weighted_edges': True, 'symmetrize_mode': 'union', 'self_loops': True, 'use_snp_selection': False}. Best is trial 66 with value: 0.37695463223152365.
[I 2025-12-10 00:25:45,473] Trial 132 finished with value: 0.3736860253772135 and parameters: {'model_type': 'graphsage', 'hidden_dims': '[512, 256]', 'dropout': 0.48680824110876475, 'batch_norm': False, 'sage_aggr': 'mean', 'sage_normalize': False, 'sage_project': False, 'lr': 1.5957958570659626e-05, 'weight_decay': 3.7166917677893507e-07, 'epochs': 244, 'loss': 'mse', 'optimizer': 'adam', 'graph_mode': 'knn', 'knn_k': 10, 'weighted_edges': True, 'symmetrize_mode': 'union', 'self_loops': True, 'use_snp_selection': False}. Best is trial 66 with value: 0.37695463223152365.
[I 2025-12-10 00:30:13,351] Trial 133 finished with value: 0.36931735199398935 and parameters: {'model_type': 'graphsage', 'hidden_dims': '[512, 256]', 'dropout': 0.4870067586676279, 'batch_norm': False, 'sage_aggr': 'mean', 'sage_normalize': False, 'sage_project': False, 'lr': 1.719297347048286e-05, 'weight_decay': 1.4715468816017057e-07, 'epochs': 247, 'loss': 'mse', 'optimizer': 'adam', 'graph_mode': 'knn', 'knn_k': 9, 'weighted_edges': True, 'symmetrize_mode': 'union', 'self_loops': True, 'use_snp_selection': False}. Best is trial 66 with value: 0.37695463223152365.
[I 2025-12-10 00:34:33,537] Trial 134 finished with value: 0.3757287238802455 and parameters: {'model_type': 'graphsage', 'hidden_dims': '[512, 256]', 'dropout': 0.5102611552821001, 'batch_norm': False, 'sage_aggr': 'mean', 'sage_normalize': False, 'sage_project': False, 'lr': 1.4899848945157539e-05, 'weight_decay': 3.691081006493855e-07, 'epochs': 225, 'loss': 'mse', 'optimizer': 'adam', 'graph_mode': 'knn', 'knn_k': 10, 'weighted_edges': True, 'symmetrize_mode': 'union', 'self_loops': True, 'use_snp_selection': False}. Best is trial 66 with value: 0.37695463223152365.
[I 2025-12-10 00:38:50,900] Trial 135 finished with value: 0.37699470073723285 and parameters: {'model_type': 'graphsage', 'hidden_dims': '[512, 256]', 'dropout': 0.5625440007019222, 'batch_norm': False, 'sage_aggr': 'mean', 'sage_normalize': False, 'sage_project': False, 'lr': 1.2522020029443065e-05, 'weight_decay': 3.546959055157529e-07, 'epochs': 237, 'loss': 'mse', 'optimizer': 'adam', 'graph_mode': 'knn', 'knn_k': 9, 'weighted_edges': True, 'symmetrize_mode': 'union', 'self_loops': True, 'use_snp_selection': False}. Best is trial 135 with value: 0.37699470073723285.
[I 2025-12-10 00:42:08,464] Trial 136 finished with value: 0.3584040071850661 and parameters: {'model_type': 'graphsage', 'hidden_dims': '[512, 256]', 'dropout': 0.5884163552720253, 'batch_norm': False, 'sage_aggr': 'mean', 'sage_normalize': False, 'sage_project': False, 'lr': 1.2248433092192241e-05, 'weight_decay': 3.3719182354504803e-07, 'epochs': 234, 'loss': 'mse', 'optimizer': 'adam', 'graph_mode': 'knn', 'knn_k': 10, 'weighted_edges': True, 'symmetrize_mode': 'mutual', 'self_loops': True, 'use_snp_selection': False}. Best is trial 135 with value: 0.37699470073723285.
[I 2025-12-10 00:46:12,664] Trial 137 finished with value: 0.36880001854055366 and parameters: {'model_type': 'graphsage', 'hidden_dims': '[512, 256]', 'dropout': 0.5452855854546325, 'batch_norm': False, 'sage_aggr': 'mean', 'sage_normalize': False, 'sage_project': False, 'lr': 1.3738113269294116e-05, 'weight_decay': 4.756743538803511e-07, 'epochs': 225, 'loss': 'mse', 'optimizer': 'adam', 'graph_mode': 'knn', 'knn_k': 9, 'weighted_edges': True, 'symmetrize_mode': 'union', 'self_loops': True, 'use_snp_selection': False}. Best is trial 135 with value: 0.37699470073723285.
[I 2025-12-10 00:49:36,396] Trial 138 finished with value: 0.347638653604607 and parameters: {'model_type': 'graphsage', 'hidden_dims': '[512, 256]', 'dropout': 0.5688927953732191, 'batch_norm': False, 'sage_aggr': 'mean', 'sage_normalize': True, 'sage_project': False, 'lr': 1.1537918162362808e-05, 'weight_decay': 3.7055578893521344e-07, 'epochs': 242, 'loss': 'mse', 'optimizer': 'adam', 'graph_mode': 'knn', 'knn_k': 5, 'weighted_edges': True, 'symmetrize_mode': 'union', 'self_loops': True, 'use_snp_selection': False}. Best is trial 135 with value: 0.37699470073723285.
[I 2025-12-10 00:53:35,285] Trial 139 finished with value: 0.3560529222632754 and parameters: {'model_type': 'graphsage', 'hidden_dims': '[512, 256]', 'dropout': 0.5192148335330198, 'batch_norm': True, 'sage_aggr': 'mean', 'sage_normalize': False, 'sage_project': False, 'lr': 1.910151983232375e-05, 'weight_decay': 2.7154924919591554e-07, 'epochs': 216, 'loss': 'mse', 'optimizer': 'adam', 'graph_mode': 'knn', 'knn_k': 10, 'weighted_edges': True, 'symmetrize_mode': 'union', 'self_loops': False, 'use_snp_selection': False}. Best is trial 135 with value: 0.37699470073723285.
[I 2025-12-10 00:57:01,274] Trial 140 finished with value: 0.36972449198046664 and parameters: {'model_type': 'graphsage', 'hidden_dims': '[512, 256]', 'dropout': 0.56191851774226, 'batch_norm': False, 'sage_aggr': 'mean', 'sage_normalize': False, 'sage_project': False, 'lr': 1.5874910244404547e-05, 'weight_decay': 4.024046834812832e-07, 'epochs': 202, 'loss': 'mse', 'optimizer': 'adam', 'graph_mode': 'knn', 'knn_k': 8, 'weighted_edges': True, 'symmetrize_mode': 'union', 'self_loops': True, 'use_snp_selection': False}. Best is trial 135 with value: 0.37699470073723285.
[I 2025-12-10 01:01:36,451] Trial 141 finished with value: 0.36852453685406794 and parameters: {'model_type': 'graphsage', 'hidden_dims': '[512, 256]', 'dropout': 0.5299974081183684, 'batch_norm': False, 'sage_aggr': 'mean', 'sage_normalize': False, 'sage_project': False, 'lr': 1.4911416864665383e-05, 'weight_decay': 2.2077805666720614e-07, 'epochs': 254, 'loss': 'mse', 'optimizer': 'adam', 'graph_mode': 'knn', 'knn_k': 9, 'weighted_edges': True, 'symmetrize_mode': 'union', 'self_loops': True, 'use_snp_selection': False}. Best is trial 135 with value: 0.37699470073723285.
[I 2025-12-10 01:06:02,269] Trial 142 finished with value: 0.3722923217655528 and parameters: {'model_type': 'graphsage', 'hidden_dims': '[512, 256]', 'dropout': 0.5005906780110954, 'batch_norm': False, 'sage_aggr': 'mean', 'sage_normalize': False, 'sage_project': False, 'lr': 1.3831456788329474e-05, 'weight_decay': 3.04105429110443e-07, 'epochs': 245, 'loss': 'mse', 'optimizer': 'adam', 'graph_mode': 'knn', 'knn_k': 9, 'weighted_edges': True, 'symmetrize_mode': 'union', 'self_loops': True, 'use_snp_selection': False}. Best is trial 135 with value: 0.37699470073723285.
