[I 2025-12-08 15:47:44,555] Trial 42 finished with value: 0.3008191088343886 and parameters: {'model_type': 'graphsage', 'hidden_dims': '[256, 128, 64]', 'dropout': 0.5614711718709352, 'batch_norm': True, 'sage_aggr': 'mean', 'sage_normalize': False, 'sage_project': False, 'lr': 0.00990086976509957, 'weight_decay': 1.145719566944475e-05, 'epochs': 112, 'loss': 'mae', 'optimizer': 'adam', 'graph_mode': 'cutoff', 'cutoff': 0.7947787207509912, 'grm_norm': 'cosine', 'self_loops': False, 'use_snp_selection': True, 'num_snps': 20460}. Best is trial 42 with value: 0.3008191088343886.
[I 2025-12-08 15:48:22,069] Trial 43 finished with value: 0.2892461419126131 and parameters: {'model_type': 'graphsage', 'hidden_dims': '[256, 128, 64]', 'dropout': 0.22958039770756555, 'batch_norm': True, 'sage_aggr': 'mean', 'sage_normalize': False, 'sage_project': False, 'lr': 0.005886138889865016, 'weight_decay': 1.0913164428960882e-05, 'epochs': 56, 'loss': 'mae', 'optimizer': 'adam', 'graph_mode': 'cutoff', 'cutoff': 0.7197186415970575, 'grm_norm': 'cosine', 'self_loops': False, 'use_snp_selection': True, 'num_snps': 22552}. Best is trial 42 with value: 0.3008191088343886.
[I 2025-12-08 15:48:57,452] Trial 44 finished with value: 0.29030236307277846 and parameters: {'model_type': 'graphsage', 'hidden_dims': '[256, 128, 64]', 'dropout': 0.5053190508266091, 'batch_norm': True, 'sage_aggr': 'mean', 'sage_normalize': False, 'sage_project': False, 'lr': 0.00387407961116783, 'weight_decay': 1.5376698189398026e-05, 'epochs': 85, 'loss': 'mae', 'optimizer': 'adam', 'graph_mode': 'cutoff', 'cutoff': 0.7787922017146098, 'grm_norm': 'cosine', 'self_loops': False, 'use_snp_selection': True, 'num_snps': 15475}. Best is trial 42 with value: 0.3008191088343886.
[I 2025-12-08 15:49:48,458] Trial 45 finished with value: 0.29357841136958496 and parameters: {'model_type': 'graphsage', 'hidden_dims': '[256, 128]', 'dropout': 0.5284157145942867, 'batch_norm': True, 'sage_aggr': 'mean', 'sage_normalize': True, 'sage_project': False, 'lr': 0.002561281428343548, 'weight_decay': 7.183026885785061e-06, 'epochs': 55, 'loss': 'mae', 'optimizer': 'adam', 'graph_mode': 'cutoff', 'cutoff': 0.8464394650861864, 'grm_norm': 'none', 'self_loops': False, 'use_snp_selection': True, 'num_snps': 49783}. Best is trial 42 with value: 0.3008191088343886.
[I 2025-12-08 15:50:21,778] Trial 46 finished with value: 0.0 and parameters: {'model_type': 'graphsage', 'hidden_dims': '[256, 128, 64]', 'dropout': 0.45777005507998536, 'batch_norm': False, 'sage_aggr': 'max', 'sage_normalize': False, 'sage_project': False, 'lr': 0.006753412131768367, 'weight_decay': 1.8732080045198944e-05, 'epochs': 114, 'loss': 'mse', 'optimizer': 'adam', 'graph_mode': 'cutoff', 'cutoff': 0.5669021412682165, 'grm_norm': 'cosine_then_gcn', 'self_loops': False, 'use_snp_selection': True, 'num_snps': 8954}. Best is trial 42 with value: 0.3008191088343886.
[I 2025-12-08 15:51:14,291] Trial 47 finished with value: 0.28551872105486475 and parameters: {'model_type': 'graphsage', 'hidden_dims': '[512, 256]', 'dropout': 0.541902058402056, 'batch_norm': True, 'sage_aggr': 'mean', 'sage_normalize': False, 'sage_project': False, 'lr': 0.0018074100896912075, 'weight_decay': 5.77008682786278e-05, 'epochs': 278, 'loss': 'mae', 'optimizer': 'adam', 'graph_mode': 'cutoff', 'cutoff': 0.890283710658773, 'grm_norm': 'none', 'self_loops': True, 'use_snp_selection': True, 'num_snps': 12833}. Best is trial 42 with value: 0.3008191088343886.
[I 2025-12-08 15:52:16,111] Trial 48 finished with value: 0.2878085658490141 and parameters: {'model_type': 'graphsage', 'hidden_dims': '[512, 128]', 'dropout': 0.35939171773722434, 'batch_norm': True, 'sage_aggr': 'mean', 'sage_normalize': False, 'sage_project': False, 'lr': 0.00994049638707738, 'weight_decay': 3.3031925156301634e-05, 'epochs': 109, 'loss': 'mae', 'optimizer': 'adam', 'graph_mode': 'knn', 'knn_k': 7, 'weighted_edges': False, 'symmetrize_mode': 'mutual', 'self_loops': False, 'use_snp_selection': True, 'num_snps': 26955}. Best is trial 42 with value: 0.3008191088343886.
[I 2025-12-08 15:53:00,518] Trial 49 finished with value: 0.28731846427950747 and parameters: {'model_type': 'graphsage', 'hidden_dims': '[512, 64]', 'dropout': 0.5180501402545671, 'batch_norm': True, 'sage_aggr': 'mean', 'sage_normalize': True, 'sage_project': False, 'lr': 0.0002103524412745548, 'weight_decay': 1.0937946507805274e-07, 'epochs': 82, 'loss': 'mae', 'optimizer': 'adam', 'graph_mode': 'cutoff', 'cutoff': 0.7533451667749521, 'grm_norm': 'cosine', 'self_loops': True, 'use_snp_selection': True, 'num_snps': 21931}. Best is trial 42 with value: 0.3008191088343886.
[I 2025-12-08 15:55:01,541] Trial 50 finished with value: 0.2894550321197564 and parameters: {'model_type': 'graphsage', 'hidden_dims': '[256, 128, 64]', 'dropout': 0.5813626316999616, 'batch_norm': True, 'sage_aggr': 'mean', 'sage_normalize': False, 'sage_project': False, 'lr': 0.00012046009097398641, 'weight_decay': 6.448711289881872e-06, 'epochs': 350, 'loss': 'mae', 'optimizer': 'adam', 'graph_mode': 'cutoff', 'cutoff': 0.6635187556203282, 'grm_norm': 'none', 'self_loops': True, 'use_snp_selection': True, 'num_snps': 55498}. Best is trial 42 with value: 0.3008191088343886.
[I 2025-12-08 15:56:02,515] Trial 51 finished with value: 0.29986426520016685 and parameters: {'model_type': 'graphsage', 'hidden_dims': '[256, 128, 64]', 'dropout': 0.5649986024635401, 'batch_norm': True, 'sage_aggr': 'mean', 'sage_normalize': False, 'sage_project': False, 'lr': 0.008325815774441624, 'weight_decay': 4.364763269976016e-06, 'epochs': 163, 'loss': 'mae', 'optimizer': 'adam', 'graph_mode': 'cutoff', 'cutoff': 0.7811547644648144, 'grm_norm': 'cosine', 'self_loops': False, 'use_snp_selection': True, 'num_snps': 38476}. Best is trial 42 with value: 0.3008191088343886.
[I 2025-12-08 15:57:03,765] Trial 52 finished with value: 0.2934865039556614 and parameters: {'model_type': 'graphsage', 'hidden_dims': '[256, 128, 64]', 'dropout': 0.4841519908858618, 'batch_norm': True, 'sage_aggr': 'mean', 'sage_normalize': False, 'sage_project': False, 'lr': 0.006068287580898617, 'weight_decay': 2.9957122367136234e-06, 'epochs': 167, 'loss': 'mae', 'optimizer': 'adam', 'graph_mode': 'cutoff', 'cutoff': 0.7808406758052341, 'grm_norm': 'cosine', 'self_loops': False, 'use_snp_selection': True, 'num_snps': 38216}. Best is trial 42 with value: 0.3008191088343886.
[I 2025-12-08 15:57:59,543] Trial 53 finished with value: 0.2974727523438153 and parameters: {'model_type': 'graphsage', 'hidden_dims': '[256, 128, 64]', 'dropout': 0.5545029567587784, 'batch_norm': True, 'sage_aggr': 'mean', 'sage_normalize': False, 'sage_project': False, 'lr': 0.0028199532453129805, 'weight_decay': 9.298849519692683e-06, 'epochs': 130, 'loss': 'mae', 'optimizer': 'adam', 'graph_mode': 'cutoff', 'cutoff': 0.8436564713890744, 'grm_norm': 'cosine', 'self_loops': False, 'use_snp_selection': True, 'num_snps': 38056}. Best is trial 42 with value: 0.3008191088343886.
[I 2025-12-08 15:59:06,282] Trial 54 finished with value: 0.29670575506903624 and parameters: {'model_type': 'graphsage', 'hidden_dims': '[256, 128, 64]', 'dropout': 0.4475449806060073, 'batch_norm': True, 'sage_aggr': 'mean', 'sage_normalize': False, 'sage_project': False, 'lr': 0.007279130036148571, 'weight_decay': 1.93788101199027e-06, 'epochs': 169, 'loss': 'mae', 'optimizer': 'adam', 'graph_mode': 'cutoff', 'cutoff': 0.8999959650842675, 'grm_norm': 'cosine', 'self_loops': False, 'use_snp_selection': True, 'num_snps': 43140}. Best is trial 42 with value: 0.3008191088343886.
[I 2025-12-08 16:00:11,891] Trial 55 finished with value: 0.2974379001177171 and parameters: {'model_type': 'graphsage', 'hidden_dims': '[256, 128]', 'dropout': 0.5372631137376688, 'batch_norm': True, 'sage_aggr': 'mean', 'sage_normalize': False, 'sage_project': False, 'lr': 0.004192264557767115, 'weight_decay': 3.454852347851564e-06, 'epochs': 150, 'loss': 'mae', 'optimizer': 'adam', 'graph_mode': 'cutoff', 'cutoff': 0.753865640563487, 'grm_norm': 'gcn', 'self_loops': False, 'use_snp_selection': True, 'num_snps': 46513}. Best is trial 42 with value: 0.3008191088343886.
[I 2025-12-08 16:00:44,815] Trial 56 finished with value: 0.29660744684435386 and parameters: {'model_type': 'graphsage', 'hidden_dims': '[256, 128, 64]', 'dropout': 0.4105527037559086, 'batch_norm': True, 'sage_aggr': 'mean', 'sage_normalize': False, 'sage_project': False, 'lr': 0.008034557359121133, 'weight_decay': 1.8352425377597604e-05, 'epochs': 105, 'loss': 'mae', 'optimizer': 'adam', 'graph_mode': 'cutoff', 'cutoff': 0.697766943444931, 'grm_norm': 'none', 'self_loops': True, 'use_snp_selection': False}. Best is trial 42 with value: 0.3008191088343886.
[I 2025-12-08 16:01:12,490] Trial 57 finished with value: 0.25749488930937037 and parameters: {'model_type': 'graphsage', 'hidden_dims': '[256, 128, 64]', 'dropout': 0.10342662893661642, 'batch_norm': False, 'sage_aggr': 'mean', 'sage_normalize': False, 'sage_project': False, 'lr': 0.005132470776649515, 'weight_decay': 1.245969721262361e-05, 'epochs': 75, 'loss': 'mae', 'optimizer': 'adam', 'graph_mode': 'cutoff', 'cutoff': 0.8150820640386197, 'grm_norm': 'cosine_then_gcn', 'self_loops': False, 'use_snp_selection': True, 'num_snps': 2213}. Best is trial 42 with value: 0.3008191088343886.
[I 2025-12-08 16:02:32,334] Trial 58 finished with value: 0.29036742089475165 and parameters: {'model_type': 'graphsage', 'hidden_dims': '[256, 128]', 'dropout': 0.5817488444701192, 'batch_norm': True, 'sage_aggr': 'mean', 'sage_normalize': False, 'sage_project': False, 'lr': 0.003059118605838212, 'weight_decay': 5.716658162257084e-06, 'epochs': 92, 'loss': 'mae', 'optimizer': 'adam', 'graph_mode': 'cutoff', 'cutoff': 0.20263568709003388, 'grm_norm': 'cosine', 'self_loops': True, 'use_snp_selection': True, 'num_snps': 33594}. Best is trial 42 with value: 0.3008191088343886.
[I 2025-12-08 16:03:21,234] Trial 59 finished with value: 0.3001221452473045 and parameters: {'model_type': 'graphsage', 'hidden_dims': '[128, 64]', 'dropout': 0.47748970456300666, 'batch_norm': True, 'sage_aggr': 'max', 'sage_normalize': False, 'sage_project': False, 'lr': 0.009803649507415092, 'weight_decay': 2.237558505681019e-06, 'epochs': 124, 'loss': 'mse', 'optimizer': 'adam', 'graph_mode': 'cutoff', 'cutoff': 0.8729162323042239, 'grm_norm': 'none', 'self_loops': True, 'use_snp_selection': True, 'num_snps': 40740}. Best is trial 42 with value: 0.3008191088343886.
[I 2025-12-08 16:04:03,532] Trial 60 finished with value: 0.30060300994974243 and parameters: {'model_type': 'graphsage', 'hidden_dims': '[128, 64]', 'dropout': 0.48165889161510855, 'batch_norm': True, 'sage_aggr': 'max', 'sage_normalize': False, 'sage_project': False, 'lr': 0.008161944061760795, 'weight_decay': 9.251520763464018e-07, 'epochs': 58, 'loss': 'mse', 'optimizer': 'adam', 'graph_mode': 'cutoff', 'cutoff': 0.8729670329508219, 'grm_norm': 'none', 'self_loops': False, 'use_snp_selection': True, 'num_snps': 40142}. Best is trial 42 with value: 0.3008191088343886.
[I 2025-12-08 16:04:44,940] Trial 61 finished with value: 0.29978914434132264 and parameters: {'model_type': 'graphsage', 'hidden_dims': '[128, 64]', 'dropout': 0.47542231728270373, 'batch_norm': True, 'sage_aggr': 'max', 'sage_normalize': False, 'sage_project': False, 'lr': 0.008368254282362826, 'weight_decay': 1.065170202817757e-06, 'epochs': 52, 'loss': 'mse', 'optimizer': 'adam', 'graph_mode': 'cutoff', 'cutoff': 0.8735575526297904, 'grm_norm': 'none', 'self_loops': False, 'use_snp_selection': True, 'num_snps': 39233}. Best is trial 42 with value: 0.3008191088343886.
[I 2025-12-08 16:05:26,605] Trial 62 finished with value: 0.2991227683491869 and parameters: {'model_type': 'graphsage', 'hidden_dims': '[128, 64]', 'dropout': 0.47774752153911526, 'batch_norm': True, 'sage_aggr': 'max', 'sage_normalize': False, 'sage_project': False, 'lr': 0.007957819949776259, 'weight_decay': 7.220081067496783e-07, 'epochs': 56, 'loss': 'mse', 'optimizer': 'adam', 'graph_mode': 'cutoff', 'cutoff': 0.8738705870376717, 'grm_norm': 'none', 'self_loops': False, 'use_snp_selection': True, 'num_snps': 38858}. Best is trial 42 with value: 0.3008191088343886.
[I 2025-12-08 16:06:09,021] Trial 63 finished with value: 0.2994394629850162 and parameters: {'model_type': 'graphsage', 'hidden_dims': '[128, 64]', 'dropout': 0.41929658373334916, 'batch_norm': True, 'sage_aggr': 'max', 'sage_normalize': False, 'sage_project': False, 'lr': 0.007733869448517068, 'weight_decay': 5.237671285562194e-07, 'epochs': 61, 'loss': 'mse', 'optimizer': 'adam', 'graph_mode': 'cutoff', 'cutoff': 0.8581291798285287, 'grm_norm': 'none', 'self_loops': False, 'use_snp_selection': True, 'num_snps': 39447}. Best is trial 42 with value: 0.3008191088343886.
[I 2025-12-08 16:06:48,690] Trial 64 finished with value: 0.2974957127316392 and parameters: {'model_type': 'graphsage', 'hidden_dims': '[128, 64]', 'dropout': 0.41427574775630077, 'batch_norm': True, 'sage_aggr': 'max', 'sage_normalize': False, 'sage_project': False, 'lr': 0.009140734767052513, 'weight_decay': 4.299484095390061e-07, 'epochs': 53, 'loss': 'mse', 'optimizer': 'adam', 'graph_mode': 'cutoff', 'cutoff': 0.8363580608695023, 'grm_norm': 'none', 'self_loops': False, 'use_snp_selection': True, 'num_snps': 34644}. Best is trial 42 with value: 0.3008191088343886.
[I 2025-12-08 16:07:26,140] Trial 65 finished with value: 0.2962034302479483 and parameters: {'model_type': 'graphsage', 'hidden_dims': '[128, 64]', 'dropout': 0.4375968574031499, 'batch_norm': True, 'sage_aggr': 'max', 'sage_normalize': False, 'sage_project': False, 'lr': 0.003914483581072796, 'weight_decay': 2.3373825080322052e-07, 'epochs': 73, 'loss': 'mse', 'optimizer': 'adam', 'graph_mode': 'cutoff', 'cutoff': 0.8738872511295875, 'grm_norm': 'none', 'self_loops': False, 'use_snp_selection': True, 'num_snps': 27311}. Best is trial 42 with value: 0.3008191088343886.
[I 2025-12-08 16:08:11,209] Trial 66 finished with value: 0.29727946685085327 and parameters: {'model_type': 'graphsage', 'hidden_dims': '[128, 64]', 'dropout': 0.2887297020094694, 'batch_norm': True, 'sage_aggr': 'max', 'sage_normalize': False, 'sage_project': False, 'lr': 0.009812438002065141, 'weight_decay': 1.1054922860729512e-06, 'epochs': 87, 'loss': 'mse', 'optimizer': 'adam', 'graph_mode': 'cutoff', 'cutoff': 0.8288460931707443, 'grm_norm': 'none', 'self_loops': False, 'use_snp_selection': True, 'num_snps': 39970}. Best is trial 42 with value: 0.3008191088343886.
[I 2025-12-08 16:08:54,118] Trial 67 finished with value: 0.2968925247004635 and parameters: {'model_type': 'graphsage', 'hidden_dims': '[128, 64]', 'dropout': 0.472603488571993, 'batch_norm': True, 'sage_aggr': 'max', 'sage_normalize': True, 'sage_project': False, 'lr': 0.005652797707452926, 'weight_decay': 5.409074786015617e-07, 'epochs': 67, 'loss': 'mse', 'optimizer': 'adam', 'graph_mode': 'cutoff', 'cutoff': 0.862754324352408, 'grm_norm': 'none', 'self_loops': False, 'use_snp_selection': True, 'num_snps': 36920}. Best is trial 42 with value: 0.3008191088343886.
[I 2025-12-08 16:09:42,702] Trial 68 finished with value: 0.2731891982013071 and parameters: {'model_type': 'graphsage', 'hidden_dims': '[128, 64]', 'dropout': 0.37584427896759415, 'batch_norm': True, 'sage_aggr': 'max', 'sage_normalize': False, 'sage_project': False, 'lr': 0.007539520824199789, 'weight_decay': 1.0779460970084446e-06, 'epochs': 119, 'loss': 'mse', 'optimizer': 'adam', 'graph_mode': 'knn', 'knn_k': 5, 'weighted_edges': True, 'symmetrize_mode': 'union', 'self_loops': False, 'use_snp_selection': False}. Best is trial 42 with value: 0.3008191088343886.
[I 2025-12-08 16:10:21,340] Trial 69 finished with value: 0.2934291900713572 and parameters: {'model_type': 'graphsage', 'hidden_dims': '[128, 64]', 'dropout': 0.42405192605132214, 'batch_norm': True, 'sage_aggr': 'max', 'sage_normalize': False, 'sage_project': False, 'lr': 0.004583480339743269, 'weight_decay': 2.207555091394586e-06, 'epochs': 48, 'loss': 'mse', 'optimizer': 'adam', 'graph_mode': 'cutoff', 'cutoff': 0.8929848501829559, 'grm_norm': 'none', 'self_loops': False, 'use_snp_selection': True, 'num_snps': 33480}. Best is trial 42 with value: 0.3008191088343886.
[I 2025-12-08 16:10:59,272] Trial 70 finished with value: 0.0 and parameters: {'model_type': 'graphsage', 'hidden_dims': '[128, 64]', 'dropout': 0.3407766470384923, 'batch_norm': False, 'sage_aggr': 'max', 'sage_normalize': False, 'sage_project': False, 'lr': 0.006573109089665334, 'weight_decay': 6.05668028506428e-07, 'epochs': 61, 'loss': 'mse', 'optimizer': 'adam', 'graph_mode': 'cutoff', 'cutoff': 0.8121605516786513, 'grm_norm': 'none', 'self_loops': False, 'use_snp_selection': True, 'num_snps': 29704}. Best is trial 42 with value: 0.3008191088343886.
[I 2025-12-08 16:11:41,417] Trial 71 finished with value: 0.30194556517461046 and parameters: {'model_type': 'graphsage', 'hidden_dims': '[128, 64]', 'dropout': 0.47396171538684245, 'batch_norm': True, 'sage_aggr': 'max', 'sage_normalize': False, 'sage_project': False, 'lr': 0.007904273980657232, 'weight_decay': 2.4879708276359206e-07, 'epochs': 59, 'loss': 'mse', 'optimizer': 'adam', 'graph_mode': 'cutoff', 'cutoff': 0.8721010511034238, 'grm_norm': 'none', 'self_loops': False, 'use_snp_selection': True, 'num_snps': 39030}. Best is trial 71 with value: 0.30194556517461046.
[I 2025-12-08 16:12:23,678] Trial 72 finished with value: 0.2993694241591207 and parameters: {'model_type': 'graphsage', 'hidden_dims': '[128, 64]', 'dropout': 0.4936045571106654, 'batch_norm': True, 'sage_aggr': 'max', 'sage_normalize': False, 'sage_project': False, 'lr': 0.00786149288159952, 'weight_decay': 2.765651610509496e-07, 'epochs': 40, 'loss': 'mse', 'optimizer': 'adam', 'graph_mode': 'cutoff', 'cutoff': 0.8505608345841347, 'grm_norm': 'none', 'self_loops': False, 'use_snp_selection': True, 'num_snps': 43217}. Best is trial 71 with value: 0.30194556517461046.
[I 2025-12-08 16:13:08,248] Trial 73 finished with value: 0.29556179756466194 and parameters: {'model_type': 'graphsage', 'hidden_dims': '[128, 64]', 'dropout': 0.5182336807479851, 'batch_norm': True, 'sage_aggr': 'max', 'sage_normalize': False, 'sage_project': False, 'lr': 0.005638071026164038, 'weight_decay': 2.956115822876997e-07, 'epochs': 80, 'loss': 'mse', 'optimizer': 'adam', 'graph_mode': 'cutoff', 'cutoff': 0.8810017692615197, 'grm_norm': 'none', 'self_loops': False, 'use_snp_selection': True, 'num_snps': 40060}. Best is trial 71 with value: 0.30194556517461046.
[I 2025-12-08 16:13:49,555] Trial 74 finished with value: 0.3021457282627437 and parameters: {'model_type': 'graphsage', 'hidden_dims': '[128, 64]', 'dropout': 0.45674216097782233, 'batch_norm': True, 'sage_aggr': 'max', 'sage_normalize': False, 'sage_project': False, 'lr': 0.0036045269049128337, 'weight_decay': 1.7153532535385942e-07, 'epochs': 64, 'loss': 'mse', 'optimizer': 'adam', 'graph_mode': 'cutoff', 'cutoff': 0.8252065666385434, 'grm_norm': 'none', 'self_loops': False, 'use_snp_selection': True, 'num_snps': 36406}. Best is trial 74 with value: 0.3021457282627437.
[I 2025-12-08 16:14:33,812] Trial 75 finished with value: 0.29338601209632786 and parameters: {'model_type': 'graphsage', 'hidden_dims': '[128, 64]', 'dropout': 0.49487467224092035, 'batch_norm': True, 'sage_aggr': 'max', 'sage_normalize': False, 'sage_project': False, 'lr': 7.380862696298e-05, 'weight_decay': 1.8097674769751133e-07, 'epochs': 103, 'loss': 'mse', 'optimizer': 'adam', 'graph_mode': 'cutoff', 'cutoff': 0.8046301085995502, 'grm_norm': 'none', 'self_loops': False, 'use_snp_selection': True, 'num_snps': 36076}. Best is trial 74 with value: 0.3021457282627437.
[I 2025-12-08 16:15:16,155] Trial 76 finished with value: 0.29933543828618786 and parameters: {'model_type': 'graphsage', 'hidden_dims': '[128, 64]', 'dropout': 0.4559214934326421, 'batch_norm': True, 'sage_aggr': 'max', 'sage_normalize': False, 'sage_project': False, 'lr': 0.003424142669167701, 'weight_decay': 1.5706161542536056e-07, 'epochs': 48, 'loss': 'mse', 'optimizer': 'adam', 'graph_mode': 'cutoff', 'cutoff': 0.7360572751826218, 'grm_norm': 'gcn', 'self_loops': False, 'use_snp_selection': True, 'num_snps': 41785}. Best is trial 74 with value: 0.3021457282627437.
[I 2025-12-08 16:16:09,020] Trial 77 finished with value: 0.28929398570604886 and parameters: {'model_type': 'graphsage', 'hidden_dims': '[128, 64]', 'dropout': 0.44060705591096294, 'batch_norm': True, 'sage_aggr': 'max', 'sage_normalize': False, 'sage_project': False, 'lr': 0.002274333701566606, 'weight_decay': 1.8602807637753788e-06, 'epochs': 92, 'loss': 'mse', 'optimizer': 'adam', 'graph_mode': 'cutoff', 'cutoff': 0.4111194202675159, 'grm_norm': 'none', 'self_loops': False, 'use_snp_selection': True, 'num_snps': 36733}. Best is trial 74 with value: 0.3021457282627437.
[I 2025-12-08 16:16:56,115] Trial 78 finished with value: 0.2961730523375518 and parameters: {'model_type': 'graphsage', 'hidden_dims': '[128, 64]', 'dropout': 0.13985239499966692, 'batch_norm': True, 'sage_aggr': 'max', 'sage_normalize': False, 'sage_project': False, 'lr': 0.004730529788067354, 'weight_decay': 9.94494903379867e-07, 'epochs': 72, 'loss': 'mse', 'optimizer': 'adam', 'graph_mode': 'cutoff', 'cutoff': 0.7758284589404851, 'grm_norm': 'cosine_then_gcn', 'self_loops': False, 'use_snp_selection': True, 'num_snps': 44692}. Best is trial 74 with value: 0.3021457282627437.
