[I 2025-12-08 12:33:41,979] Trial 3 finished with value: 0.29932925959726936 and parameters: {'model_type': 'graphsage', 'hidden_dims': '[256, 128, 64]', 'dropout': 0.3475243154412272, 'batch_norm': True, 'sage_aggr': 'max', 'sage_normalize': False, 'sage_project': False, 'lr': 1.6006331996938085e-05, 'weight_decay': 7.213121225589906e-06, 'epochs': 283, 'loss': 'mse', 'optimizer': 'adam', 'graph_mode': 'cutoff', 'cutoff': 0.5942334791449215, 'grm_norm': 'none', 'self_loops': True, 'use_snp_selection': False}. Best is trial 2 with value: 0.30264154856590786.
[I 2025-12-08 12:34:24,768] Trial 4 finished with value: 0.2754308758595392 and parameters: {'model_type': 'graphsage', 'hidden_dims': '[128, 64]', 'dropout': 0.3348926467202472, 'batch_norm': True, 'sage_aggr': 'max', 'sage_normalize': False, 'sage_project': False, 'lr': 0.0004238630400638802, 'weight_decay': 8.074086040046576e-07, 'epochs': 158, 'loss': 'mae', 'optimizer': 'adam', 'graph_mode': 'knn', 'knn_k': 1, 'weighted_edges': False, 'symmetrize_mode': 'mutual', 'self_loops': False, 'use_snp_selection': True, 'num_snps': 26850}. Best is trial 2 with value: 0.30264154856590786.
[I 2025-12-08 12:36:12,432] Trial 5 finished with value: 0.26430792321037905 and parameters: {'model_type': 'graphsage', 'hidden_dims': '[512, 64]', 'dropout': 0.14505336736221927, 'batch_norm': True, 'sage_aggr': 'mean', 'sage_normalize': True, 'sage_project': False, 'lr': 1.2962030165732234e-05, 'weight_decay': 1.326598071105465e-07, 'epochs': 180, 'loss': 'mse', 'optimizer': 'adam', 'graph_mode': 'knn', 'knn_k': 9, 'weighted_edges': True, 'symmetrize_mode': 'mutual', 'self_loops': False, 'use_snp_selection': False}. Best is trial 2 with value: 0.30264154856590786.
[I 2025-12-08 12:37:05,746] Trial 6 finished with value: 0.2924058241010531 and parameters: {'model_type': 'graphsage', 'hidden_dims': '[256, 128, 64]', 'dropout': 0.10731743755162496, 'batch_norm': True, 'sage_aggr': 'mean', 'sage_normalize': False, 'sage_project': False, 'lr': 1.922990426933137e-05, 'weight_decay': 7.30001060446905e-05, 'epochs': 63, 'loss': 'mae', 'optimizer': 'adam', 'graph_mode': 'cutoff', 'cutoff': 0.7624978434202536, 'grm_norm': 'none', 'self_loops': True, 'use_snp_selection': True, 'num_snps': 50106}. Best is trial 2 with value: 0.30264154856590786.
[I 2025-12-08 12:38:57,379] Trial 7 finished with value: 0.28641137398903327 and parameters: {'model_type': 'graphsage', 'hidden_dims': '[512, 64]', 'dropout': 0.2585007811528941, 'batch_norm': True, 'sage_aggr': 'max', 'sage_normalize': True, 'sage_project': False, 'lr': 5.921425508303391e-05, 'weight_decay': 0.0004511561961144237, 'epochs': 182, 'loss': 'mae', 'optimizer': 'adam', 'graph_mode': 'knn', 'knn_k': 9, 'weighted_edges': True, 'symmetrize_mode': 'union', 'self_loops': False, 'use_snp_selection': True, 'num_snps': 23903}. Best is trial 2 with value: 0.30264154856590786.
[I 2025-12-08 12:39:39,161] Trial 8 finished with value: 0.2708444910480404 and parameters: {'model_type': 'graphsage', 'hidden_dims': '[512, 256]', 'dropout': 0.3061380386767003, 'batch_norm': False, 'sage_aggr': 'mean', 'sage_normalize': True, 'sage_project': False, 'lr': 0.000698401460570184, 'weight_decay': 2.965560055460244e-06, 'epochs': 289, 'loss': 'mae', 'optimizer': 'adam', 'graph_mode': 'knn', 'knn_k': 7, 'weighted_edges': False, 'symmetrize_mode': 'mutual', 'self_loops': True, 'use_snp_selection': True, 'num_snps': 4710}. Best is trial 2 with value: 0.30264154856590786.
[I 2025-12-08 12:43:18,102] Trial 9 finished with value: 0.2899130393586731 and parameters: {'model_type': 'graphsage', 'hidden_dims': '[512, 128]', 'dropout': 0.1733844071393634, 'batch_norm': False, 'sage_aggr': 'mean', 'sage_normalize': True, 'sage_project': False, 'lr': 0.0004269677918501597, 'weight_decay': 2.2439779626249696e-06, 'epochs': 319, 'loss': 'mse', 'optimizer': 'adam', 'graph_mode': 'cutoff', 'cutoff': 0.24117565767129295, 'grm_norm': 'cosine_then_gcn', 'self_loops': True, 'use_snp_selection': False}. Best is trial 2 with value: 0.30264154856590786.
[I 2025-12-08 12:44:21,915] Trial 10 finished with value: 0.010953327803435706 and parameters: {'model_type': 'graphsage', 'hidden_dims': '[512, 256]', 'dropout': 0.46773351022590026, 'batch_norm': False, 'sage_aggr': 'max', 'sage_normalize': False, 'sage_project': False, 'lr': 0.0060050040216813455, 'weight_decay': 3.194347401809951e-05, 'epochs': 76, 'loss': 'mae', 'optimizer': 'adam', 'graph_mode': 'cutoff', 'cutoff': 0.36538426242387784, 'grm_norm': 'gcn', 'self_loops': False, 'use_snp_selection': True, 'num_snps': 36724}. Best is trial 2 with value: 0.30264154856590786.
[I 2025-12-08 12:45:27,346] Trial 11 finished with value: 0.31028831326221723 and parameters: {'model_type': 'graphsage', 'hidden_dims': '[256, 128]', 'dropout': 0.4087655985705578, 'batch_norm': False, 'sage_aggr': 'max', 'sage_normalize': False, 'sage_project': False, 'lr': 7.365835336670397e-05, 'weight_decay': 1.7985028354245396e-05, 'epochs': 256, 'loss': 'mse', 'optimizer': 'adam', 'graph_mode': 'cutoff', 'cutoff': 0.6163547855262844, 'grm_norm': 'gcn', 'self_loops': False, 'use_snp_selection': False}. Best is trial 11 with value: 0.31028831326221723.
[I 2025-12-08 12:46:32,163] Trial 12 finished with value: 0.2814368744056634 and parameters: {'model_type': 'graphsage', 'hidden_dims': '[256, 128]', 'dropout': 0.4509982854543687, 'batch_norm': False, 'sage_aggr': 'max', 'sage_normalize': False, 'sage_project': False, 'lr': 0.00014585774799336307, 'weight_decay': 2.9469664568254738e-05, 'epochs': 238, 'loss': 'mae', 'optimizer': 'adam', 'graph_mode': 'cutoff', 'cutoff': 0.5504134257868316, 'grm_norm': 'gcn', 'self_loops': False, 'use_snp_selection': False}. Best is trial 11 with value: 0.31028831326221723.
[I 2025-12-08 12:47:06,858] Trial 13 finished with value: 0.25859794533530595 and parameters: {'model_type': 'graphsage', 'hidden_dims': '[256, 128]', 'dropout': 0.5382373834217782, 'batch_norm': False, 'sage_aggr': 'max', 'sage_normalize': False, 'sage_project': False, 'lr': 9.933777278644623e-05, 'weight_decay': 1.488187183203529e-05, 'epochs': 112, 'loss': 'mse', 'optimizer': 'adam', 'graph_mode': 'cutoff', 'cutoff': 0.7047474752120113, 'grm_norm': 'cosine', 'self_loops': False, 'use_snp_selection': False}. Best is trial 11 with value: 0.31028831326221723.
[I 2025-12-08 12:47:49,325] Trial 14 finished with value: 0.2765001065639656 and parameters: {'model_type': 'graphsage', 'hidden_dims': '[256, 128]', 'dropout': 0.41414455041432496, 'batch_norm': False, 'sage_aggr': 'max', 'sage_normalize': False, 'sage_project': False, 'lr': 0.0012613887716364418, 'weight_decay': 0.000929256360284688, 'epochs': 228, 'loss': 'mae', 'optimizer': 'adam', 'graph_mode': 'cutoff', 'cutoff': 0.45041293462083515, 'grm_norm': 'gcn', 'self_loops': False, 'use_snp_selection': True, 'num_snps': 11562}. Best is trial 11 with value: 0.31028831326221723.
[I 2025-12-08 12:48:48,173] Trial 15 finished with value: 0.2558609342126519 and parameters: {'model_type': 'graphsage', 'hidden_dims': '[512, 256]', 'dropout': 0.5886866495246754, 'batch_norm': False, 'sage_aggr': 'max', 'sage_normalize': False, 'sage_project': False, 'lr': 0.00013385613884147037, 'weight_decay': 8.011999146322173e-05, 'epochs': 121, 'loss': 'mse', 'optimizer': 'adam', 'graph_mode': 'cutoff', 'cutoff': 0.6318395355216515, 'grm_norm': 'gcn', 'self_loops': False, 'use_snp_selection': False}. Best is trial 11 with value: 0.31028831326221723.
[I 2025-12-08 12:50:10,787] Trial 16 finished with value: 0.30713923602743154 and parameters: {'model_type': 'graphsage', 'hidden_dims': '[256, 128]', 'dropout': 0.38972932269140576, 'batch_norm': False, 'sage_aggr': 'max', 'sage_normalize': False, 'sage_project': False, 'lr': 3.383478779291662e-05, 'weight_decay': 6.786155208826885e-06, 'epochs': 346, 'loss': 'mae', 'optimizer': 'adam', 'graph_mode': 'cutoff', 'cutoff': 0.8632973278758909, 'grm_norm': 'gcn', 'self_loops': False, 'use_snp_selection': False}. Best is trial 11 with value: 0.31028831326221723.
[I 2025-12-08 12:51:30,792] Trial 17 finished with value: 0.3019377173871375 and parameters: {'model_type': 'graphsage', 'hidden_dims': '[256, 128]', 'dropout': 0.39702325504543345, 'batch_norm': False, 'sage_aggr': 'max', 'sage_normalize': False, 'sage_project': False, 'lr': 3.5287912963528374e-05, 'weight_decay': 8.392795491007006e-07, 'epochs': 329, 'loss': 'mse', 'optimizer': 'adam', 'graph_mode': 'cutoff', 'cutoff': 0.8893390523318501, 'grm_norm': 'cosine', 'self_loops': False, 'use_snp_selection': False}. Best is trial 11 with value: 0.31028831326221723.
[I 2025-12-08 12:52:55,424] Trial 18 finished with value: 0.049553927918013524 and parameters: {'model_type': 'graphsage', 'hidden_dims': '[256, 128]', 'dropout': 0.5123368571520026, 'batch_norm': False, 'sage_aggr': 'mean', 'sage_normalize': False, 'sage_project': False, 'lr': 0.0024055930663360835, 'weight_decay': 6.1518256639307695e-06, 'epochs': 347, 'loss': 'mse', 'optimizer': 'adam', 'graph_mode': 'cutoff', 'cutoff': 0.8982708732049729, 'grm_norm': 'cosine_then_gcn', 'self_loops': False, 'use_snp_selection': False}. Best is trial 11 with value: 0.31028831326221723.
[I 2025-12-08 12:54:04,477] Trial 19 finished with value: 0.3058951200024777 and parameters: {'model_type': 'graphsage', 'hidden_dims': '[256, 128]', 'dropout': 0.39360937359397624, 'batch_norm': False, 'sage_aggr': 'max', 'sage_normalize': False, 'sage_project': False, 'lr': 3.7786783794757295e-05, 'weight_decay': 1.2500982087793675e-07, 'epochs': 281, 'loss': 'mae', 'optimizer': 'adam', 'graph_mode': 'cutoff', 'cutoff': 0.7706381752960936, 'grm_norm': 'gcn', 'self_loops': False, 'use_snp_selection': False}. Best is trial 11 with value: 0.31028831326221723.
[I 2025-12-08 12:55:10,583] Trial 20 finished with value: 0.114172903984776 and parameters: {'model_type': 'graphsage', 'hidden_dims': '[256, 128]', 'dropout': 0.484162090847401, 'batch_norm': False, 'sage_aggr': 'max', 'sage_normalize': False, 'sage_project': False, 'lr': 0.00022521064699129032, 'weight_decay': 6.986110418846842e-07, 'epochs': 267, 'loss': 'mae', 'optimizer': 'adam', 'graph_mode': 'cutoff', 'cutoff': 0.801232214536872, 'grm_norm': 'gcn', 'self_loops': False, 'use_snp_selection': False}. Best is trial 11 with value: 0.31028831326221723.
[I 2025-12-08 12:56:23,677] Trial 21 finished with value: 0.30526835595530377 and parameters: {'model_type': 'graphsage', 'hidden_dims': '[256, 128]', 'dropout': 0.3962338479395505, 'batch_norm': False, 'sage_aggr': 'max', 'sage_normalize': False, 'sage_project': False, 'lr': 2.5295518283642892e-05, 'weight_decay': 1.6185174849941962e-07, 'epochs': 299, 'loss': 'mae', 'optimizer': 'adam', 'graph_mode': 'cutoff', 'cutoff': 0.7044106189813574, 'grm_norm': 'gcn', 'self_loops': False, 'use_snp_selection': False}. Best is trial 11 with value: 0.31028831326221723.
[I 2025-12-08 12:57:28,869] Trial 22 finished with value: 0.31047280355075413 and parameters: {'model_type': 'graphsage', 'hidden_dims': '[256, 128]', 'dropout': 0.4197530478441378, 'batch_norm': False, 'sage_aggr': 'max', 'sage_normalize': False, 'sage_project': False, 'lr': 1.0070843625772462e-05, 'weight_decay': 3.2031273372739246e-07, 'epochs': 262, 'loss': 'mae', 'optimizer': 'adam', 'graph_mode': 'cutoff', 'cutoff': 0.7973181257409957, 'grm_norm': 'gcn', 'self_loops': False, 'use_snp_selection': False}. Best is trial 22 with value: 0.31047280355075413.
[I 2025-12-08 12:58:31,853] Trial 23 finished with value: 0.3108901332690951 and parameters: {'model_type': 'graphsage', 'hidden_dims': '[256, 128]', 'dropout': 0.44865151366125117, 'batch_norm': False, 'sage_aggr': 'max', 'sage_normalize': False, 'sage_project': False, 'lr': 1.2365467094774556e-05, 'weight_decay': 3.644907853227275e-07, 'epochs': 251, 'loss': 'mae', 'optimizer': 'adam', 'graph_mode': 'cutoff', 'cutoff': 0.822307156234805, 'grm_norm': 'gcn', 'self_loops': False, 'use_snp_selection': False}. Best is trial 23 with value: 0.3108901332690951.
[I 2025-12-08 12:59:35,572] Trial 24 finished with value: 0.3091313237077643 and parameters: {'model_type': 'graphsage', 'hidden_dims': '[256, 128]', 'dropout': 0.4417308564872514, 'batch_norm': False, 'sage_aggr': 'max', 'sage_normalize': False, 'sage_project': False, 'lr': 1.0105657809235257e-05, 'weight_decay': 3.5017990659007635e-07, 'epochs': 253, 'loss': 'mae', 'optimizer': 'adam', 'graph_mode': 'cutoff', 'cutoff': 0.6771219989183055, 'grm_norm': 'gcn', 'self_loops': False, 'use_snp_selection': False}. Best is trial 23 with value: 0.3108901332690951.
[I 2025-12-08 13:00:29,273] Trial 25 finished with value: 0.2833007751210504 and parameters: {'model_type': 'graphsage', 'hidden_dims': '[256, 128]', 'dropout': 0.5511331690896256, 'batch_norm': False, 'sage_aggr': 'max', 'sage_normalize': False, 'sage_project': False, 'lr': 5.950202351829456e-05, 'weight_decay': 2.1751174755634773e-06, 'epochs': 203, 'loss': 'mae', 'optimizer': 'adam', 'graph_mode': 'cutoff', 'cutoff': 0.7916374504522262, 'grm_norm': 'cosine', 'self_loops': False, 'use_snp_selection': False}. Best is trial 23 with value: 0.3108901332690951.
[I 2025-12-08 13:01:22,859] Trial 26 finished with value: 0.2823868827106988 and parameters: {'model_type': 'graphsage', 'hidden_dims': '[256, 128, 64]', 'dropout': 0.5099615670741011, 'batch_norm': False, 'sage_aggr': 'mean', 'sage_normalize': True, 'sage_project': False, 'lr': 1.0247228508766544e-05, 'weight_decay': 4.2669118769725823e-07, 'epochs': 200, 'loss': 'mse', 'optimizer': 'adam', 'graph_mode': 'cutoff', 'cutoff': 0.8349937248623318, 'grm_norm': 'none', 'self_loops': False, 'use_snp_selection': False}. Best is trial 23 with value: 0.3108901332690951.
[I 2025-12-08 13:03:14,462] Trial 27 finished with value: 0.30727444805842674 and parameters: {'model_type': 'graphsage', 'hidden_dims': '[512, 64]', 'dropout': 0.4231191278518485, 'batch_norm': False, 'sage_aggr': 'max', 'sage_normalize': False, 'sage_project': False, 'lr': 2.0039397720176524e-05, 'weight_decay': 1.629354594701227e-06, 'epochs': 259, 'loss': 'mae', 'optimizer': 'adam', 'graph_mode': 'cutoff', 'cutoff': 0.7282736088000885, 'grm_norm': 'cosine_then_gcn', 'self_loops': False, 'use_snp_selection': False}. Best is trial 23 with value: 0.3108901332690951.
[I 2025-12-08 13:03:52,900] Trial 28 finished with value: 0.31201386338760956 and parameters: {'model_type': 'graphsage', 'hidden_dims': '[128, 64]', 'dropout': 0.35511163028759074, 'batch_norm': False, 'sage_aggr': 'max', 'sage_normalize': False, 'sage_project': False, 'lr': 6.417059394632355e-05, 'weight_decay': 1.5094865591901266e-05, 'epochs': 218, 'loss': 'mse', 'optimizer': 'adam', 'graph_mode': 'cutoff', 'cutoff': 0.6229208450504546, 'grm_norm': 'gcn', 'self_loops': False, 'use_snp_selection': False}. Best is trial 28 with value: 0.31201386338760956.
[I 2025-12-08 13:05:11,687] Trial 29 finished with value: 0.24162555079834208 and parameters: {'model_type': 'graphsage', 'hidden_dims': '[128, 64]', 'dropout': 0.3595902606527363, 'batch_norm': True, 'sage_aggr': 'max', 'sage_normalize': True, 'sage_project': False, 'lr': 2.232031740647628e-05, 'weight_decay': 2.965833848911607e-07, 'epochs': 222, 'loss': 'mse', 'optimizer': 'adam', 'graph_mode': 'knn', 'knn_k': 4, 'weighted_edges': True, 'symmetrize_mode': 'union', 'self_loops': True, 'use_snp_selection': False}. Best is trial 28 with value: 0.31201386338760956.
[I 2025-12-08 13:06:06,433] Trial 30 finished with value: 0.2280402548731406 and parameters: {'model_type': 'graphsage', 'hidden_dims': '[128, 64]', 'dropout': 0.3133295474779294, 'batch_norm': False, 'sage_aggr': 'max', 'sage_normalize': False, 'sage_project': False, 'lr': 0.00019020774642574263, 'weight_decay': 4.197472827319944e-06, 'epochs': 220, 'loss': 'mae', 'optimizer': 'adam', 'graph_mode': 'cutoff', 'cutoff': 0.44317585828652895, 'grm_norm': 'gcn', 'self_loops': False, 'use_snp_selection': False}. Best is trial 28 with value: 0.31201386338760956.
[I 2025-12-08 13:06:47,368] Trial 31 finished with value: 0.292079831363523 and parameters: {'model_type': 'graphsage', 'hidden_dims': '[128, 64]', 'dropout': 0.3663425191787888, 'batch_norm': False, 'sage_aggr': 'max', 'sage_normalize': False, 'sage_project': False, 'lr': 8.122164083145035e-05, 'weight_decay': 1.5876831167197295e-05, 'epochs': 238, 'loss': 'mse', 'optimizer': 'adam', 'graph_mode': 'cutoff', 'cutoff': 0.6314114825659495, 'grm_norm': 'gcn', 'self_loops': False, 'use_snp_selection': False}. Best is trial 28 with value: 0.31201386338760956.
[I 2025-12-08 13:08:40,283] Trial 32 finished with value: 0.29621132978401443 and parameters: {'model_type': 'graphsage', 'hidden_dims': '[512, 128]', 'dropout': 0.2275270283176365, 'batch_norm': False, 'sage_aggr': 'max', 'sage_normalize': False, 'sage_project': False, 'lr': 5.4691900714972844e-05, 'weight_decay': 0.00011310265382955659, 'epochs': 255, 'loss': 'mse', 'optimizer': 'adam', 'graph_mode': 'cutoff', 'cutoff': 0.567128411450761, 'grm_norm': 'gcn', 'self_loops': False, 'use_snp_selection': False}. Best is trial 28 with value: 0.31201386338760956.
[I 2025-12-08 13:09:30,165] Trial 33 finished with value: 0.3068693217352577 and parameters: {'model_type': 'graphsage', 'hidden_dims': '[128, 64]', 'dropout': 0.4416212120948248, 'batch_norm': False, 'sage_aggr': 'max', 'sage_normalize': False, 'sage_project': False, 'lr': 1.5022246497883865e-05, 'weight_decay': 4.983482687112874e-05, 'epochs': 307, 'loss': 'mse', 'optimizer': 'adam', 'graph_mode': 'cutoff', 'cutoff': 0.646258788679814, 'grm_norm': 'gcn', 'self_loops': False, 'use_snp_selection': False}. Best is trial 28 with value: 0.31201386338760956.
[I 2025-12-08 13:10:13,747] Trial 34 finished with value: 0.3113346954614166 and parameters: {'model_type': 'graphsage', 'hidden_dims': '[128, 64]', 'dropout': 0.3017719707186194, 'batch_norm': False, 'sage_aggr': 'max', 'sage_normalize': False, 'sage_project': False, 'lr': 2.929186702704564e-05, 'weight_decay': 1.3182255599433175e-05, 'epochs': 267, 'loss': 'mse', 'optimizer': 'adam', 'graph_mode': 'cutoff', 'cutoff': 0.8326056222856669, 'grm_norm': 'gcn', 'self_loops': True, 'use_snp_selection': False}. Best is trial 28 with value: 0.31201386338760956.
[I 2025-12-08 13:11:38,001] Trial 35 finished with value: 0.2562297904053178 and parameters: {'model_type': 'graphsage', 'hidden_dims': '[128, 64]', 'dropout': 0.3010525067471624, 'batch_norm': False, 'sage_aggr': 'max', 'sage_normalize': False, 'sage_project': False, 'lr': 2.687931565021196e-05, 'weight_decay': 1.0527542724005767e-05, 'epochs': 280, 'loss': 'mse', 'optimizer': 'adam', 'graph_mode': 'knn', 'knn_k': 3, 'weighted_edges': False, 'symmetrize_mode': 'union', 'self_loops': True, 'use_snp_selection': False}. Best is trial 28 with value: 0.31201386338760956.
[I 2025-12-08 13:12:14,668] Trial 36 finished with value: 0.29734681571224575 and parameters: {'model_type': 'graphsage', 'hidden_dims': '[128, 64]', 'dropout': 0.3300931235845114, 'batch_norm': True, 'sage_aggr': 'max', 'sage_normalize': False, 'sage_project': False, 'lr': 1.5024011436307637e-05, 'weight_decay': 1.2341578835656204e-06, 'epochs': 211, 'loss': 'mse', 'optimizer': 'adam', 'graph_mode': 'cutoff', 'cutoff': 0.84026827346866, 'grm_norm': 'gcn', 'self_loops': True, 'use_snp_selection': False}. Best is trial 28 with value: 0.31201386338760956.
[I 2025-12-08 13:12:46,993] Trial 37 finished with value: 0.3126492371427131 and parameters: {'model_type': 'graphsage', 'hidden_dims': '[128, 64]', 'dropout': 0.2744231257999067, 'batch_norm': False, 'sage_aggr': 'max', 'sage_normalize': False, 'sage_project': False, 'lr': 4.5727640204775645e-05, 'weight_decay': 4.805803392056214e-06, 'epochs': 179, 'loss': 'mse', 'optimizer': 'adam', 'graph_mode': 'cutoff', 'cutoff': 0.8171876897303707, 'grm_norm': 'gcn', 'self_loops': True, 'use_snp_selection': False}. Best is trial 37 with value: 0.3126492371427131.
[I 2025-12-08 13:14:36,955] Trial 38 finished with value: 0.287537960857685 and parameters: {'model_type': 'graphsage', 'hidden_dims': '[128, 64]', 'dropout': 0.2118261129942271, 'batch_norm': True, 'sage_aggr': 'mean', 'sage_normalize': True, 'sage_project': False, 'lr': 4.268033452524336e-05, 'weight_decay': 4.326989356966149e-06, 'epochs': 172, 'loss': 'mse', 'optimizer': 'adam', 'graph_mode': 'knn', 'knn_k': 10, 'weighted_edges': True, 'symmetrize_mode': 'union', 'self_loops': True, 'use_snp_selection': False}. Best is trial 37 with value: 0.3126492371427131.
[I 2025-12-08 13:15:36,021] Trial 39 finished with value: 0.30736301372812846 and parameters: {'model_type': 'graphsage', 'hidden_dims': '[128, 64]', 'dropout': 0.27073929179137096, 'batch_norm': False, 'sage_aggr': 'max', 'sage_normalize': False, 'sage_project': False, 'lr': 0.00011131266146968992, 'weight_decay': 1.1553422648486624e-05, 'epochs': 124, 'loss': 'mse', 'optimizer': 'adam', 'graph_mode': 'cutoff', 'cutoff': 0.7400002162498713, 'grm_norm': 'gcn', 'self_loops': True, 'use_snp_selection': True, 'num_snps': 54809}. Best is trial 37 with value: 0.3126492371427131.
[I 2025-12-08 13:17:10,901] Trial 40 finished with value: 0.28283259147738177 and parameters: {'model_type': 'graphsage', 'hidden_dims': '[128, 64]', 'dropout': 0.2850266809751485, 'batch_norm': True, 'sage_aggr': 'max', 'sage_normalize': False, 'sage_project': False, 'lr': 0.0002560357117195925, 'weight_decay': 0.0002232415955003297, 'epochs': 165, 'loss': 'mse', 'optimizer': 'adam', 'graph_mode': 'knn', 'knn_k': 7, 'weighted_edges': False, 'symmetrize_mode': 'union', 'self_loops': True, 'use_snp_selection': False}. Best is trial 37 with value: 0.3126492371427131.
