[I 2025-12-10 03:45:03,129] Trial 12 finished with value: 0.27813543433280385 and parameters: {'model_type': 'graphsage', 'hidden_dims': '[512, 128]', 'dropout': 0.4657878741060366, 'batch_norm': False, 'sage_aggr': 'mean', 'sage_normalize': True, 'sage_project': False, 'lr': 0.00923224194542078, 'weight_decay': 1.2318488085524775e-07, 'epochs': 347, 'loss': 'mse', 'optimizer': 'adam', 'graph_mode': 'cutoff', 'cutoff': 0.21246019134591498, 'grm_norm': 'cosine_then_gcn', 'self_loops': True, 'use_snp_selection': False}. Best is trial 9 with value: 0.3029902099523632.
[I 2025-12-10 03:47:18,602] Trial 13 finished with value: 0.30667262712128923 and parameters: {'model_type': 'graphsage', 'hidden_dims': '[256, 128]', 'dropout': 0.4316724017626087, 'batch_norm': False, 'sage_aggr': 'mean', 'sage_normalize': True, 'sage_project': False, 'lr': 0.001717546144024873, 'weight_decay': 1.138012797452361e-06, 'epochs': 338, 'loss': 'mse', 'optimizer': 'adam', 'graph_mode': 'cutoff', 'cutoff': 0.38086978888717765, 'grm_norm': 'cosine_then_gcn', 'self_loops': True, 'use_snp_selection': False}. Best is trial 13 with value: 0.30667262712128923.
[I 2025-12-10 03:48:54,060] Trial 14 finished with value: 0.3041418138767301 and parameters: {'model_type': 'graphsage', 'hidden_dims': '[256, 128]', 'dropout': 0.4013541230472613, 'batch_norm': False, 'sage_aggr': 'mean', 'sage_normalize': True, 'sage_project': False, 'lr': 0.0017052245808707196, 'weight_decay': 3.283305539741077e-06, 'epochs': 241, 'loss': 'mse', 'optimizer': 'adam', 'graph_mode': 'cutoff', 'cutoff': 0.4124332403343759, 'grm_norm': 'cosine', 'self_loops': True, 'use_snp_selection': False}. Best is trial 13 with value: 0.30667262712128923.
[I 2025-12-10 03:50:28,345] Trial 15 finished with value: 0.29906870016504794 and parameters: {'model_type': 'graphsage', 'hidden_dims': '[256, 128]', 'dropout': 0.4303289675097773, 'batch_norm': False, 'sage_aggr': 'mean', 'sage_normalize': True, 'sage_project': False, 'lr': 0.0015974959117223606, 'weight_decay': 2.4480221808497912e-05, 'epochs': 241, 'loss': 'mse', 'optimizer': 'adam', 'graph_mode': 'cutoff', 'cutoff': 0.4354075990476878, 'grm_norm': 'cosine', 'self_loops': True, 'use_snp_selection': False}. Best is trial 13 with value: 0.30667262712128923.
[I 2025-12-10 03:52:05,105] Trial 16 finished with value: 0.3042267921253156 and parameters: {'model_type': 'graphsage', 'hidden_dims': '[256, 128]', 'dropout': 0.4056487601995511, 'batch_norm': False, 'sage_aggr': 'mean', 'sage_normalize': True, 'sage_project': False, 'lr': 0.0019425754293061575, 'weight_decay': 8.726288463112435e-06, 'epochs': 247, 'loss': 'mse', 'optimizer': 'adam', 'graph_mode': 'cutoff', 'cutoff': 0.43054167853921105, 'grm_norm': 'cosine', 'self_loops': True, 'use_snp_selection': False}. Best is trial 13 with value: 0.30667262712128923.
[I 2025-12-10 03:52:30,937] Trial 17 finished with value: 0.2855057193764756 and parameters: {'model_type': 'graphsage', 'hidden_dims': '[256, 128]', 'dropout': 0.593575210181673, 'batch_norm': False, 'sage_aggr': 'mean', 'sage_normalize': True, 'sage_project': False, 'lr': 0.002502830010992904, 'weight_decay': 1.1799090874444619e-05, 'epochs': 82, 'loss': 'mse', 'optimizer': 'adam', 'graph_mode': 'cutoff', 'cutoff': 0.6349690136441454, 'grm_norm': 'cosine', 'self_loops': True, 'use_snp_selection': False}. Best is trial 13 with value: 0.30667262712128923.
[I 2025-12-10 03:54:22,130] Trial 18 finished with value: 0.27884870958695507 and parameters: {'model_type': 'graphsage', 'hidden_dims': '[256, 128]', 'dropout': 0.39654095361623953, 'batch_norm': False, 'sage_aggr': 'mean', 'sage_normalize': True, 'sage_project': False, 'lr': 0.00016026547657939263, 'weight_decay': 4.229107992221749e-07, 'epochs': 255, 'loss': 'mse', 'optimizer': 'adam', 'graph_mode': 'cutoff', 'cutoff': 0.34923158684896505, 'grm_norm': 'gcn', 'self_loops': False, 'use_snp_selection': False}. Best is trial 13 with value: 0.30667262712128923.
[I 2025-12-10 03:55:52,331] Trial 19 finished with value: 0.2918250475644564 and parameters: {'model_type': 'graphsage', 'hidden_dims': '[256, 128]', 'dropout': 0.46793327050396705, 'batch_norm': False, 'sage_aggr': 'mean', 'sage_normalize': True, 'sage_project': False, 'lr': 0.0009405811524404025, 'weight_decay': 8.346288595093032e-06, 'epochs': 215, 'loss': 'mse', 'optimizer': 'adam', 'graph_mode': 'cutoff', 'cutoff': 0.3516839937345968, 'grm_norm': 'cosine', 'self_loops': True, 'use_snp_selection': False}. Best is trial 13 with value: 0.30667262712128923.
[I 2025-12-10 03:56:26,668] Trial 20 finished with value: 0.30519940854585287 and parameters: {'model_type': 'graphsage', 'hidden_dims': '[256, 128]', 'dropout': 0.400168592994694, 'batch_norm': False, 'sage_aggr': 'mean', 'sage_normalize': True, 'sage_project': False, 'lr': 0.0031110387165230926, 'weight_decay': 1.631022686679958e-06, 'epochs': 113, 'loss': 'mse', 'optimizer': 'adam', 'graph_mode': 'cutoff', 'cutoff': 0.6833055417198552, 'grm_norm': 'cosine_then_gcn', 'self_loops': True, 'use_snp_selection': False}. Best is trial 13 with value: 0.30667262712128923.
[I 2025-12-10 03:57:03,159] Trial 21 finished with value: 0.2933110045740354 and parameters: {'model_type': 'graphsage', 'hidden_dims': '[256, 128]', 'dropout': 0.38491388664857734, 'batch_norm': False, 'sage_aggr': 'mean', 'sage_normalize': True, 'sage_project': False, 'lr': 0.0033066495372465077, 'weight_decay': 1.511706367701903e-06, 'epochs': 121, 'loss': 'mse', 'optimizer': 'adam', 'graph_mode': 'cutoff', 'cutoff': 0.718801474182183, 'grm_norm': 'cosine_then_gcn', 'self_loops': True, 'use_snp_selection': False}. Best is trial 13 with value: 0.30667262712128923.
[I 2025-12-10 03:57:36,593] Trial 22 finished with value: 0.29993950437749134 and parameters: {'model_type': 'graphsage', 'hidden_dims': '[256, 128]', 'dropout': 0.4553522886022748, 'batch_norm': False, 'sage_aggr': 'mean', 'sage_normalize': True, 'sage_project': False, 'lr': 0.0008794599181790484, 'weight_decay': 2.801651148281033e-07, 'epochs': 110, 'loss': 'mse', 'optimizer': 'adam', 'graph_mode': 'cutoff', 'cutoff': 0.8439006143069819, 'grm_norm': 'cosine_then_gcn', 'self_loops': True, 'use_snp_selection': False}. Best is trial 13 with value: 0.30667262712128923.
[I 2025-12-10 03:58:38,568] Trial 23 finished with value: 0.2959127699942087 and parameters: {'model_type': 'graphsage', 'hidden_dims': '[256, 128]', 'dropout': 0.3660181304725245, 'batch_norm': False, 'sage_aggr': 'mean', 'sage_normalize': True, 'sage_project': False, 'lr': 0.0018250212094228651, 'weight_decay': 5.17763484540338e-06, 'epochs': 197, 'loss': 'mse', 'optimizer': 'adam', 'graph_mode': 'cutoff', 'cutoff': 0.5291368513462451, 'grm_norm': 'cosine_then_gcn', 'self_loops': True, 'use_snp_selection': False}. Best is trial 13 with value: 0.30667262712128923.
[I 2025-12-10 03:58:55,693] Trial 24 finished with value: 0.2509621914931516 and parameters: {'model_type': 'graphsage', 'hidden_dims': '[256, 128]', 'dropout': 0.519804024066552, 'batch_norm': False, 'sage_aggr': 'mean', 'sage_normalize': True, 'sage_project': False, 'lr': 0.004278153765637513, 'weight_decay': 1.658044866488978e-05, 'epochs': 51, 'loss': 'mse', 'optimizer': 'adam', 'graph_mode': 'cutoff', 'cutoff': 0.6662122337356747, 'grm_norm': 'cosine', 'self_loops': True, 'use_snp_selection': False}. Best is trial 13 with value: 0.30667262712128923.
[I 2025-12-10 04:00:45,057] Trial 25 finished with value: 0.3080156802359948 and parameters: {'model_type': 'graphsage', 'hidden_dims': '[256, 128]', 'dropout': 0.4199757462765584, 'batch_norm': False, 'sage_aggr': 'mean', 'sage_normalize': True, 'sage_project': False, 'lr': 0.00118147381741966, 'weight_decay': 1.508318229758224e-06, 'epochs': 264, 'loss': 'mse', 'optimizer': 'adam', 'graph_mode': 'cutoff', 'cutoff': 0.35490812379973596, 'grm_norm': 'cosine_then_gcn', 'self_loops': True, 'use_snp_selection': False}. Best is trial 25 with value: 0.3080156802359948.
[I 2025-12-10 04:03:07,621] Trial 26 finished with value: 0.11086690540685606 and parameters: {'model_type': 'graphsage', 'hidden_dims': '[256, 128]', 'dropout': 0.49749282791481886, 'batch_norm': False, 'sage_aggr': 'mean', 'sage_normalize': False, 'sage_project': False, 'lr': 0.00018261035730288063, 'weight_decay': 1.36469575900316e-06, 'epochs': 269, 'loss': 'mae', 'optimizer': 'adam', 'graph_mode': 'cutoff', 'cutoff': 0.3059557087136044, 'grm_norm': 'cosine_then_gcn', 'self_loops': False, 'use_snp_selection': False}. Best is trial 25 with value: 0.3080156802359948.
[I 2025-12-10 04:04:02,995] Trial 27 finished with value: 0.2983529099775148 and parameters: {'model_type': 'graphsage', 'hidden_dims': '[128, 64]', 'dropout': 0.5630754292386756, 'batch_norm': False, 'sage_aggr': 'mean', 'sage_normalize': True, 'sage_project': False, 'lr': 0.0011003386099079442, 'weight_decay': 2.516603263279454e-07, 'epochs': 310, 'loss': 'mse', 'optimizer': 'adam', 'graph_mode': 'cutoff', 'cutoff': 0.876594208572298, 'grm_norm': 'cosine_then_gcn', 'self_loops': True, 'use_snp_selection': False}. Best is trial 25 with value: 0.3080156802359948.
[I 2025-12-10 04:05:44,616] Trial 28 finished with value: 0.28698939206769597 and parameters: {'model_type': 'graphsage', 'hidden_dims': '[256, 128, 64]', 'dropout': 0.3218521361276224, 'batch_norm': False, 'sage_aggr': 'mean', 'sage_normalize': True, 'sage_project': False, 'lr': 0.000634023918393368, 'weight_decay': 1.426871736916921e-06, 'epochs': 323, 'loss': 'mse', 'optimizer': 'adam', 'graph_mode': 'cutoff', 'cutoff': 0.5222183634656038, 'grm_norm': 'cosine_then_gcn', 'self_loops': True, 'use_snp_selection': False}. Best is trial 25 with value: 0.3080156802359948.
[I 2025-12-10 04:08:13,651] Trial 29 finished with value: 0.25471443458371473 and parameters: {'model_type': 'graphsage', 'hidden_dims': '[512, 256]', 'dropout': 0.4443929191636416, 'batch_norm': True, 'sage_aggr': 'max', 'sage_normalize': True, 'sage_project': False, 'lr': 0.00020268819870133443, 'weight_decay': 4.358056202240838e-06, 'epochs': 208, 'loss': 'mse', 'optimizer': 'adam', 'graph_mode': 'knn', 'knn_k': 3, 'weighted_edges': False, 'symmetrize_mode': 'union', 'self_loops': True, 'use_snp_selection': False}. Best is trial 25 with value: 0.3080156802359948.
[I 2025-12-10 04:09:40,191] Trial 30 finished with value: 0.2622797575597343 and parameters: {'model_type': 'graphsage', 'hidden_dims': '[512, 64]', 'dropout': 0.48961501569131094, 'batch_norm': False, 'sage_aggr': 'mean', 'sage_normalize': True, 'sage_project': False, 'lr': 0.00287150409416894, 'weight_decay': 3.607557990922148e-07, 'epochs': 104, 'loss': 'mse', 'optimizer': 'adam', 'graph_mode': 'cutoff', 'cutoff': 0.3090615666428327, 'grm_norm': 'gcn', 'self_loops': True, 'use_snp_selection': False}. Best is trial 25 with value: 0.3080156802359948.
[I 2025-12-10 04:11:25,823] Trial 31 finished with value: 0.29391864843953674 and parameters: {'model_type': 'graphsage', 'hidden_dims': '[256, 128]', 'dropout': 0.41990531898837835, 'batch_norm': False, 'sage_aggr': 'mean', 'sage_normalize': True, 'sage_project': False, 'lr': 0.001478211354120703, 'weight_decay': 7.582875981848566e-05, 'epochs': 267, 'loss': 'mse', 'optimizer': 'adam', 'graph_mode': 'cutoff', 'cutoff': 0.4395942004732729, 'grm_norm': 'none', 'self_loops': True, 'use_snp_selection': False}. Best is trial 25 with value: 0.3080156802359948.
[I 2025-12-10 04:12:54,852] Trial 32 finished with value: 0.29786919446299515 and parameters: {'model_type': 'graphsage', 'hidden_dims': '[256, 128]', 'dropout': 0.36691690880815475, 'batch_norm': False, 'sage_aggr': 'mean', 'sage_normalize': True, 'sage_project': False, 'lr': 0.004840360965798175, 'weight_decay': 1.7884124460419014e-06, 'epochs': 219, 'loss': 'mse', 'optimizer': 'adam', 'graph_mode': 'cutoff', 'cutoff': 0.3804778845697968, 'grm_norm': 'cosine_then_gcn', 'self_loops': True, 'use_snp_selection': False}. Best is trial 25 with value: 0.3080156802359948.
[I 2025-12-10 04:14:27,227] Trial 33 finished with value: 0.306194228928446 and parameters: {'model_type': 'graphsage', 'hidden_dims': '[256, 128]', 'dropout': 0.4169630159579798, 'batch_norm': False, 'sage_aggr': 'mean', 'sage_normalize': True, 'sage_project': False, 'lr': 0.002024148862633158, 'weight_decay': 8.352101043547658e-07, 'epochs': 249, 'loss': 'mse', 'optimizer': 'adam', 'graph_mode': 'cutoff', 'cutoff': 0.48767183748759435, 'grm_norm': 'cosine', 'self_loops': True, 'use_snp_selection': False}. Best is trial 25 with value: 0.3080156802359948.
[I 2025-12-10 04:14:37,967] Trial 34 finished with value: 0.10124025326312469 and parameters: {'model_type': 'graphsage', 'hidden_dims': '[128, 64]', 'dropout': 0.21503354894718946, 'batch_norm': False, 'sage_aggr': 'max', 'sage_normalize': False, 'sage_project': False, 'lr': 0.008406467448408408, 'weight_decay': 9.76722364091073e-07, 'epochs': 269, 'loss': 'mse', 'optimizer': 'adam', 'graph_mode': 'cutoff', 'cutoff': 0.5802945861620352, 'grm_norm': 'cosine_then_gcn', 'self_loops': True, 'use_snp_selection': True, 'num_snps': 2241}. Best is trial 25 with value: 0.3080156802359948.
[I 2025-12-10 04:15:59,730] Trial 35 finished with value: 0.02746663881874618 and parameters: {'model_type': 'graphsage', 'hidden_dims': '[256, 128]', 'dropout': 0.2949894730220758, 'batch_norm': False, 'sage_aggr': 'max', 'sage_normalize': False, 'sage_project': False, 'lr': 0.0005821159791014068, 'weight_decay': 4.74711350927243e-07, 'epochs': 137, 'loss': 'mse', 'optimizer': 'adam', 'graph_mode': 'knn', 'knn_k': 4, 'weighted_edges': True, 'symmetrize_mode': 'union', 'self_loops': True, 'use_snp_selection': False}. Best is trial 25 with value: 0.3080156802359948.
[I 2025-12-10 04:17:45,047] Trial 36 finished with value: 0.27599600514092953 and parameters: {'model_type': 'graphsage', 'hidden_dims': '[256, 128]', 'dropout': 0.3582401417738962, 'batch_norm': True, 'sage_aggr': 'mean', 'sage_normalize': True, 'sage_project': False, 'lr': 0.00032136708318363313, 'weight_decay': 2.1772566515061964e-07, 'epochs': 174, 'loss': 'mae', 'optimizer': 'adam', 'graph_mode': 'cutoff', 'cutoff': 0.5005470250089583, 'grm_norm': 'cosine_then_gcn', 'self_loops': False, 'use_snp_selection': True, 'num_snps': 59922}. Best is trial 25 with value: 0.3080156802359948.
[I 2025-12-10 04:19:44,953] Trial 37 finished with value: 0.0 and parameters: {'model_type': 'graphsage', 'hidden_dims': '[256, 128, 64]', 'dropout': 0.4342436544260517, 'batch_norm': False, 'sage_aggr': 'mean', 'sage_normalize': False, 'sage_project': False, 'lr': 0.0036295598309809243, 'weight_decay': 9.639916336435886e-07, 'epochs': 225, 'loss': 'mse', 'optimizer': 'adam', 'graph_mode': 'cutoff', 'cutoff': 0.3065952530852548, 'grm_norm': 'cosine', 'self_loops': True, 'use_snp_selection': False}. Best is trial 25 with value: 0.3080156802359948.
[I 2025-12-10 04:23:03,573] Trial 38 finished with value: 0.2622298072597689 and parameters: {'model_type': 'graphsage', 'hidden_dims': '[512, 256]', 'dropout': 0.47085206242758293, 'batch_norm': True, 'sage_aggr': 'max', 'sage_normalize': True, 'sage_project': False, 'lr': 0.0012173647899285662, 'weight_decay': 2.725663311561382e-06, 'epochs': 161, 'loss': 'mae', 'optimizer': 'adam', 'graph_mode': 'knn', 'knn_k': 10, 'weighted_edges': True, 'symmetrize_mode': 'union', 'self_loops': False, 'use_snp_selection': False}. Best is trial 25 with value: 0.3080156802359948.
[I 2025-12-10 04:24:00,308] Trial 39 finished with value: 0.2906102413451547 and parameters: {'model_type': 'graphsage', 'hidden_dims': '[512, 64]', 'dropout': 0.32829623480467063, 'batch_norm': False, 'sage_aggr': 'mean', 'sage_normalize': True, 'sage_project': False, 'lr': 0.002440228094076498, 'weight_decay': 0.0008076915742574946, 'epochs': 304, 'loss': 'mse', 'optimizer': 'adam', 'graph_mode': 'cutoff', 'cutoff': 0.4833227550591356, 'grm_norm': 'gcn', 'self_loops': True, 'use_snp_selection': True, 'num_snps': 15197}. Best is trial 25 with value: 0.3080156802359948.
[I 2025-12-10 04:26:46,416] Trial 40 finished with value: 0.2985220851696827 and parameters: {'model_type': 'graphsage', 'hidden_dims': '[128, 64]', 'dropout': 0.2693613414141063, 'batch_norm': True, 'sage_aggr': 'mean', 'sage_normalize': False, 'sage_project': False, 'lr': 0.006291216520571267, 'weight_decay': 4.6043841808943695e-06, 'epochs': 280, 'loss': 'mae', 'optimizer': 'adam', 'graph_mode': 'knn', 'knn_k': 7, 'weighted_edges': False, 'symmetrize_mode': 'union', 'self_loops': True, 'use_snp_selection': False}. Best is trial 25 with value: 0.3080156802359948.
[I 2025-12-10 04:28:17,766] Trial 41 finished with value: 0.2843559461991479 and parameters: {'model_type': 'graphsage', 'hidden_dims': '[256, 128]', 'dropout': 0.39154416132221403, 'batch_norm': False, 'sage_aggr': 'mean', 'sage_normalize': True, 'sage_project': False, 'lr': 0.0021805901977308955, 'weight_decay': 6.971893305326586e-05, 'epochs': 237, 'loss': 'mse', 'optimizer': 'adam', 'graph_mode': 'cutoff', 'cutoff': 0.46420694205779467, 'grm_norm': 'cosine', 'self_loops': True, 'use_snp_selection': False}. Best is trial 25 with value: 0.3080156802359948.
[I 2025-12-10 04:30:00,390] Trial 42 finished with value: 0.30855471718694893 and parameters: {'model_type': 'graphsage', 'hidden_dims': '[256, 128]', 'dropout': 0.4176153560647947, 'batch_norm': False, 'sage_aggr': 'mean', 'sage_normalize': True, 'sage_project': False, 'lr': 0.0012197758192930407, 'weight_decay': 7.19979044591012e-06, 'epochs': 257, 'loss': 'mse', 'optimizer': 'adam', 'graph_mode': 'cutoff', 'cutoff': 0.39669785172231503, 'grm_norm': 'cosine', 'self_loops': True, 'use_snp_selection': False}. Best is trial 42 with value: 0.30855471718694893.
[I 2025-12-10 04:31:57,383] Trial 43 finished with value: 0.2971094114417948 and parameters: {'model_type': 'graphsage', 'hidden_dims': '[256, 128]', 'dropout': 0.42006731372493517, 'batch_norm': False, 'sage_aggr': 'mean', 'sage_normalize': True, 'sage_project': False, 'lr': 0.0005299176576163532, 'weight_decay': 6.036699891686971e-07, 'epochs': 294, 'loss': 'mse', 'optimizer': 'adam', 'graph_mode': 'cutoff', 'cutoff': 0.3955376807328087, 'grm_norm': 'cosine', 'self_loops': True, 'use_snp_selection': False}. Best is trial 42 with value: 0.30855471718694893.
[I 2025-12-10 04:33:15,794] Trial 44 finished with value: 0.2949822128581941 and parameters: {'model_type': 'graphsage', 'hidden_dims': '[256, 128]', 'dropout': 0.3469371416442966, 'batch_norm': False, 'sage_aggr': 'mean', 'sage_normalize': True, 'sage_project': False, 'lr': 0.0008607403590723642, 'weight_decay': 2.2930892104163605e-06, 'epochs': 259, 'loss': 'mse', 'optimizer': 'adam', 'graph_mode': 'cutoff', 'cutoff': 0.5807795735346034, 'grm_norm': 'none', 'self_loops': True, 'use_snp_selection': False}. Best is trial 42 with value: 0.30855471718694893.
[I 2025-12-10 04:36:27,966] Trial 45 finished with value: 0.2995197765467507 and parameters: {'model_type': 'graphsage', 'hidden_dims': '[256, 128]', 'dropout': 0.37411760315738896, 'batch_norm': False, 'sage_aggr': 'mean', 'sage_normalize': True, 'sage_project': False, 'lr': 0.0013916072402475259, 'weight_decay': 1.0274250521403222e-06, 'epochs': 349, 'loss': 'mse', 'optimizer': 'adam', 'graph_mode': 'cutoff', 'cutoff': 0.27275695820817486, 'grm_norm': 'cosine', 'self_loops': True, 'use_snp_selection': True, 'num_snps': 34750}. Best is trial 42 with value: 0.30855471718694893.
[I 2025-12-10 04:37:59,045] Trial 46 finished with value: 0.2548186196301064 and parameters: {'model_type': 'graphsage', 'hidden_dims': '[256, 128, 64]', 'dropout': 0.44494552364656925, 'batch_norm': False, 'sage_aggr': 'max', 'sage_normalize': True, 'sage_project': False, 'lr': 0.00043543765929098395, 'weight_decay': 5.9469349605596e-06, 'epochs': 191, 'loss': 'mse', 'optimizer': 'adam', 'graph_mode': 'cutoff', 'cutoff': 0.35982684193633113, 'grm_norm': 'none', 'self_loops': False, 'use_snp_selection': False}. Best is trial 42 with value: 0.30855471718694893.
[I 2025-12-10 04:40:28,804] Trial 47 finished with value: 0.2987046462110534 and parameters: {'model_type': 'graphsage', 'hidden_dims': '[512, 256]', 'dropout': 0.49641167422278903, 'batch_norm': False, 'sage_aggr': 'mean', 'sage_normalize': True, 'sage_project': False, 'lr': 0.005743397778030385, 'weight_decay': 1.4079387910257894e-05, 'epochs': 282, 'loss': 'mse', 'optimizer': 'adam', 'graph_mode': 'cutoff', 'cutoff': 0.7417486216767745, 'grm_norm': 'cosine_then_gcn', 'self_loops': True, 'use_snp_selection': False}. Best is trial 42 with value: 0.30855471718694893.
[I 2025-12-10 04:41:31,779] Trial 48 finished with value: 0.31165090555774844 and parameters: {'model_type': 'graphsage', 'hidden_dims': '[512, 128]', 'dropout': 0.40843669139958666, 'batch_norm': True, 'sage_aggr': 'mean', 'sage_normalize': True, 'sage_project': False, 'lr': 0.0028359438024017636, 'weight_decay': 1.910139858742864e-07, 'epochs': 76, 'loss': 'mse', 'optimizer': 'adam', 'graph_mode': 'knn', 'knn_k': 4, 'weighted_edges': False, 'symmetrize_mode': 'union', 'self_loops': True, 'use_snp_selection': False}. Best is trial 48 with value: 0.31165090555774844.
[I 2025-12-10 04:45:34,507] Trial 49 finished with value: 0.3051207405160681 and parameters: {'model_type': 'graphsage', 'hidden_dims': '[512, 128]', 'dropout': 0.42012751232165096, 'batch_norm': True, 'sage_aggr': 'mean', 'sage_normalize': True, 'sage_project': False, 'lr': 0.0008102912700105041, 'weight_decay': 1.4209000964774444e-07, 'epochs': 319, 'loss': 'mae', 'optimizer': 'adam', 'graph_mode': 'knn', 'knn_k': 4, 'weighted_edges': False, 'symmetrize_mode': 'union', 'self_loops': True, 'use_snp_selection': True, 'num_snps': 41557}. Best is trial 48 with value: 0.31165090555774844.
