[I 2025-12-08 14:06:24,715] Trial 1 finished with value: 0.2722173463779126 and parameters: {'model_type': 'graphsage', 'hidden_dims': '[512, 128]', 'dropout': 0.2503500283181017, 'batch_norm': False, 'sage_aggr': 'max', 'sage_normalize': False, 'sage_project': False, 'lr': 3.952233718592099e-05, 'weight_decay': 0.00026754769258252603, 'epochs': 149, 'loss': 'mse', 'optimizer': 'adam', 'graph_mode': 'knn', 'knn_k': 2, 'weighted_edges': False, 'symmetrize_mode': 'mutual', 'self_loops': True, 'use_snp_selection': True, 'num_snps': 49915}. Best is trial 1 with value: 0.2722173463779126.
[I 2025-12-08 14:07:44,687] Trial 2 finished with value: 0.2679386631866796 and parameters: {'model_type': 'graphsage', 'hidden_dims': '[512, 256]', 'dropout': 0.2785908793172681, 'batch_norm': False, 'sage_aggr': 'max', 'sage_normalize': False, 'sage_project': False, 'lr': 8.806039223165805e-05, 'weight_decay': 3.5153176302760294e-05, 'epochs': 147, 'loss': 'mae', 'optimizer': 'adam', 'graph_mode': 'cutoff', 'cutoff': 0.4922564006874869, 'grm_norm': 'gcn', 'self_loops': False, 'use_snp_selection': True, 'num_snps': 34340}. Best is trial 1 with value: 0.2722173463779126.
[I 2025-12-08 14:09:02,577] Trial 3 finished with value: 0.28817611324866793 and parameters: {'model_type': 'graphsage', 'hidden_dims': '[256, 128, 64]', 'dropout': 0.3475243154412272, 'batch_norm': True, 'sage_aggr': 'max', 'sage_normalize': False, 'sage_project': False, 'lr': 1.6006331996938085e-05, 'weight_decay': 7.213121225589906e-06, 'epochs': 283, 'loss': 'mse', 'optimizer': 'adam', 'graph_mode': 'cutoff', 'cutoff': 0.5942334791449215, 'grm_norm': 'none', 'self_loops': True, 'use_snp_selection': False}. Best is trial 3 with value: 0.28817611324866793.
[I 2025-12-08 14:09:45,942] Trial 4 finished with value: 0.25259138635881434 and parameters: {'model_type': 'graphsage', 'hidden_dims': '[128, 64]', 'dropout': 0.3348926467202472, 'batch_norm': True, 'sage_aggr': 'max', 'sage_normalize': False, 'sage_project': False, 'lr': 0.0004238630400638802, 'weight_decay': 8.074086040046576e-07, 'epochs': 158, 'loss': 'mae', 'optimizer': 'adam', 'graph_mode': 'knn', 'knn_k': 1, 'weighted_edges': False, 'symmetrize_mode': 'mutual', 'self_loops': False, 'use_snp_selection': True, 'num_snps': 26850}. Best is trial 3 with value: 0.28817611324866793.
[I 2025-12-08 14:11:40,264] Trial 5 finished with value: 0.24039143520952036 and parameters: {'model_type': 'graphsage', 'hidden_dims': '[512, 64]', 'dropout': 0.14505336736221927, 'batch_norm': True, 'sage_aggr': 'mean', 'sage_normalize': True, 'sage_project': False, 'lr': 1.2962030165732234e-05, 'weight_decay': 1.326598071105465e-07, 'epochs': 180, 'loss': 'mse', 'optimizer': 'adam', 'graph_mode': 'knn', 'knn_k': 9, 'weighted_edges': True, 'symmetrize_mode': 'mutual', 'self_loops': False, 'use_snp_selection': False}. Best is trial 3 with value: 0.28817611324866793.
[I 2025-12-08 14:12:34,676] Trial 6 finished with value: 0.25896085491837884 and parameters: {'model_type': 'graphsage', 'hidden_dims': '[256, 128, 64]', 'dropout': 0.10731743755162496, 'batch_norm': True, 'sage_aggr': 'mean', 'sage_normalize': False, 'sage_project': False, 'lr': 1.922990426933137e-05, 'weight_decay': 7.30001060446905e-05, 'epochs': 63, 'loss': 'mae', 'optimizer': 'adam', 'graph_mode': 'cutoff', 'cutoff': 0.7624978434202536, 'grm_norm': 'none', 'self_loops': True, 'use_snp_selection': True, 'num_snps': 50106}. Best is trial 3 with value: 0.28817611324866793.
[I 2025-12-08 14:14:35,006] Trial 7 finished with value: 0.2655522378532429 and parameters: {'model_type': 'graphsage', 'hidden_dims': '[512, 64]', 'dropout': 0.2585007811528941, 'batch_norm': True, 'sage_aggr': 'max', 'sage_normalize': True, 'sage_project': False, 'lr': 5.921425508303391e-05, 'weight_decay': 0.0004511561961144237, 'epochs': 182, 'loss': 'mae', 'optimizer': 'adam', 'graph_mode': 'knn', 'knn_k': 9, 'weighted_edges': True, 'symmetrize_mode': 'union', 'self_loops': False, 'use_snp_selection': True, 'num_snps': 23903}. Best is trial 3 with value: 0.28817611324866793.
[I 2025-12-08 14:15:17,954] Trial 8 finished with value: 0.2501478602718607 and parameters: {'model_type': 'graphsage', 'hidden_dims': '[512, 256]', 'dropout': 0.3061380386767003, 'batch_norm': False, 'sage_aggr': 'mean', 'sage_normalize': True, 'sage_project': False, 'lr': 0.000698401460570184, 'weight_decay': 2.965560055460244e-06, 'epochs': 289, 'loss': 'mae', 'optimizer': 'adam', 'graph_mode': 'knn', 'knn_k': 7, 'weighted_edges': False, 'symmetrize_mode': 'mutual', 'self_loops': True, 'use_snp_selection': True, 'num_snps': 4710}. Best is trial 3 with value: 0.28817611324866793.
[I 2025-12-08 14:19:11,540] Trial 9 finished with value: 0.2827529312062381 and parameters: {'model_type': 'graphsage', 'hidden_dims': '[512, 128]', 'dropout': 0.1733844071393634, 'batch_norm': False, 'sage_aggr': 'mean', 'sage_normalize': True, 'sage_project': False, 'lr': 0.0004269677918501597, 'weight_decay': 2.2439779626249696e-06, 'epochs': 319, 'loss': 'mse', 'optimizer': 'adam', 'graph_mode': 'cutoff', 'cutoff': 0.24117565767129295, 'grm_norm': 'cosine_then_gcn', 'self_loops': True, 'use_snp_selection': False}. Best is trial 3 with value: 0.28817611324866793.
[I 2025-12-08 14:20:22,488] Trial 10 finished with value: 0.28652215790866753 and parameters: {'model_type': 'graphsage', 'hidden_dims': '[256, 128, 64]', 'dropout': 0.5062131504581071, 'batch_norm': True, 'sage_aggr': 'max', 'sage_normalize': False, 'sage_project': False, 'lr': 0.0060050040216813455, 'weight_decay': 1.5886244399072472e-05, 'epochs': 258, 'loss': 'mse', 'optimizer': 'adam', 'graph_mode': 'cutoff', 'cutoff': 0.6388703494956212, 'grm_norm': 'none', 'self_loops': True, 'use_snp_selection': False}. Best is trial 3 with value: 0.28817611324866793.
[I 2025-12-08 14:21:31,661] Trial 11 finished with value: 0.280937688636274 and parameters: {'model_type': 'graphsage', 'hidden_dims': '[256, 128, 64]', 'dropout': 0.49488119581970164, 'batch_norm': True, 'sage_aggr': 'max', 'sage_normalize': False, 'sage_project': False, 'lr': 0.006753264773209739, 'weight_decay': 1.623283721491421e-05, 'epochs': 251, 'loss': 'mse', 'optimizer': 'adam', 'graph_mode': 'cutoff', 'cutoff': 0.6423124990838213, 'grm_norm': 'none', 'self_loops': True, 'use_snp_selection': False}. Best is trial 3 with value: 0.28817611324866793.
[I 2025-12-08 14:23:12,657] Trial 12 finished with value: 0.2578973883219421 and parameters: {'model_type': 'graphsage', 'hidden_dims': '[256, 128, 64]', 'dropout': 0.4543297147807155, 'batch_norm': True, 'sage_aggr': 'max', 'sage_normalize': False, 'sage_project': False, 'lr': 0.00923224194542078, 'weight_decay': 6.372026470830696e-06, 'epochs': 340, 'loss': 'mse', 'optimizer': 'adam', 'graph_mode': 'cutoff', 'cutoff': 0.5281360710212811, 'grm_norm': 'none', 'self_loops': True, 'use_snp_selection': False}. Best is trial 3 with value: 0.28817611324866793.
[I 2025-12-08 14:24:27,205] Trial 13 finished with value: 0.29095565502353943 and parameters: {'model_type': 'graphsage', 'hidden_dims': '[256, 128]', 'dropout': 0.4126000400326648, 'batch_norm': True, 'sage_aggr': 'max', 'sage_normalize': False, 'sage_project': False, 'lr': 0.0014626888081117136, 'weight_decay': 1.4066038882938765e-05, 'epochs': 276, 'loss': 'mse', 'optimizer': 'adam', 'graph_mode': 'cutoff', 'cutoff': 0.8513601585335109, 'grm_norm': 'cosine', 'self_loops': True, 'use_snp_selection': False}. Best is trial 13 with value: 0.29095565502353943.
[I 2025-12-08 14:25:45,529] Trial 14 finished with value: 0.2909237443363825 and parameters: {'model_type': 'graphsage', 'hidden_dims': '[256, 128]', 'dropout': 0.3973052383994868, 'batch_norm': True, 'sage_aggr': 'max', 'sage_normalize': False, 'sage_project': False, 'lr': 0.0015333835308097184, 'weight_decay': 5.732655810822652e-07, 'epochs': 293, 'loss': 'mse', 'optimizer': 'adam', 'graph_mode': 'cutoff', 'cutoff': 0.8923190952193389, 'grm_norm': 'cosine', 'self_loops': True, 'use_snp_selection': False}. Best is trial 13 with value: 0.29095565502353943.
[I 2025-12-08 14:26:47,558] Trial 15 finished with value: 0.2902509329115689 and parameters: {'model_type': 'graphsage', 'hidden_dims': '[256, 128]', 'dropout': 0.4270847148237577, 'batch_norm': True, 'sage_aggr': 'max', 'sage_normalize': False, 'sage_project': False, 'lr': 0.002124042171159377, 'weight_decay': 2.695529270882855e-07, 'epochs': 222, 'loss': 'mse', 'optimizer': 'adam', 'graph_mode': 'cutoff', 'cutoff': 0.8973313329898638, 'grm_norm': 'cosine', 'self_loops': True, 'use_snp_selection': False}. Best is trial 13 with value: 0.29095565502353943.
[I 2025-12-08 14:28:09,964] Trial 16 finished with value: 0.28562873424518614 and parameters: {'model_type': 'graphsage', 'hidden_dims': '[256, 128]', 'dropout': 0.4023093052066774, 'batch_norm': True, 'sage_aggr': 'max', 'sage_normalize': False, 'sage_project': False, 'lr': 0.001815787016337461, 'weight_decay': 6.235480231501605e-07, 'epochs': 311, 'loss': 'mse', 'optimizer': 'adam', 'graph_mode': 'cutoff', 'cutoff': 0.8813659147687973, 'grm_norm': 'cosine', 'self_loops': True, 'use_snp_selection': False}. Best is trial 13 with value: 0.29095565502353943.
[I 2025-12-08 14:28:40,035] Trial 17 finished with value: 0.2935186738159087 and parameters: {'model_type': 'graphsage', 'hidden_dims': '[256, 128]', 'dropout': 0.5919520179709522, 'batch_norm': True, 'sage_aggr': 'max', 'sage_normalize': False, 'sage_project': False, 'lr': 0.0021775836937064966, 'weight_decay': 1.8917217435856293e-06, 'epochs': 82, 'loss': 'mse', 'optimizer': 'adam', 'graph_mode': 'cutoff', 'cutoff': 0.7785386910297676, 'grm_norm': 'cosine', 'self_loops': True, 'use_snp_selection': False}. Best is trial 17 with value: 0.2935186738159087.
[I 2025-12-08 14:29:05,218] Trial 18 finished with value: 0.05792273462291042 and parameters: {'model_type': 'graphsage', 'hidden_dims': '[256, 128]', 'dropout': 0.5777451011741039, 'batch_norm': False, 'sage_aggr': 'mean', 'sage_normalize': False, 'sage_project': False, 'lr': 0.00014033037896914508, 'weight_decay': 2.0564422243412808e-06, 'epochs': 62, 'loss': 'mse', 'optimizer': 'adam', 'graph_mode': 'cutoff', 'cutoff': 0.7705998881697249, 'grm_norm': 'cosine', 'self_loops': False, 'use_snp_selection': False}. Best is trial 17 with value: 0.2935186738159087.
[I 2025-12-08 14:29:39,576] Trial 19 finished with value: 0.29473479969542327 and parameters: {'model_type': 'graphsage', 'hidden_dims': '[256, 128]', 'dropout': 0.5983507512977211, 'batch_norm': True, 'sage_aggr': 'max', 'sage_normalize': False, 'sage_project': False, 'lr': 0.002841086925026474, 'weight_decay': 6.837107819990591e-05, 'epochs': 101, 'loss': 'mse', 'optimizer': 'adam', 'graph_mode': 'cutoff', 'cutoff': 0.7525229549192901, 'grm_norm': 'cosine', 'self_loops': True, 'use_snp_selection': False}. Best is trial 19 with value: 0.29473479969542327.
[I 2025-12-08 14:30:14,393] Trial 20 finished with value: 0.2871451339568644 and parameters: {'model_type': 'graphsage', 'hidden_dims': '[256, 128]', 'dropout': 0.5929409630458561, 'batch_norm': True, 'sage_aggr': 'max', 'sage_normalize': False, 'sage_project': False, 'lr': 0.003720721191293333, 'weight_decay': 7.936732212453394e-05, 'epochs': 103, 'loss': 'mse', 'optimizer': 'adam', 'graph_mode': 'cutoff', 'cutoff': 0.7352605650943386, 'grm_norm': 'cosine_then_gcn', 'self_loops': True, 'use_snp_selection': False}. Best is trial 19 with value: 0.29473479969542327.
[I 2025-12-08 14:30:53,354] Trial 21 finished with value: 0.29178544070030143 and parameters: {'model_type': 'graphsage', 'hidden_dims': '[256, 128]', 'dropout': 0.5236067908228456, 'batch_norm': True, 'sage_aggr': 'max', 'sage_normalize': False, 'sage_project': False, 'lr': 0.0008856672368579469, 'weight_decay': 4.6136023252750196e-05, 'epochs': 121, 'loss': 'mse', 'optimizer': 'adam', 'graph_mode': 'cutoff', 'cutoff': 0.7844481591979892, 'grm_norm': 'cosine', 'self_loops': True, 'use_snp_selection': False}. Best is trial 19 with value: 0.29473479969542327.
[I 2025-12-08 14:31:27,446] Trial 22 finished with value: 0.2895524935742909 and parameters: {'model_type': 'graphsage', 'hidden_dims': '[256, 128]', 'dropout': 0.5418534810312459, 'batch_norm': True, 'sage_aggr': 'max', 'sage_normalize': False, 'sage_project': False, 'lr': 0.0009828187426944746, 'weight_decay': 7.172856065643491e-05, 'epochs': 100, 'loss': 'mse', 'optimizer': 'adam', 'graph_mode': 'cutoff', 'cutoff': 0.7102694223603071, 'grm_norm': 'cosine', 'self_loops': True, 'use_snp_selection': False}. Best is trial 19 with value: 0.29473479969542327.
[I 2025-12-08 14:32:02,408] Trial 23 finished with value: 0.29225625283705126 and parameters: {'model_type': 'graphsage', 'hidden_dims': '[256, 128]', 'dropout': 0.5401608778027169, 'batch_norm': True, 'sage_aggr': 'max', 'sage_normalize': False, 'sage_project': False, 'lr': 0.0031532494865829847, 'weight_decay': 0.0001667483459035609, 'epochs': 104, 'loss': 'mse', 'optimizer': 'adam', 'graph_mode': 'cutoff', 'cutoff': 0.7946108649474338, 'grm_norm': 'cosine', 'self_loops': True, 'use_snp_selection': False}. Best is trial 19 with value: 0.29473479969542327.
[I 2025-12-08 14:32:25,191] Trial 24 finished with value: 0.2747766917134523 and parameters: {'model_type': 'graphsage', 'hidden_dims': '[256, 128]', 'dropout': 0.5558065998016691, 'batch_norm': True, 'sage_aggr': 'max', 'sage_normalize': False, 'sage_project': False, 'lr': 0.0033552475812527243, 'weight_decay': 0.0009581085420427445, 'epochs': 41, 'loss': 'mse', 'optimizer': 'adam', 'graph_mode': 'cutoff', 'cutoff': 0.4704010545531979, 'grm_norm': 'gcn', 'self_loops': True, 'use_snp_selection': False}. Best is trial 19 with value: 0.29473479969542327.
[I 2025-12-08 14:32:57,456] Trial 25 finished with value: 0.29396427232524697 and parameters: {'model_type': 'graphsage', 'hidden_dims': '[256, 128]', 'dropout': 0.5948355281269728, 'batch_norm': True, 'sage_aggr': 'max', 'sage_normalize': False, 'sage_project': False, 'lr': 0.00402871273746261, 'weight_decay': 0.00012544305222617283, 'epochs': 92, 'loss': 'mse', 'optimizer': 'adam', 'graph_mode': 'cutoff', 'cutoff': 0.6863336235426247, 'grm_norm': 'cosine', 'self_loops': True, 'use_snp_selection': False}. Best is trial 19 with value: 0.29473479969542327.
[I 2025-12-08 14:33:26,778] Trial 26 finished with value: 0.28396265993556385 and parameters: {'model_type': 'graphsage', 'hidden_dims': '[256, 128]', 'dropout': 0.47364879746465804, 'batch_norm': True, 'sage_aggr': 'mean', 'sage_normalize': True, 'sage_project': False, 'lr': 0.00018261035730288063, 'weight_decay': 3.470255670691035e-05, 'epochs': 78, 'loss': 'mse', 'optimizer': 'adam', 'graph_mode': 'cutoff', 'cutoff': 0.6772879018482634, 'grm_norm': 'cosine', 'self_loops': True, 'use_snp_selection': False}. Best is trial 19 with value: 0.29473479969542327.
[I 2025-12-08 14:34:04,365] Trial 27 finished with value: -1.2398272160973607e-05 and parameters: {'model_type': 'graphsage', 'hidden_dims': '[128, 64]', 'dropout': 0.5848861733125558, 'batch_norm': False, 'sage_aggr': 'max', 'sage_normalize': False, 'sage_project': False, 'lr': 0.005046546767995602, 'weight_decay': 0.0006695793784488542, 'epochs': 122, 'loss': 'mae', 'optimizer': 'adam', 'graph_mode': 'cutoff', 'cutoff': 0.3772369258416245, 'grm_norm': 'cosine', 'self_loops': False, 'use_snp_selection': False}. Best is trial 19 with value: 0.29473479969542327.
[I 2025-12-08 14:34:51,446] Trial 28 finished with value: 0.28792657034372765 and parameters: {'model_type': 'graphsage', 'hidden_dims': '[512, 64]', 'dropout': 0.5726323723723976, 'batch_norm': True, 'sage_aggr': 'max', 'sage_normalize': False, 'sage_project': False, 'lr': 0.009467082690514304, 'weight_decay': 0.00019517451494644716, 'epochs': 81, 'loss': 'mse', 'optimizer': 'adam', 'graph_mode': 'cutoff', 'cutoff': 0.5833262500382577, 'grm_norm': 'gcn', 'self_loops': True, 'use_snp_selection': False}. Best is trial 19 with value: 0.29473479969542327.
[I 2025-12-08 14:35:29,709] Trial 29 finished with value: 0.15173315962159253 and parameters: {'model_type': 'graphsage', 'hidden_dims': '[512, 256]', 'dropout': 0.5957721590531615, 'batch_norm': True, 'sage_aggr': 'max', 'sage_normalize': True, 'sage_project': False, 'lr': 0.002512042517238402, 'weight_decay': 4.358056202240853e-06, 'epochs': 43, 'loss': 'mse', 'optimizer': 'adam', 'graph_mode': 'knn', 'knn_k': 3, 'weighted_edges': False, 'symmetrize_mode': 'union', 'self_loops': True, 'use_snp_selection': False}. Best is trial 19 with value: 0.29473479969542327.
[I 2025-12-08 14:36:35,395] Trial 30 finished with value: 0.29143032820828746 and parameters: {'model_type': 'graphsage', 'hidden_dims': '[512, 128]', 'dropout': 0.47082777963466954, 'batch_norm': True, 'sage_aggr': 'max', 'sage_normalize': False, 'sage_project': False, 'lr': 0.0006674902595083882, 'weight_decay': 0.00033817561340415366, 'epochs': 126, 'loss': 'mse', 'optimizer': 'adam', 'graph_mode': 'cutoff', 'cutoff': 0.8278938259847122, 'grm_norm': 'cosine_then_gcn', 'self_loops': True, 'use_snp_selection': False}. Best is trial 19 with value: 0.29473479969542327.
[I 2025-12-08 14:37:09,670] Trial 31 finished with value: 0.2915780711977984 and parameters: {'model_type': 'graphsage', 'hidden_dims': '[256, 128]', 'dropout': 0.5385550487046553, 'batch_norm': True, 'sage_aggr': 'max', 'sage_normalize': False, 'sage_project': False, 'lr': 0.002873331249661532, 'weight_decay': 0.0001236778500833303, 'epochs': 101, 'loss': 'mse', 'optimizer': 'adam', 'graph_mode': 'cutoff', 'cutoff': 0.801826345686197, 'grm_norm': 'cosine', 'self_loops': True, 'use_snp_selection': False}. Best is trial 19 with value: 0.29473479969542327.
[I 2025-12-08 14:37:39,463] Trial 32 finished with value: 0.29775721061271626 and parameters: {'model_type': 'graphsage', 'hidden_dims': '[256, 128]', 'dropout': 0.5495128905918601, 'batch_norm': True, 'sage_aggr': 'max', 'sage_normalize': False, 'sage_project': False, 'lr': 0.004786698507507558, 'weight_decay': 0.0001617571360376703, 'epochs': 81, 'loss': 'mse', 'optimizer': 'adam', 'graph_mode': 'cutoff', 'cutoff': 0.6907775585945035, 'grm_norm': 'cosine', 'self_loops': True, 'use_snp_selection': False}. Best is trial 32 with value: 0.29775721061271626.
[I 2025-12-08 14:38:08,036] Trial 33 finished with value: 0.29054569402495406 and parameters: {'model_type': 'graphsage', 'hidden_dims': '[256, 128]', 'dropout': 0.5152650587868493, 'batch_norm': True, 'sage_aggr': 'max', 'sage_normalize': False, 'sage_project': False, 'lr': 0.0046187366602847705, 'weight_decay': 2.6529418204374484e-05, 'epochs': 76, 'loss': 'mse', 'optimizer': 'adam', 'graph_mode': 'cutoff', 'cutoff': 0.7054377314251808, 'grm_norm': 'cosine', 'self_loops': True, 'use_snp_selection': False}. Best is trial 32 with value: 0.29775721061271626.
[I 2025-12-08 14:38:36,146] Trial 34 finished with value: 0.23427598803133884 and parameters: {'model_type': 'graphsage', 'hidden_dims': '[128, 64]', 'dropout': 0.5603685108551789, 'batch_norm': False, 'sage_aggr': 'max', 'sage_normalize': False, 'sage_project': False, 'lr': 0.0012390451171824008, 'weight_decay': 0.00012404143256371637, 'epochs': 153, 'loss': 'mse', 'optimizer': 'adam', 'graph_mode': 'cutoff', 'cutoff': 0.6575832258653338, 'grm_norm': 'cosine', 'self_loops': True, 'use_snp_selection': True, 'num_snps': 2241}. Best is trial 32 with value: 0.29775721061271626.
[I 2025-12-08 14:39:44,094] Trial 35 finished with value: 0.2589818679872094 and parameters: {'model_type': 'graphsage', 'hidden_dims': '[256, 128]', 'dropout': 0.598798484070252, 'batch_norm': True, 'sage_aggr': 'max', 'sage_normalize': False, 'sage_project': False, 'lr': 0.0060746719533245445, 'weight_decay': 1.133399702967612e-06, 'epochs': 136, 'loss': 'mse', 'optimizer': 'adam', 'graph_mode': 'knn', 'knn_k': 4, 'weighted_edges': True, 'symmetrize_mode': 'union', 'self_loops': True, 'use_snp_selection': False}. Best is trial 32 with value: 0.29775721061271626.
[I 2025-12-08 14:40:56,348] Trial 36 finished with value: 0.2921579803036136 and parameters: {'model_type': 'graphsage', 'hidden_dims': '[512, 128]', 'dropout': 0.4952298828427944, 'batch_norm': True, 'sage_aggr': 'max', 'sage_normalize': False, 'sage_project': False, 'lr': 0.0002803487607108336, 'weight_decay': 0.00025777232151560496, 'epochs': 59, 'loss': 'mae', 'optimizer': 'adam', 'graph_mode': 'cutoff', 'cutoff': 0.7279996307162433, 'grm_norm': 'cosine', 'self_loops': False, 'use_snp_selection': True, 'num_snps': 59922}. Best is trial 32 with value: 0.29775721061271626.
[I 2025-12-08 14:41:47,648] Trial 37 finished with value: 0.291079224270589 and parameters: {'model_type': 'graphsage', 'hidden_dims': '[512, 256]', 'dropout': 0.5628254012181173, 'batch_norm': True, 'sage_aggr': 'max', 'sage_normalize': False, 'sage_project': False, 'lr': 0.002138642543516637, 'weight_decay': 0.00046905210585123676, 'epochs': 91, 'loss': 'mse', 'optimizer': 'adam', 'graph_mode': 'cutoff', 'cutoff': 0.5996470091352433, 'grm_norm': 'cosine', 'self_loops': True, 'use_snp_selection': False}. Best is trial 32 with value: 0.29775721061271626.
[I 2025-12-08 14:43:51,319] Trial 38 finished with value: 0.10218726186908926 and parameters: {'model_type': 'graphsage', 'hidden_dims': '[256, 128]', 'dropout': 0.3629213627825921, 'batch_norm': False, 'sage_aggr': 'mean', 'sage_normalize': True, 'sage_project': False, 'lr': 0.003984165214948194, 'weight_decay': 4.870524343901116e-05, 'epochs': 167, 'loss': 'mae', 'optimizer': 'adam', 'graph_mode': 'knn', 'knn_k': 10, 'weighted_edges': True, 'symmetrize_mode': 'union', 'self_loops': False, 'use_snp_selection': False}. Best is trial 32 with value: 0.29775721061271626.
