[I 2025-12-09 19:39:19,520] Trial 46 finished with value: 0.22669071622695203 and parameters: {'model_type': 'graphsage', 'hidden_dims': '[256, 128, 64]', 'dropout': 0.5127877747592811, 'batch_norm': True, 'sage_aggr': 'max', 'sage_normalize': True, 'sage_project': False, 'lr': 0.004824205556174641, 'weight_decay': 3.776639114121727e-06, 'epochs': 253, 'loss': 'mae', 'optimizer': 'adam', 'graph_mode': 'knn', 'knn_k': 10, 'weighted_edges': False, 'symmetrize_mode': 'union', 'self_loops': False, 'use_snp_selection': False}. Best is trial 22 with value: 0.3113074478251863.
[I 2025-12-09 19:40:51,146] Trial 47 finished with value: 0.3089542673208096 and parameters: {'model_type': 'graphsage', 'hidden_dims': '[512, 256]', 'dropout': 0.5450328342156536, 'batch_norm': False, 'sage_aggr': 'mean', 'sage_normalize': True, 'sage_project': False, 'lr': 0.002857633156752367, 'weight_decay': 8.517445738975425e-07, 'epochs': 169, 'loss': 'mse', 'optimizer': 'adam', 'graph_mode': 'cutoff', 'cutoff': 0.8504755730097503, 'grm_norm': 'cosine', 'self_loops': True, 'use_snp_selection': False}. Best is trial 22 with value: 0.3113074478251863.
[I 2025-12-09 19:42:26,839] Trial 48 finished with value: 0.29855521368489174 and parameters: {'model_type': 'graphsage', 'hidden_dims': '[512, 256]', 'dropout': 0.5504195503866051, 'batch_norm': False, 'sage_aggr': 'mean', 'sage_normalize': True, 'sage_project': False, 'lr': 0.0033372090492857194, 'weight_decay': 1.0341254320186813e-07, 'epochs': 177, 'loss': 'mse', 'optimizer': 'adam', 'graph_mode': 'cutoff', 'cutoff': 0.8508929271938761, 'grm_norm': 'cosine', 'self_loops': True, 'use_snp_selection': False}. Best is trial 22 with value: 0.3113074478251863.
[I 2025-12-09 19:43:04,214] Trial 49 finished with value: 0.2865082052816062 and parameters: {'model_type': 'graphsage', 'hidden_dims': '[512, 256]', 'dropout': 0.44503241914514635, 'batch_norm': False, 'sage_aggr': 'mean', 'sage_normalize': True, 'sage_project': False, 'lr': 0.0004405340651325045, 'weight_decay': 2.770146049581017e-07, 'epochs': 226, 'loss': 'mse', 'optimizer': 'adam', 'graph_mode': 'cutoff', 'cutoff': 0.7830336990859147, 'grm_norm': 'cosine', 'self_loops': True, 'use_snp_selection': True, 'num_snps': 14234}. Best is trial 22 with value: 0.3113074478251863.
[I 2025-12-09 19:45:57,943] Trial 50 finished with value: 0.2816022096597081 and parameters: {'model_type': 'graphsage', 'hidden_dims': '[512, 256]', 'dropout': 0.5738281404989334, 'batch_norm': False, 'sage_aggr': 'mean', 'sage_normalize': True, 'sage_project': False, 'lr': 0.00010618598153533753, 'weight_decay': 6.270178236937872e-07, 'epochs': 321, 'loss': 'mse', 'optimizer': 'adam', 'graph_mode': 'cutoff', 'cutoff': 0.5919748267550635, 'grm_norm': 'none', 'self_loops': True, 'use_snp_selection': False}. Best is trial 22 with value: 0.3113074478251863.
[I 2025-12-09 19:47:02,699] Trial 51 finished with value: 0.2839360833910999 and parameters: {'model_type': 'graphsage', 'hidden_dims': '[512, 128]', 'dropout': 0.30504421670519005, 'batch_norm': False, 'sage_aggr': 'mean', 'sage_normalize': True, 'sage_project': False, 'lr': 0.0021427810229156315, 'weight_decay': 1.0699109990606087e-06, 'epochs': 117, 'loss': 'mse', 'optimizer': 'adam', 'graph_mode': 'cutoff', 'cutoff': 0.8489248105462439, 'grm_norm': 'cosine', 'self_loops': True, 'use_snp_selection': False}. Best is trial 22 with value: 0.3113074478251863.
[I 2025-12-09 19:48:31,540] Trial 52 finished with value: 0.3096680106206858 and parameters: {'model_type': 'graphsage', 'hidden_dims': '[512, 256]', 'dropout': 0.49975218991665155, 'batch_norm': False, 'sage_aggr': 'mean', 'sage_normalize': True, 'sage_project': False, 'lr': 0.005231174100684929, 'weight_decay': 2.1163986625990785e-07, 'epochs': 164, 'loss': 'mse', 'optimizer': 'adam', 'graph_mode': 'cutoff', 'cutoff': 0.8046716091261706, 'grm_norm': 'none', 'self_loops': True, 'use_snp_selection': False}. Best is trial 22 with value: 0.3113074478251863.
[I 2025-12-09 19:50:01,453] Trial 53 finished with value: 0.31108743845791087 and parameters: {'model_type': 'graphsage', 'hidden_dims': '[512, 256]', 'dropout': 0.5360370292684745, 'batch_norm': False, 'sage_aggr': 'mean', 'sage_normalize': True, 'sage_project': False, 'lr': 0.007526927070134367, 'weight_decay': 1.5407649822415286e-07, 'epochs': 166, 'loss': 'mse', 'optimizer': 'adam', 'graph_mode': 'cutoff', 'cutoff': 0.8006004914259218, 'grm_norm': 'none', 'self_loops': True, 'use_snp_selection': False}. Best is trial 22 with value: 0.3113074478251863.
[I 2025-12-09 19:51:29,837] Trial 54 finished with value: 0.2960620937043893 and parameters: {'model_type': 'graphsage', 'hidden_dims': '[512, 256]', 'dropout': 0.5400072031723917, 'batch_norm': False, 'sage_aggr': 'mean', 'sage_normalize': True, 'sage_project': False, 'lr': 0.005667020688673745, 'weight_decay': 1.6176512038160786e-07, 'epochs': 163, 'loss': 'mse', 'optimizer': 'adam', 'graph_mode': 'cutoff', 'cutoff': 0.8043626683433653, 'grm_norm': 'none', 'self_loops': True, 'use_snp_selection': False}. Best is trial 22 with value: 0.3113074478251863.
[I 2025-12-09 19:53:12,036] Trial 55 finished with value: 0.30928368010302076 and parameters: {'model_type': 'graphsage', 'hidden_dims': '[512, 256]', 'dropout': 0.5965174290095814, 'batch_norm': False, 'sage_aggr': 'mean', 'sage_normalize': True, 'sage_project': False, 'lr': 0.0031394830782091724, 'weight_decay': 2.761824603441078e-07, 'epochs': 190, 'loss': 'mse', 'optimizer': 'adam', 'graph_mode': 'cutoff', 'cutoff': 0.8652023725386474, 'grm_norm': 'none', 'self_loops': True, 'use_snp_selection': False}. Best is trial 22 with value: 0.3113074478251863.
[I 2025-12-09 19:54:52,752] Trial 56 finished with value: 0.3023903826398254 and parameters: {'model_type': 'graphsage', 'hidden_dims': '[512, 256]', 'dropout': 0.5990407375503369, 'batch_norm': False, 'sage_aggr': 'mean', 'sage_normalize': True, 'sage_project': False, 'lr': 0.0012843750634678008, 'weight_decay': 3.166842691859638e-07, 'epochs': 187, 'loss': 'mse', 'optimizer': 'adam', 'graph_mode': 'cutoff', 'cutoff': 0.7861249644814784, 'grm_norm': 'none', 'self_loops': True, 'use_snp_selection': False}. Best is trial 22 with value: 0.3113074478251863.
[I 2025-12-09 19:56:22,094] Trial 57 finished with value: 0.30249731232054045 and parameters: {'model_type': 'graphsage', 'hidden_dims': '[512, 256]', 'dropout': 0.5327113507194804, 'batch_norm': False, 'sage_aggr': 'mean', 'sage_normalize': True, 'sage_project': False, 'lr': 0.0029373588250670595, 'weight_decay': 1.2526898408010777e-07, 'epochs': 165, 'loss': 'mse', 'optimizer': 'adam', 'graph_mode': 'cutoff', 'cutoff': 0.8551233317153416, 'grm_norm': 'none', 'self_loops': False, 'use_snp_selection': False}. Best is trial 22 with value: 0.3113074478251863.
[I 2025-12-09 19:57:43,839] Trial 58 finished with value: 0.3000098129611624 and parameters: {'model_type': 'graphsage', 'hidden_dims': '[512, 256]', 'dropout': 0.5795103043560345, 'batch_norm': False, 'sage_aggr': 'mean', 'sage_normalize': True, 'sage_project': False, 'lr': 0.00414484863863053, 'weight_decay': 2.358052111285746e-07, 'epochs': 150, 'loss': 'mse', 'optimizer': 'adam', 'graph_mode': 'cutoff', 'cutoff': 0.7641087197116785, 'grm_norm': 'none', 'self_loops': True, 'use_snp_selection': False}. Best is trial 22 with value: 0.3113074478251863.
[I 2025-12-09 19:59:34,402] Trial 59 finished with value: 0.31197841542309374 and parameters: {'model_type': 'graphsage', 'hidden_dims': '[512, 256]', 'dropout': 0.49386693484487865, 'batch_norm': False, 'sage_aggr': 'mean', 'sage_normalize': True, 'sage_project': False, 'lr': 0.0017732620978191808, 'weight_decay': 7.799283363652534e-07, 'epochs': 206, 'loss': 'mse', 'optimizer': 'adam', 'graph_mode': 'cutoff', 'cutoff': 0.8185600422307905, 'grm_norm': 'none', 'self_loops': True, 'use_snp_selection': False}. Best is trial 59 with value: 0.31197841542309374.
[I 2025-12-09 20:01:21,904] Trial 60 finished with value: 0.30555331124717117 and parameters: {'model_type': 'graphsage', 'hidden_dims': '[512, 256]', 'dropout': 0.10057321925494148, 'batch_norm': False, 'sage_aggr': 'max', 'sage_normalize': True, 'sage_project': False, 'lr': 0.0017589238246355269, 'weight_decay': 3.401214860768287e-07, 'epochs': 201, 'loss': 'mse', 'optimizer': 'adam', 'graph_mode': 'cutoff', 'cutoff': 0.8050830566991592, 'grm_norm': 'none', 'self_loops': True, 'use_snp_selection': False}. Best is trial 59 with value: 0.31197841542309374.
[I 2025-12-09 20:03:02,080] Trial 61 finished with value: 0.3058770440326556 and parameters: {'model_type': 'graphsage', 'hidden_dims': '[512, 256]', 'dropout': 0.4951633510397732, 'batch_norm': False, 'sage_aggr': 'mean', 'sage_normalize': True, 'sage_project': False, 'lr': 0.002858437467869394, 'weight_decay': 7.694612754303168e-07, 'epochs': 186, 'loss': 'mse', 'optimizer': 'adam', 'graph_mode': 'cutoff', 'cutoff': 0.8684294658892547, 'grm_norm': 'none', 'self_loops': True, 'use_snp_selection': False}. Best is trial 59 with value: 0.31197841542309374.
[I 2025-12-09 20:04:56,707] Trial 62 finished with value: 0.3064550548718471 and parameters: {'model_type': 'graphsage', 'hidden_dims': '[512, 256]', 'dropout': 0.4744426961477844, 'batch_norm': False, 'sage_aggr': 'mean', 'sage_normalize': True, 'sage_project': False, 'lr': 0.001042222239960151, 'weight_decay': 1.472886939260719e-07, 'epochs': 214, 'loss': 'mse', 'optimizer': 'adam', 'graph_mode': 'cutoff', 'cutoff': 0.8328315023253157, 'grm_norm': 'none', 'self_loops': True, 'use_snp_selection': False}. Best is trial 59 with value: 0.31197841542309374.
[I 2025-12-09 20:06:30,256] Trial 63 finished with value: 0.3038504705892144 and parameters: {'model_type': 'graphsage', 'hidden_dims': '[512, 256]', 'dropout': 0.5542766329966393, 'batch_norm': False, 'sage_aggr': 'mean', 'sage_normalize': True, 'sage_project': False, 'lr': 0.0043180560795575435, 'weight_decay': 4.0636930198874575e-07, 'epochs': 173, 'loss': 'mse', 'optimizer': 'adam', 'graph_mode': 'cutoff', 'cutoff': 0.8156520126109799, 'grm_norm': 'none', 'self_loops': True, 'use_snp_selection': False}. Best is trial 59 with value: 0.31197841542309374.
[I 2025-12-09 20:07:53,080] Trial 64 finished with value: 0.3050194481161948 and parameters: {'model_type': 'graphsage', 'hidden_dims': '[512, 256]', 'dropout': 0.5875890454402621, 'batch_norm': False, 'sage_aggr': 'mean', 'sage_normalize': True, 'sage_project': False, 'lr': 0.00147481291896612, 'weight_decay': 2.056541501134843e-07, 'epochs': 152, 'loss': 'mse', 'optimizer': 'adam', 'graph_mode': 'cutoff', 'cutoff': 0.7446776719612419, 'grm_norm': 'none', 'self_loops': True, 'use_snp_selection': False}. Best is trial 59 with value: 0.31197841542309374.
[I 2025-12-09 20:09:44,243] Trial 65 finished with value: 0.30119344723481933 and parameters: {'model_type': 'graphsage', 'hidden_dims': '[512, 256]', 'dropout': 0.5256933458774391, 'batch_norm': False, 'sage_aggr': 'mean', 'sage_normalize': True, 'sage_project': False, 'lr': 0.0005412604645975213, 'weight_decay': 3.0386421992794887e-07, 'epochs': 207, 'loss': 'mse', 'optimizer': 'adam', 'graph_mode': 'cutoff', 'cutoff': 0.859907301838405, 'grm_norm': 'cosine_then_gcn', 'self_loops': True, 'use_snp_selection': False}. Best is trial 59 with value: 0.31197841542309374.
[I 2025-12-09 20:11:49,155] Trial 66 finished with value: 0.3005030856420283 and parameters: {'model_type': 'graphsage', 'hidden_dims': '[512, 256]', 'dropout': 0.5002920109732859, 'batch_norm': False, 'sage_aggr': 'mean', 'sage_normalize': True, 'sage_project': False, 'lr': 0.009902699538005417, 'weight_decay': 2.512401162855106e-06, 'epochs': 233, 'loss': 'mse', 'optimizer': 'adam', 'graph_mode': 'cutoff', 'cutoff': 0.6926585751846279, 'grm_norm': 'none', 'self_loops': True, 'use_snp_selection': False}. Best is trial 59 with value: 0.31197841542309374.
[I 2025-12-09 20:13:32,564] Trial 67 finished with value: 0.3023615769454636 and parameters: {'model_type': 'graphsage', 'hidden_dims': '[512, 64]', 'dropout': 0.45296038336277294, 'batch_norm': False, 'sage_aggr': 'mean', 'sage_normalize': True, 'sage_project': False, 'lr': 0.0069528286426017724, 'weight_decay': 1.279558042673196e-07, 'epochs': 193, 'loss': 'mse', 'optimizer': 'adam', 'graph_mode': 'cutoff', 'cutoff': 0.7783232336839472, 'grm_norm': 'none', 'self_loops': True, 'use_snp_selection': False}. Best is trial 59 with value: 0.31197841542309374.
[I 2025-12-09 20:15:03,186] Trial 68 finished with value: 0.28699829413293176 and parameters: {'model_type': 'graphsage', 'hidden_dims': '[512, 128]', 'dropout': 0.4110865706589696, 'batch_norm': False, 'sage_aggr': 'mean', 'sage_normalize': True, 'sage_project': False, 'lr': 0.0018469135650180562, 'weight_decay': 6.645281668321386e-07, 'epochs': 168, 'loss': 'mse', 'optimizer': 'adam', 'graph_mode': 'cutoff', 'cutoff': 0.8654780421858833, 'grm_norm': 'none', 'self_loops': True, 'use_snp_selection': False}. Best is trial 59 with value: 0.31197841542309374.
[I 2025-12-09 20:16:17,981] Trial 69 finished with value: 0.302335239939474 and parameters: {'model_type': 'graphsage', 'hidden_dims': '[512, 256]', 'dropout': 0.5551775916389905, 'batch_norm': False, 'sage_aggr': 'mean', 'sage_normalize': True, 'sage_project': False, 'lr': 0.007913360478254281, 'weight_decay': 1.4511820158036459e-06, 'epochs': 181, 'loss': 'mse', 'optimizer': 'adam', 'graph_mode': 'cutoff', 'cutoff': 0.8061816759459794, 'grm_norm': 'cosine_then_gcn', 'self_loops': True, 'use_snp_selection': True, 'num_snps': 38681}. Best is trial 59 with value: 0.31197841542309374.
[I 2025-12-09 20:18:16,210] Trial 70 finished with value: 0.308743662240907 and parameters: {'model_type': 'graphsage', 'hidden_dims': '[512, 256]', 'dropout': 0.5837940715576928, 'batch_norm': False, 'sage_aggr': 'mean', 'sage_normalize': True, 'sage_project': False, 'lr': 0.0035822336766156877, 'weight_decay': 7.900651539443342e-07, 'epochs': 221, 'loss': 'mse', 'optimizer': 'adam', 'graph_mode': 'cutoff', 'cutoff': 0.8353669099191883, 'grm_norm': 'none', 'self_loops': False, 'use_snp_selection': False}. Best is trial 59 with value: 0.31197841542309374.
[I 2025-12-09 20:20:13,424] Trial 71 finished with value: 0.3022001422885575 and parameters: {'model_type': 'graphsage', 'hidden_dims': '[512, 256]', 'dropout': 0.5797897168487967, 'batch_norm': False, 'sage_aggr': 'mean', 'sage_normalize': True, 'sage_project': False, 'lr': 0.003889926688908086, 'weight_decay': 4.6287028537940225e-07, 'epochs': 219, 'loss': 'mse', 'optimizer': 'adam', 'graph_mode': 'cutoff', 'cutoff': 0.8325299548024708, 'grm_norm': 'none', 'self_loops': False, 'use_snp_selection': False}. Best is trial 59 with value: 0.31197841542309374.
[I 2025-12-09 20:22:22,404] Trial 72 finished with value: 0.30444117373783786 and parameters: {'model_type': 'graphsage', 'hidden_dims': '[512, 256]', 'dropout': 0.599315767396284, 'batch_norm': False, 'sage_aggr': 'mean', 'sage_normalize': True, 'sage_project': False, 'lr': 0.0026528374895485483, 'weight_decay': 8.344700191915131e-07, 'epochs': 242, 'loss': 'mse', 'optimizer': 'adam', 'graph_mode': 'cutoff', 'cutoff': 0.8979860969905155, 'grm_norm': 'none', 'self_loops': False, 'use_snp_selection': False}. Best is trial 59 with value: 0.31197841542309374.
[I 2025-12-09 20:24:05,252] Trial 73 finished with value: 0.2998549935499907 and parameters: {'model_type': 'graphsage', 'hidden_dims': '[512, 256]', 'dropout': 0.5388335755537883, 'batch_norm': False, 'sage_aggr': 'mean', 'sage_normalize': True, 'sage_project': False, 'lr': 0.005200687994634131, 'weight_decay': 2.2559446417430873e-07, 'epochs': 191, 'loss': 'mse', 'optimizer': 'adam', 'graph_mode': 'cutoff', 'cutoff': 0.787380647039876, 'grm_norm': 'none', 'self_loops': False, 'use_snp_selection': False}. Best is trial 59 with value: 0.31197841542309374.
[I 2025-12-09 20:26:11,518] Trial 74 finished with value: 0.2968856678733378 and parameters: {'model_type': 'graphsage', 'hidden_dims': '[512, 256]', 'dropout': 0.12614145498218443, 'batch_norm': False, 'sage_aggr': 'mean', 'sage_normalize': True, 'sage_project': False, 'lr': 0.0035029558777868817, 'weight_decay': 2.2944655090910008e-05, 'epochs': 235, 'loss': 'mse', 'optimizer': 'adam', 'graph_mode': 'cutoff', 'cutoff': 0.6632582345626423, 'grm_norm': 'none', 'self_loops': False, 'use_snp_selection': False}. Best is trial 59 with value: 0.31197841542309374.
[I 2025-12-09 20:27:38,452] Trial 75 finished with value: 0.31119490669520034 and parameters: {'model_type': 'graphsage', 'hidden_dims': '[512, 256]', 'dropout': 0.5632737186272322, 'batch_norm': False, 'sage_aggr': 'mean', 'sage_normalize': True, 'sage_project': False, 'lr': 0.0019077600032249217, 'weight_decay': 3.229283616086684e-07, 'epochs': 160, 'loss': 'mse', 'optimizer': 'adam', 'graph_mode': 'cutoff', 'cutoff': 0.7403647380946814, 'grm_norm': 'gcn', 'self_loops': False, 'use_snp_selection': False}. Best is trial 59 with value: 0.31197841542309374.
[I 2025-12-09 20:28:19,551] Trial 76 finished with value: 0.27446806788007616 and parameters: {'model_type': 'graphsage', 'hidden_dims': '[256, 128, 64]', 'dropout': 0.5587944087853745, 'batch_norm': False, 'sage_aggr': 'mean', 'sage_normalize': True, 'sage_project': False, 'lr': 0.0021114013427829125, 'weight_decay': 3.3998803363451786e-07, 'epochs': 137, 'loss': 'mse', 'optimizer': 'adam', 'graph_mode': 'cutoff', 'cutoff': 0.7482337533324173, 'grm_norm': 'gcn', 'self_loops': True, 'use_snp_selection': False}. Best is trial 59 with value: 0.31197841542309374.
[I 2025-12-09 20:29:44,908] Trial 77 finished with value: 0.30406982429979795 and parameters: {'model_type': 'graphsage', 'hidden_dims': '[512, 256]', 'dropout': 0.485435610467304, 'batch_norm': False, 'sage_aggr': 'max', 'sage_normalize': True, 'sage_project': False, 'lr': 0.000945458498363039, 'weight_decay': 1.9259741126405217e-07, 'epochs': 158, 'loss': 'mse', 'optimizer': 'adam', 'graph_mode': 'cutoff', 'cutoff': 0.8732705153578347, 'grm_norm': 'gcn', 'self_loops': True, 'use_snp_selection': False}. Best is trial 59 with value: 0.31197841542309374.
[I 2025-12-09 20:31:04,767] Trial 78 finished with value: 0.2877511251511278 and parameters: {'model_type': 'graphsage', 'hidden_dims': '[512, 64]', 'dropout': 0.5019573100917594, 'batch_norm': False, 'sage_aggr': 'mean', 'sage_normalize': True, 'sage_project': False, 'lr': 0.0063154241167862795, 'weight_decay': 2.709913295447299e-07, 'epochs': 145, 'loss': 'mse', 'optimizer': 'adam', 'graph_mode': 'cutoff', 'cutoff': 0.618315036138114, 'grm_norm': 'gcn', 'self_loops': False, 'use_snp_selection': False}. Best is trial 59 with value: 0.31197841542309374.
[I 2025-12-09 20:31:40,683] Trial 79 finished with value: 0.28708542777541013 and parameters: {'model_type': 'graphsage', 'hidden_dims': '[256, 128]', 'dropout': 0.5630428296647587, 'batch_norm': False, 'sage_aggr': 'mean', 'sage_normalize': True, 'sage_project': False, 'lr': 0.0027199431904925304, 'weight_decay': 1.022978449865034e-07, 'epochs': 119, 'loss': 'mse', 'optimizer': 'adam', 'graph_mode': 'cutoff', 'cutoff': 0.733567766926126, 'grm_norm': 'gcn', 'self_loops': True, 'use_snp_selection': False}. Best is trial 59 with value: 0.31197841542309374.
[I 2025-12-09 20:33:18,503] Trial 80 finished with value: 0.3071022188541611 and parameters: {'model_type': 'graphsage', 'hidden_dims': '[512, 256]', 'dropout': 0.5404407080768043, 'batch_norm': False, 'sage_aggr': 'mean', 'sage_normalize': True, 'sage_project': False, 'lr': 0.0014993685693835757, 'weight_decay': 9.539208419187465e-06, 'epochs': 181, 'loss': 'mse', 'optimizer': 'adam', 'graph_mode': 'cutoff', 'cutoff': 0.6941890307398952, 'grm_norm': 'cosine_then_gcn', 'self_loops': True, 'use_snp_selection': False}. Best is trial 59 with value: 0.31197841542309374.
[I 2025-12-09 20:35:24,835] Trial 81 finished with value: 0.28747131607888426 and parameters: {'model_type': 'graphsage', 'hidden_dims': '[512, 256]', 'dropout': 0.5872880823454774, 'batch_norm': False, 'sage_aggr': 'mean', 'sage_normalize': True, 'sage_project': False, 'lr': 0.004553300469662952, 'weight_decay': 4.705193824537385e-07, 'epochs': 200, 'loss': 'mse', 'optimizer': 'adam', 'graph_mode': 'cutoff', 'cutoff': 0.48199840797276683, 'grm_norm': 'none', 'self_loops': False, 'use_snp_selection': False}. Best is trial 59 with value: 0.31197841542309374.
[I 2025-12-09 20:37:23,176] Trial 82 finished with value: 0.3075801600402911 and parameters: {'model_type': 'graphsage', 'hidden_dims': '[512, 256]', 'dropout': 0.527400286425496, 'batch_norm': False, 'sage_aggr': 'mean', 'sage_normalize': True, 'sage_project': False, 'lr': 0.0034068043509438146, 'weight_decay': 1.2994322469857042e-06, 'epochs': 221, 'loss': 'mse', 'optimizer': 'adam', 'graph_mode': 'cutoff', 'cutoff': 0.8298736640895004, 'grm_norm': 'cosine', 'self_loops': False, 'use_snp_selection': False}. Best is trial 59 with value: 0.31197841542309374.
[I 2025-12-09 20:38:57,732] Trial 83 finished with value: 0.29851413360113027 and parameters: {'model_type': 'graphsage', 'hidden_dims': '[512, 256]', 'dropout': 0.5203684701646176, 'batch_norm': False, 'sage_aggr': 'mean', 'sage_normalize': True, 'sage_project': False, 'lr': 0.00790770923206907, 'weight_decay': 2.122150201192065e-06, 'epochs': 175, 'loss': 'mse', 'optimizer': 'adam', 'graph_mode': 'cutoff', 'cutoff': 0.8195219732744347, 'grm_norm': 'gcn', 'self_loops': False, 'use_snp_selection': False}. Best is trial 59 with value: 0.31197841542309374.
