[I 2025-12-09 13:43:04,937] Trial 43 finished with value: 0.31439690364379314 and parameters: {'model_type': 'graphsage', 'hidden_dims': '[512, 64]', 'dropout': 0.4707220975997622, 'batch_norm': True, 'sage_aggr': 'max', 'sage_normalize': False, 'sage_project': False, 'lr': 0.0032245040757960582, 'weight_decay': 3.110785165786159e-05, 'epochs': 121, 'loss': 'mse', 'optimizer': 'adam', 'graph_mode': 'cutoff', 'cutoff': 0.8452972880773744, 'grm_norm': 'cosine_then_gcn', 'self_loops': True, 'use_snp_selection': False}. Best is trial 43 with value: 0.31439690364379314.
[I 2025-12-09 13:44:34,954] Trial 44 finished with value: 0.3034812863636523 and parameters: {'model_type': 'graphsage', 'hidden_dims': '[512, 64]', 'dropout': 0.48400502612235574, 'batch_norm': True, 'sage_aggr': 'max', 'sage_normalize': False, 'sage_project': False, 'lr': 0.00045238834517422055, 'weight_decay': 2.269294783773026e-05, 'epochs': 168, 'loss': 'mse', 'optimizer': 'adam', 'graph_mode': 'cutoff', 'cutoff': 0.8546128654537066, 'grm_norm': 'cosine_then_gcn', 'self_loops': True, 'use_snp_selection': False}. Best is trial 43 with value: 0.31439690364379314.
[I 2025-12-09 13:45:30,008] Trial 45 finished with value: 0.31131089331911055 and parameters: {'model_type': 'graphsage', 'hidden_dims': '[512, 64]', 'dropout': 0.5095886493154682, 'batch_norm': True, 'sage_aggr': 'mean', 'sage_normalize': True, 'sage_project': False, 'lr': 0.007261671914142459, 'weight_decay': 7.745975243993571e-06, 'epochs': 142, 'loss': 'mse', 'optimizer': 'adam', 'graph_mode': 'cutoff', 'cutoff': 0.7884593562328468, 'grm_norm': 'cosine_then_gcn', 'self_loops': True, 'use_snp_selection': True, 'num_snps': 34750}. Best is trial 43 with value: 0.31439690364379314.
[I 2025-12-09 13:47:10,746] Trial 46 finished with value: 0.0 and parameters: {'model_type': 'graphsage', 'hidden_dims': '[512, 64]', 'dropout': 0.43411109562185224, 'batch_norm': False, 'sage_aggr': 'max', 'sage_normalize': False, 'sage_project': False, 'lr': 0.0016618888549414382, 'weight_decay': 2.1084512760732634e-05, 'epochs': 186, 'loss': 'mse', 'optimizer': 'adam', 'graph_mode': 'cutoff', 'cutoff': 0.5839042200554263, 'grm_norm': 'cosine_then_gcn', 'self_loops': False, 'use_snp_selection': False}. Best is trial 43 with value: 0.31439690364379314.
[I 2025-12-09 13:48:14,238] Trial 47 finished with value: 0.3119960354435363 and parameters: {'model_type': 'graphsage', 'hidden_dims': '[512, 64]', 'dropout': 0.2885818797175596, 'batch_norm': True, 'sage_aggr': 'max', 'sage_normalize': False, 'sage_project': False, 'lr': 0.004351061379952564, 'weight_decay': 1.0359645285627394e-05, 'epochs': 116, 'loss': 'mse', 'optimizer': 'adam', 'graph_mode': 'cutoff', 'cutoff': 0.8614581406379952, 'grm_norm': 'cosine_then_gcn', 'self_loops': True, 'use_snp_selection': False}. Best is trial 43 with value: 0.31439690364379314.
[I 2025-12-09 13:50:06,267] Trial 48 finished with value: 0.2754836442967698 and parameters: {'model_type': 'graphsage', 'hidden_dims': '[512, 64]', 'dropout': 0.3683324628152046, 'batch_norm': True, 'sage_aggr': 'max', 'sage_normalize': False, 'sage_project': False, 'lr': 0.002616560615846987, 'weight_decay': 2.6980860184890996e-06, 'epochs': 132, 'loss': 'mse', 'optimizer': 'adam', 'graph_mode': 'knn', 'knn_k': 4, 'weighted_edges': False, 'symmetrize_mode': 'union', 'self_loops': True, 'use_snp_selection': False}. Best is trial 43 with value: 0.31439690364379314.
[I 2025-12-09 13:51:55,777] Trial 49 finished with value: 0.27900111258109017 and parameters: {'model_type': 'graphsage', 'hidden_dims': '[512, 64]', 'dropout': 0.5164682970851785, 'batch_norm': True, 'sage_aggr': 'mean', 'sage_normalize': True, 'sage_project': False, 'lr': 0.0013786829097886812, 'weight_decay': 5.35545462601305e-05, 'epochs': 159, 'loss': 'mae', 'optimizer': 'adam', 'graph_mode': 'cutoff', 'cutoff': 0.449897920650789, 'grm_norm': 'cosine_then_gcn', 'self_loops': True, 'use_snp_selection': True, 'num_snps': 43660}. Best is trial 43 with value: 0.31439690364379314.
[I 2025-12-09 13:52:48,059] Trial 50 finished with value: 0.31796609177250984 and parameters: {'model_type': 'graphsage', 'hidden_dims': '[512, 64]', 'dropout': 0.49086687234590515, 'batch_norm': True, 'sage_aggr': 'max', 'sage_normalize': False, 'sage_project': False, 'lr': 0.006863765826102171, 'weight_decay': 2.5688776135166294e-05, 'epochs': 94, 'loss': 'mse', 'optimizer': 'adam', 'graph_mode': 'cutoff', 'cutoff': 0.8434888524820693, 'grm_norm': 'cosine_then_gcn', 'self_loops': True, 'use_snp_selection': False}. Best is trial 50 with value: 0.31796609177250984.
[I 2025-12-09 13:53:38,797] Trial 51 finished with value: 0.31444495153818486 and parameters: {'model_type': 'graphsage', 'hidden_dims': '[512, 64]', 'dropout': 0.48857405358947525, 'batch_norm': True, 'sage_aggr': 'max', 'sage_normalize': False, 'sage_project': False, 'lr': 0.006056991821900928, 'weight_decay': 4.368715200100576e-06, 'epochs': 91, 'loss': 'mse', 'optimizer': 'adam', 'graph_mode': 'cutoff', 'cutoff': 0.8424995832673005, 'grm_norm': 'cosine_then_gcn', 'self_loops': True, 'use_snp_selection': False}. Best is trial 50 with value: 0.31796609177250984.
[I 2025-12-09 13:54:21,410] Trial 52 finished with value: 0.30891872098140716 and parameters: {'model_type': 'graphsage', 'hidden_dims': '[512, 64]', 'dropout': 0.49165810561101436, 'batch_norm': True, 'sage_aggr': 'max', 'sage_normalize': False, 'sage_project': False, 'lr': 0.006370356365241212, 'weight_decay': 4.966171481628436e-06, 'epochs': 75, 'loss': 'mse', 'optimizer': 'adam', 'graph_mode': 'cutoff', 'cutoff': 0.8398259553154045, 'grm_norm': 'cosine_then_gcn', 'self_loops': True, 'use_snp_selection': False}. Best is trial 50 with value: 0.31796609177250984.
[I 2025-12-09 13:55:10,129] Trial 53 finished with value: 0.3135459174480432 and parameters: {'model_type': 'graphsage', 'hidden_dims': '[512, 64]', 'dropout': 0.47745114534157085, 'batch_norm': True, 'sage_aggr': 'max', 'sage_normalize': False, 'sage_project': False, 'lr': 0.005665376203106797, 'weight_decay': 1.1650974623489807e-05, 'epochs': 87, 'loss': 'mse', 'optimizer': 'adam', 'graph_mode': 'cutoff', 'cutoff': 0.7752561306514908, 'grm_norm': 'cosine_then_gcn', 'self_loops': True, 'use_snp_selection': False}. Best is trial 50 with value: 0.31796609177250984.
[I 2025-12-09 13:55:58,381] Trial 54 finished with value: 0.28642784031692065 and parameters: {'model_type': 'graphsage', 'hidden_dims': '[512, 64]', 'dropout': 0.475274879332613, 'batch_norm': True, 'sage_aggr': 'max', 'sage_normalize': False, 'sage_project': False, 'lr': 3.465010786392697e-05, 'weight_decay': 1.2234061994903213e-06, 'epochs': 86, 'loss': 'mse', 'optimizer': 'adam', 'graph_mode': 'cutoff', 'cutoff': 0.7761790609088646, 'grm_norm': 'cosine_then_gcn', 'self_loops': True, 'use_snp_selection': False}. Best is trial 50 with value: 0.31796609177250984.
[I 2025-12-09 13:56:50,190] Trial 55 finished with value: 0.3142796562411677 and parameters: {'model_type': 'graphsage', 'hidden_dims': '[512, 64]', 'dropout': 0.5000243866627881, 'batch_norm': True, 'sage_aggr': 'max', 'sage_normalize': False, 'sage_project': False, 'lr': 0.007309148983027639, 'weight_decay': 1.1549616589651413e-05, 'epochs': 93, 'loss': 'mse', 'optimizer': 'adam', 'graph_mode': 'cutoff', 'cutoff': 0.7042355182508445, 'grm_norm': 'cosine', 'self_loops': True, 'use_snp_selection': False}. Best is trial 50 with value: 0.31796609177250984.
[I 2025-12-09 13:57:26,217] Trial 56 finished with value: 0.3145021287454944 and parameters: {'model_type': 'graphsage', 'hidden_dims': '[512, 64]', 'dropout': 0.5011872526374951, 'batch_norm': True, 'sage_aggr': 'max', 'sage_normalize': False, 'sage_project': False, 'lr': 0.009233123400397647, 'weight_decay': 4.820155773643814e-06, 'epochs': 62, 'loss': 'mse', 'optimizer': 'adam', 'graph_mode': 'cutoff', 'cutoff': 0.7046889676280617, 'grm_norm': 'cosine', 'self_loops': True, 'use_snp_selection': False}. Best is trial 50 with value: 0.31796609177250984.
[I 2025-12-09 13:57:58,803] Trial 57 finished with value: 0.3129852275515319 and parameters: {'model_type': 'graphsage', 'hidden_dims': '[512, 64]', 'dropout': 0.5725082705626304, 'batch_norm': True, 'sage_aggr': 'max', 'sage_normalize': False, 'sage_project': False, 'lr': 0.008442935401444047, 'weight_decay': 4.496720122688965e-06, 'epochs': 55, 'loss': 'mse', 'optimizer': 'adam', 'graph_mode': 'cutoff', 'cutoff': 0.6329760431202884, 'grm_norm': 'cosine', 'self_loops': False, 'use_snp_selection': False}. Best is trial 50 with value: 0.31796609177250984.
[I 2025-12-09 13:59:03,831] Trial 58 finished with value: 0.0 and parameters: {'model_type': 'graphsage', 'hidden_dims': '[512, 64]', 'dropout': 0.5230927049860815, 'batch_norm': False, 'sage_aggr': 'max', 'sage_normalize': False, 'sage_project': False, 'lr': 0.009869652194599282, 'weight_decay': 1.8942348770718284e-06, 'epochs': 119, 'loss': 'mse', 'optimizer': 'adam', 'graph_mode': 'cutoff', 'cutoff': 0.7047221869426645, 'grm_norm': 'cosine', 'self_loops': True, 'use_snp_selection': False}. Best is trial 50 with value: 0.31796609177250984.
[I 2025-12-09 13:59:43,985] Trial 59 finished with value: 0.3103468736657648 and parameters: {'model_type': 'graphsage', 'hidden_dims': '[512, 64]', 'dropout': 0.5541049920368676, 'batch_norm': True, 'sage_aggr': 'max', 'sage_normalize': False, 'sage_project': False, 'lr': 0.00735804189611626, 'weight_decay': 7.547105741782007e-06, 'epochs': 70, 'loss': 'mse', 'optimizer': 'adam', 'graph_mode': 'cutoff', 'cutoff': 0.6558003997827344, 'grm_norm': 'cosine', 'self_loops': True, 'use_snp_selection': False}. Best is trial 50 with value: 0.31796609177250984.
[I 2025-12-09 14:00:02,817] Trial 60 finished with value: 0.30552364402147464 and parameters: {'model_type': 'graphsage', 'hidden_dims': '[256, 128, 64]', 'dropout': 0.49136785247909687, 'batch_norm': True, 'sage_aggr': 'mean', 'sage_normalize': False, 'sage_project': False, 'lr': 0.00497852040843402, 'weight_decay': 3.8536658041443955e-06, 'epochs': 57, 'loss': 'mse', 'optimizer': 'adam', 'graph_mode': 'cutoff', 'cutoff': 0.7504650846477542, 'grm_norm': 'cosine', 'self_loops': True, 'use_snp_selection': False}. Best is trial 50 with value: 0.31796609177250984.
[I 2025-12-09 14:00:55,225] Trial 61 finished with value: 0.30842960278848525 and parameters: {'model_type': 'graphsage', 'hidden_dims': '[512, 64]', 'dropout': 0.4583710162540373, 'batch_norm': True, 'sage_aggr': 'max', 'sage_normalize': False, 'sage_project': False, 'lr': 0.0071704029470468994, 'weight_decay': 2.4670256246407047e-05, 'epochs': 93, 'loss': 'mse', 'optimizer': 'adam', 'graph_mode': 'cutoff', 'cutoff': 0.6127103443077002, 'grm_norm': 'cosine', 'self_loops': True, 'use_snp_selection': False}. Best is trial 50 with value: 0.31796609177250984.
[I 2025-12-09 14:02:44,457] Trial 62 finished with value: 0.272334524199215 and parameters: {'model_type': 'graphsage', 'hidden_dims': '[512, 64]', 'dropout': 0.5016684725976506, 'batch_norm': True, 'sage_aggr': 'max', 'sage_normalize': False, 'sage_project': False, 'lr': 0.0039398055107074895, 'weight_decay': 1.9480290196155517e-05, 'epochs': 102, 'loss': 'mse', 'optimizer': 'adam', 'graph_mode': 'cutoff', 'cutoff': 0.25167960439948406, 'grm_norm': 'cosine', 'self_loops': True, 'use_snp_selection': False}. Best is trial 50 with value: 0.31796609177250984.
[I 2025-12-09 14:03:27,445] Trial 63 finished with value: 0.30615942424690096 and parameters: {'model_type': 'graphsage', 'hidden_dims': '[512, 64]', 'dropout': 0.5327231100821634, 'batch_norm': True, 'sage_aggr': 'max', 'sage_normalize': False, 'sage_project': False, 'lr': 0.00557413107337538, 'weight_decay': 1.464969460104399e-05, 'epochs': 76, 'loss': 'mse', 'optimizer': 'adam', 'graph_mode': 'cutoff', 'cutoff': 0.8422438378636846, 'grm_norm': 'none', 'self_loops': True, 'use_snp_selection': False}. Best is trial 50 with value: 0.31796609177250984.
[I 2025-12-09 14:04:18,224] Trial 64 finished with value: 0.31302909755336217 and parameters: {'model_type': 'graphsage', 'hidden_dims': '[512, 64]', 'dropout': 0.41742858680480555, 'batch_norm': True, 'sage_aggr': 'max', 'sage_normalize': False, 'sage_project': False, 'lr': 0.0021316185174111092, 'weight_decay': 4.3927088591111865e-05, 'epochs': 91, 'loss': 'mse', 'optimizer': 'adam', 'graph_mode': 'cutoff', 'cutoff': 0.7238130419558888, 'grm_norm': 'cosine', 'self_loops': True, 'use_snp_selection': False}. Best is trial 50 with value: 0.31796609177250984.
[I 2025-12-09 14:04:51,249] Trial 65 finished with value: 0.30689723225208365 and parameters: {'model_type': 'graphsage', 'hidden_dims': '[512, 64]', 'dropout': 0.4702457030468187, 'batch_norm': True, 'sage_aggr': 'max', 'sage_normalize': False, 'sage_project': False, 'lr': 0.003214195095358473, 'weight_decay': 9.028989144370484e-06, 'epochs': 56, 'loss': 'mse', 'optimizer': 'adam', 'graph_mode': 'cutoff', 'cutoff': 0.688972607481977, 'grm_norm': 'none', 'self_loops': True, 'use_snp_selection': False}. Best is trial 50 with value: 0.31796609177250984.
[I 2025-12-09 14:05:53,670] Trial 66 finished with value: 0.2911785481839531 and parameters: {'model_type': 'graphsage', 'hidden_dims': '[512, 64]', 'dropout': 0.10970737880322579, 'batch_norm': True, 'sage_aggr': 'max', 'sage_normalize': False, 'sage_project': False, 'lr': 0.00788391597932929, 'weight_decay': 5.966033704185222e-06, 'epochs': 109, 'loss': 'mse', 'optimizer': 'adam', 'graph_mode': 'cutoff', 'cutoff': 0.5455973771256821, 'grm_norm': 'cosine', 'self_loops': True, 'use_snp_selection': False}. Best is trial 50 with value: 0.31796609177250984.
[I 2025-12-09 14:06:09,479] Trial 67 finished with value: 0.3080153090303616 and parameters: {'model_type': 'graphsage', 'hidden_dims': '[128, 64]', 'dropout': 0.46074438223476605, 'batch_norm': True, 'sage_aggr': 'max', 'sage_normalize': True, 'sage_project': False, 'lr': 0.0042633355229774825, 'weight_decay': 1.6542129994852046e-06, 'epochs': 80, 'loss': 'mse', 'optimizer': 'adam', 'graph_mode': 'cutoff', 'cutoff': 0.7600733328699059, 'grm_norm': 'cosine_then_gcn', 'self_loops': True, 'use_snp_selection': False}. Best is trial 50 with value: 0.31796609177250984.
[I 2025-12-09 14:07:21,926] Trial 68 finished with value: 0.2679658948398296 and parameters: {'model_type': 'graphsage', 'hidden_dims': '[512, 64]', 'dropout': 0.49920677695302823, 'batch_norm': True, 'sage_aggr': 'max', 'sage_normalize': False, 'sage_project': False, 'lr': 0.006266136372055317, 'weight_decay': 6.300077631031955e-07, 'epochs': 103, 'loss': 'mae', 'optimizer': 'adam', 'graph_mode': 'knn', 'knn_k': 5, 'weighted_edges': True, 'symmetrize_mode': 'mutual', 'self_loops': True, 'use_snp_selection': False}. Best is trial 50 with value: 0.31796609177250984.
[I 2025-12-09 14:10:00,022] Trial 69 finished with value: 0.3142609252674457 and parameters: {'model_type': 'graphsage', 'hidden_dims': '[512, 64]', 'dropout': 0.40052145344547596, 'batch_norm': True, 'sage_aggr': 'max', 'sage_normalize': False, 'sage_project': False, 'lr': 0.009724334042310906, 'weight_decay': 3.017448934920806e-05, 'epochs': 302, 'loss': 'mse', 'optimizer': 'adam', 'graph_mode': 'cutoff', 'cutoff': 0.8027650848606164, 'grm_norm': 'cosine_then_gcn', 'self_loops': True, 'use_snp_selection': False}. Best is trial 50 with value: 0.31796609177250984.
[I 2025-12-09 14:10:37,004] Trial 70 finished with value: 0.0 and parameters: {'model_type': 'graphsage', 'hidden_dims': '[256, 128, 64]', 'dropout': 0.39660989223202675, 'batch_norm': False, 'sage_aggr': 'max', 'sage_normalize': False, 'sage_project': False, 'lr': 0.009650710652489597, 'weight_decay': 1.2148794740597716e-05, 'epochs': 344, 'loss': 'mse', 'optimizer': 'adam', 'graph_mode': 'cutoff', 'cutoff': 0.8055064551924271, 'grm_norm': 'cosine', 'self_loops': False, 'use_snp_selection': True, 'num_snps': 15839}. Best is trial 50 with value: 0.31796609177250984.
[I 2025-12-09 14:13:19,771] Trial 71 finished with value: 0.31004130465601426 and parameters: {'model_type': 'graphsage', 'hidden_dims': '[512, 64]', 'dropout': 0.42483746693016283, 'batch_norm': True, 'sage_aggr': 'max', 'sage_normalize': False, 'sage_project': False, 'lr': 0.004996045032770118, 'weight_decay': 2.7981581920873845e-05, 'epochs': 311, 'loss': 'mse', 'optimizer': 'adam', 'graph_mode': 'cutoff', 'cutoff': 0.8320549218602473, 'grm_norm': 'cosine_then_gcn', 'self_loops': True, 'use_snp_selection': False}. Best is trial 50 with value: 0.31796609177250984.
[I 2025-12-09 14:16:09,074] Trial 72 finished with value: 0.3111687239141183 and parameters: {'model_type': 'graphsage', 'hidden_dims': '[512, 64]', 'dropout': 0.4521161123863936, 'batch_norm': True, 'sage_aggr': 'max', 'sage_normalize': False, 'sage_project': False, 'lr': 0.00793841883792111, 'weight_decay': 4.0211201320508704e-05, 'epochs': 324, 'loss': 'mse', 'optimizer': 'adam', 'graph_mode': 'cutoff', 'cutoff': 0.7904832106978632, 'grm_norm': 'cosine_then_gcn', 'self_loops': True, 'use_snp_selection': False}. Best is trial 50 with value: 0.31796609177250984.
[I 2025-12-09 14:18:20,447] Trial 73 finished with value: 0.30988985944027997 and parameters: {'model_type': 'graphsage', 'hidden_dims': '[512, 128]', 'dropout': 0.40926354849775776, 'batch_norm': True, 'sage_aggr': 'max', 'sage_normalize': False, 'sage_project': False, 'lr': 0.006169760689676007, 'weight_decay': 1.6207549150932236e-05, 'epochs': 249, 'loss': 'mse', 'optimizer': 'adam', 'graph_mode': 'cutoff', 'cutoff': 0.8703467812689847, 'grm_norm': 'cosine_then_gcn', 'self_loops': True, 'use_snp_selection': False}. Best is trial 50 with value: 0.31796609177250984.
[I 2025-12-09 14:20:14,803] Trial 74 finished with value: 0.3153667957383532 and parameters: {'model_type': 'graphsage', 'hidden_dims': '[512, 64]', 'dropout': 0.46629362174304007, 'batch_norm': True, 'sage_aggr': 'max', 'sage_normalize': False, 'sage_project': False, 'lr': 0.003760202114220039, 'weight_decay': 5.268981341784196e-05, 'epochs': 216, 'loss': 'mse', 'optimizer': 'adam', 'graph_mode': 'cutoff', 'cutoff': 0.8226522087831898, 'grm_norm': 'cosine_then_gcn', 'self_loops': True, 'use_snp_selection': False}. Best is trial 50 with value: 0.31796609177250984.
[I 2025-12-09 14:22:10,209] Trial 75 finished with value: 0.3099593563618034 and parameters: {'model_type': 'graphsage', 'hidden_dims': '[512, 64]', 'dropout': 0.39095441612190585, 'batch_norm': True, 'sage_aggr': 'max', 'sage_normalize': False, 'sage_project': False, 'lr': 0.003490336799731472, 'weight_decay': 5.144067103933069e-05, 'epochs': 218, 'loss': 'mse', 'optimizer': 'adam', 'graph_mode': 'cutoff', 'cutoff': 0.7382418277451094, 'grm_norm': 'cosine_then_gcn', 'self_loops': True, 'use_snp_selection': False}. Best is trial 50 with value: 0.31796609177250984.
[I 2025-12-09 14:24:48,296] Trial 76 finished with value: 0.3145346657414264 and parameters: {'model_type': 'graphsage', 'hidden_dims': '[512, 64]', 'dropout': 0.5397802118645905, 'batch_norm': True, 'sage_aggr': 'max', 'sage_normalize': False, 'sage_project': False, 'lr': 0.004965286514697155, 'weight_decay': 3.392688555712699e-06, 'epochs': 302, 'loss': 'mse', 'optimizer': 'adam', 'graph_mode': 'cutoff', 'cutoff': 0.8178095722893739, 'grm_norm': 'cosine_then_gcn', 'self_loops': True, 'use_snp_selection': False}. Best is trial 50 with value: 0.31796609177250984.
[I 2025-12-09 14:27:21,330] Trial 77 finished with value: 0.31234253369294074 and parameters: {'model_type': 'graphsage', 'hidden_dims': '[512, 64]', 'dropout': 0.5460418117235881, 'batch_norm': True, 'sage_aggr': 'max', 'sage_normalize': False, 'sage_project': False, 'lr': 0.0047610720202024785, 'weight_decay': 3.0467860250176503e-06, 'epochs': 292, 'loss': 'mse', 'optimizer': 'adam', 'graph_mode': 'cutoff', 'cutoff': 0.8259649911684395, 'grm_norm': 'none', 'self_loops': True, 'use_snp_selection': False}. Best is trial 50 with value: 0.31796609177250984.
[I 2025-12-09 14:28:11,669] Trial 78 finished with value: 0.3069968291292972 and parameters: {'model_type': 'graphsage', 'hidden_dims': '[128, 64]', 'dropout': 0.5828839066652202, 'batch_norm': True, 'sage_aggr': 'mean', 'sage_normalize': False, 'sage_project': False, 'lr': 0.008322325340653053, 'weight_decay': 1.1859833613006497e-06, 'epochs': 281, 'loss': 'mse', 'optimizer': 'adam', 'graph_mode': 'cutoff', 'cutoff': 0.814471445501027, 'grm_norm': 'cosine_then_gcn', 'self_loops': True, 'use_snp_selection': False}. Best is trial 50 with value: 0.31796609177250984.
[I 2025-12-09 14:30:31,610] Trial 79 finished with value: 0.2903612072711143 and parameters: {'model_type': 'graphsage', 'hidden_dims': '[512, 64]', 'dropout': 0.5182942044535501, 'batch_norm': True, 'sage_aggr': 'max', 'sage_normalize': False, 'sage_project': False, 'lr': 9.229544830849834e-05, 'weight_decay': 5.712748859669626e-06, 'epochs': 266, 'loss': 'mse', 'optimizer': 'adam', 'graph_mode': 'cutoff', 'cutoff': 0.7659985850603427, 'grm_norm': 'gcn', 'self_loops': True, 'use_snp_selection': False}. Best is trial 50 with value: 0.31796609177250984.
[I 2025-12-09 14:33:16,172] Trial 80 finished with value: 0.2749406240728473 and parameters: {'model_type': 'graphsage', 'hidden_dims': '[512, 64]', 'dropout': 0.5282977190116412, 'batch_norm': True, 'sage_aggr': 'max', 'sage_normalize': True, 'sage_project': False, 'lr': 0.009932334929170882, 'weight_decay': 1.845538713455922e-05, 'epochs': 301, 'loss': 'mae', 'optimizer': 'adam', 'graph_mode': 'knn', 'knn_k': 1, 'weighted_edges': True, 'symmetrize_mode': 'mutual', 'self_loops': True, 'use_snp_selection': False}. Best is trial 50 with value: 0.31796609177250984.
