[I 2025-12-05 22:28:03,426] Trial 11 finished with value: 0.18642276848836242 and parameters: {'model_type': 'graphsage', 'hidden_dims': '[256, 128, 64]', 'dropout': 0.43792734467159944, 'batch_norm': True, 'sage_aggr': 'mean', 'sage_normalize': False, 'sage_project': False, 'lr': 0.00039339919849228907, 'weight_decay': 1.6627269565976914e-06, 'epochs': 44, 'loss': 'mse', 'optimizer': 'adam', 'graph_mode': 'cutoff', 'cutoff': 0.8674357119417975, 'grm_norm': 'none', 'self_loops': False, 'use_snp_selection': False, 'graphsage_batch_size': 32}. Best is trial 5 with value: 0.19977169108788465.
[I 2025-12-05 22:28:23,787] Trial 12 finished with value: 0.187921874909761 and parameters: {'model_type': 'graphsage', 'hidden_dims': '[256, 128, 64]', 'dropout': 0.4722141150575662, 'batch_norm': True, 'sage_aggr': 'mean', 'sage_normalize': True, 'sage_project': False, 'lr': 0.00015917521200452755, 'weight_decay': 2.1371376075456425e-06, 'epochs': 41, 'loss': 'mae', 'optimizer': 'adam', 'graph_mode': 'cutoff', 'cutoff': 0.8992422261739597, 'grm_norm': 'none', 'self_loops': False, 'use_snp_selection': False, 'graphsage_batch_size': 32}. Best is trial 5 with value: 0.19977169108788465.
[I 2025-12-05 22:29:11,317] Trial 13 finished with value: 0.18943144547389906 and parameters: {'model_type': 'graphsage', 'hidden_dims': '[256, 128, 64]', 'dropout': 0.48177467097578114, 'batch_norm': True, 'sage_aggr': 'mean', 'sage_normalize': True, 'sage_project': False, 'lr': 0.00011232971989533325, 'weight_decay': 3.918227309741153e-05, 'epochs': 127, 'loss': 'mae', 'optimizer': 'adam', 'graph_mode': 'cutoff', 'cutoff': 0.8835877295168457, 'grm_norm': 'none', 'self_loops': False, 'use_snp_selection': False, 'graphsage_batch_size': 16}. Best is trial 5 with value: 0.19977169108788465.
[I 2025-12-05 22:29:33,958] Trial 14 finished with value: 0.20520855480653294 and parameters: {'model_type': 'graphsage', 'hidden_dims': '[256, 128, 64]', 'dropout': 0.5039660351495283, 'batch_norm': True, 'sage_aggr': 'mean', 'sage_normalize': True, 'sage_project': False, 'lr': 0.00010484496001290993, 'weight_decay': 3.820635563016361e-05, 'epochs': 133, 'loss': 'mae', 'optimizer': 'adam', 'graph_mode': 'cutoff', 'cutoff': 0.5884928680163001, 'grm_norm': 'cosine', 'self_loops': False, 'use_snp_selection': True, 'num_snps': 8326, 'graphsage_batch_size': 16}. Best is trial 14 with value: 0.20520855480653294.
[I 2025-12-05 22:29:52,093] Trial 15 finished with value: 0.15475528164846453 and parameters: {'model_type': 'graphsage', 'hidden_dims': '[128, 64]', 'dropout': 0.5415431027488957, 'batch_norm': True, 'sage_aggr': 'mean', 'sage_normalize': True, 'sage_project': False, 'lr': 0.00011302911078184568, 'weight_decay': 4.132270106730111e-05, 'epochs': 160, 'loss': 'mae', 'optimizer': 'adam', 'graph_mode': 'cutoff', 'cutoff': 0.5504994848138167, 'grm_norm': 'cosine', 'self_loops': False, 'use_snp_selection': True, 'num_snps': 4243, 'graphsage_batch_size': 16}. Best is trial 14 with value: 0.20520855480653294.
[I 2025-12-05 22:30:39,470] Trial 16 finished with value: 0.21767367515912256 and parameters: {'model_type': 'graphsage', 'hidden_dims': '[512, 256]', 'dropout': 0.33962125160383283, 'batch_norm': True, 'sage_aggr': 'mean', 'sage_normalize': True, 'sage_project': False, 'lr': 5.5811666422274364e-05, 'weight_decay': 0.0008423882627352312, 'epochs': 191, 'loss': 'mae', 'optimizer': 'adam', 'graph_mode': 'cutoff', 'cutoff': 0.5672973282177872, 'grm_norm': 'cosine', 'self_loops': False, 'use_snp_selection': True, 'num_snps': 17200, 'graphsage_batch_size': 64}. Best is trial 16 with value: 0.21767367515912256.
[I 2025-12-05 22:31:34,023] Trial 17 finished with value: 0.2055913735191588 and parameters: {'model_type': 'graphsage', 'hidden_dims': '[512, 256]', 'dropout': 0.5184091962274652, 'batch_norm': True, 'sage_aggr': 'mean', 'sage_normalize': True, 'sage_project': False, 'lr': 2.2465963456090454e-05, 'weight_decay': 0.0007805871620966975, 'epochs': 197, 'loss': 'mae', 'optimizer': 'adam', 'graph_mode': 'cutoff', 'cutoff': 0.6048093847457465, 'grm_norm': 'cosine', 'self_loops': False, 'use_snp_selection': True, 'num_snps': 20481, 'graphsage_batch_size': 64}. Best is trial 16 with value: 0.21767367515912256.
[I 2025-12-05 22:32:36,943] Trial 18 finished with value: 0.20127387993187407 and parameters: {'model_type': 'graphsage', 'hidden_dims': '[512, 256]', 'dropout': 0.31843111750074155, 'batch_norm': True, 'sage_aggr': 'mean', 'sage_normalize': True, 'sage_project': False, 'lr': 2.0462901478260636e-05, 'weight_decay': 0.0008286542138371042, 'epochs': 196, 'loss': 'mae', 'optimizer': 'adam', 'graph_mode': 'cutoff', 'cutoff': 0.6816195334510146, 'grm_norm': 'cosine', 'self_loops': False, 'use_snp_selection': True, 'num_snps': 24491, 'graphsage_batch_size': 64}. Best is trial 16 with value: 0.21767367515912256.
[I 2025-12-05 22:33:37,159] Trial 19 finished with value: 0.20814634199243082 and parameters: {'model_type': 'graphsage', 'hidden_dims': '[512, 256]', 'dropout': 0.4257574712320197, 'batch_norm': True, 'sage_aggr': 'mean', 'sage_normalize': True, 'sage_project': False, 'lr': 1.6938233354529462e-05, 'weight_decay': 0.00024776793463240926, 'epochs': 189, 'loss': 'mae', 'optimizer': 'adam', 'graph_mode': 'cutoff', 'cutoff': 0.42072353803585416, 'grm_norm': 'cosine', 'self_loops': False, 'use_snp_selection': True, 'num_snps': 19762, 'graphsage_batch_size': 64}. Best is trial 16 with value: 0.21767367515912256.
[I 2025-12-05 22:34:30,753] Trial 20 finished with value: 0.17568176846230904 and parameters: {'model_type': 'graphsage', 'hidden_dims': '[512, 256]', 'dropout': 0.4274503203533666, 'batch_norm': True, 'sage_aggr': 'mean', 'sage_normalize': True, 'sage_project': False, 'lr': 1.1448841454327765e-05, 'weight_decay': 0.00019869229889604625, 'epochs': 192, 'loss': 'mae', 'optimizer': 'adam', 'graph_mode': 'cutoff', 'cutoff': 0.411321457448354, 'grm_norm': 'cosine', 'self_loops': False, 'use_snp_selection': True, 'num_snps': 16480, 'graphsage_batch_size': 64}. Best is trial 16 with value: 0.21767367515912256.
[I 2025-12-05 22:35:34,824] Trial 21 finished with value: 0.19863166642060437 and parameters: {'model_type': 'graphsage', 'hidden_dims': '[512, 256]', 'dropout': 0.526371945695485, 'batch_norm': True, 'sage_aggr': 'mean', 'sage_normalize': True, 'sage_project': False, 'lr': 2.2408539582921055e-05, 'weight_decay': 0.0008232222156599138, 'epochs': 188, 'loss': 'mae', 'optimizer': 'adam', 'graph_mode': 'cutoff', 'cutoff': 0.4444936513619202, 'grm_norm': 'cosine', 'self_loops': False, 'use_snp_selection': True, 'num_snps': 21787, 'graphsage_batch_size': 64}. Best is trial 16 with value: 0.21767367515912256.
[I 2025-12-05 22:36:24,757] Trial 22 finished with value: 0.21191106053078754 and parameters: {'model_type': 'graphsage', 'hidden_dims': '[512, 256]', 'dropout': 0.4325935314911198, 'batch_norm': True, 'sage_aggr': 'mean', 'sage_normalize': True, 'sage_project': False, 'lr': 5.475532178807485e-05, 'weight_decay': 0.00031707228992941067, 'epochs': 221, 'loss': 'mae', 'optimizer': 'adam', 'graph_mode': 'cutoff', 'cutoff': 0.6707809060907954, 'grm_norm': 'cosine', 'self_loops': False, 'use_snp_selection': True, 'num_snps': 16096, 'graphsage_batch_size': 64}. Best is trial 16 with value: 0.21767367515912256.
[I 2025-12-05 22:37:08,584] Trial 23 finished with value: 0.21933905262061376 and parameters: {'model_type': 'graphsage', 'hidden_dims': '[512, 256]', 'dropout': 0.4358036954394782, 'batch_norm': True, 'sage_aggr': 'mean', 'sage_normalize': True, 'sage_project': False, 'lr': 5.807917199263843e-05, 'weight_decay': 0.0002916588661951472, 'epochs': 232, 'loss': 'mae', 'optimizer': 'adam', 'graph_mode': 'cutoff', 'cutoff': 0.7239352731450901, 'grm_norm': 'cosine', 'self_loops': False, 'use_snp_selection': True, 'num_snps': 12536, 'graphsage_batch_size': 64}. Best is trial 23 with value: 0.21933905262061376.
[I 2025-12-05 22:37:55,212] Trial 24 finished with value: 0.20762846862822984 and parameters: {'model_type': 'graphsage', 'hidden_dims': '[512, 256]', 'dropout': 0.34472639261478755, 'batch_norm': True, 'sage_aggr': 'mean', 'sage_normalize': True, 'sage_project': False, 'lr': 5.509452452048977e-05, 'weight_decay': 7.897357543211113e-05, 'epochs': 246, 'loss': 'mae', 'optimizer': 'adam', 'graph_mode': 'cutoff', 'cutoff': 0.7290487617536903, 'grm_norm': 'gcn', 'self_loops': False, 'use_snp_selection': True, 'num_snps': 13317, 'graphsage_batch_size': 256}. Best is trial 23 with value: 0.21933905262061376.
[I 2025-12-05 22:39:13,018] Trial 25 finished with value: 0.21627803060180165 and parameters: {'model_type': 'graphsage', 'hidden_dims': '[512, 256]', 'dropout': 0.45176834202078875, 'batch_norm': True, 'sage_aggr': 'mean', 'sage_normalize': True, 'sage_project': False, 'lr': 5.986951459840628e-05, 'weight_decay': 0.00039447851088389267, 'epochs': 221, 'loss': 'mae', 'optimizer': 'adam', 'graph_mode': 'cutoff', 'cutoff': 0.7587715285892269, 'grm_norm': 'cosine', 'self_loops': False, 'use_snp_selection': True, 'num_snps': 29237, 'graphsage_batch_size': 512}. Best is trial 23 with value: 0.21933905262061376.
[I 2025-12-05 22:40:35,831] Trial 26 finished with value: 0.20351468470698358 and parameters: {'model_type': 'graphsage', 'hidden_dims': '[512, 256]', 'dropout': 0.21050219379205756, 'batch_norm': False, 'sage_aggr': 'max', 'sage_normalize': True, 'sage_project': False, 'lr': 5.8616903814542985e-05, 'weight_decay': 8.935211876066358e-05, 'epochs': 234, 'loss': 'mae', 'optimizer': 'adam', 'graph_mode': 'cutoff', 'cutoff': 0.7649514934735121, 'grm_norm': 'cosine', 'self_loops': False, 'use_snp_selection': True, 'num_snps': 29688, 'graphsage_batch_size': 512}. Best is trial 23 with value: 0.21933905262061376.
[I 2025-12-05 22:42:14,054] Trial 27 finished with value: 0.2003197428431967 and parameters: {'model_type': 'graphsage', 'hidden_dims': '[512, 256]', 'dropout': 0.30235183385379844, 'batch_norm': True, 'sage_aggr': 'mean', 'sage_normalize': True, 'sage_project': False, 'lr': 0.00026249670842804027, 'weight_decay': 0.0003576084208289669, 'epochs': 211, 'loss': 'mae', 'optimizer': 'adam', 'graph_mode': 'cutoff', 'cutoff': 0.8011867362199124, 'grm_norm': 'cosine', 'self_loops': False, 'use_snp_selection': True, 'num_snps': 39928, 'graphsage_batch_size': 512}. Best is trial 23 with value: 0.21933905262061376.
[I 2025-12-05 22:43:31,222] Trial 28 finished with value: 0.2170573400731383 and parameters: {'model_type': 'graphsage', 'hidden_dims': '[512, 256]', 'dropout': 0.47942937717152145, 'batch_norm': True, 'sage_aggr': 'mean', 'sage_normalize': True, 'sage_project': False, 'lr': 7.185962699727653e-05, 'weight_decay': 8.82237612045281e-05, 'epochs': 237, 'loss': 'mae', 'optimizer': 'adam', 'graph_mode': 'cutoff', 'cutoff': 0.6715265261761375, 'grm_norm': 'gcn', 'self_loops': False, 'use_snp_selection': True, 'num_snps': 27015, 'graphsage_batch_size': 512}. Best is trial 23 with value: 0.21933905262061376.
[I 2025-12-05 22:43:57,907] Trial 29 finished with value: 0.18451372138042982 and parameters: {'model_type': 'graphsage', 'hidden_dims': '[128, 64]', 'dropout': 0.4051933164564707, 'batch_norm': True, 'sage_aggr': 'max', 'sage_normalize': False, 'sage_project': False, 'lr': 0.0002444724557746789, 'weight_decay': 0.00011835273909493079, 'epochs': 239, 'loss': 'mse', 'optimizer': 'adam', 'graph_mode': 'cutoff', 'cutoff': 0.4998235456799104, 'grm_norm': 'gcn', 'self_loops': False, 'use_snp_selection': True, 'num_snps': 9512, 'graphsage_batch_size': 256}. Best is trial 23 with value: 0.21933905262061376.
[I 2025-12-05 22:45:17,530] Trial 30 finished with value: 0.2053983614251976 and parameters: {'model_type': 'graphsage', 'hidden_dims': '[512, 64]', 'dropout': 0.4785079886025678, 'batch_norm': True, 'sage_aggr': 'mean', 'sage_normalize': True, 'sage_project': False, 'lr': 8.894704448640486e-05, 'weight_decay': 0.0005619079604117052, 'epochs': 172, 'loss': 'mae', 'optimizer': 'adam', 'graph_mode': 'cutoff', 'cutoff': 0.6314114825659495, 'grm_norm': 'gcn', 'self_loops': False, 'use_snp_selection': True, 'num_snps': 37245, 'graphsage_batch_size': 512}. Best is trial 23 with value: 0.21933905262061376.
[I 2025-12-05 22:46:31,310] Trial 31 finished with value: 0.2120078595564187 and parameters: {'model_type': 'graphsage', 'hidden_dims': '[512, 256]', 'dropout': 0.46332957854118273, 'batch_norm': True, 'sage_aggr': 'mean', 'sage_normalize': True, 'sage_project': False, 'lr': 4.792114102513604e-05, 'weight_decay': 0.00019473606024641052, 'epochs': 221, 'loss': 'mae', 'optimizer': 'adam', 'graph_mode': 'cutoff', 'cutoff': 0.7124093321405269, 'grm_norm': 'gcn', 'self_loops': False, 'use_snp_selection': True, 'num_snps': 27417, 'graphsage_batch_size': 512}. Best is trial 23 with value: 0.21933905262061376.
[I 2025-12-05 22:48:53,466] Trial 32 finished with value: 0.19559619588356686 and parameters: {'model_type': 'graphsage', 'hidden_dims': '[512, 256]', 'dropout': 0.36175327975332544, 'batch_norm': True, 'sage_aggr': 'mean', 'sage_normalize': True, 'sage_project': False, 'lr': 3.5305248471979084e-05, 'weight_decay': 0.0003306648476510282, 'epochs': 208, 'loss': 'mae', 'optimizer': 'adam', 'graph_mode': 'cutoff', 'cutoff': 0.7978829878963655, 'grm_norm': 'cosine_then_gcn', 'self_loops': False, 'use_snp_selection': True, 'num_snps': 59815, 'graphsage_batch_size': 512}. Best is trial 23 with value: 0.21933905262061376.
[I 2025-12-05 22:50:08,121] Trial 33 finished with value: 0.21165900949040872 and parameters: {'model_type': 'graphsage', 'hidden_dims': '[512, 256]', 'dropout': 0.5530260665395138, 'batch_norm': True, 'sage_aggr': 'mean', 'sage_normalize': True, 'sage_project': False, 'lr': 6.933562966694045e-05, 'weight_decay': 0.0009698416707034285, 'epochs': 231, 'loss': 'mae', 'optimizer': 'adam', 'graph_mode': 'cutoff', 'cutoff': 0.6324053411782317, 'grm_norm': 'cosine', 'self_loops': False, 'use_snp_selection': True, 'num_snps': 26400, 'graphsage_batch_size': 512}. Best is trial 23 with value: 0.21933905262061376.
[I 2025-12-05 22:50:33,808] Trial 34 finished with value: 0.19615578196181455 and parameters: {'model_type': 'graphsage', 'hidden_dims': '[128, 64]', 'dropout': 0.399846007208379, 'batch_norm': True, 'sage_aggr': 'mean', 'sage_normalize': True, 'sage_project': False, 'lr': 4.0977811485725944e-05, 'weight_decay': 6.775801962398765e-05, 'epochs': 250, 'loss': 'mse', 'optimizer': 'adam', 'graph_mode': 'cutoff', 'cutoff': 0.7622312653742314, 'grm_norm': 'gcn', 'self_loops': False, 'use_snp_selection': True, 'num_snps': 11652, 'graphsage_batch_size': 8}. Best is trial 23 with value: 0.21933905262061376.
[I 2025-12-05 22:52:43,074] Trial 35 finished with value: 0.17835816749406397 and parameters: {'model_type': 'graphsage', 'hidden_dims': '[512, 256]', 'dropout': 0.36325300819757506, 'batch_norm': False, 'sage_aggr': 'mean', 'sage_normalize': True, 'sage_project': False, 'lr': 0.0007171669415635541, 'weight_decay': 0.0005351381418493558, 'epochs': 207, 'loss': 'mae', 'optimizer': 'adam', 'graph_mode': 'cutoff', 'cutoff': 0.530635025211779, 'grm_norm': 'cosine', 'self_loops': False, 'use_snp_selection': False, 'graphsage_batch_size': 512}. Best is trial 23 with value: 0.21933905262061376.
[I 2025-12-05 22:53:43,174] Trial 36 finished with value: 0.1705519493223432 and parameters: {'model_type': 'graphsage', 'hidden_dims': '[512, 128]', 'dropout': 0.49505729143066224, 'batch_norm': True, 'sage_aggr': 'max', 'sage_normalize': False, 'sage_project': False, 'lr': 0.00017764507553811256, 'weight_decay': 0.00015552280116449226, 'epochs': 180, 'loss': 'mse', 'optimizer': 'adam', 'graph_mode': 'knn', 'knn_k': 1, 'weighted_edges': False, 'symmetrize_mode': 'union', 'self_loops': False, 'use_snp_selection': True, 'num_snps': 24013, 'graphsage_batch_size': 32}. Best is trial 23 with value: 0.21933905262061376.
[I 2025-12-05 22:54:28,852] Trial 37 finished with value: 0.19265426257280607 and parameters: {'model_type': 'graphsage', 'hidden_dims': '[256, 128]', 'dropout': 0.38583356960214094, 'batch_norm': True, 'sage_aggr': 'mean', 'sage_normalize': True, 'sage_project': False, 'lr': 3.333279995829281e-05, 'weight_decay': 0.00047169003892744295, 'epochs': 150, 'loss': 'mae', 'optimizer': 'adam', 'graph_mode': 'cutoff', 'cutoff': 0.8328244087972966, 'grm_norm': 'cosine', 'self_loops': False, 'use_snp_selection': True, 'num_snps': 32664, 'graphsage_batch_size': 256}. Best is trial 23 with value: 0.21933905262061376.
[I 2025-12-05 22:57:38,489] Trial 38 finished with value: 0.19379874654414458 and parameters: {'model_type': 'graphsage', 'hidden_dims': '[512, 256]', 'dropout': 0.4642051062169797, 'batch_norm': False, 'sage_aggr': 'max', 'sage_normalize': True, 'sage_project': False, 'lr': 8.632312308041617e-05, 'weight_decay': 6.651848813100837e-06, 'epochs': 225, 'loss': 'mae', 'optimizer': 'adam', 'graph_mode': 'knn', 'knn_k': 10, 'weighted_edges': False, 'symmetrize_mode': 'union', 'self_loops': False, 'use_snp_selection': True, 'num_snps': 30129, 'graphsage_batch_size': 512}. Best is trial 23 with value: 0.21933905262061376.
[I 2025-12-05 22:59:59,710] Trial 39 finished with value: 0.18587331463540663 and parameters: {'model_type': 'graphsage', 'hidden_dims': '[512, 64]', 'dropout': 0.21523482601455812, 'batch_norm': True, 'sage_aggr': 'mean', 'sage_normalize': True, 'sage_project': False, 'lr': 1.2854340407847646e-05, 'weight_decay': 2.3265960960527056e-05, 'epochs': 238, 'loss': 'mse', 'optimizer': 'adam', 'graph_mode': 'cutoff', 'cutoff': 0.6866393148516388, 'grm_norm': 'gcn', 'self_loops': False, 'use_snp_selection': False, 'graphsage_batch_size': 64}. Best is trial 23 with value: 0.21933905262061376.
[I 2025-12-05 23:01:04,547] Trial 40 finished with value: 0.18811830574916497 and parameters: {'model_type': 'graphsage', 'hidden_dims': '[256, 128]', 'dropout': 0.24124664026676262, 'batch_norm': True, 'sage_aggr': 'mean', 'sage_normalize': False, 'sage_project': False, 'lr': 2.682923350658425e-05, 'weight_decay': 1.7575495475992277e-05, 'epochs': 215, 'loss': 'mae', 'optimizer': 'adam', 'graph_mode': 'knn', 'knn_k': 1, 'weighted_edges': True, 'symmetrize_mode': 'mutual', 'self_loops': False, 'use_snp_selection': True, 'num_snps': 41379, 'graphsage_batch_size': 8}. Best is trial 23 with value: 0.21933905262061376.
[I 2025-12-05 23:02:18,736] Trial 41 finished with value: 0.21014392999201661 and parameters: {'model_type': 'graphsage', 'hidden_dims': '[512, 256]', 'dropout': 0.44150838817196003, 'batch_norm': True, 'sage_aggr': 'mean', 'sage_normalize': True, 'sage_project': False, 'lr': 4.352072673193434e-05, 'weight_decay': 0.00020116445931537343, 'epochs': 224, 'loss': 'mae', 'optimizer': 'adam', 'graph_mode': 'cutoff', 'cutoff': 0.7137202731780703, 'grm_norm': 'gcn', 'self_loops': False, 'use_snp_selection': True, 'num_snps': 27238, 'graphsage_batch_size': 512}. Best is trial 23 with value: 0.21933905262061376.
[I 2025-12-05 23:03:09,327] Trial 42 finished with value: 0.21737265717718893 and parameters: {'model_type': 'graphsage', 'hidden_dims': '[512, 256]', 'dropout': 0.4483790548219128, 'batch_norm': True, 'sage_aggr': 'mean', 'sage_normalize': True, 'sage_project': False, 'lr': 7.256180477473993e-05, 'weight_decay': 0.00011559708739224758, 'epochs': 202, 'loss': 'mae', 'optimizer': 'adam', 'graph_mode': 'cutoff', 'cutoff': 0.7523232141080312, 'grm_norm': 'gcn', 'self_loops': False, 'use_snp_selection': True, 'num_snps': 18325, 'graphsage_batch_size': 512}. Best is trial 23 with value: 0.21933905262061376.
[I 2025-12-05 23:03:57,860] Trial 43 finished with value: 0.21944118959095055 and parameters: {'model_type': 'graphsage', 'hidden_dims': '[512, 256]', 'dropout': 0.4550648760461638, 'batch_norm': True, 'sage_aggr': 'mean', 'sage_normalize': True, 'sage_project': False, 'lr': 7.435156860835496e-05, 'weight_decay': 6.371200620769931e-05, 'epochs': 205, 'loss': 'mae', 'optimizer': 'adam', 'graph_mode': 'cutoff', 'cutoff': 0.7506531604949911, 'grm_norm': 'gcn', 'self_loops': False, 'use_snp_selection': True, 'num_snps': 16908, 'graphsage_batch_size': 512}. Best is trial 43 with value: 0.21944118959095055.
[I 2025-12-05 23:04:45,867] Trial 44 finished with value: 0.21906912835882425 and parameters: {'model_type': 'graphsage', 'hidden_dims': '[512, 128]', 'dropout': 0.410867826952027, 'batch_norm': True, 'sage_aggr': 'mean', 'sage_normalize': True, 'sage_project': False, 'lr': 0.0001684534624668562, 'weight_decay': 0.00012026381128736639, 'epochs': 206, 'loss': 'mae', 'optimizer': 'adam', 'graph_mode': 'cutoff', 'cutoff': 0.6556996195983774, 'grm_norm': 'gcn', 'self_loops': False, 'use_snp_selection': True, 'num_snps': 16954, 'graphsage_batch_size': 128}. Best is trial 43 with value: 0.21944118959095055.
[I 2025-12-05 23:05:32,434] Trial 45 finished with value: 0.21467167513744306 and parameters: {'model_type': 'graphsage', 'hidden_dims': '[512, 128]', 'dropout': 0.4080743660449117, 'batch_norm': False, 'sage_aggr': 'mean', 'sage_normalize': True, 'sage_project': False, 'lr': 0.00015286067608583258, 'weight_decay': 5.3829383584268355e-05, 'epochs': 202, 'loss': 'mae', 'optimizer': 'adam', 'graph_mode': 'cutoff', 'cutoff': 0.6284976743440532, 'grm_norm': 'gcn', 'self_loops': False, 'use_snp_selection': True, 'num_snps': 16183, 'graphsage_batch_size': 128}. Best is trial 43 with value: 0.21944118959095055.
[I 2025-12-05 23:06:13,481] Trial 46 finished with value: 0.21947898140693073 and parameters: {'model_type': 'graphsage', 'hidden_dims': '[512, 128]', 'dropout': 0.2989768413211691, 'batch_norm': True, 'sage_aggr': 'max', 'sage_normalize': True, 'sage_project': False, 'lr': 0.00023542197361378184, 'weight_decay': 0.0001296028459441081, 'epochs': 182, 'loss': 'mae', 'optimizer': 'adam', 'graph_mode': 'cutoff', 'cutoff': 0.8052711654517315, 'grm_norm': 'cosine_then_gcn', 'self_loops': False, 'use_snp_selection': True, 'num_snps': 14221, 'graphsage_batch_size': 128}. Best is trial 46 with value: 0.21947898140693073.
