[I 2025-12-10 05:51:56,932] Trial 104 finished with value: 0.3002237641163396 and parameters: {'model_type': 'graphsage', 'hidden_dims': '[512, 128]', 'dropout': 0.12388005559097079, 'batch_norm': False, 'sage_aggr': 'max', 'sage_normalize': False, 'sage_project': False, 'lr': 1.4105838622484346e-05, 'weight_decay': 1.5966903655616898e-07, 'epochs': 259, 'loss': 'mse', 'optimizer': 'adam', 'graph_mode': 'cutoff', 'cutoff': 0.4409041978345205, 'grm_norm': 'none', 'self_loops': True, 'use_snp_selection': True, 'num_snps': 6850}. Best is trial 28 with value: 0.30732090388868005.
[I 2025-12-10 05:52:29,318] Trial 105 finished with value: 0.29687831192175607 and parameters: {'model_type': 'graphsage', 'hidden_dims': '[512, 128]', 'dropout': 0.12297186019996678, 'batch_norm': False, 'sage_aggr': 'max', 'sage_normalize': False, 'sage_project': False, 'lr': 1.256363300610138e-05, 'weight_decay': 1.0104782739005751e-07, 'epochs': 252, 'loss': 'mse', 'optimizer': 'adam', 'graph_mode': 'cutoff', 'cutoff': 0.4483795610835129, 'grm_norm': 'none', 'self_loops': True, 'use_snp_selection': True, 'num_snps': 3177}. Best is trial 28 with value: 0.30732090388868005.
[I 2025-12-10 05:53:17,329] Trial 106 finished with value: 0.3021145671447095 and parameters: {'model_type': 'graphsage', 'hidden_dims': '[512, 128]', 'dropout': 0.10178642253932052, 'batch_norm': False, 'sage_aggr': 'mean', 'sage_normalize': False, 'sage_project': False, 'lr': 1.5232533808483416e-05, 'weight_decay': 1.2168549501106918e-07, 'epochs': 235, 'loss': 'mse', 'optimizer': 'adam', 'graph_mode': 'cutoff', 'cutoff': 0.47637048219857564, 'grm_norm': 'none', 'self_loops': True, 'use_snp_selection': True, 'num_snps': 9461}. Best is trial 28 with value: 0.30732090388868005.
[I 2025-12-10 05:54:19,214] Trial 107 finished with value: 0.3107321665790005 and parameters: {'model_type': 'graphsage', 'hidden_dims': '[512, 128]', 'dropout': 0.12936092293283322, 'batch_norm': False, 'sage_aggr': 'max', 'sage_normalize': False, 'sage_project': False, 'lr': 1.2586866393984956e-05, 'weight_decay': 1.761997466095654e-07, 'epochs': 269, 'loss': 'mse', 'optimizer': 'adam', 'graph_mode': 'cutoff', 'cutoff': 0.4204740637636838, 'grm_norm': 'none', 'self_loops': True, 'use_snp_selection': True, 'num_snps': 11339}. Best is trial 107 with value: 0.3107321665790005.
[I 2025-12-10 05:55:15,225] Trial 108 finished with value: 0.24835154006161525 and parameters: {'model_type': 'graphsage', 'hidden_dims': '[512, 128]', 'dropout': 0.12836603144696723, 'batch_norm': True, 'sage_aggr': 'max', 'sage_normalize': False, 'sage_project': False, 'lr': 1.2057355921171543e-05, 'weight_decay': 1.4818596510983556e-07, 'epochs': 212, 'loss': 'mse', 'optimizer': 'adam', 'graph_mode': 'cutoff', 'cutoff': 0.40072063587877477, 'grm_norm': 'none', 'self_loops': True, 'use_snp_selection': True, 'num_snps': 11895}. Best is trial 107 with value: 0.3107321665790005.
[I 2025-12-10 05:56:06,440] Trial 109 finished with value: 0.28090301843816773 and parameters: {'model_type': 'graphsage', 'hidden_dims': '[512, 128]', 'dropout': 0.11588237785776903, 'batch_norm': False, 'sage_aggr': 'max', 'sage_normalize': True, 'sage_project': False, 'lr': 1.4307391828057219e-05, 'weight_decay': 0.0005052058984522897, 'epochs': 267, 'loss': 'mse', 'optimizer': 'adam', 'graph_mode': 'cutoff', 'cutoff': 0.41831021211465735, 'grm_norm': 'cosine', 'self_loops': True, 'use_snp_selection': True, 'num_snps': 8342}. Best is trial 107 with value: 0.3107321665790005.
[I 2025-12-10 05:59:04,697] Trial 110 finished with value: 0.2992144835380358 and parameters: {'model_type': 'graphsage', 'hidden_dims': '[512, 128]', 'dropout': 0.15030761892762437, 'batch_norm': False, 'sage_aggr': 'max', 'sage_normalize': False, 'sage_project': False, 'lr': 1.714971268365428e-05, 'weight_decay': 2.3107480378288468e-07, 'epochs': 250, 'loss': 'mse', 'optimizer': 'adam', 'graph_mode': 'cutoff', 'cutoff': 0.4770685821797722, 'grm_norm': 'cosine_then_gcn', 'self_loops': True, 'use_snp_selection': False}. Best is trial 107 with value: 0.3107321665790005.
[I 2025-12-10 06:00:11,004] Trial 111 finished with value: 0.30516526533125 and parameters: {'model_type': 'graphsage', 'hidden_dims': '[512, 128]', 'dropout': 0.1092643132313297, 'batch_norm': False, 'sage_aggr': 'max', 'sage_normalize': False, 'sage_project': False, 'lr': 1.1360036880373904e-05, 'weight_decay': 1.6996483249842558e-07, 'epochs': 260, 'loss': 'mse', 'optimizer': 'adam', 'graph_mode': 'cutoff', 'cutoff': 0.36911353547196407, 'grm_norm': 'none', 'self_loops': True, 'use_snp_selection': True, 'num_snps': 12254}. Best is trial 107 with value: 0.3107321665790005.
[I 2025-12-10 06:01:17,314] Trial 112 finished with value: 0.3053534533850687 and parameters: {'model_type': 'graphsage', 'hidden_dims': '[512, 128]', 'dropout': 0.11166690919871337, 'batch_norm': False, 'sage_aggr': 'max', 'sage_normalize': False, 'sage_project': False, 'lr': 1.1977419025169278e-05, 'weight_decay': 2.9607049512873204e-07, 'epochs': 258, 'loss': 'mse', 'optimizer': 'adam', 'graph_mode': 'cutoff', 'cutoff': 0.3686855283649856, 'grm_norm': 'none', 'self_loops': True, 'use_snp_selection': True, 'num_snps': 12417}. Best is trial 107 with value: 0.3107321665790005.
[I 2025-12-10 06:01:59,688] Trial 113 finished with value: 0.29652177030777827 and parameters: {'model_type': 'graphsage', 'hidden_dims': '[512, 128]', 'dropout': 0.11665446051952044, 'batch_norm': False, 'sage_aggr': 'max', 'sage_normalize': False, 'sage_project': False, 'lr': 1.3518783794489308e-05, 'weight_decay': 3.23266849917105e-07, 'epochs': 268, 'loss': 'mse', 'optimizer': 'adam', 'graph_mode': 'cutoff', 'cutoff': 0.36331022387405054, 'grm_norm': 'none', 'self_loops': True, 'use_snp_selection': True, 'num_snps': 5361}. Best is trial 107 with value: 0.3107321665790005.
[I 2025-12-10 06:02:59,310] Trial 114 finished with value: 0.29803878405212353 and parameters: {'model_type': 'graphsage', 'hidden_dims': '[512, 128]', 'dropout': 0.13067936794744292, 'batch_norm': False, 'sage_aggr': 'max', 'sage_normalize': False, 'sage_project': False, 'lr': 1.1632818306338685e-05, 'weight_decay': 2.8295320014647533e-07, 'epochs': 233, 'loss': 'mse', 'optimizer': 'adam', 'graph_mode': 'cutoff', 'cutoff': 0.3412538678650629, 'grm_norm': 'none', 'self_loops': True, 'use_snp_selection': True, 'num_snps': 11194}. Best is trial 107 with value: 0.3107321665790005.
[I 2025-12-10 06:03:56,833] Trial 115 finished with value: 0.3097953787151909 and parameters: {'model_type': 'graphsage', 'hidden_dims': '[512, 128]', 'dropout': 0.14832282721474804, 'batch_norm': False, 'sage_aggr': 'max', 'sage_normalize': False, 'sage_project': False, 'lr': 1.0363470017910896e-05, 'weight_decay': 1.2102537362422706e-07, 'epochs': 241, 'loss': 'mse', 'optimizer': 'adam', 'graph_mode': 'cutoff', 'cutoff': 0.38548115096002156, 'grm_norm': 'none', 'self_loops': True, 'use_snp_selection': True, 'num_snps': 10762}. Best is trial 107 with value: 0.3107321665790005.
[I 2025-12-10 06:04:53,221] Trial 116 finished with value: 0.2974830847553657 and parameters: {'model_type': 'graphsage', 'hidden_dims': '[512, 128]', 'dropout': 0.15161982258759713, 'batch_norm': False, 'sage_aggr': 'max', 'sage_normalize': False, 'sage_project': False, 'lr': 1.0437570438101383e-05, 'weight_decay': 1.171741777333974e-07, 'epochs': 240, 'loss': 'mae', 'optimizer': 'adam', 'graph_mode': 'cutoff', 'cutoff': 0.38418827939134903, 'grm_norm': 'none', 'self_loops': True, 'use_snp_selection': True, 'num_snps': 10426}. Best is trial 107 with value: 0.3107321665790005.
[I 2025-12-10 06:05:31,255] Trial 117 finished with value: 0.3095920527581746 and parameters: {'model_type': 'graphsage', 'hidden_dims': '[512, 128]', 'dropout': 0.14573112870463775, 'batch_norm': False, 'sage_aggr': 'max', 'sage_normalize': False, 'sage_project': False, 'lr': 1.2128723793418885e-05, 'weight_decay': 1.4732493331190998e-07, 'epochs': 175, 'loss': 'mse', 'optimizer': 'adam', 'graph_mode': 'cutoff', 'cutoff': 0.44351463331378926, 'grm_norm': 'none', 'self_loops': True, 'use_snp_selection': True, 'num_snps': 6949}. Best is trial 107 with value: 0.3107321665790005.
[I 2025-12-10 06:06:10,670] Trial 118 finished with value: 0.3017945115526722 and parameters: {'model_type': 'graphsage', 'hidden_dims': '[512, 128]', 'dropout': 0.14268979592432085, 'batch_norm': False, 'sage_aggr': 'max', 'sage_normalize': False, 'sage_project': False, 'lr': 1.2427787594542911e-05, 'weight_decay': 1.4903795845665308e-07, 'epochs': 157, 'loss': 'mse', 'optimizer': 'adam', 'graph_mode': 'knn', 'knn_k': 6, 'weighted_edges': False, 'symmetrize_mode': 'mutual', 'self_loops': True, 'use_snp_selection': True, 'num_snps': 7743}. Best is trial 107 with value: 0.3107321665790005.
[I 2025-12-10 06:06:41,751] Trial 119 finished with value: 0.28883754256792854 and parameters: {'model_type': 'graphsage', 'hidden_dims': '[512, 128]', 'dropout': 0.10780530020709135, 'batch_norm': False, 'sage_aggr': 'max', 'sage_normalize': False, 'sage_project': False, 'lr': 1.0348658296677764e-05, 'weight_decay': 1.1610061898284972e-07, 'epochs': 173, 'loss': 'mse', 'optimizer': 'adam', 'graph_mode': 'cutoff', 'cutoff': 0.5193518307175452, 'grm_norm': 'none', 'self_loops': True, 'use_snp_selection': True, 'num_snps': 4848}. Best is trial 107 with value: 0.3107321665790005.
[I 2025-12-10 06:07:19,920] Trial 120 finished with value: 0.29454523590701076 and parameters: {'model_type': 'graphsage', 'hidden_dims': '[512, 128]', 'dropout': 0.1605624613181305, 'batch_norm': False, 'sage_aggr': 'max', 'sage_normalize': False, 'sage_project': False, 'lr': 0.00023497868008710653, 'weight_decay': 1.755335885454454e-07, 'epochs': 203, 'loss': 'mse', 'optimizer': 'adam', 'graph_mode': 'cutoff', 'cutoff': 0.4338654734426367, 'grm_norm': 'none', 'self_loops': True, 'use_snp_selection': True, 'num_snps': 6193}. Best is trial 107 with value: 0.3107321665790005.
[I 2025-12-10 06:08:24,905] Trial 121 finished with value: 0.3029098451251903 and parameters: {'model_type': 'graphsage', 'hidden_dims': '[512, 128]', 'dropout': 0.130928592404604, 'batch_norm': False, 'sage_aggr': 'max', 'sage_normalize': False, 'sage_project': False, 'lr': 1.8238898123504926e-05, 'weight_decay': 1.4389982977861158e-07, 'epochs': 247, 'loss': 'mse', 'optimizer': 'adam', 'graph_mode': 'cutoff', 'cutoff': 0.37966259135909997, 'grm_norm': 'none', 'self_loops': True, 'use_snp_selection': True, 'num_snps': 12844}. Best is trial 107 with value: 0.3107321665790005.
[I 2025-12-10 06:08:54,781] Trial 122 finished with value: 0.29066046064764633 and parameters: {'model_type': 'graphsage', 'hidden_dims': '[512, 128]', 'dropout': 0.17103699369287595, 'batch_norm': False, 'sage_aggr': 'max', 'sage_normalize': False, 'sage_project': False, 'lr': 1.1476082721712858e-05, 'weight_decay': 2.3156021431862587e-07, 'epochs': 255, 'loss': 'mse', 'optimizer': 'adam', 'graph_mode': 'cutoff', 'cutoff': 0.3937252475493319, 'grm_norm': 'none', 'self_loops': True, 'use_snp_selection': True, 'num_snps': 2162}. Best is trial 107 with value: 0.3107321665790005.
[I 2025-12-10 06:09:49,886] Trial 123 finished with value: 0.30431225153128283 and parameters: {'model_type': 'graphsage', 'hidden_dims': '[512, 128]', 'dropout': 0.11218285732540206, 'batch_norm': False, 'sage_aggr': 'max', 'sage_normalize': False, 'sage_project': False, 'lr': 1.319209641317859e-05, 'weight_decay': 3.7378426248565185e-07, 'epochs': 265, 'loss': 'mse', 'optimizer': 'adam', 'graph_mode': 'cutoff', 'cutoff': 0.4536969192894051, 'grm_norm': 'none', 'self_loops': True, 'use_snp_selection': True, 'num_snps': 9761}. Best is trial 107 with value: 0.3107321665790005.
[I 2025-12-10 06:10:22,100] Trial 124 finished with value: 0.29952785353209344 and parameters: {'model_type': 'graphsage', 'hidden_dims': '[512, 128]', 'dropout': 0.14329149353042986, 'batch_norm': False, 'sage_aggr': 'max', 'sage_normalize': False, 'sage_project': False, 'lr': 1.578625617478791e-05, 'weight_decay': 2.790281969954166e-07, 'epochs': 86, 'loss': 'mse', 'optimizer': 'adam', 'graph_mode': 'cutoff', 'cutoff': 0.35589563752658004, 'grm_norm': 'none', 'self_loops': True, 'use_snp_selection': True, 'num_snps': 8178}. Best is trial 107 with value: 0.3107321665790005.
[I 2025-12-10 06:11:05,075] Trial 125 finished with value: 0.307759440238791 and parameters: {'model_type': 'graphsage', 'hidden_dims': '[512, 128]', 'dropout': 0.1204148425562322, 'batch_norm': False, 'sage_aggr': 'max', 'sage_normalize': False, 'sage_project': False, 'lr': 1.0098042623014048e-05, 'weight_decay': 2.014555422395346e-07, 'epochs': 230, 'loss': 'mse', 'optimizer': 'adam', 'graph_mode': 'cutoff', 'cutoff': 0.37224555677623217, 'grm_norm': 'cosine_then_gcn', 'self_loops': True, 'use_snp_selection': True, 'num_snps': 6899}. Best is trial 107 with value: 0.3107321665790005.
[I 2025-12-10 06:11:45,803] Trial 126 finished with value: 0.30285187866780483 and parameters: {'model_type': 'graphsage', 'hidden_dims': '[512, 128]', 'dropout': 0.12003100259202665, 'batch_norm': False, 'sage_aggr': 'max', 'sage_normalize': False, 'sage_project': False, 'lr': 1.0028670930086956e-05, 'weight_decay': 1.8072521583318214e-07, 'epochs': 190, 'loss': 'mse', 'optimizer': 'adam', 'graph_mode': 'cutoff', 'cutoff': 0.3425578601582589, 'grm_norm': 'cosine_then_gcn', 'self_loops': True, 'use_snp_selection': True, 'num_snps': 6961}. Best is trial 107 with value: 0.3107321665790005.
[I 2025-12-10 06:12:35,569] Trial 127 finished with value: 0.2978799429464311 and parameters: {'model_type': 'graphsage', 'hidden_dims': '[512, 128]', 'dropout': 0.1284678678077431, 'batch_norm': False, 'sage_aggr': 'mean', 'sage_normalize': False, 'sage_project': False, 'lr': 1.2280182871367139e-05, 'weight_decay': 1.0165873737086616e-07, 'epochs': 213, 'loss': 'mse', 'optimizer': 'adam', 'graph_mode': 'cutoff', 'cutoff': 0.4962442608666323, 'grm_norm': 'cosine_then_gcn', 'self_loops': True, 'use_snp_selection': True, 'num_snps': 11671}. Best is trial 107 with value: 0.3107321665790005.
[I 2025-12-10 06:13:10,692] Trial 128 finished with value: 0.29659523760391293 and parameters: {'model_type': 'graphsage', 'hidden_dims': '[512, 128]', 'dropout': 0.10065179348177725, 'batch_norm': False, 'sage_aggr': 'max', 'sage_normalize': False, 'sage_project': False, 'lr': 1.2508003865635821e-05, 'weight_decay': 4.7108442972516336e-07, 'epochs': 231, 'loss': 'mse', 'optimizer': 'adam', 'graph_mode': 'cutoff', 'cutoff': 0.32775681304464654, 'grm_norm': 'cosine_then_gcn', 'self_loops': True, 'use_snp_selection': True, 'num_snps': 3849}. Best is trial 107 with value: 0.3107321665790005.
[I 2025-12-10 06:13:58,673] Trial 129 finished with value: 0.3046882023188951 and parameters: {'model_type': 'graphsage', 'hidden_dims': '[512, 128]', 'dropout': 0.14176992186611137, 'batch_norm': False, 'sage_aggr': 'max', 'sage_normalize': False, 'sage_project': False, 'lr': 1.7287322322611553e-05, 'weight_decay': 1.2815822275767376e-07, 'epochs': 182, 'loss': 'mse', 'optimizer': 'adam', 'graph_mode': 'cutoff', 'cutoff': 0.4285654949987246, 'grm_norm': 'cosine_then_gcn', 'self_loops': True, 'use_snp_selection': True, 'num_snps': 10769}. Best is trial 107 with value: 0.3107321665790005.
[I 2025-12-10 06:14:49,672] Trial 130 finished with value: 0.26771593446502495 and parameters: {'model_type': 'graphsage', 'hidden_dims': '[512, 256]', 'dropout': 0.15482491114780964, 'batch_norm': True, 'sage_aggr': 'max', 'sage_normalize': True, 'sage_project': False, 'lr': 1.1394568775903738e-05, 'weight_decay': 1.9880203425037746e-07, 'epochs': 224, 'loss': 'mse', 'optimizer': 'adam', 'graph_mode': 'cutoff', 'cutoff': 0.3717216024279445, 'grm_norm': 'none', 'self_loops': True, 'use_snp_selection': True, 'num_snps': 8945}. Best is trial 107 with value: 0.3107321665790005.
[I 2025-12-10 06:15:20,574] Trial 131 finished with value: 0.2855850649228884 and parameters: {'model_type': 'graphsage', 'hidden_dims': '[128, 64]', 'dropout': 0.16777787401687727, 'batch_norm': False, 'sage_aggr': 'max', 'sage_normalize': False, 'sage_project': False, 'lr': 0.00012556708147890835, 'weight_decay': 2.4907109992843494e-07, 'epochs': 242, 'loss': 'mse', 'optimizer': 'adam', 'graph_mode': 'cutoff', 'cutoff': 0.4717277407097735, 'grm_norm': 'cosine', 'self_loops': True, 'use_snp_selection': True, 'num_snps': 6184}. Best is trial 107 with value: 0.3107321665790005.
[I 2025-12-10 06:16:25,769] Trial 132 finished with value: 0.30115586042563763 and parameters: {'model_type': 'graphsage', 'hidden_dims': '[512, 128]', 'dropout': 0.1114412499063857, 'batch_norm': False, 'sage_aggr': 'max', 'sage_normalize': False, 'sage_project': False, 'lr': 1.927060424170734e-05, 'weight_decay': 1.6023824582882195e-07, 'epochs': 250, 'loss': 'mse', 'optimizer': 'adam', 'graph_mode': 'cutoff', 'cutoff': 0.3924008006896721, 'grm_norm': 'none', 'self_loops': True, 'use_snp_selection': True, 'num_snps': 12899}. Best is trial 107 with value: 0.3107321665790005.
[I 2025-12-10 06:17:24,861] Trial 133 finished with value: 0.30226841108112446 and parameters: {'model_type': 'graphsage', 'hidden_dims': '[512, 128]', 'dropout': 0.13679050819616914, 'batch_norm': False, 'sage_aggr': 'max', 'sage_normalize': False, 'sage_project': False, 'lr': 1.537409039783221e-05, 'weight_decay': 3.384046093261139e-07, 'epochs': 271, 'loss': 'mse', 'optimizer': 'adam', 'graph_mode': 'cutoff', 'cutoff': 0.417246688443447, 'grm_norm': 'none', 'self_loops': True, 'use_snp_selection': True, 'num_snps': 10365}. Best is trial 107 with value: 0.3107321665790005.
[I 2025-12-10 06:18:43,646] Trial 134 finished with value: 0.30224925317456436 and parameters: {'model_type': 'graphsage', 'hidden_dims': '[512, 256]', 'dropout': 0.11433918501938488, 'batch_norm': False, 'sage_aggr': 'max', 'sage_normalize': False, 'sage_project': False, 'lr': 1.0119897771193908e-05, 'weight_decay': 2.0614903296613323e-07, 'epochs': 281, 'loss': 'mse', 'optimizer': 'adam', 'graph_mode': 'cutoff', 'cutoff': 0.36917965477924936, 'grm_norm': 'none', 'self_loops': True, 'use_snp_selection': True, 'num_snps': 14708}. Best is trial 107 with value: 0.3107321665790005.
[I 2025-12-10 06:20:22,636] Trial 135 finished with value: 0.2998363325256483 and parameters: {'model_type': 'graphsage', 'hidden_dims': '[128, 64]', 'dropout': 0.12659919504652314, 'batch_norm': False, 'sage_aggr': 'max', 'sage_normalize': False, 'sage_project': False, 'lr': 1.3523059706309921e-05, 'weight_decay': 2.804129131339738e-07, 'epochs': 262, 'loss': 'mse', 'optimizer': 'adam', 'graph_mode': 'cutoff', 'cutoff': 0.3515065447913185, 'grm_norm': 'cosine_then_gcn', 'self_loops': True, 'use_snp_selection': False}. Best is trial 107 with value: 0.3107321665790005.
[I 2025-12-10 06:21:09,462] Trial 136 finished with value: 0.3074894653895185 and parameters: {'model_type': 'graphsage', 'hidden_dims': '[512, 128]', 'dropout': 0.14904181613194195, 'batch_norm': False, 'sage_aggr': 'max', 'sage_normalize': False, 'sage_project': False, 'lr': 1.5944563867479898e-05, 'weight_decay': 1.397463252439955e-07, 'epochs': 240, 'loss': 'mse', 'optimizer': 'adam', 'graph_mode': 'cutoff', 'cutoff': 0.42695684837549364, 'grm_norm': 'gcn', 'self_loops': True, 'use_snp_selection': True, 'num_snps': 7832}. Best is trial 107 with value: 0.3107321665790005.
[I 2025-12-10 06:21:58,301] Trial 137 finished with value: 0.3086227908925011 and parameters: {'model_type': 'graphsage', 'hidden_dims': '[512, 128]', 'dropout': 0.15473773068096486, 'batch_norm': False, 'sage_aggr': 'max', 'sage_normalize': False, 'sage_project': False, 'lr': 1.1380969272259644e-05, 'weight_decay': 1.373041812838652e-07, 'epochs': 240, 'loss': 'mse', 'optimizer': 'adam', 'graph_mode': 'cutoff', 'cutoff': 0.43429928948293395, 'grm_norm': 'gcn', 'self_loops': True, 'use_snp_selection': True, 'num_snps': 8672}. Best is trial 107 with value: 0.3107321665790005.
[I 2025-12-10 06:22:47,208] Trial 138 finished with value: 0.303808566901016 and parameters: {'model_type': 'graphsage', 'hidden_dims': '[512, 128]', 'dropout': 0.14988596983455005, 'batch_norm': False, 'sage_aggr': 'max', 'sage_normalize': False, 'sage_project': False, 'lr': 1.9046947320610143e-05, 'weight_decay': 1.294347036998973e-07, 'epochs': 236, 'loss': 'mae', 'optimizer': 'adam', 'graph_mode': 'cutoff', 'cutoff': 0.4437785911359412, 'grm_norm': 'gcn', 'self_loops': True, 'use_snp_selection': True, 'num_snps': 8678}. Best is trial 107 with value: 0.3107321665790005.
[I 2025-12-10 06:23:28,227] Trial 139 finished with value: 0.29422327680397864 and parameters: {'model_type': 'graphsage', 'hidden_dims': '[512, 128]', 'dropout': 0.1640474367876683, 'batch_norm': False, 'sage_aggr': 'max', 'sage_normalize': False, 'sage_project': False, 'lr': 1.5672365269748474e-05, 'weight_decay': 1.0230213390435952e-07, 'epochs': 229, 'loss': 'mse', 'optimizer': 'adam', 'graph_mode': 'cutoff', 'cutoff': 0.3144990140187081, 'grm_norm': 'gcn', 'self_loops': True, 'use_snp_selection': True, 'num_snps': 5226}. Best is trial 107 with value: 0.3107321665790005.
[I 2025-12-10 06:24:22,659] Trial 140 finished with value: 0.29596570932693933 and parameters: {'model_type': 'graphsage', 'hidden_dims': '[512, 128]', 'dropout': 0.14108261653576742, 'batch_norm': False, 'sage_aggr': 'max', 'sage_normalize': False, 'sage_project': False, 'lr': 1.1211474932911612e-05, 'weight_decay': 3.1166391180793748e-06, 'epochs': 218, 'loss': 'mse', 'optimizer': 'adam', 'graph_mode': 'knn', 'knn_k': 4, 'weighted_edges': True, 'symmetrize_mode': 'union', 'self_loops': True, 'use_snp_selection': True, 'num_snps': 9690}. Best is trial 107 with value: 0.3107321665790005.
