[I 2025-12-09 04:48:13,939] Trial 71 finished with value: 0.36799045054121055 and parameters: {'model_type': 'graphsage', 'hidden_dims': '[256, 128, 64]', 'dropout': 0.5479311706437516, 'batch_norm': False, 'sage_aggr': 'max', 'sage_normalize': False, 'sage_project': False, 'lr': 1.0151601295736025e-05, 'weight_decay': 7.37648410628911e-05, 'epochs': 253, 'loss': 'mae', 'optimizer': 'adam', 'graph_mode': 'cutoff', 'cutoff': 0.8011545239186604, 'grm_norm': 'cosine_then_gcn', 'self_loops': True, 'use_snp_selection': True, 'num_snps': 57854}. Best is trial 25 with value: 0.37075254988769146.
[I 2025-12-09 04:49:45,124] Trial 72 finished with value: 0.3594616539501121 and parameters: {'model_type': 'graphsage', 'hidden_dims': '[256, 128, 64]', 'dropout': 0.5509802738488717, 'batch_norm': False, 'sage_aggr': 'max', 'sage_normalize': False, 'sage_project': False, 'lr': 1.0036256812229733e-05, 'weight_decay': 7.763736465334264e-05, 'epochs': 262, 'loss': 'mae', 'optimizer': 'adam', 'graph_mode': 'cutoff', 'cutoff': 0.7370918926913215, 'grm_norm': 'cosine_then_gcn', 'self_loops': True, 'use_snp_selection': True, 'num_snps': 55209}. Best is trial 25 with value: 0.37075254988769146.
[I 2025-12-09 04:51:20,077] Trial 73 finished with value: 0.3591024260568517 and parameters: {'model_type': 'graphsage', 'hidden_dims': '[256, 128, 64]', 'dropout': 0.5017506298446593, 'batch_norm': False, 'sage_aggr': 'max', 'sage_normalize': False, 'sage_project': False, 'lr': 1.544401307246162e-05, 'weight_decay': 0.0001018449512312841, 'epochs': 250, 'loss': 'mae', 'optimizer': 'adam', 'graph_mode': 'cutoff', 'cutoff': 0.8360252297440786, 'grm_norm': 'cosine_then_gcn', 'self_loops': True, 'use_snp_selection': True, 'num_snps': 57880}. Best is trial 25 with value: 0.37075254988769146.
[I 2025-12-09 04:52:42,707] Trial 74 finished with value: 0.36092052507686156 and parameters: {'model_type': 'graphsage', 'hidden_dims': '[256, 128, 64]', 'dropout': 0.5838869748453785, 'batch_norm': False, 'sage_aggr': 'max', 'sage_normalize': False, 'sage_project': False, 'lr': 1.2460468238375894e-05, 'weight_decay': 0.00017841437925903805, 'epochs': 237, 'loss': 'mae', 'optimizer': 'adam', 'graph_mode': 'cutoff', 'cutoff': 0.7832213745606721, 'grm_norm': 'cosine_then_gcn', 'self_loops': True, 'use_snp_selection': True, 'num_snps': 52855}. Best is trial 25 with value: 0.37075254988769146.
[I 2025-12-09 04:55:22,457] Trial 75 finished with value: 0.35981815568054665 and parameters: {'model_type': 'graphsage', 'hidden_dims': '[512, 64]', 'dropout': 0.5688810958988633, 'batch_norm': False, 'sage_aggr': 'max', 'sage_normalize': False, 'sage_project': False, 'lr': 1.85415241022416e-05, 'weight_decay': 0.00012928871562601773, 'epochs': 272, 'loss': 'mae', 'optimizer': 'adam', 'graph_mode': 'cutoff', 'cutoff': 0.8129557168468509, 'grm_norm': 'cosine_then_gcn', 'self_loops': True, 'use_snp_selection': True, 'num_snps': 59997}. Best is trial 25 with value: 0.37075254988769146.
[I 2025-12-09 04:57:57,682] Trial 76 finished with value: 0.3520656001057567 and parameters: {'model_type': 'graphsage', 'hidden_dims': '[512, 128]', 'dropout': 0.546054016762408, 'batch_norm': False, 'sage_aggr': 'mean', 'sage_normalize': False, 'sage_project': False, 'lr': 2.4899989451927563e-05, 'weight_decay': 3.520230250153266e-05, 'epochs': 290, 'loss': 'mae', 'optimizer': 'adam', 'graph_mode': 'cutoff', 'cutoff': 0.7085762318861257, 'grm_norm': 'cosine_then_gcn', 'self_loops': True, 'use_snp_selection': True, 'num_snps': 55759}. Best is trial 25 with value: 0.37075254988769146.
[I 2025-12-09 04:58:32,688] Trial 77 finished with value: 0.3054184915991226 and parameters: {'model_type': 'graphsage', 'hidden_dims': '[128, 64]', 'dropout': 0.2874510071648959, 'batch_norm': True, 'sage_aggr': 'max', 'sage_normalize': True, 'sage_project': False, 'lr': 0.0012122846614184388, 'weight_decay': 6.215224208763817e-05, 'epochs': 130, 'loss': 'mae', 'optimizer': 'adam', 'graph_mode': 'cutoff', 'cutoff': 0.8831547092305715, 'grm_norm': 'cosine_then_gcn', 'self_loops': False, 'use_snp_selection': True, 'num_snps': 46894}. Best is trial 25 with value: 0.37075254988769146.
[I 2025-12-09 04:59:44,470] Trial 78 finished with value: 0.3603330469510846 and parameters: {'model_type': 'graphsage', 'hidden_dims': '[256, 128, 64]', 'dropout': 0.5101859491520054, 'batch_norm': False, 'sage_aggr': 'max', 'sage_normalize': False, 'sage_project': False, 'lr': 1.20878600468703e-05, 'weight_decay': 1.9442983342202622e-05, 'epochs': 248, 'loss': 'mae', 'optimizer': 'adam', 'graph_mode': 'cutoff', 'cutoff': 0.7448402966058625, 'grm_norm': 'cosine', 'self_loops': True, 'use_snp_selection': False}. Best is trial 25 with value: 0.37075254988769146.
[I 2025-12-09 05:01:37,169] Trial 79 finished with value: 0.3636218021645046 and parameters: {'model_type': 'graphsage', 'hidden_dims': '[512, 128]', 'dropout': 0.48768129869903026, 'batch_norm': False, 'sage_aggr': 'max', 'sage_normalize': False, 'sage_project': False, 'lr': 1.5004699946279777e-05, 'weight_decay': 2.0331659322074714e-07, 'epochs': 220, 'loss': 'mae', 'optimizer': 'adam', 'graph_mode': 'cutoff', 'cutoff': 0.8266301596214227, 'grm_norm': 'cosine_then_gcn', 'self_loops': True, 'use_snp_selection': True, 'num_snps': 50714}. Best is trial 25 with value: 0.37075254988769146.
[I 2025-12-09 05:05:09,450] Trial 80 finished with value: 0.32685425246591654 and parameters: {'model_type': 'graphsage', 'hidden_dims': '[256, 128]', 'dropout': 0.5284928312753441, 'batch_norm': False, 'sage_aggr': 'max', 'sage_normalize': False, 'sage_project': False, 'lr': 2.162367411305103e-05, 'weight_decay': 0.0003168383219615889, 'epochs': 283, 'loss': 'mae', 'optimizer': 'adam', 'graph_mode': 'knn', 'knn_k': 5, 'weighted_edges': True, 'symmetrize_mode': 'mutual', 'self_loops': True, 'use_snp_selection': True, 'num_snps': 58334}. Best is trial 25 with value: 0.37075254988769146.
[I 2025-12-09 05:06:43,735] Trial 81 finished with value: 0.366056502066521 and parameters: {'model_type': 'graphsage', 'hidden_dims': '[256, 128, 64]', 'dropout': 0.5355272638998655, 'batch_norm': False, 'sage_aggr': 'max', 'sage_normalize': False, 'sage_project': False, 'lr': 1.1071936418474513e-05, 'weight_decay': 7.22561261699692e-05, 'epochs': 255, 'loss': 'mae', 'optimizer': 'adam', 'graph_mode': 'cutoff', 'cutoff': 0.7924727999860188, 'grm_norm': 'cosine_then_gcn', 'self_loops': True, 'use_snp_selection': True, 'num_snps': 57980}. Best is trial 25 with value: 0.37075254988769146.
[I 2025-12-09 05:08:14,532] Trial 82 finished with value: 0.36187738909944944 and parameters: {'model_type': 'graphsage', 'hidden_dims': '[256, 128, 64]', 'dropout': 0.5896200872003645, 'batch_norm': False, 'sage_aggr': 'max', 'sage_normalize': False, 'sage_project': False, 'lr': 1.1718675023465654e-05, 'weight_decay': 4.1561134360430555e-05, 'epochs': 268, 'loss': 'mae', 'optimizer': 'adam', 'graph_mode': 'cutoff', 'cutoff': 0.7876069499777795, 'grm_norm': 'cosine_then_gcn', 'self_loops': True, 'use_snp_selection': True, 'num_snps': 53811}. Best is trial 25 with value: 0.37075254988769146.
[I 2025-12-09 05:09:44,093] Trial 83 finished with value: 0.3604598046638043 and parameters: {'model_type': 'graphsage', 'hidden_dims': '[256, 128, 64]', 'dropout': 0.5712324198796745, 'batch_norm': False, 'sage_aggr': 'max', 'sage_normalize': False, 'sage_project': False, 'lr': 1.0046316129905245e-05, 'weight_decay': 0.00015503526527263446, 'epochs': 234, 'loss': 'mae', 'optimizer': 'adam', 'graph_mode': 'cutoff', 'cutoff': 0.8565301941011353, 'grm_norm': 'cosine_then_gcn', 'self_loops': True, 'use_snp_selection': True, 'num_snps': 57879}. Best is trial 25 with value: 0.37075254988769146.
[I 2025-12-09 05:11:12,915] Trial 84 finished with value: 0.3617521665768284 and parameters: {'model_type': 'graphsage', 'hidden_dims': '[256, 128, 64]', 'dropout': 0.5560154893904568, 'batch_norm': False, 'sage_aggr': 'max', 'sage_normalize': False, 'sage_project': False, 'lr': 1.5378752049495382e-05, 'weight_decay': 7.313172702785559e-05, 'epochs': 259, 'loss': 'mae', 'optimizer': 'adam', 'graph_mode': 'cutoff', 'cutoff': 0.7674606753686043, 'grm_norm': 'cosine_then_gcn', 'self_loops': True, 'use_snp_selection': True, 'num_snps': 56174}. Best is trial 25 with value: 0.37075254988769146.
[I 2025-12-09 05:12:38,100] Trial 85 finished with value: 0.3563642477568183 and parameters: {'model_type': 'graphsage', 'hidden_dims': '[256, 128, 64]', 'dropout': 0.5987304165202596, 'batch_norm': False, 'sage_aggr': 'max', 'sage_normalize': False, 'sage_project': False, 'lr': 1.7739492773686945e-05, 'weight_decay': 5.2229933849754074e-05, 'epochs': 246, 'loss': 'mae', 'optimizer': 'adam', 'graph_mode': 'cutoff', 'cutoff': 0.7300574119560176, 'grm_norm': 'cosine_then_gcn', 'self_loops': True, 'use_snp_selection': True, 'num_snps': 53804}. Best is trial 25 with value: 0.37075254988769146.
[I 2025-12-09 05:13:52,384] Trial 86 finished with value: 0.36753458390624616 and parameters: {'model_type': 'graphsage', 'hidden_dims': '[128, 64]', 'dropout': 0.539611570204013, 'batch_norm': False, 'sage_aggr': 'max', 'sage_normalize': False, 'sage_project': False, 'lr': 1.3421980749607987e-05, 'weight_decay': 0.00011509993941839639, 'epochs': 273, 'loss': 'mae', 'optimizer': 'adam', 'graph_mode': 'cutoff', 'cutoff': 0.7987915061484677, 'grm_norm': 'cosine_then_gcn', 'self_loops': True, 'use_snp_selection': True, 'num_snps': 58548}. Best is trial 25 with value: 0.37075254988769146.
[I 2025-12-09 05:15:06,599] Trial 87 finished with value: 0.3663236651175034 and parameters: {'model_type': 'graphsage', 'hidden_dims': '[128, 64]', 'dropout': 0.5441556103898539, 'batch_norm': False, 'sage_aggr': 'max', 'sage_normalize': False, 'sage_project': False, 'lr': 1.394791031732194e-05, 'weight_decay': 0.00011151743103470899, 'epochs': 279, 'loss': 'mse', 'optimizer': 'adam', 'graph_mode': 'cutoff', 'cutoff': 0.8026447161362235, 'grm_norm': 'cosine_then_gcn', 'self_loops': True, 'use_snp_selection': True, 'num_snps': 58463}. Best is trial 25 with value: 0.37075254988769146.
[I 2025-12-09 05:15:41,884] Trial 88 finished with value: 0.07699233232860433 and parameters: {'model_type': 'graphsage', 'hidden_dims': '[128, 64]', 'dropout': 0.5447991078840265, 'batch_norm': False, 'sage_aggr': 'mean', 'sage_normalize': False, 'sage_project': False, 'lr': 0.0002470074788269821, 'weight_decay': 0.00019640459342255595, 'epochs': 86, 'loss': 'mse', 'optimizer': 'adam', 'graph_mode': 'cutoff', 'cutoff': 0.8364924910946704, 'grm_norm': 'none', 'self_loops': True, 'use_snp_selection': True, 'num_snps': 58277}. Best is trial 25 with value: 0.37075254988769146.
[I 2025-12-09 05:16:55,761] Trial 89 finished with value: 0.33598847317898156 and parameters: {'model_type': 'graphsage', 'hidden_dims': '[128, 64]', 'dropout': 0.5750838761973222, 'batch_norm': True, 'sage_aggr': 'max', 'sage_normalize': True, 'sage_project': False, 'lr': 3.046924230643797e-05, 'weight_decay': 0.00012262757224509727, 'epochs': 313, 'loss': 'mse', 'optimizer': 'adam', 'graph_mode': 'cutoff', 'cutoff': 0.8051580828494694, 'grm_norm': 'cosine_then_gcn', 'self_loops': True, 'use_snp_selection': True, 'num_snps': 55182}. Best is trial 25 with value: 0.37075254988769146.
[I 2025-12-09 05:17:47,582] Trial 90 finished with value: 0.36712850328485225 and parameters: {'model_type': 'graphsage', 'hidden_dims': '[128, 64]', 'dropout': 0.5580430743327841, 'batch_norm': False, 'sage_aggr': 'max', 'sage_normalize': False, 'sage_project': False, 'lr': 1.3941892320524017e-05, 'weight_decay': 8.60206408020923e-05, 'epochs': 282, 'loss': 'mse', 'optimizer': 'adam', 'graph_mode': 'cutoff', 'cutoff': 0.5914656147343536, 'grm_norm': 'cosine_then_gcn', 'self_loops': False, 'use_snp_selection': False}. Best is trial 25 with value: 0.37075254988769146.
[I 2025-12-09 05:18:51,207] Trial 91 finished with value: 0.35879976330855456 and parameters: {'model_type': 'graphsage', 'hidden_dims': '[128, 64]', 'dropout': 0.5573874032428968, 'batch_norm': False, 'sage_aggr': 'max', 'sage_normalize': False, 'sage_project': False, 'lr': 1.417882010716144e-05, 'weight_decay': 9.228514387047333e-05, 'epochs': 302, 'loss': 'mse', 'optimizer': 'adam', 'graph_mode': 'cutoff', 'cutoff': 0.5259842483940264, 'grm_norm': 'cosine_then_gcn', 'self_loops': False, 'use_snp_selection': False}. Best is trial 25 with value: 0.37075254988769146.
[I 2025-12-09 05:19:41,823] Trial 92 finished with value: 0.36950425320302793 and parameters: {'model_type': 'graphsage', 'hidden_dims': '[128, 64]', 'dropout': 0.5860360427142353, 'batch_norm': False, 'sage_aggr': 'max', 'sage_normalize': False, 'sage_project': False, 'lr': 1.1924521645459961e-05, 'weight_decay': 0.00013664286859224974, 'epochs': 279, 'loss': 'mse', 'optimizer': 'adam', 'graph_mode': 'cutoff', 'cutoff': 0.6063279114729077, 'grm_norm': 'cosine_then_gcn', 'self_loops': False, 'use_snp_selection': False}. Best is trial 25 with value: 0.37075254988769146.
[I 2025-12-09 05:20:35,442] Trial 93 finished with value: 0.3588575654986431 and parameters: {'model_type': 'graphsage', 'hidden_dims': '[128, 64]', 'dropout': 0.5894226380533275, 'batch_norm': False, 'sage_aggr': 'max', 'sage_normalize': False, 'sage_project': False, 'lr': 1.9829144544156957e-05, 'weight_decay': 0.00023764964059149607, 'epochs': 286, 'loss': 'mse', 'optimizer': 'adam', 'graph_mode': 'cutoff', 'cutoff': 0.6174194664974988, 'grm_norm': 'gcn', 'self_loops': False, 'use_snp_selection': False}. Best is trial 25 with value: 0.37075254988769146.
[I 2025-12-09 05:21:30,296] Trial 94 finished with value: 0.3686749705618536 and parameters: {'model_type': 'graphsage', 'hidden_dims': '[128, 64]', 'dropout': 0.5797006829830457, 'batch_norm': False, 'sage_aggr': 'max', 'sage_normalize': False, 'sage_project': False, 'lr': 1.3710510820177077e-05, 'weight_decay': 0.00014696117593768419, 'epochs': 298, 'loss': 'mse', 'optimizer': 'adam', 'graph_mode': 'cutoff', 'cutoff': 0.5884274299092149, 'grm_norm': 'cosine_then_gcn', 'self_loops': False, 'use_snp_selection': False}. Best is trial 25 with value: 0.37075254988769146.
[I 2025-12-09 05:22:30,906] Trial 95 finished with value: 0.30520157488303423 and parameters: {'model_type': 'graphsage', 'hidden_dims': '[128, 64]', 'dropout': 0.5824274266983476, 'batch_norm': False, 'sage_aggr': 'max', 'sage_normalize': False, 'sage_project': False, 'lr': 4.144759422354746e-05, 'weight_decay': 0.00015065975706751925, 'epochs': 332, 'loss': 'mse', 'optimizer': 'adam', 'graph_mode': 'cutoff', 'cutoff': 0.5988584205874597, 'grm_norm': 'cosine_then_gcn', 'self_loops': False, 'use_snp_selection': False}. Best is trial 25 with value: 0.37075254988769146.
[I 2025-12-09 05:23:29,122] Trial 96 finished with value: 0.36438515980180386 and parameters: {'model_type': 'graphsage', 'hidden_dims': '[128, 64]', 'dropout': 0.5697724461068224, 'batch_norm': False, 'sage_aggr': 'max', 'sage_normalize': False, 'sage_project': False, 'lr': 1.20819881562467e-05, 'weight_decay': 0.00039202140642262943, 'epochs': 297, 'loss': 'mse', 'optimizer': 'adam', 'graph_mode': 'cutoff', 'cutoff': 0.554032132873919, 'grm_norm': 'cosine_then_gcn', 'self_loops': False, 'use_snp_selection': False}. Best is trial 25 with value: 0.37075254988769146.
[I 2025-12-09 05:24:20,850] Trial 97 finished with value: 0.35925884372926464 and parameters: {'model_type': 'graphsage', 'hidden_dims': '[128, 64]', 'dropout': 0.5889284727801326, 'batch_norm': False, 'sage_aggr': 'max', 'sage_normalize': False, 'sage_project': False, 'lr': 1.581019229586348e-05, 'weight_decay': 8.546944857982772e-05, 'epochs': 277, 'loss': 'mse', 'optimizer': 'adam', 'graph_mode': 'cutoff', 'cutoff': 0.5778766940656845, 'grm_norm': 'cosine_then_gcn', 'self_loops': False, 'use_snp_selection': False}. Best is trial 25 with value: 0.37075254988769146.
[I 2025-12-09 05:25:43,978] Trial 98 finished with value: 0.3502866647204662 and parameters: {'model_type': 'graphsage', 'hidden_dims': '[128, 64]', 'dropout': 0.5607946949545645, 'batch_norm': False, 'sage_aggr': 'max', 'sage_normalize': False, 'sage_project': False, 'lr': 1.7925594394001184e-05, 'weight_decay': 0.00029027706287542104, 'epochs': 265, 'loss': 'mse', 'optimizer': 'adam', 'graph_mode': 'cutoff', 'cutoff': 0.4293396347286436, 'grm_norm': 'cosine', 'self_loops': False, 'use_snp_selection': False}. Best is trial 25 with value: 0.37075254988769146.
[I 2025-12-09 05:30:01,851] Trial 99 finished with value: 0.3121514496518763 and parameters: {'model_type': 'graphsage', 'hidden_dims': '[128, 64]', 'dropout': 0.5792202519501111, 'batch_norm': False, 'sage_aggr': 'max', 'sage_normalize': False, 'sage_project': False, 'lr': 2.177476557939291e-05, 'weight_decay': 0.00013441423092311837, 'epochs': 301, 'loss': 'mse', 'optimizer': 'adam', 'graph_mode': 'knn', 'knn_k': 10, 'weighted_edges': False, 'symmetrize_mode': 'union', 'self_loops': False, 'use_snp_selection': False}. Best is trial 25 with value: 0.37075254988769146.
[I 2025-12-09 05:31:08,982] Trial 100 finished with value: 0.29570875516819217 and parameters: {'model_type': 'graphsage', 'hidden_dims': '[128, 64]', 'dropout': 0.5991782377235875, 'batch_norm': False, 'sage_aggr': 'max', 'sage_normalize': False, 'sage_project': False, 'lr': 5.6935243178866126e-05, 'weight_decay': 0.00017077407907817495, 'epochs': 311, 'loss': 'mse', 'optimizer': 'adam', 'graph_mode': 'cutoff', 'cutoff': 0.5190151132419005, 'grm_norm': 'cosine_then_gcn', 'self_loops': False, 'use_snp_selection': False}. Best is trial 25 with value: 0.37075254988769146.
[I 2025-12-09 05:31:57,912] Trial 101 finished with value: 0.35554927128975355 and parameters: {'model_type': 'graphsage', 'hidden_dims': '[128, 64]', 'dropout': 0.5465476911761127, 'batch_norm': False, 'sage_aggr': 'max', 'sage_normalize': False, 'sage_project': False, 'lr': 1.3917065291766308e-05, 'weight_decay': 0.0001028378198968668, 'epochs': 276, 'loss': 'mse', 'optimizer': 'adam', 'graph_mode': 'cutoff', 'cutoff': 0.6983158754740537, 'grm_norm': 'cosine_then_gcn', 'self_loops': False, 'use_snp_selection': False}. Best is trial 25 with value: 0.37075254988769146.
[I 2025-12-09 05:32:57,872] Trial 102 finished with value: 0.35874743317560764 and parameters: {'model_type': 'graphsage', 'hidden_dims': '[128, 64]', 'dropout': 0.5224780659400513, 'batch_norm': False, 'sage_aggr': 'max', 'sage_normalize': False, 'sage_project': False, 'lr': 1.3864725967068715e-05, 'weight_decay': 0.00011675231903040516, 'epochs': 321, 'loss': 'mse', 'optimizer': 'adam', 'graph_mode': 'cutoff', 'cutoff': 0.580290887957283, 'grm_norm': 'cosine_then_gcn', 'self_loops': False, 'use_snp_selection': False}. Best is trial 25 with value: 0.37075254988769146.
[I 2025-12-09 05:33:51,379] Trial 103 finished with value: 0.36617825771370516 and parameters: {'model_type': 'graphsage', 'hidden_dims': '[128, 64]', 'dropout': 0.564927196959807, 'batch_norm': False, 'sage_aggr': 'max', 'sage_normalize': False, 'sage_project': False, 'lr': 1.1311942115673773e-05, 'weight_decay': 0.00022715813165176792, 'epochs': 291, 'loss': 'mse', 'optimizer': 'adam', 'graph_mode': 'cutoff', 'cutoff': 0.6106520252354017, 'grm_norm': 'cosine_then_gcn', 'self_loops': False, 'use_snp_selection': False}. Best is trial 25 with value: 0.37075254988769146.
[I 2025-12-09 05:34:42,509] Trial 104 finished with value: 0.34263564217592957 and parameters: {'model_type': 'graphsage', 'hidden_dims': '[128, 64]', 'dropout': 0.19693028232575624, 'batch_norm': False, 'sage_aggr': 'max', 'sage_normalize': False, 'sage_project': False, 'lr': 1.1970803550166196e-05, 'weight_decay': 0.00010141180979043095, 'epochs': 285, 'loss': 'mse', 'optimizer': 'adam', 'graph_mode': 'cutoff', 'cutoff': 0.7542395736219736, 'grm_norm': 'cosine_then_gcn', 'self_loops': False, 'use_snp_selection': False}. Best is trial 25 with value: 0.37075254988769146.
[I 2025-12-09 05:36:07,991] Trial 105 finished with value: 0.3456355279051368 and parameters: {'model_type': 'graphsage', 'hidden_dims': '[128, 64]', 'dropout': 0.5408778082543277, 'batch_norm': False, 'sage_aggr': 'max', 'sage_normalize': False, 'sage_project': False, 'lr': 1.6352624626134363e-05, 'weight_decay': 6.9005370272568e-05, 'epochs': 280, 'loss': 'mse', 'optimizer': 'adam', 'graph_mode': 'cutoff', 'cutoff': 0.45724289283874153, 'grm_norm': 'cosine_then_gcn', 'self_loops': False, 'use_snp_selection': False}. Best is trial 25 with value: 0.37075254988769146.
[I 2025-12-09 05:38:26,023] Trial 106 finished with value: 0.3405183229981556 and parameters: {'model_type': 'graphsage', 'hidden_dims': '[512, 128]', 'dropout': 0.34956284749972455, 'batch_norm': False, 'sage_aggr': 'max', 'sage_normalize': False, 'sage_project': False, 'lr': 2.5140282484627473e-05, 'weight_decay': 5.1422765291794e-05, 'epochs': 261, 'loss': 'mse', 'optimizer': 'adam', 'graph_mode': 'cutoff', 'cutoff': 0.8174596317243153, 'grm_norm': 'cosine_then_gcn', 'self_loops': False, 'use_snp_selection': False}. Best is trial 25 with value: 0.37075254988769146.
[I 2025-12-09 05:39:15,684] Trial 107 finished with value: 0.014178619122960045 and parameters: {'model_type': 'graphsage', 'hidden_dims': '[128, 64]', 'dropout': 0.574954476159881, 'batch_norm': False, 'sage_aggr': 'mean', 'sage_normalize': False, 'sage_project': False, 'lr': 0.004373138246636098, 'weight_decay': 0.0001404232409325351, 'epochs': 272, 'loss': 'mse', 'optimizer': 'adam', 'graph_mode': 'cutoff', 'cutoff': 0.6719985572936876, 'grm_norm': 'cosine_then_gcn', 'self_loops': False, 'use_snp_selection': False}. Best is trial 25 with value: 0.37075254988769146.
