[I 2025-12-08 15:12:52,148] Trial 38 finished with value: 0.3286539456992036 and parameters: {'model_type': 'graphsage', 'hidden_dims': '[256, 128, 64]', 'dropout': 0.31765768751244516, 'batch_norm': False, 'sage_aggr': 'mean', 'sage_normalize': True, 'sage_project': False, 'lr': 0.002461635864826784, 'weight_decay': 4.73176686594307e-06, 'epochs': 87, 'loss': 'mae', 'optimizer': 'adam', 'graph_mode': 'cutoff', 'cutoff': 0.6469273193967431, 'grm_norm': 'gcn', 'self_loops': True, 'use_snp_selection': True, 'num_snps': 2532}. Best is trial 15 with value: 0.37084461715139433.
[I 2025-12-08 15:13:31,125] Trial 39 finished with value: 0.3481302373388731 and parameters: {'model_type': 'graphsage', 'hidden_dims': '[128, 64]', 'dropout': 0.2697070201995263, 'batch_norm': True, 'sage_aggr': 'max', 'sage_normalize': True, 'sage_project': False, 'lr': 0.0006727168718641816, 'weight_decay': 1.3768538110343867e-05, 'epochs': 56, 'loss': 'mae', 'optimizer': 'adam', 'graph_mode': 'knn', 'knn_k': 6, 'weighted_edges': True, 'symmetrize_mode': 'union', 'self_loops': False, 'use_snp_selection': True, 'num_snps': 16853}. Best is trial 15 with value: 0.37084461715139433.
[I 2025-12-08 15:15:16,169] Trial 40 finished with value: 0.3349128567915807 and parameters: {'model_type': 'graphsage', 'hidden_dims': '[256, 128]', 'dropout': 0.22334773057859086, 'batch_norm': True, 'sage_aggr': 'max', 'sage_normalize': False, 'sage_project': False, 'lr': 0.0013055857304657614, 'weight_decay': 1.222056876027961e-06, 'epochs': 256, 'loss': 'mae', 'optimizer': 'adam', 'graph_mode': 'knn', 'knn_k': 7, 'weighted_edges': False, 'symmetrize_mode': 'mutual', 'self_loops': True, 'use_snp_selection': False}. Best is trial 15 with value: 0.37084461715139433.
[I 2025-12-08 15:16:41,943] Trial 41 finished with value: 0.3536310574814405 and parameters: {'model_type': 'graphsage', 'hidden_dims': '[256, 128]', 'dropout': 0.45546941453560913, 'batch_norm': True, 'sage_aggr': 'max', 'sage_normalize': True, 'sage_project': False, 'lr': 0.003272004321763422, 'weight_decay': 3.0332151077186972e-05, 'epochs': 145, 'loss': 'mae', 'optimizer': 'adam', 'graph_mode': 'knn', 'knn_k': 8, 'weighted_edges': True, 'symmetrize_mode': 'union', 'self_loops': False, 'use_snp_selection': True, 'num_snps': 24692}. Best is trial 15 with value: 0.37084461715139433.
[I 2025-12-08 15:18:23,446] Trial 42 finished with value: 0.366098650424335 and parameters: {'model_type': 'graphsage', 'hidden_dims': '[256, 128]', 'dropout': 0.41559845175447874, 'batch_norm': True, 'sage_aggr': 'max', 'sage_normalize': True, 'sage_project': False, 'lr': 0.006517901337856941, 'weight_decay': 1.916336181431334e-05, 'epochs': 178, 'loss': 'mae', 'optimizer': 'adam', 'graph_mode': 'knn', 'knn_k': 8, 'weighted_edges': True, 'symmetrize_mode': 'union', 'self_loops': False, 'use_snp_selection': True, 'num_snps': 25807}. Best is trial 15 with value: 0.37084461715139433.
[I 2025-12-08 15:20:36,152] Trial 43 finished with value: 0.357151435279023 and parameters: {'model_type': 'graphsage', 'hidden_dims': '[256, 128]', 'dropout': 0.35618706645199605, 'batch_norm': True, 'sage_aggr': 'max', 'sage_normalize': True, 'sage_project': False, 'lr': 0.006707533845936683, 'weight_decay': 4.513147979711104e-05, 'epochs': 188, 'loss': 'mae', 'optimizer': 'adam', 'graph_mode': 'knn', 'knn_k': 9, 'weighted_edges': True, 'symmetrize_mode': 'union', 'self_loops': False, 'use_snp_selection': True, 'num_snps': 33105}. Best is trial 15 with value: 0.37084461715139433.
[I 2025-12-08 15:21:49,549] Trial 44 finished with value: 0.3421701242911709 and parameters: {'model_type': 'graphsage', 'hidden_dims': '[512, 64]', 'dropout': 0.4044981080633146, 'batch_norm': True, 'sage_aggr': 'mean', 'sage_normalize': True, 'sage_project': False, 'lr': 0.005980113689440894, 'weight_decay': 8.545306524757618e-05, 'epochs': 151, 'loss': 'mae', 'optimizer': 'adam', 'graph_mode': 'knn', 'knn_k': 7, 'weighted_edges': True, 'symmetrize_mode': 'mutual', 'self_loops': False, 'use_snp_selection': True, 'num_snps': 27682}. Best is trial 15 with value: 0.37084461715139433.
[I 2025-12-08 15:22:39,286] Trial 45 finished with value: 0.3137401694219473 and parameters: {'model_type': 'graphsage', 'hidden_dims': '[256, 128]', 'dropout': 0.5102434833231702, 'batch_norm': True, 'sage_aggr': 'max', 'sage_normalize': True, 'sage_project': False, 'lr': 2.475222594826997e-05, 'weight_decay': 1.0585335971808653e-05, 'epochs': 177, 'loss': 'mae', 'optimizer': 'adam', 'graph_mode': 'knn', 'knn_k': 1, 'weighted_edges': False, 'symmetrize_mode': 'union', 'self_loops': False, 'use_snp_selection': True, 'num_snps': 22521}. Best is trial 15 with value: 0.37084461715139433.
[I 2025-12-08 15:24:05,861] Trial 46 finished with value: 0.182513940690459 and parameters: {'model_type': 'graphsage', 'hidden_dims': '[256, 128, 64]', 'dropout': 0.43333100488737436, 'batch_norm': False, 'sage_aggr': 'max', 'sage_normalize': True, 'sage_project': False, 'lr': 0.008398733161038837, 'weight_decay': 2.9841517887786094e-06, 'epochs': 199, 'loss': 'mse', 'optimizer': 'adam', 'graph_mode': 'cutoff', 'cutoff': 0.40202279402957186, 'grm_norm': 'none', 'self_loops': False, 'use_snp_selection': True, 'num_snps': 37580}. Best is trial 15 with value: 0.37084461715139433.
[I 2025-12-08 15:25:09,911] Trial 47 finished with value: 0.3361234961037315 and parameters: {'model_type': 'graphsage', 'hidden_dims': '[512, 64]', 'dropout': 0.37657471523111985, 'batch_norm': True, 'sage_aggr': 'max', 'sage_normalize': True, 'sage_project': False, 'lr': 0.005169345693040353, 'weight_decay': 0.0006128636172421666, 'epochs': 171, 'loss': 'mae', 'optimizer': 'adam', 'graph_mode': 'knn', 'knn_k': 9, 'weighted_edges': True, 'symmetrize_mode': 'union', 'self_loops': False, 'use_snp_selection': True, 'num_snps': 13318}. Best is trial 15 with value: 0.37084461715139433.
[I 2025-12-08 15:26:00,339] Trial 48 finished with value: 0.34007711555867337 and parameters: {'model_type': 'graphsage', 'hidden_dims': '[512, 128]', 'dropout': 0.5389221396479393, 'batch_norm': True, 'sage_aggr': 'mean', 'sage_normalize': True, 'sage_project': False, 'lr': 0.0023961035234954086, 'weight_decay': 2.2378382007092437e-05, 'epochs': 112, 'loss': 'mae', 'optimizer': 'adam', 'graph_mode': 'knn', 'knn_k': 8, 'weighted_edges': True, 'symmetrize_mode': 'mutual', 'self_loops': False, 'use_snp_selection': True, 'num_snps': 18123}. Best is trial 15 with value: 0.37084461715139433.
[I 2025-12-08 15:28:05,514] Trial 49 finished with value: 0.3547623389689663 and parameters: {'model_type': 'graphsage', 'hidden_dims': '[512, 256]', 'dropout': 0.4834396320771355, 'batch_norm': True, 'sage_aggr': 'max', 'sage_normalize': True, 'sage_project': False, 'lr': 0.001773957347586022, 'weight_decay': 0.0001900346266876033, 'epochs': 217, 'loss': 'mae', 'optimizer': 'adam', 'graph_mode': 'knn', 'knn_k': 6, 'weighted_edges': True, 'symmetrize_mode': 'union', 'self_loops': True, 'use_snp_selection': True, 'num_snps': 26198}. Best is trial 15 with value: 0.37084461715139433.
[I 2025-12-08 15:31:26,908] Trial 50 finished with value: 0.2884395498363108 and parameters: {'model_type': 'graphsage', 'hidden_dims': '[256, 128]', 'dropout': 0.4113270394384086, 'batch_norm': True, 'sage_aggr': 'max', 'sage_normalize': True, 'sage_project': False, 'lr': 0.004217973393628013, 'weight_decay': 0.0006119890193478286, 'epochs': 341, 'loss': 'mae', 'optimizer': 'adam', 'graph_mode': 'knn', 'knn_k': 7, 'weighted_edges': False, 'symmetrize_mode': 'union', 'self_loops': False, 'use_snp_selection': False}. Best is trial 15 with value: 0.37084461715139433.
[I 2025-12-08 15:32:52,069] Trial 51 finished with value: 0.36112430092185527 and parameters: {'model_type': 'graphsage', 'hidden_dims': '[256, 128]', 'dropout': 0.44577646181767416, 'batch_norm': True, 'sage_aggr': 'max', 'sage_normalize': True, 'sage_project': False, 'lr': 0.003154426350571242, 'weight_decay': 2.0672640163487105e-05, 'epochs': 135, 'loss': 'mae', 'optimizer': 'adam', 'graph_mode': 'knn', 'knn_k': 8, 'weighted_edges': True, 'symmetrize_mode': 'union', 'self_loops': False, 'use_snp_selection': True, 'num_snps': 25236}. Best is trial 15 with value: 0.37084461715139433.
[I 2025-12-08 15:34:06,687] Trial 52 finished with value: 0.3543524623731823 and parameters: {'model_type': 'graphsage', 'hidden_dims': '[256, 128]', 'dropout': 0.39258712403240537, 'batch_norm': True, 'sage_aggr': 'max', 'sage_normalize': True, 'sage_project': False, 'lr': 0.0061533658317108955, 'weight_decay': 7.977431215682854e-05, 'epochs': 137, 'loss': 'mae', 'optimizer': 'adam', 'graph_mode': 'knn', 'knn_k': 8, 'weighted_edges': True, 'symmetrize_mode': 'union', 'self_loops': False, 'use_snp_selection': True, 'num_snps': 22747}. Best is trial 15 with value: 0.37084461715139433.
[I 2025-12-08 15:35:38,424] Trial 53 finished with value: 0.3518229032066109 and parameters: {'model_type': 'graphsage', 'hidden_dims': '[256, 128]', 'dropout': 0.43026104205417653, 'batch_norm': True, 'sage_aggr': 'max', 'sage_normalize': True, 'sage_project': False, 'lr': 0.0037226718440409403, 'weight_decay': 1.0890180405630363e-05, 'epochs': 99, 'loss': 'mae', 'optimizer': 'adam', 'graph_mode': 'knn', 'knn_k': 9, 'weighted_edges': True, 'symmetrize_mode': 'union', 'self_loops': False, 'use_snp_selection': True, 'num_snps': 31332}. Best is trial 15 with value: 0.37084461715139433.
[I 2025-12-08 15:36:50,758] Trial 54 finished with value: 0.3465058509341534 and parameters: {'model_type': 'graphsage', 'hidden_dims': '[256, 128]', 'dropout': 0.45083882489212984, 'batch_norm': True, 'sage_aggr': 'max', 'sage_normalize': True, 'sage_project': False, 'lr': 0.001241560819308809, 'weight_decay': 2.0531010678919877e-05, 'epochs': 156, 'loss': 'mae', 'optimizer': 'adam', 'graph_mode': 'knn', 'knn_k': 9, 'weighted_edges': True, 'symmetrize_mode': 'union', 'self_loops': False, 'use_snp_selection': True, 'num_snps': 19280}. Best is trial 15 with value: 0.37084461715139433.
[I 2025-12-08 15:37:39,581] Trial 55 finished with value: 0.3689187699317644 and parameters: {'model_type': 'graphsage', 'hidden_dims': '[512, 64]', 'dropout': 0.3461538903685801, 'batch_norm': True, 'sage_aggr': 'max', 'sage_normalize': True, 'sage_project': False, 'lr': 0.0021614383634710123, 'weight_decay': 4.851992883063068e-05, 'epochs': 81, 'loss': 'mae', 'optimizer': 'adam', 'graph_mode': 'knn', 'knn_k': 8, 'weighted_edges': True, 'symmetrize_mode': 'union', 'self_loops': False, 'use_snp_selection': True, 'num_snps': 15368}. Best is trial 15 with value: 0.37084461715139433.
[I 2025-12-08 15:38:25,398] Trial 56 finished with value: 0.3615266956711928 and parameters: {'model_type': 'graphsage', 'hidden_dims': '[512, 64]', 'dropout': 0.2919272115850064, 'batch_norm': True, 'sage_aggr': 'max', 'sage_normalize': True, 'sage_project': False, 'lr': 0.007106666866509733, 'weight_decay': 5.2465107303485955e-05, 'epochs': 75, 'loss': 'mae', 'optimizer': 'adam', 'graph_mode': 'knn', 'knn_k': 10, 'weighted_edges': True, 'symmetrize_mode': 'union', 'self_loops': False, 'use_snp_selection': True, 'num_snps': 12707}. Best is trial 15 with value: 0.37084461715139433.
[I 2025-12-08 15:38:58,269] Trial 57 finished with value: 0.2673835977854807 and parameters: {'model_type': 'graphsage', 'hidden_dims': '[512, 64]', 'dropout': 0.2371891689465339, 'batch_norm': False, 'sage_aggr': 'max', 'sage_normalize': True, 'sage_project': False, 'lr': 0.007735078280486318, 'weight_decay': 4.427054500779077e-05, 'epochs': 52, 'loss': 'mae', 'optimizer': 'adam', 'graph_mode': 'cutoff', 'cutoff': 0.8962115168000044, 'grm_norm': 'gcn', 'self_loops': False, 'use_snp_selection': True, 'num_snps': 12463}. Best is trial 15 with value: 0.37084461715139433.
[I 2025-12-08 15:39:34,794] Trial 58 finished with value: 0.33570935534393803 and parameters: {'model_type': 'graphsage', 'hidden_dims': '[512, 64]', 'dropout': 0.2880158235452777, 'batch_norm': True, 'sage_aggr': 'mean', 'sage_normalize': False, 'sage_project': False, 'lr': 0.0008887608312476478, 'weight_decay': 0.0002588519415740702, 'epochs': 77, 'loss': 'mae', 'optimizer': 'adam', 'graph_mode': 'knn', 'knn_k': 10, 'weighted_edges': True, 'symmetrize_mode': 'union', 'self_loops': False, 'use_snp_selection': True, 'num_snps': 7354}. Best is trial 15 with value: 0.37084461715139433.
[I 2025-12-08 15:40:19,516] Trial 59 finished with value: 0.344152265574329 and parameters: {'model_type': 'graphsage', 'hidden_dims': '[512, 64]', 'dropout': 0.3410777775509689, 'batch_norm': True, 'sage_aggr': 'max', 'sage_normalize': True, 'sage_project': False, 'lr': 0.00013345496534551143, 'weight_decay': 5.851146621410945e-05, 'epochs': 81, 'loss': 'mse', 'optimizer': 'adam', 'graph_mode': 'knn', 'knn_k': 10, 'weighted_edges': True, 'symmetrize_mode': 'mutual', 'self_loops': False, 'use_snp_selection': True, 'num_snps': 15021}. Best is trial 15 with value: 0.37084461715139433.
[I 2025-12-08 15:41:04,289] Trial 60 finished with value: 0.3379314369613508 and parameters: {'model_type': 'graphsage', 'hidden_dims': '[512, 64]', 'dropout': 0.32609742351205545, 'batch_norm': True, 'sage_aggr': 'max', 'sage_normalize': True, 'sage_project': False, 'lr': 0.009983021266992268, 'weight_decay': 0.00010784562315716017, 'epochs': 51, 'loss': 'mae', 'optimizer': 'adam', 'graph_mode': 'knn', 'knn_k': 5, 'weighted_edges': True, 'symmetrize_mode': 'union', 'self_loops': False, 'use_snp_selection': True, 'num_snps': 20392}. Best is trial 15 with value: 0.37084461715139433.
[I 2025-12-08 15:42:18,273] Trial 61 finished with value: 0.37123953196455645 and parameters: {'model_type': 'graphsage', 'hidden_dims': '[512, 64]', 'dropout': 0.35677143725326105, 'batch_norm': True, 'sage_aggr': 'max', 'sage_normalize': True, 'sage_project': False, 'lr': 0.005336517953680738, 'weight_decay': 0.0001437917015279212, 'epochs': 93, 'loss': 'mae', 'optimizer': 'adam', 'graph_mode': 'knn', 'knn_k': 8, 'weighted_edges': True, 'symmetrize_mode': 'union', 'self_loops': False, 'use_snp_selection': True, 'num_snps': 27298}. Best is trial 61 with value: 0.37123953196455645.
[I 2025-12-08 15:43:09,972] Trial 62 finished with value: 0.357893614176754 and parameters: {'model_type': 'graphsage', 'hidden_dims': '[512, 64]', 'dropout': 0.2955709124022952, 'batch_norm': True, 'sage_aggr': 'max', 'sage_normalize': True, 'sage_project': False, 'lr': 0.0051351292409747935, 'weight_decay': 0.00013626746263435577, 'epochs': 118, 'loss': 'mae', 'optimizer': 'adam', 'graph_mode': 'knn', 'knn_k': 9, 'weighted_edges': True, 'symmetrize_mode': 'union', 'self_loops': False, 'use_snp_selection': True, 'num_snps': 12088}. Best is trial 61 with value: 0.37123953196455645.
[I 2025-12-08 15:44:02,311] Trial 63 finished with value: 0.3564343443838891 and parameters: {'model_type': 'graphsage', 'hidden_dims': '[512, 64]', 'dropout': 0.3627386472449057, 'batch_norm': True, 'sage_aggr': 'max', 'sage_normalize': True, 'sage_project': False, 'lr': 0.007157040991515521, 'weight_decay': 8.305161157789598e-05, 'epochs': 94, 'loss': 'mae', 'optimizer': 'adam', 'graph_mode': 'knn', 'knn_k': 8, 'weighted_edges': True, 'symmetrize_mode': 'union', 'self_loops': False, 'use_snp_selection': True, 'num_snps': 15725}. Best is trial 61 with value: 0.37123953196455645.
[I 2025-12-08 15:44:53,136] Trial 64 finished with value: 0.3551802754581225 and parameters: {'model_type': 'graphsage', 'hidden_dims': '[512, 64]', 'dropout': 0.39067856916584415, 'batch_norm': True, 'sage_aggr': 'max', 'sage_normalize': True, 'sage_project': False, 'lr': 0.0019702231679037657, 'weight_decay': 0.0001741173703237769, 'epochs': 75, 'loss': 'mae', 'optimizer': 'adam', 'graph_mode': 'knn', 'knn_k': 4, 'weighted_edges': True, 'symmetrize_mode': 'union', 'self_loops': False, 'use_snp_selection': True, 'num_snps': 21906}. Best is trial 61 with value: 0.37123953196455645.
[I 2025-12-08 15:46:50,170] Trial 65 finished with value: 0.34690455044260954 and parameters: {'model_type': 'graphsage', 'hidden_dims': '[512, 64]', 'dropout': 0.1051462079786658, 'batch_norm': True, 'sage_aggr': 'max', 'sage_normalize': True, 'sage_project': False, 'lr': 0.005401506342069531, 'weight_decay': 4.389444986841703e-05, 'epochs': 62, 'loss': 'mae', 'optimizer': 'adam', 'graph_mode': 'knn', 'knn_k': 10, 'weighted_edges': True, 'symmetrize_mode': 'union', 'self_loops': False, 'use_snp_selection': True, 'num_snps': 49194}. Best is trial 61 with value: 0.37123953196455645.
[I 2025-12-08 15:47:28,064] Trial 66 finished with value: 0.3560628508726544 and parameters: {'model_type': 'graphsage', 'hidden_dims': '[512, 64]', 'dropout': 0.3133791176672623, 'batch_norm': True, 'sage_aggr': 'max', 'sage_normalize': True, 'sage_project': False, 'lr': 0.0003488351775968828, 'weight_decay': 0.00010086657449857021, 'epochs': 108, 'loss': 'mae', 'optimizer': 'adam', 'graph_mode': 'knn', 'knn_k': 7, 'weighted_edges': True, 'symmetrize_mode': 'union', 'self_loops': False, 'use_snp_selection': True, 'num_snps': 6495}. Best is trial 61 with value: 0.37123953196455645.
[I 2025-12-08 15:48:38,212] Trial 67 finished with value: 0.33476380196435757 and parameters: {'model_type': 'graphsage', 'hidden_dims': '[512, 64]', 'dropout': 0.3424684556299079, 'batch_norm': True, 'sage_aggr': 'max', 'sage_normalize': True, 'sage_project': False, 'lr': 0.004032139504561489, 'weight_decay': 0.00027909436746975555, 'epochs': 68, 'loss': 'mae', 'optimizer': 'adam', 'graph_mode': 'knn', 'knn_k': 8, 'weighted_edges': False, 'symmetrize_mode': 'union', 'self_loops': True, 'use_snp_selection': False}. Best is trial 61 with value: 0.37123953196455645.
[I 2025-12-08 15:49:53,823] Trial 68 finished with value: 0.2955737781123041 and parameters: {'model_type': 'graphsage', 'hidden_dims': '[128, 64]', 'dropout': 0.1950054821495844, 'batch_norm': False, 'sage_aggr': 'max', 'sage_normalize': True, 'sage_project': False, 'lr': 0.0015748314699841406, 'weight_decay': 5.8782998556514874e-05, 'epochs': 121, 'loss': 'mae', 'optimizer': 'adam', 'graph_mode': 'knn', 'knn_k': 9, 'weighted_edges': True, 'symmetrize_mode': 'union', 'self_loops': False, 'use_snp_selection': True, 'num_snps': 27952}. Best is trial 61 with value: 0.37123953196455645.
[I 2025-12-08 15:50:46,770] Trial 69 finished with value: 0.35940578319578764 and parameters: {'model_type': 'graphsage', 'hidden_dims': '[512, 64]', 'dropout': 0.26547869025859067, 'batch_norm': True, 'sage_aggr': 'max', 'sage_normalize': True, 'sage_project': False, 'lr': 0.0027569686497648086, 'weight_decay': 0.0001581812276690168, 'epochs': 93, 'loss': 'mae', 'optimizer': 'adam', 'graph_mode': 'cutoff', 'cutoff': 0.35020738737348006, 'grm_norm': 'cosine', 'self_loops': False, 'use_snp_selection': True, 'num_snps': 23542}. Best is trial 61 with value: 0.37123953196455645.
[I 2025-12-08 15:51:59,681] Trial 70 finished with value: 0.33224327538440507 and parameters: {'model_type': 'graphsage', 'hidden_dims': '[512, 128]', 'dropout': 0.36751405267103315, 'batch_norm': True, 'sage_aggr': 'mean', 'sage_normalize': False, 'sage_project': False, 'lr': 4.473148633620034e-05, 'weight_decay': 2.690323567751839e-05, 'epochs': 246, 'loss': 'mse', 'optimizer': 'adam', 'graph_mode': 'knn', 'knn_k': 3, 'weighted_edges': True, 'symmetrize_mode': 'union', 'self_loops': False, 'use_snp_selection': True, 'num_snps': 20561}. Best is trial 61 with value: 0.37123953196455645.
[I 2025-12-08 15:53:25,205] Trial 71 finished with value: 0.3672484809437506 and parameters: {'model_type': 'graphsage', 'hidden_dims': '[512, 256]', 'dropout': 0.47120549992236893, 'batch_norm': True, 'sage_aggr': 'max', 'sage_normalize': True, 'sage_project': False, 'lr': 0.003396875134981963, 'weight_decay': 3.484562286891808e-05, 'epochs': 105, 'loss': 'mae', 'optimizer': 'adam', 'graph_mode': 'knn', 'knn_k': 8, 'weighted_edges': True, 'symmetrize_mode': 'union', 'self_loops': False, 'use_snp_selection': True, 'num_snps': 26391}. Best is trial 61 with value: 0.37123953196455645.
[I 2025-12-08 15:55:04,274] Trial 72 finished with value: 0.36468704539040075 and parameters: {'model_type': 'graphsage', 'hidden_dims': '[512, 256]', 'dropout': 0.47097904272454727, 'batch_norm': True, 'sage_aggr': 'max', 'sage_normalize': True, 'sage_project': False, 'lr': 0.0036127603800838438, 'weight_decay': 3.413754870196105e-05, 'epochs': 104, 'loss': 'mae', 'optimizer': 'adam', 'graph_mode': 'knn', 'knn_k': 8, 'weighted_edges': True, 'symmetrize_mode': 'union', 'self_loops': False, 'use_snp_selection': True, 'num_snps': 32002}. Best is trial 61 with value: 0.37123953196455645.
[I 2025-12-08 15:56:38,198] Trial 73 finished with value: 0.3616790085261981 and parameters: {'model_type': 'graphsage', 'hidden_dims': '[512, 256]', 'dropout': 0.4745058622711044, 'batch_norm': True, 'sage_aggr': 'max', 'sage_normalize': True, 'sage_project': False, 'lr': 0.0034852066304860126, 'weight_decay': 3.474732691351332e-05, 'epochs': 101, 'loss': 'mae', 'optimizer': 'adam', 'graph_mode': 'knn', 'knn_k': 8, 'weighted_edges': True, 'symmetrize_mode': 'union', 'self_loops': False, 'use_snp_selection': True, 'num_snps': 34631}. Best is trial 61 with value: 0.37123953196455645.
[I 2025-12-08 15:58:05,398] Trial 74 finished with value: 0.36000748586423953 and parameters: {'model_type': 'graphsage', 'hidden_dims': '[512, 256]', 'dropout': 0.48989341684047627, 'batch_norm': True, 'sage_aggr': 'max', 'sage_normalize': True, 'sage_project': False, 'lr': 0.0021570573014218415, 'weight_decay': 6.925550495410976e-05, 'epochs': 105, 'loss': 'mae', 'optimizer': 'adam', 'graph_mode': 'knn', 'knn_k': 7, 'weighted_edges': True, 'symmetrize_mode': 'union', 'self_loops': False, 'use_snp_selection': True, 'num_snps': 30183}. Best is trial 61 with value: 0.37123953196455645.
