[I 2025-12-09 12:49:12,916] Trial 105 finished with value: 0.35394472859949533 and parameters: {'model_type': 'graphsage', 'hidden_dims': '[512, 128]', 'dropout': 0.30323186757863496, 'batch_norm': False, 'sage_aggr': 'mean', 'sage_normalize': False, 'sage_project': False, 'lr': 1.2078241652627483e-05, 'weight_decay': 0.0001741503679526804, 'epochs': 64, 'loss': 'mae', 'optimizer': 'adam', 'graph_mode': 'cutoff', 'cutoff': 0.8485237739339674, 'grm_norm': 'none', 'self_loops': False, 'use_snp_selection': True, 'num_snps': 12770}. Best is trial 88 with value: 0.370452562702736.
[I 2025-12-09 12:49:52,891] Trial 106 finished with value: 0.3628608530691013 and parameters: {'model_type': 'graphsage', 'hidden_dims': '[512, 256]', 'dropout': 0.5112423869263228, 'batch_norm': False, 'sage_aggr': 'mean', 'sage_normalize': False, 'sage_project': False, 'lr': 1.47751960104412e-05, 'weight_decay': 9.9210679348338e-05, 'epochs': 69, 'loss': 'mae', 'optimizer': 'adam', 'graph_mode': 'cutoff', 'cutoff': 0.8620179744551407, 'grm_norm': 'none', 'self_loops': False, 'use_snp_selection': True, 'num_snps': 20106}. Best is trial 88 with value: 0.370452562702736.
[I 2025-12-09 12:50:50,954] Trial 107 finished with value: 0.3496307376469307 and parameters: {'model_type': 'graphsage', 'hidden_dims': '[512, 256]', 'dropout': 0.5326291159547174, 'batch_norm': True, 'sage_aggr': 'mean', 'sage_normalize': False, 'sage_project': False, 'lr': 2.206713018074623e-05, 'weight_decay': 0.0002685383714571604, 'epochs': 108, 'loss': 'mae', 'optimizer': 'adam', 'graph_mode': 'cutoff', 'cutoff': 0.7272911906823343, 'grm_norm': 'none', 'self_loops': False, 'use_snp_selection': True, 'num_snps': 32885}. Best is trial 88 with value: 0.370452562702736.
[I 2025-12-09 12:51:47,057] Trial 108 finished with value: 0.34920062948729536 and parameters: {'model_type': 'graphsage', 'hidden_dims': '[512, 256]', 'dropout': 0.5634838882980691, 'batch_norm': False, 'sage_aggr': 'mean', 'sage_normalize': False, 'sage_project': False, 'lr': 3.148800064871618e-05, 'weight_decay': 0.0005873741982816389, 'epochs': 95, 'loss': 'mae', 'optimizer': 'adam', 'graph_mode': 'knn', 'knn_k': 10, 'weighted_edges': True, 'symmetrize_mode': 'mutual', 'self_loops': False, 'use_snp_selection': True, 'num_snps': 22431}. Best is trial 88 with value: 0.370452562702736.
[I 2025-12-09 12:52:21,653] Trial 109 finished with value: 0.3630264532662826 and parameters: {'model_type': 'graphsage', 'hidden_dims': '[256, 128]', 'dropout': 0.48707311513453366, 'batch_norm': False, 'sage_aggr': 'mean', 'sage_normalize': False, 'sage_project': False, 'lr': 4.1327684378858664e-05, 'weight_decay': 0.00012430783471224953, 'epochs': 53, 'loss': 'mae', 'optimizer': 'adam', 'graph_mode': 'cutoff', 'cutoff': 0.759134543997425, 'grm_norm': 'cosine_then_gcn', 'self_loops': False, 'use_snp_selection': True, 'num_snps': 17965}. Best is trial 88 with value: 0.370452562702736.
[I 2025-12-09 12:53:01,728] Trial 110 finished with value: 0.36218262744313756 and parameters: {'model_type': 'graphsage', 'hidden_dims': '[256, 128, 64]', 'dropout': 0.40267152799432726, 'batch_norm': False, 'sage_aggr': 'mean', 'sage_normalize': False, 'sage_project': False, 'lr': 1.9149389002201767e-05, 'weight_decay': 0.0003109423303830534, 'epochs': 81, 'loss': 'mae', 'optimizer': 'adam', 'graph_mode': 'cutoff', 'cutoff': 0.8261229881308918, 'grm_norm': 'cosine', 'self_loops': False, 'use_snp_selection': True, 'num_snps': 23939}. Best is trial 88 with value: 0.370452562702736.
[I 2025-12-09 12:53:49,134] Trial 111 finished with value: 0.36046589150506625 and parameters: {'model_type': 'graphsage', 'hidden_dims': '[512, 256]', 'dropout': 0.413565345497777, 'batch_norm': False, 'sage_aggr': 'mean', 'sage_normalize': False, 'sage_project': False, 'lr': 1.6287086039857945e-05, 'weight_decay': 0.00044855703059862317, 'epochs': 85, 'loss': 'mae', 'optimizer': 'adam', 'graph_mode': 'cutoff', 'cutoff': 0.8582889883204115, 'grm_norm': 'cosine', 'self_loops': False, 'use_snp_selection': True, 'num_snps': 25294}. Best is trial 88 with value: 0.370452562702736.
[I 2025-12-09 12:54:40,864] Trial 112 finished with value: 0.3673298277646756 and parameters: {'model_type': 'graphsage', 'hidden_dims': '[512, 256]', 'dropout': 0.34507867270912557, 'batch_norm': False, 'sage_aggr': 'mean', 'sage_normalize': False, 'sage_project': False, 'lr': 1.1810309380501463e-05, 'weight_decay': 0.0004054249213491079, 'epochs': 91, 'loss': 'mae', 'optimizer': 'adam', 'graph_mode': 'cutoff', 'cutoff': 0.8860500730425406, 'grm_norm': 'cosine', 'self_loops': False, 'use_snp_selection': True, 'num_snps': 28915}. Best is trial 88 with value: 0.370452562702736.
[I 2025-12-09 12:55:29,787] Trial 113 finished with value: 0.36392980188899376 and parameters: {'model_type': 'graphsage', 'hidden_dims': '[512, 256]', 'dropout': 0.34619642553914276, 'batch_norm': False, 'sage_aggr': 'mean', 'sage_normalize': False, 'sage_project': False, 'lr': 1.1208049775387315e-05, 'weight_decay': 0.0002361063791471488, 'epochs': 74, 'loss': 'mae', 'optimizer': 'adam', 'graph_mode': 'cutoff', 'cutoff': 0.8876241881332498, 'grm_norm': 'cosine', 'self_loops': False, 'use_snp_selection': True, 'num_snps': 29302}. Best is trial 88 with value: 0.370452562702736.
[I 2025-12-09 12:56:29,282] Trial 114 finished with value: 0.3659794792997827 and parameters: {'model_type': 'graphsage', 'hidden_dims': '[512, 256]', 'dropout': 0.3738292125312366, 'batch_norm': False, 'sage_aggr': 'mean', 'sage_normalize': False, 'sage_project': False, 'lr': 1.45359383277628e-05, 'weight_decay': 0.00014750213802750025, 'epochs': 119, 'loss': 'mae', 'optimizer': 'adam', 'graph_mode': 'cutoff', 'cutoff': 0.8508796213551082, 'grm_norm': 'cosine', 'self_loops': False, 'use_snp_selection': True, 'num_snps': 31293}. Best is trial 88 with value: 0.370452562702736.
[I 2025-12-09 12:57:28,266] Trial 115 finished with value: 0.3591125160781344 and parameters: {'model_type': 'graphsage', 'hidden_dims': '[512, 256]', 'dropout': 0.37033049313721794, 'batch_norm': False, 'sage_aggr': 'mean', 'sage_normalize': False, 'sage_project': False, 'lr': 2.489817264668298e-05, 'weight_decay': 0.0001395601741827052, 'epochs': 121, 'loss': 'mae', 'optimizer': 'adam', 'graph_mode': 'cutoff', 'cutoff': 0.8486630740959991, 'grm_norm': 'cosine', 'self_loops': False, 'use_snp_selection': True, 'num_snps': 30593}. Best is trial 88 with value: 0.370452562702736.
[I 2025-12-09 12:58:30,993] Trial 116 finished with value: 0.3646381404405123 and parameters: {'model_type': 'graphsage', 'hidden_dims': '[512, 256]', 'dropout': 0.3441022979682122, 'batch_norm': False, 'sage_aggr': 'mean', 'sage_normalize': False, 'sage_project': False, 'lr': 1.3795319719822373e-05, 'weight_decay': 0.00019727788414255977, 'epochs': 130, 'loss': 'mae', 'optimizer': 'adam', 'graph_mode': 'cutoff', 'cutoff': 0.8984289130422449, 'grm_norm': 'cosine', 'self_loops': False, 'use_snp_selection': True, 'num_snps': 32554}. Best is trial 88 with value: 0.370452562702736.
[I 2025-12-09 12:59:25,047] Trial 117 finished with value: 0.3650151948898732 and parameters: {'model_type': 'graphsage', 'hidden_dims': '[512, 256]', 'dropout': 0.3316604585662915, 'batch_norm': False, 'sage_aggr': 'mean', 'sage_normalize': False, 'sage_project': False, 'lr': 1.755572393824178e-05, 'weight_decay': 0.00015204039122999945, 'epochs': 106, 'loss': 'mae', 'optimizer': 'adam', 'graph_mode': 'cutoff', 'cutoff': 0.8394994296709538, 'grm_norm': 'cosine', 'self_loops': False, 'use_snp_selection': False}. Best is trial 88 with value: 0.370452562702736.
[I 2025-12-09 12:59:53,393] Trial 118 finished with value: 0.3386000764136955 and parameters: {'model_type': 'graphsage', 'hidden_dims': '[128, 64]', 'dropout': 0.3874201157423243, 'batch_norm': False, 'sage_aggr': 'mean', 'sage_normalize': True, 'sage_project': False, 'lr': 1.030593788672913e-05, 'weight_decay': 0.00015919661563483983, 'epochs': 137, 'loss': 'mae', 'optimizer': 'adam', 'graph_mode': 'cutoff', 'cutoff': 0.8409742110967607, 'grm_norm': 'cosine', 'self_loops': False, 'use_snp_selection': False}. Best is trial 88 with value: 0.370452562702736.
[I 2025-12-09 13:00:47,724] Trial 119 finished with value: 0.37453500651960414 and parameters: {'model_type': 'graphsage', 'hidden_dims': '[512, 256]', 'dropout': 0.32657159252201085, 'batch_norm': False, 'sage_aggr': 'mean', 'sage_normalize': False, 'sage_project': False, 'lr': 3.5211507209299076e-05, 'weight_decay': 9.624501087106055e-05, 'epochs': 107, 'loss': 'mse', 'optimizer': 'adam', 'graph_mode': 'cutoff', 'cutoff': 0.8786353136906393, 'grm_norm': 'cosine', 'self_loops': False, 'use_snp_selection': False}. Best is trial 119 with value: 0.37453500651960414.
[I 2025-12-09 13:01:42,063] Trial 120 finished with value: 0.0 and parameters: {'model_type': 'graphsage', 'hidden_dims': '[512, 256]', 'dropout': 0.35955989161662544, 'batch_norm': False, 'sage_aggr': 'mean', 'sage_normalize': False, 'sage_project': False, 'lr': 0.0078123644824184876, 'weight_decay': 6.861525525657225e-05, 'epochs': 107, 'loss': 'mse', 'optimizer': 'adam', 'graph_mode': 'cutoff', 'cutoff': 0.8796048222793834, 'grm_norm': 'cosine', 'self_loops': False, 'use_snp_selection': False}. Best is trial 119 with value: 0.37453500651960414.
[I 2025-12-09 13:02:43,394] Trial 121 finished with value: 0.36840909211028544 and parameters: {'model_type': 'graphsage', 'hidden_dims': '[512, 256]', 'dropout': 0.32653865512660846, 'batch_norm': False, 'sage_aggr': 'mean', 'sage_normalize': False, 'sage_project': False, 'lr': 3.3374958981458014e-05, 'weight_decay': 9.51480134933769e-05, 'epochs': 125, 'loss': 'mse', 'optimizer': 'adam', 'graph_mode': 'cutoff', 'cutoff': 0.8600000480933209, 'grm_norm': 'cosine', 'self_loops': False, 'use_snp_selection': False}. Best is trial 119 with value: 0.37453500651960414.
[I 2025-12-09 13:03:45,083] Trial 122 finished with value: 0.3607776741126735 and parameters: {'model_type': 'graphsage', 'hidden_dims': '[512, 256]', 'dropout': 0.3101946938469833, 'batch_norm': False, 'sage_aggr': 'mean', 'sage_normalize': False, 'sage_project': False, 'lr': 2.9516250981344607e-05, 'weight_decay': 9.41979977609976e-05, 'epochs': 126, 'loss': 'mse', 'optimizer': 'adam', 'graph_mode': 'cutoff', 'cutoff': 0.8607767189889861, 'grm_norm': 'cosine', 'self_loops': False, 'use_snp_selection': False}. Best is trial 119 with value: 0.37453500651960414.
[I 2025-12-09 13:04:44,046] Trial 123 finished with value: 0.1950299072835421 and parameters: {'model_type': 'graphsage', 'hidden_dims': '[512, 256]', 'dropout': 0.3256503956537192, 'batch_norm': False, 'sage_aggr': 'mean', 'sage_normalize': False, 'sage_project': False, 'lr': 0.0004774834148905364, 'weight_decay': 7.506242712478401e-05, 'epochs': 119, 'loss': 'mse', 'optimizer': 'adam', 'graph_mode': 'cutoff', 'cutoff': 0.8791030915279268, 'grm_norm': 'cosine', 'self_loops': False, 'use_snp_selection': False}. Best is trial 119 with value: 0.37453500651960414.
[I 2025-12-09 13:06:56,346] Trial 124 finished with value: 0.33611028675445354 and parameters: {'model_type': 'graphsage', 'hidden_dims': '[512, 256]', 'dropout': 0.29217386301715104, 'batch_norm': False, 'sage_aggr': 'mean', 'sage_normalize': False, 'sage_project': False, 'lr': 1.3136426730318514e-05, 'weight_decay': 0.00010710731205678077, 'epochs': 309, 'loss': 'mse', 'optimizer': 'adam', 'graph_mode': 'cutoff', 'cutoff': 0.8638893035689486, 'grm_norm': 'cosine', 'self_loops': False, 'use_snp_selection': False}. Best is trial 119 with value: 0.37453500651960414.
[I 2025-12-09 13:08:07,287] Trial 125 finished with value: 0.3579158475629451 and parameters: {'model_type': 'graphsage', 'hidden_dims': '[512, 256]', 'dropout': 0.30214611666603297, 'batch_norm': False, 'sage_aggr': 'mean', 'sage_normalize': False, 'sage_project': False, 'lr': 3.522774992200493e-05, 'weight_decay': 0.00014521666844088547, 'epochs': 150, 'loss': 'mse', 'optimizer': 'adam', 'graph_mode': 'cutoff', 'cutoff': 0.8447085376335899, 'grm_norm': 'cosine', 'self_loops': False, 'use_snp_selection': False}. Best is trial 119 with value: 0.37453500651960414.
[I 2025-12-09 13:08:59,724] Trial 126 finished with value: 0.36791365089339145 and parameters: {'model_type': 'graphsage', 'hidden_dims': '[512, 256]', 'dropout': 0.314927097132492, 'batch_norm': False, 'sage_aggr': 'mean', 'sage_normalize': False, 'sage_project': False, 'lr': 1.5912148933067697e-05, 'weight_decay': 0.00017583642191643502, 'epochs': 102, 'loss': 'mse', 'optimizer': 'adam', 'graph_mode': 'cutoff', 'cutoff': 0.8863489544729549, 'grm_norm': 'cosine', 'self_loops': True, 'use_snp_selection': False}. Best is trial 119 with value: 0.37453500651960414.
[I 2025-12-09 13:10:14,691] Trial 127 finished with value: 0.3410828129860888 and parameters: {'model_type': 'graphsage', 'hidden_dims': '[512, 128]', 'dropout': 0.5989614814241819, 'batch_norm': True, 'sage_aggr': 'mean', 'sage_normalize': False, 'sage_project': False, 'lr': 2.189899568800319e-05, 'weight_decay': 0.00019615638705532807, 'epochs': 159, 'loss': 'mse', 'optimizer': 'adam', 'graph_mode': 'cutoff', 'cutoff': 0.8871046899336537, 'grm_norm': 'cosine', 'self_loops': True, 'use_snp_selection': False}. Best is trial 119 with value: 0.37453500651960414.
[I 2025-12-09 13:11:37,976] Trial 128 finished with value: 0.3285822614218116 and parameters: {'model_type': 'graphsage', 'hidden_dims': '[512, 64]', 'dropout': 0.31411743458205155, 'batch_norm': False, 'sage_aggr': 'mean', 'sage_normalize': False, 'sage_project': False, 'lr': 1.4335909391804996e-05, 'weight_decay': 3.223723581894375e-05, 'epochs': 99, 'loss': 'mse', 'optimizer': 'adam', 'graph_mode': 'knn', 'knn_k': 7, 'weighted_edges': False, 'symmetrize_mode': 'union', 'self_loops': True, 'use_snp_selection': False}. Best is trial 119 with value: 0.37453500651960414.
[I 2025-12-09 13:12:46,580] Trial 129 finished with value: 0.35818179535977296 and parameters: {'model_type': 'graphsage', 'hidden_dims': '[512, 256]', 'dropout': 0.37348004133641943, 'batch_norm': False, 'sage_aggr': 'mean', 'sage_normalize': False, 'sage_project': False, 'lr': 4.6654309105748414e-05, 'weight_decay': 0.00028249350861873164, 'epochs': 144, 'loss': 'mse', 'optimizer': 'adam', 'graph_mode': 'cutoff', 'cutoff': 0.8225222868476215, 'grm_norm': 'cosine', 'self_loops': True, 'use_snp_selection': False}. Best is trial 119 with value: 0.37453500651960414.
[I 2025-12-09 13:13:43,626] Trial 130 finished with value: 0.3646053442297613 and parameters: {'model_type': 'graphsage', 'hidden_dims': '[512, 256]', 'dropout': 0.39948843083463204, 'batch_norm': False, 'sage_aggr': 'mean', 'sage_normalize': False, 'sage_project': False, 'lr': 1.568340518062574e-05, 'weight_decay': 6.081819842931139e-05, 'epochs': 114, 'loss': 'mse', 'optimizer': 'adam', 'graph_mode': 'cutoff', 'cutoff': 0.863109397564777, 'grm_norm': 'cosine', 'self_loops': True, 'use_snp_selection': False}. Best is trial 119 with value: 0.37453500651960414.
[I 2025-12-09 13:14:38,397] Trial 131 finished with value: 0.36766198677726086 and parameters: {'model_type': 'graphsage', 'hidden_dims': '[512, 256]', 'dropout': 0.32234476191599504, 'batch_norm': False, 'sage_aggr': 'mean', 'sage_normalize': False, 'sage_project': False, 'lr': 1.772915751892352e-05, 'weight_decay': 0.00017426977706056575, 'epochs': 108, 'loss': 'mse', 'optimizer': 'adam', 'graph_mode': 'cutoff', 'cutoff': 0.8991566686151898, 'grm_norm': 'cosine', 'self_loops': True, 'use_snp_selection': False}. Best is trial 119 with value: 0.37453500651960414.
[I 2025-12-09 13:15:38,535] Trial 132 finished with value: 0.365004599125635 and parameters: {'model_type': 'graphsage', 'hidden_dims': '[512, 256]', 'dropout': 0.28212478813147246, 'batch_norm': False, 'sage_aggr': 'mean', 'sage_normalize': False, 'sage_project': False, 'lr': 2.569135765540056e-05, 'weight_decay': 0.000224430596339526, 'epochs': 122, 'loss': 'mse', 'optimizer': 'adam', 'graph_mode': 'cutoff', 'cutoff': 0.8878027888899992, 'grm_norm': 'cosine', 'self_loops': True, 'use_snp_selection': False}. Best is trial 119 with value: 0.37453500651960414.
[I 2025-12-09 13:16:27,882] Trial 133 finished with value: 0.36981125445657864 and parameters: {'model_type': 'graphsage', 'hidden_dims': '[512, 256]', 'dropout': 0.3512953620909163, 'batch_norm': False, 'sage_aggr': 'mean', 'sage_normalize': False, 'sage_project': False, 'lr': 1.9727599064861783e-05, 'weight_decay': 8.972297062920328e-05, 'epochs': 94, 'loss': 'mse', 'optimizer': 'adam', 'graph_mode': 'cutoff', 'cutoff': 0.8678929515650015, 'grm_norm': 'cosine', 'self_loops': True, 'use_snp_selection': False}. Best is trial 119 with value: 0.37453500651960414.
[I 2025-12-09 13:17:20,311] Trial 134 finished with value: 0.3637396814771843 and parameters: {'model_type': 'graphsage', 'hidden_dims': '[512, 256]', 'dropout': 0.3216985777583783, 'batch_norm': False, 'sage_aggr': 'mean', 'sage_normalize': False, 'sage_project': False, 'lr': 2.0135295928834266e-05, 'weight_decay': 0.00043667748351403296, 'epochs': 102, 'loss': 'mse', 'optimizer': 'adam', 'graph_mode': 'cutoff', 'cutoff': 0.8969135567511617, 'grm_norm': 'cosine', 'self_loops': True, 'use_snp_selection': False}. Best is trial 119 with value: 0.37453500651960414.
[I 2025-12-09 13:18:17,365] Trial 135 finished with value: 0.36455289846284045 and parameters: {'model_type': 'graphsage', 'hidden_dims': '[512, 256]', 'dropout': 0.35488683580075453, 'batch_norm': False, 'sage_aggr': 'mean', 'sage_normalize': False, 'sage_project': False, 'lr': 1.2724605417368714e-05, 'weight_decay': 0.00016734647283401282, 'epochs': 114, 'loss': 'mse', 'optimizer': 'adam', 'graph_mode': 'cutoff', 'cutoff': 0.8700898382769079, 'grm_norm': 'cosine', 'self_loops': True, 'use_snp_selection': False}. Best is trial 119 with value: 0.37453500651960414.
[I 2025-12-09 13:19:06,296] Trial 136 finished with value: 0.3702862416527939 and parameters: {'model_type': 'graphsage', 'hidden_dims': '[512, 256]', 'dropout': 0.3320508600631145, 'batch_norm': False, 'sage_aggr': 'mean', 'sage_normalize': False, 'sage_project': False, 'lr': 1.4487984407425841e-05, 'weight_decay': 0.00012425722612209768, 'epochs': 93, 'loss': 'mse', 'optimizer': 'adam', 'graph_mode': 'cutoff', 'cutoff': 0.8557964936960749, 'grm_norm': 'cosine', 'self_loops': True, 'use_snp_selection': False}. Best is trial 119 with value: 0.37453500651960414.
[I 2025-12-09 13:19:54,868] Trial 137 finished with value: 0.3670542909208211 and parameters: {'model_type': 'graphsage', 'hidden_dims': '[512, 256]', 'dropout': 0.33153265016041616, 'batch_norm': False, 'sage_aggr': 'mean', 'sage_normalize': False, 'sage_project': False, 'lr': 1.6518155565039342e-05, 'weight_decay': 0.00011481358921374068, 'epochs': 92, 'loss': 'mse', 'optimizer': 'adam', 'graph_mode': 'cutoff', 'cutoff': 0.8554008500471689, 'grm_norm': 'cosine', 'self_loops': True, 'use_snp_selection': False}. Best is trial 119 with value: 0.37453500651960414.
[I 2025-12-09 13:20:25,695] Trial 138 finished with value: 0.3696956953385178 and parameters: {'model_type': 'graphsage', 'hidden_dims': '[256, 128, 64]', 'dropout': 0.332313523494674, 'batch_norm': False, 'sage_aggr': 'mean', 'sage_normalize': False, 'sage_project': False, 'lr': 1.00113090901488e-05, 'weight_decay': 0.00011984950663891849, 'epochs': 92, 'loss': 'mse', 'optimizer': 'adam', 'graph_mode': 'cutoff', 'cutoff': 0.8993626739306828, 'grm_norm': 'cosine', 'self_loops': True, 'use_snp_selection': False}. Best is trial 119 with value: 0.37453500651960414.
[I 2025-12-09 13:20:56,938] Trial 139 finished with value: 0.36988878554116467 and parameters: {'model_type': 'graphsage', 'hidden_dims': '[256, 128, 64]', 'dropout': 0.2979420512123342, 'batch_norm': False, 'sage_aggr': 'mean', 'sage_normalize': False, 'sage_project': False, 'lr': 1.0081207717543255e-05, 'weight_decay': 7.656495561988161e-05, 'epochs': 94, 'loss': 'mse', 'optimizer': 'adam', 'graph_mode': 'cutoff', 'cutoff': 0.8982608816667407, 'grm_norm': 'cosine', 'self_loops': True, 'use_snp_selection': False}. Best is trial 119 with value: 0.37453500651960414.
[I 2025-12-09 13:21:28,140] Trial 140 finished with value: 0.3469545971525117 and parameters: {'model_type': 'graphsage', 'hidden_dims': '[256, 128, 64]', 'dropout': 0.2974001733102317, 'batch_norm': False, 'sage_aggr': 'mean', 'sage_normalize': True, 'sage_project': False, 'lr': 1.0008075990228199e-05, 'weight_decay': 8.468645422688212e-05, 'epochs': 93, 'loss': 'mse', 'optimizer': 'adam', 'graph_mode': 'cutoff', 'cutoff': 0.8976015607848433, 'grm_norm': 'cosine_then_gcn', 'self_loops': True, 'use_snp_selection': False}. Best is trial 119 with value: 0.37453500651960414.
[I 2025-12-09 13:21:59,805] Trial 141 finished with value: 0.37510286724679653 and parameters: {'model_type': 'graphsage', 'hidden_dims': '[256, 128, 64]', 'dropout': 0.3309353950944217, 'batch_norm': False, 'sage_aggr': 'mean', 'sage_normalize': False, 'sage_project': False, 'lr': 1.1667152909008074e-05, 'weight_decay': 0.00011262691581584425, 'epochs': 96, 'loss': 'mse', 'optimizer': 'adam', 'graph_mode': 'cutoff', 'cutoff': 0.8872234355184652, 'grm_norm': 'cosine', 'self_loops': True, 'use_snp_selection': False}. Best is trial 141 with value: 0.37510286724679653.
[I 2025-12-09 13:22:30,609] Trial 142 finished with value: 0.36439032832160095 and parameters: {'model_type': 'graphsage', 'hidden_dims': '[256, 128, 64]', 'dropout': 0.3335463929474702, 'batch_norm': False, 'sage_aggr': 'mean', 'sage_normalize': False, 'sage_project': False, 'lr': 1.1524707003140013e-05, 'weight_decay': 0.00011294633110985316, 'epochs': 92, 'loss': 'mse', 'optimizer': 'adam', 'graph_mode': 'cutoff', 'cutoff': 0.8820481812889903, 'grm_norm': 'cosine', 'self_loops': True, 'use_snp_selection': False}. Best is trial 141 with value: 0.37510286724679653.
