[I 2025-12-08 16:59:20,034] Trial 41 finished with value: 0.28852673267280976 and parameters: {'model_type': 'graphsage', 'hidden_dims': '[512, 64]', 'dropout': 0.10067756352880261, 'batch_norm': True, 'sage_aggr': 'mean', 'sage_normalize': False, 'sage_project': False, 'lr': 0.000350734509846861, 'weight_decay': 1.2903132403288242e-06, 'epochs': 126, 'loss': 'mae', 'optimizer': 'adam', 'graph_mode': 'cutoff', 'cutoff': 0.4797854427600242, 'grm_norm': 'cosine', 'self_loops': False, 'use_snp_selection': True, 'num_snps': 30169}. Best is trial 20 with value: 0.293397987427608.
[I 2025-12-08 17:00:45,252] Trial 42 finished with value: 0.29502818224896277 and parameters: {'model_type': 'graphsage', 'hidden_dims': '[512, 256]', 'dropout': 0.15024072473513572, 'batch_norm': True, 'sage_aggr': 'mean', 'sage_normalize': False, 'sage_project': False, 'lr': 0.00021303526058234204, 'weight_decay': 6.220479333274535e-07, 'epochs': 151, 'loss': 'mae', 'optimizer': 'adam', 'graph_mode': 'cutoff', 'cutoff': 0.36774681532315157, 'grm_norm': 'cosine', 'self_loops': False, 'use_snp_selection': True, 'num_snps': 34025}. Best is trial 42 with value: 0.29502818224896277.
[I 2025-12-08 17:02:32,886] Trial 43 finished with value: 0.2921405854963036 and parameters: {'model_type': 'graphsage', 'hidden_dims': '[512, 256]', 'dropout': 0.16950581819111318, 'batch_norm': True, 'sage_aggr': 'mean', 'sage_normalize': False, 'sage_project': False, 'lr': 0.00011433149507297647, 'weight_decay': 1.9217110594612558e-07, 'epochs': 156, 'loss': 'mae', 'optimizer': 'adam', 'graph_mode': 'cutoff', 'cutoff': 0.2837293995944815, 'grm_norm': 'cosine', 'self_loops': False, 'use_snp_selection': True, 'num_snps': 35291}. Best is trial 42 with value: 0.29502818224896277.
[I 2025-12-08 17:04:18,584] Trial 44 finished with value: 0.2950136062088946 and parameters: {'model_type': 'graphsage', 'hidden_dims': '[512, 256]', 'dropout': 0.16814602140571228, 'batch_norm': True, 'sage_aggr': 'mean', 'sage_normalize': False, 'sage_project': False, 'lr': 0.00021279959410732313, 'weight_decay': 1.8046448664708175e-07, 'epochs': 147, 'loss': 'mae', 'optimizer': 'adam', 'graph_mode': 'cutoff', 'cutoff': 0.2637485120562113, 'grm_norm': 'cosine', 'self_loops': False, 'use_snp_selection': True, 'num_snps': 33683}. Best is trial 42 with value: 0.29502818224896277.
[I 2025-12-08 17:06:11,674] Trial 45 finished with value: 0.27822932457321875 and parameters: {'model_type': 'graphsage', 'hidden_dims': '[512, 256]', 'dropout': 0.17589264475545724, 'batch_norm': True, 'sage_aggr': 'max', 'sage_normalize': True, 'sage_project': False, 'lr': 0.00010761507085303147, 'weight_decay': 1.9527344992371682e-07, 'epochs': 158, 'loss': 'mae', 'optimizer': 'adam', 'graph_mode': 'cutoff', 'cutoff': 0.2799015528805398, 'grm_norm': 'cosine', 'self_loops': False, 'use_snp_selection': True, 'num_snps': 34221}. Best is trial 42 with value: 0.29502818224896277.
[I 2025-12-08 17:08:17,400] Trial 46 finished with value: 0.29416312412089624 and parameters: {'model_type': 'graphsage', 'hidden_dims': '[512, 256]', 'dropout': 0.1463120718198206, 'batch_norm': True, 'sage_aggr': 'mean', 'sage_normalize': False, 'sage_project': False, 'lr': 0.00018960552685899716, 'weight_decay': 1.1276773970250676e-07, 'epochs': 151, 'loss': 'mae', 'optimizer': 'adam', 'graph_mode': 'cutoff', 'cutoff': 0.28845923535216555, 'grm_norm': 'cosine', 'self_loops': False, 'use_snp_selection': True, 'num_snps': 42516}. Best is trial 42 with value: 0.29502818224896277.
[I 2025-12-08 17:10:43,221] Trial 47 finished with value: 0.2864040902835121 and parameters: {'model_type': 'graphsage', 'hidden_dims': '[512, 256]', 'dropout': 0.37026101489225055, 'batch_norm': True, 'sage_aggr': 'mean', 'sage_normalize': False, 'sage_project': False, 'lr': 0.00018656988731440837, 'weight_decay': 1.209452805763837e-07, 'epochs': 102, 'loss': 'mae', 'optimizer': 'adam', 'graph_mode': 'knn', 'knn_k': 10, 'weighted_edges': True, 'symmetrize_mode': 'union', 'self_loops': False, 'use_snp_selection': True, 'num_snps': 42359}. Best is trial 42 with value: 0.29502818224896277.
[I 2025-12-08 17:13:03,853] Trial 48 finished with value: 0.2881240580588119 and parameters: {'model_type': 'graphsage', 'hidden_dims': '[512, 256]', 'dropout': 0.2861696163833837, 'batch_norm': True, 'sage_aggr': 'mean', 'sage_normalize': False, 'sage_project': False, 'lr': 0.000457048493563984, 'weight_decay': 2.2634731262559813e-07, 'epochs': 147, 'loss': 'mse', 'optimizer': 'adam', 'graph_mode': 'cutoff', 'cutoff': 0.28256802293010225, 'grm_norm': 'cosine', 'self_loops': False, 'use_snp_selection': True, 'num_snps': 47774}. Best is trial 42 with value: 0.29502818224896277.
[I 2025-12-08 17:17:08,522] Trial 49 finished with value: 0.2535796176218003 and parameters: {'model_type': 'graphsage', 'hidden_dims': '[512, 256]', 'dropout': 0.1688648980170265, 'batch_norm': True, 'sage_aggr': 'max', 'sage_normalize': True, 'sage_project': False, 'lr': 0.00035189090227578793, 'weight_decay': 1.0003286496460512e-07, 'epochs': 215, 'loss': 'mae', 'optimizer': 'adam', 'graph_mode': 'cutoff', 'cutoff': 0.24620515952587566, 'grm_norm': 'cosine', 'self_loops': False, 'use_snp_selection': True, 'num_snps': 51673}. Best is trial 42 with value: 0.29502818224896277.
[I 2025-12-08 17:22:44,664] Trial 50 finished with value: 0.28261241080172567 and parameters: {'model_type': 'graphsage', 'hidden_dims': '[512, 256]', 'dropout': 0.269895748368445, 'batch_norm': False, 'sage_aggr': 'mean', 'sage_normalize': False, 'sage_project': False, 'lr': 0.0001087647638832639, 'weight_decay': 2.557865146808544e-07, 'epochs': 350, 'loss': 'mae', 'optimizer': 'adam', 'graph_mode': 'knn', 'knn_k': 7, 'weighted_edges': True, 'symmetrize_mode': 'union', 'self_loops': False, 'use_snp_selection': True, 'num_snps': 45281}. Best is trial 42 with value: 0.29502818224896277.
[I 2025-12-08 17:24:07,041] Trial 51 finished with value: 0.2902429187921619 and parameters: {'model_type': 'graphsage', 'hidden_dims': '[512, 256]', 'dropout': 0.1391373638769806, 'batch_norm': True, 'sage_aggr': 'mean', 'sage_normalize': False, 'sage_project': False, 'lr': 0.0001950092064648065, 'weight_decay': 1.6930885559154147e-07, 'epochs': 155, 'loss': 'mae', 'optimizer': 'adam', 'graph_mode': 'cutoff', 'cutoff': 0.2989574469187773, 'grm_norm': 'cosine', 'self_loops': False, 'use_snp_selection': True, 'num_snps': 27809}. Best is trial 42 with value: 0.29502818224896277.
[I 2025-12-08 17:25:57,762] Trial 52 finished with value: 0.3010667019795393 and parameters: {'model_type': 'graphsage', 'hidden_dims': '[512, 256]', 'dropout': 0.11848249279961083, 'batch_norm': True, 'sage_aggr': 'mean', 'sage_normalize': False, 'sage_project': False, 'lr': 0.00011809266798663764, 'weight_decay': 6.323170849972907e-07, 'epochs': 187, 'loss': 'mae', 'optimizer': 'adam', 'graph_mode': 'cutoff', 'cutoff': 0.40156209303574125, 'grm_norm': 'cosine', 'self_loops': False, 'use_snp_selection': True, 'num_snps': 40933}. Best is trial 52 with value: 0.3010667019795393.
[I 2025-12-08 17:27:53,452] Trial 53 finished with value: 0.2920290872701062 and parameters: {'model_type': 'graphsage', 'hidden_dims': '[512, 256]', 'dropout': 0.2311713464273295, 'batch_norm': True, 'sage_aggr': 'mean', 'sage_normalize': False, 'sage_project': False, 'lr': 0.0001253167572406334, 'weight_decay': 6.704733532057952e-07, 'epochs': 185, 'loss': 'mae', 'optimizer': 'adam', 'graph_mode': 'cutoff', 'cutoff': 0.4001857498894652, 'grm_norm': 'cosine', 'self_loops': False, 'use_snp_selection': True, 'num_snps': 41452}. Best is trial 52 with value: 0.3010667019795393.
[I 2025-12-08 17:30:23,259] Trial 54 finished with value: 0.2899955897805386 and parameters: {'model_type': 'graphsage', 'hidden_dims': '[512, 256]', 'dropout': 0.16272051931155135, 'batch_norm': True, 'sage_aggr': 'mean', 'sage_normalize': False, 'sage_project': False, 'lr': 0.0001988622179608869, 'weight_decay': 3.9986926127984445e-07, 'epochs': 188, 'loss': 'mse', 'optimizer': 'adam', 'graph_mode': 'cutoff', 'cutoff': 0.24956953511133878, 'grm_norm': 'cosine', 'self_loops': False, 'use_snp_selection': True, 'num_snps': 37260}. Best is trial 52 with value: 0.3010667019795393.
[I 2025-12-08 17:31:40,165] Trial 55 finished with value: 0.29751348207582423 and parameters: {'model_type': 'graphsage', 'hidden_dims': '[512, 256]', 'dropout': 0.12152887242442628, 'batch_norm': True, 'sage_aggr': 'mean', 'sage_normalize': False, 'sage_project': False, 'lr': 4.7189042281921974e-05, 'weight_decay': 4.633366766973117e-05, 'epochs': 93, 'loss': 'mae', 'optimizer': 'adam', 'graph_mode': 'cutoff', 'cutoff': 0.37933122502763644, 'grm_norm': 'gcn', 'self_loops': False, 'use_snp_selection': True, 'num_snps': 40036}. Best is trial 52 with value: 0.3010667019795393.
[I 2025-12-08 17:32:48,716] Trial 56 finished with value: 0.28396869098831246 and parameters: {'model_type': 'graphsage', 'hidden_dims': '[256, 128]', 'dropout': 0.11273057292488964, 'batch_norm': True, 'sage_aggr': 'max', 'sage_normalize': False, 'sage_project': False, 'lr': 6.0006801263750805e-05, 'weight_decay': 4.153923721114909e-05, 'epochs': 102, 'loss': 'mae', 'optimizer': 'adam', 'graph_mode': 'cutoff', 'cutoff': 0.451479086132847, 'grm_norm': 'gcn', 'self_loops': False, 'use_snp_selection': True, 'num_snps': 41357}. Best is trial 52 with value: 0.3010667019795393.
[I 2025-12-08 17:34:06,623] Trial 57 finished with value: 0.25827958625404196 and parameters: {'model_type': 'graphsage', 'hidden_dims': '[512, 256]', 'dropout': 0.13950797941506782, 'batch_norm': False, 'sage_aggr': 'mean', 'sage_normalize': False, 'sage_project': False, 'lr': 1.8196791474204023e-05, 'weight_decay': 2.7443034454918256e-05, 'epochs': 113, 'loss': 'mae', 'optimizer': 'adam', 'graph_mode': 'knn', 'knn_k': 5, 'weighted_edges': True, 'symmetrize_mode': 'union', 'self_loops': False, 'use_snp_selection': False}. Best is trial 52 with value: 0.3010667019795393.
[I 2025-12-08 17:35:44,649] Trial 58 finished with value: 0.28260955185781284 and parameters: {'model_type': 'graphsage', 'hidden_dims': '[512, 256]', 'dropout': 0.10043630428031972, 'batch_norm': True, 'sage_aggr': 'mean', 'sage_normalize': False, 'sage_project': False, 'lr': 4.0385621097975345e-05, 'weight_decay': 1.2959225496709515e-05, 'epochs': 90, 'loss': 'mse', 'optimizer': 'adam', 'graph_mode': 'cutoff', 'cutoff': 0.3706942618841653, 'grm_norm': 'gcn', 'self_loops': False, 'use_snp_selection': True, 'num_snps': 54661}. Best is trial 52 with value: 0.3010667019795393.
[I 2025-12-08 17:36:54,062] Trial 59 finished with value: 0.28808800041006527 and parameters: {'model_type': 'graphsage', 'hidden_dims': '[512, 256]', 'dropout': 0.14825818513472427, 'batch_norm': True, 'sage_aggr': 'mean', 'sage_normalize': False, 'sage_project': False, 'lr': 0.00032518356058560104, 'weight_decay': 7.59510402574371e-05, 'epochs': 55, 'loss': 'mae', 'optimizer': 'adam', 'graph_mode': 'cutoff', 'cutoff': 0.31830276647542427, 'grm_norm': 'gcn', 'self_loops': False, 'use_snp_selection': True, 'num_snps': 43505}. Best is trial 52 with value: 0.3010667019795393.
[I 2025-12-08 17:38:56,595] Trial 60 finished with value: 0.287531887094195 and parameters: {'model_type': 'graphsage', 'hidden_dims': '[512, 256]', 'dropout': 0.49142603668610674, 'batch_norm': True, 'sage_aggr': 'mean', 'sage_normalize': False, 'sage_project': False, 'lr': 2.3593821339161206e-05, 'weight_decay': 2.1775832967986826e-05, 'epochs': 211, 'loss': 'mae', 'optimizer': 'adam', 'graph_mode': 'cutoff', 'cutoff': 0.3539267833999379, 'grm_norm': 'cosine_then_gcn', 'self_loops': False, 'use_snp_selection': True, 'num_snps': 38441}. Best is trial 52 with value: 0.3010667019795393.
[I 2025-12-08 17:40:23,037] Trial 61 finished with value: 0.2949531331236905 and parameters: {'model_type': 'graphsage', 'hidden_dims': '[512, 256]', 'dropout': 0.17365684314555027, 'batch_norm': True, 'sage_aggr': 'mean', 'sage_normalize': False, 'sage_project': False, 'lr': 0.00011939507930905339, 'weight_decay': 1.3095935356105314e-07, 'epochs': 149, 'loss': 'mae', 'optimizer': 'adam', 'graph_mode': 'cutoff', 'cutoff': 0.40515410665529067, 'grm_norm': 'cosine', 'self_loops': False, 'use_snp_selection': True, 'num_snps': 35638}. Best is trial 52 with value: 0.3010667019795393.
[I 2025-12-08 17:42:15,737] Trial 62 finished with value: 0.293180896386677 and parameters: {'model_type': 'graphsage', 'hidden_dims': '[512, 256]', 'dropout': 0.20585607858321986, 'batch_norm': True, 'sage_aggr': 'mean', 'sage_normalize': False, 'sage_project': False, 'lr': 0.00016471562025913492, 'weight_decay': 1.312256393071726e-07, 'epochs': 141, 'loss': 'mae', 'optimizer': 'adam', 'graph_mode': 'cutoff', 'cutoff': 0.40056007045268893, 'grm_norm': 'gcn', 'self_loops': False, 'use_snp_selection': True, 'num_snps': 47711}. Best is trial 52 with value: 0.3010667019795393.
[I 2025-12-08 17:44:04,939] Trial 63 finished with value: 0.29977825218747495 and parameters: {'model_type': 'graphsage', 'hidden_dims': '[512, 256]', 'dropout': 0.1535835355981253, 'batch_norm': True, 'sage_aggr': 'mean', 'sage_normalize': False, 'sage_project': False, 'lr': 4.41221302513345e-05, 'weight_decay': 1.0550710503388665e-07, 'epochs': 135, 'loss': 'mae', 'optimizer': 'adam', 'graph_mode': 'cutoff', 'cutoff': 0.44536112370859815, 'grm_norm': 'cosine', 'self_loops': False, 'use_snp_selection': True, 'num_snps': 45128}. Best is trial 52 with value: 0.3010667019795393.
[I 2025-12-08 17:45:23,962] Trial 64 finished with value: 0.2928333316288966 and parameters: {'model_type': 'graphsage', 'hidden_dims': '[512, 256]', 'dropout': 0.11951694921150774, 'batch_norm': True, 'sage_aggr': 'mean', 'sage_normalize': False, 'sage_project': False, 'lr': 4.2587229935834076e-05, 'weight_decay': 1.025413259182202e-07, 'epochs': 111, 'loss': 'mae', 'optimizer': 'adam', 'graph_mode': 'cutoff', 'cutoff': 0.44878147533039586, 'grm_norm': 'cosine', 'self_loops': False, 'use_snp_selection': True, 'num_snps': 39392}. Best is trial 52 with value: 0.3010667019795393.
[I 2025-12-08 17:46:53,539] Trial 65 finished with value: 0.2669371182603183 and parameters: {'model_type': 'graphsage', 'hidden_dims': '[512, 256]', 'dropout': 0.18097135980309456, 'batch_norm': False, 'sage_aggr': 'mean', 'sage_normalize': False, 'sage_project': False, 'lr': 6.428348813617347e-05, 'weight_decay': 3.515433137408979e-07, 'epochs': 128, 'loss': 'mae', 'optimizer': 'adam', 'graph_mode': 'cutoff', 'cutoff': 0.4197687324272952, 'grm_norm': 'cosine', 'self_loops': False, 'use_snp_selection': True, 'num_snps': 40312}. Best is trial 52 with value: 0.3010667019795393.
[I 2025-12-08 17:47:27,143] Trial 66 finished with value: 0.25776265092283557 and parameters: {'model_type': 'graphsage', 'hidden_dims': '[512, 256]', 'dropout': 0.21746691805519025, 'batch_norm': True, 'sage_aggr': 'mean', 'sage_normalize': False, 'sage_project': False, 'lr': 3.44512787113528e-05, 'weight_decay': 2.6710696079693746e-07, 'epochs': 174, 'loss': 'mae', 'optimizer': 'adam', 'graph_mode': 'cutoff', 'cutoff': 0.3154973137309915, 'grm_norm': 'cosine', 'self_loops': False, 'use_snp_selection': True, 'num_snps': 3520}. Best is trial 52 with value: 0.3010667019795393.
[I 2025-12-08 17:48:27,197] Trial 67 finished with value: 0.2710565711658871 and parameters: {'model_type': 'graphsage', 'hidden_dims': '[256, 128]', 'dropout': 0.15621697188031863, 'batch_norm': True, 'sage_aggr': 'max', 'sage_normalize': True, 'sage_project': False, 'lr': 0.0002117339678755586, 'weight_decay': 1.6121933077857475e-07, 'epochs': 89, 'loss': 'mae', 'optimizer': 'adam', 'graph_mode': 'cutoff', 'cutoff': 0.3546755886947637, 'grm_norm': 'cosine', 'self_loops': False, 'use_snp_selection': True, 'num_snps': 34145}. Best is trial 52 with value: 0.3010667019795393.
[I 2025-12-08 17:50:37,796] Trial 68 finished with value: 0.28953333357955635 and parameters: {'model_type': 'graphsage', 'hidden_dims': '[512, 256]', 'dropout': 0.1848894441459791, 'batch_norm': True, 'sage_aggr': 'mean', 'sage_normalize': False, 'sage_project': False, 'lr': 5.068701464452039e-05, 'weight_decay': 1.3391181911726842e-07, 'epochs': 152, 'loss': 'mae', 'optimizer': 'adam', 'graph_mode': 'knn', 'knn_k': 8, 'weighted_edges': True, 'symmetrize_mode': 'union', 'self_loops': False, 'use_snp_selection': False}. Best is trial 52 with value: 0.3010667019795393.
[I 2025-12-08 17:52:43,278] Trial 69 finished with value: 0.29597976992449915 and parameters: {'model_type': 'graphsage', 'hidden_dims': '[512, 128]', 'dropout': 0.11674731321121311, 'batch_norm': True, 'sage_aggr': 'mean', 'sage_normalize': False, 'sage_project': False, 'lr': 0.00013837150110268315, 'weight_decay': 4.725711238033402e-07, 'epochs': 231, 'loss': 'mse', 'optimizer': 'adam', 'graph_mode': 'cutoff', 'cutoff': 0.49994055328993764, 'grm_norm': 'cosine', 'self_loops': False, 'use_snp_selection': True, 'num_snps': 42783}. Best is trial 52 with value: 0.3010667019795393.
[I 2025-12-08 17:54:38,184] Trial 70 finished with value: 0.2806329741492969 and parameters: {'model_type': 'graphsage', 'hidden_dims': '[512, 128]', 'dropout': 0.11488226129936434, 'batch_norm': True, 'sage_aggr': 'mean', 'sage_normalize': False, 'sage_project': False, 'lr': 0.009234859483799545, 'weight_decay': 6.07517647283383e-07, 'epochs': 249, 'loss': 'mse', 'optimizer': 'adam', 'graph_mode': 'cutoff', 'cutoff': 0.5006110763133319, 'grm_norm': 'cosine_then_gcn', 'self_loops': False, 'use_snp_selection': True, 'num_snps': 37681}. Best is trial 52 with value: 0.3010667019795393.
[I 2025-12-08 17:56:55,212] Trial 71 finished with value: 0.28796315620701995 and parameters: {'model_type': 'graphsage', 'hidden_dims': '[512, 128]', 'dropout': 0.14581924707133703, 'batch_norm': True, 'sage_aggr': 'mean', 'sage_normalize': False, 'sage_project': False, 'lr': 1.3618668295364217e-05, 'weight_decay': 2.3099521503211517e-07, 'epochs': 234, 'loss': 'mse', 'optimizer': 'adam', 'graph_mode': 'cutoff', 'cutoff': 0.46256128703842464, 'grm_norm': 'cosine', 'self_loops': False, 'use_snp_selection': True, 'num_snps': 42867}. Best is trial 52 with value: 0.3010667019795393.
[I 2025-12-08 17:59:38,882] Trial 72 finished with value: 0.298107970237349 and parameters: {'model_type': 'graphsage', 'hidden_dims': '[512, 128]', 'dropout': 0.12115600099524536, 'batch_norm': True, 'sage_aggr': 'mean', 'sage_normalize': False, 'sage_project': False, 'lr': 0.00013484287846881422, 'weight_decay': 4.428813156901493e-07, 'epochs': 281, 'loss': 'mse', 'optimizer': 'adam', 'graph_mode': 'cutoff', 'cutoff': 0.42956326055568506, 'grm_norm': 'cosine', 'self_loops': False, 'use_snp_selection': True, 'num_snps': 44806}. Best is trial 52 with value: 0.3010667019795393.
[I 2025-12-08 18:02:36,889] Trial 73 finished with value: 0.29409363242170816 and parameters: {'model_type': 'graphsage', 'hidden_dims': '[512, 128]', 'dropout': 0.11680355262090934, 'batch_norm': True, 'sage_aggr': 'mean', 'sage_normalize': False, 'sage_project': False, 'lr': 0.0001464540904734697, 'weight_decay': 8.751338143753711e-07, 'epochs': 302, 'loss': 'mse', 'optimizer': 'adam', 'graph_mode': 'cutoff', 'cutoff': 0.43041204647352466, 'grm_norm': 'cosine', 'self_loops': False, 'use_snp_selection': True, 'num_snps': 45153}. Best is trial 52 with value: 0.3010667019795393.
[I 2025-12-08 18:04:57,228] Trial 74 finished with value: 0.29503611665716045 and parameters: {'model_type': 'graphsage', 'hidden_dims': '[512, 128]', 'dropout': 0.132259694767619, 'batch_norm': True, 'sage_aggr': 'mean', 'sage_normalize': False, 'sage_project': False, 'lr': 9.931343411904783e-05, 'weight_decay': 4.19896415404409e-07, 'epochs': 263, 'loss': 'mse', 'optimizer': 'adam', 'graph_mode': 'cutoff', 'cutoff': 0.8141390824592337, 'grm_norm': 'gcn', 'self_loops': False, 'use_snp_selection': True, 'num_snps': 51938}. Best is trial 52 with value: 0.3010667019795393.
[I 2025-12-08 18:07:33,128] Trial 75 finished with value: 0.2959922553400708 and parameters: {'model_type': 'graphsage', 'hidden_dims': '[512, 128]', 'dropout': 0.12192028722184714, 'batch_norm': True, 'sage_aggr': 'mean', 'sage_normalize': False, 'sage_project': False, 'lr': 9.816627603728391e-05, 'weight_decay': 4.643241179681456e-07, 'epochs': 291, 'loss': 'mse', 'optimizer': 'adam', 'graph_mode': 'cutoff', 'cutoff': 0.7870072399946755, 'grm_norm': 'gcn', 'self_loops': False, 'use_snp_selection': True, 'num_snps': 52976}. Best is trial 52 with value: 0.3010667019795393.
[I 2025-12-08 18:09:59,132] Trial 76 finished with value: 0.2916160519740433 and parameters: {'model_type': 'graphsage', 'hidden_dims': '[512, 128]', 'dropout': 0.12842890092961914, 'batch_norm': True, 'sage_aggr': 'mean', 'sage_normalize': False, 'sage_project': False, 'lr': 7.185240009499768e-05, 'weight_decay': 4.719954249384467e-07, 'epochs': 278, 'loss': 'mse', 'optimizer': 'adam', 'graph_mode': 'cutoff', 'cutoff': 0.818961851787176, 'grm_norm': 'gcn', 'self_loops': False, 'use_snp_selection': True, 'num_snps': 51931}. Best is trial 52 with value: 0.3010667019795393.
[I 2025-12-08 18:12:40,745] Trial 77 finished with value: 0.2797898317712933 and parameters: {'model_type': 'graphsage', 'hidden_dims': '[512, 128]', 'dropout': 0.10398682310294073, 'batch_norm': False, 'sage_aggr': 'mean', 'sage_normalize': False, 'sage_project': False, 'lr': 9.327076179854014e-05, 'weight_decay': 7.66580334640115e-07, 'epochs': 290, 'loss': 'mse', 'optimizer': 'adam', 'graph_mode': 'cutoff', 'cutoff': 0.8035137313376113, 'grm_norm': 'gcn', 'self_loops': False, 'use_snp_selection': True, 'num_snps': 56955}. Best is trial 52 with value: 0.3010667019795393.
