[I 2025-12-09 11:37:22,413] Trial 132 finished with value: 0.31747845877887626 and parameters: {'model_type': 'graphsage', 'hidden_dims': '[512, 128]', 'dropout': 0.5587760880970134, 'batch_norm': True, 'sage_aggr': 'mean', 'sage_normalize': True, 'sage_project': False, 'lr': 0.005981032402628963, 'weight_decay': 4.380996469890313e-06, 'epochs': 209, 'loss': 'mse', 'optimizer': 'adam', 'graph_mode': 'cutoff', 'cutoff': 0.7879920199217875, 'grm_norm': 'cosine_then_gcn', 'self_loops': True, 'use_snp_selection': False}. Best is trial 30 with value: 0.3184890102856323.
[I 2025-12-09 11:38:59,196] Trial 133 finished with value: 0.3133555250818989 and parameters: {'model_type': 'graphsage', 'hidden_dims': '[512, 128]', 'dropout': 0.5595171720551912, 'batch_norm': True, 'sage_aggr': 'mean', 'sage_normalize': True, 'sage_project': False, 'lr': 0.005847464632060778, 'weight_decay': 3.992624479821152e-06, 'epochs': 209, 'loss': 'mse', 'optimizer': 'adam', 'graph_mode': 'cutoff', 'cutoff': 0.5419433874256075, 'grm_norm': 'cosine_then_gcn', 'self_loops': True, 'use_snp_selection': False}. Best is trial 30 with value: 0.3184890102856323.
[I 2025-12-09 11:40:25,744] Trial 134 finished with value: 0.31255377575851007 and parameters: {'model_type': 'graphsage', 'hidden_dims': '[512, 128]', 'dropout': 0.5471375017247718, 'batch_norm': True, 'sage_aggr': 'mean', 'sage_normalize': True, 'sage_project': False, 'lr': 0.00665805851831154, 'weight_decay': 2.9891604525077562e-06, 'epochs': 188, 'loss': 'mse', 'optimizer': 'adam', 'graph_mode': 'cutoff', 'cutoff': 0.8488189062879808, 'grm_norm': 'cosine_then_gcn', 'self_loops': True, 'use_snp_selection': False}. Best is trial 30 with value: 0.3184890102856323.
[I 2025-12-09 11:42:05,506] Trial 135 finished with value: 0.3087553387320444 and parameters: {'model_type': 'graphsage', 'hidden_dims': '[512, 256]', 'dropout': 0.32168523816936284, 'batch_norm': True, 'sage_aggr': 'mean', 'sage_normalize': True, 'sage_project': False, 'lr': 0.004543993236812687, 'weight_decay': 2.0345756922029994e-06, 'epochs': 221, 'loss': 'mse', 'optimizer': 'adam', 'graph_mode': 'cutoff', 'cutoff': 0.749902950612861, 'grm_norm': 'cosine_then_gcn', 'self_loops': True, 'use_snp_selection': False}. Best is trial 30 with value: 0.3184890102856323.
[I 2025-12-09 11:43:59,919] Trial 136 finished with value: 0.29074739497635776 and parameters: {'model_type': 'graphsage', 'hidden_dims': '[512, 128]', 'dropout': 0.5811118960408995, 'batch_norm': True, 'sage_aggr': 'mean', 'sage_normalize': True, 'sage_project': False, 'lr': 0.008582176762897012, 'weight_decay': 9.643992427218183e-06, 'epochs': 215, 'loss': 'mse', 'optimizer': 'adam', 'graph_mode': 'knn', 'knn_k': 6, 'weighted_edges': False, 'symmetrize_mode': 'mutual', 'self_loops': False, 'use_snp_selection': False}. Best is trial 30 with value: 0.3184890102856323.
[I 2025-12-09 11:44:26,927] Trial 137 finished with value: 0.3055358879701953 and parameters: {'model_type': 'graphsage', 'hidden_dims': '[256, 128, 64]', 'dropout': 0.5643927266227435, 'batch_norm': True, 'sage_aggr': 'mean', 'sage_normalize': True, 'sage_project': False, 'lr': 0.005343897236192976, 'weight_decay': 4.551235646734335e-06, 'epochs': 73, 'loss': 'mse', 'optimizer': 'adam', 'graph_mode': 'cutoff', 'cutoff': 0.7856894195110153, 'grm_norm': 'cosine_then_gcn', 'self_loops': True, 'use_snp_selection': False}. Best is trial 30 with value: 0.3184890102856323.
[I 2025-12-09 11:45:56,203] Trial 138 finished with value: 0.31071517117284275 and parameters: {'model_type': 'graphsage', 'hidden_dims': '[512, 128]', 'dropout': 0.5895586301360907, 'batch_norm': True, 'sage_aggr': 'mean', 'sage_normalize': True, 'sage_project': False, 'lr': 0.000433526059204799, 'weight_decay': 1.4211523357945153e-06, 'epochs': 195, 'loss': 'mse', 'optimizer': 'adam', 'graph_mode': 'cutoff', 'cutoff': 0.8159607643618951, 'grm_norm': 'cosine', 'self_loops': True, 'use_snp_selection': False}. Best is trial 30 with value: 0.3184890102856323.
[I 2025-12-09 11:47:41,655] Trial 139 finished with value: 0.3123228206543535 and parameters: {'model_type': 'graphsage', 'hidden_dims': '[512, 128]', 'dropout': 0.5347727660502174, 'batch_norm': True, 'sage_aggr': 'mean', 'sage_normalize': True, 'sage_project': False, 'lr': 0.007345417415826286, 'weight_decay': 7.147864028265921e-06, 'epochs': 236, 'loss': 'mse', 'optimizer': 'adam', 'graph_mode': 'cutoff', 'cutoff': 0.7637323800977669, 'grm_norm': 'cosine_then_gcn', 'self_loops': False, 'use_snp_selection': False}. Best is trial 30 with value: 0.3184890102856323.
[I 2025-12-09 11:48:28,972] Trial 140 finished with value: 0.2976308341871435 and parameters: {'model_type': 'graphsage', 'hidden_dims': '[512, 64]', 'dropout': 0.5994756548633826, 'batch_norm': False, 'sage_aggr': 'mean', 'sage_normalize': True, 'sage_project': False, 'lr': 0.003766430096088761, 'weight_decay': 2.4939689517401223e-07, 'epochs': 110, 'loss': 'mse', 'optimizer': 'adam', 'graph_mode': 'cutoff', 'cutoff': 0.7313187405498267, 'grm_norm': 'cosine_then_gcn', 'self_loops': True, 'use_snp_selection': True, 'num_snps': 20873}. Best is trial 30 with value: 0.3184890102856323.
[I 2025-12-09 11:50:02,952] Trial 141 finished with value: 0.3143857801688933 and parameters: {'model_type': 'graphsage', 'hidden_dims': '[512, 128]', 'dropout': 0.5124070037063124, 'batch_norm': True, 'sage_aggr': 'mean', 'sage_normalize': True, 'sage_project': False, 'lr': 0.00983002519558329, 'weight_decay': 5.537585025321684e-06, 'epochs': 207, 'loss': 'mse', 'optimizer': 'adam', 'graph_mode': 'cutoff', 'cutoff': 0.7885537525161458, 'grm_norm': 'cosine_then_gcn', 'self_loops': True, 'use_snp_selection': False}. Best is trial 30 with value: 0.3184890102856323.
[I 2025-12-09 11:51:48,827] Trial 142 finished with value: 0.3124013808306598 and parameters: {'model_type': 'graphsage', 'hidden_dims': '[512, 128]', 'dropout': 0.5265064367017395, 'batch_norm': True, 'sage_aggr': 'mean', 'sage_normalize': True, 'sage_project': False, 'lr': 0.006226848613938231, 'weight_decay': 2.4392098367065987e-06, 'epochs': 212, 'loss': 'mse', 'optimizer': 'adam', 'graph_mode': 'cutoff', 'cutoff': 0.48901549754934925, 'grm_norm': 'cosine_then_gcn', 'self_loops': True, 'use_snp_selection': False}. Best is trial 30 with value: 0.3184890102856323.
[I 2025-12-09 11:53:32,509] Trial 143 finished with value: 0.3096762331717679 and parameters: {'model_type': 'graphsage', 'hidden_dims': '[512, 128]', 'dropout': 0.5523088321770857, 'batch_norm': True, 'sage_aggr': 'mean', 'sage_normalize': True, 'sage_project': False, 'lr': 0.007963518592623883, 'weight_decay': 3.534962750113132e-06, 'epochs': 184, 'loss': 'mse', 'optimizer': 'adam', 'graph_mode': 'cutoff', 'cutoff': 0.3059004158670153, 'grm_norm': 'cosine_then_gcn', 'self_loops': True, 'use_snp_selection': False}. Best is trial 30 with value: 0.3184890102856323.
[I 2025-12-09 11:54:53,684] Trial 144 finished with value: 0.3131568563665824 and parameters: {'model_type': 'graphsage', 'hidden_dims': '[512, 128]', 'dropout': 0.5741327576673724, 'batch_norm': True, 'sage_aggr': 'mean', 'sage_normalize': True, 'sage_project': False, 'lr': 0.006838540996036538, 'weight_decay': 6.080228753238574e-06, 'epochs': 174, 'loss': 'mse', 'optimizer': 'adam', 'graph_mode': 'cutoff', 'cutoff': 0.7944910766390402, 'grm_norm': 'cosine_then_gcn', 'self_loops': True, 'use_snp_selection': False}. Best is trial 30 with value: 0.3184890102856323.
[I 2025-12-09 11:56:26,197] Trial 145 finished with value: 0.3142917004408939 and parameters: {'model_type': 'graphsage', 'hidden_dims': '[512, 128]', 'dropout': 0.5413163244522835, 'batch_norm': True, 'sage_aggr': 'mean', 'sage_normalize': True, 'sage_project': False, 'lr': 0.004848339190173662, 'weight_decay': 8.329638660279297e-06, 'epochs': 203, 'loss': 'mse', 'optimizer': 'adam', 'graph_mode': 'cutoff', 'cutoff': 0.7714439338097872, 'grm_norm': 'cosine_then_gcn', 'self_loops': True, 'use_snp_selection': False}. Best is trial 30 with value: 0.3184890102856323.
[I 2025-12-09 11:57:06,592] Trial 146 finished with value: 0.3114133283411997 and parameters: {'model_type': 'graphsage', 'hidden_dims': '[128, 64]', 'dropout': 0.516385777916029, 'batch_norm': True, 'sage_aggr': 'mean', 'sage_normalize': True, 'sage_project': False, 'lr': 0.008662282733721919, 'weight_decay': 4.431861204148389e-06, 'epochs': 227, 'loss': 'mse', 'optimizer': 'adam', 'graph_mode': 'cutoff', 'cutoff': 0.8773719299680806, 'grm_norm': 'cosine', 'self_loops': False, 'use_snp_selection': False}. Best is trial 30 with value: 0.3184890102856323.
[I 2025-12-09 11:58:43,819] Trial 147 finished with value: 0.3114983843630243 and parameters: {'model_type': 'graphsage', 'hidden_dims': '[512, 128]', 'dropout': 0.49059170223065507, 'batch_norm': True, 'sage_aggr': 'mean', 'sage_normalize': False, 'sage_project': False, 'lr': 0.005832943790205114, 'weight_decay': 1.2617553990283231e-06, 'epochs': 218, 'loss': 'mse', 'optimizer': 'adam', 'graph_mode': 'cutoff', 'cutoff': 0.7551069596866636, 'grm_norm': 'gcn', 'self_loops': True, 'use_snp_selection': False}. Best is trial 30 with value: 0.3184890102856323.
[I 2025-12-09 12:00:12,276] Trial 148 finished with value: 0.30324205664846693 and parameters: {'model_type': 'graphsage', 'hidden_dims': '[512, 256]', 'dropout': 0.5321337935393877, 'batch_norm': True, 'sage_aggr': 'max', 'sage_normalize': True, 'sage_project': False, 'lr': 0.007464469507173353, 'weight_decay': 1.809668246722902e-06, 'epochs': 193, 'loss': 'mae', 'optimizer': 'adam', 'graph_mode': 'cutoff', 'cutoff': 0.8356132779510907, 'grm_norm': 'cosine_then_gcn', 'self_loops': True, 'use_snp_selection': False}. Best is trial 30 with value: 0.3184890102856323.
[I 2025-12-09 12:01:17,814] Trial 149 finished with value: 0.3124760312537597 and parameters: {'model_type': 'graphsage', 'hidden_dims': '[512, 128]', 'dropout': 0.5589268445098214, 'batch_norm': True, 'sage_aggr': 'mean', 'sage_normalize': True, 'sage_project': False, 'lr': 0.0041668777347293245, 'weight_decay': 2.817749642958728e-06, 'epochs': 134, 'loss': 'mse', 'optimizer': 'adam', 'graph_mode': 'cutoff', 'cutoff': 0.7415489846641293, 'grm_norm': 'cosine_then_gcn', 'self_loops': False, 'use_snp_selection': False}. Best is trial 30 with value: 0.3184890102856323.
[I 2025-12-09 12:02:42,841] Trial 0 finished with value: 0.2869859070843553 and parameters: {'model_type': 'graphsage', 'hidden_dims': '[128, 64]', 'dropout': 0.199031432379812, 'batch_norm': True, 'sage_aggr': 'max', 'sage_normalize': True, 'sage_project': False, 'lr': 0.00034401453323286885, 'weight_decay': 0.00017802616915745114, 'epochs': 230, 'loss': 'mse', 'optimizer': 'adam', 'graph_mode': 'knn', 'knn_k': 6, 'weighted_edges': True, 'symmetrize_mode': 'mutual', 'self_loops': True, 'use_snp_selection': False}. Best is trial 0 with value: 0.2869859070843553.
[I 2025-12-09 12:04:22,696] Trial 1 finished with value: 0.28081422782755566 and parameters: {'model_type': 'graphsage', 'hidden_dims': '[512, 128]', 'dropout': 0.2503500283181017, 'batch_norm': False, 'sage_aggr': 'max', 'sage_normalize': False, 'sage_project': False, 'lr': 3.952233718592099e-05, 'weight_decay': 0.00026754769258252603, 'epochs': 149, 'loss': 'mse', 'optimizer': 'adam', 'graph_mode': 'knn', 'knn_k': 2, 'weighted_edges': False, 'symmetrize_mode': 'mutual', 'self_loops': True, 'use_snp_selection': True, 'num_snps': 49915}. Best is trial 0 with value: 0.2869859070843553.
[I 2025-12-09 12:05:39,344] Trial 2 finished with value: 0.29102792390709986 and parameters: {'model_type': 'graphsage', 'hidden_dims': '[512, 256]', 'dropout': 0.2785908793172681, 'batch_norm': False, 'sage_aggr': 'max', 'sage_normalize': False, 'sage_project': False, 'lr': 8.806039223165805e-05, 'weight_decay': 3.5153176302760294e-05, 'epochs': 147, 'loss': 'mae', 'optimizer': 'adam', 'graph_mode': 'cutoff', 'cutoff': 0.4922564006874869, 'grm_norm': 'gcn', 'self_loops': False, 'use_snp_selection': True, 'num_snps': 34340}. Best is trial 2 with value: 0.29102792390709986.
[I 2025-12-09 12:06:52,323] Trial 3 finished with value: 0.3002887693475328 and parameters: {'model_type': 'graphsage', 'hidden_dims': '[256, 128, 64]', 'dropout': 0.3475243154412272, 'batch_norm': True, 'sage_aggr': 'max', 'sage_normalize': False, 'sage_project': False, 'lr': 1.6006331996938085e-05, 'weight_decay': 7.213121225589906e-06, 'epochs': 283, 'loss': 'mse', 'optimizer': 'adam', 'graph_mode': 'cutoff', 'cutoff': 0.5942334791449215, 'grm_norm': 'none', 'self_loops': True, 'use_snp_selection': False}. Best is trial 3 with value: 0.3002887693475328.
[I 2025-12-09 12:07:35,215] Trial 4 finished with value: 0.2840881873559522 and parameters: {'model_type': 'graphsage', 'hidden_dims': '[128, 64]', 'dropout': 0.3348926467202472, 'batch_norm': True, 'sage_aggr': 'max', 'sage_normalize': False, 'sage_project': False, 'lr': 0.0004238630400638802, 'weight_decay': 8.074086040046576e-07, 'epochs': 158, 'loss': 'mae', 'optimizer': 'adam', 'graph_mode': 'knn', 'knn_k': 1, 'weighted_edges': False, 'symmetrize_mode': 'mutual', 'self_loops': False, 'use_snp_selection': True, 'num_snps': 26850}. Best is trial 3 with value: 0.3002887693475328.
[I 2025-12-09 12:09:22,762] Trial 5 finished with value: 0.27512121592542305 and parameters: {'model_type': 'graphsage', 'hidden_dims': '[512, 64]', 'dropout': 0.14505336736221927, 'batch_norm': True, 'sage_aggr': 'mean', 'sage_normalize': True, 'sage_project': False, 'lr': 1.2962030165732234e-05, 'weight_decay': 1.326598071105465e-07, 'epochs': 180, 'loss': 'mse', 'optimizer': 'adam', 'graph_mode': 'knn', 'knn_k': 9, 'weighted_edges': True, 'symmetrize_mode': 'mutual', 'self_loops': False, 'use_snp_selection': False}. Best is trial 3 with value: 0.3002887693475328.
[I 2025-12-09 12:10:15,604] Trial 6 finished with value: 0.3012706151491492 and parameters: {'model_type': 'graphsage', 'hidden_dims': '[256, 128, 64]', 'dropout': 0.10731743755162496, 'batch_norm': True, 'sage_aggr': 'mean', 'sage_normalize': False, 'sage_project': False, 'lr': 1.922990426933137e-05, 'weight_decay': 7.30001060446905e-05, 'epochs': 63, 'loss': 'mae', 'optimizer': 'adam', 'graph_mode': 'cutoff', 'cutoff': 0.7624978434202536, 'grm_norm': 'none', 'self_loops': True, 'use_snp_selection': True, 'num_snps': 50106}. Best is trial 6 with value: 0.3012706151491492.
[I 2025-12-09 12:12:09,029] Trial 7 finished with value: 0.2994959830748035 and parameters: {'model_type': 'graphsage', 'hidden_dims': '[512, 64]', 'dropout': 0.2585007811528941, 'batch_norm': True, 'sage_aggr': 'max', 'sage_normalize': True, 'sage_project': False, 'lr': 5.921425508303391e-05, 'weight_decay': 0.0004511561961144237, 'epochs': 182, 'loss': 'mae', 'optimizer': 'adam', 'graph_mode': 'knn', 'knn_k': 9, 'weighted_edges': True, 'symmetrize_mode': 'union', 'self_loops': False, 'use_snp_selection': True, 'num_snps': 23903}. Best is trial 6 with value: 0.3012706151491492.
[I 2025-12-09 12:12:50,622] Trial 8 finished with value: 0.2638877662793314 and parameters: {'model_type': 'graphsage', 'hidden_dims': '[512, 256]', 'dropout': 0.3061380386767003, 'batch_norm': False, 'sage_aggr': 'mean', 'sage_normalize': True, 'sage_project': False, 'lr': 0.000698401460570184, 'weight_decay': 2.965560055460244e-06, 'epochs': 289, 'loss': 'mae', 'optimizer': 'adam', 'graph_mode': 'knn', 'knn_k': 7, 'weighted_edges': False, 'symmetrize_mode': 'mutual', 'self_loops': True, 'use_snp_selection': True, 'num_snps': 4710}. Best is trial 6 with value: 0.3012706151491492.
[I 2025-12-09 12:16:28,633] Trial 9 finished with value: 0.2982762513259375 and parameters: {'model_type': 'graphsage', 'hidden_dims': '[512, 128]', 'dropout': 0.1733844071393634, 'batch_norm': False, 'sage_aggr': 'mean', 'sage_normalize': True, 'sage_project': False, 'lr': 0.0004269677918501597, 'weight_decay': 2.2439779626249696e-06, 'epochs': 319, 'loss': 'mse', 'optimizer': 'adam', 'graph_mode': 'cutoff', 'cutoff': 0.24117565767129295, 'grm_norm': 'cosine_then_gcn', 'self_loops': True, 'use_snp_selection': False}. Best is trial 6 with value: 0.3012706151491492.
[I 2025-12-09 12:17:23,170] Trial 10 finished with value: 0.2995192141731454 and parameters: {'model_type': 'graphsage', 'hidden_dims': '[256, 128, 64]', 'dropout': 0.5365714961141473, 'batch_norm': True, 'sage_aggr': 'mean', 'sage_normalize': False, 'sage_project': False, 'lr': 0.0060050040216813455, 'weight_decay': 4.9377500793081834e-05, 'epochs': 46, 'loss': 'mae', 'optimizer': 'adam', 'graph_mode': 'cutoff', 'cutoff': 0.8579871888501912, 'grm_norm': 'none', 'self_loops': True, 'use_snp_selection': True, 'num_snps': 59927}. Best is trial 6 with value: 0.3012706151491492.
[I 2025-12-09 12:17:46,714] Trial 11 finished with value: 0.3039719793205528 and parameters: {'model_type': 'graphsage', 'hidden_dims': '[256, 128, 64]', 'dropout': 0.4432669231776715, 'batch_norm': True, 'sage_aggr': 'mean', 'sage_normalize': False, 'sage_project': False, 'lr': 1.2231553421043223e-05, 'weight_decay': 1.5553402552118384e-05, 'epochs': 63, 'loss': 'mse', 'optimizer': 'adam', 'graph_mode': 'cutoff', 'cutoff': 0.7635770185938652, 'grm_norm': 'none', 'self_loops': True, 'use_snp_selection': False}. Best is trial 11 with value: 0.3039719793205528.
[I 2025-12-09 12:18:05,776] Trial 12 finished with value: 0.27328754244307907 and parameters: {'model_type': 'graphsage', 'hidden_dims': '[256, 128, 64]', 'dropout': 0.47585896885209494, 'batch_norm': True, 'sage_aggr': 'mean', 'sage_normalize': False, 'sage_project': False, 'lr': 1.0733199146154037e-05, 'weight_decay': 3.338181645369436e-05, 'epochs': 42, 'loss': 'mae', 'optimizer': 'adam', 'graph_mode': 'cutoff', 'cutoff': 0.8322836612373569, 'grm_norm': 'none', 'self_loops': True, 'use_snp_selection': False}. Best is trial 11 with value: 0.3039719793205528.
[I 2025-12-09 12:18:36,232] Trial 13 finished with value: 0.3105365161996473 and parameters: {'model_type': 'graphsage', 'hidden_dims': '[256, 128]', 'dropout': 0.4377585996304457, 'batch_norm': True, 'sage_aggr': 'mean', 'sage_normalize': False, 'sage_project': False, 'lr': 0.00010305266819373948, 'weight_decay': 7.403871486746626e-05, 'epochs': 90, 'loss': 'mse', 'optimizer': 'adam', 'graph_mode': 'cutoff', 'cutoff': 0.6909652294005713, 'grm_norm': 'cosine', 'self_loops': True, 'use_snp_selection': False}. Best is trial 13 with value: 0.3105365161996473.
[I 2025-12-09 12:19:08,840] Trial 14 finished with value: 0.3050571493920552 and parameters: {'model_type': 'graphsage', 'hidden_dims': '[256, 128]', 'dropout': 0.43670413641276007, 'batch_norm': True, 'sage_aggr': 'mean', 'sage_normalize': False, 'sage_project': False, 'lr': 9.646941051903626e-05, 'weight_decay': 0.000929256360284688, 'epochs': 100, 'loss': 'mse', 'optimizer': 'adam', 'graph_mode': 'cutoff', 'cutoff': 0.6775896502896869, 'grm_norm': 'cosine', 'self_loops': True, 'use_snp_selection': False}. Best is trial 13 with value: 0.3105365161996473.
[I 2025-12-09 12:19:42,812] Trial 15 finished with value: 0.30496071559429494 and parameters: {'model_type': 'graphsage', 'hidden_dims': '[256, 128]', 'dropout': 0.42433122718505306, 'batch_norm': True, 'sage_aggr': 'mean', 'sage_normalize': False, 'sage_project': False, 'lr': 0.00013525708372764473, 'weight_decay': 0.0007597976483713402, 'epochs': 105, 'loss': 'mse', 'optimizer': 'adam', 'graph_mode': 'cutoff', 'cutoff': 0.5957529103844537, 'grm_norm': 'cosine', 'self_loops': True, 'use_snp_selection': False}. Best is trial 13 with value: 0.3105365161996473.
[I 2025-12-09 12:20:16,577] Trial 16 finished with value: 0.3081385901587561 and parameters: {'model_type': 'graphsage', 'hidden_dims': '[256, 128]', 'dropout': 0.5563845141271031, 'batch_norm': True, 'sage_aggr': 'mean', 'sage_normalize': False, 'sage_project': False, 'lr': 0.00015807200085276798, 'weight_decay': 0.0009210154980661431, 'epochs': 105, 'loss': 'mse', 'optimizer': 'adam', 'graph_mode': 'cutoff', 'cutoff': 0.6329260613429524, 'grm_norm': 'cosine', 'self_loops': True, 'use_snp_selection': False}. Best is trial 13 with value: 0.3105365161996473.
[I 2025-12-09 12:20:57,882] Trial 17 finished with value: 0.31162216315507674 and parameters: {'model_type': 'graphsage', 'hidden_dims': '[256, 128]', 'dropout': 0.5875020926599885, 'batch_norm': True, 'sage_aggr': 'mean', 'sage_normalize': False, 'sage_project': False, 'lr': 0.0013707521911067767, 'weight_decay': 0.00013159706951062678, 'epochs': 111, 'loss': 'mse', 'optimizer': 'adam', 'graph_mode': 'cutoff', 'cutoff': 0.43345716660506367, 'grm_norm': 'cosine', 'self_loops': True, 'use_snp_selection': False}. Best is trial 17 with value: 0.31162216315507674.
[I 2025-12-09 12:22:11,779] Trial 18 finished with value: 0.07960531047739337 and parameters: {'model_type': 'graphsage', 'hidden_dims': '[256, 128]', 'dropout': 0.5001226796440139, 'batch_norm': False, 'sage_aggr': 'mean', 'sage_normalize': False, 'sage_project': False, 'lr': 0.0016491682390326104, 'weight_decay': 8.50565905754856e-05, 'epochs': 233, 'loss': 'mse', 'optimizer': 'adam', 'graph_mode': 'cutoff', 'cutoff': 0.42741923607741245, 'grm_norm': 'cosine', 'self_loops': False, 'use_snp_selection': False}. Best is trial 17 with value: 0.31162216315507674.
[I 2025-12-09 12:22:57,145] Trial 19 finished with value: 0.3087879061237437 and parameters: {'model_type': 'graphsage', 'hidden_dims': '[256, 128]', 'dropout': 0.5901412608855118, 'batch_norm': True, 'sage_aggr': 'mean', 'sage_normalize': False, 'sage_project': False, 'lr': 0.0017376926526741332, 'weight_decay': 0.00015265805543382736, 'epochs': 122, 'loss': 'mse', 'optimizer': 'adam', 'graph_mode': 'cutoff', 'cutoff': 0.37391631599939296, 'grm_norm': 'cosine', 'self_loops': True, 'use_snp_selection': False}. Best is trial 17 with value: 0.31162216315507674.
