[I 2025-12-09 12:23:33,415] Trial 68 finished with value: 0.3547754154994857 and parameters: {'model_type': 'graphsage', 'hidden_dims': '[512, 256]', 'dropout': 0.4810151287767996, 'batch_norm': False, 'sage_aggr': 'mean', 'sage_normalize': False, 'sage_project': False, 'lr': 2.715430144922127e-05, 'weight_decay': 8.683680015096939e-05, 'epochs': 107, 'loss': 'mae', 'optimizer': 'adam', 'graph_mode': 'cutoff', 'cutoff': 0.7348666870620539, 'grm_norm': 'cosine', 'self_loops': False, 'use_snp_selection': True, 'num_snps': 17178}. Best is trial 62 with value: 0.3663672888177648.
[I 2025-12-09 12:24:11,119] Trial 69 finished with value: 0.35606388105641507 and parameters: {'model_type': 'graphsage', 'hidden_dims': '[512, 256]', 'dropout': 0.44697542383264455, 'batch_norm': False, 'sage_aggr': 'mean', 'sage_normalize': False, 'sage_project': False, 'lr': 9.790784975989068e-05, 'weight_decay': 4.307649199874712e-05, 'epochs': 78, 'loss': 'mae', 'optimizer': 'adam', 'graph_mode': 'cutoff', 'cutoff': 0.7004286311080221, 'grm_norm': 'cosine_then_gcn', 'self_loops': False, 'use_snp_selection': True, 'num_snps': 14535}. Best is trial 62 with value: 0.3663672888177648.
[I 2025-12-09 12:24:49,763] Trial 70 finished with value: 0.33864289404737774 and parameters: {'model_type': 'graphsage', 'hidden_dims': '[256, 128]', 'dropout': 0.4561790213929614, 'batch_norm': True, 'sage_aggr': 'mean', 'sage_normalize': False, 'sage_project': False, 'lr': 5.6385249561670906e-05, 'weight_decay': 0.0008738839597509707, 'epochs': 61, 'loss': 'mae', 'optimizer': 'adam', 'graph_mode': 'knn', 'knn_k': 1, 'weighted_edges': True, 'symmetrize_mode': 'union', 'self_loops': False, 'use_snp_selection': True, 'num_snps': 22679}. Best is trial 62 with value: 0.3663672888177648.
[I 2025-12-09 12:25:39,863] Trial 71 finished with value: 0.36464989365890466 and parameters: {'model_type': 'graphsage', 'hidden_dims': '[512, 256]', 'dropout': 0.4125433848043783, 'batch_norm': False, 'sage_aggr': 'mean', 'sage_normalize': False, 'sage_project': False, 'lr': 0.00011565047339252671, 'weight_decay': 0.0003743324293285457, 'epochs': 87, 'loss': 'mae', 'optimizer': 'adam', 'graph_mode': 'cutoff', 'cutoff': 0.8674805159031992, 'grm_norm': 'cosine', 'self_loops': False, 'use_snp_selection': True, 'num_snps': 27902}. Best is trial 62 with value: 0.3663672888177648.
[I 2025-12-09 12:26:23,181] Trial 72 finished with value: 0.36562696698110175 and parameters: {'model_type': 'graphsage', 'hidden_dims': '[512, 256]', 'dropout': 0.4976950241529418, 'batch_norm': False, 'sage_aggr': 'mean', 'sage_normalize': False, 'sage_project': False, 'lr': 0.00011403325117271815, 'weight_decay': 0.0002495553306734356, 'epochs': 52, 'loss': 'mae', 'optimizer': 'adam', 'graph_mode': 'cutoff', 'cutoff': 0.8763945721424546, 'grm_norm': 'cosine', 'self_loops': False, 'use_snp_selection': True, 'num_snps': 26920}. Best is trial 62 with value: 0.3663672888177648.
[I 2025-12-09 12:27:07,666] Trial 73 finished with value: 0.35414692822537674 and parameters: {'model_type': 'graphsage', 'hidden_dims': '[512, 256]', 'dropout': 0.4938479131829976, 'batch_norm': False, 'sage_aggr': 'mean', 'sage_normalize': False, 'sage_project': False, 'lr': 0.00013235141511062405, 'weight_decay': 0.00025700163981274253, 'epochs': 53, 'loss': 'mae', 'optimizer': 'adam', 'graph_mode': 'cutoff', 'cutoff': 0.8967395077638856, 'grm_norm': 'cosine', 'self_loops': False, 'use_snp_selection': True, 'num_snps': 27921}. Best is trial 62 with value: 0.3663672888177648.
[I 2025-12-09 12:27:50,721] Trial 74 finished with value: 0.2646123749652901 and parameters: {'model_type': 'graphsage', 'hidden_dims': '[512, 64]', 'dropout': 0.5518934621588162, 'batch_norm': False, 'sage_aggr': 'mean', 'sage_normalize': False, 'sage_project': False, 'lr': 0.00010830836971786163, 'weight_decay': 0.00015927774088666925, 'epochs': 40, 'loss': 'mae', 'optimizer': 'adam', 'graph_mode': 'cutoff', 'cutoff': 0.8313388787560152, 'grm_norm': 'cosine', 'self_loops': False, 'use_snp_selection': True, 'num_snps': 29938}. Best is trial 62 with value: 0.3663672888177648.
[I 2025-12-09 12:28:36,707] Trial 75 finished with value: 0.36348252159041067 and parameters: {'model_type': 'graphsage', 'hidden_dims': '[512, 256]', 'dropout': 0.43365136073804844, 'batch_norm': False, 'sage_aggr': 'mean', 'sage_normalize': False, 'sage_project': False, 'lr': 3.926750878596194e-05, 'weight_decay': 7.96664184317424e-05, 'epochs': 74, 'loss': 'mae', 'optimizer': 'adam', 'graph_mode': 'cutoff', 'cutoff': 0.7866481925945468, 'grm_norm': 'cosine', 'self_loops': False, 'use_snp_selection': True, 'num_snps': 25775}. Best is trial 62 with value: 0.3663672888177648.
[I 2025-12-09 12:29:22,841] Trial 76 finished with value: 0.36513003039599967 and parameters: {'model_type': 'graphsage', 'hidden_dims': '[512, 256]', 'dropout': 0.38680270996698823, 'batch_norm': False, 'sage_aggr': 'mean', 'sage_normalize': False, 'sage_project': False, 'lr': 3.848839554553125e-05, 'weight_decay': 9.330930945478327e-05, 'epochs': 76, 'loss': 'mae', 'optimizer': 'adam', 'graph_mode': 'cutoff', 'cutoff': 0.7847781165514197, 'grm_norm': 'cosine', 'self_loops': False, 'use_snp_selection': True, 'num_snps': 25465}. Best is trial 62 with value: 0.3663672888177648.
[I 2025-12-09 12:30:12,088] Trial 77 finished with value: 0.3611465750455317 and parameters: {'model_type': 'graphsage', 'hidden_dims': '[512, 256]', 'dropout': 0.3639068555049317, 'batch_norm': False, 'sage_aggr': 'mean', 'sage_normalize': False, 'sage_project': False, 'lr': 2.0072403850118078e-05, 'weight_decay': 0.0002078818668162424, 'epochs': 94, 'loss': 'mae', 'optimizer': 'adam', 'graph_mode': 'cutoff', 'cutoff': 0.8739572543433874, 'grm_norm': 'cosine', 'self_loops': False, 'use_snp_selection': True, 'num_snps': 25840}. Best is trial 62 with value: 0.3663672888177648.
[I 2025-12-09 12:30:54,779] Trial 78 finished with value: 0.3593207654482134 and parameters: {'model_type': 'graphsage', 'hidden_dims': '[512, 256]', 'dropout': 0.38150311779035667, 'batch_norm': False, 'sage_aggr': 'mean', 'sage_normalize': False, 'sage_project': False, 'lr': 3.450717855131601e-05, 'weight_decay': 1.435649515170314e-07, 'epochs': 49, 'loss': 'mae', 'optimizer': 'adam', 'graph_mode': 'cutoff', 'cutoff': 0.8322088404674631, 'grm_norm': 'none', 'self_loops': False, 'use_snp_selection': True, 'num_snps': 28281}. Best is trial 62 with value: 0.3663672888177648.
[I 2025-12-09 12:31:35,818] Trial 79 finished with value: 0.36491718234861165 and parameters: {'model_type': 'graphsage', 'hidden_dims': '[512, 256]', 'dropout': 0.4336129496541925, 'batch_norm': False, 'sage_aggr': 'mean', 'sage_normalize': False, 'sage_project': False, 'lr': 4.121516224361087e-05, 'weight_decay': 0.00012443749501704512, 'epochs': 80, 'loss': 'mae', 'optimizer': 'adam', 'graph_mode': 'cutoff', 'cutoff': 0.804167560232787, 'grm_norm': 'cosine', 'self_loops': False, 'use_snp_selection': True, 'num_snps': 18690}. Best is trial 62 with value: 0.3663672888177648.
[I 2025-12-09 12:32:16,661] Trial 80 finished with value: 0.37025396763766844 and parameters: {'model_type': 'graphsage', 'hidden_dims': '[512, 256]', 'dropout': 0.43535772766755026, 'batch_norm': False, 'sage_aggr': 'mean', 'sage_normalize': False, 'sage_project': False, 'lr': 1.6596297877045955e-05, 'weight_decay': 0.0003753381527902907, 'epochs': 83, 'loss': 'mae', 'optimizer': 'adam', 'graph_mode': 'cutoff', 'cutoff': 0.8754450265554881, 'grm_norm': 'cosine', 'self_loops': False, 'use_snp_selection': True, 'num_snps': 17874}. Best is trial 80 with value: 0.37025396763766844.
[I 2025-12-09 12:32:58,163] Trial 81 finished with value: 0.36467050031748205 and parameters: {'model_type': 'graphsage', 'hidden_dims': '[512, 256]', 'dropout': 0.41294074285550086, 'batch_norm': False, 'sage_aggr': 'mean', 'sage_normalize': False, 'sage_project': False, 'lr': 1.150975892624472e-05, 'weight_decay': 0.0003550550454904499, 'epochs': 83, 'loss': 'mae', 'optimizer': 'adam', 'graph_mode': 'cutoff', 'cutoff': 0.8017563310345194, 'grm_norm': 'cosine', 'self_loops': False, 'use_snp_selection': True, 'num_snps': 18784}. Best is trial 80 with value: 0.37025396763766844.
[I 2025-12-09 12:33:35,971] Trial 82 finished with value: 0.3646204433253318 and parameters: {'model_type': 'graphsage', 'hidden_dims': '[512, 256]', 'dropout': 0.4348821669108917, 'batch_norm': False, 'sage_aggr': 'mean', 'sage_normalize': False, 'sage_project': False, 'lr': 1.3436975915361423e-05, 'weight_decay': 0.0003720689384277051, 'epochs': 114, 'loss': 'mae', 'optimizer': 'adam', 'graph_mode': 'cutoff', 'cutoff': 0.8733863375784943, 'grm_norm': 'cosine', 'self_loops': False, 'use_snp_selection': True, 'num_snps': 11286}. Best is trial 80 with value: 0.37025396763766844.
[I 2025-12-09 12:34:11,517] Trial 83 finished with value: 0.3551406898819053 and parameters: {'model_type': 'graphsage', 'hidden_dims': '[512, 256]', 'dropout': 0.41139611626692374, 'batch_norm': False, 'sage_aggr': 'mean', 'sage_normalize': False, 'sage_project': False, 'lr': 1.0534963248729467e-05, 'weight_decay': 0.00042127299404036796, 'epochs': 117, 'loss': 'mae', 'optimizer': 'adam', 'graph_mode': 'cutoff', 'cutoff': 0.8745626644842047, 'grm_norm': 'cosine', 'self_loops': False, 'use_snp_selection': True, 'num_snps': 8891}. Best is trial 80 with value: 0.37025396763766844.
[I 2025-12-09 12:34:48,410] Trial 84 finished with value: 0.3553976445021035 and parameters: {'model_type': 'graphsage', 'hidden_dims': '[512, 256]', 'dropout': 0.38976121675531433, 'batch_norm': False, 'sage_aggr': 'mean', 'sage_normalize': False, 'sage_project': False, 'lr': 1.605466487766621e-05, 'weight_decay': 0.00012960692973769964, 'epochs': 101, 'loss': 'mae', 'optimizer': 'adam', 'graph_mode': 'cutoff', 'cutoff': 0.759919576084192, 'grm_norm': 'cosine', 'self_loops': False, 'use_snp_selection': True, 'num_snps': 11440}. Best is trial 80 with value: 0.37025396763766844.
[I 2025-12-09 12:35:19,241] Trial 85 finished with value: 0.3497870657546878 and parameters: {'model_type': 'graphsage', 'hidden_dims': '[512, 256]', 'dropout': 0.43320666010869213, 'batch_norm': False, 'sage_aggr': 'mean', 'sage_normalize': False, 'sage_project': False, 'lr': 1.3932100495321144e-05, 'weight_decay': 0.00031393582613696336, 'epochs': 88, 'loss': 'mae', 'optimizer': 'adam', 'graph_mode': 'cutoff', 'cutoff': 0.8327305931059826, 'grm_norm': 'cosine', 'self_loops': False, 'use_snp_selection': True, 'num_snps': 5472}. Best is trial 80 with value: 0.37025396763766844.
[I 2025-12-09 12:36:00,430] Trial 86 finished with value: 0.356632427290192 and parameters: {'model_type': 'graphsage', 'hidden_dims': '[512, 256]', 'dropout': 0.47343032163586024, 'batch_norm': False, 'sage_aggr': 'mean', 'sage_normalize': True, 'sage_project': False, 'lr': 1.653414303651558e-05, 'weight_decay': 0.0003816272833051209, 'epochs': 79, 'loss': 'mae', 'optimizer': 'adam', 'graph_mode': 'cutoff', 'cutoff': 0.8781260809189847, 'grm_norm': 'cosine', 'self_loops': False, 'use_snp_selection': True, 'num_snps': 18794}. Best is trial 80 with value: 0.37025396763766844.
[I 2025-12-09 12:36:42,870] Trial 87 finished with value: 0.36442939033211735 and parameters: {'model_type': 'graphsage', 'hidden_dims': '[512, 256]', 'dropout': 0.419015663319224, 'batch_norm': False, 'sage_aggr': 'mean', 'sage_normalize': False, 'sage_project': False, 'lr': 2.199063487281214e-05, 'weight_decay': 4.810217048169466e-05, 'epochs': 112, 'loss': 'mae', 'optimizer': 'adam', 'graph_mode': 'cutoff', 'cutoff': 0.8991359689988135, 'grm_norm': 'cosine', 'self_loops': False, 'use_snp_selection': True, 'num_snps': 16118}. Best is trial 80 with value: 0.37025396763766844.
[I 2025-12-09 12:37:22,194] Trial 88 finished with value: 0.370452562702736 and parameters: {'model_type': 'graphsage', 'hidden_dims': '[512, 256]', 'dropout': 0.3644579312246772, 'batch_norm': False, 'sage_aggr': 'mean', 'sage_normalize': False, 'sage_project': False, 'lr': 1.190294857186065e-05, 'weight_decay': 0.0002662191332336002, 'epochs': 114, 'loss': 'mae', 'optimizer': 'adam', 'graph_mode': 'cutoff', 'cutoff': 0.8968351065302964, 'grm_norm': 'cosine', 'self_loops': False, 'use_snp_selection': True, 'num_snps': 12916}. Best is trial 88 with value: 0.370452562702736.
[I 2025-12-09 12:37:59,333] Trial 89 finished with value: 0.3129551491208141 and parameters: {'model_type': 'graphsage', 'hidden_dims': '[256, 128]', 'dropout': 0.36708357271889924, 'batch_norm': True, 'sage_aggr': 'mean', 'sage_normalize': False, 'sage_project': False, 'lr': 1.1925424261946943e-05, 'weight_decay': 0.00027568401283736176, 'epochs': 114, 'loss': 'mae', 'optimizer': 'adam', 'graph_mode': 'knn', 'knn_k': 5, 'weighted_edges': False, 'symmetrize_mode': 'mutual', 'self_loops': False, 'use_snp_selection': True, 'num_snps': 12484}. Best is trial 88 with value: 0.370452562702736.
[I 2025-12-09 12:38:32,497] Trial 90 finished with value: 0.3540112781721639 and parameters: {'model_type': 'graphsage', 'hidden_dims': '[512, 256]', 'dropout': 0.3324836760264229, 'batch_norm': False, 'sage_aggr': 'mean', 'sage_normalize': False, 'sage_project': False, 'lr': 1.755362801174819e-05, 'weight_decay': 0.0001802793130729728, 'epochs': 100, 'loss': 'mae', 'optimizer': 'adam', 'graph_mode': 'cutoff', 'cutoff': 0.8351974263704188, 'grm_norm': 'cosine_then_gcn', 'self_loops': False, 'use_snp_selection': True, 'num_snps': 7493}. Best is trial 88 with value: 0.370452562702736.
[I 2025-12-09 12:39:12,793] Trial 91 finished with value: 0.3628500202260837 and parameters: {'model_type': 'graphsage', 'hidden_dims': '[512, 256]', 'dropout': 0.390580850916007, 'batch_norm': False, 'sage_aggr': 'mean', 'sage_normalize': False, 'sage_project': False, 'lr': 2.3254128242978365e-05, 'weight_decay': 4.9197849978111586e-05, 'epochs': 90, 'loss': 'mae', 'optimizer': 'adam', 'graph_mode': 'cutoff', 'cutoff': 0.8974596606735943, 'grm_norm': 'cosine', 'self_loops': False, 'use_snp_selection': True, 'num_snps': 16228}. Best is trial 88 with value: 0.370452562702736.
[I 2025-12-09 12:39:56,523] Trial 92 finished with value: 0.36913498666883016 and parameters: {'model_type': 'graphsage', 'hidden_dims': '[512, 256]', 'dropout': 0.4142405434560633, 'batch_norm': False, 'sage_aggr': 'mean', 'sage_normalize': False, 'sage_project': False, 'lr': 1.1876938046597322e-05, 'weight_decay': 0.00012993355322687538, 'epochs': 109, 'loss': 'mae', 'optimizer': 'adam', 'graph_mode': 'cutoff', 'cutoff': 0.8802096712860568, 'grm_norm': 'cosine', 'self_loops': False, 'use_snp_selection': True, 'num_snps': 17936}. Best is trial 88 with value: 0.370452562702736.
[I 2025-12-09 12:40:43,581] Trial 93 finished with value: 0.3659997004763394 and parameters: {'model_type': 'graphsage', 'hidden_dims': '[512, 256]', 'dropout': 0.4080728860599544, 'batch_norm': False, 'sage_aggr': 'mean', 'sage_normalize': False, 'sage_project': False, 'lr': 1.29926600473881e-05, 'weight_decay': 0.00033694863483649034, 'epochs': 132, 'loss': 'mae', 'optimizer': 'adam', 'graph_mode': 'cutoff', 'cutoff': 0.8693586597864348, 'grm_norm': 'cosine', 'self_loops': False, 'use_snp_selection': True, 'num_snps': 18750}. Best is trial 88 with value: 0.370452562702736.
[I 2025-12-09 12:41:23,376] Trial 94 finished with value: 0.3570673274608369 and parameters: {'model_type': 'graphsage', 'hidden_dims': '[512, 256]', 'dropout': 0.40971833599060536, 'batch_norm': False, 'sage_aggr': 'mean', 'sage_normalize': False, 'sage_project': False, 'lr': 1.1755185660872349e-05, 'weight_decay': 0.0001418216166327119, 'epochs': 68, 'loss': 'mae', 'optimizer': 'adam', 'graph_mode': 'cutoff', 'cutoff': 0.866988344724643, 'grm_norm': 'cosine', 'self_loops': False, 'use_snp_selection': True, 'num_snps': 18875}. Best is trial 88 with value: 0.370452562702736.
[I 2025-12-09 12:42:05,726] Trial 95 finished with value: 0.3557395039704111 and parameters: {'model_type': 'graphsage', 'hidden_dims': '[512, 256]', 'dropout': 0.3555439736574564, 'batch_norm': False, 'sage_aggr': 'mean', 'sage_normalize': False, 'sage_project': False, 'lr': 1.0048564750745385e-05, 'weight_decay': 0.0002544452583755471, 'epochs': 133, 'loss': 'mae', 'optimizer': 'adam', 'graph_mode': 'cutoff', 'cutoff': 0.8031821379037609, 'grm_norm': 'cosine', 'self_loops': False, 'use_snp_selection': True, 'num_snps': 14176}. Best is trial 88 with value: 0.370452562702736.
[I 2025-12-09 12:42:48,636] Trial 96 finished with value: 0.3587208989083507 and parameters: {'model_type': 'graphsage', 'hidden_dims': '[512, 256]', 'dropout': 0.3763916251264052, 'batch_norm': False, 'sage_aggr': 'mean', 'sage_normalize': False, 'sage_project': False, 'lr': 2.732515241747507e-05, 'weight_decay': 0.00018710970065991583, 'epochs': 103, 'loss': 'mae', 'optimizer': 'adam', 'graph_mode': 'cutoff', 'cutoff': 0.8417171162616747, 'grm_norm': 'cosine', 'self_loops': False, 'use_snp_selection': True, 'num_snps': 17725}. Best is trial 88 with value: 0.370452562702736.
[I 2025-12-09 12:43:33,181] Trial 97 finished with value: 0.3647366405548047 and parameters: {'model_type': 'graphsage', 'hidden_dims': '[512, 256]', 'dropout': 0.3390287563338298, 'batch_norm': False, 'sage_aggr': 'mean', 'sage_normalize': False, 'sage_project': False, 'lr': 1.805115524920444e-05, 'weight_decay': 0.000721232407271679, 'epochs': 81, 'loss': 'mae', 'optimizer': 'adam', 'graph_mode': 'cutoff', 'cutoff': 0.7548999126282526, 'grm_norm': 'none', 'self_loops': False, 'use_snp_selection': True, 'num_snps': 23670}. Best is trial 88 with value: 0.370452562702736.
[I 2025-12-09 12:44:14,850] Trial 98 finished with value: 0.36452995436576596 and parameters: {'model_type': 'graphsage', 'hidden_dims': '[512, 256]', 'dropout': 0.324035665999893, 'batch_norm': False, 'sage_aggr': 'mean', 'sage_normalize': False, 'sage_project': False, 'lr': 1.805603270491467e-05, 'weight_decay': 0.0007249784794154051, 'epochs': 80, 'loss': 'mae', 'optimizer': 'adam', 'graph_mode': 'cutoff', 'cutoff': 0.7500823975558661, 'grm_norm': 'none', 'self_loops': False, 'use_snp_selection': True, 'num_snps': 20548}. Best is trial 88 with value: 0.370452562702736.
[I 2025-12-09 12:45:09,568] Trial 99 finished with value: 0.3448442760842604 and parameters: {'model_type': 'graphsage', 'hidden_dims': '[512, 256]', 'dropout': 0.3427069895836555, 'batch_norm': False, 'sage_aggr': 'mean', 'sage_normalize': True, 'sage_project': False, 'lr': 1.2594284165139172e-05, 'weight_decay': 0.00011067380874563623, 'epochs': 141, 'loss': 'mae', 'optimizer': 'adam', 'graph_mode': 'cutoff', 'cutoff': 0.8131585199950366, 'grm_norm': 'cosine', 'self_loops': False, 'use_snp_selection': True, 'num_snps': 23730}. Best is trial 88 with value: 0.370452562702736.
[I 2025-12-09 12:45:52,334] Trial 100 finished with value: 0.36400256219705746 and parameters: {'model_type': 'graphsage', 'hidden_dims': '[512, 256]', 'dropout': 0.3966786527728441, 'batch_norm': False, 'sage_aggr': 'mean', 'sage_normalize': False, 'sage_project': False, 'lr': 1.4820057965355108e-05, 'weight_decay': 0.0007238513071258744, 'epochs': 96, 'loss': 'mae', 'optimizer': 'adam', 'graph_mode': 'cutoff', 'cutoff': 0.795320542222125, 'grm_norm': 'none', 'self_loops': False, 'use_snp_selection': True, 'num_snps': 19511}. Best is trial 88 with value: 0.370452562702736.
[I 2025-12-09 12:46:30,286] Trial 101 finished with value: 0.3632278256336818 and parameters: {'model_type': 'graphsage', 'hidden_dims': '[512, 256]', 'dropout': 0.36016610933894255, 'batch_norm': False, 'sage_aggr': 'mean', 'sage_normalize': False, 'sage_project': False, 'lr': 2.536921799061284e-05, 'weight_decay': 0.0003392179532021338, 'epochs': 88, 'loss': 'mae', 'optimizer': 'adam', 'graph_mode': 'cutoff', 'cutoff': 0.8803364232900024, 'grm_norm': 'none', 'self_loops': False, 'use_snp_selection': True, 'num_snps': 15049}. Best is trial 88 with value: 0.370452562702736.
[I 2025-12-09 12:47:15,633] Trial 102 finished with value: 0.3688000814550792 and parameters: {'model_type': 'graphsage', 'hidden_dims': '[512, 256]', 'dropout': 0.41784422163703006, 'batch_norm': False, 'sage_aggr': 'mean', 'sage_normalize': False, 'sage_project': False, 'lr': 3.1002243789093566e-05, 'weight_decay': 0.00024346495918432202, 'epochs': 83, 'loss': 'mae', 'optimizer': 'adam', 'graph_mode': 'cutoff', 'cutoff': 0.8564903642559183, 'grm_norm': 'none', 'self_loops': False, 'use_snp_selection': True, 'num_snps': 24277}. Best is trial 88 with value: 0.370452562702736.
[I 2025-12-09 12:48:00,301] Trial 103 finished with value: 0.3629595855347803 and parameters: {'model_type': 'graphsage', 'hidden_dims': '[512, 256]', 'dropout': 0.38019426679508905, 'batch_norm': False, 'sage_aggr': 'mean', 'sage_normalize': False, 'sage_project': False, 'lr': 1.951738275753853e-05, 'weight_decay': 7.076345206028606e-05, 'epochs': 80, 'loss': 'mae', 'optimizer': 'adam', 'graph_mode': 'cutoff', 'cutoff': 0.8207874048327645, 'grm_norm': 'none', 'self_loops': False, 'use_snp_selection': True, 'num_snps': 24175}. Best is trial 88 with value: 0.370452562702736.
[I 2025-12-09 12:48:38,703] Trial 104 finished with value: 0.3589808057102777 and parameters: {'model_type': 'graphsage', 'hidden_dims': '[512, 256]', 'dropout': 0.4206951270569095, 'batch_norm': False, 'sage_aggr': 'mean', 'sage_normalize': False, 'sage_project': False, 'lr': 3.1442709890434706e-05, 'weight_decay': 0.00022602873825020025, 'epochs': 73, 'loss': 'mae', 'optimizer': 'adam', 'graph_mode': 'cutoff', 'cutoff': 0.8861231207958769, 'grm_norm': 'none', 'self_loops': False, 'use_snp_selection': True, 'num_snps': 17477}. Best is trial 88 with value: 0.370452562702736.
