[I 2025-12-08 11:08:55,610] Trial 37 finished with value: 0.26678120165238306 and parameters: {'model_type': 'graphsage', 'hidden_dims': '[128, 64]', 'dropout': 0.5191006243404575, 'batch_norm': True, 'sage_aggr': 'mean', 'sage_normalize': False, 'sage_project': False, 'lr': 2.4681785897844713e-05, 'weight_decay': 2.904306044458212e-07, 'epochs': 299, 'loss': 'mse', 'optimizer': 'adam', 'graph_mode': 'cutoff', 'cutoff': 0.8213422881259568, 'grm_norm': 'cosine_then_gcn', 'self_loops': False, 'use_snp_selection': False}. Best is trial 27 with value: 0.27433001243192623.
[I 2025-12-08 11:09:40,229] Trial 38 finished with value: 0.27594366591756203 and parameters: {'model_type': 'graphsage', 'hidden_dims': '[128, 64]', 'dropout': 0.5443105650505742, 'batch_norm': True, 'sage_aggr': 'mean', 'sage_normalize': True, 'sage_project': False, 'lr': 1.5636199908247007e-05, 'weight_decay': 5.194389169424771e-06, 'epochs': 241, 'loss': 'mse', 'optimizer': 'adam', 'graph_mode': 'cutoff', 'cutoff': 0.7287870220292905, 'grm_norm': 'cosine_then_gcn', 'self_loops': False, 'use_snp_selection': False}. Best is trial 38 with value: 0.27594366591756203.
[I 2025-12-08 11:10:24,731] Trial 39 finished with value: 0.2703643010082136 and parameters: {'model_type': 'graphsage', 'hidden_dims': '[128, 64]', 'dropout': 0.5520018735937736, 'batch_norm': True, 'sage_aggr': 'mean', 'sage_normalize': False, 'sage_project': False, 'lr': 1.4292079525176166e-05, 'weight_decay': 1.1023669448044968e-05, 'epochs': 239, 'loss': 'mse', 'optimizer': 'adam', 'graph_mode': 'cutoff', 'cutoff': 0.6264986357278902, 'grm_norm': 'cosine_then_gcn', 'self_loops': False, 'use_snp_selection': False}. Best is trial 38 with value: 0.27594366591756203.
[I 2025-12-08 11:11:22,064] Trial 40 finished with value: 0.2699872936824219 and parameters: {'model_type': 'graphsage', 'hidden_dims': '[128, 64]', 'dropout': 0.4814929422494649, 'batch_norm': True, 'sage_aggr': 'mean', 'sage_normalize': True, 'sage_project': False, 'lr': 1.006810990924393e-05, 'weight_decay': 3.5982383273697014e-06, 'epochs': 330, 'loss': 'mse', 'optimizer': 'adam', 'graph_mode': 'cutoff', 'cutoff': 0.70488593263591, 'grm_norm': 'cosine_then_gcn', 'self_loops': False, 'use_snp_selection': False}. Best is trial 38 with value: 0.27594366591756203.
[I 2025-12-08 11:12:06,697] Trial 41 finished with value: 0.2709885530241514 and parameters: {'model_type': 'graphsage', 'hidden_dims': '[128, 64]', 'dropout': 0.5566573087724205, 'batch_norm': True, 'sage_aggr': 'mean', 'sage_normalize': False, 'sage_project': False, 'lr': 1.4717268753360408e-05, 'weight_decay': 1.0059096145188599e-05, 'epochs': 241, 'loss': 'mse', 'optimizer': 'adam', 'graph_mode': 'cutoff', 'cutoff': 0.6413398129953569, 'grm_norm': 'cosine_then_gcn', 'self_loops': False, 'use_snp_selection': False}. Best is trial 38 with value: 0.27594366591756203.
[I 2025-12-08 11:12:58,205] Trial 42 finished with value: 0.2690483541347368 and parameters: {'model_type': 'graphsage', 'hidden_dims': '[128, 64]', 'dropout': 0.5426746095543913, 'batch_norm': True, 'sage_aggr': 'mean', 'sage_normalize': False, 'sage_project': False, 'lr': 1.8075322839707074e-05, 'weight_decay': 2.1698999328993406e-06, 'epochs': 291, 'loss': 'mse', 'optimizer': 'adam', 'graph_mode': 'cutoff', 'cutoff': 0.7324565421940209, 'grm_norm': 'cosine_then_gcn', 'self_loops': False, 'use_snp_selection': False}. Best is trial 38 with value: 0.27594366591756203.
[I 2025-12-08 11:13:46,913] Trial 43 finished with value: 0.26996870370571013 and parameters: {'model_type': 'graphsage', 'hidden_dims': '[128, 64]', 'dropout': 0.5999597702667671, 'batch_norm': True, 'sage_aggr': 'mean', 'sage_normalize': False, 'sage_project': False, 'lr': 2.6787103032435627e-05, 'weight_decay': 1.1830726098676802e-06, 'epochs': 269, 'loss': 'mse', 'optimizer': 'adam', 'graph_mode': 'cutoff', 'cutoff': 0.6262908219985972, 'grm_norm': 'cosine_then_gcn', 'self_loops': False, 'use_snp_selection': False}. Best is trial 38 with value: 0.27594366591756203.
[I 2025-12-08 11:14:59,285] Trial 44 finished with value: 0.2707253635762769 and parameters: {'model_type': 'graphsage', 'hidden_dims': '[256, 128, 64]', 'dropout': 0.4304585469794625, 'batch_norm': True, 'sage_aggr': 'mean', 'sage_normalize': False, 'sage_project': False, 'lr': 1.658467045739421e-05, 'weight_decay': 5.528387614332506e-07, 'epochs': 241, 'loss': 'mse', 'optimizer': 'adam', 'graph_mode': 'cutoff', 'cutoff': 0.5138375790631106, 'grm_norm': 'cosine_then_gcn', 'self_loops': False, 'use_snp_selection': False}. Best is trial 38 with value: 0.27594366591756203.
[I 2025-12-08 11:16:22,604] Trial 45 finished with value: 0.2704498951337687 and parameters: {'model_type': 'graphsage', 'hidden_dims': '[256, 128]', 'dropout': 0.5628413551907645, 'batch_norm': True, 'sage_aggr': 'mean', 'sage_normalize': False, 'sage_project': False, 'lr': 4.959969767875425e-05, 'weight_decay': 2.1208480296767592e-05, 'epochs': 312, 'loss': 'mse', 'optimizer': 'adam', 'graph_mode': 'cutoff', 'cutoff': 0.7803968829206626, 'grm_norm': 'cosine', 'self_loops': False, 'use_snp_selection': False}. Best is trial 38 with value: 0.27594366591756203.
[I 2025-12-08 11:17:12,634] Trial 46 finished with value: 0.2693575531147024 and parameters: {'model_type': 'graphsage', 'hidden_dims': '[128, 64]', 'dropout': 0.5283032784592488, 'batch_norm': True, 'sage_aggr': 'mean', 'sage_normalize': False, 'sage_project': False, 'lr': 1.3198816536754692e-05, 'weight_decay': 1.1486458640706898e-07, 'epochs': 280, 'loss': 'mse', 'optimizer': 'adam', 'graph_mode': 'cutoff', 'cutoff': 0.6353830966463988, 'grm_norm': 'none', 'self_loops': False, 'use_snp_selection': False}. Best is trial 38 with value: 0.27594366591756203.
[I 2025-12-08 11:17:58,245] Trial 47 finished with value: 0.2754285258095529 and parameters: {'model_type': 'graphsage', 'hidden_dims': '[128, 64]', 'dropout': 0.4959544773495881, 'batch_norm': True, 'sage_aggr': 'mean', 'sage_normalize': True, 'sage_project': False, 'lr': 0.0066038802669719935, 'weight_decay': 1.268675282534902e-05, 'epochs': 231, 'loss': 'mse', 'optimizer': 'adam', 'graph_mode': 'cutoff', 'cutoff': 0.5423274978141782, 'grm_norm': 'cosine_then_gcn', 'self_loops': False, 'use_snp_selection': False}. Best is trial 38 with value: 0.27594366591756203.
[I 2025-12-08 11:18:42,969] Trial 48 finished with value: 0.27104474356456426 and parameters: {'model_type': 'graphsage', 'hidden_dims': '[128, 64]', 'dropout': 0.49406206637821726, 'batch_norm': True, 'sage_aggr': 'mean', 'sage_normalize': True, 'sage_project': False, 'lr': 0.009109699400469243, 'weight_decay': 5.017589170779992e-06, 'epochs': 198, 'loss': 'mse', 'optimizer': 'adam', 'graph_mode': 'cutoff', 'cutoff': 0.5030005274937396, 'grm_norm': 'cosine_then_gcn', 'self_loops': False, 'use_snp_selection': False}. Best is trial 38 with value: 0.27594366591756203.
[I 2025-12-08 11:19:32,286] Trial 49 finished with value: 0.26556426713702913 and parameters: {'model_type': 'graphsage', 'hidden_dims': '[128, 64]', 'dropout': 0.4672241717938267, 'batch_norm': True, 'sage_aggr': 'mean', 'sage_normalize': True, 'sage_project': False, 'lr': 0.0026981471645927944, 'weight_decay': 1.799616005095394e-06, 'epochs': 264, 'loss': 'mse', 'optimizer': 'adam', 'graph_mode': 'cutoff', 'cutoff': 0.5830105895934027, 'grm_norm': 'none', 'self_loops': False, 'use_snp_selection': False}. Best is trial 38 with value: 0.27594366591756203.
[I 2025-12-08 11:20:39,091] Trial 50 finished with value: 0.2709395068756935 and parameters: {'model_type': 'graphsage', 'hidden_dims': '[256, 128]', 'dropout': 0.3721272869551001, 'batch_norm': True, 'sage_aggr': 'mean', 'sage_normalize': True, 'sage_project': False, 'lr': 0.0009220922568486521, 'weight_decay': 2.9488619629908415e-06, 'epochs': 231, 'loss': 'mse', 'optimizer': 'adam', 'graph_mode': 'cutoff', 'cutoff': 0.553225758467399, 'grm_norm': 'cosine_then_gcn', 'self_loops': True, 'use_snp_selection': False}. Best is trial 38 with value: 0.27594366591756203.
[I 2025-12-08 11:21:25,847] Trial 51 finished with value: 0.272983571715531 and parameters: {'model_type': 'graphsage', 'hidden_dims': '[128, 64]', 'dropout': 0.49262059624230425, 'batch_norm': True, 'sage_aggr': 'mean', 'sage_normalize': True, 'sage_project': False, 'lr': 0.007023637088032002, 'weight_decay': 5.3389480392352635e-06, 'epochs': 200, 'loss': 'mse', 'optimizer': 'adam', 'graph_mode': 'cutoff', 'cutoff': 0.5037248281422408, 'grm_norm': 'cosine_then_gcn', 'self_loops': False, 'use_snp_selection': False}. Best is trial 38 with value: 0.27594366591756203.
[I 2025-12-08 11:22:19,038] Trial 52 finished with value: 0.27676359363788156 and parameters: {'model_type': 'graphsage', 'hidden_dims': '[128, 64]', 'dropout': 0.4448670763381676, 'batch_norm': True, 'sage_aggr': 'mean', 'sage_normalize': True, 'sage_project': False, 'lr': 0.0037929601908111236, 'weight_decay': 1.3653047656482657e-05, 'epochs': 211, 'loss': 'mse', 'optimizer': 'adam', 'graph_mode': 'cutoff', 'cutoff': 0.4384470183623859, 'grm_norm': 'cosine_then_gcn', 'self_loops': False, 'use_snp_selection': False}. Best is trial 52 with value: 0.27676359363788156.
[I 2025-12-08 11:23:11,603] Trial 53 finished with value: 0.2765395707538666 and parameters: {'model_type': 'graphsage', 'hidden_dims': '[128, 64]', 'dropout': 0.4525013997487722, 'batch_norm': True, 'sage_aggr': 'mean', 'sage_normalize': True, 'sage_project': False, 'lr': 0.004269966841920287, 'weight_decay': 1.4814267626263182e-05, 'epochs': 207, 'loss': 'mse', 'optimizer': 'adam', 'graph_mode': 'cutoff', 'cutoff': 0.41620458255582365, 'grm_norm': 'cosine_then_gcn', 'self_loops': False, 'use_snp_selection': False}. Best is trial 52 with value: 0.27676359363788156.
[I 2025-12-08 11:24:14,203] Trial 54 finished with value: 0.26880406428718573 and parameters: {'model_type': 'graphsage', 'hidden_dims': '[256, 128, 64]', 'dropout': 0.4458811509577518, 'batch_norm': True, 'sage_aggr': 'mean', 'sage_normalize': True, 'sage_project': False, 'lr': 0.00436057106181196, 'weight_decay': 2.698830553186754e-05, 'epochs': 169, 'loss': 'mse', 'optimizer': 'adam', 'graph_mode': 'cutoff', 'cutoff': 0.3805542165553718, 'grm_norm': 'none', 'self_loops': False, 'use_snp_selection': False}. Best is trial 52 with value: 0.27676359363788156.
[I 2025-12-08 11:25:02,752] Trial 55 finished with value: 0.27454568532332263 and parameters: {'model_type': 'graphsage', 'hidden_dims': '[128, 64]', 'dropout': 0.4075974355398025, 'batch_norm': True, 'sage_aggr': 'mean', 'sage_normalize': True, 'sage_project': False, 'lr': 0.00966705787002157, 'weight_decay': 1.4954951858322695e-05, 'epochs': 189, 'loss': 'mse', 'optimizer': 'adam', 'graph_mode': 'cutoff', 'cutoff': 0.4464319142299916, 'grm_norm': 'cosine', 'self_loops': False, 'use_snp_selection': False}. Best is trial 52 with value: 0.27676359363788156.
[I 2025-12-08 11:25:52,433] Trial 56 finished with value: 0.264911958896784 and parameters: {'model_type': 'graphsage', 'hidden_dims': '[128, 64]', 'dropout': 0.42376166414336197, 'batch_norm': True, 'sage_aggr': 'mean', 'sage_normalize': True, 'sage_project': False, 'lr': 0.0040032898448016645, 'weight_decay': 1.2266626854467137e-05, 'epochs': 179, 'loss': 'mae', 'optimizer': 'adam', 'graph_mode': 'cutoff', 'cutoff': 0.348008981148962, 'grm_norm': 'cosine', 'self_loops': False, 'use_snp_selection': False}. Best is trial 52 with value: 0.27676359363788156.
[I 2025-12-08 11:27:47,378] Trial 57 finished with value: 0.28025014439599605 and parameters: {'model_type': 'graphsage', 'hidden_dims': '[512, 128]', 'dropout': 0.40402095610748023, 'batch_norm': True, 'sage_aggr': 'mean', 'sage_normalize': True, 'sage_project': False, 'lr': 0.0019221097025671938, 'weight_decay': 1.4865048199453349e-05, 'epochs': 212, 'loss': 'mse', 'optimizer': 'adam', 'graph_mode': 'cutoff', 'cutoff': 0.45599208012912434, 'grm_norm': 'cosine', 'self_loops': True, 'use_snp_selection': False}. Best is trial 57 with value: 0.28025014439599605.
[I 2025-12-08 11:29:41,236] Trial 58 finished with value: 0.2797838408228705 and parameters: {'model_type': 'graphsage', 'hidden_dims': '[512, 128]', 'dropout': 0.4037160457507439, 'batch_norm': True, 'sage_aggr': 'mean', 'sage_normalize': True, 'sage_project': False, 'lr': 0.0017749488443704867, 'weight_decay': 1.5895647952387714e-05, 'epochs': 209, 'loss': 'mse', 'optimizer': 'adam', 'graph_mode': 'cutoff', 'cutoff': 0.4474236353386797, 'grm_norm': 'cosine', 'self_loops': True, 'use_snp_selection': False}. Best is trial 57 with value: 0.28025014439599605.
[I 2025-12-08 11:31:39,672] Trial 59 finished with value: 0.27597831191159283 and parameters: {'model_type': 'graphsage', 'hidden_dims': '[512, 128]', 'dropout': 0.35155343888824403, 'batch_norm': True, 'sage_aggr': 'mean', 'sage_normalize': True, 'sage_project': False, 'lr': 0.0015663174192144318, 'weight_decay': 2.8561238377473698e-05, 'epochs': 216, 'loss': 'mse', 'optimizer': 'adam', 'graph_mode': 'cutoff', 'cutoff': 0.4097119018559988, 'grm_norm': 'cosine', 'self_loops': True, 'use_snp_selection': False}. Best is trial 57 with value: 0.28025014439599605.
[I 2025-12-08 11:33:35,781] Trial 60 finished with value: 0.27649202792327454 and parameters: {'model_type': 'graphsage', 'hidden_dims': '[512, 128]', 'dropout': 0.336631197387756, 'batch_norm': True, 'sage_aggr': 'mean', 'sage_normalize': True, 'sage_project': False, 'lr': 0.0017043058707201851, 'weight_decay': 6.0870063118582204e-05, 'epochs': 211, 'loss': 'mse', 'optimizer': 'adam', 'graph_mode': 'cutoff', 'cutoff': 0.40673052151590183, 'grm_norm': 'cosine', 'self_loops': True, 'use_snp_selection': False}. Best is trial 57 with value: 0.28025014439599605.
[I 2025-12-08 11:35:32,480] Trial 61 finished with value: 0.2798734862852067 and parameters: {'model_type': 'graphsage', 'hidden_dims': '[512, 128]', 'dropout': 0.3499292449967131, 'batch_norm': True, 'sage_aggr': 'mean', 'sage_normalize': True, 'sage_project': False, 'lr': 0.0016923227878226305, 'weight_decay': 5.5262355826915886e-05, 'epochs': 212, 'loss': 'mse', 'optimizer': 'adam', 'graph_mode': 'cutoff', 'cutoff': 0.40347808445624966, 'grm_norm': 'cosine', 'self_loops': True, 'use_snp_selection': False}. Best is trial 57 with value: 0.28025014439599605.
[I 2025-12-08 11:37:29,489] Trial 62 finished with value: 0.27384460751271933 and parameters: {'model_type': 'graphsage', 'hidden_dims': '[512, 128]', 'dropout': 0.3391066444135127, 'batch_norm': True, 'sage_aggr': 'mean', 'sage_normalize': True, 'sage_project': False, 'lr': 0.0016899804916987585, 'weight_decay': 5.388564568748451e-05, 'epochs': 212, 'loss': 'mse', 'optimizer': 'adam', 'graph_mode': 'cutoff', 'cutoff': 0.39427977967584854, 'grm_norm': 'cosine', 'self_loops': True, 'use_snp_selection': False}. Best is trial 57 with value: 0.28025014439599605.
[I 2025-12-08 11:39:40,980] Trial 63 finished with value: 0.2655483568457336 and parameters: {'model_type': 'graphsage', 'hidden_dims': '[512, 128]', 'dropout': 0.32480727375637564, 'batch_norm': True, 'sage_aggr': 'mean', 'sage_normalize': True, 'sage_project': False, 'lr': 0.0014960259266433638, 'weight_decay': 0.0001022918470166818, 'epochs': 223, 'loss': 'mse', 'optimizer': 'adam', 'graph_mode': 'cutoff', 'cutoff': 0.30442707016676274, 'grm_norm': 'cosine', 'self_loops': True, 'use_snp_selection': False}. Best is trial 57 with value: 0.28025014439599605.
[I 2025-12-08 11:41:33,503] Trial 64 finished with value: 0.2775316649934805 and parameters: {'model_type': 'graphsage', 'hidden_dims': '[512, 128]', 'dropout': 0.29214231493158566, 'batch_norm': True, 'sage_aggr': 'mean', 'sage_normalize': True, 'sage_project': False, 'lr': 0.002887963014268131, 'weight_decay': 3.5069769995680836e-05, 'epochs': 207, 'loss': 'mse', 'optimizer': 'adam', 'graph_mode': 'cutoff', 'cutoff': 0.46180280609810465, 'grm_norm': 'cosine', 'self_loops': True, 'use_snp_selection': False}. Best is trial 57 with value: 0.28025014439599605.
[I 2025-12-08 11:43:09,785] Trial 65 finished with value: 0.2715146626420345 and parameters: {'model_type': 'graphsage', 'hidden_dims': '[512, 128]', 'dropout': 0.3936036623540913, 'batch_norm': True, 'sage_aggr': 'mean', 'sage_normalize': True, 'sage_project': False, 'lr': 0.0029344176064216806, 'weight_decay': 0.00013562387687756692, 'epochs': 173, 'loss': 'mse', 'optimizer': 'adam', 'graph_mode': 'cutoff', 'cutoff': 0.4590399133333365, 'grm_norm': 'cosine', 'self_loops': True, 'use_snp_selection': False}. Best is trial 57 with value: 0.28025014439599605.
[I 2025-12-08 11:45:07,763] Trial 66 finished with value: 0.2661108582750046 and parameters: {'model_type': 'graphsage', 'hidden_dims': '[512, 128]', 'dropout': 0.28843801549642517, 'batch_norm': True, 'sage_aggr': 'mean', 'sage_normalize': True, 'sage_project': False, 'lr': 0.0006421697091774078, 'weight_decay': 1.9566290257750807e-05, 'epochs': 204, 'loss': 'mse', 'optimizer': 'adam', 'graph_mode': 'knn', 'knn_k': 5, 'weighted_edges': False, 'symmetrize_mode': 'mutual', 'self_loops': True, 'use_snp_selection': False}. Best is trial 57 with value: 0.28025014439599605.
[I 2025-12-08 11:46:55,065] Trial 67 finished with value: 0.27735425081578935 and parameters: {'model_type': 'graphsage', 'hidden_dims': '[512, 128]', 'dropout': 0.3599434066419605, 'batch_norm': True, 'sage_aggr': 'mean', 'sage_normalize': True, 'sage_project': False, 'lr': 0.004262031207656976, 'weight_decay': 5.7735715525792495e-05, 'epochs': 189, 'loss': 'mse', 'optimizer': 'adam', 'graph_mode': 'cutoff', 'cutoff': 0.3561827905381062, 'grm_norm': 'cosine', 'self_loops': True, 'use_snp_selection': False}. Best is trial 57 with value: 0.28025014439599605.
[I 2025-12-08 11:48:59,438] Trial 68 finished with value: 0.27106618159305995 and parameters: {'model_type': 'graphsage', 'hidden_dims': '[512, 128]', 'dropout': 0.35628291794913286, 'batch_norm': True, 'sage_aggr': 'mean', 'sage_normalize': True, 'sage_project': False, 'lr': 0.004245956634512112, 'weight_decay': 4.027257527359236e-05, 'epochs': 192, 'loss': 'mse', 'optimizer': 'adam', 'graph_mode': 'cutoff', 'cutoff': 0.26722732333024884, 'grm_norm': 'cosine', 'self_loops': True, 'use_snp_selection': False}. Best is trial 57 with value: 0.28025014439599605.
[I 2025-12-08 11:50:43,399] Trial 69 finished with value: 0.2704850600908265 and parameters: {'model_type': 'graphsage', 'hidden_dims': '[512, 128]', 'dropout': 0.3861140118390852, 'batch_norm': True, 'sage_aggr': 'mean', 'sage_normalize': True, 'sage_project': False, 'lr': 0.003040504348831024, 'weight_decay': 7.250599671371483e-05, 'epochs': 182, 'loss': 'mse', 'optimizer': 'adam', 'graph_mode': 'cutoff', 'cutoff': 0.36816192384087587, 'grm_norm': 'gcn', 'self_loops': True, 'use_snp_selection': False}. Best is trial 57 with value: 0.28025014439599605.
[I 2025-12-08 11:52:12,566] Trial 70 finished with value: 0.2778694376492431 and parameters: {'model_type': 'graphsage', 'hidden_dims': '[512, 128]', 'dropout': 0.29944401056554115, 'batch_norm': True, 'sage_aggr': 'mean', 'sage_normalize': True, 'sage_project': False, 'lr': 0.0023561030629830576, 'weight_decay': 3.240698772287049e-05, 'epochs': 157, 'loss': 'mse', 'optimizer': 'adam', 'graph_mode': 'cutoff', 'cutoff': 0.42936139361659237, 'grm_norm': 'cosine', 'self_loops': True, 'use_snp_selection': False}. Best is trial 57 with value: 0.28025014439599605.
[I 2025-12-08 11:53:43,883] Trial 71 finished with value: 0.27715305039640137 and parameters: {'model_type': 'graphsage', 'hidden_dims': '[512, 128]', 'dropout': 0.2925789636066007, 'batch_norm': True, 'sage_aggr': 'mean', 'sage_normalize': True, 'sage_project': False, 'lr': 0.0023716196366381837, 'weight_decay': 3.117777500931135e-05, 'epochs': 162, 'loss': 'mse', 'optimizer': 'adam', 'graph_mode': 'cutoff', 'cutoff': 0.43671560829243683, 'grm_norm': 'cosine', 'self_loops': True, 'use_snp_selection': False}. Best is trial 57 with value: 0.28025014439599605.
[I 2025-12-08 11:55:11,786] Trial 72 finished with value: 0.27765780914445964 and parameters: {'model_type': 'graphsage', 'hidden_dims': '[512, 128]', 'dropout': 0.30123689368671885, 'batch_norm': True, 'sage_aggr': 'mean', 'sage_normalize': True, 'sage_project': False, 'lr': 0.0022155773019074767, 'weight_decay': 3.307267037019641e-05, 'epochs': 155, 'loss': 'mse', 'optimizer': 'adam', 'graph_mode': 'cutoff', 'cutoff': 0.44406021108779475, 'grm_norm': 'cosine', 'self_loops': True, 'use_snp_selection': False}. Best is trial 57 with value: 0.28025014439599605.
[I 2025-12-08 11:56:40,740] Trial 73 finished with value: 0.27718675904539525 and parameters: {'model_type': 'graphsage', 'hidden_dims': '[512, 128]', 'dropout': 0.24922206748444575, 'batch_norm': True, 'sage_aggr': 'mean', 'sage_normalize': True, 'sage_project': False, 'lr': 0.002288368319486696, 'weight_decay': 2.9156991117077132e-05, 'epochs': 158, 'loss': 'mse', 'optimizer': 'adam', 'graph_mode': 'cutoff', 'cutoff': 0.4687181757964093, 'grm_norm': 'cosine', 'self_loops': True, 'use_snp_selection': False}. Best is trial 57 with value: 0.28025014439599605.
[I 2025-12-08 11:57:56,984] Trial 74 finished with value: 0.27048697096527197 and parameters: {'model_type': 'graphsage', 'hidden_dims': '[512, 128]', 'dropout': 0.25310950774173113, 'batch_norm': True, 'sage_aggr': 'mean', 'sage_normalize': True, 'sage_project': False, 'lr': 0.0011178095688092599, 'weight_decay': 4.433744199471297e-05, 'epochs': 132, 'loss': 'mse', 'optimizer': 'adam', 'graph_mode': 'cutoff', 'cutoff': 0.47810003617321417, 'grm_norm': 'cosine', 'self_loops': True, 'use_snp_selection': False}. Best is trial 57 with value: 0.28025014439599605.
