[I 2025-12-05 18:33:52,432] Trial 63 finished with value: 0.22913482831890764 and parameters: {'model_type': 'graphsage', 'hidden_dims': '[256, 128]', 'dropout': 0.40083341867226235, 'batch_norm': False, 'sage_aggr': 'max', 'sage_normalize': True, 'sage_project': False, 'lr': 4.298231231233476e-06, 'weight_decay': 8.433626561794947e-06, 'epochs': 182, 'loss': 'mae', 'optimizer': 'adam', 'graph_mode': 'cutoff', 'cutoff': 0.7525632525510896, 'grm_norm': 'none', 'self_loops': False, 'use_snp_selection': True, 'num_snps': 32456, 'graphsage_batch_size': 256}. Best is trial 46 with value: 0.24263623152047006.
[I 2025-12-05 18:34:25,868] Trial 64 finished with value: 0.2228892812716765 and parameters: {'model_type': 'graphsage', 'hidden_dims': '[256, 128]', 'dropout': 0.332776126801683, 'batch_norm': False, 'sage_aggr': 'max', 'sage_normalize': True, 'sage_project': False, 'lr': 1.7110788732749984e-05, 'weight_decay': 4.681735386434997e-06, 'epochs': 221, 'loss': 'mae', 'optimizer': 'adam', 'graph_mode': 'cutoff', 'cutoff': 0.8403162807114107, 'grm_norm': 'cosine_then_gcn', 'self_loops': False, 'use_snp_selection': True, 'num_snps': 13755, 'graphsage_batch_size': 256}. Best is trial 46 with value: 0.24263623152047006.
[I 2025-12-05 18:35:18,625] Trial 65 finished with value: 0.23666726777200267 and parameters: {'model_type': 'graphsage', 'hidden_dims': '[512, 256]', 'dropout': 0.3757590773916071, 'batch_norm': False, 'sage_aggr': 'max', 'sage_normalize': True, 'sage_project': False, 'lr': 9.166035148672443e-06, 'weight_decay': 1.89715404120812e-05, 'epochs': 201, 'loss': 'mae', 'optimizer': 'adam', 'graph_mode': 'cutoff', 'cutoff': 0.7988068504183432, 'grm_norm': 'gcn', 'self_loops': False, 'use_snp_selection': True, 'num_snps': 18978, 'graphsage_batch_size': 512}. Best is trial 46 with value: 0.24263623152047006.
[I 2025-12-05 18:35:46,133] Trial 66 finished with value: 0.21662654140664034 and parameters: {'model_type': 'graphsage', 'hidden_dims': '[512, 256]', 'dropout': 0.4239728038408746, 'batch_norm': False, 'sage_aggr': 'max', 'sage_normalize': True, 'sage_project': False, 'lr': 9.593305640949171e-06, 'weight_decay': 1.6842562157312395e-05, 'epochs': 200, 'loss': 'mae', 'optimizer': 'adam', 'graph_mode': 'cutoff', 'cutoff': 0.8041208466723302, 'grm_norm': 'gcn', 'self_loops': False, 'use_snp_selection': True, 'num_snps': 5808, 'graphsage_batch_size': 512}. Best is trial 46 with value: 0.24263623152047006.
[I 2025-12-05 18:36:32,682] Trial 67 finished with value: 0.2251117895057345 and parameters: {'model_type': 'graphsage', 'hidden_dims': '[512, 256]', 'dropout': 0.36668718305804854, 'batch_norm': False, 'sage_aggr': 'max', 'sage_normalize': True, 'sage_project': False, 'lr': 8.731305044851327e-06, 'weight_decay': 4.69268583995188e-05, 'epochs': 185, 'loss': 'mae', 'optimizer': 'adam', 'graph_mode': 'cutoff', 'cutoff': 0.8735648183630038, 'grm_norm': 'gcn', 'self_loops': False, 'use_snp_selection': True, 'num_snps': 16717, 'graphsage_batch_size': 512}. Best is trial 46 with value: 0.24263623152047006.
[I 2025-12-05 18:37:35,622] Trial 68 finished with value: 0.22166131135607353 and parameters: {'model_type': 'graphsage', 'hidden_dims': '[512, 256]', 'dropout': 0.3928971400291927, 'batch_norm': False, 'sage_aggr': 'max', 'sage_normalize': True, 'sage_project': False, 'lr': 1.6981779665281615e-05, 'weight_decay': 2.0069309116043106e-05, 'epochs': 176, 'loss': 'mae', 'optimizer': 'adam', 'graph_mode': 'cutoff', 'cutoff': 0.7679548530827847, 'grm_norm': 'gcn', 'self_loops': False, 'use_snp_selection': True, 'num_snps': 26538, 'graphsage_batch_size': 512}. Best is trial 46 with value: 0.24263623152047006.
[I 2025-12-05 18:38:15,658] Trial 69 finished with value: 0.22999991719519036 and parameters: {'model_type': 'graphsage', 'hidden_dims': '[512, 256]', 'dropout': 0.3493040739902352, 'batch_norm': False, 'sage_aggr': 'max', 'sage_normalize': True, 'sage_project': False, 'lr': 4.613427558702711e-06, 'weight_decay': 1.0561899745944915e-05, 'epochs': 218, 'loss': 'mae', 'optimizer': 'adam', 'graph_mode': 'cutoff', 'cutoff': 0.8004092438744355, 'grm_norm': 'gcn', 'self_loops': False, 'use_snp_selection': True, 'num_snps': 11163, 'graphsage_batch_size': 512}. Best is trial 46 with value: 0.24263623152047006.
[I 2025-12-05 18:38:54,957] Trial 70 finished with value: 0.20793924143054482 and parameters: {'model_type': 'graphsage', 'hidden_dims': '[512, 256]', 'dropout': 0.34361995455369615, 'batch_norm': False, 'sage_aggr': 'max', 'sage_normalize': True, 'sage_project': False, 'lr': 2.0412101920512533e-06, 'weight_decay': 1.0940835507738546e-05, 'epochs': 212, 'loss': 'mae', 'optimizer': 'adam', 'graph_mode': 'cutoff', 'cutoff': 0.8014841088408675, 'grm_norm': 'none', 'self_loops': False, 'use_snp_selection': True, 'num_snps': 11148, 'graphsage_batch_size': 512}. Best is trial 46 with value: 0.24263623152047006.
[I 2025-12-05 18:39:46,879] Trial 71 finished with value: 0.22195742948241834 and parameters: {'model_type': 'graphsage', 'hidden_dims': '[512, 256]', 'dropout': 0.3807307953055445, 'batch_norm': False, 'sage_aggr': 'max', 'sage_normalize': True, 'sage_project': False, 'lr': 2.8221214278055097e-06, 'weight_decay': 5.383188322767531e-06, 'epochs': 242, 'loss': 'mae', 'optimizer': 'adam', 'graph_mode': 'cutoff', 'cutoff': 0.7297815244650929, 'grm_norm': 'gcn', 'self_loops': False, 'use_snp_selection': True, 'num_snps': 15344, 'graphsage_batch_size': 512}. Best is trial 46 with value: 0.24263623152047006.
[I 2025-12-05 18:40:22,202] Trial 72 finished with value: 0.22859124406683978 and parameters: {'model_type': 'graphsage', 'hidden_dims': '[512, 256]', 'dropout': 0.4108497682699054, 'batch_norm': False, 'sage_aggr': 'max', 'sage_normalize': True, 'sage_project': False, 'lr': 8.961051872990718e-06, 'weight_decay': 1.0007626264436554e-05, 'epochs': 226, 'loss': 'mae', 'optimizer': 'adam', 'graph_mode': 'cutoff', 'cutoff': 0.7736267780580851, 'grm_norm': 'gcn', 'self_loops': False, 'use_snp_selection': True, 'num_snps': 8614, 'graphsage_batch_size': 128}. Best is trial 46 with value: 0.24263623152047006.
[I 2025-12-05 18:40:52,381] Trial 73 finished with value: 0.22045846684537698 and parameters: {'model_type': 'graphsage', 'hidden_dims': '[128, 64]', 'dropout': 0.35055440850299163, 'batch_norm': False, 'sage_aggr': 'max', 'sage_normalize': True, 'sage_project': False, 'lr': 4.3890958792879565e-06, 'weight_decay': 3.25338283320493e-05, 'epochs': 206, 'loss': 'mae', 'optimizer': 'adam', 'graph_mode': 'cutoff', 'cutoff': 0.8973714924062504, 'grm_norm': 'gcn', 'self_loops': False, 'use_snp_selection': True, 'num_snps': 18841, 'graphsage_batch_size': 512}. Best is trial 46 with value: 0.24263623152047006.
[I 2025-12-05 18:41:20,682] Trial 74 finished with value: 0.2257244069907995 and parameters: {'model_type': 'graphsage', 'hidden_dims': '[512, 64]', 'dropout': 0.3248222326359295, 'batch_norm': False, 'sage_aggr': 'max', 'sage_normalize': True, 'sage_project': False, 'lr': 5.462676034870141e-06, 'weight_decay': 0.00011463959760704532, 'epochs': 220, 'loss': 'mae', 'optimizer': 'adam', 'graph_mode': 'cutoff', 'cutoff': 0.8569139892751272, 'grm_norm': 'gcn', 'self_loops': False, 'use_snp_selection': True, 'num_snps': 5885, 'graphsage_batch_size': 8}. Best is trial 46 with value: 0.24263623152047006.
[I 2025-12-05 18:42:01,371] Trial 75 finished with value: 0.2174789208172463 and parameters: {'model_type': 'graphsage', 'hidden_dims': '[512, 256]', 'dropout': 0.3763453087730676, 'batch_norm': False, 'sage_aggr': 'max', 'sage_normalize': True, 'sage_project': False, 'lr': 2.9675803787078095e-06, 'weight_decay': 5.944212570387768e-06, 'epochs': 196, 'loss': 'mae', 'optimizer': 'adam', 'graph_mode': 'cutoff', 'cutoff': 0.7993742561739139, 'grm_norm': 'cosine_then_gcn', 'self_loops': False, 'use_snp_selection': True, 'num_snps': 12503, 'graphsage_batch_size': 512}. Best is trial 46 with value: 0.24263623152047006.
[I 2025-12-05 18:43:38,078] Trial 76 finished with value: 0.1896609916036908 and parameters: {'model_type': 'graphsage', 'hidden_dims': '[512, 128]', 'dropout': 0.40431695971725207, 'batch_norm': False, 'sage_aggr': 'max', 'sage_normalize': True, 'sage_project': False, 'lr': 8.409492669721321e-05, 'weight_decay': 2.047745280075484e-05, 'epochs': 187, 'loss': 'mae', 'optimizer': 'adam', 'graph_mode': 'cutoff', 'cutoff': 0.2198879145818875, 'grm_norm': 'gcn', 'self_loops': False, 'use_snp_selection': True, 'num_snps': 17863, 'graphsage_batch_size': 64}. Best is trial 46 with value: 0.24263623152047006.
[I 2025-12-05 18:44:25,783] Trial 77 finished with value: 0.21923772480833112 and parameters: {'model_type': 'graphsage', 'hidden_dims': '[256, 128]', 'dropout': 0.36194950857958424, 'batch_norm': False, 'sage_aggr': 'max', 'sage_normalize': True, 'sage_project': False, 'lr': 3.3572648296706476e-05, 'weight_decay': 3.173541851117355e-06, 'epochs': 215, 'loss': 'mae', 'optimizer': 'adam', 'graph_mode': 'cutoff', 'cutoff': 0.8184294594729071, 'grm_norm': 'gcn', 'self_loops': False, 'use_snp_selection': True, 'num_snps': 25337, 'graphsage_batch_size': 32}. Best is trial 46 with value: 0.24263623152047006.
[I 2025-12-05 18:46:40,708] Trial 78 finished with value: 0.1944849559128825 and parameters: {'model_type': 'graphsage', 'hidden_dims': '[512, 256]', 'dropout': 0.4311264048683596, 'batch_norm': False, 'sage_aggr': 'max', 'sage_normalize': True, 'sage_project': False, 'lr': 1.037140872625406e-05, 'weight_decay': 4.1814427236457593e-05, 'epochs': 171, 'loss': 'mae', 'optimizer': 'adam', 'graph_mode': 'knn', 'knn_k': 8, 'weighted_edges': False, 'symmetrize_mode': 'union', 'self_loops': False, 'use_snp_selection': True, 'num_snps': 29111, 'graphsage_batch_size': 256}. Best is trial 46 with value: 0.24263623152047006.
[I 2025-12-05 18:46:59,017] Trial 79 finished with value: 0.19729484186634996 and parameters: {'model_type': 'graphsage', 'hidden_dims': '[256, 128]', 'dropout': 0.3384427730438641, 'batch_norm': False, 'sage_aggr': 'max', 'sage_normalize': True, 'sage_project': False, 'lr': 2.012713808063312e-05, 'weight_decay': 1.3078187547431855e-05, 'epochs': 199, 'loss': 'mae', 'optimizer': 'adam', 'graph_mode': 'cutoff', 'cutoff': 0.8771973104992786, 'grm_norm': 'gcn', 'self_loops': False, 'use_snp_selection': True, 'num_snps': 2522, 'graphsage_batch_size': 512}. Best is trial 46 with value: 0.24263623152047006.
[I 2025-12-05 18:47:27,111] Trial 80 finished with value: 0.22054665902359538 and parameters: {'model_type': 'graphsage', 'hidden_dims': '[128, 64]', 'dropout': 0.28743803725748784, 'batch_norm': False, 'sage_aggr': 'max', 'sage_normalize': True, 'sage_project': False, 'lr': 7.245510960986578e-06, 'weight_decay': 8.827494442010276e-06, 'epochs': 230, 'loss': 'mae', 'optimizer': 'adam', 'graph_mode': 'cutoff', 'cutoff': 0.8394412179981153, 'grm_norm': 'gcn', 'self_loops': False, 'use_snp_selection': True, 'num_snps': 14215, 'graphsage_batch_size': 256}. Best is trial 46 with value: 0.24263623152047006.
[I 2025-12-05 18:48:03,187] Trial 81 finished with value: 0.23106996668022392 and parameters: {'model_type': 'graphsage', 'hidden_dims': '[256, 128]', 'dropout': 0.3009231044063355, 'batch_norm': True, 'sage_aggr': 'mean', 'sage_normalize': True, 'sage_project': False, 'lr': 0.00048676846432451785, 'weight_decay': 1.2330804911874411e-06, 'epochs': 155, 'loss': 'mae', 'optimizer': 'adam', 'graph_mode': 'cutoff', 'cutoff': 0.8286941722674392, 'grm_norm': 'gcn', 'self_loops': False, 'use_snp_selection': True, 'num_snps': 21505, 'graphsage_batch_size': 256}. Best is trial 46 with value: 0.24263623152047006.
[I 2025-12-05 18:48:36,744] Trial 82 finished with value: 0.23620615005244988 and parameters: {'model_type': 'graphsage', 'hidden_dims': '[256, 128]', 'dropout': 0.27436836953954746, 'batch_norm': True, 'sage_aggr': 'mean', 'sage_normalize': True, 'sage_project': False, 'lr': 0.00047059017245234787, 'weight_decay': 1.3041283784020744e-06, 'epochs': 137, 'loss': 'mae', 'optimizer': 'adam', 'graph_mode': 'cutoff', 'cutoff': 0.7592472253027167, 'grm_norm': 'gcn', 'self_loops': False, 'use_snp_selection': True, 'num_snps': 21705, 'graphsage_batch_size': 256}. Best is trial 46 with value: 0.24263623152047006.
[I 2025-12-05 18:49:17,949] Trial 83 finished with value: 0.232932554789389 and parameters: {'model_type': 'graphsage', 'hidden_dims': '[256, 128]', 'dropout': 0.2449253358429884, 'batch_norm': True, 'sage_aggr': 'mean', 'sage_normalize': True, 'sage_project': False, 'lr': 0.0005143789753629834, 'weight_decay': 1.3691880995701272e-06, 'epochs': 208, 'loss': 'mae', 'optimizer': 'adam', 'graph_mode': 'cutoff', 'cutoff': 0.7791356093084854, 'grm_norm': 'gcn', 'self_loops': False, 'use_snp_selection': True, 'num_snps': 21096, 'graphsage_batch_size': 256}. Best is trial 46 with value: 0.24263623152047006.
[I 2025-12-05 18:49:50,764] Trial 84 finished with value: 0.2263510747604879 and parameters: {'model_type': 'graphsage', 'hidden_dims': '[256, 128]', 'dropout': 0.2506972327653195, 'batch_norm': True, 'sage_aggr': 'mean', 'sage_normalize': True, 'sage_project': False, 'lr': 0.0005214673877429988, 'weight_decay': 1.26025688595857e-06, 'epochs': 134, 'loss': 'mae', 'optimizer': 'adam', 'graph_mode': 'cutoff', 'cutoff': 0.825168833642331, 'grm_norm': 'gcn', 'self_loops': False, 'use_snp_selection': True, 'num_snps': 20714, 'graphsage_batch_size': 256}. Best is trial 46 with value: 0.24263623152047006.
[I 2025-12-05 18:50:24,498] Trial 85 finished with value: 0.232723218917735 and parameters: {'model_type': 'graphsage', 'hidden_dims': '[256, 128]', 'dropout': 0.26757092805575206, 'batch_norm': True, 'sage_aggr': 'mean', 'sage_normalize': True, 'sage_project': False, 'lr': 0.0004486238147209895, 'weight_decay': 1.2881638039036498e-06, 'epochs': 142, 'loss': 'mae', 'optimizer': 'adam', 'graph_mode': 'cutoff', 'cutoff': 0.7701111087003208, 'grm_norm': 'gcn', 'self_loops': False, 'use_snp_selection': True, 'num_snps': 20665, 'graphsage_batch_size': 256}. Best is trial 46 with value: 0.24263623152047006.
[I 2025-12-05 18:50:59,299] Trial 86 finished with value: 0.22990190462410487 and parameters: {'model_type': 'graphsage', 'hidden_dims': '[256, 128]', 'dropout': 0.23425172927452131, 'batch_norm': True, 'sage_aggr': 'mean', 'sage_normalize': True, 'sage_project': False, 'lr': 0.00043772024901445777, 'weight_decay': 1.7749506556152417e-06, 'epochs': 141, 'loss': 'mae', 'optimizer': 'adam', 'graph_mode': 'cutoff', 'cutoff': 0.7014688035275831, 'grm_norm': 'none', 'self_loops': False, 'use_snp_selection': True, 'num_snps': 22073, 'graphsage_batch_size': 256}. Best is trial 46 with value: 0.24263623152047006.
[I 2025-12-05 18:51:34,179] Trial 87 finished with value: 0.22800131050171085 and parameters: {'model_type': 'graphsage', 'hidden_dims': '[256, 128]', 'dropout': 0.2637238964802043, 'batch_norm': True, 'sage_aggr': 'mean', 'sage_normalize': True, 'sage_project': False, 'lr': 0.0005603802597216465, 'weight_decay': 1.3264077223685953e-06, 'epochs': 123, 'loss': 'mae', 'optimizer': 'adam', 'graph_mode': 'cutoff', 'cutoff': 0.7768667264213547, 'grm_norm': 'gcn', 'self_loops': False, 'use_snp_selection': True, 'num_snps': 24203, 'graphsage_batch_size': 256}. Best is trial 46 with value: 0.24263623152047006.
[I 2025-12-05 18:52:15,171] Trial 88 finished with value: 0.23414432427709503 and parameters: {'model_type': 'graphsage', 'hidden_dims': '[256, 128]', 'dropout': 0.2768872700447308, 'batch_norm': True, 'sage_aggr': 'mean', 'sage_normalize': True, 'sage_project': False, 'lr': 0.00041046911757864084, 'weight_decay': 8.315833577746997e-07, 'epochs': 207, 'loss': 'mae', 'optimizer': 'adam', 'graph_mode': 'cutoff', 'cutoff': 0.668592381165058, 'grm_norm': 'cosine_then_gcn', 'self_loops': False, 'use_snp_selection': True, 'num_snps': 20542, 'graphsage_batch_size': 256}. Best is trial 46 with value: 0.24263623152047006.
[I 2025-12-05 18:52:50,599] Trial 89 finished with value: 0.21777478790782903 and parameters: {'model_type': 'graphsage', 'hidden_dims': '[256, 128]', 'dropout': 0.18349522829375914, 'batch_norm': True, 'sage_aggr': 'mean', 'sage_normalize': True, 'sage_project': False, 'lr': 0.00028134345511154126, 'weight_decay': 9.245562279680608e-07, 'epochs': 136, 'loss': 'mae', 'optimizer': 'adam', 'graph_mode': 'knn', 'knn_k': 2, 'weighted_edges': False, 'symmetrize_mode': 'mutual', 'self_loops': False, 'use_snp_selection': True, 'num_snps': 21282, 'graphsage_batch_size': 256}. Best is trial 46 with value: 0.24263623152047006.
[I 2025-12-05 18:53:42,383] Trial 90 finished with value: 0.2135704236820215 and parameters: {'model_type': 'graphsage', 'hidden_dims': '[256, 128]', 'dropout': 0.282737648545376, 'batch_norm': True, 'sage_aggr': 'mean', 'sage_normalize': True, 'sage_project': False, 'lr': 0.0007531355972715645, 'weight_decay': 3.321093105709542e-06, 'epochs': 151, 'loss': 'mae', 'optimizer': 'adam', 'graph_mode': 'cutoff', 'cutoff': 0.6835207900955994, 'grm_norm': 'cosine_then_gcn', 'self_loops': False, 'use_snp_selection': True, 'num_snps': 37740, 'graphsage_batch_size': 128}. Best is trial 46 with value: 0.24263623152047006.
[I 2025-12-05 18:54:21,789] Trial 91 finished with value: 0.23968032731024178 and parameters: {'model_type': 'graphsage', 'hidden_dims': '[256, 128]', 'dropout': 0.22874835788162484, 'batch_norm': True, 'sage_aggr': 'mean', 'sage_normalize': True, 'sage_project': False, 'lr': 0.000395956918906631, 'weight_decay': 8.474496409191062e-07, 'epochs': 206, 'loss': 'mae', 'optimizer': 'adam', 'graph_mode': 'cutoff', 'cutoff': 0.7288513661864424, 'grm_norm': 'cosine_then_gcn', 'self_loops': False, 'use_snp_selection': True, 'num_snps': 19052, 'graphsage_batch_size': 256}. Best is trial 46 with value: 0.24263623152047006.
[I 2025-12-05 18:55:01,561] Trial 92 finished with value: 0.2335165201762394 and parameters: {'model_type': 'graphsage', 'hidden_dims': '[256, 128]', 'dropout': 0.2299307881637477, 'batch_norm': True, 'sage_aggr': 'mean', 'sage_normalize': True, 'sage_project': False, 'lr': 0.00044142185717850396, 'weight_decay': 3.2237586044338175e-07, 'epochs': 206, 'loss': 'mae', 'optimizer': 'adam', 'graph_mode': 'cutoff', 'cutoff': 0.7260427756721258, 'grm_norm': 'cosine_then_gcn', 'self_loops': False, 'use_snp_selection': True, 'num_snps': 19370, 'graphsage_batch_size': 256}. Best is trial 46 with value: 0.24263623152047006.
[I 2025-12-05 18:55:40,180] Trial 93 finished with value: 0.2360521509038759 and parameters: {'model_type': 'graphsage', 'hidden_dims': '[256, 128]', 'dropout': 0.22828039476413078, 'batch_norm': True, 'sage_aggr': 'mean', 'sage_normalize': True, 'sage_project': False, 'lr': 0.0002187903111429913, 'weight_decay': 3.845038828099542e-07, 'epochs': 206, 'loss': 'mae', 'optimizer': 'adam', 'graph_mode': 'cutoff', 'cutoff': 0.7299662827888933, 'grm_norm': 'cosine_then_gcn', 'self_loops': False, 'use_snp_selection': True, 'num_snps': 18380, 'graphsage_batch_size': 256}. Best is trial 46 with value: 0.24263623152047006.
[I 2025-12-05 18:56:18,980] Trial 94 finished with value: 0.23644652820507975 and parameters: {'model_type': 'graphsage', 'hidden_dims': '[256, 128]', 'dropout': 0.22602553241468587, 'batch_norm': True, 'sage_aggr': 'mean', 'sage_normalize': True, 'sage_project': False, 'lr': 0.00021831731533813813, 'weight_decay': 3.6231417521351517e-07, 'epochs': 208, 'loss': 'mae', 'optimizer': 'adam', 'graph_mode': 'cutoff', 'cutoff': 0.7245691945073045, 'grm_norm': 'cosine_then_gcn', 'self_loops': False, 'use_snp_selection': True, 'num_snps': 18442, 'graphsage_batch_size': 256}. Best is trial 46 with value: 0.24263623152047006.
[I 2025-12-05 18:56:56,953] Trial 95 finished with value: 0.23880475587719868 and parameters: {'model_type': 'graphsage', 'hidden_dims': '[256, 128]', 'dropout': 0.22600380638829914, 'batch_norm': True, 'sage_aggr': 'mean', 'sage_normalize': True, 'sage_project': False, 'lr': 0.00022199960479556363, 'weight_decay': 3.7632264949447846e-07, 'epochs': 206, 'loss': 'mae', 'optimizer': 'adam', 'graph_mode': 'cutoff', 'cutoff': 0.7230914349133082, 'grm_norm': 'cosine_then_gcn', 'self_loops': False, 'use_snp_selection': True, 'num_snps': 17918, 'graphsage_batch_size': 256}. Best is trial 46 with value: 0.24263623152047006.
[I 2025-12-05 18:57:49,058] Trial 96 finished with value: 0.24525499812586338 and parameters: {'model_type': 'graphsage', 'hidden_dims': '[512, 64]', 'dropout': 0.22573826360802662, 'batch_norm': True, 'sage_aggr': 'mean', 'sage_normalize': True, 'sage_project': False, 'lr': 0.0001444398832532379, 'weight_decay': 3.717863031488624e-07, 'epochs': 208, 'loss': 'mae', 'optimizer': 'adam', 'graph_mode': 'cutoff', 'cutoff': 0.6631244248968808, 'grm_norm': 'cosine_then_gcn', 'self_loops': False, 'use_snp_selection': True, 'num_snps': 17996, 'graphsage_batch_size': 256}. Best is trial 96 with value: 0.24525499812586338.
[I 2025-12-05 18:58:43,392] Trial 97 finished with value: 0.23501870767015495 and parameters: {'model_type': 'graphsage', 'hidden_dims': '[512, 64]', 'dropout': 0.19777206437176945, 'batch_norm': True, 'sage_aggr': 'mean', 'sage_normalize': True, 'sage_project': False, 'lr': 0.00022597927176622567, 'weight_decay': 2.203643510962615e-07, 'epochs': 216, 'loss': 'mae', 'optimizer': 'adam', 'graph_mode': 'cutoff', 'cutoff': 0.6200932486677879, 'grm_norm': 'cosine_then_gcn', 'self_loops': False, 'use_snp_selection': True, 'num_snps': 18309, 'graphsage_batch_size': 32}. Best is trial 96 with value: 0.24525499812586338.
