[I 2025-12-09 03:29:46,757] Trial 34 finished with value: 0.35176395127893995 and parameters: {'model_type': 'graphsage', 'hidden_dims': '[512, 64]', 'dropout': 0.561570764643825, 'batch_norm': False, 'sage_aggr': 'max', 'sage_normalize': False, 'sage_project': False, 'lr': 1.775615410816553e-05, 'weight_decay': 0.00014595122664523878, 'epochs': 349, 'loss': 'mae', 'optimizer': 'adam', 'graph_mode': 'cutoff', 'cutoff': 0.6814704979276325, 'grm_norm': 'cosine_then_gcn', 'self_loops': True, 'use_snp_selection': True, 'num_snps': 37104}. Best is trial 25 with value: 0.37075254988769146.
[I 2025-12-09 03:31:29,756] Trial 35 finished with value: 0.0 and parameters: {'model_type': 'graphsage', 'hidden_dims': '[256, 128]', 'dropout': 0.46860847197689537, 'batch_norm': False, 'sage_aggr': 'max', 'sage_normalize': False, 'sage_project': False, 'lr': 0.00841334259761915, 'weight_decay': 3.657421406202565e-05, 'epochs': 304, 'loss': 'mae', 'optimizer': 'adam', 'graph_mode': 'cutoff', 'cutoff': 0.8534844162640202, 'grm_norm': 'cosine', 'self_loops': True, 'use_snp_selection': True, 'num_snps': 55846}. Best is trial 25 with value: 0.37075254988769146.
[I 2025-12-09 03:32:45,796] Trial 36 finished with value: 0.3089142402399521 and parameters: {'model_type': 'graphsage', 'hidden_dims': '[128, 64]', 'dropout': 0.5744801555754965, 'batch_norm': True, 'sage_aggr': 'max', 'sage_normalize': False, 'sage_project': False, 'lr': 1.4856273391610264e-05, 'weight_decay': 1.0909805161919874e-05, 'epochs': 276, 'loss': 'mae', 'optimizer': 'adam', 'graph_mode': 'cutoff', 'cutoff': 0.5479346650864106, 'grm_norm': 'none', 'self_loops': True, 'use_snp_selection': True, 'num_snps': 48046}. Best is trial 25 with value: 0.37075254988769146.
[I 2025-12-09 03:34:57,486] Trial 37 finished with value: 0.36052143848081525 and parameters: {'model_type': 'graphsage', 'hidden_dims': '[512, 128]', 'dropout': 0.5997363318427112, 'batch_norm': False, 'sage_aggr': 'max', 'sage_normalize': False, 'sage_project': False, 'lr': 2.348839146137711e-05, 'weight_decay': 4.939199347547792e-06, 'epochs': 248, 'loss': 'mae', 'optimizer': 'adam', 'graph_mode': 'cutoff', 'cutoff': 0.783067723544792, 'grm_norm': 'cosine_then_gcn', 'self_loops': True, 'use_snp_selection': False}. Best is trial 25 with value: 0.37075254988769146.
[I 2025-12-09 03:36:43,553] Trial 38 finished with value: 0.3184538347066718 and parameters: {'model_type': 'graphsage', 'hidden_dims': '[256, 128, 64]', 'dropout': 0.5158358268928194, 'batch_norm': True, 'sage_aggr': 'mean', 'sage_normalize': True, 'sage_project': False, 'lr': 4.815405921219656e-05, 'weight_decay': 1.573807272847972e-07, 'epochs': 329, 'loss': 'mae', 'optimizer': 'adam', 'graph_mode': 'cutoff', 'cutoff': 0.6926669688866424, 'grm_norm': 'cosine_then_gcn', 'self_loops': True, 'use_snp_selection': True, 'num_snps': 52607}. Best is trial 25 with value: 0.37075254988769146.
[I 2025-12-09 03:39:17,637] Trial 39 finished with value: 0.36118381748865935 and parameters: {'model_type': 'graphsage', 'hidden_dims': '[512, 64]', 'dropout': 0.5641487548476798, 'batch_norm': False, 'sage_aggr': 'max', 'sage_normalize': False, 'sage_project': False, 'lr': 1.4717897277333873e-05, 'weight_decay': 0.0005077232322592445, 'epochs': 297, 'loss': 'mae', 'optimizer': 'adam', 'graph_mode': 'cutoff', 'cutoff': 0.8440297427276512, 'grm_norm': 'cosine_then_gcn', 'self_loops': True, 'use_snp_selection': True, 'num_snps': 54826}. Best is trial 25 with value: 0.37075254988769146.
[I 2025-12-09 03:41:47,202] Trial 40 finished with value: 0.3452929418440455 and parameters: {'model_type': 'graphsage', 'hidden_dims': '[512, 128]', 'dropout': 0.36704218383693576, 'batch_norm': True, 'sage_aggr': 'max', 'sage_normalize': False, 'sage_project': False, 'lr': 2.305102712162015e-05, 'weight_decay': 2.4133049294503454e-05, 'epochs': 274, 'loss': 'mae', 'optimizer': 'adam', 'graph_mode': 'cutoff', 'cutoff': 0.5648110443138201, 'grm_norm': 'cosine_then_gcn', 'self_loops': True, 'use_snp_selection': False}. Best is trial 25 with value: 0.37075254988769146.
[I 2025-12-09 03:43:22,445] Trial 41 finished with value: 0.3639296861143927 and parameters: {'model_type': 'graphsage', 'hidden_dims': '[256, 128, 64]', 'dropout': 0.5339848552388706, 'batch_norm': False, 'sage_aggr': 'max', 'sage_normalize': False, 'sage_project': False, 'lr': 1.0965982439676253e-05, 'weight_decay': 6.258561688085687e-05, 'epochs': 244, 'loss': 'mae', 'optimizer': 'adam', 'graph_mode': 'cutoff', 'cutoff': 0.7935545437480301, 'grm_norm': 'cosine_then_gcn', 'self_loops': True, 'use_snp_selection': True, 'num_snps': 59003}. Best is trial 25 with value: 0.37075254988769146.
[I 2025-12-09 03:44:58,763] Trial 42 finished with value: 0.3641015496895096 and parameters: {'model_type': 'graphsage', 'hidden_dims': '[256, 128, 64]', 'dropout': 0.5345662818435611, 'batch_norm': False, 'sage_aggr': 'max', 'sage_normalize': False, 'sage_project': False, 'lr': 1.0394242537952857e-05, 'weight_decay': 7.412776913563782e-05, 'epochs': 255, 'loss': 'mae', 'optimizer': 'adam', 'graph_mode': 'cutoff', 'cutoff': 0.791725513780097, 'grm_norm': 'cosine_then_gcn', 'self_loops': True, 'use_snp_selection': True, 'num_snps': 58457}. Best is trial 25 with value: 0.37075254988769146.
[I 2025-12-09 03:46:30,049] Trial 43 finished with value: 0.3620678639077365 and parameters: {'model_type': 'graphsage', 'hidden_dims': '[256, 128, 64]', 'dropout': 0.5780633293451691, 'batch_norm': False, 'sage_aggr': 'max', 'sage_normalize': False, 'sage_project': False, 'lr': 1.3035337512930386e-05, 'weight_decay': 4.605966889014618e-05, 'epochs': 225, 'loss': 'mae', 'optimizer': 'adam', 'graph_mode': 'cutoff', 'cutoff': 0.7234406766769765, 'grm_norm': 'cosine_then_gcn', 'self_loops': True, 'use_snp_selection': True, 'num_snps': 59868}. Best is trial 25 with value: 0.37075254988769146.
[I 2025-12-09 03:48:06,368] Trial 44 finished with value: 0.35300590631707246 and parameters: {'model_type': 'graphsage', 'hidden_dims': '[256, 128, 64]', 'dropout': 0.5213651575223525, 'batch_norm': False, 'sage_aggr': 'mean', 'sage_normalize': False, 'sage_project': False, 'lr': 1.543730771856103e-05, 'weight_decay': 0.00016129390715619854, 'epochs': 315, 'loss': 'mae', 'optimizer': 'adam', 'graph_mode': 'cutoff', 'cutoff': 0.7601317781943744, 'grm_norm': 'none', 'self_loops': True, 'use_snp_selection': True, 'num_snps': 49429}. Best is trial 25 with value: 0.37075254988769146.
[I 2025-12-09 03:48:45,378] Trial 45 finished with value: 0.35042759072322993 and parameters: {'model_type': 'graphsage', 'hidden_dims': '[128, 64]', 'dropout': 0.4836104081437088, 'batch_norm': False, 'sage_aggr': 'max', 'sage_normalize': True, 'sage_project': False, 'lr': 0.0030439245400280517, 'weight_decay': 8.852286684839351e-05, 'epochs': 283, 'loss': 'mae', 'optimizer': 'adam', 'graph_mode': 'cutoff', 'cutoff': 0.8523822467394268, 'grm_norm': 'none', 'self_loops': True, 'use_snp_selection': True, 'num_snps': 30146}. Best is trial 25 with value: 0.37075254988769146.
[I 2025-12-09 03:57:26,576] Trial 46 finished with value: 0.3508560155935374 and parameters: {'model_type': 'graphsage', 'hidden_dims': '[512, 128]', 'dropout': 0.31604785017989023, 'batch_norm': False, 'sage_aggr': 'max', 'sage_normalize': False, 'sage_project': False, 'lr': 4.5521326781631296e-05, 'weight_decay': 3.318958576709176e-05, 'epochs': 264, 'loss': 'mae', 'optimizer': 'adam', 'graph_mode': 'knn', 'knn_k': 10, 'weighted_edges': True, 'symmetrize_mode': 'union', 'self_loops': True, 'use_snp_selection': True, 'num_snps': 54078}. Best is trial 25 with value: 0.37075254988769146.
[I 2025-12-09 03:58:29,208] Trial 47 finished with value: 0.34031837278134025 and parameters: {'model_type': 'graphsage', 'hidden_dims': '[256, 128, 64]', 'dropout': 0.5504971660358553, 'batch_norm': False, 'sage_aggr': 'max', 'sage_normalize': False, 'sage_project': False, 'lr': 6.314400517848594e-05, 'weight_decay': 1.1922720540681396e-06, 'epochs': 180, 'loss': 'mae', 'optimizer': 'adam', 'graph_mode': 'cutoff', 'cutoff': 0.6533893901933843, 'grm_norm': 'cosine_then_gcn', 'self_loops': True, 'use_snp_selection': True, 'num_snps': 49320}. Best is trial 25 with value: 0.37075254988769146.
[I 2025-12-09 03:58:45,795] Trial 48 finished with value: 0.3358100943739522 and parameters: {'model_type': 'graphsage', 'hidden_dims': '[256, 128]', 'dropout': 0.5797420591578454, 'batch_norm': True, 'sage_aggr': 'max', 'sage_normalize': False, 'sage_project': False, 'lr': 1.8647095461972108e-05, 'weight_decay': 0.00012011657306394413, 'epochs': 230, 'loss': 'mse', 'optimizer': 'adam', 'graph_mode': 'cutoff', 'cutoff': 0.7547763220758552, 'grm_norm': 'gcn', 'self_loops': True, 'use_snp_selection': True, 'num_snps': 6546}. Best is trial 25 with value: 0.37075254988769146.
[I 2025-12-09 04:01:29,624] Trial 49 finished with value: 0.31356170578493925 and parameters: {'model_type': 'graphsage', 'hidden_dims': '[512, 128]', 'dropout': 0.46455783528152417, 'batch_norm': False, 'sage_aggr': 'mean', 'sage_normalize': True, 'sage_project': False, 'lr': 3.6697422131506445e-05, 'weight_decay': 6.232175514258516e-05, 'epochs': 295, 'loss': 'mae', 'optimizer': 'adam', 'graph_mode': 'cutoff', 'cutoff': 0.49655675252974724, 'grm_norm': 'cosine', 'self_loops': True, 'use_snp_selection': True, 'num_snps': 43410}. Best is trial 25 with value: 0.37075254988769146.
[I 2025-12-09 04:07:03,480] Trial 50 finished with value: 0.02614910304760749 and parameters: {'model_type': 'graphsage', 'hidden_dims': '[512, 64]', 'dropout': 0.5242204285391953, 'batch_norm': False, 'sage_aggr': 'max', 'sage_normalize': False, 'sage_project': False, 'lr': 0.0001317044056686722, 'weight_decay': 0.000186125084585394, 'epochs': 219, 'loss': 'mae', 'optimizer': 'adam', 'graph_mode': 'knn', 'knn_k': 7, 'weighted_edges': True, 'symmetrize_mode': 'union', 'self_loops': False, 'use_snp_selection': True, 'num_snps': 56819}. Best is trial 25 with value: 0.37075254988769146.
[I 2025-12-09 04:08:32,587] Trial 51 finished with value: 0.3664266688712851 and parameters: {'model_type': 'graphsage', 'hidden_dims': '[256, 128, 64]', 'dropout': 0.5433708289666584, 'batch_norm': False, 'sage_aggr': 'max', 'sage_normalize': False, 'sage_project': False, 'lr': 1.1164980737074783e-05, 'weight_decay': 7.73283912026527e-05, 'epochs': 254, 'loss': 'mae', 'optimizer': 'adam', 'graph_mode': 'cutoff', 'cutoff': 0.7963376324830574, 'grm_norm': 'cosine_then_gcn', 'self_loops': True, 'use_snp_selection': True, 'num_snps': 56327}. Best is trial 25 with value: 0.37075254988769146.
[I 2025-12-09 04:09:59,429] Trial 52 finished with value: 0.3628603257133449 and parameters: {'model_type': 'graphsage', 'hidden_dims': '[256, 128, 64]', 'dropout': 0.554273939498791, 'batch_norm': False, 'sage_aggr': 'max', 'sage_normalize': False, 'sage_project': False, 'lr': 1.3728354189787674e-05, 'weight_decay': 4.517487024645043e-05, 'epochs': 244, 'loss': 'mae', 'optimizer': 'adam', 'graph_mode': 'cutoff', 'cutoff': 0.8100125820418052, 'grm_norm': 'cosine_then_gcn', 'self_loops': True, 'use_snp_selection': True, 'num_snps': 56546}. Best is trial 25 with value: 0.37075254988769146.
[I 2025-12-09 04:11:01,428] Trial 53 finished with value: 0.3587047508108591 and parameters: {'model_type': 'graphsage', 'hidden_dims': '[256, 128, 64]', 'dropout': 0.5876512240679511, 'batch_norm': False, 'sage_aggr': 'max', 'sage_normalize': False, 'sage_project': False, 'lr': 1.0243958354436463e-05, 'weight_decay': 2.0095128631164493e-05, 'epochs': 165, 'loss': 'mae', 'optimizer': 'adam', 'graph_mode': 'cutoff', 'cutoff': 0.7775351993433047, 'grm_norm': 'cosine_then_gcn', 'self_loops': True, 'use_snp_selection': True, 'num_snps': 51832}. Best is trial 25 with value: 0.37075254988769146.
[I 2025-12-09 04:12:12,082] Trial 54 finished with value: 0.3369561783898039 and parameters: {'model_type': 'graphsage', 'hidden_dims': '[256, 128, 64]', 'dropout': 0.22343651276592313, 'batch_norm': False, 'sage_aggr': 'max', 'sage_normalize': False, 'sage_project': False, 'lr': 2.336028234767662e-05, 'weight_decay': 9.027769818678634e-05, 'epochs': 195, 'loss': 'mse', 'optimizer': 'adam', 'graph_mode': 'cutoff', 'cutoff': 0.7133406154615018, 'grm_norm': 'cosine_then_gcn', 'self_loops': True, 'use_snp_selection': True, 'num_snps': 54674}. Best is trial 25 with value: 0.37075254988769146.
[I 2025-12-09 04:14:52,773] Trial 55 finished with value: 0.3593379420578116 and parameters: {'model_type': 'graphsage', 'hidden_dims': '[512, 128]', 'dropout': 0.541455423612711, 'batch_norm': False, 'sage_aggr': 'max', 'sage_normalize': False, 'sage_project': False, 'lr': 1.7115432731656045e-05, 'weight_decay': 0.0005489118230151406, 'epochs': 271, 'loss': 'mae', 'optimizer': 'adam', 'graph_mode': 'cutoff', 'cutoff': 0.8682050580497566, 'grm_norm': 'gcn', 'self_loops': True, 'use_snp_selection': True, 'num_snps': 59981}. Best is trial 25 with value: 0.37075254988769146.
[I 2025-12-09 04:15:47,726] Trial 56 finished with value: 0.3529572551789243 and parameters: {'model_type': 'graphsage', 'hidden_dims': '[512, 128]', 'dropout': 0.13151369101534957, 'batch_norm': False, 'sage_aggr': 'max', 'sage_normalize': False, 'sage_project': False, 'lr': 2.7963810103444396e-05, 'weight_decay': 3.0542709230765764e-05, 'epochs': 239, 'loss': 'mae', 'optimizer': 'adam', 'graph_mode': 'cutoff', 'cutoff': 0.813112751829933, 'grm_norm': 'cosine_then_gcn', 'self_loops': False, 'use_snp_selection': True, 'num_snps': 22192}. Best is trial 25 with value: 0.37075254988769146.
[I 2025-12-09 04:19:39,687] Trial 57 finished with value: 0.17015281232486457 and parameters: {'model_type': 'graphsage', 'hidden_dims': '[512, 256]', 'dropout': 0.5790031664647061, 'batch_norm': False, 'sage_aggr': 'max', 'sage_normalize': False, 'sage_project': False, 'lr': 0.000579521352675857, 'weight_decay': 0.0003259910103075682, 'epochs': 256, 'loss': 'mae', 'optimizer': 'adam', 'graph_mode': 'knn', 'knn_k': 5, 'weighted_edges': True, 'symmetrize_mode': 'union', 'self_loops': True, 'use_snp_selection': False}. Best is trial 25 with value: 0.37075254988769146.
[I 2025-12-09 04:20:43,285] Trial 58 finished with value: 0.3539264049747601 and parameters: {'model_type': 'graphsage', 'hidden_dims': '[256, 128, 64]', 'dropout': 0.5162826463786911, 'batch_norm': False, 'sage_aggr': 'max', 'sage_normalize': False, 'sage_project': False, 'lr': 1.3641350155924128e-05, 'weight_decay': 0.00012590562986798776, 'epochs': 258, 'loss': 'mse', 'optimizer': 'adam', 'graph_mode': 'cutoff', 'cutoff': 0.7649890855932553, 'grm_norm': 'cosine_then_gcn', 'self_loops': True, 'use_snp_selection': True, 'num_snps': 39234}. Best is trial 25 with value: 0.37075254988769146.
[I 2025-12-09 04:21:38,038] Trial 59 finished with value: 0.3588686928074894 and parameters: {'model_type': 'graphsage', 'hidden_dims': '[128, 64]', 'dropout': 0.4506942980446103, 'batch_norm': False, 'sage_aggr': 'mean', 'sage_normalize': False, 'sage_project': False, 'lr': 2.1032188257546306e-05, 'weight_decay': 5.603630888416415e-05, 'epochs': 281, 'loss': 'mae', 'optimizer': 'adam', 'graph_mode': 'cutoff', 'cutoff': 0.6911055488783279, 'grm_norm': 'cosine', 'self_loops': True, 'use_snp_selection': True, 'num_snps': 44562}. Best is trial 25 with value: 0.37075254988769146.
[I 2025-12-09 04:24:04,081] Trial 60 finished with value: 0.35752146168084104 and parameters: {'model_type': 'graphsage', 'hidden_dims': '[512, 128]', 'dropout': 0.5639964019208553, 'batch_norm': False, 'sage_aggr': 'max', 'sage_normalize': False, 'sage_project': False, 'lr': 1.2693197983671177e-05, 'weight_decay': 1.2289103418889607e-05, 'epochs': 321, 'loss': 'mae', 'optimizer': 'adam', 'graph_mode': 'cutoff', 'cutoff': 0.8764416880285284, 'grm_norm': 'cosine_then_gcn', 'self_loops': False, 'use_snp_selection': True, 'num_snps': 47967}. Best is trial 25 with value: 0.37075254988769146.
[I 2025-12-09 04:25:38,784] Trial 61 finished with value: 0.3620559334116589 and parameters: {'model_type': 'graphsage', 'hidden_dims': '[256, 128, 64]', 'dropout': 0.5395687264437082, 'batch_norm': False, 'sage_aggr': 'max', 'sage_normalize': False, 'sage_project': False, 'lr': 1.0379061324521213e-05, 'weight_decay': 7.48578171135437e-05, 'epochs': 256, 'loss': 'mae', 'optimizer': 'adam', 'graph_mode': 'cutoff', 'cutoff': 0.802128360161943, 'grm_norm': 'cosine_then_gcn', 'self_loops': True, 'use_snp_selection': True, 'num_snps': 57398}. Best is trial 25 with value: 0.37075254988769146.
[I 2025-12-09 04:27:22,942] Trial 62 finished with value: 0.3520922154153253 and parameters: {'model_type': 'graphsage', 'hidden_dims': '[256, 128, 64]', 'dropout': 0.5308668021873431, 'batch_norm': False, 'sage_aggr': 'max', 'sage_normalize': False, 'sage_project': False, 'lr': 1.694934799624383e-05, 'weight_decay': 0.00021173096965256788, 'epochs': 289, 'loss': 'mae', 'optimizer': 'adam', 'graph_mode': 'cutoff', 'cutoff': 0.828798428372857, 'grm_norm': 'cosine_then_gcn', 'self_loops': True, 'use_snp_selection': True, 'num_snps': 57123}. Best is trial 25 with value: 0.37075254988769146.
[I 2025-12-09 04:28:51,013] Trial 63 finished with value: 0.3652536664125528 and parameters: {'model_type': 'graphsage', 'hidden_dims': '[256, 128, 64]', 'dropout': 0.5033024802763775, 'batch_norm': False, 'sage_aggr': 'max', 'sage_normalize': False, 'sage_project': False, 'lr': 1.0177745247042056e-05, 'weight_decay': 4.2980874741456134e-05, 'epochs': 269, 'loss': 'mae', 'optimizer': 'adam', 'graph_mode': 'cutoff', 'cutoff': 0.7831956816721289, 'grm_norm': 'cosine_then_gcn', 'self_loops': True, 'use_snp_selection': True, 'num_snps': 51507}. Best is trial 25 with value: 0.37075254988769146.
[I 2025-12-09 04:30:22,004] Trial 64 finished with value: 0.3618472890518437 and parameters: {'model_type': 'graphsage', 'hidden_dims': '[256, 128, 64]', 'dropout': 0.48249798996680826, 'batch_norm': False, 'sage_aggr': 'max', 'sage_normalize': False, 'sage_project': False, 'lr': 1.2446824484146645e-05, 'weight_decay': 4.1291135593644767e-05, 'epochs': 268, 'loss': 'mae', 'optimizer': 'adam', 'graph_mode': 'cutoff', 'cutoff': 0.7436890543669439, 'grm_norm': 'cosine_then_gcn', 'self_loops': True, 'use_snp_selection': True, 'num_snps': 52873}. Best is trial 25 with value: 0.37075254988769146.
[I 2025-12-09 04:31:40,721] Trial 65 finished with value: 0.35065629710735063 and parameters: {'model_type': 'graphsage', 'hidden_dims': '[256, 128]', 'dropout': 0.5024707026413319, 'batch_norm': False, 'sage_aggr': 'max', 'sage_normalize': False, 'sage_project': False, 'lr': 3.431339471965723e-05, 'weight_decay': 1.5660896285193107e-05, 'epochs': 240, 'loss': 'mae', 'optimizer': 'adam', 'graph_mode': 'cutoff', 'cutoff': 0.7194138240305366, 'grm_norm': 'cosine_then_gcn', 'self_loops': True, 'use_snp_selection': True, 'num_snps': 50825}. Best is trial 25 with value: 0.37075254988769146.
[I 2025-12-09 04:33:33,301] Trial 66 finished with value: 0.3336815624478568 and parameters: {'model_type': 'graphsage', 'hidden_dims': '[512, 128]', 'dropout': 0.599545612185245, 'batch_norm': False, 'sage_aggr': 'max', 'sage_normalize': True, 'sage_project': False, 'lr': 0.00031881865905525325, 'weight_decay': 7.292509078494935e-06, 'epochs': 201, 'loss': 'mae', 'optimizer': 'adam', 'graph_mode': 'cutoff', 'cutoff': 0.7682040648268755, 'grm_norm': 'gcn', 'self_loops': True, 'use_snp_selection': True, 'num_snps': 54894}. Best is trial 25 with value: 0.37075254988769146.
[I 2025-12-09 04:34:14,226] Trial 67 finished with value: 0.32149622797420896 and parameters: {'model_type': 'graphsage', 'hidden_dims': '[128, 64]', 'dropout': 0.5574283843397088, 'batch_norm': True, 'sage_aggr': 'max', 'sage_normalize': False, 'sage_project': False, 'lr': 1.59014655651152e-05, 'weight_decay': 2.5834425823448812e-05, 'epochs': 226, 'loss': 'mae', 'optimizer': 'adam', 'graph_mode': 'cutoff', 'cutoff': 0.6399211985214285, 'grm_norm': 'cosine_then_gcn', 'self_loops': True, 'use_snp_selection': False}. Best is trial 25 with value: 0.37075254988769146.
[I 2025-12-09 04:40:14,803] Trial 68 finished with value: 0.3505167310725675 and parameters: {'model_type': 'graphsage', 'hidden_dims': '[512, 128]', 'dropout': 0.5855839455416448, 'batch_norm': False, 'sage_aggr': 'max', 'sage_normalize': False, 'sage_project': False, 'lr': 2.715990839196485e-05, 'weight_decay': 0.00010147152715951856, 'epochs': 306, 'loss': 'mae', 'optimizer': 'adam', 'graph_mode': 'knn', 'knn_k': 8, 'weighted_edges': True, 'symmetrize_mode': 'union', 'self_loops': True, 'use_snp_selection': True, 'num_snps': 41560}. Best is trial 25 with value: 0.37075254988769146.
[I 2025-12-09 04:42:27,667] Trial 69 finished with value: 0.3378642165704199 and parameters: {'model_type': 'graphsage', 'hidden_dims': '[512, 256]', 'dropout': 0.5684404179413928, 'batch_norm': False, 'sage_aggr': 'max', 'sage_normalize': False, 'sage_project': False, 'lr': 2.056435542947404e-05, 'weight_decay': 5.303147172645453e-05, 'epochs': 278, 'loss': 'mse', 'optimizer': 'adam', 'graph_mode': 'cutoff', 'cutoff': 0.6623148655300403, 'grm_norm': 'cosine_then_gcn', 'self_loops': True, 'use_snp_selection': True, 'num_snps': 48950}. Best is trial 25 with value: 0.37075254988769146.
[I 2025-12-09 04:46:39,814] Trial 70 finished with value: 0.3301545978582169 and parameters: {'model_type': 'graphsage', 'hidden_dims': '[256, 128, 64]', 'dropout': 0.41700771936514763, 'batch_norm': False, 'sage_aggr': 'max', 'sage_normalize': False, 'sage_project': False, 'lr': 1.246943922786171e-05, 'weight_decay': 0.0002577507216098419, 'epochs': 295, 'loss': 'mae', 'optimizer': 'adam', 'graph_mode': 'cutoff', 'cutoff': 0.3201090212669987, 'grm_norm': 'none', 'self_loops': True, 'use_snp_selection': True, 'num_snps': 51674}. Best is trial 25 with value: 0.37075254988769146.
