[I 2025-12-09 14:59:51,363] Trial 31 finished with value: 0.36193647019792446 and parameters: {'model_type': 'graphsage', 'hidden_dims': '[256, 128]', 'dropout': 0.2207284099750628, 'batch_norm': False, 'sage_aggr': 'max', 'sage_normalize': False, 'sage_project': False, 'lr': 0.00011761649755688634, 'weight_decay': 2.592151035313084e-05, 'epochs': 159, 'loss': 'mae', 'optimizer': 'adam', 'graph_mode': 'cutoff', 'cutoff': 0.5046276854430878, 'grm_norm': 'cosine', 'self_loops': True, 'use_snp_selection': True, 'num_snps': 36127}. Best is trial 17 with value: 0.3762292983403702.
[I 2025-12-09 15:00:35,157] Trial 32 finished with value: 0.369000792174525 and parameters: {'model_type': 'graphsage', 'hidden_dims': '[256, 128]', 'dropout': 0.17253105178328357, 'batch_norm': False, 'sage_aggr': 'max', 'sage_normalize': False, 'sage_project': False, 'lr': 6.851084016091671e-05, 'weight_decay': 9.001534492600415e-05, 'epochs': 135, 'loss': 'mae', 'optimizer': 'adam', 'graph_mode': 'cutoff', 'cutoff': 0.526769351709601, 'grm_norm': 'cosine', 'self_loops': False, 'use_snp_selection': True, 'num_snps': 38052}. Best is trial 17 with value: 0.3762292983403702.
[I 2025-12-09 15:01:08,593] Trial 33 finished with value: 0.37239159230191987 and parameters: {'model_type': 'graphsage', 'hidden_dims': '[256, 128]', 'dropout': 0.13616219207395894, 'batch_norm': False, 'sage_aggr': 'max', 'sage_normalize': False, 'sage_project': False, 'lr': 4.6802591151931975e-05, 'weight_decay': 6.9751650903161e-05, 'epochs': 140, 'loss': 'mae', 'optimizer': 'adam', 'graph_mode': 'cutoff', 'cutoff': 0.4505203418442465, 'grm_norm': 'cosine', 'self_loops': True, 'use_snp_selection': True, 'num_snps': 20944}. Best is trial 17 with value: 0.3762292983403702.
[I 2025-12-09 15:01:45,732] Trial 34 finished with value: 0.371269349640119 and parameters: {'model_type': 'graphsage', 'hidden_dims': '[256, 128]', 'dropout': 0.12929109880768014, 'batch_norm': False, 'sage_aggr': 'max', 'sage_normalize': False, 'sage_project': False, 'lr': 4.006233751109492e-05, 'weight_decay': 4.7056871722302874e-05, 'epochs': 172, 'loss': 'mae', 'optimizer': 'adam', 'graph_mode': 'cutoff', 'cutoff': 0.44987663239006037, 'grm_norm': 'cosine', 'self_loops': True, 'use_snp_selection': True, 'num_snps': 20060}. Best is trial 17 with value: 0.3762292983403702.
[I 2025-12-09 15:02:27,348] Trial 35 finished with value: 0.37241011402951196 and parameters: {'model_type': 'graphsage', 'hidden_dims': '[256, 128]', 'dropout': 0.12514767710222058, 'batch_norm': False, 'sage_aggr': 'max', 'sage_normalize': False, 'sage_project': False, 'lr': 3.53383863499464e-05, 'weight_decay': 5.640760779816776e-05, 'epochs': 168, 'loss': 'mae', 'optimizer': 'adam', 'graph_mode': 'cutoff', 'cutoff': 0.45325761292419253, 'grm_norm': 'cosine', 'self_loops': True, 'use_snp_selection': True, 'num_snps': 23172}. Best is trial 17 with value: 0.3762292983403702.
[I 2025-12-09 15:03:14,294] Trial 36 finished with value: 0.35730561399944066 and parameters: {'model_type': 'graphsage', 'hidden_dims': '[512, 256]', 'dropout': 0.12866895552270585, 'batch_norm': True, 'sage_aggr': 'max', 'sage_normalize': False, 'sage_project': False, 'lr': 4.0335854716866164e-05, 'weight_decay': 5.820437852018554e-05, 'epochs': 140, 'loss': 'mae', 'optimizer': 'adam', 'graph_mode': 'cutoff', 'cutoff': 0.6312774286974002, 'grm_norm': 'cosine', 'self_loops': True, 'use_snp_selection': True, 'num_snps': 28724}. Best is trial 17 with value: 0.3762292983403702.
[I 2025-12-09 15:04:25,666] Trial 37 finished with value: 0.36239644445282815 and parameters: {'model_type': 'graphsage', 'hidden_dims': '[256, 128]', 'dropout': 0.39350286193211126, 'batch_norm': False, 'sage_aggr': 'max', 'sage_normalize': False, 'sage_project': False, 'lr': 2.034964558142042e-05, 'weight_decay': 0.00014841136484024684, 'epochs': 169, 'loss': 'mae', 'optimizer': 'adam', 'graph_mode': 'cutoff', 'cutoff': 0.46156514901491397, 'grm_norm': 'cosine', 'self_loops': True, 'use_snp_selection': False}. Best is trial 17 with value: 0.3762292983403702.
[I 2025-12-09 15:04:51,573] Trial 38 finished with value: 0.30699745935405903 and parameters: {'model_type': 'graphsage', 'hidden_dims': '[256, 128, 64]', 'dropout': 0.11907773412998646, 'batch_norm': True, 'sage_aggr': 'mean', 'sage_normalize': True, 'sage_project': False, 'lr': 3.142320234634348e-05, 'weight_decay': 0.0003638904151274244, 'epochs': 88, 'loss': 'mae', 'optimizer': 'adam', 'graph_mode': 'cutoff', 'cutoff': 0.4102932181521539, 'grm_norm': 'cosine', 'self_loops': True, 'use_snp_selection': True, 'num_snps': 22363}. Best is trial 17 with value: 0.3762292983403702.
[I 2025-12-09 15:05:18,971] Trial 39 finished with value: 0.3645648592824349 and parameters: {'model_type': 'graphsage', 'hidden_dims': '[512, 64]', 'dropout': 0.1839044481143916, 'batch_norm': False, 'sage_aggr': 'max', 'sage_normalize': False, 'sage_project': False, 'lr': 5.5940570895663964e-05, 'weight_decay': 5.965072830735283e-05, 'epochs': 168, 'loss': 'mae', 'optimizer': 'adam', 'graph_mode': 'cutoff', 'cutoff': 0.4803312253582032, 'grm_norm': 'gcn', 'self_loops': True, 'use_snp_selection': True, 'num_snps': 9631}. Best is trial 17 with value: 0.3762292983403702.
[I 2025-12-09 15:07:55,018] Trial 40 finished with value: 0.3365727945684577 and parameters: {'model_type': 'graphsage', 'hidden_dims': '[256, 128]', 'dropout': 0.10036210805302771, 'batch_norm': True, 'sage_aggr': 'max', 'sage_normalize': False, 'sage_project': False, 'lr': 1.4643982296413416e-05, 'weight_decay': 0.0001962544446506851, 'epochs': 148, 'loss': 'mae', 'optimizer': 'adam', 'graph_mode': 'knn', 'knn_k': 10, 'weighted_edges': True, 'symmetrize_mode': 'union', 'self_loops': True, 'use_snp_selection': False}. Best is trial 17 with value: 0.3762292983403702.
[I 2025-12-09 15:08:29,173] Trial 41 finished with value: 0.37071952325271773 and parameters: {'model_type': 'graphsage', 'hidden_dims': '[256, 128]', 'dropout': 0.14252507825139946, 'batch_norm': False, 'sage_aggr': 'max', 'sage_normalize': False, 'sage_project': False, 'lr': 2.393780323479402e-05, 'weight_decay': 1.90228787459172e-05, 'epochs': 183, 'loss': 'mae', 'optimizer': 'adam', 'graph_mode': 'cutoff', 'cutoff': 0.4797854427600242, 'grm_norm': 'cosine', 'self_loops': True, 'use_snp_selection': True, 'num_snps': 16583}. Best is trial 17 with value: 0.3762292983403702.
[I 2025-12-09 15:09:06,777] Trial 42 finished with value: 0.36552126377988514 and parameters: {'model_type': 'graphsage', 'hidden_dims': '[256, 128]', 'dropout': 0.13477403380095102, 'batch_norm': False, 'sage_aggr': 'max', 'sage_normalize': False, 'sage_project': False, 'lr': 2.0355151015372276e-05, 'weight_decay': 2.003102730794492e-05, 'epochs': 178, 'loss': 'mae', 'optimizer': 'adam', 'graph_mode': 'cutoff', 'cutoff': 0.5003672391722411, 'grm_norm': 'cosine', 'self_loops': True, 'use_snp_selection': True, 'num_snps': 22613}. Best is trial 17 with value: 0.3762292983403702.
[I 2025-12-09 15:09:27,859] Trial 43 finished with value: 0.3614453358665425 and parameters: {'model_type': 'graphsage', 'hidden_dims': '[128, 64]', 'dropout': 0.15000770547541933, 'batch_norm': False, 'sage_aggr': 'max', 'sage_normalize': False, 'sage_project': False, 'lr': 4.486736159185484e-05, 'weight_decay': 4.6739046645345566e-05, 'epochs': 190, 'loss': 'mae', 'optimizer': 'adam', 'graph_mode': 'cutoff', 'cutoff': 0.5504486999998042, 'grm_norm': 'none', 'self_loops': True, 'use_snp_selection': True, 'num_snps': 15010}. Best is trial 17 with value: 0.3762292983403702.
[I 2025-12-09 15:10:19,458] Trial 44 finished with value: 0.36776714900507534 and parameters: {'model_type': 'graphsage', 'hidden_dims': '[512, 128]', 'dropout': 0.21104978785075046, 'batch_norm': False, 'sage_aggr': 'mean', 'sage_normalize': False, 'sage_project': False, 'lr': 2.8751444865094892e-05, 'weight_decay': 0.00012639375173971673, 'epochs': 131, 'loss': 'mae', 'optimizer': 'adam', 'graph_mode': 'cutoff', 'cutoff': 0.4467382747223161, 'grm_norm': 'cosine', 'self_loops': True, 'use_snp_selection': True, 'num_snps': 27020}. Best is trial 17 with value: 0.3762292983403702.
[I 2025-12-09 15:11:15,608] Trial 45 finished with value: 0.35770004666114763 and parameters: {'model_type': 'graphsage', 'hidden_dims': '[512, 256]', 'dropout': 0.12246154680276071, 'batch_norm': False, 'sage_aggr': 'max', 'sage_normalize': True, 'sage_project': False, 'lr': 1.0414922787295443e-05, 'weight_decay': 9.269126653724977e-06, 'epochs': 158, 'loss': 'mse', 'optimizer': 'adam', 'graph_mode': 'cutoff', 'cutoff': 0.6184610021546542, 'grm_norm': 'cosine_then_gcn', 'self_loops': True, 'use_snp_selection': True, 'num_snps': 31972}. Best is trial 17 with value: 0.3762292983403702.
[I 2025-12-09 15:12:40,206] Trial 46 finished with value: 0.363345669046495 and parameters: {'model_type': 'graphsage', 'hidden_dims': '[256, 128]', 'dropout': 0.2731922068161621, 'batch_norm': False, 'sage_aggr': 'max', 'sage_normalize': False, 'sage_project': False, 'lr': 1.5412282537450678e-05, 'weight_decay': 8.373169105594098e-05, 'epochs': 218, 'loss': 'mae', 'optimizer': 'adam', 'graph_mode': 'knn', 'knn_k': 5, 'weighted_edges': True, 'symmetrize_mode': 'union', 'self_loops': True, 'use_snp_selection': True, 'num_snps': 24094}. Best is trial 17 with value: 0.3762292983403702.
[I 2025-12-09 15:13:05,285] Trial 47 finished with value: 0.34565209544011444 and parameters: {'model_type': 'graphsage', 'hidden_dims': '[256, 128, 64]', 'dropout': 0.3364148722270578, 'batch_norm': False, 'sage_aggr': 'max', 'sage_normalize': False, 'sage_project': False, 'lr': 9.14810627081592e-05, 'weight_decay': 2.5762903302959387e-05, 'epochs': 94, 'loss': 'mae', 'optimizer': 'adam', 'graph_mode': 'cutoff', 'cutoff': 0.4210441721481989, 'grm_norm': 'none', 'self_loops': True, 'use_snp_selection': True, 'num_snps': 18713}. Best is trial 17 with value: 0.3762292983403702.
[I 2025-12-09 15:13:22,912] Trial 48 finished with value: 0.34010725158445476 and parameters: {'model_type': 'graphsage', 'hidden_dims': '[256, 128]', 'dropout': 0.22937549553407235, 'batch_norm': True, 'sage_aggr': 'max', 'sage_normalize': False, 'sage_project': False, 'lr': 5.643306978859752e-05, 'weight_decay': 3.8275889218487826e-05, 'epochs': 170, 'loss': 'mse', 'optimizer': 'adam', 'graph_mode': 'cutoff', 'cutoff': 0.5606467232928962, 'grm_norm': 'gcn', 'self_loops': True, 'use_snp_selection': True, 'num_snps': 9021}. Best is trial 17 with value: 0.3762292983403702.
[I 2025-12-09 15:13:36,608] Trial 49 finished with value: 0.33941169262782017 and parameters: {'model_type': 'graphsage', 'hidden_dims': '[512, 64]', 'dropout': 0.1688648980170265, 'batch_norm': False, 'sage_aggr': 'mean', 'sage_normalize': True, 'sage_project': False, 'lr': 2.4999123966947946e-05, 'weight_decay': 2.016899383547716e-05, 'epochs': 193, 'loss': 'mae', 'optimizer': 'adam', 'graph_mode': 'cutoff', 'cutoff': 0.47364574940950305, 'grm_norm': 'cosine', 'self_loops': True, 'use_snp_selection': True, 'num_snps': 2236}. Best is trial 17 with value: 0.3762292983403702.
[I 2025-12-09 15:16:05,008] Trial 50 finished with value: 0.3399411286357887 and parameters: {'model_type': 'graphsage', 'hidden_dims': '[256, 128]', 'dropout': 0.4923757848293242, 'batch_norm': False, 'sage_aggr': 'max', 'sage_normalize': False, 'sage_project': False, 'lr': 1.88156166120087e-05, 'weight_decay': 8.927763644056321e-05, 'epochs': 126, 'loss': 'mae', 'optimizer': 'adam', 'graph_mode': 'knn', 'knn_k': 7, 'weighted_edges': True, 'symmetrize_mode': 'union', 'self_loops': True, 'use_snp_selection': True, 'num_snps': 46285}. Best is trial 17 with value: 0.3762292983403702.
[I 2025-12-09 15:16:39,813] Trial 51 finished with value: 0.3728941027970271 and parameters: {'model_type': 'graphsage', 'hidden_dims': '[256, 128]', 'dropout': 0.14366072100903576, 'batch_norm': False, 'sage_aggr': 'max', 'sage_normalize': False, 'sage_project': False, 'lr': 3.6763339424448136e-05, 'weight_decay': 8.075109476379056e-06, 'epochs': 196, 'loss': 'mae', 'optimizer': 'adam', 'graph_mode': 'cutoff', 'cutoff': 0.39530988401501543, 'grm_norm': 'cosine', 'self_loops': True, 'use_snp_selection': True, 'num_snps': 16192}. Best is trial 17 with value: 0.3762292983403702.
[I 2025-12-09 15:17:11,114] Trial 52 finished with value: 0.35969206006691545 and parameters: {'model_type': 'graphsage', 'hidden_dims': '[256, 128]', 'dropout': 0.14246834799986346, 'batch_norm': False, 'sage_aggr': 'max', 'sage_normalize': False, 'sage_project': False, 'lr': 4.236659896765195e-05, 'weight_decay': 1.3835698020728482e-05, 'epochs': 151, 'loss': 'mae', 'optimizer': 'adam', 'graph_mode': 'cutoff', 'cutoff': 0.3214821459678121, 'grm_norm': 'cosine', 'self_loops': True, 'use_snp_selection': True, 'num_snps': 15648}. Best is trial 17 with value: 0.3762292983403702.
[I 2025-12-09 15:18:03,327] Trial 53 finished with value: 0.3794702187575015 and parameters: {'model_type': 'graphsage', 'hidden_dims': '[256, 128]', 'dropout': 0.1175248892101372, 'batch_norm': False, 'sage_aggr': 'max', 'sage_normalize': False, 'sage_project': False, 'lr': 3.607402203806377e-05, 'weight_decay': 9.824897772079193e-06, 'epochs': 238, 'loss': 'mae', 'optimizer': 'adam', 'graph_mode': 'cutoff', 'cutoff': 0.398728202160219, 'grm_norm': 'cosine', 'self_loops': True, 'use_snp_selection': True, 'num_snps': 21451}. Best is trial 53 with value: 0.3794702187575015.
[I 2025-12-09 15:18:52,758] Trial 54 finished with value: 0.3764056454077642 and parameters: {'model_type': 'graphsage', 'hidden_dims': '[256, 128]', 'dropout': 0.11605507991545892, 'batch_norm': False, 'sage_aggr': 'max', 'sage_normalize': False, 'sage_project': False, 'lr': 3.305146303935427e-05, 'weight_decay': 7.796675202032111e-06, 'epochs': 224, 'loss': 'mae', 'optimizer': 'adam', 'graph_mode': 'cutoff', 'cutoff': 0.4034053999950362, 'grm_norm': 'cosine', 'self_loops': True, 'use_snp_selection': True, 'num_snps': 21456}. Best is trial 53 with value: 0.3794702187575015.
[I 2025-12-09 15:20:24,414] Trial 55 finished with value: 0.37723226217080663 and parameters: {'model_type': 'graphsage', 'hidden_dims': '[512, 128]', 'dropout': 0.11505737932228702, 'batch_norm': False, 'sage_aggr': 'max', 'sage_normalize': False, 'sage_project': False, 'lr': 0.00010082987935338956, 'weight_decay': 8.378357292314502e-06, 'epochs': 241, 'loss': 'mse', 'optimizer': 'adam', 'graph_mode': 'cutoff', 'cutoff': 0.40376556980923184, 'grm_norm': 'cosine', 'self_loops': True, 'use_snp_selection': True, 'num_snps': 26679}. Best is trial 53 with value: 0.3794702187575015.
[I 2025-12-09 15:21:54,120] Trial 56 finished with value: 0.37605693703952114 and parameters: {'model_type': 'graphsage', 'hidden_dims': '[512, 128]', 'dropout': 0.11171492584192559, 'batch_norm': False, 'sage_aggr': 'max', 'sage_normalize': False, 'sage_project': False, 'lr': 0.00011012462701720859, 'weight_decay': 9.182192192838233e-06, 'epochs': 238, 'loss': 'mse', 'optimizer': 'adam', 'graph_mode': 'cutoff', 'cutoff': 0.4046333942220322, 'grm_norm': 'cosine', 'self_loops': False, 'use_snp_selection': True, 'num_snps': 27083}. Best is trial 53 with value: 0.3794702187575015.
[I 2025-12-09 15:24:59,048] Trial 57 finished with value: 0.3500604343067944 and parameters: {'model_type': 'graphsage', 'hidden_dims': '[512, 128]', 'dropout': 0.11466577432111497, 'batch_norm': False, 'sage_aggr': 'max', 'sage_normalize': False, 'sage_project': False, 'lr': 9.502256043537312e-05, 'weight_decay': 8.272485311615183e-06, 'epochs': 273, 'loss': 'mse', 'optimizer': 'adam', 'graph_mode': 'cutoff', 'cutoff': 0.39916595097173874, 'grm_norm': 'cosine', 'self_loops': False, 'use_snp_selection': False}. Best is trial 53 with value: 0.3794702187575015.
[I 2025-12-09 15:27:20,408] Trial 58 finished with value: 0.34601309254167645 and parameters: {'model_type': 'graphsage', 'hidden_dims': '[512, 128]', 'dropout': 0.18308920928199746, 'batch_norm': False, 'sage_aggr': 'max', 'sage_normalize': False, 'sage_project': False, 'lr': 6.964771441084463e-05, 'weight_decay': 6.584641349591863e-06, 'epochs': 240, 'loss': 'mse', 'optimizer': 'adam', 'graph_mode': 'knn', 'knn_k': 8, 'weighted_edges': False, 'symmetrize_mode': 'mutual', 'self_loops': False, 'use_snp_selection': True, 'num_snps': 34218}. Best is trial 53 with value: 0.3794702187575015.
[I 2025-12-09 15:29:27,040] Trial 59 finished with value: 0.35268395837326855 and parameters: {'model_type': 'graphsage', 'hidden_dims': '[512, 128]', 'dropout': 0.10848914335542, 'batch_norm': False, 'sage_aggr': 'mean', 'sage_normalize': False, 'sage_project': False, 'lr': 0.00010586918599708484, 'weight_decay': 1.2015852249981908e-05, 'epochs': 308, 'loss': 'mse', 'optimizer': 'adam', 'graph_mode': 'cutoff', 'cutoff': 0.3361130703819107, 'grm_norm': 'cosine', 'self_loops': False, 'use_snp_selection': True, 'num_snps': 28540}. Best is trial 53 with value: 0.3794702187575015.
[I 2025-12-09 15:30:29,277] Trial 60 finished with value: 0.3414049221733069 and parameters: {'model_type': 'graphsage', 'hidden_dims': '[512, 128]', 'dropout': 0.1703081767842491, 'batch_norm': False, 'sage_aggr': 'max', 'sage_normalize': False, 'sage_project': False, 'lr': 7.284679475786458e-05, 'weight_decay': 1.5693079792323407e-06, 'epochs': 222, 'loss': 'mse', 'optimizer': 'adam', 'graph_mode': 'cutoff', 'cutoff': 0.8695669929796743, 'grm_norm': 'cosine_then_gcn', 'self_loops': False, 'use_snp_selection': True, 'num_snps': 27362}. Best is trial 53 with value: 0.3794702187575015.
[I 2025-12-09 15:31:51,054] Trial 61 finished with value: 0.3751619563023893 and parameters: {'model_type': 'graphsage', 'hidden_dims': '[512, 128]', 'dropout': 0.1530067849640489, 'batch_norm': False, 'sage_aggr': 'max', 'sage_normalize': False, 'sage_project': False, 'lr': 3.525808229026039e-05, 'weight_decay': 4.669051225055058e-06, 'epochs': 238, 'loss': 'mse', 'optimizer': 'adam', 'graph_mode': 'cutoff', 'cutoff': 0.39906854888235427, 'grm_norm': 'cosine', 'self_loops': False, 'use_snp_selection': True, 'num_snps': 24363}. Best is trial 53 with value: 0.3794702187575015.
[I 2025-12-09 15:33:15,276] Trial 62 finished with value: 0.38241543888456686 and parameters: {'model_type': 'graphsage', 'hidden_dims': '[512, 128]', 'dropout': 0.1548719731788502, 'batch_norm': False, 'sage_aggr': 'max', 'sage_normalize': False, 'sage_project': False, 'lr': 5.3684535619030285e-05, 'weight_decay': 4.50863700031562e-06, 'epochs': 237, 'loss': 'mse', 'optimizer': 'adam', 'graph_mode': 'cutoff', 'cutoff': 0.3955499598496082, 'grm_norm': 'cosine', 'self_loops': False, 'use_snp_selection': True, 'num_snps': 25486}. Best is trial 62 with value: 0.38241543888456686.
[I 2025-12-09 15:35:11,602] Trial 63 finished with value: 0.3749852897002485 and parameters: {'model_type': 'graphsage', 'hidden_dims': '[512, 128]', 'dropout': 0.10026702588073036, 'batch_norm': False, 'sage_aggr': 'max', 'sage_normalize': False, 'sage_project': False, 'lr': 5.4091755660574134e-05, 'weight_decay': 4.755852350837982e-06, 'epochs': 240, 'loss': 'mse', 'optimizer': 'adam', 'graph_mode': 'cutoff', 'cutoff': 0.2851656669805769, 'grm_norm': 'cosine', 'self_loops': False, 'use_snp_selection': True, 'num_snps': 25087}. Best is trial 62 with value: 0.38241543888456686.
[I 2025-12-09 15:37:06,141] Trial 64 finished with value: 0.35897053928160916 and parameters: {'model_type': 'graphsage', 'hidden_dims': '[512, 128]', 'dropout': 0.1583966954799825, 'batch_norm': False, 'sage_aggr': 'max', 'sage_normalize': False, 'sage_project': False, 'lr': 0.00013502391765480036, 'weight_decay': 3.533448205884208e-06, 'epochs': 251, 'loss': 'mse', 'optimizer': 'adam', 'graph_mode': 'cutoff', 'cutoff': 0.3676352540144277, 'grm_norm': 'cosine', 'self_loops': False, 'use_snp_selection': True, 'num_snps': 30725}. Best is trial 62 with value: 0.38241543888456686.
[I 2025-12-09 15:39:16,502] Trial 65 finished with value: 0.3787913780537119 and parameters: {'model_type': 'graphsage', 'hidden_dims': '[512, 128]', 'dropout': 0.11417913308835098, 'batch_norm': False, 'sage_aggr': 'max', 'sage_normalize': False, 'sage_project': False, 'lr': 2.8907469509124216e-05, 'weight_decay': 2.3880743254709812e-06, 'epochs': 273, 'loss': 'mse', 'optimizer': 'adam', 'graph_mode': 'cutoff', 'cutoff': 0.41752393743240496, 'grm_norm': 'cosine', 'self_loops': False, 'use_snp_selection': True, 'num_snps': 33210}. Best is trial 62 with value: 0.38241543888456686.
[I 2025-12-09 15:41:37,498] Trial 66 finished with value: 0.3703448082054794 and parameters: {'model_type': 'graphsage', 'hidden_dims': '[512, 128]', 'dropout': 0.11566772715234716, 'batch_norm': False, 'sage_aggr': 'max', 'sage_normalize': False, 'sage_project': False, 'lr': 2.449522874030508e-05, 'weight_decay': 2.78543888220101e-06, 'epochs': 278, 'loss': 'mse', 'optimizer': 'adam', 'graph_mode': 'cutoff', 'cutoff': 0.4265340641335695, 'grm_norm': 'cosine', 'self_loops': False, 'use_snp_selection': True, 'num_snps': 35080}. Best is trial 62 with value: 0.38241543888456686.
[I 2025-12-09 15:43:58,549] Trial 67 finished with value: 0.34084775237568105 and parameters: {'model_type': 'graphsage', 'hidden_dims': '[512, 128]', 'dropout': 0.362866843767867, 'batch_norm': False, 'sage_aggr': 'max', 'sage_normalize': True, 'sage_project': False, 'lr': 7.175457039363272e-05, 'weight_decay': 2.0864945751274816e-06, 'epochs': 261, 'loss': 'mse', 'optimizer': 'adam', 'graph_mode': 'cutoff', 'cutoff': 0.340801483194746, 'grm_norm': 'cosine', 'self_loops': False, 'use_snp_selection': True, 'num_snps': 32902}. Best is trial 62 with value: 0.38241543888456686.
