[I 2025-12-09 05:21:44,094] Trial 127 finished with value: 0.3155037816123497 and parameters: {'model_type': 'graphsage', 'hidden_dims': '[512, 128]', 'dropout': 0.5190260754035747, 'batch_norm': True, 'sage_aggr': 'max', 'sage_normalize': True, 'sage_project': False, 'lr': 0.0032420329179363777, 'weight_decay': 4.689540280813958e-05, 'epochs': 174, 'loss': 'mse', 'optimizer': 'adam', 'graph_mode': 'cutoff', 'cutoff': 0.7746206091021219, 'grm_norm': 'cosine', 'self_loops': False, 'use_snp_selection': False}. Best is trial 97 with value: 0.32167090191646536.
[I 2025-12-09 05:22:27,753] Trial 128 finished with value: 0.3039922231110221 and parameters: {'model_type': 'graphsage', 'hidden_dims': '[256, 128]', 'dropout': 0.5471509003158194, 'batch_norm': True, 'sage_aggr': 'max', 'sage_normalize': True, 'sage_project': False, 'lr': 0.003725786242604836, 'weight_decay': 1.6539697516285262e-05, 'epochs': 152, 'loss': 'mae', 'optimizer': 'adam', 'graph_mode': 'cutoff', 'cutoff': 0.7903367857896615, 'grm_norm': 'cosine', 'self_loops': False, 'use_snp_selection': False}. Best is trial 97 with value: 0.32167090191646536.
[I 2025-12-09 05:23:54,481] Trial 129 finished with value: 0.3212247761280221 and parameters: {'model_type': 'graphsage', 'hidden_dims': '[512, 64]', 'dropout': 0.48912865129938515, 'batch_norm': True, 'sage_aggr': 'max', 'sage_normalize': True, 'sage_project': False, 'lr': 0.0045107696510471905, 'weight_decay': 2.1388222204849938e-05, 'epochs': 189, 'loss': 'mse', 'optimizer': 'adam', 'graph_mode': 'cutoff', 'cutoff': 0.8256394673266013, 'grm_norm': 'cosine', 'self_loops': False, 'use_snp_selection': False}. Best is trial 97 with value: 0.32167090191646536.
[I 2025-12-09 05:25:20,340] Trial 130 finished with value: 0.3194177776688492 and parameters: {'model_type': 'graphsage', 'hidden_dims': '[512, 64]', 'dropout': 0.487707259508698, 'batch_norm': True, 'sage_aggr': 'max', 'sage_normalize': True, 'sage_project': False, 'lr': 0.004480438236382248, 'weight_decay': 0.0005043958729026676, 'epochs': 187, 'loss': 'mse', 'optimizer': 'adam', 'graph_mode': 'cutoff', 'cutoff': 0.8276837708436282, 'grm_norm': 'cosine', 'self_loops': False, 'use_snp_selection': False}. Best is trial 97 with value: 0.32167090191646536.
[I 2025-12-09 05:26:46,943] Trial 131 finished with value: 0.31623719503792336 and parameters: {'model_type': 'graphsage', 'hidden_dims': '[512, 64]', 'dropout': 0.4907017443997795, 'batch_norm': True, 'sage_aggr': 'max', 'sage_normalize': True, 'sage_project': False, 'lr': 0.004371841351475013, 'weight_decay': 2.2083121752016375e-05, 'epochs': 189, 'loss': 'mse', 'optimizer': 'adam', 'graph_mode': 'cutoff', 'cutoff': 0.8141922410090716, 'grm_norm': 'cosine', 'self_loops': False, 'use_snp_selection': False}. Best is trial 97 with value: 0.32167090191646536.
[I 2025-12-09 05:28:15,901] Trial 132 finished with value: 0.30792090873170735 and parameters: {'model_type': 'graphsage', 'hidden_dims': '[512, 64]', 'dropout': 0.5122357215832757, 'batch_norm': True, 'sage_aggr': 'max', 'sage_normalize': True, 'sage_project': False, 'lr': 0.00512742674486885, 'weight_decay': 0.0005298163515343243, 'epochs': 195, 'loss': 'mse', 'optimizer': 'adam', 'graph_mode': 'cutoff', 'cutoff': 0.8327298866899169, 'grm_norm': 'cosine', 'self_loops': False, 'use_snp_selection': False}. Best is trial 97 with value: 0.32167090191646536.
[I 2025-12-09 05:29:55,777] Trial 133 finished with value: 0.3172449157993337 and parameters: {'model_type': 'graphsage', 'hidden_dims': '[512, 64]', 'dropout': 0.48194346140089855, 'batch_norm': True, 'sage_aggr': 'max', 'sage_normalize': True, 'sage_project': False, 'lr': 0.0029526209412007523, 'weight_decay': 1.930045490034695e-05, 'epochs': 223, 'loss': 'mse', 'optimizer': 'adam', 'graph_mode': 'cutoff', 'cutoff': 0.8253282662956833, 'grm_norm': 'cosine', 'self_loops': False, 'use_snp_selection': False}. Best is trial 97 with value: 0.32167090191646536.
[I 2025-12-09 05:31:18,870] Trial 134 finished with value: 0.30234774007124604 and parameters: {'model_type': 'graphsage', 'hidden_dims': '[512, 64]', 'dropout': 0.5310433244223376, 'batch_norm': True, 'sage_aggr': 'max', 'sage_normalize': True, 'sage_project': False, 'lr': 0.004709354465334655, 'weight_decay': 3.493510239985527e-05, 'epochs': 159, 'loss': 'mse', 'optimizer': 'adam', 'graph_mode': 'cutoff', 'cutoff': 0.4962442608666323, 'grm_norm': 'cosine', 'self_loops': False, 'use_snp_selection': False}. Best is trial 97 with value: 0.32167090191646536.
[I 2025-12-09 05:32:43,609] Trial 135 finished with value: 0.31478072279824926 and parameters: {'model_type': 'graphsage', 'hidden_dims': '[512, 64]', 'dropout': 0.4938261366363272, 'batch_norm': True, 'sage_aggr': 'max', 'sage_normalize': True, 'sage_project': False, 'lr': 0.005646394841866243, 'weight_decay': 0.00010885772749450704, 'epochs': 184, 'loss': 'mse', 'optimizer': 'adam', 'graph_mode': 'cutoff', 'cutoff': 0.8080926101325338, 'grm_norm': 'cosine', 'self_loops': False, 'use_snp_selection': False}. Best is trial 97 with value: 0.32167090191646536.
[I 2025-12-09 05:34:13,776] Trial 136 finished with value: 0.316887580706222 and parameters: {'model_type': 'graphsage', 'hidden_dims': '[512, 64]', 'dropout': 0.4776376664253291, 'batch_norm': True, 'sage_aggr': 'max', 'sage_normalize': True, 'sage_project': False, 'lr': 0.0036168366072178485, 'weight_decay': 0.00021933241693092114, 'epochs': 198, 'loss': 'mse', 'optimizer': 'adam', 'graph_mode': 'cutoff', 'cutoff': 0.7840326114643508, 'grm_norm': 'cosine', 'self_loops': False, 'use_snp_selection': False}. Best is trial 97 with value: 0.32167090191646536.
[I 2025-12-09 05:35:21,763] Trial 137 finished with value: 0.3111696934035536 and parameters: {'model_type': 'graphsage', 'hidden_dims': '[512, 64]', 'dropout': 0.4701781632415381, 'batch_norm': True, 'sage_aggr': 'max', 'sage_normalize': True, 'sage_project': False, 'lr': 0.004130038257026831, 'weight_decay': 0.00028307910468600535, 'epochs': 141, 'loss': 'mse', 'optimizer': 'adam', 'graph_mode': 'cutoff', 'cutoff': 0.7986129147782326, 'grm_norm': 'cosine', 'self_loops': False, 'use_snp_selection': False}. Best is trial 97 with value: 0.32167090191646536.
[I 2025-12-09 05:38:22,078] Trial 138 finished with value: 0.29021705021931704 and parameters: {'model_type': 'graphsage', 'hidden_dims': '[512, 64]', 'dropout': 0.5023112546767007, 'batch_norm': True, 'sage_aggr': 'max', 'sage_normalize': True, 'sage_project': False, 'lr': 0.003127486649673709, 'weight_decay': 7.524873365575826e-05, 'epochs': 209, 'loss': 'mse', 'optimizer': 'adam', 'graph_mode': 'cutoff', 'cutoff': 0.20363069787530824, 'grm_norm': 'cosine', 'self_loops': False, 'use_snp_selection': False}. Best is trial 97 with value: 0.32167090191646536.
[I 2025-12-09 05:39:19,168] Trial 139 finished with value: 0.2481884899987942 and parameters: {'model_type': 'graphsage', 'hidden_dims': '[256, 128, 64]', 'dropout': 0.4914713375285546, 'batch_norm': True, 'sage_aggr': 'max', 'sage_normalize': True, 'sage_project': False, 'lr': 1.5741755483560768e-05, 'weight_decay': 1.9344059349807034e-06, 'epochs': 184, 'loss': 'mse', 'optimizer': 'adam', 'graph_mode': 'knn', 'knn_k': 3, 'weighted_edges': False, 'symmetrize_mode': 'mutual', 'self_loops': False, 'use_snp_selection': False}. Best is trial 97 with value: 0.32167090191646536.
[I 2025-12-09 05:40:04,893] Trial 140 finished with value: -0.01059844476400593 and parameters: {'model_type': 'graphsage', 'hidden_dims': '[256, 128]', 'dropout': 0.5467055277882702, 'batch_norm': False, 'sage_aggr': 'max', 'sage_normalize': False, 'sage_project': False, 'lr': 0.0024695730658995676, 'weight_decay': 2.6098230310247334e-05, 'epochs': 165, 'loss': 'mse', 'optimizer': 'adam', 'graph_mode': 'cutoff', 'cutoff': 0.7630327458682463, 'grm_norm': 'cosine', 'self_loops': False, 'use_snp_selection': False}. Best is trial 97 with value: 0.32167090191646536.
[I 2025-12-09 05:41:26,526] Trial 141 finished with value: 0.31404681636758985 and parameters: {'model_type': 'graphsage', 'hidden_dims': '[512, 128]', 'dropout': 0.4719113399839492, 'batch_norm': True, 'sage_aggr': 'max', 'sage_normalize': True, 'sage_project': False, 'lr': 0.0022468077944581026, 'weight_decay': 4.085623403211567e-06, 'epochs': 176, 'loss': 'mse', 'optimizer': 'adam', 'graph_mode': 'cutoff', 'cutoff': 0.7363004184452803, 'grm_norm': 'cosine', 'self_loops': False, 'use_snp_selection': False}. Best is trial 97 with value: 0.32167090191646536.
[I 2025-12-09 05:42:28,882] Trial 142 finished with value: 0.31410555938110185 and parameters: {'model_type': 'graphsage', 'hidden_dims': '[512, 128]', 'dropout': 0.4556608805506256, 'batch_norm': True, 'sage_aggr': 'max', 'sage_normalize': True, 'sage_project': False, 'lr': 0.006456999141381578, 'weight_decay': 1.3392992108116902e-05, 'epochs': 129, 'loss': 'mse', 'optimizer': 'adam', 'graph_mode': 'cutoff', 'cutoff': 0.7728154124938049, 'grm_norm': 'none', 'self_loops': False, 'use_snp_selection': False}. Best is trial 97 with value: 0.32167090191646536.
[I 2025-12-09 05:43:57,626] Trial 143 finished with value: 0.3190309150460749 and parameters: {'model_type': 'graphsage', 'hidden_dims': '[512, 128]', 'dropout': 0.4827006661584985, 'batch_norm': True, 'sage_aggr': 'max', 'sage_normalize': True, 'sage_project': False, 'lr': 0.004915712431360387, 'weight_decay': 3.6627493026250976e-06, 'epochs': 194, 'loss': 'mse', 'optimizer': 'adam', 'graph_mode': 'cutoff', 'cutoff': 0.8502613339952023, 'grm_norm': 'cosine_then_gcn', 'self_loops': False, 'use_snp_selection': False}. Best is trial 97 with value: 0.32167090191646536.
[I 2025-12-09 05:45:25,983] Trial 144 finished with value: 0.31678767088567394 and parameters: {'model_type': 'graphsage', 'hidden_dims': '[512, 128]', 'dropout': 0.5106281820893317, 'batch_norm': True, 'sage_aggr': 'max', 'sage_normalize': True, 'sage_project': False, 'lr': 0.004870297932348905, 'weight_decay': 3.6024778441906065e-06, 'epochs': 193, 'loss': 'mse', 'optimizer': 'adam', 'graph_mode': 'cutoff', 'cutoff': 0.8873680822649559, 'grm_norm': 'cosine_then_gcn', 'self_loops': True, 'use_snp_selection': False}. Best is trial 97 with value: 0.32167090191646536.
[I 2025-12-09 05:47:03,310] Trial 145 finished with value: 0.3178073522872266 and parameters: {'model_type': 'graphsage', 'hidden_dims': '[512, 128]', 'dropout': 0.48365981095756605, 'batch_norm': True, 'sage_aggr': 'max', 'sage_normalize': True, 'sage_project': False, 'lr': 0.00801060056872361, 'weight_decay': 2.2846012957952723e-06, 'epochs': 216, 'loss': 'mse', 'optimizer': 'adam', 'graph_mode': 'cutoff', 'cutoff': 0.8685984146176385, 'grm_norm': 'cosine_then_gcn', 'self_loops': False, 'use_snp_selection': False}. Best is trial 97 with value: 0.32167090191646536.
[I 2025-12-09 05:48:34,760] Trial 146 finished with value: 0.31627054992844317 and parameters: {'model_type': 'graphsage', 'hidden_dims': '[512, 128]', 'dropout': 0.4856747487557915, 'batch_norm': True, 'sage_aggr': 'max', 'sage_normalize': True, 'sage_project': False, 'lr': 0.003934287265428209, 'weight_decay': 2.4005806736753165e-06, 'epochs': 201, 'loss': 'mse', 'optimizer': 'adam', 'graph_mode': 'cutoff', 'cutoff': 0.8641056256663471, 'grm_norm': 'cosine_then_gcn', 'self_loops': False, 'use_snp_selection': False}. Best is trial 97 with value: 0.32167090191646536.
[I 2025-12-09 05:49:54,921] Trial 147 finished with value: 0.31342947716881486 and parameters: {'model_type': 'graphsage', 'hidden_dims': '[512, 128]', 'dropout': 0.5005264529420311, 'batch_norm': True, 'sage_aggr': 'max', 'sage_normalize': True, 'sage_project': False, 'lr': 0.005606330996235419, 'weight_decay': 2.8951090238866413e-06, 'epochs': 213, 'loss': 'mse', 'optimizer': 'adam', 'graph_mode': 'cutoff', 'cutoff': 0.8494541657208999, 'grm_norm': 'cosine_then_gcn', 'self_loops': False, 'use_snp_selection': True, 'num_snps': 32327}. Best is trial 97 with value: 0.32167090191646536.
[I 2025-12-09 05:51:34,910] Trial 148 finished with value: 0.3185995380602385 and parameters: {'model_type': 'graphsage', 'hidden_dims': '[512, 128]', 'dropout': 0.4840945837182965, 'batch_norm': True, 'sage_aggr': 'max', 'sage_normalize': True, 'sage_project': False, 'lr': 0.0034390848454919354, 'weight_decay': 2.1889748023853542e-06, 'epochs': 223, 'loss': 'mse', 'optimizer': 'adam', 'graph_mode': 'cutoff', 'cutoff': 0.8358735242710829, 'grm_norm': 'cosine_then_gcn', 'self_loops': False, 'use_snp_selection': False}. Best is trial 97 with value: 0.32167090191646536.
[I 2025-12-09 05:53:14,191] Trial 149 finished with value: 0.31336531087021346 and parameters: {'model_type': 'graphsage', 'hidden_dims': '[512, 128]', 'dropout': 0.5183834454582922, 'batch_norm': True, 'sage_aggr': 'max', 'sage_normalize': True, 'sage_project': False, 'lr': 0.0044552423966424904, 'weight_decay': 3.154519987525814e-05, 'epochs': 221, 'loss': 'mse', 'optimizer': 'adam', 'graph_mode': 'cutoff', 'cutoff': 0.8735506931544315, 'grm_norm': 'cosine_then_gcn', 'self_loops': False, 'use_snp_selection': False}. Best is trial 97 with value: 0.32167090191646536.
[I 2025-12-09 05:54:35,258] Trial 0 finished with value: 0.26989576472096666 and parameters: {'model_type': 'graphsage', 'hidden_dims': '[128, 64]', 'dropout': 0.199031432379812, 'batch_norm': True, 'sage_aggr': 'max', 'sage_normalize': True, 'sage_project': False, 'lr': 0.00034401453323286885, 'weight_decay': 0.00017802616915745114, 'epochs': 230, 'loss': 'mse', 'optimizer': 'adam', 'graph_mode': 'knn', 'knn_k': 6, 'weighted_edges': True, 'symmetrize_mode': 'mutual', 'self_loops': True, 'use_snp_selection': False}. Best is trial 0 with value: 0.26989576472096666.
[I 2025-12-09 05:56:14,745] Trial 1 finished with value: 0.2835763869847052 and parameters: {'model_type': 'graphsage', 'hidden_dims': '[512, 128]', 'dropout': 0.2503500283181017, 'batch_norm': False, 'sage_aggr': 'max', 'sage_normalize': False, 'sage_project': False, 'lr': 3.952233718592099e-05, 'weight_decay': 0.00026754769258252603, 'epochs': 149, 'loss': 'mse', 'optimizer': 'adam', 'graph_mode': 'knn', 'knn_k': 2, 'weighted_edges': False, 'symmetrize_mode': 'mutual', 'self_loops': True, 'use_snp_selection': True, 'num_snps': 49915}. Best is trial 1 with value: 0.2835763869847052.
[I 2025-12-09 05:57:31,310] Trial 2 finished with value: 0.2889084989589329 and parameters: {'model_type': 'graphsage', 'hidden_dims': '[512, 256]', 'dropout': 0.2785908793172681, 'batch_norm': False, 'sage_aggr': 'max', 'sage_normalize': False, 'sage_project': False, 'lr': 8.806039223165805e-05, 'weight_decay': 3.5153176302760294e-05, 'epochs': 147, 'loss': 'mae', 'optimizer': 'adam', 'graph_mode': 'cutoff', 'cutoff': 0.4922564006874869, 'grm_norm': 'gcn', 'self_loops': False, 'use_snp_selection': True, 'num_snps': 34340}. Best is trial 2 with value: 0.2889084989589329.
[I 2025-12-09 05:58:44,502] Trial 3 finished with value: 0.29731684163045297 and parameters: {'model_type': 'graphsage', 'hidden_dims': '[256, 128, 64]', 'dropout': 0.3475243154412272, 'batch_norm': True, 'sage_aggr': 'max', 'sage_normalize': False, 'sage_project': False, 'lr': 1.6006331996938085e-05, 'weight_decay': 7.213121225589906e-06, 'epochs': 283, 'loss': 'mse', 'optimizer': 'adam', 'graph_mode': 'cutoff', 'cutoff': 0.5942334791449215, 'grm_norm': 'none', 'self_loops': True, 'use_snp_selection': False}. Best is trial 3 with value: 0.29731684163045297.
[I 2025-12-09 05:59:27,074] Trial 4 finished with value: 0.2637898334945866 and parameters: {'model_type': 'graphsage', 'hidden_dims': '[128, 64]', 'dropout': 0.3348926467202472, 'batch_norm': True, 'sage_aggr': 'max', 'sage_normalize': False, 'sage_project': False, 'lr': 0.0004238630400638802, 'weight_decay': 8.074086040046576e-07, 'epochs': 158, 'loss': 'mae', 'optimizer': 'adam', 'graph_mode': 'knn', 'knn_k': 1, 'weighted_edges': False, 'symmetrize_mode': 'mutual', 'self_loops': False, 'use_snp_selection': True, 'num_snps': 26850}. Best is trial 3 with value: 0.29731684163045297.
[I 2025-12-09 06:01:14,746] Trial 5 finished with value: 0.27515139102299147 and parameters: {'model_type': 'graphsage', 'hidden_dims': '[512, 64]', 'dropout': 0.14505336736221927, 'batch_norm': True, 'sage_aggr': 'mean', 'sage_normalize': True, 'sage_project': False, 'lr': 1.2962030165732234e-05, 'weight_decay': 1.326598071105465e-07, 'epochs': 180, 'loss': 'mse', 'optimizer': 'adam', 'graph_mode': 'knn', 'knn_k': 9, 'weighted_edges': True, 'symmetrize_mode': 'mutual', 'self_loops': False, 'use_snp_selection': False}. Best is trial 3 with value: 0.29731684163045297.
[I 2025-12-09 06:02:07,902] Trial 6 finished with value: 0.2876890704422137 and parameters: {'model_type': 'graphsage', 'hidden_dims': '[256, 128, 64]', 'dropout': 0.10731743755162496, 'batch_norm': True, 'sage_aggr': 'mean', 'sage_normalize': False, 'sage_project': False, 'lr': 1.922990426933137e-05, 'weight_decay': 7.30001060446905e-05, 'epochs': 63, 'loss': 'mae', 'optimizer': 'adam', 'graph_mode': 'cutoff', 'cutoff': 0.7624978434202536, 'grm_norm': 'none', 'self_loops': True, 'use_snp_selection': True, 'num_snps': 50106}. Best is trial 3 with value: 0.29731684163045297.
[I 2025-12-09 06:03:59,831] Trial 7 finished with value: 0.28909620327168567 and parameters: {'model_type': 'graphsage', 'hidden_dims': '[512, 64]', 'dropout': 0.2585007811528941, 'batch_norm': True, 'sage_aggr': 'max', 'sage_normalize': True, 'sage_project': False, 'lr': 5.921425508303391e-05, 'weight_decay': 0.0004511561961144237, 'epochs': 182, 'loss': 'mae', 'optimizer': 'adam', 'graph_mode': 'knn', 'knn_k': 9, 'weighted_edges': True, 'symmetrize_mode': 'union', 'self_loops': False, 'use_snp_selection': True, 'num_snps': 23903}. Best is trial 3 with value: 0.29731684163045297.
[I 2025-12-09 06:04:41,569] Trial 8 finished with value: 0.25989289872585153 and parameters: {'model_type': 'graphsage', 'hidden_dims': '[512, 256]', 'dropout': 0.3061380386767003, 'batch_norm': False, 'sage_aggr': 'mean', 'sage_normalize': True, 'sage_project': False, 'lr': 0.000698401460570184, 'weight_decay': 2.965560055460244e-06, 'epochs': 289, 'loss': 'mae', 'optimizer': 'adam', 'graph_mode': 'knn', 'knn_k': 7, 'weighted_edges': False, 'symmetrize_mode': 'mutual', 'self_loops': True, 'use_snp_selection': True, 'num_snps': 4710}. Best is trial 3 with value: 0.29731684163045297.
[I 2025-12-09 06:08:19,868] Trial 9 finished with value: 0.2927366484802302 and parameters: {'model_type': 'graphsage', 'hidden_dims': '[512, 128]', 'dropout': 0.1733844071393634, 'batch_norm': False, 'sage_aggr': 'mean', 'sage_normalize': True, 'sage_project': False, 'lr': 0.0004269677918501597, 'weight_decay': 2.2439779626249696e-06, 'epochs': 319, 'loss': 'mse', 'optimizer': 'adam', 'graph_mode': 'cutoff', 'cutoff': 0.24117565767129295, 'grm_norm': 'cosine_then_gcn', 'self_loops': True, 'use_snp_selection': False}. Best is trial 3 with value: 0.29731684163045297.
[I 2025-12-09 06:09:26,286] Trial 10 finished with value: 0.30173836701318757 and parameters: {'model_type': 'graphsage', 'hidden_dims': '[256, 128, 64]', 'dropout': 0.5062131504581071, 'batch_norm': True, 'sage_aggr': 'max', 'sage_normalize': False, 'sage_project': False, 'lr': 0.0060050040216813455, 'weight_decay': 1.5886244399072472e-05, 'epochs': 258, 'loss': 'mse', 'optimizer': 'adam', 'graph_mode': 'cutoff', 'cutoff': 0.6388703494956212, 'grm_norm': 'none', 'self_loops': True, 'use_snp_selection': False}. Best is trial 10 with value: 0.30173836701318757.
[I 2025-12-09 06:10:31,173] Trial 11 finished with value: 0.3024062345558296 and parameters: {'model_type': 'graphsage', 'hidden_dims': '[256, 128, 64]', 'dropout': 0.49488119581970164, 'batch_norm': True, 'sage_aggr': 'max', 'sage_normalize': False, 'sage_project': False, 'lr': 0.006753264773209739, 'weight_decay': 1.623283721491421e-05, 'epochs': 251, 'loss': 'mse', 'optimizer': 'adam', 'graph_mode': 'cutoff', 'cutoff': 0.6423124990838213, 'grm_norm': 'none', 'self_loops': True, 'use_snp_selection': False}. Best is trial 11 with value: 0.3024062345558296.
[I 2025-12-09 06:11:31,940] Trial 12 finished with value: 0.3037364222409388 and parameters: {'model_type': 'graphsage', 'hidden_dims': '[256, 128, 64]', 'dropout': 0.51498112638603, 'batch_norm': True, 'sage_aggr': 'max', 'sage_normalize': False, 'sage_project': False, 'lr': 0.00923224194542078, 'weight_decay': 2.2174123778930998e-05, 'epochs': 233, 'loss': 'mse', 'optimizer': 'adam', 'graph_mode': 'cutoff', 'cutoff': 0.6518755419888931, 'grm_norm': 'none', 'self_loops': True, 'use_snp_selection': False}. Best is trial 12 with value: 0.3037364222409388.
[I 2025-12-09 06:12:30,681] Trial 13 finished with value: 0.30579508527125254 and parameters: {'model_type': 'graphsage', 'hidden_dims': '[256, 128]', 'dropout': 0.5141447107919271, 'batch_norm': True, 'sage_aggr': 'max', 'sage_normalize': False, 'sage_project': False, 'lr': 0.009857610698294416, 'weight_decay': 3.589632705619127e-05, 'epochs': 224, 'loss': 'mse', 'optimizer': 'adam', 'graph_mode': 'cutoff', 'cutoff': 0.8556020950455094, 'grm_norm': 'cosine', 'self_loops': True, 'use_snp_selection': False}. Best is trial 13 with value: 0.30579508527125254.
[I 2025-12-09 06:13:55,687] Trial 14 finished with value: 0.30743859026058795 and parameters: {'model_type': 'graphsage', 'hidden_dims': '[256, 128]', 'dropout': 0.5911608956856331, 'batch_norm': True, 'sage_aggr': 'max', 'sage_normalize': False, 'sage_project': False, 'lr': 0.0024371165556171634, 'weight_decay': 6.115596899007738e-05, 'epochs': 348, 'loss': 'mse', 'optimizer': 'adam', 'graph_mode': 'cutoff', 'cutoff': 0.8923190952193389, 'grm_norm': 'cosine', 'self_loops': True, 'use_snp_selection': False}. Best is trial 14 with value: 0.30743859026058795.
