[I 2025-12-09 09:17:06,536] Trial 69 finished with value: 0.3679551914998692 and parameters: {'model_type': 'graphsage', 'hidden_dims': '[128, 64]', 'dropout': 0.485781012124951, 'batch_norm': False, 'sage_aggr': 'mean', 'sage_normalize': False, 'sage_project': False, 'lr': 3.9469724318901974e-05, 'weight_decay': 2.6794762719430563e-05, 'epochs': 233, 'loss': 'mse', 'optimizer': 'adam', 'graph_mode': 'knn', 'knn_k': 3, 'weighted_edges': True, 'symmetrize_mode': 'union', 'self_loops': False, 'use_snp_selection': True, 'num_snps': 48482}. Best is trial 35 with value: 0.3836273050545894.
[I 2025-12-09 09:22:28,833] Trial 70 finished with value: 0.36867495693959296 and parameters: {'model_type': 'graphsage', 'hidden_dims': '[256, 128, 64]', 'dropout': 0.3985487029535355, 'batch_norm': False, 'sage_aggr': 'mean', 'sage_normalize': False, 'sage_project': False, 'lr': 1.711999450979535e-05, 'weight_decay': 0.00045946766829686156, 'epochs': 247, 'loss': 'mae', 'optimizer': 'adam', 'graph_mode': 'knn', 'knn_k': 9, 'weighted_edges': False, 'symmetrize_mode': 'union', 'self_loops': False, 'use_snp_selection': True, 'num_snps': 51362}. Best is trial 35 with value: 0.3836273050545894.
[I 2025-12-09 09:28:14,608] Trial 71 finished with value: 0.36596711852910124 and parameters: {'model_type': 'graphsage', 'hidden_dims': '[256, 128, 64]', 'dropout': 0.4020561040071308, 'batch_norm': False, 'sage_aggr': 'mean', 'sage_normalize': False, 'sage_project': False, 'lr': 2.7200511657278802e-05, 'weight_decay': 0.0006122290268962816, 'epochs': 251, 'loss': 'mae', 'optimizer': 'adam', 'graph_mode': 'knn', 'knn_k': 9, 'weighted_edges': False, 'symmetrize_mode': 'union', 'self_loops': False, 'use_snp_selection': True, 'num_snps': 53368}. Best is trial 35 with value: 0.3836273050545894.
[I 2025-12-09 09:34:28,604] Trial 72 finished with value: 0.3706541769209405 and parameters: {'model_type': 'graphsage', 'hidden_dims': '[256, 128, 64]', 'dropout': 0.44352302083680833, 'batch_norm': False, 'sage_aggr': 'mean', 'sage_normalize': False, 'sage_project': False, 'lr': 1.711993091525813e-05, 'weight_decay': 0.0004859019961265592, 'epochs': 242, 'loss': 'mae', 'optimizer': 'adam', 'graph_mode': 'knn', 'knn_k': 10, 'weighted_edges': False, 'symmetrize_mode': 'union', 'self_loops': False, 'use_snp_selection': True, 'num_snps': 55514}. Best is trial 35 with value: 0.3836273050545894.
[I 2025-12-09 09:40:49,319] Trial 73 finished with value: 0.36300672828503056 and parameters: {'model_type': 'graphsage', 'hidden_dims': '[256, 128, 64]', 'dropout': 0.444690993336633, 'batch_norm': False, 'sage_aggr': 'mean', 'sage_normalize': False, 'sage_project': False, 'lr': 3.1719840313102554e-05, 'weight_decay': 0.00018594983019465055, 'epochs': 236, 'loss': 'mae', 'optimizer': 'adam', 'graph_mode': 'knn', 'knn_k': 10, 'weighted_edges': False, 'symmetrize_mode': 'union', 'self_loops': False, 'use_snp_selection': True, 'num_snps': 56364}. Best is trial 35 with value: 0.3836273050545894.
[I 2025-12-09 09:44:42,095] Trial 74 finished with value: 0.3727713383248452 and parameters: {'model_type': 'graphsage', 'hidden_dims': '[512, 128]', 'dropout': 0.5244344391740097, 'batch_norm': False, 'sage_aggr': 'mean', 'sage_normalize': False, 'sage_project': False, 'lr': 6.112966396184998e-05, 'weight_decay': 0.0008306780198971751, 'epochs': 157, 'loss': 'mae', 'optimizer': 'adam', 'graph_mode': 'knn', 'knn_k': 10, 'weighted_edges': False, 'symmetrize_mode': 'union', 'self_loops': False, 'use_snp_selection': True, 'num_snps': 48407}. Best is trial 35 with value: 0.3836273050545894.
[I 2025-12-09 09:49:33,230] Trial 75 finished with value: 0.3764797619992038 and parameters: {'model_type': 'graphsage', 'hidden_dims': '[512, 128]', 'dropout': 0.513335346040016, 'batch_norm': False, 'sage_aggr': 'mean', 'sage_normalize': False, 'sage_project': False, 'lr': 1.2637958509214112e-05, 'weight_decay': 0.0007470974719635766, 'epochs': 193, 'loss': 'mae', 'optimizer': 'adam', 'graph_mode': 'knn', 'knn_k': 10, 'weighted_edges': False, 'symmetrize_mode': 'union', 'self_loops': False, 'use_snp_selection': True, 'num_snps': 47824}. Best is trial 35 with value: 0.3836273050545894.
[I 2025-12-09 09:54:16,871] Trial 76 finished with value: 0.3792642686576616 and parameters: {'model_type': 'graphsage', 'hidden_dims': '[512, 128]', 'dropout': 0.5348459192495459, 'batch_norm': False, 'sage_aggr': 'mean', 'sage_normalize': False, 'sage_project': False, 'lr': 1.191911169947874e-05, 'weight_decay': 0.0008092459554456587, 'epochs': 190, 'loss': 'mae', 'optimizer': 'adam', 'graph_mode': 'knn', 'knn_k': 10, 'weighted_edges': False, 'symmetrize_mode': 'union', 'self_loops': False, 'use_snp_selection': True, 'num_snps': 47199}. Best is trial 35 with value: 0.3836273050545894.
[I 2025-12-09 09:58:16,924] Trial 77 finished with value: 0.37550533679621545 and parameters: {'model_type': 'graphsage', 'hidden_dims': '[512, 128]', 'dropout': 0.5358629968598398, 'batch_norm': False, 'sage_aggr': 'mean', 'sage_normalize': False, 'sage_project': False, 'lr': 1.2718341597085233e-05, 'weight_decay': 0.0008012320559209083, 'epochs': 159, 'loss': 'mae', 'optimizer': 'adam', 'graph_mode': 'knn', 'knn_k': 10, 'weighted_edges': False, 'symmetrize_mode': 'union', 'self_loops': False, 'use_snp_selection': True, 'num_snps': 46944}. Best is trial 35 with value: 0.3836273050545894.
[I 2025-12-09 10:02:23,377] Trial 78 finished with value: 0.36929626620896283 and parameters: {'model_type': 'graphsage', 'hidden_dims': '[512, 128]', 'dropout': 0.5718386264735469, 'batch_norm': True, 'sage_aggr': 'mean', 'sage_normalize': False, 'sage_project': False, 'lr': 1.1435404463148191e-05, 'weight_decay': 0.00034424103932155265, 'epochs': 170, 'loss': 'mae', 'optimizer': 'adam', 'graph_mode': 'knn', 'knn_k': 10, 'weighted_edges': False, 'symmetrize_mode': 'union', 'self_loops': False, 'use_snp_selection': True, 'num_snps': 45973}. Best is trial 35 with value: 0.3836273050545894.
[I 2025-12-09 10:06:02,495] Trial 79 finished with value: 0.38431940141120957 and parameters: {'model_type': 'graphsage', 'hidden_dims': '[512, 128]', 'dropout': 0.5241604335195895, 'batch_norm': False, 'sage_aggr': 'mean', 'sage_normalize': False, 'sage_project': False, 'lr': 1.1906909119635798e-05, 'weight_decay': 0.0009854805152152328, 'epochs': 198, 'loss': 'mse', 'optimizer': 'adam', 'graph_mode': 'knn', 'knn_k': 10, 'weighted_edges': False, 'symmetrize_mode': 'union', 'self_loops': False, 'use_snp_selection': False}. Best is trial 79 with value: 0.38431940141120957.
[I 2025-12-09 10:09:35,317] Trial 80 finished with value: 0.36695798663551327 and parameters: {'model_type': 'graphsage', 'hidden_dims': '[512, 128]', 'dropout': 0.5104329061140459, 'batch_norm': False, 'sage_aggr': 'mean', 'sage_normalize': True, 'sage_project': False, 'lr': 1.0048973707632797e-05, 'weight_decay': 0.0009872467586730773, 'epochs': 205, 'loss': 'mse', 'optimizer': 'adam', 'graph_mode': 'knn', 'knn_k': 9, 'weighted_edges': False, 'symmetrize_mode': 'union', 'self_loops': False, 'use_snp_selection': False}. Best is trial 79 with value: 0.38431940141120957.
[I 2025-12-09 10:13:01,968] Trial 81 finished with value: 0.37897388326506387 and parameters: {'model_type': 'graphsage', 'hidden_dims': '[512, 128]', 'dropout': 0.542658021764509, 'batch_norm': False, 'sage_aggr': 'mean', 'sage_normalize': False, 'sage_project': False, 'lr': 1.3012118373486814e-05, 'weight_decay': 0.0006850928151220608, 'epochs': 186, 'loss': 'mse', 'optimizer': 'adam', 'graph_mode': 'knn', 'knn_k': 10, 'weighted_edges': False, 'symmetrize_mode': 'union', 'self_loops': False, 'use_snp_selection': False}. Best is trial 79 with value: 0.38431940141120957.
[I 2025-12-09 10:16:35,696] Trial 82 finished with value: 0.3811018133020274 and parameters: {'model_type': 'graphsage', 'hidden_dims': '[512, 128]', 'dropout': 0.5775168959229305, 'batch_norm': False, 'sage_aggr': 'mean', 'sage_normalize': False, 'sage_project': False, 'lr': 1.4666041948836852e-05, 'weight_decay': 0.0006759371887516737, 'epochs': 193, 'loss': 'mse', 'optimizer': 'adam', 'graph_mode': 'knn', 'knn_k': 10, 'weighted_edges': False, 'symmetrize_mode': 'union', 'self_loops': False, 'use_snp_selection': False}. Best is trial 79 with value: 0.38431940141120957.
[I 2025-12-09 10:20:10,797] Trial 83 finished with value: 0.3776567568412665 and parameters: {'model_type': 'graphsage', 'hidden_dims': '[512, 128]', 'dropout': 0.5655745231039709, 'batch_norm': False, 'sage_aggr': 'mean', 'sage_normalize': False, 'sage_project': False, 'lr': 1.4357373866473184e-05, 'weight_decay': 0.0006727085884648952, 'epochs': 194, 'loss': 'mse', 'optimizer': 'adam', 'graph_mode': 'knn', 'knn_k': 10, 'weighted_edges': False, 'symmetrize_mode': 'union', 'self_loops': False, 'use_snp_selection': False}. Best is trial 79 with value: 0.38431940141120957.
[I 2025-12-09 10:23:35,281] Trial 84 finished with value: 0.3812908921482543 and parameters: {'model_type': 'graphsage', 'hidden_dims': '[512, 128]', 'dropout': 0.5736233148087454, 'batch_norm': False, 'sage_aggr': 'mean', 'sage_normalize': False, 'sage_project': False, 'lr': 1.449325312436236e-05, 'weight_decay': 0.0006192855497434626, 'epochs': 184, 'loss': 'mse', 'optimizer': 'adam', 'graph_mode': 'knn', 'knn_k': 10, 'weighted_edges': False, 'symmetrize_mode': 'union', 'self_loops': False, 'use_snp_selection': False}. Best is trial 79 with value: 0.38431940141120957.
[I 2025-12-09 10:26:50,244] Trial 85 finished with value: 0.3758795862241401 and parameters: {'model_type': 'graphsage', 'hidden_dims': '[512, 128]', 'dropout': 0.5889547160877627, 'batch_norm': False, 'sage_aggr': 'mean', 'sage_normalize': False, 'sage_project': False, 'lr': 2.4975027247662098e-05, 'weight_decay': 0.0004942883127927867, 'epochs': 175, 'loss': 'mse', 'optimizer': 'adam', 'graph_mode': 'knn', 'knn_k': 10, 'weighted_edges': False, 'symmetrize_mode': 'union', 'self_loops': False, 'use_snp_selection': False}. Best is trial 79 with value: 0.38431940141120957.
[I 2025-12-09 10:30:18,046] Trial 86 finished with value: 0.3653093648977227 and parameters: {'model_type': 'graphsage', 'hidden_dims': '[512, 128]', 'dropout': 0.5638962942278047, 'batch_norm': True, 'sage_aggr': 'mean', 'sage_normalize': False, 'sage_project': False, 'lr': 2.0180318634322527e-05, 'weight_decay': 0.00041378163865957607, 'epochs': 187, 'loss': 'mse', 'optimizer': 'adam', 'graph_mode': 'knn', 'knn_k': 10, 'weighted_edges': False, 'symmetrize_mode': 'union', 'self_loops': False, 'use_snp_selection': False}. Best is trial 79 with value: 0.38431940141120957.
[I 2025-12-09 10:33:45,802] Trial 87 finished with value: 0.3771557385372294 and parameters: {'model_type': 'graphsage', 'hidden_dims': '[512, 128]', 'dropout': 0.5502174878091389, 'batch_norm': False, 'sage_aggr': 'mean', 'sage_normalize': False, 'sage_project': False, 'lr': 1.8894446175151617e-05, 'weight_decay': 0.0003362425969482704, 'epochs': 200, 'loss': 'mse', 'optimizer': 'adam', 'graph_mode': 'knn', 'knn_k': 9, 'weighted_edges': False, 'symmetrize_mode': 'union', 'self_loops': False, 'use_snp_selection': False}. Best is trial 79 with value: 0.38431940141120957.
[I 2025-12-09 10:37:43,260] Trial 88 finished with value: 0.3789945150416916 and parameters: {'model_type': 'graphsage', 'hidden_dims': '[512, 128]', 'dropout': 0.5818125243429608, 'batch_norm': False, 'sage_aggr': 'mean', 'sage_normalize': False, 'sage_project': False, 'lr': 1.641393493550213e-05, 'weight_decay': 0.00024513476218216215, 'epochs': 215, 'loss': 'mse', 'optimizer': 'adam', 'graph_mode': 'knn', 'knn_k': 10, 'weighted_edges': False, 'symmetrize_mode': 'union', 'self_loops': False, 'use_snp_selection': False}. Best is trial 79 with value: 0.38431940141120957.
[I 2025-12-09 10:41:41,119] Trial 89 finished with value: 0.3617005563834709 and parameters: {'model_type': 'graphsage', 'hidden_dims': '[512, 128]', 'dropout': 0.5810680008760076, 'batch_norm': False, 'sage_aggr': 'mean', 'sage_normalize': True, 'sage_project': False, 'lr': 1.440061053608256e-05, 'weight_decay': 0.0002788769323522563, 'epochs': 215, 'loss': 'mse', 'optimizer': 'adam', 'graph_mode': 'knn', 'knn_k': 10, 'weighted_edges': False, 'symmetrize_mode': 'union', 'self_loops': False, 'use_snp_selection': False}. Best is trial 79 with value: 0.38431940141120957.
[I 2025-12-09 10:45:48,197] Trial 90 finished with value: 0.3838967965275305 and parameters: {'model_type': 'graphsage', 'hidden_dims': '[512, 128]', 'dropout': 0.5983357775773199, 'batch_norm': False, 'sage_aggr': 'mean', 'sage_normalize': False, 'sage_project': False, 'lr': 1.1260001865955748e-05, 'weight_decay': 0.0002354928486807491, 'epochs': 224, 'loss': 'mse', 'optimizer': 'adam', 'graph_mode': 'knn', 'knn_k': 10, 'weighted_edges': False, 'symmetrize_mode': 'union', 'self_loops': False, 'use_snp_selection': False}. Best is trial 79 with value: 0.38431940141120957.
[I 2025-12-09 10:49:58,548] Trial 91 finished with value: 0.3784724806187968 and parameters: {'model_type': 'graphsage', 'hidden_dims': '[512, 128]', 'dropout': 0.55250925506205, 'batch_norm': False, 'sage_aggr': 'mean', 'sage_normalize': False, 'sage_project': False, 'lr': 1.145529249292473e-05, 'weight_decay': 0.0002332413581995501, 'epochs': 227, 'loss': 'mse', 'optimizer': 'adam', 'graph_mode': 'knn', 'knn_k': 10, 'weighted_edges': False, 'symmetrize_mode': 'union', 'self_loops': False, 'use_snp_selection': False}. Best is trial 79 with value: 0.38431940141120957.
[I 2025-12-09 10:54:04,377] Trial 92 finished with value: 0.384390724388326 and parameters: {'model_type': 'graphsage', 'hidden_dims': '[512, 128]', 'dropout': 0.5512524365755084, 'batch_norm': False, 'sage_aggr': 'mean', 'sage_normalize': False, 'sage_project': False, 'lr': 1.1651373388336621e-05, 'weight_decay': 0.00020148231661208484, 'epochs': 223, 'loss': 'mse', 'optimizer': 'adam', 'graph_mode': 'knn', 'knn_k': 10, 'weighted_edges': False, 'symmetrize_mode': 'union', 'self_loops': False, 'use_snp_selection': False}. Best is trial 92 with value: 0.384390724388326.
[I 2025-12-09 10:57:27,830] Trial 93 finished with value: 0.37779186609052473 and parameters: {'model_type': 'graphsage', 'hidden_dims': '[512, 128]', 'dropout': 0.5540436898429613, 'batch_norm': False, 'sage_aggr': 'mean', 'sage_normalize': False, 'sage_project': False, 'lr': 1.1236899979142738e-05, 'weight_decay': 0.0001989430285905587, 'epochs': 183, 'loss': 'mse', 'optimizer': 'adam', 'graph_mode': 'knn', 'knn_k': 10, 'weighted_edges': False, 'symmetrize_mode': 'union', 'self_loops': False, 'use_snp_selection': False}. Best is trial 92 with value: 0.384390724388326.
[I 2025-12-09 11:01:34,755] Trial 94 finished with value: 0.37856666955442836 and parameters: {'model_type': 'graphsage', 'hidden_dims': '[512, 128]', 'dropout': 0.5963897850913372, 'batch_norm': False, 'sage_aggr': 'mean', 'sage_normalize': False, 'sage_project': False, 'lr': 1.5837795724660602e-05, 'weight_decay': 0.00024376699954154745, 'epochs': 224, 'loss': 'mse', 'optimizer': 'adam', 'graph_mode': 'knn', 'knn_k': 10, 'weighted_edges': False, 'symmetrize_mode': 'union', 'self_loops': False, 'use_snp_selection': False}. Best is trial 92 with value: 0.384390724388326.
[I 2025-12-09 11:05:19,275] Trial 95 finished with value: 0.3816761771756084 and parameters: {'model_type': 'graphsage', 'hidden_dims': '[512, 128]', 'dropout': 0.5957889053163721, 'batch_norm': False, 'sage_aggr': 'mean', 'sage_normalize': False, 'sage_project': False, 'lr': 1.6447112129759342e-05, 'weight_decay': 0.0006177146895703412, 'epochs': 203, 'loss': 'mse', 'optimizer': 'adam', 'graph_mode': 'knn', 'knn_k': 10, 'weighted_edges': False, 'symmetrize_mode': 'union', 'self_loops': False, 'use_snp_selection': False}. Best is trial 92 with value: 0.384390724388326.
[I 2025-12-09 11:08:52,684] Trial 96 finished with value: 0.38285984148895014 and parameters: {'model_type': 'graphsage', 'hidden_dims': '[512, 128]', 'dropout': 0.5834941513847264, 'batch_norm': False, 'sage_aggr': 'mean', 'sage_normalize': False, 'sage_project': False, 'lr': 1.3250148204962864e-05, 'weight_decay': 0.0005547322520362478, 'epochs': 206, 'loss': 'mse', 'optimizer': 'adam', 'graph_mode': 'knn', 'knn_k': 9, 'weighted_edges': False, 'symmetrize_mode': 'union', 'self_loops': False, 'use_snp_selection': False}. Best is trial 92 with value: 0.384390724388326.
[I 2025-12-09 11:12:26,018] Trial 97 finished with value: 0.3774262711132409 and parameters: {'model_type': 'graphsage', 'hidden_dims': '[512, 128]', 'dropout': 0.5828343203485084, 'batch_norm': False, 'sage_aggr': 'mean', 'sage_normalize': False, 'sage_project': False, 'lr': 1.8536067788584994e-05, 'weight_decay': 0.000988008787884515, 'epochs': 206, 'loss': 'mse', 'optimizer': 'adam', 'graph_mode': 'knn', 'knn_k': 9, 'weighted_edges': False, 'symmetrize_mode': 'union', 'self_loops': False, 'use_snp_selection': False}. Best is trial 92 with value: 0.384390724388326.
[I 2025-12-09 11:15:52,609] Trial 98 finished with value: 0.380420289177139 and parameters: {'model_type': 'graphsage', 'hidden_dims': '[512, 128]', 'dropout': 0.5987419633782252, 'batch_norm': False, 'sage_aggr': 'mean', 'sage_normalize': False, 'sage_project': False, 'lr': 1.028327749972815e-05, 'weight_decay': 0.0005921719899526761, 'epochs': 199, 'loss': 'mse', 'optimizer': 'adam', 'graph_mode': 'knn', 'knn_k': 9, 'weighted_edges': False, 'symmetrize_mode': 'union', 'self_loops': False, 'use_snp_selection': False}. Best is trial 92 with value: 0.384390724388326.
[I 2025-12-09 11:19:21,072] Trial 99 finished with value: 0.37677551640112095 and parameters: {'model_type': 'graphsage', 'hidden_dims': '[512, 128]', 'dropout': 0.5698439997752809, 'batch_norm': False, 'sage_aggr': 'mean', 'sage_normalize': False, 'sage_project': False, 'lr': 1.0288508216958243e-05, 'weight_decay': 0.0005940085652331041, 'epochs': 201, 'loss': 'mse', 'optimizer': 'adam', 'graph_mode': 'knn', 'knn_k': 9, 'weighted_edges': False, 'symmetrize_mode': 'union', 'self_loops': False, 'use_snp_selection': False}. Best is trial 92 with value: 0.384390724388326.
[I 2025-12-09 11:22:40,456] Trial 100 finished with value: 0.3809450301644218 and parameters: {'model_type': 'graphsage', 'hidden_dims': '[512, 128]', 'dropout': 0.591038635550831, 'batch_norm': False, 'sage_aggr': 'mean', 'sage_normalize': False, 'sage_project': False, 'lr': 1.3397189902216025e-05, 'weight_decay': 0.0005412957806034034, 'epochs': 192, 'loss': 'mse', 'optimizer': 'adam', 'graph_mode': 'knn', 'knn_k': 9, 'weighted_edges': False, 'symmetrize_mode': 'union', 'self_loops': False, 'use_snp_selection': False}. Best is trial 92 with value: 0.384390724388326.
[I 2025-12-09 11:25:45,885] Trial 101 finished with value: 0.3723817219901743 and parameters: {'model_type': 'graphsage', 'hidden_dims': '[512, 128]', 'dropout': 0.5936711993372651, 'batch_norm': False, 'sage_aggr': 'mean', 'sage_normalize': False, 'sage_project': False, 'lr': 1.301184502680679e-05, 'weight_decay': 0.0003960455057485888, 'epochs': 178, 'loss': 'mse', 'optimizer': 'adam', 'graph_mode': 'knn', 'knn_k': 9, 'weighted_edges': False, 'symmetrize_mode': 'union', 'self_loops': False, 'use_snp_selection': False}. Best is trial 92 with value: 0.384390724388326.
[I 2025-12-09 11:28:37,413] Trial 102 finished with value: 0.37258875891694754 and parameters: {'model_type': 'graphsage', 'hidden_dims': '[512, 128]', 'dropout': 0.5984102791943395, 'batch_norm': False, 'sage_aggr': 'mean', 'sage_normalize': False, 'sage_project': False, 'lr': 1.5724647063925303e-05, 'weight_decay': 0.0005542133235116655, 'epochs': 164, 'loss': 'mse', 'optimizer': 'adam', 'graph_mode': 'knn', 'knn_k': 9, 'weighted_edges': False, 'symmetrize_mode': 'union', 'self_loops': False, 'use_snp_selection': False}. Best is trial 92 with value: 0.384390724388326.
[I 2025-12-09 11:32:14,610] Trial 103 finished with value: 0.37622560996279164 and parameters: {'model_type': 'graphsage', 'hidden_dims': '[512, 128]', 'dropout': 0.528432958691242, 'batch_norm': False, 'sage_aggr': 'mean', 'sage_normalize': False, 'sage_project': False, 'lr': 2.3394687075613353e-05, 'weight_decay': 0.0007895306380545592, 'epochs': 210, 'loss': 'mse', 'optimizer': 'adam', 'graph_mode': 'knn', 'knn_k': 9, 'weighted_edges': False, 'symmetrize_mode': 'union', 'self_loops': False, 'use_snp_selection': False}. Best is trial 92 with value: 0.384390724388326.
[I 2025-12-09 11:35:33,306] Trial 104 finished with value: 0.37702000195285734 and parameters: {'model_type': 'graphsage', 'hidden_dims': '[512, 128]', 'dropout': 0.5594505779164523, 'batch_norm': False, 'sage_aggr': 'mean', 'sage_normalize': False, 'sage_project': False, 'lr': 1.2694974933960225e-05, 'weight_decay': 0.00029773998295526015, 'epochs': 191, 'loss': 'mse', 'optimizer': 'adam', 'graph_mode': 'knn', 'knn_k': 9, 'weighted_edges': False, 'symmetrize_mode': 'union', 'self_loops': False, 'use_snp_selection': False}. Best is trial 92 with value: 0.384390724388326.
[I 2025-12-09 11:38:46,045] Trial 105 finished with value: 0.3784945107905964 and parameters: {'model_type': 'graphsage', 'hidden_dims': '[512, 128]', 'dropout': 0.5749678050294946, 'batch_norm': False, 'sage_aggr': 'mean', 'sage_normalize': False, 'sage_project': False, 'lr': 2.039448993174995e-05, 'weight_decay': 0.0005466273784527776, 'epochs': 173, 'loss': 'mse', 'optimizer': 'adam', 'graph_mode': 'knn', 'knn_k': 10, 'weighted_edges': False, 'symmetrize_mode': 'union', 'self_loops': False, 'use_snp_selection': False}. Best is trial 92 with value: 0.384390724388326.
