[I 2025-12-05 23:28:36,673] Trial 82 finished with value: 0.2267189595782008 and parameters: {'model_type': 'graphsage', 'hidden_dims': '[256, 128]', 'dropout': 0.4872479963141486, 'batch_norm': True, 'sage_aggr': 'mean', 'sage_normalize': True, 'sage_project': False, 'lr': 0.0005790052202602571, 'weight_decay': 4.903323040813572e-05, 'epochs': 223, 'loss': 'mae', 'optimizer': 'adam', 'graph_mode': 'cutoff', 'cutoff': 0.7370640205986202, 'grm_norm': 'cosine_then_gcn', 'self_loops': False, 'use_snp_selection': True, 'num_snps': 10014, 'graphsage_batch_size': 64}. Best is trial 76 with value: 0.2298278314019619.
[I 2025-12-05 23:29:04,376] Trial 83 finished with value: 0.2332920520508953 and parameters: {'model_type': 'graphsage', 'hidden_dims': '[256, 128]', 'dropout': 0.5128032555902662, 'batch_norm': True, 'sage_aggr': 'mean', 'sage_normalize': True, 'sage_project': False, 'lr': 0.0005652143942051002, 'weight_decay': 5.0964857768569995e-05, 'epochs': 221, 'loss': 'mae', 'optimizer': 'adam', 'graph_mode': 'cutoff', 'cutoff': 0.7344460172440976, 'grm_norm': 'cosine_then_gcn', 'self_loops': False, 'use_snp_selection': True, 'num_snps': 9563, 'graphsage_batch_size': 64}. Best is trial 83 with value: 0.2332920520508953.
[I 2025-12-05 23:29:30,291] Trial 84 finished with value: 0.21593974201206673 and parameters: {'model_type': 'graphsage', 'hidden_dims': '[256, 128]', 'dropout': 0.588481006524183, 'batch_norm': True, 'sage_aggr': 'mean', 'sage_normalize': True, 'sage_project': False, 'lr': 0.000571020497643615, 'weight_decay': 7.041074346106859e-05, 'epochs': 223, 'loss': 'mae', 'optimizer': 'adam', 'graph_mode': 'cutoff', 'cutoff': 0.735334773500192, 'grm_norm': 'cosine_then_gcn', 'self_loops': False, 'use_snp_selection': True, 'num_snps': 8187, 'graphsage_batch_size': 64}. Best is trial 83 with value: 0.2332920520508953.
[I 2025-12-05 23:30:00,872] Trial 85 finished with value: 0.22563522248020065 and parameters: {'model_type': 'graphsage', 'hidden_dims': '[256, 128]', 'dropout': 0.5098904950022773, 'batch_norm': True, 'sage_aggr': 'mean', 'sage_normalize': True, 'sage_project': False, 'lr': 0.0008236177634944821, 'weight_decay': 5.089102886988512e-05, 'epochs': 226, 'loss': 'mae', 'optimizer': 'adam', 'graph_mode': 'cutoff', 'cutoff': 0.7565418759914602, 'grm_norm': 'cosine_then_gcn', 'self_loops': False, 'use_snp_selection': True, 'num_snps': 11652, 'graphsage_batch_size': 64}. Best is trial 83 with value: 0.2332920520508953.
[I 2025-12-05 23:30:31,189] Trial 86 finished with value: 0.20930378832292465 and parameters: {'model_type': 'graphsage', 'hidden_dims': '[256, 128]', 'dropout': 0.5513145863088845, 'batch_norm': False, 'sage_aggr': 'mean', 'sage_normalize': True, 'sage_project': False, 'lr': 0.0008781439046503259, 'weight_decay': 5.1375644073464994e-05, 'epochs': 226, 'loss': 'mae', 'optimizer': 'adam', 'graph_mode': 'cutoff', 'cutoff': 0.7494758571160188, 'grm_norm': 'cosine_then_gcn', 'self_loops': False, 'use_snp_selection': True, 'num_snps': 11608, 'graphsage_batch_size': 64}. Best is trial 83 with value: 0.2332920520508953.
[I 2025-12-05 23:31:01,128] Trial 87 finished with value: 0.15498303360809842 and parameters: {'model_type': 'graphsage', 'hidden_dims': '[256, 128]', 'dropout': 0.5135244195740566, 'batch_norm': True, 'sage_aggr': 'mean', 'sage_normalize': True, 'sage_project': False, 'lr': 0.0004866061203639362, 'weight_decay': 0.000216409113236134, 'epochs': 241, 'loss': 'mae', 'optimizer': 'adam', 'graph_mode': 'cutoff', 'cutoff': 0.21698568215727276, 'grm_norm': 'cosine_then_gcn', 'self_loops': False, 'use_snp_selection': True, 'num_snps': 4197, 'graphsage_batch_size': 64}. Best is trial 83 with value: 0.2332920520508953.
[I 2025-12-05 23:31:20,512] Trial 88 finished with value: 0.19501920028575917 and parameters: {'model_type': 'graphsage', 'hidden_dims': '[256, 128]', 'dropout': 0.5082645157303931, 'batch_norm': True, 'sage_aggr': 'mean', 'sage_normalize': False, 'sage_project': False, 'lr': 0.0008104288617804612, 'weight_decay': 3.576621738525157e-05, 'epochs': 114, 'loss': 'mae', 'optimizer': 'adam', 'graph_mode': 'cutoff', 'cutoff': 0.6451635229093301, 'grm_norm': 'cosine_then_gcn', 'self_loops': False, 'use_snp_selection': True, 'num_snps': 6281, 'graphsage_batch_size': 64}. Best is trial 83 with value: 0.2332920520508953.
[I 2025-12-05 23:31:52,763] Trial 89 finished with value: 0.23440750426696227 and parameters: {'model_type': 'graphsage', 'hidden_dims': '[256, 128]', 'dropout': 0.48879880492848987, 'batch_norm': True, 'sage_aggr': 'mean', 'sage_normalize': True, 'sage_project': False, 'lr': 0.00043206692685663576, 'weight_decay': 5.5001992337277296e-05, 'epochs': 234, 'loss': 'mae', 'optimizer': 'adam', 'graph_mode': 'cutoff', 'cutoff': 0.7583309763636842, 'grm_norm': 'cosine_then_gcn', 'self_loops': False, 'use_snp_selection': True, 'num_snps': 12438, 'graphsage_batch_size': 64}. Best is trial 89 with value: 0.23440750426696227.
[I 2025-12-05 23:32:40,148] Trial 90 finished with value: 0.20337644160761478 and parameters: {'model_type': 'graphsage', 'hidden_dims': '[256, 128]', 'dropout': 0.4876364672060227, 'batch_norm': True, 'sage_aggr': 'mean', 'sage_normalize': True, 'sage_project': False, 'lr': 0.00043412948627795465, 'weight_decay': 0.00015540039516029732, 'epochs': 209, 'loss': 'mae', 'optimizer': 'adam', 'graph_mode': 'knn', 'knn_k': 8, 'weighted_edges': True, 'symmetrize_mode': 'union', 'self_loops': False, 'use_snp_selection': True, 'num_snps': 12325, 'graphsage_batch_size': 256}. Best is trial 89 with value: 0.23440750426696227.
[I 2025-12-05 23:33:09,959] Trial 91 finished with value: 0.22376704650719384 and parameters: {'model_type': 'graphsage', 'hidden_dims': '[256, 128]', 'dropout': 0.5387830233580566, 'batch_norm': True, 'sage_aggr': 'mean', 'sage_normalize': True, 'sage_project': False, 'lr': 0.0006163493508332068, 'weight_decay': 6.027261234534752e-05, 'epochs': 234, 'loss': 'mae', 'optimizer': 'adam', 'graph_mode': 'cutoff', 'cutoff': 0.7251381573298247, 'grm_norm': 'cosine_then_gcn', 'self_loops': False, 'use_snp_selection': True, 'num_snps': 10536, 'graphsage_batch_size': 64}. Best is trial 89 with value: 0.23440750426696227.
[I 2025-12-05 23:33:35,916] Trial 92 finished with value: 0.20569477006502895 and parameters: {'model_type': 'graphsage', 'hidden_dims': '[256, 128]', 'dropout': 0.4652952580813374, 'batch_norm': True, 'sage_aggr': 'mean', 'sage_normalize': True, 'sage_project': False, 'lr': 0.00026961936717577695, 'weight_decay': 3.007482867063311e-05, 'epochs': 226, 'loss': 'mae', 'optimizer': 'adam', 'graph_mode': 'cutoff', 'cutoff': 0.7550148894844365, 'grm_norm': 'cosine_then_gcn', 'self_loops': False, 'use_snp_selection': True, 'num_snps': 8000, 'graphsage_batch_size': 64}. Best is trial 89 with value: 0.23440750426696227.
[I 2025-12-05 23:33:57,791] Trial 93 finished with value: 0.21847943392429886 and parameters: {'model_type': 'graphsage', 'hidden_dims': '[256, 128]', 'dropout': 0.5011855571820657, 'batch_norm': True, 'sage_aggr': 'mean', 'sage_normalize': True, 'sage_project': False, 'lr': 0.0007912186328945595, 'weight_decay': 5.132013036307573e-05, 'epochs': 85, 'loss': 'mae', 'optimizer': 'adam', 'graph_mode': 'cutoff', 'cutoff': 0.7850549800321474, 'grm_norm': 'cosine_then_gcn', 'self_loops': False, 'use_snp_selection': True, 'num_snps': 11867, 'graphsage_batch_size': 64}. Best is trial 89 with value: 0.23440750426696227.
[I 2025-12-05 23:34:19,754] Trial 94 finished with value: 0.17732485267456552 and parameters: {'model_type': 'graphsage', 'hidden_dims': '[256, 128]', 'dropout': 0.5247097397110675, 'batch_norm': True, 'sage_aggr': 'mean', 'sage_normalize': True, 'sage_project': False, 'lr': 0.0005061106479238754, 'weight_decay': 0.00010397077538640905, 'epochs': 246, 'loss': 'mae', 'optimizer': 'adam', 'graph_mode': 'cutoff', 'cutoff': 0.7408897478914275, 'grm_norm': 'cosine_then_gcn', 'self_loops': False, 'use_snp_selection': True, 'num_snps': 4477, 'graphsage_batch_size': 8}. Best is trial 89 with value: 0.23440750426696227.
[I 2025-12-05 23:34:48,002] Trial 95 finished with value: 0.22444667198676754 and parameters: {'model_type': 'graphsage', 'hidden_dims': '[256, 128]', 'dropout': 0.5615349321922815, 'batch_norm': True, 'sage_aggr': 'mean', 'sage_normalize': True, 'sage_project': False, 'lr': 0.0003833387089279411, 'weight_decay': 4.593042813737019e-05, 'epochs': 233, 'loss': 'mae', 'optimizer': 'adam', 'graph_mode': 'cutoff', 'cutoff': 0.7647641050565888, 'grm_norm': 'cosine_then_gcn', 'self_loops': False, 'use_snp_selection': True, 'num_snps': 9513, 'graphsage_batch_size': 64}. Best is trial 89 with value: 0.23440750426696227.
[I 2025-12-05 23:35:11,537] Trial 96 finished with value: 0.18700090979087938 and parameters: {'model_type': 'graphsage', 'hidden_dims': '[256, 128]', 'dropout': 0.48385078919084124, 'batch_norm': True, 'sage_aggr': 'mean', 'sage_normalize': True, 'sage_project': False, 'lr': 0.0004225995126077455, 'weight_decay': 7.294985399693545e-05, 'epochs': 238, 'loss': 'mae', 'optimizer': 'adam', 'graph_mode': 'cutoff', 'cutoff': 0.674546473887383, 'grm_norm': 'cosine_then_gcn', 'self_loops': False, 'use_snp_selection': True, 'num_snps': 5841, 'graphsage_batch_size': 64}. Best is trial 89 with value: 0.23440750426696227.
[I 2025-12-05 23:36:32,780] Trial 97 finished with value: 0.19728935136558862 and parameters: {'model_type': 'graphsage', 'hidden_dims': '[256, 128]', 'dropout': 0.46035487963040655, 'batch_norm': True, 'sage_aggr': 'mean', 'sage_normalize': True, 'sage_project': False, 'lr': 0.000347517177760439, 'weight_decay': 6.122616844872885e-07, 'epochs': 222, 'loss': 'mse', 'optimizer': 'adam', 'graph_mode': 'cutoff', 'cutoff': 0.802421764720712, 'grm_norm': 'cosine_then_gcn', 'self_loops': False, 'use_snp_selection': True, 'num_snps': 49703, 'graphsage_batch_size': 64}. Best is trial 89 with value: 0.23440750426696227.
[I 2025-12-05 23:37:52,559] Trial 98 finished with value: 0.1766342527575875 and parameters: {'model_type': 'graphsage', 'hidden_dims': '[256, 128]', 'dropout': 0.4744810253701314, 'batch_norm': False, 'sage_aggr': 'mean', 'sage_normalize': True, 'sage_project': False, 'lr': 3.2068646320633316e-06, 'weight_decay': 2.4103431677946294e-05, 'epochs': 230, 'loss': 'mae', 'optimizer': 'adam', 'graph_mode': 'cutoff', 'cutoff': 0.7221493341535087, 'grm_norm': 'cosine_then_gcn', 'self_loops': False, 'use_snp_selection': False, 'graphsage_batch_size': 32}. Best is trial 89 with value: 0.23440750426696227.
[I 2025-12-05 23:38:26,866] Trial 99 finished with value: 0.22362018653520002 and parameters: {'model_type': 'graphsage', 'hidden_dims': '[256, 128]', 'dropout': 0.49438806456944345, 'batch_norm': True, 'sage_aggr': 'mean', 'sage_normalize': True, 'sage_project': False, 'lr': 0.0005723380734557042, 'weight_decay': 0.00014496213638176244, 'epochs': 210, 'loss': 'mae', 'optimizer': 'adam', 'graph_mode': 'cutoff', 'cutoff': 0.8189936383023321, 'grm_norm': 'cosine_then_gcn', 'self_loops': False, 'use_snp_selection': True, 'num_snps': 15480, 'graphsage_batch_size': 64}. Best is trial 89 with value: 0.23440750426696227.
[I 2025-12-05 23:38:57,086] Trial 100 finished with value: 0.22745923053999312 and parameters: {'model_type': 'graphsage', 'hidden_dims': '[256, 128]', 'dropout': 0.4463527751163954, 'batch_norm': True, 'sage_aggr': 'mean', 'sage_normalize': True, 'sage_project': False, 'lr': 0.00027419199797349027, 'weight_decay': 6.167898848489257e-05, 'epochs': 200, 'loss': 'mae', 'optimizer': 'adam', 'graph_mode': 'cutoff', 'cutoff': 0.751527743376574, 'grm_norm': 'cosine_then_gcn', 'self_loops': False, 'use_snp_selection': True, 'num_snps': 12767, 'graphsage_batch_size': 64}. Best is trial 89 with value: 0.23440750426696227.
[I 2025-12-05 23:39:27,609] Trial 101 finished with value: 0.22774012814561062 and parameters: {'model_type': 'graphsage', 'hidden_dims': '[256, 128]', 'dropout': 0.4483564883948287, 'batch_norm': True, 'sage_aggr': 'mean', 'sage_normalize': True, 'sage_project': False, 'lr': 0.0002828876346594406, 'weight_decay': 6.412837049253266e-05, 'epochs': 199, 'loss': 'mae', 'optimizer': 'adam', 'graph_mode': 'cutoff', 'cutoff': 0.7658167521683491, 'grm_norm': 'cosine_then_gcn', 'self_loops': False, 'use_snp_selection': True, 'num_snps': 12880, 'graphsage_batch_size': 64}. Best is trial 89 with value: 0.23440750426696227.
[I 2025-12-05 23:39:59,460] Trial 102 finished with value: 0.22360251344481444 and parameters: {'model_type': 'graphsage', 'hidden_dims': '[256, 128]', 'dropout': 0.446804217797663, 'batch_norm': True, 'sage_aggr': 'mean', 'sage_normalize': True, 'sage_project': False, 'lr': 0.00031840165726492717, 'weight_decay': 6.187553929840301e-05, 'epochs': 216, 'loss': 'mae', 'optimizer': 'adam', 'graph_mode': 'cutoff', 'cutoff': 0.7477642577336475, 'grm_norm': 'cosine_then_gcn', 'self_loops': False, 'use_snp_selection': True, 'num_snps': 13247, 'graphsage_batch_size': 64}. Best is trial 89 with value: 0.23440750426696227.
[I 2025-12-05 23:40:29,877] Trial 103 finished with value: 0.23099940366498797 and parameters: {'model_type': 'graphsage', 'hidden_dims': '[256, 128]', 'dropout': 0.48302678431597823, 'batch_norm': True, 'sage_aggr': 'mean', 'sage_normalize': True, 'sage_project': False, 'lr': 0.0006485512398650298, 'weight_decay': 0.00010604937494351965, 'epochs': 225, 'loss': 'mae', 'optimizer': 'adam', 'graph_mode': 'cutoff', 'cutoff': 0.6121057598109725, 'grm_norm': 'cosine_then_gcn', 'self_loops': False, 'use_snp_selection': True, 'num_snps': 11350, 'graphsage_batch_size': 64}. Best is trial 89 with value: 0.23440750426696227.
[I 2025-12-05 23:40:54,918] Trial 104 finished with value: 0.22968588170837623 and parameters: {'model_type': 'graphsage', 'hidden_dims': '[128, 64]', 'dropout': 0.4841266524921281, 'batch_norm': True, 'sage_aggr': 'mean', 'sage_normalize': True, 'sage_project': False, 'lr': 0.000998724495290409, 'weight_decay': 0.00011801065675665082, 'epochs': 211, 'loss': 'mae', 'optimizer': 'adam', 'graph_mode': 'cutoff', 'cutoff': 0.6108024399503926, 'grm_norm': 'none', 'self_loops': False, 'use_snp_selection': True, 'num_snps': 12637, 'graphsage_batch_size': 64}. Best is trial 89 with value: 0.23440750426696227.
[I 2025-12-05 23:41:22,256] Trial 105 finished with value: 0.22667425911907907 and parameters: {'model_type': 'graphsage', 'hidden_dims': '[128, 64]', 'dropout': 0.48623339438849295, 'batch_norm': True, 'sage_aggr': 'mean', 'sage_normalize': True, 'sage_project': False, 'lr': 0.000989199263555699, 'weight_decay': 0.00022919560029131117, 'epochs': 198, 'loss': 'mae', 'optimizer': 'adam', 'graph_mode': 'cutoff', 'cutoff': 0.5000736008142389, 'grm_norm': 'none', 'self_loops': False, 'use_snp_selection': True, 'num_snps': 12801, 'graphsage_batch_size': 64}. Best is trial 89 with value: 0.23440750426696227.
[I 2025-12-05 23:41:52,759] Trial 106 finished with value: 0.2075609659625079 and parameters: {'model_type': 'graphsage', 'hidden_dims': '[128, 64]', 'dropout': 0.46949358871197866, 'batch_norm': True, 'sage_aggr': 'mean', 'sage_normalize': True, 'sage_project': False, 'lr': 0.0006735750657842457, 'weight_decay': 0.00010878943380517844, 'epochs': 202, 'loss': 'mae', 'optimizer': 'adam', 'graph_mode': 'cutoff', 'cutoff': 0.550508279459882, 'grm_norm': 'none', 'self_loops': False, 'use_snp_selection': True, 'num_snps': 18805, 'graphsage_batch_size': 8}. Best is trial 89 with value: 0.23440750426696227.
[I 2025-12-05 23:42:36,121] Trial 107 finished with value: 0.21927848081447618 and parameters: {'model_type': 'graphsage', 'hidden_dims': '[512, 64]', 'dropout': 0.4590430118483362, 'batch_norm': True, 'sage_aggr': 'mean', 'sage_normalize': False, 'sage_project': False, 'lr': 0.00045689806927115746, 'weight_decay': 0.0001319521130282008, 'epochs': 192, 'loss': 'mae', 'optimizer': 'adam', 'graph_mode': 'cutoff', 'cutoff': 0.5872975818459758, 'grm_norm': 'none', 'self_loops': False, 'use_snp_selection': True, 'num_snps': 15297, 'graphsage_batch_size': 64}. Best is trial 89 with value: 0.23440750426696227.
[I 2025-12-05 23:43:01,145] Trial 108 finished with value: 0.22264115534193807 and parameters: {'model_type': 'graphsage', 'hidden_dims': '[128, 64]', 'dropout': 0.5026971232972325, 'batch_norm': True, 'sage_aggr': 'mean', 'sage_normalize': True, 'sage_project': False, 'lr': 0.0005313151876139328, 'weight_decay': 0.00018093878997034956, 'epochs': 213, 'loss': 'mae', 'optimizer': 'adam', 'graph_mode': 'cutoff', 'cutoff': 0.7965639412893815, 'grm_norm': 'none', 'self_loops': False, 'use_snp_selection': True, 'num_snps': 13130, 'graphsage_batch_size': 256}. Best is trial 89 with value: 0.23440750426696227.
[I 2025-12-05 23:43:29,216] Trial 109 finished with value: 0.19342356528465135 and parameters: {'model_type': 'graphsage', 'hidden_dims': '[128, 64]', 'dropout': 0.5351311303284875, 'batch_norm': True, 'sage_aggr': 'mean', 'sage_normalize': True, 'sage_project': False, 'lr': 0.0007731356327974284, 'weight_decay': 9.106663447471669e-05, 'epochs': 210, 'loss': 'mae', 'optimizer': 'adam', 'graph_mode': 'knn', 'knn_k': 5, 'weighted_edges': False, 'symmetrize_mode': 'mutual', 'self_loops': False, 'use_snp_selection': True, 'num_snps': 11200, 'graphsage_batch_size': 64}. Best is trial 89 with value: 0.23440750426696227.
[I 2025-12-05 23:43:54,265] Trial 110 finished with value: 0.208456223006717 and parameters: {'model_type': 'graphsage', 'hidden_dims': '[256, 128]', 'dropout': 0.47743180618787, 'batch_norm': True, 'sage_aggr': 'mean', 'sage_normalize': True, 'sage_project': False, 'lr': 0.0003902183785379013, 'weight_decay': 6.254765175999848e-05, 'epochs': 223, 'loss': 'mae', 'optimizer': 'adam', 'graph_mode': 'cutoff', 'cutoff': 0.6216575086743629, 'grm_norm': 'cosine_then_gcn', 'self_loops': False, 'use_snp_selection': True, 'num_snps': 7239, 'graphsage_batch_size': 64}. Best is trial 89 with value: 0.23440750426696227.
[I 2025-12-05 23:44:21,432] Trial 111 finished with value: 0.21375083116196852 and parameters: {'model_type': 'graphsage', 'hidden_dims': '[128, 64]', 'dropout': 0.4838804248639574, 'batch_norm': True, 'sage_aggr': 'mean', 'sage_normalize': True, 'sage_project': False, 'lr': 0.0009257502907470458, 'weight_decay': 0.00024225701766189664, 'epochs': 198, 'loss': 'mae', 'optimizer': 'adam', 'graph_mode': 'cutoff', 'cutoff': 0.5018194119000564, 'grm_norm': 'none', 'self_loops': False, 'use_snp_selection': True, 'num_snps': 12881, 'graphsage_batch_size': 64}. Best is trial 89 with value: 0.23440750426696227.
[I 2025-12-05 23:44:51,526] Trial 112 finished with value: 0.22636139210040138 and parameters: {'model_type': 'graphsage', 'hidden_dims': '[128, 64]', 'dropout': 0.4936185202877736, 'batch_norm': True, 'sage_aggr': 'mean', 'sage_normalize': True, 'sage_project': False, 'lr': 0.0006150439635620675, 'weight_decay': 0.00011873666312246968, 'epochs': 186, 'loss': 'mae', 'optimizer': 'adam', 'graph_mode': 'cutoff', 'cutoff': 0.4832453410263957, 'grm_norm': 'none', 'self_loops': False, 'use_snp_selection': True, 'num_snps': 14527, 'graphsage_batch_size': 64}. Best is trial 89 with value: 0.23440750426696227.
[I 2025-12-05 23:45:18,543] Trial 113 finished with value: 0.22162483266786698 and parameters: {'model_type': 'graphsage', 'hidden_dims': '[128, 64]', 'dropout': 0.5191766219857787, 'batch_norm': True, 'sage_aggr': 'mean', 'sage_normalize': True, 'sage_project': False, 'lr': 0.0009570098333105311, 'weight_decay': 0.0003744765839753466, 'epochs': 199, 'loss': 'mae', 'optimizer': 'adam', 'graph_mode': 'cutoff', 'cutoff': 0.4526230715256756, 'grm_norm': 'none', 'self_loops': False, 'use_snp_selection': True, 'num_snps': 10545, 'graphsage_batch_size': 64}. Best is trial 89 with value: 0.23440750426696227.
[I 2025-12-05 23:45:49,575] Trial 114 finished with value: 0.21261150357435915 and parameters: {'model_type': 'graphsage', 'hidden_dims': '[128, 64]', 'dropout': 0.44970713765207865, 'batch_norm': True, 'sage_aggr': 'mean', 'sage_normalize': True, 'sage_project': False, 'lr': 0.0006358523164047994, 'weight_decay': 7.995769329679833e-05, 'epochs': 204, 'loss': 'mae', 'optimizer': 'adam', 'graph_mode': 'cutoff', 'cutoff': 0.516133113061559, 'grm_norm': 'none', 'self_loops': False, 'use_snp_selection': True, 'num_snps': 17286, 'graphsage_batch_size': 64}. Best is trial 89 with value: 0.23440750426696227.
[I 2025-12-05 23:46:20,363] Trial 115 finished with value: 0.21888592855091074 and parameters: {'model_type': 'graphsage', 'hidden_dims': '[256, 128]', 'dropout': 0.4660086654239331, 'batch_norm': True, 'sage_aggr': 'mean', 'sage_normalize': True, 'sage_project': False, 'lr': 0.0002376605696143308, 'weight_decay': 0.0001730745118615122, 'epochs': 207, 'loss': 'mae', 'optimizer': 'adam', 'graph_mode': 'cutoff', 'cutoff': 0.5729513475510449, 'grm_norm': 'none', 'self_loops': False, 'use_snp_selection': True, 'num_snps': 12661, 'graphsage_batch_size': 64}. Best is trial 89 with value: 0.23440750426696227.
[I 2025-12-05 23:46:46,719] Trial 116 finished with value: 0.22748112442016458 and parameters: {'model_type': 'graphsage', 'hidden_dims': '[256, 128]', 'dropout': 0.4801260038964063, 'batch_norm': True, 'sage_aggr': 'mean', 'sage_normalize': True, 'sage_project': False, 'lr': 0.0004765228110650075, 'weight_decay': 3.767517504507938e-05, 'epochs': 218, 'loss': 'mae', 'optimizer': 'adam', 'graph_mode': 'cutoff', 'cutoff': 0.6174961865632347, 'grm_norm': 'cosine_then_gcn', 'self_loops': False, 'use_snp_selection': True, 'num_snps': 8439, 'graphsage_batch_size': 64}. Best is trial 89 with value: 0.23440750426696227.
