[I 2025-12-09 11:53:35,506] Trial 118 finished with value: 0.30853163563298586 and parameters: {'model_type': 'graphsage', 'hidden_dims': '[512, 256]', 'dropout': 0.37605819689666753, 'batch_norm': False, 'sage_aggr': 'max', 'sage_normalize': True, 'sage_project': False, 'lr': 0.007170109118841074, 'weight_decay': 4.77827712084996e-07, 'epochs': 303, 'loss': 'mse', 'optimizer': 'adam', 'graph_mode': 'cutoff', 'cutoff': 0.8710077706505619, 'grm_norm': 'cosine_then_gcn', 'self_loops': True, 'use_snp_selection': True, 'num_snps': 52569}. Best is trial 111 with value: 0.3115588534626376.
[I 2025-12-09 11:56:26,353] Trial 119 finished with value: 0.30736860275273903 and parameters: {'model_type': 'graphsage', 'hidden_dims': '[512, 256]', 'dropout': 0.38131934074270346, 'batch_norm': False, 'sage_aggr': 'max', 'sage_normalize': True, 'sage_project': False, 'lr': 0.007433639057914449, 'weight_decay': 4.565875703401376e-07, 'epochs': 301, 'loss': 'mse', 'optimizer': 'adam', 'graph_mode': 'cutoff', 'cutoff': 0.8374023800325244, 'grm_norm': 'cosine_then_gcn', 'self_loops': True, 'use_snp_selection': True, 'num_snps': 57608}. Best is trial 111 with value: 0.3115588534626376.
[I 2025-12-09 11:59:07,638] Trial 120 finished with value: 0.28960346825364913 and parameters: {'model_type': 'graphsage', 'hidden_dims': '[512, 256]', 'dropout': 0.3751770933440078, 'batch_norm': False, 'sage_aggr': 'max', 'sage_normalize': True, 'sage_project': False, 'lr': 0.00701245518486284, 'weight_decay': 5.822751675819654e-07, 'epochs': 279, 'loss': 'mse', 'optimizer': 'adam', 'graph_mode': 'cutoff', 'cutoff': 0.8687379173203913, 'grm_norm': 'cosine_then_gcn', 'self_loops': False, 'use_snp_selection': True, 'num_snps': 58654}. Best is trial 111 with value: 0.3115588534626376.
[I 2025-12-09 12:01:52,700] Trial 121 finished with value: 0.3072053992936125 and parameters: {'model_type': 'graphsage', 'hidden_dims': '[512, 256]', 'dropout': 0.39450180412495317, 'batch_norm': False, 'sage_aggr': 'max', 'sage_normalize': True, 'sage_project': False, 'lr': 0.0081958832699599, 'weight_decay': 4.8668730070902e-07, 'epochs': 303, 'loss': 'mse', 'optimizer': 'adam', 'graph_mode': 'cutoff', 'cutoff': 0.8376690559264759, 'grm_norm': 'cosine_then_gcn', 'self_loops': True, 'use_snp_selection': True, 'num_snps': 55759}. Best is trial 111 with value: 0.3115588534626376.
[I 2025-12-09 12:04:32,062] Trial 122 finished with value: 0.2869975262732728 and parameters: {'model_type': 'graphsage', 'hidden_dims': '[512, 256]', 'dropout': 0.39577070786332613, 'batch_norm': False, 'sage_aggr': 'max', 'sage_normalize': True, 'sage_project': False, 'lr': 0.008305699323638236, 'weight_decay': 8.571740541024225e-07, 'epochs': 301, 'loss': 'mse', 'optimizer': 'adam', 'graph_mode': 'cutoff', 'cutoff': 0.8072710902026184, 'grm_norm': 'cosine_then_gcn', 'self_loops': True, 'use_snp_selection': True, 'num_snps': 55177}. Best is trial 111 with value: 0.3115588534626376.
[I 2025-12-09 12:07:01,986] Trial 123 finished with value: 0.30173917782695037 and parameters: {'model_type': 'graphsage', 'hidden_dims': '[512, 256]', 'dropout': 0.38062496210009855, 'batch_norm': False, 'sage_aggr': 'max', 'sage_normalize': True, 'sage_project': False, 'lr': 0.0058869508520259005, 'weight_decay': 4.363695922690888e-07, 'epochs': 290, 'loss': 'mse', 'optimizer': 'adam', 'graph_mode': 'cutoff', 'cutoff': 0.8278906045030339, 'grm_norm': 'cosine_then_gcn', 'self_loops': True, 'use_snp_selection': True, 'num_snps': 52239}. Best is trial 111 with value: 0.3115588534626376.
[I 2025-12-09 12:09:52,412] Trial 124 finished with value: 0.3054845095412227 and parameters: {'model_type': 'graphsage', 'hidden_dims': '[512, 256]', 'dropout': 0.3502962874104212, 'batch_norm': False, 'sage_aggr': 'max', 'sage_normalize': True, 'sage_project': False, 'lr': 0.007058526817666318, 'weight_decay': 3.624971061093962e-07, 'epochs': 296, 'loss': 'mse', 'optimizer': 'adam', 'graph_mode': 'cutoff', 'cutoff': 0.8531136480876416, 'grm_norm': 'cosine_then_gcn', 'self_loops': True, 'use_snp_selection': True, 'num_snps': 58502}. Best is trial 111 with value: 0.3115588534626376.
[I 2025-12-09 12:12:27,891] Trial 125 finished with value: 0.30339406620501436 and parameters: {'model_type': 'graphsage', 'hidden_dims': '[512, 256]', 'dropout': 0.41850571718543456, 'batch_norm': False, 'sage_aggr': 'max', 'sage_normalize': True, 'sage_project': False, 'lr': 0.008034296696524688, 'weight_decay': 2.551811640273245e-07, 'epochs': 258, 'loss': 'mse', 'optimizer': 'adam', 'graph_mode': 'cutoff', 'cutoff': 0.8788794531625795, 'grm_norm': 'cosine_then_gcn', 'self_loops': True, 'use_snp_selection': True, 'num_snps': 59938}. Best is trial 111 with value: 0.3115588534626376.
[I 2025-12-09 12:16:06,238] Trial 126 finished with value: 0.2863112565532515 and parameters: {'model_type': 'graphsage', 'hidden_dims': '[512, 256]', 'dropout': 0.3867340073397418, 'batch_norm': False, 'sage_aggr': 'max', 'sage_normalize': True, 'sage_project': False, 'lr': 0.004241540908865497, 'weight_decay': 4.51505792199463e-07, 'epochs': 304, 'loss': 'mse', 'optimizer': 'adam', 'graph_mode': 'cutoff', 'cutoff': 0.47371905667307124, 'grm_norm': 'cosine_then_gcn', 'self_loops': True, 'use_snp_selection': True, 'num_snps': 48722}. Best is trial 111 with value: 0.3115588534626376.
[I 2025-12-09 12:17:05,709] Trial 127 finished with value: 0.30271226588679667 and parameters: {'model_type': 'graphsage', 'hidden_dims': '[512, 256]', 'dropout': 0.3353797977516392, 'batch_norm': False, 'sage_aggr': 'max', 'sage_normalize': True, 'sage_project': False, 'lr': 0.009870205836079338, 'weight_decay': 1.0380854491544394e-06, 'epochs': 284, 'loss': 'mse', 'optimizer': 'adam', 'graph_mode': 'cutoff', 'cutoff': 0.7892639920571008, 'grm_norm': 'cosine_then_gcn', 'self_loops': True, 'use_snp_selection': True, 'num_snps': 20369}. Best is trial 111 with value: 0.3115588534626376.
[I 2025-12-09 12:19:22,856] Trial 128 finished with value: 0.29943997838516195 and parameters: {'model_type': 'graphsage', 'hidden_dims': '[512, 256]', 'dropout': 0.40513827524170015, 'batch_norm': False, 'sage_aggr': 'max', 'sage_normalize': True, 'sage_project': False, 'lr': 0.004821548852598358, 'weight_decay': 7.347963250927809e-07, 'epochs': 268, 'loss': 'mse', 'optimizer': 'adam', 'graph_mode': 'cutoff', 'cutoff': 0.8630527032066552, 'grm_norm': 'cosine_then_gcn', 'self_loops': True, 'use_snp_selection': True, 'num_snps': 55284}. Best is trial 111 with value: 0.3115588534626376.
[I 2025-12-09 12:21:04,399] Trial 129 finished with value: 0.30874451655121554 and parameters: {'model_type': 'graphsage', 'hidden_dims': '[512, 256]', 'dropout': 0.43998586041289817, 'batch_norm': False, 'sage_aggr': 'max', 'sage_normalize': True, 'sage_project': False, 'lr': 0.005900030817325556, 'weight_decay': 4.348984626142467e-07, 'epochs': 184, 'loss': 'mse', 'optimizer': 'adam', 'graph_mode': 'cutoff', 'cutoff': 0.8177255269176225, 'grm_norm': 'cosine_then_gcn', 'self_loops': True, 'use_snp_selection': True, 'num_snps': 52270}. Best is trial 111 with value: 0.3115588534626376.
[I 2025-12-09 12:22:46,127] Trial 130 finished with value: 0.30008721960157836 and parameters: {'model_type': 'graphsage', 'hidden_dims': '[512, 256]', 'dropout': 0.3591536470072994, 'batch_norm': False, 'sage_aggr': 'max', 'sage_normalize': True, 'sage_project': False, 'lr': 0.006378293515118989, 'weight_decay': 1.7487495892083275e-07, 'epochs': 186, 'loss': 'mse', 'optimizer': 'adam', 'graph_mode': 'cutoff', 'cutoff': 0.8207484716086288, 'grm_norm': 'cosine_then_gcn', 'self_loops': True, 'use_snp_selection': True, 'num_snps': 51888}. Best is trial 111 with value: 0.3115588534626376.
[I 2025-12-09 12:24:23,864] Trial 131 finished with value: 0.3023704034945308 and parameters: {'model_type': 'graphsage', 'hidden_dims': '[512, 256]', 'dropout': 0.43853432685804605, 'batch_norm': False, 'sage_aggr': 'max', 'sage_normalize': True, 'sage_project': False, 'lr': 0.0071730137253133205, 'weight_decay': 4.0090720159897354e-07, 'epochs': 158, 'loss': 'mse', 'optimizer': 'adam', 'graph_mode': 'cutoff', 'cutoff': 0.8395524014596126, 'grm_norm': 'cosine_then_gcn', 'self_loops': True, 'use_snp_selection': True, 'num_snps': 57208}. Best is trial 111 with value: 0.3115588534626376.
[I 2025-12-09 12:26:02,407] Trial 132 finished with value: 0.30698334000571 and parameters: {'model_type': 'graphsage', 'hidden_dims': '[512, 256]', 'dropout': 0.39114823948468824, 'batch_norm': False, 'sage_aggr': 'max', 'sage_normalize': True, 'sage_project': False, 'lr': 0.004638534131559639, 'weight_decay': 5.170777323964994e-07, 'epochs': 175, 'loss': 'mse', 'optimizer': 'adam', 'graph_mode': 'cutoff', 'cutoff': 0.797669672667575, 'grm_norm': 'cosine_then_gcn', 'self_loops': True, 'use_snp_selection': True, 'num_snps': 53043}. Best is trial 111 with value: 0.3115588534626376.
[I 2025-12-09 12:28:27,773] Trial 133 finished with value: 0.3099641726740849 and parameters: {'model_type': 'graphsage', 'hidden_dims': '[512, 256]', 'dropout': 0.3731560736451417, 'batch_norm': False, 'sage_aggr': 'max', 'sage_normalize': True, 'sage_project': False, 'lr': 0.008268732987741669, 'weight_decay': 2.0483529863374488e-07, 'epochs': 276, 'loss': 'mse', 'optimizer': 'adam', 'graph_mode': 'cutoff', 'cutoff': 0.8237718943148258, 'grm_norm': 'cosine_then_gcn', 'self_loops': True, 'use_snp_selection': True, 'num_snps': 54534}. Best is trial 111 with value: 0.3115588534626376.
[I 2025-12-09 12:30:22,886] Trial 134 finished with value: 0.3070621886946044 and parameters: {'model_type': 'graphsage', 'hidden_dims': '[512, 256]', 'dropout': 0.37641447221306695, 'batch_norm': False, 'sage_aggr': 'max', 'sage_normalize': True, 'sage_project': False, 'lr': 0.0033339683857673322, 'weight_decay': 3.2137722157703867e-07, 'epochs': 205, 'loss': 'mse', 'optimizer': 'adam', 'graph_mode': 'cutoff', 'cutoff': 0.7771360568443939, 'grm_norm': 'cosine_then_gcn', 'self_loops': True, 'use_snp_selection': True, 'num_snps': 53918}. Best is trial 111 with value: 0.3115588534626376.
[I 2025-12-09 12:31:42,741] Trial 135 finished with value: 0.30837556223624624 and parameters: {'model_type': 'graphsage', 'hidden_dims': '[512, 256]', 'dropout': 0.31727730998373505, 'batch_norm': False, 'sage_aggr': 'max', 'sage_normalize': True, 'sage_project': False, 'lr': 0.002571377571099483, 'weight_decay': 1.7895431786696648e-07, 'epochs': 288, 'loss': 'mse', 'optimizer': 'adam', 'graph_mode': 'cutoff', 'cutoff': 0.7509903760634682, 'grm_norm': 'cosine_then_gcn', 'self_loops': True, 'use_snp_selection': True, 'num_snps': 27825}. Best is trial 111 with value: 0.3115588534626376.
[I 2025-12-09 12:32:39,250] Trial 136 finished with value: 0.3004785476848119 and parameters: {'model_type': 'graphsage', 'hidden_dims': '[512, 256]', 'dropout': 0.2678128367315522, 'batch_norm': False, 'sage_aggr': 'max', 'sage_normalize': True, 'sage_project': False, 'lr': 0.005636251283090386, 'weight_decay': 1.3320775895180166e-07, 'epochs': 188, 'loss': 'mse', 'optimizer': 'adam', 'graph_mode': 'cutoff', 'cutoff': 0.7478889020943973, 'grm_norm': 'cosine_then_gcn', 'self_loops': True, 'use_snp_selection': True, 'num_snps': 27723}. Best is trial 111 with value: 0.3115588534626376.
[I 2025-12-09 12:34:03,382] Trial 137 finished with value: 0.3015904038864089 and parameters: {'model_type': 'graphsage', 'hidden_dims': '[512, 256]', 'dropout': 0.31307139242536797, 'batch_norm': False, 'sage_aggr': 'max', 'sage_normalize': True, 'sage_project': False, 'lr': 0.0026959121090914624, 'weight_decay': 1.9511301944428506e-07, 'epochs': 279, 'loss': 'mse', 'optimizer': 'adam', 'graph_mode': 'cutoff', 'cutoff': 0.8087110918694254, 'grm_norm': 'cosine_then_gcn', 'self_loops': True, 'use_snp_selection': True, 'num_snps': 30814}. Best is trial 111 with value: 0.3115588534626376.
[I 2025-12-09 12:36:48,375] Trial 138 finished with value: 0.3000172260254491 and parameters: {'model_type': 'graphsage', 'hidden_dims': '[512, 64]', 'dropout': 0.3451611784455796, 'batch_norm': False, 'sage_aggr': 'max', 'sage_normalize': True, 'sage_project': False, 'lr': 0.006155283486680519, 'weight_decay': 1.28196852647779e-07, 'epochs': 288, 'loss': 'mse', 'optimizer': 'adam', 'graph_mode': 'cutoff', 'cutoff': 0.8572089564888393, 'grm_norm': 'cosine_then_gcn', 'self_loops': True, 'use_snp_selection': True, 'num_snps': 58033}. Best is trial 111 with value: 0.3115588534626376.
[I 2025-12-09 12:39:04,075] Trial 139 finished with value: 0.3045819117695149 and parameters: {'model_type': 'graphsage', 'hidden_dims': '[512, 256]', 'dropout': 0.32371311363976885, 'batch_norm': False, 'sage_aggr': 'max', 'sage_normalize': True, 'sage_project': False, 'lr': 0.0024508164854395017, 'weight_decay': 1.8576711946103125e-07, 'epochs': 273, 'loss': 'mse', 'optimizer': 'adam', 'graph_mode': 'cutoff', 'cutoff': 0.8216486573211512, 'grm_norm': 'cosine_then_gcn', 'self_loops': True, 'use_snp_selection': True, 'num_snps': 50097}. Best is trial 111 with value: 0.3115588534626376.
[I 2025-12-09 12:40:22,658] Trial 140 finished with value: 0.3007618760945303 and parameters: {'model_type': 'graphsage', 'hidden_dims': '[512, 256]', 'dropout': 0.367298167542616, 'batch_norm': False, 'sage_aggr': 'max', 'sage_normalize': True, 'sage_project': False, 'lr': 0.004653068933370605, 'weight_decay': 2.3207738294971185e-07, 'epochs': 263, 'loss': 'mse', 'optimizer': 'adam', 'graph_mode': 'cutoff', 'cutoff': 0.8818216928646812, 'grm_norm': 'cosine_then_gcn', 'self_loops': True, 'use_snp_selection': True, 'num_snps': 30126}. Best is trial 111 with value: 0.3115588534626376.
[I 2025-12-09 12:43:04,295] Trial 141 finished with value: 0.3044182046092523 and parameters: {'model_type': 'graphsage', 'hidden_dims': '[512, 256]', 'dropout': 0.3509241379000213, 'batch_norm': False, 'sage_aggr': 'max', 'sage_normalize': True, 'sage_project': False, 'lr': 0.008489083334988958, 'weight_decay': 1.0076883876991843e-07, 'epochs': 294, 'loss': 'mse', 'optimizer': 'adam', 'graph_mode': 'cutoff', 'cutoff': 0.8677808644072164, 'grm_norm': 'cosine_then_gcn', 'self_loops': True, 'use_snp_selection': True, 'num_snps': 56576}. Best is trial 111 with value: 0.3115588534626376.
[I 2025-12-09 12:44:19,257] Trial 142 finished with value: 0.29907242098598547 and parameters: {'model_type': 'graphsage', 'hidden_dims': '[512, 256]', 'dropout': 0.33745979953014044, 'batch_norm': False, 'sage_aggr': 'max', 'sage_normalize': True, 'sage_project': False, 'lr': 0.0037630225718142452, 'weight_decay': 2.522236066980412e-07, 'epochs': 308, 'loss': 'mse', 'optimizer': 'adam', 'graph_mode': 'cutoff', 'cutoff': 0.8471345482211309, 'grm_norm': 'none', 'self_loops': True, 'use_snp_selection': True, 'num_snps': 24550}. Best is trial 111 with value: 0.3115588534626376.
[I 2025-12-09 12:45:39,010] Trial 143 finished with value: 0.2983376438345318 and parameters: {'model_type': 'graphsage', 'hidden_dims': '[512, 256]', 'dropout': 0.41681863782875805, 'batch_norm': False, 'sage_aggr': 'max', 'sage_normalize': True, 'sage_project': False, 'lr': 0.001573616334272077, 'weight_decay': 7.116766088110189e-07, 'epochs': 282, 'loss': 'mse', 'optimizer': 'adam', 'graph_mode': 'cutoff', 'cutoff': 0.829821433872593, 'grm_norm': 'cosine_then_gcn', 'self_loops': True, 'use_snp_selection': True, 'num_snps': 28835}. Best is trial 111 with value: 0.3115588534626376.
[I 2025-12-09 12:46:33,298] Trial 144 finished with value: 0.299206059724651 and parameters: {'model_type': 'graphsage', 'hidden_dims': '[512, 256]', 'dropout': 0.3713484998158591, 'batch_norm': False, 'sage_aggr': 'max', 'sage_normalize': True, 'sage_project': False, 'lr': 0.002903248214376491, 'weight_decay': 1.451500834493016e-07, 'epochs': 199, 'loss': 'mse', 'optimizer': 'adam', 'graph_mode': 'cutoff', 'cutoff': 0.8121879277469538, 'grm_norm': 'cosine_then_gcn', 'self_loops': True, 'use_snp_selection': True, 'num_snps': 25621}. Best is trial 111 with value: 0.3115588534626376.
[I 2025-12-09 12:48:59,842] Trial 145 finished with value: 0.30234492963769477 and parameters: {'model_type': 'graphsage', 'hidden_dims': '[512, 256]', 'dropout': 0.3587528814619679, 'batch_norm': False, 'sage_aggr': 'max', 'sage_normalize': True, 'sage_project': False, 'lr': 0.0017119637736883896, 'weight_decay': 1.0681871018122613e-06, 'epochs': 274, 'loss': 'mse', 'optimizer': 'adam', 'graph_mode': 'cutoff', 'cutoff': 0.7988680302302748, 'grm_norm': 'cosine_then_gcn', 'self_loops': True, 'use_snp_selection': True, 'num_snps': 54755}. Best is trial 111 with value: 0.3115588534626376.
[I 2025-12-09 12:49:28,547] Trial 146 finished with value: 0.27768022272456755 and parameters: {'model_type': 'graphsage', 'hidden_dims': '[512, 256]', 'dropout': 0.38436985705998616, 'batch_norm': False, 'sage_aggr': 'max', 'sage_normalize': True, 'sage_project': False, 'lr': 0.007071137612114311, 'weight_decay': 4.629996603020818e-06, 'epochs': 88, 'loss': 'mse', 'optimizer': 'adam', 'graph_mode': 'cutoff', 'cutoff': 0.8520857638847134, 'grm_norm': 'none', 'self_loops': False, 'use_snp_selection': True, 'num_snps': 22559}. Best is trial 111 with value: 0.3115588534626376.
[I 2025-12-09 12:51:03,936] Trial 147 finished with value: 0.2998664207631411 and parameters: {'model_type': 'graphsage', 'hidden_dims': '[512, 64]', 'dropout': 0.33008989748888395, 'batch_norm': False, 'sage_aggr': 'max', 'sage_normalize': True, 'sage_project': False, 'lr': 0.0024467962659092345, 'weight_decay': 2.9051693384661904e-07, 'epochs': 298, 'loss': 'mse', 'optimizer': 'adam', 'graph_mode': 'cutoff', 'cutoff': 0.8722488289918755, 'grm_norm': 'cosine_then_gcn', 'self_loops': True, 'use_snp_selection': True, 'num_snps': 33180}. Best is trial 111 with value: 0.3115588534626376.
[I 2025-12-09 12:52:11,871] Trial 148 finished with value: 0.30206581696169116 and parameters: {'model_type': 'graphsage', 'hidden_dims': '[512, 128]', 'dropout': 0.4068797110233954, 'batch_norm': False, 'sage_aggr': 'max', 'sage_normalize': True, 'sage_project': False, 'lr': 0.0010722992979599955, 'weight_decay': 7.180515919096018e-06, 'epochs': 164, 'loss': 'mse', 'optimizer': 'adam', 'graph_mode': 'cutoff', 'cutoff': 0.7740508831558415, 'grm_norm': 'cosine', 'self_loops': True, 'use_snp_selection': True, 'num_snps': 38612}. Best is trial 111 with value: 0.3115588534626376.
[I 2025-12-09 12:54:56,831] Trial 149 finished with value: 0.3043438770864053 and parameters: {'model_type': 'graphsage', 'hidden_dims': '[512, 256]', 'dropout': 0.38330765009507184, 'batch_norm': False, 'sage_aggr': 'max', 'sage_normalize': True, 'sage_project': False, 'lr': 0.003407242126497376, 'weight_decay': 3.917675768365555e-07, 'epochs': 287, 'loss': 'mse', 'optimizer': 'adam', 'graph_mode': 'cutoff', 'cutoff': 0.7593833924666512, 'grm_norm': 'cosine_then_gcn', 'self_loops': True, 'use_snp_selection': True, 'num_snps': 57759}. Best is trial 111 with value: 0.3115588534626376.
[I 2025-12-09 12:56:51,033] Trial 0 finished with value: 0.26380625988910306 and parameters: {'model_type': 'graphsage', 'hidden_dims': '[128, 64]', 'dropout': 0.199031432379812, 'batch_norm': True, 'sage_aggr': 'max', 'sage_normalize': True, 'sage_project': False, 'lr': 0.00034401453323286885, 'weight_decay': 0.00017802616915745114, 'epochs': 230, 'loss': 'mse', 'optimizer': 'adam', 'graph_mode': 'knn', 'knn_k': 6, 'weighted_edges': True, 'symmetrize_mode': 'mutual', 'self_loops': True, 'use_snp_selection': False}. Best is trial 0 with value: 0.26380625988910306.
[I 2025-12-09 12:58:24,885] Trial 1 finished with value: 0.2871972881123569 and parameters: {'model_type': 'graphsage', 'hidden_dims': '[512, 128]', 'dropout': 0.2503500283181017, 'batch_norm': False, 'sage_aggr': 'max', 'sage_normalize': False, 'sage_project': False, 'lr': 3.952233718592099e-05, 'weight_decay': 0.00026754769258252603, 'epochs': 149, 'loss': 'mse', 'optimizer': 'adam', 'graph_mode': 'knn', 'knn_k': 2, 'weighted_edges': False, 'symmetrize_mode': 'mutual', 'self_loops': True, 'use_snp_selection': True, 'num_snps': 49915}. Best is trial 1 with value: 0.2871972881123569.
[I 2025-12-09 12:59:37,236] Trial 2 finished with value: 0.286658662383027 and parameters: {'model_type': 'graphsage', 'hidden_dims': '[512, 256]', 'dropout': 0.2785908793172681, 'batch_norm': False, 'sage_aggr': 'max', 'sage_normalize': False, 'sage_project': False, 'lr': 8.806039223165805e-05, 'weight_decay': 3.5153176302760294e-05, 'epochs': 147, 'loss': 'mae', 'optimizer': 'adam', 'graph_mode': 'cutoff', 'cutoff': 0.4922564006874869, 'grm_norm': 'gcn', 'self_loops': False, 'use_snp_selection': True, 'num_snps': 34340}. Best is trial 1 with value: 0.2871972881123569.
[I 2025-12-09 13:01:02,486] Trial 3 finished with value: 0.30100827123453333 and parameters: {'model_type': 'graphsage', 'hidden_dims': '[256, 128, 64]', 'dropout': 0.3475243154412272, 'batch_norm': True, 'sage_aggr': 'max', 'sage_normalize': False, 'sage_project': False, 'lr': 1.6006331996938085e-05, 'weight_decay': 7.213121225589906e-06, 'epochs': 283, 'loss': 'mse', 'optimizer': 'adam', 'graph_mode': 'cutoff', 'cutoff': 0.5942334791449215, 'grm_norm': 'none', 'self_loops': True, 'use_snp_selection': False}. Best is trial 3 with value: 0.30100827123453333.
[I 2025-12-09 13:01:25,433] Trial 4 finished with value: 0.27293558837832965 and parameters: {'model_type': 'graphsage', 'hidden_dims': '[128, 64]', 'dropout': 0.3348926467202472, 'batch_norm': True, 'sage_aggr': 'max', 'sage_normalize': False, 'sage_project': False, 'lr': 0.0004238630400638802, 'weight_decay': 8.074086040046576e-07, 'epochs': 158, 'loss': 'mae', 'optimizer': 'adam', 'graph_mode': 'knn', 'knn_k': 1, 'weighted_edges': False, 'symmetrize_mode': 'mutual', 'self_loops': False, 'use_snp_selection': True, 'num_snps': 26850}. Best is trial 3 with value: 0.30100827123453333.
