[I 2025-12-08 12:08:22,523] Trial 115 finished with value: 0.29824986740441595 and parameters: {'model_type': 'graphsage', 'hidden_dims': '[512, 128]', 'dropout': 0.5598336097328502, 'batch_norm': True, 'sage_aggr': 'max', 'sage_normalize': True, 'sage_project': False, 'lr': 0.008889144248035613, 'weight_decay': 1.5665439257835563e-05, 'epochs': 172, 'loss': 'mse', 'optimizer': 'adam', 'graph_mode': 'cutoff', 'cutoff': 0.689979798344475, 'grm_norm': 'cosine_then_gcn', 'self_loops': True, 'use_snp_selection': False}. Best is trial 89 with value: 0.31323712514652646.
[I 2025-12-08 12:09:05,790] Trial 116 finished with value: 0.2914798415772437 and parameters: {'model_type': 'graphsage', 'hidden_dims': '[128, 64]', 'dropout': 0.5008332036679475, 'batch_norm': True, 'sage_aggr': 'max', 'sage_normalize': False, 'sage_project': False, 'lr': 0.007322612626295771, 'weight_decay': 5.773284413945946e-06, 'epochs': 262, 'loss': 'mse', 'optimizer': 'adam', 'graph_mode': 'cutoff', 'cutoff': 0.8330857818022315, 'grm_norm': 'none', 'self_loops': True, 'use_snp_selection': False}. Best is trial 89 with value: 0.31323712514652646.
[I 2025-12-08 12:10:01,082] Trial 117 finished with value: 0.2352749949055623 and parameters: {'model_type': 'graphsage', 'hidden_dims': '[256, 128]', 'dropout': 0.5235852408803441, 'batch_norm': False, 'sage_aggr': 'max', 'sage_normalize': True, 'sage_project': False, 'lr': 0.009921382294729178, 'weight_decay': 3.1132747284645906e-05, 'epochs': 160, 'loss': 'mse', 'optimizer': 'adam', 'graph_mode': 'cutoff', 'cutoff': 0.48407425535009657, 'grm_norm': 'gcn', 'self_loops': True, 'use_snp_selection': False}. Best is trial 89 with value: 0.31323712514652646.
[I 2025-12-08 12:10:38,824] Trial 118 finished with value: 0.30135729718832494 and parameters: {'model_type': 'graphsage', 'hidden_dims': '[512, 128]', 'dropout': 0.5348220888636719, 'batch_norm': True, 'sage_aggr': 'max', 'sage_normalize': False, 'sage_project': False, 'lr': 0.0044767263559681615, 'weight_decay': 5.539898283919581e-07, 'epochs': 66, 'loss': 'mae', 'optimizer': 'adam', 'graph_mode': 'cutoff', 'cutoff': 0.8705782150736368, 'grm_norm': 'gcn', 'self_loops': True, 'use_snp_selection': False}. Best is trial 89 with value: 0.31323712514652646.
[I 2025-12-08 12:11:36,321] Trial 119 finished with value: 0.30130168927075623 and parameters: {'model_type': 'graphsage', 'hidden_dims': '[512, 128]', 'dropout': 0.5468999247459917, 'batch_norm': True, 'sage_aggr': 'max', 'sage_normalize': True, 'sage_project': False, 'lr': 0.006036745158125987, 'weight_decay': 4.6718595621937196e-06, 'epochs': 140, 'loss': 'mse', 'optimizer': 'adam', 'graph_mode': 'cutoff', 'cutoff': 0.8979894233513857, 'grm_norm': 'gcn', 'self_loops': False, 'use_snp_selection': True, 'num_snps': 26505}. Best is trial 89 with value: 0.31323712514652646.
[I 2025-12-08 12:11:51,491] Trial 120 finished with value: 0.29513004096373724 and parameters: {'model_type': 'graphsage', 'hidden_dims': '[128, 64]', 'dropout': 0.5650797824707554, 'batch_norm': True, 'sage_aggr': 'max', 'sage_normalize': False, 'sage_project': False, 'lr': 0.005216710035617375, 'weight_decay': 7.004428312599679e-07, 'epochs': 44, 'loss': 'mse', 'optimizer': 'adam', 'graph_mode': 'cutoff', 'cutoff': 0.648415561037259, 'grm_norm': 'gcn', 'self_loops': True, 'use_snp_selection': False}. Best is trial 89 with value: 0.31323712514652646.
[I 2025-12-08 12:12:11,888] Trial 121 finished with value: 0.299430847561681 and parameters: {'model_type': 'graphsage', 'hidden_dims': '[128, 64]', 'dropout': 0.536402801823175, 'batch_norm': True, 'sage_aggr': 'max', 'sage_normalize': True, 'sage_project': False, 'lr': 0.00675382572906577, 'weight_decay': 8.285937178883722e-06, 'epochs': 78, 'loss': 'mse', 'optimizer': 'adam', 'graph_mode': 'cutoff', 'cutoff': 0.7559717751601056, 'grm_norm': 'cosine_then_gcn', 'self_loops': True, 'use_snp_selection': False}. Best is trial 89 with value: 0.31323712514652646.
[I 2025-12-08 12:12:33,618] Trial 122 finished with value: 0.30054511765197256 and parameters: {'model_type': 'graphsage', 'hidden_dims': '[128, 64]', 'dropout': 0.5797068117426556, 'batch_norm': True, 'sage_aggr': 'max', 'sage_normalize': True, 'sage_project': False, 'lr': 0.00768707365807651, 'weight_decay': 1.0227701847186482e-05, 'epochs': 88, 'loss': 'mse', 'optimizer': 'adam', 'graph_mode': 'cutoff', 'cutoff': 0.7754086074640802, 'grm_norm': 'cosine_then_gcn', 'self_loops': True, 'use_snp_selection': False}. Best is trial 89 with value: 0.31323712514652646.
[I 2025-12-08 12:12:51,403] Trial 123 finished with value: 0.3015644937069641 and parameters: {'model_type': 'graphsage', 'hidden_dims': '[128, 64]', 'dropout': 0.47898404234286474, 'batch_norm': True, 'sage_aggr': 'max', 'sage_normalize': True, 'sage_project': False, 'lr': 0.00850545246897562, 'weight_decay': 7.538292314939616e-06, 'epochs': 58, 'loss': 'mse', 'optimizer': 'adam', 'graph_mode': 'cutoff', 'cutoff': 0.8153235615990828, 'grm_norm': 'cosine_then_gcn', 'self_loops': True, 'use_snp_selection': False}. Best is trial 89 with value: 0.31323712514652646.
[I 2025-12-08 12:13:14,548] Trial 124 finished with value: 0.3000296238090339 and parameters: {'model_type': 'graphsage', 'hidden_dims': '[128, 64]', 'dropout': 0.5020995447730364, 'batch_norm': True, 'sage_aggr': 'max', 'sage_normalize': True, 'sage_project': False, 'lr': 0.006677951967674557, 'weight_decay': 2.001922417524202e-05, 'epochs': 99, 'loss': 'mse', 'optimizer': 'adam', 'graph_mode': 'cutoff', 'cutoff': 0.7007426197183455, 'grm_norm': 'cosine_then_gcn', 'self_loops': True, 'use_snp_selection': False}. Best is trial 89 with value: 0.31323712514652646.
[I 2025-12-08 12:13:40,621] Trial 125 finished with value: 0.30194509784198303 and parameters: {'model_type': 'graphsage', 'hidden_dims': '[256, 128]', 'dropout': 0.46146707241493606, 'batch_norm': True, 'sage_aggr': 'max', 'sage_normalize': True, 'sage_project': False, 'lr': 0.005681186851951011, 'weight_decay': 1.1001441328489507e-05, 'epochs': 70, 'loss': 'mse', 'optimizer': 'adam', 'graph_mode': 'cutoff', 'cutoff': 0.7237930810692441, 'grm_norm': 'cosine_then_gcn', 'self_loops': True, 'use_snp_selection': False}. Best is trial 89 with value: 0.31323712514652646.
[I 2025-12-08 12:14:13,073] Trial 126 finished with value: 0.30753144637201657 and parameters: {'model_type': 'graphsage', 'hidden_dims': '[512, 128]', 'dropout': 0.5494695565168117, 'batch_norm': True, 'sage_aggr': 'mean', 'sage_normalize': True, 'sage_project': False, 'lr': 0.008618925383249494, 'weight_decay': 2.3189574669850275e-05, 'epochs': 52, 'loss': 'mae', 'optimizer': 'adam', 'graph_mode': 'cutoff', 'cutoff': 0.792035359123966, 'grm_norm': 'gcn', 'self_loops': True, 'use_snp_selection': False}. Best is trial 89 with value: 0.31323712514652646.
[I 2025-12-08 12:15:01,934] Trial 127 finished with value: 0.3060392235158228 and parameters: {'model_type': 'graphsage', 'hidden_dims': '[512, 128]', 'dropout': 0.5886883606113477, 'batch_norm': True, 'sage_aggr': 'mean', 'sage_normalize': False, 'sage_project': False, 'lr': 0.009889505320686793, 'weight_decay': 2.2848612208253173e-05, 'epochs': 53, 'loss': 'mae', 'optimizer': 'adam', 'graph_mode': 'cutoff', 'cutoff': 0.7931087953273788, 'grm_norm': 'gcn', 'self_loops': False, 'use_snp_selection': True, 'num_snps': 36017}. Best is trial 89 with value: 0.31323712514652646.
[I 2025-12-08 12:15:38,266] Trial 128 finished with value: 0.30855250068840084 and parameters: {'model_type': 'graphsage', 'hidden_dims': '[512, 128]', 'dropout': 0.5507184485536737, 'batch_norm': True, 'sage_aggr': 'mean', 'sage_normalize': True, 'sage_project': False, 'lr': 0.008415659197425195, 'weight_decay': 3.3870144717302906e-05, 'epochs': 62, 'loss': 'mae', 'optimizer': 'adam', 'graph_mode': 'cutoff', 'cutoff': 0.8583115850444234, 'grm_norm': 'gcn', 'self_loops': True, 'use_snp_selection': False}. Best is trial 89 with value: 0.31323712514652646.
[I 2025-12-08 12:16:15,059] Trial 129 finished with value: 0.3067749493164567 and parameters: {'model_type': 'graphsage', 'hidden_dims': '[512, 128]', 'dropout': 0.5504147819128844, 'batch_norm': True, 'sage_aggr': 'mean', 'sage_normalize': True, 'sage_project': False, 'lr': 0.00850269919864793, 'weight_decay': 3.53722057384015e-05, 'epochs': 63, 'loss': 'mae', 'optimizer': 'adam', 'graph_mode': 'cutoff', 'cutoff': 0.8807986639602785, 'grm_norm': 'gcn', 'self_loops': True, 'use_snp_selection': False}. Best is trial 89 with value: 0.31323712514652646.
[I 2025-12-08 12:16:51,428] Trial 130 finished with value: 0.3073001307830111 and parameters: {'model_type': 'graphsage', 'hidden_dims': '[512, 128]', 'dropout': 0.5131176007539159, 'batch_norm': True, 'sage_aggr': 'mean', 'sage_normalize': True, 'sage_project': False, 'lr': 0.008514109888301043, 'weight_decay': 3.741580999292319e-05, 'epochs': 62, 'loss': 'mae', 'optimizer': 'adam', 'graph_mode': 'cutoff', 'cutoff': 0.8603588834742792, 'grm_norm': 'gcn', 'self_loops': True, 'use_snp_selection': False}. Best is trial 89 with value: 0.31323712514652646.
[I 2025-12-08 12:17:21,584] Trial 131 finished with value: 0.2988693331027813 and parameters: {'model_type': 'graphsage', 'hidden_dims': '[512, 128]', 'dropout': 0.5162259175303934, 'batch_norm': True, 'sage_aggr': 'mean', 'sage_normalize': True, 'sage_project': False, 'lr': 0.008696151422181823, 'weight_decay': 4.444348296615506e-05, 'epochs': 46, 'loss': 'mae', 'optimizer': 'adam', 'graph_mode': 'cutoff', 'cutoff': 0.8592228833307497, 'grm_norm': 'gcn', 'self_loops': True, 'use_snp_selection': False}. Best is trial 89 with value: 0.31323712514652646.
[I 2025-12-08 12:17:57,974] Trial 132 finished with value: 0.30923250986252054 and parameters: {'model_type': 'graphsage', 'hidden_dims': '[512, 128]', 'dropout': 0.5464837799374466, 'batch_norm': True, 'sage_aggr': 'mean', 'sage_normalize': True, 'sage_project': False, 'lr': 0.008409491978675018, 'weight_decay': 5.6794440528430966e-05, 'epochs': 62, 'loss': 'mae', 'optimizer': 'adam', 'graph_mode': 'cutoff', 'cutoff': 0.8773633053740969, 'grm_norm': 'gcn', 'self_loops': True, 'use_snp_selection': False}. Best is trial 89 with value: 0.31323712514652646.
[I 2025-12-08 12:18:33,588] Trial 133 finished with value: 0.3054097714745961 and parameters: {'model_type': 'graphsage', 'hidden_dims': '[512, 128]', 'dropout': 0.4935394544461992, 'batch_norm': True, 'sage_aggr': 'mean', 'sage_normalize': True, 'sage_project': False, 'lr': 0.007486046757436275, 'weight_decay': 3.885203758679067e-05, 'epochs': 60, 'loss': 'mae', 'optimizer': 'adam', 'graph_mode': 'cutoff', 'cutoff': 0.8436997519303675, 'grm_norm': 'gcn', 'self_loops': True, 'use_snp_selection': False}. Best is trial 89 with value: 0.31323712514652646.
[I 2025-12-08 12:19:06,177] Trial 134 finished with value: 0.30023295427081964 and parameters: {'model_type': 'graphsage', 'hidden_dims': '[512, 128]', 'dropout': 0.5493225086360249, 'batch_norm': True, 'sage_aggr': 'mean', 'sage_normalize': True, 'sage_project': False, 'lr': 0.006338922774515017, 'weight_decay': 5.875996693120899e-05, 'epochs': 52, 'loss': 'mae', 'optimizer': 'adam', 'graph_mode': 'cutoff', 'cutoff': 0.8749662387761706, 'grm_norm': 'gcn', 'self_loops': True, 'use_snp_selection': False}. Best is trial 89 with value: 0.31323712514652646.
[I 2025-12-08 12:19:42,972] Trial 135 finished with value: 0.2998851410127232 and parameters: {'model_type': 'graphsage', 'hidden_dims': '[512, 128]', 'dropout': 0.5322923336878577, 'batch_norm': True, 'sage_aggr': 'mean', 'sage_normalize': True, 'sage_project': False, 'lr': 0.009644629805273091, 'weight_decay': 8.697824835270866e-05, 'epochs': 63, 'loss': 'mae', 'optimizer': 'adam', 'graph_mode': 'cutoff', 'cutoff': 0.8256754830030067, 'grm_norm': 'gcn', 'self_loops': True, 'use_snp_selection': False}. Best is trial 89 with value: 0.31323712514652646.
[I 2025-12-08 12:20:20,169] Trial 136 finished with value: 0.30970937572011203 and parameters: {'model_type': 'graphsage', 'hidden_dims': '[512, 128]', 'dropout': 0.5149815771556674, 'batch_norm': True, 'sage_aggr': 'mean', 'sage_normalize': True, 'sage_project': False, 'lr': 0.008016158759713161, 'weight_decay': 3.2502694887074255e-05, 'epochs': 64, 'loss': 'mae', 'optimizer': 'adam', 'graph_mode': 'cutoff', 'cutoff': 0.862298142297606, 'grm_norm': 'gcn', 'self_loops': True, 'use_snp_selection': False}. Best is trial 89 with value: 0.31323712514652646.
[I 2025-12-08 12:20:59,302] Trial 137 finished with value: 0.3079333978126476 and parameters: {'model_type': 'graphsage', 'hidden_dims': '[512, 128]', 'dropout': 0.5204566863757009, 'batch_norm': True, 'sage_aggr': 'mean', 'sage_normalize': True, 'sage_project': False, 'lr': 0.007788260569596687, 'weight_decay': 3.189476527567908e-05, 'epochs': 69, 'loss': 'mae', 'optimizer': 'adam', 'graph_mode': 'cutoff', 'cutoff': 0.8513500667600739, 'grm_norm': 'gcn', 'self_loops': True, 'use_snp_selection': False}. Best is trial 89 with value: 0.31323712514652646.
[I 2025-12-08 12:21:38,804] Trial 138 finished with value: 0.2964824239305515 and parameters: {'model_type': 'graphsage', 'hidden_dims': '[512, 128]', 'dropout': 0.5097261566356766, 'batch_norm': True, 'sage_aggr': 'mean', 'sage_normalize': True, 'sage_project': False, 'lr': 0.007653501065983532, 'weight_decay': 4.911498107204011e-05, 'epochs': 70, 'loss': 'mae', 'optimizer': 'adam', 'graph_mode': 'cutoff', 'cutoff': 0.8512869239287074, 'grm_norm': 'gcn', 'self_loops': True, 'use_snp_selection': False}. Best is trial 89 with value: 0.31323712514652646.
[I 2025-12-08 12:22:23,077] Trial 139 finished with value: 0.3059468853021327 and parameters: {'model_type': 'graphsage', 'hidden_dims': '[512, 128]', 'dropout': 0.49479179998388034, 'batch_norm': True, 'sage_aggr': 'mean', 'sage_normalize': True, 'sage_project': False, 'lr': 0.005245764312373469, 'weight_decay': 2.8650249694219594e-05, 'epochs': 82, 'loss': 'mae', 'optimizer': 'adam', 'graph_mode': 'cutoff', 'cutoff': 0.8361736285642932, 'grm_norm': 'gcn', 'self_loops': True, 'use_snp_selection': False}. Best is trial 89 with value: 0.31323712514652646.
[I 2025-12-08 12:22:57,084] Trial 140 finished with value: 0.23372523485989355 and parameters: {'model_type': 'graphsage', 'hidden_dims': '[512, 128]', 'dropout': 0.5250993878639268, 'batch_norm': False, 'sage_aggr': 'mean', 'sage_normalize': True, 'sage_project': False, 'lr': 0.006417176768753667, 'weight_decay': 7.676659167613066e-05, 'epochs': 56, 'loss': 'mae', 'optimizer': 'adam', 'graph_mode': 'cutoff', 'cutoff': 0.865242557027761, 'grm_norm': 'gcn', 'self_loops': True, 'use_snp_selection': False}. Best is trial 89 with value: 0.31323712514652646.
[I 2025-12-08 12:23:34,691] Trial 141 finished with value: 0.3044860294903601 and parameters: {'model_type': 'graphsage', 'hidden_dims': '[512, 128]', 'dropout': 0.5181669178502958, 'batch_norm': True, 'sage_aggr': 'mean', 'sage_normalize': True, 'sage_project': False, 'lr': 0.009859025836464178, 'weight_decay': 3.062485549682352e-05, 'epochs': 65, 'loss': 'mae', 'optimizer': 'adam', 'graph_mode': 'cutoff', 'cutoff': 0.8803273007302026, 'grm_norm': 'gcn', 'self_loops': True, 'use_snp_selection': False}. Best is trial 89 with value: 0.31323712514652646.
[I 2025-12-08 12:24:13,861] Trial 142 finished with value: 0.30053839591347065 and parameters: {'model_type': 'graphsage', 'hidden_dims': '[512, 128]', 'dropout': 0.4473752245882058, 'batch_norm': True, 'sage_aggr': 'mean', 'sage_normalize': True, 'sage_project': False, 'lr': 0.008316019787975972, 'weight_decay': 3.403295298472855e-05, 'epochs': 69, 'loss': 'mae', 'optimizer': 'adam', 'graph_mode': 'cutoff', 'cutoff': 0.8067168020037722, 'grm_norm': 'gcn', 'self_loops': True, 'use_snp_selection': False}. Best is trial 89 with value: 0.31323712514652646.
[I 2025-12-08 12:24:49,959] Trial 143 finished with value: 0.3057548952075444 and parameters: {'model_type': 'graphsage', 'hidden_dims': '[512, 128]', 'dropout': 0.5089398096207894, 'batch_norm': True, 'sage_aggr': 'mean', 'sage_normalize': True, 'sage_project': False, 'lr': 0.008379054632448556, 'weight_decay': 3.767316431583623e-05, 'epochs': 61, 'loss': 'mae', 'optimizer': 'adam', 'graph_mode': 'cutoff', 'cutoff': 0.857317954278521, 'grm_norm': 'gcn', 'self_loops': True, 'use_snp_selection': False}. Best is trial 89 with value: 0.31323712514652646.
[I 2025-12-08 12:25:22,511] Trial 144 finished with value: 0.3092329041278511 and parameters: {'model_type': 'graphsage', 'hidden_dims': '[512, 128]', 'dropout': 0.5442892706446152, 'batch_norm': True, 'sage_aggr': 'mean', 'sage_normalize': True, 'sage_project': False, 'lr': 0.006944606739192435, 'weight_decay': 6.226693945645413e-05, 'epochs': 52, 'loss': 'mae', 'optimizer': 'adam', 'graph_mode': 'cutoff', 'cutoff': 0.8260587651300751, 'grm_norm': 'gcn', 'self_loops': True, 'use_snp_selection': False}. Best is trial 89 with value: 0.31323712514652646.
[I 2025-12-08 12:25:54,288] Trial 145 finished with value: 0.3085981026638428 and parameters: {'model_type': 'graphsage', 'hidden_dims': '[512, 128]', 'dropout': 0.5265697582711256, 'batch_norm': True, 'sage_aggr': 'mean', 'sage_normalize': True, 'sage_project': False, 'lr': 0.006922896349494988, 'weight_decay': 6.249610475971022e-05, 'epochs': 50, 'loss': 'mae', 'optimizer': 'adam', 'graph_mode': 'cutoff', 'cutoff': 0.8183574010209804, 'grm_norm': 'gcn', 'self_loops': True, 'use_snp_selection': False}. Best is trial 89 with value: 0.31323712514652646.
[I 2025-12-08 12:26:25,815] Trial 146 finished with value: 0.30191690930209336 and parameters: {'model_type': 'graphsage', 'hidden_dims': '[512, 128]', 'dropout': 0.47991317604514583, 'batch_norm': True, 'sage_aggr': 'mean', 'sage_normalize': True, 'sage_project': False, 'lr': 0.006911394821539235, 'weight_decay': 0.00010845432232169778, 'epochs': 49, 'loss': 'mae', 'optimizer': 'adam', 'graph_mode': 'cutoff', 'cutoff': 0.8254673828668015, 'grm_norm': 'gcn', 'self_loops': True, 'use_snp_selection': False}. Best is trial 89 with value: 0.31323712514652646.
[I 2025-12-08 12:26:58,014] Trial 147 finished with value: 0.30379272595490925 and parameters: {'model_type': 'graphsage', 'hidden_dims': '[512, 128]', 'dropout': 0.5406539652748186, 'batch_norm': True, 'sage_aggr': 'mean', 'sage_normalize': True, 'sage_project': False, 'lr': 0.005585120317022078, 'weight_decay': 6.0906741555838724e-05, 'epochs': 50, 'loss': 'mae', 'optimizer': 'adam', 'graph_mode': 'cutoff', 'cutoff': 0.8114182618473633, 'grm_norm': 'none', 'self_loops': True, 'use_snp_selection': False}. Best is trial 89 with value: 0.31323712514652646.
[I 2025-12-08 12:27:26,871] Trial 148 finished with value: 0.30196064769118375 and parameters: {'model_type': 'graphsage', 'hidden_dims': '[512, 128]', 'dropout': 0.5224805378181098, 'batch_norm': True, 'sage_aggr': 'mean', 'sage_normalize': True, 'sage_project': False, 'lr': 0.0045237006046124975, 'weight_decay': 0.00015093386465997574, 'epochs': 42, 'loss': 'mae', 'optimizer': 'adam', 'graph_mode': 'cutoff', 'cutoff': 0.7851259660056618, 'grm_norm': 'gcn', 'self_loops': True, 'use_snp_selection': False}. Best is trial 89 with value: 0.31323712514652646.
[I 2025-12-08 12:28:11,029] Trial 149 finished with value: 0.30681430728964565 and parameters: {'model_type': 'graphsage', 'hidden_dims': '[512, 64]', 'dropout': 0.49854547685257666, 'batch_norm': True, 'sage_aggr': 'mean', 'sage_normalize': True, 'sage_project': False, 'lr': 0.005985335085979183, 'weight_decay': 7.18886605886817e-05, 'epochs': 55, 'loss': 'mae', 'optimizer': 'adam', 'graph_mode': 'knn', 'knn_k': 9, 'weighted_edges': False, 'symmetrize_mode': 'mutual', 'self_loops': True, 'use_snp_selection': False}. Best is trial 89 with value: 0.31323712514652646.
[I 2025-12-08 12:29:31,565] Trial 0 finished with value: 0.28032452892339965 and parameters: {'model_type': 'graphsage', 'hidden_dims': '[128, 64]', 'dropout': 0.199031432379812, 'batch_norm': True, 'sage_aggr': 'max', 'sage_normalize': True, 'sage_project': False, 'lr': 0.00034401453323286885, 'weight_decay': 0.00017802616915745114, 'epochs': 230, 'loss': 'mse', 'optimizer': 'adam', 'graph_mode': 'knn', 'knn_k': 6, 'weighted_edges': True, 'symmetrize_mode': 'mutual', 'self_loops': True, 'use_snp_selection': False}. Best is trial 0 with value: 0.28032452892339965.
[I 2025-12-08 12:31:11,485] Trial 1 finished with value: 0.2846831616520656 and parameters: {'model_type': 'graphsage', 'hidden_dims': '[512, 128]', 'dropout': 0.2503500283181017, 'batch_norm': False, 'sage_aggr': 'max', 'sage_normalize': False, 'sage_project': False, 'lr': 3.952233718592099e-05, 'weight_decay': 0.00026754769258252603, 'epochs': 149, 'loss': 'mse', 'optimizer': 'adam', 'graph_mode': 'knn', 'knn_k': 2, 'weighted_edges': False, 'symmetrize_mode': 'mutual', 'self_loops': True, 'use_snp_selection': True, 'num_snps': 49915}. Best is trial 1 with value: 0.2846831616520656.
[I 2025-12-08 12:32:28,755] Trial 2 finished with value: 0.30264154856590786 and parameters: {'model_type': 'graphsage', 'hidden_dims': '[512, 256]', 'dropout': 0.2785908793172681, 'batch_norm': False, 'sage_aggr': 'max', 'sage_normalize': False, 'sage_project': False, 'lr': 8.806039223165805e-05, 'weight_decay': 3.5153176302760294e-05, 'epochs': 147, 'loss': 'mae', 'optimizer': 'adam', 'graph_mode': 'cutoff', 'cutoff': 0.4922564006874869, 'grm_norm': 'gcn', 'self_loops': False, 'use_snp_selection': True, 'num_snps': 34340}. Best is trial 2 with value: 0.30264154856590786.
