[I 2025-12-09 01:12:36,816] Trial 41 finished with value: 0.29954461453902426 and parameters: {'model_type': 'graphsage', 'hidden_dims': '[256, 128]', 'dropout': 0.40239317077146264, 'batch_norm': False, 'sage_aggr': 'mean', 'sage_normalize': True, 'sage_project': False, 'lr': 0.0017342799964383895, 'weight_decay': 1.856943015367387e-05, 'epochs': 329, 'loss': 'mse', 'optimizer': 'adam', 'graph_mode': 'cutoff', 'cutoff': 0.36584018949625946, 'grm_norm': 'cosine_then_gcn', 'self_loops': True, 'use_snp_selection': False}. Best is trial 22 with value: 0.3041329662341845.
[I 2025-12-09 01:14:52,615] Trial 42 finished with value: 0.2927322786639032 and parameters: {'model_type': 'graphsage', 'hidden_dims': '[256, 128]', 'dropout': 0.4529799605467938, 'batch_norm': False, 'sage_aggr': 'mean', 'sage_normalize': True, 'sage_project': False, 'lr': 0.0016491283930479526, 'weight_decay': 5.232261856879188e-05, 'epochs': 331, 'loss': 'mse', 'optimizer': 'adam', 'graph_mode': 'cutoff', 'cutoff': 0.35769935275393033, 'grm_norm': 'cosine_then_gcn', 'self_loops': True, 'use_snp_selection': False}. Best is trial 22 with value: 0.3041329662341845.
[I 2025-12-09 01:17:00,795] Trial 43 finished with value: 0.2917318750273272 and parameters: {'model_type': 'graphsage', 'hidden_dims': '[256, 128]', 'dropout': 0.22287373264375274, 'batch_norm': False, 'sage_aggr': 'mean', 'sage_normalize': True, 'sage_project': False, 'lr': 0.0005147194009430245, 'weight_decay': 2.812345631438631e-05, 'epochs': 349, 'loss': 'mse', 'optimizer': 'adam', 'graph_mode': 'cutoff', 'cutoff': 0.48781206875069494, 'grm_norm': 'cosine_then_gcn', 'self_loops': True, 'use_snp_selection': False}. Best is trial 22 with value: 0.3041329662341845.
[I 2025-12-09 01:17:22,705] Trial 44 finished with value: 0.2487741754903218 and parameters: {'model_type': 'graphsage', 'hidden_dims': '[256, 128]', 'dropout': 0.4061218132456962, 'batch_norm': False, 'sage_aggr': 'mean', 'sage_normalize': True, 'sage_project': False, 'lr': 0.001374400928125982, 'weight_decay': 8.38087902294789e-06, 'epochs': 46, 'loss': 'mse', 'optimizer': 'adam', 'graph_mode': 'cutoff', 'cutoff': 0.37804507727809866, 'grm_norm': 'none', 'self_loops': True, 'use_snp_selection': False}. Best is trial 22 with value: 0.3041329662341845.
[I 2025-12-09 01:20:57,934] Trial 45 finished with value: 0.2941034047300567 and parameters: {'model_type': 'graphsage', 'hidden_dims': '[256, 128]', 'dropout': 0.3149631950274558, 'batch_norm': False, 'sage_aggr': 'mean', 'sage_normalize': True, 'sage_project': False, 'lr': 0.00038657546366970393, 'weight_decay': 1.6293636220118726e-06, 'epochs': 331, 'loss': 'mse', 'optimizer': 'adam', 'graph_mode': 'cutoff', 'cutoff': 0.25283660729455437, 'grm_norm': 'cosine_then_gcn', 'self_loops': True, 'use_snp_selection': True, 'num_snps': 34750}. Best is trial 22 with value: 0.3041329662341845.
[I 2025-12-09 01:21:46,811] Trial 46 finished with value: 0.24917989912254673 and parameters: {'model_type': 'graphsage', 'hidden_dims': '[256, 128, 64]', 'dropout': 0.35787021514566153, 'batch_norm': False, 'sage_aggr': 'max', 'sage_normalize': True, 'sage_project': False, 'lr': 0.002130244727933415, 'weight_decay': 0.00011534375347222604, 'epochs': 165, 'loss': 'mse', 'optimizer': 'adam', 'graph_mode': 'cutoff', 'cutoff': 0.6840618573092501, 'grm_norm': 'none', 'self_loops': False, 'use_snp_selection': False}. Best is trial 22 with value: 0.3041329662341845.
[I 2025-12-09 01:25:51,105] Trial 47 finished with value: 0.3021263933989284 and parameters: {'model_type': 'graphsage', 'hidden_dims': '[512, 256]', 'dropout': 0.4982661744288287, 'batch_norm': False, 'sage_aggr': 'mean', 'sage_normalize': True, 'sage_project': False, 'lr': 0.00091657068375572, 'weight_decay': 1.640543001809428e-05, 'epochs': 312, 'loss': 'mse', 'optimizer': 'adam', 'graph_mode': 'cutoff', 'cutoff': 0.30177588253468046, 'grm_norm': 'cosine_then_gcn', 'self_loops': True, 'use_snp_selection': False}. Best is trial 22 with value: 0.3041329662341845.
[I 2025-12-09 01:29:54,568] Trial 48 finished with value: 0.28931089365989726 and parameters: {'model_type': 'graphsage', 'hidden_dims': '[512, 256]', 'dropout': 0.5451992134624001, 'batch_norm': True, 'sage_aggr': 'mean', 'sage_normalize': True, 'sage_project': False, 'lr': 0.000837528569562993, 'weight_decay': 4.6853111815185795e-06, 'epochs': 314, 'loss': 'mse', 'optimizer': 'adam', 'graph_mode': 'knn', 'knn_k': 4, 'weighted_edges': False, 'symmetrize_mode': 'union', 'self_loops': True, 'use_snp_selection': False}. Best is trial 22 with value: 0.3041329662341845.
[I 2025-12-09 01:33:47,002] Trial 49 finished with value: 0.2946253297567897 and parameters: {'model_type': 'graphsage', 'hidden_dims': '[512, 256]', 'dropout': 0.4935913641158174, 'batch_norm': False, 'sage_aggr': 'mean', 'sage_normalize': True, 'sage_project': False, 'lr': 0.0005979279072034861, 'weight_decay': 4.030267147090066e-05, 'epochs': 289, 'loss': 'mae', 'optimizer': 'adam', 'graph_mode': 'cutoff', 'cutoff': 0.3092653744015503, 'grm_norm': 'cosine_then_gcn', 'self_loops': True, 'use_snp_selection': True, 'num_snps': 43660}. Best is trial 22 with value: 0.3041329662341845.
[I 2025-12-09 01:38:47,415] Trial 50 finished with value: 0.2954343715661833 and parameters: {'model_type': 'graphsage', 'hidden_dims': '[512, 256]', 'dropout': 0.5936650220283303, 'batch_norm': False, 'sage_aggr': 'mean', 'sage_normalize': True, 'sage_project': False, 'lr': 0.00029676436855819756, 'weight_decay': 8.974849727219066e-05, 'epochs': 306, 'loss': 'mse', 'optimizer': 'adam', 'graph_mode': 'cutoff', 'cutoff': 0.23991135324419005, 'grm_norm': 'cosine_then_gcn', 'self_loops': True, 'use_snp_selection': False}. Best is trial 22 with value: 0.3041329662341845.
[I 2025-12-09 01:42:30,326] Trial 51 finished with value: 0.30226558861761593 and parameters: {'model_type': 'graphsage', 'hidden_dims': '[512, 128]', 'dropout': 0.4409762317363211, 'batch_norm': False, 'sage_aggr': 'mean', 'sage_normalize': True, 'sage_project': False, 'lr': 0.001308492289845285, 'weight_decay': 1.9586624754052374e-05, 'epochs': 336, 'loss': 'mse', 'optimizer': 'adam', 'graph_mode': 'cutoff', 'cutoff': 0.34057086833326244, 'grm_norm': 'cosine_then_gcn', 'self_loops': True, 'use_snp_selection': False}. Best is trial 22 with value: 0.3041329662341845.
[I 2025-12-09 01:47:02,252] Trial 52 finished with value: 0.268497243955647 and parameters: {'model_type': 'graphsage', 'hidden_dims': '[512, 128]', 'dropout': 0.5211154183921934, 'batch_norm': False, 'sage_aggr': 'mean', 'sage_normalize': True, 'sage_project': False, 'lr': 2.7151648386107264e-05, 'weight_decay': 5.126633357281915e-05, 'epochs': 335, 'loss': 'mse', 'optimizer': 'adam', 'graph_mode': 'cutoff', 'cutoff': 0.28901574533689545, 'grm_norm': 'cosine_then_gcn', 'self_loops': True, 'use_snp_selection': False}. Best is trial 22 with value: 0.3041329662341845.
[I 2025-12-09 01:52:56,842] Trial 53 finished with value: 0.23455112418182625 and parameters: {'model_type': 'graphsage', 'hidden_dims': '[512, 128]', 'dropout': 0.49099179220154854, 'batch_norm': False, 'sage_aggr': 'mean', 'sage_normalize': True, 'sage_project': False, 'lr': 0.0036936914088145684, 'weight_decay': 1.583732980810277e-05, 'epochs': 315, 'loss': 'mse', 'optimizer': 'adam', 'graph_mode': 'cutoff', 'cutoff': 0.20818357622762035, 'grm_norm': 'cosine_then_gcn', 'self_loops': True, 'use_snp_selection': False}. Best is trial 22 with value: 0.3041329662341845.
[I 2025-12-09 01:56:51,287] Trial 54 finished with value: 0.29679290432657196 and parameters: {'model_type': 'graphsage', 'hidden_dims': '[512, 128]', 'dropout': 0.4434311819941914, 'batch_norm': False, 'sage_aggr': 'mean', 'sage_normalize': True, 'sage_project': False, 'lr': 0.0010873190966456086, 'weight_decay': 8.748070984270035e-06, 'epochs': 349, 'loss': 'mse', 'optimizer': 'adam', 'graph_mode': 'cutoff', 'cutoff': 0.3309625828914653, 'grm_norm': 'cosine_then_gcn', 'self_loops': True, 'use_snp_selection': False}. Best is trial 22 with value: 0.3041329662341845.
[I 2025-12-09 02:00:02,331] Trial 55 finished with value: 0.2955103796522368 and parameters: {'model_type': 'graphsage', 'hidden_dims': '[512, 128]', 'dropout': 0.4715609382619554, 'batch_norm': False, 'sage_aggr': 'mean', 'sage_normalize': True, 'sage_project': False, 'lr': 0.0013106014830184013, 'weight_decay': 2.6373935390196443e-06, 'epochs': 296, 'loss': 'mse', 'optimizer': 'adam', 'graph_mode': 'cutoff', 'cutoff': 0.4075769643278624, 'grm_norm': 'gcn', 'self_loops': True, 'use_snp_selection': False}. Best is trial 22 with value: 0.3041329662341845.
[I 2025-12-09 02:05:32,467] Trial 56 finished with value: 0.29671964525879624 and parameters: {'model_type': 'graphsage', 'hidden_dims': '[512, 256]', 'dropout': 0.43231758160711226, 'batch_norm': False, 'sage_aggr': 'mean', 'sage_normalize': True, 'sage_project': False, 'lr': 0.0023436155175761953, 'weight_decay': 2.4999030270158862e-05, 'epochs': 337, 'loss': 'mse', 'optimizer': 'adam', 'graph_mode': 'cutoff', 'cutoff': 0.23989316460784618, 'grm_norm': 'cosine_then_gcn', 'self_loops': False, 'use_snp_selection': False}. Best is trial 22 with value: 0.3041329662341845.
[I 2025-12-09 02:09:04,701] Trial 57 finished with value: 0.25881857384309015 and parameters: {'model_type': 'graphsage', 'hidden_dims': '[512, 64]', 'dropout': 0.5029349332699158, 'batch_norm': False, 'sage_aggr': 'mean', 'sage_normalize': True, 'sage_project': False, 'lr': 0.0008726765957987268, 'weight_decay': 0.00040101875836173734, 'epochs': 320, 'loss': 'mse', 'optimizer': 'adam', 'graph_mode': 'cutoff', 'cutoff': 0.34101972933226365, 'grm_norm': 'cosine_then_gcn', 'self_loops': True, 'use_snp_selection': False}. Best is trial 22 with value: 0.3041329662341845.
[I 2025-12-09 02:12:43,898] Trial 58 finished with value: 0.0 and parameters: {'model_type': 'graphsage', 'hidden_dims': '[512, 128]', 'dropout': 0.450185326565135, 'batch_norm': False, 'sage_aggr': 'mean', 'sage_normalize': False, 'sage_project': False, 'lr': 0.006100126380932649, 'weight_decay': 4.982178894777572e-06, 'epochs': 341, 'loss': 'mse', 'optimizer': 'adam', 'graph_mode': 'cutoff', 'cutoff': 0.3758541870467502, 'grm_norm': 'cosine', 'self_loops': True, 'use_snp_selection': False}. Best is trial 22 with value: 0.3041329662341845.
[I 2025-12-09 02:14:58,384] Trial 59 finished with value: 0.2796797048854457 and parameters: {'model_type': 'graphsage', 'hidden_dims': '[512, 256]', 'dropout': 0.4189261916592866, 'batch_norm': False, 'sage_aggr': 'max', 'sage_normalize': True, 'sage_project': False, 'lr': 0.0004658715166488463, 'weight_decay': 1.1688166119605258e-05, 'epochs': 197, 'loss': 'mse', 'optimizer': 'adam', 'graph_mode': 'cutoff', 'cutoff': 0.3990237269231576, 'grm_norm': 'cosine_then_gcn', 'self_loops': True, 'use_snp_selection': False}. Best is trial 22 with value: 0.3041329662341845.
[I 2025-12-09 02:16:43,576] Trial 60 finished with value: 0.2919755044240405 and parameters: {'model_type': 'graphsage', 'hidden_dims': '[256, 128]', 'dropout': 0.530639330465372, 'batch_norm': False, 'sage_aggr': 'mean', 'sage_normalize': True, 'sage_project': False, 'lr': 0.0006731071293887631, 'weight_decay': 3.593806600188168e-05, 'epochs': 273, 'loss': 'mse', 'optimizer': 'adam', 'graph_mode': 'cutoff', 'cutoff': 0.4543901402806836, 'grm_norm': 'cosine_then_gcn', 'self_loops': True, 'use_snp_selection': False}. Best is trial 22 with value: 0.3041329662341845.
[I 2025-12-09 02:19:41,058] Trial 61 finished with value: 0.30112478716090024 and parameters: {'model_type': 'graphsage', 'hidden_dims': '[256, 128]', 'dropout': 0.4028866834081403, 'batch_norm': False, 'sage_aggr': 'mean', 'sage_normalize': True, 'sage_project': False, 'lr': 0.0016034315661839472, 'weight_decay': 1.8964245425238438e-05, 'epochs': 326, 'loss': 'mse', 'optimizer': 'adam', 'graph_mode': 'cutoff', 'cutoff': 0.29882751786313766, 'grm_norm': 'cosine_then_gcn', 'self_loops': True, 'use_snp_selection': False}. Best is trial 22 with value: 0.3041329662341845.
[I 2025-12-09 02:22:19,728] Trial 62 finished with value: 0.30205628533383916 and parameters: {'model_type': 'graphsage', 'hidden_dims': '[256, 128]', 'dropout': 0.3932198784044528, 'batch_norm': False, 'sage_aggr': 'mean', 'sage_normalize': True, 'sage_project': False, 'lr': 0.001423007098459943, 'weight_decay': 1.8565102958371306e-05, 'epochs': 307, 'loss': 'mse', 'optimizer': 'adam', 'graph_mode': 'cutoff', 'cutoff': 0.3121112837249797, 'grm_norm': 'cosine_then_gcn', 'self_loops': True, 'use_snp_selection': False}. Best is trial 22 with value: 0.3041329662341845.
[I 2025-12-09 02:25:59,633] Trial 63 finished with value: 0.30419373614899614 and parameters: {'model_type': 'graphsage', 'hidden_dims': '[256, 128]', 'dropout': 0.38972063328478923, 'batch_norm': False, 'sage_aggr': 'mean', 'sage_normalize': True, 'sage_project': False, 'lr': 0.001862973882702476, 'weight_decay': 1.6286682715020604e-05, 'epochs': 323, 'loss': 'mse', 'optimizer': 'adam', 'graph_mode': 'cutoff', 'cutoff': 0.2545858882100077, 'grm_norm': 'cosine_then_gcn', 'self_loops': True, 'use_snp_selection': False}. Best is trial 63 with value: 0.30419373614899614.
[I 2025-12-09 02:30:16,441] Trial 64 finished with value: 0.30276342550481955 and parameters: {'model_type': 'graphsage', 'hidden_dims': '[256, 128]', 'dropout': 0.3776281785457686, 'batch_norm': False, 'sage_aggr': 'mean', 'sage_normalize': True, 'sage_project': False, 'lr': 0.0032550520519450407, 'weight_decay': 6.666301459208772e-06, 'epochs': 339, 'loss': 'mse', 'optimizer': 'adam', 'graph_mode': 'cutoff', 'cutoff': 0.2343168065341041, 'grm_norm': 'cosine_then_gcn', 'self_loops': True, 'use_snp_selection': False}. Best is trial 63 with value: 0.30419373614899614.
[I 2025-12-09 02:33:51,871] Trial 65 finished with value: 0.29410476553498677 and parameters: {'model_type': 'graphsage', 'hidden_dims': '[256, 128]', 'dropout': 0.33417307126087503, 'batch_norm': False, 'sage_aggr': 'mean', 'sage_normalize': True, 'sage_project': False, 'lr': 0.0033950771105673823, 'weight_decay': 6.039621055485359e-06, 'epochs': 293, 'loss': 'mse', 'optimizer': 'adam', 'graph_mode': 'cutoff', 'cutoff': 0.24015917485580265, 'grm_norm': 'cosine_then_gcn', 'self_loops': True, 'use_snp_selection': False}. Best is trial 63 with value: 0.30419373614899614.
[I 2025-12-09 02:38:03,728] Trial 66 finished with value: 0.2804158175229354 and parameters: {'model_type': 'graphsage', 'hidden_dims': '[128, 64]', 'dropout': 0.38728951001015177, 'batch_norm': False, 'sage_aggr': 'mean', 'sage_normalize': True, 'sage_project': False, 'lr': 0.0047297973664954165, 'weight_decay': 9.884483633370653e-06, 'epochs': 309, 'loss': 'mse', 'optimizer': 'adam', 'graph_mode': 'cutoff', 'cutoff': 0.20023141717680132, 'grm_norm': 'cosine', 'self_loops': True, 'use_snp_selection': False}. Best is trial 63 with value: 0.30419373614899614.
[I 2025-12-09 02:40:59,755] Trial 67 finished with value: 0.2976550344237395 and parameters: {'model_type': 'graphsage', 'hidden_dims': '[256, 128]', 'dropout': 0.29741714605799935, 'batch_norm': False, 'sage_aggr': 'mean', 'sage_normalize': True, 'sage_project': False, 'lr': 0.0028547057370502615, 'weight_decay': 3.228499964444905e-06, 'epochs': 252, 'loss': 'mse', 'optimizer': 'adam', 'graph_mode': 'cutoff', 'cutoff': 0.2612898918537793, 'grm_norm': 'none', 'self_loops': True, 'use_snp_selection': False}. Best is trial 63 with value: 0.30419373614899614.
[I 2025-12-09 02:44:35,469] Trial 68 finished with value: 0.2918094759657197 and parameters: {'model_type': 'graphsage', 'hidden_dims': '[512, 128]', 'dropout': 0.33509773645113533, 'batch_norm': True, 'sage_aggr': 'mean', 'sage_normalize': True, 'sage_project': False, 'lr': 0.009041595759205682, 'weight_decay': 1.451440980894722e-05, 'epochs': 338, 'loss': 'mae', 'optimizer': 'adam', 'graph_mode': 'knn', 'knn_k': 5, 'weighted_edges': True, 'symmetrize_mode': 'mutual', 'self_loops': True, 'use_snp_selection': False}. Best is trial 63 with value: 0.30419373614899614.
[I 2025-12-09 02:46:22,496] Trial 69 finished with value: 0.28916925449852393 and parameters: {'model_type': 'graphsage', 'hidden_dims': '[256, 128, 64]', 'dropout': 0.3665110379492294, 'batch_norm': False, 'sage_aggr': 'mean', 'sage_normalize': True, 'sage_project': False, 'lr': 0.002517319449886345, 'weight_decay': 1.3942157929913875e-06, 'epochs': 284, 'loss': 'mse', 'optimizer': 'adam', 'graph_mode': 'cutoff', 'cutoff': 0.21996811121621246, 'grm_norm': 'cosine_then_gcn', 'self_loops': False, 'use_snp_selection': True, 'num_snps': 19853}. Best is trial 63 with value: 0.30419373614899614.
[I 2025-12-09 02:49:37,007] Trial 70 finished with value: 0.3055510384016394 and parameters: {'model_type': 'graphsage', 'hidden_dims': '[256, 128]', 'dropout': 0.41891598729757984, 'batch_norm': False, 'sage_aggr': 'mean', 'sage_normalize': True, 'sage_project': False, 'lr': 0.0013922216605738948, 'weight_decay': 3.955063038925446e-06, 'epochs': 322, 'loss': 'mse', 'optimizer': 'adam', 'graph_mode': 'cutoff', 'cutoff': 0.2774101411280827, 'grm_norm': 'cosine_then_gcn', 'self_loops': True, 'use_snp_selection': False}. Best is trial 70 with value: 0.3055510384016394.
[I 2025-12-09 02:52:45,086] Trial 71 finished with value: 0.30223231214231144 and parameters: {'model_type': 'graphsage', 'hidden_dims': '[256, 128]', 'dropout': 0.42112301731568413, 'batch_norm': False, 'sage_aggr': 'mean', 'sage_normalize': True, 'sage_project': False, 'lr': 0.0013460937424336463, 'weight_decay': 3.4865173062728605e-06, 'epochs': 319, 'loss': 'mse', 'optimizer': 'adam', 'graph_mode': 'cutoff', 'cutoff': 0.2822205842034913, 'grm_norm': 'cosine_then_gcn', 'self_loops': True, 'use_snp_selection': False}. Best is trial 70 with value: 0.3055510384016394.
[I 2025-12-09 02:56:04,078] Trial 72 finished with value: 0.3070664354361066 and parameters: {'model_type': 'graphsage', 'hidden_dims': '[256, 128]', 'dropout': 0.3909563061098045, 'batch_norm': False, 'sage_aggr': 'mean', 'sage_normalize': True, 'sage_project': False, 'lr': 0.0013315330619263757, 'weight_decay': 2.3823123921398935e-06, 'epochs': 325, 'loss': 'mse', 'optimizer': 'adam', 'graph_mode': 'cutoff', 'cutoff': 0.2747266420289922, 'grm_norm': 'cosine_then_gcn', 'self_loops': True, 'use_snp_selection': False}. Best is trial 72 with value: 0.3070664354361066.
[I 2025-12-09 02:59:12,841] Trial 73 finished with value: 0.30310147960681133 and parameters: {'model_type': 'graphsage', 'hidden_dims': '[256, 128]', 'dropout': 0.41568082126237293, 'batch_norm': False, 'sage_aggr': 'mean', 'sage_normalize': True, 'sage_project': False, 'lr': 0.0018860893149304514, 'weight_decay': 9.238546592948867e-07, 'epochs': 324, 'loss': 'mse', 'optimizer': 'adam', 'graph_mode': 'cutoff', 'cutoff': 0.28426762520151455, 'grm_norm': 'cosine_then_gcn', 'self_loops': True, 'use_snp_selection': False}. Best is trial 72 with value: 0.3070664354361066.
[I 2025-12-09 03:02:30,823] Trial 74 finished with value: 0.29264055676350853 and parameters: {'model_type': 'graphsage', 'hidden_dims': '[256, 128]', 'dropout': 0.41656037428501475, 'batch_norm': False, 'sage_aggr': 'mean', 'sage_normalize': True, 'sage_project': False, 'lr': 0.004209122456523032, 'weight_decay': 4.5884711461116235e-07, 'epochs': 325, 'loss': 'mse', 'optimizer': 'adam', 'graph_mode': 'cutoff', 'cutoff': 0.2757187388918521, 'grm_norm': 'cosine_then_gcn', 'self_loops': True, 'use_snp_selection': False}. Best is trial 72 with value: 0.3070664354361066.
[I 2025-12-09 03:07:05,282] Trial 75 finished with value: 0.30183961338231924 and parameters: {'model_type': 'graphsage', 'hidden_dims': '[256, 128]', 'dropout': 0.37666234739439713, 'batch_norm': False, 'sage_aggr': 'mean', 'sage_normalize': True, 'sage_project': False, 'lr': 0.0020490881371220807, 'weight_decay': 8.654443141179451e-07, 'epochs': 341, 'loss': 'mse', 'optimizer': 'adam', 'graph_mode': 'cutoff', 'cutoff': 0.2238427601839975, 'grm_norm': 'cosine_then_gcn', 'self_loops': True, 'use_snp_selection': False}. Best is trial 72 with value: 0.3070664354361066.
[I 2025-12-09 03:10:46,654] Trial 76 finished with value: 0.025915502797166833 and parameters: {'model_type': 'graphsage', 'hidden_dims': '[256, 128]', 'dropout': 0.34933605868493106, 'batch_norm': False, 'sage_aggr': 'mean', 'sage_normalize': False, 'sage_project': False, 'lr': 0.0011375919725761605, 'weight_decay': 1.9956261920974454e-06, 'epochs': 349, 'loss': 'mse', 'optimizer': 'adam', 'graph_mode': 'cutoff', 'cutoff': 0.26711120096260854, 'grm_norm': 'cosine_then_gcn', 'self_loops': True, 'use_snp_selection': False}. Best is trial 72 with value: 0.3070664354361066.
[I 2025-12-09 03:15:16,627] Trial 77 finished with value: 0.28798771908363874 and parameters: {'model_type': 'graphsage', 'hidden_dims': '[256, 128]', 'dropout': 0.4274422812181936, 'batch_norm': False, 'sage_aggr': 'max', 'sage_normalize': True, 'sage_project': False, 'lr': 0.001817137458584048, 'weight_decay': 2.387676765759912e-06, 'epochs': 323, 'loss': 'mse', 'optimizer': 'adam', 'graph_mode': 'cutoff', 'cutoff': 0.23999921272802216, 'grm_norm': 'cosine_then_gcn', 'self_loops': True, 'use_snp_selection': False}. Best is trial 72 with value: 0.3070664354361066.
[I 2025-12-09 03:17:23,518] Trial 78 finished with value: 0.2766404772650563 and parameters: {'model_type': 'graphsage', 'hidden_dims': '[256, 128]', 'dropout': 0.40583278709946813, 'batch_norm': False, 'sage_aggr': 'mean', 'sage_normalize': True, 'sage_project': False, 'lr': 6.130763354439246e-05, 'weight_decay': 1.1951078358387544e-06, 'epochs': 301, 'loss': 'mse', 'optimizer': 'adam', 'graph_mode': 'cutoff', 'cutoff': 0.3419775796070744, 'grm_norm': 'cosine_then_gcn', 'self_loops': True, 'use_snp_selection': False}. Best is trial 72 with value: 0.3070664354361066.
