[I 2025-12-08 16:21:36,115] Trial 41 finished with value: 0.3034523341103411 and parameters: {'model_type': 'graphsage', 'hidden_dims': '[256, 128]', 'dropout': 0.45380549183946384, 'batch_norm': False, 'sage_aggr': 'mean', 'sage_normalize': True, 'sage_project': False, 'lr': 0.0030014158665733724, 'weight_decay': 1.4353487641912898e-05, 'epochs': 340, 'loss': 'mse', 'optimizer': 'adam', 'graph_mode': 'cutoff', 'cutoff': 0.44020083331390597, 'grm_norm': 'gcn', 'self_loops': False, 'use_snp_selection': False}. Best is trial 13 with value: 0.3123866227334652.
[I 2025-12-08 16:23:54,268] Trial 42 finished with value: 0.31000298113422103 and parameters: {'model_type': 'graphsage', 'hidden_dims': '[256, 128]', 'dropout': 0.48391517304742254, 'batch_norm': False, 'sage_aggr': 'mean', 'sage_normalize': True, 'sage_project': False, 'lr': 0.0017139711695286707, 'weight_decay': 1.4722911909150394e-05, 'epochs': 336, 'loss': 'mse', 'optimizer': 'adam', 'graph_mode': 'cutoff', 'cutoff': 0.3836184102472195, 'grm_norm': 'gcn', 'self_loops': False, 'use_snp_selection': False}. Best is trial 13 with value: 0.3123866227334652.
[I 2025-12-08 16:26:04,719] Trial 43 finished with value: 0.30352291545173643 and parameters: {'model_type': 'graphsage', 'hidden_dims': '[256, 128]', 'dropout': 0.5207635960422197, 'batch_norm': False, 'sage_aggr': 'mean', 'sage_normalize': True, 'sage_project': False, 'lr': 0.0016512193688523395, 'weight_decay': 5.021470571026313e-05, 'epochs': 314, 'loss': 'mse', 'optimizer': 'adam', 'graph_mode': 'cutoff', 'cutoff': 0.3766234458936046, 'grm_norm': 'gcn', 'self_loops': False, 'use_snp_selection': False}. Best is trial 13 with value: 0.3123866227334652.
[I 2025-12-08 16:29:16,464] Trial 44 finished with value: 0.30607699755522466 and parameters: {'model_type': 'graphsage', 'hidden_dims': '[512, 128]', 'dropout': 0.4860294554295053, 'batch_norm': False, 'sage_aggr': 'mean', 'sage_normalize': True, 'sage_project': False, 'lr': 0.0010153797542797472, 'weight_decay': 5.751018544536876e-06, 'epochs': 307, 'loss': 'mse', 'optimizer': 'adam', 'graph_mode': 'cutoff', 'cutoff': 0.48000377715897435, 'grm_norm': 'none', 'self_loops': False, 'use_snp_selection': False}. Best is trial 13 with value: 0.3123866227334652.
[I 2025-12-08 16:31:10,160] Trial 45 finished with value: 0.301380291348607 and parameters: {'model_type': 'graphsage', 'hidden_dims': '[512, 128]', 'dropout': 0.48192601724912504, 'batch_norm': False, 'sage_aggr': 'mean', 'sage_normalize': True, 'sage_project': False, 'lr': 0.006509372309308574, 'weight_decay': 1.5410602907896603e-06, 'epochs': 284, 'loss': 'mse', 'optimizer': 'adam', 'graph_mode': 'cutoff', 'cutoff': 0.5092670160357953, 'grm_norm': 'none', 'self_loops': False, 'use_snp_selection': True, 'num_snps': 34750}. Best is trial 13 with value: 0.3123866227334652.
[I 2025-12-08 16:34:59,499] Trial 46 finished with value: 0.2933738196021198 and parameters: {'model_type': 'graphsage', 'hidden_dims': '[512, 128]', 'dropout': 0.23787566344156802, 'batch_norm': False, 'sage_aggr': 'max', 'sage_normalize': True, 'sage_project': False, 'lr': 0.0010592724868489294, 'weight_decay': 5.422520567889971e-06, 'epochs': 350, 'loss': 'mse', 'optimizer': 'adam', 'graph_mode': 'cutoff', 'cutoff': 0.4737484416446754, 'grm_norm': 'none', 'self_loops': False, 'use_snp_selection': False}. Best is trial 13 with value: 0.3123866227334652.
[I 2025-12-08 16:38:36,083] Trial 47 finished with value: 0.262062672631387 and parameters: {'model_type': 'graphsage', 'hidden_dims': '[512, 128]', 'dropout': 0.4252518836366819, 'batch_norm': False, 'sage_aggr': 'mean', 'sage_normalize': True, 'sage_project': False, 'lr': 0.0023751462762839014, 'weight_decay': 1.0714959931752211e-05, 'epochs': 332, 'loss': 'mae', 'optimizer': 'adam', 'graph_mode': 'cutoff', 'cutoff': 0.3860531068806055, 'grm_norm': 'none', 'self_loops': True, 'use_snp_selection': False}. Best is trial 13 with value: 0.3123866227334652.
[I 2025-12-08 16:40:05,507] Trial 48 finished with value: 0.2923727707554885 and parameters: {'model_type': 'graphsage', 'hidden_dims': '[512, 256]', 'dropout': 0.5185955012782039, 'batch_norm': True, 'sage_aggr': 'mean', 'sage_normalize': True, 'sage_project': False, 'lr': 0.001612372040788702, 'weight_decay': 3.361412367829754e-06, 'epochs': 127, 'loss': 'mse', 'optimizer': 'adam', 'graph_mode': 'knn', 'knn_k': 4, 'weighted_edges': False, 'symmetrize_mode': 'union', 'self_loops': False, 'use_snp_selection': False}. Best is trial 13 with value: 0.3123866227334652.
[I 2025-12-08 16:43:07,542] Trial 49 finished with value: 0.0 and parameters: {'model_type': 'graphsage', 'hidden_dims': '[512, 128]', 'dropout': 0.3364148722270578, 'batch_norm': False, 'sage_aggr': 'mean', 'sage_normalize': False, 'sage_project': False, 'lr': 0.004203421860231097, 'weight_decay': 3.6299988509268543e-07, 'epochs': 162, 'loss': 'mse', 'optimizer': 'adam', 'graph_mode': 'cutoff', 'cutoff': 0.26418884729062647, 'grm_norm': 'none', 'self_loops': False, 'use_snp_selection': True, 'num_snps': 43660}. Best is trial 13 with value: 0.3123866227334652.
[I 2025-12-08 16:45:42,986] Trial 50 finished with value: 0.2871507400028501 and parameters: {'model_type': 'graphsage', 'hidden_dims': '[256, 128, 64]', 'dropout': 0.4034058169372454, 'batch_norm': False, 'sage_aggr': 'mean', 'sage_normalize': True, 'sage_project': False, 'lr': 0.0004971091578823137, 'weight_decay': 7.027249196928137e-06, 'epochs': 304, 'loss': 'mse', 'optimizer': 'adam', 'graph_mode': 'cutoff', 'cutoff': 0.3345367680388418, 'grm_norm': 'gcn', 'self_loops': False, 'use_snp_selection': False}. Best is trial 13 with value: 0.3123866227334652.
[I 2025-12-08 16:47:50,269] Trial 51 finished with value: 0.2995899456271994 and parameters: {'model_type': 'graphsage', 'hidden_dims': '[256, 128]', 'dropout': 0.49758589845876283, 'batch_norm': False, 'sage_aggr': 'mean', 'sage_normalize': True, 'sage_project': False, 'lr': 0.0006218375878674581, 'weight_decay': 2.644484686002349e-05, 'epochs': 315, 'loss': 'mse', 'optimizer': 'adam', 'graph_mode': 'cutoff', 'cutoff': 0.40617273218204675, 'grm_norm': 'none', 'self_loops': False, 'use_snp_selection': False}. Best is trial 13 with value: 0.3123866227334652.
[I 2025-12-08 16:48:10,952] Trial 52 finished with value: 0.24651015252752256 and parameters: {'model_type': 'graphsage', 'hidden_dims': '[256, 128]', 'dropout': 0.4582556629873449, 'batch_norm': False, 'sage_aggr': 'mean', 'sage_normalize': True, 'sage_project': False, 'lr': 0.0008713463237742278, 'weight_decay': 1.2502313530578985e-05, 'epochs': 45, 'loss': 'mse', 'optimizer': 'adam', 'graph_mode': 'cutoff', 'cutoff': 0.4522081017684659, 'grm_norm': 'gcn', 'self_loops': False, 'use_snp_selection': False}. Best is trial 13 with value: 0.3123866227334652.
[I 2025-12-08 16:51:06,832] Trial 53 finished with value: 0.296503851182174 and parameters: {'model_type': 'graphsage', 'hidden_dims': '[512, 64]', 'dropout': 0.5711393356743141, 'batch_norm': False, 'sage_aggr': 'mean', 'sage_normalize': True, 'sage_project': False, 'lr': 0.001296724252334447, 'weight_decay': 2.0313174313457068e-05, 'epochs': 322, 'loss': 'mse', 'optimizer': 'adam', 'graph_mode': 'cutoff', 'cutoff': 0.5368003331013127, 'grm_norm': 'cosine_then_gcn', 'self_loops': False, 'use_snp_selection': False}. Best is trial 13 with value: 0.3123866227334652.
[I 2025-12-08 16:52:47,749] Trial 54 finished with value: 0.2909888812124692 and parameters: {'model_type': 'graphsage', 'hidden_dims': '[256, 128]', 'dropout': 0.4922203734864511, 'batch_norm': False, 'sage_aggr': 'mean', 'sage_normalize': True, 'sage_project': False, 'lr': 0.0003896578791215808, 'weight_decay': 0.0004466557029203468, 'epochs': 340, 'loss': 'mse', 'optimizer': 'adam', 'graph_mode': 'cutoff', 'cutoff': 0.6004218455533403, 'grm_norm': 'gcn', 'self_loops': False, 'use_snp_selection': False}. Best is trial 13 with value: 0.3123866227334652.
[I 2025-12-08 16:54:42,431] Trial 55 finished with value: 0.2992003714690039 and parameters: {'model_type': 'graphsage', 'hidden_dims': '[256, 128]', 'dropout': 0.5937145750402077, 'batch_norm': False, 'sage_aggr': 'mean', 'sage_normalize': True, 'sage_project': False, 'lr': 0.001969914667964821, 'weight_decay': 4.2729890697275366e-06, 'epochs': 290, 'loss': 'mse', 'optimizer': 'adam', 'graph_mode': 'cutoff', 'cutoff': 0.4092990568847925, 'grm_norm': 'cosine_then_gcn', 'self_loops': False, 'use_snp_selection': False}. Best is trial 13 with value: 0.3123866227334652.
[I 2025-12-08 16:57:09,598] Trial 56 finished with value: 0.30417003945915927 and parameters: {'model_type': 'graphsage', 'hidden_dims': '[512, 128]', 'dropout': 0.43589787646034783, 'batch_norm': False, 'sage_aggr': 'mean', 'sage_normalize': True, 'sage_project': False, 'lr': 0.0065315945177172935, 'weight_decay': 2.0876713452242783e-06, 'epochs': 277, 'loss': 'mse', 'optimizer': 'adam', 'graph_mode': 'cutoff', 'cutoff': 0.6760444723440711, 'grm_norm': 'cosine', 'self_loops': False, 'use_snp_selection': False}. Best is trial 13 with value: 0.3123866227334652.
[I 2025-12-08 16:59:19,749] Trial 57 finished with value: 0.3042801672366199 and parameters: {'model_type': 'graphsage', 'hidden_dims': '[256, 128]', 'dropout': 0.5276066495466005, 'batch_norm': False, 'sage_aggr': 'mean', 'sage_normalize': True, 'sage_project': False, 'lr': 0.0024860283949893797, 'weight_decay': 7.0208849639694484e-06, 'epochs': 336, 'loss': 'mse', 'optimizer': 'adam', 'graph_mode': 'cutoff', 'cutoff': 0.4635527072901468, 'grm_norm': 'none', 'self_loops': False, 'use_snp_selection': False}. Best is trial 13 with value: 0.3123866227334652.
[I 2025-12-08 17:02:17,272] Trial 58 finished with value: 0.2897907311910699 and parameters: {'model_type': 'graphsage', 'hidden_dims': '[512, 256]', 'dropout': 0.5491974541570401, 'batch_norm': False, 'sage_aggr': 'mean', 'sage_normalize': True, 'sage_project': False, 'lr': 0.0012502555586287607, 'weight_decay': 3.5301374357599024e-05, 'epochs': 303, 'loss': 'mae', 'optimizer': 'adam', 'graph_mode': 'cutoff', 'cutoff': 0.5158464183718916, 'grm_norm': 'gcn', 'self_loops': True, 'use_snp_selection': False}. Best is trial 13 with value: 0.3123866227334652.
[I 2025-12-08 17:03:32,017] Trial 59 finished with value: 0.29516508798614777 and parameters: {'model_type': 'graphsage', 'hidden_dims': '[256, 128]', 'dropout': 0.46763161118321595, 'batch_norm': False, 'sage_aggr': 'max', 'sage_normalize': True, 'sage_project': False, 'lr': 0.00029301342832837945, 'weight_decay': 9.073596177312788e-06, 'epochs': 261, 'loss': 'mse', 'optimizer': 'adam', 'graph_mode': 'cutoff', 'cutoff': 0.7822050374379026, 'grm_norm': 'cosine', 'self_loops': False, 'use_snp_selection': False}. Best is trial 13 with value: 0.3123866227334652.
[I 2025-12-08 17:04:30,974] Trial 60 finished with value: 0.30094492614120216 and parameters: {'model_type': 'graphsage', 'hidden_dims': '[256, 128]', 'dropout': 0.29387849093866036, 'batch_norm': False, 'sage_aggr': 'mean', 'sage_normalize': True, 'sage_project': False, 'lr': 0.000854371946240166, 'weight_decay': 0.00010520487054042846, 'epochs': 195, 'loss': 'mse', 'optimizer': 'adam', 'graph_mode': 'cutoff', 'cutoff': 0.5714199678465908, 'grm_norm': 'cosine_then_gcn', 'self_loops': False, 'use_snp_selection': False}. Best is trial 13 with value: 0.3123866227334652.
[I 2025-12-08 17:06:41,644] Trial 61 finished with value: 0.2733957107694761 and parameters: {'model_type': 'graphsage', 'hidden_dims': '[256, 128]', 'dropout': 0.5256908916366483, 'batch_norm': False, 'sage_aggr': 'mean', 'sage_normalize': True, 'sage_project': False, 'lr': 1.026350744812483e-05, 'weight_decay': 6.798447188494486e-06, 'epochs': 336, 'loss': 'mse', 'optimizer': 'adam', 'graph_mode': 'cutoff', 'cutoff': 0.46077724096987127, 'grm_norm': 'none', 'self_loops': False, 'use_snp_selection': False}. Best is trial 13 with value: 0.3123866227334652.
[I 2025-12-08 17:08:50,956] Trial 62 finished with value: 0.3058485835822986 and parameters: {'model_type': 'graphsage', 'hidden_dims': '[256, 128]', 'dropout': 0.5091028166438445, 'batch_norm': False, 'sage_aggr': 'mean', 'sage_normalize': True, 'sage_project': False, 'lr': 0.0026580786418573137, 'weight_decay': 1.1923827409364731e-05, 'epochs': 322, 'loss': 'mse', 'optimizer': 'adam', 'graph_mode': 'cutoff', 'cutoff': 0.4137185342790635, 'grm_norm': 'none', 'self_loops': False, 'use_snp_selection': False}. Best is trial 13 with value: 0.3123866227334652.
[I 2025-12-08 17:11:10,313] Trial 63 finished with value: 0.2823118762961829 and parameters: {'model_type': 'graphsage', 'hidden_dims': '[256, 128]', 'dropout': 0.5118767028976403, 'batch_norm': False, 'sage_aggr': 'mean', 'sage_normalize': True, 'sage_project': False, 'lr': 0.002836216008435188, 'weight_decay': 1.671581483718086e-05, 'epochs': 323, 'loss': 'mse', 'optimizer': 'adam', 'graph_mode': 'cutoff', 'cutoff': 0.3518230697390917, 'grm_norm': 'none', 'self_loops': False, 'use_snp_selection': False}. Best is trial 13 with value: 0.3123866227334652.
[I 2025-12-08 17:12:40,705] Trial 64 finished with value: 0.2995448400728928 and parameters: {'model_type': 'graphsage', 'hidden_dims': '[128, 64]', 'dropout': 0.4864576264865421, 'batch_norm': False, 'sage_aggr': 'mean', 'sage_normalize': True, 'sage_project': False, 'lr': 0.0017404006943356597, 'weight_decay': 1.1289613995470913e-05, 'epochs': 307, 'loss': 'mse', 'optimizer': 'adam', 'graph_mode': 'cutoff', 'cutoff': 0.40802327765720325, 'grm_norm': 'none', 'self_loops': False, 'use_snp_selection': False}. Best is trial 13 with value: 0.3123866227334652.
[I 2025-12-08 17:14:56,805] Trial 65 finished with value: 0.3029829724208006 and parameters: {'model_type': 'graphsage', 'hidden_dims': '[256, 128]', 'dropout': 0.44369218748452977, 'batch_norm': False, 'sage_aggr': 'mean', 'sage_normalize': True, 'sage_project': False, 'lr': 0.0036070140605311695, 'weight_decay': 2.588749192352088e-06, 'epochs': 349, 'loss': 'mse', 'optimizer': 'adam', 'graph_mode': 'cutoff', 'cutoff': 0.4223540059200042, 'grm_norm': 'cosine', 'self_loops': False, 'use_snp_selection': False}. Best is trial 13 with value: 0.3123866227334652.
[I 2025-12-08 17:16:57,948] Trial 66 finished with value: 0.3028476221066498 and parameters: {'model_type': 'graphsage', 'hidden_dims': '[256, 128]', 'dropout': 0.10970737880322579, 'batch_norm': False, 'sage_aggr': 'mean', 'sage_normalize': True, 'sage_project': False, 'lr': 0.0010924832957199143, 'weight_decay': 2.1856507620248128e-05, 'epochs': 292, 'loss': 'mse', 'optimizer': 'adam', 'graph_mode': 'cutoff', 'cutoff': 0.37943524495942554, 'grm_norm': 'gcn', 'self_loops': False, 'use_snp_selection': False}. Best is trial 13 with value: 0.3123866227334652.
[I 2025-12-08 17:18:55,042] Trial 67 finished with value: 0.27453426047718715 and parameters: {'model_type': 'graphsage', 'hidden_dims': '[256, 128, 64]', 'dropout': 0.4660233968763971, 'batch_norm': True, 'sage_aggr': 'mean', 'sage_normalize': True, 'sage_project': False, 'lr': 0.001379311557620366, 'weight_decay': 5.038165759720017e-05, 'epochs': 320, 'loss': 'mse', 'optimizer': 'adam', 'graph_mode': 'knn', 'knn_k': 5, 'weighted_edges': True, 'symmetrize_mode': 'mutual', 'self_loops': False, 'use_snp_selection': False}. Best is trial 13 with value: 0.3123866227334652.
[I 2025-12-08 17:21:05,765] Trial 68 finished with value: -0.02248989133945643 and parameters: {'model_type': 'graphsage', 'hidden_dims': '[256, 128]', 'dropout': 0.4124597349592142, 'batch_norm': False, 'sage_aggr': 'mean', 'sage_normalize': False, 'sage_project': False, 'lr': 0.008590700865975295, 'weight_decay': 3.055114265690353e-05, 'epochs': 311, 'loss': 'mse', 'optimizer': 'adam', 'graph_mode': 'cutoff', 'cutoff': 0.3421323005843407, 'grm_norm': 'cosine_then_gcn', 'self_loops': False, 'use_snp_selection': False}. Best is trial 13 with value: 0.3123866227334652.
[I 2025-12-08 17:22:24,286] Trial 69 finished with value: 0.30203032724768225 and parameters: {'model_type': 'graphsage', 'hidden_dims': '[512, 64]', 'dropout': 0.5047428434622464, 'batch_norm': False, 'sage_aggr': 'mean', 'sage_normalize': True, 'sage_project': False, 'lr': 0.005273201949879098, 'weight_decay': 5.617472030543786e-06, 'epochs': 339, 'loss': 'mse', 'optimizer': 'adam', 'graph_mode': 'cutoff', 'cutoff': 0.48834173262429237, 'grm_norm': 'none', 'self_loops': False, 'use_snp_selection': True, 'num_snps': 19853}. Best is trial 13 with value: 0.3123866227334652.
[I 2025-12-08 17:25:23,197] Trial 70 finished with value: 0.281660350281157 and parameters: {'model_type': 'graphsage', 'hidden_dims': '[512, 128]', 'dropout': 0.5432883290361512, 'batch_norm': False, 'sage_aggr': 'mean', 'sage_normalize': True, 'sage_project': False, 'lr': 0.0001973559973730082, 'weight_decay': 3.764559464183166e-06, 'epochs': 325, 'loss': 'mse', 'optimizer': 'adam', 'graph_mode': 'cutoff', 'cutoff': 0.5276910671595443, 'grm_norm': 'cosine_then_gcn', 'self_loops': False, 'use_snp_selection': False}. Best is trial 13 with value: 0.3123866227334652.
[I 2025-12-08 17:27:34,568] Trial 71 finished with value: 0.3037017886446778 and parameters: {'model_type': 'graphsage', 'hidden_dims': '[256, 128]', 'dropout': 0.48476172375627863, 'batch_norm': False, 'sage_aggr': 'mean', 'sage_normalize': True, 'sage_project': False, 'lr': 0.0022407203716631463, 'weight_decay': 8.351622985120368e-06, 'epochs': 333, 'loss': 'mse', 'optimizer': 'adam', 'graph_mode': 'cutoff', 'cutoff': 0.4565207673714628, 'grm_norm': 'none', 'self_loops': False, 'use_snp_selection': False}. Best is trial 13 with value: 0.3123866227334652.
[I 2025-12-08 17:29:49,108] Trial 72 finished with value: 0.2992418825011073 and parameters: {'model_type': 'graphsage', 'hidden_dims': '[256, 128]', 'dropout': 0.5293064791381396, 'batch_norm': False, 'sage_aggr': 'mean', 'sage_normalize': True, 'sage_project': False, 'lr': 0.0028254335240965826, 'weight_decay': 1.4033122994857113e-05, 'epochs': 341, 'loss': 'mse', 'optimizer': 'adam', 'graph_mode': 'cutoff', 'cutoff': 0.43671560829243683, 'grm_norm': 'none', 'self_loops': False, 'use_snp_selection': False}. Best is trial 13 with value: 0.3123866227334652.
[I 2025-12-08 17:31:50,554] Trial 73 finished with value: 0.29953807816540345 and parameters: {'model_type': 'graphsage', 'hidden_dims': '[256, 128]', 'dropout': 0.564619378067991, 'batch_norm': False, 'sage_aggr': 'mean', 'sage_normalize': True, 'sage_project': False, 'lr': 0.002490876714784952, 'weight_decay': 6.252591898863874e-06, 'epochs': 316, 'loss': 'mse', 'optimizer': 'adam', 'graph_mode': 'cutoff', 'cutoff': 0.47428867470774694, 'grm_norm': 'none', 'self_loops': False, 'use_snp_selection': False}. Best is trial 13 with value: 0.3123866227334652.
[I 2025-12-08 17:33:51,946] Trial 74 finished with value: 0.30662495284746605 and parameters: {'model_type': 'graphsage', 'hidden_dims': '[256, 128]', 'dropout': 0.5059211405951607, 'batch_norm': False, 'sage_aggr': 'mean', 'sage_normalize': True, 'sage_project': False, 'lr': 0.0009707721828130495, 'weight_decay': 8.56676529863779e-06, 'epochs': 297, 'loss': 'mse', 'optimizer': 'adam', 'graph_mode': 'cutoff', 'cutoff': 0.39257067075520685, 'grm_norm': 'none', 'self_loops': False, 'use_snp_selection': False}. Best is trial 13 with value: 0.3123866227334652.
[I 2025-12-08 17:36:02,959] Trial 75 finished with value: 0.25843657937461445 and parameters: {'model_type': 'graphsage', 'hidden_dims': '[256, 128]', 'dropout': 0.5060885017715548, 'batch_norm': False, 'sage_aggr': 'max', 'sage_normalize': True, 'sage_project': False, 'lr': 7.302801795834575e-05, 'weight_decay': 9.822147377445758e-06, 'epochs': 296, 'loss': 'mse', 'optimizer': 'adam', 'graph_mode': 'cutoff', 'cutoff': 0.3674962423908851, 'grm_norm': 'cosine', 'self_loops': True, 'use_snp_selection': False}. Best is trial 13 with value: 0.3123866227334652.
[I 2025-12-08 17:38:15,792] Trial 76 finished with value: 0.2933324406001086 and parameters: {'model_type': 'graphsage', 'hidden_dims': '[256, 128]', 'dropout': 0.4684184460438713, 'batch_norm': False, 'sage_aggr': 'mean', 'sage_normalize': True, 'sage_project': False, 'lr': 0.000649270194441912, 'weight_decay': 4.563077034293009e-06, 'epochs': 326, 'loss': 'mae', 'optimizer': 'adam', 'graph_mode': 'cutoff', 'cutoff': 0.3924680469744841, 'grm_norm': 'gcn', 'self_loops': False, 'use_snp_selection': False}. Best is trial 13 with value: 0.3123866227334652.
[I 2025-12-08 17:39:49,032] Trial 77 finished with value: 0.23883244703915257 and parameters: {'model_type': 'graphsage', 'hidden_dims': '[256, 128]', 'dropout': 0.4945884973523305, 'batch_norm': False, 'sage_aggr': 'mean', 'sage_normalize': True, 'sage_project': False, 'lr': 0.000963784648160189, 'weight_decay': 1.7544531990926382e-05, 'epochs': 307, 'loss': 'mse', 'optimizer': 'adam', 'graph_mode': 'knn', 'knn_k': 1, 'weighted_edges': True, 'symmetrize_mode': 'union', 'self_loops': False, 'use_snp_selection': False}. Best is trial 13 with value: 0.3123866227334652.
[I 2025-12-08 17:42:13,600] Trial 78 finished with value: 0.3005167957305452 and parameters: {'model_type': 'graphsage', 'hidden_dims': '[256, 128]', 'dropout': 0.4460776469828775, 'batch_norm': True, 'sage_aggr': 'mean', 'sage_normalize': False, 'sage_project': False, 'lr': 0.0018910681713694975, 'weight_decay': 6.664245681150227e-05, 'epochs': 277, 'loss': 'mse', 'optimizer': 'adam', 'graph_mode': 'cutoff', 'cutoff': 0.31021502921731553, 'grm_norm': 'cosine_then_gcn', 'self_loops': False, 'use_snp_selection': False}. Best is trial 13 with value: 0.3123866227334652.
