[I 2025-12-09 01:48:28,957] Trial 110 finished with value: 0.37768868216182405 and parameters: {'model_type': 'graphsage', 'hidden_dims': '[512, 64]', 'dropout': 0.4309550323610957, 'batch_norm': True, 'sage_aggr': 'max', 'sage_normalize': False, 'sage_project': False, 'lr': 0.00445025490034323, 'weight_decay': 7.266036245888399e-07, 'epochs': 76, 'loss': 'mae', 'optimizer': 'adam', 'graph_mode': 'knn', 'knn_k': 9, 'weighted_edges': False, 'symmetrize_mode': 'union', 'self_loops': False, 'use_snp_selection': True, 'num_snps': 22398}. Best is trial 101 with value: 0.3913775485011878.
[I 2025-12-09 01:49:24,269] Trial 111 finished with value: 0.3913902474161667 and parameters: {'model_type': 'graphsage', 'hidden_dims': '[512, 64]', 'dropout': 0.5038823561745832, 'batch_norm': True, 'sage_aggr': 'max', 'sage_normalize': False, 'sage_project': False, 'lr': 0.00202769098463563, 'weight_decay': 3.813117946080532e-07, 'epochs': 62, 'loss': 'mae', 'optimizer': 'adam', 'graph_mode': 'knn', 'knn_k': 9, 'weighted_edges': False, 'symmetrize_mode': 'union', 'self_loops': False, 'use_snp_selection': True, 'num_snps': 26421}. Best is trial 111 with value: 0.3913902474161667.
[I 2025-12-09 01:50:35,052] Trial 112 finished with value: 0.3786634126900196 and parameters: {'model_type': 'graphsage', 'hidden_dims': '[512, 64]', 'dropout': 0.4035223205504701, 'batch_norm': True, 'sage_aggr': 'max', 'sage_normalize': False, 'sage_project': False, 'lr': 0.002382485172209758, 'weight_decay': 3.657709517023015e-07, 'epochs': 84, 'loss': 'mae', 'optimizer': 'adam', 'graph_mode': 'knn', 'knn_k': 9, 'weighted_edges': False, 'symmetrize_mode': 'union', 'self_loops': False, 'use_snp_selection': True, 'num_snps': 26718}. Best is trial 111 with value: 0.3913902474161667.
[I 2025-12-09 01:52:32,281] Trial 113 finished with value: 0.3749854822064573 and parameters: {'model_type': 'graphsage', 'hidden_dims': '[512, 64]', 'dropout': 0.46930176107108135, 'batch_norm': True, 'sage_aggr': 'max', 'sage_normalize': False, 'sage_project': False, 'lr': 0.002166133190293013, 'weight_decay': 5.610589009665785e-07, 'epochs': 113, 'loss': 'mae', 'optimizer': 'adam', 'graph_mode': 'knn', 'knn_k': 9, 'weighted_edges': False, 'symmetrize_mode': 'union', 'self_loops': False, 'use_snp_selection': True, 'num_snps': 32019}. Best is trial 111 with value: 0.3913902474161667.
[I 2025-12-09 01:53:27,281] Trial 114 finished with value: 0.3820868907677565 and parameters: {'model_type': 'graphsage', 'hidden_dims': '[512, 64]', 'dropout': 0.38143828830012205, 'batch_norm': True, 'sage_aggr': 'max', 'sage_normalize': False, 'sage_project': False, 'lr': 0.0028990472648543837, 'weight_decay': 3.210831636586933e-07, 'epochs': 64, 'loss': 'mae', 'optimizer': 'adam', 'graph_mode': 'knn', 'knn_k': 9, 'weighted_edges': False, 'symmetrize_mode': 'union', 'self_loops': False, 'use_snp_selection': True, 'num_snps': 25586}. Best is trial 111 with value: 0.3913902474161667.
[I 2025-12-09 01:54:29,186] Trial 115 finished with value: 0.376811615883563 and parameters: {'model_type': 'graphsage', 'hidden_dims': '[512, 64]', 'dropout': 0.4963691939438731, 'batch_norm': True, 'sage_aggr': 'max', 'sage_normalize': False, 'sage_project': False, 'lr': 0.005080898828264963, 'weight_decay': 8.586662633746978e-07, 'epochs': 61, 'loss': 'mae', 'optimizer': 'adam', 'graph_mode': 'knn', 'knn_k': 9, 'weighted_edges': False, 'symmetrize_mode': 'union', 'self_loops': False, 'use_snp_selection': True, 'num_snps': 29121}. Best is trial 111 with value: 0.3913902474161667.
[I 2025-12-09 01:54:39,300] Trial 116 finished with value: 0.3077018531533782 and parameters: {'model_type': 'graphsage', 'hidden_dims': '[512, 64]', 'dropout': 0.44454372159152455, 'batch_norm': True, 'sage_aggr': 'max', 'sage_normalize': False, 'sage_project': False, 'lr': 0.0025654201306200756, 'weight_decay': 4.0516893160039385e-07, 'epochs': 78, 'loss': 'mae', 'optimizer': 'adam', 'graph_mode': 'cutoff', 'cutoff': 0.8798515389944795, 'grm_norm': 'cosine', 'self_loops': False, 'use_snp_selection': True, 'num_snps': 2342}. Best is trial 111 with value: 0.3913902474161667.
[I 2025-12-09 01:56:11,296] Trial 117 finished with value: 0.3740171077876286 and parameters: {'model_type': 'graphsage', 'hidden_dims': '[512, 64]', 'dropout': 0.4573954617451853, 'batch_norm': True, 'sage_aggr': 'max', 'sage_normalize': False, 'sage_project': False, 'lr': 0.0031823358185339, 'weight_decay': 3.032087138668025e-07, 'epochs': 72, 'loss': 'mae', 'optimizer': 'adam', 'graph_mode': 'knn', 'knn_k': 9, 'weighted_edges': False, 'symmetrize_mode': 'union', 'self_loops': True, 'use_snp_selection': False}. Best is trial 111 with value: 0.3913902474161667.
[I 2025-12-09 01:56:40,452] Trial 118 finished with value: 0.33437178432566467 and parameters: {'model_type': 'graphsage', 'hidden_dims': '[256, 128, 64]', 'dropout': 0.5366599525911867, 'batch_norm': True, 'sage_aggr': 'max', 'sage_normalize': False, 'sage_project': False, 'lr': 0.0019638135178809846, 'weight_decay': 5.415149511677324e-07, 'epochs': 58, 'loss': 'mae', 'optimizer': 'adam', 'graph_mode': 'knn', 'knn_k': 5, 'weighted_edges': False, 'symmetrize_mode': 'union', 'self_loops': False, 'use_snp_selection': True, 'num_snps': 27634}. Best is trial 111 with value: 0.3913902474161667.
[I 2025-12-09 01:58:57,852] Trial 119 finished with value: 0.37444652740242224 and parameters: {'model_type': 'graphsage', 'hidden_dims': '[512, 64]', 'dropout': 0.5039381381602053, 'batch_norm': True, 'sage_aggr': 'max', 'sage_normalize': False, 'sage_project': False, 'lr': 0.0016803474785477253, 'weight_decay': 4.863988145051665e-07, 'epochs': 244, 'loss': 'mae', 'optimizer': 'adam', 'graph_mode': 'knn', 'knn_k': 9, 'weighted_edges': False, 'symmetrize_mode': 'union', 'self_loops': False, 'use_snp_selection': True, 'num_snps': 23117}. Best is trial 111 with value: 0.3913902474161667.
[I 2025-12-09 01:59:56,924] Trial 120 finished with value: 0.3762899743376936 and parameters: {'model_type': 'graphsage', 'hidden_dims': '[512, 64]', 'dropout': 0.48411011349138205, 'batch_norm': True, 'sage_aggr': 'max', 'sage_normalize': False, 'sage_project': False, 'lr': 0.004174326039008435, 'weight_decay': 1.4260654663754085e-06, 'epochs': 100, 'loss': 'mae', 'optimizer': 'adam', 'graph_mode': 'knn', 'knn_k': 9, 'weighted_edges': False, 'symmetrize_mode': 'union', 'self_loops': False, 'use_snp_selection': True, 'num_snps': 21760}. Best is trial 111 with value: 0.3913902474161667.
[I 2025-12-09 02:00:52,515] Trial 121 finished with value: 0.37851732791150783 and parameters: {'model_type': 'graphsage', 'hidden_dims': '[512, 64]', 'dropout': 0.3593249476071487, 'batch_norm': True, 'sage_aggr': 'max', 'sage_normalize': False, 'sage_project': False, 'lr': 0.0028855132895482844, 'weight_decay': 2.9510817743399465e-07, 'epochs': 65, 'loss': 'mae', 'optimizer': 'adam', 'graph_mode': 'knn', 'knn_k': 9, 'weighted_edges': False, 'symmetrize_mode': 'union', 'self_loops': False, 'use_snp_selection': True, 'num_snps': 25994}. Best is trial 111 with value: 0.3913902474161667.
[I 2025-12-09 02:01:32,401] Trial 122 finished with value: 0.38128033724468635 and parameters: {'model_type': 'graphsage', 'hidden_dims': '[512, 64]', 'dropout': 0.38720912521380263, 'batch_norm': True, 'sage_aggr': 'max', 'sage_normalize': False, 'sage_project': False, 'lr': 0.0023602039842749237, 'weight_decay': 3.843063716048689e-07, 'epochs': 43, 'loss': 'mae', 'optimizer': 'adam', 'graph_mode': 'knn', 'knn_k': 9, 'weighted_edges': False, 'symmetrize_mode': 'union', 'self_loops': False, 'use_snp_selection': True, 'num_snps': 24747}. Best is trial 111 with value: 0.3913902474161667.
[I 2025-12-09 02:02:18,400] Trial 123 finished with value: 0.3914066785204766 and parameters: {'model_type': 'graphsage', 'hidden_dims': '[512, 64]', 'dropout': 0.39753901302221023, 'batch_norm': True, 'sage_aggr': 'max', 'sage_normalize': False, 'sage_project': False, 'lr': 0.0028958070619824845, 'weight_decay': 7.070549491603121e-07, 'epochs': 54, 'loss': 'mae', 'optimizer': 'adam', 'graph_mode': 'knn', 'knn_k': 9, 'weighted_edges': False, 'symmetrize_mode': 'union', 'self_loops': False, 'use_snp_selection': True, 'num_snps': 25482}. Best is trial 123 with value: 0.3914066785204766.
[I 2025-12-09 02:03:01,606] Trial 124 finished with value: 0.38064873260818793 and parameters: {'model_type': 'graphsage', 'hidden_dims': '[128, 64]', 'dropout': 0.4095525839158249, 'batch_norm': True, 'sage_aggr': 'max', 'sage_normalize': False, 'sage_project': False, 'lr': 0.002041529352941628, 'weight_decay': 7.627231825008009e-07, 'epochs': 55, 'loss': 'mae', 'optimizer': 'adam', 'graph_mode': 'knn', 'knn_k': 9, 'weighted_edges': False, 'symmetrize_mode': 'union', 'self_loops': False, 'use_snp_selection': True, 'num_snps': 28306}. Best is trial 123 with value: 0.3914066785204766.
[I 2025-12-09 02:04:31,545] Trial 125 finished with value: 0.36380073825111775 and parameters: {'model_type': 'graphsage', 'hidden_dims': '[512, 64]', 'dropout': 0.40062504496962287, 'batch_norm': True, 'sage_aggr': 'max', 'sage_normalize': False, 'sage_project': False, 'lr': 0.001388566013503482, 'weight_decay': 6.085165636782265e-07, 'epochs': 44, 'loss': 'mae', 'optimizer': 'adam', 'graph_mode': 'knn', 'knn_k': 9, 'weighted_edges': False, 'symmetrize_mode': 'union', 'self_loops': False, 'use_snp_selection': True, 'num_snps': 52263}. Best is trial 123 with value: 0.3914066785204766.
[I 2025-12-09 02:05:12,585] Trial 126 finished with value: 0.38548308085533645 and parameters: {'model_type': 'graphsage', 'hidden_dims': '[512, 64]', 'dropout': 0.42355054978778683, 'batch_norm': True, 'sage_aggr': 'max', 'sage_normalize': False, 'sage_project': False, 'lr': 0.003241752205170798, 'weight_decay': 4.2281251830721243e-07, 'epochs': 52, 'loss': 'mse', 'optimizer': 'adam', 'graph_mode': 'knn', 'knn_k': 8, 'weighted_edges': False, 'symmetrize_mode': 'union', 'self_loops': False, 'use_snp_selection': True, 'num_snps': 24078}. Best is trial 123 with value: 0.3914066785204766.
[I 2025-12-09 02:05:52,487] Trial 127 finished with value: 0.3803669175515333 and parameters: {'model_type': 'graphsage', 'hidden_dims': '[512, 64]', 'dropout': 0.41954707032060745, 'batch_norm': True, 'sage_aggr': 'max', 'sage_normalize': False, 'sage_project': False, 'lr': 0.00421878326761378, 'weight_decay': 4.785184640096287e-07, 'epochs': 52, 'loss': 'mse', 'optimizer': 'adam', 'graph_mode': 'knn', 'knn_k': 8, 'weighted_edges': False, 'symmetrize_mode': 'union', 'self_loops': False, 'use_snp_selection': True, 'num_snps': 23572}. Best is trial 123 with value: 0.3914066785204766.
[I 2025-12-09 02:07:26,986] Trial 128 finished with value: 0.35524767787129174 and parameters: {'model_type': 'graphsage', 'hidden_dims': '[512, 64]', 'dropout': 0.5249851696874326, 'batch_norm': True, 'sage_aggr': 'max', 'sage_normalize': False, 'sage_project': False, 'lr': 0.0031837131938898034, 'weight_decay': 4.195837166735517e-07, 'epochs': 156, 'loss': 'mse', 'optimizer': 'adam', 'graph_mode': 'knn', 'knn_k': 10, 'weighted_edges': False, 'symmetrize_mode': 'mutual', 'self_loops': False, 'use_snp_selection': True, 'num_snps': 29909}. Best is trial 123 with value: 0.3914066785204766.
[I 2025-12-09 02:08:28,424] Trial 129 finished with value: 0.38301850975433294 and parameters: {'model_type': 'graphsage', 'hidden_dims': '[512, 64]', 'dropout': 0.46749815799620464, 'batch_norm': True, 'sage_aggr': 'max', 'sage_normalize': False, 'sage_project': False, 'lr': 0.002577955209970149, 'weight_decay': 7.020541590672841e-07, 'epochs': 72, 'loss': 'mse', 'optimizer': 'adam', 'graph_mode': 'knn', 'knn_k': 9, 'weighted_edges': False, 'symmetrize_mode': 'union', 'self_loops': False, 'use_snp_selection': True, 'num_snps': 26872}. Best is trial 123 with value: 0.3914066785204766.
[I 2025-12-09 02:09:22,099] Trial 130 finished with value: 0.3558242222495263 and parameters: {'model_type': 'graphsage', 'hidden_dims': '[512, 64]', 'dropout': 0.550027962542997, 'batch_norm': True, 'sage_aggr': 'mean', 'sage_normalize': False, 'sage_project': False, 'lr': 0.0024937338049617138, 'weight_decay': 8.89125761668674e-07, 'epochs': 80, 'loss': 'mse', 'optimizer': 'adam', 'graph_mode': 'knn', 'knn_k': 9, 'weighted_edges': True, 'symmetrize_mode': 'union', 'self_loops': False, 'use_snp_selection': True, 'num_snps': 24932}. Best is trial 123 with value: 0.3914066785204766.
[I 2025-12-09 02:10:23,866] Trial 131 finished with value: 0.3843031910136744 and parameters: {'model_type': 'graphsage', 'hidden_dims': '[512, 64]', 'dropout': 0.46537884831179116, 'batch_norm': True, 'sage_aggr': 'max', 'sage_normalize': False, 'sage_project': False, 'lr': 0.0035441396328846947, 'weight_decay': 6.2598326790761e-07, 'epochs': 72, 'loss': 'mse', 'optimizer': 'adam', 'graph_mode': 'knn', 'knn_k': 9, 'weighted_edges': False, 'symmetrize_mode': 'union', 'self_loops': False, 'use_snp_selection': True, 'num_snps': 26945}. Best is trial 123 with value: 0.3914066785204766.
[I 2025-12-09 02:11:16,260] Trial 132 finished with value: 0.3894631423926442 and parameters: {'model_type': 'graphsage', 'hidden_dims': '[512, 64]', 'dropout': 0.47219344939841035, 'batch_norm': True, 'sage_aggr': 'max', 'sage_normalize': False, 'sage_project': False, 'lr': 0.0034515538962034053, 'weight_decay': 6.819703872955351e-07, 'epochs': 62, 'loss': 'mse', 'optimizer': 'adam', 'graph_mode': 'knn', 'knn_k': 9, 'weighted_edges': False, 'symmetrize_mode': 'union', 'self_loops': False, 'use_snp_selection': True, 'num_snps': 25713}. Best is trial 123 with value: 0.3914066785204766.
[I 2025-12-09 02:12:01,328] Trial 133 finished with value: 0.3761810122984798 and parameters: {'model_type': 'graphsage', 'hidden_dims': '[512, 64]', 'dropout': 0.49914782355247467, 'batch_norm': True, 'sage_aggr': 'max', 'sage_normalize': False, 'sage_project': False, 'lr': 0.0034227009103745933, 'weight_decay': 6.364122343461323e-07, 'epochs': 62, 'loss': 'mse', 'optimizer': 'adam', 'graph_mode': 'knn', 'knn_k': 9, 'weighted_edges': False, 'symmetrize_mode': 'union', 'self_loops': False, 'use_snp_selection': True, 'num_snps': 23706}. Best is trial 123 with value: 0.3914066785204766.
[I 2025-12-09 02:12:42,601] Trial 134 finished with value: 0.3459933874536647 and parameters: {'model_type': 'graphsage', 'hidden_dims': '[512, 256]', 'dropout': 0.47694601534629255, 'batch_norm': True, 'sage_aggr': 'max', 'sage_normalize': False, 'sage_project': False, 'lr': 0.005374806832986617, 'weight_decay': 3.4957830076208376e-07, 'epochs': 54, 'loss': 'mse', 'optimizer': 'adam', 'graph_mode': 'knn', 'knn_k': 8, 'weighted_edges': False, 'symmetrize_mode': 'union', 'self_loops': False, 'use_snp_selection': True, 'num_snps': 25526}. Best is trial 123 with value: 0.3914066785204766.
[I 2025-12-09 02:13:46,147] Trial 135 finished with value: 0.3867804267085485 and parameters: {'model_type': 'graphsage', 'hidden_dims': '[512, 64]', 'dropout': 0.44075149046276374, 'batch_norm': True, 'sage_aggr': 'max', 'sage_normalize': False, 'sage_project': False, 'lr': 0.003909049148946367, 'weight_decay': 2.074549872440566e-07, 'epochs': 67, 'loss': 'mse', 'optimizer': 'adam', 'graph_mode': 'knn', 'knn_k': 9, 'weighted_edges': False, 'symmetrize_mode': 'union', 'self_loops': False, 'use_snp_selection': True, 'num_snps': 31132}. Best is trial 123 with value: 0.3914066785204766.
[I 2025-12-09 02:14:27,421] Trial 136 finished with value: 0.281536628372435 and parameters: {'model_type': 'graphsage', 'hidden_dims': '[512, 64]', 'dropout': 0.4453408147258498, 'batch_norm': False, 'sage_aggr': 'max', 'sage_normalize': True, 'sage_project': False, 'lr': 0.006823891851787152, 'weight_decay': 2.0128902706852538e-07, 'epochs': 59, 'loss': 'mse', 'optimizer': 'adam', 'graph_mode': 'knn', 'knn_k': 4, 'weighted_edges': False, 'symmetrize_mode': 'union', 'self_loops': False, 'use_snp_selection': True, 'num_snps': 31510}. Best is trial 123 with value: 0.3914066785204766.
[I 2025-12-09 02:14:57,140] Trial 137 finished with value: 0.3434596790087706 and parameters: {'model_type': 'graphsage', 'hidden_dims': '[512, 64]', 'dropout': 0.4337760969338115, 'batch_norm': True, 'sage_aggr': 'max', 'sage_normalize': False, 'sage_project': False, 'lr': 0.0038449586865605427, 'weight_decay': 2.5528916637222794e-07, 'epochs': 65, 'loss': 'mse', 'optimizer': 'adam', 'graph_mode': 'cutoff', 'cutoff': 0.6805409227049478, 'grm_norm': 'cosine_then_gcn', 'self_loops': False, 'use_snp_selection': True, 'num_snps': 29435}. Best is trial 123 with value: 0.3914066785204766.
[I 2025-12-09 02:15:49,020] Trial 138 finished with value: 0.3701625675902806 and parameters: {'model_type': 'graphsage', 'hidden_dims': '[512, 64]', 'dropout': 0.42683659296486276, 'batch_norm': True, 'sage_aggr': 'max', 'sage_normalize': False, 'sage_project': False, 'lr': 0.004735444989739712, 'weight_decay': 2.9882781650021377e-07, 'epochs': 52, 'loss': 'mse', 'optimizer': 'adam', 'graph_mode': 'knn', 'knn_k': 9, 'weighted_edges': False, 'symmetrize_mode': 'union', 'self_loops': False, 'use_snp_selection': True, 'num_snps': 28473}. Best is trial 123 with value: 0.3914066785204766.
[I 2025-12-09 02:16:58,930] Trial 139 finished with value: 0.3223552447680426 and parameters: {'model_type': 'graphsage', 'hidden_dims': '[256, 128, 64]', 'dropout': 0.4884571963713613, 'batch_norm': True, 'sage_aggr': 'max', 'sage_normalize': False, 'sage_project': False, 'lr': 0.003997351267025757, 'weight_decay': 1.3304133784481563e-06, 'epochs': 75, 'loss': 'mse', 'optimizer': 'adam', 'graph_mode': 'knn', 'knn_k': 8, 'weighted_edges': False, 'symmetrize_mode': 'union', 'self_loops': True, 'use_snp_selection': False}. Best is trial 123 with value: 0.3914066785204766.
[I 2025-12-09 02:17:57,653] Trial 140 finished with value: 0.3661696408945895 and parameters: {'model_type': 'graphsage', 'hidden_dims': '[512, 64]', 'dropout': 0.4498511225892637, 'batch_norm': True, 'sage_aggr': 'max', 'sage_normalize': False, 'sage_project': False, 'lr': 0.0033969714965382683, 'weight_decay': 2.1600679979739996e-07, 'epochs': 45, 'loss': 'mse', 'optimizer': 'adam', 'graph_mode': 'knn', 'knn_k': 10, 'weighted_edges': False, 'symmetrize_mode': 'union', 'self_loops': False, 'use_snp_selection': True, 'num_snps': 32332}. Best is trial 123 with value: 0.3914066785204766.
[I 2025-12-09 02:19:20,077] Trial 141 finished with value: 0.389175079411006 and parameters: {'model_type': 'graphsage', 'hidden_dims': '[512, 64]', 'dropout': 0.4643628340564421, 'batch_norm': True, 'sage_aggr': 'max', 'sage_normalize': False, 'sage_project': False, 'lr': 0.0028147354271528344, 'weight_decay': 4.2849846722163634e-07, 'epochs': 83, 'loss': 'mse', 'optimizer': 'adam', 'graph_mode': 'knn', 'knn_k': 9, 'weighted_edges': False, 'symmetrize_mode': 'union', 'self_loops': False, 'use_snp_selection': True, 'num_snps': 34557}. Best is trial 123 with value: 0.3914066785204766.
[I 2025-12-09 02:20:43,791] Trial 142 finished with value: 0.372533671124068 and parameters: {'model_type': 'graphsage', 'hidden_dims': '[512, 64]', 'dropout': 0.46087492351362896, 'batch_norm': True, 'sage_aggr': 'max', 'sage_normalize': False, 'sage_project': False, 'lr': 0.0027017993374303675, 'weight_decay': 4.0803215686007717e-07, 'epochs': 67, 'loss': 'mse', 'optimizer': 'adam', 'graph_mode': 'knn', 'knn_k': 9, 'weighted_edges': False, 'symmetrize_mode': 'union', 'self_loops': False, 'use_snp_selection': True, 'num_snps': 36480}. Best is trial 123 with value: 0.3914066785204766.
[I 2025-12-09 02:21:56,877] Trial 143 finished with value: 0.37361615573797285 and parameters: {'model_type': 'graphsage', 'hidden_dims': '[512, 64]', 'dropout': 0.47572828348159363, 'batch_norm': True, 'sage_aggr': 'max', 'sage_normalize': False, 'sage_project': False, 'lr': 0.004485029928620323, 'weight_decay': 4.6166080966823233e-07, 'epochs': 58, 'loss': 'mse', 'optimizer': 'adam', 'graph_mode': 'knn', 'knn_k': 9, 'weighted_edges': False, 'symmetrize_mode': 'union', 'self_loops': False, 'use_snp_selection': True, 'num_snps': 34777}. Best is trial 123 with value: 0.3914066785204766.
[I 2025-12-09 02:23:00,729] Trial 144 finished with value: 0.3751037753416712 and parameters: {'model_type': 'graphsage', 'hidden_dims': '[512, 64]', 'dropout': 0.43713067322030386, 'batch_norm': True, 'sage_aggr': 'max', 'sage_normalize': False, 'sage_project': False, 'lr': 0.003094262558269741, 'weight_decay': 8.260773578061116e-07, 'epochs': 51, 'loss': 'mse', 'optimizer': 'adam', 'graph_mode': 'knn', 'knn_k': 9, 'weighted_edges': False, 'symmetrize_mode': 'union', 'self_loops': False, 'use_snp_selection': True, 'num_snps': 33640}. Best is trial 123 with value: 0.3914066785204766.
[I 2025-12-09 02:23:53,204] Trial 145 finished with value: 0.36594957259682104 and parameters: {'model_type': 'graphsage', 'hidden_dims': '[512, 64]', 'dropout': 0.4637581448161134, 'batch_norm': True, 'sage_aggr': 'max', 'sage_normalize': False, 'sage_project': False, 'lr': 0.003755130073524861, 'weight_decay': 1.4553597382765857e-07, 'epochs': 73, 'loss': 'mse', 'optimizer': 'adam', 'graph_mode': 'knn', 'knn_k': 9, 'weighted_edges': False, 'symmetrize_mode': 'union', 'self_loops': False, 'use_snp_selection': True, 'num_snps': 22545}. Best is trial 123 with value: 0.3914066785204766.
[I 2025-12-09 02:27:14,334] Trial 146 finished with value: 0.3720629667790482 and parameters: {'model_type': 'graphsage', 'hidden_dims': '[512, 64]', 'dropout': 0.48109850080255784, 'batch_norm': True, 'sage_aggr': 'max', 'sage_normalize': False, 'sage_project': False, 'lr': 0.0021410044070012484, 'weight_decay': 3.1804071980787437e-07, 'epochs': 183, 'loss': 'mse', 'optimizer': 'adam', 'graph_mode': 'knn', 'knn_k': 8, 'weighted_edges': False, 'symmetrize_mode': 'union', 'self_loops': False, 'use_snp_selection': True, 'num_snps': 38491}. Best is trial 123 with value: 0.3914066785204766.
