[I 2025-12-06 11:27:38,237] Trial 127 finished with value: 0.21231599971343953 and parameters: {'model_type': 'graphsage', 'hidden_dims': '[512, 256]', 'dropout': 0.5057491914667688, 'batch_norm': True, 'sage_aggr': 'max', 'sage_normalize': True, 'sage_project': False, 'lr': 0.0004341383210269759, 'weight_decay': 1.0069390275458985e-07, 'epochs': 237, 'loss': 'mae', 'optimizer': 'adam', 'graph_mode': 'cutoff', 'cutoff': 0.8363219918472702, 'grm_norm': 'none', 'self_loops': False, 'use_snp_selection': True, 'num_snps': 28445, 'graphsage_batch_size': 16}. Best is trial 19 with value: 0.22264005015541502.
[I 2025-12-06 11:29:08,035] Trial 128 finished with value: 0.1986831182315007 and parameters: {'model_type': 'graphsage', 'hidden_dims': '[512, 256]', 'dropout': 0.5356485707778862, 'batch_norm': True, 'sage_aggr': 'max', 'sage_normalize': True, 'sage_project': False, 'lr': 0.00044459520788997324, 'weight_decay': 1.391373665322697e-07, 'epochs': 240, 'loss': 'mae', 'optimizer': 'adam', 'graph_mode': 'knn', 'knn_k': 4, 'weighted_edges': False, 'symmetrize_mode': 'mutual', 'self_loops': False, 'use_snp_selection': True, 'num_snps': 27613, 'graphsage_batch_size': 16}. Best is trial 19 with value: 0.22264005015541502.
[I 2025-12-06 11:30:39,891] Trial 129 finished with value: 0.20989151754874777 and parameters: {'model_type': 'graphsage', 'hidden_dims': '[512, 256]', 'dropout': 0.4859794924696617, 'batch_norm': True, 'sage_aggr': 'max', 'sage_normalize': True, 'sage_project': False, 'lr': 0.0005277051224597322, 'weight_decay': 1.85757418308744e-07, 'epochs': 242, 'loss': 'mae', 'optimizer': 'adam', 'graph_mode': 'cutoff', 'cutoff': 0.8351755498729077, 'grm_norm': 'none', 'self_loops': False, 'use_snp_selection': True, 'num_snps': 33501, 'graphsage_batch_size': 16}. Best is trial 19 with value: 0.22264005015541502.
[I 2025-12-06 11:31:59,802] Trial 130 finished with value: 0.2123698853803873 and parameters: {'model_type': 'graphsage', 'hidden_dims': '[512, 256]', 'dropout': 0.5528502551417815, 'batch_norm': True, 'sage_aggr': 'max', 'sage_normalize': True, 'sage_project': False, 'lr': 0.0007367695772399699, 'weight_decay': 2.685596433308452e-07, 'epochs': 228, 'loss': 'mae', 'optimizer': 'adam', 'graph_mode': 'cutoff', 'cutoff': 0.8052204677049112, 'grm_norm': 'none', 'self_loops': False, 'use_snp_selection': True, 'num_snps': 29879, 'graphsage_batch_size': 16}. Best is trial 19 with value: 0.22264005015541502.
[I 2025-12-06 11:33:17,260] Trial 131 finished with value: 0.21044815097657477 and parameters: {'model_type': 'graphsage', 'hidden_dims': '[512, 256]', 'dropout': 0.5720940537805509, 'batch_norm': True, 'sage_aggr': 'max', 'sage_normalize': True, 'sage_project': False, 'lr': 0.00037789837768092673, 'weight_decay': 1.0270907812722516e-07, 'epochs': 226, 'loss': 'mae', 'optimizer': 'adam', 'graph_mode': 'cutoff', 'cutoff': 0.8034606541912724, 'grm_norm': 'none', 'self_loops': False, 'use_snp_selection': True, 'num_snps': 29210, 'graphsage_batch_size': 16}. Best is trial 19 with value: 0.22264005015541502.
[I 2025-12-06 11:34:27,118] Trial 132 finished with value: 0.20880690391403664 and parameters: {'model_type': 'graphsage', 'hidden_dims': '[512, 256]', 'dropout': 0.49991915276890764, 'batch_norm': True, 'sage_aggr': 'max', 'sage_normalize': True, 'sage_project': False, 'lr': 0.0009925302186037327, 'weight_decay': 2.693189866007677e-07, 'epochs': 235, 'loss': 'mae', 'optimizer': 'adam', 'graph_mode': 'cutoff', 'cutoff': 0.8089808738386624, 'grm_norm': 'none', 'self_loops': False, 'use_snp_selection': True, 'num_snps': 24482, 'graphsage_batch_size': 16}. Best is trial 19 with value: 0.22264005015541502.
[I 2025-12-06 11:35:53,027] Trial 133 finished with value: 0.20747276373011267 and parameters: {'model_type': 'graphsage', 'hidden_dims': '[512, 256]', 'dropout': 0.5508506011669039, 'batch_norm': True, 'sage_aggr': 'max', 'sage_normalize': True, 'sage_project': False, 'lr': 0.0006896339303385199, 'weight_decay': 1.3756912373782298e-07, 'epochs': 232, 'loss': 'mae', 'optimizer': 'adam', 'graph_mode': 'cutoff', 'cutoff': 0.8483099685688021, 'grm_norm': 'none', 'self_loops': False, 'use_snp_selection': True, 'num_snps': 32185, 'graphsage_batch_size': 16}. Best is trial 19 with value: 0.22264005015541502.
[I 2025-12-06 11:37:35,748] Trial 134 finished with value: 0.2030830220679407 and parameters: {'model_type': 'graphsage', 'hidden_dims': '[512, 256]', 'dropout': 0.5876159400418406, 'batch_norm': True, 'sage_aggr': 'max', 'sage_normalize': True, 'sage_project': False, 'lr': 0.0005285991601327202, 'weight_decay': 1.7550159088358202e-07, 'epochs': 230, 'loss': 'mae', 'optimizer': 'adam', 'graph_mode': 'cutoff', 'cutoff': 0.8325921368782663, 'grm_norm': 'none', 'self_loops': False, 'use_snp_selection': True, 'num_snps': 40070, 'graphsage_batch_size': 16}. Best is trial 19 with value: 0.22264005015541502.
[I 2025-12-06 11:38:51,842] Trial 135 finished with value: 0.21222644381415368 and parameters: {'model_type': 'graphsage', 'hidden_dims': '[512, 256]', 'dropout': 0.5310423655483555, 'batch_norm': True, 'sage_aggr': 'max', 'sage_normalize': True, 'sage_project': False, 'lr': 0.0006866660091324122, 'weight_decay': 1.4440061696046914e-07, 'epochs': 221, 'loss': 'mae', 'optimizer': 'adam', 'graph_mode': 'cutoff', 'cutoff': 0.8685580201739141, 'grm_norm': 'cosine', 'self_loops': False, 'use_snp_selection': True, 'num_snps': 29182, 'graphsage_batch_size': 16}. Best is trial 19 with value: 0.22264005015541502.
[I 2025-12-06 11:40:14,110] Trial 136 finished with value: 0.21617513630209012 and parameters: {'model_type': 'graphsage', 'hidden_dims': '[512, 256]', 'dropout': 0.5321601440595698, 'batch_norm': True, 'sage_aggr': 'max', 'sage_normalize': True, 'sage_project': False, 'lr': 0.00038730805051989247, 'weight_decay': 3.2992213775263944e-07, 'epochs': 249, 'loss': 'mae', 'optimizer': 'adam', 'graph_mode': 'cutoff', 'cutoff': 0.8229941631062496, 'grm_norm': 'cosine', 'self_loops': False, 'use_snp_selection': True, 'num_snps': 28720, 'graphsage_batch_size': 16}. Best is trial 19 with value: 0.22264005015541502.
[I 2025-12-06 11:41:38,369] Trial 137 finished with value: 0.210170169835289 and parameters: {'model_type': 'graphsage', 'hidden_dims': '[512, 256]', 'dropout': 0.528202559671255, 'batch_norm': True, 'sage_aggr': 'max', 'sage_normalize': True, 'sage_project': False, 'lr': 0.0004024345313426395, 'weight_decay': 4.2850672576498404e-07, 'epochs': 246, 'loss': 'mae', 'optimizer': 'adam', 'graph_mode': 'cutoff', 'cutoff': 0.8148950409439017, 'grm_norm': 'cosine', 'self_loops': False, 'use_snp_selection': True, 'num_snps': 29775, 'graphsage_batch_size': 16}. Best is trial 19 with value: 0.22264005015541502.
[I 2025-12-06 11:43:19,568] Trial 138 finished with value: 0.20371075834531477 and parameters: {'model_type': 'graphsage', 'hidden_dims': '[512, 256]', 'dropout': 0.5194058136643261, 'batch_norm': True, 'sage_aggr': 'max', 'sage_normalize': True, 'sage_project': False, 'lr': 0.00029454352134430093, 'weight_decay': 3.4231118061579363e-07, 'epochs': 237, 'loss': 'mae', 'optimizer': 'adam', 'graph_mode': 'cutoff', 'cutoff': 0.44772441965220655, 'grm_norm': 'cosine', 'self_loops': False, 'use_snp_selection': True, 'num_snps': 28137, 'graphsage_batch_size': 16}. Best is trial 19 with value: 0.22264005015541502.
[I 2025-12-06 11:44:33,955] Trial 139 finished with value: 0.21322653004947068 and parameters: {'model_type': 'graphsage', 'hidden_dims': '[512, 256]', 'dropout': 0.5639025021545623, 'batch_norm': True, 'sage_aggr': 'max', 'sage_normalize': True, 'sage_project': False, 'lr': 0.0007853251044239672, 'weight_decay': 3.0666525847170866e-07, 'epochs': 247, 'loss': 'mae', 'optimizer': 'adam', 'graph_mode': 'cutoff', 'cutoff': 0.8261118810930066, 'grm_norm': 'cosine', 'self_loops': False, 'use_snp_selection': True, 'num_snps': 25137, 'graphsage_batch_size': 16}. Best is trial 19 with value: 0.22264005015541502.
[I 2025-12-06 11:45:36,928] Trial 140 finished with value: 0.20926320702670562 and parameters: {'model_type': 'graphsage', 'hidden_dims': '[512, 256]', 'dropout': 0.5608859541801223, 'batch_norm': True, 'sage_aggr': 'max', 'sage_normalize': True, 'sage_project': False, 'lr': 0.0008414110667009112, 'weight_decay': 2.2067240065233356e-07, 'epochs': 249, 'loss': 'mae', 'optimizer': 'adam', 'graph_mode': 'cutoff', 'cutoff': 0.6098405987854759, 'grm_norm': 'cosine', 'self_loops': False, 'use_snp_selection': True, 'num_snps': 20305, 'graphsage_batch_size': 16}. Best is trial 19 with value: 0.22264005015541502.
[I 2025-12-06 11:46:45,567] Trial 141 finished with value: 0.20860129476105566 and parameters: {'model_type': 'graphsage', 'hidden_dims': '[512, 256]', 'dropout': 0.5646211890624305, 'batch_norm': True, 'sage_aggr': 'max', 'sage_normalize': True, 'sage_project': False, 'lr': 0.0004746479181188491, 'weight_decay': 1.0011535635805862e-07, 'epochs': 223, 'loss': 'mae', 'optimizer': 'adam', 'graph_mode': 'cutoff', 'cutoff': 0.7932223594805091, 'grm_norm': 'cosine', 'self_loops': False, 'use_snp_selection': True, 'num_snps': 25130, 'graphsage_batch_size': 16}. Best is trial 19 with value: 0.22264005015541502.
[I 2025-12-06 11:48:00,338] Trial 142 finished with value: 0.20709788771041593 and parameters: {'model_type': 'graphsage', 'hidden_dims': '[512, 256]', 'dropout': 0.5798676188507765, 'batch_norm': True, 'sage_aggr': 'max', 'sage_normalize': True, 'sage_project': False, 'lr': 0.0008250938444454322, 'weight_decay': 1.7882863581138688e-07, 'epochs': 234, 'loss': 'mae', 'optimizer': 'adam', 'graph_mode': 'cutoff', 'cutoff': 0.8236869414990905, 'grm_norm': 'cosine', 'self_loops': False, 'use_snp_selection': True, 'num_snps': 26872, 'graphsage_batch_size': 16}. Best is trial 19 with value: 0.22264005015541502.
[I 2025-12-06 11:49:25,206] Trial 143 finished with value: 0.21103884441673415 and parameters: {'model_type': 'graphsage', 'hidden_dims': '[512, 256]', 'dropout': 0.5408931809910055, 'batch_norm': True, 'sage_aggr': 'max', 'sage_normalize': True, 'sage_project': False, 'lr': 0.0005905760243268069, 'weight_decay': 2.972351211524146e-07, 'epochs': 215, 'loss': 'mae', 'optimizer': 'adam', 'graph_mode': 'cutoff', 'cutoff': 0.8488497033663337, 'grm_norm': 'cosine', 'self_loops': False, 'use_snp_selection': True, 'num_snps': 34072, 'graphsage_batch_size': 16}. Best is trial 19 with value: 0.22264005015541502.
[I 2025-12-06 11:50:33,977] Trial 144 finished with value: 0.21989211245398305 and parameters: {'model_type': 'graphsage', 'hidden_dims': '[512, 256]', 'dropout': 0.5998928205451938, 'batch_norm': True, 'sage_aggr': 'max', 'sage_normalize': True, 'sage_project': False, 'lr': 0.0007281240382824956, 'weight_decay': 1.268302909691268e-07, 'epochs': 241, 'loss': 'mae', 'optimizer': 'adam', 'graph_mode': 'cutoff', 'cutoff': 0.8392579363601378, 'grm_norm': 'cosine', 'self_loops': False, 'use_snp_selection': True, 'num_snps': 23489, 'graphsage_batch_size': 16}. Best is trial 19 with value: 0.22264005015541502.
[I 2025-12-06 11:51:44,642] Trial 145 finished with value: 0.20375169185480746 and parameters: {'model_type': 'graphsage', 'hidden_dims': '[512, 256]', 'dropout': 0.5520539668479628, 'batch_norm': False, 'sage_aggr': 'max', 'sage_normalize': True, 'sage_project': False, 'lr': 0.00024908308117405135, 'weight_decay': 1.2675788550025544e-07, 'epochs': 247, 'loss': 'mae', 'optimizer': 'adam', 'graph_mode': 'cutoff', 'cutoff': 0.8022898632116634, 'grm_norm': 'cosine', 'self_loops': False, 'use_snp_selection': True, 'num_snps': 24066, 'graphsage_batch_size': 16}. Best is trial 19 with value: 0.22264005015541502.
[I 2025-12-06 11:52:47,656] Trial 146 finished with value: 0.22172696745376594 and parameters: {'model_type': 'graphsage', 'hidden_dims': '[512, 256]', 'dropout': 0.5948552773848692, 'batch_norm': True, 'sage_aggr': 'max', 'sage_normalize': True, 'sage_project': False, 'lr': 0.0007660514087897937, 'weight_decay': 2.5806280122634813e-07, 'epochs': 229, 'loss': 'mae', 'optimizer': 'adam', 'graph_mode': 'cutoff', 'cutoff': 0.8311447730846228, 'grm_norm': 'cosine', 'self_loops': False, 'use_snp_selection': True, 'num_snps': 22415, 'graphsage_batch_size': 16}. Best is trial 19 with value: 0.22264005015541502.
[I 2025-12-06 11:53:52,535] Trial 147 finished with value: 0.21882293825310778 and parameters: {'model_type': 'graphsage', 'hidden_dims': '[512, 256]', 'dropout': 0.5986451615285315, 'batch_norm': True, 'sage_aggr': 'max', 'sage_normalize': True, 'sage_project': False, 'lr': 0.0007413591461265455, 'weight_decay': 6.599427375155233e-07, 'epochs': 243, 'loss': 'mae', 'optimizer': 'adam', 'graph_mode': 'cutoff', 'cutoff': 0.7574256627151145, 'grm_norm': 'cosine', 'self_loops': False, 'use_snp_selection': True, 'num_snps': 21786, 'graphsage_batch_size': 16}. Best is trial 19 with value: 0.22264005015541502.
[I 2025-12-06 11:54:57,233] Trial 148 finished with value: 0.21300070194114767 and parameters: {'model_type': 'graphsage', 'hidden_dims': '[512, 256]', 'dropout': 0.598836151357991, 'batch_norm': True, 'sage_aggr': 'max', 'sage_normalize': True, 'sage_project': False, 'lr': 0.0007646603305076114, 'weight_decay': 7.124929984527406e-07, 'epochs': 243, 'loss': 'mae', 'optimizer': 'adam', 'graph_mode': 'cutoff', 'cutoff': 0.756158329650816, 'grm_norm': 'cosine', 'self_loops': False, 'use_snp_selection': True, 'num_snps': 21653, 'graphsage_batch_size': 512}. Best is trial 19 with value: 0.22264005015541502.
[I 2025-12-06 11:56:00,971] Trial 149 finished with value: 0.21613296239874105 and parameters: {'model_type': 'graphsage', 'hidden_dims': '[512, 256]', 'dropout': 0.594679927450098, 'batch_norm': True, 'sage_aggr': 'max', 'sage_normalize': True, 'sage_project': False, 'lr': 0.0008264578600795341, 'weight_decay': 5.670558425472738e-07, 'epochs': 244, 'loss': 'mae', 'optimizer': 'adam', 'graph_mode': 'cutoff', 'cutoff': 0.7584045800684612, 'grm_norm': 'cosine', 'self_loops': False, 'use_snp_selection': True, 'num_snps': 21121, 'graphsage_batch_size': 512}. Best is trial 19 with value: 0.22264005015541502.
[I 2025-12-06 11:57:05,800] Trial 0 finished with value: 0.16674062282203797 and parameters: {'model_type': 'graphsage', 'hidden_dims': '[128, 64]', 'dropout': 0.199031432379812, 'batch_norm': True, 'sage_aggr': 'max', 'sage_normalize': False, 'sage_project': False, 'lr': 3.4401453323286906e-05, 'weight_decay': 0.00017802616915745114, 'epochs': 169, 'loss': 'mse', 'optimizer': 'adam', 'graph_mode': 'knn', 'knn_k': 6, 'weighted_edges': True, 'symmetrize_mode': 'mutual', 'self_loops': False, 'use_snp_selection': False, 'graphsage_batch_size': 256}. Best is trial 0 with value: 0.16674062282203797.
[I 2025-12-06 11:58:09,452] Trial 1 finished with value: 0.19442079309274463 and parameters: {'model_type': 'graphsage', 'hidden_dims': '[512, 128]', 'dropout': 0.3737930779596218, 'batch_norm': True, 'sage_aggr': 'mean', 'sage_normalize': False, 'sage_project': False, 'lr': 0.0004485485309869717, 'weight_decay': 2.0046868950224612e-06, 'epochs': 74, 'loss': 'mse', 'optimizer': 'adam', 'graph_mode': 'knn', 'knn_k': 4, 'weighted_edges': True, 'symmetrize_mode': 'union', 'self_loops': False, 'use_snp_selection': False, 'graphsage_batch_size': 8}. Best is trial 1 with value: 0.19442079309274463.
[I 2025-12-06 11:58:54,862] Trial 2 finished with value: 0.18201354791054836 and parameters: {'model_type': 'graphsage', 'hidden_dims': '[256, 128]', 'dropout': 0.2731735750400165, 'batch_norm': False, 'sage_aggr': 'max', 'sage_normalize': True, 'sage_project': False, 'lr': 3.4705625989073525e-05, 'weight_decay': 2.4623319020131338e-05, 'epochs': 95, 'loss': 'mse', 'optimizer': 'adam', 'graph_mode': 'knn', 'knn_k': 6, 'weighted_edges': False, 'symmetrize_mode': 'mutual', 'self_loops': False, 'use_snp_selection': True, 'num_snps': 30713, 'graphsage_batch_size': 8}. Best is trial 1 with value: 0.19442079309274463.
[I 2025-12-06 11:59:56,598] Trial 3 finished with value: 0.2066442594691941 and parameters: {'model_type': 'graphsage', 'hidden_dims': '[256, 128]', 'dropout': 0.3815953422463725, 'batch_norm': False, 'sage_aggr': 'mean', 'sage_normalize': True, 'sage_project': False, 'lr': 2.1095572616816696e-06, 'weight_decay': 5.195307220037778e-07, 'epochs': 226, 'loss': 'mse', 'optimizer': 'adam', 'graph_mode': 'knn', 'knn_k': 8, 'weighted_edges': True, 'symmetrize_mode': 'union', 'self_loops': False, 'use_snp_selection': True, 'num_snps': 16419, 'graphsage_batch_size': 128}. Best is trial 3 with value: 0.2066442594691941.
[I 2025-12-06 12:01:59,861] Trial 4 finished with value: 0.18516653597919447 and parameters: {'model_type': 'graphsage', 'hidden_dims': '[256, 128]', 'dropout': 0.3920979142653378, 'batch_norm': True, 'sage_aggr': 'max', 'sage_normalize': True, 'sage_project': False, 'lr': 3.15214685884738e-06, 'weight_decay': 1.0663862019069792e-05, 'epochs': 212, 'loss': 'mae', 'optimizer': 'adam', 'graph_mode': 'cutoff', 'cutoff': 0.33867046005138823, 'grm_norm': 'gcn', 'self_loops': False, 'use_snp_selection': False, 'graphsage_batch_size': 512}. Best is trial 3 with value: 0.2066442594691941.
[I 2025-12-06 12:02:27,100] Trial 5 finished with value: 0.20340583933928294 and parameters: {'model_type': 'graphsage', 'hidden_dims': '[256, 128]', 'dropout': 0.32925710311863654, 'batch_norm': True, 'sage_aggr': 'mean', 'sage_normalize': True, 'sage_project': False, 'lr': 0.00016905333078305474, 'weight_decay': 6.711044850912148e-06, 'epochs': 127, 'loss': 'mae', 'optimizer': 'adam', 'graph_mode': 'cutoff', 'cutoff': 0.253959783091227, 'grm_norm': 'cosine_then_gcn', 'self_loops': False, 'use_snp_selection': True, 'num_snps': 7419, 'graphsage_batch_size': 64}. Best is trial 3 with value: 0.2066442594691941.
[I 2025-12-06 12:04:37,538] Trial 6 finished with value: 0.16520110873067445 and parameters: {'model_type': 'graphsage', 'hidden_dims': '[512, 64]', 'dropout': 0.2585007811528941, 'batch_norm': True, 'sage_aggr': 'max', 'sage_normalize': False, 'sage_project': False, 'lr': 5.921425508303395e-06, 'weight_decay': 0.0004511561961144237, 'epochs': 136, 'loss': 'mae', 'optimizer': 'adam', 'graph_mode': 'knn', 'knn_k': 9, 'weighted_edges': True, 'symmetrize_mode': 'union', 'self_loops': False, 'use_snp_selection': True, 'num_snps': 34427, 'graphsage_batch_size': 128}. Best is trial 3 with value: 0.2066442594691941.
[I 2025-12-06 12:06:45,480] Trial 7 finished with value: 0.17824652981637712 and parameters: {'model_type': 'graphsage', 'hidden_dims': '[512, 128]', 'dropout': 0.5944584870981006, 'batch_norm': False, 'sage_aggr': 'max', 'sage_normalize': True, 'sage_project': False, 'lr': 7.3241868695773595e-06, 'weight_decay': 1.2565521754060153e-06, 'epochs': 166, 'loss': 'mse', 'optimizer': 'adam', 'graph_mode': 'knn', 'knn_k': 5, 'weighted_edges': False, 'symmetrize_mode': 'mutual', 'self_loops': False, 'use_snp_selection': True, 'num_snps': 50019, 'graphsage_batch_size': 8}. Best is trial 3 with value: 0.2066442594691941.
[I 2025-12-06 12:08:14,685] Trial 8 finished with value: 0.1665633670039227 and parameters: {'model_type': 'graphsage', 'hidden_dims': '[512, 64]', 'dropout': 0.5703535192416116, 'batch_norm': False, 'sage_aggr': 'mean', 'sage_normalize': False, 'sage_project': False, 'lr': 1.823510325310572e-06, 'weight_decay': 0.00013672790135428885, 'epochs': 104, 'loss': 'mae', 'optimizer': 'adam', 'graph_mode': 'knn', 'knn_k': 7, 'weighted_edges': True, 'symmetrize_mode': 'mutual', 'self_loops': False, 'use_snp_selection': True, 'num_snps': 45923, 'graphsage_batch_size': 128}. Best is trial 3 with value: 0.2066442594691941.
[I 2025-12-06 12:10:51,184] Trial 9 finished with value: 0.19717941357851979 and parameters: {'model_type': 'graphsage', 'hidden_dims': '[512, 128]', 'dropout': 0.27261839493092876, 'batch_norm': False, 'sage_aggr': 'mean', 'sage_normalize': False, 'sage_project': False, 'lr': 5.88603310717523e-06, 'weight_decay': 1.0998339923223823e-05, 'epochs': 249, 'loss': 'mae', 'optimizer': 'adam', 'graph_mode': 'knn', 'knn_k': 3, 'weighted_edges': False, 'symmetrize_mode': 'mutual', 'self_loops': False, 'use_snp_selection': False, 'graphsage_batch_size': 128}. Best is trial 3 with value: 0.2066442594691941.
[I 2025-12-06 12:11:25,515] Trial 10 finished with value: 0.18548634035684225 and parameters: {'model_type': 'graphsage', 'hidden_dims': '[512, 256]', 'dropout': 0.4697146875681737, 'batch_norm': False, 'sage_aggr': 'mean', 'sage_normalize': True, 'sage_project': False, 'lr': 1.0395039389455004e-06, 'weight_decay': 1.2257443862615642e-07, 'epochs': 215, 'loss': 'mse', 'optimizer': 'adam', 'graph_mode': 'cutoff', 'cutoff': 0.8339492830671671, 'grm_norm': 'none', 'self_loops': False, 'use_snp_selection': True, 'num_snps': 8873, 'graphsage_batch_size': 32}. Best is trial 3 with value: 0.2066442594691941.
[I 2025-12-06 12:11:51,375] Trial 11 finished with value: 0.18723788102803512 and parameters: {'model_type': 'graphsage', 'hidden_dims': '[256, 128]', 'dropout': 0.4442074440481004, 'batch_norm': True, 'sage_aggr': 'mean', 'sage_normalize': True, 'sage_project': False, 'lr': 0.00024576597189725224, 'weight_decay': 2.810356528079821e-07, 'epochs': 132, 'loss': 'mae', 'optimizer': 'adam', 'graph_mode': 'cutoff', 'cutoff': 0.2186298383723732, 'grm_norm': 'cosine_then_gcn', 'self_loops': False, 'use_snp_selection': True, 'num_snps': 5355, 'graphsage_batch_size': 64}. Best is trial 3 with value: 0.2066442594691941.
