[I 2025-12-08 18:54:08,859] Trial 43 finished with value: 0.3008353422650478 and parameters: {'model_type': 'graphsage', 'hidden_dims': '[512, 256]', 'dropout': 0.3696936179539868, 'batch_norm': True, 'sage_aggr': 'mean', 'sage_normalize': True, 'sage_project': False, 'lr': 0.0009661507995082109, 'weight_decay': 5.043891728775972e-05, 'epochs': 143, 'loss': 'mae', 'optimizer': 'adam', 'graph_mode': 'knn', 'knn_k': 3, 'weighted_edges': False, 'symmetrize_mode': 'union', 'self_loops': True, 'use_snp_selection': True, 'num_snps': 49424}. Best is trial 36 with value: 0.3048852938541998.
[I 2025-12-08 18:55:25,186] Trial 44 finished with value: 0.3032096728746697 and parameters: {'model_type': 'graphsage', 'hidden_dims': '[512, 64]', 'dropout': 0.2926379307439122, 'batch_norm': True, 'sage_aggr': 'mean', 'sage_normalize': True, 'sage_project': False, 'lr': 0.0032152190064511903, 'weight_decay': 0.0009499659164785227, 'epochs': 87, 'loss': 'mse', 'optimizer': 'adam', 'graph_mode': 'knn', 'knn_k': 7, 'weighted_edges': False, 'symmetrize_mode': 'union', 'self_loops': False, 'use_snp_selection': True, 'num_snps': 29689}. Best is trial 36 with value: 0.3048852938541998.
[I 2025-12-08 18:56:56,005] Trial 45 finished with value: 0.2902552762023344 and parameters: {'model_type': 'graphsage', 'hidden_dims': '[512, 64]', 'dropout': 0.22899142690826602, 'batch_norm': True, 'sage_aggr': 'max', 'sage_normalize': True, 'sage_project': False, 'lr': 0.0030253731855395655, 'weight_decay': 0.0008318260300383067, 'epochs': 88, 'loss': 'mse', 'optimizer': 'adam', 'graph_mode': 'knn', 'knn_k': 10, 'weighted_edges': True, 'symmetrize_mode': 'union', 'self_loops': False, 'use_snp_selection': True, 'num_snps': 29116}. Best is trial 36 with value: 0.3048852938541998.
[I 2025-12-08 18:57:56,549] Trial 46 finished with value: 0.28917979210338945 and parameters: {'model_type': 'graphsage', 'hidden_dims': '[512, 64]', 'dropout': 0.28485149685674316, 'batch_norm': True, 'sage_aggr': 'mean', 'sage_normalize': True, 'sage_project': False, 'lr': 0.005233221251735373, 'weight_decay': 0.0005579630242346412, 'epochs': 119, 'loss': 'mae', 'optimizer': 'adam', 'graph_mode': 'knn', 'knn_k': 7, 'weighted_edges': False, 'symmetrize_mode': 'union', 'self_loops': False, 'use_snp_selection': True, 'num_snps': 19483}. Best is trial 36 with value: 0.3048852938541998.
[I 2025-12-08 18:59:18,691] Trial 47 finished with value: 0.28752253705397346 and parameters: {'model_type': 'graphsage', 'hidden_dims': '[512, 64]', 'dropout': 0.30891720786470456, 'batch_norm': True, 'sage_aggr': 'mean', 'sage_normalize': False, 'sage_project': False, 'lr': 1.0087771566710249e-05, 'weight_decay': 0.00035880373971083906, 'epochs': 95, 'loss': 'mse', 'optimizer': 'adam', 'graph_mode': 'knn', 'knn_k': 6, 'weighted_edges': False, 'symmetrize_mode': 'union', 'self_loops': False, 'use_snp_selection': True, 'num_snps': 33501}. Best is trial 36 with value: 0.3048852938541998.
[I 2025-12-08 19:00:01,027] Trial 48 finished with value: 0.29554495568011147 and parameters: {'model_type': 'graphsage', 'hidden_dims': '[512, 64]', 'dropout': 0.24337358674172807, 'batch_norm': True, 'sage_aggr': 'max', 'sage_normalize': True, 'sage_project': False, 'lr': 0.0003600396297538745, 'weight_decay': 0.0002456608439251981, 'epochs': 66, 'loss': 'mse', 'optimizer': 'adam', 'graph_mode': 'knn', 'knn_k': 8, 'weighted_edges': False, 'symmetrize_mode': 'union', 'self_loops': False, 'use_snp_selection': True, 'num_snps': 12960}. Best is trial 36 with value: 0.3048852938541998.
[I 2025-12-08 19:00:58,049] Trial 49 finished with value: 0.2902123794920951 and parameters: {'model_type': 'graphsage', 'hidden_dims': '[512, 128]', 'dropout': 0.33835269647670485, 'batch_norm': True, 'sage_aggr': 'mean', 'sage_normalize': True, 'sage_project': False, 'lr': 0.0022014690860455034, 'weight_decay': 0.0006239410120985047, 'epochs': 42, 'loss': 'mse', 'optimizer': 'adam', 'graph_mode': 'knn', 'knn_k': 2, 'weighted_edges': True, 'symmetrize_mode': 'union', 'self_loops': False, 'use_snp_selection': True, 'num_snps': 43179}. Best is trial 36 with value: 0.3048852938541998.
[I 2025-12-08 19:01:28,899] Trial 50 finished with value: 0.2810963551874453 and parameters: {'model_type': 'graphsage', 'hidden_dims': '[128, 64]', 'dropout': 0.18529722420521785, 'batch_norm': True, 'sage_aggr': 'mean', 'sage_normalize': False, 'sage_project': False, 'lr': 0.00021159910694949384, 'weight_decay': 9.971453617220844e-07, 'epochs': 114, 'loss': 'mae', 'optimizer': 'adam', 'graph_mode': 'knn', 'knn_k': 4, 'weighted_edges': False, 'symmetrize_mode': 'mutual', 'self_loops': False, 'use_snp_selection': False}. Best is trial 36 with value: 0.3048852938541998.
[I 2025-12-08 19:03:34,699] Trial 51 finished with value: 0.301477167263258 and parameters: {'model_type': 'graphsage', 'hidden_dims': '[512, 256]', 'dropout': 0.4073031031054511, 'batch_norm': True, 'sage_aggr': 'mean', 'sage_normalize': True, 'sage_project': False, 'lr': 0.0014832902709735793, 'weight_decay': 0.00020316867638702643, 'epochs': 174, 'loss': 'mse', 'optimizer': 'adam', 'graph_mode': 'knn', 'knn_k': 5, 'weighted_edges': False, 'symmetrize_mode': 'union', 'self_loops': True, 'use_snp_selection': True, 'num_snps': 36502}. Best is trial 36 with value: 0.3048852938541998.
[I 2025-12-08 19:06:22,593] Trial 52 finished with value: 0.29885139848561326 and parameters: {'model_type': 'graphsage', 'hidden_dims': '[512, 256]', 'dropout': 0.2631238521618052, 'batch_norm': True, 'sage_aggr': 'mean', 'sage_normalize': True, 'sage_project': False, 'lr': 0.0029729068527060867, 'weight_decay': 0.000947381091849078, 'epochs': 138, 'loss': 'mse', 'optimizer': 'adam', 'graph_mode': 'knn', 'knn_k': 6, 'weighted_edges': False, 'symmetrize_mode': 'union', 'self_loops': True, 'use_snp_selection': True, 'num_snps': 54140}. Best is trial 36 with value: 0.3048852938541998.
[I 2025-12-08 19:08:04,866] Trial 53 finished with value: 0.30001027743713665 and parameters: {'model_type': 'graphsage', 'hidden_dims': '[512, 256]', 'dropout': 0.29319742098413576, 'batch_norm': True, 'sage_aggr': 'mean', 'sage_normalize': True, 'sage_project': False, 'lr': 0.0007089642449584794, 'weight_decay': 1.0463337301128178e-05, 'epochs': 199, 'loss': 'mse', 'optimizer': 'adam', 'graph_mode': 'knn', 'knn_k': 6, 'weighted_edges': False, 'symmetrize_mode': 'union', 'self_loops': True, 'use_snp_selection': True, 'num_snps': 24826}. Best is trial 36 with value: 0.3048852938541998.
[I 2025-12-08 19:10:19,246] Trial 54 finished with value: 0.29764135523668844 and parameters: {'model_type': 'graphsage', 'hidden_dims': '[512, 64]', 'dropout': 0.4305978276187113, 'batch_norm': True, 'sage_aggr': 'mean', 'sage_normalize': True, 'sage_project': False, 'lr': 0.00046340286502747984, 'weight_decay': 0.00014515286298817824, 'epochs': 143, 'loss': 'mse', 'optimizer': 'adam', 'graph_mode': 'knn', 'knn_k': 7, 'weighted_edges': False, 'symmetrize_mode': 'union', 'self_loops': True, 'use_snp_selection': True, 'num_snps': 39554}. Best is trial 36 with value: 0.3048852938541998.
[I 2025-12-08 19:11:13,696] Trial 55 finished with value: 0.26187561340896287 and parameters: {'model_type': 'graphsage', 'hidden_dims': '[256, 128, 64]', 'dropout': 0.3324323918902979, 'batch_norm': True, 'sage_aggr': 'mean', 'sage_normalize': True, 'sage_project': False, 'lr': 0.009702619296371093, 'weight_decay': 0.00043270204693462186, 'epochs': 155, 'loss': 'mse', 'optimizer': 'adam', 'graph_mode': 'cutoff', 'cutoff': 0.8487019908595222, 'grm_norm': 'cosine_then_gcn', 'self_loops': True, 'use_snp_selection': True, 'num_snps': 31458}. Best is trial 36 with value: 0.3048852938541998.
[I 2025-12-08 19:12:11,177] Trial 56 finished with value: 0.28687428196302767 and parameters: {'model_type': 'graphsage', 'hidden_dims': '[512, 256]', 'dropout': 0.38024037968133995, 'batch_norm': True, 'sage_aggr': 'mean', 'sage_normalize': True, 'sage_project': False, 'lr': 0.00012619955939290083, 'weight_decay': 4.267758580974968e-07, 'epochs': 91, 'loss': 'mse', 'optimizer': 'adam', 'graph_mode': 'knn', 'knn_k': 5, 'weighted_edges': False, 'symmetrize_mode': 'mutual', 'self_loops': True, 'use_snp_selection': False}. Best is trial 36 with value: 0.3048852938541998.
[I 2025-12-08 19:12:37,550] Trial 57 finished with value: 0.3050860871677357 and parameters: {'model_type': 'graphsage', 'hidden_dims': '[256, 128]', 'dropout': 0.3990003730749475, 'batch_norm': True, 'sage_aggr': 'max', 'sage_normalize': True, 'sage_project': False, 'lr': 0.0017137376254733208, 'weight_decay': 1.905945926014683e-07, 'epochs': 71, 'loss': 'mse', 'optimizer': 'adam', 'graph_mode': 'cutoff', 'cutoff': 0.7739310560194004, 'grm_norm': 'cosine_then_gcn', 'self_loops': False, 'use_snp_selection': False}. Best is trial 57 with value: 0.3050860871677357.
[I 2025-12-08 19:13:00,955] Trial 58 finished with value: 0.3069802792355041 and parameters: {'model_type': 'graphsage', 'hidden_dims': '[256, 128]', 'dropout': 0.40476109236586927, 'batch_norm': True, 'sage_aggr': 'max', 'sage_normalize': True, 'sage_project': False, 'lr': 0.0025736501040318203, 'weight_decay': 1.8149076354438435e-07, 'epochs': 56, 'loss': 'mse', 'optimizer': 'adam', 'graph_mode': 'cutoff', 'cutoff': 0.7847775624679948, 'grm_norm': 'cosine_then_gcn', 'self_loops': False, 'use_snp_selection': False}. Best is trial 58 with value: 0.3069802792355041.
[I 2025-12-08 19:13:23,687] Trial 59 finished with value: 0.3102073321407814 and parameters: {'model_type': 'graphsage', 'hidden_dims': '[256, 128]', 'dropout': 0.4025762604647104, 'batch_norm': True, 'sage_aggr': 'max', 'sage_normalize': False, 'sage_project': False, 'lr': 0.0059947235453531875, 'weight_decay': 1.6313349473124243e-07, 'epochs': 54, 'loss': 'mse', 'optimizer': 'adam', 'graph_mode': 'cutoff', 'cutoff': 0.7855607047055961, 'grm_norm': 'cosine_then_gcn', 'self_loops': False, 'use_snp_selection': False}. Best is trial 59 with value: 0.3102073321407814.
[I 2025-12-08 19:13:46,048] Trial 60 finished with value: 0.0 and parameters: {'model_type': 'graphsage', 'hidden_dims': '[256, 128]', 'dropout': 0.4012824086697976, 'batch_norm': False, 'sage_aggr': 'max', 'sage_normalize': False, 'sage_project': False, 'lr': 0.006861954794613312, 'weight_decay': 1.8161833034126532e-07, 'epochs': 53, 'loss': 'mse', 'optimizer': 'adam', 'graph_mode': 'cutoff', 'cutoff': 0.7804442889918491, 'grm_norm': 'cosine_then_gcn', 'self_loops': False, 'use_snp_selection': False}. Best is trial 59 with value: 0.3102073321407814.
[I 2025-12-08 19:14:11,100] Trial 61 finished with value: 0.3037577450839194 and parameters: {'model_type': 'graphsage', 'hidden_dims': '[256, 128]', 'dropout': 0.4384149991620761, 'batch_norm': True, 'sage_aggr': 'max', 'sage_normalize': False, 'sage_project': False, 'lr': 0.003997680752160525, 'weight_decay': 1.0703345563550684e-07, 'epochs': 65, 'loss': 'mse', 'optimizer': 'adam', 'graph_mode': 'cutoff', 'cutoff': 0.7056854294046545, 'grm_norm': 'cosine_then_gcn', 'self_loops': False, 'use_snp_selection': False}. Best is trial 59 with value: 0.3102073321407814.
[I 2025-12-08 19:14:37,620] Trial 62 finished with value: 0.3040657002840626 and parameters: {'model_type': 'graphsage', 'hidden_dims': '[256, 128]', 'dropout': 0.42430335634708116, 'batch_norm': True, 'sage_aggr': 'max', 'sage_normalize': False, 'sage_project': False, 'lr': 0.0048225515645227875, 'weight_decay': 1.0119775690965066e-07, 'epochs': 72, 'loss': 'mse', 'optimizer': 'adam', 'graph_mode': 'cutoff', 'cutoff': 0.7247189321368881, 'grm_norm': 'cosine_then_gcn', 'self_loops': False, 'use_snp_selection': False}. Best is trial 59 with value: 0.3102073321407814.
[I 2025-12-08 19:15:04,554] Trial 63 finished with value: 0.30229083672005175 and parameters: {'model_type': 'graphsage', 'hidden_dims': '[256, 128]', 'dropout': 0.4396052911454323, 'batch_norm': True, 'sage_aggr': 'max', 'sage_normalize': False, 'sage_project': False, 'lr': 0.004658153348111675, 'weight_decay': 1.0005158184871632e-07, 'epochs': 74, 'loss': 'mse', 'optimizer': 'adam', 'graph_mode': 'cutoff', 'cutoff': 0.716940568840194, 'grm_norm': 'cosine_then_gcn', 'self_loops': False, 'use_snp_selection': False}. Best is trial 59 with value: 0.3102073321407814.
[I 2025-12-08 19:15:27,089] Trial 64 finished with value: 0.3104074760978193 and parameters: {'model_type': 'graphsage', 'hidden_dims': '[256, 128]', 'dropout': 0.4196667716063873, 'batch_norm': True, 'sage_aggr': 'max', 'sage_normalize': False, 'sage_project': False, 'lr': 0.007272658916333097, 'weight_decay': 1.5961906258849362e-07, 'epochs': 53, 'loss': 'mse', 'optimizer': 'adam', 'graph_mode': 'cutoff', 'cutoff': 0.6716496894178394, 'grm_norm': 'cosine_then_gcn', 'self_loops': False, 'use_snp_selection': False}. Best is trial 64 with value: 0.3104074760978193.
[I 2025-12-08 19:15:49,778] Trial 65 finished with value: 0.30825758007864873 and parameters: {'model_type': 'graphsage', 'hidden_dims': '[256, 128]', 'dropout': 0.4146700631122846, 'batch_norm': True, 'sage_aggr': 'max', 'sage_normalize': False, 'sage_project': False, 'lr': 0.00770979938491715, 'weight_decay': 1.5399360959803915e-07, 'epochs': 54, 'loss': 'mse', 'optimizer': 'adam', 'graph_mode': 'cutoff', 'cutoff': 0.6919674915999688, 'grm_norm': 'cosine_then_gcn', 'self_loops': False, 'use_snp_selection': False}. Best is trial 64 with value: 0.3104074760978193.
[I 2025-12-08 19:16:11,865] Trial 66 finished with value: 0.3074693529524773 and parameters: {'model_type': 'graphsage', 'hidden_dims': '[256, 128]', 'dropout': 0.4196992188257467, 'batch_norm': True, 'sage_aggr': 'max', 'sage_normalize': False, 'sage_project': False, 'lr': 0.007493597898021894, 'weight_decay': 1.6811033680363113e-07, 'epochs': 51, 'loss': 'mse', 'optimizer': 'adam', 'graph_mode': 'cutoff', 'cutoff': 0.7542564720110854, 'grm_norm': 'cosine_then_gcn', 'self_loops': False, 'use_snp_selection': False}. Best is trial 64 with value: 0.3104074760978193.
[I 2025-12-08 19:16:33,690] Trial 67 finished with value: 0.3089454810508133 and parameters: {'model_type': 'graphsage', 'hidden_dims': '[256, 128]', 'dropout': 0.41544492925739585, 'batch_norm': True, 'sage_aggr': 'max', 'sage_normalize': False, 'sage_project': False, 'lr': 0.007389189472636949, 'weight_decay': 2.1336968964363023e-07, 'epochs': 50, 'loss': 'mse', 'optimizer': 'adam', 'graph_mode': 'cutoff', 'cutoff': 0.7870144754716784, 'grm_norm': 'cosine_then_gcn', 'self_loops': False, 'use_snp_selection': False}. Best is trial 64 with value: 0.3104074760978193.
[I 2025-12-08 19:16:55,808] Trial 68 finished with value: 0.002932186767737205 and parameters: {'model_type': 'graphsage', 'hidden_dims': '[256, 128]', 'dropout': 0.41812422815288197, 'batch_norm': False, 'sage_aggr': 'max', 'sage_normalize': False, 'sage_project': False, 'lr': 0.007349257519986733, 'weight_decay': 1.622180914065399e-07, 'epochs': 52, 'loss': 'mse', 'optimizer': 'adam', 'graph_mode': 'cutoff', 'cutoff': 0.7892719545277858, 'grm_norm': 'cosine_then_gcn', 'self_loops': False, 'use_snp_selection': False}. Best is trial 64 with value: 0.3104074760978193.
[I 2025-12-08 19:17:18,140] Trial 69 finished with value: 0.3085183696431165 and parameters: {'model_type': 'graphsage', 'hidden_dims': '[256, 128]', 'dropout': 0.4859766509672119, 'batch_norm': True, 'sage_aggr': 'max', 'sage_normalize': False, 'sage_project': False, 'lr': 0.007621928932027581, 'weight_decay': 2.7299268302789264e-07, 'epochs': 52, 'loss': 'mse', 'optimizer': 'adam', 'graph_mode': 'cutoff', 'cutoff': 0.6585906796080504, 'grm_norm': 'cosine_then_gcn', 'self_loops': False, 'use_snp_selection': False}. Best is trial 64 with value: 0.3104074760978193.
[I 2025-12-08 19:17:40,564] Trial 70 finished with value: 0.3101116991015391 and parameters: {'model_type': 'graphsage', 'hidden_dims': '[256, 128]', 'dropout': 0.4944670756203767, 'batch_norm': True, 'sage_aggr': 'max', 'sage_normalize': False, 'sage_project': False, 'lr': 0.006846506853757191, 'weight_decay': 2.6080285868002113e-07, 'epochs': 51, 'loss': 'mse', 'optimizer': 'adam', 'graph_mode': 'cutoff', 'cutoff': 0.5747094729514773, 'grm_norm': 'cosine_then_gcn', 'self_loops': False, 'use_snp_selection': False}. Best is trial 64 with value: 0.3104074760978193.
[I 2025-12-08 19:18:04,264] Trial 71 finished with value: 0.30039198634147807 and parameters: {'model_type': 'graphsage', 'hidden_dims': '[256, 128]', 'dropout': 0.5016177539039566, 'batch_norm': True, 'sage_aggr': 'max', 'sage_normalize': False, 'sage_project': False, 'lr': 0.007264941347454196, 'weight_decay': 2.8543713670844267e-07, 'epochs': 56, 'loss': 'mse', 'optimizer': 'adam', 'graph_mode': 'cutoff', 'cutoff': 0.5534898229634397, 'grm_norm': 'cosine_then_gcn', 'self_loops': False, 'use_snp_selection': False}. Best is trial 64 with value: 0.3104074760978193.
[I 2025-12-08 19:18:24,831] Trial 72 finished with value: 0.30757147377873395 and parameters: {'model_type': 'graphsage', 'hidden_dims': '[256, 128]', 'dropout': 0.5279597199655394, 'batch_norm': True, 'sage_aggr': 'max', 'sage_normalize': False, 'sage_project': False, 'lr': 0.008447978798292777, 'weight_decay': 4.5102193237777346e-07, 'epochs': 44, 'loss': 'mse', 'optimizer': 'adam', 'graph_mode': 'cutoff', 'cutoff': 0.6660997336862998, 'grm_norm': 'cosine_then_gcn', 'self_loops': False, 'use_snp_selection': False}. Best is trial 64 with value: 0.3104074760978193.
[I 2025-12-08 19:18:44,565] Trial 73 finished with value: 0.3080174176998366 and parameters: {'model_type': 'graphsage', 'hidden_dims': '[256, 128]', 'dropout': 0.5223044412947366, 'batch_norm': True, 'sage_aggr': 'max', 'sage_normalize': False, 'sage_project': False, 'lr': 0.008002748638968235, 'weight_decay': 4.3398699136447783e-07, 'epochs': 40, 'loss': 'mse', 'optimizer': 'adam', 'graph_mode': 'cutoff', 'cutoff': 0.6608836718584468, 'grm_norm': 'cosine_then_gcn', 'self_loops': False, 'use_snp_selection': False}. Best is trial 64 with value: 0.3104074760978193.
[I 2025-12-08 19:19:04,508] Trial 74 finished with value: 0.30458816345946793 and parameters: {'model_type': 'graphsage', 'hidden_dims': '[256, 128]', 'dropout': 0.5259628237930715, 'batch_norm': True, 'sage_aggr': 'max', 'sage_normalize': False, 'sage_project': False, 'lr': 0.0060732434630140384, 'weight_decay': 3.7591721652198316e-07, 'epochs': 41, 'loss': 'mse', 'optimizer': 'adam', 'graph_mode': 'cutoff', 'cutoff': 0.660919585890971, 'grm_norm': 'cosine_then_gcn', 'self_loops': False, 'use_snp_selection': False}. Best is trial 64 with value: 0.3104074760978193.
[I 2025-12-08 19:19:25,742] Trial 75 finished with value: 0.30545858910414686 and parameters: {'model_type': 'graphsage', 'hidden_dims': '[256, 128]', 'dropout': 0.5695338561464318, 'batch_norm': True, 'sage_aggr': 'max', 'sage_normalize': False, 'sage_project': False, 'lr': 0.008721095233508776, 'weight_decay': 5.626976013442558e-07, 'epochs': 46, 'loss': 'mse', 'optimizer': 'adam', 'graph_mode': 'cutoff', 'cutoff': 0.5811299218607114, 'grm_norm': 'cosine_then_gcn', 'self_loops': False, 'use_snp_selection': False}. Best is trial 64 with value: 0.3104074760978193.
[I 2025-12-08 19:19:54,021] Trial 76 finished with value: 0.30664417937378735 and parameters: {'model_type': 'graphsage', 'hidden_dims': '[256, 128]', 'dropout': 0.5491573069613869, 'batch_norm': True, 'sage_aggr': 'max', 'sage_normalize': False, 'sage_project': False, 'lr': 0.009973009292836803, 'weight_decay': 2.524310382428892e-07, 'epochs': 80, 'loss': 'mse', 'optimizer': 'adam', 'graph_mode': 'cutoff', 'cutoff': 0.6345428930683045, 'grm_norm': 'cosine_then_gcn', 'self_loops': False, 'use_snp_selection': False}. Best is trial 64 with value: 0.3104074760978193.
[I 2025-12-08 19:20:18,226] Trial 77 finished with value: 0.31041190250428563 and parameters: {'model_type': 'graphsage', 'hidden_dims': '[256, 128]', 'dropout': 0.5123449309771201, 'batch_norm': True, 'sage_aggr': 'max', 'sage_normalize': False, 'sage_project': False, 'lr': 0.00580735943187486, 'weight_decay': 6.947919549029104e-07, 'epochs': 61, 'loss': 'mse', 'optimizer': 'adam', 'graph_mode': 'cutoff', 'cutoff': 0.6756045704950345, 'grm_norm': 'cosine_then_gcn', 'self_loops': False, 'use_snp_selection': False}. Best is trial 77 with value: 0.31041190250428563.
[I 2025-12-08 19:20:43,099] Trial 78 finished with value: 0.03185848764307612 and parameters: {'model_type': 'graphsage', 'hidden_dims': '[256, 128]', 'dropout': 0.5941029129752968, 'batch_norm': False, 'sage_aggr': 'max', 'sage_normalize': False, 'sage_project': False, 'lr': 0.005831247698458565, 'weight_decay': 1.3062992439184836e-07, 'epochs': 64, 'loss': 'mse', 'optimizer': 'adam', 'graph_mode': 'cutoff', 'cutoff': 0.5942096284021245, 'grm_norm': 'cosine_then_gcn', 'self_loops': False, 'use_snp_selection': False}. Best is trial 77 with value: 0.31041190250428563.
[I 2025-12-08 19:21:07,096] Trial 79 finished with value: 0.30317536763265107 and parameters: {'model_type': 'graphsage', 'hidden_dims': '[256, 128]', 'dropout': 0.48938897524379615, 'batch_norm': True, 'sage_aggr': 'max', 'sage_normalize': False, 'sage_project': False, 'lr': 0.004473649932542529, 'weight_decay': 7.658845411274744e-07, 'epochs': 60, 'loss': 'mse', 'optimizer': 'adam', 'graph_mode': 'cutoff', 'cutoff': 0.674430781574816, 'grm_norm': 'cosine_then_gcn', 'self_loops': False, 'use_snp_selection': False}. Best is trial 77 with value: 0.31041190250428563.
[I 2025-12-08 19:21:28,347] Trial 80 finished with value: 0.3017169836365269 and parameters: {'model_type': 'graphsage', 'hidden_dims': '[256, 128]', 'dropout': 0.4666640588208264, 'batch_norm': True, 'sage_aggr': 'max', 'sage_normalize': False, 'sage_project': False, 'lr': 0.0061781103922619405, 'weight_decay': 2.3183368587798208e-07, 'epochs': 47, 'loss': 'mse', 'optimizer': 'adam', 'graph_mode': 'cutoff', 'cutoff': 0.632705341034364, 'grm_norm': 'cosine_then_gcn', 'self_loops': False, 'use_snp_selection': False}. Best is trial 77 with value: 0.31041190250428563.
