[I 2025-12-06 05:53:36,493] Trial 139 finished with value: 0.23298764620029302 and parameters: {'model_type': 'graphsage', 'hidden_dims': '[512, 64]', 'dropout': 0.10718573954144575, 'batch_norm': False, 'sage_aggr': 'mean', 'sage_normalize': False, 'sage_project': False, 'lr': 3.008355267267116e-05, 'weight_decay': 0.0002854112061312394, 'epochs': 191, 'loss': 'mae', 'optimizer': 'adam', 'graph_mode': 'cutoff', 'cutoff': 0.24063984485035045, 'grm_norm': 'cosine_then_gcn', 'self_loops': False, 'use_snp_selection': False, 'graphsage_batch_size': 64}. Best is trial 72 with value: 0.24785014245637355.
[I 2025-12-06 05:56:04,737] Trial 140 finished with value: 0.229314477306509 and parameters: {'model_type': 'graphsage', 'hidden_dims': '[512, 64]', 'dropout': 0.16373576235589543, 'batch_norm': False, 'sage_aggr': 'max', 'sage_normalize': False, 'sage_project': False, 'lr': 1.767868847394345e-05, 'weight_decay': 0.00013845913407376607, 'epochs': 224, 'loss': 'mae', 'optimizer': 'adam', 'graph_mode': 'cutoff', 'cutoff': 0.29157639596881413, 'grm_norm': 'cosine', 'self_loops': False, 'use_snp_selection': False, 'graphsage_batch_size': 64}. Best is trial 72 with value: 0.24785014245637355.
[I 2025-12-06 05:58:29,500] Trial 141 finished with value: 0.24504858144145478 and parameters: {'model_type': 'graphsage', 'hidden_dims': '[512, 128]', 'dropout': 0.12505838824107834, 'batch_norm': False, 'sage_aggr': 'mean', 'sage_normalize': False, 'sage_project': False, 'lr': 4.85372116827091e-05, 'weight_decay': 3.7497342865534084e-05, 'epochs': 231, 'loss': 'mae', 'optimizer': 'adam', 'graph_mode': 'cutoff', 'cutoff': 0.28077824240106103, 'grm_norm': 'cosine_then_gcn', 'self_loops': False, 'use_snp_selection': False, 'graphsage_batch_size': 128}. Best is trial 72 with value: 0.24785014245637355.
[I 2025-12-06 06:00:55,051] Trial 142 finished with value: 0.2391629213148878 and parameters: {'model_type': 'graphsage', 'hidden_dims': '[512, 128]', 'dropout': 0.1212027565567605, 'batch_norm': False, 'sage_aggr': 'mean', 'sage_normalize': False, 'sage_project': False, 'lr': 8.212855702596963e-05, 'weight_decay': 3.642248907968328e-05, 'epochs': 231, 'loss': 'mae', 'optimizer': 'adam', 'graph_mode': 'cutoff', 'cutoff': 0.2792482785865311, 'grm_norm': 'cosine_then_gcn', 'self_loops': False, 'use_snp_selection': False, 'graphsage_batch_size': 128}. Best is trial 72 with value: 0.24785014245637355.
[I 2025-12-06 06:03:21,380] Trial 143 finished with value: 0.23034499653079776 and parameters: {'model_type': 'graphsage', 'hidden_dims': '[512, 128]', 'dropout': 0.12326738036318294, 'batch_norm': False, 'sage_aggr': 'mean', 'sage_normalize': False, 'sage_project': False, 'lr': 8.284804899654226e-05, 'weight_decay': 0.00019229196678289973, 'epochs': 230, 'loss': 'mae', 'optimizer': 'adam', 'graph_mode': 'cutoff', 'cutoff': 0.2757372521409951, 'grm_norm': 'cosine_then_gcn', 'self_loops': False, 'use_snp_selection': False, 'graphsage_batch_size': 128}. Best is trial 72 with value: 0.24785014245637355.
[I 2025-12-06 06:06:01,487] Trial 144 finished with value: 0.23500480335077567 and parameters: {'model_type': 'graphsage', 'hidden_dims': '[512, 128]', 'dropout': 0.1413373636021634, 'batch_norm': False, 'sage_aggr': 'mean', 'sage_normalize': False, 'sage_project': False, 'lr': 5.110256851316264e-05, 'weight_decay': 0.0005235620140626208, 'epochs': 243, 'loss': 'mae', 'optimizer': 'adam', 'graph_mode': 'cutoff', 'cutoff': 0.26242308142668963, 'grm_norm': 'cosine_then_gcn', 'self_loops': False, 'use_snp_selection': False, 'graphsage_batch_size': 128}. Best is trial 72 with value: 0.24785014245637355.
[I 2025-12-06 06:08:25,028] Trial 145 finished with value: 0.23879772535600333 and parameters: {'model_type': 'graphsage', 'hidden_dims': '[512, 128]', 'dropout': 0.12984706106007632, 'batch_norm': False, 'sage_aggr': 'mean', 'sage_normalize': False, 'sage_project': False, 'lr': 0.00014590562350473438, 'weight_decay': 3.827150202924309e-05, 'epochs': 232, 'loss': 'mse', 'optimizer': 'adam', 'graph_mode': 'cutoff', 'cutoff': 0.2853294418325246, 'grm_norm': 'cosine_then_gcn', 'self_loops': False, 'use_snp_selection': False, 'graphsage_batch_size': 128}. Best is trial 72 with value: 0.24785014245637355.
[I 2025-12-06 06:10:50,393] Trial 146 finished with value: 0.238547183625122 and parameters: {'model_type': 'graphsage', 'hidden_dims': '[512, 128]', 'dropout': 0.18410643487312195, 'batch_norm': False, 'sage_aggr': 'mean', 'sage_normalize': False, 'sage_project': False, 'lr': 0.0001851758710610689, 'weight_decay': 3.63697205889671e-05, 'epochs': 239, 'loss': 'mse', 'optimizer': 'adam', 'graph_mode': 'cutoff', 'cutoff': 0.290942999381421, 'grm_norm': 'cosine_then_gcn', 'self_loops': False, 'use_snp_selection': False, 'graphsage_batch_size': 128}. Best is trial 72 with value: 0.24785014245637355.
[I 2025-12-06 06:13:10,013] Trial 147 finished with value: 0.1974978374710241 and parameters: {'model_type': 'graphsage', 'hidden_dims': '[512, 128]', 'dropout': 0.18813626952598503, 'batch_norm': False, 'sage_aggr': 'mean', 'sage_normalize': False, 'sage_project': False, 'lr': 0.00023139128467939378, 'weight_decay': 3.8598180534711264e-05, 'epochs': 239, 'loss': 'mse', 'optimizer': 'adam', 'graph_mode': 'cutoff', 'cutoff': 0.3075650791928193, 'grm_norm': 'cosine_then_gcn', 'self_loops': False, 'use_snp_selection': False, 'graphsage_batch_size': 128}. Best is trial 72 with value: 0.24785014245637355.
[I 2025-12-06 06:15:32,626] Trial 148 finished with value: 0.21992099930423842 and parameters: {'model_type': 'graphsage', 'hidden_dims': '[512, 128]', 'dropout': 0.17932875816151816, 'batch_norm': True, 'sage_aggr': 'mean', 'sage_normalize': False, 'sage_project': False, 'lr': 0.00012747112688236815, 'weight_decay': 1.8622011266014708e-05, 'epochs': 233, 'loss': 'mse', 'optimizer': 'adam', 'graph_mode': 'cutoff', 'cutoff': 0.28968741730022685, 'grm_norm': 'cosine_then_gcn', 'self_loops': False, 'use_snp_selection': False, 'graphsage_batch_size': 128}. Best is trial 72 with value: 0.24785014245637355.
[I 2025-12-06 06:17:47,584] Trial 149 finished with value: 0.22035836617035617 and parameters: {'model_type': 'graphsage', 'hidden_dims': '[512, 128]', 'dropout': 0.15430329811212656, 'batch_norm': False, 'sage_aggr': 'mean', 'sage_normalize': False, 'sage_project': False, 'lr': 0.0003227358823812411, 'weight_decay': 3.5646372682825116e-05, 'epochs': 237, 'loss': 'mse', 'optimizer': 'adam', 'graph_mode': 'cutoff', 'cutoff': 0.321354102310596, 'grm_norm': 'cosine_then_gcn', 'self_loops': False, 'use_snp_selection': False, 'graphsage_batch_size': 128}. Best is trial 72 with value: 0.24785014245637355.
[I 2025-12-06 06:18:59,265] Trial 0 finished with value: 0.15815390363429294 and parameters: {'model_type': 'graphsage', 'hidden_dims': '[128, 64]', 'dropout': 0.199031432379812, 'batch_norm': True, 'sage_aggr': 'max', 'sage_normalize': False, 'sage_project': False, 'lr': 3.4401453323286906e-05, 'weight_decay': 0.00017802616915745114, 'epochs': 169, 'loss': 'mse', 'optimizer': 'adam', 'graph_mode': 'knn', 'knn_k': 6, 'weighted_edges': True, 'symmetrize_mode': 'mutual', 'self_loops': False, 'use_snp_selection': False, 'graphsage_batch_size': 256}. Best is trial 0 with value: 0.15815390363429294.
[I 2025-12-06 06:19:59,551] Trial 1 finished with value: 0.19029209037828046 and parameters: {'model_type': 'graphsage', 'hidden_dims': '[512, 128]', 'dropout': 0.3737930779596218, 'batch_norm': True, 'sage_aggr': 'mean', 'sage_normalize': False, 'sage_project': False, 'lr': 0.0004485485309869717, 'weight_decay': 2.0046868950224612e-06, 'epochs': 74, 'loss': 'mse', 'optimizer': 'adam', 'graph_mode': 'knn', 'knn_k': 4, 'weighted_edges': True, 'symmetrize_mode': 'union', 'self_loops': False, 'use_snp_selection': False, 'graphsage_batch_size': 8}. Best is trial 1 with value: 0.19029209037828046.
[I 2025-12-06 06:20:41,861] Trial 2 finished with value: 0.16685464810283884 and parameters: {'model_type': 'graphsage', 'hidden_dims': '[256, 128]', 'dropout': 0.2731735750400165, 'batch_norm': False, 'sage_aggr': 'max', 'sage_normalize': True, 'sage_project': False, 'lr': 3.4705625989073525e-05, 'weight_decay': 2.4623319020131338e-05, 'epochs': 95, 'loss': 'mse', 'optimizer': 'adam', 'graph_mode': 'knn', 'knn_k': 6, 'weighted_edges': False, 'symmetrize_mode': 'mutual', 'self_loops': False, 'use_snp_selection': True, 'num_snps': 30713, 'graphsage_batch_size': 8}. Best is trial 1 with value: 0.19029209037828046.
[I 2025-12-06 06:21:40,117] Trial 3 finished with value: 0.1488947125415826 and parameters: {'model_type': 'graphsage', 'hidden_dims': '[256, 128]', 'dropout': 0.3815953422463725, 'batch_norm': False, 'sage_aggr': 'mean', 'sage_normalize': True, 'sage_project': False, 'lr': 2.1095572616816696e-06, 'weight_decay': 5.195307220037778e-07, 'epochs': 226, 'loss': 'mse', 'optimizer': 'adam', 'graph_mode': 'knn', 'knn_k': 8, 'weighted_edges': True, 'symmetrize_mode': 'union', 'self_loops': False, 'use_snp_selection': True, 'num_snps': 16419, 'graphsage_batch_size': 128}. Best is trial 1 with value: 0.19029209037828046.
[I 2025-12-06 06:23:34,013] Trial 4 finished with value: 0.16633691940027892 and parameters: {'model_type': 'graphsage', 'hidden_dims': '[256, 128]', 'dropout': 0.3920979142653378, 'batch_norm': True, 'sage_aggr': 'max', 'sage_normalize': True, 'sage_project': False, 'lr': 3.15214685884738e-06, 'weight_decay': 1.0663862019069792e-05, 'epochs': 212, 'loss': 'mae', 'optimizer': 'adam', 'graph_mode': 'cutoff', 'cutoff': 0.33867046005138823, 'grm_norm': 'gcn', 'self_loops': False, 'use_snp_selection': False, 'graphsage_batch_size': 512}. Best is trial 1 with value: 0.19029209037828046.
[I 2025-12-06 06:23:59,026] Trial 5 finished with value: 0.19383126098784256 and parameters: {'model_type': 'graphsage', 'hidden_dims': '[256, 128]', 'dropout': 0.32925710311863654, 'batch_norm': True, 'sage_aggr': 'mean', 'sage_normalize': True, 'sage_project': False, 'lr': 0.00016905333078305474, 'weight_decay': 6.711044850912148e-06, 'epochs': 127, 'loss': 'mae', 'optimizer': 'adam', 'graph_mode': 'cutoff', 'cutoff': 0.253959783091227, 'grm_norm': 'cosine_then_gcn', 'self_loops': False, 'use_snp_selection': True, 'num_snps': 7419, 'graphsage_batch_size': 64}. Best is trial 5 with value: 0.19383126098784256.
[I 2025-12-06 06:25:59,675] Trial 6 finished with value: 0.09630172500862713 and parameters: {'model_type': 'graphsage', 'hidden_dims': '[512, 64]', 'dropout': 0.2585007811528941, 'batch_norm': True, 'sage_aggr': 'max', 'sage_normalize': False, 'sage_project': False, 'lr': 5.921425508303395e-06, 'weight_decay': 0.0004511561961144237, 'epochs': 136, 'loss': 'mae', 'optimizer': 'adam', 'graph_mode': 'knn', 'knn_k': 9, 'weighted_edges': True, 'symmetrize_mode': 'union', 'self_loops': False, 'use_snp_selection': True, 'num_snps': 34427, 'graphsage_batch_size': 128}. Best is trial 5 with value: 0.19383126098784256.
[I 2025-12-06 06:27:59,527] Trial 7 finished with value: 0.14704899773788976 and parameters: {'model_type': 'graphsage', 'hidden_dims': '[512, 128]', 'dropout': 0.5944584870981006, 'batch_norm': False, 'sage_aggr': 'max', 'sage_normalize': True, 'sage_project': False, 'lr': 7.3241868695773595e-06, 'weight_decay': 1.2565521754060153e-06, 'epochs': 166, 'loss': 'mse', 'optimizer': 'adam', 'graph_mode': 'knn', 'knn_k': 5, 'weighted_edges': False, 'symmetrize_mode': 'mutual', 'self_loops': False, 'use_snp_selection': True, 'num_snps': 50019, 'graphsage_batch_size': 8}. Best is trial 5 with value: 0.19383126098784256.
[I 2025-12-06 06:29:22,410] Trial 8 finished with value: 0.13640239596797546 and parameters: {'model_type': 'graphsage', 'hidden_dims': '[512, 64]', 'dropout': 0.5703535192416116, 'batch_norm': False, 'sage_aggr': 'mean', 'sage_normalize': False, 'sage_project': False, 'lr': 1.823510325310572e-06, 'weight_decay': 0.00013672790135428885, 'epochs': 104, 'loss': 'mae', 'optimizer': 'adam', 'graph_mode': 'knn', 'knn_k': 7, 'weighted_edges': True, 'symmetrize_mode': 'mutual', 'self_loops': False, 'use_snp_selection': True, 'num_snps': 45923, 'graphsage_batch_size': 128}. Best is trial 5 with value: 0.19383126098784256.
[I 2025-12-06 06:31:51,022] Trial 9 finished with value: 0.19238404062839104 and parameters: {'model_type': 'graphsage', 'hidden_dims': '[512, 128]', 'dropout': 0.27261839493092876, 'batch_norm': False, 'sage_aggr': 'mean', 'sage_normalize': False, 'sage_project': False, 'lr': 5.88603310717523e-06, 'weight_decay': 1.0998339923223823e-05, 'epochs': 249, 'loss': 'mae', 'optimizer': 'adam', 'graph_mode': 'knn', 'knn_k': 3, 'weighted_edges': False, 'symmetrize_mode': 'mutual', 'self_loops': False, 'use_snp_selection': False, 'graphsage_batch_size': 128}. Best is trial 5 with value: 0.19383126098784256.
[I 2025-12-06 06:32:07,957] Trial 10 finished with value: 0.16851311234070343 and parameters: {'model_type': 'graphsage', 'hidden_dims': '[512, 256]', 'dropout': 0.11372025982957354, 'batch_norm': True, 'sage_aggr': 'mean', 'sage_normalize': True, 'sage_project': False, 'lr': 0.0004700436326814432, 'weight_decay': 1.2257443862615642e-07, 'epochs': 51, 'loss': 'mae', 'optimizer': 'adam', 'graph_mode': 'cutoff', 'cutoff': 0.21281628365523453, 'grm_norm': 'cosine_then_gcn', 'self_loops': False, 'use_snp_selection': True, 'num_snps': 2862, 'graphsage_batch_size': 64}. Best is trial 5 with value: 0.19383126098784256.
[I 2025-12-06 06:33:29,001] Trial 11 finished with value: 0.18382635216894574 and parameters: {'model_type': 'graphsage', 'hidden_dims': '[256, 128, 64]', 'dropout': 0.470533141241523, 'batch_norm': False, 'sage_aggr': 'mean', 'sage_normalize': False, 'sage_project': False, 'lr': 0.00015662364936172582, 'weight_decay': 3.530558597654037e-05, 'epochs': 249, 'loss': 'mae', 'optimizer': 'adam', 'graph_mode': 'cutoff', 'cutoff': 0.8674357119417975, 'grm_norm': 'none', 'self_loops': False, 'use_snp_selection': False, 'graphsage_batch_size': 16}. Best is trial 5 with value: 0.19383126098784256.
[I 2025-12-06 06:34:50,855] Trial 12 finished with value: 0.16539461748092865 and parameters: {'model_type': 'graphsage', 'hidden_dims': '[512, 128]', 'dropout': 0.281646895676097, 'batch_norm': False, 'sage_aggr': 'mean', 'sage_normalize': True, 'sage_project': False, 'lr': 0.00010905698769028621, 'weight_decay': 4.54550853695558e-06, 'epochs': 130, 'loss': 'mae', 'optimizer': 'adam', 'graph_mode': 'cutoff', 'cutoff': 0.5249798451032744, 'grm_norm': 'cosine_then_gcn', 'self_loops': False, 'use_snp_selection': False, 'graphsage_batch_size': 32}. Best is trial 5 with value: 0.19383126098784256.
[I 2025-12-06 06:35:45,504] Trial 13 finished with value: 0.17432462967897105 and parameters: {'model_type': 'graphsage', 'hidden_dims': '[128, 64]', 'dropout': 0.18110620754205714, 'batch_norm': True, 'sage_aggr': 'mean', 'sage_normalize': False, 'sage_project': False, 'lr': 1.0971752234033849e-05, 'weight_decay': 2.8081591027513654e-05, 'epochs': 189, 'loss': 'mae', 'optimizer': 'adam', 'graph_mode': 'cutoff', 'cutoff': 0.48483802576559265, 'grm_norm': 'cosine', 'self_loops': False, 'use_snp_selection': False, 'graphsage_batch_size': 64}. Best is trial 5 with value: 0.19383126098784256.
[I 2025-12-06 06:36:09,683] Trial 14 finished with value: 0.19370663269657334 and parameters: {'model_type': 'graphsage', 'hidden_dims': '[512, 256]', 'dropout': 0.4566787275802825, 'batch_norm': False, 'sage_aggr': 'mean', 'sage_normalize': True, 'sage_project': False, 'lr': 0.00010484496001290993, 'weight_decay': 5.2287777778236675e-06, 'epochs': 117, 'loss': 'mae', 'optimizer': 'adam', 'graph_mode': 'cutoff', 'cutoff': 0.7801097842767627, 'grm_norm': 'cosine_then_gcn', 'self_loops': False, 'use_snp_selection': True, 'num_snps': 8326, 'graphsage_batch_size': 64}. Best is trial 5 with value: 0.19383126098784256.
[I 2025-12-06 06:36:28,878] Trial 15 finished with value: 0.18769939006154845 and parameters: {'model_type': 'graphsage', 'hidden_dims': '[512, 256]', 'dropout': 0.47627753018274765, 'batch_norm': True, 'sage_aggr': 'mean', 'sage_normalize': True, 'sage_project': False, 'lr': 0.00011302911078184568, 'weight_decay': 4.1943350063362954e-07, 'epochs': 112, 'loss': 'mae', 'optimizer': 'adam', 'graph_mode': 'cutoff', 'cutoff': 0.8154651750706483, 'grm_norm': 'cosine_then_gcn', 'self_loops': False, 'use_snp_selection': True, 'num_snps': 4243, 'graphsage_batch_size': 64}. Best is trial 5 with value: 0.19383126098784256.
[I 2025-12-06 06:37:09,054] Trial 16 finished with value: 0.21133728112363293 and parameters: {'model_type': 'graphsage', 'hidden_dims': '[512, 256]', 'dropout': 0.4694434037035995, 'batch_norm': True, 'sage_aggr': 'mean', 'sage_normalize': True, 'sage_project': False, 'lr': 0.00022640547793816414, 'weight_decay': 3.4330326758164017e-06, 'epochs': 159, 'loss': 'mae', 'optimizer': 'adam', 'graph_mode': 'cutoff', 'cutoff': 0.6763508430640583, 'grm_norm': 'cosine_then_gcn', 'self_loops': False, 'use_snp_selection': True, 'num_snps': 17200, 'graphsage_batch_size': 64}. Best is trial 16 with value: 0.21133728112363293.
[I 2025-12-06 06:37:42,720] Trial 17 finished with value: 0.20651280720479362 and parameters: {'model_type': 'graphsage', 'hidden_dims': '[256, 128, 64]', 'dropout': 0.3351581659577916, 'batch_norm': True, 'sage_aggr': 'mean', 'sage_normalize': True, 'sage_project': False, 'lr': 0.00027081692584003827, 'weight_decay': 1.922961838291483e-06, 'epochs': 156, 'loss': 'mae', 'optimizer': 'adam', 'graph_mode': 'cutoff', 'cutoff': 0.6440372246775852, 'grm_norm': 'cosine_then_gcn', 'self_loops': False, 'use_snp_selection': True, 'num_snps': 20481, 'graphsage_batch_size': 64}. Best is trial 16 with value: 0.21133728112363293.
[I 2025-12-06 06:38:20,635] Trial 18 finished with value: 0.21169307323473358 and parameters: {'model_type': 'graphsage', 'hidden_dims': '[256, 128, 64]', 'dropout': 0.5304745127644971, 'batch_norm': True, 'sage_aggr': 'mean', 'sage_normalize': True, 'sage_project': False, 'lr': 0.0009685730102688063, 'weight_decay': 1.433065852115379e-06, 'epochs': 162, 'loss': 'mae', 'optimizer': 'adam', 'graph_mode': 'cutoff', 'cutoff': 0.6699295935662005, 'grm_norm': 'none', 'self_loops': False, 'use_snp_selection': True, 'num_snps': 24491, 'graphsage_batch_size': 256}. Best is trial 18 with value: 0.21169307323473358.
[I 2025-12-06 06:39:03,060] Trial 19 finished with value: 0.20422773057239546 and parameters: {'model_type': 'graphsage', 'hidden_dims': '[256, 128, 64]', 'dropout': 0.5376061587799685, 'batch_norm': True, 'sage_aggr': 'mean', 'sage_normalize': True, 'sage_project': False, 'lr': 0.000766325589826277, 'weight_decay': 2.627278317917249e-07, 'epochs': 193, 'loss': 'mae', 'optimizer': 'adam', 'graph_mode': 'cutoff', 'cutoff': 0.6509177373611086, 'grm_norm': 'none', 'self_loops': False, 'use_snp_selection': True, 'num_snps': 25134, 'graphsage_batch_size': 256}. Best is trial 18 with value: 0.21169307323473358.
[I 2025-12-06 06:40:27,234] Trial 20 finished with value: 0.22070891377468463 and parameters: {'model_type': 'graphsage', 'hidden_dims': '[512, 256]', 'dropout': 0.5266600658638261, 'batch_norm': True, 'sage_aggr': 'mean', 'sage_normalize': True, 'sage_project': False, 'lr': 0.0009333716153926649, 'weight_decay': 7.847124856170176e-07, 'epochs': 188, 'loss': 'mae', 'optimizer': 'adam', 'graph_mode': 'cutoff', 'cutoff': 0.6957803122252104, 'grm_norm': 'none', 'self_loops': False, 'use_snp_selection': True, 'num_snps': 39148, 'graphsage_batch_size': 256}. Best is trial 20 with value: 0.22070891377468463.
[I 2025-12-06 06:41:52,230] Trial 21 finished with value: 0.21806937635175316 and parameters: {'model_type': 'graphsage', 'hidden_dims': '[512, 256]', 'dropout': 0.5323467909580544, 'batch_norm': True, 'sage_aggr': 'mean', 'sage_normalize': True, 'sage_project': False, 'lr': 0.0009093570904350366, 'weight_decay': 9.795806085950918e-07, 'epochs': 186, 'loss': 'mae', 'optimizer': 'adam', 'graph_mode': 'cutoff', 'cutoff': 0.6800064377675872, 'grm_norm': 'none', 'self_loops': False, 'use_snp_selection': True, 'num_snps': 39769, 'graphsage_batch_size': 256}. Best is trial 20 with value: 0.22070891377468463.
[I 2025-12-06 06:43:17,615] Trial 22 finished with value: 0.21547370895817336 and parameters: {'model_type': 'graphsage', 'hidden_dims': '[512, 256]', 'dropout': 0.5381715913649774, 'batch_norm': True, 'sage_aggr': 'mean', 'sage_normalize': True, 'sage_project': False, 'lr': 0.0009131577226863987, 'weight_decay': 8.847454706330317e-07, 'epochs': 184, 'loss': 'mae', 'optimizer': 'adam', 'graph_mode': 'cutoff', 'cutoff': 0.7229493263942419, 'grm_norm': 'none', 'self_loops': False, 'use_snp_selection': True, 'num_snps': 40561, 'graphsage_batch_size': 256}. Best is trial 20 with value: 0.22070891377468463.
[I 2025-12-06 06:44:46,294] Trial 23 finished with value: 0.21962007574795112 and parameters: {'model_type': 'graphsage', 'hidden_dims': '[512, 256]', 'dropout': 0.5283801825413343, 'batch_norm': True, 'sage_aggr': 'mean', 'sage_normalize': True, 'sage_project': False, 'lr': 0.0005143484718431177, 'weight_decay': 6.582059441027228e-07, 'epochs': 191, 'loss': 'mae', 'optimizer': 'adam', 'graph_mode': 'cutoff', 'cutoff': 0.7458995527009292, 'grm_norm': 'none', 'self_loops': False, 'use_snp_selection': True, 'num_snps': 41086, 'graphsage_batch_size': 256}. Best is trial 20 with value: 0.22070891377468463.
[I 2025-12-06 06:47:11,575] Trial 24 finished with value: 0.21039330883060062 and parameters: {'model_type': 'graphsage', 'hidden_dims': '[512, 256]', 'dropout': 0.42837212662880886, 'batch_norm': True, 'sage_aggr': 'mean', 'sage_normalize': True, 'sage_project': False, 'lr': 0.00043427221811338904, 'weight_decay': 1.3259774625720686e-07, 'epochs': 216, 'loss': 'mae', 'optimizer': 'adam', 'graph_mode': 'cutoff', 'cutoff': 0.565471246121422, 'grm_norm': 'none', 'self_loops': False, 'use_snp_selection': True, 'num_snps': 59416, 'graphsage_batch_size': 256}. Best is trial 20 with value: 0.22070891377468463.
