[I 2025-12-09 00:22:44,138] Trial 10 finished with value: 0.30460194612460806 and parameters: {'model_type': 'graphsage', 'hidden_dims': '[256, 128, 64]', 'dropout': 0.5365714961141473, 'batch_norm': True, 'sage_aggr': 'mean', 'sage_normalize': False, 'sage_project': False, 'lr': 0.0060050040216813455, 'weight_decay': 4.9377500793081834e-05, 'epochs': 46, 'loss': 'mae', 'optimizer': 'adam', 'graph_mode': 'cutoff', 'cutoff': 0.8579871888501912, 'grm_norm': 'none', 'self_loops': True, 'use_snp_selection': True, 'num_snps': 59927}. Best is trial 10 with value: 0.30460194612460806.
[I 2025-12-09 00:23:37,486] Trial 11 finished with value: 0.3085369268731748 and parameters: {'model_type': 'graphsage', 'hidden_dims': '[256, 128, 64]', 'dropout': 0.5437810742461437, 'batch_norm': True, 'sage_aggr': 'mean', 'sage_normalize': False, 'sage_project': False, 'lr': 0.008000655871733665, 'weight_decay': 4.2521929457206324e-05, 'epochs': 47, 'loss': 'mae', 'optimizer': 'adam', 'graph_mode': 'cutoff', 'cutoff': 0.897550071387144, 'grm_norm': 'none', 'self_loops': True, 'use_snp_selection': True, 'num_snps': 57688}. Best is trial 11 with value: 0.3085369268731748.
[I 2025-12-09 00:24:29,633] Trial 12 finished with value: 0.29916869248300365 and parameters: {'model_type': 'graphsage', 'hidden_dims': '[256, 128, 64]', 'dropout': 0.5558945971784524, 'batch_norm': True, 'sage_aggr': 'mean', 'sage_normalize': False, 'sage_project': False, 'lr': 0.009282551774952042, 'weight_decay': 3.501204923724955e-05, 'epochs': 42, 'loss': 'mae', 'optimizer': 'adam', 'graph_mode': 'cutoff', 'cutoff': 0.87844160791601, 'grm_norm': 'none', 'self_loops': True, 'use_snp_selection': True, 'num_snps': 57556}. Best is trial 11 with value: 0.3085369268731748.
[I 2025-12-09 00:25:32,987] Trial 13 finished with value: 0.3073675726143802 and parameters: {'model_type': 'graphsage', 'hidden_dims': '[256, 128]', 'dropout': 0.5341959639795645, 'batch_norm': True, 'sage_aggr': 'mean', 'sage_normalize': False, 'sage_project': False, 'lr': 0.008215750668655835, 'weight_decay': 2.207819306969384e-05, 'epochs': 80, 'loss': 'mae', 'optimizer': 'adam', 'graph_mode': 'cutoff', 'cutoff': 0.8962199188745039, 'grm_norm': 'cosine', 'self_loops': True, 'use_snp_selection': True, 'num_snps': 59441}. Best is trial 11 with value: 0.3085369268731748.
[I 2025-12-09 00:26:28,131] Trial 14 finished with value: 0.31048659765087105 and parameters: {'model_type': 'graphsage', 'hidden_dims': '[256, 128]', 'dropout': 0.44099154398585816, 'batch_norm': True, 'sage_aggr': 'mean', 'sage_normalize': False, 'sage_project': False, 'lr': 0.0026259119277744977, 'weight_decay': 1.0774511659769707e-05, 'epochs': 105, 'loss': 'mae', 'optimizer': 'adam', 'graph_mode': 'cutoff', 'cutoff': 0.6785547012950875, 'grm_norm': 'cosine', 'self_loops': True, 'use_snp_selection': True, 'num_snps': 41693}. Best is trial 14 with value: 0.31048659765087105.
[I 2025-12-09 00:27:24,388] Trial 15 finished with value: 0.30607914730464875 and parameters: {'model_type': 'graphsage', 'hidden_dims': '[256, 128]', 'dropout': 0.45939857593813493, 'batch_norm': True, 'sage_aggr': 'mean', 'sage_normalize': False, 'sage_project': False, 'lr': 0.0018874946562029051, 'weight_decay': 1.0335308460801528e-05, 'epochs': 105, 'loss': 'mae', 'optimizer': 'adam', 'graph_mode': 'cutoff', 'cutoff': 0.6580364564181902, 'grm_norm': 'cosine', 'self_loops': True, 'use_snp_selection': True, 'num_snps': 43648}. Best is trial 14 with value: 0.31048659765087105.
[I 2025-12-09 00:28:24,907] Trial 16 finished with value: 0.3064104451463633 and parameters: {'model_type': 'graphsage', 'hidden_dims': '[256, 128]', 'dropout': 0.4334411227544116, 'batch_norm': True, 'sage_aggr': 'mean', 'sage_normalize': False, 'sage_project': False, 'lr': 0.0020040615235403995, 'weight_decay': 5.911424349880312e-07, 'epochs': 107, 'loss': 'mae', 'optimizer': 'adam', 'graph_mode': 'cutoff', 'cutoff': 0.41272003720230993, 'grm_norm': 'cosine', 'self_loops': True, 'use_snp_selection': True, 'num_snps': 37941}. Best is trial 14 with value: 0.31048659765087105.
[I 2025-12-09 00:29:02,195] Trial 17 finished with value: 0.301702274631101 and parameters: {'model_type': 'graphsage', 'hidden_dims': '[256, 128]', 'dropout': 0.4244400238757159, 'batch_norm': True, 'sage_aggr': 'mean', 'sage_normalize': False, 'sage_project': False, 'lr': 0.0027493726401736905, 'weight_decay': 0.00012666273491221004, 'epochs': 107, 'loss': 'mae', 'optimizer': 'adam', 'graph_mode': 'cutoff', 'cutoff': 0.7377713175529416, 'grm_norm': 'gcn', 'self_loops': True, 'use_snp_selection': True, 'num_snps': 18242}. Best is trial 14 with value: 0.31048659765087105.
[I 2025-12-09 00:30:00,772] Trial 18 finished with value: 0.0041447437107502766 and parameters: {'model_type': 'graphsage', 'hidden_dims': '[256, 128, 64]', 'dropout': 0.48484482386611594, 'batch_norm': False, 'sage_aggr': 'mean', 'sage_normalize': False, 'sage_project': False, 'lr': 0.003976422745871507, 'weight_decay': 8.114254566842623e-06, 'epochs': 223, 'loss': 'mae', 'optimizer': 'adam', 'graph_mode': 'cutoff', 'cutoff': 0.7557936915826282, 'grm_norm': 'cosine_then_gcn', 'self_loops': False, 'use_snp_selection': False}. Best is trial 14 with value: 0.31048659765087105.
[I 2025-12-09 00:30:59,769] Trial 19 finished with value: 0.30478512552413944 and parameters: {'model_type': 'graphsage', 'hidden_dims': '[256, 128]', 'dropout': 0.5811872389603683, 'batch_norm': True, 'sage_aggr': 'mean', 'sage_normalize': False, 'sage_project': False, 'lr': 0.0009685637480098563, 'weight_decay': 0.0006844463756456, 'epochs': 74, 'loss': 'mae', 'optimizer': 'adam', 'graph_mode': 'cutoff', 'cutoff': 0.47824025350101435, 'grm_norm': 'cosine', 'self_loops': True, 'use_snp_selection': True, 'num_snps': 45808}. Best is trial 14 with value: 0.31048659765087105.
[I 2025-12-09 00:32:11,522] Trial 20 finished with value: 0.3042853302912838 and parameters: {'model_type': 'graphsage', 'hidden_dims': '[512, 256]', 'dropout': 0.39344456026368846, 'batch_norm': True, 'sage_aggr': 'mean', 'sage_normalize': False, 'sage_project': False, 'lr': 0.0001763892193880176, 'weight_decay': 3.0239585412618573e-06, 'epochs': 125, 'loss': 'mae', 'optimizer': 'adam', 'graph_mode': 'cutoff', 'cutoff': 0.6313675773816241, 'grm_norm': 'none', 'self_loops': True, 'use_snp_selection': True, 'num_snps': 41158}. Best is trial 14 with value: 0.31048659765087105.
[I 2025-12-09 00:33:10,578] Trial 21 finished with value: 0.3095258396345832 and parameters: {'model_type': 'graphsage', 'hidden_dims': '[256, 128]', 'dropout': 0.5027688748767667, 'batch_norm': True, 'sage_aggr': 'mean', 'sage_normalize': False, 'sage_project': False, 'lr': 0.006614973871160996, 'weight_decay': 2.8340450483246656e-05, 'epochs': 82, 'loss': 'mae', 'optimizer': 'adam', 'graph_mode': 'cutoff', 'cutoff': 0.8722185129326064, 'grm_norm': 'cosine', 'self_loops': True, 'use_snp_selection': True, 'num_snps': 54481}. Best is trial 14 with value: 0.31048659765087105.
[I 2025-12-09 00:34:09,607] Trial 22 finished with value: 0.31208024242774074 and parameters: {'model_type': 'graphsage', 'hidden_dims': '[256, 128]', 'dropout': 0.4928571486812452, 'batch_norm': True, 'sage_aggr': 'mean', 'sage_normalize': False, 'sage_project': False, 'lr': 0.004202924837694374, 'weight_decay': 1.559539254206575e-05, 'epochs': 84, 'loss': 'mae', 'optimizer': 'adam', 'graph_mode': 'cutoff', 'cutoff': 0.7922544642826639, 'grm_norm': 'cosine', 'self_loops': True, 'use_snp_selection': True, 'num_snps': 52121}. Best is trial 22 with value: 0.31208024242774074.
[I 2025-12-09 00:35:09,165] Trial 23 finished with value: 0.3120591181909942 and parameters: {'model_type': 'graphsage', 'hidden_dims': '[256, 128]', 'dropout': 0.4903254339374024, 'batch_norm': True, 'sage_aggr': 'mean', 'sage_normalize': False, 'sage_project': False, 'lr': 0.0040379460051036325, 'weight_decay': 1.527227234460684e-05, 'epochs': 92, 'loss': 'mae', 'optimizer': 'adam', 'graph_mode': 'cutoff', 'cutoff': 0.7852478575310977, 'grm_norm': 'cosine', 'self_loops': True, 'use_snp_selection': True, 'num_snps': 50268}. Best is trial 22 with value: 0.31208024242774074.
[I 2025-12-09 00:36:14,383] Trial 24 finished with value: 0.30985698381164867 and parameters: {'model_type': 'graphsage', 'hidden_dims': '[256, 128]', 'dropout': 0.38771801372630577, 'batch_norm': True, 'sage_aggr': 'mean', 'sage_normalize': False, 'sage_project': False, 'lr': 0.0009814685163232815, 'weight_decay': 1.3802819161825854e-05, 'epochs': 127, 'loss': 'mae', 'optimizer': 'adam', 'graph_mode': 'cutoff', 'cutoff': 0.6914925117776447, 'grm_norm': 'cosine', 'self_loops': True, 'use_snp_selection': True, 'num_snps': 49884}. Best is trial 22 with value: 0.31208024242774074.
[I 2025-12-09 00:37:17,155] Trial 25 finished with value: 0.30641786426688256 and parameters: {'model_type': 'graphsage', 'hidden_dims': '[256, 128]', 'dropout': 0.4820383289469867, 'batch_norm': True, 'sage_aggr': 'mean', 'sage_normalize': False, 'sage_project': False, 'lr': 0.0035330410069192852, 'weight_decay': 4.797601541642166e-06, 'epochs': 208, 'loss': 'mae', 'optimizer': 'adam', 'graph_mode': 'cutoff', 'cutoff': 0.7928522582434365, 'grm_norm': 'cosine', 'self_loops': True, 'use_snp_selection': True, 'num_snps': 35168}. Best is trial 22 with value: 0.31208024242774074.
[I 2025-12-09 00:37:48,330] Trial 26 finished with value: 0.3122083427298363 and parameters: {'model_type': 'graphsage', 'hidden_dims': '[256, 128]', 'dropout': 0.5884432890448963, 'batch_norm': True, 'sage_aggr': 'mean', 'sage_normalize': True, 'sage_project': False, 'lr': 0.0018127024713313537, 'weight_decay': 1.0559621156581787e-06, 'epochs': 93, 'loss': 'mse', 'optimizer': 'adam', 'graph_mode': 'cutoff', 'cutoff': 0.8074390863821729, 'grm_norm': 'cosine', 'self_loops': True, 'use_snp_selection': False}. Best is trial 26 with value: 0.3122083427298363.
[I 2025-12-09 00:38:28,232] Trial 27 finished with value: 0.2966875677115343 and parameters: {'model_type': 'graphsage', 'hidden_dims': '[256, 128]', 'dropout': 0.5986751031002422, 'batch_norm': False, 'sage_aggr': 'mean', 'sage_normalize': True, 'sage_project': False, 'lr': 0.0014248104909576622, 'weight_decay': 1.4536670189552617e-06, 'epochs': 134, 'loss': 'mse', 'optimizer': 'adam', 'graph_mode': 'cutoff', 'cutoff': 0.8156036320412869, 'grm_norm': 'cosine', 'self_loops': False, 'use_snp_selection': False}. Best is trial 26 with value: 0.3122083427298363.
[I 2025-12-09 00:38:58,301] Trial 28 finished with value: 0.31515666221002137 and parameters: {'model_type': 'graphsage', 'hidden_dims': '[256, 128]', 'dropout': 0.49973130829917517, 'batch_norm': True, 'sage_aggr': 'mean', 'sage_normalize': True, 'sage_project': False, 'lr': 0.0041157624727600935, 'weight_decay': 2.1022988279304266e-07, 'epochs': 88, 'loss': 'mse', 'optimizer': 'adam', 'graph_mode': 'cutoff', 'cutoff': 0.8152558120553267, 'grm_norm': 'cosine', 'self_loops': True, 'use_snp_selection': False}. Best is trial 28 with value: 0.31515666221002137.
[I 2025-12-09 00:40:27,255] Trial 29 finished with value: 0.27622363063328187 and parameters: {'model_type': 'graphsage', 'hidden_dims': '[128, 64]', 'dropout': 0.5629259383618102, 'batch_norm': True, 'sage_aggr': 'max', 'sage_normalize': True, 'sage_project': False, 'lr': 0.00021744012628968274, 'weight_decay': 1.5496686512429446e-07, 'epochs': 257, 'loss': 'mse', 'optimizer': 'adam', 'graph_mode': 'knn', 'knn_k': 4, 'weighted_edges': False, 'symmetrize_mode': 'union', 'self_loops': True, 'use_snp_selection': False}. Best is trial 28 with value: 0.31515666221002137.
[I 2025-12-09 00:41:06,421] Trial 30 finished with value: 0.305576831885628 and parameters: {'model_type': 'graphsage', 'hidden_dims': '[512, 64]', 'dropout': 0.5169685978447658, 'batch_norm': True, 'sage_aggr': 'mean', 'sage_normalize': True, 'sage_project': False, 'lr': 0.0013111337046003491, 'weight_decay': 4.6361976695841504e-07, 'epochs': 66, 'loss': 'mse', 'optimizer': 'adam', 'graph_mode': 'cutoff', 'cutoff': 0.5792472423465486, 'grm_norm': 'cosine_then_gcn', 'self_loops': True, 'use_snp_selection': False}. Best is trial 28 with value: 0.31515666221002137.
[I 2025-12-09 00:41:37,146] Trial 31 finished with value: 0.3162843361804539 and parameters: {'model_type': 'graphsage', 'hidden_dims': '[256, 128]', 'dropout': 0.394193001175609, 'batch_norm': True, 'sage_aggr': 'mean', 'sage_normalize': True, 'sage_project': False, 'lr': 0.004573220918653214, 'weight_decay': 2.4058579968494104e-07, 'epochs': 91, 'loss': 'mse', 'optimizer': 'adam', 'graph_mode': 'cutoff', 'cutoff': 0.8125644575922393, 'grm_norm': 'cosine', 'self_loops': True, 'use_snp_selection': False}. Best is trial 31 with value: 0.3162843361804539.
[I 2025-12-09 00:42:53,583] Trial 32 finished with value: 0.3141654543288804 and parameters: {'model_type': 'graphsage', 'hidden_dims': '[512, 128]', 'dropout': 0.3951287818468476, 'batch_norm': True, 'sage_aggr': 'mean', 'sage_normalize': True, 'sage_project': False, 'lr': 0.004147809814679446, 'weight_decay': 2.8777446400652547e-07, 'epochs': 162, 'loss': 'mse', 'optimizer': 'adam', 'graph_mode': 'cutoff', 'cutoff': 0.717034570286269, 'grm_norm': 'cosine', 'self_loops': True, 'use_snp_selection': False}. Best is trial 31 with value: 0.3162843361804539.
[I 2025-12-09 00:44:09,693] Trial 33 finished with value: 0.31375428072714756 and parameters: {'model_type': 'graphsage', 'hidden_dims': '[512, 128]', 'dropout': 0.3781095712277449, 'batch_norm': True, 'sage_aggr': 'mean', 'sage_normalize': True, 'sage_project': False, 'lr': 0.005225843495261765, 'weight_decay': 2.781516808182439e-07, 'epochs': 161, 'loss': 'mse', 'optimizer': 'adam', 'graph_mode': 'cutoff', 'cutoff': 0.7348478104697417, 'grm_norm': 'cosine', 'self_loops': True, 'use_snp_selection': False}. Best is trial 31 with value: 0.3162843361804539.
[I 2025-12-09 00:45:26,503] Trial 34 finished with value: 0.3023969213966687 and parameters: {'model_type': 'graphsage', 'hidden_dims': '[512, 128]', 'dropout': 0.3855894550359592, 'batch_norm': False, 'sage_aggr': 'max', 'sage_normalize': True, 'sage_project': False, 'lr': 0.0064365638755926845, 'weight_decay': 2.788837635510579e-07, 'epochs': 164, 'loss': 'mse', 'optimizer': 'adam', 'graph_mode': 'cutoff', 'cutoff': 0.7213871091691957, 'grm_norm': 'cosine', 'self_loops': True, 'use_snp_selection': False}. Best is trial 31 with value: 0.3162843361804539.
[I 2025-12-09 00:47:35,819] Trial 35 finished with value: 0.2910452756344574 and parameters: {'model_type': 'graphsage', 'hidden_dims': '[512, 128]', 'dropout': 0.3142807688755044, 'batch_norm': True, 'sage_aggr': 'max', 'sage_normalize': True, 'sage_project': False, 'lr': 0.00510968752720697, 'weight_decay': 2.9718481226439853e-07, 'epochs': 203, 'loss': 'mse', 'optimizer': 'adam', 'graph_mode': 'knn', 'knn_k': 4, 'weighted_edges': True, 'symmetrize_mode': 'union', 'self_loops': True, 'use_snp_selection': False}. Best is trial 31 with value: 0.3162843361804539.
[I 2025-12-09 00:48:44,705] Trial 36 finished with value: 0.30998460334853395 and parameters: {'model_type': 'graphsage', 'hidden_dims': '[512, 128]', 'dropout': 0.36347459740556287, 'batch_norm': True, 'sage_aggr': 'mean', 'sage_normalize': True, 'sage_project': False, 'lr': 0.0029075649117250306, 'weight_decay': 1.0674589748807897e-07, 'epochs': 145, 'loss': 'mse', 'optimizer': 'adam', 'graph_mode': 'cutoff', 'cutoff': 0.7145742166948359, 'grm_norm': 'gcn', 'self_loops': False, 'use_snp_selection': False}. Best is trial 31 with value: 0.3162843361804539.
[I 2025-12-09 00:50:07,495] Trial 37 finished with value: 0.31089812035283676 and parameters: {'model_type': 'graphsage', 'hidden_dims': '[512, 128]', 'dropout': 0.4096277529199174, 'batch_norm': True, 'sage_aggr': 'mean', 'sage_normalize': True, 'sage_project': False, 'lr': 0.009613975049041852, 'weight_decay': 2.1919790709036095e-07, 'epochs': 178, 'loss': 'mse', 'optimizer': 'adam', 'graph_mode': 'cutoff', 'cutoff': 0.8332863933511232, 'grm_norm': 'cosine', 'self_loops': True, 'use_snp_selection': False}. Best is trial 31 with value: 0.3162843361804539.
[I 2025-12-09 00:53:55,934] Trial 38 finished with value: 0.28389424136588765 and parameters: {'model_type': 'graphsage', 'hidden_dims': '[512, 128]', 'dropout': 0.22093296904711832, 'batch_norm': False, 'sage_aggr': 'max', 'sage_normalize': True, 'sage_project': False, 'lr': 0.000702637390759077, 'weight_decay': 4.334254316305321e-07, 'epochs': 240, 'loss': 'mse', 'optimizer': 'adam', 'graph_mode': 'knn', 'knn_k': 10, 'weighted_edges': False, 'symmetrize_mode': 'union', 'self_loops': False, 'use_snp_selection': False}. Best is trial 31 with value: 0.3162843361804539.
[I 2025-12-09 00:54:31,878] Trial 39 finished with value: 0.29063638800040076 and parameters: {'model_type': 'graphsage', 'hidden_dims': '[128, 64]', 'dropout': 0.3590454174780073, 'batch_norm': True, 'sage_aggr': 'mean', 'sage_normalize': True, 'sage_project': False, 'lr': 2.4937111580885677e-05, 'weight_decay': 1.8883079967764533e-07, 'epochs': 162, 'loss': 'mse', 'optimizer': 'adam', 'graph_mode': 'cutoff', 'cutoff': 0.5155458161930963, 'grm_norm': 'gcn', 'self_loops': True, 'use_snp_selection': False}. Best is trial 31 with value: 0.3162843361804539.
[I 2025-12-09 00:56:17,719] Trial 40 finished with value: 0.2982415371688921 and parameters: {'model_type': 'graphsage', 'hidden_dims': '[512, 128]', 'dropout': 0.2872284910838502, 'batch_norm': True, 'sage_aggr': 'mean', 'sage_normalize': True, 'sage_project': False, 'lr': 0.00011517675560191285, 'weight_decay': 8.244497262176543e-07, 'epochs': 185, 'loss': 'mse', 'optimizer': 'adam', 'graph_mode': 'knn', 'knn_k': 3, 'weighted_edges': True, 'symmetrize_mode': 'union', 'self_loops': True, 'use_snp_selection': False}. Best is trial 31 with value: 0.3162843361804539.
[I 2025-12-09 00:57:17,743] Trial 41 finished with value: 0.31049954495424903 and parameters: {'model_type': 'graphsage', 'hidden_dims': '[512, 128]', 'dropout': 0.4581514103757204, 'batch_norm': True, 'sage_aggr': 'mean', 'sage_normalize': True, 'sage_project': False, 'lr': 0.002040063928163517, 'weight_decay': 1.0141398680292654e-06, 'epochs': 120, 'loss': 'mse', 'optimizer': 'adam', 'graph_mode': 'cutoff', 'cutoff': 0.8355246211534149, 'grm_norm': 'cosine', 'self_loops': True, 'use_snp_selection': False}. Best is trial 31 with value: 0.3162843361804539.
[I 2025-12-09 00:58:25,855] Trial 42 finished with value: 0.3116466367061065 and parameters: {'model_type': 'graphsage', 'hidden_dims': '[512, 256]', 'dropout': 0.33229055766955273, 'batch_norm': True, 'sage_aggr': 'mean', 'sage_normalize': True, 'sage_project': False, 'lr': 0.004775222871118472, 'weight_decay': 3.2736852987507097e-07, 'epochs': 140, 'loss': 'mse', 'optimizer': 'adam', 'graph_mode': 'cutoff', 'cutoff': 0.7531962795702409, 'grm_norm': 'cosine', 'self_loops': True, 'use_snp_selection': False}. Best is trial 31 with value: 0.3162843361804539.
[I 2025-12-09 00:59:02,796] Trial 43 finished with value: 0.31258004779829196 and parameters: {'model_type': 'graphsage', 'hidden_dims': '[512, 64]', 'dropout': 0.3625324506069416, 'batch_norm': True, 'sage_aggr': 'mean', 'sage_normalize': True, 'sage_project': False, 'lr': 0.0028934460842030517, 'weight_decay': 1.3248998252563862e-06, 'epochs': 61, 'loss': 'mse', 'optimizer': 'adam', 'graph_mode': 'cutoff', 'cutoff': 0.6349223981443999, 'grm_norm': 'cosine', 'self_loops': True, 'use_snp_selection': False}. Best is trial 31 with value: 0.3162843361804539.
[I 2025-12-09 00:59:38,992] Trial 44 finished with value: 0.31339930868677784 and parameters: {'model_type': 'graphsage', 'hidden_dims': '[512, 64]', 'dropout': 0.3710390059743915, 'batch_norm': True, 'sage_aggr': 'mean', 'sage_normalize': True, 'sage_project': False, 'lr': 0.0030871230408543245, 'weight_decay': 1.194801010246708e-07, 'epochs': 59, 'loss': 'mse', 'optimizer': 'adam', 'graph_mode': 'cutoff', 'cutoff': 0.6172660928520168, 'grm_norm': 'cosine', 'self_loops': True, 'use_snp_selection': False}. Best is trial 31 with value: 0.3162843361804539.
[I 2025-12-09 01:00:14,446] Trial 45 finished with value: 0.3061907862413071 and parameters: {'model_type': 'graphsage', 'hidden_dims': '[512, 64]', 'dropout': 0.3348079365808616, 'batch_norm': True, 'sage_aggr': 'mean', 'sage_normalize': True, 'sage_project': False, 'lr': 0.005266377498005359, 'weight_decay': 1.085103736581261e-07, 'epochs': 57, 'loss': 'mse', 'optimizer': 'adam', 'graph_mode': 'cutoff', 'cutoff': 0.5941672762637356, 'grm_norm': 'cosine', 'self_loops': True, 'use_snp_selection': False}. Best is trial 31 with value: 0.3162843361804539.
[I 2025-12-09 01:01:25,679] Trial 46 finished with value: 0.2989007676283656 and parameters: {'model_type': 'graphsage', 'hidden_dims': '[512, 64]', 'dropout': 0.2703467912872735, 'batch_norm': False, 'sage_aggr': 'max', 'sage_normalize': True, 'sage_project': False, 'lr': 0.006479070875046296, 'weight_decay': 5.626935478477834e-07, 'epochs': 150, 'loss': 'mse', 'optimizer': 'adam', 'graph_mode': 'cutoff', 'cutoff': 0.705392488897404, 'grm_norm': 'cosine_then_gcn', 'self_loops': False, 'use_snp_selection': False}. Best is trial 31 with value: 0.3162843361804539.
[I 2025-12-09 01:03:06,340] Trial 47 finished with value: 0.2994450817461926 and parameters: {'model_type': 'graphsage', 'hidden_dims': '[512, 64]', 'dropout': 0.4091164876669837, 'batch_norm': True, 'sage_aggr': 'mean', 'sage_normalize': True, 'sage_project': False, 'lr': 0.0004747982765477054, 'weight_decay': 1.7487436116178308e-07, 'epochs': 169, 'loss': 'mse', 'optimizer': 'adam', 'graph_mode': 'cutoff', 'cutoff': 0.2818185990324402, 'grm_norm': 'cosine', 'self_loops': True, 'use_snp_selection': False}. Best is trial 31 with value: 0.3162843361804539.
