[I 2025-12-08 23:21:26,989] Trial 112 finished with value: 0.3705643730546514 and parameters: {'model_type': 'graphsage', 'hidden_dims': '[256, 128, 64]', 'dropout': 0.5562818945914584, 'batch_norm': False, 'sage_aggr': 'max', 'sage_normalize': False, 'sage_project': False, 'lr': 1.1927310028709019e-05, 'weight_decay': 1.7198929412603377e-05, 'epochs': 191, 'loss': 'mae', 'optimizer': 'adam', 'graph_mode': 'cutoff', 'cutoff': 0.8208977574201699, 'grm_norm': 'gcn', 'self_loops': True, 'use_snp_selection': True, 'num_snps': 24249}. Best is trial 69 with value: 0.37979444876206886.
[I 2025-12-08 23:21:54,341] Trial 113 finished with value: 0.3650178402586381 and parameters: {'model_type': 'graphsage', 'hidden_dims': '[256, 128, 64]', 'dropout': 0.5772771931978552, 'batch_norm': False, 'sage_aggr': 'max', 'sage_normalize': False, 'sage_project': False, 'lr': 1.6290980256980813e-05, 'weight_decay': 8.164153841857393e-05, 'epochs': 180, 'loss': 'mae', 'optimizer': 'adam', 'graph_mode': 'cutoff', 'cutoff': 0.7951473354011156, 'grm_norm': 'gcn', 'self_loops': True, 'use_snp_selection': True, 'num_snps': 18545}. Best is trial 69 with value: 0.37979444876206886.
[I 2025-12-08 23:22:31,507] Trial 114 finished with value: 0.37718301113383357 and parameters: {'model_type': 'graphsage', 'hidden_dims': '[256, 128, 64]', 'dropout': 0.541073353185222, 'batch_norm': False, 'sage_aggr': 'max', 'sage_normalize': False, 'sage_project': False, 'lr': 1.3294365942609282e-05, 'weight_decay': 2.767602338468589e-05, 'epochs': 206, 'loss': 'mae', 'optimizer': 'adam', 'graph_mode': 'cutoff', 'cutoff': 0.8406891935073622, 'grm_norm': 'gcn', 'self_loops': True, 'use_snp_selection': True, 'num_snps': 25471}. Best is trial 69 with value: 0.37979444876206886.
[I 2025-12-08 23:23:04,111] Trial 115 finished with value: 0.3358180649360058 and parameters: {'model_type': 'graphsage', 'hidden_dims': '[256, 128, 64]', 'dropout': 0.5439408960165197, 'batch_norm': False, 'sage_aggr': 'max', 'sage_normalize': False, 'sage_project': False, 'lr': 0.00013247250189536987, 'weight_decay': 5.966333688091418e-05, 'epochs': 205, 'loss': 'mae', 'optimizer': 'adam', 'graph_mode': 'cutoff', 'cutoff': 0.8627090138506371, 'grm_norm': 'gcn', 'self_loops': True, 'use_snp_selection': True, 'num_snps': 21091}. Best is trial 69 with value: 0.37979444876206886.
[I 2025-12-08 23:23:43,674] Trial 116 finished with value: 0.32306156500856054 and parameters: {'model_type': 'graphsage', 'hidden_dims': '[256, 128, 64]', 'dropout': 0.501303484117732, 'batch_norm': True, 'sage_aggr': 'mean', 'sage_normalize': False, 'sage_project': False, 'lr': 1.3557319449795425e-05, 'weight_decay': 2.9163601054915134e-05, 'epochs': 223, 'loss': 'mae', 'optimizer': 'adam', 'graph_mode': 'cutoff', 'cutoff': 0.8814811129046268, 'grm_norm': 'gcn', 'self_loops': True, 'use_snp_selection': True, 'num_snps': 25799}. Best is trial 69 with value: 0.37979444876206886.
[I 2025-12-08 23:24:15,822] Trial 117 finished with value: 0.2991000091045831 and parameters: {'model_type': 'graphsage', 'hidden_dims': '[256, 128]', 'dropout': 0.5235839524465365, 'batch_norm': False, 'sage_aggr': 'max', 'sage_normalize': False, 'sage_project': False, 'lr': 2.032961445312416e-05, 'weight_decay': 4.0002348658256564e-05, 'epochs': 66, 'loss': 'mae', 'optimizer': 'adam', 'graph_mode': 'cutoff', 'cutoff': 0.40139416443540443, 'grm_norm': 'gcn', 'self_loops': False, 'use_snp_selection': False}. Best is trial 69 with value: 0.37979444876206886.
[I 2025-12-08 23:25:08,471] Trial 118 finished with value: 0.3489885834995262 and parameters: {'model_type': 'graphsage', 'hidden_dims': '[512, 128]', 'dropout': 0.5906539244703786, 'batch_norm': False, 'sage_aggr': 'max', 'sage_normalize': False, 'sage_project': False, 'lr': 2.28941598219814e-05, 'weight_decay': 7.182646916624012e-05, 'epochs': 210, 'loss': 'mse', 'optimizer': 'adam', 'graph_mode': 'cutoff', 'cutoff': 0.5862943148749055, 'grm_norm': 'cosine', 'self_loops': True, 'use_snp_selection': True, 'num_snps': 22958}. Best is trial 69 with value: 0.37979444876206886.
[I 2025-12-08 23:26:47,246] Trial 119 finished with value: 0.32027656720610825 and parameters: {'model_type': 'graphsage', 'hidden_dims': '[256, 128, 64]', 'dropout': 0.533899421375194, 'batch_norm': False, 'sage_aggr': 'max', 'sage_normalize': False, 'sage_project': False, 'lr': 1.011645658377874e-05, 'weight_decay': 0.00012057163204943926, 'epochs': 185, 'loss': 'mae', 'optimizer': 'adam', 'graph_mode': 'knn', 'knn_k': 6, 'weighted_edges': False, 'symmetrize_mode': 'union', 'self_loops': True, 'use_snp_selection': True, 'num_snps': 26610}. Best is trial 69 with value: 0.37979444876206886.
[I 2025-12-08 23:27:17,923] Trial 120 finished with value: 0.364405378021446 and parameters: {'model_type': 'graphsage', 'hidden_dims': '[512, 256]', 'dropout': 0.5690191590176057, 'batch_norm': False, 'sage_aggr': 'max', 'sage_normalize': False, 'sage_project': False, 'lr': 1.7762375354015844e-05, 'weight_decay': 2.4231890458077536e-05, 'epochs': 89, 'loss': 'mae', 'optimizer': 'adam', 'graph_mode': 'cutoff', 'cutoff': 0.8380038475962222, 'grm_norm': 'gcn', 'self_loops': True, 'use_snp_selection': True, 'num_snps': 24588}. Best is trial 69 with value: 0.37979444876206886.
[I 2025-12-08 23:28:00,529] Trial 121 finished with value: 0.36867652660200373 and parameters: {'model_type': 'graphsage', 'hidden_dims': '[256, 128, 64]', 'dropout': 0.5605322327004586, 'batch_norm': False, 'sage_aggr': 'max', 'sage_normalize': False, 'sage_project': False, 'lr': 1.2580837671259781e-05, 'weight_decay': 5.59287108704362e-07, 'epochs': 216, 'loss': 'mae', 'optimizer': 'adam', 'graph_mode': 'cutoff', 'cutoff': 0.8139952740087825, 'grm_norm': 'gcn', 'self_loops': True, 'use_snp_selection': True, 'num_snps': 28440}. Best is trial 69 with value: 0.37979444876206886.
[I 2025-12-08 23:28:30,595] Trial 122 finished with value: 0.37469975299849423 and parameters: {'model_type': 'graphsage', 'hidden_dims': '[256, 128, 64]', 'dropout': 0.5472227052973956, 'batch_norm': False, 'sage_aggr': 'max', 'sage_normalize': False, 'sage_project': False, 'lr': 1.4434065041979631e-05, 'weight_decay': 7.689977300677714e-07, 'epochs': 196, 'loss': 'mae', 'optimizer': 'adam', 'graph_mode': 'cutoff', 'cutoff': 0.8614800459254268, 'grm_norm': 'gcn', 'self_loops': True, 'use_snp_selection': True, 'num_snps': 19823}. Best is trial 69 with value: 0.37979444876206886.
[I 2025-12-08 23:29:01,140] Trial 123 finished with value: 0.3712030815526243 and parameters: {'model_type': 'graphsage', 'hidden_dims': '[256, 128, 64]', 'dropout': 0.5443230874027413, 'batch_norm': False, 'sage_aggr': 'max', 'sage_normalize': False, 'sage_project': False, 'lr': 1.549604743714893e-05, 'weight_decay': 0.00018702896979126682, 'epochs': 201, 'loss': 'mae', 'optimizer': 'adam', 'graph_mode': 'cutoff', 'cutoff': 0.8606166577132981, 'grm_norm': 'gcn', 'self_loops': True, 'use_snp_selection': True, 'num_snps': 19746}. Best is trial 69 with value: 0.37979444876206886.
[I 2025-12-08 23:29:29,086] Trial 124 finished with value: 0.3676400468650508 and parameters: {'model_type': 'graphsage', 'hidden_dims': '[256, 128, 64]', 'dropout': 0.5814935562847655, 'batch_norm': False, 'sage_aggr': 'max', 'sage_normalize': False, 'sage_project': False, 'lr': 1.1646790880200729e-05, 'weight_decay': 1.866707452133909e-05, 'epochs': 194, 'loss': 'mae', 'optimizer': 'adam', 'graph_mode': 'cutoff', 'cutoff': 0.8424560349345865, 'grm_norm': 'gcn', 'self_loops': True, 'use_snp_selection': True, 'num_snps': 17755}. Best is trial 69 with value: 0.37979444876206886.
[I 2025-12-08 23:29:51,251] Trial 125 finished with value: 0.36213940036886705 and parameters: {'model_type': 'graphsage', 'hidden_dims': '[256, 128, 64]', 'dropout': 0.5216712450795783, 'batch_norm': False, 'sage_aggr': 'max', 'sage_normalize': False, 'sage_project': False, 'lr': 1.3703562077513936e-05, 'weight_decay': 9.481745860297725e-05, 'epochs': 187, 'loss': 'mae', 'optimizer': 'adam', 'graph_mode': 'cutoff', 'cutoff': 0.8843957485633042, 'grm_norm': 'gcn', 'self_loops': True, 'use_snp_selection': True, 'num_snps': 13339}. Best is trial 69 with value: 0.37979444876206886.
[I 2025-12-08 23:30:00,990] Trial 126 finished with value: 0.33407482588437415 and parameters: {'model_type': 'graphsage', 'hidden_dims': '[128, 64]', 'dropout': 0.5530639888111132, 'batch_norm': False, 'sage_aggr': 'max', 'sage_normalize': False, 'sage_project': False, 'lr': 1.8277217803128778e-05, 'weight_decay': 7.657516935285154e-07, 'epochs': 175, 'loss': 'mae', 'optimizer': 'adam', 'graph_mode': 'cutoff', 'cutoff': 0.8719781072050656, 'grm_norm': 'gcn', 'self_loops': True, 'use_snp_selection': True, 'num_snps': 2482}. Best is trial 69 with value: 0.37979444876206886.
[I 2025-12-08 23:30:33,601] Trial 127 finished with value: 0.1973483055049967 and parameters: {'model_type': 'graphsage', 'hidden_dims': '[256, 128, 64]', 'dropout': 0.5684337189339981, 'batch_norm': False, 'sage_aggr': 'mean', 'sage_normalize': False, 'sage_project': False, 'lr': 0.0005201530871792811, 'weight_decay': 5.1584680915897566e-05, 'epochs': 203, 'loss': 'mae', 'optimizer': 'adam', 'graph_mode': 'cutoff', 'cutoff': 0.8253896587975124, 'grm_norm': 'none', 'self_loops': False, 'use_snp_selection': True, 'num_snps': 21657}. Best is trial 69 with value: 0.37979444876206886.
[I 2025-12-08 23:32:09,389] Trial 128 finished with value: 0.36124551111482306 and parameters: {'model_type': 'graphsage', 'hidden_dims': '[512, 64]', 'dropout': 0.533371270457481, 'batch_norm': False, 'sage_aggr': 'max', 'sage_normalize': False, 'sage_project': False, 'lr': 2.409319786557107e-05, 'weight_decay': 0.00016331149792634208, 'epochs': 169, 'loss': 'mae', 'optimizer': 'adam', 'graph_mode': 'cutoff', 'cutoff': 0.7983818089912559, 'grm_norm': 'gcn', 'self_loops': True, 'use_snp_selection': True, 'num_snps': 53770}. Best is trial 69 with value: 0.37979444876206886.
[I 2025-12-08 23:32:36,853] Trial 129 finished with value: 0.18780874828606683 and parameters: {'model_type': 'graphsage', 'hidden_dims': '[256, 128, 64]', 'dropout': 0.5994884227229018, 'batch_norm': False, 'sage_aggr': 'max', 'sage_normalize': False, 'sage_project': False, 'lr': 0.003815415641737659, 'weight_decay': 4.544297544635547e-05, 'epochs': 209, 'loss': 'mse', 'optimizer': 'adam', 'graph_mode': 'cutoff', 'cutoff': 0.8532971498548217, 'grm_norm': 'gcn', 'self_loops': True, 'use_snp_selection': True, 'num_snps': 16479}. Best is trial 69 with value: 0.37979444876206886.
[I 2025-12-08 23:33:11,257] Trial 130 finished with value: 0.36752139228286473 and parameters: {'model_type': 'graphsage', 'hidden_dims': '[256, 128, 64]', 'dropout': 0.4927863792389059, 'batch_norm': False, 'sage_aggr': 'max', 'sage_normalize': False, 'sage_project': False, 'lr': 1.5992832674348328e-05, 'weight_decay': 3.3727664453335e-05, 'epochs': 197, 'loss': 'mae', 'optimizer': 'adam', 'graph_mode': 'cutoff', 'cutoff': 0.7484958498913713, 'grm_norm': 'cosine', 'self_loops': True, 'use_snp_selection': True, 'num_snps': 23617}. Best is trial 69 with value: 0.37979444876206886.
[I 2025-12-08 23:33:51,833] Trial 131 finished with value: 0.3666515578416353 and parameters: {'model_type': 'graphsage', 'hidden_dims': '[256, 128, 64]', 'dropout': 0.5474083699278229, 'batch_norm': False, 'sage_aggr': 'max', 'sage_normalize': False, 'sage_project': False, 'lr': 1.4267972340657362e-05, 'weight_decay': 6.260074664720521e-07, 'epochs': 189, 'loss': 'mae', 'optimizer': 'adam', 'graph_mode': 'cutoff', 'cutoff': 0.8386747408746047, 'grm_norm': 'cosine_then_gcn', 'self_loops': True, 'use_snp_selection': True, 'num_snps': 30627}. Best is trial 69 with value: 0.37979444876206886.
[I 2025-12-08 23:34:33,278] Trial 132 finished with value: 0.3726614938802414 and parameters: {'model_type': 'graphsage', 'hidden_dims': '[256, 128, 64]', 'dropout': 0.5774925329574321, 'batch_norm': False, 'sage_aggr': 'max', 'sage_normalize': False, 'sage_project': False, 'lr': 1.1241550884554639e-05, 'weight_decay': 8.229710138565747e-07, 'epochs': 306, 'loss': 'mae', 'optimizer': 'adam', 'graph_mode': 'cutoff', 'cutoff': 0.8654922070040704, 'grm_norm': 'cosine_then_gcn', 'self_loops': True, 'use_snp_selection': True, 'num_snps': 20635}. Best is trial 69 with value: 0.37979444876206886.
[I 2025-12-08 23:36:57,764] Trial 133 finished with value: 0.3044137673913666 and parameters: {'model_type': 'graphsage', 'hidden_dims': '[256, 128, 64]', 'dropout': 0.5845733038601375, 'batch_norm': False, 'sage_aggr': 'max', 'sage_normalize': False, 'sage_project': False, 'lr': 1.2085718235317978e-05, 'weight_decay': 2.5081508128738003e-07, 'epochs': 314, 'loss': 'mae', 'optimizer': 'adam', 'graph_mode': 'cutoff', 'cutoff': 0.2102469422702014, 'grm_norm': 'gcn', 'self_loops': True, 'use_snp_selection': True, 'num_snps': 20815}. Best is trial 69 with value: 0.37979444876206886.
[I 2025-12-08 23:37:33,803] Trial 134 finished with value: 0.37378550235859986 and parameters: {'model_type': 'graphsage', 'hidden_dims': '[256, 128, 64]', 'dropout': 0.5749622085076483, 'batch_norm': False, 'sage_aggr': 'max', 'sage_normalize': False, 'sage_project': False, 'lr': 1.0119351991456143e-05, 'weight_decay': 4.840560966652794e-07, 'epochs': 285, 'loss': 'mae', 'optimizer': 'adam', 'graph_mode': 'cutoff', 'cutoff': 0.8814680882105635, 'grm_norm': 'cosine_then_gcn', 'self_loops': True, 'use_snp_selection': True, 'num_snps': 18079}. Best is trial 69 with value: 0.37979444876206886.
[I 2025-12-08 23:38:15,175] Trial 135 finished with value: 0.3740706448261065 and parameters: {'model_type': 'graphsage', 'hidden_dims': '[256, 128, 64]', 'dropout': 0.5744041342087614, 'batch_norm': False, 'sage_aggr': 'max', 'sage_normalize': False, 'sage_project': False, 'lr': 1.0970600570708294e-05, 'weight_decay': 4.547987671398381e-07, 'epochs': 283, 'loss': 'mae', 'optimizer': 'adam', 'graph_mode': 'cutoff', 'cutoff': 0.8862824002960609, 'grm_norm': 'cosine_then_gcn', 'self_loops': True, 'use_snp_selection': True, 'num_snps': 22132}. Best is trial 69 with value: 0.37979444876206886.
[I 2025-12-08 23:38:52,109] Trial 136 finished with value: 0.36475546570852424 and parameters: {'model_type': 'graphsage', 'hidden_dims': '[256, 128, 64]', 'dropout': 0.5765296527447387, 'batch_norm': True, 'sage_aggr': 'max', 'sage_normalize': True, 'sage_project': False, 'lr': 1.1414295010045878e-05, 'weight_decay': 3.6594793424524424e-07, 'epochs': 292, 'loss': 'mae', 'optimizer': 'adam', 'graph_mode': 'cutoff', 'cutoff': 0.888561519331781, 'grm_norm': 'cosine_then_gcn', 'self_loops': True, 'use_snp_selection': True, 'num_snps': 17786}. Best is trial 69 with value: 0.37979444876206886.
[I 2025-12-08 23:41:47,227] Trial 137 finished with value: 0.31834642629640597 and parameters: {'model_type': 'graphsage', 'hidden_dims': '[256, 128, 64]', 'dropout': 0.58883256023807, 'batch_norm': False, 'sage_aggr': 'max', 'sage_normalize': False, 'sage_project': False, 'lr': 1.285023925311117e-05, 'weight_decay': 4.4832232210220494e-07, 'epochs': 301, 'loss': 'mae', 'optimizer': 'adam', 'graph_mode': 'cutoff', 'cutoff': 0.3085925672205627, 'grm_norm': 'cosine_then_gcn', 'self_loops': True, 'use_snp_selection': False}. Best is trial 69 with value: 0.37979444876206886.
[I 2025-12-08 23:42:24,284] Trial 138 finished with value: 0.36661031205003186 and parameters: {'model_type': 'graphsage', 'hidden_dims': '[256, 128, 64]', 'dropout': 0.5665124892498277, 'batch_norm': False, 'sage_aggr': 'max', 'sage_normalize': False, 'sage_project': False, 'lr': 2.0186749361306422e-05, 'weight_decay': 2.585600540368883e-07, 'epochs': 270, 'loss': 'mae', 'optimizer': 'adam', 'graph_mode': 'cutoff', 'cutoff': 0.8723189257334394, 'grm_norm': 'cosine_then_gcn', 'self_loops': True, 'use_snp_selection': True, 'num_snps': 19945}. Best is trial 69 with value: 0.37979444876206886.
[I 2025-12-08 23:43:09,375] Trial 139 finished with value: 0.3656403928138688 and parameters: {'model_type': 'graphsage', 'hidden_dims': '[256, 128]', 'dropout': 0.5726111469477921, 'batch_norm': False, 'sage_aggr': 'max', 'sage_normalize': False, 'sage_project': False, 'lr': 1.1108830612986061e-05, 'weight_decay': 4.467237321647133e-07, 'epochs': 322, 'loss': 'mae', 'optimizer': 'adam', 'graph_mode': 'cutoff', 'cutoff': 0.8847697526848718, 'grm_norm': 'cosine_then_gcn', 'self_loops': True, 'use_snp_selection': True, 'num_snps': 22210}. Best is trial 69 with value: 0.37979444876206886.
[I 2025-12-08 23:43:54,017] Trial 140 finished with value: 0.32269223122925583 and parameters: {'model_type': 'graphsage', 'hidden_dims': '[256, 128, 64]', 'dropout': 0.5604334792898753, 'batch_norm': False, 'sage_aggr': 'max', 'sage_normalize': False, 'sage_project': False, 'lr': 1.4496136923794009e-05, 'weight_decay': 1.6500140277833906e-07, 'epochs': 283, 'loss': 'mae', 'optimizer': 'adam', 'graph_mode': 'knn', 'knn_k': 4, 'weighted_edges': True, 'symmetrize_mode': 'mutual', 'self_loops': True, 'use_snp_selection': True, 'num_snps': 16426}. Best is trial 69 with value: 0.37979444876206886.
[I 2025-12-08 23:44:47,591] Trial 141 finished with value: 0.0 and parameters: {'model_type': 'graphsage', 'hidden_dims': '[256, 128, 64]', 'dropout': 0.38037360906376383, 'batch_norm': False, 'sage_aggr': 'max', 'sage_normalize': False, 'sage_project': False, 'lr': 0.00950059717372258, 'weight_decay': 7.288985127182264e-07, 'epochs': 347, 'loss': 'mae', 'optimizer': 'adam', 'graph_mode': 'cutoff', 'cutoff': 0.8708828891802891, 'grm_norm': 'cosine_then_gcn', 'self_loops': True, 'use_snp_selection': True, 'num_snps': 25130}. Best is trial 69 with value: 0.37979444876206886.
[I 2025-12-08 23:45:26,634] Trial 142 finished with value: 0.3730527190671008 and parameters: {'model_type': 'graphsage', 'hidden_dims': '[256, 128, 64]', 'dropout': 0.5820458247662302, 'batch_norm': False, 'sage_aggr': 'max', 'sage_normalize': False, 'sage_project': False, 'lr': 1.0091524784606931e-05, 'weight_decay': 9.281202648845239e-07, 'epochs': 310, 'loss': 'mae', 'optimizer': 'adam', 'graph_mode': 'cutoff', 'cutoff': 0.8556783270387953, 'grm_norm': 'gcn', 'self_loops': True, 'use_snp_selection': True, 'num_snps': 18523}. Best is trial 69 with value: 0.37979444876206886.
[I 2025-12-08 23:46:04,296] Trial 143 finished with value: 0.37133781446008157 and parameters: {'model_type': 'graphsage', 'hidden_dims': '[256, 128, 64]', 'dropout': 0.5860561686435454, 'batch_norm': False, 'sage_aggr': 'max', 'sage_normalize': False, 'sage_project': False, 'lr': 1.1228481850047567e-05, 'weight_decay': 8.599127551766887e-07, 'epochs': 298, 'loss': 'mae', 'optimizer': 'adam', 'graph_mode': 'cutoff', 'cutoff': 0.8601402558214265, 'grm_norm': 'cosine_then_gcn', 'self_loops': True, 'use_snp_selection': True, 'num_snps': 18539}. Best is trial 69 with value: 0.37979444876206886.
[I 2025-12-08 23:46:34,830] Trial 144 finished with value: 0.3732016377327831 and parameters: {'model_type': 'graphsage', 'hidden_dims': '[256, 128, 64]', 'dropout': 0.5939797670344522, 'batch_norm': False, 'sage_aggr': 'max', 'sage_normalize': False, 'sage_project': False, 'lr': 1.0026353201601808e-05, 'weight_decay': 1.1448181550050478e-06, 'epochs': 316, 'loss': 'mae', 'optimizer': 'adam', 'graph_mode': 'cutoff', 'cutoff': 0.8289292768388241, 'grm_norm': 'none', 'self_loops': True, 'use_snp_selection': True, 'num_snps': 13467}. Best is trial 69 with value: 0.37979444876206886.
[I 2025-12-08 23:47:03,326] Trial 145 finished with value: 0.36280719167728265 and parameters: {'model_type': 'graphsage', 'hidden_dims': '[256, 128, 64]', 'dropout': 0.5939426991536462, 'batch_norm': False, 'sage_aggr': 'max', 'sage_normalize': False, 'sage_project': False, 'lr': 1.0261061880880749e-05, 'weight_decay': 1.2776952089990432e-06, 'epochs': 317, 'loss': 'mae', 'optimizer': 'adam', 'graph_mode': 'cutoff', 'cutoff': 0.8274132387691898, 'grm_norm': 'gcn', 'self_loops': True, 'use_snp_selection': True, 'num_snps': 12078}. Best is trial 69 with value: 0.37979444876206886.
[I 2025-12-08 23:47:28,198] Trial 146 finished with value: 0.3644372975645177 and parameters: {'model_type': 'graphsage', 'hidden_dims': '[256, 128, 64]', 'dropout': 0.5766044194877487, 'batch_norm': False, 'sage_aggr': 'max', 'sage_normalize': False, 'sage_project': False, 'lr': 1.3198166657713718e-05, 'weight_decay': 3.030822282931738e-07, 'epochs': 326, 'loss': 'mae', 'optimizer': 'adam', 'graph_mode': 'cutoff', 'cutoff': 0.8982016575473172, 'grm_norm': 'none', 'self_loops': True, 'use_snp_selection': True, 'num_snps': 9516}. Best is trial 69 with value: 0.37979444876206886.
[I 2025-12-08 23:47:56,866] Trial 147 finished with value: 0.05815717535524635 and parameters: {'model_type': 'graphsage', 'hidden_dims': '[256, 128, 64]', 'dropout': 0.5977947419905553, 'batch_norm': False, 'sage_aggr': 'max', 'sage_normalize': False, 'sage_project': False, 'lr': 0.0013470867195996502, 'weight_decay': 5.591711404508401e-07, 'epochs': 246, 'loss': 'mse', 'optimizer': 'adam', 'graph_mode': 'cutoff', 'cutoff': 0.8176834052732171, 'grm_norm': 'gcn', 'self_loops': True, 'use_snp_selection': True, 'num_snps': 15178}. Best is trial 69 with value: 0.37979444876206886.
[I 2025-12-08 23:48:26,286] Trial 148 finished with value: 0.3701758058917981 and parameters: {'model_type': 'graphsage', 'hidden_dims': '[256, 128, 64]', 'dropout': 0.5809326807914161, 'batch_norm': False, 'sage_aggr': 'max', 'sage_normalize': False, 'sage_project': False, 'lr': 1.0000739278014696e-05, 'weight_decay': 9.839962902486405e-07, 'epochs': 306, 'loss': 'mae', 'optimizer': 'adam', 'graph_mode': 'cutoff', 'cutoff': 0.8778991196454112, 'grm_norm': 'none', 'self_loops': True, 'use_snp_selection': True, 'num_snps': 13174}. Best is trial 69 with value: 0.37979444876206886.
