[I 2025-12-09 16:27:48,297] Trial 70 finished with value: 0.2910635970132161 and parameters: {'model_type': 'graphsage', 'hidden_dims': '[256, 128]', 'dropout': 0.3177454185214725, 'batch_norm': False, 'sage_aggr': 'max', 'sage_normalize': False, 'sage_project': False, 'lr': 1.2621311222425853e-05, 'weight_decay': 1.6276601550373405e-05, 'epochs': 195, 'loss': 'mse', 'optimizer': 'adam', 'graph_mode': 'cutoff', 'cutoff': 0.4615421323181111, 'grm_norm': 'cosine', 'self_loops': False, 'use_snp_selection': False}. Best is trial 42 with value: 0.29695598343060625.
[I 2025-12-09 16:30:48,102] Trial 71 finished with value: 0.29375403588904503 and parameters: {'model_type': 'graphsage', 'hidden_dims': '[512, 64]', 'dropout': 0.2965742684709888, 'batch_norm': False, 'sage_aggr': 'max', 'sage_normalize': False, 'sage_project': False, 'lr': 1.1399675568689305e-05, 'weight_decay': 4.460744922114675e-06, 'epochs': 236, 'loss': 'mse', 'optimizer': 'adam', 'graph_mode': 'cutoff', 'cutoff': 0.38322042453538074, 'grm_norm': 'gcn', 'self_loops': False, 'use_snp_selection': False}. Best is trial 42 with value: 0.29695598343060625.
[I 2025-12-09 16:33:57,033] Trial 72 finished with value: 0.2908872643567009 and parameters: {'model_type': 'graphsage', 'hidden_dims': '[512, 64]', 'dropout': 0.29554507696734966, 'batch_norm': False, 'sage_aggr': 'max', 'sage_normalize': False, 'sage_project': False, 'lr': 1.632812906913148e-05, 'weight_decay': 3.5874413135061212e-06, 'epochs': 247, 'loss': 'mse', 'optimizer': 'adam', 'graph_mode': 'cutoff', 'cutoff': 0.37356651645366723, 'grm_norm': 'gcn', 'self_loops': False, 'use_snp_selection': False}. Best is trial 42 with value: 0.29695598343060625.
[I 2025-12-09 16:37:04,617] Trial 73 finished with value: 0.2626189179415243 and parameters: {'model_type': 'graphsage', 'hidden_dims': '[512, 64]', 'dropout': 0.27233223309446136, 'batch_norm': False, 'sage_aggr': 'max', 'sage_normalize': False, 'sage_project': False, 'lr': 2.0796632440818956e-05, 'weight_decay': 2.4600917205616714e-06, 'epochs': 216, 'loss': 'mse', 'optimizer': 'adam', 'graph_mode': 'cutoff', 'cutoff': 0.338312582417384, 'grm_norm': 'gcn', 'self_loops': False, 'use_snp_selection': False}. Best is trial 42 with value: 0.29695598343060625.
[I 2025-12-09 16:40:27,860] Trial 74 finished with value: 0.2857790481533985 and parameters: {'model_type': 'graphsage', 'hidden_dims': '[512, 64]', 'dropout': 0.22734947010245432, 'batch_norm': False, 'sage_aggr': 'max', 'sage_normalize': False, 'sage_project': False, 'lr': 3.473359663630846e-05, 'weight_decay': 3.986694842927337e-06, 'epochs': 276, 'loss': 'mse', 'optimizer': 'adam', 'graph_mode': 'cutoff', 'cutoff': 0.4174070980122829, 'grm_norm': 'gcn', 'self_loops': False, 'use_snp_selection': False}. Best is trial 42 with value: 0.29695598343060625.
[I 2025-12-09 16:43:53,306] Trial 75 finished with value: 0.2846630211488698 and parameters: {'model_type': 'graphsage', 'hidden_dims': '[512, 128]', 'dropout': 0.38537410529350946, 'batch_norm': False, 'sage_aggr': 'max', 'sage_normalize': False, 'sage_project': False, 'lr': 1.1950006582695187e-05, 'weight_decay': 7.256999782293315e-06, 'epochs': 231, 'loss': 'mse', 'optimizer': 'adam', 'graph_mode': 'cutoff', 'cutoff': 0.32780702835211073, 'grm_norm': 'gcn', 'self_loops': False, 'use_snp_selection': False}. Best is trial 42 with value: 0.29695598343060625.
[I 2025-12-09 16:46:50,429] Trial 76 finished with value: 0.28484160417948373 and parameters: {'model_type': 'graphsage', 'hidden_dims': '[512, 64]', 'dropout': 0.32267985917831826, 'batch_norm': False, 'sage_aggr': 'max', 'sage_normalize': False, 'sage_project': False, 'lr': 1.504840000643597e-05, 'weight_decay': 4.585366793802329e-06, 'epochs': 266, 'loss': 'mse', 'optimizer': 'adam', 'graph_mode': 'cutoff', 'cutoff': 0.5098207815381128, 'grm_norm': 'gcn', 'self_loops': False, 'use_snp_selection': False}. Best is trial 42 with value: 0.29695598343060625.
[I 2025-12-09 16:48:28,199] Trial 77 finished with value: 0.2938046004689901 and parameters: {'model_type': 'graphsage', 'hidden_dims': '[128, 64]', 'dropout': 0.20538484781800453, 'batch_norm': False, 'sage_aggr': 'max', 'sage_normalize': False, 'sage_project': False, 'lr': 2.610584055285075e-05, 'weight_decay': 1.0857897837054828e-05, 'epochs': 292, 'loss': 'mse', 'optimizer': 'adam', 'graph_mode': 'cutoff', 'cutoff': 0.4396224064356207, 'grm_norm': 'cosine_then_gcn', 'self_loops': False, 'use_snp_selection': False}. Best is trial 42 with value: 0.29695598343060625.
[I 2025-12-09 16:49:45,625] Trial 78 finished with value: 0.2930287418707914 and parameters: {'model_type': 'graphsage', 'hidden_dims': '[128, 64]', 'dropout': 0.1919091632818942, 'batch_norm': False, 'sage_aggr': 'mean', 'sage_normalize': False, 'sage_project': False, 'lr': 2.593829987422536e-05, 'weight_decay': 1.1162096213031297e-05, 'epochs': 251, 'loss': 'mse', 'optimizer': 'adam', 'graph_mode': 'cutoff', 'cutoff': 0.44816126429861636, 'grm_norm': 'cosine_then_gcn', 'self_loops': False, 'use_snp_selection': False}. Best is trial 42 with value: 0.29695598343060625.
[I 2025-12-09 16:51:17,037] Trial 79 finished with value: 0.2923713533868785 and parameters: {'model_type': 'graphsage', 'hidden_dims': '[128, 64]', 'dropout': 0.13789939297109594, 'batch_norm': False, 'sage_aggr': 'max', 'sage_normalize': False, 'sage_project': False, 'lr': 1.9078660193081446e-05, 'weight_decay': 2.329614056258119e-06, 'epochs': 293, 'loss': 'mse', 'optimizer': 'adam', 'graph_mode': 'cutoff', 'cutoff': 0.4860711912075122, 'grm_norm': 'cosine_then_gcn', 'self_loops': False, 'use_snp_selection': False}. Best is trial 42 with value: 0.29695598343060625.
[I 2025-12-09 16:52:41,942] Trial 80 finished with value: 0.2311340111948385 and parameters: {'model_type': 'graphsage', 'hidden_dims': '[128, 64]', 'dropout': 0.3764791535527608, 'batch_norm': True, 'sage_aggr': 'max', 'sage_normalize': True, 'sage_project': False, 'lr': 5.655878426385177e-05, 'weight_decay': 6.556471512124318e-06, 'epochs': 230, 'loss': 'mse', 'optimizer': 'adam', 'graph_mode': 'cutoff', 'cutoff': 0.3719631973890686, 'grm_norm': 'cosine_then_gcn', 'self_loops': True, 'use_snp_selection': False}. Best is trial 42 with value: 0.29695598343060625.
[I 2025-12-09 16:54:00,719] Trial 81 finished with value: 0.2934577319552313 and parameters: {'model_type': 'graphsage', 'hidden_dims': '[128, 64]', 'dropout': 0.19311087615796313, 'batch_norm': False, 'sage_aggr': 'mean', 'sage_normalize': False, 'sage_project': False, 'lr': 2.747101053067185e-05, 'weight_decay': 1.0999048622594785e-05, 'epochs': 253, 'loss': 'mse', 'optimizer': 'adam', 'graph_mode': 'cutoff', 'cutoff': 0.435836999409473, 'grm_norm': 'cosine_then_gcn', 'self_loops': False, 'use_snp_selection': False}. Best is trial 42 with value: 0.29695598343060625.
[I 2025-12-09 16:55:28,390] Trial 82 finished with value: 0.2943059978638233 and parameters: {'model_type': 'graphsage', 'hidden_dims': '[128, 64]', 'dropout': 0.19838025547893148, 'batch_norm': False, 'sage_aggr': 'mean', 'sage_normalize': False, 'sage_project': False, 'lr': 2.0487250076972282e-05, 'weight_decay': 9.131909497734442e-06, 'epochs': 280, 'loss': 'mse', 'optimizer': 'adam', 'graph_mode': 'cutoff', 'cutoff': 0.4233296261629461, 'grm_norm': 'cosine_then_gcn', 'self_loops': False, 'use_snp_selection': False}. Best is trial 42 with value: 0.29695598343060625.
[I 2025-12-09 16:56:58,185] Trial 83 finished with value: 0.29169886686286783 and parameters: {'model_type': 'graphsage', 'hidden_dims': '[128, 64]', 'dropout': 0.21280415827357224, 'batch_norm': False, 'sage_aggr': 'mean', 'sage_normalize': False, 'sage_project': False, 'lr': 3.567755493245088e-05, 'weight_decay': 8.295724202799788e-06, 'epochs': 281, 'loss': 'mse', 'optimizer': 'adam', 'graph_mode': 'cutoff', 'cutoff': 0.39241802119528035, 'grm_norm': 'cosine_then_gcn', 'self_loops': False, 'use_snp_selection': False}. Best is trial 42 with value: 0.29695598343060625.
[I 2025-12-09 16:57:58,804] Trial 84 finished with value: 0.292806072475156 and parameters: {'model_type': 'graphsage', 'hidden_dims': '[128, 64]', 'dropout': 0.1568436651690346, 'batch_norm': False, 'sage_aggr': 'mean', 'sage_normalize': False, 'sage_project': False, 'lr': 1.4253032192131387e-05, 'weight_decay': 1.7223933137950513e-05, 'epochs': 270, 'loss': 'mse', 'optimizer': 'adam', 'graph_mode': 'cutoff', 'cutoff': 0.5309218381128857, 'grm_norm': 'cosine_then_gcn', 'self_loops': False, 'use_snp_selection': False}. Best is trial 42 with value: 0.29695598343060625.
[I 2025-12-09 16:59:44,236] Trial 85 finished with value: 0.2797724671863328 and parameters: {'model_type': 'graphsage', 'hidden_dims': '[256, 128, 64]', 'dropout': 0.20584481696618487, 'batch_norm': False, 'sage_aggr': 'mean', 'sage_normalize': False, 'sage_project': False, 'lr': 2.092240359901876e-05, 'weight_decay': 2.8637439592007287e-06, 'epochs': 243, 'loss': 'mse', 'optimizer': 'adam', 'graph_mode': 'cutoff', 'cutoff': 0.468001780642448, 'grm_norm': 'gcn', 'self_loops': False, 'use_snp_selection': False}. Best is trial 42 with value: 0.29695598343060625.
[I 2025-12-09 17:00:34,909] Trial 86 finished with value: 0.2773084338368291 and parameters: {'model_type': 'graphsage', 'hidden_dims': '[128, 64]', 'dropout': 0.25377898937919946, 'batch_norm': False, 'sage_aggr': 'max', 'sage_normalize': False, 'sage_project': False, 'lr': 4.452195571629795e-05, 'weight_decay': 1.7486950420781412e-06, 'epochs': 259, 'loss': 'mae', 'optimizer': 'adam', 'graph_mode': 'cutoff', 'cutoff': 0.886333535758203, 'grm_norm': 'cosine_then_gcn', 'self_loops': False, 'use_snp_selection': False}. Best is trial 42 with value: 0.29695598343060625.
[I 2025-12-09 17:06:41,936] Trial 87 finished with value: 0.2882907041020586 and parameters: {'model_type': 'graphsage', 'hidden_dims': '[512, 64]', 'dropout': 0.23526606328156213, 'batch_norm': False, 'sage_aggr': 'mean', 'sage_normalize': False, 'sage_project': False, 'lr': 1.5999476814840683e-05, 'weight_decay': 1.0242857450407147e-06, 'epochs': 289, 'loss': 'mse', 'optimizer': 'adam', 'graph_mode': 'cutoff', 'cutoff': 0.20264910579638973, 'grm_norm': 'cosine', 'self_loops': False, 'use_snp_selection': False}. Best is trial 42 with value: 0.29695598343060625.
[I 2025-12-09 17:08:20,165] Trial 88 finished with value: 0.29193993229247417 and parameters: {'model_type': 'graphsage', 'hidden_dims': '[128, 64]', 'dropout': 0.3582558726895028, 'batch_norm': False, 'sage_aggr': 'max', 'sage_normalize': False, 'sage_project': False, 'lr': 1.1551723998409217e-05, 'weight_decay': 4.7475890251464405e-06, 'epochs': 277, 'loss': 'mse', 'optimizer': 'adam', 'graph_mode': 'cutoff', 'cutoff': 0.41882736104903495, 'grm_norm': 'gcn', 'self_loops': False, 'use_snp_selection': False}. Best is trial 42 with value: 0.29695598343060625.
[I 2025-12-09 17:11:31,708] Trial 89 finished with value: 0.2822716363231174 and parameters: {'model_type': 'graphsage', 'hidden_dims': '[512, 64]', 'dropout': 0.3949712739201231, 'batch_norm': False, 'sage_aggr': 'max', 'sage_normalize': False, 'sage_project': False, 'lr': 2.4403917989373953e-05, 'weight_decay': 1.3510987865375204e-05, 'epochs': 329, 'loss': 'mse', 'optimizer': 'adam', 'graph_mode': 'cutoff', 'cutoff': 0.6125944987377345, 'grm_norm': 'gcn', 'self_loops': False, 'use_snp_selection': False}. Best is trial 42 with value: 0.29695598343060625.
[I 2025-12-09 17:13:37,588] Trial 90 finished with value: 0.2930872668200268 and parameters: {'model_type': 'graphsage', 'hidden_dims': '[256, 128]', 'dropout': 0.2847043871967256, 'batch_norm': False, 'sage_aggr': 'max', 'sage_normalize': False, 'sage_project': False, 'lr': 1.9313043584822674e-05, 'weight_decay': 5.197914965433583e-07, 'epochs': 266, 'loss': 'mse', 'optimizer': 'adam', 'graph_mode': 'cutoff', 'cutoff': 0.3905217636327048, 'grm_norm': 'cosine_then_gcn', 'self_loops': False, 'use_snp_selection': False}. Best is trial 42 with value: 0.29695598343060625.
[I 2025-12-09 17:14:55,664] Trial 91 finished with value: 0.293153238711144 and parameters: {'model_type': 'graphsage', 'hidden_dims': '[128, 64]', 'dropout': 0.1902696576914312, 'batch_norm': False, 'sage_aggr': 'mean', 'sage_normalize': False, 'sage_project': False, 'lr': 3.17817253827187e-05, 'weight_decay': 9.56153641550431e-06, 'epochs': 253, 'loss': 'mse', 'optimizer': 'adam', 'graph_mode': 'cutoff', 'cutoff': 0.44253875258407277, 'grm_norm': 'cosine_then_gcn', 'self_loops': False, 'use_snp_selection': False}. Best is trial 42 with value: 0.29695598343060625.
[I 2025-12-09 17:16:08,498] Trial 92 finished with value: 0.29223309720153495 and parameters: {'model_type': 'graphsage', 'hidden_dims': '[128, 64]', 'dropout': 0.16435136261192565, 'batch_norm': False, 'sage_aggr': 'mean', 'sage_normalize': False, 'sage_project': False, 'lr': 1.4113061223104847e-05, 'weight_decay': 6.075613117948717e-06, 'epochs': 231, 'loss': 'mse', 'optimizer': 'adam', 'graph_mode': 'cutoff', 'cutoff': 0.42929230672232743, 'grm_norm': 'cosine_then_gcn', 'self_loops': False, 'use_snp_selection': False}. Best is trial 42 with value: 0.29695598343060625.
[I 2025-12-09 17:17:31,949] Trial 93 finished with value: 0.28812359087087 and parameters: {'model_type': 'graphsage', 'hidden_dims': '[128, 64]', 'dropout': 0.18132500265798518, 'batch_norm': False, 'sage_aggr': 'mean', 'sage_normalize': False, 'sage_project': False, 'lr': 2.4839718269834937e-05, 'weight_decay': 1.177115843111403e-05, 'epochs': 243, 'loss': 'mse', 'optimizer': 'adam', 'graph_mode': 'cutoff', 'cutoff': 0.3482461869119896, 'grm_norm': 'cosine_then_gcn', 'self_loops': False, 'use_snp_selection': False}. Best is trial 42 with value: 0.29695598343060625.
[I 2025-12-09 17:18:18,673] Trial 94 finished with value: 0.2957385865168666 and parameters: {'model_type': 'graphsage', 'hidden_dims': '[128, 64]', 'dropout': 0.30163928756725855, 'batch_norm': False, 'sage_aggr': 'mean', 'sage_normalize': False, 'sage_project': False, 'lr': 1.1416363040751208e-05, 'weight_decay': 2.7179112121028453e-05, 'epochs': 211, 'loss': 'mse', 'optimizer': 'adam', 'graph_mode': 'cutoff', 'cutoff': 0.5756336495634461, 'grm_norm': 'gcn', 'self_loops': False, 'use_snp_selection': False}. Best is trial 42 with value: 0.29695598343060625.
[I 2025-12-09 17:20:24,127] Trial 95 finished with value: 0.29668605142821775 and parameters: {'model_type': 'graphsage', 'hidden_dims': '[512, 128]', 'dropout': 0.302627207313816, 'batch_norm': False, 'sage_aggr': 'mean', 'sage_normalize': False, 'sage_project': False, 'lr': 1.1839348534309686e-05, 'weight_decay': 3.654103851653688e-05, 'epochs': 208, 'loss': 'mse', 'optimizer': 'adam', 'graph_mode': 'cutoff', 'cutoff': 0.5968771509004588, 'grm_norm': 'gcn', 'self_loops': False, 'use_snp_selection': False}. Best is trial 42 with value: 0.29695598343060625.
[I 2025-12-09 17:22:26,937] Trial 96 finished with value: 0.294546538641382 and parameters: {'model_type': 'graphsage', 'hidden_dims': '[512, 128]', 'dropout': 0.2994691941032504, 'batch_norm': False, 'sage_aggr': 'mean', 'sage_normalize': False, 'sage_project': False, 'lr': 1.0940733452185004e-05, 'weight_decay': 6.375612491352014e-05, 'epochs': 202, 'loss': 'mse', 'optimizer': 'adam', 'graph_mode': 'cutoff', 'cutoff': 0.5914513939149502, 'grm_norm': 'gcn', 'self_loops': False, 'use_snp_selection': False}. Best is trial 42 with value: 0.29695598343060625.
[I 2025-12-09 17:24:29,457] Trial 97 finished with value: 0.29055583161935195 and parameters: {'model_type': 'graphsage', 'hidden_dims': '[512, 128]', 'dropout': 0.33214998817594443, 'batch_norm': True, 'sage_aggr': 'mean', 'sage_normalize': True, 'sage_project': False, 'lr': 0.001353338684012779, 'weight_decay': 3.6483167585532714e-05, 'epochs': 201, 'loss': 'mse', 'optimizer': 'adam', 'graph_mode': 'cutoff', 'cutoff': 0.6491923300423619, 'grm_norm': 'gcn', 'self_loops': False, 'use_snp_selection': False}. Best is trial 42 with value: 0.29695598343060625.
[I 2025-12-09 17:26:22,878] Trial 98 finished with value: 0.2956263657070125 and parameters: {'model_type': 'graphsage', 'hidden_dims': '[512, 128]', 'dropout': 0.2684523919033695, 'batch_norm': False, 'sage_aggr': 'mean', 'sage_normalize': False, 'sage_project': False, 'lr': 1.821121974045271e-05, 'weight_decay': 7.749084322351611e-05, 'epochs': 188, 'loss': 'mse', 'optimizer': 'adam', 'graph_mode': 'cutoff', 'cutoff': 0.5915592703070829, 'grm_norm': 'gcn', 'self_loops': False, 'use_snp_selection': False}. Best is trial 42 with value: 0.29695598343060625.
[I 2025-12-09 17:28:13,000] Trial 99 finished with value: 0.2819248650977262 and parameters: {'model_type': 'graphsage', 'hidden_dims': '[512, 128]', 'dropout': 0.3039423706272414, 'batch_norm': False, 'sage_aggr': 'mean', 'sage_normalize': False, 'sage_project': False, 'lr': 1.653394996442137e-05, 'weight_decay': 6.935056189961434e-05, 'epochs': 179, 'loss': 'mae', 'optimizer': 'adam', 'graph_mode': 'cutoff', 'cutoff': 0.5664101704212576, 'grm_norm': 'gcn', 'self_loops': True, 'use_snp_selection': False}. Best is trial 42 with value: 0.29695598343060625.
[I 2025-12-09 17:30:19,169] Trial 100 finished with value: 0.2998517231124538 and parameters: {'model_type': 'graphsage', 'hidden_dims': '[512, 128]', 'dropout': 0.2638140248061741, 'batch_norm': False, 'sage_aggr': 'mean', 'sage_normalize': False, 'sage_project': False, 'lr': 1.1340855392717052e-05, 'weight_decay': 5.955552757865554e-05, 'epochs': 208, 'loss': 'mse', 'optimizer': 'adam', 'graph_mode': 'cutoff', 'cutoff': 0.5827224856595336, 'grm_norm': 'gcn', 'self_loops': False, 'use_snp_selection': False}. Best is trial 100 with value: 0.2998517231124538.
[I 2025-12-09 17:32:12,926] Trial 101 finished with value: 0.29845602339208677 and parameters: {'model_type': 'graphsage', 'hidden_dims': '[512, 128]', 'dropout': 0.2630985782608524, 'batch_norm': False, 'sage_aggr': 'mean', 'sage_normalize': False, 'sage_project': False, 'lr': 1.1355208731835004e-05, 'weight_decay': 5.843732981362016e-05, 'epochs': 187, 'loss': 'mse', 'optimizer': 'adam', 'graph_mode': 'cutoff', 'cutoff': 0.5919300900326716, 'grm_norm': 'gcn', 'self_loops': False, 'use_snp_selection': False}. Best is trial 100 with value: 0.2998517231124538.
[I 2025-12-09 17:34:09,299] Trial 102 finished with value: 0.2961337177388915 and parameters: {'model_type': 'graphsage', 'hidden_dims': '[512, 128]', 'dropout': 0.270254260448765, 'batch_norm': False, 'sage_aggr': 'mean', 'sage_normalize': False, 'sage_project': False, 'lr': 1.1175640411148339e-05, 'weight_decay': 6.19007399361006e-05, 'epochs': 191, 'loss': 'mse', 'optimizer': 'adam', 'graph_mode': 'cutoff', 'cutoff': 0.5859324030119373, 'grm_norm': 'gcn', 'self_loops': False, 'use_snp_selection': False}. Best is trial 100 with value: 0.2998517231124538.
[I 2025-12-09 17:36:04,257] Trial 103 finished with value: 0.29820876434161236 and parameters: {'model_type': 'graphsage', 'hidden_dims': '[512, 128]', 'dropout': 0.2661953486234615, 'batch_norm': False, 'sage_aggr': 'mean', 'sage_normalize': False, 'sage_project': False, 'lr': 1.0811561715673074e-05, 'weight_decay': 5.902298526387773e-05, 'epochs': 188, 'loss': 'mse', 'optimizer': 'adam', 'graph_mode': 'cutoff', 'cutoff': 0.5789827250536715, 'grm_norm': 'gcn', 'self_loops': False, 'use_snp_selection': False}. Best is trial 100 with value: 0.2998517231124538.
[I 2025-12-09 17:37:56,282] Trial 104 finished with value: 0.28996827954136206 and parameters: {'model_type': 'graphsage', 'hidden_dims': '[512, 128]', 'dropout': 0.26777622130914175, 'batch_norm': False, 'sage_aggr': 'mean', 'sage_normalize': False, 'sage_project': False, 'lr': 1.4433988594356814e-05, 'weight_decay': 0.00015012410132624762, 'epochs': 188, 'loss': 'mse', 'optimizer': 'adam', 'graph_mode': 'cutoff', 'cutoff': 0.6629438302654238, 'grm_norm': 'gcn', 'self_loops': False, 'use_snp_selection': False}. Best is trial 100 with value: 0.2998517231124538.
[I 2025-12-09 17:39:41,052] Trial 105 finished with value: 0.299398569357684 and parameters: {'model_type': 'graphsage', 'hidden_dims': '[512, 128]', 'dropout': 0.2775447013650873, 'batch_norm': False, 'sage_aggr': 'mean', 'sage_normalize': False, 'sage_project': False, 'lr': 1.3467513611420496e-05, 'weight_decay': 9.066184461167989e-05, 'epochs': 171, 'loss': 'mse', 'optimizer': 'adam', 'graph_mode': 'cutoff', 'cutoff': 0.5814526870697566, 'grm_norm': 'gcn', 'self_loops': False, 'use_snp_selection': False}. Best is trial 100 with value: 0.2998517231124538.
[I 2025-12-09 17:41:25,142] Trial 106 finished with value: 0.3021395890851344 and parameters: {'model_type': 'graphsage', 'hidden_dims': '[512, 128]', 'dropout': 0.27869265299181906, 'batch_norm': False, 'sage_aggr': 'mean', 'sage_normalize': False, 'sage_project': False, 'lr': 1.0070878899415084e-05, 'weight_decay': 8.578916345012529e-05, 'epochs': 169, 'loss': 'mse', 'optimizer': 'adam', 'graph_mode': 'cutoff', 'cutoff': 0.5826820977633395, 'grm_norm': 'gcn', 'self_loops': False, 'use_snp_selection': False}. Best is trial 106 with value: 0.3021395890851344.
[I 2025-12-09 17:43:08,739] Trial 107 finished with value: 0.29856327278170447 and parameters: {'model_type': 'graphsage', 'hidden_dims': '[512, 128]', 'dropout': 0.25445763313573905, 'batch_norm': False, 'sage_aggr': 'mean', 'sage_normalize': False, 'sage_project': False, 'lr': 1.106159600462066e-05, 'weight_decay': 5.68469099387334e-05, 'epochs': 166, 'loss': 'mse', 'optimizer': 'adam', 'graph_mode': 'cutoff', 'cutoff': 0.5598449876178149, 'grm_norm': 'gcn', 'self_loops': False, 'use_snp_selection': False}. Best is trial 106 with value: 0.3021395890851344.
