[I 2025-12-09 16:22:10,748] Trial 120 finished with value: -0.004443484792287312 and parameters: {'model_type': 'graphsage', 'hidden_dims': '[128, 64]', 'dropout': 0.559585616961761, 'batch_norm': False, 'sage_aggr': 'max', 'sage_normalize': False, 'sage_project': False, 'lr': 0.0004257597197007464, 'weight_decay': 9.387646787414292e-06, 'epochs': 46, 'loss': 'mse', 'optimizer': 'adam', 'graph_mode': 'cutoff', 'cutoff': 0.624910195318118, 'grm_norm': 'gcn', 'self_loops': True, 'use_snp_selection': False}. Best is trial 77 with value: 0.30631818426543256.
[I 2025-12-09 16:22:32,346] Trial 121 finished with value: 0.2647519837926354 and parameters: {'model_type': 'graphsage', 'hidden_dims': '[128, 64]', 'dropout': 0.5156236669846344, 'batch_norm': True, 'sage_aggr': 'max', 'sage_normalize': False, 'sage_project': False, 'lr': 0.0006062263059689613, 'weight_decay': 4.780173276305948e-06, 'epochs': 56, 'loss': 'mse', 'optimizer': 'adam', 'graph_mode': 'cutoff', 'cutoff': 0.44892607514888744, 'grm_norm': 'gcn', 'self_loops': True, 'use_snp_selection': False}. Best is trial 77 with value: 0.30631818426543256.
[I 2025-12-09 16:22:49,115] Trial 122 finished with value: 0.29793180831138605 and parameters: {'model_type': 'graphsage', 'hidden_dims': '[128, 64]', 'dropout': 0.5349173055320804, 'batch_norm': True, 'sage_aggr': 'max', 'sage_normalize': False, 'sage_project': False, 'lr': 0.0008665669684693232, 'weight_decay': 6.184770860652503e-06, 'epochs': 53, 'loss': 'mse', 'optimizer': 'adam', 'graph_mode': 'cutoff', 'cutoff': 0.711623012768558, 'grm_norm': 'gcn', 'self_loops': True, 'use_snp_selection': False}. Best is trial 77 with value: 0.30631818426543256.
[I 2025-12-09 16:23:07,412] Trial 123 finished with value: 0.29894735131398564 and parameters: {'model_type': 'graphsage', 'hidden_dims': '[128, 64]', 'dropout': 0.47939501036079823, 'batch_norm': True, 'sage_aggr': 'max', 'sage_normalize': False, 'sage_project': False, 'lr': 0.004161258813787794, 'weight_decay': 4.2706095476820295e-06, 'epochs': 64, 'loss': 'mse', 'optimizer': 'adam', 'graph_mode': 'cutoff', 'cutoff': 0.682282557931776, 'grm_norm': 'gcn', 'self_loops': True, 'use_snp_selection': False}. Best is trial 77 with value: 0.30631818426543256.
[I 2025-12-09 16:23:22,465] Trial 124 finished with value: 0.306964184690847 and parameters: {'model_type': 'graphsage', 'hidden_dims': '[128, 64]', 'dropout': 0.5533217303613761, 'batch_norm': True, 'sage_aggr': 'max', 'sage_normalize': False, 'sage_project': False, 'lr': 0.0031654568702063355, 'weight_decay': 2.1042718987080046e-06, 'epochs': 40, 'loss': 'mse', 'optimizer': 'adam', 'graph_mode': 'cutoff', 'cutoff': 0.6561265733508073, 'grm_norm': 'gcn', 'self_loops': True, 'use_snp_selection': False}. Best is trial 124 with value: 0.306964184690847.
[I 2025-12-09 16:23:38,010] Trial 125 finished with value: 0.30759257673960805 and parameters: {'model_type': 'graphsage', 'hidden_dims': '[128, 64]', 'dropout': 0.5509664926730731, 'batch_norm': True, 'sage_aggr': 'max', 'sage_normalize': False, 'sage_project': False, 'lr': 0.0031998049796047733, 'weight_decay': 2.1174790782414427e-06, 'epochs': 44, 'loss': 'mse', 'optimizer': 'adam', 'graph_mode': 'cutoff', 'cutoff': 0.6549321882777057, 'grm_norm': 'gcn', 'self_loops': True, 'use_snp_selection': False}. Best is trial 125 with value: 0.30759257673960805.
[I 2025-12-09 16:23:53,778] Trial 126 finished with value: 0.30532155158667645 and parameters: {'model_type': 'graphsage', 'hidden_dims': '[128, 64]', 'dropout': 0.5520450294253895, 'batch_norm': True, 'sage_aggr': 'max', 'sage_normalize': False, 'sage_project': False, 'lr': 0.003292235487590901, 'weight_decay': 2.3281539716696448e-06, 'epochs': 45, 'loss': 'mse', 'optimizer': 'adam', 'graph_mode': 'cutoff', 'cutoff': 0.6534397514574425, 'grm_norm': 'gcn', 'self_loops': True, 'use_snp_selection': False}. Best is trial 125 with value: 0.30759257673960805.
[I 2025-12-09 16:24:08,830] Trial 127 finished with value: 0.30326790715592633 and parameters: {'model_type': 'graphsage', 'hidden_dims': '[128, 64]', 'dropout': 0.5685710845096208, 'batch_norm': True, 'sage_aggr': 'max', 'sage_normalize': False, 'sage_project': False, 'lr': 0.0032935177369671663, 'weight_decay': 2.214004317627258e-06, 'epochs': 40, 'loss': 'mse', 'optimizer': 'adam', 'graph_mode': 'cutoff', 'cutoff': 0.6565725365641698, 'grm_norm': 'gcn', 'self_loops': True, 'use_snp_selection': False}. Best is trial 125 with value: 0.30759257673960805.
[I 2025-12-09 16:24:24,734] Trial 128 finished with value: 0.29436120894487633 and parameters: {'model_type': 'graphsage', 'hidden_dims': '[128, 64]', 'dropout': 0.26661621594642476, 'batch_norm': True, 'sage_aggr': 'max', 'sage_normalize': False, 'sage_project': False, 'lr': 0.0034749906071325455, 'weight_decay': 1.3513893652003709e-06, 'epochs': 45, 'loss': 'mse', 'optimizer': 'adam', 'graph_mode': 'cutoff', 'cutoff': 0.6093172098604155, 'grm_norm': 'gcn', 'self_loops': True, 'use_snp_selection': False}. Best is trial 125 with value: 0.30759257673960805.
[I 2025-12-09 16:24:39,828] Trial 129 finished with value: 0.3020582671217619 and parameters: {'model_type': 'graphsage', 'hidden_dims': '[128, 64]', 'dropout': 0.5458838786557908, 'batch_norm': True, 'sage_aggr': 'mean', 'sage_normalize': False, 'sage_project': False, 'lr': 0.006147511139732153, 'weight_decay': 2.2994617941184333e-06, 'epochs': 40, 'loss': 'mse', 'optimizer': 'adam', 'graph_mode': 'cutoff', 'cutoff': 0.6583290649289387, 'grm_norm': 'gcn', 'self_loops': True, 'use_snp_selection': False}. Best is trial 125 with value: 0.30759257673960805.
[I 2025-12-09 16:24:55,169] Trial 130 finished with value: 0.2998280472483397 and parameters: {'model_type': 'graphsage', 'hidden_dims': '[128, 64]', 'dropout': 0.5434693923753916, 'batch_norm': True, 'sage_aggr': 'mean', 'sage_normalize': False, 'sage_project': False, 'lr': 0.006592298407567743, 'weight_decay': 2.1956221887220687e-06, 'epochs': 42, 'loss': 'mse', 'optimizer': 'adam', 'graph_mode': 'cutoff', 'cutoff': 0.6543316105775057, 'grm_norm': 'gcn', 'self_loops': True, 'use_snp_selection': False}. Best is trial 125 with value: 0.30759257673960805.
[I 2025-12-09 16:25:10,330] Trial 131 finished with value: 0.3023296959976809 and parameters: {'model_type': 'graphsage', 'hidden_dims': '[128, 64]', 'dropout': 0.5504765638167121, 'batch_norm': True, 'sage_aggr': 'mean', 'sage_normalize': False, 'sage_project': False, 'lr': 0.0031506599031925937, 'weight_decay': 1.8286501205575277e-06, 'epochs': 40, 'loss': 'mse', 'optimizer': 'adam', 'graph_mode': 'cutoff', 'cutoff': 0.6491719479669836, 'grm_norm': 'gcn', 'self_loops': True, 'use_snp_selection': False}. Best is trial 125 with value: 0.30759257673960805.
[I 2025-12-09 16:25:25,428] Trial 132 finished with value: 0.3028627559403684 and parameters: {'model_type': 'graphsage', 'hidden_dims': '[128, 64]', 'dropout': 0.5867711774475307, 'batch_norm': True, 'sage_aggr': 'mean', 'sage_normalize': False, 'sage_project': False, 'lr': 0.004673156953319437, 'weight_decay': 1.8483923446393895e-06, 'epochs': 40, 'loss': 'mse', 'optimizer': 'adam', 'graph_mode': 'cutoff', 'cutoff': 0.656115194564263, 'grm_norm': 'gcn', 'self_loops': True, 'use_snp_selection': False}. Best is trial 125 with value: 0.30759257673960805.
[I 2025-12-09 16:25:41,111] Trial 133 finished with value: 0.30245880251963286 and parameters: {'model_type': 'graphsage', 'hidden_dims': '[128, 64]', 'dropout': 0.5876514665745103, 'batch_norm': True, 'sage_aggr': 'mean', 'sage_normalize': False, 'sage_project': False, 'lr': 0.005558393862500434, 'weight_decay': 1.0044835677847418e-06, 'epochs': 44, 'loss': 'mse', 'optimizer': 'adam', 'graph_mode': 'cutoff', 'cutoff': 0.6466246571286577, 'grm_norm': 'gcn', 'self_loops': True, 'use_snp_selection': False}. Best is trial 125 with value: 0.30759257673960805.
[I 2025-12-09 16:25:56,689] Trial 134 finished with value: 0.3044930478007018 and parameters: {'model_type': 'graphsage', 'hidden_dims': '[128, 64]', 'dropout': 0.5839406459619045, 'batch_norm': True, 'sage_aggr': 'mean', 'sage_normalize': False, 'sage_project': False, 'lr': 0.008680256928729925, 'weight_decay': 3.8755773967047053e-07, 'epochs': 43, 'loss': 'mse', 'optimizer': 'adam', 'graph_mode': 'cutoff', 'cutoff': 0.6537089277234042, 'grm_norm': 'gcn', 'self_loops': True, 'use_snp_selection': False}. Best is trial 125 with value: 0.30759257673960805.
[I 2025-12-09 16:26:12,111] Trial 135 finished with value: 0.2918567684296294 and parameters: {'model_type': 'graphsage', 'hidden_dims': '[128, 64]', 'dropout': 0.5907756514838836, 'batch_norm': True, 'sage_aggr': 'mean', 'sage_normalize': False, 'sage_project': False, 'lr': 0.00854675475328358, 'weight_decay': 5.906196426352968e-07, 'epochs': 42, 'loss': 'mse', 'optimizer': 'adam', 'graph_mode': 'cutoff', 'cutoff': 0.6441623535609367, 'grm_norm': 'gcn', 'self_loops': True, 'use_snp_selection': False}. Best is trial 125 with value: 0.30759257673960805.
[I 2025-12-09 16:26:27,348] Trial 136 finished with value: 0.2980832409424357 and parameters: {'model_type': 'graphsage', 'hidden_dims': '[128, 64]', 'dropout': 0.5820739148138486, 'batch_norm': True, 'sage_aggr': 'mean', 'sage_normalize': False, 'sage_project': False, 'lr': 0.004688323801360961, 'weight_decay': 3.78547668683599e-07, 'epochs': 40, 'loss': 'mse', 'optimizer': 'adam', 'graph_mode': 'cutoff', 'cutoff': 0.6125699848230309, 'grm_norm': 'gcn', 'self_loops': True, 'use_snp_selection': False}. Best is trial 125 with value: 0.30759257673960805.
[I 2025-12-09 16:26:43,595] Trial 137 finished with value: 0.2722354445068037 and parameters: {'model_type': 'graphsage', 'hidden_dims': '[128, 64]', 'dropout': 0.5699488027765873, 'batch_norm': True, 'sage_aggr': 'mean', 'sage_normalize': True, 'sage_project': False, 'lr': 0.005619723958148523, 'weight_decay': 1.7196064027930453e-06, 'epochs': 48, 'loss': 'mse', 'optimizer': 'adam', 'graph_mode': 'cutoff', 'cutoff': 0.6385314307549993, 'grm_norm': 'gcn', 'self_loops': True, 'use_snp_selection': False}. Best is trial 125 with value: 0.30759257673960805.
[I 2025-12-09 16:27:06,228] Trial 138 finished with value: 0.2572890642089597 and parameters: {'model_type': 'graphsage', 'hidden_dims': '[128, 64]', 'dropout': 0.5992184541853923, 'batch_norm': True, 'sage_aggr': 'mean', 'sage_normalize': False, 'sage_project': False, 'lr': 0.006380285439084138, 'weight_decay': 1.1409389607555486e-06, 'epochs': 50, 'loss': 'mae', 'optimizer': 'adam', 'graph_mode': 'knn', 'knn_k': 5, 'weighted_edges': False, 'symmetrize_mode': 'mutual', 'self_loops': True, 'use_snp_selection': False}. Best is trial 125 with value: 0.30759257673960805.
[I 2025-12-09 16:27:21,334] Trial 139 finished with value: 0.2997664565383662 and parameters: {'model_type': 'graphsage', 'hidden_dims': '[128, 64]', 'dropout': 0.5663817116242906, 'batch_norm': True, 'sage_aggr': 'mean', 'sage_normalize': False, 'sage_project': False, 'lr': 0.0031718030195786737, 'weight_decay': 1.8312074630597733e-07, 'epochs': 40, 'loss': 'mse', 'optimizer': 'adam', 'graph_mode': 'cutoff', 'cutoff': 0.6565939388512252, 'grm_norm': 'gcn', 'self_loops': True, 'use_snp_selection': False}. Best is trial 125 with value: 0.30759257673960805.
[I 2025-12-09 16:27:37,924] Trial 140 finished with value: 0.30137416233827596 and parameters: {'model_type': 'graphsage', 'hidden_dims': '[128, 64]', 'dropout': 0.550858867495751, 'batch_norm': True, 'sage_aggr': 'mean', 'sage_normalize': False, 'sage_project': False, 'lr': 0.009445063874628491, 'weight_decay': 1.3707004611890098e-06, 'epochs': 49, 'loss': 'mse', 'optimizer': 'adam', 'graph_mode': 'cutoff', 'cutoff': 0.5968660646714234, 'grm_norm': 'gcn', 'self_loops': True, 'use_snp_selection': False}. Best is trial 125 with value: 0.30759257673960805.
[I 2025-12-09 16:27:53,044] Trial 141 finished with value: 0.30123137200479083 and parameters: {'model_type': 'graphsage', 'hidden_dims': '[128, 64]', 'dropout': 0.5848956333651985, 'batch_norm': True, 'sage_aggr': 'mean', 'sage_normalize': False, 'sage_project': False, 'lr': 0.0025531339559407063, 'weight_decay': 5.751968227837683e-07, 'epochs': 40, 'loss': 'mse', 'optimizer': 'adam', 'graph_mode': 'cutoff', 'cutoff': 0.6763090896640042, 'grm_norm': 'gcn', 'self_loops': True, 'use_snp_selection': False}. Best is trial 125 with value: 0.30759257673960805.
[I 2025-12-09 16:28:09,575] Trial 142 finished with value: 0.2997086579762769 and parameters: {'model_type': 'graphsage', 'hidden_dims': '[128, 64]', 'dropout': 0.572294238915863, 'batch_norm': True, 'sage_aggr': 'mean', 'sage_normalize': False, 'sage_project': False, 'lr': 0.004619538863198388, 'weight_decay': 2.037126809182972e-06, 'epochs': 50, 'loss': 'mse', 'optimizer': 'adam', 'graph_mode': 'cutoff', 'cutoff': 0.6548182117149592, 'grm_norm': 'gcn', 'self_loops': True, 'use_snp_selection': False}. Best is trial 125 with value: 0.30759257673960805.
[I 2025-12-09 16:28:27,109] Trial 143 finished with value: 0.305467231697329 and parameters: {'model_type': 'graphsage', 'hidden_dims': '[128, 64]', 'dropout': 0.5542555653611189, 'batch_norm': True, 'sage_aggr': 'mean', 'sage_normalize': False, 'sage_project': False, 'lr': 0.003850635574000367, 'weight_decay': 8.860473418607148e-07, 'epochs': 58, 'loss': 'mse', 'optimizer': 'adam', 'graph_mode': 'cutoff', 'cutoff': 0.6963488968592092, 'grm_norm': 'gcn', 'self_loops': True, 'use_snp_selection': False}. Best is trial 125 with value: 0.30759257673960805.
[I 2025-12-09 16:28:42,942] Trial 144 finished with value: 0.300114626497529 and parameters: {'model_type': 'graphsage', 'hidden_dims': '[128, 64]', 'dropout': 0.5543566715847079, 'batch_norm': True, 'sage_aggr': 'mean', 'sage_normalize': False, 'sage_project': False, 'lr': 0.007879248387163439, 'weight_decay': 1.4681905401791892e-06, 'epochs': 46, 'loss': 'mse', 'optimizer': 'adam', 'graph_mode': 'cutoff', 'cutoff': 0.6992936593986595, 'grm_norm': 'gcn', 'self_loops': True, 'use_snp_selection': False}. Best is trial 125 with value: 0.30759257673960805.
[I 2025-12-09 16:29:00,889] Trial 145 finished with value: 0.30134172450772667 and parameters: {'model_type': 'graphsage', 'hidden_dims': '[128, 64]', 'dropout': 0.586256853885623, 'batch_norm': True, 'sage_aggr': 'mean', 'sage_normalize': False, 'sage_project': False, 'lr': 0.003906330219774762, 'weight_decay': 2.5450804449739356e-06, 'epochs': 61, 'loss': 'mse', 'optimizer': 'adam', 'graph_mode': 'cutoff', 'cutoff': 0.6761356701325446, 'grm_norm': 'gcn', 'self_loops': True, 'use_snp_selection': False}. Best is trial 125 with value: 0.30759257673960805.
[I 2025-12-09 16:29:35,886] Trial 146 finished with value: 0.29720821480021475 and parameters: {'model_type': 'graphsage', 'hidden_dims': '[128, 64]', 'dropout': 0.5678526147165264, 'batch_norm': True, 'sage_aggr': 'mean', 'sage_normalize': False, 'sage_project': False, 'lr': 0.005470024998208746, 'weight_decay': 1.8708079692552105e-06, 'epochs': 52, 'loss': 'mse', 'optimizer': 'adam', 'graph_mode': 'cutoff', 'cutoff': 0.6341507338344996, 'grm_norm': 'gcn', 'self_loops': True, 'use_snp_selection': True, 'num_snps': 22983}. Best is trial 125 with value: 0.30759257673960805.
[I 2025-12-09 16:30:56,826] Trial 147 finished with value: 0.01711673411956796 and parameters: {'model_type': 'graphsage', 'hidden_dims': '[256, 128, 64]', 'dropout': 0.5533127459178052, 'batch_norm': False, 'sage_aggr': 'mean', 'sage_normalize': False, 'sage_project': False, 'lr': 0.002892399761002989, 'weight_decay': 9.573292410935103e-07, 'epochs': 311, 'loss': 'mse', 'optimizer': 'adam', 'graph_mode': 'cutoff', 'cutoff': 0.6166346243818167, 'grm_norm': 'gcn', 'self_loops': False, 'use_snp_selection': False}. Best is trial 125 with value: 0.30759257673960805.
[I 2025-12-09 16:31:11,859] Trial 148 finished with value: 0.30460756504564046 and parameters: {'model_type': 'graphsage', 'hidden_dims': '[128, 64]', 'dropout': 0.5403730621873151, 'batch_norm': True, 'sage_aggr': 'mean', 'sage_normalize': False, 'sage_project': False, 'lr': 0.0034310474684112577, 'weight_decay': 2.3575133428765764e-06, 'epochs': 40, 'loss': 'mse', 'optimizer': 'adam', 'graph_mode': 'cutoff', 'cutoff': 0.7007942592844884, 'grm_norm': 'gcn', 'self_loops': True, 'use_snp_selection': False}. Best is trial 125 with value: 0.30759257673960805.
[I 2025-12-09 16:31:26,869] Trial 149 finished with value: 0.30513615545013917 and parameters: {'model_type': 'graphsage', 'hidden_dims': '[128, 64]', 'dropout': 0.5395430348864098, 'batch_norm': True, 'sage_aggr': 'mean', 'sage_normalize': False, 'sage_project': False, 'lr': 0.004664661986270965, 'weight_decay': 9.136258076557116e-07, 'epochs': 40, 'loss': 'mse', 'optimizer': 'adam', 'graph_mode': 'cutoff', 'cutoff': 0.7009823887971727, 'grm_norm': 'gcn', 'self_loops': True, 'use_snp_selection': False}. Best is trial 125 with value: 0.30759257673960805.
[I 2025-12-09 16:32:44,297] Trial 0 finished with value: 0.2595270493545826 and parameters: {'model_type': 'graphsage', 'hidden_dims': '[128, 64]', 'dropout': 0.199031432379812, 'batch_norm': True, 'sage_aggr': 'max', 'sage_normalize': True, 'sage_project': False, 'lr': 0.00034401453323286885, 'weight_decay': 0.00017802616915745114, 'epochs': 230, 'loss': 'mse', 'optimizer': 'adam', 'graph_mode': 'knn', 'knn_k': 6, 'weighted_edges': True, 'symmetrize_mode': 'mutual', 'self_loops': True, 'use_snp_selection': False}. Best is trial 0 with value: 0.2595270493545826.
[I 2025-12-09 16:34:30,107] Trial 1 finished with value: 0.2781493965944043 and parameters: {'model_type': 'graphsage', 'hidden_dims': '[512, 128]', 'dropout': 0.2503500283181017, 'batch_norm': False, 'sage_aggr': 'max', 'sage_normalize': False, 'sage_project': False, 'lr': 3.952233718592099e-05, 'weight_decay': 0.00026754769258252603, 'epochs': 149, 'loss': 'mse', 'optimizer': 'adam', 'graph_mode': 'knn', 'knn_k': 2, 'weighted_edges': False, 'symmetrize_mode': 'mutual', 'self_loops': True, 'use_snp_selection': True, 'num_snps': 49915}. Best is trial 1 with value: 0.2781493965944043.
[I 2025-12-09 16:35:49,641] Trial 2 finished with value: 0.27305844102206145 and parameters: {'model_type': 'graphsage', 'hidden_dims': '[512, 256]', 'dropout': 0.2785908793172681, 'batch_norm': False, 'sage_aggr': 'max', 'sage_normalize': False, 'sage_project': False, 'lr': 8.806039223165805e-05, 'weight_decay': 3.5153176302760294e-05, 'epochs': 147, 'loss': 'mae', 'optimizer': 'adam', 'graph_mode': 'cutoff', 'cutoff': 0.4922564006874869, 'grm_norm': 'gcn', 'self_loops': False, 'use_snp_selection': True, 'num_snps': 34340}. Best is trial 1 with value: 0.2781493965944043.
[I 2025-12-09 16:37:06,899] Trial 3 finished with value: 0.2774670744863219 and parameters: {'model_type': 'graphsage', 'hidden_dims': '[256, 128, 64]', 'dropout': 0.3475243154412272, 'batch_norm': True, 'sage_aggr': 'max', 'sage_normalize': False, 'sage_project': False, 'lr': 1.6006331996938085e-05, 'weight_decay': 7.213121225589906e-06, 'epochs': 283, 'loss': 'mse', 'optimizer': 'adam', 'graph_mode': 'cutoff', 'cutoff': 0.5942334791449215, 'grm_norm': 'none', 'self_loops': True, 'use_snp_selection': False}. Best is trial 1 with value: 0.2781493965944043.
[I 2025-12-09 16:37:49,987] Trial 4 finished with value: 0.2513968273711988 and parameters: {'model_type': 'graphsage', 'hidden_dims': '[128, 64]', 'dropout': 0.3348926467202472, 'batch_norm': True, 'sage_aggr': 'max', 'sage_normalize': False, 'sage_project': False, 'lr': 0.0004238630400638802, 'weight_decay': 8.074086040046576e-07, 'epochs': 158, 'loss': 'mae', 'optimizer': 'adam', 'graph_mode': 'knn', 'knn_k': 1, 'weighted_edges': False, 'symmetrize_mode': 'mutual', 'self_loops': False, 'use_snp_selection': True, 'num_snps': 26850}. Best is trial 1 with value: 0.2781493965944043.
[I 2025-12-09 16:39:43,739] Trial 5 finished with value: 0.2630307863671028 and parameters: {'model_type': 'graphsage', 'hidden_dims': '[512, 64]', 'dropout': 0.14505336736221927, 'batch_norm': True, 'sage_aggr': 'mean', 'sage_normalize': True, 'sage_project': False, 'lr': 1.2962030165732234e-05, 'weight_decay': 1.326598071105465e-07, 'epochs': 180, 'loss': 'mse', 'optimizer': 'adam', 'graph_mode': 'knn', 'knn_k': 9, 'weighted_edges': True, 'symmetrize_mode': 'mutual', 'self_loops': False, 'use_snp_selection': False}. Best is trial 1 with value: 0.2781493965944043.
[I 2025-12-09 16:40:37,985] Trial 6 finished with value: 0.27158517895444234 and parameters: {'model_type': 'graphsage', 'hidden_dims': '[256, 128, 64]', 'dropout': 0.10731743755162496, 'batch_norm': True, 'sage_aggr': 'mean', 'sage_normalize': False, 'sage_project': False, 'lr': 1.922990426933137e-05, 'weight_decay': 7.30001060446905e-05, 'epochs': 63, 'loss': 'mae', 'optimizer': 'adam', 'graph_mode': 'cutoff', 'cutoff': 0.7624978434202536, 'grm_norm': 'none', 'self_loops': True, 'use_snp_selection': True, 'num_snps': 50106}. Best is trial 1 with value: 0.2781493965944043.
[I 2025-12-09 16:42:41,575] Trial 7 finished with value: 0.2652817202310686 and parameters: {'model_type': 'graphsage', 'hidden_dims': '[512, 64]', 'dropout': 0.2585007811528941, 'batch_norm': True, 'sage_aggr': 'max', 'sage_normalize': True, 'sage_project': False, 'lr': 5.921425508303391e-05, 'weight_decay': 0.0004511561961144237, 'epochs': 182, 'loss': 'mae', 'optimizer': 'adam', 'graph_mode': 'knn', 'knn_k': 9, 'weighted_edges': True, 'symmetrize_mode': 'union', 'self_loops': False, 'use_snp_selection': True, 'num_snps': 23903}. Best is trial 1 with value: 0.2781493965944043.
