[I 2025-12-06 17:30:38,092] Trial 77 finished with value: 0.24595777051619444 and parameters: {'model_type': 'graphsage', 'hidden_dims': '[512, 128]', 'dropout': 0.37370215874621227, 'batch_norm': False, 'sage_aggr': 'mean', 'sage_normalize': False, 'sage_project': False, 'lr': 2.9217669512130182e-05, 'weight_decay': 0.0005133956971116898, 'epochs': 99, 'loss': 'mae', 'optimizer': 'adam', 'graph_mode': 'cutoff', 'cutoff': 0.8339306709420835, 'grm_norm': 'cosine_then_gcn', 'self_loops': False, 'use_snp_selection': True, 'num_snps': 14534, 'graphsage_batch_size': 8}. Best is trial 59 with value: 0.2521737550644459.
[I 2025-12-06 17:31:07,690] Trial 78 finished with value: 0.24072323483444807 and parameters: {'model_type': 'graphsage', 'hidden_dims': '[512, 128]', 'dropout': 0.3871684473570703, 'batch_norm': True, 'sage_aggr': 'mean', 'sage_normalize': True, 'sage_project': False, 'lr': 3.157944386228023e-05, 'weight_decay': 0.0008190338695340183, 'epochs': 65, 'loss': 'mae', 'optimizer': 'adam', 'graph_mode': 'cutoff', 'cutoff': 0.8594321719004963, 'grm_norm': 'cosine_then_gcn', 'self_loops': False, 'use_snp_selection': True, 'num_snps': 18858, 'graphsage_batch_size': 8}. Best is trial 59 with value: 0.2521737550644459.
[I 2025-12-06 17:31:36,705] Trial 79 finished with value: 0.25577141764965894 and parameters: {'model_type': 'graphsage', 'hidden_dims': '[512, 128]', 'dropout': 0.5968721318561121, 'batch_norm': False, 'sage_aggr': 'mean', 'sage_normalize': False, 'sage_project': False, 'lr': 6.246639251914996e-05, 'weight_decay': 0.000528643800840885, 'epochs': 98, 'loss': 'mae', 'optimizer': 'adam', 'graph_mode': 'cutoff', 'cutoff': 0.8031496829571826, 'grm_norm': 'cosine_then_gcn', 'self_loops': False, 'use_snp_selection': True, 'num_snps': 13126, 'graphsage_batch_size': 8}. Best is trial 79 with value: 0.25577141764965894.
[I 2025-12-06 17:32:11,555] Trial 80 finished with value: 0.21914305223244673 and parameters: {'model_type': 'graphsage', 'hidden_dims': '[512, 128]', 'dropout': 0.5825753501456845, 'batch_norm': False, 'sage_aggr': 'mean', 'sage_normalize': False, 'sage_project': False, 'lr': 8.260434579053883e-05, 'weight_decay': 0.0005744797170329132, 'epochs': 98, 'loss': 'mse', 'optimizer': 'adam', 'graph_mode': 'knn', 'knn_k': 8, 'weighted_edges': True, 'symmetrize_mode': 'union', 'self_loops': False, 'use_snp_selection': True, 'num_snps': 11203, 'graphsage_batch_size': 8}. Best is trial 79 with value: 0.25577141764965894.
[I 2025-12-06 17:32:35,727] Trial 81 finished with value: 0.23596439050154197 and parameters: {'model_type': 'graphsage', 'hidden_dims': '[512, 128]', 'dropout': 0.3431482881886568, 'batch_norm': False, 'sage_aggr': 'mean', 'sage_normalize': False, 'sage_project': False, 'lr': 5.1378270214893045e-05, 'weight_decay': 0.0004787271430975337, 'epochs': 85, 'loss': 'mae', 'optimizer': 'adam', 'graph_mode': 'cutoff', 'cutoff': 0.8085620055235287, 'grm_norm': 'cosine_then_gcn', 'self_loops': False, 'use_snp_selection': True, 'num_snps': 9761, 'graphsage_batch_size': 8}. Best is trial 79 with value: 0.25577141764965894.
[I 2025-12-06 17:33:07,391] Trial 82 finished with value: 0.2491519684799297 and parameters: {'model_type': 'graphsage', 'hidden_dims': '[512, 128]', 'dropout': 0.37178589776371845, 'batch_norm': False, 'sage_aggr': 'mean', 'sage_normalize': False, 'sage_project': False, 'lr': 6.575407545311883e-05, 'weight_decay': 0.000377717321884976, 'epochs': 102, 'loss': 'mae', 'optimizer': 'adam', 'graph_mode': 'cutoff', 'cutoff': 0.77799933127146, 'grm_norm': 'cosine_then_gcn', 'self_loops': False, 'use_snp_selection': True, 'num_snps': 15209, 'graphsage_batch_size': 8}. Best is trial 79 with value: 0.25577141764965894.
[I 2025-12-06 17:33:38,790] Trial 83 finished with value: 0.2573353179378245 and parameters: {'model_type': 'graphsage', 'hidden_dims': '[512, 128]', 'dropout': 0.3714120480714809, 'batch_norm': False, 'sage_aggr': 'mean', 'sage_normalize': False, 'sage_project': False, 'lr': 6.794421684037385e-05, 'weight_decay': 0.0007717571183919647, 'epochs': 103, 'loss': 'mae', 'optimizer': 'adam', 'graph_mode': 'cutoff', 'cutoff': 0.8922605881130857, 'grm_norm': 'cosine_then_gcn', 'self_loops': False, 'use_snp_selection': True, 'num_snps': 14831, 'graphsage_batch_size': 8}. Best is trial 83 with value: 0.2573353179378245.
[I 2025-12-06 17:34:11,336] Trial 84 finished with value: 0.2462053998710183 and parameters: {'model_type': 'graphsage', 'hidden_dims': '[512, 128]', 'dropout': 0.3734679403874022, 'batch_norm': False, 'sage_aggr': 'mean', 'sage_normalize': False, 'sage_project': False, 'lr': 6.403127574542082e-05, 'weight_decay': 0.000984739071790191, 'epochs': 107, 'loss': 'mae', 'optimizer': 'adam', 'graph_mode': 'cutoff', 'cutoff': 0.8942386804820492, 'grm_norm': 'cosine_then_gcn', 'self_loops': False, 'use_snp_selection': True, 'num_snps': 15453, 'graphsage_batch_size': 8}. Best is trial 83 with value: 0.2573353179378245.
[I 2025-12-06 17:34:43,038] Trial 85 finished with value: 0.24935276706845544 and parameters: {'model_type': 'graphsage', 'hidden_dims': '[512, 128]', 'dropout': 0.3711864760767073, 'batch_norm': False, 'sage_aggr': 'mean', 'sage_normalize': False, 'sage_project': False, 'lr': 6.726099366459615e-05, 'weight_decay': 0.000965597442418993, 'epochs': 102, 'loss': 'mae', 'optimizer': 'adam', 'graph_mode': 'cutoff', 'cutoff': 0.8832418411462548, 'grm_norm': 'cosine_then_gcn', 'self_loops': False, 'use_snp_selection': True, 'num_snps': 15302, 'graphsage_batch_size': 8}. Best is trial 83 with value: 0.2573353179378245.
[I 2025-12-06 17:35:17,454] Trial 86 finished with value: 0.25563302152152934 and parameters: {'model_type': 'graphsage', 'hidden_dims': '[512, 128]', 'dropout': 0.3609691023832388, 'batch_norm': False, 'sage_aggr': 'mean', 'sage_normalize': False, 'sage_project': False, 'lr': 6.821170529837315e-05, 'weight_decay': 0.000752605175867743, 'epochs': 111, 'loss': 'mae', 'optimizer': 'adam', 'graph_mode': 'cutoff', 'cutoff': 0.8982822876687441, 'grm_norm': 'cosine_then_gcn', 'self_loops': False, 'use_snp_selection': True, 'num_snps': 16503, 'graphsage_batch_size': 8}. Best is trial 83 with value: 0.2573353179378245.
[I 2025-12-06 17:35:54,677] Trial 87 finished with value: 0.25754851190325023 and parameters: {'model_type': 'graphsage', 'hidden_dims': '[512, 128]', 'dropout': 0.3148213533254083, 'batch_norm': False, 'sage_aggr': 'mean', 'sage_normalize': False, 'sage_project': False, 'lr': 6.938298313384435e-05, 'weight_decay': 0.0007185813297644958, 'epochs': 116, 'loss': 'mae', 'optimizer': 'adam', 'graph_mode': 'cutoff', 'cutoff': 0.7926889097524552, 'grm_norm': 'cosine_then_gcn', 'self_loops': False, 'use_snp_selection': True, 'num_snps': 18496, 'graphsage_batch_size': 8}. Best is trial 87 with value: 0.25754851190325023.
[I 2025-12-06 17:36:31,994] Trial 88 finished with value: 0.2585854428243063 and parameters: {'model_type': 'graphsage', 'hidden_dims': '[512, 128]', 'dropout': 0.3162584825660136, 'batch_norm': False, 'sage_aggr': 'mean', 'sage_normalize': False, 'sage_project': False, 'lr': 6.220266851666211e-05, 'weight_decay': 0.0007962232838036141, 'epochs': 116, 'loss': 'mae', 'optimizer': 'adam', 'graph_mode': 'cutoff', 'cutoff': 0.7898837003883603, 'grm_norm': 'cosine_then_gcn', 'self_loops': False, 'use_snp_selection': True, 'num_snps': 18482, 'graphsage_batch_size': 8}. Best is trial 88 with value: 0.2585854428243063.
[I 2025-12-06 17:37:09,444] Trial 89 finished with value: 0.254860157050302 and parameters: {'model_type': 'graphsage', 'hidden_dims': '[512, 128]', 'dropout': 0.3168379691764146, 'batch_norm': False, 'sage_aggr': 'mean', 'sage_normalize': False, 'sage_project': False, 'lr': 4.934795750338967e-05, 'weight_decay': 0.000743822894987232, 'epochs': 116, 'loss': 'mae', 'optimizer': 'adam', 'graph_mode': 'cutoff', 'cutoff': 0.7967380718280085, 'grm_norm': 'cosine_then_gcn', 'self_loops': False, 'use_snp_selection': True, 'num_snps': 18721, 'graphsage_batch_size': 8}. Best is trial 88 with value: 0.2585854428243063.
[I 2025-12-06 17:37:47,951] Trial 90 finished with value: 0.2413858751014577 and parameters: {'model_type': 'graphsage', 'hidden_dims': '[512, 128]', 'dropout': 0.30359760648210377, 'batch_norm': True, 'sage_aggr': 'mean', 'sage_normalize': False, 'sage_project': False, 'lr': 4.832331978695912e-05, 'weight_decay': 0.0007763509476118688, 'epochs': 118, 'loss': 'mae', 'optimizer': 'adam', 'graph_mode': 'cutoff', 'cutoff': 0.7956739749376013, 'grm_norm': 'cosine_then_gcn', 'self_loops': False, 'use_snp_selection': True, 'num_snps': 19019, 'graphsage_batch_size': 8}. Best is trial 88 with value: 0.2585854428243063.
[I 2025-12-06 17:38:25,335] Trial 91 finished with value: 0.2587303411496328 and parameters: {'model_type': 'graphsage', 'hidden_dims': '[512, 128]', 'dropout': 0.3277490845727067, 'batch_norm': False, 'sage_aggr': 'mean', 'sage_normalize': False, 'sage_project': False, 'lr': 8.348774637245785e-05, 'weight_decay': 0.0008080636933124228, 'epochs': 114, 'loss': 'mae', 'optimizer': 'adam', 'graph_mode': 'cutoff', 'cutoff': 0.8812002750122314, 'grm_norm': 'cosine_then_gcn', 'self_loops': False, 'use_snp_selection': True, 'num_snps': 18972, 'graphsage_batch_size': 8}. Best is trial 91 with value: 0.2587303411496328.
[I 2025-12-06 17:39:02,695] Trial 92 finished with value: 0.2626148420921274 and parameters: {'model_type': 'graphsage', 'hidden_dims': '[512, 128]', 'dropout': 0.3258248095636003, 'batch_norm': False, 'sage_aggr': 'mean', 'sage_normalize': False, 'sage_project': False, 'lr': 9.067783461700791e-05, 'weight_decay': 0.0006903600331571917, 'epochs': 115, 'loss': 'mae', 'optimizer': 'adam', 'graph_mode': 'cutoff', 'cutoff': 0.751400920717034, 'grm_norm': 'cosine_then_gcn', 'self_loops': False, 'use_snp_selection': True, 'num_snps': 18700, 'graphsage_batch_size': 8}. Best is trial 92 with value: 0.2626148420921274.
[I 2025-12-06 17:39:46,189] Trial 93 finished with value: 0.2584692864052628 and parameters: {'model_type': 'graphsage', 'hidden_dims': '[512, 128]', 'dropout': 0.322050386962966, 'batch_norm': False, 'sage_aggr': 'mean', 'sage_normalize': False, 'sage_project': False, 'lr': 9.591855009844268e-05, 'weight_decay': 0.0006193486467240479, 'epochs': 115, 'loss': 'mae', 'optimizer': 'adam', 'graph_mode': 'cutoff', 'cutoff': 0.7594061338111906, 'grm_norm': 'cosine_then_gcn', 'self_loops': False, 'use_snp_selection': True, 'num_snps': 23190, 'graphsage_batch_size': 8}. Best is trial 92 with value: 0.2626148420921274.
[I 2025-12-06 17:40:30,077] Trial 94 finished with value: 0.25611427732477976 and parameters: {'model_type': 'graphsage', 'hidden_dims': '[512, 128]', 'dropout': 0.31689331133431337, 'batch_norm': False, 'sage_aggr': 'mean', 'sage_normalize': False, 'sage_project': False, 'lr': 7.981837860155069e-05, 'weight_decay': 0.0005685697572296314, 'epochs': 115, 'loss': 'mae', 'optimizer': 'adam', 'graph_mode': 'cutoff', 'cutoff': 0.758410691222583, 'grm_norm': 'cosine_then_gcn', 'self_loops': False, 'use_snp_selection': True, 'num_snps': 23503, 'graphsage_batch_size': 8}. Best is trial 92 with value: 0.2626148420921274.
[I 2025-12-06 17:41:13,445] Trial 95 finished with value: 0.25833717227263914 and parameters: {'model_type': 'graphsage', 'hidden_dims': '[512, 128]', 'dropout': 0.32251605943389056, 'batch_norm': False, 'sage_aggr': 'mean', 'sage_normalize': False, 'sage_project': False, 'lr': 9.211323136332703e-05, 'weight_decay': 0.0005958588654999308, 'epochs': 115, 'loss': 'mae', 'optimizer': 'adam', 'graph_mode': 'cutoff', 'cutoff': 0.7532964761824332, 'grm_norm': 'cosine_then_gcn', 'self_loops': False, 'use_snp_selection': True, 'num_snps': 23238, 'graphsage_batch_size': 8}. Best is trial 92 with value: 0.2626148420921274.
[I 2025-12-06 17:42:01,347] Trial 96 finished with value: 0.22753310946136276 and parameters: {'model_type': 'graphsage', 'hidden_dims': '[512, 64]', 'dropout': 0.2714037866651375, 'batch_norm': False, 'sage_aggr': 'mean', 'sage_normalize': True, 'sage_project': False, 'lr': 8.903257228608786e-05, 'weight_decay': 0.0005589512997507972, 'epochs': 131, 'loss': 'mae', 'optimizer': 'adam', 'graph_mode': 'cutoff', 'cutoff': 0.7525812338153558, 'grm_norm': 'cosine_then_gcn', 'self_loops': False, 'use_snp_selection': True, 'num_snps': 24040, 'graphsage_batch_size': 8}. Best is trial 92 with value: 0.2626148420921274.
[I 2025-12-06 17:42:42,489] Trial 97 finished with value: 0.26201270623802936 and parameters: {'model_type': 'graphsage', 'hidden_dims': '[512, 128]', 'dropout': 0.32786241586592596, 'batch_norm': False, 'sage_aggr': 'mean', 'sage_normalize': False, 'sage_project': False, 'lr': 0.00010506611158936629, 'weight_decay': 0.0005537070933734661, 'epochs': 112, 'loss': 'mae', 'optimizer': 'adam', 'graph_mode': 'cutoff', 'cutoff': 0.7526002464140877, 'grm_norm': 'cosine_then_gcn', 'self_loops': False, 'use_snp_selection': True, 'num_snps': 22235, 'graphsage_batch_size': 8}. Best is trial 92 with value: 0.2626148420921274.
[I 2025-12-06 17:43:25,087] Trial 98 finished with value: 0.2562420972241505 and parameters: {'model_type': 'graphsage', 'hidden_dims': '[512, 128]', 'dropout': 0.32367390868018003, 'batch_norm': False, 'sage_aggr': 'mean', 'sage_normalize': False, 'sage_project': False, 'lr': 0.0001721419632225207, 'weight_decay': 0.0005789493775224585, 'epochs': 122, 'loss': 'mae', 'optimizer': 'adam', 'graph_mode': 'cutoff', 'cutoff': 0.7420139134469304, 'grm_norm': 'cosine_then_gcn', 'self_loops': False, 'use_snp_selection': True, 'num_snps': 21672, 'graphsage_batch_size': 8}. Best is trial 92 with value: 0.2626148420921274.
[I 2025-12-06 17:43:57,585] Trial 99 finished with value: 0.24547138899715124 and parameters: {'model_type': 'graphsage', 'hidden_dims': '[256, 128]', 'dropout': 0.326602652843284, 'batch_norm': False, 'sage_aggr': 'mean', 'sage_normalize': False, 'sage_project': False, 'lr': 0.00020220607066047259, 'weight_decay': 0.0006248009263400461, 'epochs': 124, 'loss': 'mse', 'optimizer': 'adam', 'graph_mode': 'cutoff', 'cutoff': 0.752865897779893, 'grm_norm': 'cosine_then_gcn', 'self_loops': False, 'use_snp_selection': True, 'num_snps': 21893, 'graphsage_batch_size': 8}. Best is trial 92 with value: 0.2626148420921274.
[I 2025-12-06 17:44:50,618] Trial 100 finished with value: 0.246860201322005 and parameters: {'model_type': 'graphsage', 'hidden_dims': '[512, 128]', 'dropout': 0.284602350858932, 'batch_norm': False, 'sage_aggr': 'mean', 'sage_normalize': False, 'sage_project': False, 'lr': 0.000103251481560765, 'weight_decay': 0.00034805014110056936, 'epochs': 129, 'loss': 'mae', 'optimizer': 'adam', 'graph_mode': 'cutoff', 'cutoff': 0.7204313329937166, 'grm_norm': 'cosine_then_gcn', 'self_loops': False, 'use_snp_selection': True, 'num_snps': 28153, 'graphsage_batch_size': 8}. Best is trial 92 with value: 0.2626148420921274.
[I 2025-12-06 17:45:36,175] Trial 101 finished with value: 0.25202534266191295 and parameters: {'model_type': 'graphsage', 'hidden_dims': '[512, 128]', 'dropout': 0.3244151439641872, 'batch_norm': False, 'sage_aggr': 'mean', 'sage_normalize': False, 'sage_project': False, 'lr': 0.000123625484543404, 'weight_decay': 0.000551545456306965, 'epochs': 111, 'loss': 'mae', 'optimizer': 'adam', 'graph_mode': 'cutoff', 'cutoff': 0.7686074251669377, 'grm_norm': 'cosine_then_gcn', 'self_loops': False, 'use_snp_selection': True, 'num_snps': 25776, 'graphsage_batch_size': 8}. Best is trial 92 with value: 0.2626148420921274.
[I 2025-12-06 17:46:17,829] Trial 102 finished with value: 0.25142534353212287 and parameters: {'model_type': 'graphsage', 'hidden_dims': '[512, 128]', 'dropout': 0.30440727060478956, 'batch_norm': False, 'sage_aggr': 'mean', 'sage_normalize': False, 'sage_project': False, 'lr': 0.0001594846451592518, 'weight_decay': 0.0004170251980949233, 'epochs': 120, 'loss': 'mae', 'optimizer': 'adam', 'graph_mode': 'cutoff', 'cutoff': 0.700992149925012, 'grm_norm': 'cosine_then_gcn', 'self_loops': False, 'use_snp_selection': True, 'num_snps': 21270, 'graphsage_batch_size': 8}. Best is trial 92 with value: 0.2626148420921274.
[I 2025-12-06 17:46:46,221] Trial 103 finished with value: 0.2278859376764612 and parameters: {'model_type': 'graphsage', 'hidden_dims': '[512, 128]', 'dropout': 0.3463600941209192, 'batch_norm': False, 'sage_aggr': 'mean', 'sage_normalize': False, 'sage_project': False, 'lr': 9.953677541326505e-05, 'weight_decay': 0.0006507435709548171, 'epochs': 107, 'loss': 'mae', 'optimizer': 'adam', 'graph_mode': 'cutoff', 'cutoff': 0.73505230528305, 'grm_norm': 'cosine_then_gcn', 'self_loops': False, 'use_snp_selection': True, 'num_snps': 11799, 'graphsage_batch_size': 8}. Best is trial 92 with value: 0.2626148420921274.
[I 2025-12-06 17:47:30,515] Trial 104 finished with value: 0.2577153760048471 and parameters: {'model_type': 'graphsage', 'hidden_dims': '[512, 128]', 'dropout': 0.29111695012578875, 'batch_norm': False, 'sage_aggr': 'mean', 'sage_normalize': False, 'sage_project': False, 'lr': 8.338301111265932e-05, 'weight_decay': 0.0005065477544918117, 'epochs': 115, 'loss': 'mae', 'optimizer': 'adam', 'graph_mode': 'cutoff', 'cutoff': 0.818951345646002, 'grm_norm': 'cosine_then_gcn', 'self_loops': False, 'use_snp_selection': True, 'num_snps': 23996, 'graphsage_batch_size': 8}. Best is trial 92 with value: 0.2626148420921274.
[I 2025-12-06 17:48:15,286] Trial 105 finished with value: 0.2515583226767239 and parameters: {'model_type': 'graphsage', 'hidden_dims': '[512, 128]', 'dropout': 0.29660487198951685, 'batch_norm': False, 'sage_aggr': 'mean', 'sage_normalize': False, 'sage_project': False, 'lr': 7.494887635893906e-05, 'weight_decay': 0.000998796933599821, 'epochs': 114, 'loss': 'mae', 'optimizer': 'adam', 'graph_mode': 'cutoff', 'cutoff': 0.8233518737048813, 'grm_norm': 'cosine_then_gcn', 'self_loops': False, 'use_snp_selection': True, 'num_snps': 24342, 'graphsage_batch_size': 8}. Best is trial 92 with value: 0.2626148420921274.
[I 2025-12-06 17:48:54,313] Trial 106 finished with value: 0.26152584484389 and parameters: {'model_type': 'graphsage', 'hidden_dims': '[512, 128]', 'dropout': 0.3348894856551936, 'batch_norm': False, 'sage_aggr': 'mean', 'sage_normalize': False, 'sage_project': False, 'lr': 0.00011955606799086723, 'weight_decay': 0.0003351817500219443, 'epochs': 134, 'loss': 'mae', 'optimizer': 'adam', 'graph_mode': 'cutoff', 'cutoff': 0.6942324883021453, 'grm_norm': 'cosine_then_gcn', 'self_loops': False, 'use_snp_selection': True, 'num_snps': 17583, 'graphsage_batch_size': 8}. Best is trial 92 with value: 0.2626148420921274.
[I 2025-12-06 17:49:35,398] Trial 107 finished with value: 0.25183673162949655 and parameters: {'model_type': 'graphsage', 'hidden_dims': '[512, 128]', 'dropout': 0.3352701035894256, 'batch_norm': False, 'sage_aggr': 'mean', 'sage_normalize': False, 'sage_project': False, 'lr': 0.0002602631361877154, 'weight_decay': 0.0002600013956066442, 'epochs': 122, 'loss': 'mae', 'optimizer': 'adam', 'graph_mode': 'cutoff', 'cutoff': 0.6881456995801836, 'grm_norm': 'cosine_then_gcn', 'self_loops': False, 'use_snp_selection': True, 'num_snps': 20543, 'graphsage_batch_size': 8}. Best is trial 92 with value: 0.2626148420921274.
[I 2025-12-06 17:50:13,724] Trial 108 finished with value: 0.25643284893466906 and parameters: {'model_type': 'graphsage', 'hidden_dims': '[512, 128]', 'dropout': 0.2699836352664952, 'batch_norm': False, 'sage_aggr': 'mean', 'sage_normalize': False, 'sage_project': False, 'lr': 0.00014774278710250012, 'weight_decay': 0.0003470787177577603, 'epochs': 133, 'loss': 'mae', 'optimizer': 'adam', 'graph_mode': 'cutoff', 'cutoff': 0.7370648972635628, 'grm_norm': 'cosine', 'self_loops': False, 'use_snp_selection': True, 'num_snps': 17158, 'graphsage_batch_size': 8}. Best is trial 92 with value: 0.2626148420921274.
[I 2025-12-06 17:50:44,746] Trial 109 finished with value: 0.2451816328370629 and parameters: {'model_type': 'graphsage', 'hidden_dims': '[256, 128, 64]', 'dropout': 0.2614506239848552, 'batch_norm': False, 'sage_aggr': 'mean', 'sage_normalize': False, 'sage_project': False, 'lr': 0.00013711039178881398, 'weight_decay': 9.65252249137977e-07, 'epochs': 134, 'loss': 'mae', 'optimizer': 'adam', 'graph_mode': 'cutoff', 'cutoff': 0.7770064834274751, 'grm_norm': 'cosine', 'self_loops': False, 'use_snp_selection': True, 'num_snps': 18278, 'graphsage_batch_size': 8}. Best is trial 92 with value: 0.2626148420921274.
[I 2025-12-06 17:51:23,405] Trial 110 finished with value: 0.21839072126903095 and parameters: {'model_type': 'graphsage', 'hidden_dims': '[512, 128]', 'dropout': 0.2847107575367996, 'batch_norm': False, 'sage_aggr': 'mean', 'sage_normalize': True, 'sage_project': False, 'lr': 0.00010811429734776481, 'weight_decay': 0.0003585856170511677, 'epochs': 129, 'loss': 'mae', 'optimizer': 'adam', 'graph_mode': 'cutoff', 'cutoff': 0.7164509577483537, 'grm_norm': 'cosine', 'self_loops': False, 'use_snp_selection': True, 'num_snps': 17732, 'graphsage_batch_size': 8}. Best is trial 92 with value: 0.2626148420921274.
[I 2025-12-06 17:52:12,993] Trial 111 finished with value: 0.2513799697964965 and parameters: {'model_type': 'graphsage', 'hidden_dims': '[512, 128]', 'dropout': 0.35294084841363144, 'batch_norm': False, 'sage_aggr': 'mean', 'sage_normalize': False, 'sage_project': False, 'lr': 0.00018334415617522827, 'weight_decay': 0.00042172664332316284, 'epochs': 126, 'loss': 'mae', 'optimizer': 'adam', 'graph_mode': 'cutoff', 'cutoff': 0.7379244819329654, 'grm_norm': 'cosine', 'self_loops': False, 'use_snp_selection': True, 'num_snps': 26018, 'graphsage_batch_size': 8}. Best is trial 92 with value: 0.2626148420921274.
