[I 2025-12-09 18:13:26,543] Trial 67 finished with value: 0.3535507363959401 and parameters: {'model_type': 'graphsage', 'hidden_dims': '[128, 64]', 'dropout': 0.16483852556921583, 'batch_norm': False, 'sage_aggr': 'mean', 'sage_normalize': True, 'sage_project': False, 'lr': 2.055285485028261e-05, 'weight_decay': 6.055990467830107e-05, 'epochs': 129, 'loss': 'mse', 'optimizer': 'adam', 'graph_mode': 'cutoff', 'cutoff': 0.4957396366923331, 'grm_norm': 'cosine_then_gcn', 'self_loops': True, 'use_snp_selection': False}. Best is trial 66 with value: 0.3724803529459689.
[I 2025-12-09 18:14:09,246] Trial 68 finished with value: 0.35237416586406295 and parameters: {'model_type': 'graphsage', 'hidden_dims': '[256, 128]', 'dropout': 0.5198542449926655, 'batch_norm': True, 'sage_aggr': 'mean', 'sage_normalize': False, 'sage_project': False, 'lr': 4.170565175739413e-05, 'weight_decay': 8.225970082187448e-05, 'epochs': 142, 'loss': 'mse', 'optimizer': 'adam', 'graph_mode': 'cutoff', 'cutoff': 0.5513987430867573, 'grm_norm': 'cosine_then_gcn', 'self_loops': False, 'use_snp_selection': False}. Best is trial 66 with value: 0.3724803529459689.
[I 2025-12-09 18:14:49,362] Trial 69 finished with value: 0.34657376843008914 and parameters: {'model_type': 'graphsage', 'hidden_dims': '[512, 64]', 'dropout': 0.13111177527291865, 'batch_norm': False, 'sage_aggr': 'mean', 'sage_normalize': False, 'sage_project': False, 'lr': 3.20526915679204e-05, 'weight_decay': 3.09658192764645e-05, 'epochs': 70, 'loss': 'mse', 'optimizer': 'adam', 'graph_mode': 'cutoff', 'cutoff': 0.6055857716931388, 'grm_norm': 'cosine_then_gcn', 'self_loops': True, 'use_snp_selection': False}. Best is trial 66 with value: 0.3724803529459689.
[I 2025-12-09 18:16:07,495] Trial 70 finished with value: 0.36963682503164497 and parameters: {'model_type': 'graphsage', 'hidden_dims': '[512, 256]', 'dropout': 0.14876741758196874, 'batch_norm': False, 'sage_aggr': 'mean', 'sage_normalize': False, 'sage_project': False, 'lr': 1.0736858951156233e-05, 'weight_decay': 1.0561899745944915e-05, 'epochs': 115, 'loss': 'mse', 'optimizer': 'adam', 'graph_mode': 'knn', 'knn_k': 5, 'weighted_edges': True, 'symmetrize_mode': 'union', 'self_loops': True, 'use_snp_selection': False}. Best is trial 66 with value: 0.3724803529459689.
[I 2025-12-09 18:17:26,182] Trial 71 finished with value: 0.3655614180671334 and parameters: {'model_type': 'graphsage', 'hidden_dims': '[512, 256]', 'dropout': 0.15067075169343072, 'batch_norm': False, 'sage_aggr': 'mean', 'sage_normalize': False, 'sage_project': False, 'lr': 1.1230423381475465e-05, 'weight_decay': 9.372601416253124e-06, 'epochs': 116, 'loss': 'mse', 'optimizer': 'adam', 'graph_mode': 'knn', 'knn_k': 5, 'weighted_edges': True, 'symmetrize_mode': 'union', 'self_loops': True, 'use_snp_selection': False}. Best is trial 66 with value: 0.3724803529459689.
[I 2025-12-09 18:18:41,342] Trial 72 finished with value: 0.35988685581104346 and parameters: {'model_type': 'graphsage', 'hidden_dims': '[512, 256]', 'dropout': 0.113940572131694, 'batch_norm': False, 'sage_aggr': 'mean', 'sage_normalize': False, 'sage_project': False, 'lr': 1.9241773850886566e-05, 'weight_decay': 2.3797132093361232e-05, 'epochs': 87, 'loss': 'mse', 'optimizer': 'adam', 'graph_mode': 'knn', 'knn_k': 7, 'weighted_edges': True, 'symmetrize_mode': 'union', 'self_loops': True, 'use_snp_selection': False}. Best is trial 66 with value: 0.3724803529459689.
[I 2025-12-09 18:19:49,878] Trial 73 finished with value: 0.36542107468931706 and parameters: {'model_type': 'graphsage', 'hidden_dims': '[512, 256]', 'dropout': 0.17762215138151838, 'batch_norm': False, 'sage_aggr': 'mean', 'sage_normalize': False, 'sage_project': False, 'lr': 1.2104463030049572e-05, 'weight_decay': 1.391138044899278e-05, 'epochs': 98, 'loss': 'mse', 'optimizer': 'adam', 'graph_mode': 'knn', 'knn_k': 5, 'weighted_edges': True, 'symmetrize_mode': 'union', 'self_loops': True, 'use_snp_selection': False}. Best is trial 66 with value: 0.3724803529459689.
[I 2025-12-09 18:21:58,776] Trial 74 finished with value: 0.36823534013003345 and parameters: {'model_type': 'graphsage', 'hidden_dims': '[512, 256]', 'dropout': 0.1382857095692751, 'batch_norm': False, 'sage_aggr': 'mean', 'sage_normalize': False, 'sage_project': False, 'lr': 2.909866921064795e-05, 'weight_decay': 4.933519950221577e-06, 'epochs': 154, 'loss': 'mse', 'optimizer': 'adam', 'graph_mode': 'knn', 'knn_k': 8, 'weighted_edges': True, 'symmetrize_mode': 'union', 'self_loops': True, 'use_snp_selection': False}. Best is trial 66 with value: 0.3724803529459689.
[I 2025-12-09 18:24:11,885] Trial 75 finished with value: 0.37120453622865435 and parameters: {'model_type': 'graphsage', 'hidden_dims': '[256, 128]', 'dropout': 0.21503336450509203, 'batch_norm': False, 'sage_aggr': 'mean', 'sage_normalize': False, 'sage_project': False, 'lr': 1.0132280448993734e-05, 'weight_decay': 1.0711491829901412e-05, 'epochs': 250, 'loss': 'mse', 'optimizer': 'adam', 'graph_mode': 'knn', 'knn_k': 6, 'weighted_edges': True, 'symmetrize_mode': 'union', 'self_loops': True, 'use_snp_selection': False}. Best is trial 66 with value: 0.3724803529459689.
[I 2025-12-09 18:26:22,585] Trial 76 finished with value: 0.36340696078648954 and parameters: {'model_type': 'graphsage', 'hidden_dims': '[256, 128, 64]', 'dropout': 0.25323098906641517, 'batch_norm': False, 'sage_aggr': 'mean', 'sage_normalize': False, 'sage_project': False, 'lr': 1.055867597026797e-05, 'weight_decay': 3.30929907787588e-06, 'epochs': 244, 'loss': 'mse', 'optimizer': 'adam', 'graph_mode': 'knn', 'knn_k': 6, 'weighted_edges': True, 'symmetrize_mode': 'union', 'self_loops': True, 'use_snp_selection': False}. Best is trial 66 with value: 0.3724803529459689.
[I 2025-12-09 18:28:07,080] Trial 77 finished with value: 0.3603641334313417 and parameters: {'model_type': 'graphsage', 'hidden_dims': '[256, 128]', 'dropout': 0.21239186987216171, 'batch_norm': False, 'sage_aggr': 'mean', 'sage_normalize': False, 'sage_project': False, 'lr': 1.2980519037185789e-05, 'weight_decay': 6.037774803151047e-06, 'epochs': 265, 'loss': 'mse', 'optimizer': 'adam', 'graph_mode': 'knn', 'knn_k': 4, 'weighted_edges': True, 'symmetrize_mode': 'union', 'self_loops': True, 'use_snp_selection': False}. Best is trial 66 with value: 0.3724803529459689.
[I 2025-12-09 18:29:51,900] Trial 78 finished with value: 0.36315417840710984 and parameters: {'model_type': 'graphsage', 'hidden_dims': '[256, 128]', 'dropout': 0.30988359396339654, 'batch_norm': False, 'sage_aggr': 'mean', 'sage_normalize': False, 'sage_project': False, 'lr': 1.6125218720179903e-05, 'weight_decay': 1.4386324691322735e-05, 'epochs': 205, 'loss': 'mse', 'optimizer': 'adam', 'graph_mode': 'knn', 'knn_k': 6, 'weighted_edges': True, 'symmetrize_mode': 'union', 'self_loops': False, 'use_snp_selection': False}. Best is trial 66 with value: 0.3724803529459689.
[I 2025-12-09 18:33:02,989] Trial 79 finished with value: 0.36212453172481973 and parameters: {'model_type': 'graphsage', 'hidden_dims': '[256, 128]', 'dropout': 0.24441227001558385, 'batch_norm': False, 'sage_aggr': 'mean', 'sage_normalize': False, 'sage_project': False, 'lr': 1.0107390794014673e-05, 'weight_decay': 1.0282214141984588e-05, 'epochs': 314, 'loss': 'mse', 'optimizer': 'adam', 'graph_mode': 'knn', 'knn_k': 8, 'weighted_edges': True, 'symmetrize_mode': 'union', 'self_loops': True, 'use_snp_selection': False}. Best is trial 66 with value: 0.3724803529459689.
[I 2025-12-09 18:34:59,684] Trial 80 finished with value: 0.3298906089308254 and parameters: {'model_type': 'graphsage', 'hidden_dims': '[256, 128]', 'dropout': 0.34441920286089467, 'batch_norm': True, 'sage_aggr': 'mean', 'sage_normalize': True, 'sage_project': False, 'lr': 2.0490191411058385e-05, 'weight_decay': 1.1025860677985782e-05, 'epochs': 271, 'loss': 'mse', 'optimizer': 'adam', 'graph_mode': 'knn', 'knn_k': 5, 'weighted_edges': True, 'symmetrize_mode': 'union', 'self_loops': True, 'use_snp_selection': False}. Best is trial 66 with value: 0.3724803529459689.
[I 2025-12-09 18:35:34,932] Trial 81 finished with value: 0.371789106323504 and parameters: {'model_type': 'graphsage', 'hidden_dims': '[256, 128]', 'dropout': 0.16021156691575095, 'batch_norm': False, 'sage_aggr': 'mean', 'sage_normalize': False, 'sage_project': False, 'lr': 3.770116011431426e-05, 'weight_decay': 5.469738731019229e-05, 'epochs': 111, 'loss': 'mse', 'optimizer': 'adam', 'graph_mode': 'cutoff', 'cutoff': 0.5757851651186994, 'grm_norm': 'cosine_then_gcn', 'self_loops': True, 'use_snp_selection': False}. Best is trial 66 with value: 0.3724803529459689.
[I 2025-12-09 18:36:55,570] Trial 82 finished with value: 0.3672639895819456 and parameters: {'model_type': 'graphsage', 'hidden_dims': '[256, 128]', 'dropout': 0.15586008245062988, 'batch_norm': False, 'sage_aggr': 'mean', 'sage_normalize': False, 'sage_project': False, 'lr': 2.4443854182853077e-05, 'weight_decay': 0.00014604565194935898, 'epochs': 120, 'loss': 'mse', 'optimizer': 'adam', 'graph_mode': 'knn', 'knn_k': 8, 'weighted_edges': True, 'symmetrize_mode': 'union', 'self_loops': True, 'use_snp_selection': False}. Best is trial 66 with value: 0.3724803529459689.
[I 2025-12-09 18:37:42,316] Trial 83 finished with value: 0.3717027085366976 and parameters: {'model_type': 'graphsage', 'hidden_dims': '[256, 128]', 'dropout': 0.17113116885226298, 'batch_norm': False, 'sage_aggr': 'mean', 'sage_normalize': False, 'sage_project': False, 'lr': 3.46803660264876e-05, 'weight_decay': 3.717722938011691e-05, 'epochs': 134, 'loss': 'mse', 'optimizer': 'adam', 'graph_mode': 'cutoff', 'cutoff': 0.47291010838753733, 'grm_norm': 'cosine_then_gcn', 'self_loops': True, 'use_snp_selection': False}. Best is trial 66 with value: 0.3724803529459689.
[I 2025-12-09 18:38:29,617] Trial 84 finished with value: 0.3688416018430874 and parameters: {'model_type': 'graphsage', 'hidden_dims': '[256, 128]', 'dropout': 0.18831786675761322, 'batch_norm': False, 'sage_aggr': 'mean', 'sage_normalize': False, 'sage_project': False, 'lr': 1.5048463649625533e-05, 'weight_decay': 0.00023407369359971508, 'epochs': 133, 'loss': 'mse', 'optimizer': 'adam', 'graph_mode': 'cutoff', 'cutoff': 0.4193422085121684, 'grm_norm': 'cosine_then_gcn', 'self_loops': True, 'use_snp_selection': False}. Best is trial 66 with value: 0.3724803529459689.
[I 2025-12-09 18:39:17,544] Trial 85 finished with value: 0.34746328616508426 and parameters: {'model_type': 'graphsage', 'hidden_dims': '[512, 256]', 'dropout': 0.16642894051581392, 'batch_norm': False, 'sage_aggr': 'mean', 'sage_normalize': False, 'sage_project': False, 'lr': 3.4880147107069607e-05, 'weight_decay': 5.564501560684879e-05, 'epochs': 79, 'loss': 'mse', 'optimizer': 'adam', 'graph_mode': 'cutoff', 'cutoff': 0.4553300457172493, 'grm_norm': 'cosine_then_gcn', 'self_loops': True, 'use_snp_selection': False}. Best is trial 66 with value: 0.3724803529459689.
[I 2025-12-09 18:40:16,104] Trial 86 finished with value: 0.3599906788171402 and parameters: {'model_type': 'graphsage', 'hidden_dims': '[256, 128]', 'dropout': 0.20809855142855577, 'batch_norm': False, 'sage_aggr': 'mean', 'sage_normalize': False, 'sage_project': False, 'lr': 2.4607544592042452e-05, 'weight_decay': 3.726937205864222e-05, 'epochs': 147, 'loss': 'mse', 'optimizer': 'adam', 'graph_mode': 'knn', 'knn_k': 3, 'weighted_edges': True, 'symmetrize_mode': 'union', 'self_loops': True, 'use_snp_selection': False}. Best is trial 66 with value: 0.3724803529459689.
[I 2025-12-09 18:40:49,107] Trial 87 finished with value: 0.37133305661582566 and parameters: {'model_type': 'graphsage', 'hidden_dims': '[256, 128]', 'dropout': 0.2208989983435331, 'batch_norm': False, 'sage_aggr': 'mean', 'sage_normalize': False, 'sage_project': False, 'lr': 1.731323849277878e-05, 'weight_decay': 2.1125347537369646e-05, 'epochs': 95, 'loss': 'mse', 'optimizer': 'adam', 'graph_mode': 'cutoff', 'cutoff': 0.5177579355094828, 'grm_norm': 'cosine_then_gcn', 'self_loops': True, 'use_snp_selection': False}. Best is trial 66 with value: 0.3724803529459689.
[I 2025-12-09 18:41:38,319] Trial 88 finished with value: 0.3731829818307439 and parameters: {'model_type': 'graphsage', 'hidden_dims': '[512, 128]', 'dropout': 0.2214254351776847, 'batch_norm': False, 'sage_aggr': 'mean', 'sage_normalize': False, 'sage_project': False, 'lr': 1.6955000163729103e-05, 'weight_decay': 7.389212457778238e-05, 'epochs': 90, 'loss': 'mse', 'optimizer': 'adam', 'graph_mode': 'cutoff', 'cutoff': 0.5189060462397387, 'grm_norm': 'cosine_then_gcn', 'self_loops': True, 'use_snp_selection': False}. Best is trial 88 with value: 0.3731829818307439.
[I 2025-12-09 18:43:26,106] Trial 89 finished with value: 0.36007246825732697 and parameters: {'model_type': 'graphsage', 'hidden_dims': '[512, 128]', 'dropout': 0.26342194356628545, 'batch_norm': False, 'sage_aggr': 'mean', 'sage_normalize': False, 'sage_project': False, 'lr': 1.6669277994154605e-05, 'weight_decay': 7.440189688024438e-05, 'epochs': 216, 'loss': 'mse', 'optimizer': 'adam', 'graph_mode': 'cutoff', 'cutoff': 0.4678976560282118, 'grm_norm': 'cosine_then_gcn', 'self_loops': True, 'use_snp_selection': False}. Best is trial 88 with value: 0.3731829818307439.
[I 2025-12-09 18:44:09,777] Trial 90 finished with value: 0.01824231237745026 and parameters: {'model_type': 'graphsage', 'hidden_dims': '[512, 128]', 'dropout': 0.21794933143060802, 'batch_norm': False, 'sage_aggr': 'max', 'sage_normalize': False, 'sage_project': False, 'lr': 0.0014375586292900877, 'weight_decay': 1.941046698045267e-05, 'epochs': 65, 'loss': 'mse', 'optimizer': 'adam', 'graph_mode': 'cutoff', 'cutoff': 0.37674357042718254, 'grm_norm': 'cosine_then_gcn', 'self_loops': True, 'use_snp_selection': False}. Best is trial 88 with value: 0.3731829818307439.
[I 2025-12-09 18:44:58,682] Trial 91 finished with value: 0.3631150732177656 and parameters: {'model_type': 'graphsage', 'hidden_dims': '[512, 128]', 'dropout': 0.2361553425308577, 'batch_norm': False, 'sage_aggr': 'mean', 'sage_normalize': False, 'sage_project': False, 'lr': 1.4134618182828109e-05, 'weight_decay': 9.071367051667667e-06, 'epochs': 89, 'loss': 'mse', 'optimizer': 'adam', 'graph_mode': 'cutoff', 'cutoff': 0.5186556924904029, 'grm_norm': 'cosine_then_gcn', 'self_loops': True, 'use_snp_selection': False}. Best is trial 88 with value: 0.3731829818307439.
[I 2025-12-09 18:46:18,774] Trial 92 finished with value: 0.35894035399290514 and parameters: {'model_type': 'graphsage', 'hidden_dims': '[512, 128]', 'dropout': 0.19744337655169417, 'batch_norm': False, 'sage_aggr': 'mean', 'sage_normalize': False, 'sage_project': False, 'lr': 1.807779913667165e-05, 'weight_decay': 2.6828240423413154e-05, 'epochs': 172, 'loss': 'mse', 'optimizer': 'adam', 'graph_mode': 'cutoff', 'cutoff': 0.5718133085860169, 'grm_norm': 'cosine_then_gcn', 'self_loops': True, 'use_snp_selection': False}. Best is trial 88 with value: 0.3731829818307439.
[I 2025-12-09 18:46:42,576] Trial 93 finished with value: 0.37098773653052686 and parameters: {'model_type': 'graphsage', 'hidden_dims': '[128, 64]', 'dropout': 0.22850158556902792, 'batch_norm': False, 'sage_aggr': 'mean', 'sage_normalize': False, 'sage_project': False, 'lr': 2.1042896707844347e-05, 'weight_decay': 3.716714220507107e-05, 'epochs': 93, 'loss': 'mse', 'optimizer': 'adam', 'graph_mode': 'cutoff', 'cutoff': 0.524628653184663, 'grm_norm': 'cosine_then_gcn', 'self_loops': True, 'use_snp_selection': False}. Best is trial 88 with value: 0.3731829818307439.
[I 2025-12-09 18:47:29,925] Trial 94 finished with value: 0.35985883187741113 and parameters: {'model_type': 'graphsage', 'hidden_dims': '[128, 64]', 'dropout': 0.22994328102921324, 'batch_norm': False, 'sage_aggr': 'mean', 'sage_normalize': False, 'sage_project': False, 'lr': 2.3517257675840577e-05, 'weight_decay': 3.861122066630031e-05, 'epochs': 237, 'loss': 'mse', 'optimizer': 'adam', 'graph_mode': 'cutoff', 'cutoff': 0.5079133217853903, 'grm_norm': 'cosine', 'self_loops': True, 'use_snp_selection': False}. Best is trial 88 with value: 0.3731829818307439.
[I 2025-12-09 18:47:54,001] Trial 95 finished with value: 0.35386244937865613 and parameters: {'model_type': 'graphsage', 'hidden_dims': '[128, 64]', 'dropout': 0.27830948323460714, 'batch_norm': False, 'sage_aggr': 'mean', 'sage_normalize': False, 'sage_project': False, 'lr': 2.1180517226339968e-05, 'weight_decay': 6.306217797903693e-06, 'epochs': 75, 'loss': 'mse', 'optimizer': 'adam', 'graph_mode': 'cutoff', 'cutoff': 0.47080209826915065, 'grm_norm': 'cosine_then_gcn', 'self_loops': True, 'use_snp_selection': False}. Best is trial 88 with value: 0.3731829818307439.
[I 2025-12-09 18:48:20,130] Trial 96 finished with value: 0.3390346522284581 and parameters: {'model_type': 'graphsage', 'hidden_dims': '[128, 64]', 'dropout': 0.22216601002136568, 'batch_norm': False, 'sage_aggr': 'mean', 'sage_normalize': False, 'sage_project': False, 'lr': 5.533325737301745e-05, 'weight_decay': 5.344929090087936e-05, 'epochs': 93, 'loss': 'mse', 'optimizer': 'adam', 'graph_mode': 'cutoff', 'cutoff': 0.5390878315298391, 'grm_norm': 'gcn', 'self_loops': True, 'use_snp_selection': True, 'num_snps': 2105}. Best is trial 88 with value: 0.3731829818307439.
[I 2025-12-09 18:49:06,702] Trial 97 finished with value: 0.33851471947896616 and parameters: {'model_type': 'graphsage', 'hidden_dims': '[128, 64]', 'dropout': 0.24600886127762267, 'batch_norm': False, 'sage_aggr': 'mean', 'sage_normalize': True, 'sage_project': False, 'lr': 3.124696211028085e-05, 'weight_decay': 9.67943374728953e-05, 'epochs': 187, 'loss': 'mse', 'optimizer': 'adam', 'graph_mode': 'cutoff', 'cutoff': 0.39855177301091155, 'grm_norm': 'cosine_then_gcn', 'self_loops': True, 'use_snp_selection': False}. Best is trial 88 with value: 0.3731829818307439.
[I 2025-12-09 18:50:14,677] Trial 98 finished with value: 0.35386728303611614 and parameters: {'model_type': 'graphsage', 'hidden_dims': '[512, 64]', 'dropout': 0.17497939579388871, 'batch_norm': True, 'sage_aggr': 'mean', 'sage_normalize': False, 'sage_project': False, 'lr': 1.1790730889590233e-05, 'weight_decay': 1.217334930127975e-05, 'epochs': 123, 'loss': 'mse', 'optimizer': 'adam', 'graph_mode': 'cutoff', 'cutoff': 0.4364468309375836, 'grm_norm': 'cosine_then_gcn', 'self_loops': False, 'use_snp_selection': False}. Best is trial 88 with value: 0.3731829818307439.
[I 2025-12-09 18:50:49,860] Trial 99 finished with value: 0.3168044933857603 and parameters: {'model_type': 'graphsage', 'hidden_dims': '[256, 128, 64]', 'dropout': 0.20245486583996075, 'batch_norm': False, 'sage_aggr': 'mean', 'sage_normalize': False, 'sage_project': False, 'lr': 1.8814435715775895e-05, 'weight_decay': 1.6105536636327764e-05, 'epochs': 60, 'loss': 'mse', 'optimizer': 'adam', 'graph_mode': 'knn', 'knn_k': 5, 'weighted_edges': True, 'symmetrize_mode': 'union', 'self_loops': True, 'use_snp_selection': False}. Best is trial 88 with value: 0.3731829818307439.
[I 2025-12-09 18:51:53,921] Trial 100 finished with value: 0.3648278929900114 and parameters: {'model_type': 'graphsage', 'hidden_dims': '[512, 128]', 'dropout': 0.1823501632572226, 'batch_norm': False, 'sage_aggr': 'mean', 'sage_normalize': False, 'sage_project': False, 'lr': 2.6731533610581023e-05, 'weight_decay': 6.868642108350147e-05, 'epochs': 110, 'loss': 'mse', 'optimizer': 'adam', 'graph_mode': 'cutoff', 'cutoff': 0.33771398935214175, 'grm_norm': 'cosine_then_gcn', 'self_loops': True, 'use_snp_selection': False}. Best is trial 88 with value: 0.3731829818307439.
[I 2025-12-09 18:52:26,325] Trial 101 finished with value: 0.3663919085015275 and parameters: {'model_type': 'graphsage', 'hidden_dims': '[256, 128]', 'dropout': 0.10747463471535776, 'batch_norm': False, 'sage_aggr': 'mean', 'sage_normalize': False, 'sage_project': False, 'lr': 1.3702517590068221e-05, 'weight_decay': 2.2187678124582142e-05, 'epochs': 98, 'loss': 'mse', 'optimizer': 'adam', 'graph_mode': 'cutoff', 'cutoff': 0.5790916741275598, 'grm_norm': 'cosine_then_gcn', 'self_loops': True, 'use_snp_selection': False}. Best is trial 88 with value: 0.3731829818307439.
[I 2025-12-09 18:52:56,078] Trial 102 finished with value: 0.35187978427892946 and parameters: {'model_type': 'graphsage', 'hidden_dims': '[256, 128]', 'dropout': 0.19399849615457876, 'batch_norm': False, 'sage_aggr': 'mean', 'sage_normalize': False, 'sage_project': False, 'lr': 3.624261625393734e-05, 'weight_decay': 3.213162966519563e-05, 'epochs': 84, 'loss': 'mse', 'optimizer': 'adam', 'graph_mode': 'cutoff', 'cutoff': 0.5483194374143944, 'grm_norm': 'cosine_then_gcn', 'self_loops': True, 'use_snp_selection': False}. Best is trial 88 with value: 0.3731829818307439.
[I 2025-12-09 18:53:32,076] Trial 103 finished with value: 0.36682354193941313 and parameters: {'model_type': 'graphsage', 'hidden_dims': '[256, 128]', 'dropout': 0.17054717706858968, 'batch_norm': False, 'sage_aggr': 'mean', 'sage_normalize': False, 'sage_project': False, 'lr': 1.675824201721272e-05, 'weight_decay': 7.835840646428433e-06, 'epochs': 94, 'loss': 'mse', 'optimizer': 'adam', 'graph_mode': 'cutoff', 'cutoff': 0.47761184352746233, 'grm_norm': 'cosine_then_gcn', 'self_loops': True, 'use_snp_selection': False}. Best is trial 88 with value: 0.3731829818307439.
[I 2025-12-09 18:54:10,341] Trial 104 finished with value: 0.36557858370544233 and parameters: {'model_type': 'graphsage', 'hidden_dims': '[256, 128]', 'dropout': 0.1553554702931983, 'batch_norm': False, 'sage_aggr': 'mean', 'sage_normalize': False, 'sage_project': False, 'lr': 1.0000327161682002e-05, 'weight_decay': 4.037996751689657e-05, 'epochs': 117, 'loss': 'mse', 'optimizer': 'adam', 'graph_mode': 'cutoff', 'cutoff': 0.514705182099281, 'grm_norm': 'cosine', 'self_loops': True, 'use_snp_selection': False}. Best is trial 88 with value: 0.3731829818307439.
