[I 2025-12-08 23:49:40,489] Trial 111 finished with value: 0.3653275525408347 and parameters: {'model_type': 'graphsage', 'hidden_dims': '[512, 128]', 'dropout': 0.3409819746066755, 'batch_norm': False, 'sage_aggr': 'mean', 'sage_normalize': False, 'sage_project': False, 'lr': 1.1237599861742807e-05, 'weight_decay': 9.612957731708373e-06, 'epochs': 86, 'loss': 'mse', 'optimizer': 'adam', 'graph_mode': 'cutoff', 'cutoff': 0.7525000928256127, 'grm_norm': 'gcn', 'self_loops': False, 'use_snp_selection': False}. Best is trial 90 with value: 0.37863403836464726.
[I 2025-12-08 23:50:43,241] Trial 112 finished with value: 0.36093055685384623 and parameters: {'model_type': 'graphsage', 'hidden_dims': '[512, 128]', 'dropout': 0.389026201954065, 'batch_norm': False, 'sage_aggr': 'mean', 'sage_normalize': False, 'sage_project': False, 'lr': 1.385854993034279e-05, 'weight_decay': 2.0641260961871304e-06, 'epochs': 129, 'loss': 'mse', 'optimizer': 'adam', 'graph_mode': 'cutoff', 'cutoff': 0.7945164063217814, 'grm_norm': 'cosine_then_gcn', 'self_loops': False, 'use_snp_selection': False}. Best is trial 90 with value: 0.37863403836464726.
[I 2025-12-08 23:51:25,219] Trial 113 finished with value: 0.3650859965289337 and parameters: {'model_type': 'graphsage', 'hidden_dims': '[512, 128]', 'dropout': 0.3798636789174925, 'batch_norm': False, 'sage_aggr': 'mean', 'sage_normalize': False, 'sage_project': False, 'lr': 1.7679811422030327e-05, 'weight_decay': 4.657089687450791e-06, 'epochs': 78, 'loss': 'mse', 'optimizer': 'adam', 'graph_mode': 'cutoff', 'cutoff': 0.7700546143360445, 'grm_norm': 'gcn', 'self_loops': False, 'use_snp_selection': False}. Best is trial 90 with value: 0.37863403836464726.
[I 2025-12-08 23:52:19,506] Trial 114 finished with value: 0.377259627696629 and parameters: {'model_type': 'graphsage', 'hidden_dims': '[512, 128]', 'dropout': 0.446696421384602, 'batch_norm': False, 'sage_aggr': 'mean', 'sage_normalize': False, 'sage_project': False, 'lr': 2.2634387750738975e-05, 'weight_decay': 8.354300040588637e-06, 'epochs': 110, 'loss': 'mse', 'optimizer': 'adam', 'graph_mode': 'cutoff', 'cutoff': 0.8312589326937897, 'grm_norm': 'gcn', 'self_loops': False, 'use_snp_selection': False}. Best is trial 90 with value: 0.37863403836464726.
[I 2025-12-08 23:53:13,402] Trial 115 finished with value: 0.3705722271918623 and parameters: {'model_type': 'graphsage', 'hidden_dims': '[512, 128]', 'dropout': 0.44729239873048426, 'batch_norm': False, 'sage_aggr': 'mean', 'sage_normalize': False, 'sage_project': False, 'lr': 2.3608441955365176e-05, 'weight_decay': 6.6949692049685855e-06, 'epochs': 109, 'loss': 'mse', 'optimizer': 'adam', 'graph_mode': 'cutoff', 'cutoff': 0.8205434202322827, 'grm_norm': 'gcn', 'self_loops': False, 'use_snp_selection': False}. Best is trial 90 with value: 0.37863403836464726.
[I 2025-12-08 23:54:07,689] Trial 116 finished with value: 0.3720839181278722 and parameters: {'model_type': 'graphsage', 'hidden_dims': '[512, 128]', 'dropout': 0.42926872353353845, 'batch_norm': False, 'sage_aggr': 'mean', 'sage_normalize': False, 'sage_project': False, 'lr': 4.9968219738516005e-05, 'weight_decay': 2.7856168982717724e-06, 'epochs': 110, 'loss': 'mse', 'optimizer': 'adam', 'graph_mode': 'cutoff', 'cutoff': 0.8501806632789561, 'grm_norm': 'gcn', 'self_loops': False, 'use_snp_selection': False}. Best is trial 90 with value: 0.37863403836464726.
[I 2025-12-08 23:54:57,943] Trial 117 finished with value: 0.3431006243189549 and parameters: {'model_type': 'graphsage', 'hidden_dims': '[512, 128]', 'dropout': 0.44827765505129086, 'batch_norm': False, 'sage_aggr': 'mean', 'sage_normalize': True, 'sage_project': False, 'lr': 3.9431298833196424e-05, 'weight_decay': 3.0994009181312195e-06, 'epochs': 98, 'loss': 'mse', 'optimizer': 'adam', 'graph_mode': 'cutoff', 'cutoff': 0.8337773019545355, 'grm_norm': 'gcn', 'self_loops': False, 'use_snp_selection': False}. Best is trial 90 with value: 0.37863403836464726.
[I 2025-12-08 23:55:53,198] Trial 118 finished with value: 0.34700795390979644 and parameters: {'model_type': 'graphsage', 'hidden_dims': '[512, 128]', 'dropout': 0.42988972003459835, 'batch_norm': True, 'sage_aggr': 'mean', 'sage_normalize': False, 'sage_project': False, 'lr': 2.823347946534715e-05, 'weight_decay': 1.59477539862176e-06, 'epochs': 111, 'loss': 'mse', 'optimizer': 'adam', 'graph_mode': 'cutoff', 'cutoff': 0.8241530011093801, 'grm_norm': 'gcn', 'self_loops': False, 'use_snp_selection': False}. Best is trial 90 with value: 0.37863403836464726.
[I 2025-12-08 23:56:39,334] Trial 119 finished with value: 0.3678729187155878 and parameters: {'model_type': 'graphsage', 'hidden_dims': '[512, 128]', 'dropout': 0.5136880351497886, 'batch_norm': False, 'sage_aggr': 'mean', 'sage_normalize': False, 'sage_project': False, 'lr': 2.2072259394035865e-05, 'weight_decay': 2.5227484607753774e-06, 'epochs': 89, 'loss': 'mse', 'optimizer': 'adam', 'graph_mode': 'cutoff', 'cutoff': 0.8481468993247118, 'grm_norm': 'gcn', 'self_loops': False, 'use_snp_selection': False}. Best is trial 90 with value: 0.37863403836464726.
[I 2025-12-08 23:57:48,362] Trial 120 finished with value: 0.313277716150828 and parameters: {'model_type': 'graphsage', 'hidden_dims': '[512, 128]', 'dropout': 0.5160449392143501, 'batch_norm': False, 'sage_aggr': 'mean', 'sage_normalize': False, 'sage_project': False, 'lr': 4.984846897066118e-05, 'weight_decay': 2.5739046281284465e-06, 'epochs': 88, 'loss': 'mse', 'optimizer': 'adam', 'graph_mode': 'knn', 'knn_k': 6, 'weighted_edges': False, 'symmetrize_mode': 'union', 'self_loops': False, 'use_snp_selection': False}. Best is trial 90 with value: 0.37863403836464726.
[I 2025-12-08 23:58:26,396] Trial 121 finished with value: 0.3550685242212526 and parameters: {'model_type': 'graphsage', 'hidden_dims': '[512, 128]', 'dropout': 0.44551677945179197, 'batch_norm': False, 'sage_aggr': 'mean', 'sage_normalize': False, 'sage_project': False, 'lr': 2.3534223478342587e-05, 'weight_decay': 6.095300455743099e-06, 'epochs': 68, 'loss': 'mse', 'optimizer': 'adam', 'graph_mode': 'cutoff', 'cutoff': 0.8685165111955995, 'grm_norm': 'gcn', 'self_loops': False, 'use_snp_selection': False}. Best is trial 90 with value: 0.37863403836464726.
[I 2025-12-08 23:59:16,400] Trial 122 finished with value: 0.3648740268869107 and parameters: {'model_type': 'graphsage', 'hidden_dims': '[512, 128]', 'dropout': 0.4013659902185211, 'batch_norm': False, 'sage_aggr': 'mean', 'sage_normalize': False, 'sage_project': False, 'lr': 2.064431571493881e-05, 'weight_decay': 1.6486923003887375e-06, 'epochs': 99, 'loss': 'mse', 'optimizer': 'adam', 'graph_mode': 'cutoff', 'cutoff': 0.8456525668790466, 'grm_norm': 'gcn', 'self_loops': False, 'use_snp_selection': False}. Best is trial 90 with value: 0.37863403836464726.
[I 2025-12-08 23:59:49,461] Trial 123 finished with value: 0.30671232214976696 and parameters: {'model_type': 'graphsage', 'hidden_dims': '[512, 128]', 'dropout': 0.4900987239343339, 'batch_norm': False, 'sage_aggr': 'mean', 'sage_normalize': False, 'sage_project': False, 'lr': 3.3383439337350126e-05, 'weight_decay': 2.67843708298582e-06, 'epochs': 55, 'loss': 'mse', 'optimizer': 'adam', 'graph_mode': 'cutoff', 'cutoff': 0.8213073590988723, 'grm_norm': 'gcn', 'self_loops': False, 'use_snp_selection': False}. Best is trial 90 with value: 0.37863403836464726.
[I 2025-12-09 00:00:42,552] Trial 124 finished with value: 0.3621959422668272 and parameters: {'model_type': 'graphsage', 'hidden_dims': '[512, 128]', 'dropout': 0.505598575222589, 'batch_norm': False, 'sage_aggr': 'mean', 'sage_normalize': False, 'sage_project': False, 'lr': 2.4728942862048156e-05, 'weight_decay': 3.603045291851136e-06, 'epochs': 107, 'loss': 'mse', 'optimizer': 'adam', 'graph_mode': 'cutoff', 'cutoff': 0.8477591113603995, 'grm_norm': 'gcn', 'self_loops': False, 'use_snp_selection': False}. Best is trial 90 with value: 0.37863403836464726.
[I 2025-12-09 00:01:29,844] Trial 125 finished with value: 0.3676847707620765 and parameters: {'model_type': 'graphsage', 'hidden_dims': '[512, 128]', 'dropout': 0.412496333660608, 'batch_norm': False, 'sage_aggr': 'mean', 'sage_normalize': False, 'sage_project': False, 'lr': 1.972314673420143e-05, 'weight_decay': 7.828382845764482e-06, 'epochs': 92, 'loss': 'mse', 'optimizer': 'adam', 'graph_mode': 'cutoff', 'cutoff': 0.8616351575318076, 'grm_norm': 'gcn', 'self_loops': False, 'use_snp_selection': False}. Best is trial 90 with value: 0.37863403836464726.
[I 2025-12-09 00:02:17,146] Trial 126 finished with value: 0.3580446070489812 and parameters: {'model_type': 'graphsage', 'hidden_dims': '[512, 128]', 'dropout': 0.40494607153313855, 'batch_norm': False, 'sage_aggr': 'mean', 'sage_normalize': False, 'sage_project': False, 'lr': 2.715723277409889e-05, 'weight_decay': 7.0223989151492255e-06, 'epochs': 92, 'loss': 'mse', 'optimizer': 'adam', 'graph_mode': 'cutoff', 'cutoff': 0.8782505361305815, 'grm_norm': 'gcn', 'self_loops': False, 'use_snp_selection': False}. Best is trial 90 with value: 0.37863403836464726.
[I 2025-12-09 00:02:57,892] Trial 127 finished with value: 0.36831369851844176 and parameters: {'model_type': 'graphsage', 'hidden_dims': '[512, 128]', 'dropout': 0.5483473193320392, 'batch_norm': False, 'sage_aggr': 'mean', 'sage_normalize': False, 'sage_project': False, 'lr': 2.0996337936347146e-05, 'weight_decay': 4.515059716675228e-06, 'epochs': 75, 'loss': 'mse', 'optimizer': 'adam', 'graph_mode': 'cutoff', 'cutoff': 0.8607030391731462, 'grm_norm': 'gcn', 'self_loops': False, 'use_snp_selection': False}. Best is trial 90 with value: 0.37863403836464726.
[I 2025-12-09 00:04:06,034] Trial 128 finished with value: 0.3210936500247132 and parameters: {'model_type': 'graphsage', 'hidden_dims': '[512, 128]', 'dropout': 0.5906323580607256, 'batch_norm': False, 'sage_aggr': 'mean', 'sage_normalize': False, 'sage_project': False, 'lr': 3.931217468346628e-05, 'weight_decay': 4.828384605827176e-06, 'epochs': 75, 'loss': 'mse', 'optimizer': 'adam', 'graph_mode': 'cutoff', 'cutoff': 0.20154609179645755, 'grm_norm': 'gcn', 'self_loops': False, 'use_snp_selection': False}. Best is trial 90 with value: 0.37863403836464726.
[I 2025-12-09 00:04:48,734] Trial 129 finished with value: 0.3574929606650613 and parameters: {'model_type': 'graphsage', 'hidden_dims': '[512, 128]', 'dropout': 0.5555163164752005, 'batch_norm': False, 'sage_aggr': 'mean', 'sage_normalize': False, 'sage_project': False, 'lr': 2.2764389129043242e-05, 'weight_decay': 4.275661952003691e-06, 'epochs': 80, 'loss': 'mse', 'optimizer': 'adam', 'graph_mode': 'cutoff', 'cutoff': 0.8101260049564737, 'grm_norm': 'gcn', 'self_loops': False, 'use_snp_selection': False}. Best is trial 90 with value: 0.37863403836464726.
[I 2025-12-09 00:05:26,423] Trial 130 finished with value: 0.35478829438914944 and parameters: {'model_type': 'graphsage', 'hidden_dims': '[512, 128]', 'dropout': 0.5482841901645954, 'batch_norm': False, 'sage_aggr': 'mean', 'sage_normalize': False, 'sage_project': False, 'lr': 3.3269095220868967e-05, 'weight_decay': 0.00032849735876657306, 'epochs': 67, 'loss': 'mse', 'optimizer': 'adam', 'graph_mode': 'cutoff', 'cutoff': 0.7933032130218256, 'grm_norm': 'gcn', 'self_loops': False, 'use_snp_selection': False}. Best is trial 90 with value: 0.37863403836464726.
[I 2025-12-09 00:06:11,375] Trial 131 finished with value: 0.3732909537883679 and parameters: {'model_type': 'graphsage', 'hidden_dims': '[512, 128]', 'dropout': 0.4569886494380296, 'batch_norm': False, 'sage_aggr': 'mean', 'sage_normalize': False, 'sage_project': False, 'lr': 2.155276211719744e-05, 'weight_decay': 6.465865618877051e-06, 'epochs': 86, 'loss': 'mse', 'optimizer': 'adam', 'graph_mode': 'cutoff', 'cutoff': 0.8596470807759292, 'grm_norm': 'gcn', 'self_loops': False, 'use_snp_selection': False}. Best is trial 90 with value: 0.37863403836464726.
[I 2025-12-09 00:06:55,596] Trial 132 finished with value: 0.03548244923741113 and parameters: {'model_type': 'graphsage', 'hidden_dims': '[512, 128]', 'dropout': 0.45971319946855943, 'batch_norm': False, 'sage_aggr': 'mean', 'sage_normalize': False, 'sage_project': False, 'lr': 0.0003167098639833797, 'weight_decay': 6.041152704867748e-06, 'epochs': 84, 'loss': 'mse', 'optimizer': 'adam', 'graph_mode': 'cutoff', 'cutoff': 0.8577194968235506, 'grm_norm': 'gcn', 'self_loops': False, 'use_snp_selection': False}. Best is trial 90 with value: 0.37863403836464726.
[I 2025-12-09 00:07:45,971] Trial 133 finished with value: 0.37100072762391195 and parameters: {'model_type': 'graphsage', 'hidden_dims': '[512, 128]', 'dropout': 0.43890906343122144, 'batch_norm': False, 'sage_aggr': 'mean', 'sage_normalize': False, 'sage_project': False, 'lr': 2.014797760527528e-05, 'weight_decay': 3.461285960316928e-06, 'epochs': 100, 'loss': 'mse', 'optimizer': 'adam', 'graph_mode': 'cutoff', 'cutoff': 0.8282507600315955, 'grm_norm': 'gcn', 'self_loops': False, 'use_snp_selection': False}. Best is trial 90 with value: 0.37863403836464726.
[I 2025-12-09 00:08:35,973] Trial 134 finished with value: 0.3634195820291174 and parameters: {'model_type': 'graphsage', 'hidden_dims': '[512, 128]', 'dropout': 0.43652285240809163, 'batch_norm': False, 'sage_aggr': 'mean', 'sage_normalize': False, 'sage_project': False, 'lr': 2.051713009966154e-05, 'weight_decay': 3.222830271342202e-06, 'epochs': 99, 'loss': 'mse', 'optimizer': 'adam', 'graph_mode': 'cutoff', 'cutoff': 0.827555578707142, 'grm_norm': 'gcn', 'self_loops': False, 'use_snp_selection': False}. Best is trial 90 with value: 0.37863403836464726.
[I 2025-12-09 00:09:16,703] Trial 135 finished with value: 0.3591919155230109 and parameters: {'model_type': 'graphsage', 'hidden_dims': '[512, 128]', 'dropout': 0.446434109425335, 'batch_norm': False, 'sage_aggr': 'mean', 'sage_normalize': False, 'sage_project': False, 'lr': 2.813321408085244e-05, 'weight_decay': 2.6869550639730177e-06, 'epochs': 75, 'loss': 'mse', 'optimizer': 'adam', 'graph_mode': 'cutoff', 'cutoff': 0.8829431922058948, 'grm_norm': 'gcn', 'self_loops': False, 'use_snp_selection': False}. Best is trial 90 with value: 0.37863403836464726.
[I 2025-12-09 00:09:51,282] Trial 136 finished with value: 0.34570369988304656 and parameters: {'model_type': 'graphsage', 'hidden_dims': '[512, 128]', 'dropout': 0.42485413298673486, 'batch_norm': False, 'sage_aggr': 'mean', 'sage_normalize': False, 'sage_project': False, 'lr': 2.307519906027225e-05, 'weight_decay': 4.018979952447198e-06, 'epochs': 59, 'loss': 'mse', 'optimizer': 'adam', 'graph_mode': 'cutoff', 'cutoff': 0.8712181200850342, 'grm_norm': 'gcn', 'self_loops': False, 'use_snp_selection': False}. Best is trial 90 with value: 0.37863403836464726.
[I 2025-12-09 00:10:20,856] Trial 137 finished with value: 0.31209910849227135 and parameters: {'model_type': 'graphsage', 'hidden_dims': '[512, 128]', 'dropout': 0.4609849793130732, 'batch_norm': False, 'sage_aggr': 'mean', 'sage_normalize': False, 'sage_project': False, 'lr': 1.8749633337811865e-05, 'weight_decay': 5.4526836764592324e-06, 'epochs': 46, 'loss': 'mse', 'optimizer': 'adam', 'graph_mode': 'cutoff', 'cutoff': 0.8393716485583973, 'grm_norm': 'none', 'self_loops': False, 'use_snp_selection': False}. Best is trial 90 with value: 0.37863403836464726.
[I 2025-12-09 00:11:13,734] Trial 138 finished with value: 0.33707232163495926 and parameters: {'model_type': 'graphsage', 'hidden_dims': '[512, 128]', 'dropout': 0.4376688524448282, 'batch_norm': False, 'sage_aggr': 'mean', 'sage_normalize': True, 'sage_project': False, 'lr': 5.017581674975403e-05, 'weight_decay': 4.634421305369604e-05, 'epochs': 105, 'loss': 'mse', 'optimizer': 'adam', 'graph_mode': 'cutoff', 'cutoff': 0.8514734119526822, 'grm_norm': 'gcn', 'self_loops': False, 'use_snp_selection': False}. Best is trial 90 with value: 0.37863403836464726.
[I 2025-12-09 00:11:59,173] Trial 139 finished with value: 0.33605053980793087 and parameters: {'model_type': 'graphsage', 'hidden_dims': '[512, 128]', 'dropout': 0.5419357588870084, 'batch_norm': True, 'sage_aggr': 'mean', 'sage_normalize': False, 'sage_project': False, 'lr': 2.4216848132055465e-05, 'weight_decay': 7.649568823404924e-05, 'epochs': 86, 'loss': 'mse', 'optimizer': 'adam', 'graph_mode': 'cutoff', 'cutoff': 0.7618249302202272, 'grm_norm': 'gcn', 'self_loops': False, 'use_snp_selection': False}. Best is trial 90 with value: 0.37863403836464726.
[I 2025-12-09 00:12:47,624] Trial 140 finished with value: 0.3653315770330827 and parameters: {'model_type': 'graphsage', 'hidden_dims': '[512, 128]', 'dropout': 0.5241228881653238, 'batch_norm': False, 'sage_aggr': 'mean', 'sage_normalize': False, 'sage_project': False, 'lr': 2.926489389640405e-05, 'weight_decay': 6.133752909488292e-05, 'epochs': 95, 'loss': 'mse', 'optimizer': 'adam', 'graph_mode': 'cutoff', 'cutoff': 0.884222546236607, 'grm_norm': 'gcn', 'self_loops': False, 'use_snp_selection': False}. Best is trial 90 with value: 0.37863403836464726.
[I 2025-12-09 00:13:42,406] Trial 141 finished with value: 0.36197791765277165 and parameters: {'model_type': 'graphsage', 'hidden_dims': '[512, 256]', 'dropout': 0.3919149164472929, 'batch_norm': False, 'sage_aggr': 'mean', 'sage_normalize': False, 'sage_project': False, 'lr': 1.4048536048881805e-05, 'weight_decay': 7.87514042711806e-06, 'epochs': 111, 'loss': 'mse', 'optimizer': 'adam', 'graph_mode': 'cutoff', 'cutoff': 0.8163390090256725, 'grm_norm': 'gcn', 'self_loops': False, 'use_snp_selection': False}. Best is trial 90 with value: 0.37863403836464726.
[I 2025-12-09 00:14:40,136] Trial 142 finished with value: 0.36094236007267483 and parameters: {'model_type': 'graphsage', 'hidden_dims': '[512, 128]', 'dropout': 0.45294341150825734, 'batch_norm': False, 'sage_aggr': 'mean', 'sage_normalize': False, 'sage_project': False, 'lr': 1.6905187889888288e-05, 'weight_decay': 6.444079531894703e-06, 'epochs': 119, 'loss': 'mse', 'optimizer': 'adam', 'graph_mode': 'cutoff', 'cutoff': 0.7805772232170137, 'grm_norm': 'gcn', 'self_loops': False, 'use_snp_selection': False}. Best is trial 90 with value: 0.37863403836464726.
[I 2025-12-09 00:15:19,777] Trial 143 finished with value: 0.3614672354345753 and parameters: {'model_type': 'graphsage', 'hidden_dims': '[512, 128]', 'dropout': 0.41862452052802024, 'batch_norm': False, 'sage_aggr': 'mean', 'sage_normalize': False, 'sage_project': False, 'lr': 1.1660520289026162e-05, 'weight_decay': 3.512141006779794e-05, 'epochs': 72, 'loss': 'mse', 'optimizer': 'adam', 'graph_mode': 'cutoff', 'cutoff': 0.796884482067525, 'grm_norm': 'gcn', 'self_loops': False, 'use_snp_selection': False}. Best is trial 90 with value: 0.37863403836464726.
[I 2025-12-09 00:15:42,359] Trial 144 finished with value: 0.36441141091798457 and parameters: {'model_type': 'graphsage', 'hidden_dims': '[128, 64]', 'dropout': 0.37728544689437266, 'batch_norm': False, 'sage_aggr': 'mean', 'sage_normalize': False, 'sage_project': False, 'lr': 2.0991540742805855e-05, 'weight_decay': 4.722619427821655e-06, 'epochs': 103, 'loss': 'mse', 'optimizer': 'adam', 'graph_mode': 'cutoff', 'cutoff': 0.8272231268541279, 'grm_norm': 'gcn', 'self_loops': False, 'use_snp_selection': False}. Best is trial 90 with value: 0.37863403836464726.
[I 2025-12-09 00:16:30,424] Trial 145 finished with value: 0.3824741529048902 and parameters: {'model_type': 'graphsage', 'hidden_dims': '[512, 128]', 'dropout': 0.3645734643118367, 'batch_norm': False, 'sage_aggr': 'mean', 'sage_normalize': False, 'sage_project': False, 'lr': 1.5577418132406002e-05, 'weight_decay': 8.715828489321639e-06, 'epochs': 91, 'loss': 'mse', 'optimizer': 'adam', 'graph_mode': 'cutoff', 'cutoff': 0.8650908578747942, 'grm_norm': 'cosine_then_gcn', 'self_loops': False, 'use_snp_selection': False}. Best is trial 145 with value: 0.3824741529048902.
[I 2025-12-09 00:17:14,621] Trial 146 finished with value: 0.3676054188545657 and parameters: {'model_type': 'graphsage', 'hidden_dims': '[512, 128]', 'dropout': 0.36375454006001984, 'batch_norm': False, 'sage_aggr': 'mean', 'sage_normalize': False, 'sage_project': False, 'lr': 1.5835826064925397e-05, 'weight_decay': 1.4349592949098603e-05, 'epochs': 81, 'loss': 'mse', 'optimizer': 'adam', 'graph_mode': 'cutoff', 'cutoff': 0.8636885453543033, 'grm_norm': 'cosine_then_gcn', 'self_loops': False, 'use_snp_selection': False}. Best is trial 145 with value: 0.3824741529048902.
[I 2025-12-09 00:18:06,825] Trial 147 finished with value: 0.3446071223028143 and parameters: {'model_type': 'graphsage', 'hidden_dims': '[512, 128]', 'dropout': 0.5709876511486245, 'batch_norm': False, 'sage_aggr': 'mean', 'sage_normalize': False, 'sage_project': False, 'lr': 1.936405847177515e-05, 'weight_decay': 1.9671206396280155e-05, 'epochs': 90, 'loss': 'mse', 'optimizer': 'adam', 'graph_mode': 'knn', 'knn_k': 4, 'weighted_edges': True, 'symmetrize_mode': 'mutual', 'self_loops': False, 'use_snp_selection': False}. Best is trial 145 with value: 0.3824741529048902.
[I 2025-12-09 00:18:57,583] Trial 148 finished with value: 0.3707425171883828 and parameters: {'model_type': 'graphsage', 'hidden_dims': '[512, 128]', 'dropout': 0.346117664289133, 'batch_norm': False, 'sage_aggr': 'mean', 'sage_normalize': False, 'sage_project': False, 'lr': 2.5685581711139672e-05, 'weight_decay': 9.559582224877346e-06, 'epochs': 98, 'loss': 'mse', 'optimizer': 'adam', 'graph_mode': 'cutoff', 'cutoff': 0.8993882783681897, 'grm_norm': 'cosine_then_gcn', 'self_loops': False, 'use_snp_selection': False}. Best is trial 145 with value: 0.3824741529048902.
