[I 2025-12-09 09:56:11,140] Trial 45 finished with value: 0.27593097134867384 and parameters: {'model_type': 'graphsage', 'hidden_dims': '[512, 64]', 'dropout': 0.12448046485316769, 'batch_norm': True, 'sage_aggr': 'mean', 'sage_normalize': True, 'sage_project': False, 'lr': 3.269751198646723e-05, 'weight_decay': 0.00034685839963065937, 'epochs': 60, 'loss': 'mae', 'optimizer': 'adam', 'graph_mode': 'cutoff', 'cutoff': 0.3706307538963134, 'grm_norm': 'gcn', 'self_loops': False, 'use_snp_selection': True, 'num_snps': 59234}. Best is trial 36 with value: 0.2960321170656044.
[I 2025-12-09 09:57:37,970] Trial 46 finished with value: 0.2920885255581549 and parameters: {'model_type': 'graphsage', 'hidden_dims': '[512, 128]', 'dropout': 0.10110973021311653, 'batch_norm': True, 'sage_aggr': 'mean', 'sage_normalize': True, 'sage_project': False, 'lr': 4.540471152248397e-05, 'weight_decay': 0.000680395512228873, 'epochs': 76, 'loss': 'mae', 'optimizer': 'adam', 'graph_mode': 'cutoff', 'cutoff': 0.478718655522389, 'grm_norm': 'gcn', 'self_loops': False, 'use_snp_selection': True, 'num_snps': 55200}. Best is trial 36 with value: 0.2960321170656044.
[I 2025-12-09 09:59:13,136] Trial 47 finished with value: 0.2827937162738263 and parameters: {'model_type': 'graphsage', 'hidden_dims': '[512, 128]', 'dropout': 0.17493722434315592, 'batch_norm': True, 'sage_aggr': 'mean', 'sage_normalize': True, 'sage_project': False, 'lr': 6.638420472212797e-05, 'weight_decay': 0.0006483644869319087, 'epochs': 125, 'loss': 'mae', 'optimizer': 'adam', 'graph_mode': 'cutoff', 'cutoff': 0.5509248183778244, 'grm_norm': 'gcn', 'self_loops': False, 'use_snp_selection': True, 'num_snps': 54211}. Best is trial 36 with value: 0.2960321170656044.
[I 2025-12-09 10:00:47,047] Trial 48 finished with value: 0.2533472243782494 and parameters: {'model_type': 'graphsage', 'hidden_dims': '[512, 128]', 'dropout': 0.103469462662101, 'batch_norm': True, 'sage_aggr': 'mean', 'sage_normalize': True, 'sage_project': False, 'lr': 0.0001164245452553226, 'weight_decay': 0.000963449663629448, 'epochs': 79, 'loss': 'mae', 'optimizer': 'adam', 'graph_mode': 'knn', 'knn_k': 7, 'weighted_edges': False, 'symmetrize_mode': 'mutual', 'self_loops': False, 'use_snp_selection': True, 'num_snps': 51306}. Best is trial 36 with value: 0.2960321170656044.
[I 2025-12-09 10:01:45,341] Trial 49 finished with value: 0.26584188657112023 and parameters: {'model_type': 'graphsage', 'hidden_dims': '[128, 64]', 'dropout': 0.32550890471707483, 'batch_norm': True, 'sage_aggr': 'mean', 'sage_normalize': True, 'sage_project': False, 'lr': 1.0978421901638472e-05, 'weight_decay': 0.00020834207534748737, 'epochs': 53, 'loss': 'mae', 'optimizer': 'adam', 'graph_mode': 'cutoff', 'cutoff': 0.4681927521828021, 'grm_norm': 'gcn', 'self_loops': False, 'use_snp_selection': True, 'num_snps': 53611}. Best is trial 36 with value: 0.2960321170656044.
[I 2025-12-09 10:03:23,234] Trial 50 finished with value: 0.28207094906389374 and parameters: {'model_type': 'graphsage', 'hidden_dims': '[512, 128]', 'dropout': 0.3676769556885651, 'batch_norm': True, 'sage_aggr': 'mean', 'sage_normalize': True, 'sage_project': False, 'lr': 1.7193574740138087e-05, 'weight_decay': 7.044619150302645e-05, 'epochs': 105, 'loss': 'mae', 'optimizer': 'adam', 'graph_mode': 'cutoff', 'cutoff': 0.5009552466660642, 'grm_norm': 'gcn', 'self_loops': False, 'use_snp_selection': True, 'num_snps': 56383}. Best is trial 36 with value: 0.2960321170656044.
[I 2025-12-09 10:04:55,235] Trial 51 finished with value: 0.2873149174003849 and parameters: {'model_type': 'graphsage', 'hidden_dims': '[512, 128]', 'dropout': 0.1346143555818166, 'batch_norm': True, 'sage_aggr': 'mean', 'sage_normalize': True, 'sage_project': False, 'lr': 4.4221980504705276e-05, 'weight_decay': 0.0003428481544047456, 'epochs': 70, 'loss': 'mae', 'optimizer': 'adam', 'graph_mode': 'cutoff', 'cutoff': 0.38091164238943903, 'grm_norm': 'gcn', 'self_loops': False, 'use_snp_selection': True, 'num_snps': 59780}. Best is trial 36 with value: 0.2960321170656044.
[I 2025-12-09 10:06:36,282] Trial 52 finished with value: 0.28411432728408864 and parameters: {'model_type': 'graphsage', 'hidden_dims': '[512, 128]', 'dropout': 0.1508888758124259, 'batch_norm': True, 'sage_aggr': 'mean', 'sage_normalize': True, 'sage_project': False, 'lr': 3.781325422985116e-05, 'weight_decay': 0.0007099598754080031, 'epochs': 83, 'loss': 'mae', 'optimizer': 'adam', 'graph_mode': 'cutoff', 'cutoff': 0.3370454960472985, 'grm_norm': 'gcn', 'self_loops': False, 'use_snp_selection': True, 'num_snps': 56795}. Best is trial 36 with value: 0.2960321170656044.
[I 2025-12-09 10:07:41,146] Trial 53 finished with value: 0.2859098607802282 and parameters: {'model_type': 'graphsage', 'hidden_dims': '[512, 128]', 'dropout': 0.12348771013213654, 'batch_norm': True, 'sage_aggr': 'mean', 'sage_normalize': True, 'sage_project': False, 'lr': 6.763329885703032e-05, 'weight_decay': 0.00020377869003744312, 'epochs': 61, 'loss': 'mae', 'optimizer': 'adam', 'graph_mode': 'cutoff', 'cutoff': 0.5473906843175469, 'grm_norm': 'gcn', 'self_loops': False, 'use_snp_selection': True, 'num_snps': 48794}. Best is trial 36 with value: 0.2960321170656044.
[I 2025-12-09 10:09:11,129] Trial 54 finished with value: 0.2748723537428435 and parameters: {'model_type': 'graphsage', 'hidden_dims': '[256, 128]', 'dropout': 0.101694845350642, 'batch_norm': True, 'sage_aggr': 'mean', 'sage_normalize': True, 'sage_project': False, 'lr': 2.3661994559827123e-05, 'weight_decay': 0.00011459385467196141, 'epochs': 119, 'loss': 'mae', 'optimizer': 'adam', 'graph_mode': 'cutoff', 'cutoff': 0.3979076094021427, 'grm_norm': 'gcn', 'self_loops': False, 'use_snp_selection': True, 'num_snps': 54275}. Best is trial 36 with value: 0.2960321170656044.
[I 2025-12-09 10:10:48,333] Trial 55 finished with value: 0.2882352201466023 and parameters: {'model_type': 'graphsage', 'hidden_dims': '[512, 128]', 'dropout': 0.19310516169491132, 'batch_norm': True, 'sage_aggr': 'mean', 'sage_normalize': True, 'sage_project': False, 'lr': 4.526813424979605e-05, 'weight_decay': 0.0002969754829091997, 'epochs': 83, 'loss': 'mae', 'optimizer': 'adam', 'graph_mode': 'cutoff', 'cutoff': 0.472701428328891, 'grm_norm': 'gcn', 'self_loops': False, 'use_snp_selection': True, 'num_snps': 59886}. Best is trial 36 with value: 0.2960321170656044.
[I 2025-12-09 10:11:50,622] Trial 56 finished with value: 0.28967043901711725 and parameters: {'model_type': 'graphsage', 'hidden_dims': '[512, 128]', 'dropout': 0.17235251049178837, 'batch_norm': True, 'sage_aggr': 'mean', 'sage_normalize': True, 'sage_project': False, 'lr': 0.00012532290758235836, 'weight_decay': 5.199181720137629e-05, 'epochs': 142, 'loss': 'mae', 'optimizer': 'adam', 'graph_mode': 'cutoff', 'cutoff': 0.4476963190381579, 'grm_norm': 'cosine', 'self_loops': False, 'use_snp_selection': True, 'num_snps': 24467}. Best is trial 36 with value: 0.2960321170656044.
[I 2025-12-09 10:13:38,043] Trial 57 finished with value: 0.2787141779325761 and parameters: {'model_type': 'graphsage', 'hidden_dims': '[512, 64]', 'dropout': 0.22195064687091057, 'batch_norm': True, 'sage_aggr': 'mean', 'sage_normalize': True, 'sage_project': False, 'lr': 1.3495495423972895e-05, 'weight_decay': 0.0005849015243015214, 'epochs': 104, 'loss': 'mae', 'optimizer': 'adam', 'graph_mode': 'cutoff', 'cutoff': 0.34519395897195254, 'grm_norm': 'gcn', 'self_loops': False, 'use_snp_selection': True, 'num_snps': 54124}. Best is trial 36 with value: 0.2960321170656044.
[I 2025-12-09 10:15:50,586] Trial 58 finished with value: 0.2826366783612755 and parameters: {'model_type': 'graphsage', 'hidden_dims': '[512, 128]', 'dropout': 0.5726525376157654, 'batch_norm': True, 'sage_aggr': 'mean', 'sage_normalize': True, 'sage_project': False, 'lr': 2.642517666207831e-05, 'weight_decay': 1.03455192952892e-07, 'epochs': 170, 'loss': 'mae', 'optimizer': 'adam', 'graph_mode': 'cutoff', 'cutoff': 0.4065090899161768, 'grm_norm': 'gcn', 'self_loops': False, 'use_snp_selection': True, 'num_snps': 51258}. Best is trial 36 with value: 0.2960321170656044.
[I 2025-12-09 10:16:41,688] Trial 59 finished with value: 0.28701695264661264 and parameters: {'model_type': 'graphsage', 'hidden_dims': '[512, 128]', 'dropout': 0.15476856952001908, 'batch_norm': True, 'sage_aggr': 'mean', 'sage_normalize': True, 'sage_project': False, 'lr': 5.970310551053504e-05, 'weight_decay': 0.0009987534674976775, 'epochs': 51, 'loss': 'mae', 'optimizer': 'adam', 'graph_mode': 'cutoff', 'cutoff': 0.49331029343143057, 'grm_norm': 'gcn', 'self_loops': False, 'use_snp_selection': True, 'num_snps': 33737}. Best is trial 36 with value: 0.2960321170656044.
[I 2025-12-09 10:17:52,212] Trial 60 finished with value: 0.27940529639010225 and parameters: {'model_type': 'graphsage', 'hidden_dims': '[256, 128]', 'dropout': 0.18272773463244418, 'batch_norm': True, 'sage_aggr': 'mean', 'sage_normalize': True, 'sage_project': False, 'lr': 3.9835575106668736e-05, 'weight_decay': 2.660274386296502e-05, 'epochs': 84, 'loss': 'mae', 'optimizer': 'adam', 'graph_mode': 'cutoff', 'cutoff': 0.36148700230166886, 'grm_norm': 'cosine', 'self_loops': False, 'use_snp_selection': True, 'num_snps': 47383}. Best is trial 36 with value: 0.2960321170656044.
[I 2025-12-09 10:18:53,121] Trial 61 finished with value: 0.289098635000871 and parameters: {'model_type': 'graphsage', 'hidden_dims': '[512, 128]', 'dropout': 0.13287799478067905, 'batch_norm': True, 'sage_aggr': 'mean', 'sage_normalize': True, 'sage_project': False, 'lr': 9.970257831551378e-05, 'weight_decay': 6.59865126609232e-05, 'epochs': 142, 'loss': 'mae', 'optimizer': 'adam', 'graph_mode': 'cutoff', 'cutoff': 0.44235174717317355, 'grm_norm': 'cosine', 'self_loops': False, 'use_snp_selection': True, 'num_snps': 23321}. Best is trial 36 with value: 0.2960321170656044.
[I 2025-12-09 10:19:38,612] Trial 62 finished with value: 0.28657461711682153 and parameters: {'model_type': 'graphsage', 'hidden_dims': '[512, 128]', 'dropout': 0.17398083075455617, 'batch_norm': True, 'sage_aggr': 'mean', 'sage_normalize': True, 'sage_project': False, 'lr': 7.209447479901712e-05, 'weight_decay': 3.858612439137209e-05, 'epochs': 68, 'loss': 'mae', 'optimizer': 'adam', 'graph_mode': 'cutoff', 'cutoff': 0.5381587142936832, 'grm_norm': 'cosine', 'self_loops': False, 'use_snp_selection': True, 'num_snps': 23667}. Best is trial 36 with value: 0.2960321170656044.
[I 2025-12-09 10:20:22,261] Trial 63 finished with value: 0.29355917244183494 and parameters: {'model_type': 'graphsage', 'hidden_dims': '[512, 128]', 'dropout': 0.2055746466282152, 'batch_norm': True, 'sage_aggr': 'mean', 'sage_normalize': True, 'sage_project': False, 'lr': 0.00011975874222744044, 'weight_decay': 9.727790950307762e-05, 'epochs': 107, 'loss': 'mae', 'optimizer': 'adam', 'graph_mode': 'cutoff', 'cutoff': 0.45755143909568796, 'grm_norm': 'cosine', 'self_loops': False, 'use_snp_selection': True, 'num_snps': 15022}. Best is trial 36 with value: 0.2960321170656044.
[I 2025-12-09 10:20:56,356] Trial 64 finished with value: 0.274298916466015 and parameters: {'model_type': 'graphsage', 'hidden_dims': '[512, 128]', 'dropout': 0.2407357101528328, 'batch_norm': True, 'sage_aggr': 'mean', 'sage_normalize': True, 'sage_project': False, 'lr': 5.1892823580272425e-05, 'weight_decay': 0.0003964248537293943, 'epochs': 104, 'loss': 'mae', 'optimizer': 'adam', 'graph_mode': 'cutoff', 'cutoff': 0.47805939762935756, 'grm_norm': 'cosine', 'self_loops': False, 'use_snp_selection': True, 'num_snps': 6694}. Best is trial 36 with value: 0.2960321170656044.
[I 2025-12-09 10:21:36,958] Trial 65 finished with value: 0.2640688762609399 and parameters: {'model_type': 'graphsage', 'hidden_dims': '[128, 64]', 'dropout': 0.27936399199216966, 'batch_norm': True, 'sage_aggr': 'mean', 'sage_normalize': True, 'sage_project': False, 'lr': 0.00022534316390300906, 'weight_decay': 0.00010724039090923908, 'epochs': 122, 'loss': 'mae', 'optimizer': 'adam', 'graph_mode': 'cutoff', 'cutoff': 0.3996433940349586, 'grm_norm': 'cosine_then_gcn', 'self_loops': False, 'use_snp_selection': True, 'num_snps': 19435}. Best is trial 36 with value: 0.2960321170656044.
[I 2025-12-09 10:23:14,569] Trial 66 finished with value: 0.29172611107498525 and parameters: {'model_type': 'graphsage', 'hidden_dims': '[512, 128]', 'dropout': 0.21249947866170205, 'batch_norm': True, 'sage_aggr': 'mean', 'sage_normalize': True, 'sage_project': False, 'lr': 0.00013497045284123434, 'weight_decay': 0.00027474367207772543, 'epochs': 113, 'loss': 'mae', 'optimizer': 'adam', 'graph_mode': 'cutoff', 'cutoff': 0.513928308472034, 'grm_norm': 'gcn', 'self_loops': False, 'use_snp_selection': True, 'num_snps': 56303}. Best is trial 36 with value: 0.2960321170656044.
[I 2025-12-09 10:23:54,724] Trial 67 finished with value: 0.2887465065418492 and parameters: {'model_type': 'graphsage', 'hidden_dims': '[512, 128]', 'dropout': 0.21758598455269562, 'batch_norm': True, 'sage_aggr': 'mean', 'sage_normalize': True, 'sage_project': False, 'lr': 0.00014305004475799224, 'weight_decay': 0.00015711698863882966, 'epochs': 115, 'loss': 'mae', 'optimizer': 'adam', 'graph_mode': 'cutoff', 'cutoff': 0.592916995825424, 'grm_norm': 'gcn', 'self_loops': False, 'use_snp_selection': True, 'num_snps': 13196}. Best is trial 36 with value: 0.2960321170656044.
[I 2025-12-09 10:24:57,517] Trial 68 finished with value: 0.2646141159693679 and parameters: {'model_type': 'graphsage', 'hidden_dims': '[512, 256]', 'dropout': 0.20632035058251974, 'batch_norm': True, 'sage_aggr': 'mean', 'sage_normalize': True, 'sage_project': False, 'lr': 0.0001978982984681528, 'weight_decay': 0.0002347781083529283, 'epochs': 131, 'loss': 'mae', 'optimizer': 'adam', 'graph_mode': 'knn', 'knn_k': 1, 'weighted_edges': True, 'symmetrize_mode': 'union', 'self_loops': False, 'use_snp_selection': True, 'num_snps': 28424}. Best is trial 36 with value: 0.2960321170656044.
[I 2025-12-09 10:26:25,536] Trial 69 finished with value: 0.28713072651400934 and parameters: {'model_type': 'graphsage', 'hidden_dims': '[512, 128]', 'dropout': 0.2699276341978181, 'batch_norm': True, 'sage_aggr': 'mean', 'sage_normalize': True, 'sage_project': False, 'lr': 0.00012516163985328387, 'weight_decay': 0.00026944156392866693, 'epochs': 154, 'loss': 'mae', 'optimizer': 'adam', 'graph_mode': 'cutoff', 'cutoff': 0.5155704466030162, 'grm_norm': 'cosine', 'self_loops': False, 'use_snp_selection': True, 'num_snps': 39754}. Best is trial 36 with value: 0.2960321170656044.
[I 2025-12-09 10:27:55,010] Trial 70 finished with value: 0.27872712267705413 and parameters: {'model_type': 'graphsage', 'hidden_dims': '[512, 64]', 'dropout': 0.24388746149662416, 'batch_norm': True, 'sage_aggr': 'mean', 'sage_normalize': True, 'sage_project': False, 'lr': 0.00010194605853372414, 'weight_decay': 0.00013546915547894026, 'epochs': 105, 'loss': 'mae', 'optimizer': 'adam', 'graph_mode': 'cutoff', 'cutoff': 0.5726337243627377, 'grm_norm': 'gcn', 'self_loops': False, 'use_snp_selection': True, 'num_snps': 56962}. Best is trial 36 with value: 0.2960321170656044.
[I 2025-12-09 10:29:23,325] Trial 71 finished with value: 0.2894035460416165 and parameters: {'model_type': 'graphsage', 'hidden_dims': '[512, 128]', 'dropout': 0.19793697628766782, 'batch_norm': True, 'sage_aggr': 'mean', 'sage_normalize': True, 'sage_project': False, 'lr': 0.00046072016249476663, 'weight_decay': 0.00017294770374373688, 'epochs': 89, 'loss': 'mae', 'optimizer': 'adam', 'graph_mode': 'cutoff', 'cutoff': 0.45607055046807304, 'grm_norm': 'gcn', 'self_loops': False, 'use_snp_selection': True, 'num_snps': 51550}. Best is trial 36 with value: 0.2960321170656044.
[I 2025-12-09 10:30:51,228] Trial 72 finished with value: 0.2928952423934401 and parameters: {'model_type': 'graphsage', 'hidden_dims': '[512, 128]', 'dropout': 0.2277679482390502, 'batch_norm': True, 'sage_aggr': 'mean', 'sage_normalize': True, 'sage_project': False, 'lr': 2.9076362596742898e-05, 'weight_decay': 0.0005573630320790892, 'epochs': 75, 'loss': 'mae', 'optimizer': 'adam', 'graph_mode': 'cutoff', 'cutoff': 0.4786995202808041, 'grm_norm': 'gcn', 'self_loops': False, 'use_snp_selection': True, 'num_snps': 57733}. Best is trial 36 with value: 0.2960321170656044.
[I 2025-12-09 10:32:32,717] Trial 73 finished with value: 0.2862631920634546 and parameters: {'model_type': 'graphsage', 'hidden_dims': '[512, 128]', 'dropout': 0.29413611205987267, 'batch_norm': True, 'sage_aggr': 'mean', 'sage_normalize': True, 'sage_project': False, 'lr': 1.9498132642023482e-05, 'weight_decay': 0.0005306705726978557, 'epochs': 111, 'loss': 'mae', 'optimizer': 'adam', 'graph_mode': 'cutoff', 'cutoff': 0.5138028038682831, 'grm_norm': 'gcn', 'self_loops': False, 'use_snp_selection': True, 'num_snps': 57899}. Best is trial 36 with value: 0.2960321170656044.
[I 2025-12-09 10:33:33,975] Trial 74 finished with value: 0.27560514730777214 and parameters: {'model_type': 'graphsage', 'hidden_dims': '[512, 128]', 'dropout': 0.2281456664497795, 'batch_norm': True, 'sage_aggr': 'mean', 'sage_normalize': True, 'sage_project': False, 'lr': 2.7578313370109527e-05, 'weight_decay': 0.0007929803977828017, 'epochs': 75, 'loss': 'mae', 'optimizer': 'adam', 'graph_mode': 'cutoff', 'cutoff': 0.48277579538127763, 'grm_norm': 'cosine_then_gcn', 'self_loops': False, 'use_snp_selection': True, 'num_snps': 35194}. Best is trial 36 with value: 0.2960321170656044.
[I 2025-12-09 10:35:11,740] Trial 75 finished with value: 0.28723300183785894 and parameters: {'model_type': 'graphsage', 'hidden_dims': '[512, 128]', 'dropout': 0.24757172567839095, 'batch_norm': True, 'sage_aggr': 'mean', 'sage_normalize': True, 'sage_project': False, 'lr': 8.068993992120418e-05, 'weight_decay': 8.658111859023007e-05, 'epochs': 101, 'loss': 'mae', 'optimizer': 'adam', 'graph_mode': 'cutoff', 'cutoff': 0.4499345509501345, 'grm_norm': 'gcn', 'self_loops': False, 'use_snp_selection': True, 'num_snps': 53070}. Best is trial 36 with value: 0.2960321170656044.
[I 2025-12-09 10:36:43,877] Trial 76 finished with value: 0.2899446582328185 and parameters: {'model_type': 'graphsage', 'hidden_dims': '[512, 128]', 'dropout': 0.21746496846030366, 'batch_norm': True, 'sage_aggr': 'mean', 'sage_normalize': True, 'sage_project': False, 'lr': 3.0407037363007242e-05, 'weight_decay': 0.0002762905109097835, 'epochs': 85, 'loss': 'mae', 'optimizer': 'adam', 'graph_mode': 'cutoff', 'cutoff': 0.43131665259689167, 'grm_norm': 'none', 'self_loops': False, 'use_snp_selection': True, 'num_snps': 55120}. Best is trial 36 with value: 0.2960321170656044.
[I 2025-12-09 10:37:57,193] Trial 77 finished with value: 0.2978067463653598 and parameters: {'model_type': 'graphsage', 'hidden_dims': '[512, 128]', 'dropout': 0.19890587014821454, 'batch_norm': True, 'sage_aggr': 'mean', 'sage_normalize': True, 'sage_project': False, 'lr': 5.901530432729783e-05, 'weight_decay': 0.0004159985132369157, 'epochs': 58, 'loss': 'mae', 'optimizer': 'adam', 'graph_mode': 'cutoff', 'cutoff': 0.5323252234501563, 'grm_norm': 'gcn', 'self_loops': False, 'use_snp_selection': True, 'num_snps': 57780}. Best is trial 77 with value: 0.2978067463653598.
[I 2025-12-09 10:38:23,729] Trial 78 finished with value: 0.2516624387739198 and parameters: {'model_type': 'graphsage', 'hidden_dims': '[256, 128, 64]', 'dropout': 0.1644850679882299, 'batch_norm': False, 'sage_aggr': 'mean', 'sage_normalize': True, 'sage_project': False, 'lr': 3.527123740614048e-05, 'weight_decay': 0.00043319504777147703, 'epochs': 40, 'loss': 'mae', 'optimizer': 'adam', 'graph_mode': 'cutoff', 'cutoff': 0.5610173734858895, 'grm_norm': 'gcn', 'self_loops': False, 'use_snp_selection': True, 'num_snps': 2521}. Best is trial 77 with value: 0.2978067463653598.
[I 2025-12-09 10:39:37,597] Trial 79 finished with value: 0.2549803187094627 and parameters: {'model_type': 'graphsage', 'hidden_dims': '[256, 128]', 'dropout': 0.2687286063249667, 'batch_norm': True, 'sage_aggr': 'mean', 'sage_normalize': True, 'sage_project': False, 'lr': 5.667205364701969e-05, 'weight_decay': 1.0728095168182568e-06, 'epochs': 61, 'loss': 'mae', 'optimizer': 'adam', 'graph_mode': 'knn', 'knn_k': 8, 'weighted_edges': False, 'symmetrize_mode': 'mutual', 'self_loops': True, 'use_snp_selection': True, 'num_snps': 47306}. Best is trial 77 with value: 0.2978067463653598.
[I 2025-12-09 10:40:26,259] Trial 80 finished with value: 0.2703103593317951 and parameters: {'model_type': 'graphsage', 'hidden_dims': '[128, 64]', 'dropout': 0.234518073520454, 'batch_norm': True, 'sage_aggr': 'mean', 'sage_normalize': True, 'sage_project': False, 'lr': 2.1947071210848648e-05, 'weight_decay': 0.0005268027822007646, 'epochs': 50, 'loss': 'mae', 'optimizer': 'adam', 'graph_mode': 'cutoff', 'cutoff': 0.6106247167230278, 'grm_norm': 'gcn', 'self_loops': False, 'use_snp_selection': True, 'num_snps': 52039}. Best is trial 77 with value: 0.2978067463653598.
[I 2025-12-09 10:41:43,751] Trial 81 finished with value: 0.2865446154962789 and parameters: {'model_type': 'graphsage', 'hidden_dims': '[512, 128]', 'dropout': 0.19919921059209578, 'batch_norm': True, 'sage_aggr': 'mean', 'sage_normalize': True, 'sage_project': False, 'lr': 0.0002804803423614404, 'weight_decay': 0.00019601727349058873, 'epochs': 74, 'loss': 'mae', 'optimizer': 'adam', 'graph_mode': 'cutoff', 'cutoff': 0.5294482033016228, 'grm_norm': 'gcn', 'self_loops': False, 'use_snp_selection': True, 'num_snps': 56027}. Best is trial 77 with value: 0.2978067463653598.
