[I 2025-12-09 10:53:16,271] Trial 71 finished with value: 0.2733906380467589 and parameters: {'model_type': 'graphsage', 'hidden_dims': '[128, 64]', 'dropout': 0.3837954737773839, 'batch_norm': False, 'sage_aggr': 'max', 'sage_normalize': False, 'sage_project': False, 'lr': 9.236495234870258e-05, 'weight_decay': 0.00010379772874877066, 'epochs': 304, 'loss': 'mse', 'optimizer': 'adam', 'graph_mode': 'cutoff', 'cutoff': 0.22310049831830425, 'grm_norm': 'gcn', 'self_loops': True, 'use_snp_selection': True, 'num_snps': 15159}. Best is trial 41 with value: 0.289349286162371.
[I 2025-12-09 10:56:10,390] Trial 72 finished with value: 0.28313521234377415 and parameters: {'model_type': 'graphsage', 'hidden_dims': '[512, 64]', 'dropout': 0.3378327189947148, 'batch_norm': False, 'sage_aggr': 'max', 'sage_normalize': False, 'sage_project': False, 'lr': 5.542027565691001e-05, 'weight_decay': 0.000142158276615613, 'epochs': 285, 'loss': 'mse', 'optimizer': 'adam', 'graph_mode': 'cutoff', 'cutoff': 0.25840239040455276, 'grm_norm': 'gcn', 'self_loops': False, 'use_snp_selection': True, 'num_snps': 20929}. Best is trial 41 with value: 0.289349286162371.
[I 2025-12-09 10:59:29,494] Trial 73 finished with value: 0.2799028148158611 and parameters: {'model_type': 'graphsage', 'hidden_dims': '[512, 64]', 'dropout': 0.3310948362041122, 'batch_norm': False, 'sage_aggr': 'max', 'sage_normalize': False, 'sage_project': False, 'lr': 3.387038558089447e-05, 'weight_decay': 3.864698376892168e-05, 'epochs': 286, 'loss': 'mse', 'optimizer': 'adam', 'graph_mode': 'cutoff', 'cutoff': 0.3499396306972147, 'grm_norm': 'gcn', 'self_loops': False, 'use_snp_selection': True, 'num_snps': 31996}. Best is trial 41 with value: 0.289349286162371.
[I 2025-12-09 11:02:21,372] Trial 74 finished with value: 0.28493103951298127 and parameters: {'model_type': 'graphsage', 'hidden_dims': '[512, 64]', 'dropout': 0.3590596400972457, 'batch_norm': False, 'sage_aggr': 'max', 'sage_normalize': False, 'sage_project': False, 'lr': 6.722316190184588e-05, 'weight_decay': 0.0003920658966369499, 'epochs': 315, 'loss': 'mse', 'optimizer': 'adam', 'graph_mode': 'cutoff', 'cutoff': 0.2542409335159964, 'grm_norm': 'cosine', 'self_loops': False, 'use_snp_selection': True, 'num_snps': 20049}. Best is trial 41 with value: 0.289349286162371.
[I 2025-12-09 11:04:33,680] Trial 75 finished with value: 0.27128100793197024 and parameters: {'model_type': 'graphsage', 'hidden_dims': '[512, 64]', 'dropout': 0.36530638695986606, 'batch_norm': False, 'sage_aggr': 'max', 'sage_normalize': False, 'sage_project': False, 'lr': 6.607336726475211e-05, 'weight_decay': 0.0006164042007259639, 'epochs': 320, 'loss': 'mse', 'optimizer': 'adam', 'graph_mode': 'cutoff', 'cutoff': 0.28813161231970047, 'grm_norm': 'cosine', 'self_loops': True, 'use_snp_selection': True, 'num_snps': 19240}. Best is trial 41 with value: 0.289349286162371.
[I 2025-12-09 11:06:25,617] Trial 76 finished with value: 0.25601775509807684 and parameters: {'model_type': 'graphsage', 'hidden_dims': '[512, 64]', 'dropout': 0.38922974673749483, 'batch_norm': False, 'sage_aggr': 'mean', 'sage_normalize': False, 'sage_project': False, 'lr': 0.00012457932944648278, 'weight_decay': 0.00044165155579493985, 'epochs': 337, 'loss': 'mse', 'optimizer': 'adam', 'graph_mode': 'cutoff', 'cutoff': 0.7085762318861256, 'grm_norm': 'cosine', 'self_loops': False, 'use_snp_selection': True, 'num_snps': 27545}. Best is trial 41 with value: 0.289349286162371.
[I 2025-12-09 11:10:05,711] Trial 77 finished with value: 0.1367809759271655 and parameters: {'model_type': 'graphsage', 'hidden_dims': '[512, 128]', 'dropout': 0.30581313137774696, 'batch_norm': False, 'sage_aggr': 'max', 'sage_normalize': False, 'sage_project': False, 'lr': 0.0012122846614184388, 'weight_decay': 0.0003631806625154812, 'epochs': 307, 'loss': 'mse', 'optimizer': 'adam', 'graph_mode': 'cutoff', 'cutoff': 0.26082629165943044, 'grm_norm': 'cosine', 'self_loops': False, 'use_snp_selection': True, 'num_snps': 25365}. Best is trial 41 with value: 0.289349286162371.
[I 2025-12-09 11:12:04,211] Trial 78 finished with value: 0.186492568170392 and parameters: {'model_type': 'graphsage', 'hidden_dims': '[256, 128, 64]', 'dropout': 0.4171436628103507, 'batch_norm': True, 'sage_aggr': 'max', 'sage_normalize': True, 'sage_project': False, 'lr': 2.7384904451035006e-05, 'weight_decay': 1.4223716797204128e-05, 'epochs': 315, 'loss': 'mse', 'optimizer': 'adam', 'graph_mode': 'cutoff', 'cutoff': 0.5130088680467415, 'grm_norm': 'cosine', 'self_loops': False, 'use_snp_selection': False}. Best is trial 41 with value: 0.289349286162371.
[I 2025-12-09 11:13:37,104] Trial 79 finished with value: 0.27558571004145493 and parameters: {'model_type': 'graphsage', 'hidden_dims': '[512, 256]', 'dropout': 0.36121304626124356, 'batch_norm': False, 'sage_aggr': 'max', 'sage_normalize': False, 'sage_project': False, 'lr': 1.1129469298286313e-05, 'weight_decay': 0.0007858883306604127, 'epochs': 299, 'loss': 'mae', 'optimizer': 'adam', 'graph_mode': 'cutoff', 'cutoff': 0.44269027115683024, 'grm_norm': 'cosine_then_gcn', 'self_loops': False, 'use_snp_selection': True, 'num_snps': 17910}. Best is trial 41 with value: 0.289349286162371.
[I 2025-12-09 11:15:18,438] Trial 80 finished with value: 0.28799325842253076 and parameters: {'model_type': 'graphsage', 'hidden_dims': '[512, 64]', 'dropout': 0.44953543373673377, 'batch_norm': False, 'sage_aggr': 'max', 'sage_normalize': False, 'sage_project': False, 'lr': 1.4523975405129413e-05, 'weight_decay': 2.577825034638217e-06, 'epochs': 266, 'loss': 'mse', 'optimizer': 'adam', 'graph_mode': 'knn', 'knn_k': 5, 'weighted_edges': True, 'symmetrize_mode': 'mutual', 'self_loops': True, 'use_snp_selection': True, 'num_snps': 20681}. Best is trial 41 with value: 0.289349286162371.
[I 2025-12-09 11:17:01,499] Trial 81 finished with value: 0.28675386161777133 and parameters: {'model_type': 'graphsage', 'hidden_dims': '[512, 64]', 'dropout': 0.44192007370109915, 'batch_norm': False, 'sage_aggr': 'max', 'sage_normalize': False, 'sage_project': False, 'lr': 1.4662867805655962e-05, 'weight_decay': 1.162112233101801e-06, 'epochs': 266, 'loss': 'mse', 'optimizer': 'adam', 'graph_mode': 'knn', 'knn_k': 5, 'weighted_edges': True, 'symmetrize_mode': 'mutual', 'self_loops': True, 'use_snp_selection': True, 'num_snps': 20702}. Best is trial 41 with value: 0.289349286162371.
[I 2025-12-09 11:19:02,523] Trial 82 finished with value: 0.28840354740831586 and parameters: {'model_type': 'graphsage', 'hidden_dims': '[512, 64]', 'dropout': 0.44985272978663804, 'batch_norm': False, 'sage_aggr': 'max', 'sage_normalize': False, 'sage_project': False, 'lr': 1.519120240486856e-05, 'weight_decay': 1.2405087589841282e-06, 'epochs': 267, 'loss': 'mse', 'optimizer': 'adam', 'graph_mode': 'knn', 'knn_k': 5, 'weighted_edges': True, 'symmetrize_mode': 'mutual', 'self_loops': True, 'use_snp_selection': True, 'num_snps': 24843}. Best is trial 41 with value: 0.289349286162371.
[I 2025-12-09 11:20:33,653] Trial 83 finished with value: 0.28592707179216664 and parameters: {'model_type': 'graphsage', 'hidden_dims': '[512, 64]', 'dropout': 0.5023833566684155, 'batch_norm': False, 'sage_aggr': 'max', 'sage_normalize': False, 'sage_project': False, 'lr': 2.1958499494967322e-05, 'weight_decay': 3.783885837586904e-07, 'epochs': 254, 'loss': 'mse', 'optimizer': 'adam', 'graph_mode': 'knn', 'knn_k': 5, 'weighted_edges': True, 'symmetrize_mode': 'mutual', 'self_loops': True, 'use_snp_selection': True, 'num_snps': 20477}. Best is trial 41 with value: 0.289349286162371.
[I 2025-12-09 11:22:21,999] Trial 84 finished with value: 0.28655108432332277 and parameters: {'model_type': 'graphsage', 'hidden_dims': '[512, 64]', 'dropout': 0.49497658894838614, 'batch_norm': False, 'sage_aggr': 'max', 'sage_normalize': False, 'sage_project': False, 'lr': 1.5156966339324578e-05, 'weight_decay': 1.0026311132855878e-06, 'epochs': 252, 'loss': 'mse', 'optimizer': 'adam', 'graph_mode': 'knn', 'knn_k': 5, 'weighted_edges': True, 'symmetrize_mode': 'mutual', 'self_loops': True, 'use_snp_selection': True, 'num_snps': 23775}. Best is trial 41 with value: 0.289349286162371.
[I 2025-12-09 11:24:04,244] Trial 85 finished with value: 0.2888102759660498 and parameters: {'model_type': 'graphsage', 'hidden_dims': '[512, 64]', 'dropout': 0.5139844273046601, 'batch_norm': False, 'sage_aggr': 'max', 'sage_normalize': False, 'sage_project': False, 'lr': 1.5121716817572096e-05, 'weight_decay': 1.3792772821889907e-06, 'epochs': 232, 'loss': 'mse', 'optimizer': 'adam', 'graph_mode': 'knn', 'knn_k': 5, 'weighted_edges': True, 'symmetrize_mode': 'mutual', 'self_loops': True, 'use_snp_selection': True, 'num_snps': 23637}. Best is trial 41 with value: 0.289349286162371.
[I 2025-12-09 11:25:43,810] Trial 86 finished with value: 0.29024726671501966 and parameters: {'model_type': 'graphsage', 'hidden_dims': '[512, 64]', 'dropout': 0.5149175990826971, 'batch_norm': False, 'sage_aggr': 'max', 'sage_normalize': False, 'sage_project': False, 'lr': 2.1876615147836727e-05, 'weight_decay': 1.438932700825695e-06, 'epochs': 220, 'loss': 'mse', 'optimizer': 'adam', 'graph_mode': 'knn', 'knn_k': 5, 'weighted_edges': True, 'symmetrize_mode': 'mutual', 'self_loops': True, 'use_snp_selection': True, 'num_snps': 24311}. Best is trial 86 with value: 0.29024726671501966.
[I 2025-12-09 11:27:26,853] Trial 87 finished with value: 0.2895947670576393 and parameters: {'model_type': 'graphsage', 'hidden_dims': '[512, 64]', 'dropout': 0.5230242332096142, 'batch_norm': False, 'sage_aggr': 'max', 'sage_normalize': False, 'sage_project': False, 'lr': 1.6350607847535602e-05, 'weight_decay': 1.4954925823992194e-06, 'epochs': 233, 'loss': 'mse', 'optimizer': 'adam', 'graph_mode': 'knn', 'knn_k': 5, 'weighted_edges': True, 'symmetrize_mode': 'mutual', 'self_loops': True, 'use_snp_selection': True, 'num_snps': 23939}. Best is trial 86 with value: 0.29024726671501966.
[I 2025-12-09 11:29:14,671] Trial 88 finished with value: 0.2893364183091018 and parameters: {'model_type': 'graphsage', 'hidden_dims': '[512, 64]', 'dropout': 0.5365728649835209, 'batch_norm': False, 'sage_aggr': 'max', 'sage_normalize': False, 'sage_project': False, 'lr': 1.562040706055834e-05, 'weight_decay': 1.648053769026737e-06, 'epochs': 231, 'loss': 'mse', 'optimizer': 'adam', 'graph_mode': 'knn', 'knn_k': 5, 'weighted_edges': True, 'symmetrize_mode': 'mutual', 'self_loops': True, 'use_snp_selection': True, 'num_snps': 24881}. Best is trial 86 with value: 0.29024726671501966.
[I 2025-12-09 11:31:20,554] Trial 89 finished with value: 0.28595024897497623 and parameters: {'model_type': 'graphsage', 'hidden_dims': '[512, 64]', 'dropout': 0.5348443682744923, 'batch_norm': False, 'sage_aggr': 'max', 'sage_normalize': False, 'sage_project': False, 'lr': 1.5779495288410517e-05, 'weight_decay': 1.8507524113744936e-06, 'epochs': 220, 'loss': 'mse', 'optimizer': 'adam', 'graph_mode': 'knn', 'knn_k': 5, 'weighted_edges': True, 'symmetrize_mode': 'mutual', 'self_loops': True, 'use_snp_selection': True, 'num_snps': 28749}. Best is trial 86 with value: 0.29024726671501966.
[I 2025-12-09 11:33:38,219] Trial 90 finished with value: 0.2899821919360238 and parameters: {'model_type': 'graphsage', 'hidden_dims': '[512, 64]', 'dropout': 0.5729208893499594, 'batch_norm': False, 'sage_aggr': 'mean', 'sage_normalize': False, 'sage_project': False, 'lr': 1.712631050811078e-05, 'weight_decay': 1.2218041341305537e-06, 'epochs': 231, 'loss': 'mse', 'optimizer': 'adam', 'graph_mode': 'knn', 'knn_k': 5, 'weighted_edges': True, 'symmetrize_mode': 'mutual', 'self_loops': True, 'use_snp_selection': True, 'num_snps': 31292}. Best is trial 86 with value: 0.29024726671501966.
[I 2025-12-09 11:36:16,777] Trial 91 finished with value: 0.28575879836035634 and parameters: {'model_type': 'graphsage', 'hidden_dims': '[512, 64]', 'dropout': 0.5822194858859739, 'batch_norm': False, 'sage_aggr': 'mean', 'sage_normalize': False, 'sage_project': False, 'lr': 1.730262288340757e-05, 'weight_decay': 1.3806052068324233e-06, 'epochs': 232, 'loss': 'mse', 'optimizer': 'adam', 'graph_mode': 'knn', 'knn_k': 5, 'weighted_edges': True, 'symmetrize_mode': 'mutual', 'self_loops': True, 'use_snp_selection': True, 'num_snps': 36574}. Best is trial 86 with value: 0.29024726671501966.
[I 2025-12-09 11:38:47,514] Trial 92 finished with value: 0.28810986559716006 and parameters: {'model_type': 'graphsage', 'hidden_dims': '[512, 64]', 'dropout': 0.5273432826002116, 'batch_norm': False, 'sage_aggr': 'mean', 'sage_normalize': False, 'sage_project': False, 'lr': 1.466804095533852e-05, 'weight_decay': 1.1103880201528765e-06, 'epochs': 232, 'loss': 'mse', 'optimizer': 'adam', 'graph_mode': 'knn', 'knn_k': 6, 'weighted_edges': True, 'symmetrize_mode': 'mutual', 'self_loops': True, 'use_snp_selection': True, 'num_snps': 31956}. Best is trial 86 with value: 0.29024726671501966.
[I 2025-12-09 11:41:01,173] Trial 93 finished with value: 0.2912915728187556 and parameters: {'model_type': 'graphsage', 'hidden_dims': '[512, 64]', 'dropout': 0.5290576560100746, 'batch_norm': False, 'sage_aggr': 'mean', 'sage_normalize': False, 'sage_project': False, 'lr': 1.0067020243836083e-05, 'weight_decay': 3.4317938945143743e-06, 'epochs': 205, 'loss': 'mse', 'optimizer': 'adam', 'graph_mode': 'knn', 'knn_k': 6, 'weighted_edges': True, 'symmetrize_mode': 'mutual', 'self_loops': True, 'use_snp_selection': True, 'num_snps': 32315}. Best is trial 93 with value: 0.2912915728187556.
[I 2025-12-09 11:43:24,371] Trial 94 finished with value: 0.2923823061698122 and parameters: {'model_type': 'graphsage', 'hidden_dims': '[512, 64]', 'dropout': 0.5357666956001242, 'batch_norm': False, 'sage_aggr': 'mean', 'sage_normalize': False, 'sage_project': False, 'lr': 1.0442061517652086e-05, 'weight_decay': 2.90552907493791e-06, 'epochs': 218, 'loss': 'mse', 'optimizer': 'adam', 'graph_mode': 'knn', 'knn_k': 6, 'weighted_edges': True, 'symmetrize_mode': 'mutual', 'self_loops': True, 'use_snp_selection': True, 'num_snps': 31746}. Best is trial 94 with value: 0.2923823061698122.
[I 2025-12-09 11:45:43,328] Trial 95 finished with value: 0.28854584819381907 and parameters: {'model_type': 'graphsage', 'hidden_dims': '[512, 64]', 'dropout': 0.540022394178328, 'batch_norm': False, 'sage_aggr': 'mean', 'sage_normalize': False, 'sage_project': False, 'lr': 1.078053238982852e-05, 'weight_decay': 3.7411802616877134e-06, 'epochs': 205, 'loss': 'mse', 'optimizer': 'adam', 'graph_mode': 'knn', 'knn_k': 6, 'weighted_edges': True, 'symmetrize_mode': 'mutual', 'self_loops': True, 'use_snp_selection': True, 'num_snps': 32071}. Best is trial 94 with value: 0.2923823061698122.
[I 2025-12-09 11:48:12,841] Trial 96 finished with value: 0.2882390311119559 and parameters: {'model_type': 'graphsage', 'hidden_dims': '[512, 64]', 'dropout': 0.5593672948856544, 'batch_norm': False, 'sage_aggr': 'mean', 'sage_normalize': False, 'sage_project': False, 'lr': 1.0205899507387456e-05, 'weight_decay': 3.7159695684540776e-06, 'epochs': 206, 'loss': 'mse', 'optimizer': 'adam', 'graph_mode': 'knn', 'knn_k': 6, 'weighted_edges': True, 'symmetrize_mode': 'mutual', 'self_loops': True, 'use_snp_selection': True, 'num_snps': 35601}. Best is trial 94 with value: 0.2923823061698122.
[I 2025-12-09 11:50:10,929] Trial 97 finished with value: 0.24446032336416074 and parameters: {'model_type': 'graphsage', 'hidden_dims': '[512, 64]', 'dropout': 0.5547820116453923, 'batch_norm': True, 'sage_aggr': 'mean', 'sage_normalize': True, 'sage_project': False, 'lr': 1.1362431135805554e-05, 'weight_decay': 1.7607845432749891e-06, 'epochs': 191, 'loss': 'mse', 'optimizer': 'adam', 'graph_mode': 'knn', 'knn_k': 4, 'weighted_edges': True, 'symmetrize_mode': 'mutual', 'self_loops': True, 'use_snp_selection': True, 'num_snps': 33795}. Best is trial 94 with value: 0.2923823061698122.
[I 2025-12-09 11:52:48,102] Trial 98 finished with value: 0.29160322144002926 and parameters: {'model_type': 'graphsage', 'hidden_dims': '[512, 64]', 'dropout': 0.5184668209637369, 'batch_norm': False, 'sage_aggr': 'mean', 'sage_normalize': False, 'sage_project': False, 'lr': 2.1078441719699274e-05, 'weight_decay': 6.617056123663009e-07, 'epochs': 213, 'loss': 'mse', 'optimizer': 'adam', 'graph_mode': 'knn', 'knn_k': 6, 'weighted_edges': True, 'symmetrize_mode': 'mutual', 'self_loops': True, 'use_snp_selection': False}. Best is trial 94 with value: 0.2923823061698122.
[I 2025-12-09 11:55:29,248] Trial 99 finished with value: 0.28023307279834053 and parameters: {'model_type': 'graphsage', 'hidden_dims': '[512, 64]', 'dropout': 0.5175781620171137, 'batch_norm': False, 'sage_aggr': 'mean', 'sage_normalize': False, 'sage_project': False, 'lr': 2.144161987407139e-05, 'weight_decay': 6.706417089830971e-07, 'epochs': 219, 'loss': 'mae', 'optimizer': 'adam', 'graph_mode': 'knn', 'knn_k': 6, 'weighted_edges': True, 'symmetrize_mode': 'mutual', 'self_loops': True, 'use_snp_selection': False}. Best is trial 94 with value: 0.2923823061698122.
[I 2025-12-09 11:58:06,422] Trial 100 finished with value: 0.28674067358572247 and parameters: {'model_type': 'graphsage', 'hidden_dims': '[512, 64]', 'dropout': 0.5759600527394044, 'batch_norm': False, 'sage_aggr': 'mean', 'sage_normalize': False, 'sage_project': False, 'lr': 1.8397410704943016e-05, 'weight_decay': 3.108047737628019e-06, 'epochs': 206, 'loss': 'mse', 'optimizer': 'adam', 'graph_mode': 'knn', 'knn_k': 7, 'weighted_edges': True, 'symmetrize_mode': 'mutual', 'self_loops': True, 'use_snp_selection': False}. Best is trial 94 with value: 0.2923823061698122.
[I 2025-12-09 12:00:53,076] Trial 101 finished with value: 0.28506602485429494 and parameters: {'model_type': 'graphsage', 'hidden_dims': '[512, 64]', 'dropout': 0.5425338286308532, 'batch_norm': False, 'sage_aggr': 'mean', 'sage_normalize': False, 'sage_project': False, 'lr': 1.183913996257423e-05, 'weight_decay': 4.348956348581094e-07, 'epochs': 226, 'loss': 'mse', 'optimizer': 'adam', 'graph_mode': 'knn', 'knn_k': 6, 'weighted_edges': True, 'symmetrize_mode': 'mutual', 'self_loops': True, 'use_snp_selection': False}. Best is trial 94 with value: 0.2923823061698122.
[I 2025-12-09 12:03:20,978] Trial 102 finished with value: 0.2881878661824654 and parameters: {'model_type': 'graphsage', 'hidden_dims': '[512, 64]', 'dropout': 0.5113356208490756, 'batch_norm': False, 'sage_aggr': 'mean', 'sage_normalize': False, 'sage_project': False, 'lr': 2.441050642874087e-05, 'weight_decay': 8.334985946463497e-07, 'epochs': 200, 'loss': 'mse', 'optimizer': 'adam', 'graph_mode': 'knn', 'knn_k': 6, 'weighted_edges': True, 'symmetrize_mode': 'mutual', 'self_loops': True, 'use_snp_selection': False}. Best is trial 94 with value: 0.2923823061698122.
[I 2025-12-09 12:06:06,648] Trial 103 finished with value: 0.2839149348837343 and parameters: {'model_type': 'graphsage', 'hidden_dims': '[512, 64]', 'dropout': 0.5438150640920203, 'batch_norm': False, 'sage_aggr': 'mean', 'sage_normalize': False, 'sage_project': False, 'lr': 1.269650009766263e-05, 'weight_decay': 1.5417876469882637e-06, 'epochs': 243, 'loss': 'mse', 'optimizer': 'adam', 'graph_mode': 'knn', 'knn_k': 4, 'weighted_edges': True, 'symmetrize_mode': 'mutual', 'self_loops': True, 'use_snp_selection': False}. Best is trial 94 with value: 0.2923823061698122.
[I 2025-12-09 12:09:08,940] Trial 104 finished with value: 0.2841028374856015 and parameters: {'model_type': 'graphsage', 'hidden_dims': '[512, 64]', 'dropout': 0.4821545759619391, 'batch_norm': False, 'sage_aggr': 'mean', 'sage_normalize': False, 'sage_project': False, 'lr': 1.0047794512847844e-05, 'weight_decay': 4.414516275754797e-06, 'epochs': 215, 'loss': 'mse', 'optimizer': 'adam', 'graph_mode': 'knn', 'knn_k': 6, 'weighted_edges': True, 'symmetrize_mode': 'mutual', 'self_loops': True, 'use_snp_selection': True, 'num_snps': 40864}. Best is trial 94 with value: 0.2923823061698122.
[I 2025-12-09 12:10:50,839] Trial 105 finished with value: 0.2842641943265325 and parameters: {'model_type': 'graphsage', 'hidden_dims': '[512, 64]', 'dropout': 0.5744468383535188, 'batch_norm': False, 'sage_aggr': 'mean', 'sage_normalize': False, 'sage_project': False, 'lr': 1.7897571372350944e-05, 'weight_decay': 2.027703431415809e-06, 'epochs': 178, 'loss': 'mse', 'optimizer': 'adam', 'graph_mode': 'knn', 'knn_k': 4, 'weighted_edges': True, 'symmetrize_mode': 'mutual', 'self_loops': True, 'use_snp_selection': True, 'num_snps': 30108}. Best is trial 94 with value: 0.2923823061698122.
[I 2025-12-09 12:13:11,212] Trial 106 finished with value: 0.28861098918557104 and parameters: {'model_type': 'graphsage', 'hidden_dims': '[512, 64]', 'dropout': 0.5964427316614491, 'batch_norm': False, 'sage_aggr': 'mean', 'sage_normalize': False, 'sage_project': False, 'lr': 2.088881955455007e-05, 'weight_decay': 2.3462594399233246e-06, 'epochs': 234, 'loss': 'mse', 'optimizer': 'adam', 'graph_mode': 'knn', 'knn_k': 5, 'weighted_edges': True, 'symmetrize_mode': 'mutual', 'self_loops': True, 'use_snp_selection': True, 'num_snps': 31850}. Best is trial 94 with value: 0.2923823061698122.
[I 2025-12-09 12:15:47,625] Trial 107 finished with value: 0.29042819130656006 and parameters: {'model_type': 'graphsage', 'hidden_dims': '[512, 64]', 'dropout': 0.592372217609885, 'batch_norm': False, 'sage_aggr': 'mean', 'sage_normalize': False, 'sage_project': False, 'lr': 2.7514052912153355e-05, 'weight_decay': 2.738055199311704e-06, 'epochs': 191, 'loss': 'mse', 'optimizer': 'adam', 'graph_mode': 'knn', 'knn_k': 6, 'weighted_edges': True, 'symmetrize_mode': 'mutual', 'self_loops': True, 'use_snp_selection': True, 'num_snps': 38824}. Best is trial 94 with value: 0.2923823061698122.
