[I 2025-12-09 19:22:52,426] Trial 143 finished with value: 0.37404753843341576 and parameters: {'model_type': 'graphsage', 'hidden_dims': '[256, 128]', 'dropout': 0.23378506868424787, 'batch_norm': False, 'sage_aggr': 'mean', 'sage_normalize': False, 'sage_project': False, 'lr': 6.034899083727286e-05, 'weight_decay': 7.082087784121197e-05, 'epochs': 95, 'loss': 'mse', 'optimizer': 'adam', 'graph_mode': 'cutoff', 'cutoff': 0.828474393268315, 'grm_norm': 'cosine_then_gcn', 'self_loops': True, 'use_snp_selection': False}. Best is trial 139 with value: 0.376105414027429.
[I 2025-12-09 19:23:23,791] Trial 144 finished with value: 0.3719457052190191 and parameters: {'model_type': 'graphsage', 'hidden_dims': '[256, 128]', 'dropout': 0.22825242363005616, 'batch_norm': False, 'sage_aggr': 'mean', 'sage_normalize': False, 'sage_project': False, 'lr': 5.978451415694341e-05, 'weight_decay': 6.814007815986788e-05, 'epochs': 95, 'loss': 'mse', 'optimizer': 'adam', 'graph_mode': 'cutoff', 'cutoff': 0.8227484833468092, 'grm_norm': 'cosine_then_gcn', 'self_loops': True, 'use_snp_selection': False}. Best is trial 139 with value: 0.376105414027429.
[I 2025-12-09 19:23:55,118] Trial 145 finished with value: 0.3629091249606686 and parameters: {'model_type': 'graphsage', 'hidden_dims': '[256, 128]', 'dropout': 0.1895276582368756, 'batch_norm': False, 'sage_aggr': 'mean', 'sage_normalize': False, 'sage_project': False, 'lr': 5.6545666666596976e-05, 'weight_decay': 6.855850956563055e-05, 'epochs': 95, 'loss': 'mse', 'optimizer': 'adam', 'graph_mode': 'cutoff', 'cutoff': 0.8309837387653676, 'grm_norm': 'cosine_then_gcn', 'self_loops': True, 'use_snp_selection': False}. Best is trial 139 with value: 0.376105414027429.
[I 2025-12-09 19:24:29,652] Trial 146 finished with value: 0.3629720889106062 and parameters: {'model_type': 'graphsage', 'hidden_dims': '[256, 128]', 'dropout': 0.22919012906767272, 'batch_norm': False, 'sage_aggr': 'mean', 'sage_normalize': False, 'sage_project': False, 'lr': 9.516864731038737e-05, 'weight_decay': 5.933157087987187e-05, 'epochs': 110, 'loss': 'mse', 'optimizer': 'adam', 'graph_mode': 'cutoff', 'cutoff': 0.7735866687941012, 'grm_norm': 'cosine_then_gcn', 'self_loops': True, 'use_snp_selection': False}. Best is trial 139 with value: 0.376105414027429.
[I 2025-12-09 19:25:46,182] Trial 147 finished with value: 0.3672486636773503 and parameters: {'model_type': 'graphsage', 'hidden_dims': '[512, 128]', 'dropout': 0.2110235234500614, 'batch_norm': False, 'sage_aggr': 'mean', 'sage_normalize': False, 'sage_project': False, 'lr': 7.452031305825143e-05, 'weight_decay': 0.00012208215179324936, 'epochs': 165, 'loss': 'mse', 'optimizer': 'adam', 'graph_mode': 'cutoff', 'cutoff': 0.8541618571950561, 'grm_norm': 'cosine_then_gcn', 'self_loops': True, 'use_snp_selection': False}. Best is trial 139 with value: 0.376105414027429.
[I 2025-12-09 19:26:14,600] Trial 148 finished with value: 0.3664187361493875 and parameters: {'model_type': 'graphsage', 'hidden_dims': '[128, 64]', 'dropout': 0.2639774440589729, 'batch_norm': False, 'sage_aggr': 'mean', 'sage_normalize': False, 'sage_project': False, 'lr': 6.281592215529185e-05, 'weight_decay': 4.518617635705136e-05, 'epochs': 138, 'loss': 'mse', 'optimizer': 'adam', 'graph_mode': 'cutoff', 'cutoff': 0.8079977433359009, 'grm_norm': 'cosine_then_gcn', 'self_loops': True, 'use_snp_selection': False}. Best is trial 139 with value: 0.376105414027429.
[I 2025-12-09 19:26:42,150] Trial 149 finished with value: 0.31097743643001036 and parameters: {'model_type': 'graphsage', 'hidden_dims': '[256, 128]', 'dropout': 0.2397526036861592, 'batch_norm': False, 'sage_aggr': 'max', 'sage_normalize': False, 'sage_project': False, 'lr': 0.00011996027586223647, 'weight_decay': 9.17464497406591e-05, 'epochs': 78, 'loss': 'mse', 'optimizer': 'adam', 'graph_mode': 'cutoff', 'cutoff': 0.8143290164873171, 'grm_norm': 'cosine_then_gcn', 'self_loops': True, 'use_snp_selection': False}. Best is trial 139 with value: 0.376105414027429.
[I 2025-12-09 19:28:00,304] Trial 0 finished with value: 0.3325050233795651 and parameters: {'model_type': 'graphsage', 'hidden_dims': '[128, 64]', 'dropout': 0.199031432379812, 'batch_norm': True, 'sage_aggr': 'max', 'sage_normalize': True, 'sage_project': False, 'lr': 0.00034401453323286885, 'weight_decay': 0.00017802616915745114, 'epochs': 230, 'loss': 'mse', 'optimizer': 'adam', 'graph_mode': 'knn', 'knn_k': 6, 'weighted_edges': True, 'symmetrize_mode': 'mutual', 'self_loops': True, 'use_snp_selection': False}. Best is trial 0 with value: 0.3325050233795651.
[I 2025-12-09 19:29:39,041] Trial 1 finished with value: 0.3453024920813018 and parameters: {'model_type': 'graphsage', 'hidden_dims': '[512, 128]', 'dropout': 0.2503500283181017, 'batch_norm': False, 'sage_aggr': 'max', 'sage_normalize': False, 'sage_project': False, 'lr': 3.952233718592099e-05, 'weight_decay': 0.00026754769258252603, 'epochs': 149, 'loss': 'mse', 'optimizer': 'adam', 'graph_mode': 'knn', 'knn_k': 2, 'weighted_edges': False, 'symmetrize_mode': 'mutual', 'self_loops': True, 'use_snp_selection': True, 'num_snps': 49915}. Best is trial 1 with value: 0.3453024920813018.
[I 2025-12-09 19:30:55,672] Trial 2 finished with value: 0.35084402292598665 and parameters: {'model_type': 'graphsage', 'hidden_dims': '[512, 256]', 'dropout': 0.2785908793172681, 'batch_norm': False, 'sage_aggr': 'max', 'sage_normalize': False, 'sage_project': False, 'lr': 8.806039223165805e-05, 'weight_decay': 3.5153176302760294e-05, 'epochs': 147, 'loss': 'mae', 'optimizer': 'adam', 'graph_mode': 'cutoff', 'cutoff': 0.4922564006874869, 'grm_norm': 'gcn', 'self_loops': False, 'use_snp_selection': True, 'num_snps': 34340}. Best is trial 2 with value: 0.35084402292598665.
[I 2025-12-09 19:32:08,484] Trial 3 finished with value: 0.34509155996569757 and parameters: {'model_type': 'graphsage', 'hidden_dims': '[256, 128, 64]', 'dropout': 0.3475243154412272, 'batch_norm': True, 'sage_aggr': 'max', 'sage_normalize': False, 'sage_project': False, 'lr': 1.6006331996938085e-05, 'weight_decay': 7.213121225589906e-06, 'epochs': 283, 'loss': 'mse', 'optimizer': 'adam', 'graph_mode': 'cutoff', 'cutoff': 0.5942334791449215, 'grm_norm': 'none', 'self_loops': True, 'use_snp_selection': False}. Best is trial 2 with value: 0.35084402292598665.
[I 2025-12-09 19:32:50,537] Trial 4 finished with value: 0.2950241982182239 and parameters: {'model_type': 'graphsage', 'hidden_dims': '[128, 64]', 'dropout': 0.3348926467202472, 'batch_norm': True, 'sage_aggr': 'max', 'sage_normalize': False, 'sage_project': False, 'lr': 0.0004238630400638802, 'weight_decay': 8.074086040046576e-07, 'epochs': 158, 'loss': 'mae', 'optimizer': 'adam', 'graph_mode': 'knn', 'knn_k': 1, 'weighted_edges': False, 'symmetrize_mode': 'mutual', 'self_loops': False, 'use_snp_selection': True, 'num_snps': 26850}. Best is trial 2 with value: 0.35084402292598665.
[I 2025-12-09 19:34:38,023] Trial 5 finished with value: 0.3208589675769692 and parameters: {'model_type': 'graphsage', 'hidden_dims': '[512, 64]', 'dropout': 0.14505336736221927, 'batch_norm': True, 'sage_aggr': 'mean', 'sage_normalize': True, 'sage_project': False, 'lr': 1.2962030165732234e-05, 'weight_decay': 1.326598071105465e-07, 'epochs': 180, 'loss': 'mse', 'optimizer': 'adam', 'graph_mode': 'knn', 'knn_k': 9, 'weighted_edges': True, 'symmetrize_mode': 'mutual', 'self_loops': False, 'use_snp_selection': False}. Best is trial 2 with value: 0.35084402292598665.
[I 2025-12-09 19:35:30,306] Trial 6 finished with value: 0.3285124256738378 and parameters: {'model_type': 'graphsage', 'hidden_dims': '[256, 128, 64]', 'dropout': 0.10731743755162496, 'batch_norm': True, 'sage_aggr': 'mean', 'sage_normalize': False, 'sage_project': False, 'lr': 1.922990426933137e-05, 'weight_decay': 7.30001060446905e-05, 'epochs': 63, 'loss': 'mae', 'optimizer': 'adam', 'graph_mode': 'cutoff', 'cutoff': 0.7624978434202536, 'grm_norm': 'none', 'self_loops': True, 'use_snp_selection': True, 'num_snps': 50106}. Best is trial 2 with value: 0.35084402292598665.
[I 2025-12-09 19:37:25,146] Trial 7 finished with value: 0.33945790122641123 and parameters: {'model_type': 'graphsage', 'hidden_dims': '[512, 64]', 'dropout': 0.2585007811528941, 'batch_norm': True, 'sage_aggr': 'max', 'sage_normalize': True, 'sage_project': False, 'lr': 5.921425508303391e-05, 'weight_decay': 0.0004511561961144237, 'epochs': 182, 'loss': 'mae', 'optimizer': 'adam', 'graph_mode': 'knn', 'knn_k': 9, 'weighted_edges': True, 'symmetrize_mode': 'union', 'self_loops': False, 'use_snp_selection': True, 'num_snps': 23903}. Best is trial 2 with value: 0.35084402292598665.
[I 2025-12-09 19:38:06,710] Trial 8 finished with value: 0.3140869674196279 and parameters: {'model_type': 'graphsage', 'hidden_dims': '[512, 256]', 'dropout': 0.3061380386767003, 'batch_norm': False, 'sage_aggr': 'mean', 'sage_normalize': True, 'sage_project': False, 'lr': 0.000698401460570184, 'weight_decay': 2.965560055460244e-06, 'epochs': 289, 'loss': 'mae', 'optimizer': 'adam', 'graph_mode': 'knn', 'knn_k': 7, 'weighted_edges': False, 'symmetrize_mode': 'mutual', 'self_loops': True, 'use_snp_selection': True, 'num_snps': 4710}. Best is trial 2 with value: 0.35084402292598665.
[I 2025-12-09 19:41:45,905] Trial 9 finished with value: 0.34758719001363586 and parameters: {'model_type': 'graphsage', 'hidden_dims': '[512, 128]', 'dropout': 0.1733844071393634, 'batch_norm': False, 'sage_aggr': 'mean', 'sage_normalize': True, 'sage_project': False, 'lr': 0.0004269677918501597, 'weight_decay': 2.2439779626249696e-06, 'epochs': 319, 'loss': 'mse', 'optimizer': 'adam', 'graph_mode': 'cutoff', 'cutoff': 0.24117565767129295, 'grm_norm': 'cosine_then_gcn', 'self_loops': True, 'use_snp_selection': False}. Best is trial 2 with value: 0.35084402292598665.
[I 2025-12-09 19:42:49,257] Trial 10 finished with value: 0.0 and parameters: {'model_type': 'graphsage', 'hidden_dims': '[512, 256]', 'dropout': 0.46773351022590026, 'batch_norm': False, 'sage_aggr': 'max', 'sage_normalize': False, 'sage_project': False, 'lr': 0.0060050040216813455, 'weight_decay': 3.194347401809951e-05, 'epochs': 76, 'loss': 'mae', 'optimizer': 'adam', 'graph_mode': 'cutoff', 'cutoff': 0.36538426242387784, 'grm_norm': 'gcn', 'self_loops': False, 'use_snp_selection': True, 'num_snps': 36724}. Best is trial 2 with value: 0.35084402292598665.
[I 2025-12-09 19:46:46,950] Trial 11 finished with value: 0.3477086262286545 and parameters: {'model_type': 'graphsage', 'hidden_dims': '[512, 128]', 'dropout': 0.4926018175562089, 'batch_norm': False, 'sage_aggr': 'mean', 'sage_normalize': True, 'sage_project': False, 'lr': 0.00014329243697702685, 'weight_decay': 1.722110956047924e-06, 'epochs': 348, 'loss': 'mse', 'optimizer': 'adam', 'graph_mode': 'cutoff', 'cutoff': 0.2414787267843555, 'grm_norm': 'cosine_then_gcn', 'self_loops': False, 'use_snp_selection': False}. Best is trial 2 with value: 0.35084402292598665.
[I 2025-12-09 19:48:01,762] Trial 12 finished with value: 0.2092874793343416 and parameters: {'model_type': 'graphsage', 'hidden_dims': '[256, 128]', 'dropout': 0.5599862888643445, 'batch_norm': False, 'sage_aggr': 'mean', 'sage_normalize': False, 'sage_project': False, 'lr': 0.00014585774799336307, 'weight_decay': 1.8695700928243635e-05, 'epochs': 238, 'loss': 'mae', 'optimizer': 'adam', 'graph_mode': 'cutoff', 'cutoff': 0.4538278092755863, 'grm_norm': 'cosine', 'self_loops': False, 'use_snp_selection': False}. Best is trial 2 with value: 0.35084402292598665.
[I 2025-12-09 19:49:34,605] Trial 13 finished with value: 0.3377758991130479 and parameters: {'model_type': 'graphsage', 'hidden_dims': '[512, 256]', 'dropout': 0.4531177470383393, 'batch_norm': False, 'sage_aggr': 'mean', 'sage_normalize': True, 'sage_project': False, 'lr': 9.933777278644623e-05, 'weight_decay': 4.23848995069748e-07, 'epochs': 112, 'loss': 'mse', 'optimizer': 'adam', 'graph_mode': 'cutoff', 'cutoff': 0.21134110540440323, 'grm_norm': 'cosine_then_gcn', 'self_loops': False, 'use_snp_selection': False}. Best is trial 2 with value: 0.35084402292598665.
[I 2025-12-09 19:50:20,478] Trial 14 finished with value: 0.32555033834844427 and parameters: {'model_type': 'graphsage', 'hidden_dims': '[512, 128]', 'dropout': 0.4324009678201306, 'batch_norm': False, 'sage_aggr': 'max', 'sage_normalize': False, 'sage_project': False, 'lr': 0.0012297848507367218, 'weight_decay': 4.8427478008329095e-06, 'epochs': 228, 'loss': 'mae', 'optimizer': 'adam', 'graph_mode': 'cutoff', 'cutoff': 0.5912917505793289, 'grm_norm': 'gcn', 'self_loops': False, 'use_snp_selection': True, 'num_snps': 11562}. Best is trial 2 with value: 0.35084402292598665.
[I 2025-12-09 19:51:43,906] Trial 15 finished with value: 0.33728034639842885 and parameters: {'model_type': 'graphsage', 'hidden_dims': '[256, 128]', 'dropout': 0.5886866495246754, 'batch_norm': False, 'sage_aggr': 'mean', 'sage_normalize': True, 'sage_project': False, 'lr': 0.00015629493379297512, 'weight_decay': 5.5844131462578395e-05, 'epochs': 337, 'loss': 'mse', 'optimizer': 'adam', 'graph_mode': 'cutoff', 'cutoff': 0.8474060677480266, 'grm_norm': 'cosine_then_gcn', 'self_loops': False, 'use_snp_selection': False}. Best is trial 2 with value: 0.35084402292598665.
[I 2025-12-09 19:52:55,005] Trial 16 finished with value: 0.30180587524108793 and parameters: {'model_type': 'graphsage', 'hidden_dims': '[512, 128]', 'dropout': 0.5210517368126334, 'batch_norm': False, 'sage_aggr': 'mean', 'sage_normalize': True, 'sage_project': False, 'lr': 0.002730955891745877, 'weight_decay': 1.0959832203380132e-06, 'epochs': 128, 'loss': 'mae', 'optimizer': 'adam', 'graph_mode': 'cutoff', 'cutoff': 0.38221913865788715, 'grm_norm': 'gcn', 'self_loops': False, 'use_snp_selection': False}. Best is trial 2 with value: 0.35084402292598665.
[I 2025-12-09 19:53:56,185] Trial 17 finished with value: 0.35870747683500986 and parameters: {'model_type': 'graphsage', 'hidden_dims': '[512, 256]', 'dropout': 0.40769459624859483, 'batch_norm': False, 'sage_aggr': 'max', 'sage_normalize': False, 'sage_project': False, 'lr': 3.948895807386739e-05, 'weight_decay': 0.0009434791891988082, 'epochs': 94, 'loss': 'mse', 'optimizer': 'adam', 'graph_mode': 'cutoff', 'cutoff': 0.6908055822673191, 'grm_norm': 'cosine', 'self_loops': False, 'use_snp_selection': True, 'num_snps': 38468}. Best is trial 17 with value: 0.35870747683500986.
[I 2025-12-09 19:54:57,956] Trial 18 finished with value: 0.3678548522968107 and parameters: {'model_type': 'graphsage', 'hidden_dims': '[512, 256]', 'dropout': 0.3987098321530354, 'batch_norm': False, 'sage_aggr': 'max', 'sage_normalize': False, 'sage_project': False, 'lr': 3.2633554138598334e-05, 'weight_decay': 0.0008832347121775657, 'epochs': 94, 'loss': 'mae', 'optimizer': 'adam', 'graph_mode': 'cutoff', 'cutoff': 0.7066230635083002, 'grm_norm': 'cosine', 'self_loops': False, 'use_snp_selection': True, 'num_snps': 39070}. Best is trial 18 with value: 0.3678548522968107.
[I 2025-12-09 19:56:02,002] Trial 19 finished with value: 0.3345302013911337 and parameters: {'model_type': 'graphsage', 'hidden_dims': '[512, 256]', 'dropout': 0.3886735652449291, 'batch_norm': False, 'sage_aggr': 'max', 'sage_normalize': False, 'sage_project': False, 'lr': 2.9986029596707813e-05, 'weight_decay': 0.000912663321147305, 'epochs': 47, 'loss': 'mse', 'optimizer': 'adam', 'graph_mode': 'cutoff', 'cutoff': 0.7170815909894875, 'grm_norm': 'cosine', 'self_loops': False, 'use_snp_selection': True, 'num_snps': 59695}. Best is trial 18 with value: 0.3678548522968107.
[I 2025-12-09 19:57:08,869] Trial 20 finished with value: 0.36618157641842364 and parameters: {'model_type': 'graphsage', 'hidden_dims': '[512, 256]', 'dropout': 0.3989046263767588, 'batch_norm': False, 'sage_aggr': 'max', 'sage_normalize': False, 'sage_project': False, 'lr': 1.0011626212035154e-05, 'weight_decay': 0.000986175443703161, 'epochs': 95, 'loss': 'mae', 'optimizer': 'adam', 'graph_mode': 'cutoff', 'cutoff': 0.6956258088555951, 'grm_norm': 'cosine', 'self_loops': False, 'use_snp_selection': True, 'num_snps': 43626}. Best is trial 18 with value: 0.3678548522968107.
[I 2025-12-09 19:58:14,488] Trial 21 finished with value: 0.3652902261475932 and parameters: {'model_type': 'graphsage', 'hidden_dims': '[512, 256]', 'dropout': 0.4025497973167898, 'batch_norm': False, 'sage_aggr': 'max', 'sage_normalize': False, 'sage_project': False, 'lr': 1.0200612683764361e-05, 'weight_decay': 0.0008877038338638183, 'epochs': 94, 'loss': 'mae', 'optimizer': 'adam', 'graph_mode': 'cutoff', 'cutoff': 0.7019165062321472, 'grm_norm': 'cosine', 'self_loops': False, 'use_snp_selection': True, 'num_snps': 42485}. Best is trial 18 with value: 0.3678548522968107.
[I 2025-12-09 19:59:22,518] Trial 22 finished with value: 0.36999608349393254 and parameters: {'model_type': 'graphsage', 'hidden_dims': '[512, 256]', 'dropout': 0.37828778315870737, 'batch_norm': False, 'sage_aggr': 'max', 'sage_normalize': False, 'sage_project': False, 'lr': 1.1365936190453806e-05, 'weight_decay': 0.00018723992990405934, 'epochs': 97, 'loss': 'mae', 'optimizer': 'adam', 'graph_mode': 'cutoff', 'cutoff': 0.8682546565604596, 'grm_norm': 'cosine', 'self_loops': False, 'use_snp_selection': True, 'num_snps': 44532}. Best is trial 22 with value: 0.36999608349393254.
[I 2025-12-09 20:00:37,580] Trial 23 finished with value: 0.36599777836620884 and parameters: {'model_type': 'graphsage', 'hidden_dims': '[512, 256]', 'dropout': 0.3686257385772722, 'batch_norm': False, 'sage_aggr': 'max', 'sage_normalize': False, 'sage_project': False, 'lr': 2.495020545303125e-05, 'weight_decay': 0.0001311580198970004, 'epochs': 116, 'loss': 'mae', 'optimizer': 'adam', 'graph_mode': 'cutoff', 'cutoff': 0.8751280127986528, 'grm_norm': 'cosine', 'self_loops': False, 'use_snp_selection': True, 'num_snps': 46281}. Best is trial 22 with value: 0.36999608349393254.
[I 2025-12-09 20:01:37,179] Trial 24 finished with value: 0.33243954641683693 and parameters: {'model_type': 'graphsage', 'hidden_dims': '[512, 256]', 'dropout': 0.3184969027292452, 'batch_norm': False, 'sage_aggr': 'max', 'sage_normalize': False, 'sage_project': False, 'lr': 1.016913950677186e-05, 'weight_decay': 0.0003879462739342272, 'epochs': 41, 'loss': 'mae', 'optimizer': 'adam', 'graph_mode': 'cutoff', 'cutoff': 0.8108017937822829, 'grm_norm': 'cosine', 'self_loops': False, 'use_snp_selection': True, 'num_snps': 56627}. Best is trial 22 with value: 0.36999608349393254.
[I 2025-12-09 20:02:28,500] Trial 25 finished with value: 0.3626316692617528 and parameters: {'model_type': 'graphsage', 'hidden_dims': '[512, 256]', 'dropout': 0.501211252899153, 'batch_norm': False, 'sage_aggr': 'max', 'sage_normalize': False, 'sage_project': False, 'lr': 5.582491419561053e-05, 'weight_decay': 0.0001341827105675341, 'epochs': 84, 'loss': 'mae', 'optimizer': 'adam', 'graph_mode': 'cutoff', 'cutoff': 0.8962857716439909, 'grm_norm': 'cosine', 'self_loops': False, 'use_snp_selection': True, 'num_snps': 29736}. Best is trial 22 with value: 0.36999608349393254.
[I 2025-12-09 20:03:41,277] Trial 26 finished with value: 0.3701089826402753 and parameters: {'model_type': 'graphsage', 'hidden_dims': '[512, 256]', 'dropout': 0.4314081794810973, 'batch_norm': False, 'sage_aggr': 'max', 'sage_normalize': False, 'sage_project': False, 'lr': 2.1377880804680632e-05, 'weight_decay': 0.000494866061743946, 'epochs': 117, 'loss': 'mae', 'optimizer': 'adam', 'graph_mode': 'cutoff', 'cutoff': 0.6539055749953557, 'grm_norm': 'cosine', 'self_loops': False, 'use_snp_selection': True, 'num_snps': 43612}. Best is trial 26 with value: 0.3701089826402753.
[I 2025-12-09 20:04:39,279] Trial 27 finished with value: 0.3653480293943141 and parameters: {'model_type': 'graphsage', 'hidden_dims': '[128, 64]', 'dropout': 0.44938734282858, 'batch_norm': False, 'sage_aggr': 'max', 'sage_normalize': False, 'sage_project': False, 'lr': 2.6225446017215142e-05, 'weight_decay': 0.0004063062119433531, 'epochs': 123, 'loss': 'mae', 'optimizer': 'adam', 'graph_mode': 'cutoff', 'cutoff': 0.6230124982099694, 'grm_norm': 'cosine', 'self_loops': False, 'use_snp_selection': True, 'num_snps': 52102}. Best is trial 26 with value: 0.3701089826402753.
[I 2025-12-09 20:05:15,473] Trial 28 finished with value: 0.35880545915290785 and parameters: {'model_type': 'graphsage', 'hidden_dims': '[256, 128]', 'dropout': 0.5175531082892659, 'batch_norm': False, 'sage_aggr': 'max', 'sage_normalize': False, 'sage_project': False, 'lr': 2.0497942079363905e-05, 'weight_decay': 8.969755257094484e-05, 'epochs': 64, 'loss': 'mae', 'optimizer': 'adam', 'graph_mode': 'cutoff', 'cutoff': 0.8107473664219268, 'grm_norm': 'cosine', 'self_loops': False, 'use_snp_selection': True, 'num_snps': 19679}. Best is trial 26 with value: 0.3701089826402753.
[I 2025-12-09 20:07:22,832] Trial 29 finished with value: 0.33173073886862187 and parameters: {'model_type': 'graphsage', 'hidden_dims': '[256, 128, 64]', 'dropout': 0.2193856796667361, 'batch_norm': True, 'sage_aggr': 'max', 'sage_normalize': False, 'sage_project': False, 'lr': 0.00027273583896154566, 'weight_decay': 0.00027113951660718644, 'epochs': 222, 'loss': 'mae', 'optimizer': 'adam', 'graph_mode': 'knn', 'knn_k': 4, 'weighted_edges': False, 'symmetrize_mode': 'union', 'self_loops': True, 'use_snp_selection': True, 'num_snps': 39857}. Best is trial 26 with value: 0.3701089826402753.
[I 2025-12-09 20:08:33,146] Trial 30 finished with value: 0.361056833074881 and parameters: {'model_type': 'graphsage', 'hidden_dims': '[512, 64]', 'dropout': 0.36744704654382127, 'batch_norm': False, 'sage_aggr': 'max', 'sage_normalize': False, 'sage_project': False, 'lr': 5.493853390582889e-05, 'weight_decay': 0.00019420605492074806, 'epochs': 167, 'loss': 'mae', 'optimizer': 'adam', 'graph_mode': 'cutoff', 'cutoff': 0.6370903671021888, 'grm_norm': 'none', 'self_loops': False, 'use_snp_selection': True, 'num_snps': 32962}. Best is trial 26 with value: 0.3701089826402753.
