[I 2025-12-09 17:35:22,779] Trial 46 finished with value: 0.24342408389202283 and parameters: {'model_type': 'graphsage', 'hidden_dims': '[512, 64]', 'dropout': 0.32963380109279466, 'batch_norm': True, 'sage_aggr': 'max', 'sage_normalize': True, 'sage_project': False, 'lr': 7.500571388569052e-05, 'weight_decay': 5.94666213079731e-07, 'epochs': 227, 'loss': 'mse', 'optimizer': 'adam', 'graph_mode': 'knn', 'knn_k': 5, 'weighted_edges': True, 'symmetrize_mode': 'union', 'self_loops': False, 'use_snp_selection': False}. Best is trial 32 with value: 0.28766705771362766.
[I 2025-12-09 17:36:04,620] Trial 47 finished with value: 0.2813209683828072 and parameters: {'model_type': 'graphsage', 'hidden_dims': '[256, 128, 64]', 'dropout': 0.20523324794505957, 'batch_norm': True, 'sage_aggr': 'max', 'sage_normalize': True, 'sage_project': False, 'lr': 0.00025091935063740746, 'weight_decay': 3.0330204313454756e-06, 'epochs': 180, 'loss': 'mse', 'optimizer': 'adam', 'graph_mode': 'cutoff', 'cutoff': 0.6063515728525846, 'grm_norm': 'none', 'self_loops': True, 'use_snp_selection': True, 'num_snps': 15740}. Best is trial 32 with value: 0.28766705771362766.
[I 2025-12-09 17:37:42,240] Trial 48 finished with value: 0.2883344329871482 and parameters: {'model_type': 'graphsage', 'hidden_dims': '[512, 256]', 'dropout': 0.2789921067641966, 'batch_norm': True, 'sage_aggr': 'max', 'sage_normalize': True, 'sage_project': False, 'lr': 0.00038083677513082954, 'weight_decay': 1.6598222947425356e-07, 'epochs': 203, 'loss': 'mse', 'optimizer': 'adam', 'graph_mode': 'cutoff', 'cutoff': 0.6585420246163031, 'grm_norm': 'cosine', 'self_loops': True, 'use_snp_selection': False}. Best is trial 48 with value: 0.2883344329871482.
[I 2025-12-09 17:39:25,781] Trial 49 finished with value: 0.28589032563808503 and parameters: {'model_type': 'graphsage', 'hidden_dims': '[512, 256]', 'dropout': 0.28385614399083114, 'batch_norm': True, 'sage_aggr': 'mean', 'sage_normalize': True, 'sage_project': False, 'lr': 0.00038541457385425827, 'weight_decay': 1.456378225274402e-07, 'epochs': 207, 'loss': 'mae', 'optimizer': 'adam', 'graph_mode': 'cutoff', 'cutoff': 0.5394079783997592, 'grm_norm': 'none', 'self_loops': True, 'use_snp_selection': False}. Best is trial 48 with value: 0.2883344329871482.
[I 2025-12-09 17:42:21,469] Trial 50 finished with value: 0.27458913019393927 and parameters: {'model_type': 'graphsage', 'hidden_dims': '[512, 256]', 'dropout': 0.3577333609094853, 'batch_norm': True, 'sage_aggr': 'mean', 'sage_normalize': True, 'sage_project': False, 'lr': 0.00037397333912485357, 'weight_decay': 1.6828426327571248e-07, 'epochs': 207, 'loss': 'mae', 'optimizer': 'adam', 'graph_mode': 'knn', 'knn_k': 7, 'weighted_edges': True, 'symmetrize_mode': 'union', 'self_loops': True, 'use_snp_selection': True, 'num_snps': 36753}. Best is trial 48 with value: 0.2883344329871482.
[I 2025-12-09 17:43:45,724] Trial 51 finished with value: 0.28434464477403176 and parameters: {'model_type': 'graphsage', 'hidden_dims': '[512, 256]', 'dropout': 0.27686800209021895, 'batch_norm': True, 'sage_aggr': 'mean', 'sage_normalize': True, 'sage_project': False, 'lr': 0.0005055094007292548, 'weight_decay': 1.0966906630117951e-07, 'epochs': 163, 'loss': 'mae', 'optimizer': 'adam', 'graph_mode': 'cutoff', 'cutoff': 0.5360414866638216, 'grm_norm': 'none', 'self_loops': True, 'use_snp_selection': False}. Best is trial 48 with value: 0.2883344329871482.
[I 2025-12-09 17:45:39,915] Trial 52 finished with value: 0.2828632527974947 and parameters: {'model_type': 'graphsage', 'hidden_dims': '[512, 256]', 'dropout': 0.2833894261950334, 'batch_norm': True, 'sage_aggr': 'mean', 'sage_normalize': True, 'sage_project': False, 'lr': 0.00071471252618137, 'weight_decay': 2.6555571536489107e-07, 'epochs': 236, 'loss': 'mae', 'optimizer': 'adam', 'graph_mode': 'cutoff', 'cutoff': 0.5722015270796077, 'grm_norm': 'none', 'self_loops': True, 'use_snp_selection': False}. Best is trial 48 with value: 0.2883344329871482.
[I 2025-12-09 17:47:12,549] Trial 53 finished with value: 0.2806709953329688 and parameters: {'model_type': 'graphsage', 'hidden_dims': '[512, 256]', 'dropout': 0.25242475128160874, 'batch_norm': True, 'sage_aggr': 'mean', 'sage_normalize': True, 'sage_project': False, 'lr': 0.00039532439163131376, 'weight_decay': 4.389460178565474e-07, 'epochs': 190, 'loss': 'mae', 'optimizer': 'adam', 'graph_mode': 'cutoff', 'cutoff': 0.6597558134862332, 'grm_norm': 'none', 'self_loops': True, 'use_snp_selection': False}. Best is trial 48 with value: 0.2883344329871482.
[I 2025-12-09 17:48:56,078] Trial 54 finished with value: 0.2822902188159603 and parameters: {'model_type': 'graphsage', 'hidden_dims': '[512, 256]', 'dropout': 0.23931555726716988, 'batch_norm': True, 'sage_aggr': 'mean', 'sage_normalize': True, 'sage_project': False, 'lr': 0.0002511044005226266, 'weight_decay': 1.6808520379277187e-07, 'epochs': 214, 'loss': 'mae', 'optimizer': 'adam', 'graph_mode': 'cutoff', 'cutoff': 0.608898142934161, 'grm_norm': 'none', 'self_loops': True, 'use_snp_selection': False}. Best is trial 48 with value: 0.2883344329871482.
[I 2025-12-09 17:51:10,889] Trial 55 finished with value: 0.2401925387720663 and parameters: {'model_type': 'graphsage', 'hidden_dims': '[512, 256]', 'dropout': 0.3410705449459329, 'batch_norm': True, 'sage_aggr': 'max', 'sage_normalize': True, 'sage_project': False, 'lr': 0.0010297330394797763, 'weight_decay': 8.038295054749789e-07, 'epochs': 141, 'loss': 'mse', 'optimizer': 'adam', 'graph_mode': 'cutoff', 'cutoff': 0.2007018405975749, 'grm_norm': 'cosine', 'self_loops': True, 'use_snp_selection': False}. Best is trial 48 with value: 0.2883344329871482.
[I 2025-12-09 17:52:07,530] Trial 56 finished with value: 0.2821587085606479 and parameters: {'model_type': 'graphsage', 'hidden_dims': '[256, 128, 64]', 'dropout': 0.13470298416358584, 'batch_norm': True, 'sage_aggr': 'max', 'sage_normalize': True, 'sage_project': False, 'lr': 0.0002148865784413081, 'weight_decay': 1.362394942315506e-07, 'epochs': 197, 'loss': 'mse', 'optimizer': 'adam', 'graph_mode': 'cutoff', 'cutoff': 0.6608582027459448, 'grm_norm': 'cosine_then_gcn', 'self_loops': True, 'use_snp_selection': False}. Best is trial 48 with value: 0.2883344329871482.
[I 2025-12-09 17:53:39,166] Trial 57 finished with value: 0.2876771757147295 and parameters: {'model_type': 'graphsage', 'hidden_dims': '[512, 128]', 'dropout': 0.3645783743484275, 'batch_norm': True, 'sage_aggr': 'mean', 'sage_normalize': True, 'sage_project': False, 'lr': 0.00014453593153716492, 'weight_decay': 3.133727772458192e-07, 'epochs': 178, 'loss': 'mse', 'optimizer': 'adam', 'graph_mode': 'cutoff', 'cutoff': 0.530922980582963, 'grm_norm': 'gcn', 'self_loops': False, 'use_snp_selection': False}. Best is trial 48 with value: 0.2883344329871482.
[I 2025-12-09 17:55:31,119] Trial 58 finished with value: 0.26175586106024684 and parameters: {'model_type': 'graphsage', 'hidden_dims': '[512, 128]', 'dropout': 0.36965596364290854, 'batch_norm': True, 'sage_aggr': 'mean', 'sage_normalize': True, 'sage_project': False, 'lr': 0.000162266461448947, 'weight_decay': 4.614381489890317e-07, 'epochs': 182, 'loss': 'mae', 'optimizer': 'adam', 'graph_mode': 'knn', 'knn_k': 8, 'weighted_edges': False, 'symmetrize_mode': 'mutual', 'self_loops': False, 'use_snp_selection': False}. Best is trial 48 with value: 0.2883344329871482.
[I 2025-12-09 17:56:28,103] Trial 59 finished with value: 0.2916028587906642 and parameters: {'model_type': 'graphsage', 'hidden_dims': '[512, 128]', 'dropout': 0.3986937722554633, 'batch_norm': True, 'sage_aggr': 'mean', 'sage_normalize': True, 'sage_project': False, 'lr': 9.73255507536176e-05, 'weight_decay': 1.2804328344274712e-06, 'epochs': 223, 'loss': 'mse', 'optimizer': 'adam', 'graph_mode': 'cutoff', 'cutoff': 0.5221021865260745, 'grm_norm': 'gcn', 'self_loops': False, 'use_snp_selection': True, 'num_snps': 15866}. Best is trial 59 with value: 0.2916028587906642.
[I 2025-12-09 17:57:24,526] Trial 60 finished with value: 0.29255876736872977 and parameters: {'model_type': 'graphsage', 'hidden_dims': '[512, 128]', 'dropout': 0.40815035296864177, 'batch_norm': True, 'sage_aggr': 'mean', 'sage_normalize': True, 'sage_project': False, 'lr': 0.00011166753469851924, 'weight_decay': 7.379991429380397e-07, 'epochs': 229, 'loss': 'mse', 'optimizer': 'adam', 'graph_mode': 'cutoff', 'cutoff': 0.5242535443970808, 'grm_norm': 'gcn', 'self_loops': False, 'use_snp_selection': True, 'num_snps': 15113}. Best is trial 60 with value: 0.29255876736872977.
[I 2025-12-09 17:58:20,402] Trial 61 finished with value: 0.28514757896979065 and parameters: {'model_type': 'graphsage', 'hidden_dims': '[512, 128]', 'dropout': 0.40638266121776445, 'batch_norm': True, 'sage_aggr': 'mean', 'sage_normalize': True, 'sage_project': False, 'lr': 9.941239494672512e-05, 'weight_decay': 7.500891910699528e-07, 'epochs': 226, 'loss': 'mse', 'optimizer': 'adam', 'graph_mode': 'cutoff', 'cutoff': 0.5185838201678249, 'grm_norm': 'gcn', 'self_loops': False, 'use_snp_selection': True, 'num_snps': 15067}. Best is trial 60 with value: 0.29255876736872977.
[I 2025-12-09 17:59:14,334] Trial 62 finished with value: 0.2803032759276479 and parameters: {'model_type': 'graphsage', 'hidden_dims': '[512, 128]', 'dropout': 0.4720868011192424, 'batch_norm': True, 'sage_aggr': 'mean', 'sage_normalize': True, 'sage_project': False, 'lr': 5.867900613920556e-05, 'weight_decay': 1.6211253927462094e-06, 'epochs': 203, 'loss': 'mse', 'optimizer': 'adam', 'graph_mode': 'cutoff', 'cutoff': 0.4252235903451016, 'grm_norm': 'gcn', 'self_loops': False, 'use_snp_selection': True, 'num_snps': 14436}. Best is trial 60 with value: 0.29255876736872977.
[I 2025-12-09 18:00:27,376] Trial 63 finished with value: 0.28882054622901315 and parameters: {'model_type': 'graphsage', 'hidden_dims': '[512, 128]', 'dropout': 0.3845481548257216, 'batch_norm': True, 'sage_aggr': 'mean', 'sage_normalize': True, 'sage_project': False, 'lr': 0.00013242203026651557, 'weight_decay': 1.5779637625529785e-07, 'epochs': 241, 'loss': 'mse', 'optimizer': 'adam', 'graph_mode': 'cutoff', 'cutoff': 0.4687174070662908, 'grm_norm': 'gcn', 'self_loops': False, 'use_snp_selection': True, 'num_snps': 21663}. Best is trial 60 with value: 0.29255876736872977.
[I 2025-12-09 18:01:42,222] Trial 64 finished with value: 0.2796074335995977 and parameters: {'model_type': 'graphsage', 'hidden_dims': '[512, 128]', 'dropout': 0.38419322393288163, 'batch_norm': True, 'sage_aggr': 'mean', 'sage_normalize': True, 'sage_project': False, 'lr': 4.0369145231223795e-05, 'weight_decay': 1.5553880527028494e-07, 'epochs': 245, 'loss': 'mse', 'optimizer': 'adam', 'graph_mode': 'cutoff', 'cutoff': 0.46332060539400877, 'grm_norm': 'gcn', 'self_loops': False, 'use_snp_selection': True, 'num_snps': 21633}. Best is trial 60 with value: 0.29255876736872977.
[I 2025-12-09 18:02:31,273] Trial 65 finished with value: 0.29269515664515533 and parameters: {'model_type': 'graphsage', 'hidden_dims': '[512, 128]', 'dropout': 0.42132794692285325, 'batch_norm': True, 'sage_aggr': 'mean', 'sage_normalize': True, 'sage_project': False, 'lr': 0.0001384212359890609, 'weight_decay': 2.8870169521858166e-07, 'epochs': 235, 'loss': 'mse', 'optimizer': 'adam', 'graph_mode': 'cutoff', 'cutoff': 0.5026313652997771, 'grm_norm': 'gcn', 'self_loops': False, 'use_snp_selection': True, 'num_snps': 10776}. Best is trial 65 with value: 0.29269515664515533.
[I 2025-12-09 18:03:20,518] Trial 66 finished with value: 0.2847848865468679 and parameters: {'model_type': 'graphsage', 'hidden_dims': '[512, 128]', 'dropout': 0.42403757785783236, 'batch_norm': True, 'sage_aggr': 'mean', 'sage_normalize': True, 'sage_project': False, 'lr': 6.998498874385425e-05, 'weight_decay': 3.3031147425921193e-07, 'epochs': 235, 'loss': 'mse', 'optimizer': 'adam', 'graph_mode': 'cutoff', 'cutoff': 0.4938086873417947, 'grm_norm': 'gcn', 'self_loops': False, 'use_snp_selection': True, 'num_snps': 10862}. Best is trial 65 with value: 0.29269515664515533.
[I 2025-12-09 18:04:32,867] Trial 67 finished with value: 0.28440639460122774 and parameters: {'model_type': 'graphsage', 'hidden_dims': '[512, 128]', 'dropout': 0.46152038160109726, 'batch_norm': True, 'sage_aggr': 'mean', 'sage_normalize': True, 'sage_project': False, 'lr': 0.000143298315083784, 'weight_decay': 1.0224058799329451e-07, 'epochs': 261, 'loss': 'mse', 'optimizer': 'adam', 'graph_mode': 'cutoff', 'cutoff': 0.40368696199508636, 'grm_norm': 'gcn', 'self_loops': False, 'use_snp_selection': True, 'num_snps': 19583}. Best is trial 65 with value: 0.29269515664515533.
[I 2025-12-09 18:05:18,754] Trial 68 finished with value: 0.2757738276962143 and parameters: {'model_type': 'graphsage', 'hidden_dims': '[512, 128]', 'dropout': 0.4153951009255141, 'batch_norm': True, 'sage_aggr': 'mean', 'sage_normalize': True, 'sage_project': False, 'lr': 9.201395927904859e-05, 'weight_decay': 5.300632346558184e-07, 'epochs': 274, 'loss': 'mse', 'optimizer': 'adam', 'graph_mode': 'cutoff', 'cutoff': 0.5141899487932801, 'grm_norm': 'gcn', 'self_loops': False, 'use_snp_selection': True, 'num_snps': 8540}. Best is trial 65 with value: 0.29269515664515533.
[I 2025-12-09 18:07:03,695] Trial 69 finished with value: 0.28900770240134993 and parameters: {'model_type': 'graphsage', 'hidden_dims': '[512, 128]', 'dropout': 0.38832196315907475, 'batch_norm': True, 'sage_aggr': 'mean', 'sage_normalize': True, 'sage_project': False, 'lr': 0.00011038084194207136, 'weight_decay': 2.3510486953834374e-07, 'epochs': 287, 'loss': 'mse', 'optimizer': 'adam', 'graph_mode': 'cutoff', 'cutoff': 0.4754845954769831, 'grm_norm': 'gcn', 'self_loops': False, 'use_snp_selection': True, 'num_snps': 28398}. Best is trial 65 with value: 0.29269515664515533.
[I 2025-12-09 18:08:50,818] Trial 70 finished with value: 0.2887992769905298 and parameters: {'model_type': 'graphsage', 'hidden_dims': '[512, 128]', 'dropout': 0.3259934422365414, 'batch_norm': True, 'sage_aggr': 'mean', 'sage_normalize': True, 'sage_project': False, 'lr': 0.00011508459931450774, 'weight_decay': 2.066431077881483e-07, 'epochs': 301, 'loss': 'mse', 'optimizer': 'adam', 'graph_mode': 'cutoff', 'cutoff': 0.4422994459196239, 'grm_norm': 'gcn', 'self_loops': False, 'use_snp_selection': True, 'num_snps': 27473}. Best is trial 65 with value: 0.29269515664515533.
[I 2025-12-09 18:10:52,212] Trial 71 finished with value: 0.2956582821015444 and parameters: {'model_type': 'graphsage', 'hidden_dims': '[512, 128]', 'dropout': 0.3244807925882669, 'batch_norm': True, 'sage_aggr': 'mean', 'sage_normalize': True, 'sage_project': False, 'lr': 0.00010584542271262533, 'weight_decay': 2.196540700303518e-07, 'epochs': 300, 'loss': 'mse', 'optimizer': 'adam', 'graph_mode': 'cutoff', 'cutoff': 0.37076353170978593, 'grm_norm': 'gcn', 'self_loops': False, 'use_snp_selection': True, 'num_snps': 30480}. Best is trial 71 with value: 0.2956582821015444.
[I 2025-12-09 18:13:01,468] Trial 72 finished with value: 0.2901795341428443 and parameters: {'model_type': 'graphsage', 'hidden_dims': '[512, 128]', 'dropout': 0.31876524806597867, 'batch_norm': True, 'sage_aggr': 'mean', 'sage_normalize': True, 'sage_project': False, 'lr': 0.00010664548081366585, 'weight_decay': 2.2847223110510448e-07, 'epochs': 297, 'loss': 'mse', 'optimizer': 'adam', 'graph_mode': 'cutoff', 'cutoff': 0.34040335108406783, 'grm_norm': 'gcn', 'self_loops': False, 'use_snp_selection': True, 'num_snps': 29923}. Best is trial 71 with value: 0.2956582821015444.
[I 2025-12-09 18:15:22,462] Trial 73 finished with value: 0.2840968807400624 and parameters: {'model_type': 'graphsage', 'hidden_dims': '[512, 128]', 'dropout': 0.32479295895593324, 'batch_norm': True, 'sage_aggr': 'mean', 'sage_normalize': True, 'sage_project': False, 'lr': 0.00010920481774775033, 'weight_decay': 2.329228873375809e-07, 'epochs': 299, 'loss': 'mse', 'optimizer': 'adam', 'graph_mode': 'cutoff', 'cutoff': 0.30534917303538067, 'grm_norm': 'gcn', 'self_loops': False, 'use_snp_selection': True, 'num_snps': 30364}. Best is trial 71 with value: 0.2956582821015444.
[I 2025-12-09 18:17:32,289] Trial 74 finished with value: 0.285178372255816 and parameters: {'model_type': 'graphsage', 'hidden_dims': '[512, 128]', 'dropout': 0.3857886393717185, 'batch_norm': True, 'sage_aggr': 'mean', 'sage_normalize': True, 'sage_project': False, 'lr': 5.0636658406922123e-05, 'weight_decay': 2.0128050237720096e-07, 'epochs': 334, 'loss': 'mse', 'optimizer': 'adam', 'graph_mode': 'cutoff', 'cutoff': 0.37327332192283047, 'grm_norm': 'gcn', 'self_loops': False, 'use_snp_selection': True, 'num_snps': 29294}. Best is trial 71 with value: 0.2956582821015444.
[I 2025-12-09 18:19:35,646] Trial 75 finished with value: 0.28593774956629897 and parameters: {'model_type': 'graphsage', 'hidden_dims': '[512, 128]', 'dropout': 0.49657236352258166, 'batch_norm': True, 'sage_aggr': 'mean', 'sage_normalize': True, 'sage_project': False, 'lr': 6.84191416925711e-05, 'weight_decay': 4.141715359765611e-07, 'epochs': 301, 'loss': 'mse', 'optimizer': 'adam', 'graph_mode': 'cutoff', 'cutoff': 0.3016667302937478, 'grm_norm': 'gcn', 'self_loops': False, 'use_snp_selection': True, 'num_snps': 25894}. Best is trial 71 with value: 0.2956582821015444.
[I 2025-12-09 18:21:46,917] Trial 76 finished with value: 0.29102760782691844 and parameters: {'model_type': 'graphsage', 'hidden_dims': '[512, 128]', 'dropout': 0.3153639966401837, 'batch_norm': True, 'sage_aggr': 'mean', 'sage_normalize': True, 'sage_project': False, 'lr': 0.0001721619314624951, 'weight_decay': 2.6796417526465584e-07, 'epochs': 284, 'loss': 'mse', 'optimizer': 'adam', 'graph_mode': 'cutoff', 'cutoff': 0.3971217129769289, 'grm_norm': 'gcn', 'self_loops': False, 'use_snp_selection': True, 'num_snps': 33603}. Best is trial 71 with value: 0.2956582821015444.
[I 2025-12-09 18:24:27,106] Trial 77 finished with value: 0.2652379178576951 and parameters: {'model_type': 'graphsage', 'hidden_dims': '[512, 128]', 'dropout': 0.43481335144454375, 'batch_norm': True, 'sage_aggr': 'mean', 'sage_normalize': True, 'sage_project': False, 'lr': 0.0001837195656251933, 'weight_decay': 2.800675546284319e-07, 'epochs': 285, 'loss': 'mse', 'optimizer': 'adam', 'graph_mode': 'knn', 'knn_k': 4, 'weighted_edges': True, 'symmetrize_mode': 'union', 'self_loops': False, 'use_snp_selection': True, 'num_snps': 35279}. Best is trial 71 with value: 0.2956582821015444.
[I 2025-12-09 18:25:49,283] Trial 78 finished with value: 0.2923128671260251 and parameters: {'model_type': 'graphsage', 'hidden_dims': '[512, 128]', 'dropout': 0.3733787883377253, 'batch_norm': True, 'sage_aggr': 'mean', 'sage_normalize': True, 'sage_project': False, 'lr': 9.175207595809172e-05, 'weight_decay': 6.526322439349586e-07, 'epochs': 328, 'loss': 'mse', 'optimizer': 'adam', 'graph_mode': 'cutoff', 'cutoff': 0.39366981235330284, 'grm_norm': 'gcn', 'self_loops': False, 'use_snp_selection': True, 'num_snps': 18329}. Best is trial 71 with value: 0.2956582821015444.
[I 2025-12-09 18:26:49,431] Trial 79 finished with value: 0.28544327523200147 and parameters: {'model_type': 'graphsage', 'hidden_dims': '[512, 128]', 'dropout': 0.3533304965896386, 'batch_norm': True, 'sage_aggr': 'mean', 'sage_normalize': True, 'sage_project': False, 'lr': 8.76189627663157e-05, 'weight_decay': 6.635091073329725e-07, 'epochs': 323, 'loss': 'mse', 'optimizer': 'adam', 'graph_mode': 'cutoff', 'cutoff': 0.38471015776719913, 'grm_norm': 'gcn', 'self_loops': False, 'use_snp_selection': True, 'num_snps': 11443}. Best is trial 71 with value: 0.2956582821015444.
[I 2025-12-09 18:29:51,307] Trial 80 finished with value: 0.2864114038466818 and parameters: {'model_type': 'graphsage', 'hidden_dims': '[512, 128]', 'dropout': 0.31461401843127956, 'batch_norm': True, 'sage_aggr': 'mean', 'sage_normalize': True, 'sage_project': False, 'lr': 4.152143874894257e-05, 'weight_decay': 4.0796241239710326e-07, 'epochs': 325, 'loss': 'mse', 'optimizer': 'adam', 'graph_mode': 'cutoff', 'cutoff': 0.3406399804731775, 'grm_norm': 'gcn', 'self_loops': False, 'use_snp_selection': True, 'num_snps': 39020}. Best is trial 71 with value: 0.2956582821015444.
[I 2025-12-09 18:31:13,203] Trial 81 finished with value: 0.29074825309413554 and parameters: {'model_type': 'graphsage', 'hidden_dims': '[512, 128]', 'dropout': 0.3971501114158626, 'batch_norm': True, 'sage_aggr': 'mean', 'sage_normalize': True, 'sage_project': False, 'lr': 0.00017446792186782332, 'weight_decay': 3.406000652775293e-07, 'epochs': 345, 'loss': 'mse', 'optimizer': 'adam', 'graph_mode': 'cutoff', 'cutoff': 0.4775179566796958, 'grm_norm': 'gcn', 'self_loops': False, 'use_snp_selection': True, 'num_snps': 18557}. Best is trial 71 with value: 0.2956582821015444.
[I 2025-12-09 18:32:37,402] Trial 82 finished with value: 0.28683857383050365 and parameters: {'model_type': 'graphsage', 'hidden_dims': '[512, 128]', 'dropout': 0.4047211101947713, 'batch_norm': True, 'sage_aggr': 'mean', 'sage_normalize': True, 'sage_project': False, 'lr': 0.0001811024308621993, 'weight_decay': 3.5851524117368903e-07, 'epochs': 350, 'loss': 'mse', 'optimizer': 'adam', 'graph_mode': 'cutoff', 'cutoff': 0.40703103291973586, 'grm_norm': 'gcn', 'self_loops': False, 'use_snp_selection': True, 'num_snps': 18857}. Best is trial 71 with value: 0.2956582821015444.
[I 2025-12-09 18:35:23,213] Trial 83 finished with value: 0.28581134581604667 and parameters: {'model_type': 'graphsage', 'hidden_dims': '[512, 128]', 'dropout': 0.39765584092921374, 'batch_norm': True, 'sage_aggr': 'mean', 'sage_normalize': True, 'sage_project': False, 'lr': 6.438988853927663e-05, 'weight_decay': 5.415234544806281e-07, 'epochs': 311, 'loss': 'mse', 'optimizer': 'adam', 'graph_mode': 'cutoff', 'cutoff': 0.28736127429995456, 'grm_norm': 'gcn', 'self_loops': False, 'use_snp_selection': True, 'num_snps': 31960}. Best is trial 71 with value: 0.2956582821015444.
