[I 2025-12-09 16:10:17,752] Trial 7 finished with value: 0.26859908017687495 and parameters: {'model_type': 'graphsage', 'hidden_dims': '[512, 64]', 'dropout': 0.2585007811528941, 'batch_norm': True, 'sage_aggr': 'max', 'sage_normalize': True, 'sage_project': False, 'lr': 5.921425508303391e-05, 'weight_decay': 0.0004511561961144237, 'epochs': 182, 'loss': 'mae', 'optimizer': 'adam', 'graph_mode': 'knn', 'knn_k': 9, 'weighted_edges': True, 'symmetrize_mode': 'union', 'self_loops': False, 'use_snp_selection': True, 'num_snps': 23903}. Best is trial 6 with value: 0.2895681430968783.
[I 2025-12-09 16:10:43,736] Trial 8 finished with value: 0.2514227905630152 and parameters: {'model_type': 'graphsage', 'hidden_dims': '[512, 256]', 'dropout': 0.3061380386767003, 'batch_norm': False, 'sage_aggr': 'mean', 'sage_normalize': True, 'sage_project': False, 'lr': 0.000698401460570184, 'weight_decay': 2.965560055460244e-06, 'epochs': 289, 'loss': 'mae', 'optimizer': 'adam', 'graph_mode': 'knn', 'knn_k': 7, 'weighted_edges': False, 'symmetrize_mode': 'mutual', 'self_loops': True, 'use_snp_selection': True, 'num_snps': 4710}. Best is trial 6 with value: 0.2895681430968783.
[I 2025-12-09 16:15:54,448] Trial 9 finished with value: 0.2968904115346363 and parameters: {'model_type': 'graphsage', 'hidden_dims': '[512, 128]', 'dropout': 0.1733844071393634, 'batch_norm': False, 'sage_aggr': 'mean', 'sage_normalize': True, 'sage_project': False, 'lr': 0.0004269677918501597, 'weight_decay': 2.2439779626249696e-06, 'epochs': 319, 'loss': 'mse', 'optimizer': 'adam', 'graph_mode': 'cutoff', 'cutoff': 0.24117565767129295, 'grm_norm': 'cosine_then_gcn', 'self_loops': True, 'use_snp_selection': False}. Best is trial 9 with value: 0.2968904115346363.
[I 2025-12-09 16:21:24,415] Trial 10 finished with value: 0.2757739232845885 and parameters: {'model_type': 'graphsage', 'hidden_dims': '[512, 128]', 'dropout': 0.5365714961141473, 'batch_norm': False, 'sage_aggr': 'mean', 'sage_normalize': True, 'sage_project': False, 'lr': 0.004737327072203749, 'weight_decay': 7.303103160282385e-07, 'epochs': 299, 'loss': 'mse', 'optimizer': 'adam', 'graph_mode': 'cutoff', 'cutoff': 0.21281628365523453, 'grm_norm': 'cosine_then_gcn', 'self_loops': True, 'use_snp_selection': False}. Best is trial 9 with value: 0.2968904115346363.
[I 2025-12-09 16:21:40,795] Trial 11 finished with value: 0.1639424213867033 and parameters: {'model_type': 'graphsage', 'hidden_dims': '[256, 128]', 'dropout': 0.10328191384162141, 'batch_norm': False, 'sage_aggr': 'mean', 'sage_normalize': False, 'sage_project': False, 'lr': 0.001954403550457137, 'weight_decay': 3.05795292129246e-05, 'epochs': 49, 'loss': 'mae', 'optimizer': 'adam', 'graph_mode': 'cutoff', 'cutoff': 0.8822531113253764, 'grm_norm': 'none', 'self_loops': True, 'use_snp_selection': False}. Best is trial 9 with value: 0.2968904115346363.
[I 2025-12-09 16:23:20,009] Trial 12 finished with value: 0.25205426654672675 and parameters: {'model_type': 'graphsage', 'hidden_dims': '[256, 128, 64]', 'dropout': 0.45056085137293955, 'batch_norm': True, 'sage_aggr': 'mean', 'sage_normalize': True, 'sage_project': False, 'lr': 0.00013733087283801813, 'weight_decay': 5.2104031802411976e-05, 'epochs': 345, 'loss': 'mse', 'optimizer': 'adam', 'graph_mode': 'cutoff', 'cutoff': 0.8087429324628925, 'grm_norm': 'cosine', 'self_loops': True, 'use_snp_selection': False}. Best is trial 9 with value: 0.2968904115346363.
[I 2025-12-09 16:24:52,671] Trial 13 finished with value: 0.07352770120737721 and parameters: {'model_type': 'graphsage', 'hidden_dims': '[256, 128, 64]', 'dropout': 0.17858025577407707, 'batch_norm': False, 'sage_aggr': 'mean', 'sage_normalize': False, 'sage_project': False, 'lr': 0.0014626888081117134, 'weight_decay': 2.709093360195289e-06, 'epochs': 48, 'loss': 'mae', 'optimizer': 'adam', 'graph_mode': 'cutoff', 'cutoff': 0.2203328435135632, 'grm_norm': 'cosine_then_gcn', 'self_loops': True, 'use_snp_selection': True, 'num_snps': 58094}. Best is trial 9 with value: 0.2968904115346363.
[I 2025-12-09 16:25:46,998] Trial 14 finished with value: 0.3045993600847188 and parameters: {'model_type': 'graphsage', 'hidden_dims': '[512, 128]', 'dropout': 0.10255743378718205, 'batch_norm': True, 'sage_aggr': 'mean', 'sage_normalize': False, 'sage_project': False, 'lr': 0.00018147187815803901, 'weight_decay': 0.000929256360284688, 'epochs': 101, 'loss': 'mae', 'optimizer': 'adam', 'graph_mode': 'cutoff', 'cutoff': 0.6342262445147304, 'grm_norm': 'none', 'self_loops': True, 'use_snp_selection': True, 'num_snps': 44246}. Best is trial 14 with value: 0.3045993600847188.
[I 2025-12-09 16:26:58,662] Trial 15 finished with value: 0.26260849855248647 and parameters: {'model_type': 'graphsage', 'hidden_dims': '[512, 128]', 'dropout': 0.20906026130589128, 'batch_norm': False, 'sage_aggr': 'mean', 'sage_normalize': True, 'sage_project': False, 'lr': 0.00017741034581641971, 'weight_decay': 1.0147826271692032e-05, 'epochs': 110, 'loss': 'mse', 'optimizer': 'adam', 'graph_mode': 'cutoff', 'cutoff': 0.46843728256195905, 'grm_norm': 'cosine_then_gcn', 'self_loops': True, 'use_snp_selection': False}. Best is trial 14 with value: 0.3045993600847188.
[I 2025-12-09 16:29:00,284] Trial 16 finished with value: 0.020304756352972464 and parameters: {'model_type': 'graphsage', 'hidden_dims': '[512, 128]', 'dropout': 0.43496482955272026, 'batch_norm': False, 'sage_aggr': 'mean', 'sage_normalize': False, 'sage_project': False, 'lr': 0.0010014902752430645, 'weight_decay': 1.1967526565722927e-07, 'epochs': 227, 'loss': 'mse', 'optimizer': 'adam', 'graph_mode': 'cutoff', 'cutoff': 0.6064069599959692, 'grm_norm': 'cosine', 'self_loops': True, 'use_snp_selection': False}. Best is trial 14 with value: 0.3045993600847188.
[I 2025-12-09 16:30:14,357] Trial 17 finished with value: 0.28606965258821526 and parameters: {'model_type': 'graphsage', 'hidden_dims': '[512, 128]', 'dropout': 0.15808666146923367, 'batch_norm': True, 'sage_aggr': 'mean', 'sage_normalize': True, 'sage_project': False, 'lr': 0.004639666206941278, 'weight_decay': 0.0009434791891988081, 'epochs': 94, 'loss': 'mae', 'optimizer': 'adam', 'graph_mode': 'cutoff', 'cutoff': 0.3734963434506495, 'grm_norm': 'gcn', 'self_loops': True, 'use_snp_selection': True, 'num_snps': 38010}. Best is trial 14 with value: 0.3045993600847188.
[I 2025-12-09 16:31:53,952] Trial 18 finished with value: 0.3062053724760559 and parameters: {'model_type': 'graphsage', 'hidden_dims': '[256, 128]', 'dropout': 0.4052988607401715, 'batch_norm': True, 'sage_aggr': 'mean', 'sage_normalize': False, 'sage_project': False, 'lr': 0.0002202091846615283, 'weight_decay': 5.81186101124253e-07, 'epochs': 349, 'loss': 'mse', 'optimizer': 'adam', 'graph_mode': 'cutoff', 'cutoff': 0.6864095140981994, 'grm_norm': 'cosine_then_gcn', 'self_loops': False, 'use_snp_selection': False}. Best is trial 18 with value: 0.3062053724760559.
[I 2025-12-09 16:32:18,707] Trial 19 finished with value: 0.29446178187139593 and parameters: {'model_type': 'graphsage', 'hidden_dims': '[256, 128]', 'dropout': 0.41667694898393676, 'batch_norm': True, 'sage_aggr': 'mean', 'sage_normalize': False, 'sage_project': False, 'lr': 0.00018092475025861444, 'weight_decay': 4.324062411699967e-07, 'epochs': 242, 'loss': 'mae', 'optimizer': 'adam', 'graph_mode': 'cutoff', 'cutoff': 0.683524003647006, 'grm_norm': 'none', 'self_loops': False, 'use_snp_selection': True, 'num_snps': 13140}. Best is trial 18 with value: 0.3062053724760559.
[I 2025-12-09 16:32:55,861] Trial 20 finished with value: 0.3088351069026947 and parameters: {'model_type': 'graphsage', 'hidden_dims': '[256, 128]', 'dropout': 0.5754751662401014, 'batch_norm': True, 'sage_aggr': 'mean', 'sage_normalize': False, 'sage_project': False, 'lr': 0.00916401334230661, 'weight_decay': 1.168016445406286e-05, 'epochs': 98, 'loss': 'mae', 'optimizer': 'adam', 'graph_mode': 'cutoff', 'cutoff': 0.6994130241494052, 'grm_norm': 'cosine_then_gcn', 'self_loops': False, 'use_snp_selection': True, 'num_snps': 43736}. Best is trial 20 with value: 0.3088351069026947.
[I 2025-12-09 16:33:31,009] Trial 21 finished with value: 0.3129010512387002 and parameters: {'model_type': 'graphsage', 'hidden_dims': '[256, 128]', 'dropout': 0.5810427469157409, 'batch_norm': True, 'sage_aggr': 'mean', 'sage_normalize': False, 'sage_project': False, 'lr': 0.008215200603949051, 'weight_decay': 1.583295836421477e-05, 'epochs': 89, 'loss': 'mae', 'optimizer': 'adam', 'graph_mode': 'cutoff', 'cutoff': 0.693086005084648, 'grm_norm': 'cosine_then_gcn', 'self_loops': False, 'use_snp_selection': True, 'num_snps': 43978}. Best is trial 21 with value: 0.3129010512387002.
[I 2025-12-09 16:34:04,084] Trial 22 finished with value: 0.3094098128615056 and parameters: {'model_type': 'graphsage', 'hidden_dims': '[256, 128]', 'dropout': 0.5920064094085478, 'batch_norm': True, 'sage_aggr': 'mean', 'sage_normalize': False, 'sage_project': False, 'lr': 0.008866828878040911, 'weight_decay': 1.2493857550188618e-05, 'epochs': 80, 'loss': 'mae', 'optimizer': 'adam', 'graph_mode': 'cutoff', 'cutoff': 0.7140310083323519, 'grm_norm': 'cosine_then_gcn', 'self_loops': False, 'use_snp_selection': True, 'num_snps': 44064}. Best is trial 21 with value: 0.3129010512387002.
[I 2025-12-09 16:34:36,452] Trial 23 finished with value: 0.3110734027682821 and parameters: {'model_type': 'graphsage', 'hidden_dims': '[256, 128]', 'dropout': 0.596777235026267, 'batch_norm': True, 'sage_aggr': 'mean', 'sage_normalize': False, 'sage_project': False, 'lr': 0.009463136088492878, 'weight_decay': 1.7118950171328104e-05, 'epochs': 83, 'loss': 'mae', 'optimizer': 'adam', 'graph_mode': 'cutoff', 'cutoff': 0.7643753567166948, 'grm_norm': 'cosine_then_gcn', 'self_loops': False, 'use_snp_selection': True, 'num_snps': 42061}. Best is trial 21 with value: 0.3129010512387002.
[I 2025-12-09 16:35:17,335] Trial 24 finished with value: 0.3082713207412512 and parameters: {'model_type': 'graphsage', 'hidden_dims': '[256, 128]', 'dropout': 0.5223718934460381, 'batch_norm': True, 'sage_aggr': 'mean', 'sage_normalize': False, 'sage_project': False, 'lr': 0.008847342248184039, 'weight_decay': 1.7376890902530003e-05, 'epochs': 126, 'loss': 'mae', 'optimizer': 'adam', 'graph_mode': 'cutoff', 'cutoff': 0.8195754483880213, 'grm_norm': 'cosine_then_gcn', 'self_loops': False, 'use_snp_selection': True, 'num_snps': 41840}. Best is trial 21 with value: 0.3129010512387002.
[I 2025-12-09 16:35:55,301] Trial 25 finished with value: 0.3127306780597497 and parameters: {'model_type': 'graphsage', 'hidden_dims': '[256, 128]', 'dropout': 0.5993598374608993, 'batch_norm': True, 'sage_aggr': 'mean', 'sage_normalize': False, 'sage_project': False, 'lr': 0.003162425043538749, 'weight_decay': 4.964444870370549e-06, 'epochs': 74, 'loss': 'mae', 'optimizer': 'adam', 'graph_mode': 'cutoff', 'cutoff': 0.748757026001022, 'grm_norm': 'cosine_then_gcn', 'self_loops': False, 'use_snp_selection': True, 'num_snps': 54638}. Best is trial 21 with value: 0.3129010512387002.
[I 2025-12-09 16:36:35,032] Trial 26 finished with value: 0.3124046494421237 and parameters: {'model_type': 'graphsage', 'hidden_dims': '[256, 128]', 'dropout': 0.49950808762983, 'batch_norm': True, 'sage_aggr': 'mean', 'sage_normalize': False, 'sage_project': False, 'lr': 0.003288255938826253, 'weight_decay': 4.4073140400600456e-06, 'epochs': 68, 'loss': 'mae', 'optimizer': 'adam', 'graph_mode': 'cutoff', 'cutoff': 0.8968287742995075, 'grm_norm': 'cosine_then_gcn', 'self_loops': False, 'use_snp_selection': True, 'num_snps': 58061}. Best is trial 21 with value: 0.3129010512387002.
[I 2025-12-09 16:37:35,099] Trial 27 finished with value: 0.3118510519601895 and parameters: {'model_type': 'graphsage', 'hidden_dims': '[256, 128]', 'dropout': 0.49270603624674925, 'batch_norm': True, 'sage_aggr': 'mean', 'sage_normalize': False, 'sage_project': False, 'lr': 0.0031793348998411367, 'weight_decay': 5.736601900544193e-06, 'epochs': 129, 'loss': 'mae', 'optimizer': 'adam', 'graph_mode': 'cutoff', 'cutoff': 0.8981822966183226, 'grm_norm': 'cosine_then_gcn', 'self_loops': False, 'use_snp_selection': True, 'num_snps': 59940}. Best is trial 21 with value: 0.3129010512387002.
[I 2025-12-09 16:38:07,066] Trial 28 finished with value: 0.31620296329527353 and parameters: {'model_type': 'graphsage', 'hidden_dims': '[256, 128]', 'dropout': 0.5502995996885128, 'batch_norm': True, 'sage_aggr': 'mean', 'sage_normalize': False, 'sage_project': False, 'lr': 0.002570278792207418, 'weight_decay': 1.4191236169304608e-06, 'epochs': 58, 'loss': 'mae', 'optimizer': 'adam', 'graph_mode': 'cutoff', 'cutoff': 0.821678999174851, 'grm_norm': 'gcn', 'self_loops': False, 'use_snp_selection': True, 'num_snps': 50590}. Best is trial 28 with value: 0.31620296329527353.
[I 2025-12-09 16:38:46,973] Trial 29 finished with value: 0.2567879973931321 and parameters: {'model_type': 'graphsage', 'hidden_dims': '[128, 64]', 'dropout': 0.5542718652029052, 'batch_norm': True, 'sage_aggr': 'max', 'sage_normalize': False, 'sage_project': False, 'lr': 0.002132223164954542, 'weight_decay': 1.1714840232449118e-06, 'epochs': 40, 'loss': 'mae', 'optimizer': 'adam', 'graph_mode': 'knn', 'knn_k': 4, 'weighted_edges': True, 'symmetrize_mode': 'union', 'self_loops': False, 'use_snp_selection': True, 'num_snps': 50612}. Best is trial 28 with value: 0.31620296329527353.
[I 2025-12-09 16:39:37,686] Trial 30 finished with value: 0.31208127756933385 and parameters: {'model_type': 'graphsage', 'hidden_dims': '[256, 128]', 'dropout': 0.4765688849035783, 'batch_norm': True, 'sage_aggr': 'mean', 'sage_normalize': False, 'sage_project': False, 'lr': 0.005104923590548838, 'weight_decay': 1.4209963181600596e-06, 'epochs': 120, 'loss': 'mae', 'optimizer': 'adam', 'graph_mode': 'cutoff', 'cutoff': 0.8166436698213461, 'grm_norm': 'gcn', 'self_loops': False, 'use_snp_selection': True, 'num_snps': 53049}. Best is trial 28 with value: 0.31620296329527353.
[I 2025-12-09 16:40:13,929] Trial 31 finished with value: 0.31247952547801816 and parameters: {'model_type': 'graphsage', 'hidden_dims': '[256, 128]', 'dropout': 0.5018119370539919, 'batch_norm': True, 'sage_aggr': 'mean', 'sage_normalize': False, 'sage_project': False, 'lr': 0.003419918112464345, 'weight_decay': 3.5273939885854494e-06, 'epochs': 66, 'loss': 'mae', 'optimizer': 'adam', 'graph_mode': 'cutoff', 'cutoff': 0.8551525406268705, 'grm_norm': 'gcn', 'self_loops': False, 'use_snp_selection': True, 'num_snps': 55382}. Best is trial 28 with value: 0.31620296329527353.
[I 2025-12-09 16:40:49,917] Trial 32 finished with value: 0.31632202257022557 and parameters: {'model_type': 'graphsage', 'hidden_dims': '[256, 128]', 'dropout': 0.5614755584693105, 'batch_norm': True, 'sage_aggr': 'mean', 'sage_normalize': False, 'sage_project': False, 'lr': 0.0010013594349679764, 'weight_decay': 0.00010266475015742625, 'epochs': 68, 'loss': 'mae', 'optimizer': 'adam', 'graph_mode': 'cutoff', 'cutoff': 0.7602870556200158, 'grm_norm': 'gcn', 'self_loops': False, 'use_snp_selection': True, 'num_snps': 53115}. Best is trial 32 with value: 0.31632202257022557.
[I 2025-12-09 16:41:24,798] Trial 33 finished with value: 0.3182853363930097 and parameters: {'model_type': 'graphsage', 'hidden_dims': '[256, 128]', 'dropout': 0.5640061384020474, 'batch_norm': True, 'sage_aggr': 'mean', 'sage_normalize': False, 'sage_project': False, 'lr': 0.0009660873144090066, 'weight_decay': 0.00012116707840710325, 'epochs': 79, 'loss': 'mae', 'optimizer': 'adam', 'graph_mode': 'cutoff', 'cutoff': 0.7525793941508319, 'grm_norm': 'gcn', 'self_loops': False, 'use_snp_selection': True, 'num_snps': 46716}. Best is trial 33 with value: 0.3182853363930097.
[I 2025-12-09 16:42:15,629] Trial 34 finished with value: 0.31578325747955505 and parameters: {'model_type': 'graphsage', 'hidden_dims': '[256, 128]', 'dropout': 0.559533701699152, 'batch_norm': True, 'sage_aggr': 'max', 'sage_normalize': False, 'sage_project': False, 'lr': 0.0006953792299814445, 'weight_decay': 9.974896261011789e-05, 'epochs': 140, 'loss': 'mae', 'optimizer': 'adam', 'graph_mode': 'cutoff', 'cutoff': 0.785748836509143, 'grm_norm': 'gcn', 'self_loops': False, 'use_snp_selection': True, 'num_snps': 47765}. Best is trial 33 with value: 0.3182853363930097.
[I 2025-12-09 16:44:33,689] Trial 35 finished with value: 0.2663574953864207 and parameters: {'model_type': 'graphsage', 'hidden_dims': '[512, 256]', 'dropout': 0.554834820509343, 'batch_norm': True, 'sage_aggr': 'max', 'sage_normalize': False, 'sage_project': False, 'lr': 0.0012397260341935358, 'weight_decay': 0.0001293241186439139, 'epochs': 144, 'loss': 'mae', 'optimizer': 'adam', 'graph_mode': 'knn', 'knn_k': 4, 'weighted_edges': False, 'symmetrize_mode': 'union', 'self_loops': False, 'use_snp_selection': True, 'num_snps': 50023}. Best is trial 33 with value: 0.3182853363930097.
[I 2025-12-09 16:45:10,046] Trial 36 finished with value: 0.30374975999809817 and parameters: {'model_type': 'graphsage', 'hidden_dims': '[128, 64]', 'dropout': 0.38829142738941724, 'batch_norm': True, 'sage_aggr': 'max', 'sage_normalize': False, 'sage_project': False, 'lr': 0.0006511731744609308, 'weight_decay': 0.00018625730690977337, 'epochs': 213, 'loss': 'mae', 'optimizer': 'adam', 'graph_mode': 'cutoff', 'cutoff': 0.7815605719832056, 'grm_norm': 'gcn', 'self_loops': False, 'use_snp_selection': True, 'num_snps': 35425}. Best is trial 33 with value: 0.3182853363930097.
[I 2025-12-09 16:46:32,035] Trial 37 finished with value: 0.3136940138027637 and parameters: {'model_type': 'graphsage', 'hidden_dims': '[512, 64]', 'dropout': 0.5297613131888538, 'batch_norm': True, 'sage_aggr': 'max', 'sage_normalize': False, 'sage_project': False, 'lr': 0.0005478195007906965, 'weight_decay': 0.00035964848245493913, 'epochs': 162, 'loss': 'mae', 'optimizer': 'adam', 'graph_mode': 'cutoff', 'cutoff': 0.8401449230795573, 'grm_norm': 'gcn', 'self_loops': False, 'use_snp_selection': True, 'num_snps': 47024}. Best is trial 33 with value: 0.3182853363930097.
[I 2025-12-09 16:47:47,147] Trial 38 finished with value: 0.26410407558463783 and parameters: {'model_type': 'graphsage', 'hidden_dims': '[256, 128]', 'dropout': 0.46981838715254637, 'batch_norm': True, 'sage_aggr': 'max', 'sage_normalize': False, 'sage_project': False, 'lr': 0.00029832718913247897, 'weight_decay': 8.893918295761733e-05, 'epochs': 56, 'loss': 'mae', 'optimizer': 'adam', 'graph_mode': 'knn', 'knn_k': 10, 'weighted_edges': False, 'symmetrize_mode': 'union', 'self_loops': False, 'use_snp_selection': True, 'num_snps': 38839}. Best is trial 33 with value: 0.3182853363930097.
[I 2025-12-09 16:49:10,114] Trial 39 finished with value: 0.292743876751251 and parameters: {'model_type': 'graphsage', 'hidden_dims': '[512, 256]', 'dropout': 0.5611796253053872, 'batch_norm': True, 'sage_aggr': 'max', 'sage_normalize': False, 'sage_project': False, 'lr': 0.0009384443126048902, 'weight_decay': 4.6624229638458354e-05, 'epochs': 144, 'loss': 'mae', 'optimizer': 'adam', 'graph_mode': 'cutoff', 'cutoff': 0.5586082388249249, 'grm_norm': 'gcn', 'self_loops': False, 'use_snp_selection': True, 'num_snps': 48013}. Best is trial 33 with value: 0.3182853363930097.
[I 2025-12-09 16:50:13,934] Trial 40 finished with value: 0.28264444586061804 and parameters: {'model_type': 'graphsage', 'hidden_dims': '[512, 64]', 'dropout': 0.520825145698854, 'batch_norm': True, 'sage_aggr': 'max', 'sage_normalize': False, 'sage_project': False, 'lr': 0.0018493392604421943, 'weight_decay': 0.00013572222799519733, 'epochs': 110, 'loss': 'mae', 'optimizer': 'adam', 'graph_mode': 'knn', 'knn_k': 4, 'weighted_edges': True, 'symmetrize_mode': 'union', 'self_loops': False, 'use_snp_selection': True, 'num_snps': 30127}. Best is trial 33 with value: 0.3182853363930097.
[I 2025-12-09 16:51:37,479] Trial 41 finished with value: 0.30792961228751026 and parameters: {'model_type': 'graphsage', 'hidden_dims': '[512, 64]', 'dropout': 0.5328812278602364, 'batch_norm': True, 'sage_aggr': 'max', 'sage_normalize': False, 'sage_project': False, 'lr': 0.0006320594480973862, 'weight_decay': 0.0004261585164537939, 'epochs': 164, 'loss': 'mae', 'optimizer': 'adam', 'graph_mode': 'cutoff', 'cutoff': 0.8128850351984608, 'grm_norm': 'gcn', 'self_loops': False, 'use_snp_selection': True, 'num_snps': 47600}. Best is trial 33 with value: 0.3182853363930097.
[I 2025-12-09 16:53:17,508] Trial 42 finished with value: 0.3118662866075256 and parameters: {'model_type': 'graphsage', 'hidden_dims': '[512, 64]', 'dropout': 0.5552513908971264, 'batch_norm': True, 'sage_aggr': 'max', 'sage_normalize': False, 'sage_project': False, 'lr': 0.0004629264926053757, 'weight_decay': 0.00034331011986045386, 'epochs': 178, 'loss': 'mae', 'optimizer': 'adam', 'graph_mode': 'cutoff', 'cutoff': 0.8500108459348965, 'grm_norm': 'gcn', 'self_loops': False, 'use_snp_selection': True, 'num_snps': 53312}. Best is trial 33 with value: 0.3182853363930097.
[I 2025-12-09 16:55:00,266] Trial 43 finished with value: 0.30973783133894284 and parameters: {'model_type': 'graphsage', 'hidden_dims': '[512, 64]', 'dropout': 0.5196663062149723, 'batch_norm': True, 'sage_aggr': 'max', 'sage_normalize': False, 'sage_project': False, 'lr': 0.0008448431949920254, 'weight_decay': 0.0002206003855226155, 'epochs': 210, 'loss': 'mae', 'optimizer': 'adam', 'graph_mode': 'cutoff', 'cutoff': 0.731422717846814, 'grm_norm': 'gcn', 'self_loops': False, 'use_snp_selection': True, 'num_snps': 47370}. Best is trial 33 with value: 0.3182853363930097.
