[I 2025-12-09 06:15:18,432] Trial 15 finished with value: 0.3042067958296321 and parameters: {'model_type': 'graphsage', 'hidden_dims': '[256, 128]', 'dropout': 0.5959563344733824, 'batch_norm': True, 'sage_aggr': 'max', 'sage_normalize': False, 'sage_project': False, 'lr': 0.002096588809075663, 'weight_decay': 8.736600284532222e-05, 'epochs': 337, 'loss': 'mse', 'optimizer': 'adam', 'graph_mode': 'cutoff', 'cutoff': 0.8973313329898638, 'grm_norm': 'cosine', 'self_loops': True, 'use_snp_selection': False}. Best is trial 14 with value: 0.30743859026058795.
[I 2025-12-09 06:15:43,415] Trial 16 finished with value: 0.31333399213621604 and parameters: {'model_type': 'graphsage', 'hidden_dims': '[256, 128]', 'dropout': 0.42705378978876407, 'batch_norm': True, 'sage_aggr': 'max', 'sage_normalize': False, 'sage_project': False, 'lr': 0.0021273413180799413, 'weight_decay': 0.0006943121180525726, 'epochs': 65, 'loss': 'mse', 'optimizer': 'adam', 'graph_mode': 'cutoff', 'cutoff': 0.8813801726098964, 'grm_norm': 'cosine', 'self_loops': True, 'use_snp_selection': False}. Best is trial 16 with value: 0.31333399213621604.
[I 2025-12-09 06:16:06,501] Trial 17 finished with value: 0.3120089922453609 and parameters: {'model_type': 'graphsage', 'hidden_dims': '[256, 128]', 'dropout': 0.4212983160925956, 'batch_norm': True, 'sage_aggr': 'max', 'sage_normalize': False, 'sage_project': False, 'lr': 0.0016231092551251551, 'weight_decay': 0.0009398660006148266, 'epochs': 56, 'loss': 'mse', 'optimizer': 'adam', 'graph_mode': 'cutoff', 'cutoff': 0.7785386910297676, 'grm_norm': 'cosine', 'self_loops': True, 'use_snp_selection': False}. Best is trial 16 with value: 0.31333399213621604.
[I 2025-12-09 06:16:30,870] Trial 18 finished with value: -0.03941568612154872 and parameters: {'model_type': 'graphsage', 'hidden_dims': '[256, 128]', 'dropout': 0.4184505800329321, 'batch_norm': False, 'sage_aggr': 'mean', 'sage_normalize': False, 'sage_project': False, 'lr': 0.0014618157250936986, 'weight_decay': 0.0009759940319538015, 'epochs': 62, 'loss': 'mse', 'optimizer': 'adam', 'graph_mode': 'cutoff', 'cutoff': 0.7743896139503647, 'grm_norm': 'cosine', 'self_loops': False, 'use_snp_selection': False}. Best is trial 16 with value: 0.31333399213621604.
[I 2025-12-09 06:17:10,854] Trial 19 finished with value: 0.29434002219525024 and parameters: {'model_type': 'graphsage', 'hidden_dims': '[256, 128]', 'dropout': 0.41351899471153286, 'batch_norm': True, 'sage_aggr': 'max', 'sage_normalize': False, 'sage_project': False, 'lr': 0.0010280517891387096, 'weight_decay': 0.0008424554930747332, 'epochs': 101, 'loss': 'mse', 'optimizer': 'adam', 'graph_mode': 'cutoff', 'cutoff': 0.45096531351440755, 'grm_norm': 'cosine', 'self_loops': True, 'use_snp_selection': False}. Best is trial 16 with value: 0.31333399213621604.
[I 2025-12-09 06:17:30,565] Trial 20 finished with value: 0.3114825452476882 and parameters: {'model_type': 'graphsage', 'hidden_dims': '[256, 128]', 'dropout': 0.4128604147512321, 'batch_norm': True, 'sage_aggr': 'max', 'sage_normalize': False, 'sage_project': False, 'lr': 0.0028270433649936278, 'weight_decay': 0.00019984167422125074, 'epochs': 40, 'loss': 'mse', 'optimizer': 'adam', 'graph_mode': 'cutoff', 'cutoff': 0.7378209616212532, 'grm_norm': 'cosine_then_gcn', 'self_loops': True, 'use_snp_selection': False}. Best is trial 16 with value: 0.31333399213621604.
[I 2025-12-09 06:18:03,193] Trial 21 finished with value: 0.31026556299461844 and parameters: {'model_type': 'graphsage', 'hidden_dims': '[256, 128]', 'dropout': 0.4250952267269558, 'batch_norm': True, 'sage_aggr': 'max', 'sage_normalize': False, 'sage_project': False, 'lr': 0.0036367282827401756, 'weight_decay': 0.0002293917129409824, 'epochs': 101, 'loss': 'mse', 'optimizer': 'adam', 'graph_mode': 'cutoff', 'cutoff': 0.7501898429797068, 'grm_norm': 'cosine_then_gcn', 'self_loops': True, 'use_snp_selection': False}. Best is trial 16 with value: 0.31333399213621604.
[I 2025-12-09 06:18:22,897] Trial 22 finished with value: 0.30607216169017615 and parameters: {'model_type': 'graphsage', 'hidden_dims': '[256, 128]', 'dropout': 0.45143143944203185, 'batch_norm': True, 'sage_aggr': 'max', 'sage_normalize': False, 'sage_project': False, 'lr': 0.00013256607502279362, 'weight_decay': 0.00048737564126386185, 'epochs': 40, 'loss': 'mse', 'optimizer': 'adam', 'graph_mode': 'cutoff', 'cutoff': 0.7973370812826049, 'grm_norm': 'cosine_then_gcn', 'self_loops': True, 'use_snp_selection': False}. Best is trial 16 with value: 0.31333399213621604.
[I 2025-12-09 06:18:54,761] Trial 23 finished with value: 0.3090539103607671 and parameters: {'model_type': 'graphsage', 'hidden_dims': '[256, 128]', 'dropout': 0.3882441819800575, 'batch_norm': True, 'sage_aggr': 'max', 'sage_normalize': False, 'sage_project': False, 'lr': 0.0037029189305570875, 'weight_decay': 0.00013927249954682387, 'epochs': 102, 'loss': 'mse', 'optimizer': 'adam', 'graph_mode': 'cutoff', 'cutoff': 0.7504834504317955, 'grm_norm': 'gcn', 'self_loops': True, 'use_snp_selection': False}. Best is trial 16 with value: 0.31333399213621604.
[I 2025-12-09 06:19:14,505] Trial 24 finished with value: 0.3099809247855292 and parameters: {'model_type': 'graphsage', 'hidden_dims': '[256, 128]', 'dropout': 0.4665968118223398, 'batch_norm': True, 'sage_aggr': 'max', 'sage_normalize': False, 'sage_project': False, 'lr': 0.0008688027900647909, 'weight_decay': 0.0004586007210188453, 'epochs': 40, 'loss': 'mse', 'optimizer': 'adam', 'graph_mode': 'cutoff', 'cutoff': 0.8199519404375315, 'grm_norm': 'cosine_then_gcn', 'self_loops': True, 'use_snp_selection': False}. Best is trial 16 with value: 0.31333399213621604.
[I 2025-12-09 06:19:41,374] Trial 25 finished with value: 0.303285061008071 and parameters: {'model_type': 'graphsage', 'hidden_dims': '[256, 128]', 'dropout': 0.3716483547524604, 'batch_norm': True, 'sage_aggr': 'max', 'sage_normalize': False, 'sage_project': False, 'lr': 0.00016817322431803786, 'weight_decay': 0.000820545270998923, 'epochs': 74, 'loss': 'mse', 'optimizer': 'adam', 'graph_mode': 'cutoff', 'cutoff': 0.7069364298351237, 'grm_norm': 'cosine', 'self_loops': True, 'use_snp_selection': False}. Best is trial 16 with value: 0.31333399213621604.
[I 2025-12-09 06:20:25,106] Trial 26 finished with value: 0.30894274244152176 and parameters: {'model_type': 'graphsage', 'hidden_dims': '[256, 128]', 'dropout': 0.4597802195800565, 'batch_norm': True, 'sage_aggr': 'mean', 'sage_normalize': True, 'sage_project': False, 'lr': 0.0016788385827845077, 'weight_decay': 0.00033765145232400275, 'epochs': 116, 'loss': 'mse', 'optimizer': 'adam', 'graph_mode': 'cutoff', 'cutoff': 0.38400890201883053, 'grm_norm': 'cosine', 'self_loops': True, 'use_snp_selection': False}. Best is trial 16 with value: 0.31333399213621604.
[I 2025-12-09 06:20:45,628] Trial 27 finished with value: 0.0 and parameters: {'model_type': 'graphsage', 'hidden_dims': '[128, 64]', 'dropout': 0.5609240239121683, 'batch_norm': False, 'sage_aggr': 'max', 'sage_normalize': False, 'sage_project': False, 'lr': 0.0006460336695966054, 'weight_decay': 0.00012466080137490243, 'epochs': 80, 'loss': 'mae', 'optimizer': 'adam', 'graph_mode': 'cutoff', 'cutoff': 0.6979604228345953, 'grm_norm': 'cosine_then_gcn', 'self_loops': False, 'use_snp_selection': False}. Best is trial 16 with value: 0.31333399213621604.
[I 2025-12-09 06:21:48,273] Trial 28 finished with value: 0.307916634900153 and parameters: {'model_type': 'graphsage', 'hidden_dims': '[512, 64]', 'dropout': 0.36660178406795974, 'batch_norm': True, 'sage_aggr': 'max', 'sage_normalize': False, 'sage_project': False, 'lr': 0.0036123485539295763, 'weight_decay': 0.0005897226919020489, 'epochs': 128, 'loss': 'mse', 'optimizer': 'adam', 'graph_mode': 'cutoff', 'cutoff': 0.8285746652291756, 'grm_norm': 'cosine', 'self_loops': True, 'use_snp_selection': False}. Best is trial 16 with value: 0.31333399213621604.
[I 2025-12-09 06:22:31,253] Trial 29 finished with value: 0.2705994878501833 and parameters: {'model_type': 'graphsage', 'hidden_dims': '[512, 256]', 'dropout': 0.402593664283453, 'batch_norm': True, 'sage_aggr': 'max', 'sage_normalize': True, 'sage_project': False, 'lr': 0.0002581692377442773, 'weight_decay': 0.0002034252124354088, 'epochs': 55, 'loss': 'mse', 'optimizer': 'adam', 'graph_mode': 'knn', 'knn_k': 3, 'weighted_edges': False, 'symmetrize_mode': 'union', 'self_loops': True, 'use_snp_selection': False}. Best is trial 16 with value: 0.31333399213621604.
[I 2025-12-09 06:23:13,789] Trial 30 finished with value: 0.30653467250214816 and parameters: {'model_type': 'graphsage', 'hidden_dims': '[512, 128]', 'dropout': 0.32864016685927316, 'batch_norm': True, 'sage_aggr': 'max', 'sage_normalize': False, 'sage_project': False, 'lr': 0.002654829350219805, 'weight_decay': 0.00017577224037944542, 'epochs': 75, 'loss': 'mse', 'optimizer': 'adam', 'graph_mode': 'cutoff', 'cutoff': 0.5578082010081278, 'grm_norm': 'gcn', 'self_loops': True, 'use_snp_selection': False}. Best is trial 16 with value: 0.31333399213621604.
[I 2025-12-09 06:23:45,122] Trial 31 finished with value: 0.3170046826524637 and parameters: {'model_type': 'graphsage', 'hidden_dims': '[256, 128]', 'dropout': 0.4380205550895209, 'batch_norm': True, 'sage_aggr': 'max', 'sage_normalize': False, 'sage_project': False, 'lr': 0.004521909738438375, 'weight_decay': 0.00026832196081143044, 'epochs': 95, 'loss': 'mse', 'optimizer': 'adam', 'graph_mode': 'cutoff', 'cutoff': 0.7337461437559251, 'grm_norm': 'cosine_then_gcn', 'self_loops': True, 'use_snp_selection': False}. Best is trial 31 with value: 0.3170046826524637.
[I 2025-12-09 06:24:15,029] Trial 32 finished with value: 0.30736807900345564 and parameters: {'model_type': 'graphsage', 'hidden_dims': '[256, 128]', 'dropout': 0.4448513429311166, 'batch_norm': True, 'sage_aggr': 'max', 'sage_normalize': False, 'sage_project': False, 'lr': 0.001209259056963821, 'weight_decay': 0.00031507014714223636, 'epochs': 88, 'loss': 'mse', 'optimizer': 'adam', 'graph_mode': 'cutoff', 'cutoff': 0.7088265321987194, 'grm_norm': 'cosine_then_gcn', 'self_loops': True, 'use_snp_selection': False}. Best is trial 31 with value: 0.3170046826524637.
[I 2025-12-09 06:24:53,155] Trial 33 finished with value: 0.3065522459974986 and parameters: {'model_type': 'graphsage', 'hidden_dims': '[256, 128]', 'dropout': 0.4762113293761182, 'batch_norm': True, 'sage_aggr': 'max', 'sage_normalize': False, 'sage_project': False, 'lr': 0.005527051629066857, 'weight_decay': 0.00026359961775170336, 'epochs': 127, 'loss': 'mse', 'optimizer': 'adam', 'graph_mode': 'cutoff', 'cutoff': 0.8463468847693372, 'grm_norm': 'cosine_then_gcn', 'self_loops': True, 'use_snp_selection': False}. Best is trial 31 with value: 0.3170046826524637.
[I 2025-12-09 06:25:20,344] Trial 34 finished with value: 0.20405955740112636 and parameters: {'model_type': 'graphsage', 'hidden_dims': '[128, 64]', 'dropout': 0.5549268861785291, 'batch_norm': False, 'sage_aggr': 'max', 'sage_normalize': False, 'sage_project': False, 'lr': 0.004409238374943521, 'weight_decay': 4.2726685326297065e-05, 'epochs': 51, 'loss': 'mse', 'optimizer': 'adam', 'graph_mode': 'cutoff', 'cutoff': 0.7012501843417747, 'grm_norm': 'cosine_then_gcn', 'self_loops': True, 'use_snp_selection': True, 'num_snps': 2241}. Best is trial 31 with value: 0.3170046826524637.
[I 2025-12-09 06:26:05,136] Trial 35 finished with value: 0.284762702154507 and parameters: {'model_type': 'graphsage', 'hidden_dims': '[256, 128]', 'dropout': 0.30636889846330656, 'batch_norm': True, 'sage_aggr': 'max', 'sage_normalize': False, 'sage_project': False, 'lr': 0.002551780290946823, 'weight_decay': 0.00011578850100975218, 'epochs': 84, 'loss': 'mse', 'optimizer': 'adam', 'graph_mode': 'knn', 'knn_k': 4, 'weighted_edges': True, 'symmetrize_mode': 'union', 'self_loops': True, 'use_snp_selection': False}. Best is trial 31 with value: 0.3170046826524637.
[I 2025-12-09 06:27:51,420] Trial 36 finished with value: 0.3032466154828772 and parameters: {'model_type': 'graphsage', 'hidden_dims': '[512, 128]', 'dropout': 0.38459020661138077, 'batch_norm': True, 'sage_aggr': 'max', 'sage_normalize': False, 'sage_project': False, 'lr': 0.0016672546251264263, 'weight_decay': 0.0005980272006035149, 'epochs': 149, 'loss': 'mae', 'optimizer': 'adam', 'graph_mode': 'cutoff', 'cutoff': 0.8079128942645716, 'grm_norm': 'cosine_then_gcn', 'self_loops': False, 'use_snp_selection': True, 'num_snps': 59922}. Best is trial 31 with value: 0.3170046826524637.
[I 2025-12-09 06:28:30,619] Trial 37 finished with value: 0.30721444618984056 and parameters: {'model_type': 'graphsage', 'hidden_dims': '[512, 256]', 'dropout': 0.43516746158176917, 'batch_norm': True, 'sage_aggr': 'max', 'sage_normalize': False, 'sage_project': False, 'lr': 0.0005398725530771776, 'weight_decay': 5.3676607723444975e-06, 'epochs': 67, 'loss': 'mse', 'optimizer': 'adam', 'graph_mode': 'cutoff', 'cutoff': 0.8642269367025466, 'grm_norm': 'cosine', 'self_loops': True, 'use_snp_selection': False}. Best is trial 31 with value: 0.3170046826524637.
[I 2025-12-09 06:30:01,043] Trial 38 finished with value: 0.24614232853301146 and parameters: {'model_type': 'graphsage', 'hidden_dims': '[256, 128]', 'dropout': 0.354727124324704, 'batch_norm': False, 'sage_aggr': 'mean', 'sage_normalize': True, 'sage_project': False, 'lr': 0.001018377069071448, 'weight_decay': 1.6139406775110432e-07, 'epochs': 125, 'loss': 'mae', 'optimizer': 'adam', 'graph_mode': 'knn', 'knn_k': 10, 'weighted_edges': True, 'symmetrize_mode': 'union', 'self_loops': False, 'use_snp_selection': False}. Best is trial 31 with value: 0.3170046826524637.
[I 2025-12-09 06:30:48,958] Trial 39 finished with value: 0.29245085385802294 and parameters: {'model_type': 'graphsage', 'hidden_dims': '[512, 64]', 'dropout': 0.39626501693236815, 'batch_norm': True, 'sage_aggr': 'max', 'sage_normalize': False, 'sage_project': False, 'lr': 2.6451524405790403e-05, 'weight_decay': 4.1209427144022575e-07, 'epochs': 166, 'loss': 'mse', 'optimizer': 'adam', 'graph_mode': 'cutoff', 'cutoff': 0.5214944849646166, 'grm_norm': 'gcn', 'self_loops': True, 'use_snp_selection': True, 'num_snps': 15197}. Best is trial 31 with value: 0.3170046826524637.
[I 2025-12-09 06:31:26,045] Trial 40 finished with value: 0.2518633079983773 and parameters: {'model_type': 'graphsage', 'hidden_dims': '[128, 64]', 'dropout': 0.5397671793537435, 'batch_norm': True, 'sage_aggr': 'max', 'sage_normalize': False, 'sage_project': False, 'lr': 0.0002560357117195925, 'weight_decay': 0.000345362747463038, 'epochs': 51, 'loss': 'mae', 'optimizer': 'adam', 'graph_mode': 'knn', 'knn_k': 7, 'weighted_edges': False, 'symmetrize_mode': 'union', 'self_loops': True, 'use_snp_selection': False}. Best is trial 31 with value: 0.3170046826524637.
[I 2025-12-09 06:31:58,951] Trial 41 finished with value: 0.3072041828090115 and parameters: {'model_type': 'graphsage', 'hidden_dims': '[256, 128]', 'dropout': 0.43738891228645604, 'batch_norm': True, 'sage_aggr': 'max', 'sage_normalize': False, 'sage_project': False, 'lr': 0.0032665199874592717, 'weight_decay': 0.00025097725282420834, 'epochs': 102, 'loss': 'mse', 'optimizer': 'adam', 'graph_mode': 'cutoff', 'cutoff': 0.7182833695462104, 'grm_norm': 'cosine_then_gcn', 'self_loops': True, 'use_snp_selection': False}. Best is trial 31 with value: 0.3170046826524637.
[I 2025-12-09 06:32:29,218] Trial 42 finished with value: 0.3098647676112735 and parameters: {'model_type': 'graphsage', 'hidden_dims': '[256, 128]', 'dropout': 0.4209983622675257, 'batch_norm': True, 'sage_aggr': 'max', 'sage_normalize': False, 'sage_project': False, 'lr': 0.005172659183492256, 'weight_decay': 0.0006706850593210711, 'epochs': 90, 'loss': 'mse', 'optimizer': 'adam', 'graph_mode': 'cutoff', 'cutoff': 0.7567266745447732, 'grm_norm': 'cosine_then_gcn', 'self_loops': True, 'use_snp_selection': False}. Best is trial 31 with value: 0.3170046826524637.
[I 2025-12-09 06:33:05,394] Trial 43 finished with value: 0.30287337521214175 and parameters: {'model_type': 'graphsage', 'hidden_dims': '[256, 128]', 'dropout': 0.4810882238421322, 'batch_norm': True, 'sage_aggr': 'max', 'sage_normalize': False, 'sage_project': False, 'lr': 0.00794718489940492, 'weight_decay': 6.332470097756605e-05, 'epochs': 116, 'loss': 'mse', 'optimizer': 'adam', 'graph_mode': 'cutoff', 'cutoff': 0.6002786791791763, 'grm_norm': 'cosine_then_gcn', 'self_loops': True, 'use_snp_selection': False}. Best is trial 31 with value: 0.3170046826524637.
[I 2025-12-09 06:33:30,190] Trial 44 finished with value: 0.3117637492476893 and parameters: {'model_type': 'graphsage', 'hidden_dims': '[256, 128]', 'dropout': 0.32652631513669983, 'batch_norm': True, 'sage_aggr': 'max', 'sage_normalize': False, 'sage_project': False, 'lr': 0.004080636102667595, 'weight_decay': 0.0001880064616305176, 'epochs': 64, 'loss': 'mse', 'optimizer': 'adam', 'graph_mode': 'cutoff', 'cutoff': 0.7823456307987727, 'grm_norm': 'cosine_then_gcn', 'self_loops': True, 'use_snp_selection': False}. Best is trial 31 with value: 0.3170046826524637.
[I 2025-12-09 06:34:14,962] Trial 45 finished with value: 0.3018077077036664 and parameters: {'model_type': 'graphsage', 'hidden_dims': '[256, 128]', 'dropout': 0.2254476562126341, 'batch_norm': True, 'sage_aggr': 'mean', 'sage_normalize': True, 'sage_project': False, 'lr': 0.0020563690191041486, 'weight_decay': 0.0009942540235913417, 'epochs': 64, 'loss': 'mse', 'optimizer': 'adam', 'graph_mode': 'cutoff', 'cutoff': 0.7903217573505235, 'grm_norm': 'cosine_then_gcn', 'self_loops': True, 'use_snp_selection': True, 'num_snps': 34750}. Best is trial 31 with value: 0.3170046826524637.
[I 2025-12-09 06:35:46,061] Trial 46 finished with value: 0.0017823150432521417 and parameters: {'model_type': 'graphsage', 'hidden_dims': '[512, 256]', 'dropout': 0.2814586853834257, 'batch_norm': False, 'sage_aggr': 'max', 'sage_normalize': False, 'sage_project': False, 'lr': 0.006528431823300507, 'weight_decay': 9.819129505204621e-05, 'epochs': 204, 'loss': 'mse', 'optimizer': 'adam', 'graph_mode': 'cutoff', 'cutoff': 0.66185330190837, 'grm_norm': 'cosine', 'self_loops': False, 'use_snp_selection': False}. Best is trial 31 with value: 0.3170046826524637.
[I 2025-12-09 06:36:19,749] Trial 47 finished with value: 0.26523549217359993 and parameters: {'model_type': 'graphsage', 'hidden_dims': '[512, 128]', 'dropout': 0.3314156416355453, 'batch_norm': True, 'sage_aggr': 'max', 'sage_normalize': False, 'sage_project': False, 'lr': 0.004463623449413393, 'weight_decay': 0.00044841289746250213, 'epochs': 41, 'loss': 'mse', 'optimizer': 'adam', 'graph_mode': 'cutoff', 'cutoff': 0.3258906296603168, 'grm_norm': 'cosine_then_gcn', 'self_loops': True, 'use_snp_selection': False}. Best is trial 31 with value: 0.3170046826524637.
[I 2025-12-09 06:36:48,797] Trial 48 finished with value: 0.285273408520805 and parameters: {'model_type': 'graphsage', 'hidden_dims': '[256, 128]', 'dropout': 0.31785145717473, 'batch_norm': True, 'sage_aggr': 'max', 'sage_normalize': False, 'sage_project': False, 'lr': 0.0013508514421316262, 'weight_decay': 0.00014160634019321527, 'epochs': 57, 'loss': 'mse', 'optimizer': 'adam', 'graph_mode': 'knn', 'knn_k': 4, 'weighted_edges': False, 'symmetrize_mode': 'mutual', 'self_loops': True, 'use_snp_selection': False}. Best is trial 31 with value: 0.3170046826524637.
[I 2025-12-09 06:37:39,205] Trial 49 finished with value: 0.30247246346435486 and parameters: {'model_type': 'graphsage', 'hidden_dims': '[256, 128, 64]', 'dropout': 0.34630035052301616, 'batch_norm': True, 'sage_aggr': 'mean', 'sage_normalize': True, 'sage_project': False, 'lr': 0.003010693463464243, 'weight_decay': 9.929856429984327e-06, 'epochs': 69, 'loss': 'mae', 'optimizer': 'adam', 'graph_mode': 'cutoff', 'cutoff': 0.5853984585686263, 'grm_norm': 'none', 'self_loops': True, 'use_snp_selection': True, 'num_snps': 43660}. Best is trial 31 with value: 0.3170046826524637.
[I 2025-12-09 06:38:26,560] Trial 50 finished with value: 0.31138873432274194 and parameters: {'model_type': 'graphsage', 'hidden_dims': '[512, 64]', 'dropout': 0.27916780999479895, 'batch_norm': True, 'sage_aggr': 'max', 'sage_normalize': False, 'sage_project': False, 'lr': 0.0018640397117383834, 'weight_decay': 4.788321955813987e-05, 'epochs': 91, 'loss': 'mse', 'optimizer': 'adam', 'graph_mode': 'cutoff', 'cutoff': 0.8645167739253925, 'grm_norm': 'gcn', 'self_loops': True, 'use_snp_selection': False}. Best is trial 31 with value: 0.3170046826524637.
[I 2025-12-09 06:39:15,490] Trial 51 finished with value: 0.3145365066196154 and parameters: {'model_type': 'graphsage', 'hidden_dims': '[512, 64]', 'dropout': 0.2763195224010869, 'batch_norm': True, 'sage_aggr': 'max', 'sage_normalize': False, 'sage_project': False, 'lr': 0.0018266253484934063, 'weight_decay': 2.5808969191943058e-05, 'epochs': 95, 'loss': 'mse', 'optimizer': 'adam', 'graph_mode': 'cutoff', 'cutoff': 0.8665232840302735, 'grm_norm': 'gcn', 'self_loops': True, 'use_snp_selection': False}. Best is trial 31 with value: 0.3170046826524637.
[I 2025-12-09 06:40:22,654] Trial 52 finished with value: 0.31332243014247746 and parameters: {'model_type': 'graphsage', 'hidden_dims': '[512, 64]', 'dropout': 0.25042876187783447, 'batch_norm': True, 'sage_aggr': 'max', 'sage_normalize': False, 'sage_project': False, 'lr': 0.0022896399224454646, 'weight_decay': 2.9589365899709285e-05, 'epochs': 142, 'loss': 'mse', 'optimizer': 'adam', 'graph_mode': 'cutoff', 'cutoff': 0.8311858626579919, 'grm_norm': 'gcn', 'self_loops': True, 'use_snp_selection': False}. Best is trial 31 with value: 0.3170046826524637.
