[I 2025-12-09 03:18:06,661] Trial 79 finished with value: 0.27131809925116146 and parameters: {'model_type': 'graphsage', 'hidden_dims': '[256, 128]', 'dropout': 0.11420565327277696, 'batch_norm': False, 'sage_aggr': 'mean', 'sage_normalize': True, 'sage_project': False, 'lr': 0.0031472704802472376, 'weight_decay': 3.2973514534160464e-06, 'epochs': 137, 'loss': 'mae', 'optimizer': 'adam', 'graph_mode': 'knn', 'knn_k': 1, 'weighted_edges': True, 'symmetrize_mode': 'mutual', 'self_loops': True, 'use_snp_selection': False}. Best is trial 72 with value: 0.3070664354361066.
[I 2025-12-09 03:19:04,510] Trial 80 finished with value: 0.29739686696447226 and parameters: {'model_type': 'graphsage', 'hidden_dims': '[256, 128]', 'dropout': 0.3764255646846202, 'batch_norm': True, 'sage_aggr': 'mean', 'sage_normalize': True, 'sage_project': False, 'lr': 0.0014353799865983433, 'weight_decay': 3.819744778219481e-06, 'epochs': 90, 'loss': 'mse', 'optimizer': 'adam', 'graph_mode': 'cutoff', 'cutoff': 0.2873738393042417, 'grm_norm': 'gcn', 'self_loops': True, 'use_snp_selection': False}. Best is trial 72 with value: 0.3070664354361066.
[I 2025-12-09 03:23:56,146] Trial 81 finished with value: 0.30072012402814136 and parameters: {'model_type': 'graphsage', 'hidden_dims': '[512, 64]', 'dropout': 0.45115690682311316, 'batch_norm': False, 'sage_aggr': 'mean', 'sage_normalize': True, 'sage_project': False, 'lr': 0.0009979112202307492, 'weight_decay': 7.743975500917113e-06, 'epochs': 315, 'loss': 'mse', 'optimizer': 'adam', 'graph_mode': 'cutoff', 'cutoff': 0.25398735948443807, 'grm_norm': 'cosine_then_gcn', 'self_loops': True, 'use_snp_selection': False}. Best is trial 72 with value: 0.3070664354361066.
[I 2025-12-09 03:27:05,974] Trial 82 finished with value: 0.3095226162433806 and parameters: {'model_type': 'graphsage', 'hidden_dims': '[256, 128]', 'dropout': 0.43738877444381685, 'batch_norm': False, 'sage_aggr': 'mean', 'sage_normalize': True, 'sage_project': False, 'lr': 0.002610102248682687, 'weight_decay': 6.043066945412146e-07, 'epochs': 333, 'loss': 'mse', 'optimizer': 'adam', 'graph_mode': 'cutoff', 'cutoff': 0.2885619499951346, 'grm_norm': 'cosine_then_gcn', 'self_loops': True, 'use_snp_selection': False}. Best is trial 82 with value: 0.3095226162433806.
[I 2025-12-09 03:31:32,835] Trial 83 finished with value: 0.2900228632728269 and parameters: {'model_type': 'graphsage', 'hidden_dims': '[256, 128]', 'dropout': 0.4162198115509378, 'batch_norm': False, 'sage_aggr': 'mean', 'sage_normalize': True, 'sage_project': False, 'lr': 0.005278129489194438, 'weight_decay': 5.711486085373687e-07, 'epochs': 333, 'loss': 'mse', 'optimizer': 'adam', 'graph_mode': 'cutoff', 'cutoff': 0.22470313178746437, 'grm_norm': 'cosine_then_gcn', 'self_loops': True, 'use_snp_selection': False}. Best is trial 82 with value: 0.3095226162433806.
[I 2025-12-09 03:35:00,620] Trial 84 finished with value: 0.2996962672825642 and parameters: {'model_type': 'graphsage', 'hidden_dims': '[256, 128]', 'dropout': 0.43614457756595176, 'batch_norm': False, 'sage_aggr': 'mean', 'sage_normalize': True, 'sage_project': False, 'lr': 0.002644783098226331, 'weight_decay': 1.7478473234217973e-07, 'epochs': 342, 'loss': 'mse', 'optimizer': 'adam', 'graph_mode': 'cutoff', 'cutoff': 0.27602495553019346, 'grm_norm': 'cosine_then_gcn', 'self_loops': True, 'use_snp_selection': False}. Best is trial 82 with value: 0.3095226162433806.
[I 2025-12-09 03:36:33,766] Trial 85 finished with value: 0.30174424974522424 and parameters: {'model_type': 'graphsage', 'hidden_dims': '[256, 128]', 'dropout': 0.3977769480498271, 'batch_norm': False, 'sage_aggr': 'mean', 'sage_normalize': True, 'sage_project': False, 'lr': 0.001958799888925145, 'weight_decay': 1.2352944756698144e-06, 'epochs': 326, 'loss': 'mse', 'optimizer': 'adam', 'graph_mode': 'cutoff', 'cutoff': 0.7994960048968013, 'grm_norm': 'cosine_then_gcn', 'self_loops': True, 'use_snp_selection': False}. Best is trial 82 with value: 0.3095226162433806.
[I 2025-12-09 03:37:10,958] Trial 86 finished with value: 0.289178225970644 and parameters: {'model_type': 'graphsage', 'hidden_dims': '[256, 128]', 'dropout': 0.4583889176299144, 'batch_norm': False, 'sage_aggr': 'mean', 'sage_normalize': True, 'sage_project': False, 'lr': 0.007604121078616585, 'weight_decay': 3.6939356653798013e-07, 'epochs': 333, 'loss': 'mse', 'optimizer': 'adam', 'graph_mode': 'cutoff', 'cutoff': 0.32061000816964, 'grm_norm': 'cosine_then_gcn', 'self_loops': True, 'use_snp_selection': True, 'num_snps': 10432}. Best is trial 82 with value: 0.3095226162433806.
[I 2025-12-09 03:39:52,703] Trial 87 finished with value: 0.049743192862580256 and parameters: {'model_type': 'graphsage', 'hidden_dims': '[256, 128]', 'dropout': 0.3692034555942484, 'batch_norm': False, 'sage_aggr': 'mean', 'sage_normalize': False, 'sage_project': False, 'lr': 0.0012851755855776451, 'weight_decay': 5.7159580873753145e-06, 'epochs': 231, 'loss': 'mse', 'optimizer': 'adam', 'graph_mode': 'cutoff', 'cutoff': 0.250264554337354, 'grm_norm': 'cosine_then_gcn', 'self_loops': False, 'use_snp_selection': False}. Best is trial 82 with value: 0.3095226162433806.
[I 2025-12-09 03:43:08,168] Trial 88 finished with value: 0.2965336077642965 and parameters: {'model_type': 'graphsage', 'hidden_dims': '[256, 128]', 'dropout': 0.38598102252285044, 'batch_norm': False, 'sage_aggr': 'mean', 'sage_normalize': True, 'sage_project': False, 'lr': 0.003909649254116335, 'weight_decay': 3.967980059959945e-06, 'epochs': 342, 'loss': 'mse', 'optimizer': 'adam', 'graph_mode': 'cutoff', 'cutoff': 0.2878178559472274, 'grm_norm': 'cosine_then_gcn', 'self_loops': True, 'use_snp_selection': False}. Best is trial 82 with value: 0.3095226162433806.
[I 2025-12-09 03:45:32,592] Trial 89 finished with value: 0.28782708394621254 and parameters: {'model_type': 'graphsage', 'hidden_dims': '[256, 128]', 'dropout': 0.426296616854152, 'batch_norm': False, 'sage_aggr': 'max', 'sage_normalize': True, 'sage_project': False, 'lr': 0.002257906975493997, 'weight_decay': 1.0685918973536487e-06, 'epochs': 319, 'loss': 'mse', 'optimizer': 'adam', 'graph_mode': 'cutoff', 'cutoff': 0.3509730753135047, 'grm_norm': 'cosine_then_gcn', 'self_loops': True, 'use_snp_selection': False}. Best is trial 82 with value: 0.3095226162433806.
[I 2025-12-09 03:47:38,039] Trial 90 finished with value: 0.29178456579082757 and parameters: {'model_type': 'graphsage', 'hidden_dims': '[128, 64]', 'dropout': 0.44389122427229205, 'batch_norm': False, 'sage_aggr': 'mean', 'sage_normalize': True, 'sage_project': False, 'lr': 0.0016412599634019944, 'weight_decay': 1.9234642375362024e-06, 'epochs': 301, 'loss': 'mse', 'optimizer': 'adam', 'graph_mode': 'cutoff', 'cutoff': 0.32416569344926394, 'grm_norm': 'none', 'self_loops': True, 'use_snp_selection': False}. Best is trial 82 with value: 0.3095226162433806.
[I 2025-12-09 03:52:23,524] Trial 91 finished with value: 0.3072589492514277 and parameters: {'model_type': 'graphsage', 'hidden_dims': '[512, 256]', 'dropout': 0.4879509377915054, 'batch_norm': False, 'sage_aggr': 'mean', 'sage_normalize': True, 'sage_project': False, 'lr': 0.003027934786781717, 'weight_decay': 6.536361566529295e-07, 'epochs': 350, 'loss': 'mse', 'optimizer': 'adam', 'graph_mode': 'cutoff', 'cutoff': 0.28773350932798764, 'grm_norm': 'cosine_then_gcn', 'self_loops': True, 'use_snp_selection': False}. Best is trial 82 with value: 0.3095226162433806.
[I 2025-12-09 03:57:26,989] Trial 92 finished with value: 0.30069864982365957 and parameters: {'model_type': 'graphsage', 'hidden_dims': '[512, 128]', 'dropout': 0.48041189690531083, 'batch_norm': False, 'sage_aggr': 'mean', 'sage_normalize': True, 'sage_project': False, 'lr': 0.0030083450869772765, 'weight_decay': 2.8491354728292386e-07, 'epochs': 349, 'loss': 'mse', 'optimizer': 'adam', 'graph_mode': 'cutoff', 'cutoff': 0.2695732710651795, 'grm_norm': 'cosine_then_gcn', 'self_loops': True, 'use_snp_selection': False}. Best is trial 82 with value: 0.3095226162433806.
[I 2025-12-09 03:59:03,846] Trial 93 finished with value: 0.2927940060149191 and parameters: {'model_type': 'graphsage', 'hidden_dims': '[256, 128, 64]', 'dropout': 0.4605574266954203, 'batch_norm': False, 'sage_aggr': 'mean', 'sage_normalize': True, 'sage_project': False, 'lr': 0.002580802122949816, 'weight_decay': 7.253187574225219e-07, 'epochs': 333, 'loss': 'mse', 'optimizer': 'adam', 'graph_mode': 'cutoff', 'cutoff': 0.6038194454787491, 'grm_norm': 'cosine_then_gcn', 'self_loops': True, 'use_snp_selection': False}. Best is trial 82 with value: 0.3095226162433806.
[I 2025-12-09 04:01:59,850] Trial 94 finished with value: 0.3070068579069063 and parameters: {'model_type': 'graphsage', 'hidden_dims': '[256, 128]', 'dropout': 0.4094276865494119, 'batch_norm': False, 'sage_aggr': 'mean', 'sage_normalize': True, 'sage_project': False, 'lr': 0.0034804832291223174, 'weight_decay': 5.842197214452684e-07, 'epochs': 329, 'loss': 'mse', 'optimizer': 'adam', 'graph_mode': 'cutoff', 'cutoff': 0.30293516023242806, 'grm_norm': 'cosine_then_gcn', 'self_loops': True, 'use_snp_selection': False}. Best is trial 82 with value: 0.3095226162433806.
[I 2025-12-09 04:06:14,212] Trial 95 finished with value: 0.30705418454227457 and parameters: {'model_type': 'graphsage', 'hidden_dims': '[512, 256]', 'dropout': 0.40857545836822096, 'batch_norm': False, 'sage_aggr': 'mean', 'sage_normalize': True, 'sage_project': False, 'lr': 0.0034208682088805527, 'weight_decay': 4.5939175356703815e-07, 'epochs': 327, 'loss': 'mse', 'optimizer': 'adam', 'graph_mode': 'cutoff', 'cutoff': 0.3037335983032279, 'grm_norm': 'cosine_then_gcn', 'self_loops': True, 'use_snp_selection': False}. Best is trial 82 with value: 0.3095226162433806.
[I 2025-12-09 04:10:34,121] Trial 96 finished with value: 0.30375314119574415 and parameters: {'model_type': 'graphsage', 'hidden_dims': '[512, 256]', 'dropout': 0.40695336011884914, 'batch_norm': False, 'sage_aggr': 'mean', 'sage_normalize': True, 'sage_project': False, 'lr': 0.003501568835781185, 'weight_decay': 4.869681110614206e-07, 'epochs': 330, 'loss': 'mse', 'optimizer': 'adam', 'graph_mode': 'cutoff', 'cutoff': 0.29931192054884226, 'grm_norm': 'cosine_then_gcn', 'self_loops': True, 'use_snp_selection': False}. Best is trial 82 with value: 0.3095226162433806.
[I 2025-12-09 04:16:02,337] Trial 97 finished with value: 0.294464236280808 and parameters: {'model_type': 'graphsage', 'hidden_dims': '[512, 256]', 'dropout': 0.40991038004270214, 'batch_norm': True, 'sage_aggr': 'mean', 'sage_normalize': True, 'sage_project': False, 'lr': 0.005169018275831657, 'weight_decay': 5.973336138872269e-07, 'epochs': 327, 'loss': 'mae', 'optimizer': 'adam', 'graph_mode': 'knn', 'knn_k': 8, 'weighted_edges': False, 'symmetrize_mode': 'union', 'self_loops': True, 'use_snp_selection': False}. Best is trial 82 with value: 0.3095226162433806.
[I 2025-12-09 04:20:06,919] Trial 98 finished with value: 0.30393170329122066 and parameters: {'model_type': 'graphsage', 'hidden_dims': '[512, 256]', 'dropout': 0.3954653217200923, 'batch_norm': False, 'sage_aggr': 'mean', 'sage_normalize': True, 'sage_project': False, 'lr': 0.003689814998700507, 'weight_decay': 2.799474876721917e-07, 'epochs': 312, 'loss': 'mse', 'optimizer': 'adam', 'graph_mode': 'cutoff', 'cutoff': 0.3013112074569595, 'grm_norm': 'cosine_then_gcn', 'self_loops': True, 'use_snp_selection': False}. Best is trial 82 with value: 0.3095226162433806.
[I 2025-12-09 04:26:32,112] Trial 99 finished with value: 0.2952201803957286 and parameters: {'model_type': 'graphsage', 'hidden_dims': '[512, 256]', 'dropout': 0.3590704773816847, 'batch_norm': False, 'sage_aggr': 'mean', 'sage_normalize': True, 'sage_project': False, 'lr': 0.006781441605907304, 'weight_decay': 2.297533328600958e-07, 'epochs': 311, 'loss': 'mse', 'optimizer': 'adam', 'graph_mode': 'cutoff', 'cutoff': 0.30636338517890815, 'grm_norm': 'gcn', 'self_loops': True, 'use_snp_selection': True, 'num_snps': 59498}. Best is trial 82 with value: 0.3095226162433806.
[I 2025-12-09 04:30:13,533] Trial 100 finished with value: 0.29435929278878475 and parameters: {'model_type': 'graphsage', 'hidden_dims': '[512, 256]', 'dropout': 0.3924796007444871, 'batch_norm': False, 'sage_aggr': 'mean', 'sage_normalize': True, 'sage_project': False, 'lr': 0.004357956641341775, 'weight_decay': 4.1801851903596873e-07, 'epochs': 345, 'loss': 'mse', 'optimizer': 'adam', 'graph_mode': 'cutoff', 'cutoff': 0.3866243758827627, 'grm_norm': 'cosine_then_gcn', 'self_loops': False, 'use_snp_selection': False}. Best is trial 82 with value: 0.3095226162433806.
[I 2025-12-09 04:34:39,510] Trial 101 finished with value: 0.30534771716680026 and parameters: {'model_type': 'graphsage', 'hidden_dims': '[512, 256]', 'dropout': 0.40907484352639056, 'batch_norm': False, 'sage_aggr': 'mean', 'sage_normalize': True, 'sage_project': False, 'lr': 0.003501116457526807, 'weight_decay': 5.41752236785846e-07, 'epochs': 330, 'loss': 'mse', 'optimizer': 'adam', 'graph_mode': 'cutoff', 'cutoff': 0.2921477370181442, 'grm_norm': 'cosine_then_gcn', 'self_loops': True, 'use_snp_selection': False}. Best is trial 82 with value: 0.3095226162433806.
[I 2025-12-09 04:38:45,357] Trial 102 finished with value: 0.3066206362660048 and parameters: {'model_type': 'graphsage', 'hidden_dims': '[512, 256]', 'dropout': 0.39867991918303075, 'batch_norm': False, 'sage_aggr': 'mean', 'sage_normalize': True, 'sage_project': False, 'lr': 0.003526073481851483, 'weight_decay': 1.4121568870310338e-07, 'epochs': 315, 'loss': 'mse', 'optimizer': 'adam', 'graph_mode': 'cutoff', 'cutoff': 0.30294462870706984, 'grm_norm': 'cosine_then_gcn', 'self_loops': True, 'use_snp_selection': False}. Best is trial 82 with value: 0.3095226162433806.
[I 2025-12-09 04:42:19,227] Trial 103 finished with value: 0.3065215488685109 and parameters: {'model_type': 'graphsage', 'hidden_dims': '[512, 256]', 'dropout': 0.43278405375355467, 'batch_norm': False, 'sage_aggr': 'mean', 'sage_normalize': True, 'sage_project': False, 'lr': 0.0039712087738556475, 'weight_decay': 1.5659611128112503e-07, 'epochs': 314, 'loss': 'mse', 'optimizer': 'adam', 'graph_mode': 'cutoff', 'cutoff': 0.3259621541240075, 'grm_norm': 'cosine_then_gcn', 'self_loops': True, 'use_snp_selection': False}. Best is trial 82 with value: 0.3095226162433806.
[I 2025-12-09 04:45:30,709] Trial 104 finished with value: 0.3041970322170971 and parameters: {'model_type': 'graphsage', 'hidden_dims': '[512, 256]', 'dropout': 0.43617898934778765, 'batch_norm': False, 'sage_aggr': 'mean', 'sage_normalize': True, 'sage_project': False, 'lr': 0.005333704276856876, 'weight_decay': 1.443014717944986e-07, 'epochs': 293, 'loss': 'mse', 'optimizer': 'adam', 'graph_mode': 'cutoff', 'cutoff': 0.3621971024504337, 'grm_norm': 'cosine_then_gcn', 'self_loops': True, 'use_snp_selection': False}. Best is trial 82 with value: 0.3095226162433806.
[I 2025-12-09 04:48:41,161] Trial 105 finished with value: 0.2662173966016948 and parameters: {'model_type': 'graphsage', 'hidden_dims': '[512, 256]', 'dropout': 0.43651060426362964, 'batch_norm': False, 'sage_aggr': 'mean', 'sage_normalize': True, 'sage_project': False, 'lr': 0.0073876769591988065, 'weight_decay': 1.0887074433504086e-07, 'epochs': 291, 'loss': 'mse', 'optimizer': 'adam', 'graph_mode': 'cutoff', 'cutoff': 0.3613760235274306, 'grm_norm': 'cosine_then_gcn', 'self_loops': True, 'use_snp_selection': False}. Best is trial 82 with value: 0.3095226162433806.
[I 2025-12-09 04:52:23,364] Trial 106 finished with value: 0.29282406585605897 and parameters: {'model_type': 'graphsage', 'hidden_dims': '[512, 256]', 'dropout': 0.42979464222604347, 'batch_norm': False, 'sage_aggr': 'mean', 'sage_normalize': True, 'sage_project': False, 'lr': 0.009915028560226117, 'weight_decay': 1.8008196799871643e-07, 'epochs': 297, 'loss': 'mse', 'optimizer': 'adam', 'graph_mode': 'cutoff', 'cutoff': 0.31965789433798975, 'grm_norm': 'cosine_then_gcn', 'self_loops': True, 'use_snp_selection': False}. Best is trial 82 with value: 0.3095226162433806.
[I 2025-12-09 04:56:45,222] Trial 107 finished with value: 0.0 and parameters: {'model_type': 'graphsage', 'hidden_dims': '[512, 256]', 'dropout': 0.4856887181383652, 'batch_norm': False, 'sage_aggr': 'mean', 'sage_normalize': False, 'sage_project': False, 'lr': 0.004835449898162951, 'weight_decay': 1.643853002824049e-07, 'epochs': 282, 'loss': 'mse', 'optimizer': 'adam', 'graph_mode': 'cutoff', 'cutoff': 0.2541740561205148, 'grm_norm': 'cosine_then_gcn', 'self_loops': True, 'use_snp_selection': False}. Best is trial 82 with value: 0.3095226162433806.
[I 2025-12-09 05:00:10,562] Trial 108 finished with value: 0.29848343560294094 and parameters: {'model_type': 'graphsage', 'hidden_dims': '[512, 256]', 'dropout': 0.33708342534606617, 'batch_norm': False, 'sage_aggr': 'mean', 'sage_normalize': True, 'sage_project': False, 'lr': 0.005593493296066579, 'weight_decay': 2.203392104948918e-07, 'epochs': 304, 'loss': 'mse', 'optimizer': 'adam', 'graph_mode': 'cutoff', 'cutoff': 0.33088738791629757, 'grm_norm': 'cosine_then_gcn', 'self_loops': True, 'use_snp_selection': False}. Best is trial 82 with value: 0.3095226162433806.
[I 2025-12-09 05:03:54,495] Trial 109 finished with value: 0.27451589403683335 and parameters: {'model_type': 'graphsage', 'hidden_dims': '[512, 256]', 'dropout': 0.3847208895577895, 'batch_norm': False, 'sage_aggr': 'max', 'sage_normalize': True, 'sage_project': False, 'lr': 0.0044857390397250365, 'weight_decay': 3.7005934521794356e-07, 'epochs': 277, 'loss': 'mse', 'optimizer': 'adam', 'graph_mode': 'cutoff', 'cutoff': 0.3148180802707944, 'grm_norm': 'cosine_then_gcn', 'self_loops': True, 'use_snp_selection': False}. Best is trial 82 with value: 0.3095226162433806.
[I 2025-12-09 05:06:53,738] Trial 110 finished with value: 0.268614691287196 and parameters: {'model_type': 'graphsage', 'hidden_dims': '[512, 256]', 'dropout': 0.3589302140096222, 'batch_norm': False, 'sage_aggr': 'mean', 'sage_normalize': True, 'sage_project': False, 'lr': 1.0045458391585387e-05, 'weight_decay': 1.323658094581345e-07, 'epochs': 321, 'loss': 'mse', 'optimizer': 'adam', 'graph_mode': 'cutoff', 'cutoff': 0.5448078218905736, 'grm_norm': 'none', 'self_loops': True, 'use_snp_selection': False}. Best is trial 82 with value: 0.3095226162433806.
[I 2025-12-09 05:10:22,338] Trial 111 finished with value: 0.30598475815546744 and parameters: {'model_type': 'graphsage', 'hidden_dims': '[512, 256]', 'dropout': 0.4647676309519003, 'batch_norm': False, 'sage_aggr': 'mean', 'sage_normalize': True, 'sage_project': False, 'lr': 0.0028457206300276077, 'weight_decay': 1.3497978516414251e-07, 'epochs': 315, 'loss': 'mse', 'optimizer': 'adam', 'graph_mode': 'cutoff', 'cutoff': 0.3449706270219744, 'grm_norm': 'cosine_then_gcn', 'self_loops': True, 'use_snp_selection': False}. Best is trial 82 with value: 0.3095226162433806.
[I 2025-12-09 05:13:45,412] Trial 112 finished with value: 0.2964664032014487 and parameters: {'model_type': 'graphsage', 'hidden_dims': '[512, 256]', 'dropout': 0.47363369949486994, 'batch_norm': False, 'sage_aggr': 'mean', 'sage_normalize': True, 'sage_project': False, 'lr': 0.0039231007976961154, 'weight_decay': 1.49980031859404e-07, 'epochs': 316, 'loss': 'mse', 'optimizer': 'adam', 'graph_mode': 'cutoff', 'cutoff': 0.38736372943486025, 'grm_norm': 'cosine_then_gcn', 'self_loops': True, 'use_snp_selection': False}. Best is trial 82 with value: 0.3095226162433806.
[I 2025-12-09 05:18:26,514] Trial 113 finished with value: 0.3009388428705594 and parameters: {'model_type': 'graphsage', 'hidden_dims': '[512, 256]', 'dropout': 0.44792907388293923, 'batch_norm': False, 'sage_aggr': 'mean', 'sage_normalize': True, 'sage_project': False, 'lr': 0.002884835732239986, 'weight_decay': 1.229273309843434e-07, 'epochs': 310, 'loss': 'mse', 'optimizer': 'adam', 'graph_mode': 'cutoff', 'cutoff': 0.25993741897280237, 'grm_norm': 'cosine_then_gcn', 'self_loops': True, 'use_snp_selection': False}. Best is trial 82 with value: 0.3095226162433806.
[I 2025-12-09 05:22:02,295] Trial 114 finished with value: 0.3083655996199789 and parameters: {'model_type': 'graphsage', 'hidden_dims': '[512, 256]', 'dropout': 0.46714701033876727, 'batch_norm': False, 'sage_aggr': 'mean', 'sage_normalize': True, 'sage_project': False, 'lr': 0.006522830604368992, 'weight_decay': 2.342938554232111e-07, 'epochs': 332, 'loss': 'mse', 'optimizer': 'adam', 'graph_mode': 'cutoff', 'cutoff': 0.3635806721178315, 'grm_norm': 'cosine_then_gcn', 'self_loops': True, 'use_snp_selection': False}. Best is trial 82 with value: 0.3095226162433806.
[I 2025-12-09 05:25:41,319] Trial 115 finished with value: 0.29467480326259965 and parameters: {'model_type': 'graphsage', 'hidden_dims': '[512, 256]', 'dropout': 0.4232901825375766, 'batch_norm': False, 'sage_aggr': 'mean', 'sage_normalize': True, 'sage_project': False, 'lr': 0.006345791427690796, 'weight_decay': 2.0279385615238352e-07, 'epochs': 334, 'loss': 'mse', 'optimizer': 'adam', 'graph_mode': 'cutoff', 'cutoff': 0.35371443041642314, 'grm_norm': 'cosine_then_gcn', 'self_loops': True, 'use_snp_selection': False}. Best is trial 82 with value: 0.3095226162433806.
[I 2025-12-09 05:29:15,414] Trial 116 finished with value: 0.2973916712340989 and parameters: {'model_type': 'graphsage', 'hidden_dims': '[512, 256]', 'dropout': 0.45997965522918033, 'batch_norm': False, 'sage_aggr': 'mean', 'sage_normalize': True, 'sage_project': False, 'lr': 0.007813136524245787, 'weight_decay': 3.281087920278158e-07, 'epochs': 329, 'loss': 'mse', 'optimizer': 'adam', 'graph_mode': 'cutoff', 'cutoff': 0.36997070433532536, 'grm_norm': 'cosine_then_gcn', 'self_loops': True, 'use_snp_selection': False}. Best is trial 82 with value: 0.3095226162433806.
