[I 2025-12-09 14:32:50,200] Trial 118 finished with value: 0.2852790342601699 and parameters: {'model_type': 'graphsage', 'hidden_dims': '[256, 128, 64]', 'dropout': 0.5534624385530452, 'batch_norm': True, 'sage_aggr': 'mean', 'sage_normalize': False, 'sage_project': False, 'lr': 0.004821544968680901, 'weight_decay': 6.6367745694375434e-06, 'epochs': 69, 'loss': 'mse', 'optimizer': 'adam', 'graph_mode': 'cutoff', 'cutoff': 0.6521976083536537, 'grm_norm': 'none', 'self_loops': True, 'use_snp_selection': False}. Best is trial 42 with value: 0.2969538400699926.
[I 2025-12-09 14:33:25,880] Trial 119 finished with value: 0.28202594019527194 and parameters: {'model_type': 'graphsage', 'hidden_dims': '[128, 64]', 'dropout': 0.514992749245406, 'batch_norm': True, 'sage_aggr': 'mean', 'sage_normalize': False, 'sage_project': False, 'lr': 0.0037563236614422285, 'weight_decay': 4.689208075830113e-06, 'epochs': 184, 'loss': 'mse', 'optimizer': 'adam', 'graph_mode': 'cutoff', 'cutoff': 0.7766604416224919, 'grm_norm': 'none', 'self_loops': True, 'use_snp_selection': False}. Best is trial 42 with value: 0.2969538400699926.
[I 2025-12-09 14:33:46,837] Trial 120 finished with value: 0.0 and parameters: {'model_type': 'graphsage', 'hidden_dims': '[256, 128, 64]', 'dropout': 0.5757751155829163, 'batch_norm': False, 'sage_aggr': 'mean', 'sage_normalize': False, 'sage_project': False, 'lr': 0.005328786209912358, 'weight_decay': 3.254351597799505e-05, 'epochs': 46, 'loss': 'mse', 'optimizer': 'adam', 'graph_mode': 'cutoff', 'cutoff': 0.8195419050117001, 'grm_norm': 'none', 'self_loops': False, 'use_snp_selection': False}. Best is trial 42 with value: 0.2969538400699926.
[I 2025-12-09 14:34:14,683] Trial 121 finished with value: 0.2862832811993004 and parameters: {'model_type': 'graphsage', 'hidden_dims': '[256, 128, 64]', 'dropout': 0.5303799648206162, 'batch_norm': True, 'sage_aggr': 'mean', 'sage_normalize': False, 'sage_project': False, 'lr': 0.004539949218628079, 'weight_decay': 3.9263311707020716e-05, 'epochs': 75, 'loss': 'mse', 'optimizer': 'adam', 'graph_mode': 'cutoff', 'cutoff': 0.8875992152131185, 'grm_norm': 'none', 'self_loops': True, 'use_snp_selection': False}. Best is trial 42 with value: 0.2969538400699926.
[I 2025-12-09 14:34:43,042] Trial 122 finished with value: 0.2826443077337243 and parameters: {'model_type': 'graphsage', 'hidden_dims': '[256, 128, 64]', 'dropout': 0.557617658690343, 'batch_norm': True, 'sage_aggr': 'mean', 'sage_normalize': False, 'sage_project': False, 'lr': 0.0034268494075912763, 'weight_decay': 1.960715946260658e-05, 'epochs': 77, 'loss': 'mse', 'optimizer': 'adam', 'graph_mode': 'cutoff', 'cutoff': 0.7988108451075937, 'grm_norm': 'none', 'self_loops': True, 'use_snp_selection': False}. Best is trial 42 with value: 0.2969538400699926.
[I 2025-12-09 14:35:07,627] Trial 123 finished with value: 0.2881573246084459 and parameters: {'model_type': 'graphsage', 'hidden_dims': '[256, 128, 64]', 'dropout': 0.5443041079526955, 'batch_norm': True, 'sage_aggr': 'mean', 'sage_normalize': False, 'sage_project': False, 'lr': 0.006660007352931427, 'weight_decay': 2.6035697428423194e-05, 'epochs': 61, 'loss': 'mse', 'optimizer': 'adam', 'graph_mode': 'cutoff', 'cutoff': 0.7557693690114018, 'grm_norm': 'none', 'self_loops': True, 'use_snp_selection': False}. Best is trial 42 with value: 0.2969538400699926.
[I 2025-12-09 14:36:00,744] Trial 124 finished with value: 0.2819388509449877 and parameters: {'model_type': 'graphsage', 'hidden_dims': '[256, 128, 64]', 'dropout': 0.5199168002778545, 'batch_norm': True, 'sage_aggr': 'mean', 'sage_normalize': False, 'sage_project': False, 'lr': 0.009927730708512607, 'weight_decay': 6.13539629904808e-05, 'epochs': 81, 'loss': 'mse', 'optimizer': 'adam', 'graph_mode': 'cutoff', 'cutoff': 0.8419587642329742, 'grm_norm': 'none', 'self_loops': True, 'use_snp_selection': True, 'num_snps': 42466}. Best is trial 42 with value: 0.2969538400699926.
[I 2025-12-09 14:36:23,999] Trial 125 finished with value: 0.2878712384564503 and parameters: {'model_type': 'graphsage', 'hidden_dims': '[256, 128, 64]', 'dropout': 0.5041982542712659, 'batch_norm': True, 'sage_aggr': 'mean', 'sage_normalize': False, 'sage_project': False, 'lr': 0.0077163115425884915, 'weight_decay': 1.3546744290846454e-05, 'epochs': 55, 'loss': 'mae', 'optimizer': 'adam', 'graph_mode': 'cutoff', 'cutoff': 0.8301715034573274, 'grm_norm': 'gcn', 'self_loops': True, 'use_snp_selection': False}. Best is trial 42 with value: 0.2969538400699926.
[I 2025-12-09 14:37:29,376] Trial 126 finished with value: 0.28380388193064426 and parameters: {'model_type': 'graphsage', 'hidden_dims': '[512, 256]', 'dropout': 0.5829425754637035, 'batch_norm': True, 'sage_aggr': 'mean', 'sage_normalize': False, 'sage_project': False, 'lr': 0.005068131296806553, 'weight_decay': 4.4020310593007756e-05, 'epochs': 71, 'loss': 'mae', 'optimizer': 'adam', 'graph_mode': 'cutoff', 'cutoff': 0.872927639458422, 'grm_norm': 'none', 'self_loops': True, 'use_snp_selection': True, 'num_snps': 47075}. Best is trial 42 with value: 0.2969538400699926.
[I 2025-12-09 14:38:37,392] Trial 127 finished with value: 0.29197467052702747 and parameters: {'model_type': 'graphsage', 'hidden_dims': '[512, 128]', 'dropout': 0.5698893634752783, 'batch_norm': True, 'sage_aggr': 'mean', 'sage_normalize': False, 'sage_project': False, 'lr': 0.0027704394711505044, 'weight_decay': 2.8897146705788734e-05, 'epochs': 66, 'loss': 'mae', 'optimizer': 'adam', 'graph_mode': 'cutoff', 'cutoff': 0.7810205446450278, 'grm_norm': 'cosine_then_gcn', 'self_loops': True, 'use_snp_selection': True, 'num_snps': 51077}. Best is trial 42 with value: 0.2969538400699926.
[I 2025-12-09 14:39:19,963] Trial 128 finished with value: 0.29554775746056683 and parameters: {'model_type': 'graphsage', 'hidden_dims': '[256, 128, 64]', 'dropout': 0.5475827949088107, 'batch_norm': True, 'sage_aggr': 'mean', 'sage_normalize': False, 'sage_project': False, 'lr': 0.005661208504080352, 'weight_decay': 5.14421582625715e-06, 'epochs': 43, 'loss': 'mae', 'optimizer': 'adam', 'graph_mode': 'cutoff', 'cutoff': 0.718273063162457, 'grm_norm': 'none', 'self_loops': True, 'use_snp_selection': True, 'num_snps': 35179}. Best is trial 42 with value: 0.2969538400699926.
[I 2025-12-09 14:40:00,741] Trial 129 finished with value: 0.29197286686563145 and parameters: {'model_type': 'graphsage', 'hidden_dims': '[256, 128, 64]', 'dropout': 0.5355786741293963, 'batch_norm': True, 'sage_aggr': 'mean', 'sage_normalize': False, 'sage_project': False, 'lr': 0.006839762745877697, 'weight_decay': 5.072539372587231e-06, 'epochs': 44, 'loss': 'mae', 'optimizer': 'adam', 'graph_mode': 'cutoff', 'cutoff': 0.7208182131663194, 'grm_norm': 'none', 'self_loops': True, 'use_snp_selection': True, 'num_snps': 31013}. Best is trial 42 with value: 0.2969538400699926.
[I 2025-12-09 14:41:00,103] Trial 130 finished with value: 0.28264207045971773 and parameters: {'model_type': 'graphsage', 'hidden_dims': '[256, 128, 64]', 'dropout': 0.5510722618124145, 'batch_norm': True, 'sage_aggr': 'mean', 'sage_normalize': False, 'sage_project': False, 'lr': 0.00394095008422446, 'weight_decay': 3.6722876015443667e-06, 'epochs': 212, 'loss': 'mse', 'optimizer': 'adam', 'graph_mode': 'cutoff', 'cutoff': 0.691820752952717, 'grm_norm': 'none', 'self_loops': True, 'use_snp_selection': False}. Best is trial 42 with value: 0.2969538400699926.
[I 2025-12-09 14:41:39,626] Trial 131 finished with value: 0.2930571218579917 and parameters: {'model_type': 'graphsage', 'hidden_dims': '[256, 128, 64]', 'dropout': 0.5322923336878577, 'batch_norm': True, 'sage_aggr': 'mean', 'sage_normalize': False, 'sage_project': False, 'lr': 0.005846155571360894, 'weight_decay': 7.462275560713462e-06, 'epochs': 53, 'loss': 'mae', 'optimizer': 'adam', 'graph_mode': 'cutoff', 'cutoff': 0.6715252411288095, 'grm_norm': 'none', 'self_loops': True, 'use_snp_selection': True, 'num_snps': 26367}. Best is trial 42 with value: 0.2969538400699926.
[I 2025-12-09 14:42:17,404] Trial 132 finished with value: 0.28626524577516865 and parameters: {'model_type': 'graphsage', 'hidden_dims': '[256, 128, 64]', 'dropout': 0.561316244036787, 'batch_norm': True, 'sage_aggr': 'mean', 'sage_normalize': False, 'sage_project': False, 'lr': 0.005721886241910148, 'weight_decay': 4.282821803130328e-06, 'epochs': 52, 'loss': 'mae', 'optimizer': 'adam', 'graph_mode': 'cutoff', 'cutoff': 0.7126035214689914, 'grm_norm': 'none', 'self_loops': True, 'use_snp_selection': True, 'num_snps': 23483}. Best is trial 42 with value: 0.2969538400699926.
[I 2025-12-09 14:42:58,435] Trial 133 finished with value: 0.2938743654421786 and parameters: {'model_type': 'graphsage', 'hidden_dims': '[256, 128, 64]', 'dropout': 0.5898749389931492, 'batch_norm': True, 'sage_aggr': 'mean', 'sage_normalize': False, 'sage_project': False, 'lr': 0.008406665517685994, 'weight_decay': 6.3405343897162255e-06, 'epochs': 40, 'loss': 'mae', 'optimizer': 'adam', 'graph_mode': 'cutoff', 'cutoff': 0.7391243103964741, 'grm_norm': 'none', 'self_loops': True, 'use_snp_selection': True, 'num_snps': 32827}. Best is trial 42 with value: 0.2969538400699926.
[I 2025-12-09 14:43:40,083] Trial 134 finished with value: 0.2946993257024636 and parameters: {'model_type': 'graphsage', 'hidden_dims': '[256, 128, 64]', 'dropout': 0.5890991175562179, 'batch_norm': True, 'sage_aggr': 'mean', 'sage_normalize': False, 'sage_project': False, 'lr': 0.006014375179280067, 'weight_decay': 2.658524834434818e-06, 'epochs': 42, 'loss': 'mae', 'optimizer': 'adam', 'graph_mode': 'cutoff', 'cutoff': 0.7347020477970441, 'grm_norm': 'none', 'self_loops': True, 'use_snp_selection': True, 'num_snps': 33909}. Best is trial 42 with value: 0.2969538400699926.
[I 2025-12-09 14:44:21,683] Trial 135 finished with value: 0.2918436853254102 and parameters: {'model_type': 'graphsage', 'hidden_dims': '[256, 128, 64]', 'dropout': 0.5912795620678859, 'batch_norm': True, 'sage_aggr': 'mean', 'sage_normalize': False, 'sage_project': False, 'lr': 0.008631667345161359, 'weight_decay': 1.6257383620268408e-06, 'epochs': 44, 'loss': 'mae', 'optimizer': 'adam', 'graph_mode': 'cutoff', 'cutoff': 0.733208227337534, 'grm_norm': 'none', 'self_loops': True, 'use_snp_selection': True, 'num_snps': 33326}. Best is trial 42 with value: 0.2969538400699926.
[I 2025-12-09 14:45:00,508] Trial 136 finished with value: 0.2902117617806788 and parameters: {'model_type': 'graphsage', 'hidden_dims': '[256, 128, 64]', 'dropout': 0.33150200745949043, 'batch_norm': True, 'sage_aggr': 'mean', 'sage_normalize': False, 'sage_project': False, 'lr': 0.005925347978124768, 'weight_decay': 5.7677463172894905e-06, 'epochs': 40, 'loss': 'mae', 'optimizer': 'adam', 'graph_mode': 'cutoff', 'cutoff': 0.6758101035897301, 'grm_norm': 'none', 'self_loops': True, 'use_snp_selection': True, 'num_snps': 27904}. Best is trial 42 with value: 0.2969538400699926.
[I 2025-12-09 14:45:41,125] Trial 137 finished with value: 0.29156033298881817 and parameters: {'model_type': 'graphsage', 'hidden_dims': '[256, 128, 64]', 'dropout': 0.5790019791978892, 'batch_norm': True, 'sage_aggr': 'mean', 'sage_normalize': False, 'sage_project': False, 'lr': 0.0077020197475443225, 'weight_decay': 2.2602509350450175e-06, 'epochs': 50, 'loss': 'mae', 'optimizer': 'adam', 'graph_mode': 'cutoff', 'cutoff': 0.7104239686125625, 'grm_norm': 'none', 'self_loops': True, 'use_snp_selection': True, 'num_snps': 29077}. Best is trial 42 with value: 0.2969538400699926.
[I 2025-12-09 14:46:32,779] Trial 138 finished with value: 0.19870200488816425 and parameters: {'model_type': 'graphsage', 'hidden_dims': '[256, 128, 64]', 'dropout': 0.5652625538134509, 'batch_norm': True, 'sage_aggr': 'mean', 'sage_normalize': True, 'sage_project': False, 'lr': 0.008824200099335532, 'weight_decay': 3.001908910257487e-06, 'epochs': 40, 'loss': 'mae', 'optimizer': 'adam', 'graph_mode': 'knn', 'knn_k': 6, 'weighted_edges': True, 'symmetrize_mode': 'mutual', 'self_loops': True, 'use_snp_selection': True, 'num_snps': 36301}. Best is trial 42 with value: 0.2969538400699926.
[I 2025-12-09 14:47:15,769] Trial 139 finished with value: 0.2983312496726147 and parameters: {'model_type': 'graphsage', 'hidden_dims': '[256, 128, 64]', 'dropout': 0.5473819991942735, 'batch_norm': True, 'sage_aggr': 'mean', 'sage_normalize': False, 'sage_project': False, 'lr': 0.006923055215119802, 'weight_decay': 1.2385697603177188e-06, 'epochs': 53, 'loss': 'mae', 'optimizer': 'adam', 'graph_mode': 'cutoff', 'cutoff': 0.655917222611915, 'grm_norm': 'none', 'self_loops': True, 'use_snp_selection': True, 'num_snps': 33404}. Best is trial 139 with value: 0.2983312496726147.
[I 2025-12-09 14:47:56,429] Trial 140 finished with value: 0.2874851663947539 and parameters: {'model_type': 'graphsage', 'hidden_dims': '[128, 64]', 'dropout': 0.5434756827260694, 'batch_norm': True, 'sage_aggr': 'mean', 'sage_normalize': False, 'sage_project': False, 'lr': 0.0054242169141654, 'weight_decay': 1.0082124855718392e-06, 'epochs': 53, 'loss': 'mae', 'optimizer': 'adam', 'graph_mode': 'cutoff', 'cutoff': 0.6911640748296155, 'grm_norm': 'none', 'self_loops': True, 'use_snp_selection': True, 'num_snps': 34783}. Best is trial 139 with value: 0.2983312496726147.
[I 2025-12-09 14:48:34,843] Trial 141 finished with value: 0.29122699483326964 and parameters: {'model_type': 'graphsage', 'hidden_dims': '[256, 128, 64]', 'dropout': 0.5505092163842088, 'batch_norm': True, 'sage_aggr': 'mean', 'sage_normalize': False, 'sage_project': False, 'lr': 0.006831161493243375, 'weight_decay': 6.777496683616051e-07, 'epochs': 54, 'loss': 'mae', 'optimizer': 'adam', 'graph_mode': 'cutoff', 'cutoff': 0.654093869681236, 'grm_norm': 'none', 'self_loops': True, 'use_snp_selection': True, 'num_snps': 24126}. Best is trial 139 with value: 0.2983312496726147.
[I 2025-12-09 14:49:19,263] Trial 142 finished with value: 0.29533102865058425 and parameters: {'model_type': 'graphsage', 'hidden_dims': '[256, 128, 64]', 'dropout': 0.5692276731713009, 'batch_norm': True, 'sage_aggr': 'mean', 'sage_normalize': False, 'sage_project': False, 'lr': 0.007542163771278417, 'weight_decay': 7.090895977501279e-06, 'epochs': 47, 'loss': 'mae', 'optimizer': 'adam', 'graph_mode': 'cutoff', 'cutoff': 0.6239784389779786, 'grm_norm': 'none', 'self_loops': True, 'use_snp_selection': True, 'num_snps': 37678}. Best is trial 139 with value: 0.2983312496726147.
[I 2025-12-09 14:50:01,404] Trial 143 finished with value: 0.298585762684554 and parameters: {'model_type': 'graphsage', 'hidden_dims': '[256, 128, 64]', 'dropout': 0.5342759376390842, 'batch_norm': True, 'sage_aggr': 'mean', 'sage_normalize': False, 'sage_project': False, 'lr': 0.007906616162989348, 'weight_decay': 7.282238552822e-06, 'epochs': 47, 'loss': 'mae', 'optimizer': 'adam', 'graph_mode': 'cutoff', 'cutoff': 0.6242293403459821, 'grm_norm': 'none', 'self_loops': True, 'use_snp_selection': True, 'num_snps': 32867}. Best is trial 143 with value: 0.298585762684554.
[I 2025-12-09 14:50:43,652] Trial 144 finished with value: 0.29368489445349544 and parameters: {'model_type': 'graphsage', 'hidden_dims': '[256, 128, 64]', 'dropout': 0.5603357574423804, 'batch_norm': True, 'sage_aggr': 'mean', 'sage_normalize': False, 'sage_project': False, 'lr': 0.008016890082295457, 'weight_decay': 5.756115072546848e-06, 'epochs': 47, 'loss': 'mae', 'optimizer': 'adam', 'graph_mode': 'cutoff', 'cutoff': 0.6292623025468631, 'grm_norm': 'none', 'self_loops': True, 'use_snp_selection': True, 'num_snps': 33243}. Best is trial 143 with value: 0.298585762684554.
[I 2025-12-09 14:51:25,820] Trial 145 finished with value: 0.296442559821377 and parameters: {'model_type': 'graphsage', 'hidden_dims': '[256, 128, 64]', 'dropout': 0.5567571516115208, 'batch_norm': True, 'sage_aggr': 'mean', 'sage_normalize': False, 'sage_project': False, 'lr': 0.009689380234480016, 'weight_decay': 1.2561062161120822e-06, 'epochs': 45, 'loss': 'mae', 'optimizer': 'adam', 'graph_mode': 'cutoff', 'cutoff': 0.6292266830071855, 'grm_norm': 'none', 'self_loops': True, 'use_snp_selection': True, 'num_snps': 33727}. Best is trial 143 with value: 0.298585762684554.
[I 2025-12-09 14:52:07,354] Trial 146 finished with value: 0.2901025751586682 and parameters: {'model_type': 'graphsage', 'hidden_dims': '[256, 128, 64]', 'dropout': 0.5425286792644575, 'batch_norm': True, 'sage_aggr': 'mean', 'sage_normalize': False, 'sage_project': False, 'lr': 0.009584275541369178, 'weight_decay': 1.4201457386175955e-06, 'epochs': 45, 'loss': 'mae', 'optimizer': 'adam', 'graph_mode': 'cutoff', 'cutoff': 0.6514048002349878, 'grm_norm': 'none', 'self_loops': True, 'use_snp_selection': True, 'num_snps': 32478}. Best is trial 143 with value: 0.298585762684554.
[I 2025-12-09 14:52:49,662] Trial 147 finished with value: 0.0 and parameters: {'model_type': 'graphsage', 'hidden_dims': '[256, 128, 64]', 'dropout': 0.5552539213634788, 'batch_norm': False, 'sage_aggr': 'mean', 'sage_normalize': False, 'sage_project': False, 'lr': 0.008386815684744506, 'weight_decay': 7.102966616957387e-07, 'epochs': 40, 'loss': 'mae', 'optimizer': 'adam', 'graph_mode': 'cutoff', 'cutoff': 0.5819956589103971, 'grm_norm': 'none', 'self_loops': False, 'use_snp_selection': True, 'num_snps': 35092}. Best is trial 143 with value: 0.298585762684554.
[I 2025-12-09 14:53:35,847] Trial 148 finished with value: 0.2913048004974876 and parameters: {'model_type': 'graphsage', 'hidden_dims': '[256, 128, 64]', 'dropout': 0.5278397133894519, 'batch_norm': True, 'sage_aggr': 'mean', 'sage_normalize': False, 'sage_project': False, 'lr': 0.007650143486465645, 'weight_decay': 5.030790433575636e-07, 'epochs': 58, 'loss': 'mae', 'optimizer': 'adam', 'graph_mode': 'cutoff', 'cutoff': 0.5961473918726898, 'grm_norm': 'gcn', 'self_loops': True, 'use_snp_selection': True, 'num_snps': 36825}. Best is trial 143 with value: 0.298585762684554.
[I 2025-12-09 14:54:21,878] Trial 149 finished with value: 0.28266777501401624 and parameters: {'model_type': 'graphsage', 'hidden_dims': '[256, 128, 64]', 'dropout': 0.2174911643933105, 'batch_norm': True, 'sage_aggr': 'mean', 'sage_normalize': False, 'sage_project': False, 'lr': 0.005324831262871532, 'weight_decay': 1.233510979106469e-06, 'epochs': 49, 'loss': 'mae', 'optimizer': 'adam', 'graph_mode': 'cutoff', 'cutoff': 0.6096230255813838, 'grm_norm': 'none', 'self_loops': True, 'use_snp_selection': True, 'num_snps': 39356}. Best is trial 143 with value: 0.298585762684554.
[I 2025-12-09 14:55:46,276] Trial 0 finished with value: 0.2657459229732845 and parameters: {'model_type': 'graphsage', 'hidden_dims': '[128, 64]', 'dropout': 0.199031432379812, 'batch_norm': True, 'sage_aggr': 'max', 'sage_normalize': True, 'sage_project': False, 'lr': 0.00034401453323286885, 'weight_decay': 0.00017802616915745114, 'epochs': 230, 'loss': 'mse', 'optimizer': 'adam', 'graph_mode': 'knn', 'knn_k': 6, 'weighted_edges': True, 'symmetrize_mode': 'mutual', 'self_loops': True, 'use_snp_selection': False}. Best is trial 0 with value: 0.2657459229732845.
[I 2025-12-09 14:57:32,600] Trial 1 finished with value: 0.27858329846109714 and parameters: {'model_type': 'graphsage', 'hidden_dims': '[512, 128]', 'dropout': 0.2503500283181017, 'batch_norm': False, 'sage_aggr': 'max', 'sage_normalize': False, 'sage_project': False, 'lr': 3.952233718592099e-05, 'weight_decay': 0.00026754769258252603, 'epochs': 149, 'loss': 'mse', 'optimizer': 'adam', 'graph_mode': 'knn', 'knn_k': 2, 'weighted_edges': False, 'symmetrize_mode': 'mutual', 'self_loops': True, 'use_snp_selection': True, 'num_snps': 49915}. Best is trial 1 with value: 0.27858329846109714.
[I 2025-12-09 14:58:52,700] Trial 2 finished with value: 0.27553016989270207 and parameters: {'model_type': 'graphsage', 'hidden_dims': '[512, 256]', 'dropout': 0.2785908793172681, 'batch_norm': False, 'sage_aggr': 'max', 'sage_normalize': False, 'sage_project': False, 'lr': 8.806039223165805e-05, 'weight_decay': 3.5153176302760294e-05, 'epochs': 147, 'loss': 'mae', 'optimizer': 'adam', 'graph_mode': 'cutoff', 'cutoff': 0.4922564006874869, 'grm_norm': 'gcn', 'self_loops': False, 'use_snp_selection': True, 'num_snps': 34340}. Best is trial 1 with value: 0.27858329846109714.
[I 2025-12-09 15:00:10,514] Trial 3 finished with value: 0.2854878492473889 and parameters: {'model_type': 'graphsage', 'hidden_dims': '[256, 128, 64]', 'dropout': 0.3475243154412272, 'batch_norm': True, 'sage_aggr': 'max', 'sage_normalize': False, 'sage_project': False, 'lr': 1.6006331996938085e-05, 'weight_decay': 7.213121225589906e-06, 'epochs': 283, 'loss': 'mse', 'optimizer': 'adam', 'graph_mode': 'cutoff', 'cutoff': 0.5942334791449215, 'grm_norm': 'none', 'self_loops': True, 'use_snp_selection': False}. Best is trial 3 with value: 0.2854878492473889.
[I 2025-12-09 15:00:54,342] Trial 4 finished with value: 0.26145752681954937 and parameters: {'model_type': 'graphsage', 'hidden_dims': '[128, 64]', 'dropout': 0.3348926467202472, 'batch_norm': True, 'sage_aggr': 'max', 'sage_normalize': False, 'sage_project': False, 'lr': 0.0004238630400638802, 'weight_decay': 8.074086040046576e-07, 'epochs': 158, 'loss': 'mae', 'optimizer': 'adam', 'graph_mode': 'knn', 'knn_k': 1, 'weighted_edges': False, 'symmetrize_mode': 'mutual', 'self_loops': False, 'use_snp_selection': True, 'num_snps': 26850}. Best is trial 3 with value: 0.2854878492473889.
[I 2025-12-09 15:02:48,738] Trial 5 finished with value: 0.26347953386812833 and parameters: {'model_type': 'graphsage', 'hidden_dims': '[512, 64]', 'dropout': 0.14505336736221927, 'batch_norm': True, 'sage_aggr': 'mean', 'sage_normalize': True, 'sage_project': False, 'lr': 1.2962030165732234e-05, 'weight_decay': 1.326598071105465e-07, 'epochs': 180, 'loss': 'mse', 'optimizer': 'adam', 'graph_mode': 'knn', 'knn_k': 9, 'weighted_edges': True, 'symmetrize_mode': 'mutual', 'self_loops': False, 'use_snp_selection': False}. Best is trial 3 with value: 0.2854878492473889.
