[I 2025-12-09 01:52:55,566] Trial 82 finished with value: 0.2853552162309449 and parameters: {'model_type': 'graphsage', 'hidden_dims': '[512, 64]', 'dropout': 0.29438853475529886, 'batch_norm': False, 'sage_aggr': 'mean', 'sage_normalize': False, 'sage_project': False, 'lr': 1.0082519933743518e-05, 'weight_decay': 2.4959422975107236e-07, 'epochs': 256, 'loss': 'mae', 'optimizer': 'adam', 'graph_mode': 'cutoff', 'cutoff': 0.5755719373759522, 'grm_norm': 'cosine', 'self_loops': False, 'use_snp_selection': False}. Best is trial 63 with value: 0.29051347740500066.
[I 2025-12-09 01:54:59,446] Trial 83 finished with value: 0.2764962082991097 and parameters: {'model_type': 'graphsage', 'hidden_dims': '[512, 64]', 'dropout': 0.29214643095720105, 'batch_norm': False, 'sage_aggr': 'mean', 'sage_normalize': False, 'sage_project': False, 'lr': 1.3774916644243088e-05, 'weight_decay': 2.4706733432685706e-07, 'epochs': 236, 'loss': 'mae', 'optimizer': 'adam', 'graph_mode': 'cutoff', 'cutoff': 0.47451160644973933, 'grm_norm': 'cosine', 'self_loops': False, 'use_snp_selection': False}. Best is trial 63 with value: 0.29051347740500066.
[I 2025-12-09 01:57:00,950] Trial 84 finished with value: 0.2871593354810142 and parameters: {'model_type': 'graphsage', 'hidden_dims': '[512, 256]', 'dropout': 0.27827831312355084, 'batch_norm': False, 'sage_aggr': 'mean', 'sage_normalize': False, 'sage_project': False, 'lr': 1.0175362336621486e-05, 'weight_decay': 3.634800609780451e-07, 'epochs': 257, 'loss': 'mae', 'optimizer': 'adam', 'graph_mode': 'cutoff', 'cutoff': 0.5733110633976674, 'grm_norm': 'cosine', 'self_loops': False, 'use_snp_selection': False}. Best is trial 63 with value: 0.29051347740500066.
[I 2025-12-09 01:58:56,508] Trial 85 finished with value: 0.2855204787552729 and parameters: {'model_type': 'graphsage', 'hidden_dims': '[512, 256]', 'dropout': 0.273942931573853, 'batch_norm': False, 'sage_aggr': 'mean', 'sage_normalize': False, 'sage_project': False, 'lr': 2.4326096670314403e-05, 'weight_decay': 4.424423863625084e-07, 'epochs': 244, 'loss': 'mae', 'optimizer': 'adam', 'graph_mode': 'cutoff', 'cutoff': 0.5430982797797455, 'grm_norm': 'cosine', 'self_loops': False, 'use_snp_selection': False}. Best is trial 63 with value: 0.29051347740500066.
[I 2025-12-09 02:01:05,612] Trial 86 finished with value: 0.27770598750163983 and parameters: {'model_type': 'graphsage', 'hidden_dims': '[512, 256]', 'dropout': 0.27897806094832023, 'batch_norm': False, 'sage_aggr': 'mean', 'sage_normalize': False, 'sage_project': False, 'lr': 2.5388016652601354e-05, 'weight_decay': 8.982778596552669e-07, 'epochs': 247, 'loss': 'mae', 'optimizer': 'adam', 'graph_mode': 'cutoff', 'cutoff': 0.4586681285858893, 'grm_norm': 'cosine', 'self_loops': False, 'use_snp_selection': False}. Best is trial 63 with value: 0.29051347740500066.
[I 2025-12-09 02:03:11,908] Trial 87 finished with value: 0.25137277884570325 and parameters: {'model_type': 'graphsage', 'hidden_dims': '[512, 256]', 'dropout': 0.31390069129510717, 'batch_norm': False, 'sage_aggr': 'mean', 'sage_normalize': True, 'sage_project': False, 'lr': 1.5388331504954664e-05, 'weight_decay': 2.1042021186269085e-07, 'epochs': 263, 'loss': 'mae', 'optimizer': 'adam', 'graph_mode': 'cutoff', 'cutoff': 0.5551599525610126, 'grm_norm': 'cosine_then_gcn', 'self_loops': False, 'use_snp_selection': False}. Best is trial 63 with value: 0.29051347740500066.
[I 2025-12-09 02:05:17,027] Trial 88 finished with value: 0.27589355396600024 and parameters: {'model_type': 'graphsage', 'hidden_dims': '[512, 256]', 'dropout': 0.34053767357562686, 'batch_norm': False, 'sage_aggr': 'max', 'sage_normalize': False, 'sage_project': False, 'lr': 2.101084056863009e-05, 'weight_decay': 5.721020416352483e-07, 'epochs': 265, 'loss': 'mae', 'optimizer': 'adam', 'graph_mode': 'cutoff', 'cutoff': 0.537294134018853, 'grm_norm': 'cosine', 'self_loops': False, 'use_snp_selection': False}. Best is trial 63 with value: 0.29051347740500066.
[I 2025-12-09 02:09:19,648] Trial 89 finished with value: 0.0 and parameters: {'model_type': 'graphsage', 'hidden_dims': '[512, 256]', 'dropout': 0.33500587939771376, 'batch_norm': False, 'sage_aggr': 'mean', 'sage_normalize': False, 'sage_project': False, 'lr': 0.003970866647517963, 'weight_decay': 4.438115065945054e-07, 'epochs': 270, 'loss': 'mae', 'optimizer': 'adam', 'graph_mode': 'knn', 'knn_k': 10, 'weighted_edges': False, 'symmetrize_mode': 'union', 'self_loops': False, 'use_snp_selection': False}. Best is trial 63 with value: 0.29051347740500066.
[I 2025-12-09 02:11:20,706] Trial 90 finished with value: 0.2832751775101211 and parameters: {'model_type': 'graphsage', 'hidden_dims': '[512, 256]', 'dropout': 0.2584975660755228, 'batch_norm': False, 'sage_aggr': 'mean', 'sage_normalize': False, 'sage_project': False, 'lr': 1.2019812295189872e-05, 'weight_decay': 1.70492010560452e-07, 'epochs': 241, 'loss': 'mae', 'optimizer': 'adam', 'graph_mode': 'cutoff', 'cutoff': 0.5089199230346831, 'grm_norm': 'cosine', 'self_loops': False, 'use_snp_selection': True, 'num_snps': 41364}. Best is trial 63 with value: 0.29051347740500066.
[I 2025-12-09 02:13:09,363] Trial 91 finished with value: 0.28878967393298793 and parameters: {'model_type': 'graphsage', 'hidden_dims': '[512, 256]', 'dropout': 0.2776071158828088, 'batch_norm': False, 'sage_aggr': 'mean', 'sage_normalize': False, 'sage_project': False, 'lr': 1.7515399407079985e-05, 'weight_decay': 3.488148664078208e-07, 'epochs': 231, 'loss': 'mae', 'optimizer': 'adam', 'graph_mode': 'cutoff', 'cutoff': 0.5962491294558656, 'grm_norm': 'cosine', 'self_loops': False, 'use_snp_selection': False}. Best is trial 63 with value: 0.29051347740500066.
[I 2025-12-09 02:15:07,726] Trial 92 finished with value: 0.2860621450129166 and parameters: {'model_type': 'graphsage', 'hidden_dims': '[512, 256]', 'dropout': 0.2781387836815951, 'batch_norm': False, 'sage_aggr': 'mean', 'sage_normalize': False, 'sage_project': False, 'lr': 1.6770800357107988e-05, 'weight_decay': 4.6773163987052523e-07, 'epochs': 253, 'loss': 'mae', 'optimizer': 'adam', 'graph_mode': 'cutoff', 'cutoff': 0.5732668414772291, 'grm_norm': 'cosine', 'self_loops': False, 'use_snp_selection': False}. Best is trial 63 with value: 0.29051347740500066.
[I 2025-12-09 02:17:21,098] Trial 93 finished with value: 0.28485121475221575 and parameters: {'model_type': 'graphsage', 'hidden_dims': '[512, 256]', 'dropout': 0.3011388344563395, 'batch_norm': False, 'sage_aggr': 'mean', 'sage_normalize': False, 'sage_project': False, 'lr': 1.7326107180432034e-05, 'weight_decay': 2.9263745634042195e-07, 'epochs': 291, 'loss': 'mae', 'optimizer': 'adam', 'graph_mode': 'cutoff', 'cutoff': 0.5959219901754573, 'grm_norm': 'cosine', 'self_loops': False, 'use_snp_selection': False}. Best is trial 63 with value: 0.29051347740500066.
[I 2025-12-09 02:19:18,960] Trial 94 finished with value: 0.28147134118739825 and parameters: {'model_type': 'graphsage', 'hidden_dims': '[512, 256]', 'dropout': 0.3537849739564992, 'batch_norm': False, 'sage_aggr': 'mean', 'sage_normalize': False, 'sage_project': False, 'lr': 1.488589931258252e-05, 'weight_decay': 1.281026210251207e-07, 'epochs': 252, 'loss': 'mae', 'optimizer': 'adam', 'graph_mode': 'cutoff', 'cutoff': 0.573482718955596, 'grm_norm': 'cosine', 'self_loops': False, 'use_snp_selection': False}. Best is trial 63 with value: 0.29051347740500066.
[I 2025-12-09 02:21:06,217] Trial 95 finished with value: 0.2839250675895581 and parameters: {'model_type': 'graphsage', 'hidden_dims': '[512, 256]', 'dropout': 0.3167122083977554, 'batch_norm': False, 'sage_aggr': 'mean', 'sage_normalize': False, 'sage_project': False, 'lr': 1.0010190500581195e-05, 'weight_decay': 2.092925227848282e-07, 'epochs': 227, 'loss': 'mae', 'optimizer': 'adam', 'graph_mode': 'cutoff', 'cutoff': 0.6150964145997192, 'grm_norm': 'none', 'self_loops': False, 'use_snp_selection': False}. Best is trial 63 with value: 0.29051347740500066.
[I 2025-12-09 02:23:20,548] Trial 96 finished with value: 0.27954243955973446 and parameters: {'model_type': 'graphsage', 'hidden_dims': '[512, 256]', 'dropout': 0.3321654219993639, 'batch_norm': True, 'sage_aggr': 'mean', 'sage_normalize': False, 'sage_project': False, 'lr': 1.2421915709885411e-05, 'weight_decay': 7.563645030571475e-07, 'epochs': 283, 'loss': 'mae', 'optimizer': 'adam', 'graph_mode': 'cutoff', 'cutoff': 0.5608923124747773, 'grm_norm': 'cosine', 'self_loops': True, 'use_snp_selection': False}. Best is trial 63 with value: 0.29051347740500066.
[I 2025-12-09 02:24:20,559] Trial 97 finished with value: 0.275750591534894 and parameters: {'model_type': 'graphsage', 'hidden_dims': '[256, 128]', 'dropout': 0.2806248237345695, 'batch_norm': False, 'sage_aggr': 'mean', 'sage_normalize': False, 'sage_project': False, 'lr': 1.861527120550283e-05, 'weight_decay': 1.594334922828629e-07, 'epochs': 213, 'loss': 'mse', 'optimizer': 'adam', 'graph_mode': 'cutoff', 'cutoff': 0.6034076541861848, 'grm_norm': 'cosine', 'self_loops': False, 'use_snp_selection': False}. Best is trial 63 with value: 0.29051347740500066.
[I 2025-12-09 02:25:58,868] Trial 98 finished with value: 0.28785447318796276 and parameters: {'model_type': 'graphsage', 'hidden_dims': '[512, 256]', 'dropout': 0.367526916860065, 'batch_norm': False, 'sage_aggr': 'mean', 'sage_normalize': False, 'sage_project': False, 'lr': 1.3649948585577887e-05, 'weight_decay': 3.486623700014598e-07, 'epochs': 207, 'loss': 'mae', 'optimizer': 'adam', 'graph_mode': 'cutoff', 'cutoff': 0.6224947564853853, 'grm_norm': 'gcn', 'self_loops': False, 'use_snp_selection': False}. Best is trial 63 with value: 0.29051347740500066.
[I 2025-12-09 02:26:36,600] Trial 99 finished with value: 0.2830331637710447 and parameters: {'model_type': 'graphsage', 'hidden_dims': '[128, 64]', 'dropout': 0.3716045088921082, 'batch_norm': False, 'sage_aggr': 'mean', 'sage_normalize': False, 'sage_project': False, 'lr': 1.1602688402697209e-05, 'weight_decay': 1.796574969134046e-07, 'epochs': 189, 'loss': 'mae', 'optimizer': 'adam', 'graph_mode': 'cutoff', 'cutoff': 0.6232417837552944, 'grm_norm': 'gcn', 'self_loops': False, 'use_snp_selection': False}. Best is trial 63 with value: 0.29051347740500066.
[I 2025-12-09 02:27:54,139] Trial 100 finished with value: 0.034829348944545244 and parameters: {'model_type': 'graphsage', 'hidden_dims': '[256, 128, 64]', 'dropout': 0.34949345869179355, 'batch_norm': False, 'sage_aggr': 'mean', 'sage_normalize': False, 'sage_project': False, 'lr': 0.0015053966820795016, 'weight_decay': 1.1586549119166293e-07, 'epochs': 224, 'loss': 'mae', 'optimizer': 'adam', 'graph_mode': 'cutoff', 'cutoff': 0.3939115176299397, 'grm_norm': 'gcn', 'self_loops': False, 'use_snp_selection': False}. Best is trial 63 with value: 0.29051347740500066.
[I 2025-12-09 02:29:34,062] Trial 101 finished with value: 0.28847255461592713 and parameters: {'model_type': 'graphsage', 'hidden_dims': '[512, 256]', 'dropout': 0.30186815981088877, 'batch_norm': False, 'sage_aggr': 'mean', 'sage_normalize': False, 'sage_project': False, 'lr': 1.3348663194766372e-05, 'weight_decay': 3.441457172018914e-07, 'epochs': 207, 'loss': 'mae', 'optimizer': 'adam', 'graph_mode': 'cutoff', 'cutoff': 0.5673557290847038, 'grm_norm': 'gcn', 'self_loops': False, 'use_snp_selection': False}. Best is trial 63 with value: 0.29051347740500066.
[I 2025-12-09 02:31:13,387] Trial 102 finished with value: 0.2880504848671607 and parameters: {'model_type': 'graphsage', 'hidden_dims': '[512, 256]', 'dropout': 0.41712811813230793, 'batch_norm': False, 'sage_aggr': 'mean', 'sage_normalize': False, 'sage_project': False, 'lr': 1.3183389035321114e-05, 'weight_decay': 3.5506578779887e-07, 'epochs': 208, 'loss': 'mae', 'optimizer': 'adam', 'graph_mode': 'cutoff', 'cutoff': 0.5927367790818676, 'grm_norm': 'gcn', 'self_loops': False, 'use_snp_selection': False}. Best is trial 63 with value: 0.29051347740500066.
[I 2025-12-09 02:32:59,904] Trial 103 finished with value: 0.27105235985512927 and parameters: {'model_type': 'graphsage', 'hidden_dims': '[512, 256]', 'dropout': 0.38804042668566047, 'batch_norm': False, 'sage_aggr': 'mean', 'sage_normalize': False, 'sage_project': False, 'lr': 1.3889023492771766e-05, 'weight_decay': 3.578176280696262e-07, 'epochs': 172, 'loss': 'mae', 'optimizer': 'adam', 'graph_mode': 'cutoff', 'cutoff': 0.2943608262774151, 'grm_norm': 'gcn', 'self_loops': False, 'use_snp_selection': False}. Best is trial 63 with value: 0.29051347740500066.
[I 2025-12-09 02:34:37,318] Trial 104 finished with value: 0.29099341814667246 and parameters: {'model_type': 'graphsage', 'hidden_dims': '[512, 256]', 'dropout': 0.4149166118875331, 'batch_norm': False, 'sage_aggr': 'mean', 'sage_normalize': False, 'sage_project': False, 'lr': 1.3851137178894383e-05, 'weight_decay': 2.933801624197958e-07, 'epochs': 203, 'loss': 'mae', 'optimizer': 'adam', 'graph_mode': 'cutoff', 'cutoff': 0.5888731370560742, 'grm_norm': 'gcn', 'self_loops': False, 'use_snp_selection': False}. Best is trial 104 with value: 0.29099341814667246.
[I 2025-12-09 02:36:16,479] Trial 105 finished with value: 0.2819588883234065 and parameters: {'model_type': 'graphsage', 'hidden_dims': '[512, 256]', 'dropout': 0.43826139743098225, 'batch_norm': False, 'sage_aggr': 'mean', 'sage_normalize': False, 'sage_project': False, 'lr': 1.33159920384373e-05, 'weight_decay': 3.0399607505768355e-07, 'epochs': 207, 'loss': 'mae', 'optimizer': 'adam', 'graph_mode': 'cutoff', 'cutoff': 0.5852940753630891, 'grm_norm': 'gcn', 'self_loops': False, 'use_snp_selection': False}. Best is trial 104 with value: 0.29099341814667246.
[I 2025-12-09 02:37:53,104] Trial 106 finished with value: 0.2480884248902564 and parameters: {'model_type': 'graphsage', 'hidden_dims': '[512, 256]', 'dropout': 0.4180146470700731, 'batch_norm': False, 'sage_aggr': 'max', 'sage_normalize': True, 'sage_project': False, 'lr': 2.1148730797823753e-05, 'weight_decay': 1.2677114399820886e-06, 'epochs': 201, 'loss': 'mae', 'optimizer': 'adam', 'graph_mode': 'cutoff', 'cutoff': 0.8671849179551872, 'grm_norm': 'gcn', 'self_loops': False, 'use_snp_selection': False}. Best is trial 104 with value: 0.29099341814667246.
[I 2025-12-09 02:39:33,007] Trial 107 finished with value: 0.2831868605422458 and parameters: {'model_type': 'graphsage', 'hidden_dims': '[512, 256]', 'dropout': 0.45331173762693017, 'batch_norm': False, 'sage_aggr': 'mean', 'sage_normalize': False, 'sage_project': False, 'lr': 2.9744257033900354e-05, 'weight_decay': 5.409608460619585e-07, 'epochs': 204, 'loss': 'mae', 'optimizer': 'adam', 'graph_mode': 'cutoff', 'cutoff': 0.5426728028269694, 'grm_norm': 'gcn', 'self_loops': False, 'use_snp_selection': False}. Best is trial 104 with value: 0.29099341814667246.
[I 2025-12-09 02:41:07,674] Trial 108 finished with value: 0.2829964518396638 and parameters: {'model_type': 'graphsage', 'hidden_dims': '[512, 256]', 'dropout': 0.3010036759805049, 'batch_norm': False, 'sage_aggr': 'mean', 'sage_normalize': False, 'sage_project': False, 'lr': 1.529993531530898e-05, 'weight_decay': 6.704356759378353e-07, 'epochs': 187, 'loss': 'mae', 'optimizer': 'adam', 'graph_mode': 'cutoff', 'cutoff': 0.5244367066093242, 'grm_norm': 'gcn', 'self_loops': True, 'use_snp_selection': False}. Best is trial 104 with value: 0.29099341814667246.
[I 2025-12-09 02:43:04,141] Trial 109 finished with value: 0.26025643710698565 and parameters: {'model_type': 'graphsage', 'hidden_dims': '[512, 256]', 'dropout': 0.2666200480896767, 'batch_norm': False, 'sage_aggr': 'mean', 'sage_normalize': False, 'sage_project': False, 'lr': 1.1178721754859031e-05, 'weight_decay': 3.6154591904921126e-07, 'epochs': 215, 'loss': 'mse', 'optimizer': 'adam', 'graph_mode': 'knn', 'knn_k': 5, 'weighted_edges': True, 'symmetrize_mode': 'mutual', 'self_loops': False, 'use_snp_selection': False}. Best is trial 104 with value: 0.29099341814667246.
[I 2025-12-09 02:44:12,885] Trial 110 finished with value: 0.0 and parameters: {'model_type': 'graphsage', 'hidden_dims': '[512, 256]', 'dropout': 0.41550944833702497, 'batch_norm': False, 'sage_aggr': 'mean', 'sage_normalize': False, 'sage_project': False, 'lr': 0.0095515539799851, 'weight_decay': 2.711051346939521e-07, 'epochs': 193, 'loss': 'mae', 'optimizer': 'adam', 'graph_mode': 'cutoff', 'cutoff': 0.5928612328686166, 'grm_norm': 'gcn', 'self_loops': False, 'use_snp_selection': True, 'num_snps': 26317}. Best is trial 104 with value: 0.29099341814667246.
[I 2025-12-09 02:46:02,535] Trial 111 finished with value: 0.2902110994865023 and parameters: {'model_type': 'graphsage', 'hidden_dims': '[512, 256]', 'dropout': 0.3983255627487423, 'batch_norm': False, 'sage_aggr': 'mean', 'sage_normalize': False, 'sage_project': False, 'lr': 1.3016927684905396e-05, 'weight_decay': 2.0103993289214182e-07, 'epochs': 235, 'loss': 'mae', 'optimizer': 'adam', 'graph_mode': 'cutoff', 'cutoff': 0.630442391581646, 'grm_norm': 'gcn', 'self_loops': False, 'use_snp_selection': False}. Best is trial 104 with value: 0.29099341814667246.
[I 2025-12-09 02:47:52,252] Trial 112 finished with value: 0.28883596849034576 and parameters: {'model_type': 'graphsage', 'hidden_dims': '[512, 256]', 'dropout': 0.44939447085654904, 'batch_norm': False, 'sage_aggr': 'mean', 'sage_normalize': False, 'sage_project': False, 'lr': 1.284727802669344e-05, 'weight_decay': 2.1962569768621262e-07, 'epochs': 235, 'loss': 'mae', 'optimizer': 'adam', 'graph_mode': 'cutoff', 'cutoff': 0.6334631331601402, 'grm_norm': 'gcn', 'self_loops': False, 'use_snp_selection': False}. Best is trial 104 with value: 0.29099341814667246.
[I 2025-12-09 02:49:40,908] Trial 113 finished with value: 0.28072139124926854 and parameters: {'model_type': 'graphsage', 'hidden_dims': '[512, 256]', 'dropout': 0.463658789463144, 'batch_norm': False, 'sage_aggr': 'mean', 'sage_normalize': False, 'sage_project': False, 'lr': 1.7913595882219682e-05, 'weight_decay': 2.206055650410503e-07, 'epochs': 234, 'loss': 'mae', 'optimizer': 'adam', 'graph_mode': 'cutoff', 'cutoff': 0.6357398077462375, 'grm_norm': 'gcn', 'self_loops': False, 'use_snp_selection': False}. Best is trial 104 with value: 0.29099341814667246.
[I 2025-12-09 02:51:22,689] Trial 114 finished with value: 0.28107473333533844 and parameters: {'model_type': 'graphsage', 'hidden_dims': '[512, 256]', 'dropout': 0.4468225054558774, 'batch_norm': False, 'sage_aggr': 'mean', 'sage_normalize': False, 'sage_project': False, 'lr': 1.3153601579127561e-05, 'weight_decay': 2.157432018443385e-07, 'epochs': 217, 'loss': 'mae', 'optimizer': 'adam', 'graph_mode': 'cutoff', 'cutoff': 0.672424437714036, 'grm_norm': 'gcn', 'self_loops': False, 'use_snp_selection': False}. Best is trial 104 with value: 0.29099341814667246.
[I 2025-12-09 02:53:00,444] Trial 115 finished with value: -0.001679798595648551 and parameters: {'model_type': 'graphsage', 'hidden_dims': '[512, 256]', 'dropout': 0.4620927694759078, 'batch_norm': False, 'sage_aggr': 'mean', 'sage_normalize': False, 'sage_project': False, 'lr': 0.00024399837056204277, 'weight_decay': 1.3302446898874515e-07, 'epochs': 209, 'loss': 'mae', 'optimizer': 'adam', 'graph_mode': 'cutoff', 'cutoff': 0.6570548049370658, 'grm_norm': 'gcn', 'self_loops': False, 'use_snp_selection': False}. Best is trial 104 with value: 0.29099341814667246.
[I 2025-12-09 02:54:45,448] Trial 116 finished with value: 0.2816503281684616 and parameters: {'model_type': 'graphsage', 'hidden_dims': '[512, 256]', 'dropout': 0.47903458546571376, 'batch_norm': False, 'sage_aggr': 'mean', 'sage_normalize': False, 'sage_project': False, 'lr': 1.5392858589192044e-05, 'weight_decay': 8.970146581781744e-06, 'epochs': 223, 'loss': 'mae', 'optimizer': 'adam', 'graph_mode': 'cutoff', 'cutoff': 0.6054673886708765, 'grm_norm': 'gcn', 'self_loops': False, 'use_snp_selection': False}. Best is trial 104 with value: 0.29099341814667246.
[I 2025-12-09 02:56:14,607] Trial 117 finished with value: 0.27889839102145153 and parameters: {'model_type': 'graphsage', 'hidden_dims': '[512, 128]', 'dropout': 0.49259707117300566, 'batch_norm': True, 'sage_aggr': 'mean', 'sage_normalize': False, 'sage_project': False, 'lr': 2.0466715350753e-05, 'weight_decay': 2.885405764264392e-07, 'epochs': 181, 'loss': 'mae', 'optimizer': 'adam', 'graph_mode': 'cutoff', 'cutoff': 0.6302655998202852, 'grm_norm': 'gcn', 'self_loops': False, 'use_snp_selection': False}. Best is trial 104 with value: 0.29099341814667246.
[I 2025-12-09 02:58:04,935] Trial 118 finished with value: 0.29171594113557 and parameters: {'model_type': 'graphsage', 'hidden_dims': '[512, 256]', 'dropout': 0.4040092960994884, 'batch_norm': False, 'sage_aggr': 'mean', 'sage_normalize': False, 'sage_project': False, 'lr': 1.2483433849203596e-05, 'weight_decay': 1.822412024809984e-07, 'epochs': 231, 'loss': 'mae', 'optimizer': 'adam', 'graph_mode': 'cutoff', 'cutoff': 0.5636178503305788, 'grm_norm': 'gcn', 'self_loops': False, 'use_snp_selection': False}. Best is trial 118 with value: 0.29171594113557.
[I 2025-12-09 02:59:54,205] Trial 119 finished with value: 0.29010400905177713 and parameters: {'model_type': 'graphsage', 'hidden_dims': '[512, 256]', 'dropout': 0.42926660676065387, 'batch_norm': False, 'sage_aggr': 'mean', 'sage_normalize': False, 'sage_project': False, 'lr': 1.3050201333815053e-05, 'weight_decay': 1.440986262449441e-07, 'epochs': 229, 'loss': 'mae', 'optimizer': 'adam', 'graph_mode': 'cutoff', 'cutoff': 0.5623161712485923, 'grm_norm': 'gcn', 'self_loops': False, 'use_snp_selection': False}. Best is trial 118 with value: 0.29171594113557.
