[I 2025-12-08 22:56:49,632] Trial 75 finished with value: 0.3609549106275402 and parameters: {'model_type': 'graphsage', 'hidden_dims': '[512, 256]', 'dropout': 0.507449836381185, 'batch_norm': False, 'sage_aggr': 'max', 'sage_normalize': False, 'sage_project': False, 'lr': 3.080207727660608e-05, 'weight_decay': 3.78597230642343e-07, 'epochs': 139, 'loss': 'mae', 'optimizer': 'adam', 'graph_mode': 'cutoff', 'cutoff': 0.8147276468226929, 'grm_norm': 'cosine_then_gcn', 'self_loops': True, 'use_snp_selection': True, 'num_snps': 21931}. Best is trial 69 with value: 0.37979444876206886.
[I 2025-12-08 22:57:22,316] Trial 76 finished with value: 0.37039987248984413 and parameters: {'model_type': 'graphsage', 'hidden_dims': '[256, 128, 64]', 'dropout': 0.43332386875886175, 'batch_norm': False, 'sage_aggr': 'max', 'sage_normalize': False, 'sage_project': False, 'lr': 1.1862864282362114e-05, 'weight_decay': 5.273826006829528e-06, 'epochs': 158, 'loss': 'mae', 'optimizer': 'adam', 'graph_mode': 'cutoff', 'cutoff': 0.7680137749419921, 'grm_norm': 'cosine_then_gcn', 'self_loops': True, 'use_snp_selection': True, 'num_snps': 26593}. Best is trial 69 with value: 0.37979444876206886.
[I 2025-12-08 22:57:54,647] Trial 77 finished with value: 0.37224916186400325 and parameters: {'model_type': 'graphsage', 'hidden_dims': '[128, 64]', 'dropout': 0.5495199917782712, 'batch_norm': False, 'sage_aggr': 'mean', 'sage_normalize': False, 'sage_project': False, 'lr': 1.7332751220599452e-05, 'weight_decay': 1.961380289473205e-06, 'epochs': 211, 'loss': 'mae', 'optimizer': 'adam', 'graph_mode': 'cutoff', 'cutoff': 0.8479335085943953, 'grm_norm': 'cosine_then_gcn', 'self_loops': False, 'use_snp_selection': True, 'num_snps': 30996}. Best is trial 69 with value: 0.37979444876206886.
[I 2025-12-08 22:58:18,151] Trial 78 finished with value: 0.36780374549275135 and parameters: {'model_type': 'graphsage', 'hidden_dims': '[128, 64]', 'dropout': 0.5473380091962956, 'batch_norm': False, 'sage_aggr': 'mean', 'sage_normalize': False, 'sage_project': False, 'lr': 1.3805438705817743e-05, 'weight_decay': 7.556106882861768e-07, 'epochs': 222, 'loss': 'mse', 'optimizer': 'adam', 'graph_mode': 'cutoff', 'cutoff': 0.7119435598566867, 'grm_norm': 'cosine_then_gcn', 'self_loops': False, 'use_snp_selection': True, 'num_snps': 18998}. Best is trial 69 with value: 0.37979444876206886.
[I 2025-12-08 22:58:56,780] Trial 79 finished with value: 0.30048353876806355 and parameters: {'model_type': 'graphsage', 'hidden_dims': '[128, 64]', 'dropout': 0.5658167913734774, 'batch_norm': True, 'sage_aggr': 'mean', 'sage_normalize': True, 'sage_project': False, 'lr': 1.1274597444832345e-05, 'weight_decay': 3.417696860523906e-05, 'epochs': 210, 'loss': 'mae', 'optimizer': 'adam', 'graph_mode': 'cutoff', 'cutoff': 0.8367943206058323, 'grm_norm': 'cosine', 'self_loops': False, 'use_snp_selection': False}. Best is trial 69 with value: 0.37979444876206886.
[I 2025-12-08 22:59:37,291] Trial 80 finished with value: 0.3519981753346428 and parameters: {'model_type': 'graphsage', 'hidden_dims': '[128, 64]', 'dropout': 0.35912048951446846, 'batch_norm': False, 'sage_aggr': 'mean', 'sage_normalize': False, 'sage_project': False, 'lr': 2.208048030525979e-05, 'weight_decay': 0.00010061578150255849, 'epochs': 240, 'loss': 'mae', 'optimizer': 'adam', 'graph_mode': 'cutoff', 'cutoff': 0.8054591039918655, 'grm_norm': 'cosine_then_gcn', 'self_loops': False, 'use_snp_selection': True, 'num_snps': 37591}. Best is trial 69 with value: 0.37979444876206886.
[I 2025-12-08 23:00:09,884] Trial 81 finished with value: 0.37042289575165455 and parameters: {'model_type': 'graphsage', 'hidden_dims': '[128, 64]', 'dropout': 0.5259972532028888, 'batch_norm': False, 'sage_aggr': 'mean', 'sage_normalize': False, 'sage_project': False, 'lr': 1.832922367594581e-05, 'weight_decay': 2.1449630606219806e-06, 'epochs': 204, 'loss': 'mae', 'optimizer': 'adam', 'graph_mode': 'cutoff', 'cutoff': 0.8827233118273351, 'grm_norm': 'cosine_then_gcn', 'self_loops': False, 'use_snp_selection': True, 'num_snps': 31595}. Best is trial 69 with value: 0.37979444876206886.
[I 2025-12-08 23:00:56,273] Trial 82 finished with value: 0.37038348887418604 and parameters: {'model_type': 'graphsage', 'hidden_dims': '[512, 64]', 'dropout': 0.5416229675420773, 'batch_norm': False, 'sage_aggr': 'mean', 'sage_normalize': False, 'sage_project': False, 'lr': 1.63266961792507e-05, 'weight_decay': 1.4685895537797083e-06, 'epochs': 170, 'loss': 'mae', 'optimizer': 'adam', 'graph_mode': 'cutoff', 'cutoff': 0.8464901466039954, 'grm_norm': 'cosine_then_gcn', 'self_loops': False, 'use_snp_selection': True, 'num_snps': 24367}. Best is trial 69 with value: 0.37979444876206886.
[I 2025-12-08 23:01:36,689] Trial 83 finished with value: 0.36659753163568554 and parameters: {'model_type': 'graphsage', 'hidden_dims': '[256, 128, 64]', 'dropout': 0.5850609736002034, 'batch_norm': False, 'sage_aggr': 'max', 'sage_normalize': False, 'sage_project': False, 'lr': 2.8149183908201166e-05, 'weight_decay': 2.5897105082298063e-06, 'epochs': 195, 'loss': 'mae', 'optimizer': 'adam', 'graph_mode': 'cutoff', 'cutoff': 0.8652569479668306, 'grm_norm': 'cosine_then_gcn', 'self_loops': True, 'use_snp_selection': True, 'num_snps': 29514}. Best is trial 69 with value: 0.37979444876206886.
[I 2025-12-08 23:02:15,071] Trial 84 finished with value: 0.3688844926994656 and parameters: {'model_type': 'graphsage', 'hidden_dims': '[256, 128, 64]', 'dropout': 0.5047632287136934, 'batch_norm': False, 'sage_aggr': 'max', 'sage_normalize': False, 'sage_project': False, 'lr': 1.4331229649827367e-05, 'weight_decay': 0.0007542581382446665, 'epochs': 153, 'loss': 'mae', 'optimizer': 'adam', 'graph_mode': 'cutoff', 'cutoff': 0.8505079081303356, 'grm_norm': 'cosine_then_gcn', 'self_loops': True, 'use_snp_selection': True, 'num_snps': 34255}. Best is trial 69 with value: 0.37979444876206886.
[I 2025-12-08 23:02:57,097] Trial 85 finished with value: 0.3703395100716603 and parameters: {'model_type': 'graphsage', 'hidden_dims': '[256, 128, 64]', 'dropout': 0.5662142048755275, 'batch_norm': False, 'sage_aggr': 'max', 'sage_normalize': False, 'sage_project': False, 'lr': 1.7356533678805576e-05, 'weight_decay': 0.00020505738675479575, 'epochs': 227, 'loss': 'mae', 'optimizer': 'adam', 'graph_mode': 'cutoff', 'cutoff': 0.8782576025843362, 'grm_norm': 'cosine_then_gcn', 'self_loops': True, 'use_snp_selection': True, 'num_snps': 27429}. Best is trial 69 with value: 0.37979444876206886.
[I 2025-12-08 23:05:11,459] Trial 86 finished with value: 0.35401420688337276 and parameters: {'model_type': 'graphsage', 'hidden_dims': '[256, 128, 64]', 'dropout': 0.5197706069338613, 'batch_norm': False, 'sage_aggr': 'mean', 'sage_normalize': False, 'sage_project': False, 'lr': 3.710932023239525e-05, 'weight_decay': 8.29288487473007e-06, 'epochs': 261, 'loss': 'mae', 'optimizer': 'adam', 'graph_mode': 'knn', 'knn_k': 5, 'weighted_edges': False, 'symmetrize_mode': 'union', 'self_loops': True, 'use_snp_selection': True, 'num_snps': 32433}. Best is trial 69 with value: 0.37979444876206886.
[I 2025-12-08 23:06:02,806] Trial 87 finished with value: 0.36747243883256286 and parameters: {'model_type': 'graphsage', 'hidden_dims': '[256, 128]', 'dropout': 0.46937823222470826, 'batch_norm': False, 'sage_aggr': 'max', 'sage_normalize': False, 'sage_project': False, 'lr': 1.0574789317865442e-05, 'weight_decay': 1.910296235846276e-06, 'epochs': 178, 'loss': 'mae', 'optimizer': 'adam', 'graph_mode': 'cutoff', 'cutoff': 0.8145087764816034, 'grm_norm': 'cosine_then_gcn', 'self_loops': False, 'use_snp_selection': True, 'num_snps': 41748}. Best is trial 69 with value: 0.37979444876206886.
[I 2025-12-08 23:06:32,726] Trial 88 finished with value: 0.36907729178774884 and parameters: {'model_type': 'graphsage', 'hidden_dims': '[256, 128, 64]', 'dropout': 0.5555161058450243, 'batch_norm': False, 'sage_aggr': 'max', 'sage_normalize': False, 'sage_project': False, 'lr': 2.3294576873607054e-05, 'weight_decay': 4.32889809860153e-06, 'epochs': 115, 'loss': 'mae', 'optimizer': 'adam', 'graph_mode': 'cutoff', 'cutoff': 0.7711207115488944, 'grm_norm': 'cosine_then_gcn', 'self_loops': True, 'use_snp_selection': True, 'num_snps': 30409}. Best is trial 69 with value: 0.37979444876206886.
[I 2025-12-08 23:07:04,331] Trial 89 finished with value: 0.36907182772941255 and parameters: {'model_type': 'graphsage', 'hidden_dims': '[128, 64]', 'dropout': 0.5731026046172217, 'batch_norm': False, 'sage_aggr': 'max', 'sage_normalize': False, 'sage_project': False, 'lr': 1.446115911316311e-05, 'weight_decay': 1.3432442583740033e-06, 'epochs': 166, 'loss': 'mae', 'optimizer': 'adam', 'graph_mode': 'cutoff', 'cutoff': 0.8308154724804787, 'grm_norm': 'none', 'self_loops': True, 'use_snp_selection': True, 'num_snps': 35856}. Best is trial 69 with value: 0.37979444876206886.
[I 2025-12-08 23:07:54,079] Trial 90 finished with value: 0.34858325753501684 and parameters: {'model_type': 'graphsage', 'hidden_dims': '[256, 128, 64]', 'dropout': 0.4825554006370152, 'batch_norm': False, 'sage_aggr': 'max', 'sage_normalize': False, 'sage_project': False, 'lr': 4.9359913541268965e-05, 'weight_decay': 3.0894851382532627e-06, 'epochs': 128, 'loss': 'mse', 'optimizer': 'adam', 'graph_mode': 'cutoff', 'cutoff': 0.8833030926745998, 'grm_norm': 'cosine_then_gcn', 'self_loops': True, 'use_snp_selection': True, 'num_snps': 50477}. Best is trial 69 with value: 0.37979444876206886.
[I 2025-12-08 23:08:29,072] Trial 91 finished with value: 0.370416253402728 and parameters: {'model_type': 'graphsage', 'hidden_dims': '[256, 128, 64]', 'dropout': 0.5115799666388382, 'batch_norm': False, 'sage_aggr': 'max', 'sage_normalize': False, 'sage_project': False, 'lr': 1.722384021664159e-05, 'weight_decay': 4.5488242702238144e-05, 'epochs': 162, 'loss': 'mae', 'optimizer': 'adam', 'graph_mode': 'cutoff', 'cutoff': 0.8286991505768393, 'grm_norm': 'cosine_then_gcn', 'self_loops': True, 'use_snp_selection': True, 'num_snps': 27838}. Best is trial 69 with value: 0.37979444876206886.
[I 2025-12-08 23:09:03,661] Trial 92 finished with value: 0.3702632335464141 and parameters: {'model_type': 'graphsage', 'hidden_dims': '[256, 128, 64]', 'dropout': 0.5352515322155889, 'batch_norm': False, 'sage_aggr': 'max', 'sage_normalize': False, 'sage_project': False, 'lr': 2.0629569525504707e-05, 'weight_decay': 1.0234585331062258e-06, 'epochs': 153, 'loss': 'mae', 'optimizer': 'adam', 'graph_mode': 'cutoff', 'cutoff': 0.8987808201698563, 'grm_norm': 'cosine_then_gcn', 'self_loops': True, 'use_snp_selection': True, 'num_snps': 29212}. Best is trial 69 with value: 0.37979444876206886.
[I 2025-12-08 23:09:38,215] Trial 93 finished with value: 0.37228198877329216 and parameters: {'model_type': 'graphsage', 'hidden_dims': '[256, 128, 64]', 'dropout': 0.5000536290317005, 'batch_norm': False, 'sage_aggr': 'max', 'sage_normalize': False, 'sage_project': False, 'lr': 1.002491061667951e-05, 'weight_decay': 5.684781289960643e-05, 'epochs': 185, 'loss': 'mae', 'optimizer': 'adam', 'graph_mode': 'cutoff', 'cutoff': 0.8500745182970294, 'grm_norm': 'gcn', 'self_loops': True, 'use_snp_selection': True, 'num_snps': 24632}. Best is trial 69 with value: 0.37979444876206886.
[I 2025-12-08 23:10:12,816] Trial 94 finished with value: 0.37941281281815004 and parameters: {'model_type': 'graphsage', 'hidden_dims': '[256, 128, 64]', 'dropout': 0.5494429919893771, 'batch_norm': False, 'sage_aggr': 'max', 'sage_normalize': False, 'sage_project': False, 'lr': 1.2759758189358143e-05, 'weight_decay': 5.9433970490257634e-05, 'epochs': 198, 'loss': 'mae', 'optimizer': 'adam', 'graph_mode': 'cutoff', 'cutoff': 0.8577092844622188, 'grm_norm': 'gcn', 'self_loops': True, 'use_snp_selection': True, 'num_snps': 23719}. Best is trial 69 with value: 0.37979444876206886.
[I 2025-12-08 23:10:47,840] Trial 95 finished with value: 0.37758725874211624 and parameters: {'model_type': 'graphsage', 'hidden_dims': '[256, 128, 64]', 'dropout': 0.589395200837992, 'batch_norm': False, 'sage_aggr': 'max', 'sage_normalize': False, 'sage_project': False, 'lr': 1.148661269782692e-05, 'weight_decay': 6.385467402002781e-05, 'epochs': 191, 'loss': 'mae', 'optimizer': 'adam', 'graph_mode': 'cutoff', 'cutoff': 0.7968470547184686, 'grm_norm': 'gcn', 'self_loops': True, 'use_snp_selection': True, 'num_snps': 24433}. Best is trial 69 with value: 0.37979444876206886.
[I 2025-12-08 23:11:20,451] Trial 96 finished with value: 0.35072681933258076 and parameters: {'model_type': 'graphsage', 'hidden_dims': '[256, 128, 64]', 'dropout': 0.5915683158742855, 'batch_norm': True, 'sage_aggr': 'max', 'sage_normalize': True, 'sage_project': False, 'lr': 1.202786962943951e-05, 'weight_decay': 6.554832366417451e-05, 'epochs': 213, 'loss': 'mae', 'optimizer': 'adam', 'graph_mode': 'cutoff', 'cutoff': 0.7969761313749836, 'grm_norm': 'gcn', 'self_loops': True, 'use_snp_selection': True, 'num_snps': 20108}. Best is trial 69 with value: 0.37979444876206886.
[I 2025-12-08 23:13:07,350] Trial 97 finished with value: 0.3649312592843589 and parameters: {'model_type': 'graphsage', 'hidden_dims': '[512, 64]', 'dropout': 0.5548696169625663, 'batch_norm': False, 'sage_aggr': 'max', 'sage_normalize': False, 'sage_project': False, 'lr': 1.0279955640346391e-05, 'weight_decay': 6.25804494873827e-05, 'epochs': 199, 'loss': 'mae', 'optimizer': 'adam', 'graph_mode': 'cutoff', 'cutoff': 0.7791687032905306, 'grm_norm': 'gcn', 'self_loops': True, 'use_snp_selection': False}. Best is trial 69 with value: 0.37979444876206886.
[I 2025-12-08 23:13:59,032] Trial 98 finished with value: 0.34180337331408295 and parameters: {'model_type': 'graphsage', 'hidden_dims': '[512, 256]', 'dropout': 0.5752096405241816, 'batch_norm': False, 'sage_aggr': 'mean', 'sage_normalize': False, 'sage_project': False, 'lr': 0.00023768765987117503, 'weight_decay': 2.7687214519874582e-05, 'epochs': 207, 'loss': 'mae', 'optimizer': 'adam', 'graph_mode': 'cutoff', 'cutoff': 0.8550348898641276, 'grm_norm': 'gcn', 'self_loops': False, 'use_snp_selection': True, 'num_snps': 23252}. Best is trial 69 with value: 0.37979444876206886.
[I 2025-12-08 23:14:30,689] Trial 99 finished with value: 0.3739892641412781 and parameters: {'model_type': 'graphsage', 'hidden_dims': '[256, 128, 64]', 'dropout': 0.5922078047307017, 'batch_norm': False, 'sage_aggr': 'max', 'sage_normalize': False, 'sage_project': False, 'lr': 1.4912897638581313e-05, 'weight_decay': 0.00010919717326767415, 'epochs': 190, 'loss': 'mae', 'optimizer': 'adam', 'graph_mode': 'cutoff', 'cutoff': 0.7427297034088634, 'grm_norm': 'gcn', 'self_loops': True, 'use_snp_selection': True, 'num_snps': 21889}. Best is trial 69 with value: 0.37979444876206886.
[I 2025-12-08 23:15:36,037] Trial 100 finished with value: 0.3106944829456029 and parameters: {'model_type': 'graphsage', 'hidden_dims': '[256, 128, 64]', 'dropout': 0.5949375479822543, 'batch_norm': False, 'sage_aggr': 'max', 'sage_normalize': False, 'sage_project': False, 'lr': 1.1255778152624151e-05, 'weight_decay': 0.00010663087227943548, 'epochs': 188, 'loss': 'mae', 'optimizer': 'adam', 'graph_mode': 'knn', 'knn_k': 10, 'weighted_edges': True, 'symmetrize_mode': 'mutual', 'self_loops': True, 'use_snp_selection': True, 'num_snps': 22053}. Best is trial 69 with value: 0.37979444876206886.
[I 2025-12-08 23:16:08,512] Trial 101 finished with value: 0.36458184174914154 and parameters: {'model_type': 'graphsage', 'hidden_dims': '[256, 128, 64]', 'dropout': 0.5824342396319832, 'batch_norm': False, 'sage_aggr': 'max', 'sage_normalize': False, 'sage_project': False, 'lr': 1.471413673724884e-05, 'weight_decay': 8.81519474703953e-05, 'epochs': 178, 'loss': 'mae', 'optimizer': 'adam', 'graph_mode': 'cutoff', 'cutoff': 0.7538481359308047, 'grm_norm': 'gcn', 'self_loops': True, 'use_snp_selection': True, 'num_snps': 24063}. Best is trial 69 with value: 0.37979444876206886.
[I 2025-12-08 23:16:44,209] Trial 102 finished with value: 0.3653091126428104 and parameters: {'model_type': 'graphsage', 'hidden_dims': '[256, 128, 64]', 'dropout': 0.5457785939636118, 'batch_norm': False, 'sage_aggr': 'max', 'sage_normalize': False, 'sage_project': False, 'lr': 1.0077844941920306e-05, 'weight_decay': 7.321698940198104e-05, 'epochs': 193, 'loss': 'mae', 'optimizer': 'adam', 'graph_mode': 'cutoff', 'cutoff': 0.8243261449065652, 'grm_norm': 'gcn', 'self_loops': True, 'use_snp_selection': True, 'num_snps': 25289}. Best is trial 69 with value: 0.37979444876206886.
[I 2025-12-08 23:17:11,557] Trial 103 finished with value: 0.3743411118625836 and parameters: {'model_type': 'graphsage', 'hidden_dims': '[256, 128, 64]', 'dropout': 0.5640050132225403, 'batch_norm': False, 'sage_aggr': 'max', 'sage_normalize': False, 'sage_project': False, 'lr': 1.4350085307212207e-05, 'weight_decay': 0.00014757056576335028, 'epochs': 201, 'loss': 'mae', 'optimizer': 'adam', 'graph_mode': 'cutoff', 'cutoff': 0.8482858145171865, 'grm_norm': 'gcn', 'self_loops': True, 'use_snp_selection': True, 'num_snps': 17112}. Best is trial 69 with value: 0.37979444876206886.
[I 2025-12-08 23:17:39,850] Trial 104 finished with value: 0.36957098133668664 and parameters: {'model_type': 'graphsage', 'hidden_dims': '[256, 128, 64]', 'dropout': 0.5998806217761895, 'batch_norm': False, 'sage_aggr': 'max', 'sage_normalize': False, 'sage_project': False, 'lr': 2.6023937647447266e-05, 'weight_decay': 0.00023149726126891714, 'epochs': 201, 'loss': 'mae', 'optimizer': 'adam', 'graph_mode': 'cutoff', 'cutoff': 0.8043305372572527, 'grm_norm': 'gcn', 'self_loops': True, 'use_snp_selection': True, 'num_snps': 17336}. Best is trial 69 with value: 0.37979444876206886.
[I 2025-12-08 23:18:12,079] Trial 105 finished with value: 0.3675285377024325 and parameters: {'model_type': 'graphsage', 'hidden_dims': '[256, 128, 64]', 'dropout': 0.5653026475362722, 'batch_norm': False, 'sage_aggr': 'max', 'sage_normalize': False, 'sage_project': False, 'lr': 2.16656415424774e-05, 'weight_decay': 0.00016847559748923158, 'epochs': 227, 'loss': 'mae', 'optimizer': 'adam', 'graph_mode': 'cutoff', 'cutoff': 0.8555774322279215, 'grm_norm': 'gcn', 'self_loops': True, 'use_snp_selection': True, 'num_snps': 19055}. Best is trial 69 with value: 0.37979444876206886.
[I 2025-12-08 23:18:44,458] Trial 106 finished with value: 0.3636944966873038 and parameters: {'model_type': 'graphsage', 'hidden_dims': '[256, 128]', 'dropout': 0.5367668858546535, 'batch_norm': False, 'sage_aggr': 'max', 'sage_normalize': False, 'sage_project': False, 'lr': 1.6284864878073766e-05, 'weight_decay': 0.0003435038065967577, 'epochs': 215, 'loss': 'mae', 'optimizer': 'adam', 'graph_mode': 'cutoff', 'cutoff': 0.7289220308371567, 'grm_norm': 'gcn', 'self_loops': True, 'use_snp_selection': True, 'num_snps': 20586}. Best is trial 69 with value: 0.37979444876206886.
[I 2025-12-08 23:19:08,998] Trial 107 finished with value: 0.36412428368593963 and parameters: {'model_type': 'graphsage', 'hidden_dims': '[256, 128, 64]', 'dropout': 0.57306365095031, 'batch_norm': False, 'sage_aggr': 'max', 'sage_normalize': False, 'sage_project': False, 'lr': 1.1687203632632634e-05, 'weight_decay': 0.00011734719636075493, 'epochs': 184, 'loss': 'mae', 'optimizer': 'adam', 'graph_mode': 'cutoff', 'cutoff': 0.8377042931473861, 'grm_norm': 'gcn', 'self_loops': True, 'use_snp_selection': True, 'num_snps': 15712}. Best is trial 69 with value: 0.37979444876206886.
[I 2025-12-08 23:19:25,912] Trial 108 finished with value: 0.35539320682209696 and parameters: {'model_type': 'graphsage', 'hidden_dims': '[128, 64]', 'dropout': 0.5868041895245165, 'batch_norm': False, 'sage_aggr': 'max', 'sage_normalize': False, 'sage_project': False, 'lr': 1.3625415523746561e-05, 'weight_decay': 0.0002978343670310119, 'epochs': 196, 'loss': 'mse', 'optimizer': 'adam', 'graph_mode': 'cutoff', 'cutoff': 0.7811867733557678, 'grm_norm': 'gcn', 'self_loops': True, 'use_snp_selection': True, 'num_snps': 11843}. Best is trial 69 with value: 0.37979444876206886.
[I 2025-12-08 23:20:03,244] Trial 109 finished with value: 0.36747503852155416 and parameters: {'model_type': 'graphsage', 'hidden_dims': '[256, 128, 64]', 'dropout': 0.5512342647991247, 'batch_norm': False, 'sage_aggr': 'max', 'sage_normalize': False, 'sage_project': False, 'lr': 1.8774393570985135e-05, 'weight_decay': 0.00013989805619831204, 'epochs': 234, 'loss': 'mae', 'optimizer': 'adam', 'graph_mode': 'cutoff', 'cutoff': 0.8765652568897356, 'grm_norm': 'gcn', 'self_loops': True, 'use_snp_selection': True, 'num_snps': 22517}. Best is trial 69 with value: 0.37979444876206886.
[I 2025-12-08 23:20:27,225] Trial 110 finished with value: 0.31394323452072304 and parameters: {'model_type': 'graphsage', 'hidden_dims': '[256, 128, 64]', 'dropout': 0.5294059506761444, 'batch_norm': False, 'sage_aggr': 'max', 'sage_normalize': True, 'sage_project': False, 'lr': 2.9218771953370093e-05, 'weight_decay': 5.058578811814495e-05, 'epochs': 172, 'loss': 'mae', 'optimizer': 'adam', 'graph_mode': 'cutoff', 'cutoff': 0.6202012024026835, 'grm_norm': 'gcn', 'self_loops': True, 'use_snp_selection': True, 'num_snps': 15320}. Best is trial 69 with value: 0.37979444876206886.
[I 2025-12-08 23:20:52,583] Trial 111 finished with value: 0.3607128442666534 and parameters: {'model_type': 'graphsage', 'hidden_dims': '[256, 128, 64]', 'dropout': 0.5626809297554317, 'batch_norm': False, 'sage_aggr': 'max', 'sage_normalize': False, 'sage_project': False, 'lr': 1.4698893974362003e-05, 'weight_decay': 3.931544789997333e-05, 'epochs': 101, 'loss': 'mae', 'optimizer': 'adam', 'graph_mode': 'cutoff', 'cutoff': 0.8512320989203672, 'grm_norm': 'gcn', 'self_loops': True, 'use_snp_selection': True, 'num_snps': 26221}. Best is trial 69 with value: 0.37979444876206886.
