[I 2025-12-08 15:19:48,535] Trial 77 finished with value: 0.2885423212339015 and parameters: {'model_type': 'graphsage', 'hidden_dims': '[512, 256]', 'dropout': 0.5526852724307139, 'batch_norm': True, 'sage_aggr': 'max', 'sage_normalize': False, 'sage_project': False, 'lr': 0.003472750038851361, 'weight_decay': 4.61625919783902e-05, 'epochs': 96, 'loss': 'mse', 'optimizer': 'adam', 'graph_mode': 'cutoff', 'cutoff': 0.7018485482974359, 'grm_norm': 'gcn', 'self_loops': True, 'use_snp_selection': False}. Best is trial 32 with value: 0.29775721061271626.
[I 2025-12-08 15:20:31,193] Trial 78 finished with value: 0.28930647585386404 and parameters: {'model_type': 'graphsage', 'hidden_dims': '[512, 64]', 'dropout': 0.5365317408672678, 'batch_norm': True, 'sage_aggr': 'mean', 'sage_normalize': False, 'sage_project': False, 'lr': 0.008108481807932688, 'weight_decay': 0.0007277312566388906, 'epochs': 70, 'loss': 'mse', 'optimizer': 'adam', 'graph_mode': 'cutoff', 'cutoff': 0.776231132285141, 'grm_norm': 'cosine_then_gcn', 'self_loops': True, 'use_snp_selection': False}. Best is trial 32 with value: 0.29775721061271626.
[I 2025-12-08 15:21:21,591] Trial 79 finished with value: 0.2846202648060102 and parameters: {'model_type': 'graphsage', 'hidden_dims': '[512, 128]', 'dropout': 0.5644772531840299, 'batch_norm': True, 'sage_aggr': 'max', 'sage_normalize': True, 'sage_project': False, 'lr': 0.005490377546681085, 'weight_decay': 2.3213512166691253e-07, 'epochs': 89, 'loss': 'mse', 'optimizer': 'adam', 'graph_mode': 'cutoff', 'cutoff': 0.7394914777991358, 'grm_norm': 'cosine', 'self_loops': True, 'use_snp_selection': False}. Best is trial 32 with value: 0.29775721061271626.
[I 2025-12-08 15:22:12,920] Trial 80 finished with value: 0.2850467900970738 and parameters: {'model_type': 'graphsage', 'hidden_dims': '[256, 128, 64]', 'dropout': 0.5877561152641572, 'batch_norm': True, 'sage_aggr': 'max', 'sage_normalize': False, 'sage_project': False, 'lr': 0.0025195608566264713, 'weight_decay': 0.00020753495570797513, 'epochs': 160, 'loss': 'mae', 'optimizer': 'adam', 'graph_mode': 'knn', 'knn_k': 1, 'weighted_edges': True, 'symmetrize_mode': 'mutual', 'self_loops': True, 'use_snp_selection': False}. Best is trial 32 with value: 0.29775721061271626.
[I 2025-12-08 15:22:48,427] Trial 81 finished with value: 0.29431816074827954 and parameters: {'model_type': 'graphsage', 'hidden_dims': '[256, 128]', 'dropout': 0.5972362775068829, 'batch_norm': True, 'sage_aggr': 'max', 'sage_normalize': False, 'sage_project': False, 'lr': 0.002876251062518154, 'weight_decay': 6.0565912758465165e-05, 'epochs': 106, 'loss': 'mse', 'optimizer': 'adam', 'graph_mode': 'cutoff', 'cutoff': 0.7646857826116606, 'grm_norm': 'cosine', 'self_loops': True, 'use_snp_selection': False}. Best is trial 32 with value: 0.29775721061271626.
[I 2025-12-08 15:23:22,551] Trial 82 finished with value: 0.28771254306620475 and parameters: {'model_type': 'graphsage', 'hidden_dims': '[256, 128]', 'dropout': 0.5643137256760763, 'batch_norm': True, 'sage_aggr': 'max', 'sage_normalize': False, 'sage_project': False, 'lr': 0.004241000873772269, 'weight_decay': 2.5599069195574506e-05, 'epochs': 100, 'loss': 'mse', 'optimizer': 'adam', 'graph_mode': 'cutoff', 'cutoff': 0.722596385760388, 'grm_norm': 'cosine', 'self_loops': True, 'use_snp_selection': False}. Best is trial 32 with value: 0.29775721061271626.
[I 2025-12-08 15:24:08,242] Trial 83 finished with value: 0.289727129581021 and parameters: {'model_type': 'graphsage', 'hidden_dims': '[512, 128]', 'dropout': 0.5985590402598988, 'batch_norm': True, 'sage_aggr': 'max', 'sage_normalize': False, 'sage_project': False, 'lr': 0.0013900932738004478, 'weight_decay': 1.134644855053024e-05, 'epochs': 78, 'loss': 'mse', 'optimizer': 'adam', 'graph_mode': 'cutoff', 'cutoff': 0.8210727717356485, 'grm_norm': 'cosine', 'self_loops': True, 'use_snp_selection': False}. Best is trial 32 with value: 0.29775721061271626.
[I 2025-12-08 15:25:38,755] Trial 84 finished with value: 0.2869268635355615 and parameters: {'model_type': 'graphsage', 'hidden_dims': '[256, 128]', 'dropout': 0.17767360212710054, 'batch_norm': True, 'sage_aggr': 'max', 'sage_normalize': False, 'sage_project': False, 'lr': 0.002753069268402493, 'weight_decay': 9.997310133866878e-05, 'epochs': 347, 'loss': 'mse', 'optimizer': 'adam', 'graph_mode': 'cutoff', 'cutoff': 0.7960891399307632, 'grm_norm': 'cosine', 'self_loops': True, 'use_snp_selection': False}. Best is trial 32 with value: 0.29775721061271626.
[I 2025-12-08 15:27:15,958] Trial 85 finished with value: 0.2892249891367459 and parameters: {'model_type': 'graphsage', 'hidden_dims': '[512, 128]', 'dropout': 0.2595907697040646, 'batch_norm': True, 'sage_aggr': 'max', 'sage_normalize': False, 'sage_project': False, 'lr': 0.001902736892136081, 'weight_decay': 0.0004630073696936481, 'epochs': 121, 'loss': 'mse', 'optimizer': 'adam', 'graph_mode': 'cutoff', 'cutoff': 0.6933068754027192, 'grm_norm': 'cosine', 'self_loops': True, 'use_snp_selection': True, 'num_snps': 58556}. Best is trial 32 with value: 0.29775721061271626.
[I 2025-12-08 15:27:53,977] Trial 86 finished with value: 0.0 and parameters: {'model_type': 'graphsage', 'hidden_dims': '[512, 128]', 'dropout': 0.5197135574787098, 'batch_norm': False, 'sage_aggr': 'max', 'sage_normalize': False, 'sage_project': False, 'lr': 0.0036543197227240703, 'weight_decay': 7.701665000380045e-05, 'epochs': 62, 'loss': 'mse', 'optimizer': 'adam', 'graph_mode': 'cutoff', 'cutoff': 0.7356702641208474, 'grm_norm': 'cosine', 'self_loops': False, 'use_snp_selection': False}. Best is trial 32 with value: 0.29775721061271626.
[I 2025-12-08 15:28:10,384] Trial 87 finished with value: 0.2788860999725718 and parameters: {'model_type': 'graphsage', 'hidden_dims': '[128, 64]', 'dropout': 0.5834283835783098, 'batch_norm': True, 'sage_aggr': 'max', 'sage_normalize': False, 'sage_project': False, 'lr': 0.007585905375709237, 'weight_decay': 0.00030944151370340363, 'epochs': 47, 'loss': 'mse', 'optimizer': 'adam', 'graph_mode': 'cutoff', 'cutoff': 0.5684111343001365, 'grm_norm': 'none', 'self_loops': True, 'use_snp_selection': False}. Best is trial 32 with value: 0.29775721061271626.
[I 2025-12-08 15:28:54,724] Trial 88 finished with value: 0.29207754760090443 and parameters: {'model_type': 'graphsage', 'hidden_dims': '[256, 128]', 'dropout': 0.5484764152027353, 'batch_norm': True, 'sage_aggr': 'max', 'sage_normalize': False, 'sage_project': False, 'lr': 0.002221101852611929, 'weight_decay': 0.00011988814176408909, 'epochs': 145, 'loss': 'mse', 'optimizer': 'adam', 'graph_mode': 'cutoff', 'cutoff': 0.6705239836230174, 'grm_norm': 'cosine', 'self_loops': True, 'use_snp_selection': False}. Best is trial 32 with value: 0.29775721061271626.
[I 2025-12-08 15:30:02,522] Trial 89 finished with value: 0.2906953570096183 and parameters: {'model_type': 'graphsage', 'hidden_dims': '[512, 256]', 'dropout': 0.5351799583740371, 'batch_norm': True, 'sage_aggr': 'mean', 'sage_normalize': False, 'sage_project': False, 'lr': 0.001485391336917051, 'weight_decay': 0.00016683949787937185, 'epochs': 130, 'loss': 'mse', 'optimizer': 'adam', 'graph_mode': 'cutoff', 'cutoff': 0.8478454129998413, 'grm_norm': 'cosine', 'self_loops': True, 'use_snp_selection': False}. Best is trial 32 with value: 0.29775721061271626.
[I 2025-12-08 15:30:50,320] Trial 90 finished with value: 0.2889030160833028 and parameters: {'model_type': 'graphsage', 'hidden_dims': '[512, 128]', 'dropout': 0.5746874911768464, 'batch_norm': True, 'sage_aggr': 'max', 'sage_normalize': False, 'sage_project': False, 'lr': 0.005873003337456565, 'weight_decay': 0.00025636857142276954, 'epochs': 83, 'loss': 'mse', 'optimizer': 'adam', 'graph_mode': 'cutoff', 'cutoff': 0.7616038247302346, 'grm_norm': 'cosine', 'self_loops': True, 'use_snp_selection': False}. Best is trial 32 with value: 0.29775721061271626.
[I 2025-12-08 15:31:25,732] Trial 91 finished with value: 0.29486537257634515 and parameters: {'model_type': 'graphsage', 'hidden_dims': '[256, 128]', 'dropout': 0.5903972450413708, 'batch_norm': True, 'sage_aggr': 'max', 'sage_normalize': False, 'sage_project': False, 'lr': 0.0030279347867817165, 'weight_decay': 6.176105847238059e-05, 'epochs': 106, 'loss': 'mse', 'optimizer': 'adam', 'graph_mode': 'cutoff', 'cutoff': 0.7761074561495022, 'grm_norm': 'cosine', 'self_loops': True, 'use_snp_selection': False}. Best is trial 32 with value: 0.29775721061271626.
[I 2025-12-08 15:31:59,739] Trial 92 finished with value: 0.29664868929627886 and parameters: {'model_type': 'graphsage', 'hidden_dims': '[256, 128]', 'dropout': 0.562077802024923, 'batch_norm': True, 'sage_aggr': 'max', 'sage_normalize': False, 'sage_project': False, 'lr': 0.0030083450869772765, 'weight_decay': 4.841597558990297e-05, 'epochs': 100, 'loss': 'mse', 'optimizer': 'adam', 'graph_mode': 'cutoff', 'cutoff': 0.789449732540449, 'grm_norm': 'cosine', 'self_loops': True, 'use_snp_selection': False}. Best is trial 32 with value: 0.29775721061271626.
[I 2025-12-08 15:32:32,816] Trial 93 finished with value: 0.29050879673336355 and parameters: {'model_type': 'graphsage', 'hidden_dims': '[256, 128]', 'dropout': 0.5599319598639652, 'batch_norm': True, 'sage_aggr': 'max', 'sage_normalize': False, 'sage_project': False, 'lr': 0.00450591050299869, 'weight_decay': 4.986770071407861e-05, 'epochs': 95, 'loss': 'mse', 'optimizer': 'adam', 'graph_mode': 'cutoff', 'cutoff': 0.7950186199329455, 'grm_norm': 'cosine', 'self_loops': True, 'use_snp_selection': False}. Best is trial 32 with value: 0.29775721061271626.
[I 2025-12-08 15:33:09,787] Trial 94 finished with value: 0.29475201331438255 and parameters: {'model_type': 'graphsage', 'hidden_dims': '[256, 128]', 'dropout': 0.5705745408369524, 'batch_norm': True, 'sage_aggr': 'max', 'sage_normalize': False, 'sage_project': False, 'lr': 0.0032593202028452046, 'weight_decay': 3.748233698097946e-05, 'epochs': 113, 'loss': 'mse', 'optimizer': 'adam', 'graph_mode': 'cutoff', 'cutoff': 0.8339610859330737, 'grm_norm': 'cosine', 'self_loops': True, 'use_snp_selection': False}. Best is trial 32 with value: 0.29775721061271626.
[I 2025-12-08 15:33:33,493] Trial 95 finished with value: 0.2953175086568176 and parameters: {'model_type': 'graphsage', 'hidden_dims': '[256, 128]', 'dropout': 0.5524622509308323, 'batch_norm': True, 'sage_aggr': 'max', 'sage_normalize': False, 'sage_project': False, 'lr': 0.002037828183200488, 'weight_decay': 9.15657764586627e-05, 'epochs': 59, 'loss': 'mse', 'optimizer': 'adam', 'graph_mode': 'cutoff', 'cutoff': 0.7803361017760149, 'grm_norm': 'gcn', 'self_loops': True, 'use_snp_selection': False}. Best is trial 32 with value: 0.29775721061271626.
[I 2025-12-08 15:33:56,990] Trial 96 finished with value: 0.29540434136561844 and parameters: {'model_type': 'graphsage', 'hidden_dims': '[256, 128]', 'dropout': 0.5095224240994686, 'batch_norm': True, 'sage_aggr': 'max', 'sage_normalize': False, 'sage_project': False, 'lr': 0.0038578883038790836, 'weight_decay': 5.80389086298915e-05, 'epochs': 58, 'loss': 'mse', 'optimizer': 'adam', 'graph_mode': 'cutoff', 'cutoff': 0.7851550199484424, 'grm_norm': 'gcn', 'self_loops': True, 'use_snp_selection': False}. Best is trial 32 with value: 0.29775721061271626.
[I 2025-12-08 15:34:49,483] Trial 97 finished with value: 0.2279451274901672 and parameters: {'model_type': 'graphsage', 'hidden_dims': '[256, 128]', 'dropout': 0.5028053027618946, 'batch_norm': True, 'sage_aggr': 'max', 'sage_normalize': True, 'sage_project': False, 'lr': 0.0037246713895013905, 'weight_decay': 1.76612373883941e-05, 'epochs': 59, 'loss': 'mae', 'optimizer': 'adam', 'graph_mode': 'knn', 'knn_k': 8, 'weighted_edges': False, 'symmetrize_mode': 'union', 'self_loops': True, 'use_snp_selection': False}. Best is trial 32 with value: 0.29775721061271626.
[I 2025-12-08 15:35:11,613] Trial 98 finished with value: 0.2913865390372901 and parameters: {'model_type': 'graphsage', 'hidden_dims': '[256, 128]', 'dropout': 0.4515245413706567, 'batch_norm': True, 'sage_aggr': 'max', 'sage_normalize': False, 'sage_project': False, 'lr': 4.2415038789158835e-05, 'weight_decay': 3.976318196296793e-05, 'epochs': 52, 'loss': 'mse', 'optimizer': 'adam', 'graph_mode': 'cutoff', 'cutoff': 0.8929122985731264, 'grm_norm': 'gcn', 'self_loops': True, 'use_snp_selection': False}. Best is trial 32 with value: 0.29775721061271626.
[I 2025-12-08 15:35:44,529] Trial 99 finished with value: 0.27859296400987643 and parameters: {'model_type': 'graphsage', 'hidden_dims': '[256, 128]', 'dropout': 0.5179131782046706, 'batch_norm': True, 'sage_aggr': 'max', 'sage_normalize': False, 'sage_project': False, 'lr': 0.002410993635020093, 'weight_decay': 6.178472190627908e-05, 'epochs': 75, 'loss': 'mse', 'optimizer': 'adam', 'graph_mode': 'cutoff', 'cutoff': 0.8135643080595182, 'grm_norm': 'gcn', 'self_loops': True, 'use_snp_selection': True, 'num_snps': 13096}. Best is trial 32 with value: 0.29775721061271626.
[I 2025-12-08 15:36:07,622] Trial 100 finished with value: 0.03982157769125994 and parameters: {'model_type': 'graphsage', 'hidden_dims': '[256, 128]', 'dropout': 0.5388395196044914, 'batch_norm': False, 'sage_aggr': 'max', 'sage_normalize': False, 'sage_project': False, 'lr': 0.004609826558143616, 'weight_decay': 2.911004593647714e-05, 'epochs': 58, 'loss': 'mse', 'optimizer': 'adam', 'graph_mode': 'cutoff', 'cutoff': 0.8741183825096336, 'grm_norm': 'gcn', 'self_loops': False, 'use_snp_selection': False}. Best is trial 32 with value: 0.29775721061271626.
[I 2025-12-08 15:36:38,099] Trial 101 finished with value: 0.2891414549629704 and parameters: {'model_type': 'graphsage', 'hidden_dims': '[256, 128]', 'dropout': 0.5491637228027474, 'batch_norm': True, 'sage_aggr': 'max', 'sage_normalize': False, 'sage_project': False, 'lr': 0.0020085322748495354, 'weight_decay': 8.288123220900691e-05, 'epochs': 89, 'loss': 'mse', 'optimizer': 'adam', 'graph_mode': 'cutoff', 'cutoff': 0.7698557407174038, 'grm_norm': 'gcn', 'self_loops': True, 'use_snp_selection': False}. Best is trial 32 with value: 0.29775721061271626.
[I 2025-12-08 15:37:03,388] Trial 102 finished with value: 0.29741115247132444 and parameters: {'model_type': 'graphsage', 'hidden_dims': '[256, 128]', 'dropout': 0.5913943650125524, 'batch_norm': True, 'sage_aggr': 'max', 'sage_normalize': False, 'sage_project': False, 'lr': 0.003041364272386755, 'weight_decay': 0.0001233084962856179, 'epochs': 66, 'loss': 'mse', 'optimizer': 'adam', 'graph_mode': 'cutoff', 'cutoff': 0.7920713100803829, 'grm_norm': 'gcn', 'self_loops': True, 'use_snp_selection': False}. Best is trial 32 with value: 0.29775721061271626.
[I 2025-12-08 15:37:28,218] Trial 103 finished with value: 0.2938338323760766 and parameters: {'model_type': 'graphsage', 'hidden_dims': '[256, 128]', 'dropout': 0.5902515156467957, 'batch_norm': True, 'sage_aggr': 'max', 'sage_normalize': False, 'sage_project': False, 'lr': 0.0030855442001516183, 'weight_decay': 5.4649703748655425e-05, 'epochs': 64, 'loss': 'mse', 'optimizer': 'adam', 'graph_mode': 'cutoff', 'cutoff': 0.7889788358877072, 'grm_norm': 'gcn', 'self_loops': True, 'use_snp_selection': False}. Best is trial 32 with value: 0.29775721061271626.
[I 2025-12-08 15:37:48,954] Trial 104 finished with value: 0.28993395146093687 and parameters: {'model_type': 'graphsage', 'hidden_dims': '[256, 128]', 'dropout': 0.5596286846673504, 'batch_norm': True, 'sage_aggr': 'max', 'sage_normalize': False, 'sage_project': False, 'lr': 0.0064250850999482915, 'weight_decay': 0.00012481174819320453, 'epochs': 46, 'loss': 'mse', 'optimizer': 'adam', 'graph_mode': 'cutoff', 'cutoff': 0.8149169701831429, 'grm_norm': 'gcn', 'self_loops': True, 'use_snp_selection': False}. Best is trial 32 with value: 0.29775721061271626.
[I 2025-12-08 15:38:22,206] Trial 105 finished with value: 0.2942058485684595 and parameters: {'model_type': 'graphsage', 'hidden_dims': '[256, 128]', 'dropout': 0.5902529143520601, 'batch_norm': True, 'sage_aggr': 'max', 'sage_normalize': False, 'sage_project': False, 'lr': 0.003958296828293461, 'weight_decay': 8.585851179317153e-05, 'epochs': 101, 'loss': 'mse', 'optimizer': 'adam', 'graph_mode': 'cutoff', 'cutoff': 0.7205769505129628, 'grm_norm': 'gcn', 'self_loops': True, 'use_snp_selection': False}. Best is trial 32 with value: 0.29775721061271626.
[I 2025-12-08 15:38:47,837] Trial 106 finished with value: 0.295357469455502 and parameters: {'model_type': 'graphsage', 'hidden_dims': '[256, 128]', 'dropout': 0.5523147754570809, 'batch_norm': True, 'sage_aggr': 'max', 'sage_normalize': False, 'sage_project': False, 'lr': 0.0026983477149260613, 'weight_decay': 0.000147491917975634, 'epochs': 67, 'loss': 'mse', 'optimizer': 'adam', 'graph_mode': 'cutoff', 'cutoff': 0.7810668084047055, 'grm_norm': 'gcn', 'self_loops': True, 'use_snp_selection': False}. Best is trial 32 with value: 0.29775721061271626.
[I 2025-12-08 15:39:13,549] Trial 107 finished with value: 0.29740533186217283 and parameters: {'model_type': 'graphsage', 'hidden_dims': '[256, 128]', 'dropout': 0.5509965863512387, 'batch_norm': True, 'sage_aggr': 'max', 'sage_normalize': False, 'sage_project': False, 'lr': 0.005241766648481126, 'weight_decay': 0.0001943513040197269, 'epochs': 68, 'loss': 'mse', 'optimizer': 'adam', 'graph_mode': 'cutoff', 'cutoff': 0.8428020590029495, 'grm_norm': 'gcn', 'self_loops': True, 'use_snp_selection': False}. Best is trial 32 with value: 0.29775721061271626.
[I 2025-12-08 15:39:39,061] Trial 108 finished with value: 0.29516263144277577 and parameters: {'model_type': 'graphsage', 'hidden_dims': '[256, 128]', 'dropout': 0.5330130276617304, 'batch_norm': True, 'sage_aggr': 'max', 'sage_normalize': False, 'sage_project': False, 'lr': 0.005544651321242019, 'weight_decay': 0.00018574820291652067, 'epochs': 67, 'loss': 'mse', 'optimizer': 'adam', 'graph_mode': 'cutoff', 'cutoff': 0.8470999675969069, 'grm_norm': 'gcn', 'self_loops': True, 'use_snp_selection': False}. Best is trial 32 with value: 0.29775721061271626.
[I 2025-12-08 15:40:01,962] Trial 109 finished with value: 0.2913599459822934 and parameters: {'model_type': 'graphsage', 'hidden_dims': '[256, 128]', 'dropout': 0.482309985378895, 'batch_norm': True, 'sage_aggr': 'mean', 'sage_normalize': False, 'sage_project': False, 'lr': 0.004900807027234224, 'weight_decay': 0.00014433721279031258, 'epochs': 55, 'loss': 'mse', 'optimizer': 'adam', 'graph_mode': 'cutoff', 'cutoff': 0.8270579401521366, 'grm_norm': 'gcn', 'self_loops': True, 'use_snp_selection': False}. Best is trial 32 with value: 0.29775721061271626.
[I 2025-12-08 15:40:22,759] Trial 110 finished with value: 0.28941237642121254 and parameters: {'model_type': 'graphsage', 'hidden_dims': '[256, 128]', 'dropout': 0.5472307461597046, 'batch_norm': True, 'sage_aggr': 'max', 'sage_normalize': False, 'sage_project': False, 'lr': 0.008275256392648521, 'weight_decay': 0.0002239326786902361, 'epochs': 46, 'loss': 'mse', 'optimizer': 'adam', 'graph_mode': 'cutoff', 'cutoff': 0.8026982169075361, 'grm_norm': 'gcn', 'self_loops': True, 'use_snp_selection': False}. Best is trial 32 with value: 0.29775721061271626.
[I 2025-12-08 15:40:51,662] Trial 111 finished with value: 0.29751396611903774 and parameters: {'model_type': 'graphsage', 'hidden_dims': '[256, 128]', 'dropout': 0.56689825212777, 'batch_norm': True, 'sage_aggr': 'max', 'sage_normalize': False, 'sage_project': False, 'lr': 0.0024907063596063274, 'weight_decay': 0.000400652444451329, 'epochs': 82, 'loss': 'mse', 'optimizer': 'adam', 'graph_mode': 'cutoff', 'cutoff': 0.7444126780560011, 'grm_norm': 'gcn', 'self_loops': True, 'use_snp_selection': False}. Best is trial 32 with value: 0.29775721061271626.
[I 2025-12-08 15:41:17,250] Trial 112 finished with value: 0.29063342800543607 and parameters: {'model_type': 'graphsage', 'hidden_dims': '[256, 128]', 'dropout': 0.5083433367744887, 'batch_norm': True, 'sage_aggr': 'max', 'sage_normalize': False, 'sage_project': False, 'lr': 0.0025839627948767503, 'weight_decay': 0.0004088071409239486, 'epochs': 67, 'loss': 'mse', 'optimizer': 'adam', 'graph_mode': 'cutoff', 'cutoff': 0.859770707599743, 'grm_norm': 'gcn', 'self_loops': True, 'use_snp_selection': False}. Best is trial 32 with value: 0.29775721061271626.
[I 2025-12-08 15:41:46,259] Trial 113 finished with value: 0.29200402879203535 and parameters: {'model_type': 'graphsage', 'hidden_dims': '[256, 128]', 'dropout': 0.5568132825971399, 'batch_norm': True, 'sage_aggr': 'max', 'sage_normalize': False, 'sage_project': False, 'lr': 0.003575144751103007, 'weight_decay': 0.00028033210111874044, 'epochs': 82, 'loss': 'mse', 'optimizer': 'adam', 'graph_mode': 'cutoff', 'cutoff': 0.7886223048346115, 'grm_norm': 'gcn', 'self_loops': True, 'use_snp_selection': False}. Best is trial 32 with value: 0.29775721061271626.
[I 2025-12-08 15:42:42,969] Trial 114 finished with value: 0.28847858875797144 and parameters: {'model_type': 'graphsage', 'hidden_dims': '[256, 128]', 'dropout': 0.5671584172750728, 'batch_norm': True, 'sage_aggr': 'max', 'sage_normalize': False, 'sage_project': False, 'lr': 0.004068128878710321, 'weight_decay': 0.00011763859418730608, 'epochs': 203, 'loss': 'mse', 'optimizer': 'adam', 'graph_mode': 'cutoff', 'cutoff': 0.7424996589218397, 'grm_norm': 'gcn', 'self_loops': True, 'use_snp_selection': False}. Best is trial 32 with value: 0.29775721061271626.
[I 2025-12-08 15:43:12,888] Trial 115 finished with value: 0.29352755460738267 and parameters: {'model_type': 'graphsage', 'hidden_dims': '[256, 128]', 'dropout': 0.5800472367313341, 'batch_norm': True, 'sage_aggr': 'max', 'sage_normalize': False, 'sage_project': False, 'lr': 0.002284061455996714, 'weight_decay': 0.0001662718282202841, 'epochs': 86, 'loss': 'mse', 'optimizer': 'adam', 'graph_mode': 'cutoff', 'cutoff': 0.8381572739300743, 'grm_norm': 'gcn', 'self_loops': True, 'use_snp_selection': False}. Best is trial 32 with value: 0.29775721061271626.
