[I 2025-12-09 01:06:10,461] Trial 48 finished with value: 0.307666226884071 and parameters: {'model_type': 'graphsage', 'hidden_dims': '[512, 128]', 'dropout': 0.2409484645309255, 'batch_norm': True, 'sage_aggr': 'mean', 'sage_normalize': True, 'sage_project': False, 'lr': 0.003218585602542801, 'weight_decay': 2.462079544681261e-07, 'epochs': 333, 'loss': 'mse', 'optimizer': 'adam', 'graph_mode': 'knn', 'knn_k': 7, 'weighted_edges': True, 'symmetrize_mode': 'mutual', 'self_loops': True, 'use_snp_selection': False}. Best is trial 31 with value: 0.3162843361804539.
[I 2025-12-09 01:06:26,316] Trial 49 finished with value: 0.2994417773369373 and parameters: {'model_type': 'graphsage', 'hidden_dims': '[128, 64]', 'dropout': 0.2983956584361119, 'batch_norm': True, 'sage_aggr': 'mean', 'sage_normalize': True, 'sage_project': False, 'lr': 0.0013088407495803877, 'weight_decay': 3.7260882803740236e-07, 'epochs': 42, 'loss': 'mse', 'optimizer': 'adam', 'graph_mode': 'cutoff', 'cutoff': 0.6463946452461176, 'grm_norm': 'cosine', 'self_loops': True, 'use_snp_selection': False}. Best is trial 31 with value: 0.3162843361804539.
[I 2025-12-09 01:07:22,161] Trial 50 finished with value: 0.30953605341651824 and parameters: {'model_type': 'graphsage', 'hidden_dims': '[512, 128]', 'dropout': 0.45540430886441374, 'batch_norm': True, 'sage_aggr': 'mean', 'sage_normalize': True, 'sage_project': False, 'lr': 0.002239015098595772, 'weight_decay': 1.3867134587127148e-07, 'epochs': 112, 'loss': 'mse', 'optimizer': 'adam', 'graph_mode': 'cutoff', 'cutoff': 0.7623841773023396, 'grm_norm': 'gcn', 'self_loops': True, 'use_snp_selection': False}. Best is trial 31 with value: 0.3162843361804539.
[I 2025-12-09 01:07:56,737] Trial 51 finished with value: 0.31289312522708634 and parameters: {'model_type': 'graphsage', 'hidden_dims': '[512, 64]', 'dropout': 0.3673675699923187, 'batch_norm': True, 'sage_aggr': 'mean', 'sage_normalize': True, 'sage_project': False, 'lr': 0.0030407053588830946, 'weight_decay': 1.5946174191872692e-06, 'epochs': 55, 'loss': 'mse', 'optimizer': 'adam', 'graph_mode': 'cutoff', 'cutoff': 0.626882142725158, 'grm_norm': 'cosine', 'self_loops': True, 'use_snp_selection': False}. Best is trial 31 with value: 0.3162843361804539.
[I 2025-12-09 01:08:31,804] Trial 52 finished with value: 0.296051349861246 and parameters: {'model_type': 'graphsage', 'hidden_dims': '[512, 64]', 'dropout': 0.3777026233804489, 'batch_norm': True, 'sage_aggr': 'mean', 'sage_normalize': True, 'sage_project': False, 'lr': 0.007457956036458587, 'weight_decay': 6.866865659578996e-07, 'epochs': 55, 'loss': 'mse', 'optimizer': 'adam', 'graph_mode': 'cutoff', 'cutoff': 0.545427705789625, 'grm_norm': 'cosine', 'self_loops': True, 'use_snp_selection': False}. Best is trial 31 with value: 0.3162843361804539.
[I 2025-12-09 01:09:12,955] Trial 53 finished with value: 0.3140968706477972 and parameters: {'model_type': 'graphsage', 'hidden_dims': '[512, 64]', 'dropout': 0.31912182807767075, 'batch_norm': True, 'sage_aggr': 'mean', 'sage_normalize': True, 'sage_project': False, 'lr': 0.0036592457134664944, 'weight_decay': 1.7398574770980094e-06, 'epochs': 72, 'loss': 'mse', 'optimizer': 'adam', 'graph_mode': 'cutoff', 'cutoff': 0.6758124065447831, 'grm_norm': 'cosine', 'self_loops': True, 'use_snp_selection': False}. Best is trial 31 with value: 0.3162843361804539.
[I 2025-12-09 01:09:53,531] Trial 54 finished with value: 0.3074361724417515 and parameters: {'model_type': 'graphsage', 'hidden_dims': '[512, 64]', 'dropout': 0.312996031235733, 'batch_norm': True, 'sage_aggr': 'mean', 'sage_normalize': True, 'sage_project': False, 'lr': 0.00973186095495663, 'weight_decay': 2.195033594054831e-07, 'epochs': 73, 'loss': 'mse', 'optimizer': 'adam', 'graph_mode': 'cutoff', 'cutoff': 0.6759152942572582, 'grm_norm': 'none', 'self_loops': True, 'use_snp_selection': False}. Best is trial 31 with value: 0.3162843361804539.
[I 2025-12-09 01:10:40,906] Trial 55 finished with value: 0.3148050071016292 and parameters: {'model_type': 'graphsage', 'hidden_dims': '[512, 64]', 'dropout': 0.40859177247629447, 'batch_norm': True, 'sage_aggr': 'mean', 'sage_normalize': True, 'sage_project': False, 'lr': 0.005149476947295954, 'weight_decay': 4.434212987363055e-07, 'epochs': 88, 'loss': 'mse', 'optimizer': 'adam', 'graph_mode': 'cutoff', 'cutoff': 0.8485386432722377, 'grm_norm': 'cosine', 'self_loops': True, 'use_snp_selection': False}. Best is trial 31 with value: 0.3162843361804539.
[I 2025-12-09 01:11:32,386] Trial 56 finished with value: 0.3139395540863598 and parameters: {'model_type': 'graphsage', 'hidden_dims': '[512, 256]', 'dropout': 0.41496322148843606, 'batch_norm': True, 'sage_aggr': 'mean', 'sage_normalize': True, 'sage_project': False, 'lr': 0.005106872645527404, 'weight_decay': 2.8817018630457215e-06, 'epochs': 98, 'loss': 'mse', 'optimizer': 'adam', 'graph_mode': 'cutoff', 'cutoff': 0.8475398601892178, 'grm_norm': 'cosine', 'self_loops': True, 'use_snp_selection': False}. Best is trial 31 with value: 0.3162843361804539.
[I 2025-12-09 01:12:20,747] Trial 57 finished with value: 0.3116205263798967 and parameters: {'model_type': 'graphsage', 'hidden_dims': '[512, 256]', 'dropout': 0.4068088445741704, 'batch_norm': True, 'sage_aggr': 'mean', 'sage_normalize': True, 'sage_project': False, 'lr': 0.004145899242076671, 'weight_decay': 4.826900389346105e-06, 'epochs': 90, 'loss': 'mse', 'optimizer': 'adam', 'graph_mode': 'cutoff', 'cutoff': 0.8575848267961356, 'grm_norm': 'cosine', 'self_loops': False, 'use_snp_selection': False}. Best is trial 31 with value: 0.3162843361804539.
[I 2025-12-09 01:13:11,026] Trial 58 finished with value: 0.28900457682013636 and parameters: {'model_type': 'graphsage', 'hidden_dims': '[512, 256]', 'dropout': 0.43650140805476834, 'batch_norm': False, 'sage_aggr': 'mean', 'sage_normalize': True, 'sage_project': False, 'lr': 0.0016651652087554787, 'weight_decay': 3.092845921704186e-06, 'epochs': 95, 'loss': 'mse', 'optimizer': 'adam', 'graph_mode': 'cutoff', 'cutoff': 0.8437665224677648, 'grm_norm': 'cosine_then_gcn', 'self_loops': True, 'use_snp_selection': False}. Best is trial 31 with value: 0.3162843361804539.
[I 2025-12-09 01:14:09,210] Trial 59 finished with value: 0.30606053819496415 and parameters: {'model_type': 'graphsage', 'hidden_dims': '[512, 256]', 'dropout': 0.34484238596399, 'batch_norm': True, 'sage_aggr': 'mean', 'sage_normalize': True, 'sage_project': False, 'lr': 0.002426945627781898, 'weight_decay': 1.9101617250371254e-06, 'epochs': 115, 'loss': 'mse', 'optimizer': 'adam', 'graph_mode': 'cutoff', 'cutoff': 0.8944896590836018, 'grm_norm': 'cosine', 'self_loops': True, 'use_snp_selection': False}. Best is trial 31 with value: 0.3162843361804539.
[I 2025-12-09 01:14:41,032] Trial 60 finished with value: 0.30043843079979926 and parameters: {'model_type': 'graphsage', 'hidden_dims': '[256, 128, 64]', 'dropout': 0.4208719133675299, 'batch_norm': True, 'sage_aggr': 'max', 'sage_normalize': True, 'sage_project': False, 'lr': 1.004067125721024e-05, 'weight_decay': 8.515749485669863e-07, 'epochs': 101, 'loss': 'mse', 'optimizer': 'adam', 'graph_mode': 'cutoff', 'cutoff': 0.7703690132683512, 'grm_norm': 'none', 'self_loops': True, 'use_snp_selection': False}. Best is trial 31 with value: 0.3162843361804539.
[I 2025-12-09 01:15:25,548] Trial 61 finished with value: 0.31253048998830363 and parameters: {'model_type': 'graphsage', 'hidden_dims': '[512, 256]', 'dropout': 0.47272365229491164, 'batch_norm': True, 'sage_aggr': 'mean', 'sage_normalize': True, 'sage_project': False, 'lr': 0.005211083138806679, 'weight_decay': 4.425029149827845e-07, 'epochs': 79, 'loss': 'mse', 'optimizer': 'adam', 'graph_mode': 'cutoff', 'cutoff': 0.826562377846458, 'grm_norm': 'cosine', 'self_loops': True, 'use_snp_selection': False}. Best is trial 31 with value: 0.3162843361804539.
[I 2025-12-09 01:16:03,386] Trial 62 finished with value: 0.30973941449018544 and parameters: {'model_type': 'graphsage', 'hidden_dims': '[256, 128]', 'dropout': 0.345983148115114, 'batch_norm': True, 'sage_aggr': 'mean', 'sage_normalize': True, 'sage_project': False, 'lr': 0.00750271825879588, 'weight_decay': 5.69442448274189e-07, 'epochs': 124, 'loss': 'mse', 'optimizer': 'adam', 'graph_mode': 'cutoff', 'cutoff': 0.7383528397970716, 'grm_norm': 'cosine', 'self_loops': True, 'use_snp_selection': False}. Best is trial 31 with value: 0.3162843361804539.
[I 2025-12-09 01:16:56,058] Trial 63 finished with value: 0.30863748494309534 and parameters: {'model_type': 'graphsage', 'hidden_dims': '[512, 256]', 'dropout': 0.39936705220181634, 'batch_norm': True, 'sage_aggr': 'mean', 'sage_normalize': True, 'sage_project': False, 'lr': 0.0037708508327710926, 'weight_decay': 2.2640063818984144e-06, 'epochs': 101, 'loss': 'mse', 'optimizer': 'adam', 'graph_mode': 'cutoff', 'cutoff': 0.8048712063537028, 'grm_norm': 'cosine', 'self_loops': True, 'use_snp_selection': False}. Best is trial 31 with value: 0.3162843361804539.
[I 2025-12-09 01:17:36,089] Trial 64 finished with value: 0.31464835989037365 and parameters: {'model_type': 'graphsage', 'hidden_dims': '[512, 128]', 'dropout': 0.44089244884362105, 'batch_norm': True, 'sage_aggr': 'mean', 'sage_normalize': True, 'sage_project': False, 'lr': 0.0049753549798737615, 'weight_decay': 5.08451664813819e-06, 'epochs': 69, 'loss': 'mse', 'optimizer': 'adam', 'graph_mode': 'cutoff', 'cutoff': 0.7770504041175997, 'grm_norm': 'cosine', 'self_loops': True, 'use_snp_selection': False}. Best is trial 31 with value: 0.3162843361804539.
[I 2025-12-09 01:18:02,309] Trial 65 finished with value: 0.31412870807149584 and parameters: {'model_type': 'graphsage', 'hidden_dims': '[256, 128]', 'dropout': 0.44560842930533207, 'batch_norm': True, 'sage_aggr': 'mean', 'sage_normalize': True, 'sage_project': False, 'lr': 0.0062630163631924324, 'weight_decay': 4.5514642056830025e-06, 'epochs': 70, 'loss': 'mse', 'optimizer': 'adam', 'graph_mode': 'cutoff', 'cutoff': 0.8724410180023766, 'grm_norm': 'cosine', 'self_loops': True, 'use_snp_selection': False}. Best is trial 31 with value: 0.3162843361804539.
[I 2025-12-09 01:18:29,365] Trial 66 finished with value: 0.31604656542118825 and parameters: {'model_type': 'graphsage', 'hidden_dims': '[256, 128]', 'dropout': 0.5105360980152971, 'batch_norm': True, 'sage_aggr': 'mean', 'sage_normalize': True, 'sage_project': False, 'lr': 0.007874442845465082, 'weight_decay': 6.151258928586187e-06, 'epochs': 74, 'loss': 'mse', 'optimizer': 'adam', 'graph_mode': 'cutoff', 'cutoff': 0.8750917820659978, 'grm_norm': 'cosine', 'self_loops': True, 'use_snp_selection': False}. Best is trial 31 with value: 0.3162843361804539.
[I 2025-12-09 01:18:58,993] Trial 67 finished with value: 0.3162949131121171 and parameters: {'model_type': 'graphsage', 'hidden_dims': '[256, 128]', 'dropout': 0.5189776160292612, 'batch_norm': True, 'sage_aggr': 'mean', 'sage_normalize': True, 'sage_project': False, 'lr': 0.008271432948774523, 'weight_decay': 5.621515750889937e-06, 'epochs': 86, 'loss': 'mse', 'optimizer': 'adam', 'graph_mode': 'cutoff', 'cutoff': 0.8846066726031618, 'grm_norm': 'cosine', 'self_loops': True, 'use_snp_selection': False}. Best is trial 67 with value: 0.3162949131121171.
[I 2025-12-09 01:19:32,724] Trial 68 finished with value: 0.2982368470262299 and parameters: {'model_type': 'graphsage', 'hidden_dims': '[256, 128]', 'dropout': 0.518627264577237, 'batch_norm': True, 'sage_aggr': 'mean', 'sage_normalize': True, 'sage_project': False, 'lr': 0.008051903903775687, 'weight_decay': 6.507495316743496e-05, 'epochs': 87, 'loss': 'mse', 'optimizer': 'adam', 'graph_mode': 'knn', 'knn_k': 1, 'weighted_edges': False, 'symmetrize_mode': 'union', 'self_loops': True, 'use_snp_selection': False}. Best is trial 67 with value: 0.3162949131121171.
[I 2025-12-09 01:20:01,704] Trial 69 finished with value: 0.30921570178936136 and parameters: {'model_type': 'graphsage', 'hidden_dims': '[256, 128]', 'dropout': 0.5081775969462426, 'batch_norm': True, 'sage_aggr': 'mean', 'sage_normalize': True, 'sage_project': False, 'lr': 0.009911641259686767, 'weight_decay': 2.116077966146533e-05, 'epochs': 83, 'loss': 'mse', 'optimizer': 'adam', 'graph_mode': 'cutoff', 'cutoff': 0.8824288079224287, 'grm_norm': 'cosine', 'self_loops': False, 'use_snp_selection': False}. Best is trial 67 with value: 0.3162949131121171.
[I 2025-12-09 01:20:40,588] Trial 70 finished with value: 0.29829232274100487 and parameters: {'model_type': 'graphsage', 'hidden_dims': '[256, 128]', 'dropout': 0.5595334800363857, 'batch_norm': False, 'sage_aggr': 'mean', 'sage_normalize': True, 'sage_project': False, 'lr': 0.007415733686851752, 'weight_decay': 6.3431582867881576e-06, 'epochs': 134, 'loss': 'mse', 'optimizer': 'adam', 'graph_mode': 'cutoff', 'cutoff': 0.7810478186335289, 'grm_norm': 'none', 'self_loops': True, 'use_snp_selection': False}. Best is trial 67 with value: 0.3162949131121171.
[I 2025-12-09 01:21:06,163] Trial 71 finished with value: 0.30857529102585657 and parameters: {'model_type': 'graphsage', 'hidden_dims': '[256, 128]', 'dropout': 0.44783113251338225, 'batch_norm': True, 'sage_aggr': 'mean', 'sage_normalize': True, 'sage_project': False, 'lr': 0.006055920385769538, 'weight_decay': 4.269642880939542e-06, 'epochs': 67, 'loss': 'mse', 'optimizer': 'adam', 'graph_mode': 'cutoff', 'cutoff': 0.872264101663407, 'grm_norm': 'cosine', 'self_loops': True, 'use_snp_selection': False}. Best is trial 67 with value: 0.3162949131121171.
[I 2025-12-09 01:21:27,425] Trial 72 finished with value: 0.3002018993435276 and parameters: {'model_type': 'graphsage', 'hidden_dims': '[256, 128]', 'dropout': 0.5247532256162352, 'batch_norm': True, 'sage_aggr': 'mean', 'sage_normalize': True, 'sage_project': False, 'lr': 0.006166530324408874, 'weight_decay': 6.88388576987841e-06, 'epochs': 47, 'loss': 'mse', 'optimizer': 'adam', 'graph_mode': 'cutoff', 'cutoff': 0.8658286662546413, 'grm_norm': 'cosine', 'self_loops': True, 'use_snp_selection': False}. Best is trial 67 with value: 0.3162949131121171.
[I 2025-12-09 01:21:54,917] Trial 73 finished with value: 0.30895141673049886 and parameters: {'model_type': 'graphsage', 'hidden_dims': '[256, 128]', 'dropout': 0.46590581667108344, 'batch_norm': True, 'sage_aggr': 'mean', 'sage_normalize': True, 'sage_project': False, 'lr': 0.00457874047942835, 'weight_decay': 0.00025513548839060105, 'epochs': 76, 'loss': 'mse', 'optimizer': 'adam', 'graph_mode': 'cutoff', 'cutoff': 0.8106886550792015, 'grm_norm': 'cosine', 'self_loops': True, 'use_snp_selection': False}. Best is trial 67 with value: 0.3162949131121171.
[I 2025-12-09 01:22:20,520] Trial 74 finished with value: 0.31047583508145854 and parameters: {'model_type': 'graphsage', 'hidden_dims': '[256, 128]', 'dropout': 0.43190564258512254, 'batch_norm': True, 'sage_aggr': 'mean', 'sage_normalize': True, 'sage_project': False, 'lr': 0.00822456454533964, 'weight_decay': 1.119395834712339e-05, 'epochs': 67, 'loss': 'mse', 'optimizer': 'adam', 'graph_mode': 'cutoff', 'cutoff': 0.8901838826330942, 'grm_norm': 'cosine', 'self_loops': True, 'use_snp_selection': False}. Best is trial 67 with value: 0.3162949131121171.
[I 2025-12-09 01:22:50,566] Trial 75 finished with value: 0.3066865666146421 and parameters: {'model_type': 'graphsage', 'hidden_dims': '[256, 128]', 'dropout': 0.5386552722962765, 'batch_norm': True, 'sage_aggr': 'mean', 'sage_normalize': True, 'sage_project': False, 'lr': 4.2492892125233705e-05, 'weight_decay': 3.991767471687641e-06, 'epochs': 88, 'loss': 'mse', 'optimizer': 'adam', 'graph_mode': 'cutoff', 'cutoff': 0.8542020378085278, 'grm_norm': 'cosine', 'self_loops': True, 'use_snp_selection': False}. Best is trial 67 with value: 0.3162949131121171.
[I 2025-12-09 01:23:59,669] Trial 76 finished with value: 0.31118784446183606 and parameters: {'model_type': 'graphsage', 'hidden_dims': '[256, 128]', 'dropout': 0.5014259087940227, 'batch_norm': True, 'sage_aggr': 'max', 'sage_normalize': True, 'sage_project': False, 'lr': 0.0038755025289231443, 'weight_decay': 7.734555429354571e-06, 'epochs': 277, 'loss': 'mse', 'optimizer': 'adam', 'graph_mode': 'cutoff', 'cutoff': 0.8230398458333117, 'grm_norm': 'gcn', 'self_loops': True, 'use_snp_selection': False}. Best is trial 67 with value: 0.3162949131121171.
[I 2025-12-09 01:24:34,720] Trial 77 finished with value: 0.31105148984735276 and parameters: {'model_type': 'graphsage', 'hidden_dims': '[256, 128]', 'dropout': 0.4784659270001905, 'batch_norm': True, 'sage_aggr': 'mean', 'sage_normalize': True, 'sage_project': False, 'lr': 0.005981557541475972, 'weight_decay': 5.708642663042608e-06, 'epochs': 111, 'loss': 'mse', 'optimizer': 'adam', 'graph_mode': 'cutoff', 'cutoff': 0.8977407027238989, 'grm_norm': 'cosine', 'self_loops': True, 'use_snp_selection': False}. Best is trial 67 with value: 0.3162949131121171.
[I 2025-12-09 01:24:56,577] Trial 78 finished with value: 0.2927225070283328 and parameters: {'model_type': 'graphsage', 'hidden_dims': '[256, 128, 64]', 'dropout': 0.4437215516116514, 'batch_norm': True, 'sage_aggr': 'mean', 'sage_normalize': True, 'sage_project': False, 'lr': 0.0024487899660688346, 'weight_decay': 9.524149112153393e-06, 'epochs': 49, 'loss': 'mse', 'optimizer': 'adam', 'graph_mode': 'cutoff', 'cutoff': 0.791017100319784, 'grm_norm': 'cosine_then_gcn', 'self_loops': True, 'use_snp_selection': False}. Best is trial 67 with value: 0.3162949131121171.
[I 2025-12-09 01:25:48,478] Trial 79 finished with value: 0.30040356976430077 and parameters: {'model_type': 'graphsage', 'hidden_dims': '[512, 128]', 'dropout': 0.5762520730445632, 'batch_norm': True, 'sage_aggr': 'mean', 'sage_normalize': True, 'sage_project': False, 'lr': 0.0046363211883801965, 'weight_decay': 1.9195985170840382e-05, 'epochs': 80, 'loss': 'mse', 'optimizer': 'adam', 'graph_mode': 'knn', 'knn_k': 5, 'weighted_edges': False, 'symmetrize_mode': 'mutual', 'self_loops': True, 'use_snp_selection': False}. Best is trial 67 with value: 0.3162949131121171.
[I 2025-12-09 01:26:14,515] Trial 80 finished with value: 0.30903998805330096 and parameters: {'model_type': 'graphsage', 'hidden_dims': '[256, 128]', 'dropout': 0.5464251068292145, 'batch_norm': True, 'sage_aggr': 'mean', 'sage_normalize': True, 'sage_project': False, 'lr': 0.006999146508947372, 'weight_decay': 3.371144872499755e-06, 'epochs': 69, 'loss': 'mse', 'optimizer': 'adam', 'graph_mode': 'cutoff', 'cutoff': 0.8659305874635277, 'grm_norm': 'cosine', 'self_loops': True, 'use_snp_selection': False}. Best is trial 67 with value: 0.3162949131121171.
[I 2025-12-09 01:26:34,518] Trial 81 finished with value: 0.3091618874937808 and parameters: {'model_type': 'graphsage', 'hidden_dims': '[128, 64]', 'dropout': 0.3925013129752619, 'batch_norm': True, 'sage_aggr': 'mean', 'sage_normalize': True, 'sage_project': False, 'lr': 0.0035204456837099724, 'weight_decay': 5.607600919140564e-06, 'epochs': 74, 'loss': 'mse', 'optimizer': 'adam', 'graph_mode': 'cutoff', 'cutoff': 0.8384193586865164, 'grm_norm': 'cosine', 'self_loops': True, 'use_snp_selection': False}. Best is trial 67 with value: 0.3162949131121171.
[I 2025-12-09 01:27:25,062] Trial 82 finished with value: 0.31716674889826163 and parameters: {'model_type': 'graphsage', 'hidden_dims': '[512, 64]', 'dropout': 0.4921605042203814, 'batch_norm': True, 'sage_aggr': 'mean', 'sage_normalize': True, 'sage_project': False, 'lr': 0.005698782793468826, 'weight_decay': 1.9709266465446807e-06, 'epochs': 96, 'loss': 'mse', 'optimizer': 'adam', 'graph_mode': 'cutoff', 'cutoff': 0.8103955959542148, 'grm_norm': 'cosine', 'self_loops': True, 'use_snp_selection': False}. Best is trial 82 with value: 0.31716674889826163.
[I 2025-12-09 01:27:56,662] Trial 83 finished with value: 0.30759850085999435 and parameters: {'model_type': 'graphsage', 'hidden_dims': '[256, 128]', 'dropout': 0.4982373139156999, 'batch_norm': True, 'sage_aggr': 'mean', 'sage_normalize': True, 'sage_project': False, 'lr': 0.00870726239227285, 'weight_decay': 2.5692126017003774e-06, 'epochs': 95, 'loss': 'mse', 'optimizer': 'adam', 'graph_mode': 'cutoff', 'cutoff': 0.8066415302116825, 'grm_norm': 'cosine', 'self_loops': True, 'use_snp_selection': False}. Best is trial 82 with value: 0.31716674889826163.
[I 2025-12-09 01:28:51,736] Trial 84 finished with value: 0.3109885286263525 and parameters: {'model_type': 'graphsage', 'hidden_dims': '[512, 128]', 'dropout': 0.4856547125162188, 'batch_norm': True, 'sage_aggr': 'mean', 'sage_normalize': True, 'sage_project': False, 'lr': 0.005733592422073198, 'weight_decay': 1.2620541785835365e-05, 'epochs': 107, 'loss': 'mse', 'optimizer': 'adam', 'graph_mode': 'cutoff', 'cutoff': 0.7789650282303766, 'grm_norm': 'cosine', 'self_loops': True, 'use_snp_selection': False}. Best is trial 82 with value: 0.31716674889826163.
[I 2025-12-09 01:29:51,407] Trial 85 finished with value: 0.3007134122867928 and parameters: {'model_type': 'graphsage', 'hidden_dims': '[512, 64]', 'dropout': 0.10048332380905659, 'batch_norm': True, 'sage_aggr': 'mean', 'sage_normalize': True, 'sage_project': False, 'lr': 0.00443732040465134, 'weight_decay': 1.2346809930508192e-06, 'epochs': 119, 'loss': 'mse', 'optimizer': 'adam', 'graph_mode': 'cutoff', 'cutoff': 0.7459229923657876, 'grm_norm': 'cosine', 'self_loops': True, 'use_snp_selection': False}. Best is trial 82 with value: 0.31716674889826163.
[I 2025-12-09 01:30:13,516] Trial 86 finished with value: 0.26156378565184146 and parameters: {'model_type': 'graphsage', 'hidden_dims': '[256, 128]', 'dropout': 0.42648946872217675, 'batch_norm': False, 'sage_aggr': 'mean', 'sage_normalize': True, 'sage_project': False, 'lr': 0.006947608521182661, 'weight_decay': 1.666262113189321e-07, 'epochs': 51, 'loss': 'mse', 'optimizer': 'adam', 'graph_mode': 'cutoff', 'cutoff': 0.8193827766927555, 'grm_norm': 'cosine', 'self_loops': False, 'use_snp_selection': False}. Best is trial 82 with value: 0.31716674889826163.
