[I 2025-12-10 07:28:21,104] Trial 28 finished with value: 0.2832992425120985 and parameters: {'model_type': 'graphsage', 'hidden_dims': '[256, 128]', 'dropout': 0.46742451254814205, 'batch_norm': False, 'sage_aggr': 'max', 'sage_normalize': False, 'sage_project': False, 'lr': 2.94653071771997e-05, 'weight_decay': 2.773205788909878e-07, 'epochs': 99, 'loss': 'mse', 'optimizer': 'adam', 'graph_mode': 'cutoff', 'cutoff': 0.3169168437117632, 'grm_norm': 'gcn', 'self_loops': False, 'use_snp_selection': True, 'num_snps': 11168}. Best is trial 19 with value: 0.2991266517976424.
[I 2025-12-10 07:31:11,791] Trial 29 finished with value: 0.2323014015201462 and parameters: {'model_type': 'graphsage', 'hidden_dims': '[512, 64]', 'dropout': 0.5453396890643647, 'batch_norm': True, 'sage_aggr': 'max', 'sage_normalize': True, 'sage_project': False, 'lr': 0.0002126566754547883, 'weight_decay': 1.905366947331104e-06, 'epochs': 230, 'loss': 'mse', 'optimizer': 'adam', 'graph_mode': 'cutoff', 'cutoff': 0.4360710321075942, 'grm_norm': 'cosine_then_gcn', 'self_loops': False, 'use_snp_selection': False}. Best is trial 19 with value: 0.2991266517976424.
[I 2025-12-10 07:33:29,079] Trial 30 finished with value: 0.27027754127197573 and parameters: {'model_type': 'graphsage', 'hidden_dims': '[128, 64]', 'dropout': 0.37670931174350997, 'batch_norm': False, 'sage_aggr': 'max', 'sage_normalize': False, 'sage_project': False, 'lr': 9.881461080427969e-05, 'weight_decay': 7.896990385808444e-05, 'epochs': 262, 'loss': 'mse', 'optimizer': 'adam', 'graph_mode': 'cutoff', 'cutoff': 0.3057842583217879, 'grm_norm': 'none', 'self_loops': False, 'use_snp_selection': True, 'num_snps': 28493}. Best is trial 19 with value: 0.2991266517976424.
[I 2025-12-10 07:34:24,574] Trial 31 finished with value: 0.29693915216497574 and parameters: {'model_type': 'graphsage', 'hidden_dims': '[512, 256]', 'dropout': 0.5001796895309651, 'batch_norm': False, 'sage_aggr': 'max', 'sage_normalize': False, 'sage_project': False, 'lr': 2.2009653617756577e-05, 'weight_decay': 1.8640078552235718e-05, 'epochs': 214, 'loss': 'mse', 'optimizer': 'adam', 'graph_mode': 'cutoff', 'cutoff': 0.4141675001388785, 'grm_norm': 'cosine_then_gcn', 'self_loops': False, 'use_snp_selection': True, 'num_snps': 11918}. Best is trial 19 with value: 0.2991266517976424.
[I 2025-12-10 07:35:20,663] Trial 32 finished with value: 0.2918644653082594 and parameters: {'model_type': 'graphsage', 'hidden_dims': '[512, 256]', 'dropout': 0.4794330213157694, 'batch_norm': False, 'sage_aggr': 'max', 'sage_normalize': False, 'sage_project': False, 'lr': 2.1937854752992137e-05, 'weight_decay': 4.146683370794659e-06, 'epochs': 219, 'loss': 'mse', 'optimizer': 'adam', 'graph_mode': 'cutoff', 'cutoff': 0.4626065929927976, 'grm_norm': 'cosine_then_gcn', 'self_loops': False, 'use_snp_selection': True, 'num_snps': 12224}. Best is trial 19 with value: 0.2991266517976424.
[I 2025-12-10 07:35:52,656] Trial 33 finished with value: 0.26471452693650377 and parameters: {'model_type': 'graphsage', 'hidden_dims': '[512, 256]', 'dropout': 0.4253055534053507, 'batch_norm': False, 'sage_aggr': 'max', 'sage_normalize': False, 'sage_project': False, 'lr': 4.8198581629993295e-05, 'weight_decay': 2.1802933399335595e-05, 'epochs': 136, 'loss': 'mse', 'optimizer': 'adam', 'graph_mode': 'cutoff', 'cutoff': 0.5531805945871784, 'grm_norm': 'cosine_then_gcn', 'self_loops': False, 'use_snp_selection': True, 'num_snps': 7040}. Best is trial 19 with value: 0.2991266517976424.
[I 2025-12-10 07:37:19,234] Trial 34 finished with value: 0.2977047907669731 and parameters: {'model_type': 'graphsage', 'hidden_dims': '[512, 256]', 'dropout': 0.561570764643825, 'batch_norm': False, 'sage_aggr': 'max', 'sage_normalize': False, 'sage_project': False, 'lr': 1.4877557192922417e-05, 'weight_decay': 4.8823679331174596e-05, 'epochs': 178, 'loss': 'mse', 'optimizer': 'adam', 'graph_mode': 'cutoff', 'cutoff': 0.39234984068022954, 'grm_norm': 'cosine', 'self_loops': False, 'use_snp_selection': True, 'num_snps': 24077}. Best is trial 19 with value: 0.2991266517976424.
[I 2025-12-10 07:38:05,472] Trial 35 finished with value: 0.3015295099119898 and parameters: {'model_type': 'graphsage', 'hidden_dims': '[512, 256]', 'dropout': 0.5651470378773809, 'batch_norm': False, 'sage_aggr': 'max', 'sage_normalize': False, 'sage_project': False, 'lr': 1.0263043167200545e-05, 'weight_decay': 4.6805067449327404e-05, 'epochs': 178, 'loss': 'mse', 'optimizer': 'adam', 'graph_mode': 'cutoff', 'cutoff': 0.3794676393076831, 'grm_norm': 'cosine', 'self_loops': False, 'use_snp_selection': True, 'num_snps': 9988}. Best is trial 35 with value: 0.3015295099119898.
[I 2025-12-10 07:39:45,989] Trial 36 finished with value: 0.26579854376533507 and parameters: {'model_type': 'graphsage', 'hidden_dims': '[512, 256]', 'dropout': 0.5723226781856685, 'batch_norm': True, 'sage_aggr': 'max', 'sage_normalize': False, 'sage_project': False, 'lr': 1.2384360004087764e-05, 'weight_decay': 4.111659095889544e-05, 'epochs': 170, 'loss': 'mse', 'optimizer': 'adam', 'graph_mode': 'cutoff', 'cutoff': 0.3081811897865835, 'grm_norm': 'cosine', 'self_loops': False, 'use_snp_selection': True, 'num_snps': 23243}. Best is trial 35 with value: 0.3015295099119898.
[I 2025-12-10 07:41:07,763] Trial 37 finished with value: 0.25626789643307385 and parameters: {'model_type': 'graphsage', 'hidden_dims': '[256, 128, 64]', 'dropout': 0.529851301460115, 'batch_norm': False, 'sage_aggr': 'max', 'sage_normalize': False, 'sage_project': False, 'lr': 1.5218005459877077e-05, 'weight_decay': 8.146523393676105e-06, 'epochs': 155, 'loss': 'mse', 'optimizer': 'adam', 'graph_mode': 'cutoff', 'cutoff': 0.33869958981553694, 'grm_norm': 'cosine', 'self_loops': False, 'use_snp_selection': False}. Best is trial 35 with value: 0.3015295099119898.
[I 2025-12-10 07:42:04,313] Trial 38 finished with value: 0.27802201100464774 and parameters: {'model_type': 'graphsage', 'hidden_dims': '[128, 64]', 'dropout': 0.5759556720372566, 'batch_norm': True, 'sage_aggr': 'mean', 'sage_normalize': True, 'sage_project': False, 'lr': 1.0253335799635467e-05, 'weight_decay': 4.825602426409824e-05, 'epochs': 184, 'loss': 'mae', 'optimizer': 'adam', 'graph_mode': 'cutoff', 'cutoff': 0.37948915381191844, 'grm_norm': 'cosine', 'self_loops': True, 'use_snp_selection': True, 'num_snps': 22957}. Best is trial 35 with value: 0.3015295099119898.
[I 2025-12-10 07:42:46,178] Trial 39 finished with value: 0.28198294117638323 and parameters: {'model_type': 'graphsage', 'hidden_dims': '[512, 64]', 'dropout': 0.5546871062369149, 'batch_norm': False, 'sage_aggr': 'max', 'sage_normalize': False, 'sage_project': False, 'lr': 1.622345971526971e-05, 'weight_decay': 0.00033139083492480864, 'epochs': 155, 'loss': 'mse', 'optimizer': 'adam', 'graph_mode': 'cutoff', 'cutoff': 0.2888818393531925, 'grm_norm': 'cosine', 'self_loops': False, 'use_snp_selection': True, 'num_snps': 8160}. Best is trial 35 with value: 0.3015295099119898.
[I 2025-12-10 07:44:27,585] Trial 40 finished with value: 0.26987610146739555 and parameters: {'model_type': 'graphsage', 'hidden_dims': '[512, 256]', 'dropout': 0.5222326854057322, 'batch_norm': True, 'sage_aggr': 'max', 'sage_normalize': False, 'sage_project': False, 'lr': 2.8451177303508375e-05, 'weight_decay': 6.74372605895274e-05, 'epochs': 133, 'loss': 'mae', 'optimizer': 'adam', 'graph_mode': 'cutoff', 'cutoff': 0.45113797446267523, 'grm_norm': 'cosine', 'self_loops': True, 'use_snp_selection': False}. Best is trial 35 with value: 0.3015295099119898.
[I 2025-12-10 07:45:19,104] Trial 41 finished with value: 0.30005755689550184 and parameters: {'model_type': 'graphsage', 'hidden_dims': '[512, 256]', 'dropout': 0.5094107230647029, 'batch_norm': False, 'sage_aggr': 'max', 'sage_normalize': False, 'sage_project': False, 'lr': 1.6667008131087822e-05, 'weight_decay': 1.8995031239186043e-05, 'epochs': 176, 'loss': 'mse', 'optimizer': 'adam', 'graph_mode': 'cutoff', 'cutoff': 0.4149208900794064, 'grm_norm': 'cosine', 'self_loops': False, 'use_snp_selection': True, 'num_snps': 12419}. Best is trial 35 with value: 0.3015295099119898.
[I 2025-12-10 07:46:19,067] Trial 42 finished with value: 0.3002549837150633 and parameters: {'model_type': 'graphsage', 'hidden_dims': '[512, 256]', 'dropout': 0.5832562189473516, 'batch_norm': False, 'sage_aggr': 'max', 'sage_normalize': False, 'sage_project': False, 'lr': 1.672126503183348e-05, 'weight_decay': 6.755200672820706e-06, 'epochs': 184, 'loss': 'mse', 'optimizer': 'adam', 'graph_mode': 'cutoff', 'cutoff': 0.37686377988239894, 'grm_norm': 'cosine', 'self_loops': False, 'use_snp_selection': True, 'num_snps': 14854}. Best is trial 35 with value: 0.3015295099119898.
[I 2025-12-10 07:47:19,175] Trial 43 finished with value: 0.29889155811369916 and parameters: {'model_type': 'graphsage', 'hidden_dims': '[512, 256]', 'dropout': 0.5839035096828679, 'batch_norm': False, 'sage_aggr': 'max', 'sage_normalize': False, 'sage_project': False, 'lr': 1.5310413830605974e-05, 'weight_decay': 6.4108976558035e-06, 'epochs': 178, 'loss': 'mse', 'optimizer': 'adam', 'graph_mode': 'cutoff', 'cutoff': 0.3619527786765799, 'grm_norm': 'cosine', 'self_loops': False, 'use_snp_selection': True, 'num_snps': 15131}. Best is trial 35 with value: 0.3015295099119898.
[I 2025-12-10 07:48:21,003] Trial 44 finished with value: 0.2922406075009448 and parameters: {'model_type': 'graphsage', 'hidden_dims': '[512, 256]', 'dropout': 0.5831848763288687, 'batch_norm': False, 'sage_aggr': 'mean', 'sage_normalize': False, 'sage_project': False, 'lr': 1.807444945830753e-05, 'weight_decay': 1.2805491939368374e-06, 'epochs': 188, 'loss': 'mse', 'optimizer': 'adam', 'graph_mode': 'cutoff', 'cutoff': 0.25892848655670425, 'grm_norm': 'cosine', 'self_loops': False, 'use_snp_selection': True, 'num_snps': 13005}. Best is trial 35 with value: 0.3015295099119898.
[I 2025-12-10 07:49:13,874] Trial 45 finished with value: 0.2816862630882492 and parameters: {'model_type': 'graphsage', 'hidden_dims': '[512, 128]', 'dropout': 0.5177192396533022, 'batch_norm': False, 'sage_aggr': 'max', 'sage_normalize': True, 'sage_project': False, 'lr': 1.0254264483124761e-05, 'weight_decay': 5.217252487596829e-06, 'epochs': 136, 'loss': 'mse', 'optimizer': 'adam', 'graph_mode': 'cutoff', 'cutoff': 0.35905579008099875, 'grm_norm': 'cosine', 'self_loops': False, 'use_snp_selection': True, 'num_snps': 15447}. Best is trial 35 with value: 0.3015295099119898.
[I 2025-12-10 07:49:41,883] Trial 46 finished with value: 0.23795767278497734 and parameters: {'model_type': 'graphsage', 'hidden_dims': '[256, 128, 64]', 'dropout': 0.5522613547870283, 'batch_norm': False, 'sage_aggr': 'max', 'sage_normalize': False, 'sage_project': False, 'lr': 3.544793213285711e-05, 'weight_decay': 8.66410790114011e-06, 'epochs': 150, 'loss': 'mse', 'optimizer': 'adam', 'graph_mode': 'knn', 'knn_k': 10, 'weighted_edges': True, 'symmetrize_mode': 'union', 'self_loops': False, 'use_snp_selection': True, 'num_snps': 2073}. Best is trial 35 with value: 0.3015295099119898.
[I 2025-12-10 07:50:43,361] Trial 47 finished with value: 0.22848062781885994 and parameters: {'model_type': 'graphsage', 'hidden_dims': '[512, 256]', 'dropout': 0.5954203665476396, 'batch_norm': False, 'sage_aggr': 'max', 'sage_normalize': False, 'sage_project': False, 'lr': 1.9401193965494927e-05, 'weight_decay': 3.6679615111397466e-06, 'epochs': 98, 'loss': 'mae', 'optimizer': 'adam', 'graph_mode': 'cutoff', 'cutoff': 0.20494897794902997, 'grm_norm': 'cosine', 'self_loops': True, 'use_snp_selection': True, 'num_snps': 15588}. Best is trial 35 with value: 0.3015295099119898.
[I 2025-12-10 07:51:17,358] Trial 48 finished with value: 0.2552373705543349 and parameters: {'model_type': 'graphsage', 'hidden_dims': '[256, 128]', 'dropout': 0.3146359948337931, 'batch_norm': True, 'sage_aggr': 'max', 'sage_normalize': False, 'sage_project': False, 'lr': 6.706362539352254e-05, 'weight_decay': 2.5508857303603915e-05, 'epochs': 195, 'loss': 'mse', 'optimizer': 'adam', 'graph_mode': 'cutoff', 'cutoff': 0.35944095103306783, 'grm_norm': 'none', 'self_loops': False, 'use_snp_selection': True, 'num_snps': 6546}. Best is trial 35 with value: 0.3015295099119898.
[I 2025-12-10 07:52:25,879] Trial 49 finished with value: 0.2744241217719668 and parameters: {'model_type': 'graphsage', 'hidden_dims': '[512, 64]', 'dropout': 0.5372100045021879, 'batch_norm': False, 'sage_aggr': 'mean', 'sage_normalize': True, 'sage_project': False, 'lr': 1.2988558535411144e-05, 'weight_decay': 1.3926938599026675e-05, 'epochs': 173, 'loss': 'mse', 'optimizer': 'adam', 'graph_mode': 'cutoff', 'cutoff': 0.4836788942179856, 'grm_norm': 'cosine', 'self_loops': False, 'use_snp_selection': True, 'num_snps': 20861}. Best is trial 35 with value: 0.3015295099119898.
[I 2025-12-10 07:54:57,808] Trial 50 finished with value: 0.2630208751412482 and parameters: {'model_type': 'graphsage', 'hidden_dims': '[512, 256]', 'dropout': 0.2286792825839225, 'batch_norm': False, 'sage_aggr': 'max', 'sage_normalize': False, 'sage_project': False, 'lr': 5.1044596639548003e-05, 'weight_decay': 2.3470207172173137e-06, 'epochs': 142, 'loss': 'mae', 'optimizer': 'adam', 'graph_mode': 'knn', 'knn_k': 7, 'weighted_edges': True, 'symmetrize_mode': 'union', 'self_loops': False, 'use_snp_selection': True, 'num_snps': 32617}. Best is trial 35 with value: 0.3015295099119898.
[I 2025-12-10 07:56:40,458] Trial 51 finished with value: 0.29681592723921324 and parameters: {'model_type': 'graphsage', 'hidden_dims': '[512, 256]', 'dropout': 0.5668393349618933, 'batch_norm': False, 'sage_aggr': 'max', 'sage_normalize': False, 'sage_project': False, 'lr': 1.5375613987851265e-05, 'weight_decay': 4.857723286321386e-05, 'epochs': 180, 'loss': 'mse', 'optimizer': 'adam', 'graph_mode': 'cutoff', 'cutoff': 0.397480028130521, 'grm_norm': 'cosine', 'self_loops': False, 'use_snp_selection': True, 'num_snps': 28107}. Best is trial 35 with value: 0.3015295099119898.
[I 2025-12-10 07:58:10,016] Trial 52 finished with value: 0.2930033860087275 and parameters: {'model_type': 'graphsage', 'hidden_dims': '[512, 256]', 'dropout': 0.5768203589159286, 'batch_norm': False, 'sage_aggr': 'max', 'sage_normalize': False, 'sage_project': False, 'lr': 1.4572016575924891e-05, 'weight_decay': 3.121425675325752e-05, 'epochs': 161, 'loss': 'mse', 'optimizer': 'adam', 'graph_mode': 'cutoff', 'cutoff': 0.3390126962228322, 'grm_norm': 'cosine', 'self_loops': False, 'use_snp_selection': True, 'num_snps': 24527}. Best is trial 35 with value: 0.3015295099119898.
[I 2025-12-10 07:58:51,852] Trial 53 finished with value: 0.27223585267690054 and parameters: {'model_type': 'graphsage', 'hidden_dims': '[512, 256]', 'dropout': 0.5564355474953931, 'batch_norm': False, 'sage_aggr': 'max', 'sage_normalize': False, 'sage_project': False, 'lr': 2.0146941699664025e-05, 'weight_decay': 6.759567372800964e-06, 'epochs': 207, 'loss': 'mse', 'optimizer': 'adam', 'graph_mode': 'cutoff', 'cutoff': 0.5347320329793666, 'grm_norm': 'cosine', 'self_loops': False, 'use_snp_selection': True, 'num_snps': 8954}. Best is trial 35 with value: 0.3015295099119898.
[I 2025-12-10 08:00:01,402] Trial 54 finished with value: 0.2923995496637982 and parameters: {'model_type': 'graphsage', 'hidden_dims': '[512, 256]', 'dropout': 0.5115989471407394, 'batch_norm': False, 'sage_aggr': 'max', 'sage_normalize': False, 'sage_project': False, 'lr': 1.2484557821032502e-05, 'weight_decay': 0.00011794376796063095, 'epochs': 188, 'loss': 'mse', 'optimizer': 'adam', 'graph_mode': 'cutoff', 'cutoff': 0.2763256827487718, 'grm_norm': 'cosine', 'self_loops': False, 'use_snp_selection': True, 'num_snps': 14553}. Best is trial 35 with value: 0.3015295099119898.
[I 2025-12-10 08:01:16,756] Trial 55 finished with value: 0.2888776296365911 and parameters: {'model_type': 'graphsage', 'hidden_dims': '[512, 128]', 'dropout': 0.5987595409688763, 'batch_norm': False, 'sage_aggr': 'max', 'sage_normalize': False, 'sage_project': False, 'lr': 4.0702564705069365e-05, 'weight_decay': 1.1478299742932222e-05, 'epochs': 239, 'loss': 'mse', 'optimizer': 'adam', 'graph_mode': 'cutoff', 'cutoff': 0.42423350095239354, 'grm_norm': 'cosine', 'self_loops': True, 'use_snp_selection': True, 'num_snps': 17220}. Best is trial 35 with value: 0.3015295099119898.
[I 2025-12-10 08:03:03,334] Trial 56 finished with value: 0.07278924780334915 and parameters: {'model_type': 'graphsage', 'hidden_dims': '[512, 256]', 'dropout': 0.5481301973217478, 'batch_norm': False, 'sage_aggr': 'max', 'sage_normalize': False, 'sage_project': False, 'lr': 0.0007117592902164731, 'weight_decay': 1.9663183105922844e-05, 'epochs': 198, 'loss': 'mse', 'optimizer': 'adam', 'graph_mode': 'cutoff', 'cutoff': 0.387868754120568, 'grm_norm': 'cosine', 'self_loops': False, 'use_snp_selection': True, 'num_snps': 26275}. Best is trial 35 with value: 0.3015295099119898.
[I 2025-12-10 08:05:07,283] Trial 57 finished with value: 0.2683808621928795 and parameters: {'model_type': 'graphsage', 'hidden_dims': '[512, 256]', 'dropout': 0.5827426279279264, 'batch_norm': False, 'sage_aggr': 'max', 'sage_normalize': False, 'sage_project': False, 'lr': 2.5787846879432815e-05, 'weight_decay': 3.3104472630671654e-05, 'epochs': 177, 'loss': 'mse', 'optimizer': 'adam', 'graph_mode': 'knn', 'knn_k': 5, 'weighted_edges': True, 'symmetrize_mode': 'mutual', 'self_loops': False, 'use_snp_selection': False}. Best is trial 35 with value: 0.3015295099119898.
[I 2025-12-10 08:05:50,623] Trial 58 finished with value: -0.014878099916837587 and parameters: {'model_type': 'graphsage', 'hidden_dims': '[512, 256]', 'dropout': 0.4774102839353215, 'batch_norm': False, 'sage_aggr': 'max', 'sage_normalize': False, 'sage_project': False, 'lr': 0.005180399004829333, 'weight_decay': 0.0002023129944137304, 'epochs': 49, 'loss': 'mse', 'optimizer': 'adam', 'graph_mode': 'cutoff', 'cutoff': 0.3304699617430452, 'grm_norm': 'none', 'self_loops': False, 'use_snp_selection': True, 'num_snps': 20868}. Best is trial 35 with value: 0.3015295099119898.
[I 2025-12-10 08:07:58,025] Trial 59 finished with value: 0.2909316508898824 and parameters: {'model_type': 'graphsage', 'hidden_dims': '[512, 256]', 'dropout': 0.431203200280519, 'batch_norm': False, 'sage_aggr': 'mean', 'sage_normalize': False, 'sage_project': False, 'lr': 1.9339053760692237e-05, 'weight_decay': 6.168723542095542e-05, 'epochs': 211, 'loss': 'mse', 'optimizer': 'adam', 'graph_mode': 'cutoff', 'cutoff': 0.384574510803769, 'grm_norm': 'cosine', 'self_loops': False, 'use_snp_selection': True, 'num_snps': 31658}. Best is trial 35 with value: 0.3015295099119898.
[I 2025-12-10 08:08:26,112] Trial 60 finished with value: 0.26426495064834665 and parameters: {'model_type': 'graphsage', 'hidden_dims': '[256, 128]', 'dropout': 0.13842087003977827, 'batch_norm': False, 'sage_aggr': 'max', 'sage_normalize': False, 'sage_project': False, 'lr': 1.1723374359023111e-05, 'weight_decay': 5.910559175546855e-06, 'epochs': 191, 'loss': 'mse', 'optimizer': 'adam', 'graph_mode': 'cutoff', 'cutoff': 0.6582843487678294, 'grm_norm': 'cosine', 'self_loops': False, 'use_snp_selection': True, 'num_snps': 5756}. Best is trial 35 with value: 0.3015295099119898.
[I 2025-12-10 08:09:08,367] Trial 61 finished with value: 0.29255873148694755 and parameters: {'model_type': 'graphsage', 'hidden_dims': '[512, 256]', 'dropout': 0.4851121856244949, 'batch_norm': False, 'sage_aggr': 'max', 'sage_normalize': False, 'sage_project': False, 'lr': 3.3777755262376516e-05, 'weight_decay': 2.0483545380836213e-07, 'epochs': 163, 'loss': 'mse', 'optimizer': 'adam', 'graph_mode': 'cutoff', 'cutoff': 0.4460192149123108, 'grm_norm': 'cosine', 'self_loops': False, 'use_snp_selection': True, 'num_snps': 9341}. Best is trial 35 with value: 0.3015295099119898.
[I 2025-12-10 08:09:49,633] Trial 62 finished with value: 0.28639157078373456 and parameters: {'model_type': 'graphsage', 'hidden_dims': '[512, 256]', 'dropout': 0.537084411270016, 'batch_norm': False, 'sage_aggr': 'max', 'sage_normalize': False, 'sage_project': False, 'lr': 2.4330042693611527e-05, 'weight_decay': 4.175136372750852e-07, 'epochs': 172, 'loss': 'mse', 'optimizer': 'adam', 'graph_mode': 'cutoff', 'cutoff': 0.5018047415549182, 'grm_norm': 'cosine_then_gcn', 'self_loops': False, 'use_snp_selection': True, 'num_snps': 9664}. Best is trial 35 with value: 0.3015295099119898.
[I 2025-12-10 08:10:37,340] Trial 63 finished with value: 0.28746865158440194 and parameters: {'model_type': 'graphsage', 'hidden_dims': '[512, 256]', 'dropout': 0.5100199813415391, 'batch_norm': False, 'sage_aggr': 'max', 'sage_normalize': False, 'sage_project': False, 'lr': 3.2231323849021795e-05, 'weight_decay': 1.523999680310664e-06, 'epochs': 146, 'loss': 'mse', 'optimizer': 'adam', 'graph_mode': 'cutoff', 'cutoff': 0.4608133097758734, 'grm_norm': 'cosine', 'self_loops': False, 'use_snp_selection': True, 'num_snps': 13297}. Best is trial 35 with value: 0.3015295099119898.
[I 2025-12-10 08:11:27,675] Trial 64 finished with value: 0.24526410102420035 and parameters: {'model_type': 'graphsage', 'hidden_dims': '[512, 256]', 'dropout': 0.5655743194379931, 'batch_norm': False, 'sage_aggr': 'max', 'sage_normalize': False, 'sage_project': False, 'lr': 0.0003224320177284173, 'weight_decay': 9.194330559129466e-07, 'epochs': 124, 'loss': 'mse', 'optimizer': 'adam', 'graph_mode': 'cutoff', 'cutoff': 0.42596373041646735, 'grm_norm': 'gcn', 'self_loops': False, 'use_snp_selection': True, 'num_snps': 15994}. Best is trial 35 with value: 0.3015295099119898.
