[I 2025-12-06 13:47:09,550] Trial 84 finished with value: 0.23312253973408428 and parameters: {'model_type': 'graphsage', 'hidden_dims': '[512, 128]', 'dropout': 0.17712085091445323, 'batch_norm': True, 'sage_aggr': 'max', 'sage_normalize': False, 'sage_project': False, 'lr': 3.883570260273772e-05, 'weight_decay': 7.580667798288789e-06, 'epochs': 161, 'loss': 'mae', 'optimizer': 'adam', 'graph_mode': 'cutoff', 'cutoff': 0.636054891078185, 'grm_norm': 'none', 'self_loops': False, 'use_snp_selection': False, 'graphsage_batch_size': 512}. Best is trial 79 with value: 0.23704232560089328.
[I 2025-12-06 13:48:25,230] Trial 85 finished with value: 0.2431809407916649 and parameters: {'model_type': 'graphsage', 'hidden_dims': '[512, 128]', 'dropout': 0.13093009588144763, 'batch_norm': True, 'sage_aggr': 'max', 'sage_normalize': False, 'sage_project': False, 'lr': 4.6974005633955495e-05, 'weight_decay': 1.0446396501775528e-05, 'epochs': 154, 'loss': 'mae', 'optimizer': 'adam', 'graph_mode': 'cutoff', 'cutoff': 0.628789008130513, 'grm_norm': 'none', 'self_loops': False, 'use_snp_selection': True, 'num_snps': 38016, 'graphsage_batch_size': 512}. Best is trial 85 with value: 0.2431809407916649.
[I 2025-12-06 13:50:05,663] Trial 86 finished with value: 0.2207308442413743 and parameters: {'model_type': 'graphsage', 'hidden_dims': '[512, 128]', 'dropout': 0.11735801519606362, 'batch_norm': False, 'sage_aggr': 'max', 'sage_normalize': False, 'sage_project': False, 'lr': 4.507186687210889e-05, 'weight_decay': 5.480251878924901e-06, 'epochs': 156, 'loss': 'mae', 'optimizer': 'adam', 'graph_mode': 'cutoff', 'cutoff': 0.5618980318212401, 'grm_norm': 'none', 'self_loops': False, 'use_snp_selection': False, 'graphsage_batch_size': 512}. Best is trial 85 with value: 0.2431809407916649.
[I 2025-12-06 13:51:20,492] Trial 87 finished with value: 0.2396026410070161 and parameters: {'model_type': 'graphsage', 'hidden_dims': '[512, 128]', 'dropout': 0.12354207715729362, 'batch_norm': True, 'sage_aggr': 'max', 'sage_normalize': False, 'sage_project': False, 'lr': 3.606076897094717e-05, 'weight_decay': 3.0013097599817336e-05, 'epochs': 152, 'loss': 'mae', 'optimizer': 'adam', 'graph_mode': 'cutoff', 'cutoff': 0.6271444042914985, 'grm_norm': 'none', 'self_loops': False, 'use_snp_selection': True, 'num_snps': 37773, 'graphsage_batch_size': 512}. Best is trial 85 with value: 0.2431809407916649.
[I 2025-12-06 13:52:33,797] Trial 88 finished with value: 0.21664488817890457 and parameters: {'model_type': 'graphsage', 'hidden_dims': '[512, 128]', 'dropout': 0.14988465660480615, 'batch_norm': True, 'sage_aggr': 'max', 'sage_normalize': False, 'sage_project': False, 'lr': 1.1971972215897685e-05, 'weight_decay': 5.6732530846410115e-05, 'epochs': 144, 'loss': 'mae', 'optimizer': 'adam', 'graph_mode': 'cutoff', 'cutoff': 0.629609742646501, 'grm_norm': 'none', 'self_loops': False, 'use_snp_selection': True, 'num_snps': 38349, 'graphsage_batch_size': 512}. Best is trial 85 with value: 0.2431809407916649.
[I 2025-12-06 13:53:52,993] Trial 89 finished with value: 0.2005259105178961 and parameters: {'model_type': 'graphsage', 'hidden_dims': '[512, 128]', 'dropout': 0.125241317846262, 'batch_norm': True, 'sage_aggr': 'max', 'sage_normalize': False, 'sage_project': False, 'lr': 3.628255614466763e-05, 'weight_decay': 2.903758238350541e-05, 'epochs': 154, 'loss': 'mae', 'optimizer': 'adam', 'graph_mode': 'knn', 'knn_k': 2, 'weighted_edges': True, 'symmetrize_mode': 'mutual', 'self_loops': False, 'use_snp_selection': True, 'num_snps': 39289, 'graphsage_batch_size': 512}. Best is trial 85 with value: 0.2431809407916649.
[I 2025-12-06 13:55:10,414] Trial 90 finished with value: 0.21840505948295016 and parameters: {'model_type': 'graphsage', 'hidden_dims': '[512, 128]', 'dropout': 0.17108231183702458, 'batch_norm': True, 'sage_aggr': 'max', 'sage_normalize': False, 'sage_project': False, 'lr': 2.8802371292757756e-05, 'weight_decay': 8.663779483405119e-06, 'epochs': 127, 'loss': 'mae', 'optimizer': 'adam', 'graph_mode': 'cutoff', 'cutoff': 0.6603231439972277, 'grm_norm': 'none', 'self_loops': False, 'use_snp_selection': True, 'num_snps': 45693, 'graphsage_batch_size': 512}. Best is trial 85 with value: 0.2431809407916649.
[I 2025-12-06 13:56:13,987] Trial 91 finished with value: 0.23757141993949937 and parameters: {'model_type': 'graphsage', 'hidden_dims': '[512, 128]', 'dropout': 0.1407833635895016, 'batch_norm': True, 'sage_aggr': 'max', 'sage_normalize': False, 'sage_project': False, 'lr': 5.35179019012574e-05, 'weight_decay': 1.0703312207996664e-05, 'epochs': 163, 'loss': 'mae', 'optimizer': 'adam', 'graph_mode': 'cutoff', 'cutoff': 0.5910990802445968, 'grm_norm': 'none', 'self_loops': False, 'use_snp_selection': True, 'num_snps': 28431, 'graphsage_batch_size': 512}. Best is trial 85 with value: 0.2431809407916649.
[I 2025-12-06 13:57:18,144] Trial 92 finished with value: 0.22072472078798183 and parameters: {'model_type': 'graphsage', 'hidden_dims': '[512, 128]', 'dropout': 0.12039535755022643, 'batch_norm': True, 'sage_aggr': 'max', 'sage_normalize': False, 'sage_project': False, 'lr': 5.4548787039913236e-05, 'weight_decay': 2.314192973575733e-05, 'epochs': 160, 'loss': 'mae', 'optimizer': 'adam', 'graph_mode': 'cutoff', 'cutoff': 0.614147681937027, 'grm_norm': 'none', 'self_loops': False, 'use_snp_selection': True, 'num_snps': 29626, 'graphsage_batch_size': 512}. Best is trial 85 with value: 0.2431809407916649.
[I 2025-12-06 13:58:24,535] Trial 93 finished with value: 0.2428483006144467 and parameters: {'model_type': 'graphsage', 'hidden_dims': '[512, 128]', 'dropout': 0.13739688861401447, 'batch_norm': True, 'sage_aggr': 'max', 'sage_normalize': False, 'sage_project': False, 'lr': 4.81211813650754e-05, 'weight_decay': 1.1807424409650994e-05, 'epochs': 139, 'loss': 'mae', 'optimizer': 'adam', 'graph_mode': 'cutoff', 'cutoff': 0.6389575419600976, 'grm_norm': 'none', 'self_loops': False, 'use_snp_selection': True, 'num_snps': 35319, 'graphsage_batch_size': 512}. Best is trial 85 with value: 0.2431809407916649.
[I 2025-12-06 13:59:32,288] Trial 94 finished with value: 0.21580987083934172 and parameters: {'model_type': 'graphsage', 'hidden_dims': '[512, 128]', 'dropout': 0.13930506064667672, 'batch_norm': True, 'sage_aggr': 'max', 'sage_normalize': False, 'sage_project': False, 'lr': 2.1021656933744396e-05, 'weight_decay': 7.712850028736364e-06, 'epochs': 140, 'loss': 'mae', 'optimizer': 'adam', 'graph_mode': 'cutoff', 'cutoff': 0.6451745389666007, 'grm_norm': 'none', 'self_loops': False, 'use_snp_selection': True, 'num_snps': 35830, 'graphsage_batch_size': 512}. Best is trial 85 with value: 0.2431809407916649.
[I 2025-12-06 14:00:25,829] Trial 95 finished with value: 0.2167277661074951 and parameters: {'model_type': 'graphsage', 'hidden_dims': '[512, 128]', 'dropout': 0.15752446274959278, 'batch_norm': True, 'sage_aggr': 'max', 'sage_normalize': False, 'sage_project': False, 'lr': 6.659483541725966e-05, 'weight_decay': 1.7570125504384462e-05, 'epochs': 147, 'loss': 'mae', 'optimizer': 'adam', 'graph_mode': 'cutoff', 'cutoff': 0.5451565780703026, 'grm_norm': 'none', 'self_loops': False, 'use_snp_selection': True, 'num_snps': 24134, 'graphsage_batch_size': 512}. Best is trial 85 with value: 0.2431809407916649.
[I 2025-12-06 14:01:36,381] Trial 96 finished with value: 0.21669602590227144 and parameters: {'model_type': 'graphsage', 'hidden_dims': '[512, 128]', 'dropout': 0.146924883761101, 'batch_norm': True, 'sage_aggr': 'max', 'sage_normalize': False, 'sage_project': False, 'lr': 3.4444860336190504e-05, 'weight_decay': 1.046617860297454e-05, 'epochs': 171, 'loss': 'mae', 'optimizer': 'adam', 'graph_mode': 'cutoff', 'cutoff': 0.5946072683550854, 'grm_norm': 'none', 'self_loops': False, 'use_snp_selection': True, 'num_snps': 31224, 'graphsage_batch_size': 512}. Best is trial 85 with value: 0.2431809407916649.
[I 2025-12-06 14:02:47,697] Trial 97 finished with value: 0.2142494115878189 and parameters: {'model_type': 'graphsage', 'hidden_dims': '[512, 128]', 'dropout': 0.21118437021406608, 'batch_norm': True, 'sage_aggr': 'max', 'sage_normalize': False, 'sage_project': False, 'lr': 1.5009714317248113e-05, 'weight_decay': 3.2299309414956354e-05, 'epochs': 118, 'loss': 'mae', 'optimizer': 'adam', 'graph_mode': 'cutoff', 'cutoff': 0.5808037269037635, 'grm_norm': 'none', 'self_loops': False, 'use_snp_selection': True, 'num_snps': 42339, 'graphsage_batch_size': 512}. Best is trial 85 with value: 0.2431809407916649.
[I 2025-12-06 14:03:28,758] Trial 98 finished with value: 0.22909158227583393 and parameters: {'model_type': 'graphsage', 'hidden_dims': '[512, 128]', 'dropout': 0.17729453046966176, 'batch_norm': True, 'sage_aggr': 'max', 'sage_normalize': False, 'sage_project': False, 'lr': 4.872808116015338e-05, 'weight_decay': 3.906079646833382e-06, 'epochs': 56, 'loss': 'mae', 'optimizer': 'adam', 'graph_mode': 'cutoff', 'cutoff': 0.6266029557895497, 'grm_norm': 'none', 'self_loops': False, 'use_snp_selection': True, 'num_snps': 35749, 'graphsage_batch_size': 512}. Best is trial 85 with value: 0.2431809407916649.
[I 2025-12-06 14:04:30,018] Trial 99 finished with value: 0.2305584284821244 and parameters: {'model_type': 'graphsage', 'hidden_dims': '[512, 128]', 'dropout': 0.11282470674821415, 'batch_norm': True, 'sage_aggr': 'max', 'sage_normalize': False, 'sage_project': False, 'lr': 2.5924802756441535e-05, 'weight_decay': 9.223816070559519e-05, 'epochs': 163, 'loss': 'mae', 'optimizer': 'adam', 'graph_mode': 'cutoff', 'cutoff': 0.6615474768741304, 'grm_norm': 'cosine', 'self_loops': False, 'use_snp_selection': True, 'num_snps': 27652, 'graphsage_batch_size': 128}. Best is trial 85 with value: 0.2431809407916649.
[I 2025-12-06 14:06:10,018] Trial 100 finished with value: 0.1965182656943995 and parameters: {'model_type': 'graphsage', 'hidden_dims': '[512, 128]', 'dropout': 0.1326121411477512, 'batch_norm': False, 'sage_aggr': 'max', 'sage_normalize': False, 'sage_project': False, 'lr': 1.1087861903960796e-06, 'weight_decay': 4.62860410376142e-06, 'epochs': 168, 'loss': 'mae', 'optimizer': 'adam', 'graph_mode': 'cutoff', 'cutoff': 0.6111137966073413, 'grm_norm': 'gcn', 'self_loops': False, 'use_snp_selection': True, 'num_snps': 48214, 'graphsage_batch_size': 512}. Best is trial 85 with value: 0.2431809407916649.
[I 2025-12-06 14:07:02,281] Trial 101 finished with value: 0.2268495366441982 and parameters: {'model_type': 'graphsage', 'hidden_dims': '[512, 128]', 'dropout': 0.1007653527889992, 'batch_norm': True, 'sage_aggr': 'max', 'sage_normalize': False, 'sage_project': False, 'lr': 4.0366620968669015e-05, 'weight_decay': 6.773997989458539e-06, 'epochs': 152, 'loss': 'mae', 'optimizer': 'adam', 'graph_mode': 'cutoff', 'cutoff': 0.678436001397162, 'grm_norm': 'none', 'self_loops': False, 'use_snp_selection': True, 'num_snps': 24078, 'graphsage_batch_size': 512}. Best is trial 85 with value: 0.2431809407916649.
[I 2025-12-06 14:08:12,662] Trial 102 finished with value: 0.23432464410713463 and parameters: {'model_type': 'graphsage', 'hidden_dims': '[512, 128]', 'dropout': 0.16159043034547338, 'batch_norm': True, 'sage_aggr': 'max', 'sage_normalize': False, 'sage_project': False, 'lr': 6.381051169668952e-05, 'weight_decay': 1.0530421754837068e-05, 'epochs': 158, 'loss': 'mae', 'optimizer': 'adam', 'graph_mode': 'cutoff', 'cutoff': 0.6428413844970042, 'grm_norm': 'none', 'self_loops': False, 'use_snp_selection': True, 'num_snps': 33868, 'graphsage_batch_size': 512}. Best is trial 85 with value: 0.2431809407916649.
[I 2025-12-06 14:09:16,348] Trial 103 finished with value: 0.2248772987902435 and parameters: {'model_type': 'graphsage', 'hidden_dims': '[512, 128]', 'dropout': 0.18885752866049998, 'batch_norm': True, 'sage_aggr': 'max', 'sage_normalize': False, 'sage_project': False, 'lr': 5.9715805601989896e-05, 'weight_decay': 1.1112541616051236e-05, 'epochs': 131, 'loss': 'mae', 'optimizer': 'adam', 'graph_mode': 'cutoff', 'cutoff': 0.638502105749474, 'grm_norm': 'none', 'self_loops': False, 'use_snp_selection': True, 'num_snps': 34633, 'graphsage_batch_size': 512}. Best is trial 85 with value: 0.2431809407916649.
[I 2025-12-06 14:10:22,177] Trial 104 finished with value: 0.22324641083750732 and parameters: {'model_type': 'graphsage', 'hidden_dims': '[512, 128]', 'dropout': 0.20275272611508363, 'batch_norm': True, 'sage_aggr': 'max', 'sage_normalize': False, 'sage_project': False, 'lr': 4.9376437931173594e-05, 'weight_decay': 3.107987916715532e-06, 'epochs': 158, 'loss': 'mae', 'optimizer': 'adam', 'graph_mode': 'cutoff', 'cutoff': 0.5645230273193271, 'grm_norm': 'none', 'self_loops': False, 'use_snp_selection': True, 'num_snps': 30115, 'graphsage_batch_size': 32}. Best is trial 85 with value: 0.2431809407916649.
[I 2025-12-06 14:11:27,976] Trial 105 finished with value: 0.2353850748028548 and parameters: {'model_type': 'graphsage', 'hidden_dims': '[512, 128]', 'dropout': 0.16420871319016458, 'batch_norm': True, 'sage_aggr': 'max', 'sage_normalize': False, 'sage_project': False, 'lr': 6.807968588927551e-05, 'weight_decay': 2.3045872050935702e-05, 'epochs': 143, 'loss': 'mae', 'optimizer': 'adam', 'graph_mode': 'cutoff', 'cutoff': 0.5866134949832119, 'grm_norm': 'none', 'self_loops': False, 'use_snp_selection': True, 'num_snps': 32984, 'graphsage_batch_size': 512}. Best is trial 85 with value: 0.2431809407916649.
[I 2025-12-06 14:12:35,099] Trial 106 finished with value: 0.21971418932964557 and parameters: {'model_type': 'graphsage', 'hidden_dims': '[512, 128]', 'dropout': 0.15932306565569979, 'batch_norm': True, 'sage_aggr': 'max', 'sage_normalize': False, 'sage_project': False, 'lr': 9.074218778411586e-05, 'weight_decay': 2.4513945019168975e-05, 'epochs': 135, 'loss': 'mae', 'optimizer': 'adam', 'graph_mode': 'cutoff', 'cutoff': 0.5222437847385619, 'grm_norm': 'none', 'self_loops': False, 'use_snp_selection': True, 'num_snps': 33071, 'graphsage_batch_size': 512}. Best is trial 85 with value: 0.2431809407916649.
[I 2025-12-06 14:13:49,246] Trial 107 finished with value: 0.23494525504179248 and parameters: {'model_type': 'graphsage', 'hidden_dims': '[512, 128]', 'dropout': 0.14294504625289098, 'batch_norm': True, 'sage_aggr': 'max', 'sage_normalize': False, 'sage_project': False, 'lr': 6.856705429990391e-05, 'weight_decay': 1.7321690598289003e-05, 'epochs': 148, 'loss': 'mae', 'optimizer': 'adam', 'graph_mode': 'cutoff', 'cutoff': 0.587193272655162, 'grm_norm': 'gcn', 'self_loops': False, 'use_snp_selection': True, 'num_snps': 37355, 'graphsage_batch_size': 512}. Best is trial 85 with value: 0.2431809407916649.
[I 2025-12-06 14:15:39,188] Trial 108 finished with value: 0.1930253843525845 and parameters: {'model_type': 'graphsage', 'hidden_dims': '[512, 128]', 'dropout': 0.13157671978809268, 'batch_norm': True, 'sage_aggr': 'max', 'sage_normalize': False, 'sage_project': False, 'lr': 6.462570207754648e-05, 'weight_decay': 4.190270020619643e-05, 'epochs': 145, 'loss': 'mae', 'optimizer': 'adam', 'graph_mode': 'knn', 'knn_k': 5, 'weighted_edges': False, 'symmetrize_mode': 'union', 'self_loops': False, 'use_snp_selection': True, 'num_snps': 36756, 'graphsage_batch_size': 512}. Best is trial 85 with value: 0.2431809407916649.
[I 2025-12-06 14:16:55,265] Trial 109 finished with value: 0.23599271923137768 and parameters: {'model_type': 'graphsage', 'hidden_dims': '[512, 128]', 'dropout': 0.14427588321459628, 'batch_norm': True, 'sage_aggr': 'max', 'sage_normalize': False, 'sage_project': False, 'lr': 3.7260448836753346e-05, 'weight_decay': 1.8691124180211325e-05, 'epochs': 137, 'loss': 'mae', 'optimizer': 'adam', 'graph_mode': 'cutoff', 'cutoff': 0.5826861004401649, 'grm_norm': 'none', 'self_loops': False, 'use_snp_selection': True, 'num_snps': 40908, 'graphsage_batch_size': 512}. Best is trial 85 with value: 0.2431809407916649.
[I 2025-12-06 14:18:09,919] Trial 110 finished with value: 0.2374741069459402 and parameters: {'model_type': 'graphsage', 'hidden_dims': '[512, 128]', 'dropout': 0.14151203579975466, 'batch_norm': True, 'sage_aggr': 'max', 'sage_normalize': False, 'sage_project': False, 'lr': 5.629553720268115e-05, 'weight_decay': 3.5140903871357696e-05, 'epochs': 130, 'loss': 'mae', 'optimizer': 'adam', 'graph_mode': 'cutoff', 'cutoff': 0.5875463671937402, 'grm_norm': 'none', 'self_loops': False, 'use_snp_selection': True, 'num_snps': 41291, 'graphsage_batch_size': 512}. Best is trial 85 with value: 0.2431809407916649.
[I 2025-12-06 14:19:28,786] Trial 111 finished with value: 0.23613904185479542 and parameters: {'model_type': 'graphsage', 'hidden_dims': '[512, 128]', 'dropout': 0.14002758764709244, 'batch_norm': True, 'sage_aggr': 'max', 'sage_normalize': False, 'sage_project': False, 'lr': 5.5913334481445536e-05, 'weight_decay': 3.582227173018599e-05, 'epochs': 138, 'loss': 'mae', 'optimizer': 'adam', 'graph_mode': 'cutoff', 'cutoff': 0.5927245717493117, 'grm_norm': 'none', 'self_loops': False, 'use_snp_selection': True, 'num_snps': 41405, 'graphsage_batch_size': 512}. Best is trial 85 with value: 0.2431809407916649.
[I 2025-12-06 14:20:40,994] Trial 112 finished with value: 0.2327036676050218 and parameters: {'model_type': 'graphsage', 'hidden_dims': '[512, 128]', 'dropout': 0.16394252192050116, 'batch_norm': True, 'sage_aggr': 'max', 'sage_normalize': False, 'sage_project': False, 'lr': 5.4159491154058004e-05, 'weight_decay': 5.090323978024087e-05, 'epochs': 122, 'loss': 'mae', 'optimizer': 'adam', 'graph_mode': 'cutoff', 'cutoff': 0.5918516890068724, 'grm_norm': 'none', 'self_loops': False, 'use_snp_selection': True, 'num_snps': 41694, 'graphsage_batch_size': 512}. Best is trial 85 with value: 0.2431809407916649.
[I 2025-12-06 14:21:47,009] Trial 113 finished with value: 0.21283950494726284 and parameters: {'model_type': 'graphsage', 'hidden_dims': '[512, 128]', 'dropout': 0.14614809079933774, 'batch_norm': True, 'sage_aggr': 'max', 'sage_normalize': False, 'sage_project': False, 'lr': 7.266765150597246e-05, 'weight_decay': 3.7077342534091055e-05, 'epochs': 110, 'loss': 'mae', 'optimizer': 'adam', 'graph_mode': 'cutoff', 'cutoff': 0.5532356545440051, 'grm_norm': 'none', 'self_loops': False, 'use_snp_selection': True, 'num_snps': 40140, 'graphsage_batch_size': 512}. Best is trial 85 with value: 0.2431809407916649.
[I 2025-12-06 14:22:57,595] Trial 114 finished with value: 0.23503279076748843 and parameters: {'model_type': 'graphsage', 'hidden_dims': '[512, 128]', 'dropout': 0.13970041579589385, 'batch_norm': True, 'sage_aggr': 'max', 'sage_normalize': False, 'sage_project': False, 'lr': 5.910438225792565e-05, 'weight_decay': 2.194983850212178e-05, 'epochs': 138, 'loss': 'mae', 'optimizer': 'adam', 'graph_mode': 'cutoff', 'cutoff': 0.6042657943209563, 'grm_norm': 'none', 'self_loops': False, 'use_snp_selection': True, 'num_snps': 37747, 'graphsage_batch_size': 512}. Best is trial 85 with value: 0.2431809407916649.
[I 2025-12-06 14:24:18,504] Trial 115 finished with value: 0.2355477113479579 and parameters: {'model_type': 'graphsage', 'hidden_dims': '[512, 128]', 'dropout': 0.13942963190555135, 'batch_norm': True, 'sage_aggr': 'max', 'sage_normalize': False, 'sage_project': False, 'lr': 4.5821801664894306e-05, 'weight_decay': 1.876989489956562e-05, 'epochs': 131, 'loss': 'mae', 'optimizer': 'adam', 'graph_mode': 'cutoff', 'cutoff': 0.6037555138388413, 'grm_norm': 'none', 'self_loops': False, 'use_snp_selection': True, 'num_snps': 43486, 'graphsage_batch_size': 512}. Best is trial 85 with value: 0.2431809407916649.
[I 2025-12-06 14:25:27,046] Trial 116 finished with value: 0.23134523155272083 and parameters: {'model_type': 'graphsage', 'hidden_dims': '[512, 128]', 'dropout': 0.1389666925530641, 'batch_norm': True, 'sage_aggr': 'max', 'sage_normalize': False, 'sage_project': False, 'lr': 4.7579420292535434e-05, 'weight_decay': 2.1353175571096666e-05, 'epochs': 132, 'loss': 'mae', 'optimizer': 'adam', 'graph_mode': 'cutoff', 'cutoff': 0.6036867592553621, 'grm_norm': 'none', 'self_loops': False, 'use_snp_selection': True, 'num_snps': 37808, 'graphsage_batch_size': 512}. Best is trial 85 with value: 0.2431809407916649.
[I 2025-12-06 14:26:49,538] Trial 117 finished with value: 0.22288923862461302 and parameters: {'model_type': 'graphsage', 'hidden_dims': '[512, 128]', 'dropout': 0.11546288603667054, 'batch_norm': True, 'sage_aggr': 'max', 'sage_normalize': False, 'sage_project': False, 'lr': 3.23329340440524e-05, 'weight_decay': 3.235783102539041e-05, 'epochs': 140, 'loss': 'mae', 'optimizer': 'adam', 'graph_mode': 'cutoff', 'cutoff': 0.5691955843316031, 'grm_norm': 'none', 'self_loops': False, 'use_snp_selection': True, 'num_snps': 43638, 'graphsage_batch_size': 512}. Best is trial 85 with value: 0.2431809407916649.
[I 2025-12-06 14:28:01,916] Trial 118 finished with value: 0.23585479422726072 and parameters: {'model_type': 'graphsage', 'hidden_dims': '[512, 128]', 'dropout': 0.1415003189892632, 'batch_norm': True, 'sage_aggr': 'max', 'sage_normalize': False, 'sage_project': False, 'lr': 4.549198259514741e-05, 'weight_decay': 2.7218143097193e-05, 'epochs': 130, 'loss': 'mae', 'optimizer': 'adam', 'graph_mode': 'cutoff', 'cutoff': 0.589310326642527, 'grm_norm': 'gcn', 'self_loops': False, 'use_snp_selection': True, 'num_snps': 40362, 'graphsage_batch_size': 512}. Best is trial 85 with value: 0.2431809407916649.
[I 2025-12-06 14:29:19,468] Trial 119 finished with value: 0.2239680535967626 and parameters: {'model_type': 'graphsage', 'hidden_dims': '[512, 128]', 'dropout': 0.12616620078838356, 'batch_norm': True, 'sage_aggr': 'max', 'sage_normalize': False, 'sage_project': False, 'lr': 3.6134315378919665e-05, 'weight_decay': 2.7160926909405662e-05, 'epochs': 125, 'loss': 'mae', 'optimizer': 'adam', 'graph_mode': 'cutoff', 'cutoff': 0.5134706610787786, 'grm_norm': 'none', 'self_loops': False, 'use_snp_selection': True, 'num_snps': 40793, 'graphsage_batch_size': 512}. Best is trial 85 with value: 0.2431809407916649.
