[I 2025-12-09 22:40:30,981] Trial 142 finished with value: 0.12001049714421477 and parameters: {'model_type': 'graphsage', 'hidden_dims': '[256, 128]', 'dropout': 0.4274331559764128, 'batch_norm': False, 'sage_aggr': 'max', 'sage_normalize': False, 'sage_project': False, 'lr': 0.0009671154709102498, 'weight_decay': 1.726336699059532e-05, 'epochs': 104, 'loss': 'mae', 'optimizer': 'adam', 'graph_mode': 'cutoff', 'cutoff': 0.6466026850832505, 'grm_norm': 'cosine', 'self_loops': False, 'use_snp_selection': True, 'num_snps': 49010}. Best is trial 63 with value: 0.3744651287832118.
[I 2025-12-09 22:41:31,883] Trial 143 finished with value: 0.3703482703168294 and parameters: {'model_type': 'graphsage', 'hidden_dims': '[256, 128]', 'dropout': 0.388876253416005, 'batch_norm': False, 'sage_aggr': 'max', 'sage_normalize': False, 'sage_project': False, 'lr': 1.2318164791209558e-05, 'weight_decay': 2.249408827497377e-05, 'epochs': 111, 'loss': 'mae', 'optimizer': 'adam', 'graph_mode': 'cutoff', 'cutoff': 0.6088056687267839, 'grm_norm': 'cosine', 'self_loops': False, 'use_snp_selection': True, 'num_snps': 47636}. Best is trial 63 with value: 0.3744651287832118.
[I 2025-12-09 22:42:33,110] Trial 144 finished with value: 0.3641980834671808 and parameters: {'model_type': 'graphsage', 'hidden_dims': '[256, 128]', 'dropout': 0.12208676453812037, 'batch_norm': False, 'sage_aggr': 'max', 'sage_normalize': False, 'sage_project': False, 'lr': 1.2045376626835329e-05, 'weight_decay': 1.7955876533519041e-07, 'epochs': 116, 'loss': 'mae', 'optimizer': 'adam', 'graph_mode': 'cutoff', 'cutoff': 0.6229657119196202, 'grm_norm': 'cosine', 'self_loops': False, 'use_snp_selection': True, 'num_snps': 47491}. Best is trial 63 with value: 0.3744651287832118.
[I 2025-12-09 22:43:28,832] Trial 145 finished with value: 0.3688441517802869 and parameters: {'model_type': 'graphsage', 'hidden_dims': '[256, 128]', 'dropout': 0.3873590577891834, 'batch_norm': False, 'sage_aggr': 'max', 'sage_normalize': False, 'sage_project': False, 'lr': 1.483076023513277e-05, 'weight_decay': 6.330738775257695e-07, 'epochs': 99, 'loss': 'mae', 'optimizer': 'adam', 'graph_mode': 'cutoff', 'cutoff': 0.6160022313057382, 'grm_norm': 'cosine', 'self_loops': False, 'use_snp_selection': True, 'num_snps': 43514}. Best is trial 63 with value: 0.3744651287832118.
[I 2025-12-09 22:44:32,840] Trial 146 finished with value: 0.36339471683746466 and parameters: {'model_type': 'graphsage', 'hidden_dims': '[256, 128]', 'dropout': 0.4422439384268567, 'batch_norm': False, 'sage_aggr': 'max', 'sage_normalize': False, 'sage_project': False, 'lr': 1.2034856019235764e-05, 'weight_decay': 1.0481219007827639e-05, 'epochs': 108, 'loss': 'mae', 'optimizer': 'adam', 'graph_mode': 'cutoff', 'cutoff': 0.5760340379141388, 'grm_norm': 'cosine', 'self_loops': False, 'use_snp_selection': True, 'num_snps': 50122}. Best is trial 63 with value: 0.3744651287832118.
[I 2025-12-09 22:45:28,712] Trial 147 finished with value: 0.3636056510607037 and parameters: {'model_type': 'graphsage', 'hidden_dims': '[256, 128]', 'dropout': 0.4033148701114716, 'batch_norm': False, 'sage_aggr': 'max', 'sage_normalize': False, 'sage_project': False, 'lr': 1.3137213820916327e-05, 'weight_decay': 1.3046019489438182e-05, 'epochs': 82, 'loss': 'mae', 'optimizer': 'adam', 'graph_mode': 'cutoff', 'cutoff': 0.605874671366224, 'grm_norm': 'cosine', 'self_loops': False, 'use_snp_selection': True, 'num_snps': 48240}. Best is trial 63 with value: 0.3744651287832118.
[I 2025-12-09 22:46:28,907] Trial 148 finished with value: 0.3616471682361572 and parameters: {'model_type': 'graphsage', 'hidden_dims': '[256, 128]', 'dropout': 0.4313203320837038, 'batch_norm': False, 'sage_aggr': 'max', 'sage_normalize': False, 'sage_project': False, 'lr': 1.8631435836022493e-05, 'weight_decay': 2.935254736036441e-05, 'epochs': 95, 'loss': 'mse', 'optimizer': 'adam', 'graph_mode': 'cutoff', 'cutoff': 0.6704701298971835, 'grm_norm': 'cosine', 'self_loops': False, 'use_snp_selection': True, 'num_snps': 51222}. Best is trial 63 with value: 0.3744651287832118.
[I 2025-12-09 22:47:29,433] Trial 149 finished with value: 0.3633313425751501 and parameters: {'model_type': 'graphsage', 'hidden_dims': '[256, 128]', 'dropout': 0.414726194089771, 'batch_norm': False, 'sage_aggr': 'max', 'sage_normalize': False, 'sage_project': False, 'lr': 1.6130208074618946e-05, 'weight_decay': 3.8135215439341456e-05, 'epochs': 112, 'loss': 'mae', 'optimizer': 'adam', 'graph_mode': 'cutoff', 'cutoff': 0.5909196817021976, 'grm_norm': 'cosine', 'self_loops': False, 'use_snp_selection': True, 'num_snps': 46191}. Best is trial 63 with value: 0.3744651287832118.
