[I 2025-12-08 13:56:57,281] Trial 79 finished with value: 0.31276048821920865 and parameters: {'model_type': 'graphsage', 'hidden_dims': '[256, 128]', 'dropout': 0.3423255715096406, 'batch_norm': False, 'sage_aggr': 'max', 'sage_normalize': False, 'sage_project': False, 'lr': 2.5417588220435435e-05, 'weight_decay': 9.566501732355674e-06, 'epochs': 171, 'loss': 'mse', 'optimizer': 'adam', 'graph_mode': 'cutoff', 'cutoff': 0.8999412567112858, 'grm_norm': 'gcn', 'self_loops': False, 'use_snp_selection': False}. Best is trial 74 with value: 0.3140890642982352.
[I 2025-12-08 13:57:36,554] Trial 80 finished with value: 0.301157162738138 and parameters: {'model_type': 'graphsage', 'hidden_dims': '[128, 64]', 'dropout': 0.34784041603296684, 'batch_norm': False, 'sage_aggr': 'max', 'sage_normalize': False, 'sage_project': False, 'lr': 2.6694528849506866e-05, 'weight_decay': 1.0339468025945347e-05, 'epochs': 172, 'loss': 'mse', 'optimizer': 'adam', 'graph_mode': 'cutoff', 'cutoff': 0.8853014424788019, 'grm_norm': 'gcn', 'self_loops': True, 'use_snp_selection': True, 'num_snps': 20556}. Best is trial 74 with value: 0.3140890642982352.
[I 2025-12-08 13:58:20,538] Trial 81 finished with value: 0.31317982855696613 and parameters: {'model_type': 'graphsage', 'hidden_dims': '[256, 128]', 'dropout': 0.30999909013338356, 'batch_norm': False, 'sage_aggr': 'max', 'sage_normalize': False, 'sage_project': False, 'lr': 3.387725470514468e-05, 'weight_decay': 9.3372909944246e-06, 'epochs': 161, 'loss': 'mse', 'optimizer': 'adam', 'graph_mode': 'cutoff', 'cutoff': 0.8504794905307131, 'grm_norm': 'gcn', 'self_loops': False, 'use_snp_selection': False}. Best is trial 74 with value: 0.3140890642982352.
[I 2025-12-08 13:59:05,467] Trial 82 finished with value: 0.30945060226879895 and parameters: {'model_type': 'graphsage', 'hidden_dims': '[256, 128]', 'dropout': 0.27583183595100025, 'batch_norm': False, 'sage_aggr': 'max', 'sage_normalize': False, 'sage_project': False, 'lr': 3.5606420523905544e-05, 'weight_decay': 1.321099514029353e-05, 'epochs': 166, 'loss': 'mse', 'optimizer': 'adam', 'graph_mode': 'cutoff', 'cutoff': 0.8486234806668127, 'grm_norm': 'gcn', 'self_loops': False, 'use_snp_selection': False}. Best is trial 74 with value: 0.3140890642982352.
[I 2025-12-08 13:59:54,163] Trial 83 finished with value: 0.30886876290267407 and parameters: {'model_type': 'graphsage', 'hidden_dims': '[256, 128]', 'dropout': 0.2963025760633304, 'batch_norm': False, 'sage_aggr': 'max', 'sage_normalize': False, 'sage_project': False, 'lr': 4.5976184386722153e-05, 'weight_decay': 1.779080997411949e-05, 'epochs': 184, 'loss': 'mse', 'optimizer': 'adam', 'graph_mode': 'cutoff', 'cutoff': 0.8940564735210761, 'grm_norm': 'gcn', 'self_loops': False, 'use_snp_selection': False}. Best is trial 74 with value: 0.3140890642982352.
[I 2025-12-08 14:00:37,460] Trial 84 finished with value: 0.3163297088354978 and parameters: {'model_type': 'graphsage', 'hidden_dims': '[256, 128]', 'dropout': 0.3076478215269225, 'batch_norm': False, 'sage_aggr': 'max', 'sage_normalize': False, 'sage_project': False, 'lr': 2.3876638431075682e-05, 'weight_decay': 9.33232183768558e-06, 'epochs': 158, 'loss': 'mse', 'optimizer': 'adam', 'graph_mode': 'cutoff', 'cutoff': 0.8171725106286095, 'grm_norm': 'gcn', 'self_loops': False, 'use_snp_selection': False}. Best is trial 84 with value: 0.3163297088354978.
[I 2025-12-08 14:01:15,354] Trial 85 finished with value: 0.30700777883044034 and parameters: {'model_type': 'graphsage', 'hidden_dims': '[256, 128]', 'dropout': 0.33422873065818276, 'batch_norm': False, 'sage_aggr': 'max', 'sage_normalize': False, 'sage_project': False, 'lr': 2.32190993661794e-05, 'weight_decay': 9.34974613673398e-06, 'epochs': 128, 'loss': 'mse', 'optimizer': 'adam', 'graph_mode': 'cutoff', 'cutoff': 0.8214963524313713, 'grm_norm': 'gcn', 'self_loops': False, 'use_snp_selection': False}. Best is trial 84 with value: 0.3163297088354978.
[I 2025-12-08 14:01:58,473] Trial 86 finished with value: 0.29746412223829116 and parameters: {'model_type': 'graphsage', 'hidden_dims': '[256, 128]', 'dropout': 0.3062808714725822, 'batch_norm': False, 'sage_aggr': 'max', 'sage_normalize': False, 'sage_project': False, 'lr': 9.838589470185877e-05, 'weight_decay': 6.33189895367529e-06, 'epochs': 157, 'loss': 'mse', 'optimizer': 'adam', 'graph_mode': 'cutoff', 'cutoff': 0.8520962887612353, 'grm_norm': 'gcn', 'self_loops': False, 'use_snp_selection': False}. Best is trial 84 with value: 0.3163297088354978.
[I 2025-12-08 14:02:33,197] Trial 87 finished with value: 0.30981429419428946 and parameters: {'model_type': 'graphsage', 'hidden_dims': '[128, 64]', 'dropout': 0.2498113122213188, 'batch_norm': False, 'sage_aggr': 'max', 'sage_normalize': False, 'sage_project': False, 'lr': 3.706964985913158e-05, 'weight_decay': 5.19640711590319e-06, 'epochs': 158, 'loss': 'mse', 'optimizer': 'adam', 'graph_mode': 'cutoff', 'cutoff': 0.5289242986117877, 'grm_norm': 'gcn', 'self_loops': False, 'use_snp_selection': False}. Best is trial 84 with value: 0.3163297088354978.
[I 2025-12-08 14:03:13,916] Trial 88 finished with value: 0.3154382956542413 and parameters: {'model_type': 'graphsage', 'hidden_dims': '[256, 128]', 'dropout': 0.3116338232945596, 'batch_norm': False, 'sage_aggr': 'max', 'sage_normalize': False, 'sage_project': False, 'lr': 8.070583736594143e-05, 'weight_decay': 3.7789283008915476e-06, 'epochs': 145, 'loss': 'mse', 'optimizer': 'adam', 'graph_mode': 'cutoff', 'cutoff': 0.7454294702528854, 'grm_norm': 'none', 'self_loops': True, 'use_snp_selection': False}. Best is trial 84 with value: 0.3163297088354978.
[I 2025-12-08 14:03:55,330] Trial 89 finished with value: 0.31480336933908676 and parameters: {'model_type': 'graphsage', 'hidden_dims': '[256, 128]', 'dropout': 0.32427492446700834, 'batch_norm': False, 'sage_aggr': 'mean', 'sage_normalize': False, 'sage_project': False, 'lr': 0.00012151488791537597, 'weight_decay': 2.779921137180547e-06, 'epochs': 147, 'loss': 'mse', 'optimizer': 'adam', 'graph_mode': 'cutoff', 'cutoff': 0.7379430842740893, 'grm_norm': 'none', 'self_loops': False, 'use_snp_selection': False}. Best is trial 84 with value: 0.3163297088354978.
[I 2025-12-08 14:04:36,305] Trial 90 finished with value: 0.31153591392766283 and parameters: {'model_type': 'graphsage', 'hidden_dims': '[256, 128]', 'dropout': 0.3210646697832284, 'batch_norm': False, 'sage_aggr': 'mean', 'sage_normalize': False, 'sage_project': False, 'lr': 7.94421877601831e-05, 'weight_decay': 3.3541091859465707e-06, 'epochs': 145, 'loss': 'mse', 'optimizer': 'adam', 'graph_mode': 'cutoff', 'cutoff': 0.7505650858766244, 'grm_norm': 'none', 'self_loops': False, 'use_snp_selection': False}. Best is trial 84 with value: 0.3163297088354978.
[I 2025-12-08 14:05:16,117] Trial 91 finished with value: 0.3039468042884428 and parameters: {'model_type': 'graphsage', 'hidden_dims': '[256, 128]', 'dropout': 0.35520063726280765, 'batch_norm': False, 'sage_aggr': 'mean', 'sage_normalize': False, 'sage_project': False, 'lr': 0.0001332452301367846, 'weight_decay': 2.745489068569877e-06, 'epochs': 139, 'loss': 'mse', 'optimizer': 'adam', 'graph_mode': 'cutoff', 'cutoff': 0.7300857467341825, 'grm_norm': 'none', 'self_loops': False, 'use_snp_selection': False}. Best is trial 84 with value: 0.3163297088354978.
[I 2025-12-08 14:06:01,718] Trial 92 finished with value: 0.3149547590629481 and parameters: {'model_type': 'graphsage', 'hidden_dims': '[256, 128]', 'dropout': 0.34288771322747896, 'batch_norm': False, 'sage_aggr': 'mean', 'sage_normalize': False, 'sage_project': False, 'lr': 5.3825689508309085e-05, 'weight_decay': 4.7239461879046495e-06, 'epochs': 167, 'loss': 'mse', 'optimizer': 'adam', 'graph_mode': 'cutoff', 'cutoff': 0.777595213656713, 'grm_norm': 'none', 'self_loops': False, 'use_snp_selection': False}. Best is trial 84 with value: 0.3163297088354978.
[I 2025-12-08 14:06:47,259] Trial 93 finished with value: 0.3034247534466382 and parameters: {'model_type': 'graphsage', 'hidden_dims': '[256, 128]', 'dropout': 0.3419221618717473, 'batch_norm': False, 'sage_aggr': 'mean', 'sage_normalize': False, 'sage_project': False, 'lr': 5.426687529664039e-05, 'weight_decay': 4.827209330485293e-06, 'epochs': 166, 'loss': 'mse', 'optimizer': 'adam', 'graph_mode': 'cutoff', 'cutoff': 0.7799035465839099, 'grm_norm': 'none', 'self_loops': False, 'use_snp_selection': False}. Best is trial 84 with value: 0.3163297088354978.
[I 2025-12-08 14:07:29,706] Trial 94 finished with value: 0.309970977433521 and parameters: {'model_type': 'graphsage', 'hidden_dims': '[256, 128]', 'dropout': 0.28476164312823393, 'batch_norm': False, 'sage_aggr': 'mean', 'sage_normalize': False, 'sage_project': False, 'lr': 7.40971847297967e-05, 'weight_decay': 1.946159515836604e-06, 'epochs': 152, 'loss': 'mse', 'optimizer': 'adam', 'graph_mode': 'cutoff', 'cutoff': 0.7938334933935791, 'grm_norm': 'none', 'self_loops': False, 'use_snp_selection': False}. Best is trial 84 with value: 0.3163297088354978.
[I 2025-12-08 14:08:17,512] Trial 95 finished with value: 0.27195396538375516 and parameters: {'model_type': 'graphsage', 'hidden_dims': '[256, 128]', 'dropout': 0.3233772943225008, 'batch_norm': False, 'sage_aggr': 'mean', 'sage_normalize': False, 'sage_project': False, 'lr': 0.0003209431140656254, 'weight_decay': 1.5874685738102102e-06, 'epochs': 177, 'loss': 'mse', 'optimizer': 'adam', 'graph_mode': 'cutoff', 'cutoff': 0.7748410622556774, 'grm_norm': 'none', 'self_loops': False, 'use_snp_selection': False}. Best is trial 84 with value: 0.3163297088354978.
[I 2025-12-08 14:08:54,877] Trial 96 finished with value: 0.31077477418192456 and parameters: {'model_type': 'graphsage', 'hidden_dims': '[256, 128]', 'dropout': 0.3116175001585394, 'batch_norm': False, 'sage_aggr': 'mean', 'sage_normalize': False, 'sage_project': False, 'lr': 5.3391871748675455e-05, 'weight_decay': 3.7767009131287088e-06, 'epochs': 128, 'loss': 'mse', 'optimizer': 'adam', 'graph_mode': 'cutoff', 'cutoff': 0.8065835273059585, 'grm_norm': 'none', 'self_loops': True, 'use_snp_selection': False}. Best is trial 84 with value: 0.3163297088354978.
[I 2025-12-08 14:09:29,936] Trial 97 finished with value: 0.2463839222234853 and parameters: {'model_type': 'graphsage', 'hidden_dims': '[256, 128]', 'dropout': 0.365987911384265, 'batch_norm': True, 'sage_aggr': 'mean', 'sage_normalize': True, 'sage_project': False, 'lr': 0.0001007946323781074, 'weight_decay': 2.622680536081647e-06, 'epochs': 114, 'loss': 'mse', 'optimizer': 'adam', 'graph_mode': 'knn', 'knn_k': 1, 'weighted_edges': False, 'symmetrize_mode': 'mutual', 'self_loops': False, 'use_snp_selection': False}. Best is trial 84 with value: 0.3163297088354978.
[I 2025-12-08 14:10:14,564] Trial 98 finished with value: 0.3121900216153224 and parameters: {'model_type': 'graphsage', 'hidden_dims': '[256, 128]', 'dropout': 0.26155849567784467, 'batch_norm': False, 'sage_aggr': 'mean', 'sage_normalize': False, 'sage_project': False, 'lr': 4.098186350054629e-05, 'weight_decay': 6.170857261445081e-06, 'epochs': 162, 'loss': 'mse', 'optimizer': 'adam', 'graph_mode': 'cutoff', 'cutoff': 0.7212499142589751, 'grm_norm': 'none', 'self_loops': True, 'use_snp_selection': False}. Best is trial 84 with value: 0.3163297088354978.
[I 2025-12-08 14:11:04,460] Trial 99 finished with value: 0.3114989587011293 and parameters: {'model_type': 'graphsage', 'hidden_dims': '[256, 128]', 'dropout': 0.2787611158408664, 'batch_norm': False, 'sage_aggr': 'mean', 'sage_normalize': False, 'sage_project': False, 'lr': 3.3388411394129184e-05, 'weight_decay': 9.840197774850527e-06, 'epochs': 187, 'loss': 'mse', 'optimizer': 'adam', 'graph_mode': 'cutoff', 'cutoff': 0.7440119651860281, 'grm_norm': 'none', 'self_loops': False, 'use_snp_selection': False}. Best is trial 84 with value: 0.3163297088354978.
[I 2025-12-08 14:12:04,361] Trial 100 finished with value: 0.31039681804714747 and parameters: {'model_type': 'graphsage', 'hidden_dims': '[256, 128]', 'dropout': 0.22207255604268872, 'batch_norm': False, 'sage_aggr': 'mean', 'sage_normalize': False, 'sage_project': False, 'lr': 0.00011960329556094405, 'weight_decay': 8.008676168183177e-06, 'epochs': 141, 'loss': 'mse', 'optimizer': 'adam', 'graph_mode': 'cutoff', 'cutoff': 0.8696221142835877, 'grm_norm': 'none', 'self_loops': True, 'use_snp_selection': True, 'num_snps': 42475}. Best is trial 84 with value: 0.3163297088354978.
[I 2025-12-08 14:12:51,753] Trial 101 finished with value: 0.3091813019306473 and parameters: {'model_type': 'graphsage', 'hidden_dims': '[256, 128]', 'dropout': 0.26178055248575144, 'batch_norm': False, 'sage_aggr': 'mean', 'sage_normalize': False, 'sage_project': False, 'lr': 4.09570851266142e-05, 'weight_decay': 6.304296607933402e-06, 'epochs': 175, 'loss': 'mse', 'optimizer': 'adam', 'graph_mode': 'cutoff', 'cutoff': 0.7217540345114332, 'grm_norm': 'none', 'self_loops': True, 'use_snp_selection': False}. Best is trial 84 with value: 0.3163297088354978.
[I 2025-12-08 14:13:36,320] Trial 102 finished with value: 0.3083837760443851 and parameters: {'model_type': 'graphsage', 'hidden_dims': '[256, 128]', 'dropout': 0.31028772322506903, 'batch_norm': False, 'sage_aggr': 'mean', 'sage_normalize': False, 'sage_project': False, 'lr': 6.355544778963293e-05, 'weight_decay': 4.469017769314662e-06, 'epochs': 162, 'loss': 'mse', 'optimizer': 'adam', 'graph_mode': 'cutoff', 'cutoff': 0.7639841515530699, 'grm_norm': 'none', 'self_loops': True, 'use_snp_selection': False}. Best is trial 84 with value: 0.3163297088354978.
[I 2025-12-08 14:14:19,324] Trial 103 finished with value: 0.30960862870195405 and parameters: {'model_type': 'graphsage', 'hidden_dims': '[256, 128]', 'dropout': 0.2486797530724703, 'batch_norm': False, 'sage_aggr': 'mean', 'sage_normalize': False, 'sage_project': False, 'lr': 2.6060965909637716e-05, 'weight_decay': 3.441869356847042e-06, 'epochs': 154, 'loss': 'mse', 'optimizer': 'adam', 'graph_mode': 'cutoff', 'cutoff': 0.6900819282669477, 'grm_norm': 'none', 'self_loops': True, 'use_snp_selection': False}. Best is trial 84 with value: 0.3163297088354978.
[I 2025-12-08 14:15:05,278] Trial 104 finished with value: 0.2578673185871928 and parameters: {'model_type': 'graphsage', 'hidden_dims': '[256, 128]', 'dropout': 0.29111263819443023, 'batch_norm': False, 'sage_aggr': 'mean', 'sage_normalize': False, 'sage_project': False, 'lr': 0.0004114788078194416, 'weight_decay': 6.020596228203326e-06, 'epochs': 167, 'loss': 'mse', 'optimizer': 'adam', 'graph_mode': 'cutoff', 'cutoff': 0.6511503705114244, 'grm_norm': 'none', 'self_loops': True, 'use_snp_selection': False}. Best is trial 84 with value: 0.3163297088354978.
[I 2025-12-08 14:16:33,958] Trial 105 finished with value: 0.30803216438909714 and parameters: {'model_type': 'graphsage', 'hidden_dims': '[512, 128]', 'dropout': 0.3310218567565937, 'batch_norm': False, 'sage_aggr': 'mean', 'sage_normalize': False, 'sage_project': False, 'lr': 4.604916341353917e-05, 'weight_decay': 1.1614896546631158e-05, 'epochs': 200, 'loss': 'mse', 'optimizer': 'adam', 'graph_mode': 'cutoff', 'cutoff': 0.8260963644574612, 'grm_norm': 'none', 'self_loops': True, 'use_snp_selection': False}. Best is trial 84 with value: 0.3163297088354978.
[I 2025-12-08 14:17:15,195] Trial 106 finished with value: 0.30956810227096465 and parameters: {'model_type': 'graphsage', 'hidden_dims': '[256, 128, 64]', 'dropout': 0.34506860715911114, 'batch_norm': False, 'sage_aggr': 'mean', 'sage_normalize': False, 'sage_project': False, 'lr': 8.458543239629488e-05, 'weight_decay': 1.929199035333626e-05, 'epochs': 146, 'loss': 'mse', 'optimizer': 'adam', 'graph_mode': 'cutoff', 'cutoff': 0.8829515068144862, 'grm_norm': 'none', 'self_loops': True, 'use_snp_selection': False}. Best is trial 84 with value: 0.3163297088354978.
[I 2025-12-08 14:17:52,938] Trial 107 finished with value: 0.31396897317688377 and parameters: {'model_type': 'graphsage', 'hidden_dims': '[256, 128]', 'dropout': 0.27390093159985457, 'batch_norm': False, 'sage_aggr': 'max', 'sage_normalize': False, 'sage_project': False, 'lr': 2.1520464345020338e-05, 'weight_decay': 2.7757888043456962e-05, 'epochs': 131, 'loss': 'mse', 'optimizer': 'adam', 'graph_mode': 'cutoff', 'cutoff': 0.7889752075942491, 'grm_norm': 'none', 'self_loops': False, 'use_snp_selection': False}. Best is trial 84 with value: 0.3163297088354978.
[I 2025-12-08 14:18:56,461] Trial 108 finished with value: 0.313351116135788 and parameters: {'model_type': 'graphsage', 'hidden_dims': '[512, 256]', 'dropout': 0.2978325871910192, 'batch_norm': False, 'sage_aggr': 'max', 'sage_normalize': False, 'sage_project': False, 'lr': 3.0858055678612926e-05, 'weight_decay': 4.0530370287581094e-05, 'epochs': 132, 'loss': 'mse', 'optimizer': 'adam', 'graph_mode': 'cutoff', 'cutoff': 0.8509548242400794, 'grm_norm': 'cosine_then_gcn', 'self_loops': False, 'use_snp_selection': False}. Best is trial 84 with value: 0.3163297088354978.
[I 2025-12-08 14:20:00,735] Trial 109 finished with value: 0.313772788715736 and parameters: {'model_type': 'graphsage', 'hidden_dims': '[512, 256]', 'dropout': 0.30127754048604455, 'batch_norm': False, 'sage_aggr': 'max', 'sage_normalize': False, 'sage_project': False, 'lr': 2.09947497181136e-05, 'weight_decay': 2.8781278900467314e-05, 'epochs': 134, 'loss': 'mse', 'optimizer': 'adam', 'graph_mode': 'cutoff', 'cutoff': 0.8432615645897836, 'grm_norm': 'cosine_then_gcn', 'self_loops': False, 'use_snp_selection': False}. Best is trial 84 with value: 0.3163297088354978.
[I 2025-12-08 14:21:02,488] Trial 110 finished with value: 0.3069571913683016 and parameters: {'model_type': 'graphsage', 'hidden_dims': '[512, 64]', 'dropout': 0.3062061159136986, 'batch_norm': False, 'sage_aggr': 'max', 'sage_normalize': False, 'sage_project': False, 'lr': 3.123708640842883e-05, 'weight_decay': 3.77352566019433e-05, 'epochs': 128, 'loss': 'mse', 'optimizer': 'adam', 'graph_mode': 'cutoff', 'cutoff': 0.8500859573763752, 'grm_norm': 'cosine_then_gcn', 'self_loops': False, 'use_snp_selection': False}. Best is trial 84 with value: 0.3163297088354978.
[I 2025-12-08 14:22:07,189] Trial 111 finished with value: 0.31049851521044414 and parameters: {'model_type': 'graphsage', 'hidden_dims': '[512, 256]', 'dropout': 0.2981668439461453, 'batch_norm': False, 'sage_aggr': 'max', 'sage_normalize': False, 'sage_project': False, 'lr': 2.0602461885989017e-05, 'weight_decay': 4.168384312685194e-05, 'epochs': 135, 'loss': 'mse', 'optimizer': 'adam', 'graph_mode': 'cutoff', 'cutoff': 0.7877638490159158, 'grm_norm': 'cosine_then_gcn', 'self_loops': False, 'use_snp_selection': False}. Best is trial 84 with value: 0.3163297088354978.
[I 2025-12-08 14:23:06,160] Trial 112 finished with value: 0.31626426551575504 and parameters: {'model_type': 'graphsage', 'hidden_dims': '[512, 256]', 'dropout': 0.32629867470088536, 'batch_norm': False, 'sage_aggr': 'max', 'sage_normalize': False, 'sage_project': False, 'lr': 2.4935548944225807e-05, 'weight_decay': 5.7818830519370034e-05, 'epochs': 120, 'loss': 'mse', 'optimizer': 'adam', 'graph_mode': 'cutoff', 'cutoff': 0.8585815601536233, 'grm_norm': 'cosine_then_gcn', 'self_loops': False, 'use_snp_selection': False}. Best is trial 84 with value: 0.3163297088354978.
[I 2025-12-08 14:23:59,082] Trial 113 finished with value: 0.3149368476855937 and parameters: {'model_type': 'graphsage', 'hidden_dims': '[512, 256]', 'dropout': 0.322802920744891, 'batch_norm': False, 'sage_aggr': 'max', 'sage_normalize': False, 'sage_project': False, 'lr': 1.7512934599715907e-05, 'weight_decay': 2.8862185598793684e-05, 'epochs': 104, 'loss': 'mse', 'optimizer': 'adam', 'graph_mode': 'cutoff', 'cutoff': 0.8984861189324832, 'grm_norm': 'cosine_then_gcn', 'self_loops': False, 'use_snp_selection': False}. Best is trial 84 with value: 0.3163297088354978.
[I 2025-12-08 14:24:45,879] Trial 114 finished with value: 0.31031312041242937 and parameters: {'model_type': 'graphsage', 'hidden_dims': '[512, 256]', 'dropout': 0.32188865093282076, 'batch_norm': False, 'sage_aggr': 'max', 'sage_normalize': False, 'sage_project': False, 'lr': 1.719973284353503e-05, 'weight_decay': 6.404429393852403e-05, 'epochs': 88, 'loss': 'mse', 'optimizer': 'adam', 'graph_mode': 'cutoff', 'cutoff': 0.8559704803766676, 'grm_norm': 'cosine_then_gcn', 'self_loops': False, 'use_snp_selection': False}. Best is trial 84 with value: 0.3163297088354978.
[I 2025-12-08 14:25:37,955] Trial 115 finished with value: 0.30732467734512453 and parameters: {'model_type': 'graphsage', 'hidden_dims': '[512, 256]', 'dropout': 0.2791940227635104, 'batch_norm': False, 'sage_aggr': 'max', 'sage_normalize': False, 'sage_project': False, 'lr': 2.0266240903719315e-05, 'weight_decay': 2.9082918452431446e-05, 'epochs': 102, 'loss': 'mse', 'optimizer': 'adam', 'graph_mode': 'cutoff', 'cutoff': 0.8274369248079514, 'grm_norm': 'cosine_then_gcn', 'self_loops': False, 'use_snp_selection': False}. Best is trial 84 with value: 0.3163297088354978.
[I 2025-12-08 14:26:32,276] Trial 116 finished with value: 0.31503226563534825 and parameters: {'model_type': 'graphsage', 'hidden_dims': '[512, 256]', 'dropout': 0.2878727902314853, 'batch_norm': False, 'sage_aggr': 'max', 'sage_normalize': False, 'sage_project': False, 'lr': 2.2521252763455267e-05, 'weight_decay': 2.786603677877471e-05, 'epochs': 108, 'loss': 'mse', 'optimizer': 'adam', 'graph_mode': 'cutoff', 'cutoff': 0.8037264062545979, 'grm_norm': 'cosine_then_gcn', 'self_loops': False, 'use_snp_selection': False}. Best is trial 84 with value: 0.3163297088354978.
