[I 2025-12-05 15:27:36,437] Trial 35 finished with value: 0.21266112806939846 and parameters: {'model_type': 'graphsage', 'hidden_dims': '[128, 64]', 'dropout': 0.47682402835522875, 'batch_norm': False, 'sage_aggr': 'mean', 'sage_normalize': True, 'sage_project': False, 'lr': 0.0005033805311274025, 'weight_decay': 1.9597048463407206e-05, 'epochs': 163, 'loss': 'mae', 'optimizer': 'adam', 'graph_mode': 'cutoff', 'cutoff': 0.4881803264589025, 'grm_norm': 'cosine_then_gcn', 'self_loops': False, 'use_snp_selection': True, 'num_snps': 33224, 'graphsage_batch_size': 512}. Best is trial 19 with value: 0.2677380881307657.
[I 2025-12-05 15:28:26,846] Trial 36 finished with value: 0.21787352243430366 and parameters: {'model_type': 'graphsage', 'hidden_dims': '[512, 128]', 'dropout': 0.5760655014507483, 'batch_norm': True, 'sage_aggr': 'max', 'sage_normalize': True, 'sage_project': False, 'lr': 0.0006912414006858555, 'weight_decay': 3.0601414728086456e-07, 'epochs': 144, 'loss': 'mse', 'optimizer': 'adam', 'graph_mode': 'knn', 'knn_k': 1, 'weighted_edges': False, 'symmetrize_mode': 'union', 'self_loops': False, 'use_snp_selection': True, 'num_snps': 22403, 'graphsage_batch_size': 32}. Best is trial 19 with value: 0.2677380881307657.
[I 2025-12-05 15:29:20,585] Trial 37 finished with value: 0.24290898786981954 and parameters: {'model_type': 'graphsage', 'hidden_dims': '[256, 128]', 'dropout': 0.3580779898900733, 'batch_norm': True, 'sage_aggr': 'mean', 'sage_normalize': True, 'sage_project': False, 'lr': 2.6771940840627176e-05, 'weight_decay': 7.281923671298038e-07, 'epochs': 215, 'loss': 'mae', 'optimizer': 'adam', 'graph_mode': 'cutoff', 'cutoff': 0.6456198709849481, 'grm_norm': 'gcn', 'self_loops': False, 'use_snp_selection': True, 'num_snps': 29668, 'graphsage_batch_size': 64}. Best is trial 19 with value: 0.2677380881307657.
[I 2025-12-05 15:30:27,233] Trial 38 finished with value: 0.226308798678589 and parameters: {'model_type': 'graphsage', 'hidden_dims': '[512, 256]', 'dropout': 0.3997249160965265, 'batch_norm': False, 'sage_aggr': 'max', 'sage_normalize': True, 'sage_project': False, 'lr': 0.00035281549764368204, 'weight_decay': 0.00011970461699280313, 'epochs': 232, 'loss': 'mae', 'optimizer': 'adam', 'graph_mode': 'knn', 'knn_k': 10, 'weighted_edges': False, 'symmetrize_mode': 'union', 'self_loops': False, 'use_snp_selection': True, 'num_snps': 9796, 'graphsage_batch_size': 256}. Best is trial 19 with value: 0.2677380881307657.
[I 2025-12-05 15:33:20,209] Trial 39 finished with value: 0.24853676770107663 and parameters: {'model_type': 'graphsage', 'hidden_dims': '[512, 64]', 'dropout': 0.21523482601455812, 'batch_norm': True, 'sage_aggr': 'mean', 'sage_normalize': True, 'sage_project': False, 'lr': 0.0002070826211414413, 'weight_decay': 1.3827601547590333e-07, 'epochs': 200, 'loss': 'mse', 'optimizer': 'adam', 'graph_mode': 'cutoff', 'cutoff': 0.29443641287481565, 'grm_norm': 'gcn', 'self_loops': False, 'use_snp_selection': False, 'graphsage_batch_size': 8}. Best is trial 19 with value: 0.2677380881307657.
[I 2025-12-05 15:34:07,874] Trial 40 finished with value: 0.23243957066427362 and parameters: {'model_type': 'graphsage', 'hidden_dims': '[256, 128]', 'dropout': 0.5370474170867279, 'batch_norm': True, 'sage_aggr': 'mean', 'sage_normalize': True, 'sage_project': False, 'lr': 0.0006858466794640658, 'weight_decay': 0.0006272753050763997, 'epochs': 181, 'loss': 'mae', 'optimizer': 'adam', 'graph_mode': 'knn', 'knn_k': 1, 'weighted_edges': True, 'symmetrize_mode': 'mutual', 'self_loops': False, 'use_snp_selection': True, 'num_snps': 30649, 'graphsage_batch_size': 64}. Best is trial 19 with value: 0.2677380881307657.
[I 2025-12-05 15:35:06,674] Trial 41 finished with value: 0.26602916907385693 and parameters: {'model_type': 'graphsage', 'hidden_dims': '[512, 256]', 'dropout': 0.5558547015065747, 'batch_norm': True, 'sage_aggr': 'mean', 'sage_normalize': True, 'sage_project': False, 'lr': 0.0008614925332943006, 'weight_decay': 3.80642008503402e-07, 'epochs': 189, 'loss': 'mae', 'optimizer': 'adam', 'graph_mode': 'cutoff', 'cutoff': 0.41095086156048477, 'grm_norm': 'gcn', 'self_loops': False, 'use_snp_selection': True, 'num_snps': 18738, 'graphsage_batch_size': 64}. Best is trial 19 with value: 0.2677380881307657.
[I 2025-12-05 15:36:00,190] Trial 42 finished with value: 0.26076634377975827 and parameters: {'model_type': 'graphsage', 'hidden_dims': '[512, 256]', 'dropout': 0.5609266343409818, 'batch_norm': True, 'sage_aggr': 'mean', 'sage_normalize': True, 'sage_project': False, 'lr': 0.0009667620990111035, 'weight_decay': 4.485947208502638e-07, 'epochs': 170, 'loss': 'mae', 'optimizer': 'adam', 'graph_mode': 'cutoff', 'cutoff': 0.374410986810376, 'grm_norm': 'gcn', 'self_loops': False, 'use_snp_selection': True, 'num_snps': 17526, 'graphsage_batch_size': 64}. Best is trial 19 with value: 0.2677380881307657.
[I 2025-12-05 15:37:10,236] Trial 43 finished with value: 0.2714390357744548 and parameters: {'model_type': 'graphsage', 'hidden_dims': '[512, 256]', 'dropout': 0.5992278274662661, 'batch_norm': True, 'sage_aggr': 'mean', 'sage_normalize': True, 'sage_project': False, 'lr': 0.0004509361379823733, 'weight_decay': 1.4351364787396923e-06, 'epochs': 210, 'loss': 'mae', 'optimizer': 'adam', 'graph_mode': 'cutoff', 'cutoff': 0.457513127878605, 'grm_norm': 'gcn', 'self_loops': False, 'use_snp_selection': True, 'num_snps': 21689, 'graphsage_batch_size': 64}. Best is trial 43 with value: 0.2714390357744548.
[I 2025-12-05 15:37:58,268] Trial 44 finished with value: 0.2585995385625402 and parameters: {'model_type': 'graphsage', 'hidden_dims': '[512, 128]', 'dropout': 0.5872628784212177, 'batch_norm': True, 'sage_aggr': 'mean', 'sage_normalize': True, 'sage_project': False, 'lr': 0.0004441657294633456, 'weight_decay': 1.3772105930682504e-06, 'epochs': 209, 'loss': 'mae', 'optimizer': 'adam', 'graph_mode': 'cutoff', 'cutoff': 0.4765358186143636, 'grm_norm': 'gcn', 'self_loops': False, 'use_snp_selection': True, 'num_snps': 13384, 'graphsage_batch_size': 128}. Best is trial 43 with value: 0.2714390357744548.
[I 2025-12-05 15:39:07,494] Trial 45 finished with value: 0.22547187518621475 and parameters: {'model_type': 'graphsage', 'hidden_dims': '[512, 256]', 'dropout': 0.5998291863117089, 'batch_norm': False, 'sage_aggr': 'mean', 'sage_normalize': True, 'sage_project': False, 'lr': 0.00035782779341245766, 'weight_decay': 2.6859589051803495e-07, 'epochs': 222, 'loss': 'mae', 'optimizer': 'adam', 'graph_mode': 'cutoff', 'cutoff': 0.5263219831646595, 'grm_norm': 'gcn', 'self_loops': False, 'use_snp_selection': True, 'num_snps': 23230, 'graphsage_batch_size': 64}. Best is trial 43 with value: 0.2714390357744548.
[I 2025-12-05 15:40:25,148] Trial 46 finished with value: 0.25094686336930394 and parameters: {'model_type': 'graphsage', 'hidden_dims': '[512, 256]', 'dropout': 0.49336329555319225, 'batch_norm': True, 'sage_aggr': 'max', 'sage_normalize': False, 'sage_project': False, 'lr': 0.0002119360355731295, 'weight_decay': 5.194889816221484e-07, 'epochs': 234, 'loss': 'mae', 'optimizer': 'adam', 'graph_mode': 'cutoff', 'cutoff': 0.3211667212788756, 'grm_norm': 'gcn', 'self_loops': False, 'use_snp_selection': True, 'num_snps': 17513, 'graphsage_batch_size': 512}. Best is trial 43 with value: 0.2714390357744548.
[I 2025-12-05 15:42:50,017] Trial 47 finished with value: 0.2099073206218507 and parameters: {'model_type': 'graphsage', 'hidden_dims': '[512, 256]', 'dropout': 0.518591242544107, 'batch_norm': True, 'sage_aggr': 'mean', 'sage_normalize': True, 'sage_project': False, 'lr': 0.0005231153328728704, 'weight_decay': 1.0152403645580648e-07, 'epochs': 198, 'loss': 'mse', 'optimizer': 'adam', 'graph_mode': 'knn', 'knn_k': 3, 'weighted_edges': False, 'symmetrize_mode': 'union', 'self_loops': False, 'use_snp_selection': False, 'graphsage_batch_size': 64}. Best is trial 43 with value: 0.2714390357744548.
[I 2025-12-05 15:44:41,437] Trial 48 finished with value: 0.24456739954437334 and parameters: {'model_type': 'graphsage', 'hidden_dims': '[512, 64]', 'dropout': 0.5686799837021038, 'batch_norm': True, 'sage_aggr': 'mean', 'sage_normalize': True, 'sage_project': False, 'lr': 9.147210607093876e-05, 'weight_decay': 2.3903069649269946e-06, 'epochs': 182, 'loss': 'mae', 'optimizer': 'adam', 'graph_mode': 'cutoff', 'cutoff': 0.2500741902325868, 'grm_norm': 'gcn', 'self_loops': False, 'use_snp_selection': True, 'num_snps': 25768, 'graphsage_batch_size': 32}. Best is trial 43 with value: 0.2714390357744548.
[I 2025-12-05 15:45:17,373] Trial 49 finished with value: 0.15237954446652302 and parameters: {'model_type': 'graphsage', 'hidden_dims': '[256, 128, 64]', 'dropout': 0.31512618536644343, 'batch_norm': False, 'sage_aggr': 'mean', 'sage_normalize': False, 'sage_project': False, 'lr': 1.0685839803828317e-06, 'weight_decay': 1.6388692584105645e-07, 'epochs': 73, 'loss': 'mae', 'optimizer': 'adam', 'graph_mode': 'cutoff', 'cutoff': 0.4579478773387341, 'grm_norm': 'gcn', 'self_loops': False, 'use_snp_selection': True, 'num_snps': 27833, 'graphsage_batch_size': 16}. Best is trial 43 with value: 0.2714390357744548.
[I 2025-12-05 15:46:46,700] Trial 50 finished with value: 0.23379511296870964 and parameters: {'model_type': 'graphsage', 'hidden_dims': '[256, 128]', 'dropout': 0.5551271753660885, 'batch_norm': True, 'sage_aggr': 'mean', 'sage_normalize': True, 'sage_project': False, 'lr': 0.0002031392387464291, 'weight_decay': 9.519833947719136e-07, 'epochs': 241, 'loss': 'mae', 'optimizer': 'adam', 'graph_mode': 'cutoff', 'cutoff': 0.5498216244794041, 'grm_norm': 'gcn', 'self_loops': False, 'use_snp_selection': False, 'graphsage_batch_size': 128}. Best is trial 43 with value: 0.2714390357744548.
[I 2025-12-05 15:47:59,151] Trial 51 finished with value: 0.26523914787708847 and parameters: {'model_type': 'graphsage', 'hidden_dims': '[512, 256]', 'dropout': 0.45219536413070033, 'batch_norm': True, 'sage_aggr': 'mean', 'sage_normalize': True, 'sage_project': False, 'lr': 0.0007392982125180667, 'weight_decay': 3.6686501199361846e-06, 'epochs': 213, 'loss': 'mae', 'optimizer': 'adam', 'graph_mode': 'cutoff', 'cutoff': 0.3960607748241683, 'grm_norm': 'cosine_then_gcn', 'self_loops': False, 'use_snp_selection': True, 'num_snps': 21768, 'graphsage_batch_size': 64}. Best is trial 43 with value: 0.2714390357744548.
[I 2025-12-05 15:48:49,628] Trial 52 finished with value: 0.25852279729996674 and parameters: {'model_type': 'graphsage', 'hidden_dims': '[512, 256]', 'dropout': 0.5205264817700654, 'batch_norm': True, 'sage_aggr': 'mean', 'sage_normalize': True, 'sage_project': False, 'lr': 0.0005369512000094088, 'weight_decay': 8.900925485027813e-06, 'epochs': 163, 'loss': 'mae', 'optimizer': 'adam', 'graph_mode': 'cutoff', 'cutoff': 0.44732843610494355, 'grm_norm': 'cosine_then_gcn', 'self_loops': False, 'use_snp_selection': True, 'num_snps': 16523, 'graphsage_batch_size': 64}. Best is trial 43 with value: 0.2714390357744548.
[I 2025-12-05 15:50:02,078] Trial 53 finished with value: 0.2639652451150617 and parameters: {'model_type': 'graphsage', 'hidden_dims': '[512, 256]', 'dropout': 0.5451237244516937, 'batch_norm': True, 'sage_aggr': 'mean', 'sage_normalize': True, 'sage_project': False, 'lr': 0.0007095741919939252, 'weight_decay': 1.736831294246289e-06, 'epochs': 191, 'loss': 'mae', 'optimizer': 'adam', 'graph_mode': 'cutoff', 'cutoff': 0.42095434522863473, 'grm_norm': 'none', 'self_loops': False, 'use_snp_selection': True, 'num_snps': 21047, 'graphsage_batch_size': 64}. Best is trial 43 with value: 0.2714390357744548.
[I 2025-12-05 15:50:42,316] Trial 54 finished with value: 0.24791488559749855 and parameters: {'model_type': 'graphsage', 'hidden_dims': '[512, 256]', 'dropout': 0.5798233464148718, 'batch_norm': True, 'sage_aggr': 'mean', 'sage_normalize': True, 'sage_project': False, 'lr': 0.00034125131465538583, 'weight_decay': 5.893696156592038e-06, 'epochs': 173, 'loss': 'mae', 'optimizer': 'adam', 'graph_mode': 'cutoff', 'cutoff': 0.3432189605411472, 'grm_norm': 'cosine', 'self_loops': False, 'use_snp_selection': True, 'num_snps': 10772, 'graphsage_batch_size': 64}. Best is trial 43 with value: 0.2714390357744548.
[I 2025-12-05 15:51:15,362] Trial 55 finished with value: 0.25450480189127783 and parameters: {'model_type': 'graphsage', 'hidden_dims': '[128, 64]', 'dropout': 0.49162213840464725, 'batch_norm': True, 'sage_aggr': 'mean', 'sage_normalize': True, 'sage_project': False, 'lr': 0.000983412655240691, 'weight_decay': 2.3368999890523715e-07, 'epochs': 142, 'loss': 'mae', 'optimizer': 'adam', 'graph_mode': 'cutoff', 'cutoff': 0.38432040333718154, 'grm_norm': 'cosine_then_gcn', 'self_loops': False, 'use_snp_selection': True, 'num_snps': 18459, 'graphsage_batch_size': 64}. Best is trial 43 with value: 0.2714390357744548.
[I 2025-12-05 15:52:14,245] Trial 56 finished with value: 0.24767588986301795 and parameters: {'model_type': 'graphsage', 'hidden_dims': '[512, 256]', 'dropout': 0.5188998707882688, 'batch_norm': True, 'sage_aggr': 'mean', 'sage_normalize': False, 'sage_project': False, 'lr': 0.00046239260134319697, 'weight_decay': 1.3753814728314544e-05, 'epochs': 185, 'loss': 'mse', 'optimizer': 'adam', 'graph_mode': 'cutoff', 'cutoff': 0.7852236761015634, 'grm_norm': 'none', 'self_loops': False, 'use_snp_selection': True, 'num_snps': 23703, 'graphsage_batch_size': 8}. Best is trial 43 with value: 0.2714390357744548.
[I 2025-12-05 15:53:06,026] Trial 57 finished with value: 0.2626529042247524 and parameters: {'model_type': 'graphsage', 'hidden_dims': '[512, 256]', 'dropout': 0.5998076296339904, 'batch_norm': True, 'sage_aggr': 'mean', 'sage_normalize': True, 'sage_project': False, 'lr': 0.0007588637207129157, 'weight_decay': 4.164192476004505e-07, 'epochs': 201, 'loss': 'mae', 'optimizer': 'adam', 'graph_mode': 'cutoff', 'cutoff': 0.4475875363070711, 'grm_norm': 'gcn', 'self_loops': False, 'use_snp_selection': True, 'num_snps': 15081, 'graphsage_batch_size': 64}. Best is trial 43 with value: 0.2714390357744548.
[I 2025-12-05 15:55:56,839] Trial 58 finished with value: 0.20234560202789448 and parameters: {'model_type': 'graphsage', 'hidden_dims': '[512, 128]', 'dropout': 0.5550167248124512, 'batch_norm': True, 'sage_aggr': 'max', 'sage_normalize': True, 'sage_project': False, 'lr': 0.00013853089407451754, 'weight_decay': 7.497512702845437e-07, 'epochs': 194, 'loss': 'mae', 'optimizer': 'adam', 'graph_mode': 'knn', 'knn_k': 10, 'weighted_edges': True, 'symmetrize_mode': 'mutual', 'self_loops': False, 'use_snp_selection': False, 'graphsage_batch_size': 64}. Best is trial 43 with value: 0.2714390357744548.
[I 2025-12-05 15:56:26,166] Trial 59 finished with value: 0.1856995182886692 and parameters: {'model_type': 'graphsage', 'hidden_dims': '[512, 256]', 'dropout': 0.5297516927345668, 'batch_norm': True, 'sage_aggr': 'mean', 'sage_normalize': True, 'sage_project': False, 'lr': 1.3988440816833356e-05, 'weight_decay': 3.4932384068598003e-06, 'epochs': 216, 'loss': 'mae', 'optimizer': 'adam', 'graph_mode': 'cutoff', 'cutoff': 0.4980909949529178, 'grm_norm': 'gcn', 'self_loops': False, 'use_snp_selection': True, 'num_snps': 5416, 'graphsage_batch_size': 16}. Best is trial 43 with value: 0.2714390357744548.
[I 2025-12-05 15:57:34,920] Trial 60 finished with value: 0.1931657942072607 and parameters: {'model_type': 'graphsage', 'hidden_dims': '[256, 128, 64]', 'dropout': 0.45937286149802126, 'batch_norm': True, 'sage_aggr': 'mean', 'sage_normalize': True, 'sage_project': False, 'lr': 3.613199799106047e-06, 'weight_decay': 1.4480392715730985e-06, 'epochs': 160, 'loss': 'mae', 'optimizer': 'adam', 'graph_mode': 'cutoff', 'cutoff': 0.4089899080703685, 'grm_norm': 'gcn', 'self_loops': False, 'use_snp_selection': True, 'num_snps': 34289, 'graphsage_batch_size': 256}. Best is trial 43 with value: 0.2714390357744548.
[I 2025-12-05 15:58:47,091] Trial 61 finished with value: 0.26553344680784335 and parameters: {'model_type': 'graphsage', 'hidden_dims': '[512, 256]', 'dropout': 0.5710039291896423, 'batch_norm': True, 'sage_aggr': 'mean', 'sage_normalize': True, 'sage_project': False, 'lr': 0.0007518024937901584, 'weight_decay': 4.2224188443039304e-06, 'epochs': 213, 'loss': 'mae', 'optimizer': 'adam', 'graph_mode': 'cutoff', 'cutoff': 0.3908365733063012, 'grm_norm': 'cosine_then_gcn', 'self_loops': False, 'use_snp_selection': True, 'num_snps': 21606, 'graphsage_batch_size': 64}. Best is trial 43 with value: 0.2714390357744548.
[I 2025-12-05 16:00:01,037] Trial 62 finished with value: 0.2615927702173955 and parameters: {'model_type': 'graphsage', 'hidden_dims': '[512, 256]', 'dropout': 0.5724838482323005, 'batch_norm': True, 'sage_aggr': 'mean', 'sage_normalize': True, 'sage_project': False, 'lr': 0.0005695710168858055, 'weight_decay': 7.266320740035365e-06, 'epochs': 206, 'loss': 'mae', 'optimizer': 'adam', 'graph_mode': 'cutoff', 'cutoff': 0.46655900570911624, 'grm_norm': 'cosine_then_gcn', 'self_loops': False, 'use_snp_selection': True, 'num_snps': 23572, 'graphsage_batch_size': 64}. Best is trial 43 with value: 0.2714390357744548.
[I 2025-12-05 16:01:13,140] Trial 63 finished with value: 0.26217824947638146 and parameters: {'model_type': 'graphsage', 'hidden_dims': '[512, 256]', 'dropout': 0.5066164055871087, 'batch_norm': True, 'sage_aggr': 'mean', 'sage_normalize': True, 'sage_project': False, 'lr': 0.0007935934689479145, 'weight_decay': 4.660130587329763e-06, 'epochs': 225, 'loss': 'mae', 'optimizer': 'adam', 'graph_mode': 'cutoff', 'cutoff': 0.4316778644318924, 'grm_norm': 'cosine_then_gcn', 'self_loops': False, 'use_snp_selection': True, 'num_snps': 21084, 'graphsage_batch_size': 64}. Best is trial 43 with value: 0.2714390357744548.
[I 2025-12-05 16:02:37,811] Trial 64 finished with value: 0.2616698713314848 and parameters: {'model_type': 'graphsage', 'hidden_dims': '[512, 256]', 'dropout': 0.5526314092362897, 'batch_norm': True, 'sage_aggr': 'mean', 'sage_normalize': True, 'sage_project': False, 'lr': 0.0004114884856798745, 'weight_decay': 3.673947679551663e-07, 'epochs': 188, 'loss': 'mae', 'optimizer': 'adam', 'graph_mode': 'cutoff', 'cutoff': 0.36125738607729896, 'grm_norm': 'cosine_then_gcn', 'self_loops': False, 'use_snp_selection': True, 'num_snps': 27463, 'graphsage_batch_size': 64}. Best is trial 43 with value: 0.2714390357744548.
[I 2025-12-05 16:03:53,810] Trial 65 finished with value: 0.23948631450233973 and parameters: {'model_type': 'graphsage', 'hidden_dims': '[512, 256]', 'dropout': 0.5823420911163103, 'batch_norm': True, 'sage_aggr': 'mean', 'sage_normalize': True, 'sage_project': False, 'lr': 0.0005773560980284453, 'weight_decay': 1.377451860606989e-07, 'epochs': 177, 'loss': 'mae', 'optimizer': 'adam', 'graph_mode': 'cutoff', 'cutoff': 0.5203222848302825, 'grm_norm': 'cosine_then_gcn', 'self_loops': False, 'use_snp_selection': True, 'num_snps': 31885, 'graphsage_batch_size': 64}. Best is trial 43 with value: 0.2714390357744548.
[I 2025-12-05 16:05:20,186] Trial 66 finished with value: 0.2649910006767382 and parameters: {'model_type': 'graphsage', 'hidden_dims': '[512, 256]', 'dropout': 0.48754128753358644, 'batch_norm': True, 'sage_aggr': 'mean', 'sage_normalize': True, 'sage_project': False, 'lr': 0.00026744734220873143, 'weight_decay': 1.7398859972638496e-05, 'epochs': 209, 'loss': 'mae', 'optimizer': 'adam', 'graph_mode': 'cutoff', 'cutoff': 0.3246957672479567, 'grm_norm': 'gcn', 'self_loops': False, 'use_snp_selection': True, 'num_snps': 23866, 'graphsage_batch_size': 64}. Best is trial 43 with value: 0.2714390357744548.
[I 2025-12-05 16:06:14,719] Trial 67 finished with value: 0.22202875745453632 and parameters: {'model_type': 'graphsage', 'hidden_dims': '[512, 256]', 'dropout': 0.5361604686850485, 'batch_norm': False, 'sage_aggr': 'mean', 'sage_normalize': False, 'sage_project': False, 'lr': 0.0008199789546966749, 'weight_decay': 2.6566700424064033e-06, 'epochs': 168, 'loss': 'mae', 'optimizer': 'adam', 'graph_mode': 'cutoff', 'cutoff': 0.40157242756403255, 'grm_norm': 'none', 'self_loops': False, 'use_snp_selection': True, 'num_snps': 18989, 'graphsage_batch_size': 512}. Best is trial 43 with value: 0.2714390357744548.
[I 2025-12-05 16:07:01,232] Trial 68 finished with value: 0.26636516228190865 and parameters: {'model_type': 'graphsage', 'hidden_dims': '[128, 64]', 'dropout': 0.5666434754586103, 'batch_norm': True, 'sage_aggr': 'mean', 'sage_normalize': True, 'sage_project': False, 'lr': 0.0006535419454633877, 'weight_decay': 1.0606287924578832e-06, 'epochs': 197, 'loss': 'mse', 'optimizer': 'adam', 'graph_mode': 'cutoff', 'cutoff': 0.4340438574344548, 'grm_norm': 'cosine', 'self_loops': False, 'use_snp_selection': True, 'num_snps': 25267, 'graphsage_batch_size': 32}. Best is trial 43 with value: 0.2714390357744548.
[I 2025-12-05 16:07:56,666] Trial 69 finished with value: 0.2539206159142117 and parameters: {'model_type': 'graphsage', 'hidden_dims': '[128, 64]', 'dropout': 0.5693015718519484, 'batch_norm': True, 'sage_aggr': 'mean', 'sage_normalize': True, 'sage_project': False, 'lr': 0.0003249239286989281, 'weight_decay': 1.0518113093858323e-06, 'epochs': 218, 'loss': 'mse', 'optimizer': 'adam', 'graph_mode': 'cutoff', 'cutoff': 0.47198956346330007, 'grm_norm': 'cosine', 'self_loops': False, 'use_snp_selection': True, 'num_snps': 29148, 'graphsage_batch_size': 32}. Best is trial 43 with value: 0.2714390357744548.
