[I 2025-12-06 03:29:41,548] Trial 67 finished with value: 0.22188553798833896 and parameters: {'model_type': 'graphsage', 'hidden_dims': '[512, 128]', 'dropout': 0.20439746094257374, 'batch_norm': False, 'sage_aggr': 'mean', 'sage_normalize': False, 'sage_project': False, 'lr': 5.36852343017317e-06, 'weight_decay': 0.0002182063808938595, 'epochs': 221, 'loss': 'mae', 'optimizer': 'adam', 'graph_mode': 'cutoff', 'cutoff': 0.26384790070303943, 'grm_norm': 'cosine_then_gcn', 'self_loops': False, 'use_snp_selection': False, 'graphsage_batch_size': 64}. Best is trial 48 with value: 0.24224195621693326.
[I 2025-12-06 03:31:32,260] Trial 68 finished with value: 0.221872332859395 and parameters: {'model_type': 'graphsage', 'hidden_dims': '[512, 64]', 'dropout': 0.11081070994656159, 'batch_norm': False, 'sage_aggr': 'mean', 'sage_normalize': False, 'sage_project': False, 'lr': 6.604592103081556e-06, 'weight_decay': 6.206131803232645e-05, 'epochs': 200, 'loss': 'mae', 'optimizer': 'adam', 'graph_mode': 'cutoff', 'cutoff': 0.34914807497120776, 'grm_norm': 'cosine_then_gcn', 'self_loops': False, 'use_snp_selection': False, 'graphsage_batch_size': 16}. Best is trial 48 with value: 0.24224195621693326.
[I 2025-12-06 03:33:42,845] Trial 69 finished with value: 0.22037194753088976 and parameters: {'model_type': 'graphsage', 'hidden_dims': '[512, 128]', 'dropout': 0.1362638662328896, 'batch_norm': False, 'sage_aggr': 'mean', 'sage_normalize': False, 'sage_project': False, 'lr': 2.504466880138962e-06, 'weight_decay': 9.790221122732475e-05, 'epochs': 250, 'loss': 'mae', 'optimizer': 'adam', 'graph_mode': 'cutoff', 'cutoff': 0.4111197945376732, 'grm_norm': 'cosine', 'self_loops': False, 'use_snp_selection': False, 'graphsage_batch_size': 128}. Best is trial 48 with value: 0.24224195621693326.
[I 2025-12-06 03:35:48,528] Trial 70 finished with value: 0.21911232650912846 and parameters: {'model_type': 'graphsage', 'hidden_dims': '[256, 128]', 'dropout': 0.16293621886735266, 'batch_norm': False, 'sage_aggr': 'mean', 'sage_normalize': False, 'sage_project': False, 'lr': 1.3171986606861453e-05, 'weight_decay': 8.91671455465096e-06, 'epochs': 238, 'loss': 'mse', 'optimizer': 'adam', 'graph_mode': 'cutoff', 'cutoff': 0.23360212711084283, 'grm_norm': 'cosine_then_gcn', 'self_loops': False, 'use_snp_selection': False, 'graphsage_batch_size': 8}. Best is trial 48 with value: 0.24224195621693326.
[I 2025-12-06 03:37:51,903] Trial 71 finished with value: 0.23267149757815328 and parameters: {'model_type': 'graphsage', 'hidden_dims': '[512, 128]', 'dropout': 0.18012838306080214, 'batch_norm': False, 'sage_aggr': 'mean', 'sage_normalize': False, 'sage_project': False, 'lr': 7.89539546382432e-06, 'weight_decay': 0.00014275337322300198, 'epochs': 227, 'loss': 'mae', 'optimizer': 'adam', 'graph_mode': 'cutoff', 'cutoff': 0.3588022771260768, 'grm_norm': 'cosine_then_gcn', 'self_loops': False, 'use_snp_selection': False, 'graphsage_batch_size': 128}. Best is trial 48 with value: 0.24224195621693326.
[I 2025-12-06 03:40:06,524] Trial 72 finished with value: 0.24785014245637355 and parameters: {'model_type': 'graphsage', 'hidden_dims': '[512, 128]', 'dropout': 0.1825743686798059, 'batch_norm': False, 'sage_aggr': 'mean', 'sage_normalize': False, 'sage_project': False, 'lr': 8.236852884406815e-06, 'weight_decay': 0.00018248552938155048, 'epochs': 230, 'loss': 'mae', 'optimizer': 'adam', 'graph_mode': 'cutoff', 'cutoff': 0.30792282896345397, 'grm_norm': 'cosine_then_gcn', 'self_loops': False, 'use_snp_selection': False, 'graphsage_batch_size': 128}. Best is trial 72 with value: 0.24785014245637355.
[I 2025-12-06 03:42:21,565] Trial 73 finished with value: 0.23711666662784908 and parameters: {'model_type': 'graphsage', 'hidden_dims': '[512, 128]', 'dropout': 0.18813674794558666, 'batch_norm': False, 'sage_aggr': 'mean', 'sage_normalize': False, 'sage_project': False, 'lr': 7.726990141995163e-06, 'weight_decay': 0.00027265395852464023, 'epochs': 230, 'loss': 'mae', 'optimizer': 'adam', 'graph_mode': 'cutoff', 'cutoff': 0.3064937115694069, 'grm_norm': 'cosine_then_gcn', 'self_loops': False, 'use_snp_selection': False, 'graphsage_batch_size': 128}. Best is trial 72 with value: 0.24785014245637355.
[I 2025-12-06 03:44:26,061] Trial 74 finished with value: 0.23200602247823227 and parameters: {'model_type': 'graphsage', 'hidden_dims': '[512, 128]', 'dropout': 0.14349893120562185, 'batch_norm': False, 'sage_aggr': 'mean', 'sage_normalize': False, 'sage_project': False, 'lr': 4.136187856727037e-06, 'weight_decay': 0.000337241753065014, 'epochs': 213, 'loss': 'mae', 'optimizer': 'adam', 'graph_mode': 'cutoff', 'cutoff': 0.3117385530318547, 'grm_norm': 'cosine_then_gcn', 'self_loops': False, 'use_snp_selection': False, 'graphsage_batch_size': 128}. Best is trial 72 with value: 0.24785014245637355.
[I 2025-12-06 03:46:52,188] Trial 75 finished with value: 0.22990422185622 and parameters: {'model_type': 'graphsage', 'hidden_dims': '[512, 128]', 'dropout': 0.21277815430824887, 'batch_norm': False, 'sage_aggr': 'mean', 'sage_normalize': False, 'sage_project': False, 'lr': 6.468980321277241e-06, 'weight_decay': 0.0006277762995962973, 'epochs': 234, 'loss': 'mae', 'optimizer': 'adam', 'graph_mode': 'cutoff', 'cutoff': 0.28198394065651367, 'grm_norm': 'cosine_then_gcn', 'self_loops': False, 'use_snp_selection': False, 'graphsage_batch_size': 128}. Best is trial 72 with value: 0.24785014245637355.
[I 2025-12-06 03:47:53,338] Trial 76 finished with value: 0.17514588467058972 and parameters: {'model_type': 'graphsage', 'hidden_dims': '[512, 128]', 'dropout': 0.24108645837011863, 'batch_norm': True, 'sage_aggr': 'mean', 'sage_normalize': False, 'sage_project': False, 'lr': 2.76753903492002e-06, 'weight_decay': 0.00016595057735784222, 'epochs': 242, 'loss': 'mae', 'optimizer': 'adam', 'graph_mode': 'cutoff', 'cutoff': 0.3348578771617046, 'grm_norm': 'cosine_then_gcn', 'self_loops': False, 'use_snp_selection': True, 'num_snps': 21882, 'graphsage_batch_size': 128}. Best is trial 72 with value: 0.24785014245637355.
[I 2025-12-06 03:49:58,241] Trial 77 finished with value: 0.20426960625066526 and parameters: {'model_type': 'graphsage', 'hidden_dims': '[512, 128]', 'dropout': 0.15303543455000918, 'batch_norm': False, 'sage_aggr': 'max', 'sage_normalize': False, 'sage_project': False, 'lr': 1.976043937934102e-06, 'weight_decay': 0.00020827167362924405, 'epochs': 223, 'loss': 'mae', 'optimizer': 'adam', 'graph_mode': 'cutoff', 'cutoff': 0.39166405877639704, 'grm_norm': 'cosine_then_gcn', 'self_loops': False, 'use_snp_selection': False, 'graphsage_batch_size': 256}. Best is trial 72 with value: 0.24785014245637355.
[I 2025-12-06 03:52:38,394] Trial 78 finished with value: 0.20787896805031653 and parameters: {'model_type': 'graphsage', 'hidden_dims': '[512, 128]', 'dropout': 0.19089009592632641, 'batch_norm': False, 'sage_aggr': 'mean', 'sage_normalize': False, 'sage_project': False, 'lr': 1.5782411978274053e-06, 'weight_decay': 0.00010210262982264471, 'epochs': 233, 'loss': 'mae', 'optimizer': 'adam', 'graph_mode': 'knn', 'knn_k': 8, 'weighted_edges': False, 'symmetrize_mode': 'union', 'self_loops': False, 'use_snp_selection': False, 'graphsage_batch_size': 128}. Best is trial 72 with value: 0.24785014245637355.
[I 2025-12-06 03:53:15,739] Trial 79 finished with value: 0.19825986757411082 and parameters: {'model_type': 'graphsage', 'hidden_dims': '[512, 128]', 'dropout': 0.16936920303141967, 'batch_norm': False, 'sage_aggr': 'mean', 'sage_normalize': True, 'sage_project': False, 'lr': 1.1556813949817154e-05, 'weight_decay': 0.0003240690270461833, 'epochs': 44, 'loss': 'mae', 'optimizer': 'adam', 'graph_mode': 'cutoff', 'cutoff': 0.262462163780906, 'grm_norm': 'cosine_then_gcn', 'self_loops': False, 'use_snp_selection': False, 'graphsage_batch_size': 128}. Best is trial 72 with value: 0.24785014245637355.
[I 2025-12-06 03:54:55,890] Trial 80 finished with value: 0.22768941216024774 and parameters: {'model_type': 'graphsage', 'hidden_dims': '[256, 128, 64]', 'dropout': 0.20977132379546068, 'batch_norm': False, 'sage_aggr': 'mean', 'sage_normalize': False, 'sage_project': False, 'lr': 1.6481530657144522e-05, 'weight_decay': 6.106454068480975e-05, 'epochs': 246, 'loss': 'mae', 'optimizer': 'adam', 'graph_mode': 'cutoff', 'cutoff': 0.29455153450300386, 'grm_norm': 'cosine_then_gcn', 'self_loops': False, 'use_snp_selection': False, 'graphsage_batch_size': 128}. Best is trial 72 with value: 0.24785014245637355.
[I 2025-12-06 03:57:08,145] Trial 81 finished with value: 0.2297580044868472 and parameters: {'model_type': 'graphsage', 'hidden_dims': '[512, 128]', 'dropout': 0.1836014606685444, 'batch_norm': False, 'sage_aggr': 'mean', 'sage_normalize': False, 'sage_project': False, 'lr': 8.688786404956199e-06, 'weight_decay': 0.00016964908199066945, 'epochs': 227, 'loss': 'mae', 'optimizer': 'adam', 'graph_mode': 'cutoff', 'cutoff': 0.3105964128174007, 'grm_norm': 'cosine_then_gcn', 'self_loops': False, 'use_snp_selection': False, 'graphsage_batch_size': 128}. Best is trial 72 with value: 0.24785014245637355.
[I 2025-12-06 03:59:13,266] Trial 82 finished with value: 0.21919077641722934 and parameters: {'model_type': 'graphsage', 'hidden_dims': '[512, 128]', 'dropout': 0.1310236160008816, 'batch_norm': False, 'sage_aggr': 'mean', 'sage_normalize': False, 'sage_project': False, 'lr': 7.466536713355766e-06, 'weight_decay': 0.0006720030208124669, 'epochs': 230, 'loss': 'mae', 'optimizer': 'adam', 'graph_mode': 'cutoff', 'cutoff': 0.35585232299116276, 'grm_norm': 'cosine_then_gcn', 'self_loops': False, 'use_snp_selection': False, 'graphsage_batch_size': 128}. Best is trial 72 with value: 0.24785014245637355.
[I 2025-12-06 04:01:56,502] Trial 83 finished with value: 0.22780765207025455 and parameters: {'model_type': 'graphsage', 'hidden_dims': '[512, 128]', 'dropout': 0.15529297728717112, 'batch_norm': False, 'sage_aggr': 'mean', 'sage_normalize': False, 'sage_project': False, 'lr': 5.107477325945532e-06, 'weight_decay': 0.0001196140492227182, 'epochs': 238, 'loss': 'mae', 'optimizer': 'adam', 'graph_mode': 'cutoff', 'cutoff': 0.2505836769110515, 'grm_norm': 'cosine_then_gcn', 'self_loops': False, 'use_snp_selection': False, 'graphsage_batch_size': 128}. Best is trial 72 with value: 0.24785014245637355.
[I 2025-12-06 04:03:55,590] Trial 84 finished with value: 0.22187562641163136 and parameters: {'model_type': 'graphsage', 'hidden_dims': '[512, 128]', 'dropout': 0.25561100440306433, 'batch_norm': False, 'sage_aggr': 'mean', 'sage_normalize': False, 'sage_project': False, 'lr': 3.629855359998759e-06, 'weight_decay': 0.0002645319940769238, 'epochs': 214, 'loss': 'mae', 'optimizer': 'adam', 'graph_mode': 'cutoff', 'cutoff': 0.3409568538869151, 'grm_norm': 'cosine_then_gcn', 'self_loops': False, 'use_snp_selection': False, 'graphsage_batch_size': 64}. Best is trial 72 with value: 0.24785014245637355.
[I 2025-12-06 04:06:40,972] Trial 85 finished with value: 0.2240294086360765 and parameters: {'model_type': 'graphsage', 'hidden_dims': '[512, 128]', 'dropout': 0.18867747907886684, 'batch_norm': False, 'sage_aggr': 'mean', 'sage_normalize': False, 'sage_project': False, 'lr': 6.072034034943912e-06, 'weight_decay': 0.0003760283236450367, 'epochs': 222, 'loss': 'mae', 'optimizer': 'adam', 'graph_mode': 'cutoff', 'cutoff': 0.2269452216850859, 'grm_norm': 'cosine_then_gcn', 'self_loops': False, 'use_snp_selection': False, 'graphsage_batch_size': 128}. Best is trial 72 with value: 0.24785014245637355.
[I 2025-12-06 04:09:23,583] Trial 86 finished with value: 0.23352199895241382 and parameters: {'model_type': 'graphsage', 'hidden_dims': '[512, 64]', 'dropout': 0.1084372409423969, 'batch_norm': False, 'sage_aggr': 'mean', 'sage_normalize': False, 'sage_project': False, 'lr': 8.642371834029607e-06, 'weight_decay': 0.0001860047624238861, 'epochs': 206, 'loss': 'mae', 'optimizer': 'adam', 'graph_mode': 'cutoff', 'cutoff': 0.21503769701181488, 'grm_norm': 'cosine', 'self_loops': False, 'use_snp_selection': False, 'graphsage_batch_size': 16}. Best is trial 72 with value: 0.24785014245637355.
[I 2025-12-06 04:10:20,110] Trial 87 finished with value: 0.1838174718815945 and parameters: {'model_type': 'graphsage', 'hidden_dims': '[512, 64]', 'dropout': 0.11135372797815268, 'batch_norm': True, 'sage_aggr': 'mean', 'sage_normalize': False, 'sage_project': False, 'lr': 4.659571841510009e-06, 'weight_decay': 4.114726233710017e-05, 'epochs': 216, 'loss': 'mse', 'optimizer': 'adam', 'graph_mode': 'cutoff', 'cutoff': 0.20284150909219403, 'grm_norm': 'cosine', 'self_loops': False, 'use_snp_selection': True, 'num_snps': 14782, 'graphsage_batch_size': 16}. Best is trial 72 with value: 0.24785014245637355.
[I 2025-12-06 04:13:00,664] Trial 88 finished with value: 0.23577801293489892 and parameters: {'model_type': 'graphsage', 'hidden_dims': '[512, 64]', 'dropout': 0.12238164655991418, 'batch_norm': False, 'sage_aggr': 'mean', 'sage_normalize': False, 'sage_project': False, 'lr': 1.1103604615931064e-05, 'weight_decay': 2.9659608298117466e-05, 'epochs': 210, 'loss': 'mae', 'optimizer': 'adam', 'graph_mode': 'cutoff', 'cutoff': 0.2195222574697559, 'grm_norm': 'cosine', 'self_loops': False, 'use_snp_selection': False, 'graphsage_batch_size': 16}. Best is trial 72 with value: 0.24785014245637355.
[I 2025-12-06 04:15:21,579] Trial 89 finished with value: 0.23638227583027244 and parameters: {'model_type': 'graphsage', 'hidden_dims': '[512, 64]', 'dropout': 0.14228542299198038, 'batch_norm': False, 'sage_aggr': 'max', 'sage_normalize': False, 'sage_project': False, 'lr': 1.0053115856027729e-05, 'weight_decay': 7.693187194892013e-05, 'epochs': 204, 'loss': 'mae', 'optimizer': 'adam', 'graph_mode': 'cutoff', 'cutoff': 0.28010290718162784, 'grm_norm': 'cosine', 'self_loops': False, 'use_snp_selection': False, 'graphsage_batch_size': 16}. Best is trial 72 with value: 0.24785014245637355.
[I 2025-12-06 04:16:48,596] Trial 90 finished with value: 0.17890159540933728 and parameters: {'model_type': 'graphsage', 'hidden_dims': '[512, 64]', 'dropout': 0.13942340235461334, 'batch_norm': False, 'sage_aggr': 'max', 'sage_normalize': True, 'sage_project': False, 'lr': 1.826502614700471e-05, 'weight_decay': 7.779639546454228e-05, 'epochs': 187, 'loss': 'mae', 'optimizer': 'adam', 'graph_mode': 'knn', 'knn_k': 2, 'weighted_edges': False, 'symmetrize_mode': 'mutual', 'self_loops': False, 'use_snp_selection': False, 'graphsage_batch_size': 16}. Best is trial 72 with value: 0.24785014245637355.
[I 2025-12-06 04:19:11,011] Trial 91 finished with value: 0.23788977419772342 and parameters: {'model_type': 'graphsage', 'hidden_dims': '[512, 64]', 'dropout': 0.12485644155611614, 'batch_norm': False, 'sage_aggr': 'max', 'sage_normalize': False, 'sage_project': False, 'lr': 1.1116693760104843e-05, 'weight_decay': 3.075079577550543e-05, 'epochs': 204, 'loss': 'mae', 'optimizer': 'adam', 'graph_mode': 'cutoff', 'cutoff': 0.2770615145046569, 'grm_norm': 'cosine', 'self_loops': False, 'use_snp_selection': False, 'graphsage_batch_size': 16}. Best is trial 72 with value: 0.24785014245637355.
[I 2025-12-06 04:21:35,455] Trial 92 finished with value: 0.22828523867877984 and parameters: {'model_type': 'graphsage', 'hidden_dims': '[512, 64]', 'dropout': 0.12264283475141521, 'batch_norm': False, 'sage_aggr': 'max', 'sage_normalize': False, 'sage_project': False, 'lr': 1.1421938283154485e-05, 'weight_decay': 3.137465907884425e-05, 'epochs': 204, 'loss': 'mae', 'optimizer': 'adam', 'graph_mode': 'cutoff', 'cutoff': 0.2729950358790785, 'grm_norm': 'cosine', 'self_loops': False, 'use_snp_selection': False, 'graphsage_batch_size': 16}. Best is trial 72 with value: 0.24785014245637355.
[I 2025-12-06 04:23:57,031] Trial 93 finished with value: 0.22919754188539915 and parameters: {'model_type': 'graphsage', 'hidden_dims': '[512, 64]', 'dropout': 0.16325062967760795, 'batch_norm': False, 'sage_aggr': 'max', 'sage_normalize': False, 'sage_project': False, 'lr': 1.0198258498420192e-05, 'weight_decay': 0.0001184919330332702, 'epochs': 213, 'loss': 'mae', 'optimizer': 'adam', 'graph_mode': 'cutoff', 'cutoff': 0.2913463915532908, 'grm_norm': 'cosine', 'self_loops': False, 'use_snp_selection': False, 'graphsage_batch_size': 16}. Best is trial 72 with value: 0.24785014245637355.
[I 2025-12-06 04:26:24,452] Trial 94 finished with value: 0.23254538643060507 and parameters: {'model_type': 'graphsage', 'hidden_dims': '[512, 64]', 'dropout': 0.14442746610717985, 'batch_norm': False, 'sage_aggr': 'max', 'sage_normalize': False, 'sage_project': False, 'lr': 2.5168229833117805e-05, 'weight_decay': 2.726864691580428e-05, 'epochs': 194, 'loss': 'mae', 'optimizer': 'adam', 'graph_mode': 'cutoff', 'cutoff': 0.25431635605326813, 'grm_norm': 'cosine', 'self_loops': False, 'use_snp_selection': False, 'graphsage_batch_size': 16}. Best is trial 72 with value: 0.24785014245637355.
[I 2025-12-06 04:28:48,113] Trial 95 finished with value: 0.23389603801268039 and parameters: {'model_type': 'graphsage', 'hidden_dims': '[512, 64]', 'dropout': 0.13283103867422635, 'batch_norm': False, 'sage_aggr': 'max', 'sage_normalize': False, 'sage_project': False, 'lr': 1.4595239166336768e-05, 'weight_decay': 5.186703989365406e-05, 'epochs': 239, 'loss': 'mae', 'optimizer': 'adam', 'graph_mode': 'cutoff', 'cutoff': 0.32662389006035, 'grm_norm': 'cosine', 'self_loops': False, 'use_snp_selection': False, 'graphsage_batch_size': 16}. Best is trial 72 with value: 0.24785014245637355.
[I 2025-12-06 04:31:10,647] Trial 96 finished with value: 0.22901806651731804 and parameters: {'model_type': 'graphsage', 'hidden_dims': '[512, 64]', 'dropout': 0.13240997428906262, 'batch_norm': False, 'sage_aggr': 'max', 'sage_normalize': False, 'sage_project': False, 'lr': 1.4544507596857248e-05, 'weight_decay': 2.146883877807608e-05, 'epochs': 238, 'loss': 'mae', 'optimizer': 'adam', 'graph_mode': 'cutoff', 'cutoff': 0.32850109982528086, 'grm_norm': 'cosine', 'self_loops': False, 'use_snp_selection': False, 'graphsage_batch_size': 16}. Best is trial 72 with value: 0.24785014245637355.
[I 2025-12-06 04:33:44,501] Trial 97 finished with value: 0.22981425630123944 and parameters: {'model_type': 'graphsage', 'hidden_dims': '[512, 64]', 'dropout': 0.17273935121390213, 'batch_norm': False, 'sage_aggr': 'max', 'sage_normalize': False, 'sage_project': False, 'lr': 1.3065467903408877e-05, 'weight_decay': 5.7327371119738546e-05, 'epochs': 245, 'loss': 'mae', 'optimizer': 'adam', 'graph_mode': 'cutoff', 'cutoff': 0.30700096707895336, 'grm_norm': 'cosine', 'self_loops': False, 'use_snp_selection': False, 'graphsage_batch_size': 16}. Best is trial 72 with value: 0.24785014245637355.
[I 2025-12-06 04:35:38,681] Trial 98 finished with value: 0.2112232193100751 and parameters: {'model_type': 'graphsage', 'hidden_dims': '[512, 64]', 'dropout': 0.15771823582192898, 'batch_norm': False, 'sage_aggr': 'max', 'sage_normalize': False, 'sage_project': False, 'lr': 1.0620872386266211e-05, 'weight_decay': 7.382135006737199e-05, 'epochs': 210, 'loss': 'mae', 'optimizer': 'adam', 'graph_mode': 'cutoff', 'cutoff': 0.4430609940347049, 'grm_norm': 'cosine', 'self_loops': False, 'use_snp_selection': False, 'graphsage_batch_size': 16}. Best is trial 72 with value: 0.24785014245637355.
[I 2025-12-06 04:37:47,049] Trial 99 finished with value: 0.2258643087704113 and parameters: {'model_type': 'graphsage', 'hidden_dims': '[512, 64]', 'dropout': 0.12441094057688276, 'batch_norm': False, 'sage_aggr': 'max', 'sage_normalize': False, 'sage_project': False, 'lr': 8.58516167538108e-06, 'weight_decay': 3.3247114923903065e-05, 'epochs': 231, 'loss': 'mse', 'optimizer': 'adam', 'graph_mode': 'cutoff', 'cutoff': 0.394900479292498, 'grm_norm': 'cosine', 'self_loops': False, 'use_snp_selection': False, 'graphsage_batch_size': 16}. Best is trial 72 with value: 0.24785014245637355.
[I 2025-12-06 04:39:07,605] Trial 100 finished with value: 0.23572321845318017 and parameters: {'model_type': 'graphsage', 'hidden_dims': '[512, 64]', 'dropout': 0.28556216944296375, 'batch_norm': False, 'sage_aggr': 'max', 'sage_normalize': False, 'sage_project': False, 'lr': 1.9517459364447447e-05, 'weight_decay': 4.787472133698005e-05, 'epochs': 221, 'loss': 'mae', 'optimizer': 'adam', 'graph_mode': 'cutoff', 'cutoff': 0.3331993117375544, 'grm_norm': 'cosine', 'self_loops': False, 'use_snp_selection': True, 'num_snps': 29160, 'graphsage_batch_size': 16}. Best is trial 72 with value: 0.24785014245637355.
[I 2025-12-06 04:40:30,194] Trial 101 finished with value: 0.2367135563818059 and parameters: {'model_type': 'graphsage', 'hidden_dims': '[512, 64]', 'dropout': 0.30314111086432927, 'batch_norm': False, 'sage_aggr': 'max', 'sage_normalize': False, 'sage_project': False, 'lr': 1.917116457388655e-05, 'weight_decay': 5.208757826348825e-05, 'epochs': 221, 'loss': 'mae', 'optimizer': 'adam', 'graph_mode': 'cutoff', 'cutoff': 0.3241608734082828, 'grm_norm': 'cosine', 'self_loops': False, 'use_snp_selection': True, 'num_snps': 29201, 'graphsage_batch_size': 16}. Best is trial 72 with value: 0.24785014245637355.
[I 2025-12-06 04:42:13,333] Trial 102 finished with value: 0.23805631804962912 and parameters: {'model_type': 'graphsage', 'hidden_dims': '[512, 64]', 'dropout': 0.295468911536248, 'batch_norm': False, 'sage_aggr': 'max', 'sage_normalize': False, 'sage_project': False, 'lr': 3.3886651865065535e-05, 'weight_decay': 1.4242197066500193e-05, 'epochs': 220, 'loss': 'mae', 'optimizer': 'adam', 'graph_mode': 'cutoff', 'cutoff': 0.2787862052257829, 'grm_norm': 'cosine', 'self_loops': False, 'use_snp_selection': True, 'num_snps': 31316, 'graphsage_batch_size': 16}. Best is trial 72 with value: 0.24785014245637355.
