[I 2025-12-09 12:18:13,104] Trial 108 finished with value: 0.28700088481780195 and parameters: {'model_type': 'graphsage', 'hidden_dims': '[512, 64]', 'dropout': 0.5884182898913298, 'batch_norm': False, 'sage_aggr': 'mean', 'sage_normalize': False, 'sage_project': False, 'lr': 2.861613712174152e-05, 'weight_decay': 2.736396004601318e-06, 'epochs': 190, 'loss': 'mse', 'optimizer': 'adam', 'graph_mode': 'knn', 'knn_k': 7, 'weighted_edges': True, 'symmetrize_mode': 'mutual', 'self_loops': True, 'use_snp_selection': False}. Best is trial 94 with value: 0.2923823061698122.
[I 2025-12-09 12:21:32,116] Trial 109 finished with value: 0.2866043131954411 and parameters: {'model_type': 'graphsage', 'hidden_dims': '[512, 64]', 'dropout': 0.5962164931671224, 'batch_norm': False, 'sage_aggr': 'mean', 'sage_normalize': False, 'sage_project': False, 'lr': 2.2842666032295866e-05, 'weight_decay': 2.295851877056871e-06, 'epochs': 236, 'loss': 'mse', 'optimizer': 'adam', 'graph_mode': 'knn', 'knn_k': 5, 'weighted_edges': True, 'symmetrize_mode': 'mutual', 'self_loops': True, 'use_snp_selection': True, 'num_snps': 43622}. Best is trial 94 with value: 0.2923823061698122.
[I 2025-12-09 12:24:02,390] Trial 110 finished with value: 0.28616859115213 and parameters: {'model_type': 'graphsage', 'hidden_dims': '[512, 64]', 'dropout': 0.5520420891423915, 'batch_norm': False, 'sage_aggr': 'mean', 'sage_normalize': False, 'sage_project': False, 'lr': 3.7526858779541857e-05, 'weight_decay': 8.186298235466442e-07, 'epochs': 162, 'loss': 'mse', 'optimizer': 'adam', 'graph_mode': 'knn', 'knn_k': 4, 'weighted_edges': True, 'symmetrize_mode': 'mutual', 'self_loops': True, 'use_snp_selection': True, 'num_snps': 47638}. Best is trial 94 with value: 0.2923823061698122.
[I 2025-12-09 12:26:18,128] Trial 111 finished with value: 0.2880868291025095 and parameters: {'model_type': 'graphsage', 'hidden_dims': '[512, 64]', 'dropout': 0.569109195631765, 'batch_norm': False, 'sage_aggr': 'mean', 'sage_normalize': False, 'sage_project': False, 'lr': 1.964241049554467e-05, 'weight_decay': 5.856931386773003e-06, 'epochs': 210, 'loss': 'mse', 'optimizer': 'adam', 'graph_mode': 'knn', 'knn_k': 6, 'weighted_edges': True, 'symmetrize_mode': 'mutual', 'self_loops': True, 'use_snp_selection': True, 'num_snps': 32292}. Best is trial 94 with value: 0.2923823061698122.
[I 2025-12-09 12:29:22,582] Trial 112 finished with value: 0.2871143285524808 and parameters: {'model_type': 'graphsage', 'hidden_dims': '[512, 64]', 'dropout': 0.5255198635936092, 'batch_norm': False, 'sage_aggr': 'mean', 'sage_normalize': False, 'sage_project': False, 'lr': 1.2925633013000347e-05, 'weight_decay': 3.541562287063825e-06, 'epochs': 224, 'loss': 'mse', 'optimizer': 'adam', 'graph_mode': 'knn', 'knn_k': 6, 'weighted_edges': True, 'symmetrize_mode': 'mutual', 'self_loops': True, 'use_snp_selection': True, 'num_snps': 39678}. Best is trial 94 with value: 0.2923823061698122.
[I 2025-12-09 12:31:16,785] Trial 113 finished with value: 0.2851792201216098 and parameters: {'model_type': 'graphsage', 'hidden_dims': '[512, 64]', 'dropout': 0.599504366320055, 'batch_norm': False, 'sage_aggr': 'mean', 'sage_normalize': False, 'sage_project': False, 'lr': 2.6168943074615255e-05, 'weight_decay': 1.5060043900350086e-06, 'epochs': 197, 'loss': 'mse', 'optimizer': 'adam', 'graph_mode': 'knn', 'knn_k': 6, 'weighted_edges': True, 'symmetrize_mode': 'mutual', 'self_loops': True, 'use_snp_selection': True, 'num_snps': 28522}. Best is trial 94 with value: 0.2923823061698122.
[I 2025-12-09 12:33:49,074] Trial 114 finished with value: 0.2879483572200487 and parameters: {'model_type': 'graphsage', 'hidden_dims': '[512, 64]', 'dropout': 0.5657231217037354, 'batch_norm': False, 'sage_aggr': 'mean', 'sage_normalize': False, 'sage_project': False, 'lr': 1.6795100461537985e-05, 'weight_decay': 7.730885978439043e-06, 'epochs': 218, 'loss': 'mse', 'optimizer': 'adam', 'graph_mode': 'knn', 'knn_k': 5, 'weighted_edges': True, 'symmetrize_mode': 'mutual', 'self_loops': True, 'use_snp_selection': True, 'num_snps': 35769}. Best is trial 94 with value: 0.2923823061698122.
[I 2025-12-09 12:36:27,809] Trial 115 finished with value: 0.2878804884745549 and parameters: {'model_type': 'graphsage', 'hidden_dims': '[256, 128]', 'dropout': 0.47750712983796473, 'batch_norm': False, 'sage_aggr': 'mean', 'sage_normalize': False, 'sage_project': False, 'lr': 3.1184545897242976e-05, 'weight_decay': 2.127195355737096e-06, 'epochs': 230, 'loss': 'mse', 'optimizer': 'adam', 'graph_mode': 'knn', 'knn_k': 7, 'weighted_edges': True, 'symmetrize_mode': 'mutual', 'self_loops': True, 'use_snp_selection': True, 'num_snps': 38423}. Best is trial 94 with value: 0.2923823061698122.
[I 2025-12-09 12:38:38,360] Trial 116 finished with value: 0.2855217693768747 and parameters: {'model_type': 'graphsage', 'hidden_dims': '[512, 64]', 'dropout': 0.52470447220548, 'batch_norm': False, 'sage_aggr': 'mean', 'sage_normalize': False, 'sage_project': False, 'lr': 1.1345999816964472e-05, 'weight_decay': 3.5167232734597976e-06, 'epochs': 209, 'loss': 'mse', 'optimizer': 'adam', 'graph_mode': 'knn', 'knn_k': 6, 'weighted_edges': True, 'symmetrize_mode': 'mutual', 'self_loops': True, 'use_snp_selection': True, 'num_snps': 30329}. Best is trial 94 with value: 0.2923823061698122.
[I 2025-12-09 12:41:01,153] Trial 117 finished with value: 0.2470785969843646 and parameters: {'model_type': 'graphsage', 'hidden_dims': '[512, 64]', 'dropout': 0.507977713663011, 'batch_norm': True, 'sage_aggr': 'mean', 'sage_normalize': True, 'sage_project': False, 'lr': 2.2948810715281638e-05, 'weight_decay': 6.621951454870544e-07, 'epochs': 239, 'loss': 'mse', 'optimizer': 'adam', 'graph_mode': 'knn', 'knn_k': 5, 'weighted_edges': True, 'symmetrize_mode': 'mutual', 'self_loops': True, 'use_snp_selection': True, 'num_snps': 33031}. Best is trial 94 with value: 0.2923823061698122.
[I 2025-12-09 12:43:09,975] Trial 118 finished with value: 0.28464875900230113 and parameters: {'model_type': 'graphsage', 'hidden_dims': '[512, 64]', 'dropout': 0.5451439850386075, 'batch_norm': False, 'sage_aggr': 'mean', 'sage_normalize': False, 'sage_project': False, 'lr': 1.970354842391365e-05, 'weight_decay': 4.370578077055859e-06, 'epochs': 201, 'loss': 'mae', 'optimizer': 'adam', 'graph_mode': 'knn', 'knn_k': 6, 'weighted_edges': True, 'symmetrize_mode': 'mutual', 'self_loops': True, 'use_snp_selection': True, 'num_snps': 30827}. Best is trial 94 with value: 0.2923823061698122.
[I 2025-12-09 12:45:23,475] Trial 119 finished with value: 0.2854121671020688 and parameters: {'model_type': 'graphsage', 'hidden_dims': '[512, 64]', 'dropout': 0.532778764459852, 'batch_norm': False, 'sage_aggr': 'mean', 'sage_normalize': False, 'sage_project': False, 'lr': 1.312248855974651e-05, 'weight_decay': 9.64559001380462e-07, 'epochs': 224, 'loss': 'mse', 'optimizer': 'adam', 'graph_mode': 'knn', 'knn_k': 4, 'weighted_edges': False, 'symmetrize_mode': 'mutual', 'self_loops': True, 'use_snp_selection': True, 'num_snps': 34819}. Best is trial 94 with value: 0.2923823061698122.
[I 2025-12-09 12:48:49,864] Trial 120 finished with value: 0.0 and parameters: {'model_type': 'graphsage', 'hidden_dims': '[512, 64]', 'dropout': 0.5880511010936496, 'batch_norm': False, 'sage_aggr': 'mean', 'sage_normalize': False, 'sage_project': False, 'lr': 0.003505761727502583, 'weight_decay': 2.4439191524062887e-06, 'epochs': 191, 'loss': 'mse', 'optimizer': 'adam', 'graph_mode': 'knn', 'knn_k': 5, 'weighted_edges': True, 'symmetrize_mode': 'mutual', 'self_loops': True, 'use_snp_selection': True, 'num_snps': 53009}. Best is trial 94 with value: 0.2923823061698122.
[I 2025-12-09 12:50:43,183] Trial 121 finished with value: 0.2888532804771537 and parameters: {'model_type': 'graphsage', 'hidden_dims': '[512, 64]', 'dropout': 0.49436611644140255, 'batch_norm': False, 'sage_aggr': 'mean', 'sage_normalize': False, 'sage_project': False, 'lr': 1.5304385964258595e-05, 'weight_decay': 1.3395603613691875e-06, 'epochs': 243, 'loss': 'mse', 'optimizer': 'adam', 'graph_mode': 'knn', 'knn_k': 5, 'weighted_edges': True, 'symmetrize_mode': 'mutual', 'self_loops': True, 'use_snp_selection': True, 'num_snps': 25591}. Best is trial 94 with value: 0.2923823061698122.
[I 2025-12-09 12:52:42,883] Trial 122 finished with value: 0.28457501376594657 and parameters: {'model_type': 'graphsage', 'hidden_dims': '[512, 64]', 'dropout': 0.49715358178081637, 'batch_norm': False, 'sage_aggr': 'mean', 'sage_normalize': False, 'sage_project': False, 'lr': 1.7149220134522906e-05, 'weight_decay': 1.7441131504551688e-06, 'epochs': 245, 'loss': 'mse', 'optimizer': 'adam', 'graph_mode': 'knn', 'knn_k': 5, 'weighted_edges': True, 'symmetrize_mode': 'mutual', 'self_loops': True, 'use_snp_selection': True, 'num_snps': 27551}. Best is trial 94 with value: 0.2923823061698122.
[I 2025-12-09 12:54:29,879] Trial 123 finished with value: 0.2903597011806335 and parameters: {'model_type': 'graphsage', 'hidden_dims': '[512, 64]', 'dropout': 0.5150193379568729, 'batch_norm': False, 'sage_aggr': 'mean', 'sage_normalize': False, 'sage_project': False, 'lr': 1.3629267614697476e-05, 'weight_decay': 6.301984045777711e-06, 'epochs': 217, 'loss': 'mse', 'optimizer': 'adam', 'graph_mode': 'knn', 'knn_k': 5, 'weighted_edges': True, 'symmetrize_mode': 'mutual', 'self_loops': True, 'use_snp_selection': True, 'num_snps': 26262}. Best is trial 94 with value: 0.2923823061698122.
[I 2025-12-09 12:56:14,802] Trial 124 finished with value: 0.28969190177798415 and parameters: {'model_type': 'graphsage', 'hidden_dims': '[512, 128]', 'dropout': 0.5194890191654549, 'batch_norm': False, 'sage_aggr': 'mean', 'sage_normalize': False, 'sage_project': False, 'lr': 2.188183845816198e-05, 'weight_decay': 1.1035699801941905e-05, 'epochs': 214, 'loss': 'mse', 'optimizer': 'adam', 'graph_mode': 'knn', 'knn_k': 5, 'weighted_edges': True, 'symmetrize_mode': 'mutual', 'self_loops': True, 'use_snp_selection': True, 'num_snps': 26296}. Best is trial 94 with value: 0.2923823061698122.
[I 2025-12-09 12:57:33,133] Trial 125 finished with value: 0.29095852667914457 and parameters: {'model_type': 'graphsage', 'hidden_dims': '[512, 128]', 'dropout': 0.5120176419032492, 'batch_norm': False, 'sage_aggr': 'mean', 'sage_normalize': False, 'sage_project': False, 'lr': 1.3871708626979444e-05, 'weight_decay': 6.560342700686014e-06, 'epochs': 181, 'loss': 'mse', 'optimizer': 'adam', 'graph_mode': 'knn', 'knn_k': 5, 'weighted_edges': True, 'symmetrize_mode': 'mutual', 'self_loops': True, 'use_snp_selection': True, 'num_snps': 22870}. Best is trial 94 with value: 0.2923823061698122.
[I 2025-12-09 12:58:57,742] Trial 126 finished with value: 0.2866621991849488 and parameters: {'model_type': 'graphsage', 'hidden_dims': '[512, 128]', 'dropout': 0.4882505095839911, 'batch_norm': False, 'sage_aggr': 'mean', 'sage_normalize': False, 'sage_project': False, 'lr': 1.3445378390540778e-05, 'weight_decay': 1.0628929696414413e-05, 'epochs': 181, 'loss': 'mse', 'optimizer': 'adam', 'graph_mode': 'knn', 'knn_k': 4, 'weighted_edges': True, 'symmetrize_mode': 'mutual', 'self_loops': True, 'use_snp_selection': True, 'num_snps': 25758}. Best is trial 94 with value: 0.2923823061698122.
[I 2025-12-09 13:00:37,831] Trial 127 finished with value: 0.2886052934489308 and parameters: {'model_type': 'graphsage', 'hidden_dims': '[512, 128]', 'dropout': 0.4694312501890797, 'batch_norm': False, 'sage_aggr': 'mean', 'sage_normalize': False, 'sage_project': False, 'lr': 2.4836352841206533e-05, 'weight_decay': 5.1380269436195925e-06, 'epochs': 171, 'loss': 'mse', 'optimizer': 'adam', 'graph_mode': 'knn', 'knn_k': 5, 'weighted_edges': True, 'symmetrize_mode': 'mutual', 'self_loops': True, 'use_snp_selection': True, 'num_snps': 28768}. Best is trial 94 with value: 0.2923823061698122.
[I 2025-12-09 13:03:56,308] Trial 128 finished with value: 0.2858077488749625 and parameters: {'model_type': 'graphsage', 'hidden_dims': '[512, 128]', 'dropout': 0.5250361803447287, 'batch_norm': False, 'sage_aggr': 'mean', 'sage_normalize': False, 'sage_project': False, 'lr': 1.7157020849210388e-05, 'weight_decay': 7.319595169558128e-06, 'epochs': 216, 'loss': 'mse', 'optimizer': 'adam', 'graph_mode': 'knn', 'knn_k': 5, 'weighted_edges': False, 'symmetrize_mode': 'union', 'self_loops': True, 'use_snp_selection': False}. Best is trial 94 with value: 0.2923823061698122.
[I 2025-12-09 13:05:09,465] Trial 129 finished with value: 0.290015427753983 and parameters: {'model_type': 'graphsage', 'hidden_dims': '[512, 128]', 'dropout': 0.5064584856220169, 'batch_norm': False, 'sage_aggr': 'mean', 'sage_normalize': False, 'sage_project': False, 'lr': 1.1955456924733252e-05, 'weight_decay': 6.0007491132450515e-06, 'epochs': 162, 'loss': 'mse', 'optimizer': 'adam', 'graph_mode': 'knn', 'knn_k': 5, 'weighted_edges': True, 'symmetrize_mode': 'mutual', 'self_loops': True, 'use_snp_selection': True, 'num_snps': 22847}. Best is trial 94 with value: 0.2923823061698122.
[I 2025-12-09 13:06:30,320] Trial 130 finished with value: 0.28979887595807796 and parameters: {'model_type': 'graphsage', 'hidden_dims': '[512, 128]', 'dropout': 0.5040039448461578, 'batch_norm': False, 'sage_aggr': 'mean', 'sage_normalize': False, 'sage_project': False, 'lr': 1.2254488743277345e-05, 'weight_decay': 6.126724991945532e-06, 'epochs': 158, 'loss': 'mse', 'optimizer': 'adam', 'graph_mode': 'knn', 'knn_k': 7, 'weighted_edges': True, 'symmetrize_mode': 'mutual', 'self_loops': True, 'use_snp_selection': True, 'num_snps': 23118}. Best is trial 94 with value: 0.2923823061698122.
[I 2025-12-09 13:07:50,195] Trial 131 finished with value: 0.2880474024905984 and parameters: {'model_type': 'graphsage', 'hidden_dims': '[512, 128]', 'dropout': 0.5104548798799379, 'batch_norm': False, 'sage_aggr': 'mean', 'sage_normalize': False, 'sage_project': False, 'lr': 1.1733820181907213e-05, 'weight_decay': 9.265717883825038e-06, 'epochs': 155, 'loss': 'mse', 'optimizer': 'adam', 'graph_mode': 'knn', 'knn_k': 7, 'weighted_edges': True, 'symmetrize_mode': 'mutual', 'self_loops': True, 'use_snp_selection': True, 'num_snps': 22408}. Best is trial 94 with value: 0.2923823061698122.
[I 2025-12-09 13:09:22,179] Trial 132 finished with value: 0.293433201334795 and parameters: {'model_type': 'graphsage', 'hidden_dims': '[512, 128]', 'dropout': 0.5525219522338564, 'batch_norm': False, 'sage_aggr': 'mean', 'sage_normalize': False, 'sage_project': False, 'lr': 1.0203949302947283e-05, 'weight_decay': 5.815130177978576e-06, 'epochs': 158, 'loss': 'mse', 'optimizer': 'adam', 'graph_mode': 'knn', 'knn_k': 8, 'weighted_edges': True, 'symmetrize_mode': 'mutual', 'self_loops': True, 'use_snp_selection': True, 'num_snps': 24533}. Best is trial 132 with value: 0.293433201334795.
[I 2025-12-09 13:11:02,912] Trial 133 finished with value: 0.28922381773799477 and parameters: {'model_type': 'graphsage', 'hidden_dims': '[512, 128]', 'dropout': 0.5203678310307039, 'batch_norm': False, 'sage_aggr': 'mean', 'sage_normalize': False, 'sage_project': False, 'lr': 1.0146206284053814e-05, 'weight_decay': 6.884797674701673e-06, 'epochs': 164, 'loss': 'mse', 'optimizer': 'adam', 'graph_mode': 'knn', 'knn_k': 7, 'weighted_edges': True, 'symmetrize_mode': 'mutual', 'self_loops': True, 'use_snp_selection': True, 'num_snps': 26504}. Best is trial 132 with value: 0.293433201334795.
[I 2025-12-09 13:12:25,523] Trial 134 finished with value: 0.2869676973494551 and parameters: {'model_type': 'graphsage', 'hidden_dims': '[512, 128]', 'dropout': 0.5017976488338414, 'batch_norm': False, 'sage_aggr': 'mean', 'sage_normalize': False, 'sage_project': False, 'lr': 1.2783919172733139e-05, 'weight_decay': 6.300325433342837e-06, 'epochs': 153, 'loss': 'mse', 'optimizer': 'adam', 'graph_mode': 'knn', 'knn_k': 8, 'weighted_edges': True, 'symmetrize_mode': 'mutual', 'self_loops': True, 'use_snp_selection': True, 'num_snps': 22574}. Best is trial 132 with value: 0.293433201334795.
[I 2025-12-09 13:13:39,642] Trial 135 finished with value: 0.28647787880506737 and parameters: {'model_type': 'graphsage', 'hidden_dims': '[512, 128]', 'dropout': 0.5510017469320304, 'batch_norm': False, 'sage_aggr': 'mean', 'sage_normalize': False, 'sage_project': False, 'lr': 1.1604815681176405e-05, 'weight_decay': 4.759189692996095e-06, 'epochs': 129, 'loss': 'mse', 'optimizer': 'adam', 'graph_mode': 'knn', 'knn_k': 8, 'weighted_edges': True, 'symmetrize_mode': 'mutual', 'self_loops': True, 'use_snp_selection': True, 'num_snps': 27647}. Best is trial 132 with value: 0.293433201334795.
[I 2025-12-09 13:15:16,176] Trial 136 finished with value: 0.28858069538606956 and parameters: {'model_type': 'graphsage', 'hidden_dims': '[512, 128]', 'dropout': 0.5618075537946113, 'batch_norm': False, 'sage_aggr': 'mean', 'sage_normalize': False, 'sage_project': False, 'lr': 1.9673361394653328e-05, 'weight_decay': 8.701007059456137e-06, 'epochs': 177, 'loss': 'mse', 'optimizer': 'adam', 'graph_mode': 'knn', 'knn_k': 8, 'weighted_edges': True, 'symmetrize_mode': 'mutual', 'self_loops': True, 'use_snp_selection': True, 'num_snps': 24170}. Best is trial 132 with value: 0.293433201334795.
[I 2025-12-09 13:16:48,244] Trial 137 finished with value: 0.2914766619622371 and parameters: {'model_type': 'graphsage', 'hidden_dims': '[512, 128]', 'dropout': 0.5074561848274431, 'batch_norm': False, 'sage_aggr': 'mean', 'sage_normalize': False, 'sage_project': False, 'lr': 1.0120358612093635e-05, 'weight_decay': 5.919140150083969e-06, 'epochs': 160, 'loss': 'mse', 'optimizer': 'adam', 'graph_mode': 'knn', 'knn_k': 6, 'weighted_edges': True, 'symmetrize_mode': 'mutual', 'self_loops': True, 'use_snp_selection': True, 'num_snps': 26540}. Best is trial 132 with value: 0.293433201334795.
[I 2025-12-09 13:18:22,586] Trial 138 finished with value: 0.27023273722792557 and parameters: {'model_type': 'graphsage', 'hidden_dims': '[512, 128]', 'dropout': 0.48681610647501117, 'batch_norm': False, 'sage_aggr': 'mean', 'sage_normalize': True, 'sage_project': False, 'lr': 1.0074047724303322e-05, 'weight_decay': 1.0086700429051025e-05, 'epochs': 165, 'loss': 'mse', 'optimizer': 'adam', 'graph_mode': 'knn', 'knn_k': 6, 'weighted_edges': True, 'symmetrize_mode': 'mutual', 'self_loops': True, 'use_snp_selection': True, 'num_snps': 26920}. Best is trial 132 with value: 0.293433201334795.
[I 2025-12-09 13:19:55,902] Trial 139 finished with value: 0.2581656975656379 and parameters: {'model_type': 'graphsage', 'hidden_dims': '[512, 128]', 'dropout': 0.5087594561782358, 'batch_norm': True, 'sage_aggr': 'mean', 'sage_normalize': False, 'sage_project': False, 'lr': 1.3812748775656666e-05, 'weight_decay': 3.026828657954165e-06, 'epochs': 131, 'loss': 'mse', 'optimizer': 'adam', 'graph_mode': 'knn', 'knn_k': 6, 'weighted_edges': True, 'symmetrize_mode': 'mutual', 'self_loops': True, 'use_snp_selection': True, 'num_snps': 29508}. Best is trial 132 with value: 0.293433201334795.
[I 2025-12-09 13:21:19,561] Trial 140 finished with value: 0.28707557263786176 and parameters: {'model_type': 'graphsage', 'hidden_dims': '[512, 128]', 'dropout': 0.5331599802589524, 'batch_norm': False, 'sage_aggr': 'mean', 'sage_normalize': False, 'sage_project': False, 'lr': 1.2033225614559265e-05, 'weight_decay': 1.2239769707101366e-05, 'epochs': 185, 'loss': 'mae', 'optimizer': 'adam', 'graph_mode': 'knn', 'knn_k': 5, 'weighted_edges': True, 'symmetrize_mode': 'mutual', 'self_loops': True, 'use_snp_selection': True, 'num_snps': 23030}. Best is trial 132 with value: 0.293433201334795.
[I 2025-12-09 13:22:43,167] Trial 141 finished with value: 0.28982456860711436 and parameters: {'model_type': 'graphsage', 'hidden_dims': '[512, 128]', 'dropout': 0.47080589526139305, 'batch_norm': False, 'sage_aggr': 'mean', 'sage_normalize': False, 'sage_project': False, 'lr': 1.4185023280721627e-05, 'weight_decay': 6.29611783055266e-06, 'epochs': 159, 'loss': 'mse', 'optimizer': 'adam', 'graph_mode': 'knn', 'knn_k': 6, 'weighted_edges': True, 'symmetrize_mode': 'mutual', 'self_loops': True, 'use_snp_selection': True, 'num_snps': 24644}. Best is trial 132 with value: 0.293433201334795.
[I 2025-12-09 13:24:14,508] Trial 142 finished with value: 0.2879547542488153 and parameters: {'model_type': 'graphsage', 'hidden_dims': '[512, 128]', 'dropout': 0.47535150114686114, 'batch_norm': False, 'sage_aggr': 'mean', 'sage_normalize': False, 'sage_project': False, 'lr': 1.3385264937578037e-05, 'weight_decay': 6.406527262381032e-06, 'epochs': 141, 'loss': 'mse', 'optimizer': 'adam', 'graph_mode': 'knn', 'knn_k': 9, 'weighted_edges': True, 'symmetrize_mode': 'mutual', 'self_loops': True, 'use_snp_selection': True, 'num_snps': 24857}. Best is trial 132 with value: 0.293433201334795.
[I 2025-12-09 13:25:39,565] Trial 143 finished with value: 0.29008422798220695 and parameters: {'model_type': 'graphsage', 'hidden_dims': '[512, 128]', 'dropout': 0.4630769303650382, 'batch_norm': False, 'sage_aggr': 'mean', 'sage_normalize': False, 'sage_project': False, 'lr': 1.154727425355294e-05, 'weight_decay': 4.192112040022129e-06, 'epochs': 141, 'loss': 'mse', 'optimizer': 'adam', 'graph_mode': 'knn', 'knn_k': 6, 'weighted_edges': True, 'symmetrize_mode': 'mutual', 'self_loops': True, 'use_snp_selection': True, 'num_snps': 26223}. Best is trial 132 with value: 0.293433201334795.
[I 2025-12-09 13:27:05,547] Trial 144 finished with value: 0.2862353415633604 and parameters: {'model_type': 'graphsage', 'hidden_dims': '[512, 128]', 'dropout': 0.5001000824515361, 'batch_norm': False, 'sage_aggr': 'mean', 'sage_normalize': False, 'sage_project': False, 'lr': 1.11498165778762e-05, 'weight_decay': 5.548103616160097e-06, 'epochs': 146, 'loss': 'mse', 'optimizer': 'adam', 'graph_mode': 'knn', 'knn_k': 6, 'weighted_edges': True, 'symmetrize_mode': 'mutual', 'self_loops': True, 'use_snp_selection': True, 'num_snps': 26088}. Best is trial 132 with value: 0.293433201334795.
