[I 2025-12-09 05:23:20,179] Trial 46 finished with value: 0.2662809467135462 and parameters: {'model_type': 'graphsage', 'hidden_dims': '[512, 256]', 'dropout': 0.2225721437453993, 'batch_norm': False, 'sage_aggr': 'max', 'sage_normalize': True, 'sage_project': False, 'lr': 4.3124558421675304e-05, 'weight_decay': 8.732167585203654e-06, 'epochs': 289, 'loss': 'mse', 'optimizer': 'adam', 'graph_mode': 'cutoff', 'cutoff': 0.7611674087344066, 'grm_norm': 'cosine_then_gcn', 'self_loops': False, 'use_snp_selection': True, 'num_snps': 47928}. Best is trial 45 with value: 0.2943558146606595.
[I 2025-12-09 05:26:11,223] Trial 47 finished with value: 0.29340956905996796 and parameters: {'model_type': 'graphsage', 'hidden_dims': '[512, 256]', 'dropout': 0.12996393583084284, 'batch_norm': True, 'sage_aggr': 'max', 'sage_normalize': True, 'sage_project': False, 'lr': 3.548438911576988e-05, 'weight_decay': 0.0002481709526587985, 'epochs': 341, 'loss': 'mae', 'optimizer': 'adam', 'graph_mode': 'cutoff', 'cutoff': 0.8493934269571919, 'grm_norm': 'cosine_then_gcn', 'self_loops': True, 'use_snp_selection': True, 'num_snps': 51891}. Best is trial 45 with value: 0.2943558146606595.
[I 2025-12-09 05:30:12,026] Trial 48 finished with value: 0.26418278226714154 and parameters: {'model_type': 'graphsage', 'hidden_dims': '[512, 256]', 'dropout': 0.10496686867422064, 'batch_norm': True, 'sage_aggr': 'max', 'sage_normalize': True, 'sage_project': False, 'lr': 3.588064444277504e-05, 'weight_decay': 0.0005490461273796053, 'epochs': 338, 'loss': 'mae', 'optimizer': 'adam', 'graph_mode': 'knn', 'knn_k': 7, 'weighted_edges': True, 'symmetrize_mode': 'mutual', 'self_loops': True, 'use_snp_selection': True, 'num_snps': 42416}. Best is trial 45 with value: 0.2943558146606595.
[I 2025-12-09 05:37:03,923] Trial 49 finished with value: 0.24446149095932146 and parameters: {'model_type': 'graphsage', 'hidden_dims': '[512, 256]', 'dropout': 0.14332007317834156, 'batch_norm': True, 'sage_aggr': 'max', 'sage_normalize': True, 'sage_project': False, 'lr': 1.817837752237921e-05, 'weight_decay': 0.00021691275629544658, 'epochs': 320, 'loss': 'mae', 'optimizer': 'adam', 'graph_mode': 'cutoff', 'cutoff': 0.20672202047864102, 'grm_norm': 'cosine_then_gcn', 'self_loops': True, 'use_snp_selection': True, 'num_snps': 50829}. Best is trial 45 with value: 0.2943558146606595.
[I 2025-12-09 05:38:27,889] Trial 50 finished with value: 0.15222615466131514 and parameters: {'model_type': 'graphsage', 'hidden_dims': '[512, 256]', 'dropout': 0.18878645798723925, 'batch_norm': True, 'sage_aggr': 'max', 'sage_normalize': True, 'sage_project': False, 'lr': 0.009573240843000425, 'weight_decay': 0.00044304557146333974, 'epochs': 169, 'loss': 'mae', 'optimizer': 'adam', 'graph_mode': 'cutoff', 'cutoff': 0.6656779203570704, 'grm_norm': 'cosine_then_gcn', 'self_loops': True, 'use_snp_selection': False}. Best is trial 45 with value: 0.2943558146606595.
[I 2025-12-09 05:41:13,213] Trial 51 finished with value: 0.2923092470617099 and parameters: {'model_type': 'graphsage', 'hidden_dims': '[512, 256]', 'dropout': 0.21873408907121242, 'batch_norm': True, 'sage_aggr': 'max', 'sage_normalize': True, 'sage_project': False, 'lr': 8.494797897304953e-05, 'weight_decay': 0.00015228487237156006, 'epochs': 314, 'loss': 'mae', 'optimizer': 'adam', 'graph_mode': 'cutoff', 'cutoff': 0.8437516922812917, 'grm_norm': 'cosine_then_gcn', 'self_loops': True, 'use_snp_selection': True, 'num_snps': 53938}. Best is trial 45 with value: 0.2943558146606595.
[I 2025-12-09 05:44:09,542] Trial 52 finished with value: 0.290186563660576 and parameters: {'model_type': 'graphsage', 'hidden_dims': '[512, 256]', 'dropout': 0.2330085376546246, 'batch_norm': True, 'sage_aggr': 'max', 'sage_normalize': True, 'sage_project': False, 'lr': 8.067690247848951e-05, 'weight_decay': 0.00014067568738951994, 'epochs': 349, 'loss': 'mae', 'optimizer': 'adam', 'graph_mode': 'cutoff', 'cutoff': 0.8315901970868664, 'grm_norm': 'cosine_then_gcn', 'self_loops': True, 'use_snp_selection': True, 'num_snps': 52232}. Best is trial 45 with value: 0.2943558146606595.
[I 2025-12-09 05:47:02,252] Trial 53 finished with value: 0.2972337900235421 and parameters: {'model_type': 'graphsage', 'hidden_dims': '[512, 256]', 'dropout': 0.14037525411503804, 'batch_norm': True, 'sage_aggr': 'max', 'sage_normalize': True, 'sage_project': False, 'lr': 3.6678367468966785e-05, 'weight_decay': 9.354123712436174e-05, 'epochs': 316, 'loss': 'mae', 'optimizer': 'adam', 'graph_mode': 'cutoff', 'cutoff': 0.8536816553846325, 'grm_norm': 'cosine_then_gcn', 'self_loops': True, 'use_snp_selection': True, 'num_snps': 55519}. Best is trial 53 with value: 0.2972337900235421.
[I 2025-12-09 05:49:27,639] Trial 54 finished with value: 0.29077247513004806 and parameters: {'model_type': 'graphsage', 'hidden_dims': '[512, 256]', 'dropout': 0.13772676586701293, 'batch_norm': True, 'sage_aggr': 'max', 'sage_normalize': True, 'sage_project': False, 'lr': 1.5362155303915703e-05, 'weight_decay': 9.852212722339057e-05, 'epochs': 317, 'loss': 'mae', 'optimizer': 'adam', 'graph_mode': 'cutoff', 'cutoff': 0.844802161314443, 'grm_norm': 'cosine_then_gcn', 'self_loops': True, 'use_snp_selection': True, 'num_snps': 46424}. Best is trial 53 with value: 0.2972337900235421.
[I 2025-12-09 05:52:22,951] Trial 55 finished with value: 0.2916065116315033 and parameters: {'model_type': 'graphsage', 'hidden_dims': '[512, 256]', 'dropout': 0.17266132074043025, 'batch_norm': True, 'sage_aggr': 'max', 'sage_normalize': True, 'sage_project': False, 'lr': 3.84446585542996e-05, 'weight_decay': 0.00021100469781562838, 'epochs': 329, 'loss': 'mae', 'optimizer': 'adam', 'graph_mode': 'cutoff', 'cutoff': 0.7742727217238845, 'grm_norm': 'cosine_then_gcn', 'self_loops': True, 'use_snp_selection': True, 'num_snps': 56198}. Best is trial 53 with value: 0.2972337900235421.
[I 2025-12-09 05:55:41,301] Trial 56 finished with value: 0.2589117738294788 and parameters: {'model_type': 'graphsage', 'hidden_dims': '[512, 256]', 'dropout': 0.1251119434505744, 'batch_norm': True, 'sage_aggr': 'max', 'sage_normalize': True, 'sage_project': False, 'lr': 3.2260558645323075e-05, 'weight_decay': 0.000316981337085348, 'epochs': 341, 'loss': 'mae', 'optimizer': 'adam', 'graph_mode': 'cutoff', 'cutoff': 0.31825004408683877, 'grm_norm': 'cosine_then_gcn', 'self_loops': True, 'use_snp_selection': False}. Best is trial 53 with value: 0.2972337900235421.
[I 2025-12-09 05:58:12,097] Trial 57 finished with value: 0.2921009902999914 and parameters: {'model_type': 'graphsage', 'hidden_dims': '[512, 256]', 'dropout': 0.16604304577461676, 'batch_norm': True, 'sage_aggr': 'max', 'sage_normalize': True, 'sage_project': False, 'lr': 5.321522773036152e-05, 'weight_decay': 8.259892933057561e-06, 'epochs': 287, 'loss': 'mae', 'optimizer': 'adam', 'graph_mode': 'cutoff', 'cutoff': 0.7360762264591951, 'grm_norm': 'cosine_then_gcn', 'self_loops': False, 'use_snp_selection': True, 'num_snps': 51684}. Best is trial 53 with value: 0.2972337900235421.
[I 2025-12-09 06:00:26,828] Trial 58 finished with value: 0.25128401094268576 and parameters: {'model_type': 'graphsage', 'hidden_dims': '[512, 256]', 'dropout': 0.17219709423755775, 'batch_norm': False, 'sage_aggr': 'max', 'sage_normalize': True, 'sage_project': False, 'lr': 4.8750329992650405e-05, 'weight_decay': 9.495185664822881e-06, 'epochs': 291, 'loss': 'mae', 'optimizer': 'adam', 'graph_mode': 'cutoff', 'cutoff': 0.7300632334951468, 'grm_norm': 'cosine_then_gcn', 'self_loops': False, 'use_snp_selection': False}. Best is trial 53 with value: 0.2972337900235421.
[I 2025-12-09 06:02:55,550] Trial 59 finished with value: 0.29561191527548364 and parameters: {'model_type': 'graphsage', 'hidden_dims': '[512, 256]', 'dropout': 0.2675946525568011, 'batch_norm': True, 'sage_aggr': 'max', 'sage_normalize': False, 'sage_project': False, 'lr': 2.2656893918383703e-05, 'weight_decay': 3.687936931078077e-06, 'epochs': 285, 'loss': 'mae', 'optimizer': 'adam', 'graph_mode': 'cutoff', 'cutoff': 0.5928887253122413, 'grm_norm': 'cosine_then_gcn', 'self_loops': False, 'use_snp_selection': True, 'num_snps': 50078}. Best is trial 53 with value: 0.2972337900235421.
[I 2025-12-09 06:04:41,054] Trial 60 finished with value: 0.28800171997969776 and parameters: {'model_type': 'graphsage', 'hidden_dims': '[512, 256]', 'dropout': 0.2655382136912782, 'batch_norm': True, 'sage_aggr': 'max', 'sage_normalize': False, 'sage_project': False, 'lr': 1.0822462143728865e-05, 'weight_decay': 4.183726820995008e-06, 'epochs': 265, 'loss': 'mae', 'optimizer': 'adam', 'graph_mode': 'cutoff', 'cutoff': 0.5995701940226001, 'grm_norm': 'cosine_then_gcn', 'self_loops': False, 'use_snp_selection': True, 'num_snps': 36412}. Best is trial 53 with value: 0.2972337900235421.
[I 2025-12-09 06:07:06,930] Trial 61 finished with value: 0.2968615717650018 and parameters: {'model_type': 'graphsage', 'hidden_dims': '[512, 256]', 'dropout': 0.20776625415354144, 'batch_norm': True, 'sage_aggr': 'max', 'sage_normalize': False, 'sage_project': False, 'lr': 2.065497405557248e-05, 'weight_decay': 5.018598919393334e-06, 'epochs': 279, 'loss': 'mae', 'optimizer': 'adam', 'graph_mode': 'cutoff', 'cutoff': 0.6185588826109334, 'grm_norm': 'cosine_then_gcn', 'self_loops': False, 'use_snp_selection': True, 'num_snps': 50386}. Best is trial 53 with value: 0.2972337900235421.
[I 2025-12-09 06:09:27,805] Trial 62 finished with value: 0.2841080769577601 and parameters: {'model_type': 'graphsage', 'hidden_dims': '[512, 256]', 'dropout': 0.2001006136431615, 'batch_norm': True, 'sage_aggr': 'max', 'sage_normalize': False, 'sage_project': False, 'lr': 2.2610536430148066e-05, 'weight_decay': 4.63764874394882e-06, 'epochs': 244, 'loss': 'mae', 'optimizer': 'adam', 'graph_mode': 'cutoff', 'cutoff': 0.5082732241362422, 'grm_norm': 'cosine_then_gcn', 'self_loops': False, 'use_snp_selection': True, 'num_snps': 47821}. Best is trial 53 with value: 0.2972337900235421.
[I 2025-12-09 06:12:20,473] Trial 63 finished with value: 0.29574578102209026 and parameters: {'model_type': 'graphsage', 'hidden_dims': '[512, 256]', 'dropout': 0.20331215460973473, 'batch_norm': True, 'sage_aggr': 'max', 'sage_normalize': False, 'sage_project': False, 'lr': 2.9295807137579964e-05, 'weight_decay': 1.3997727847723376e-06, 'epochs': 316, 'loss': 'mae', 'optimizer': 'adam', 'graph_mode': 'cutoff', 'cutoff': 0.632304727751287, 'grm_norm': 'cosine_then_gcn', 'self_loops': False, 'use_snp_selection': True, 'num_snps': 56250}. Best is trial 53 with value: 0.2972337900235421.
[I 2025-12-09 06:14:57,731] Trial 64 finished with value: 0.2927283165437672 and parameters: {'model_type': 'graphsage', 'hidden_dims': '[512, 256]', 'dropout': 0.24643214103965408, 'batch_norm': True, 'sage_aggr': 'max', 'sage_normalize': False, 'sage_project': False, 'lr': 1.870375183402884e-05, 'weight_decay': 1.7139732779379827e-06, 'epochs': 271, 'loss': 'mae', 'optimizer': 'adam', 'graph_mode': 'cutoff', 'cutoff': 0.6310161628564979, 'grm_norm': 'cosine_then_gcn', 'self_loops': False, 'use_snp_selection': True, 'num_snps': 56675}. Best is trial 53 with value: 0.2972337900235421.
[I 2025-12-09 06:17:34,815] Trial 65 finished with value: 0.2871993473576912 and parameters: {'model_type': 'graphsage', 'hidden_dims': '[512, 256]', 'dropout': 0.24694366883881633, 'batch_norm': True, 'sage_aggr': 'max', 'sage_normalize': False, 'sage_project': False, 'lr': 1.8477761815586484e-05, 'weight_decay': 1.233264755800033e-06, 'epochs': 269, 'loss': 'mae', 'optimizer': 'adam', 'graph_mode': 'cutoff', 'cutoff': 0.6304184260329099, 'grm_norm': 'cosine_then_gcn', 'self_loops': False, 'use_snp_selection': True, 'num_snps': 56894}. Best is trial 53 with value: 0.2972337900235421.
[I 2025-12-09 06:20:20,304] Trial 66 finished with value: 0.2915897202893603 and parameters: {'model_type': 'graphsage', 'hidden_dims': '[512, 256]', 'dropout': 0.28634184946898766, 'batch_norm': True, 'sage_aggr': 'max', 'sage_normalize': False, 'sage_project': False, 'lr': 2.64678540893217e-05, 'weight_decay': 2.039732881611872e-06, 'epochs': 282, 'loss': 'mae', 'optimizer': 'adam', 'graph_mode': 'cutoff', 'cutoff': 0.670030152086802, 'grm_norm': 'cosine_then_gcn', 'self_loops': False, 'use_snp_selection': True, 'num_snps': 57776}. Best is trial 53 with value: 0.2972337900235421.
[I 2025-12-09 06:22:35,287] Trial 67 finished with value: 0.2904365240405662 and parameters: {'model_type': 'graphsage', 'hidden_dims': '[512, 256]', 'dropout': 0.195624915992845, 'batch_norm': True, 'sage_aggr': 'max', 'sage_normalize': False, 'sage_project': False, 'lr': 1.2927855750565235e-05, 'weight_decay': 4.565735963014896e-07, 'epochs': 249, 'loss': 'mae', 'optimizer': 'adam', 'graph_mode': 'cutoff', 'cutoff': 0.6202594780886862, 'grm_norm': 'cosine_then_gcn', 'self_loops': False, 'use_snp_selection': True, 'num_snps': 50380}. Best is trial 53 with value: 0.2972337900235421.
[I 2025-12-09 06:28:31,692] Trial 68 finished with value: 0.23773644724714313 and parameters: {'model_type': 'graphsage', 'hidden_dims': '[512, 256]', 'dropout': 0.15598828296339828, 'batch_norm': True, 'sage_aggr': 'max', 'sage_normalize': False, 'sage_project': False, 'lr': 1.51014125755099e-05, 'weight_decay': 1.5915567388828094e-06, 'epochs': 327, 'loss': 'mae', 'optimizer': 'adam', 'graph_mode': 'knn', 'knn_k': 5, 'weighted_edges': False, 'symmetrize_mode': 'union', 'self_loops': False, 'use_snp_selection': True, 'num_snps': 57481}. Best is trial 53 with value: 0.2972337900235421.
[I 2025-12-09 06:30:01,386] Trial 69 finished with value: 0.29379489305781575 and parameters: {'model_type': 'graphsage', 'hidden_dims': '[512, 256]', 'dropout': 0.12298064110707028, 'batch_norm': True, 'sage_aggr': 'max', 'sage_normalize': False, 'sage_project': False, 'lr': 3.0167658846679576e-05, 'weight_decay': 9.585297893455951e-07, 'epochs': 144, 'loss': 'mae', 'optimizer': 'adam', 'graph_mode': 'cutoff', 'cutoff': 0.5597404626451699, 'grm_norm': 'gcn', 'self_loops': False, 'use_snp_selection': True, 'num_snps': 44750}. Best is trial 53 with value: 0.2972337900235421.
[I 2025-12-09 06:31:08,041] Trial 70 finished with value: 0.28197844743130807 and parameters: {'model_type': 'graphsage', 'hidden_dims': '[256, 128]', 'dropout': 0.12501068227072798, 'batch_norm': False, 'sage_aggr': 'max', 'sage_normalize': False, 'sage_project': False, 'lr': 3.235154349567241e-05, 'weight_decay': 5.729909123121388e-07, 'epochs': 137, 'loss': 'mae', 'optimizer': 'adam', 'graph_mode': 'cutoff', 'cutoff': 0.570508021069574, 'grm_norm': 'gcn', 'self_loops': False, 'use_snp_selection': True, 'num_snps': 44186}. Best is trial 53 with value: 0.2972337900235421.
[I 2025-12-09 06:33:18,276] Trial 71 finished with value: 0.27498625266253884 and parameters: {'model_type': 'graphsage', 'hidden_dims': '[512, 256]', 'dropout': 0.21184692325440949, 'batch_norm': True, 'sage_aggr': 'max', 'sage_normalize': False, 'sage_project': False, 'lr': 2.1100074713620593e-05, 'weight_decay': 2.74186425952437e-07, 'epochs': 196, 'loss': 'mae', 'optimizer': 'adam', 'graph_mode': 'cutoff', 'cutoff': 0.516929006439171, 'grm_norm': 'gcn', 'self_loops': False, 'use_snp_selection': True, 'num_snps': 50893}. Best is trial 53 with value: 0.2972337900235421.
[I 2025-12-09 06:34:40,916] Trial 72 finished with value: 0.29126385672091065 and parameters: {'model_type': 'graphsage', 'hidden_dims': '[512, 256]', 'dropout': 0.24599970508461802, 'batch_norm': True, 'sage_aggr': 'max', 'sage_normalize': False, 'sage_project': False, 'lr': 2.8591953974069534e-05, 'weight_decay': 9.66902906329923e-07, 'epochs': 112, 'loss': 'mae', 'optimizer': 'adam', 'graph_mode': 'cutoff', 'cutoff': 0.5659769120898815, 'grm_norm': 'gcn', 'self_loops': False, 'use_snp_selection': True, 'num_snps': 47992}. Best is trial 53 with value: 0.2972337900235421.
[I 2025-12-09 06:36:26,307] Trial 73 finished with value: 0.28804186035885093 and parameters: {'model_type': 'graphsage', 'hidden_dims': '[512, 256]', 'dropout': 0.12229267773303117, 'batch_norm': True, 'sage_aggr': 'max', 'sage_normalize': False, 'sage_project': False, 'lr': 1.2945872656271779e-05, 'weight_decay': 9.211482477497209e-07, 'epochs': 150, 'loss': 'mae', 'optimizer': 'adam', 'graph_mode': 'cutoff', 'cutoff': 0.6751758957378315, 'grm_norm': 'cosine_then_gcn', 'self_loops': False, 'use_snp_selection': True, 'num_snps': 55704}. Best is trial 53 with value: 0.2972337900235421.
[I 2025-12-09 06:37:46,563] Trial 74 finished with value: 0.3010413560543322 and parameters: {'model_type': 'graphsage', 'hidden_dims': '[512, 256]', 'dropout': 0.1843154241802721, 'batch_norm': True, 'sage_aggr': 'max', 'sage_normalize': False, 'sage_project': False, 'lr': 1.7479294887654846e-05, 'weight_decay': 2.823195337269933e-06, 'epochs': 78, 'loss': 'mae', 'optimizer': 'adam', 'graph_mode': 'cutoff', 'cutoff': 0.6119002987890413, 'grm_norm': 'cosine_then_gcn', 'self_loops': False, 'use_snp_selection': True, 'num_snps': 59387}. Best is trial 74 with value: 0.3010413560543322.
[I 2025-12-09 06:38:20,500] Trial 75 finished with value: 0.26011237625931494 and parameters: {'model_type': 'graphsage', 'hidden_dims': '[512, 256]', 'dropout': 0.1543685924181254, 'batch_norm': True, 'sage_aggr': 'max', 'sage_normalize': False, 'sage_project': False, 'lr': 2.403171039681644e-05, 'weight_decay': 3.0316745747550185e-06, 'epochs': 137, 'loss': 'mae', 'optimizer': 'adam', 'graph_mode': 'cutoff', 'cutoff': 0.5357567158152851, 'grm_norm': 'cosine_then_gcn', 'self_loops': False, 'use_snp_selection': True, 'num_snps': 5386}. Best is trial 74 with value: 0.3010413560543322.
[I 2025-12-09 06:39:42,995] Trial 76 finished with value: 0.29097528680558715 and parameters: {'model_type': 'graphsage', 'hidden_dims': '[512, 256]', 'dropout': 0.19471066116844765, 'batch_norm': True, 'sage_aggr': 'max', 'sage_normalize': False, 'sage_project': False, 'lr': 4.317002060055495e-05, 'weight_decay': 2.5033199787580162e-06, 'epochs': 82, 'loss': 'mae', 'optimizer': 'adam', 'graph_mode': 'cutoff', 'cutoff': 0.6076728565222603, 'grm_norm': 'cosine_then_gcn', 'self_loops': False, 'use_snp_selection': True, 'num_snps': 59998}. Best is trial 74 with value: 0.3010413560543322.
[I 2025-12-09 06:41:17,390] Trial 77 finished with value: 0.2547637355820439 and parameters: {'model_type': 'graphsage', 'hidden_dims': '[512, 256]', 'dropout': 0.18514705639276613, 'batch_norm': True, 'sage_aggr': 'max', 'sage_normalize': False, 'sage_project': False, 'lr': 1.0389751735167306e-05, 'weight_decay': 5.689392555011303e-06, 'epochs': 93, 'loss': 'mae', 'optimizer': 'adam', 'graph_mode': 'cutoff', 'cutoff': 0.46353829183810796, 'grm_norm': 'gcn', 'self_loops': False, 'use_snp_selection': True, 'num_snps': 52700}. Best is trial 74 with value: 0.3010413560543322.
[I 2025-12-09 06:42:59,114] Trial 78 finished with value: 0.30253482888050814 and parameters: {'model_type': 'graphsage', 'hidden_dims': '[512, 256]', 'dropout': 0.20604080242133557, 'batch_norm': True, 'sage_aggr': 'max', 'sage_normalize': False, 'sage_project': False, 'lr': 2.9740780038949984e-05, 'weight_decay': 4.607876984256184e-06, 'epochs': 173, 'loss': 'mae', 'optimizer': 'adam', 'graph_mode': 'cutoff', 'cutoff': 0.6956296068616692, 'grm_norm': 'cosine_then_gcn', 'self_loops': False, 'use_snp_selection': True, 'num_snps': 48583}. Best is trial 78 with value: 0.30253482888050814.
[I 2025-12-09 06:43:42,795] Trial 79 finished with value: 0.28546114242778364 and parameters: {'model_type': 'graphsage', 'hidden_dims': '[512, 256]', 'dropout': 0.2333235758808582, 'batch_norm': True, 'sage_aggr': 'max', 'sage_normalize': False, 'sage_project': False, 'lr': 0.002162867140291538, 'weight_decay': 6.798725022493747e-06, 'epochs': 55, 'loss': 'mae', 'optimizer': 'adam', 'graph_mode': 'cutoff', 'cutoff': 0.6919488793954455, 'grm_norm': 'cosine_then_gcn', 'self_loops': False, 'use_snp_selection': True, 'num_snps': 24870}. Best is trial 78 with value: 0.30253482888050814.
[I 2025-12-09 06:45:04,935] Trial 80 finished with value: 0.2578774327006859 and parameters: {'model_type': 'graphsage', 'hidden_dims': '[256, 128]', 'dropout': 0.2680036896740694, 'batch_norm': True, 'sage_aggr': 'max', 'sage_normalize': False, 'sage_project': False, 'lr': 2.7535055272028955e-05, 'weight_decay': 4.799240714307074e-06, 'epochs': 181, 'loss': 'mae', 'optimizer': 'adam', 'graph_mode': 'knn', 'knn_k': 1, 'weighted_edges': False, 'symmetrize_mode': 'union', 'self_loops': False, 'use_snp_selection': True, 'num_snps': 45539}. Best is trial 78 with value: 0.30253482888050814.
[I 2025-12-09 06:46:49,288] Trial 81 finished with value: 0.29619558290749504 and parameters: {'model_type': 'graphsage', 'hidden_dims': '[512, 256]', 'dropout': 0.20737110127792976, 'batch_norm': True, 'sage_aggr': 'max', 'sage_normalize': False, 'sage_project': False, 'lr': 3.6176705039639023e-05, 'weight_decay': 2.001734464798421e-06, 'epochs': 169, 'loss': 'mae', 'optimizer': 'adam', 'graph_mode': 'cutoff', 'cutoff': 0.5843227434048548, 'grm_norm': 'cosine_then_gcn', 'self_loops': False, 'use_snp_selection': True, 'num_snps': 49815}. Best is trial 78 with value: 0.30253482888050814.
[I 2025-12-09 06:48:16,788] Trial 82 finished with value: 0.2912257913805541 and parameters: {'model_type': 'graphsage', 'hidden_dims': '[512, 256]', 'dropout': 0.20834464198154967, 'batch_norm': True, 'sage_aggr': 'max', 'sage_normalize': False, 'sage_project': False, 'lr': 6.355463813553909e-05, 'weight_decay': 1.156823929731978e-06, 'epochs': 166, 'loss': 'mae', 'optimizer': 'adam', 'graph_mode': 'cutoff', 'cutoff': 0.5827030666798168, 'grm_norm': 'cosine_then_gcn', 'self_loops': False, 'use_snp_selection': True, 'num_snps': 40633}. Best is trial 78 with value: 0.30253482888050814.
