[I 2025-12-09 06:41:18,205] Trial 53 finished with value: 0.30998547593221926 and parameters: {'model_type': 'graphsage', 'hidden_dims': '[512, 64]', 'dropout': 0.2317436463944382, 'batch_norm': True, 'sage_aggr': 'max', 'sage_normalize': False, 'sage_project': False, 'lr': 0.0021608702067798273, 'weight_decay': 2.6428308809198426e-05, 'epochs': 112, 'loss': 'mse', 'optimizer': 'adam', 'graph_mode': 'cutoff', 'cutoff': 0.899910127228354, 'grm_norm': 'gcn', 'self_loops': True, 'use_snp_selection': False}. Best is trial 31 with value: 0.3170046826524637.
[I 2025-12-09 06:42:40,487] Trial 54 finished with value: 0.3083868128804029 and parameters: {'model_type': 'graphsage', 'hidden_dims': '[512, 64]', 'dropout': 0.1699104546456833, 'batch_norm': True, 'sage_aggr': 'max', 'sage_normalize': False, 'sage_project': False, 'lr': 0.0007957958667271875, 'weight_decay': 1.576477174074956e-05, 'epochs': 181, 'loss': 'mse', 'optimizer': 'adam', 'graph_mode': 'cutoff', 'cutoff': 0.8388393759310452, 'grm_norm': 'gcn', 'self_loops': True, 'use_snp_selection': False}. Best is trial 31 with value: 0.3170046826524637.
[I 2025-12-09 06:43:44,998] Trial 55 finished with value: 0.31449382836889894 and parameters: {'model_type': 'graphsage', 'hidden_dims': '[512, 64]', 'dropout': 0.2648540323035089, 'batch_norm': True, 'sage_aggr': 'max', 'sage_normalize': False, 'sage_project': False, 'lr': 0.007293096168969826, 'weight_decay': 2.637393539019644e-06, 'epochs': 135, 'loss': 'mse', 'optimizer': 'adam', 'graph_mode': 'cutoff', 'cutoff': 0.789800557053058, 'grm_norm': 'gcn', 'self_loops': True, 'use_snp_selection': False}. Best is trial 31 with value: 0.3170046826524637.
[I 2025-12-09 06:44:51,003] Trial 56 finished with value: 0.31452687876105206 and parameters: {'model_type': 'graphsage', 'hidden_dims': '[512, 64]', 'dropout': 0.25033303732863527, 'batch_norm': True, 'sage_aggr': 'max', 'sage_normalize': False, 'sage_project': False, 'lr': 0.007084486311102044, 'weight_decay': 3.2271303154316026e-06, 'epochs': 139, 'loss': 'mse', 'optimizer': 'adam', 'graph_mode': 'cutoff', 'cutoff': 0.8744118269174519, 'grm_norm': 'gcn', 'self_loops': True, 'use_snp_selection': False}. Best is trial 31 with value: 0.3170046826524637.
[I 2025-12-09 06:46:00,107] Trial 57 finished with value: 0.3137245231407793 and parameters: {'model_type': 'graphsage', 'hidden_dims': '[512, 64]', 'dropout': 0.25835335242150503, 'batch_norm': True, 'sage_aggr': 'max', 'sage_normalize': False, 'sage_project': False, 'lr': 0.008158012724249528, 'weight_decay': 1.521343048149379e-06, 'epochs': 147, 'loss': 'mse', 'optimizer': 'adam', 'graph_mode': 'cutoff', 'cutoff': 0.8803004118008095, 'grm_norm': 'gcn', 'self_loops': False, 'use_snp_selection': False}. Best is trial 31 with value: 0.3170046826524637.
[I 2025-12-09 06:47:14,171] Trial 58 finished with value: 0.0 and parameters: {'model_type': 'graphsage', 'hidden_dims': '[512, 64]', 'dropout': 0.2005905718245657, 'batch_norm': False, 'sage_aggr': 'max', 'sage_normalize': False, 'sage_project': False, 'lr': 0.009865162858306563, 'weight_decay': 1.2907564824234787e-06, 'epochs': 163, 'loss': 'mse', 'optimizer': 'adam', 'graph_mode': 'cutoff', 'cutoff': 0.8739426840947069, 'grm_norm': 'gcn', 'self_loops': False, 'use_snp_selection': False}. Best is trial 31 with value: 0.3170046826524637.
[I 2025-12-09 06:48:20,035] Trial 59 finished with value: 0.3112296613223914 and parameters: {'model_type': 'graphsage', 'hidden_dims': '[512, 64]', 'dropout': 0.26152358190663, 'batch_norm': True, 'sage_aggr': 'mean', 'sage_normalize': False, 'sage_project': False, 'lr': 0.007165729491789624, 'weight_decay': 3.10154722287347e-06, 'epochs': 138, 'loss': 'mse', 'optimizer': 'adam', 'graph_mode': 'cutoff', 'cutoff': 0.8992599681974296, 'grm_norm': 'gcn', 'self_loops': False, 'use_snp_selection': False}. Best is trial 31 with value: 0.3170046826524637.
[I 2025-12-09 06:49:49,270] Trial 60 finished with value: 0.309562002788704 and parameters: {'model_type': 'graphsage', 'hidden_dims': '[512, 64]', 'dropout': 0.20209662639258708, 'batch_norm': True, 'sage_aggr': 'max', 'sage_normalize': False, 'sage_project': False, 'lr': 0.008068148985866124, 'weight_decay': 1.493983127239247e-06, 'epochs': 199, 'loss': 'mse', 'optimizer': 'adam', 'graph_mode': 'cutoff', 'cutoff': 0.867604216742498, 'grm_norm': 'gcn', 'self_loops': False, 'use_snp_selection': False}. Best is trial 31 with value: 0.3170046826524637.
[I 2025-12-09 06:50:56,091] Trial 61 finished with value: 0.3114411356250851 and parameters: {'model_type': 'graphsage', 'hidden_dims': '[512, 64]', 'dropout': 0.24773360130249775, 'batch_norm': True, 'sage_aggr': 'max', 'sage_normalize': False, 'sage_project': False, 'lr': 0.0058036231742025855, 'weight_decay': 4.881323652459945e-06, 'epochs': 141, 'loss': 'mse', 'optimizer': 'adam', 'graph_mode': 'cutoff', 'cutoff': 0.810797864018082, 'grm_norm': 'gcn', 'self_loops': False, 'use_snp_selection': False}. Best is trial 31 with value: 0.3170046826524637.
[I 2025-12-09 06:52:14,927] Trial 62 finished with value: 0.31406569101384474 and parameters: {'model_type': 'graphsage', 'hidden_dims': '[512, 64]', 'dropout': 0.3013500991738018, 'batch_norm': True, 'sage_aggr': 'max', 'sage_normalize': False, 'sage_project': False, 'lr': 0.004590963731340843, 'weight_decay': 2.643037858830485e-06, 'epochs': 172, 'loss': 'mse', 'optimizer': 'adam', 'graph_mode': 'cutoff', 'cutoff': 0.8432613127532642, 'grm_norm': 'gcn', 'self_loops': False, 'use_snp_selection': False}. Best is trial 31 with value: 0.3170046826524637.
[I 2025-12-09 06:53:28,709] Trial 63 finished with value: 0.31404638816308605 and parameters: {'model_type': 'graphsage', 'hidden_dims': '[512, 64]', 'dropout': 0.29235797309485057, 'batch_norm': True, 'sage_aggr': 'max', 'sage_normalize': False, 'sage_project': False, 'lr': 0.0048537427327326665, 'weight_decay': 5.189386162025619e-07, 'epochs': 159, 'loss': 'mse', 'optimizer': 'adam', 'graph_mode': 'cutoff', 'cutoff': 0.8441543564437952, 'grm_norm': 'gcn', 'self_loops': False, 'use_snp_selection': False}. Best is trial 31 with value: 0.3170046826524637.
[I 2025-12-09 06:54:47,539] Trial 64 finished with value: 0.31485715761070593 and parameters: {'model_type': 'graphsage', 'hidden_dims': '[512, 64]', 'dropout': 0.29427899048738343, 'batch_norm': True, 'sage_aggr': 'max', 'sage_normalize': False, 'sage_project': False, 'lr': 0.004834451917362427, 'weight_decay': 5.092652959590438e-07, 'epochs': 172, 'loss': 'mse', 'optimizer': 'adam', 'graph_mode': 'cutoff', 'cutoff': 0.8532720966724519, 'grm_norm': 'gcn', 'self_loops': False, 'use_snp_selection': False}. Best is trial 31 with value: 0.3170046826524637.
[I 2025-12-09 06:56:06,133] Trial 65 finished with value: 0.31030764507449343 and parameters: {'model_type': 'graphsage', 'hidden_dims': '[512, 64]', 'dropout': 0.28672497657262674, 'batch_norm': True, 'sage_aggr': 'max', 'sage_normalize': False, 'sage_project': False, 'lr': 0.00467903471168819, 'weight_decay': 5.357282143103668e-07, 'epochs': 171, 'loss': 'mse', 'optimizer': 'adam', 'graph_mode': 'cutoff', 'cutoff': 0.8442308327418216, 'grm_norm': 'gcn', 'self_loops': False, 'use_snp_selection': False}. Best is trial 31 with value: 0.3170046826524637.
[I 2025-12-09 06:57:31,975] Trial 66 finished with value: 0.31073476429625785 and parameters: {'model_type': 'graphsage', 'hidden_dims': '[512, 64]', 'dropout': 0.30395715505148074, 'batch_norm': True, 'sage_aggr': 'max', 'sage_normalize': False, 'sage_project': False, 'lr': 0.0063671223221246675, 'weight_decay': 3.29160850263475e-07, 'epochs': 190, 'loss': 'mse', 'optimizer': 'adam', 'graph_mode': 'cutoff', 'cutoff': 0.8039147261059721, 'grm_norm': 'gcn', 'self_loops': False, 'use_snp_selection': False}. Best is trial 31 with value: 0.3170046826524637.
[I 2025-12-09 06:59:04,958] Trial 67 finished with value: 0.3134669045810513 and parameters: {'model_type': 'graphsage', 'hidden_dims': '[512, 64]', 'dropout': 0.2291707937518171, 'batch_norm': True, 'sage_aggr': 'max', 'sage_normalize': True, 'sage_project': False, 'lr': 0.005081594204652155, 'weight_decay': 8.660910337397257e-07, 'epochs': 208, 'loss': 'mse', 'optimizer': 'adam', 'graph_mode': 'cutoff', 'cutoff': 0.8276342776706862, 'grm_norm': 'gcn', 'self_loops': False, 'use_snp_selection': False}. Best is trial 31 with value: 0.3170046826524637.
[I 2025-12-09 07:00:49,187] Trial 68 finished with value: 0.29140700093102095 and parameters: {'model_type': 'graphsage', 'hidden_dims': '[512, 64]', 'dropout': 0.3004550513653811, 'batch_norm': True, 'sage_aggr': 'max', 'sage_normalize': False, 'sage_project': False, 'lr': 0.009900525033523585, 'weight_decay': 2.724795443369877e-06, 'epochs': 156, 'loss': 'mae', 'optimizer': 'adam', 'graph_mode': 'knn', 'knn_k': 5, 'weighted_edges': True, 'symmetrize_mode': 'union', 'self_loops': False, 'use_snp_selection': False}. Best is trial 31 with value: 0.3170046826524637.
[I 2025-12-09 07:02:08,139] Trial 69 finished with value: 0.31105689451593455 and parameters: {'model_type': 'graphsage', 'hidden_dims': '[512, 64]', 'dropout': 0.29197905373301, 'batch_norm': True, 'sage_aggr': 'max', 'sage_normalize': False, 'sage_project': False, 'lr': 0.003458784454536719, 'weight_decay': 3.9724929860107085e-06, 'epochs': 172, 'loss': 'mse', 'optimizer': 'adam', 'graph_mode': 'cutoff', 'cutoff': 0.7350188572266589, 'grm_norm': 'gcn', 'self_loops': False, 'use_snp_selection': False}. Best is trial 31 with value: 0.3170046826524637.
[I 2025-12-09 07:02:59,947] Trial 70 finished with value: 0.0 and parameters: {'model_type': 'graphsage', 'hidden_dims': '[512, 64]', 'dropout': 0.2670943727196139, 'batch_norm': False, 'sage_aggr': 'max', 'sage_normalize': False, 'sage_project': False, 'lr': 0.0067679680224845586, 'weight_decay': 1.032595367944407e-06, 'epochs': 219, 'loss': 'mse', 'optimizer': 'adam', 'graph_mode': 'cutoff', 'cutoff': 0.7652415741277364, 'grm_norm': 'none', 'self_loops': False, 'use_snp_selection': True, 'num_snps': 15839}. Best is trial 31 with value: 0.3170046826524637.
[I 2025-12-09 07:04:10,950] Trial 71 finished with value: 0.31730020582153445 and parameters: {'model_type': 'graphsage', 'hidden_dims': '[512, 64]', 'dropout': 0.24024440600033775, 'batch_norm': True, 'sage_aggr': 'max', 'sage_normalize': False, 'sage_project': False, 'lr': 0.007977025276697084, 'weight_decay': 1.797402257528618e-06, 'epochs': 152, 'loss': 'mse', 'optimizer': 'adam', 'graph_mode': 'cutoff', 'cutoff': 0.8678510628653873, 'grm_norm': 'gcn', 'self_loops': False, 'use_snp_selection': False}. Best is trial 71 with value: 0.31730020582153445.
[I 2025-12-09 07:05:36,314] Trial 72 finished with value: 0.3101892686194945 and parameters: {'model_type': 'graphsage', 'hidden_dims': '[512, 64]', 'dropout': 0.21551759746193935, 'batch_norm': True, 'sage_aggr': 'max', 'sage_normalize': False, 'sage_project': False, 'lr': 0.005126954572897794, 'weight_decay': 2.111084602390437e-06, 'epochs': 189, 'loss': 'mse', 'optimizer': 'adam', 'graph_mode': 'cutoff', 'cutoff': 0.8526896653993379, 'grm_norm': 'gcn', 'self_loops': False, 'use_snp_selection': False}. Best is trial 71 with value: 0.31730020582153445.
[I 2025-12-09 07:06:47,737] Trial 73 finished with value: 0.312704003562364 and parameters: {'model_type': 'graphsage', 'hidden_dims': '[512, 64]', 'dropout': 0.1708159448751892, 'batch_norm': True, 'sage_aggr': 'max', 'sage_normalize': False, 'sage_project': False, 'lr': 0.0039807963899399805, 'weight_decay': 2.4082107359590164e-07, 'epochs': 153, 'loss': 'mse', 'optimizer': 'adam', 'graph_mode': 'cutoff', 'cutoff': 0.7971029208008229, 'grm_norm': 'gcn', 'self_loops': False, 'use_snp_selection': False}. Best is trial 71 with value: 0.31730020582153445.
[I 2025-12-09 07:07:51,106] Trial 74 finished with value: 0.3130133856787304 and parameters: {'model_type': 'graphsage', 'hidden_dims': '[512, 64]', 'dropout': 0.2421406730512241, 'batch_norm': True, 'sage_aggr': 'max', 'sage_normalize': False, 'sage_project': False, 'lr': 0.008169574793593409, 'weight_decay': 7.191592375685207e-07, 'epochs': 132, 'loss': 'mse', 'optimizer': 'adam', 'graph_mode': 'cutoff', 'cutoff': 0.8484253424896686, 'grm_norm': 'gcn', 'self_loops': False, 'use_snp_selection': False}. Best is trial 71 with value: 0.31730020582153445.
[I 2025-12-09 07:08:38,021] Trial 75 finished with value: 0.3094614599992001 and parameters: {'model_type': 'graphsage', 'hidden_dims': '[256, 128, 64]', 'dropout': 0.26797554453706013, 'batch_norm': True, 'sage_aggr': 'max', 'sage_normalize': False, 'sage_project': False, 'lr': 7.302801795834574e-05, 'weight_decay': 1.9027923081956918e-06, 'epochs': 172, 'loss': 'mse', 'optimizer': 'adam', 'graph_mode': 'cutoff', 'cutoff': 0.8177899961257873, 'grm_norm': 'gcn', 'self_loops': False, 'use_snp_selection': False}. Best is trial 71 with value: 0.31730020582153445.
[I 2025-12-09 07:09:50,914] Trial 76 finished with value: 0.31793588769783154 and parameters: {'model_type': 'graphsage', 'hidden_dims': '[512, 64]', 'dropout': 0.3151409157957315, 'batch_norm': True, 'sage_aggr': 'max', 'sage_normalize': False, 'sage_project': False, 'lr': 0.0030764794263821904, 'weight_decay': 7.812216402787587e-06, 'epochs': 157, 'loss': 'mse', 'optimizer': 'adam', 'graph_mode': 'cutoff', 'cutoff': 0.8774817309257837, 'grm_norm': 'gcn', 'self_loops': False, 'use_snp_selection': False}. Best is trial 76 with value: 0.31793588769783154.
[I 2025-12-09 07:10:48,331] Trial 77 finished with value: 0.31131141843600135 and parameters: {'model_type': 'graphsage', 'hidden_dims': '[512, 64]', 'dropout': 0.3161290551139974, 'batch_norm': True, 'sage_aggr': 'max', 'sage_normalize': False, 'sage_project': False, 'lr': 0.0028228009463484435, 'weight_decay': 7.015149532914822e-06, 'epochs': 117, 'loss': 'mse', 'optimizer': 'adam', 'graph_mode': 'cutoff', 'cutoff': 0.8807916971721302, 'grm_norm': 'gcn', 'self_loops': False, 'use_snp_selection': False}. Best is trial 76 with value: 0.31793588769783154.
[I 2025-12-09 07:11:15,546] Trial 78 finished with value: 0.3071254859903644 and parameters: {'model_type': 'graphsage', 'hidden_dims': '[128, 64]', 'dropout': 0.34978446997635004, 'batch_norm': True, 'sage_aggr': 'mean', 'sage_normalize': False, 'sage_project': False, 'lr': 0.005934677823553654, 'weight_decay': 9.371031654732255e-06, 'epochs': 134, 'loss': 'mse', 'optimizer': 'adam', 'graph_mode': 'cutoff', 'cutoff': 0.6754613038200963, 'grm_norm': 'gcn', 'self_loops': False, 'use_snp_selection': False}. Best is trial 76 with value: 0.31793588769783154.
[I 2025-12-09 07:12:24,828] Trial 79 finished with value: 0.2958722839959467 and parameters: {'model_type': 'graphsage', 'hidden_dims': '[512, 64]', 'dropout': 0.11420565327277696, 'batch_norm': True, 'sage_aggr': 'max', 'sage_normalize': False, 'sage_project': False, 'lr': 0.0033950646101040373, 'weight_decay': 3.7305889553740233e-06, 'epochs': 122, 'loss': 'mse', 'optimizer': 'adam', 'graph_mode': 'cutoff', 'cutoff': 0.43956663488126496, 'grm_norm': 'gcn', 'self_loops': False, 'use_snp_selection': False}. Best is trial 76 with value: 0.31793588769783154.
[I 2025-12-09 07:14:24,710] Trial 80 finished with value: 0.2467094079786504 and parameters: {'model_type': 'graphsage', 'hidden_dims': '[512, 64]', 'dropout': 0.21687488270831765, 'batch_norm': True, 'sage_aggr': 'max', 'sage_normalize': True, 'sage_project': False, 'lr': 0.007267573724797314, 'weight_decay': 1.331446552870447e-05, 'epochs': 286, 'loss': 'mae', 'optimizer': 'adam', 'graph_mode': 'knn', 'knn_k': 1, 'weighted_edges': True, 'symmetrize_mode': 'mutual', 'self_loops': False, 'use_snp_selection': False}. Best is trial 76 with value: 0.31793588769783154.
[I 2025-12-09 07:15:38,422] Trial 81 finished with value: 0.3123009284291919 and parameters: {'model_type': 'graphsage', 'hidden_dims': '[512, 64]', 'dropout': 0.27660309172435676, 'batch_norm': True, 'sage_aggr': 'max', 'sage_normalize': False, 'sage_project': False, 'lr': 0.004285556482800182, 'weight_decay': 7.000278144586771e-06, 'epochs': 159, 'loss': 'mse', 'optimizer': 'adam', 'graph_mode': 'cutoff', 'cutoff': 0.8578962102832661, 'grm_norm': 'gcn', 'self_loops': False, 'use_snp_selection': False}. Best is trial 76 with value: 0.31793588769783154.
[I 2025-12-09 07:16:32,859] Trial 82 finished with value: 0.31075235375685717 and parameters: {'model_type': 'graphsage', 'hidden_dims': '[512, 64]', 'dropout': 0.2997192713311987, 'batch_norm': True, 'sage_aggr': 'max', 'sage_normalize': False, 'sage_project': False, 'lr': 0.005605250446814629, 'weight_decay': 6.043066945412146e-07, 'epochs': 109, 'loss': 'mse', 'optimizer': 'adam', 'graph_mode': 'cutoff', 'cutoff': 0.8822779632757574, 'grm_norm': 'gcn', 'self_loops': False, 'use_snp_selection': False}. Best is trial 76 with value: 0.31793588769783154.
[I 2025-12-09 07:17:53,586] Trial 83 finished with value: 0.313015408601532 and parameters: {'model_type': 'graphsage', 'hidden_dims': '[512, 64]', 'dropout': 0.31763033604230045, 'batch_norm': True, 'sage_aggr': 'max', 'sage_normalize': False, 'sage_project': False, 'lr': 0.0029514179913592425, 'weight_decay': 1.031695759738163e-06, 'epochs': 177, 'loss': 'mse', 'optimizer': 'adam', 'graph_mode': 'cutoff', 'cutoff': 0.7791901404247945, 'grm_norm': 'gcn', 'self_loops': False, 'use_snp_selection': False}. Best is trial 76 with value: 0.31793588769783154.
[I 2025-12-09 07:19:04,482] Trial 84 finished with value: 0.31043699942963887 and parameters: {'model_type': 'graphsage', 'hidden_dims': '[512, 256]', 'dropout': 0.24243639626990793, 'batch_norm': True, 'sage_aggr': 'max', 'sage_normalize': False, 'sage_project': False, 'lr': 0.004115727555860185, 'weight_decay': 5.621527325000868e-06, 'epochs': 151, 'loss': 'mse', 'optimizer': 'adam', 'graph_mode': 'cutoff', 'cutoff': 0.8246748346065761, 'grm_norm': 'gcn', 'self_loops': False, 'use_snp_selection': False}. Best is trial 76 with value: 0.31793588769783154.
[I 2025-12-09 07:21:34,705] Trial 85 finished with value: 0.2977756274489087 and parameters: {'model_type': 'graphsage', 'hidden_dims': '[512, 128]', 'dropout': 0.33963991885243455, 'batch_norm': True, 'sage_aggr': 'max', 'sage_normalize': False, 'sage_project': False, 'lr': 0.00852830041619732, 'weight_decay': 2.6327840061952714e-06, 'epochs': 165, 'loss': 'mse', 'optimizer': 'adam', 'graph_mode': 'cutoff', 'cutoff': 0.2006766533326792, 'grm_norm': 'gcn', 'self_loops': False, 'use_snp_selection': False}. Best is trial 76 with value: 0.31793588769783154.
[I 2025-12-09 07:23:33,267] Trial 86 finished with value: 0.31086436249215765 and parameters: {'model_type': 'graphsage', 'hidden_dims': '[512, 64]', 'dropout': 0.290945581838278, 'batch_norm': True, 'sage_aggr': 'max', 'sage_normalize': False, 'sage_project': False, 'lr': 0.004965524619676322, 'weight_decay': 1.854599575337479e-06, 'epochs': 186, 'loss': 'mse', 'optimizer': 'adam', 'graph_mode': 'cutoff', 'cutoff': 0.8383241406703948, 'grm_norm': 'none', 'self_loops': False, 'use_snp_selection': True, 'num_snps': 58998}. Best is trial 76 with value: 0.31793588769783154.
[I 2025-12-09 07:24:40,214] Trial 87 finished with value: 0.0 and parameters: {'model_type': 'graphsage', 'hidden_dims': '[512, 64]', 'dropout': 0.25927827457661307, 'batch_norm': False, 'sage_aggr': 'max', 'sage_normalize': False, 'sage_project': False, 'lr': 0.0067203906555691716, 'weight_decay': 1.3572434712325464e-07, 'epochs': 144, 'loss': 'mse', 'optimizer': 'adam', 'graph_mode': 'cutoff', 'cutoff': 0.8010724847143716, 'grm_norm': 'gcn', 'self_loops': True, 'use_snp_selection': False}. Best is trial 76 with value: 0.31793588769783154.
[I 2025-12-09 07:25:29,946] Trial 88 finished with value: 0.31211937908693377 and parameters: {'model_type': 'graphsage', 'hidden_dims': '[512, 64]', 'dropout': 0.3654503012161056, 'batch_norm': True, 'sage_aggr': 'max', 'sage_normalize': False, 'sage_project': False, 'lr': 0.003694904155868876, 'weight_decay': 3.967980059959945e-06, 'epochs': 97, 'loss': 'mse', 'optimizer': 'adam', 'graph_mode': 'cutoff', 'cutoff': 0.8718241606403911, 'grm_norm': 'gcn', 'self_loops': True, 'use_snp_selection': False}. Best is trial 76 with value: 0.31793588769783154.
[I 2025-12-09 07:26:46,089] Trial 89 finished with value: 0.3085326717058286 and parameters: {'model_type': 'graphsage', 'hidden_dims': '[256, 128, 64]', 'dropout': 0.2737005227638779, 'batch_norm': True, 'sage_aggr': 'max', 'sage_normalize': False, 'sage_project': False, 'lr': 0.002470524216682682, 'weight_decay': 2.6613172445614516e-07, 'epochs': 309, 'loss': 'mse', 'optimizer': 'adam', 'graph_mode': 'cutoff', 'cutoff': 0.8993417925599387, 'grm_norm': 'gcn', 'self_loops': False, 'use_snp_selection': False}. Best is trial 76 with value: 0.31793588769783154.
[I 2025-12-09 07:28:00,607] Trial 90 finished with value: 0.30731252164931977 and parameters: {'model_type': 'graphsage', 'hidden_dims': '[512, 64]', 'dropout': 0.3106285684381185, 'batch_norm': True, 'sage_aggr': 'mean', 'sage_normalize': False, 'sage_project': False, 'lr': 4.664918749373849e-05, 'weight_decay': 4.303454138437617e-07, 'epochs': 160, 'loss': 'mse', 'optimizer': 'adam', 'graph_mode': 'cutoff', 'cutoff': 0.7695263315147944, 'grm_norm': 'gcn', 'self_loops': True, 'use_snp_selection': False}. Best is trial 76 with value: 0.31793588769783154.
[I 2025-12-09 07:29:09,706] Trial 91 finished with value: 0.3089363613899968 and parameters: {'model_type': 'graphsage', 'hidden_dims': '[512, 64]', 'dropout': 0.2523740325562672, 'batch_norm': True, 'sage_aggr': 'max', 'sage_normalize': False, 'sage_project': False, 'lr': 0.009132578351002148, 'weight_decay': 1.344263667548333e-06, 'epochs': 147, 'loss': 'mse', 'optimizer': 'adam', 'graph_mode': 'cutoff', 'cutoff': 0.8845799081630619, 'grm_norm': 'gcn', 'self_loops': False, 'use_snp_selection': False}. Best is trial 76 with value: 0.31793588769783154.
