[I 2025-12-09 07:30:14,528] Trial 92 finished with value: 0.31328296951897705 and parameters: {'model_type': 'graphsage', 'hidden_dims': '[512, 64]', 'dropout': 0.29131611993825546, 'batch_norm': True, 'sage_aggr': 'max', 'sage_normalize': False, 'sage_project': False, 'lr': 0.008031523523009664, 'weight_decay': 1.7788367698046223e-06, 'epochs': 136, 'loss': 'mse', 'optimizer': 'adam', 'graph_mode': 'cutoff', 'cutoff': 0.8575792138605339, 'grm_norm': 'gcn', 'self_loops': False, 'use_snp_selection': False}. Best is trial 76 with value: 0.31793588769783154.
[I 2025-12-09 07:31:36,054] Trial 93 finished with value: 0.31511482844260513 and parameters: {'model_type': 'graphsage', 'hidden_dims': '[512, 64]', 'dropout': 0.23637474835888622, 'batch_norm': True, 'sage_aggr': 'max', 'sage_normalize': False, 'sage_project': False, 'lr': 0.005898360975402665, 'weight_decay': 3.251438899835681e-06, 'epochs': 179, 'loss': 'mse', 'optimizer': 'adam', 'graph_mode': 'cutoff', 'cutoff': 0.8192593802392217, 'grm_norm': 'gcn', 'self_loops': False, 'use_snp_selection': False}. Best is trial 76 with value: 0.31793588769783154.
[I 2025-12-09 07:33:04,528] Trial 94 finished with value: 0.31291676556306147 and parameters: {'model_type': 'graphsage', 'hidden_dims': '[512, 64]', 'dropout': 0.23719493384632415, 'batch_norm': True, 'sage_aggr': 'max', 'sage_normalize': False, 'sage_project': False, 'lr': 0.005824624928384363, 'weight_decay': 3.302209551894342e-06, 'epochs': 197, 'loss': 'mse', 'optimizer': 'adam', 'graph_mode': 'cutoff', 'cutoff': 0.817906304330819, 'grm_norm': 'gcn', 'self_loops': False, 'use_snp_selection': False}. Best is trial 76 with value: 0.31793588769783154.
[I 2025-12-09 07:33:37,465] Trial 95 finished with value: 0.3073940798717948 and parameters: {'model_type': 'graphsage', 'hidden_dims': '[128, 64]', 'dropout': 0.21218275562659816, 'batch_norm': True, 'sage_aggr': 'max', 'sage_normalize': False, 'sage_project': False, 'lr': 0.0046342367546243265, 'weight_decay': 2.5232263966505123e-06, 'epochs': 182, 'loss': 'mse', 'optimizer': 'adam', 'graph_mode': 'cutoff', 'cutoff': 0.7424096018906357, 'grm_norm': 'gcn', 'self_loops': False, 'use_snp_selection': False}. Best is trial 76 with value: 0.31793588769783154.
[I 2025-12-09 07:34:54,717] Trial 96 finished with value: 0.31548906580247993 and parameters: {'model_type': 'graphsage', 'hidden_dims': '[512, 64]', 'dropout': 0.3304087646580267, 'batch_norm': True, 'sage_aggr': 'max', 'sage_normalize': False, 'sage_project': False, 'lr': 0.00677369334433797, 'weight_decay': 5.036758763761992e-06, 'epochs': 168, 'loss': 'mse', 'optimizer': 'adam', 'graph_mode': 'cutoff', 'cutoff': 0.789717620796594, 'grm_norm': 'none', 'self_loops': True, 'use_snp_selection': False}. Best is trial 76 with value: 0.31793588769783154.
[I 2025-12-09 07:38:04,209] Trial 97 finished with value: 0.2856640168747502 and parameters: {'model_type': 'graphsage', 'hidden_dims': '[512, 64]', 'dropout': 0.19118017341179333, 'batch_norm': True, 'sage_aggr': 'max', 'sage_normalize': True, 'sage_project': False, 'lr': 0.007166154037390491, 'weight_decay': 8.706297060672464e-06, 'epochs': 212, 'loss': 'mae', 'optimizer': 'adam', 'graph_mode': 'knn', 'knn_k': 8, 'weighted_edges': False, 'symmetrize_mode': 'union', 'self_loops': True, 'use_snp_selection': False}. Best is trial 76 with value: 0.31793588769783154.
[I 2025-12-09 07:39:22,614] Trial 98 finished with value: 0.3094935531384003 and parameters: {'model_type': 'graphsage', 'hidden_dims': '[512, 256]', 'dropout': 0.3325682882277422, 'batch_norm': True, 'sage_aggr': 'max', 'sage_normalize': False, 'sage_project': False, 'lr': 0.006153334604196396, 'weight_decay': 5.055429146565284e-06, 'epochs': 170, 'loss': 'mse', 'optimizer': 'adam', 'graph_mode': 'cutoff', 'cutoff': 0.7866579002413369, 'grm_norm': 'none', 'self_loops': True, 'use_snp_selection': False}. Best is trial 76 with value: 0.31793588769783154.
[I 2025-12-09 07:40:06,848] Trial 99 finished with value: 0.2948192479001402 and parameters: {'model_type': 'graphsage', 'hidden_dims': '[512, 128]', 'dropout': 0.18330220175484124, 'batch_norm': True, 'sage_aggr': 'max', 'sage_normalize': False, 'sage_project': False, 'lr': 0.0029492767603976244, 'weight_decay': 5.779217623384023e-06, 'epochs': 178, 'loss': 'mse', 'optimizer': 'adam', 'graph_mode': 'cutoff', 'cutoff': 0.8652034376351719, 'grm_norm': 'none', 'self_loops': True, 'use_snp_selection': True, 'num_snps': 13096}. Best is trial 76 with value: 0.31793588769783154.
[I 2025-12-09 07:41:00,680] Trial 100 finished with value: 0.30196855759188956 and parameters: {'model_type': 'graphsage', 'hidden_dims': '[512, 64]', 'dropout': 0.38292793311141926, 'batch_norm': False, 'sage_aggr': 'max', 'sage_normalize': False, 'sage_project': False, 'lr': 1.2843713735967391e-05, 'weight_decay': 1.279024139978872e-05, 'epochs': 109, 'loss': 'mse', 'optimizer': 'adam', 'graph_mode': 'cutoff', 'cutoff': 0.7272592261319752, 'grm_norm': 'none', 'self_loops': True, 'use_snp_selection': False}. Best is trial 76 with value: 0.31793588769783154.
[I 2025-12-09 07:42:12,519] Trial 101 finished with value: 0.3126361684127387 and parameters: {'model_type': 'graphsage', 'hidden_dims': '[512, 64]', 'dropout': 0.27262320141072566, 'batch_norm': True, 'sage_aggr': 'max', 'sage_normalize': False, 'sage_project': False, 'lr': 0.0051875105762582575, 'weight_decay': 4.471580659228961e-06, 'epochs': 154, 'loss': 'mse', 'optimizer': 'adam', 'graph_mode': 'cutoff', 'cutoff': 0.8385999534587402, 'grm_norm': 'none', 'self_loops': True, 'use_snp_selection': False}. Best is trial 76 with value: 0.31793588769783154.
[I 2025-12-09 07:43:28,275] Trial 102 finished with value: 0.3142716855635797 and parameters: {'model_type': 'graphsage', 'hidden_dims': '[512, 64]', 'dropout': 0.29774924363183164, 'batch_norm': True, 'sage_aggr': 'max', 'sage_normalize': False, 'sage_project': False, 'lr': 0.0038610866435146267, 'weight_decay': 2.311337940198171e-06, 'epochs': 164, 'loss': 'mse', 'optimizer': 'adam', 'graph_mode': 'cutoff', 'cutoff': 0.8148154707194579, 'grm_norm': 'gcn', 'self_loops': True, 'use_snp_selection': False}. Best is trial 76 with value: 0.31793588769783154.
[I 2025-12-09 07:44:44,840] Trial 103 finished with value: 0.31244170544326655 and parameters: {'model_type': 'graphsage', 'hidden_dims': '[512, 64]', 'dropout': 0.3193046545046909, 'batch_norm': True, 'sage_aggr': 'max', 'sage_normalize': False, 'sage_project': False, 'lr': 0.0032779729917133994, 'weight_decay': 3.435749675863028e-06, 'epochs': 166, 'loss': 'mse', 'optimizer': 'adam', 'graph_mode': 'cutoff', 'cutoff': 0.8132844555651191, 'grm_norm': 'gcn', 'self_loops': True, 'use_snp_selection': False}. Best is trial 76 with value: 0.31793588769783154.
[I 2025-12-09 07:46:09,914] Trial 104 finished with value: 0.3148964326410849 and parameters: {'model_type': 'graphsage', 'hidden_dims': '[512, 64]', 'dropout': 0.33978827612857676, 'batch_norm': True, 'sage_aggr': 'max', 'sage_normalize': False, 'sage_project': False, 'lr': 0.003955952065006582, 'weight_decay': 1.9959788711757126e-05, 'epochs': 188, 'loss': 'mse', 'optimizer': 'adam', 'graph_mode': 'cutoff', 'cutoff': 0.7931419307504788, 'grm_norm': 'gcn', 'self_loops': True, 'use_snp_selection': False}. Best is trial 76 with value: 0.31793588769783154.
[I 2025-12-09 07:47:36,547] Trial 105 finished with value: 0.30921713439993936 and parameters: {'model_type': 'graphsage', 'hidden_dims': '[512, 64]', 'dropout': 0.36592489672583817, 'batch_norm': True, 'sage_aggr': 'max', 'sage_normalize': False, 'sage_project': False, 'lr': 0.0018936939680987638, 'weight_decay': 2.1579531888260894e-05, 'epochs': 192, 'loss': 'mse', 'optimizer': 'adam', 'graph_mode': 'cutoff', 'cutoff': 0.7634062505605277, 'grm_norm': 'gcn', 'self_loops': True, 'use_snp_selection': False}. Best is trial 76 with value: 0.31793588769783154.
[I 2025-12-09 07:48:57,755] Trial 106 finished with value: 0.3096638234071203 and parameters: {'model_type': 'graphsage', 'hidden_dims': '[512, 64]', 'dropout': 0.3363601257248418, 'batch_norm': True, 'sage_aggr': 'max', 'sage_normalize': False, 'sage_project': False, 'lr': 0.003917854178328745, 'weight_decay': 8.11810260140918e-06, 'epochs': 178, 'loss': 'mse', 'optimizer': 'adam', 'graph_mode': 'cutoff', 'cutoff': 0.7820732870070884, 'grm_norm': 'none', 'self_loops': True, 'use_snp_selection': False}. Best is trial 76 with value: 0.31793588769783154.
[I 2025-12-09 07:49:58,610] Trial 107 finished with value: 0.3142070431451941 and parameters: {'model_type': 'graphsage', 'hidden_dims': '[512, 64]', 'dropout': 0.2815416072554329, 'batch_norm': True, 'sage_aggr': 'max', 'sage_normalize': False, 'sage_project': False, 'lr': 0.007330317317368008, 'weight_decay': 1.7933349389887975e-05, 'epochs': 123, 'loss': 'mse', 'optimizer': 'adam', 'graph_mode': 'cutoff', 'cutoff': 0.753826500239358, 'grm_norm': 'cosine_then_gcn', 'self_loops': True, 'use_snp_selection': False}. Best is trial 76 with value: 0.31793588769783154.
[I 2025-12-09 07:51:30,109] Trial 108 finished with value: 0.3064931670310508 and parameters: {'model_type': 'graphsage', 'hidden_dims': '[512, 64]', 'dropout': 0.32286279208802277, 'batch_norm': True, 'sage_aggr': 'max', 'sage_normalize': False, 'sage_project': False, 'lr': 0.00038862911000798735, 'weight_decay': 1.1602590886516665e-05, 'epochs': 202, 'loss': 'mse', 'optimizer': 'adam', 'graph_mode': 'cutoff', 'cutoff': 0.6267852860461752, 'grm_norm': 'gcn', 'self_loops': True, 'use_snp_selection': False}. Best is trial 76 with value: 0.31793588769783154.
[I 2025-12-09 07:51:57,853] Trial 109 finished with value: 0.30886949276744136 and parameters: {'model_type': 'graphsage', 'hidden_dims': '[256, 128, 64]', 'dropout': 0.3570957124082291, 'batch_norm': True, 'sage_aggr': 'mean', 'sage_normalize': False, 'sage_project': False, 'lr': 0.0024694975860417214, 'weight_decay': 6.6881596966069145e-06, 'epochs': 81, 'loss': 'mse', 'optimizer': 'adam', 'graph_mode': 'cutoff', 'cutoff': 0.7953784011252854, 'grm_norm': 'gcn', 'self_loops': True, 'use_snp_selection': False}. Best is trial 76 with value: 0.31793588769783154.
[I 2025-12-09 07:53:23,410] Trial 110 finished with value: 0.3122789769516845 and parameters: {'model_type': 'graphsage', 'hidden_dims': '[512, 64]', 'dropout': 0.25592635044968964, 'batch_norm': True, 'sage_aggr': 'max', 'sage_normalize': False, 'sage_project': False, 'lr': 1.0051205212777255e-05, 'weight_decay': 3.23724844614611e-05, 'epochs': 187, 'loss': 'mse', 'optimizer': 'adam', 'graph_mode': 'cutoff', 'cutoff': 0.8246498953754866, 'grm_norm': 'cosine', 'self_loops': True, 'use_snp_selection': False}. Best is trial 76 with value: 0.31793588769783154.
[I 2025-12-09 07:54:25,023] Trial 111 finished with value: 0.3156506163348934 and parameters: {'model_type': 'graphsage', 'hidden_dims': '[512, 64]', 'dropout': 0.22375377559757526, 'batch_norm': True, 'sage_aggr': 'max', 'sage_normalize': False, 'sage_project': False, 'lr': 0.007086853755214848, 'weight_decay': 1.9155373528890875e-05, 'epochs': 125, 'loss': 'mse', 'optimizer': 'adam', 'graph_mode': 'cutoff', 'cutoff': 0.7575770375092865, 'grm_norm': 'cosine_then_gcn', 'self_loops': True, 'use_snp_selection': False}. Best is trial 76 with value: 0.31793588769783154.
[I 2025-12-09 07:55:28,142] Trial 112 finished with value: 0.3104652813889335 and parameters: {'model_type': 'graphsage', 'hidden_dims': '[512, 64]', 'dropout': 0.2326338966894961, 'batch_norm': True, 'sage_aggr': 'max', 'sage_normalize': False, 'sage_project': False, 'lr': 0.009173577939811045, 'weight_decay': 2.1088727211903843e-05, 'epochs': 129, 'loss': 'mse', 'optimizer': 'adam', 'graph_mode': 'cutoff', 'cutoff': 0.8039256951407198, 'grm_norm': 'cosine_then_gcn', 'self_loops': True, 'use_snp_selection': False}. Best is trial 76 with value: 0.31793588769783154.
[I 2025-12-09 07:56:35,925] Trial 113 finished with value: 0.3125262901193745 and parameters: {'model_type': 'graphsage', 'hidden_dims': '[512, 64]', 'dropout': 0.26570876553002176, 'batch_norm': True, 'sage_aggr': 'max', 'sage_normalize': False, 'sage_project': False, 'lr': 0.006271631214860385, 'weight_decay': 2.1694137916062364e-06, 'epochs': 141, 'loss': 'mse', 'optimizer': 'adam', 'graph_mode': 'cutoff', 'cutoff': 0.7140832191215025, 'grm_norm': 'cosine_then_gcn', 'self_loops': True, 'use_snp_selection': False}. Best is trial 76 with value: 0.31793588769783154.
[I 2025-12-09 07:57:25,540] Trial 114 finished with value: 0.3096265672413915 and parameters: {'model_type': 'graphsage', 'hidden_dims': '[512, 64]', 'dropout': 0.2261480205492928, 'batch_norm': True, 'sage_aggr': 'max', 'sage_normalize': False, 'sage_project': False, 'lr': 0.00550899473020324, 'weight_decay': 2.9285507578635617e-06, 'epochs': 94, 'loss': 'mse', 'optimizer': 'adam', 'graph_mode': 'cutoff', 'cutoff': 0.7749020414145786, 'grm_norm': 'cosine_then_gcn', 'self_loops': True, 'use_snp_selection': False}. Best is trial 76 with value: 0.31793588769783154.
[I 2025-12-09 07:59:08,587] Trial 115 finished with value: 0.3113057234557599 and parameters: {'model_type': 'graphsage', 'hidden_dims': '[512, 64]', 'dropout': 0.24393968364649343, 'batch_norm': True, 'sage_aggr': 'max', 'sage_normalize': False, 'sage_project': False, 'lr': 0.004241958888262689, 'weight_decay': 1.0518764236055827e-05, 'epochs': 232, 'loss': 'mse', 'optimizer': 'adam', 'graph_mode': 'cutoff', 'cutoff': 0.8590029463390991, 'grm_norm': 'cosine_then_gcn', 'self_loops': True, 'use_snp_selection': False}. Best is trial 76 with value: 0.31793588769783154.
[I 2025-12-09 08:00:59,040] Trial 116 finished with value: 0.2890129297732068 and parameters: {'model_type': 'graphsage', 'hidden_dims': '[128, 64]', 'dropout': 0.30881966274885997, 'batch_norm': True, 'sage_aggr': 'max', 'sage_normalize': True, 'sage_project': False, 'lr': 0.0035919570240799427, 'weight_decay': 1.5806646175177772e-05, 'epochs': 149, 'loss': 'mae', 'optimizer': 'adam', 'graph_mode': 'knn', 'knn_k': 10, 'weighted_edges': True, 'symmetrize_mode': 'union', 'self_loops': True, 'use_snp_selection': False}. Best is trial 76 with value: 0.31793588769783154.
[I 2025-12-09 08:01:57,216] Trial 117 finished with value: 0.3144648903944982 and parameters: {'model_type': 'graphsage', 'hidden_dims': '[512, 64]', 'dropout': 0.2109091171638855, 'batch_norm': True, 'sage_aggr': 'max', 'sage_normalize': False, 'sage_project': False, 'lr': 0.007573853198838001, 'weight_decay': 4.373332948255272e-06, 'epochs': 119, 'loss': 'mse', 'optimizer': 'adam', 'graph_mode': 'cutoff', 'cutoff': 0.8292865692026474, 'grm_norm': 'gcn', 'self_loops': True, 'use_snp_selection': False}. Best is trial 76 with value: 0.31793588769783154.
[I 2025-12-09 08:02:49,938] Trial 118 finished with value: 0.3157595804376474 and parameters: {'model_type': 'graphsage', 'hidden_dims': '[512, 64]', 'dropout': 0.2054781054166808, 'batch_norm': True, 'sage_aggr': 'max', 'sage_normalize': False, 'sage_project': False, 'lr': 0.007556380133320885, 'weight_decay': 5.1580287165522905e-05, 'epochs': 105, 'loss': 'mse', 'optimizer': 'adam', 'graph_mode': 'cutoff', 'cutoff': 0.8875004333454103, 'grm_norm': 'gcn', 'self_loops': True, 'use_snp_selection': False}. Best is trial 76 with value: 0.31793588769783154.
[I 2025-12-09 08:03:54,359] Trial 119 finished with value: 0.3070459987718554 and parameters: {'model_type': 'graphsage', 'hidden_dims': '[512, 64]', 'dropout': 0.1868991340720026, 'batch_norm': True, 'sage_aggr': 'max', 'sage_normalize': False, 'sage_project': False, 'lr': 0.00978016513150325, 'weight_decay': 4.546838574880751e-05, 'epochs': 102, 'loss': 'mse', 'optimizer': 'adam', 'graph_mode': 'cutoff', 'cutoff': 0.8878973073985574, 'grm_norm': 'gcn', 'self_loops': True, 'use_snp_selection': True, 'num_snps': 40648}. Best is trial 76 with value: 0.31793588769783154.
[I 2025-12-09 08:04:47,888] Trial 120 finished with value: 0.04666160869968504 and parameters: {'model_type': 'graphsage', 'hidden_dims': '[512, 256]', 'dropout': 0.1503032044650348, 'batch_norm': False, 'sage_aggr': 'max', 'sage_normalize': False, 'sage_project': False, 'lr': 0.00616821552478181, 'weight_decay': 3.866718709644964e-05, 'epochs': 106, 'loss': 'mse', 'optimizer': 'adam', 'graph_mode': 'cutoff', 'cutoff': 0.8733905474215242, 'grm_norm': 'cosine_then_gcn', 'self_loops': True, 'use_snp_selection': False}. Best is trial 76 with value: 0.31793588769783154.
[I 2025-12-09 08:05:46,807] Trial 121 finished with value: 0.31065046029173465 and parameters: {'model_type': 'graphsage', 'hidden_dims': '[512, 64]', 'dropout': 0.22207712749384884, 'batch_norm': True, 'sage_aggr': 'max', 'sage_normalize': False, 'sage_project': False, 'lr': 0.007354021853330449, 'weight_decay': 2.6081952530397497e-05, 'epochs': 121, 'loss': 'mse', 'optimizer': 'adam', 'graph_mode': 'cutoff', 'cutoff': 0.8539141252443484, 'grm_norm': 'gcn', 'self_loops': True, 'use_snp_selection': False}. Best is trial 76 with value: 0.31793588769783154.
[I 2025-12-09 08:06:43,053] Trial 122 finished with value: 0.3093999734410407 and parameters: {'model_type': 'graphsage', 'hidden_dims': '[512, 64]', 'dropout': 0.20244646657509652, 'batch_norm': True, 'sage_aggr': 'max', 'sage_normalize': False, 'sage_project': False, 'lr': 0.008558290589894003, 'weight_decay': 5.864557023852353e-05, 'epochs': 114, 'loss': 'mse', 'optimizer': 'adam', 'graph_mode': 'cutoff', 'cutoff': 0.8382822058923846, 'grm_norm': 'gcn', 'self_loops': True, 'use_snp_selection': False}. Best is trial 76 with value: 0.31793588769783154.
[I 2025-12-09 08:07:41,256] Trial 123 finished with value: 0.3128692275556699 and parameters: {'model_type': 'graphsage', 'hidden_dims': '[512, 64]', 'dropout': 0.20540403472483698, 'batch_norm': True, 'sage_aggr': 'max', 'sage_normalize': False, 'sage_project': False, 'lr': 0.007618613005162186, 'weight_decay': 4.269237040638398e-06, 'epochs': 119, 'loss': 'mse', 'optimizer': 'adam', 'graph_mode': 'cutoff', 'cutoff': 0.8274229756901346, 'grm_norm': 'gcn', 'self_loops': True, 'use_snp_selection': False}. Best is trial 76 with value: 0.31793588769783154.
[I 2025-12-09 08:08:26,634] Trial 124 finished with value: 0.31069613623275977 and parameters: {'model_type': 'graphsage', 'hidden_dims': '[512, 64]', 'dropout': 0.21216883819170407, 'batch_norm': True, 'sage_aggr': 'max', 'sage_normalize': False, 'sage_project': False, 'lr': 0.005353175858651884, 'weight_decay': 2.659181653398194e-05, 'epochs': 86, 'loss': 'mse', 'optimizer': 'adam', 'graph_mode': 'cutoff', 'cutoff': 0.885673819940887, 'grm_norm': 'gcn', 'self_loops': True, 'use_snp_selection': False}. Best is trial 76 with value: 0.31793588769783154.
[I 2025-12-09 08:09:29,123] Trial 125 finished with value: 0.30974344075721116 and parameters: {'model_type': 'graphsage', 'hidden_dims': '[512, 64]', 'dropout': 0.23786160643326978, 'batch_norm': True, 'sage_aggr': 'max', 'sage_normalize': False, 'sage_project': False, 'lr': 0.006794193639911524, 'weight_decay': 8.922366866427979e-05, 'epochs': 130, 'loss': 'mse', 'optimizer': 'adam', 'graph_mode': 'cutoff', 'cutoff': 0.7908667534421784, 'grm_norm': 'gcn', 'self_loops': True, 'use_snp_selection': False}. Best is trial 76 with value: 0.31793588769783154.
[I 2025-12-09 08:10:34,554] Trial 126 finished with value: 0.3077756972138516 and parameters: {'model_type': 'graphsage', 'hidden_dims': '[512, 128]', 'dropout': 0.2524057850518173, 'batch_norm': True, 'sage_aggr': 'max', 'sage_normalize': False, 'sage_project': False, 'lr': 0.0046631586705692726, 'weight_decay': 6.2443368388139975e-06, 'epochs': 137, 'loss': 'mse', 'optimizer': 'adam', 'graph_mode': 'cutoff', 'cutoff': 0.6951458544244602, 'grm_norm': 'gcn', 'self_loops': True, 'use_snp_selection': False}. Best is trial 76 with value: 0.31793588769783154.
[I 2025-12-09 08:11:23,799] Trial 127 finished with value: 0.3106186815043455 and parameters: {'model_type': 'graphsage', 'hidden_dims': '[512, 64]', 'dropout': 0.15807952702777117, 'batch_norm': True, 'sage_aggr': 'max', 'sage_normalize': False, 'sage_project': False, 'lr': 0.008563327979880969, 'weight_decay': 1.9732731386470786e-05, 'epochs': 96, 'loss': 'mse', 'optimizer': 'adam', 'graph_mode': 'cutoff', 'cutoff': 0.8707988796267404, 'grm_norm': 'gcn', 'self_loops': True, 'use_snp_selection': False}. Best is trial 76 with value: 0.31793588769783154.
[I 2025-12-09 08:13:11,306] Trial 128 finished with value: 0.3170230452205999 and parameters: {'model_type': 'graphsage', 'hidden_dims': '[512, 64]', 'dropout': 0.5053335406233641, 'batch_norm': True, 'sage_aggr': 'max', 'sage_normalize': False, 'sage_project': False, 'lr': 0.005820911762930585, 'weight_decay': 1.3459345583753782e-05, 'epochs': 246, 'loss': 'mse', 'optimizer': 'adam', 'graph_mode': 'cutoff', 'cutoff': 0.7434586297194674, 'grm_norm': 'gcn', 'self_loops': True, 'use_snp_selection': False}. Best is trial 76 with value: 0.31793588769783154.
[I 2025-12-09 08:14:50,072] Trial 129 finished with value: 0.31118112371518786 and parameters: {'model_type': 'graphsage', 'hidden_dims': '[512, 64]', 'dropout': 0.528652941482566, 'batch_norm': True, 'sage_aggr': 'mean', 'sage_normalize': False, 'sage_project': False, 'lr': 0.005667334706956554, 'weight_decay': 5.4461802228544044e-05, 'epochs': 220, 'loss': 'mse', 'optimizer': 'adam', 'graph_mode': 'cutoff', 'cutoff': 0.7568417681591517, 'grm_norm': 'cosine', 'self_loops': True, 'use_snp_selection': False}. Best is trial 76 with value: 0.31793588769783154.
