[I 2025-12-09 14:10:35,830] Trial 31 finished with value: 0.35481058664441634 and parameters: {'model_type': 'graphsage', 'hidden_dims': '[128, 64]', 'dropout': 0.3308582091326991, 'batch_norm': False, 'sage_aggr': 'max', 'sage_normalize': False, 'sage_project': False, 'lr': 3.6317513337679694e-05, 'weight_decay': 3.807559175555045e-05, 'epochs': 253, 'loss': 'mae', 'optimizer': 'adam', 'graph_mode': 'cutoff', 'cutoff': 0.33117044938234536, 'grm_norm': 'cosine', 'self_loops': True, 'use_snp_selection': True, 'num_snps': 31491}. Best is trial 17 with value: 0.3673211022051078.
[I 2025-12-09 14:11:50,302] Trial 32 finished with value: 0.36676968188123393 and parameters: {'model_type': 'graphsage', 'hidden_dims': '[512, 128]', 'dropout': 0.27947812157100815, 'batch_norm': False, 'sage_aggr': 'max', 'sage_normalize': False, 'sage_project': False, 'lr': 5.642044718246897e-05, 'weight_decay': 2.850529516360954e-07, 'epochs': 244, 'loss': 'mae', 'optimizer': 'adam', 'graph_mode': 'cutoff', 'cutoff': 0.41226975674414873, 'grm_norm': 'cosine', 'self_loops': True, 'use_snp_selection': True, 'num_snps': 21507}. Best is trial 17 with value: 0.3673211022051078.
[I 2025-12-09 14:13:09,167] Trial 33 finished with value: 0.3581211203797886 and parameters: {'model_type': 'graphsage', 'hidden_dims': '[512, 256]', 'dropout': 0.2614623765526662, 'batch_norm': False, 'sage_aggr': 'max', 'sage_normalize': False, 'sage_project': False, 'lr': 5.917831510835559e-05, 'weight_decay': 0.00012780236681075285, 'epochs': 203, 'loss': 'mae', 'optimizer': 'adam', 'graph_mode': 'cutoff', 'cutoff': 0.4846511030458248, 'grm_norm': 'cosine', 'self_loops': True, 'use_snp_selection': True, 'num_snps': 27336}. Best is trial 17 with value: 0.3673211022051078.
[I 2025-12-09 14:14:31,872] Trial 34 finished with value: 0.3639369765942631 and parameters: {'model_type': 'graphsage', 'hidden_dims': '[512, 64]', 'dropout': 0.16442412799137202, 'batch_norm': False, 'sage_aggr': 'max', 'sage_normalize': False, 'sage_project': False, 'lr': 1.61732915072424e-05, 'weight_decay': 1.3308469634696038e-05, 'epochs': 285, 'loss': 'mae', 'optimizer': 'adam', 'graph_mode': 'cutoff', 'cutoff': 0.40923839578925086, 'grm_norm': 'cosine', 'self_loops': True, 'use_snp_selection': True, 'num_snps': 22367}. Best is trial 17 with value: 0.3673211022051078.
[I 2025-12-09 14:15:56,904] Trial 35 finished with value: 0.3314760728869248 and parameters: {'model_type': 'graphsage', 'hidden_dims': '[512, 128]', 'dropout': 0.1651773378217259, 'batch_norm': True, 'sage_aggr': 'max', 'sage_normalize': False, 'sage_project': False, 'lr': 1.3511730565966148e-05, 'weight_decay': 1.3025747162552636e-05, 'epochs': 284, 'loss': 'mae', 'optimizer': 'adam', 'graph_mode': 'cutoff', 'cutoff': 0.4065131842025372, 'grm_norm': 'gcn', 'self_loops': True, 'use_snp_selection': True, 'num_snps': 22614}. Best is trial 17 with value: 0.3673211022051078.
[I 2025-12-09 14:18:07,909] Trial 36 finished with value: 0.3492359477262965 and parameters: {'model_type': 'graphsage', 'hidden_dims': '[256, 128, 64]', 'dropout': 0.10977883333450672, 'batch_norm': False, 'sage_aggr': 'max', 'sage_normalize': False, 'sage_project': False, 'lr': 1.8754002713426553e-05, 'weight_decay': 5.1586927755463794e-06, 'epochs': 300, 'loss': 'mae', 'optimizer': 'adam', 'graph_mode': 'cutoff', 'cutoff': 0.269783051395699, 'grm_norm': 'cosine', 'self_loops': True, 'use_snp_selection': False}. Best is trial 17 with value: 0.3673211022051078.
[I 2025-12-09 14:18:54,962] Trial 37 finished with value: 0.33058699162706284 and parameters: {'model_type': 'graphsage', 'hidden_dims': '[512, 64]', 'dropout': 0.18191887515787222, 'batch_norm': True, 'sage_aggr': 'mean', 'sage_normalize': False, 'sage_project': False, 'lr': 1.0709836802843144e-05, 'weight_decay': 1.581431171109205e-06, 'epochs': 267, 'loss': 'mae', 'optimizer': 'adam', 'graph_mode': 'cutoff', 'cutoff': 0.8915372602251425, 'grm_norm': 'cosine', 'self_loops': False, 'use_snp_selection': True, 'num_snps': 10386}. Best is trial 17 with value: 0.3673211022051078.
[I 2025-12-09 14:19:47,355] Trial 38 finished with value: 0.35106377607236067 and parameters: {'model_type': 'graphsage', 'hidden_dims': '[128, 64]', 'dropout': 0.14645160320694883, 'batch_norm': False, 'sage_aggr': 'max', 'sage_normalize': True, 'sage_project': False, 'lr': 1.61598714989762e-05, 'weight_decay': 3.4191595606940737e-06, 'epochs': 243, 'loss': 'mae', 'optimizer': 'adam', 'graph_mode': 'cutoff', 'cutoff': 0.408565293629316, 'grm_norm': 'gcn', 'self_loops': True, 'use_snp_selection': True, 'num_snps': 21602}. Best is trial 17 with value: 0.3673211022051078.
[I 2025-12-09 14:24:53,998] Trial 39 finished with value: 0.31180317480350334 and parameters: {'model_type': 'graphsage', 'hidden_dims': '[512, 256]', 'dropout': 0.24364122659358556, 'batch_norm': True, 'sage_aggr': 'max', 'sage_normalize': False, 'sage_project': False, 'lr': 5.098624170118643e-05, 'weight_decay': 1.138024384911919e-05, 'epochs': 313, 'loss': 'mae', 'optimizer': 'adam', 'graph_mode': 'knn', 'knn_k': 10, 'weighted_edges': True, 'symmetrize_mode': 'union', 'self_loops': True, 'use_snp_selection': False}. Best is trial 17 with value: 0.3673211022051078.
[I 2025-12-09 14:27:45,100] Trial 40 finished with value: 0.3373532326308848 and parameters: {'model_type': 'graphsage', 'hidden_dims': '[512, 128]', 'dropout': 0.13904272733625653, 'batch_norm': False, 'sage_aggr': 'mean', 'sage_normalize': True, 'sage_project': False, 'lr': 6.945633689317099e-05, 'weight_decay': 1.0881808472481786e-07, 'epochs': 273, 'loss': 'mse', 'optimizer': 'adam', 'graph_mode': 'cutoff', 'cutoff': 0.38086768024144496, 'grm_norm': 'none', 'self_loops': False, 'use_snp_selection': True, 'num_snps': 47916}. Best is trial 17 with value: 0.3673211022051078.
[I 2025-12-09 14:28:56,261] Trial 41 finished with value: 0.3570724707393992 and parameters: {'model_type': 'graphsage', 'hidden_dims': '[512, 64]', 'dropout': 0.35507775554221865, 'batch_norm': False, 'sage_aggr': 'max', 'sage_normalize': False, 'sage_project': False, 'lr': 4.238868290249868e-05, 'weight_decay': 4.8412890434118464e-05, 'epochs': 188, 'loss': 'mae', 'optimizer': 'adam', 'graph_mode': 'cutoff', 'cutoff': 0.5856387714844968, 'grm_norm': 'cosine', 'self_loops': True, 'use_snp_selection': True, 'num_snps': 29812}. Best is trial 17 with value: 0.3673211022051078.
[I 2025-12-09 14:30:14,126] Trial 42 finished with value: 0.37124776808108756 and parameters: {'model_type': 'graphsage', 'hidden_dims': '[512, 64]', 'dropout': 0.31946095607612834, 'batch_norm': False, 'sage_aggr': 'max', 'sage_normalize': False, 'sage_project': False, 'lr': 2.4433373786756794e-05, 'weight_decay': 2.4502871937156988e-05, 'epochs': 145, 'loss': 'mae', 'optimizer': 'adam', 'graph_mode': 'cutoff', 'cutoff': 0.4810553769198015, 'grm_norm': 'cosine', 'self_loops': True, 'use_snp_selection': True, 'num_snps': 34097}. Best is trial 42 with value: 0.37124776808108756.
[I 2025-12-09 14:32:13,184] Trial 43 finished with value: 0.36055370663602776 and parameters: {'model_type': 'graphsage', 'hidden_dims': '[512, 64]', 'dropout': 0.2686258799577045, 'batch_norm': False, 'sage_aggr': 'max', 'sage_normalize': False, 'sage_project': False, 'lr': 1.8776350973747506e-05, 'weight_decay': 2.1104672622263784e-05, 'epochs': 153, 'loss': 'mae', 'optimizer': 'adam', 'graph_mode': 'cutoff', 'cutoff': 0.4765619026965252, 'grm_norm': 'cosine', 'self_loops': True, 'use_snp_selection': True, 'num_snps': 53967}. Best is trial 42 with value: 0.37124776808108756.
[I 2025-12-09 14:33:27,677] Trial 44 finished with value: 0.36285130273259736 and parameters: {'model_type': 'graphsage', 'hidden_dims': '[512, 64]', 'dropout': 0.3167267378487636, 'batch_norm': False, 'sage_aggr': 'max', 'sage_normalize': False, 'sage_project': False, 'lr': 0.00011756927801742147, 'weight_decay': 7.093501499022741e-06, 'epochs': 214, 'loss': 'mae', 'optimizer': 'adam', 'graph_mode': 'cutoff', 'cutoff': 0.478781114162855, 'grm_norm': 'none', 'self_loops': True, 'use_snp_selection': True, 'num_snps': 24844}. Best is trial 42 with value: 0.37124776808108756.
[I 2025-12-09 14:34:17,845] Trial 45 finished with value: 0.3597484743782724 and parameters: {'model_type': 'graphsage', 'hidden_dims': '[256, 128, 64]', 'dropout': 0.28226789267037145, 'batch_norm': False, 'sage_aggr': 'max', 'sage_normalize': False, 'sage_project': False, 'lr': 2.341958894890087e-05, 'weight_decay': 0.00010570626104364604, 'epochs': 129, 'loss': 'mae', 'optimizer': 'adam', 'graph_mode': 'cutoff', 'cutoff': 0.5586683462737045, 'grm_norm': 'cosine_then_gcn', 'self_loops': True, 'use_snp_selection': True, 'num_snps': 30146}. Best is trial 42 with value: 0.37124776808108756.
[I 2025-12-09 14:35:16,788] Trial 46 finished with value: -0.012901294118778975 and parameters: {'model_type': 'graphsage', 'hidden_dims': '[512, 64]', 'dropout': 0.3683934752882834, 'batch_norm': False, 'sage_aggr': 'max', 'sage_normalize': False, 'sage_project': False, 'lr': 0.0005507892644238696, 'weight_decay': 2.37075614507364e-05, 'epochs': 95, 'loss': 'mse', 'optimizer': 'adam', 'graph_mode': 'knn', 'knn_k': 5, 'weighted_edges': True, 'symmetrize_mode': 'union', 'self_loops': True, 'use_snp_selection': True, 'num_snps': 20760}. Best is trial 42 with value: 0.37124776808108756.
[I 2025-12-09 14:35:55,256] Trial 47 finished with value: 0.33652193255805773 and parameters: {'model_type': 'graphsage', 'hidden_dims': '[256, 128]', 'dropout': 0.23463481844978962, 'batch_norm': True, 'sage_aggr': 'max', 'sage_normalize': False, 'sage_project': False, 'lr': 4.680771206650652e-05, 'weight_decay': 1.035366546824881e-05, 'epochs': 148, 'loss': 'mae', 'optimizer': 'adam', 'graph_mode': 'cutoff', 'cutoff': 0.387992944098364, 'grm_norm': 'cosine', 'self_loops': False, 'use_snp_selection': True, 'num_snps': 11776}. Best is trial 42 with value: 0.37124776808108756.
[I 2025-12-09 14:38:10,165] Trial 48 finished with value: 0.3407319935493389 and parameters: {'model_type': 'graphsage', 'hidden_dims': '[512, 256]', 'dropout': 0.18416219864055716, 'batch_norm': False, 'sage_aggr': 'mean', 'sage_normalize': True, 'sage_project': False, 'lr': 1.4026166904121906e-05, 'weight_decay': 2.1419195701513303e-06, 'epochs': 233, 'loss': 'mae', 'optimizer': 'adam', 'graph_mode': 'cutoff', 'cutoff': 0.4560619701502579, 'grm_norm': 'cosine', 'self_loops': True, 'use_snp_selection': True, 'num_snps': 46424}. Best is trial 42 with value: 0.37124776808108756.
[I 2025-12-09 14:39:40,738] Trial 49 finished with value: 0.35721260372894903 and parameters: {'model_type': 'graphsage', 'hidden_dims': '[512, 128]', 'dropout': 0.2182057269037979, 'batch_norm': False, 'sage_aggr': 'max', 'sage_normalize': False, 'sage_project': False, 'lr': 7.838293907310358e-05, 'weight_decay': 0.00026495430710788824, 'epochs': 335, 'loss': 'mse', 'optimizer': 'adam', 'graph_mode': 'knn', 'knn_k': 8, 'weighted_edges': True, 'symmetrize_mode': 'union', 'self_loops': False, 'use_snp_selection': True, 'num_snps': 13422}. Best is trial 42 with value: 0.37124776808108756.
[I 2025-12-09 14:42:49,359] Trial 50 finished with value: 0.3518533093098309 and parameters: {'model_type': 'graphsage', 'hidden_dims': '[512, 256]', 'dropout': 0.31804111128135487, 'batch_norm': False, 'sage_aggr': 'max', 'sage_normalize': False, 'sage_project': False, 'lr': 0.00013322552489457003, 'weight_decay': 4.421997946819191e-05, 'epochs': 300, 'loss': 'mae', 'optimizer': 'adam', 'graph_mode': 'cutoff', 'cutoff': 0.27304145636280497, 'grm_norm': 'gcn', 'self_loops': True, 'use_snp_selection': False}. Best is trial 42 with value: 0.37124776808108756.
[I 2025-12-09 14:44:03,730] Trial 51 finished with value: 0.345001081900221 and parameters: {'model_type': 'graphsage', 'hidden_dims': '[512, 64]', 'dropout': 0.31640848179633885, 'batch_norm': False, 'sage_aggr': 'max', 'sage_normalize': False, 'sage_project': False, 'lr': 0.00011444385760847632, 'weight_decay': 7.047326441925376e-06, 'epochs': 215, 'loss': 'mae', 'optimizer': 'adam', 'graph_mode': 'cutoff', 'cutoff': 0.48883017614607316, 'grm_norm': 'none', 'self_loops': True, 'use_snp_selection': True, 'num_snps': 25176}. Best is trial 42 with value: 0.37124776808108756.
[I 2025-12-09 14:45:19,706] Trial 52 finished with value: 0.3543676770771191 and parameters: {'model_type': 'graphsage', 'hidden_dims': '[512, 64]', 'dropout': 0.27994334423569367, 'batch_norm': False, 'sage_aggr': 'max', 'sage_normalize': False, 'sage_project': False, 'lr': 0.0002001715187850576, 'weight_decay': 8.162477037631876e-07, 'epochs': 210, 'loss': 'mae', 'optimizer': 'adam', 'graph_mode': 'cutoff', 'cutoff': 0.5227061016432271, 'grm_norm': 'none', 'self_loops': True, 'use_snp_selection': True, 'num_snps': 27715}. Best is trial 42 with value: 0.37124776808108756.
[I 2025-12-09 14:46:40,258] Trial 53 finished with value: 0.3246470695426203 and parameters: {'model_type': 'graphsage', 'hidden_dims': '[512, 64]', 'dropout': 0.25213002451315664, 'batch_norm': False, 'sage_aggr': 'max', 'sage_normalize': False, 'sage_project': False, 'lr': 0.0003271543273954891, 'weight_decay': 2.70338169599595e-05, 'epochs': 243, 'loss': 'mae', 'optimizer': 'adam', 'graph_mode': 'cutoff', 'cutoff': 0.4231639998816678, 'grm_norm': 'none', 'self_loops': True, 'use_snp_selection': True, 'num_snps': 24259}. Best is trial 42 with value: 0.37124776808108756.
[I 2025-12-09 14:48:39,258] Trial 54 finished with value: 0.3452190462324899 and parameters: {'model_type': 'graphsage', 'hidden_dims': '[512, 64]', 'dropout': 0.33242247664119423, 'batch_norm': False, 'sage_aggr': 'max', 'sage_normalize': False, 'sage_project': False, 'lr': 0.00010266503608982252, 'weight_decay': 4.495978369922894e-07, 'epochs': 224, 'loss': 'mae', 'optimizer': 'adam', 'graph_mode': 'cutoff', 'cutoff': 0.4638310442598626, 'grm_norm': 'none', 'self_loops': True, 'use_snp_selection': True, 'num_snps': 39916}. Best is trial 42 with value: 0.37124776808108756.
[I 2025-12-09 14:50:09,363] Trial 55 finished with value: 0.36469280791615283 and parameters: {'model_type': 'graphsage', 'hidden_dims': '[512, 128]', 'dropout': 0.35602622618041, 'batch_norm': False, 'sage_aggr': 'max', 'sage_normalize': False, 'sage_project': False, 'lr': 3.953013372601135e-05, 'weight_decay': 9.068309196998415e-06, 'epochs': 164, 'loss': 'mae', 'optimizer': 'adam', 'graph_mode': 'cutoff', 'cutoff': 0.34996347747439516, 'grm_norm': 'cosine', 'self_loops': True, 'use_snp_selection': True, 'num_snps': 32950}. Best is trial 42 with value: 0.37124776808108756.
[I 2025-12-09 14:51:44,814] Trial 56 finished with value: 0.3586959100071228 and parameters: {'model_type': 'graphsage', 'hidden_dims': '[512, 128]', 'dropout': 0.42361477806025816, 'batch_norm': False, 'sage_aggr': 'max', 'sage_normalize': False, 'sage_project': False, 'lr': 3.227379680514761e-05, 'weight_decay': 1.2275418666972573e-05, 'epochs': 162, 'loss': 'mae', 'optimizer': 'adam', 'graph_mode': 'cutoff', 'cutoff': 0.2998623350115549, 'grm_norm': 'cosine', 'self_loops': False, 'use_snp_selection': True, 'num_snps': 32477}. Best is trial 42 with value: 0.37124776808108756.
[I 2025-12-09 14:53:19,153] Trial 57 finished with value: 0.029937533984132753 and parameters: {'model_type': 'graphsage', 'hidden_dims': '[512, 128]', 'dropout': 0.45895843296340366, 'batch_norm': False, 'sage_aggr': 'max', 'sage_normalize': False, 'sage_project': False, 'lr': 0.0011808588844333448, 'weight_decay': 2.0076400699124526e-07, 'epochs': 145, 'loss': 'mae', 'optimizer': 'adam', 'graph_mode': 'knn', 'knn_k': 5, 'weighted_edges': False, 'symmetrize_mode': 'mutual', 'self_loops': True, 'use_snp_selection': True, 'num_snps': 37859}. Best is trial 42 with value: 0.37124776808108756.
[I 2025-12-09 14:54:49,829] Trial 58 finished with value: 0.35098846432707764 and parameters: {'model_type': 'graphsage', 'hidden_dims': '[512, 128]', 'dropout': 0.4028098891113817, 'batch_norm': False, 'sage_aggr': 'mean', 'sage_normalize': False, 'sage_project': False, 'lr': 5.469303526982925e-05, 'weight_decay': 4.500424133454421e-06, 'epochs': 184, 'loss': 'mse', 'optimizer': 'adam', 'graph_mode': 'cutoff', 'cutoff': 0.3566579104455596, 'grm_norm': 'cosine', 'self_loops': True, 'use_snp_selection': True, 'num_snps': 34777}. Best is trial 42 with value: 0.37124776808108756.
[I 2025-12-09 14:56:19,194] Trial 59 finished with value: 0.36747065447166605 and parameters: {'model_type': 'graphsage', 'hidden_dims': '[512, 128]', 'dropout': 0.3669463803914591, 'batch_norm': False, 'sage_aggr': 'max', 'sage_normalize': False, 'sage_project': False, 'lr': 4.0233407769543174e-05, 'weight_decay': 1.4879641964307542e-05, 'epochs': 122, 'loss': 'mae', 'optimizer': 'adam', 'graph_mode': 'cutoff', 'cutoff': 0.35366148870516434, 'grm_norm': 'cosine', 'self_loops': False, 'use_snp_selection': True, 'num_snps': 42029}. Best is trial 42 with value: 0.37124776808108756.
[I 2025-12-09 14:57:41,048] Trial 60 finished with value: 0.33819464480317707 and parameters: {'model_type': 'graphsage', 'hidden_dims': '[512, 128]', 'dropout': 0.49142603668610674, 'batch_norm': True, 'sage_aggr': 'max', 'sage_normalize': False, 'sage_project': False, 'lr': 4.017909046917823e-05, 'weight_decay': 3.391194745190254e-05, 'epochs': 91, 'loss': 'mae', 'optimizer': 'adam', 'graph_mode': 'cutoff', 'cutoff': 0.3363195931291199, 'grm_norm': 'cosine', 'self_loops': False, 'use_snp_selection': True, 'num_snps': 44866}. Best is trial 42 with value: 0.37124776808108756.
[I 2025-12-09 14:59:29,107] Trial 61 finished with value: 0.3535647494985801 and parameters: {'model_type': 'graphsage', 'hidden_dims': '[512, 128]', 'dropout': 0.35589235348944404, 'batch_norm': False, 'sage_aggr': 'max', 'sage_normalize': False, 'sage_project': False, 'lr': 2.3276255760224003e-05, 'weight_decay': 1.4668404410133203e-05, 'epochs': 122, 'loss': 'mae', 'optimizer': 'adam', 'graph_mode': 'cutoff', 'cutoff': 0.38194801937244294, 'grm_norm': 'cosine', 'self_loops': False, 'use_snp_selection': True, 'num_snps': 54316}. Best is trial 42 with value: 0.37124776808108756.
[I 2025-12-09 15:00:59,351] Trial 62 finished with value: 0.35774045555140155 and parameters: {'model_type': 'graphsage', 'hidden_dims': '[512, 128]', 'dropout': 0.3639987626500087, 'batch_norm': False, 'sage_aggr': 'max', 'sage_normalize': False, 'sage_project': False, 'lr': 8.194120280269202e-05, 'weight_decay': 1.0186407977128311e-05, 'epochs': 141, 'loss': 'mae', 'optimizer': 'adam', 'graph_mode': 'cutoff', 'cutoff': 0.4197493070997327, 'grm_norm': 'cosine', 'self_loops': False, 'use_snp_selection': True, 'num_snps': 40911}. Best is trial 42 with value: 0.37124776808108756.
[I 2025-12-09 15:02:36,399] Trial 63 finished with value: 0.3271814691951511 and parameters: {'model_type': 'graphsage', 'hidden_dims': '[512, 128]', 'dropout': 0.40361313758326073, 'batch_norm': False, 'sage_aggr': 'max', 'sage_normalize': False, 'sage_project': False, 'lr': 3.035351695701684e-05, 'weight_decay': 2.33409983303618e-05, 'epochs': 108, 'loss': 'mae', 'optimizer': 'adam', 'graph_mode': 'cutoff', 'cutoff': 0.28758410594596606, 'grm_norm': 'cosine', 'self_loops': False, 'use_snp_selection': True, 'num_snps': 43082}. Best is trial 42 with value: 0.37124776808108756.
[I 2025-12-09 15:03:50,378] Trial 64 finished with value: 0.359476109815325 and parameters: {'model_type': 'graphsage', 'hidden_dims': '[512, 128]', 'dropout': 0.29220859787586945, 'batch_norm': False, 'sage_aggr': 'max', 'sage_normalize': False, 'sage_project': False, 'lr': 1.6192909912383247e-05, 'weight_decay': 5.175766107911634e-05, 'epochs': 131, 'loss': 'mae', 'optimizer': 'adam', 'graph_mode': 'cutoff', 'cutoff': 0.4456311456551209, 'grm_norm': 'cosine', 'self_loops': False, 'use_snp_selection': True, 'num_snps': 33157}. Best is trial 42 with value: 0.37124776808108756.
[I 2025-12-09 15:05:40,638] Trial 65 finished with value: 0.3547499165007829 and parameters: {'model_type': 'graphsage', 'hidden_dims': '[256, 128]', 'dropout': 0.3762653283172785, 'batch_norm': False, 'sage_aggr': 'max', 'sage_normalize': False, 'sage_project': False, 'lr': 4.2223259589240625e-05, 'weight_decay': 1.8018519363392238e-05, 'epochs': 161, 'loss': 'mae', 'optimizer': 'adam', 'graph_mode': 'cutoff', 'cutoff': 0.35113085030774555, 'grm_norm': 'gcn', 'self_loops': True, 'use_snp_selection': True, 'num_snps': 51796}. Best is trial 42 with value: 0.37124776808108756.
[I 2025-12-09 15:06:12,572] Trial 66 finished with value: 0.32926500465630754 and parameters: {'model_type': 'graphsage', 'hidden_dims': '[512, 128]', 'dropout': 0.30217302570499965, 'batch_norm': False, 'sage_aggr': 'max', 'sage_normalize': True, 'sage_project': False, 'lr': 6.79951004082092e-05, 'weight_decay': 2.8113756865739076e-06, 'epochs': 174, 'loss': 'mae', 'optimizer': 'adam', 'graph_mode': 'cutoff', 'cutoff': 0.5111442909475713, 'grm_norm': 'cosine_then_gcn', 'self_loops': False, 'use_snp_selection': True, 'num_snps': 3520}. Best is trial 42 with value: 0.37124776808108756.
[I 2025-12-09 15:07:58,095] Trial 67 finished with value: 0.3619273625168148 and parameters: {'model_type': 'graphsage', 'hidden_dims': '[512, 256]', 'dropout': 0.33493574662325437, 'batch_norm': False, 'sage_aggr': 'max', 'sage_normalize': False, 'sage_project': False, 'lr': 2.0647643336359998e-05, 'weight_decay': 8.986963668898213e-06, 'epochs': 198, 'loss': 'mae', 'optimizer': 'adam', 'graph_mode': 'cutoff', 'cutoff': 0.3946143718542501, 'grm_norm': 'cosine', 'self_loops': True, 'use_snp_selection': False}. Best is trial 42 with value: 0.37124776808108756.
