[I 2025-12-08 16:11:27,654] Trial 4 finished with value: 0.2575574256516343 and parameters: {'model_type': 'graphsage', 'hidden_dims': '[128, 64]', 'dropout': 0.3348926467202472, 'batch_norm': True, 'sage_aggr': 'max', 'sage_normalize': False, 'sage_project': False, 'lr': 0.0004238630400638802, 'weight_decay': 8.074086040046576e-07, 'epochs': 158, 'loss': 'mae', 'optimizer': 'adam', 'graph_mode': 'knn', 'knn_k': 1, 'weighted_edges': False, 'symmetrize_mode': 'mutual', 'self_loops': False, 'use_snp_selection': True, 'num_snps': 26850}. Best is trial 1 with value: 0.28269492294993015.
[I 2025-12-08 16:13:21,720] Trial 5 finished with value: 0.25810221685057255 and parameters: {'model_type': 'graphsage', 'hidden_dims': '[512, 64]', 'dropout': 0.14505336736221927, 'batch_norm': True, 'sage_aggr': 'mean', 'sage_normalize': True, 'sage_project': False, 'lr': 1.2962030165732234e-05, 'weight_decay': 1.326598071105465e-07, 'epochs': 180, 'loss': 'mse', 'optimizer': 'adam', 'graph_mode': 'knn', 'knn_k': 9, 'weighted_edges': True, 'symmetrize_mode': 'mutual', 'self_loops': False, 'use_snp_selection': False}. Best is trial 1 with value: 0.28269492294993015.
[I 2025-12-08 16:14:15,787] Trial 6 finished with value: 0.2833656583656862 and parameters: {'model_type': 'graphsage', 'hidden_dims': '[256, 128, 64]', 'dropout': 0.10731743755162496, 'batch_norm': True, 'sage_aggr': 'mean', 'sage_normalize': False, 'sage_project': False, 'lr': 1.922990426933137e-05, 'weight_decay': 7.30001060446905e-05, 'epochs': 63, 'loss': 'mae', 'optimizer': 'adam', 'graph_mode': 'cutoff', 'cutoff': 0.7624978434202536, 'grm_norm': 'none', 'self_loops': True, 'use_snp_selection': True, 'num_snps': 50106}. Best is trial 6 with value: 0.2833656583656862.
[I 2025-12-08 16:16:16,292] Trial 7 finished with value: 0.26150647965010826 and parameters: {'model_type': 'graphsage', 'hidden_dims': '[512, 64]', 'dropout': 0.2585007811528941, 'batch_norm': True, 'sage_aggr': 'max', 'sage_normalize': True, 'sage_project': False, 'lr': 5.921425508303391e-05, 'weight_decay': 0.0004511561961144237, 'epochs': 182, 'loss': 'mae', 'optimizer': 'adam', 'graph_mode': 'knn', 'knn_k': 9, 'weighted_edges': True, 'symmetrize_mode': 'union', 'self_loops': False, 'use_snp_selection': True, 'num_snps': 23903}. Best is trial 6 with value: 0.2833656583656862.
[I 2025-12-08 16:16:59,393] Trial 8 finished with value: 0.23344047671927282 and parameters: {'model_type': 'graphsage', 'hidden_dims': '[512, 256]', 'dropout': 0.3061380386767003, 'batch_norm': False, 'sage_aggr': 'mean', 'sage_normalize': True, 'sage_project': False, 'lr': 0.000698401460570184, 'weight_decay': 2.965560055460244e-06, 'epochs': 289, 'loss': 'mae', 'optimizer': 'adam', 'graph_mode': 'knn', 'knn_k': 7, 'weighted_edges': False, 'symmetrize_mode': 'mutual', 'self_loops': True, 'use_snp_selection': True, 'num_snps': 4710}. Best is trial 6 with value: 0.2833656583656862.
[I 2025-12-08 16:20:52,446] Trial 9 finished with value: 0.2779734636075504 and parameters: {'model_type': 'graphsage', 'hidden_dims': '[512, 128]', 'dropout': 0.1733844071393634, 'batch_norm': False, 'sage_aggr': 'mean', 'sage_normalize': True, 'sage_project': False, 'lr': 0.0004269677918501597, 'weight_decay': 2.2439779626249696e-06, 'epochs': 319, 'loss': 'mse', 'optimizer': 'adam', 'graph_mode': 'cutoff', 'cutoff': 0.24117565767129295, 'grm_norm': 'cosine_then_gcn', 'self_loops': True, 'use_snp_selection': False}. Best is trial 6 with value: 0.2833656583656862.
[I 2025-12-08 16:21:48,081] Trial 10 finished with value: 0.28233952230390336 and parameters: {'model_type': 'graphsage', 'hidden_dims': '[256, 128, 64]', 'dropout': 0.5365714961141473, 'batch_norm': True, 'sage_aggr': 'mean', 'sage_normalize': False, 'sage_project': False, 'lr': 0.0060050040216813455, 'weight_decay': 4.9377500793081834e-05, 'epochs': 46, 'loss': 'mae', 'optimizer': 'adam', 'graph_mode': 'cutoff', 'cutoff': 0.8579871888501912, 'grm_norm': 'none', 'self_loops': True, 'use_snp_selection': True, 'num_snps': 59927}. Best is trial 6 with value: 0.2833656583656862.
[I 2025-12-08 16:22:55,484] Trial 11 finished with value: 0.2818665358288653 and parameters: {'model_type': 'graphsage', 'hidden_dims': '[512, 128]', 'dropout': 0.4926018175562089, 'batch_norm': False, 'sage_aggr': 'mean', 'sage_normalize': False, 'sage_project': False, 'lr': 4.9824880370512245e-05, 'weight_decay': 0.0005735134390673265, 'epochs': 60, 'loss': 'mse', 'optimizer': 'adam', 'graph_mode': 'cutoff', 'cutoff': 0.897550071387144, 'grm_norm': 'cosine', 'self_loops': True, 'use_snp_selection': True, 'num_snps': 54892}. Best is trial 6 with value: 0.2833656583656862.
[I 2025-12-08 16:24:05,006] Trial 12 finished with value: 0.25859921669420916 and parameters: {'model_type': 'graphsage', 'hidden_dims': '[256, 128]', 'dropout': 0.10652415720094331, 'batch_norm': False, 'sage_aggr': 'max', 'sage_normalize': False, 'sage_project': False, 'lr': 2.7571407647028188e-05, 'weight_decay': 6.9442169885097e-05, 'epochs': 112, 'loss': 'mse', 'optimizer': 'adam', 'graph_mode': 'knn', 'knn_k': 1, 'weighted_edges': False, 'symmetrize_mode': 'union', 'self_loops': True, 'use_snp_selection': True, 'num_snps': 44458}. Best is trial 6 with value: 0.2833656583656862.
[I 2025-12-08 16:25:11,328] Trial 13 finished with value: 0.2800718846676734 and parameters: {'model_type': 'graphsage', 'hidden_dims': '[512, 128]', 'dropout': 0.4434641410947794, 'batch_norm': False, 'sage_aggr': 'mean', 'sage_normalize': False, 'sage_project': False, 'lr': 0.00012586985041155037, 'weight_decay': 0.00016929802170264466, 'epochs': 98, 'loss': 'mae', 'optimizer': 'adam', 'graph_mode': 'cutoff', 'cutoff': 0.6633238280227164, 'grm_norm': 'none', 'self_loops': True, 'use_snp_selection': True, 'num_snps': 41241}. Best is trial 6 with value: 0.2833656583656862.
[I 2025-12-08 16:26:26,785] Trial 14 finished with value: 0.26089741112591325 and parameters: {'model_type': 'graphsage', 'hidden_dims': '[256, 128, 64]', 'dropout': 0.420004136612043, 'batch_norm': True, 'sage_aggr': 'mean', 'sage_normalize': False, 'sage_project': False, 'lr': 1.0848448158454988e-05, 'weight_decay': 0.000989888024080623, 'epochs': 102, 'loss': 'mse', 'optimizer': 'adam', 'graph_mode': 'knn', 'knn_k': 3, 'weighted_edges': False, 'symmetrize_mode': 'mutual', 'self_loops': True, 'use_snp_selection': True, 'num_snps': 49213}. Best is trial 6 with value: 0.2833656583656862.
[I 2025-12-08 16:27:36,425] Trial 15 finished with value: 0.03798993694259211 and parameters: {'model_type': 'graphsage', 'hidden_dims': '[256, 128]', 'dropout': 0.22830298968572366, 'batch_norm': False, 'sage_aggr': 'max', 'sage_normalize': False, 'sage_project': False, 'lr': 0.0021318068147912375, 'weight_decay': 1.4092407418815202e-05, 'epochs': 227, 'loss': 'mae', 'optimizer': 'adam', 'graph_mode': 'cutoff', 'cutoff': 0.7194312411951659, 'grm_norm': 'cosine_then_gcn', 'self_loops': True, 'use_snp_selection': True, 'num_snps': 37642}. Best is trial 6 with value: 0.2833656583656862.
[I 2025-12-08 16:29:20,983] Trial 16 finished with value: 0.2701855924744056 and parameters: {'model_type': 'graphsage', 'hidden_dims': '[512, 128]', 'dropout': 0.10859712615091835, 'batch_norm': False, 'sage_aggr': 'mean', 'sage_normalize': False, 'sage_project': False, 'lr': 0.00014296089162504002, 'weight_decay': 0.00015839578976615366, 'epochs': 84, 'loss': 'mse', 'optimizer': 'adam', 'graph_mode': 'knn', 'knn_k': 4, 'weighted_edges': False, 'symmetrize_mode': 'union', 'self_loops': True, 'use_snp_selection': True, 'num_snps': 50886}. Best is trial 6 with value: 0.2833656583656862.
[I 2025-12-08 16:30:01,824] Trial 17 finished with value: 0.2684892197649004 and parameters: {'model_type': 'graphsage', 'hidden_dims': '[256, 128, 64]', 'dropout': 0.2127376919918207, 'batch_norm': True, 'sage_aggr': 'max', 'sage_normalize': False, 'sage_project': False, 'lr': 3.133817472255369e-05, 'weight_decay': 1.9393799729155212e-05, 'epochs': 126, 'loss': 'mae', 'optimizer': 'adam', 'graph_mode': 'cutoff', 'cutoff': 0.42979538969295905, 'grm_norm': 'cosine', 'self_loops': True, 'use_snp_selection': True, 'num_snps': 14365}. Best is trial 6 with value: 0.2833656583656862.
[I 2025-12-08 16:30:33,772] Trial 18 finished with value: 0.154044885490853 and parameters: {'model_type': 'graphsage', 'hidden_dims': '[512, 128]', 'dropout': 0.3999027850493187, 'batch_norm': False, 'sage_aggr': 'max', 'sage_normalize': False, 'sage_project': False, 'lr': 2.5902597537770688e-05, 'weight_decay': 0.00010542162929566695, 'epochs': 41, 'loss': 'mse', 'optimizer': 'adam', 'graph_mode': 'knn', 'knn_k': 3, 'weighted_edges': False, 'symmetrize_mode': 'mutual', 'self_loops': False, 'use_snp_selection': False}. Best is trial 6 with value: 0.2833656583656862.
[I 2025-12-08 16:32:14,378] Trial 19 finished with value: 0.27746028251639576 and parameters: {'model_type': 'graphsage', 'hidden_dims': '[256, 128, 64]', 'dropout': 0.5916123333422963, 'batch_norm': True, 'sage_aggr': 'mean', 'sage_normalize': False, 'sage_project': False, 'lr': 0.0012896111047584144, 'weight_decay': 0.00026321494613168223, 'epochs': 220, 'loss': 'mae', 'optimizer': 'adam', 'graph_mode': 'cutoff', 'cutoff': 0.7471275074589868, 'grm_norm': 'gcn', 'self_loops': True, 'use_snp_selection': True, 'num_snps': 58943}. Best is trial 6 with value: 0.2833656583656862.
[I 2025-12-08 16:34:02,751] Trial 20 finished with value: 0.293397987427608 and parameters: {'model_type': 'graphsage', 'hidden_dims': '[512, 64]', 'dropout': 0.14827052941369162, 'batch_norm': True, 'sage_aggr': 'mean', 'sage_normalize': False, 'sage_project': False, 'lr': 0.00016539031578027247, 'weight_decay': 2.6754725553923845e-05, 'epochs': 141, 'loss': 'mae', 'optimizer': 'adam', 'graph_mode': 'cutoff', 'cutoff': 0.3877331800899538, 'grm_norm': 'none', 'self_loops': True, 'use_snp_selection': True, 'num_snps': 45987}. Best is trial 20 with value: 0.293397987427608.
[I 2025-12-08 16:35:58,012] Trial 21 finished with value: 0.2828032453731269 and parameters: {'model_type': 'graphsage', 'hidden_dims': '[512, 64]', 'dropout': 0.16117614910021003, 'batch_norm': True, 'sage_aggr': 'mean', 'sage_normalize': False, 'sage_project': False, 'lr': 0.0001449412724559848, 'weight_decay': 2.777031406787062e-05, 'epochs': 148, 'loss': 'mae', 'optimizer': 'adam', 'graph_mode': 'cutoff', 'cutoff': 0.3413557758020669, 'grm_norm': 'none', 'self_loops': True, 'use_snp_selection': True, 'num_snps': 46355}. Best is trial 20 with value: 0.293397987427608.
[I 2025-12-08 16:37:14,136] Trial 22 finished with value: 0.28464297238379543 and parameters: {'model_type': 'graphsage', 'hidden_dims': '[512, 64]', 'dropout': 0.15459906134322865, 'batch_norm': True, 'sage_aggr': 'mean', 'sage_normalize': False, 'sage_project': False, 'lr': 0.00016632307411127136, 'weight_decay': 7.247158209819465e-06, 'epochs': 71, 'loss': 'mae', 'optimizer': 'adam', 'graph_mode': 'cutoff', 'cutoff': 0.33579797508937725, 'grm_norm': 'none', 'self_loops': True, 'use_snp_selection': True, 'num_snps': 43857}. Best is trial 20 with value: 0.293397987427608.
[I 2025-12-08 16:38:24,123] Trial 23 finished with value: 0.28625168636692017 and parameters: {'model_type': 'graphsage', 'hidden_dims': '[512, 64]', 'dropout': 0.14596845826086913, 'batch_norm': True, 'sage_aggr': 'mean', 'sage_normalize': False, 'sage_project': False, 'lr': 0.00023871927416489728, 'weight_decay': 6.873349044019221e-06, 'epochs': 68, 'loss': 'mae', 'optimizer': 'adam', 'graph_mode': 'cutoff', 'cutoff': 0.33226262491743297, 'grm_norm': 'none', 'self_loops': True, 'use_snp_selection': True, 'num_snps': 39805}. Best is trial 20 with value: 0.293397987427608.
[I 2025-12-08 16:39:37,903] Trial 24 finished with value: 0.28373588409004424 and parameters: {'model_type': 'graphsage', 'hidden_dims': '[512, 64]', 'dropout': 0.15647149067039348, 'batch_norm': True, 'sage_aggr': 'mean', 'sage_normalize': False, 'sage_project': False, 'lr': 0.0001523815650964482, 'weight_decay': 6.934883167407441e-06, 'epochs': 78, 'loss': 'mae', 'optimizer': 'adam', 'graph_mode': 'cutoff', 'cutoff': 0.31729090691240486, 'grm_norm': 'none', 'self_loops': True, 'use_snp_selection': True, 'num_snps': 38886}. Best is trial 20 with value: 0.293397987427608.
[I 2025-12-08 16:40:52,461] Trial 25 finished with value: 0.29048169455492806 and parameters: {'model_type': 'graphsage', 'hidden_dims': '[512, 64]', 'dropout': 0.20734712011012219, 'batch_norm': True, 'sage_aggr': 'mean', 'sage_normalize': False, 'sage_project': False, 'lr': 0.00024352771241519165, 'weight_decay': 3.156660756073536e-06, 'epochs': 123, 'loss': 'mae', 'optimizer': 'adam', 'graph_mode': 'cutoff', 'cutoff': 0.3661442777875857, 'grm_norm': 'none', 'self_loops': True, 'use_snp_selection': True, 'num_snps': 32223}. Best is trial 20 with value: 0.293397987427608.
[I 2025-12-08 16:42:02,136] Trial 26 finished with value: 0.27698930639376734 and parameters: {'model_type': 'graphsage', 'hidden_dims': '[512, 64]', 'dropout': 0.2154335452331205, 'batch_norm': True, 'sage_aggr': 'mean', 'sage_normalize': True, 'sage_project': False, 'lr': 0.0008114553328348802, 'weight_decay': 1.026318147114276e-06, 'epochs': 119, 'loss': 'mae', 'optimizer': 'adam', 'graph_mode': 'cutoff', 'cutoff': 0.4468701647303522, 'grm_norm': 'none', 'self_loops': True, 'use_snp_selection': False}. Best is trial 20 with value: 0.293397987427608.
[I 2025-12-08 16:44:09,468] Trial 27 finished with value: 0.2884868102721455 and parameters: {'model_type': 'graphsage', 'hidden_dims': '[512, 64]', 'dropout': 0.1892472097231788, 'batch_norm': True, 'sage_aggr': 'mean', 'sage_normalize': False, 'sage_project': False, 'lr': 0.00024688952622974644, 'weight_decay': 2.9387202477637287e-06, 'epochs': 204, 'loss': 'mae', 'optimizer': 'adam', 'graph_mode': 'cutoff', 'cutoff': 0.20617936076702692, 'grm_norm': 'none', 'self_loops': False, 'use_snp_selection': True, 'num_snps': 27479}. Best is trial 20 with value: 0.293397987427608.
[I 2025-12-08 16:45:41,790] Trial 28 finished with value: 0.2849042848432552 and parameters: {'model_type': 'graphsage', 'hidden_dims': '[512, 64]', 'dropout': 0.1935412963783623, 'batch_norm': True, 'sage_aggr': 'mean', 'sage_normalize': False, 'sage_project': False, 'lr': 0.0028564404909010577, 'weight_decay': 3.094463214085988e-07, 'epochs': 197, 'loss': 'mae', 'optimizer': 'adam', 'graph_mode': 'cutoff', 'cutoff': 0.21003225082764557, 'grm_norm': 'none', 'self_loops': False, 'use_snp_selection': True, 'num_snps': 20587}. Best is trial 20 with value: 0.293397987427608.
[I 2025-12-08 16:47:08,814] Trial 29 finished with value: 0.2778432881094946 and parameters: {'model_type': 'graphsage', 'hidden_dims': '[128, 64]', 'dropout': 0.29581093006842185, 'batch_norm': True, 'sage_aggr': 'mean', 'sage_normalize': True, 'sage_project': False, 'lr': 0.00027931103980676874, 'weight_decay': 3.158964256753742e-06, 'epochs': 248, 'loss': 'mae', 'optimizer': 'adam', 'graph_mode': 'cutoff', 'cutoff': 0.26789447816546286, 'grm_norm': 'gcn', 'self_loops': False, 'use_snp_selection': False}. Best is trial 20 with value: 0.293397987427608.
[I 2025-12-08 16:48:38,617] Trial 30 finished with value: 0.2833490909571672 and parameters: {'model_type': 'graphsage', 'hidden_dims': '[512, 64]', 'dropout': 0.19415176321492897, 'batch_norm': True, 'sage_aggr': 'mean', 'sage_normalize': False, 'sage_project': False, 'lr': 7.951562900019514e-05, 'weight_decay': 9.280983573934888e-07, 'epochs': 197, 'loss': 'mae', 'optimizer': 'adam', 'graph_mode': 'cutoff', 'cutoff': 0.41914131805400107, 'grm_norm': 'cosine_then_gcn', 'self_loops': False, 'use_snp_selection': True, 'num_snps': 30788}. Best is trial 20 with value: 0.293397987427608.
[I 2025-12-08 16:49:54,066] Trial 31 finished with value: 0.28982932418239615 and parameters: {'model_type': 'graphsage', 'hidden_dims': '[512, 64]', 'dropout': 0.13256958806858704, 'batch_norm': True, 'sage_aggr': 'mean', 'sage_normalize': False, 'sage_project': False, 'lr': 0.00026248792164560537, 'weight_decay': 1.686517349775002e-06, 'epochs': 134, 'loss': 'mae', 'optimizer': 'adam', 'graph_mode': 'cutoff', 'cutoff': 0.37288388752467994, 'grm_norm': 'none', 'self_loops': False, 'use_snp_selection': True, 'num_snps': 31156}. Best is trial 20 with value: 0.293397987427608.
[I 2025-12-08 16:51:02,149] Trial 32 finished with value: 0.28959811727037943 and parameters: {'model_type': 'graphsage', 'hidden_dims': '[512, 64]', 'dropout': 0.24135225944407374, 'batch_norm': True, 'sage_aggr': 'mean', 'sage_normalize': False, 'sage_project': False, 'lr': 0.000531414734159716, 'weight_decay': 1.7600901122283402e-06, 'epochs': 141, 'loss': 'mae', 'optimizer': 'adam', 'graph_mode': 'cutoff', 'cutoff': 0.5201870996668936, 'grm_norm': 'none', 'self_loops': False, 'use_snp_selection': True, 'num_snps': 30688}. Best is trial 20 with value: 0.293397987427608.
[I 2025-12-08 16:52:12,320] Trial 33 finished with value: 0.28524047555862053 and parameters: {'model_type': 'graphsage', 'hidden_dims': '[512, 64]', 'dropout': 0.2594856185372122, 'batch_norm': True, 'sage_aggr': 'mean', 'sage_normalize': False, 'sage_project': False, 'lr': 0.0006123004874874034, 'weight_decay': 4.136606002671797e-07, 'epochs': 136, 'loss': 'mae', 'optimizer': 'adam', 'graph_mode': 'cutoff', 'cutoff': 0.5329435728937104, 'grm_norm': 'none', 'self_loops': False, 'use_snp_selection': True, 'num_snps': 33181}. Best is trial 20 with value: 0.293397987427608.
[I 2025-12-08 16:53:09,015] Trial 34 finished with value: 0.28105138369331606 and parameters: {'model_type': 'graphsage', 'hidden_dims': '[512, 256]', 'dropout': 0.24710170033074727, 'batch_norm': True, 'sage_aggr': 'mean', 'sage_normalize': False, 'sage_project': False, 'lr': 0.0009662718836499635, 'weight_decay': 2.00491697444108e-06, 'epochs': 166, 'loss': 'mae', 'optimizer': 'adam', 'graph_mode': 'cutoff', 'cutoff': 0.392119266964952, 'grm_norm': 'none', 'self_loops': False, 'use_snp_selection': True, 'num_snps': 18925}. Best is trial 20 with value: 0.293397987427608.
[I 2025-12-08 16:54:19,852] Trial 35 finished with value: 0.29104366815900495 and parameters: {'model_type': 'graphsage', 'hidden_dims': '[512, 64]', 'dropout': 0.13097235576355715, 'batch_norm': True, 'sage_aggr': 'mean', 'sage_normalize': False, 'sage_project': False, 'lr': 9.017729820157243e-05, 'weight_decay': 1.447143106437523e-06, 'epochs': 166, 'loss': 'mae', 'optimizer': 'adam', 'graph_mode': 'cutoff', 'cutoff': 0.5781133645491054, 'grm_norm': 'cosine', 'self_loops': False, 'use_snp_selection': True, 'num_snps': 30278}. Best is trial 20 with value: 0.293397987427608.
[I 2025-12-08 16:55:12,669] Trial 36 finished with value: 0.2898880584884441 and parameters: {'model_type': 'graphsage', 'hidden_dims': '[128, 64]', 'dropout': 0.12483505439860287, 'batch_norm': True, 'sage_aggr': 'mean', 'sage_normalize': False, 'sage_project': False, 'lr': 8.734027303044851e-05, 'weight_decay': 4.994997527382118e-07, 'epochs': 170, 'loss': 'mae', 'optimizer': 'adam', 'graph_mode': 'cutoff', 'cutoff': 0.5947860077196476, 'grm_norm': 'cosine', 'self_loops': False, 'use_snp_selection': True, 'num_snps': 36087}. Best is trial 20 with value: 0.293397987427608.
[I 2025-12-08 16:55:46,124] Trial 37 finished with value: 0.28768761036139306 and parameters: {'model_type': 'graphsage', 'hidden_dims': '[128, 64]', 'dropout': 0.12192019829223, 'batch_norm': True, 'sage_aggr': 'mean', 'sage_normalize': False, 'sage_project': False, 'lr': 8.737343602037735e-05, 'weight_decay': 3.1563621487235777e-07, 'epochs': 162, 'loss': 'mae', 'optimizer': 'adam', 'graph_mode': 'cutoff', 'cutoff': 0.5965938800659268, 'grm_norm': 'cosine', 'self_loops': False, 'use_snp_selection': False}. Best is trial 20 with value: 0.293397987427608.
[I 2025-12-08 16:56:39,547] Trial 38 finished with value: 0.2856950307044669 and parameters: {'model_type': 'graphsage', 'hidden_dims': '[128, 64]', 'dropout': 0.18007381062639868, 'batch_norm': True, 'sage_aggr': 'mean', 'sage_normalize': True, 'sage_project': False, 'lr': 5.685835642068765e-05, 'weight_decay': 1.573807272847972e-07, 'epochs': 176, 'loss': 'mae', 'optimizer': 'adam', 'graph_mode': 'cutoff', 'cutoff': 0.6140356814759305, 'grm_norm': 'cosine', 'self_loops': False, 'use_snp_selection': True, 'num_snps': 36450}. Best is trial 20 with value: 0.293397987427608.
[I 2025-12-08 16:57:36,394] Trial 39 finished with value: 0.28342711226241957 and parameters: {'model_type': 'graphsage', 'hidden_dims': '[128, 64]', 'dropout': 0.13167218957949584, 'batch_norm': True, 'sage_aggr': 'mean', 'sage_normalize': False, 'sage_project': False, 'lr': 7.341125373493537e-05, 'weight_decay': 4.4514022947449955e-06, 'epochs': 259, 'loss': 'mae', 'optimizer': 'adam', 'graph_mode': 'cutoff', 'cutoff': 0.48192061714177115, 'grm_norm': 'cosine', 'self_loops': False, 'use_snp_selection': True, 'num_snps': 25163}. Best is trial 20 with value: 0.293397987427608.
[I 2025-12-08 16:58:11,961] Trial 40 finished with value: 0.2897172273641545 and parameters: {'model_type': 'graphsage', 'hidden_dims': '[128, 64]', 'dropout': 0.32731199575456493, 'batch_norm': True, 'sage_aggr': 'mean', 'sage_normalize': False, 'sage_project': False, 'lr': 3.911954579844758e-05, 'weight_decay': 5.754204435976327e-07, 'epochs': 180, 'loss': 'mae', 'optimizer': 'adam', 'graph_mode': 'cutoff', 'cutoff': 0.6597581059099146, 'grm_norm': 'cosine', 'self_loops': False, 'use_snp_selection': False}. Best is trial 20 with value: 0.293397987427608.
