[I 2025-12-09 15:03:43,862] Trial 6 finished with value: 0.27754217789214825 and parameters: {'model_type': 'graphsage', 'hidden_dims': '[256, 128, 64]', 'dropout': 0.10731743755162496, 'batch_norm': True, 'sage_aggr': 'mean', 'sage_normalize': False, 'sage_project': False, 'lr': 1.922990426933137e-05, 'weight_decay': 7.30001060446905e-05, 'epochs': 63, 'loss': 'mae', 'optimizer': 'adam', 'graph_mode': 'cutoff', 'cutoff': 0.7624978434202536, 'grm_norm': 'none', 'self_loops': True, 'use_snp_selection': True, 'num_snps': 50106}. Best is trial 3 with value: 0.2854878492473889.
[I 2025-12-09 15:05:45,677] Trial 7 finished with value: 0.2630083441704637 and parameters: {'model_type': 'graphsage', 'hidden_dims': '[512, 64]', 'dropout': 0.2585007811528941, 'batch_norm': True, 'sage_aggr': 'max', 'sage_normalize': True, 'sage_project': False, 'lr': 5.921425508303391e-05, 'weight_decay': 0.0004511561961144237, 'epochs': 182, 'loss': 'mae', 'optimizer': 'adam', 'graph_mode': 'knn', 'knn_k': 9, 'weighted_edges': True, 'symmetrize_mode': 'union', 'self_loops': False, 'use_snp_selection': True, 'num_snps': 23903}. Best is trial 3 with value: 0.2854878492473889.
[I 2025-12-09 15:06:29,250] Trial 8 finished with value: 0.2528880403566921 and parameters: {'model_type': 'graphsage', 'hidden_dims': '[512, 256]', 'dropout': 0.3061380386767003, 'batch_norm': False, 'sage_aggr': 'mean', 'sage_normalize': True, 'sage_project': False, 'lr': 0.000698401460570184, 'weight_decay': 2.965560055460244e-06, 'epochs': 289, 'loss': 'mae', 'optimizer': 'adam', 'graph_mode': 'knn', 'knn_k': 7, 'weighted_edges': False, 'symmetrize_mode': 'mutual', 'self_loops': True, 'use_snp_selection': True, 'num_snps': 4710}. Best is trial 3 with value: 0.2854878492473889.
[I 2025-12-09 15:10:22,263] Trial 9 finished with value: 0.28043029626365507 and parameters: {'model_type': 'graphsage', 'hidden_dims': '[512, 128]', 'dropout': 0.1733844071393634, 'batch_norm': False, 'sage_aggr': 'mean', 'sage_normalize': True, 'sage_project': False, 'lr': 0.0004269677918501597, 'weight_decay': 2.2439779626249696e-06, 'epochs': 319, 'loss': 'mse', 'optimizer': 'adam', 'graph_mode': 'cutoff', 'cutoff': 0.24117565767129295, 'grm_norm': 'cosine_then_gcn', 'self_loops': True, 'use_snp_selection': False}. Best is trial 3 with value: 0.2854878492473889.
[I 2025-12-09 15:11:33,204] Trial 10 finished with value: 0.2909041743660771 and parameters: {'model_type': 'graphsage', 'hidden_dims': '[256, 128, 64]', 'dropout': 0.5062131504581071, 'batch_norm': True, 'sage_aggr': 'max', 'sage_normalize': False, 'sage_project': False, 'lr': 0.0060050040216813455, 'weight_decay': 1.5886244399072472e-05, 'epochs': 258, 'loss': 'mse', 'optimizer': 'adam', 'graph_mode': 'cutoff', 'cutoff': 0.6388703494956212, 'grm_norm': 'none', 'self_loops': True, 'use_snp_selection': False}. Best is trial 10 with value: 0.2909041743660771.
[I 2025-12-09 15:12:42,545] Trial 11 finished with value: 0.2907949418576298 and parameters: {'model_type': 'graphsage', 'hidden_dims': '[256, 128, 64]', 'dropout': 0.49488119581970164, 'batch_norm': True, 'sage_aggr': 'max', 'sage_normalize': False, 'sage_project': False, 'lr': 0.006753264773209739, 'weight_decay': 1.623283721491421e-05, 'epochs': 251, 'loss': 'mse', 'optimizer': 'adam', 'graph_mode': 'cutoff', 'cutoff': 0.6423124990838213, 'grm_norm': 'none', 'self_loops': True, 'use_snp_selection': False}. Best is trial 10 with value: 0.2909041743660771.
[I 2025-12-09 15:13:47,640] Trial 12 finished with value: 0.2959088098609017 and parameters: {'model_type': 'graphsage', 'hidden_dims': '[256, 128, 64]', 'dropout': 0.51498112638603, 'batch_norm': True, 'sage_aggr': 'max', 'sage_normalize': False, 'sage_project': False, 'lr': 0.00923224194542078, 'weight_decay': 2.2174123778930998e-05, 'epochs': 233, 'loss': 'mse', 'optimizer': 'adam', 'graph_mode': 'cutoff', 'cutoff': 0.6518755419888931, 'grm_norm': 'none', 'self_loops': True, 'use_snp_selection': False}. Best is trial 12 with value: 0.2959088098609017.
[I 2025-12-09 15:14:52,186] Trial 13 finished with value: 0.29751468379234425 and parameters: {'model_type': 'graphsage', 'hidden_dims': '[256, 128]', 'dropout': 0.5786495726450808, 'batch_norm': True, 'sage_aggr': 'max', 'sage_normalize': False, 'sage_project': False, 'lr': 0.009857123725592538, 'weight_decay': 3.525983997703114e-05, 'epochs': 233, 'loss': 'mse', 'optimizer': 'adam', 'graph_mode': 'cutoff', 'cutoff': 0.8556020950455094, 'grm_norm': 'cosine', 'self_loops': True, 'use_snp_selection': False}. Best is trial 13 with value: 0.29751468379234425.
[I 2025-12-09 15:16:22,811] Trial 14 finished with value: 0.29693429439063207 and parameters: {'model_type': 'graphsage', 'hidden_dims': '[256, 128]', 'dropout': 0.5935914223132918, 'batch_norm': True, 'sage_aggr': 'max', 'sage_normalize': False, 'sage_project': False, 'lr': 0.0024371165556171634, 'weight_decay': 6.115596899007738e-05, 'epochs': 348, 'loss': 'mse', 'optimizer': 'adam', 'graph_mode': 'cutoff', 'cutoff': 0.8923190952193389, 'grm_norm': 'cosine', 'self_loops': True, 'use_snp_selection': False}. Best is trial 13 with value: 0.29751468379234425.
[I 2025-12-09 15:17:51,214] Trial 15 finished with value: 0.290328548803254 and parameters: {'model_type': 'graphsage', 'hidden_dims': '[256, 128]', 'dropout': 0.5960190295615726, 'batch_norm': True, 'sage_aggr': 'max', 'sage_normalize': False, 'sage_project': False, 'lr': 0.0020965421622487065, 'weight_decay': 8.736600284532222e-05, 'epochs': 338, 'loss': 'mse', 'optimizer': 'adam', 'graph_mode': 'cutoff', 'cutoff': 0.8973313329898638, 'grm_norm': 'cosine', 'self_loops': True, 'use_snp_selection': False}. Best is trial 13 with value: 0.29751468379234425.
[I 2025-12-09 15:18:18,617] Trial 16 finished with value: 0.29837816172805615 and parameters: {'model_type': 'graphsage', 'hidden_dims': '[256, 128]', 'dropout': 0.4284482407392213, 'batch_norm': True, 'sage_aggr': 'max', 'sage_normalize': False, 'sage_project': False, 'lr': 0.0021273413180799413, 'weight_decay': 0.0006943121180525726, 'epochs': 70, 'loss': 'mse', 'optimizer': 'adam', 'graph_mode': 'cutoff', 'cutoff': 0.8813801726098964, 'grm_norm': 'cosine', 'self_loops': True, 'use_snp_selection': False}. Best is trial 16 with value: 0.29837816172805615.
[I 2025-12-09 15:18:42,798] Trial 17 finished with value: 0.30027958902662266 and parameters: {'model_type': 'graphsage', 'hidden_dims': '[256, 128]', 'dropout': 0.4251116875306481, 'batch_norm': True, 'sage_aggr': 'max', 'sage_normalize': False, 'sage_project': False, 'lr': 0.0015538009378391197, 'weight_decay': 0.0009285352356731823, 'epochs': 56, 'loss': 'mse', 'optimizer': 'adam', 'graph_mode': 'cutoff', 'cutoff': 0.7785386910297676, 'grm_norm': 'cosine', 'self_loops': True, 'use_snp_selection': False}. Best is trial 17 with value: 0.30027958902662266.
[I 2025-12-09 15:19:08,063] Trial 18 finished with value: -0.011754042435748369 and parameters: {'model_type': 'graphsage', 'hidden_dims': '[256, 128]', 'dropout': 0.4214582817413944, 'batch_norm': False, 'sage_aggr': 'mean', 'sage_normalize': False, 'sage_project': False, 'lr': 0.001419194494386327, 'weight_decay': 0.0009758934990860478, 'epochs': 62, 'loss': 'mse', 'optimizer': 'adam', 'graph_mode': 'cutoff', 'cutoff': 0.7743896139503647, 'grm_norm': 'cosine', 'self_loops': False, 'use_snp_selection': False}. Best is trial 17 with value: 0.30027958902662266.
[I 2025-12-09 15:19:50,189] Trial 19 finished with value: 0.27564543577865913 and parameters: {'model_type': 'graphsage', 'hidden_dims': '[256, 128]', 'dropout': 0.41351899471153286, 'batch_norm': True, 'sage_aggr': 'max', 'sage_normalize': False, 'sage_project': False, 'lr': 0.0010280517891387096, 'weight_decay': 0.0008418673656380595, 'epochs': 101, 'loss': 'mse', 'optimizer': 'adam', 'graph_mode': 'cutoff', 'cutoff': 0.45096531351440755, 'grm_norm': 'cosine', 'self_loops': True, 'use_snp_selection': False}. Best is trial 17 with value: 0.30027958902662266.
[I 2025-12-09 15:20:10,816] Trial 20 finished with value: 0.3001756949859901 and parameters: {'model_type': 'graphsage', 'hidden_dims': '[256, 128]', 'dropout': 0.4158910382401621, 'batch_norm': True, 'sage_aggr': 'max', 'sage_normalize': False, 'sage_project': False, 'lr': 0.0027590271392990257, 'weight_decay': 0.00019890954183082892, 'epochs': 40, 'loss': 'mse', 'optimizer': 'adam', 'graph_mode': 'cutoff', 'cutoff': 0.7378209616212532, 'grm_norm': 'cosine_then_gcn', 'self_loops': True, 'use_snp_selection': False}. Best is trial 17 with value: 0.30027958902662266.
[I 2025-12-09 15:20:45,044] Trial 21 finished with value: 0.2938726730469891 and parameters: {'model_type': 'graphsage', 'hidden_dims': '[256, 128]', 'dropout': 0.40142564316740664, 'batch_norm': True, 'sage_aggr': 'max', 'sage_normalize': False, 'sage_project': False, 'lr': 0.0035895606230145717, 'weight_decay': 0.0002293917129409824, 'epochs': 100, 'loss': 'mse', 'optimizer': 'adam', 'graph_mode': 'cutoff', 'cutoff': 0.7501898429797068, 'grm_norm': 'cosine_then_gcn', 'self_loops': True, 'use_snp_selection': False}. Best is trial 17 with value: 0.30027958902662266.
[I 2025-12-09 15:21:05,598] Trial 22 finished with value: 0.2871154353549831 and parameters: {'model_type': 'graphsage', 'hidden_dims': '[256, 128]', 'dropout': 0.4526206807195812, 'batch_norm': True, 'sage_aggr': 'max', 'sage_normalize': False, 'sage_project': False, 'lr': 0.00013256607502279362, 'weight_decay': 0.00048737564126386185, 'epochs': 40, 'loss': 'mse', 'optimizer': 'adam', 'graph_mode': 'cutoff', 'cutoff': 0.7973370812826049, 'grm_norm': 'cosine_then_gcn', 'self_loops': True, 'use_snp_selection': False}. Best is trial 17 with value: 0.30027958902662266.
[I 2025-12-09 15:21:39,386] Trial 23 finished with value: 0.29328755358240793 and parameters: {'model_type': 'graphsage', 'hidden_dims': '[256, 128]', 'dropout': 0.3910301739666856, 'batch_norm': True, 'sage_aggr': 'max', 'sage_normalize': False, 'sage_project': False, 'lr': 0.0037029189305570875, 'weight_decay': 0.00013842822285441375, 'epochs': 102, 'loss': 'mse', 'optimizer': 'adam', 'graph_mode': 'cutoff', 'cutoff': 0.7504834504317955, 'grm_norm': 'gcn', 'self_loops': True, 'use_snp_selection': False}. Best is trial 17 with value: 0.30027958902662266.
[I 2025-12-09 15:21:59,914] Trial 24 finished with value: 0.3002042771636864 and parameters: {'model_type': 'graphsage', 'hidden_dims': '[256, 128]', 'dropout': 0.46174215249655615, 'batch_norm': True, 'sage_aggr': 'max', 'sage_normalize': False, 'sage_project': False, 'lr': 0.0008688027900647909, 'weight_decay': 0.00045710666672106, 'epochs': 40, 'loss': 'mse', 'optimizer': 'adam', 'graph_mode': 'cutoff', 'cutoff': 0.8199519404375315, 'grm_norm': 'cosine_then_gcn', 'self_loops': True, 'use_snp_selection': False}. Best is trial 17 with value: 0.30027958902662266.
[I 2025-12-09 15:22:21,783] Trial 25 finished with value: 0.2933751534401171 and parameters: {'model_type': 'graphsage', 'hidden_dims': '[256, 128]', 'dropout': 0.47234019723666726, 'batch_norm': True, 'sage_aggr': 'max', 'sage_normalize': False, 'sage_project': False, 'lr': 0.0008711423699186112, 'weight_decay': 0.0003403383915497489, 'epochs': 46, 'loss': 'mse', 'optimizer': 'adam', 'graph_mode': 'cutoff', 'cutoff': 0.7037161251683467, 'grm_norm': 'cosine_then_gcn', 'self_loops': True, 'use_snp_selection': False}. Best is trial 17 with value: 0.30027958902662266.
[I 2025-12-09 15:22:53,933] Trial 26 finished with value: 0.2950335503585361 and parameters: {'model_type': 'graphsage', 'hidden_dims': '[256, 128]', 'dropout': 0.549262648975849, 'batch_norm': True, 'sage_aggr': 'mean', 'sage_normalize': True, 'sage_project': False, 'lr': 0.00018261035730288063, 'weight_decay': 0.00012359136265874095, 'epochs': 90, 'loss': 'mse', 'optimizer': 'adam', 'graph_mode': 'cutoff', 'cutoff': 0.8234122100963018, 'grm_norm': 'cosine_then_gcn', 'self_loops': True, 'use_snp_selection': False}. Best is trial 17 with value: 0.30027958902662266.
[I 2025-12-09 15:23:31,154] Trial 27 finished with value: 0.08255709990880927 and parameters: {'model_type': 'graphsage', 'hidden_dims': '[128, 64]', 'dropout': 0.3686100469590262, 'batch_norm': False, 'sage_aggr': 'max', 'sage_normalize': False, 'sage_project': False, 'lr': 0.0006207929014351972, 'weight_decay': 0.00035750536241648716, 'epochs': 120, 'loss': 'mae', 'optimizer': 'adam', 'graph_mode': 'cutoff', 'cutoff': 0.3772369258416245, 'grm_norm': 'cosine_then_gcn', 'self_loops': False, 'use_snp_selection': False}. Best is trial 17 with value: 0.30027958902662266.
[I 2025-12-09 15:24:37,514] Trial 28 finished with value: 0.29212724516385774 and parameters: {'model_type': 'graphsage', 'hidden_dims': '[512, 64]', 'dropout': 0.45257820703379464, 'batch_norm': True, 'sage_aggr': 'max', 'sage_normalize': False, 'sage_project': False, 'lr': 0.0014469929529687352, 'weight_decay': 0.0008910759200852317, 'epochs': 128, 'loss': 'mse', 'optimizer': 'adam', 'graph_mode': 'cutoff', 'cutoff': 0.6917670052386932, 'grm_norm': 'cosine_then_gcn', 'self_loops': True, 'use_snp_selection': False}. Best is trial 17 with value: 0.30027958902662266.
[I 2025-12-09 15:25:34,144] Trial 29 finished with value: 0.2606093914852396 and parameters: {'model_type': 'graphsage', 'hidden_dims': '[512, 256]', 'dropout': 0.5402489487632578, 'batch_norm': True, 'sage_aggr': 'max', 'sage_normalize': True, 'sage_project': False, 'lr': 0.0036665520050115454, 'weight_decay': 0.00017208946001235086, 'epochs': 76, 'loss': 'mse', 'optimizer': 'adam', 'graph_mode': 'knn', 'knn_k': 3, 'weighted_edges': False, 'symmetrize_mode': 'union', 'self_loops': True, 'use_snp_selection': False}. Best is trial 17 with value: 0.30027958902662266.
[I 2025-12-09 15:26:06,557] Trial 30 finished with value: 0.2870472019355724 and parameters: {'model_type': 'graphsage', 'hidden_dims': '[512, 128]', 'dropout': 0.37371068354224424, 'batch_norm': True, 'sage_aggr': 'max', 'sage_normalize': False, 'sage_project': False, 'lr': 0.00021744012628968274, 'weight_decay': 0.0002202683174881331, 'epochs': 45, 'loss': 'mse', 'optimizer': 'adam', 'graph_mode': 'cutoff', 'cutoff': 0.5578082010081278, 'grm_norm': 'cosine_then_gcn', 'self_loops': True, 'use_snp_selection': False}. Best is trial 17 with value: 0.30027958902662266.
[I 2025-12-09 15:26:34,644] Trial 31 finished with value: 0.2975178957621195 and parameters: {'model_type': 'graphsage', 'hidden_dims': '[256, 128]', 'dropout': 0.4415916523670944, 'batch_norm': True, 'sage_aggr': 'max', 'sage_normalize': False, 'sage_project': False, 'lr': 0.0018121066671552086, 'weight_decay': 0.0005474650056614814, 'epochs': 74, 'loss': 'mse', 'optimizer': 'adam', 'graph_mode': 'cutoff', 'cutoff': 0.8244301480938822, 'grm_norm': 'cosine', 'self_loops': True, 'use_snp_selection': False}. Best is trial 17 with value: 0.30027958902662266.
[I 2025-12-09 15:27:00,955] Trial 32 finished with value: 0.2982672952852262 and parameters: {'model_type': 'graphsage', 'hidden_dims': '[256, 128]', 'dropout': 0.4333439344176567, 'batch_norm': True, 'sage_aggr': 'max', 'sage_normalize': False, 'sage_project': False, 'lr': 0.0011632013714631547, 'weight_decay': 0.0006535685193861179, 'epochs': 66, 'loss': 'mse', 'optimizer': 'adam', 'graph_mode': 'cutoff', 'cutoff': 0.8450017127001397, 'grm_norm': 'cosine', 'self_loops': True, 'use_snp_selection': False}. Best is trial 17 with value: 0.30027958902662266.
[I 2025-12-09 15:27:31,720] Trial 33 finished with value: 0.2974890168332584 and parameters: {'model_type': 'graphsage', 'hidden_dims': '[256, 128]', 'dropout': 0.4762113293761182, 'batch_norm': True, 'sage_aggr': 'max', 'sage_normalize': False, 'sage_project': False, 'lr': 0.0005634425568986518, 'weight_decay': 0.0003061711725231843, 'epochs': 86, 'loss': 'mse', 'optimizer': 'adam', 'graph_mode': 'cutoff', 'cutoff': 0.7183939360204749, 'grm_norm': 'cosine', 'self_loops': True, 'use_snp_selection': False}. Best is trial 17 with value: 0.30027958902662266.
[I 2025-12-09 15:27:58,836] Trial 34 finished with value: 0.25023162192285825 and parameters: {'model_type': 'graphsage', 'hidden_dims': '[128, 64]', 'dropout': 0.3257934225294451, 'batch_norm': False, 'sage_aggr': 'max', 'sage_normalize': False, 'sage_project': False, 'lr': 0.0026420014496524847, 'weight_decay': 4.975104786569102e-05, 'epochs': 117, 'loss': 'mse', 'optimizer': 'adam', 'graph_mode': 'cutoff', 'cutoff': 0.892125807574659, 'grm_norm': 'gcn', 'self_loops': True, 'use_snp_selection': True, 'num_snps': 2241}. Best is trial 17 with value: 0.30027958902662266.
[I 2025-12-09 15:28:35,726] Trial 35 finished with value: 0.25070957774072333 and parameters: {'model_type': 'graphsage', 'hidden_dims': '[256, 128]', 'dropout': 0.3703248028713751, 'batch_norm': True, 'sage_aggr': 'max', 'sage_normalize': False, 'sage_project': False, 'lr': 0.0002790634029066202, 'weight_decay': 0.00011498019038564708, 'epochs': 60, 'loss': 'mse', 'optimizer': 'adam', 'graph_mode': 'knn', 'knn_k': 4, 'weighted_edges': True, 'symmetrize_mode': 'union', 'self_loops': True, 'use_snp_selection': False}. Best is trial 17 with value: 0.30027958902662266.
[I 2025-12-09 15:30:24,011] Trial 36 finished with value: 0.2872705874391355 and parameters: {'model_type': 'graphsage', 'hidden_dims': '[512, 128]', 'dropout': 0.4797795108959691, 'batch_norm': True, 'sage_aggr': 'max', 'sage_normalize': False, 'sage_project': False, 'lr': 0.0055192873973149885, 'weight_decay': 0.000583803144547155, 'epochs': 140, 'loss': 'mae', 'optimizer': 'adam', 'graph_mode': 'cutoff', 'cutoff': 0.804190129609904, 'grm_norm': 'cosine_then_gcn', 'self_loops': False, 'use_snp_selection': True, 'num_snps': 59922}. Best is trial 17 with value: 0.30027958902662266.
[I 2025-12-09 15:30:54,413] Trial 37 finished with value: 0.30141857550670126 and parameters: {'model_type': 'graphsage', 'hidden_dims': '[512, 256]', 'dropout': 0.30618407366413447, 'batch_norm': True, 'sage_aggr': 'max', 'sage_normalize': False, 'sage_project': False, 'lr': 0.0030226303148346997, 'weight_decay': 5.3676607723444975e-06, 'epochs': 41, 'loss': 'mse', 'optimizer': 'adam', 'graph_mode': 'cutoff', 'cutoff': 0.8364361917846033, 'grm_norm': 'cosine', 'self_loops': True, 'use_snp_selection': False}. Best is trial 37 with value: 0.30141857550670126.
[I 2025-12-09 15:31:45,064] Trial 38 finished with value: 0.057196224016789775 and parameters: {'model_type': 'graphsage', 'hidden_dims': '[512, 256]', 'dropout': 0.20702426795911522, 'batch_norm': False, 'sage_aggr': 'mean', 'sage_normalize': True, 'sage_project': False, 'lr': 0.003458805180753242, 'weight_decay': 7.392486461145812e-06, 'epochs': 42, 'loss': 'mae', 'optimizer': 'adam', 'graph_mode': 'knn', 'knn_k': 10, 'weighted_edges': True, 'symmetrize_mode': 'union', 'self_loops': False, 'use_snp_selection': False}. Best is trial 37 with value: 0.30141857550670126.
[I 2025-12-09 15:32:36,660] Trial 39 finished with value: 0.2794683286152876 and parameters: {'model_type': 'graphsage', 'hidden_dims': '[512, 256]', 'dropout': 0.29074207672457864, 'batch_norm': True, 'sage_aggr': 'max', 'sage_normalize': False, 'sage_project': False, 'lr': 0.0015100378150487562, 'weight_decay': 2.601489980000073e-06, 'epochs': 201, 'loss': 'mse', 'optimizer': 'adam', 'graph_mode': 'cutoff', 'cutoff': 0.7083200457477851, 'grm_norm': 'gcn', 'self_loops': True, 'use_snp_selection': True, 'num_snps': 15197}. Best is trial 37 with value: 0.30141857550670126.
[I 2025-12-09 15:35:08,952] Trial 40 finished with value: 0.2571101400494903 and parameters: {'model_type': 'graphsage', 'hidden_dims': '[512, 256]', 'dropout': 0.2469587813106559, 'batch_norm': True, 'sage_aggr': 'max', 'sage_normalize': False, 'sage_project': False, 'lr': 0.0008325278263817297, 'weight_decay': 7.557781307265559e-07, 'epochs': 168, 'loss': 'mae', 'optimizer': 'adam', 'graph_mode': 'knn', 'knn_k': 7, 'weighted_edges': False, 'symmetrize_mode': 'union', 'self_loops': True, 'use_snp_selection': False}. Best is trial 37 with value: 0.30141857550670126.
[I 2025-12-09 15:35:46,041] Trial 41 finished with value: 0.2971782554335537 and parameters: {'model_type': 'graphsage', 'hidden_dims': '[512, 64]', 'dropout': 0.3392341713439302, 'batch_norm': True, 'sage_aggr': 'max', 'sage_normalize': False, 'sage_project': False, 'lr': 0.001980820227113938, 'weight_decay': 4.168456698281502e-06, 'epochs': 57, 'loss': 'mse', 'optimizer': 'adam', 'graph_mode': 'cutoff', 'cutoff': 0.854286655883589, 'grm_norm': 'cosine', 'self_loops': True, 'use_snp_selection': False}. Best is trial 37 with value: 0.30141857550670126.
[I 2025-12-09 15:36:34,544] Trial 42 finished with value: 0.2956640041830627 and parameters: {'model_type': 'graphsage', 'hidden_dims': '[512, 256]', 'dropout': 0.3955306428972237, 'batch_norm': True, 'sage_aggr': 'max', 'sage_normalize': False, 'sage_project': False, 'lr': 0.002779808147326284, 'weight_decay': 7.006381067190493e-07, 'epochs': 84, 'loss': 'mse', 'optimizer': 'adam', 'graph_mode': 'cutoff', 'cutoff': 0.8007887578312121, 'grm_norm': 'cosine', 'self_loops': True, 'use_snp_selection': False}. Best is trial 37 with value: 0.30141857550670126.
[I 2025-12-09 15:36:52,282] Trial 43 finished with value: 0.29076612585934286 and parameters: {'model_type': 'graphsage', 'hidden_dims': '[128, 64]', 'dropout': 0.30929617128335024, 'batch_norm': True, 'sage_aggr': 'max', 'sage_normalize': False, 'sage_project': False, 'lr': 0.005226947172014253, 'weight_decay': 0.0002591787421298467, 'epochs': 53, 'loss': 'mse', 'optimizer': 'adam', 'graph_mode': 'cutoff', 'cutoff': 0.8560685791819248, 'grm_norm': 'cosine', 'self_loops': True, 'use_snp_selection': False}. Best is trial 37 with value: 0.30141857550670126.
