[I 2025-12-09 10:43:17,373] Trial 82 finished with value: 0.28663444868429533 and parameters: {'model_type': 'graphsage', 'hidden_dims': '[512, 128]', 'dropout': 0.19013751787480448, 'batch_norm': True, 'sage_aggr': 'mean', 'sage_normalize': True, 'sage_project': False, 'lr': 6.763957865718076e-05, 'weight_decay': 0.0007547776482335055, 'epochs': 91, 'loss': 'mae', 'optimizer': 'adam', 'graph_mode': 'cutoff', 'cutoff': 0.4967559771474938, 'grm_norm': 'gcn', 'self_loops': False, 'use_snp_selection': True, 'num_snps': 57104}. Best is trial 77 with value: 0.2978067463653598.
[I 2025-12-09 10:45:17,442] Trial 83 finished with value: 0.2888187683300699 and parameters: {'model_type': 'graphsage', 'hidden_dims': '[512, 128]', 'dropout': 0.211525603612914, 'batch_norm': True, 'sage_aggr': 'mean', 'sage_normalize': True, 'sage_project': False, 'lr': 0.00015700217871135593, 'weight_decay': 0.0003831433952931648, 'epochs': 128, 'loss': 'mae', 'optimizer': 'adam', 'graph_mode': 'cutoff', 'cutoff': 0.46631664679447055, 'grm_norm': 'gcn', 'self_loops': False, 'use_snp_selection': True, 'num_snps': 57557}. Best is trial 77 with value: 0.2978067463653598.
[I 2025-12-09 10:46:38,458] Trial 84 finished with value: 0.28615873036853323 and parameters: {'model_type': 'graphsage', 'hidden_dims': '[512, 128]', 'dropout': 0.257298646486956, 'batch_norm': True, 'sage_aggr': 'mean', 'sage_normalize': True, 'sage_project': False, 'lr': 5.128437147341616e-05, 'weight_decay': 0.00024361027698076735, 'epochs': 78, 'loss': 'mae', 'optimizer': 'adam', 'graph_mode': 'cutoff', 'cutoff': 0.39753378919677573, 'grm_norm': 'gcn', 'self_loops': False, 'use_snp_selection': True, 'num_snps': 49619}. Best is trial 77 with value: 0.2978067463653598.
[I 2025-12-09 10:48:16,663] Trial 85 finished with value: 0.2828310750837549 and parameters: {'model_type': 'graphsage', 'hidden_dims': '[512, 128]', 'dropout': 0.2266324486654853, 'batch_norm': True, 'sage_aggr': 'mean', 'sage_normalize': True, 'sage_project': False, 'lr': 8.034290318294222e-05, 'weight_decay': 0.00012178935258434934, 'epochs': 189, 'loss': 'mse', 'optimizer': 'adam', 'graph_mode': 'cutoff', 'cutoff': 0.510892786879089, 'grm_norm': 'gcn', 'self_loops': False, 'use_snp_selection': False}. Best is trial 77 with value: 0.2978067463653598.
[I 2025-12-09 10:49:11,076] Trial 86 finished with value: 0.2879051886684846 and parameters: {'model_type': 'graphsage', 'hidden_dims': '[512, 256]', 'dropout': 0.1840708631922452, 'batch_norm': True, 'sage_aggr': 'mean', 'sage_normalize': True, 'sage_project': False, 'lr': 3.883493451913672e-05, 'weight_decay': 0.0006227423144679547, 'epochs': 57, 'loss': 'mae', 'optimizer': 'adam', 'graph_mode': 'cutoff', 'cutoff': 0.5762503824652148, 'grm_norm': 'gcn', 'self_loops': False, 'use_snp_selection': True, 'num_snps': 39077}. Best is trial 77 with value: 0.2978067463653598.
[I 2025-12-09 10:50:37,701] Trial 87 finished with value: 0.2780207870545252 and parameters: {'model_type': 'graphsage', 'hidden_dims': '[512, 128]', 'dropout': 0.28555585075266166, 'batch_norm': True, 'sage_aggr': 'mean', 'sage_normalize': True, 'sage_project': False, 'lr': 0.0030279347867817165, 'weight_decay': 0.0003089475718160556, 'epochs': 97, 'loss': 'mae', 'optimizer': 'adam', 'graph_mode': 'cutoff', 'cutoff': 0.6355641970380081, 'grm_norm': 'none', 'self_loops': False, 'use_snp_selection': True, 'num_snps': 58075}. Best is trial 77 with value: 0.2978067463653598.
[I 2025-12-09 10:51:44,131] Trial 88 finished with value: 0.2779966603506793 and parameters: {'model_type': 'graphsage', 'hidden_dims': '[512, 128]', 'dropout': 0.3196437503367182, 'batch_norm': False, 'sage_aggr': 'mean', 'sage_normalize': False, 'sage_project': False, 'lr': 0.00010142402077259962, 'weight_decay': 4.293410090017497e-06, 'epochs': 109, 'loss': 'mae', 'optimizer': 'adam', 'graph_mode': 'cutoff', 'cutoff': 0.4785111458345923, 'grm_norm': 'gcn', 'self_loops': False, 'use_snp_selection': True, 'num_snps': 32407}. Best is trial 77 with value: 0.2978067463653598.
[I 2025-12-09 10:53:17,712] Trial 89 finished with value: 0.29650938971482493 and parameters: {'model_type': 'graphsage', 'hidden_dims': '[512, 128]', 'dropout': 0.2030904919029168, 'batch_norm': True, 'sage_aggr': 'mean', 'sage_normalize': True, 'sage_project': False, 'lr': 4.465694326970966e-05, 'weight_decay': 0.0001490504968187239, 'epochs': 89, 'loss': 'mae', 'optimizer': 'adam', 'graph_mode': 'cutoff', 'cutoff': 0.4222325807249548, 'grm_norm': 'cosine_then_gcn', 'self_loops': False, 'use_snp_selection': True, 'num_snps': 55146}. Best is trial 77 with value: 0.2978067463653598.
[I 2025-12-09 10:55:00,190] Trial 90 finished with value: 0.2346034178745136 and parameters: {'model_type': 'graphsage', 'hidden_dims': '[512, 128]', 'dropout': 0.23791431009478253, 'batch_norm': True, 'sage_aggr': 'max', 'sage_normalize': True, 'sage_project': False, 'lr': 2.768833445520774e-05, 'weight_decay': 9.069854700709345e-05, 'epochs': 67, 'loss': 'mae', 'optimizer': 'adam', 'graph_mode': 'knn', 'knn_k': 4, 'weighted_edges': True, 'symmetrize_mode': 'union', 'self_loops': True, 'use_snp_selection': True, 'num_snps': 54978}. Best is trial 77 with value: 0.2978067463653598.
[I 2025-12-09 10:56:33,267] Trial 91 finished with value: 0.29540158004462674 and parameters: {'model_type': 'graphsage', 'hidden_dims': '[512, 128]', 'dropout': 0.1643228270439611, 'batch_norm': True, 'sage_aggr': 'mean', 'sage_normalize': True, 'sage_project': False, 'lr': 4.6156477400352394e-05, 'weight_decay': 0.00014220442125983105, 'epochs': 91, 'loss': 'mae', 'optimizer': 'adam', 'graph_mode': 'cutoff', 'cutoff': 0.4199670451369502, 'grm_norm': 'cosine_then_gcn', 'self_loops': False, 'use_snp_selection': True, 'num_snps': 52705}. Best is trial 77 with value: 0.2978067463653598.
[I 2025-12-09 10:58:04,112] Trial 92 finished with value: 0.2950059493695238 and parameters: {'model_type': 'graphsage', 'hidden_dims': '[512, 128]', 'dropout': 0.15660243339643945, 'batch_norm': True, 'sage_aggr': 'mean', 'sage_normalize': True, 'sage_project': False, 'lr': 5.281310440412674e-05, 'weight_decay': 0.00014608107214595845, 'epochs': 87, 'loss': 'mae', 'optimizer': 'adam', 'graph_mode': 'cutoff', 'cutoff': 0.4117478917430129, 'grm_norm': 'cosine_then_gcn', 'self_loops': False, 'use_snp_selection': True, 'num_snps': 52695}. Best is trial 77 with value: 0.2978067463653598.
[I 2025-12-09 10:59:34,694] Trial 93 finished with value: 0.2905751735852805 and parameters: {'model_type': 'graphsage', 'hidden_dims': '[512, 128]', 'dropout': 0.15921101588801784, 'batch_norm': True, 'sage_aggr': 'mean', 'sage_normalize': True, 'sage_project': False, 'lr': 4.2418297018838045e-05, 'weight_decay': 0.00015815036496947342, 'epochs': 88, 'loss': 'mae', 'optimizer': 'adam', 'graph_mode': 'cutoff', 'cutoff': 0.4435044617331254, 'grm_norm': 'cosine_then_gcn', 'self_loops': False, 'use_snp_selection': True, 'num_snps': 52749}. Best is trial 77 with value: 0.2978067463653598.
[I 2025-12-09 11:00:56,789] Trial 94 finished with value: 0.2757851476223208 and parameters: {'model_type': 'graphsage', 'hidden_dims': '[512, 128]', 'dropout': 0.14151089471372053, 'batch_norm': True, 'sage_aggr': 'mean', 'sage_normalize': True, 'sage_project': False, 'lr': 1.710689058002253e-05, 'weight_decay': 6.188278970021081e-05, 'epochs': 77, 'loss': 'mae', 'optimizer': 'adam', 'graph_mode': 'cutoff', 'cutoff': 0.39145412394934015, 'grm_norm': 'cosine_then_gcn', 'self_loops': False, 'use_snp_selection': True, 'num_snps': 50821}. Best is trial 77 with value: 0.2978067463653598.
[I 2025-12-09 11:02:34,348] Trial 95 finished with value: 0.2881206043040704 and parameters: {'model_type': 'graphsage', 'hidden_dims': '[512, 128]', 'dropout': 0.16570102610026816, 'batch_norm': True, 'sage_aggr': 'mean', 'sage_normalize': True, 'sage_project': False, 'lr': 3.3941327812934206e-05, 'weight_decay': 4.726426342725796e-05, 'epochs': 96, 'loss': 'mae', 'optimizer': 'adam', 'graph_mode': 'cutoff', 'cutoff': 0.41218249594137524, 'grm_norm': 'cosine_then_gcn', 'self_loops': False, 'use_snp_selection': True, 'num_snps': 55164}. Best is trial 77 with value: 0.2978067463653598.
[I 2025-12-09 11:03:08,384] Trial 96 finished with value: 0.2676174781294045 and parameters: {'model_type': 'graphsage', 'hidden_dims': '[256, 128, 64]', 'dropout': 0.20058909593239876, 'batch_norm': True, 'sage_aggr': 'mean', 'sage_normalize': True, 'sage_project': False, 'lr': 4.7867212332384186e-05, 'weight_decay': 2.2731738608925082e-07, 'epochs': 69, 'loss': 'mse', 'optimizer': 'adam', 'graph_mode': 'cutoff', 'cutoff': 0.31218128774254555, 'grm_norm': 'cosine_then_gcn', 'self_loops': False, 'use_snp_selection': False}. Best is trial 77 with value: 0.2978067463653598.
[I 2025-12-09 11:04:36,829] Trial 97 finished with value: 0.2967006555928754 and parameters: {'model_type': 'graphsage', 'hidden_dims': '[512, 64]', 'dropout': 0.11125920714992654, 'batch_norm': True, 'sage_aggr': 'mean', 'sage_normalize': True, 'sage_project': False, 'lr': 6.054395335659533e-05, 'weight_decay': 9.913441039602873e-05, 'epochs': 81, 'loss': 'mae', 'optimizer': 'adam', 'graph_mode': 'cutoff', 'cutoff': 0.43344363360333066, 'grm_norm': 'cosine_then_gcn', 'self_loops': False, 'use_snp_selection': True, 'num_snps': 52967}. Best is trial 77 with value: 0.2978067463653598.
[I 2025-12-09 11:06:10,764] Trial 98 finished with value: 0.2824596147050799 and parameters: {'model_type': 'graphsage', 'hidden_dims': '[512, 64]', 'dropout': 0.11992128115072039, 'batch_norm': True, 'sage_aggr': 'mean', 'sage_normalize': True, 'sage_project': False, 'lr': 7.549101309105039e-05, 'weight_decay': 0.00010003207630017753, 'epochs': 99, 'loss': 'mae', 'optimizer': 'adam', 'graph_mode': 'cutoff', 'cutoff': 0.3543015308186965, 'grm_norm': 'cosine_then_gcn', 'self_loops': False, 'use_snp_selection': True, 'num_snps': 48309}. Best is trial 77 with value: 0.2978067463653598.
[I 2025-12-09 11:07:46,736] Trial 99 finished with value: 0.2870335927483759 and parameters: {'model_type': 'graphsage', 'hidden_dims': '[512, 64]', 'dropout': 0.1829007397917058, 'batch_norm': True, 'sage_aggr': 'mean', 'sage_normalize': False, 'sage_project': False, 'lr': 6.373782979914753e-05, 'weight_decay': 0.00014082228920983555, 'epochs': 80, 'loss': 'mae', 'optimizer': 'adam', 'graph_mode': 'cutoff', 'cutoff': 0.38373271973329603, 'grm_norm': 'cosine_then_gcn', 'self_loops': False, 'use_snp_selection': True, 'num_snps': 58738}. Best is trial 77 with value: 0.2978067463653598.
[I 2025-12-09 11:08:54,283] Trial 100 finished with value: 0.2754123393599296 and parameters: {'model_type': 'graphsage', 'hidden_dims': '[512, 64]', 'dropout': 0.14772559801793633, 'batch_norm': True, 'sage_aggr': 'mean', 'sage_normalize': True, 'sage_project': False, 'lr': 9.414274916496187e-05, 'weight_decay': 8.190877017684338e-05, 'epochs': 56, 'loss': 'mae', 'optimizer': 'adam', 'graph_mode': 'cutoff', 'cutoff': 0.42620927287984856, 'grm_norm': 'cosine_then_gcn', 'self_loops': False, 'use_snp_selection': True, 'num_snps': 46385}. Best is trial 77 with value: 0.2978067463653598.
[I 2025-12-09 11:10:25,499] Trial 101 finished with value: 0.2828361773246823 and parameters: {'model_type': 'graphsage', 'hidden_dims': '[512, 64]', 'dropout': 0.13343127155706985, 'batch_norm': True, 'sage_aggr': 'mean', 'sage_normalize': True, 'sage_project': False, 'lr': 4.664828711069896e-05, 'weight_decay': 0.00019162816976245868, 'epochs': 88, 'loss': 'mae', 'optimizer': 'adam', 'graph_mode': 'cutoff', 'cutoff': 0.4629045657073856, 'grm_norm': 'cosine_then_gcn', 'self_loops': False, 'use_snp_selection': True, 'num_snps': 52998}. Best is trial 77 with value: 0.2978067463653598.
[I 2025-12-09 11:11:32,522] Trial 102 finished with value: 0.2931210616039578 and parameters: {'model_type': 'graphsage', 'hidden_dims': '[512, 128]', 'dropout': 0.1117420649616324, 'batch_norm': True, 'sage_aggr': 'mean', 'sage_normalize': True, 'sage_project': False, 'lr': 5.708363517526339e-05, 'weight_decay': 0.00012690939422338414, 'epochs': 48, 'loss': 'mae', 'optimizer': 'adam', 'graph_mode': 'cutoff', 'cutoff': 0.4305577685492366, 'grm_norm': 'cosine_then_gcn', 'self_loops': False, 'use_snp_selection': True, 'num_snps': 50167}. Best is trial 77 with value: 0.2978067463653598.
[I 2025-12-09 11:12:51,696] Trial 103 finished with value: 0.2937204569605793 and parameters: {'model_type': 'graphsage', 'hidden_dims': '[512, 128]', 'dropout': 0.11343313769495916, 'batch_norm': True, 'sage_aggr': 'mean', 'sage_normalize': True, 'sage_project': False, 'lr': 5.682737940602978e-05, 'weight_decay': 7.605682334323883e-05, 'epochs': 64, 'loss': 'mae', 'optimizer': 'adam', 'graph_mode': 'cutoff', 'cutoff': 0.4348654179030271, 'grm_norm': 'cosine_then_gcn', 'self_loops': False, 'use_snp_selection': True, 'num_snps': 53876}. Best is trial 77 with value: 0.2978067463653598.
[I 2025-12-09 11:13:58,829] Trial 104 finished with value: 0.2779557340287854 and parameters: {'model_type': 'graphsage', 'hidden_dims': '[512, 128]', 'dropout': 0.11351900299596615, 'batch_norm': True, 'sage_aggr': 'mean', 'sage_normalize': True, 'sage_project': False, 'lr': 5.776407360601745e-05, 'weight_decay': 3.1618525351656296e-05, 'epochs': 47, 'loss': 'mae', 'optimizer': 'adam', 'graph_mode': 'cutoff', 'cutoff': 0.41670951327010686, 'grm_norm': 'cosine_then_gcn', 'self_loops': False, 'use_snp_selection': True, 'num_snps': 50317}. Best is trial 77 with value: 0.2978067463653598.
[I 2025-12-09 11:15:08,563] Trial 105 finished with value: 0.2948534505673953 and parameters: {'model_type': 'graphsage', 'hidden_dims': '[512, 128]', 'dropout': 0.11192689803012912, 'batch_norm': True, 'sage_aggr': 'mean', 'sage_normalize': True, 'sage_project': False, 'lr': 5.4125449356430274e-05, 'weight_decay': 7.322583196757687e-05, 'epochs': 65, 'loss': 'mae', 'optimizer': 'adam', 'graph_mode': 'cutoff', 'cutoff': 0.38020308550887727, 'grm_norm': 'cosine_then_gcn', 'self_loops': False, 'use_snp_selection': True, 'num_snps': 43207}. Best is trial 77 with value: 0.2978067463653598.
[I 2025-12-09 11:16:10,666] Trial 106 finished with value: 0.2901841985719882 and parameters: {'model_type': 'graphsage', 'hidden_dims': '[256, 128]', 'dropout': 0.13194563654921304, 'batch_norm': True, 'sage_aggr': 'mean', 'sage_normalize': True, 'sage_project': False, 'lr': 7.263164395353534e-05, 'weight_decay': 7.270065203909965e-05, 'epochs': 65, 'loss': 'mae', 'optimizer': 'adam', 'graph_mode': 'cutoff', 'cutoff': 0.3310109077857286, 'grm_norm': 'cosine_then_gcn', 'self_loops': False, 'use_snp_selection': True, 'num_snps': 42759}. Best is trial 77 with value: 0.2978067463653598.
[I 2025-12-09 11:17:14,159] Trial 107 finished with value: 0.247113510438221 and parameters: {'model_type': 'graphsage', 'hidden_dims': '[128, 64]', 'dropout': 0.14472536536827546, 'batch_norm': False, 'sage_aggr': 'max', 'sage_normalize': True, 'sage_project': False, 'lr': 3.7886337927210265e-05, 'weight_decay': 5.83540960706941e-05, 'epochs': 62, 'loss': 'mae', 'optimizer': 'adam', 'graph_mode': 'cutoff', 'cutoff': 0.37301895982457167, 'grm_norm': 'cosine_then_gcn', 'self_loops': False, 'use_snp_selection': True, 'num_snps': 52282}. Best is trial 77 with value: 0.2978067463653598.
[I 2025-12-09 11:17:54,659] Trial 108 finished with value: 0.28343494803230757 and parameters: {'model_type': 'graphsage', 'hidden_dims': '[512, 64]', 'dropout': 0.17162587778139507, 'batch_norm': True, 'sage_aggr': 'mean', 'sage_normalize': True, 'sage_project': False, 'lr': 6.567934720813441e-05, 'weight_decay': 3.868603230288107e-05, 'epochs': 84, 'loss': 'mae', 'optimizer': 'adam', 'graph_mode': 'cutoff', 'cutoff': 0.4421113616469637, 'grm_norm': 'cosine_then_gcn', 'self_loops': True, 'use_snp_selection': True, 'num_snps': 14278}. Best is trial 77 with value: 0.2978067463653598.
[I 2025-12-09 11:19:30,399] Trial 109 finished with value: 0.29606827662089974 and parameters: {'model_type': 'graphsage', 'hidden_dims': '[512, 256]', 'dropout': 0.15775892308270603, 'batch_norm': True, 'sage_aggr': 'mean', 'sage_normalize': True, 'sage_project': False, 'lr': 0.00011200646638269333, 'weight_decay': 0.00010580776533435931, 'epochs': 93, 'loss': 'mae', 'optimizer': 'adam', 'graph_mode': 'cutoff', 'cutoff': 0.4065999046874136, 'grm_norm': 'cosine_then_gcn', 'self_loops': False, 'use_snp_selection': True, 'num_snps': 53534}. Best is trial 77 with value: 0.2978067463653598.
[I 2025-12-09 11:20:27,557] Trial 110 finished with value: 0.2939540356026106 and parameters: {'model_type': 'graphsage', 'hidden_dims': '[512, 256]', 'dropout': 0.15899607963680243, 'batch_norm': True, 'sage_aggr': 'mean', 'sage_normalize': True, 'sage_project': False, 'lr': 5.061386502662688e-05, 'weight_decay': 7.510667066494111e-05, 'epochs': 91, 'loss': 'mse', 'optimizer': 'adam', 'graph_mode': 'cutoff', 'cutoff': 0.4092065091038226, 'grm_norm': 'cosine_then_gcn', 'self_loops': False, 'use_snp_selection': False}. Best is trial 77 with value: 0.2978067463653598.
[I 2025-12-09 11:21:25,340] Trial 111 finished with value: 0.290337566368438 and parameters: {'model_type': 'graphsage', 'hidden_dims': '[512, 256]', 'dropout': 0.1510528407232928, 'batch_norm': True, 'sage_aggr': 'mean', 'sage_normalize': True, 'sage_project': False, 'lr': 4.923430351086324e-05, 'weight_decay': 7.886954864350077e-05, 'epochs': 92, 'loss': 'mse', 'optimizer': 'adam', 'graph_mode': 'cutoff', 'cutoff': 0.4066571852839741, 'grm_norm': 'cosine_then_gcn', 'self_loops': False, 'use_snp_selection': False}. Best is trial 77 with value: 0.2978067463653598.
[I 2025-12-09 11:23:08,591] Trial 112 finished with value: 0.294733967642354 and parameters: {'model_type': 'graphsage', 'hidden_dims': '[512, 256]', 'dropout': 0.1612419937041626, 'batch_norm': True, 'sage_aggr': 'mean', 'sage_normalize': True, 'sage_project': False, 'lr': 9.132355179347637e-05, 'weight_decay': 0.00011024840412857212, 'epochs': 99, 'loss': 'mse', 'optimizer': 'adam', 'graph_mode': 'cutoff', 'cutoff': 0.3844521775984766, 'grm_norm': 'cosine_then_gcn', 'self_loops': False, 'use_snp_selection': True, 'num_snps': 55578}. Best is trial 77 with value: 0.2978067463653598.
[I 2025-12-09 11:24:19,832] Trial 113 finished with value: 0.30016353402037277 and parameters: {'model_type': 'graphsage', 'hidden_dims': '[512, 256]', 'dropout': 0.15959157110945724, 'batch_norm': True, 'sage_aggr': 'mean', 'sage_normalize': True, 'sage_project': False, 'lr': 0.00010485355411288293, 'weight_decay': 0.00010866077573308778, 'epochs': 119, 'loss': 'mse', 'optimizer': 'adam', 'graph_mode': 'cutoff', 'cutoff': 0.382760586344338, 'grm_norm': 'cosine_then_gcn', 'self_loops': False, 'use_snp_selection': False}. Best is trial 113 with value: 0.30016353402037277.
[I 2025-12-09 11:25:31,280] Trial 114 finished with value: 0.2902046145661502 and parameters: {'model_type': 'graphsage', 'hidden_dims': '[512, 256]', 'dropout': 0.15786615591788722, 'batch_norm': True, 'sage_aggr': 'mean', 'sage_normalize': True, 'sage_project': False, 'lr': 8.621966636403769e-05, 'weight_decay': 0.0001463558979643136, 'epochs': 119, 'loss': 'mse', 'optimizer': 'adam', 'graph_mode': 'cutoff', 'cutoff': 0.3787866106891486, 'grm_norm': 'cosine_then_gcn', 'self_loops': False, 'use_snp_selection': False}. Best is trial 113 with value: 0.30016353402037277.
[I 2025-12-09 11:26:26,609] Trial 115 finished with value: 0.27474989966000196 and parameters: {'model_type': 'graphsage', 'hidden_dims': '[512, 256]', 'dropout': 0.1814350053386264, 'batch_norm': True, 'sage_aggr': 'mean', 'sage_normalize': True, 'sage_project': False, 'lr': 0.00010620286774546957, 'weight_decay': 0.00011323300819482545, 'epochs': 82, 'loss': 'mse', 'optimizer': 'adam', 'graph_mode': 'cutoff', 'cutoff': 0.3228262536885735, 'grm_norm': 'cosine_then_gcn', 'self_loops': False, 'use_snp_selection': False}. Best is trial 113 with value: 0.30016353402037277.
[I 2025-12-09 11:28:07,434] Trial 116 finished with value: 0.26635528393970015 and parameters: {'model_type': 'graphsage', 'hidden_dims': '[512, 256]', 'dropout': 0.16626064958992479, 'batch_norm': True, 'sage_aggr': 'mean', 'sage_normalize': True, 'sage_project': False, 'lr': 0.0001777111150243895, 'weight_decay': 1.7706118976520923e-05, 'epochs': 100, 'loss': 'mse', 'optimizer': 'adam', 'graph_mode': 'knn', 'knn_k': 10, 'weighted_edges': False, 'symmetrize_mode': 'union', 'self_loops': False, 'use_snp_selection': False}. Best is trial 113 with value: 0.30016353402037277.
[I 2025-12-09 11:30:23,235] Trial 117 finished with value: 0.29538023658551604 and parameters: {'model_type': 'graphsage', 'hidden_dims': '[512, 256]', 'dropout': 0.12897804483420378, 'batch_norm': True, 'sage_aggr': 'mean', 'sage_normalize': True, 'sage_project': False, 'lr': 8.805758073687631e-05, 'weight_decay': 0.00019924469538038566, 'epochs': 247, 'loss': 'mse', 'optimizer': 'adam', 'graph_mode': 'cutoff', 'cutoff': 0.36312597858744755, 'grm_norm': 'cosine_then_gcn', 'self_loops': False, 'use_snp_selection': False}. Best is trial 113 with value: 0.30016353402037277.
[I 2025-12-09 11:32:38,308] Trial 118 finished with value: 0.2903677009065834 and parameters: {'model_type': 'graphsage', 'hidden_dims': '[512, 256]', 'dropout': 0.1245817197355488, 'batch_norm': True, 'sage_aggr': 'mean', 'sage_normalize': True, 'sage_project': False, 'lr': 9.174605539881085e-05, 'weight_decay': 0.0001762738584494014, 'epochs': 243, 'loss': 'mse', 'optimizer': 'adam', 'graph_mode': 'cutoff', 'cutoff': 0.34920971902658593, 'grm_norm': 'cosine_then_gcn', 'self_loops': False, 'use_snp_selection': False}. Best is trial 113 with value: 0.30016353402037277.
