[I 2025-12-05 21:22:48,002] Trial 90 finished with value: 0.19302202862887427 and parameters: {'model_type': 'graphsage', 'hidden_dims': '[512, 128]', 'dropout': 0.593760742902952, 'batch_norm': True, 'sage_aggr': 'max', 'sage_normalize': True, 'sage_project': False, 'lr': 0.0008702443728688723, 'weight_decay': 0.00011243944436272206, 'epochs': 245, 'loss': 'mae', 'optimizer': 'adam', 'graph_mode': 'knn', 'knn_k': 3, 'weighted_edges': True, 'symmetrize_mode': 'union', 'self_loops': False, 'use_snp_selection': True, 'num_snps': 21221, 'graphsage_batch_size': 8}. Best is trial 63 with value: 0.23771832062188675.
[I 2025-12-05 21:23:42,097] Trial 91 finished with value: 0.22572451440600955 and parameters: {'model_type': 'graphsage', 'hidden_dims': '[512, 128]', 'dropout': 0.561544938997426, 'batch_norm': True, 'sage_aggr': 'max', 'sage_normalize': True, 'sage_project': False, 'lr': 0.0007293431525454011, 'weight_decay': 0.00012932902165879953, 'epochs': 238, 'loss': 'mae', 'optimizer': 'adam', 'graph_mode': 'cutoff', 'cutoff': 0.7928949692294744, 'grm_norm': 'cosine_then_gcn', 'self_loops': False, 'use_snp_selection': True, 'num_snps': 17997, 'graphsage_batch_size': 8}. Best is trial 63 with value: 0.23771832062188675.
[I 2025-12-05 21:24:24,445] Trial 92 finished with value: 0.22876743689723694 and parameters: {'model_type': 'graphsage', 'hidden_dims': '[512, 128]', 'dropout': 0.5754489927819181, 'batch_norm': True, 'sage_aggr': 'max', 'sage_normalize': True, 'sage_project': False, 'lr': 0.0005486704221672161, 'weight_decay': 0.000187517793737686, 'epochs': 233, 'loss': 'mae', 'optimizer': 'adam', 'graph_mode': 'cutoff', 'cutoff': 0.7674747800420684, 'grm_norm': 'cosine_then_gcn', 'self_loops': False, 'use_snp_selection': True, 'num_snps': 12278, 'graphsage_batch_size': 8}. Best is trial 63 with value: 0.23771832062188675.
[I 2025-12-05 21:25:12,265] Trial 93 finished with value: 0.2368921173944877 and parameters: {'model_type': 'graphsage', 'hidden_dims': '[512, 128]', 'dropout': 0.5328538070136518, 'batch_norm': True, 'sage_aggr': 'max', 'sage_normalize': True, 'sage_project': False, 'lr': 0.00046636725590952234, 'weight_decay': 4.750321871476909e-05, 'epochs': 244, 'loss': 'mae', 'optimizer': 'adam', 'graph_mode': 'cutoff', 'cutoff': 0.8455663973999792, 'grm_norm': 'cosine_then_gcn', 'self_loops': False, 'use_snp_selection': True, 'num_snps': 14434, 'graphsage_batch_size': 8}. Best is trial 63 with value: 0.23771832062188675.
[I 2025-12-05 21:27:03,759] Trial 94 finished with value: 0.20585387811641045 and parameters: {'model_type': 'graphsage', 'hidden_dims': '[512, 128]', 'dropout': 0.5341127853919161, 'batch_norm': True, 'sage_aggr': 'max', 'sage_normalize': True, 'sage_project': False, 'lr': 0.0005853445556025186, 'weight_decay': 4.477141366190637e-05, 'epochs': 246, 'loss': 'mae', 'optimizer': 'adam', 'graph_mode': 'cutoff', 'cutoff': 0.7445773400101918, 'grm_norm': 'cosine_then_gcn', 'self_loops': False, 'use_snp_selection': True, 'num_snps': 42136, 'graphsage_batch_size': 128}. Best is trial 63 with value: 0.23771832062188675.
[I 2025-12-05 21:29:12,003] Trial 95 finished with value: 0.20113561663078885 and parameters: {'model_type': 'graphsage', 'hidden_dims': '[512, 128]', 'dropout': 0.546351619341861, 'batch_norm': True, 'sage_aggr': 'max', 'sage_normalize': True, 'sage_project': False, 'lr': 0.0008079829164356634, 'weight_decay': 4.964315053530991e-05, 'epochs': 228, 'loss': 'mae', 'optimizer': 'adam', 'graph_mode': 'cutoff', 'cutoff': 0.710121047144404, 'grm_norm': 'cosine_then_gcn', 'self_loops': False, 'use_snp_selection': True, 'num_snps': 52020, 'graphsage_batch_size': 8}. Best is trial 63 with value: 0.23771832062188675.
[I 2025-12-05 21:29:59,914] Trial 96 finished with value: 0.22877472463716755 and parameters: {'model_type': 'graphsage', 'hidden_dims': '[512, 128]', 'dropout': 0.5244653714306904, 'batch_norm': True, 'sage_aggr': 'max', 'sage_normalize': True, 'sage_project': False, 'lr': 0.00030813025665505517, 'weight_decay': 3.435202246124339e-05, 'epochs': 243, 'loss': 'mae', 'optimizer': 'adam', 'graph_mode': 'cutoff', 'cutoff': 0.6842982519739566, 'grm_norm': 'cosine_then_gcn', 'self_loops': False, 'use_snp_selection': True, 'num_snps': 14332, 'graphsage_batch_size': 8}. Best is trial 63 with value: 0.23771832062188675.
[I 2025-12-05 21:30:54,674] Trial 97 finished with value: 0.22939285131351334 and parameters: {'model_type': 'graphsage', 'hidden_dims': '[512, 128]', 'dropout': 0.5925489873494737, 'batch_norm': True, 'sage_aggr': 'max', 'sage_normalize': True, 'sage_project': False, 'lr': 0.00045638901131842647, 'weight_decay': 6.56363455705079e-05, 'epochs': 247, 'loss': 'mae', 'optimizer': 'adam', 'graph_mode': 'cutoff', 'cutoff': 0.8320351180789582, 'grm_norm': 'cosine_then_gcn', 'self_loops': False, 'use_snp_selection': True, 'num_snps': 17453, 'graphsage_batch_size': 8}. Best is trial 63 with value: 0.23771832062188675.
[I 2025-12-05 21:31:30,826] Trial 98 finished with value: 0.22844279755883518 and parameters: {'model_type': 'graphsage', 'hidden_dims': '[512, 128]', 'dropout': 0.48139740944931514, 'batch_norm': True, 'sage_aggr': 'max', 'sage_normalize': True, 'sage_project': False, 'lr': 0.0005944228777343233, 'weight_decay': 2.1189877746637614e-05, 'epochs': 185, 'loss': 'mae', 'optimizer': 'adam', 'graph_mode': 'cutoff', 'cutoff': 0.8025090754995855, 'grm_norm': 'cosine_then_gcn', 'self_loops': False, 'use_snp_selection': True, 'num_snps': 12070, 'graphsage_batch_size': 8}. Best is trial 63 with value: 0.23771832062188675.
[I 2025-12-05 21:31:52,856] Trial 99 finished with value: 0.21322039938217713 and parameters: {'model_type': 'graphsage', 'hidden_dims': '[128, 64]', 'dropout': 0.5084862240658222, 'batch_norm': True, 'sage_aggr': 'max', 'sage_normalize': True, 'sage_project': False, 'lr': 0.00036486701940905233, 'weight_decay': 9.639208162274908e-05, 'epochs': 240, 'loss': 'mse', 'optimizer': 'adam', 'graph_mode': 'cutoff', 'cutoff': 0.851627177449128, 'grm_norm': 'cosine_then_gcn', 'self_loops': False, 'use_snp_selection': True, 'num_snps': 8264, 'graphsage_batch_size': 256}. Best is trial 63 with value: 0.23771832062188675.
[I 2025-12-05 21:32:57,935] Trial 100 finished with value: 0.22839921029611432 and parameters: {'model_type': 'graphsage', 'hidden_dims': '[512, 128]', 'dropout': 0.4951557770863551, 'batch_norm': True, 'sage_aggr': 'max', 'sage_normalize': True, 'sage_project': False, 'lr': 0.00023542452875267495, 'weight_decay': 0.00041165306852627726, 'epochs': 215, 'loss': 'mae', 'optimizer': 'adam', 'graph_mode': 'cutoff', 'cutoff': 0.8820757061156346, 'grm_norm': 'cosine', 'self_loops': False, 'use_snp_selection': True, 'num_snps': 24864, 'graphsage_batch_size': 8}. Best is trial 63 with value: 0.23771832062188675.
[I 2025-12-05 21:33:46,003] Trial 101 finished with value: 0.23621371427853646 and parameters: {'model_type': 'graphsage', 'hidden_dims': '[512, 128]', 'dropout': 0.5614105817763564, 'batch_norm': True, 'sage_aggr': 'max', 'sage_normalize': True, 'sage_project': False, 'lr': 0.00042999720113648165, 'weight_decay': 7.801202805828989e-05, 'epochs': 235, 'loss': 'mae', 'optimizer': 'adam', 'graph_mode': 'cutoff', 'cutoff': 0.8601050011306903, 'grm_norm': 'gcn', 'self_loops': False, 'use_snp_selection': True, 'num_snps': 15229, 'graphsage_batch_size': 8}. Best is trial 63 with value: 0.23771832062188675.
[I 2025-12-05 21:34:38,129] Trial 102 finished with value: 0.19716913630278599 and parameters: {'model_type': 'graphsage', 'hidden_dims': '[512, 128]', 'dropout': 0.550870912928333, 'batch_norm': True, 'sage_aggr': 'max', 'sage_normalize': True, 'sage_project': False, 'lr': 0.0004816054534564377, 'weight_decay': 0.00015697366645555944, 'epochs': 250, 'loss': 'mae', 'optimizer': 'adam', 'graph_mode': 'cutoff', 'cutoff': 0.5460609672259704, 'grm_norm': 'gcn', 'self_loops': False, 'use_snp_selection': True, 'num_snps': 15031, 'graphsage_batch_size': 8}. Best is trial 63 with value: 0.23771832062188675.
[I 2025-12-05 21:35:15,653] Trial 103 finished with value: 0.22681612040049495 and parameters: {'model_type': 'graphsage', 'hidden_dims': '[512, 128]', 'dropout': 0.5377411278925339, 'batch_norm': True, 'sage_aggr': 'max', 'sage_normalize': True, 'sage_project': False, 'lr': 0.0007062186233126075, 'weight_decay': 7.118170708201431e-05, 'epochs': 224, 'loss': 'mae', 'optimizer': 'adam', 'graph_mode': 'cutoff', 'cutoff': 0.8208603002903844, 'grm_norm': 'gcn', 'self_loops': False, 'use_snp_selection': True, 'num_snps': 10864, 'graphsage_batch_size': 8}. Best is trial 63 with value: 0.23771832062188675.
[I 2025-12-05 21:35:56,086] Trial 104 finished with value: 0.2322308097530109 and parameters: {'model_type': 'graphsage', 'hidden_dims': '[512, 128]', 'dropout': 0.5698035146157089, 'batch_norm': True, 'sage_aggr': 'max', 'sage_normalize': True, 'sage_project': False, 'lr': 0.00082982308687882, 'weight_decay': 2.580301990891275e-06, 'epochs': 205, 'loss': 'mae', 'optimizer': 'adam', 'graph_mode': 'cutoff', 'cutoff': 0.8575285891628399, 'grm_norm': 'gcn', 'self_loops': False, 'use_snp_selection': True, 'num_snps': 13591, 'graphsage_batch_size': 8}. Best is trial 63 with value: 0.23771832062188675.
[I 2025-12-05 21:36:39,992] Trial 105 finished with value: 0.23466326547153943 and parameters: {'model_type': 'graphsage', 'hidden_dims': '[512, 128]', 'dropout': 0.5754599072291098, 'batch_norm': True, 'sage_aggr': 'max', 'sage_normalize': True, 'sage_project': False, 'lr': 0.0006347505789315634, 'weight_decay': 1.9751365749207725e-06, 'epochs': 231, 'loss': 'mae', 'optimizer': 'adam', 'graph_mode': 'cutoff', 'cutoff': 0.8415720595784899, 'grm_norm': 'gcn', 'self_loops': False, 'use_snp_selection': True, 'num_snps': 13808, 'graphsage_batch_size': 8}. Best is trial 63 with value: 0.23771832062188675.
[I 2025-12-05 21:37:55,428] Trial 106 finished with value: 0.22220551413064413 and parameters: {'model_type': 'graphsage', 'hidden_dims': '[512, 128]', 'dropout': 0.5710488537477595, 'batch_norm': True, 'sage_aggr': 'max', 'sage_normalize': True, 'sage_project': False, 'lr': 0.0008393820671042224, 'weight_decay': 2.426714263618652e-06, 'epochs': 231, 'loss': 'mae', 'optimizer': 'adam', 'graph_mode': 'cutoff', 'cutoff': 0.8601633002986886, 'grm_norm': 'gcn', 'self_loops': False, 'use_snp_selection': True, 'num_snps': 28106, 'graphsage_batch_size': 8}. Best is trial 63 with value: 0.23771832062188675.
[I 2025-12-05 21:39:54,647] Trial 107 finished with value: 0.19686815878590064 and parameters: {'model_type': 'graphsage', 'hidden_dims': '[512, 128]', 'dropout': 0.5985264719907292, 'batch_norm': True, 'sage_aggr': 'max', 'sage_normalize': True, 'sage_project': False, 'lr': 0.0005513202711435426, 'weight_decay': 1.4218148487045901e-06, 'epochs': 234, 'loss': 'mae', 'optimizer': 'adam', 'graph_mode': 'cutoff', 'cutoff': 0.20261366095615918, 'grm_norm': 'gcn', 'self_loops': False, 'use_snp_selection': True, 'num_snps': 17854, 'graphsage_batch_size': 8}. Best is trial 63 with value: 0.23771832062188675.
[I 2025-12-05 21:40:35,542] Trial 108 finished with value: 0.21548197572577812 and parameters: {'model_type': 'graphsage', 'hidden_dims': '[512, 128]', 'dropout': 0.5822710792138664, 'batch_norm': True, 'sage_aggr': 'max', 'sage_normalize': True, 'sage_project': False, 'lr': 0.0009947770485183222, 'weight_decay': 2.116278878866294e-06, 'epochs': 204, 'loss': 'mae', 'optimizer': 'adam', 'graph_mode': 'knn', 'knn_k': 2, 'weighted_edges': False, 'symmetrize_mode': 'mutual', 'self_loops': False, 'use_snp_selection': True, 'num_snps': 12869, 'graphsage_batch_size': 8}. Best is trial 63 with value: 0.23771832062188675.
[I 2025-12-05 21:41:37,859] Trial 109 finished with value: 0.21321678526710527 and parameters: {'model_type': 'graphsage', 'hidden_dims': '[512, 128]', 'dropout': 0.5275703903066873, 'batch_norm': True, 'sage_aggr': 'max', 'sage_normalize': True, 'sage_project': False, 'lr': 0.0006473877958055179, 'weight_decay': 3.4692249720155173e-06, 'epochs': 242, 'loss': 'mae', 'optimizer': 'adam', 'graph_mode': 'cutoff', 'cutoff': 0.7926073019046432, 'grm_norm': 'gcn', 'self_loops': False, 'use_snp_selection': True, 'num_snps': 21231, 'graphsage_batch_size': 8}. Best is trial 63 with value: 0.23771832062188675.
[I 2025-12-05 21:42:13,206] Trial 110 finished with value: 0.22321089621802837 and parameters: {'model_type': 'graphsage', 'hidden_dims': '[512, 128]', 'dropout': 0.5836019982128776, 'batch_norm': True, 'sage_aggr': 'max', 'sage_normalize': True, 'sage_project': False, 'lr': 0.0007941927944577788, 'weight_decay': 4.556550793944738e-06, 'epochs': 218, 'loss': 'mae', 'optimizer': 'adam', 'graph_mode': 'cutoff', 'cutoff': 0.7670536651736088, 'grm_norm': 'gcn', 'self_loops': False, 'use_snp_selection': True, 'num_snps': 10176, 'graphsage_batch_size': 8}. Best is trial 63 with value: 0.23771832062188675.
[I 2025-12-05 21:42:59,400] Trial 111 finished with value: 0.2296427490980824 and parameters: {'model_type': 'graphsage', 'hidden_dims': '[512, 128]', 'dropout': 0.5706138109722347, 'batch_norm': True, 'sage_aggr': 'max', 'sage_normalize': True, 'sage_project': False, 'lr': 0.00039403963661914276, 'weight_decay': 3.0174060834943516e-06, 'epochs': 229, 'loss': 'mae', 'optimizer': 'adam', 'graph_mode': 'cutoff', 'cutoff': 0.8423726129176157, 'grm_norm': 'gcn', 'self_loops': False, 'use_snp_selection': True, 'num_snps': 14623, 'graphsage_batch_size': 16}. Best is trial 63 with value: 0.23771832062188675.
[I 2025-12-05 21:43:46,155] Trial 112 finished with value: 0.22861659145304905 and parameters: {'model_type': 'graphsage', 'hidden_dims': '[512, 128]', 'dropout': 0.553288849075485, 'batch_norm': True, 'sage_aggr': 'max', 'sage_normalize': True, 'sage_project': False, 'lr': 0.0006539157596128942, 'weight_decay': 6.4497776031788e-06, 'epochs': 212, 'loss': 'mae', 'optimizer': 'adam', 'graph_mode': 'cutoff', 'cutoff': 0.8083520991805138, 'grm_norm': 'gcn', 'self_loops': False, 'use_snp_selection': True, 'num_snps': 16048, 'graphsage_batch_size': 512}. Best is trial 63 with value: 0.23771832062188675.
[I 2025-12-05 21:44:29,423] Trial 113 finished with value: 0.2261318625099346 and parameters: {'model_type': 'graphsage', 'hidden_dims': '[512, 128]', 'dropout': 0.5384858767129945, 'batch_norm': True, 'sage_aggr': 'max', 'sage_normalize': True, 'sage_project': False, 'lr': 0.0004231798337426032, 'weight_decay': 1.914971211982263e-06, 'epochs': 225, 'loss': 'mae', 'optimizer': 'adam', 'graph_mode': 'cutoff', 'cutoff': 0.8343623392390943, 'grm_norm': 'gcn', 'self_loops': False, 'use_snp_selection': True, 'num_snps': 13676, 'graphsage_batch_size': 8}. Best is trial 63 with value: 0.23771832062188675.
[I 2025-12-05 21:45:00,323] Trial 114 finished with value: 0.22379870620755998 and parameters: {'model_type': 'graphsage', 'hidden_dims': '[256, 128, 64]', 'dropout': 0.5167942066435479, 'batch_norm': True, 'sage_aggr': 'max', 'sage_normalize': True, 'sage_project': False, 'lr': 0.0002905087524634909, 'weight_decay': 9.143117381387779e-05, 'epochs': 142, 'loss': 'mae', 'optimizer': 'adam', 'graph_mode': 'cutoff', 'cutoff': 0.8536795336691279, 'grm_norm': 'gcn', 'self_loops': False, 'use_snp_selection': True, 'num_snps': 18719, 'graphsage_batch_size': 8}. Best is trial 63 with value: 0.23771832062188675.
[I 2025-12-05 21:45:46,386] Trial 115 finished with value: 0.2331974099888227 and parameters: {'model_type': 'graphsage', 'hidden_dims': '[512, 128]', 'dropout': 0.5654844049333834, 'batch_norm': True, 'sage_aggr': 'max', 'sage_normalize': True, 'sage_project': False, 'lr': 0.0005102289442489803, 'weight_decay': 0.00011134299600442762, 'epochs': 207, 'loss': 'mae', 'optimizer': 'adam', 'graph_mode': 'cutoff', 'cutoff': 0.885704065072278, 'grm_norm': 'gcn', 'self_loops': False, 'use_snp_selection': True, 'num_snps': 15972, 'graphsage_batch_size': 8}. Best is trial 63 with value: 0.23771832062188675.
[I 2025-12-05 21:46:30,867] Trial 116 finished with value: 0.23211592849577922 and parameters: {'model_type': 'graphsage', 'hidden_dims': '[512, 128]', 'dropout': 0.5680592184205259, 'batch_norm': True, 'sage_aggr': 'max', 'sage_normalize': True, 'sage_project': False, 'lr': 0.000524615408021984, 'weight_decay': 9.873361654759277e-05, 'epochs': 198, 'loss': 'mae', 'optimizer': 'adam', 'graph_mode': 'cutoff', 'cutoff': 0.883356425828416, 'grm_norm': 'gcn', 'self_loops': False, 'use_snp_selection': True, 'num_snps': 15892, 'graphsage_batch_size': 8}. Best is trial 63 with value: 0.23771832062188675.
[I 2025-12-05 21:47:04,963] Trial 117 finished with value: 0.23482466647105035 and parameters: {'model_type': 'graphsage', 'hidden_dims': '[256, 128]', 'dropout': 0.5666280548415081, 'batch_norm': True, 'sage_aggr': 'max', 'sage_normalize': True, 'sage_project': False, 'lr': 0.0003424390591172103, 'weight_decay': 0.0001313624769219542, 'epochs': 198, 'loss': 'mae', 'optimizer': 'adam', 'graph_mode': 'cutoff', 'cutoff': 0.8868964456124192, 'grm_norm': 'cosine', 'self_loops': False, 'use_snp_selection': True, 'num_snps': 17106, 'graphsage_batch_size': 8}. Best is trial 63 with value: 0.23771832062188675.
[I 2025-12-05 21:47:38,533] Trial 118 finished with value: 0.22947321868629808 and parameters: {'model_type': 'graphsage', 'hidden_dims': '[256, 128]', 'dropout': 0.5861207212537677, 'batch_norm': True, 'sage_aggr': 'max', 'sage_normalize': True, 'sage_project': False, 'lr': 0.000355810108441902, 'weight_decay': 0.00022264367646778697, 'epochs': 197, 'loss': 'mae', 'optimizer': 'adam', 'graph_mode': 'cutoff', 'cutoff': 0.8930567519390735, 'grm_norm': 'cosine', 'self_loops': False, 'use_snp_selection': True, 'num_snps': 16864, 'graphsage_batch_size': 8}. Best is trial 63 with value: 0.23771832062188675.
[I 2025-12-05 21:48:15,416] Trial 119 finished with value: 0.21757143525943903 and parameters: {'model_type': 'graphsage', 'hidden_dims': '[256, 128]', 'dropout': 0.5677598392027494, 'batch_norm': True, 'sage_aggr': 'max', 'sage_normalize': True, 'sage_project': False, 'lr': 0.00020531415224900359, 'weight_decay': 0.00012945425859988902, 'epochs': 186, 'loss': 'mae', 'optimizer': 'adam', 'graph_mode': 'cutoff', 'cutoff': 0.8849299369240576, 'grm_norm': 'cosine', 'self_loops': False, 'use_snp_selection': True, 'num_snps': 20109, 'graphsage_batch_size': 8}. Best is trial 63 with value: 0.23771832062188675.
[I 2025-12-05 21:48:48,792] Trial 120 finished with value: 0.23030796962740063 and parameters: {'model_type': 'graphsage', 'hidden_dims': '[256, 128]', 'dropout': 0.5897955165500147, 'batch_norm': True, 'sage_aggr': 'max', 'sage_normalize': True, 'sage_project': False, 'lr': 0.0005065446697989105, 'weight_decay': 0.0001011276324236788, 'epochs': 201, 'loss': 'mse', 'optimizer': 'adam', 'graph_mode': 'cutoff', 'cutoff': 0.8614968013859692, 'grm_norm': 'cosine', 'self_loops': False, 'use_snp_selection': True, 'num_snps': 16162, 'graphsage_batch_size': 8}. Best is trial 63 with value: 0.23771832062188675.
[I 2025-12-05 21:49:16,134] Trial 121 finished with value: 0.22728892134011724 and parameters: {'model_type': 'graphsage', 'hidden_dims': '[256, 128]', 'dropout': 0.5743026714279696, 'batch_norm': True, 'sage_aggr': 'max', 'sage_normalize': True, 'sage_project': False, 'lr': 0.0007316870195216097, 'weight_decay': 7.826549088412952e-05, 'epochs': 172, 'loss': 'mae', 'optimizer': 'adam', 'graph_mode': 'cutoff', 'cutoff': 0.8711760781889679, 'grm_norm': 'cosine', 'self_loops': False, 'use_snp_selection': True, 'num_snps': 12209, 'graphsage_batch_size': 8}. Best is trial 63 with value: 0.23771832062188675.
[I 2025-12-05 21:49:39,662] Trial 122 finished with value: 0.22003416190684705 and parameters: {'model_type': 'graphsage', 'hidden_dims': '[128, 64]', 'dropout': 0.5505726453614077, 'batch_norm': True, 'sage_aggr': 'max', 'sage_normalize': True, 'sage_project': False, 'lr': 0.0008687773850512782, 'weight_decay': 0.00011590216488929883, 'epochs': 188, 'loss': 'mae', 'optimizer': 'adam', 'graph_mode': 'cutoff', 'cutoff': 0.8796888979344859, 'grm_norm': 'gcn', 'self_loops': False, 'use_snp_selection': True, 'num_snps': 13287, 'graphsage_batch_size': 8}. Best is trial 63 with value: 0.23771832062188675.
[I 2025-12-05 21:50:22,840] Trial 123 finished with value: 0.18932058155577008 and parameters: {'model_type': 'graphsage', 'hidden_dims': '[512, 128]', 'dropout': 0.5658992652160537, 'batch_norm': True, 'sage_aggr': 'max', 'sage_normalize': True, 'sage_project': False, 'lr': 2.5143932351759202e-05, 'weight_decay': 0.00015891767916513067, 'epochs': 156, 'loss': 'mae', 'optimizer': 'adam', 'graph_mode': 'cutoff', 'cutoff': 0.8924516294925721, 'grm_norm': 'gcn', 'self_loops': False, 'use_snp_selection': True, 'num_snps': 18181, 'graphsage_batch_size': 8}. Best is trial 63 with value: 0.23771832062188675.
[I 2025-12-05 21:50:58,218] Trial 124 finished with value: 0.22894689319595352 and parameters: {'model_type': 'graphsage', 'hidden_dims': '[512, 128]', 'dropout': 0.4732048331181343, 'batch_norm': True, 'sage_aggr': 'max', 'sage_normalize': True, 'sage_project': False, 'lr': 0.0005209169979032382, 'weight_decay': 0.00014202549620626428, 'epochs': 194, 'loss': 'mae', 'optimizer': 'adam', 'graph_mode': 'cutoff', 'cutoff': 0.8662491879016775, 'grm_norm': 'cosine_then_gcn', 'self_loops': False, 'use_snp_selection': True, 'num_snps': 10993, 'graphsage_batch_size': 8}. Best is trial 63 with value: 0.23771832062188675.
