[I 2025-12-09 05:21:21,744] Trial 34 finished with value: 0.2853734019497074 and parameters: {'model_type': 'graphsage', 'hidden_dims': '[256, 128, 64]', 'dropout': 0.16902355551592385, 'batch_norm': False, 'sage_aggr': 'mean', 'sage_normalize': False, 'sage_project': False, 'lr': 2.0542559811876357e-05, 'weight_decay': 0.0009941630988983773, 'epochs': 203, 'loss': 'mse', 'optimizer': 'adam', 'graph_mode': 'knn', 'knn_k': 6, 'weighted_edges': False, 'symmetrize_mode': 'mutual', 'self_loops': False, 'use_snp_selection': False}. Best is trial 31 with value: 0.2935497108781514.
[I 2025-12-09 05:22:24,702] Trial 35 finished with value: 0.2794527245326942 and parameters: {'model_type': 'graphsage', 'hidden_dims': '[128, 64]', 'dropout': 0.27475343011814796, 'batch_norm': False, 'sage_aggr': 'mean', 'sage_normalize': False, 'sage_project': False, 'lr': 3.611513458100507e-05, 'weight_decay': 0.00012335078954035705, 'epochs': 170, 'loss': 'mse', 'optimizer': 'adam', 'graph_mode': 'knn', 'knn_k': 8, 'weighted_edges': False, 'symmetrize_mode': 'mutual', 'self_loops': False, 'use_snp_selection': False}. Best is trial 31 with value: 0.2935497108781514.
[I 2025-12-09 05:24:11,530] Trial 36 finished with value: 0.2628362309368283 and parameters: {'model_type': 'graphsage', 'hidden_dims': '[512, 256]', 'dropout': 0.32596708987758605, 'batch_norm': True, 'sage_aggr': 'mean', 'sage_normalize': False, 'sage_project': False, 'lr': 0.00023031968553025777, 'weight_decay': 4.8008457352093485e-05, 'epochs': 151, 'loss': 'mse', 'optimizer': 'adam', 'graph_mode': 'knn', 'knn_k': 5, 'weighted_edges': False, 'symmetrize_mode': 'mutual', 'self_loops': False, 'use_snp_selection': False}. Best is trial 31 with value: 0.2935497108781514.
[I 2025-12-09 05:26:38,261] Trial 37 finished with value: 0.2788179500283775 and parameters: {'model_type': 'graphsage', 'hidden_dims': '[512, 256]', 'dropout': 0.3571979331350616, 'batch_norm': False, 'sage_aggr': 'mean', 'sage_normalize': False, 'sage_project': False, 'lr': 1.5676422574578818e-05, 'weight_decay': 1.4888829356128287e-07, 'epochs': 251, 'loss': 'mse', 'optimizer': 'adam', 'graph_mode': 'cutoff', 'cutoff': 0.6806305736947694, 'grm_norm': 'cosine_then_gcn', 'self_loops': False, 'use_snp_selection': False}. Best is trial 31 with value: 0.2935497108781514.
[I 2025-12-09 05:27:52,912] Trial 38 finished with value: 0.2144579294319801 and parameters: {'model_type': 'graphsage', 'hidden_dims': '[256, 128, 64]', 'dropout': 0.23865244012357315, 'batch_norm': True, 'sage_aggr': 'mean', 'sage_normalize': True, 'sage_project': False, 'lr': 6.438236281443707e-05, 'weight_decay': 0.0002893756734062631, 'epochs': 188, 'loss': 'mae', 'optimizer': 'adam', 'graph_mode': 'knn', 'knn_k': 4, 'weighted_edges': False, 'symmetrize_mode': 'mutual', 'self_loops': False, 'use_snp_selection': False}. Best is trial 31 with value: 0.2935497108781514.
[I 2025-12-09 05:29:27,050] Trial 39 finished with value: 0.2917739027343452 and parameters: {'model_type': 'graphsage', 'hidden_dims': '[512, 64]', 'dropout': 0.1505062337847427, 'batch_norm': False, 'sage_aggr': 'mean', 'sage_normalize': False, 'sage_project': False, 'lr': 1.7135169025671746e-05, 'weight_decay': 1.9476723385609898e-05, 'epochs': 132, 'loss': 'mse', 'optimizer': 'adam', 'graph_mode': 'cutoff', 'cutoff': 0.4768191578050947, 'grm_norm': 'cosine', 'self_loops': False, 'use_snp_selection': False}. Best is trial 31 with value: 0.2935497108781514.
[I 2025-12-09 05:31:59,745] Trial 40 finished with value: 0.2634593578806744 and parameters: {'model_type': 'graphsage', 'hidden_dims': '[512, 64]', 'dropout': 0.12948916740748082, 'batch_norm': True, 'sage_aggr': 'mean', 'sage_normalize': False, 'sage_project': False, 'lr': 1.0654321759789424e-05, 'weight_decay': 5.459906867502395e-07, 'epochs': 139, 'loss': 'mae', 'optimizer': 'adam', 'graph_mode': 'knn', 'knn_k': 8, 'weighted_edges': True, 'symmetrize_mode': 'union', 'self_loops': False, 'use_snp_selection': False}. Best is trial 31 with value: 0.2935497108781514.
[I 2025-12-09 05:33:52,373] Trial 41 finished with value: 0.29349645191175155 and parameters: {'model_type': 'graphsage', 'hidden_dims': '[512, 256]', 'dropout': 0.18389649190177357, 'batch_norm': False, 'sage_aggr': 'mean', 'sage_normalize': False, 'sage_project': False, 'lr': 1.7788839598928372e-05, 'weight_decay': 1.9494841617982103e-05, 'epochs': 157, 'loss': 'mse', 'optimizer': 'adam', 'graph_mode': 'cutoff', 'cutoff': 0.4256051605298248, 'grm_norm': 'cosine', 'self_loops': False, 'use_snp_selection': False}. Best is trial 31 with value: 0.2935497108781514.
[I 2025-12-09 05:35:45,729] Trial 42 finished with value: 0.29171903837687574 and parameters: {'model_type': 'graphsage', 'hidden_dims': '[512, 64]', 'dropout': 0.18398035475904922, 'batch_norm': False, 'sage_aggr': 'mean', 'sage_normalize': False, 'sage_project': False, 'lr': 1.6965899986597604e-05, 'weight_decay': 1.3714153304283015e-05, 'epochs': 155, 'loss': 'mse', 'optimizer': 'adam', 'graph_mode': 'cutoff', 'cutoff': 0.3781544404538534, 'grm_norm': 'cosine', 'self_loops': False, 'use_snp_selection': False}. Best is trial 31 with value: 0.2935497108781514.
[I 2025-12-09 05:37:18,699] Trial 43 finished with value: 0.29258568515850925 and parameters: {'model_type': 'graphsage', 'hidden_dims': '[512, 64]', 'dropout': 0.1414436898680595, 'batch_norm': False, 'sage_aggr': 'mean', 'sage_normalize': False, 'sage_project': False, 'lr': 1.6389581861016886e-05, 'weight_decay': 1.3297746373643932e-05, 'epochs': 126, 'loss': 'mse', 'optimizer': 'adam', 'graph_mode': 'cutoff', 'cutoff': 0.392443521784085, 'grm_norm': 'cosine', 'self_loops': False, 'use_snp_selection': False}. Best is trial 31 with value: 0.2935497108781514.
[I 2025-12-09 05:38:48,294] Trial 44 finished with value: 0.2935549019645619 and parameters: {'model_type': 'graphsage', 'hidden_dims': '[512, 64]', 'dropout': 0.13486981534286654, 'batch_norm': False, 'sage_aggr': 'mean', 'sage_normalize': False, 'sage_project': False, 'lr': 1.7510213708598696e-05, 'weight_decay': 6.871798380365007e-06, 'epochs': 121, 'loss': 'mse', 'optimizer': 'adam', 'graph_mode': 'cutoff', 'cutoff': 0.3905535499553933, 'grm_norm': 'cosine', 'self_loops': False, 'use_snp_selection': False}. Best is trial 44 with value: 0.2935549019645619.
[I 2025-12-09 05:40:17,358] Trial 45 finished with value: 0.27493055800688004 and parameters: {'model_type': 'graphsage', 'hidden_dims': '[512, 64]', 'dropout': 0.14117802589782785, 'batch_norm': False, 'sage_aggr': 'mean', 'sage_normalize': True, 'sage_project': False, 'lr': 1.9079645106787496e-05, 'weight_decay': 5.636788933129511e-06, 'epochs': 121, 'loss': 'mse', 'optimizer': 'adam', 'graph_mode': 'cutoff', 'cutoff': 0.4579013181718533, 'grm_norm': 'cosine', 'self_loops': False, 'use_snp_selection': False}. Best is trial 44 with value: 0.2935549019645619.
[I 2025-12-09 05:41:19,894] Trial 46 finished with value: 0.257499031270914 and parameters: {'model_type': 'graphsage', 'hidden_dims': '[512, 64]', 'dropout': 0.13092031197286522, 'batch_norm': False, 'sage_aggr': 'mean', 'sage_normalize': False, 'sage_project': False, 'lr': 2.8104738573396117e-05, 'weight_decay': 5.855708764201788e-06, 'epochs': 77, 'loss': 'mse', 'optimizer': 'adam', 'graph_mode': 'cutoff', 'cutoff': 0.3304644920988661, 'grm_norm': 'cosine', 'self_loops': False, 'use_snp_selection': False}. Best is trial 44 with value: 0.2935549019645619.
[I 2025-12-09 05:42:36,959] Trial 47 finished with value: 0.25992706953888955 and parameters: {'model_type': 'graphsage', 'hidden_dims': '[512, 64]', 'dropout': 0.15231279546457016, 'batch_norm': False, 'sage_aggr': 'mean', 'sage_normalize': False, 'sage_project': False, 'lr': 1.5695715565671117e-05, 'weight_decay': 2.3315137417844497e-06, 'epochs': 104, 'loss': 'mae', 'optimizer': 'adam', 'graph_mode': 'cutoff', 'cutoff': 0.43159013232220395, 'grm_norm': 'cosine', 'self_loops': False, 'use_snp_selection': False}. Best is trial 44 with value: 0.2935549019645619.
[I 2025-12-09 05:44:35,639] Trial 48 finished with value: 0.2748323655249195 and parameters: {'model_type': 'graphsage', 'hidden_dims': '[512, 64]', 'dropout': 0.12195895379748165, 'batch_norm': True, 'sage_aggr': 'mean', 'sage_normalize': False, 'sage_project': False, 'lr': 0.008386643269801972, 'weight_decay': 2.1984187504692818e-05, 'epochs': 130, 'loss': 'mse', 'optimizer': 'adam', 'graph_mode': 'cutoff', 'cutoff': 0.29900431061826444, 'grm_norm': 'cosine', 'self_loops': False, 'use_snp_selection': False}. Best is trial 44 with value: 0.2935549019645619.
[I 2025-12-09 05:45:42,863] Trial 49 finished with value: 0.2684144279088751 and parameters: {'model_type': 'graphsage', 'hidden_dims': '[512, 64]', 'dropout': 0.1943630141134142, 'batch_norm': False, 'sage_aggr': 'mean', 'sage_normalize': True, 'sage_project': False, 'lr': 3.843414970983556e-05, 'weight_decay': 1.0066713050466047e-05, 'epochs': 88, 'loss': 'mse', 'optimizer': 'adam', 'graph_mode': 'cutoff', 'cutoff': 0.4258895678659295, 'grm_norm': 'cosine', 'self_loops': False, 'use_snp_selection': False}. Best is trial 44 with value: 0.2935549019645619.
[I 2025-12-09 05:46:52,688] Trial 50 finished with value: 0.0 and parameters: {'model_type': 'graphsage', 'hidden_dims': '[512, 64]', 'dropout': 0.1496509048000122, 'batch_norm': False, 'sage_aggr': 'mean', 'sage_normalize': False, 'sage_project': False, 'lr': 0.002616298468413825, 'weight_decay': 1.4601956920140695e-06, 'epochs': 113, 'loss': 'mae', 'optimizer': 'adam', 'graph_mode': 'cutoff', 'cutoff': 0.5747290950226795, 'grm_norm': 'cosine', 'self_loops': True, 'use_snp_selection': False}. Best is trial 44 with value: 0.2935549019645619.
[I 2025-12-09 05:48:50,753] Trial 51 finished with value: 0.29409720658499966 and parameters: {'model_type': 'graphsage', 'hidden_dims': '[512, 64]', 'dropout': 0.17668129962811707, 'batch_norm': False, 'sage_aggr': 'mean', 'sage_normalize': False, 'sage_project': False, 'lr': 1.60630059502477e-05, 'weight_decay': 1.3733895650790533e-05, 'epochs': 162, 'loss': 'mse', 'optimizer': 'adam', 'graph_mode': 'cutoff', 'cutoff': 0.3805982486705977, 'grm_norm': 'cosine', 'self_loops': False, 'use_snp_selection': False}. Best is trial 51 with value: 0.29409720658499966.
[I 2025-12-09 05:51:27,267] Trial 52 finished with value: 0.2865266937153574 and parameters: {'model_type': 'graphsage', 'hidden_dims': '[512, 64]', 'dropout': 0.1625385183953659, 'batch_norm': False, 'sage_aggr': 'mean', 'sage_normalize': False, 'sage_project': False, 'lr': 2.284487916042203e-05, 'weight_decay': 4.144584186952816e-06, 'epochs': 175, 'loss': 'mse', 'optimizer': 'adam', 'graph_mode': 'cutoff', 'cutoff': 0.2942029244601362, 'grm_norm': 'cosine', 'self_loops': False, 'use_snp_selection': False}. Best is trial 51 with value: 0.29409720658499966.
[I 2025-12-09 05:53:01,494] Trial 53 finished with value: 0.2930831197481157 and parameters: {'model_type': 'graphsage', 'hidden_dims': '[512, 64]', 'dropout': 0.1194603681929533, 'batch_norm': False, 'sage_aggr': 'mean', 'sage_normalize': False, 'sage_project': False, 'lr': 1.4354385552054203e-05, 'weight_decay': 1.821863423294282e-05, 'epochs': 127, 'loss': 'mse', 'optimizer': 'adam', 'graph_mode': 'cutoff', 'cutoff': 0.3830422815742769, 'grm_norm': 'cosine', 'self_loops': False, 'use_snp_selection': False}. Best is trial 51 with value: 0.29409720658499966.
[I 2025-12-09 05:54:58,984] Trial 54 finished with value: 0.29407442193945565 and parameters: {'model_type': 'graphsage', 'hidden_dims': '[512, 64]', 'dropout': 0.11826517869714442, 'batch_norm': False, 'sage_aggr': 'mean', 'sage_normalize': False, 'sage_project': False, 'lr': 1.3169996870343841e-05, 'weight_decay': 4.4659215169113376e-05, 'epochs': 162, 'loss': 'mse', 'optimizer': 'adam', 'graph_mode': 'cutoff', 'cutoff': 0.3937724520008493, 'grm_norm': 'cosine', 'self_loops': False, 'use_snp_selection': False}. Best is trial 51 with value: 0.29409720658499966.
[I 2025-12-09 05:57:00,800] Trial 55 finished with value: 0.28734650171357934 and parameters: {'model_type': 'graphsage', 'hidden_dims': '[512, 64]', 'dropout': 0.11634793611847857, 'batch_norm': False, 'sage_aggr': 'mean', 'sage_normalize': False, 'sage_project': False, 'lr': 1.2489803211276223e-05, 'weight_decay': 4.6895181684943366e-05, 'epochs': 162, 'loss': 'mse', 'optimizer': 'adam', 'graph_mode': 'cutoff', 'cutoff': 0.3427882491391194, 'grm_norm': 'cosine', 'self_loops': False, 'use_snp_selection': False}. Best is trial 51 with value: 0.29409720658499966.
[I 2025-12-09 05:58:40,388] Trial 56 finished with value: 0.2862605619825726 and parameters: {'model_type': 'graphsage', 'hidden_dims': '[256, 128]', 'dropout': 0.183076258842957, 'batch_norm': False, 'sage_aggr': 'mean', 'sage_normalize': False, 'sage_project': False, 'lr': 1.3286486546344593e-05, 'weight_decay': 9.077230059993487e-06, 'epochs': 143, 'loss': 'mse', 'optimizer': 'adam', 'graph_mode': 'cutoff', 'cutoff': 0.27527869846861724, 'grm_norm': 'cosine', 'self_loops': False, 'use_snp_selection': False}. Best is trial 51 with value: 0.29409720658499966.
[I 2025-12-09 05:59:19,033] Trial 57 finished with value: 0.2870834070241624 and parameters: {'model_type': 'graphsage', 'hidden_dims': '[128, 64]', 'dropout': 0.10796406843787018, 'batch_norm': False, 'sage_aggr': 'mean', 'sage_normalize': False, 'sage_project': False, 'lr': 3.073726600109511e-05, 'weight_decay': 4.0606730981098457e-05, 'epochs': 111, 'loss': 'mse', 'optimizer': 'adam', 'graph_mode': 'cutoff', 'cutoff': 0.3792569443134659, 'grm_norm': 'cosine', 'self_loops': True, 'use_snp_selection': False}. Best is trial 51 with value: 0.29409720658499966.
[I 2025-12-09 06:01:27,512] Trial 58 finished with value: 0.2933820171775307 and parameters: {'model_type': 'graphsage', 'hidden_dims': '[512, 64]', 'dropout': 0.2647044783362555, 'batch_norm': False, 'sage_aggr': 'mean', 'sage_normalize': False, 'sage_project': False, 'lr': 2.31715568878646e-05, 'weight_decay': 2.7785912607568453e-05, 'epochs': 182, 'loss': 'mse', 'optimizer': 'adam', 'graph_mode': 'cutoff', 'cutoff': 0.4610270425185904, 'grm_norm': 'none', 'self_loops': False, 'use_snp_selection': False}. Best is trial 51 with value: 0.29409720658499966.
[I 2025-12-09 06:02:46,769] Trial 59 finished with value: 0.2841087569181796 and parameters: {'model_type': 'graphsage', 'hidden_dims': '[256, 128, 64]', 'dropout': 0.23466134863095112, 'batch_norm': False, 'sage_aggr': 'mean', 'sage_normalize': False, 'sage_project': False, 'lr': 7.650540728506288e-05, 'weight_decay': 2.9025304407102777e-05, 'epochs': 180, 'loss': 'mse', 'optimizer': 'adam', 'graph_mode': 'cutoff', 'cutoff': 0.46352317531689424, 'grm_norm': 'none', 'self_loops': False, 'use_snp_selection': False}. Best is trial 51 with value: 0.29409720658499966.
[I 2025-12-09 06:04:38,184] Trial 60 finished with value: 0.29498166171326784 and parameters: {'model_type': 'graphsage', 'hidden_dims': '[512, 64]', 'dropout': 0.19454425539622047, 'batch_norm': False, 'sage_aggr': 'mean', 'sage_normalize': False, 'sage_project': False, 'lr': 2.3294862836796922e-05, 'weight_decay': 6.429368218246975e-05, 'epochs': 163, 'loss': 'mse', 'optimizer': 'adam', 'graph_mode': 'cutoff', 'cutoff': 0.49686260162804197, 'grm_norm': 'none', 'self_loops': False, 'use_snp_selection': False}. Best is trial 60 with value: 0.29498166171326784.
[I 2025-12-09 06:06:15,727] Trial 61 finished with value: 0.2915768698169652 and parameters: {'model_type': 'graphsage', 'hidden_dims': '[512, 64]', 'dropout': 0.26290112539370203, 'batch_norm': False, 'sage_aggr': 'mean', 'sage_normalize': False, 'sage_project': False, 'lr': 2.2861512600727317e-05, 'weight_decay': 6.119220233221952e-05, 'epochs': 155, 'loss': 'mse', 'optimizer': 'adam', 'graph_mode': 'cutoff', 'cutoff': 0.5456446423001551, 'grm_norm': 'none', 'self_loops': False, 'use_snp_selection': False}. Best is trial 60 with value: 0.29498166171326784.
[I 2025-12-09 06:08:10,797] Trial 62 finished with value: 0.2837632755368832 and parameters: {'model_type': 'graphsage', 'hidden_dims': '[512, 64]', 'dropout': 0.19792774609913538, 'batch_norm': False, 'sage_aggr': 'mean', 'sage_normalize': False, 'sage_project': False, 'lr': 4.291249070365677e-05, 'weight_decay': 9.041710813227893e-05, 'epochs': 161, 'loss': 'mse', 'optimizer': 'adam', 'graph_mode': 'cutoff', 'cutoff': 0.4447030010215636, 'grm_norm': 'none', 'self_loops': False, 'use_snp_selection': False}. Best is trial 60 with value: 0.29498166171326784.
[I 2025-12-09 06:10:11,227] Trial 63 finished with value: 0.29461915577649805 and parameters: {'model_type': 'graphsage', 'hidden_dims': '[512, 64]', 'dropout': 0.18131312406742844, 'batch_norm': False, 'sage_aggr': 'mean', 'sage_normalize': False, 'sage_project': False, 'lr': 2.8201073129660323e-05, 'weight_decay': 2.511279389557164e-05, 'epochs': 179, 'loss': 'mse', 'optimizer': 'adam', 'graph_mode': 'cutoff', 'cutoff': 0.5014298844449327, 'grm_norm': 'none', 'self_loops': False, 'use_snp_selection': False}. Best is trial 60 with value: 0.29498166171326784.
[I 2025-12-09 06:12:23,341] Trial 64 finished with value: 0.2938671505313826 and parameters: {'model_type': 'graphsage', 'hidden_dims': '[512, 128]', 'dropout': 0.1865820196585304, 'batch_norm': False, 'sage_aggr': 'mean', 'sage_normalize': False, 'sage_project': False, 'lr': 3.0301223062578045e-05, 'weight_decay': 9.166209340367445e-06, 'epochs': 199, 'loss': 'mse', 'optimizer': 'adam', 'graph_mode': 'cutoff', 'cutoff': 0.5038698008787521, 'grm_norm': 'none', 'self_loops': False, 'use_snp_selection': False}. Best is trial 60 with value: 0.29498166171326784.
[I 2025-12-09 06:14:44,768] Trial 65 finished with value: 0.29444114958313394 and parameters: {'model_type': 'graphsage', 'hidden_dims': '[512, 128]', 'dropout': 0.163431312111233, 'batch_norm': False, 'sage_aggr': 'max', 'sage_normalize': False, 'sage_project': False, 'lr': 2.9509635134962346e-05, 'weight_decay': 3.884568418406996e-06, 'epochs': 211, 'loss': 'mse', 'optimizer': 'adam', 'graph_mode': 'cutoff', 'cutoff': 0.5099776708938195, 'grm_norm': 'none', 'self_loops': False, 'use_snp_selection': False}. Best is trial 60 with value: 0.29498166171326784.
[I 2025-12-09 06:15:26,553] Trial 66 finished with value: 0.27835870771977844 and parameters: {'model_type': 'graphsage', 'hidden_dims': '[512, 128]', 'dropout': 0.16473763131493985, 'batch_norm': False, 'sage_aggr': 'max', 'sage_normalize': False, 'sage_project': False, 'lr': 3.151252251480223e-05, 'weight_decay': 4.926250436393901e-06, 'epochs': 215, 'loss': 'mse', 'optimizer': 'adam', 'graph_mode': 'cutoff', 'cutoff': 0.5133104008745817, 'grm_norm': 'none', 'self_loops': True, 'use_snp_selection': True, 'num_snps': 8251}. Best is trial 60 with value: 0.29498166171326784.
[I 2025-12-09 06:17:28,882] Trial 67 finished with value: 0.25588764744981335 and parameters: {'model_type': 'graphsage', 'hidden_dims': '[512, 128]', 'dropout': 0.1913065632373022, 'batch_norm': False, 'sage_aggr': 'max', 'sage_normalize': True, 'sage_project': False, 'lr': 0.0005612730061688693, 'weight_decay': 8.25023147946771e-06, 'epochs': 200, 'loss': 'mae', 'optimizer': 'adam', 'graph_mode': 'cutoff', 'cutoff': 0.6031930235793905, 'grm_norm': 'none', 'self_loops': False, 'use_snp_selection': False}. Best is trial 60 with value: 0.29498166171326784.
[I 2025-12-09 06:20:02,763] Trial 68 finished with value: 0.2730664643174491 and parameters: {'model_type': 'graphsage', 'hidden_dims': '[512, 128]', 'dropout': 0.10321422483667136, 'batch_norm': True, 'sage_aggr': 'max', 'sage_normalize': False, 'sage_project': False, 'lr': 6.19046155573162e-05, 'weight_decay': 1.1823880725999698e-06, 'epochs': 236, 'loss': 'mse', 'optimizer': 'adam', 'graph_mode': 'cutoff', 'cutoff': 0.5331163109748593, 'grm_norm': 'none', 'self_loops': False, 'use_snp_selection': False}. Best is trial 60 with value: 0.29498166171326784.
[I 2025-12-09 06:22:15,304] Trial 69 finished with value: 0.28979760530179055 and parameters: {'model_type': 'graphsage', 'hidden_dims': '[512, 128]', 'dropout': 0.14014500223148083, 'batch_norm': False, 'sage_aggr': 'max', 'sage_normalize': False, 'sage_project': False, 'lr': 3.816266719140729e-05, 'weight_decay': 3.5649000227984855e-06, 'epochs': 217, 'loss': 'mse', 'optimizer': 'adam', 'graph_mode': 'cutoff', 'cutoff': 0.5623547527427791, 'grm_norm': 'none', 'self_loops': False, 'use_snp_selection': False}. Best is trial 60 with value: 0.29498166171326784.
[I 2025-12-09 06:24:29,565] Trial 70 finished with value: 0.28776750392098616 and parameters: {'model_type': 'graphsage', 'hidden_dims': '[512, 128]', 'dropout': 0.17282510978963736, 'batch_norm': False, 'sage_aggr': 'max', 'sage_normalize': False, 'sage_project': False, 'lr': 2.694110088137252e-05, 'weight_decay': 1.1113010206046539e-05, 'epochs': 192, 'loss': 'mse', 'optimizer': 'adam', 'graph_mode': 'cutoff', 'cutoff': 0.496232854645098, 'grm_norm': 'none', 'self_loops': False, 'use_snp_selection': False}. Best is trial 60 with value: 0.29498166171326784.
[I 2025-12-09 06:27:40,678] Trial 71 finished with value: 0.2884089734835759 and parameters: {'model_type': 'graphsage', 'hidden_dims': '[512, 128]', 'dropout': 0.22115493358431138, 'batch_norm': False, 'sage_aggr': 'mean', 'sage_normalize': False, 'sage_project': False, 'lr': 1.0349721509632725e-05, 'weight_decay': 6.777908976005093e-06, 'epochs': 280, 'loss': 'mse', 'optimizer': 'adam', 'graph_mode': 'cutoff', 'cutoff': 0.48749546936131843, 'grm_norm': 'none', 'self_loops': False, 'use_snp_selection': False}. Best is trial 60 with value: 0.29498166171326784.
