[I 2025-12-08 21:16:44,647] Trial 45 finished with value: 0.2848335379182211 and parameters: {'model_type': 'graphsage', 'hidden_dims': '[512, 128]', 'dropout': 0.5518587197022058, 'batch_norm': True, 'sage_aggr': 'mean', 'sage_normalize': True, 'sage_project': False, 'lr': 0.0096511445035848, 'weight_decay': 0.00023629081980818046, 'epochs': 320, 'loss': 'mse', 'optimizer': 'adam', 'graph_mode': 'cutoff', 'cutoff': 0.7513183040607583, 'grm_norm': 'cosine_then_gcn', 'self_loops': True, 'use_snp_selection': False}. Best is trial 30 with value: 0.31405307096775703.
[I 2025-12-08 21:18:29,503] Trial 46 finished with value: 0.2823011901453514 and parameters: {'model_type': 'graphsage', 'hidden_dims': '[512, 256]', 'dropout': 0.36432577568374186, 'batch_norm': False, 'sage_aggr': 'max', 'sage_normalize': True, 'sage_project': False, 'lr': 2.6695140785102466e-05, 'weight_decay': 0.0001402766349707727, 'epochs': 235, 'loss': 'mse', 'optimizer': 'adam', 'graph_mode': 'cutoff', 'cutoff': 0.8466261594969725, 'grm_norm': 'cosine_then_gcn', 'self_loops': False, 'use_snp_selection': False}. Best is trial 30 with value: 0.31405307096775703.
[I 2025-12-08 21:19:53,353] Trial 47 finished with value: 0.3055020720429196 and parameters: {'model_type': 'graphsage', 'hidden_dims': '[512, 64]', 'dropout': 0.513376159271818, 'batch_norm': True, 'sage_aggr': 'mean', 'sage_normalize': True, 'sage_project': False, 'lr': 0.0005155712894394626, 'weight_decay': 7.261225227466812e-05, 'epochs': 181, 'loss': 'mse', 'optimizer': 'adam', 'graph_mode': 'cutoff', 'cutoff': 0.8027827112926844, 'grm_norm': 'cosine_then_gcn', 'self_loops': True, 'use_snp_selection': False}. Best is trial 30 with value: 0.31405307096775703.
[I 2025-12-08 21:22:33,819] Trial 48 finished with value: 0.3028866305959127 and parameters: {'model_type': 'graphsage', 'hidden_dims': '[512, 128]', 'dropout': 0.25792342162208287, 'batch_norm': True, 'sage_aggr': 'mean', 'sage_normalize': True, 'sage_project': False, 'lr': 0.007000190768929433, 'weight_decay': 2.9190795029319468e-05, 'epochs': 287, 'loss': 'mse', 'optimizer': 'adam', 'graph_mode': 'knn', 'knn_k': 7, 'weighted_edges': True, 'symmetrize_mode': 'mutual', 'self_loops': True, 'use_snp_selection': False}. Best is trial 30 with value: 0.31405307096775703.
[I 2025-12-08 21:24:08,592] Trial 49 finished with value: 0.29772772371188977 and parameters: {'model_type': 'graphsage', 'hidden_dims': '[512, 128]', 'dropout': 0.4776949908345045, 'batch_norm': True, 'sage_aggr': 'mean', 'sage_normalize': True, 'sage_project': False, 'lr': 0.004882750310617911, 'weight_decay': 0.0006407895016718345, 'epochs': 211, 'loss': 'mse', 'optimizer': 'adam', 'graph_mode': 'cutoff', 'cutoff': 0.6979863133143229, 'grm_norm': 'gcn', 'self_loops': True, 'use_snp_selection': False}. Best is trial 30 with value: 0.31405307096775703.
[I 2025-12-08 21:25:00,409] Trial 50 finished with value: 0.3082570232044733 and parameters: {'model_type': 'graphsage', 'hidden_dims': '[128, 64]', 'dropout': 0.32598215246506623, 'batch_norm': True, 'sage_aggr': 'mean', 'sage_normalize': True, 'sage_project': False, 'lr': 5.7629638805463394e-05, 'weight_decay': 5.175372921801362e-05, 'epochs': 312, 'loss': 'mse', 'optimizer': 'adam', 'graph_mode': 'cutoff', 'cutoff': 0.8641015525670732, 'grm_norm': 'cosine_then_gcn', 'self_loops': True, 'use_snp_selection': False}. Best is trial 30 with value: 0.31405307096775703.
[I 2025-12-08 21:25:51,333] Trial 51 finished with value: 0.2935039500082562 and parameters: {'model_type': 'graphsage', 'hidden_dims': '[128, 64]', 'dropout': 0.3335270505866935, 'batch_norm': True, 'sage_aggr': 'mean', 'sage_normalize': True, 'sage_project': False, 'lr': 1.0158769191343586e-05, 'weight_decay': 4.8888026337945764e-05, 'epochs': 306, 'loss': 'mse', 'optimizer': 'adam', 'graph_mode': 'cutoff', 'cutoff': 0.8560423044786221, 'grm_norm': 'cosine_then_gcn', 'self_loops': True, 'use_snp_selection': False}. Best is trial 30 with value: 0.31405307096775703.
[I 2025-12-08 21:26:44,954] Trial 52 finished with value: 0.30709581159470317 and parameters: {'model_type': 'graphsage', 'hidden_dims': '[128, 64]', 'dropout': 0.2902818575683862, 'batch_norm': True, 'sage_aggr': 'mean', 'sage_normalize': True, 'sage_project': False, 'lr': 0.00011618852190307736, 'weight_decay': 0.0003341723886533779, 'epochs': 326, 'loss': 'mse', 'optimizer': 'adam', 'graph_mode': 'cutoff', 'cutoff': 0.8705116529223648, 'grm_norm': 'cosine_then_gcn', 'self_loops': True, 'use_snp_selection': False}. Best is trial 30 with value: 0.31405307096775703.
[I 2025-12-08 21:27:31,100] Trial 53 finished with value: 0.3059756728883986 and parameters: {'model_type': 'graphsage', 'hidden_dims': '[128, 64]', 'dropout': 0.31304785206055796, 'batch_norm': True, 'sage_aggr': 'mean', 'sage_normalize': True, 'sage_project': False, 'lr': 4.599038839182411e-05, 'weight_decay': 3.516672645686854e-05, 'epochs': 277, 'loss': 'mse', 'optimizer': 'adam', 'graph_mode': 'cutoff', 'cutoff': 0.7529993064736543, 'grm_norm': 'none', 'self_loops': True, 'use_snp_selection': False}. Best is trial 30 with value: 0.31405307096775703.
[I 2025-12-08 21:28:46,059] Trial 54 finished with value: 0.30517980058168126 and parameters: {'model_type': 'graphsage', 'hidden_dims': '[256, 128, 64]', 'dropout': 0.23348759618526246, 'batch_norm': True, 'sage_aggr': 'mean', 'sage_normalize': True, 'sage_project': False, 'lr': 0.00023996708786405458, 'weight_decay': 6.180807746419688e-05, 'epochs': 294, 'loss': 'mse', 'optimizer': 'adam', 'graph_mode': 'cutoff', 'cutoff': 0.893530226252479, 'grm_norm': 'cosine_then_gcn', 'self_loops': True, 'use_snp_selection': False}. Best is trial 30 with value: 0.31405307096775703.
[I 2025-12-08 21:31:57,202] Trial 55 finished with value: 0.2994378505481608 and parameters: {'model_type': 'graphsage', 'hidden_dims': '[512, 128]', 'dropout': 0.4446153378758932, 'batch_norm': True, 'sage_aggr': 'mean', 'sage_normalize': True, 'sage_project': False, 'lr': 7.393170594066212e-05, 'weight_decay': 0.0002011321030968268, 'epochs': 260, 'loss': 'mse', 'optimizer': 'adam', 'graph_mode': 'cutoff', 'cutoff': 0.22285419746436375, 'grm_norm': 'cosine_then_gcn', 'self_loops': True, 'use_snp_selection': False}. Best is trial 30 with value: 0.31405307096775703.
[I 2025-12-08 21:32:37,769] Trial 56 finished with value: 0.30511418369524246 and parameters: {'model_type': 'graphsage', 'hidden_dims': '[128, 64]', 'dropout': 0.37251069438719664, 'batch_norm': True, 'sage_aggr': 'mean', 'sage_normalize': True, 'sage_project': False, 'lr': 0.002422463346693335, 'weight_decay': 0.00010264300349503357, 'epochs': 228, 'loss': 'mse', 'optimizer': 'adam', 'graph_mode': 'cutoff', 'cutoff': 0.769951834383826, 'grm_norm': 'cosine_then_gcn', 'self_loops': True, 'use_snp_selection': False}. Best is trial 30 with value: 0.31405307096775703.
[I 2025-12-08 21:34:53,415] Trial 57 finished with value: 0.3075407082134822 and parameters: {'model_type': 'graphsage', 'hidden_dims': '[512, 256]', 'dropout': 0.41648961474626955, 'batch_norm': True, 'sage_aggr': 'mean', 'sage_normalize': True, 'sage_project': False, 'lr': 2.137160116102584e-05, 'weight_decay': 1.922034860861835e-06, 'epochs': 315, 'loss': 'mse', 'optimizer': 'adam', 'graph_mode': 'cutoff', 'cutoff': 0.8631780778606153, 'grm_norm': 'none', 'self_loops': False, 'use_snp_selection': False}. Best is trial 30 with value: 0.31405307096775703.
[I 2025-12-08 21:36:21,436] Trial 58 finished with value: 0.2786062669596753 and parameters: {'model_type': 'graphsage', 'hidden_dims': '[512, 64]', 'dropout': 0.4725772258960491, 'batch_norm': False, 'sage_aggr': 'mean', 'sage_normalize': True, 'sage_project': False, 'lr': 0.0016651652087554787, 'weight_decay': 0.00031598750246653317, 'epochs': 192, 'loss': 'mse', 'optimizer': 'adam', 'graph_mode': 'cutoff', 'cutoff': 0.801968970750939, 'grm_norm': 'cosine_then_gcn', 'self_loops': True, 'use_snp_selection': False}. Best is trial 30 with value: 0.31405307096775703.
[I 2025-12-08 21:39:02,627] Trial 59 finished with value: 0.30809521070417023 and parameters: {'model_type': 'graphsage', 'hidden_dims': '[512, 128]', 'dropout': 0.273748933338299, 'batch_norm': True, 'sage_aggr': 'mean', 'sage_normalize': False, 'sage_project': False, 'lr': 0.007839253753789863, 'weight_decay': 2.7443034454918256e-05, 'epochs': 333, 'loss': 'mse', 'optimizer': 'adam', 'graph_mode': 'cutoff', 'cutoff': 0.8350776219860275, 'grm_norm': 'cosine_then_gcn', 'self_loops': True, 'use_snp_selection': True, 'num_snps': 53896}. Best is trial 30 with value: 0.31405307096775703.
[I 2025-12-08 21:40:06,125] Trial 60 finished with value: 0.2877987584521383 and parameters: {'model_type': 'graphsage', 'hidden_dims': '[256, 128, 64]', 'dropout': 0.4002719108548732, 'batch_norm': True, 'sage_aggr': 'max', 'sage_normalize': True, 'sage_project': False, 'lr': 0.0028774676548398363, 'weight_decay': 0.000135377083371376, 'epochs': 247, 'loss': 'mae', 'optimizer': 'adam', 'graph_mode': 'cutoff', 'cutoff': 0.6872706566158221, 'grm_norm': 'gcn', 'self_loops': True, 'use_snp_selection': False}. Best is trial 30 with value: 0.31405307096775703.
[I 2025-12-08 21:42:47,177] Trial 61 finished with value: 0.3078438661266781 and parameters: {'model_type': 'graphsage', 'hidden_dims': '[512, 128]', 'dropout': 0.27901601005034904, 'batch_norm': True, 'sage_aggr': 'mean', 'sage_normalize': False, 'sage_project': False, 'lr': 0.008026404345836066, 'weight_decay': 2.445183895484315e-05, 'epochs': 336, 'loss': 'mse', 'optimizer': 'adam', 'graph_mode': 'cutoff', 'cutoff': 0.8936191580941008, 'grm_norm': 'cosine_then_gcn', 'self_loops': True, 'use_snp_selection': True, 'num_snps': 52501}. Best is trial 30 with value: 0.31405307096775703.
[I 2025-12-08 21:45:20,042] Trial 62 finished with value: 0.3052033861321063 and parameters: {'model_type': 'graphsage', 'hidden_dims': '[512, 128]', 'dropout': 0.32708018748939843, 'batch_norm': True, 'sage_aggr': 'mean', 'sage_normalize': False, 'sage_project': False, 'lr': 0.004038630267192794, 'weight_decay': 1.4450202874296181e-05, 'epochs': 312, 'loss': 'mse', 'optimizer': 'adam', 'graph_mode': 'cutoff', 'cutoff': 0.8358098871926657, 'grm_norm': 'cosine_then_gcn', 'self_loops': True, 'use_snp_selection': True, 'num_snps': 54185}. Best is trial 30 with value: 0.31405307096775703.
[I 2025-12-08 21:47:26,189] Trial 63 finished with value: 0.3064581079598866 and parameters: {'model_type': 'graphsage', 'hidden_dims': '[512, 128]', 'dropout': 0.19869313095866645, 'batch_norm': True, 'sage_aggr': 'mean', 'sage_normalize': False, 'sage_project': False, 'lr': 0.006891525257877324, 'weight_decay': 8.175883723031978e-06, 'epochs': 288, 'loss': 'mse', 'optimizer': 'adam', 'graph_mode': 'cutoff', 'cutoff': 0.7341039471728042, 'grm_norm': 'cosine_then_gcn', 'self_loops': True, 'use_snp_selection': True, 'num_snps': 45738}. Best is trial 30 with value: 0.31405307096775703.
[I 2025-12-08 21:50:09,367] Trial 64 finished with value: 0.30631028335669014 and parameters: {'model_type': 'graphsage', 'hidden_dims': '[512, 128]', 'dropout': 0.12923191072265694, 'batch_norm': True, 'sage_aggr': 'mean', 'sage_normalize': False, 'sage_project': False, 'lr': 0.005292357881501847, 'weight_decay': 5.112382438676754e-05, 'epochs': 326, 'loss': 'mse', 'optimizer': 'adam', 'graph_mode': 'cutoff', 'cutoff': 0.7965163257835488, 'grm_norm': 'cosine_then_gcn', 'self_loops': True, 'use_snp_selection': True, 'num_snps': 56162}. Best is trial 30 with value: 0.31405307096775703.
[I 2025-12-08 21:52:26,491] Trial 65 finished with value: 0.3051509473526967 and parameters: {'model_type': 'graphsage', 'hidden_dims': '[512, 128]', 'dropout': 0.24149744906754322, 'batch_norm': True, 'sage_aggr': 'mean', 'sage_normalize': False, 'sage_project': False, 'lr': 0.007735557841977102, 'weight_decay': 3.086711946025306e-05, 'epochs': 339, 'loss': 'mse', 'optimizer': 'adam', 'graph_mode': 'cutoff', 'cutoff': 0.867241682387584, 'grm_norm': 'cosine_then_gcn', 'self_loops': True, 'use_snp_selection': True, 'num_snps': 44606}. Best is trial 30 with value: 0.31405307096775703.
[I 2025-12-08 21:55:39,799] Trial 66 finished with value: 0.29844772313661305 and parameters: {'model_type': 'graphsage', 'hidden_dims': '[128, 64]', 'dropout': 0.27313655452044605, 'batch_norm': True, 'sage_aggr': 'mean', 'sage_normalize': False, 'sage_project': False, 'lr': 0.003998168428603354, 'weight_decay': 8.70862206313541e-05, 'epochs': 280, 'loss': 'mae', 'optimizer': 'adam', 'graph_mode': 'cutoff', 'cutoff': 0.2710453578791485, 'grm_norm': 'none', 'self_loops': True, 'use_snp_selection': True, 'num_snps': 53041}. Best is trial 30 with value: 0.31405307096775703.
[I 2025-12-08 21:56:20,001] Trial 67 finished with value: 0.26136734446727405 and parameters: {'model_type': 'graphsage', 'hidden_dims': '[512, 128]', 'dropout': 0.44098037977689375, 'batch_norm': True, 'sage_aggr': 'mean', 'sage_normalize': False, 'sage_project': False, 'lr': 0.0014108125640275072, 'weight_decay': 1.614742508638845e-05, 'epochs': 268, 'loss': 'mse', 'optimizer': 'adam', 'graph_mode': 'knn', 'knn_k': 5, 'weighted_edges': False, 'symmetrize_mode': 'union', 'self_loops': True, 'use_snp_selection': True, 'num_snps': 4107}. Best is trial 30 with value: 0.31405307096775703.
[I 2025-12-08 21:56:55,040] Trial 68 finished with value: 0.29694929540818593 and parameters: {'model_type': 'graphsage', 'hidden_dims': '[512, 128]', 'dropout': 0.5159145495371193, 'batch_norm': True, 'sage_aggr': 'mean', 'sage_normalize': True, 'sage_project': False, 'lr': 0.009919924700768955, 'weight_decay': 5.184571630814924e-06, 'epochs': 56, 'loss': 'mse', 'optimizer': 'adam', 'graph_mode': 'cutoff', 'cutoff': 0.7597335949377754, 'grm_norm': 'cosine_then_gcn', 'self_loops': True, 'use_snp_selection': False}. Best is trial 30 with value: 0.31405307096775703.
[I 2025-12-08 21:58:26,994] Trial 69 finished with value: 0.12225419744813962 and parameters: {'model_type': 'graphsage', 'hidden_dims': '[512, 256]', 'dropout': 0.35776639947027605, 'batch_norm': False, 'sage_aggr': 'mean', 'sage_normalize': False, 'sage_project': False, 'lr': 0.002020407448851697, 'weight_decay': 4.4552401998054083e-05, 'epochs': 148, 'loss': 'mae', 'optimizer': 'adam', 'graph_mode': 'cutoff', 'cutoff': 0.6431834152761666, 'grm_norm': 'cosine_then_gcn', 'self_loops': False, 'use_snp_selection': True, 'num_snps': 50846}. Best is trial 30 with value: 0.31405307096775703.
[I 2025-12-08 22:00:15,610] Trial 70 finished with value: 0.3135345906986534 and parameters: {'model_type': 'graphsage', 'hidden_dims': '[512, 128]', 'dropout': 0.5347632099046269, 'batch_norm': True, 'sage_aggr': 'mean', 'sage_normalize': True, 'sage_project': False, 'lr': 0.005649405848583509, 'weight_decay': 2.4376890251875834e-05, 'epochs': 244, 'loss': 'mse', 'optimizer': 'adam', 'graph_mode': 'cutoff', 'cutoff': 0.8328396959402965, 'grm_norm': 'cosine', 'self_loops': True, 'use_snp_selection': False}. Best is trial 30 with value: 0.31405307096775703.
[I 2025-12-08 22:02:04,321] Trial 71 finished with value: 0.3112162578122771 and parameters: {'model_type': 'graphsage', 'hidden_dims': '[512, 128]', 'dropout': 0.5439054183920619, 'batch_norm': True, 'sage_aggr': 'mean', 'sage_normalize': True, 'sage_project': False, 'lr': 0.005672893819200013, 'weight_decay': 2.575683920137786e-05, 'epochs': 244, 'loss': 'mse', 'optimizer': 'adam', 'graph_mode': 'cutoff', 'cutoff': 0.8344414507388055, 'grm_norm': 'cosine', 'self_loops': True, 'use_snp_selection': False}. Best is trial 30 with value: 0.31405307096775703.
[I 2025-12-08 22:03:53,786] Trial 72 finished with value: 0.3109097838257629 and parameters: {'model_type': 'graphsage', 'hidden_dims': '[512, 128]', 'dropout': 0.556234518369763, 'batch_norm': True, 'sage_aggr': 'mean', 'sage_normalize': True, 'sage_project': False, 'lr': 0.005473238030063672, 'weight_decay': 2.058625355871223e-05, 'epochs': 246, 'loss': 'mse', 'optimizer': 'adam', 'graph_mode': 'cutoff', 'cutoff': 0.8138528392748485, 'grm_norm': 'cosine', 'self_loops': True, 'use_snp_selection': False}. Best is trial 30 with value: 0.31405307096775703.
[I 2025-12-08 22:05:41,723] Trial 73 finished with value: 0.3112853108065336 and parameters: {'model_type': 'graphsage', 'hidden_dims': '[512, 128]', 'dropout': 0.5658127024149702, 'batch_norm': True, 'sage_aggr': 'mean', 'sage_normalize': True, 'sage_project': False, 'lr': 0.003961526523157631, 'weight_decay': 1.1021933767153255e-05, 'epochs': 242, 'loss': 'mse', 'optimizer': 'adam', 'graph_mode': 'cutoff', 'cutoff': 0.8485105862380325, 'grm_norm': 'cosine', 'self_loops': True, 'use_snp_selection': False}. Best is trial 30 with value: 0.31405307096775703.
[I 2025-12-08 22:07:30,415] Trial 74 finished with value: 0.31330404626647457 and parameters: {'model_type': 'graphsage', 'hidden_dims': '[512, 128]', 'dropout': 0.5654828688336834, 'batch_norm': True, 'sage_aggr': 'mean', 'sage_normalize': True, 'sage_project': False, 'lr': 0.005831580956372605, 'weight_decay': 9.475035545183392e-06, 'epochs': 244, 'loss': 'mse', 'optimizer': 'adam', 'graph_mode': 'cutoff', 'cutoff': 0.7699432583337387, 'grm_norm': 'cosine', 'self_loops': True, 'use_snp_selection': False}. Best is trial 30 with value: 0.31405307096775703.
[I 2025-12-08 22:09:18,728] Trial 75 finished with value: 0.31279032831327097 and parameters: {'model_type': 'graphsage', 'hidden_dims': '[512, 128]', 'dropout': 0.5763181059504024, 'batch_norm': True, 'sage_aggr': 'mean', 'sage_normalize': True, 'sage_project': False, 'lr': 0.005799092468076616, 'weight_decay': 1.0019250580703392e-05, 'epochs': 243, 'loss': 'mse', 'optimizer': 'adam', 'graph_mode': 'cutoff', 'cutoff': 0.7763687239179483, 'grm_norm': 'cosine', 'self_loops': True, 'use_snp_selection': False}. Best is trial 30 with value: 0.31405307096775703.
[I 2025-12-08 22:11:07,059] Trial 76 finished with value: 0.3024154531133704 and parameters: {'model_type': 'graphsage', 'hidden_dims': '[512, 128]', 'dropout': 0.5739814676797876, 'batch_norm': True, 'sage_aggr': 'mean', 'sage_normalize': True, 'sage_project': False, 'lr': 0.005620733473266694, 'weight_decay': 1.1133243024485679e-05, 'epochs': 243, 'loss': 'mae', 'optimizer': 'adam', 'graph_mode': 'cutoff', 'cutoff': 0.7190688098450916, 'grm_norm': 'cosine', 'self_loops': True, 'use_snp_selection': False}. Best is trial 30 with value: 0.31405307096775703.
[I 2025-12-08 22:12:45,222] Trial 77 finished with value: 0.31013741108356063 and parameters: {'model_type': 'graphsage', 'hidden_dims': '[512, 128]', 'dropout': 0.5979645782638107, 'batch_norm': True, 'sage_aggr': 'max', 'sage_normalize': True, 'sage_project': False, 'lr': 0.003338601627018555, 'weight_decay': 9.369606302071004e-06, 'epochs': 218, 'loss': 'mse', 'optimizer': 'adam', 'graph_mode': 'cutoff', 'cutoff': 0.7892110676942132, 'grm_norm': 'cosine', 'self_loops': True, 'use_snp_selection': False}. Best is trial 30 with value: 0.31405307096775703.
[I 2025-12-08 22:13:46,464] Trial 78 finished with value: 0.3054563726986692 and parameters: {'model_type': 'graphsage', 'hidden_dims': '[256, 128]', 'dropout': 0.5485014328382829, 'batch_norm': True, 'sage_aggr': 'mean', 'sage_normalize': True, 'sage_project': False, 'lr': 0.002673516100238301, 'weight_decay': 5.113039809649287e-06, 'epochs': 231, 'loss': 'mse', 'optimizer': 'adam', 'graph_mode': 'cutoff', 'cutoff': 0.6666534162624065, 'grm_norm': 'cosine', 'self_loops': True, 'use_snp_selection': False}. Best is trial 30 with value: 0.31405307096775703.
[I 2025-12-08 22:15:29,712] Trial 79 finished with value: 0.2975584683150666 and parameters: {'model_type': 'graphsage', 'hidden_dims': '[512, 128]', 'dropout': 0.5332305578051821, 'batch_norm': True, 'sage_aggr': 'mean', 'sage_normalize': True, 'sage_project': False, 'lr': 0.005908555651040095, 'weight_decay': 3.0224369081064645e-06, 'epochs': 208, 'loss': 'mse', 'optimizer': 'adam', 'graph_mode': 'knn', 'knn_k': 1, 'weighted_edges': True, 'symmetrize_mode': 'union', 'self_loops': True, 'use_snp_selection': False}. Best is trial 30 with value: 0.31405307096775703.
[I 2025-12-08 22:17:21,099] Trial 80 finished with value: 0.3040923193685042 and parameters: {'model_type': 'graphsage', 'hidden_dims': '[512, 64]', 'dropout': 0.5582573273268067, 'batch_norm': True, 'sage_aggr': 'mean', 'sage_normalize': True, 'sage_project': False, 'lr': 0.0040564386944476035, 'weight_decay': 2.0281740889382276e-05, 'epochs': 251, 'loss': 'mae', 'optimizer': 'adam', 'graph_mode': 'cutoff', 'cutoff': 0.771918779631664, 'grm_norm': 'cosine', 'self_loops': True, 'use_snp_selection': False}. Best is trial 30 with value: 0.31405307096775703.
[I 2025-12-08 22:18:51,018] Trial 81 finished with value: 0.31258221853837204 and parameters: {'model_type': 'graphsage', 'hidden_dims': '[512, 128]', 'dropout': 0.5829765913726693, 'batch_norm': True, 'sage_aggr': 'mean', 'sage_normalize': True, 'sage_project': False, 'lr': 0.00737358718341862, 'weight_decay': 6.278701815695578e-06, 'epochs': 196, 'loss': 'mse', 'optimizer': 'adam', 'graph_mode': 'cutoff', 'cutoff': 0.8246496702828351, 'grm_norm': 'cosine', 'self_loops': True, 'use_snp_selection': False}. Best is trial 30 with value: 0.31405307096775703.
[I 2025-12-08 22:20:22,842] Trial 82 finished with value: 0.3161094675173128 and parameters: {'model_type': 'graphsage', 'hidden_dims': '[512, 128]', 'dropout': 0.5815981732718056, 'batch_norm': True, 'sage_aggr': 'mean', 'sage_normalize': True, 'sage_project': False, 'lr': 0.007010901754621436, 'weight_decay': 6.809094943633017e-06, 'epochs': 201, 'loss': 'mse', 'optimizer': 'adam', 'graph_mode': 'cutoff', 'cutoff': 0.8188907878489295, 'grm_norm': 'cosine', 'self_loops': True, 'use_snp_selection': False}. Best is trial 82 with value: 0.3161094675173128.
