[I 2025-12-09 00:12:19,802] Trial 72 finished with value: 0.27866491603645666 and parameters: {'model_type': 'graphsage', 'hidden_dims': '[512, 64]', 'dropout': 0.24496206451834485, 'batch_norm': False, 'sage_aggr': 'max', 'sage_normalize': False, 'sage_project': False, 'lr': 1.233037305250875e-05, 'weight_decay': 8.041801797717431e-06, 'epochs': 306, 'loss': 'mse', 'optimizer': 'adam', 'graph_mode': 'cutoff', 'cutoff': 0.8919337347226602, 'grm_norm': 'gcn', 'self_loops': True, 'use_snp_selection': False}. Best is trial 44 with value: 0.2989826039814593.
[I 2025-12-09 00:14:42,821] Trial 73 finished with value: 0.2955207587723242 and parameters: {'model_type': 'graphsage', 'hidden_dims': '[256, 128]', 'dropout': 0.2098804221394248, 'batch_norm': False, 'sage_aggr': 'max', 'sage_normalize': False, 'sage_project': False, 'lr': 1.6075029929728334e-05, 'weight_decay': 1.5221481339728475e-05, 'epochs': 300, 'loss': 'mse', 'optimizer': 'adam', 'graph_mode': 'cutoff', 'cutoff': 0.4101460620265912, 'grm_norm': 'gcn', 'self_loops': True, 'use_snp_selection': False}. Best is trial 44 with value: 0.2989826039814593.
[I 2025-12-09 00:17:47,449] Trial 74 finished with value: 0.28800975499576476 and parameters: {'model_type': 'graphsage', 'hidden_dims': '[128, 64]', 'dropout': 0.18293289533315724, 'batch_norm': False, 'sage_aggr': 'max', 'sage_normalize': False, 'sage_project': False, 'lr': 2.9131110898801053e-05, 'weight_decay': 2.337901079229951e-06, 'epochs': 280, 'loss': 'mse', 'optimizer': 'adam', 'graph_mode': 'cutoff', 'cutoff': 0.27712970274507887, 'grm_norm': 'gcn', 'self_loops': True, 'use_snp_selection': False}. Best is trial 44 with value: 0.2989826039814593.
[I 2025-12-09 00:20:47,544] Trial 75 finished with value: 0.28927580818178755 and parameters: {'model_type': 'graphsage', 'hidden_dims': '[128, 64]', 'dropout': 0.3413346107822675, 'batch_norm': False, 'sage_aggr': 'max', 'sage_normalize': False, 'sage_project': False, 'lr': 1.1997595259434833e-05, 'weight_decay': 1.6468817869192637e-06, 'epochs': 350, 'loss': 'mse', 'optimizer': 'adam', 'graph_mode': 'cutoff', 'cutoff': 0.3192697380464081, 'grm_norm': 'gcn', 'self_loops': True, 'use_snp_selection': False}. Best is trial 44 with value: 0.2989826039814593.
[I 2025-12-09 00:25:57,205] Trial 76 finished with value: 0.2875488062730393 and parameters: {'model_type': 'graphsage', 'hidden_dims': '[512, 64]', 'dropout': 0.22960250958415782, 'batch_norm': False, 'sage_aggr': 'max', 'sage_normalize': False, 'sage_project': False, 'lr': 1.0003944645989704e-05, 'weight_decay': 3.411337220441807e-06, 'epochs': 318, 'loss': 'mse', 'optimizer': 'adam', 'graph_mode': 'knn', 'knn_k': 10, 'weighted_edges': False, 'symmetrize_mode': 'mutual', 'self_loops': True, 'use_snp_selection': False}. Best is trial 44 with value: 0.2989826039814593.
[I 2025-12-09 00:29:47,277] Trial 77 finished with value: 0.2534130262048529 and parameters: {'model_type': 'graphsage', 'hidden_dims': '[256, 128, 64]', 'dropout': 0.1545582202118836, 'batch_norm': False, 'sage_aggr': 'mean', 'sage_normalize': True, 'sage_project': False, 'lr': 1.9960581446332866e-05, 'weight_decay': 1.298569189262039e-06, 'epochs': 263, 'loss': 'mse', 'optimizer': 'adam', 'graph_mode': 'cutoff', 'cutoff': 0.3765961152314127, 'grm_norm': 'cosine_then_gcn', 'self_loops': True, 'use_snp_selection': True, 'num_snps': 55641}. Best is trial 44 with value: 0.2989826039814593.
[I 2025-12-09 00:31:38,557] Trial 78 finished with value: 0.29188722844909204 and parameters: {'model_type': 'graphsage', 'hidden_dims': '[128, 64]', 'dropout': 0.26086338060932857, 'batch_norm': False, 'sage_aggr': 'max', 'sage_normalize': False, 'sage_project': False, 'lr': 1.5993491347534356e-05, 'weight_decay': 1.2801940875671671e-05, 'epochs': 292, 'loss': 'mse', 'optimizer': 'adam', 'graph_mode': 'cutoff', 'cutoff': 0.3442399662547573, 'grm_norm': 'cosine_then_gcn', 'self_loops': True, 'use_snp_selection': False}. Best is trial 44 with value: 0.2989826039814593.
[I 2025-12-09 00:33:07,652] Trial 79 finished with value: 0.24831318963347843 and parameters: {'model_type': 'graphsage', 'hidden_dims': '[128, 64]', 'dropout': 0.2769559138705501, 'batch_norm': True, 'sage_aggr': 'mean', 'sage_normalize': False, 'sage_project': False, 'lr': 2.5178809176793687e-05, 'weight_decay': 5.957690523112805e-06, 'epochs': 275, 'loss': 'mae', 'optimizer': 'adam', 'graph_mode': 'cutoff', 'cutoff': 0.42376506082788373, 'grm_norm': 'gcn', 'self_loops': True, 'use_snp_selection': False}. Best is trial 44 with value: 0.2989826039814593.
[I 2025-12-09 00:36:06,098] Trial 80 finished with value: 0.18798825773689617 and parameters: {'model_type': 'graphsage', 'hidden_dims': '[512, 64]', 'dropout': 0.2963586791571408, 'batch_norm': False, 'sage_aggr': 'mean', 'sage_normalize': False, 'sage_project': False, 'lr': 0.0003147031439242886, 'weight_decay': 8.86023339782168e-06, 'epochs': 190, 'loss': 'mse', 'optimizer': 'adam', 'graph_mode': 'knn', 'knn_k': 6, 'weighted_edges': True, 'symmetrize_mode': 'union', 'self_loops': False, 'use_snp_selection': False}. Best is trial 44 with value: 0.2989826039814593.
[I 2025-12-09 00:38:29,654] Trial 81 finished with value: 0.29386850028702355 and parameters: {'model_type': 'graphsage', 'hidden_dims': '[256, 128]', 'dropout': 0.2101740570115835, 'batch_norm': False, 'sage_aggr': 'max', 'sage_normalize': False, 'sage_project': False, 'lr': 1.3641391981743298e-05, 'weight_decay': 1.941229609704135e-05, 'epochs': 298, 'loss': 'mse', 'optimizer': 'adam', 'graph_mode': 'cutoff', 'cutoff': 0.40092761174390096, 'grm_norm': 'gcn', 'self_loops': True, 'use_snp_selection': False}. Best is trial 44 with value: 0.2989826039814593.
[I 2025-12-09 00:40:52,511] Trial 82 finished with value: 0.300111585155938 and parameters: {'model_type': 'graphsage', 'hidden_dims': '[256, 128]', 'dropout': 0.20822557465214334, 'batch_norm': False, 'sage_aggr': 'max', 'sage_normalize': False, 'sage_project': False, 'lr': 1.565400910391573e-05, 'weight_decay': 2.4092371575738886e-05, 'epochs': 310, 'loss': 'mse', 'optimizer': 'adam', 'graph_mode': 'cutoff', 'cutoff': 0.45142853453323506, 'grm_norm': 'gcn', 'self_loops': True, 'use_snp_selection': False}. Best is trial 82 with value: 0.300111585155938.
[I 2025-12-09 00:43:21,227] Trial 83 finished with value: 0.29186046296002477 and parameters: {'model_type': 'graphsage', 'hidden_dims': '[256, 128]', 'dropout': 0.18815433869556747, 'batch_norm': False, 'sage_aggr': 'max', 'sage_normalize': False, 'sage_project': False, 'lr': 1.7529295956740747e-05, 'weight_decay': 5.557524578827349e-05, 'epochs': 326, 'loss': 'mse', 'optimizer': 'adam', 'graph_mode': 'cutoff', 'cutoff': 0.4598558567166903, 'grm_norm': 'gcn', 'self_loops': True, 'use_snp_selection': False}. Best is trial 82 with value: 0.300111585155938.
[I 2025-12-09 00:45:14,680] Trial 84 finished with value: 0.2825849645574661 and parameters: {'model_type': 'graphsage', 'hidden_dims': '[256, 128]', 'dropout': 0.2481058419661287, 'batch_norm': False, 'sage_aggr': 'max', 'sage_normalize': False, 'sage_project': False, 'lr': 1.2194943188551567e-05, 'weight_decay': 2.3958879220721348e-05, 'epochs': 310, 'loss': 'mse', 'optimizer': 'adam', 'graph_mode': 'cutoff', 'cutoff': 0.5127370313606306, 'grm_norm': 'cosine_then_gcn', 'self_loops': True, 'use_snp_selection': False}. Best is trial 82 with value: 0.300111585155938.
[I 2025-12-09 00:46:53,913] Trial 85 finished with value: 0.3010353739747248 and parameters: {'model_type': 'graphsage', 'hidden_dims': '[256, 128]', 'dropout': 0.20200340245706644, 'batch_norm': False, 'sage_aggr': 'max', 'sage_normalize': False, 'sage_project': False, 'lr': 2.2024132826192734e-05, 'weight_decay': 4.057584336480774e-06, 'epochs': 220, 'loss': 'mse', 'optimizer': 'adam', 'graph_mode': 'cutoff', 'cutoff': 0.4824641494593961, 'grm_norm': 'gcn', 'self_loops': True, 'use_snp_selection': False}. Best is trial 85 with value: 0.3010353739747248.
[I 2025-12-09 00:47:19,936] Trial 86 finished with value: 0.28050914474800775 and parameters: {'model_type': 'graphsage', 'hidden_dims': '[256, 128]', 'dropout': 0.22882108913204532, 'batch_norm': False, 'sage_aggr': 'max', 'sage_normalize': False, 'sage_project': False, 'lr': 2.013569813782691e-05, 'weight_decay': 2.612458453293323e-06, 'epochs': 214, 'loss': 'mse', 'optimizer': 'adam', 'graph_mode': 'cutoff', 'cutoff': 0.48254501793585175, 'grm_norm': 'cosine', 'self_loops': True, 'use_snp_selection': True, 'num_snps': 2368}. Best is trial 85 with value: 0.3010353739747248.
[I 2025-12-09 00:48:40,001] Trial 87 finished with value: 0.2841650539619226 and parameters: {'model_type': 'graphsage', 'hidden_dims': '[256, 128]', 'dropout': 0.16221189412642076, 'batch_norm': False, 'sage_aggr': 'mean', 'sage_normalize': False, 'sage_project': False, 'lr': 2.3154348289752493e-05, 'weight_decay': 4.188182117244101e-06, 'epochs': 231, 'loss': 'mse', 'optimizer': 'adam', 'graph_mode': 'cutoff', 'cutoff': 0.5292745273643502, 'grm_norm': 'cosine_then_gcn', 'self_loops': True, 'use_snp_selection': False}. Best is trial 85 with value: 0.3010353739747248.
[I 2025-12-09 00:50:10,457] Trial 88 finished with value: 0.26232227050081147 and parameters: {'model_type': 'graphsage', 'hidden_dims': '[256, 128]', 'dropout': 0.13842639733168896, 'batch_norm': False, 'sage_aggr': 'mean', 'sage_normalize': True, 'sage_project': False, 'lr': 4.332027381138536e-05, 'weight_decay': 2.1484428216318737e-06, 'epochs': 201, 'loss': 'mse', 'optimizer': 'adam', 'graph_mode': 'cutoff', 'cutoff': 0.44704128566155765, 'grm_norm': 'gcn', 'self_loops': True, 'use_snp_selection': False}. Best is trial 85 with value: 0.3010353739747248.
[I 2025-12-09 00:52:52,658] Trial 89 finished with value: 0.2867096557899984 and parameters: {'model_type': 'graphsage', 'hidden_dims': '[256, 128]', 'dropout': 0.2426665332645857, 'batch_norm': False, 'sage_aggr': 'max', 'sage_normalize': False, 'sage_project': False, 'lr': 1.5734293833317638e-05, 'weight_decay': 1.2553969349160913e-06, 'epochs': 256, 'loss': 'mse', 'optimizer': 'adam', 'graph_mode': 'knn', 'knn_k': 8, 'weighted_edges': False, 'symmetrize_mode': 'mutual', 'self_loops': True, 'use_snp_selection': False}. Best is trial 85 with value: 0.3010353739747248.
[I 2025-12-09 00:53:51,826] Trial 90 finished with value: 0.27551983235651895 and parameters: {'model_type': 'graphsage', 'hidden_dims': '[512, 128]', 'dropout': 0.10249808016434946, 'batch_norm': False, 'sage_aggr': 'mean', 'sage_normalize': False, 'sage_project': False, 'lr': 3.2679474537642284e-05, 'weight_decay': 3.1108130402907985e-06, 'epochs': 220, 'loss': 'mae', 'optimizer': 'adam', 'graph_mode': 'cutoff', 'cutoff': 0.7665537398760109, 'grm_norm': 'cosine_then_gcn', 'self_loops': True, 'use_snp_selection': True, 'num_snps': 16644}. Best is trial 85 with value: 0.3010353739747248.
[I 2025-12-09 00:55:11,315] Trial 91 finished with value: 0.2974381558840756 and parameters: {'model_type': 'graphsage', 'hidden_dims': '[128, 64]', 'dropout': 0.20793845086501833, 'batch_norm': False, 'sage_aggr': 'max', 'sage_normalize': False, 'sage_project': False, 'lr': 1.3735503699647635e-05, 'weight_decay': 6.506661960707866e-06, 'epochs': 248, 'loss': 'mse', 'optimizer': 'adam', 'graph_mode': 'cutoff', 'cutoff': 0.48882186694582963, 'grm_norm': 'gcn', 'self_loops': True, 'use_snp_selection': False}. Best is trial 85 with value: 0.3010353739747248.
[I 2025-12-09 00:56:26,212] Trial 92 finished with value: 0.2980734628986771 and parameters: {'model_type': 'graphsage', 'hidden_dims': '[128, 64]', 'dropout': 0.21879564126235074, 'batch_norm': False, 'sage_aggr': 'max', 'sage_normalize': False, 'sage_project': False, 'lr': 1.4056905623315489e-05, 'weight_decay': 6.268605942641524e-06, 'epochs': 236, 'loss': 'mse', 'optimizer': 'adam', 'graph_mode': 'cutoff', 'cutoff': 0.4917524624292548, 'grm_norm': 'gcn', 'self_loops': True, 'use_snp_selection': False}. Best is trial 85 with value: 0.3010353739747248.
[I 2025-12-09 00:57:24,498] Trial 93 finished with value: 0.28267661676731526 and parameters: {'model_type': 'graphsage', 'hidden_dims': '[128, 64]', 'dropout': 0.19411249387972587, 'batch_norm': False, 'sage_aggr': 'max', 'sage_normalize': False, 'sage_project': False, 'lr': 1.383202944660079e-05, 'weight_decay': 5.15127853593862e-06, 'epochs': 246, 'loss': 'mse', 'optimizer': 'adam', 'graph_mode': 'cutoff', 'cutoff': 0.5496112123745557, 'grm_norm': 'gcn', 'self_loops': True, 'use_snp_selection': False}. Best is trial 85 with value: 0.3010353739747248.
[I 2025-12-09 00:59:03,880] Trial 94 finished with value: 0.011448728947158067 and parameters: {'model_type': 'graphsage', 'hidden_dims': '[256, 128]', 'dropout': 0.2194244720488808, 'batch_norm': False, 'sage_aggr': 'max', 'sage_normalize': False, 'sage_project': False, 'lr': 0.005851014081280891, 'weight_decay': 1.1396890638693139e-05, 'epochs': 233, 'loss': 'mse', 'optimizer': 'adam', 'graph_mode': 'cutoff', 'cutoff': 0.49740565778274065, 'grm_norm': 'gcn', 'self_loops': True, 'use_snp_selection': False}. Best is trial 85 with value: 0.3010353739747248.
[I 2025-12-09 00:59:50,586] Trial 95 finished with value: 0.29314951137017176 and parameters: {'model_type': 'graphsage', 'hidden_dims': '[128, 64]', 'dropout': 0.2540351986388507, 'batch_norm': False, 'sage_aggr': 'max', 'sage_normalize': False, 'sage_project': False, 'lr': 1.0233267277470737e-05, 'weight_decay': 6.5061157318984375e-06, 'epochs': 207, 'loss': 'mse', 'optimizer': 'adam', 'graph_mode': 'cutoff', 'cutoff': 0.5718354780372912, 'grm_norm': 'gcn', 'self_loops': True, 'use_snp_selection': False}. Best is trial 85 with value: 0.3010353739747248.
[I 2025-12-09 01:01:38,119] Trial 96 finished with value: 0.22840415813945655 and parameters: {'model_type': 'graphsage', 'hidden_dims': '[256, 128, 64]', 'dropout': 0.2060640495187656, 'batch_norm': True, 'sage_aggr': 'max', 'sage_normalize': False, 'sage_project': False, 'lr': 2.253044366636941e-05, 'weight_decay': 6.379320304784388e-07, 'epochs': 226, 'loss': 'mse', 'optimizer': 'adam', 'graph_mode': 'cutoff', 'cutoff': 0.42692260396056114, 'grm_norm': 'cosine_then_gcn', 'self_loops': True, 'use_snp_selection': False}. Best is trial 85 with value: 0.3010353739747248.
[I 2025-12-09 01:05:23,212] Trial 97 finished with value: 0.2939487693087158 and parameters: {'model_type': 'graphsage', 'hidden_dims': '[512, 256]', 'dropout': 0.17402658927783948, 'batch_norm': False, 'sage_aggr': 'max', 'sage_normalize': False, 'sage_project': False, 'lr': 1.786872374933547e-05, 'weight_decay': 4.1942351362247915e-06, 'epochs': 238, 'loss': 'mse', 'optimizer': 'adam', 'graph_mode': 'cutoff', 'cutoff': 0.30618137998751876, 'grm_norm': 'none', 'self_loops': False, 'use_snp_selection': False}. Best is trial 85 with value: 0.3010353739747248.
[I 2025-12-09 01:08:25,483] Trial 98 finished with value: 0.2976455249477339 and parameters: {'model_type': 'graphsage', 'hidden_dims': '[512, 64]', 'dropout': 0.26162071096988515, 'batch_norm': False, 'sage_aggr': 'max', 'sage_normalize': False, 'sage_project': False, 'lr': 1.4029107321036287e-05, 'weight_decay': 1.659272043685082e-06, 'epochs': 250, 'loss': 'mse', 'optimizer': 'adam', 'graph_mode': 'cutoff', 'cutoff': 0.4519861209544533, 'grm_norm': 'gcn', 'self_loops': True, 'use_snp_selection': False}. Best is trial 85 with value: 0.3010353739747248.
[I 2025-12-09 01:12:06,804] Trial 99 finished with value: 0.26881587247953637 and parameters: {'model_type': 'graphsage', 'hidden_dims': '[512, 64]', 'dropout': 0.2826309175529559, 'batch_norm': False, 'sage_aggr': 'max', 'sage_normalize': False, 'sage_project': False, 'lr': 2.7523995723869114e-05, 'weight_decay': 1.6266410172823136e-06, 'epochs': 247, 'loss': 'mse', 'optimizer': 'adam', 'graph_mode': 'knn', 'knn_k': 8, 'weighted_edges': False, 'symmetrize_mode': 'mutual', 'self_loops': True, 'use_snp_selection': False}. Best is trial 85 with value: 0.3010353739747248.
[I 2025-12-09 01:14:33,720] Trial 100 finished with value: 0.2977720050866882 and parameters: {'model_type': 'graphsage', 'hidden_dims': '[512, 64]', 'dropout': 0.2626972497640769, 'batch_norm': False, 'sage_aggr': 'max', 'sage_normalize': False, 'sage_project': False, 'lr': 1.403563086791199e-05, 'weight_decay': 2.9564840224876723e-06, 'epochs': 252, 'loss': 'mse', 'optimizer': 'adam', 'graph_mode': 'cutoff', 'cutoff': 0.4736564761507471, 'grm_norm': 'cosine_then_gcn', 'self_loops': True, 'use_snp_selection': True, 'num_snps': 32227}. Best is trial 85 with value: 0.3010353739747248.
[I 2025-12-09 01:17:08,685] Trial 101 finished with value: 0.2954848616129936 and parameters: {'model_type': 'graphsage', 'hidden_dims': '[512, 64]', 'dropout': 0.26173156745824655, 'batch_norm': False, 'sage_aggr': 'max', 'sage_normalize': False, 'sage_project': False, 'lr': 1.382928142604818e-05, 'weight_decay': 2.8113338554389327e-06, 'epochs': 254, 'loss': 'mse', 'optimizer': 'adam', 'graph_mode': 'cutoff', 'cutoff': 0.4541225494095873, 'grm_norm': 'cosine_then_gcn', 'self_loops': True, 'use_snp_selection': True, 'num_snps': 32750}. Best is trial 85 with value: 0.3010353739747248.
[I 2025-12-09 01:17:54,421] Trial 102 finished with value: 0.29363964525413727 and parameters: {'model_type': 'graphsage', 'hidden_dims': '[512, 64]', 'dropout': 0.27461361050598004, 'batch_norm': False, 'sage_aggr': 'max', 'sage_normalize': False, 'sage_project': False, 'lr': 1.1655870922033218e-05, 'weight_decay': 5.9555152542712806e-06, 'epochs': 217, 'loss': 'mse', 'optimizer': 'adam', 'graph_mode': 'cutoff', 'cutoff': 0.4760623424203109, 'grm_norm': 'cosine_then_gcn', 'self_loops': True, 'use_snp_selection': True, 'num_snps': 8680}. Best is trial 85 with value: 0.3010353739747248.
[I 2025-12-09 01:19:11,949] Trial 103 finished with value: 0.2721214486256082 and parameters: {'model_type': 'graphsage', 'hidden_dims': '[512, 64]', 'dropout': 0.22183219935592907, 'batch_norm': False, 'sage_aggr': 'max', 'sage_normalize': False, 'sage_project': False, 'lr': 1.663740277146611e-05, 'weight_decay': 4.4975360116526716e-05, 'epochs': 241, 'loss': 'mse', 'optimizer': 'adam', 'graph_mode': 'cutoff', 'cutoff': 0.5205908293835599, 'grm_norm': 'cosine_then_gcn', 'self_loops': True, 'use_snp_selection': True, 'num_snps': 20871}. Best is trial 85 with value: 0.3010353739747248.
[I 2025-12-09 01:23:00,866] Trial 104 finished with value: 0.3013232731544343 and parameters: {'model_type': 'graphsage', 'hidden_dims': '[512, 64]', 'dropout': 0.24075959592590693, 'batch_norm': False, 'sage_aggr': 'max', 'sage_normalize': False, 'sage_project': False, 'lr': 1.4149984087890639e-05, 'weight_decay': 3.27173164567745e-06, 'epochs': 272, 'loss': 'mse', 'optimizer': 'adam', 'graph_mode': 'cutoff', 'cutoff': 0.4133289798533543, 'grm_norm': 'cosine_then_gcn', 'self_loops': True, 'use_snp_selection': True, 'num_snps': 43460}. Best is trial 104 with value: 0.3013232731544343.
[I 2025-12-09 01:26:57,637] Trial 105 finished with value: 0.29936018108379076 and parameters: {'model_type': 'graphsage', 'hidden_dims': '[512, 64]', 'dropout': 0.2344486470172994, 'batch_norm': False, 'sage_aggr': 'max', 'sage_normalize': False, 'sage_project': False, 'lr': 2.0855309332230254e-05, 'weight_decay': 9.047666134104083e-07, 'epochs': 273, 'loss': 'mse', 'optimizer': 'adam', 'graph_mode': 'cutoff', 'cutoff': 0.4114618231046966, 'grm_norm': 'cosine_then_gcn', 'self_loops': True, 'use_snp_selection': True, 'num_snps': 45005}. Best is trial 104 with value: 0.3013232731544343.
[I 2025-12-09 01:30:57,200] Trial 106 finished with value: 0.2985664461891009 and parameters: {'model_type': 'graphsage', 'hidden_dims': '[512, 64]', 'dropout': 0.3059734361305012, 'batch_norm': False, 'sage_aggr': 'max', 'sage_normalize': False, 'sage_project': False, 'lr': 2.0615153861641738e-05, 'weight_decay': 9.85162030805188e-07, 'epochs': 270, 'loss': 'mse', 'optimizer': 'adam', 'graph_mode': 'cutoff', 'cutoff': 0.4092760532438824, 'grm_norm': 'cosine_then_gcn', 'self_loops': True, 'use_snp_selection': True, 'num_snps': 45659}. Best is trial 104 with value: 0.3013232731544343.
[I 2025-12-09 01:34:53,231] Trial 107 finished with value: 0.2984081410894192 and parameters: {'model_type': 'graphsage', 'hidden_dims': '[512, 64]', 'dropout': 0.30733602466552074, 'batch_norm': False, 'sage_aggr': 'max', 'sage_normalize': False, 'sage_project': False, 'lr': 3.462752601222972e-05, 'weight_decay': 4.255411909133992e-07, 'epochs': 268, 'loss': 'mse', 'optimizer': 'adam', 'graph_mode': 'cutoff', 'cutoff': 0.414383713634815, 'grm_norm': 'cosine_then_gcn', 'self_loops': True, 'use_snp_selection': True, 'num_snps': 46015}. Best is trial 104 with value: 0.3013232731544343.
[I 2025-12-09 01:38:53,373] Trial 108 finished with value: 0.2577614126304231 and parameters: {'model_type': 'graphsage', 'hidden_dims': '[512, 64]', 'dropout': 0.34311267827564906, 'batch_norm': False, 'sage_aggr': 'max', 'sage_normalize': True, 'sage_project': False, 'lr': 6.426843734073583e-05, 'weight_decay': 4.797562401260637e-07, 'epochs': 267, 'loss': 'mse', 'optimizer': 'adam', 'graph_mode': 'cutoff', 'cutoff': 0.4300844414508968, 'grm_norm': 'cosine_then_gcn', 'self_loops': True, 'use_snp_selection': True, 'num_snps': 46614}. Best is trial 104 with value: 0.3013232731544343.
[I 2025-12-09 01:42:33,751] Trial 109 finished with value: 0.09746669424087868 and parameters: {'model_type': 'graphsage', 'hidden_dims': '[512, 64]', 'dropout': 0.30449704967638463, 'batch_norm': False, 'sage_aggr': 'max', 'sage_normalize': False, 'sage_project': False, 'lr': 0.00012398803189837482, 'weight_decay': 4.7011465056331577e-07, 'epochs': 260, 'loss': 'mse', 'optimizer': 'adam', 'graph_mode': 'cutoff', 'cutoff': 0.40558323766821464, 'grm_norm': 'cosine_then_gcn', 'self_loops': True, 'use_snp_selection': True, 'num_snps': 42996}. Best is trial 104 with value: 0.3013232731544343.
