[I 2025-12-08 11:42:21,130] Trial 37 finished with value: 0.2505977587566263 and parameters: {'model_type': 'graphsage', 'hidden_dims': '[128, 64]', 'dropout': 0.49302116680963814, 'batch_norm': False, 'sage_aggr': 'max', 'sage_normalize': False, 'sage_project': False, 'lr': 1.5282159303639765e-05, 'weight_decay': 3.356886161998182e-06, 'epochs': 269, 'loss': 'mse', 'optimizer': 'adam', 'graph_mode': 'cutoff', 'cutoff': 0.2985718312964703, 'grm_norm': 'gcn', 'self_loops': False, 'use_snp_selection': False}. Best is trial 31 with value: 0.2830140239892268.
[I 2025-12-08 11:44:10,501] Trial 38 finished with value: 0.2567629597413449 and parameters: {'model_type': 'graphsage', 'hidden_dims': '[256, 128, 64]', 'dropout': 0.1147241343165514, 'batch_norm': True, 'sage_aggr': 'mean', 'sage_normalize': True, 'sage_project': False, 'lr': 6.454071750586255e-05, 'weight_decay': 1.573807272847972e-07, 'epochs': 197, 'loss': 'mse', 'optimizer': 'adam', 'graph_mode': 'cutoff', 'cutoff': 0.531808132517827, 'grm_norm': 'gcn', 'self_loops': False, 'use_snp_selection': True, 'num_snps': 46625}. Best is trial 31 with value: 0.2830140239892268.
[I 2025-12-08 11:49:15,413] Trial 39 finished with value: 0.2797860193884746 and parameters: {'model_type': 'graphsage', 'hidden_dims': '[512, 256]', 'dropout': 0.3580040692199618, 'batch_norm': False, 'sage_aggr': 'max', 'sage_normalize': False, 'sage_project': False, 'lr': 2.3097368831758828e-05, 'weight_decay': 7.065423697305338e-07, 'epochs': 299, 'loss': 'mse', 'optimizer': 'adam', 'graph_mode': 'cutoff', 'cutoff': 0.4550260859016181, 'grm_norm': 'gcn', 'self_loops': False, 'use_snp_selection': True, 'num_snps': 53047}. Best is trial 31 with value: 0.2830140239892268.
[I 2025-12-08 11:52:58,095] Trial 40 finished with value: 0.26865035175964963 and parameters: {'model_type': 'graphsage', 'hidden_dims': '[512, 64]', 'dropout': 0.33731354336138664, 'batch_norm': True, 'sage_aggr': 'max', 'sage_normalize': False, 'sage_project': False, 'lr': 2.286910457612812e-05, 'weight_decay': 1.3010728377048843e-06, 'epochs': 302, 'loss': 'mse', 'optimizer': 'adam', 'graph_mode': 'cutoff', 'cutoff': 0.4552979533372606, 'grm_norm': 'gcn', 'self_loops': False, 'use_snp_selection': False}. Best is trial 31 with value: 0.2830140239892268.
[I 2025-12-08 11:55:50,894] Trial 41 finished with value: 0.2788788437793006 and parameters: {'model_type': 'graphsage', 'hidden_dims': '[512, 256]', 'dropout': 0.3773588327739603, 'batch_norm': False, 'sage_aggr': 'max', 'sage_normalize': False, 'sage_project': False, 'lr': 1.4759907647910463e-05, 'weight_decay': 5.54546406682179e-07, 'epochs': 174, 'loss': 'mse', 'optimizer': 'adam', 'graph_mode': 'cutoff', 'cutoff': 0.5020750608696763, 'grm_norm': 'gcn', 'self_loops': False, 'use_snp_selection': True, 'num_snps': 52914}. Best is trial 31 with value: 0.2830140239892268.
[I 2025-12-08 11:58:45,018] Trial 42 finished with value: 0.27638454540470064 and parameters: {'model_type': 'graphsage', 'hidden_dims': '[512, 256]', 'dropout': 0.36553378260555636, 'batch_norm': False, 'sage_aggr': 'max', 'sage_normalize': False, 'sage_project': False, 'lr': 1.477634729800018e-05, 'weight_decay': 6.327781883234607e-07, 'epochs': 141, 'loss': 'mse', 'optimizer': 'adam', 'graph_mode': 'cutoff', 'cutoff': 0.39588605542673155, 'grm_norm': 'gcn', 'self_loops': False, 'use_snp_selection': True, 'num_snps': 53532}. Best is trial 31 with value: 0.2830140239892268.
[I 2025-12-08 12:02:13,396] Trial 43 finished with value: 0.2833418898716488 and parameters: {'model_type': 'graphsage', 'hidden_dims': '[512, 256]', 'dropout': 0.28564779482452035, 'batch_norm': False, 'sage_aggr': 'max', 'sage_normalize': False, 'sage_project': False, 'lr': 1.5975007975624378e-05, 'weight_decay': 3.191581593683152e-07, 'epochs': 165, 'loss': 'mse', 'optimizer': 'adam', 'graph_mode': 'cutoff', 'cutoff': 0.4624924868684459, 'grm_norm': 'none', 'self_loops': False, 'use_snp_selection': True, 'num_snps': 59809}. Best is trial 43 with value: 0.2833418898716488.
[I 2025-12-08 12:04:22,186] Trial 44 finished with value: 0.2732529457204061 and parameters: {'model_type': 'graphsage', 'hidden_dims': '[512, 256]', 'dropout': 0.28945781180916325, 'batch_norm': False, 'sage_aggr': 'mean', 'sage_normalize': False, 'sage_project': False, 'lr': 2.6549474098404008e-05, 'weight_decay': 1.2805491939368374e-06, 'epochs': 92, 'loss': 'mse', 'optimizer': 'adam', 'graph_mode': 'cutoff', 'cutoff': 0.44760531149586424, 'grm_norm': 'none', 'self_loops': False, 'use_snp_selection': True, 'num_snps': 58855}. Best is trial 43 with value: 0.2833418898716488.
[I 2025-12-08 12:09:11,174] Trial 45 finished with value: 0.25145433375277976 and parameters: {'model_type': 'graphsage', 'hidden_dims': '[128, 64]', 'dropout': 0.26506158995220536, 'batch_norm': False, 'sage_aggr': 'max', 'sage_normalize': True, 'sage_project': False, 'lr': 1.0265231233239593e-05, 'weight_decay': 3.102474910282054e-07, 'epochs': 337, 'loss': 'mse', 'optimizer': 'adam', 'graph_mode': 'cutoff', 'cutoff': 0.3713132429802304, 'grm_norm': 'none', 'self_loops': False, 'use_snp_selection': True, 'num_snps': 56719}. Best is trial 43 with value: 0.2833418898716488.
[I 2025-12-08 12:15:09,432] Trial 46 finished with value: 0.24778674636235282 and parameters: {'model_type': 'graphsage', 'hidden_dims': '[512, 256]', 'dropout': 0.31604785017989023, 'batch_norm': False, 'sage_aggr': 'max', 'sage_normalize': False, 'sage_project': False, 'lr': 1.8587956750110022e-05, 'weight_decay': 1.4484728753110256e-07, 'epochs': 165, 'loss': 'mse', 'optimizer': 'adam', 'graph_mode': 'knn', 'knn_k': 10, 'weighted_edges': True, 'symmetrize_mode': 'union', 'self_loops': False, 'use_snp_selection': True, 'num_snps': 50475}. Best is trial 43 with value: 0.2833418898716488.
[I 2025-12-08 12:17:49,642] Trial 47 finished with value: 0.2472544711626418 and parameters: {'model_type': 'graphsage', 'hidden_dims': '[256, 128, 64]', 'dropout': 0.20603566904820605, 'batch_norm': False, 'sage_aggr': 'max', 'sage_normalize': False, 'sage_project': False, 'lr': 2.7496154980832942e-05, 'weight_decay': 1.0494425031684845e-07, 'epochs': 312, 'loss': 'mse', 'optimizer': 'adam', 'graph_mode': 'cutoff', 'cutoff': 0.5835952158946708, 'grm_norm': 'none', 'self_loops': False, 'use_snp_selection': True, 'num_snps': 56915}. Best is trial 43 with value: 0.2833418898716488.
[I 2025-12-08 12:22:10,343] Trial 48 finished with value: 0.2447221798580114 and parameters: {'model_type': 'graphsage', 'hidden_dims': '[256, 128]', 'dropout': 0.2478030753195391, 'batch_norm': True, 'sage_aggr': 'max', 'sage_normalize': False, 'sage_project': False, 'lr': 1.313612326202681e-05, 'weight_decay': 3.09515355437148e-07, 'epochs': 183, 'loss': 'mse', 'optimizer': 'adam', 'graph_mode': 'cutoff', 'cutoff': 0.27214491899971505, 'grm_norm': 'none', 'self_loops': False, 'use_snp_selection': True, 'num_snps': 49126}. Best is trial 43 with value: 0.2833418898716488.
[I 2025-12-08 12:24:23,979] Trial 49 finished with value: 0.24959526808703827 and parameters: {'model_type': 'graphsage', 'hidden_dims': '[512, 256]', 'dropout': 0.22831702191039804, 'batch_norm': False, 'sage_aggr': 'mean', 'sage_normalize': True, 'sage_project': False, 'lr': 4.566247307847914e-05, 'weight_decay': 4.057229763640145e-06, 'epochs': 110, 'loss': 'mse', 'optimizer': 'adam', 'graph_mode': 'cutoff', 'cutoff': 0.47929702772098143, 'grm_norm': 'cosine_then_gcn', 'self_loops': False, 'use_snp_selection': True, 'num_snps': 56200}. Best is trial 43 with value: 0.2833418898716488.
[I 2025-12-08 12:33:05,640] Trial 50 finished with value: 0.0 and parameters: {'model_type': 'graphsage', 'hidden_dims': '[512, 64]', 'dropout': 0.3255395088305583, 'batch_norm': False, 'sage_aggr': 'max', 'sage_normalize': False, 'sage_project': False, 'lr': 0.002510125745181469, 'weight_decay': 1.3241104997234136e-06, 'epochs': 350, 'loss': 'mae', 'optimizer': 'adam', 'graph_mode': 'knn', 'knn_k': 7, 'weighted_edges': True, 'symmetrize_mode': 'union', 'self_loops': True, 'use_snp_selection': True, 'num_snps': 45388}. Best is trial 43 with value: 0.2833418898716488.
[I 2025-12-08 12:35:56,391] Trial 51 finished with value: 0.2852076841066237 and parameters: {'model_type': 'graphsage', 'hidden_dims': '[512, 256]', 'dropout': 0.3516648157173378, 'batch_norm': False, 'sage_aggr': 'max', 'sage_normalize': False, 'sage_project': False, 'lr': 1.6107062257903528e-05, 'weight_decay': 5.833063182629598e-07, 'epochs': 174, 'loss': 'mse', 'optimizer': 'adam', 'graph_mode': 'cutoff', 'cutoff': 0.4989207151261251, 'grm_norm': 'none', 'self_loops': False, 'use_snp_selection': True, 'num_snps': 51834}. Best is trial 51 with value: 0.2852076841066237.
[I 2025-12-08 12:37:56,244] Trial 52 finished with value: 0.2754358118588136 and parameters: {'model_type': 'graphsage', 'hidden_dims': '[512, 256]', 'dropout': 0.28839958577063385, 'batch_norm': False, 'sage_aggr': 'max', 'sage_normalize': False, 'sage_project': False, 'lr': 1.8502862983766316e-05, 'weight_decay': 6.998511481754191e-07, 'epochs': 138, 'loss': 'mse', 'optimizer': 'adam', 'graph_mode': 'cutoff', 'cutoff': 0.5434731105263764, 'grm_norm': 'none', 'self_loops': False, 'use_snp_selection': True, 'num_snps': 51202}. Best is trial 51 with value: 0.2852076841066237.
[I 2025-12-08 12:41:47,625] Trial 53 finished with value: 0.28242828717069657 and parameters: {'model_type': 'graphsage', 'hidden_dims': '[512, 256]', 'dropout': 0.350414089764968, 'batch_norm': False, 'sage_aggr': 'max', 'sage_normalize': False, 'sage_project': False, 'lr': 1.1852673558121048e-05, 'weight_decay': 1.9613100343863494e-07, 'epochs': 189, 'loss': 'mse', 'optimizer': 'adam', 'graph_mode': 'cutoff', 'cutoff': 0.44701112869011567, 'grm_norm': 'none', 'self_loops': False, 'use_snp_selection': True, 'num_snps': 59680}. Best is trial 51 with value: 0.2852076841066237.
[I 2025-12-08 12:45:26,068] Trial 54 finished with value: 0.2700431196612668 and parameters: {'model_type': 'graphsage', 'hidden_dims': '[512, 256]', 'dropout': 0.4064721157238559, 'batch_norm': False, 'sage_aggr': 'max', 'sage_normalize': False, 'sage_project': False, 'lr': 3.5939699307899175e-05, 'weight_decay': 1.8059691864291509e-07, 'epochs': 206, 'loss': 'mse', 'optimizer': 'adam', 'graph_mode': 'cutoff', 'cutoff': 0.5082942846164773, 'grm_norm': 'none', 'self_loops': False, 'use_snp_selection': True, 'num_snps': 59852}. Best is trial 51 with value: 0.2852076841066237.
[I 2025-12-08 12:45:53,761] Trial 55 finished with value: 0.271701110992924 and parameters: {'model_type': 'graphsage', 'hidden_dims': '[512, 256]', 'dropout': 0.35460295723428353, 'batch_norm': False, 'sage_aggr': 'max', 'sage_normalize': False, 'sage_project': False, 'lr': 2.2427402986333072e-05, 'weight_decay': 2.822069957359548e-07, 'epochs': 155, 'loss': 'mse', 'optimizer': 'adam', 'graph_mode': 'cutoff', 'cutoff': 0.43921061928944255, 'grm_norm': 'none', 'self_loops': False, 'use_snp_selection': True, 'num_snps': 2923}. Best is trial 51 with value: 0.2852076841066237.
[I 2025-12-08 12:47:46,323] Trial 56 finished with value: 0.2744434393127304 and parameters: {'model_type': 'graphsage', 'hidden_dims': '[512, 256]', 'dropout': 0.39108122642285376, 'batch_norm': False, 'sage_aggr': 'max', 'sage_normalize': False, 'sage_project': False, 'lr': 1.6697675588645848e-05, 'weight_decay': 4.125088294860742e-07, 'epochs': 188, 'loss': 'mse', 'optimizer': 'adam', 'graph_mode': 'cutoff', 'cutoff': 0.628363031265103, 'grm_norm': 'none', 'self_loops': False, 'use_snp_selection': True, 'num_snps': 41649}. Best is trial 51 with value: 0.2852076841066237.
[I 2025-12-08 12:51:38,791] Trial 57 finished with value: 0.015095690550802173 and parameters: {'model_type': 'graphsage', 'hidden_dims': '[512, 256]', 'dropout': 0.42975521457406823, 'batch_norm': False, 'sage_aggr': 'max', 'sage_normalize': False, 'sage_project': False, 'lr': 0.0005795213526758569, 'weight_decay': 1.8425217553090535e-06, 'epochs': 239, 'loss': 'mse', 'optimizer': 'adam', 'graph_mode': 'knn', 'knn_k': 5, 'weighted_edges': True, 'symmetrize_mode': 'union', 'self_loops': True, 'use_snp_selection': False}. Best is trial 51 with value: 0.2852076841066237.
[I 2025-12-08 12:54:54,232] Trial 58 finished with value: 0.2608490007292684 and parameters: {'model_type': 'graphsage', 'hidden_dims': '[512, 256]', 'dropout': 0.33563481206953194, 'batch_norm': False, 'sage_aggr': 'max', 'sage_normalize': False, 'sage_project': False, 'lr': 1.3700454833647189e-05, 'weight_decay': 8.161953861969425e-07, 'epochs': 167, 'loss': 'mae', 'optimizer': 'adam', 'graph_mode': 'cutoff', 'cutoff': 0.4875033825339052, 'grm_norm': 'none', 'self_loops': False, 'use_snp_selection': True, 'num_snps': 57620}. Best is trial 51 with value: 0.2852076841066237.
[I 2025-12-08 12:56:32,830] Trial 59 finished with value: 0.27601968782478503 and parameters: {'model_type': 'graphsage', 'hidden_dims': '[512, 256]', 'dropout': 0.1833845602153985, 'batch_norm': False, 'sage_aggr': 'mean', 'sage_normalize': False, 'sage_project': False, 'lr': 2.8326397584572662e-05, 'weight_decay': 1.1142684328675827e-06, 'epochs': 121, 'loss': 'mse', 'optimizer': 'adam', 'graph_mode': 'cutoff', 'cutoff': 0.5497567907297126, 'grm_norm': 'cosine', 'self_loops': False, 'use_snp_selection': True, 'num_snps': 48390}. Best is trial 51 with value: 0.2852076841066237.
[I 2025-12-08 13:01:26,596] Trial 60 finished with value: 0.2760361417680067 and parameters: {'model_type': 'graphsage', 'hidden_dims': '[512, 128]', 'dropout': 0.14273621226961508, 'batch_norm': False, 'sage_aggr': 'max', 'sage_normalize': False, 'sage_project': False, 'lr': 7.328451380812796e-05, 'weight_decay': 5.079829788045738e-07, 'epochs': 279, 'loss': 'mse', 'optimizer': 'adam', 'graph_mode': 'cutoff', 'cutoff': 0.38868719398116636, 'grm_norm': 'none', 'self_loops': False, 'use_snp_selection': True, 'num_snps': 51448}. Best is trial 51 with value: 0.2852076841066237.
[I 2025-12-08 13:04:57,238] Trial 61 finished with value: 0.28509838246695085 and parameters: {'model_type': 'graphsage', 'hidden_dims': '[512, 256]', 'dropout': 0.3050182083607853, 'batch_norm': False, 'sage_aggr': 'max', 'sage_normalize': False, 'sage_project': False, 'lr': 1.1264176733033331e-05, 'weight_decay': 1.269847262307413e-07, 'epochs': 185, 'loss': 'mse', 'optimizer': 'adam', 'graph_mode': 'cutoff', 'cutoff': 0.44010690983341433, 'grm_norm': 'none', 'self_loops': False, 'use_snp_selection': True, 'num_snps': 54991}. Best is trial 51 with value: 0.2852076841066237.
[I 2025-12-08 13:08:53,364] Trial 62 finished with value: 0.28435995862891145 and parameters: {'model_type': 'graphsage', 'hidden_dims': '[512, 256]', 'dropout': 0.2733827417768907, 'batch_norm': False, 'sage_aggr': 'max', 'sage_normalize': False, 'sage_project': False, 'lr': 1.3394150835928665e-05, 'weight_decay': 1.6705769349305956e-07, 'epochs': 189, 'loss': 'mse', 'optimizer': 'adam', 'graph_mode': 'cutoff', 'cutoff': 0.4469566958259877, 'grm_norm': 'none', 'self_loops': False, 'use_snp_selection': True, 'num_snps': 59912}. Best is trial 51 with value: 0.2852076841066237.
[I 2025-12-08 13:13:34,778] Trial 63 finished with value: 0.2802354511961017 and parameters: {'model_type': 'graphsage', 'hidden_dims': '[512, 256]', 'dropout': 0.27157848824476905, 'batch_norm': False, 'sage_aggr': 'max', 'sage_normalize': False, 'sage_project': False, 'lr': 1.171135598904294e-05, 'weight_decay': 1.5521512175217923e-07, 'epochs': 190, 'loss': 'mse', 'optimizer': 'adam', 'graph_mode': 'cutoff', 'cutoff': 0.3335233135984598, 'grm_norm': 'none', 'self_loops': False, 'use_snp_selection': True, 'num_snps': 59343}. Best is trial 51 with value: 0.2852076841066237.
[I 2025-12-08 13:17:35,430] Trial 64 finished with value: 0.2869477674964106 and parameters: {'model_type': 'graphsage', 'hidden_dims': '[512, 256]', 'dropout': 0.24742182300976276, 'batch_norm': False, 'sage_aggr': 'max', 'sage_normalize': False, 'sage_project': False, 'lr': 1.2751933696570142e-05, 'weight_decay': 2.6696964622155216e-07, 'epochs': 205, 'loss': 'mse', 'optimizer': 'adam', 'graph_mode': 'cutoff', 'cutoff': 0.4261184270952919, 'grm_norm': 'none', 'self_loops': False, 'use_snp_selection': True, 'num_snps': 56141}. Best is trial 64 with value: 0.2869477674964106.
[I 2025-12-08 13:21:36,044] Trial 65 finished with value: 0.2869086483479154 and parameters: {'model_type': 'graphsage', 'hidden_dims': '[512, 256]', 'dropout': 0.23992061555717945, 'batch_norm': False, 'sage_aggr': 'max', 'sage_normalize': False, 'sage_project': False, 'lr': 1.6938461446383077e-05, 'weight_decay': 2.4834578463586735e-07, 'epochs': 206, 'loss': 'mse', 'optimizer': 'adam', 'graph_mode': 'cutoff', 'cutoff': 0.42843075845407264, 'grm_norm': 'none', 'self_loops': False, 'use_snp_selection': True, 'num_snps': 56175}. Best is trial 64 with value: 0.2869477674964106.
[I 2025-12-08 13:25:43,160] Trial 66 finished with value: 0.2787408159256269 and parameters: {'model_type': 'graphsage', 'hidden_dims': '[512, 256]', 'dropout': 0.2503783722842959, 'batch_norm': False, 'sage_aggr': 'max', 'sage_normalize': False, 'sage_project': False, 'lr': 1.781091264891882e-05, 'weight_decay': 2.6004676955587716e-07, 'epochs': 217, 'loss': 'mse', 'optimizer': 'adam', 'graph_mode': 'cutoff', 'cutoff': 0.42198740629582043, 'grm_norm': 'none', 'self_loops': True, 'use_snp_selection': True, 'num_snps': 55503}. Best is trial 64 with value: 0.2869477674964106.
[I 2025-12-08 13:28:44,528] Trial 67 finished with value: 0.2380919347421307 and parameters: {'model_type': 'graphsage', 'hidden_dims': '[256, 128]', 'dropout': 0.22949657780154897, 'batch_norm': False, 'sage_aggr': 'max', 'sage_normalize': True, 'sage_project': False, 'lr': 1.4899382448654317e-05, 'weight_decay': 3.540912821909743e-07, 'epochs': 230, 'loss': 'mae', 'optimizer': 'adam', 'graph_mode': 'cutoff', 'cutoff': 0.5040537651607201, 'grm_norm': 'none', 'self_loops': False, 'use_snp_selection': True, 'num_snps': 57147}. Best is trial 64 with value: 0.2869477674964106.
[I 2025-12-08 13:32:40,902] Trial 68 finished with value: 0.23153670883701283 and parameters: {'model_type': 'graphsage', 'hidden_dims': '[512, 256]', 'dropout': 0.28360207041186786, 'batch_norm': True, 'sage_aggr': 'max', 'sage_normalize': False, 'sage_project': False, 'lr': 3.152582183260889e-05, 'weight_decay': 1.2648013073298348e-07, 'epochs': 202, 'loss': 'mse', 'optimizer': 'adam', 'graph_mode': 'knn', 'knn_k': 8, 'weighted_edges': True, 'symmetrize_mode': 'union', 'self_loops': False, 'use_snp_selection': False}. Best is trial 64 with value: 0.2869477674964106.
[I 2025-12-08 13:35:12,033] Trial 69 finished with value: 0.2738729971777813 and parameters: {'model_type': 'graphsage', 'hidden_dims': '[512, 256]', 'dropout': 0.30057004905668866, 'batch_norm': False, 'sage_aggr': 'max', 'sage_normalize': False, 'sage_project': False, 'lr': 1.3403542252356968e-05, 'weight_decay': 2.435956383205759e-07, 'epochs': 210, 'loss': 'mse', 'optimizer': 'adam', 'graph_mode': 'cutoff', 'cutoff': 0.8982154358987493, 'grm_norm': 'none', 'self_loops': False, 'use_snp_selection': True, 'num_snps': 54810}. Best is trial 64 with value: 0.2869477674964106.
[I 2025-12-08 13:39:19,352] Trial 70 finished with value: -0.008432481947745669 and parameters: {'model_type': 'graphsage', 'hidden_dims': '[512, 64]', 'dropout': 0.23512321941342573, 'batch_norm': False, 'sage_aggr': 'max', 'sage_normalize': False, 'sage_project': False, 'lr': 0.009234859483799545, 'weight_decay': 1.6837365196423393e-07, 'epochs': 256, 'loss': 'mse', 'optimizer': 'adam', 'graph_mode': 'cutoff', 'cutoff': 0.47881738561207504, 'grm_norm': 'none', 'self_loops': False, 'use_snp_selection': True, 'num_snps': 51756}. Best is trial 64 with value: 0.2869477674964106.
[I 2025-12-08 13:43:11,236] Trial 71 finished with value: 0.2863957111064504 and parameters: {'model_type': 'graphsage', 'hidden_dims': '[512, 256]', 'dropout': 0.2626042230285079, 'batch_norm': False, 'sage_aggr': 'max', 'sage_normalize': False, 'sage_project': False, 'lr': 1.2215199992635856e-05, 'weight_decay': 1.7869089699956165e-07, 'epochs': 190, 'loss': 'mse', 'optimizer': 'adam', 'graph_mode': 'cutoff', 'cutoff': 0.4360576878717669, 'grm_norm': 'none', 'self_loops': False, 'use_snp_selection': True, 'num_snps': 58196}. Best is trial 64 with value: 0.2869477674964106.
[I 2025-12-08 13:46:48,579] Trial 72 finished with value: 0.2833371280430975 and parameters: {'model_type': 'graphsage', 'hidden_dims': '[512, 256]', 'dropout': 0.2587854506571931, 'batch_norm': False, 'sage_aggr': 'max', 'sage_normalize': False, 'sage_project': False, 'lr': 1.0010302366757795e-05, 'weight_decay': 1.006805355274195e-07, 'epochs': 175, 'loss': 'mse', 'optimizer': 'adam', 'graph_mode': 'cutoff', 'cutoff': 0.42863855076476487, 'grm_norm': 'none', 'self_loops': False, 'use_snp_selection': True, 'num_snps': 57999}. Best is trial 64 with value: 0.2869477674964106.
[I 2025-12-08 13:50:19,864] Trial 73 finished with value: 0.2759523357514617 and parameters: {'model_type': 'graphsage', 'hidden_dims': '[512, 256]', 'dropout': 0.2564794959703387, 'batch_norm': False, 'sage_aggr': 'max', 'sage_normalize': False, 'sage_project': False, 'lr': 2.055752526551024e-05, 'weight_decay': 1.0214083758114477e-07, 'epochs': 157, 'loss': 'mse', 'optimizer': 'adam', 'graph_mode': 'cutoff', 'cutoff': 0.3829010249463296, 'grm_norm': 'none', 'self_loops': False, 'use_snp_selection': True, 'num_snps': 58038}. Best is trial 64 with value: 0.2869477674964106.
