[I 2025-12-09 23:09:24,828] Trial 31 finished with value: 0.29245109592317 and parameters: {'model_type': 'graphsage', 'hidden_dims': '[128, 64]', 'dropout': 0.4777762713461754, 'batch_norm': False, 'sage_aggr': 'mean', 'sage_normalize': False, 'sage_project': False, 'lr': 2.3819309317698703e-05, 'weight_decay': 0.0006197743898548057, 'epochs': 130, 'loss': 'mse', 'optimizer': 'adam', 'graph_mode': 'cutoff', 'cutoff': 0.8061712915692537, 'grm_norm': 'cosine', 'self_loops': False, 'use_snp_selection': False}. Best is trial 25 with value: 0.29618261474472857.
[I 2025-12-09 23:09:52,355] Trial 32 finished with value: 0.2926405271898231 and parameters: {'model_type': 'graphsage', 'hidden_dims': '[128, 64]', 'dropout': 0.4996517626122244, 'batch_norm': False, 'sage_aggr': 'mean', 'sage_normalize': False, 'sage_project': False, 'lr': 1.0034419317159471e-05, 'weight_decay': 0.0009221442069182682, 'epochs': 126, 'loss': 'mse', 'optimizer': 'adam', 'graph_mode': 'cutoff', 'cutoff': 0.7646174353325428, 'grm_norm': 'cosine', 'self_loops': False, 'use_snp_selection': False}. Best is trial 25 with value: 0.29618261474472857.
[I 2025-12-09 23:10:15,907] Trial 33 finished with value: 0.2765094332871478 and parameters: {'model_type': 'graphsage', 'hidden_dims': '[128, 64]', 'dropout': 0.5187512621880488, 'batch_norm': False, 'sage_aggr': 'mean', 'sage_normalize': False, 'sage_project': False, 'lr': 1.1530736742886048e-05, 'weight_decay': 0.0002346712640188127, 'epochs': 105, 'loss': 'mse', 'optimizer': 'adam', 'graph_mode': 'cutoff', 'cutoff': 0.7264209677356241, 'grm_norm': 'cosine', 'self_loops': False, 'use_snp_selection': False}. Best is trial 25 with value: 0.29618261474472857.
[I 2025-12-09 23:10:36,155] Trial 34 finished with value: 0.28909114936885827 and parameters: {'model_type': 'graphsage', 'hidden_dims': '[128, 64]', 'dropout': 0.4243158141640183, 'batch_norm': False, 'sage_aggr': 'mean', 'sage_normalize': False, 'sage_project': False, 'lr': 1.0223739366902973e-05, 'weight_decay': 0.0009308622194266408, 'epochs': 87, 'loss': 'mse', 'optimizer': 'adam', 'graph_mode': 'cutoff', 'cutoff': 0.8125353274544044, 'grm_norm': 'cosine', 'self_loops': False, 'use_snp_selection': False}. Best is trial 25 with value: 0.29618261474472857.
[I 2025-12-09 23:11:05,055] Trial 35 finished with value: 0.2919849706728912 and parameters: {'model_type': 'graphsage', 'hidden_dims': '[128, 64]', 'dropout': 0.5607018217054658, 'batch_norm': False, 'sage_aggr': 'mean', 'sage_normalize': False, 'sage_project': False, 'lr': 1.6130430188310274e-05, 'weight_decay': 0.00026951899536131567, 'epochs': 134, 'loss': 'mse', 'optimizer': 'adam', 'graph_mode': 'cutoff', 'cutoff': 0.7026240824387023, 'grm_norm': 'cosine', 'self_loops': False, 'use_snp_selection': False}. Best is trial 25 with value: 0.29618261474472857.
[I 2025-12-09 23:11:40,476] Trial 36 finished with value: 0.25699432343652384 and parameters: {'model_type': 'graphsage', 'hidden_dims': '[128, 64]', 'dropout': 0.37008097467793244, 'batch_norm': True, 'sage_aggr': 'mean', 'sage_normalize': False, 'sage_project': False, 'lr': 2.7521297954461528e-05, 'weight_decay': 0.0006176253385773167, 'epochs': 166, 'loss': 'mse', 'optimizer': 'adam', 'graph_mode': 'cutoff', 'cutoff': 0.8364762808942657, 'grm_norm': 'cosine', 'self_loops': False, 'use_snp_selection': False}. Best is trial 25 with value: 0.29618261474472857.
[I 2025-12-09 23:12:20,401] Trial 37 finished with value: 0.2955492776817918 and parameters: {'model_type': 'graphsage', 'hidden_dims': '[128, 64]', 'dropout': 0.49507496735451717, 'batch_norm': False, 'sage_aggr': 'mean', 'sage_normalize': False, 'sage_project': False, 'lr': 1.4660524411286982e-05, 'weight_decay': 0.00021437043728425681, 'epochs': 193, 'loss': 'mse', 'optimizer': 'adam', 'graph_mode': 'cutoff', 'cutoff': 0.767080213264413, 'grm_norm': 'cosine', 'self_loops': False, 'use_snp_selection': False}. Best is trial 25 with value: 0.29618261474472857.
[I 2025-12-09 23:13:25,019] Trial 38 finished with value: 0.2873608370536683 and parameters: {'model_type': 'graphsage', 'hidden_dims': '[256, 128, 64]', 'dropout': 0.5486889295924648, 'batch_norm': True, 'sage_aggr': 'mean', 'sage_normalize': True, 'sage_project': False, 'lr': 1.549822317514835e-05, 'weight_decay': 1.264400578950234e-07, 'epochs': 192, 'loss': 'mse', 'optimizer': 'adam', 'graph_mode': 'cutoff', 'cutoff': 0.8976331452362369, 'grm_norm': 'cosine_then_gcn', 'self_loops': False, 'use_snp_selection': False}. Best is trial 25 with value: 0.29618261474472857.
[I 2025-12-09 23:14:00,263] Trial 39 finished with value: 0.2715833584544557 and parameters: {'model_type': 'graphsage', 'hidden_dims': '[128, 64]', 'dropout': 0.4371585313151751, 'batch_norm': False, 'sage_aggr': 'mean', 'sage_normalize': False, 'sage_project': False, 'lr': 6.318608088500387e-05, 'weight_decay': 0.0001876502938558429, 'epochs': 169, 'loss': 'mse', 'optimizer': 'adam', 'graph_mode': 'cutoff', 'cutoff': 0.7126572195919867, 'grm_norm': 'none', 'self_loops': False, 'use_snp_selection': False}. Best is trial 25 with value: 0.29618261474472857.
[I 2025-12-09 23:14:31,325] Trial 40 finished with value: 0.2680589247092749 and parameters: {'model_type': 'graphsage', 'hidden_dims': '[128, 64]', 'dropout': 0.595104023724764, 'batch_norm': True, 'sage_aggr': 'mean', 'sage_normalize': False, 'sage_project': False, 'lr': 3.390190098570948e-05, 'weight_decay': 5.581629873017114e-05, 'epochs': 143, 'loss': 'mse', 'optimizer': 'adam', 'graph_mode': 'cutoff', 'cutoff': 0.7982065088971197, 'grm_norm': 'cosine', 'self_loops': False, 'use_snp_selection': False}. Best is trial 25 with value: 0.29618261474472857.
[I 2025-12-09 23:15:10,578] Trial 41 finished with value: 0.2925280032236897 and parameters: {'model_type': 'graphsage', 'hidden_dims': '[128, 64]', 'dropout': 0.4924833837180567, 'batch_norm': False, 'sage_aggr': 'mean', 'sage_normalize': False, 'sage_project': False, 'lr': 1.505327430471515e-05, 'weight_decay': 0.0003193180291977571, 'epochs': 190, 'loss': 'mse', 'optimizer': 'adam', 'graph_mode': 'cutoff', 'cutoff': 0.7609065223807631, 'grm_norm': 'cosine', 'self_loops': False, 'use_snp_selection': False}. Best is trial 25 with value: 0.29618261474472857.
[I 2025-12-09 23:15:44,312] Trial 42 finished with value: 0.2927428351099698 and parameters: {'model_type': 'graphsage', 'hidden_dims': '[128, 64]', 'dropout': 0.5000474427928522, 'batch_norm': False, 'sage_aggr': 'mean', 'sage_normalize': False, 'sage_project': False, 'lr': 1.3538628957657379e-05, 'weight_decay': 4.5616743067161246e-07, 'epochs': 160, 'loss': 'mse', 'optimizer': 'adam', 'graph_mode': 'cutoff', 'cutoff': 0.7412685154544724, 'grm_norm': 'cosine', 'self_loops': False, 'use_snp_selection': False}. Best is trial 25 with value: 0.29618261474472857.
[I 2025-12-09 23:16:18,512] Trial 43 finished with value: 0.29368635276135363 and parameters: {'model_type': 'graphsage', 'hidden_dims': '[128, 64]', 'dropout': 0.5301709183509248, 'batch_norm': False, 'sage_aggr': 'mean', 'sage_normalize': False, 'sage_project': False, 'lr': 2.036597586854907e-05, 'weight_decay': 2.6281299327679963e-07, 'epochs': 158, 'loss': 'mse', 'optimizer': 'adam', 'graph_mode': 'cutoff', 'cutoff': 0.5879064779429741, 'grm_norm': 'cosine', 'self_loops': False, 'use_snp_selection': False}. Best is trial 25 with value: 0.29618261474472857.
[I 2025-12-09 23:17:02,776] Trial 44 finished with value: 0.2987332707245484 and parameters: {'model_type': 'graphsage', 'hidden_dims': '[128, 64]', 'dropout': 0.5283425498103935, 'batch_norm': False, 'sage_aggr': 'mean', 'sage_normalize': False, 'sage_project': False, 'lr': 2.401331802944618e-05, 'weight_decay': 2.371467907519207e-07, 'epochs': 213, 'loss': 'mse', 'optimizer': 'adam', 'graph_mode': 'cutoff', 'cutoff': 0.6028361694452727, 'grm_norm': 'cosine', 'self_loops': False, 'use_snp_selection': False}. Best is trial 44 with value: 0.2987332707245484.
[I 2025-12-09 23:18:17,846] Trial 45 finished with value: 0.2374338814400648 and parameters: {'model_type': 'graphsage', 'hidden_dims': '[256, 128, 64]', 'dropout': 0.5330533230329191, 'batch_norm': False, 'sage_aggr': 'mean', 'sage_normalize': True, 'sage_project': False, 'lr': 1.773092055446542e-05, 'weight_decay': 2.932313008354442e-07, 'epochs': 211, 'loss': 'mse', 'optimizer': 'adam', 'graph_mode': 'cutoff', 'cutoff': 0.5615993454662886, 'grm_norm': 'none', 'self_loops': False, 'use_snp_selection': False}. Best is trial 44 with value: 0.2987332707245484.
[I 2025-12-09 23:19:43,179] Trial 46 finished with value: 0.2856515996682278 and parameters: {'model_type': 'graphsage', 'hidden_dims': '[256, 128]', 'dropout': 0.5830157257259605, 'batch_norm': False, 'sage_aggr': 'mean', 'sage_normalize': False, 'sage_project': False, 'lr': 3.40832439324676e-05, 'weight_decay': 1.1882455793034792e-06, 'epochs': 265, 'loss': 'mse', 'optimizer': 'adam', 'graph_mode': 'cutoff', 'cutoff': 0.6058414997974543, 'grm_norm': 'cosine', 'self_loops': False, 'use_snp_selection': False}. Best is trial 44 with value: 0.2987332707245484.
[I 2025-12-09 23:22:04,411] Trial 47 finished with value: 0.28267653914257196 and parameters: {'model_type': 'graphsage', 'hidden_dims': '[512, 64]', 'dropout': 0.5229851621710512, 'batch_norm': False, 'sage_aggr': 'mean', 'sage_normalize': False, 'sage_project': False, 'lr': 4.505727257846887e-05, 'weight_decay': 2.0337259136469523e-07, 'epochs': 240, 'loss': 'mse', 'optimizer': 'adam', 'graph_mode': 'cutoff', 'cutoff': 0.5723316842191037, 'grm_norm': 'cosine_then_gcn', 'self_loops': False, 'use_snp_selection': False}. Best is trial 44 with value: 0.2987332707245484.
[I 2025-12-09 23:22:49,797] Trial 48 finished with value: 0.28400280836028713 and parameters: {'model_type': 'graphsage', 'hidden_dims': '[128, 64]', 'dropout': 0.5660111563314991, 'batch_norm': True, 'sage_aggr': 'mean', 'sage_normalize': False, 'sage_project': False, 'lr': 0.0067888646214943225, 'weight_decay': 4.966045682109382e-06, 'epochs': 216, 'loss': 'mse', 'optimizer': 'adam', 'graph_mode': 'cutoff', 'cutoff': 0.6778531284495479, 'grm_norm': 'none', 'self_loops': False, 'use_snp_selection': False}. Best is trial 44 with value: 0.2987332707245484.
[I 2025-12-09 23:23:48,577] Trial 49 finished with value: 0.24373595824566427 and parameters: {'model_type': 'graphsage', 'hidden_dims': '[128, 64]', 'dropout': 0.34195833093753536, 'batch_norm': False, 'sage_aggr': 'mean', 'sage_normalize': True, 'sage_project': False, 'lr': 0.00024869998139245863, 'weight_decay': 8.035451137383833e-07, 'epochs': 189, 'loss': 'mse', 'optimizer': 'adam', 'graph_mode': 'cutoff', 'cutoff': 0.4743568643363257, 'grm_norm': 'cosine', 'self_loops': False, 'use_snp_selection': False}. Best is trial 44 with value: 0.2987332707245484.
[I 2025-12-09 23:27:02,548] Trial 50 finished with value: 0.2646056143577974 and parameters: {'model_type': 'graphsage', 'hidden_dims': '[128, 64]', 'dropout': 0.4688309749327908, 'batch_norm': False, 'sage_aggr': 'mean', 'sage_normalize': False, 'sage_project': False, 'lr': 2.054236032804946e-05, 'weight_decay': 4.749110385065784e-07, 'epochs': 226, 'loss': 'mae', 'optimizer': 'adam', 'graph_mode': 'knn', 'knn_k': 10, 'weighted_edges': True, 'symmetrize_mode': 'union', 'self_loops': True, 'use_snp_selection': False}. Best is trial 44 with value: 0.2987332707245484.
[I 2025-12-09 23:27:32,400] Trial 51 finished with value: 0.29348671538836424 and parameters: {'model_type': 'graphsage', 'hidden_dims': '[128, 64]', 'dropout': 0.4778353721625965, 'batch_norm': False, 'sage_aggr': 'mean', 'sage_normalize': False, 'sage_project': False, 'lr': 2.470368962635067e-05, 'weight_decay': 1.0371640573167359e-07, 'epochs': 139, 'loss': 'mse', 'optimizer': 'adam', 'graph_mode': 'cutoff', 'cutoff': 0.6455105738581348, 'grm_norm': 'cosine', 'self_loops': False, 'use_snp_selection': False}. Best is trial 44 with value: 0.2987332707245484.
[I 2025-12-09 23:28:02,853] Trial 52 finished with value: 0.27422531789527194 and parameters: {'model_type': 'graphsage', 'hidden_dims': '[128, 64]', 'dropout': 0.5382035258039732, 'batch_norm': False, 'sage_aggr': 'mean', 'sage_normalize': False, 'sage_project': False, 'lr': 6.882883199359798e-05, 'weight_decay': 1.5608794231496522e-07, 'epochs': 142, 'loss': 'mse', 'optimizer': 'adam', 'graph_mode': 'cutoff', 'cutoff': 0.624287315461226, 'grm_norm': 'cosine', 'self_loops': False, 'use_snp_selection': False}. Best is trial 44 with value: 0.2987332707245484.
[I 2025-12-09 23:28:38,447] Trial 53 finished with value: 0.2948436007570908 and parameters: {'model_type': 'graphsage', 'hidden_dims': '[128, 64]', 'dropout': 0.41856867614502097, 'batch_norm': False, 'sage_aggr': 'mean', 'sage_normalize': False, 'sage_project': False, 'lr': 1.3284986022374606e-05, 'weight_decay': 2.6046990811817686e-07, 'epochs': 169, 'loss': 'mse', 'optimizer': 'adam', 'graph_mode': 'cutoff', 'cutoff': 0.6575517013042195, 'grm_norm': 'cosine', 'self_loops': False, 'use_snp_selection': False}. Best is trial 44 with value: 0.2987332707245484.
[I 2025-12-09 23:29:35,783] Trial 54 finished with value: 0.29734302516695205 and parameters: {'model_type': 'graphsage', 'hidden_dims': '[256, 128]', 'dropout': 0.42686627435391716, 'batch_norm': False, 'sage_aggr': 'mean', 'sage_normalize': False, 'sage_project': False, 'lr': 1.3636260475313883e-05, 'weight_decay': 3.271279469690813e-07, 'epochs': 170, 'loss': 'mse', 'optimizer': 'adam', 'graph_mode': 'cutoff', 'cutoff': 0.5896434958176083, 'grm_norm': 'cosine', 'self_loops': False, 'use_snp_selection': False}. Best is trial 44 with value: 0.2987332707245484.
[I 2025-12-09 23:30:36,977] Trial 55 finished with value: 0.2951861425877217 and parameters: {'model_type': 'graphsage', 'hidden_dims': '[256, 128]', 'dropout': 0.41176833239369015, 'batch_norm': False, 'sage_aggr': 'mean', 'sage_normalize': False, 'sage_project': False, 'lr': 1.3048214638401871e-05, 'weight_decay': 1.5963180582088082e-06, 'epochs': 174, 'loss': 'mse', 'optimizer': 'adam', 'graph_mode': 'cutoff', 'cutoff': 0.5365837441111129, 'grm_norm': 'cosine', 'self_loops': False, 'use_snp_selection': False}. Best is trial 44 with value: 0.2987332707245484.
[I 2025-12-09 23:31:40,505] Trial 56 finished with value: 0.2949740485697525 and parameters: {'model_type': 'graphsage', 'hidden_dims': '[256, 128]', 'dropout': 0.4025723718279753, 'batch_norm': False, 'sage_aggr': 'mean', 'sage_normalize': False, 'sage_project': False, 'lr': 1.3550150363270611e-05, 'weight_decay': 2.1470798914024408e-06, 'epochs': 184, 'loss': 'mse', 'optimizer': 'adam', 'graph_mode': 'cutoff', 'cutoff': 0.5455751292160963, 'grm_norm': 'cosine', 'self_loops': False, 'use_snp_selection': False}. Best is trial 44 with value: 0.2987332707245484.
[I 2025-12-09 23:34:16,473] Trial 57 finished with value: 0.2878965504544818 and parameters: {'model_type': 'graphsage', 'hidden_dims': '[256, 128]', 'dropout': 0.36596546107648054, 'batch_norm': False, 'sage_aggr': 'mean', 'sage_normalize': False, 'sage_project': False, 'lr': 2.9413298399697917e-05, 'weight_decay': 1.8055316814939476e-05, 'epochs': 201, 'loss': 'mse', 'optimizer': 'adam', 'graph_mode': 'knn', 'knn_k': 7, 'weighted_edges': True, 'symmetrize_mode': 'union', 'self_loops': True, 'use_snp_selection': False}. Best is trial 44 with value: 0.2987332707245484.
[I 2025-12-09 23:35:50,558] Trial 58 finished with value: 0.054628487026656625 and parameters: {'model_type': 'graphsage', 'hidden_dims': '[256, 128]', 'dropout': 0.4521337605292126, 'batch_norm': False, 'sage_aggr': 'mean', 'sage_normalize': False, 'sage_project': False, 'lr': 0.002898262676882834, 'weight_decay': 7.4642626776629116e-06, 'epochs': 214, 'loss': 'mae', 'optimizer': 'adam', 'graph_mode': 'cutoff', 'cutoff': 0.44047092247110337, 'grm_norm': 'gcn', 'self_loops': False, 'use_snp_selection': False}. Best is trial 44 with value: 0.2987332707245484.
[I 2025-12-09 23:37:01,050] Trial 59 finished with value: 0.2773446522147045 and parameters: {'model_type': 'graphsage', 'hidden_dims': '[256, 128]', 'dropout': 0.4363962656194022, 'batch_norm': False, 'sage_aggr': 'mean', 'sage_normalize': False, 'sage_project': False, 'lr': 1.7316646761902394e-05, 'weight_decay': 1.3340426584925198e-06, 'epochs': 199, 'loss': 'mse', 'optimizer': 'adam', 'graph_mode': 'cutoff', 'cutoff': 0.5232633881990286, 'grm_norm': 'cosine_then_gcn', 'self_loops': False, 'use_snp_selection': False}. Best is trial 44 with value: 0.2987332707245484.
[I 2025-12-09 23:38:33,272] Trial 60 finished with value: 0.27805802749223824 and parameters: {'model_type': 'graphsage', 'hidden_dims': '[256, 128]', 'dropout': 0.3214699757100795, 'batch_norm': False, 'sage_aggr': 'max', 'sage_normalize': False, 'sage_project': False, 'lr': 8.90572969309748e-05, 'weight_decay': 3.79522732129249e-07, 'epochs': 236, 'loss': 'mse', 'optimizer': 'adam', 'graph_mode': 'cutoff', 'cutoff': 0.5178163373626753, 'grm_norm': 'gcn', 'self_loops': False, 'use_snp_selection': False}. Best is trial 44 with value: 0.2987332707245484.
[I 2025-12-09 23:39:37,131] Trial 61 finished with value: 0.29013311119449997 and parameters: {'model_type': 'graphsage', 'hidden_dims': '[256, 128]', 'dropout': 0.4107277228028644, 'batch_norm': False, 'sage_aggr': 'mean', 'sage_normalize': False, 'sage_project': False, 'lr': 1.2249872767675702e-05, 'weight_decay': 2.754840553296434e-06, 'epochs': 183, 'loss': 'mse', 'optimizer': 'adam', 'graph_mode': 'cutoff', 'cutoff': 0.5381152661664822, 'grm_norm': 'cosine', 'self_loops': False, 'use_snp_selection': False}. Best is trial 44 with value: 0.2987332707245484.
[I 2025-12-09 23:40:36,641] Trial 62 finished with value: 0.29474546951764646 and parameters: {'model_type': 'graphsage', 'hidden_dims': '[256, 128]', 'dropout': 0.39317271415656824, 'batch_norm': False, 'sage_aggr': 'mean', 'sage_normalize': False, 'sage_project': False, 'lr': 1.3258843085329769e-05, 'weight_decay': 7.505523276582628e-07, 'epochs': 179, 'loss': 'mse', 'optimizer': 'adam', 'graph_mode': 'cutoff', 'cutoff': 0.6005925537746768, 'grm_norm': 'cosine', 'self_loops': False, 'use_snp_selection': False}. Best is trial 44 with value: 0.2987332707245484.
[I 2025-12-09 23:41:35,104] Trial 63 finished with value: 0.28958058800336445 and parameters: {'model_type': 'graphsage', 'hidden_dims': '[256, 128]', 'dropout': 0.3828238609458156, 'batch_norm': False, 'sage_aggr': 'mean', 'sage_normalize': False, 'sage_project': False, 'lr': 1.6854657688227397e-05, 'weight_decay': 1.7244636631363437e-06, 'epochs': 170, 'loss': 'mse', 'optimizer': 'adam', 'graph_mode': 'cutoff', 'cutoff': 0.5549301053480078, 'grm_norm': 'cosine', 'self_loops': False, 'use_snp_selection': False}. Best is trial 44 with value: 0.2987332707245484.
[I 2025-12-09 23:42:10,760] Trial 64 finished with value: 0.24175183585889587 and parameters: {'model_type': 'graphsage', 'hidden_dims': '[256, 128]', 'dropout': 0.4057932884698072, 'batch_norm': False, 'sage_aggr': 'mean', 'sage_normalize': False, 'sage_project': False, 'lr': 0.0004991134658146168, 'weight_decay': 4.068946214905764e-06, 'epochs': 255, 'loss': 'mse', 'optimizer': 'adam', 'graph_mode': 'cutoff', 'cutoff': 0.2073238500174694, 'grm_norm': 'cosine', 'self_loops': False, 'use_snp_selection': True, 'num_snps': 3907}. Best is trial 44 with value: 0.2987332707245484.
[I 2025-12-09 23:44:23,395] Trial 65 finished with value: 0.2829149938699707 and parameters: {'model_type': 'graphsage', 'hidden_dims': '[512, 64]', 'dropout': 0.3560853388138918, 'batch_norm': False, 'sage_aggr': 'mean', 'sage_normalize': False, 'sage_project': False, 'lr': 3.893983359549002e-05, 'weight_decay': 5.656480303025639e-07, 'epochs': 186, 'loss': 'mse', 'optimizer': 'adam', 'graph_mode': 'cutoff', 'cutoff': 0.4262740435356048, 'grm_norm': 'gcn', 'self_loops': False, 'use_snp_selection': False}. Best is trial 44 with value: 0.2987332707245484.
[I 2025-12-09 23:46:50,928] Trial 66 finished with value: 0.26953326488537355 and parameters: {'model_type': 'graphsage', 'hidden_dims': '[256, 128]', 'dropout': 0.429183465697889, 'batch_norm': False, 'sage_aggr': 'max', 'sage_normalize': False, 'sage_project': False, 'lr': 2.7708632922459614e-05, 'weight_decay': 1.0732628279781004e-06, 'epochs': 207, 'loss': 'mse', 'optimizer': 'adam', 'graph_mode': 'knn', 'knn_k': 5, 'weighted_edges': True, 'symmetrize_mode': 'union', 'self_loops': True, 'use_snp_selection': False}. Best is trial 44 with value: 0.2987332707245484.
[I 2025-12-09 23:47:55,805] Trial 67 finished with value: 0.2771161865865895 and parameters: {'model_type': 'graphsage', 'hidden_dims': '[256, 128, 64]', 'dropout': 0.45435581470912456, 'batch_norm': False, 'sage_aggr': 'mean', 'sage_normalize': False, 'sage_project': False, 'lr': 1.3166550754523619e-05, 'weight_decay': 0.00010028119064050381, 'epochs': 157, 'loss': 'mae', 'optimizer': 'adam', 'graph_mode': 'cutoff', 'cutoff': 0.4960926222103121, 'grm_norm': 'cosine', 'self_loops': False, 'use_snp_selection': True, 'num_snps': 28214}. Best is trial 44 with value: 0.2987332707245484.
[I 2025-12-09 23:50:07,876] Trial 68 finished with value: 0.2624426121622278 and parameters: {'model_type': 'graphsage', 'hidden_dims': '[512, 128]', 'dropout': 0.3295642538585787, 'batch_norm': True, 'sage_aggr': 'max', 'sage_normalize': True, 'sage_project': False, 'lr': 1.0331107369902601e-05, 'weight_decay': 1.9512448654847515e-06, 'epochs': 220, 'loss': 'mse', 'optimizer': 'adam', 'graph_mode': 'cutoff', 'cutoff': 0.6797099895136071, 'grm_norm': 'cosine', 'self_loops': False, 'use_snp_selection': False}. Best is trial 44 with value: 0.2987332707245484.
