[I 2025-12-09 00:40:56,087] Trial 44 finished with value: 0.2656593359769592 and parameters: {'model_type': 'graphsage', 'hidden_dims': '[128, 64]', 'dropout': 0.32549036592239305, 'batch_norm': False, 'sage_aggr': 'mean', 'sage_normalize': False, 'sage_project': False, 'lr': 1.3950766677345562e-05, 'weight_decay': 3.313815964995224e-07, 'epochs': 335, 'loss': 'mae', 'optimizer': 'adam', 'graph_mode': 'cutoff', 'cutoff': 0.6112947795240402, 'grm_norm': 'cosine', 'self_loops': False, 'use_snp_selection': True, 'num_snps': 5799}. Best is trial 31 with value: 0.2871956790107179.
[I 2025-12-09 00:42:59,651] Trial 45 finished with value: 0.2782860926282903 and parameters: {'model_type': 'graphsage', 'hidden_dims': '[512, 64]', 'dropout': 0.3626560185919033, 'batch_norm': False, 'sage_aggr': 'max', 'sage_normalize': False, 'sage_project': False, 'lr': 4.0308634958524854e-05, 'weight_decay': 3.8049918395935864e-06, 'epochs': 277, 'loss': 'mae', 'optimizer': 'adam', 'graph_mode': 'cutoff', 'cutoff': 0.7592603880612765, 'grm_norm': 'none', 'self_loops': False, 'use_snp_selection': False}. Best is trial 31 with value: 0.2871956790107179.
[I 2025-12-09 00:46:30,945] Trial 46 finished with value: 0.2751870432609437 and parameters: {'model_type': 'graphsage', 'hidden_dims': '[512, 64]', 'dropout': 0.26320653515903103, 'batch_norm': False, 'sage_aggr': 'mean', 'sage_normalize': False, 'sage_project': False, 'lr': 2.2363090795108695e-05, 'weight_decay': 1.0077462712585076e-07, 'epochs': 349, 'loss': 'mae', 'optimizer': 'adam', 'graph_mode': 'knn', 'knn_k': 5, 'weighted_edges': True, 'symmetrize_mode': 'union', 'self_loops': False, 'use_snp_selection': False}. Best is trial 31 with value: 0.2871956790107179.
[I 2025-12-09 00:47:20,356] Trial 47 finished with value: 0.26864846481172594 and parameters: {'model_type': 'graphsage', 'hidden_dims': '[256, 128, 64]', 'dropout': 0.17107203593109696, 'batch_norm': False, 'sage_aggr': 'mean', 'sage_normalize': False, 'sage_project': False, 'lr': 1.2662719515908026e-05, 'weight_decay': 1.844608488344423e-07, 'epochs': 297, 'loss': 'mae', 'optimizer': 'adam', 'graph_mode': 'cutoff', 'cutoff': 0.6875634278677057, 'grm_norm': 'cosine', 'self_loops': False, 'use_snp_selection': True, 'num_snps': 15740}. Best is trial 31 with value: 0.2871956790107179.
[I 2025-12-09 00:49:58,105] Trial 48 finished with value: 0.25563398369411405 and parameters: {'model_type': 'graphsage', 'hidden_dims': '[512, 256]', 'dropout': 0.341853393744004, 'batch_norm': True, 'sage_aggr': 'max', 'sage_normalize': False, 'sage_project': False, 'lr': 1.008834454774219e-05, 'weight_decay': 4.6265828040737144e-07, 'epochs': 316, 'loss': 'mae', 'optimizer': 'adam', 'graph_mode': 'cutoff', 'cutoff': 0.5050272322113002, 'grm_norm': 'cosine', 'self_loops': False, 'use_snp_selection': False}. Best is trial 31 with value: 0.2871956790107179.
[I 2025-12-09 00:51:26,740] Trial 49 finished with value: 0.27367718400969754 and parameters: {'model_type': 'graphsage', 'hidden_dims': '[512, 64]', 'dropout': 0.424486900263454, 'batch_norm': False, 'sage_aggr': 'mean', 'sage_normalize': False, 'sage_project': False, 'lr': 1.878630990330476e-05, 'weight_decay': 5.125237374043105e-05, 'epochs': 161, 'loss': 'mae', 'optimizer': 'adam', 'graph_mode': 'cutoff', 'cutoff': 0.44207771679210944, 'grm_norm': 'none', 'self_loops': False, 'use_snp_selection': False}. Best is trial 31 with value: 0.2871956790107179.
[I 2025-12-09 00:54:46,219] Trial 50 finished with value: 0.2756327600571803 and parameters: {'model_type': 'graphsage', 'hidden_dims': '[512, 64]', 'dropout': 0.37630003213074953, 'batch_norm': False, 'sage_aggr': 'mean', 'sage_normalize': False, 'sage_project': False, 'lr': 2.7856499984072714e-05, 'weight_decay': 1.1962539128838895e-06, 'epochs': 261, 'loss': 'mae', 'optimizer': 'adam', 'graph_mode': 'knn', 'knn_k': 7, 'weighted_edges': True, 'symmetrize_mode': 'union', 'self_loops': False, 'use_snp_selection': True, 'num_snps': 36753}. Best is trial 31 with value: 0.2871956790107179.
[I 2025-12-09 00:57:14,616] Trial 51 finished with value: 0.27657922803512963 and parameters: {'model_type': 'graphsage', 'hidden_dims': '[512, 64]', 'dropout': 0.3710882753237705, 'batch_norm': False, 'sage_aggr': 'mean', 'sage_normalize': False, 'sage_project': False, 'lr': 8.060091751410744e-05, 'weight_decay': 1.8763685983836562e-07, 'epochs': 333, 'loss': 'mae', 'optimizer': 'adam', 'graph_mode': 'cutoff', 'cutoff': 0.6708722751996581, 'grm_norm': 'cosine', 'self_loops': False, 'use_snp_selection': False}. Best is trial 31 with value: 0.2871956790107179.
[I 2025-12-09 00:59:11,556] Trial 52 finished with value: 0.28202285498673374 and parameters: {'model_type': 'graphsage', 'hidden_dims': '[512, 64]', 'dropout': 0.32452283393678094, 'batch_norm': False, 'sage_aggr': 'mean', 'sage_normalize': False, 'sage_project': False, 'lr': 5.512637296984621e-05, 'weight_decay': 2.5177374934161636e-07, 'epochs': 253, 'loss': 'mae', 'optimizer': 'adam', 'graph_mode': 'cutoff', 'cutoff': 0.5861147698195389, 'grm_norm': 'cosine', 'self_loops': False, 'use_snp_selection': False}. Best is trial 31 with value: 0.2871956790107179.
[I 2025-12-09 01:01:21,709] Trial 53 finished with value: 0.1733016081332647 and parameters: {'model_type': 'graphsage', 'hidden_dims': '[512, 64]', 'dropout': 0.3581049133921721, 'batch_norm': False, 'sage_aggr': 'mean', 'sage_normalize': False, 'sage_project': False, 'lr': 0.0003068646277947021, 'weight_decay': 1.509406581102639e-07, 'epochs': 288, 'loss': 'mae', 'optimizer': 'adam', 'graph_mode': 'cutoff', 'cutoff': 0.6242763667565783, 'grm_norm': 'cosine', 'self_loops': False, 'use_snp_selection': False}. Best is trial 31 with value: 0.2871956790107179.
[I 2025-12-09 01:03:38,997] Trial 54 finished with value: 0.2843765127873682 and parameters: {'model_type': 'graphsage', 'hidden_dims': '[512, 64]', 'dropout': 0.28703285488000235, 'batch_norm': False, 'sage_aggr': 'mean', 'sage_normalize': False, 'sage_project': False, 'lr': 1.371814872553471e-05, 'weight_decay': 6.842169889811893e-07, 'epochs': 304, 'loss': 'mae', 'optimizer': 'adam', 'graph_mode': 'cutoff', 'cutoff': 0.7480684954513335, 'grm_norm': 'cosine', 'self_loops': False, 'use_snp_selection': False}. Best is trial 31 with value: 0.2871956790107179.
[I 2025-12-09 01:05:26,439] Trial 55 finished with value: 0.2854657347108921 and parameters: {'model_type': 'graphsage', 'hidden_dims': '[512, 64]', 'dropout': 0.24440357854863726, 'batch_norm': False, 'sage_aggr': 'mean', 'sage_normalize': False, 'sage_project': False, 'lr': 3.6150378268935446e-05, 'weight_decay': 3.43805070240614e-07, 'epochs': 232, 'loss': 'mae', 'optimizer': 'adam', 'graph_mode': 'cutoff', 'cutoff': 0.6492299079562439, 'grm_norm': 'cosine', 'self_loops': False, 'use_snp_selection': False}. Best is trial 31 with value: 0.2871956790107179.
[I 2025-12-09 01:06:09,750] Trial 56 finished with value: 0.23522288164886546 and parameters: {'model_type': 'graphsage', 'hidden_dims': '[128, 64]', 'dropout': 0.23804254129369778, 'batch_norm': False, 'sage_aggr': 'mean', 'sage_normalize': True, 'sage_project': False, 'lr': 4.0852975093575906e-05, 'weight_decay': 3.262748691346472e-07, 'epochs': 222, 'loss': 'mae', 'optimizer': 'adam', 'graph_mode': 'cutoff', 'cutoff': 0.5609975282377311, 'grm_norm': 'cosine', 'self_loops': False, 'use_snp_selection': False}. Best is trial 31 with value: 0.2871956790107179.
[I 2025-12-09 01:07:12,593] Trial 57 finished with value: 0.2832290535943615 and parameters: {'model_type': 'graphsage', 'hidden_dims': '[256, 128]', 'dropout': 0.22248792778699983, 'batch_norm': False, 'sage_aggr': 'max', 'sage_normalize': False, 'sage_project': False, 'lr': 1.711428803721939e-05, 'weight_decay': 1.2173289457998933e-07, 'epochs': 232, 'loss': 'mae', 'optimizer': 'adam', 'graph_mode': 'cutoff', 'cutoff': 0.8125884762770438, 'grm_norm': 'cosine', 'self_loops': False, 'use_snp_selection': False}. Best is trial 31 with value: 0.2871956790107179.
[I 2025-12-09 01:09:17,538] Trial 58 finished with value: 0.25509710282718434 and parameters: {'model_type': 'graphsage', 'hidden_dims': '[256, 128, 64]', 'dropout': 0.20252332561622682, 'batch_norm': False, 'sage_aggr': 'mean', 'sage_normalize': False, 'sage_project': False, 'lr': 1.3434786910075855e-05, 'weight_decay': 2.5848220035565014e-07, 'epochs': 327, 'loss': 'mae', 'optimizer': 'adam', 'graph_mode': 'knn', 'knn_k': 8, 'weighted_edges': False, 'symmetrize_mode': 'mutual', 'self_loops': False, 'use_snp_selection': False}. Best is trial 31 with value: 0.2871956790107179.
[I 2025-12-09 01:10:07,536] Trial 59 finished with value: 0.2756154026225509 and parameters: {'model_type': 'graphsage', 'hidden_dims': '[512, 256]', 'dropout': 0.4077885039857744, 'batch_norm': False, 'sage_aggr': 'mean', 'sage_normalize': False, 'sage_project': False, 'lr': 2.100048526784731e-05, 'weight_decay': 0.00018065525276486432, 'epochs': 179, 'loss': 'mae', 'optimizer': 'adam', 'graph_mode': 'cutoff', 'cutoff': 0.636086088100097, 'grm_norm': 'gcn', 'self_loops': False, 'use_snp_selection': True, 'num_snps': 15866}. Best is trial 31 with value: 0.2871956790107179.
[I 2025-12-09 01:11:42,588] Trial 60 finished with value: 0.24978524308380923 and parameters: {'model_type': 'graphsage', 'hidden_dims': '[512, 64]', 'dropout': 0.1390259453486118, 'batch_norm': False, 'sage_aggr': 'mean', 'sage_normalize': True, 'sage_project': False, 'lr': 2.7094953681465113e-05, 'weight_decay': 2.8422216578133737e-06, 'epochs': 197, 'loss': 'mae', 'optimizer': 'adam', 'graph_mode': 'cutoff', 'cutoff': 0.6911020681092831, 'grm_norm': 'cosine', 'self_loops': False, 'use_snp_selection': False}. Best is trial 31 with value: 0.2871956790107179.
[I 2025-12-09 01:13:44,812] Trial 61 finished with value: 0.21405491220841882 and parameters: {'model_type': 'graphsage', 'hidden_dims': '[512, 64]', 'dropout': 0.34387222129830586, 'batch_norm': False, 'sage_aggr': 'mean', 'sage_normalize': False, 'sage_project': False, 'lr': 0.00013269094181927367, 'weight_decay': 3.9330304714479054e-07, 'epochs': 269, 'loss': 'mae', 'optimizer': 'adam', 'graph_mode': 'cutoff', 'cutoff': 0.6454746119829625, 'grm_norm': 'cosine', 'self_loops': False, 'use_snp_selection': False}. Best is trial 31 with value: 0.2871956790107179.
[I 2025-12-09 01:15:37,246] Trial 62 finished with value: 0.28480039119446904 and parameters: {'model_type': 'graphsage', 'hidden_dims': '[512, 64]', 'dropout': 0.30194622453851044, 'batch_norm': False, 'sage_aggr': 'mean', 'sage_normalize': False, 'sage_project': False, 'lr': 1.1616124425523795e-05, 'weight_decay': 1.973840360898615e-07, 'epochs': 241, 'loss': 'mae', 'optimizer': 'adam', 'graph_mode': 'cutoff', 'cutoff': 0.6646720122014513, 'grm_norm': 'cosine', 'self_loops': False, 'use_snp_selection': False}. Best is trial 31 with value: 0.2871956790107179.
[I 2025-12-09 01:17:29,028] Trial 63 finished with value: 0.29051347740500066 and parameters: {'model_type': 'graphsage', 'hidden_dims': '[512, 64]', 'dropout': 0.3043401579008975, 'batch_norm': False, 'sage_aggr': 'mean', 'sage_normalize': False, 'sage_project': False, 'lr': 1.1620324666453551e-05, 'weight_decay': 1.2442237530119137e-07, 'epochs': 240, 'loss': 'mae', 'optimizer': 'adam', 'graph_mode': 'cutoff', 'cutoff': 0.7244953196747468, 'grm_norm': 'cosine', 'self_loops': False, 'use_snp_selection': False}. Best is trial 63 with value: 0.29051347740500066.
[I 2025-12-09 01:19:44,341] Trial 64 finished with value: 0.2796041933161231 and parameters: {'model_type': 'graphsage', 'hidden_dims': '[512, 64]', 'dropout': 0.24605867507857884, 'batch_norm': False, 'sage_aggr': 'mean', 'sage_normalize': False, 'sage_project': False, 'lr': 1.6221775929863912e-05, 'weight_decay': 1.2035135749463467e-07, 'epochs': 299, 'loss': 'mae', 'optimizer': 'adam', 'graph_mode': 'cutoff', 'cutoff': 0.7277963247194887, 'grm_norm': 'cosine', 'self_loops': False, 'use_snp_selection': False}. Best is trial 63 with value: 0.29051347740500066.
[I 2025-12-09 01:21:53,116] Trial 65 finished with value: 0.28102753705667 and parameters: {'model_type': 'graphsage', 'hidden_dims': '[512, 64]', 'dropout': 0.27311425986167304, 'batch_norm': False, 'sage_aggr': 'mean', 'sage_normalize': False, 'sage_project': False, 'lr': 3.694635081480611e-05, 'weight_decay': 1.614534542389009e-05, 'epochs': 284, 'loss': 'mae', 'optimizer': 'adam', 'graph_mode': 'cutoff', 'cutoff': 0.7852737388777373, 'grm_norm': 'cosine', 'self_loops': False, 'use_snp_selection': False}. Best is trial 63 with value: 0.29051347740500066.
[I 2025-12-09 01:24:15,172] Trial 66 finished with value: 0.2877584460422387 and parameters: {'model_type': 'graphsage', 'hidden_dims': '[512, 64]', 'dropout': 0.31676849248468036, 'batch_norm': False, 'sage_aggr': 'mean', 'sage_normalize': False, 'sage_project': False, 'lr': 1.202722988369491e-05, 'weight_decay': 1.00117375393059e-07, 'epochs': 312, 'loss': 'mae', 'optimizer': 'adam', 'graph_mode': 'cutoff', 'cutoff': 0.6020913509886973, 'grm_norm': 'cosine_then_gcn', 'self_loops': False, 'use_snp_selection': False}. Best is trial 63 with value: 0.29051347740500066.
[I 2025-12-09 01:25:48,753] Trial 67 finished with value: 0.28259439116077106 and parameters: {'model_type': 'graphsage', 'hidden_dims': '[256, 128]', 'dropout': 0.38191872788841724, 'batch_norm': False, 'sage_aggr': 'mean', 'sage_normalize': False, 'sage_project': False, 'lr': 2.0035143061552602e-05, 'weight_decay': 1.294407942275236e-07, 'epochs': 343, 'loss': 'mae', 'optimizer': 'adam', 'graph_mode': 'cutoff', 'cutoff': 0.5290509957340154, 'grm_norm': 'cosine_then_gcn', 'self_loops': False, 'use_snp_selection': False}. Best is trial 63 with value: 0.29051347740500066.
[I 2025-12-09 01:26:45,459] Trial 68 finished with value: 0.2674795782639307 and parameters: {'model_type': 'graphsage', 'hidden_dims': '[128, 64]', 'dropout': 0.32099075543700334, 'batch_norm': True, 'sage_aggr': 'mean', 'sage_normalize': False, 'sage_project': False, 'lr': 1.417618459419657e-05, 'weight_decay': 1.0271219849733136e-07, 'epochs': 317, 'loss': 'mae', 'optimizer': 'adam', 'graph_mode': 'cutoff', 'cutoff': 0.5819102927634718, 'grm_norm': 'cosine_then_gcn', 'self_loops': False, 'use_snp_selection': False}. Best is trial 63 with value: 0.29051347740500066.
[I 2025-12-09 01:28:33,575] Trial 69 finished with value: 0.24232513891799576 and parameters: {'model_type': 'graphsage', 'hidden_dims': '[512, 64]', 'dropout': 0.4518254407327271, 'batch_norm': False, 'sage_aggr': 'max', 'sage_normalize': True, 'sage_project': False, 'lr': 3.2530817414648855e-05, 'weight_decay': 2.895972940875982e-07, 'epochs': 227, 'loss': 'mae', 'optimizer': 'adam', 'graph_mode': 'cutoff', 'cutoff': 0.7055804470112602, 'grm_norm': 'cosine_then_gcn', 'self_loops': False, 'use_snp_selection': False}. Best is trial 63 with value: 0.29051347740500066.
[I 2025-12-09 01:31:06,773] Trial 70 finished with value: 0.2812232491143335 and parameters: {'model_type': 'graphsage', 'hidden_dims': '[512, 64]', 'dropout': 0.2890900464810886, 'batch_norm': False, 'sage_aggr': 'mean', 'sage_normalize': False, 'sage_project': False, 'lr': 1.2090956100504621e-05, 'weight_decay': 6.228572677230525e-07, 'epochs': 340, 'loss': 'mae', 'optimizer': 'adam', 'graph_mode': 'cutoff', 'cutoff': 0.6780066241115937, 'grm_norm': 'cosine_then_gcn', 'self_loops': False, 'use_snp_selection': False}. Best is trial 63 with value: 0.29051347740500066.
[I 2025-12-09 01:33:33,290] Trial 71 finished with value: 0.28675358598833245 and parameters: {'model_type': 'graphsage', 'hidden_dims': '[512, 64]', 'dropout': 0.33390047516509075, 'batch_norm': False, 'sage_aggr': 'mean', 'sage_normalize': False, 'sage_project': False, 'lr': 1.1395904797843396e-05, 'weight_decay': 1.6196155202764948e-07, 'epochs': 323, 'loss': 'mae', 'optimizer': 'adam', 'graph_mode': 'cutoff', 'cutoff': 0.6147575232123655, 'grm_norm': 'cosine', 'self_loops': False, 'use_snp_selection': False}. Best is trial 63 with value: 0.29051347740500066.
[I 2025-12-09 01:35:58,229] Trial 72 finished with value: 0.27905672325344755 and parameters: {'model_type': 'graphsage', 'hidden_dims': '[512, 64]', 'dropout': 0.3421628164405877, 'batch_norm': False, 'sage_aggr': 'mean', 'sage_normalize': False, 'sage_project': False, 'lr': 1.539027162189488e-05, 'weight_decay': 1.4845999078202374e-07, 'epochs': 320, 'loss': 'mae', 'optimizer': 'adam', 'graph_mode': 'cutoff', 'cutoff': 0.6071940767178072, 'grm_norm': 'cosine', 'self_loops': False, 'use_snp_selection': False}. Best is trial 63 with value: 0.29051347740500066.
[I 2025-12-09 01:38:09,403] Trial 73 finished with value: 0.27796234063480163 and parameters: {'model_type': 'graphsage', 'hidden_dims': '[512, 64]', 'dropout': 0.4055168555317462, 'batch_norm': False, 'sage_aggr': 'mean', 'sage_normalize': False, 'sage_project': False, 'lr': 1.9154210877625268e-05, 'weight_decay': 4.102598817822374e-07, 'epochs': 289, 'loss': 'mae', 'optimizer': 'adam', 'graph_mode': 'cutoff', 'cutoff': 0.7290529701663053, 'grm_norm': 'cosine_then_gcn', 'self_loops': False, 'use_snp_selection': False}. Best is trial 63 with value: 0.29051347740500066.
[I 2025-12-09 01:40:29,228] Trial 74 finished with value: 0.14555476395637243 and parameters: {'model_type': 'graphsage', 'hidden_dims': '[512, 64]', 'dropout': 0.2619791887610053, 'batch_norm': False, 'sage_aggr': 'mean', 'sage_normalize': False, 'sage_project': False, 'lr': 0.0006324768220292677, 'weight_decay': 0.0004896281297812428, 'epochs': 311, 'loss': 'mae', 'optimizer': 'adam', 'graph_mode': 'cutoff', 'cutoff': 0.6333808651194057, 'grm_norm': 'none', 'self_loops': False, 'use_snp_selection': False}. Best is trial 63 with value: 0.29051347740500066.
[I 2025-12-09 01:42:59,026] Trial 75 finished with value: 0.2786282846539492 and parameters: {'model_type': 'graphsage', 'hidden_dims': '[512, 64]', 'dropout': 0.3218540367847466, 'batch_norm': False, 'sage_aggr': 'mean', 'sage_normalize': False, 'sage_project': False, 'lr': 2.429139671899925e-05, 'weight_decay': 2.3310186672046093e-07, 'epochs': 328, 'loss': 'mae', 'optimizer': 'adam', 'graph_mode': 'cutoff', 'cutoff': 0.5538021318540736, 'grm_norm': 'cosine', 'self_loops': False, 'use_snp_selection': False}. Best is trial 63 with value: 0.29051347740500066.
[I 2025-12-09 01:44:07,904] Trial 76 finished with value: 0.2883211569723826 and parameters: {'model_type': 'graphsage', 'hidden_dims': '[256, 128, 64]', 'dropout': 0.39308460046099863, 'batch_norm': False, 'sage_aggr': 'mean', 'sage_normalize': False, 'sage_project': False, 'lr': 1.1924237681282604e-05, 'weight_decay': 1.5153201802564622e-07, 'epochs': 249, 'loss': 'mae', 'optimizer': 'adam', 'graph_mode': 'cutoff', 'cutoff': 0.5948678078775151, 'grm_norm': 'cosine', 'self_loops': False, 'use_snp_selection': False}. Best is trial 63 with value: 0.29051347740500066.
[I 2025-12-09 01:45:46,314] Trial 77 finished with value: 0.244822663391842 and parameters: {'model_type': 'graphsage', 'hidden_dims': '[256, 128, 64]', 'dropout': 0.3890456171624977, 'batch_norm': False, 'sage_aggr': 'mean', 'sage_normalize': False, 'sage_project': False, 'lr': 1.1780274945897176e-05, 'weight_decay': 3.1655422898712494e-07, 'epochs': 248, 'loss': 'mae', 'optimizer': 'adam', 'graph_mode': 'knn', 'knn_k': 4, 'weighted_edges': True, 'symmetrize_mode': 'union', 'self_loops': False, 'use_snp_selection': False}. Best is trial 63 with value: 0.29051347740500066.
[I 2025-12-09 01:46:28,963] Trial 78 finished with value: 0.27472606141707334 and parameters: {'model_type': 'graphsage', 'hidden_dims': '[256, 128, 64]', 'dropout': 0.36082497086021575, 'batch_norm': False, 'sage_aggr': 'mean', 'sage_normalize': False, 'sage_project': False, 'lr': 1.604250624524444e-05, 'weight_decay': 1.2678035795764073e-07, 'epochs': 198, 'loss': 'mae', 'optimizer': 'adam', 'graph_mode': 'cutoff', 'cutoff': 0.5950019950514182, 'grm_norm': 'cosine', 'self_loops': False, 'use_snp_selection': True, 'num_snps': 15122}. Best is trial 63 with value: 0.29051347740500066.
[I 2025-12-09 01:47:30,487] Trial 79 finished with value: 0.2815702534153445 and parameters: {'model_type': 'graphsage', 'hidden_dims': '[256, 128, 64]', 'dropout': 0.4290828595607434, 'batch_norm': True, 'sage_aggr': 'mean', 'sage_normalize': False, 'sage_project': False, 'lr': 1.2011779249827941e-05, 'weight_decay': 1.0072787663214684e-07, 'epochs': 219, 'loss': 'mae', 'optimizer': 'adam', 'graph_mode': 'cutoff', 'cutoff': 0.6520265867387768, 'grm_norm': 'gcn', 'self_loops': False, 'use_snp_selection': False}. Best is trial 63 with value: 0.29051347740500066.
[I 2025-12-09 01:48:50,447] Trial 80 finished with value: 0.27955506883375564 and parameters: {'model_type': 'graphsage', 'hidden_dims': '[256, 128, 64]', 'dropout': 0.3989703331277493, 'batch_norm': False, 'sage_aggr': 'mean', 'sage_normalize': False, 'sage_project': False, 'lr': 1.8803609457693083e-05, 'weight_decay': 1.531249782744451e-07, 'epochs': 279, 'loss': 'mae', 'optimizer': 'adam', 'graph_mode': 'cutoff', 'cutoff': 0.5185544391045546, 'grm_norm': 'cosine', 'self_loops': False, 'use_snp_selection': False}. Best is trial 63 with value: 0.29051347740500066.
[I 2025-12-09 01:50:55,345] Trial 81 finished with value: 0.2900994747770291 and parameters: {'model_type': 'graphsage', 'hidden_dims': '[512, 64]', 'dropout': 0.3051120299599505, 'batch_norm': False, 'sage_aggr': 'mean', 'sage_normalize': False, 'sage_project': False, 'lr': 1.0029061792387403e-05, 'weight_decay': 2.1713455822233763e-07, 'epochs': 267, 'loss': 'mae', 'optimizer': 'adam', 'graph_mode': 'cutoff', 'cutoff': 0.5763731074109859, 'grm_norm': 'cosine', 'self_loops': False, 'use_snp_selection': False}. Best is trial 63 with value: 0.29051347740500066.
