[I 2025-12-06 17:52:47,547] Trial 112 finished with value: 0.24890330193230578 and parameters: {'model_type': 'graphsage', 'hidden_dims': '[512, 128]', 'dropout': 0.32125385593859784, 'batch_norm': False, 'sage_aggr': 'mean', 'sage_normalize': False, 'sage_project': False, 'lr': 0.00014962275342332663, 'weight_decay': 0.0008432339308523806, 'epochs': 109, 'loss': 'mae', 'optimizer': 'adam', 'graph_mode': 'cutoff', 'cutoff': 0.8189699312216092, 'grm_norm': 'cosine_then_gcn', 'self_loops': False, 'use_snp_selection': True, 'num_snps': 17176, 'graphsage_batch_size': 8}. Best is trial 92 with value: 0.2626148420921274.
[I 2025-12-06 17:53:27,279] Trial 113 finished with value: 0.26147020433256585 and parameters: {'model_type': 'graphsage', 'hidden_dims': '[512, 128]', 'dropout': 0.3087372257744513, 'batch_norm': False, 'sage_aggr': 'mean', 'sage_normalize': False, 'sage_project': False, 'lr': 0.00012053084118088081, 'weight_decay': 0.00033334440210926045, 'epochs': 121, 'loss': 'mae', 'optimizer': 'adam', 'graph_mode': 'cutoff', 'cutoff': 0.7697274460132247, 'grm_norm': 'cosine_then_gcn', 'self_loops': False, 'use_snp_selection': True, 'num_snps': 20182, 'graphsage_batch_size': 8}. Best is trial 92 with value: 0.2626148420921274.
[I 2025-12-06 17:54:04,871] Trial 114 finished with value: 0.253807413164426 and parameters: {'model_type': 'graphsage', 'hidden_dims': '[512, 128]', 'dropout': 0.3056902527936386, 'batch_norm': False, 'sage_aggr': 'mean', 'sage_normalize': False, 'sage_project': False, 'lr': 0.00012157770262919452, 'weight_decay': 0.0003041603323161392, 'epochs': 135, 'loss': 'mae', 'optimizer': 'adam', 'graph_mode': 'cutoff', 'cutoff': 0.7878102544274441, 'grm_norm': 'cosine_then_gcn', 'self_loops': False, 'use_snp_selection': True, 'num_snps': 16754, 'graphsage_batch_size': 8}. Best is trial 92 with value: 0.2626148420921274.
[I 2025-12-06 17:54:29,268] Trial 115 finished with value: 0.25232260343098545 and parameters: {'model_type': 'graphsage', 'hidden_dims': '[128, 64]', 'dropout': 0.24819259518787373, 'batch_norm': False, 'sage_aggr': 'mean', 'sage_normalize': False, 'sage_project': False, 'lr': 8.735961383619862e-05, 'weight_decay': 0.0004775291973144817, 'epochs': 104, 'loss': 'mae', 'optimizer': 'adam', 'graph_mode': 'cutoff', 'cutoff': 0.7665710130390618, 'grm_norm': 'cosine_then_gcn', 'self_loops': False, 'use_snp_selection': True, 'num_snps': 20277, 'graphsage_batch_size': 256}. Best is trial 92 with value: 0.2626148420921274.
[I 2025-12-06 17:55:12,902] Trial 116 finished with value: 0.25454251298227426 and parameters: {'model_type': 'graphsage', 'hidden_dims': '[512, 64]', 'dropout': 0.2897077558045361, 'batch_norm': False, 'sage_aggr': 'mean', 'sage_normalize': False, 'sage_project': False, 'lr': 9.901653400888667e-05, 'weight_decay': 0.00024876515285493083, 'epochs': 118, 'loss': 'mae', 'optimizer': 'adam', 'graph_mode': 'cutoff', 'cutoff': 0.8375498303271783, 'grm_norm': 'cosine', 'self_loops': False, 'use_snp_selection': True, 'num_snps': 22871, 'graphsage_batch_size': 8}. Best is trial 92 with value: 0.2626148420921274.
[I 2025-12-06 17:56:01,865] Trial 117 finished with value: 0.25305127347946677 and parameters: {'model_type': 'graphsage', 'hidden_dims': '[512, 128]', 'dropout': 0.2725465518929068, 'batch_norm': False, 'sage_aggr': 'mean', 'sage_normalize': False, 'sage_project': False, 'lr': 5.693134831590989e-05, 'weight_decay': 0.0001639118876357889, 'epochs': 128, 'loss': 'mae', 'optimizer': 'adam', 'graph_mode': 'cutoff', 'cutoff': 0.682203154936138, 'grm_norm': 'cosine_then_gcn', 'self_loops': False, 'use_snp_selection': True, 'num_snps': 25309, 'graphsage_batch_size': 8}. Best is trial 92 with value: 0.2626148420921274.
[I 2025-12-06 17:56:40,677] Trial 118 finished with value: 0.2586658782366088 and parameters: {'model_type': 'graphsage', 'hidden_dims': '[512, 128]', 'dropout': 0.3369372048737039, 'batch_norm': False, 'sage_aggr': 'mean', 'sage_normalize': False, 'sage_project': False, 'lr': 0.00014213220310877253, 'weight_decay': 0.0006730931656472684, 'epochs': 113, 'loss': 'mae', 'optimizer': 'adam', 'graph_mode': 'cutoff', 'cutoff': 0.6617637178368462, 'grm_norm': 'cosine_then_gcn', 'self_loops': False, 'use_snp_selection': True, 'num_snps': 19948, 'graphsage_batch_size': 512}. Best is trial 92 with value: 0.2626148420921274.
[I 2025-12-06 17:57:10,583] Trial 119 finished with value: 0.24837661653646337 and parameters: {'model_type': 'graphsage', 'hidden_dims': '[256, 128]', 'dropout': 0.33647251757989816, 'batch_norm': False, 'sage_aggr': 'mean', 'sage_normalize': False, 'sage_project': False, 'lr': 4.4863734854245645e-05, 'weight_decay': 0.0006745219343890825, 'epochs': 112, 'loss': 'mse', 'optimizer': 'adam', 'graph_mode': 'cutoff', 'cutoff': 0.6613702403776174, 'grm_norm': 'cosine_then_gcn', 'self_loops': False, 'use_snp_selection': True, 'num_snps': 19779, 'graphsage_batch_size': 512}. Best is trial 92 with value: 0.2626148420921274.
[I 2025-12-06 17:57:57,722] Trial 120 finished with value: 0.25630358309402845 and parameters: {'model_type': 'graphsage', 'hidden_dims': '[512, 128]', 'dropout': 0.34542888468242017, 'batch_norm': False, 'sage_aggr': 'max', 'sage_normalize': False, 'sage_project': False, 'lr': 7.732029515696374e-05, 'weight_decay': 0.0008048904459982205, 'epochs': 104, 'loss': 'mae', 'optimizer': 'adam', 'graph_mode': 'cutoff', 'cutoff': 0.8112324803680808, 'grm_norm': 'cosine_then_gcn', 'self_loops': False, 'use_snp_selection': True, 'num_snps': 27969, 'graphsage_batch_size': 512}. Best is trial 92 with value: 0.2626148420921274.
[I 2025-12-06 17:58:39,321] Trial 121 finished with value: 0.2549659664661165 and parameters: {'model_type': 'graphsage', 'hidden_dims': '[512, 128]', 'dropout': 0.3097594350583979, 'batch_norm': False, 'sage_aggr': 'mean', 'sage_normalize': False, 'sage_project': False, 'lr': 0.00011187464640476036, 'weight_decay': 0.00037493031127027837, 'epochs': 120, 'loss': 'mae', 'optimizer': 'adam', 'graph_mode': 'cutoff', 'cutoff': 0.71039645260525, 'grm_norm': 'cosine_then_gcn', 'self_loops': False, 'use_snp_selection': True, 'num_snps': 20991, 'graphsage_batch_size': 512}. Best is trial 92 with value: 0.2626148420921274.
[I 2025-12-06 17:59:15,511] Trial 122 finished with value: 0.2525212073223782 and parameters: {'model_type': 'graphsage', 'hidden_dims': '[512, 128]', 'dropout': 0.2969606698346058, 'batch_norm': False, 'sage_aggr': 'mean', 'sage_normalize': False, 'sage_project': False, 'lr': 0.00013954580121700185, 'weight_decay': 0.0004737905287983611, 'epochs': 114, 'loss': 'mae', 'optimizer': 'adam', 'graph_mode': 'cutoff', 'cutoff': 0.6285119767080968, 'grm_norm': 'cosine_then_gcn', 'self_loops': False, 'use_snp_selection': True, 'num_snps': 17504, 'graphsage_batch_size': 64}. Best is trial 92 with value: 0.2626148420921274.
[I 2025-12-06 17:59:49,353] Trial 123 finished with value: 0.23820172625660097 and parameters: {'model_type': 'graphsage', 'hidden_dims': '[512, 128]', 'dropout': 0.33598974088099276, 'batch_norm': False, 'sage_aggr': 'mean', 'sage_normalize': False, 'sage_project': False, 'lr': 0.00022060590156667897, 'weight_decay': 0.0006644064540316593, 'epochs': 144, 'loss': 'mae', 'optimizer': 'adam', 'graph_mode': 'cutoff', 'cutoff': 0.7315525060426666, 'grm_norm': 'cosine_then_gcn', 'self_loops': False, 'use_snp_selection': True, 'num_snps': 12846, 'graphsage_batch_size': 8}. Best is trial 92 with value: 0.2626148420921274.
[I 2025-12-06 18:00:06,926] Trial 124 finished with value: 0.20169747221045603 and parameters: {'model_type': 'graphsage', 'hidden_dims': '[512, 128]', 'dropout': 0.35545085794566966, 'batch_norm': False, 'sage_aggr': 'mean', 'sage_normalize': False, 'sage_project': False, 'lr': 9.418349555629194e-05, 'weight_decay': 0.00032116548108894623, 'epochs': 89, 'loss': 'mae', 'optimizer': 'adam', 'graph_mode': 'cutoff', 'cutoff': 0.6993887536927752, 'grm_norm': 'cosine_then_gcn', 'self_loops': False, 'use_snp_selection': True, 'num_snps': 2805, 'graphsage_batch_size': 16}. Best is trial 92 with value: 0.2626148420921274.
[I 2025-12-06 18:00:47,985] Trial 125 finished with value: 0.25291195250871124 and parameters: {'model_type': 'graphsage', 'hidden_dims': '[512, 128]', 'dropout': 0.3290759311859831, 'batch_norm': False, 'sage_aggr': 'mean', 'sage_normalize': False, 'sage_project': False, 'lr': 0.00012160339945725203, 'weight_decay': 0.0008753884768689023, 'epochs': 108, 'loss': 'mae', 'optimizer': 'adam', 'graph_mode': 'cutoff', 'cutoff': 0.7600862870864844, 'grm_norm': 'cosine_then_gcn', 'self_loops': False, 'use_snp_selection': True, 'num_snps': 22471, 'graphsage_batch_size': 8}. Best is trial 92 with value: 0.2626148420921274.
[I 2025-12-06 18:01:28,105] Trial 126 finished with value: 0.26082588437441967 and parameters: {'model_type': 'graphsage', 'hidden_dims': '[512, 128]', 'dropout': 0.27511577256515785, 'batch_norm': False, 'sage_aggr': 'mean', 'sage_normalize': False, 'sage_project': False, 'lr': 0.0001589359988878037, 'weight_decay': 0.00047858922423500374, 'epochs': 124, 'loss': 'mae', 'optimizer': 'adam', 'graph_mode': 'cutoff', 'cutoff': 0.7885019044880212, 'grm_norm': 'cosine', 'self_loops': False, 'use_snp_selection': True, 'num_snps': 19564, 'graphsage_batch_size': 8}. Best is trial 92 with value: 0.2626148420921274.
[I 2025-12-06 18:01:58,728] Trial 127 finished with value: 0.25677855052529425 and parameters: {'model_type': 'graphsage', 'hidden_dims': '[256, 128, 64]', 'dropout': 0.2796057743586653, 'batch_norm': False, 'sage_aggr': 'mean', 'sage_normalize': False, 'sage_project': False, 'lr': 7.328542273552419e-05, 'weight_decay': 0.0005094612840162307, 'epochs': 116, 'loss': 'mae', 'optimizer': 'adam', 'graph_mode': 'cutoff', 'cutoff': 0.7959502771885091, 'grm_norm': 'cosine_then_gcn', 'self_loops': False, 'use_snp_selection': True, 'num_snps': 19999, 'graphsage_batch_size': 512}. Best is trial 92 with value: 0.2626148420921274.
[I 2025-12-06 18:02:37,598] Trial 128 finished with value: 0.26189232796655115 and parameters: {'model_type': 'graphsage', 'hidden_dims': '[512, 128]', 'dropout': 0.24402400930759355, 'batch_norm': False, 'sage_aggr': 'mean', 'sage_normalize': False, 'sage_project': False, 'lr': 5.779641842999129e-05, 'weight_decay': 0.0006796392631556496, 'epochs': 124, 'loss': 'mae', 'optimizer': 'adam', 'graph_mode': 'cutoff', 'cutoff': 0.8475866505330995, 'grm_norm': 'cosine_then_gcn', 'self_loops': False, 'use_snp_selection': True, 'num_snps': 18674, 'graphsage_batch_size': 8}. Best is trial 92 with value: 0.2626148420921274.
[I 2025-12-06 18:03:16,466] Trial 129 finished with value: 0.26440112878171423 and parameters: {'model_type': 'graphsage', 'hidden_dims': '[512, 128]', 'dropout': 0.23123327594140633, 'batch_norm': False, 'sage_aggr': 'mean', 'sage_normalize': False, 'sage_project': False, 'lr': 5.654578385606808e-05, 'weight_decay': 0.000650463075700498, 'epochs': 124, 'loss': 'mae', 'optimizer': 'adam', 'graph_mode': 'cutoff', 'cutoff': 0.8480419639491569, 'grm_norm': 'cosine_then_gcn', 'self_loops': False, 'use_snp_selection': True, 'num_snps': 18723, 'graphsage_batch_size': 8}. Best is trial 129 with value: 0.26440112878171423.
[I 2025-12-06 18:04:02,464] Trial 130 finished with value: 0.2653487826019978 and parameters: {'model_type': 'graphsage', 'hidden_dims': '[512, 128]', 'dropout': 0.22820892946019328, 'batch_norm': False, 'sage_aggr': 'mean', 'sage_normalize': False, 'sage_project': False, 'lr': 3.6729642089050664e-05, 'weight_decay': 0.00042381286463993373, 'epochs': 126, 'loss': 'mae', 'optimizer': 'adam', 'graph_mode': 'cutoff', 'cutoff': 0.8415688690535201, 'grm_norm': 'cosine_then_gcn', 'self_loops': False, 'use_snp_selection': True, 'num_snps': 23300, 'graphsage_batch_size': 8}. Best is trial 130 with value: 0.2653487826019978.
[I 2025-12-06 18:04:50,558] Trial 131 finished with value: 0.2548958693580685 and parameters: {'model_type': 'graphsage', 'hidden_dims': '[512, 128]', 'dropout': 0.24076702886440812, 'batch_norm': False, 'sage_aggr': 'mean', 'sage_normalize': False, 'sage_project': False, 'lr': 3.669127403004574e-05, 'weight_decay': 0.00043846650405694987, 'epochs': 125, 'loss': 'mae', 'optimizer': 'adam', 'graph_mode': 'cutoff', 'cutoff': 0.8724352875976716, 'grm_norm': 'cosine_then_gcn', 'self_loops': False, 'use_snp_selection': True, 'num_snps': 24927, 'graphsage_batch_size': 8}. Best is trial 130 with value: 0.2653487826019978.
[I 2025-12-06 18:05:35,779] Trial 132 finished with value: 0.2556344050789498 and parameters: {'model_type': 'graphsage', 'hidden_dims': '[512, 128]', 'dropout': 0.19806839029633722, 'batch_norm': False, 'sage_aggr': 'mean', 'sage_normalize': False, 'sage_project': False, 'lr': 8.721654907309694e-05, 'weight_decay': 0.0005880158415055077, 'epochs': 122, 'loss': 'mae', 'optimizer': 'adam', 'graph_mode': 'cutoff', 'cutoff': 0.8514865304157737, 'grm_norm': 'cosine_then_gcn', 'self_loops': False, 'use_snp_selection': True, 'num_snps': 23079, 'graphsage_batch_size': 8}. Best is trial 130 with value: 0.2653487826019978.
[I 2025-12-06 18:06:17,623] Trial 133 finished with value: 0.25880291464428884 and parameters: {'model_type': 'graphsage', 'hidden_dims': '[512, 128]', 'dropout': 0.22509264034043835, 'batch_norm': False, 'sage_aggr': 'mean', 'sage_normalize': False, 'sage_project': False, 'lr': 5.623802303691148e-05, 'weight_decay': 0.0004131188531791967, 'epochs': 128, 'loss': 'mae', 'optimizer': 'adam', 'graph_mode': 'cutoff', 'cutoff': 0.8352818779824425, 'grm_norm': 'cosine_then_gcn', 'self_loops': False, 'use_snp_selection': True, 'num_snps': 20441, 'graphsage_batch_size': 8}. Best is trial 130 with value: 0.2653487826019978.
[I 2025-12-06 18:07:02,838] Trial 134 finished with value: 0.2587839539557532 and parameters: {'model_type': 'graphsage', 'hidden_dims': '[512, 128]', 'dropout': 0.22605640128191462, 'batch_norm': False, 'sage_aggr': 'mean', 'sage_normalize': False, 'sage_project': False, 'lr': 5.643584898471141e-05, 'weight_decay': 2.9881346129353987e-07, 'epochs': 139, 'loss': 'mae', 'optimizer': 'adam', 'graph_mode': 'cutoff', 'cutoff': 0.8309268448812698, 'grm_norm': 'cosine_then_gcn', 'self_loops': False, 'use_snp_selection': True, 'num_snps': 21297, 'graphsage_batch_size': 8}. Best is trial 130 with value: 0.2653487826019978.
[I 2025-12-06 18:07:47,684] Trial 135 finished with value: 0.25838905805597584 and parameters: {'model_type': 'graphsage', 'hidden_dims': '[512, 128]', 'dropout': 0.22682217658861273, 'batch_norm': False, 'sage_aggr': 'mean', 'sage_normalize': False, 'sage_project': False, 'lr': 5.849643489951029e-05, 'weight_decay': 2.7602430494894203e-06, 'epochs': 138, 'loss': 'mae', 'optimizer': 'adam', 'graph_mode': 'cutoff', 'cutoff': 0.8416852245497902, 'grm_norm': 'cosine_then_gcn', 'self_loops': False, 'use_snp_selection': True, 'num_snps': 21270, 'graphsage_batch_size': 8}. Best is trial 130 with value: 0.2653487826019978.
[I 2025-12-06 18:08:28,427] Trial 136 finished with value: 0.24840068722480596 and parameters: {'model_type': 'graphsage', 'hidden_dims': '[512, 128]', 'dropout': 0.21995408024717875, 'batch_norm': False, 'sage_aggr': 'mean', 'sage_normalize': True, 'sage_project': False, 'lr': 4.5191500460373916e-05, 'weight_decay': 0.00025084058564929973, 'epochs': 129, 'loss': 'mae', 'optimizer': 'adam', 'graph_mode': 'cutoff', 'cutoff': 0.8318200183471929, 'grm_norm': 'cosine_then_gcn', 'self_loops': False, 'use_snp_selection': True, 'num_snps': 19169, 'graphsage_batch_size': 256}. Best is trial 130 with value: 0.2653487826019978.
[I 2025-12-06 18:09:06,583] Trial 137 finished with value: 0.25855729657603904 and parameters: {'model_type': 'graphsage', 'hidden_dims': '[512, 128]', 'dropout': 0.21342070001978955, 'batch_norm': False, 'sage_aggr': 'mean', 'sage_normalize': False, 'sage_project': False, 'lr': 3.5837313605437906e-05, 'weight_decay': 3.285834431590144e-07, 'epochs': 141, 'loss': 'mae', 'optimizer': 'adam', 'graph_mode': 'cutoff', 'cutoff': 0.8576691893317342, 'grm_norm': 'cosine_then_gcn', 'self_loops': False, 'use_snp_selection': True, 'num_snps': 16123, 'graphsage_batch_size': 8}. Best is trial 130 with value: 0.2653487826019978.
[I 2025-12-06 18:09:31,213] Trial 138 finished with value: 0.24718795680104888 and parameters: {'model_type': 'graphsage', 'hidden_dims': '[128, 64]', 'dropout': 0.20639718689032788, 'batch_norm': False, 'sage_aggr': 'mean', 'sage_normalize': False, 'sage_project': False, 'lr': 3.8952036884089535e-05, 'weight_decay': 1.6916781602126928e-07, 'epochs': 147, 'loss': 'mae', 'optimizer': 'adam', 'graph_mode': 'cutoff', 'cutoff': 0.8586950654415221, 'grm_norm': 'cosine_then_gcn', 'self_loops': False, 'use_snp_selection': True, 'num_snps': 15731, 'graphsage_batch_size': 8}. Best is trial 130 with value: 0.2653487826019978.
[I 2025-12-06 18:10:04,582] Trial 139 finished with value: 0.24620380907998957 and parameters: {'model_type': 'graphsage', 'hidden_dims': '[512, 128]', 'dropout': 0.24151946594022083, 'batch_norm': False, 'sage_aggr': 'max', 'sage_normalize': False, 'sage_project': False, 'lr': 3.545372461759558e-05, 'weight_decay': 7.496537848261187e-07, 'epochs': 135, 'loss': 'mae', 'optimizer': 'adam', 'graph_mode': 'cutoff', 'cutoff': 0.8786747047680437, 'grm_norm': 'cosine', 'self_loops': False, 'use_snp_selection': True, 'num_snps': 13230, 'graphsage_batch_size': 8}. Best is trial 130 with value: 0.2653487826019978.
[I 2025-12-06 18:10:43,026] Trial 140 finished with value: 0.25278063729822364 and parameters: {'model_type': 'graphsage', 'hidden_dims': '[512, 128]', 'dropout': 0.2154445989817636, 'batch_norm': False, 'sage_aggr': 'mean', 'sage_normalize': False, 'sage_project': False, 'lr': 2.1211029484825552e-05, 'weight_decay': 2.8293739588155625e-07, 'epochs': 142, 'loss': 'mae', 'optimizer': 'adam', 'graph_mode': 'cutoff', 'cutoff': 0.8619808456939733, 'grm_norm': 'cosine_then_gcn', 'self_loops': False, 'use_snp_selection': True, 'num_snps': 16157, 'graphsage_batch_size': 512}. Best is trial 130 with value: 0.2653487826019978.
[I 2025-12-06 18:11:21,804] Trial 141 finished with value: 0.2587578195315462 and parameters: {'model_type': 'graphsage', 'hidden_dims': '[512, 128]', 'dropout': 0.23747103375011155, 'batch_norm': False, 'sage_aggr': 'mean', 'sage_normalize': False, 'sage_project': False, 'lr': 5.3723660065582426e-05, 'weight_decay': 3.555909279831008e-07, 'epochs': 126, 'loss': 'mae', 'optimizer': 'adam', 'graph_mode': 'cutoff', 'cutoff': 0.8110817485508688, 'grm_norm': 'cosine_then_gcn', 'self_loops': False, 'use_snp_selection': True, 'num_snps': 18437, 'graphsage_batch_size': 8}. Best is trial 130 with value: 0.2653487826019978.
[I 2025-12-06 18:12:02,983] Trial 142 finished with value: 0.25551955016028727 and parameters: {'model_type': 'graphsage', 'hidden_dims': '[512, 128]', 'dropout': 0.2298538737962186, 'batch_norm': False, 'sage_aggr': 'mean', 'sage_normalize': False, 'sage_project': False, 'lr': 5.726214459435619e-05, 'weight_decay': 4.3970138990388385e-07, 'epochs': 138, 'loss': 'mae', 'optimizer': 'adam', 'graph_mode': 'cutoff', 'cutoff': 0.8108154574572087, 'grm_norm': 'cosine_then_gcn', 'self_loops': False, 'use_snp_selection': True, 'num_snps': 18457, 'graphsage_batch_size': 8}. Best is trial 130 with value: 0.2653487826019978.
[I 2025-12-06 18:12:44,504] Trial 143 finished with value: 0.2660027114252147 and parameters: {'model_type': 'graphsage', 'hidden_dims': '[512, 128]', 'dropout': 0.2613525072078097, 'batch_norm': False, 'sage_aggr': 'mean', 'sage_normalize': False, 'sage_project': False, 'lr': 3.2404184177541196e-05, 'weight_decay': 3.6423828401814324e-07, 'epochs': 132, 'loss': 'mae', 'optimizer': 'adam', 'graph_mode': 'cutoff', 'cutoff': 0.8348093353164677, 'grm_norm': 'cosine_then_gcn', 'self_loops': False, 'use_snp_selection': True, 'num_snps': 19796, 'graphsage_batch_size': 8}. Best is trial 143 with value: 0.2660027114252147.
[I 2025-12-06 18:13:25,943] Trial 144 finished with value: 0.2625970680174786 and parameters: {'model_type': 'graphsage', 'hidden_dims': '[512, 128]', 'dropout': 0.2562592114882415, 'batch_norm': False, 'sage_aggr': 'mean', 'sage_normalize': False, 'sage_project': False, 'lr': 5.088906125993002e-05, 'weight_decay': 2.3049518591431863e-07, 'epochs': 126, 'loss': 'mae', 'optimizer': 'adam', 'graph_mode': 'cutoff', 'cutoff': 0.8328878149380549, 'grm_norm': 'cosine_then_gcn', 'self_loops': False, 'use_snp_selection': True, 'num_snps': 20342, 'graphsage_batch_size': 8}. Best is trial 143 with value: 0.2660027114252147.
[I 2025-12-06 18:14:08,189] Trial 145 finished with value: 0.25518705833368316 and parameters: {'model_type': 'graphsage', 'hidden_dims': '[512, 128]', 'dropout': 0.2547762990751958, 'batch_norm': False, 'sage_aggr': 'mean', 'sage_normalize': False, 'sage_project': False, 'lr': 4.7414253872351036e-05, 'weight_decay': 2.3761485764773315e-07, 'epochs': 126, 'loss': 'mae', 'optimizer': 'adam', 'graph_mode': 'cutoff', 'cutoff': 0.8303025184345922, 'grm_norm': 'cosine_then_gcn', 'self_loops': False, 'use_snp_selection': True, 'num_snps': 20101, 'graphsage_batch_size': 8}. Best is trial 143 with value: 0.2660027114252147.
[I 2025-12-06 18:14:52,454] Trial 146 finished with value: 0.24201576174607337 and parameters: {'model_type': 'graphsage', 'hidden_dims': '[512, 64]', 'dropout': 0.23688046197310986, 'batch_norm': False, 'sage_aggr': 'mean', 'sage_normalize': False, 'sage_project': False, 'lr': 4.4794834284518055e-05, 'weight_decay': 4.0396945788263133e-07, 'epochs': 132, 'loss': 'mse', 'optimizer': 'adam', 'graph_mode': 'cutoff', 'cutoff': 0.8393116571913886, 'grm_norm': 'cosine_then_gcn', 'self_loops': False, 'use_snp_selection': True, 'num_snps': 21794, 'graphsage_batch_size': 64}. Best is trial 143 with value: 0.2660027114252147.
