[I 2025-12-08 18:02:55,205] Trial 36 finished with value: 0.34068728432194206 and parameters: {'model_type': 'graphsage', 'hidden_dims': '[128, 64]', 'dropout': 0.12201008673632394, 'batch_norm': True, 'sage_aggr': 'mean', 'sage_normalize': False, 'sage_project': False, 'lr': 6.336878917406234e-05, 'weight_decay': 0.0001741448016427667, 'epochs': 156, 'loss': 'mse', 'optimizer': 'adam', 'graph_mode': 'knn', 'knn_k': 4, 'weighted_edges': False, 'symmetrize_mode': 'union', 'self_loops': False, 'use_snp_selection': True, 'num_snps': 30236}. Best is trial 35 with value: 0.3690750020563868.
[I 2025-12-08 18:03:39,835] Trial 37 finished with value: 0.3626744165608045 and parameters: {'model_type': 'graphsage', 'hidden_dims': '[128, 64]', 'dropout': 0.23951094107504248, 'batch_norm': False, 'sage_aggr': 'mean', 'sage_normalize': False, 'sage_project': False, 'lr': 2.1740180058761296e-05, 'weight_decay': 0.00029884097297016394, 'epochs': 138, 'loss': 'mse', 'optimizer': 'adam', 'graph_mode': 'knn', 'knn_k': 4, 'weighted_edges': False, 'symmetrize_mode': 'union', 'self_loops': False, 'use_snp_selection': False}. Best is trial 35 with value: 0.3690750020563868.
[I 2025-12-08 18:04:27,470] Trial 38 finished with value: 0.31904636289349947 and parameters: {'model_type': 'graphsage', 'hidden_dims': '[128, 64]', 'dropout': 0.2971686865106393, 'batch_norm': True, 'sage_aggr': 'mean', 'sage_normalize': True, 'sage_project': False, 'lr': 1.1402081838053656e-05, 'weight_decay': 0.00010160449128552494, 'epochs': 165, 'loss': 'mse', 'optimizer': 'adam', 'graph_mode': 'knn', 'knn_k': 3, 'weighted_edges': False, 'symmetrize_mode': 'union', 'self_loops': True, 'use_snp_selection': True, 'num_snps': 20210}. Best is trial 35 with value: 0.3690750020563868.
[I 2025-12-08 18:06:03,061] Trial 39 finished with value: 0.3703688072794665 and parameters: {'model_type': 'graphsage', 'hidden_dims': '[128, 64]', 'dropout': 0.18774927582111473, 'batch_norm': False, 'sage_aggr': 'mean', 'sage_normalize': False, 'sage_project': False, 'lr': 0.00012061490569470713, 'weight_decay': 0.0006017876432575978, 'epochs': 180, 'loss': 'mse', 'optimizer': 'adam', 'graph_mode': 'knn', 'knn_k': 7, 'weighted_edges': False, 'symmetrize_mode': 'union', 'self_loops': False, 'use_snp_selection': True, 'num_snps': 32250}. Best is trial 39 with value: 0.3703688072794665.
[I 2025-12-08 18:07:36,968] Trial 40 finished with value: 0.3357308268926066 and parameters: {'model_type': 'graphsage', 'hidden_dims': '[128, 64]', 'dropout': 0.17570031827235238, 'batch_norm': True, 'sage_aggr': 'mean', 'sage_normalize': False, 'sage_project': False, 'lr': 5.634580674064791e-05, 'weight_decay': 5.114033276295974e-06, 'epochs': 186, 'loss': 'mse', 'optimizer': 'adam', 'graph_mode': 'knn', 'knn_k': 7, 'weighted_edges': False, 'symmetrize_mode': 'union', 'self_loops': True, 'use_snp_selection': False}. Best is trial 39 with value: 0.3703688072794665.
[I 2025-12-08 18:09:00,356] Trial 41 finished with value: 0.37106180158176544 and parameters: {'model_type': 'graphsage', 'hidden_dims': '[128, 64]', 'dropout': 0.10016803964841223, 'batch_norm': False, 'sage_aggr': 'mean', 'sage_normalize': False, 'sage_project': False, 'lr': 9.249511359332144e-05, 'weight_decay': 0.0006997317972977203, 'epochs': 164, 'loss': 'mse', 'optimizer': 'adam', 'graph_mode': 'knn', 'knn_k': 5, 'weighted_edges': False, 'symmetrize_mode': 'union', 'self_loops': False, 'use_snp_selection': True, 'num_snps': 33452}. Best is trial 41 with value: 0.37106180158176544.
[I 2025-12-08 18:10:18,710] Trial 42 finished with value: 0.3662131844956039 and parameters: {'model_type': 'graphsage', 'hidden_dims': '[128, 64]', 'dropout': 0.11033409892282159, 'batch_norm': False, 'sage_aggr': 'mean', 'sage_normalize': False, 'sage_project': False, 'lr': 7.587862621342077e-05, 'weight_decay': 0.00046421582478661615, 'epochs': 156, 'loss': 'mse', 'optimizer': 'adam', 'graph_mode': 'knn', 'knn_k': 5, 'weighted_edges': False, 'symmetrize_mode': 'union', 'self_loops': False, 'use_snp_selection': True, 'num_snps': 32574}. Best is trial 41 with value: 0.37106180158176544.
[I 2025-12-08 18:11:27,910] Trial 43 finished with value: 0.370642294028085 and parameters: {'model_type': 'graphsage', 'hidden_dims': '[128, 64]', 'dropout': 0.1451859525921315, 'batch_norm': False, 'sage_aggr': 'mean', 'sage_normalize': False, 'sage_project': False, 'lr': 0.00012990319454736496, 'weight_decay': 0.000573763698080238, 'epochs': 177, 'loss': 'mse', 'optimizer': 'adam', 'graph_mode': 'knn', 'knn_k': 6, 'weighted_edges': False, 'symmetrize_mode': 'union', 'self_loops': False, 'use_snp_selection': True, 'num_snps': 27350}. Best is trial 41 with value: 0.37106180158176544.
[I 2025-12-08 18:12:53,691] Trial 44 finished with value: 0.3473883105835367 and parameters: {'model_type': 'graphsage', 'hidden_dims': '[128, 64]', 'dropout': 0.13332678957229122, 'batch_norm': False, 'sage_aggr': 'mean', 'sage_normalize': True, 'sage_project': False, 'lr': 4.959969767875425e-05, 'weight_decay': 0.0005715113086335082, 'epochs': 221, 'loss': 'mse', 'optimizer': 'adam', 'graph_mode': 'knn', 'knn_k': 6, 'weighted_edges': False, 'symmetrize_mode': 'union', 'self_loops': False, 'use_snp_selection': True, 'num_snps': 26903}. Best is trial 41 with value: 0.37106180158176544.
[I 2025-12-08 18:14:27,514] Trial 45 finished with value: 0.3576156852417948 and parameters: {'model_type': 'graphsage', 'hidden_dims': '[128, 64]', 'dropout': 0.10035312462886126, 'batch_norm': False, 'sage_aggr': 'mean', 'sage_normalize': False, 'sage_project': False, 'lr': 0.0003793576906318858, 'weight_decay': 0.0003105874159689543, 'epochs': 349, 'loss': 'mse', 'optimizer': 'adam', 'graph_mode': 'knn', 'knn_k': 5, 'weighted_edges': False, 'symmetrize_mode': 'union', 'self_loops': False, 'use_snp_selection': True, 'num_snps': 27282}. Best is trial 41 with value: 0.37106180158176544.
[I 2025-12-08 18:15:42,971] Trial 46 finished with value: 0.3707879080780576 and parameters: {'model_type': 'graphsage', 'hidden_dims': '[128, 64]', 'dropout': 0.1924274909646207, 'batch_norm': False, 'sage_aggr': 'mean', 'sage_normalize': False, 'sage_project': False, 'lr': 0.00010723277461443578, 'weight_decay': 6.35767738680839e-05, 'epochs': 192, 'loss': 'mse', 'optimizer': 'adam', 'graph_mode': 'knn', 'knn_k': 7, 'weighted_edges': False, 'symmetrize_mode': 'union', 'self_loops': False, 'use_snp_selection': True, 'num_snps': 22842}. Best is trial 41 with value: 0.37106180158176544.
[I 2025-12-08 18:16:59,704] Trial 47 finished with value: 0.3282702699245019 and parameters: {'model_type': 'graphsage', 'hidden_dims': '[128, 64]', 'dropout': 0.18430400358248927, 'batch_norm': True, 'sage_aggr': 'mean', 'sage_normalize': True, 'sage_project': False, 'lr': 2.662647999147338e-05, 'weight_decay': 2.024039358880375e-05, 'epochs': 256, 'loss': 'mse', 'optimizer': 'adam', 'graph_mode': 'knn', 'knn_k': 7, 'weighted_edges': False, 'symmetrize_mode': 'union', 'self_loops': False, 'use_snp_selection': True, 'num_snps': 20779}. Best is trial 41 with value: 0.37106180158176544.
[I 2025-12-08 18:17:58,397] Trial 48 finished with value: 0.35076859077451117 and parameters: {'model_type': 'graphsage', 'hidden_dims': '[256, 128, 64]', 'dropout': 0.14674399954947331, 'batch_norm': False, 'sage_aggr': 'mean', 'sage_normalize': False, 'sage_project': False, 'lr': 3.9247478063523784e-05, 'weight_decay': 6.457893996192107e-05, 'epochs': 191, 'loss': 'mse', 'optimizer': 'adam', 'graph_mode': 'knn', 'knn_k': 8, 'weighted_edges': False, 'symmetrize_mode': 'union', 'self_loops': False, 'use_snp_selection': True, 'num_snps': 15646}. Best is trial 41 with value: 0.37106180158176544.
[I 2025-12-08 18:19:02,549] Trial 49 finished with value: 0.37071707917730545 and parameters: {'model_type': 'graphsage', 'hidden_dims': '[128, 64]', 'dropout': 0.19254008467425224, 'batch_norm': False, 'sage_aggr': 'mean', 'sage_normalize': False, 'sage_project': False, 'lr': 7.423862602929262e-05, 'weight_decay': 0.0001377229379479687, 'epochs': 152, 'loss': 'mse', 'optimizer': 'adam', 'graph_mode': 'knn', 'knn_k': 6, 'weighted_edges': False, 'symmetrize_mode': 'union', 'self_loops': True, 'use_snp_selection': True, 'num_snps': 24197}. Best is trial 41 with value: 0.37106180158176544.
[I 2025-12-08 18:20:33,375] Trial 50 finished with value: 0.3699994859243147 and parameters: {'model_type': 'graphsage', 'hidden_dims': '[512, 128]', 'dropout': 0.1953381064271553, 'batch_norm': False, 'sage_aggr': 'mean', 'sage_normalize': False, 'sage_project': False, 'lr': 7.912076026647838e-05, 'weight_decay': 5.1150740762948075e-05, 'epochs': 211, 'loss': 'mse', 'optimizer': 'adam', 'graph_mode': 'knn', 'knn_k': 6, 'weighted_edges': False, 'symmetrize_mode': 'union', 'self_loops': True, 'use_snp_selection': True, 'num_snps': 23700}. Best is trial 41 with value: 0.37106180158176544.
[I 2025-12-08 18:22:15,502] Trial 51 finished with value: 0.36915868882402714 and parameters: {'model_type': 'graphsage', 'hidden_dims': '[512, 128]', 'dropout': 0.1980318013284349, 'batch_norm': False, 'sage_aggr': 'mean', 'sage_normalize': False, 'sage_project': False, 'lr': 7.727996757423505e-05, 'weight_decay': 4.551121285990972e-05, 'epochs': 214, 'loss': 'mse', 'optimizer': 'adam', 'graph_mode': 'knn', 'knn_k': 6, 'weighted_edges': False, 'symmetrize_mode': 'union', 'self_loops': True, 'use_snp_selection': True, 'num_snps': 23810}. Best is trial 41 with value: 0.37106180158176544.
[I 2025-12-08 18:23:13,641] Trial 52 finished with value: 0.3396496050460258 and parameters: {'model_type': 'graphsage', 'hidden_dims': '[512, 128]', 'dropout': 0.12843409327890443, 'batch_norm': False, 'sage_aggr': 'mean', 'sage_normalize': False, 'sage_project': False, 'lr': 0.00010285305959158404, 'weight_decay': 0.00011701726188163492, 'epochs': 239, 'loss': 'mse', 'optimizer': 'adam', 'graph_mode': 'knn', 'knn_k': 7, 'weighted_edges': False, 'symmetrize_mode': 'union', 'self_loops': True, 'use_snp_selection': True, 'num_snps': 10497}. Best is trial 41 with value: 0.37106180158176544.
[I 2025-12-08 18:25:12,259] Trial 53 finished with value: 0.3500748441311841 and parameters: {'model_type': 'graphsage', 'hidden_dims': '[512, 128]', 'dropout': 0.1621993344943205, 'batch_norm': False, 'sage_aggr': 'mean', 'sage_normalize': False, 'sage_project': False, 'lr': 7.661972750195375e-05, 'weight_decay': 2.286970780667819e-05, 'epochs': 275, 'loss': 'mse', 'optimizer': 'adam', 'graph_mode': 'knn', 'knn_k': 6, 'weighted_edges': False, 'symmetrize_mode': 'union', 'self_loops': True, 'use_snp_selection': True, 'num_snps': 23976}. Best is trial 41 with value: 0.37106180158176544.
[I 2025-12-08 18:26:26,423] Trial 54 finished with value: 0.3665649190759954 and parameters: {'model_type': 'graphsage', 'hidden_dims': '[128, 64]', 'dropout': 0.1955518797688012, 'batch_norm': False, 'sage_aggr': 'mean', 'sage_normalize': False, 'sage_project': False, 'lr': 0.00012364770424603131, 'weight_decay': 7.330997465945046e-05, 'epochs': 187, 'loss': 'mse', 'optimizer': 'adam', 'graph_mode': 'knn', 'knn_k': 5, 'weighted_edges': False, 'symmetrize_mode': 'union', 'self_loops': True, 'use_snp_selection': True, 'num_snps': 25052}. Best is trial 41 with value: 0.37106180158176544.
[I 2025-12-08 18:28:05,763] Trial 55 finished with value: 0.3297965512736174 and parameters: {'model_type': 'graphsage', 'hidden_dims': '[512, 128]', 'dropout': 0.2645162969203801, 'batch_norm': False, 'sage_aggr': 'mean', 'sage_normalize': True, 'sage_project': False, 'lr': 0.00016157521697889458, 'weight_decay': 0.00012881143617879615, 'epochs': 210, 'loss': 'mse', 'optimizer': 'adam', 'graph_mode': 'knn', 'knn_k': 8, 'weighted_edges': False, 'symmetrize_mode': 'union', 'self_loops': True, 'use_snp_selection': True, 'num_snps': 21091}. Best is trial 41 with value: 0.37106180158176544.
[I 2025-12-08 18:29:53,698] Trial 56 finished with value: 0.36755340297785233 and parameters: {'model_type': 'graphsage', 'hidden_dims': '[128, 64]', 'dropout': 0.11795712617596762, 'batch_norm': False, 'sage_aggr': 'mean', 'sage_normalize': False, 'sage_project': False, 'lr': 0.0002863372921357132, 'weight_decay': 0.0006876693296992445, 'epochs': 234, 'loss': 'mse', 'optimizer': 'adam', 'graph_mode': 'knn', 'knn_k': 6, 'weighted_edges': False, 'symmetrize_mode': 'union', 'self_loops': True, 'use_snp_selection': True, 'num_snps': 28803}. Best is trial 41 with value: 0.37106180158176544.
[I 2025-12-08 18:31:11,082] Trial 57 finished with value: 0.3706290936812067 and parameters: {'model_type': 'graphsage', 'hidden_dims': '[128, 64]', 'dropout': 0.15437936598072638, 'batch_norm': False, 'sage_aggr': 'mean', 'sage_normalize': False, 'sage_project': False, 'lr': 4.3414825992794224e-05, 'weight_decay': 3.541163183869679e-05, 'epochs': 149, 'loss': 'mse', 'optimizer': 'adam', 'graph_mode': 'knn', 'knn_k': 7, 'weighted_edges': False, 'symmetrize_mode': 'union', 'self_loops': True, 'use_snp_selection': False}. Best is trial 41 with value: 0.37106180158176544.
[I 2025-12-08 18:32:28,520] Trial 58 finished with value: 0.3386047631965984 and parameters: {'model_type': 'graphsage', 'hidden_dims': '[128, 64]', 'dropout': 0.16765580679110034, 'batch_norm': True, 'sage_aggr': 'mean', 'sage_normalize': False, 'sage_project': False, 'lr': 1.6012999714742296e-05, 'weight_decay': 3.548904949823729e-05, 'epochs': 149, 'loss': 'mse', 'optimizer': 'adam', 'graph_mode': 'knn', 'knn_k': 7, 'weighted_edges': False, 'symmetrize_mode': 'union', 'self_loops': True, 'use_snp_selection': False}. Best is trial 41 with value: 0.37106180158176544.
[I 2025-12-08 18:34:03,588] Trial 59 finished with value: 0.3766201497265718 and parameters: {'model_type': 'graphsage', 'hidden_dims': '[128, 64]', 'dropout': 0.144713250535227, 'batch_norm': False, 'sage_aggr': 'mean', 'sage_normalize': False, 'sage_project': False, 'lr': 3.127344007173194e-05, 'weight_decay': 1.6701879832538204e-05, 'epochs': 172, 'loss': 'mse', 'optimizer': 'adam', 'graph_mode': 'knn', 'knn_k': 8, 'weighted_edges': False, 'symmetrize_mode': 'union', 'self_loops': True, 'use_snp_selection': False}. Best is trial 59 with value: 0.3766201497265718.
[I 2025-12-08 18:35:08,439] Trial 60 finished with value: 0.3684423142082454 and parameters: {'model_type': 'graphsage', 'hidden_dims': '[128, 64]', 'dropout': 0.14494199361503315, 'batch_norm': False, 'sage_aggr': 'mean', 'sage_normalize': False, 'sage_project': False, 'lr': 4.43255515568108e-05, 'weight_decay': 7.794846882739729e-06, 'epochs': 110, 'loss': 'mse', 'optimizer': 'adam', 'graph_mode': 'knn', 'knn_k': 8, 'weighted_edges': True, 'symmetrize_mode': 'union', 'self_loops': True, 'use_snp_selection': False}. Best is trial 59 with value: 0.3766201497265718.
[I 2025-12-08 18:36:44,948] Trial 61 finished with value: 0.3708723800387531 and parameters: {'model_type': 'graphsage', 'hidden_dims': '[128, 64]', 'dropout': 0.12494925926351794, 'batch_norm': False, 'sage_aggr': 'mean', 'sage_normalize': False, 'sage_project': False, 'lr': 3.243507944698587e-05, 'weight_decay': 1.6227706498700077e-05, 'epochs': 175, 'loss': 'mse', 'optimizer': 'adam', 'graph_mode': 'knn', 'knn_k': 8, 'weighted_edges': False, 'symmetrize_mode': 'union', 'self_loops': True, 'use_snp_selection': False}. Best is trial 59 with value: 0.3766201497265718.
[I 2025-12-08 18:38:19,040] Trial 62 finished with value: 0.37180282086195177 and parameters: {'model_type': 'graphsage', 'hidden_dims': '[128, 64]', 'dropout': 0.10312608697799969, 'batch_norm': False, 'sage_aggr': 'mean', 'sage_normalize': False, 'sage_project': False, 'lr': 2.9644562585090485e-05, 'weight_decay': 1.6218193567380765e-05, 'epochs': 170, 'loss': 'mse', 'optimizer': 'adam', 'graph_mode': 'knn', 'knn_k': 8, 'weighted_edges': False, 'symmetrize_mode': 'union', 'self_loops': True, 'use_snp_selection': False}. Best is trial 59 with value: 0.3766201497265718.
[I 2025-12-08 18:39:51,666] Trial 63 finished with value: 0.3773403851087473 and parameters: {'model_type': 'graphsage', 'hidden_dims': '[128, 64]', 'dropout': 0.11078847228972291, 'batch_norm': False, 'sage_aggr': 'mean', 'sage_normalize': False, 'sage_project': False, 'lr': 2.9596537164286707e-05, 'weight_decay': 1.6758534285056848e-05, 'epochs': 167, 'loss': 'mse', 'optimizer': 'adam', 'graph_mode': 'knn', 'knn_k': 8, 'weighted_edges': False, 'symmetrize_mode': 'union', 'self_loops': True, 'use_snp_selection': False}. Best is trial 63 with value: 0.3773403851087473.
[I 2025-12-08 18:41:46,179] Trial 64 finished with value: 0.37733845940916255 and parameters: {'model_type': 'graphsage', 'hidden_dims': '[256, 128, 64]', 'dropout': 0.1079515543879232, 'batch_norm': False, 'sage_aggr': 'mean', 'sage_normalize': False, 'sage_project': False, 'lr': 2.9825112896658825e-05, 'weight_decay': 1.6134417980357064e-05, 'epochs': 166, 'loss': 'mse', 'optimizer': 'adam', 'graph_mode': 'knn', 'knn_k': 9, 'weighted_edges': False, 'symmetrize_mode': 'union', 'self_loops': True, 'use_snp_selection': False}. Best is trial 63 with value: 0.3773403851087473.
[I 2025-12-08 18:43:00,223] Trial 65 finished with value: 0.37251885935916995 and parameters: {'model_type': 'graphsage', 'hidden_dims': '[256, 128, 64]', 'dropout': 0.10302703063437577, 'batch_norm': False, 'sage_aggr': 'mean', 'sage_normalize': False, 'sage_project': False, 'lr': 1.5697053193651716e-05, 'weight_decay': 4.330998277725227e-06, 'epochs': 169, 'loss': 'mse', 'optimizer': 'adam', 'graph_mode': 'knn', 'knn_k': 9, 'weighted_edges': False, 'symmetrize_mode': 'mutual', 'self_loops': True, 'use_snp_selection': False}. Best is trial 63 with value: 0.3773403851087473.
[I 2025-12-08 18:44:13,227] Trial 66 finished with value: 0.3758980371220028 and parameters: {'model_type': 'graphsage', 'hidden_dims': '[256, 128, 64]', 'dropout': 0.10682947210981576, 'batch_norm': False, 'sage_aggr': 'mean', 'sage_normalize': False, 'sage_project': False, 'lr': 1.6304275369375328e-05, 'weight_decay': 1.6508609748764443e-06, 'epochs': 166, 'loss': 'mse', 'optimizer': 'adam', 'graph_mode': 'knn', 'knn_k': 9, 'weighted_edges': False, 'symmetrize_mode': 'mutual', 'self_loops': True, 'use_snp_selection': False}. Best is trial 63 with value: 0.3773403851087473.
[I 2025-12-08 18:45:25,116] Trial 67 finished with value: 0.3706692782172346 and parameters: {'model_type': 'graphsage', 'hidden_dims': '[256, 128, 64]', 'dropout': 0.11694142206897377, 'batch_norm': False, 'sage_aggr': 'mean', 'sage_normalize': False, 'sage_project': False, 'lr': 1.5390893867604294e-05, 'weight_decay': 1.2880280831312752e-06, 'epochs': 163, 'loss': 'mse', 'optimizer': 'adam', 'graph_mode': 'knn', 'knn_k': 9, 'weighted_edges': True, 'symmetrize_mode': 'mutual', 'self_loops': True, 'use_snp_selection': False}. Best is trial 63 with value: 0.3773403851087473.
[I 2025-12-08 18:46:52,135] Trial 68 finished with value: 0.3485772332587195 and parameters: {'model_type': 'graphsage', 'hidden_dims': '[256, 128, 64]', 'dropout': 0.10111489542850731, 'batch_norm': False, 'sage_aggr': 'mean', 'sage_normalize': True, 'sage_project': False, 'lr': 2.1545788830189172e-05, 'weight_decay': 3.8287064491321755e-06, 'epochs': 168, 'loss': 'mse', 'optimizer': 'adam', 'graph_mode': 'knn', 'knn_k': 10, 'weighted_edges': False, 'symmetrize_mode': 'mutual', 'self_loops': True, 'use_snp_selection': False}. Best is trial 63 with value: 0.3773403851087473.
[I 2025-12-08 18:47:53,383] Trial 69 finished with value: 0.3697168270393562 and parameters: {'model_type': 'graphsage', 'hidden_dims': '[256, 128, 64]', 'dropout': 0.1077807741419356, 'batch_norm': False, 'sage_aggr': 'mean', 'sage_normalize': False, 'sage_project': False, 'lr': 1.4497225391617002e-05, 'weight_decay': 1.9297336392578344e-06, 'epochs': 134, 'loss': 'mse', 'optimizer': 'adam', 'graph_mode': 'knn', 'knn_k': 9, 'weighted_edges': False, 'symmetrize_mode': 'mutual', 'self_loops': True, 'use_snp_selection': False}. Best is trial 63 with value: 0.3773403851087473.
[I 2025-12-08 18:49:02,324] Trial 70 finished with value: 0.3635425574358012 and parameters: {'model_type': 'graphsage', 'hidden_dims': '[256, 128, 64]', 'dropout': 0.13422210199684692, 'batch_norm': False, 'sage_aggr': 'mean', 'sage_normalize': False, 'sage_project': False, 'lr': 1.9734301800107503e-05, 'weight_decay': 9.149884766521088e-06, 'epochs': 128, 'loss': 'mse', 'optimizer': 'adam', 'graph_mode': 'knn', 'knn_k': 10, 'weighted_edges': True, 'symmetrize_mode': 'mutual', 'self_loops': True, 'use_snp_selection': False}. Best is trial 63 with value: 0.3773403851087473.
[I 2025-12-08 18:50:13,699] Trial 71 finished with value: 0.36606610131239825 and parameters: {'model_type': 'graphsage', 'hidden_dims': '[256, 128, 64]', 'dropout': 0.12494877128017494, 'batch_norm': False, 'sage_aggr': 'mean', 'sage_normalize': False, 'sage_project': False, 'lr': 3.073188497384794e-05, 'weight_decay': 1.807119626031544e-05, 'epochs': 170, 'loss': 'mse', 'optimizer': 'adam', 'graph_mode': 'knn', 'knn_k': 8, 'weighted_edges': False, 'symmetrize_mode': 'mutual', 'self_loops': True, 'use_snp_selection': False}. Best is trial 63 with value: 0.3773403851087473.
[I 2025-12-08 18:51:37,949] Trial 72 finished with value: 0.371846671250793 and parameters: {'model_type': 'graphsage', 'hidden_dims': '[256, 128, 64]', 'dropout': 0.10014655387929546, 'batch_norm': False, 'sage_aggr': 'mean', 'sage_normalize': False, 'sage_project': False, 'lr': 2.6231970227708247e-05, 'weight_decay': 4.57824117274107e-07, 'epochs': 197, 'loss': 'mse', 'optimizer': 'adam', 'graph_mode': 'knn', 'knn_k': 9, 'weighted_edges': False, 'symmetrize_mode': 'mutual', 'self_loops': True, 'use_snp_selection': False}. Best is trial 63 with value: 0.3773403851087473.
