[I 2025-12-08 22:21:53,124] Trial 83 finished with value: 0.30613242320786777 and parameters: {'model_type': 'graphsage', 'hidden_dims': '[512, 128]', 'dropout': 0.5844392422898196, 'batch_norm': True, 'sage_aggr': 'mean', 'sage_normalize': True, 'sage_project': False, 'lr': 0.007025879790171954, 'weight_decay': 6.44931120974652e-06, 'epochs': 197, 'loss': 'mse', 'optimizer': 'adam', 'graph_mode': 'cutoff', 'cutoff': 0.819924328402928, 'grm_norm': 'cosine', 'self_loops': True, 'use_snp_selection': False}. Best is trial 82 with value: 0.3161094675173128.
[I 2025-12-08 22:23:33,993] Trial 84 finished with value: 0.31409945388355875 and parameters: {'model_type': 'graphsage', 'hidden_dims': '[512, 128]', 'dropout': 0.568825444402832, 'batch_norm': True, 'sage_aggr': 'mean', 'sage_normalize': True, 'sage_project': False, 'lr': 0.005316678739710247, 'weight_decay': 1.8927041027384753e-06, 'epochs': 224, 'loss': 'mse', 'optimizer': 'adam', 'graph_mode': 'cutoff', 'cutoff': 0.8857773312937854, 'grm_norm': 'cosine', 'self_loops': True, 'use_snp_selection': False}. Best is trial 82 with value: 0.3161094675173128.
[I 2025-12-08 22:25:15,774] Trial 85 finished with value: 0.3091008536797327 and parameters: {'model_type': 'graphsage', 'hidden_dims': '[512, 128]', 'dropout': 0.5722099177151178, 'batch_norm': True, 'sage_aggr': 'mean', 'sage_normalize': True, 'sage_project': False, 'lr': 0.0042406471497757475, 'weight_decay': 3.7121478273964287e-06, 'epochs': 226, 'loss': 'mse', 'optimizer': 'adam', 'graph_mode': 'cutoff', 'cutoff': 0.8956514654908224, 'grm_norm': 'cosine', 'self_loops': True, 'use_snp_selection': False}. Best is trial 82 with value: 0.3161094675173128.
[I 2025-12-08 22:27:01,850] Trial 86 finished with value: 0.30936336077487664 and parameters: {'model_type': 'graphsage', 'hidden_dims': '[512, 128]', 'dropout': 0.5854619586059907, 'batch_norm': True, 'sage_aggr': 'mean', 'sage_normalize': True, 'sage_project': False, 'lr': 0.006911770612448919, 'weight_decay': 6.8148725380269076e-06, 'epochs': 237, 'loss': 'mse', 'optimizer': 'adam', 'graph_mode': 'cutoff', 'cutoff': 0.8468021152306728, 'grm_norm': 'cosine', 'self_loops': True, 'use_snp_selection': False}. Best is trial 82 with value: 0.3161094675173128.
[I 2025-12-08 22:28:23,769] Trial 87 finished with value: 0.29222270065281636 and parameters: {'model_type': 'graphsage', 'hidden_dims': '[512, 128]', 'dropout': 0.5401865978876349, 'batch_norm': False, 'sage_aggr': 'mean', 'sage_normalize': True, 'sage_project': False, 'lr': 0.003324722895999354, 'weight_decay': 1.681028575766982e-06, 'epochs': 176, 'loss': 'mse', 'optimizer': 'adam', 'graph_mode': 'cutoff', 'cutoff': 0.8816967573312324, 'grm_norm': 'cosine', 'self_loops': False, 'use_snp_selection': False}. Best is trial 82 with value: 0.3161094675173128.
[I 2025-12-08 22:30:01,873] Trial 88 finished with value: 0.30640254719870386 and parameters: {'model_type': 'graphsage', 'hidden_dims': '[512, 128]', 'dropout': 0.5636673160988834, 'batch_norm': True, 'sage_aggr': 'mean', 'sage_normalize': True, 'sage_project': False, 'lr': 0.008504111457200819, 'weight_decay': 1.2567943134576047e-05, 'epochs': 217, 'loss': 'mse', 'optimizer': 'adam', 'graph_mode': 'cutoff', 'cutoff': 0.8478021071156789, 'grm_norm': 'cosine', 'self_loops': True, 'use_snp_selection': False}. Best is trial 82 with value: 0.3161094675173128.
[I 2025-12-08 22:31:42,726] Trial 89 finished with value: 0.28986803210776557 and parameters: {'model_type': 'graphsage', 'hidden_dims': '[512, 128]', 'dropout': 0.5889020207989353, 'batch_norm': True, 'sage_aggr': 'max', 'sage_normalize': True, 'sage_project': False, 'lr': 0.00523187596634275, 'weight_decay': 1.2939402683855315e-06, 'epochs': 191, 'loss': 'mse', 'optimizer': 'adam', 'graph_mode': 'cutoff', 'cutoff': 0.47468120800388774, 'grm_norm': 'cosine', 'self_loops': True, 'use_snp_selection': False}. Best is trial 82 with value: 0.3161094675173128.
[I 2025-12-08 22:33:15,731] Trial 90 finished with value: 0.3150352236538581 and parameters: {'model_type': 'graphsage', 'hidden_dims': '[512, 128]', 'dropout': 0.5215113520227619, 'batch_norm': True, 'sage_aggr': 'mean', 'sage_normalize': True, 'sage_project': False, 'lr': 0.006179474479702574, 'weight_decay': 6.177990701530122e-07, 'epochs': 204, 'loss': 'mse', 'optimizer': 'adam', 'graph_mode': 'cutoff', 'cutoff': 0.7821803404213653, 'grm_norm': 'cosine', 'self_loops': True, 'use_snp_selection': False}. Best is trial 82 with value: 0.3161094675173128.
[I 2025-12-08 22:34:46,846] Trial 91 finished with value: 0.31111545147051345 and parameters: {'model_type': 'graphsage', 'hidden_dims': '[512, 128]', 'dropout': 0.5189639005313287, 'batch_norm': True, 'sage_aggr': 'mean', 'sage_normalize': True, 'sage_project': False, 'lr': 0.006508895368859891, 'weight_decay': 3.3105637168720664e-07, 'epochs': 199, 'loss': 'mse', 'optimizer': 'adam', 'graph_mode': 'cutoff', 'cutoff': 0.7777465467614533, 'grm_norm': 'cosine', 'self_loops': True, 'use_snp_selection': False}. Best is trial 82 with value: 0.3161094675173128.
[I 2025-12-08 22:36:08,510] Trial 92 finished with value: 0.31116483050859456 and parameters: {'model_type': 'graphsage', 'hidden_dims': '[512, 128]', 'dropout': 0.5073768941402478, 'batch_norm': True, 'sage_aggr': 'mean', 'sage_normalize': True, 'sage_project': False, 'lr': 0.004632968037780639, 'weight_decay': 6.689521028318503e-07, 'epochs': 175, 'loss': 'mse', 'optimizer': 'adam', 'graph_mode': 'cutoff', 'cutoff': 0.7424906555687673, 'grm_norm': 'cosine', 'self_loops': True, 'use_snp_selection': False}. Best is trial 82 with value: 0.3161094675173128.
[I 2025-12-08 22:37:41,900] Trial 93 finished with value: 0.3125913352573143 and parameters: {'model_type': 'graphsage', 'hidden_dims': '[512, 128]', 'dropout': 0.5322480100542438, 'batch_norm': True, 'sage_aggr': 'mean', 'sage_normalize': True, 'sage_project': False, 'lr': 0.008449092895477697, 'weight_decay': 7.356939765235582e-07, 'epochs': 205, 'loss': 'mse', 'optimizer': 'adam', 'graph_mode': 'cutoff', 'cutoff': 0.8316145288080722, 'grm_norm': 'cosine', 'self_loops': True, 'use_snp_selection': False}. Best is trial 82 with value: 0.3161094675173128.
[I 2025-12-08 22:39:15,283] Trial 94 finished with value: 0.3074227822532605 and parameters: {'model_type': 'graphsage', 'hidden_dims': '[512, 128]', 'dropout': 0.5289773215284129, 'batch_norm': True, 'sage_aggr': 'mean', 'sage_normalize': True, 'sage_project': False, 'lr': 0.008197945771575298, 'weight_decay': 5.15065499437086e-07, 'epochs': 205, 'loss': 'mse', 'optimizer': 'adam', 'graph_mode': 'cutoff', 'cutoff': 0.8792661658391474, 'grm_norm': 'cosine', 'self_loops': True, 'use_snp_selection': False}. Best is trial 82 with value: 0.3161094675173128.
[I 2025-12-08 22:40:40,775] Trial 95 finished with value: 0.3107138951274131 and parameters: {'model_type': 'graphsage', 'hidden_dims': '[512, 128]', 'dropout': 0.5696432441678085, 'batch_norm': True, 'sage_aggr': 'mean', 'sage_normalize': True, 'sage_project': False, 'lr': 0.007515600027712815, 'weight_decay': 1.909442419140544e-07, 'epochs': 185, 'loss': 'mse', 'optimizer': 'adam', 'graph_mode': 'cutoff', 'cutoff': 0.8221220680635141, 'grm_norm': 'cosine', 'self_loops': True, 'use_snp_selection': False}. Best is trial 82 with value: 0.3161094675173128.
[I 2025-12-08 22:42:16,806] Trial 96 finished with value: 0.3120773598271277 and parameters: {'model_type': 'graphsage', 'hidden_dims': '[512, 128]', 'dropout': 0.597452319747447, 'batch_norm': True, 'sage_aggr': 'mean', 'sage_normalize': True, 'sage_project': False, 'lr': 0.0036613966544083347, 'weight_decay': 8.28795822702696e-07, 'epochs': 212, 'loss': 'mse', 'optimizer': 'adam', 'graph_mode': 'cutoff', 'cutoff': 0.7967251951658819, 'grm_norm': 'cosine', 'self_loops': True, 'use_snp_selection': False}. Best is trial 82 with value: 0.3161094675173128.
[I 2025-12-08 22:43:14,551] Trial 97 finished with value: 0.3182992944876167 and parameters: {'model_type': 'graphsage', 'hidden_dims': '[256, 128, 64]', 'dropout': 0.5989122524766197, 'batch_norm': True, 'sage_aggr': 'mean', 'sage_normalize': True, 'sage_project': False, 'lr': 0.008934443276888238, 'weight_decay': 7.375659831013309e-07, 'epochs': 215, 'loss': 'mse', 'optimizer': 'adam', 'graph_mode': 'cutoff', 'cutoff': 0.7865956316485893, 'grm_norm': 'cosine', 'self_loops': True, 'use_snp_selection': False}. Best is trial 97 with value: 0.3182992944876167.
[I 2025-12-08 22:44:22,773] Trial 98 finished with value: 0.2945036650309115 and parameters: {'model_type': 'graphsage', 'hidden_dims': '[256, 128, 64]', 'dropout': 0.5781206029229203, 'batch_norm': True, 'sage_aggr': 'mean', 'sage_normalize': True, 'sage_project': False, 'lr': 0.008990703141088834, 'weight_decay': 4.1696440973575193e-07, 'epochs': 168, 'loss': 'mse', 'optimizer': 'adam', 'graph_mode': 'knn', 'knn_k': 7, 'weighted_edges': False, 'symmetrize_mode': 'mutual', 'self_loops': True, 'use_snp_selection': False}. Best is trial 97 with value: 0.3182992944876167.
[I 2025-12-08 22:45:17,852] Trial 99 finished with value: 0.3095325548575561 and parameters: {'model_type': 'graphsage', 'hidden_dims': '[256, 128, 64]', 'dropout': 0.4868704279290736, 'batch_norm': True, 'sage_aggr': 'mean', 'sage_normalize': True, 'sage_project': False, 'lr': 0.0063820329974886006, 'weight_decay': 1.363975042181459e-06, 'epochs': 203, 'loss': 'mse', 'optimizer': 'adam', 'graph_mode': 'cutoff', 'cutoff': 0.7607598697169329, 'grm_norm': 'cosine', 'self_loops': True, 'use_snp_selection': False}. Best is trial 97 with value: 0.3182992944876167.
[I 2025-12-08 22:46:17,549] Trial 100 finished with value: 0.28357476589843067 and parameters: {'model_type': 'graphsage', 'hidden_dims': '[256, 128, 64]', 'dropout': 0.5376043526831024, 'batch_norm': False, 'sage_aggr': 'mean', 'sage_normalize': True, 'sage_project': False, 'lr': 0.009181596599707567, 'weight_decay': 2.373230660895456e-06, 'epochs': 225, 'loss': 'mse', 'optimizer': 'adam', 'graph_mode': 'cutoff', 'cutoff': 0.7189622487025166, 'grm_norm': 'cosine', 'self_loops': False, 'use_snp_selection': False}. Best is trial 97 with value: 0.3182992944876167.
[I 2025-12-08 22:47:15,451] Trial 101 finished with value: 0.3081490176232529 and parameters: {'model_type': 'graphsage', 'hidden_dims': '[256, 128, 64]', 'dropout': 0.59891963976757, 'batch_norm': True, 'sage_aggr': 'mean', 'sage_normalize': True, 'sage_project': False, 'lr': 0.004915477500259728, 'weight_decay': 7.354793119384949e-07, 'epochs': 216, 'loss': 'mse', 'optimizer': 'adam', 'graph_mode': 'cutoff', 'cutoff': 0.7897509083536357, 'grm_norm': 'cosine', 'self_loops': True, 'use_snp_selection': False}. Best is trial 97 with value: 0.3182992944876167.
[I 2025-12-08 22:48:51,798] Trial 102 finished with value: 0.3170342337826175 and parameters: {'model_type': 'graphsage', 'hidden_dims': '[512, 128]', 'dropout': 0.5893818384505156, 'batch_norm': True, 'sage_aggr': 'mean', 'sage_normalize': True, 'sage_project': False, 'lr': 0.009945665832379337, 'weight_decay': 8.074479304013076e-07, 'epochs': 213, 'loss': 'mse', 'optimizer': 'adam', 'graph_mode': 'cutoff', 'cutoff': 0.8058506741605568, 'grm_norm': 'cosine', 'self_loops': True, 'use_snp_selection': False}. Best is trial 97 with value: 0.3182992944876167.
[I 2025-12-08 22:50:17,564] Trial 103 finished with value: 0.3098247392267347 and parameters: {'model_type': 'graphsage', 'hidden_dims': '[512, 128]', 'dropout': 0.5515406734857583, 'batch_norm': True, 'sage_aggr': 'mean', 'sage_normalize': True, 'sage_project': False, 'lr': 0.007521806914006604, 'weight_decay': 5.800064183930227e-07, 'epochs': 186, 'loss': 'mse', 'optimizer': 'adam', 'graph_mode': 'cutoff', 'cutoff': 0.811542894749861, 'grm_norm': 'cosine', 'self_loops': True, 'use_snp_selection': False}. Best is trial 97 with value: 0.3182992944876167.
[I 2025-12-08 22:52:01,373] Trial 104 finished with value: 0.311946647612653 and parameters: {'model_type': 'graphsage', 'hidden_dims': '[512, 128]', 'dropout': 0.5872765674974791, 'batch_norm': True, 'sage_aggr': 'mean', 'sage_normalize': True, 'sage_project': False, 'lr': 0.006381715384321994, 'weight_decay': 1.0064601566146813e-06, 'epochs': 232, 'loss': 'mse', 'optimizer': 'adam', 'graph_mode': 'cutoff', 'cutoff': 0.7839358839618362, 'grm_norm': 'cosine', 'self_loops': True, 'use_snp_selection': False}. Best is trial 97 with value: 0.3182992944876167.
[I 2025-12-08 22:52:56,301] Trial 105 finished with value: 0.30986542665504474 and parameters: {'model_type': 'graphsage', 'hidden_dims': '[256, 128, 64]', 'dropout': 0.5774042054984937, 'batch_norm': True, 'sage_aggr': 'mean', 'sage_normalize': True, 'sage_project': False, 'lr': 0.008451777054233294, 'weight_decay': 3.5072087369767774e-07, 'epochs': 202, 'loss': 'mse', 'optimizer': 'adam', 'graph_mode': 'cutoff', 'cutoff': 0.7656570170397399, 'grm_norm': 'cosine', 'self_loops': True, 'use_snp_selection': False}. Best is trial 97 with value: 0.3182992944876167.
[I 2025-12-08 22:54:31,533] Trial 106 finished with value: 0.308426284120077 and parameters: {'model_type': 'graphsage', 'hidden_dims': '[512, 128]', 'dropout': 0.558367745279019, 'batch_norm': True, 'sage_aggr': 'mean', 'sage_normalize': True, 'sage_project': False, 'lr': 0.005827844297210604, 'weight_decay': 2.5875858866679475e-07, 'epochs': 210, 'loss': 'mse', 'optimizer': 'adam', 'graph_mode': 'cutoff', 'cutoff': 0.7373496954031338, 'grm_norm': 'cosine', 'self_loops': True, 'use_snp_selection': False}. Best is trial 97 with value: 0.3182992944876167.
[I 2025-12-08 22:55:58,423] Trial 107 finished with value: 0.31448079337714996 and parameters: {'model_type': 'graphsage', 'hidden_dims': '[512, 256]', 'dropout': 0.5251739102077252, 'batch_norm': True, 'sage_aggr': 'mean', 'sage_normalize': True, 'sage_project': False, 'lr': 0.009634038140142081, 'weight_decay': 4.038389914644443e-06, 'epochs': 191, 'loss': 'mse', 'optimizer': 'adam', 'graph_mode': 'cutoff', 'cutoff': 0.8081795180972293, 'grm_norm': 'gcn', 'self_loops': True, 'use_snp_selection': False}. Best is trial 97 with value: 0.3182992944876167.
[I 2025-12-08 22:57:37,036] Trial 108 finished with value: 0.3124656638836769 and parameters: {'model_type': 'graphsage', 'hidden_dims': '[512, 256]', 'dropout': 0.503833080099769, 'batch_norm': True, 'sage_aggr': 'max', 'sage_normalize': True, 'sage_project': False, 'lr': 0.008859678832220953, 'weight_decay': 4.134531455335079e-06, 'epochs': 222, 'loss': 'mse', 'optimizer': 'adam', 'graph_mode': 'cutoff', 'cutoff': 0.8589904485251829, 'grm_norm': 'gcn', 'self_loops': True, 'use_snp_selection': False}. Best is trial 97 with value: 0.3182992944876167.
[I 2025-12-08 22:59:21,385] Trial 109 finished with value: 0.31489978189352236 and parameters: {'model_type': 'graphsage', 'hidden_dims': '[512, 256]', 'dropout': 0.5301253964674743, 'batch_norm': True, 'sage_aggr': 'mean', 'sage_normalize': True, 'sage_project': False, 'lr': 0.009696105653154976, 'weight_decay': 2.6394050808750895e-06, 'epochs': 235, 'loss': 'mse', 'optimizer': 'adam', 'graph_mode': 'cutoff', 'cutoff': 0.7506794106434949, 'grm_norm': 'gcn', 'self_loops': True, 'use_snp_selection': False}. Best is trial 97 with value: 0.3182992944876167.
[I 2025-12-08 23:01:21,748] Trial 110 finished with value: 0.2975096649759517 and parameters: {'model_type': 'graphsage', 'hidden_dims': '[512, 256]', 'dropout': 0.5208247830460386, 'batch_norm': True, 'sage_aggr': 'mean', 'sage_normalize': True, 'sage_project': False, 'lr': 0.009901213853572129, 'weight_decay': 2.3216487613967702e-06, 'epochs': 235, 'loss': 'mse', 'optimizer': 'adam', 'graph_mode': 'cutoff', 'cutoff': 0.40174753295630294, 'grm_norm': 'gcn', 'self_loops': True, 'use_snp_selection': False}. Best is trial 97 with value: 0.3182992944876167.
[I 2025-12-08 23:02:58,284] Trial 111 finished with value: 0.3100312958363776 and parameters: {'model_type': 'graphsage', 'hidden_dims': '[512, 256]', 'dropout': 0.5345126563317946, 'batch_norm': True, 'sage_aggr': 'mean', 'sage_normalize': True, 'sage_project': False, 'lr': 0.00684253696759069, 'weight_decay': 2.8133108212059993e-06, 'epochs': 215, 'loss': 'mse', 'optimizer': 'adam', 'graph_mode': 'cutoff', 'cutoff': 0.7515019700139082, 'grm_norm': 'gcn', 'self_loops': True, 'use_snp_selection': False}. Best is trial 97 with value: 0.3182992944876167.
[I 2025-12-08 23:04:24,558] Trial 112 finished with value: 0.3110834072984078 and parameters: {'model_type': 'graphsage', 'hidden_dims': '[512, 256]', 'dropout': 0.5475256451392702, 'batch_norm': True, 'sage_aggr': 'mean', 'sage_normalize': True, 'sage_project': False, 'lr': 0.0052952428732833574, 'weight_decay': 1.8977856352110056e-06, 'epochs': 189, 'loss': 'mse', 'optimizer': 'adam', 'graph_mode': 'cutoff', 'cutoff': 0.8065405567402992, 'grm_norm': 'gcn', 'self_loops': True, 'use_snp_selection': False}. Best is trial 97 with value: 0.3182992944876167.
[I 2025-12-08 23:05:38,166] Trial 113 finished with value: 0.31030996530542404 and parameters: {'model_type': 'graphsage', 'hidden_dims': '[512, 256]', 'dropout': 0.487915500894509, 'batch_norm': True, 'sage_aggr': 'mean', 'sage_normalize': True, 'sage_project': False, 'lr': 0.008091278148518254, 'weight_decay': 9.444014128386595e-07, 'epochs': 157, 'loss': 'mse', 'optimizer': 'adam', 'graph_mode': 'cutoff', 'cutoff': 0.8369744732809621, 'grm_norm': 'gcn', 'self_loops': True, 'use_snp_selection': False}. Best is trial 97 with value: 0.3182992944876167.
[I 2025-12-08 23:07:19,393] Trial 114 finished with value: 0.3095397314682211 and parameters: {'model_type': 'graphsage', 'hidden_dims': '[512, 256]', 'dropout': 0.5267055573512666, 'batch_norm': True, 'sage_aggr': 'mean', 'sage_normalize': True, 'sage_project': False, 'lr': 0.004498812508767344, 'weight_decay': 8.660511866711535e-06, 'epochs': 227, 'loss': 'mse', 'optimizer': 'adam', 'graph_mode': 'cutoff', 'cutoff': 0.7816786786765418, 'grm_norm': 'gcn', 'self_loops': True, 'use_snp_selection': False}. Best is trial 97 with value: 0.3182992944876167.
[I 2025-12-08 23:09:11,303] Trial 115 finished with value: 0.3148261810491961 and parameters: {'model_type': 'graphsage', 'hidden_dims': '[512, 256]', 'dropout': 0.510670484831909, 'batch_norm': True, 'sage_aggr': 'mean', 'sage_normalize': True, 'sage_project': False, 'lr': 0.00968311602560765, 'weight_decay': 1.3051938235157282e-06, 'epochs': 254, 'loss': 'mse', 'optimizer': 'adam', 'graph_mode': 'cutoff', 'cutoff': 0.7707669000248341, 'grm_norm': 'gcn', 'self_loops': True, 'use_snp_selection': False}. Best is trial 97 with value: 0.3182992944876167.
[I 2025-12-08 23:11:02,932] Trial 116 finished with value: 0.3065642568135534 and parameters: {'model_type': 'graphsage', 'hidden_dims': '[512, 256]', 'dropout': 0.5097153577031346, 'batch_norm': True, 'sage_aggr': 'mean', 'sage_normalize': True, 'sage_project': False, 'lr': 0.009643840310628404, 'weight_decay': 1.3889095492645563e-06, 'epochs': 253, 'loss': 'mse', 'optimizer': 'adam', 'graph_mode': 'cutoff', 'cutoff': 0.7056593577758616, 'grm_norm': 'gcn', 'self_loops': True, 'use_snp_selection': False}. Best is trial 97 with value: 0.3182992944876167.
[I 2025-12-08 23:14:55,938] Trial 117 finished with value: 0.30292244609545405 and parameters: {'model_type': 'graphsage', 'hidden_dims': '[512, 256]', 'dropout': 0.5654448926172708, 'batch_norm': True, 'sage_aggr': 'mean', 'sage_normalize': True, 'sage_project': False, 'lr': 0.006148660028814958, 'weight_decay': 1.6286960972141053e-06, 'epochs': 260, 'loss': 'mse', 'optimizer': 'adam', 'graph_mode': 'knn', 'knn_k': 10, 'weighted_edges': False, 'symmetrize_mode': 'union', 'self_loops': True, 'use_snp_selection': False}. Best is trial 97 with value: 0.3182992944876167.
[I 2025-12-08 23:16:53,794] Trial 118 finished with value: 0.30887134333323624 and parameters: {'model_type': 'graphsage', 'hidden_dims': '[512, 256]', 'dropout': 0.5556411357305174, 'batch_norm': True, 'sage_aggr': 'mean', 'sage_normalize': True, 'sage_project': False, 'lr': 0.00984989721357587, 'weight_decay': 2.8093468475746044e-06, 'epochs': 265, 'loss': 'mse', 'optimizer': 'adam', 'graph_mode': 'cutoff', 'cutoff': 0.5976688903344052, 'grm_norm': 'gcn', 'self_loops': True, 'use_snp_selection': False}. Best is trial 97 with value: 0.3182992944876167.
[I 2025-12-08 23:18:39,045] Trial 119 finished with value: 0.310095177191847 and parameters: {'model_type': 'graphsage', 'hidden_dims': '[512, 256]', 'dropout': 0.5006345732454183, 'batch_norm': True, 'sage_aggr': 'mean', 'sage_normalize': True, 'sage_project': False, 'lr': 0.007150825352881917, 'weight_decay': 4.004529705566084e-06, 'epochs': 237, 'loss': 'mse', 'optimizer': 'adam', 'graph_mode': 'cutoff', 'cutoff': 0.7712469453690027, 'grm_norm': 'gcn', 'self_loops': True, 'use_snp_selection': False}. Best is trial 97 with value: 0.3182992944876167.
[I 2025-12-08 23:20:17,724] Trial 120 finished with value: 0.29718327180219595 and parameters: {'model_type': 'graphsage', 'hidden_dims': '[512, 64]', 'dropout': 0.5900842877169322, 'batch_norm': False, 'sage_aggr': 'mean', 'sage_normalize': True, 'sage_project': False, 'lr': 0.003079514003763952, 'weight_decay': 5.507643336739269e-06, 'epochs': 222, 'loss': 'mse', 'optimizer': 'adam', 'graph_mode': 'cutoff', 'cutoff': 0.7503543668892728, 'grm_norm': 'none', 'self_loops': False, 'use_snp_selection': False}. Best is trial 97 with value: 0.3182992944876167.
[I 2025-12-08 23:21:51,091] Trial 121 finished with value: 0.30893422090054873 and parameters: {'model_type': 'graphsage', 'hidden_dims': '[512, 256]', 'dropout': 0.5412129832719531, 'batch_norm': True, 'sage_aggr': 'mean', 'sage_normalize': True, 'sage_project': False, 'lr': 0.00799521075615678, 'weight_decay': 5.309028390265267e-07, 'epochs': 207, 'loss': 'mse', 'optimizer': 'adam', 'graph_mode': 'cutoff', 'cutoff': 0.7963172051938291, 'grm_norm': 'gcn', 'self_loops': True, 'use_snp_selection': False}. Best is trial 97 with value: 0.3182992944876167.
