[I 2025-12-09 07:49:11,836] Trial 120 finished with value: 0.21374319030167888 and parameters: {'model_type': 'graphsage', 'hidden_dims': '[512, 256]', 'dropout': 0.11582795978338895, 'batch_norm': False, 'sage_aggr': 'max', 'sage_normalize': False, 'sage_project': False, 'lr': 4.074457101420282e-05, 'weight_decay': 1.3809623008731125e-06, 'epochs': 54, 'loss': 'mae', 'optimizer': 'adam', 'graph_mode': 'cutoff', 'cutoff': 0.6292689061367821, 'grm_norm': 'cosine_then_gcn', 'self_loops': False, 'use_snp_selection': False}. Best is trial 78 with value: 0.30253482888050814.
[I 2025-12-09 07:51:37,806] Trial 121 finished with value: 0.2910764916777738 and parameters: {'model_type': 'graphsage', 'hidden_dims': '[512, 256]', 'dropout': 0.1018716896530373, 'batch_norm': True, 'sage_aggr': 'max', 'sage_normalize': False, 'sage_project': False, 'lr': 1.6898701194897024e-05, 'weight_decay': 1.8339028052771655e-06, 'epochs': 314, 'loss': 'mae', 'optimizer': 'adam', 'graph_mode': 'cutoff', 'cutoff': 0.5969759876229036, 'grm_norm': 'cosine_then_gcn', 'self_loops': False, 'use_snp_selection': False}. Best is trial 78 with value: 0.30253482888050814.
[I 2025-12-09 07:53:58,957] Trial 122 finished with value: 0.29444173606071355 and parameters: {'model_type': 'graphsage', 'hidden_dims': '[512, 256]', 'dropout': 0.10641788605565936, 'batch_norm': True, 'sage_aggr': 'max', 'sage_normalize': False, 'sage_project': False, 'lr': 1.4831408987363193e-05, 'weight_decay': 1.6484819949781571e-06, 'epochs': 301, 'loss': 'mae', 'optimizer': 'adam', 'graph_mode': 'cutoff', 'cutoff': 0.5813723503487479, 'grm_norm': 'cosine_then_gcn', 'self_loops': False, 'use_snp_selection': False}. Best is trial 78 with value: 0.30253482888050814.
[I 2025-12-09 07:56:27,208] Trial 123 finished with value: 0.28466933059334887 and parameters: {'model_type': 'graphsage', 'hidden_dims': '[512, 256]', 'dropout': 0.16123672979557596, 'batch_norm': True, 'sage_aggr': 'max', 'sage_normalize': False, 'sage_project': False, 'lr': 1.930404724161557e-05, 'weight_decay': 1.1454132245541933e-06, 'epochs': 313, 'loss': 'mae', 'optimizer': 'adam', 'graph_mode': 'cutoff', 'cutoff': 0.5507296159688495, 'grm_norm': 'cosine_then_gcn', 'self_loops': False, 'use_snp_selection': False}. Best is trial 78 with value: 0.30253482888050814.
[I 2025-12-09 07:59:00,106] Trial 124 finished with value: 0.2827982077873621 and parameters: {'model_type': 'graphsage', 'hidden_dims': '[512, 256]', 'dropout': 0.18017957304343318, 'batch_norm': True, 'sage_aggr': 'max', 'sage_normalize': False, 'sage_project': False, 'lr': 1.203255878572128e-05, 'weight_decay': 8.747332591779836e-07, 'epochs': 333, 'loss': 'mae', 'optimizer': 'adam', 'graph_mode': 'cutoff', 'cutoff': 0.6824049568441264, 'grm_norm': 'cosine_then_gcn', 'self_loops': False, 'use_snp_selection': False}. Best is trial 78 with value: 0.30253482888050814.
[I 2025-12-09 08:01:28,519] Trial 125 finished with value: 0.2932583166385548 and parameters: {'model_type': 'graphsage', 'hidden_dims': '[512, 256]', 'dropout': 0.1156632783216234, 'batch_norm': True, 'sage_aggr': 'max', 'sage_normalize': False, 'sage_project': False, 'lr': 2.9476623317056075e-05, 'weight_decay': 2.3524458794113397e-06, 'epochs': 320, 'loss': 'mae', 'optimizer': 'adam', 'graph_mode': 'cutoff', 'cutoff': 0.6084256283310674, 'grm_norm': 'cosine_then_gcn', 'self_loops': False, 'use_snp_selection': False}. Best is trial 78 with value: 0.30253482888050814.
[I 2025-12-09 08:02:50,357] Trial 126 finished with value: 0.27993740493993546 and parameters: {'model_type': 'graphsage', 'hidden_dims': '[256, 128, 64]', 'dropout': 0.20063866176252607, 'batch_norm': True, 'sage_aggr': 'max', 'sage_normalize': False, 'sage_project': False, 'lr': 0.002457659596142981, 'weight_decay': 1.849557950529098e-06, 'epochs': 305, 'loss': 'mae', 'optimizer': 'adam', 'graph_mode': 'cutoff', 'cutoff': 0.6493180953466677, 'grm_norm': 'cosine_then_gcn', 'self_loops': False, 'use_snp_selection': False}. Best is trial 78 with value: 0.30253482888050814.
[I 2025-12-09 08:05:21,368] Trial 127 finished with value: 0.29403049454644903 and parameters: {'model_type': 'graphsage', 'hidden_dims': '[512, 256]', 'dropout': 0.131355420241266, 'batch_norm': True, 'sage_aggr': 'max', 'sage_normalize': False, 'sage_project': False, 'lr': 1.702392768047323e-05, 'weight_decay': 3.4519820890474617e-06, 'epochs': 327, 'loss': 'mae', 'optimizer': 'adam', 'graph_mode': 'cutoff', 'cutoff': 0.6288356900300988, 'grm_norm': 'cosine_then_gcn', 'self_loops': False, 'use_snp_selection': False}. Best is trial 78 with value: 0.30253482888050814.
[I 2025-12-09 08:06:57,727] Trial 128 finished with value: 0.2941258100243827 and parameters: {'model_type': 'graphsage', 'hidden_dims': '[512, 256]', 'dropout': 0.10080446217438896, 'batch_norm': True, 'sage_aggr': 'max', 'sage_normalize': False, 'sage_project': False, 'lr': 2.4162589593698493e-05, 'weight_decay': 2.905198895179845e-06, 'epochs': 198, 'loss': 'mae', 'optimizer': 'adam', 'graph_mode': 'cutoff', 'cutoff': 0.8171639372934763, 'grm_norm': 'cosine_then_gcn', 'self_loops': False, 'use_snp_selection': False}. Best is trial 78 with value: 0.30253482888050814.
[I 2025-12-09 08:08:45,002] Trial 129 finished with value: 0.27462536305353147 and parameters: {'model_type': 'graphsage', 'hidden_dims': '[256, 128]', 'dropout': 0.14863335604310296, 'batch_norm': True, 'sage_aggr': 'max', 'sage_normalize': False, 'sage_project': False, 'lr': 2.0867401065793222e-05, 'weight_decay': 1.5436910306523469e-06, 'epochs': 298, 'loss': 'mae', 'optimizer': 'adam', 'graph_mode': 'cutoff', 'cutoff': 0.3675102294798861, 'grm_norm': 'cosine_then_gcn', 'self_loops': False, 'use_snp_selection': False}. Best is trial 78 with value: 0.30253482888050814.
[I 2025-12-09 08:10:05,781] Trial 130 finished with value: 0.282651550228926 and parameters: {'model_type': 'graphsage', 'hidden_dims': '[512, 64]', 'dropout': 0.21317093981231855, 'batch_norm': True, 'sage_aggr': 'max', 'sage_normalize': False, 'sage_project': False, 'lr': 1.3946936448955387e-05, 'weight_decay': 2.356188451357196e-06, 'epochs': 159, 'loss': 'mae', 'optimizer': 'adam', 'graph_mode': 'cutoff', 'cutoff': 0.5771843413448438, 'grm_norm': 'cosine_then_gcn', 'self_loops': False, 'use_snp_selection': False}. Best is trial 78 with value: 0.30253482888050814.
[I 2025-12-09 08:12:19,808] Trial 131 finished with value: 0.2935290413470047 and parameters: {'model_type': 'graphsage', 'hidden_dims': '[512, 256]', 'dropout': 0.19205028360758122, 'batch_norm': True, 'sage_aggr': 'max', 'sage_normalize': False, 'sage_project': False, 'lr': 2.648767785391973e-05, 'weight_decay': 3.6253825293891084e-06, 'epochs': 285, 'loss': 'mae', 'optimizer': 'adam', 'graph_mode': 'cutoff', 'cutoff': 0.5935198505852058, 'grm_norm': 'cosine_then_gcn', 'self_loops': False, 'use_snp_selection': False}. Best is trial 78 with value: 0.30253482888050814.
[I 2025-12-09 08:14:28,612] Trial 132 finished with value: 0.2970682331871997 and parameters: {'model_type': 'graphsage', 'hidden_dims': '[512, 256]', 'dropout': 0.2040574851565921, 'batch_norm': True, 'sage_aggr': 'max', 'sage_normalize': False, 'sage_project': False, 'lr': 2.301524050324373e-05, 'weight_decay': 4.440708179231644e-06, 'epochs': 264, 'loss': 'mae', 'optimizer': 'adam', 'graph_mode': 'cutoff', 'cutoff': 0.5612989316916558, 'grm_norm': 'cosine_then_gcn', 'self_loops': False, 'use_snp_selection': True, 'num_snps': 43774}. Best is trial 78 with value: 0.30253482888050814.
[I 2025-12-09 08:16:46,703] Trial 133 finished with value: 0.28729305818626527 and parameters: {'model_type': 'graphsage', 'hidden_dims': '[512, 256]', 'dropout': 0.20525409740157813, 'batch_norm': True, 'sage_aggr': 'max', 'sage_normalize': False, 'sage_project': False, 'lr': 1.851492074052603e-05, 'weight_decay': 1.0489308171790639e-07, 'epochs': 294, 'loss': 'mae', 'optimizer': 'adam', 'graph_mode': 'cutoff', 'cutoff': 0.5586126426999495, 'grm_norm': 'cosine_then_gcn', 'self_loops': False, 'use_snp_selection': True, 'num_snps': 43798}. Best is trial 78 with value: 0.30253482888050814.
[I 2025-12-09 08:18:36,984] Trial 134 finished with value: 0.29655598895680846 and parameters: {'model_type': 'graphsage', 'hidden_dims': '[512, 256]', 'dropout': 0.17169601088355138, 'batch_norm': True, 'sage_aggr': 'max', 'sage_normalize': False, 'sage_project': False, 'lr': 4.43838067344828e-05, 'weight_decay': 6.333627528657687e-06, 'epochs': 188, 'loss': 'mae', 'optimizer': 'adam', 'graph_mode': 'cutoff', 'cutoff': 0.5431719393687529, 'grm_norm': 'cosine_then_gcn', 'self_loops': False, 'use_snp_selection': True, 'num_snps': 47192}. Best is trial 78 with value: 0.30253482888050814.
[I 2025-12-09 08:20:39,885] Trial 135 finished with value: 0.2753913337410501 and parameters: {'model_type': 'graphsage', 'hidden_dims': '[512, 256]', 'dropout': 0.17218290493494476, 'batch_norm': True, 'sage_aggr': 'max', 'sage_normalize': False, 'sage_project': False, 'lr': 3.3496887703334396e-05, 'weight_decay': 6.810441649703735e-06, 'epochs': 186, 'loss': 'mae', 'optimizer': 'adam', 'graph_mode': 'cutoff', 'cutoff': 0.4971375783588721, 'grm_norm': 'cosine_then_gcn', 'self_loops': False, 'use_snp_selection': True, 'num_snps': 47009}. Best is trial 78 with value: 0.30253482888050814.
[I 2025-12-09 08:23:03,952] Trial 136 finished with value: 0.28576057323232534 and parameters: {'model_type': 'graphsage', 'hidden_dims': '[512, 256]', 'dropout': 0.18907355991126223, 'batch_norm': True, 'sage_aggr': 'max', 'sage_normalize': False, 'sage_project': False, 'lr': 4.57795671100318e-05, 'weight_decay': 1.0488300572683403e-05, 'epochs': 260, 'loss': 'mae', 'optimizer': 'adam', 'graph_mode': 'cutoff', 'cutoff': 0.5205331547770978, 'grm_norm': 'cosine_then_gcn', 'self_loops': False, 'use_snp_selection': True, 'num_snps': 48488}. Best is trial 78 with value: 0.30253482888050814.
[I 2025-12-09 08:24:59,518] Trial 137 finished with value: 0.2892173730446201 and parameters: {'model_type': 'graphsage', 'hidden_dims': '[512, 256]', 'dropout': 0.17967576964734797, 'batch_norm': True, 'sage_aggr': 'max', 'sage_normalize': False, 'sage_project': False, 'lr': 3.92934134892595e-05, 'weight_decay': 4.806194025707935e-06, 'epochs': 212, 'loss': 'mae', 'optimizer': 'adam', 'graph_mode': 'cutoff', 'cutoff': 0.5469778141596899, 'grm_norm': 'cosine_then_gcn', 'self_loops': False, 'use_snp_selection': True, 'num_snps': 45487}. Best is trial 78 with value: 0.30253482888050814.
[I 2025-12-09 08:27:55,616] Trial 138 finished with value: 0.25271492462480366 and parameters: {'model_type': 'graphsage', 'hidden_dims': '[512, 256]', 'dropout': 0.20149140084782524, 'batch_norm': True, 'sage_aggr': 'max', 'sage_normalize': False, 'sage_project': False, 'lr': 3.0286724082458852e-05, 'weight_decay': 8.05371099234638e-06, 'epochs': 206, 'loss': 'mae', 'optimizer': 'adam', 'graph_mode': 'knn', 'knn_k': 6, 'weighted_edges': False, 'symmetrize_mode': 'union', 'self_loops': False, 'use_snp_selection': True, 'num_snps': 38251}. Best is trial 78 with value: 0.30253482888050814.
[I 2025-12-09 08:28:56,151] Trial 139 finished with value: 0.30026193302347154 and parameters: {'model_type': 'graphsage', 'hidden_dims': '[512, 256]', 'dropout': 0.22343878274717063, 'batch_norm': True, 'sage_aggr': 'max', 'sage_normalize': False, 'sage_project': False, 'lr': 2.4423349316495048e-05, 'weight_decay': 5.638995163089458e-06, 'epochs': 66, 'loss': 'mae', 'optimizer': 'adam', 'graph_mode': 'cutoff', 'cutoff': 0.6722745445038383, 'grm_norm': 'none', 'self_loops': False, 'use_snp_selection': True, 'num_snps': 43098}. Best is trial 78 with value: 0.30253482888050814.
[I 2025-12-09 08:29:56,301] Trial 140 finished with value: 0.2854100296182218 and parameters: {'model_type': 'graphsage', 'hidden_dims': '[128, 64]', 'dropout': 0.22707798771497306, 'batch_norm': True, 'sage_aggr': 'max', 'sage_normalize': False, 'sage_project': False, 'lr': 2.4195269924772402e-05, 'weight_decay': 5.415742818324448e-06, 'epochs': 177, 'loss': 'mae', 'optimizer': 'adam', 'graph_mode': 'cutoff', 'cutoff': 0.6977560837114818, 'grm_norm': 'none', 'self_loops': False, 'use_snp_selection': True, 'num_snps': 42830}. Best is trial 78 with value: 0.30253482888050814.
[I 2025-12-09 08:30:54,991] Trial 141 finished with value: 0.28860446873154416 and parameters: {'model_type': 'graphsage', 'hidden_dims': '[512, 256]', 'dropout': 0.21310205023042775, 'batch_norm': True, 'sage_aggr': 'max', 'sage_normalize': False, 'sage_project': False, 'lr': 2.147425256351929e-05, 'weight_decay': 6.145422712622113e-06, 'epochs': 67, 'loss': 'mae', 'optimizer': 'adam', 'graph_mode': 'cutoff', 'cutoff': 0.6714342557654722, 'grm_norm': 'none', 'self_loops': False, 'use_snp_selection': True, 'num_snps': 41473}. Best is trial 78 with value: 0.30253482888050814.
[I 2025-12-09 08:31:55,288] Trial 142 finished with value: 0.2934757250151051 and parameters: {'model_type': 'graphsage', 'hidden_dims': '[512, 256]', 'dropout': 0.16305259185978294, 'batch_norm': True, 'sage_aggr': 'max', 'sage_normalize': False, 'sage_project': False, 'lr': 3.560235700579445e-05, 'weight_decay': 4.391048523605039e-06, 'epochs': 61, 'loss': 'mae', 'optimizer': 'adam', 'graph_mode': 'cutoff', 'cutoff': 0.6178151445750757, 'grm_norm': 'none', 'self_loops': False, 'use_snp_selection': True, 'num_snps': 44831}. Best is trial 78 with value: 0.30253482888050814.
[I 2025-12-09 08:34:08,075] Trial 143 finished with value: 0.2868509730008072 and parameters: {'model_type': 'graphsage', 'hidden_dims': '[512, 256]', 'dropout': 0.20066639460413063, 'batch_norm': True, 'sage_aggr': 'max', 'sage_normalize': False, 'sage_project': False, 'lr': 2.786380975605846e-05, 'weight_decay': 2.860199384712297e-06, 'epochs': 166, 'loss': 'mae', 'optimizer': 'adam', 'graph_mode': 'cutoff', 'cutoff': 0.4758822354638611, 'grm_norm': 'none', 'self_loops': False, 'use_snp_selection': True, 'num_snps': 51653}. Best is trial 78 with value: 0.30253482888050814.
[I 2025-12-09 08:35:38,835] Trial 144 finished with value: 0.2970894459733019 and parameters: {'model_type': 'graphsage', 'hidden_dims': '[512, 256]', 'dropout': 0.24826990923939404, 'batch_norm': True, 'sage_aggr': 'max', 'sage_normalize': False, 'sage_project': False, 'lr': 2.5201671413328023e-05, 'weight_decay': 4.060434870496649e-06, 'epochs': 185, 'loss': 'mae', 'optimizer': 'adam', 'graph_mode': 'cutoff', 'cutoff': 0.6384067440937078, 'grm_norm': 'cosine_then_gcn', 'self_loops': False, 'use_snp_selection': True, 'num_snps': 39633}. Best is trial 78 with value: 0.30253482888050814.
[I 2025-12-09 08:37:08,892] Trial 145 finished with value: 0.28795823432202156 and parameters: {'model_type': 'graphsage', 'hidden_dims': '[512, 256]', 'dropout': 0.2527415853973595, 'batch_norm': True, 'sage_aggr': 'max', 'sage_normalize': False, 'sage_project': False, 'lr': 0.0011659706292606548, 'weight_decay': 8.030951397766544e-06, 'epochs': 189, 'loss': 'mae', 'optimizer': 'adam', 'graph_mode': 'cutoff', 'cutoff': 0.6544916570051104, 'grm_norm': 'cosine_then_gcn', 'self_loops': False, 'use_snp_selection': True, 'num_snps': 38565}. Best is trial 78 with value: 0.30253482888050814.
[I 2025-12-09 08:38:48,113] Trial 146 finished with value: 0.2891947834451603 and parameters: {'model_type': 'graphsage', 'hidden_dims': '[512, 256]', 'dropout': 0.2276555329945607, 'batch_norm': True, 'sage_aggr': 'max', 'sage_normalize': False, 'sage_project': False, 'lr': 2.5095100541573805e-05, 'weight_decay': 4.159503457168245e-06, 'epochs': 182, 'loss': 'mae', 'optimizer': 'adam', 'graph_mode': 'cutoff', 'cutoff': 0.5650053267852594, 'grm_norm': 'cosine_then_gcn', 'self_loops': False, 'use_snp_selection': True, 'num_snps': 43515}. Best is trial 78 with value: 0.30253482888050814.
[I 2025-12-09 08:40:04,327] Trial 147 finished with value: 0.2864830260615728 and parameters: {'model_type': 'graphsage', 'hidden_dims': '[512, 256]', 'dropout': 0.21846694141629877, 'batch_norm': False, 'sage_aggr': 'max', 'sage_normalize': False, 'sage_project': False, 'lr': 2.035389021231237e-05, 'weight_decay': 6.303765980080745e-06, 'epochs': 168, 'loss': 'mae', 'optimizer': 'adam', 'graph_mode': 'cutoff', 'cutoff': 0.7065651745514091, 'grm_norm': 'cosine_then_gcn', 'self_loops': False, 'use_snp_selection': True, 'num_snps': 33914}. Best is trial 78 with value: 0.30253482888050814.
[I 2025-12-09 08:41:52,194] Trial 148 finished with value: 0.28867716150638717 and parameters: {'model_type': 'graphsage', 'hidden_dims': '[512, 256]', 'dropout': 0.18819874544524873, 'batch_norm': True, 'sage_aggr': 'max', 'sage_normalize': False, 'sage_project': False, 'lr': 3.213830542250098e-05, 'weight_decay': 3.383678904251415e-06, 'epochs': 199, 'loss': 'mae', 'optimizer': 'adam', 'graph_mode': 'cutoff', 'cutoff': 0.6413174074525874, 'grm_norm': 'none', 'self_loops': False, 'use_snp_selection': True, 'num_snps': 46365}. Best is trial 78 with value: 0.30253482888050814.
[I 2025-12-09 08:43:34,026] Trial 149 finished with value: 0.2867741376460137 and parameters: {'model_type': 'graphsage', 'hidden_dims': '[512, 128]', 'dropout': 0.24345395109726042, 'batch_norm': True, 'sage_aggr': 'max', 'sage_normalize': False, 'sage_project': False, 'lr': 1.5487396531744705e-05, 'weight_decay': 1.0413537713198935e-05, 'epochs': 154, 'loss': 'mae', 'optimizer': 'adam', 'graph_mode': 'cutoff', 'cutoff': 0.5372999340920832, 'grm_norm': 'cosine_then_gcn', 'self_loops': False, 'use_snp_selection': True, 'num_snps': 48942}. Best is trial 78 with value: 0.30253482888050814.
[I 2025-12-09 08:45:13,721] Trial 0 finished with value: 0.260979477270608 and parameters: {'model_type': 'graphsage', 'hidden_dims': '[128, 64]', 'dropout': 0.199031432379812, 'batch_norm': True, 'sage_aggr': 'max', 'sage_normalize': True, 'sage_project': False, 'lr': 0.00034401453323286885, 'weight_decay': 0.00017802616915745114, 'epochs': 230, 'loss': 'mse', 'optimizer': 'adam', 'graph_mode': 'knn', 'knn_k': 6, 'weighted_edges': True, 'symmetrize_mode': 'mutual', 'self_loops': True, 'use_snp_selection': False}. Best is trial 0 with value: 0.260979477270608.
[I 2025-12-09 08:46:59,841] Trial 1 finished with value: 0.2741733020951151 and parameters: {'model_type': 'graphsage', 'hidden_dims': '[512, 128]', 'dropout': 0.2503500283181017, 'batch_norm': False, 'sage_aggr': 'max', 'sage_normalize': False, 'sage_project': False, 'lr': 3.952233718592099e-05, 'weight_decay': 0.00026754769258252603, 'epochs': 149, 'loss': 'mse', 'optimizer': 'adam', 'graph_mode': 'knn', 'knn_k': 2, 'weighted_edges': False, 'symmetrize_mode': 'mutual', 'self_loops': True, 'use_snp_selection': True, 'num_snps': 49915}. Best is trial 1 with value: 0.2741733020951151.
[I 2025-12-09 08:48:19,987] Trial 2 finished with value: 0.28298274318703115 and parameters: {'model_type': 'graphsage', 'hidden_dims': '[512, 256]', 'dropout': 0.2785908793172681, 'batch_norm': False, 'sage_aggr': 'max', 'sage_normalize': False, 'sage_project': False, 'lr': 8.806039223165805e-05, 'weight_decay': 3.5153176302760294e-05, 'epochs': 147, 'loss': 'mae', 'optimizer': 'adam', 'graph_mode': 'cutoff', 'cutoff': 0.4922564006874869, 'grm_norm': 'gcn', 'self_loops': False, 'use_snp_selection': True, 'num_snps': 34340}. Best is trial 2 with value: 0.28298274318703115.
[I 2025-12-09 08:49:37,710] Trial 3 finished with value: 0.2752692200744327 and parameters: {'model_type': 'graphsage', 'hidden_dims': '[256, 128, 64]', 'dropout': 0.3475243154412272, 'batch_norm': True, 'sage_aggr': 'max', 'sage_normalize': False, 'sage_project': False, 'lr': 1.6006331996938085e-05, 'weight_decay': 7.213121225589906e-06, 'epochs': 283, 'loss': 'mse', 'optimizer': 'adam', 'graph_mode': 'cutoff', 'cutoff': 0.5942334791449215, 'grm_norm': 'none', 'self_loops': True, 'use_snp_selection': False}. Best is trial 2 with value: 0.28298274318703115.
[I 2025-12-09 08:50:21,272] Trial 4 finished with value: 0.25475667803711266 and parameters: {'model_type': 'graphsage', 'hidden_dims': '[128, 64]', 'dropout': 0.3348926467202472, 'batch_norm': True, 'sage_aggr': 'max', 'sage_normalize': False, 'sage_project': False, 'lr': 0.0004238630400638802, 'weight_decay': 8.074086040046576e-07, 'epochs': 158, 'loss': 'mae', 'optimizer': 'adam', 'graph_mode': 'knn', 'knn_k': 1, 'weighted_edges': False, 'symmetrize_mode': 'mutual', 'self_loops': False, 'use_snp_selection': True, 'num_snps': 26850}. Best is trial 2 with value: 0.28298274318703115.
[I 2025-12-09 08:52:15,591] Trial 5 finished with value: 0.24719951247978833 and parameters: {'model_type': 'graphsage', 'hidden_dims': '[512, 64]', 'dropout': 0.14505336736221927, 'batch_norm': True, 'sage_aggr': 'mean', 'sage_normalize': True, 'sage_project': False, 'lr': 1.2962030165732234e-05, 'weight_decay': 1.326598071105465e-07, 'epochs': 180, 'loss': 'mse', 'optimizer': 'adam', 'graph_mode': 'knn', 'knn_k': 9, 'weighted_edges': True, 'symmetrize_mode': 'mutual', 'self_loops': False, 'use_snp_selection': False}. Best is trial 2 with value: 0.28298274318703115.
[I 2025-12-09 08:53:10,364] Trial 6 finished with value: 0.27193494094412146 and parameters: {'model_type': 'graphsage', 'hidden_dims': '[256, 128, 64]', 'dropout': 0.10731743755162496, 'batch_norm': True, 'sage_aggr': 'mean', 'sage_normalize': False, 'sage_project': False, 'lr': 1.922990426933137e-05, 'weight_decay': 7.30001060446905e-05, 'epochs': 63, 'loss': 'mae', 'optimizer': 'adam', 'graph_mode': 'cutoff', 'cutoff': 0.7624978434202536, 'grm_norm': 'none', 'self_loops': True, 'use_snp_selection': True, 'num_snps': 50106}. Best is trial 2 with value: 0.28298274318703115.
