[I 2025-12-10 04:04:40,759] Trial 141 finished with value: 0.3647865574763192 and parameters: {'model_type': 'graphsage', 'hidden_dims': '[256, 128, 64]', 'dropout': 0.2078333830091048, 'batch_norm': False, 'sage_aggr': 'mean', 'sage_normalize': False, 'sage_project': False, 'lr': 0.00021393888847515564, 'weight_decay': 2.1952003884183323e-07, 'epochs': 64, 'loss': 'mae', 'optimizer': 'adam', 'graph_mode': 'cutoff', 'cutoff': 0.6129141446823656, 'grm_norm': 'cosine', 'self_loops': False, 'use_snp_selection': True, 'num_snps': 32818}. Best is trial 132 with value: 0.37916936401711226.
[I 2025-12-10 04:05:04,917] Trial 142 finished with value: 0.3629295563088867 and parameters: {'model_type': 'graphsage', 'hidden_dims': '[256, 128, 64]', 'dropout': 0.1817815055614192, 'batch_norm': False, 'sage_aggr': 'mean', 'sage_normalize': False, 'sage_project': False, 'lr': 0.0001838343454058745, 'weight_decay': 2.2908263807189433e-07, 'epochs': 77, 'loss': 'mae', 'optimizer': 'adam', 'graph_mode': 'cutoff', 'cutoff': 0.6856592148767773, 'grm_norm': 'cosine', 'self_loops': False, 'use_snp_selection': True, 'num_snps': 29886}. Best is trial 132 with value: 0.37916936401711226.
[I 2025-12-10 04:05:30,416] Trial 143 finished with value: 0.3690118973068523 and parameters: {'model_type': 'graphsage', 'hidden_dims': '[256, 128, 64]', 'dropout': 0.20465454403238711, 'batch_norm': False, 'sage_aggr': 'mean', 'sage_normalize': False, 'sage_project': False, 'lr': 0.0002810610819404448, 'weight_decay': 1.1678561168998223e-07, 'epochs': 68, 'loss': 'mae', 'optimizer': 'adam', 'graph_mode': 'cutoff', 'cutoff': 0.6213518543201954, 'grm_norm': 'cosine', 'self_loops': False, 'use_snp_selection': True, 'num_snps': 34642}. Best is trial 132 with value: 0.37916936401711226.
[I 2025-12-10 04:05:52,074] Trial 144 finished with value: 0.37125922160490227 and parameters: {'model_type': 'graphsage', 'hidden_dims': '[256, 128, 64]', 'dropout': 0.15813380497528126, 'batch_norm': False, 'sage_aggr': 'mean', 'sage_normalize': False, 'sage_project': False, 'lr': 0.00010677736334934119, 'weight_decay': 1.4553522963598275e-07, 'epochs': 54, 'loss': 'mae', 'optimizer': 'adam', 'graph_mode': 'cutoff', 'cutoff': 0.6374118455174664, 'grm_norm': 'cosine', 'self_loops': False, 'use_snp_selection': True, 'num_snps': 31285}. Best is trial 132 with value: 0.37916936401711226.
[I 2025-12-10 04:06:22,034] Trial 145 finished with value: 0.3542542569822286 and parameters: {'model_type': 'graphsage', 'hidden_dims': '[128, 64]', 'dropout': 0.1658305868811158, 'batch_norm': False, 'sage_aggr': 'mean', 'sage_normalize': False, 'sage_project': False, 'lr': 9.242247220928197e-05, 'weight_decay': 1.5804149021818675e-07, 'epochs': 55, 'loss': 'mae', 'optimizer': 'adam', 'graph_mode': 'cutoff', 'cutoff': 0.6391069199922785, 'grm_norm': 'cosine', 'self_loops': False, 'use_snp_selection': True, 'num_snps': 59871}. Best is trial 132 with value: 0.37916936401711226.
[I 2025-12-10 04:06:42,669] Trial 146 finished with value: 0.3691281864389021 and parameters: {'model_type': 'graphsage', 'hidden_dims': '[256, 128, 64]', 'dropout': 0.15624947509110662, 'batch_norm': False, 'sage_aggr': 'mean', 'sage_normalize': False, 'sage_project': False, 'lr': 0.00011174510191869592, 'weight_decay': 1.20381054272488e-07, 'epochs': 49, 'loss': 'mae', 'optimizer': 'adam', 'graph_mode': 'cutoff', 'cutoff': 0.5980329773202773, 'grm_norm': 'cosine', 'self_loops': False, 'use_snp_selection': True, 'num_snps': 30773}. Best is trial 132 with value: 0.37916936401711226.
[I 2025-12-10 04:07:02,821] Trial 147 finished with value: 0.3638963745018107 and parameters: {'model_type': 'graphsage', 'hidden_dims': '[256, 128]', 'dropout': 0.1370656539823832, 'batch_norm': False, 'sage_aggr': 'mean', 'sage_normalize': False, 'sage_project': False, 'lr': 0.0001648547052477243, 'weight_decay': 1.6909756121527222e-07, 'epochs': 59, 'loss': 'mae', 'optimizer': 'adam', 'graph_mode': 'cutoff', 'cutoff': 0.6923694999664812, 'grm_norm': 'cosine', 'self_loops': False, 'use_snp_selection': True, 'num_snps': 26851}. Best is trial 132 with value: 0.37916936401711226.
[I 2025-12-10 04:07:24,872] Trial 148 finished with value: 0.37381574151559044 and parameters: {'model_type': 'graphsage', 'hidden_dims': '[128, 64]', 'dropout': 0.18627498674265883, 'batch_norm': False, 'sage_aggr': 'mean', 'sage_normalize': False, 'sage_project': False, 'lr': 0.00010623183644919002, 'weight_decay': 3.5705399324970247e-07, 'epochs': 93, 'loss': 'mae', 'optimizer': 'adam', 'graph_mode': 'cutoff', 'cutoff': 0.5362793851444466, 'grm_norm': 'cosine', 'self_loops': False, 'use_snp_selection': True, 'num_snps': 28359}. Best is trial 132 with value: 0.37916936401711226.
[I 2025-12-10 04:07:49,061] Trial 149 finished with value: 0.3475633526716302 and parameters: {'model_type': 'graphsage', 'hidden_dims': '[128, 64]', 'dropout': 0.18789100424966135, 'batch_norm': False, 'sage_aggr': 'mean', 'sage_normalize': False, 'sage_project': False, 'lr': 6.41972763986604e-05, 'weight_decay': 4.111410735423646e-07, 'epochs': 93, 'loss': 'mae', 'optimizer': 'adam', 'graph_mode': 'knn', 'knn_k': 4, 'weighted_edges': True, 'symmetrize_mode': 'mutual', 'self_loops': False, 'use_snp_selection': True, 'num_snps': 28449}. Best is trial 132 with value: 0.37916936401711226.
