[I 2025-12-05 23:08:22,619] Trial 47 finished with value: 0.17097484115531728 and parameters: {'model_type': 'graphsage', 'hidden_dims': '[512, 128]', 'dropout': 0.2927531466325934, 'batch_norm': True, 'sage_aggr': 'max', 'sage_normalize': False, 'sage_project': False, 'lr': 0.00036814235380530527, 'weight_decay': 0.00027154524811199725, 'epochs': 173, 'loss': 'mae', 'optimizer': 'adam', 'graph_mode': 'knn', 'knn_k': 3, 'weighted_edges': False, 'symmetrize_mode': 'union', 'self_loops': False, 'use_snp_selection': False, 'graphsage_batch_size': 128}. Best is trial 46 with value: 0.21947898140693073.
[I 2025-12-05 23:09:01,489] Trial 48 finished with value: 0.21108308977871754 and parameters: {'model_type': 'graphsage', 'hidden_dims': '[512, 128]', 'dropout': 0.33808336243704706, 'batch_norm': True, 'sage_aggr': 'max', 'sage_normalize': True, 'sage_project': False, 'lr': 0.00022727824033393353, 'weight_decay': 1.655061025603067e-07, 'epochs': 181, 'loss': 'mse', 'optimizer': 'adam', 'graph_mode': 'cutoff', 'cutoff': 0.8075778302781318, 'grm_norm': 'cosine_then_gcn', 'self_loops': False, 'use_snp_selection': True, 'num_snps': 13576, 'graphsage_batch_size': 128}. Best is trial 46 with value: 0.21947898140693073.
[I 2025-12-05 23:09:27,109] Trial 49 finished with value: 0.08688374141639951 and parameters: {'model_type': 'graphsage', 'hidden_dims': '[512, 128]', 'dropout': 0.13919397989091056, 'batch_norm': False, 'sage_aggr': 'max', 'sage_normalize': True, 'sage_project': False, 'lr': 1.0685839803828317e-06, 'weight_decay': 3.5573474813339114e-06, 'epochs': 107, 'loss': 'mae', 'optimizer': 'adam', 'graph_mode': 'cutoff', 'cutoff': 0.2992229769347044, 'grm_norm': 'cosine_then_gcn', 'self_loops': False, 'use_snp_selection': True, 'num_snps': 5837, 'graphsage_batch_size': 128}. Best is trial 46 with value: 0.21947898140693073.
[I 2025-12-05 23:11:04,680] Trial 50 finished with value: 0.195582850037305 and parameters: {'model_type': 'graphsage', 'hidden_dims': '[512, 128]', 'dropout': 0.3803555760006291, 'batch_norm': True, 'sage_aggr': 'max', 'sage_normalize': True, 'sage_project': False, 'lr': 0.0005985845656335777, 'weight_decay': 0.0001345355654433942, 'epochs': 159, 'loss': 'mae', 'optimizer': 'adam', 'graph_mode': 'cutoff', 'cutoff': 0.852069350407504, 'grm_norm': 'cosine_then_gcn', 'self_loops': False, 'use_snp_selection': False, 'graphsage_batch_size': 128}. Best is trial 46 with value: 0.21947898140693073.
[I 2025-12-05 23:11:54,033] Trial 51 finished with value: 0.20570223935538015 and parameters: {'model_type': 'graphsage', 'hidden_dims': '[512, 128]', 'dropout': 0.3148206270012644, 'batch_norm': True, 'sage_aggr': 'max', 'sage_normalize': True, 'sage_project': False, 'lr': 0.0001275532409554423, 'weight_decay': 0.0001041147894308477, 'epochs': 201, 'loss': 'mae', 'optimizer': 'adam', 'graph_mode': 'cutoff', 'cutoff': 0.730549197769675, 'grm_norm': 'none', 'self_loops': False, 'use_snp_selection': True, 'num_snps': 17829, 'graphsage_batch_size': 128}. Best is trial 46 with value: 0.21947898140693073.
[I 2025-12-05 23:12:28,194] Trial 52 finished with value: 0.2164561308440848 and parameters: {'model_type': 'graphsage', 'hidden_dims': '[512, 128]', 'dropout': 0.2669339850080556, 'batch_norm': True, 'sage_aggr': 'mean', 'sage_normalize': True, 'sage_project': False, 'lr': 8.611768659858565e-05, 'weight_decay': 5.786890129478255e-05, 'epochs': 180, 'loss': 'mae', 'optimizer': 'adam', 'graph_mode': 'cutoff', 'cutoff': 0.7789491069581989, 'grm_norm': 'gcn', 'self_loops': False, 'use_snp_selection': True, 'num_snps': 10922, 'graphsage_batch_size': 64}. Best is trial 46 with value: 0.21947898140693073.
[I 2025-12-05 23:13:03,139] Trial 53 finished with value: 0.21947581165115518 and parameters: {'model_type': 'graphsage', 'hidden_dims': '[256, 128, 64]', 'dropout': 0.4167462415389438, 'batch_norm': True, 'sage_aggr': 'mean', 'sage_normalize': True, 'sage_project': False, 'lr': 0.00019477419236895357, 'weight_decay': 2.8169187258618823e-05, 'epochs': 214, 'loss': 'mae', 'optimizer': 'adam', 'graph_mode': 'cutoff', 'cutoff': 0.8348474947351484, 'grm_norm': 'cosine_then_gcn', 'self_loops': False, 'use_snp_selection': True, 'num_snps': 14330, 'graphsage_batch_size': 16}. Best is trial 46 with value: 0.21947898140693073.
[I 2025-12-05 23:13:36,028] Trial 54 finished with value: 0.21795941384232992 and parameters: {'model_type': 'graphsage', 'hidden_dims': '[256, 128, 64]', 'dropout': 0.42106447589785173, 'batch_norm': True, 'sage_aggr': 'mean', 'sage_normalize': True, 'sage_project': False, 'lr': 0.0003103989222740892, 'weight_decay': 1.5373520863725415e-05, 'epochs': 213, 'loss': 'mae', 'optimizer': 'adam', 'graph_mode': 'cutoff', 'cutoff': 0.8453660299805591, 'grm_norm': 'cosine_then_gcn', 'self_loops': False, 'use_snp_selection': True, 'num_snps': 13769, 'graphsage_batch_size': 16}. Best is trial 46 with value: 0.21947898140693073.
[I 2025-12-05 23:14:00,475] Trial 55 finished with value: 0.20570639787177475 and parameters: {'model_type': 'graphsage', 'hidden_dims': '[256, 128, 64]', 'dropout': 0.41851642807605627, 'batch_norm': True, 'sage_aggr': 'mean', 'sage_normalize': True, 'sage_project': False, 'lr': 0.0009700802939925482, 'weight_decay': 1.5511732587208396e-05, 'epochs': 213, 'loss': 'mae', 'optimizer': 'adam', 'graph_mode': 'cutoff', 'cutoff': 0.8405964799070735, 'grm_norm': 'cosine_then_gcn', 'self_loops': False, 'use_snp_selection': True, 'num_snps': 6880, 'graphsage_batch_size': 16}. Best is trial 46 with value: 0.21947898140693073.
[I 2025-12-05 23:14:34,690] Trial 56 finished with value: 0.21619492103615262 and parameters: {'model_type': 'graphsage', 'hidden_dims': '[256, 128, 64]', 'dropout': 0.36670660522135334, 'batch_norm': True, 'sage_aggr': 'max', 'sage_normalize': True, 'sage_project': False, 'lr': 0.00030233534113616054, 'weight_decay': 2.6450583392868996e-05, 'epochs': 215, 'loss': 'mae', 'optimizer': 'adam', 'graph_mode': 'cutoff', 'cutoff': 0.8729230528484344, 'grm_norm': 'cosine_then_gcn', 'self_loops': False, 'use_snp_selection': True, 'num_snps': 14264, 'graphsage_batch_size': 16}. Best is trial 46 with value: 0.21947898140693073.
[I 2025-12-05 23:15:00,357] Trial 57 finished with value: 0.20966532590087605 and parameters: {'model_type': 'graphsage', 'hidden_dims': '[256, 128, 64]', 'dropout': 0.4994926090448301, 'batch_norm': True, 'sage_aggr': 'mean', 'sage_normalize': False, 'sage_project': False, 'lr': 0.00017930562877084053, 'weight_decay': 6.177929813335272e-06, 'epochs': 61, 'loss': 'mae', 'optimizer': 'adam', 'graph_mode': 'cutoff', 'cutoff': 0.8215471706410074, 'grm_norm': 'cosine_then_gcn', 'self_loops': False, 'use_snp_selection': True, 'num_snps': 22196, 'graphsage_batch_size': 16}. Best is trial 46 with value: 0.21947898140693073.
[I 2025-12-05 23:15:36,134] Trial 58 finished with value: 0.18485098705218264 and parameters: {'model_type': 'graphsage', 'hidden_dims': '[256, 128, 64]', 'dropout': 0.39585533671154394, 'batch_norm': True, 'sage_aggr': 'mean', 'sage_normalize': True, 'sage_project': False, 'lr': 0.00042904296609116885, 'weight_decay': 3.224197479915365e-05, 'epochs': 230, 'loss': 'mae', 'optimizer': 'adam', 'graph_mode': 'knn', 'knn_k': 10, 'weighted_edges': True, 'symmetrize_mode': 'mutual', 'self_loops': False, 'use_snp_selection': True, 'num_snps': 8896, 'graphsage_batch_size': 16}. Best is trial 46 with value: 0.21947898140693073.
[I 2025-12-05 23:15:57,425] Trial 59 finished with value: 0.17673386451608297 and parameters: {'model_type': 'graphsage', 'hidden_dims': '[256, 128, 64]', 'dropout': 0.4179673807900239, 'batch_norm': True, 'sage_aggr': 'mean', 'sage_normalize': True, 'sage_project': False, 'lr': 0.0001432133786499361, 'weight_decay': 5.26168048092605e-05, 'epochs': 195, 'loss': 'mae', 'optimizer': 'adam', 'graph_mode': 'cutoff', 'cutoff': 0.8997014570118295, 'grm_norm': 'cosine_then_gcn', 'self_loops': False, 'use_snp_selection': True, 'num_snps': 4607, 'graphsage_batch_size': 16}. Best is trial 46 with value: 0.21947898140693073.
[I 2025-12-05 23:16:30,647] Trial 60 finished with value: 0.20351694155156616 and parameters: {'model_type': 'graphsage', 'hidden_dims': '[256, 128, 64]', 'dropout': 0.518650032969482, 'batch_norm': True, 'sage_aggr': 'mean', 'sage_normalize': True, 'sage_project': False, 'lr': 0.0002004187281622388, 'weight_decay': 1.3591655841070968e-05, 'epochs': 243, 'loss': 'mae', 'optimizer': 'adam', 'graph_mode': 'cutoff', 'cutoff': 0.8649877843810381, 'grm_norm': 'cosine_then_gcn', 'self_loops': False, 'use_snp_selection': True, 'num_snps': 12155, 'graphsage_batch_size': 16}. Best is trial 46 with value: 0.21947898140693073.
[I 2025-12-05 23:17:04,390] Trial 61 finished with value: 0.21029419305345792 and parameters: {'model_type': 'graphsage', 'hidden_dims': '[256, 128, 64]', 'dropout': 0.329194840706648, 'batch_norm': True, 'sage_aggr': 'mean', 'sage_normalize': True, 'sage_project': False, 'lr': 0.0003088232224314178, 'weight_decay': 1.0262370251550992e-05, 'epochs': 186, 'loss': 'mae', 'optimizer': 'adam', 'graph_mode': 'cutoff', 'cutoff': 0.5945582138716636, 'grm_norm': 'none', 'self_loops': False, 'use_snp_selection': True, 'num_snps': 16160, 'graphsage_batch_size': 64}. Best is trial 46 with value: 0.21947898140693073.
[I 2025-12-05 23:17:34,980] Trial 62 finished with value: 0.2157296007775517 and parameters: {'model_type': 'graphsage', 'hidden_dims': '[128, 64]', 'dropout': 0.2904429209773579, 'batch_norm': True, 'sage_aggr': 'mean', 'sage_normalize': True, 'sage_project': False, 'lr': 0.0005374837328265863, 'weight_decay': 2.2706251063973037e-05, 'epochs': 206, 'loss': 'mae', 'optimizer': 'adam', 'graph_mode': 'cutoff', 'cutoff': 0.7882555227167626, 'grm_norm': 'cosine_then_gcn', 'self_loops': False, 'use_snp_selection': True, 'num_snps': 19829, 'graphsage_batch_size': 32}. Best is trial 46 with value: 0.21947898140693073.
[I 2025-12-05 23:18:19,560] Trial 63 finished with value: 0.21681667984136452 and parameters: {'model_type': 'graphsage', 'hidden_dims': '[512, 64]', 'dropout': 0.34937513192124753, 'batch_norm': True, 'sage_aggr': 'mean', 'sage_normalize': True, 'sage_project': False, 'lr': 9.743152721790645e-05, 'weight_decay': 0.0006936524724007834, 'epochs': 195, 'loss': 'mae', 'optimizer': 'adam', 'graph_mode': 'cutoff', 'cutoff': 0.5631519935613747, 'grm_norm': 'cosine_then_gcn', 'self_loops': False, 'use_snp_selection': True, 'num_snps': 14871, 'graphsage_batch_size': 128}. Best is trial 46 with value: 0.21947898140693073.
[I 2025-12-05 23:18:47,412] Trial 64 finished with value: 0.2214064926342149 and parameters: {'model_type': 'graphsage', 'hidden_dims': '[256, 128]', 'dropout': 0.3790285910623375, 'batch_norm': True, 'sage_aggr': 'mean', 'sage_normalize': True, 'sage_project': False, 'lr': 0.00013068582822722526, 'weight_decay': 4.173057529241992e-05, 'epochs': 217, 'loss': 'mae', 'optimizer': 'adam', 'graph_mode': 'cutoff', 'cutoff': 0.70026548873334, 'grm_norm': 'cosine_then_gcn', 'self_loops': False, 'use_snp_selection': True, 'num_snps': 9811, 'graphsage_batch_size': 64}. Best is trial 64 with value: 0.2214064926342149.
[I 2025-12-05 23:19:06,705] Trial 65 finished with value: 0.14932684357615428 and parameters: {'model_type': 'graphsage', 'hidden_dims': '[256, 128]', 'dropout': 0.3795430577433181, 'batch_norm': True, 'sage_aggr': 'mean', 'sage_normalize': True, 'sage_project': False, 'lr': 0.00013141755039634714, 'weight_decay': 3.850938693049944e-05, 'epochs': 219, 'loss': 'mae', 'optimizer': 'adam', 'graph_mode': 'cutoff', 'cutoff': 0.6946471228560901, 'grm_norm': 'cosine_then_gcn', 'self_loops': False, 'use_snp_selection': True, 'num_snps': 2549, 'graphsage_batch_size': 16}. Best is trial 64 with value: 0.2214064926342149.
[I 2025-12-05 23:19:34,578] Trial 66 finished with value: 0.2290281524546119 and parameters: {'model_type': 'graphsage', 'hidden_dims': '[256, 128]', 'dropout': 0.45396830734257054, 'batch_norm': True, 'sage_aggr': 'mean', 'sage_normalize': True, 'sage_project': False, 'lr': 0.0003492383611229481, 'weight_decay': 7.116731683070763e-05, 'epochs': 230, 'loss': 'mae', 'optimizer': 'adam', 'graph_mode': 'cutoff', 'cutoff': 0.7339492433230305, 'grm_norm': 'cosine_then_gcn', 'self_loops': False, 'use_snp_selection': True, 'num_snps': 9234, 'graphsage_batch_size': 64}. Best is trial 66 with value: 0.2290281524546119.
[I 2025-12-05 23:20:54,799] Trial 67 finished with value: 0.19860575093339783 and parameters: {'model_type': 'graphsage', 'hidden_dims': '[256, 128]', 'dropout': 0.44901957334923315, 'batch_norm': True, 'sage_aggr': 'mean', 'sage_normalize': True, 'sage_project': False, 'lr': 0.0002126550187283894, 'weight_decay': 6.938140675570841e-05, 'epochs': 231, 'loss': 'mae', 'optimizer': 'adam', 'graph_mode': 'cutoff', 'cutoff': 0.7393967221150605, 'grm_norm': 'cosine_then_gcn', 'self_loops': False, 'use_snp_selection': False, 'graphsage_batch_size': 64}. Best is trial 66 with value: 0.2290281524546119.
[I 2025-12-05 23:21:20,510] Trial 68 finished with value: 0.20041238202632003 and parameters: {'model_type': 'graphsage', 'hidden_dims': '[256, 128]', 'dropout': 0.4904061344624336, 'batch_norm': False, 'sage_aggr': 'max', 'sage_normalize': True, 'sage_project': False, 'lr': 0.0001091209742440816, 'weight_decay': 0.00016392899189655272, 'epochs': 243, 'loss': 'mse', 'optimizer': 'adam', 'graph_mode': 'cutoff', 'cutoff': 0.6591987339458025, 'grm_norm': 'none', 'self_loops': False, 'use_snp_selection': True, 'num_snps': 7543, 'graphsage_batch_size': 64}. Best is trial 66 with value: 0.2290281524546119.
[I 2025-12-05 23:21:50,887] Trial 69 finished with value: 0.2287786325080277 and parameters: {'model_type': 'graphsage', 'hidden_dims': '[256, 128]', 'dropout': 0.46167937127489367, 'batch_norm': True, 'sage_aggr': 'mean', 'sage_normalize': True, 'sage_project': False, 'lr': 0.00025698038017707035, 'weight_decay': 4.607935960072698e-05, 'epochs': 228, 'loss': 'mae', 'optimizer': 'adam', 'graph_mode': 'cutoff', 'cutoff': 0.7112692149229243, 'grm_norm': 'cosine_then_gcn', 'self_loops': False, 'use_snp_selection': True, 'num_snps': 11237, 'graphsage_batch_size': 64}. Best is trial 66 with value: 0.2290281524546119.
[I 2025-12-05 23:22:20,286] Trial 70 finished with value: 0.20345602794792242 and parameters: {'model_type': 'graphsage', 'hidden_dims': '[256, 128]', 'dropout': 0.45539225044088455, 'batch_norm': True, 'sage_aggr': 'mean', 'sage_normalize': False, 'sage_project': False, 'lr': 0.00038436725182668064, 'weight_decay': 4.576212217586678e-05, 'epochs': 228, 'loss': 'mae', 'optimizer': 'adam', 'graph_mode': 'cutoff', 'cutoff': 0.712019727029028, 'grm_norm': 'cosine_then_gcn', 'self_loops': False, 'use_snp_selection': True, 'num_snps': 10769, 'graphsage_batch_size': 64}. Best is trial 66 with value: 0.2290281524546119.
[I 2025-12-05 23:22:48,413] Trial 71 finished with value: 0.2265575681770772 and parameters: {'model_type': 'graphsage', 'hidden_dims': '[256, 128]', 'dropout': 0.4095247427372982, 'batch_norm': True, 'sage_aggr': 'mean', 'sage_normalize': True, 'sage_project': False, 'lr': 0.0002763857878456837, 'weight_decay': 7.467073005862087e-05, 'epochs': 219, 'loss': 'mae', 'optimizer': 'adam', 'graph_mode': 'cutoff', 'cutoff': 0.6506033896000152, 'grm_norm': 'cosine_then_gcn', 'self_loops': False, 'use_snp_selection': True, 'num_snps': 10079, 'graphsage_batch_size': 64}. Best is trial 66 with value: 0.2290281524546119.
[I 2025-12-05 23:23:15,822] Trial 72 finished with value: 0.2249075178851764 and parameters: {'model_type': 'graphsage', 'hidden_dims': '[256, 128]', 'dropout': 0.432277516582294, 'batch_norm': True, 'sage_aggr': 'mean', 'sage_normalize': True, 'sage_project': False, 'lr': 0.00026451769636823155, 'weight_decay': 3.2270069049569164e-05, 'epochs': 235, 'loss': 'mae', 'optimizer': 'adam', 'graph_mode': 'cutoff', 'cutoff': 0.7765336084341763, 'grm_norm': 'cosine_then_gcn', 'self_loops': False, 'use_snp_selection': True, 'num_snps': 8738, 'graphsage_batch_size': 64}. Best is trial 66 with value: 0.2290281524546119.
[I 2025-12-05 23:23:43,610] Trial 73 finished with value: 0.2285671254827461 and parameters: {'model_type': 'graphsage', 'hidden_dims': '[256, 128]', 'dropout': 0.4762084976853249, 'batch_norm': True, 'sage_aggr': 'mean', 'sage_normalize': True, 'sage_project': False, 'lr': 0.0002729484292476199, 'weight_decay': 7.939483230957421e-05, 'epochs': 218, 'loss': 'mae', 'optimizer': 'adam', 'graph_mode': 'cutoff', 'cutoff': 0.7856015935120902, 'grm_norm': 'cosine_then_gcn', 'self_loops': False, 'use_snp_selection': True, 'num_snps': 9616, 'graphsage_batch_size': 64}. Best is trial 66 with value: 0.2290281524546119.
[I 2025-12-05 23:24:05,931] Trial 74 finished with value: 0.17887513550062467 and parameters: {'model_type': 'graphsage', 'hidden_dims': '[256, 128]', 'dropout': 0.47578654214544536, 'batch_norm': True, 'sage_aggr': 'mean', 'sage_normalize': True, 'sage_project': False, 'lr': 0.0002664359217605634, 'weight_decay': 3.179053704078779e-05, 'epochs': 237, 'loss': 'mae', 'optimizer': 'adam', 'graph_mode': 'cutoff', 'cutoff': 0.8182542471180292, 'grm_norm': 'cosine_then_gcn', 'self_loops': False, 'use_snp_selection': True, 'num_snps': 4927, 'graphsage_batch_size': 64}. Best is trial 66 with value: 0.2290281524546119.
[I 2025-12-05 23:24:33,146] Trial 75 finished with value: 0.22389670740879608 and parameters: {'model_type': 'graphsage', 'hidden_dims': '[256, 128]', 'dropout': 0.43436563833755815, 'batch_norm': True, 'sage_aggr': 'mean', 'sage_normalize': True, 'sage_project': False, 'lr': 0.0006792411047868752, 'weight_decay': 8.683538076520659e-05, 'epochs': 218, 'loss': 'mae', 'optimizer': 'adam', 'graph_mode': 'cutoff', 'cutoff': 0.7743895961675046, 'grm_norm': 'cosine_then_gcn', 'self_loops': False, 'use_snp_selection': True, 'num_snps': 9258, 'graphsage_batch_size': 64}. Best is trial 66 with value: 0.2290281524546119.
[I 2025-12-05 23:25:00,481] Trial 76 finished with value: 0.2298278314019619 and parameters: {'model_type': 'graphsage', 'hidden_dims': '[256, 128]', 'dropout': 0.43742316489685407, 'batch_norm': True, 'sage_aggr': 'mean', 'sage_normalize': True, 'sage_project': False, 'lr': 0.0007413497882844608, 'weight_decay': 8.157417709968911e-05, 'epochs': 221, 'loss': 'mae', 'optimizer': 'adam', 'graph_mode': 'cutoff', 'cutoff': 0.7768406661768252, 'grm_norm': 'cosine_then_gcn', 'self_loops': False, 'use_snp_selection': True, 'num_snps': 9332, 'graphsage_batch_size': 64}. Best is trial 76 with value: 0.2298278314019619.
[I 2025-12-05 23:25:26,255] Trial 77 finished with value: 0.20895424893495637 and parameters: {'model_type': 'graphsage', 'hidden_dims': '[256, 128]', 'dropout': 0.43437387895633095, 'batch_norm': True, 'sage_aggr': 'mean', 'sage_normalize': True, 'sage_project': False, 'lr': 0.0009171218969069699, 'weight_decay': 7.925307468838603e-05, 'epochs': 220, 'loss': 'mae', 'optimizer': 'adam', 'graph_mode': 'cutoff', 'cutoff': 0.7716819273058831, 'grm_norm': 'cosine_then_gcn', 'self_loops': False, 'use_snp_selection': True, 'num_snps': 7984, 'graphsage_batch_size': 64}. Best is trial 76 with value: 0.2298278314019619.
[I 2025-12-05 23:25:58,504] Trial 78 finished with value: 0.20494960407374233 and parameters: {'model_type': 'graphsage', 'hidden_dims': '[256, 128]', 'dropout': 0.4696273579210436, 'batch_norm': True, 'sage_aggr': 'mean', 'sage_normalize': True, 'sage_project': False, 'lr': 0.0006969706420774223, 'weight_decay': 8.902097445502092e-05, 'epochs': 244, 'loss': 'mae', 'optimizer': 'adam', 'graph_mode': 'knn', 'knn_k': 2, 'weighted_edges': False, 'symmetrize_mode': 'union', 'self_loops': False, 'use_snp_selection': True, 'num_snps': 9831, 'graphsage_batch_size': 64}. Best is trial 76 with value: 0.2298278314019619.
[I 2025-12-05 23:26:17,712] Trial 79 finished with value: 0.14466422574594143 and parameters: {'model_type': 'graphsage', 'hidden_dims': '[256, 128]', 'dropout': 0.529823476851212, 'batch_norm': True, 'sage_aggr': 'mean', 'sage_normalize': True, 'sage_project': False, 'lr': 0.00048548401946930323, 'weight_decay': 1.9969188013450713e-05, 'epochs': 228, 'loss': 'mse', 'optimizer': 'adam', 'graph_mode': 'cutoff', 'cutoff': 0.6886824413921808, 'grm_norm': 'cosine_then_gcn', 'self_loops': False, 'use_snp_selection': True, 'num_snps': 2449, 'graphsage_batch_size': 64}. Best is trial 76 with value: 0.2298278314019619.
[I 2025-12-05 23:27:43,926] Trial 80 finished with value: 0.19881261386403914 and parameters: {'model_type': 'graphsage', 'hidden_dims': '[256, 128]', 'dropout': 0.39583327409880087, 'batch_norm': True, 'sage_aggr': 'mean', 'sage_normalize': True, 'sage_project': False, 'lr': 0.0007100841540000158, 'weight_decay': 4.086737608123802e-05, 'epochs': 250, 'loss': 'mae', 'optimizer': 'adam', 'graph_mode': 'cutoff', 'cutoff': 0.7066606749284933, 'grm_norm': 'cosine_then_gcn', 'self_loops': False, 'use_snp_selection': False, 'graphsage_batch_size': 64}. Best is trial 76 with value: 0.2298278314019619.
[I 2025-12-05 23:28:08,424] Trial 81 finished with value: 0.20468165062049462 and parameters: {'model_type': 'graphsage', 'hidden_dims': '[256, 128]', 'dropout': 0.43713452355223525, 'batch_norm': True, 'sage_aggr': 'mean', 'sage_normalize': True, 'sage_project': False, 'lr': 0.0003405884645950817, 'weight_decay': 9.802105714536849e-05, 'epochs': 235, 'loss': 'mae', 'optimizer': 'adam', 'graph_mode': 'cutoff', 'cutoff': 0.7850474260268335, 'grm_norm': 'cosine_then_gcn', 'self_loops': False, 'use_snp_selection': True, 'num_snps': 6500, 'graphsage_batch_size': 64}. Best is trial 76 with value: 0.2298278314019619.
