[I 2025-12-09 09:10:53,598] Trial 43 finished with value: 0.2937226075404302 and parameters: {'model_type': 'graphsage', 'hidden_dims': '[256, 128, 64]', 'dropout': 0.3247199926105052, 'batch_norm': True, 'sage_aggr': 'mean', 'sage_normalize': False, 'sage_project': False, 'lr': 0.00015691104142507352, 'weight_decay': 0.00014114597805897335, 'epochs': 285, 'loss': 'mae', 'optimizer': 'adam', 'graph_mode': 'knn', 'knn_k': 8, 'weighted_edges': False, 'symmetrize_mode': 'union', 'self_loops': True, 'use_snp_selection': False}. Best is trial 25 with value: 0.3076883833138432.
[I 2025-12-09 09:15:04,710] Trial 44 finished with value: 0.29741073010013375 and parameters: {'model_type': 'graphsage', 'hidden_dims': '[512, 64]', 'dropout': 0.2669561452759786, 'batch_norm': True, 'sage_aggr': 'mean', 'sage_normalize': False, 'sage_project': False, 'lr': 0.0005974484863807989, 'weight_decay': 9.30581987446489e-06, 'epochs': 303, 'loss': 'mae', 'optimizer': 'adam', 'graph_mode': 'knn', 'knn_k': 5, 'weighted_edges': False, 'symmetrize_mode': 'union', 'self_loops': True, 'use_snp_selection': False}. Best is trial 25 with value: 0.3076883833138432.
[I 2025-12-09 09:19:58,396] Trial 45 finished with value: 0.30351923213739085 and parameters: {'model_type': 'graphsage', 'hidden_dims': '[512, 256]', 'dropout': 0.20017209896657956, 'batch_norm': True, 'sage_aggr': 'mean', 'sage_normalize': False, 'sage_project': False, 'lr': 7.835047414850467e-05, 'weight_decay': 4.083134751433048e-06, 'epochs': 262, 'loss': 'mae', 'optimizer': 'adam', 'graph_mode': 'knn', 'knn_k': 7, 'weighted_edges': False, 'symmetrize_mode': 'union', 'self_loops': True, 'use_snp_selection': True, 'num_snps': 44150}. Best is trial 25 with value: 0.3076883833138432.
[I 2025-12-09 09:25:22,570] Trial 46 finished with value: 0.24943803139713835 and parameters: {'model_type': 'graphsage', 'hidden_dims': '[512, 256]', 'dropout': 0.21473772616634573, 'batch_norm': True, 'sage_aggr': 'max', 'sage_normalize': True, 'sage_project': False, 'lr': 5.947593815228993e-05, 'weight_decay': 5.092529241053517e-06, 'epochs': 258, 'loss': 'mae', 'optimizer': 'adam', 'graph_mode': 'knn', 'knn_k': 10, 'weighted_edges': False, 'symmetrize_mode': 'union', 'self_loops': False, 'use_snp_selection': True, 'num_snps': 38633}. Best is trial 25 with value: 0.3076883833138432.
[I 2025-12-09 09:27:08,134] Trial 47 finished with value: 0.25700666060402033 and parameters: {'model_type': 'graphsage', 'hidden_dims': '[512, 256]', 'dropout': 0.15593624897426545, 'batch_norm': False, 'sage_aggr': 'mean', 'sage_normalize': True, 'sage_project': False, 'lr': 9.648325114950141e-05, 'weight_decay': 3.7734722925818886e-06, 'epochs': 170, 'loss': 'mse', 'optimizer': 'adam', 'graph_mode': 'cutoff', 'cutoff': 0.4973780300980287, 'grm_norm': 'none', 'self_loops': True, 'use_snp_selection': True, 'num_snps': 43326}. Best is trial 25 with value: 0.3076883833138432.
[I 2025-12-09 09:28:47,056] Trial 48 finished with value: -0.02854134416903442 and parameters: {'model_type': 'graphsage', 'hidden_dims': '[512, 256]', 'dropout': 0.10489469251263113, 'batch_norm': False, 'sage_aggr': 'mean', 'sage_normalize': False, 'sage_project': False, 'lr': 0.0029894655462170522, 'weight_decay': 2.5897454692434152e-05, 'epochs': 133, 'loss': 'mse', 'optimizer': 'adam', 'graph_mode': 'cutoff', 'cutoff': 0.5506016534684224, 'grm_norm': 'gcn', 'self_loops': True, 'use_snp_selection': True, 'num_snps': 59176}. Best is trial 25 with value: 0.3076883833138432.
[I 2025-12-09 09:29:43,167] Trial 49 finished with value: 0.29599125993983183 and parameters: {'model_type': 'graphsage', 'hidden_dims': '[512, 256]', 'dropout': 0.5778066376893958, 'batch_norm': False, 'sage_aggr': 'mean', 'sage_normalize': True, 'sage_project': False, 'lr': 0.005768765993899974, 'weight_decay': 1.1303843873525837e-05, 'epochs': 287, 'loss': 'mse', 'optimizer': 'adam', 'graph_mode': 'cutoff', 'cutoff': 0.6332083004110522, 'grm_norm': 'none', 'self_loops': True, 'use_snp_selection': True, 'num_snps': 18781}. Best is trial 25 with value: 0.3076883833138432.
[I 2025-12-09 09:31:32,505] Trial 50 finished with value: 0.293943718575986 and parameters: {'model_type': 'graphsage', 'hidden_dims': '[128, 64]', 'dropout': 0.22351334486580704, 'batch_norm': True, 'sage_aggr': 'mean', 'sage_normalize': True, 'sage_project': False, 'lr': 0.0017656879070678199, 'weight_decay': 4.820414926768668e-05, 'epochs': 263, 'loss': 'mae', 'optimizer': 'adam', 'graph_mode': 'knn', 'knn_k': 4, 'weighted_edges': True, 'symmetrize_mode': 'mutual', 'self_loops': True, 'use_snp_selection': True, 'num_snps': 47452}. Best is trial 25 with value: 0.3076883833138432.
[I 2025-12-09 09:35:26,869] Trial 51 finished with value: 0.26093608624286413 and parameters: {'model_type': 'graphsage', 'hidden_dims': '[256, 128, 64]', 'dropout': 0.3618426185338849, 'batch_norm': True, 'sage_aggr': 'mean', 'sage_normalize': False, 'sage_project': False, 'lr': 1.0248907383031643e-05, 'weight_decay': 0.0002741087060222162, 'epochs': 334, 'loss': 'mae', 'optimizer': 'adam', 'graph_mode': 'knn', 'knn_k': 7, 'weighted_edges': False, 'symmetrize_mode': 'union', 'self_loops': True, 'use_snp_selection': False}. Best is trial 25 with value: 0.3076883833138432.
[I 2025-12-09 09:38:15,761] Trial 52 finished with value: 0.29568815846404384 and parameters: {'model_type': 'graphsage', 'hidden_dims': '[128, 64]', 'dropout': 0.1267078770275128, 'batch_norm': True, 'sage_aggr': 'mean', 'sage_normalize': False, 'sage_project': False, 'lr': 0.0013830567397013355, 'weight_decay': 7.161555344896974e-06, 'epochs': 316, 'loss': 'mae', 'optimizer': 'adam', 'graph_mode': 'knn', 'knn_k': 6, 'weighted_edges': False, 'symmetrize_mode': 'union', 'self_loops': True, 'use_snp_selection': False}. Best is trial 25 with value: 0.3076883833138432.
[I 2025-12-09 09:42:07,329] Trial 53 finished with value: 0.2910844070084703 and parameters: {'model_type': 'graphsage', 'hidden_dims': '[256, 128, 64]', 'dropout': 0.1868439640232244, 'batch_norm': True, 'sage_aggr': 'mean', 'sage_normalize': False, 'sage_project': False, 'lr': 5.200064783034998e-05, 'weight_decay': 1.5550374424320387e-06, 'epochs': 296, 'loss': 'mae', 'optimizer': 'adam', 'graph_mode': 'knn', 'knn_k': 8, 'weighted_edges': False, 'symmetrize_mode': 'union', 'self_loops': True, 'use_snp_selection': True, 'num_snps': 33623}. Best is trial 25 with value: 0.3076883833138432.
[I 2025-12-09 09:47:31,848] Trial 54 finished with value: 0.2965093072467953 and parameters: {'model_type': 'graphsage', 'hidden_dims': '[512, 256]', 'dropout': 0.29383300175032123, 'batch_norm': True, 'sage_aggr': 'mean', 'sage_normalize': False, 'sage_project': False, 'lr': 0.0008351008420403266, 'weight_decay': 0.0005034743891018017, 'epochs': 324, 'loss': 'mae', 'optimizer': 'adam', 'graph_mode': 'knn', 'knn_k': 8, 'weighted_edges': False, 'symmetrize_mode': 'union', 'self_loops': True, 'use_snp_selection': False}. Best is trial 25 with value: 0.3076883833138432.
[I 2025-12-09 09:52:29,106] Trial 55 finished with value: 0.29559448589145 and parameters: {'model_type': 'graphsage', 'hidden_dims': '[512, 128]', 'dropout': 0.5265758401787385, 'batch_norm': True, 'sage_aggr': 'mean', 'sage_normalize': False, 'sage_project': False, 'lr': 0.00045282688971546626, 'weight_decay': 1.589712628478455e-05, 'epochs': 336, 'loss': 'mse', 'optimizer': 'adam', 'graph_mode': 'knn', 'knn_k': 6, 'weighted_edges': False, 'symmetrize_mode': 'union', 'self_loops': True, 'use_snp_selection': False}. Best is trial 25 with value: 0.3076883833138432.
[I 2025-12-09 09:54:53,263] Trial 56 finished with value: 0.2676896300162264 and parameters: {'model_type': 'graphsage', 'hidden_dims': '[512, 64]', 'dropout': 0.43581588346648586, 'batch_norm': False, 'sage_aggr': 'mean', 'sage_normalize': True, 'sage_project': False, 'lr': 3.146131319136756e-05, 'weight_decay': 4.071772599689738e-06, 'epochs': 273, 'loss': 'mae', 'optimizer': 'adam', 'graph_mode': 'cutoff', 'cutoff': 0.8317294903962025, 'grm_norm': 'cosine', 'self_loops': True, 'use_snp_selection': False}. Best is trial 25 with value: 0.3076883833138432.
[I 2025-12-09 09:55:48,698] Trial 57 finished with value: 0.29850215901570104 and parameters: {'model_type': 'graphsage', 'hidden_dims': '[128, 64]', 'dropout': 0.40752553455769636, 'batch_norm': False, 'sage_aggr': 'mean', 'sage_normalize': True, 'sage_project': False, 'lr': 0.0013504426456491388, 'weight_decay': 7.081046100264686e-06, 'epochs': 310, 'loss': 'mse', 'optimizer': 'adam', 'graph_mode': 'cutoff', 'cutoff': 0.7445269734322152, 'grm_norm': 'cosine', 'self_loops': False, 'use_snp_selection': False}. Best is trial 25 with value: 0.3076883833138432.
[I 2025-12-09 09:56:02,100] Trial 58 finished with value: 0.27407756706946396 and parameters: {'model_type': 'graphsage', 'hidden_dims': '[512, 128]', 'dropout': 0.3485826309048423, 'batch_norm': False, 'sage_aggr': 'mean', 'sage_normalize': False, 'sage_project': False, 'lr': 0.00022171448033011547, 'weight_decay': 0.0001049685848331442, 'epochs': 42, 'loss': 'mse', 'optimizer': 'adam', 'graph_mode': 'cutoff', 'cutoff': 0.7042222046765626, 'grm_norm': 'none', 'self_loops': True, 'use_snp_selection': True, 'num_snps': 10375}. Best is trial 25 with value: 0.3076883833138432.
[I 2025-12-09 10:00:00,475] Trial 59 finished with value: 0.26015879476176457 and parameters: {'model_type': 'graphsage', 'hidden_dims': '[256, 128, 64]', 'dropout': 0.5090240660293521, 'batch_norm': True, 'sage_aggr': 'max', 'sage_normalize': True, 'sage_project': False, 'lr': 0.001993624832830997, 'weight_decay': 3.764492548584384e-05, 'epochs': 250, 'loss': 'mae', 'optimizer': 'adam', 'graph_mode': 'knn', 'knn_k': 9, 'weighted_edges': False, 'symmetrize_mode': 'union', 'self_loops': True, 'use_snp_selection': False}. Best is trial 25 with value: 0.3076883833138432.
[I 2025-12-09 10:00:51,267] Trial 60 finished with value: 0.284852732043804 and parameters: {'model_type': 'graphsage', 'hidden_dims': '[128, 64]', 'dropout': 0.22216302452757625, 'batch_norm': False, 'sage_aggr': 'mean', 'sage_normalize': True, 'sage_project': False, 'lr': 0.00032462421924380803, 'weight_decay': 1.291728618839655e-06, 'epochs': 281, 'loss': 'mse', 'optimizer': 'adam', 'graph_mode': 'cutoff', 'cutoff': 0.6454746119829625, 'grm_norm': 'cosine', 'self_loops': True, 'use_snp_selection': False}. Best is trial 25 with value: 0.3076883833138432.
[I 2025-12-09 10:01:51,132] Trial 61 finished with value: 0.3006732613848511 and parameters: {'model_type': 'graphsage', 'hidden_dims': '[128, 64]', 'dropout': 0.5875765000485513, 'batch_norm': False, 'sage_aggr': 'mean', 'sage_normalize': True, 'sage_project': False, 'lr': 0.0005791458910303955, 'weight_decay': 1.987840201603361e-05, 'epochs': 336, 'loss': 'mse', 'optimizer': 'adam', 'graph_mode': 'cutoff', 'cutoff': 0.8798803648223196, 'grm_norm': 'cosine', 'self_loops': True, 'use_snp_selection': False}. Best is trial 25 with value: 0.3076883833138432.
[I 2025-12-09 10:02:51,707] Trial 62 finished with value: 0.2991029379005723 and parameters: {'model_type': 'graphsage', 'hidden_dims': '[128, 64]', 'dropout': 0.5913465892366506, 'batch_norm': False, 'sage_aggr': 'mean', 'sage_normalize': True, 'sage_project': False, 'lr': 0.000683159461239142, 'weight_decay': 1.2295222355281399e-05, 'epochs': 340, 'loss': 'mse', 'optimizer': 'adam', 'graph_mode': 'cutoff', 'cutoff': 0.8653052432339423, 'grm_norm': 'cosine', 'self_loops': True, 'use_snp_selection': False}. Best is trial 25 with value: 0.3076883833138432.
[I 2025-12-09 10:03:48,487] Trial 63 finished with value: 0.2977874781708453 and parameters: {'model_type': 'graphsage', 'hidden_dims': '[128, 64]', 'dropout': 0.5524340379755853, 'batch_norm': False, 'sage_aggr': 'mean', 'sage_normalize': True, 'sage_project': False, 'lr': 0.00046297307470879545, 'weight_decay': 2.35414401452557e-06, 'epochs': 318, 'loss': 'mse', 'optimizer': 'adam', 'graph_mode': 'cutoff', 'cutoff': 0.7931421124681906, 'grm_norm': 'cosine', 'self_loops': True, 'use_snp_selection': False}. Best is trial 25 with value: 0.3076883833138432.
[I 2025-12-09 10:04:40,808] Trial 64 finished with value: 0.298403960176992 and parameters: {'model_type': 'graphsage', 'hidden_dims': '[128, 64]', 'dropout': 0.5361075752305519, 'batch_norm': False, 'sage_aggr': 'mean', 'sage_normalize': True, 'sage_project': False, 'lr': 0.0007283060764238175, 'weight_decay': 2.237979039730748e-05, 'epochs': 292, 'loss': 'mse', 'optimizer': 'adam', 'graph_mode': 'cutoff', 'cutoff': 0.8147422371568441, 'grm_norm': 'cosine', 'self_loops': True, 'use_snp_selection': False}. Best is trial 25 with value: 0.3076883833138432.
[I 2025-12-09 10:07:22,108] Trial 65 finished with value: 0.2888173163211357 and parameters: {'model_type': 'graphsage', 'hidden_dims': '[512, 128]', 'dropout': 0.5785482004361278, 'batch_norm': False, 'sage_aggr': 'mean', 'sage_normalize': True, 'sage_project': False, 'lr': 0.00017045826879082314, 'weight_decay': 7.507087719869202e-05, 'epochs': 306, 'loss': 'mse', 'optimizer': 'adam', 'graph_mode': 'cutoff', 'cutoff': 0.8932642466861624, 'grm_norm': 'cosine', 'self_loops': True, 'use_snp_selection': False}. Best is trial 25 with value: 0.3076883833138432.
[I 2025-12-09 10:08:22,780] Trial 66 finished with value: 0.3040567142223626 and parameters: {'model_type': 'graphsage', 'hidden_dims': '[128, 64]', 'dropout': 0.5984838445279688, 'batch_norm': False, 'sage_aggr': 'mean', 'sage_normalize': True, 'sage_project': False, 'lr': 0.001149692915679234, 'weight_decay': 1.716798175388876e-05, 'epochs': 340, 'loss': 'mse', 'optimizer': 'adam', 'graph_mode': 'cutoff', 'cutoff': 0.7695426583182864, 'grm_norm': 'gcn', 'self_loops': True, 'use_snp_selection': False}. Best is trial 25 with value: 0.3076883833138432.
[I 2025-12-09 10:09:23,946] Trial 67 finished with value: 0.3096185571869391 and parameters: {'model_type': 'graphsage', 'hidden_dims': '[128, 64]', 'dropout': 0.5984853250605647, 'batch_norm': False, 'sage_aggr': 'mean', 'sage_normalize': True, 'sage_project': False, 'lr': 0.0011646005691605579, 'weight_decay': 1.4489907853933248e-05, 'epochs': 343, 'loss': 'mse', 'optimizer': 'adam', 'graph_mode': 'cutoff', 'cutoff': 0.7635968259995121, 'grm_norm': 'gcn', 'self_loops': True, 'use_snp_selection': False}. Best is trial 67 with value: 0.3096185571869391.
[I 2025-12-09 10:10:25,412] Trial 68 finished with value: 0.29606625567725225 and parameters: {'model_type': 'graphsage', 'hidden_dims': '[128, 64]', 'dropout': 0.5975377493061105, 'batch_norm': False, 'sage_aggr': 'mean', 'sage_normalize': True, 'sage_project': False, 'lr': 0.0011797049428348538, 'weight_decay': 3.804642282423835e-05, 'epochs': 345, 'loss': 'mse', 'optimizer': 'adam', 'graph_mode': 'cutoff', 'cutoff': 0.7776585306284602, 'grm_norm': 'gcn', 'self_loops': True, 'use_snp_selection': False}. Best is trial 67 with value: 0.3096185571869391.
[I 2025-12-09 10:11:07,135] Trial 69 finished with value: 0.29600806790013 and parameters: {'model_type': 'graphsage', 'hidden_dims': '[128, 64]', 'dropout': 0.5622669993514419, 'batch_norm': False, 'sage_aggr': 'mean', 'sage_normalize': True, 'sage_project': False, 'lr': 0.0031799209643749754, 'weight_decay': 9.968477827111637e-06, 'epochs': 230, 'loss': 'mse', 'optimizer': 'adam', 'graph_mode': 'cutoff', 'cutoff': 0.749226301740066, 'grm_norm': 'gcn', 'self_loops': False, 'use_snp_selection': False}. Best is trial 67 with value: 0.3096185571869391.
[I 2025-12-09 10:12:29,178] Trial 70 finished with value: 0.3061269351210953 and parameters: {'model_type': 'graphsage', 'hidden_dims': '[256, 128]', 'dropout': 0.48449427590752664, 'batch_norm': False, 'sage_aggr': 'mean', 'sage_normalize': True, 'sage_project': False, 'lr': 0.002154508473582044, 'weight_decay': 1.484956635301341e-05, 'epochs': 315, 'loss': 'mse', 'optimizer': 'adam', 'graph_mode': 'cutoff', 'cutoff': 0.8195341707328625, 'grm_norm': 'gcn', 'self_loops': True, 'use_snp_selection': True, 'num_snps': 42417}. Best is trial 67 with value: 0.3096185571869391.
[I 2025-12-09 10:13:46,604] Trial 71 finished with value: 0.29813525303151944 and parameters: {'model_type': 'graphsage', 'hidden_dims': '[256, 128]', 'dropout': 0.5691515229380751, 'batch_norm': False, 'sage_aggr': 'mean', 'sage_normalize': True, 'sage_project': False, 'lr': 0.0019460305949703836, 'weight_decay': 1.4713090044235534e-05, 'epochs': 318, 'loss': 'mse', 'optimizer': 'adam', 'graph_mode': 'cutoff', 'cutoff': 0.8233990760298816, 'grm_norm': 'gcn', 'self_loops': True, 'use_snp_selection': True, 'num_snps': 40820}. Best is trial 67 with value: 0.3096185571869391.
[I 2025-12-09 10:15:28,292] Trial 72 finished with value: 0.29974049511063905 and parameters: {'model_type': 'graphsage', 'hidden_dims': '[256, 128]', 'dropout': 0.4759225538318773, 'batch_norm': False, 'sage_aggr': 'mean', 'sage_normalize': True, 'sage_project': False, 'lr': 0.0008949222219065416, 'weight_decay': 2.5280336309728433e-05, 'epochs': 298, 'loss': 'mse', 'optimizer': 'adam', 'graph_mode': 'cutoff', 'cutoff': 0.8524718098813442, 'grm_norm': 'gcn', 'self_loops': True, 'use_snp_selection': True, 'num_snps': 53573}. Best is trial 67 with value: 0.3096185571869391.
[I 2025-12-09 10:16:02,069] Trial 73 finished with value: 0.29729081289502624 and parameters: {'model_type': 'graphsage', 'hidden_dims': '[128, 64]', 'dropout': 0.5155693460046491, 'batch_norm': False, 'sage_aggr': 'mean', 'sage_normalize': True, 'sage_project': False, 'lr': 0.0015438793683396426, 'weight_decay': 7.756472015469823e-06, 'epochs': 267, 'loss': 'mse', 'optimizer': 'adam', 'graph_mode': 'cutoff', 'cutoff': 0.7267600749381918, 'grm_norm': 'gcn', 'self_loops': True, 'use_snp_selection': True, 'num_snps': 27348}. Best is trial 67 with value: 0.3096185571869391.
[I 2025-12-09 10:17:26,436] Trial 74 finished with value: 0.3010108346393966 and parameters: {'model_type': 'graphsage', 'hidden_dims': '[256, 128]', 'dropout': 0.5452318183374548, 'batch_norm': False, 'sage_aggr': 'mean', 'sage_normalize': True, 'sage_project': False, 'lr': 0.0011485766627313692, 'weight_decay': 1.3887445191443388e-05, 'epochs': 311, 'loss': 'mse', 'optimizer': 'adam', 'graph_mode': 'cutoff', 'cutoff': 0.7679463770056696, 'grm_norm': 'gcn', 'self_loops': True, 'use_snp_selection': True, 'num_snps': 44272}. Best is trial 67 with value: 0.3096185571869391.
[I 2025-12-09 10:18:54,261] Trial 75 finished with value: 0.30183584736113983 and parameters: {'model_type': 'graphsage', 'hidden_dims': '[256, 128]', 'dropout': 0.486945602710396, 'batch_norm': False, 'sage_aggr': 'mean', 'sage_normalize': True, 'sage_project': False, 'lr': 0.002252296510864957, 'weight_decay': 3.0146680169190853e-05, 'epochs': 309, 'loss': 'mse', 'optimizer': 'adam', 'graph_mode': 'cutoff', 'cutoff': 0.7636399061499992, 'grm_norm': 'gcn', 'self_loops': True, 'use_snp_selection': True, 'num_snps': 45737}. Best is trial 67 with value: 0.3096185571869391.
[I 2025-12-09 10:20:07,655] Trial 76 finished with value: 0.30008483264123104 and parameters: {'model_type': 'graphsage', 'hidden_dims': '[256, 128]', 'dropout': 0.4869771487678707, 'batch_norm': False, 'sage_aggr': 'max', 'sage_normalize': True, 'sage_project': False, 'lr': 0.005123100156903183, 'weight_decay': 2.9430095619058347e-05, 'epochs': 326, 'loss': 'mse', 'optimizer': 'adam', 'graph_mode': 'cutoff', 'cutoff': 0.799087954612665, 'grm_norm': 'gcn', 'self_loops': True, 'use_snp_selection': True, 'num_snps': 37897}. Best is trial 67 with value: 0.3096185571869391.
[I 2025-12-09 10:22:05,327] Trial 77 finished with value: 0.3054414861208218 and parameters: {'model_type': 'graphsage', 'hidden_dims': '[256, 128]', 'dropout': 0.41027200988532986, 'batch_norm': False, 'sage_aggr': 'mean', 'sage_normalize': True, 'sage_project': False, 'lr': 0.002111553277995589, 'weight_decay': 5.7497886583301676e-05, 'epochs': 343, 'loss': 'mse', 'optimizer': 'adam', 'graph_mode': 'cutoff', 'cutoff': 0.6662409569775155, 'grm_norm': 'gcn', 'self_loops': True, 'use_snp_selection': True, 'num_snps': 53922}. Best is trial 67 with value: 0.3096185571869391.
[I 2025-12-09 10:24:01,786] Trial 78 finished with value: 0.2979305811892563 and parameters: {'model_type': 'graphsage', 'hidden_dims': '[256, 128]', 'dropout': 0.4495428734817214, 'batch_norm': False, 'sage_aggr': 'mean', 'sage_normalize': True, 'sage_project': False, 'lr': 0.0029903781401316954, 'weight_decay': 4.293198745990859e-05, 'epochs': 350, 'loss': 'mse', 'optimizer': 'adam', 'graph_mode': 'cutoff', 'cutoff': 0.6662212670607816, 'grm_norm': 'gcn', 'self_loops': True, 'use_snp_selection': True, 'num_snps': 54343}. Best is trial 67 with value: 0.3096185571869391.
[I 2025-12-09 10:26:10,400] Trial 79 finished with value: 0.2987854830421863 and parameters: {'model_type': 'graphsage', 'hidden_dims': '[256, 128]', 'dropout': 0.41156863744191874, 'batch_norm': False, 'sage_aggr': 'mean', 'sage_normalize': True, 'sage_project': False, 'lr': 0.009375833794816183, 'weight_decay': 2.014985110026087e-05, 'epochs': 341, 'loss': 'mse', 'optimizer': 'adam', 'graph_mode': 'cutoff', 'cutoff': 0.5714102440852179, 'grm_norm': 'gcn', 'self_loops': True, 'use_snp_selection': True, 'num_snps': 55923}. Best is trial 67 with value: 0.3096185571869391.
[I 2025-12-09 10:27:22,498] Trial 80 finished with value: 0.3000112839089298 and parameters: {'model_type': 'graphsage', 'hidden_dims': '[128, 64]', 'dropout': 0.40042043568766394, 'batch_norm': False, 'sage_aggr': 'mean', 'sage_normalize': True, 'sage_project': False, 'lr': 0.002270852998839383, 'weight_decay': 5.659792097072705e-05, 'epochs': 325, 'loss': 'mse', 'optimizer': 'adam', 'graph_mode': 'cutoff', 'cutoff': 0.717263723776971, 'grm_norm': 'gcn', 'self_loops': False, 'use_snp_selection': True, 'num_snps': 49422}. Best is trial 67 with value: 0.3096185571869391.
