[I 2025-12-05 23:47:13,934] Trial 117 finished with value: 0.22057463982861894 and parameters: {'model_type': 'graphsage', 'hidden_dims': '[256, 128]', 'dropout': 0.44098777445732085, 'batch_norm': True, 'sage_aggr': 'mean', 'sage_normalize': True, 'sage_project': False, 'lr': 0.0003380772820161303, 'weight_decay': 4.207795009382232e-05, 'epochs': 217, 'loss': 'mse', 'optimizer': 'adam', 'graph_mode': 'cutoff', 'cutoff': 0.6213379786575621, 'grm_norm': 'cosine_then_gcn', 'self_loops': False, 'use_snp_selection': True, 'num_snps': 9342, 'graphsage_batch_size': 32}. Best is trial 89 with value: 0.23440750426696227.
[I 2025-12-05 23:48:34,019] Trial 118 finished with value: 0.18614957681777108 and parameters: {'model_type': 'graphsage', 'hidden_dims': '[256, 128]', 'dropout': 0.45607135965807677, 'batch_norm': False, 'sage_aggr': 'mean', 'sage_normalize': True, 'sage_project': False, 'lr': 0.00044841872390293127, 'weight_decay': 3.6974763273641294e-05, 'epochs': 228, 'loss': 'mae', 'optimizer': 'adam', 'graph_mode': 'cutoff', 'cutoff': 0.6037765176185604, 'grm_norm': 'cosine_then_gcn', 'self_loops': False, 'use_snp_selection': False, 'graphsage_batch_size': 64}. Best is trial 89 with value: 0.23440750426696227.
[I 2025-12-05 23:48:52,409] Trial 119 finished with value: 0.17721520571655575 and parameters: {'model_type': 'graphsage', 'hidden_dims': '[256, 128]', 'dropout': 0.49948149194757435, 'batch_norm': True, 'sage_aggr': 'mean', 'sage_normalize': True, 'sage_project': False, 'lr': 0.0005266962979114985, 'weight_decay': 6.006824300988443e-05, 'epochs': 148, 'loss': 'mae', 'optimizer': 'adam', 'graph_mode': 'cutoff', 'cutoff': 0.6679260815392265, 'grm_norm': 'cosine_then_gcn', 'self_loops': False, 'use_snp_selection': True, 'num_snps': 3658, 'graphsage_batch_size': 64}. Best is trial 89 with value: 0.23440750426696227.
[I 2025-12-05 23:49:19,602] Trial 120 finished with value: 0.22327489712070073 and parameters: {'model_type': 'graphsage', 'hidden_dims': '[256, 128]', 'dropout': 0.42639818539319263, 'batch_norm': True, 'sage_aggr': 'mean', 'sage_normalize': True, 'sage_project': False, 'lr': 0.0001987377971421211, 'weight_decay': 9.807457076885356e-05, 'epochs': 240, 'loss': 'mae', 'optimizer': 'adam', 'graph_mode': 'cutoff', 'cutoff': 0.6920810158265869, 'grm_norm': 'cosine_then_gcn', 'self_loops': False, 'use_snp_selection': True, 'num_snps': 8244, 'graphsage_batch_size': 64}. Best is trial 89 with value: 0.23440750426696227.
[I 2025-12-05 23:49:54,556] Trial 121 finished with value: 0.22433996377795973 and parameters: {'model_type': 'graphsage', 'hidden_dims': '[256, 128]', 'dropout': 0.48900860899119264, 'batch_norm': True, 'sage_aggr': 'mean', 'sage_normalize': True, 'sage_project': False, 'lr': 0.0007630537880190834, 'weight_decay': 4.723307021752339e-05, 'epochs': 222, 'loss': 'mae', 'optimizer': 'adam', 'graph_mode': 'cutoff', 'cutoff': 0.385716861162247, 'grm_norm': 'cosine_then_gcn', 'self_loops': False, 'use_snp_selection': True, 'num_snps': 10894, 'graphsage_batch_size': 64}. Best is trial 89 with value: 0.23440750426696227.
[I 2025-12-05 23:50:16,231] Trial 122 finished with value: 0.20647937746518905 and parameters: {'model_type': 'graphsage', 'hidden_dims': '[128, 64]', 'dropout': 0.47959532237317637, 'batch_norm': True, 'sage_aggr': 'mean', 'sage_normalize': True, 'sage_project': False, 'lr': 0.00029781963717181965, 'weight_decay': 7.036155700226647e-05, 'epochs': 212, 'loss': 'mae', 'optimizer': 'adam', 'graph_mode': 'cutoff', 'cutoff': 0.5267106001518272, 'grm_norm': 'cosine_then_gcn', 'self_loops': False, 'use_snp_selection': True, 'num_snps': 7029, 'graphsage_batch_size': 64}. Best is trial 89 with value: 0.23440750426696227.
[I 2025-12-05 23:50:38,847] Trial 123 finished with value: 0.18458088062215505 and parameters: {'model_type': 'graphsage', 'hidden_dims': '[256, 128]', 'dropout': 0.5084253581486949, 'batch_norm': True, 'sage_aggr': 'mean', 'sage_normalize': True, 'sage_project': False, 'lr': 0.0005716148643908303, 'weight_decay': 8.096960906053648e-05, 'epochs': 231, 'loss': 'mae', 'optimizer': 'adam', 'graph_mode': 'cutoff', 'cutoff': 0.7249933621085612, 'grm_norm': 'cosine_then_gcn', 'self_loops': False, 'use_snp_selection': True, 'num_snps': 5286, 'graphsage_batch_size': 64}. Best is trial 89 with value: 0.23440750426696227.
[I 2025-12-05 23:51:22,260] Trial 124 finished with value: 0.2252113021805413 and parameters: {'model_type': 'graphsage', 'hidden_dims': '[512, 64]', 'dropout': 0.4668019603188539, 'batch_norm': True, 'sage_aggr': 'mean', 'sage_normalize': True, 'sage_project': False, 'lr': 0.0003938300432729424, 'weight_decay': 0.00024168653648336998, 'epochs': 219, 'loss': 'mae', 'optimizer': 'adam', 'graph_mode': 'cutoff', 'cutoff': 0.7122784246704065, 'grm_norm': 'none', 'self_loops': False, 'use_snp_selection': True, 'num_snps': 13780, 'graphsage_batch_size': 64}. Best is trial 89 with value: 0.23440750426696227.
[I 2025-12-05 23:51:49,024] Trial 125 finished with value: 0.22063481442875937 and parameters: {'model_type': 'graphsage', 'hidden_dims': '[256, 128]', 'dropout': 0.4850818088896478, 'batch_norm': True, 'sage_aggr': 'mean', 'sage_normalize': True, 'sage_project': False, 'lr': 0.000480728150585402, 'weight_decay': 0.00013040678483901573, 'epochs': 215, 'loss': 'mae', 'optimizer': 'adam', 'graph_mode': 'cutoff', 'cutoff': 0.765944500373451, 'grm_norm': 'cosine_then_gcn', 'self_loops': False, 'use_snp_selection': True, 'num_snps': 8975, 'graphsage_batch_size': 64}. Best is trial 89 with value: 0.23440750426696227.
[I 2025-12-05 23:52:18,274] Trial 126 finished with value: 0.22663097562019446 and parameters: {'model_type': 'graphsage', 'hidden_dims': '[256, 128]', 'dropout': 0.44520279408371494, 'batch_norm': True, 'sage_aggr': 'mean', 'sage_normalize': True, 'sage_project': False, 'lr': 0.000996231220379793, 'weight_decay': 2.094805073342622e-05, 'epochs': 195, 'loss': 'mae', 'optimizer': 'adam', 'graph_mode': 'cutoff', 'cutoff': 0.5761881903431295, 'grm_norm': 'cosine_then_gcn', 'self_loops': False, 'use_snp_selection': True, 'num_snps': 11983, 'graphsage_batch_size': 64}. Best is trial 89 with value: 0.23440750426696227.
[I 2025-12-05 23:52:47,095] Trial 127 finished with value: 0.20837087677283525 and parameters: {'model_type': 'graphsage', 'hidden_dims': '[256, 128]', 'dropout': 0.5230990996532483, 'batch_norm': True, 'sage_aggr': 'mean', 'sage_normalize': False, 'sage_project': False, 'lr': 0.0007030233128667442, 'weight_decay': 0.00010625205205590658, 'epochs': 225, 'loss': 'mae', 'optimizer': 'adam', 'graph_mode': 'cutoff', 'cutoff': 0.6403421455090414, 'grm_norm': 'cosine_then_gcn', 'self_loops': False, 'use_snp_selection': True, 'num_snps': 10408, 'graphsage_batch_size': 64}. Best is trial 89 with value: 0.23440750426696227.
[I 2025-12-05 23:53:46,716] Trial 128 finished with value: 0.19451128121228412 and parameters: {'model_type': 'graphsage', 'hidden_dims': '[256, 128]', 'dropout': 0.4738160431063945, 'batch_norm': True, 'sage_aggr': 'mean', 'sage_normalize': True, 'sage_project': False, 'lr': 0.0008467273619986931, 'weight_decay': 5.5631643148887164e-05, 'epochs': 204, 'loss': 'mae', 'optimizer': 'adam', 'graph_mode': 'cutoff', 'cutoff': 0.739049512671772, 'grm_norm': 'cosine', 'self_loops': False, 'use_snp_selection': True, 'num_snps': 36635, 'graphsage_batch_size': 64}. Best is trial 89 with value: 0.23440750426696227.
[I 2025-12-05 23:54:31,168] Trial 129 finished with value: 0.20309740938036316 and parameters: {'model_type': 'graphsage', 'hidden_dims': '[128, 64]', 'dropout': 0.49477025587709805, 'batch_norm': True, 'sage_aggr': 'mean', 'sage_normalize': True, 'sage_project': False, 'lr': 0.000658155525946645, 'weight_decay': 0.0002932402692705073, 'epochs': 208, 'loss': 'mae', 'optimizer': 'adam', 'graph_mode': 'knn', 'knn_k': 7, 'weighted_edges': False, 'symmetrize_mode': 'union', 'self_loops': False, 'use_snp_selection': True, 'num_snps': 14893, 'graphsage_batch_size': 8}. Best is trial 89 with value: 0.23440750426696227.
[I 2025-12-05 23:55:05,212] Trial 130 finished with value: 0.21105086294867292 and parameters: {'model_type': 'graphsage', 'hidden_dims': '[256, 128]', 'dropout': 0.45737275852039205, 'batch_norm': True, 'sage_aggr': 'mean', 'sage_normalize': True, 'sage_project': False, 'lr': 0.00022808272458588126, 'weight_decay': 2.8132358110625485e-05, 'epochs': 138, 'loss': 'mae', 'optimizer': 'adam', 'graph_mode': 'cutoff', 'cutoff': 0.6127915365797766, 'grm_norm': 'cosine_then_gcn', 'self_loops': False, 'use_snp_selection': True, 'num_snps': 21554, 'graphsage_batch_size': 256}. Best is trial 89 with value: 0.23440750426696227.
[I 2025-12-05 23:55:35,187] Trial 131 finished with value: 0.21842091624201046 and parameters: {'model_type': 'graphsage', 'hidden_dims': '[256, 128]', 'dropout': 0.4473100931798909, 'batch_norm': True, 'sage_aggr': 'mean', 'sage_normalize': True, 'sage_project': False, 'lr': 0.00098979196221263, 'weight_decay': 2.0580272544311395e-05, 'epochs': 194, 'loss': 'mae', 'optimizer': 'adam', 'graph_mode': 'cutoff', 'cutoff': 0.5750343031009182, 'grm_norm': 'cosine_then_gcn', 'self_loops': False, 'use_snp_selection': True, 'num_snps': 12200, 'graphsage_batch_size': 64}. Best is trial 89 with value: 0.23440750426696227.
[I 2025-12-05 23:56:03,223] Trial 132 finished with value: 0.2229380918199782 and parameters: {'model_type': 'graphsage', 'hidden_dims': '[256, 128]', 'dropout': 0.440618022437105, 'batch_norm': True, 'sage_aggr': 'mean', 'sage_normalize': True, 'sage_project': False, 'lr': 0.0008255938824381424, 'weight_decay': 3.723299280606458e-05, 'epochs': 175, 'loss': 'mae', 'optimizer': 'adam', 'graph_mode': 'cutoff', 'cutoff': 0.5456726612885227, 'grm_norm': 'cosine_then_gcn', 'self_loops': False, 'use_snp_selection': True, 'num_snps': 11676, 'graphsage_batch_size': 64}. Best is trial 89 with value: 0.23440750426696227.
[I 2025-12-05 23:56:31,635] Trial 133 finished with value: 0.2258931780324666 and parameters: {'model_type': 'graphsage', 'hidden_dims': '[256, 128]', 'dropout': 0.47332643433290134, 'batch_norm': True, 'sage_aggr': 'mean', 'sage_normalize': True, 'sage_project': False, 'lr': 0.0007353188524979932, 'weight_decay': 4.9941395879184586e-05, 'epochs': 196, 'loss': 'mae', 'optimizer': 'adam', 'graph_mode': 'cutoff', 'cutoff': 0.4703015804640627, 'grm_norm': 'cosine_then_gcn', 'self_loops': False, 'use_snp_selection': True, 'num_snps': 8693, 'graphsage_batch_size': 64}. Best is trial 89 with value: 0.23440750426696227.
[I 2025-12-05 23:56:58,198] Trial 134 finished with value: 0.21859197017427853 and parameters: {'model_type': 'graphsage', 'hidden_dims': '[256, 128]', 'dropout': 0.42355641271229727, 'batch_norm': True, 'sage_aggr': 'mean', 'sage_normalize': True, 'sage_project': False, 'lr': 0.0009807005565417662, 'weight_decay': 3.357927437218849e-05, 'epochs': 189, 'loss': 'mae', 'optimizer': 'adam', 'graph_mode': 'cutoff', 'cutoff': 0.5868892391529799, 'grm_norm': 'cosine_then_gcn', 'self_loops': False, 'use_snp_selection': True, 'num_snps': 10025, 'graphsage_batch_size': 64}. Best is trial 89 with value: 0.23440750426696227.
[I 2025-12-05 23:58:28,985] Trial 135 finished with value: 0.19816607204141332 and parameters: {'model_type': 'graphsage', 'hidden_dims': '[256, 128]', 'dropout': 0.5454239680212993, 'batch_norm': True, 'sage_aggr': 'mean', 'sage_normalize': True, 'sage_project': False, 'lr': 0.0005763344920713195, 'weight_decay': 1.2063147473965827e-05, 'epochs': 200, 'loss': 'mae', 'optimizer': 'adam', 'graph_mode': 'cutoff', 'cutoff': 0.7942980060928116, 'grm_norm': 'cosine_then_gcn', 'self_loops': False, 'use_snp_selection': True, 'num_snps': 59999, 'graphsage_batch_size': 64}. Best is trial 89 with value: 0.23440750426696227.
[I 2025-12-05 23:59:00,805] Trial 136 finished with value: 0.23079181909484797 and parameters: {'model_type': 'graphsage', 'hidden_dims': '[256, 128]', 'dropout': 0.5114899548139397, 'batch_norm': True, 'sage_aggr': 'mean', 'sage_normalize': True, 'sage_project': False, 'lr': 0.0003697198472137364, 'weight_decay': 6.514778426320634e-05, 'epochs': 220, 'loss': 'mae', 'optimizer': 'adam', 'graph_mode': 'cutoff', 'cutoff': 0.7758477429456224, 'grm_norm': 'cosine_then_gcn', 'self_loops': False, 'use_snp_selection': True, 'num_snps': 12896, 'graphsage_batch_size': 64}. Best is trial 89 with value: 0.23440750426696227.
[I 2025-12-05 23:59:36,931] Trial 137 finished with value: 0.20554843064322945 and parameters: {'model_type': 'graphsage', 'hidden_dims': '[256, 128]', 'dropout': 0.16555030707140864, 'batch_norm': True, 'sage_aggr': 'mean', 'sage_normalize': True, 'sage_project': False, 'lr': 0.00034466286839610115, 'weight_decay': 8.869273572411548e-05, 'epochs': 220, 'loss': 'mse', 'optimizer': 'adam', 'graph_mode': 'cutoff', 'cutoff': 0.7730058581225405, 'grm_norm': 'cosine_then_gcn', 'self_loops': False, 'use_snp_selection': True, 'num_snps': 16344, 'graphsage_batch_size': 64}. Best is trial 89 with value: 0.23440750426696227.
[I 2025-12-06 00:00:10,811] Trial 138 finished with value: 0.21612606737636259 and parameters: {'model_type': 'graphsage', 'hidden_dims': '[256, 128]', 'dropout': 0.5134571194180542, 'batch_norm': True, 'sage_aggr': 'mean', 'sage_normalize': True, 'sage_project': False, 'lr': 0.0004062697598358662, 'weight_decay': 6.467812930826266e-05, 'epochs': 235, 'loss': 'mae', 'optimizer': 'adam', 'graph_mode': 'cutoff', 'cutoff': 0.811048442469523, 'grm_norm': 'cosine_then_gcn', 'self_loops': False, 'use_snp_selection': True, 'num_snps': 13743, 'graphsage_batch_size': 64}. Best is trial 89 with value: 0.23440750426696227.
[I 2025-12-06 00:01:30,418] Trial 139 finished with value: 0.19784436924287993 and parameters: {'model_type': 'graphsage', 'hidden_dims': '[256, 128]', 'dropout': 0.4851709670687664, 'batch_norm': True, 'sage_aggr': 'mean', 'sage_normalize': True, 'sage_project': False, 'lr': 0.0002904148429528648, 'weight_decay': 8.161708566535683e-06, 'epochs': 229, 'loss': 'mae', 'optimizer': 'adam', 'graph_mode': 'cutoff', 'cutoff': 0.7033978601385559, 'grm_norm': 'none', 'self_loops': False, 'use_snp_selection': False, 'graphsage_batch_size': 64}. Best is trial 89 with value: 0.23440750426696227.
[I 2025-12-06 00:01:51,618] Trial 140 finished with value: 0.199708885734673 and parameters: {'model_type': 'graphsage', 'hidden_dims': '[128, 64]', 'dropout': 0.5031794148920204, 'batch_norm': False, 'sage_aggr': 'max', 'sage_normalize': True, 'sage_project': False, 'lr': 0.0004744300195467941, 'weight_decay': 7.431477164138376e-05, 'epochs': 213, 'loss': 'mae', 'optimizer': 'adam', 'graph_mode': 'cutoff', 'cutoff': 0.7560990967446691, 'grm_norm': 'cosine_then_gcn', 'self_loops': False, 'use_snp_selection': True, 'num_snps': 7281, 'graphsage_batch_size': 64}. Best is trial 89 with value: 0.23440750426696227.
[I 2025-12-06 00:02:23,348] Trial 141 finished with value: 0.22606076743509038 and parameters: {'model_type': 'graphsage', 'hidden_dims': '[256, 128]', 'dropout': 0.46186758493972124, 'batch_norm': True, 'sage_aggr': 'mean', 'sage_normalize': True, 'sage_project': False, 'lr': 0.0005374806832986602, 'weight_decay': 4.444274499682463e-05, 'epochs': 224, 'loss': 'mae', 'optimizer': 'adam', 'graph_mode': 'cutoff', 'cutoff': 0.7379717222314721, 'grm_norm': 'cosine_then_gcn', 'self_loops': False, 'use_snp_selection': True, 'num_snps': 12614, 'graphsage_batch_size': 64}. Best is trial 89 with value: 0.23440750426696227.
[I 2025-12-06 00:02:50,369] Trial 142 finished with value: 0.23223433534734683 and parameters: {'model_type': 'graphsage', 'hidden_dims': '[256, 128]', 'dropout': 0.4494355591830794, 'batch_norm': True, 'sage_aggr': 'mean', 'sage_normalize': True, 'sage_project': False, 'lr': 0.0003632603415661782, 'weight_decay': 5.6618626018785e-05, 'epochs': 217, 'loss': 'mae', 'optimizer': 'adam', 'graph_mode': 'cutoff', 'cutoff': 0.7861870455741842, 'grm_norm': 'cosine_then_gcn', 'self_loops': False, 'use_snp_selection': True, 'num_snps': 9182, 'graphsage_batch_size': 64}. Best is trial 89 with value: 0.23440750426696227.
[I 2025-12-06 00:03:19,014] Trial 143 finished with value: 0.22565937568459576 and parameters: {'model_type': 'graphsage', 'hidden_dims': '[256, 128]', 'dropout': 0.47855749289233523, 'batch_norm': True, 'sage_aggr': 'mean', 'sage_normalize': True, 'sage_project': False, 'lr': 0.00035903862553220655, 'weight_decay': 6.16632244948401e-05, 'epochs': 219, 'loss': 'mae', 'optimizer': 'adam', 'graph_mode': 'cutoff', 'cutoff': 0.7774717732940092, 'grm_norm': 'cosine_then_gcn', 'self_loops': False, 'use_snp_selection': True, 'num_snps': 10385, 'graphsage_batch_size': 64}. Best is trial 89 with value: 0.23440750426696227.
[I 2025-12-06 00:03:46,188] Trial 144 finished with value: 0.21790238297465278 and parameters: {'model_type': 'graphsage', 'hidden_dims': '[256, 128]', 'dropout': 0.5280688425971264, 'batch_norm': True, 'sage_aggr': 'mean', 'sage_normalize': True, 'sage_project': False, 'lr': 0.00018112807887405184, 'weight_decay': 8.898285531042888e-05, 'epochs': 232, 'loss': 'mae', 'optimizer': 'adam', 'graph_mode': 'cutoff', 'cutoff': 0.721267476027726, 'grm_norm': 'cosine_then_gcn', 'self_loops': False, 'use_snp_selection': True, 'num_snps': 8528, 'graphsage_batch_size': 64}. Best is trial 89 with value: 0.23440750426696227.
[I 2025-12-06 00:05:17,304] Trial 145 finished with value: 0.19003546425696471 and parameters: {'model_type': 'graphsage', 'hidden_dims': '[256, 128]', 'dropout': 0.49365739433571126, 'batch_norm': True, 'sage_aggr': 'mean', 'sage_normalize': True, 'sage_project': False, 'lr': 0.0002531293731611949, 'weight_decay': 5.592136145124527e-05, 'epochs': 212, 'loss': 'mae', 'optimizer': 'adam', 'graph_mode': 'cutoff', 'cutoff': 0.831629609359029, 'grm_norm': 'cosine_then_gcn', 'self_loops': False, 'use_snp_selection': True, 'num_snps': 57507, 'graphsage_batch_size': 32}. Best is trial 89 with value: 0.23440750426696227.
[I 2025-12-06 00:05:41,462] Trial 146 finished with value: 0.19932562888226352 and parameters: {'model_type': 'graphsage', 'hidden_dims': '[256, 128]', 'dropout': 0.4682432457406616, 'batch_norm': True, 'sage_aggr': 'mean', 'sage_normalize': True, 'sage_project': False, 'lr': 0.0003037669728706566, 'weight_decay': 0.00011823904745407983, 'epochs': 226, 'loss': 'mae', 'optimizer': 'adam', 'graph_mode': 'cutoff', 'cutoff': 0.7866163444758798, 'grm_norm': 'cosine_then_gcn', 'self_loops': False, 'use_snp_selection': True, 'num_snps': 6517, 'graphsage_batch_size': 64}. Best is trial 89 with value: 0.23440750426696227.
[I 2025-12-06 00:06:14,264] Trial 147 finished with value: 0.18174759931981294 and parameters: {'model_type': 'graphsage', 'hidden_dims': '[512, 64]', 'dropout': 0.5133649277538798, 'batch_norm': True, 'sage_aggr': 'mean', 'sage_normalize': True, 'sage_project': False, 'lr': 7.398738966161373e-06, 'weight_decay': 4.2610699982273533e-05, 'epochs': 161, 'loss': 'mae', 'optimizer': 'adam', 'graph_mode': 'cutoff', 'cutoff': 0.7592034018841318, 'grm_norm': 'cosine_then_gcn', 'self_loops': False, 'use_snp_selection': True, 'num_snps': 11087, 'graphsage_batch_size': 64}. Best is trial 89 with value: 0.23440750426696227.
[I 2025-12-06 00:06:48,425] Trial 148 finished with value: 0.2167150792398619 and parameters: {'model_type': 'graphsage', 'hidden_dims': '[256, 128]', 'dropout': 0.4567457285225642, 'batch_norm': True, 'sage_aggr': 'mean', 'sage_normalize': False, 'sage_project': False, 'lr': 0.0004372776916267615, 'weight_decay': 0.00015055264040015888, 'epochs': 216, 'loss': 'mae', 'optimizer': 'adam', 'graph_mode': 'cutoff', 'cutoff': 0.6787782671224628, 'grm_norm': 'none', 'self_loops': False, 'use_snp_selection': True, 'num_snps': 15361, 'graphsage_batch_size': 64}. Best is trial 89 with value: 0.23440750426696227.
[I 2025-12-06 00:07:15,061] Trial 149 finished with value: 0.22757024179995713 and parameters: {'model_type': 'graphsage', 'hidden_dims': '[256, 128]', 'dropout': 0.5031658600703036, 'batch_norm': True, 'sage_aggr': 'mean', 'sage_normalize': True, 'sage_project': False, 'lr': 0.0006474965043849796, 'weight_decay': 7.912103454242388e-05, 'epochs': 208, 'loss': 'mae', 'optimizer': 'adam', 'graph_mode': 'cutoff', 'cutoff': 0.8014650748174771, 'grm_norm': 'cosine_then_gcn', 'self_loops': False, 'use_snp_selection': True, 'num_snps': 9390, 'graphsage_batch_size': 64}. Best is trial 89 with value: 0.23440750426696227.
[I 2025-12-06 00:08:12,388] Trial 0 finished with value: 0.1851278416993049 and parameters: {'model_type': 'graphsage', 'hidden_dims': '[128, 64]', 'dropout': 0.199031432379812, 'batch_norm': True, 'sage_aggr': 'max', 'sage_normalize': False, 'sage_project': False, 'lr': 3.4401453323286906e-05, 'weight_decay': 0.00017802616915745114, 'epochs': 169, 'loss': 'mse', 'optimizer': 'adam', 'graph_mode': 'knn', 'knn_k': 6, 'weighted_edges': True, 'symmetrize_mode': 'mutual', 'self_loops': False, 'use_snp_selection': False, 'graphsage_batch_size': 256}. Best is trial 0 with value: 0.1851278416993049.
[I 2025-12-06 00:09:08,646] Trial 1 finished with value: 0.2197265020085902 and parameters: {'model_type': 'graphsage', 'hidden_dims': '[512, 128]', 'dropout': 0.3737930779596218, 'batch_norm': True, 'sage_aggr': 'mean', 'sage_normalize': False, 'sage_project': False, 'lr': 0.0004485485309869717, 'weight_decay': 2.0046868950224612e-06, 'epochs': 74, 'loss': 'mse', 'optimizer': 'adam', 'graph_mode': 'knn', 'knn_k': 4, 'weighted_edges': True, 'symmetrize_mode': 'union', 'self_loops': False, 'use_snp_selection': False, 'graphsage_batch_size': 8}. Best is trial 1 with value: 0.2197265020085902.
