[I 2025-12-08 11:14:27,667] Trial 38 finished with value: 0.24784762915176978 and parameters: {'model_type': 'graphsage', 'hidden_dims': '[512, 64]', 'dropout': 0.5621521782220311, 'batch_norm': True, 'sage_aggr': 'max', 'sage_normalize': True, 'sage_project': False, 'lr': 0.0020846506365974067, 'weight_decay': 0.00024109818832132783, 'epochs': 164, 'loss': 'mae', 'optimizer': 'adam', 'graph_mode': 'knn', 'knn_k': 10, 'weighted_edges': True, 'symmetrize_mode': 'union', 'self_loops': False, 'use_snp_selection': False}. Best is trial 21 with value: 0.30497054797269374.
[I 2025-12-08 11:14:37,778] Trial 39 finished with value: 0.26215549055696186 and parameters: {'model_type': 'graphsage', 'hidden_dims': '[128, 64]', 'dropout': 0.24219746569788175, 'batch_norm': True, 'sage_aggr': 'mean', 'sage_normalize': True, 'sage_project': False, 'lr': 0.0036959777197471794, 'weight_decay': 9.09773462844178e-05, 'epochs': 191, 'loss': 'mae', 'optimizer': 'adam', 'graph_mode': 'cutoff', 'cutoff': 0.5901313461540527, 'grm_norm': 'gcn', 'self_loops': True, 'use_snp_selection': True, 'num_snps': 2345}. Best is trial 21 with value: 0.30497054797269374.
[I 2025-12-08 11:15:52,738] Trial 40 finished with value: 0.2855576001185737 and parameters: {'model_type': 'graphsage', 'hidden_dims': '[512, 128]', 'dropout': 0.3688697336239334, 'batch_norm': True, 'sage_aggr': 'mean', 'sage_normalize': False, 'sage_project': False, 'lr': 0.00025603571171959255, 'weight_decay': 1.0636609442133528e-06, 'epochs': 78, 'loss': 'mae', 'optimizer': 'adam', 'graph_mode': 'knn', 'knn_k': 7, 'weighted_edges': False, 'symmetrize_mode': 'union', 'self_loops': False, 'use_snp_selection': False}. Best is trial 21 with value: 0.30497054797269374.
[I 2025-12-08 11:16:26,983] Trial 41 finished with value: 0.2947872316350993 and parameters: {'model_type': 'graphsage', 'hidden_dims': '[256, 128]', 'dropout': 0.5319822914430349, 'batch_norm': True, 'sage_aggr': 'mean', 'sage_normalize': True, 'sage_project': False, 'lr': 0.0031816897147927624, 'weight_decay': 0.00016516591560273926, 'epochs': 112, 'loss': 'mae', 'optimizer': 'adam', 'graph_mode': 'cutoff', 'cutoff': 0.7556763323993018, 'grm_norm': 'cosine', 'self_loops': False, 'use_snp_selection': False}. Best is trial 21 with value: 0.30497054797269374.
[I 2025-12-08 11:17:07,908] Trial 42 finished with value: 0.2936777357454244 and parameters: {'model_type': 'graphsage', 'hidden_dims': '[256, 128]', 'dropout': 0.4859003163325056, 'batch_norm': True, 'sage_aggr': 'mean', 'sage_normalize': True, 'sage_project': False, 'lr': 0.005455164308694724, 'weight_decay': 0.00039732055746541026, 'epochs': 136, 'loss': 'mae', 'optimizer': 'adam', 'graph_mode': 'cutoff', 'cutoff': 0.7862606298877616, 'grm_norm': 'cosine', 'self_loops': False, 'use_snp_selection': False}. Best is trial 21 with value: 0.30497054797269374.
[I 2025-12-08 11:17:41,016] Trial 43 finished with value: 0.3047994939521653 and parameters: {'model_type': 'graphsage', 'hidden_dims': '[256, 128]', 'dropout': 0.5484907726232517, 'batch_norm': True, 'sage_aggr': 'mean', 'sage_normalize': True, 'sage_project': False, 'lr': 0.0022297960579405686, 'weight_decay': 3.566732221713178e-05, 'epochs': 108, 'loss': 'mae', 'optimizer': 'adam', 'graph_mode': 'cutoff', 'cutoff': 0.8533221031827074, 'grm_norm': 'cosine', 'self_loops': False, 'use_snp_selection': False}. Best is trial 21 with value: 0.30497054797269374.
[I 2025-12-08 11:18:25,956] Trial 44 finished with value: 0.2910107935762608 and parameters: {'model_type': 'graphsage', 'hidden_dims': '[256, 128]', 'dropout': 0.579038634647061, 'batch_norm': True, 'sage_aggr': 'mean', 'sage_normalize': True, 'sage_project': False, 'lr': 0.0009184319201655372, 'weight_decay': 3.533230984224504e-05, 'epochs': 150, 'loss': 'mae', 'optimizer': 'adam', 'graph_mode': 'cutoff', 'cutoff': 0.6567638452900897, 'grm_norm': 'cosine', 'self_loops': False, 'use_snp_selection': False}. Best is trial 21 with value: 0.30497054797269374.
[I 2025-12-08 11:18:49,126] Trial 45 finished with value: 0.2481066003841846 and parameters: {'model_type': 'graphsage', 'hidden_dims': '[256, 128, 64]', 'dropout': 0.516502294134327, 'batch_norm': True, 'sage_aggr': 'mean', 'sage_normalize': True, 'sage_project': False, 'lr': 0.0004384445765895225, 'weight_decay': 6.3065053187666755e-06, 'epochs': 183, 'loss': 'mae', 'optimizer': 'adam', 'graph_mode': 'cutoff', 'cutoff': 0.8441770994434372, 'grm_norm': 'cosine', 'self_loops': True, 'use_snp_selection': True, 'num_snps': 14439}. Best is trial 21 with value: 0.30497054797269374.
[I 2025-12-08 11:19:22,149] Trial 46 finished with value: 0.29599787563620455 and parameters: {'model_type': 'graphsage', 'hidden_dims': '[256, 128]', 'dropout': 0.4278819344485685, 'batch_norm': True, 'sage_aggr': 'max', 'sage_normalize': True, 'sage_project': False, 'lr': 0.0016745147961540357, 'weight_decay': 4.4993419683719303e-05, 'epochs': 108, 'loss': 'mae', 'optimizer': 'adam', 'graph_mode': 'cutoff', 'cutoff': 0.705792854206663, 'grm_norm': 'none', 'self_loops': False, 'use_snp_selection': False}. Best is trial 21 with value: 0.30497054797269374.
[I 2025-12-08 11:20:09,521] Trial 47 finished with value: 0.1305086871926431 and parameters: {'model_type': 'graphsage', 'hidden_dims': '[512, 256]', 'dropout': 0.47122216584270504, 'batch_norm': False, 'sage_aggr': 'mean', 'sage_normalize': False, 'sage_project': False, 'lr': 0.0005934081029534971, 'weight_decay': 7.838975057761602e-05, 'epochs': 71, 'loss': 'mae', 'optimizer': 'adam', 'graph_mode': 'cutoff', 'cutoff': 0.4849640483568389, 'grm_norm': 'cosine', 'self_loops': True, 'use_snp_selection': False}. Best is trial 21 with value: 0.30497054797269374.
[I 2025-12-08 11:21:09,571] Trial 48 finished with value: 0.3015033846661216 and parameters: {'model_type': 'graphsage', 'hidden_dims': '[512, 128]', 'dropout': 0.272191824257218, 'batch_norm': True, 'sage_aggr': 'mean', 'sage_normalize': True, 'sage_project': False, 'lr': 0.0021855749400295048, 'weight_decay': 2.1385330392336448e-05, 'epochs': 82, 'loss': 'mse', 'optimizer': 'adam', 'graph_mode': 'knn', 'knn_k': 4, 'weighted_edges': False, 'symmetrize_mode': 'union', 'self_loops': True, 'use_snp_selection': True, 'num_snps': 34116}. Best is trial 21 with value: 0.30497054797269374.
[I 2025-12-08 11:23:27,164] Trial 49 finished with value: 0.3080013377654483 and parameters: {'model_type': 'graphsage', 'hidden_dims': '[512, 64]', 'dropout': 0.13192402908113424, 'batch_norm': True, 'sage_aggr': 'mean', 'sage_normalize': True, 'sage_project': False, 'lr': 0.0046341059611571585, 'weight_decay': 3.263372092119974e-05, 'epochs': 259, 'loss': 'mae', 'optimizer': 'adam', 'graph_mode': 'cutoff', 'cutoff': 0.8752513766136265, 'grm_norm': 'cosine_then_gcn', 'self_loops': False, 'use_snp_selection': False}. Best is trial 49 with value: 0.3080013377654483.
[I 2025-12-08 11:25:41,993] Trial 50 finished with value: 0.28372297298835514 and parameters: {'model_type': 'graphsage', 'hidden_dims': '[512, 64]', 'dropout': 0.14072644747791216, 'batch_norm': False, 'sage_aggr': 'mean', 'sage_normalize': True, 'sage_project': False, 'lr': 0.004600467759557027, 'weight_decay': 1.1611547881451317e-05, 'epochs': 254, 'loss': 'mae', 'optimizer': 'adam', 'graph_mode': 'cutoff', 'cutoff': 0.8622390691192229, 'grm_norm': 'cosine_then_gcn', 'self_loops': False, 'use_snp_selection': False}. Best is trial 49 with value: 0.3080013377654483.
[I 2025-12-08 11:28:06,640] Trial 51 finished with value: 0.30201576667345575 and parameters: {'model_type': 'graphsage', 'hidden_dims': '[512, 64]', 'dropout': 0.13514995668285543, 'batch_norm': True, 'sage_aggr': 'mean', 'sage_normalize': True, 'sage_project': False, 'lr': 0.007572518279797718, 'weight_decay': 3.262299411510433e-05, 'epochs': 273, 'loss': 'mae', 'optimizer': 'adam', 'graph_mode': 'cutoff', 'cutoff': 0.7731210409870543, 'grm_norm': 'cosine_then_gcn', 'self_loops': False, 'use_snp_selection': False}. Best is trial 49 with value: 0.3080013377654483.
[I 2025-12-08 11:30:55,384] Trial 52 finished with value: 0.3045367171329314 and parameters: {'model_type': 'graphsage', 'hidden_dims': '[512, 64]', 'dropout': 0.1688528730931905, 'batch_norm': True, 'sage_aggr': 'mean', 'sage_normalize': True, 'sage_project': False, 'lr': 0.0042829970643636405, 'weight_decay': 2.786892517465773e-05, 'epochs': 320, 'loss': 'mae', 'optimizer': 'adam', 'graph_mode': 'cutoff', 'cutoff': 0.865065168968595, 'grm_norm': 'cosine_then_gcn', 'self_loops': False, 'use_snp_selection': False}. Best is trial 49 with value: 0.3080013377654483.
[I 2025-12-08 11:33:45,147] Trial 53 finished with value: 0.29569488053996845 and parameters: {'model_type': 'graphsage', 'hidden_dims': '[512, 64]', 'dropout': 0.18173503869610225, 'batch_norm': True, 'sage_aggr': 'mean', 'sage_normalize': True, 'sage_project': False, 'lr': 0.0011652462852968194, 'weight_decay': 4.658416440707625e-06, 'epochs': 322, 'loss': 'mae', 'optimizer': 'adam', 'graph_mode': 'cutoff', 'cutoff': 0.86924596817197, 'grm_norm': 'cosine_then_gcn', 'self_loops': False, 'use_snp_selection': False}. Best is trial 49 with value: 0.3080013377654483.
[I 2025-12-08 11:36:47,724] Trial 54 finished with value: 0.23214366648880436 and parameters: {'model_type': 'graphsage', 'hidden_dims': '[512, 64]', 'dropout': 0.12407055035251535, 'batch_norm': True, 'sage_aggr': 'mean', 'sage_normalize': True, 'sage_project': False, 'lr': 8.761505953425061e-05, 'weight_decay': 2.64578137336314e-05, 'epochs': 347, 'loss': 'mse', 'optimizer': 'adam', 'graph_mode': 'cutoff', 'cutoff': 0.8276929729465508, 'grm_norm': 'cosine_then_gcn', 'self_loops': False, 'use_snp_selection': False}. Best is trial 49 with value: 0.3080013377654483.
[I 2025-12-08 11:39:26,671] Trial 55 finished with value: 0.3063600459940804 and parameters: {'model_type': 'graphsage', 'hidden_dims': '[512, 64]', 'dropout': 0.5483792263826957, 'batch_norm': True, 'sage_aggr': 'mean', 'sage_normalize': True, 'sage_project': False, 'lr': 0.004636793888230049, 'weight_decay': 9.736007492333791e-06, 'epochs': 301, 'loss': 'mae', 'optimizer': 'adam', 'graph_mode': 'cutoff', 'cutoff': 0.8912044171546345, 'grm_norm': 'cosine_then_gcn', 'self_loops': False, 'use_snp_selection': False}. Best is trial 49 with value: 0.3080013377654483.
[I 2025-12-08 11:40:21,714] Trial 56 finished with value: 0.2987655093956447 and parameters: {'model_type': 'graphsage', 'hidden_dims': '[512, 64]', 'dropout': 0.5485762257501222, 'batch_norm': True, 'sage_aggr': 'mean', 'sage_normalize': False, 'sage_project': False, 'lr': 0.0046297178681837, 'weight_decay': 1.5330144110631296e-05, 'epochs': 304, 'loss': 'mae', 'optimizer': 'adam', 'graph_mode': 'cutoff', 'cutoff': 0.8965694170838708, 'grm_norm': 'cosine_then_gcn', 'self_loops': False, 'use_snp_selection': True, 'num_snps': 17633}. Best is trial 49 with value: 0.3080013377654483.
[I 2025-12-08 11:43:07,856] Trial 57 finished with value: 0.2954467596643425 and parameters: {'model_type': 'graphsage', 'hidden_dims': '[512, 64]', 'dropout': 0.16110948501709066, 'batch_norm': True, 'sage_aggr': 'mean', 'sage_normalize': True, 'sage_project': False, 'lr': 0.002433081496194925, 'weight_decay': 6.448932937703864e-05, 'epochs': 315, 'loss': 'mae', 'optimizer': 'adam', 'graph_mode': 'cutoff', 'cutoff': 0.8594477369515907, 'grm_norm': 'cosine_then_gcn', 'self_loops': False, 'use_snp_selection': False}. Best is trial 49 with value: 0.3080013377654483.
[I 2025-12-08 11:46:01,542] Trial 58 finished with value: 0.29335887864641663 and parameters: {'model_type': 'graphsage', 'hidden_dims': '[512, 64]', 'dropout': 0.5117483804327531, 'batch_norm': False, 'sage_aggr': 'mean', 'sage_normalize': True, 'sage_project': False, 'lr': 0.00986704490919765, 'weight_decay': 1.7169392845950762e-06, 'epochs': 330, 'loss': 'mse', 'optimizer': 'adam', 'graph_mode': 'cutoff', 'cutoff': 0.8746577293654492, 'grm_norm': 'cosine_then_gcn', 'self_loops': False, 'use_snp_selection': False}. Best is trial 49 with value: 0.3080013377654483.
[I 2025-12-08 11:48:35,419] Trial 59 finished with value: 0.3042614571504438 and parameters: {'model_type': 'graphsage', 'hidden_dims': '[512, 64]', 'dropout': 0.23436409343955283, 'batch_norm': True, 'sage_aggr': 'mean', 'sage_normalize': True, 'sage_project': False, 'lr': 0.007357278148295095, 'weight_decay': 8.013244565011686e-06, 'epochs': 291, 'loss': 'mae', 'optimizer': 'adam', 'graph_mode': 'cutoff', 'cutoff': 0.8209308607183073, 'grm_norm': 'cosine_then_gcn', 'self_loops': False, 'use_snp_selection': False}. Best is trial 49 with value: 0.3080013377654483.
[I 2025-12-08 11:51:10,761] Trial 60 finished with value: 0.26483185810483717 and parameters: {'model_type': 'graphsage', 'hidden_dims': '[512, 64]', 'dropout': 0.21851897665506623, 'batch_norm': True, 'sage_aggr': 'max', 'sage_normalize': True, 'sage_project': False, 'lr': 1.0079507573984855e-05, 'weight_decay': 7.069522148612778e-06, 'epochs': 295, 'loss': 'mae', 'optimizer': 'adam', 'graph_mode': 'cutoff', 'cutoff': 0.8221336298669776, 'grm_norm': 'cosine_then_gcn', 'self_loops': False, 'use_snp_selection': False}. Best is trial 49 with value: 0.3080013377654483.
[I 2025-12-08 11:53:41,692] Trial 61 finished with value: 0.30546099760685297 and parameters: {'model_type': 'graphsage', 'hidden_dims': '[512, 64]', 'dropout': 0.22771359488724688, 'batch_norm': True, 'sage_aggr': 'mean', 'sage_normalize': True, 'sage_project': False, 'lr': 0.006696007225094701, 'weight_decay': 1.0245479031046595e-05, 'epochs': 285, 'loss': 'mae', 'optimizer': 'adam', 'graph_mode': 'cutoff', 'cutoff': 0.779757585085927, 'grm_norm': 'cosine_then_gcn', 'self_loops': False, 'use_snp_selection': False}. Best is trial 49 with value: 0.3080013377654483.
[I 2025-12-08 11:56:14,051] Trial 62 finished with value: 0.3022653362365566 and parameters: {'model_type': 'graphsage', 'hidden_dims': '[512, 64]', 'dropout': 0.23157775929205565, 'batch_norm': True, 'sage_aggr': 'mean', 'sage_normalize': True, 'sage_project': False, 'lr': 0.007654379483746859, 'weight_decay': 8.930027341724661e-06, 'epochs': 288, 'loss': 'mae', 'optimizer': 'adam', 'graph_mode': 'cutoff', 'cutoff': 0.8516964779848126, 'grm_norm': 'cosine_then_gcn', 'self_loops': False, 'use_snp_selection': False}. Best is trial 49 with value: 0.3080013377654483.
[I 2025-12-08 11:58:39,734] Trial 63 finished with value: 0.3016186266601416 and parameters: {'model_type': 'graphsage', 'hidden_dims': '[512, 64]', 'dropout': 0.2944164632089823, 'batch_norm': True, 'sage_aggr': 'mean', 'sage_normalize': True, 'sage_project': False, 'lr': 0.005141813588324045, 'weight_decay': 4.229327142223581e-06, 'epochs': 275, 'loss': 'mae', 'optimizer': 'adam', 'graph_mode': 'cutoff', 'cutoff': 0.7814471681750643, 'grm_norm': 'cosine_then_gcn', 'self_loops': False, 'use_snp_selection': False}. Best is trial 49 with value: 0.3080013377654483.
[I 2025-12-08 12:01:24,308] Trial 64 finished with value: 0.3031435924066999 and parameters: {'model_type': 'graphsage', 'hidden_dims': '[512, 64]', 'dropout': 0.16669259795046304, 'batch_norm': True, 'sage_aggr': 'mean', 'sage_normalize': True, 'sage_project': False, 'lr': 0.0037084685128319396, 'weight_decay': 4.1538808463017975e-05, 'epochs': 312, 'loss': 'mae', 'optimizer': 'adam', 'graph_mode': 'cutoff', 'cutoff': 0.815774154859635, 'grm_norm': 'cosine_then_gcn', 'self_loops': False, 'use_snp_selection': False}. Best is trial 49 with value: 0.3080013377654483.
[I 2025-12-08 12:04:18,090] Trial 65 finished with value: 0.29602221490192426 and parameters: {'model_type': 'graphsage', 'hidden_dims': '[512, 64]', 'dropout': 0.1929884826994397, 'batch_norm': True, 'sage_aggr': 'mean', 'sage_normalize': True, 'sage_project': False, 'lr': 0.007237356939626814, 'weight_decay': 1.7737797171000716e-05, 'epochs': 330, 'loss': 'mae', 'optimizer': 'adam', 'graph_mode': 'cutoff', 'cutoff': 0.8994109689698436, 'grm_norm': 'cosine_then_gcn', 'self_loops': False, 'use_snp_selection': False}. Best is trial 49 with value: 0.3080013377654483.
[I 2025-12-08 12:06:45,225] Trial 66 finished with value: 0.30254365268859085 and parameters: {'model_type': 'graphsage', 'hidden_dims': '[512, 64]', 'dropout': 0.1141326638363325, 'batch_norm': True, 'sage_aggr': 'mean', 'sage_normalize': True, 'sage_project': False, 'lr': 0.008776175182262537, 'weight_decay': 1.1527385033022421e-05, 'epochs': 278, 'loss': 'mae', 'optimizer': 'adam', 'graph_mode': 'cutoff', 'cutoff': 0.8714136205246625, 'grm_norm': 'none', 'self_loops': False, 'use_snp_selection': False}. Best is trial 49 with value: 0.3080013377654483.
[I 2025-12-08 12:08:12,914] Trial 67 finished with value: 0.29395995734809 and parameters: {'model_type': 'graphsage', 'hidden_dims': '[256, 128, 64]', 'dropout': 0.2249363733825801, 'batch_norm': True, 'sage_aggr': 'mean', 'sage_normalize': True, 'sage_project': False, 'lr': 0.006112854028575962, 'weight_decay': 3.1799317203117747e-06, 'epochs': 303, 'loss': 'mae', 'optimizer': 'adam', 'graph_mode': 'cutoff', 'cutoff': 0.8321475777753806, 'grm_norm': 'cosine_then_gcn', 'self_loops': False, 'use_snp_selection': False}. Best is trial 49 with value: 0.3080013377654483.
[I 2025-12-08 12:11:34,704] Trial 68 finished with value: 0.13877381899441601 and parameters: {'model_type': 'graphsage', 'hidden_dims': '[512, 64]', 'dropout': 0.2581526206766156, 'batch_norm': False, 'sage_aggr': 'mean', 'sage_normalize': True, 'sage_project': False, 'lr': 0.0042558742589797255, 'weight_decay': 2.7112355559921286e-05, 'epochs': 334, 'loss': 'mae', 'optimizer': 'adam', 'graph_mode': 'knn', 'knn_k': 5, 'weighted_edges': True, 'symmetrize_mode': 'mutual', 'self_loops': False, 'use_snp_selection': False}. Best is trial 49 with value: 0.3080013377654483.
[I 2025-12-08 12:14:13,581] Trial 69 finished with value: 0.3025594440156797 and parameters: {'model_type': 'graphsage', 'hidden_dims': '[512, 64]', 'dropout': 0.1566970686964487, 'batch_norm': True, 'sage_aggr': 'mean', 'sage_normalize': False, 'sage_project': False, 'lr': 0.0031367161195047363, 'weight_decay': 6.095274850613449e-06, 'epochs': 266, 'loss': 'mse', 'optimizer': 'adam', 'graph_mode': 'cutoff', 'cutoff': 0.7976069290587778, 'grm_norm': 'cosine_then_gcn', 'self_loops': False, 'use_snp_selection': True, 'num_snps': 59827}. Best is trial 49 with value: 0.3080013377654483.
[I 2025-12-08 12:17:59,600] Trial 70 finished with value: 0.30041346455757845 and parameters: {'model_type': 'graphsage', 'hidden_dims': '[512, 64]', 'dropout': 0.18640050225654986, 'batch_norm': True, 'sage_aggr': 'mean', 'sage_normalize': True, 'sage_project': False, 'lr': 0.006268381389054533, 'weight_decay': 2.0948841836346778e-07, 'epochs': 296, 'loss': 'mae', 'optimizer': 'adam', 'graph_mode': 'cutoff', 'cutoff': 0.3104375576801104, 'grm_norm': 'cosine_then_gcn', 'self_loops': False, 'use_snp_selection': False}. Best is trial 49 with value: 0.3080013377654483.
[I 2025-12-08 12:19:21,519] Trial 71 finished with value: 0.29898095002622266 and parameters: {'model_type': 'graphsage', 'hidden_dims': '[256, 128]', 'dropout': 0.5886484717317343, 'batch_norm': True, 'sage_aggr': 'mean', 'sage_normalize': True, 'sage_project': False, 'lr': 0.0048515949651336075, 'weight_decay': 1.0336999427392808e-05, 'epochs': 284, 'loss': 'mae', 'optimizer': 'adam', 'graph_mode': 'cutoff', 'cutoff': 0.7664251143298395, 'grm_norm': 'cosine_then_gcn', 'self_loops': False, 'use_snp_selection': False}. Best is trial 49 with value: 0.3080013377654483.
[I 2025-12-08 12:22:06,056] Trial 72 finished with value: 0.30795832846010385 and parameters: {'model_type': 'graphsage', 'hidden_dims': '[512, 64]', 'dropout': 0.5754341697139917, 'batch_norm': True, 'sage_aggr': 'mean', 'sage_normalize': True, 'sage_project': False, 'lr': 0.001531606881324523, 'weight_decay': 2.12691586664567e-05, 'epochs': 312, 'loss': 'mae', 'optimizer': 'adam', 'graph_mode': 'cutoff', 'cutoff': 0.8462614737378397, 'grm_norm': 'gcn', 'self_loops': False, 'use_snp_selection': False}. Best is trial 49 with value: 0.3080013377654483.
[I 2025-12-08 12:24:18,921] Trial 73 finished with value: 0.27729164732568357 and parameters: {'model_type': 'graphsage', 'hidden_dims': '[512, 64]', 'dropout': 0.549636708492454, 'batch_norm': True, 'sage_aggr': 'mean', 'sage_normalize': True, 'sage_project': False, 'lr': 2.9912484198643302e-05, 'weight_decay': 1.7854042118367725e-05, 'epochs': 250, 'loss': 'mae', 'optimizer': 'adam', 'graph_mode': 'cutoff', 'cutoff': 0.8431333420711231, 'grm_norm': 'gcn', 'self_loops': False, 'use_snp_selection': False}. Best is trial 49 with value: 0.3080013377654483.
[I 2025-12-08 12:27:01,378] Trial 74 finished with value: 0.30368285612342216 and parameters: {'model_type': 'graphsage', 'hidden_dims': '[512, 64]', 'dropout': 0.5622587611574741, 'batch_norm': True, 'sage_aggr': 'mean', 'sage_normalize': True, 'sage_project': False, 'lr': 0.0034324475692562345, 'weight_decay': 2.5199551991313e-05, 'epochs': 308, 'loss': 'mae', 'optimizer': 'adam', 'graph_mode': 'cutoff', 'cutoff': 0.8819814290280464, 'grm_norm': 'gcn', 'self_loops': False, 'use_snp_selection': False}. Best is trial 49 with value: 0.3080013377654483.
[I 2025-12-08 12:27:59,248] Trial 75 finished with value: 0.28769258913190915 and parameters: {'model_type': 'graphsage', 'hidden_dims': '[128, 64]', 'dropout': 0.5816878127880473, 'batch_norm': True, 'sage_aggr': 'mean', 'sage_normalize': True, 'sage_project': False, 'lr': 0.008721733078244658, 'weight_decay': 3.66741159407037e-05, 'epochs': 322, 'loss': 'mae', 'optimizer': 'adam', 'graph_mode': 'cutoff', 'cutoff': 0.809514712791265, 'grm_norm': 'gcn', 'self_loops': False, 'use_snp_selection': False}. Best is trial 49 with value: 0.3080013377654483.
