[I 2025-12-06 02:18:11,484] Trial 31 finished with value: 0.21832238521921887 and parameters: {'model_type': 'graphsage', 'hidden_dims': '[128, 64]', 'dropout': 0.22878712440077814, 'batch_norm': False, 'sage_aggr': 'mean', 'sage_normalize': False, 'sage_project': False, 'lr': 8.092662767558623e-05, 'weight_decay': 2.2347764160196586e-07, 'epochs': 179, 'loss': 'mae', 'optimizer': 'adam', 'graph_mode': 'cutoff', 'cutoff': 0.8218192242058483, 'grm_norm': 'none', 'self_loops': False, 'use_snp_selection': False, 'graphsage_batch_size': 32}. Best is trial 10 with value: 0.23234478373462286.
[I 2025-12-06 02:18:42,040] Trial 32 finished with value: 0.22066585125993984 and parameters: {'model_type': 'graphsage', 'hidden_dims': '[128, 64]', 'dropout': 0.1660809163510048, 'batch_norm': False, 'sage_aggr': 'mean', 'sage_normalize': False, 'sage_project': False, 'lr': 9.750633053027371e-05, 'weight_decay': 8.132130366842523e-07, 'epochs': 202, 'loss': 'mae', 'optimizer': 'adam', 'graph_mode': 'cutoff', 'cutoff': 0.7326919328967065, 'grm_norm': 'none', 'self_loops': False, 'use_snp_selection': False, 'graphsage_batch_size': 32}. Best is trial 10 with value: 0.23234478373462286.
[I 2025-12-06 02:19:09,335] Trial 33 finished with value: 0.21320429818268272 and parameters: {'model_type': 'graphsage', 'hidden_dims': '[128, 64]', 'dropout': 0.22455988921641645, 'batch_norm': False, 'sage_aggr': 'mean', 'sage_normalize': False, 'sage_project': False, 'lr': 4.3614143008241973e-05, 'weight_decay': 3.527296905078037e-07, 'epochs': 178, 'loss': 'mae', 'optimizer': 'adam', 'graph_mode': 'cutoff', 'cutoff': 0.8343454847344368, 'grm_norm': 'none', 'self_loops': False, 'use_snp_selection': False, 'graphsage_batch_size': 32}. Best is trial 10 with value: 0.23234478373462286.
[I 2025-12-06 02:19:42,426] Trial 34 finished with value: 0.2175424430761395 and parameters: {'model_type': 'graphsage', 'hidden_dims': '[128, 64]', 'dropout': 0.13368700543434472, 'batch_norm': False, 'sage_aggr': 'mean', 'sage_normalize': False, 'sage_project': False, 'lr': 0.0006097110588996497, 'weight_decay': 6.889065529393144e-07, 'epochs': 223, 'loss': 'mse', 'optimizer': 'adam', 'graph_mode': 'cutoff', 'cutoff': 0.7593223852335761, 'grm_norm': 'none', 'self_loops': False, 'use_snp_selection': False, 'graphsage_batch_size': 32}. Best is trial 10 with value: 0.23234478373462286.
[I 2025-12-06 02:20:47,295] Trial 35 finished with value: 0.20624582335247993 and parameters: {'model_type': 'graphsage', 'hidden_dims': '[512, 128]', 'dropout': 0.20034185855091086, 'batch_norm': True, 'sage_aggr': 'mean', 'sage_normalize': True, 'sage_project': False, 'lr': 0.00018110343941594192, 'weight_decay': 1.959187455769864e-06, 'epochs': 108, 'loss': 'mae', 'optimizer': 'adam', 'graph_mode': 'cutoff', 'cutoff': 0.8263644605897241, 'grm_norm': 'cosine_then_gcn', 'self_loops': False, 'use_snp_selection': True, 'num_snps': 58379, 'graphsage_batch_size': 8}. Best is trial 10 with value: 0.23234478373462286.
[I 2025-12-06 02:21:30,367] Trial 36 finished with value: 0.1691176187582839 and parameters: {'model_type': 'graphsage', 'hidden_dims': '[512, 256]', 'dropout': 0.2368629919288624, 'batch_norm': False, 'sage_aggr': 'max', 'sage_normalize': False, 'sage_project': False, 'lr': 2.9678538753310552e-05, 'weight_decay': 1.5469647554708585e-07, 'epochs': 79, 'loss': 'mse', 'optimizer': 'adam', 'graph_mode': 'knn', 'knn_k': 1, 'weighted_edges': False, 'symmetrize_mode': 'union', 'self_loops': False, 'use_snp_selection': False, 'graphsage_batch_size': 64}. Best is trial 10 with value: 0.23234478373462286.
[I 2025-12-06 02:21:57,749] Trial 37 finished with value: 0.20441625543884773 and parameters: {'model_type': 'graphsage', 'hidden_dims': '[256, 128]', 'dropout': 0.1622661779345195, 'batch_norm': True, 'sage_aggr': 'mean', 'sage_normalize': True, 'sage_project': False, 'lr': 6.507594484086937e-05, 'weight_decay': 5.014672573276726e-07, 'epochs': 155, 'loss': 'mae', 'optimizer': 'adam', 'graph_mode': 'cutoff', 'cutoff': 0.6181050403363613, 'grm_norm': 'none', 'self_loops': False, 'use_snp_selection': True, 'num_snps': 23077, 'graphsage_batch_size': 32}. Best is trial 10 with value: 0.23234478373462286.
[I 2025-12-06 02:24:41,939] Trial 38 finished with value: 0.2071438757690595 and parameters: {'model_type': 'graphsage', 'hidden_dims': '[512, 256]', 'dropout': 0.2926458526218127, 'batch_norm': False, 'sage_aggr': 'max', 'sage_normalize': False, 'sage_project': False, 'lr': 1.0160511112096327e-05, 'weight_decay': 1.9489507454561498e-07, 'epochs': 190, 'loss': 'mae', 'optimizer': 'adam', 'graph_mode': 'knn', 'knn_k': 10, 'weighted_edges': False, 'symmetrize_mode': 'union', 'self_loops': False, 'use_snp_selection': False, 'graphsage_batch_size': 16}. Best is trial 10 with value: 0.23234478373462286.
[I 2025-12-06 02:24:58,976] Trial 39 finished with value: 0.17192808595146697 and parameters: {'model_type': 'graphsage', 'hidden_dims': '[512, 64]', 'dropout': 0.11924541953688296, 'batch_norm': False, 'sage_aggr': 'mean', 'sage_normalize': True, 'sage_project': False, 'lr': 0.00012429266384789475, 'weight_decay': 1.0456550092755959e-06, 'epochs': 135, 'loss': 'mse', 'optimizer': 'adam', 'graph_mode': 'cutoff', 'cutoff': 0.48005929750826, 'grm_norm': 'none', 'self_loops': False, 'use_snp_selection': True, 'num_snps': 4669, 'graphsage_batch_size': 256}. Best is trial 10 with value: 0.23234478373462286.
[I 2025-12-06 02:25:47,587] Trial 40 finished with value: 0.19015286411974439 and parameters: {'model_type': 'graphsage', 'hidden_dims': '[256, 128]', 'dropout': 0.25527289337376335, 'batch_norm': True, 'sage_aggr': 'mean', 'sage_normalize': False, 'sage_project': False, 'lr': 3.619798212181217e-05, 'weight_decay': 3.4068830251137555e-07, 'epochs': 176, 'loss': 'mae', 'optimizer': 'adam', 'graph_mode': 'knn', 'knn_k': 1, 'weighted_edges': False, 'symmetrize_mode': 'union', 'self_loops': False, 'use_snp_selection': False, 'graphsage_batch_size': 32}. Best is trial 10 with value: 0.23234478373462286.
[I 2025-12-06 02:27:10,739] Trial 41 finished with value: 0.22207100842036995 and parameters: {'model_type': 'graphsage', 'hidden_dims': '[512, 256]', 'dropout': 0.40992642554042114, 'batch_norm': False, 'sage_aggr': 'mean', 'sage_normalize': False, 'sage_project': False, 'lr': 2.1648548470437988e-05, 'weight_decay': 5.916361929444699e-06, 'epochs': 146, 'loss': 'mae', 'optimizer': 'adam', 'graph_mode': 'cutoff', 'cutoff': 0.38312708479981267, 'grm_norm': 'gcn', 'self_loops': False, 'use_snp_selection': False, 'graphsage_batch_size': 512}. Best is trial 10 with value: 0.23234478373462286.
[I 2025-12-06 02:28:31,760] Trial 42 finished with value: 0.2254478106015581 and parameters: {'model_type': 'graphsage', 'hidden_dims': '[512, 256]', 'dropout': 0.20019726259742246, 'batch_norm': False, 'sage_aggr': 'mean', 'sage_normalize': False, 'sage_project': False, 'lr': 3.2247894228705593e-06, 'weight_decay': 3.224483522576591e-06, 'epochs': 133, 'loss': 'mae', 'optimizer': 'adam', 'graph_mode': 'cutoff', 'cutoff': 0.332975415875572, 'grm_norm': 'gcn', 'self_loops': False, 'use_snp_selection': False, 'graphsage_batch_size': 512}. Best is trial 10 with value: 0.23234478373462286.
[I 2025-12-06 02:29:31,956] Trial 43 finished with value: 0.21991236551583052 and parameters: {'model_type': 'graphsage', 'hidden_dims': '[512, 256]', 'dropout': 0.3735520467236543, 'batch_norm': False, 'sage_aggr': 'mean', 'sage_normalize': False, 'sage_project': False, 'lr': 2.0092881091183188e-05, 'weight_decay': 1.810074803069138e-05, 'epochs': 121, 'loss': 'mae', 'optimizer': 'adam', 'graph_mode': 'cutoff', 'cutoff': 0.5785108609990071, 'grm_norm': 'gcn', 'self_loops': False, 'use_snp_selection': False, 'graphsage_batch_size': 8}. Best is trial 10 with value: 0.23234478373462286.
[I 2025-12-06 02:31:21,444] Trial 44 finished with value: 0.23176223415453712 and parameters: {'model_type': 'graphsage', 'hidden_dims': '[512, 128]', 'dropout': 0.5227194869665266, 'batch_norm': False, 'sage_aggr': 'mean', 'sage_normalize': False, 'sage_project': False, 'lr': 1.0040073026343292e-05, 'weight_decay': 4.991560809165862e-06, 'epochs': 161, 'loss': 'mae', 'optimizer': 'adam', 'graph_mode': 'cutoff', 'cutoff': 0.27428355160738205, 'grm_norm': 'none', 'self_loops': False, 'use_snp_selection': False, 'graphsage_batch_size': 128}. Best is trial 10 with value: 0.23234478373462286.
[I 2025-12-06 02:34:02,773] Trial 45 finished with value: 0.23357322087965895 and parameters: {'model_type': 'graphsage', 'hidden_dims': '[512, 128]', 'dropout': 0.11796735521925134, 'batch_norm': False, 'sage_aggr': 'mean', 'sage_normalize': False, 'sage_project': False, 'lr': 7.272954993815633e-06, 'weight_decay': 0.00047952340265424435, 'epochs': 201, 'loss': 'mae', 'optimizer': 'adam', 'graph_mode': 'cutoff', 'cutoff': 0.2257557882717191, 'grm_norm': 'none', 'self_loops': False, 'use_snp_selection': False, 'graphsage_batch_size': 128}. Best is trial 45 with value: 0.23357322087965895.
[I 2025-12-06 02:37:04,768] Trial 46 finished with value: 0.17342381129451367 and parameters: {'model_type': 'graphsage', 'hidden_dims': '[512, 128]', 'dropout': 0.55213343970042, 'batch_norm': False, 'sage_aggr': 'max', 'sage_normalize': False, 'sage_project': False, 'lr': 4.070921719614446e-06, 'weight_decay': 0.0002333375183730145, 'epochs': 207, 'loss': 'mae', 'optimizer': 'adam', 'graph_mode': 'cutoff', 'cutoff': 0.22201343692964465, 'grm_norm': 'none', 'self_loops': False, 'use_snp_selection': True, 'num_snps': 40295, 'graphsage_batch_size': 128}. Best is trial 45 with value: 0.23357322087965895.
[I 2025-12-06 02:38:38,096] Trial 47 finished with value: 0.1877684864635498 and parameters: {'model_type': 'graphsage', 'hidden_dims': '[512, 128]', 'dropout': 0.11331983930153953, 'batch_norm': False, 'sage_aggr': 'mean', 'sage_normalize': True, 'sage_project': False, 'lr': 9.24993099292586e-06, 'weight_decay': 0.00047634648000060203, 'epochs': 194, 'loss': 'mae', 'optimizer': 'adam', 'graph_mode': 'knn', 'knn_k': 3, 'weighted_edges': True, 'symmetrize_mode': 'mutual', 'self_loops': False, 'use_snp_selection': False, 'graphsage_batch_size': 128}. Best is trial 45 with value: 0.23357322087965895.
[I 2025-12-06 02:41:01,791] Trial 48 finished with value: 0.24224195621693326 and parameters: {'model_type': 'graphsage', 'hidden_dims': '[512, 128]', 'dropout': 0.12854516034083655, 'batch_norm': False, 'sage_aggr': 'mean', 'sage_normalize': False, 'sage_project': False, 'lr': 5.898230325126789e-06, 'weight_decay': 0.00010453199522555089, 'epochs': 238, 'loss': 'mae', 'optimizer': 'adam', 'graph_mode': 'cutoff', 'cutoff': 0.29401125703379816, 'grm_norm': 'cosine_then_gcn', 'self_loops': False, 'use_snp_selection': False, 'graphsage_batch_size': 128}. Best is trial 48 with value: 0.24224195621693326.
[I 2025-12-06 02:43:24,737] Trial 49 finished with value: 0.2256259254880236 and parameters: {'model_type': 'graphsage', 'hidden_dims': '[512, 128]', 'dropout': 0.10022913543804962, 'batch_norm': False, 'sage_aggr': 'mean', 'sage_normalize': False, 'sage_project': False, 'lr': 6.380277274930374e-06, 'weight_decay': 0.0009685956502838978, 'epochs': 235, 'loss': 'mae', 'optimizer': 'adam', 'graph_mode': 'cutoff', 'cutoff': 0.2914821496073384, 'grm_norm': 'cosine_then_gcn', 'self_loops': False, 'use_snp_selection': False, 'graphsage_batch_size': 128}. Best is trial 48 with value: 0.24224195621693326.
[I 2025-12-06 02:48:55,579] Trial 50 finished with value: 0.21010797479113968 and parameters: {'model_type': 'graphsage', 'hidden_dims': '[512, 128]', 'dropout': 0.1258191653101941, 'batch_norm': False, 'sage_aggr': 'mean', 'sage_normalize': False, 'sage_project': False, 'lr': 2.1277917767521195e-06, 'weight_decay': 8.888986909551305e-05, 'epochs': 245, 'loss': 'mse', 'optimizer': 'adam', 'graph_mode': 'cutoff', 'cutoff': 0.2040960300303888, 'grm_norm': 'cosine_then_gcn', 'self_loops': False, 'use_snp_selection': True, 'num_snps': 59867, 'graphsage_batch_size': 128}. Best is trial 48 with value: 0.24224195621693326.
[I 2025-12-06 02:51:16,818] Trial 51 finished with value: 0.2287001923328455 and parameters: {'model_type': 'graphsage', 'hidden_dims': '[512, 128]', 'dropout': 0.15205335402146083, 'batch_norm': False, 'sage_aggr': 'mean', 'sage_normalize': False, 'sage_project': False, 'lr': 4.8290995328538e-06, 'weight_decay': 0.00028104374573271833, 'epochs': 218, 'loss': 'mae', 'optimizer': 'adam', 'graph_mode': 'cutoff', 'cutoff': 0.2707084875555405, 'grm_norm': 'cosine_then_gcn', 'self_loops': False, 'use_snp_selection': False, 'graphsage_batch_size': 128}. Best is trial 48 with value: 0.24224195621693326.
[I 2025-12-06 02:53:33,347] Trial 52 finished with value: 0.2396128090434641 and parameters: {'model_type': 'graphsage', 'hidden_dims': '[512, 128]', 'dropout': 0.17431728897450358, 'batch_norm': False, 'sage_aggr': 'mean', 'sage_normalize': False, 'sage_project': False, 'lr': 1.0043819783972485e-05, 'weight_decay': 9.786119118409962e-05, 'epochs': 232, 'loss': 'mae', 'optimizer': 'adam', 'graph_mode': 'cutoff', 'cutoff': 0.32384840754290833, 'grm_norm': 'none', 'self_loops': False, 'use_snp_selection': False, 'graphsage_batch_size': 128}. Best is trial 48 with value: 0.24224195621693326.
[I 2025-12-06 02:55:50,651] Trial 53 finished with value: 0.22786006794224725 and parameters: {'model_type': 'graphsage', 'hidden_dims': '[512, 128]', 'dropout': 0.19019078498845923, 'batch_norm': False, 'sage_aggr': 'mean', 'sage_normalize': False, 'sage_project': False, 'lr': 9.784442286816932e-06, 'weight_decay': 8.719332026569622e-05, 'epochs': 232, 'loss': 'mae', 'optimizer': 'adam', 'graph_mode': 'cutoff', 'cutoff': 0.3204823176553417, 'grm_norm': 'none', 'self_loops': False, 'use_snp_selection': False, 'graphsage_batch_size': 128}. Best is trial 48 with value: 0.24224195621693326.
[I 2025-12-06 02:57:53,395] Trial 54 finished with value: 0.23212519731371337 and parameters: {'model_type': 'graphsage', 'hidden_dims': '[512, 128]', 'dropout': 0.17666793727521252, 'batch_norm': False, 'sage_aggr': 'mean', 'sage_normalize': False, 'sage_project': False, 'lr': 7.725275476246179e-06, 'weight_decay': 0.00013768423288097344, 'epochs': 228, 'loss': 'mae', 'optimizer': 'adam', 'graph_mode': 'cutoff', 'cutoff': 0.3695383962173564, 'grm_norm': 'cosine_then_gcn', 'self_loops': False, 'use_snp_selection': False, 'graphsage_batch_size': 128}. Best is trial 48 with value: 0.24224195621693326.
[I 2025-12-06 03:00:07,153] Trial 55 finished with value: 0.22399079658904048 and parameters: {'model_type': 'graphsage', 'hidden_dims': '[512, 128]', 'dropout': 0.17895761332366333, 'batch_norm': False, 'sage_aggr': 'mean', 'sage_normalize': False, 'sage_project': False, 'lr': 7.827246824124266e-06, 'weight_decay': 0.0001387450046015337, 'epochs': 250, 'loss': 'mae', 'optimizer': 'adam', 'graph_mode': 'cutoff', 'cutoff': 0.3681312585911529, 'grm_norm': 'cosine_then_gcn', 'self_loops': False, 'use_snp_selection': False, 'graphsage_batch_size': 128}. Best is trial 48 with value: 0.24224195621693326.
[I 2025-12-06 03:02:21,066] Trial 56 finished with value: 0.23531919573927979 and parameters: {'model_type': 'graphsage', 'hidden_dims': '[512, 128]', 'dropout': 0.12871429061474512, 'batch_norm': False, 'sage_aggr': 'mean', 'sage_normalize': False, 'sage_project': False, 'lr': 4.9850081458475496e-06, 'weight_decay': 5.3302535360352253e-05, 'epochs': 227, 'loss': 'mae', 'optimizer': 'adam', 'graph_mode': 'cutoff', 'cutoff': 0.30487966546418055, 'grm_norm': 'cosine_then_gcn', 'self_loops': False, 'use_snp_selection': False, 'graphsage_batch_size': 128}. Best is trial 48 with value: 0.24224195621693326.
[I 2025-12-06 03:05:03,198] Trial 57 finished with value: 0.23271040691063014 and parameters: {'model_type': 'graphsage', 'hidden_dims': '[512, 128]', 'dropout': 0.11389775044440689, 'batch_norm': False, 'sage_aggr': 'mean', 'sage_normalize': False, 'sage_project': False, 'lr': 4.526813424979608e-06, 'weight_decay': 4.645254301415589e-05, 'epochs': 226, 'loss': 'mae', 'optimizer': 'adam', 'graph_mode': 'cutoff', 'cutoff': 0.23823097017083797, 'grm_norm': 'cosine_then_gcn', 'self_loops': False, 'use_snp_selection': False, 'graphsage_batch_size': 128}. Best is trial 48 with value: 0.24224195621693326.
[I 2025-12-06 03:07:22,480] Trial 58 finished with value: 0.20169594883726977 and parameters: {'model_type': 'graphsage', 'hidden_dims': '[512, 128]', 'dropout': 0.11947738776542156, 'batch_norm': False, 'sage_aggr': 'mean', 'sage_normalize': False, 'sage_project': False, 'lr': 4.607314579933554e-06, 'weight_decay': 3.559914268968875e-05, 'epochs': 238, 'loss': 'mae', 'optimizer': 'adam', 'graph_mode': 'knn', 'knn_k': 10, 'weighted_edges': True, 'symmetrize_mode': 'mutual', 'self_loops': False, 'use_snp_selection': False, 'graphsage_batch_size': 128}. Best is trial 48 with value: 0.24224195621693326.
[I 2025-12-06 03:10:08,271] Trial 59 finished with value: 0.11809424868951171 and parameters: {'model_type': 'graphsage', 'hidden_dims': '[512, 128]', 'dropout': 0.10098500354272913, 'batch_norm': True, 'sage_aggr': 'max', 'sage_normalize': False, 'sage_project': False, 'lr': 2.550295835785695e-06, 'weight_decay': 6.812174568651202e-05, 'epochs': 218, 'loss': 'mae', 'optimizer': 'adam', 'graph_mode': 'cutoff', 'cutoff': 0.25288164580307376, 'grm_norm': 'cosine_then_gcn', 'self_loops': False, 'use_snp_selection': False, 'graphsage_batch_size': 128}. Best is trial 48 with value: 0.24224195621693326.
[I 2025-12-06 03:12:55,047] Trial 60 finished with value: 0.20847028148257407 and parameters: {'model_type': 'graphsage', 'hidden_dims': '[512, 128]', 'dropout': 0.13164958064165547, 'batch_norm': False, 'sage_aggr': 'mean', 'sage_normalize': True, 'sage_project': False, 'lr': 1.3174467788732968e-06, 'weight_decay': 2.1015978093444658e-05, 'epochs': 228, 'loss': 'mae', 'optimizer': 'adam', 'graph_mode': 'cutoff', 'cutoff': 0.23272453297366158, 'grm_norm': 'cosine_then_gcn', 'self_loops': False, 'use_snp_selection': False, 'graphsage_batch_size': 128}. Best is trial 48 with value: 0.24224195621693326.
[I 2025-12-06 03:15:05,047] Trial 61 finished with value: 0.22844595839983506 and parameters: {'model_type': 'graphsage', 'hidden_dims': '[512, 128]', 'dropout': 0.1696406798698065, 'batch_norm': False, 'sage_aggr': 'mean', 'sage_normalize': False, 'sage_project': False, 'lr': 3.415566614912365e-06, 'weight_decay': 1.4523769131792575e-05, 'epochs': 227, 'loss': 'mae', 'optimizer': 'adam', 'graph_mode': 'cutoff', 'cutoff': 0.319887519470906, 'grm_norm': 'cosine_then_gcn', 'self_loops': False, 'use_snp_selection': False, 'graphsage_batch_size': 128}. Best is trial 48 with value: 0.24224195621693326.
[I 2025-12-06 03:17:30,595] Trial 62 finished with value: 0.23645713691667422 and parameters: {'model_type': 'graphsage', 'hidden_dims': '[512, 128]', 'dropout': 0.14530039641923312, 'batch_norm': False, 'sage_aggr': 'mean', 'sage_normalize': False, 'sage_project': False, 'lr': 6.22679372521518e-06, 'weight_decay': 0.000454880926683119, 'epochs': 241, 'loss': 'mae', 'optimizer': 'adam', 'graph_mode': 'cutoff', 'cutoff': 0.294314445632247, 'grm_norm': 'cosine_then_gcn', 'self_loops': False, 'use_snp_selection': False, 'graphsage_batch_size': 128}. Best is trial 48 with value: 0.24224195621693326.
[I 2025-12-06 03:19:58,689] Trial 63 finished with value: 0.23044898983812975 and parameters: {'model_type': 'graphsage', 'hidden_dims': '[512, 128]', 'dropout': 0.14486841129144534, 'batch_norm': False, 'sage_aggr': 'mean', 'sage_normalize': False, 'sage_project': False, 'lr': 5.645407166403627e-06, 'weight_decay': 0.00041192843338973506, 'epochs': 242, 'loss': 'mae', 'optimizer': 'adam', 'graph_mode': 'cutoff', 'cutoff': 0.2880793727408894, 'grm_norm': 'cosine_then_gcn', 'self_loops': False, 'use_snp_selection': False, 'graphsage_batch_size': 128}. Best is trial 48 with value: 0.24224195621693326.
[I 2025-12-06 03:22:31,779] Trial 64 finished with value: 0.22467005350008526 and parameters: {'model_type': 'graphsage', 'hidden_dims': '[512, 128]', 'dropout': 0.11499564595573186, 'batch_norm': False, 'sage_aggr': 'mean', 'sage_normalize': False, 'sage_project': False, 'lr': 3.971273990919727e-06, 'weight_decay': 0.000927632011438942, 'epochs': 215, 'loss': 'mae', 'optimizer': 'adam', 'graph_mode': 'cutoff', 'cutoff': 0.24110238998735564, 'grm_norm': 'cosine_then_gcn', 'self_loops': False, 'use_snp_selection': False, 'graphsage_batch_size': 128}. Best is trial 48 with value: 0.24224195621693326.
[I 2025-12-06 03:24:07,849] Trial 65 finished with value: 0.22713950339790992 and parameters: {'model_type': 'graphsage', 'hidden_dims': '[256, 128, 64]', 'dropout': 0.1548278661315029, 'batch_norm': False, 'sage_aggr': 'mean', 'sage_normalize': False, 'sage_project': False, 'lr': 1.2059423553107796e-05, 'weight_decay': 4.382141899889845e-05, 'epochs': 242, 'loss': 'mae', 'optimizer': 'adam', 'graph_mode': 'cutoff', 'cutoff': 0.30159516586564894, 'grm_norm': 'cosine', 'self_loops': False, 'use_snp_selection': False, 'graphsage_batch_size': 128}. Best is trial 48 with value: 0.24224195621693326.
[I 2025-12-06 03:27:14,803] Trial 66 finished with value: 0.22963397490035614 and parameters: {'model_type': 'graphsage', 'hidden_dims': '[512, 128]', 'dropout': 0.1279826433017987, 'batch_norm': False, 'sage_aggr': 'mean', 'sage_normalize': False, 'sage_project': False, 'lr': 1.6723714898252175e-05, 'weight_decay': 0.0005591856919009524, 'epochs': 206, 'loss': 'mae', 'optimizer': 'adam', 'graph_mode': 'cutoff', 'cutoff': 0.20020010021902568, 'grm_norm': 'cosine_then_gcn', 'self_loops': False, 'use_snp_selection': False, 'graphsage_batch_size': 128}. Best is trial 48 with value: 0.24224195621693326.
