[I 2025-12-09 19:36:44,387] Trial 33 finished with value: 0.28090854186022246 and parameters: {'model_type': 'graphsage', 'hidden_dims': '[128, 64]', 'dropout': 0.531942189312429, 'batch_norm': False, 'sage_aggr': 'max', 'sage_normalize': False, 'sage_project': False, 'lr': 0.00010818348230288696, 'weight_decay': 2.1881025467478822e-07, 'epochs': 254, 'loss': 'mse', 'optimizer': 'adam', 'graph_mode': 'knn', 'knn_k': 7, 'weighted_edges': True, 'symmetrize_mode': 'union', 'self_loops': True, 'use_snp_selection': True, 'num_snps': 10439}. Best is trial 28 with value: 0.2966595349924173.
[I 2025-12-09 19:37:33,460] Trial 34 finished with value: 0.29303967172713585 and parameters: {'model_type': 'graphsage', 'hidden_dims': '[128, 64]', 'dropout': 0.4823361506960368, 'batch_norm': False, 'sage_aggr': 'max', 'sage_normalize': False, 'sage_project': False, 'lr': 0.0002978194033257932, 'weight_decay': 2.37575273451943e-07, 'epochs': 260, 'loss': 'mse', 'optimizer': 'adam', 'graph_mode': 'knn', 'knn_k': 5, 'weighted_edges': True, 'symmetrize_mode': 'union', 'self_loops': True, 'use_snp_selection': True, 'num_snps': 10500}. Best is trial 28 with value: 0.2966595349924173.
[I 2025-12-09 19:38:28,913] Trial 35 finished with value: 0.28703640257276497 and parameters: {'model_type': 'graphsage', 'hidden_dims': '[128, 64]', 'dropout': 0.4795590348721367, 'batch_norm': False, 'sage_aggr': 'max', 'sage_normalize': False, 'sage_project': False, 'lr': 0.00030690491127282883, 'weight_decay': 4.983354367916654e-07, 'epochs': 265, 'loss': 'mse', 'optimizer': 'adam', 'graph_mode': 'knn', 'knn_k': 6, 'weighted_edges': True, 'symmetrize_mode': 'union', 'self_loops': True, 'use_snp_selection': True, 'num_snps': 11271}. Best is trial 28 with value: 0.2966595349924173.
[I 2025-12-09 19:39:24,567] Trial 36 finished with value: 0.25682816569754163 and parameters: {'model_type': 'graphsage', 'hidden_dims': '[128, 64]', 'dropout': 0.5225939382147862, 'batch_norm': True, 'sage_aggr': 'max', 'sage_normalize': False, 'sage_project': False, 'lr': 0.0006902531255412674, 'weight_decay': 2.1145550069044824e-07, 'epochs': 347, 'loss': 'mse', 'optimizer': 'adam', 'graph_mode': 'knn', 'knn_k': 5, 'weighted_edges': True, 'symmetrize_mode': 'union', 'self_loops': True, 'use_snp_selection': True, 'num_snps': 9934}. Best is trial 28 with value: 0.2966595349924173.
[I 2025-12-09 19:42:16,062] Trial 37 finished with value: 0.25815274015998546 and parameters: {'model_type': 'graphsage', 'hidden_dims': '[128, 64]', 'dropout': 0.5530428110050245, 'batch_norm': False, 'sage_aggr': 'max', 'sage_normalize': False, 'sage_project': False, 'lr': 7.598013315530703e-05, 'weight_decay': 2.1129758647397457e-07, 'epochs': 295, 'loss': 'mse', 'optimizer': 'adam', 'graph_mode': 'knn', 'knn_k': 5, 'weighted_edges': True, 'symmetrize_mode': 'union', 'self_loops': True, 'use_snp_selection': False}. Best is trial 28 with value: 0.2966595349924173.
[I 2025-12-09 19:43:26,564] Trial 38 finished with value: 0.2778657118842574 and parameters: {'model_type': 'graphsage', 'hidden_dims': '[128, 64]', 'dropout': 0.5738510540051985, 'batch_norm': True, 'sage_aggr': 'mean', 'sage_normalize': True, 'sage_project': False, 'lr': 4.4056852071056114e-05, 'weight_decay': 1.1602417893611731e-07, 'epochs': 267, 'loss': 'mse', 'optimizer': 'adam', 'graph_mode': 'knn', 'knn_k': 6, 'weighted_edges': True, 'symmetrize_mode': 'union', 'self_loops': True, 'use_snp_selection': True, 'num_snps': 13869}. Best is trial 28 with value: 0.2966595349924173.
[I 2025-12-09 19:43:59,455] Trial 39 finished with value: 0.12302589792357306 and parameters: {'model_type': 'graphsage', 'hidden_dims': '[128, 64]', 'dropout': 0.5061616702356487, 'batch_norm': False, 'sage_aggr': 'max', 'sage_normalize': False, 'sage_project': False, 'lr': 0.0016786201153347, 'weight_decay': 6.438103062902683e-07, 'epochs': 235, 'loss': 'mse', 'optimizer': 'adam', 'graph_mode': 'knn', 'knn_k': 7, 'weighted_edges': True, 'symmetrize_mode': 'union', 'self_loops': True, 'use_snp_selection': True, 'num_snps': 4066}. Best is trial 28 with value: 0.2966595349924173.
[I 2025-12-09 19:45:59,511] Trial 40 finished with value: 0.25952834836675426 and parameters: {'model_type': 'graphsage', 'hidden_dims': '[128, 64]', 'dropout': 0.4684328807708026, 'batch_norm': True, 'sage_aggr': 'max', 'sage_normalize': False, 'sage_project': False, 'lr': 1.588451059295634e-05, 'weight_decay': 1.5307702295980954e-06, 'epochs': 202, 'loss': 'mse', 'optimizer': 'adam', 'graph_mode': 'knn', 'knn_k': 5, 'weighted_edges': True, 'symmetrize_mode': 'union', 'self_loops': True, 'use_snp_selection': False}. Best is trial 28 with value: 0.2966595349924173.
[I 2025-12-09 19:46:29,198] Trial 41 finished with value: 0.24185628711704382 and parameters: {'model_type': 'graphsage', 'hidden_dims': '[512, 64]', 'dropout': 0.424642737080992, 'batch_norm': False, 'sage_aggr': 'max', 'sage_normalize': False, 'sage_project': False, 'lr': 0.00011542941193954078, 'weight_decay': 2.9730162406670915e-07, 'epochs': 309, 'loss': 'mse', 'optimizer': 'adam', 'graph_mode': 'knn', 'knn_k': 2, 'weighted_edges': False, 'symmetrize_mode': 'mutual', 'self_loops': True, 'use_snp_selection': True, 'num_snps': 2195}. Best is trial 28 with value: 0.2966595349924173.
[I 2025-12-09 19:47:20,874] Trial 42 finished with value: 0.28641545043909594 and parameters: {'model_type': 'graphsage', 'hidden_dims': '[128, 64]', 'dropout': 0.3615448743158469, 'batch_norm': False, 'sage_aggr': 'max', 'sage_normalize': False, 'sage_project': False, 'lr': 0.00022399030084238432, 'weight_decay': 0.00022158088228260389, 'epochs': 188, 'loss': 'mse', 'optimizer': 'adam', 'graph_mode': 'knn', 'knn_k': 8, 'weighted_edges': True, 'symmetrize_mode': 'mutual', 'self_loops': True, 'use_snp_selection': True, 'num_snps': 16751}. Best is trial 28 with value: 0.2966595349924173.
[I 2025-12-09 19:48:10,234] Trial 43 finished with value: 0.28404410008955083 and parameters: {'model_type': 'graphsage', 'hidden_dims': '[128, 64]', 'dropout': 0.44334550669195333, 'batch_norm': False, 'sage_aggr': 'max', 'sage_normalize': False, 'sage_project': False, 'lr': 0.0004418794453805818, 'weight_decay': 1.582527426663934e-07, 'epochs': 239, 'loss': 'mse', 'optimizer': 'adam', 'graph_mode': 'knn', 'knn_k': 3, 'weighted_edges': False, 'symmetrize_mode': 'mutual', 'self_loops': True, 'use_snp_selection': True, 'num_snps': 19626}. Best is trial 28 with value: 0.2966595349924173.
[I 2025-12-09 19:49:54,373] Trial 44 finished with value: 0.2618467936137524 and parameters: {'model_type': 'graphsage', 'hidden_dims': '[256, 128, 64]', 'dropout': 0.41377139836561155, 'batch_norm': False, 'sage_aggr': 'mean', 'sage_normalize': False, 'sage_project': False, 'lr': 5.9085603054022254e-05, 'weight_decay': 6.265324800054591e-07, 'epochs': 275, 'loss': 'mse', 'optimizer': 'adam', 'graph_mode': 'knn', 'knn_k': 2, 'weighted_edges': True, 'symmetrize_mode': 'union', 'self_loops': True, 'use_snp_selection': True, 'num_snps': 28706}. Best is trial 28 with value: 0.2966595349924173.
[I 2025-12-09 19:50:31,026] Trial 45 finished with value: 0.25965285792795706 and parameters: {'model_type': 'graphsage', 'hidden_dims': '[128, 64]', 'dropout': 0.32509299324228746, 'batch_norm': False, 'sage_aggr': 'max', 'sage_normalize': True, 'sage_project': False, 'lr': 7.699790913150561e-05, 'weight_decay': 1.0055082656730409e-07, 'epochs': 251, 'loss': 'mse', 'optimizer': 'adam', 'graph_mode': 'knn', 'knn_k': 6, 'weighted_edges': False, 'symmetrize_mode': 'mutual', 'self_loops': True, 'use_snp_selection': True, 'num_snps': 7947}. Best is trial 28 with value: 0.2966595349924173.
[I 2025-12-09 19:51:40,602] Trial 46 finished with value: 0.06608455599701443 and parameters: {'model_type': 'graphsage', 'hidden_dims': '[512, 64]', 'dropout': 0.484308494202558, 'batch_norm': False, 'sage_aggr': 'max', 'sage_normalize': False, 'sage_project': False, 'lr': 0.0003600396297538745, 'weight_decay': 3.397478419259324e-07, 'epochs': 215, 'loss': 'mse', 'optimizer': 'adam', 'graph_mode': 'knn', 'knn_k': 5, 'weighted_edges': True, 'symmetrize_mode': 'union', 'self_loops': True, 'use_snp_selection': True, 'num_snps': 13625}. Best is trial 28 with value: 0.2966595349924173.
[I 2025-12-09 19:52:34,660] Trial 47 finished with value: 0.28083352587701926 and parameters: {'model_type': 'graphsage', 'hidden_dims': '[128, 64]', 'dropout': 0.4666865197186863, 'batch_norm': False, 'sage_aggr': 'max', 'sage_normalize': False, 'sage_project': False, 'lr': 0.0001350535250946362, 'weight_decay': 5.241376135759679e-06, 'epochs': 158, 'loss': 'mse', 'optimizer': 'adam', 'graph_mode': 'knn', 'knn_k': 4, 'weighted_edges': False, 'symmetrize_mode': 'mutual', 'self_loops': True, 'use_snp_selection': True, 'num_snps': 25547}. Best is trial 28 with value: 0.2966595349924173.
[I 2025-12-09 19:55:56,206] Trial 48 finished with value: 0.26759413074470656 and parameters: {'model_type': 'graphsage', 'hidden_dims': '[512, 128]', 'dropout': 0.40053898487365214, 'batch_norm': True, 'sage_aggr': 'max', 'sage_normalize': False, 'sage_project': False, 'lr': 0.0005858255397191356, 'weight_decay': 1.6959715812916083e-06, 'epochs': 288, 'loss': 'mse', 'optimizer': 'adam', 'graph_mode': 'knn', 'knn_k': 10, 'weighted_edges': True, 'symmetrize_mode': 'union', 'self_loops': True, 'use_snp_selection': True, 'num_snps': 20054}. Best is trial 28 with value: 0.2966595349924173.
[I 2025-12-09 19:56:33,746] Trial 49 finished with value: 0.26495856547646246 and parameters: {'model_type': 'graphsage', 'hidden_dims': '[128, 64]', 'dropout': 0.2590118611473789, 'batch_norm': False, 'sage_aggr': 'mean', 'sage_normalize': True, 'sage_project': False, 'lr': 5.593168846886791e-05, 'weight_decay': 1.975982936960204e-07, 'epochs': 302, 'loss': 'mae', 'optimizer': 'adam', 'graph_mode': 'knn', 'knn_k': 6, 'weighted_edges': False, 'symmetrize_mode': 'mutual', 'self_loops': False, 'use_snp_selection': True, 'num_snps': 9005}. Best is trial 28 with value: 0.2966595349924173.
[I 2025-12-09 20:00:38,204] Trial 50 finished with value: 0.2606592811008271 and parameters: {'model_type': 'graphsage', 'hidden_dims': '[128, 64]', 'dropout': 0.35330563687718786, 'batch_norm': False, 'sage_aggr': 'max', 'sage_normalize': False, 'sage_project': False, 'lr': 9.48015555292506e-05, 'weight_decay': 0.00038557821320362893, 'epochs': 177, 'loss': 'mse', 'optimizer': 'adam', 'graph_mode': 'cutoff', 'cutoff': 0.21560613968174253, 'grm_norm': 'cosine_then_gcn', 'self_loops': True, 'use_snp_selection': True, 'num_snps': 39957}. Best is trial 28 with value: 0.2966595349924173.
[I 2025-12-09 20:02:31,776] Trial 51 finished with value: 0.2982190349673757 and parameters: {'model_type': 'graphsage', 'hidden_dims': '[256, 128]', 'dropout': 0.367239571557251, 'batch_norm': False, 'sage_aggr': 'max', 'sage_normalize': False, 'sage_project': False, 'lr': 3.839104591504779e-05, 'weight_decay': 0.00014635656363298248, 'epochs': 218, 'loss': 'mse', 'optimizer': 'adam', 'graph_mode': 'knn', 'knn_k': 4, 'weighted_edges': True, 'symmetrize_mode': 'union', 'self_loops': True, 'use_snp_selection': True, 'num_snps': 25743}. Best is trial 51 with value: 0.2982190349673757.
[I 2025-12-09 20:03:58,005] Trial 52 finished with value: 0.291203332642992 and parameters: {'model_type': 'graphsage', 'hidden_dims': '[256, 128]', 'dropout': 0.43801742844312797, 'batch_norm': False, 'sage_aggr': 'max', 'sage_normalize': False, 'sage_project': False, 'lr': 1.9699442523085957e-05, 'weight_decay': 0.0008778415845177091, 'epochs': 206, 'loss': 'mse', 'optimizer': 'adam', 'graph_mode': 'knn', 'knn_k': 4, 'weighted_edges': True, 'symmetrize_mode': 'union', 'self_loops': True, 'use_snp_selection': True, 'num_snps': 27638}. Best is trial 51 with value: 0.2982190349673757.
[I 2025-12-09 20:06:39,653] Trial 53 finished with value: 0.29408318112287 and parameters: {'model_type': 'graphsage', 'hidden_dims': '[256, 128]', 'dropout': 0.444144919422729, 'batch_norm': False, 'sage_aggr': 'max', 'sage_normalize': False, 'sage_project': False, 'lr': 1.8761081441591693e-05, 'weight_decay': 8.71195357481492e-05, 'epochs': 214, 'loss': 'mse', 'optimizer': 'adam', 'graph_mode': 'knn', 'knn_k': 5, 'weighted_edges': True, 'symmetrize_mode': 'union', 'self_loops': True, 'use_snp_selection': True, 'num_snps': 32991}. Best is trial 51 with value: 0.2982190349673757.
[I 2025-12-09 20:09:24,575] Trial 54 finished with value: 0.29027844803407227 and parameters: {'model_type': 'graphsage', 'hidden_dims': '[256, 128]', 'dropout': 0.46089101978468183, 'batch_norm': False, 'sage_aggr': 'max', 'sage_normalize': False, 'sage_project': False, 'lr': 1.815112085279967e-05, 'weight_decay': 0.00012779648424492672, 'epochs': 224, 'loss': 'mse', 'optimizer': 'adam', 'graph_mode': 'knn', 'knn_k': 5, 'weighted_edges': True, 'symmetrize_mode': 'union', 'self_loops': True, 'use_snp_selection': True, 'num_snps': 33219}. Best is trial 51 with value: 0.2982190349673757.
[I 2025-12-09 20:12:17,436] Trial 55 finished with value: 0.2870015187478092 and parameters: {'model_type': 'graphsage', 'hidden_dims': '[256, 128]', 'dropout': 0.5131987659800854, 'batch_norm': False, 'sage_aggr': 'max', 'sage_normalize': False, 'sage_project': False, 'lr': 3.6250664046758465e-05, 'weight_decay': 0.00012336084026513285, 'epochs': 243, 'loss': 'mse', 'optimizer': 'adam', 'graph_mode': 'knn', 'knn_k': 5, 'weighted_edges': True, 'symmetrize_mode': 'union', 'self_loops': True, 'use_snp_selection': True, 'num_snps': 31386}. Best is trial 51 with value: 0.2982190349673757.
[I 2025-12-09 20:15:21,592] Trial 56 finished with value: 0.06084608372752968 and parameters: {'model_type': 'graphsage', 'hidden_dims': '[256, 128]', 'dropout': 0.10029379133731359, 'batch_norm': False, 'sage_aggr': 'max', 'sage_normalize': False, 'sage_project': False, 'lr': 0.0058036231742025855, 'weight_decay': 5.7734873560406743e-05, 'epochs': 275, 'loss': 'mae', 'optimizer': 'adam', 'graph_mode': 'knn', 'knn_k': 4, 'weighted_edges': True, 'symmetrize_mode': 'union', 'self_loops': False, 'use_snp_selection': True, 'num_snps': 38589}. Best is trial 51 with value: 0.2982190349673757.
[I 2025-12-09 20:16:23,983] Trial 57 finished with value: 0.2844467277852185 and parameters: {'model_type': 'graphsage', 'hidden_dims': '[256, 128]', 'dropout': 0.36402789410857445, 'batch_norm': False, 'sage_aggr': 'max', 'sage_normalize': False, 'sage_project': False, 'lr': 1.3857398547205554e-05, 'weight_decay': 1.825428676636408e-05, 'epochs': 192, 'loss': 'mse', 'optimizer': 'adam', 'graph_mode': 'cutoff', 'cutoff': 0.889073543245168, 'grm_norm': 'cosine', 'self_loops': True, 'use_snp_selection': False}. Best is trial 51 with value: 0.2982190349673757.
[I 2025-12-09 20:20:44,821] Trial 58 finished with value: 0.2851179904189668 and parameters: {'model_type': 'graphsage', 'hidden_dims': '[256, 128]', 'dropout': 0.2207766409828473, 'batch_norm': False, 'sage_aggr': 'max', 'sage_normalize': False, 'sage_project': False, 'lr': 4.596588075988823e-05, 'weight_decay': 0.00016996915715625737, 'epochs': 217, 'loss': 'mse', 'optimizer': 'adam', 'graph_mode': 'knn', 'knn_k': 6, 'weighted_edges': True, 'symmetrize_mode': 'union', 'self_loops': True, 'use_snp_selection': True, 'num_snps': 44842}. Best is trial 51 with value: 0.2982190349673757.
[I 2025-12-09 20:25:39,417] Trial 59 finished with value: 0.2844318077565428 and parameters: {'model_type': 'graphsage', 'hidden_dims': '[512, 128]', 'dropout': 0.39912973309189936, 'batch_norm': False, 'sage_aggr': 'max', 'sage_normalize': False, 'sage_project': False, 'lr': 2.0232514689213218e-05, 'weight_decay': 1.5282968780851108e-07, 'epochs': 229, 'loss': 'mse', 'optimizer': 'adam', 'graph_mode': 'knn', 'knn_k': 4, 'weighted_edges': True, 'symmetrize_mode': 'union', 'self_loops': True, 'use_snp_selection': True, 'num_snps': 51439}. Best is trial 51 with value: 0.2982190349673757.
[I 2025-12-09 20:28:22,037] Trial 60 finished with value: 0.2807538699626323 and parameters: {'model_type': 'graphsage', 'hidden_dims': '[256, 128, 64]', 'dropout': 0.3247141697368875, 'batch_norm': False, 'sage_aggr': 'mean', 'sage_normalize': False, 'sage_project': False, 'lr': 3.74070661606387e-05, 'weight_decay': 7.62238878779643e-05, 'epochs': 261, 'loss': 'mae', 'optimizer': 'adam', 'graph_mode': 'knn', 'knn_k': 5, 'weighted_edges': True, 'symmetrize_mode': 'union', 'self_loops': False, 'use_snp_selection': True, 'num_snps': 32679}. Best is trial 51 with value: 0.2982190349673757.
[I 2025-12-09 20:30:12,582] Trial 61 finished with value: 0.29294010310614604 and parameters: {'model_type': 'graphsage', 'hidden_dims': '[256, 128]', 'dropout': 0.4327843259774115, 'batch_norm': False, 'sage_aggr': 'max', 'sage_normalize': False, 'sage_project': False, 'lr': 2.169667358215744e-05, 'weight_decay': 0.0006136296593909163, 'epochs': 211, 'loss': 'mse', 'optimizer': 'adam', 'graph_mode': 'knn', 'knn_k': 4, 'weighted_edges': True, 'symmetrize_mode': 'union', 'self_loops': True, 'use_snp_selection': True, 'num_snps': 26792}. Best is trial 51 with value: 0.2982190349673757.
[I 2025-12-09 20:31:59,378] Trial 62 finished with value: 0.2957543759555632 and parameters: {'model_type': 'graphsage', 'hidden_dims': '[256, 128]', 'dropout': 0.45109411762224555, 'batch_norm': False, 'sage_aggr': 'max', 'sage_normalize': False, 'sage_project': False, 'lr': 2.2990135630129234e-05, 'weight_decay': 0.0003311658026085756, 'epochs': 205, 'loss': 'mse', 'optimizer': 'adam', 'graph_mode': 'knn', 'knn_k': 4, 'weighted_edges': True, 'symmetrize_mode': 'union', 'self_loops': True, 'use_snp_selection': True, 'num_snps': 25573}. Best is trial 51 with value: 0.2982190349673757.
[I 2025-12-09 20:33:34,914] Trial 63 finished with value: 0.29441292320280976 and parameters: {'model_type': 'graphsage', 'hidden_dims': '[256, 128]', 'dropout': 0.4272327179537408, 'batch_norm': False, 'sage_aggr': 'max', 'sage_normalize': False, 'sage_project': False, 'lr': 1.0589368600013945e-05, 'weight_decay': 0.00042381684618065385, 'epochs': 174, 'loss': 'mse', 'optimizer': 'adam', 'graph_mode': 'knn', 'knn_k': 4, 'weighted_edges': True, 'symmetrize_mode': 'union', 'self_loops': True, 'use_snp_selection': True, 'num_snps': 25926}. Best is trial 51 with value: 0.2982190349673757.
[I 2025-12-09 20:35:11,020] Trial 64 finished with value: 0.28622561276397357 and parameters: {'model_type': 'graphsage', 'hidden_dims': '[256, 128]', 'dropout': 0.4899310597058344, 'batch_norm': False, 'sage_aggr': 'max', 'sage_normalize': False, 'sage_project': False, 'lr': 1.012520560200212e-05, 'weight_decay': 0.0003410537452215001, 'epochs': 167, 'loss': 'mse', 'optimizer': 'adam', 'graph_mode': 'knn', 'knn_k': 3, 'weighted_edges': True, 'symmetrize_mode': 'union', 'self_loops': True, 'use_snp_selection': True, 'num_snps': 30030}. Best is trial 51 with value: 0.2982190349673757.
[I 2025-12-09 20:36:38,344] Trial 65 finished with value: 0.2967899424501973 and parameters: {'model_type': 'graphsage', 'hidden_dims': '[256, 128]', 'dropout': 0.449219131077705, 'batch_norm': False, 'sage_aggr': 'max', 'sage_normalize': False, 'sage_project': False, 'lr': 1.40058436438545e-05, 'weight_decay': 0.0002719631898877987, 'epochs': 196, 'loss': 'mse', 'optimizer': 'adam', 'graph_mode': 'cutoff', 'cutoff': 0.35095784615514836, 'grm_norm': 'none', 'self_loops': True, 'use_snp_selection': True, 'num_snps': 24973}. Best is trial 51 with value: 0.2982190349673757.
[I 2025-12-09 20:38:01,030] Trial 66 finished with value: 0.29561279168723126 and parameters: {'model_type': 'graphsage', 'hidden_dims': '[256, 128]', 'dropout': 0.3901257442384778, 'batch_norm': False, 'sage_aggr': 'max', 'sage_normalize': False, 'sage_project': False, 'lr': 1.2175605220958676e-05, 'weight_decay': 0.00028459838234016365, 'epochs': 148, 'loss': 'mse', 'optimizer': 'adam', 'graph_mode': 'cutoff', 'cutoff': 0.32512189594308194, 'grm_norm': 'none', 'self_loops': True, 'use_snp_selection': True, 'num_snps': 25008}. Best is trial 51 with value: 0.2982190349673757.
[I 2025-12-09 20:39:23,556] Trial 67 finished with value: 0.2779079605126829 and parameters: {'model_type': 'graphsage', 'hidden_dims': '[256, 128]', 'dropout': 0.37215231634811097, 'batch_norm': False, 'sage_aggr': 'max', 'sage_normalize': True, 'sage_project': False, 'lr': 1.3185573433816592e-05, 'weight_decay': 0.00026309764538632864, 'epochs': 150, 'loss': 'mse', 'optimizer': 'adam', 'graph_mode': 'cutoff', 'cutoff': 0.3317043234229147, 'grm_norm': 'none', 'self_loops': True, 'use_snp_selection': True, 'num_snps': 25050}. Best is trial 51 with value: 0.2982190349673757.
[I 2025-12-09 20:41:34,034] Trial 68 finished with value: 0.2464273416455865 and parameters: {'model_type': 'graphsage', 'hidden_dims': '[256, 128]', 'dropout': 0.3911756760064543, 'batch_norm': True, 'sage_aggr': 'max', 'sage_normalize': False, 'sage_project': False, 'lr': 1.263207465511161e-05, 'weight_decay': 0.0005290005834076626, 'epochs': 173, 'loss': 'mse', 'optimizer': 'adam', 'graph_mode': 'cutoff', 'cutoff': 0.28996603061061454, 'grm_norm': 'none', 'self_loops': True, 'use_snp_selection': False}. Best is trial 51 with value: 0.2982190349673757.
[I 2025-12-09 20:42:33,712] Trial 69 finished with value: 0.3004994880946845 and parameters: {'model_type': 'graphsage', 'hidden_dims': '[256, 128]', 'dropout': 0.41049178983568513, 'batch_norm': False, 'sage_aggr': 'max', 'sage_normalize': False, 'sage_project': False, 'lr': 1.5334173565455024e-05, 'weight_decay': 0.00017961762038219342, 'epochs': 183, 'loss': 'mse', 'optimizer': 'adam', 'graph_mode': 'cutoff', 'cutoff': 0.38991341201253904, 'grm_norm': 'none', 'self_loops': True, 'use_snp_selection': True, 'num_snps': 20498}. Best is trial 69 with value: 0.3004994880946845.
