[I 2025-12-08 12:30:57,822] Trial 76 finished with value: 0.3007408607600311 and parameters: {'model_type': 'graphsage', 'hidden_dims': '[512, 64]', 'dropout': 0.1491889015604989, 'batch_norm': True, 'sage_aggr': 'mean', 'sage_normalize': True, 'sage_project': False, 'lr': 0.001446802596149709, 'weight_decay': 8.831021232686723e-06, 'epochs': 339, 'loss': 'mae', 'optimizer': 'adam', 'graph_mode': 'cutoff', 'cutoff': 0.8512645609341365, 'grm_norm': 'gcn', 'self_loops': False, 'use_snp_selection': False}. Best is trial 49 with value: 0.3080013377654483.
[I 2025-12-08 12:33:27,510] Trial 77 finished with value: 0.30262724421392206 and parameters: {'model_type': 'graphsage', 'hidden_dims': '[512, 64]', 'dropout': 0.12772478896387374, 'batch_norm': True, 'sage_aggr': 'max', 'sage_normalize': True, 'sage_project': False, 'lr': 0.0056668984195900685, 'weight_decay': 1.3599914480930635e-05, 'epochs': 284, 'loss': 'mae', 'optimizer': 'adam', 'graph_mode': 'cutoff', 'cutoff': 0.8010189210751671, 'grm_norm': 'cosine_then_gcn', 'self_loops': False, 'use_snp_selection': False}. Best is trial 49 with value: 0.3080013377654483.
[I 2025-12-08 12:34:52,044] Trial 78 finished with value: 0.25392415005804236 and parameters: {'model_type': 'graphsage', 'hidden_dims': '[256, 128, 64]', 'dropout': 0.27705252069066416, 'batch_norm': True, 'sage_aggr': 'mean', 'sage_normalize': True, 'sage_project': False, 'lr': 0.006912968093412582, 'weight_decay': 6.610544453942963e-05, 'epochs': 292, 'loss': 'mae', 'optimizer': 'adam', 'graph_mode': 'cutoff', 'cutoff': 0.8817076472682562, 'grm_norm': 'none', 'self_loops': False, 'use_snp_selection': False}. Best is trial 49 with value: 0.3080013377654483.
[I 2025-12-08 12:37:18,902] Trial 79 finished with value: 0.23856147065576389 and parameters: {'model_type': 'graphsage', 'hidden_dims': '[512, 64]', 'dropout': 0.31567645111514164, 'batch_norm': True, 'sage_aggr': 'mean', 'sage_normalize': True, 'sage_project': False, 'lr': 0.0027573235712193924, 'weight_decay': 5.12163841553011e-05, 'epochs': 268, 'loss': 'mae', 'optimizer': 'adam', 'graph_mode': 'knn', 'knn_k': 1, 'weighted_edges': False, 'symmetrize_mode': 'union', 'self_loops': False, 'use_snp_selection': False}. Best is trial 49 with value: 0.3080013377654483.
[I 2025-12-08 12:39:18,589] Trial 80 finished with value: 0.3032643649568799 and parameters: {'model_type': 'graphsage', 'hidden_dims': '[512, 64]', 'dropout': 0.5999639146069593, 'batch_norm': True, 'sage_aggr': 'mean', 'sage_normalize': True, 'sage_project': False, 'lr': 0.003970471124094394, 'weight_decay': 2.0419767694955006e-05, 'epochs': 224, 'loss': 'mae', 'optimizer': 'adam', 'graph_mode': 'cutoff', 'cutoff': 0.8279636775908694, 'grm_norm': 'cosine_then_gcn', 'self_loops': False, 'use_snp_selection': False}. Best is trial 49 with value: 0.3080013377654483.
[I 2025-12-08 12:39:37,731] Trial 81 finished with value: 0.3000334487482145 and parameters: {'model_type': 'graphsage', 'hidden_dims': '[256, 128]', 'dropout': 0.5309450663709481, 'batch_norm': True, 'sage_aggr': 'mean', 'sage_normalize': True, 'sage_project': False, 'lr': 0.00215346202943733, 'weight_decay': 0.00012768816559193135, 'epochs': 58, 'loss': 'mae', 'optimizer': 'adam', 'graph_mode': 'cutoff', 'cutoff': 0.748399531707197, 'grm_norm': 'gcn', 'self_loops': False, 'use_snp_selection': False}. Best is trial 49 with value: 0.3080013377654483.
[I 2025-12-08 12:41:49,343] Trial 82 finished with value: 0.29957845812538875 and parameters: {'model_type': 'graphsage', 'hidden_dims': '[512, 256]', 'dropout': 0.5749869312324526, 'batch_norm': True, 'sage_aggr': 'mean', 'sage_normalize': True, 'sage_project': False, 'lr': 0.001714400347419304, 'weight_decay': 1.3858194389619371e-05, 'epochs': 246, 'loss': 'mae', 'optimizer': 'adam', 'graph_mode': 'cutoff', 'cutoff': 0.7726614175353727, 'grm_norm': 'cosine_then_gcn', 'self_loops': False, 'use_snp_selection': False}. Best is trial 49 with value: 0.3080013377654483.
[I 2025-12-08 12:42:29,173] Trial 83 finished with value: 0.2954462192619317 and parameters: {'model_type': 'graphsage', 'hidden_dims': '[256, 128]', 'dropout': 0.5621096294215971, 'batch_norm': True, 'sage_aggr': 'mean', 'sage_normalize': True, 'sage_project': False, 'lr': 0.0010722527816188674, 'weight_decay': 0.0006856404495473844, 'epochs': 132, 'loss': 'mae', 'optimizer': 'adam', 'graph_mode': 'cutoff', 'cutoff': 0.7161240305220976, 'grm_norm': 'cosine_then_gcn', 'self_loops': False, 'use_snp_selection': False}. Best is trial 49 with value: 0.3080013377654483.
[I 2025-12-08 12:43:55,433] Trial 84 finished with value: 0.298519523739378 and parameters: {'model_type': 'graphsage', 'hidden_dims': '[256, 128]', 'dropout': 0.5480456451988892, 'batch_norm': True, 'sage_aggr': 'mean', 'sage_normalize': True, 'sage_project': False, 'lr': 0.002592457169026488, 'weight_decay': 0.0001046656652085612, 'epochs': 299, 'loss': 'mae', 'optimizer': 'adam', 'graph_mode': 'cutoff', 'cutoff': 0.6873525931933803, 'grm_norm': 'cosine', 'self_loops': False, 'use_snp_selection': False}. Best is trial 49 with value: 0.3080013377654483.
[I 2025-12-08 12:44:53,220] Trial 85 finished with value: 0.2933784173879859 and parameters: {'model_type': 'graphsage', 'hidden_dims': '[128, 64]', 'dropout': 0.525401964417394, 'batch_norm': True, 'sage_aggr': 'mean', 'sage_normalize': True, 'sage_project': False, 'lr': 0.004974238772848269, 'weight_decay': 7.169221016358713e-06, 'epochs': 322, 'loss': 'mae', 'optimizer': 'adam', 'graph_mode': 'cutoff', 'cutoff': 0.7325264967198192, 'grm_norm': 'cosine', 'self_loops': False, 'use_snp_selection': False}. Best is trial 49 with value: 0.3080013377654483.
[I 2025-12-08 12:45:58,271] Trial 86 finished with value: 0.2966922683636567 and parameters: {'model_type': 'graphsage', 'hidden_dims': '[512, 64]', 'dropout': 0.21041853467377475, 'batch_norm': True, 'sage_aggr': 'mean', 'sage_normalize': False, 'sage_project': False, 'lr': 0.0015491338925632636, 'weight_decay': 0.00023571169887347785, 'epochs': 118, 'loss': 'mae', 'optimizer': 'adam', 'graph_mode': 'cutoff', 'cutoff': 0.8984917418870634, 'grm_norm': 'cosine_then_gcn', 'self_loops': False, 'use_snp_selection': False}. Best is trial 49 with value: 0.3080013377654483.
[I 2025-12-08 12:46:21,937] Trial 87 finished with value: 0.24165762724622203 and parameters: {'model_type': 'graphsage', 'hidden_dims': '[256, 128]', 'dropout': 0.23993456224383658, 'batch_norm': False, 'sage_aggr': 'mean', 'sage_normalize': True, 'sage_project': False, 'lr': 0.00867565517243731, 'weight_decay': 2.9988251260737878e-05, 'epochs': 40, 'loss': 'mae', 'optimizer': 'adam', 'graph_mode': 'cutoff', 'cutoff': 0.8572232313892673, 'grm_norm': 'none', 'self_loops': False, 'use_snp_selection': True, 'num_snps': 41671}. Best is trial 49 with value: 0.3080013377654483.
[I 2025-12-08 12:47:55,927] Trial 88 finished with value: 0.3064871367887032 and parameters: {'model_type': 'graphsage', 'hidden_dims': '[512, 256]', 'dropout': 0.3388723514477812, 'batch_norm': True, 'sage_aggr': 'max', 'sage_normalize': True, 'sage_project': False, 'lr': 0.0033770507516462265, 'weight_decay': 4.208068445038032e-05, 'epochs': 174, 'loss': 'mse', 'optimizer': 'adam', 'graph_mode': 'cutoff', 'cutoff': 0.8001727750605232, 'grm_norm': 'cosine', 'self_loops': False, 'use_snp_selection': False}. Best is trial 49 with value: 0.3080013377654483.
[I 2025-12-08 12:49:07,997] Trial 89 finished with value: 0.28566626862341427 and parameters: {'model_type': 'graphsage', 'hidden_dims': '[512, 256]', 'dropout': 0.3609691023832388, 'batch_norm': True, 'sage_aggr': 'max', 'sage_normalize': True, 'sage_project': False, 'lr': 0.003395794272887143, 'weight_decay': 4.003972151909666e-05, 'epochs': 103, 'loss': 'mse', 'optimizer': 'adam', 'graph_mode': 'cutoff', 'cutoff': 0.4522537384007172, 'grm_norm': 'gcn', 'self_loops': False, 'use_snp_selection': False}. Best is trial 49 with value: 0.3080013377654483.
[I 2025-12-08 12:51:17,372] Trial 90 finished with value: 0.30697691813576106 and parameters: {'model_type': 'graphsage', 'hidden_dims': '[512, 256]', 'dropout': 0.2003188491267454, 'batch_norm': True, 'sage_aggr': 'max', 'sage_normalize': True, 'sage_project': False, 'lr': 0.004248330522250621, 'weight_decay': 7.433870571407768e-05, 'epochs': 243, 'loss': 'mse', 'optimizer': 'adam', 'graph_mode': 'cutoff', 'cutoff': 0.7919875207703958, 'grm_norm': 'cosine', 'self_loops': True, 'use_snp_selection': False}. Best is trial 49 with value: 0.3080013377654483.
[I 2025-12-08 12:53:36,464] Trial 91 finished with value: 0.3001373044307719 and parameters: {'model_type': 'graphsage', 'hidden_dims': '[512, 256]', 'dropout': 0.17194979503151725, 'batch_norm': True, 'sage_aggr': 'max', 'sage_normalize': True, 'sage_project': False, 'lr': 0.0042456245665199585, 'weight_decay': 7.761717250617757e-05, 'epochs': 262, 'loss': 'mse', 'optimizer': 'adam', 'graph_mode': 'cutoff', 'cutoff': 0.7915644030846752, 'grm_norm': 'cosine', 'self_loops': True, 'use_snp_selection': False}. Best is trial 49 with value: 0.3080013377654483.
[I 2025-12-08 12:56:03,710] Trial 92 finished with value: 0.2935707611731827 and parameters: {'model_type': 'graphsage', 'hidden_dims': '[512, 256]', 'dropout': 0.2040017883686906, 'batch_norm': True, 'sage_aggr': 'max', 'sage_normalize': True, 'sage_project': False, 'lr': 0.005582589001917766, 'weight_decay': 5.6907995437048195e-05, 'epochs': 278, 'loss': 'mse', 'optimizer': 'adam', 'graph_mode': 'cutoff', 'cutoff': 0.8152237280868784, 'grm_norm': 'cosine', 'self_loops': True, 'use_snp_selection': False}. Best is trial 49 with value: 0.3080013377654483.
[I 2025-12-08 12:58:12,085] Trial 93 finished with value: 0.30364440721575386 and parameters: {'model_type': 'graphsage', 'hidden_dims': '[512, 256]', 'dropout': 0.38302106469963376, 'batch_norm': True, 'sage_aggr': 'max', 'sage_normalize': True, 'sage_project': False, 'lr': 0.006966097581239343, 'weight_decay': 2.2838780133027216e-05, 'epochs': 241, 'loss': 'mse', 'optimizer': 'adam', 'graph_mode': 'cutoff', 'cutoff': 0.8362044984961295, 'grm_norm': 'cosine', 'self_loops': True, 'use_snp_selection': False}. Best is trial 49 with value: 0.3080013377654483.
[I 2025-12-08 13:00:55,721] Trial 94 finished with value: 0.2994944742228948 and parameters: {'model_type': 'graphsage', 'hidden_dims': '[512, 256]', 'dropout': 0.2544438005339421, 'batch_norm': True, 'sage_aggr': 'max', 'sage_normalize': True, 'sage_project': False, 'lr': 0.0037146659667697574, 'weight_decay': 3.2418121037855445e-05, 'epochs': 310, 'loss': 'mse', 'optimizer': 'adam', 'graph_mode': 'cutoff', 'cutoff': 0.8731242912038002, 'grm_norm': 'cosine', 'self_loops': True, 'use_snp_selection': False}. Best is trial 49 with value: 0.3080013377654483.
[I 2025-12-08 13:02:59,355] Trial 95 finished with value: 0.29968398497310506 and parameters: {'model_type': 'graphsage', 'hidden_dims': '[512, 256]', 'dropout': 0.3393333670820711, 'batch_norm': True, 'sage_aggr': 'max', 'sage_normalize': True, 'sage_project': False, 'lr': 0.0029309593025810855, 'weight_decay': 8.278435717139946e-05, 'epochs': 232, 'loss': 'mse', 'optimizer': 'adam', 'graph_mode': 'cutoff', 'cutoff': 0.7596910130753735, 'grm_norm': 'cosine', 'self_loops': True, 'use_snp_selection': False}. Best is trial 49 with value: 0.3080013377654483.
[I 2025-12-08 13:04:49,603] Trial 96 finished with value: 0.29664628900473616 and parameters: {'model_type': 'graphsage', 'hidden_dims': '[512, 256]', 'dropout': 0.19700074691679614, 'batch_norm': True, 'sage_aggr': 'max', 'sage_normalize': True, 'sage_project': False, 'lr': 0.004871088260055181, 'weight_decay': 1.6892643522865384e-05, 'epochs': 206, 'loss': 'mse', 'optimizer': 'adam', 'graph_mode': 'cutoff', 'cutoff': 0.8477940892616626, 'grm_norm': 'cosine_then_gcn', 'self_loops': False, 'use_snp_selection': False}. Best is trial 49 with value: 0.3080013377654483.
[I 2025-12-08 13:07:04,863] Trial 97 finished with value: 0.2584496066876564 and parameters: {'model_type': 'graphsage', 'hidden_dims': '[512, 128]', 'dropout': 0.2952018955039953, 'batch_norm': True, 'sage_aggr': 'max', 'sage_normalize': True, 'sage_project': False, 'lr': 0.006423471194390278, 'weight_decay': 0.00011281142512033873, 'epochs': 193, 'loss': 'mse', 'optimizer': 'adam', 'graph_mode': 'knn', 'knn_k': 7, 'weighted_edges': True, 'symmetrize_mode': 'mutual', 'self_loops': False, 'use_snp_selection': False}. Best is trial 49 with value: 0.3080013377654483.
[I 2025-12-08 13:08:38,821] Trial 98 finished with value: 0.29800112702597564 and parameters: {'model_type': 'graphsage', 'hidden_dims': '[512, 64]', 'dropout': 0.1533478879929655, 'batch_norm': True, 'sage_aggr': 'max', 'sage_normalize': True, 'sage_project': False, 'lr': 0.0023988926352461683, 'weight_decay': 4.8753226622666114e-05, 'epochs': 175, 'loss': 'mse', 'optimizer': 'adam', 'graph_mode': 'cutoff', 'cutoff': 0.7835863532799922, 'grm_norm': 'cosine', 'self_loops': True, 'use_snp_selection': False}. Best is trial 49 with value: 0.3080013377654483.
[I 2025-12-08 13:09:28,291] Trial 99 finished with value: 0.019455058362965 and parameters: {'model_type': 'graphsage', 'hidden_dims': '[512, 64]', 'dropout': 0.10054100378583572, 'batch_norm': False, 'sage_aggr': 'max', 'sage_normalize': False, 'sage_project': False, 'lr': 0.0019024024469668453, 'weight_decay': 4.282148133486029e-05, 'epochs': 88, 'loss': 'mse', 'optimizer': 'adam', 'graph_mode': 'cutoff', 'cutoff': 0.8046275968584558, 'grm_norm': 'cosine_then_gcn', 'self_loops': False, 'use_snp_selection': False}. Best is trial 49 with value: 0.3080013377654483.
[I 2025-12-08 13:10:06,531] Trial 100 finished with value: 0.2715769193442833 and parameters: {'model_type': 'graphsage', 'hidden_dims': '[512, 256]', 'dropout': 0.11551057061762664, 'batch_norm': True, 'sage_aggr': 'max', 'sage_normalize': True, 'sage_project': False, 'lr': 0.008484663303248787, 'weight_decay': 1.2094453125870787e-05, 'epochs': 316, 'loss': 'mse', 'optimizer': 'adam', 'graph_mode': 'cutoff', 'cutoff': 0.8270735829911281, 'grm_norm': 'cosine_then_gcn', 'self_loops': False, 'use_snp_selection': True, 'num_snps': 10416}. Best is trial 49 with value: 0.3080013377654483.
[I 2025-12-08 13:10:55,143] Trial 101 finished with value: 0.2999043434924197 and parameters: {'model_type': 'graphsage', 'hidden_dims': '[256, 128]', 'dropout': 0.4991592332399424, 'batch_norm': True, 'sage_aggr': 'mean', 'sage_normalize': True, 'sage_project': False, 'lr': 0.003045306848254246, 'weight_decay': 6.014244754769061e-06, 'epochs': 164, 'loss': 'mae', 'optimizer': 'adam', 'graph_mode': 'cutoff', 'cutoff': 0.7475339794484703, 'grm_norm': 'cosine', 'self_loops': False, 'use_snp_selection': False}. Best is trial 49 with value: 0.3080013377654483.
[I 2025-12-08 13:11:38,458] Trial 102 finished with value: 0.29647134866759783 and parameters: {'model_type': 'graphsage', 'hidden_dims': '[256, 128, 64]', 'dropout': 0.5888152115764692, 'batch_norm': True, 'sage_aggr': 'mean', 'sage_normalize': True, 'sage_project': False, 'lr': 0.0022440203945943544, 'weight_decay': 3.8073842015921954e-06, 'epochs': 144, 'loss': 'mae', 'optimizer': 'adam', 'graph_mode': 'cutoff', 'cutoff': 0.8577871348926936, 'grm_norm': 'cosine', 'self_loops': False, 'use_snp_selection': False}. Best is trial 49 with value: 0.3080013377654483.
[I 2025-12-08 13:13:17,736] Trial 103 finished with value: 0.2971897173258145 and parameters: {'model_type': 'graphsage', 'hidden_dims': '[512, 64]', 'dropout': 0.5542697988948659, 'batch_norm': True, 'sage_aggr': 'mean', 'sage_normalize': True, 'sage_project': False, 'lr': 0.004210060087277676, 'weight_decay': 0.0001671233079467762, 'epochs': 184, 'loss': 'mae', 'optimizer': 'adam', 'graph_mode': 'cutoff', 'cutoff': 0.8830283605302889, 'grm_norm': 'cosine', 'self_loops': False, 'use_snp_selection': False}. Best is trial 49 with value: 0.3080013377654483.
[I 2025-12-08 13:15:58,119] Trial 104 finished with value: 0.2893856892712818 and parameters: {'model_type': 'graphsage', 'hidden_dims': '[512, 128]', 'dropout': 0.4245322825936756, 'batch_norm': True, 'sage_aggr': 'mean', 'sage_normalize': True, 'sage_project': False, 'lr': 0.0006280383131551661, 'weight_decay': 2.3142406120307447e-05, 'epochs': 303, 'loss': 'mae', 'optimizer': 'adam', 'graph_mode': 'cutoff', 'cutoff': 0.7821408856488924, 'grm_norm': 'cosine', 'self_loops': False, 'use_snp_selection': False}. Best is trial 49 with value: 0.3080013377654483.
[I 2025-12-08 13:18:32,889] Trial 105 finished with value: 0.3030384501695851 and parameters: {'model_type': 'graphsage', 'hidden_dims': '[512, 64]', 'dropout': 0.2441297646808204, 'batch_norm': True, 'sage_aggr': 'mean', 'sage_normalize': True, 'sage_project': False, 'lr': 0.0013596188376047435, 'weight_decay': 9.607136076129416e-06, 'epochs': 288, 'loss': 'mae', 'optimizer': 'adam', 'graph_mode': 'cutoff', 'cutoff': 0.5728578199653916, 'grm_norm': 'cosine', 'self_loops': False, 'use_snp_selection': False}. Best is trial 49 with value: 0.3080013377654483.
[I 2025-12-08 13:21:25,707] Trial 106 finished with value: 0.24326864683262284 and parameters: {'model_type': 'graphsage', 'hidden_dims': '[512, 64]', 'dropout': 0.5719931890641409, 'batch_norm': True, 'sage_aggr': 'mean', 'sage_normalize': True, 'sage_project': False, 'lr': 0.00020003860354591692, 'weight_decay': 6.678384235951287e-05, 'epochs': 328, 'loss': 'mae', 'optimizer': 'adam', 'graph_mode': 'cutoff', 'cutoff': 0.8160932862824555, 'grm_norm': 'cosine_then_gcn', 'self_loops': False, 'use_snp_selection': False}. Best is trial 49 with value: 0.3080013377654483.
[I 2025-12-08 13:22:13,216] Trial 107 finished with value: 0.2999421023697376 and parameters: {'model_type': 'graphsage', 'hidden_dims': '[256, 128]', 'dropout': 0.18341450122784603, 'batch_norm': True, 'sage_aggr': 'mean', 'sage_normalize': True, 'sage_project': False, 'lr': 0.005415196275845289, 'weight_decay': 2.8603081411113806e-05, 'epochs': 158, 'loss': 'mae', 'optimizer': 'adam', 'graph_mode': 'cutoff', 'cutoff': 0.6534022091456243, 'grm_norm': 'gcn', 'self_loops': False, 'use_snp_selection': False}. Best is trial 49 with value: 0.3080013377654483.
[I 2025-12-08 13:23:02,041] Trial 108 finished with value: 0.22927385693770463 and parameters: {'model_type': 'graphsage', 'hidden_dims': '[128, 64]', 'dropout': 0.21875377993122633, 'batch_norm': True, 'sage_aggr': 'mean', 'sage_normalize': True, 'sage_project': False, 'lr': 0.003708183128157498, 'weight_decay': 0.0007933629746941575, 'epochs': 270, 'loss': 'mae', 'optimizer': 'adam', 'graph_mode': 'cutoff', 'cutoff': 0.8373014025103872, 'grm_norm': 'cosine', 'self_loops': False, 'use_snp_selection': False}. Best is trial 49 with value: 0.3080013377654483.
[I 2025-12-08 13:26:00,689] Trial 109 finished with value: 0.2715258312827831 and parameters: {'model_type': 'graphsage', 'hidden_dims': '[512, 64]', 'dropout': 0.5858276625923474, 'batch_norm': True, 'sage_aggr': 'mean', 'sage_normalize': True, 'sage_project': False, 'lr': 0.009764831969440425, 'weight_decay': 0.00042800844538241147, 'epochs': 339, 'loss': 'mae', 'optimizer': 'adam', 'graph_mode': 'cutoff', 'cutoff': 0.7154664135027653, 'grm_norm': 'cosine_then_gcn', 'self_loops': False, 'use_snp_selection': False}. Best is trial 49 with value: 0.3080013377654483.
[I 2025-12-08 13:29:02,954] Trial 110 finished with value: 0.2997007310004013 and parameters: {'model_type': 'graphsage', 'hidden_dims': '[512, 256]', 'dropout': 0.26811788524167374, 'batch_norm': True, 'sage_aggr': 'mean', 'sage_normalize': True, 'sage_project': False, 'lr': 0.0045273024127037475, 'weight_decay': 5.564632161170076e-06, 'epochs': 216, 'loss': 'mae', 'optimizer': 'adam', 'graph_mode': 'knn', 'knn_k': 10, 'weighted_edges': True, 'symmetrize_mode': 'mutual', 'self_loops': True, 'use_snp_selection': False}. Best is trial 49 with value: 0.3080013377654483.
[I 2025-12-08 13:31:11,038] Trial 111 finished with value: 0.3023381585483896 and parameters: {'model_type': 'graphsage', 'hidden_dims': '[512, 128]', 'dropout': 0.5382110638830601, 'batch_norm': True, 'sage_aggr': 'mean', 'sage_normalize': True, 'sage_project': False, 'lr': 0.0027676403045878493, 'weight_decay': 7.577676123520783e-06, 'epochs': 240, 'loss': 'mae', 'optimizer': 'adam', 'graph_mode': 'cutoff', 'cutoff': 0.6744212083577116, 'grm_norm': 'cosine', 'self_loops': False, 'use_snp_selection': False}. Best is trial 49 with value: 0.3080013377654483.
[I 2025-12-08 13:33:23,551] Trial 112 finished with value: 0.30172541495106453 and parameters: {'model_type': 'graphsage', 'hidden_dims': '[512, 128]', 'dropout': 0.4683956206523401, 'batch_norm': True, 'sage_aggr': 'mean', 'sage_normalize': True, 'sage_project': False, 'lr': 0.0019228754205163118, 'weight_decay': 1.5497152694201586e-05, 'epochs': 249, 'loss': 'mae', 'optimizer': 'adam', 'graph_mode': 'cutoff', 'cutoff': 0.759113669654922, 'grm_norm': 'cosine', 'self_loops': False, 'use_snp_selection': False}. Best is trial 49 with value: 0.3080013377654483.
[I 2025-12-08 13:35:11,496] Trial 113 finished with value: 0.2987979054253051 and parameters: {'model_type': 'graphsage', 'hidden_dims': '[512, 128]', 'dropout': 0.14155676248354032, 'batch_norm': True, 'sage_aggr': 'mean', 'sage_normalize': True, 'sage_project': False, 'lr': 0.0032358469435554175, 'weight_decay': 1.1729465789678728e-05, 'epochs': 201, 'loss': 'mae', 'optimizer': 'adam', 'graph_mode': 'cutoff', 'cutoff': 0.6942342816654465, 'grm_norm': 'cosine', 'self_loops': False, 'use_snp_selection': False}. Best is trial 49 with value: 0.3080013377654483.
