[I 2025-12-05 17:27:08,582] Trial 141 finished with value: 0.2688289270693097 and parameters: {'model_type': 'graphsage', 'hidden_dims': '[512, 256]', 'dropout': 0.5687241390860021, 'batch_norm': True, 'sage_aggr': 'mean', 'sage_normalize': True, 'sage_project': False, 'lr': 0.0007569109086008065, 'weight_decay': 3.2458492571445676e-07, 'epochs': 188, 'loss': 'mae', 'optimizer': 'adam', 'graph_mode': 'cutoff', 'cutoff': 0.36677208954972096, 'grm_norm': 'gcn', 'self_loops': False, 'use_snp_selection': True, 'num_snps': 23214, 'graphsage_batch_size': 8}. Best is trial 102 with value: 0.2734579670807161.
[I 2025-12-05 17:28:22,173] Trial 142 finished with value: 0.27478752514376337 and parameters: {'model_type': 'graphsage', 'hidden_dims': '[512, 256]', 'dropout': 0.5695149044940573, 'batch_norm': True, 'sage_aggr': 'mean', 'sage_normalize': True, 'sage_project': False, 'lr': 0.0007278695743688487, 'weight_decay': 2.9971631883464856e-07, 'epochs': 188, 'loss': 'mae', 'optimizer': 'adam', 'graph_mode': 'cutoff', 'cutoff': 0.3680319148324512, 'grm_norm': 'gcn', 'self_loops': False, 'use_snp_selection': True, 'num_snps': 23533, 'graphsage_batch_size': 8}. Best is trial 142 with value: 0.27478752514376337.
[I 2025-12-05 17:29:35,096] Trial 143 finished with value: 0.264842187162706 and parameters: {'model_type': 'graphsage', 'hidden_dims': '[512, 256]', 'dropout': 0.575824396060552, 'batch_norm': True, 'sage_aggr': 'mean', 'sage_normalize': True, 'sage_project': False, 'lr': 0.0007556387841728008, 'weight_decay': 2.898538200516786e-07, 'epochs': 187, 'loss': 'mae', 'optimizer': 'adam', 'graph_mode': 'cutoff', 'cutoff': 0.3594437425121275, 'grm_norm': 'gcn', 'self_loops': False, 'use_snp_selection': True, 'num_snps': 23400, 'graphsage_batch_size': 8}. Best is trial 142 with value: 0.27478752514376337.
[I 2025-12-05 17:30:57,584] Trial 144 finished with value: 0.26449828734958036 and parameters: {'model_type': 'graphsage', 'hidden_dims': '[512, 256]', 'dropout': 0.5906128236743814, 'batch_norm': True, 'sage_aggr': 'mean', 'sage_normalize': True, 'sage_project': False, 'lr': 0.0005652611719888, 'weight_decay': 1.499519605259902e-07, 'epochs': 192, 'loss': 'mae', 'optimizer': 'adam', 'graph_mode': 'cutoff', 'cutoff': 0.3293015263218724, 'grm_norm': 'gcn', 'self_loops': False, 'use_snp_selection': True, 'num_snps': 24431, 'graphsage_batch_size': 8}. Best is trial 142 with value: 0.27478752514376337.
[I 2025-12-05 17:32:28,778] Trial 145 finished with value: 0.26896607397068356 and parameters: {'model_type': 'graphsage', 'hidden_dims': '[512, 256]', 'dropout': 0.5539051807891257, 'batch_norm': True, 'sage_aggr': 'mean', 'sage_normalize': True, 'sage_project': False, 'lr': 0.0008859824966717698, 'weight_decay': 1.8938355574348994e-07, 'epochs': 196, 'loss': 'mae', 'optimizer': 'adam', 'graph_mode': 'cutoff', 'cutoff': 0.37931879245482975, 'grm_norm': 'gcn', 'self_loops': False, 'use_snp_selection': True, 'num_snps': 27744, 'graphsage_batch_size': 8}. Best is trial 142 with value: 0.27478752514376337.
[I 2025-12-05 17:34:05,097] Trial 146 finished with value: 0.2617733076532026 and parameters: {'model_type': 'graphsage', 'hidden_dims': '[512, 256]', 'dropout': 0.5525721517347378, 'batch_norm': True, 'sage_aggr': 'mean', 'sage_normalize': True, 'sage_project': False, 'lr': 0.0008616457372124026, 'weight_decay': 1.8346323036570057e-07, 'epochs': 194, 'loss': 'mae', 'optimizer': 'adam', 'graph_mode': 'cutoff', 'cutoff': 0.3445156156245004, 'grm_norm': 'gcn', 'self_loops': False, 'use_snp_selection': True, 'num_snps': 28613, 'graphsage_batch_size': 8}. Best is trial 142 with value: 0.27478752514376337.
[I 2025-12-05 17:35:40,333] Trial 147 finished with value: 0.23602182772445182 and parameters: {'model_type': 'graphsage', 'hidden_dims': '[512, 256]', 'dropout': 0.5647154834136946, 'batch_norm': True, 'sage_aggr': 'mean', 'sage_normalize': True, 'sage_project': False, 'lr': 0.0006932686143014995, 'weight_decay': 1.3016227252710953e-07, 'epochs': 189, 'loss': 'mae', 'optimizer': 'adam', 'graph_mode': 'knn', 'knn_k': 5, 'weighted_edges': True, 'symmetrize_mode': 'union', 'self_loops': False, 'use_snp_selection': True, 'num_snps': 27540, 'graphsage_batch_size': 8}. Best is trial 142 with value: 0.27478752514376337.
[I 2025-12-05 17:38:15,017] Trial 148 finished with value: 0.25980757552508005 and parameters: {'model_type': 'graphsage', 'hidden_dims': '[512, 256]', 'dropout': 0.5410081627012331, 'batch_norm': True, 'sage_aggr': 'mean', 'sage_normalize': True, 'sage_project': False, 'lr': 0.0009984055015737172, 'weight_decay': 1.0543617500361838e-07, 'epochs': 203, 'loss': 'mae', 'optimizer': 'adam', 'graph_mode': 'cutoff', 'cutoff': 0.37295634058725297, 'grm_norm': 'gcn', 'self_loops': False, 'use_snp_selection': False, 'graphsage_batch_size': 8}. Best is trial 142 with value: 0.27478752514376337.
[I 2025-12-05 17:39:47,846] Trial 149 finished with value: 0.2616441975875587 and parameters: {'model_type': 'graphsage', 'hidden_dims': '[512, 256]', 'dropout': 0.5198262033054514, 'batch_norm': True, 'sage_aggr': 'mean', 'sage_normalize': True, 'sage_project': False, 'lr': 0.0003751820906521941, 'weight_decay': 2.3446713693121235e-07, 'epochs': 198, 'loss': 'mae', 'optimizer': 'adam', 'graph_mode': 'cutoff', 'cutoff': 0.3133308065421288, 'grm_norm': 'gcn', 'self_loops': False, 'use_snp_selection': True, 'num_snps': 26108, 'graphsage_batch_size': 8}. Best is trial 142 with value: 0.27478752514376337.
[I 2025-12-05 17:40:56,613] Trial 0 finished with value: 0.16276806672876748 and parameters: {'model_type': 'graphsage', 'hidden_dims': '[128, 64]', 'dropout': 0.199031432379812, 'batch_norm': True, 'sage_aggr': 'max', 'sage_normalize': False, 'sage_project': False, 'lr': 3.4401453323286906e-05, 'weight_decay': 0.00017802616915745114, 'epochs': 169, 'loss': 'mse', 'optimizer': 'adam', 'graph_mode': 'knn', 'knn_k': 6, 'weighted_edges': True, 'symmetrize_mode': 'mutual', 'self_loops': False, 'use_snp_selection': False, 'graphsage_batch_size': 256}. Best is trial 0 with value: 0.16276806672876748.
[I 2025-12-05 17:42:01,320] Trial 1 finished with value: 0.20236055619484952 and parameters: {'model_type': 'graphsage', 'hidden_dims': '[512, 128]', 'dropout': 0.3737930779596218, 'batch_norm': True, 'sage_aggr': 'mean', 'sage_normalize': False, 'sage_project': False, 'lr': 0.0004485485309869717, 'weight_decay': 2.0046868950224612e-06, 'epochs': 74, 'loss': 'mse', 'optimizer': 'adam', 'graph_mode': 'knn', 'knn_k': 4, 'weighted_edges': True, 'symmetrize_mode': 'union', 'self_loops': False, 'use_snp_selection': False, 'graphsage_batch_size': 8}. Best is trial 1 with value: 0.20236055619484952.
[I 2025-12-05 17:42:47,074] Trial 2 finished with value: 0.18611486622827156 and parameters: {'model_type': 'graphsage', 'hidden_dims': '[256, 128]', 'dropout': 0.2731735750400165, 'batch_norm': False, 'sage_aggr': 'max', 'sage_normalize': True, 'sage_project': False, 'lr': 3.4705625989073525e-05, 'weight_decay': 2.4623319020131338e-05, 'epochs': 95, 'loss': 'mse', 'optimizer': 'adam', 'graph_mode': 'knn', 'knn_k': 6, 'weighted_edges': False, 'symmetrize_mode': 'mutual', 'self_loops': False, 'use_snp_selection': True, 'num_snps': 30713, 'graphsage_batch_size': 8}. Best is trial 1 with value: 0.20236055619484952.
[I 2025-12-05 17:43:49,432] Trial 3 finished with value: 0.20007000040088804 and parameters: {'model_type': 'graphsage', 'hidden_dims': '[256, 128]', 'dropout': 0.3815953422463725, 'batch_norm': False, 'sage_aggr': 'mean', 'sage_normalize': True, 'sage_project': False, 'lr': 2.1095572616816696e-06, 'weight_decay': 5.195307220037778e-07, 'epochs': 226, 'loss': 'mse', 'optimizer': 'adam', 'graph_mode': 'knn', 'knn_k': 8, 'weighted_edges': True, 'symmetrize_mode': 'union', 'self_loops': False, 'use_snp_selection': True, 'num_snps': 16419, 'graphsage_batch_size': 128}. Best is trial 1 with value: 0.20236055619484952.
[I 2025-12-05 17:45:53,413] Trial 4 finished with value: 0.18210838523365308 and parameters: {'model_type': 'graphsage', 'hidden_dims': '[256, 128]', 'dropout': 0.3920979142653378, 'batch_norm': True, 'sage_aggr': 'max', 'sage_normalize': True, 'sage_project': False, 'lr': 3.15214685884738e-06, 'weight_decay': 1.0663862019069792e-05, 'epochs': 212, 'loss': 'mae', 'optimizer': 'adam', 'graph_mode': 'cutoff', 'cutoff': 0.33867046005138823, 'grm_norm': 'gcn', 'self_loops': False, 'use_snp_selection': False, 'graphsage_batch_size': 512}. Best is trial 1 with value: 0.20236055619484952.
[I 2025-12-05 17:46:20,603] Trial 5 finished with value: 0.20837648945757187 and parameters: {'model_type': 'graphsage', 'hidden_dims': '[256, 128]', 'dropout': 0.32925710311863654, 'batch_norm': True, 'sage_aggr': 'mean', 'sage_normalize': True, 'sage_project': False, 'lr': 0.00016905333078305474, 'weight_decay': 6.711044850912148e-06, 'epochs': 127, 'loss': 'mae', 'optimizer': 'adam', 'graph_mode': 'cutoff', 'cutoff': 0.253959783091227, 'grm_norm': 'cosine_then_gcn', 'self_loops': False, 'use_snp_selection': True, 'num_snps': 7419, 'graphsage_batch_size': 64}. Best is trial 5 with value: 0.20837648945757187.
[I 2025-12-05 17:48:33,317] Trial 6 finished with value: 0.12015504565024368 and parameters: {'model_type': 'graphsage', 'hidden_dims': '[512, 64]', 'dropout': 0.2585007811528941, 'batch_norm': True, 'sage_aggr': 'max', 'sage_normalize': False, 'sage_project': False, 'lr': 5.921425508303395e-06, 'weight_decay': 0.0004511561961144237, 'epochs': 136, 'loss': 'mae', 'optimizer': 'adam', 'graph_mode': 'knn', 'knn_k': 9, 'weighted_edges': True, 'symmetrize_mode': 'union', 'self_loops': False, 'use_snp_selection': True, 'num_snps': 34427, 'graphsage_batch_size': 128}. Best is trial 5 with value: 0.20837648945757187.
[I 2025-12-05 17:50:42,966] Trial 7 finished with value: 0.1558306247940477 and parameters: {'model_type': 'graphsage', 'hidden_dims': '[512, 128]', 'dropout': 0.5944584870981006, 'batch_norm': False, 'sage_aggr': 'max', 'sage_normalize': True, 'sage_project': False, 'lr': 7.3241868695773595e-06, 'weight_decay': 1.2565521754060153e-06, 'epochs': 166, 'loss': 'mse', 'optimizer': 'adam', 'graph_mode': 'knn', 'knn_k': 5, 'weighted_edges': False, 'symmetrize_mode': 'mutual', 'self_loops': False, 'use_snp_selection': True, 'num_snps': 50019, 'graphsage_batch_size': 8}. Best is trial 5 with value: 0.20837648945757187.
[I 2025-12-05 17:52:12,695] Trial 8 finished with value: 0.15021667823888007 and parameters: {'model_type': 'graphsage', 'hidden_dims': '[512, 64]', 'dropout': 0.5703535192416116, 'batch_norm': False, 'sage_aggr': 'mean', 'sage_normalize': False, 'sage_project': False, 'lr': 1.823510325310572e-06, 'weight_decay': 0.00013672790135428885, 'epochs': 104, 'loss': 'mae', 'optimizer': 'adam', 'graph_mode': 'knn', 'knn_k': 7, 'weighted_edges': True, 'symmetrize_mode': 'mutual', 'self_loops': False, 'use_snp_selection': True, 'num_snps': 45923, 'graphsage_batch_size': 128}. Best is trial 5 with value: 0.20837648945757187.
[I 2025-12-05 17:54:52,347] Trial 9 finished with value: 0.20119947940058086 and parameters: {'model_type': 'graphsage', 'hidden_dims': '[512, 128]', 'dropout': 0.27261839493092876, 'batch_norm': False, 'sage_aggr': 'mean', 'sage_normalize': False, 'sage_project': False, 'lr': 5.88603310717523e-06, 'weight_decay': 1.0998339923223823e-05, 'epochs': 249, 'loss': 'mae', 'optimizer': 'adam', 'graph_mode': 'knn', 'knn_k': 3, 'weighted_edges': False, 'symmetrize_mode': 'mutual', 'self_loops': False, 'use_snp_selection': False, 'graphsage_batch_size': 128}. Best is trial 5 with value: 0.20837648945757187.
[I 2025-12-05 17:55:10,625] Trial 10 finished with value: 0.1838238855129649 and parameters: {'model_type': 'graphsage', 'hidden_dims': '[512, 256]', 'dropout': 0.11372025982957354, 'batch_norm': True, 'sage_aggr': 'mean', 'sage_normalize': True, 'sage_project': False, 'lr': 0.0004700436326814432, 'weight_decay': 1.2257443862615642e-07, 'epochs': 51, 'loss': 'mae', 'optimizer': 'adam', 'graph_mode': 'cutoff', 'cutoff': 0.21281628365523453, 'grm_norm': 'cosine_then_gcn', 'self_loops': False, 'use_snp_selection': True, 'num_snps': 2862, 'graphsage_batch_size': 64}. Best is trial 5 with value: 0.20837648945757187.
[I 2025-12-05 17:55:32,139] Trial 11 finished with value: 0.21939079386082255 and parameters: {'model_type': 'graphsage', 'hidden_dims': '[256, 128, 64]', 'dropout': 0.43792734467159944, 'batch_norm': True, 'sage_aggr': 'mean', 'sage_normalize': False, 'sage_project': False, 'lr': 0.00039339919849228907, 'weight_decay': 1.6627269565976914e-06, 'epochs': 44, 'loss': 'mse', 'optimizer': 'adam', 'graph_mode': 'cutoff', 'cutoff': 0.8674357119417975, 'grm_norm': 'none', 'self_loops': False, 'use_snp_selection': False, 'graphsage_batch_size': 32}. Best is trial 11 with value: 0.21939079386082255.
[I 2025-12-05 17:55:52,771] Trial 12 finished with value: 0.20902061761138185 and parameters: {'model_type': 'graphsage', 'hidden_dims': '[256, 128, 64]', 'dropout': 0.4722141150575662, 'batch_norm': True, 'sage_aggr': 'mean', 'sage_normalize': True, 'sage_project': False, 'lr': 0.00015917521200452755, 'weight_decay': 2.1371376075456425e-06, 'epochs': 41, 'loss': 'mae', 'optimizer': 'adam', 'graph_mode': 'cutoff', 'cutoff': 0.8992422261739597, 'grm_norm': 'none', 'self_loops': False, 'use_snp_selection': False, 'graphsage_batch_size': 32}. Best is trial 11 with value: 0.21939079386082255.
[I 2025-12-05 17:56:13,020] Trial 13 finished with value: 0.21909094540149682 and parameters: {'model_type': 'graphsage', 'hidden_dims': '[256, 128, 64]', 'dropout': 0.48177467097578114, 'batch_norm': True, 'sage_aggr': 'mean', 'sage_normalize': False, 'sage_project': False, 'lr': 0.0001265646453151747, 'weight_decay': 2.821777928034696e-07, 'epochs': 40, 'loss': 'mse', 'optimizer': 'adam', 'graph_mode': 'cutoff', 'cutoff': 0.8983708444258042, 'grm_norm': 'none', 'self_loops': False, 'use_snp_selection': False, 'graphsage_batch_size': 32}. Best is trial 11 with value: 0.21939079386082255.
[I 2025-12-05 17:56:43,114] Trial 14 finished with value: 0.21431448650067653 and parameters: {'model_type': 'graphsage', 'hidden_dims': '[256, 128, 64]', 'dropout': 0.49171414511847783, 'batch_norm': True, 'sage_aggr': 'mean', 'sage_normalize': False, 'sage_project': False, 'lr': 0.00012297848507367205, 'weight_decay': 1.0362311765688494e-07, 'epochs': 71, 'loss': 'mse', 'optimizer': 'adam', 'graph_mode': 'cutoff', 'cutoff': 0.8991258466829875, 'grm_norm': 'none', 'self_loops': False, 'use_snp_selection': False, 'graphsage_batch_size': 32}. Best is trial 11 with value: 0.21939079386082255.
[I 2025-12-05 17:57:13,250] Trial 15 finished with value: 0.22061166298496 and parameters: {'model_type': 'graphsage', 'hidden_dims': '[256, 128, 64]', 'dropout': 0.4819812221489776, 'batch_norm': True, 'sage_aggr': 'mean', 'sage_normalize': False, 'sage_project': False, 'lr': 0.0009008616732081617, 'weight_decay': 3.886175306152644e-07, 'epochs': 69, 'loss': 'mse', 'optimizer': 'adam', 'graph_mode': 'cutoff', 'cutoff': 0.6850404175212892, 'grm_norm': 'cosine', 'self_loops': False, 'use_snp_selection': False, 'graphsage_batch_size': 32}. Best is trial 15 with value: 0.22061166298496.
[I 2025-12-05 17:57:48,363] Trial 16 finished with value: 0.220399048334114 and parameters: {'model_type': 'graphsage', 'hidden_dims': '[256, 128, 64]', 'dropout': 0.4405058776983694, 'batch_norm': True, 'sage_aggr': 'mean', 'sage_normalize': False, 'sage_project': False, 'lr': 0.0007606170544983445, 'weight_decay': 5.429010323664392e-07, 'epochs': 84, 'loss': 'mse', 'optimizer': 'adam', 'graph_mode': 'cutoff', 'cutoff': 0.63503558642358, 'grm_norm': 'cosine', 'self_loops': False, 'use_snp_selection': False, 'graphsage_batch_size': 16}. Best is trial 15 with value: 0.22061166298496.
[I 2025-12-05 17:58:29,120] Trial 17 finished with value: 0.22503483396071927 and parameters: {'model_type': 'graphsage', 'hidden_dims': '[256, 128, 64]', 'dropout': 0.5335884558407255, 'batch_norm': True, 'sage_aggr': 'mean', 'sage_normalize': False, 'sage_project': False, 'lr': 0.0009283593577721785, 'weight_decay': 4.277795004218617e-07, 'epochs': 102, 'loss': 'mse', 'optimizer': 'adam', 'graph_mode': 'cutoff', 'cutoff': 0.6455336625620641, 'grm_norm': 'cosine', 'self_loops': False, 'use_snp_selection': False, 'graphsage_batch_size': 16}. Best is trial 17 with value: 0.22503483396071927.
[I 2025-12-05 17:59:44,538] Trial 18 finished with value: 0.21493792111628002 and parameters: {'model_type': 'graphsage', 'hidden_dims': '[512, 256]', 'dropout': 0.5409428677737899, 'batch_norm': True, 'sage_aggr': 'mean', 'sage_normalize': False, 'sage_project': False, 'lr': 0.000981707359429085, 'weight_decay': 2.7649414609339657e-07, 'epochs': 113, 'loss': 'mse', 'optimizer': 'adam', 'graph_mode': 'cutoff', 'cutoff': 0.6306463141134656, 'grm_norm': 'cosine', 'self_loops': False, 'use_snp_selection': False, 'graphsage_batch_size': 16}. Best is trial 17 with value: 0.22503483396071927.
[I 2025-12-05 18:00:33,034] Trial 19 finished with value: 0.20186874786224843 and parameters: {'model_type': 'graphsage', 'hidden_dims': '[128, 64]', 'dropout': 0.5297706569094759, 'batch_norm': True, 'sage_aggr': 'mean', 'sage_normalize': False, 'sage_project': False, 'lr': 6.531330501412273e-05, 'weight_decay': 4.306443148110512e-06, 'epochs': 176, 'loss': 'mse', 'optimizer': 'adam', 'graph_mode': 'cutoff', 'cutoff': 0.5015967987812009, 'grm_norm': 'cosine', 'self_loops': False, 'use_snp_selection': False, 'graphsage_batch_size': 16}. Best is trial 17 with value: 0.22503483396071927.
[I 2025-12-05 18:01:29,273] Trial 20 finished with value: 0.2139633726336628 and parameters: {'model_type': 'graphsage', 'hidden_dims': '[256, 128, 64]', 'dropout': 0.5288047244503477, 'batch_norm': True, 'sage_aggr': 'mean', 'sage_normalize': False, 'sage_project': False, 'lr': 1.2993377610924599e-05, 'weight_decay': 4.139784208065384e-05, 'epochs': 151, 'loss': 'mse', 'optimizer': 'adam', 'graph_mode': 'cutoff', 'cutoff': 0.701462196656869, 'grm_norm': 'cosine', 'self_loops': False, 'use_snp_selection': False, 'graphsage_batch_size': 256}. Best is trial 17 with value: 0.22503483396071927.
[I 2025-12-05 18:02:03,238] Trial 21 finished with value: 0.2155832791962226 and parameters: {'model_type': 'graphsage', 'hidden_dims': '[256, 128, 64]', 'dropout': 0.44664304851584136, 'batch_norm': True, 'sage_aggr': 'mean', 'sage_normalize': False, 'sage_project': False, 'lr': 0.0008657950267348009, 'weight_decay': 5.941484351790203e-07, 'epochs': 81, 'loss': 'mse', 'optimizer': 'adam', 'graph_mode': 'cutoff', 'cutoff': 0.7086928681987231, 'grm_norm': 'cosine', 'self_loops': False, 'use_snp_selection': False, 'graphsage_batch_size': 16}. Best is trial 17 with value: 0.22503483396071927.
[I 2025-12-05 18:02:40,114] Trial 22 finished with value: 0.21312054551044363 and parameters: {'model_type': 'graphsage', 'hidden_dims': '[256, 128, 64]', 'dropout': 0.41850597911661086, 'batch_norm': True, 'sage_aggr': 'mean', 'sage_normalize': False, 'sage_project': False, 'lr': 0.00029776309578116115, 'weight_decay': 6.056617406679039e-07, 'epochs': 85, 'loss': 'mse', 'optimizer': 'adam', 'graph_mode': 'cutoff', 'cutoff': 0.5386444555408324, 'grm_norm': 'cosine', 'self_loops': False, 'use_snp_selection': False, 'graphsage_batch_size': 16}. Best is trial 17 with value: 0.22503483396071927.
[I 2025-12-05 18:03:25,909] Trial 23 finished with value: 0.21932914540261464 and parameters: {'model_type': 'graphsage', 'hidden_dims': '[256, 128, 64]', 'dropout': 0.5035141518174406, 'batch_norm': True, 'sage_aggr': 'mean', 'sage_normalize': False, 'sage_project': False, 'lr': 0.0006580169761636397, 'weight_decay': 2.7086766073882356e-07, 'epochs': 118, 'loss': 'mse', 'optimizer': 'adam', 'graph_mode': 'cutoff', 'cutoff': 0.6524360559276522, 'grm_norm': 'cosine', 'self_loops': False, 'use_snp_selection': False, 'graphsage_batch_size': 16}. Best is trial 17 with value: 0.22503483396071927.
[I 2025-12-05 18:03:55,041] Trial 24 finished with value: 0.22219057725431818 and parameters: {'model_type': 'graphsage', 'hidden_dims': '[256, 128, 64]', 'dropout': 0.31886870838854836, 'batch_norm': True, 'sage_aggr': 'mean', 'sage_normalize': False, 'sage_project': False, 'lr': 0.0002591011998806474, 'weight_decay': 9.048546943424313e-07, 'epochs': 66, 'loss': 'mse', 'optimizer': 'adam', 'graph_mode': 'cutoff', 'cutoff': 0.7876923889523691, 'grm_norm': 'cosine', 'self_loops': False, 'use_snp_selection': False, 'graphsage_batch_size': 16}. Best is trial 17 with value: 0.22503483396071927.
[I 2025-12-05 18:04:23,025] Trial 25 finished with value: 0.21749935734513573 and parameters: {'model_type': 'graphsage', 'hidden_dims': '[256, 128, 64]', 'dropout': 0.3458097089863429, 'batch_norm': True, 'sage_aggr': 'mean', 'sage_normalize': False, 'sage_project': False, 'lr': 0.0002665649587753341, 'weight_decay': 1.0224442444410686e-06, 'epochs': 64, 'loss': 'mse', 'optimizer': 'adam', 'graph_mode': 'cutoff', 'cutoff': 0.7752341619256954, 'grm_norm': 'gcn', 'self_loops': False, 'use_snp_selection': False, 'graphsage_batch_size': 512}. Best is trial 17 with value: 0.22503483396071927.
[I 2025-12-05 18:04:51,303] Trial 26 finished with value: 0.21304422094110267 and parameters: {'model_type': 'graphsage', 'hidden_dims': '[256, 128, 64]', 'dropout': 0.3317398912389726, 'batch_norm': False, 'sage_aggr': 'max', 'sage_normalize': False, 'sage_project': False, 'lr': 7.069122283917176e-05, 'weight_decay': 1.8834970137059398e-07, 'epochs': 64, 'loss': 'mse', 'optimizer': 'adam', 'graph_mode': 'cutoff', 'cutoff': 0.7762050314823455, 'grm_norm': 'cosine', 'self_loops': False, 'use_snp_selection': False, 'graphsage_batch_size': 16}. Best is trial 17 with value: 0.22503483396071927.
