[I 2025-12-09 10:56:25,185] Trial 144 finished with value: 0.3531358619047703 and parameters: {'model_type': 'graphsage', 'hidden_dims': '[512, 64]', 'dropout': 0.5001175279261056, 'batch_norm': False, 'sage_aggr': 'max', 'sage_normalize': False, 'sage_project': False, 'lr': 1.352481413941691e-05, 'weight_decay': 8.111439854611318e-05, 'epochs': 62, 'loss': 'mae', 'optimizer': 'adam', 'graph_mode': 'cutoff', 'cutoff': 0.8403726753137772, 'grm_norm': 'gcn', 'self_loops': False, 'use_snp_selection': True, 'num_snps': 45771}. Best is trial 138 with value: 0.3778850360492746.
[I 2025-12-09 10:57:32,576] Trial 145 finished with value: 0.3784195861322729 and parameters: {'model_type': 'graphsage', 'hidden_dims': '[512, 64]', 'dropout': 0.5083532819381031, 'batch_norm': False, 'sage_aggr': 'max', 'sage_normalize': False, 'sage_project': False, 'lr': 1.1745128263043009e-05, 'weight_decay': 0.00011484117941590998, 'epochs': 100, 'loss': 'mae', 'optimizer': 'adam', 'graph_mode': 'cutoff', 'cutoff': 0.8434540409790131, 'grm_norm': 'gcn', 'self_loops': False, 'use_snp_selection': True, 'num_snps': 44168}. Best is trial 145 with value: 0.3784195861322729.
[I 2025-12-09 10:58:50,230] Trial 146 finished with value: 0.37344379114267323 and parameters: {'model_type': 'graphsage', 'hidden_dims': '[512, 64]', 'dropout': 0.4988704006860592, 'batch_norm': False, 'sage_aggr': 'max', 'sage_normalize': False, 'sage_project': False, 'lr': 2.0755500975356858e-05, 'weight_decay': 0.00010484053605574952, 'epochs': 138, 'loss': 'mae', 'optimizer': 'adam', 'graph_mode': 'cutoff', 'cutoff': 0.8286790913080896, 'grm_norm': 'gcn', 'self_loops': False, 'use_snp_selection': True, 'num_snps': 44084}. Best is trial 145 with value: 0.3784195861322729.
[I 2025-12-09 10:59:58,464] Trial 147 finished with value: 0.3736435965229865 and parameters: {'model_type': 'graphsage', 'hidden_dims': '[512, 64]', 'dropout': 0.43379485578292315, 'batch_norm': False, 'sage_aggr': 'max', 'sage_normalize': False, 'sage_project': False, 'lr': 1.5442403029216482e-05, 'weight_decay': 0.000282757526304288, 'epochs': 100, 'loss': 'mae', 'optimizer': 'adam', 'graph_mode': 'cutoff', 'cutoff': 0.80987475750306, 'grm_norm': 'gcn', 'self_loops': False, 'use_snp_selection': True, 'num_snps': 44904}. Best is trial 145 with value: 0.3784195861322729.
[I 2025-12-09 11:01:15,136] Trial 148 finished with value: 0.3680431159969929 and parameters: {'model_type': 'graphsage', 'hidden_dims': '[512, 64]', 'dropout': 0.4504138038039079, 'batch_norm': False, 'sage_aggr': 'max', 'sage_normalize': False, 'sage_project': False, 'lr': 1.1244304634542482e-05, 'weight_decay': 0.0001903824939993893, 'epochs': 108, 'loss': 'mae', 'optimizer': 'adam', 'graph_mode': 'cutoff', 'cutoff': 0.8454291056227428, 'grm_norm': 'gcn', 'self_loops': False, 'use_snp_selection': True, 'num_snps': 50247}. Best is trial 145 with value: 0.3784195861322729.
[I 2025-12-09 11:02:33,186] Trial 149 finished with value: 0.0 and parameters: {'model_type': 'graphsage', 'hidden_dims': '[512, 64]', 'dropout': 0.543418891553438, 'batch_norm': False, 'sage_aggr': 'max', 'sage_normalize': False, 'sage_project': False, 'lr': 0.0010236900649192447, 'weight_decay': 0.00014684610204099825, 'epochs': 119, 'loss': 'mae', 'optimizer': 'adam', 'graph_mode': 'cutoff', 'cutoff': 0.774979920267839, 'grm_norm': 'gcn', 'self_loops': False, 'use_snp_selection': True, 'num_snps': 48421}. Best is trial 145 with value: 0.3784195861322729.
[I 2025-12-09 11:04:00,754] Trial 0 finished with value: 0.32171764969045313 and parameters: {'model_type': 'graphsage', 'hidden_dims': '[128, 64]', 'dropout': 0.199031432379812, 'batch_norm': True, 'sage_aggr': 'max', 'sage_normalize': True, 'sage_project': False, 'lr': 0.00034401453323286885, 'weight_decay': 0.00017802616915745114, 'epochs': 230, 'loss': 'mse', 'optimizer': 'adam', 'graph_mode': 'knn', 'knn_k': 6, 'weighted_edges': True, 'symmetrize_mode': 'mutual', 'self_loops': True, 'use_snp_selection': False}. Best is trial 0 with value: 0.32171764969045313.
[I 2025-12-09 11:05:39,739] Trial 1 finished with value: 0.34165675876948537 and parameters: {'model_type': 'graphsage', 'hidden_dims': '[512, 128]', 'dropout': 0.2503500283181017, 'batch_norm': False, 'sage_aggr': 'max', 'sage_normalize': False, 'sage_project': False, 'lr': 3.952233718592099e-05, 'weight_decay': 0.00026754769258252603, 'epochs': 149, 'loss': 'mse', 'optimizer': 'adam', 'graph_mode': 'knn', 'knn_k': 2, 'weighted_edges': False, 'symmetrize_mode': 'mutual', 'self_loops': True, 'use_snp_selection': True, 'num_snps': 49915}. Best is trial 1 with value: 0.34165675876948537.
[I 2025-12-09 11:06:55,773] Trial 2 finished with value: 0.36255218638588504 and parameters: {'model_type': 'graphsage', 'hidden_dims': '[512, 256]', 'dropout': 0.2785908793172681, 'batch_norm': False, 'sage_aggr': 'max', 'sage_normalize': False, 'sage_project': False, 'lr': 8.806039223165805e-05, 'weight_decay': 3.5153176302760294e-05, 'epochs': 147, 'loss': 'mae', 'optimizer': 'adam', 'graph_mode': 'cutoff', 'cutoff': 0.4922564006874869, 'grm_norm': 'gcn', 'self_loops': False, 'use_snp_selection': True, 'num_snps': 34340}. Best is trial 2 with value: 0.36255218638588504.
[I 2025-12-09 11:08:08,781] Trial 3 finished with value: 0.32755229884328785 and parameters: {'model_type': 'graphsage', 'hidden_dims': '[256, 128, 64]', 'dropout': 0.3475243154412272, 'batch_norm': True, 'sage_aggr': 'max', 'sage_normalize': False, 'sage_project': False, 'lr': 1.6006331996938085e-05, 'weight_decay': 7.213121225589906e-06, 'epochs': 283, 'loss': 'mse', 'optimizer': 'adam', 'graph_mode': 'cutoff', 'cutoff': 0.5942334791449215, 'grm_norm': 'none', 'self_loops': True, 'use_snp_selection': False}. Best is trial 2 with value: 0.36255218638588504.
[I 2025-12-09 11:08:50,996] Trial 4 finished with value: 0.30643937991930886 and parameters: {'model_type': 'graphsage', 'hidden_dims': '[128, 64]', 'dropout': 0.3348926467202472, 'batch_norm': True, 'sage_aggr': 'max', 'sage_normalize': False, 'sage_project': False, 'lr': 0.0004238630400638802, 'weight_decay': 8.074086040046576e-07, 'epochs': 158, 'loss': 'mae', 'optimizer': 'adam', 'graph_mode': 'knn', 'knn_k': 1, 'weighted_edges': False, 'symmetrize_mode': 'mutual', 'self_loops': False, 'use_snp_selection': True, 'num_snps': 26850}. Best is trial 2 with value: 0.36255218638588504.
[I 2025-12-09 11:10:38,597] Trial 5 finished with value: 0.3114379921301085 and parameters: {'model_type': 'graphsage', 'hidden_dims': '[512, 64]', 'dropout': 0.14505336736221927, 'batch_norm': True, 'sage_aggr': 'mean', 'sage_normalize': True, 'sage_project': False, 'lr': 1.2962030165732234e-05, 'weight_decay': 1.326598071105465e-07, 'epochs': 180, 'loss': 'mse', 'optimizer': 'adam', 'graph_mode': 'knn', 'knn_k': 9, 'weighted_edges': True, 'symmetrize_mode': 'mutual', 'self_loops': False, 'use_snp_selection': False}. Best is trial 2 with value: 0.36255218638588504.
[I 2025-12-09 11:11:31,189] Trial 6 finished with value: 0.3275995174453169 and parameters: {'model_type': 'graphsage', 'hidden_dims': '[256, 128, 64]', 'dropout': 0.10731743755162496, 'batch_norm': True, 'sage_aggr': 'mean', 'sage_normalize': False, 'sage_project': False, 'lr': 1.922990426933137e-05, 'weight_decay': 7.30001060446905e-05, 'epochs': 63, 'loss': 'mae', 'optimizer': 'adam', 'graph_mode': 'cutoff', 'cutoff': 0.7624978434202536, 'grm_norm': 'none', 'self_loops': True, 'use_snp_selection': True, 'num_snps': 50106}. Best is trial 2 with value: 0.36255218638588504.
[I 2025-12-09 11:13:24,829] Trial 7 finished with value: 0.3501679429724963 and parameters: {'model_type': 'graphsage', 'hidden_dims': '[512, 64]', 'dropout': 0.2585007811528941, 'batch_norm': True, 'sage_aggr': 'max', 'sage_normalize': True, 'sage_project': False, 'lr': 5.921425508303391e-05, 'weight_decay': 0.0004511561961144237, 'epochs': 182, 'loss': 'mae', 'optimizer': 'adam', 'graph_mode': 'knn', 'knn_k': 9, 'weighted_edges': True, 'symmetrize_mode': 'union', 'self_loops': False, 'use_snp_selection': True, 'num_snps': 23903}. Best is trial 2 with value: 0.36255218638588504.
[I 2025-12-09 11:14:06,231] Trial 8 finished with value: 0.29980292591884994 and parameters: {'model_type': 'graphsage', 'hidden_dims': '[512, 256]', 'dropout': 0.3061380386767003, 'batch_norm': False, 'sage_aggr': 'mean', 'sage_normalize': True, 'sage_project': False, 'lr': 0.000698401460570184, 'weight_decay': 2.965560055460244e-06, 'epochs': 289, 'loss': 'mae', 'optimizer': 'adam', 'graph_mode': 'knn', 'knn_k': 7, 'weighted_edges': False, 'symmetrize_mode': 'mutual', 'self_loops': True, 'use_snp_selection': True, 'num_snps': 4710}. Best is trial 2 with value: 0.36255218638588504.
[I 2025-12-09 11:17:44,397] Trial 9 finished with value: 0.34469953446639684 and parameters: {'model_type': 'graphsage', 'hidden_dims': '[512, 128]', 'dropout': 0.1733844071393634, 'batch_norm': False, 'sage_aggr': 'mean', 'sage_normalize': True, 'sage_project': False, 'lr': 0.0004269677918501597, 'weight_decay': 2.2439779626249696e-06, 'epochs': 319, 'loss': 'mse', 'optimizer': 'adam', 'graph_mode': 'cutoff', 'cutoff': 0.24117565767129295, 'grm_norm': 'cosine_then_gcn', 'self_loops': True, 'use_snp_selection': False}. Best is trial 2 with value: 0.36255218638588504.
[I 2025-12-09 11:18:47,876] Trial 10 finished with value: 0.0 and parameters: {'model_type': 'graphsage', 'hidden_dims': '[512, 256]', 'dropout': 0.46773351022590026, 'batch_norm': False, 'sage_aggr': 'max', 'sage_normalize': False, 'sage_project': False, 'lr': 0.0060050040216813455, 'weight_decay': 3.194347401809951e-05, 'epochs': 76, 'loss': 'mae', 'optimizer': 'adam', 'graph_mode': 'cutoff', 'cutoff': 0.36538426242387784, 'grm_norm': 'gcn', 'self_loops': False, 'use_snp_selection': True, 'num_snps': 36724}. Best is trial 2 with value: 0.36255218638588504.
[I 2025-12-09 11:19:33,101] Trial 11 finished with value: 0.3397961819194392 and parameters: {'model_type': 'graphsage', 'hidden_dims': '[256, 128]', 'dropout': 0.4589395225570495, 'batch_norm': False, 'sage_aggr': 'max', 'sage_normalize': True, 'sage_project': False, 'lr': 8.702795510793363e-05, 'weight_decay': 0.0007239007104174252, 'epochs': 110, 'loss': 'mae', 'optimizer': 'adam', 'graph_mode': 'cutoff', 'cutoff': 0.48934453790731597, 'grm_norm': 'gcn', 'self_loops': False, 'use_snp_selection': True, 'num_snps': 23960}. Best is trial 2 with value: 0.36255218638588504.
[I 2025-12-09 11:20:54,463] Trial 12 finished with value: 0.34190465481798044 and parameters: {'model_type': 'graphsage', 'hidden_dims': '[512, 64]', 'dropout': 0.5957621421360685, 'batch_norm': True, 'sage_aggr': 'max', 'sage_normalize': True, 'sage_project': False, 'lr': 9.196950102765017e-05, 'weight_decay': 2.7276858240322104e-05, 'epochs': 229, 'loss': 'mae', 'optimizer': 'adam', 'graph_mode': 'knn', 'knn_k': 10, 'weighted_edges': True, 'symmetrize_mode': 'union', 'self_loops': False, 'use_snp_selection': True, 'num_snps': 14365}. Best is trial 2 with value: 0.36255218638588504.
[I 2025-12-09 11:22:02,108] Trial 13 finished with value: 0.3619153932594782 and parameters: {'model_type': 'graphsage', 'hidden_dims': '[512, 64]', 'dropout': 0.2396535080243103, 'batch_norm': False, 'sage_aggr': 'max', 'sage_normalize': False, 'sage_project': False, 'lr': 0.00011511504947960979, 'weight_decay': 0.0008199617083701963, 'epochs': 129, 'loss': 'mae', 'optimizer': 'adam', 'graph_mode': 'cutoff', 'cutoff': 0.8137943133270612, 'grm_norm': 'cosine', 'self_loops': False, 'use_snp_selection': True, 'num_snps': 36810}. Best is trial 2 with value: 0.36255218638588504.
[I 2025-12-09 11:23:12,794] Trial 14 finished with value: 0.3576919983308034 and parameters: {'model_type': 'graphsage', 'hidden_dims': '[512, 256]', 'dropout': 0.420004136612043, 'batch_norm': False, 'sage_aggr': 'max', 'sage_normalize': False, 'sage_project': False, 'lr': 0.00014707891294861864, 'weight_decay': 0.0009764404227223913, 'epochs': 119, 'loss': 'mae', 'optimizer': 'adam', 'graph_mode': 'cutoff', 'cutoff': 0.889546541726153, 'grm_norm': 'cosine', 'self_loops': False, 'use_snp_selection': True, 'num_snps': 41357}. Best is trial 2 with value: 0.36255218638588504.
[I 2025-12-09 11:24:05,194] Trial 15 finished with value: 0.3416661032980481 and parameters: {'model_type': 'graphsage', 'hidden_dims': '[256, 128]', 'dropout': 0.23676193157103503, 'batch_norm': False, 'sage_aggr': 'max', 'sage_normalize': False, 'sage_project': False, 'lr': 0.0013847822027307618, 'weight_decay': 9.11467158269823e-05, 'epochs': 109, 'loss': 'mae', 'optimizer': 'adam', 'graph_mode': 'cutoff', 'cutoff': 0.6099811810284483, 'grm_norm': 'cosine', 'self_loops': False, 'use_snp_selection': True, 'num_snps': 38496}. Best is trial 2 with value: 0.36255218638588504.
[I 2025-12-09 11:26:06,115] Trial 16 finished with value: 0.3490338340092747 and parameters: {'model_type': 'graphsage', 'hidden_dims': '[512, 64]', 'dropout': 0.41050249627484303, 'batch_norm': False, 'sage_aggr': 'max', 'sage_normalize': False, 'sage_project': False, 'lr': 0.00015946268529881528, 'weight_decay': 2.5220578180392543e-05, 'epochs': 223, 'loss': 'mae', 'optimizer': 'adam', 'graph_mode': 'cutoff', 'cutoff': 0.7419957812461905, 'grm_norm': 'gcn', 'self_loops': False, 'use_snp_selection': True, 'num_snps': 54760}. Best is trial 2 with value: 0.36255218638588504.
[I 2025-12-09 11:27:21,792] Trial 17 finished with value: 0.10934386602364962 and parameters: {'model_type': 'graphsage', 'hidden_dims': '[512, 256]', 'dropout': 0.29039558206872257, 'batch_norm': False, 'sage_aggr': 'max', 'sage_normalize': False, 'sage_project': False, 'lr': 0.00187557210073371, 'weight_decay': 7.358915402744353e-06, 'epochs': 141, 'loss': 'mae', 'optimizer': 'adam', 'graph_mode': 'cutoff', 'cutoff': 0.43672077646257246, 'grm_norm': 'cosine', 'self_loops': False, 'use_snp_selection': True, 'num_snps': 32263}. Best is trial 2 with value: 0.36255218638588504.
[I 2025-12-09 11:27:52,185] Trial 18 finished with value: 0.3115544929538766 and parameters: {'model_type': 'graphsage', 'hidden_dims': '[512, 256]', 'dropout': 0.20659399060640374, 'batch_norm': False, 'sage_aggr': 'mean', 'sage_normalize': False, 'sage_project': False, 'lr': 4.023963981737559e-05, 'weight_decay': 2.8063926070691656e-07, 'epochs': 45, 'loss': 'mae', 'optimizer': 'adam', 'graph_mode': 'cutoff', 'cutoff': 0.6851228139594263, 'grm_norm': 'cosine_then_gcn', 'self_loops': False, 'use_snp_selection': False}. Best is trial 2 with value: 0.36255218638588504.
[I 2025-12-09 11:28:56,295] Trial 19 finished with value: 0.15934995604169838 and parameters: {'model_type': 'graphsage', 'hidden_dims': '[512, 64]', 'dropout': 0.39327553546337024, 'batch_norm': False, 'sage_aggr': 'max', 'sage_normalize': False, 'sage_project': False, 'lr': 0.00019215243138724956, 'weight_decay': 0.00010458092612680933, 'epochs': 87, 'loss': 'mae', 'optimizer': 'adam', 'graph_mode': 'cutoff', 'cutoff': 0.8876019425544109, 'grm_norm': 'gcn', 'self_loops': False, 'use_snp_selection': True, 'num_snps': 44871}. Best is trial 2 with value: 0.36255218638588504.
[I 2025-12-09 11:30:30,874] Trial 20 finished with value: 0.35851680451352913 and parameters: {'model_type': 'graphsage', 'hidden_dims': '[512, 128]', 'dropout': 0.5722347017211814, 'batch_norm': False, 'sage_aggr': 'max', 'sage_normalize': False, 'sage_project': False, 'lr': 3.4630663300629394e-05, 'weight_decay': 0.0003731447008328642, 'epochs': 210, 'loss': 'mae', 'optimizer': 'adam', 'graph_mode': 'cutoff', 'cutoff': 0.37048989694547907, 'grm_norm': 'cosine', 'self_loops': False, 'use_snp_selection': True, 'num_snps': 31541}. Best is trial 2 with value: 0.36255218638588504.
[I 2025-12-09 11:32:07,253] Trial 21 finished with value: 0.3570333786254524 and parameters: {'model_type': 'graphsage', 'hidden_dims': '[512, 128]', 'dropout': 0.5842886712404146, 'batch_norm': False, 'sage_aggr': 'max', 'sage_normalize': False, 'sage_project': False, 'lr': 3.161316214305987e-05, 'weight_decay': 0.0003186677384845962, 'epochs': 200, 'loss': 'mae', 'optimizer': 'adam', 'graph_mode': 'cutoff', 'cutoff': 0.34837353473823807, 'grm_norm': 'cosine', 'self_loops': False, 'use_snp_selection': True, 'num_snps': 31819}. Best is trial 2 with value: 0.36255218638588504.
[I 2025-12-09 11:33:06,579] Trial 22 finished with value: 0.3568003161672072 and parameters: {'model_type': 'graphsage', 'hidden_dims': '[512, 128]', 'dropout': 0.5456576228940596, 'batch_norm': False, 'sage_aggr': 'max', 'sage_normalize': False, 'sage_project': False, 'lr': 8.314059216639655e-05, 'weight_decay': 0.0009962055526835797, 'epochs': 205, 'loss': 'mae', 'optimizer': 'adam', 'graph_mode': 'cutoff', 'cutoff': 0.4963693686998206, 'grm_norm': 'cosine', 'self_loops': False, 'use_snp_selection': True, 'num_snps': 18524}. Best is trial 2 with value: 0.36255218638588504.
[I 2025-12-09 11:35:12,316] Trial 23 finished with value: 0.35399397144674377 and parameters: {'model_type': 'graphsage', 'hidden_dims': '[512, 128]', 'dropout': 0.29280528738845507, 'batch_norm': False, 'sage_aggr': 'max', 'sage_normalize': False, 'sage_project': False, 'lr': 2.8862025939498524e-05, 'weight_decay': 0.0002064682584419992, 'epochs': 247, 'loss': 'mae', 'optimizer': 'adam', 'graph_mode': 'cutoff', 'cutoff': 0.29544259305179676, 'grm_norm': 'cosine', 'self_loops': False, 'use_snp_selection': True, 'num_snps': 32599}. Best is trial 2 with value: 0.36255218638588504.
[I 2025-12-09 11:36:30,122] Trial 24 finished with value: 0.24949997863215967 and parameters: {'model_type': 'graphsage', 'hidden_dims': '[128, 64]', 'dropout': 0.5027770912246753, 'batch_norm': False, 'sage_aggr': 'max', 'sage_normalize': False, 'sage_project': False, 'lr': 0.0002124135874436907, 'weight_decay': 4.102443938464455e-05, 'epochs': 165, 'loss': 'mae', 'optimizer': 'adam', 'graph_mode': 'cutoff', 'cutoff': 0.41748307166446197, 'grm_norm': 'cosine', 'self_loops': False, 'use_snp_selection': True, 'num_snps': 43816}. Best is trial 2 with value: 0.36255218638588504.
[I 2025-12-09 11:37:26,958] Trial 25 finished with value: 0.35810034972145627 and parameters: {'model_type': 'graphsage', 'hidden_dims': '[256, 128, 64]', 'dropout': 0.37565662960296864, 'batch_norm': False, 'sage_aggr': 'max', 'sage_normalize': False, 'sage_project': False, 'lr': 5.974233543571797e-05, 'weight_decay': 1.565372424947362e-05, 'epochs': 123, 'loss': 'mae', 'optimizer': 'adam', 'graph_mode': 'cutoff', 'cutoff': 0.5252662985167289, 'grm_norm': 'gcn', 'self_loops': False, 'use_snp_selection': True, 'num_snps': 37304}. Best is trial 2 with value: 0.36255218638588504.
[I 2025-12-09 11:38:42,728] Trial 26 finished with value: 0.3555540577319042 and parameters: {'model_type': 'graphsage', 'hidden_dims': '[256, 128]', 'dropout': 0.21994626064093464, 'batch_norm': False, 'sage_aggr': 'max', 'sage_normalize': False, 'sage_project': False, 'lr': 1.0661807028389828e-05, 'weight_decay': 0.00046784836021663157, 'epochs': 254, 'loss': 'mae', 'optimizer': 'adam', 'graph_mode': 'cutoff', 'cutoff': 0.4232108832367663, 'grm_norm': 'cosine', 'self_loops': False, 'use_snp_selection': True, 'num_snps': 27903}. Best is trial 2 with value: 0.36255218638588504.
[I 2025-12-09 11:41:09,873] Trial 27 finished with value: 0.33538408497577465 and parameters: {'model_type': 'graphsage', 'hidden_dims': '[512, 256]', 'dropout': 0.1609262262393797, 'batch_norm': False, 'sage_aggr': 'mean', 'sage_normalize': False, 'sage_project': False, 'lr': 0.00010734734287706442, 'weight_decay': 0.00014654059204877154, 'epochs': 348, 'loss': 'mse', 'optimizer': 'adam', 'graph_mode': 'cutoff', 'cutoff': 0.6508764439767312, 'grm_norm': 'none', 'self_loops': False, 'use_snp_selection': False}. Best is trial 2 with value: 0.36255218638588504.
[I 2025-12-09 11:41:52,390] Trial 28 finished with value: 0.3533605823331191 and parameters: {'model_type': 'graphsage', 'hidden_dims': '[512, 64]', 'dropout': 0.3197441388182095, 'batch_norm': False, 'sage_aggr': 'max', 'sage_normalize': False, 'sage_project': False, 'lr': 2.413673954658727e-05, 'weight_decay': 0.00046242931190995125, 'epochs': 136, 'loss': 'mae', 'optimizer': 'adam', 'graph_mode': 'cutoff', 'cutoff': 0.8248994476831157, 'grm_norm': 'cosine_then_gcn', 'self_loops': False, 'use_snp_selection': True, 'num_snps': 14191}. Best is trial 2 with value: 0.36255218638588504.
[I 2025-12-09 11:42:27,079] Trial 29 finished with value: 0.3579398950883214 and parameters: {'model_type': 'graphsage', 'hidden_dims': '[128, 64]', 'dropout': 0.2705103402523758, 'batch_norm': False, 'sage_aggr': 'max', 'sage_normalize': False, 'sage_project': False, 'lr': 0.0002637370324985383, 'weight_decay': 6.153451171596127e-05, 'epochs': 178, 'loss': 'mse', 'optimizer': 'adam', 'graph_mode': 'cutoff', 'cutoff': 0.5676889049714322, 'grm_norm': 'gcn', 'self_loops': True, 'use_snp_selection': False}. Best is trial 2 with value: 0.36255218638588504.
[I 2025-12-09 11:47:29,798] Trial 30 finished with value: 0.3548640374428173 and parameters: {'model_type': 'graphsage', 'hidden_dims': '[512, 128]', 'dropout': 0.18909024430007068, 'batch_norm': False, 'sage_aggr': 'max', 'sage_normalize': False, 'sage_project': False, 'lr': 5.4932187169945926e-05, 'weight_decay': 0.00016269925912808467, 'epochs': 210, 'loss': 'mae', 'optimizer': 'adam', 'graph_mode': 'cutoff', 'cutoff': 0.20492989984466756, 'grm_norm': 'cosine', 'self_loops': False, 'use_snp_selection': True, 'num_snps': 58279}. Best is trial 2 with value: 0.36255218638588504.
