[I 2025-12-08 10:55:28,752] Trial 38 finished with value: 0.20868340756372844 and parameters: {'model_type': 'graphsage', 'hidden_dims': '[512, 128]', 'dropout': 0.47536183137348687, 'batch_norm': False, 'sage_aggr': 'mean', 'sage_normalize': True, 'sage_project': False, 'lr': 0.008082642497905898, 'weight_decay': 1.0839426551861133e-07, 'epochs': 127, 'loss': 'mae', 'optimizer': 'adam', 'graph_mode': 'knn', 'knn_k': 10, 'weighted_edges': False, 'symmetrize_mode': 'union', 'self_loops': False, 'use_snp_selection': True, 'num_snps': 59559}. Best is trial 25 with value: 0.30786536984361546.
[I 2025-12-08 10:57:51,845] Trial 39 finished with value: 0.30200072546533674 and parameters: {'model_type': 'graphsage', 'hidden_dims': '[512, 128]', 'dropout': 0.5672344389947636, 'batch_norm': True, 'sage_aggr': 'max', 'sage_normalize': False, 'sage_project': False, 'lr': 0.004842474037410365, 'weight_decay': 1.823690227822674e-07, 'epochs': 164, 'loss': 'mae', 'optimizer': 'adam', 'graph_mode': 'cutoff', 'cutoff': 0.40064555397379914, 'grm_norm': 'gcn', 'self_loops': False, 'use_snp_selection': True, 'num_snps': 58858}. Best is trial 25 with value: 0.30786536984361546.
[I 2025-12-08 10:59:55,086] Trial 40 finished with value: 0.30503844453669876 and parameters: {'model_type': 'graphsage', 'hidden_dims': '[512, 128]', 'dropout': 0.5196381373932131, 'batch_norm': True, 'sage_aggr': 'max', 'sage_normalize': False, 'sage_project': False, 'lr': 0.006284848893744887, 'weight_decay': 1.7433150775005484e-07, 'epochs': 137, 'loss': 'mae', 'optimizer': 'adam', 'graph_mode': 'knn', 'knn_k': 5, 'weighted_edges': True, 'symmetrize_mode': 'union', 'self_loops': False, 'use_snp_selection': True, 'num_snps': 43569}. Best is trial 25 with value: 0.30786536984361546.
[I 2025-12-08 11:00:58,952] Trial 41 finished with value: 0.3013695406060937 and parameters: {'model_type': 'graphsage', 'hidden_dims': '[512, 128]', 'dropout': 0.5591693927168147, 'batch_norm': True, 'sage_aggr': 'max', 'sage_normalize': False, 'sage_project': False, 'lr': 0.0093909028568562, 'weight_decay': 1.019824908780046e-07, 'epochs': 97, 'loss': 'mae', 'optimizer': 'adam', 'graph_mode': 'cutoff', 'cutoff': 0.5760488014546771, 'grm_norm': 'gcn', 'self_loops': False, 'use_snp_selection': True, 'num_snps': 39591}. Best is trial 25 with value: 0.30786536984361546.
[I 2025-12-08 11:01:51,264] Trial 42 finished with value: 0.29456882249013383 and parameters: {'model_type': 'graphsage', 'hidden_dims': '[512, 128]', 'dropout': 0.31554275146010846, 'batch_norm': True, 'sage_aggr': 'max', 'sage_normalize': False, 'sage_project': False, 'lr': 0.006234826214198858, 'weight_decay': 6.238104795506724e-07, 'epochs': 208, 'loss': 'mae', 'optimizer': 'adam', 'graph_mode': 'cutoff', 'cutoff': 0.7026310325983124, 'grm_norm': 'gcn', 'self_loops': False, 'use_snp_selection': True, 'num_snps': 16308}. Best is trial 25 with value: 0.30786536984361546.
[I 2025-12-08 11:03:00,137] Trial 43 finished with value: 0.304587045589319 and parameters: {'model_type': 'graphsage', 'hidden_dims': '[512, 256]', 'dropout': 0.47190146845288483, 'batch_norm': True, 'sage_aggr': 'max', 'sage_normalize': False, 'sage_project': False, 'lr': 0.004200490825335867, 'weight_decay': 1.6741737461700559e-06, 'epochs': 77, 'loss': 'mae', 'optimizer': 'adam', 'graph_mode': 'cutoff', 'cutoff': 0.5987644011052682, 'grm_norm': 'gcn', 'self_loops': False, 'use_snp_selection': True, 'num_snps': 50090}. Best is trial 25 with value: 0.30786536984361546.
[I 2025-12-08 11:04:08,429] Trial 44 finished with value: 0.30272045260339925 and parameters: {'model_type': 'graphsage', 'hidden_dims': '[512, 128]', 'dropout': 0.42640636704222706, 'batch_norm': True, 'sage_aggr': 'mean', 'sage_normalize': False, 'sage_project': False, 'lr': 0.002653051232031009, 'weight_decay': 1.6037647168713792e-07, 'epochs': 56, 'loss': 'mae', 'optimizer': 'adam', 'graph_mode': 'cutoff', 'cutoff': 0.6614403966357635, 'grm_norm': 'gcn', 'self_loops': False, 'use_snp_selection': True, 'num_snps': 59939}. Best is trial 25 with value: 0.30786536984361546.
[I 2025-12-08 11:05:45,717] Trial 45 finished with value: 0.28238935565612844 and parameters: {'model_type': 'graphsage', 'hidden_dims': '[512, 64]', 'dropout': 0.35570130310476245, 'batch_norm': True, 'sage_aggr': 'max', 'sage_normalize': True, 'sage_project': False, 'lr': 2.6814277070615364e-05, 'weight_decay': 0.0008909871684972516, 'epochs': 105, 'loss': 'mae', 'optimizer': 'adam', 'graph_mode': 'cutoff', 'cutoff': 0.41962408246775407, 'grm_norm': 'gcn', 'self_loops': False, 'use_snp_selection': True, 'num_snps': 52178}. Best is trial 25 with value: 0.30786536984361546.
[I 2025-12-08 11:07:12,144] Trial 46 finished with value: 0.0 and parameters: {'model_type': 'graphsage', 'hidden_dims': '[512, 128]', 'dropout': 0.22343679898699537, 'batch_norm': False, 'sage_aggr': 'max', 'sage_normalize': False, 'sage_project': False, 'lr': 0.006901392266260258, 'weight_decay': 2.690087782146765e-07, 'epochs': 183, 'loss': 'mae', 'optimizer': 'adam', 'graph_mode': 'cutoff', 'cutoff': 0.7391751487246865, 'grm_norm': 'gcn', 'self_loops': False, 'use_snp_selection': True, 'num_snps': 41219}. Best is trial 25 with value: 0.30786536984361546.
[I 2025-12-08 11:07:50,455] Trial 47 finished with value: 0.28866676452680473 and parameters: {'model_type': 'graphsage', 'hidden_dims': '[128, 64]', 'dropout': 0.5619931134467065, 'batch_norm': True, 'sage_aggr': 'max', 'sage_normalize': False, 'sage_project': False, 'lr': 0.0015254057710116257, 'weight_decay': 7.259334668809657e-07, 'epochs': 168, 'loss': 'mae', 'optimizer': 'adam', 'graph_mode': 'cutoff', 'cutoff': 0.5184423786379977, 'grm_norm': 'gcn', 'self_loops': False, 'use_snp_selection': True, 'num_snps': 15369}. Best is trial 25 with value: 0.30786536984361546.
[I 2025-12-08 11:09:46,165] Trial 48 finished with value: 0.1792621674448607 and parameters: {'model_type': 'graphsage', 'hidden_dims': '[256, 128, 64]', 'dropout': 0.49460806900432, 'batch_norm': True, 'sage_aggr': 'max', 'sage_normalize': False, 'sage_project': False, 'lr': 1.0087771566710249e-05, 'weight_decay': 0.0001871159865235435, 'epochs': 143, 'loss': 'mae', 'optimizer': 'adam', 'graph_mode': 'knn', 'knn_k': 8, 'weighted_edges': True, 'symmetrize_mode': 'mutual', 'self_loops': False, 'use_snp_selection': True, 'num_snps': 53792}. Best is trial 25 with value: 0.30786536984361546.
[I 2025-12-08 11:10:50,825] Trial 49 finished with value: 0.2961941224751131 and parameters: {'model_type': 'graphsage', 'hidden_dims': '[512, 128]', 'dropout': 0.5768582384780558, 'batch_norm': True, 'sage_aggr': 'mean', 'sage_normalize': True, 'sage_project': False, 'lr': 7.036066194735695e-05, 'weight_decay': 4.3900194317842247e-07, 'epochs': 79, 'loss': 'mae', 'optimizer': 'adam', 'graph_mode': 'cutoff', 'cutoff': 0.5991335021942235, 'grm_norm': 'cosine_then_gcn', 'self_loops': False, 'use_snp_selection': True, 'num_snps': 44927}. Best is trial 25 with value: 0.30786536984361546.
[I 2025-12-08 11:11:38,074] Trial 50 finished with value: 0.30087512226464297 and parameters: {'model_type': 'graphsage', 'hidden_dims': '[512, 256]', 'dropout': 0.5255663151521999, 'batch_norm': True, 'sage_aggr': 'max', 'sage_normalize': False, 'sage_project': False, 'lr': 0.0005609566241484396, 'weight_decay': 1.1156733601612487e-06, 'epochs': 53, 'loss': 'mae', 'optimizer': 'adam', 'graph_mode': 'cutoff', 'cutoff': 0.6712407160016889, 'grm_norm': 'none', 'self_loops': False, 'use_snp_selection': True, 'num_snps': 32238}. Best is trial 25 with value: 0.30786536984361546.
[I 2025-12-08 11:13:48,956] Trial 51 finished with value: 0.29559678296825753 and parameters: {'model_type': 'graphsage', 'hidden_dims': '[512, 128]', 'dropout': 0.5166134547605439, 'batch_norm': True, 'sage_aggr': 'max', 'sage_normalize': False, 'sage_project': False, 'lr': 0.007068471775518173, 'weight_decay': 1.5788020837085214e-07, 'epochs': 137, 'loss': 'mae', 'optimizer': 'adam', 'graph_mode': 'knn', 'knn_k': 5, 'weighted_edges': True, 'symmetrize_mode': 'union', 'self_loops': False, 'use_snp_selection': True, 'num_snps': 45232}. Best is trial 25 with value: 0.30786536984361546.
[I 2025-12-08 11:16:20,233] Trial 52 finished with value: 0.28687080286050204 and parameters: {'model_type': 'graphsage', 'hidden_dims': '[512, 128]', 'dropout': 0.5072070180684181, 'batch_norm': True, 'sage_aggr': 'max', 'sage_normalize': False, 'sage_project': False, 'lr': 0.005282957220473705, 'weight_decay': 1.54841014121632e-07, 'epochs': 132, 'loss': 'mae', 'optimizer': 'adam', 'graph_mode': 'knn', 'knn_k': 5, 'weighted_edges': True, 'symmetrize_mode': 'union', 'self_loops': False, 'use_snp_selection': True, 'num_snps': 56020}. Best is trial 25 with value: 0.30786536984361546.
[I 2025-12-08 11:17:55,602] Trial 53 finished with value: 0.2933660652470099 and parameters: {'model_type': 'graphsage', 'hidden_dims': '[512, 128]', 'dropout': 0.46800494837868645, 'batch_norm': True, 'sage_aggr': 'max', 'sage_normalize': False, 'sage_project': False, 'lr': 0.0036605801913326356, 'weight_decay': 2.22296680792456e-07, 'epochs': 114, 'loss': 'mae', 'optimizer': 'adam', 'graph_mode': 'knn', 'knn_k': 3, 'weighted_edges': True, 'symmetrize_mode': 'union', 'self_loops': False, 'use_snp_selection': True, 'num_snps': 45720}. Best is trial 25 with value: 0.30786536984361546.
[I 2025-12-08 11:20:52,136] Trial 54 finished with value: 0.29930569576171556 and parameters: {'model_type': 'graphsage', 'hidden_dims': '[512, 128]', 'dropout': 0.5719683208775783, 'batch_norm': True, 'sage_aggr': 'max', 'sage_normalize': False, 'sage_project': False, 'lr': 0.006605595419469776, 'weight_decay': 3.367876468261508e-07, 'epochs': 197, 'loss': 'mae', 'optimizer': 'adam', 'graph_mode': 'knn', 'knn_k': 7, 'weighted_edges': True, 'symmetrize_mode': 'union', 'self_loops': False, 'use_snp_selection': True, 'num_snps': 40416}. Best is trial 25 with value: 0.30786536984361546.
[I 2025-12-08 11:22:19,302] Trial 55 finished with value: 0.2790751993974378 and parameters: {'model_type': 'graphsage', 'hidden_dims': '[512, 64]', 'dropout': 0.42016970798531017, 'batch_norm': True, 'sage_aggr': 'max', 'sage_normalize': False, 'sage_project': False, 'lr': 0.002220788634456455, 'weight_decay': 1.4288158309553623e-07, 'epochs': 102, 'loss': 'mae', 'optimizer': 'adam', 'graph_mode': 'knn', 'knn_k': 1, 'weighted_edges': True, 'symmetrize_mode': 'union', 'self_loops': False, 'use_snp_selection': True, 'num_snps': 55812}. Best is trial 25 with value: 0.30786536984361546.
[I 2025-12-08 11:23:45,668] Trial 56 finished with value: 0.26028879172929653 and parameters: {'model_type': 'graphsage', 'hidden_dims': '[256, 128]', 'dropout': 0.5244856295733522, 'batch_norm': True, 'sage_aggr': 'max', 'sage_normalize': False, 'sage_project': False, 'lr': 0.008060394791445463, 'weight_decay': 8.808089658871191e-06, 'epochs': 152, 'loss': 'mse', 'optimizer': 'adam', 'graph_mode': 'cutoff', 'cutoff': 0.2589057392250262, 'grm_norm': 'gcn', 'self_loops': True, 'use_snp_selection': False}. Best is trial 25 with value: 0.30786536984361546.
[I 2025-12-08 11:24:11,083] Trial 57 finished with value: 0.024705102082497418 and parameters: {'model_type': 'graphsage', 'hidden_dims': '[256, 128, 64]', 'dropout': 0.4927007721500561, 'batch_norm': False, 'sage_aggr': 'max', 'sage_normalize': False, 'sage_project': False, 'lr': 0.003153932290290701, 'weight_decay': 4.380445436074755e-06, 'epochs': 68, 'loss': 'mae', 'optimizer': 'adam', 'graph_mode': 'cutoff', 'cutoff': 0.5759035287736327, 'grm_norm': 'gcn', 'self_loops': True, 'use_snp_selection': False}. Best is trial 25 with value: 0.30786536984361546.
[I 2025-12-08 11:25:33,160] Trial 58 finished with value: 0.29028374210853625 and parameters: {'model_type': 'graphsage', 'hidden_dims': '[512, 128]', 'dropout': 0.5499695779232752, 'batch_norm': True, 'sage_aggr': 'max', 'sage_normalize': False, 'sage_project': False, 'lr': 0.009647829519499771, 'weight_decay': 1.0133485474769345e-07, 'epochs': 88, 'loss': 'mse', 'optimizer': 'adam', 'graph_mode': 'knn', 'knn_k': 6, 'weighted_edges': False, 'symmetrize_mode': 'union', 'self_loops': False, 'use_snp_selection': True, 'num_snps': 35466}. Best is trial 25 with value: 0.30786536984361546.
[I 2025-12-08 11:25:54,093] Trial 59 finished with value: 0.3041143438493106 and parameters: {'model_type': 'graphsage', 'hidden_dims': '[256, 128]', 'dropout': 0.5795809840036408, 'batch_norm': True, 'sage_aggr': 'mean', 'sage_normalize': False, 'sage_project': False, 'lr': 0.00464632331625667, 'weight_decay': 5.271813234883759e-07, 'epochs': 50, 'loss': 'mse', 'optimizer': 'adam', 'graph_mode': 'cutoff', 'cutoff': 0.7321422829140904, 'grm_norm': 'none', 'self_loops': True, 'use_snp_selection': False}. Best is trial 25 with value: 0.30786536984361546.
[I 2025-12-08 11:27:28,960] Trial 60 finished with value: 0.2848678379280621 and parameters: {'model_type': 'graphsage', 'hidden_dims': '[256, 128]', 'dropout': 0.4542092408651033, 'batch_norm': True, 'sage_aggr': 'max', 'sage_normalize': False, 'sage_project': False, 'lr': 0.0025017721738360213, 'weight_decay': 8.34010478408166e-07, 'epochs': 291, 'loss': 'mse', 'optimizer': 'adam', 'graph_mode': 'cutoff', 'cutoff': 0.445138454168334, 'grm_norm': 'gcn', 'self_loops': True, 'use_snp_selection': False}. Best is trial 25 with value: 0.30786536984361546.
[I 2025-12-08 11:28:32,947] Trial 61 finished with value: 0.2995912180132526 and parameters: {'model_type': 'graphsage', 'hidden_dims': '[512, 256]', 'dropout': 0.4692775634827061, 'batch_norm': True, 'sage_aggr': 'max', 'sage_normalize': False, 'sage_project': False, 'lr': 0.003912662258001801, 'weight_decay': 2.3332889916838183e-06, 'epochs': 69, 'loss': 'mae', 'optimizer': 'adam', 'graph_mode': 'cutoff', 'cutoff': 0.6039838022383033, 'grm_norm': 'gcn', 'self_loops': False, 'use_snp_selection': True, 'num_snps': 48746}. Best is trial 25 with value: 0.30786536984361546.
[I 2025-12-08 11:30:03,268] Trial 62 finished with value: 0.29865522519872945 and parameters: {'model_type': 'graphsage', 'hidden_dims': '[512, 256]', 'dropout': 0.392812076419584, 'batch_norm': True, 'sage_aggr': 'max', 'sage_normalize': False, 'sage_project': False, 'lr': 0.005694112667718402, 'weight_decay': 1.7299525679869026e-06, 'epochs': 116, 'loss': 'mae', 'optimizer': 'adam', 'graph_mode': 'cutoff', 'cutoff': 0.5446161105385207, 'grm_norm': 'gcn', 'self_loops': False, 'use_snp_selection': True, 'num_snps': 54701}. Best is trial 25 with value: 0.30786536984361546.
[I 2025-12-08 11:31:11,420] Trial 63 finished with value: 0.30370110647603965 and parameters: {'model_type': 'graphsage', 'hidden_dims': '[512, 256]', 'dropout': 0.43864098294372733, 'batch_norm': True, 'sage_aggr': 'max', 'sage_normalize': False, 'sage_project': False, 'lr': 0.004675067603195885, 'weight_decay': 2.7825170281114885e-07, 'epochs': 79, 'loss': 'mae', 'optimizer': 'adam', 'graph_mode': 'cutoff', 'cutoff': 0.6229082755585986, 'grm_norm': 'gcn', 'self_loops': False, 'use_snp_selection': True, 'num_snps': 49166}. Best is trial 25 with value: 0.30786536984361546.
[I 2025-12-08 11:32:26,327] Trial 64 finished with value: 0.3023524848377729 and parameters: {'model_type': 'graphsage', 'hidden_dims': '[512, 256]', 'dropout': 0.11644674100910096, 'batch_norm': True, 'sage_aggr': 'max', 'sage_normalize': False, 'sage_project': False, 'lr': 0.0036255782345380383, 'weight_decay': 2.1693486918199035e-07, 'epochs': 93, 'loss': 'mae', 'optimizer': 'adam', 'graph_mode': 'cutoff', 'cutoff': 0.6779457230684679, 'grm_norm': 'cosine_then_gcn', 'self_loops': False, 'use_snp_selection': True, 'num_snps': 51733}. Best is trial 25 with value: 0.30786536984361546.
[I 2025-12-08 11:33:35,273] Trial 65 finished with value: 0.30413721394901483 and parameters: {'model_type': 'graphsage', 'hidden_dims': '[512, 256]', 'dropout': 0.5382488854187933, 'batch_norm': True, 'sage_aggr': 'max', 'sage_normalize': False, 'sage_project': False, 'lr': 0.0018822627246592326, 'weight_decay': 1.422476614685081e-06, 'epochs': 62, 'loss': 'mae', 'optimizer': 'adam', 'graph_mode': 'cutoff', 'cutoff': 0.5716779006550322, 'grm_norm': 'cosine', 'self_loops': False, 'use_snp_selection': True, 'num_snps': 56619}. Best is trial 25 with value: 0.30786536984361546.
[I 2025-12-08 11:33:54,586] Trial 66 finished with value: 0.3114468395549208 and parameters: {'model_type': 'graphsage', 'hidden_dims': '[128, 64]', 'dropout': 0.48752081732094865, 'batch_norm': True, 'sage_aggr': 'max', 'sage_normalize': True, 'sage_project': False, 'lr': 0.008085941027364513, 'weight_decay': 3.6260690364852816e-07, 'epochs': 77, 'loss': 'mse', 'optimizer': 'adam', 'graph_mode': 'cutoff', 'cutoff': 0.8669119557966405, 'grm_norm': 'none', 'self_loops': True, 'use_snp_selection': False}. Best is trial 66 with value: 0.3114468395549208.
[I 2025-12-08 11:34:18,119] Trial 67 finished with value: 0.30110019168662583 and parameters: {'model_type': 'graphsage', 'hidden_dims': '[128, 64]', 'dropout': 0.5198542449926655, 'batch_norm': True, 'sage_aggr': 'max', 'sage_normalize': True, 'sage_project': False, 'lr': 0.008057119181050666, 'weight_decay': 3.7695832451522676e-07, 'epochs': 109, 'loss': 'mse', 'optimizer': 'adam', 'graph_mode': 'cutoff', 'cutoff': 0.7850568970897572, 'grm_norm': 'none', 'self_loops': True, 'use_snp_selection': False}. Best is trial 66 with value: 0.3114468395549208.
[I 2025-12-08 11:34:33,566] Trial 68 finished with value: 0.25923551614232687 and parameters: {'model_type': 'graphsage', 'hidden_dims': '[128, 64]', 'dropout': 0.5000045031817377, 'batch_norm': False, 'sage_aggr': 'max', 'sage_normalize': True, 'sage_project': False, 'lr': 0.006377640743763733, 'weight_decay': 1.329713159066809e-07, 'epochs': 47, 'loss': 'mse', 'optimizer': 'adam', 'graph_mode': 'cutoff', 'cutoff': 0.8705376377692721, 'grm_norm': 'none', 'self_loops': True, 'use_snp_selection': False}. Best is trial 66 with value: 0.3114468395549208.
[I 2025-12-08 11:35:04,076] Trial 69 finished with value: 0.2598192609450521 and parameters: {'model_type': 'graphsage', 'hidden_dims': '[128, 64]', 'dropout': 0.548067592265548, 'batch_norm': True, 'sage_aggr': 'max', 'sage_normalize': True, 'sage_project': False, 'lr': 0.000247081016437987, 'weight_decay': 8.254264745255187e-07, 'epochs': 63, 'loss': 'mse', 'optimizer': 'adam', 'graph_mode': 'knn', 'knn_k': 4, 'weighted_edges': True, 'symmetrize_mode': 'union', 'self_loops': True, 'use_snp_selection': False}. Best is trial 66 with value: 0.3114468395549208.
[I 2025-12-08 11:35:18,862] Trial 70 finished with value: 0.290703701375581 and parameters: {'model_type': 'graphsage', 'hidden_dims': '[128, 64]', 'dropout': 0.4840055656340958, 'batch_norm': True, 'sage_aggr': 'mean', 'sage_normalize': True, 'sage_project': False, 'lr': 0.007512145640024935, 'weight_decay': 4.971369308742915e-07, 'epochs': 40, 'loss': 'mse', 'optimizer': 'adam', 'graph_mode': 'cutoff', 'cutoff': 0.7579038549840291, 'grm_norm': 'none', 'self_loops': True, 'use_snp_selection': False}. Best is trial 66 with value: 0.3114468395549208.
[I 2025-12-08 11:35:44,871] Trial 71 finished with value: 0.2999137548123615 and parameters: {'model_type': 'graphsage', 'hidden_dims': '[256, 128]', 'dropout': 0.46557361856557977, 'batch_norm': True, 'sage_aggr': 'max', 'sage_normalize': True, 'sage_project': False, 'lr': 0.004267925277192393, 'weight_decay': 3.1002893143465704e-07, 'epochs': 74, 'loss': 'mse', 'optimizer': 'adam', 'graph_mode': 'cutoff', 'cutoff': 0.8573659473121281, 'grm_norm': 'none', 'self_loops': True, 'use_snp_selection': False}. Best is trial 66 with value: 0.3114468395549208.
[I 2025-12-08 11:36:14,650] Trial 72 finished with value: 0.29778116301811597 and parameters: {'model_type': 'graphsage', 'hidden_dims': '[256, 128]', 'dropout': 0.36141461594396845, 'batch_norm': True, 'sage_aggr': 'max', 'sage_normalize': False, 'sage_project': False, 'lr': 0.005533069273494343, 'weight_decay': 2.0913805520215632e-07, 'epochs': 87, 'loss': 'mse', 'optimizer': 'adam', 'graph_mode': 'cutoff', 'cutoff': 0.6284772740000268, 'grm_norm': 'cosine', 'self_loops': True, 'use_snp_selection': False}. Best is trial 66 with value: 0.3114468395549208.
[I 2025-12-08 11:36:55,945] Trial 73 finished with value: 0.31037723572278947 and parameters: {'model_type': 'graphsage', 'hidden_dims': '[512, 128]', 'dropout': 0.5056738491065563, 'batch_norm': True, 'sage_aggr': 'max', 'sage_normalize': False, 'sage_project': False, 'lr': 0.009929731748539443, 'weight_decay': 1.1622705349966886e-06, 'epochs': 75, 'loss': 'mse', 'optimizer': 'adam', 'graph_mode': 'cutoff', 'cutoff': 0.8049443968014803, 'grm_norm': 'gcn', 'self_loops': True, 'use_snp_selection': False}. Best is trial 66 with value: 0.3114468395549208.
[I 2025-12-08 11:37:56,811] Trial 74 finished with value: 0.3025358539202134 and parameters: {'model_type': 'graphsage', 'hidden_dims': '[512, 128]', 'dropout': 0.533443027146351, 'batch_norm': True, 'sage_aggr': 'max', 'sage_normalize': False, 'sage_project': False, 'lr': 0.009687163376318742, 'weight_decay': 9.803914244143118e-07, 'epochs': 123, 'loss': 'mse', 'optimizer': 'adam', 'graph_mode': 'cutoff', 'cutoff': 0.8995773516100367, 'grm_norm': 'cosine', 'self_loops': True, 'use_snp_selection': False}. Best is trial 66 with value: 0.3114468395549208.
[I 2025-12-08 11:38:46,395] Trial 75 finished with value: 0.3128906257260532 and parameters: {'model_type': 'graphsage', 'hidden_dims': '[512, 128]', 'dropout': 0.5165224231565768, 'batch_norm': True, 'sage_aggr': 'max', 'sage_normalize': True, 'sage_project': False, 'lr': 0.008294347646992896, 'weight_decay': 2.608848334197618e-05, 'epochs': 96, 'loss': 'mse', 'optimizer': 'adam', 'graph_mode': 'cutoff', 'cutoff': 0.7907750866889982, 'grm_norm': 'gcn', 'self_loops': True, 'use_snp_selection': False}. Best is trial 75 with value: 0.3128906257260532.
