[I 2025-12-09 13:03:44,355] Trial 5 finished with value: 0.24996164911964058 and parameters: {'model_type': 'graphsage', 'hidden_dims': '[512, 64]', 'dropout': 0.14505336736221927, 'batch_norm': True, 'sage_aggr': 'mean', 'sage_normalize': True, 'sage_project': False, 'lr': 1.2962030165732234e-05, 'weight_decay': 1.326598071105465e-07, 'epochs': 180, 'loss': 'mse', 'optimizer': 'adam', 'graph_mode': 'knn', 'knn_k': 9, 'weighted_edges': True, 'symmetrize_mode': 'mutual', 'self_loops': False, 'use_snp_selection': False}. Best is trial 3 with value: 0.30100827123453333.
[I 2025-12-09 13:04:17,734] Trial 6 finished with value: 0.28938921292263803 and parameters: {'model_type': 'graphsage', 'hidden_dims': '[256, 128, 64]', 'dropout': 0.10731743755162496, 'batch_norm': True, 'sage_aggr': 'mean', 'sage_normalize': False, 'sage_project': False, 'lr': 1.922990426933137e-05, 'weight_decay': 7.30001060446905e-05, 'epochs': 63, 'loss': 'mae', 'optimizer': 'adam', 'graph_mode': 'cutoff', 'cutoff': 0.7624978434202536, 'grm_norm': 'none', 'self_loops': True, 'use_snp_selection': True, 'num_snps': 50106}. Best is trial 3 with value: 0.30100827123453333.
[I 2025-12-09 13:06:19,656] Trial 7 finished with value: 0.2519140525311313 and parameters: {'model_type': 'graphsage', 'hidden_dims': '[512, 64]', 'dropout': 0.2585007811528941, 'batch_norm': True, 'sage_aggr': 'max', 'sage_normalize': True, 'sage_project': False, 'lr': 5.921425508303391e-05, 'weight_decay': 0.0004511561961144237, 'epochs': 182, 'loss': 'mae', 'optimizer': 'adam', 'graph_mode': 'knn', 'knn_k': 9, 'weighted_edges': True, 'symmetrize_mode': 'union', 'self_loops': False, 'use_snp_selection': True, 'num_snps': 23903}. Best is trial 3 with value: 0.30100827123453333.
[I 2025-12-09 13:06:45,524] Trial 8 finished with value: 0.2561403482778357 and parameters: {'model_type': 'graphsage', 'hidden_dims': '[512, 256]', 'dropout': 0.3061380386767003, 'batch_norm': False, 'sage_aggr': 'mean', 'sage_normalize': True, 'sage_project': False, 'lr': 0.000698401460570184, 'weight_decay': 2.965560055460244e-06, 'epochs': 289, 'loss': 'mae', 'optimizer': 'adam', 'graph_mode': 'knn', 'knn_k': 7, 'weighted_edges': False, 'symmetrize_mode': 'mutual', 'self_loops': True, 'use_snp_selection': True, 'num_snps': 4710}. Best is trial 3 with value: 0.30100827123453333.
[I 2025-12-09 13:11:56,289] Trial 9 finished with value: 0.3002753348633383 and parameters: {'model_type': 'graphsage', 'hidden_dims': '[512, 128]', 'dropout': 0.1733844071393634, 'batch_norm': False, 'sage_aggr': 'mean', 'sage_normalize': True, 'sage_project': False, 'lr': 0.0004269677918501597, 'weight_decay': 2.2439779626249696e-06, 'epochs': 319, 'loss': 'mse', 'optimizer': 'adam', 'graph_mode': 'cutoff', 'cutoff': 0.24117565767129295, 'grm_norm': 'cosine_then_gcn', 'self_loops': True, 'use_snp_selection': False}. Best is trial 3 with value: 0.30100827123453333.
[I 2025-12-09 13:13:11,987] Trial 10 finished with value: 0.301927427581815 and parameters: {'model_type': 'graphsage', 'hidden_dims': '[256, 128, 64]', 'dropout': 0.5062131504581071, 'batch_norm': True, 'sage_aggr': 'max', 'sage_normalize': False, 'sage_project': False, 'lr': 0.006005004021681345, 'weight_decay': 1.5886244399072472e-05, 'epochs': 258, 'loss': 'mse', 'optimizer': 'adam', 'graph_mode': 'cutoff', 'cutoff': 0.6388703494956212, 'grm_norm': 'none', 'self_loops': True, 'use_snp_selection': False}. Best is trial 10 with value: 0.301927427581815.
[I 2025-12-09 13:14:25,490] Trial 11 finished with value: 0.300459660045483 and parameters: {'model_type': 'graphsage', 'hidden_dims': '[256, 128, 64]', 'dropout': 0.49488119581970164, 'batch_norm': True, 'sage_aggr': 'max', 'sage_normalize': False, 'sage_project': False, 'lr': 0.006753264773209739, 'weight_decay': 1.623283721491421e-05, 'epochs': 251, 'loss': 'mse', 'optimizer': 'adam', 'graph_mode': 'cutoff', 'cutoff': 0.6423124990838213, 'grm_norm': 'none', 'self_loops': True, 'use_snp_selection': False}. Best is trial 10 with value: 0.301927427581815.
[I 2025-12-09 13:16:12,573] Trial 12 finished with value: 0.27921642818389525 and parameters: {'model_type': 'graphsage', 'hidden_dims': '[256, 128, 64]', 'dropout': 0.4543297147807155, 'batch_norm': True, 'sage_aggr': 'max', 'sage_normalize': False, 'sage_project': False, 'lr': 0.00923224194542078, 'weight_decay': 6.372026470830696e-06, 'epochs': 340, 'loss': 'mse', 'optimizer': 'adam', 'graph_mode': 'cutoff', 'cutoff': 0.5281360710212811, 'grm_norm': 'cosine', 'self_loops': True, 'use_snp_selection': False}. Best is trial 10 with value: 0.301927427581815.
[I 2025-12-09 13:17:30,743] Trial 13 finished with value: 0.3048316355362081 and parameters: {'model_type': 'graphsage', 'hidden_dims': '[256, 128]', 'dropout': 0.41260004003266476, 'batch_norm': True, 'sage_aggr': 'max', 'sage_normalize': False, 'sage_project': False, 'lr': 0.0014626888081117134, 'weight_decay': 1.4066038882938765e-05, 'epochs': 276, 'loss': 'mse', 'optimizer': 'adam', 'graph_mode': 'cutoff', 'cutoff': 0.8513601585335109, 'grm_norm': 'none', 'self_loops': True, 'use_snp_selection': False}. Best is trial 13 with value: 0.3048316355362081.
[I 2025-12-09 13:18:36,597] Trial 14 finished with value: 0.30675638486992496 and parameters: {'model_type': 'graphsage', 'hidden_dims': '[256, 128]', 'dropout': 0.5904818868511308, 'batch_norm': True, 'sage_aggr': 'max', 'sage_normalize': False, 'sage_project': False, 'lr': 0.0022248893412831895, 'weight_decay': 4.280691332584972e-05, 'epochs': 231, 'loss': 'mse', 'optimizer': 'adam', 'graph_mode': 'cutoff', 'cutoff': 0.8923190952193389, 'grm_norm': 'none', 'self_loops': True, 'use_snp_selection': False}. Best is trial 14 with value: 0.30675638486992496.
[I 2025-12-09 13:19:39,457] Trial 15 finished with value: 0.30801050642660754 and parameters: {'model_type': 'graphsage', 'hidden_dims': '[256, 128]', 'dropout': 0.5943559672137123, 'batch_norm': True, 'sage_aggr': 'max', 'sage_normalize': False, 'sage_project': False, 'lr': 0.0014342593302532757, 'weight_decay': 6.778517508030456e-05, 'epochs': 220, 'loss': 'mse', 'optimizer': 'adam', 'graph_mode': 'cutoff', 'cutoff': 0.8973313329898638, 'grm_norm': 'none', 'self_loops': True, 'use_snp_selection': False}. Best is trial 15 with value: 0.30801050642660754.
[I 2025-12-09 13:20:09,282] Trial 16 finished with value: 0.3116288369888033 and parameters: {'model_type': 'graphsage', 'hidden_dims': '[256, 128]', 'dropout': 0.5780343407090761, 'batch_norm': True, 'sage_aggr': 'max', 'sage_normalize': False, 'sage_project': False, 'lr': 0.0023284946378271734, 'weight_decay': 8.175028900782917e-05, 'epochs': 99, 'loss': 'mse', 'optimizer': 'adam', 'graph_mode': 'cutoff', 'cutoff': 0.8813610467420523, 'grm_norm': 'gcn', 'self_loops': True, 'use_snp_selection': False}. Best is trial 16 with value: 0.3116288369888033.
[I 2025-12-09 13:20:35,623] Trial 17 finished with value: 0.30400044691668376 and parameters: {'model_type': 'graphsage', 'hidden_dims': '[256, 128]', 'dropout': 0.5984651878389242, 'batch_norm': True, 'sage_aggr': 'max', 'sage_normalize': False, 'sage_project': False, 'lr': 0.002761792988263759, 'weight_decay': 0.0008556782640823645, 'epochs': 86, 'loss': 'mse', 'optimizer': 'adam', 'graph_mode': 'cutoff', 'cutoff': 0.7742238121595011, 'grm_norm': 'gcn', 'self_loops': True, 'use_snp_selection': False}. Best is trial 16 with value: 0.3116288369888033.
[I 2025-12-09 13:21:24,161] Trial 18 finished with value: 0.2637045324505707 and parameters: {'model_type': 'graphsage', 'hidden_dims': '[256, 128]', 'dropout': 0.5424350895553987, 'batch_norm': False, 'sage_aggr': 'mean', 'sage_normalize': False, 'sage_project': False, 'lr': 0.00013805749421061123, 'weight_decay': 0.0001227167525796232, 'epochs': 107, 'loss': 'mse', 'optimizer': 'adam', 'graph_mode': 'cutoff', 'cutoff': 0.34923158684896505, 'grm_norm': 'gcn', 'self_loops': False, 'use_snp_selection': False}. Best is trial 16 with value: 0.3116288369888033.
[I 2025-12-09 13:21:38,066] Trial 19 finished with value: 0.3085875904638321 and parameters: {'model_type': 'graphsage', 'hidden_dims': '[256, 128]', 'dropout': 0.41351899471153286, 'batch_norm': True, 'sage_aggr': 'max', 'sage_normalize': False, 'sage_project': False, 'lr': 0.0010669781325807002, 'weight_decay': 7.592030665997785e-05, 'epochs': 40, 'loss': 'mse', 'optimizer': 'adam', 'graph_mode': 'cutoff', 'cutoff': 0.7480483258696848, 'grm_norm': 'cosine_then_gcn', 'self_loops': True, 'use_snp_selection': False}. Best is trial 16 with value: 0.3116288369888033.
[I 2025-12-09 13:21:51,961] Trial 20 finished with value: 0.3092172712053987 and parameters: {'model_type': 'graphsage', 'hidden_dims': '[256, 128]', 'dropout': 0.4016467161064905, 'batch_norm': True, 'sage_aggr': 'max', 'sage_normalize': False, 'sage_project': False, 'lr': 0.00017654279238307223, 'weight_decay': 0.0005012258574965979, 'epochs': 40, 'loss': 'mse', 'optimizer': 'adam', 'graph_mode': 'cutoff', 'cutoff': 0.7378209616212532, 'grm_norm': 'cosine_then_gcn', 'self_loops': True, 'use_snp_selection': False}. Best is trial 16 with value: 0.3116288369888033.
[I 2025-12-09 13:22:08,317] Trial 21 finished with value: 0.2954614840245762 and parameters: {'model_type': 'graphsage', 'hidden_dims': '[256, 128]', 'dropout': 0.3891282918864761, 'batch_norm': True, 'sage_aggr': 'max', 'sage_normalize': False, 'sage_project': False, 'lr': 0.00014047865335987616, 'weight_decay': 0.0007790707769555663, 'epochs': 49, 'loss': 'mse', 'optimizer': 'adam', 'graph_mode': 'cutoff', 'cutoff': 0.7452141527023352, 'grm_norm': 'cosine_then_gcn', 'self_loops': True, 'use_snp_selection': False}. Best is trial 16 with value: 0.3116288369888033.
[I 2025-12-09 13:22:22,218] Trial 22 finished with value: 0.30692874762102285 and parameters: {'model_type': 'graphsage', 'hidden_dims': '[256, 128]', 'dropout': 0.4153511638461153, 'batch_norm': True, 'sage_aggr': 'max', 'sage_normalize': False, 'sage_project': False, 'lr': 0.001035813660902307, 'weight_decay': 0.000321073472796422, 'epochs': 40, 'loss': 'mse', 'optimizer': 'adam', 'graph_mode': 'cutoff', 'cutoff': 0.7179114953784209, 'grm_norm': 'cosine_then_gcn', 'self_loops': True, 'use_snp_selection': False}. Best is trial 16 with value: 0.3116288369888033.
[I 2025-12-09 13:22:53,029] Trial 23 finished with value: 0.312166337709982 and parameters: {'model_type': 'graphsage', 'hidden_dims': '[256, 128]', 'dropout': 0.46121434614073836, 'batch_norm': True, 'sage_aggr': 'max', 'sage_normalize': False, 'sage_project': False, 'lr': 0.003281614092784413, 'weight_decay': 0.00011361649318705622, 'epochs': 102, 'loss': 'mse', 'optimizer': 'adam', 'graph_mode': 'cutoff', 'cutoff': 0.8166044049379827, 'grm_norm': 'cosine_then_gcn', 'self_loops': True, 'use_snp_selection': False}. Best is trial 23 with value: 0.312166337709982.
[I 2025-12-09 13:23:26,553] Trial 24 finished with value: 0.30777369901268986 and parameters: {'model_type': 'graphsage', 'hidden_dims': '[256, 128]', 'dropout': 0.4702281425740899, 'batch_norm': True, 'sage_aggr': 'max', 'sage_normalize': False, 'sage_project': False, 'lr': 0.00340242394168626, 'weight_decay': 0.00016518067338091696, 'epochs': 112, 'loss': 'mse', 'optimizer': 'adam', 'graph_mode': 'cutoff', 'cutoff': 0.8192974305088713, 'grm_norm': 'cosine_then_gcn', 'self_loops': True, 'use_snp_selection': False}. Best is trial 23 with value: 0.312166337709982.
[I 2025-12-09 13:23:51,978] Trial 25 finished with value: 0.29719038970030365 and parameters: {'model_type': 'graphsage', 'hidden_dims': '[256, 128]', 'dropout': 0.5380272108141361, 'batch_norm': True, 'sage_aggr': 'max', 'sage_normalize': False, 'sage_project': False, 'lr': 0.00020394029240899014, 'weight_decay': 0.0005142567328447796, 'epochs': 82, 'loss': 'mse', 'optimizer': 'adam', 'graph_mode': 'cutoff', 'cutoff': 0.6702212170548514, 'grm_norm': 'cosine', 'self_loops': True, 'use_snp_selection': False}. Best is trial 23 with value: 0.312166337709982.
[I 2025-12-09 13:24:24,693] Trial 26 finished with value: 0.26870077841007917 and parameters: {'model_type': 'graphsage', 'hidden_dims': '[256, 128]', 'dropout': 0.5511608780971201, 'batch_norm': False, 'sage_aggr': 'mean', 'sage_normalize': True, 'sage_project': False, 'lr': 0.004510238714189935, 'weight_decay': 3.2004890136819126e-05, 'epochs': 108, 'loss': 'mae', 'optimizer': 'adam', 'graph_mode': 'cutoff', 'cutoff': 0.8220753520350895, 'grm_norm': 'gcn', 'self_loops': False, 'use_snp_selection': False}. Best is trial 23 with value: 0.312166337709982.
[I 2025-12-09 13:24:48,406] Trial 27 finished with value: 0.3026227323324163 and parameters: {'model_type': 'graphsage', 'hidden_dims': '[128, 64]', 'dropout': 0.4492176151202998, 'batch_norm': True, 'sage_aggr': 'max', 'sage_normalize': False, 'sage_project': False, 'lr': 0.0006460336695966054, 'weight_decay': 0.00013534107917590566, 'epochs': 128, 'loss': 'mse', 'optimizer': 'adam', 'graph_mode': 'cutoff', 'cutoff': 0.8253032819971129, 'grm_norm': 'cosine_then_gcn', 'self_loops': True, 'use_snp_selection': False}. Best is trial 23 with value: 0.312166337709982.
[I 2025-12-09 13:25:32,078] Trial 28 finished with value: 0.303823267829129 and parameters: {'model_type': 'graphsage', 'hidden_dims': '[512, 64]', 'dropout': 0.37722171601446625, 'batch_norm': True, 'sage_aggr': 'max', 'sage_normalize': False, 'sage_project': False, 'lr': 0.0002263815575808641, 'weight_decay': 0.00026098030993620096, 'epochs': 77, 'loss': 'mse', 'optimizer': 'adam', 'graph_mode': 'cutoff', 'cutoff': 0.6917670052386933, 'grm_norm': 'cosine_then_gcn', 'self_loops': True, 'use_snp_selection': False}. Best is trial 23 with value: 0.312166337709982.
[I 2025-12-09 13:26:22,206] Trial 29 finished with value: 0.2739293882503954 and parameters: {'model_type': 'graphsage', 'hidden_dims': '[512, 256]', 'dropout': 0.4801023397292997, 'batch_norm': True, 'sage_aggr': 'max', 'sage_normalize': True, 'sage_project': False, 'lr': 0.0021261332326980454, 'weight_decay': 0.0001399979971402765, 'epochs': 65, 'loss': 'mse', 'optimizer': 'adam', 'graph_mode': 'knn', 'knn_k': 3, 'weighted_edges': False, 'symmetrize_mode': 'union', 'self_loops': True, 'use_snp_selection': False}. Best is trial 23 with value: 0.312166337709982.
[I 2025-12-09 13:27:28,949] Trial 30 finished with value: 0.27935126553937295 and parameters: {'model_type': 'graphsage', 'hidden_dims': '[512, 128]', 'dropout': 0.5276046974050617, 'batch_norm': True, 'sage_aggr': 'max', 'sage_normalize': False, 'sage_project': False, 'lr': 0.00028322330452216143, 'weight_decay': 0.0005021273269676993, 'epochs': 96, 'loss': 'mse', 'optimizer': 'adam', 'graph_mode': 'cutoff', 'cutoff': 0.45875978126303096, 'grm_norm': 'gcn', 'self_loops': True, 'use_snp_selection': False}. Best is trial 23 with value: 0.312166337709982.
[I 2025-12-09 13:27:42,985] Trial 31 finished with value: 0.30951186758060895 and parameters: {'model_type': 'graphsage', 'hidden_dims': '[256, 128]', 'dropout': 0.43066823547739064, 'batch_norm': True, 'sage_aggr': 'max', 'sage_normalize': False, 'sage_project': False, 'lr': 0.0008499257332198022, 'weight_decay': 6.462432262911019e-05, 'epochs': 40, 'loss': 'mse', 'optimizer': 'adam', 'graph_mode': 'cutoff', 'cutoff': 0.8018263456861972, 'grm_norm': 'cosine_then_gcn', 'self_loops': True, 'use_snp_selection': False}. Best is trial 23 with value: 0.312166337709982.
[I 2025-12-09 13:28:03,712] Trial 32 finished with value: 0.30380502283497846 and parameters: {'model_type': 'graphsage', 'hidden_dims': '[256, 128]', 'dropout': 0.3729671092136626, 'batch_norm': True, 'sage_aggr': 'max', 'sage_normalize': False, 'sage_project': False, 'lr': 0.0007172533849859558, 'weight_decay': 7.054931454857861e-05, 'epochs': 65, 'loss': 'mse', 'optimizer': 'adam', 'graph_mode': 'cutoff', 'cutoff': 0.8025526054016505, 'grm_norm': 'cosine_then_gcn', 'self_loops': True, 'use_snp_selection': False}. Best is trial 23 with value: 0.312166337709982.
[I 2025-12-09 13:28:43,260] Trial 33 finished with value: 0.3126149317194739 and parameters: {'model_type': 'graphsage', 'hidden_dims': '[256, 128]', 'dropout': 0.4404168584034953, 'batch_norm': True, 'sage_aggr': 'max', 'sage_normalize': False, 'sage_project': False, 'lr': 0.0016886323080198972, 'weight_decay': 0.0002451690750633489, 'epochs': 134, 'loss': 'mse', 'optimizer': 'adam', 'graph_mode': 'cutoff', 'cutoff': 0.8726833068845926, 'grm_norm': 'cosine_then_gcn', 'self_loops': True, 'use_snp_selection': False}. Best is trial 33 with value: 0.3126149317194739.
[I 2025-12-09 13:28:52,640] Trial 34 finished with value: 0.2622136948758725 and parameters: {'model_type': 'graphsage', 'hidden_dims': '[128, 64]', 'dropout': 0.44584542197373567, 'batch_norm': False, 'sage_aggr': 'max', 'sage_normalize': False, 'sage_project': False, 'lr': 0.004025596595694407, 'weight_decay': 3.060441592619428e-05, 'epochs': 134, 'loss': 'mse', 'optimizer': 'adam', 'graph_mode': 'cutoff', 'cutoff': 0.8799993216916269, 'grm_norm': 'cosine_then_gcn', 'self_loops': True, 'use_snp_selection': True, 'num_snps': 2241}. Best is trial 33 with value: 0.3126149317194739.
[I 2025-12-09 13:30:25,821] Trial 35 finished with value: 0.266707154332584 and parameters: {'model_type': 'graphsage', 'hidden_dims': '[256, 128]', 'dropout': 0.32373429167633644, 'batch_norm': True, 'sage_aggr': 'max', 'sage_normalize': False, 'sage_project': False, 'lr': 0.001705086507270517, 'weight_decay': 0.00023255580200210214, 'epochs': 157, 'loss': 'mse', 'optimizer': 'adam', 'graph_mode': 'knn', 'knn_k': 4, 'weighted_edges': True, 'symmetrize_mode': 'union', 'self_loops': True, 'use_snp_selection': False}. Best is trial 33 with value: 0.3126149317194739.
[I 2025-12-09 13:31:50,220] Trial 36 finished with value: 0.3041609358551871 and parameters: {'model_type': 'graphsage', 'hidden_dims': '[512, 128]', 'dropout': 0.5634526836847107, 'batch_norm': True, 'sage_aggr': 'max', 'sage_normalize': False, 'sage_project': False, 'lr': 0.0010073312303765728, 'weight_decay': 4.237201132416096e-05, 'epochs': 123, 'loss': 'mae', 'optimizer': 'adam', 'graph_mode': 'cutoff', 'cutoff': 0.8492716883793541, 'grm_norm': 'cosine', 'self_loops': False, 'use_snp_selection': True, 'num_snps': 59922}. Best is trial 33 with value: 0.3126149317194739.
[I 2025-12-09 13:33:05,695] Trial 37 finished with value: 0.3133627178984531 and parameters: {'model_type': 'graphsage', 'hidden_dims': '[512, 256]', 'dropout': 0.437377303531862, 'batch_norm': True, 'sage_aggr': 'max', 'sage_normalize': False, 'sage_project': False, 'lr': 0.002796373096094803, 'weight_decay': 0.0001038885871441471, 'epochs': 139, 'loss': 'mse', 'optimizer': 'adam', 'graph_mode': 'cutoff', 'cutoff': 0.8974238794332844, 'grm_norm': 'cosine_then_gcn', 'self_loops': True, 'use_snp_selection': False}. Best is trial 37 with value: 0.3133627178984531.
[I 2025-12-09 13:36:17,316] Trial 38 finished with value: 0.24014467311534418 and parameters: {'model_type': 'graphsage', 'hidden_dims': '[512, 256]', 'dropout': 0.5069963450950178, 'batch_norm': False, 'sage_aggr': 'mean', 'sage_normalize': True, 'sage_project': False, 'lr': 0.009443930715667225, 'weight_decay': 1.6139406775110432e-07, 'epochs': 173, 'loss': 'mae', 'optimizer': 'adam', 'graph_mode': 'knn', 'knn_k': 10, 'weighted_edges': True, 'symmetrize_mode': 'union', 'self_loops': False, 'use_snp_selection': False}. Best is trial 37 with value: 0.3133627178984531.
[I 2025-12-09 13:36:46,065] Trial 39 finished with value: 0.297240063519795 and parameters: {'model_type': 'graphsage', 'hidden_dims': '[512, 256]', 'dropout': 0.35136449686570176, 'batch_norm': True, 'sage_aggr': 'max', 'sage_normalize': False, 'sage_project': False, 'lr': 0.005355044434849404, 'weight_decay': 9.634026765804182e-05, 'epochs': 143, 'loss': 'mse', 'optimizer': 'adam', 'graph_mode': 'cutoff', 'cutoff': 0.8983359239564862, 'grm_norm': 'gcn', 'self_loops': True, 'use_snp_selection': True, 'num_snps': 15197}. Best is trial 37 with value: 0.3133627178984531.
[I 2025-12-09 13:40:14,901] Trial 40 finished with value: 0.27115376795561147 and parameters: {'model_type': 'graphsage', 'hidden_dims': '[512, 256]', 'dropout': 0.22125668019936234, 'batch_norm': True, 'sage_aggr': 'max', 'sage_normalize': False, 'sage_project': False, 'lr': 0.0033873384453555985, 'weight_decay': 0.00021910270999411243, 'epochs': 199, 'loss': 'mae', 'optimizer': 'adam', 'graph_mode': 'knn', 'knn_k': 7, 'weighted_edges': False, 'symmetrize_mode': 'union', 'self_loops': True, 'use_snp_selection': False}. Best is trial 37 with value: 0.3133627178984531.
[I 2025-12-09 13:41:06,677] Trial 41 finished with value: 0.3139472306944735 and parameters: {'model_type': 'graphsage', 'hidden_dims': '[512, 64]', 'dropout': 0.43307975319395053, 'batch_norm': True, 'sage_aggr': 'max', 'sage_normalize': False, 'sage_project': False, 'lr': 0.0027162587268589914, 'weight_decay': 5.976387179919739e-05, 'epochs': 93, 'loss': 'mse', 'optimizer': 'adam', 'graph_mode': 'cutoff', 'cutoff': 0.7955533235076242, 'grm_norm': 'cosine_then_gcn', 'self_loops': True, 'use_snp_selection': False}. Best is trial 41 with value: 0.3139472306944735.
[I 2025-12-09 13:41:58,951] Trial 42 finished with value: 0.31366948041212334 and parameters: {'model_type': 'graphsage', 'hidden_dims': '[512, 64]', 'dropout': 0.4710629288568626, 'batch_norm': True, 'sage_aggr': 'max', 'sage_normalize': False, 'sage_project': False, 'lr': 0.0024492186614590676, 'weight_decay': 2.424007138181092e-05, 'epochs': 94, 'loss': 'mse', 'optimizer': 'adam', 'graph_mode': 'cutoff', 'cutoff': 0.8548242501806931, 'grm_norm': 'cosine_then_gcn', 'self_loops': True, 'use_snp_selection': False}. Best is trial 41 with value: 0.3139472306944735.
