[I 2025-12-09 13:23:03,330] Trial 143 finished with value: 0.3709738134043955 and parameters: {'model_type': 'graphsage', 'hidden_dims': '[256, 128, 64]', 'dropout': 0.3147983642214804, 'batch_norm': False, 'sage_aggr': 'mean', 'sage_normalize': False, 'sage_project': False, 'lr': 1.6538078357265537e-05, 'weight_decay': 5.474274762385565e-05, 'epochs': 101, 'loss': 'mse', 'optimizer': 'adam', 'graph_mode': 'cutoff', 'cutoff': 0.8979110883056046, 'grm_norm': 'cosine', 'self_loops': True, 'use_snp_selection': False}. Best is trial 141 with value: 0.37510286724679653.
[I 2025-12-09 13:23:35,897] Trial 144 finished with value: 0.3686928812783926 and parameters: {'model_type': 'graphsage', 'hidden_dims': '[256, 128, 64]', 'dropout': 0.31297818068584704, 'batch_norm': False, 'sage_aggr': 'mean', 'sage_normalize': False, 'sage_project': False, 'lr': 1.004051836854118e-05, 'weight_decay': 5.4482856597458206e-05, 'epochs': 100, 'loss': 'mse', 'optimizer': 'adam', 'graph_mode': 'cutoff', 'cutoff': 0.8968624302818212, 'grm_norm': 'cosine', 'self_loops': True, 'use_snp_selection': False}. Best is trial 141 with value: 0.37510286724679653.
[I 2025-12-09 13:24:08,654] Trial 145 finished with value: 0.3761033656282664 and parameters: {'model_type': 'graphsage', 'hidden_dims': '[256, 128, 64]', 'dropout': 0.31301735617068777, 'batch_norm': False, 'sage_aggr': 'mean', 'sage_normalize': False, 'sage_project': False, 'lr': 1.0547427525503886e-05, 'weight_decay': 5.632785096098992e-05, 'epochs': 101, 'loss': 'mse', 'optimizer': 'adam', 'graph_mode': 'cutoff', 'cutoff': 0.8999179680693129, 'grm_norm': 'cosine', 'self_loops': True, 'use_snp_selection': False}. Best is trial 145 with value: 0.3761033656282664.
[I 2025-12-09 13:24:41,191] Trial 146 finished with value: 0.3627898106350918 and parameters: {'model_type': 'graphsage', 'hidden_dims': '[256, 128, 64]', 'dropout': 0.3096872497799295, 'batch_norm': False, 'sage_aggr': 'mean', 'sage_normalize': False, 'sage_project': False, 'lr': 1.002906765844122e-05, 'weight_decay': 2.6199840619359424e-05, 'epochs': 100, 'loss': 'mse', 'optimizer': 'adam', 'graph_mode': 'cutoff', 'cutoff': 0.8745162937510303, 'grm_norm': 'cosine', 'self_loops': True, 'use_snp_selection': False}. Best is trial 145 with value: 0.3761033656282664.
[I 2025-12-09 13:25:13,507] Trial 147 finished with value: 0.3644530498788587 and parameters: {'model_type': 'graphsage', 'hidden_dims': '[256, 128, 64]', 'dropout': 0.2744137427586822, 'batch_norm': False, 'sage_aggr': 'mean', 'sage_normalize': False, 'sage_project': False, 'lr': 1.3454803742822453e-05, 'weight_decay': 5.10776622054841e-05, 'epochs': 99, 'loss': 'mse', 'optimizer': 'adam', 'graph_mode': 'cutoff', 'cutoff': 0.8864976749232237, 'grm_norm': 'cosine', 'self_loops': True, 'use_snp_selection': False}. Best is trial 145 with value: 0.3761033656282664.
[I 2025-12-09 13:25:47,940] Trial 148 finished with value: 0.36396013470831495 and parameters: {'model_type': 'graphsage', 'hidden_dims': '[256, 128, 64]', 'dropout': 0.2880847641613079, 'batch_norm': False, 'sage_aggr': 'mean', 'sage_normalize': False, 'sage_project': False, 'lr': 1.1609759035632418e-05, 'weight_decay': 3.5484786632112294e-05, 'epochs': 109, 'loss': 'mse', 'optimizer': 'adam', 'graph_mode': 'cutoff', 'cutoff': 0.8993911603016481, 'grm_norm': 'cosine', 'self_loops': True, 'use_snp_selection': False}. Best is trial 145 with value: 0.3761033656282664.
[I 2025-12-09 13:26:20,896] Trial 149 finished with value: 0.3594559828345013 and parameters: {'model_type': 'graphsage', 'hidden_dims': '[256, 128, 64]', 'dropout': 0.31490403430505876, 'batch_norm': False, 'sage_aggr': 'mean', 'sage_normalize': False, 'sage_project': False, 'lr': 1.5297081088270768e-05, 'weight_decay': 7.885684816140861e-05, 'epochs': 101, 'loss': 'mse', 'optimizer': 'adam', 'graph_mode': 'cutoff', 'cutoff': 0.8704925113478393, 'grm_norm': 'cosine', 'self_loops': True, 'use_snp_selection': False}. Best is trial 145 with value: 0.3761033656282664.
[I 2025-12-09 13:27:39,768] Trial 0 finished with value: 0.31920804645140216 and parameters: {'model_type': 'graphsage', 'hidden_dims': '[128, 64]', 'dropout': 0.199031432379812, 'batch_norm': True, 'sage_aggr': 'max', 'sage_normalize': True, 'sage_project': False, 'lr': 0.00034401453323286885, 'weight_decay': 0.00017802616915745114, 'epochs': 230, 'loss': 'mse', 'optimizer': 'adam', 'graph_mode': 'knn', 'knn_k': 6, 'weighted_edges': True, 'symmetrize_mode': 'mutual', 'self_loops': True, 'use_snp_selection': False}. Best is trial 0 with value: 0.31920804645140216.
[I 2025-12-09 13:29:19,095] Trial 1 finished with value: 0.35493301872391625 and parameters: {'model_type': 'graphsage', 'hidden_dims': '[512, 128]', 'dropout': 0.2503500283181017, 'batch_norm': False, 'sage_aggr': 'max', 'sage_normalize': False, 'sage_project': False, 'lr': 3.952233718592099e-05, 'weight_decay': 0.00026754769258252603, 'epochs': 149, 'loss': 'mse', 'optimizer': 'adam', 'graph_mode': 'knn', 'knn_k': 2, 'weighted_edges': False, 'symmetrize_mode': 'mutual', 'self_loops': True, 'use_snp_selection': True, 'num_snps': 49915}. Best is trial 1 with value: 0.35493301872391625.
[I 2025-12-09 13:30:35,350] Trial 2 finished with value: 0.3644229735540957 and parameters: {'model_type': 'graphsage', 'hidden_dims': '[512, 256]', 'dropout': 0.2785908793172681, 'batch_norm': False, 'sage_aggr': 'max', 'sage_normalize': False, 'sage_project': False, 'lr': 8.806039223165805e-05, 'weight_decay': 3.5153176302760294e-05, 'epochs': 147, 'loss': 'mae', 'optimizer': 'adam', 'graph_mode': 'cutoff', 'cutoff': 0.4922564006874869, 'grm_norm': 'gcn', 'self_loops': False, 'use_snp_selection': True, 'num_snps': 34340}. Best is trial 2 with value: 0.3644229735540957.
[I 2025-12-09 13:31:48,355] Trial 3 finished with value: 0.3363703727520964 and parameters: {'model_type': 'graphsage', 'hidden_dims': '[256, 128, 64]', 'dropout': 0.3475243154412272, 'batch_norm': True, 'sage_aggr': 'max', 'sage_normalize': False, 'sage_project': False, 'lr': 1.6006331996938085e-05, 'weight_decay': 7.213121225589906e-06, 'epochs': 283, 'loss': 'mse', 'optimizer': 'adam', 'graph_mode': 'cutoff', 'cutoff': 0.5942334791449215, 'grm_norm': 'none', 'self_loops': True, 'use_snp_selection': False}. Best is trial 2 with value: 0.3644229735540957.
[I 2025-12-09 13:32:30,668] Trial 4 finished with value: 0.32421451535927537 and parameters: {'model_type': 'graphsage', 'hidden_dims': '[128, 64]', 'dropout': 0.3348926467202472, 'batch_norm': True, 'sage_aggr': 'max', 'sage_normalize': False, 'sage_project': False, 'lr': 0.0004238630400638802, 'weight_decay': 8.074086040046576e-07, 'epochs': 158, 'loss': 'mae', 'optimizer': 'adam', 'graph_mode': 'knn', 'knn_k': 1, 'weighted_edges': False, 'symmetrize_mode': 'mutual', 'self_loops': False, 'use_snp_selection': True, 'num_snps': 26850}. Best is trial 2 with value: 0.3644229735540957.
[I 2025-12-09 13:34:18,136] Trial 5 finished with value: 0.3209519857983688 and parameters: {'model_type': 'graphsage', 'hidden_dims': '[512, 64]', 'dropout': 0.14505336736221927, 'batch_norm': True, 'sage_aggr': 'mean', 'sage_normalize': True, 'sage_project': False, 'lr': 1.2962030165732234e-05, 'weight_decay': 1.326598071105465e-07, 'epochs': 180, 'loss': 'mse', 'optimizer': 'adam', 'graph_mode': 'knn', 'knn_k': 9, 'weighted_edges': True, 'symmetrize_mode': 'mutual', 'self_loops': False, 'use_snp_selection': False}. Best is trial 2 with value: 0.3644229735540957.
[I 2025-12-09 13:35:10,913] Trial 6 finished with value: 0.3265063727927469 and parameters: {'model_type': 'graphsage', 'hidden_dims': '[256, 128, 64]', 'dropout': 0.10731743755162496, 'batch_norm': True, 'sage_aggr': 'mean', 'sage_normalize': False, 'sage_project': False, 'lr': 1.922990426933137e-05, 'weight_decay': 7.30001060446905e-05, 'epochs': 63, 'loss': 'mae', 'optimizer': 'adam', 'graph_mode': 'cutoff', 'cutoff': 0.7624978434202536, 'grm_norm': 'none', 'self_loops': True, 'use_snp_selection': True, 'num_snps': 50106}. Best is trial 2 with value: 0.3644229735540957.
[I 2025-12-09 13:37:03,321] Trial 7 finished with value: 0.3386295313546552 and parameters: {'model_type': 'graphsage', 'hidden_dims': '[512, 64]', 'dropout': 0.2585007811528941, 'batch_norm': True, 'sage_aggr': 'max', 'sage_normalize': True, 'sage_project': False, 'lr': 5.921425508303391e-05, 'weight_decay': 0.0004511561961144237, 'epochs': 182, 'loss': 'mae', 'optimizer': 'adam', 'graph_mode': 'knn', 'knn_k': 9, 'weighted_edges': True, 'symmetrize_mode': 'union', 'self_loops': False, 'use_snp_selection': True, 'num_snps': 23903}. Best is trial 2 with value: 0.3644229735540957.
[I 2025-12-09 13:37:44,742] Trial 8 finished with value: 0.2927762302546447 and parameters: {'model_type': 'graphsage', 'hidden_dims': '[512, 256]', 'dropout': 0.3061380386767003, 'batch_norm': False, 'sage_aggr': 'mean', 'sage_normalize': True, 'sage_project': False, 'lr': 0.000698401460570184, 'weight_decay': 2.965560055460244e-06, 'epochs': 289, 'loss': 'mae', 'optimizer': 'adam', 'graph_mode': 'knn', 'knn_k': 7, 'weighted_edges': False, 'symmetrize_mode': 'mutual', 'self_loops': True, 'use_snp_selection': True, 'num_snps': 4710}. Best is trial 2 with value: 0.3644229735540957.
[I 2025-12-09 13:41:23,495] Trial 9 finished with value: 0.33862365592780186 and parameters: {'model_type': 'graphsage', 'hidden_dims': '[512, 128]', 'dropout': 0.1733844071393634, 'batch_norm': False, 'sage_aggr': 'mean', 'sage_normalize': True, 'sage_project': False, 'lr': 0.0004269677918501597, 'weight_decay': 2.2439779626249696e-06, 'epochs': 319, 'loss': 'mse', 'optimizer': 'adam', 'graph_mode': 'cutoff', 'cutoff': 0.24117565767129295, 'grm_norm': 'cosine_then_gcn', 'self_loops': True, 'use_snp_selection': False}. Best is trial 2 with value: 0.3644229735540957.
[I 2025-12-09 13:42:27,250] Trial 10 finished with value: 0.0 and parameters: {'model_type': 'graphsage', 'hidden_dims': '[512, 256]', 'dropout': 0.46773351022590026, 'batch_norm': False, 'sage_aggr': 'max', 'sage_normalize': False, 'sage_project': False, 'lr': 0.0060050040216813455, 'weight_decay': 3.194347401809951e-05, 'epochs': 76, 'loss': 'mae', 'optimizer': 'adam', 'graph_mode': 'cutoff', 'cutoff': 0.36538426242387784, 'grm_norm': 'gcn', 'self_loops': False, 'use_snp_selection': True, 'num_snps': 36724}. Best is trial 2 with value: 0.3644229735540957.
[I 2025-12-09 13:44:10,409] Trial 11 finished with value: 0.1940524011895365 and parameters: {'model_type': 'graphsage', 'hidden_dims': '[512, 128]', 'dropout': 0.4554228059341249, 'batch_norm': False, 'sage_aggr': 'max', 'sage_normalize': False, 'sage_project': False, 'lr': 8.040010782675617e-05, 'weight_decay': 0.0005735134390673265, 'epochs': 111, 'loss': 'mse', 'optimizer': 'adam', 'graph_mode': 'cutoff', 'cutoff': 0.48934453790731597, 'grm_norm': 'gcn', 'self_loops': False, 'use_snp_selection': True, 'num_snps': 57852}. Best is trial 2 with value: 0.3644229735540957.
[I 2025-12-09 13:45:21,689] Trial 12 finished with value: 0.3034391216081066 and parameters: {'model_type': 'graphsage', 'hidden_dims': '[256, 128]', 'dropout': 0.5957621421360685, 'batch_norm': False, 'sage_aggr': 'max', 'sage_normalize': False, 'sage_project': False, 'lr': 9.196950102765017e-05, 'weight_decay': 3.009671916983956e-05, 'epochs': 138, 'loss': 'mse', 'optimizer': 'adam', 'graph_mode': 'knn', 'knn_k': 1, 'weighted_edges': False, 'symmetrize_mode': 'union', 'self_loops': True, 'use_snp_selection': True, 'num_snps': 41579}. Best is trial 2 with value: 0.3644229735540957.
[I 2025-12-09 13:47:04,097] Trial 13 finished with value: 0.3518973248147583 and parameters: {'model_type': 'graphsage', 'hidden_dims': '[512, 128]', 'dropout': 0.232363982604941, 'batch_norm': False, 'sage_aggr': 'max', 'sage_normalize': False, 'sage_project': False, 'lr': 4.819859523109959e-05, 'weight_decay': 0.00011926072016900266, 'epochs': 223, 'loss': 'mae', 'optimizer': 'adam', 'graph_mode': 'cutoff', 'cutoff': 0.8137943133270612, 'grm_norm': 'cosine', 'self_loops': False, 'use_snp_selection': True, 'num_snps': 44122}. Best is trial 2 with value: 0.3644229735540957.
[I 2025-12-09 13:47:51,684] Trial 14 finished with value: 0.3432070580453323 and parameters: {'model_type': 'graphsage', 'hidden_dims': '[512, 256]', 'dropout': 0.420004136612043, 'batch_norm': False, 'sage_aggr': 'max', 'sage_normalize': False, 'sage_project': False, 'lr': 0.00011914209383103213, 'weight_decay': 0.000989888024080623, 'epochs': 120, 'loss': 'mse', 'optimizer': 'adam', 'graph_mode': 'knn', 'knn_k': 3, 'weighted_edges': False, 'symmetrize_mode': 'mutual', 'self_loops': True, 'use_snp_selection': True, 'num_snps': 16713}. Best is trial 2 with value: 0.3644229735540957.
[I 2025-12-09 13:48:43,673] Trial 15 finished with value: 0.08387042018956843 and parameters: {'model_type': 'graphsage', 'hidden_dims': '[256, 128]', 'dropout': 0.26548128812133703, 'batch_norm': False, 'sage_aggr': 'max', 'sage_normalize': False, 'sage_project': False, 'lr': 0.001140050652126762, 'weight_decay': 3.2519139811105935e-05, 'epochs': 41, 'loss': 'mae', 'optimizer': 'adam', 'graph_mode': 'cutoff', 'cutoff': 0.5928979992521486, 'grm_norm': 'gcn', 'self_loops': False, 'use_snp_selection': True, 'num_snps': 56944}. Best is trial 2 with value: 0.3644229735540957.
[I 2025-12-09 13:49:55,527] Trial 16 finished with value: 0.10995830473589167 and parameters: {'model_type': 'graphsage', 'hidden_dims': '[512, 256]', 'dropout': 0.39350777114497715, 'batch_norm': False, 'sage_aggr': 'max', 'sage_normalize': False, 'sage_project': False, 'lr': 0.0001503378949109947, 'weight_decay': 0.00018360671125602785, 'epochs': 92, 'loss': 'mse', 'optimizer': 'adam', 'graph_mode': 'knn', 'knn_k': 4, 'weighted_edges': False, 'symmetrize_mode': 'union', 'self_loops': False, 'use_snp_selection': True, 'num_snps': 33164}. Best is trial 2 with value: 0.3644229735540957.
[I 2025-12-09 13:52:20,698] Trial 17 finished with value: 0.3673211022051078 and parameters: {'model_type': 'graphsage', 'hidden_dims': '[512, 128]', 'dropout': 0.2881021929685086, 'batch_norm': False, 'sage_aggr': 'max', 'sage_normalize': False, 'sage_project': False, 'lr': 3.851579445299815e-05, 'weight_decay': 1.3591103086412823e-05, 'epochs': 222, 'loss': 'mae', 'optimizer': 'adam', 'graph_mode': 'cutoff', 'cutoff': 0.42979538969295905, 'grm_norm': 'cosine', 'self_loops': True, 'use_snp_selection': True, 'num_snps': 48827}. Best is trial 17 with value: 0.3673211022051078.
[I 2025-12-09 13:54:16,049] Trial 18 finished with value: 0.05919994850756462 and parameters: {'model_type': 'graphsage', 'hidden_dims': '[512, 256]', 'dropout': 0.5388719778066067, 'batch_norm': False, 'sage_aggr': 'mean', 'sage_normalize': False, 'sage_project': False, 'lr': 0.003170528957019733, 'weight_decay': 9.282749478762101e-06, 'epochs': 230, 'loss': 'mae', 'optimizer': 'adam', 'graph_mode': 'cutoff', 'cutoff': 0.44151348136910595, 'grm_norm': 'cosine', 'self_loops': False, 'use_snp_selection': False}. Best is trial 17 with value: 0.3673211022051078.
[I 2025-12-09 13:55:27,696] Trial 19 finished with value: 0.3577665342590333 and parameters: {'model_type': 'graphsage', 'hidden_dims': '[512, 128]', 'dropout': 0.30967081558167486, 'batch_norm': False, 'sage_aggr': 'max', 'sage_normalize': False, 'sage_project': False, 'lr': 2.7995338529665928e-05, 'weight_decay': 5.865453005585863e-07, 'epochs': 258, 'loss': 'mae', 'optimizer': 'adam', 'graph_mode': 'cutoff', 'cutoff': 0.31368603635868664, 'grm_norm': 'cosine', 'self_loops': True, 'use_snp_selection': True, 'num_snps': 17447}. Best is trial 17 with value: 0.3673211022051078.
[I 2025-12-09 13:56:40,162] Trial 20 finished with value: 0.340289980205956 and parameters: {'model_type': 'graphsage', 'hidden_dims': '[256, 128, 64]', 'dropout': 0.3825653036340115, 'batch_norm': False, 'sage_aggr': 'max', 'sage_normalize': False, 'sage_project': False, 'lr': 0.00016581002366662187, 'weight_decay': 1.7407150635988906e-05, 'epochs': 215, 'loss': 'mae', 'optimizer': 'adam', 'graph_mode': 'cutoff', 'cutoff': 0.680191331454106, 'grm_norm': 'cosine_then_gcn', 'self_loops': True, 'use_snp_selection': True, 'num_snps': 42550}. Best is trial 17 with value: 0.3673211022051078.
[I 2025-12-09 13:57:46,313] Trial 21 finished with value: 0.36182408462394966 and parameters: {'model_type': 'graphsage', 'hidden_dims': '[512, 128]', 'dropout': 0.29971861358185753, 'batch_norm': False, 'sage_aggr': 'max', 'sage_normalize': False, 'sage_project': False, 'lr': 3.236746825349599e-05, 'weight_decay': 2.9310702303566687e-07, 'epochs': 242, 'loss': 'mae', 'optimizer': 'adam', 'graph_mode': 'cutoff', 'cutoff': 0.33144543764187456, 'grm_norm': 'cosine', 'self_loops': True, 'use_snp_selection': True, 'num_snps': 16653}. Best is trial 17 with value: 0.3673211022051078.
[I 2025-12-09 13:58:39,714] Trial 22 finished with value: 0.3583674551359187 and parameters: {'model_type': 'graphsage', 'hidden_dims': '[512, 128]', 'dropout': 0.2964315897626386, 'batch_norm': False, 'sage_aggr': 'max', 'sage_normalize': False, 'sage_project': False, 'lr': 1.0430993306539756e-05, 'weight_decay': 2.2297279757607685e-07, 'epochs': 340, 'loss': 'mae', 'optimizer': 'adam', 'graph_mode': 'cutoff', 'cutoff': 0.4456050263601484, 'grm_norm': 'cosine', 'self_loops': True, 'use_snp_selection': True, 'num_snps': 8811}. Best is trial 17 with value: 0.3673211022051078.
[I 2025-12-09 13:59:51,237] Trial 23 finished with value: 0.3552426880281403 and parameters: {'model_type': 'graphsage', 'hidden_dims': '[512, 128]', 'dropout': 0.2102396594722936, 'batch_norm': False, 'sage_aggr': 'max', 'sage_normalize': False, 'sage_project': False, 'lr': 3.632725098087807e-05, 'weight_decay': 4.443471977501621e-06, 'epochs': 260, 'loss': 'mae', 'optimizer': 'adam', 'graph_mode': 'cutoff', 'cutoff': 0.3648903530947226, 'grm_norm': 'cosine', 'self_loops': True, 'use_snp_selection': True, 'num_snps': 18566}. Best is trial 17 with value: 0.3673211022051078.
[I 2025-12-09 14:01:51,176] Trial 24 finished with value: 0.29401641334624695 and parameters: {'model_type': 'graphsage', 'hidden_dims': '[512, 128]', 'dropout': 0.28639848513295435, 'batch_norm': False, 'sage_aggr': 'max', 'sage_normalize': False, 'sage_project': False, 'lr': 0.0002128321103459001, 'weight_decay': 1.2783326763870088e-06, 'epochs': 203, 'loss': 'mae', 'optimizer': 'adam', 'graph_mode': 'cutoff', 'cutoff': 0.2255804085069537, 'grm_norm': 'gcn', 'self_loops': True, 'use_snp_selection': True, 'num_snps': 27565}. Best is trial 17 with value: 0.3673211022051078.
[I 2025-12-09 14:03:10,041] Trial 25 finished with value: 0.36189112513325655 and parameters: {'model_type': 'graphsage', 'hidden_dims': '[512, 64]', 'dropout': 0.3357008181122375, 'batch_norm': False, 'sage_aggr': 'max', 'sage_normalize': False, 'sage_project': False, 'lr': 2.918624923771762e-05, 'weight_decay': 6.126475983213692e-05, 'epochs': 171, 'loss': 'mae', 'optimizer': 'adam', 'graph_mode': 'cutoff', 'cutoff': 0.5185854173107008, 'grm_norm': 'cosine', 'self_loops': True, 'use_snp_selection': True, 'num_snps': 35679}. Best is trial 17 with value: 0.3673211022051078.
[I 2025-12-09 14:04:33,727] Trial 26 finished with value: 0.3587128495446351 and parameters: {'model_type': 'graphsage', 'hidden_dims': '[512, 64]', 'dropout': 0.38471865036298153, 'batch_norm': False, 'sage_aggr': 'max', 'sage_normalize': False, 'sage_project': False, 'lr': 2.2044984968997322e-05, 'weight_decay': 6.647762624077904e-05, 'epochs': 175, 'loss': 'mae', 'optimizer': 'adam', 'graph_mode': 'cutoff', 'cutoff': 0.5224290157257139, 'grm_norm': 'cosine', 'self_loops': False, 'use_snp_selection': False}. Best is trial 17 with value: 0.3673211022051078.
[I 2025-12-09 14:05:40,884] Trial 27 finished with value: 0.31937053090140904 and parameters: {'model_type': 'graphsage', 'hidden_dims': '[512, 64]', 'dropout': 0.3472720536218367, 'batch_norm': False, 'sage_aggr': 'mean', 'sage_normalize': True, 'sage_project': False, 'lr': 6.321859426392463e-05, 'weight_decay': 1.8175283317033416e-05, 'epochs': 135, 'loss': 'mae', 'optimizer': 'adam', 'graph_mode': 'cutoff', 'cutoff': 0.6375372702379453, 'grm_norm': 'gcn', 'self_loops': True, 'use_snp_selection': True, 'num_snps': 35710}. Best is trial 17 with value: 0.3673211022051078.
[I 2025-12-09 14:07:50,961] Trial 28 finished with value: 0.19051211921913497 and parameters: {'model_type': 'graphsage', 'hidden_dims': '[512, 64]', 'dropout': 0.42433794306605666, 'batch_norm': False, 'sage_aggr': 'max', 'sage_normalize': False, 'sage_project': False, 'lr': 9.721660165635427e-05, 'weight_decay': 6.845833162799926e-05, 'epochs': 194, 'loss': 'mae', 'optimizer': 'adam', 'graph_mode': 'cutoff', 'cutoff': 0.4304646049135676, 'grm_norm': 'cosine', 'self_loops': False, 'use_snp_selection': True, 'num_snps': 49629}. Best is trial 17 with value: 0.3673211022051078.
[I 2025-12-09 14:08:17,282] Trial 29 finished with value: 0.3432276506392829 and parameters: {'model_type': 'graphsage', 'hidden_dims': '[128, 64]', 'dropout': 0.20162229600458176, 'batch_norm': True, 'sage_aggr': 'max', 'sage_normalize': True, 'sage_project': False, 'lr': 0.0002667432551127041, 'weight_decay': 1.673821111376386e-05, 'epochs': 112, 'loss': 'mae', 'optimizer': 'adam', 'graph_mode': 'cutoff', 'cutoff': 0.5423959508752372, 'grm_norm': 'cosine_then_gcn', 'self_loops': True, 'use_snp_selection': False}. Best is trial 17 with value: 0.3673211022051078.
[I 2025-12-09 14:09:17,192] Trial 30 finished with value: 0.3540765923399105 and parameters: {'model_type': 'graphsage', 'hidden_dims': '[256, 128]', 'dropout': 0.2233680484274158, 'batch_norm': False, 'sage_aggr': 'max', 'sage_normalize': False, 'sage_project': False, 'lr': 2.5461238593735493e-05, 'weight_decay': 6.477727162070418e-06, 'epochs': 166, 'loss': 'mae', 'optimizer': 'adam', 'graph_mode': 'cutoff', 'cutoff': 0.7054459309572257, 'grm_norm': 'none', 'self_loops': True, 'use_snp_selection': True, 'num_snps': 38914}. Best is trial 17 with value: 0.3673211022051078.
