[I 2025-12-06 20:45:48,814] Trial 140 finished with value: 0.2396728326627271 and parameters: {'model_type': 'graphsage', 'hidden_dims': '[512, 64]', 'dropout': 0.14324323255892868, 'batch_norm': False, 'sage_aggr': 'max', 'sage_normalize': False, 'sage_project': False, 'lr': 9.455337597112617e-05, 'weight_decay': 0.0005238286832997297, 'epochs': 181, 'loss': 'mse', 'optimizer': 'adam', 'graph_mode': 'cutoff', 'cutoff': 0.6998602296235856, 'grm_norm': 'cosine', 'self_loops': False, 'use_snp_selection': True, 'num_snps': 18176, 'graphsage_batch_size': 64}. Best is trial 121 with value: 0.2633200643440919.
[I 2025-12-06 20:46:29,719] Trial 141 finished with value: 0.24872248807207042 and parameters: {'model_type': 'graphsage', 'hidden_dims': '[512, 64]', 'dropout': 0.1772700657841414, 'batch_norm': False, 'sage_aggr': 'max', 'sage_normalize': False, 'sage_project': False, 'lr': 0.00016072600514712942, 'weight_decay': 0.00022669347649539924, 'epochs': 103, 'loss': 'mae', 'optimizer': 'adam', 'graph_mode': 'cutoff', 'cutoff': 0.8575896768985645, 'grm_norm': 'gcn', 'self_loops': False, 'use_snp_selection': True, 'num_snps': 23592, 'graphsage_batch_size': 512}. Best is trial 121 with value: 0.2633200643440919.
[I 2025-12-06 20:47:10,561] Trial 142 finished with value: 0.2514422382804099 and parameters: {'model_type': 'graphsage', 'hidden_dims': '[512, 64]', 'dropout': 0.12223227929824847, 'batch_norm': False, 'sage_aggr': 'max', 'sage_normalize': False, 'sage_project': False, 'lr': 0.00017622753753021133, 'weight_decay': 0.00020383936523035202, 'epochs': 119, 'loss': 'mae', 'optimizer': 'adam', 'graph_mode': 'cutoff', 'cutoff': 0.8436122617331232, 'grm_norm': 'gcn', 'self_loops': False, 'use_snp_selection': True, 'num_snps': 21232, 'graphsage_batch_size': 512}. Best is trial 121 with value: 0.2633200643440919.
[I 2025-12-06 20:47:50,945] Trial 143 finished with value: 0.24137000346739218 and parameters: {'model_type': 'graphsage', 'hidden_dims': '[512, 64]', 'dropout': 0.15665528884534072, 'batch_norm': False, 'sage_aggr': 'max', 'sage_normalize': False, 'sage_project': False, 'lr': 0.00026821163392422455, 'weight_decay': 0.00036303817819731773, 'epochs': 90, 'loss': 'mae', 'optimizer': 'adam', 'graph_mode': 'cutoff', 'cutoff': 0.8714576721246705, 'grm_norm': 'gcn', 'self_loops': False, 'use_snp_selection': True, 'num_snps': 25770, 'graphsage_batch_size': 64}. Best is trial 121 with value: 0.2633200643440919.
[I 2025-12-06 20:48:14,671] Trial 144 finished with value: 0.2515015965638212 and parameters: {'model_type': 'graphsage', 'hidden_dims': '[128, 64]', 'dropout': 0.10047531844352502, 'batch_norm': False, 'sage_aggr': 'max', 'sage_normalize': False, 'sage_project': False, 'lr': 0.00011333018853390344, 'weight_decay': 0.0002572511845112032, 'epochs': 107, 'loss': 'mae', 'optimizer': 'adam', 'graph_mode': 'cutoff', 'cutoff': 0.8059715659317135, 'grm_norm': 'gcn', 'self_loops': False, 'use_snp_selection': True, 'num_snps': 18872, 'graphsage_batch_size': 512}. Best is trial 121 with value: 0.2633200643440919.
[I 2025-12-06 20:48:53,632] Trial 145 finished with value: 0.2417439889606578 and parameters: {'model_type': 'graphsage', 'hidden_dims': '[512, 64]', 'dropout': 0.13473837879306302, 'batch_norm': False, 'sage_aggr': 'max', 'sage_normalize': False, 'sage_project': False, 'lr': 0.00021787935437149453, 'weight_decay': 0.0004379340690974278, 'epochs': 97, 'loss': 'mae', 'optimizer': 'adam', 'graph_mode': 'cutoff', 'cutoff': 0.8298746223440117, 'grm_norm': 'gcn', 'self_loops': False, 'use_snp_selection': True, 'num_snps': 22657, 'graphsage_batch_size': 128}. Best is trial 121 with value: 0.2633200643440919.
[I 2025-12-06 20:49:37,651] Trial 146 finished with value: 0.2548157894258171 and parameters: {'model_type': 'graphsage', 'hidden_dims': '[512, 64]', 'dropout': 0.11569438831569158, 'batch_norm': False, 'sage_aggr': 'max', 'sage_normalize': False, 'sage_project': False, 'lr': 8.032949817697052e-05, 'weight_decay': 0.00013222870225044318, 'epochs': 112, 'loss': 'mae', 'optimizer': 'adam', 'graph_mode': 'cutoff', 'cutoff': 0.7592454248776076, 'grm_norm': 'gcn', 'self_loops': False, 'use_snp_selection': True, 'num_snps': 24431, 'graphsage_batch_size': 64}. Best is trial 121 with value: 0.2633200643440919.
[I 2025-12-06 20:50:16,323] Trial 147 finished with value: 0.2556182398572679 and parameters: {'model_type': 'graphsage', 'hidden_dims': '[512, 64]', 'dropout': 0.11406785999134167, 'batch_norm': False, 'sage_aggr': 'max', 'sage_normalize': False, 'sage_project': False, 'lr': 8.146132800741365e-05, 'weight_decay': 4.88678926283593e-05, 'epochs': 116, 'loss': 'mae', 'optimizer': 'adam', 'graph_mode': 'cutoff', 'cutoff': 0.7527813445987098, 'grm_norm': 'gcn', 'self_loops': False, 'use_snp_selection': True, 'num_snps': 19897, 'graphsage_batch_size': 64}. Best is trial 121 with value: 0.2633200643440919.
[I 2025-12-06 20:50:55,293] Trial 148 finished with value: 0.2582556997926598 and parameters: {'model_type': 'graphsage', 'hidden_dims': '[512, 64]', 'dropout': 0.11334621195572095, 'batch_norm': False, 'sage_aggr': 'max', 'sage_normalize': False, 'sage_project': False, 'lr': 4.815685358703079e-05, 'weight_decay': 5.148657213491637e-05, 'epochs': 117, 'loss': 'mae', 'optimizer': 'adam', 'graph_mode': 'cutoff', 'cutoff': 0.7330154796473803, 'grm_norm': 'gcn', 'self_loops': False, 'use_snp_selection': True, 'num_snps': 20080, 'graphsage_batch_size': 64}. Best is trial 121 with value: 0.2633200643440919.
[I 2025-12-06 20:51:25,486] Trial 149 finished with value: 0.24143900085747755 and parameters: {'model_type': 'graphsage', 'hidden_dims': '[256, 128]', 'dropout': 0.1277827574182531, 'batch_norm': True, 'sage_aggr': 'max', 'sage_normalize': False, 'sage_project': False, 'lr': 6.687982894980533e-05, 'weight_decay': 5.0545456905738895e-05, 'epochs': 117, 'loss': 'mae', 'optimizer': 'adam', 'graph_mode': 'cutoff', 'cutoff': 0.7335345978987593, 'grm_norm': 'gcn', 'self_loops': False, 'use_snp_selection': True, 'num_snps': 20020, 'graphsage_batch_size': 64}. Best is trial 121 with value: 0.2633200643440919.
