[I 2025-12-10 09:04:02,870] Trial 102 finished with value: 0.29613135710806876 and parameters: {'model_type': 'graphsage', 'hidden_dims': '[512, 256]', 'dropout': 0.1784382986609021, 'batch_norm': False, 'sage_aggr': 'max', 'sage_normalize': False, 'sage_project': False, 'lr': 3.224804819310159e-05, 'weight_decay': 1.0830167558653777e-06, 'epochs': 158, 'loss': 'mse', 'optimizer': 'adam', 'graph_mode': 'cutoff', 'cutoff': 0.3783211058477798, 'grm_norm': 'cosine', 'self_loops': False, 'use_snp_selection': True, 'num_snps': 8516}. Best is trial 35 with value: 0.3015295099119898.
[I 2025-12-10 09:05:25,549] Trial 103 finished with value: 0.29741735860986374 and parameters: {'model_type': 'graphsage', 'hidden_dims': '[512, 256]', 'dropout': 0.27690257896614007, 'batch_norm': False, 'sage_aggr': 'max', 'sage_normalize': False, 'sage_project': False, 'lr': 4.199565311977185e-05, 'weight_decay': 2.6894336704704336e-06, 'epochs': 171, 'loss': 'mse', 'optimizer': 'adam', 'graph_mode': 'cutoff', 'cutoff': 0.4400218865713856, 'grm_norm': 'cosine_then_gcn', 'self_loops': False, 'use_snp_selection': True, 'num_snps': 24326}. Best is trial 35 with value: 0.3015295099119898.
[I 2025-12-10 09:07:02,077] Trial 104 finished with value: 0.2964336385390053 and parameters: {'model_type': 'graphsage', 'hidden_dims': '[512, 256]', 'dropout': 0.27465561032955843, 'batch_norm': False, 'sage_aggr': 'max', 'sage_normalize': False, 'sage_project': False, 'lr': 5.239369111601151e-05, 'weight_decay': 2.8702486246573334e-06, 'epochs': 173, 'loss': 'mse', 'optimizer': 'adam', 'graph_mode': 'cutoff', 'cutoff': 0.4403993211297625, 'grm_norm': 'cosine_then_gcn', 'self_loops': False, 'use_snp_selection': True, 'num_snps': 27727}. Best is trial 35 with value: 0.3015295099119898.
[I 2025-12-10 09:07:50,065] Trial 105 finished with value: 0.2914208833919286 and parameters: {'model_type': 'graphsage', 'hidden_dims': '[128, 64]', 'dropout': 0.2696073119356554, 'batch_norm': False, 'sage_aggr': 'max', 'sage_normalize': False, 'sage_project': False, 'lr': 4.560273454167677e-05, 'weight_decay': 1.5719635302621425e-06, 'epochs': 142, 'loss': 'mse', 'optimizer': 'adam', 'graph_mode': 'cutoff', 'cutoff': 0.4741572734853867, 'grm_norm': 'cosine', 'self_loops': False, 'use_snp_selection': True, 'num_snps': 21986}. Best is trial 35 with value: 0.3015295099119898.
[I 2025-12-10 09:09:17,984] Trial 106 finished with value: 0.2975042804582144 and parameters: {'model_type': 'graphsage', 'hidden_dims': '[512, 256]', 'dropout': 0.3418796552086491, 'batch_norm': False, 'sage_aggr': 'max', 'sage_normalize': False, 'sage_project': False, 'lr': 4.1280466863766414e-05, 'weight_decay': 6.047403310678163e-06, 'epochs': 165, 'loss': 'mse', 'optimizer': 'adam', 'graph_mode': 'cutoff', 'cutoff': 0.3928425720940123, 'grm_norm': 'cosine', 'self_loops': True, 'use_snp_selection': True, 'num_snps': 25128}. Best is trial 35 with value: 0.3015295099119898.
[I 2025-12-10 09:10:49,137] Trial 107 finished with value: 0.29203859993401526 and parameters: {'model_type': 'graphsage', 'hidden_dims': '[512, 256]', 'dropout': 0.3242265572849967, 'batch_norm': False, 'sage_aggr': 'max', 'sage_normalize': False, 'sage_project': False, 'lr': 1.9495574824501806e-05, 'weight_decay': 5.750703321132637e-06, 'epochs': 196, 'loss': 'mse', 'optimizer': 'adam', 'graph_mode': 'cutoff', 'cutoff': 0.4520465656801672, 'grm_norm': 'cosine', 'self_loops': True, 'use_snp_selection': True, 'num_snps': 24471}. Best is trial 35 with value: 0.3015295099119898.
[I 2025-12-10 09:12:38,099] Trial 108 finished with value: 0.27890266873260305 and parameters: {'model_type': 'graphsage', 'hidden_dims': '[512, 256]', 'dropout': 0.3534331365552589, 'batch_norm': True, 'sage_aggr': 'max', 'sage_normalize': True, 'sage_project': False, 'lr': 6.833425061008265e-05, 'weight_decay': 3.6160464997967594e-06, 'epochs': 167, 'loss': 'mse', 'optimizer': 'adam', 'graph_mode': 'cutoff', 'cutoff': 0.4203603182760292, 'grm_norm': 'cosine', 'self_loops': True, 'use_snp_selection': True, 'num_snps': 30197}. Best is trial 35 with value: 0.3015295099119898.
[I 2025-12-10 09:14:04,365] Trial 109 finished with value: 0.28549645781297656 and parameters: {'model_type': 'graphsage', 'hidden_dims': '[256, 128, 64]', 'dropout': 0.29249845247790324, 'batch_norm': False, 'sage_aggr': 'max', 'sage_normalize': False, 'sage_project': False, 'lr': 2.740601124941195e-05, 'weight_decay': 5.348556922721287e-07, 'epochs': 186, 'loss': 'mse', 'optimizer': 'adam', 'graph_mode': 'cutoff', 'cutoff': 0.34628618659994825, 'grm_norm': 'cosine', 'self_loops': True, 'use_snp_selection': True, 'num_snps': 25053}. Best is trial 35 with value: 0.3015295099119898.
[I 2025-12-10 09:15:45,211] Trial 110 finished with value: 0.2758333661771853 and parameters: {'model_type': 'graphsage', 'hidden_dims': '[512, 256]', 'dropout': 0.370033634044598, 'batch_norm': False, 'sage_aggr': 'max', 'sage_normalize': False, 'sage_project': False, 'lr': 3.489249773877022e-05, 'weight_decay': 2.74398151706289e-06, 'epochs': 149, 'loss': 'mae', 'optimizer': 'adam', 'graph_mode': 'cutoff', 'cutoff': 0.5019314602923248, 'grm_norm': 'cosine', 'self_loops': True, 'use_snp_selection': False}. Best is trial 35 with value: 0.3015295099119898.
[I 2025-12-10 09:17:16,983] Trial 111 finished with value: 0.2961348551305435 and parameters: {'model_type': 'graphsage', 'hidden_dims': '[512, 256]', 'dropout': 0.24060243947757504, 'batch_norm': False, 'sage_aggr': 'max', 'sage_normalize': False, 'sage_project': False, 'lr': 4.1748698645330154e-05, 'weight_decay': 9.458269382493864e-06, 'epochs': 158, 'loss': 'mse', 'optimizer': 'adam', 'graph_mode': 'cutoff', 'cutoff': 0.3807967852326338, 'grm_norm': 'cosine_then_gcn', 'self_loops': True, 'use_snp_selection': True, 'num_snps': 26594}. Best is trial 35 with value: 0.3015295099119898.
[I 2025-12-10 09:19:06,158] Trial 112 finished with value: 0.2937568703747293 and parameters: {'model_type': 'graphsage', 'hidden_dims': '[512, 256]', 'dropout': 0.2654888521232487, 'batch_norm': False, 'sage_aggr': 'max', 'sage_normalize': False, 'sage_project': False, 'lr': 9.440619398400558e-05, 'weight_decay': 7.756545457172615e-06, 'epochs': 174, 'loss': 'mse', 'optimizer': 'adam', 'graph_mode': 'cutoff', 'cutoff': 0.3926394650920882, 'grm_norm': 'cosine', 'self_loops': False, 'use_snp_selection': True, 'num_snps': 29012}. Best is trial 35 with value: 0.3015295099119898.
[I 2025-12-10 09:20:59,145] Trial 113 finished with value: 0.29939795980250555 and parameters: {'model_type': 'graphsage', 'hidden_dims': '[512, 256]', 'dropout': 0.32185440820877376, 'batch_norm': False, 'sage_aggr': 'max', 'sage_normalize': False, 'sage_project': False, 'lr': 3.123653148932791e-05, 'weight_decay': 6.4260128125057425e-06, 'epochs': 164, 'loss': 'mse', 'optimizer': 'adam', 'graph_mode': 'cutoff', 'cutoff': 0.40950720129593976, 'grm_norm': 'gcn', 'self_loops': False, 'use_snp_selection': True, 'num_snps': 32168}. Best is trial 35 with value: 0.3015295099119898.
[I 2025-12-10 09:23:09,678] Trial 114 finished with value: 0.29873012501559376 and parameters: {'model_type': 'graphsage', 'hidden_dims': '[512, 256]', 'dropout': 0.3156598796946641, 'batch_norm': False, 'sage_aggr': 'max', 'sage_normalize': False, 'sage_project': False, 'lr': 3.571570683095254e-05, 'weight_decay': 3.5194684665531414e-06, 'epochs': 182, 'loss': 'mse', 'optimizer': 'adam', 'graph_mode': 'cutoff', 'cutoff': 0.4319540413315675, 'grm_norm': 'gcn', 'self_loops': False, 'use_snp_selection': True, 'num_snps': 33922}. Best is trial 35 with value: 0.3015295099119898.
[I 2025-12-10 09:25:13,185] Trial 115 finished with value: 0.29489185936601653 and parameters: {'model_type': 'graphsage', 'hidden_dims': '[512, 256]', 'dropout': 0.32920369627586404, 'batch_norm': False, 'sage_aggr': 'max', 'sage_normalize': False, 'sage_project': False, 'lr': 3.0395646655691576e-05, 'weight_decay': 3.4683312123545447e-06, 'epochs': 182, 'loss': 'mse', 'optimizer': 'adam', 'graph_mode': 'cutoff', 'cutoff': 0.4102152168366212, 'grm_norm': 'gcn', 'self_loops': False, 'use_snp_selection': True, 'num_snps': 32217}. Best is trial 35 with value: 0.3015295099119898.
[I 2025-12-10 09:27:47,320] Trial 116 finished with value: 0.29751508109799674 and parameters: {'model_type': 'graphsage', 'hidden_dims': '[512, 256]', 'dropout': 0.3131735364174102, 'batch_norm': False, 'sage_aggr': 'max', 'sage_normalize': False, 'sage_project': False, 'lr': 1.7627829610993105e-05, 'weight_decay': 4.468150867788504e-06, 'epochs': 201, 'loss': 'mse', 'optimizer': 'adam', 'graph_mode': 'cutoff', 'cutoff': 0.4319125001761389, 'grm_norm': 'gcn', 'self_loops': False, 'use_snp_selection': True, 'num_snps': 37636}. Best is trial 35 with value: 0.3015295099119898.
[I 2025-12-10 09:30:29,650] Trial 117 finished with value: 0.2904284254436459 and parameters: {'model_type': 'graphsage', 'hidden_dims': '[512, 64]', 'dropout': 0.30782749646107344, 'batch_norm': False, 'sage_aggr': 'max', 'sage_normalize': False, 'sage_project': False, 'lr': 1.787792730682727e-05, 'weight_decay': 4.7446410772524845e-06, 'epochs': 202, 'loss': 'mse', 'optimizer': 'adam', 'graph_mode': 'knn', 'knn_k': 3, 'weighted_edges': True, 'symmetrize_mode': 'union', 'self_loops': True, 'use_snp_selection': True, 'num_snps': 36236}. Best is trial 35 with value: 0.3015295099119898.
[I 2025-12-10 09:33:24,522] Trial 118 finished with value: 0.29287178241867373 and parameters: {'model_type': 'graphsage', 'hidden_dims': '[512, 256]', 'dropout': 0.33902739930116144, 'batch_norm': False, 'sage_aggr': 'max', 'sage_normalize': False, 'sage_project': False, 'lr': 1.2873317137226873e-05, 'weight_decay': 6.7552206081234325e-06, 'epochs': 195, 'loss': 'mse', 'optimizer': 'adam', 'graph_mode': 'cutoff', 'cutoff': 0.3641568993355458, 'grm_norm': 'gcn', 'self_loops': False, 'use_snp_selection': True, 'num_snps': 39321}. Best is trial 35 with value: 0.3015295099119898.
[I 2025-12-10 09:34:52,095] Trial 119 finished with value: 0.28440321075870145 and parameters: {'model_type': 'graphsage', 'hidden_dims': '[512, 128]', 'dropout': 0.31786166578595126, 'batch_norm': False, 'sage_aggr': 'max', 'sage_normalize': False, 'sage_project': False, 'lr': 2.295745714462431e-05, 'weight_decay': 5.83547471019253e-06, 'epochs': 178, 'loss': 'mse', 'optimizer': 'adam', 'graph_mode': 'cutoff', 'cutoff': 0.6867560555780672, 'grm_norm': 'gcn', 'self_loops': False, 'use_snp_selection': True, 'num_snps': 34236}. Best is trial 35 with value: 0.3015295099119898.
[I 2025-12-10 09:37:18,815] Trial 120 finished with value: 0.29681186649105207 and parameters: {'model_type': 'graphsage', 'hidden_dims': '[512, 256]', 'dropout': 0.3662121204876547, 'batch_norm': False, 'sage_aggr': 'max', 'sage_normalize': False, 'sage_project': False, 'lr': 2.070876538367073e-05, 'weight_decay': 1.7262929706791548e-06, 'epochs': 191, 'loss': 'mse', 'optimizer': 'adam', 'graph_mode': 'cutoff', 'cutoff': 0.391643103207415, 'grm_norm': 'gcn', 'self_loops': False, 'use_snp_selection': True, 'num_snps': 36911}. Best is trial 35 with value: 0.3015295099119898.
[I 2025-12-10 09:39:17,316] Trial 121 finished with value: 0.305397681020213 and parameters: {'model_type': 'graphsage', 'hidden_dims': '[512, 256]', 'dropout': 0.28325806442333495, 'batch_norm': False, 'sage_aggr': 'max', 'sage_normalize': False, 'sage_project': False, 'lr': 3.691163683727225e-05, 'weight_decay': 2.28831440309989e-06, 'epochs': 167, 'loss': 'mse', 'optimizer': 'adam', 'graph_mode': 'cutoff', 'cutoff': 0.43258059442253066, 'grm_norm': 'gcn', 'self_loops': False, 'use_snp_selection': True, 'num_snps': 33720}. Best is trial 121 with value: 0.305397681020213.
[I 2025-12-10 09:42:20,941] Trial 122 finished with value: 0.3009892765536117 and parameters: {'model_type': 'graphsage', 'hidden_dims': '[512, 256]', 'dropout': 0.29272135665861926, 'batch_norm': False, 'sage_aggr': 'max', 'sage_normalize': False, 'sage_project': False, 'lr': 3.3740445461484064e-05, 'weight_decay': 2.1616233251808724e-06, 'epochs': 303, 'loss': 'mse', 'optimizer': 'adam', 'graph_mode': 'cutoff', 'cutoff': 0.429032757292749, 'grm_norm': 'gcn', 'self_loops': False, 'use_snp_selection': True, 'num_snps': 33000}. Best is trial 121 with value: 0.305397681020213.
[I 2025-12-10 09:44:38,889] Trial 123 finished with value: 0.3005287287677676 and parameters: {'model_type': 'graphsage', 'hidden_dims': '[512, 256]', 'dropout': 0.28842857407182926, 'batch_norm': False, 'sage_aggr': 'max', 'sage_normalize': False, 'sage_project': False, 'lr': 3.5439949163560124e-05, 'weight_decay': 1.2143224489295014e-06, 'epochs': 186, 'loss': 'mse', 'optimizer': 'adam', 'graph_mode': 'cutoff', 'cutoff': 0.4099115049325825, 'grm_norm': 'gcn', 'self_loops': False, 'use_snp_selection': True, 'num_snps': 35096}. Best is trial 121 with value: 0.305397681020213.
[I 2025-12-10 09:47:49,048] Trial 124 finished with value: 0.2929626438356857 and parameters: {'model_type': 'graphsage', 'hidden_dims': '[512, 256]', 'dropout': 0.2878199528766944, 'batch_norm': False, 'sage_aggr': 'max', 'sage_normalize': False, 'sage_project': False, 'lr': 2.580651865681107e-05, 'weight_decay': 2.0379462246278513e-06, 'epochs': 294, 'loss': 'mse', 'optimizer': 'adam', 'graph_mode': 'cutoff', 'cutoff': 0.4101867844134663, 'grm_norm': 'gcn', 'self_loops': False, 'use_snp_selection': True, 'num_snps': 34589}. Best is trial 121 with value: 0.305397681020213.
[I 2025-12-10 09:49:15,696] Trial 125 finished with value: 0.28161230735044496 and parameters: {'model_type': 'graphsage', 'hidden_dims': '[512, 256]', 'dropout': 0.29465220021990424, 'batch_norm': False, 'sage_aggr': 'max', 'sage_normalize': False, 'sage_project': False, 'lr': 3.692889208216055e-05, 'weight_decay': 1.2632659058684605e-06, 'epochs': 109, 'loss': 'mse', 'optimizer': 'adam', 'graph_mode': 'cutoff', 'cutoff': 0.46204539761194696, 'grm_norm': 'gcn', 'self_loops': False, 'use_snp_selection': True, 'num_snps': 33141}. Best is trial 121 with value: 0.305397681020213.
[I 2025-12-10 09:51:35,193] Trial 126 finished with value: 0.29679892725538026 and parameters: {'model_type': 'graphsage', 'hidden_dims': '[512, 256]', 'dropout': 0.30126131967440584, 'batch_norm': False, 'sage_aggr': 'mean', 'sage_normalize': False, 'sage_project': False, 'lr': 3.115083810796001e-05, 'weight_decay': 1.2850215171887344e-06, 'epochs': 185, 'loss': 'mse', 'optimizer': 'adam', 'graph_mode': 'cutoff', 'cutoff': 0.3506354315922656, 'grm_norm': 'gcn', 'self_loops': False, 'use_snp_selection': True, 'num_snps': 33699}. Best is trial 121 with value: 0.305397681020213.
[I 2025-12-10 09:54:43,653] Trial 127 finished with value: 0.29553626267219657 and parameters: {'model_type': 'graphsage', 'hidden_dims': '[512, 256]', 'dropout': 0.25125334326356746, 'batch_norm': False, 'sage_aggr': 'max', 'sage_normalize': False, 'sage_project': False, 'lr': 3.5472820359631085e-05, 'weight_decay': 3.6481545309025764e-06, 'epochs': 305, 'loss': 'mse', 'optimizer': 'adam', 'graph_mode': 'cutoff', 'cutoff': 0.37364342558908703, 'grm_norm': 'gcn', 'self_loops': False, 'use_snp_selection': True, 'num_snps': 31663}. Best is trial 121 with value: 0.305397681020213.
[I 2025-12-10 09:56:08,038] Trial 128 finished with value: 0.2896436395093054 and parameters: {'model_type': 'graphsage', 'hidden_dims': '[512, 256]', 'dropout': 0.28446393753315435, 'batch_norm': False, 'sage_aggr': 'max', 'sage_normalize': False, 'sage_project': False, 'lr': 1.1153741404718946e-05, 'weight_decay': 2.469004826406716e-06, 'epochs': 88, 'loss': 'mse', 'optimizer': 'adam', 'graph_mode': 'cutoff', 'cutoff': 0.42775797391635517, 'grm_norm': 'gcn', 'self_loops': False, 'use_snp_selection': True, 'num_snps': 35802}. Best is trial 121 with value: 0.305397681020213.
[I 2025-12-10 09:57:32,697] Trial 129 finished with value: 0.2646800527154116 and parameters: {'model_type': 'graphsage', 'hidden_dims': '[256, 128]', 'dropout': 0.2649323510756259, 'batch_norm': False, 'sage_aggr': 'max', 'sage_normalize': True, 'sage_project': False, 'lr': 6.16234358225347e-05, 'weight_decay': 2.2438181986204404e-06, 'epochs': 155, 'loss': 'mse', 'optimizer': 'adam', 'graph_mode': 'cutoff', 'cutoff': 0.4092308082626279, 'grm_norm': 'gcn', 'self_loops': False, 'use_snp_selection': True, 'num_snps': 29987}. Best is trial 121 with value: 0.305397681020213.
[I 2025-12-10 09:59:04,963] Trial 130 finished with value: 0.27999519108752713 and parameters: {'model_type': 'graphsage', 'hidden_dims': '[128, 64]', 'dropout': 0.2423957950211011, 'batch_norm': True, 'sage_aggr': 'max', 'sage_normalize': False, 'sage_project': False, 'lr': 0.0076184306451478525, 'weight_decay': 9.522473724794282e-07, 'epochs': 265, 'loss': 'mae', 'optimizer': 'adam', 'graph_mode': 'cutoff', 'cutoff': 0.4474889595477582, 'grm_norm': 'gcn', 'self_loops': False, 'use_snp_selection': False}. Best is trial 121 with value: 0.305397681020213.
[I 2025-12-10 10:03:15,226] Trial 131 finished with value: 0.29766164324846583 and parameters: {'model_type': 'graphsage', 'hidden_dims': '[512, 256]', 'dropout': 0.3143808177263509, 'batch_norm': False, 'sage_aggr': 'max', 'sage_normalize': False, 'sage_project': False, 'lr': 1.518423672031003e-05, 'weight_decay': 4.247165187745516e-06, 'epochs': 322, 'loss': 'mse', 'optimizer': 'adam', 'graph_mode': 'cutoff', 'cutoff': 0.43019326034645167, 'grm_norm': 'gcn', 'self_loops': False, 'use_snp_selection': True, 'num_snps': 40859}. Best is trial 121 with value: 0.305397681020213.
[I 2025-12-10 10:07:56,850] Trial 132 finished with value: 0.28734157489455076 and parameters: {'model_type': 'graphsage', 'hidden_dims': '[512, 256]', 'dropout': 0.3272972831621007, 'batch_norm': False, 'sage_aggr': 'max', 'sage_normalize': False, 'sage_project': False, 'lr': 1.5029137945708517e-05, 'weight_decay': 1.659948969405653e-06, 'epochs': 323, 'loss': 'mse', 'optimizer': 'adam', 'graph_mode': 'cutoff', 'cutoff': 0.4796577075085104, 'grm_norm': 'gcn', 'self_loops': False, 'use_snp_selection': True, 'num_snps': 46963}. Best is trial 121 with value: 0.305397681020213.
[I 2025-12-10 10:12:26,663] Trial 133 finished with value: 0.2913591193998934 and parameters: {'model_type': 'graphsage', 'hidden_dims': '[512, 256]', 'dropout': 0.3044572341621185, 'batch_norm': False, 'sage_aggr': 'max', 'sage_normalize': False, 'sage_project': False, 'lr': 2.16156228110416e-05, 'weight_decay': 3.0435627743668837e-06, 'epochs': 327, 'loss': 'mse', 'optimizer': 'adam', 'graph_mode': 'cutoff', 'cutoff': 0.4224153314829462, 'grm_norm': 'gcn', 'self_loops': False, 'use_snp_selection': True, 'num_snps': 42507}. Best is trial 121 with value: 0.305397681020213.
[I 2025-12-10 10:17:12,576] Trial 134 finished with value: 0.2879861427371472 and parameters: {'model_type': 'graphsage', 'hidden_dims': '[512, 256]', 'dropout': 0.27911835704266835, 'batch_norm': False, 'sage_aggr': 'max', 'sage_normalize': False, 'sage_project': False, 'lr': 1.3561455626917637e-05, 'weight_decay': 7.242860623648683e-07, 'epochs': 349, 'loss': 'mse', 'optimizer': 'adam', 'graph_mode': 'cutoff', 'cutoff': 0.3655775422615555, 'grm_norm': 'gcn', 'self_loops': False, 'use_snp_selection': True, 'num_snps': 39873}. Best is trial 121 with value: 0.305397681020213.
[I 2025-12-10 10:19:28,828] Trial 135 finished with value: 0.30064030055893576 and parameters: {'model_type': 'graphsage', 'hidden_dims': '[512, 256]', 'dropout': 0.3158870114244916, 'batch_norm': False, 'sage_aggr': 'max', 'sage_normalize': False, 'sage_project': False, 'lr': 2.5385699927312335e-05, 'weight_decay': 1.1211954413849086e-05, 'epochs': 177, 'loss': 'mse', 'optimizer': 'adam', 'graph_mode': 'cutoff', 'cutoff': 0.38504714960144804, 'grm_norm': 'gcn', 'self_loops': False, 'use_snp_selection': True, 'num_snps': 35106}. Best is trial 121 with value: 0.305397681020213.
[I 2025-12-10 10:21:46,315] Trial 136 finished with value: 0.30005780206540145 and parameters: {'model_type': 'graphsage', 'hidden_dims': '[512, 256]', 'dropout': 0.29094114846325114, 'batch_norm': False, 'sage_aggr': 'max', 'sage_normalize': False, 'sage_project': False, 'lr': 5.274320901389378e-05, 'weight_decay': 1.0800389374041974e-05, 'epochs': 178, 'loss': 'mse', 'optimizer': 'adam', 'graph_mode': 'cutoff', 'cutoff': 0.38292090244015065, 'grm_norm': 'gcn', 'self_loops': False, 'use_snp_selection': True, 'num_snps': 35100}. Best is trial 121 with value: 0.305397681020213.
[I 2025-12-10 10:24:03,302] Trial 137 finished with value: 0.2996997482877663 and parameters: {'model_type': 'graphsage', 'hidden_dims': '[512, 256]', 'dropout': 0.2957505838871444, 'batch_norm': False, 'sage_aggr': 'max', 'sage_normalize': False, 'sage_project': False, 'lr': 5.460153898824627e-05, 'weight_decay': 1.5169376078395632e-05, 'epochs': 179, 'loss': 'mse', 'optimizer': 'adam', 'graph_mode': 'cutoff', 'cutoff': 0.38146143653318254, 'grm_norm': 'gcn', 'self_loops': False, 'use_snp_selection': True, 'num_snps': 35647}. Best is trial 121 with value: 0.305397681020213.
[I 2025-12-10 10:26:04,102] Trial 138 finished with value: 0.27997193353022887 and parameters: {'model_type': 'graphsage', 'hidden_dims': '[512, 256]', 'dropout': 0.2958648303977045, 'batch_norm': False, 'sage_aggr': 'max', 'sage_normalize': False, 'sage_project': False, 'lr': 2.7903168706159682e-05, 'weight_decay': 1.2565810361820496e-05, 'epochs': 185, 'loss': 'mse', 'optimizer': 'adam', 'graph_mode': 'knn', 'knn_k': 5, 'weighted_edges': False, 'symmetrize_mode': 'mutual', 'self_loops': False, 'use_snp_selection': True, 'num_snps': 35077}. Best is trial 121 with value: 0.305397681020213.
