[I 2025-12-08 15:57:48,228] Trial 111 finished with value: -0.003589214273281762 and parameters: {'model_type': 'graphsage', 'hidden_dims': '[512, 256]', 'dropout': 0.27443627921996816, 'batch_norm': False, 'sage_aggr': 'max', 'sage_normalize': False, 'sage_project': False, 'lr': 0.0026656289730481336, 'weight_decay': 3.6487737470353786e-07, 'epochs': 178, 'loss': 'mse', 'optimizer': 'adam', 'graph_mode': 'cutoff', 'cutoff': 0.46734707659308183, 'grm_norm': 'none', 'self_loops': False, 'use_snp_selection': True, 'num_snps': 59992}. Best is trial 77 with value: 0.28832115134996583.
[I 2025-12-08 16:01:32,243] Trial 112 finished with value: 0.27992369145639456 and parameters: {'model_type': 'graphsage', 'hidden_dims': '[512, 256]', 'dropout': 0.28567505539274823, 'batch_norm': False, 'sage_aggr': 'max', 'sage_normalize': False, 'sage_project': False, 'lr': 1.5918048546594668e-05, 'weight_decay': 1.2235838222896462e-07, 'epochs': 186, 'loss': 'mse', 'optimizer': 'adam', 'graph_mode': 'cutoff', 'cutoff': 0.4480989238791641, 'grm_norm': 'none', 'self_loops': False, 'use_snp_selection': True, 'num_snps': 57401}. Best is trial 77 with value: 0.28832115134996583.
[I 2025-12-08 16:04:42,757] Trial 113 finished with value: 0.27909437352715216 and parameters: {'model_type': 'graphsage', 'hidden_dims': '[512, 256]', 'dropout': 0.32375475615509497, 'batch_norm': False, 'sage_aggr': 'max', 'sage_normalize': False, 'sage_project': False, 'lr': 2.41925834465073e-05, 'weight_decay': 2.7110110778862323e-07, 'epochs': 153, 'loss': 'mse', 'optimizer': 'adam', 'graph_mode': 'cutoff', 'cutoff': 0.4083911882568876, 'grm_norm': 'none', 'self_loops': False, 'use_snp_selection': True, 'num_snps': 56018}. Best is trial 77 with value: 0.28832115134996583.
[I 2025-12-08 16:07:55,480] Trial 114 finished with value: 0.2790330601336145 and parameters: {'model_type': 'graphsage', 'hidden_dims': '[512, 256]', 'dropout': 0.2966246969854931, 'batch_norm': False, 'sage_aggr': 'max', 'sage_normalize': False, 'sage_project': False, 'lr': 1.1095753739152435e-05, 'weight_decay': 3.087596864626257e-05, 'epochs': 162, 'loss': 'mse', 'optimizer': 'adam', 'graph_mode': 'cutoff', 'cutoff': 0.49216071136869277, 'grm_norm': 'none', 'self_loops': False, 'use_snp_selection': True, 'num_snps': 58974}. Best is trial 77 with value: 0.28832115134996583.
[I 2025-12-08 16:10:58,896] Trial 115 finished with value: 0.27503499394583925 and parameters: {'model_type': 'graphsage', 'hidden_dims': '[512, 256]', 'dropout': 0.2440151639158942, 'batch_norm': False, 'sage_aggr': 'max', 'sage_normalize': False, 'sage_project': False, 'lr': 1.0090114034883644e-05, 'weight_decay': 1.589141805511297e-07, 'epochs': 217, 'loss': 'mse', 'optimizer': 'adam', 'graph_mode': 'cutoff', 'cutoff': 0.5297064198966154, 'grm_norm': 'none', 'self_loops': True, 'use_snp_selection': True, 'num_snps': 52803}. Best is trial 77 with value: 0.28832115134996583.
[I 2025-12-08 16:14:21,031] Trial 116 finished with value: 0.2389310575885172 and parameters: {'model_type': 'graphsage', 'hidden_dims': '[512, 256]', 'dropout': 0.26049507170152175, 'batch_norm': True, 'sage_aggr': 'max', 'sage_normalize': True, 'sage_project': False, 'lr': 2.13369873886413e-05, 'weight_decay': 2.0633789039939046e-05, 'epochs': 195, 'loss': 'mse', 'optimizer': 'adam', 'graph_mode': 'cutoff', 'cutoff': 0.4575277230844855, 'grm_norm': 'none', 'self_loops': False, 'use_snp_selection': True, 'num_snps': 55344}. Best is trial 77 with value: 0.28832115134996583.
[I 2025-12-08 16:16:58,449] Trial 117 finished with value: 0.2668982842351576 and parameters: {'model_type': 'graphsage', 'hidden_dims': '[512, 64]', 'dropout': 0.31102108729826033, 'batch_norm': False, 'sage_aggr': 'max', 'sage_normalize': False, 'sage_project': False, 'lr': 1.4427151448585751e-05, 'weight_decay': 4.2823518538269164e-07, 'epochs': 210, 'loss': 'mae', 'optimizer': 'adam', 'graph_mode': 'cutoff', 'cutoff': 0.38723693544465, 'grm_norm': 'cosine', 'self_loops': False, 'use_snp_selection': False}. Best is trial 77 with value: 0.28832115134996583.
[I 2025-12-08 16:17:53,930] Trial 118 finished with value: 0.27301041210253113 and parameters: {'model_type': 'graphsage', 'hidden_dims': '[512, 256]', 'dropout': 0.3676505614984695, 'batch_norm': False, 'sage_aggr': 'max', 'sage_normalize': False, 'sage_project': False, 'lr': 9.076684999832923e-05, 'weight_decay': 2.1695708542460453e-07, 'epochs': 188, 'loss': 'mse', 'optimizer': 'adam', 'graph_mode': 'cutoff', 'cutoff': 0.4327693241708908, 'grm_norm': 'none', 'self_loops': False, 'use_snp_selection': True, 'num_snps': 13708}. Best is trial 77 with value: 0.28832115134996583.
[I 2025-12-08 16:25:03,149] Trial 119 finished with value: 0.2699805736456818 and parameters: {'model_type': 'graphsage', 'hidden_dims': '[512, 256]', 'dropout': 0.2767924103893212, 'batch_norm': False, 'sage_aggr': 'max', 'sage_normalize': False, 'sage_project': False, 'lr': 1.265715970501039e-05, 'weight_decay': 1.7915781384324277e-07, 'epochs': 252, 'loss': 'mse', 'optimizer': 'adam', 'graph_mode': 'knn', 'knn_k': 6, 'weighted_edges': False, 'symmetrize_mode': 'union', 'self_loops': False, 'use_snp_selection': True, 'num_snps': 58328}. Best is trial 77 with value: 0.28832115134996583.
[I 2025-12-08 16:27:29,572] Trial 120 finished with value: 0.269844511557029 and parameters: {'model_type': 'graphsage', 'hidden_dims': '[256, 128, 64]', 'dropout': 0.26642524833133807, 'batch_norm': False, 'sage_aggr': 'max', 'sage_normalize': False, 'sage_project': False, 'lr': 1.728145428533839e-05, 'weight_decay': 5.568988815926475e-07, 'epochs': 177, 'loss': 'mse', 'optimizer': 'adam', 'graph_mode': 'cutoff', 'cutoff': 0.5041707399438639, 'grm_norm': 'none', 'self_loops': False, 'use_snp_selection': True, 'num_snps': 56876}. Best is trial 77 with value: 0.28832115134996583.
[I 2025-12-08 16:30:50,247] Trial 121 finished with value: 0.2858629933247823 and parameters: {'model_type': 'graphsage', 'hidden_dims': '[512, 256]', 'dropout': 0.257151179414131, 'batch_norm': False, 'sage_aggr': 'max', 'sage_normalize': False, 'sage_project': False, 'lr': 1.0502019989886947e-05, 'weight_decay': 1.0088541564831353e-07, 'epochs': 171, 'loss': 'mse', 'optimizer': 'adam', 'graph_mode': 'cutoff', 'cutoff': 0.4778114638004338, 'grm_norm': 'none', 'self_loops': False, 'use_snp_selection': True, 'num_snps': 58112}. Best is trial 77 with value: 0.28832115134996583.
[I 2025-12-08 16:33:59,479] Trial 122 finished with value: 0.28748104977707534 and parameters: {'model_type': 'graphsage', 'hidden_dims': '[512, 256]', 'dropout': 0.23088927060703288, 'batch_norm': False, 'sage_aggr': 'max', 'sage_normalize': False, 'sage_project': False, 'lr': 1.2353690901891281e-05, 'weight_decay': 1.3654215219688397e-07, 'epochs': 172, 'loss': 'mse', 'optimizer': 'adam', 'graph_mode': 'cutoff', 'cutoff': 0.47916315640012647, 'grm_norm': 'none', 'self_loops': False, 'use_snp_selection': True, 'num_snps': 54134}. Best is trial 77 with value: 0.28832115134996583.
[I 2025-12-08 16:37:16,229] Trial 123 finished with value: 0.2850130187832478 and parameters: {'model_type': 'graphsage', 'hidden_dims': '[512, 256]', 'dropout': 0.23285325975306498, 'batch_norm': False, 'sage_aggr': 'max', 'sage_normalize': False, 'sage_project': False, 'lr': 1.2116823701528516e-05, 'weight_decay': 1.4488460386730134e-07, 'epochs': 182, 'loss': 'mse', 'optimizer': 'adam', 'graph_mode': 'cutoff', 'cutoff': 0.4835879672393047, 'grm_norm': 'none', 'self_loops': False, 'use_snp_selection': True, 'num_snps': 54492}. Best is trial 77 with value: 0.28832115134996583.
[I 2025-12-08 16:40:38,152] Trial 124 finished with value: 0.2854117857869586 and parameters: {'model_type': 'graphsage', 'hidden_dims': '[512, 256]', 'dropout': 0.23689266367780334, 'batch_norm': False, 'sage_aggr': 'max', 'sage_normalize': False, 'sage_project': False, 'lr': 1.3939736506208128e-05, 'weight_decay': 1.3627991208995852e-07, 'epochs': 170, 'loss': 'mse', 'optimizer': 'adam', 'graph_mode': 'cutoff', 'cutoff': 0.4177333830684859, 'grm_norm': 'none', 'self_loops': False, 'use_snp_selection': True, 'num_snps': 54629}. Best is trial 77 with value: 0.28832115134996583.
[I 2025-12-08 16:42:58,175] Trial 125 finished with value: 0.28004708958455427 and parameters: {'model_type': 'graphsage', 'hidden_dims': '[512, 256]', 'dropout': 0.2320655264281568, 'batch_norm': False, 'sage_aggr': 'max', 'sage_normalize': False, 'sage_project': False, 'lr': 1.0124509715718135e-05, 'weight_decay': 1.1629453080584893e-07, 'epochs': 169, 'loss': 'mse', 'optimizer': 'adam', 'graph_mode': 'cutoff', 'cutoff': 0.5445525736170941, 'grm_norm': 'none', 'self_loops': False, 'use_snp_selection': True, 'num_snps': 51689}. Best is trial 77 with value: 0.28832115134996583.
[I 2025-12-08 16:45:54,485] Trial 126 finished with value: 0.2826001831343107 and parameters: {'model_type': 'graphsage', 'hidden_dims': '[512, 256]', 'dropout': 0.247164477911709, 'batch_norm': False, 'sage_aggr': 'max', 'sage_normalize': False, 'sage_project': False, 'lr': 1.5169608943681498e-05, 'weight_decay': 1.4343803862575736e-07, 'epochs': 140, 'loss': 'mse', 'optimizer': 'adam', 'graph_mode': 'cutoff', 'cutoff': 0.3965783673126305, 'grm_norm': 'none', 'self_loops': False, 'use_snp_selection': True, 'num_snps': 53801}. Best is trial 77 with value: 0.28832115134996583.
[I 2025-12-08 16:49:03,800] Trial 127 finished with value: 0.2816093571568544 and parameters: {'model_type': 'graphsage', 'hidden_dims': '[512, 128]', 'dropout': 0.21245736634210943, 'batch_norm': False, 'sage_aggr': 'max', 'sage_normalize': False, 'sage_project': False, 'lr': 1.9812203145477812e-05, 'weight_decay': 1.0904654933883387e-07, 'epochs': 159, 'loss': 'mse', 'optimizer': 'adam', 'graph_mode': 'cutoff', 'cutoff': 0.4189507834668514, 'grm_norm': 'none', 'self_loops': False, 'use_snp_selection': True, 'num_snps': 54441}. Best is trial 77 with value: 0.28832115134996583.
[I 2025-12-08 16:52:18,360] Trial 128 finished with value: 0.2817263781967244 and parameters: {'model_type': 'graphsage', 'hidden_dims': '[512, 256]', 'dropout': 0.233234649460093, 'batch_norm': False, 'sage_aggr': 'max', 'sage_normalize': False, 'sage_project': False, 'lr': 1.1691054391357438e-05, 'weight_decay': 1.3113772348313528e-07, 'epochs': 182, 'loss': 'mse', 'optimizer': 'adam', 'graph_mode': 'cutoff', 'cutoff': 0.4815275303507339, 'grm_norm': 'none', 'self_loops': False, 'use_snp_selection': True, 'num_snps': 52659}. Best is trial 77 with value: 0.28832115134996583.
[I 2025-12-08 16:55:13,686] Trial 129 finished with value: 0.2820214656221588 and parameters: {'model_type': 'graphsage', 'hidden_dims': '[512, 256]', 'dropout': 0.25299398085541985, 'batch_norm': False, 'sage_aggr': 'mean', 'sage_normalize': False, 'sage_project': False, 'lr': 1.3570244414759637e-05, 'weight_decay': 1.4528695054369282e-07, 'epochs': 172, 'loss': 'mse', 'optimizer': 'adam', 'graph_mode': 'cutoff', 'cutoff': 0.47529508413521726, 'grm_norm': 'none', 'self_loops': False, 'use_snp_selection': True, 'num_snps': 50439}. Best is trial 77 with value: 0.28832115134996583.
[I 2025-12-08 16:58:33,815] Trial 130 finished with value: 0.2851321326067866 and parameters: {'model_type': 'graphsage', 'hidden_dims': '[512, 256]', 'dropout': 0.18780382939198437, 'batch_norm': False, 'sage_aggr': 'max', 'sage_normalize': False, 'sage_project': False, 'lr': 1.7147670782353457e-05, 'weight_decay': 1.0028860064981788e-07, 'epochs': 197, 'loss': 'mse', 'optimizer': 'adam', 'graph_mode': 'cutoff', 'cutoff': 0.4150898923912523, 'grm_norm': 'none', 'self_loops': False, 'use_snp_selection': True, 'num_snps': 48651}. Best is trial 77 with value: 0.28832115134996583.
[I 2025-12-08 17:01:59,186] Trial 131 finished with value: 0.28532957409676546 and parameters: {'model_type': 'graphsage', 'hidden_dims': '[512, 256]', 'dropout': 0.1831245174072109, 'batch_norm': False, 'sage_aggr': 'max', 'sage_normalize': False, 'sage_project': False, 'lr': 1.858026105518349e-05, 'weight_decay': 1.0489308171790639e-07, 'epochs': 196, 'loss': 'mse', 'optimizer': 'adam', 'graph_mode': 'cutoff', 'cutoff': 0.4124036288058236, 'grm_norm': 'none', 'self_loops': False, 'use_snp_selection': True, 'num_snps': 48892}. Best is trial 77 with value: 0.28832115134996583.
[I 2025-12-08 17:05:27,546] Trial 132 finished with value: 0.27987600307780286 and parameters: {'model_type': 'graphsage', 'hidden_dims': '[512, 256]', 'dropout': 0.15291944959550546, 'batch_norm': False, 'sage_aggr': 'max', 'sage_normalize': False, 'sage_project': False, 'lr': 1.6735210168803034e-05, 'weight_decay': 1.0984648209360877e-07, 'epochs': 197, 'loss': 'mse', 'optimizer': 'adam', 'graph_mode': 'cutoff', 'cutoff': 0.38012860238999635, 'grm_norm': 'none', 'self_loops': False, 'use_snp_selection': True, 'num_snps': 48441}. Best is trial 77 with value: 0.28832115134996583.
[I 2025-12-08 17:08:58,607] Trial 133 finished with value: 0.2842605683076437 and parameters: {'model_type': 'graphsage', 'hidden_dims': '[512, 256]', 'dropout': 0.12207364712566057, 'batch_norm': False, 'sage_aggr': 'max', 'sage_normalize': False, 'sage_project': False, 'lr': 2.503078556101787e-05, 'weight_decay': 1.0240416402064179e-07, 'epochs': 193, 'loss': 'mse', 'optimizer': 'adam', 'graph_mode': 'cutoff', 'cutoff': 0.433294076056019, 'grm_norm': 'none', 'self_loops': False, 'use_snp_selection': True, 'num_snps': 52056}. Best is trial 77 with value: 0.28832115134996583.
[I 2025-12-08 17:11:24,421] Trial 134 finished with value: 0.27850074884148646 and parameters: {'model_type': 'graphsage', 'hidden_dims': '[512, 256]', 'dropout': 0.17339228492863112, 'batch_norm': False, 'sage_aggr': 'max', 'sage_normalize': False, 'sage_project': False, 'lr': 1.1294087978104393e-05, 'weight_decay': 1.5054616997683035e-07, 'epochs': 183, 'loss': 'mse', 'optimizer': 'adam', 'graph_mode': 'cutoff', 'cutoff': 0.5101818125024183, 'grm_norm': 'none', 'self_loops': False, 'use_snp_selection': True, 'num_snps': 45757}. Best is trial 77 with value: 0.28832115134996583.
[I 2025-12-08 17:14:08,154] Trial 135 finished with value: 0.2828681809161546 and parameters: {'model_type': 'graphsage', 'hidden_dims': '[512, 256]', 'dropout': 0.18626448459000783, 'batch_norm': False, 'sage_aggr': 'max', 'sage_normalize': False, 'sage_project': False, 'lr': 1.4322414048358294e-05, 'weight_decay': 1.2906257361641884e-07, 'epochs': 176, 'loss': 'mse', 'optimizer': 'adam', 'graph_mode': 'cutoff', 'cutoff': 0.4570699147182011, 'grm_norm': 'none', 'self_loops': False, 'use_snp_selection': True, 'num_snps': 43774}. Best is trial 77 with value: 0.28832115134996583.
[I 2025-12-08 17:17:58,370] Trial 136 finished with value: 0.28324059116282885 and parameters: {'model_type': 'graphsage', 'hidden_dims': '[512, 256]', 'dropout': 0.2150616303191851, 'batch_norm': False, 'sage_aggr': 'max', 'sage_normalize': False, 'sage_project': False, 'lr': 1.839401300269141e-05, 'weight_decay': 2.1561157526436717e-07, 'epochs': 203, 'loss': 'mse', 'optimizer': 'adam', 'graph_mode': 'cutoff', 'cutoff': 0.4227275245111202, 'grm_norm': 'none', 'self_loops': False, 'use_snp_selection': True, 'num_snps': 54992}. Best is trial 77 with value: 0.28832115134996583.
[I 2025-12-08 17:19:58,120] Trial 137 finished with value: 0.247708691911335 and parameters: {'model_type': 'graphsage', 'hidden_dims': '[512, 256]', 'dropout': 0.1993230095323917, 'batch_norm': False, 'sage_aggr': 'max', 'sage_normalize': True, 'sage_project': False, 'lr': 1.2823857883942247e-05, 'weight_decay': 2.5372545726722023e-07, 'epochs': 154, 'loss': 'mse', 'optimizer': 'adam', 'graph_mode': 'cutoff', 'cutoff': 0.522043284880328, 'grm_norm': 'cosine_then_gcn', 'self_loops': True, 'use_snp_selection': True, 'num_snps': 47513}. Best is trial 77 with value: 0.28832115134996583.
[I 2025-12-08 17:22:16,874] Trial 138 finished with value: 0.24409001522197124 and parameters: {'model_type': 'graphsage', 'hidden_dims': '[512, 256]', 'dropout': 0.2257443975774864, 'batch_norm': True, 'sage_aggr': 'max', 'sage_normalize': False, 'sage_project': False, 'lr': 1.5788279819249096e-05, 'weight_decay': 1.7593989529334648e-07, 'epochs': 167, 'loss': 'mae', 'optimizer': 'adam', 'graph_mode': 'cutoff', 'cutoff': 0.3431802569151319, 'grm_norm': 'none', 'self_loops': False, 'use_snp_selection': False}. Best is trial 77 with value: 0.28832115134996583.
[I 2025-12-08 17:24:52,770] Trial 139 finished with value: 0.2816355311328035 and parameters: {'model_type': 'graphsage', 'hidden_dims': '[256, 128]', 'dropout': 0.16863731642701946, 'batch_norm': False, 'sage_aggr': 'max', 'sage_normalize': False, 'sage_project': False, 'lr': 1.1416916274222618e-05, 'weight_decay': 1.0223182159649153e-07, 'epochs': 191, 'loss': 'mse', 'optimizer': 'adam', 'graph_mode': 'cutoff', 'cutoff': 0.45098142127371205, 'grm_norm': 'none', 'self_loops': False, 'use_snp_selection': True, 'num_snps': 49104}. Best is trial 77 with value: 0.28832115134996583.
[I 2025-12-08 17:27:05,029] Trial 140 finished with value: 0.2817967984100521 and parameters: {'model_type': 'graphsage', 'hidden_dims': '[128, 64]', 'dropout': 0.1426328611480306, 'batch_norm': False, 'sage_aggr': 'max', 'sage_normalize': False, 'sage_project': False, 'lr': 2.2894589929383018e-05, 'weight_decay': 1.2611534915253847e-07, 'epochs': 184, 'loss': 'mse', 'optimizer': 'adam', 'graph_mode': 'cutoff', 'cutoff': 0.4720365696070819, 'grm_norm': 'none', 'self_loops': False, 'use_snp_selection': True, 'num_snps': 50680}. Best is trial 77 with value: 0.28832115134996583.
[I 2025-12-08 17:31:00,260] Trial 141 finished with value: 0.2830610591614458 and parameters: {'model_type': 'graphsage', 'hidden_dims': '[512, 256]', 'dropout': 0.2383048624615404, 'batch_norm': False, 'sage_aggr': 'max', 'sage_normalize': False, 'sage_project': False, 'lr': 2.0634909750144002e-05, 'weight_decay': 1.463780549502577e-07, 'epochs': 197, 'loss': 'mse', 'optimizer': 'adam', 'graph_mode': 'cutoff', 'cutoff': 0.41034785171013993, 'grm_norm': 'none', 'self_loops': False, 'use_snp_selection': True, 'num_snps': 55865}. Best is trial 77 with value: 0.28832115134996583.
[I 2025-12-08 17:34:55,598] Trial 142 finished with value: 0.28505053764553845 and parameters: {'model_type': 'graphsage', 'hidden_dims': '[512, 256]', 'dropout': 0.2595191239273075, 'batch_norm': False, 'sage_aggr': 'max', 'sage_normalize': False, 'sage_project': False, 'lr': 1.0092898692682781e-05, 'weight_decay': 4.085922970377725e-05, 'epochs': 206, 'loss': 'mse', 'optimizer': 'adam', 'graph_mode': 'cutoff', 'cutoff': 0.3989362350201586, 'grm_norm': 'none', 'self_loops': False, 'use_snp_selection': True, 'num_snps': 52952}. Best is trial 77 with value: 0.28832115134996583.
[I 2025-12-08 17:38:57,573] Trial 143 finished with value: 0.28055433717817985 and parameters: {'model_type': 'graphsage', 'hidden_dims': '[512, 256]', 'dropout': 0.2569198633364709, 'batch_norm': False, 'sage_aggr': 'max', 'sage_normalize': False, 'sage_project': False, 'lr': 1.3280301031290901e-05, 'weight_decay': 1.872558371832316e-07, 'epochs': 208, 'loss': 'mse', 'optimizer': 'adam', 'graph_mode': 'cutoff', 'cutoff': 0.39355585267399834, 'grm_norm': 'none', 'self_loops': False, 'use_snp_selection': True, 'num_snps': 53431}. Best is trial 77 with value: 0.28832115134996583.
[I 2025-12-08 17:42:12,543] Trial 144 finished with value: 0.2859405479535259 and parameters: {'model_type': 'graphsage', 'hidden_dims': '[512, 256]', 'dropout': 0.223920637145686, 'batch_norm': False, 'sage_aggr': 'max', 'sage_normalize': False, 'sage_project': False, 'lr': 1.0004981244405444e-05, 'weight_decay': 1.0030700806666611e-07, 'epochs': 178, 'loss': 'mse', 'optimizer': 'adam', 'graph_mode': 'cutoff', 'cutoff': 0.4368361646280049, 'grm_norm': 'none', 'self_loops': False, 'use_snp_selection': True, 'num_snps': 51362}. Best is trial 77 with value: 0.28832115134996583.
[I 2025-12-08 17:43:35,678] Trial 145 finished with value: 0.2127071630767789 and parameters: {'model_type': 'graphsage', 'hidden_dims': '[512, 256]', 'dropout': 0.20265159600040025, 'batch_norm': False, 'sage_aggr': 'max', 'sage_normalize': False, 'sage_project': False, 'lr': 1.4948287289138838e-05, 'weight_decay': 1.0349364325572006e-07, 'epochs': 41, 'loss': 'mse', 'optimizer': 'adam', 'graph_mode': 'cutoff', 'cutoff': 0.4368437370343746, 'grm_norm': 'none', 'self_loops': False, 'use_snp_selection': True, 'num_snps': 52915}. Best is trial 77 with value: 0.28832115134996583.
[I 2025-12-08 17:45:03,666] Trial 146 finished with value: 0.2637607170037838 and parameters: {'model_type': 'graphsage', 'hidden_dims': '[512, 256]', 'dropout': 0.17913408911760453, 'batch_norm': False, 'sage_aggr': 'max', 'sage_normalize': False, 'sage_project': False, 'lr': 1.0608662103331956e-05, 'weight_decay': 1.2445762944662874e-07, 'epochs': 174, 'loss': 'mse', 'optimizer': 'adam', 'graph_mode': 'knn', 'knn_k': 4, 'weighted_edges': True, 'symmetrize_mode': 'mutual', 'self_loops': False, 'use_snp_selection': True, 'num_snps': 28650}. Best is trial 77 with value: 0.28832115134996583.
[I 2025-12-08 17:48:37,358] Trial 147 finished with value: 0.28091040296215375 and parameters: {'model_type': 'graphsage', 'hidden_dims': '[512, 256]', 'dropout': 0.2221624369329533, 'batch_norm': False, 'sage_aggr': 'max', 'sage_normalize': False, 'sage_project': False, 'lr': 1.0042938601011647e-05, 'weight_decay': 2.1598676587273776e-07, 'epochs': 189, 'loss': 'mse', 'optimizer': 'adam', 'graph_mode': 'cutoff', 'cutoff': 0.3653396399563234, 'grm_norm': 'none', 'self_loops': False, 'use_snp_selection': True, 'num_snps': 49563}. Best is trial 77 with value: 0.28832115134996583.
