[I 2025-12-08 23:26:56,872] Trial 73 finished with value: 0.3647160396327214 and parameters: {'model_type': 'graphsage', 'hidden_dims': '[256, 128]', 'dropout': 0.4137497587975256, 'batch_norm': False, 'sage_aggr': 'max', 'sage_normalize': False, 'sage_project': False, 'lr': 1.585970391349974e-05, 'weight_decay': 2.220288518640106e-05, 'epochs': 61, 'loss': 'mse', 'optimizer': 'adam', 'graph_mode': 'cutoff', 'cutoff': 0.855322366535064, 'grm_norm': 'gcn', 'self_loops': False, 'use_snp_selection': False}. Best is trial 72 with value: 0.3732252999044715.
[I 2025-12-08 23:27:19,694] Trial 74 finished with value: 0.34468435982823203 and parameters: {'model_type': 'graphsage', 'hidden_dims': '[256, 128]', 'dropout': 0.41841757920666567, 'batch_norm': False, 'sage_aggr': 'max', 'sage_normalize': False, 'sage_project': False, 'lr': 1.536307868177947e-05, 'weight_decay': 2.1302200837787868e-05, 'epochs': 61, 'loss': 'mse', 'optimizer': 'adam', 'graph_mode': 'cutoff', 'cutoff': 0.8605885595587737, 'grm_norm': 'gcn', 'self_loops': False, 'use_snp_selection': False}. Best is trial 72 with value: 0.3732252999044715.
[I 2025-12-08 23:27:49,494] Trial 75 finished with value: 0.36586485603708324 and parameters: {'model_type': 'graphsage', 'hidden_dims': '[256, 128]', 'dropout': 0.5020753657493168, 'batch_norm': False, 'sage_aggr': 'max', 'sage_normalize': False, 'sage_project': False, 'lr': 1.2657216923836149e-05, 'weight_decay': 5.575900108649714e-06, 'epochs': 94, 'loss': 'mse', 'optimizer': 'adam', 'graph_mode': 'cutoff', 'cutoff': 0.8025493977608036, 'grm_norm': 'gcn', 'self_loops': False, 'use_snp_selection': False}. Best is trial 72 with value: 0.3732252999044715.
[I 2025-12-08 23:28:19,085] Trial 76 finished with value: 0.3626164407952675 and parameters: {'model_type': 'graphsage', 'hidden_dims': '[256, 128]', 'dropout': 0.4960571322056291, 'batch_norm': False, 'sage_aggr': 'max', 'sage_normalize': False, 'sage_project': False, 'lr': 1.225651696601338e-05, 'weight_decay': 4.8707481983885445e-06, 'epochs': 93, 'loss': 'mse', 'optimizer': 'adam', 'graph_mode': 'cutoff', 'cutoff': 0.8032790915550791, 'grm_norm': 'gcn', 'self_loops': False, 'use_snp_selection': False}. Best is trial 72 with value: 0.3732252999044715.
[I 2025-12-08 23:28:44,855] Trial 77 finished with value: 0.3623054768116284 and parameters: {'model_type': 'graphsage', 'hidden_dims': '[256, 128]', 'dropout': 0.49364203578194144, 'batch_norm': False, 'sage_aggr': 'max', 'sage_normalize': False, 'sage_project': False, 'lr': 1.86390617546689e-05, 'weight_decay': 1.2890174925344072e-05, 'epochs': 75, 'loss': 'mse', 'optimizer': 'adam', 'graph_mode': 'cutoff', 'cutoff': 0.7739849354274246, 'grm_norm': 'gcn', 'self_loops': False, 'use_snp_selection': False}. Best is trial 72 with value: 0.3732252999044715.
[I 2025-12-08 23:29:19,543] Trial 78 finished with value: 0.36769093078129406 and parameters: {'model_type': 'graphsage', 'hidden_dims': '[256, 128]', 'dropout': 0.38717481555285316, 'batch_norm': False, 'sage_aggr': 'mean', 'sage_normalize': False, 'sage_project': False, 'lr': 1.0610553734795416e-05, 'weight_decay': 7.379947435007689e-06, 'epochs': 116, 'loss': 'mse', 'optimizer': 'adam', 'graph_mode': 'cutoff', 'cutoff': 0.8120199178953745, 'grm_norm': 'gcn', 'self_loops': False, 'use_snp_selection': False}. Best is trial 72 with value: 0.3732252999044715.
[I 2025-12-08 23:29:53,801] Trial 79 finished with value: -0.009432390917533732 and parameters: {'model_type': 'graphsage', 'hidden_dims': '[256, 128]', 'dropout': 0.39547249076955293, 'batch_norm': False, 'sage_aggr': 'mean', 'sage_normalize': False, 'sage_project': False, 'lr': 0.00786053491102219, 'weight_decay': 6.705910208823001e-06, 'epochs': 114, 'loss': 'mse', 'optimizer': 'adam', 'graph_mode': 'cutoff', 'cutoff': 0.8137419219677717, 'grm_norm': 'gcn', 'self_loops': False, 'use_snp_selection': False}. Best is trial 72 with value: 0.3732252999044715.
[I 2025-12-08 23:30:37,449] Trial 80 finished with value: 0.33851275698350425 and parameters: {'model_type': 'graphsage', 'hidden_dims': '[256, 128]', 'dropout': 0.43547861832180434, 'batch_norm': True, 'sage_aggr': 'mean', 'sage_normalize': True, 'sage_project': False, 'lr': 1.0034807525417776e-05, 'weight_decay': 7.794357141059265e-06, 'epochs': 156, 'loss': 'mse', 'optimizer': 'adam', 'graph_mode': 'cutoff', 'cutoff': 0.8401357801460365, 'grm_norm': 'gcn', 'self_loops': False, 'use_snp_selection': False}. Best is trial 72 with value: 0.3732252999044715.
[I 2025-12-08 23:31:07,666] Trial 81 finished with value: 0.3614287718825994 and parameters: {'model_type': 'graphsage', 'hidden_dims': '[256, 128]', 'dropout': 0.33428631868624026, 'batch_norm': False, 'sage_aggr': 'mean', 'sage_normalize': False, 'sage_project': False, 'lr': 1.3148825617727497e-05, 'weight_decay': 4.080351102791947e-05, 'epochs': 95, 'loss': 'mse', 'optimizer': 'adam', 'graph_mode': 'cutoff', 'cutoff': 0.8512932384017096, 'grm_norm': 'gcn', 'self_loops': False, 'use_snp_selection': False}. Best is trial 72 with value: 0.3732252999044715.
[I 2025-12-08 23:31:35,104] Trial 82 finished with value: 0.3702524165161866 and parameters: {'model_type': 'graphsage', 'hidden_dims': '[256, 128]', 'dropout': 0.3728483406991082, 'batch_norm': False, 'sage_aggr': 'mean', 'sage_normalize': False, 'sage_project': False, 'lr': 1.9986566552124017e-05, 'weight_decay': 5.266805950068875e-06, 'epochs': 82, 'loss': 'mse', 'optimizer': 'adam', 'graph_mode': 'cutoff', 'cutoff': 0.8862016052354378, 'grm_norm': 'gcn', 'self_loops': False, 'use_snp_selection': False}. Best is trial 72 with value: 0.3732252999044715.
[I 2025-12-08 23:32:08,076] Trial 83 finished with value: 0.3641799693617376 and parameters: {'model_type': 'graphsage', 'hidden_dims': '[256, 128]', 'dropout': 0.4627449170799275, 'batch_norm': False, 'sage_aggr': 'mean', 'sage_normalize': False, 'sage_project': False, 'lr': 2.008771632321268e-05, 'weight_decay': 5.21188144747596e-06, 'epochs': 108, 'loss': 'mse', 'optimizer': 'adam', 'graph_mode': 'cutoff', 'cutoff': 0.8841431038867305, 'grm_norm': 'gcn', 'self_loops': False, 'use_snp_selection': False}. Best is trial 72 with value: 0.3732252999044715.
[I 2025-12-08 23:32:33,840] Trial 84 finished with value: 0.35778109878091263 and parameters: {'model_type': 'graphsage', 'hidden_dims': '[128, 64]', 'dropout': 0.5712324198796748, 'batch_norm': False, 'sage_aggr': 'mean', 'sage_normalize': False, 'sage_project': False, 'lr': 1.0049061473717831e-05, 'weight_decay': 1.5897210336149875e-05, 'epochs': 127, 'loss': 'mse', 'optimizer': 'adam', 'graph_mode': 'cutoff', 'cutoff': 0.8032741568948161, 'grm_norm': 'gcn', 'self_loops': False, 'use_snp_selection': False}. Best is trial 72 with value: 0.3732252999044715.
[I 2025-12-08 23:33:40,826] Trial 85 finished with value: 0.3602895226913 and parameters: {'model_type': 'graphsage', 'hidden_dims': '[512, 128]', 'dropout': 0.3103135075095724, 'batch_norm': False, 'sage_aggr': 'mean', 'sage_normalize': False, 'sage_project': False, 'lr': 1.6642609408042866e-05, 'weight_decay': 3.4588851902470557e-06, 'epochs': 143, 'loss': 'mse', 'optimizer': 'adam', 'graph_mode': 'cutoff', 'cutoff': 0.7737898656932738, 'grm_norm': 'gcn', 'self_loops': False, 'use_snp_selection': False}. Best is trial 72 with value: 0.3732252999044715.
[I 2025-12-08 23:34:16,152] Trial 86 finished with value: 0.03845705684479399 and parameters: {'model_type': 'graphsage', 'hidden_dims': '[256, 128]', 'dropout': 0.3919700459220073, 'batch_norm': False, 'sage_aggr': 'mean', 'sage_normalize': False, 'sage_project': False, 'lr': 0.0020295660672218258, 'weight_decay': 8.845030515913558e-06, 'epochs': 119, 'loss': 'mse', 'optimizer': 'adam', 'graph_mode': 'cutoff', 'cutoff': 0.8200299362270874, 'grm_norm': 'gcn', 'self_loops': False, 'use_snp_selection': False}. Best is trial 72 with value: 0.3732252999044715.
[I 2025-12-08 23:34:54,659] Trial 87 finished with value: 0.338624497123352 and parameters: {'model_type': 'graphsage', 'hidden_dims': '[256, 128]', 'dropout': 0.3248943631460572, 'batch_norm': False, 'sage_aggr': 'mean', 'sage_normalize': False, 'sage_project': False, 'lr': 1.386654001144606e-05, 'weight_decay': 5.739274368830524e-06, 'epochs': 98, 'loss': 'mse', 'optimizer': 'adam', 'graph_mode': 'knn', 'knn_k': 5, 'weighted_edges': False, 'symmetrize_mode': 'mutual', 'self_loops': False, 'use_snp_selection': False}. Best is trial 72 with value: 0.3732252999044715.
[I 2025-12-08 23:35:22,107] Trial 88 finished with value: 0.3594106736827782 and parameters: {'model_type': 'graphsage', 'hidden_dims': '[256, 128]', 'dropout': 0.29508734605796283, 'batch_norm': False, 'sage_aggr': 'mean', 'sage_normalize': False, 'sage_project': False, 'lr': 3.148596029997078e-05, 'weight_decay': 1.5353464430789688e-05, 'epochs': 82, 'loss': 'mse', 'optimizer': 'adam', 'graph_mode': 'cutoff', 'cutoff': 0.8877191929853638, 'grm_norm': 'gcn', 'self_loops': False, 'use_snp_selection': False}. Best is trial 72 with value: 0.3732252999044715.
[I 2025-12-08 23:35:47,463] Trial 89 finished with value: 0.3550499184540711 and parameters: {'model_type': 'graphsage', 'hidden_dims': '[256, 128]', 'dropout': 0.3679354994088623, 'batch_norm': False, 'sage_aggr': 'mean', 'sage_normalize': False, 'sage_project': False, 'lr': 2.1191991169210012e-05, 'weight_decay': 7.31741276575486e-06, 'epochs': 72, 'loss': 'mse', 'optimizer': 'adam', 'graph_mode': 'cutoff', 'cutoff': 0.7915010998911652, 'grm_norm': 'none', 'self_loops': False, 'use_snp_selection': False}. Best is trial 72 with value: 0.3732252999044715.
[I 2025-12-08 23:36:20,941] Trial 90 finished with value: 0.37863403836464726 and parameters: {'model_type': 'graphsage', 'hidden_dims': '[256, 128]', 'dropout': 0.4285684284277265, 'batch_norm': False, 'sage_aggr': 'mean', 'sage_normalize': False, 'sage_project': False, 'lr': 1.732046578268075e-05, 'weight_decay': 1.1126247953760343e-05, 'epochs': 110, 'loss': 'mse', 'optimizer': 'adam', 'graph_mode': 'cutoff', 'cutoff': 0.7620086933073025, 'grm_norm': 'gcn', 'self_loops': False, 'use_snp_selection': False}. Best is trial 90 with value: 0.37863403836464726.
[I 2025-12-08 23:36:55,239] Trial 91 finished with value: 0.3670170859502611 and parameters: {'model_type': 'graphsage', 'hidden_dims': '[256, 128]', 'dropout': 0.4765523788549345, 'batch_norm': False, 'sage_aggr': 'mean', 'sage_normalize': False, 'sage_project': False, 'lr': 1.7172674779346237e-05, 'weight_decay': 1.931477354894042e-06, 'epochs': 114, 'loss': 'mse', 'optimizer': 'adam', 'graph_mode': 'cutoff', 'cutoff': 0.8379272433212177, 'grm_norm': 'gcn', 'self_loops': False, 'use_snp_selection': False}. Best is trial 90 with value: 0.37863403836464726.
[I 2025-12-08 23:37:29,318] Trial 92 finished with value: 0.36594997091380677 and parameters: {'model_type': 'graphsage', 'hidden_dims': '[256, 128]', 'dropout': 0.4702166478105332, 'batch_norm': False, 'sage_aggr': 'mean', 'sage_normalize': False, 'sage_project': False, 'lr': 1.7271290471763295e-05, 'weight_decay': 1.2031841735853487e-05, 'epochs': 113, 'loss': 'mse', 'optimizer': 'adam', 'graph_mode': 'cutoff', 'cutoff': 0.8326533238181344, 'grm_norm': 'gcn', 'self_loops': False, 'use_snp_selection': False}. Best is trial 90 with value: 0.37863403836464726.
[I 2025-12-08 23:38:02,572] Trial 93 finished with value: 0.3656597259648474 and parameters: {'model_type': 'graphsage', 'hidden_dims': '[256, 128]', 'dropout': 0.425192290193254, 'batch_norm': False, 'sage_aggr': 'mean', 'sage_normalize': False, 'sage_project': False, 'lr': 2.59781710824733e-05, 'weight_decay': 2.0731814839452407e-06, 'epochs': 109, 'loss': 'mse', 'optimizer': 'adam', 'graph_mode': 'cutoff', 'cutoff': 0.7570790152477501, 'grm_norm': 'gcn', 'self_loops': False, 'use_snp_selection': False}. Best is trial 90 with value: 0.37863403836464726.
[I 2025-12-08 23:38:37,705] Trial 94 finished with value: 0.3683717491105095 and parameters: {'model_type': 'graphsage', 'hidden_dims': '[256, 128]', 'dropout': 0.46192262178393084, 'batch_norm': False, 'sage_aggr': 'mean', 'sage_normalize': False, 'sage_project': False, 'lr': 1.7312593220853777e-05, 'weight_decay': 1.7771280956275338e-05, 'epochs': 118, 'loss': 'mse', 'optimizer': 'adam', 'graph_mode': 'cutoff', 'cutoff': 0.87376023105892, 'grm_norm': 'gcn', 'self_loops': False, 'use_snp_selection': False}. Best is trial 90 with value: 0.37863403836464726.
[I 2025-12-08 23:39:40,193] Trial 95 finished with value: 0.36562905412770536 and parameters: {'model_type': 'graphsage', 'hidden_dims': '[512, 256]', 'dropout': 0.4508306979871872, 'batch_norm': False, 'sage_aggr': 'mean', 'sage_normalize': False, 'sage_project': False, 'lr': 2.181575894062339e-05, 'weight_decay': 1.8749137211105084e-05, 'epochs': 131, 'loss': 'mse', 'optimizer': 'adam', 'graph_mode': 'cutoff', 'cutoff': 0.8757115676366163, 'grm_norm': 'gcn', 'self_loops': False, 'use_snp_selection': False}. Best is trial 90 with value: 0.37863403836464726.
[I 2025-12-08 23:40:12,121] Trial 96 finished with value: 0.3665499556569891 and parameters: {'model_type': 'graphsage', 'hidden_dims': '[256, 128]', 'dropout': 0.4807032413163834, 'batch_norm': False, 'sage_aggr': 'mean', 'sage_normalize': False, 'sage_project': False, 'lr': 1.5999161652215716e-05, 'weight_decay': 2.515772501282415e-05, 'epochs': 103, 'loss': 'mse', 'optimizer': 'adam', 'graph_mode': 'cutoff', 'cutoff': 0.8961534234802058, 'grm_norm': 'gcn', 'self_loops': False, 'use_snp_selection': False}. Best is trial 90 with value: 0.37863403836464726.
[I 2025-12-08 23:40:48,456] Trial 97 finished with value: 0.33395419898969253 and parameters: {'model_type': 'graphsage', 'hidden_dims': '[256, 128]', 'dropout': 0.5260940653186015, 'batch_norm': False, 'sage_aggr': 'mean', 'sage_normalize': True, 'sage_project': False, 'lr': 2.887524352505828e-05, 'weight_decay': 3.725298987197894e-05, 'epochs': 117, 'loss': 'mse', 'optimizer': 'adam', 'graph_mode': 'cutoff', 'cutoff': 0.8186445960082033, 'grm_norm': 'cosine_then_gcn', 'self_loops': False, 'use_snp_selection': False}. Best is trial 90 with value: 0.37863403836464726.
[I 2025-12-08 23:41:15,610] Trial 98 finished with value: 0.3357406996805975 and parameters: {'model_type': 'graphsage', 'hidden_dims': '[128, 64]', 'dropout': 0.4067533173733103, 'batch_norm': True, 'sage_aggr': 'mean', 'sage_normalize': False, 'sage_project': False, 'lr': 1.873711191089107e-05, 'weight_decay': 3.862927429009189e-06, 'epochs': 137, 'loss': 'mse', 'optimizer': 'adam', 'graph_mode': 'cutoff', 'cutoff': 0.8647267957543282, 'grm_norm': 'gcn', 'self_loops': False, 'use_snp_selection': False}. Best is trial 90 with value: 0.37863403836464726.
[I 2025-12-08 23:41:36,916] Trial 99 finished with value: 0.32414061404709943 and parameters: {'model_type': 'graphsage', 'hidden_dims': '[256, 128]', 'dropout': 0.38376423717210784, 'batch_norm': False, 'sage_aggr': 'mean', 'sage_normalize': False, 'sage_project': False, 'lr': 2.3793797570160836e-05, 'weight_decay': 1.4761698224482672e-05, 'epochs': 53, 'loss': 'mse', 'optimizer': 'adam', 'graph_mode': 'cutoff', 'cutoff': 0.7787159377323156, 'grm_norm': 'gcn', 'self_loops': False, 'use_snp_selection': False}. Best is trial 90 with value: 0.37863403836464726.
[I 2025-12-08 23:43:21,832] Trial 100 finished with value: 0.36217368719409715 and parameters: {'model_type': 'graphsage', 'hidden_dims': '[256, 128]', 'dropout': 0.42793339522498247, 'batch_norm': False, 'sage_aggr': 'mean', 'sage_normalize': False, 'sage_project': False, 'lr': 3.5318106617325506e-05, 'weight_decay': 7.935275786428047e-06, 'epochs': 148, 'loss': 'mse', 'optimizer': 'adam', 'graph_mode': 'knn', 'knn_k': 10, 'weighted_edges': True, 'symmetrize_mode': 'union', 'self_loops': False, 'use_snp_selection': False}. Best is trial 90 with value: 0.37863403836464726.
[I 2025-12-08 23:43:53,992] Trial 101 finished with value: 0.36314391308385996 and parameters: {'model_type': 'graphsage', 'hidden_dims': '[256, 128]', 'dropout': 0.45542018263585643, 'batch_norm': False, 'sage_aggr': 'mean', 'sage_normalize': False, 'sage_project': False, 'lr': 1.4838931826068846e-05, 'weight_decay': 2.4686103323980614e-05, 'epochs': 104, 'loss': 'mse', 'optimizer': 'adam', 'graph_mode': 'cutoff', 'cutoff': 0.8905079692970737, 'grm_norm': 'gcn', 'self_loops': False, 'use_snp_selection': False}. Best is trial 90 with value: 0.37863403836464726.
[I 2025-12-08 23:44:22,959] Trial 102 finished with value: 0.3649054868147437 and parameters: {'model_type': 'graphsage', 'hidden_dims': '[256, 128]', 'dropout': 0.4655882116673108, 'batch_norm': False, 'sage_aggr': 'mean', 'sage_normalize': False, 'sage_project': False, 'lr': 1.6264710921707962e-05, 'weight_decay': 1.725930570972487e-05, 'epochs': 89, 'loss': 'mse', 'optimizer': 'adam', 'graph_mode': 'cutoff', 'cutoff': 0.8755161351028167, 'grm_norm': 'gcn', 'self_loops': False, 'use_snp_selection': False}. Best is trial 90 with value: 0.37863403836464726.
[I 2025-12-08 23:44:49,783] Trial 103 finished with value: 0.3596070961733432 and parameters: {'model_type': 'graphsage', 'hidden_dims': '[256, 128]', 'dropout': 0.4766013627337631, 'batch_norm': False, 'sage_aggr': 'mean', 'sage_normalize': False, 'sage_project': False, 'lr': 1.4398269983834172e-05, 'weight_decay': 3.0448718366788832e-05, 'epochs': 79, 'loss': 'mse', 'optimizer': 'adam', 'graph_mode': 'cutoff', 'cutoff': 0.8991961181952817, 'grm_norm': 'gcn', 'self_loops': False, 'use_snp_selection': False}. Best is trial 90 with value: 0.37863403836464726.
[I 2025-12-08 23:45:25,129] Trial 104 finished with value: 0.3650073832956646 and parameters: {'model_type': 'graphsage', 'hidden_dims': '[256, 128]', 'dropout': 0.4791268149323435, 'batch_norm': False, 'sage_aggr': 'mean', 'sage_normalize': False, 'sage_project': False, 'lr': 1.1445262800279942e-05, 'weight_decay': 1.1045607662800974e-05, 'epochs': 119, 'loss': 'mse', 'optimizer': 'adam', 'graph_mode': 'cutoff', 'cutoff': 0.8389950769685477, 'grm_norm': 'gcn', 'self_loops': False, 'use_snp_selection': False}. Best is trial 90 with value: 0.37863403836464726.
[I 2025-12-08 23:46:02,874] Trial 105 finished with value: 0.36819794349253465 and parameters: {'model_type': 'graphsage', 'hidden_dims': '[512, 128]', 'dropout': 0.4460752909755795, 'batch_norm': False, 'sage_aggr': 'mean', 'sage_normalize': False, 'sage_project': False, 'lr': 1.9737865621444625e-05, 'weight_decay': 4.716083810030453e-05, 'epochs': 67, 'loss': 'mse', 'optimizer': 'adam', 'graph_mode': 'cutoff', 'cutoff': 0.7530241103103122, 'grm_norm': 'gcn', 'self_loops': False, 'use_snp_selection': False}. Best is trial 90 with value: 0.37863403836464726.
[I 2025-12-08 23:46:41,385] Trial 106 finished with value: 0.37566243350460715 and parameters: {'model_type': 'graphsage', 'hidden_dims': '[512, 128]', 'dropout': 0.4050604194454164, 'batch_norm': False, 'sage_aggr': 'mean', 'sage_normalize': False, 'sage_project': False, 'lr': 2.1229652330963274e-05, 'weight_decay': 5.035136935843299e-05, 'epochs': 69, 'loss': 'mse', 'optimizer': 'adam', 'graph_mode': 'cutoff', 'cutoff': 0.7582068638489279, 'grm_norm': 'gcn', 'self_loops': False, 'use_snp_selection': False}. Best is trial 90 with value: 0.37863403836464726.
[I 2025-12-08 23:47:19,670] Trial 107 finished with value: 0.3621740602500562 and parameters: {'model_type': 'graphsage', 'hidden_dims': '[512, 128]', 'dropout': 0.40249674953025005, 'batch_norm': False, 'sage_aggr': 'mean', 'sage_normalize': False, 'sage_project': False, 'lr': 2.0503617813620406e-05, 'weight_decay': 4.245007535519407e-05, 'epochs': 68, 'loss': 'mse', 'optimizer': 'adam', 'graph_mode': 'cutoff', 'cutoff': 0.7409904358758579, 'grm_norm': 'gcn', 'self_loops': False, 'use_snp_selection': False}. Best is trial 90 with value: 0.37863403836464726.
[I 2025-12-08 23:47:51,276] Trial 108 finished with value: 0.3492086132290376 and parameters: {'model_type': 'graphsage', 'hidden_dims': '[512, 128]', 'dropout': 0.4373937029377727, 'batch_norm': False, 'sage_aggr': 'mean', 'sage_normalize': False, 'sage_project': False, 'lr': 2.529648435251155e-05, 'weight_decay': 5.135016578429395e-05, 'epochs': 51, 'loss': 'mse', 'optimizer': 'adam', 'graph_mode': 'cutoff', 'cutoff': 0.8102912705054188, 'grm_norm': 'gcn', 'self_loops': False, 'use_snp_selection': False}. Best is trial 90 with value: 0.37863403836464726.
[I 2025-12-08 23:48:18,603] Trial 109 finished with value: 0.1873843696218507 and parameters: {'model_type': 'graphsage', 'hidden_dims': '[512, 128]', 'dropout': 0.4163334093968832, 'batch_norm': False, 'sage_aggr': 'mean', 'sage_normalize': False, 'sage_project': False, 'lr': 3.124079222565476e-05, 'weight_decay': 0.0001412221437729371, 'epochs': 40, 'loss': 'mse', 'optimizer': 'adam', 'graph_mode': 'cutoff', 'cutoff': 0.7859115549339392, 'grm_norm': 'none', 'self_loops': False, 'use_snp_selection': False}. Best is trial 90 with value: 0.37863403836464726.
[I 2025-12-08 23:48:55,201] Trial 110 finished with value: 0.3547834438512704 and parameters: {'model_type': 'graphsage', 'hidden_dims': '[512, 128]', 'dropout': 0.362567127653343, 'batch_norm': False, 'sage_aggr': 'mean', 'sage_normalize': False, 'sage_project': False, 'lr': 1.816819345918436e-05, 'weight_decay': 8.662004299865925e-05, 'epochs': 64, 'loss': 'mse', 'optimizer': 'adam', 'graph_mode': 'cutoff', 'cutoff': 0.7125186756445885, 'grm_norm': 'gcn', 'self_loops': False, 'use_snp_selection': False}. Best is trial 90 with value: 0.37863403836464726.
