[I 2025-12-10 10:28:28,292] Trial 139 finished with value: 0.29204645062827755 and parameters: {'model_type': 'graphsage', 'hidden_dims': '[512, 256]', 'dropout': 0.319366482151452, 'batch_norm': False, 'sage_aggr': 'max', 'sage_normalize': False, 'sage_project': False, 'lr': 4.96277408245892e-05, 'weight_decay': 1.4766896999917444e-05, 'epochs': 168, 'loss': 'mse', 'optimizer': 'adam', 'graph_mode': 'cutoff', 'cutoff': 0.38076249563280357, 'grm_norm': 'gcn', 'self_loops': False, 'use_snp_selection': True, 'num_snps': 37518}. Best is trial 121 with value: 0.305397681020213.
[I 2025-12-10 10:30:22,081] Trial 140 finished with value: 0.2738186494514 and parameters: {'model_type': 'graphsage', 'hidden_dims': '[256, 128, 64]', 'dropout': 0.30724229112916146, 'batch_norm': False, 'sage_aggr': 'max', 'sage_normalize': False, 'sage_project': False, 'lr': 0.00011781429006226272, 'weight_decay': 1.0442249985113438e-05, 'epochs': 190, 'loss': 'mse', 'optimizer': 'adam', 'graph_mode': 'cutoff', 'cutoff': 0.34038499611852263, 'grm_norm': 'gcn', 'self_loops': False, 'use_snp_selection': True, 'num_snps': 32140}. Best is trial 121 with value: 0.305397681020213.
[I 2025-12-10 10:32:46,355] Trial 141 finished with value: 0.2977035460845386 and parameters: {'model_type': 'graphsage', 'hidden_dims': '[512, 256]', 'dropout': 0.25769740676553016, 'batch_norm': False, 'sage_aggr': 'max', 'sage_normalize': False, 'sage_project': False, 'lr': 5.75443601147814e-05, 'weight_decay': 8.527343633764611e-06, 'epochs': 176, 'loss': 'mse', 'optimizer': 'adam', 'graph_mode': 'cutoff', 'cutoff': 0.40138461206488557, 'grm_norm': 'gcn', 'self_loops': False, 'use_snp_selection': True, 'num_snps': 38556}. Best is trial 121 with value: 0.305397681020213.
[I 2025-12-10 10:35:30,375] Trial 142 finished with value: 0.2813399091850709 and parameters: {'model_type': 'graphsage', 'hidden_dims': '[512, 256]', 'dropout': 0.2816469285233867, 'batch_norm': False, 'sage_aggr': 'max', 'sage_normalize': False, 'sage_project': False, 'lr': 3.6992188873234185e-05, 'weight_decay': 1.736229268796797e-05, 'epochs': 180, 'loss': 'mse', 'optimizer': 'adam', 'graph_mode': 'cutoff', 'cutoff': 0.3235247797172826, 'grm_norm': 'gcn', 'self_loops': False, 'use_snp_selection': True, 'num_snps': 35978}. Best is trial 121 with value: 0.305397681020213.
[I 2025-12-10 10:37:25,136] Trial 143 finished with value: 0.2973019446175736 and parameters: {'model_type': 'graphsage', 'hidden_dims': '[512, 256]', 'dropout': 0.2918839898756631, 'batch_norm': False, 'sage_aggr': 'max', 'sage_normalize': False, 'sage_project': False, 'lr': 4.979126006783085e-05, 'weight_decay': 1.0668072524523256e-05, 'epochs': 162, 'loss': 'mse', 'optimizer': 'adam', 'graph_mode': 'cutoff', 'cutoff': 0.4133053524229174, 'grm_norm': 'gcn', 'self_loops': False, 'use_snp_selection': True, 'num_snps': 33080}. Best is trial 121 with value: 0.305397681020213.
[I 2025-12-10 10:40:49,397] Trial 144 finished with value: 0.29134653186970816 and parameters: {'model_type': 'graphsage', 'hidden_dims': '[512, 256]', 'dropout': 0.33373107397265267, 'batch_norm': False, 'sage_aggr': 'max', 'sage_normalize': False, 'sage_project': False, 'lr': 3.128836689560781e-05, 'weight_decay': 0.00025327206144460843, 'epochs': 269, 'loss': 'mse', 'optimizer': 'adam', 'graph_mode': 'cutoff', 'cutoff': 0.3580186167246491, 'grm_norm': 'gcn', 'self_loops': False, 'use_snp_selection': True, 'num_snps': 35332}. Best is trial 121 with value: 0.305397681020213.
[I 2025-12-10 10:42:50,981] Trial 145 finished with value: 0.2904171536383481 and parameters: {'model_type': 'graphsage', 'hidden_dims': '[512, 256]', 'dropout': 0.26731368207076406, 'batch_norm': False, 'sage_aggr': 'max', 'sage_normalize': False, 'sage_project': False, 'lr': 6.965870155990215e-05, 'weight_decay': 7.303789241180398e-06, 'epochs': 172, 'loss': 'mse', 'optimizer': 'adam', 'graph_mode': 'cutoff', 'cutoff': 0.3847007390472228, 'grm_norm': 'none', 'self_loops': False, 'use_snp_selection': True, 'num_snps': 31457}. Best is trial 121 with value: 0.305397681020213.
[I 2025-12-10 10:45:14,171] Trial 146 finished with value: 0.2961290055632037 and parameters: {'model_type': 'graphsage', 'hidden_dims': '[512, 256]', 'dropout': 0.3527881136992538, 'batch_norm': False, 'sage_aggr': 'max', 'sage_normalize': False, 'sage_project': False, 'lr': 2.5112345136059617e-05, 'weight_decay': 0.000939009599691692, 'epochs': 195, 'loss': 'mse', 'optimizer': 'adam', 'graph_mode': 'cutoff', 'cutoff': 0.3710352992559079, 'grm_norm': 'gcn', 'self_loops': False, 'use_snp_selection': True, 'num_snps': 34447}. Best is trial 121 with value: 0.305397681020213.
[I 2025-12-10 10:46:18,615] Trial 147 finished with value: 0.2762750492271508 and parameters: {'model_type': 'graphsage', 'hidden_dims': '[512, 256]', 'dropout': 0.30285997042349777, 'batch_norm': False, 'sage_aggr': 'max', 'sage_normalize': False, 'sage_project': False, 'lr': 3.555327922308631e-05, 'weight_decay': 1.464455540401015e-05, 'epochs': 70, 'loss': 'mse', 'optimizer': 'adam', 'graph_mode': 'cutoff', 'cutoff': 0.39703628686144166, 'grm_norm': 'gcn', 'self_loops': False, 'use_snp_selection': True, 'num_snps': 30422}. Best is trial 121 with value: 0.305397681020213.
[I 2025-12-10 10:48:25,001] Trial 148 finished with value: 0.08067563920700221 and parameters: {'model_type': 'graphsage', 'hidden_dims': '[512, 64]', 'dropout': 0.39001041779920564, 'batch_norm': False, 'sage_aggr': 'mean', 'sage_normalize': False, 'sage_project': False, 'lr': 0.0006845230352082544, 'weight_decay': 1.1930594669209516e-05, 'epochs': 177, 'loss': 'mse', 'optimizer': 'adam', 'graph_mode': 'cutoff', 'cutoff': 0.4536863308275298, 'grm_norm': 'gcn', 'self_loops': False, 'use_snp_selection': True, 'num_snps': 36697}. Best is trial 121 with value: 0.305397681020213.
[I 2025-12-10 10:50:21,502] Trial 149 finished with value: 0.29239898335643116 and parameters: {'model_type': 'graphsage', 'hidden_dims': '[512, 128]', 'dropout': 0.2787262876293377, 'batch_norm': False, 'sage_aggr': 'max', 'sage_normalize': False, 'sage_project': False, 'lr': 4.290303229544551e-05, 'weight_decay': 0.00047579949955608384, 'epochs': 165, 'loss': 'mse', 'optimizer': 'adam', 'graph_mode': 'cutoff', 'cutoff': 0.41681459343929805, 'grm_norm': 'gcn', 'self_loops': False, 'use_snp_selection': True, 'num_snps': 32611}. Best is trial 121 with value: 0.305397681020213.
