[I 2025-12-10 00:49:02,920] Trial 143 finished with value: 0.29643493185375397 and parameters: {'model_type': 'graphsage', 'hidden_dims': '[512, 128]', 'dropout': 0.1111174838618497, 'batch_norm': False, 'sage_aggr': 'mean', 'sage_normalize': False, 'sage_project': False, 'lr': 1.185960853576389e-05, 'weight_decay': 1.7757711051591545e-05, 'epochs': 61, 'loss': 'mse', 'optimizer': 'adam', 'graph_mode': 'cutoff', 'cutoff': 0.567167839149182, 'grm_norm': 'gcn', 'self_loops': False, 'use_snp_selection': True, 'num_snps': 34533}. Best is trial 109 with value: 0.30135334402070546.
[I 2025-12-10 00:49:56,764] Trial 144 finished with value: 0.29984787620020065 and parameters: {'model_type': 'graphsage', 'hidden_dims': '[512, 128]', 'dropout': 0.11948516410559026, 'batch_norm': False, 'sage_aggr': 'mean', 'sage_normalize': False, 'sage_project': False, 'lr': 1.4432348050637598e-05, 'weight_decay': 1.1518345304243502e-05, 'epochs': 84, 'loss': 'mse', 'optimizer': 'adam', 'graph_mode': 'cutoff', 'cutoff': 0.5914969630275753, 'grm_norm': 'cosine_then_gcn', 'self_loops': False, 'use_snp_selection': True, 'num_snps': 29506}. Best is trial 109 with value: 0.30135334402070546.
[I 2025-12-10 00:50:49,468] Trial 145 finished with value: 0.29447967831201904 and parameters: {'model_type': 'graphsage', 'hidden_dims': '[512, 128]', 'dropout': 0.11895563504708667, 'batch_norm': False, 'sage_aggr': 'mean', 'sage_normalize': False, 'sage_project': False, 'lr': 1.4388291438878396e-05, 'weight_decay': 0.000147358163639392, 'epochs': 85, 'loss': 'mse', 'optimizer': 'adam', 'graph_mode': 'cutoff', 'cutoff': 0.593393102033302, 'grm_norm': 'cosine_then_gcn', 'self_loops': False, 'use_snp_selection': True, 'num_snps': 28699}. Best is trial 109 with value: 0.30135334402070546.
[I 2025-12-10 00:51:46,888] Trial 146 finished with value: 0.29621246344932317 and parameters: {'model_type': 'graphsage', 'hidden_dims': '[512, 128]', 'dropout': 0.13049317442588249, 'batch_norm': False, 'sage_aggr': 'mean', 'sage_normalize': False, 'sage_project': False, 'lr': 1.2340965704257247e-05, 'weight_decay': 1.036004180738245e-05, 'epochs': 94, 'loss': 'mse', 'optimizer': 'adam', 'graph_mode': 'cutoff', 'cutoff': 0.5848456979265945, 'grm_norm': 'cosine_then_gcn', 'self_loops': False, 'use_snp_selection': True, 'num_snps': 30857}. Best is trial 109 with value: 0.30135334402070546.
[I 2025-12-10 00:53:11,222] Trial 147 finished with value: 0.2895854577439928 and parameters: {'model_type': 'graphsage', 'hidden_dims': '[512, 128]', 'dropout': 0.14105901966184708, 'batch_norm': False, 'sage_aggr': 'mean', 'sage_normalize': False, 'sage_project': False, 'lr': 1.6668836310613813e-05, 'weight_decay': 8.208502776420533e-06, 'epochs': 126, 'loss': 'mse', 'optimizer': 'adam', 'graph_mode': 'cutoff', 'cutoff': 0.5560821437120637, 'grm_norm': 'cosine_then_gcn', 'self_loops': False, 'use_snp_selection': True, 'num_snps': 41035}. Best is trial 109 with value: 0.30135334402070546.
[I 2025-12-10 00:54:02,092] Trial 148 finished with value: 0.2963740298294938 and parameters: {'model_type': 'graphsage', 'hidden_dims': '[512, 128]', 'dropout': 0.11087389438620475, 'batch_norm': False, 'sage_aggr': 'mean', 'sage_normalize': False, 'sage_project': False, 'lr': 1.4504569257169784e-05, 'weight_decay': 7.596692697594582e-05, 'epochs': 73, 'loss': 'mse', 'optimizer': 'adam', 'graph_mode': 'cutoff', 'cutoff': 0.6149013991356044, 'grm_norm': 'cosine_then_gcn', 'self_loops': False, 'use_snp_selection': True, 'num_snps': 29937}. Best is trial 109 with value: 0.30135334402070546.
[I 2025-12-10 00:55:20,595] Trial 149 finished with value: 0.2979553945749194 and parameters: {'model_type': 'graphsage', 'hidden_dims': '[512, 128]', 'dropout': 0.13694736525085438, 'batch_norm': False, 'sage_aggr': 'mean', 'sage_normalize': False, 'sage_project': False, 'lr': 1.1303505232942829e-05, 'weight_decay': 1.1126552839477701e-05, 'epochs': 87, 'loss': 'mse', 'optimizer': 'adam', 'graph_mode': 'cutoff', 'cutoff': 0.593463987248706, 'grm_norm': 'cosine_then_gcn', 'self_loops': False, 'use_snp_selection': True, 'num_snps': 48282}. Best is trial 109 with value: 0.30135334402070546.
[I 2025-12-10 00:57:00,072] Trial 0 finished with value: 0.2531192000298195 and parameters: {'model_type': 'graphsage', 'hidden_dims': '[128, 64]', 'dropout': 0.199031432379812, 'batch_norm': True, 'sage_aggr': 'max', 'sage_normalize': True, 'sage_project': False, 'lr': 0.00034401453323286885, 'weight_decay': 0.00017802616915745114, 'epochs': 230, 'loss': 'mse', 'optimizer': 'adam', 'graph_mode': 'knn', 'knn_k': 6, 'weighted_edges': True, 'symmetrize_mode': 'mutual', 'self_loops': True, 'use_snp_selection': False}. Best is trial 0 with value: 0.2531192000298195.
[I 2025-12-10 00:59:05,021] Trial 1 finished with value: 0.2872468474552016 and parameters: {'model_type': 'graphsage', 'hidden_dims': '[512, 128]', 'dropout': 0.2503500283181017, 'batch_norm': False, 'sage_aggr': 'max', 'sage_normalize': False, 'sage_project': False, 'lr': 3.952233718592099e-05, 'weight_decay': 0.00026754769258252603, 'epochs': 149, 'loss': 'mse', 'optimizer': 'adam', 'graph_mode': 'knn', 'knn_k': 2, 'weighted_edges': False, 'symmetrize_mode': 'mutual', 'self_loops': True, 'use_snp_selection': True, 'num_snps': 49915}. Best is trial 1 with value: 0.2872468474552016.
[I 2025-12-10 01:00:42,347] Trial 2 finished with value: 0.286324522217053 and parameters: {'model_type': 'graphsage', 'hidden_dims': '[512, 256]', 'dropout': 0.2785908793172681, 'batch_norm': False, 'sage_aggr': 'max', 'sage_normalize': False, 'sage_project': False, 'lr': 8.806039223165805e-05, 'weight_decay': 3.5153176302760294e-05, 'epochs': 147, 'loss': 'mae', 'optimizer': 'adam', 'graph_mode': 'cutoff', 'cutoff': 0.4922564006874869, 'grm_norm': 'gcn', 'self_loops': False, 'use_snp_selection': True, 'num_snps': 34340}. Best is trial 1 with value: 0.2872468474552016.
[I 2025-12-10 01:02:18,802] Trial 3 finished with value: 0.23717791622609846 and parameters: {'model_type': 'graphsage', 'hidden_dims': '[256, 128, 64]', 'dropout': 0.3475243154412272, 'batch_norm': True, 'sage_aggr': 'max', 'sage_normalize': False, 'sage_project': False, 'lr': 1.6006331996938085e-05, 'weight_decay': 7.213121225589906e-06, 'epochs': 283, 'loss': 'mse', 'optimizer': 'adam', 'graph_mode': 'cutoff', 'cutoff': 0.5942334791449215, 'grm_norm': 'none', 'self_loops': True, 'use_snp_selection': False}. Best is trial 1 with value: 0.2872468474552016.
[I 2025-12-10 01:02:58,954] Trial 4 finished with value: 0.2645745775345033 and parameters: {'model_type': 'graphsage', 'hidden_dims': '[128, 64]', 'dropout': 0.3348926467202472, 'batch_norm': True, 'sage_aggr': 'max', 'sage_normalize': False, 'sage_project': False, 'lr': 0.0004238630400638802, 'weight_decay': 8.074086040046576e-07, 'epochs': 158, 'loss': 'mae', 'optimizer': 'adam', 'graph_mode': 'knn', 'knn_k': 1, 'weighted_edges': False, 'symmetrize_mode': 'mutual', 'self_loops': False, 'use_snp_selection': True, 'num_snps': 26850}. Best is trial 1 with value: 0.2872468474552016.
[I 2025-12-10 01:05:34,293] Trial 5 finished with value: 0.2542168143007043 and parameters: {'model_type': 'graphsage', 'hidden_dims': '[512, 64]', 'dropout': 0.14505336736221927, 'batch_norm': True, 'sage_aggr': 'mean', 'sage_normalize': True, 'sage_project': False, 'lr': 1.2962030165732234e-05, 'weight_decay': 1.326598071105465e-07, 'epochs': 180, 'loss': 'mse', 'optimizer': 'adam', 'graph_mode': 'knn', 'knn_k': 9, 'weighted_edges': True, 'symmetrize_mode': 'mutual', 'self_loops': False, 'use_snp_selection': False}. Best is trial 1 with value: 0.2872468474552016.
[I 2025-12-10 01:06:29,489] Trial 6 finished with value: 0.2683608523819879 and parameters: {'model_type': 'graphsage', 'hidden_dims': '[256, 128, 64]', 'dropout': 0.10731743755162496, 'batch_norm': True, 'sage_aggr': 'mean', 'sage_normalize': False, 'sage_project': False, 'lr': 1.922990426933137e-05, 'weight_decay': 7.30001060446905e-05, 'epochs': 63, 'loss': 'mae', 'optimizer': 'adam', 'graph_mode': 'cutoff', 'cutoff': 0.7624978434202536, 'grm_norm': 'none', 'self_loops': True, 'use_snp_selection': True, 'num_snps': 50106}. Best is trial 1 with value: 0.2872468474552016.
[I 2025-12-10 01:09:07,368] Trial 7 finished with value: 0.22096415137285433 and parameters: {'model_type': 'graphsage', 'hidden_dims': '[512, 64]', 'dropout': 0.2585007811528941, 'batch_norm': True, 'sage_aggr': 'max', 'sage_normalize': True, 'sage_project': False, 'lr': 5.921425508303391e-05, 'weight_decay': 0.0004511561961144237, 'epochs': 182, 'loss': 'mae', 'optimizer': 'adam', 'graph_mode': 'knn', 'knn_k': 9, 'weighted_edges': True, 'symmetrize_mode': 'union', 'self_loops': False, 'use_snp_selection': True, 'num_snps': 23903}. Best is trial 1 with value: 0.2872468474552016.
[I 2025-12-10 01:09:48,116] Trial 8 finished with value: 0.2237825673034571 and parameters: {'model_type': 'graphsage', 'hidden_dims': '[512, 256]', 'dropout': 0.3061380386767003, 'batch_norm': False, 'sage_aggr': 'mean', 'sage_normalize': True, 'sage_project': False, 'lr': 0.000698401460570184, 'weight_decay': 2.965560055460244e-06, 'epochs': 289, 'loss': 'mae', 'optimizer': 'adam', 'graph_mode': 'knn', 'knn_k': 7, 'weighted_edges': False, 'symmetrize_mode': 'mutual', 'self_loops': True, 'use_snp_selection': True, 'num_snps': 4710}. Best is trial 1 with value: 0.2872468474552016.
[I 2025-12-10 01:15:34,825] Trial 9 finished with value: 0.27845863079371486 and parameters: {'model_type': 'graphsage', 'hidden_dims': '[512, 128]', 'dropout': 0.1733844071393634, 'batch_norm': False, 'sage_aggr': 'mean', 'sage_normalize': True, 'sage_project': False, 'lr': 0.0004269677918501597, 'weight_decay': 2.2439779626249696e-06, 'epochs': 319, 'loss': 'mse', 'optimizer': 'adam', 'graph_mode': 'cutoff', 'cutoff': 0.24117565767129295, 'grm_norm': 'cosine_then_gcn', 'self_loops': True, 'use_snp_selection': False}. Best is trial 1 with value: 0.2872468474552016.
[I 2025-12-10 01:17:11,820] Trial 10 finished with value: 0.0 and parameters: {'model_type': 'graphsage', 'hidden_dims': '[512, 128]', 'dropout': 0.5365714961141473, 'batch_norm': False, 'sage_aggr': 'max', 'sage_normalize': False, 'sage_project': False, 'lr': 0.0060050040216813455, 'weight_decay': 0.0009536725175322669, 'epochs': 77, 'loss': 'mse', 'optimizer': 'adam', 'graph_mode': 'knn', 'knn_k': 1, 'weighted_edges': False, 'symmetrize_mode': 'union', 'self_loops': True, 'use_snp_selection': True, 'num_snps': 56869}. Best is trial 1 with value: 0.2872468474552016.
[I 2025-12-10 01:19:25,509] Trial 11 finished with value: 0.27522438078468736 and parameters: {'model_type': 'graphsage', 'hidden_dims': '[512, 256]', 'dropout': 0.4460200598462328, 'batch_norm': False, 'sage_aggr': 'max', 'sage_normalize': False, 'sage_project': False, 'lr': 7.530654417271752e-05, 'weight_decay': 3.337083767692119e-05, 'epochs': 122, 'loss': 'mae', 'optimizer': 'adam', 'graph_mode': 'cutoff', 'cutoff': 0.3489998807678978, 'grm_norm': 'gcn', 'self_loops': False, 'use_snp_selection': True, 'num_snps': 42056}. Best is trial 1 with value: 0.2872468474552016.
[I 2025-12-10 01:20:28,872] Trial 12 finished with value: 0.28476712549991867 and parameters: {'model_type': 'graphsage', 'hidden_dims': '[256, 128]', 'dropout': 0.2490067964043116, 'batch_norm': False, 'sage_aggr': 'max', 'sage_normalize': False, 'sage_project': False, 'lr': 8.816195883637583e-05, 'weight_decay': 2.737551210455884e-05, 'epochs': 114, 'loss': 'mae', 'optimizer': 'adam', 'graph_mode': 'cutoff', 'cutoff': 0.5206024458939927, 'grm_norm': 'cosine', 'self_loops': False, 'use_snp_selection': True, 'num_snps': 39092}. Best is trial 1 with value: 0.2872468474552016.
[I 2025-12-10 01:22:47,579] Trial 13 finished with value: 0.2933358506078614 and parameters: {'model_type': 'graphsage', 'hidden_dims': '[512, 256]', 'dropout': 0.4608586563939124, 'batch_norm': False, 'sage_aggr': 'max', 'sage_normalize': False, 'sage_project': False, 'lr': 0.00012586985041155037, 'weight_decay': 0.00011926072016900266, 'epochs': 223, 'loss': 'mse', 'optimizer': 'adam', 'graph_mode': 'cutoff', 'cutoff': 0.5105648593757639, 'grm_norm': 'gcn', 'self_loops': False, 'use_snp_selection': True, 'num_snps': 36810}. Best is trial 13 with value: 0.2933358506078614.
[I 2025-12-10 01:26:11,650] Trial 14 finished with value: 0.1522982548938469 and parameters: {'model_type': 'graphsage', 'hidden_dims': '[512, 128]', 'dropout': 0.4483048564714998, 'batch_norm': False, 'sage_aggr': 'max', 'sage_normalize': False, 'sage_project': False, 'lr': 0.00015809858243784908, 'weight_decay': 0.00020766862519105273, 'epochs': 240, 'loss': 'mse', 'optimizer': 'adam', 'graph_mode': 'knn', 'knn_k': 3, 'weighted_edges': False, 'symmetrize_mode': 'mutual', 'self_loops': True, 'use_snp_selection': True, 'num_snps': 50546}. Best is trial 13 with value: 0.2933358506078614.
[I 2025-12-10 01:26:54,301] Trial 15 finished with value: 0.27025443807074306 and parameters: {'model_type': 'graphsage', 'hidden_dims': '[256, 128]', 'dropout': 0.41656724566348174, 'batch_norm': False, 'sage_aggr': 'max', 'sage_normalize': False, 'sage_project': False, 'lr': 0.001140050652126762, 'weight_decay': 0.00013588196896766432, 'epochs': 227, 'loss': 'mse', 'optimizer': 'adam', 'graph_mode': 'cutoff', 'cutoff': 0.7732092081242897, 'grm_norm': 'gcn', 'self_loops': False, 'use_snp_selection': True, 'num_snps': 15396}. Best is trial 13 with value: 0.2933358506078614.
[I 2025-12-10 01:30:35,775] Trial 16 finished with value: 0.2818299888153003 and parameters: {'model_type': 'graphsage', 'hidden_dims': '[512, 256]', 'dropout': 0.5938724975079561, 'batch_norm': False, 'sage_aggr': 'max', 'sage_normalize': False, 'sage_project': False, 'lr': 4.038866340895696e-05, 'weight_decay': 0.0008475119096092616, 'epochs': 212, 'loss': 'mse', 'optimizer': 'adam', 'graph_mode': 'knn', 'knn_k': 4, 'weighted_edges': False, 'symmetrize_mode': 'union', 'self_loops': False, 'use_snp_selection': True, 'num_snps': 45490}. Best is trial 13 with value: 0.2933358506078614.
[I 2025-12-10 01:33:51,957] Trial 17 finished with value: 0.027824576364627058 and parameters: {'model_type': 'graphsage', 'hidden_dims': '[512, 128]', 'dropout': 0.5141380926853039, 'batch_norm': False, 'sage_aggr': 'max', 'sage_normalize': False, 'sage_project': False, 'lr': 0.0015455375793976113, 'weight_decay': 1.3591103086412823e-05, 'epochs': 263, 'loss': 'mse', 'optimizer': 'adam', 'graph_mode': 'cutoff', 'cutoff': 0.8937392655886813, 'grm_norm': 'cosine', 'self_loops': True, 'use_snp_selection': True, 'num_snps': 59749}. Best is trial 13 with value: 0.2933358506078614.
[I 2025-12-10 01:34:59,057] Trial 18 finished with value: 0.2776785340961495 and parameters: {'model_type': 'graphsage', 'hidden_dims': '[512, 256]', 'dropout': 0.3999027850493187, 'batch_norm': False, 'sage_aggr': 'mean', 'sage_normalize': False, 'sage_project': False, 'lr': 2.9387915246742254e-05, 'weight_decay': 0.0003315106954073976, 'epochs': 101, 'loss': 'mse', 'optimizer': 'adam', 'graph_mode': 'knn', 'knn_k': 3, 'weighted_edges': False, 'symmetrize_mode': 'mutual', 'self_loops': False, 'use_snp_selection': False}. Best is trial 13 with value: 0.2933358506078614.
[I 2025-12-10 01:38:28,542] Trial 19 finished with value: 0.060143067802328996 and parameters: {'model_type': 'graphsage', 'hidden_dims': '[512, 128]', 'dropout': 0.49397529053217226, 'batch_norm': False, 'sage_aggr': 'max', 'sage_normalize': False, 'sage_project': False, 'lr': 0.00019416945668393836, 'weight_decay': 7.956494844679583e-05, 'epochs': 333, 'loss': 'mse', 'optimizer': 'adam', 'graph_mode': 'cutoff', 'cutoff': 0.40336129009098626, 'grm_norm': 'cosine_then_gcn', 'self_loops': True, 'use_snp_selection': True, 'num_snps': 34019}. Best is trial 13 with value: 0.2933358506078614.
[I 2025-12-10 01:39:03,237] Trial 20 finished with value: 0.10734081237597967 and parameters: {'model_type': 'graphsage', 'hidden_dims': '[512, 64]', 'dropout': 0.3724365646517256, 'batch_norm': False, 'sage_aggr': 'max', 'sage_normalize': False, 'sage_project': False, 'lr': 0.00016539031578027247, 'weight_decay': 7.425799682333995e-05, 'epochs': 45, 'loss': 'mse', 'optimizer': 'adam', 'graph_mode': 'cutoff', 'cutoff': 0.6328031517277831, 'grm_norm': 'gcn', 'self_loops': True, 'use_snp_selection': True, 'num_snps': 19494}. Best is trial 13 with value: 0.2933358506078614.
[I 2025-12-10 01:40:51,789] Trial 21 finished with value: 0.2870645110090154 and parameters: {'model_type': 'graphsage', 'hidden_dims': '[512, 256]', 'dropout': 0.27435642321558573, 'batch_norm': False, 'sage_aggr': 'max', 'sage_normalize': False, 'sage_project': False, 'lr': 0.00010696971096965546, 'weight_decay': 2.777031406787062e-05, 'epochs': 148, 'loss': 'mae', 'optimizer': 'adam', 'graph_mode': 'cutoff', 'cutoff': 0.46565489685732264, 'grm_norm': 'gcn', 'self_loops': False, 'use_snp_selection': True, 'num_snps': 33627}. Best is trial 13 with value: 0.2933358506078614.
[I 2025-12-10 01:42:58,592] Trial 22 finished with value: 0.2875419890796743 and parameters: {'model_type': 'graphsage', 'hidden_dims': '[512, 256]', 'dropout': 0.23293954555351734, 'batch_norm': False, 'sage_aggr': 'max', 'sage_normalize': False, 'sage_project': False, 'lr': 3.061206772847394e-05, 'weight_decay': 1.1110533374648393e-05, 'epochs': 150, 'loss': 'mae', 'optimizer': 'adam', 'graph_mode': 'cutoff', 'cutoff': 0.40102506146401923, 'grm_norm': 'gcn', 'self_loops': False, 'use_snp_selection': True, 'num_snps': 37930}. Best is trial 13 with value: 0.2933358506078614.
[I 2025-12-10 01:47:38,358] Trial 23 finished with value: 0.28392342578555746 and parameters: {'model_type': 'graphsage', 'hidden_dims': '[512, 256]', 'dropout': 0.21478765976689004, 'batch_norm': False, 'sage_aggr': 'max', 'sage_normalize': False, 'sage_project': False, 'lr': 3.3363050725877965e-05, 'weight_decay': 6.892786112574957e-06, 'epochs': 196, 'loss': 'mae', 'optimizer': 'adam', 'graph_mode': 'cutoff', 'cutoff': 0.2870331951913094, 'grm_norm': 'gcn', 'self_loops': False, 'use_snp_selection': True, 'num_snps': 47615}. Best is trial 13 with value: 0.2933358506078614.
[I 2025-12-10 01:50:16,105] Trial 24 finished with value: 0.2976189866341795 and parameters: {'model_type': 'graphsage', 'hidden_dims': '[512, 256]', 'dropout': 0.215384752789976, 'batch_norm': False, 'sage_aggr': 'max', 'sage_normalize': False, 'sage_project': False, 'lr': 4.721099368279506e-05, 'weight_decay': 5.524925706969623e-07, 'epochs': 164, 'loss': 'mse', 'optimizer': 'adam', 'graph_mode': 'cutoff', 'cutoff': 0.35119959578011917, 'grm_norm': 'gcn', 'self_loops': False, 'use_snp_selection': True, 'num_snps': 39483}. Best is trial 24 with value: 0.2976189866341795.
[I 2025-12-10 01:53:07,933] Trial 25 finished with value: 0.3060349877166755 and parameters: {'model_type': 'graphsage', 'hidden_dims': '[512, 256]', 'dropout': 0.10039276041677202, 'batch_norm': False, 'sage_aggr': 'max', 'sage_normalize': False, 'sage_project': False, 'lr': 1.0666636980667135e-05, 'weight_decay': 1.7877483624609163e-07, 'epochs': 198, 'loss': 'mse', 'optimizer': 'adam', 'graph_mode': 'cutoff', 'cutoff': 0.37939663677405366, 'grm_norm': 'gcn', 'self_loops': False, 'use_snp_selection': True, 'num_snps': 39191}. Best is trial 25 with value: 0.3060349877166755.
[I 2025-12-10 01:56:03,991] Trial 26 finished with value: 0.2755553557004372 and parameters: {'model_type': 'graphsage', 'hidden_dims': '[512, 256]', 'dropout': 0.11878873307822505, 'batch_norm': False, 'sage_aggr': 'mean', 'sage_normalize': True, 'sage_project': False, 'lr': 1.267850129928415e-05, 'weight_decay': 1.0633561701108114e-07, 'epochs': 200, 'loss': 'mse', 'optimizer': 'adam', 'graph_mode': 'cutoff', 'cutoff': 0.3207098799975939, 'grm_norm': 'gcn', 'self_loops': False, 'use_snp_selection': False}. Best is trial 25 with value: 0.3060349877166755.
[I 2025-12-10 02:00:35,695] Trial 27 finished with value: 0.305592983749844 and parameters: {'model_type': 'graphsage', 'hidden_dims': '[512, 256]', 'dropout': 0.1551263324194719, 'batch_norm': False, 'sage_aggr': 'max', 'sage_normalize': False, 'sage_project': False, 'lr': 2.0322548603575907e-05, 'weight_decay': 2.7480020357736047e-07, 'epochs': 251, 'loss': 'mse', 'optimizer': 'adam', 'graph_mode': 'cutoff', 'cutoff': 0.20617936076702692, 'grm_norm': 'gcn', 'self_loops': False, 'use_snp_selection': True, 'num_snps': 27178}. Best is trial 25 with value: 0.3060349877166755.
[I 2025-12-10 02:04:32,765] Trial 28 finished with value: 0.30732090388868005 and parameters: {'model_type': 'graphsage', 'hidden_dims': '[512, 256]', 'dropout': 0.16184931217774765, 'batch_norm': False, 'sage_aggr': 'max', 'sage_normalize': False, 'sage_project': False, 'lr': 1.0042476703468476e-05, 'weight_decay': 3.31471305852682e-07, 'epochs': 254, 'loss': 'mse', 'optimizer': 'adam', 'graph_mode': 'cutoff', 'cutoff': 0.20912343988459467, 'grm_norm': 'gcn', 'self_loops': False, 'use_snp_selection': True, 'num_snps': 27855}. Best is trial 28 with value: 0.30732090388868005.
[I 2025-12-10 02:08:32,689] Trial 29 finished with value: 0.2507155043764163 and parameters: {'model_type': 'graphsage', 'hidden_dims': '[128, 64]', 'dropout': 0.1648260163598688, 'batch_norm': True, 'sage_aggr': 'max', 'sage_normalize': True, 'sage_project': False, 'lr': 1.0259465448485644e-05, 'weight_decay': 3.2628345791556514e-07, 'epochs': 247, 'loss': 'mse', 'optimizer': 'adam', 'graph_mode': 'cutoff', 'cutoff': 0.2092055119104459, 'grm_norm': 'cosine_then_gcn', 'self_loops': False, 'use_snp_selection': False}. Best is trial 28 with value: 0.30732090388868005.
