[I 2025-12-06 09:59:22,707] Trial 55 finished with value: 0.18976465317566943 and parameters: {'model_type': 'graphsage', 'hidden_dims': '[256, 128, 64]', 'dropout': 0.5616712779184324, 'batch_norm': False, 'sage_aggr': 'mean', 'sage_normalize': False, 'sage_project': False, 'lr': 0.00012910830751371042, 'weight_decay': 0.000546901719569454, 'epochs': 155, 'loss': 'mae', 'optimizer': 'adam', 'graph_mode': 'cutoff', 'cutoff': 0.5545456981558193, 'grm_norm': 'none', 'self_loops': False, 'use_snp_selection': False, 'graphsage_batch_size': 32}. Best is trial 19 with value: 0.22264005015541502.
[I 2025-12-06 10:01:03,252] Trial 56 finished with value: 0.1923296378255557 and parameters: {'model_type': 'graphsage', 'hidden_dims': '[512, 128]', 'dropout': 0.2903163909568206, 'batch_norm': True, 'sage_aggr': 'mean', 'sage_normalize': False, 'sage_project': False, 'lr': 1.3730548876929888e-05, 'weight_decay': 0.0009152073898054338, 'epochs': 166, 'loss': 'mae', 'optimizer': 'adam', 'graph_mode': 'cutoff', 'cutoff': 0.6482796438950539, 'grm_norm': 'none', 'self_loops': False, 'use_snp_selection': False, 'graphsage_batch_size': 8}. Best is trial 19 with value: 0.22264005015541502.
[I 2025-12-06 10:02:55,597] Trial 57 finished with value: 0.16755895006041313 and parameters: {'model_type': 'graphsage', 'hidden_dims': '[256, 128, 64]', 'dropout': 0.44442051619150374, 'batch_norm': True, 'sage_aggr': 'mean', 'sage_normalize': False, 'sage_project': False, 'lr': 5.298481560755114e-05, 'weight_decay': 1.4859748798541792e-07, 'epochs': 117, 'loss': 'mae', 'optimizer': 'adam', 'graph_mode': 'cutoff', 'cutoff': 0.22405160827838366, 'grm_norm': 'none', 'self_loops': False, 'use_snp_selection': False, 'graphsage_batch_size': 32}. Best is trial 19 with value: 0.22264005015541502.
[I 2025-12-06 10:04:43,989] Trial 58 finished with value: 0.18626356045836995 and parameters: {'model_type': 'graphsage', 'hidden_dims': '[512, 256]', 'dropout': 0.4135297021835127, 'batch_norm': True, 'sage_aggr': 'mean', 'sage_normalize': False, 'sage_project': False, 'lr': 0.00018719054791289892, 'weight_decay': 2.4396838330594686e-07, 'epochs': 134, 'loss': 'mae', 'optimizer': 'adam', 'graph_mode': 'knn', 'knn_k': 10, 'weighted_edges': True, 'symmetrize_mode': 'mutual', 'self_loops': False, 'use_snp_selection': False, 'graphsage_batch_size': 64}. Best is trial 19 with value: 0.22264005015541502.
[I 2025-12-06 10:05:26,521] Trial 59 finished with value: 0.1922661405940596 and parameters: {'model_type': 'graphsage', 'hidden_dims': '[128, 64]', 'dropout': 0.5889303731860436, 'batch_norm': True, 'sage_aggr': 'max', 'sage_normalize': False, 'sage_project': False, 'lr': 7.377264113938622e-05, 'weight_decay': 0.00022161569250776645, 'epochs': 180, 'loss': 'mae', 'optimizer': 'adam', 'graph_mode': 'cutoff', 'cutoff': 0.564221874684489, 'grm_norm': 'gcn', 'self_loops': False, 'use_snp_selection': False, 'graphsage_batch_size': 32}. Best is trial 19 with value: 0.22264005015541502.
[I 2025-12-06 10:06:27,060] Trial 60 finished with value: 0.20382175374671047 and parameters: {'model_type': 'graphsage', 'hidden_dims': '[256, 128, 64]', 'dropout': 0.535608611623611, 'batch_norm': True, 'sage_aggr': 'mean', 'sage_normalize': False, 'sage_project': False, 'lr': 1.9197765172130114e-05, 'weight_decay': 4.1138071272767363e-07, 'epochs': 172, 'loss': 'mse', 'optimizer': 'adam', 'graph_mode': 'cutoff', 'cutoff': 0.6753629195655133, 'grm_norm': 'none', 'self_loops': False, 'use_snp_selection': False, 'graphsage_batch_size': 256}. Best is trial 19 with value: 0.22264005015541502.
[I 2025-12-06 10:07:32,406] Trial 61 finished with value: 0.21583766242894095 and parameters: {'model_type': 'graphsage', 'hidden_dims': '[256, 128, 64]', 'dropout': 0.44185051315212437, 'batch_norm': True, 'sage_aggr': 'mean', 'sage_normalize': False, 'sage_project': False, 'lr': 7.908767861713666e-05, 'weight_decay': 0.0006552388718259606, 'epochs': 188, 'loss': 'mae', 'optimizer': 'adam', 'graph_mode': 'cutoff', 'cutoff': 0.6919217612145439, 'grm_norm': 'none', 'self_loops': False, 'use_snp_selection': False, 'graphsage_batch_size': 32}. Best is trial 19 with value: 0.22264005015541502.
[I 2025-12-06 10:08:25,865] Trial 62 finished with value: 0.2004338436131546 and parameters: {'model_type': 'graphsage', 'hidden_dims': '[256, 128, 64]', 'dropout': 0.4765126244891189, 'batch_norm': True, 'sage_aggr': 'mean', 'sage_normalize': False, 'sage_project': False, 'lr': 7.928650287678611e-05, 'weight_decay': 0.0007182528329192861, 'epochs': 150, 'loss': 'mae', 'optimizer': 'adam', 'graph_mode': 'cutoff', 'cutoff': 0.721297533515427, 'grm_norm': 'none', 'self_loops': False, 'use_snp_selection': False, 'graphsage_batch_size': 32}. Best is trial 19 with value: 0.22264005015541502.
[I 2025-12-06 10:09:38,112] Trial 63 finished with value: 0.20216245300372152 and parameters: {'model_type': 'graphsage', 'hidden_dims': '[256, 128, 64]', 'dropout': 0.49861692223338333, 'batch_norm': True, 'sage_aggr': 'mean', 'sage_normalize': False, 'sage_project': False, 'lr': 0.00012889710644895937, 'weight_decay': 0.0003833808163831934, 'epochs': 208, 'loss': 'mae', 'optimizer': 'adam', 'graph_mode': 'cutoff', 'cutoff': 0.6377366323337612, 'grm_norm': 'none', 'self_loops': False, 'use_snp_selection': False, 'graphsage_batch_size': 32}. Best is trial 19 with value: 0.22264005015541502.
[I 2025-12-06 10:10:46,160] Trial 64 finished with value: 0.19955851991274248 and parameters: {'model_type': 'graphsage', 'hidden_dims': '[256, 128, 64]', 'dropout': 0.43302329992574057, 'batch_norm': True, 'sage_aggr': 'mean', 'sage_normalize': False, 'sage_project': False, 'lr': 4.079386002028413e-05, 'weight_decay': 7.073834755338135e-07, 'epochs': 191, 'loss': 'mae', 'optimizer': 'adam', 'graph_mode': 'cutoff', 'cutoff': 0.5966098546232401, 'grm_norm': 'none', 'self_loops': False, 'use_snp_selection': False, 'graphsage_batch_size': 32}. Best is trial 19 with value: 0.22264005015541502.
[I 2025-12-06 10:11:50,016] Trial 65 finished with value: 0.18891312953974376 and parameters: {'model_type': 'graphsage', 'hidden_dims': '[256, 128, 64]', 'dropout': 0.4624861955444744, 'batch_norm': True, 'sage_aggr': 'mean', 'sage_normalize': False, 'sage_project': False, 'lr': 7.236743156230129e-06, 'weight_decay': 0.0009969447584263643, 'epochs': 183, 'loss': 'mae', 'optimizer': 'adam', 'graph_mode': 'cutoff', 'cutoff': 0.7436219669439571, 'grm_norm': 'cosine', 'self_loops': False, 'use_snp_selection': False, 'graphsage_batch_size': 32}. Best is trial 19 with value: 0.22264005015541502.
[I 2025-12-06 10:13:27,105] Trial 66 finished with value: 0.20123323894134218 and parameters: {'model_type': 'graphsage', 'hidden_dims': '[512, 256]', 'dropout': 0.5220879118128199, 'batch_norm': True, 'sage_aggr': 'mean', 'sage_normalize': False, 'sage_project': False, 'lr': 2.867921120076123e-05, 'weight_decay': 0.00024123595201915838, 'epochs': 162, 'loss': 'mae', 'optimizer': 'adam', 'graph_mode': 'cutoff', 'cutoff': 0.6863625064798076, 'grm_norm': 'gcn', 'self_loops': False, 'use_snp_selection': False, 'graphsage_batch_size': 16}. Best is trial 19 with value: 0.22264005015541502.
[I 2025-12-06 10:15:08,725] Trial 67 finished with value: 0.21019781582098443 and parameters: {'model_type': 'graphsage', 'hidden_dims': '[512, 64]', 'dropout': 0.37826078762377824, 'batch_norm': True, 'sage_aggr': 'mean', 'sage_normalize': False, 'sage_project': False, 'lr': 5.595617405344345e-05, 'weight_decay': 0.000664731598191602, 'epochs': 172, 'loss': 'mae', 'optimizer': 'adam', 'graph_mode': 'cutoff', 'cutoff': 0.773880371959767, 'grm_norm': 'none', 'self_loops': False, 'use_snp_selection': False, 'graphsage_batch_size': 32}. Best is trial 19 with value: 0.22264005015541502.
[I 2025-12-06 10:15:41,429] Trial 68 finished with value: 0.15953200829044262 and parameters: {'model_type': 'graphsage', 'hidden_dims': '[128, 64]', 'dropout': 0.39579367839634827, 'batch_norm': False, 'sage_aggr': 'mean', 'sage_normalize': False, 'sage_project': False, 'lr': 0.00021843683445534065, 'weight_decay': 0.0004188658898538425, 'epochs': 146, 'loss': 'mae', 'optimizer': 'adam', 'graph_mode': 'cutoff', 'cutoff': 0.7285923204204863, 'grm_norm': 'cosine_then_gcn', 'self_loops': False, 'use_snp_selection': False, 'graphsage_batch_size': 512}. Best is trial 19 with value: 0.22264005015541502.
[I 2025-12-06 10:16:25,577] Trial 69 finished with value: 0.2139749959018394 and parameters: {'model_type': 'graphsage', 'hidden_dims': '[256, 128, 64]', 'dropout': 0.41435516470882017, 'batch_norm': True, 'sage_aggr': 'mean', 'sage_normalize': True, 'sage_project': False, 'lr': 1.4046827987184824e-05, 'weight_decay': 1.284515625692829e-07, 'epochs': 198, 'loss': 'mae', 'optimizer': 'adam', 'graph_mode': 'cutoff', 'cutoff': 0.6599917998589611, 'grm_norm': 'none', 'self_loops': False, 'use_snp_selection': True, 'num_snps': 24524, 'graphsage_batch_size': 32}. Best is trial 19 with value: 0.22264005015541502.
[I 2025-12-06 10:17:13,376] Trial 70 finished with value: 0.18904958997471516 and parameters: {'model_type': 'graphsage', 'hidden_dims': '[256, 128, 64]', 'dropout': 0.10524467411490976, 'batch_norm': True, 'sage_aggr': 'max', 'sage_normalize': True, 'sage_project': False, 'lr': 1.552477362427026e-05, 'weight_decay': 1.3758726684054395e-07, 'epochs': 213, 'loss': 'mae', 'optimizer': 'adam', 'graph_mode': 'cutoff', 'cutoff': 0.6133534377658836, 'grm_norm': 'gcn', 'self_loops': False, 'use_snp_selection': True, 'num_snps': 25368, 'graphsage_batch_size': 128}. Best is trial 19 with value: 0.22264005015541502.
[I 2025-12-06 10:17:45,689] Trial 71 finished with value: 0.18866242034616482 and parameters: {'model_type': 'graphsage', 'hidden_dims': '[256, 128, 64]', 'dropout': 0.41476804692233804, 'batch_norm': True, 'sage_aggr': 'mean', 'sage_normalize': True, 'sage_project': False, 'lr': 2.524623387002794e-05, 'weight_decay': 1.0260369960103261e-07, 'epochs': 199, 'loss': 'mae', 'optimizer': 'adam', 'graph_mode': 'cutoff', 'cutoff': 0.6594916081923214, 'grm_norm': 'none', 'self_loops': False, 'use_snp_selection': True, 'num_snps': 15068, 'graphsage_batch_size': 32}. Best is trial 19 with value: 0.22264005015541502.
[I 2025-12-06 10:18:29,667] Trial 72 finished with value: 0.19603745952307972 and parameters: {'model_type': 'graphsage', 'hidden_dims': '[256, 128, 64]', 'dropout': 0.4428927811620974, 'batch_norm': True, 'sage_aggr': 'mean', 'sage_normalize': True, 'sage_project': False, 'lr': 1.3037618729860787e-05, 'weight_decay': 2.1642006154989343e-07, 'epochs': 185, 'loss': 'mae', 'optimizer': 'adam', 'graph_mode': 'cutoff', 'cutoff': 0.6968017835295855, 'grm_norm': 'none', 'self_loops': False, 'use_snp_selection': True, 'num_snps': 26465, 'graphsage_batch_size': 32}. Best is trial 19 with value: 0.22264005015541502.
[I 2025-12-06 10:19:41,529] Trial 73 finished with value: 0.20007027723069587 and parameters: {'model_type': 'graphsage', 'hidden_dims': '[256, 128, 64]', 'dropout': 0.4672699776946897, 'batch_norm': True, 'sage_aggr': 'mean', 'sage_normalize': True, 'sage_project': False, 'lr': 8.471754537843062e-06, 'weight_decay': 3.5845295752888697e-07, 'epochs': 219, 'loss': 'mae', 'optimizer': 'adam', 'graph_mode': 'cutoff', 'cutoff': 0.5203812536587209, 'grm_norm': 'none', 'self_loops': False, 'use_snp_selection': True, 'num_snps': 38968, 'graphsage_batch_size': 32}. Best is trial 19 with value: 0.22264005015541502.
[I 2025-12-06 10:20:10,688] Trial 74 finished with value: 0.18823251914704955 and parameters: {'model_type': 'graphsage', 'hidden_dims': '[256, 128, 64]', 'dropout': 0.42477171586805484, 'batch_norm': True, 'sage_aggr': 'mean', 'sage_normalize': True, 'sage_project': False, 'lr': 0.0001476616106069984, 'weight_decay': 2.647309200620755e-07, 'epochs': 204, 'loss': 'mae', 'optimizer': 'adam', 'graph_mode': 'cutoff', 'cutoff': 0.5774421627084014, 'grm_norm': 'none', 'self_loops': False, 'use_snp_selection': True, 'num_snps': 11629, 'graphsage_batch_size': 32}. Best is trial 19 with value: 0.22264005015541502.
[I 2025-12-06 10:22:05,799] Trial 75 finished with value: 0.20575554654344969 and parameters: {'model_type': 'graphsage', 'hidden_dims': '[512, 256]', 'dropout': 0.45499913771040545, 'batch_norm': True, 'sage_aggr': 'mean', 'sage_normalize': False, 'sage_project': False, 'lr': 0.0003797191723062594, 'weight_decay': 3.5551810786362353e-06, 'epochs': 195, 'loss': 'mse', 'optimizer': 'adam', 'graph_mode': 'cutoff', 'cutoff': 0.6614226150471452, 'grm_norm': 'none', 'self_loops': False, 'use_snp_selection': False, 'graphsage_batch_size': 8}. Best is trial 19 with value: 0.22264005015541502.
[I 2025-12-06 10:22:59,500] Trial 76 finished with value: 0.18501168737486395 and parameters: {'model_type': 'graphsage', 'hidden_dims': '[128, 64]', 'dropout': 0.49006440265932755, 'batch_norm': True, 'sage_aggr': 'mean', 'sage_normalize': True, 'sage_project': False, 'lr': 2.1376615347523702e-05, 'weight_decay': 1.4863362273645245e-06, 'epochs': 177, 'loss': 'mae', 'optimizer': 'adam', 'graph_mode': 'knn', 'knn_k': 8, 'weighted_edges': False, 'symmetrize_mode': 'union', 'self_loops': False, 'use_snp_selection': True, 'num_snps': 20044, 'graphsage_batch_size': 32}. Best is trial 19 with value: 0.22264005015541502.
[I 2025-12-06 10:24:35,959] Trial 77 finished with value: 0.2095283134716473 and parameters: {'model_type': 'graphsage', 'hidden_dims': '[256, 128]', 'dropout': 0.5099755010477603, 'batch_norm': True, 'sage_aggr': 'mean', 'sage_normalize': False, 'sage_project': False, 'lr': 4.591532979983744e-05, 'weight_decay': 1.7409257461161773e-07, 'epochs': 168, 'loss': 'mae', 'optimizer': 'adam', 'graph_mode': 'cutoff', 'cutoff': 0.3007041158989687, 'grm_norm': 'none', 'self_loops': False, 'use_snp_selection': False, 'graphsage_batch_size': 32}. Best is trial 19 with value: 0.22264005015541502.
[I 2025-12-06 10:26:09,362] Trial 78 finished with value: 0.2092000854487846 and parameters: {'model_type': 'graphsage', 'hidden_dims': '[512, 64]', 'dropout': 0.36368238342860465, 'batch_norm': True, 'sage_aggr': 'mean', 'sage_normalize': False, 'sage_project': False, 'lr': 1.1357528045202781e-05, 'weight_decay': 1.2852599295002373e-07, 'epochs': 155, 'loss': 'mae', 'optimizer': 'adam', 'graph_mode': 'cutoff', 'cutoff': 0.62505384088425, 'grm_norm': 'cosine', 'self_loops': False, 'use_snp_selection': False, 'graphsage_batch_size': 256}. Best is trial 19 with value: 0.22264005015541502.
[I 2025-12-06 10:26:57,878] Trial 79 finished with value: 0.20620262330533276 and parameters: {'model_type': 'graphsage', 'hidden_dims': '[256, 128, 64]', 'dropout': 0.4103194684996458, 'batch_norm': True, 'sage_aggr': 'mean', 'sage_normalize': True, 'sage_project': False, 'lr': 9.075771090694082e-05, 'weight_decay': 0.00016004031777235356, 'epochs': 186, 'loss': 'mse', 'optimizer': 'adam', 'graph_mode': 'cutoff', 'cutoff': 0.8477994989685931, 'grm_norm': 'gcn', 'self_loops': False, 'use_snp_selection': True, 'num_snps': 31017, 'graphsage_batch_size': 32}. Best is trial 19 with value: 0.22264005015541502.
[I 2025-12-06 10:28:52,883] Trial 80 finished with value: 0.19526414283364898 and parameters: {'model_type': 'graphsage', 'hidden_dims': '[512, 128]', 'dropout': 0.13199957523358335, 'batch_norm': False, 'sage_aggr': 'mean', 'sage_normalize': False, 'sage_project': False, 'lr': 1.8021490970656907e-05, 'weight_decay': 5.488663437658347e-07, 'epochs': 197, 'loss': 'mae', 'optimizer': 'adam', 'graph_mode': 'cutoff', 'cutoff': 0.7512556838068085, 'grm_norm': 'none', 'self_loops': False, 'use_snp_selection': False, 'graphsage_batch_size': 8}. Best is trial 19 with value: 0.22264005015541502.
[I 2025-12-06 10:30:35,153] Trial 81 finished with value: 0.210983810490657 and parameters: {'model_type': 'graphsage', 'hidden_dims': '[512, 64]', 'dropout': 0.38712863556391486, 'batch_norm': True, 'sage_aggr': 'mean', 'sage_normalize': False, 'sage_project': False, 'lr': 6.291625712188862e-05, 'weight_decay': 0.000698406257035708, 'epochs': 173, 'loss': 'mae', 'optimizer': 'adam', 'graph_mode': 'cutoff', 'cutoff': 0.7867884865338123, 'grm_norm': 'none', 'self_loops': False, 'use_snp_selection': False, 'graphsage_batch_size': 32}. Best is trial 19 with value: 0.22264005015541502.
[I 2025-12-06 10:32:20,014] Trial 82 finished with value: 0.20467518145606373 and parameters: {'model_type': 'graphsage', 'hidden_dims': '[512, 64]', 'dropout': 0.38921287470619775, 'batch_norm': True, 'sage_aggr': 'mean', 'sage_normalize': False, 'sage_project': False, 'lr': 6.911679718020949e-05, 'weight_decay': 1.028969689360136e-06, 'epochs': 178, 'loss': 'mae', 'optimizer': 'adam', 'graph_mode': 'cutoff', 'cutoff': 0.780324876006399, 'grm_norm': 'none', 'self_loops': False, 'use_snp_selection': False, 'graphsage_batch_size': 32}. Best is trial 19 with value: 0.22264005015541502.
[I 2025-12-06 10:33:02,149] Trial 83 finished with value: 0.19978416006894523 and parameters: {'model_type': 'graphsage', 'hidden_dims': '[512, 64]', 'dropout': 0.4333596953231775, 'batch_norm': True, 'sage_aggr': 'mean', 'sage_normalize': False, 'sage_project': False, 'lr': 0.00011041025685507547, 'weight_decay': 0.0006806526431462544, 'epochs': 60, 'loss': 'mae', 'optimizer': 'adam', 'graph_mode': 'cutoff', 'cutoff': 0.7088928624396178, 'grm_norm': 'none', 'self_loops': False, 'use_snp_selection': False, 'graphsage_batch_size': 32}. Best is trial 19 with value: 0.22264005015541502.
[I 2025-12-06 10:34:38,486] Trial 84 finished with value: 0.1985257682737017 and parameters: {'model_type': 'graphsage', 'hidden_dims': '[512, 64]', 'dropout': 0.44964941616499854, 'batch_norm': True, 'sage_aggr': 'mean', 'sage_normalize': False, 'sage_project': False, 'lr': 8.316554649229304e-05, 'weight_decay': 0.0004858712257618059, 'epochs': 162, 'loss': 'mae', 'optimizer': 'adam', 'graph_mode': 'cutoff', 'cutoff': 0.798591790820956, 'grm_norm': 'none', 'self_loops': False, 'use_snp_selection': False, 'graphsage_batch_size': 32}. Best is trial 19 with value: 0.22264005015541502.
[I 2025-12-06 10:36:30,701] Trial 85 finished with value: 0.2024613498634674 and parameters: {'model_type': 'graphsage', 'hidden_dims': '[512, 64]', 'dropout': 0.3427992550366143, 'batch_norm': True, 'sage_aggr': 'mean', 'sage_normalize': False, 'sage_project': False, 'lr': 3.353516514776275e-05, 'weight_decay': 0.0007254524270616824, 'epochs': 192, 'loss': 'mae', 'optimizer': 'adam', 'graph_mode': 'cutoff', 'cutoff': 0.8339049653245963, 'grm_norm': 'none', 'self_loops': False, 'use_snp_selection': False, 'graphsage_batch_size': 64}. Best is trial 19 with value: 0.22264005015541502.
[I 2025-12-06 10:37:30,126] Trial 86 finished with value: 0.20436795018995685 and parameters: {'model_type': 'graphsage', 'hidden_dims': '[256, 128, 64]', 'dropout': 0.3674247812754825, 'batch_norm': True, 'sage_aggr': 'mean', 'sage_normalize': False, 'sage_project': False, 'lr': 5.051460510217164e-05, 'weight_decay': 0.0003580300940087827, 'epochs': 169, 'loss': 'mae', 'optimizer': 'adam', 'graph_mode': 'cutoff', 'cutoff': 0.723878833642353, 'grm_norm': 'gcn', 'self_loops': False, 'use_snp_selection': False, 'graphsage_batch_size': 32}. Best is trial 19 with value: 0.22264005015541502.
[I 2025-12-06 10:39:17,826] Trial 87 finished with value: 0.1993712335660455 and parameters: {'model_type': 'graphsage', 'hidden_dims': '[512, 256]', 'dropout': 0.4750211646598449, 'batch_norm': True, 'sage_aggr': 'max', 'sage_normalize': False, 'sage_project': False, 'lr': 6.34392325760206e-05, 'weight_decay': 0.0002825069864966872, 'epochs': 182, 'loss': 'mse', 'optimizer': 'adam', 'graph_mode': 'cutoff', 'cutoff': 0.6733247938955926, 'grm_norm': 'cosine_then_gcn', 'self_loops': False, 'use_snp_selection': False, 'graphsage_batch_size': 16}. Best is trial 19 with value: 0.22264005015541502.
[I 2025-12-06 10:39:58,490] Trial 88 finished with value: 0.14389882054049302 and parameters: {'model_type': 'graphsage', 'hidden_dims': '[128, 64]', 'dropout': 0.3906943765444934, 'batch_norm': True, 'sage_aggr': 'mean', 'sage_normalize': True, 'sage_project': False, 'lr': 2.7310416547176564e-05, 'weight_decay': 8.712182974672042e-06, 'epochs': 124, 'loss': 'mae', 'optimizer': 'adam', 'graph_mode': 'knn', 'knn_k': 2, 'weighted_edges': True, 'symmetrize_mode': 'mutual', 'self_loops': False, 'use_snp_selection': True, 'num_snps': 44857, 'graphsage_batch_size': 32}. Best is trial 19 with value: 0.22264005015541502.
[I 2025-12-06 10:40:52,878] Trial 89 finished with value: 0.19845226615854525 and parameters: {'model_type': 'graphsage', 'hidden_dims': '[256, 128, 64]', 'dropout': 0.4216764163676622, 'batch_norm': True, 'sage_aggr': 'mean', 'sage_normalize': False, 'sage_project': False, 'lr': 3.886642110956696e-05, 'weight_decay': 8.000518084423422e-05, 'epochs': 153, 'loss': 'mae', 'optimizer': 'adam', 'graph_mode': 'cutoff', 'cutoff': 0.7444141286684977, 'grm_norm': 'none', 'self_loops': False, 'use_snp_selection': False, 'graphsage_batch_size': 32}. Best is trial 19 with value: 0.22264005015541502.
[I 2025-12-06 10:42:54,093] Trial 90 finished with value: 0.2000821581188003 and parameters: {'model_type': 'graphsage', 'hidden_dims': '[512, 64]', 'dropout': 0.4046740419822055, 'batch_norm': True, 'sage_aggr': 'mean', 'sage_normalize': False, 'sage_project': False, 'lr': 0.00011985421671266286, 'weight_decay': 2.3561413525229224e-06, 'epochs': 208, 'loss': 'mae', 'optimizer': 'adam', 'graph_mode': 'cutoff', 'cutoff': 0.6979007884102333, 'grm_norm': 'none', 'self_loops': False, 'use_snp_selection': False, 'graphsage_batch_size': 512}. Best is trial 19 with value: 0.22264005015541502.
