Running from this directory: /cluster/work/simennes/Project_thesis/Project_thesis
Name of job: sage_m_ind
ID of job: 23696743
The job was run on these nodes: idun-07-04
[I 2025-12-08 10:17:17,929] Trial 0 finished with value: 0.25433901783724605 and parameters: {'model_type': 'graphsage', 'hidden_dims': '[128, 64]', 'dropout': 0.199031432379812, 'batch_norm': True, 'sage_aggr': 'max', 'sage_normalize': True, 'sage_project': False, 'lr': 0.00034401453323286885, 'weight_decay': 0.00017802616915745114, 'epochs': 230, 'loss': 'mse', 'optimizer': 'adam', 'graph_mode': 'knn', 'knn_k': 6, 'weighted_edges': True, 'symmetrize_mode': 'mutual', 'self_loops': True, 'use_snp_selection': False}. Best is trial 0 with value: 0.25433901783724605.
[I 2025-12-08 10:19:03,478] Trial 1 finished with value: 0.26631295311833425 and parameters: {'model_type': 'graphsage', 'hidden_dims': '[512, 128]', 'dropout': 0.2503500283181017, 'batch_norm': False, 'sage_aggr': 'max', 'sage_normalize': False, 'sage_project': False, 'lr': 3.952233718592099e-05, 'weight_decay': 0.00026754769258252603, 'epochs': 149, 'loss': 'mse', 'optimizer': 'adam', 'graph_mode': 'knn', 'knn_k': 2, 'weighted_edges': False, 'symmetrize_mode': 'mutual', 'self_loops': True, 'use_snp_selection': True, 'num_snps': 49915}. Best is trial 1 with value: 0.26631295311833425.
[I 2025-12-08 10:20:22,997] Trial 2 finished with value: 0.2642134970431798 and parameters: {'model_type': 'graphsage', 'hidden_dims': '[512, 256]', 'dropout': 0.2785908793172681, 'batch_norm': False, 'sage_aggr': 'max', 'sage_normalize': False, 'sage_project': False, 'lr': 8.806039223165805e-05, 'weight_decay': 3.5153176302760294e-05, 'epochs': 147, 'loss': 'mae', 'optimizer': 'adam', 'graph_mode': 'cutoff', 'cutoff': 0.4922564006874869, 'grm_norm': 'gcn', 'self_loops': False, 'use_snp_selection': True, 'num_snps': 34340}. Best is trial 1 with value: 0.26631295311833425.
[I 2025-12-08 10:21:40,589] Trial 3 finished with value: 0.26191367279257083 and parameters: {'model_type': 'graphsage', 'hidden_dims': '[256, 128, 64]', 'dropout': 0.3475243154412272, 'batch_norm': True, 'sage_aggr': 'max', 'sage_normalize': False, 'sage_project': False, 'lr': 1.6006331996938085e-05, 'weight_decay': 7.213121225589906e-06, 'epochs': 283, 'loss': 'mse', 'optimizer': 'adam', 'graph_mode': 'cutoff', 'cutoff': 0.5942334791449215, 'grm_norm': 'none', 'self_loops': True, 'use_snp_selection': False}. Best is trial 1 with value: 0.26631295311833425.
[I 2025-12-08 10:22:23,597] Trial 4 finished with value: 0.2398228870604508 and parameters: {'model_type': 'graphsage', 'hidden_dims': '[128, 64]', 'dropout': 0.3348926467202472, 'batch_norm': True, 'sage_aggr': 'max', 'sage_normalize': False, 'sage_project': False, 'lr': 0.0004238630400638802, 'weight_decay': 8.074086040046576e-07, 'epochs': 158, 'loss': 'mae', 'optimizer': 'adam', 'graph_mode': 'knn', 'knn_k': 1, 'weighted_edges': False, 'symmetrize_mode': 'mutual', 'self_loops': False, 'use_snp_selection': True, 'num_snps': 26850}. Best is trial 1 with value: 0.26631295311833425.
[I 2025-12-08 10:24:17,509] Trial 5 finished with value: 0.24981609346945105 and parameters: {'model_type': 'graphsage', 'hidden_dims': '[512, 64]', 'dropout': 0.14505336736221927, 'batch_norm': True, 'sage_aggr': 'mean', 'sage_normalize': True, 'sage_project': False, 'lr': 1.2962030165732234e-05, 'weight_decay': 1.326598071105465e-07, 'epochs': 180, 'loss': 'mse', 'optimizer': 'adam', 'graph_mode': 'knn', 'knn_k': 9, 'weighted_edges': True, 'symmetrize_mode': 'mutual', 'self_loops': False, 'use_snp_selection': False}. Best is trial 1 with value: 0.26631295311833425.
[I 2025-12-08 10:25:11,635] Trial 6 finished with value: 0.26269570539797044 and parameters: {'model_type': 'graphsage', 'hidden_dims': '[256, 128, 64]', 'dropout': 0.10731743755162496, 'batch_norm': True, 'sage_aggr': 'mean', 'sage_normalize': False, 'sage_project': False, 'lr': 1.922990426933137e-05, 'weight_decay': 7.30001060446905e-05, 'epochs': 63, 'loss': 'mae', 'optimizer': 'adam', 'graph_mode': 'cutoff', 'cutoff': 0.7624978434202536, 'grm_norm': 'none', 'self_loops': True, 'use_snp_selection': True, 'num_snps': 50106}. Best is trial 1 with value: 0.26631295311833425.
[I 2025-12-08 10:27:14,257] Trial 7 finished with value: 0.2682052850038773 and parameters: {'model_type': 'graphsage', 'hidden_dims': '[512, 64]', 'dropout': 0.2585007811528941, 'batch_norm': True, 'sage_aggr': 'max', 'sage_normalize': True, 'sage_project': False, 'lr': 5.921425508303391e-05, 'weight_decay': 0.0004511561961144237, 'epochs': 182, 'loss': 'mae', 'optimizer': 'adam', 'graph_mode': 'knn', 'knn_k': 9, 'weighted_edges': True, 'symmetrize_mode': 'union', 'self_loops': False, 'use_snp_selection': True, 'num_snps': 23903}. Best is trial 7 with value: 0.2682052850038773.
[I 2025-12-08 10:27:56,880] Trial 8 finished with value: 0.21830026629201038 and parameters: {'model_type': 'graphsage', 'hidden_dims': '[512, 256]', 'dropout': 0.3061380386767003, 'batch_norm': False, 'sage_aggr': 'mean', 'sage_normalize': True, 'sage_project': False, 'lr': 0.000698401460570184, 'weight_decay': 2.965560055460244e-06, 'epochs': 289, 'loss': 'mae', 'optimizer': 'adam', 'graph_mode': 'knn', 'knn_k': 7, 'weighted_edges': False, 'symmetrize_mode': 'mutual', 'self_loops': True, 'use_snp_selection': True, 'num_snps': 4710}. Best is trial 7 with value: 0.2682052850038773.
[I 2025-12-08 10:31:49,381] Trial 9 finished with value: 0.2639094179368472 and parameters: {'model_type': 'graphsage', 'hidden_dims': '[512, 128]', 'dropout': 0.1733844071393634, 'batch_norm': False, 'sage_aggr': 'mean', 'sage_normalize': True, 'sage_project': False, 'lr': 0.0004269677918501597, 'weight_decay': 2.2439779626249696e-06, 'epochs': 319, 'loss': 'mse', 'optimizer': 'adam', 'graph_mode': 'cutoff', 'cutoff': 0.24117565767129295, 'grm_norm': 'cosine_then_gcn', 'self_loops': True, 'use_snp_selection': False}. Best is trial 7 with value: 0.2682052850038773.
[I 2025-12-08 10:32:36,682] Trial 10 finished with value: 0.25542164398367845 and parameters: {'model_type': 'graphsage', 'hidden_dims': '[512, 64]', 'dropout': 0.5365714961141473, 'batch_norm': True, 'sage_aggr': 'max', 'sage_normalize': True, 'sage_project': False, 'lr': 0.0060050040216813455, 'weight_decay': 0.0009536725175322669, 'epochs': 68, 'loss': 'mae', 'optimizer': 'adam', 'graph_mode': 'knn', 'knn_k': 10, 'weighted_edges': True, 'symmetrize_mode': 'union', 'self_loops': False, 'use_snp_selection': True, 'num_snps': 14119}. Best is trial 7 with value: 0.2682052850038773.
[I 2025-12-08 10:34:32,839] Trial 11 finished with value: 0.14688465426811456 and parameters: {'model_type': 'graphsage', 'hidden_dims': '[512, 128]', 'dropout': 0.4692039945166981, 'batch_norm': False, 'sage_aggr': 'max', 'sage_normalize': False, 'sage_project': False, 'lr': 7.372010651217635e-05, 'weight_decay': 0.0009195886437027288, 'epochs': 118, 'loss': 'mse', 'optimizer': 'adam', 'graph_mode': 'knn', 'knn_k': 2, 'weighted_edges': False, 'symmetrize_mode': 'union', 'self_loops': False, 'use_snp_selection': True, 'num_snps': 59509}. Best is trial 7 with value: 0.2682052850038773.
[I 2025-12-08 10:36:43,273] Trial 12 finished with value: 0.25814554475511364 and parameters: {'model_type': 'graphsage', 'hidden_dims': '[256, 128]', 'dropout': 0.258303392049232, 'batch_norm': False, 'sage_aggr': 'max', 'sage_normalize': True, 'sage_project': False, 'lr': 6.816045485459728e-05, 'weight_decay': 0.00018069908979176965, 'epochs': 222, 'loss': 'mse', 'optimizer': 'adam', 'graph_mode': 'knn', 'knn_k': 4, 'weighted_edges': False, 'symmetrize_mode': 'union', 'self_loops': True, 'use_snp_selection': True, 'num_snps': 36209}. Best is trial 7 with value: 0.2682052850038773.
[I 2025-12-08 10:37:42,087] Trial 13 finished with value: 0.1895143630201288 and parameters: {'model_type': 'graphsage', 'hidden_dims': '[512, 128]', 'dropout': 0.4176256781596038, 'batch_norm': False, 'sage_aggr': 'max', 'sage_normalize': False, 'sage_project': False, 'lr': 4.45095078140391e-05, 'weight_decay': 0.0002496237941555406, 'epochs': 107, 'loss': 'mae', 'optimizer': 'adam', 'graph_mode': 'knn', 'knn_k': 4, 'weighted_edges': True, 'symmetrize_mode': 'union', 'self_loops': False, 'use_snp_selection': True, 'num_snps': 22181}. Best is trial 7 with value: 0.2682052850038773.
[I 2025-12-08 10:40:46,293] Trial 14 finished with value: 0.257486147195413 and parameters: {'model_type': 'graphsage', 'hidden_dims': '[512, 64]', 'dropout': 0.2312628506238401, 'batch_norm': True, 'sage_aggr': 'max', 'sage_normalize': False, 'sage_project': False, 'lr': 0.00016018564472759444, 'weight_decay': 2.6713878082732833e-05, 'epochs': 223, 'loss': 'mse', 'optimizer': 'adam', 'graph_mode': 'knn', 'knn_k': 8, 'weighted_edges': False, 'symmetrize_mode': 'mutual', 'self_loops': True, 'use_snp_selection': True, 'num_snps': 44832}. Best is trial 7 with value: 0.2682052850038773.
[I 2025-12-08 10:41:32,708] Trial 15 finished with value: 0.2384615897182197 and parameters: {'model_type': 'graphsage', 'hidden_dims': '[256, 128]', 'dropout': 0.4016092173964063, 'batch_norm': False, 'sage_aggr': 'max', 'sage_normalize': True, 'sage_project': False, 'lr': 3.5277241717378875e-05, 'weight_decay': 0.0002470659269008767, 'epochs': 116, 'loss': 'mae', 'optimizer': 'adam', 'graph_mode': 'knn', 'knn_k': 4, 'weighted_edges': True, 'symmetrize_mode': 'union', 'self_loops': False, 'use_snp_selection': True, 'num_snps': 16630}. Best is trial 7 with value: 0.2682052850038773.
[I 2025-12-08 10:43:29,419] Trial 16 finished with value: 0.2619124450440812 and parameters: {'model_type': 'graphsage', 'hidden_dims': '[512, 64]', 'dropout': 0.23222163473299473, 'batch_norm': True, 'sage_aggr': 'max', 'sage_normalize': True, 'sage_project': False, 'lr': 0.0021029989821283067, 'weight_decay': 6.094672304568381e-05, 'epochs': 186, 'loss': 'mae', 'optimizer': 'adam', 'graph_mode': 'knn', 'knn_k': 2, 'weighted_edges': True, 'symmetrize_mode': 'union', 'self_loops': False, 'use_snp_selection': True, 'num_snps': 42760}. Best is trial 7 with value: 0.2682052850038773.
[I 2025-12-08 10:47:28,660] Trial 17 finished with value: 0.24908107978643274 and parameters: {'model_type': 'graphsage', 'hidden_dims': '[512, 128]', 'dropout': 0.3972315889162996, 'batch_norm': False, 'sage_aggr': 'max', 'sage_normalize': False, 'sage_project': False, 'lr': 3.11209847943503e-05, 'weight_decay': 0.0004964272443268107, 'epochs': 242, 'loss': 'mse', 'optimizer': 'adam', 'graph_mode': 'knn', 'knn_k': 6, 'weighted_edges': False, 'symmetrize_mode': 'mutual', 'self_loops': True, 'use_snp_selection': True, 'num_snps': 59682}. Best is trial 7 with value: 0.2682052850038773.
[I 2025-12-08 10:48:43,817] Trial 18 finished with value: 0.24375036385016627 and parameters: {'model_type': 'graphsage', 'hidden_dims': '[512, 128]', 'dropout': 0.3020521484715857, 'batch_norm': False, 'sage_aggr': 'mean', 'sage_normalize': True, 'sage_project': False, 'lr': 0.00016810825443956012, 'weight_decay': 1.4489288563582195e-05, 'epochs': 148, 'loss': 'mse', 'optimizer': 'adam', 'graph_mode': 'cutoff', 'cutoff': 0.8781219337374944, 'grm_norm': 'cosine', 'self_loops': True, 'use_snp_selection': False}. Best is trial 7 with value: 0.2682052850038773.
[I 2025-12-08 10:49:49,952] Trial 19 finished with value: 0.24267560777123998 and parameters: {'model_type': 'graphsage', 'hidden_dims': '[512, 64]', 'dropout': 0.5684346716934683, 'batch_norm': True, 'sage_aggr': 'max', 'sage_normalize': False, 'sage_project': False, 'lr': 0.00012715577818850243, 'weight_decay': 8.490435515325556e-05, 'epochs': 42, 'loss': 'mae', 'optimizer': 'adam', 'graph_mode': 'knn', 'knn_k': 10, 'weighted_edges': True, 'symmetrize_mode': 'union', 'self_loops': False, 'use_snp_selection': True, 'num_snps': 29402}. Best is trial 7 with value: 0.2682052850038773.
[I 2025-12-08 10:52:37,245] Trial 20 finished with value: 0.04167340531515455 and parameters: {'model_type': 'graphsage', 'hidden_dims': '[256, 128, 64]', 'dropout': 0.20011643156264247, 'batch_norm': False, 'sage_aggr': 'max', 'sage_normalize': True, 'sage_project': False, 'lr': 0.0010821374911652206, 'weight_decay': 0.0005366393723477964, 'epochs': 199, 'loss': 'mae', 'optimizer': 'adam', 'graph_mode': 'knn', 'knn_k': 8, 'weighted_edges': False, 'symmetrize_mode': 'mutual', 'self_loops': True, 'use_snp_selection': True, 'num_snps': 50272}. Best is trial 7 with value: 0.2682052850038773.
[I 2025-12-08 10:54:10,996] Trial 21 finished with value: 0.2535959181761897 and parameters: {'model_type': 'graphsage', 'hidden_dims': '[512, 256]', 'dropout': 0.2752056973765205, 'batch_norm': False, 'sage_aggr': 'max', 'sage_normalize': False, 'sage_project': False, 'lr': 8.888646072232485e-05, 'weight_decay': 4.3956737861734336e-05, 'epochs': 141, 'loss': 'mae', 'optimizer': 'adam', 'graph_mode': 'cutoff', 'cutoff': 0.32782714888374875, 'grm_norm': 'gcn', 'self_loops': False, 'use_snp_selection': True, 'num_snps': 35473}. Best is trial 7 with value: 0.2682052850038773.
[I 2025-12-08 10:55:25,796] Trial 22 finished with value: 0.24205651811770007 and parameters: {'model_type': 'graphsage', 'hidden_dims': '[512, 256]', 'dropout': 0.2710262159638379, 'batch_norm': False, 'sage_aggr': 'max', 'sage_normalize': False, 'sage_project': False, 'lr': 2.6560560012515073e-05, 'weight_decay': 1.8466338393276456e-05, 'epochs': 90, 'loss': 'mae', 'optimizer': 'adam', 'graph_mode': 'cutoff', 'cutoff': 0.46254047881637506, 'grm_norm': 'gcn', 'self_loops': False, 'use_snp_selection': True, 'num_snps': 39786}. Best is trial 7 with value: 0.2682052850038773.
[I 2025-12-08 10:56:24,601] Trial 23 finished with value: 0.26385204433499226 and parameters: {'model_type': 'graphsage', 'hidden_dims': '[512, 256]', 'dropout': 0.31662886456152817, 'batch_norm': False, 'sage_aggr': 'max', 'sage_normalize': False, 'sage_project': False, 'lr': 5.66445518741512e-05, 'weight_decay': 0.00011138189688731992, 'epochs': 163, 'loss': 'mae', 'optimizer': 'adam', 'graph_mode': 'cutoff', 'cutoff': 0.5701906554289855, 'grm_norm': 'gcn', 'self_loops': False, 'use_snp_selection': True, 'num_snps': 22531}. Best is trial 7 with value: 0.2682052850038773.
[I 2025-12-08 10:58:21,268] Trial 24 finished with value: 0.24831317921016974 and parameters: {'model_type': 'graphsage', 'hidden_dims': '[512, 256]', 'dropout': 0.22867932725836804, 'batch_norm': False, 'sage_aggr': 'max', 'sage_normalize': False, 'sage_project': False, 'lr': 0.00021055071014667955, 'weight_decay': 0.0003894887928323972, 'epochs': 136, 'loss': 'mae', 'optimizer': 'adam', 'graph_mode': 'cutoff', 'cutoff': 0.4246896489101385, 'grm_norm': 'cosine', 'self_loops': False, 'use_snp_selection': True, 'num_snps': 50637}. Best is trial 7 with value: 0.2682052850038773.
[I 2025-12-08 10:59:17,987] Trial 25 finished with value: 0.2675728195752508 and parameters: {'model_type': 'graphsage', 'hidden_dims': '[128, 64]', 'dropout': 0.3747822351341761, 'batch_norm': False, 'sage_aggr': 'max', 'sage_normalize': False, 'sage_project': False, 'lr': 7.776286290509217e-05, 'weight_decay': 3.9242518514587354e-05, 'epochs': 258, 'loss': 'mae', 'optimizer': 'adam', 'graph_mode': 'cutoff', 'cutoff': 0.6854927177982701, 'grm_norm': 'cosine_then_gcn', 'self_loops': False, 'use_snp_selection': True, 'num_snps': 32360}. Best is trial 7 with value: 0.2682052850038773.
[I 2025-12-08 11:00:05,037] Trial 26 finished with value: 0.2715068511140044 and parameters: {'model_type': 'graphsage', 'hidden_dims': '[128, 64]', 'dropout': 0.37656470528686836, 'batch_norm': True, 'sage_aggr': 'max', 'sage_normalize': False, 'sage_project': False, 'lr': 2.3539723170009003e-05, 'weight_decay': 6.2146586263065036e-06, 'epochs': 267, 'loss': 'mse', 'optimizer': 'adam', 'graph_mode': 'cutoff', 'cutoff': 0.7109837425832898, 'grm_norm': 'cosine_then_gcn', 'self_loops': False, 'use_snp_selection': False}. Best is trial 26 with value: 0.2715068511140044.
[I 2025-12-08 11:00:51,788] Trial 27 finished with value: 0.27433001243192623 and parameters: {'model_type': 'graphsage', 'hidden_dims': '[128, 64]', 'dropout': 0.48807446261649595, 'batch_norm': True, 'sage_aggr': 'mean', 'sage_normalize': False, 'sage_project': False, 'lr': 1.0441320530792826e-05, 'weight_decay': 7.699705347626554e-06, 'epochs': 258, 'loss': 'mae', 'optimizer': 'adam', 'graph_mode': 'cutoff', 'cutoff': 0.7143943175673989, 'grm_norm': 'cosine_then_gcn', 'self_loops': False, 'use_snp_selection': False}. Best is trial 27 with value: 0.27433001243192623.
[I 2025-12-08 11:01:50,465] Trial 28 finished with value: 0.2607897267073074 and parameters: {'model_type': 'graphsage', 'hidden_dims': '[128, 64]', 'dropout': 0.4558871312470506, 'batch_norm': True, 'sage_aggr': 'mean', 'sage_normalize': True, 'sage_project': False, 'lr': 1.089968859529795e-05, 'weight_decay': 4.231631269495629e-06, 'epochs': 340, 'loss': 'mse', 'optimizer': 'adam', 'graph_mode': 'cutoff', 'cutoff': 0.759261518705469, 'grm_norm': 'cosine_then_gcn', 'self_loops': False, 'use_snp_selection': False}. Best is trial 27 with value: 0.27433001243192623.
[I 2025-12-08 11:02:38,020] Trial 29 finished with value: 0.2717502613933615 and parameters: {'model_type': 'graphsage', 'hidden_dims': '[128, 64]', 'dropout': 0.5082524904712666, 'batch_norm': True, 'sage_aggr': 'mean', 'sage_normalize': True, 'sage_project': False, 'lr': 2.1239880158215368e-05, 'weight_decay': 1.0322341550424723e-06, 'epochs': 262, 'loss': 'mse', 'optimizer': 'adam', 'graph_mode': 'cutoff', 'cutoff': 0.8816414267949, 'grm_norm': 'cosine_then_gcn', 'self_loops': False, 'use_snp_selection': False}. Best is trial 27 with value: 0.27433001243192623.
[I 2025-12-08 11:03:27,385] Trial 30 finished with value: 0.2655639987156697 and parameters: {'model_type': 'graphsage', 'hidden_dims': '[128, 64]', 'dropout': 0.5081523405444226, 'batch_norm': True, 'sage_aggr': 'mean', 'sage_normalize': False, 'sage_project': False, 'lr': 2.1517261094853404e-05, 'weight_decay': 8.940368370498738e-07, 'epochs': 276, 'loss': 'mse', 'optimizer': 'adam', 'graph_mode': 'cutoff', 'cutoff': 0.8906832403637103, 'grm_norm': 'cosine_then_gcn', 'self_loops': False, 'use_snp_selection': False}. Best is trial 27 with value: 0.27433001243192623.
[I 2025-12-08 11:04:21,331] Trial 31 finished with value: 0.26519288870707725 and parameters: {'model_type': 'graphsage', 'hidden_dims': '[128, 64]', 'dropout': 0.4752062683736772, 'batch_norm': True, 'sage_aggr': 'mean', 'sage_normalize': True, 'sage_project': False, 'lr': 1.0399296830950873e-05, 'weight_decay': 9.92606364629176e-07, 'epochs': 307, 'loss': 'mse', 'optimizer': 'adam', 'graph_mode': 'cutoff', 'cutoff': 0.7485912895390888, 'grm_norm': 'cosine_then_gcn', 'self_loops': False, 'use_snp_selection': False}. Best is trial 27 with value: 0.27433001243192623.
[I 2025-12-08 11:05:08,276] Trial 32 finished with value: 0.262644112402081 and parameters: {'model_type': 'graphsage', 'hidden_dims': '[128, 64]', 'dropout': 0.5782992317651293, 'batch_norm': True, 'sage_aggr': 'mean', 'sage_normalize': True, 'sage_project': False, 'lr': 1.9595004870925045e-05, 'weight_decay': 3.8202921863959406e-07, 'epochs': 256, 'loss': 'mse', 'optimizer': 'adam', 'graph_mode': 'cutoff', 'cutoff': 0.6605303308566104, 'grm_norm': 'cosine_then_gcn', 'self_loops': False, 'use_snp_selection': False}. Best is trial 27 with value: 0.27433001243192623.
[I 2025-12-08 11:05:48,569] Trial 33 finished with value: 0.2692271036572107 and parameters: {'model_type': 'graphsage', 'hidden_dims': '[128, 64]', 'dropout': 0.5172238350066837, 'batch_norm': True, 'sage_aggr': 'mean', 'sage_normalize': True, 'sage_project': False, 'lr': 4.248733519535222e-05, 'weight_decay': 5.519949778153376e-06, 'epochs': 211, 'loss': 'mse', 'optimizer': 'adam', 'graph_mode': 'cutoff', 'cutoff': 0.8390915759827569, 'grm_norm': 'cosine_then_gcn', 'self_loops': False, 'use_snp_selection': False}. Best is trial 27 with value: 0.27433001243192623.
[I 2025-12-08 11:06:29,302] Trial 34 finished with value: 0.26733439398972086 and parameters: {'model_type': 'graphsage', 'hidden_dims': '[128, 64]', 'dropout': 0.4995618560228332, 'batch_norm': True, 'sage_aggr': 'mean', 'sage_normalize': True, 'sage_project': False, 'lr': 1.6040029915107886e-05, 'weight_decay': 6.06766630615738e-06, 'epochs': 214, 'loss': 'mse', 'optimizer': 'adam', 'graph_mode': 'cutoff', 'cutoff': 0.8220578511550473, 'grm_norm': 'cosine_then_gcn', 'self_loops': False, 'use_snp_selection': False}. Best is trial 27 with value: 0.27433001243192623.
[I 2025-12-08 11:07:14,656] Trial 35 finished with value: 0.2602447309844784 and parameters: {'model_type': 'graphsage', 'hidden_dims': '[128, 64]', 'dropout': 0.5989559710409709, 'batch_norm': True, 'sage_aggr': 'mean', 'sage_normalize': True, 'sage_project': False, 'lr': 3.53383863499464e-05, 'weight_decay': 1.8844503676497598e-06, 'epochs': 247, 'loss': 'mse', 'optimizer': 'adam', 'graph_mode': 'cutoff', 'cutoff': 0.8246257256239562, 'grm_norm': 'cosine_then_gcn', 'self_loops': False, 'use_snp_selection': False}. Best is trial 27 with value: 0.27433001243192623.
[I 2025-12-08 11:08:03,008] Trial 36 finished with value: 0.26297410435354235 and parameters: {'model_type': 'graphsage', 'hidden_dims': '[128, 64]', 'dropout': 0.440204044884733, 'batch_norm': True, 'sage_aggr': 'mean', 'sage_normalize': False, 'sage_project': False, 'lr': 1.3700034007621076e-05, 'weight_decay': 8.870402892160817e-06, 'epochs': 268, 'loss': 'mse', 'optimizer': 'adam', 'graph_mode': 'cutoff', 'cutoff': 0.6784978919919973, 'grm_norm': 'cosine_then_gcn', 'self_loops': False, 'use_snp_selection': False}. Best is trial 27 with value: 0.27433001243192623.
