[I 2025-12-06 08:06:19,438] Trial 97 finished with value: 0.1895399081380883 and parameters: {'model_type': 'graphsage', 'hidden_dims': '[512, 64]', 'dropout': 0.32088423507932756, 'batch_norm': True, 'sage_aggr': 'max', 'sage_normalize': False, 'sage_project': False, 'lr': 0.0001261965584653553, 'weight_decay': 0.00017756709076819448, 'epochs': 81, 'loss': 'mae', 'optimizer': 'adam', 'graph_mode': 'cutoff', 'cutoff': 0.2578962046868194, 'grm_norm': 'gcn', 'self_loops': False, 'use_snp_selection': True, 'num_snps': 35922, 'graphsage_batch_size': 8}. Best is trial 55 with value: 0.2351501566550843.
[I 2025-12-06 08:06:48,218] Trial 98 finished with value: 0.19656044312488055 and parameters: {'model_type': 'graphsage', 'hidden_dims': '[256, 128, 64]', 'dropout': 0.28806542317948775, 'batch_norm': True, 'sage_aggr': 'max', 'sage_normalize': False, 'sage_project': False, 'lr': 5.012560719878103e-05, 'weight_decay': 0.0005019125652816885, 'epochs': 48, 'loss': 'mae', 'optimizer': 'adam', 'graph_mode': 'cutoff', 'cutoff': 0.40680180349736084, 'grm_norm': 'gcn', 'self_loops': False, 'use_snp_selection': False, 'graphsage_batch_size': 8}. Best is trial 55 with value: 0.2351501566550843.
[I 2025-12-06 08:07:42,837] Trial 99 finished with value: 0.2178315680208332 and parameters: {'model_type': 'graphsage', 'hidden_dims': '[512, 64]', 'dropout': 0.234498750706052, 'batch_norm': True, 'sage_aggr': 'max', 'sage_normalize': False, 'sage_project': False, 'lr': 0.00010222725686171915, 'weight_decay': 0.00023046702042998966, 'epochs': 70, 'loss': 'mse', 'optimizer': 'adam', 'graph_mode': 'cutoff', 'cutoff': 0.4543235083250481, 'grm_norm': 'gcn', 'self_loops': False, 'use_snp_selection': True, 'num_snps': 38862, 'graphsage_batch_size': 32}. Best is trial 55 with value: 0.2351501566550843.
[I 2025-12-06 08:08:21,014] Trial 100 finished with value: 0.2044149646586965 and parameters: {'model_type': 'graphsage', 'hidden_dims': '[512, 64]', 'dropout': 0.30095689932628367, 'batch_norm': True, 'sage_aggr': 'max', 'sage_normalize': False, 'sage_project': False, 'lr': 7.566452047219818e-05, 'weight_decay': 8.217767954082209e-05, 'epochs': 61, 'loss': 'mae', 'optimizer': 'adam', 'graph_mode': 'cutoff', 'cutoff': 0.5406134724430794, 'grm_norm': 'gcn', 'self_loops': False, 'use_snp_selection': True, 'num_snps': 31771, 'graphsage_batch_size': 8}. Best is trial 55 with value: 0.2351501566550843.
[I 2025-12-06 08:09:35,209] Trial 101 finished with value: 0.22449437009862 and parameters: {'model_type': 'graphsage', 'hidden_dims': '[512, 64]', 'dropout': 0.3192768427348139, 'batch_norm': True, 'sage_aggr': 'max', 'sage_normalize': False, 'sage_project': False, 'lr': 0.00016029736099327333, 'weight_decay': 0.000307815058168172, 'epochs': 116, 'loss': 'mae', 'optimizer': 'adam', 'graph_mode': 'cutoff', 'cutoff': 0.34199252951292614, 'grm_norm': 'gcn', 'self_loops': False, 'use_snp_selection': True, 'num_snps': 33528, 'graphsage_batch_size': 8}. Best is trial 55 with value: 0.2351501566550843.
[I 2025-12-06 08:10:32,645] Trial 102 finished with value: 0.23493455311755182 and parameters: {'model_type': 'graphsage', 'hidden_dims': '[512, 64]', 'dropout': 0.34988664195336294, 'batch_norm': True, 'sage_aggr': 'max', 'sage_normalize': False, 'sage_project': False, 'lr': 0.0001337403880977994, 'weight_decay': 0.00037860295896648003, 'epochs': 106, 'loss': 'mae', 'optimizer': 'adam', 'graph_mode': 'cutoff', 'cutoff': 0.38889208736684605, 'grm_norm': 'gcn', 'self_loops': False, 'use_snp_selection': True, 'num_snps': 29216, 'graphsage_batch_size': 8}. Best is trial 55 with value: 0.2351501566550843.
[I 2025-12-06 08:11:32,118] Trial 103 finished with value: 0.22663947169142387 and parameters: {'model_type': 'graphsage', 'hidden_dims': '[512, 64]', 'dropout': 0.3495356137789275, 'batch_norm': True, 'sage_aggr': 'max', 'sage_normalize': False, 'sage_project': False, 'lr': 0.0001294941254856247, 'weight_decay': 0.00044394551825129074, 'epochs': 106, 'loss': 'mae', 'optimizer': 'adam', 'graph_mode': 'cutoff', 'cutoff': 0.38206040580506007, 'grm_norm': 'gcn', 'self_loops': False, 'use_snp_selection': True, 'num_snps': 29511, 'graphsage_batch_size': 8}. Best is trial 55 with value: 0.2351501566550843.
[I 2025-12-06 08:12:18,776] Trial 104 finished with value: 0.23038464432776928 and parameters: {'model_type': 'graphsage', 'hidden_dims': '[512, 64]', 'dropout': 0.35069364492145594, 'batch_norm': True, 'sage_aggr': 'max', 'sage_normalize': False, 'sage_project': False, 'lr': 0.00021091974699657647, 'weight_decay': 0.0005930203206415382, 'epochs': 72, 'loss': 'mae', 'optimizer': 'adam', 'graph_mode': 'cutoff', 'cutoff': 0.38747436430462745, 'grm_norm': 'gcn', 'self_loops': False, 'use_snp_selection': True, 'num_snps': 29416, 'graphsage_batch_size': 8}. Best is trial 55 with value: 0.2351501566550843.
[I 2025-12-06 08:13:15,436] Trial 105 finished with value: 0.23592098489947694 and parameters: {'model_type': 'graphsage', 'hidden_dims': '[512, 64]', 'dropout': 0.36933634965728207, 'batch_norm': True, 'sage_aggr': 'max', 'sage_normalize': False, 'sage_project': False, 'lr': 0.00021141567464710173, 'weight_decay': 0.0003545634951514558, 'epochs': 99, 'loss': 'mae', 'optimizer': 'adam', 'graph_mode': 'cutoff', 'cutoff': 0.3861135822988432, 'grm_norm': 'gcn', 'self_loops': False, 'use_snp_selection': True, 'num_snps': 29789, 'graphsage_batch_size': 8}. Best is trial 105 with value: 0.23592098489947694.
[I 2025-12-06 08:13:44,779] Trial 106 finished with value: 0.2094342556819925 and parameters: {'model_type': 'graphsage', 'hidden_dims': '[128, 64]', 'dropout': 0.37995441901912447, 'batch_norm': True, 'sage_aggr': 'max', 'sage_normalize': False, 'sage_project': False, 'lr': 0.00024272596079176172, 'weight_decay': 7.239873803842981e-06, 'epochs': 70, 'loss': 'mae', 'optimizer': 'adam', 'graph_mode': 'cutoff', 'cutoff': 0.4300288992779081, 'grm_norm': 'cosine', 'self_loops': False, 'use_snp_selection': True, 'num_snps': 27079, 'graphsage_batch_size': 8}. Best is trial 105 with value: 0.23592098489947694.
[I 2025-12-06 08:14:19,959] Trial 107 finished with value: 0.20084241433789612 and parameters: {'model_type': 'graphsage', 'hidden_dims': '[256, 128]', 'dropout': 0.37038793126244557, 'batch_norm': True, 'sage_aggr': 'max', 'sage_normalize': False, 'sage_project': False, 'lr': 0.00021155137525252595, 'weight_decay': 0.0005799055313144195, 'epochs': 85, 'loss': 'mae', 'optimizer': 'adam', 'graph_mode': 'cutoff', 'cutoff': 0.5015195586250762, 'grm_norm': 'gcn', 'self_loops': False, 'use_snp_selection': True, 'num_snps': 29481, 'graphsage_batch_size': 8}. Best is trial 105 with value: 0.23592098489947694.
[I 2025-12-06 08:14:58,261] Trial 108 finished with value: 0.17944505090700763 and parameters: {'model_type': 'graphsage', 'hidden_dims': '[512, 128]', 'dropout': 0.3521714955191348, 'batch_norm': True, 'sage_aggr': 'max', 'sage_normalize': False, 'sage_project': False, 'lr': 0.0002975566290546705, 'weight_decay': 0.00036553531575156053, 'epochs': 72, 'loss': 'mae', 'optimizer': 'adam', 'graph_mode': 'knn', 'knn_k': 5, 'weighted_edges': False, 'symmetrize_mode': 'mutual', 'self_loops': False, 'use_snp_selection': True, 'num_snps': 24582, 'graphsage_batch_size': 8}. Best is trial 105 with value: 0.23592098489947694.
[I 2025-12-06 08:15:48,358] Trial 109 finished with value: 0.0029092668158507058 and parameters: {'model_type': 'graphsage', 'hidden_dims': '[512, 64]', 'dropout': 0.4143078145146304, 'batch_norm': False, 'sage_aggr': 'max', 'sage_normalize': False, 'sage_project': False, 'lr': 0.00038870223741040855, 'weight_decay': 0.0002498262475611173, 'epochs': 98, 'loss': 'mae', 'optimizer': 'adam', 'graph_mode': 'cutoff', 'cutoff': 0.38986363655983064, 'grm_norm': 'gcn', 'self_loops': False, 'use_snp_selection': True, 'num_snps': 26284, 'graphsage_batch_size': 128}. Best is trial 105 with value: 0.23592098489947694.
[I 2025-12-06 08:16:37,811] Trial 110 finished with value: 0.22182774808089062 and parameters: {'model_type': 'graphsage', 'hidden_dims': '[512, 64]', 'dropout': 0.33676560275162637, 'batch_norm': True, 'sage_aggr': 'max', 'sage_normalize': False, 'sage_project': False, 'lr': 0.00017571425110589803, 'weight_decay': 0.0007590882924197654, 'epochs': 91, 'loss': 'mae', 'optimizer': 'adam', 'graph_mode': 'cutoff', 'cutoff': 0.4657617398135218, 'grm_norm': 'gcn', 'self_loops': False, 'use_snp_selection': True, 'num_snps': 28796, 'graphsage_batch_size': 16}. Best is trial 105 with value: 0.23592098489947694.
[I 2025-12-06 08:17:37,127] Trial 111 finished with value: 0.23482363587193347 and parameters: {'model_type': 'graphsage', 'hidden_dims': '[512, 64]', 'dropout': 0.3488106889122444, 'batch_norm': True, 'sage_aggr': 'max', 'sage_normalize': False, 'sage_project': False, 'lr': 0.00014240835845161313, 'weight_decay': 0.00043923160593310523, 'epochs': 109, 'loss': 'mae', 'optimizer': 'adam', 'graph_mode': 'cutoff', 'cutoff': 0.38659766139639457, 'grm_norm': 'gcn', 'self_loops': False, 'use_snp_selection': True, 'num_snps': 30167, 'graphsage_batch_size': 8}. Best is trial 105 with value: 0.23592098489947694.
[I 2025-12-06 08:18:44,757] Trial 112 finished with value: 0.22586656163614274 and parameters: {'model_type': 'graphsage', 'hidden_dims': '[512, 64]', 'dropout': 0.38715353747232417, 'batch_norm': True, 'sage_aggr': 'max', 'sage_normalize': False, 'sage_project': False, 'lr': 0.0002750084493724186, 'weight_decay': 0.0005917865842365326, 'epochs': 121, 'loss': 'mae', 'optimizer': 'adam', 'graph_mode': 'cutoff', 'cutoff': 0.3697773619389713, 'grm_norm': 'gcn', 'self_loops': False, 'use_snp_selection': True, 'num_snps': 30797, 'graphsage_batch_size': 8}. Best is trial 105 with value: 0.23592098489947694.
[I 2025-12-06 08:19:51,744] Trial 113 finished with value: 0.21958572924300798 and parameters: {'model_type': 'graphsage', 'hidden_dims': '[512, 64]', 'dropout': 0.37114199427765515, 'batch_norm': True, 'sage_aggr': 'max', 'sage_normalize': False, 'sage_project': False, 'lr': 0.00019013192765359862, 'weight_decay': 0.0009539550254029326, 'epochs': 112, 'loss': 'mae', 'optimizer': 'adam', 'graph_mode': 'cutoff', 'cutoff': 0.42773063546483087, 'grm_norm': 'gcn', 'self_loops': False, 'use_snp_selection': True, 'num_snps': 33602, 'graphsage_batch_size': 8}. Best is trial 105 with value: 0.23592098489947694.
[I 2025-12-06 08:20:29,386] Trial 114 finished with value: 0.22394459390382773 and parameters: {'model_type': 'graphsage', 'hidden_dims': '[512, 64]', 'dropout': 0.40443056485190676, 'batch_norm': True, 'sage_aggr': 'max', 'sage_normalize': False, 'sage_project': False, 'lr': 0.00014189883794626186, 'weight_decay': 0.00036593296568670884, 'epochs': 53, 'loss': 'mae', 'optimizer': 'adam', 'graph_mode': 'cutoff', 'cutoff': 0.4100858283853491, 'grm_norm': 'gcn', 'self_loops': False, 'use_snp_selection': True, 'num_snps': 28264, 'graphsage_batch_size': 8}. Best is trial 105 with value: 0.23592098489947694.
[I 2025-12-06 08:21:22,851] Trial 115 finished with value: 0.2295573119094773 and parameters: {'model_type': 'graphsage', 'hidden_dims': '[512, 64]', 'dropout': 0.3252986337947616, 'batch_norm': True, 'sage_aggr': 'max', 'sage_normalize': False, 'sage_project': False, 'lr': 0.0001595883505942748, 'weight_decay': 0.00046387471889391935, 'epochs': 81, 'loss': 'mae', 'optimizer': 'adam', 'graph_mode': 'cutoff', 'cutoff': 0.3390442065582592, 'grm_norm': 'gcn', 'self_loops': False, 'use_snp_selection': True, 'num_snps': 30344, 'graphsage_batch_size': 8}. Best is trial 105 with value: 0.23592098489947694.
[I 2025-12-06 08:22:17,025] Trial 116 finished with value: 0.19039689411149074 and parameters: {'model_type': 'graphsage', 'hidden_dims': '[512, 64]', 'dropout': 0.35625919161601466, 'batch_norm': True, 'sage_aggr': 'max', 'sage_normalize': False, 'sage_project': False, 'lr': 1.0106401752364674e-05, 'weight_decay': 0.000292979106202325, 'epochs': 81, 'loss': 'mae', 'optimizer': 'adam', 'graph_mode': 'cutoff', 'cutoff': 0.33465979738261764, 'grm_norm': 'gcn', 'self_loops': False, 'use_snp_selection': True, 'num_snps': 30106, 'graphsage_batch_size': 512}. Best is trial 105 with value: 0.23592098489947694.
[I 2025-12-06 08:23:44,936] Trial 117 finished with value: 0.20483264824313605 and parameters: {'model_type': 'graphsage', 'hidden_dims': '[512, 64]', 'dropout': 0.34332534715334356, 'batch_norm': True, 'sage_aggr': 'max', 'sage_normalize': False, 'sage_project': False, 'lr': 0.00016168020812467403, 'weight_decay': 0.0004667521958350611, 'epochs': 101, 'loss': 'mae', 'optimizer': 'adam', 'graph_mode': 'cutoff', 'cutoff': 0.3027628905430048, 'grm_norm': 'cosine_then_gcn', 'self_loops': False, 'use_snp_selection': False, 'graphsage_batch_size': 8}. Best is trial 105 with value: 0.23592098489947694.
[I 2025-12-06 08:24:40,955] Trial 118 finished with value: 0.23266280586068883 and parameters: {'model_type': 'graphsage', 'hidden_dims': '[512, 64]', 'dropout': 0.3242890494498525, 'batch_norm': True, 'sage_aggr': 'max', 'sage_normalize': False, 'sage_project': False, 'lr': 0.00021929765687395903, 'weight_decay': 0.0002059108435277765, 'epochs': 88, 'loss': 'mae', 'optimizer': 'adam', 'graph_mode': 'cutoff', 'cutoff': 0.3899165520640069, 'grm_norm': 'gcn', 'self_loops': False, 'use_snp_selection': True, 'num_snps': 32113, 'graphsage_batch_size': 8}. Best is trial 105 with value: 0.23592098489947694.
[I 2025-12-06 08:25:52,844] Trial 119 finished with value: 0.21179802596365352 and parameters: {'model_type': 'graphsage', 'hidden_dims': '[512, 64]', 'dropout': 0.3315314632843429, 'batch_norm': True, 'sage_aggr': 'max', 'sage_normalize': False, 'sage_project': False, 'lr': 0.00033763776120604726, 'weight_decay': 0.0006943740721825362, 'epochs': 89, 'loss': 'mae', 'optimizer': 'adam', 'graph_mode': 'cutoff', 'cutoff': 0.32564576118576105, 'grm_norm': 'gcn', 'self_loops': False, 'use_snp_selection': True, 'num_snps': 36063, 'graphsage_batch_size': 64}. Best is trial 105 with value: 0.23592098489947694.
[I 2025-12-06 08:26:52,890] Trial 120 finished with value: 0.2253505231354711 and parameters: {'model_type': 'graphsage', 'hidden_dims': '[512, 64]', 'dropout': 0.3645788743045051, 'batch_norm': True, 'sage_aggr': 'max', 'sage_normalize': False, 'sage_project': False, 'lr': 0.0002559657921185138, 'weight_decay': 0.0002287835905647268, 'epochs': 77, 'loss': 'mae', 'optimizer': 'adam', 'graph_mode': 'cutoff', 'cutoff': 0.39208120242825395, 'grm_norm': 'gcn', 'self_loops': False, 'use_snp_selection': True, 'num_snps': 37809, 'graphsage_batch_size': 8}. Best is trial 105 with value: 0.23592098489947694.
[I 2025-12-06 08:27:52,274] Trial 121 finished with value: 0.22884320176461959 and parameters: {'model_type': 'graphsage', 'hidden_dims': '[512, 64]', 'dropout': 0.3213379641169916, 'batch_norm': True, 'sage_aggr': 'max', 'sage_normalize': False, 'sage_project': False, 'lr': 0.0002085650663836871, 'weight_decay': 0.00034450091095157776, 'epochs': 93, 'loss': 'mae', 'optimizer': 'adam', 'graph_mode': 'cutoff', 'cutoff': 0.36928569376169046, 'grm_norm': 'gcn', 'self_loops': False, 'use_snp_selection': True, 'num_snps': 31873, 'graphsage_batch_size': 8}. Best is trial 105 with value: 0.23592098489947694.
[I 2025-12-06 08:28:52,503] Trial 122 finished with value: 0.22945270893461686 and parameters: {'model_type': 'graphsage', 'hidden_dims': '[512, 64]', 'dropout': 0.3252593129885493, 'batch_norm': True, 'sage_aggr': 'max', 'sage_normalize': False, 'sage_project': False, 'lr': 0.00021508833092023517, 'weight_decay': 0.0004166115354700909, 'epochs': 94, 'loss': 'mae', 'optimizer': 'adam', 'graph_mode': 'cutoff', 'cutoff': 0.3694384084508629, 'grm_norm': 'gcn', 'self_loops': False, 'use_snp_selection': True, 'num_snps': 31783, 'graphsage_batch_size': 8}. Best is trial 105 with value: 0.23592098489947694.
[I 2025-12-06 08:29:52,153] Trial 123 finished with value: 0.2260300535826434 and parameters: {'model_type': 'graphsage', 'hidden_dims': '[512, 64]', 'dropout': 0.3802208148147236, 'batch_norm': True, 'sage_aggr': 'max', 'sage_normalize': False, 'sage_project': False, 'lr': 0.0002468632520956411, 'weight_decay': 0.0005055249533987385, 'epochs': 83, 'loss': 'mae', 'optimizer': 'adam', 'graph_mode': 'cutoff', 'cutoff': 0.34445368098855167, 'grm_norm': 'gcn', 'self_loops': False, 'use_snp_selection': True, 'num_snps': 34676, 'graphsage_batch_size': 8}. Best is trial 105 with value: 0.23592098489947694.
[I 2025-12-06 08:31:11,696] Trial 124 finished with value: 0.22100059546862405 and parameters: {'model_type': 'graphsage', 'hidden_dims': '[512, 64]', 'dropout': 0.30882338746259913, 'batch_norm': True, 'sage_aggr': 'max', 'sage_normalize': False, 'sage_project': False, 'lr': 0.0001730171180978454, 'weight_decay': 0.00040161739099337494, 'epochs': 108, 'loss': 'mae', 'optimizer': 'adam', 'graph_mode': 'cutoff', 'cutoff': 0.2970611116181885, 'grm_norm': 'gcn', 'self_loops': False, 'use_snp_selection': True, 'num_snps': 32979, 'graphsage_batch_size': 8}. Best is trial 105 with value: 0.23592098489947694.
[I 2025-12-06 08:32:08,780] Trial 125 finished with value: 0.22640219623582536 and parameters: {'model_type': 'graphsage', 'hidden_dims': '[512, 64]', 'dropout': 0.33850293792493635, 'batch_norm': True, 'sage_aggr': 'max', 'sage_normalize': False, 'sage_project': False, 'lr': 0.00022428344988448148, 'weight_decay': 0.0001878213054824894, 'epochs': 87, 'loss': 'mse', 'optimizer': 'adam', 'graph_mode': 'cutoff', 'cutoff': 0.3534944435031503, 'grm_norm': 'gcn', 'self_loops': False, 'use_snp_selection': True, 'num_snps': 31279, 'graphsage_batch_size': 8}. Best is trial 105 with value: 0.23592098489947694.
[I 2025-12-06 08:32:45,354] Trial 126 finished with value: 0.22096382728109662 and parameters: {'model_type': 'graphsage', 'hidden_dims': '[256, 128, 64]', 'dropout': 0.34967974607536106, 'batch_norm': True, 'sage_aggr': 'max', 'sage_normalize': False, 'sage_project': False, 'lr': 0.00013356495871779016, 'weight_decay': 0.0002601338031609605, 'epochs': 60, 'loss': 'mae', 'optimizer': 'adam', 'graph_mode': 'cutoff', 'cutoff': 0.3788016788164357, 'grm_norm': 'gcn', 'self_loops': False, 'use_snp_selection': True, 'num_snps': 30116, 'graphsage_batch_size': 8}. Best is trial 105 with value: 0.23592098489947694.
[I 2025-12-06 08:33:52,753] Trial 127 finished with value: 0.21347063224122326 and parameters: {'model_type': 'graphsage', 'hidden_dims': '[512, 64]', 'dropout': 0.3306245076545035, 'batch_norm': True, 'sage_aggr': 'max', 'sage_normalize': False, 'sage_project': False, 'lr': 0.0003857091544214508, 'weight_decay': 0.0006040928960116961, 'epochs': 125, 'loss': 'mae', 'optimizer': 'adam', 'graph_mode': 'cutoff', 'cutoff': 0.31863057137569084, 'grm_norm': 'gcn', 'self_loops': False, 'use_snp_selection': True, 'num_snps': 27099, 'graphsage_batch_size': 32}. Best is trial 105 with value: 0.23592098489947694.
[I 2025-12-06 08:34:35,891] Trial 128 finished with value: 0.21601307559331 and parameters: {'model_type': 'graphsage', 'hidden_dims': '[256, 128]', 'dropout': 0.3661629001096728, 'batch_norm': True, 'sage_aggr': 'max', 'sage_normalize': False, 'sage_project': False, 'lr': 0.00019560821791717476, 'weight_decay': 0.00020496952934857056, 'epochs': 118, 'loss': 'mae', 'optimizer': 'adam', 'graph_mode': 'cutoff', 'cutoff': 0.39444402692867686, 'grm_norm': 'cosine', 'self_loops': False, 'use_snp_selection': True, 'num_snps': 26343, 'graphsage_batch_size': 8}. Best is trial 105 with value: 0.23592098489947694.
[I 2025-12-06 08:35:56,658] Trial 129 finished with value: 0.19212225007922826 and parameters: {'model_type': 'graphsage', 'hidden_dims': '[512, 64]', 'dropout': 0.32346699928710376, 'batch_norm': True, 'sage_aggr': 'max', 'sage_normalize': False, 'sage_project': False, 'lr': 0.0004776523587291991, 'weight_decay': 0.0008116491717504183, 'epochs': 98, 'loss': 'mae', 'optimizer': 'adam', 'graph_mode': 'knn', 'knn_k': 7, 'weighted_edges': False, 'symmetrize_mode': 'union', 'self_loops': False, 'use_snp_selection': True, 'num_snps': 32661, 'graphsage_batch_size': 8}. Best is trial 105 with value: 0.23592098489947694.
[I 2025-12-06 08:36:57,349] Trial 130 finished with value: 0.14731934126763882 and parameters: {'model_type': 'graphsage', 'hidden_dims': '[512, 64]', 'dropout': 0.3060018866209511, 'batch_norm': False, 'sage_aggr': 'max', 'sage_normalize': False, 'sage_project': False, 'lr': 0.00015290475063258645, 'weight_decay': 0.0004481318955724995, 'epochs': 113, 'loss': 'mae', 'optimizer': 'adam', 'graph_mode': 'cutoff', 'cutoff': 0.3628860341738404, 'grm_norm': 'gcn', 'self_loops': False, 'use_snp_selection': True, 'num_snps': 28311, 'graphsage_batch_size': 8}. Best is trial 105 with value: 0.23592098489947694.
[I 2025-12-06 08:37:55,320] Trial 131 finished with value: 0.22189722238919032 and parameters: {'model_type': 'graphsage', 'hidden_dims': '[512, 64]', 'dropout': 0.3156548526384371, 'batch_norm': True, 'sage_aggr': 'max', 'sage_normalize': False, 'sage_project': False, 'lr': 0.0002032399442641575, 'weight_decay': 0.00033770673948505425, 'epochs': 93, 'loss': 'mae', 'optimizer': 'adam', 'graph_mode': 'cutoff', 'cutoff': 0.3682875331297439, 'grm_norm': 'gcn', 'self_loops': False, 'use_snp_selection': True, 'num_snps': 31560, 'graphsage_batch_size': 8}. Best is trial 105 with value: 0.23592098489947694.
[I 2025-12-06 08:38:55,044] Trial 132 finished with value: 0.21717445867724408 and parameters: {'model_type': 'graphsage', 'hidden_dims': '[512, 64]', 'dropout': 0.3252139085345051, 'batch_norm': True, 'sage_aggr': 'max', 'sage_normalize': False, 'sage_project': False, 'lr': 0.00011615609969401103, 'weight_decay': 0.00028078018375233876, 'epochs': 94, 'loss': 'mae', 'optimizer': 'adam', 'graph_mode': 'cutoff', 'cutoff': 0.3410022378441433, 'grm_norm': 'gcn', 'self_loops': False, 'use_snp_selection': True, 'num_snps': 30298, 'graphsage_batch_size': 8}. Best is trial 105 with value: 0.23592098489947694.
