[I 2025-12-09 15:02:13,856] Trial 134 finished with value: 0.31755180773184677 and parameters: {'model_type': 'graphsage', 'hidden_dims': '[256, 128]', 'dropout': 0.43158343035001495, 'batch_norm': True, 'sage_aggr': 'mean', 'sage_normalize': True, 'sage_project': False, 'lr': 0.0017116445220646962, 'weight_decay': 2.515063287184357e-07, 'epochs': 282, 'loss': 'mse', 'optimizer': 'adam', 'graph_mode': 'cutoff', 'cutoff': 0.7659902646295805, 'grm_norm': 'cosine', 'self_loops': True, 'use_snp_selection': False}. Best is trial 114 with value: 0.3196654869303589.
[I 2025-12-09 15:03:26,275] Trial 135 finished with value: 0.32043748965522606 and parameters: {'model_type': 'graphsage', 'hidden_dims': '[256, 128]', 'dropout': 0.4285183014629377, 'batch_norm': True, 'sage_aggr': 'mean', 'sage_normalize': True, 'sage_project': False, 'lr': 0.0018483642477092534, 'weight_decay': 2.662886205693422e-07, 'epochs': 284, 'loss': 'mse', 'optimizer': 'adam', 'graph_mode': 'cutoff', 'cutoff': 0.8051148716857719, 'grm_norm': 'cosine', 'self_loops': True, 'use_snp_selection': False}. Best is trial 135 with value: 0.32043748965522606.
[I 2025-12-09 15:04:39,417] Trial 136 finished with value: 0.3156709068447013 and parameters: {'model_type': 'graphsage', 'hidden_dims': '[256, 128]', 'dropout': 0.44049066516544894, 'batch_norm': True, 'sage_aggr': 'mean', 'sage_normalize': True, 'sage_project': False, 'lr': 0.0017601376233050082, 'weight_decay': 2.5955771590405865e-07, 'epochs': 288, 'loss': 'mse', 'optimizer': 'adam', 'graph_mode': 'cutoff', 'cutoff': 0.8059682996503598, 'grm_norm': 'cosine', 'self_loops': True, 'use_snp_selection': False}. Best is trial 135 with value: 0.32043748965522606.
[I 2025-12-09 15:05:54,327] Trial 137 finished with value: 0.3180295606090953 and parameters: {'model_type': 'graphsage', 'hidden_dims': '[256, 128]', 'dropout': 0.4216406225236516, 'batch_norm': True, 'sage_aggr': 'mean', 'sage_normalize': True, 'sage_project': False, 'lr': 0.0023028620922217863, 'weight_decay': 3.9022057962797757e-07, 'epochs': 296, 'loss': 'mse', 'optimizer': 'adam', 'graph_mode': 'cutoff', 'cutoff': 0.7672741790914221, 'grm_norm': 'cosine', 'self_loops': True, 'use_snp_selection': False}. Best is trial 135 with value: 0.32043748965522606.
[I 2025-12-09 15:07:06,181] Trial 138 finished with value: 0.3141140238719006 and parameters: {'model_type': 'graphsage', 'hidden_dims': '[256, 128]', 'dropout': 0.42423452903163095, 'batch_norm': True, 'sage_aggr': 'mean', 'sage_normalize': True, 'sage_project': False, 'lr': 0.001266164928182884, 'weight_decay': 3.7156223572412607e-07, 'epochs': 282, 'loss': 'mse', 'optimizer': 'adam', 'graph_mode': 'cutoff', 'cutoff': 0.7683353192838842, 'grm_norm': 'cosine', 'self_loops': True, 'use_snp_selection': False}. Best is trial 135 with value: 0.32043748965522606.
[I 2025-12-09 15:08:21,919] Trial 139 finished with value: 0.31326599264193167 and parameters: {'model_type': 'graphsage', 'hidden_dims': '[256, 128]', 'dropout': 0.44748723693240705, 'batch_norm': True, 'sage_aggr': 'mean', 'sage_normalize': True, 'sage_project': False, 'lr': 0.003160562034347278, 'weight_decay': 2.988134612935398e-07, 'epochs': 300, 'loss': 'mse', 'optimizer': 'adam', 'graph_mode': 'cutoff', 'cutoff': 0.792362857361328, 'grm_norm': 'cosine', 'self_loops': True, 'use_snp_selection': False}. Best is trial 135 with value: 0.32043748965522606.
[I 2025-12-09 15:09:32,122] Trial 140 finished with value: 0.31839188628144827 and parameters: {'model_type': 'graphsage', 'hidden_dims': '[256, 128]', 'dropout': 0.42069824788814925, 'batch_norm': True, 'sage_aggr': 'mean', 'sage_normalize': True, 'sage_project': False, 'lr': 0.002401133536351046, 'weight_decay': 4.4252656020520823e-07, 'epochs': 274, 'loss': 'mse', 'optimizer': 'adam', 'graph_mode': 'cutoff', 'cutoff': 0.7751649516322225, 'grm_norm': 'cosine', 'self_loops': True, 'use_snp_selection': False}. Best is trial 135 with value: 0.32043748965522606.
[I 2025-12-09 15:10:42,800] Trial 141 finished with value: 0.31718828325004 and parameters: {'model_type': 'graphsage', 'hidden_dims': '[256, 128]', 'dropout': 0.43071646256943236, 'batch_norm': True, 'sage_aggr': 'mean', 'sage_normalize': True, 'sage_project': False, 'lr': 0.0023225720709051227, 'weight_decay': 4.5398699271696087e-07, 'epochs': 276, 'loss': 'mse', 'optimizer': 'adam', 'graph_mode': 'cutoff', 'cutoff': 0.7665041098998857, 'grm_norm': 'cosine', 'self_loops': True, 'use_snp_selection': False}. Best is trial 135 with value: 0.32043748965522606.
[I 2025-12-09 15:11:51,939] Trial 142 finished with value: 0.31275528878712633 and parameters: {'model_type': 'graphsage', 'hidden_dims': '[256, 128]', 'dropout': 0.4049196557500479, 'batch_norm': True, 'sage_aggr': 'mean', 'sage_normalize': True, 'sage_project': False, 'lr': 0.002107756544196155, 'weight_decay': 2.454720972602818e-07, 'epochs': 269, 'loss': 'mse', 'optimizer': 'adam', 'graph_mode': 'cutoff', 'cutoff': 0.8047803641705848, 'grm_norm': 'cosine', 'self_loops': True, 'use_snp_selection': False}. Best is trial 135 with value: 0.32043748965522606.
[I 2025-12-09 15:13:05,900] Trial 143 finished with value: 0.3133722940443474 and parameters: {'model_type': 'graphsage', 'hidden_dims': '[256, 128]', 'dropout': 0.4635353855520735, 'batch_norm': True, 'sage_aggr': 'mean', 'sage_normalize': True, 'sage_project': False, 'lr': 0.0025285790999596157, 'weight_decay': 3.462044242569072e-07, 'epochs': 291, 'loss': 'mse', 'optimizer': 'adam', 'graph_mode': 'cutoff', 'cutoff': 0.7279010822342231, 'grm_norm': 'cosine', 'self_loops': True, 'use_snp_selection': False}. Best is trial 135 with value: 0.32043748965522606.
[I 2025-12-09 15:14:18,064] Trial 144 finished with value: 0.31786482303333924 and parameters: {'model_type': 'graphsage', 'hidden_dims': '[256, 128]', 'dropout': 0.41759540379063037, 'batch_norm': True, 'sage_aggr': 'mean', 'sage_normalize': True, 'sage_project': False, 'lr': 0.003363136711712843, 'weight_decay': 7.025589636159045e-07, 'epochs': 283, 'loss': 'mse', 'optimizer': 'adam', 'graph_mode': 'cutoff', 'cutoff': 0.7799730433637855, 'grm_norm': 'cosine', 'self_loops': True, 'use_snp_selection': False}. Best is trial 135 with value: 0.32043748965522606.
[I 2025-12-09 15:15:36,108] Trial 145 finished with value: 0.31762606992208287 and parameters: {'model_type': 'graphsage', 'hidden_dims': '[256, 128]', 'dropout': 0.4163155613403616, 'batch_norm': True, 'sage_aggr': 'mean', 'sage_normalize': True, 'sage_project': False, 'lr': 0.00347539218322404, 'weight_decay': 6.755121127334911e-07, 'epochs': 310, 'loss': 'mse', 'optimizer': 'adam', 'graph_mode': 'cutoff', 'cutoff': 0.7761630950599099, 'grm_norm': 'cosine', 'self_loops': True, 'use_snp_selection': False}. Best is trial 135 with value: 0.32043748965522606.
[I 2025-12-09 15:16:51,110] Trial 146 finished with value: 0.31613630099674345 and parameters: {'model_type': 'graphsage', 'hidden_dims': '[256, 128]', 'dropout': 0.3889446429655631, 'batch_norm': True, 'sage_aggr': 'mean', 'sage_normalize': True, 'sage_project': False, 'lr': 0.0023570045823541512, 'weight_decay': 4.0433653056296403e-07, 'epochs': 296, 'loss': 'mse', 'optimizer': 'adam', 'graph_mode': 'cutoff', 'cutoff': 0.7925405673070046, 'grm_norm': 'cosine', 'self_loops': True, 'use_snp_selection': False}. Best is trial 135 with value: 0.32043748965522606.
[I 2025-12-09 15:18:01,398] Trial 147 finished with value: 0.30921828880713526 and parameters: {'model_type': 'graphsage', 'hidden_dims': '[256, 128]', 'dropout': 0.35582747596475095, 'batch_norm': False, 'sage_aggr': 'mean', 'sage_normalize': True, 'sage_project': False, 'lr': 0.0028177285237437656, 'weight_decay': 3.1874524883464947e-07, 'epochs': 275, 'loss': 'mse', 'optimizer': 'adam', 'graph_mode': 'cutoff', 'cutoff': 0.8133143498455191, 'grm_norm': 'cosine', 'self_loops': False, 'use_snp_selection': False}. Best is trial 135 with value: 0.32043748965522606.
[I 2025-12-09 15:19:55,395] Trial 148 finished with value: 0.3128645396353026 and parameters: {'model_type': 'graphsage', 'hidden_dims': '[512, 128]', 'dropout': 0.42148721905315223, 'batch_norm': True, 'sage_aggr': 'mean', 'sage_normalize': True, 'sage_project': False, 'lr': 0.001365511744415696, 'weight_decay': 6.965607253963184e-07, 'epochs': 258, 'loss': 'mse', 'optimizer': 'adam', 'graph_mode': 'cutoff', 'cutoff': 0.7847560178171508, 'grm_norm': 'cosine', 'self_loops': True, 'use_snp_selection': False}. Best is trial 135 with value: 0.32043748965522606.
[I 2025-12-09 15:21:08,516] Trial 149 finished with value: 0.30988038570949356 and parameters: {'model_type': 'graphsage', 'hidden_dims': '[256, 128, 64]', 'dropout': 0.45395047682294576, 'batch_norm': True, 'sage_aggr': 'mean', 'sage_normalize': True, 'sage_project': False, 'lr': 0.00037075563899823617, 'weight_decay': 1.694660086222803e-07, 'epochs': 284, 'loss': 'mse', 'optimizer': 'adam', 'graph_mode': 'cutoff', 'cutoff': 0.6199024289746897, 'grm_norm': 'cosine', 'self_loops': True, 'use_snp_selection': False}. Best is trial 135 with value: 0.32043748965522606.
