[I 2025-12-05 20:08:19,210] Trial 18 finished with value: 0.19134839501509848 and parameters: {'model_type': 'graphsage', 'hidden_dims': '[128, 64]', 'dropout': 0.2180618771914129, 'batch_norm': False, 'sage_aggr': 'mean', 'sage_normalize': False, 'sage_project': False, 'lr': 6.118506655061126e-05, 'weight_decay': 4.7702001965427466e-05, 'epochs': 191, 'loss': 'mae', 'optimizer': 'adam', 'graph_mode': 'cutoff', 'cutoff': 0.5023832085256028, 'grm_norm': 'cosine', 'self_loops': False, 'use_snp_selection': False, 'graphsage_batch_size': 256}. Best is trial 10 with value: 0.2138774181514703.
[I 2025-12-05 20:09:14,075] Trial 19 finished with value: 0.20086172247643078 and parameters: {'model_type': 'graphsage', 'hidden_dims': '[256, 128, 64]', 'dropout': 0.14360360207638995, 'batch_norm': False, 'sage_aggr': 'mean', 'sage_normalize': False, 'sage_project': False, 'lr': 2.0082206099162444e-05, 'weight_decay': 9.884244821116265e-07, 'epochs': 156, 'loss': 'mae', 'optimizer': 'adam', 'graph_mode': 'cutoff', 'cutoff': 0.7646625597082742, 'grm_norm': 'cosine_then_gcn', 'self_loops': False, 'use_snp_selection': False, 'graphsage_batch_size': 16}. Best is trial 10 with value: 0.2138774181514703.
[I 2025-12-05 20:10:35,330] Trial 20 finished with value: 0.1986403686864859 and parameters: {'model_type': 'graphsage', 'hidden_dims': '[512, 256]', 'dropout': 0.31970210289767603, 'batch_norm': False, 'sage_aggr': 'mean', 'sage_normalize': False, 'sage_project': False, 'lr': 0.00030146451036691614, 'weight_decay': 4.18783331923737e-06, 'epochs': 123, 'loss': 'mae', 'optimizer': 'adam', 'graph_mode': 'cutoff', 'cutoff': 0.5147617196172521, 'grm_norm': 'gcn', 'self_loops': False, 'use_snp_selection': False, 'graphsage_batch_size': 512}. Best is trial 10 with value: 0.2138774181514703.
[I 2025-12-05 20:12:42,440] Trial 21 finished with value: 0.19866659718332663 and parameters: {'model_type': 'graphsage', 'hidden_dims': '[512, 256]', 'dropout': 0.14387886065125138, 'batch_norm': False, 'sage_aggr': 'mean', 'sage_normalize': False, 'sage_project': False, 'lr': 0.00021504393963644387, 'weight_decay': 1.6974260602030996e-07, 'epochs': 219, 'loss': 'mae', 'optimizer': 'adam', 'graph_mode': 'cutoff', 'cutoff': 0.8057345185950266, 'grm_norm': 'none', 'self_loops': False, 'use_snp_selection': False, 'graphsage_batch_size': 32}. Best is trial 10 with value: 0.2138774181514703.
[I 2025-12-05 20:14:57,041] Trial 22 finished with value: 0.20843432433847214 and parameters: {'model_type': 'graphsage', 'hidden_dims': '[512, 256]', 'dropout': 0.23280132286266825, 'batch_norm': False, 'sage_aggr': 'mean', 'sage_normalize': False, 'sage_project': False, 'lr': 5.8127416036926055e-05, 'weight_decay': 2.799018008422119e-07, 'epochs': 233, 'loss': 'mae', 'optimizer': 'adam', 'graph_mode': 'cutoff', 'cutoff': 0.805415769240667, 'grm_norm': 'none', 'self_loops': False, 'use_snp_selection': False, 'graphsage_batch_size': 32}. Best is trial 10 with value: 0.2138774181514703.
[I 2025-12-05 20:16:53,537] Trial 23 finished with value: 0.21178974344789597 and parameters: {'model_type': 'graphsage', 'hidden_dims': '[512, 256]', 'dropout': 0.22981755442409876, 'batch_norm': False, 'sage_aggr': 'mean', 'sage_normalize': False, 'sage_project': False, 'lr': 4.6853191907527874e-05, 'weight_decay': 3.464323895206319e-07, 'epochs': 199, 'loss': 'mae', 'optimizer': 'adam', 'graph_mode': 'cutoff', 'cutoff': 0.7815339001565123, 'grm_norm': 'none', 'self_loops': False, 'use_snp_selection': False, 'graphsage_batch_size': 32}. Best is trial 10 with value: 0.2138774181514703.
[I 2025-12-05 20:18:54,695] Trial 24 finished with value: 0.20393750144350112 and parameters: {'model_type': 'graphsage', 'hidden_dims': '[512, 256]', 'dropout': 0.2416109564007761, 'batch_norm': False, 'sage_aggr': 'mean', 'sage_normalize': False, 'sage_project': False, 'lr': 4.2579230173594337e-05, 'weight_decay': 2.783803612848494e-07, 'epochs': 204, 'loss': 'mae', 'optimizer': 'adam', 'graph_mode': 'cutoff', 'cutoff': 0.6060974044173509, 'grm_norm': 'none', 'self_loops': False, 'use_snp_selection': False, 'graphsage_batch_size': 32}. Best is trial 10 with value: 0.2138774181514703.
[I 2025-12-05 20:21:07,111] Trial 25 finished with value: 0.20812393630557283 and parameters: {'model_type': 'graphsage', 'hidden_dims': '[512, 256]', 'dropout': 0.29859843908287853, 'batch_norm': False, 'sage_aggr': 'mean', 'sage_normalize': False, 'sage_project': False, 'lr': 2.2667095797322137e-05, 'weight_decay': 8.278091450524593e-07, 'epochs': 229, 'loss': 'mae', 'optimizer': 'adam', 'graph_mode': 'cutoff', 'cutoff': 0.7971984445507025, 'grm_norm': 'none', 'self_loops': False, 'use_snp_selection': False, 'graphsage_batch_size': 64}. Best is trial 10 with value: 0.2138774181514703.
[I 2025-12-05 20:23:18,722] Trial 26 finished with value: 0.19320563221837297 and parameters: {'model_type': 'graphsage', 'hidden_dims': '[512, 256]', 'dropout': 0.4164048568898492, 'batch_norm': True, 'sage_aggr': 'max', 'sage_normalize': True, 'sage_project': False, 'lr': 1.0304774992420204e-05, 'weight_decay': 2.5657612571905586e-07, 'epochs': 227, 'loss': 'mse', 'optimizer': 'adam', 'graph_mode': 'cutoff', 'cutoff': 0.8182723232959177, 'grm_norm': 'none', 'self_loops': False, 'use_snp_selection': False, 'graphsage_batch_size': 32}. Best is trial 10 with value: 0.2138774181514703.
[I 2025-12-05 20:23:59,792] Trial 27 finished with value: 0.20710504719366968 and parameters: {'model_type': 'graphsage', 'hidden_dims': '[128, 64]', 'dropout': 0.22637914896790723, 'batch_norm': False, 'sage_aggr': 'mean', 'sage_normalize': False, 'sage_project': False, 'lr': 4.870240901562351e-05, 'weight_decay': 6.85136224305265e-07, 'epochs': 192, 'loss': 'mae', 'optimizer': 'adam', 'graph_mode': 'cutoff', 'cutoff': 0.667462536238491, 'grm_norm': 'gcn', 'self_loops': False, 'use_snp_selection': False, 'graphsage_batch_size': 32}. Best is trial 10 with value: 0.2138774181514703.
[I 2025-12-05 20:25:03,156] Trial 28 finished with value: 0.1764552719454942 and parameters: {'model_type': 'graphsage', 'hidden_dims': '[256, 128, 64]', 'dropout': 0.14247120177339212, 'batch_norm': False, 'sage_aggr': 'mean', 'sage_normalize': False, 'sage_project': False, 'lr': 1.0571560005324774e-06, 'weight_decay': 1.0065937498088176e-07, 'epochs': 179, 'loss': 'mae', 'optimizer': 'adam', 'graph_mode': 'cutoff', 'cutoff': 0.5735484271248482, 'grm_norm': 'cosine_then_gcn', 'self_loops': False, 'use_snp_selection': False, 'graphsage_batch_size': 32}. Best is trial 10 with value: 0.2138774181514703.
[I 2025-12-05 20:27:37,599] Trial 29 finished with value: 0.18938601185066034 and parameters: {'model_type': 'graphsage', 'hidden_dims': '[512, 64]', 'dropout': 0.20489113080635765, 'batch_norm': True, 'sage_aggr': 'max', 'sage_normalize': False, 'sage_project': False, 'lr': 2.5474606801426882e-05, 'weight_decay': 2.5847060446810665e-07, 'epochs': 212, 'loss': 'mse', 'optimizer': 'adam', 'graph_mode': 'cutoff', 'cutoff': 0.4202012713396594, 'grm_norm': 'cosine', 'self_loops': False, 'use_snp_selection': False, 'graphsage_batch_size': 256}. Best is trial 10 with value: 0.2138774181514703.
[I 2025-12-05 20:28:09,611] Trial 30 finished with value: 0.17374805708871804 and parameters: {'model_type': 'graphsage', 'hidden_dims': '[128, 64]', 'dropout': 0.4752171521116915, 'batch_norm': False, 'sage_aggr': 'mean', 'sage_normalize': False, 'sage_project': False, 'lr': 9.577363701674745e-05, 'weight_decay': 1.5703792238695032e-06, 'epochs': 146, 'loss': 'mae', 'optimizer': 'adam', 'graph_mode': 'cutoff', 'cutoff': 0.8345669795321781, 'grm_norm': 'none', 'self_loops': False, 'use_snp_selection': False, 'graphsage_batch_size': 16}. Best is trial 10 with value: 0.2138774181514703.
[I 2025-12-05 20:30:24,269] Trial 31 finished with value: 0.20396224805743265 and parameters: {'model_type': 'graphsage', 'hidden_dims': '[512, 256]', 'dropout': 0.2993351555734304, 'batch_norm': False, 'sage_aggr': 'mean', 'sage_normalize': False, 'sage_project': False, 'lr': 2.2873454680525712e-05, 'weight_decay': 5.95442627964948e-07, 'epochs': 233, 'loss': 'mae', 'optimizer': 'adam', 'graph_mode': 'cutoff', 'cutoff': 0.7613719692565933, 'grm_norm': 'none', 'self_loops': False, 'use_snp_selection': False, 'graphsage_batch_size': 64}. Best is trial 10 with value: 0.2138774181514703.
[I 2025-12-05 20:32:25,985] Trial 32 finished with value: 0.21219621797485694 and parameters: {'model_type': 'graphsage', 'hidden_dims': '[512, 256]', 'dropout': 0.2993773948180464, 'batch_norm': False, 'sage_aggr': 'mean', 'sage_normalize': False, 'sage_project': False, 'lr': 3.4156342696597685e-05, 'weight_decay': 8.942401164528469e-07, 'epochs': 209, 'loss': 'mae', 'optimizer': 'adam', 'graph_mode': 'cutoff', 'cutoff': 0.8328831557202958, 'grm_norm': 'none', 'self_loops': False, 'use_snp_selection': False, 'graphsage_batch_size': 64}. Best is trial 10 with value: 0.2138774181514703.
[I 2025-12-05 20:34:27,691] Trial 33 finished with value: 0.2109517167576287 and parameters: {'model_type': 'graphsage', 'hidden_dims': '[512, 256]', 'dropout': 0.3497339640241455, 'batch_norm': False, 'sage_aggr': 'mean', 'sage_normalize': False, 'sage_project': False, 'lr': 4.249635791677082e-05, 'weight_decay': 2.722831499829603e-07, 'epochs': 209, 'loss': 'mae', 'optimizer': 'adam', 'graph_mode': 'cutoff', 'cutoff': 0.8423861580485432, 'grm_norm': 'none', 'self_loops': False, 'use_snp_selection': False, 'graphsage_batch_size': 64}. Best is trial 10 with value: 0.2138774181514703.
[I 2025-12-05 20:36:13,294] Trial 34 finished with value: 0.19992049229939018 and parameters: {'model_type': 'graphsage', 'hidden_dims': '[512, 256]', 'dropout': 0.3464776977058328, 'batch_norm': False, 'sage_aggr': 'mean', 'sage_normalize': False, 'sage_project': False, 'lr': 3.498912820048371e-05, 'weight_decay': 2.192525701324304e-07, 'epochs': 179, 'loss': 'mse', 'optimizer': 'adam', 'graph_mode': 'cutoff', 'cutoff': 0.8539552518167952, 'grm_norm': 'none', 'self_loops': False, 'use_snp_selection': False, 'graphsage_batch_size': 64}. Best is trial 10 with value: 0.2138774181514703.
[I 2025-12-05 20:38:26,774] Trial 35 finished with value: 0.18798072576408398 and parameters: {'model_type': 'graphsage', 'hidden_dims': '[512, 128]', 'dropout': 0.42914320701832614, 'batch_norm': True, 'sage_aggr': 'mean', 'sage_normalize': True, 'sage_project': False, 'lr': 1.2376929007622722e-05, 'weight_decay': 4.621146354532469e-07, 'epochs': 207, 'loss': 'mae', 'optimizer': 'adam', 'graph_mode': 'cutoff', 'cutoff': 0.7293965256862701, 'grm_norm': 'none', 'self_loops': False, 'use_snp_selection': True, 'num_snps': 58379, 'graphsage_batch_size': 64}. Best is trial 10 with value: 0.2138774181514703.
[I 2025-12-05 20:40:37,662] Trial 36 finished with value: 0.1728739059783079 and parameters: {'model_type': 'graphsage', 'hidden_dims': '[512, 256]', 'dropout': 0.29411682940625894, 'batch_norm': False, 'sage_aggr': 'max', 'sage_normalize': False, 'sage_project': False, 'lr': 3.2750471436175596e-05, 'weight_decay': 1.9208582543935265e-06, 'epochs': 217, 'loss': 'mse', 'optimizer': 'adam', 'graph_mode': 'knn', 'knn_k': 1, 'weighted_edges': False, 'symmetrize_mode': 'union', 'self_loops': False, 'use_snp_selection': False, 'graphsage_batch_size': 64}. Best is trial 10 with value: 0.2138774181514703.
[I 2025-12-05 20:41:19,166] Trial 37 finished with value: 0.21096344752268173 and parameters: {'model_type': 'graphsage', 'hidden_dims': '[256, 128]', 'dropout': 0.36022842341204, 'batch_norm': True, 'sage_aggr': 'mean', 'sage_normalize': True, 'sage_project': False, 'lr': 9.799241068873094e-06, 'weight_decay': 1.0298404328631098e-06, 'epochs': 202, 'loss': 'mae', 'optimizer': 'adam', 'graph_mode': 'cutoff', 'cutoff': 0.6347690162424398, 'grm_norm': 'none', 'self_loops': False, 'use_snp_selection': True, 'num_snps': 23077, 'graphsage_batch_size': 64}. Best is trial 10 with value: 0.2138774181514703.
[I 2025-12-05 20:42:49,157] Trial 38 finished with value: 0.0991892926711766 and parameters: {'model_type': 'graphsage', 'hidden_dims': '[256, 128]', 'dropout': 0.36169109199079935, 'batch_norm': True, 'sage_aggr': 'max', 'sage_normalize': True, 'sage_project': False, 'lr': 3.7843488150955526e-06, 'weight_decay': 9.964110899834232e-07, 'epochs': 155, 'loss': 'mae', 'optimizer': 'adam', 'graph_mode': 'knn', 'knn_k': 10, 'weighted_edges': False, 'symmetrize_mode': 'union', 'self_loops': False, 'use_snp_selection': True, 'num_snps': 24501, 'graphsage_batch_size': 8}. Best is trial 10 with value: 0.2138774181514703.
[I 2025-12-05 20:43:07,868] Trial 39 finished with value: 0.1663031616825175 and parameters: {'model_type': 'graphsage', 'hidden_dims': '[256, 128]', 'dropout': 0.39571000215402957, 'batch_norm': True, 'sage_aggr': 'mean', 'sage_normalize': True, 'sage_project': False, 'lr': 8.261615938022514e-06, 'weight_decay': 0.0008076915742574946, 'epochs': 183, 'loss': 'mse', 'optimizer': 'adam', 'graph_mode': 'cutoff', 'cutoff': 0.6230677183799651, 'grm_norm': 'none', 'self_loops': False, 'use_snp_selection': True, 'num_snps': 4088, 'graphsage_batch_size': 512}. Best is trial 10 with value: 0.2138774181514703.
[I 2025-12-05 20:43:41,477] Trial 40 finished with value: 0.12663475607390665 and parameters: {'model_type': 'graphsage', 'hidden_dims': '[256, 128]', 'dropout': 0.2552692944215692, 'batch_norm': True, 'sage_aggr': 'mean', 'sage_normalize': True, 'sage_project': False, 'lr': 3.985887957004158e-06, 'weight_decay': 4.668312472424922e-05, 'epochs': 168, 'loss': 'mae', 'optimizer': 'adam', 'graph_mode': 'knn', 'knn_k': 1, 'weighted_edges': True, 'symmetrize_mode': 'union', 'self_loops': False, 'use_snp_selection': True, 'num_snps': 17506, 'graphsage_batch_size': 64}. Best is trial 10 with value: 0.2138774181514703.
[I 2025-12-05 20:44:42,150] Trial 41 finished with value: 0.1936282701556872 and parameters: {'model_type': 'graphsage', 'hidden_dims': '[256, 128]', 'dropout': 0.3394738569326401, 'batch_norm': True, 'sage_aggr': 'mean', 'sage_normalize': True, 'sage_project': False, 'lr': 1.4332314754993271e-05, 'weight_decay': 3.8306178233645265e-07, 'epochs': 202, 'loss': 'mae', 'optimizer': 'adam', 'graph_mode': 'cutoff', 'cutoff': 0.848973047543007, 'grm_norm': 'none', 'self_loops': False, 'use_snp_selection': True, 'num_snps': 40097, 'graphsage_batch_size': 64}. Best is trial 10 with value: 0.2138774181514703.
[I 2025-12-05 20:45:31,624] Trial 42 finished with value: 0.22877771404725977 and parameters: {'model_type': 'graphsage', 'hidden_dims': '[512, 64]', 'dropout': 0.3798745004484287, 'batch_norm': True, 'sage_aggr': 'mean', 'sage_normalize': True, 'sage_project': False, 'lr': 3.2642388118452304e-05, 'weight_decay': 7.192168989460436e-06, 'epochs': 220, 'loss': 'mae', 'optimizer': 'adam', 'graph_mode': 'cutoff', 'cutoff': 0.7785885130437808, 'grm_norm': 'gcn', 'self_loops': False, 'use_snp_selection': True, 'num_snps': 16253, 'graphsage_batch_size': 64}. Best is trial 42 with value: 0.22877771404725977.
[I 2025-12-05 20:46:18,938] Trial 43 finished with value: 0.19147268961753616 and parameters: {'model_type': 'graphsage', 'hidden_dims': '[512, 64]', 'dropout': 0.4448334026343696, 'batch_norm': True, 'sage_aggr': 'mean', 'sage_normalize': True, 'sage_project': False, 'lr': 5.963321930032685e-06, 'weight_decay': 1.8724444721974767e-05, 'epochs': 218, 'loss': 'mae', 'optimizer': 'adam', 'graph_mode': 'cutoff', 'cutoff': 0.7328181581480984, 'grm_norm': 'gcn', 'self_loops': False, 'use_snp_selection': True, 'num_snps': 16288, 'graphsage_batch_size': 64}. Best is trial 42 with value: 0.22877771404725977.
[I 2025-12-05 20:47:34,051] Trial 44 finished with value: 0.2152676852406159 and parameters: {'model_type': 'graphsage', 'hidden_dims': '[512, 64]', 'dropout': 0.3796968366023135, 'batch_norm': True, 'sage_aggr': 'mean', 'sage_normalize': True, 'sage_project': False, 'lr': 3.059219007350318e-05, 'weight_decay': 5.013882982221889e-06, 'epochs': 250, 'loss': 'mae', 'optimizer': 'adam', 'graph_mode': 'cutoff', 'cutoff': 0.7785320990929119, 'grm_norm': 'gcn', 'self_loops': False, 'use_snp_selection': True, 'num_snps': 26078, 'graphsage_batch_size': 8}. Best is trial 42 with value: 0.22877771404725977.
[I 2025-12-05 20:50:04,461] Trial 45 finished with value: 0.19250751431070462 and parameters: {'model_type': 'graphsage', 'hidden_dims': '[512, 64]', 'dropout': 0.38919239246450643, 'batch_norm': True, 'sage_aggr': 'mean', 'sage_normalize': True, 'sage_project': False, 'lr': 1.8223635846118662e-05, 'weight_decay': 6.668051061168977e-06, 'epochs': 245, 'loss': 'mae', 'optimizer': 'adam', 'graph_mode': 'cutoff', 'cutoff': 0.25676800420471996, 'grm_norm': 'gcn', 'self_loops': False, 'use_snp_selection': True, 'num_snps': 28419, 'graphsage_batch_size': 8}. Best is trial 42 with value: 0.22877771404725977.
[I 2025-12-05 20:50:46,780] Trial 46 finished with value: 0.2355210709696963 and parameters: {'model_type': 'graphsage', 'hidden_dims': '[512, 64]', 'dropout': 0.5061713955384552, 'batch_norm': True, 'sage_aggr': 'max', 'sage_normalize': True, 'sage_project': False, 'lr': 2.866858612041281e-05, 'weight_decay': 4.767370925038275e-06, 'epochs': 250, 'loss': 'mae', 'optimizer': 'adam', 'graph_mode': 'cutoff', 'cutoff': 0.7851535266799463, 'grm_norm': 'gcn', 'self_loops': False, 'use_snp_selection': True, 'num_snps': 11809, 'graphsage_batch_size': 8}. Best is trial 46 with value: 0.2355210709696963.
[I 2025-12-05 20:51:32,554] Trial 47 finished with value: 0.19882954568506425 and parameters: {'model_type': 'graphsage', 'hidden_dims': '[512, 64]', 'dropout': 0.5319779134044862, 'batch_norm': True, 'sage_aggr': 'max', 'sage_normalize': True, 'sage_project': False, 'lr': 2.9175165335941137e-05, 'weight_decay': 5.426580616594797e-06, 'epochs': 238, 'loss': 'mae', 'optimizer': 'adam', 'graph_mode': 'knn', 'knn_k': 3, 'weighted_edges': False, 'symmetrize_mode': 'mutual', 'self_loops': False, 'use_snp_selection': True, 'num_snps': 12342, 'graphsage_batch_size': 8}. Best is trial 46 with value: 0.2355210709696963.
[I 2025-12-05 20:52:08,136] Trial 48 finished with value: 0.21712929624887964 and parameters: {'model_type': 'graphsage', 'hidden_dims': '[512, 64]', 'dropout': 0.502930272794129, 'batch_norm': True, 'sage_aggr': 'max', 'sage_normalize': True, 'sage_project': False, 'lr': 9.949548326976956e-05, 'weight_decay': 1.4522120039978882e-05, 'epochs': 222, 'loss': 'mae', 'optimizer': 'adam', 'graph_mode': 'cutoff', 'cutoff': 0.8980745166025752, 'grm_norm': 'gcn', 'self_loops': False, 'use_snp_selection': True, 'num_snps': 10118, 'graphsage_batch_size': 8}. Best is trial 46 with value: 0.2355210709696963.
[I 2025-12-05 20:52:46,163] Trial 49 finished with value: 0.22892804939381955 and parameters: {'model_type': 'graphsage', 'hidden_dims': '[512, 64]', 'dropout': 0.5145243979127637, 'batch_norm': True, 'sage_aggr': 'max', 'sage_normalize': True, 'sage_project': False, 'lr': 0.0001280145461478114, 'weight_decay': 1.4563553870350994e-05, 'epochs': 250, 'loss': 'mae', 'optimizer': 'adam', 'graph_mode': 'cutoff', 'cutoff': 0.896339616498588, 'grm_norm': 'gcn', 'self_loops': False, 'use_snp_selection': True, 'num_snps': 10069, 'graphsage_batch_size': 8}. Best is trial 46 with value: 0.2355210709696963.
[I 2025-12-05 20:53:22,180] Trial 50 finished with value: 0.20778608794134906 and parameters: {'model_type': 'graphsage', 'hidden_dims': '[512, 64]', 'dropout': 0.5129066237826218, 'batch_norm': True, 'sage_aggr': 'max', 'sage_normalize': True, 'sage_project': False, 'lr': 0.0001524552551763215, 'weight_decay': 1.37314746675342e-05, 'epochs': 250, 'loss': 'mse', 'optimizer': 'adam', 'graph_mode': 'cutoff', 'cutoff': 0.8973544329232279, 'grm_norm': 'gcn', 'self_loops': False, 'use_snp_selection': True, 'num_snps': 9051, 'graphsage_batch_size': 8}. Best is trial 46 with value: 0.2355210709696963.
[I 2025-12-05 20:54:04,782] Trial 51 finished with value: 0.2198191959515452 and parameters: {'model_type': 'graphsage', 'hidden_dims': '[512, 64]', 'dropout': 0.5322291737302309, 'batch_norm': True, 'sage_aggr': 'max', 'sage_normalize': True, 'sage_project': False, 'lr': 0.00010805985249520375, 'weight_decay': 3.1639338926548305e-05, 'epochs': 237, 'loss': 'mae', 'optimizer': 'adam', 'graph_mode': 'cutoff', 'cutoff': 0.867448437472205, 'grm_norm': 'gcn', 'self_loops': False, 'use_snp_selection': True, 'num_snps': 12631, 'graphsage_batch_size': 8}. Best is trial 46 with value: 0.2355210709696963.
[I 2025-12-05 20:54:44,751] Trial 52 finished with value: 0.22843348311893563 and parameters: {'model_type': 'graphsage', 'hidden_dims': '[512, 64]', 'dropout': 0.5353983388402717, 'batch_norm': True, 'sage_aggr': 'max', 'sage_normalize': True, 'sage_project': False, 'lr': 0.0002494721151347829, 'weight_decay': 3.6855538849441554e-05, 'epochs': 240, 'loss': 'mae', 'optimizer': 'adam', 'graph_mode': 'cutoff', 'cutoff': 0.8713652484093372, 'grm_norm': 'gcn', 'self_loops': False, 'use_snp_selection': True, 'num_snps': 11344, 'graphsage_batch_size': 8}. Best is trial 46 with value: 0.2355210709696963.
[I 2025-12-05 20:55:24,878] Trial 53 finished with value: 0.23093564336231362 and parameters: {'model_type': 'graphsage', 'hidden_dims': '[512, 64]', 'dropout': 0.5569926289089672, 'batch_norm': True, 'sage_aggr': 'max', 'sage_normalize': True, 'sage_project': False, 'lr': 0.0004745470884180135, 'weight_decay': 3.6420640808710694e-05, 'epochs': 239, 'loss': 'mae', 'optimizer': 'adam', 'graph_mode': 'cutoff', 'cutoff': 0.8832107708626047, 'grm_norm': 'gcn', 'self_loops': False, 'use_snp_selection': True, 'num_snps': 11377, 'graphsage_batch_size': 8}. Best is trial 46 with value: 0.2355210709696963.
