[I 2025-12-06 12:54:24,397] Trial 48 finished with value: 0.21879809996660424 and parameters: {'model_type': 'graphsage', 'hidden_dims': '[256, 128]', 'dropout': 0.4682326368215513, 'batch_norm': True, 'sage_aggr': 'max', 'sage_normalize': False, 'sage_project': False, 'lr': 0.0006582244400705063, 'weight_decay': 3.865140340714897e-06, 'epochs': 163, 'loss': 'mae', 'optimizer': 'adam', 'graph_mode': 'cutoff', 'cutoff': 0.6778160651336054, 'grm_norm': 'cosine_then_gcn', 'self_loops': False, 'use_snp_selection': False, 'graphsage_batch_size': 8}. Best is trial 19 with value: 0.2325487041055966.
[I 2025-12-06 12:55:26,221] Trial 49 finished with value: 0.21191862412358678 and parameters: {'model_type': 'graphsage', 'hidden_dims': '[256, 128]', 'dropout': 0.27562038917408155, 'batch_norm': True, 'sage_aggr': 'max', 'sage_normalize': True, 'sage_project': False, 'lr': 6.631160462979042e-05, 'weight_decay': 8.406901763508514e-06, 'epochs': 142, 'loss': 'mae', 'optimizer': 'adam', 'graph_mode': 'cutoff', 'cutoff': 0.5021530451975407, 'grm_norm': 'cosine_then_gcn', 'self_loops': False, 'use_snp_selection': False, 'graphsage_batch_size': 128}. Best is trial 19 with value: 0.2325487041055966.
[I 2025-12-06 12:57:24,212] Trial 50 finished with value: 0.2177297447070489 and parameters: {'model_type': 'graphsage', 'hidden_dims': '[512, 64]', 'dropout': 0.394144450740737, 'batch_norm': True, 'sage_aggr': 'max', 'sage_normalize': True, 'sage_project': False, 'lr': 0.0006377826716720674, 'weight_decay': 1.0883214508579678e-06, 'epochs': 150, 'loss': 'mae', 'optimizer': 'adam', 'graph_mode': 'cutoff', 'cutoff': 0.40145067044024874, 'grm_norm': 'cosine_then_gcn', 'self_loops': False, 'use_snp_selection': False, 'graphsage_batch_size': 8}. Best is trial 19 with value: 0.2325487041055966.
[I 2025-12-06 12:58:32,965] Trial 51 finished with value: 0.2242287674880314 and parameters: {'model_type': 'graphsage', 'hidden_dims': '[256, 128]', 'dropout': 0.25554258242225353, 'batch_norm': True, 'sage_aggr': 'max', 'sage_normalize': True, 'sage_project': False, 'lr': 9.944199818254221e-05, 'weight_decay': 3.729985358167112e-05, 'epochs': 192, 'loss': 'mae', 'optimizer': 'adam', 'graph_mode': 'cutoff', 'cutoff': 0.6113713908870444, 'grm_norm': 'cosine_then_gcn', 'self_loops': False, 'use_snp_selection': False, 'graphsage_batch_size': 64}. Best is trial 19 with value: 0.2325487041055966.
[I 2025-12-06 13:00:27,015] Trial 52 finished with value: 0.2330217617778696 and parameters: {'model_type': 'graphsage', 'hidden_dims': '[512, 128]', 'dropout': 0.345543840376212, 'batch_norm': True, 'sage_aggr': 'mean', 'sage_normalize': True, 'sage_project': False, 'lr': 0.00013902914277447143, 'weight_decay': 1.628494242722564e-05, 'epochs': 183, 'loss': 'mae', 'optimizer': 'adam', 'graph_mode': 'cutoff', 'cutoff': 0.5781389030379993, 'grm_norm': 'cosine_then_gcn', 'self_loops': False, 'use_snp_selection': False, 'graphsage_batch_size': 16}. Best is trial 52 with value: 0.2330217617778696.
[I 2025-12-06 13:02:15,744] Trial 53 finished with value: 0.22060600506314615 and parameters: {'model_type': 'graphsage', 'hidden_dims': '[512, 128]', 'dropout': 0.3427390372956957, 'batch_norm': True, 'sage_aggr': 'mean', 'sage_normalize': True, 'sage_project': False, 'lr': 0.00012828937717606666, 'weight_decay': 2.003366532012956e-05, 'epochs': 176, 'loss': 'mae', 'optimizer': 'adam', 'graph_mode': 'cutoff', 'cutoff': 0.6646502412684423, 'grm_norm': 'cosine_then_gcn', 'self_loops': False, 'use_snp_selection': False, 'graphsage_batch_size': 16}. Best is trial 52 with value: 0.2330217617778696.
[I 2025-12-06 13:03:56,453] Trial 54 finished with value: 0.21940627391153997 and parameters: {'model_type': 'graphsage', 'hidden_dims': '[512, 128]', 'dropout': 0.38087207079882923, 'batch_norm': True, 'sage_aggr': 'mean', 'sage_normalize': True, 'sage_project': False, 'lr': 0.00020143434903879023, 'weight_decay': 6.092571953339044e-06, 'epochs': 159, 'loss': 'mae', 'optimizer': 'adam', 'graph_mode': 'cutoff', 'cutoff': 0.5728976829931215, 'grm_norm': 'cosine_then_gcn', 'self_loops': False, 'use_snp_selection': False, 'graphsage_batch_size': 16}. Best is trial 52 with value: 0.2330217617778696.
[I 2025-12-06 13:05:52,829] Trial 55 finished with value: 0.20104748274749745 and parameters: {'model_type': 'graphsage', 'hidden_dims': '[512, 128]', 'dropout': 0.31521980351983137, 'batch_norm': False, 'sage_aggr': 'mean', 'sage_normalize': True, 'sage_project': False, 'lr': 6.0253960402801836e-05, 'weight_decay': 1.265200682435771e-05, 'epochs': 186, 'loss': 'mae', 'optimizer': 'adam', 'graph_mode': 'cutoff', 'cutoff': 0.560230460499345, 'grm_norm': 'cosine_then_gcn', 'self_loops': False, 'use_snp_selection': False, 'graphsage_batch_size': 16}. Best is trial 52 with value: 0.2330217617778696.
[I 2025-12-06 13:06:47,033] Trial 56 finished with value: 0.18609154843886577 and parameters: {'model_type': 'graphsage', 'hidden_dims': '[256, 128, 64]', 'dropout': 0.28059312943361053, 'batch_norm': True, 'sage_aggr': 'max', 'sage_normalize': True, 'sage_project': False, 'lr': 0.00029973747771877687, 'weight_decay': 3.4432640013394454e-06, 'epochs': 134, 'loss': 'mae', 'optimizer': 'adam', 'graph_mode': 'cutoff', 'cutoff': 0.533630231294971, 'grm_norm': 'cosine_then_gcn', 'self_loops': False, 'use_snp_selection': False, 'graphsage_batch_size': 16}. Best is trial 52 with value: 0.2330217617778696.
[I 2025-12-06 13:07:48,801] Trial 57 finished with value: 0.20591014581895065 and parameters: {'model_type': 'graphsage', 'hidden_dims': '[256, 128, 64]', 'dropout': 0.5376292116260163, 'batch_norm': True, 'sage_aggr': 'mean', 'sage_normalize': True, 'sage_project': False, 'lr': 0.00016664946525981524, 'weight_decay': 2.5284109308673713e-06, 'epochs': 168, 'loss': 'mae', 'optimizer': 'adam', 'graph_mode': 'cutoff', 'cutoff': 0.6209675080720829, 'grm_norm': 'cosine_then_gcn', 'self_loops': False, 'use_snp_selection': False, 'graphsage_batch_size': 8}. Best is trial 52 with value: 0.2330217617778696.
[I 2025-12-06 13:10:19,588] Trial 58 finished with value: 0.1927856740957073 and parameters: {'model_type': 'graphsage', 'hidden_dims': '[512, 128]', 'dropout': 0.3427100580957885, 'batch_norm': True, 'sage_aggr': 'mean', 'sage_normalize': True, 'sage_project': False, 'lr': 3.964261247019667e-05, 'weight_decay': 2.0540352754225017e-05, 'epochs': 198, 'loss': 'mae', 'optimizer': 'adam', 'graph_mode': 'knn', 'knn_k': 8, 'weighted_edges': True, 'symmetrize_mode': 'mutual', 'self_loops': False, 'use_snp_selection': False, 'graphsage_batch_size': 128}. Best is trial 52 with value: 0.2330217617778696.
[I 2025-12-06 13:12:40,580] Trial 59 finished with value: 0.2164652184434252 and parameters: {'model_type': 'graphsage', 'hidden_dims': '[512, 64]', 'dropout': 0.2815375926688379, 'batch_norm': True, 'sage_aggr': 'mean', 'sage_normalize': True, 'sage_project': False, 'lr': 0.000131259574326063, 'weight_decay': 1.723794346854313e-06, 'epochs': 218, 'loss': 'mae', 'optimizer': 'adam', 'graph_mode': 'cutoff', 'cutoff': 0.5066133604055746, 'grm_norm': 'cosine', 'self_loops': False, 'use_snp_selection': False, 'graphsage_batch_size': 512}. Best is trial 52 with value: 0.2330217617778696.
[I 2025-12-06 13:14:32,110] Trial 60 finished with value: 0.22949281530807258 and parameters: {'model_type': 'graphsage', 'hidden_dims': '[512, 256]', 'dropout': 0.36261586322746475, 'batch_norm': True, 'sage_aggr': 'mean', 'sage_normalize': False, 'sage_project': False, 'lr': 7.821434154732704e-05, 'weight_decay': 2.1483724591015553e-07, 'epochs': 182, 'loss': 'mae', 'optimizer': 'adam', 'graph_mode': 'cutoff', 'cutoff': 0.7324149475503475, 'grm_norm': 'none', 'self_loops': False, 'use_snp_selection': False, 'graphsage_batch_size': 16}. Best is trial 52 with value: 0.2330217617778696.
[I 2025-12-06 13:16:23,148] Trial 61 finished with value: 0.22473977064529835 and parameters: {'model_type': 'graphsage', 'hidden_dims': '[512, 256]', 'dropout': 0.3643786131773549, 'batch_norm': True, 'sage_aggr': 'mean', 'sage_normalize': False, 'sage_project': False, 'lr': 6.940374571965021e-05, 'weight_decay': 1.5760591902050867e-07, 'epochs': 181, 'loss': 'mae', 'optimizer': 'adam', 'graph_mode': 'cutoff', 'cutoff': 0.721297533515427, 'grm_norm': 'none', 'self_loops': False, 'use_snp_selection': False, 'graphsage_batch_size': 16}. Best is trial 52 with value: 0.2330217617778696.
[I 2025-12-06 13:18:18,962] Trial 62 finished with value: 0.2224299357400703 and parameters: {'model_type': 'graphsage', 'hidden_dims': '[512, 256]', 'dropout': 0.4335123476476749, 'batch_norm': True, 'sage_aggr': 'mean', 'sage_normalize': False, 'sage_project': False, 'lr': 9.101540781933402e-05, 'weight_decay': 2.5151811663958543e-07, 'epochs': 190, 'loss': 'mae', 'optimizer': 'adam', 'graph_mode': 'cutoff', 'cutoff': 0.7889577750910448, 'grm_norm': 'none', 'self_loops': False, 'use_snp_selection': False, 'graphsage_batch_size': 16}. Best is trial 52 with value: 0.2330217617778696.
[I 2025-12-06 13:20:04,691] Trial 63 finished with value: 0.2209169788999032 and parameters: {'model_type': 'graphsage', 'hidden_dims': '[512, 256]', 'dropout': 0.3155472750756561, 'batch_norm': True, 'sage_aggr': 'mean', 'sage_normalize': False, 'sage_project': False, 'lr': 0.00021986408369594886, 'weight_decay': 3.505238345384904e-07, 'epochs': 172, 'loss': 'mae', 'optimizer': 'adam', 'graph_mode': 'cutoff', 'cutoff': 0.8588354713534195, 'grm_norm': 'none', 'self_loops': False, 'use_snp_selection': False, 'graphsage_batch_size': 16}. Best is trial 52 with value: 0.2330217617778696.
[I 2025-12-06 13:21:10,631] Trial 64 finished with value: 0.22150855057896238 and parameters: {'model_type': 'graphsage', 'hidden_dims': '[256, 128, 64]', 'dropout': 0.36578713507505023, 'batch_norm': True, 'sage_aggr': 'mean', 'sage_normalize': False, 'sage_project': False, 'lr': 8.147232075465314e-05, 'weight_decay': 1.583511867554753e-07, 'epochs': 184, 'loss': 'mae', 'optimizer': 'adam', 'graph_mode': 'cutoff', 'cutoff': 0.7436219669439571, 'grm_norm': 'cosine_then_gcn', 'self_loops': False, 'use_snp_selection': False, 'graphsage_batch_size': 16}. Best is trial 52 with value: 0.2330217617778696.
[I 2025-12-06 13:22:09,323] Trial 65 finished with value: 0.2346940641829402 and parameters: {'model_type': 'graphsage', 'hidden_dims': '[256, 128]', 'dropout': 0.39467030946651754, 'batch_norm': True, 'sage_aggr': 'mean', 'sage_normalize': False, 'sage_project': False, 'lr': 5.406281926968102e-05, 'weight_decay': 5.415684893933501e-07, 'epochs': 162, 'loss': 'mae', 'optimizer': 'adam', 'graph_mode': 'cutoff', 'cutoff': 0.6750223441742732, 'grm_norm': 'none', 'self_loops': False, 'use_snp_selection': False, 'graphsage_batch_size': 8}. Best is trial 65 with value: 0.2346940641829402.
[I 2025-12-06 13:23:08,879] Trial 66 finished with value: 0.23235811652697627 and parameters: {'model_type': 'graphsage', 'hidden_dims': '[256, 128]', 'dropout': 0.40486042080553014, 'batch_norm': True, 'sage_aggr': 'mean', 'sage_normalize': False, 'sage_project': False, 'lr': 2.7295610791314077e-05, 'weight_decay': 4.950266606285177e-07, 'epochs': 165, 'loss': 'mae', 'optimizer': 'adam', 'graph_mode': 'cutoff', 'cutoff': 0.6886481844935779, 'grm_norm': 'none', 'self_loops': False, 'use_snp_selection': False, 'graphsage_batch_size': 16}. Best is trial 65 with value: 0.2346940641829402.
[I 2025-12-06 13:24:07,436] Trial 67 finished with value: 0.2183825417475501 and parameters: {'model_type': 'graphsage', 'hidden_dims': '[256, 128]', 'dropout': 0.44001457272598565, 'batch_norm': True, 'sage_aggr': 'mean', 'sage_normalize': False, 'sage_project': False, 'lr': 2.3606470766490593e-05, 'weight_decay': 5.577969518481128e-07, 'epochs': 162, 'loss': 'mae', 'optimizer': 'adam', 'graph_mode': 'cutoff', 'cutoff': 0.6923474262406324, 'grm_norm': 'none', 'self_loops': False, 'use_snp_selection': False, 'graphsage_batch_size': 8}. Best is trial 65 with value: 0.2346940641829402.
[I 2025-12-06 13:25:16,824] Trial 68 finished with value: 0.2280092216471555 and parameters: {'model_type': 'graphsage', 'hidden_dims': '[256, 128]', 'dropout': 0.40168074076869187, 'batch_norm': False, 'sage_aggr': 'max', 'sage_normalize': False, 'sage_project': False, 'lr': 5.1147894859906854e-05, 'weight_decay': 5.65474229802941e-07, 'epochs': 195, 'loss': 'mae', 'optimizer': 'adam', 'graph_mode': 'cutoff', 'cutoff': 0.6397843840130467, 'grm_norm': 'none', 'self_loops': False, 'use_snp_selection': False, 'graphsage_batch_size': 64}. Best is trial 65 with value: 0.2346940641829402.
[I 2025-12-06 13:26:30,029] Trial 69 finished with value: 0.19524707422770643 and parameters: {'model_type': 'graphsage', 'hidden_dims': '[256, 128]', 'dropout': 0.4612362731246667, 'batch_norm': True, 'sage_aggr': 'mean', 'sage_normalize': False, 'sage_project': False, 'lr': 3.794018539596862e-06, 'weight_decay': 8.284737236205519e-07, 'epochs': 208, 'loss': 'mae', 'optimizer': 'adam', 'graph_mode': 'cutoff', 'cutoff': 0.6794897477192873, 'grm_norm': 'none', 'self_loops': False, 'use_snp_selection': False, 'graphsage_batch_size': 256}. Best is trial 65 with value: 0.2346940641829402.
[I 2025-12-06 13:26:56,254] Trial 70 finished with value: 0.21432926108010295 and parameters: {'model_type': 'graphsage', 'hidden_dims': '[256, 128]', 'dropout': 0.41723415160606653, 'batch_norm': True, 'sage_aggr': 'mean', 'sage_normalize': False, 'sage_project': False, 'lr': 3.454453881637744e-05, 'weight_decay': 1.0309382138541026e-07, 'epochs': 147, 'loss': 'mae', 'optimizer': 'adam', 'graph_mode': 'cutoff', 'cutoff': 0.627491521338409, 'grm_norm': 'cosine', 'self_loops': False, 'use_snp_selection': True, 'num_snps': 12074, 'graphsage_batch_size': 16}. Best is trial 65 with value: 0.2346940641829402.
[I 2025-12-06 13:27:59,069] Trial 71 finished with value: 0.2244989861965177 and parameters: {'model_type': 'graphsage', 'hidden_dims': '[256, 128]', 'dropout': 0.38082856948063065, 'batch_norm': True, 'sage_aggr': 'mean', 'sage_normalize': False, 'sage_project': False, 'lr': 5.627116800001807e-05, 'weight_decay': 3.640717882478485e-07, 'epochs': 176, 'loss': 'mae', 'optimizer': 'adam', 'graph_mode': 'cutoff', 'cutoff': 0.7211140192931987, 'grm_norm': 'none', 'self_loops': False, 'use_snp_selection': False, 'graphsage_batch_size': 16}. Best is trial 65 with value: 0.2346940641829402.
[I 2025-12-06 13:28:59,159] Trial 72 finished with value: 0.22702334720300038 and parameters: {'model_type': 'graphsage', 'hidden_dims': '[256, 128]', 'dropout': 0.48320783444486776, 'batch_norm': True, 'sage_aggr': 'mean', 'sage_normalize': False, 'sage_project': False, 'lr': 4.245793369787737e-05, 'weight_decay': 1.6732722361539243e-07, 'epochs': 166, 'loss': 'mae', 'optimizer': 'adam', 'graph_mode': 'cutoff', 'cutoff': 0.6665109817326209, 'grm_norm': 'none', 'self_loops': False, 'use_snp_selection': False, 'graphsage_batch_size': 16}. Best is trial 65 with value: 0.2346940641829402.
[I 2025-12-06 13:30:51,087] Trial 73 finished with value: 0.22701973022673885 and parameters: {'model_type': 'graphsage', 'hidden_dims': '[512, 256]', 'dropout': 0.4258564575982611, 'batch_norm': True, 'sage_aggr': 'mean', 'sage_normalize': False, 'sage_project': False, 'lr': 7.624852528601559e-05, 'weight_decay': 4.687073882257562e-07, 'epochs': 183, 'loss': 'mae', 'optimizer': 'adam', 'graph_mode': 'cutoff', 'cutoff': 0.7734082219771448, 'grm_norm': 'none', 'self_loops': False, 'use_snp_selection': False, 'graphsage_batch_size': 16}. Best is trial 65 with value: 0.2346940641829402.
[I 2025-12-06 13:31:53,015] Trial 74 finished with value: 0.22070071612086326 and parameters: {'model_type': 'graphsage', 'hidden_dims': '[256, 128]', 'dropout': 0.39167324144101445, 'batch_norm': True, 'sage_aggr': 'mean', 'sage_normalize': False, 'sage_project': False, 'lr': 0.00014600981106127817, 'weight_decay': 2.1306321879107023e-07, 'epochs': 174, 'loss': 'mae', 'optimizer': 'adam', 'graph_mode': 'cutoff', 'cutoff': 0.8149080089180665, 'grm_norm': 'none', 'self_loops': False, 'use_snp_selection': False, 'graphsage_batch_size': 16}. Best is trial 65 with value: 0.2346940641829402.
[I 2025-12-06 13:33:03,426] Trial 75 finished with value: 0.23121070986891148 and parameters: {'model_type': 'graphsage', 'hidden_dims': '[256, 128, 64]', 'dropout': 0.35489930622159127, 'batch_norm': True, 'sage_aggr': 'mean', 'sage_normalize': False, 'sage_project': False, 'lr': 3.06428817035801e-05, 'weight_decay': 2.9891034193114177e-07, 'epochs': 199, 'loss': 'mae', 'optimizer': 'adam', 'graph_mode': 'cutoff', 'cutoff': 0.7312036286858214, 'grm_norm': 'none', 'self_loops': False, 'use_snp_selection': False, 'graphsage_batch_size': 512}. Best is trial 65 with value: 0.2346940641829402.
[I 2025-12-06 13:33:50,857] Trial 76 finished with value: 0.21436469663101726 and parameters: {'model_type': 'graphsage', 'hidden_dims': '[256, 128, 64]', 'dropout': 0.18111294137976044, 'batch_norm': True, 'sage_aggr': 'mean', 'sage_normalize': False, 'sage_project': False, 'lr': 1.1431133573737308e-05, 'weight_decay': 2.9589700662089287e-07, 'epochs': 203, 'loss': 'mse', 'optimizer': 'adam', 'graph_mode': 'cutoff', 'cutoff': 0.7589905583357566, 'grm_norm': 'none', 'self_loops': False, 'use_snp_selection': True, 'num_snps': 27086, 'graphsage_batch_size': 512}. Best is trial 65 with value: 0.2346940641829402.
[I 2025-12-06 13:37:01,075] Trial 77 finished with value: 0.2129486986712764 and parameters: {'model_type': 'graphsage', 'hidden_dims': '[256, 128, 64]', 'dropout': 0.45296887490040205, 'batch_norm': True, 'sage_aggr': 'mean', 'sage_normalize': False, 'sage_project': False, 'lr': 2.7577755229542323e-05, 'weight_decay': 5.69934286212026e-07, 'epochs': 211, 'loss': 'mae', 'optimizer': 'adam', 'graph_mode': 'knn', 'knn_k': 10, 'weighted_edges': False, 'symmetrize_mode': 'union', 'self_loops': False, 'use_snp_selection': False, 'graphsage_batch_size': 8}. Best is trial 65 with value: 0.2346940641829402.
[I 2025-12-06 13:37:54,499] Trial 78 finished with value: 0.19735748905887088 and parameters: {'model_type': 'graphsage', 'hidden_dims': '[256, 128, 64]', 'dropout': 0.3406273122326669, 'batch_norm': True, 'sage_aggr': 'mean', 'sage_normalize': True, 'sage_project': False, 'lr': 1.9500535718077853e-05, 'weight_decay': 1.3169921294247745e-06, 'epochs': 193, 'loss': 'mse', 'optimizer': 'adam', 'graph_mode': 'cutoff', 'cutoff': 0.708413836690517, 'grm_norm': 'cosine_then_gcn', 'self_loops': False, 'use_snp_selection': True, 'num_snps': 32273, 'graphsage_batch_size': 512}. Best is trial 65 with value: 0.2346940641829402.
[I 2025-12-06 13:39:30,176] Trial 79 finished with value: 0.23704232560089328 and parameters: {'model_type': 'graphsage', 'hidden_dims': '[512, 128]', 'dropout': 0.1370859781082004, 'batch_norm': True, 'sage_aggr': 'max', 'sage_normalize': False, 'sage_project': False, 'lr': 2.97580292493102e-05, 'weight_decay': 1.0419331978968207e-05, 'epochs': 153, 'loss': 'mae', 'optimizer': 'adam', 'graph_mode': 'cutoff', 'cutoff': 0.6523591810880447, 'grm_norm': 'none', 'self_loops': False, 'use_snp_selection': False, 'graphsage_batch_size': 512}. Best is trial 79 with value: 0.23704232560089328.
[I 2025-12-06 13:40:51,537] Trial 80 finished with value: 0.22850135796643906 and parameters: {'model_type': 'graphsage', 'hidden_dims': '[512, 128]', 'dropout': 0.12966385972254865, 'batch_norm': True, 'sage_aggr': 'mean', 'sage_normalize': False, 'sage_project': False, 'lr': 3.189840283301015e-05, 'weight_decay': 6.678838540569248e-06, 'epochs': 127, 'loss': 'mse', 'optimizer': 'adam', 'graph_mode': 'cutoff', 'cutoff': 0.6512262805037732, 'grm_norm': 'none', 'self_loops': False, 'use_snp_selection': False, 'graphsage_batch_size': 512}. Best is trial 79 with value: 0.23704232560089328.
[I 2025-12-06 13:42:27,003] Trial 81 finished with value: 0.23205269610627882 and parameters: {'model_type': 'graphsage', 'hidden_dims': '[512, 128]', 'dropout': 0.10129569447194241, 'batch_norm': True, 'sage_aggr': 'max', 'sage_normalize': False, 'sage_project': False, 'lr': 4.1234379017075326e-05, 'weight_decay': 1.1846620819178219e-05, 'epochs': 153, 'loss': 'mae', 'optimizer': 'adam', 'graph_mode': 'cutoff', 'cutoff': 0.6834835671936639, 'grm_norm': 'none', 'self_loops': False, 'use_snp_selection': False, 'graphsage_batch_size': 512}. Best is trial 79 with value: 0.23704232560089328.
[I 2025-12-06 13:43:55,507] Trial 82 finished with value: 0.2213925970561997 and parameters: {'model_type': 'graphsage', 'hidden_dims': '[512, 128]', 'dropout': 0.10494425526723658, 'batch_norm': True, 'sage_aggr': 'max', 'sage_normalize': False, 'sage_project': False, 'lr': 2.2960585144204443e-05, 'weight_decay': 9.892747544152674e-06, 'epochs': 138, 'loss': 'mae', 'optimizer': 'adam', 'graph_mode': 'cutoff', 'cutoff': 0.604261306026397, 'grm_norm': 'none', 'self_loops': False, 'use_snp_selection': False, 'graphsage_batch_size': 512}. Best is trial 79 with value: 0.23704232560089328.
[I 2025-12-06 13:45:29,099] Trial 83 finished with value: 0.22834555161759237 and parameters: {'model_type': 'graphsage', 'hidden_dims': '[512, 128]', 'dropout': 0.1507146315725458, 'batch_norm': True, 'sage_aggr': 'max', 'sage_normalize': False, 'sage_project': False, 'lr': 4.1523615962997915e-05, 'weight_decay': 1.7181546294912156e-05, 'epochs': 150, 'loss': 'mae', 'optimizer': 'adam', 'graph_mode': 'cutoff', 'cutoff': 0.7087803175834501, 'grm_norm': 'none', 'self_loops': False, 'use_snp_selection': False, 'graphsage_batch_size': 512}. Best is trial 79 with value: 0.23704232560089328.
