[I 2025-12-09 03:01:46,280] Trial 120 finished with value: 0.28908838222210376 and parameters: {'model_type': 'graphsage', 'hidden_dims': '[512, 256]', 'dropout': 0.4297580244913743, 'batch_norm': False, 'sage_aggr': 'mean', 'sage_normalize': False, 'sage_project': False, 'lr': 2.276945009144417e-05, 'weight_decay': 2.3967008735157054e-05, 'epochs': 237, 'loss': 'mae', 'optimizer': 'adam', 'graph_mode': 'cutoff', 'cutoff': 0.5653154717358584, 'grm_norm': 'gcn', 'self_loops': False, 'use_snp_selection': False}. Best is trial 118 with value: 0.29171594113557.
[I 2025-12-09 03:03:35,780] Trial 121 finished with value: 0.2896389791897488 and parameters: {'model_type': 'graphsage', 'hidden_dims': '[512, 256]', 'dropout': 0.4254264278195729, 'batch_norm': False, 'sage_aggr': 'mean', 'sage_normalize': False, 'sage_project': False, 'lr': 1.7560676565517868e-05, 'weight_decay': 2.1267934376400178e-05, 'epochs': 230, 'loss': 'mae', 'optimizer': 'adam', 'graph_mode': 'cutoff', 'cutoff': 0.5620292610601754, 'grm_norm': 'gcn', 'self_loops': False, 'use_snp_selection': False}. Best is trial 118 with value: 0.29171594113557.
[I 2025-12-09 03:05:28,248] Trial 122 finished with value: 0.28255135425669076 and parameters: {'model_type': 'graphsage', 'hidden_dims': '[512, 256]', 'dropout': 0.42734244245481523, 'batch_norm': False, 'sage_aggr': 'mean', 'sage_normalize': False, 'sage_project': False, 'lr': 2.2499512936905474e-05, 'weight_decay': 1.89822670219138e-05, 'epochs': 238, 'loss': 'mae', 'optimizer': 'adam', 'graph_mode': 'cutoff', 'cutoff': 0.5655298492632959, 'grm_norm': 'gcn', 'self_loops': False, 'use_snp_selection': False}. Best is trial 118 with value: 0.29171594113557.
[I 2025-12-09 03:07:18,098] Trial 123 finished with value: 0.29113015682975496 and parameters: {'model_type': 'graphsage', 'hidden_dims': '[512, 256]', 'dropout': 0.40561547930901654, 'batch_norm': False, 'sage_aggr': 'mean', 'sage_normalize': False, 'sage_project': False, 'lr': 1.7766786514625125e-05, 'weight_decay': 3.680950781323662e-05, 'epochs': 229, 'loss': 'mae', 'optimizer': 'adam', 'graph_mode': 'cutoff', 'cutoff': 0.5526852148015329, 'grm_norm': 'gcn', 'self_loops': False, 'use_snp_selection': False}. Best is trial 118 with value: 0.29171594113557.
[I 2025-12-09 03:09:19,103] Trial 124 finished with value: 0.27101773394408424 and parameters: {'model_type': 'graphsage', 'hidden_dims': '[512, 256]', 'dropout': 0.4051817710539085, 'batch_norm': False, 'sage_aggr': 'mean', 'sage_normalize': False, 'sage_project': False, 'lr': 2.780216469430679e-05, 'weight_decay': 3.4586388183007565e-05, 'epochs': 236, 'loss': 'mae', 'optimizer': 'adam', 'graph_mode': 'cutoff', 'cutoff': 0.4939727136818731, 'grm_norm': 'gcn', 'self_loops': False, 'use_snp_selection': False}. Best is trial 118 with value: 0.29171594113557.
[I 2025-12-09 03:11:14,111] Trial 125 finished with value: 0.27832669381024877 and parameters: {'model_type': 'graphsage', 'hidden_dims': '[512, 256]', 'dropout': 0.4297035448215541, 'batch_norm': False, 'sage_aggr': 'mean', 'sage_normalize': False, 'sage_project': False, 'lr': 4.65752021819172e-05, 'weight_decay': 5.703867481343221e-05, 'epochs': 230, 'loss': 'mae', 'optimizer': 'adam', 'graph_mode': 'cutoff', 'cutoff': 0.5121231277836779, 'grm_norm': 'gcn', 'self_loops': False, 'use_snp_selection': False}. Best is trial 118 with value: 0.29171594113557.
[I 2025-12-09 03:13:00,178] Trial 126 finished with value: 0.28954549547156105 and parameters: {'model_type': 'graphsage', 'hidden_dims': '[512, 256]', 'dropout': 0.39364883800480976, 'batch_norm': False, 'sage_aggr': 'mean', 'sage_normalize': False, 'sage_project': False, 'lr': 1.842778486855031e-05, 'weight_decay': 2.7352256152534356e-05, 'epochs': 220, 'loss': 'mae', 'optimizer': 'adam', 'graph_mode': 'cutoff', 'cutoff': 0.5522406133476666, 'grm_norm': 'gcn', 'self_loops': False, 'use_snp_selection': False}. Best is trial 118 with value: 0.29171594113557.
[I 2025-12-09 03:14:51,079] Trial 127 finished with value: 0.2473604197344291 and parameters: {'model_type': 'graphsage', 'hidden_dims': '[512, 256]', 'dropout': 0.44477618972252175, 'batch_norm': False, 'sage_aggr': 'mean', 'sage_normalize': True, 'sage_project': False, 'lr': 1.7832790786518473e-05, 'weight_decay': 2.3584385829571925e-05, 'epochs': 220, 'loss': 'mae', 'optimizer': 'adam', 'graph_mode': 'cutoff', 'cutoff': 0.5309096125910956, 'grm_norm': 'gcn', 'self_loops': False, 'use_snp_selection': False}. Best is trial 118 with value: 0.29171594113557.
[I 2025-12-09 03:16:40,686] Trial 128 finished with value: 0.28671037425564266 and parameters: {'model_type': 'graphsage', 'hidden_dims': '[512, 256]', 'dropout': 0.4361685402902299, 'batch_norm': False, 'sage_aggr': 'mean', 'sage_normalize': False, 'sage_project': False, 'lr': 2.375922455541038e-05, 'weight_decay': 2.899517737102912e-05, 'epochs': 228, 'loss': 'mae', 'optimizer': 'adam', 'graph_mode': 'cutoff', 'cutoff': 0.5475466991299361, 'grm_norm': 'gcn', 'self_loops': False, 'use_snp_selection': False}. Best is trial 118 with value: 0.29171594113557.
[I 2025-12-09 03:18:36,588] Trial 129 finished with value: 0.2839370864534862 and parameters: {'model_type': 'graphsage', 'hidden_dims': '[512, 256]', 'dropout': 0.39896429297508934, 'batch_norm': False, 'sage_aggr': 'max', 'sage_normalize': False, 'sage_project': False, 'lr': 1.6422240221811193e-05, 'weight_decay': 1.4559118372753638e-05, 'epochs': 243, 'loss': 'mae', 'optimizer': 'adam', 'graph_mode': 'cutoff', 'cutoff': 0.5567740454176369, 'grm_norm': 'gcn', 'self_loops': True, 'use_snp_selection': False}. Best is trial 118 with value: 0.29171594113557.
[I 2025-12-09 03:20:31,325] Trial 130 finished with value: 0.2616460591688501 and parameters: {'model_type': 'graphsage', 'hidden_dims': '[512, 256]', 'dropout': 0.48286656965034447, 'batch_norm': False, 'sage_aggr': 'mean', 'sage_normalize': False, 'sage_project': False, 'lr': 3.30603440686887e-05, 'weight_decay': 4.09390858805535e-05, 'epochs': 232, 'loss': 'mse', 'optimizer': 'adam', 'graph_mode': 'knn', 'knn_k': 3, 'weighted_edges': True, 'symmetrize_mode': 'mutual', 'self_loops': False, 'use_snp_selection': False}. Best is trial 118 with value: 0.29171594113557.
[I 2025-12-09 03:22:27,092] Trial 131 finished with value: 0.28913739241669595 and parameters: {'model_type': 'graphsage', 'hidden_dims': '[512, 256]', 'dropout': 0.3877723012649208, 'batch_norm': False, 'sage_aggr': 'mean', 'sage_normalize': False, 'sage_project': False, 'lr': 1.947590279316271e-05, 'weight_decay': 7.557692309689804e-05, 'epochs': 247, 'loss': 'mae', 'optimizer': 'adam', 'graph_mode': 'cutoff', 'cutoff': 0.580457095272595, 'grm_norm': 'gcn', 'self_loops': False, 'use_snp_selection': False}. Best is trial 118 with value: 0.29171594113557.
[I 2025-12-09 03:24:20,479] Trial 132 finished with value: 0.290707495860026 and parameters: {'model_type': 'graphsage', 'hidden_dims': '[512, 256]', 'dropout': 0.4091187630167025, 'batch_norm': False, 'sage_aggr': 'mean', 'sage_normalize': False, 'sage_project': False, 'lr': 2.018159846861938e-05, 'weight_decay': 0.00010608038878916301, 'epochs': 240, 'loss': 'mae', 'optimizer': 'adam', 'graph_mode': 'cutoff', 'cutoff': 0.566969783836095, 'grm_norm': 'gcn', 'self_loops': False, 'use_snp_selection': False}. Best is trial 118 with value: 0.29171594113557.
[I 2025-12-09 03:26:17,664] Trial 133 finished with value: 0.2869506855445934 and parameters: {'model_type': 'graphsage', 'hidden_dims': '[512, 256]', 'dropout': 0.40662611055240344, 'batch_norm': False, 'sage_aggr': 'mean', 'sage_normalize': False, 'sage_project': False, 'lr': 2.0508990376191905e-05, 'weight_decay': 8.62608037451247e-05, 'epochs': 242, 'loss': 'mae', 'optimizer': 'adam', 'graph_mode': 'cutoff', 'cutoff': 0.5350309702682318, 'grm_norm': 'gcn', 'self_loops': False, 'use_snp_selection': False}. Best is trial 118 with value: 0.29171594113557.
[I 2025-12-09 03:28:02,422] Trial 134 finished with value: 0.290202972455422 and parameters: {'model_type': 'graphsage', 'hidden_dims': '[512, 256]', 'dropout': 0.4238247937232533, 'batch_norm': False, 'sage_aggr': 'mean', 'sage_normalize': False, 'sage_project': False, 'lr': 1.8464660656902365e-05, 'weight_decay': 0.00012121792193425283, 'epochs': 221, 'loss': 'mae', 'optimizer': 'adam', 'graph_mode': 'cutoff', 'cutoff': 0.5832820220396733, 'grm_norm': 'gcn', 'self_loops': False, 'use_snp_selection': False}. Best is trial 118 with value: 0.29171594113557.
[I 2025-12-09 03:29:47,794] Trial 135 finished with value: 0.2845028845176204 and parameters: {'model_type': 'graphsage', 'hidden_dims': '[512, 256]', 'dropout': 0.3822052614492114, 'batch_norm': False, 'sage_aggr': 'mean', 'sage_normalize': False, 'sage_project': False, 'lr': 2.7237445651934125e-05, 'weight_decay': 9.131509381434396e-05, 'epochs': 223, 'loss': 'mae', 'optimizer': 'adam', 'graph_mode': 'cutoff', 'cutoff': 0.5805408036423206, 'grm_norm': 'gcn', 'self_loops': False, 'use_snp_selection': False}. Best is trial 118 with value: 0.29171594113557.
[I 2025-12-09 03:30:51,276] Trial 136 finished with value: 0.28377485017984416 and parameters: {'model_type': 'graphsage', 'hidden_dims': '[512, 256]', 'dropout': 0.4218228506202067, 'batch_norm': False, 'sage_aggr': 'mean', 'sage_normalize': False, 'sage_project': False, 'lr': 1.97119885923622e-05, 'weight_decay': 0.00012349238767921013, 'epochs': 217, 'loss': 'mae', 'optimizer': 'adam', 'graph_mode': 'cutoff', 'cutoff': 0.5495239120195216, 'grm_norm': 'gcn', 'self_loops': False, 'use_snp_selection': True, 'num_snps': 20693}. Best is trial 118 with value: 0.29171594113557.
[I 2025-12-09 03:32:56,112] Trial 137 finished with value: 0.27743290534802706 and parameters: {'model_type': 'graphsage', 'hidden_dims': '[512, 256]', 'dropout': 0.4055337947480097, 'batch_norm': False, 'sage_aggr': 'mean', 'sage_normalize': False, 'sage_project': False, 'lr': 2.409354945748682e-05, 'weight_decay': 0.00015550166195497938, 'epochs': 247, 'loss': 'mae', 'optimizer': 'adam', 'graph_mode': 'cutoff', 'cutoff': 0.5019562195572411, 'grm_norm': 'gcn', 'self_loops': False, 'use_snp_selection': False}. Best is trial 118 with value: 0.29171594113557.
[I 2025-12-09 03:34:53,244] Trial 138 finished with value: 0.2820309157151034 and parameters: {'model_type': 'graphsage', 'hidden_dims': '[512, 256]', 'dropout': 0.4289302018910742, 'batch_norm': False, 'sage_aggr': 'mean', 'sage_normalize': False, 'sage_project': False, 'lr': 1.5069912981847933e-05, 'weight_decay': 6.070628877243259e-05, 'epochs': 237, 'loss': 'mae', 'optimizer': 'adam', 'graph_mode': 'cutoff', 'cutoff': 0.5211622673428015, 'grm_norm': 'gcn', 'self_loops': False, 'use_snp_selection': False}. Best is trial 118 with value: 0.29171594113557.
[I 2025-12-09 03:36:58,095] Trial 139 finished with value: 0.28378596548306145 and parameters: {'model_type': 'graphsage', 'hidden_dims': '[512, 256]', 'dropout': 0.3957131712125656, 'batch_norm': True, 'sage_aggr': 'mean', 'sage_normalize': False, 'sage_project': False, 'lr': 1.8447685260965988e-05, 'weight_decay': 0.00023046880071794643, 'epochs': 259, 'loss': 'mae', 'optimizer': 'adam', 'graph_mode': 'cutoff', 'cutoff': 0.5596364224472563, 'grm_norm': 'gcn', 'self_loops': False, 'use_snp_selection': False}. Best is trial 118 with value: 0.29171594113557.
[I 2025-12-09 03:38:56,263] Trial 140 finished with value: 0.2742114189748956 and parameters: {'model_type': 'graphsage', 'hidden_dims': '[512, 256]', 'dropout': 0.41306619965247404, 'batch_norm': False, 'sage_aggr': 'mean', 'sage_normalize': False, 'sage_project': False, 'lr': 1.526833544109764e-05, 'weight_decay': 4.6487053428415376e-05, 'epochs': 226, 'loss': 'mae', 'optimizer': 'adam', 'graph_mode': 'cutoff', 'cutoff': 0.48131656107111237, 'grm_norm': 'gcn', 'self_loops': False, 'use_snp_selection': False}. Best is trial 118 with value: 0.29171594113557.
[I 2025-12-09 03:40:44,945] Trial 141 finished with value: 0.29043268125861527 and parameters: {'model_type': 'graphsage', 'hidden_dims': '[512, 256]', 'dropout': 0.45811280264108356, 'batch_norm': False, 'sage_aggr': 'mean', 'sage_normalize': False, 'sage_project': False, 'lr': 1.772837158675867e-05, 'weight_decay': 0.00012432315428966426, 'epochs': 230, 'loss': 'mae', 'optimizer': 'adam', 'graph_mode': 'cutoff', 'cutoff': 0.5763561386401039, 'grm_norm': 'gcn', 'self_loops': False, 'use_snp_selection': False}. Best is trial 118 with value: 0.29171594113557.
[I 2025-12-09 03:42:36,235] Trial 142 finished with value: 0.28730016960188837 and parameters: {'model_type': 'graphsage', 'hidden_dims': '[512, 256]', 'dropout': 0.4400003132923512, 'batch_norm': False, 'sage_aggr': 'mean', 'sage_normalize': False, 'sage_project': False, 'lr': 2.2170733414327187e-05, 'weight_decay': 0.00011731807027933924, 'epochs': 237, 'loss': 'mae', 'optimizer': 'adam', 'graph_mode': 'cutoff', 'cutoff': 0.5810344409080751, 'grm_norm': 'gcn', 'self_loops': False, 'use_snp_selection': False}. Best is trial 118 with value: 0.29171594113557.
[I 2025-12-09 03:43:39,711] Trial 143 finished with value: 0.2875403839689634 and parameters: {'model_type': 'graphsage', 'hidden_dims': '[256, 128]', 'dropout': 0.4548950449212679, 'batch_norm': False, 'sage_aggr': 'mean', 'sage_normalize': False, 'sage_project': False, 'lr': 1.1454390020713746e-05, 'weight_decay': 7.602394107955954e-05, 'epochs': 215, 'loss': 'mae', 'optimizer': 'adam', 'graph_mode': 'cutoff', 'cutoff': 0.5412986804537252, 'grm_norm': 'gcn', 'self_loops': False, 'use_snp_selection': False}. Best is trial 118 with value: 0.29171594113557.
[I 2025-12-09 03:45:35,268] Trial 144 finished with value: 0.2884879295998787 and parameters: {'model_type': 'graphsage', 'hidden_dims': '[512, 256]', 'dropout': 0.3861748137700412, 'batch_norm': False, 'sage_aggr': 'mean', 'sage_normalize': False, 'sage_project': False, 'lr': 1.586105242302408e-05, 'weight_decay': 0.00010073102789311574, 'epochs': 245, 'loss': 'mae', 'optimizer': 'adam', 'graph_mode': 'cutoff', 'cutoff': 0.5680831559970307, 'grm_norm': 'gcn', 'self_loops': False, 'use_snp_selection': False}. Best is trial 118 with value: 0.29171594113557.
[I 2025-12-09 03:47:33,955] Trial 145 finished with value: 0.2819042782418074 and parameters: {'model_type': 'graphsage', 'hidden_dims': '[512, 256]', 'dropout': 0.4217139158278155, 'batch_norm': False, 'sage_aggr': 'mean', 'sage_normalize': False, 'sage_project': False, 'lr': 3.270068669840119e-05, 'weight_decay': 1.898150998120527e-05, 'epochs': 251, 'loss': 'mae', 'optimizer': 'adam', 'graph_mode': 'cutoff', 'cutoff': 0.5522798875608735, 'grm_norm': 'gcn', 'self_loops': False, 'use_snp_selection': False}. Best is trial 118 with value: 0.29171594113557.
[I 2025-12-09 03:49:18,704] Trial 146 finished with value: 0.282138349766882 and parameters: {'model_type': 'graphsage', 'hidden_dims': '[512, 256]', 'dropout': 0.5015920793261652, 'batch_norm': False, 'sage_aggr': 'mean', 'sage_normalize': False, 'sage_project': False, 'lr': 2.6672872927943994e-05, 'weight_decay': 2.5904973682505735e-05, 'epochs': 222, 'loss': 'mae', 'optimizer': 'adam', 'graph_mode': 'cutoff', 'cutoff': 0.5869153512682674, 'grm_norm': 'gcn', 'self_loops': False, 'use_snp_selection': False}. Best is trial 118 with value: 0.29171594113557.
[I 2025-12-09 03:51:06,357] Trial 147 finished with value: 0.28439369742981147 and parameters: {'model_type': 'graphsage', 'hidden_dims': '[512, 256]', 'dropout': 0.46072807223382606, 'batch_norm': False, 'sage_aggr': 'mean', 'sage_normalize': False, 'sage_project': False, 'lr': 1.9329063320774233e-05, 'weight_decay': 0.00021542028817563978, 'epochs': 230, 'loss': 'mae', 'optimizer': 'adam', 'graph_mode': 'cutoff', 'cutoff': 0.6118880935827962, 'grm_norm': 'gcn', 'self_loops': False, 'use_snp_selection': False}. Best is trial 118 with value: 0.29171594113557.
[I 2025-12-09 03:51:51,710] Trial 148 finished with value: 0.28480362622989625 and parameters: {'model_type': 'graphsage', 'hidden_dims': '[128, 64]', 'dropout': 0.43520607117876786, 'batch_norm': False, 'sage_aggr': 'mean', 'sage_normalize': False, 'sage_project': False, 'lr': 1.109936996493836e-05, 'weight_decay': 9.694970383743397e-06, 'epochs': 240, 'loss': 'mae', 'optimizer': 'adam', 'graph_mode': 'cutoff', 'cutoff': 0.5716352707060217, 'grm_norm': 'gcn', 'self_loops': False, 'use_snp_selection': False}. Best is trial 118 with value: 0.29171594113557.
[I 2025-12-09 03:53:49,871] Trial 149 finished with value: 0.2470646847891443 and parameters: {'model_type': 'graphsage', 'hidden_dims': '[512, 256]', 'dropout': 0.4102348928758596, 'batch_norm': False, 'sage_aggr': 'max', 'sage_normalize': True, 'sage_project': False, 'lr': 1.700754093284788e-05, 'weight_decay': 1.2050504936523493e-05, 'epochs': 233, 'loss': 'mae', 'optimizer': 'adam', 'graph_mode': 'cutoff', 'cutoff': 0.5304424395145069, 'grm_norm': 'gcn', 'self_loops': False, 'use_snp_selection': False}. Best is trial 118 with value: 0.29171594113557.
[I 2025-12-09 03:55:31,453] Trial 0 finished with value: 0.25445526321873774 and parameters: {'model_type': 'graphsage', 'hidden_dims': '[128, 64]', 'dropout': 0.199031432379812, 'batch_norm': True, 'sage_aggr': 'max', 'sage_normalize': True, 'sage_project': False, 'lr': 0.00034401453323286885, 'weight_decay': 0.00017802616915745114, 'epochs': 230, 'loss': 'mse', 'optimizer': 'adam', 'graph_mode': 'knn', 'knn_k': 6, 'weighted_edges': True, 'symmetrize_mode': 'mutual', 'self_loops': True, 'use_snp_selection': False}. Best is trial 0 with value: 0.25445526321873774.
[I 2025-12-09 03:57:17,231] Trial 1 finished with value: 0.2804207806410758 and parameters: {'model_type': 'graphsage', 'hidden_dims': '[512, 128]', 'dropout': 0.2503500283181017, 'batch_norm': False, 'sage_aggr': 'max', 'sage_normalize': False, 'sage_project': False, 'lr': 3.952233718592099e-05, 'weight_decay': 0.00026754769258252603, 'epochs': 149, 'loss': 'mse', 'optimizer': 'adam', 'graph_mode': 'knn', 'knn_k': 2, 'weighted_edges': False, 'symmetrize_mode': 'mutual', 'self_loops': True, 'use_snp_selection': True, 'num_snps': 49915}. Best is trial 1 with value: 0.2804207806410758.
[I 2025-12-09 03:58:36,942] Trial 2 finished with value: 0.27875933892100707 and parameters: {'model_type': 'graphsage', 'hidden_dims': '[512, 256]', 'dropout': 0.2785908793172681, 'batch_norm': False, 'sage_aggr': 'max', 'sage_normalize': False, 'sage_project': False, 'lr': 8.806039223165805e-05, 'weight_decay': 3.5153176302760294e-05, 'epochs': 147, 'loss': 'mae', 'optimizer': 'adam', 'graph_mode': 'cutoff', 'cutoff': 0.4922564006874869, 'grm_norm': 'gcn', 'self_loops': False, 'use_snp_selection': True, 'num_snps': 34340}. Best is trial 1 with value: 0.2804207806410758.
[I 2025-12-09 03:59:54,783] Trial 3 finished with value: 0.2871675609741687 and parameters: {'model_type': 'graphsage', 'hidden_dims': '[256, 128, 64]', 'dropout': 0.3475243154412272, 'batch_norm': True, 'sage_aggr': 'max', 'sage_normalize': False, 'sage_project': False, 'lr': 1.6006331996938085e-05, 'weight_decay': 7.213121225589906e-06, 'epochs': 283, 'loss': 'mse', 'optimizer': 'adam', 'graph_mode': 'cutoff', 'cutoff': 0.5942334791449215, 'grm_norm': 'none', 'self_loops': True, 'use_snp_selection': False}. Best is trial 3 with value: 0.2871675609741687.
[I 2025-12-09 04:00:38,076] Trial 4 finished with value: 0.2656478399577259 and parameters: {'model_type': 'graphsage', 'hidden_dims': '[128, 64]', 'dropout': 0.3348926467202472, 'batch_norm': True, 'sage_aggr': 'max', 'sage_normalize': False, 'sage_project': False, 'lr': 0.0004238630400638802, 'weight_decay': 8.074086040046576e-07, 'epochs': 158, 'loss': 'mae', 'optimizer': 'adam', 'graph_mode': 'knn', 'knn_k': 1, 'weighted_edges': False, 'symmetrize_mode': 'mutual', 'self_loops': False, 'use_snp_selection': True, 'num_snps': 26850}. Best is trial 3 with value: 0.2871675609741687.
[I 2025-12-09 04:02:32,411] Trial 5 finished with value: 0.24601593612025002 and parameters: {'model_type': 'graphsage', 'hidden_dims': '[512, 64]', 'dropout': 0.14505336736221927, 'batch_norm': True, 'sage_aggr': 'mean', 'sage_normalize': True, 'sage_project': False, 'lr': 1.2962030165732234e-05, 'weight_decay': 1.326598071105465e-07, 'epochs': 180, 'loss': 'mse', 'optimizer': 'adam', 'graph_mode': 'knn', 'knn_k': 9, 'weighted_edges': True, 'symmetrize_mode': 'mutual', 'self_loops': False, 'use_snp_selection': False}. Best is trial 3 with value: 0.2871675609741687.
[I 2025-12-09 04:03:26,903] Trial 6 finished with value: 0.28567534695498226 and parameters: {'model_type': 'graphsage', 'hidden_dims': '[256, 128, 64]', 'dropout': 0.10731743755162496, 'batch_norm': True, 'sage_aggr': 'mean', 'sage_normalize': False, 'sage_project': False, 'lr': 1.922990426933137e-05, 'weight_decay': 7.30001060446905e-05, 'epochs': 63, 'loss': 'mae', 'optimizer': 'adam', 'graph_mode': 'cutoff', 'cutoff': 0.7624978434202536, 'grm_norm': 'none', 'self_loops': True, 'use_snp_selection': True, 'num_snps': 50106}. Best is trial 3 with value: 0.2871675609741687.
[I 2025-12-09 04:05:28,140] Trial 7 finished with value: 0.27271157422597225 and parameters: {'model_type': 'graphsage', 'hidden_dims': '[512, 64]', 'dropout': 0.2585007811528941, 'batch_norm': True, 'sage_aggr': 'max', 'sage_normalize': True, 'sage_project': False, 'lr': 5.921425508303391e-05, 'weight_decay': 0.0004511561961144237, 'epochs': 182, 'loss': 'mae', 'optimizer': 'adam', 'graph_mode': 'knn', 'knn_k': 9, 'weighted_edges': True, 'symmetrize_mode': 'union', 'self_loops': False, 'use_snp_selection': True, 'num_snps': 23903}. Best is trial 3 with value: 0.2871675609741687.
