[I 2025-12-09 03:11:38,551] Trial 73 finished with value: 0.3722506612382502 and parameters: {'model_type': 'graphsage', 'hidden_dims': '[512, 256]', 'dropout': 0.2271440380850846, 'batch_norm': False, 'sage_aggr': 'max', 'sage_normalize': False, 'sage_project': False, 'lr': 5.031874574874411e-05, 'weight_decay': 1.2685538077170988e-05, 'epochs': 250, 'loss': 'mae', 'optimizer': 'adam', 'graph_mode': 'knn', 'knn_k': 6, 'weighted_edges': False, 'symmetrize_mode': 'union', 'self_loops': True, 'use_snp_selection': True, 'num_snps': 44237}. Best is trial 72 with value: 0.38017846584785514.
[I 2025-12-09 03:16:51,241] Trial 74 finished with value: 0.37347878047020044 and parameters: {'model_type': 'graphsage', 'hidden_dims': '[512, 256]', 'dropout': 0.1983665802852214, 'batch_norm': False, 'sage_aggr': 'max', 'sage_normalize': False, 'sage_project': False, 'lr': 3.6997995387331884e-05, 'weight_decay': 2.040043503305029e-05, 'epochs': 299, 'loss': 'mae', 'optimizer': 'adam', 'graph_mode': 'knn', 'knn_k': 6, 'weighted_edges': False, 'symmetrize_mode': 'union', 'self_loops': True, 'use_snp_selection': True, 'num_snps': 51770}. Best is trial 72 with value: 0.38017846584785514.
[I 2025-12-09 03:20:57,073] Trial 75 finished with value: 0.37333956776087696 and parameters: {'model_type': 'graphsage', 'hidden_dims': '[512, 256]', 'dropout': 0.17257134832551668, 'batch_norm': False, 'sage_aggr': 'max', 'sage_normalize': False, 'sage_project': False, 'lr': 8.782211319120607e-05, 'weight_decay': 4.06945934404687e-06, 'epochs': 288, 'loss': 'mae', 'optimizer': 'adam', 'graph_mode': 'knn', 'knn_k': 5, 'weighted_edges': False, 'symmetrize_mode': 'union', 'self_loops': True, 'use_snp_selection': True, 'num_snps': 47412}. Best is trial 72 with value: 0.38017846584785514.
[I 2025-12-09 03:25:45,195] Trial 76 finished with value: 0.3565729949969261 and parameters: {'model_type': 'graphsage', 'hidden_dims': '[512, 256]', 'dropout': 0.24170822228858968, 'batch_norm': False, 'sage_aggr': 'max', 'sage_normalize': False, 'sage_project': False, 'lr': 0.00013748253517803792, 'weight_decay': 1.2839049926462045e-05, 'epochs': 209, 'loss': 'mae', 'optimizer': 'adam', 'graph_mode': 'knn', 'knn_k': 7, 'weighted_edges': False, 'symmetrize_mode': 'union', 'self_loops': True, 'use_snp_selection': True, 'num_snps': 56949}. Best is trial 72 with value: 0.38017846584785514.
[I 2025-12-09 03:29:56,463] Trial 77 finished with value: 0.36473006094348676 and parameters: {'model_type': 'graphsage', 'hidden_dims': '[512, 256]', 'dropout': 0.18517240503064378, 'batch_norm': False, 'sage_aggr': 'mean', 'sage_normalize': False, 'sage_project': False, 'lr': 6.332488067800728e-05, 'weight_decay': 7.502640450012125e-06, 'epochs': 311, 'loss': 'mae', 'optimizer': 'adam', 'graph_mode': 'knn', 'knn_k': 6, 'weighted_edges': False, 'symmetrize_mode': 'union', 'self_loops': True, 'use_snp_selection': True, 'num_snps': 43111}. Best is trial 72 with value: 0.38017846584785514.
[I 2025-12-09 03:34:24,131] Trial 78 finished with value: 0.36381327606223673 and parameters: {'model_type': 'graphsage', 'hidden_dims': '[512, 256]', 'dropout': 0.21120858823516217, 'batch_norm': False, 'sage_aggr': 'max', 'sage_normalize': False, 'sage_project': False, 'lr': 3.957848855500994e-05, 'weight_decay': 2.418083020964069e-05, 'epochs': 323, 'loss': 'mse', 'optimizer': 'adam', 'graph_mode': 'knn', 'knn_k': 5, 'weighted_edges': False, 'symmetrize_mode': 'union', 'self_loops': True, 'use_snp_selection': True, 'num_snps': 45262}. Best is trial 72 with value: 0.38017846584785514.
[I 2025-12-09 03:37:26,080] Trial 79 finished with value: 0.17956913153382412 and parameters: {'model_type': 'graphsage', 'hidden_dims': '[512, 256]', 'dropout': 0.11136234177636778, 'batch_norm': False, 'sage_aggr': 'max', 'sage_normalize': True, 'sage_project': False, 'lr': 0.00927402245350831, 'weight_decay': 1.8119120931652283e-05, 'epochs': 229, 'loss': 'mae', 'optimizer': 'adam', 'graph_mode': 'knn', 'knn_k': 6, 'weighted_edges': False, 'symmetrize_mode': 'union', 'self_loops': True, 'use_snp_selection': True, 'num_snps': 39396}. Best is trial 72 with value: 0.38017846584785514.
[I 2025-12-09 03:43:13,719] Trial 80 finished with value: 0.33044801543605107 and parameters: {'model_type': 'graphsage', 'hidden_dims': '[512, 256]', 'dropout': 0.2767906274399937, 'batch_norm': True, 'sage_aggr': 'max', 'sage_normalize': False, 'sage_project': False, 'lr': 5.384303338854053e-05, 'weight_decay': 3.6244201066437324e-05, 'epochs': 269, 'loss': 'mae', 'optimizer': 'adam', 'graph_mode': 'knn', 'knn_k': 8, 'weighted_edges': False, 'symmetrize_mode': 'union', 'self_loops': True, 'use_snp_selection': True, 'num_snps': 50975}. Best is trial 72 with value: 0.38017846584785514.
[I 2025-12-09 03:48:42,632] Trial 81 finished with value: 0.36959133427228963 and parameters: {'model_type': 'graphsage', 'hidden_dims': '[512, 256]', 'dropout': 0.19800747966296578, 'batch_norm': False, 'sage_aggr': 'max', 'sage_normalize': False, 'sage_project': False, 'lr': 4.0411295048887953e-05, 'weight_decay': 1.9229124375422523e-05, 'epochs': 300, 'loss': 'mae', 'optimizer': 'adam', 'graph_mode': 'knn', 'knn_k': 6, 'weighted_edges': False, 'symmetrize_mode': 'union', 'self_loops': True, 'use_snp_selection': True, 'num_snps': 52776}. Best is trial 72 with value: 0.38017846584785514.
[I 2025-12-09 03:53:16,460] Trial 82 finished with value: 0.37260737783668657 and parameters: {'model_type': 'graphsage', 'hidden_dims': '[512, 256]', 'dropout': 0.22375421543614327, 'batch_norm': False, 'sage_aggr': 'max', 'sage_normalize': False, 'sage_project': False, 'lr': 2.9583168413279302e-05, 'weight_decay': 9.548155579104083e-06, 'epochs': 283, 'loss': 'mae', 'optimizer': 'adam', 'graph_mode': 'knn', 'knn_k': 6, 'weighted_edges': False, 'symmetrize_mode': 'union', 'self_loops': True, 'use_snp_selection': True, 'num_snps': 49632}. Best is trial 72 with value: 0.38017846584785514.
[I 2025-12-09 04:00:29,012] Trial 83 finished with value: 0.36834526242613624 and parameters: {'model_type': 'graphsage', 'hidden_dims': '[512, 256]', 'dropout': 0.16733225058076456, 'batch_norm': False, 'sage_aggr': 'max', 'sage_normalize': False, 'sage_project': False, 'lr': 3.655106922484561e-05, 'weight_decay': 1.4640960040599798e-05, 'epochs': 332, 'loss': 'mae', 'optimizer': 'adam', 'graph_mode': 'knn', 'knn_k': 7, 'weighted_edges': False, 'symmetrize_mode': 'union', 'self_loops': True, 'use_snp_selection': True, 'num_snps': 56942}. Best is trial 72 with value: 0.38017846584785514.
[I 2025-12-09 04:04:10,194] Trial 84 finished with value: 0.37771135875416034 and parameters: {'model_type': 'graphsage', 'hidden_dims': '[512, 256]', 'dropout': 0.1996071625109691, 'batch_norm': False, 'sage_aggr': 'max', 'sage_normalize': False, 'sage_project': False, 'lr': 7.157126401318768e-05, 'weight_decay': 1.1255006109158516e-05, 'epochs': 249, 'loss': 'mae', 'optimizer': 'adam', 'graph_mode': 'knn', 'knn_k': 5, 'weighted_edges': False, 'symmetrize_mode': 'union', 'self_loops': True, 'use_snp_selection': True, 'num_snps': 46605}. Best is trial 72 with value: 0.38017846584785514.
[I 2025-12-09 04:08:03,743] Trial 85 finished with value: 0.3727179953505725 and parameters: {'model_type': 'graphsage', 'hidden_dims': '[512, 256]', 'dropout': 0.13445693504599396, 'batch_norm': False, 'sage_aggr': 'max', 'sage_normalize': False, 'sage_project': False, 'lr': 7.04541151694614e-05, 'weight_decay': 1.943174735520766e-06, 'epochs': 262, 'loss': 'mae', 'optimizer': 'adam', 'graph_mode': 'knn', 'knn_k': 5, 'weighted_edges': False, 'symmetrize_mode': 'union', 'self_loops': True, 'use_snp_selection': True, 'num_snps': 47346}. Best is trial 72 with value: 0.38017846584785514.
[I 2025-12-09 04:10:25,847] Trial 86 finished with value: 0.36022097564605093 and parameters: {'model_type': 'graphsage', 'hidden_dims': '[128, 64]', 'dropout': 0.2655150744817416, 'batch_norm': False, 'sage_aggr': 'max', 'sage_normalize': False, 'sage_project': False, 'lr': 0.00011573410077119893, 'weight_decay': 1.1308365270374818e-05, 'epochs': 248, 'loss': 'mae', 'optimizer': 'adam', 'graph_mode': 'knn', 'knn_k': 4, 'weighted_edges': False, 'symmetrize_mode': 'union', 'self_loops': True, 'use_snp_selection': True, 'num_snps': 43598}. Best is trial 72 with value: 0.38017846584785514.
[I 2025-12-09 04:13:15,472] Trial 87 finished with value: 0.3778206887126857 and parameters: {'model_type': 'graphsage', 'hidden_dims': '[512, 256]', 'dropout': 0.17898384644845125, 'batch_norm': False, 'sage_aggr': 'max', 'sage_normalize': False, 'sage_project': False, 'lr': 8.701105625426119e-05, 'weight_decay': 2.7932524504449496e-05, 'epochs': 218, 'loss': 'mae', 'optimizer': 'adam', 'graph_mode': 'knn', 'knn_k': 5, 'weighted_edges': False, 'symmetrize_mode': 'union', 'self_loops': True, 'use_snp_selection': True, 'num_snps': 41864}. Best is trial 72 with value: 0.38017846584785514.
[I 2025-12-09 04:15:00,246] Trial 88 finished with value: 0.34401772409802905 and parameters: {'model_type': 'graphsage', 'hidden_dims': '[256, 128, 64]', 'dropout': 0.18523150850273026, 'batch_norm': False, 'sage_aggr': 'max', 'sage_normalize': False, 'sage_project': False, 'lr': 8.25376224994843e-05, 'weight_decay': 7.678553112087281e-06, 'epochs': 219, 'loss': 'mae', 'optimizer': 'adam', 'graph_mode': 'knn', 'knn_k': 5, 'weighted_edges': False, 'symmetrize_mode': 'mutual', 'self_loops': True, 'use_snp_selection': True, 'num_snps': 39638}. Best is trial 72 with value: 0.38017846584785514.
[I 2025-12-09 04:17:35,945] Trial 89 finished with value: 0.2791688668751215 and parameters: {'model_type': 'graphsage', 'hidden_dims': '[512, 64]', 'dropout': 0.21323197501557345, 'batch_norm': False, 'sage_aggr': 'max', 'sage_normalize': False, 'sage_project': False, 'lr': 9.645133647026345e-05, 'weight_decay': 2.9750839810358162e-05, 'epochs': 188, 'loss': 'mae', 'optimizer': 'adam', 'graph_mode': 'knn', 'knn_k': 4, 'weighted_edges': False, 'symmetrize_mode': 'union', 'self_loops': True, 'use_snp_selection': True, 'num_snps': 45356}. Best is trial 72 with value: 0.38017846584785514.
[I 2025-12-09 04:21:20,456] Trial 90 finished with value: 0.37022518396430404 and parameters: {'model_type': 'graphsage', 'hidden_dims': '[512, 256]', 'dropout': 0.31161374942622067, 'batch_norm': False, 'sage_aggr': 'mean', 'sage_normalize': False, 'sage_project': False, 'lr': 0.00015381725700768612, 'weight_decay': 4.455053250937064e-06, 'epochs': 231, 'loss': 'mse', 'optimizer': 'adam', 'graph_mode': 'knn', 'knn_k': 8, 'weighted_edges': False, 'symmetrize_mode': 'union', 'self_loops': True, 'use_snp_selection': True, 'num_snps': 42262}. Best is trial 72 with value: 0.38017846584785514.
[I 2025-12-09 04:24:36,340] Trial 91 finished with value: 0.3729932905616427 and parameters: {'model_type': 'graphsage', 'hidden_dims': '[512, 256]', 'dropout': 0.1447620130135154, 'batch_norm': False, 'sage_aggr': 'max', 'sage_normalize': False, 'sage_project': False, 'lr': 5.469662824349564e-05, 'weight_decay': 1.1480847294989707e-05, 'epochs': 206, 'loss': 'mae', 'optimizer': 'adam', 'graph_mode': 'knn', 'knn_k': 5, 'weighted_edges': False, 'symmetrize_mode': 'union', 'self_loops': True, 'use_snp_selection': True, 'num_snps': 47617}. Best is trial 72 with value: 0.38017846584785514.
[I 2025-12-09 04:28:36,338] Trial 92 finished with value: 0.3771117971612623 and parameters: {'model_type': 'graphsage', 'hidden_dims': '[512, 256]', 'dropout': 0.17681972306204763, 'batch_norm': False, 'sage_aggr': 'max', 'sage_normalize': False, 'sage_project': False, 'lr': 5.988711643982023e-05, 'weight_decay': 1.5257139263240965e-05, 'epochs': 257, 'loss': 'mae', 'optimizer': 'adam', 'graph_mode': 'knn', 'knn_k': 6, 'weighted_edges': False, 'symmetrize_mode': 'union', 'self_loops': True, 'use_snp_selection': True, 'num_snps': 44770}. Best is trial 72 with value: 0.38017846584785514.
[I 2025-12-09 04:31:55,317] Trial 93 finished with value: 0.3767917565304312 and parameters: {'model_type': 'graphsage', 'hidden_dims': '[512, 256]', 'dropout': 0.1675254595886354, 'batch_norm': False, 'sage_aggr': 'max', 'sage_normalize': False, 'sage_project': False, 'lr': 7.594746168486479e-05, 'weight_decay': 1.6509088689479433e-05, 'epochs': 238, 'loss': 'mae', 'optimizer': 'adam', 'graph_mode': 'knn', 'knn_k': 5, 'weighted_edges': False, 'symmetrize_mode': 'union', 'self_loops': True, 'use_snp_selection': True, 'num_snps': 43827}. Best is trial 72 with value: 0.38017846584785514.
[I 2025-12-09 04:35:03,409] Trial 94 finished with value: 0.37254251280601147 and parameters: {'model_type': 'graphsage', 'hidden_dims': '[512, 256]', 'dropout': 0.1760903744204322, 'batch_norm': False, 'sage_aggr': 'max', 'sage_normalize': False, 'sage_project': False, 'lr': 0.00020019787419331737, 'weight_decay': 1.516075075301205e-05, 'epochs': 224, 'loss': 'mae', 'optimizer': 'adam', 'graph_mode': 'knn', 'knn_k': 7, 'weighted_edges': True, 'symmetrize_mode': 'union', 'self_loops': True, 'use_snp_selection': True, 'num_snps': 37461}. Best is trial 72 with value: 0.38017846584785514.
[I 2025-12-09 04:37:45,788] Trial 95 finished with value: 0.36740046362576395 and parameters: {'model_type': 'graphsage', 'hidden_dims': '[512, 256]', 'dropout': 0.20252877937804123, 'batch_norm': False, 'sage_aggr': 'max', 'sage_normalize': False, 'sage_project': False, 'lr': 7.565284396738026e-05, 'weight_decay': 7.577138271555333e-06, 'epochs': 238, 'loss': 'mae', 'optimizer': 'adam', 'graph_mode': 'knn', 'knn_k': 6, 'weighted_edges': False, 'symmetrize_mode': 'mutual', 'self_loops': True, 'use_snp_selection': True, 'num_snps': 44499}. Best is trial 72 with value: 0.38017846584785514.
[I 2025-12-09 04:40:19,136] Trial 96 finished with value: 0.3689834722304229 and parameters: {'model_type': 'graphsage', 'hidden_dims': '[512, 256]', 'dropout': 0.23680317016253566, 'batch_norm': False, 'sage_aggr': 'max', 'sage_normalize': False, 'sage_project': False, 'lr': 0.00011856123713453429, 'weight_decay': 5.659616451445209e-06, 'epochs': 218, 'loss': 'mae', 'optimizer': 'adam', 'graph_mode': 'knn', 'knn_k': 4, 'weighted_edges': False, 'symmetrize_mode': 'union', 'self_loops': True, 'use_snp_selection': True, 'num_snps': 40029}. Best is trial 72 with value: 0.38017846584785514.
[I 2025-12-09 04:44:11,976] Trial 97 finished with value: 0.3428164192150453 and parameters: {'model_type': 'graphsage', 'hidden_dims': '[512, 256]', 'dropout': 0.15892475784879526, 'batch_norm': True, 'sage_aggr': 'max', 'sage_normalize': True, 'sage_project': False, 'lr': 6.11086178651091e-05, 'weight_decay': 3.721681702903366e-05, 'epochs': 243, 'loss': 'mae', 'optimizer': 'adam', 'graph_mode': 'knn', 'knn_k': 7, 'weighted_edges': False, 'symmetrize_mode': 'union', 'self_loops': True, 'use_snp_selection': True, 'num_snps': 42076}. Best is trial 72 with value: 0.38017846584785514.
[I 2025-12-09 04:47:26,165] Trial 98 finished with value: 0.3655552065285514 and parameters: {'model_type': 'graphsage', 'hidden_dims': '[256, 128]', 'dropout': 0.21853471835008192, 'batch_norm': False, 'sage_aggr': 'max', 'sage_normalize': False, 'sage_project': False, 'lr': 6.748727358293037e-05, 'weight_decay': 1.0625774477270155e-05, 'epochs': 257, 'loss': 'mae', 'optimizer': 'adam', 'graph_mode': 'knn', 'knn_k': 5, 'weighted_edges': False, 'symmetrize_mode': 'union', 'self_loops': True, 'use_snp_selection': True, 'num_snps': 46916}. Best is trial 72 with value: 0.38017846584785514.
[I 2025-12-09 04:50:27,832] Trial 99 finished with value: 0.36543576428419844 and parameters: {'model_type': 'graphsage', 'hidden_dims': '[128, 64]', 'dropout': 0.18493920206755093, 'batch_norm': False, 'sage_aggr': 'max', 'sage_normalize': False, 'sage_project': False, 'lr': 9.136685259839148e-05, 'weight_decay': 1.571017971966399e-05, 'epochs': 278, 'loss': 'mae', 'optimizer': 'adam', 'graph_mode': 'knn', 'knn_k': 6, 'weighted_edges': True, 'symmetrize_mode': 'union', 'self_loops': True, 'use_snp_selection': True, 'num_snps': 40774}. Best is trial 72 with value: 0.38017846584785514.
[I 2025-12-09 04:52:50,257] Trial 100 finished with value: 0.3559251488402639 and parameters: {'model_type': 'graphsage', 'hidden_dims': '[512, 256]', 'dropout': 0.46199485223913284, 'batch_norm': False, 'sage_aggr': 'max', 'sage_normalize': False, 'sage_project': False, 'lr': 4.530746308035136e-05, 'weight_decay': 6.402093815130752e-06, 'epochs': 214, 'loss': 'mae', 'optimizer': 'adam', 'graph_mode': 'knn', 'knn_k': 4, 'weighted_edges': False, 'symmetrize_mode': 'union', 'self_loops': True, 'use_snp_selection': True, 'num_snps': 36442}. Best is trial 72 with value: 0.38017846584785514.
[I 2025-12-09 04:56:50,320] Trial 101 finished with value: 0.37241108480990925 and parameters: {'model_type': 'graphsage', 'hidden_dims': '[512, 256]', 'dropout': 0.16700896494341963, 'batch_norm': False, 'sage_aggr': 'max', 'sage_normalize': False, 'sage_project': False, 'lr': 5.641844773507772e-05, 'weight_decay': 2.6190931759282985e-05, 'epochs': 247, 'loss': 'mae', 'optimizer': 'adam', 'graph_mode': 'knn', 'knn_k': 5, 'weighted_edges': False, 'symmetrize_mode': 'union', 'self_loops': True, 'use_snp_selection': True, 'num_snps': 50119}. Best is trial 72 with value: 0.38017846584785514.
[I 2025-12-09 05:00:26,898] Trial 102 finished with value: 0.37199048790771594 and parameters: {'model_type': 'graphsage', 'hidden_dims': '[512, 256]', 'dropout': 0.20264699380996834, 'batch_norm': False, 'sage_aggr': 'max', 'sage_normalize': False, 'sage_project': False, 'lr': 8.318491010362475e-05, 'weight_decay': 8.803646687089292e-06, 'epochs': 272, 'loss': 'mae', 'optimizer': 'adam', 'graph_mode': 'knn', 'knn_k': 5, 'weighted_edges': False, 'symmetrize_mode': 'union', 'self_loops': True, 'use_snp_selection': True, 'num_snps': 42565}. Best is trial 72 with value: 0.38017846584785514.
[I 2025-12-09 05:03:16,834] Trial 103 finished with value: 0.37396332581574043 and parameters: {'model_type': 'graphsage', 'hidden_dims': '[512, 256]', 'dropout': 0.17829203199965693, 'batch_norm': False, 'sage_aggr': 'max', 'sage_normalize': False, 'sage_project': False, 'lr': 2.181055064136849e-05, 'weight_decay': 4.404217615201628e-06, 'epochs': 258, 'loss': 'mae', 'optimizer': 'adam', 'graph_mode': 'knn', 'knn_k': 3, 'weighted_edges': False, 'symmetrize_mode': 'union', 'self_loops': True, 'use_snp_selection': True, 'num_snps': 44848}. Best is trial 72 with value: 0.38017846584785514.
[I 2025-12-09 05:08:16,636] Trial 104 finished with value: 0.3684448814108313 and parameters: {'model_type': 'graphsage', 'hidden_dims': '[512, 256]', 'dropout': 0.16357426540187506, 'batch_norm': False, 'sage_aggr': 'max', 'sage_normalize': False, 'sage_project': False, 'lr': 3.0900937665571556e-05, 'weight_decay': 1.3473845423213305e-05, 'epochs': 238, 'loss': 'mae', 'optimizer': 'adam', 'graph_mode': 'knn', 'knn_k': 7, 'weighted_edges': False, 'symmetrize_mode': 'union', 'self_loops': True, 'use_snp_selection': True, 'num_snps': 53279}. Best is trial 72 with value: 0.38017846584785514.
[I 2025-12-09 05:11:46,145] Trial 105 finished with value: 0.37046392190736727 and parameters: {'model_type': 'graphsage', 'hidden_dims': '[512, 256]', 'dropout': 0.13051534483692404, 'batch_norm': False, 'sage_aggr': 'max', 'sage_normalize': False, 'sage_project': False, 'lr': 0.00012795783991635204, 'weight_decay': 6.240614946724668e-05, 'epochs': 229, 'loss': 'mae', 'optimizer': 'adam', 'graph_mode': 'knn', 'knn_k': 6, 'weighted_edges': False, 'symmetrize_mode': 'union', 'self_loops': True, 'use_snp_selection': True, 'num_snps': 46304}. Best is trial 72 with value: 0.38017846584785514.
[I 2025-12-09 05:14:49,131] Trial 106 finished with value: 0.35097807097305694 and parameters: {'model_type': 'graphsage', 'hidden_dims': '[256, 128, 64]', 'dropout': 0.15092315952931287, 'batch_norm': False, 'sage_aggr': 'max', 'sage_normalize': False, 'sage_project': False, 'lr': 0.00011194789186250352, 'weight_decay': 1.6982573878748834e-05, 'epochs': 263, 'loss': 'mae', 'optimizer': 'adam', 'graph_mode': 'knn', 'knn_k': 8, 'weighted_edges': False, 'symmetrize_mode': 'mutual', 'self_loops': True, 'use_snp_selection': True, 'num_snps': 49031}. Best is trial 72 with value: 0.38017846584785514.
[I 2025-12-09 05:18:16,853] Trial 107 finished with value: 0.07277355723841891 and parameters: {'model_type': 'graphsage', 'hidden_dims': '[512, 64]', 'dropout': 0.5662804466006538, 'batch_norm': False, 'sage_aggr': 'max', 'sage_normalize': False, 'sage_project': False, 'lr': 0.00016318673527351856, 'weight_decay': 2.9723149172050197e-05, 'epochs': 252, 'loss': 'mae', 'optimizer': 'adam', 'graph_mode': 'knn', 'knn_k': 5, 'weighted_edges': False, 'symmetrize_mode': 'union', 'self_loops': True, 'use_snp_selection': True, 'num_snps': 43874}. Best is trial 72 with value: 0.38017846584785514.
[I 2025-12-09 05:22:43,342] Trial 108 finished with value: 0.10300785598593942 and parameters: {'model_type': 'graphsage', 'hidden_dims': '[512, 256]', 'dropout': 0.18897996283386287, 'batch_norm': False, 'sage_aggr': 'mean', 'sage_normalize': False, 'sage_project': False, 'lr': 0.0022547332090193037, 'weight_decay': 2.5240718472210317e-05, 'epochs': 234, 'loss': 'mse', 'optimizer': 'adam', 'graph_mode': 'knn', 'knn_k': 7, 'weighted_edges': False, 'symmetrize_mode': 'union', 'self_loops': True, 'use_snp_selection': True, 'num_snps': 50418}. Best is trial 72 with value: 0.38017846584785514.
[I 2025-12-09 05:25:24,933] Trial 109 finished with value: 0.3776179887592105 and parameters: {'model_type': 'graphsage', 'hidden_dims': '[512, 256]', 'dropout': 0.1244513482285583, 'batch_norm': False, 'sage_aggr': 'max', 'sage_normalize': False, 'sage_project': False, 'lr': 4.456954545579725e-05, 'weight_decay': 3.0342450429300657e-06, 'epochs': 200, 'loss': 'mae', 'optimizer': 'adam', 'graph_mode': 'knn', 'knn_k': 6, 'weighted_edges': False, 'symmetrize_mode': 'union', 'self_loops': True, 'use_snp_selection': True, 'num_snps': 38523}. Best is trial 72 with value: 0.38017846584785514.
