[I 2025-12-06 01:40:05,912] Trial 145 finished with value: 0.25858089235485154 and parameters: {'model_type': 'graphsage', 'hidden_dims': '[128, 64]', 'dropout': 0.11919381862080371, 'batch_norm': False, 'sage_aggr': 'mean', 'sage_normalize': False, 'sage_project': False, 'lr': 0.00024314400797525304, 'weight_decay': 6.445013142945273e-07, 'epochs': 152, 'loss': 'mae', 'optimizer': 'adam', 'graph_mode': 'cutoff', 'cutoff': 0.6803400111369272, 'grm_norm': 'gcn', 'self_loops': False, 'use_snp_selection': True, 'num_snps': 18298, 'graphsage_batch_size': 8}. Best is trial 144 with value: 0.2660740229882091.
[I 2025-12-06 01:40:28,713] Trial 146 finished with value: 0.2617452909043566 and parameters: {'model_type': 'graphsage', 'hidden_dims': '[128, 64]', 'dropout': 0.11688492753647806, 'batch_norm': False, 'sage_aggr': 'mean', 'sage_normalize': False, 'sage_project': False, 'lr': 0.0002475103438829322, 'weight_decay': 6.492057493160752e-07, 'epochs': 151, 'loss': 'mae', 'optimizer': 'adam', 'graph_mode': 'cutoff', 'cutoff': 0.6815088669421537, 'grm_norm': 'gcn', 'self_loops': False, 'use_snp_selection': True, 'num_snps': 17798, 'graphsage_batch_size': 8}. Best is trial 144 with value: 0.2660740229882091.
[I 2025-12-06 01:41:05,939] Trial 147 finished with value: 0.25738467755408484 and parameters: {'model_type': 'graphsage', 'hidden_dims': '[512, 128]', 'dropout': 0.1193274944476706, 'batch_norm': False, 'sage_aggr': 'mean', 'sage_normalize': False, 'sage_project': False, 'lr': 0.0002800180784856824, 'weight_decay': 1.4417067785782676e-06, 'epochs': 152, 'loss': 'mae', 'optimizer': 'adam', 'graph_mode': 'cutoff', 'cutoff': 0.6240616862484948, 'grm_norm': 'gcn', 'self_loops': False, 'use_snp_selection': True, 'num_snps': 17654, 'graphsage_batch_size': 8}. Best is trial 144 with value: 0.2660740229882091.
[I 2025-12-06 01:41:29,078] Trial 148 finished with value: 0.22077980772594374 and parameters: {'model_type': 'graphsage', 'hidden_dims': '[128, 64]', 'dropout': 0.11605169353467297, 'batch_norm': False, 'sage_aggr': 'mean', 'sage_normalize': True, 'sage_project': False, 'lr': 0.00027101562598262266, 'weight_decay': 1.3513017689927164e-06, 'epochs': 154, 'loss': 'mae', 'optimizer': 'adam', 'graph_mode': 'cutoff', 'cutoff': 0.6230179811883606, 'grm_norm': 'gcn', 'self_loops': False, 'use_snp_selection': True, 'num_snps': 17436, 'graphsage_batch_size': 8}. Best is trial 144 with value: 0.2660740229882091.
[I 2025-12-06 01:42:05,943] Trial 149 finished with value: 0.22195519986405127 and parameters: {'model_type': 'graphsage', 'hidden_dims': '[512, 128]', 'dropout': 0.10619180013364607, 'batch_norm': False, 'sage_aggr': 'mean', 'sage_normalize': False, 'sage_project': False, 'lr': 0.00032881928153730903, 'weight_decay': 1.55478038557119e-06, 'epochs': 144, 'loss': 'mae', 'optimizer': 'adam', 'graph_mode': 'knn', 'knn_k': 7, 'weighted_edges': False, 'symmetrize_mode': 'mutual', 'self_loops': False, 'use_snp_selection': True, 'num_snps': 14523, 'graphsage_batch_size': 8}. Best is trial 144 with value: 0.2660740229882091.
[I 2025-12-06 01:42:50,593] Trial 0 finished with value: 0.14832545526983762 and parameters: {'model_type': 'graphsage', 'hidden_dims': '[128, 64]', 'dropout': 0.199031432379812, 'batch_norm': True, 'sage_aggr': 'max', 'sage_normalize': False, 'sage_project': False, 'lr': 3.4401453323286906e-05, 'weight_decay': 0.00017802616915745114, 'epochs': 169, 'loss': 'mse', 'optimizer': 'adam', 'graph_mode': 'knn', 'knn_k': 6, 'weighted_edges': True, 'symmetrize_mode': 'mutual', 'self_loops': False, 'use_snp_selection': False, 'graphsage_batch_size': 256}. Best is trial 0 with value: 0.14832545526983762.
[I 2025-12-06 01:43:38,613] Trial 1 finished with value: 0.19402985910498094 and parameters: {'model_type': 'graphsage', 'hidden_dims': '[512, 128]', 'dropout': 0.3737930779596218, 'batch_norm': True, 'sage_aggr': 'mean', 'sage_normalize': False, 'sage_project': False, 'lr': 0.0004485485309869717, 'weight_decay': 2.0046868950224612e-06, 'epochs': 74, 'loss': 'mse', 'optimizer': 'adam', 'graph_mode': 'knn', 'knn_k': 4, 'weighted_edges': True, 'symmetrize_mode': 'union', 'self_loops': False, 'use_snp_selection': False, 'graphsage_batch_size': 8}. Best is trial 1 with value: 0.19402985910498094.
[I 2025-12-06 01:44:10,401] Trial 2 finished with value: 0.1698379866825463 and parameters: {'model_type': 'graphsage', 'hidden_dims': '[256, 128]', 'dropout': 0.2731735750400165, 'batch_norm': False, 'sage_aggr': 'max', 'sage_normalize': True, 'sage_project': False, 'lr': 3.4705625989073525e-05, 'weight_decay': 2.4623319020131338e-05, 'epochs': 95, 'loss': 'mse', 'optimizer': 'adam', 'graph_mode': 'knn', 'knn_k': 6, 'weighted_edges': False, 'symmetrize_mode': 'mutual', 'self_loops': False, 'use_snp_selection': True, 'num_snps': 30713, 'graphsage_batch_size': 8}. Best is trial 1 with value: 0.19402985910498094.
[I 2025-12-06 01:44:55,378] Trial 3 finished with value: 0.160235009067013 and parameters: {'model_type': 'graphsage', 'hidden_dims': '[256, 128]', 'dropout': 0.3815953422463725, 'batch_norm': False, 'sage_aggr': 'mean', 'sage_normalize': True, 'sage_project': False, 'lr': 2.1095572616816696e-06, 'weight_decay': 5.195307220037778e-07, 'epochs': 226, 'loss': 'mse', 'optimizer': 'adam', 'graph_mode': 'knn', 'knn_k': 8, 'weighted_edges': True, 'symmetrize_mode': 'union', 'self_loops': False, 'use_snp_selection': True, 'num_snps': 16419, 'graphsage_batch_size': 128}. Best is trial 1 with value: 0.19402985910498094.
[I 2025-12-06 01:46:25,041] Trial 4 finished with value: 0.14839210043240048 and parameters: {'model_type': 'graphsage', 'hidden_dims': '[256, 128]', 'dropout': 0.3920979142653378, 'batch_norm': True, 'sage_aggr': 'max', 'sage_normalize': True, 'sage_project': False, 'lr': 3.15214685884738e-06, 'weight_decay': 1.0663862019069792e-05, 'epochs': 212, 'loss': 'mae', 'optimizer': 'adam', 'graph_mode': 'cutoff', 'cutoff': 0.33867046005138823, 'grm_norm': 'gcn', 'self_loops': False, 'use_snp_selection': False, 'graphsage_batch_size': 512}. Best is trial 1 with value: 0.19402985910498094.
[I 2025-12-06 01:46:44,686] Trial 5 finished with value: 0.19737999217564556 and parameters: {'model_type': 'graphsage', 'hidden_dims': '[256, 128]', 'dropout': 0.32925710311863654, 'batch_norm': True, 'sage_aggr': 'mean', 'sage_normalize': True, 'sage_project': False, 'lr': 0.00016905333078305474, 'weight_decay': 6.711044850912148e-06, 'epochs': 127, 'loss': 'mae', 'optimizer': 'adam', 'graph_mode': 'cutoff', 'cutoff': 0.253959783091227, 'grm_norm': 'cosine_then_gcn', 'self_loops': False, 'use_snp_selection': True, 'num_snps': 7419, 'graphsage_batch_size': 64}. Best is trial 5 with value: 0.19737999217564556.
[I 2025-12-06 01:48:14,682] Trial 6 finished with value: 0.11119278697631026 and parameters: {'model_type': 'graphsage', 'hidden_dims': '[512, 64]', 'dropout': 0.2585007811528941, 'batch_norm': True, 'sage_aggr': 'max', 'sage_normalize': False, 'sage_project': False, 'lr': 5.921425508303395e-06, 'weight_decay': 0.0004511561961144237, 'epochs': 136, 'loss': 'mae', 'optimizer': 'adam', 'graph_mode': 'knn', 'knn_k': 9, 'weighted_edges': True, 'symmetrize_mode': 'union', 'self_loops': False, 'use_snp_selection': True, 'num_snps': 34427, 'graphsage_batch_size': 128}. Best is trial 5 with value: 0.19737999217564556.
[I 2025-12-06 01:49:46,214] Trial 7 finished with value: 0.17877893969394895 and parameters: {'model_type': 'graphsage', 'hidden_dims': '[512, 128]', 'dropout': 0.5944584870981006, 'batch_norm': False, 'sage_aggr': 'max', 'sage_normalize': True, 'sage_project': False, 'lr': 7.3241868695773595e-06, 'weight_decay': 1.2565521754060153e-06, 'epochs': 166, 'loss': 'mse', 'optimizer': 'adam', 'graph_mode': 'knn', 'knn_k': 5, 'weighted_edges': False, 'symmetrize_mode': 'mutual', 'self_loops': False, 'use_snp_selection': True, 'num_snps': 50019, 'graphsage_batch_size': 8}. Best is trial 5 with value: 0.19737999217564556.
[I 2025-12-06 01:50:49,124] Trial 8 finished with value: 0.14980917891390488 and parameters: {'model_type': 'graphsage', 'hidden_dims': '[512, 64]', 'dropout': 0.5703535192416116, 'batch_norm': False, 'sage_aggr': 'mean', 'sage_normalize': False, 'sage_project': False, 'lr': 1.823510325310572e-06, 'weight_decay': 0.00013672790135428885, 'epochs': 104, 'loss': 'mae', 'optimizer': 'adam', 'graph_mode': 'knn', 'knn_k': 7, 'weighted_edges': True, 'symmetrize_mode': 'mutual', 'self_loops': False, 'use_snp_selection': True, 'num_snps': 45923, 'graphsage_batch_size': 128}. Best is trial 5 with value: 0.19737999217564556.
[I 2025-12-06 01:52:45,589] Trial 9 finished with value: 0.2156308293876772 and parameters: {'model_type': 'graphsage', 'hidden_dims': '[512, 128]', 'dropout': 0.27261839493092876, 'batch_norm': False, 'sage_aggr': 'mean', 'sage_normalize': False, 'sage_project': False, 'lr': 5.88603310717523e-06, 'weight_decay': 1.0998339923223823e-05, 'epochs': 249, 'loss': 'mae', 'optimizer': 'adam', 'graph_mode': 'knn', 'knn_k': 3, 'weighted_edges': False, 'symmetrize_mode': 'mutual', 'self_loops': False, 'use_snp_selection': False, 'graphsage_batch_size': 128}. Best is trial 9 with value: 0.2156308293876772.
[I 2025-12-06 01:54:15,337] Trial 10 finished with value: 0.23234478373462286 and parameters: {'model_type': 'graphsage', 'hidden_dims': '[512, 256]', 'dropout': 0.11372025982957354, 'batch_norm': False, 'sage_aggr': 'mean', 'sage_normalize': False, 'sage_project': False, 'lr': 1.320954302422749e-05, 'weight_decay': 1.2257443862615642e-07, 'epochs': 197, 'loss': 'mae', 'optimizer': 'adam', 'graph_mode': 'cutoff', 'cutoff': 0.8339492830671671, 'grm_norm': 'none', 'self_loops': False, 'use_snp_selection': False, 'graphsage_batch_size': 32}. Best is trial 10 with value: 0.23234478373462286.
[I 2025-12-06 01:56:03,476] Trial 11 finished with value: 0.21640653213301406 and parameters: {'model_type': 'graphsage', 'hidden_dims': '[512, 256]', 'dropout': 0.10222657792332025, 'batch_norm': False, 'sage_aggr': 'mean', 'sage_normalize': False, 'sage_project': False, 'lr': 1.3209655691727925e-05, 'weight_decay': 1.3081036432574914e-07, 'epochs': 242, 'loss': 'mae', 'optimizer': 'adam', 'graph_mode': 'cutoff', 'cutoff': 0.8841591475995373, 'grm_norm': 'none', 'self_loops': False, 'use_snp_selection': False, 'graphsage_batch_size': 32}. Best is trial 10 with value: 0.23234478373462286.
[I 2025-12-06 01:57:33,608] Trial 12 finished with value: 0.2190984543341156 and parameters: {'model_type': 'graphsage', 'hidden_dims': '[512, 256]', 'dropout': 0.11848165151157439, 'batch_norm': False, 'sage_aggr': 'mean', 'sage_normalize': False, 'sage_project': False, 'lr': 1.6135806111022914e-05, 'weight_decay': 1.0539977805680418e-07, 'epochs': 198, 'loss': 'mae', 'optimizer': 'adam', 'graph_mode': 'cutoff', 'cutoff': 0.8999975932582684, 'grm_norm': 'none', 'self_loops': False, 'use_snp_selection': False, 'graphsage_batch_size': 32}. Best is trial 10 with value: 0.23234478373462286.
[I 2025-12-06 01:59:02,553] Trial 13 finished with value: 0.2244365893883004 and parameters: {'model_type': 'graphsage', 'hidden_dims': '[512, 256]', 'dropout': 0.10085201161116182, 'batch_norm': False, 'sage_aggr': 'mean', 'sage_normalize': False, 'sage_project': False, 'lr': 0.00014626888081117106, 'weight_decay': 1.422233897992561e-07, 'epochs': 195, 'loss': 'mae', 'optimizer': 'adam', 'graph_mode': 'cutoff', 'cutoff': 0.8894544210054713, 'grm_norm': 'none', 'self_loops': False, 'use_snp_selection': False, 'graphsage_batch_size': 32}. Best is trial 10 with value: 0.23234478373462286.
[I 2025-12-06 01:59:51,957] Trial 14 finished with value: 0.21888411370538258 and parameters: {'model_type': 'graphsage', 'hidden_dims': '[256, 128, 64]', 'dropout': 0.17336918863160672, 'batch_norm': False, 'sage_aggr': 'mean', 'sage_normalize': False, 'sage_project': False, 'lr': 0.00011116018577506711, 'weight_decay': 4.4114649605173185e-07, 'epochs': 189, 'loss': 'mae', 'optimizer': 'adam', 'graph_mode': 'cutoff', 'cutoff': 0.6752188856300831, 'grm_norm': 'cosine', 'self_loops': False, 'use_snp_selection': False, 'graphsage_batch_size': 32}. Best is trial 10 with value: 0.23234478373462286.
[I 2025-12-06 02:00:18,268] Trial 15 finished with value: 0.08495841947606528 and parameters: {'model_type': 'graphsage', 'hidden_dims': '[512, 256]', 'dropout': 0.46689080254430726, 'batch_norm': False, 'sage_aggr': 'mean', 'sage_normalize': False, 'sage_project': False, 'lr': 0.0008000134635777176, 'weight_decay': 3.939158144371285e-07, 'epochs': 42, 'loss': 'mae', 'optimizer': 'adam', 'graph_mode': 'cutoff', 'cutoff': 0.7001405380378066, 'grm_norm': 'none', 'self_loops': False, 'use_snp_selection': False, 'graphsage_batch_size': 16}. Best is trial 10 with value: 0.23234478373462286.
[I 2025-12-06 02:01:37,052] Trial 16 finished with value: 0.22396745958149142 and parameters: {'model_type': 'graphsage', 'hidden_dims': '[512, 256]', 'dropout': 0.18257440095924932, 'batch_norm': False, 'sage_aggr': 'mean', 'sage_normalize': False, 'sage_project': False, 'lr': 7.020797354346516e-05, 'weight_decay': 2.96384767874979e-06, 'epochs': 170, 'loss': 'mae', 'optimizer': 'adam', 'graph_mode': 'cutoff', 'cutoff': 0.7509148358755057, 'grm_norm': 'none', 'self_loops': False, 'use_snp_selection': False, 'graphsage_batch_size': 32}. Best is trial 10 with value: 0.23234478373462286.
[I 2025-12-06 02:03:18,078] Trial 17 finished with value: 0.23190794001393292 and parameters: {'model_type': 'graphsage', 'hidden_dims': '[512, 256]', 'dropout': 0.14150182222544333, 'batch_norm': False, 'sage_aggr': 'mean', 'sage_normalize': False, 'sage_project': False, 'lr': 0.00021148772558498107, 'weight_decay': 2.0446388750238647e-07, 'epochs': 196, 'loss': 'mae', 'optimizer': 'adam', 'graph_mode': 'cutoff', 'cutoff': 0.4895484577568579, 'grm_norm': 'none', 'self_loops': False, 'use_snp_selection': False, 'graphsage_batch_size': 32}. Best is trial 10 with value: 0.23234478373462286.
[I 2025-12-06 02:04:06,348] Trial 18 finished with value: 0.22673320543508657 and parameters: {'model_type': 'graphsage', 'hidden_dims': '[128, 64]', 'dropout': 0.22015910374225037, 'batch_norm': False, 'sage_aggr': 'mean', 'sage_normalize': False, 'sage_project': False, 'lr': 0.0003795300583821111, 'weight_decay': 6.227301937821846e-07, 'epochs': 219, 'loss': 'mae', 'optimizer': 'adam', 'graph_mode': 'cutoff', 'cutoff': 0.4306156129696202, 'grm_norm': 'cosine', 'self_loops': False, 'use_snp_selection': False, 'graphsage_batch_size': 256}. Best is trial 10 with value: 0.23234478373462286.
[I 2025-12-06 02:04:51,700] Trial 19 finished with value: 0.21193670421094346 and parameters: {'model_type': 'graphsage', 'hidden_dims': '[256, 128, 64]', 'dropout': 0.14360360207638995, 'batch_norm': False, 'sage_aggr': 'mean', 'sage_normalize': False, 'sage_project': False, 'lr': 5.3501111728330765e-05, 'weight_decay': 2.1656801047372278e-07, 'epochs': 156, 'loss': 'mae', 'optimizer': 'adam', 'graph_mode': 'cutoff', 'cutoff': 0.5169260490650168, 'grm_norm': 'cosine_then_gcn', 'self_loops': False, 'use_snp_selection': False, 'graphsage_batch_size': 16}. Best is trial 10 with value: 0.23234478373462286.
[I 2025-12-06 02:06:03,606] Trial 20 finished with value: 0.2268408832777372 and parameters: {'model_type': 'graphsage', 'hidden_dims': '[512, 256]', 'dropout': 0.47743156043108925, 'batch_norm': False, 'sage_aggr': 'mean', 'sage_normalize': False, 'sage_project': False, 'lr': 1.4897534508273522e-05, 'weight_decay': 2.8958656088845385e-05, 'epochs': 146, 'loss': 'mae', 'optimizer': 'adam', 'graph_mode': 'cutoff', 'cutoff': 0.5428740037974007, 'grm_norm': 'gcn', 'self_loops': False, 'use_snp_selection': False, 'graphsage_batch_size': 512}. Best is trial 10 with value: 0.23234478373462286.
[I 2025-12-06 02:07:31,299] Trial 21 finished with value: 0.22216006608579025 and parameters: {'model_type': 'graphsage', 'hidden_dims': '[512, 256]', 'dropout': 0.5154708649295417, 'batch_norm': False, 'sage_aggr': 'mean', 'sage_normalize': False, 'sage_project': False, 'lr': 1.40478653359876e-05, 'weight_decay': 4.913667822598453e-05, 'epochs': 184, 'loss': 'mae', 'optimizer': 'adam', 'graph_mode': 'cutoff', 'cutoff': 0.5538253762319407, 'grm_norm': 'gcn', 'self_loops': False, 'use_snp_selection': False, 'graphsage_batch_size': 512}. Best is trial 10 with value: 0.23234478373462286.
[I 2025-12-06 02:08:42,117] Trial 22 finished with value: 0.22873296797536238 and parameters: {'model_type': 'graphsage', 'hidden_dims': '[512, 256]', 'dropout': 0.4564435156666114, 'batch_norm': False, 'sage_aggr': 'mean', 'sage_normalize': False, 'sage_project': False, 'lr': 2.243849918082921e-05, 'weight_decay': 4.316079371049083e-06, 'epochs': 145, 'loss': 'mae', 'optimizer': 'adam', 'graph_mode': 'cutoff', 'cutoff': 0.5591691222505675, 'grm_norm': 'gcn', 'self_loops': False, 'use_snp_selection': False, 'graphsage_batch_size': 512}. Best is trial 10 with value: 0.23234478373462286.
[I 2025-12-06 02:09:51,035] Trial 23 finished with value: 0.22181171148305473 and parameters: {'model_type': 'graphsage', 'hidden_dims': '[512, 256]', 'dropout': 0.4306022156332004, 'batch_norm': False, 'sage_aggr': 'mean', 'sage_normalize': False, 'sage_project': False, 'lr': 2.453988544658007e-05, 'weight_decay': 1.036900975950877e-06, 'epochs': 121, 'loss': 'mae', 'optimizer': 'adam', 'graph_mode': 'cutoff', 'cutoff': 0.41657760496493595, 'grm_norm': 'gcn', 'self_loops': False, 'use_snp_selection': False, 'graphsage_batch_size': 64}. Best is trial 10 with value: 0.23234478373462286.
[I 2025-12-06 02:11:27,789] Trial 24 finished with value: 0.22457918711645974 and parameters: {'model_type': 'graphsage', 'hidden_dims': '[512, 256]', 'dropout': 0.33812970043578733, 'batch_norm': False, 'sage_aggr': 'mean', 'sage_normalize': False, 'sage_project': False, 'lr': 1.0693095775852576e-06, 'weight_decay': 3.6062642545682852e-06, 'epochs': 210, 'loss': 'mae', 'optimizer': 'adam', 'graph_mode': 'cutoff', 'cutoff': 0.6160581318852345, 'grm_norm': 'none', 'self_loops': False, 'use_snp_selection': False, 'graphsage_batch_size': 512}. Best is trial 10 with value: 0.23234478373462286.
[I 2025-12-06 02:12:38,260] Trial 25 finished with value: 0.23113196408388728 and parameters: {'model_type': 'graphsage', 'hidden_dims': '[512, 256]', 'dropout': 0.15468535581668522, 'batch_norm': False, 'sage_aggr': 'mean', 'sage_normalize': False, 'sage_project': False, 'lr': 5.62013328619368e-05, 'weight_decay': 2.5902183932234765e-07, 'epochs': 150, 'loss': 'mae', 'optimizer': 'adam', 'graph_mode': 'cutoff', 'cutoff': 0.7944715549468735, 'grm_norm': 'none', 'self_loops': False, 'use_snp_selection': False, 'graphsage_batch_size': 32}. Best is trial 10 with value: 0.23234478373462286.
[I 2025-12-06 02:14:23,526] Trial 26 finished with value: 0.19559401249445324 and parameters: {'model_type': 'graphsage', 'hidden_dims': '[512, 256]', 'dropout': 0.1495992813597874, 'batch_norm': True, 'sage_aggr': 'max', 'sage_normalize': True, 'sage_project': False, 'lr': 0.0002367642519130749, 'weight_decay': 2.565761257190563e-07, 'epochs': 234, 'loss': 'mse', 'optimizer': 'adam', 'graph_mode': 'cutoff', 'cutoff': 0.7814002301463792, 'grm_norm': 'none', 'self_loops': False, 'use_snp_selection': False, 'graphsage_batch_size': 32}. Best is trial 10 with value: 0.23234478373462286.
[I 2025-12-06 02:14:51,217] Trial 27 finished with value: 0.22927388438401647 and parameters: {'model_type': 'graphsage', 'hidden_dims': '[128, 64]', 'dropout': 0.22557980824967827, 'batch_norm': False, 'sage_aggr': 'mean', 'sage_normalize': False, 'sage_project': False, 'lr': 8.160235888496415e-05, 'weight_decay': 9.087427733478055e-07, 'epochs': 181, 'loss': 'mae', 'optimizer': 'adam', 'graph_mode': 'cutoff', 'cutoff': 0.8000818486590053, 'grm_norm': 'none', 'self_loops': False, 'use_snp_selection': False, 'graphsage_batch_size': 32}. Best is trial 10 with value: 0.23234478373462286.
[I 2025-12-06 02:15:44,687] Trial 28 finished with value: 0.21745749600812156 and parameters: {'model_type': 'graphsage', 'hidden_dims': '[256, 128, 64]', 'dropout': 0.13833556561283564, 'batch_norm': False, 'sage_aggr': 'mean', 'sage_normalize': False, 'sage_project': False, 'lr': 4.724934091924561e-05, 'weight_decay': 2.6589112708977746e-07, 'epochs': 209, 'loss': 'mae', 'optimizer': 'adam', 'graph_mode': 'cutoff', 'cutoff': 0.8047553699724058, 'grm_norm': 'none', 'self_loops': False, 'use_snp_selection': False, 'graphsage_batch_size': 32}. Best is trial 10 with value: 0.23234478373462286.
[I 2025-12-06 02:17:18,814] Trial 29 finished with value: 0.20409229023558853 and parameters: {'model_type': 'graphsage', 'hidden_dims': '[512, 64]', 'dropout': 0.1963393113189109, 'batch_norm': True, 'sage_aggr': 'max', 'sage_normalize': False, 'sage_project': False, 'lr': 0.0002916373178019861, 'weight_decay': 1.0277409356459108e-07, 'epochs': 168, 'loss': 'mse', 'optimizer': 'adam', 'graph_mode': 'cutoff', 'cutoff': 0.45826153822634375, 'grm_norm': 'none', 'self_loops': False, 'use_snp_selection': False, 'graphsage_batch_size': 256}. Best is trial 10 with value: 0.23234478373462286.
[I 2025-12-06 02:17:44,077] Trial 30 finished with value: 0.12061192116214774 and parameters: {'model_type': 'graphsage', 'hidden_dims': '[128, 64]', 'dropout': 0.30442246358079017, 'batch_norm': False, 'sage_aggr': 'mean', 'sage_normalize': False, 'sage_project': False, 'lr': 0.0009501033354359457, 'weight_decay': 1.5703792238695032e-06, 'epochs': 157, 'loss': 'mae', 'optimizer': 'adam', 'graph_mode': 'cutoff', 'cutoff': 0.6412709931987994, 'grm_norm': 'cosine', 'self_loops': False, 'use_snp_selection': False, 'graphsage_batch_size': 32}. Best is trial 10 with value: 0.23234478373462286.
