[I 2025-12-09 05:40:36,223] Trial 108 finished with value: 0.3420495831467 and parameters: {'model_type': 'graphsage', 'hidden_dims': '[512, 256]', 'dropout': 0.5532276990825987, 'batch_norm': False, 'sage_aggr': 'max', 'sage_normalize': False, 'sage_project': False, 'lr': 1.3559722703020255e-05, 'weight_decay': 0.00017797319393334077, 'epochs': 242, 'loss': 'mse', 'optimizer': 'adam', 'graph_mode': 'cutoff', 'cutoff': 0.6322986770807347, 'grm_norm': 'cosine_then_gcn', 'self_loops': True, 'use_snp_selection': True, 'num_snps': 32911}. Best is trial 25 with value: 0.37075254988769146.
[I 2025-12-09 05:42:53,786] Trial 109 finished with value: 0.33320870564568705 and parameters: {'model_type': 'graphsage', 'hidden_dims': '[512, 128]', 'dropout': 0.5906142950301831, 'batch_norm': True, 'sage_aggr': 'max', 'sage_normalize': True, 'sage_project': False, 'lr': 1.8564747546706696e-05, 'weight_decay': 8.21621470790743e-05, 'epochs': 251, 'loss': 'mse', 'optimizer': 'adam', 'graph_mode': 'cutoff', 'cutoff': 0.76736201098317, 'grm_norm': 'gcn', 'self_loops': True, 'use_snp_selection': True, 'num_snps': 56105}. Best is trial 25 with value: 0.37075254988769146.
[I 2025-12-09 05:44:47,116] Trial 110 finished with value: 0.3449369136649962 and parameters: {'model_type': 'graphsage', 'hidden_dims': '[512, 64]', 'dropout': 0.5149152007005348, 'batch_norm': False, 'sage_aggr': 'max', 'sage_normalize': False, 'sage_project': False, 'lr': 1.1471598800508426e-05, 'weight_decay': 3.797819080237412e-06, 'epochs': 263, 'loss': 'mse', 'optimizer': 'adam', 'graph_mode': 'cutoff', 'cutoff': 0.8490475919986825, 'grm_norm': 'none', 'self_loops': False, 'use_snp_selection': True, 'num_snps': 44251}. Best is trial 25 with value: 0.37075254988769146.
[I 2025-12-09 05:45:40,870] Trial 111 finished with value: 0.36216240332861716 and parameters: {'model_type': 'graphsage', 'hidden_dims': '[128, 64]', 'dropout': 0.5662804466006538, 'batch_norm': False, 'sage_aggr': 'max', 'sage_normalize': False, 'sage_project': False, 'lr': 1.1948064524896341e-05, 'weight_decay': 0.0002286424039252285, 'epochs': 291, 'loss': 'mse', 'optimizer': 'adam', 'graph_mode': 'cutoff', 'cutoff': 0.599143285425385, 'grm_norm': 'cosine_then_gcn', 'self_loops': False, 'use_snp_selection': False}. Best is trial 25 with value: 0.37075254988769146.
[I 2025-12-09 05:46:34,200] Trial 112 finished with value: 0.3637765384184315 and parameters: {'model_type': 'graphsage', 'hidden_dims': '[128, 64]', 'dropout': 0.5632791255522764, 'batch_norm': False, 'sage_aggr': 'max', 'sage_normalize': False, 'sage_project': False, 'lr': 1.1109188540375847e-05, 'weight_decay': 0.0001120509494880957, 'epochs': 296, 'loss': 'mse', 'optimizer': 'adam', 'graph_mode': 'cutoff', 'cutoff': 0.6130667236275387, 'grm_norm': 'cosine_then_gcn', 'self_loops': False, 'use_snp_selection': False}. Best is trial 25 with value: 0.37075254988769146.
[I 2025-12-09 05:47:24,524] Trial 113 finished with value: 0.35426767794546166 and parameters: {'model_type': 'graphsage', 'hidden_dims': '[128, 64]', 'dropout': 0.5320130980863318, 'batch_norm': False, 'sage_aggr': 'max', 'sage_normalize': False, 'sage_project': False, 'lr': 1.3806830695684199e-05, 'weight_decay': 6.235192740521518e-05, 'epochs': 280, 'loss': 'mse', 'optimizer': 'adam', 'graph_mode': 'cutoff', 'cutoff': 0.6510864533071908, 'grm_norm': 'cosine_then_gcn', 'self_loops': False, 'use_snp_selection': False}. Best is trial 25 with value: 0.37075254988769146.
[I 2025-12-09 05:48:16,577] Trial 114 finished with value: 0.35029839966268284 and parameters: {'model_type': 'graphsage', 'hidden_dims': '[128, 64]', 'dropout': 0.5833334535320837, 'batch_norm': False, 'sage_aggr': 'max', 'sage_normalize': False, 'sage_project': False, 'lr': 1.651636294460945e-05, 'weight_decay': 0.0005996562855881858, 'epochs': 271, 'loss': 'mse', 'optimizer': 'adam', 'graph_mode': 'cutoff', 'cutoff': 0.5619185231290791, 'grm_norm': 'cosine_then_gcn', 'self_loops': False, 'use_snp_selection': False}. Best is trial 25 with value: 0.37075254988769146.
[I 2025-12-09 05:49:10,411] Trial 115 finished with value: 0.3541526631341193 and parameters: {'model_type': 'graphsage', 'hidden_dims': '[128, 64]', 'dropout': 0.37209753464170037, 'batch_norm': False, 'sage_aggr': 'max', 'sage_normalize': False, 'sage_project': False, 'lr': 1.3562420404515572e-05, 'weight_decay': 0.00019503175355095663, 'epochs': 287, 'loss': 'mse', 'optimizer': 'adam', 'graph_mode': 'cutoff', 'cutoff': 0.5756035967862629, 'grm_norm': 'cosine_then_gcn', 'self_loops': True, 'use_snp_selection': False}. Best is trial 25 with value: 0.37075254988769146.
[I 2025-12-09 05:51:42,748] Trial 116 finished with value: 0.36094628555237096 and parameters: {'model_type': 'graphsage', 'hidden_dims': '[512, 128]', 'dropout': 0.5503674262499539, 'batch_norm': False, 'sage_aggr': 'max', 'sage_normalize': False, 'sage_project': False, 'lr': 1.0007905935131606e-05, 'weight_decay': 0.0004418911399168977, 'epochs': 274, 'loss': 'mse', 'optimizer': 'adam', 'graph_mode': 'cutoff', 'cutoff': 0.5359116929717447, 'grm_norm': 'cosine_then_gcn', 'self_loops': False, 'use_snp_selection': False}. Best is trial 25 with value: 0.37075254988769146.
[I 2025-12-09 05:52:06,248] Trial 117 finished with value: 0.3653868686912264 and parameters: {'model_type': 'graphsage', 'hidden_dims': '[128, 64]', 'dropout': 0.578770030886205, 'batch_norm': False, 'sage_aggr': 'max', 'sage_normalize': False, 'sage_project': False, 'lr': 1.1402878228427957e-05, 'weight_decay': 0.00014650147988128068, 'epochs': 303, 'loss': 'mae', 'optimizer': 'adam', 'graph_mode': 'cutoff', 'cutoff': 0.5907646597200747, 'grm_norm': 'cosine_then_gcn', 'self_loops': True, 'use_snp_selection': True, 'num_snps': 13643}. Best is trial 25 with value: 0.37075254988769146.
[I 2025-12-09 05:56:24,833] Trial 118 finished with value: 0.34483329559933196 and parameters: {'model_type': 'graphsage', 'hidden_dims': '[512, 128]', 'dropout': 0.5651350967884016, 'batch_norm': False, 'sage_aggr': 'max', 'sage_normalize': False, 'sage_project': False, 'lr': 2.0721538941216477e-05, 'weight_decay': 0.00028815037423557654, 'epochs': 294, 'loss': 'mae', 'optimizer': 'adam', 'graph_mode': 'knn', 'knn_k': 6, 'weighted_edges': True, 'symmetrize_mode': 'union', 'self_loops': True, 'use_snp_selection': True, 'num_snps': 37379}. Best is trial 25 with value: 0.37075254988769146.
[I 2025-12-09 05:57:28,826] Trial 119 finished with value: 0.352865078925319 and parameters: {'model_type': 'graphsage', 'hidden_dims': '[128, 64]', 'dropout': 0.5914666626059812, 'batch_norm': False, 'sage_aggr': 'max', 'sage_normalize': False, 'sage_project': False, 'lr': 1.5842380873441532e-05, 'weight_decay': 8.916052011986167e-05, 'epochs': 264, 'loss': 'mae', 'optimizer': 'adam', 'graph_mode': 'cutoff', 'cutoff': 0.7756990217666496, 'grm_norm': 'cosine_then_gcn', 'self_loops': True, 'use_snp_selection': True, 'num_snps': 53740}. Best is trial 25 with value: 0.37075254988769146.
[I 2025-12-09 05:58:49,856] Trial 120 finished with value: 0.3693263289439979 and parameters: {'model_type': 'graphsage', 'hidden_dims': '[256, 128]', 'dropout': 0.5377719144697157, 'batch_norm': False, 'sage_aggr': 'max', 'sage_normalize': False, 'sage_project': False, 'lr': 1.3576940024668786e-05, 'weight_decay': 0.00011636658019628695, 'epochs': 283, 'loss': 'mse', 'optimizer': 'adam', 'graph_mode': 'cutoff', 'cutoff': 0.795883889872268, 'grm_norm': 'cosine_then_gcn', 'self_loops': False, 'use_snp_selection': False}. Best is trial 25 with value: 0.37075254988769146.
[I 2025-12-09 06:00:11,213] Trial 121 finished with value: 0.34595683561247936 and parameters: {'model_type': 'graphsage', 'hidden_dims': '[256, 128]', 'dropout': 0.5356575105175401, 'batch_norm': False, 'sage_aggr': 'max', 'sage_normalize': False, 'sage_project': False, 'lr': 1.2859297121305143e-05, 'weight_decay': 0.00011645278208075246, 'epochs': 285, 'loss': 'mse', 'optimizer': 'adam', 'graph_mode': 'cutoff', 'cutoff': 0.7988732276023544, 'grm_norm': 'cosine_then_gcn', 'self_loops': False, 'use_snp_selection': False}. Best is trial 25 with value: 0.37075254988769146.
[I 2025-12-09 06:01:30,387] Trial 122 finished with value: 0.35203575015129485 and parameters: {'model_type': 'graphsage', 'hidden_dims': '[256, 128]', 'dropout': 0.5563210480262636, 'batch_norm': False, 'sage_aggr': 'max', 'sage_normalize': False, 'sage_project': False, 'lr': 1.00443548894809e-05, 'weight_decay': 0.00016618608080181784, 'epochs': 278, 'loss': 'mse', 'optimizer': 'adam', 'graph_mode': 'cutoff', 'cutoff': 0.8241005173329394, 'grm_norm': 'cosine_then_gcn', 'self_loops': False, 'use_snp_selection': False}. Best is trial 25 with value: 0.37075254988769146.
[I 2025-12-09 06:02:43,906] Trial 123 finished with value: 0.3543951619839637 and parameters: {'model_type': 'graphsage', 'hidden_dims': '[256, 128]', 'dropout': 0.5236167864980276, 'batch_norm': False, 'sage_aggr': 'max', 'sage_normalize': False, 'sage_project': False, 'lr': 1.75936436746474e-05, 'weight_decay': 0.00021436000666965065, 'epochs': 256, 'loss': 'mse', 'optimizer': 'adam', 'graph_mode': 'cutoff', 'cutoff': 0.7296021727562031, 'grm_norm': 'cosine_then_gcn', 'self_loops': False, 'use_snp_selection': False}. Best is trial 25 with value: 0.37075254988769146.
[I 2025-12-09 06:04:00,631] Trial 124 finished with value: 0.0 and parameters: {'model_type': 'graphsage', 'hidden_dims': '[256, 128]', 'dropout': 0.5710171122939393, 'batch_norm': False, 'sage_aggr': 'max', 'sage_normalize': False, 'sage_project': False, 'lr': 0.0004396311818566522, 'weight_decay': 8.617267736054271e-05, 'epochs': 268, 'loss': 'mse', 'optimizer': 'adam', 'graph_mode': 'cutoff', 'cutoff': 0.8629079553583948, 'grm_norm': 'cosine_then_gcn', 'self_loops': False, 'use_snp_selection': False}. Best is trial 25 with value: 0.37075254988769146.
[I 2025-12-09 06:05:18,321] Trial 125 finished with value: 0.3581583852134359 and parameters: {'model_type': 'graphsage', 'hidden_dims': '[512, 128]', 'dropout': 0.5444637645949046, 'batch_norm': False, 'sage_aggr': 'max', 'sage_normalize': False, 'sage_project': False, 'lr': 1.4706599639145923e-05, 'weight_decay': 6.656007097814024e-05, 'epochs': 291, 'loss': 'mae', 'optimizer': 'adam', 'graph_mode': 'cutoff', 'cutoff': 0.7466413330709407, 'grm_norm': 'cosine', 'self_loops': False, 'use_snp_selection': True, 'num_snps': 27131}. Best is trial 25 with value: 0.37075254988769146.
[I 2025-12-09 06:06:13,452] Trial 126 finished with value: 0.3486447105522619 and parameters: {'model_type': 'graphsage', 'hidden_dims': '[128, 64]', 'dropout': 0.3262301606533241, 'batch_norm': False, 'sage_aggr': 'mean', 'sage_normalize': False, 'sage_project': False, 'lr': 9.695717987222974e-05, 'weight_decay': 0.0001307300033332912, 'epochs': 308, 'loss': 'mse', 'optimizer': 'adam', 'graph_mode': 'cutoff', 'cutoff': 0.798120914715526, 'grm_norm': 'cosine_then_gcn', 'self_loops': True, 'use_snp_selection': False}. Best is trial 25 with value: 0.37075254988769146.
[I 2025-12-09 06:07:10,277] Trial 127 finished with value: 0.3633581372522081 and parameters: {'model_type': 'graphsage', 'hidden_dims': '[128, 64]', 'dropout': 0.5784563406611345, 'batch_norm': False, 'sage_aggr': 'max', 'sage_normalize': False, 'sage_project': False, 'lr': 1.1638754681448008e-05, 'weight_decay': 0.0001072219902751839, 'epochs': 252, 'loss': 'mae', 'optimizer': 'adam', 'graph_mode': 'cutoff', 'cutoff': 0.7720603328508675, 'grm_norm': 'cosine_then_gcn', 'self_loops': True, 'use_snp_selection': True, 'num_snps': 49570}. Best is trial 25 with value: 0.37075254988769146.
[I 2025-12-09 06:09:55,399] Trial 128 finished with value: 0.3473876828906525 and parameters: {'model_type': 'graphsage', 'hidden_dims': '[512, 256]', 'dropout': 0.5995552784635206, 'batch_norm': True, 'sage_aggr': 'max', 'sage_normalize': False, 'sage_project': False, 'lr': 2.3046697472451043e-05, 'weight_decay': 5.213071718998956e-05, 'epochs': 282, 'loss': 'mae', 'optimizer': 'adam', 'graph_mode': 'cutoff', 'cutoff': 0.7028565669412268, 'grm_norm': 'cosine_then_gcn', 'self_loops': True, 'use_snp_selection': True, 'num_snps': 59033}. Best is trial 25 with value: 0.37075254988769146.
[I 2025-12-09 06:11:20,612] Trial 129 finished with value: 0.33188597846921775 and parameters: {'model_type': 'graphsage', 'hidden_dims': '[256, 128]', 'dropout': 0.5638994728207809, 'batch_norm': False, 'sage_aggr': 'max', 'sage_normalize': True, 'sage_project': False, 'lr': 1.316750022104642e-05, 'weight_decay': 3.079147991754895e-05, 'epochs': 299, 'loss': 'mse', 'optimizer': 'adam', 'graph_mode': 'cutoff', 'cutoff': 0.8121613440687993, 'grm_norm': 'cosine_then_gcn', 'self_loops': False, 'use_snp_selection': False}. Best is trial 25 with value: 0.37075254988769146.
[I 2025-12-09 06:12:44,845] Trial 130 finished with value: 0.3660634436665914 and parameters: {'model_type': 'graphsage', 'hidden_dims': '[512, 64]', 'dropout': 0.5529909701446154, 'batch_norm': False, 'sage_aggr': 'max', 'sage_normalize': False, 'sage_project': False, 'lr': 1.8871819471898057e-05, 'weight_decay': 0.0009396904080111162, 'epochs': 165, 'loss': 'mae', 'optimizer': 'adam', 'graph_mode': 'cutoff', 'cutoff': 0.6241815366322088, 'grm_norm': 'cosine_then_gcn', 'self_loops': True, 'use_snp_selection': True, 'num_snps': 48043}. Best is trial 25 with value: 0.37075254988769146.
[I 2025-12-09 06:14:26,674] Trial 131 finished with value: 0.36490510274008625 and parameters: {'model_type': 'graphsage', 'hidden_dims': '[512, 64]', 'dropout': 0.5560334322476785, 'batch_norm': False, 'sage_aggr': 'max', 'sage_normalize': False, 'sage_project': False, 'lr': 1.134272584347706e-05, 'weight_decay': 8.165155514224978e-05, 'epochs': 169, 'loss': 'mae', 'optimizer': 'adam', 'graph_mode': 'cutoff', 'cutoff': 0.6139867315222308, 'grm_norm': 'cosine_then_gcn', 'self_loops': True, 'use_snp_selection': True, 'num_snps': 56821}. Best is trial 25 with value: 0.37075254988769146.
[I 2025-12-09 06:15:36,590] Trial 132 finished with value: 0.36395524092603243 and parameters: {'model_type': 'graphsage', 'hidden_dims': '[512, 64]', 'dropout': 0.5415301158388585, 'batch_norm': False, 'sage_aggr': 'max', 'sage_normalize': False, 'sage_project': False, 'lr': 1.5468101796399074e-05, 'weight_decay': 0.000622868412433018, 'epochs': 139, 'loss': 'mae', 'optimizer': 'adam', 'graph_mode': 'cutoff', 'cutoff': 0.6255340631180253, 'grm_norm': 'cosine_then_gcn', 'self_loops': True, 'use_snp_selection': True, 'num_snps': 45321}. Best is trial 25 with value: 0.37075254988769146.
[I 2025-12-09 06:16:55,880] Trial 133 finished with value: 0.3643867097510852 and parameters: {'model_type': 'graphsage', 'hidden_dims': '[512, 64]', 'dropout': 0.5285438967865337, 'batch_norm': False, 'sage_aggr': 'max', 'sage_normalize': False, 'sage_project': False, 'lr': 1.8492079452090688e-05, 'weight_decay': 0.0009144598003569036, 'epochs': 155, 'loss': 'mae', 'optimizer': 'adam', 'graph_mode': 'cutoff', 'cutoff': 0.7536194252577116, 'grm_norm': 'cosine_then_gcn', 'self_loops': True, 'use_snp_selection': True, 'num_snps': 48016}. Best is trial 25 with value: 0.37075254988769146.
[I 2025-12-09 06:18:38,060] Trial 134 finished with value: 0.367605788029666 and parameters: {'model_type': 'graphsage', 'hidden_dims': '[512, 64]', 'dropout': 0.5107352179733621, 'batch_norm': False, 'sage_aggr': 'max', 'sage_normalize': False, 'sage_project': False, 'lr': 1.0085629680908314e-05, 'weight_decay': 9.517772337360077e-05, 'epochs': 187, 'loss': 'mae', 'optimizer': 'adam', 'graph_mode': 'cutoff', 'cutoff': 0.6405806033867382, 'grm_norm': 'cosine_then_gcn', 'self_loops': True, 'use_snp_selection': True, 'num_snps': 52605}. Best is trial 25 with value: 0.37075254988769146.
[I 2025-12-09 06:20:28,315] Trial 135 finished with value: 0.3714952871274934 and parameters: {'model_type': 'graphsage', 'hidden_dims': '[512, 128]', 'dropout': 0.586697299915223, 'batch_norm': False, 'sage_aggr': 'max', 'sage_normalize': False, 'sage_project': False, 'lr': 1.3086923599023284e-05, 'weight_decay': 0.00014502360370567495, 'epochs': 199, 'loss': 'mae', 'optimizer': 'adam', 'graph_mode': 'cutoff', 'cutoff': 0.5917318288992597, 'grm_norm': 'cosine_then_gcn', 'self_loops': True, 'use_snp_selection': True, 'num_snps': 52483}. Best is trial 135 with value: 0.3714952871274934.
[I 2025-12-09 06:22:26,083] Trial 136 finished with value: 0.36759454076004755 and parameters: {'model_type': 'graphsage', 'hidden_dims': '[512, 128]', 'dropout': 0.5871875919330787, 'batch_norm': False, 'sage_aggr': 'max', 'sage_normalize': False, 'sage_project': False, 'lr': 1.3683822479864705e-05, 'weight_decay': 0.00010433278749495766, 'epochs': 217, 'loss': 'mae', 'optimizer': 'adam', 'graph_mode': 'cutoff', 'cutoff': 0.679872132582839, 'grm_norm': 'none', 'self_loops': True, 'use_snp_selection': True, 'num_snps': 53061}. Best is trial 135 with value: 0.3714952871274934.
[I 2025-12-09 06:24:10,494] Trial 137 finished with value: 0.3654342410205377 and parameters: {'model_type': 'graphsage', 'hidden_dims': '[512, 128]', 'dropout': 0.5799869980530481, 'batch_norm': False, 'sage_aggr': 'max', 'sage_normalize': False, 'sage_project': False, 'lr': 1.3063967465258449e-05, 'weight_decay': 0.0001367601084086784, 'epochs': 187, 'loss': 'mae', 'optimizer': 'adam', 'graph_mode': 'cutoff', 'cutoff': 0.6470394086561365, 'grm_norm': 'none', 'self_loops': True, 'use_snp_selection': True, 'num_snps': 52380}. Best is trial 135 with value: 0.3714952871274934.
[I 2025-12-09 06:26:37,668] Trial 138 finished with value: 0.332911180362244 and parameters: {'model_type': 'graphsage', 'hidden_dims': '[512, 128]', 'dropout': 0.5947154527630838, 'batch_norm': False, 'sage_aggr': 'max', 'sage_normalize': False, 'sage_project': False, 'lr': 1.0222442035091086e-05, 'weight_decay': 7.060184749751185e-05, 'epochs': 199, 'loss': 'mae', 'optimizer': 'adam', 'graph_mode': 'knn', 'knn_k': 4, 'weighted_edges': False, 'symmetrize_mode': 'mutual', 'self_loops': True, 'use_snp_selection': True, 'num_snps': 49926}. Best is trial 135 with value: 0.3714952871274934.
[I 2025-12-09 06:28:23,142] Trial 139 finished with value: 0.3679232857553121 and parameters: {'model_type': 'graphsage', 'hidden_dims': '[512, 128]', 'dropout': 0.5867534027192932, 'batch_norm': False, 'sage_aggr': 'max', 'sage_normalize': False, 'sage_project': False, 'lr': 1.5649775710396408e-05, 'weight_decay': 9.26531176740974e-05, 'epochs': 187, 'loss': 'mae', 'optimizer': 'adam', 'graph_mode': 'cutoff', 'cutoff': 0.6741638122170879, 'grm_norm': 'none', 'self_loops': True, 'use_snp_selection': True, 'num_snps': 53663}. Best is trial 135 with value: 0.3714952871274934.
[I 2025-12-09 06:30:12,094] Trial 140 finished with value: 0.36190297262048193 and parameters: {'model_type': 'graphsage', 'hidden_dims': '[512, 128]', 'dropout': 0.5886808908258185, 'batch_norm': False, 'sage_aggr': 'max', 'sage_normalize': False, 'sage_project': False, 'lr': 1.6284792107475296e-05, 'weight_decay': 0.00010041154749814865, 'epochs': 208, 'loss': 'mae', 'optimizer': 'adam', 'graph_mode': 'cutoff', 'cutoff': 0.6772430563358766, 'grm_norm': 'none', 'self_loops': True, 'use_snp_selection': True, 'num_snps': 51296}. Best is trial 135 with value: 0.3714952871274934.
[I 2025-12-09 06:31:55,391] Trial 141 finished with value: 0.3665372750650319 and parameters: {'model_type': 'graphsage', 'hidden_dims': '[512, 128]', 'dropout': 0.5763106364174205, 'batch_norm': False, 'sage_aggr': 'max', 'sage_normalize': False, 'sage_project': False, 'lr': 1.0081724855646669e-05, 'weight_decay': 0.00015504065635803008, 'epochs': 185, 'loss': 'mae', 'optimizer': 'adam', 'graph_mode': 'cutoff', 'cutoff': 0.6629209659582063, 'grm_norm': 'none', 'self_loops': True, 'use_snp_selection': True, 'num_snps': 53479}. Best is trial 135 with value: 0.3714952871274934.
[I 2025-12-09 06:33:43,126] Trial 142 finished with value: 0.36644275362028683 and parameters: {'model_type': 'graphsage', 'hidden_dims': '[512, 128]', 'dropout': 0.5740486231746047, 'batch_norm': False, 'sage_aggr': 'max', 'sage_normalize': False, 'sage_project': False, 'lr': 1.2537491254581719e-05, 'weight_decay': 0.00016575542959306583, 'epochs': 194, 'loss': 'mae', 'optimizer': 'adam', 'graph_mode': 'cutoff', 'cutoff': 0.6631924090605801, 'grm_norm': 'none', 'self_loops': True, 'use_snp_selection': True, 'num_snps': 53070}. Best is trial 135 with value: 0.3714952871274934.
[I 2025-12-09 06:35:27,509] Trial 143 finished with value: 0.3710026487124459 and parameters: {'model_type': 'graphsage', 'hidden_dims': '[512, 128]', 'dropout': 0.5875123127805055, 'batch_norm': False, 'sage_aggr': 'max', 'sage_normalize': False, 'sage_project': False, 'lr': 1.007286755194406e-05, 'weight_decay': 0.00012621352980752431, 'epochs': 186, 'loss': 'mae', 'optimizer': 'adam', 'graph_mode': 'cutoff', 'cutoff': 0.6872646155314129, 'grm_norm': 'cosine', 'self_loops': True, 'use_snp_selection': True, 'num_snps': 54698}. Best is trial 135 with value: 0.3714952871274934.
[I 2025-12-09 06:37:13,010] Trial 144 finished with value: 0.3678214817646762 and parameters: {'model_type': 'graphsage', 'hidden_dims': '[512, 128]', 'dropout': 0.5993964645568165, 'batch_norm': False, 'sage_aggr': 'max', 'sage_normalize': False, 'sage_project': False, 'lr': 1.503198551128784e-05, 'weight_decay': 0.00012364907279438598, 'epochs': 182, 'loss': 'mae', 'optimizer': 'adam', 'graph_mode': 'cutoff', 'cutoff': 0.7140247093931956, 'grm_norm': 'none', 'self_loops': True, 'use_snp_selection': True, 'num_snps': 55044}. Best is trial 135 with value: 0.3714952871274934.
