[I 2025-12-08 22:52:14,403] Trial 116 finished with value: 0.2919647543272622 and parameters: {'model_type': 'graphsage', 'hidden_dims': '[512, 128]', 'dropout': 0.4655604267042926, 'batch_norm': True, 'sage_aggr': 'mean', 'sage_normalize': False, 'sage_project': False, 'lr': 6.701008648424015e-05, 'weight_decay': 2.5942123805703428e-05, 'epochs': 103, 'loss': 'mse', 'optimizer': 'adam', 'graph_mode': 'cutoff', 'cutoff': 0.8308039196198872, 'grm_norm': 'none', 'self_loops': False, 'use_snp_selection': False}. Best is trial 104 with value: 0.3068879314968838.
[I 2025-12-08 22:53:46,969] Trial 117 finished with value: 0.2945159226651391 and parameters: {'model_type': 'graphsage', 'hidden_dims': '[512, 128]', 'dropout': 0.4199337695008992, 'batch_norm': False, 'sage_aggr': 'mean', 'sage_normalize': False, 'sage_project': False, 'lr': 2.491971587188622e-05, 'weight_decay': 0.00024732805493506675, 'epochs': 138, 'loss': 'mae', 'optimizer': 'adam', 'graph_mode': 'cutoff', 'cutoff': 0.7548155957696298, 'grm_norm': 'cosine', 'self_loops': False, 'use_snp_selection': True, 'num_snps': 59896}. Best is trial 104 with value: 0.3068879314968838.
[I 2025-12-08 22:55:07,305] Trial 118 finished with value: 0.3035039847781885 and parameters: {'model_type': 'graphsage', 'hidden_dims': '[512, 128]', 'dropout': 0.3567805785246431, 'batch_norm': False, 'sage_aggr': 'mean', 'sage_normalize': False, 'sage_project': False, 'lr': 1.769410499783461e-05, 'weight_decay': 7.769758439769504e-07, 'epochs': 121, 'loss': 'mse', 'optimizer': 'adam', 'graph_mode': 'cutoff', 'cutoff': 0.7727972722032477, 'grm_norm': 'none', 'self_loops': False, 'use_snp_selection': True, 'num_snps': 57620}. Best is trial 104 with value: 0.3068879314968838.
[I 2025-12-08 22:56:05,999] Trial 119 finished with value: 0.2992105823845059 and parameters: {'model_type': 'graphsage', 'hidden_dims': '[512, 256]', 'dropout': 0.3127443429292265, 'batch_norm': False, 'sage_aggr': 'mean', 'sage_normalize': False, 'sage_project': False, 'lr': 1.3623449636816917e-05, 'weight_decay': 7.949875336250053e-07, 'epochs': 92, 'loss': 'mse', 'optimizer': 'adam', 'graph_mode': 'cutoff', 'cutoff': 0.7644084934338459, 'grm_norm': 'gcn', 'self_loops': False, 'use_snp_selection': True, 'num_snps': 50267}. Best is trial 104 with value: 0.3068879314968838.
[I 2025-12-08 22:56:49,850] Trial 120 finished with value: 0.2867170819360203 and parameters: {'model_type': 'graphsage', 'hidden_dims': '[256, 128, 64]', 'dropout': 0.48900167362444347, 'batch_norm': False, 'sage_aggr': 'mean', 'sage_normalize': False, 'sage_project': False, 'lr': 1.0122335366748028e-05, 'weight_decay': 5.782044935153971e-07, 'epochs': 82, 'loss': 'mse', 'optimizer': 'adam', 'graph_mode': 'cutoff', 'cutoff': 0.7039725116436325, 'grm_norm': 'none', 'self_loops': False, 'use_snp_selection': True, 'num_snps': 57835}. Best is trial 104 with value: 0.3068879314968838.
[I 2025-12-08 22:58:10,599] Trial 121 finished with value: 0.30204819344563727 and parameters: {'model_type': 'graphsage', 'hidden_dims': '[512, 128]', 'dropout': 0.3527702131823721, 'batch_norm': False, 'sage_aggr': 'mean', 'sage_normalize': False, 'sage_project': False, 'lr': 1.781821523728908e-05, 'weight_decay': 4.7095259053912603e-07, 'epochs': 130, 'loss': 'mse', 'optimizer': 'adam', 'graph_mode': 'cutoff', 'cutoff': 0.7875171629916248, 'grm_norm': 'none', 'self_loops': False, 'use_snp_selection': True, 'num_snps': 56350}. Best is trial 104 with value: 0.3068879314968838.
[I 2025-12-08 22:59:26,623] Trial 122 finished with value: 0.30350441730249866 and parameters: {'model_type': 'graphsage', 'hidden_dims': '[512, 128]', 'dropout': 0.3379677476282843, 'batch_norm': False, 'sage_aggr': 'mean', 'sage_normalize': False, 'sage_project': False, 'lr': 1.676721386253087e-05, 'weight_decay': 4.873767874310648e-07, 'epochs': 120, 'loss': 'mse', 'optimizer': 'adam', 'graph_mode': 'cutoff', 'cutoff': 0.7767819855504097, 'grm_norm': 'none', 'self_loops': False, 'use_snp_selection': True, 'num_snps': 55802}. Best is trial 104 with value: 0.3068879314968838.
[I 2025-12-08 23:00:41,630] Trial 123 finished with value: 0.3020249610111089 and parameters: {'model_type': 'graphsage', 'hidden_dims': '[512, 128]', 'dropout': 0.3345225299110296, 'batch_norm': False, 'sage_aggr': 'mean', 'sage_normalize': False, 'sage_project': False, 'lr': 1.7092010152817834e-05, 'weight_decay': 6.720040507537166e-07, 'epochs': 121, 'loss': 'mse', 'optimizer': 'adam', 'graph_mode': 'cutoff', 'cutoff': 0.7447237988002033, 'grm_norm': 'none', 'self_loops': False, 'use_snp_selection': True, 'num_snps': 55349}. Best is trial 104 with value: 0.3068879314968838.
[I 2025-12-08 23:01:56,627] Trial 124 finished with value: 0.19462910218840687 and parameters: {'model_type': 'graphsage', 'hidden_dims': '[512, 128]', 'dropout': 0.3340284123038849, 'batch_norm': False, 'sage_aggr': 'mean', 'sage_normalize': False, 'sage_project': False, 'lr': 0.00019556111591769286, 'weight_decay': 4.692776879671642e-07, 'epochs': 117, 'loss': 'mse', 'optimizer': 'adam', 'graph_mode': 'cutoff', 'cutoff': 0.7427838367924147, 'grm_norm': 'none', 'self_loops': False, 'use_snp_selection': True, 'num_snps': 56388}. Best is trial 104 with value: 0.3068879314968838.
[I 2025-12-08 23:02:37,685] Trial 125 finished with value: 0.2961824366714426 and parameters: {'model_type': 'graphsage', 'hidden_dims': '[512, 128]', 'dropout': 0.32114317263512193, 'batch_norm': False, 'sage_aggr': 'mean', 'sage_normalize': False, 'sage_project': False, 'lr': 1.7309521668202637e-05, 'weight_decay': 6.721775929931525e-07, 'epochs': 111, 'loss': 'mse', 'optimizer': 'adam', 'graph_mode': 'cutoff', 'cutoff': 0.813004434373343, 'grm_norm': 'cosine_then_gcn', 'self_loops': False, 'use_snp_selection': True, 'num_snps': 30085}. Best is trial 104 with value: 0.3068879314968838.
[I 2025-12-08 23:03:43,247] Trial 126 finished with value: 0.30169989211965015 and parameters: {'model_type': 'graphsage', 'hidden_dims': '[512, 128]', 'dropout': 0.45374204175031896, 'batch_norm': False, 'sage_aggr': 'mean', 'sage_normalize': False, 'sage_project': False, 'lr': 1.2752382248475922e-05, 'weight_decay': 8.782802459211052e-07, 'epochs': 101, 'loss': 'mse', 'optimizer': 'adam', 'graph_mode': 'cutoff', 'cutoff': 0.6852358034021516, 'grm_norm': 'none', 'self_loops': False, 'use_snp_selection': True, 'num_snps': 54554}. Best is trial 104 with value: 0.3068879314968838.
[I 2025-12-08 23:07:00,876] Trial 127 finished with value: 0.27182810254997475 and parameters: {'model_type': 'graphsage', 'hidden_dims': '[256, 128]', 'dropout': 0.37725940481583947, 'batch_norm': False, 'sage_aggr': 'mean', 'sage_normalize': False, 'sage_project': False, 'lr': 3.993088415932871e-05, 'weight_decay': 1.1235560145880266e-06, 'epochs': 122, 'loss': 'mse', 'optimizer': 'adam', 'graph_mode': 'knn', 'knn_k': 10, 'weighted_edges': False, 'symmetrize_mode': 'union', 'self_loops': False, 'use_snp_selection': True, 'num_snps': 55732}. Best is trial 104 with value: 0.3068879314968838.
[I 2025-12-08 23:08:09,152] Trial 128 finished with value: 0.26478709033208625 and parameters: {'model_type': 'graphsage', 'hidden_dims': '[512, 128]', 'dropout': 0.28489014557177755, 'batch_norm': False, 'sage_aggr': 'mean', 'sage_normalize': False, 'sage_project': False, 'lr': 8.55872006886019e-05, 'weight_decay': 4.1818918939320337e-07, 'epochs': 98, 'loss': 'mse', 'optimizer': 'adam', 'graph_mode': 'cutoff', 'cutoff': 0.7229790311880803, 'grm_norm': 'cosine', 'self_loops': False, 'use_snp_selection': True, 'num_snps': 57463}. Best is trial 104 with value: 0.3068879314968838.
[I 2025-12-08 23:10:47,918] Trial 129 finished with value: 0.2909110527997109 and parameters: {'model_type': 'graphsage', 'hidden_dims': '[512, 64]', 'dropout': 0.305203269753625, 'batch_norm': False, 'sage_aggr': 'mean', 'sage_normalize': False, 'sage_project': False, 'lr': 2.313843629862332e-05, 'weight_decay': 2.89370573491983e-07, 'epochs': 308, 'loss': 'mse', 'optimizer': 'adam', 'graph_mode': 'cutoff', 'cutoff': 0.7518696130709388, 'grm_norm': 'none', 'self_loops': True, 'use_snp_selection': True, 'num_snps': 53097}. Best is trial 104 with value: 0.3068879314968838.
[I 2025-12-08 23:11:56,875] Trial 130 finished with value: 0.3043311672920071 and parameters: {'model_type': 'graphsage', 'hidden_dims': '[512, 128]', 'dropout': 0.34168509793057417, 'batch_norm': False, 'sage_aggr': 'mean', 'sage_normalize': False, 'sage_project': False, 'lr': 1.5780188409626528e-05, 'weight_decay': 6.712978723378775e-07, 'epochs': 110, 'loss': 'mse', 'optimizer': 'adam', 'graph_mode': 'cutoff', 'cutoff': 0.7688858641508649, 'grm_norm': 'none', 'self_loops': False, 'use_snp_selection': True, 'num_snps': 54369}. Best is trial 104 with value: 0.3068879314968838.
[I 2025-12-08 23:13:05,421] Trial 131 finished with value: 0.302953234427083 and parameters: {'model_type': 'graphsage', 'hidden_dims': '[512, 128]', 'dropout': 0.34046045512820733, 'batch_norm': False, 'sage_aggr': 'mean', 'sage_normalize': False, 'sage_project': False, 'lr': 1.6050624193294065e-05, 'weight_decay': 5.461813824540379e-07, 'epochs': 106, 'loss': 'mse', 'optimizer': 'adam', 'graph_mode': 'cutoff', 'cutoff': 0.7720795513919139, 'grm_norm': 'none', 'self_loops': False, 'use_snp_selection': True, 'num_snps': 55004}. Best is trial 104 with value: 0.3068879314968838.
[I 2025-12-08 23:14:15,386] Trial 132 finished with value: 0.3006088560958163 and parameters: {'model_type': 'graphsage', 'hidden_dims': '[512, 128]', 'dropout': 0.33338172272662636, 'batch_norm': False, 'sage_aggr': 'mean', 'sage_normalize': False, 'sage_project': False, 'lr': 1.6318421016347638e-05, 'weight_decay': 5.197978060802579e-07, 'epochs': 112, 'loss': 'mse', 'optimizer': 'adam', 'graph_mode': 'cutoff', 'cutoff': 0.7331334695402497, 'grm_norm': 'none', 'self_loops': False, 'use_snp_selection': True, 'num_snps': 54251}. Best is trial 104 with value: 0.3068879314968838.
[I 2025-12-08 23:15:31,382] Trial 133 finished with value: 0.3013755420660487 and parameters: {'model_type': 'graphsage', 'hidden_dims': '[512, 128]', 'dropout': 0.36637673449420505, 'batch_norm': False, 'sage_aggr': 'mean', 'sage_normalize': False, 'sage_project': False, 'lr': 1.2210053656647256e-05, 'weight_decay': 7.770520536910982e-07, 'epochs': 129, 'loss': 'mse', 'optimizer': 'adam', 'graph_mode': 'cutoff', 'cutoff': 0.7834171499165417, 'grm_norm': 'none', 'self_loops': False, 'use_snp_selection': True, 'num_snps': 52015}. Best is trial 104 with value: 0.3068879314968838.
[I 2025-12-08 23:16:49,218] Trial 134 finished with value: 0.3015807468777246 and parameters: {'model_type': 'graphsage', 'hidden_dims': '[512, 128]', 'dropout': 0.3409159773586138, 'batch_norm': False, 'sage_aggr': 'mean', 'sage_normalize': False, 'sage_project': False, 'lr': 1.3727851416538911e-05, 'weight_decay': 1.654736151215807e-05, 'epochs': 122, 'loss': 'mse', 'optimizer': 'adam', 'graph_mode': 'cutoff', 'cutoff': 0.7135438425084342, 'grm_norm': 'none', 'self_loops': False, 'use_snp_selection': True, 'num_snps': 55775}. Best is trial 104 with value: 0.3068879314968838.
[I 2025-12-08 23:17:24,469] Trial 135 finished with value: 0.29645751302606504 and parameters: {'model_type': 'graphsage', 'hidden_dims': '[512, 128]', 'dropout': 0.3217438363544, 'batch_norm': False, 'sage_aggr': 'mean', 'sage_normalize': False, 'sage_project': False, 'lr': 1.1391212578035019e-05, 'weight_decay': 4.0121658091521584e-07, 'epochs': 107, 'loss': 'mse', 'optimizer': 'adam', 'graph_mode': 'cutoff', 'cutoff': 0.837059835644644, 'grm_norm': 'none', 'self_loops': True, 'use_snp_selection': True, 'num_snps': 25822}. Best is trial 104 with value: 0.3068879314968838.
[I 2025-12-08 23:18:26,996] Trial 136 finished with value: 0.28747027420777227 and parameters: {'model_type': 'graphsage', 'hidden_dims': '[512, 128]', 'dropout': 0.38934555506761653, 'batch_norm': False, 'sage_aggr': 'mean', 'sage_normalize': True, 'sage_project': False, 'lr': 1.5815671130511876e-05, 'weight_decay': 1.1853730122170395e-06, 'epochs': 87, 'loss': 'mse', 'optimizer': 'adam', 'graph_mode': 'cutoff', 'cutoff': 0.7590226499049841, 'grm_norm': 'cosine', 'self_loops': False, 'use_snp_selection': True, 'num_snps': 56901}. Best is trial 104 with value: 0.3068879314968838.
[I 2025-12-08 23:18:49,347] Trial 137 finished with value: 0.28046214120224433 and parameters: {'model_type': 'graphsage', 'hidden_dims': '[128, 64]', 'dropout': 0.35866965900316794, 'batch_norm': True, 'sage_aggr': 'mean', 'sage_normalize': False, 'sage_project': False, 'lr': 1.0086230289078788e-05, 'weight_decay': 6.963820775671029e-07, 'epochs': 118, 'loss': 'mse', 'optimizer': 'adam', 'graph_mode': 'cutoff', 'cutoff': 0.7730828246937119, 'grm_norm': 'none', 'self_loops': True, 'use_snp_selection': False}. Best is trial 104 with value: 0.3068879314968838.
[I 2025-12-08 23:19:56,214] Trial 138 finished with value: 0.294865937991981 and parameters: {'model_type': 'graphsage', 'hidden_dims': '[512, 128]', 'dropout': 0.47608786014061155, 'batch_norm': False, 'sage_aggr': 'mean', 'sage_normalize': False, 'sage_project': False, 'lr': 1.7952280993175024e-05, 'weight_decay': 5.422125408973686e-07, 'epochs': 108, 'loss': 'mae', 'optimizer': 'adam', 'graph_mode': 'cutoff', 'cutoff': 0.8093430260446453, 'grm_norm': 'none', 'self_loops': False, 'use_snp_selection': True, 'num_snps': 54396}. Best is trial 104 with value: 0.3068879314968838.
[I 2025-12-08 23:20:49,635] Trial 139 finished with value: 0.29552723365158273 and parameters: {'model_type': 'graphsage', 'hidden_dims': '[256, 128, 64]', 'dropout': 0.3355426969322744, 'batch_norm': False, 'sage_aggr': 'mean', 'sage_normalize': False, 'sage_project': False, 'lr': 1.4025487507506173e-05, 'weight_decay': 1.5601612582552692e-06, 'epochs': 130, 'loss': 'mse', 'optimizer': 'adam', 'graph_mode': 'cutoff', 'cutoff': 0.8256987617852182, 'grm_norm': 'none', 'self_loops': False, 'use_snp_selection': True, 'num_snps': 52724}. Best is trial 104 with value: 0.3068879314968838.
[I 2025-12-08 23:21:52,873] Trial 140 finished with value: 0.29993407510563247 and parameters: {'model_type': 'graphsage', 'hidden_dims': '[512, 128]', 'dropout': 0.398944571176977, 'batch_norm': False, 'sage_aggr': 'mean', 'sage_normalize': False, 'sage_project': False, 'lr': 2.016132542456957e-05, 'weight_decay': 1.00516780355564e-06, 'epochs': 92, 'loss': 'mse', 'optimizer': 'adam', 'graph_mode': 'cutoff', 'cutoff': 0.6472472766653011, 'grm_norm': 'cosine', 'self_loops': True, 'use_snp_selection': True, 'num_snps': 55495}. Best is trial 104 with value: 0.3068879314968838.
[I 2025-12-08 23:23:03,809] Trial 141 finished with value: 0.3014842297006354 and parameters: {'model_type': 'graphsage', 'hidden_dims': '[512, 128]', 'dropout': 0.3717513726490562, 'batch_norm': False, 'sage_aggr': 'mean', 'sage_normalize': False, 'sage_project': False, 'lr': 2.2035866223823036e-05, 'weight_decay': 6.330160045871584e-07, 'epochs': 103, 'loss': 'mse', 'optimizer': 'adam', 'graph_mode': 'cutoff', 'cutoff': 0.7689605221565141, 'grm_norm': 'none', 'self_loops': False, 'use_snp_selection': True, 'num_snps': 57994}. Best is trial 104 with value: 0.3068879314968838.
[I 2025-12-08 23:24:23,094] Trial 142 finished with value: 0.29714940163446085 and parameters: {'model_type': 'graphsage', 'hidden_dims': '[512, 128]', 'dropout': 0.34501346057567656, 'batch_norm': False, 'sage_aggr': 'mean', 'sage_normalize': False, 'sage_project': False, 'lr': 1.5873404487583586e-05, 'weight_decay': 8.482674428887159e-07, 'epochs': 115, 'loss': 'mse', 'optimizer': 'adam', 'graph_mode': 'cutoff', 'cutoff': 0.7843451680637458, 'grm_norm': 'none', 'self_loops': False, 'use_snp_selection': True, 'num_snps': 59158}. Best is trial 104 with value: 0.3068879314968838.
[I 2025-12-08 23:25:24,463] Trial 143 finished with value: 0.30158284274846414 and parameters: {'model_type': 'graphsage', 'hidden_dims': '[512, 128]', 'dropout': 0.32585752484759617, 'batch_norm': False, 'sage_aggr': 'mean', 'sage_normalize': False, 'sage_project': False, 'lr': 2.6451631259955378e-05, 'weight_decay': 5.240456934459314e-07, 'epochs': 98, 'loss': 'mse', 'optimizer': 'adam', 'graph_mode': 'cutoff', 'cutoff': 0.7454594130649072, 'grm_norm': 'none', 'self_loops': False, 'use_snp_selection': True, 'num_snps': 51418}. Best is trial 104 with value: 0.3068879314968838.
[I 2025-12-08 23:26:41,411] Trial 144 finished with value: 0.0003049030122748098 and parameters: {'model_type': 'graphsage', 'hidden_dims': '[512, 128]', 'dropout': 0.441208020417732, 'batch_norm': False, 'sage_aggr': 'mean', 'sage_normalize': False, 'sage_project': False, 'lr': 0.0010313708268828272, 'weight_decay': 2.72267061196604e-07, 'epochs': 118, 'loss': 'mse', 'optimizer': 'adam', 'graph_mode': 'cutoff', 'cutoff': 0.8020790662935611, 'grm_norm': 'none', 'self_loops': False, 'use_snp_selection': True, 'num_snps': 56855}. Best is trial 104 with value: 0.3068879314968838.
[I 2025-12-08 23:27:39,594] Trial 145 finished with value: 0.2946564373347556 and parameters: {'model_type': 'graphsage', 'hidden_dims': '[512, 128]', 'dropout': 0.34967401383776564, 'batch_norm': False, 'sage_aggr': 'mean', 'sage_normalize': False, 'sage_project': False, 'lr': 1.1579526534245717e-05, 'weight_decay': 3.7244363961502235e-07, 'epochs': 76, 'loss': 'mse', 'optimizer': 'adam', 'graph_mode': 'cutoff', 'cutoff': 0.7715299645008283, 'grm_norm': 'none', 'self_loops': False, 'use_snp_selection': True, 'num_snps': 58321}. Best is trial 104 with value: 0.3068879314968838.
[I 2025-12-08 23:28:49,773] Trial 146 finished with value: 0.3018849632250248 and parameters: {'model_type': 'graphsage', 'hidden_dims': '[512, 128]', 'dropout': 0.3172835352645224, 'batch_norm': False, 'sage_aggr': 'mean', 'sage_normalize': False, 'sage_project': False, 'lr': 3.0461885948281875e-05, 'weight_decay': 2.0319005664526054e-07, 'epochs': 124, 'loss': 'mse', 'optimizer': 'adam', 'graph_mode': 'cutoff', 'cutoff': 0.7870377638854289, 'grm_norm': 'none', 'self_loops': False, 'use_snp_selection': True, 'num_snps': 49507}. Best is trial 104 with value: 0.3068879314968838.
[I 2025-12-08 23:30:08,142] Trial 147 finished with value: 0.042853624051110484 and parameters: {'model_type': 'graphsage', 'hidden_dims': '[512, 128]', 'dropout': 0.29059252943197295, 'batch_norm': False, 'sage_aggr': 'mean', 'sage_normalize': False, 'sage_project': False, 'lr': 0.00048806608969299825, 'weight_decay': 1.8251853370373072e-07, 'epochs': 144, 'loss': 'mse', 'optimizer': 'adam', 'graph_mode': 'cutoff', 'cutoff': 0.8545429429023135, 'grm_norm': 'gcn', 'self_loops': True, 'use_snp_selection': True, 'num_snps': 49418}. Best is trial 104 with value: 0.3068879314968838.
[I 2025-12-08 23:31:15,806] Trial 148 finished with value: 0.2989750085195061 and parameters: {'model_type': 'graphsage', 'hidden_dims': '[512, 128]', 'dropout': 0.31162733204666976, 'batch_norm': False, 'sage_aggr': 'max', 'sage_normalize': False, 'sage_project': False, 'lr': 3.428535284744413e-05, 'weight_decay': 2.1874366088226236e-05, 'epochs': 124, 'loss': 'mse', 'optimizer': 'adam', 'graph_mode': 'cutoff', 'cutoff': 0.7896974888914564, 'grm_norm': 'none', 'self_loops': False, 'use_snp_selection': True, 'num_snps': 47513}. Best is trial 104 with value: 0.3068879314968838.
[I 2025-12-08 23:32:58,807] Trial 149 finished with value: 0.2736242048144817 and parameters: {'model_type': 'graphsage', 'hidden_dims': '[512, 128]', 'dropout': 0.30674663374811645, 'batch_norm': False, 'sage_aggr': 'mean', 'sage_normalize': False, 'sage_project': False, 'lr': 0.00010815221734317017, 'weight_decay': 2.0893244717614684e-07, 'epochs': 132, 'loss': 'mse', 'optimizer': 'adam', 'graph_mode': 'knn', 'knn_k': 5, 'weighted_edges': True, 'symmetrize_mode': 'union', 'self_loops': True, 'use_snp_selection': True, 'num_snps': 35791}. Best is trial 104 with value: 0.3068879314968838.
[I 2025-12-08 23:34:35,809] Trial 0 finished with value: 0.2571825202474745 and parameters: {'model_type': 'graphsage', 'hidden_dims': '[128, 64]', 'dropout': 0.199031432379812, 'batch_norm': True, 'sage_aggr': 'max', 'sage_normalize': True, 'sage_project': False, 'lr': 0.00034401453323286885, 'weight_decay': 0.00017802616915745114, 'epochs': 230, 'loss': 'mse', 'optimizer': 'adam', 'graph_mode': 'knn', 'knn_k': 6, 'weighted_edges': True, 'symmetrize_mode': 'mutual', 'self_loops': True, 'use_snp_selection': False}. Best is trial 0 with value: 0.2571825202474745.
[I 2025-12-08 23:36:09,755] Trial 1 finished with value: 0.2808077320814272 and parameters: {'model_type': 'graphsage', 'hidden_dims': '[512, 128]', 'dropout': 0.2503500283181017, 'batch_norm': False, 'sage_aggr': 'max', 'sage_normalize': False, 'sage_project': False, 'lr': 3.952233718592099e-05, 'weight_decay': 0.00026754769258252603, 'epochs': 149, 'loss': 'mse', 'optimizer': 'adam', 'graph_mode': 'knn', 'knn_k': 2, 'weighted_edges': False, 'symmetrize_mode': 'mutual', 'self_loops': True, 'use_snp_selection': True, 'num_snps': 49915}. Best is trial 1 with value: 0.2808077320814272.
[I 2025-12-08 23:37:22,338] Trial 2 finished with value: 0.2886336702034972 and parameters: {'model_type': 'graphsage', 'hidden_dims': '[512, 256]', 'dropout': 0.2785908793172681, 'batch_norm': False, 'sage_aggr': 'max', 'sage_normalize': False, 'sage_project': False, 'lr': 8.806039223165805e-05, 'weight_decay': 3.5153176302760294e-05, 'epochs': 147, 'loss': 'mae', 'optimizer': 'adam', 'graph_mode': 'cutoff', 'cutoff': 0.4922564006874869, 'grm_norm': 'gcn', 'self_loops': False, 'use_snp_selection': True, 'num_snps': 34340}. Best is trial 2 with value: 0.2886336702034972.
