[I 2025-12-08 19:21:48,104] Trial 81 finished with value: 0.310015905538153 and parameters: {'model_type': 'graphsage', 'hidden_dims': '[256, 128]', 'dropout': 0.5139837891919433, 'batch_norm': True, 'sage_aggr': 'max', 'sage_normalize': False, 'sage_project': False, 'lr': 0.008304089309562642, 'weight_decay': 4.3052740184313567e-07, 'epochs': 40, 'loss': 'mse', 'optimizer': 'adam', 'graph_mode': 'cutoff', 'cutoff': 0.6784396111971486, 'grm_norm': 'cosine_then_gcn', 'self_loops': False, 'use_snp_selection': False}. Best is trial 77 with value: 0.31041190250428563.
[I 2025-12-08 19:22:11,654] Trial 82 finished with value: 0.30740991337121787 and parameters: {'model_type': 'graphsage', 'hidden_dims': '[256, 128]', 'dropout': 0.5122906147442778, 'batch_norm': True, 'sage_aggr': 'max', 'sage_normalize': False, 'sage_project': False, 'lr': 0.0039262642033063054, 'weight_decay': 3.597073019010055e-07, 'epochs': 58, 'loss': 'mse', 'optimizer': 'adam', 'graph_mode': 'cutoff', 'cutoff': 0.6856559573711599, 'grm_norm': 'cosine_then_gcn', 'self_loops': False, 'use_snp_selection': False}. Best is trial 77 with value: 0.31041190250428563.
[I 2025-12-08 19:22:43,336] Trial 83 finished with value: 0.29105085210560516 and parameters: {'model_type': 'graphsage', 'hidden_dims': '[256, 128]', 'dropout': 0.47868946967477144, 'batch_norm': True, 'sage_aggr': 'max', 'sage_normalize': False, 'sage_project': False, 'lr': 0.0052656807256334075, 'weight_decay': 1.418729250743318e-07, 'epochs': 83, 'loss': 'mse', 'optimizer': 'adam', 'graph_mode': 'cutoff', 'cutoff': 0.5174868367030417, 'grm_norm': 'none', 'self_loops': False, 'use_snp_selection': False}. Best is trial 77 with value: 0.31041190250428563.
[I 2025-12-08 19:23:03,154] Trial 84 finished with value: 0.30755127106698704 and parameters: {'model_type': 'graphsage', 'hidden_dims': '[256, 128]', 'dropout': 0.5147469459967908, 'batch_norm': True, 'sage_aggr': 'max', 'sage_normalize': False, 'sage_project': False, 'lr': 0.00808856965731105, 'weight_decay': 3.14402809803423e-07, 'epochs': 40, 'loss': 'mse', 'optimizer': 'adam', 'graph_mode': 'cutoff', 'cutoff': 0.61086781891311, 'grm_norm': 'cosine_then_gcn', 'self_loops': False, 'use_snp_selection': False}. Best is trial 77 with value: 0.31041190250428563.
[I 2025-12-08 19:24:09,280] Trial 85 finished with value: 0.3027526310333891 and parameters: {'model_type': 'graphsage', 'hidden_dims': '[256, 128]', 'dropout': 0.5487495397493094, 'batch_norm': True, 'sage_aggr': 'max', 'sage_normalize': False, 'sage_project': False, 'lr': 0.005914295357617579, 'weight_decay': 2.2254396042871807e-07, 'epochs': 259, 'loss': 'mse', 'optimizer': 'adam', 'graph_mode': 'cutoff', 'cutoff': 0.750565916320626, 'grm_norm': 'cosine_then_gcn', 'self_loops': False, 'use_snp_selection': False}. Best is trial 77 with value: 0.31041190250428563.
[I 2025-12-08 19:24:36,377] Trial 86 finished with value: 0.30320171039192695 and parameters: {'model_type': 'graphsage', 'hidden_dims': '[256, 128]', 'dropout': 0.4905645148128647, 'batch_norm': True, 'sage_aggr': 'max', 'sage_normalize': False, 'sage_project': False, 'lr': 0.0035844594666712827, 'weight_decay': 7.31767576638369e-07, 'epochs': 72, 'loss': 'mse', 'optimizer': 'adam', 'graph_mode': 'cutoff', 'cutoff': 0.5653567433365342, 'grm_norm': 'cosine_then_gcn', 'self_loops': False, 'use_snp_selection': False}. Best is trial 77 with value: 0.31041190250428563.
[I 2025-12-08 19:25:01,607] Trial 87 finished with value: 0.3063861900939302 and parameters: {'model_type': 'graphsage', 'hidden_dims': '[256, 128, 64]', 'dropout': 0.45222071015105175, 'batch_norm': True, 'sage_aggr': 'max', 'sage_normalize': False, 'sage_project': False, 'lr': 0.006664930071907598, 'weight_decay': 4.966649722203344e-07, 'epochs': 65, 'loss': 'mse', 'optimizer': 'adam', 'graph_mode': 'cutoff', 'cutoff': 0.6454081139725486, 'grm_norm': 'cosine_then_gcn', 'self_loops': False, 'use_snp_selection': False}. Best is trial 77 with value: 0.31041190250428563.
[I 2025-12-08 19:25:34,137] Trial 88 finished with value: 0.3112859159478406 and parameters: {'model_type': 'graphsage', 'hidden_dims': '[512, 128]', 'dropout': 0.47671569120688234, 'batch_norm': True, 'sage_aggr': 'max', 'sage_normalize': False, 'sage_project': False, 'lr': 0.0082613116466854, 'weight_decay': 1.0242857450407147e-06, 'epochs': 50, 'loss': 'mse', 'optimizer': 'adam', 'graph_mode': 'cutoff', 'cutoff': 0.6837004906415424, 'grm_norm': 'cosine_then_gcn', 'self_loops': False, 'use_snp_selection': False}. Best is trial 88 with value: 0.3112859159478406.
[I 2025-12-08 19:26:24,404] Trial 89 finished with value: 0.3010619445220293 and parameters: {'model_type': 'graphsage', 'hidden_dims': '[512, 128]', 'dropout': 0.47470534498523775, 'batch_norm': True, 'sage_aggr': 'max', 'sage_normalize': False, 'sage_project': False, 'lr': 0.0052226050778461765, 'weight_decay': 1.0268617625715203e-06, 'epochs': 98, 'loss': 'mse', 'optimizer': 'adam', 'graph_mode': 'cutoff', 'cutoff': 0.691898355112082, 'grm_norm': 'none', 'self_loops': False, 'use_snp_selection': False}. Best is trial 88 with value: 0.3112859159478406.
[I 2025-12-08 19:28:39,121] Trial 90 finished with value: 0.3082213358286007 and parameters: {'model_type': 'graphsage', 'hidden_dims': '[512, 128]', 'dropout': 0.4973676899622477, 'batch_norm': True, 'sage_aggr': 'max', 'sage_normalize': False, 'sage_project': False, 'lr': 0.00423213346447194, 'weight_decay': 1.4763554504485454e-06, 'epochs': 313, 'loss': 'mse', 'optimizer': 'adam', 'graph_mode': 'cutoff', 'cutoff': 0.7420927460976374, 'grm_norm': 'cosine_then_gcn', 'self_loops': False, 'use_snp_selection': False}. Best is trial 88 with value: 0.3112859159478406.
[I 2025-12-08 19:30:21,649] Trial 91 finished with value: 0.3079287769419582 and parameters: {'model_type': 'graphsage', 'hidden_dims': '[512, 128]', 'dropout': 0.45726196811817976, 'batch_norm': True, 'sage_aggr': 'max', 'sage_normalize': False, 'sage_project': False, 'lr': 0.009831694199811595, 'weight_decay': 1.5687546343215243e-06, 'epochs': 230, 'loss': 'mse', 'optimizer': 'adam', 'graph_mode': 'cutoff', 'cutoff': 0.7464469830309363, 'grm_norm': 'cosine_then_gcn', 'self_loops': False, 'use_snp_selection': False}. Best is trial 88 with value: 0.3112859159478406.
[I 2025-12-08 19:32:37,874] Trial 92 finished with value: 0.30511758487318336 and parameters: {'model_type': 'graphsage', 'hidden_dims': '[512, 128]', 'dropout': 0.5410817985451513, 'batch_norm': True, 'sage_aggr': 'max', 'sage_normalize': False, 'sage_project': False, 'lr': 0.00444251235045233, 'weight_decay': 2.6478897629797114e-06, 'epochs': 317, 'loss': 'mse', 'optimizer': 'adam', 'graph_mode': 'cutoff', 'cutoff': 0.8078944804483406, 'grm_norm': 'cosine_then_gcn', 'self_loops': False, 'use_snp_selection': False}. Best is trial 88 with value: 0.3112859159478406.
[I 2025-12-08 19:33:10,066] Trial 93 finished with value: 0.30738256708673506 and parameters: {'model_type': 'graphsage', 'hidden_dims': '[512, 128]', 'dropout': 0.4994370918342764, 'batch_norm': True, 'sage_aggr': 'max', 'sage_normalize': False, 'sage_project': False, 'lr': 0.006397285855329446, 'weight_decay': 1.1928394845347333e-06, 'epochs': 49, 'loss': 'mse', 'optimizer': 'adam', 'graph_mode': 'cutoff', 'cutoff': 0.7365846120114269, 'grm_norm': 'cosine_then_gcn', 'self_loops': False, 'use_snp_selection': False}. Best is trial 88 with value: 0.3112859159478406.
[I 2025-12-08 19:33:45,736] Trial 94 finished with value: 0.30832180660656927 and parameters: {'model_type': 'graphsage', 'hidden_dims': '[512, 128]', 'dropout': 0.48203291392780784, 'batch_norm': True, 'sage_aggr': 'max', 'sage_normalize': False, 'sage_project': False, 'lr': 0.008380739785783811, 'weight_decay': 1.3298102597616484e-07, 'epochs': 58, 'loss': 'mse', 'optimizer': 'adam', 'graph_mode': 'cutoff', 'cutoff': 0.7072244908308487, 'grm_norm': 'cosine_then_gcn', 'self_loops': False, 'use_snp_selection': False}. Best is trial 88 with value: 0.3112859159478406.
[I 2025-12-08 19:34:29,644] Trial 95 finished with value: 0.30664641575451707 and parameters: {'model_type': 'graphsage', 'hidden_dims': '[512, 128]', 'dropout': 0.4441631553121924, 'batch_norm': True, 'sage_aggr': 'max', 'sage_normalize': False, 'sage_project': False, 'lr': 0.008558031994702864, 'weight_decay': 1.4465642415076419e-07, 'epochs': 79, 'loss': 'mse', 'optimizer': 'adam', 'graph_mode': 'cutoff', 'cutoff': 0.6895946039885202, 'grm_norm': 'cosine_then_gcn', 'self_loops': False, 'use_snp_selection': False}. Best is trial 88 with value: 0.3112859159478406.
[I 2025-12-08 19:34:47,889] Trial 96 finished with value: 0.3047240997394784 and parameters: {'model_type': 'graphsage', 'hidden_dims': '[128, 64]', 'dropout': 0.482922205969906, 'batch_norm': True, 'sage_aggr': 'max', 'sage_normalize': False, 'sage_project': False, 'lr': 0.005404679538325245, 'weight_decay': 1.258494839257461e-07, 'epochs': 60, 'loss': 'mse', 'optimizer': 'adam', 'graph_mode': 'cutoff', 'cutoff': 0.6085534085545765, 'grm_norm': 'cosine_then_gcn', 'self_loops': False, 'use_snp_selection': False}. Best is trial 88 with value: 0.3112859159478406.
[I 2025-12-08 19:35:20,917] Trial 97 finished with value: -0.03100416202562086 and parameters: {'model_type': 'graphsage', 'hidden_dims': '[512, 128]', 'dropout': 0.11312232064939756, 'batch_norm': False, 'sage_aggr': 'max', 'sage_normalize': False, 'sage_project': False, 'lr': 0.0033644598832615552, 'weight_decay': 2.4277068999291617e-07, 'epochs': 52, 'loss': 'mse', 'optimizer': 'adam', 'graph_mode': 'cutoff', 'cutoff': 0.7014045815965712, 'grm_norm': 'cosine_then_gcn', 'self_loops': False, 'use_snp_selection': False}. Best is trial 88 with value: 0.3112859159478406.
[I 2025-12-08 19:35:46,683] Trial 98 finished with value: 0.3083187510341674 and parameters: {'model_type': 'graphsage', 'hidden_dims': '[256, 128]', 'dropout': 0.4657868743691319, 'batch_norm': True, 'sage_aggr': 'max', 'sage_normalize': False, 'sage_project': False, 'lr': 0.007045039173614826, 'weight_decay': 2.0895669732054093e-07, 'epochs': 68, 'loss': 'mse', 'optimizer': 'adam', 'graph_mode': 'cutoff', 'cutoff': 0.648751396402946, 'grm_norm': 'cosine_then_gcn', 'self_loops': False, 'use_snp_selection': False}. Best is trial 88 with value: 0.3112859159478406.
[I 2025-12-08 19:36:26,311] Trial 99 finished with value: 0.30256232630082297 and parameters: {'model_type': 'graphsage', 'hidden_dims': '[512, 128]', 'dropout': 0.46626731436739755, 'batch_norm': True, 'sage_aggr': 'max', 'sage_normalize': False, 'sage_project': False, 'lr': 0.0026659863211026835, 'weight_decay': 6.681316526367826e-07, 'epochs': 68, 'loss': 'mse', 'optimizer': 'adam', 'graph_mode': 'cutoff', 'cutoff': 0.6468461838942439, 'grm_norm': 'cosine_then_gcn', 'self_loops': False, 'use_snp_selection': False}. Best is trial 88 with value: 0.3112859159478406.
[I 2025-12-08 19:37:02,305] Trial 100 finished with value: 0.30173200296415875 and parameters: {'model_type': 'graphsage', 'hidden_dims': '[256, 128]', 'dropout': 0.5136872559076455, 'batch_norm': True, 'sage_aggr': 'max', 'sage_normalize': False, 'sage_project': False, 'lr': 0.007044159057401959, 'weight_decay': 3.218536200795582e-07, 'epochs': 108, 'loss': 'mse', 'optimizer': 'adam', 'graph_mode': 'cutoff', 'cutoff': 0.5328296070262488, 'grm_norm': 'cosine_then_gcn', 'self_loops': False, 'use_snp_selection': False}. Best is trial 88 with value: 0.3112859159478406.
[I 2025-12-08 19:37:26,224] Trial 101 finished with value: 0.299399139767598 and parameters: {'model_type': 'graphsage', 'hidden_dims': '[256, 128]', 'dropout': 0.4743167852388955, 'batch_norm': True, 'sage_aggr': 'max', 'sage_normalize': False, 'sage_project': False, 'lr': 0.008039867182951913, 'weight_decay': 2.0689122474725558e-07, 'epochs': 59, 'loss': 'mse', 'optimizer': 'adam', 'graph_mode': 'cutoff', 'cutoff': 0.6267883997995015, 'grm_norm': 'cosine_then_gcn', 'self_loops': False, 'use_snp_selection': False}. Best is trial 88 with value: 0.3112859159478406.
[I 2025-12-08 19:37:47,903] Trial 102 finished with value: 0.3062089077477549 and parameters: {'model_type': 'graphsage', 'hidden_dims': '[256, 128]', 'dropout': 0.45695019602566683, 'batch_norm': True, 'sage_aggr': 'max', 'sage_normalize': False, 'sage_project': False, 'lr': 0.008815970436347357, 'weight_decay': 2.898231336707462e-07, 'epochs': 49, 'loss': 'mse', 'optimizer': 'adam', 'graph_mode': 'cutoff', 'cutoff': 0.6765708595914605, 'grm_norm': 'cosine_then_gcn', 'self_loops': False, 'use_snp_selection': False}. Best is trial 88 with value: 0.3112859159478406.
[I 2025-12-08 19:38:23,468] Trial 103 finished with value: 0.2885635616036839 and parameters: {'model_type': 'graphsage', 'hidden_dims': '[256, 128]', 'dropout': 0.4312428526031607, 'batch_norm': True, 'sage_aggr': 'max', 'sage_normalize': False, 'sage_project': False, 'lr': 0.009980788255546469, 'weight_decay': 1.4898175371248127e-07, 'epochs': 86, 'loss': 'mse', 'optimizer': 'adam', 'graph_mode': 'cutoff', 'cutoff': 0.46526623035775705, 'grm_norm': 'cosine_then_gcn', 'self_loops': False, 'use_snp_selection': False}. Best is trial 88 with value: 0.3112859159478406.
[I 2025-12-08 19:38:50,840] Trial 104 finished with value: 0.3031683817325118 and parameters: {'model_type': 'graphsage', 'hidden_dims': '[256, 128]', 'dropout': 0.38821058829927996, 'batch_norm': True, 'sage_aggr': 'max', 'sage_normalize': False, 'sage_project': False, 'lr': 0.004996390162484839, 'weight_decay': 1.1821899083454738e-07, 'epochs': 76, 'loss': 'mse', 'optimizer': 'adam', 'graph_mode': 'cutoff', 'cutoff': 0.7099036692666978, 'grm_norm': 'cosine_then_gcn', 'self_loops': False, 'use_snp_selection': False}. Best is trial 88 with value: 0.3112859159478406.
[I 2025-12-08 19:39:12,966] Trial 105 finished with value: 0.3033332153701239 and parameters: {'model_type': 'graphsage', 'hidden_dims': '[256, 128, 64]', 'dropout': 0.44330773495749193, 'batch_norm': True, 'sage_aggr': 'max', 'sage_normalize': False, 'sage_project': False, 'lr': 0.006756609655407206, 'weight_decay': 5.611821045260657e-07, 'epochs': 55, 'loss': 'mse', 'optimizer': 'adam', 'graph_mode': 'cutoff', 'cutoff': 0.6606302550576301, 'grm_norm': 'none', 'self_loops': False, 'use_snp_selection': False}. Best is trial 88 with value: 0.3112859159478406.
[I 2025-12-08 19:39:37,990] Trial 106 finished with value: 0.30736242528686525 and parameters: {'model_type': 'graphsage', 'hidden_dims': '[256, 128]', 'dropout': 0.4890183965522176, 'batch_norm': True, 'sage_aggr': 'max', 'sage_normalize': False, 'sage_project': False, 'lr': 0.0056509565671634876, 'weight_decay': 3.717387684682294e-07, 'epochs': 65, 'loss': 'mse', 'optimizer': 'adam', 'graph_mode': 'cutoff', 'cutoff': 0.7258691710548902, 'grm_norm': 'cosine_then_gcn', 'self_loops': False, 'use_snp_selection': False}. Best is trial 88 with value: 0.3112859159478406.
[I 2025-12-08 19:39:58,993] Trial 107 finished with value: 0.3065509685112573 and parameters: {'model_type': 'graphsage', 'hidden_dims': '[256, 128]', 'dropout': 0.5094668742946882, 'batch_norm': True, 'sage_aggr': 'max', 'sage_normalize': False, 'sage_project': False, 'lr': 0.0076474220594872, 'weight_decay': 1.9098051662578903e-07, 'epochs': 46, 'loss': 'mse', 'optimizer': 'adam', 'graph_mode': 'cutoff', 'cutoff': 0.8466502406571045, 'grm_norm': 'cosine_then_gcn', 'self_loops': False, 'use_snp_selection': False}. Best is trial 88 with value: 0.3112859159478406.
[I 2025-12-08 19:40:18,412] Trial 108 finished with value: 0.3039566941907043 and parameters: {'model_type': 'graphsage', 'hidden_dims': '[128, 64]', 'dropout': 0.42846755313867063, 'batch_norm': True, 'sage_aggr': 'max', 'sage_normalize': False, 'sage_project': False, 'lr': 0.00648229821644544, 'weight_decay': 2.5379269121993535e-07, 'epochs': 70, 'loss': 'mse', 'optimizer': 'adam', 'graph_mode': 'cutoff', 'cutoff': 0.808703776400468, 'grm_norm': 'cosine_then_gcn', 'self_loops': False, 'use_snp_selection': False}. Best is trial 88 with value: 0.3112859159478406.
[I 2025-12-08 19:40:42,388] Trial 109 finished with value: 0.3067663002433779 and parameters: {'model_type': 'graphsage', 'hidden_dims': '[256, 128]', 'dropout': 0.4132724211531788, 'batch_norm': True, 'sage_aggr': 'max', 'sage_normalize': False, 'sage_project': False, 'lr': 0.003825499387802682, 'weight_decay': 8.948960743552041e-07, 'epochs': 60, 'loss': 'mse', 'optimizer': 'adam', 'graph_mode': 'cutoff', 'cutoff': 0.761809040355163, 'grm_norm': 'cosine_then_gcn', 'self_loops': False, 'use_snp_selection': False}. Best is trial 88 with value: 0.3112859159478406.
[I 2025-12-08 19:41:05,100] Trial 110 finished with value: 0.3040673178622655 and parameters: {'model_type': 'graphsage', 'hidden_dims': '[256, 128]', 'dropout': 0.49618510978275027, 'batch_norm': True, 'sage_aggr': 'max', 'sage_normalize': False, 'sage_project': False, 'lr': 0.0047169699943142625, 'weight_decay': 1.5238345597938047e-07, 'epochs': 53, 'loss': 'mse', 'optimizer': 'adam', 'graph_mode': 'cutoff', 'cutoff': 0.588123020235168, 'grm_norm': 'cosine', 'self_loops': False, 'use_snp_selection': False}. Best is trial 88 with value: 0.3112859159478406.
[I 2025-12-08 19:43:27,135] Trial 111 finished with value: 0.30625398669123693 and parameters: {'model_type': 'graphsage', 'hidden_dims': '[512, 128]', 'dropout': 0.5013616827673283, 'batch_norm': True, 'sage_aggr': 'max', 'sage_normalize': False, 'sage_project': False, 'lr': 0.008546545637983372, 'weight_decay': 1.984714729414069e-06, 'epochs': 332, 'loss': 'mse', 'optimizer': 'adam', 'graph_mode': 'cutoff', 'cutoff': 0.7005226345707932, 'grm_norm': 'cosine_then_gcn', 'self_loops': False, 'use_snp_selection': False}. Best is trial 88 with value: 0.3112859159478406.
[I 2025-12-08 19:45:29,023] Trial 112 finished with value: 0.3041756521910727 and parameters: {'model_type': 'graphsage', 'hidden_dims': '[512, 128]', 'dropout': 0.4726904662614509, 'batch_norm': True, 'sage_aggr': 'max', 'sage_normalize': False, 'sage_project': False, 'lr': 0.004458936450144747, 'weight_decay': 1.3337126289918153e-06, 'epochs': 280, 'loss': 'mse', 'optimizer': 'adam', 'graph_mode': 'cutoff', 'cutoff': 0.7368863104084121, 'grm_norm': 'cosine_then_gcn', 'self_loops': False, 'use_snp_selection': False}. Best is trial 88 with value: 0.3112859159478406.
[I 2025-12-08 19:46:00,086] Trial 113 finished with value: 0.30954274904906665 and parameters: {'model_type': 'graphsage', 'hidden_dims': '[512, 128]', 'dropout': 0.5219216999653353, 'batch_norm': True, 'sage_aggr': 'max', 'sage_normalize': False, 'sage_project': False, 'lr': 0.007260258185322595, 'weight_decay': 4.717919138498381e-06, 'epochs': 46, 'loss': 'mse', 'optimizer': 'adam', 'graph_mode': 'cutoff', 'cutoff': 0.6537757177170201, 'grm_norm': 'cosine_then_gcn', 'self_loops': False, 'use_snp_selection': False}. Best is trial 88 with value: 0.3112859159478406.
[I 2025-12-08 19:46:30,801] Trial 114 finished with value: 0.30838124085512786 and parameters: {'model_type': 'graphsage', 'hidden_dims': '[512, 128]', 'dropout': 0.5189884537423519, 'batch_norm': True, 'sage_aggr': 'max', 'sage_normalize': False, 'sage_project': False, 'lr': 0.0063171803312839425, 'weight_decay': 8.970146581781744e-06, 'epochs': 45, 'loss': 'mse', 'optimizer': 'adam', 'graph_mode': 'cutoff', 'cutoff': 0.6477852766528673, 'grm_norm': 'cosine_then_gcn', 'self_loops': False, 'use_snp_selection': False}. Best is trial 88 with value: 0.3112859159478406.
[I 2025-12-08 19:47:01,890] Trial 115 finished with value: 0.308718595287062 and parameters: {'model_type': 'graphsage', 'hidden_dims': '[512, 128]', 'dropout': 0.5603290125112231, 'batch_norm': True, 'sage_aggr': 'max', 'sage_normalize': False, 'sage_project': False, 'lr': 0.005743501110128631, 'weight_decay': 6.713938112231846e-06, 'epochs': 46, 'loss': 'mse', 'optimizer': 'adam', 'graph_mode': 'cutoff', 'cutoff': 0.6459938467070503, 'grm_norm': 'cosine_then_gcn', 'self_loops': False, 'use_snp_selection': False}. Best is trial 88 with value: 0.3112859159478406.
[I 2025-12-08 19:47:32,605] Trial 116 finished with value: 0.3092316736585762 and parameters: {'model_type': 'graphsage', 'hidden_dims': '[512, 128]', 'dropout': 0.5494579298639555, 'batch_norm': True, 'sage_aggr': 'max', 'sage_normalize': False, 'sage_project': False, 'lr': 0.005986784855338604, 'weight_decay': 8.948348558304801e-06, 'epochs': 45, 'loss': 'mse', 'optimizer': 'adam', 'graph_mode': 'cutoff', 'cutoff': 0.6249168178790013, 'grm_norm': 'cosine_then_gcn', 'self_loops': False, 'use_snp_selection': False}. Best is trial 88 with value: 0.3112859159478406.
[I 2025-12-08 19:48:00,273] Trial 117 finished with value: 0.0 and parameters: {'model_type': 'graphsage', 'hidden_dims': '[512, 128]', 'dropout': 0.5638823936342122, 'batch_norm': False, 'sage_aggr': 'max', 'sage_normalize': False, 'sage_project': False, 'lr': 0.005632472617411538, 'weight_decay': 4.604601406094733e-06, 'epochs': 40, 'loss': 'mse', 'optimizer': 'adam', 'graph_mode': 'cutoff', 'cutoff': 0.614414842639105, 'grm_norm': 'gcn', 'self_loops': False, 'use_snp_selection': False}. Best is trial 88 with value: 0.3112859159478406.
[I 2025-12-08 19:48:32,020] Trial 118 finished with value: 0.3026235299842397 and parameters: {'model_type': 'graphsage', 'hidden_dims': '[512, 128]', 'dropout': 0.5518428889512844, 'batch_norm': True, 'sage_aggr': 'max', 'sage_normalize': False, 'sage_project': False, 'lr': 0.002940258615352924, 'weight_decay': 7.751823601372414e-06, 'epochs': 47, 'loss': 'mse', 'optimizer': 'adam', 'graph_mode': 'cutoff', 'cutoff': 0.5685629257043715, 'grm_norm': 'cosine_then_gcn', 'self_loops': False, 'use_snp_selection': False}. Best is trial 88 with value: 0.3112859159478406.
