[I 2025-12-06 01:21:43,831] Trial 110 finished with value: 0.24060146219624312 and parameters: {'model_type': 'graphsage', 'hidden_dims': '[256, 128]', 'dropout': 0.172886378979974, 'batch_norm': False, 'sage_aggr': 'mean', 'sage_normalize': False, 'sage_project': False, 'lr': 0.0001734202336384285, 'weight_decay': 4.38703972365029e-07, 'epochs': 143, 'loss': 'mae', 'optimizer': 'adam', 'graph_mode': 'cutoff', 'cutoff': 0.6774656600671028, 'grm_norm': 'none', 'self_loops': False, 'use_snp_selection': True, 'num_snps': 15201, 'graphsage_batch_size': 256}. Best is trial 73 with value: 0.2633764749247482.
[I 2025-12-06 01:22:05,262] Trial 111 finished with value: 0.24325593861012126 and parameters: {'model_type': 'graphsage', 'hidden_dims': '[128, 64]', 'dropout': 0.5999409995919389, 'batch_norm': False, 'sage_aggr': 'mean', 'sage_normalize': False, 'sage_project': False, 'lr': 0.00011286015790901803, 'weight_decay': 3.237467105996043e-07, 'epochs': 109, 'loss': 'mae', 'optimizer': 'adam', 'graph_mode': 'cutoff', 'cutoff': 0.6384193250336222, 'grm_norm': 'none', 'self_loops': False, 'use_snp_selection': True, 'num_snps': 19809, 'graphsage_batch_size': 128}. Best is trial 73 with value: 0.2633764749247482.
[I 2025-12-06 01:22:28,899] Trial 112 finished with value: 0.2552761823204971 and parameters: {'model_type': 'graphsage', 'hidden_dims': '[128, 64]', 'dropout': 0.12874615836967332, 'batch_norm': False, 'sage_aggr': 'mean', 'sage_normalize': False, 'sage_project': False, 'lr': 0.00018764312916427545, 'weight_decay': 3.055349406623758e-07, 'epochs': 124, 'loss': 'mae', 'optimizer': 'adam', 'graph_mode': 'cutoff', 'cutoff': 0.7321015573726323, 'grm_norm': 'none', 'self_loops': False, 'use_snp_selection': True, 'num_snps': 23391, 'graphsage_batch_size': 128}. Best is trial 73 with value: 0.2633764749247482.
[I 2025-12-06 01:22:49,637] Trial 113 finished with value: 0.23855174897863166 and parameters: {'model_type': 'graphsage', 'hidden_dims': '[128, 64]', 'dropout': 0.1587437649803161, 'batch_norm': False, 'sage_aggr': 'mean', 'sage_normalize': False, 'sage_project': False, 'lr': 0.0001430769149349926, 'weight_decay': 2.581441467626302e-07, 'epochs': 88, 'loss': 'mae', 'optimizer': 'adam', 'graph_mode': 'cutoff', 'cutoff': 0.7514632263325585, 'grm_norm': 'none', 'self_loops': False, 'use_snp_selection': True, 'num_snps': 21328, 'graphsage_batch_size': 128}. Best is trial 73 with value: 0.2633764749247482.
[I 2025-12-06 01:23:10,901] Trial 114 finished with value: 0.25504439855213124 and parameters: {'model_type': 'graphsage', 'hidden_dims': '[128, 64]', 'dropout': 0.1987084190520584, 'batch_norm': False, 'sage_aggr': 'mean', 'sage_normalize': False, 'sage_project': False, 'lr': 0.00026218413468130706, 'weight_decay': 6.383214216757463e-07, 'epochs': 115, 'loss': 'mae', 'optimizer': 'adam', 'graph_mode': 'cutoff', 'cutoff': 0.6521708030802656, 'grm_norm': 'none', 'self_loops': False, 'use_snp_selection': True, 'num_snps': 18765, 'graphsage_batch_size': 128}. Best is trial 73 with value: 0.2633764749247482.
[I 2025-12-06 01:23:29,992] Trial 115 finished with value: 0.24257228528223335 and parameters: {'model_type': 'graphsage', 'hidden_dims': '[128, 64]', 'dropout': 0.14761019320888055, 'batch_norm': False, 'sage_aggr': 'mean', 'sage_normalize': False, 'sage_project': False, 'lr': 0.0002128847885705859, 'weight_decay': 1.6689594021248288e-07, 'epochs': 112, 'loss': 'mae', 'optimizer': 'adam', 'graph_mode': 'cutoff', 'cutoff': 0.7814988037065688, 'grm_norm': 'gcn', 'self_loops': False, 'use_snp_selection': True, 'num_snps': 14364, 'graphsage_batch_size': 32}. Best is trial 73 with value: 0.2633764749247482.
[I 2025-12-06 01:24:10,788] Trial 116 finished with value: 0.25313594879800283 and parameters: {'model_type': 'graphsage', 'hidden_dims': '[512, 128]', 'dropout': 0.26952643303069046, 'batch_norm': False, 'sage_aggr': 'mean', 'sage_normalize': False, 'sage_project': False, 'lr': 0.00016391106672570158, 'weight_decay': 1.0195419393381318e-07, 'epochs': 104, 'loss': 'mae', 'optimizer': 'adam', 'graph_mode': 'cutoff', 'cutoff': 0.6837495577967145, 'grm_norm': 'cosine', 'self_loops': False, 'use_snp_selection': True, 'num_snps': 27036, 'graphsage_batch_size': 128}. Best is trial 73 with value: 0.2633764749247482.
[I 2025-12-06 01:24:34,831] Trial 117 finished with value: 0.23576273348588633 and parameters: {'model_type': 'graphsage', 'hidden_dims': '[128, 64]', 'dropout': 0.18259242724110922, 'batch_norm': True, 'sage_aggr': 'mean', 'sage_normalize': False, 'sage_project': False, 'lr': 8.586803514347087e-05, 'weight_decay': 3.6184364042711487e-07, 'epochs': 102, 'loss': 'mae', 'optimizer': 'adam', 'graph_mode': 'cutoff', 'cutoff': 0.5708827314654704, 'grm_norm': 'none', 'self_loops': False, 'use_snp_selection': True, 'num_snps': 25191, 'graphsage_batch_size': 32}. Best is trial 73 with value: 0.2633764749247482.
[I 2025-12-06 01:24:58,655] Trial 118 finished with value: 0.24831202701770633 and parameters: {'model_type': 'graphsage', 'hidden_dims': '[128, 64]', 'dropout': 0.13777002298081706, 'batch_norm': True, 'sage_aggr': 'mean', 'sage_normalize': False, 'sage_project': False, 'lr': 0.00029718988750518187, 'weight_decay': 4.949049363884871e-07, 'epochs': 167, 'loss': 'mse', 'optimizer': 'adam', 'graph_mode': 'cutoff', 'cutoff': 0.6168323757983168, 'grm_norm': 'none', 'self_loops': False, 'use_snp_selection': True, 'num_snps': 17508, 'graphsage_batch_size': 64}. Best is trial 73 with value: 0.2633764749247482.
[I 2025-12-06 01:25:19,674] Trial 119 finished with value: 0.24927996123932653 and parameters: {'model_type': 'graphsage', 'hidden_dims': '[128, 64]', 'dropout': 0.5024264994374008, 'batch_norm': True, 'sage_aggr': 'mean', 'sage_normalize': False, 'sage_project': False, 'lr': 0.00012527552724892377, 'weight_decay': 2.378257843950965e-07, 'epochs': 91, 'loss': 'mae', 'optimizer': 'adam', 'graph_mode': 'cutoff', 'cutoff': 0.7147112883392286, 'grm_norm': 'cosine_then_gcn', 'self_loops': False, 'use_snp_selection': True, 'num_snps': 20305, 'graphsage_batch_size': 128}. Best is trial 73 with value: 0.2633764749247482.
[I 2025-12-06 01:25:45,593] Trial 120 finished with value: 0.2537737049393841 and parameters: {'model_type': 'graphsage', 'hidden_dims': '[128, 64]', 'dropout': 0.12467191449364957, 'batch_norm': False, 'sage_aggr': 'mean', 'sage_normalize': False, 'sage_project': False, 'lr': 0.0001843083938815135, 'weight_decay': 1.0723168487763288e-06, 'epochs': 239, 'loss': 'mae', 'optimizer': 'adam', 'graph_mode': 'cutoff', 'cutoff': 0.6600013065966177, 'grm_norm': 'gcn', 'self_loops': False, 'use_snp_selection': True, 'num_snps': 16111, 'graphsage_batch_size': 32}. Best is trial 73 with value: 0.2633764749247482.
[I 2025-12-06 01:26:57,212] Trial 121 finished with value: 0.24818666541594295 and parameters: {'model_type': 'graphsage', 'hidden_dims': '[512, 256]', 'dropout': 0.15120392146912062, 'batch_norm': True, 'sage_aggr': 'mean', 'sage_normalize': False, 'sage_project': False, 'lr': 0.0001396194499284283, 'weight_decay': 1.4604119358762428e-07, 'epochs': 231, 'loss': 'mae', 'optimizer': 'adam', 'graph_mode': 'cutoff', 'cutoff': 0.6670867032826383, 'grm_norm': 'none', 'self_loops': False, 'use_snp_selection': True, 'num_snps': 28991, 'graphsage_batch_size': 16}. Best is trial 73 with value: 0.2633764749247482.
[I 2025-12-06 01:27:22,650] Trial 122 finished with value: 0.2459276270495597 and parameters: {'model_type': 'graphsage', 'hidden_dims': '[128, 64]', 'dropout': 0.16263871036688823, 'batch_norm': True, 'sage_aggr': 'mean', 'sage_normalize': False, 'sage_project': False, 'lr': 0.00010855288078916804, 'weight_decay': 1.325106872795648e-07, 'epochs': 110, 'loss': 'mae', 'optimizer': 'adam', 'graph_mode': 'cutoff', 'cutoff': 0.6947016809252932, 'grm_norm': 'none', 'self_loops': False, 'use_snp_selection': True, 'num_snps': 28401, 'graphsage_batch_size': 16}. Best is trial 73 with value: 0.2633764749247482.
[I 2025-12-06 01:27:50,212] Trial 123 finished with value: 0.2518966522936362 and parameters: {'model_type': 'graphsage', 'hidden_dims': '[256, 128, 64]', 'dropout': 0.11777246013621548, 'batch_norm': True, 'sage_aggr': 'mean', 'sage_normalize': False, 'sage_project': False, 'lr': 0.00015330511064070592, 'weight_decay': 1.9246803194802477e-07, 'epochs': 126, 'loss': 'mae', 'optimizer': 'adam', 'graph_mode': 'cutoff', 'cutoff': 0.6443816727641746, 'grm_norm': 'none', 'self_loops': False, 'use_snp_selection': True, 'num_snps': 19628, 'graphsage_batch_size': 16}. Best is trial 73 with value: 0.2633764749247482.
[I 2025-12-06 01:28:21,643] Trial 124 finished with value: 0.2454931601677377 and parameters: {'model_type': 'graphsage', 'hidden_dims': '[128, 64]', 'dropout': 0.13398097278815635, 'batch_norm': True, 'sage_aggr': 'mean', 'sage_normalize': False, 'sage_project': False, 'lr': 0.0002356489479661712, 'weight_decay': 3.0627252701897514e-07, 'epochs': 247, 'loss': 'mae', 'optimizer': 'adam', 'graph_mode': 'cutoff', 'cutoff': 0.5974532365775383, 'grm_norm': 'none', 'self_loops': False, 'use_snp_selection': True, 'num_snps': 21641, 'graphsage_batch_size': 16}. Best is trial 73 with value: 0.2633764749247482.
[I 2025-12-06 01:28:53,288] Trial 125 finished with value: 0.2426666663513247 and parameters: {'model_type': 'graphsage', 'hidden_dims': '[128, 64]', 'dropout': 0.1452701541484584, 'batch_norm': True, 'sage_aggr': 'mean', 'sage_normalize': False, 'sage_project': False, 'lr': 0.0001294262769196952, 'weight_decay': 1.1553807915433889e-07, 'epochs': 139, 'loss': 'mae', 'optimizer': 'adam', 'graph_mode': 'cutoff', 'cutoff': 0.6324071512088191, 'grm_norm': 'none', 'self_loops': False, 'use_snp_selection': True, 'num_snps': 34527, 'graphsage_batch_size': 16}. Best is trial 73 with value: 0.2633764749247482.
[I 2025-12-06 01:29:33,154] Trial 126 finished with value: 0.24791058027072094 and parameters: {'model_type': 'graphsage', 'hidden_dims': '[128, 64]', 'dropout': 0.17697990315001708, 'batch_norm': True, 'sage_aggr': 'max', 'sage_normalize': True, 'sage_project': False, 'lr': 0.0001991459826335731, 'weight_decay': 2.2493238475602877e-07, 'epochs': 250, 'loss': 'mae', 'optimizer': 'adam', 'graph_mode': 'cutoff', 'cutoff': 0.7240900462429452, 'grm_norm': 'none', 'self_loops': False, 'use_snp_selection': True, 'num_snps': 31956, 'graphsage_batch_size': 512}. Best is trial 73 with value: 0.2633764749247482.
[I 2025-12-06 01:31:08,615] Trial 127 finished with value: 0.2292486605979529 and parameters: {'model_type': 'graphsage', 'hidden_dims': '[512, 256]', 'dropout': 0.10068414945615742, 'batch_norm': True, 'sage_aggr': 'mean', 'sage_normalize': False, 'sage_project': False, 'lr': 9.51008698381873e-05, 'weight_decay': 4.2208118183148944e-07, 'epochs': 228, 'loss': 'mae', 'optimizer': 'adam', 'graph_mode': 'knn', 'knn_k': 4, 'weighted_edges': True, 'symmetrize_mode': 'union', 'self_loops': False, 'use_snp_selection': True, 'num_snps': 29510, 'graphsage_batch_size': 16}. Best is trial 73 with value: 0.2633764749247482.
[I 2025-12-06 01:31:32,395] Trial 128 finished with value: 0.24524854753107897 and parameters: {'model_type': 'graphsage', 'hidden_dims': '[128, 64]', 'dropout': 0.15516766625667772, 'batch_norm': True, 'sage_aggr': 'mean', 'sage_normalize': False, 'sage_project': False, 'lr': 0.00032904660947292557, 'weight_decay': 1.6000689384085024e-07, 'epochs': 118, 'loss': 'mae', 'optimizer': 'adam', 'graph_mode': 'cutoff', 'cutoff': 0.7575277203426184, 'grm_norm': 'gcn', 'self_loops': False, 'use_snp_selection': True, 'num_snps': 24162, 'graphsage_batch_size': 32}. Best is trial 73 with value: 0.2633764749247482.
[I 2025-12-06 01:33:30,669] Trial 129 finished with value: 0.23510808534265842 and parameters: {'model_type': 'graphsage', 'hidden_dims': '[512, 64]', 'dropout': 0.564112064098554, 'batch_norm': True, 'sage_aggr': 'mean', 'sage_normalize': False, 'sage_project': False, 'lr': 0.00017406087506900708, 'weight_decay': 8.66702918479732e-07, 'epochs': 223, 'loss': 'mae', 'optimizer': 'adam', 'graph_mode': 'cutoff', 'cutoff': 0.6750124178597114, 'grm_norm': 'none', 'self_loops': False, 'use_snp_selection': False, 'graphsage_batch_size': 16}. Best is trial 73 with value: 0.2633764749247482.
[I 2025-12-06 01:33:52,355] Trial 130 finished with value: 0.2506271414492716 and parameters: {'model_type': 'graphsage', 'hidden_dims': '[128, 64]', 'dropout': 0.18877548206821573, 'batch_norm': True, 'sage_aggr': 'mean', 'sage_normalize': False, 'sage_project': False, 'lr': 0.00011263175263039854, 'weight_decay': 5.530137892524079e-07, 'epochs': 200, 'loss': 'mae', 'optimizer': 'adam', 'graph_mode': 'cutoff', 'cutoff': 0.7035597661980453, 'grm_norm': 'none', 'self_loops': False, 'use_snp_selection': True, 'num_snps': 12963, 'graphsage_batch_size': 128}. Best is trial 73 with value: 0.2633764749247482.
[I 2025-12-06 01:34:16,143] Trial 131 finished with value: 0.2588299344564165 and parameters: {'model_type': 'graphsage', 'hidden_dims': '[128, 64]', 'dropout': 0.1272479063000429, 'batch_norm': False, 'sage_aggr': 'mean', 'sage_normalize': False, 'sage_project': False, 'lr': 0.00018371833234716, 'weight_decay': 3.043420399310359e-07, 'epochs': 126, 'loss': 'mae', 'optimizer': 'adam', 'graph_mode': 'cutoff', 'cutoff': 0.7351733791454839, 'grm_norm': 'none', 'self_loops': False, 'use_snp_selection': True, 'num_snps': 23422, 'graphsage_batch_size': 128}. Best is trial 73 with value: 0.2633764749247482.
[I 2025-12-06 01:34:44,097] Trial 132 finished with value: 0.2531340035141314 and parameters: {'model_type': 'graphsage', 'hidden_dims': '[128, 64]', 'dropout': 0.11878311650728214, 'batch_norm': False, 'sage_aggr': 'mean', 'sage_normalize': False, 'sage_project': False, 'lr': 0.0002267657161905212, 'weight_decay': 3.091982893609438e-07, 'epochs': 131, 'loss': 'mae', 'optimizer': 'adam', 'graph_mode': 'cutoff', 'cutoff': 0.7361778127721256, 'grm_norm': 'none', 'self_loops': False, 'use_snp_selection': True, 'num_snps': 30586, 'graphsage_batch_size': 128}. Best is trial 73 with value: 0.2633764749247482.
[I 2025-12-06 01:35:16,730] Trial 133 finished with value: 0.25331913914537163 and parameters: {'model_type': 'graphsage', 'hidden_dims': '[128, 64]', 'dropout': 0.13222092872889338, 'batch_norm': False, 'sage_aggr': 'mean', 'sage_normalize': False, 'sage_project': False, 'lr': 0.00014786581760730928, 'weight_decay': 0.00016187796053907563, 'epochs': 233, 'loss': 'mae', 'optimizer': 'adam', 'graph_mode': 'cutoff', 'cutoff': 0.7706657010033978, 'grm_norm': 'none', 'self_loops': False, 'use_snp_selection': True, 'num_snps': 26103, 'graphsage_batch_size': 128}. Best is trial 73 with value: 0.2633764749247482.
[I 2025-12-06 01:35:38,645] Trial 134 finished with value: 0.2646072956762485 and parameters: {'model_type': 'graphsage', 'hidden_dims': '[128, 64]', 'dropout': 0.1453021390515028, 'batch_norm': False, 'sage_aggr': 'mean', 'sage_normalize': False, 'sage_project': False, 'lr': 0.00019251714138086173, 'weight_decay': 1.9184958809866243e-07, 'epochs': 137, 'loss': 'mae', 'optimizer': 'adam', 'graph_mode': 'cutoff', 'cutoff': 0.685949022606455, 'grm_norm': 'none', 'self_loops': False, 'use_snp_selection': True, 'num_snps': 17801, 'graphsage_batch_size': 128}. Best is trial 134 with value: 0.2646072956762485.
[I 2025-12-06 01:36:00,016] Trial 135 finished with value: 0.25161481263856206 and parameters: {'model_type': 'graphsage', 'hidden_dims': '[128, 64]', 'dropout': 0.16549558982932788, 'batch_norm': False, 'sage_aggr': 'mean', 'sage_normalize': False, 'sage_project': False, 'lr': 0.0002499390452708489, 'weight_decay': 2.811405212769909e-07, 'epochs': 127, 'loss': 'mae', 'optimizer': 'adam', 'graph_mode': 'cutoff', 'cutoff': 0.7916585366276905, 'grm_norm': 'none', 'self_loops': False, 'use_snp_selection': True, 'num_snps': 17992, 'graphsage_batch_size': 128}. Best is trial 134 with value: 0.2646072956762485.
[I 2025-12-06 01:36:20,674] Trial 136 finished with value: 0.2458779253804245 and parameters: {'model_type': 'graphsage', 'hidden_dims': '[128, 64]', 'dropout': 0.10850737678962205, 'batch_norm': False, 'sage_aggr': 'mean', 'sage_normalize': False, 'sage_project': False, 'lr': 0.00018140062516184465, 'weight_decay': 3.5140540101329195e-07, 'epochs': 139, 'loss': 'mae', 'optimizer': 'adam', 'graph_mode': 'cutoff', 'cutoff': 0.6899761766930232, 'grm_norm': 'gcn', 'self_loops': False, 'use_snp_selection': True, 'num_snps': 15058, 'graphsage_batch_size': 128}. Best is trial 134 with value: 0.2646072956762485.
[I 2025-12-06 01:36:46,254] Trial 137 finished with value: 0.25187113077955214 and parameters: {'model_type': 'graphsage', 'hidden_dims': '[128, 64]', 'dropout': 0.14124786104890272, 'batch_norm': False, 'sage_aggr': 'mean', 'sage_normalize': False, 'sage_project': False, 'lr': 0.00047465494663933346, 'weight_decay': 2.023980411103999e-07, 'epochs': 134, 'loss': 'mae', 'optimizer': 'adam', 'graph_mode': 'cutoff', 'cutoff': 0.4355448607129291, 'grm_norm': 'none', 'self_loops': False, 'use_snp_selection': True, 'num_snps': 17111, 'graphsage_batch_size': 128}. Best is trial 134 with value: 0.2646072956762485.
[I 2025-12-06 01:37:09,418] Trial 138 finished with value: 0.2560484423971106 and parameters: {'model_type': 'graphsage', 'hidden_dims': '[128, 64]', 'dropout': 0.12987508521139002, 'batch_norm': False, 'sage_aggr': 'mean', 'sage_normalize': False, 'sage_project': False, 'lr': 0.00021858839283090534, 'weight_decay': 3.931306243235714e-07, 'epochs': 149, 'loss': 'mae', 'optimizer': 'adam', 'graph_mode': 'cutoff', 'cutoff': 0.7262105593164474, 'grm_norm': 'none', 'self_loops': False, 'use_snp_selection': True, 'num_snps': 19251, 'graphsage_batch_size': 128}. Best is trial 134 with value: 0.2646072956762485.
[I 2025-12-06 01:37:34,452] Trial 139 finished with value: 0.2516898908790145 and parameters: {'model_type': 'graphsage', 'hidden_dims': '[128, 64]', 'dropout': 0.1254289352749965, 'batch_norm': False, 'sage_aggr': 'mean', 'sage_normalize': False, 'sage_project': False, 'lr': 0.0002903605281209681, 'weight_decay': 4.521419998762064e-07, 'epochs': 172, 'loss': 'mse', 'optimizer': 'adam', 'graph_mode': 'cutoff', 'cutoff': 0.7418544706661543, 'grm_norm': 'none', 'self_loops': False, 'use_snp_selection': True, 'num_snps': 20370, 'graphsage_batch_size': 32}. Best is trial 134 with value: 0.2646072956762485.
[I 2025-12-06 01:38:07,494] Trial 140 finished with value: 0.2501521022613799 and parameters: {'model_type': 'graphsage', 'hidden_dims': '[256, 128]', 'dropout': 0.11124068850117783, 'batch_norm': False, 'sage_aggr': 'mean', 'sage_normalize': False, 'sage_project': False, 'lr': 0.00036157019227479447, 'weight_decay': 7.678136195067153e-07, 'epochs': 194, 'loss': 'mae', 'optimizer': 'adam', 'graph_mode': 'cutoff', 'cutoff': 0.722753050189046, 'grm_norm': 'cosine', 'self_loops': False, 'use_snp_selection': True, 'num_snps': 19009, 'graphsage_batch_size': 128}. Best is trial 134 with value: 0.2646072956762485.
[I 2025-12-06 01:38:34,972] Trial 141 finished with value: 0.25066228277599767 and parameters: {'model_type': 'graphsage', 'hidden_dims': '[128, 64]', 'dropout': 0.14665823874174047, 'batch_norm': False, 'sage_aggr': 'mean', 'sage_normalize': False, 'sage_project': False, 'lr': 0.0002074359531752732, 'weight_decay': 3.9434379178917447e-07, 'epochs': 184, 'loss': 'mae', 'optimizer': 'adam', 'graph_mode': 'cutoff', 'cutoff': 0.7539113027686148, 'grm_norm': 'none', 'self_loops': False, 'use_snp_selection': True, 'num_snps': 23143, 'graphsage_batch_size': 128}. Best is trial 134 with value: 0.2646072956762485.
[I 2025-12-06 01:38:56,890] Trial 142 finished with value: 0.25302026571623354 and parameters: {'model_type': 'graphsage', 'hidden_dims': '[128, 64]', 'dropout': 0.13286350510133332, 'batch_norm': False, 'sage_aggr': 'mean', 'sage_normalize': False, 'sage_project': False, 'lr': 0.00016157399499331203, 'weight_decay': 2.4838114531914574e-07, 'epochs': 158, 'loss': 'mae', 'optimizer': 'adam', 'graph_mode': 'cutoff', 'cutoff': 0.7096125378972865, 'grm_norm': 'none', 'self_loops': False, 'use_snp_selection': True, 'num_snps': 15998, 'graphsage_batch_size': 128}. Best is trial 134 with value: 0.2646072956762485.
[I 2025-12-06 01:39:19,889] Trial 143 finished with value: 0.2597128092175437 and parameters: {'model_type': 'graphsage', 'hidden_dims': '[128, 64]', 'dropout': 0.15968399736455502, 'batch_norm': False, 'sage_aggr': 'mean', 'sage_normalize': False, 'sage_project': False, 'lr': 0.00022788842231142092, 'weight_decay': 5.288876583689817e-07, 'epochs': 152, 'loss': 'mae', 'optimizer': 'adam', 'graph_mode': 'cutoff', 'cutoff': 0.6541678513122829, 'grm_norm': 'none', 'self_loops': False, 'use_snp_selection': True, 'num_snps': 18266, 'graphsage_batch_size': 128}. Best is trial 134 with value: 0.2646072956762485.
[I 2025-12-06 01:39:42,854] Trial 144 finished with value: 0.2660740229882091 and parameters: {'model_type': 'graphsage', 'hidden_dims': '[128, 64]', 'dropout': 0.11837571174011724, 'batch_norm': False, 'sage_aggr': 'mean', 'sage_normalize': False, 'sage_project': False, 'lr': 0.00026447313936005116, 'weight_decay': 6.319842813778601e-07, 'epochs': 153, 'loss': 'mae', 'optimizer': 'adam', 'graph_mode': 'cutoff', 'cutoff': 0.6821342080737918, 'grm_norm': 'none', 'self_loops': False, 'use_snp_selection': True, 'num_snps': 18072, 'graphsage_batch_size': 8}. Best is trial 144 with value: 0.2660740229882091.
