[I 2025-12-09 09:55:07,916] Trial 56 finished with value: 0.31314375468071604 and parameters: {'model_type': 'graphsage', 'hidden_dims': '[512, 128]', 'dropout': 0.5666618966114925, 'batch_norm': True, 'sage_aggr': 'mean', 'sage_normalize': True, 'sage_project': False, 'lr': 0.0029187415434763714, 'weight_decay': 7.401783582609473e-06, 'epochs': 192, 'loss': 'mse', 'optimizer': 'adam', 'graph_mode': 'cutoff', 'cutoff': 0.6885852382409081, 'grm_norm': 'cosine_then_gcn', 'self_loops': True, 'use_snp_selection': False}. Best is trial 30 with value: 0.3184890102856323.
[I 2025-12-09 09:56:44,515] Trial 57 finished with value: 0.31501791651383493 and parameters: {'model_type': 'graphsage', 'hidden_dims': '[512, 128]', 'dropout': 0.5805830724523842, 'batch_norm': True, 'sage_aggr': 'mean', 'sage_normalize': True, 'sage_project': False, 'lr': 0.003569296446372132, 'weight_decay': 1.6216786659232077e-05, 'epochs': 216, 'loss': 'mse', 'optimizer': 'adam', 'graph_mode': 'cutoff', 'cutoff': 0.738392858282326, 'grm_norm': 'none', 'self_loops': True, 'use_snp_selection': False}. Best is trial 30 with value: 0.3184890102856323.
[I 2025-12-09 09:57:25,783] Trial 58 finished with value: 0.30424231970028526 and parameters: {'model_type': 'graphsage', 'hidden_dims': '[128, 64]', 'dropout': 0.5960095116786591, 'batch_norm': False, 'sage_aggr': 'mean', 'sage_normalize': True, 'sage_project': False, 'lr': 0.0037797659792168027, 'weight_decay': 1.551401238045888e-05, 'epochs': 242, 'loss': 'mse', 'optimizer': 'adam', 'graph_mode': 'cutoff', 'cutoff': 0.7347797639650473, 'grm_norm': 'none', 'self_loops': True, 'use_snp_selection': False}. Best is trial 30 with value: 0.3184890102856323.
[I 2025-12-09 09:59:25,121] Trial 59 finished with value: 0.30913604673149486 and parameters: {'model_type': 'graphsage', 'hidden_dims': '[512, 128]', 'dropout': 0.5780367658847941, 'batch_norm': True, 'sage_aggr': 'mean', 'sage_normalize': True, 'sage_project': False, 'lr': 0.008079800014018963, 'weight_decay': 2.7443034454918256e-05, 'epochs': 266, 'loss': 'mse', 'optimizer': 'adam', 'graph_mode': 'cutoff', 'cutoff': 0.5631522489132271, 'grm_norm': 'none', 'self_loops': True, 'use_snp_selection': False}. Best is trial 30 with value: 0.3184890102856323.
[I 2025-12-09 10:01:01,091] Trial 60 finished with value: 0.2997625069776083 and parameters: {'model_type': 'graphsage', 'hidden_dims': '[512, 256]', 'dropout': 0.5536185745640868, 'batch_norm': True, 'sage_aggr': 'max', 'sage_normalize': True, 'sage_project': False, 'lr': 1.004067125721024e-05, 'weight_decay': 0.000249519461664609, 'epochs': 213, 'loss': 'mse', 'optimizer': 'adam', 'graph_mode': 'cutoff', 'cutoff': 0.6474788082967174, 'grm_norm': 'none', 'self_loops': False, 'use_snp_selection': False}. Best is trial 30 with value: 0.3184890102856323.
[I 2025-12-09 10:02:06,739] Trial 61 finished with value: 0.3125119289180343 and parameters: {'model_type': 'graphsage', 'hidden_dims': '[512, 128]', 'dropout': 0.5302652073884458, 'batch_norm': True, 'sage_aggr': 'mean', 'sage_normalize': True, 'sage_project': False, 'lr': 0.004516215802428679, 'weight_decay': 3.5476927372379156e-06, 'epochs': 137, 'loss': 'mse', 'optimizer': 'adam', 'graph_mode': 'cutoff', 'cutoff': 0.8343258516011806, 'grm_norm': 'none', 'self_loops': True, 'use_snp_selection': False}. Best is trial 30 with value: 0.3184890102856323.
[I 2025-12-09 10:03:47,053] Trial 62 finished with value: 0.3088262196551147 and parameters: {'model_type': 'graphsage', 'hidden_dims': '[512, 128]', 'dropout': 0.5855422969912376, 'batch_norm': True, 'sage_aggr': 'mean', 'sage_normalize': True, 'sage_project': False, 'lr': 0.00342041680244468, 'weight_decay': 5.935563663995898e-05, 'epochs': 223, 'loss': 'mse', 'optimizer': 'adam', 'graph_mode': 'cutoff', 'cutoff': 0.8714000276985496, 'grm_norm': 'cosine_then_gcn', 'self_loops': True, 'use_snp_selection': False}. Best is trial 30 with value: 0.3184890102856323.
[I 2025-12-09 10:05:07,756] Trial 63 finished with value: 0.3134140655587784 and parameters: {'model_type': 'graphsage', 'hidden_dims': '[512, 128]', 'dropout': 0.513132725819569, 'batch_norm': True, 'sage_aggr': 'mean', 'sage_normalize': True, 'sage_project': False, 'lr': 0.009992428137735026, 'weight_decay': 1.0530896576911406e-05, 'epochs': 173, 'loss': 'mse', 'optimizer': 'adam', 'graph_mode': 'cutoff', 'cutoff': 0.7782780176124842, 'grm_norm': 'cosine_then_gcn', 'self_loops': True, 'use_snp_selection': False}. Best is trial 30 with value: 0.3184890102856323.
[I 2025-12-09 10:06:35,108] Trial 64 finished with value: 0.3096444009690069 and parameters: {'model_type': 'graphsage', 'hidden_dims': '[512, 128]', 'dropout': 0.5603011696368648, 'batch_norm': True, 'sage_aggr': 'mean', 'sage_normalize': True, 'sage_project': False, 'lr': 0.00765246455477103, 'weight_decay': 0.00012655306318113722, 'epochs': 190, 'loss': 'mse', 'optimizer': 'adam', 'graph_mode': 'cutoff', 'cutoff': 0.7404100490611885, 'grm_norm': 'cosine_then_gcn', 'self_loops': True, 'use_snp_selection': False}. Best is trial 30 with value: 0.3184890102856323.
[I 2025-12-09 10:08:19,509] Trial 65 finished with value: 0.30850982800108334 and parameters: {'model_type': 'graphsage', 'hidden_dims': '[512, 64]', 'dropout': 0.5400102428339638, 'batch_norm': True, 'sage_aggr': 'mean', 'sage_normalize': True, 'sage_project': False, 'lr': 0.006450601193287743, 'weight_decay': 5.039031851538181e-06, 'epochs': 236, 'loss': 'mse', 'optimizer': 'adam', 'graph_mode': 'cutoff', 'cutoff': 0.7072315462130538, 'grm_norm': 'none', 'self_loops': True, 'use_snp_selection': False}. Best is trial 30 with value: 0.3184890102856323.
[I 2025-12-09 10:08:50,626] Trial 66 finished with value: 0.31359928650477076 and parameters: {'model_type': 'graphsage', 'hidden_dims': '[256, 128, 64]', 'dropout': 0.4934156039608698, 'batch_norm': True, 'sage_aggr': 'mean', 'sage_normalize': True, 'sage_project': False, 'lr': 0.004786267107391024, 'weight_decay': 3.1059988795837385e-06, 'epochs': 92, 'loss': 'mse', 'optimizer': 'adam', 'graph_mode': 'cutoff', 'cutoff': 0.802240761827756, 'grm_norm': 'cosine_then_gcn', 'self_loops': True, 'use_snp_selection': False}. Best is trial 30 with value: 0.3184890102856323.
[I 2025-12-09 10:10:03,885] Trial 67 finished with value: 0.31061520813686133 and parameters: {'model_type': 'graphsage', 'hidden_dims': '[512, 128]', 'dropout': 0.5977194007264529, 'batch_norm': True, 'sage_aggr': 'mean', 'sage_normalize': True, 'sage_project': False, 'lr': 0.002114096970753671, 'weight_decay': 7.545682687326488e-07, 'epochs': 154, 'loss': 'mse', 'optimizer': 'adam', 'graph_mode': 'cutoff', 'cutoff': 0.8243250579771916, 'grm_norm': 'cosine_then_gcn', 'self_loops': True, 'use_snp_selection': False}. Best is trial 30 with value: 0.3184890102856323.
[I 2025-12-09 10:11:04,283] Trial 68 finished with value: 0.29195288311978257 and parameters: {'model_type': 'graphsage', 'hidden_dims': '[512, 128]', 'dropout': 0.11295115439788234, 'batch_norm': True, 'sage_aggr': 'mean', 'sage_normalize': True, 'sage_project': False, 'lr': 0.002558751814301085, 'weight_decay': 2.038549072065472e-06, 'epochs': 109, 'loss': 'mse', 'optimizer': 'adam', 'graph_mode': 'knn', 'knn_k': 1, 'weighted_edges': False, 'symmetrize_mode': 'union', 'self_loops': True, 'use_snp_selection': False}. Best is trial 30 with value: 0.3184890102856323.
[I 2025-12-09 10:11:38,444] Trial 69 finished with value: 0.31214945959617146 and parameters: {'model_type': 'graphsage', 'hidden_dims': '[512, 128]', 'dropout': 0.5328049873314692, 'batch_norm': True, 'sage_aggr': 'mean', 'sage_normalize': True, 'sage_project': False, 'lr': 0.0016158036738554654, 'weight_decay': 8.669565538004513e-06, 'epochs': 54, 'loss': 'mse', 'optimizer': 'adam', 'graph_mode': 'cutoff', 'cutoff': 0.8563063368134124, 'grm_norm': 'cosine', 'self_loops': True, 'use_snp_selection': False}. Best is trial 30 with value: 0.3184890102856323.
[I 2025-12-09 10:14:08,404] Trial 70 finished with value: 0.2850677565809998 and parameters: {'model_type': 'graphsage', 'hidden_dims': '[512, 128]', 'dropout': 0.27513872750353857, 'batch_norm': False, 'sage_aggr': 'mean', 'sage_normalize': True, 'sage_project': False, 'lr': 0.0034643126480688757, 'weight_decay': 1.1587036450484914e-06, 'epochs': 257, 'loss': 'mse', 'optimizer': 'adam', 'graph_mode': 'cutoff', 'cutoff': 0.27114999018047176, 'grm_norm': 'cosine_then_gcn', 'self_loops': True, 'use_snp_selection': False}. Best is trial 30 with value: 0.3184890102856323.
[I 2025-12-09 10:15:52,988] Trial 71 finished with value: 0.30990223401116745 and parameters: {'model_type': 'graphsage', 'hidden_dims': '[512, 128]', 'dropout': 0.5206829162423785, 'batch_norm': True, 'sage_aggr': 'mean', 'sage_normalize': True, 'sage_project': False, 'lr': 0.00697122155229101, 'weight_decay': 5.862309323493775e-06, 'epochs': 234, 'loss': 'mse', 'optimizer': 'adam', 'graph_mode': 'cutoff', 'cutoff': 0.7810516681097645, 'grm_norm': 'cosine_then_gcn', 'self_loops': True, 'use_snp_selection': False}. Best is trial 30 with value: 0.3184890102856323.
[I 2025-12-09 10:17:24,280] Trial 72 finished with value: 0.31118467269435257 and parameters: {'model_type': 'graphsage', 'hidden_dims': '[512, 128]', 'dropout': 0.5509820435419082, 'batch_norm': True, 'sage_aggr': 'mean', 'sage_normalize': True, 'sage_project': False, 'lr': 0.00608251222543188, 'weight_decay': 1.901955199792568e-05, 'epochs': 200, 'loss': 'mse', 'optimizer': 'adam', 'graph_mode': 'cutoff', 'cutoff': 0.7799674174789062, 'grm_norm': 'cosine_then_gcn', 'self_loops': True, 'use_snp_selection': False}. Best is trial 30 with value: 0.3184890102856323.
[I 2025-12-09 10:19:01,037] Trial 73 finished with value: 0.3172588989767197 and parameters: {'model_type': 'graphsage', 'hidden_dims': '[512, 128]', 'dropout': 0.5145964325887162, 'batch_norm': True, 'sage_aggr': 'mean', 'sage_normalize': True, 'sage_project': False, 'lr': 0.008125647041179825, 'weight_decay': 3.7957776158332864e-06, 'epochs': 214, 'loss': 'mse', 'optimizer': 'adam', 'graph_mode': 'cutoff', 'cutoff': 0.7560254081771962, 'grm_norm': 'cosine_then_gcn', 'self_loops': True, 'use_snp_selection': False}. Best is trial 30 with value: 0.3184890102856323.
[I 2025-12-09 10:20:39,379] Trial 74 finished with value: 0.3152959476993954 and parameters: {'model_type': 'graphsage', 'hidden_dims': '[512, 128]', 'dropout': 0.4971948124493904, 'batch_norm': True, 'sage_aggr': 'mean', 'sage_normalize': True, 'sage_project': False, 'lr': 0.004997420316207589, 'weight_decay': 4.079053222885852e-06, 'epochs': 218, 'loss': 'mse', 'optimizer': 'adam', 'graph_mode': 'cutoff', 'cutoff': 0.7492290690450021, 'grm_norm': 'cosine_then_gcn', 'self_loops': True, 'use_snp_selection': False}. Best is trial 30 with value: 0.3184890102856323.
[I 2025-12-09 10:22:16,140] Trial 75 finished with value: 0.3086665716023558 and parameters: {'model_type': 'graphsage', 'hidden_dims': '[512, 128]', 'dropout': 0.4797301182448188, 'batch_norm': True, 'sage_aggr': 'mean', 'sage_normalize': True, 'sage_project': False, 'lr': 0.0002884282510471542, 'weight_decay': 3.991767471687641e-06, 'epochs': 214, 'loss': 'mse', 'optimizer': 'adam', 'graph_mode': 'cutoff', 'cutoff': 0.7471124227041445, 'grm_norm': 'cosine_then_gcn', 'self_loops': True, 'use_snp_selection': False}. Best is trial 30 with value: 0.3184890102856323.
[I 2025-12-09 10:23:54,215] Trial 76 finished with value: 0.3123966471127524 and parameters: {'model_type': 'graphsage', 'hidden_dims': '[512, 128]', 'dropout': 0.5024333684498744, 'batch_norm': True, 'sage_aggr': 'mean', 'sage_normalize': True, 'sage_project': False, 'lr': 0.008120127693008088, 'weight_decay': 3.1593622113088934e-06, 'epochs': 219, 'loss': 'mse', 'optimizer': 'adam', 'graph_mode': 'cutoff', 'cutoff': 0.6745336025525059, 'grm_norm': 'none', 'self_loops': True, 'use_snp_selection': False}. Best is trial 30 with value: 0.3184890102856323.
[I 2025-12-09 10:24:42,510] Trial 77 finished with value: 0.30447202027337256 and parameters: {'model_type': 'graphsage', 'hidden_dims': '[128, 64]', 'dropout': 0.5806569542033276, 'batch_norm': True, 'sage_aggr': 'max', 'sage_normalize': True, 'sage_project': False, 'lr': 0.0045287480013522004, 'weight_decay': 1.447619334362901e-05, 'epochs': 296, 'loss': 'mse', 'optimizer': 'adam', 'graph_mode': 'cutoff', 'cutoff': 0.7060747215730575, 'grm_norm': 'gcn', 'self_loops': False, 'use_snp_selection': False}. Best is trial 30 with value: 0.3184890102856323.
[I 2025-12-09 10:26:16,459] Trial 78 finished with value: 0.3118263406800638 and parameters: {'model_type': 'graphsage', 'hidden_dims': '[512, 256]', 'dropout': 0.45709139820722217, 'batch_norm': True, 'sage_aggr': 'mean', 'sage_normalize': True, 'sage_project': False, 'lr': 0.005947387194129847, 'weight_decay': 1.7596899545413998e-06, 'epochs': 206, 'loss': 'mse', 'optimizer': 'adam', 'graph_mode': 'cutoff', 'cutoff': 0.7605903819039923, 'grm_norm': 'cosine_then_gcn', 'self_loops': True, 'use_snp_selection': False}. Best is trial 30 with value: 0.3184890102856323.
[I 2025-12-09 10:28:19,223] Trial 79 finished with value: 0.30406174776780365 and parameters: {'model_type': 'graphsage', 'hidden_dims': '[512, 128]', 'dropout': 0.4265024574250402, 'batch_norm': True, 'sage_aggr': 'mean', 'sage_normalize': True, 'sage_project': False, 'lr': 0.008669803304919142, 'weight_decay': 2.649241274231417e-06, 'epochs': 229, 'loss': 'mse', 'optimizer': 'adam', 'graph_mode': 'knn', 'knn_k': 5, 'weighted_edges': False, 'symmetrize_mode': 'mutual', 'self_loops': True, 'use_snp_selection': False}. Best is trial 30 with value: 0.3184890102856323.
[I 2025-12-09 10:29:39,505] Trial 80 finished with value: 0.3164386141230358 and parameters: {'model_type': 'graphsage', 'hidden_dims': '[512, 64]', 'dropout': 0.5658875361237425, 'batch_norm': True, 'sage_aggr': 'mean', 'sage_normalize': True, 'sage_project': False, 'lr': 0.0036789160461359036, 'weight_decay': 8.774366741363775e-06, 'epochs': 172, 'loss': 'mse', 'optimizer': 'adam', 'graph_mode': 'cutoff', 'cutoff': 0.7435891425365256, 'grm_norm': 'cosine', 'self_loops': False, 'use_snp_selection': False}. Best is trial 30 with value: 0.3184890102856323.
[I 2025-12-09 10:31:05,288] Trial 81 finished with value: 0.3111848615354461 and parameters: {'model_type': 'graphsage', 'hidden_dims': '[512, 64]', 'dropout': 0.5625743268615062, 'batch_norm': True, 'sage_aggr': 'mean', 'sage_normalize': True, 'sage_project': False, 'lr': 0.004007327024696079, 'weight_decay': 7.692862331371705e-06, 'epochs': 186, 'loss': 'mse', 'optimizer': 'adam', 'graph_mode': 'cutoff', 'cutoff': 0.6711385293083856, 'grm_norm': 'cosine', 'self_loops': False, 'use_snp_selection': False}. Best is trial 30 with value: 0.3184890102856323.
[I 2025-12-09 10:32:26,696] Trial 82 finished with value: 0.3078069819808587 and parameters: {'model_type': 'graphsage', 'hidden_dims': '[512, 64]', 'dropout': 0.5364336225806285, 'batch_norm': True, 'sage_aggr': 'mean', 'sage_normalize': True, 'sage_project': False, 'lr': 0.005316696535680953, 'weight_decay': 8.964580467453774e-06, 'epochs': 175, 'loss': 'mse', 'optimizer': 'adam', 'graph_mode': 'cutoff', 'cutoff': 0.7140053160561727, 'grm_norm': 'cosine', 'self_loops': False, 'use_snp_selection': False}. Best is trial 30 with value: 0.3184890102856323.
[I 2025-12-09 10:33:57,887] Trial 83 finished with value: 0.314126711327473 and parameters: {'model_type': 'graphsage', 'hidden_dims': '[512, 64]', 'dropout': 0.3660050389478188, 'batch_norm': True, 'sage_aggr': 'mean', 'sage_normalize': True, 'sage_project': False, 'lr': 0.0032538843904280843, 'weight_decay': 5.848931206677932e-06, 'epochs': 200, 'loss': 'mse', 'optimizer': 'adam', 'graph_mode': 'cutoff', 'cutoff': 0.7456881087167149, 'grm_norm': 'cosine', 'self_loops': False, 'use_snp_selection': False}. Best is trial 30 with value: 0.3184890102856323.
[I 2025-12-09 10:35:14,996] Trial 84 finished with value: 0.31452539492343845 and parameters: {'model_type': 'graphsage', 'hidden_dims': '[512, 64]', 'dropout': 0.5823415224230385, 'batch_norm': True, 'sage_aggr': 'mean', 'sage_normalize': True, 'sage_project': False, 'lr': 0.006907414819922345, 'weight_decay': 1.0568502558374804e-05, 'epochs': 164, 'loss': 'mse', 'optimizer': 'adam', 'graph_mode': 'cutoff', 'cutoff': 0.7744859402082357, 'grm_norm': 'cosine', 'self_loops': False, 'use_snp_selection': False}. Best is trial 30 with value: 0.3184890102856323.
[I 2025-12-09 10:36:13,610] Trial 85 finished with value: 0.3098999980050177 and parameters: {'model_type': 'graphsage', 'hidden_dims': '[256, 128, 64]', 'dropout': 0.48742302930091524, 'batch_norm': True, 'sage_aggr': 'mean', 'sage_normalize': True, 'sage_project': False, 'lr': 0.008298658852503804, 'weight_decay': 4.306483479157582e-06, 'epochs': 219, 'loss': 'mse', 'optimizer': 'adam', 'graph_mode': 'cutoff', 'cutoff': 0.8165372444871044, 'grm_norm': 'cosine_then_gcn', 'self_loops': False, 'use_snp_selection': False}. Best is trial 30 with value: 0.3184890102856323.
[I 2025-12-09 10:37:38,656] Trial 86 finished with value: 0.30654705455207837 and parameters: {'model_type': 'graphsage', 'hidden_dims': '[512, 128]', 'dropout': 0.5066503915795324, 'batch_norm': False, 'sage_aggr': 'mean', 'sage_normalize': True, 'sage_project': False, 'lr': 0.0010964644060349733, 'weight_decay': 1.3187225341577042e-06, 'epochs': 184, 'loss': 'mse', 'optimizer': 'adam', 'graph_mode': 'cutoff', 'cutoff': 0.7281695606836617, 'grm_norm': 'cosine_then_gcn', 'self_loops': True, 'use_snp_selection': False}. Best is trial 30 with value: 0.3184890102856323.
[I 2025-12-09 10:39:13,165] Trial 87 finished with value: 0.30066193555176973 and parameters: {'model_type': 'graphsage', 'hidden_dims': '[512, 128]', 'dropout': 0.5598040945683193, 'batch_norm': True, 'sage_aggr': 'mean', 'sage_normalize': True, 'sage_project': False, 'lr': 3.4615768147877425e-05, 'weight_decay': 8.378112004837503e-07, 'epochs': 208, 'loss': 'mse', 'optimizer': 'adam', 'graph_mode': 'cutoff', 'cutoff': 0.7964067106161897, 'grm_norm': 'cosine_then_gcn', 'self_loops': False, 'use_snp_selection': False}. Best is trial 30 with value: 0.3184890102856323.
[I 2025-12-09 10:40:44,478] Trial 88 finished with value: 0.31038886850446745 and parameters: {'model_type': 'graphsage', 'hidden_dims': '[512, 128]', 'dropout': 0.5487777333335475, 'batch_norm': True, 'sage_aggr': 'mean', 'sage_normalize': True, 'sage_project': False, 'lr': 0.0024383597115380834, 'weight_decay': 1.962830902740917e-05, 'epochs': 199, 'loss': 'mse', 'optimizer': 'adam', 'graph_mode': 'cutoff', 'cutoff': 0.6243971987263377, 'grm_norm': 'cosine', 'self_loops': True, 'use_snp_selection': False}. Best is trial 30 with value: 0.3184890102856323.
[I 2025-12-09 10:41:15,024] Trial 89 finished with value: 0.2656503355950081 and parameters: {'model_type': 'graphsage', 'hidden_dims': '[512, 128]', 'dropout': 0.4702655575058016, 'batch_norm': True, 'sage_aggr': 'max', 'sage_normalize': False, 'sage_project': False, 'lr': 0.009853268458326818, 'weight_decay': 1.2725029461971751e-05, 'epochs': 140, 'loss': 'mse', 'optimizer': 'adam', 'graph_mode': 'cutoff', 'cutoff': 0.7611869042857643, 'grm_norm': 'cosine_then_gcn', 'self_loops': True, 'use_snp_selection': True, 'num_snps': 3330}. Best is trial 30 with value: 0.3184890102856323.
[I 2025-12-09 10:42:27,290] Trial 90 finished with value: 0.3018626285509533 and parameters: {'model_type': 'graphsage', 'hidden_dims': '[512, 64]', 'dropout': 0.5735212429410114, 'batch_norm': True, 'sage_aggr': 'mean', 'sage_normalize': True, 'sage_project': False, 'lr': 0.005106010340937379, 'weight_decay': 2.1656764092067973e-06, 'epochs': 154, 'loss': 'mae', 'optimizer': 'adam', 'graph_mode': 'cutoff', 'cutoff': 0.8529354627704047, 'grm_norm': 'gcn', 'self_loops': False, 'use_snp_selection': False}. Best is trial 30 with value: 0.3184890102856323.
[I 2025-12-09 10:42:59,295] Trial 91 finished with value: 0.3156655775035304 and parameters: {'model_type': 'graphsage', 'hidden_dims': '[128, 64]', 'dropout': 0.5869023853575638, 'batch_norm': True, 'sage_aggr': 'mean', 'sage_normalize': True, 'sage_project': False, 'lr': 0.0069463502711646545, 'weight_decay': 3.4648605610395665e-05, 'epochs': 164, 'loss': 'mse', 'optimizer': 'adam', 'graph_mode': 'cutoff', 'cutoff': 0.7740691554528404, 'grm_norm': 'cosine', 'self_loops': False, 'use_snp_selection': False}. Best is trial 30 with value: 0.3184890102856323.
[I 2025-12-09 10:44:21,626] Trial 92 finished with value: 0.313429477936025 and parameters: {'model_type': 'graphsage', 'hidden_dims': '[512, 128]', 'dropout': 0.5997371536717853, 'batch_norm': True, 'sage_aggr': 'mean', 'sage_normalize': True, 'sage_project': False, 'lr': 0.006242717348451882, 'weight_decay': 3.35312371250524e-05, 'epochs': 177, 'loss': 'mse', 'optimizer': 'adam', 'graph_mode': 'cutoff', 'cutoff': 0.791346495702095, 'grm_norm': 'cosine', 'self_loops': False, 'use_snp_selection': False}. Best is trial 30 with value: 0.3184890102856323.
[I 2025-12-09 10:44:56,983] Trial 93 finished with value: 0.3089806128584116 and parameters: {'model_type': 'graphsage', 'hidden_dims': '[128, 64]', 'dropout': 0.584200412124728, 'batch_norm': True, 'sage_aggr': 'mean', 'sage_normalize': True, 'sage_project': False, 'lr': 0.004043264381378355, 'weight_decay': 6.3216835858818435e-06, 'epochs': 189, 'loss': 'mse', 'optimizer': 'adam', 'graph_mode': 'cutoff', 'cutoff': 0.7586450971330337, 'grm_norm': 'cosine', 'self_loops': False, 'use_snp_selection': False}. Best is trial 30 with value: 0.3184890102856323.
