[I 2025-12-06 16:34:04,427] Trial 42 finished with value: 0.2352502940196331 and parameters: {'model_type': 'graphsage', 'hidden_dims': '[512, 256]', 'dropout': 0.25141472353335403, 'batch_norm': False, 'sage_aggr': 'max', 'sage_normalize': False, 'sage_project': False, 'lr': 0.00017485331446450602, 'weight_decay': 4.017914531073429e-05, 'epochs': 207, 'loss': 'mae', 'optimizer': 'adam', 'graph_mode': 'cutoff', 'cutoff': 0.2965827816762405, 'grm_norm': 'none', 'self_loops': False, 'use_snp_selection': False, 'graphsage_batch_size': 128}. Best is trial 33 with value: 0.24520186056173535.
[I 2025-12-06 16:37:12,789] Trial 43 finished with value: 0.2349687177236998 and parameters: {'model_type': 'graphsage', 'hidden_dims': '[512, 256]', 'dropout': 0.17197506862574322, 'batch_norm': False, 'sage_aggr': 'max', 'sage_normalize': False, 'sage_project': False, 'lr': 9.69881014103814e-06, 'weight_decay': 8.844849008651364e-05, 'epochs': 241, 'loss': 'mae', 'optimizer': 'adam', 'graph_mode': 'cutoff', 'cutoff': 0.3836294095834755, 'grm_norm': 'none', 'self_loops': False, 'use_snp_selection': False, 'graphsage_batch_size': 128}. Best is trial 33 with value: 0.24520186056173535.
[I 2025-12-06 16:41:03,844] Trial 44 finished with value: 0.2304135127856802 and parameters: {'model_type': 'graphsage', 'hidden_dims': '[512, 256]', 'dropout': 0.13452214782112001, 'batch_norm': False, 'sage_aggr': 'max', 'sage_normalize': False, 'sage_project': False, 'lr': 0.0003272004321763424, 'weight_decay': 2.5067058318258462e-05, 'epochs': 238, 'loss': 'mae', 'optimizer': 'adam', 'graph_mode': 'cutoff', 'cutoff': 0.2823475775572116, 'grm_norm': 'none', 'self_loops': False, 'use_snp_selection': False, 'graphsage_batch_size': 128}. Best is trial 33 with value: 0.24520186056173535.
[I 2025-12-06 16:43:32,067] Trial 45 finished with value: 0.2370527598738351 and parameters: {'model_type': 'graphsage', 'hidden_dims': '[512, 128]', 'dropout': 0.21162758707450213, 'batch_norm': False, 'sage_aggr': 'max', 'sage_normalize': False, 'sage_project': False, 'lr': 1.7372660044372747e-05, 'weight_decay': 1.2579541800255786e-05, 'epochs': 195, 'loss': 'mae', 'optimizer': 'adam', 'graph_mode': 'cutoff', 'cutoff': 0.4429284626018247, 'grm_norm': 'none', 'self_loops': False, 'use_snp_selection': False, 'graphsage_batch_size': 512}. Best is trial 33 with value: 0.24520186056173535.
[I 2025-12-06 16:45:51,861] Trial 46 finished with value: 0.23858961356570277 and parameters: {'model_type': 'graphsage', 'hidden_dims': '[512, 256]', 'dropout': 0.3386991039724526, 'batch_norm': False, 'sage_aggr': 'max', 'sage_normalize': False, 'sage_project': False, 'lr': 0.0001323949020885049, 'weight_decay': 4.089403165580039e-05, 'epochs': 182, 'loss': 'mae', 'optimizer': 'adam', 'graph_mode': 'cutoff', 'cutoff': 0.3527314202588514, 'grm_norm': 'gcn', 'self_loops': False, 'use_snp_selection': True, 'num_snps': 40179, 'graphsage_batch_size': 32}. Best is trial 33 with value: 0.24520186056173535.
[I 2025-12-06 16:47:14,206] Trial 47 finished with value: 0.1946797693463948 and parameters: {'model_type': 'graphsage', 'hidden_dims': '[256, 128, 64]', 'dropout': 0.4195110766361489, 'batch_norm': False, 'sage_aggr': 'mean', 'sage_normalize': True, 'sage_project': False, 'lr': 5.486820005101933e-05, 'weight_decay': 5.0802612988559935e-05, 'epochs': 219, 'loss': 'mae', 'optimizer': 'adam', 'graph_mode': 'knn', 'knn_k': 2, 'weighted_edges': True, 'symmetrize_mode': 'union', 'self_loops': False, 'use_snp_selection': True, 'num_snps': 39663, 'graphsage_batch_size': 32}. Best is trial 33 with value: 0.24520186056173535.
[I 2025-12-06 16:50:19,534] Trial 48 finished with value: 0.24804143078676782 and parameters: {'model_type': 'graphsage', 'hidden_dims': '[512, 256]', 'dropout': 0.3721647259097136, 'batch_norm': False, 'sage_aggr': 'mean', 'sage_normalize': False, 'sage_project': False, 'lr': 6.1044133736959795e-06, 'weight_decay': 0.0002589312078817651, 'epochs': 182, 'loss': 'mae', 'optimizer': 'adam', 'graph_mode': 'cutoff', 'cutoff': 0.34844993666748847, 'grm_norm': 'gcn', 'self_loops': False, 'use_snp_selection': True, 'num_snps': 54763, 'graphsage_batch_size': 32}. Best is trial 48 with value: 0.24804143078676782.
[I 2025-12-06 16:52:44,796] Trial 49 finished with value: 0.20926639715178816 and parameters: {'model_type': 'graphsage', 'hidden_dims': '[512, 64]', 'dropout': 0.3331072795270166, 'batch_norm': False, 'sage_aggr': 'max', 'sage_normalize': False, 'sage_project': False, 'lr': 6.0176956995531605e-06, 'weight_decay': 0.0009224515014538186, 'epochs': 107, 'loss': 'mae', 'optimizer': 'adam', 'graph_mode': 'cutoff', 'cutoff': 0.33470208949904046, 'grm_norm': 'gcn', 'self_loops': False, 'use_snp_selection': True, 'num_snps': 59644, 'graphsage_batch_size': 32}. Best is trial 48 with value: 0.24804143078676782.
[I 2025-12-06 16:55:10,743] Trial 50 finished with value: 0.1934659700982412 and parameters: {'model_type': 'graphsage', 'hidden_dims': '[512, 128]', 'dropout': 0.3808285850859427, 'batch_norm': False, 'sage_aggr': 'mean', 'sage_normalize': False, 'sage_project': False, 'lr': 2.024229541721524e-06, 'weight_decay': 0.0003694718697196016, 'epochs': 176, 'loss': 'mse', 'optimizer': 'adam', 'graph_mode': 'knn', 'knn_k': 7, 'weighted_edges': False, 'symmetrize_mode': 'mutual', 'self_loops': False, 'use_snp_selection': True, 'num_snps': 49499, 'graphsage_batch_size': 64}. Best is trial 48 with value: 0.24804143078676782.
[I 2025-12-06 16:57:07,654] Trial 51 finished with value: 0.24140008199575766 and parameters: {'model_type': 'graphsage', 'hidden_dims': '[512, 256]', 'dropout': 0.4348055158998509, 'batch_norm': False, 'sage_aggr': 'mean', 'sage_normalize': False, 'sage_project': False, 'lr': 1.1850369839736895e-05, 'weight_decay': 0.00020133399806366136, 'epochs': 162, 'loss': 'mae', 'optimizer': 'adam', 'graph_mode': 'cutoff', 'cutoff': 0.36988712594324785, 'grm_norm': 'gcn', 'self_loops': False, 'use_snp_selection': True, 'num_snps': 41322, 'graphsage_batch_size': 32}. Best is trial 48 with value: 0.24804143078676782.
[I 2025-12-06 16:59:07,254] Trial 52 finished with value: 0.24453215900797565 and parameters: {'model_type': 'graphsage', 'hidden_dims': '[512, 256]', 'dropout': 0.5184513496699384, 'batch_norm': False, 'sage_aggr': 'mean', 'sage_normalize': False, 'sage_project': False, 'lr': 1.2780146200067523e-05, 'weight_decay': 0.00020573547084512325, 'epochs': 153, 'loss': 'mae', 'optimizer': 'adam', 'graph_mode': 'cutoff', 'cutoff': 0.35589638675412777, 'grm_norm': 'gcn', 'self_loops': False, 'use_snp_selection': True, 'num_snps': 41581, 'graphsage_batch_size': 32}. Best is trial 48 with value: 0.24804143078676782.
[I 2025-12-06 17:01:20,663] Trial 53 finished with value: 0.2273088841538172 and parameters: {'model_type': 'graphsage', 'hidden_dims': '[512, 256]', 'dropout': 0.5175046227393609, 'batch_norm': False, 'sage_aggr': 'mean', 'sage_normalize': False, 'sage_project': False, 'lr': 3.4729224531122427e-06, 'weight_decay': 0.00019912546683354865, 'epochs': 137, 'loss': 'mae', 'optimizer': 'adam', 'graph_mode': 'cutoff', 'cutoff': 0.3903248684595716, 'grm_norm': 'gcn', 'self_loops': False, 'use_snp_selection': True, 'num_snps': 53082, 'graphsage_batch_size': 32}. Best is trial 48 with value: 0.24804143078676782.
[I 2025-12-06 17:04:11,474] Trial 54 finished with value: 0.2291098070465641 and parameters: {'model_type': 'graphsage', 'hidden_dims': '[512, 256]', 'dropout': 0.5307822556667225, 'batch_norm': False, 'sage_aggr': 'mean', 'sage_normalize': False, 'sage_project': False, 'lr': 1.2320277583689777e-05, 'weight_decay': 0.0006119501593628881, 'epochs': 160, 'loss': 'mae', 'optimizer': 'adam', 'graph_mode': 'cutoff', 'cutoff': 0.269008833040524, 'grm_norm': 'gcn', 'self_loops': False, 'use_snp_selection': True, 'num_snps': 42812, 'graphsage_batch_size': 32}. Best is trial 48 with value: 0.24804143078676782.
[I 2025-12-06 17:05:47,587] Trial 55 finished with value: 0.2354018565291512 and parameters: {'model_type': 'graphsage', 'hidden_dims': '[256, 128]', 'dropout': 0.4583992241732051, 'batch_norm': False, 'sage_aggr': 'mean', 'sage_normalize': False, 'sage_project': False, 'lr': 5.9614440462854765e-06, 'weight_decay': 0.00012282075936651324, 'epochs': 124, 'loss': 'mae', 'optimizer': 'adam', 'graph_mode': 'cutoff', 'cutoff': 0.23935320757170075, 'grm_norm': 'gcn', 'self_loops': False, 'use_snp_selection': True, 'num_snps': 31267, 'graphsage_batch_size': 16}. Best is trial 48 with value: 0.24804143078676782.
[I 2025-12-06 17:08:45,803] Trial 56 finished with value: 0.23706463287676466 and parameters: {'model_type': 'graphsage', 'hidden_dims': '[512, 256]', 'dropout': 0.5180994221539583, 'batch_norm': False, 'sage_aggr': 'mean', 'sage_normalize': False, 'sage_project': False, 'lr': 7.326723696112802e-06, 'weight_decay': 0.00021122191198917492, 'epochs': 166, 'loss': 'mae', 'optimizer': 'adam', 'graph_mode': 'cutoff', 'cutoff': 0.33036252229699925, 'grm_norm': 'gcn', 'self_loops': False, 'use_snp_selection': True, 'num_snps': 53949, 'graphsage_batch_size': 32}. Best is trial 48 with value: 0.24804143078676782.
[I 2025-12-06 17:10:02,221] Trial 57 finished with value: 0.2411283254500801 and parameters: {'model_type': 'graphsage', 'hidden_dims': '[512, 256]', 'dropout': 0.4326018638600706, 'batch_norm': False, 'sage_aggr': 'mean', 'sage_normalize': False, 'sage_project': False, 'lr': 1.3887619338244995e-05, 'weight_decay': 0.000316981337085348, 'epochs': 154, 'loss': 'mae', 'optimizer': 'adam', 'graph_mode': 'cutoff', 'cutoff': 0.5340600018581652, 'grm_norm': 'gcn', 'self_loops': False, 'use_snp_selection': True, 'num_snps': 36377, 'graphsage_batch_size': 32}. Best is trial 48 with value: 0.24804143078676782.
[I 2025-12-06 17:10:47,249] Trial 58 finished with value: 0.20000619304823455 and parameters: {'model_type': 'graphsage', 'hidden_dims': '[128, 64]', 'dropout': 0.4332549795635471, 'batch_norm': False, 'sage_aggr': 'mean', 'sage_normalize': False, 'sage_project': False, 'lr': 1.2409601464849401e-05, 'weight_decay': 0.00028188478218994106, 'epochs': 146, 'loss': 'mae', 'optimizer': 'adam', 'graph_mode': 'knn', 'knn_k': 4, 'weighted_edges': False, 'symmetrize_mode': 'mutual', 'self_loops': False, 'use_snp_selection': True, 'num_snps': 36086, 'graphsage_batch_size': 32}. Best is trial 48 with value: 0.24804143078676782.
[I 2025-12-06 17:12:11,249] Trial 59 finished with value: 0.2521737550644459 and parameters: {'model_type': 'graphsage', 'hidden_dims': '[512, 128]', 'dropout': 0.49436642487723503, 'batch_norm': True, 'sage_aggr': 'mean', 'sage_normalize': False, 'sage_project': False, 'lr': 4.118485781842856e-06, 'weight_decay': 0.000764650093284579, 'epochs': 139, 'loss': 'mae', 'optimizer': 'adam', 'graph_mode': 'cutoff', 'cutoff': 0.5820774602328971, 'grm_norm': 'gcn', 'self_loops': False, 'use_snp_selection': True, 'num_snps': 45515, 'graphsage_batch_size': 8}. Best is trial 59 with value: 0.2521737550644459.
[I 2025-12-06 17:13:24,905] Trial 60 finished with value: 0.1850931393203586 and parameters: {'model_type': 'graphsage', 'hidden_dims': '[512, 128]', 'dropout': 0.4862999932851234, 'batch_norm': True, 'sage_aggr': 'mean', 'sage_normalize': True, 'sage_project': False, 'lr': 2.5859541271231353e-06, 'weight_decay': 0.0006070984160501967, 'epochs': 112, 'loss': 'mae', 'optimizer': 'adam', 'graph_mode': 'cutoff', 'cutoff': 0.6454746119829625, 'grm_norm': 'gcn', 'self_loops': False, 'use_snp_selection': True, 'num_snps': 47016, 'graphsage_batch_size': 8}. Best is trial 59 with value: 0.2521737550644459.
[I 2025-12-06 17:14:39,773] Trial 61 finished with value: 0.22170620057235396 and parameters: {'model_type': 'graphsage', 'hidden_dims': '[512, 128]', 'dropout': 0.5651440546569784, 'batch_norm': True, 'sage_aggr': 'mean', 'sage_normalize': False, 'sage_project': False, 'lr': 4.402300192775683e-06, 'weight_decay': 0.0009629251530328757, 'epochs': 132, 'loss': 'mae', 'optimizer': 'adam', 'graph_mode': 'cutoff', 'cutoff': 0.5925694659761006, 'grm_norm': 'gcn', 'self_loops': False, 'use_snp_selection': True, 'num_snps': 41478, 'graphsage_batch_size': 8}. Best is trial 59 with value: 0.2521737550644459.
[I 2025-12-06 17:15:56,837] Trial 62 finished with value: 0.19517753721472103 and parameters: {'model_type': 'graphsage', 'hidden_dims': '[512, 128]', 'dropout': 0.46981116357007374, 'batch_norm': True, 'sage_aggr': 'mean', 'sage_normalize': False, 'sage_project': False, 'lr': 1.4994290423518447e-06, 'weight_decay': 0.0004790548997654113, 'epochs': 154, 'loss': 'mae', 'optimizer': 'adam', 'graph_mode': 'cutoff', 'cutoff': 0.5241442310862954, 'grm_norm': 'gcn', 'self_loops': False, 'use_snp_selection': True, 'num_snps': 36437, 'graphsage_batch_size': 8}. Best is trial 59 with value: 0.2521737550644459.
[I 2025-12-06 17:17:19,879] Trial 63 finished with value: 0.21882733702913643 and parameters: {'model_type': 'graphsage', 'hidden_dims': '[512, 128]', 'dropout': 0.4380662592218065, 'batch_norm': True, 'sage_aggr': 'mean', 'sage_normalize': False, 'sage_project': False, 'lr': 7.298460633964195e-06, 'weight_decay': 0.00028209868965887547, 'epochs': 140, 'loss': 'mae', 'optimizer': 'adam', 'graph_mode': 'cutoff', 'cutoff': 0.5667734006915646, 'grm_norm': 'gcn', 'self_loops': False, 'use_snp_selection': True, 'num_snps': 44751, 'graphsage_batch_size': 32}. Best is trial 59 with value: 0.2521737550644459.
[I 2025-12-06 17:18:20,826] Trial 64 finished with value: 0.22754934362182552 and parameters: {'model_type': 'graphsage', 'hidden_dims': '[512, 256]', 'dropout': 0.49765710066859503, 'batch_norm': True, 'sage_aggr': 'mean', 'sage_normalize': False, 'sage_project': False, 'lr': 3.622203441081874e-06, 'weight_decay': 0.00015489585484470395, 'epochs': 166, 'loss': 'mae', 'optimizer': 'adam', 'graph_mode': 'cutoff', 'cutoff': 0.6499454103359603, 'grm_norm': 'gcn', 'self_loops': False, 'use_snp_selection': True, 'num_snps': 27359, 'graphsage_batch_size': 256}. Best is trial 59 with value: 0.2521737550644459.
[I 2025-12-06 17:19:33,293] Trial 65 finished with value: 0.22958681674575124 and parameters: {'model_type': 'graphsage', 'hidden_dims': '[256, 128, 64]', 'dropout': 0.5610669354840251, 'batch_norm': False, 'sage_aggr': 'mean', 'sage_normalize': False, 'sage_project': False, 'lr': 1.1144381630597524e-05, 'weight_decay': 0.0006734126770170145, 'epochs': 172, 'loss': 'mae', 'optimizer': 'adam', 'graph_mode': 'cutoff', 'cutoff': 0.7242692397189274, 'grm_norm': 'gcn', 'self_loops': False, 'use_snp_selection': True, 'num_snps': 52197, 'graphsage_batch_size': 8}. Best is trial 59 with value: 0.2521737550644459.
[I 2025-12-06 17:20:25,853] Trial 66 finished with value: 0.24076621104435975 and parameters: {'model_type': 'graphsage', 'hidden_dims': '[512, 128]', 'dropout': 0.4020394449689242, 'batch_norm': False, 'sage_aggr': 'mean', 'sage_normalize': False, 'sage_project': False, 'lr': 1.4507614022299614e-05, 'weight_decay': 0.00010367193281710845, 'epochs': 85, 'loss': 'mae', 'optimizer': 'adam', 'graph_mode': 'cutoff', 'cutoff': 0.7816527071581265, 'grm_norm': 'cosine_then_gcn', 'self_loops': False, 'use_snp_selection': True, 'num_snps': 38167, 'graphsage_batch_size': 32}. Best is trial 59 with value: 0.2521737550644459.
[I 2025-12-06 17:22:08,276] Trial 67 finished with value: 0.19657606222367274 and parameters: {'model_type': 'graphsage', 'hidden_dims': '[512, 256]', 'dropout': 0.35399189348757515, 'batch_norm': True, 'sage_aggr': 'mean', 'sage_normalize': False, 'sage_project': False, 'lr': 7.746953577269403e-06, 'weight_decay': 0.00045397837769615377, 'epochs': 118, 'loss': 'mae', 'optimizer': 'adam', 'graph_mode': 'knn', 'knn_k': 2, 'weighted_edges': True, 'symmetrize_mode': 'union', 'self_loops': False, 'use_snp_selection': True, 'num_snps': 55892, 'graphsage_batch_size': 64}. Best is trial 59 with value: 0.2521737550644459.
[I 2025-12-06 17:22:43,780] Trial 68 finished with value: 0.22092680073955223 and parameters: {'model_type': 'graphsage', 'hidden_dims': '[128, 64]', 'dropout': 0.549206506541856, 'batch_norm': False, 'sage_aggr': 'mean', 'sage_normalize': False, 'sage_project': False, 'lr': 5.292473911662798e-06, 'weight_decay': 0.00029297426916889506, 'epochs': 149, 'loss': 'mae', 'optimizer': 'adam', 'graph_mode': 'cutoff', 'cutoff': 0.5448911045512524, 'grm_norm': 'gcn', 'self_loops': False, 'use_snp_selection': True, 'num_snps': 30410, 'graphsage_batch_size': 512}. Best is trial 59 with value: 0.2521737550644459.
[I 2025-12-06 17:24:17,253] Trial 69 finished with value: 0.24061555169006735 and parameters: {'model_type': 'graphsage', 'hidden_dims': '[512, 128]', 'dropout': 0.49910317764253254, 'batch_norm': False, 'sage_aggr': 'mean', 'sage_normalize': False, 'sage_project': False, 'lr': 2.4708101643798716e-05, 'weight_decay': 0.00022225656440142514, 'epochs': 160, 'loss': 'mae', 'optimizer': 'adam', 'graph_mode': 'cutoff', 'cutoff': 0.6806405215551385, 'grm_norm': 'cosine', 'self_loops': False, 'use_snp_selection': True, 'num_snps': 47374, 'graphsage_batch_size': 16}. Best is trial 59 with value: 0.2521737550644459.
[I 2025-12-06 17:25:52,339] Trial 70 finished with value: 0.22653649100837042 and parameters: {'model_type': 'graphsage', 'hidden_dims': '[512, 256]', 'dropout': 0.3680926772067346, 'batch_norm': False, 'sage_aggr': 'mean', 'sage_normalize': False, 'sage_project': False, 'lr': 8.959679357757065e-06, 'weight_decay': 0.00014899684215417225, 'epochs': 142, 'loss': 'mse', 'optimizer': 'adam', 'graph_mode': 'cutoff', 'cutoff': 0.4909501766123349, 'grm_norm': 'gcn', 'self_loops': False, 'use_snp_selection': True, 'num_snps': 43082, 'graphsage_batch_size': 32}. Best is trial 59 with value: 0.2521737550644459.
[I 2025-12-06 17:26:44,049] Trial 71 finished with value: 0.2410426867100895 and parameters: {'model_type': 'graphsage', 'hidden_dims': '[512, 128]', 'dropout': 0.4106914349898656, 'batch_norm': False, 'sage_aggr': 'mean', 'sage_normalize': False, 'sage_project': False, 'lr': 1.3635687835126635e-05, 'weight_decay': 8.50161175891013e-05, 'epochs': 82, 'loss': 'mae', 'optimizer': 'adam', 'graph_mode': 'cutoff', 'cutoff': 0.8240302750236841, 'grm_norm': 'cosine_then_gcn', 'self_loops': False, 'use_snp_selection': True, 'num_snps': 38367, 'graphsage_batch_size': 32}. Best is trial 59 with value: 0.2521737550644459.
[I 2025-12-06 17:27:33,458] Trial 72 finished with value: 0.24489395359134286 and parameters: {'model_type': 'graphsage', 'hidden_dims': '[512, 128]', 'dropout': 0.3964698819873846, 'batch_norm': False, 'sage_aggr': 'mean', 'sage_normalize': False, 'sage_project': False, 'lr': 2.6321194036702458e-05, 'weight_decay': 9.310762561431499e-05, 'epochs': 92, 'loss': 'mae', 'optimizer': 'adam', 'graph_mode': 'cutoff', 'cutoff': 0.8538865868649903, 'grm_norm': 'cosine_then_gcn', 'self_loops': False, 'use_snp_selection': True, 'num_snps': 32950, 'graphsage_batch_size': 32}. Best is trial 59 with value: 0.2521737550644459.
[I 2025-12-06 17:28:22,752] Trial 73 finished with value: 0.25080828685827455 and parameters: {'model_type': 'graphsage', 'hidden_dims': '[512, 128]', 'dropout': 0.3905292691833092, 'batch_norm': False, 'sage_aggr': 'mean', 'sage_normalize': False, 'sage_project': False, 'lr': 2.8287655828148802e-05, 'weight_decay': 0.0003979625155597534, 'epochs': 99, 'loss': 'mae', 'optimizer': 'adam', 'graph_mode': 'cutoff', 'cutoff': 0.8690696899719641, 'grm_norm': 'cosine_then_gcn', 'self_loops': False, 'use_snp_selection': True, 'num_snps': 31384, 'graphsage_batch_size': 32}. Best is trial 59 with value: 0.2521737550644459.
[I 2025-12-06 17:28:58,233] Trial 74 finished with value: 0.2504454538770119 and parameters: {'model_type': 'graphsage', 'hidden_dims': '[512, 128]', 'dropout': 0.369870105213375, 'batch_norm': False, 'sage_aggr': 'mean', 'sage_normalize': False, 'sage_project': False, 'lr': 2.5907334587470473e-05, 'weight_decay': 0.0007497847516542534, 'epochs': 96, 'loss': 'mae', 'optimizer': 'adam', 'graph_mode': 'cutoff', 'cutoff': 0.8449382008163053, 'grm_norm': 'cosine_then_gcn', 'self_loops': False, 'use_snp_selection': True, 'num_snps': 19725, 'graphsage_batch_size': 32}. Best is trial 59 with value: 0.2521737550644459.
[I 2025-12-06 17:29:28,108] Trial 75 finished with value: 0.24404758332169507 and parameters: {'model_type': 'graphsage', 'hidden_dims': '[512, 128]', 'dropout': 0.3969111420079267, 'batch_norm': False, 'sage_aggr': 'mean', 'sage_normalize': False, 'sage_project': False, 'lr': 2.737341950173455e-05, 'weight_decay': 0.0007404640219171235, 'epochs': 95, 'loss': 'mae', 'optimizer': 'adam', 'graph_mode': 'cutoff', 'cutoff': 0.870001658313062, 'grm_norm': 'cosine_then_gcn', 'self_loops': False, 'use_snp_selection': True, 'num_snps': 14425, 'graphsage_batch_size': 32}. Best is trial 59 with value: 0.2521737550644459.
[I 2025-12-06 17:30:07,602] Trial 76 finished with value: 0.2323290920395765 and parameters: {'model_type': 'graphsage', 'hidden_dims': '[512, 128]', 'dropout': 0.3127982254083379, 'batch_norm': False, 'sage_aggr': 'mean', 'sage_normalize': False, 'sage_project': False, 'lr': 4.0901267414941455e-05, 'weight_decay': 0.0004306872625545062, 'epochs': 93, 'loss': 'mae', 'optimizer': 'adam', 'graph_mode': 'knn', 'knn_k': 3, 'weighted_edges': False, 'symmetrize_mode': 'mutual', 'self_loops': False, 'use_snp_selection': True, 'num_snps': 22352, 'graphsage_batch_size': 32}. Best is trial 59 with value: 0.2521737550644459.
