[I 2025-12-08 22:39:53,895] Trial 36 finished with value: 0.3511108536407528 and parameters: {'model_type': 'graphsage', 'hidden_dims': '[256, 128, 64]', 'dropout': 0.3804087917909684, 'batch_norm': True, 'sage_aggr': 'max', 'sage_normalize': False, 'sage_project': False, 'lr': 3.052126518086835e-05, 'weight_decay': 6.799835853919868e-07, 'epochs': 100, 'loss': 'mae', 'optimizer': 'adam', 'graph_mode': 'cutoff', 'cutoff': 0.5571715572612115, 'grm_norm': 'cosine', 'self_loops': True, 'use_snp_selection': True, 'num_snps': 45477}. Best is trial 12 with value: 0.3643779789429402.
[I 2025-12-08 22:40:32,734] Trial 37 finished with value: 0.35365363615718964 and parameters: {'model_type': 'graphsage', 'hidden_dims': '[256, 128, 64]', 'dropout': 0.13095718817353252, 'batch_norm': False, 'sage_aggr': 'max', 'sage_normalize': False, 'sage_project': False, 'lr': 0.0001028256708677246, 'weight_decay': 2.0499074927396325e-07, 'epochs': 131, 'loss': 'mae', 'optimizer': 'adam', 'graph_mode': 'cutoff', 'cutoff': 0.7246677769900663, 'grm_norm': 'cosine', 'self_loops': False, 'use_snp_selection': False}. Best is trial 12 with value: 0.3643779789429402.
[I 2025-12-08 22:41:23,785] Trial 38 finished with value: 0.3444534185268209 and parameters: {'model_type': 'graphsage', 'hidden_dims': '[128, 64]', 'dropout': 0.269879509871032, 'batch_norm': True, 'sage_aggr': 'mean', 'sage_normalize': True, 'sage_project': False, 'lr': 1.6677866726568733e-05, 'weight_decay': 1.3571772799795928e-05, 'epochs': 167, 'loss': 'mae', 'optimizer': 'adam', 'graph_mode': 'cutoff', 'cutoff': 0.8345503915584496, 'grm_norm': 'cosine', 'self_loops': True, 'use_snp_selection': True, 'num_snps': 37391}. Best is trial 12 with value: 0.3643779789429402.
[I 2025-12-08 22:42:25,851] Trial 39 finished with value: 0.34512270919497795 and parameters: {'model_type': 'graphsage', 'hidden_dims': '[256, 128, 64]', 'dropout': 0.3179571246128973, 'batch_norm': False, 'sage_aggr': 'max', 'sage_normalize': False, 'sage_project': False, 'lr': 4.516182265100129e-05, 'weight_decay': 1.2496044648112381e-06, 'epochs': 147, 'loss': 'mae', 'optimizer': 'adam', 'graph_mode': 'cutoff', 'cutoff': 0.4149102875719276, 'grm_norm': 'cosine', 'self_loops': False, 'use_snp_selection': True, 'num_snps': 30792}. Best is trial 12 with value: 0.3643779789429402.
[I 2025-12-08 22:44:23,468] Trial 40 finished with value: 0.33187405637074463 and parameters: {'model_type': 'graphsage', 'hidden_dims': '[512, 256]', 'dropout': 0.24087096961051785, 'batch_norm': True, 'sage_aggr': 'max', 'sage_normalize': False, 'sage_project': False, 'lr': 2.294610199695355e-05, 'weight_decay': 4.123723689948671e-06, 'epochs': 212, 'loss': 'mae', 'optimizer': 'adam', 'graph_mode': 'cutoff', 'cutoff': 0.35312552623066285, 'grm_norm': 'gcn', 'self_loops': True, 'use_snp_selection': False}. Best is trial 12 with value: 0.3643779789429402.
[I 2025-12-08 22:45:23,820] Trial 41 finished with value: 0.3550513917486465 and parameters: {'model_type': 'graphsage', 'hidden_dims': '[256, 128]', 'dropout': 0.236173819940149, 'batch_norm': False, 'sage_aggr': 'max', 'sage_normalize': False, 'sage_project': False, 'lr': 1.891214746010215e-05, 'weight_decay': 2.2309032099175468e-07, 'epochs': 179, 'loss': 'mae', 'optimizer': 'adam', 'graph_mode': 'cutoff', 'cutoff': 0.7467120571263839, 'grm_norm': 'cosine', 'self_loops': True, 'use_snp_selection': True, 'num_snps': 37440}. Best is trial 12 with value: 0.3643779789429402.
[I 2025-12-08 22:47:17,162] Trial 42 finished with value: 0.3593099359931136 and parameters: {'model_type': 'graphsage', 'hidden_dims': '[512, 64]', 'dropout': 0.27982029452243806, 'batch_norm': False, 'sage_aggr': 'max', 'sage_normalize': False, 'sage_project': False, 'lr': 1.5879940372547604e-05, 'weight_decay': 4.896950715885098e-07, 'epochs': 271, 'loss': 'mae', 'optimizer': 'adam', 'graph_mode': 'cutoff', 'cutoff': 0.5092492619961979, 'grm_norm': 'cosine', 'self_loops': True, 'use_snp_selection': True, 'num_snps': 38800}. Best is trial 12 with value: 0.3643779789429402.
[I 2025-12-08 22:49:38,086] Trial 43 finished with value: 0.3572020074920149 and parameters: {'model_type': 'graphsage', 'hidden_dims': '[512, 64]', 'dropout': 0.17411753413684525, 'batch_norm': False, 'sage_aggr': 'max', 'sage_normalize': False, 'sage_project': False, 'lr': 1.4846896305333865e-05, 'weight_decay': 3.109132096312733e-05, 'epochs': 306, 'loss': 'mae', 'optimizer': 'adam', 'graph_mode': 'cutoff', 'cutoff': 0.5365083368308939, 'grm_norm': 'none', 'self_loops': True, 'use_snp_selection': True, 'num_snps': 45555}. Best is trial 12 with value: 0.3643779789429402.
[I 2025-12-08 22:50:35,820] Trial 44 finished with value: 0.3584431312838211 and parameters: {'model_type': 'graphsage', 'hidden_dims': '[512, 64]', 'dropout': 0.2837370624664495, 'batch_norm': False, 'sage_aggr': 'mean', 'sage_normalize': False, 'sage_project': False, 'lr': 5.539724372234742e-05, 'weight_decay': 1.2805491939368374e-06, 'epochs': 91, 'loss': 'mae', 'optimizer': 'adam', 'graph_mode': 'cutoff', 'cutoff': 0.4942578318610233, 'grm_norm': 'cosine', 'self_loops': True, 'use_snp_selection': True, 'num_snps': 31404}. Best is trial 12 with value: 0.3643779789429402.
[I 2025-12-08 22:52:01,817] Trial 45 finished with value: 0.33161181804289547 and parameters: {'model_type': 'graphsage', 'hidden_dims': '[512, 64]', 'dropout': 0.27535895226622487, 'batch_norm': False, 'sage_aggr': 'max', 'sage_normalize': True, 'sage_project': False, 'lr': 3.162181401572742e-05, 'weight_decay': 5.488547668801868e-07, 'epochs': 123, 'loss': 'mae', 'optimizer': 'adam', 'graph_mode': 'cutoff', 'cutoff': 0.603370253031754, 'grm_norm': 'cosine_then_gcn', 'self_loops': True, 'use_snp_selection': True, 'num_snps': 52704}. Best is trial 12 with value: 0.3643779789429402.
[I 2025-12-08 22:53:36,593] Trial 46 finished with value: 0.19748789962422647 and parameters: {'model_type': 'graphsage', 'hidden_dims': '[256, 128, 64]', 'dropout': 0.31604785017989023, 'batch_norm': False, 'sage_aggr': 'max', 'sage_normalize': False, 'sage_project': False, 'lr': 6.803187482208714e-05, 'weight_decay': 3.017381096719463e-07, 'epochs': 71, 'loss': 'mae', 'optimizer': 'adam', 'graph_mode': 'knn', 'knn_k': 10, 'weighted_edges': True, 'symmetrize_mode': 'union', 'self_loops': False, 'use_snp_selection': True, 'num_snps': 38996}. Best is trial 12 with value: 0.3643779789429402.
[I 2025-12-08 22:56:42,579] Trial 47 finished with value: 0.34263341219886617 and parameters: {'model_type': 'graphsage', 'hidden_dims': '[512, 64]', 'dropout': 0.16560237679800402, 'batch_norm': False, 'sage_aggr': 'max', 'sage_normalize': False, 'sage_project': False, 'lr': 1.4355838822994682e-05, 'weight_decay': 1.6134174992453718e-07, 'epochs': 344, 'loss': 'mse', 'optimizer': 'adam', 'graph_mode': 'cutoff', 'cutoff': 0.449897920650789, 'grm_norm': 'none', 'self_loops': True, 'use_snp_selection': True, 'num_snps': 46457}. Best is trial 12 with value: 0.3643779789429402.
[I 2025-12-08 22:58:12,087] Trial 48 finished with value: 0.32502736751285494 and parameters: {'model_type': 'graphsage', 'hidden_dims': '[128, 64]', 'dropout': 0.3537386421519709, 'batch_norm': True, 'sage_aggr': 'max', 'sage_normalize': False, 'sage_project': False, 'lr': 8.543703810422579e-05, 'weight_decay': 0.00013497835827240982, 'epochs': 153, 'loss': 'mae', 'optimizer': 'adam', 'graph_mode': 'cutoff', 'cutoff': 0.39648657661197306, 'grm_norm': 'gcn', 'self_loops': True, 'use_snp_selection': True, 'num_snps': 54663}. Best is trial 12 with value: 0.3643779789429402.
[I 2025-12-08 23:00:07,592] Trial 49 finished with value: 0.3169155968419937 and parameters: {'model_type': 'graphsage', 'hidden_dims': '[512, 256]', 'dropout': 0.25909864991340636, 'batch_norm': False, 'sage_aggr': 'mean', 'sage_normalize': True, 'sage_project': False, 'lr': 0.00013453538360526357, 'weight_decay': 1.0008580217707783e-07, 'epochs': 190, 'loss': 'mae', 'optimizer': 'adam', 'graph_mode': 'knn', 'knn_k': 5, 'weighted_edges': True, 'symmetrize_mode': 'union', 'self_loops': False, 'use_snp_selection': True, 'num_snps': 33984}. Best is trial 12 with value: 0.3643779789429402.
[I 2025-12-08 23:01:11,476] Trial 50 finished with value: 0.33435936129139765 and parameters: {'model_type': 'graphsage', 'hidden_dims': '[256, 128, 64]', 'dropout': 0.11948246321218006, 'batch_norm': False, 'sage_aggr': 'max', 'sage_normalize': False, 'sage_project': False, 'lr': 0.00041121251261271014, 'weight_decay': 3.6513543144127806e-07, 'epochs': 271, 'loss': 'mse', 'optimizer': 'adam', 'graph_mode': 'cutoff', 'cutoff': 0.6207725468410282, 'grm_norm': 'cosine', 'self_loops': True, 'use_snp_selection': True, 'num_snps': 27688}. Best is trial 12 with value: 0.3643779789429402.
[I 2025-12-08 23:02:27,794] Trial 51 finished with value: 0.3578097259776702 and parameters: {'model_type': 'graphsage', 'hidden_dims': '[256, 128]', 'dropout': 0.22726249698004283, 'batch_norm': False, 'sage_aggr': 'max', 'sage_normalize': False, 'sage_project': False, 'lr': 2.282788390877095e-05, 'weight_decay': 1.6449645532893455e-07, 'epochs': 272, 'loss': 'mae', 'optimizer': 'adam', 'graph_mode': 'cutoff', 'cutoff': 0.7287192385798046, 'grm_norm': 'cosine', 'self_loops': True, 'use_snp_selection': True, 'num_snps': 39537}. Best is trial 12 with value: 0.3643779789429402.
[I 2025-12-08 23:03:35,512] Trial 52 finished with value: 0.34715311559475004 and parameters: {'model_type': 'graphsage', 'hidden_dims': '[256, 128]', 'dropout': 0.2509470728448047, 'batch_norm': False, 'sage_aggr': 'max', 'sage_normalize': False, 'sage_project': False, 'lr': 3.885894984114014e-05, 'weight_decay': 6.33549787073812e-07, 'epochs': 245, 'loss': 'mae', 'optimizer': 'adam', 'graph_mode': 'cutoff', 'cutoff': 0.7878636251733766, 'grm_norm': 'cosine', 'self_loops': True, 'use_snp_selection': True, 'num_snps': 35822}. Best is trial 12 with value: 0.3643779789429402.
[I 2025-12-08 23:05:50,445] Trial 53 finished with value: 0.352783581209501 and parameters: {'model_type': 'graphsage', 'hidden_dims': '[256, 128]', 'dropout': 0.21991259531577914, 'batch_norm': False, 'sage_aggr': 'max', 'sage_normalize': False, 'sage_project': False, 'lr': 2.4529879946258567e-05, 'weight_decay': 1.0923175342797747e-06, 'epochs': 302, 'loss': 'mae', 'optimizer': 'adam', 'graph_mode': 'cutoff', 'cutoff': 0.25852768497494066, 'grm_norm': 'cosine', 'self_loops': True, 'use_snp_selection': True, 'num_snps': 31186}. Best is trial 12 with value: 0.3643779789429402.
[I 2025-12-08 23:07:27,860] Trial 54 finished with value: 0.3580566508383803 and parameters: {'model_type': 'graphsage', 'hidden_dims': '[512, 64]', 'dropout': 0.19383583342846628, 'batch_norm': False, 'sage_aggr': 'max', 'sage_normalize': False, 'sage_project': False, 'lr': 1.7711908597553878e-05, 'weight_decay': 2.9333497357597556e-07, 'epochs': 219, 'loss': 'mae', 'optimizer': 'adam', 'graph_mode': 'cutoff', 'cutoff': 0.5751835034025327, 'grm_norm': 'cosine', 'self_loops': True, 'use_snp_selection': True, 'num_snps': 41115}. Best is trial 12 with value: 0.3643779789429402.
[I 2025-12-08 23:08:53,864] Trial 55 finished with value: 0.364032337829546 and parameters: {'model_type': 'graphsage', 'hidden_dims': '[256, 128]', 'dropout': 0.15325084536065614, 'batch_norm': False, 'sage_aggr': 'max', 'sage_normalize': False, 'sage_project': False, 'lr': 2.6254943445764457e-05, 'weight_decay': 6.449724146751783e-05, 'epochs': 173, 'loss': 'mae', 'optimizer': 'adam', 'graph_mode': 'cutoff', 'cutoff': 0.6749030926544315, 'grm_norm': 'cosine', 'self_loops': True, 'use_snp_selection': True, 'num_snps': 59871}. Best is trial 12 with value: 0.3643779789429402.
[I 2025-12-08 23:10:15,888] Trial 56 finished with value: 0.3575049369693818 and parameters: {'model_type': 'graphsage', 'hidden_dims': '[256, 128]', 'dropout': 0.1683857012688203, 'batch_norm': False, 'sage_aggr': 'max', 'sage_normalize': False, 'sage_project': False, 'lr': 4.4712778854073055e-05, 'weight_decay': 6.253653519922905e-05, 'epochs': 168, 'loss': 'mae', 'optimizer': 'adam', 'graph_mode': 'cutoff', 'cutoff': 0.6635511536310355, 'grm_norm': 'cosine', 'self_loops': False, 'use_snp_selection': True, 'num_snps': 58242}. Best is trial 12 with value: 0.3643779789429402.
[I 2025-12-08 23:11:57,758] Trial 57 finished with value: 0.31223775835644474 and parameters: {'model_type': 'graphsage', 'hidden_dims': '[512, 256]', 'dropout': 0.1518869098296307, 'batch_norm': False, 'sage_aggr': 'max', 'sage_normalize': False, 'sage_project': False, 'lr': 1.2609086152426768e-05, 'weight_decay': 2.7443034454918256e-05, 'epochs': 114, 'loss': 'mae', 'optimizer': 'adam', 'graph_mode': 'knn', 'knn_k': 7, 'weighted_edges': True, 'symmetrize_mode': 'union', 'self_loops': True, 'use_snp_selection': False}. Best is trial 12 with value: 0.3643779789429402.
[I 2025-12-08 23:12:27,593] Trial 58 finished with value: 0.323781089011537 and parameters: {'model_type': 'graphsage', 'hidden_dims': '[256, 128]', 'dropout': 0.12052561005270145, 'batch_norm': False, 'sage_aggr': 'max', 'sage_normalize': False, 'sage_project': False, 'lr': 2.778844535426722e-05, 'weight_decay': 9.059464805349907e-05, 'epochs': 177, 'loss': 'mse', 'optimizer': 'adam', 'graph_mode': 'cutoff', 'cutoff': 0.5341663535861453, 'grm_norm': 'cosine_then_gcn', 'self_loops': True, 'use_snp_selection': True, 'num_snps': 3544}. Best is trial 12 with value: 0.3643779789429402.
[I 2025-12-08 23:13:32,258] Trial 59 finished with value: 0.3055061066760672 and parameters: {'model_type': 'graphsage', 'hidden_dims': '[512, 128]', 'dropout': 0.18191192966459105, 'batch_norm': False, 'sage_aggr': 'mean', 'sage_normalize': False, 'sage_project': False, 'lr': 0.0001839802871936462, 'weight_decay': 5.1451282423390575e-05, 'epochs': 48, 'loss': 'mae', 'optimizer': 'adam', 'graph_mode': 'cutoff', 'cutoff': 0.6962273524489705, 'grm_norm': 'cosine', 'self_loops': False, 'use_snp_selection': True, 'num_snps': 59680}. Best is trial 12 with value: 0.3643779789429402.
[I 2025-12-08 23:15:24,399] Trial 60 finished with value: 0.3389122755395196 and parameters: {'model_type': 'graphsage', 'hidden_dims': '[256, 128, 64]', 'dropout': 0.2153478587869064, 'batch_norm': False, 'sage_aggr': 'max', 'sage_normalize': False, 'sage_project': False, 'lr': 3.7143220203881706e-05, 'weight_decay': 2.6036854587824278e-06, 'epochs': 196, 'loss': 'mae', 'optimizer': 'adam', 'graph_mode': 'cutoff', 'cutoff': 0.4843087339330392, 'grm_norm': 'cosine', 'self_loops': True, 'use_snp_selection': True, 'num_snps': 56516}. Best is trial 12 with value: 0.3643779789429402.
[I 2025-12-08 23:16:29,566] Trial 61 finished with value: 0.36111891611687147 and parameters: {'model_type': 'graphsage', 'hidden_dims': '[256, 128]', 'dropout': 0.24396115637914587, 'batch_norm': False, 'sage_aggr': 'max', 'sage_normalize': False, 'sage_project': False, 'lr': 1.8922175827838664e-05, 'weight_decay': 2.0177874380156607e-05, 'epochs': 134, 'loss': 'mae', 'optimizer': 'adam', 'graph_mode': 'cutoff', 'cutoff': 0.7262717325358303, 'grm_norm': 'cosine', 'self_loops': True, 'use_snp_selection': True, 'num_snps': 48693}. Best is trial 12 with value: 0.3643779789429402.
[I 2025-12-08 23:17:34,709] Trial 62 finished with value: 0.36655345853798077 and parameters: {'model_type': 'graphsage', 'hidden_dims': '[256, 128]', 'dropout': 0.2959027952988421, 'batch_norm': False, 'sage_aggr': 'max', 'sage_normalize': False, 'sage_project': False, 'lr': 1.3010174074247908e-05, 'weight_decay': 1.0124496501465175e-05, 'epochs': 131, 'loss': 'mae', 'optimizer': 'adam', 'graph_mode': 'cutoff', 'cutoff': 0.7648196189686719, 'grm_norm': 'cosine', 'self_loops': True, 'use_snp_selection': True, 'num_snps': 48862}. Best is trial 62 with value: 0.36655345853798077.
[I 2025-12-08 23:18:37,655] Trial 63 finished with value: 0.366613032590942 and parameters: {'model_type': 'graphsage', 'hidden_dims': '[256, 128]', 'dropout': 0.2905665705837339, 'batch_norm': False, 'sage_aggr': 'max', 'sage_normalize': False, 'sage_project': False, 'lr': 1.4828458573224093e-05, 'weight_decay': 1.0302371362829249e-05, 'epochs': 126, 'loss': 'mae', 'optimizer': 'adam', 'graph_mode': 'cutoff', 'cutoff': 0.8059586503734018, 'grm_norm': 'cosine', 'self_loops': True, 'use_snp_selection': True, 'num_snps': 48108}. Best is trial 63 with value: 0.366613032590942.
[I 2025-12-08 23:19:41,854] Trial 64 finished with value: 0.36589358878111855 and parameters: {'model_type': 'graphsage', 'hidden_dims': '[256, 128]', 'dropout': 0.29220859787586945, 'batch_norm': False, 'sage_aggr': 'max', 'sage_normalize': False, 'sage_project': False, 'lr': 1.2168340133913449e-05, 'weight_decay': 1.1201323548403925e-05, 'epochs': 126, 'loss': 'mae', 'optimizer': 'adam', 'graph_mode': 'cutoff', 'cutoff': 0.8453046487168593, 'grm_norm': 'cosine', 'self_loops': True, 'use_snp_selection': True, 'num_snps': 49315}. Best is trial 63 with value: 0.366613032590942.
[I 2025-12-08 23:20:40,375] Trial 65 finished with value: 0.36187901365395575 and parameters: {'model_type': 'graphsage', 'hidden_dims': '[256, 128]', 'dropout': 0.3544677344638289, 'batch_norm': False, 'sage_aggr': 'max', 'sage_normalize': False, 'sage_project': False, 'lr': 1.204766171489263e-05, 'weight_decay': 9.454347047691096e-06, 'epochs': 102, 'loss': 'mae', 'optimizer': 'adam', 'graph_mode': 'cutoff', 'cutoff': 0.8326331263806349, 'grm_norm': 'cosine', 'self_loops': True, 'use_snp_selection': True, 'num_snps': 47968}. Best is trial 63 with value: 0.366613032590942.
[I 2025-12-08 23:21:40,285] Trial 66 finished with value: 0.36845025828456357 and parameters: {'model_type': 'graphsage', 'hidden_dims': '[256, 128]', 'dropout': 0.34392602022870017, 'batch_norm': False, 'sage_aggr': 'max', 'sage_normalize': False, 'sage_project': False, 'lr': 1.2654598348039857e-05, 'weight_decay': 9.051707121121396e-06, 'epochs': 105, 'loss': 'mae', 'optimizer': 'adam', 'graph_mode': 'cutoff', 'cutoff': 0.855702593468697, 'grm_norm': 'cosine', 'self_loops': True, 'use_snp_selection': True, 'num_snps': 48412}. Best is trial 66 with value: 0.36845025828456357.
[I 2025-12-08 23:23:56,684] Trial 67 finished with value: 0.33346204912906596 and parameters: {'model_type': 'graphsage', 'hidden_dims': '[256, 128]', 'dropout': 0.3523753113594925, 'batch_norm': False, 'sage_aggr': 'max', 'sage_normalize': True, 'sage_project': False, 'lr': 1.384430186882703e-05, 'weight_decay': 9.286888896711216e-06, 'epochs': 105, 'loss': 'mae', 'optimizer': 'adam', 'graph_mode': 'knn', 'knn_k': 8, 'weighted_edges': True, 'symmetrize_mode': 'union', 'self_loops': True, 'use_snp_selection': True, 'num_snps': 47847}. Best is trial 66 with value: 0.36845025828456357.
[I 2025-12-08 23:24:24,622] Trial 68 finished with value: 0.3652838029625931 and parameters: {'model_type': 'graphsage', 'hidden_dims': '[256, 128]', 'dropout': 0.3712247806003622, 'batch_norm': False, 'sage_aggr': 'max', 'sage_normalize': False, 'sage_project': False, 'lr': 1.2310113996077212e-05, 'weight_decay': 1.0877926671962556e-05, 'epochs': 85, 'loss': 'mse', 'optimizer': 'adam', 'graph_mode': 'cutoff', 'cutoff': 0.8588695079591764, 'grm_norm': 'gcn', 'self_loops': False, 'use_snp_selection': False}. Best is trial 66 with value: 0.36845025828456357.
[I 2025-12-08 23:24:52,155] Trial 69 finished with value: 0.32619128731332153 and parameters: {'model_type': 'graphsage', 'hidden_dims': '[256, 128]', 'dropout': 0.37312759815896457, 'batch_norm': True, 'sage_aggr': 'max', 'sage_normalize': False, 'sage_project': False, 'lr': 1.1550858649950075e-05, 'weight_decay': 4.1752088257273036e-06, 'epochs': 83, 'loss': 'mse', 'optimizer': 'adam', 'graph_mode': 'cutoff', 'cutoff': 0.8982154358987493, 'grm_norm': 'gcn', 'self_loops': False, 'use_snp_selection': False}. Best is trial 66 with value: 0.36845025828456357.
[I 2025-12-08 23:25:27,934] Trial 70 finished with value: 0.366769737343344 and parameters: {'model_type': 'graphsage', 'hidden_dims': '[256, 128]', 'dropout': 0.4218250538128498, 'batch_norm': False, 'sage_aggr': 'max', 'sage_normalize': False, 'sage_project': False, 'lr': 1.5554438436020637e-05, 'weight_decay': 1.298299628475727e-05, 'epochs': 122, 'loss': 'mse', 'optimizer': 'adam', 'graph_mode': 'cutoff', 'cutoff': 0.8548739384301964, 'grm_norm': 'gcn', 'self_loops': False, 'use_snp_selection': False}. Best is trial 66 with value: 0.36845025828456357.
[I 2025-12-08 23:26:04,231] Trial 71 finished with value: 0.08383528603606379 and parameters: {'model_type': 'graphsage', 'hidden_dims': '[256, 128]', 'dropout': 0.4403065408478885, 'batch_norm': False, 'sage_aggr': 'max', 'sage_normalize': False, 'sage_project': False, 'lr': 0.0006330587882234725, 'weight_decay': 1.2594322289558593e-05, 'epochs': 125, 'loss': 'mse', 'optimizer': 'adam', 'graph_mode': 'cutoff', 'cutoff': 0.8706494157331467, 'grm_norm': 'gcn', 'self_loops': False, 'use_snp_selection': False}. Best is trial 66 with value: 0.36845025828456357.
[I 2025-12-08 23:26:34,040] Trial 72 finished with value: 0.3732252999044715 and parameters: {'model_type': 'graphsage', 'hidden_dims': '[256, 128]', 'dropout': 0.4114195346738271, 'batch_norm': False, 'sage_aggr': 'max', 'sage_normalize': False, 'sage_project': False, 'lr': 1.570010836688799e-05, 'weight_decay': 2.260071977289398e-05, 'epochs': 94, 'loss': 'mse', 'optimizer': 'adam', 'graph_mode': 'cutoff', 'cutoff': 0.7992804121535223, 'grm_norm': 'gcn', 'self_loops': False, 'use_snp_selection': False}. Best is trial 72 with value: 0.3732252999044715.
