[I 2025-12-09 14:56:38,220] Trial 32 finished with value: 0.2663664295782041 and parameters: {'model_type': 'graphsage', 'hidden_dims': '[512, 256]', 'dropout': 0.43367394395794645, 'batch_norm': False, 'sage_aggr': 'max', 'sage_normalize': False, 'sage_project': False, 'lr': 6.007709357886671e-05, 'weight_decay': 0.0005013523210923672, 'epochs': 225, 'loss': 'mse', 'optimizer': 'adam', 'graph_mode': 'knn', 'knn_k': 2, 'weighted_edges': False, 'symmetrize_mode': 'union', 'self_loops': False, 'use_snp_selection': True, 'num_snps': 43242}. Best is trial 13 with value: 0.2891851507315001.
[I 2025-12-09 15:00:44,770] Trial 33 finished with value: 0.28803982311547616 and parameters: {'model_type': 'graphsage', 'hidden_dims': '[512, 256]', 'dropout': 0.36045080630873705, 'batch_norm': False, 'sage_aggr': 'max', 'sage_normalize': False, 'sage_project': False, 'lr': 3.5894508948275775e-05, 'weight_decay': 0.00024208969605501294, 'epochs': 269, 'loss': 'mse', 'optimizer': 'adam', 'graph_mode': 'knn', 'knn_k': 6, 'weighted_edges': False, 'symmetrize_mode': 'union', 'self_loops': False, 'use_snp_selection': True, 'num_snps': 33739}. Best is trial 13 with value: 0.2891851507315001.
[I 2025-12-09 15:05:21,549] Trial 34 finished with value: 0.2875309215006728 and parameters: {'model_type': 'graphsage', 'hidden_dims': '[512, 256]', 'dropout': 0.3660796395578011, 'batch_norm': False, 'sage_aggr': 'max', 'sage_normalize': False, 'sage_project': False, 'lr': 2.2063494000241567e-05, 'weight_decay': 4.7837012710490595e-05, 'epochs': 314, 'loss': 'mse', 'optimizer': 'adam', 'graph_mode': 'knn', 'knn_k': 7, 'weighted_edges': False, 'symmetrize_mode': 'union', 'self_loops': False, 'use_snp_selection': True, 'num_snps': 29527}. Best is trial 13 with value: 0.2891851507315001.
[I 2025-12-09 15:09:07,724] Trial 35 finished with value: 0.28609678752161577 and parameters: {'model_type': 'graphsage', 'hidden_dims': '[512, 256]', 'dropout': 0.38120738487262024, 'batch_norm': False, 'sage_aggr': 'max', 'sage_normalize': False, 'sage_project': False, 'lr': 1.986890564742241e-05, 'weight_decay': 4.795874976778663e-05, 'epochs': 321, 'loss': 'mse', 'optimizer': 'adam', 'graph_mode': 'knn', 'knn_k': 7, 'weighted_edges': False, 'symmetrize_mode': 'union', 'self_loops': False, 'use_snp_selection': True, 'num_snps': 27912}. Best is trial 13 with value: 0.2891851507315001.
[I 2025-12-09 15:13:27,299] Trial 36 finished with value: 0.24556162378270976 and parameters: {'model_type': 'graphsage', 'hidden_dims': '[512, 256]', 'dropout': 0.3645119367795324, 'batch_norm': True, 'sage_aggr': 'max', 'sage_normalize': False, 'sage_project': False, 'lr': 1.578729398061581e-05, 'weight_decay': 4.481190319572767e-05, 'epochs': 320, 'loss': 'mse', 'optimizer': 'adam', 'graph_mode': 'knn', 'knn_k': 8, 'weighted_edges': False, 'symmetrize_mode': 'union', 'self_loops': False, 'use_snp_selection': True, 'num_snps': 30160}. Best is trial 13 with value: 0.2891851507315001.
[I 2025-12-09 15:16:24,654] Trial 37 finished with value: 0.2769217625012381 and parameters: {'model_type': 'graphsage', 'hidden_dims': '[512, 256]', 'dropout': 0.33479647300418125, 'batch_norm': False, 'sage_aggr': 'max', 'sage_normalize': False, 'sage_project': False, 'lr': 2.2221429780576206e-05, 'weight_decay': 5.226016137238107e-06, 'epochs': 309, 'loss': 'mse', 'optimizer': 'adam', 'graph_mode': 'cutoff', 'cutoff': 0.6871449772177245, 'grm_norm': 'cosine_then_gcn', 'self_loops': False, 'use_snp_selection': False}. Best is trial 13 with value: 0.2891851507315001.
[I 2025-12-09 15:20:01,731] Trial 38 finished with value: 0.2734953242108625 and parameters: {'model_type': 'graphsage', 'hidden_dims': '[256, 128, 64]', 'dropout': 0.38625519913175116, 'batch_norm': True, 'sage_aggr': 'mean', 'sage_normalize': True, 'sage_project': False, 'lr': 1.6415616982824827e-05, 'weight_decay': 5.446861006551577e-05, 'epochs': 347, 'loss': 'mae', 'optimizer': 'adam', 'graph_mode': 'knn', 'knn_k': 10, 'weighted_edges': False, 'symmetrize_mode': 'union', 'self_loops': False, 'use_snp_selection': True, 'num_snps': 23381}. Best is trial 13 with value: 0.2891851507315001.
[I 2025-12-09 15:21:29,859] Trial 39 finished with value: 0.2924179495694649 and parameters: {'model_type': 'graphsage', 'hidden_dims': '[512, 256]', 'dropout': 0.3187500431919233, 'batch_norm': False, 'sage_aggr': 'max', 'sage_normalize': False, 'sage_project': False, 'lr': 1.235520495984842e-05, 'weight_decay': 2.270946593602583e-05, 'epochs': 304, 'loss': 'mse', 'optimizer': 'adam', 'graph_mode': 'cutoff', 'cutoff': 0.40760184816921796, 'grm_norm': 'none', 'self_loops': False, 'use_snp_selection': True, 'num_snps': 15881}. Best is trial 39 with value: 0.2924179495694649.
[I 2025-12-09 15:25:15,872] Trial 40 finished with value: 0.25443839818816155 and parameters: {'model_type': 'graphsage', 'hidden_dims': '[512, 64]', 'dropout': 0.2904983094695291, 'batch_norm': True, 'sage_aggr': 'max', 'sage_normalize': False, 'sage_project': False, 'lr': 1.0094435138381975e-05, 'weight_decay': 8.458129705051877e-06, 'epochs': 295, 'loss': 'mae', 'optimizer': 'adam', 'graph_mode': 'cutoff', 'cutoff': 0.38855613484836726, 'grm_norm': 'none', 'self_loops': False, 'use_snp_selection': False}. Best is trial 39 with value: 0.2924179495694649.
[I 2025-12-09 15:26:37,574] Trial 41 finished with value: 0.29151064703812557 and parameters: {'model_type': 'graphsage', 'hidden_dims': '[512, 256]', 'dropout': 0.3338607309139986, 'batch_norm': False, 'sage_aggr': 'max', 'sage_normalize': False, 'sage_project': False, 'lr': 2.7442745423696635e-05, 'weight_decay': 2.1566168475782563e-05, 'epochs': 307, 'loss': 'mse', 'optimizer': 'adam', 'graph_mode': 'cutoff', 'cutoff': 0.462296508226642, 'grm_norm': 'none', 'self_loops': False, 'use_snp_selection': True, 'num_snps': 15019}. Best is trial 39 with value: 0.2924179495694649.
[I 2025-12-09 15:27:39,164] Trial 42 finished with value: 0.29695598343060625 and parameters: {'model_type': 'graphsage', 'hidden_dims': '[512, 256]', 'dropout': 0.327534044319372, 'batch_norm': False, 'sage_aggr': 'max', 'sage_normalize': False, 'sage_project': False, 'lr': 1.4050989488749982e-05, 'weight_decay': 2.1066973075198463e-05, 'epochs': 275, 'loss': 'mse', 'optimizer': 'adam', 'graph_mode': 'cutoff', 'cutoff': 0.4630417050832056, 'grm_norm': 'none', 'self_loops': False, 'use_snp_selection': True, 'num_snps': 11051}. Best is trial 42 with value: 0.29695598343060625.
[I 2025-12-09 15:28:38,924] Trial 43 finished with value: 0.28549241561659977 and parameters: {'model_type': 'graphsage', 'hidden_dims': '[512, 256]', 'dropout': 0.3241696993307933, 'batch_norm': False, 'sage_aggr': 'max', 'sage_normalize': False, 'sage_project': False, 'lr': 2.967135093520436e-05, 'weight_decay': 2.012796647270424e-05, 'epochs': 280, 'loss': 'mse', 'optimizer': 'adam', 'graph_mode': 'cutoff', 'cutoff': 0.4710546621159995, 'grm_norm': 'none', 'self_loops': False, 'use_snp_selection': True, 'num_snps': 10503}. Best is trial 42 with value: 0.29695598343060625.
[I 2025-12-09 15:29:39,918] Trial 44 finished with value: 0.28606886148910193 and parameters: {'model_type': 'graphsage', 'hidden_dims': '[512, 256]', 'dropout': 0.2763790556584754, 'batch_norm': False, 'sage_aggr': 'mean', 'sage_normalize': False, 'sage_project': False, 'lr': 1.2397735614947453e-05, 'weight_decay': 5.102580082851116e-06, 'epochs': 272, 'loss': 'mse', 'optimizer': 'adam', 'graph_mode': 'cutoff', 'cutoff': 0.4334691179315578, 'grm_norm': 'none', 'self_loops': False, 'use_snp_selection': True, 'num_snps': 12029}. Best is trial 42 with value: 0.29695598343060625.
[I 2025-12-09 15:30:13,033] Trial 45 finished with value: 0.26056129978353815 and parameters: {'model_type': 'graphsage', 'hidden_dims': '[512, 256]', 'dropout': 0.31885531112852666, 'batch_norm': False, 'sage_aggr': 'max', 'sage_normalize': True, 'sage_project': False, 'lr': 1.4856299056715813e-05, 'weight_decay': 1.3906880051591781e-06, 'epochs': 298, 'loss': 'mse', 'optimizer': 'adam', 'graph_mode': 'cutoff', 'cutoff': 0.32808574911355487, 'grm_norm': 'none', 'self_loops': False, 'use_snp_selection': True, 'num_snps': 2073}. Best is trial 42 with value: 0.29695598343060625.
[I 2025-12-09 15:30:54,375] Trial 46 finished with value: 0.2824401589039283 and parameters: {'model_type': 'graphsage', 'hidden_dims': '[128, 64]', 'dropout': 0.34730502743425484, 'batch_norm': False, 'sage_aggr': 'max', 'sage_normalize': False, 'sage_project': False, 'lr': 7.827564233097196e-05, 'weight_decay': 3.6299988509268543e-07, 'epochs': 247, 'loss': 'mse', 'optimizer': 'adam', 'graph_mode': 'cutoff', 'cutoff': 0.5642823898198758, 'grm_norm': 'none', 'self_loops': False, 'use_snp_selection': True, 'num_snps': 16981}. Best is trial 42 with value: 0.29695598343060625.
[I 2025-12-09 15:31:46,902] Trial 47 finished with value: 0.28292048715479756 and parameters: {'model_type': 'graphsage', 'hidden_dims': '[512, 256]', 'dropout': 0.2646167030815797, 'batch_norm': False, 'sage_aggr': 'max', 'sage_normalize': False, 'sage_project': False, 'lr': 3.0125812652088858e-05, 'weight_decay': 1.3684329794436036e-05, 'epochs': 342, 'loss': 'mae', 'optimizer': 'adam', 'graph_mode': 'cutoff', 'cutoff': 0.4801361284859719, 'grm_norm': 'none', 'self_loops': False, 'use_snp_selection': True, 'num_snps': 6994}. Best is trial 42 with value: 0.29695598343060625.
[I 2025-12-09 15:33:43,732] Trial 48 finished with value: 0.27632988391852303 and parameters: {'model_type': 'graphsage', 'hidden_dims': '[256, 128]', 'dropout': 0.24117294159363462, 'batch_norm': True, 'sage_aggr': 'max', 'sage_normalize': False, 'sage_project': False, 'lr': 0.0003823767485114981, 'weight_decay': 2.3970844705367606e-05, 'epochs': 306, 'loss': 'mse', 'optimizer': 'adam', 'graph_mode': 'cutoff', 'cutoff': 0.34235031636547675, 'grm_norm': 'none', 'self_loops': False, 'use_snp_selection': True, 'num_snps': 24234}. Best is trial 42 with value: 0.29695598343060625.
[I 2025-12-09 15:34:34,752] Trial 49 finished with value: 0.2546189699474455 and parameters: {'model_type': 'graphsage', 'hidden_dims': '[256, 128, 64]', 'dropout': 0.1779899350131808, 'batch_norm': False, 'sage_aggr': 'mean', 'sage_normalize': True, 'sage_project': False, 'lr': 1.2773634742555342e-05, 'weight_decay': 1.120995569604414e-05, 'epochs': 334, 'loss': 'mse', 'optimizer': 'adam', 'graph_mode': 'cutoff', 'cutoff': 0.4460057543822346, 'grm_norm': 'none', 'self_loops': False, 'use_snp_selection': True, 'num_snps': 10710}. Best is trial 42 with value: 0.29695598343060625.
[I 2025-12-09 15:35:50,100] Trial 50 finished with value: 0.1496590226879682 and parameters: {'model_type': 'graphsage', 'hidden_dims': '[512, 256]', 'dropout': 0.41904647852852484, 'batch_norm': False, 'sage_aggr': 'max', 'sage_normalize': False, 'sage_project': False, 'lr': 0.0032527108716821226, 'weight_decay': 9.731632997212637e-05, 'epochs': 275, 'loss': 'mae', 'optimizer': 'adam', 'graph_mode': 'cutoff', 'cutoff': 0.542173380700498, 'grm_norm': 'cosine', 'self_loops': False, 'use_snp_selection': True, 'num_snps': 18614}. Best is trial 42 with value: 0.29695598343060625.
[I 2025-12-09 15:40:02,637] Trial 51 finished with value: 0.2843453094126965 and parameters: {'model_type': 'graphsage', 'hidden_dims': '[512, 256]', 'dropout': 0.3539033326076194, 'batch_norm': False, 'sage_aggr': 'max', 'sage_normalize': False, 'sage_project': False, 'lr': 2.2238183237969868e-05, 'weight_decay': 3.638656988469018e-05, 'epochs': 300, 'loss': 'mse', 'optimizer': 'adam', 'graph_mode': 'cutoff', 'cutoff': 0.29633479194279466, 'grm_norm': 'none', 'self_loops': False, 'use_snp_selection': True, 'num_snps': 33100}. Best is trial 42 with value: 0.29695598343060625.
[I 2025-12-09 15:41:21,539] Trial 52 finished with value: 0.28836345317046197 and parameters: {'model_type': 'graphsage', 'hidden_dims': '[512, 256]', 'dropout': 0.30589087884686383, 'batch_norm': False, 'sage_aggr': 'max', 'sage_normalize': False, 'sage_project': False, 'lr': 1.7974276110773796e-05, 'weight_decay': 3.0132993649199643e-05, 'epochs': 317, 'loss': 'mse', 'optimizer': 'adam', 'graph_mode': 'cutoff', 'cutoff': 0.4000142965360274, 'grm_norm': 'gcn', 'self_loops': False, 'use_snp_selection': True, 'num_snps': 13491}. Best is trial 42 with value: 0.29695598343060625.
[I 2025-12-09 15:42:34,071] Trial 53 finished with value: 0.29585663553122643 and parameters: {'model_type': 'graphsage', 'hidden_dims': '[512, 256]', 'dropout': 0.32160174560075777, 'batch_norm': False, 'sage_aggr': 'max', 'sage_normalize': False, 'sage_project': False, 'lr': 1.659434015197683e-05, 'weight_decay': 5.6513492736893306e-06, 'epochs': 286, 'loss': 'mse', 'optimizer': 'adam', 'graph_mode': 'cutoff', 'cutoff': 0.39032971288312107, 'grm_norm': 'gcn', 'self_loops': False, 'use_snp_selection': True, 'num_snps': 13102}. Best is trial 42 with value: 0.29695598343060625.
[I 2025-12-09 15:43:50,658] Trial 54 finished with value: 0.29170070111008783 and parameters: {'model_type': 'graphsage', 'hidden_dims': '[512, 64]', 'dropout': 0.30978355197917307, 'batch_norm': False, 'sage_aggr': 'max', 'sage_normalize': False, 'sage_project': False, 'lr': 1.2056573926724958e-05, 'weight_decay': 3.351484834717706e-06, 'epochs': 286, 'loss': 'mse', 'optimizer': 'adam', 'graph_mode': 'cutoff', 'cutoff': 0.40042412488484136, 'grm_norm': 'gcn', 'self_loops': False, 'use_snp_selection': True, 'num_snps': 13917}. Best is trial 42 with value: 0.29695598343060625.
[I 2025-12-09 15:44:35,571] Trial 55 finished with value: 0.26918683423816414 and parameters: {'model_type': 'graphsage', 'hidden_dims': '[512, 64]', 'dropout': 0.2767935676284824, 'batch_norm': False, 'sage_aggr': 'max', 'sage_normalize': False, 'sage_project': False, 'lr': 0.0005903291448427, 'weight_decay': 2.9381713401764385e-06, 'epochs': 285, 'loss': 'mse', 'optimizer': 'adam', 'graph_mode': 'cutoff', 'cutoff': 0.4408084245487367, 'grm_norm': 'gcn', 'self_loops': False, 'use_snp_selection': True, 'num_snps': 6310}. Best is trial 42 with value: 0.29695598343060625.
[I 2025-12-09 15:45:24,736] Trial 56 finished with value: 0.29448080732547127 and parameters: {'model_type': 'graphsage', 'hidden_dims': '[512, 64]', 'dropout': 0.3365705745985361, 'batch_norm': False, 'sage_aggr': 'max', 'sage_normalize': False, 'sage_project': False, 'lr': 1.2158806651033453e-05, 'weight_decay': 5.812021114495658e-06, 'epochs': 258, 'loss': 'mse', 'optimizer': 'adam', 'graph_mode': 'cutoff', 'cutoff': 0.4044005137061501, 'grm_norm': 'gcn', 'self_loops': False, 'use_snp_selection': True, 'num_snps': 7932}. Best is trial 42 with value: 0.29695598343060625.
[I 2025-12-09 15:48:24,870] Trial 57 finished with value: 0.2923541208835917 and parameters: {'model_type': 'graphsage', 'hidden_dims': '[512, 64]', 'dropout': 0.33655094477944597, 'batch_norm': False, 'sage_aggr': 'max', 'sage_normalize': False, 'sage_project': False, 'lr': 1.0035153720735668e-05, 'weight_decay': 5.500539432339176e-06, 'epochs': 237, 'loss': 'mse', 'optimizer': 'adam', 'graph_mode': 'cutoff', 'cutoff': 0.3885646489409549, 'grm_norm': 'gcn', 'self_loops': False, 'use_snp_selection': False}. Best is trial 42 with value: 0.29695598343060625.
[I 2025-12-09 15:51:26,334] Trial 58 finished with value: 0.2960767347364783 and parameters: {'model_type': 'graphsage', 'hidden_dims': '[512, 64]', 'dropout': 0.3142702155099704, 'batch_norm': False, 'sage_aggr': 'max', 'sage_normalize': False, 'sage_project': False, 'lr': 1.0102415243467841e-05, 'weight_decay': 5.418103606770007e-06, 'epochs': 236, 'loss': 'mse', 'optimizer': 'adam', 'graph_mode': 'cutoff', 'cutoff': 0.37461353673542797, 'grm_norm': 'gcn', 'self_loops': False, 'use_snp_selection': False}. Best is trial 42 with value: 0.29695598343060625.
[I 2025-12-09 15:55:41,445] Trial 59 finished with value: 0.2825988633137331 and parameters: {'model_type': 'graphsage', 'hidden_dims': '[512, 64]', 'dropout': 0.29127205580272614, 'batch_norm': False, 'sage_aggr': 'max', 'sage_normalize': False, 'sage_project': False, 'lr': 1.019057268857886e-05, 'weight_decay': 6.2591798075460985e-06, 'epochs': 250, 'loss': 'mse', 'optimizer': 'adam', 'graph_mode': 'cutoff', 'cutoff': 0.2852722308421428, 'grm_norm': 'gcn', 'self_loops': False, 'use_snp_selection': False}. Best is trial 42 with value: 0.29695598343060625.
[I 2025-12-09 15:58:35,312] Trial 60 finished with value: 0.0 and parameters: {'model_type': 'graphsage', 'hidden_dims': '[512, 64]', 'dropout': 0.32667486756413117, 'batch_norm': False, 'sage_aggr': 'mean', 'sage_normalize': False, 'sage_project': False, 'lr': 0.009992428137735026, 'weight_decay': 1.4964462552800568e-06, 'epochs': 239, 'loss': 'mse', 'optimizer': 'adam', 'graph_mode': 'cutoff', 'cutoff': 0.3652525663511866, 'grm_norm': 'gcn', 'self_loops': False, 'use_snp_selection': False}. Best is trial 42 with value: 0.29695598343060625.
[I 2025-12-09 16:01:48,649] Trial 61 finished with value: 0.29353199978550987 and parameters: {'model_type': 'graphsage', 'hidden_dims': '[512, 64]', 'dropout': 0.31327382498967127, 'batch_norm': False, 'sage_aggr': 'max', 'sage_normalize': False, 'sage_project': False, 'lr': 1.2182460182226858e-05, 'weight_decay': 3.4192547211132195e-06, 'epochs': 256, 'loss': 'mse', 'optimizer': 'adam', 'graph_mode': 'cutoff', 'cutoff': 0.38857123639214536, 'grm_norm': 'gcn', 'self_loops': False, 'use_snp_selection': False}. Best is trial 42 with value: 0.29695598343060625.
[I 2025-12-09 16:04:44,196] Trial 62 finished with value: 0.28766840110862446 and parameters: {'model_type': 'graphsage', 'hidden_dims': '[512, 64]', 'dropout': 0.3488308045837739, 'batch_norm': False, 'sage_aggr': 'max', 'sage_normalize': False, 'sage_project': False, 'lr': 1.5423604494451563e-05, 'weight_decay': 4.025846326275731e-06, 'epochs': 236, 'loss': 'mse', 'optimizer': 'adam', 'graph_mode': 'cutoff', 'cutoff': 0.4151940334521995, 'grm_norm': 'gcn', 'self_loops': False, 'use_snp_selection': False}. Best is trial 42 with value: 0.29695598343060625.
[I 2025-12-09 16:07:45,698] Trial 63 finished with value: 0.2763849860796041 and parameters: {'model_type': 'graphsage', 'hidden_dims': '[512, 64]', 'dropout': 0.2616620715422571, 'batch_norm': False, 'sage_aggr': 'max', 'sage_normalize': False, 'sage_project': False, 'lr': 1.3042403818017902e-05, 'weight_decay': 1.9398691661602337e-06, 'epochs': 192, 'loss': 'mse', 'optimizer': 'adam', 'graph_mode': 'cutoff', 'cutoff': 0.30943453572107726, 'grm_norm': 'gcn', 'self_loops': False, 'use_snp_selection': False}. Best is trial 42 with value: 0.29695598343060625.
[I 2025-12-09 16:11:06,319] Trial 64 finished with value: 0.29034091677722446 and parameters: {'model_type': 'graphsage', 'hidden_dims': '[512, 64]', 'dropout': 0.2885426774021205, 'batch_norm': False, 'sage_aggr': 'max', 'sage_normalize': False, 'sage_project': False, 'lr': 1.850823554748056e-05, 'weight_decay': 8.762917627781452e-06, 'epochs': 261, 'loss': 'mse', 'optimizer': 'adam', 'graph_mode': 'cutoff', 'cutoff': 0.366872341548296, 'grm_norm': 'gcn', 'self_loops': False, 'use_snp_selection': False}. Best is trial 42 with value: 0.29695598343060625.
[I 2025-12-09 16:14:25,773] Trial 65 finished with value: 0.2909541149718789 and parameters: {'model_type': 'graphsage', 'hidden_dims': '[512, 64]', 'dropout': 0.3418584361310859, 'batch_norm': False, 'sage_aggr': 'max', 'sage_normalize': False, 'sage_project': False, 'lr': 1.0052059157992903e-05, 'weight_decay': 8.96282251861371e-07, 'epochs': 255, 'loss': 'mse', 'optimizer': 'adam', 'graph_mode': 'cutoff', 'cutoff': 0.3573063003225583, 'grm_norm': 'gcn', 'self_loops': True, 'use_snp_selection': False}. Best is trial 42 with value: 0.29695598343060625.
[I 2025-12-09 16:17:24,986] Trial 66 finished with value: 0.295032614002701 and parameters: {'model_type': 'graphsage', 'hidden_dims': '[512, 64]', 'dropout': 0.31415763369703525, 'batch_norm': False, 'sage_aggr': 'max', 'sage_normalize': False, 'sage_project': False, 'lr': 1.4911369435146474e-05, 'weight_decay': 1.515909615900869e-05, 'epochs': 243, 'loss': 'mse', 'optimizer': 'adam', 'graph_mode': 'cutoff', 'cutoff': 0.4297446467104993, 'grm_norm': 'gcn', 'self_loops': False, 'use_snp_selection': False}. Best is trial 42 with value: 0.29695598343060625.
[I 2025-12-09 16:19:56,420] Trial 67 finished with value: 0.2682159759759832 and parameters: {'model_type': 'graphsage', 'hidden_dims': '[512, 64]', 'dropout': 0.30868095925687244, 'batch_norm': False, 'sage_aggr': 'max', 'sage_normalize': False, 'sage_project': False, 'lr': 1.3873470730190481e-05, 'weight_decay': 1.3920036102987527e-05, 'epochs': 219, 'loss': 'mae', 'optimizer': 'adam', 'graph_mode': 'cutoff', 'cutoff': 0.4999141618400482, 'grm_norm': 'gcn', 'self_loops': False, 'use_snp_selection': False}. Best is trial 42 with value: 0.29695598343060625.
[I 2025-12-09 16:23:12,940] Trial 68 finished with value: 0.21717335491283007 and parameters: {'model_type': 'graphsage', 'hidden_dims': '[512, 64]', 'dropout': 0.2456556986532586, 'batch_norm': True, 'sage_aggr': 'max', 'sage_normalize': True, 'sage_project': False, 'lr': 2.4499233775972654e-05, 'weight_decay': 1.0563330464932143e-05, 'epochs': 261, 'loss': 'mse', 'optimizer': 'adam', 'graph_mode': 'cutoff', 'cutoff': 0.4254329820625983, 'grm_norm': 'gcn', 'self_loops': False, 'use_snp_selection': False}. Best is trial 42 with value: 0.29695598343060625.
[I 2025-12-09 16:26:18,698] Trial 69 finished with value: 0.2708902778860183 and parameters: {'model_type': 'graphsage', 'hidden_dims': '[512, 64]', 'dropout': 0.11953252516188356, 'batch_norm': False, 'sage_aggr': 'max', 'sage_normalize': False, 'sage_project': False, 'lr': 1.7808092017664487e-05, 'weight_decay': 7.214394162886017e-06, 'epochs': 168, 'loss': 'mse', 'optimizer': 'adam', 'graph_mode': 'cutoff', 'cutoff': 0.25759998808514506, 'grm_norm': 'cosine_then_gcn', 'self_loops': True, 'use_snp_selection': False}. Best is trial 42 with value: 0.29695598343060625.
