[I 2025-12-08 16:48:53,146] Trial 112 finished with value: 0.35550104168151103 and parameters: {'model_type': 'graphsage', 'hidden_dims': '[256, 128]', 'dropout': 0.5496534780205716, 'batch_norm': True, 'sage_aggr': 'max', 'sage_normalize': True, 'sage_project': False, 'lr': 0.009412753492097572, 'weight_decay': 2.1185884222009e-05, 'epochs': 86, 'loss': 'mae', 'optimizer': 'adam', 'graph_mode': 'knn', 'knn_k': 8, 'weighted_edges': True, 'symmetrize_mode': 'union', 'self_loops': False, 'use_snp_selection': True, 'num_snps': 17286}. Best is trial 105 with value: 0.3736369503402452.
[I 2025-12-08 16:49:42,831] Trial 113 finished with value: 0.3601278485022622 and parameters: {'model_type': 'graphsage', 'hidden_dims': '[256, 128]', 'dropout': 0.5079645063035865, 'batch_norm': True, 'sage_aggr': 'max', 'sage_normalize': True, 'sage_project': False, 'lr': 0.009874579650542508, 'weight_decay': 5.0107852378698175e-05, 'epochs': 114, 'loss': 'mae', 'optimizer': 'adam', 'graph_mode': 'knn', 'knn_k': 8, 'weighted_edges': True, 'symmetrize_mode': 'union', 'self_loops': False, 'use_snp_selection': True, 'num_snps': 13781}. Best is trial 105 with value: 0.3736369503402452.
[I 2025-12-08 16:50:26,553] Trial 114 finished with value: 0.3617617261349054 and parameters: {'model_type': 'graphsage', 'hidden_dims': '[256, 128]', 'dropout': 0.1504100898259456, 'batch_norm': True, 'sage_aggr': 'max', 'sage_normalize': True, 'sage_project': False, 'lr': 0.005547152653878393, 'weight_decay': 7.81079045854942e-06, 'epochs': 72, 'loss': 'mae', 'optimizer': 'adam', 'graph_mode': 'knn', 'knn_k': 8, 'weighted_edges': True, 'symmetrize_mode': 'union', 'self_loops': False, 'use_snp_selection': True, 'num_snps': 15864}. Best is trial 105 with value: 0.3736369503402452.
[I 2025-12-08 16:51:17,818] Trial 115 finished with value: 0.3548704423468726 and parameters: {'model_type': 'graphsage', 'hidden_dims': '[256, 128]', 'dropout': 0.4792335694127746, 'batch_norm': True, 'sage_aggr': 'max', 'sage_normalize': True, 'sage_project': False, 'lr': 0.007622932122932084, 'weight_decay': 3.8957011038305916e-05, 'epochs': 97, 'loss': 'mae', 'optimizer': 'adam', 'graph_mode': 'knn', 'knn_k': 7, 'weighted_edges': True, 'symmetrize_mode': 'union', 'self_loops': False, 'use_snp_selection': True, 'num_snps': 17930}. Best is trial 105 with value: 0.3736369503402452.
[I 2025-12-08 16:52:26,827] Trial 116 finished with value: 0.3612618800162861 and parameters: {'model_type': 'graphsage', 'hidden_dims': '[512, 64]', 'dropout': 0.4594333772840922, 'batch_norm': True, 'sage_aggr': 'max', 'sage_normalize': True, 'sage_project': False, 'lr': 0.0063229149029783065, 'weight_decay': 2.5944114767393276e-05, 'epochs': 120, 'loss': 'mae', 'optimizer': 'adam', 'graph_mode': 'knn', 'knn_k': 8, 'weighted_edges': True, 'symmetrize_mode': 'union', 'self_loops': True, 'use_snp_selection': True, 'num_snps': 19721}. Best is trial 105 with value: 0.3736369503402452.
[I 2025-12-08 16:53:17,755] Trial 117 finished with value: 0.3281809015153956 and parameters: {'model_type': 'graphsage', 'hidden_dims': '[256, 128]', 'dropout': 0.5242297871287847, 'batch_norm': True, 'sage_aggr': 'max', 'sage_normalize': True, 'sage_project': False, 'lr': 0.00413195599092723, 'weight_decay': 1.8458486125412177e-05, 'epochs': 103, 'loss': 'mae', 'optimizer': 'adam', 'graph_mode': 'knn', 'knn_k': 9, 'weighted_edges': True, 'symmetrize_mode': 'mutual', 'self_loops': False, 'use_snp_selection': False}. Best is trial 105 with value: 0.3736369503402452.
[I 2025-12-08 16:54:20,666] Trial 118 finished with value: 0.28040556596615474 and parameters: {'model_type': 'graphsage', 'hidden_dims': '[128, 64]', 'dropout': 0.5398803526834114, 'batch_norm': False, 'sage_aggr': 'max', 'sage_normalize': True, 'sage_project': False, 'lr': 0.003317158878011637, 'weight_decay': 1.0078004854783392e-07, 'epochs': 108, 'loss': 'mae', 'optimizer': 'adam', 'graph_mode': 'knn', 'knn_k': 8, 'weighted_edges': True, 'symmetrize_mode': 'union', 'self_loops': False, 'use_snp_selection': True, 'num_snps': 23387}. Best is trial 105 with value: 0.3736369503402452.
[I 2025-12-08 16:54:59,131] Trial 119 finished with value: 0.3446001305853696 and parameters: {'model_type': 'graphsage', 'hidden_dims': '[256, 128]', 'dropout': 0.5002963510726522, 'batch_norm': True, 'sage_aggr': 'max', 'sage_normalize': True, 'sage_project': False, 'lr': 0.0029608164839587114, 'weight_decay': 1.2849777160428078e-05, 'epochs': 81, 'loss': 'mae', 'optimizer': 'adam', 'graph_mode': 'cutoff', 'cutoff': 0.7836763549929779, 'grm_norm': 'cosine_then_gcn', 'self_loops': False, 'use_snp_selection': True, 'num_snps': 21305}. Best is trial 105 with value: 0.3736369503402452.
[I 2025-12-08 16:55:48,303] Trial 120 finished with value: 0.36713321694753576 and parameters: {'model_type': 'graphsage', 'hidden_dims': '[512, 64]', 'dropout': 0.485399879956016, 'batch_norm': True, 'sage_aggr': 'max', 'sage_normalize': False, 'sage_project': False, 'lr': 0.004920011501714416, 'weight_decay': 1.0074396051451023e-05, 'epochs': 91, 'loss': 'mae', 'optimizer': 'adam', 'graph_mode': 'knn', 'knn_k': 8, 'weighted_edges': False, 'symmetrize_mode': 'union', 'self_loops': False, 'use_snp_selection': True, 'num_snps': 14650}. Best is trial 105 with value: 0.3736369503402452.
[I 2025-12-08 16:56:38,135] Trial 121 finished with value: 0.3720607719655286 and parameters: {'model_type': 'graphsage', 'hidden_dims': '[512, 64]', 'dropout': 0.45287774555925103, 'batch_norm': True, 'sage_aggr': 'max', 'sage_normalize': False, 'sage_project': False, 'lr': 0.0049111576491466, 'weight_decay': 1.0118393390693949e-05, 'epochs': 89, 'loss': 'mae', 'optimizer': 'adam', 'graph_mode': 'knn', 'knn_k': 8, 'weighted_edges': False, 'symmetrize_mode': 'union', 'self_loops': False, 'use_snp_selection': True, 'num_snps': 15322}. Best is trial 105 with value: 0.3736369503402452.
[I 2025-12-08 16:57:27,185] Trial 122 finished with value: 0.3676104427622167 and parameters: {'model_type': 'graphsage', 'hidden_dims': '[512, 64]', 'dropout': 0.4883542535176654, 'batch_norm': True, 'sage_aggr': 'max', 'sage_normalize': False, 'sage_project': False, 'lr': 0.004925164490628623, 'weight_decay': 1.0118615985843544e-05, 'epochs': 89, 'loss': 'mae', 'optimizer': 'adam', 'graph_mode': 'knn', 'knn_k': 8, 'weighted_edges': False, 'symmetrize_mode': 'union', 'self_loops': False, 'use_snp_selection': True, 'num_snps': 14705}. Best is trial 105 with value: 0.3736369503402452.
[I 2025-12-08 16:58:07,164] Trial 123 finished with value: 0.3723629472668495 and parameters: {'model_type': 'graphsage', 'hidden_dims': '[512, 64]', 'dropout': 0.47504712006531874, 'batch_norm': True, 'sage_aggr': 'max', 'sage_normalize': False, 'sage_project': False, 'lr': 0.004785077785315468, 'weight_decay': 3.636948583205844e-06, 'epochs': 68, 'loss': 'mae', 'optimizer': 'adam', 'graph_mode': 'knn', 'knn_k': 8, 'weighted_edges': False, 'symmetrize_mode': 'union', 'self_loops': False, 'use_snp_selection': True, 'num_snps': 11232}. Best is trial 105 with value: 0.3736369503402452.
[I 2025-12-08 16:58:47,037] Trial 124 finished with value: 0.3704545198254583 and parameters: {'model_type': 'graphsage', 'hidden_dims': '[512, 64]', 'dropout': 0.45119683330548377, 'batch_norm': True, 'sage_aggr': 'max', 'sage_normalize': False, 'sage_project': False, 'lr': 0.004272360144485857, 'weight_decay': 4.881294868482036e-06, 'epochs': 66, 'loss': 'mae', 'optimizer': 'adam', 'graph_mode': 'knn', 'knn_k': 7, 'weighted_edges': False, 'symmetrize_mode': 'union', 'self_loops': False, 'use_snp_selection': True, 'num_snps': 11628}. Best is trial 105 with value: 0.3736369503402452.
[I 2025-12-08 16:59:26,618] Trial 125 finished with value: 0.3703091342523601 and parameters: {'model_type': 'graphsage', 'hidden_dims': '[512, 64]', 'dropout': 0.4506793868467204, 'batch_norm': True, 'sage_aggr': 'max', 'sage_normalize': False, 'sage_project': False, 'lr': 0.005604297650238196, 'weight_decay': 2.4859951187568822e-06, 'epochs': 66, 'loss': 'mae', 'optimizer': 'adam', 'graph_mode': 'knn', 'knn_k': 7, 'weighted_edges': False, 'symmetrize_mode': 'union', 'self_loops': False, 'use_snp_selection': True, 'num_snps': 11106}. Best is trial 105 with value: 0.3736369503402452.
[I 2025-12-08 17:00:03,661] Trial 126 finished with value: 0.3630846624428182 and parameters: {'model_type': 'graphsage', 'hidden_dims': '[512, 64]', 'dropout': 0.45475670236163873, 'batch_norm': True, 'sage_aggr': 'max', 'sage_normalize': False, 'sage_project': False, 'lr': 0.004170045016264155, 'weight_decay': 2.7329038759764853e-06, 'epochs': 50, 'loss': 'mse', 'optimizer': 'adam', 'graph_mode': 'knn', 'knn_k': 7, 'weighted_edges': False, 'symmetrize_mode': 'union', 'self_loops': False, 'use_snp_selection': True, 'num_snps': 10965}. Best is trial 105 with value: 0.3736369503402452.
[I 2025-12-08 17:00:39,085] Trial 127 finished with value: 0.3762546080912424 and parameters: {'model_type': 'graphsage', 'hidden_dims': '[512, 64]', 'dropout': 0.43765512839980375, 'batch_norm': True, 'sage_aggr': 'max', 'sage_normalize': False, 'sage_project': False, 'lr': 0.0055840045767841144, 'weight_decay': 1.6119732238987095e-06, 'epochs': 58, 'loss': 'mae', 'optimizer': 'adam', 'graph_mode': 'knn', 'knn_k': 7, 'weighted_edges': False, 'symmetrize_mode': 'union', 'self_loops': False, 'use_snp_selection': True, 'num_snps': 8353}. Best is trial 127 with value: 0.3762546080912424.
[I 2025-12-08 17:01:12,806] Trial 128 finished with value: 0.3384488681070054 and parameters: {'model_type': 'graphsage', 'hidden_dims': '[512, 64]', 'dropout': 0.4404354494951891, 'batch_norm': True, 'sage_aggr': 'mean', 'sage_normalize': False, 'sage_project': False, 'lr': 0.005698218874432295, 'weight_decay': 1.8566266202340421e-06, 'epochs': 68, 'loss': 'mae', 'optimizer': 'adam', 'graph_mode': 'knn', 'knn_k': 6, 'weighted_edges': False, 'symmetrize_mode': 'union', 'self_loops': False, 'use_snp_selection': True, 'num_snps': 7100}. Best is trial 127 with value: 0.3762546080912424.
[I 2025-12-08 17:01:48,252] Trial 129 finished with value: 0.36756187403635776 and parameters: {'model_type': 'graphsage', 'hidden_dims': '[512, 64]', 'dropout': 0.4330036684804402, 'batch_norm': True, 'sage_aggr': 'max', 'sage_normalize': False, 'sage_project': False, 'lr': 0.004809957113082682, 'weight_decay': 3.1294597703520996e-06, 'epochs': 57, 'loss': 'mae', 'optimizer': 'adam', 'graph_mode': 'knn', 'knn_k': 7, 'weighted_edges': False, 'symmetrize_mode': 'union', 'self_loops': False, 'use_snp_selection': True, 'num_snps': 8447}. Best is trial 127 with value: 0.3762546080912424.
[I 2025-12-08 17:02:26,309] Trial 130 finished with value: 0.3322714421596117 and parameters: {'model_type': 'graphsage', 'hidden_dims': '[512, 64]', 'dropout': 0.4499609253694069, 'batch_norm': True, 'sage_aggr': 'max', 'sage_normalize': False, 'sage_project': False, 'lr': 0.007122660113671871, 'weight_decay': 1.0455745945818718e-06, 'epochs': 45, 'loss': 'mae', 'optimizer': 'adam', 'graph_mode': 'knn', 'knn_k': 7, 'weighted_edges': False, 'symmetrize_mode': 'union', 'self_loops': False, 'use_snp_selection': True, 'num_snps': 12787}. Best is trial 127 with value: 0.3762546080912424.
[I 2025-12-08 17:02:58,319] Trial 131 finished with value: 0.3591022017667967 and parameters: {'model_type': 'graphsage', 'hidden_dims': '[512, 64]', 'dropout': 0.46539101289354173, 'batch_norm': True, 'sage_aggr': 'max', 'sage_normalize': False, 'sage_project': False, 'lr': 0.00383950235651529, 'weight_decay': 1.6900235063504978e-06, 'epochs': 63, 'loss': 'mae', 'optimizer': 'adam', 'graph_mode': 'knn', 'knn_k': 7, 'weighted_edges': False, 'symmetrize_mode': 'union', 'self_loops': False, 'use_snp_selection': True, 'num_snps': 4514}. Best is trial 127 with value: 0.3762546080912424.
[I 2025-12-08 17:03:35,265] Trial 132 finished with value: 0.3524864892728952 and parameters: {'model_type': 'graphsage', 'hidden_dims': '[512, 64]', 'dropout': 0.44292971469494513, 'batch_norm': True, 'sage_aggr': 'max', 'sage_normalize': False, 'sage_project': False, 'lr': 0.0055824379523895075, 'weight_decay': 3.92096135622376e-06, 'epochs': 40, 'loss': 'mae', 'optimizer': 'adam', 'graph_mode': 'knn', 'knn_k': 7, 'weighted_edges': False, 'symmetrize_mode': 'union', 'self_loops': False, 'use_snp_selection': True, 'num_snps': 11855}. Best is trial 127 with value: 0.3762546080912424.
[I 2025-12-08 17:04:12,081] Trial 133 finished with value: 0.3660881076582919 and parameters: {'model_type': 'graphsage', 'hidden_dims': '[512, 64]', 'dropout': 0.43018685079401175, 'batch_norm': True, 'sage_aggr': 'max', 'sage_normalize': False, 'sage_project': False, 'lr': 0.004495685778502408, 'weight_decay': 2.208118784815718e-06, 'epochs': 77, 'loss': 'mae', 'optimizer': 'adam', 'graph_mode': 'knn', 'knn_k': 6, 'weighted_edges': False, 'symmetrize_mode': 'union', 'self_loops': False, 'use_snp_selection': True, 'num_snps': 8203}. Best is trial 127 with value: 0.3762546080912424.
[I 2025-12-08 17:04:50,281] Trial 134 finished with value: 0.3586385123884229 and parameters: {'model_type': 'graphsage', 'hidden_dims': '[512, 64]', 'dropout': 0.21804911594505777, 'batch_norm': True, 'sage_aggr': 'max', 'sage_normalize': False, 'sage_project': False, 'lr': 0.006108424828438929, 'weight_decay': 3.8565335510166845e-06, 'epochs': 71, 'loss': 'mae', 'optimizer': 'adam', 'graph_mode': 'knn', 'knn_k': 7, 'weighted_edges': False, 'symmetrize_mode': 'union', 'self_loops': False, 'use_snp_selection': True, 'num_snps': 9202}. Best is trial 127 with value: 0.3762546080912424.
[I 2025-12-08 17:05:23,675] Trial 135 finished with value: 0.3658370756561084 and parameters: {'model_type': 'graphsage', 'hidden_dims': '[512, 64]', 'dropout': 0.4736354238678994, 'batch_norm': True, 'sage_aggr': 'max', 'sage_normalize': False, 'sage_project': False, 'lr': 0.0025969954160877428, 'weight_decay': 5.7261710665048335e-06, 'epochs': 54, 'loss': 'mae', 'optimizer': 'adam', 'graph_mode': 'knn', 'knn_k': 8, 'weighted_edges': False, 'symmetrize_mode': 'union', 'self_loops': False, 'use_snp_selection': True, 'num_snps': 6068}. Best is trial 127 with value: 0.3762546080912424.
[I 2025-12-08 17:06:02,463] Trial 136 finished with value: 0.37204541666982327 and parameters: {'model_type': 'graphsage', 'hidden_dims': '[512, 64]', 'dropout': 0.45649896916084787, 'batch_norm': True, 'sage_aggr': 'max', 'sage_normalize': False, 'sage_project': False, 'lr': 0.004981584164237921, 'weight_decay': 4.104750267714523e-07, 'epochs': 60, 'loss': 'mae', 'optimizer': 'adam', 'graph_mode': 'knn', 'knn_k': 8, 'weighted_edges': False, 'symmetrize_mode': 'union', 'self_loops': False, 'use_snp_selection': True, 'num_snps': 10848}. Best is trial 127 with value: 0.3762546080912424.
[I 2025-12-08 17:07:02,817] Trial 137 finished with value: 0.3237918692077256 and parameters: {'model_type': 'graphsage', 'hidden_dims': '[512, 64]', 'dropout': 0.4080303462892728, 'batch_norm': True, 'sage_aggr': 'max', 'sage_normalize': False, 'sage_project': False, 'lr': 0.00524014402666233, 'weight_decay': 3.3003217681110075e-07, 'epochs': 60, 'loss': 'mae', 'optimizer': 'adam', 'graph_mode': 'knn', 'knn_k': 7, 'weighted_edges': False, 'symmetrize_mode': 'union', 'self_loops': True, 'use_snp_selection': False}. Best is trial 127 with value: 0.3762546080912424.
[I 2025-12-08 17:07:40,661] Trial 138 finished with value: 0.3703065185206296 and parameters: {'model_type': 'graphsage', 'hidden_dims': '[512, 64]', 'dropout': 0.4233792977234067, 'batch_norm': True, 'sage_aggr': 'max', 'sage_normalize': False, 'sage_project': False, 'lr': 0.0066677471442584, 'weight_decay': 5.795837902319192e-07, 'epochs': 66, 'loss': 'mae', 'optimizer': 'adam', 'graph_mode': 'knn', 'knn_k': 6, 'weighted_edges': False, 'symmetrize_mode': 'union', 'self_loops': False, 'use_snp_selection': True, 'num_snps': 10179}. Best is trial 127 with value: 0.3762546080912424.
[I 2025-12-08 17:08:16,402] Trial 139 finished with value: 0.35512314455209537 and parameters: {'model_type': 'graphsage', 'hidden_dims': '[512, 64]', 'dropout': 0.38094036318630076, 'batch_norm': True, 'sage_aggr': 'max', 'sage_normalize': False, 'sage_project': False, 'lr': 0.00788222027989107, 'weight_decay': 8.490833932827377e-07, 'epochs': 66, 'loss': 'mae', 'optimizer': 'adam', 'graph_mode': 'knn', 'knn_k': 6, 'weighted_edges': False, 'symmetrize_mode': 'mutual', 'self_loops': False, 'use_snp_selection': True, 'num_snps': 10148}. Best is trial 127 with value: 0.3762546080912424.
[I 2025-12-08 17:08:51,063] Trial 140 finished with value: 0.0 and parameters: {'model_type': 'graphsage', 'hidden_dims': '[512, 64]', 'dropout': 0.44795122523205727, 'batch_norm': False, 'sage_aggr': 'max', 'sage_normalize': False, 'sage_project': False, 'lr': 0.0059179497035455365, 'weight_decay': 3.293870664386639e-07, 'epochs': 51, 'loss': 'mae', 'optimizer': 'adam', 'graph_mode': 'cutoff', 'cutoff': 0.535979575765519, 'grm_norm': 'cosine', 'self_loops': False, 'use_snp_selection': True, 'num_snps': 13249}. Best is trial 127 with value: 0.3762546080912424.
[I 2025-12-08 17:09:31,263] Trial 141 finished with value: 0.37260332616327974 and parameters: {'model_type': 'graphsage', 'hidden_dims': '[512, 64]', 'dropout': 0.4274547344668429, 'batch_norm': True, 'sage_aggr': 'max', 'sage_normalize': False, 'sage_project': False, 'lr': 0.006836305184348173, 'weight_decay': 4.0180829568969873e-07, 'epochs': 75, 'loss': 'mae', 'optimizer': 'adam', 'graph_mode': 'knn', 'knn_k': 6, 'weighted_edges': False, 'symmetrize_mode': 'union', 'self_loops': False, 'use_snp_selection': True, 'num_snps': 11295}. Best is trial 127 with value: 0.3762546080912424.
[I 2025-12-08 17:10:11,285] Trial 142 finished with value: 0.35924235973427987 and parameters: {'model_type': 'graphsage', 'hidden_dims': '[512, 64]', 'dropout': 0.4196572347812596, 'batch_norm': True, 'sage_aggr': 'max', 'sage_normalize': False, 'sage_project': False, 'lr': 0.006743081858632152, 'weight_decay': 4.3414793176947217e-07, 'epochs': 74, 'loss': 'mae', 'optimizer': 'adam', 'graph_mode': 'knn', 'knn_k': 6, 'weighted_edges': False, 'symmetrize_mode': 'union', 'self_loops': False, 'use_snp_selection': True, 'num_snps': 11102}. Best is trial 127 with value: 0.3762546080912424.
[I 2025-12-08 17:10:48,658] Trial 143 finished with value: 0.35237866353192016 and parameters: {'model_type': 'graphsage', 'hidden_dims': '[512, 64]', 'dropout': 0.42490411165011127, 'batch_norm': True, 'sage_aggr': 'max', 'sage_normalize': False, 'sage_project': False, 'lr': 0.007350367177723496, 'weight_decay': 5.539839879680879e-07, 'epochs': 68, 'loss': 'mae', 'optimizer': 'adam', 'graph_mode': 'knn', 'knn_k': 5, 'weighted_edges': False, 'symmetrize_mode': 'union', 'self_loops': False, 'use_snp_selection': True, 'num_snps': 10288}. Best is trial 127 with value: 0.3762546080912424.
[I 2025-12-08 17:11:31,271] Trial 144 finished with value: 0.35443621323971425 and parameters: {'model_type': 'graphsage', 'hidden_dims': '[512, 64]', 'dropout': 0.45889644394891516, 'batch_norm': True, 'sage_aggr': 'max', 'sage_normalize': False, 'sage_project': False, 'lr': 0.004312065960443756, 'weight_decay': 1.9044560046314106e-07, 'epochs': 83, 'loss': 'mae', 'optimizer': 'adam', 'graph_mode': 'knn', 'knn_k': 6, 'weighted_edges': False, 'symmetrize_mode': 'union', 'self_loops': False, 'use_snp_selection': True, 'num_snps': 12334}. Best is trial 127 with value: 0.3762546080912424.
[I 2025-12-08 17:12:03,934] Trial 145 finished with value: 0.321654173037326 and parameters: {'model_type': 'graphsage', 'hidden_dims': '[512, 64]', 'dropout': 0.43517377090834036, 'batch_norm': True, 'sage_aggr': 'max', 'sage_normalize': False, 'sage_project': False, 'lr': 8.297311058394026e-05, 'weight_decay': 5.866480377350894e-07, 'epochs': 58, 'loss': 'mae', 'optimizer': 'adam', 'graph_mode': 'knn', 'knn_k': 6, 'weighted_edges': False, 'symmetrize_mode': 'union', 'self_loops': False, 'use_snp_selection': True, 'num_snps': 5764}. Best is trial 127 with value: 0.3762546080912424.
[I 2025-12-08 17:12:41,421] Trial 146 finished with value: 0.35852350971558733 and parameters: {'model_type': 'graphsage', 'hidden_dims': '[512, 64]', 'dropout': 0.44198164657141353, 'batch_norm': True, 'sage_aggr': 'max', 'sage_normalize': False, 'sage_project': False, 'lr': 0.0063829412614052235, 'weight_decay': 2.621010548839018e-07, 'epochs': 78, 'loss': 'mae', 'optimizer': 'adam', 'graph_mode': 'knn', 'knn_k': 7, 'weighted_edges': False, 'symmetrize_mode': 'union', 'self_loops': False, 'use_snp_selection': True, 'num_snps': 8132}. Best is trial 127 with value: 0.3762546080912424.
[I 2025-12-08 17:13:26,251] Trial 147 finished with value: 0.35185905399975975 and parameters: {'model_type': 'graphsage', 'hidden_dims': '[512, 64]', 'dropout': 0.11955008102373614, 'batch_norm': True, 'sage_aggr': 'max', 'sage_normalize': False, 'sage_project': False, 'lr': 0.008413957492440987, 'weight_decay': 4.050382637364964e-07, 'epochs': 64, 'loss': 'mae', 'optimizer': 'adam', 'graph_mode': 'knn', 'knn_k': 7, 'weighted_edges': False, 'symmetrize_mode': 'union', 'self_loops': False, 'use_snp_selection': True, 'num_snps': 15700}. Best is trial 127 with value: 0.3762546080912424.
[I 2025-12-08 17:14:10,268] Trial 148 finished with value: 0.3583634309325421 and parameters: {'model_type': 'graphsage', 'hidden_dims': '[512, 64]', 'dropout': 0.4066347770379907, 'batch_norm': True, 'sage_aggr': 'max', 'sage_normalize': False, 'sage_project': False, 'lr': 0.005217431049819788, 'weight_decay': 1.522873685442786e-06, 'epochs': 73, 'loss': 'mse', 'optimizer': 'adam', 'graph_mode': 'knn', 'knn_k': 7, 'weighted_edges': False, 'symmetrize_mode': 'union', 'self_loops': False, 'use_snp_selection': True, 'num_snps': 13717}. Best is trial 127 with value: 0.3762546080912424.
