[I 2025-12-09 17:44:47,119] Trial 108 finished with value: 0.29582101296579233 and parameters: {'model_type': 'graphsage', 'hidden_dims': '[512, 128]', 'dropout': 0.2812153871679498, 'batch_norm': False, 'sage_aggr': 'mean', 'sage_normalize': False, 'sage_project': False, 'lr': 1.0438588830891419e-05, 'weight_decay': 0.00010106817281242256, 'epochs': 161, 'loss': 'mse', 'optimizer': 'adam', 'graph_mode': 'cutoff', 'cutoff': 0.6180440420138178, 'grm_norm': 'gcn', 'self_loops': False, 'use_snp_selection': False}. Best is trial 106 with value: 0.3021395890851344.
[I 2025-12-09 17:46:32,345] Trial 109 finished with value: 0.29950136216328305 and parameters: {'model_type': 'graphsage', 'hidden_dims': '[512, 128]', 'dropout': 0.24101981562596406, 'batch_norm': False, 'sage_aggr': 'mean', 'sage_normalize': False, 'sage_project': False, 'lr': 1.3409996603211653e-05, 'weight_decay': 5.352549721655849e-05, 'epochs': 167, 'loss': 'mse', 'optimizer': 'adam', 'graph_mode': 'cutoff', 'cutoff': 0.5479528577725302, 'grm_norm': 'none', 'self_loops': False, 'use_snp_selection': False}. Best is trial 106 with value: 0.3021395890851344.
[I 2025-12-09 17:47:59,317] Trial 110 finished with value: 0.0 and parameters: {'model_type': 'graphsage', 'hidden_dims': '[512, 128]', 'dropout': 0.2551359324749257, 'batch_norm': False, 'sage_aggr': 'mean', 'sage_normalize': False, 'sage_project': False, 'lr': 0.0024548814423594337, 'weight_decay': 5.823940961815855e-05, 'epochs': 135, 'loss': 'mse', 'optimizer': 'adam', 'graph_mode': 'cutoff', 'cutoff': 0.5332934353743686, 'grm_norm': 'none', 'self_loops': False, 'use_snp_selection': False}. Best is trial 106 with value: 0.3021395890851344.
[I 2025-12-09 17:49:46,785] Trial 111 finished with value: 0.29781878925574856 and parameters: {'model_type': 'graphsage', 'hidden_dims': '[512, 128]', 'dropout': 0.23520226576559045, 'batch_norm': False, 'sage_aggr': 'mean', 'sage_normalize': False, 'sage_project': False, 'lr': 1.338382229532654e-05, 'weight_decay': 4.3055069933797164e-05, 'epochs': 172, 'loss': 'mse', 'optimizer': 'adam', 'graph_mode': 'cutoff', 'cutoff': 0.5557477958075295, 'grm_norm': 'none', 'self_loops': False, 'use_snp_selection': False}. Best is trial 106 with value: 0.3021395890851344.
[I 2025-12-09 17:51:31,086] Trial 112 finished with value: 0.29967343313611394 and parameters: {'model_type': 'graphsage', 'hidden_dims': '[512, 128]', 'dropout': 0.23370344336322446, 'batch_norm': False, 'sage_aggr': 'mean', 'sage_normalize': False, 'sage_project': False, 'lr': 1.3250706647721441e-05, 'weight_decay': 4.489420370158457e-05, 'epochs': 167, 'loss': 'mse', 'optimizer': 'adam', 'graph_mode': 'cutoff', 'cutoff': 0.5567889997772919, 'grm_norm': 'none', 'self_loops': False, 'use_snp_selection': False}. Best is trial 106 with value: 0.3021395890851344.
[I 2025-12-09 17:53:16,860] Trial 113 finished with value: 0.2989501417912017 and parameters: {'model_type': 'graphsage', 'hidden_dims': '[512, 128]', 'dropout': 0.24000240624317437, 'batch_norm': False, 'sage_aggr': 'mean', 'sage_normalize': False, 'sage_project': False, 'lr': 1.3595969854419566e-05, 'weight_decay': 4.263318454686739e-05, 'epochs': 169, 'loss': 'mse', 'optimizer': 'adam', 'graph_mode': 'cutoff', 'cutoff': 0.5531116573945118, 'grm_norm': 'none', 'self_loops': False, 'use_snp_selection': False}. Best is trial 106 with value: 0.3021395890851344.
[I 2025-12-09 17:55:04,673] Trial 114 finished with value: 0.2967263054407928 and parameters: {'model_type': 'graphsage', 'hidden_dims': '[512, 128]', 'dropout': 0.23432894705661922, 'batch_norm': False, 'sage_aggr': 'mean', 'sage_normalize': False, 'sage_project': False, 'lr': 1.27037872744795e-05, 'weight_decay': 3.826039359825178e-05, 'epochs': 172, 'loss': 'mse', 'optimizer': 'adam', 'graph_mode': 'cutoff', 'cutoff': 0.5502365204195611, 'grm_norm': 'none', 'self_loops': False, 'use_snp_selection': False}. Best is trial 106 with value: 0.3021395890851344.
[I 2025-12-09 17:56:37,604] Trial 115 finished with value: 0.29744225012282394 and parameters: {'model_type': 'graphsage', 'hidden_dims': '[512, 128]', 'dropout': 0.23088512636382427, 'batch_norm': False, 'sage_aggr': 'mean', 'sage_normalize': False, 'sage_project': False, 'lr': 1.3750894184442516e-05, 'weight_decay': 4.6429917681720624e-05, 'epochs': 146, 'loss': 'mse', 'optimizer': 'adam', 'graph_mode': 'cutoff', 'cutoff': 0.5467234284233892, 'grm_norm': 'none', 'self_loops': False, 'use_snp_selection': False}. Best is trial 106 with value: 0.3021395890851344.
[I 2025-12-09 17:58:07,636] Trial 116 finished with value: 0.29724303522764745 and parameters: {'model_type': 'graphsage', 'hidden_dims': '[512, 128]', 'dropout': 0.2185039207642337, 'batch_norm': False, 'sage_aggr': 'mean', 'sage_normalize': False, 'sage_project': False, 'lr': 1.3350552938219254e-05, 'weight_decay': 4.434638055774574e-05, 'epochs': 141, 'loss': 'mse', 'optimizer': 'adam', 'graph_mode': 'cutoff', 'cutoff': 0.5480214798971035, 'grm_norm': 'none', 'self_loops': False, 'use_snp_selection': False}. Best is trial 106 with value: 0.3021395890851344.
[I 2025-12-09 17:59:42,586] Trial 117 finished with value: 0.29470732614118383 and parameters: {'model_type': 'graphsage', 'hidden_dims': '[512, 128]', 'dropout': 0.21729479429751092, 'batch_norm': False, 'sage_aggr': 'mean', 'sage_normalize': False, 'sage_project': False, 'lr': 1.3804886080490003e-05, 'weight_decay': 9.544836889696016e-05, 'epochs': 149, 'loss': 'mse', 'optimizer': 'adam', 'graph_mode': 'cutoff', 'cutoff': 0.5457514734692558, 'grm_norm': 'none', 'self_loops': False, 'use_snp_selection': False}. Best is trial 106 with value: 0.3021395890851344.
[I 2025-12-09 18:01:10,435] Trial 118 finished with value: 0.23381091935936588 and parameters: {'model_type': 'graphsage', 'hidden_dims': '[512, 128]', 'dropout': 0.24370648194917927, 'batch_norm': True, 'sage_aggr': 'mean', 'sage_normalize': True, 'sage_project': False, 'lr': 1.7918240560354202e-05, 'weight_decay': 4.693678384126019e-05, 'epochs': 136, 'loss': 'mse', 'optimizer': 'adam', 'graph_mode': 'cutoff', 'cutoff': 0.561287991514453, 'grm_norm': 'none', 'self_loops': False, 'use_snp_selection': False}. Best is trial 106 with value: 0.3021395890851344.
[I 2025-12-09 18:02:56,564] Trial 119 finished with value: 0.280441581374529 and parameters: {'model_type': 'graphsage', 'hidden_dims': '[512, 128]', 'dropout': 0.23001488974173517, 'batch_norm': False, 'sage_aggr': 'mean', 'sage_normalize': False, 'sage_project': False, 'lr': 1.3434883514496089e-05, 'weight_decay': 0.00011633362781051247, 'epochs': 161, 'loss': 'mae', 'optimizer': 'adam', 'graph_mode': 'cutoff', 'cutoff': 0.5181721879438235, 'grm_norm': 'none', 'self_loops': False, 'use_snp_selection': False}. Best is trial 106 with value: 0.3021395890851344.
[I 2025-12-09 18:04:15,242] Trial 120 finished with value: 0.29479547641769255 and parameters: {'model_type': 'graphsage', 'hidden_dims': '[512, 128]', 'dropout': 0.25048563361928, 'batch_norm': False, 'sage_aggr': 'mean', 'sage_normalize': False, 'sage_project': False, 'lr': 1.715488874391243e-05, 'weight_decay': 0.0001591673680943425, 'epochs': 127, 'loss': 'mse', 'optimizer': 'adam', 'graph_mode': 'cutoff', 'cutoff': 0.6103291563096604, 'grm_norm': 'none', 'self_loops': True, 'use_snp_selection': False}. Best is trial 106 with value: 0.3021395890851344.
[I 2025-12-09 18:05:50,337] Trial 121 finished with value: 0.29318747485411245 and parameters: {'model_type': 'graphsage', 'hidden_dims': '[512, 128]', 'dropout': 0.22273166428637395, 'batch_norm': False, 'sage_aggr': 'mean', 'sage_normalize': False, 'sage_project': False, 'lr': 1.0002308011746398e-05, 'weight_decay': 5.311823578310854e-05, 'epochs': 156, 'loss': 'mse', 'optimizer': 'adam', 'graph_mode': 'cutoff', 'cutoff': 0.6303333971207441, 'grm_norm': 'none', 'self_loops': False, 'use_snp_selection': False}. Best is trial 106 with value: 0.3021395890851344.
[I 2025-12-09 18:07:34,251] Trial 122 finished with value: 0.29986802944103663 and parameters: {'model_type': 'graphsage', 'hidden_dims': '[512, 128]', 'dropout': 0.25869372831048654, 'batch_norm': False, 'sage_aggr': 'mean', 'sage_normalize': False, 'sage_project': False, 'lr': 1.4242466705880178e-05, 'weight_decay': 8.994375828314395e-05, 'epochs': 167, 'loss': 'mse', 'optimizer': 'adam', 'graph_mode': 'cutoff', 'cutoff': 0.5567692502629288, 'grm_norm': 'none', 'self_loops': False, 'use_snp_selection': False}. Best is trial 106 with value: 0.3021395890851344.
[I 2025-12-09 18:09:16,877] Trial 123 finished with value: 0.2954065808942752 and parameters: {'model_type': 'graphsage', 'hidden_dims': '[512, 128]', 'dropout': 0.24005765781152927, 'batch_norm': False, 'sage_aggr': 'mean', 'sage_normalize': False, 'sage_project': False, 'lr': 1.5232638489861411e-05, 'weight_decay': 8.476641603249355e-05, 'epochs': 165, 'loss': 'mse', 'optimizer': 'adam', 'graph_mode': 'cutoff', 'cutoff': 0.5571022254816533, 'grm_norm': 'none', 'self_loops': False, 'use_snp_selection': False}. Best is trial 106 with value: 0.3021395890851344.
[I 2025-12-09 18:10:46,559] Trial 124 finished with value: 0.30186318603563583 and parameters: {'model_type': 'graphsage', 'hidden_dims': '[512, 128]', 'dropout': 0.25777853253004673, 'batch_norm': False, 'sage_aggr': 'mean', 'sage_normalize': False, 'sage_project': False, 'lr': 1.3373135690371213e-05, 'weight_decay': 4.4020073495888224e-05, 'epochs': 144, 'loss': 'mse', 'optimizer': 'adam', 'graph_mode': 'cutoff', 'cutoff': 0.5739426632334226, 'grm_norm': 'none', 'self_loops': False, 'use_snp_selection': False}. Best is trial 106 with value: 0.3021395890851344.
[I 2025-12-09 18:12:33,303] Trial 125 finished with value: 0.30220451036781204 and parameters: {'model_type': 'graphsage', 'hidden_dims': '[512, 128]', 'dropout': 0.24964940110712003, 'batch_norm': False, 'sage_aggr': 'mean', 'sage_normalize': False, 'sage_project': False, 'lr': 2.143138699482179e-05, 'weight_decay': 0.00019179938579640511, 'epochs': 175, 'loss': 'mse', 'optimizer': 'adam', 'graph_mode': 'cutoff', 'cutoff': 0.5770840862224222, 'grm_norm': 'none', 'self_loops': False, 'use_snp_selection': False}. Best is trial 125 with value: 0.30220451036781204.
[I 2025-12-09 18:14:24,540] Trial 126 finished with value: 0.2975206408114189 and parameters: {'model_type': 'graphsage', 'hidden_dims': '[512, 128]', 'dropout': 0.2553648330504954, 'batch_norm': False, 'sage_aggr': 'mean', 'sage_normalize': False, 'sage_project': False, 'lr': 2.214373474348541e-05, 'weight_decay': 0.00011756879730115649, 'epochs': 182, 'loss': 'mse', 'optimizer': 'adam', 'graph_mode': 'cutoff', 'cutoff': 0.5708710034024996, 'grm_norm': 'none', 'self_loops': False, 'use_snp_selection': False}. Best is trial 125 with value: 0.30220451036781204.
[I 2025-12-09 18:16:21,487] Trial 127 finished with value: 0.2953145776692808 and parameters: {'model_type': 'graphsage', 'hidden_dims': '[512, 128]', 'dropout': 0.25931757904389796, 'batch_norm': False, 'sage_aggr': 'mean', 'sage_normalize': False, 'sage_project': False, 'lr': 1.605573598742384e-05, 'weight_decay': 0.00018747816579690318, 'epochs': 173, 'loss': 'mse', 'optimizer': 'adam', 'graph_mode': 'cutoff', 'cutoff': 0.5017686775353816, 'grm_norm': 'none', 'self_loops': False, 'use_snp_selection': False}. Best is trial 125 with value: 0.30220451036781204.
[I 2025-12-09 18:18:09,386] Trial 128 finished with value: 0.2951145661137276 and parameters: {'model_type': 'graphsage', 'hidden_dims': '[512, 128]', 'dropout': 0.24449252372610197, 'batch_norm': False, 'sage_aggr': 'mean', 'sage_normalize': False, 'sage_project': False, 'lr': 1.1317798004451561e-05, 'weight_decay': 0.0002651872308781942, 'epochs': 167, 'loss': 'mse', 'optimizer': 'adam', 'graph_mode': 'cutoff', 'cutoff': 0.528804670235759, 'grm_norm': 'none', 'self_loops': False, 'use_snp_selection': False}. Best is trial 125 with value: 0.30220451036781204.
[I 2025-12-09 18:19:58,601] Trial 129 finished with value: 0.2957887149815029 and parameters: {'model_type': 'graphsage', 'hidden_dims': '[512, 128]', 'dropout': 0.2816361675826453, 'batch_norm': False, 'sage_aggr': 'mean', 'sage_normalize': False, 'sage_project': False, 'lr': 1.9782589804329994e-05, 'weight_decay': 8.233419279041936e-05, 'epochs': 181, 'loss': 'mse', 'optimizer': 'adam', 'graph_mode': 'cutoff', 'cutoff': 0.6005689201191614, 'grm_norm': 'none', 'self_loops': False, 'use_snp_selection': False}. Best is trial 125 with value: 0.30220451036781204.
[I 2025-12-09 18:21:32,890] Trial 130 finished with value: 0.30385120725531234 and parameters: {'model_type': 'graphsage', 'hidden_dims': '[512, 128]', 'dropout': 0.26419208962031376, 'batch_norm': False, 'sage_aggr': 'mean', 'sage_normalize': False, 'sage_project': False, 'lr': 1.7012710450291044e-05, 'weight_decay': 2.821442467755367e-05, 'epochs': 153, 'loss': 'mse', 'optimizer': 'adam', 'graph_mode': 'cutoff', 'cutoff': 0.5783424505990722, 'grm_norm': 'none', 'self_loops': False, 'use_snp_selection': False}. Best is trial 130 with value: 0.30385120725531234.
[I 2025-12-09 18:23:07,842] Trial 131 finished with value: 0.3012869499800567 and parameters: {'model_type': 'graphsage', 'hidden_dims': '[512, 128]', 'dropout': 0.2597231198269212, 'batch_norm': False, 'sage_aggr': 'mean', 'sage_normalize': False, 'sage_project': False, 'lr': 1.2752504542031378e-05, 'weight_decay': 2.8543838129371513e-05, 'epochs': 153, 'loss': 'mse', 'optimizer': 'adam', 'graph_mode': 'cutoff', 'cutoff': 0.578803659806958, 'grm_norm': 'none', 'self_loops': False, 'use_snp_selection': False}. Best is trial 130 with value: 0.30385120725531234.
[I 2025-12-09 18:24:42,124] Trial 132 finished with value: 0.2986062307226951 and parameters: {'model_type': 'graphsage', 'hidden_dims': '[512, 128]', 'dropout': 0.2610733274381801, 'batch_norm': False, 'sage_aggr': 'mean', 'sage_normalize': False, 'sage_project': False, 'lr': 1.6956738607221905e-05, 'weight_decay': 2.9915804943894387e-05, 'epochs': 153, 'loss': 'mse', 'optimizer': 'adam', 'graph_mode': 'cutoff', 'cutoff': 0.579533919485336, 'grm_norm': 'none', 'self_loops': False, 'use_snp_selection': False}. Best is trial 130 with value: 0.30385120725531234.
[I 2025-12-09 18:26:15,817] Trial 133 finished with value: 0.29623274558180235 and parameters: {'model_type': 'graphsage', 'hidden_dims': '[512, 128]', 'dropout': 0.24962566689840537, 'batch_norm': False, 'sage_aggr': 'mean', 'sage_normalize': False, 'sage_project': False, 'lr': 1.7120026446332746e-05, 'weight_decay': 3.086874659860078e-05, 'epochs': 154, 'loss': 'mse', 'optimizer': 'adam', 'graph_mode': 'cutoff', 'cutoff': 0.6222071431126387, 'grm_norm': 'none', 'self_loops': False, 'use_snp_selection': False}. Best is trial 130 with value: 0.30385120725531234.
[I 2025-12-09 18:27:23,760] Trial 134 finished with value: 0.3004906819174861 and parameters: {'model_type': 'graphsage', 'hidden_dims': '[512, 128]', 'dropout': 0.25991262977340746, 'batch_norm': False, 'sage_aggr': 'mean', 'sage_normalize': False, 'sage_project': False, 'lr': 2.231367345627573e-05, 'weight_decay': 2.5732022631172673e-05, 'epochs': 109, 'loss': 'mse', 'optimizer': 'adam', 'graph_mode': 'cutoff', 'cutoff': 0.6387649751429888, 'grm_norm': 'none', 'self_loops': False, 'use_snp_selection': False}. Best is trial 130 with value: 0.30385120725531234.
[I 2025-12-09 18:28:39,109] Trial 135 finished with value: -0.0790822176003371 and parameters: {'model_type': 'graphsage', 'hidden_dims': '[512, 128]', 'dropout': 0.27540707111675367, 'batch_norm': False, 'sage_aggr': 'mean', 'sage_normalize': False, 'sage_project': False, 'lr': 0.0005508794902583651, 'weight_decay': 2.6534204004474504e-05, 'epochs': 123, 'loss': 'mse', 'optimizer': 'adam', 'graph_mode': 'cutoff', 'cutoff': 0.6342616007838574, 'grm_norm': 'none', 'self_loops': False, 'use_snp_selection': False}. Best is trial 130 with value: 0.30385120725531234.
[I 2025-12-09 18:29:39,292] Trial 136 finished with value: 0.29664114834667676 and parameters: {'model_type': 'graphsage', 'hidden_dims': '[512, 128]', 'dropout': 0.283768612489175, 'batch_norm': False, 'sage_aggr': 'mean', 'sage_normalize': False, 'sage_project': False, 'lr': 2.119847176021706e-05, 'weight_decay': 3.1718138723756275e-05, 'epochs': 96, 'loss': 'mse', 'optimizer': 'adam', 'graph_mode': 'cutoff', 'cutoff': 0.7270474603334549, 'grm_norm': 'none', 'self_loops': False, 'use_snp_selection': False}. Best is trial 130 with value: 0.30385120725531234.
[I 2025-12-09 18:30:46,033] Trial 137 finished with value: 0.2986621434133444 and parameters: {'model_type': 'graphsage', 'hidden_dims': '[512, 128]', 'dropout': 0.257453298160984, 'batch_norm': False, 'sage_aggr': 'mean', 'sage_normalize': False, 'sage_project': False, 'lr': 1.57695052238758e-05, 'weight_decay': 0.00013619271611200047, 'epochs': 107, 'loss': 'mse', 'optimizer': 'adam', 'graph_mode': 'cutoff', 'cutoff': 0.6775430723743077, 'grm_norm': 'none', 'self_loops': False, 'use_snp_selection': False}. Best is trial 130 with value: 0.30385120725531234.
[I 2025-12-09 18:31:47,483] Trial 138 finished with value: 0.29614115899951166 and parameters: {'model_type': 'graphsage', 'hidden_dims': '[512, 128]', 'dropout': 0.24343517091141922, 'batch_norm': False, 'sage_aggr': 'mean', 'sage_normalize': False, 'sage_project': False, 'lr': 2.1909626366948282e-05, 'weight_decay': 0.00033687958506493075, 'epochs': 98, 'loss': 'mse', 'optimizer': 'adam', 'graph_mode': 'cutoff', 'cutoff': 0.7089819225015334, 'grm_norm': 'none', 'self_loops': False, 'use_snp_selection': False}. Best is trial 130 with value: 0.30385120725531234.
[I 2025-12-09 18:33:11,818] Trial 139 finished with value: 0.25087725823851625 and parameters: {'model_type': 'graphsage', 'hidden_dims': '[512, 128]', 'dropout': 0.21480079199899438, 'batch_norm': True, 'sage_aggr': 'mean', 'sage_normalize': True, 'sage_project': False, 'lr': 0.00027547532876632576, 'weight_decay': 2.5585470153283946e-05, 'epochs': 89, 'loss': 'mse', 'optimizer': 'adam', 'graph_mode': 'knn', 'knn_k': 10, 'weighted_edges': True, 'symmetrize_mode': 'mutual', 'self_loops': False, 'use_snp_selection': False}. Best is trial 130 with value: 0.30385120725531234.
[I 2025-12-09 18:33:54,854] Trial 140 finished with value: 0.2824995875894711 and parameters: {'model_type': 'graphsage', 'hidden_dims': '[512, 128]', 'dropout': 0.2609346355468354, 'batch_norm': False, 'sage_aggr': 'mean', 'sage_normalize': False, 'sage_project': False, 'lr': 2.8525941886018275e-05, 'weight_decay': 0.00021320388846195234, 'epochs': 65, 'loss': 'mse', 'optimizer': 'adam', 'graph_mode': 'cutoff', 'cutoff': 0.6852269385512151, 'grm_norm': 'none', 'self_loops': False, 'use_snp_selection': False}. Best is trial 130 with value: 0.30385120725531234.
[I 2025-12-09 18:35:26,163] Trial 141 finished with value: 0.29617215696568655 and parameters: {'model_type': 'graphsage', 'hidden_dims': '[512, 128]', 'dropout': 0.25425100774138704, 'batch_norm': False, 'sage_aggr': 'mean', 'sage_normalize': False, 'sage_project': False, 'lr': 1.5660649649250193e-05, 'weight_decay': 6.972865445504604e-05, 'epochs': 147, 'loss': 'mse', 'optimizer': 'adam', 'graph_mode': 'cutoff', 'cutoff': 0.5774085299639214, 'grm_norm': 'none', 'self_loops': False, 'use_snp_selection': False}. Best is trial 130 with value: 0.30385120725531234.
[I 2025-12-09 18:36:34,572] Trial 142 finished with value: 0.29378864239352154 and parameters: {'model_type': 'graphsage', 'hidden_dims': '[512, 128]', 'dropout': 0.27471007534604075, 'batch_norm': False, 'sage_aggr': 'mean', 'sage_normalize': False, 'sage_project': False, 'lr': 1.8709383822047638e-05, 'weight_decay': 9.05575600330986e-05, 'epochs': 110, 'loss': 'mse', 'optimizer': 'adam', 'graph_mode': 'cutoff', 'cutoff': 0.6586342053030652, 'grm_norm': 'none', 'self_loops': False, 'use_snp_selection': False}. Best is trial 130 with value: 0.30385120725531234.
[I 2025-12-09 18:38:12,867] Trial 143 finished with value: 0.29536007613899284 and parameters: {'model_type': 'graphsage', 'hidden_dims': '[512, 128]', 'dropout': 0.226032979927743, 'batch_norm': False, 'sage_aggr': 'mean', 'sage_normalize': False, 'sage_project': False, 'lr': 1.4657385273128557e-05, 'weight_decay': 0.00013098112026065537, 'epochs': 161, 'loss': 'mse', 'optimizer': 'adam', 'graph_mode': 'cutoff', 'cutoff': 0.605312440219977, 'grm_norm': 'none', 'self_loops': False, 'use_snp_selection': False}. Best is trial 130 with value: 0.30385120725531234.
[I 2025-12-09 18:39:51,735] Trial 144 finished with value: 0.2977300551934746 and parameters: {'model_type': 'graphsage', 'hidden_dims': '[512, 128]', 'dropout': 0.2895997158861903, 'batch_norm': False, 'sage_aggr': 'mean', 'sage_normalize': False, 'sage_project': False, 'lr': 1.2512004973456349e-05, 'weight_decay': 2.2646078378744473e-05, 'epochs': 152, 'loss': 'mse', 'optimizer': 'adam', 'graph_mode': 'cutoff', 'cutoff': 0.5284123110585782, 'grm_norm': 'none', 'self_loops': False, 'use_snp_selection': False}. Best is trial 130 with value: 0.30385120725531234.
[I 2025-12-09 18:41:19,187] Trial 145 finished with value: 0.29702568700782217 and parameters: {'model_type': 'graphsage', 'hidden_dims': '[512, 128]', 'dropout': 0.24618276028112915, 'batch_norm': False, 'sage_aggr': 'mean', 'sage_normalize': False, 'sage_project': False, 'lr': 1.7448381472826668e-05, 'weight_decay': 3.813580351110017e-05, 'epochs': 142, 'loss': 'mse', 'optimizer': 'adam', 'graph_mode': 'cutoff', 'cutoff': 0.5696249310848642, 'grm_norm': 'cosine', 'self_loops': False, 'use_snp_selection': False}. Best is trial 130 with value: 0.30385120725531234.
