[I 2025-12-08 21:03:01,935] Trial 4 finished with value: 0.2550118447812177 and parameters: {'model_type': 'graphsage', 'hidden_dims': '[128, 64]', 'dropout': 0.3348926467202472, 'batch_norm': True, 'sage_aggr': 'max', 'sage_normalize': False, 'sage_project': False, 'lr': 0.0004238630400638802, 'weight_decay': 8.074086040046576e-07, 'epochs': 158, 'loss': 'mae', 'optimizer': 'adam', 'graph_mode': 'knn', 'knn_k': 1, 'weighted_edges': False, 'symmetrize_mode': 'mutual', 'self_loops': False, 'use_snp_selection': True, 'num_snps': 26850}. Best is trial 3 with value: 0.2773280311555321.
[I 2025-12-08 21:04:56,515] Trial 5 finished with value: 0.2532384371305728 and parameters: {'model_type': 'graphsage', 'hidden_dims': '[512, 64]', 'dropout': 0.14505336736221927, 'batch_norm': True, 'sage_aggr': 'mean', 'sage_normalize': True, 'sage_project': False, 'lr': 1.2962030165732234e-05, 'weight_decay': 1.326598071105465e-07, 'epochs': 180, 'loss': 'mse', 'optimizer': 'adam', 'graph_mode': 'knn', 'knn_k': 9, 'weighted_edges': True, 'symmetrize_mode': 'mutual', 'self_loops': False, 'use_snp_selection': False}. Best is trial 3 with value: 0.2773280311555321.
[I 2025-12-08 21:05:51,387] Trial 6 finished with value: 0.2702735219252833 and parameters: {'model_type': 'graphsage', 'hidden_dims': '[256, 128, 64]', 'dropout': 0.10731743755162496, 'batch_norm': True, 'sage_aggr': 'mean', 'sage_normalize': False, 'sage_project': False, 'lr': 1.922990426933137e-05, 'weight_decay': 7.30001060446905e-05, 'epochs': 63, 'loss': 'mae', 'optimizer': 'adam', 'graph_mode': 'cutoff', 'cutoff': 0.7624978434202536, 'grm_norm': 'none', 'self_loops': True, 'use_snp_selection': True, 'num_snps': 50106}. Best is trial 3 with value: 0.2773280311555321.
[I 2025-12-08 21:07:51,847] Trial 7 finished with value: 0.26175757800740307 and parameters: {'model_type': 'graphsage', 'hidden_dims': '[512, 64]', 'dropout': 0.2585007811528941, 'batch_norm': True, 'sage_aggr': 'max', 'sage_normalize': True, 'sage_project': False, 'lr': 5.921425508303391e-05, 'weight_decay': 0.0004511561961144237, 'epochs': 182, 'loss': 'mae', 'optimizer': 'adam', 'graph_mode': 'knn', 'knn_k': 9, 'weighted_edges': True, 'symmetrize_mode': 'union', 'self_loops': False, 'use_snp_selection': True, 'num_snps': 23903}. Best is trial 3 with value: 0.2773280311555321.
[I 2025-12-08 21:08:35,197] Trial 8 finished with value: 0.24180687142889384 and parameters: {'model_type': 'graphsage', 'hidden_dims': '[512, 256]', 'dropout': 0.3061380386767003, 'batch_norm': False, 'sage_aggr': 'mean', 'sage_normalize': True, 'sage_project': False, 'lr': 0.000698401460570184, 'weight_decay': 2.965560055460244e-06, 'epochs': 289, 'loss': 'mae', 'optimizer': 'adam', 'graph_mode': 'knn', 'knn_k': 7, 'weighted_edges': False, 'symmetrize_mode': 'mutual', 'self_loops': True, 'use_snp_selection': True, 'num_snps': 4710}. Best is trial 3 with value: 0.2773280311555321.
[I 2025-12-08 21:12:28,323] Trial 9 finished with value: 0.275936149458418 and parameters: {'model_type': 'graphsage', 'hidden_dims': '[512, 128]', 'dropout': 0.1733844071393634, 'batch_norm': False, 'sage_aggr': 'mean', 'sage_normalize': True, 'sage_project': False, 'lr': 0.0004269677918501597, 'weight_decay': 2.2439779626249696e-06, 'epochs': 319, 'loss': 'mse', 'optimizer': 'adam', 'graph_mode': 'cutoff', 'cutoff': 0.24117565767129295, 'grm_norm': 'cosine_then_gcn', 'self_loops': True, 'use_snp_selection': False}. Best is trial 3 with value: 0.2773280311555321.
[I 2025-12-08 21:13:39,464] Trial 10 finished with value: 0.27990699327516405 and parameters: {'model_type': 'graphsage', 'hidden_dims': '[256, 128, 64]', 'dropout': 0.5062131504581071, 'batch_norm': True, 'sage_aggr': 'max', 'sage_normalize': False, 'sage_project': False, 'lr': 0.0060050040216813455, 'weight_decay': 1.5886244399072472e-05, 'epochs': 258, 'loss': 'mse', 'optimizer': 'adam', 'graph_mode': 'cutoff', 'cutoff': 0.6388703494956212, 'grm_norm': 'none', 'self_loops': True, 'use_snp_selection': False}. Best is trial 10 with value: 0.27990699327516405.
[I 2025-12-08 21:14:48,919] Trial 11 finished with value: 0.27964840881053604 and parameters: {'model_type': 'graphsage', 'hidden_dims': '[256, 128, 64]', 'dropout': 0.49488119581970164, 'batch_norm': True, 'sage_aggr': 'max', 'sage_normalize': False, 'sage_project': False, 'lr': 0.006753264773209739, 'weight_decay': 1.623283721491421e-05, 'epochs': 251, 'loss': 'mse', 'optimizer': 'adam', 'graph_mode': 'cutoff', 'cutoff': 0.6423124990838213, 'grm_norm': 'none', 'self_loops': True, 'use_snp_selection': False}. Best is trial 10 with value: 0.27990699327516405.
[I 2025-12-08 21:15:53,980] Trial 12 finished with value: 0.2778551339801977 and parameters: {'model_type': 'graphsage', 'hidden_dims': '[256, 128, 64]', 'dropout': 0.51498112638603, 'batch_norm': True, 'sage_aggr': 'max', 'sage_normalize': False, 'sage_project': False, 'lr': 0.00923224194542078, 'weight_decay': 2.2174123778930998e-05, 'epochs': 233, 'loss': 'mse', 'optimizer': 'adam', 'graph_mode': 'cutoff', 'cutoff': 0.6518755419888931, 'grm_norm': 'none', 'self_loops': True, 'use_snp_selection': False}. Best is trial 10 with value: 0.27990699327516405.
[I 2025-12-08 21:17:01,910] Trial 13 finished with value: 0.287199596603397 and parameters: {'model_type': 'graphsage', 'hidden_dims': '[256, 128]', 'dropout': 0.49764911474423795, 'batch_norm': True, 'sage_aggr': 'max', 'sage_normalize': False, 'sage_project': False, 'lr': 0.009857123725592538, 'weight_decay': 1.0653228376940842e-05, 'epochs': 247, 'loss': 'mse', 'optimizer': 'adam', 'graph_mode': 'cutoff', 'cutoff': 0.8525230707343452, 'grm_norm': 'cosine', 'self_loops': True, 'use_snp_selection': False}. Best is trial 13 with value: 0.287199596603397.
[I 2025-12-08 21:18:32,941] Trial 14 finished with value: 0.2897236461097091 and parameters: {'model_type': 'graphsage', 'hidden_dims': '[256, 128]', 'dropout': 0.5904818868511308, 'batch_norm': True, 'sage_aggr': 'max', 'sage_normalize': False, 'sage_project': False, 'lr': 0.0024371165556171634, 'weight_decay': 6.032195947905781e-07, 'epochs': 348, 'loss': 'mse', 'optimizer': 'adam', 'graph_mode': 'cutoff', 'cutoff': 0.8923190952193389, 'grm_norm': 'cosine', 'self_loops': True, 'use_snp_selection': False}. Best is trial 14 with value: 0.2897236461097091.
[I 2025-12-08 21:20:02,019] Trial 15 finished with value: 0.2859121905651854 and parameters: {'model_type': 'graphsage', 'hidden_dims': '[256, 128]', 'dropout': 0.5959385475479251, 'batch_norm': True, 'sage_aggr': 'max', 'sage_normalize': False, 'sage_project': False, 'lr': 0.0020965421622487065, 'weight_decay': 2.3309915318775723e-07, 'epochs': 340, 'loss': 'mse', 'optimizer': 'adam', 'graph_mode': 'cutoff', 'cutoff': 0.8973313329898638, 'grm_norm': 'cosine', 'self_loops': True, 'use_snp_selection': False}. Best is trial 14 with value: 0.2897236461097091.
[I 2025-12-08 21:21:32,797] Trial 16 finished with value: 0.28434115245069336 and parameters: {'model_type': 'graphsage', 'hidden_dims': '[256, 128]', 'dropout': 0.42666201263246023, 'batch_norm': True, 'sage_aggr': 'max', 'sage_normalize': False, 'sage_project': False, 'lr': 0.0021273413180799413, 'weight_decay': 6.067807278806825e-07, 'epochs': 347, 'loss': 'mse', 'optimizer': 'adam', 'graph_mode': 'cutoff', 'cutoff': 0.8813702497064646, 'grm_norm': 'cosine', 'self_loops': True, 'use_snp_selection': False}. Best is trial 14 with value: 0.2897236461097091.
[I 2025-12-08 21:22:03,075] Trial 17 finished with value: 0.29045957567386166 and parameters: {'model_type': 'graphsage', 'hidden_dims': '[256, 128]', 'dropout': 0.5969789334672921, 'batch_norm': True, 'sage_aggr': 'max', 'sage_normalize': False, 'sage_project': False, 'lr': 0.002561819439558274, 'weight_decay': 4.028232429774471e-06, 'epochs': 82, 'loss': 'mse', 'optimizer': 'adam', 'graph_mode': 'cutoff', 'cutoff': 0.780548446244612, 'grm_norm': 'cosine', 'self_loops': True, 'use_snp_selection': False}. Best is trial 17 with value: 0.29045957567386166.
[I 2025-12-08 21:22:28,430] Trial 18 finished with value: -0.030530698732071017 and parameters: {'model_type': 'graphsage', 'hidden_dims': '[256, 128]', 'dropout': 0.5868848980333622, 'batch_norm': False, 'sage_aggr': 'mean', 'sage_normalize': False, 'sage_project': False, 'lr': 0.00157584551393007, 'weight_decay': 1.4525492047244303e-06, 'epochs': 62, 'loss': 'mse', 'optimizer': 'adam', 'graph_mode': 'cutoff', 'cutoff': 0.7495815752770503, 'grm_norm': 'cosine', 'self_loops': False, 'use_snp_selection': False}. Best is trial 17 with value: 0.29045957567386166.
[I 2025-12-08 21:23:10,638] Trial 19 finished with value: 0.25424137452938744 and parameters: {'model_type': 'graphsage', 'hidden_dims': '[256, 128]', 'dropout': 0.41351899471153286, 'batch_norm': True, 'sage_aggr': 'max', 'sage_normalize': False, 'sage_project': False, 'lr': 0.001061159526839557, 'weight_decay': 3.466554447287831e-07, 'epochs': 101, 'loss': 'mse', 'optimizer': 'adam', 'graph_mode': 'cutoff', 'cutoff': 0.4496582283915124, 'grm_norm': 'cosine', 'self_loops': True, 'use_snp_selection': False}. Best is trial 17 with value: 0.29045957567386166.
[I 2025-12-08 21:23:45,274] Trial 20 finished with value: 0.2864510380448081 and parameters: {'model_type': 'graphsage', 'hidden_dims': '[256, 128]', 'dropout': 0.5523069303729183, 'batch_norm': True, 'sage_aggr': 'max', 'sage_normalize': False, 'sage_project': False, 'lr': 0.003554823555576579, 'weight_decay': 4.374866328332016e-06, 'epochs': 102, 'loss': 'mse', 'optimizer': 'adam', 'graph_mode': 'cutoff', 'cutoff': 0.7378209616212532, 'grm_norm': 'cosine_then_gcn', 'self_loops': True, 'use_snp_selection': False}. Best is trial 17 with value: 0.29045957567386166.
[I 2025-12-08 21:24:45,248] Trial 21 finished with value: 0.2850285348666932 and parameters: {'model_type': 'graphsage', 'hidden_dims': '[256, 128]', 'dropout': 0.4540184348968538, 'batch_norm': True, 'sage_aggr': 'max', 'sage_normalize': False, 'sage_project': False, 'lr': 0.0037369661740560773, 'weight_decay': 6.42710958976235e-06, 'epochs': 213, 'loss': 'mse', 'optimizer': 'adam', 'graph_mode': 'cutoff', 'cutoff': 0.8290003685018504, 'grm_norm': 'cosine', 'self_loops': True, 'use_snp_selection': False}. Best is trial 17 with value: 0.29045957567386166.
[I 2025-12-08 21:26:05,954] Trial 22 finished with value: 0.27418130185504497 and parameters: {'model_type': 'graphsage', 'hidden_dims': '[256, 128]', 'dropout': 0.549028811691592, 'batch_norm': True, 'sage_aggr': 'max', 'sage_normalize': False, 'sage_project': False, 'lr': 0.00013256607502279362, 'weight_decay': 1.1775758092567295e-06, 'epochs': 304, 'loss': 'mse', 'optimizer': 'adam', 'graph_mode': 'cutoff', 'cutoff': 0.8067969109569992, 'grm_norm': 'cosine', 'self_loops': True, 'use_snp_selection': False}. Best is trial 17 with value: 0.29045957567386166.
[I 2025-12-08 21:26:39,733] Trial 23 finished with value: 0.28487996489085826 and parameters: {'model_type': 'graphsage', 'hidden_dims': '[256, 128]', 'dropout': 0.5544233948618654, 'batch_norm': True, 'sage_aggr': 'max', 'sage_normalize': False, 'sage_project': False, 'lr': 0.0034543712021314755, 'weight_decay': 4.90492341846463e-05, 'epochs': 98, 'loss': 'mse', 'optimizer': 'adam', 'graph_mode': 'cutoff', 'cutoff': 0.8986022009413155, 'grm_norm': 'cosine', 'self_loops': True, 'use_snp_selection': False}. Best is trial 17 with value: 0.29045957567386166.
[I 2025-12-08 21:27:52,952] Trial 24 finished with value: 0.28251902298060855 and parameters: {'model_type': 'graphsage', 'hidden_dims': '[256, 128]', 'dropout': 0.4665968118223398, 'batch_norm': True, 'sage_aggr': 'max', 'sage_normalize': False, 'sage_project': False, 'lr': 0.0009266672035455261, 'weight_decay': 3.8467866639693066e-07, 'epochs': 274, 'loss': 'mse', 'optimizer': 'adam', 'graph_mode': 'cutoff', 'cutoff': 0.817602164850951, 'grm_norm': 'gcn', 'self_loops': True, 'use_snp_selection': False}. Best is trial 17 with value: 0.29045957567386166.
[I 2025-12-08 21:28:32,189] Trial 25 finished with value: 0.285791134268608 and parameters: {'model_type': 'graphsage', 'hidden_dims': '[256, 128]', 'dropout': 0.395469238298223, 'batch_norm': True, 'sage_aggr': 'max', 'sage_normalize': False, 'sage_project': False, 'lr': 0.004698536956898683, 'weight_decay': 1.9787915306689434e-06, 'epochs': 122, 'loss': 'mse', 'optimizer': 'adam', 'graph_mode': 'cutoff', 'cutoff': 0.7090320559479141, 'grm_norm': 'cosine', 'self_loops': True, 'use_snp_selection': False}. Best is trial 17 with value: 0.29045957567386166.
[I 2025-12-08 21:29:52,769] Trial 26 finished with value: 0.24536451366100662 and parameters: {'model_type': 'graphsage', 'hidden_dims': '[256, 128]', 'dropout': 0.5932474195695975, 'batch_norm': True, 'sage_aggr': 'max', 'sage_normalize': True, 'sage_project': False, 'lr': 0.00018261035730288063, 'weight_decay': 1.0851551901703183e-07, 'epochs': 209, 'loss': 'mse', 'optimizer': 'adam', 'graph_mode': 'cutoff', 'cutoff': 0.3460530176062218, 'grm_norm': 'cosine', 'self_loops': True, 'use_snp_selection': False}. Best is trial 17 with value: 0.29045957567386166.
[I 2025-12-08 21:30:08,857] Trial 27 finished with value: 0.0 and parameters: {'model_type': 'graphsage', 'hidden_dims': '[128, 64]', 'dropout': 0.5315887643117994, 'batch_norm': False, 'sage_aggr': 'mean', 'sage_normalize': False, 'sage_project': False, 'lr': 0.00833751218988027, 'weight_decay': 9.775690522381036e-06, 'epochs': 42, 'loss': 'mae', 'optimizer': 'adam', 'graph_mode': 'cutoff', 'cutoff': 0.8290438115332105, 'grm_norm': 'cosine', 'self_loops': False, 'use_snp_selection': False}. Best is trial 17 with value: 0.29045957567386166.
[I 2025-12-08 21:32:35,962] Trial 28 finished with value: 0.28339043109451917 and parameters: {'model_type': 'graphsage', 'hidden_dims': '[512, 64]', 'dropout': 0.4733336860830407, 'batch_norm': True, 'sage_aggr': 'max', 'sage_normalize': False, 'sage_project': False, 'lr': 0.002198276826579128, 'weight_decay': 3.611096315838446e-06, 'epochs': 321, 'loss': 'mse', 'optimizer': 'adam', 'graph_mode': 'cutoff', 'cutoff': 0.6931031033557937, 'grm_norm': 'gcn', 'self_loops': True, 'use_snp_selection': False}. Best is trial 17 with value: 0.29045957567386166.
[I 2025-12-08 21:35:02,375] Trial 29 finished with value: 0.24293033814337583 and parameters: {'model_type': 'graphsage', 'hidden_dims': '[512, 256]', 'dropout': 0.566390868131296, 'batch_norm': True, 'sage_aggr': 'max', 'sage_normalize': True, 'sage_project': False, 'lr': 0.009496885563781738, 'weight_decay': 0.0001256772596311665, 'epochs': 235, 'loss': 'mse', 'optimizer': 'adam', 'graph_mode': 'knn', 'knn_k': 3, 'weighted_edges': False, 'symmetrize_mode': 'union', 'self_loops': True, 'use_snp_selection': False}. Best is trial 17 with value: 0.29045957567386166.
[I 2025-12-08 21:37:03,245] Trial 30 finished with value: 0.284265424850482 and parameters: {'model_type': 'graphsage', 'hidden_dims': '[512, 128]', 'dropout': 0.37591327619219383, 'batch_norm': True, 'sage_aggr': 'max', 'sage_normalize': False, 'sage_project': False, 'lr': 0.0006674902595083882, 'weight_decay': 8.299166567372883e-07, 'epochs': 257, 'loss': 'mse', 'optimizer': 'adam', 'graph_mode': 'cutoff', 'cutoff': 0.7887658196127517, 'grm_norm': 'cosine_then_gcn', 'self_loops': True, 'use_snp_selection': False}. Best is trial 17 with value: 0.29045957567386166.
[I 2025-12-08 21:37:32,633] Trial 31 finished with value: 0.2865819558698956 and parameters: {'model_type': 'graphsage', 'hidden_dims': '[256, 128]', 'dropout': 0.5365039746239253, 'batch_norm': True, 'sage_aggr': 'max', 'sage_normalize': False, 'sage_project': False, 'lr': 0.003977570758432971, 'weight_decay': 5.251029486229746e-06, 'epochs': 79, 'loss': 'mse', 'optimizer': 'adam', 'graph_mode': 'cutoff', 'cutoff': 0.7265411392072114, 'grm_norm': 'cosine_then_gcn', 'self_loops': True, 'use_snp_selection': False}. Best is trial 17 with value: 0.29045957567386166.
[I 2025-12-08 21:38:02,031] Trial 32 finished with value: 0.2846989784643593 and parameters: {'model_type': 'graphsage', 'hidden_dims': '[256, 128]', 'dropout': 0.5259533591613313, 'batch_norm': True, 'sage_aggr': 'max', 'sage_normalize': False, 'sage_project': False, 'lr': 0.0014562552111722707, 'weight_decay': 6.71602216840677e-06, 'epochs': 79, 'loss': 'mse', 'optimizer': 'adam', 'graph_mode': 'cutoff', 'cutoff': 0.8454084049925916, 'grm_norm': 'cosine_then_gcn', 'self_loops': True, 'use_snp_selection': False}. Best is trial 17 with value: 0.29045957567386166.
[I 2025-12-08 21:38:49,658] Trial 33 finished with value: 0.28830998558446713 and parameters: {'model_type': 'graphsage', 'hidden_dims': '[256, 128]', 'dropout': 0.5668437020707269, 'batch_norm': True, 'sage_aggr': 'max', 'sage_normalize': False, 'sage_project': False, 'lr': 0.0027942338326456713, 'weight_decay': 2.1588602401706308e-05, 'epochs': 159, 'loss': 'mse', 'optimizer': 'adam', 'graph_mode': 'cutoff', 'cutoff': 0.7623960455855285, 'grm_norm': 'cosine_then_gcn', 'self_loops': True, 'use_snp_selection': False}. Best is trial 17 with value: 0.29045957567386166.
[I 2025-12-08 21:39:17,883] Trial 34 finished with value: 0.18949996769861638 and parameters: {'model_type': 'graphsage', 'hidden_dims': '[128, 64]', 'dropout': 0.5773315362561398, 'batch_norm': False, 'sage_aggr': 'max', 'sage_normalize': False, 'sage_project': False, 'lr': 0.0026737277280830473, 'weight_decay': 3.912525314231923e-05, 'epochs': 140, 'loss': 'mse', 'optimizer': 'adam', 'graph_mode': 'cutoff', 'cutoff': 0.7790131843090291, 'grm_norm': 'cosine', 'self_loops': True, 'use_snp_selection': True, 'num_snps': 2241}. Best is trial 17 with value: 0.29045957567386166.
[I 2025-12-08 21:40:22,432] Trial 35 finished with value: 0.23640138237629876 and parameters: {'model_type': 'graphsage', 'hidden_dims': '[256, 128]', 'dropout': 0.4829299335203899, 'batch_norm': True, 'sage_aggr': 'max', 'sage_normalize': False, 'sage_project': False, 'lr': 0.0013852214472881736, 'weight_decay': 0.0009415015467824612, 'epochs': 127, 'loss': 'mse', 'optimizer': 'adam', 'graph_mode': 'knn', 'knn_k': 4, 'weighted_edges': True, 'symmetrize_mode': 'union', 'self_loops': True, 'use_snp_selection': False}. Best is trial 17 with value: 0.29045957567386166.
[I 2025-12-08 21:42:23,292] Trial 36 finished with value: 0.28473933433418247 and parameters: {'model_type': 'graphsage', 'hidden_dims': '[512, 128]', 'dropout': 0.5996918014221563, 'batch_norm': True, 'sage_aggr': 'max', 'sage_normalize': False, 'sage_project': False, 'lr': 0.0002711084320971823, 'weight_decay': 1.2765095421349896e-05, 'epochs': 169, 'loss': 'mae', 'optimizer': 'adam', 'graph_mode': 'cutoff', 'cutoff': 0.8663113945058982, 'grm_norm': 'cosine_then_gcn', 'self_loops': False, 'use_snp_selection': True, 'num_snps': 59922}. Best is trial 17 with value: 0.29045957567386166.
[I 2025-12-08 21:44:03,807] Trial 37 finished with value: 0.2806135847913859 and parameters: {'model_type': 'graphsage', 'hidden_dims': '[512, 256]', 'dropout': 0.44418392509324506, 'batch_norm': True, 'sage_aggr': 'max', 'sage_normalize': False, 'sage_project': False, 'lr': 0.005432600077331233, 'weight_decay': 2.5042126781001704e-05, 'epochs': 201, 'loss': 'mse', 'optimizer': 'adam', 'graph_mode': 'cutoff', 'cutoff': 0.531475700397186, 'grm_norm': 'cosine', 'self_loops': True, 'use_snp_selection': False}. Best is trial 17 with value: 0.29045957567386166.
[I 2025-12-08 21:46:00,805] Trial 38 finished with value: 0.054695035313047924 and parameters: {'model_type': 'graphsage', 'hidden_dims': '[256, 128]', 'dropout': 0.5077101484706883, 'batch_norm': False, 'sage_aggr': 'mean', 'sage_normalize': True, 'sage_project': False, 'lr': 0.002784118545349915, 'weight_decay': 0.00013506833166128455, 'epochs': 157, 'loss': 'mae', 'optimizer': 'adam', 'graph_mode': 'knn', 'knn_k': 10, 'weighted_edges': True, 'symmetrize_mode': 'union', 'self_loops': False, 'use_snp_selection': False}. Best is trial 17 with value: 0.29045957567386166.
[I 2025-12-08 21:46:50,280] Trial 39 finished with value: 0.2882089692304856 and parameters: {'model_type': 'graphsage', 'hidden_dims': '[512, 64]', 'dropout': 0.5658253882085367, 'batch_norm': True, 'sage_aggr': 'max', 'sage_normalize': False, 'sage_project': False, 'lr': 2.6451524405790403e-05, 'weight_decay': 6.0731228183043714e-05, 'epochs': 182, 'loss': 'mse', 'optimizer': 'adam', 'graph_mode': 'cutoff', 'cutoff': 0.6870463312315527, 'grm_norm': 'gcn', 'self_loops': True, 'use_snp_selection': True, 'num_snps': 15197}. Best is trial 17 with value: 0.29045957567386166.
[I 2025-12-08 21:47:59,041] Trial 40 finished with value: 0.23480624566442604 and parameters: {'model_type': 'graphsage', 'hidden_dims': '[512, 64]', 'dropout': 0.5605690710568424, 'batch_norm': True, 'sage_aggr': 'max', 'sage_normalize': False, 'sage_project': False, 'lr': 2.2673376447070268e-05, 'weight_decay': 7.015806430358618e-05, 'epochs': 177, 'loss': 'mae', 'optimizer': 'adam', 'graph_mode': 'knn', 'knn_k': 7, 'weighted_edges': False, 'symmetrize_mode': 'union', 'self_loops': True, 'use_snp_selection': True, 'num_snps': 15197}. Best is trial 17 with value: 0.29045957567386166.
[I 2025-12-08 21:48:45,687] Trial 41 finished with value: 0.27280673144241 and parameters: {'model_type': 'graphsage', 'hidden_dims': '[512, 64]', 'dropout': 0.5738183811428897, 'batch_norm': True, 'sage_aggr': 'max', 'sage_normalize': False, 'sage_project': False, 'lr': 0.00010813032002743276, 'weight_decay': 0.00028287200901384467, 'epochs': 189, 'loss': 'mse', 'optimizer': 'adam', 'graph_mode': 'cutoff', 'cutoff': 0.7897255914159729, 'grm_norm': 'gcn', 'self_loops': True, 'use_snp_selection': True, 'num_snps': 12999}. Best is trial 17 with value: 0.29045957567386166.
