[I 2025-12-06 12:12:14,111] Trial 12 finished with value: 0.21938781030189558 and parameters: {'model_type': 'graphsage', 'hidden_dims': '[256, 128, 64]', 'dropout': 0.11794664726169782, 'batch_norm': True, 'sage_aggr': 'mean', 'sage_normalize': True, 'sage_project': False, 'lr': 0.0001457690241539883, 'weight_decay': 1.2069615241648106e-06, 'epochs': 41, 'loss': 'mse', 'optimizer': 'adam', 'graph_mode': 'cutoff', 'cutoff': 0.5414493951134541, 'grm_norm': 'cosine_then_gcn', 'self_loops': False, 'use_snp_selection': True, 'num_snps': 18676, 'graphsage_batch_size': 16}. Best is trial 12 with value: 0.21938781030189558.
[I 2025-12-06 12:12:38,331] Trial 13 finished with value: 0.19712151594807914 and parameters: {'model_type': 'graphsage', 'hidden_dims': '[256, 128, 64]', 'dropout': 0.1189561918277873, 'batch_norm': False, 'sage_aggr': 'mean', 'sage_normalize': True, 'sage_project': False, 'lr': 7.674273218617439e-05, 'weight_decay': 7.341433977941495e-07, 'epochs': 46, 'loss': 'mse', 'optimizer': 'adam', 'graph_mode': 'cutoff', 'cutoff': 0.6160767834285827, 'grm_norm': 'cosine', 'self_loops': False, 'use_snp_selection': True, 'num_snps': 21315, 'graphsage_batch_size': 16}. Best is trial 12 with value: 0.21938781030189558.
[I 2025-12-06 12:13:19,360] Trial 14 finished with value: 0.22046693280406462 and parameters: {'model_type': 'graphsage', 'hidden_dims': '[256, 128, 64]', 'dropout': 0.10525811331266019, 'batch_norm': True, 'sage_aggr': 'mean', 'sage_normalize': True, 'sage_project': False, 'lr': 0.0008192530803467455, 'weight_decay': 4.104169171058631e-07, 'epochs': 197, 'loss': 'mse', 'optimizer': 'adam', 'graph_mode': 'cutoff', 'cutoff': 0.5458174773029156, 'grm_norm': 'cosine_then_gcn', 'self_loops': False, 'use_snp_selection': True, 'num_snps': 19973, 'graphsage_batch_size': 16}. Best is trial 14 with value: 0.22046693280406462.
[I 2025-12-06 12:14:01,151] Trial 15 finished with value: 0.2140678939219184 and parameters: {'model_type': 'graphsage', 'hidden_dims': '[256, 128, 64]', 'dropout': 0.10680351683829446, 'batch_norm': True, 'sage_aggr': 'mean', 'sage_normalize': True, 'sage_project': False, 'lr': 0.0009724619185488932, 'weight_decay': 2.94419123791581e-06, 'epochs': 169, 'loss': 'mse', 'optimizer': 'adam', 'graph_mode': 'cutoff', 'cutoff': 0.5420098352588926, 'grm_norm': 'cosine_then_gcn', 'self_loops': False, 'use_snp_selection': True, 'num_snps': 23640, 'graphsage_batch_size': 16}. Best is trial 14 with value: 0.22046693280406462.
[I 2025-12-06 12:14:32,550] Trial 16 finished with value: 0.20792337480322964 and parameters: {'model_type': 'graphsage', 'hidden_dims': '[256, 128, 64]', 'dropout': 0.16498867194427158, 'batch_norm': True, 'sage_aggr': 'mean', 'sage_normalize': True, 'sage_project': False, 'lr': 0.0009482583203427376, 'weight_decay': 1.287092257045254e-07, 'epochs': 50, 'loss': 'mse', 'optimizer': 'adam', 'graph_mode': 'cutoff', 'cutoff': 0.529772970345972, 'grm_norm': 'cosine_then_gcn', 'self_loops': False, 'use_snp_selection': True, 'num_snps': 34283, 'graphsage_batch_size': 16}. Best is trial 14 with value: 0.22046693280406462.
[I 2025-12-06 12:15:08,671] Trial 17 finished with value: 0.23135238799591704 and parameters: {'model_type': 'graphsage', 'hidden_dims': '[256, 128, 64]', 'dropout': 0.1830758479356574, 'batch_norm': True, 'sage_aggr': 'mean', 'sage_normalize': True, 'sage_project': False, 'lr': 0.00012689733323480631, 'weight_decay': 3.3087106706328406e-07, 'epochs': 189, 'loss': 'mse', 'optimizer': 'adam', 'graph_mode': 'cutoff', 'cutoff': 0.6902948659230268, 'grm_norm': 'cosine_then_gcn', 'self_loops': False, 'use_snp_selection': True, 'num_snps': 17392, 'graphsage_batch_size': 16}. Best is trial 17 with value: 0.23135238799591704.
[I 2025-12-06 12:16:17,608] Trial 18 finished with value: 0.21976256086528365 and parameters: {'model_type': 'graphsage', 'hidden_dims': '[256, 128, 64]', 'dropout': 0.20295103509072523, 'batch_norm': True, 'sage_aggr': 'mean', 'sage_normalize': True, 'sage_project': False, 'lr': 0.0004060617141781306, 'weight_decay': 3.8970012755220093e-07, 'epochs': 192, 'loss': 'mse', 'optimizer': 'adam', 'graph_mode': 'cutoff', 'cutoff': 0.7557864598690622, 'grm_norm': 'cosine', 'self_loops': False, 'use_snp_selection': False, 'graphsage_batch_size': 16}. Best is trial 17 with value: 0.23135238799591704.
[I 2025-12-06 12:17:23,965] Trial 19 finished with value: 0.2325487041055966 and parameters: {'model_type': 'graphsage', 'hidden_dims': '[128, 64]', 'dropout': 0.17752684326861112, 'batch_norm': True, 'sage_aggr': 'mean', 'sage_normalize': True, 'sage_project': False, 'lr': 6.994222641749019e-05, 'weight_decay': 3.6447978682922748e-06, 'epochs': 199, 'loss': 'mse', 'optimizer': 'adam', 'graph_mode': 'cutoff', 'cutoff': 0.6808823748871914, 'grm_norm': 'gcn', 'self_loops': False, 'use_snp_selection': True, 'num_snps': 59145, 'graphsage_batch_size': 32}. Best is trial 19 with value: 0.2325487041055966.
[I 2025-12-06 12:18:31,064] Trial 20 finished with value: 0.22565085770584226 and parameters: {'model_type': 'graphsage', 'hidden_dims': '[128, 64]', 'dropout': 0.217714940998272, 'batch_norm': True, 'sage_aggr': 'mean', 'sage_normalize': True, 'sage_project': False, 'lr': 9.105478554544476e-05, 'weight_decay': 3.988061195661038e-05, 'epochs': 245, 'loss': 'mse', 'optimizer': 'adam', 'graph_mode': 'cutoff', 'cutoff': 0.702380065173265, 'grm_norm': 'gcn', 'self_loops': False, 'use_snp_selection': True, 'num_snps': 54599, 'graphsage_batch_size': 32}. Best is trial 19 with value: 0.2325487041055966.
[I 2025-12-06 12:19:40,380] Trial 21 finished with value: 0.21931232456981337 and parameters: {'model_type': 'graphsage', 'hidden_dims': '[128, 64]', 'dropout': 0.22246821864146382, 'batch_norm': True, 'sage_aggr': 'mean', 'sage_normalize': True, 'sage_project': False, 'lr': 8.315182374545957e-05, 'weight_decay': 2.5283323837884756e-05, 'epochs': 243, 'loss': 'mse', 'optimizer': 'adam', 'graph_mode': 'cutoff', 'cutoff': 0.6912616301549732, 'grm_norm': 'gcn', 'self_loops': False, 'use_snp_selection': True, 'num_snps': 56449, 'graphsage_batch_size': 32}. Best is trial 19 with value: 0.2325487041055966.
[I 2025-12-06 12:20:43,236] Trial 22 finished with value: 0.2137619767026561 and parameters: {'model_type': 'graphsage', 'hidden_dims': '[128, 64]', 'dropout': 0.164862493957699, 'batch_norm': True, 'sage_aggr': 'mean', 'sage_normalize': True, 'sage_project': False, 'lr': 7.700309048851589e-05, 'weight_decay': 7.142386906568474e-05, 'epochs': 184, 'loss': 'mse', 'optimizer': 'adam', 'graph_mode': 'cutoff', 'cutoff': 0.7051361385925231, 'grm_norm': 'gcn', 'self_loops': False, 'use_snp_selection': True, 'num_snps': 58748, 'graphsage_batch_size': 32}. Best is trial 19 with value: 0.2325487041055966.
[I 2025-12-06 12:21:36,636] Trial 23 finished with value: 0.2064195155536183 and parameters: {'model_type': 'graphsage', 'hidden_dims': '[128, 64]', 'dropout': 0.32723560497268156, 'batch_norm': True, 'sage_aggr': 'mean', 'sage_normalize': True, 'sage_project': False, 'lr': 2.588728503874973e-05, 'weight_decay': 4.3626782492594444e-06, 'epochs': 226, 'loss': 'mse', 'optimizer': 'adam', 'graph_mode': 'cutoff', 'cutoff': 0.8837209867451716, 'grm_norm': 'gcn', 'self_loops': False, 'use_snp_selection': True, 'num_snps': 44289, 'graphsage_batch_size': 32}. Best is trial 19 with value: 0.2325487041055966.
[I 2025-12-06 12:22:36,760] Trial 24 finished with value: 0.22087425530405524 and parameters: {'model_type': 'graphsage', 'hidden_dims': '[128, 64]', 'dropout': 0.16680762822952763, 'batch_norm': True, 'sage_aggr': 'mean', 'sage_normalize': True, 'sage_project': False, 'lr': 1.912351856310804e-05, 'weight_decay': 2.6929504856121727e-05, 'epochs': 202, 'loss': 'mse', 'optimizer': 'adam', 'graph_mode': 'cutoff', 'cutoff': 0.6468070529166383, 'grm_norm': 'gcn', 'self_loops': False, 'use_snp_selection': True, 'num_snps': 54543, 'graphsage_batch_size': 32}. Best is trial 19 with value: 0.2325487041055966.
[I 2025-12-06 12:23:29,355] Trial 25 finished with value: 0.20000920126675292 and parameters: {'model_type': 'graphsage', 'hidden_dims': '[128, 64]', 'dropout': 0.2284112900373479, 'batch_norm': True, 'sage_aggr': 'mean', 'sage_normalize': True, 'sage_project': False, 'lr': 1.5575367794670044e-05, 'weight_decay': 5.081936189421862e-05, 'epochs': 234, 'loss': 'mse', 'optimizer': 'adam', 'graph_mode': 'cutoff', 'cutoff': 0.7839230957314909, 'grm_norm': 'none', 'self_loops': False, 'use_snp_selection': True, 'num_snps': 41873, 'graphsage_batch_size': 512}. Best is trial 19 with value: 0.2325487041055966.
[I 2025-12-06 12:25:48,157] Trial 26 finished with value: 0.22049674820946835 and parameters: {'model_type': 'graphsage', 'hidden_dims': '[512, 256]', 'dropout': 0.29853236003711614, 'batch_norm': True, 'sage_aggr': 'max', 'sage_normalize': False, 'sage_project': False, 'lr': 6.08183141750006e-05, 'weight_decay': 0.0007987117172062726, 'epochs': 180, 'loss': 'mse', 'optimizer': 'adam', 'graph_mode': 'cutoff', 'cutoff': 0.43651000687047325, 'grm_norm': 'gcn', 'self_loops': False, 'use_snp_selection': False, 'graphsage_batch_size': 256}. Best is trial 19 with value: 0.2325487041055966.
[I 2025-12-06 12:26:48,259] Trial 27 finished with value: 0.21999249990360772 and parameters: {'model_type': 'graphsage', 'hidden_dims': '[128, 64]', 'dropout': 0.15435568803417601, 'batch_norm': True, 'sage_aggr': 'mean', 'sage_normalize': True, 'sage_project': False, 'lr': 0.0001424810490957663, 'weight_decay': 1.5674015885695306e-05, 'epochs': 215, 'loss': 'mse', 'optimizer': 'adam', 'graph_mode': 'cutoff', 'cutoff': 0.6350231718860229, 'grm_norm': 'gcn', 'self_loops': False, 'use_snp_selection': True, 'num_snps': 50436, 'graphsage_batch_size': 32}. Best is trial 19 with value: 0.2325487041055966.
[I 2025-12-06 12:27:19,815] Trial 28 finished with value: 0.21080189538897787 and parameters: {'model_type': 'graphsage', 'hidden_dims': '[128, 64]', 'dropout': 0.234130696756632, 'batch_norm': True, 'sage_aggr': 'mean', 'sage_normalize': True, 'sage_project': False, 'lr': 4.761150140818716e-05, 'weight_decay': 4.749771213613349e-06, 'epochs': 149, 'loss': 'mse', 'optimizer': 'adam', 'graph_mode': 'cutoff', 'cutoff': 0.769205498505032, 'grm_norm': 'gcn', 'self_loops': False, 'use_snp_selection': True, 'num_snps': 27462, 'graphsage_batch_size': 32}. Best is trial 19 with value: 0.2325487041055966.
[I 2025-12-06 12:27:57,988] Trial 29 finished with value: 0.20950165858662145 and parameters: {'model_type': 'graphsage', 'hidden_dims': '[128, 64]', 'dropout': 0.19371581212445865, 'batch_norm': True, 'sage_aggr': 'max', 'sage_normalize': False, 'sage_project': False, 'lr': 0.000277351408089451, 'weight_decay': 0.00026396334501954335, 'epochs': 173, 'loss': 'mse', 'optimizer': 'adam', 'graph_mode': 'cutoff', 'cutoff': 0.6958540635845755, 'grm_norm': 'cosine', 'self_loops': False, 'use_snp_selection': False, 'graphsage_batch_size': 256}. Best is trial 19 with value: 0.2325487041055966.
[I 2025-12-06 12:29:56,611] Trial 30 finished with value: 0.21943706561955828 and parameters: {'model_type': 'graphsage', 'hidden_dims': '[512, 256]', 'dropout': 0.1975288357514345, 'batch_norm': True, 'sage_aggr': 'mean', 'sage_normalize': True, 'sage_project': False, 'lr': 0.00010969565618232033, 'weight_decay': 6.643243723546416e-05, 'epochs': 155, 'loss': 'mse', 'optimizer': 'adam', 'graph_mode': 'cutoff', 'cutoff': 0.5951243725332639, 'grm_norm': 'none', 'self_loops': False, 'use_snp_selection': True, 'num_snps': 59859, 'graphsage_batch_size': 32}. Best is trial 19 with value: 0.2325487041055966.
[I 2025-12-06 12:30:56,995] Trial 31 finished with value: 0.20076901240176218 and parameters: {'model_type': 'graphsage', 'hidden_dims': '[128, 64]', 'dropout': 0.1672065491799578, 'batch_norm': True, 'sage_aggr': 'mean', 'sage_normalize': True, 'sage_project': False, 'lr': 1.7386897625142058e-05, 'weight_decay': 3.11008738145851e-05, 'epochs': 199, 'loss': 'mse', 'optimizer': 'adam', 'graph_mode': 'cutoff', 'cutoff': 0.6467149363207914, 'grm_norm': 'gcn', 'self_loops': False, 'use_snp_selection': True, 'num_snps': 53812, 'graphsage_batch_size': 32}. Best is trial 19 with value: 0.2325487041055966.
[I 2025-12-06 12:31:56,044] Trial 32 finished with value: 0.20120798768176704 and parameters: {'model_type': 'graphsage', 'hidden_dims': '[128, 64]', 'dropout': 0.13832193986641145, 'batch_norm': True, 'sage_aggr': 'mean', 'sage_normalize': True, 'sage_project': False, 'lr': 3.2742816545561085e-05, 'weight_decay': 0.00014911069899856862, 'epochs': 205, 'loss': 'mse', 'optimizer': 'adam', 'graph_mode': 'cutoff', 'cutoff': 0.7212788630488985, 'grm_norm': 'gcn', 'self_loops': False, 'use_snp_selection': True, 'num_snps': 54190, 'graphsage_batch_size': 32}. Best is trial 19 with value: 0.2325487041055966.
[I 2025-12-06 12:32:46,495] Trial 33 finished with value: 0.20405984214419473 and parameters: {'model_type': 'graphsage', 'hidden_dims': '[128, 64]', 'dropout': 0.18817976755214402, 'batch_norm': True, 'sage_aggr': 'mean', 'sage_normalize': True, 'sage_project': False, 'lr': 1.4987587097003497e-05, 'weight_decay': 4.341590286182257e-05, 'epochs': 233, 'loss': 'mse', 'optimizer': 'adam', 'graph_mode': 'cutoff', 'cutoff': 0.6566161871517684, 'grm_norm': 'gcn', 'self_loops': False, 'use_snp_selection': True, 'num_snps': 38900, 'graphsage_batch_size': 32}. Best is trial 19 with value: 0.2325487041055966.
[I 2025-12-06 12:33:11,291] Trial 34 finished with value: 0.21659623799254546 and parameters: {'model_type': 'graphsage', 'hidden_dims': '[128, 64]', 'dropout': 0.2400663747467617, 'batch_norm': True, 'sage_aggr': 'mean', 'sage_normalize': True, 'sage_project': False, 'lr': 4.155015215039251e-05, 'weight_decay': 2.0519090473297458e-05, 'epochs': 189, 'loss': 'mse', 'optimizer': 'adam', 'graph_mode': 'cutoff', 'cutoff': 0.8142331625604354, 'grm_norm': 'gcn', 'self_loops': False, 'use_snp_selection': True, 'num_snps': 13469, 'graphsage_batch_size': 8}. Best is trial 19 with value: 0.2325487041055966.
[I 2025-12-06 12:35:25,417] Trial 35 finished with value: 0.21995340827140614 and parameters: {'model_type': 'graphsage', 'hidden_dims': '[512, 64]', 'dropout': 0.29679174936218106, 'batch_norm': True, 'sage_aggr': 'mean', 'sage_normalize': True, 'sage_project': False, 'lr': 2.5232396841974224e-05, 'weight_decay': 1.92347126947221e-06, 'epochs': 223, 'loss': 'mse', 'optimizer': 'adam', 'graph_mode': 'cutoff', 'cutoff': 0.7404791232382397, 'grm_norm': 'gcn', 'self_loops': False, 'use_snp_selection': False, 'graphsage_batch_size': 512}. Best is trial 19 with value: 0.2325487041055966.
[I 2025-12-06 12:37:29,979] Trial 36 finished with value: 0.18987535955512308 and parameters: {'model_type': 'graphsage', 'hidden_dims': '[512, 128]', 'dropout': 0.13901694467968242, 'batch_norm': True, 'sage_aggr': 'max', 'sage_normalize': False, 'sage_project': False, 'lr': 0.00022625904126388915, 'weight_decay': 7.836946092283073e-06, 'epochs': 208, 'loss': 'mse', 'optimizer': 'adam', 'graph_mode': 'knn', 'knn_k': 1, 'weighted_edges': False, 'symmetrize_mode': 'union', 'self_loops': False, 'use_snp_selection': True, 'num_snps': 49631, 'graphsage_batch_size': 64}. Best is trial 19 with value: 0.2325487041055966.
[I 2025-12-06 12:39:35,302] Trial 37 finished with value: 0.1879789439058163 and parameters: {'model_type': 'graphsage', 'hidden_dims': '[128, 64]', 'dropout': 0.25623758177209865, 'batch_norm': True, 'sage_aggr': 'mean', 'sage_normalize': True, 'sage_project': False, 'lr': 1.1013651781805607e-05, 'weight_decay': 0.00010572354311976573, 'epochs': 238, 'loss': 'mae', 'optimizer': 'adam', 'graph_mode': 'cutoff', 'cutoff': 0.46703890741440995, 'grm_norm': 'gcn', 'self_loops': False, 'use_snp_selection': True, 'num_snps': 53315, 'graphsage_batch_size': 32}. Best is trial 19 with value: 0.2325487041055966.
[I 2025-12-06 12:39:55,006] Trial 38 finished with value: 0.19207562627899347 and parameters: {'model_type': 'graphsage', 'hidden_dims': '[128, 64]', 'dropout': 0.21333867070155696, 'batch_norm': False, 'sage_aggr': 'max', 'sage_normalize': True, 'sage_project': False, 'lr': 5.119768070901629e-05, 'weight_decay': 2.2995517062785937e-07, 'epochs': 113, 'loss': 'mse', 'optimizer': 'adam', 'graph_mode': 'knn', 'knn_k': 10, 'weighted_edges': False, 'symmetrize_mode': 'union', 'self_loops': False, 'use_snp_selection': True, 'num_snps': 2392, 'graphsage_batch_size': 256}. Best is trial 19 with value: 0.2325487041055966.
[I 2025-12-06 12:41:32,480] Trial 39 finished with value: 0.2281536885368264 and parameters: {'model_type': 'graphsage', 'hidden_dims': '[512, 64]', 'dropout': 0.2946365320404709, 'batch_norm': True, 'sage_aggr': 'mean', 'sage_normalize': True, 'sage_project': False, 'lr': 0.00010877228713900936, 'weight_decay': 1.3708842748115349e-05, 'epochs': 154, 'loss': 'mae', 'optimizer': 'adam', 'graph_mode': 'cutoff', 'cutoff': 0.5831247857986599, 'grm_norm': 'cosine_then_gcn', 'self_loops': False, 'use_snp_selection': False, 'graphsage_batch_size': 8}. Best is trial 19 with value: 0.2325487041055966.
[I 2025-12-06 12:42:48,394] Trial 40 finished with value: 0.18924765987856917 and parameters: {'model_type': 'graphsage', 'hidden_dims': '[512, 64]', 'dropout': 0.3034717903443437, 'batch_norm': True, 'sage_aggr': 'mean', 'sage_normalize': False, 'sage_project': False, 'lr': 0.00043259205841303134, 'weight_decay': 2.2139757738381984e-06, 'epochs': 121, 'loss': 'mae', 'optimizer': 'adam', 'graph_mode': 'knn', 'knn_k': 1, 'weighted_edges': True, 'symmetrize_mode': 'mutual', 'self_loops': False, 'use_snp_selection': False, 'graphsage_batch_size': 8}. Best is trial 19 with value: 0.2325487041055966.
[I 2025-12-06 12:44:31,116] Trial 41 finished with value: 0.23166709318623457 and parameters: {'model_type': 'graphsage', 'hidden_dims': '[512, 64]', 'dropout': 0.3578318529798919, 'batch_norm': True, 'sage_aggr': 'mean', 'sage_normalize': True, 'sage_project': False, 'lr': 0.00010261709676710787, 'weight_decay': 1.3811796238728997e-05, 'epochs': 164, 'loss': 'mae', 'optimizer': 'adam', 'graph_mode': 'cutoff', 'cutoff': 0.5932094818864686, 'grm_norm': 'cosine_then_gcn', 'self_loops': False, 'use_snp_selection': False, 'graphsage_batch_size': 8}. Best is trial 19 with value: 0.2325487041055966.
[I 2025-12-06 12:46:10,346] Trial 42 finished with value: 0.221952409498678 and parameters: {'model_type': 'graphsage', 'hidden_dims': '[512, 64]', 'dropout': 0.3624399406339226, 'batch_norm': True, 'sage_aggr': 'mean', 'sage_normalize': True, 'sage_project': False, 'lr': 0.00011404666406772152, 'weight_decay': 9.633974193404554e-06, 'epochs': 158, 'loss': 'mae', 'optimizer': 'adam', 'graph_mode': 'cutoff', 'cutoff': 0.6003985429074912, 'grm_norm': 'cosine_then_gcn', 'self_loops': False, 'use_snp_selection': False, 'graphsage_batch_size': 8}. Best is trial 19 with value: 0.2325487041055966.
[I 2025-12-06 12:47:53,708] Trial 43 finished with value: 0.22452640030477927 and parameters: {'model_type': 'graphsage', 'hidden_dims': '[512, 64]', 'dropout': 0.41026425678073, 'batch_norm': True, 'sage_aggr': 'mean', 'sage_normalize': True, 'sage_project': False, 'lr': 0.00019088137506954793, 'weight_decay': 1.4842872879750862e-05, 'epochs': 142, 'loss': 'mae', 'optimizer': 'adam', 'graph_mode': 'cutoff', 'cutoff': 0.47944736476378846, 'grm_norm': 'cosine_then_gcn', 'self_loops': False, 'use_snp_selection': False, 'graphsage_batch_size': 8}. Best is trial 19 with value: 0.2325487041055966.
[I 2025-12-06 12:49:40,791] Trial 44 finished with value: 0.20198407882920671 and parameters: {'model_type': 'graphsage', 'hidden_dims': '[512, 64]', 'dropout': 0.3273942315800904, 'batch_norm': False, 'sage_aggr': 'mean', 'sage_normalize': True, 'sage_project': False, 'lr': 0.0001034977948826621, 'weight_decay': 5.228439629342283e-06, 'epochs': 169, 'loss': 'mae', 'optimizer': 'adam', 'graph_mode': 'cutoff', 'cutoff': 0.5791316712150884, 'grm_norm': 'cosine_then_gcn', 'self_loops': False, 'use_snp_selection': False, 'graphsage_batch_size': 8}. Best is trial 19 with value: 0.2325487041055966.
[I 2025-12-06 12:50:53,258] Trial 45 finished with value: 0.22265297429762182 and parameters: {'model_type': 'graphsage', 'hidden_dims': '[512, 64]', 'dropout': 0.4111797733842376, 'batch_norm': True, 'sage_aggr': 'mean', 'sage_normalize': True, 'sage_project': False, 'lr': 0.000331213849660646, 'weight_decay': 8.302988835670003e-07, 'epochs': 86, 'loss': 'mae', 'optimizer': 'adam', 'graph_mode': 'cutoff', 'cutoff': 0.3351279958071441, 'grm_norm': 'cosine_then_gcn', 'self_loops': False, 'use_snp_selection': False, 'graphsage_batch_size': 8}. Best is trial 19 with value: 0.2325487041055966.
[I 2025-12-06 12:51:57,454] Trial 46 finished with value: 0.23041925569520544 and parameters: {'model_type': 'graphsage', 'hidden_dims': '[256, 128]', 'dropout': 0.27782150500697933, 'batch_norm': True, 'sage_aggr': 'max', 'sage_normalize': True, 'sage_project': False, 'lr': 0.0001668987848180532, 'weight_decay': 1.36291710463359e-05, 'epochs': 179, 'loss': 'mae', 'optimizer': 'adam', 'graph_mode': 'cutoff', 'cutoff': 0.681605870623554, 'grm_norm': 'cosine_then_gcn', 'self_loops': False, 'use_snp_selection': False, 'graphsage_batch_size': 8}. Best is trial 19 with value: 0.2325487041055966.
[I 2025-12-06 12:53:25,688] Trial 47 finished with value: 0.18472204909063045 and parameters: {'model_type': 'graphsage', 'hidden_dims': '[256, 128]', 'dropout': 0.34963987086247883, 'batch_norm': False, 'sage_aggr': 'max', 'sage_normalize': True, 'sage_project': False, 'lr': 0.00016153116628131207, 'weight_decay': 1.4195765780550203e-05, 'epochs': 178, 'loss': 'mae', 'optimizer': 'adam', 'graph_mode': 'knn', 'knn_k': 3, 'weighted_edges': False, 'symmetrize_mode': 'union', 'self_loops': False, 'use_snp_selection': False, 'graphsage_batch_size': 8}. Best is trial 19 with value: 0.2325487041055966.
