[I 2025-12-08 20:27:22,293] Trial 109 finished with value: 0.28611611938507187 and parameters: {'model_type': 'graphsage', 'hidden_dims': '[256, 128]', 'dropout': 0.538187817170101, 'batch_norm': False, 'sage_aggr': 'mean', 'sage_normalize': False, 'sage_project': False, 'lr': 2.1001546483898984e-05, 'weight_decay': 2.9799571073391954e-06, 'epochs': 338, 'loss': 'mse', 'optimizer': 'adam', 'graph_mode': 'cutoff', 'cutoff': 0.6386265135224448, 'grm_norm': 'cosine_then_gcn', 'self_loops': True, 'use_snp_selection': True, 'num_snps': 31267}. Best is trial 85 with value: 0.30546169084105435.
[I 2025-12-08 20:28:23,229] Trial 110 finished with value: 0.29640503945911706 and parameters: {'model_type': 'graphsage', 'hidden_dims': '[128, 64]', 'dropout': 0.5985615130828327, 'batch_norm': False, 'sage_aggr': 'mean', 'sage_normalize': False, 'sage_project': False, 'lr': 1.6193297131077276e-05, 'weight_decay': 3.844977787628882e-06, 'epochs': 307, 'loss': 'mse', 'optimizer': 'adam', 'graph_mode': 'cutoff', 'cutoff': 0.5644007180728462, 'grm_norm': 'cosine_then_gcn', 'self_loops': True, 'use_snp_selection': True, 'num_snps': 28596}. Best is trial 85 with value: 0.30546169084105435.
[I 2025-12-08 20:29:27,021] Trial 111 finished with value: 0.3044964386861314 and parameters: {'model_type': 'graphsage', 'hidden_dims': '[128, 64]', 'dropout': 0.5500866516925617, 'batch_norm': False, 'sage_aggr': 'mean', 'sage_normalize': False, 'sage_project': False, 'lr': 1.0187158373665274e-05, 'weight_decay': 1.4104212255078976e-06, 'epochs': 280, 'loss': 'mse', 'optimizer': 'adam', 'graph_mode': 'cutoff', 'cutoff': 0.5636715364938506, 'grm_norm': 'cosine_then_gcn', 'self_loops': True, 'use_snp_selection': True, 'num_snps': 33923}. Best is trial 85 with value: 0.30546169084105435.
[I 2025-12-08 20:30:38,457] Trial 112 finished with value: 0.3016620652830224 and parameters: {'model_type': 'graphsage', 'hidden_dims': '[128, 64]', 'dropout': 0.5578893052995517, 'batch_norm': False, 'sage_aggr': 'mean', 'sage_normalize': False, 'sage_project': False, 'lr': 1.2855800867097054e-05, 'weight_decay': 1.4392324446890097e-06, 'epochs': 321, 'loss': 'mse', 'optimizer': 'adam', 'graph_mode': 'cutoff', 'cutoff': 0.543909449296222, 'grm_norm': 'cosine_then_gcn', 'self_loops': True, 'use_snp_selection': True, 'num_snps': 33534}. Best is trial 85 with value: 0.30546169084105435.
[I 2025-12-08 20:33:22,289] Trial 113 finished with value: 0.29475373396779264 and parameters: {'model_type': 'graphsage', 'hidden_dims': '[128, 64]', 'dropout': 0.5535282606990694, 'batch_norm': False, 'sage_aggr': 'mean', 'sage_normalize': False, 'sage_project': False, 'lr': 1.7417956603488272e-05, 'weight_decay': 1.0734200164560058e-06, 'epochs': 324, 'loss': 'mse', 'optimizer': 'adam', 'graph_mode': 'cutoff', 'cutoff': 0.49645891984883345, 'grm_norm': 'cosine_then_gcn', 'self_loops': True, 'use_snp_selection': True, 'num_snps': 50712}. Best is trial 85 with value: 0.30546169084105435.
[I 2025-12-08 20:34:28,592] Trial 114 finished with value: 0.295547970185969 and parameters: {'model_type': 'graphsage', 'hidden_dims': '[128, 64]', 'dropout': 0.5040604325687069, 'batch_norm': False, 'sage_aggr': 'mean', 'sage_normalize': False, 'sage_project': False, 'lr': 1.1441131605567177e-05, 'weight_decay': 8.099266969219224e-07, 'epochs': 282, 'loss': 'mse', 'optimizer': 'adam', 'graph_mode': 'cutoff', 'cutoff': 0.544282401740474, 'grm_norm': 'cosine_then_gcn', 'self_loops': True, 'use_snp_selection': True, 'num_snps': 33474}. Best is trial 85 with value: 0.30546169084105435.
[I 2025-12-08 20:35:57,632] Trial 115 finished with value: 0.3031714766206055 and parameters: {'model_type': 'graphsage', 'hidden_dims': '[128, 64]', 'dropout': 0.5269380584987435, 'batch_norm': False, 'sage_aggr': 'mean', 'sage_normalize': False, 'sage_project': False, 'lr': 1.3308750600220215e-05, 'weight_decay': 1.4734271451383002e-06, 'epochs': 199, 'loss': 'mse', 'optimizer': 'adam', 'graph_mode': 'cutoff', 'cutoff': 0.5287490913687123, 'grm_norm': 'cosine_then_gcn', 'self_loops': True, 'use_snp_selection': True, 'num_snps': 54506}. Best is trial 85 with value: 0.30546169084105435.
[I 2025-12-08 20:37:57,313] Trial 116 finished with value: 0.29404252240666306 and parameters: {'model_type': 'graphsage', 'hidden_dims': '[256, 128, 64]', 'dropout': 0.5112324974605272, 'batch_norm': False, 'sage_aggr': 'mean', 'sage_normalize': False, 'sage_project': False, 'lr': 1.4674907897997644e-05, 'weight_decay': 1.3956029681955363e-06, 'epochs': 200, 'loss': 'mse', 'optimizer': 'adam', 'graph_mode': 'cutoff', 'cutoff': 0.5196868661125476, 'grm_norm': 'cosine_then_gcn', 'self_loops': False, 'use_snp_selection': True, 'num_snps': 55025}. Best is trial 85 with value: 0.30546169084105435.
[I 2025-12-08 20:38:55,212] Trial 117 finished with value: 0.30482048574978265 and parameters: {'model_type': 'graphsage', 'hidden_dims': '[128, 64]', 'dropout': 0.5271268882796072, 'batch_norm': False, 'sage_aggr': 'mean', 'sage_normalize': False, 'sage_project': False, 'lr': 1.9551084642709125e-05, 'weight_decay': 7.356414525316059e-07, 'epochs': 182, 'loss': 'mse', 'optimizer': 'adam', 'graph_mode': 'cutoff', 'cutoff': 0.5335041241296874, 'grm_norm': 'cosine_then_gcn', 'self_loops': True, 'use_snp_selection': True, 'num_snps': 36443}. Best is trial 85 with value: 0.30546169084105435.
[I 2025-12-08 20:40:01,504] Trial 118 finished with value: 0.30272919585545044 and parameters: {'model_type': 'graphsage', 'hidden_dims': '[128, 64]', 'dropout': 0.5252770769581953, 'batch_norm': False, 'sage_aggr': 'mean', 'sage_normalize': False, 'sage_project': False, 'lr': 2.0198694063578893e-05, 'weight_decay': 1.08469142487268e-06, 'epochs': 223, 'loss': 'mse', 'optimizer': 'adam', 'graph_mode': 'cutoff', 'cutoff': 0.5355802073388014, 'grm_norm': 'cosine_then_gcn', 'self_loops': True, 'use_snp_selection': True, 'num_snps': 36295}. Best is trial 85 with value: 0.30546169084105435.
[I 2025-12-08 20:42:26,474] Trial 119 finished with value: 0.24177653598001445 and parameters: {'model_type': 'graphsage', 'hidden_dims': '[128, 64]', 'dropout': 0.5243451352747676, 'batch_norm': True, 'sage_aggr': 'mean', 'sage_normalize': False, 'sage_project': False, 'lr': 1.909346151604607e-05, 'weight_decay': 1.0235151528798723e-06, 'epochs': 187, 'loss': 'mae', 'optimizer': 'adam', 'graph_mode': 'cutoff', 'cutoff': 0.46717875570619494, 'grm_norm': 'cosine_then_gcn', 'self_loops': True, 'use_snp_selection': True, 'num_snps': 57234}. Best is trial 85 with value: 0.30546169084105435.
[I 2025-12-08 20:45:49,952] Trial 120 finished with value: 0.2905896066239856 and parameters: {'model_type': 'graphsage', 'hidden_dims': '[128, 64]', 'dropout': 0.5301984867813778, 'batch_norm': False, 'sage_aggr': 'mean', 'sage_normalize': True, 'sage_project': False, 'lr': 0.004343252448614438, 'weight_decay': 1.4839836173074343e-06, 'epochs': 261, 'loss': 'mse', 'optimizer': 'adam', 'graph_mode': 'knn', 'knn_k': 6, 'weighted_edges': True, 'symmetrize_mode': 'union', 'self_loops': True, 'use_snp_selection': True, 'num_snps': 35928}. Best is trial 85 with value: 0.30546169084105435.
[I 2025-12-08 20:46:50,599] Trial 121 finished with value: 0.2959879536440625 and parameters: {'model_type': 'graphsage', 'hidden_dims': '[128, 64]', 'dropout': 0.5411396936345045, 'batch_norm': False, 'sage_aggr': 'mean', 'sage_normalize': False, 'sage_project': False, 'lr': 1.3264394706774147e-05, 'weight_decay': 8.197449660788912e-07, 'epochs': 226, 'loss': 'mse', 'optimizer': 'adam', 'graph_mode': 'cutoff', 'cutoff': 0.5334153057911875, 'grm_norm': 'cosine_then_gcn', 'self_loops': True, 'use_snp_selection': True, 'num_snps': 34238}. Best is trial 85 with value: 0.30546169084105435.
[I 2025-12-08 20:47:57,228] Trial 122 finished with value: 0.29845536920479604 and parameters: {'model_type': 'graphsage', 'hidden_dims': '[128, 64]', 'dropout': 0.5579901148877625, 'batch_norm': False, 'sage_aggr': 'mean', 'sage_normalize': False, 'sage_project': False, 'lr': 1.0052758758834823e-05, 'weight_decay': 7.396772045529302e-07, 'epochs': 218, 'loss': 'mse', 'optimizer': 'adam', 'graph_mode': 'cutoff', 'cutoff': 0.5832033757261974, 'grm_norm': 'cosine_then_gcn', 'self_loops': True, 'use_snp_selection': True, 'num_snps': 40535}. Best is trial 85 with value: 0.30546169084105435.
[I 2025-12-08 20:49:11,918] Trial 123 finished with value: 0.29702971208647144 and parameters: {'model_type': 'graphsage', 'hidden_dims': '[128, 64]', 'dropout': 0.4997147300158501, 'batch_norm': False, 'sage_aggr': 'mean', 'sage_normalize': False, 'sage_project': False, 'lr': 2.2437105367061334e-05, 'weight_decay': 2.585759077884514e-06, 'epochs': 182, 'loss': 'mse', 'optimizer': 'adam', 'graph_mode': 'cutoff', 'cutoff': 0.49524292690926475, 'grm_norm': 'cosine_then_gcn', 'self_loops': True, 'use_snp_selection': True, 'num_snps': 36620}. Best is trial 85 with value: 0.30546169084105435.
[I 2025-12-08 20:51:25,582] Trial 124 finished with value: 0.29549070764092117 and parameters: {'model_type': 'graphsage', 'hidden_dims': '[128, 64]', 'dropout': 0.5373884985232709, 'batch_norm': False, 'sage_aggr': 'mean', 'sage_normalize': False, 'sage_project': False, 'lr': 1.7297841691997635e-05, 'weight_decay': 1.150625976242124e-06, 'epochs': 247, 'loss': 'mse', 'optimizer': 'adam', 'graph_mode': 'cutoff', 'cutoff': 0.5127877311603812, 'grm_norm': 'cosine_then_gcn', 'self_loops': True, 'use_snp_selection': True, 'num_snps': 59884}. Best is trial 85 with value: 0.30546169084105435.
[I 2025-12-08 20:52:22,526] Trial 125 finished with value: 0.29179461623910063 and parameters: {'model_type': 'graphsage', 'hidden_dims': '[128, 64]', 'dropout': 0.5145020225255075, 'batch_norm': False, 'sage_aggr': 'mean', 'sage_normalize': False, 'sage_project': False, 'lr': 1.511243565134432e-05, 'weight_decay': 4.2741254130111396e-07, 'epochs': 198, 'loss': 'mse', 'optimizer': 'adam', 'graph_mode': 'cutoff', 'cutoff': 0.5293720665537234, 'grm_norm': 'cosine_then_gcn', 'self_loops': True, 'use_snp_selection': True, 'num_snps': 31938}. Best is trial 85 with value: 0.30546169084105435.
[I 2025-12-08 20:53:26,567] Trial 126 finished with value: 0.3016072426635116 and parameters: {'model_type': 'graphsage', 'hidden_dims': '[128, 64]', 'dropout': 0.4747274370839936, 'batch_norm': False, 'sage_aggr': 'mean', 'sage_normalize': False, 'sage_project': False, 'lr': 1.2749836370054535e-05, 'weight_decay': 5.604936765234039e-07, 'epochs': 206, 'loss': 'mse', 'optimizer': 'adam', 'graph_mode': 'cutoff', 'cutoff': 0.541228300199469, 'grm_norm': 'cosine_then_gcn', 'self_loops': True, 'use_snp_selection': True, 'num_snps': 38945}. Best is trial 85 with value: 0.30546169084105435.
[I 2025-12-08 20:55:19,807] Trial 127 finished with value: 0.29808202389227617 and parameters: {'model_type': 'graphsage', 'hidden_dims': '[512, 64]', 'dropout': 0.5263467826337871, 'batch_norm': False, 'sage_aggr': 'mean', 'sage_normalize': False, 'sage_project': False, 'lr': 1.2786584898874794e-05, 'weight_decay': 5.488616951607276e-07, 'epochs': 208, 'loss': 'mse', 'optimizer': 'adam', 'graph_mode': 'cutoff', 'cutoff': 0.5415805982687605, 'grm_norm': 'cosine_then_gcn', 'self_loops': True, 'use_snp_selection': True, 'num_snps': 39355}. Best is trial 85 with value: 0.30546169084105435.
[I 2025-12-08 20:57:42,453] Trial 128 finished with value: 0.28822125968792794 and parameters: {'model_type': 'graphsage', 'hidden_dims': '[512, 128]', 'dropout': 0.4760015968726727, 'batch_norm': False, 'sage_aggr': 'mean', 'sage_normalize': False, 'sage_project': False, 'lr': 1.9140561857200467e-05, 'weight_decay': 1.9756484420999536e-06, 'epochs': 215, 'loss': 'mse', 'optimizer': 'adam', 'graph_mode': 'cutoff', 'cutoff': 0.49525605034825054, 'grm_norm': 'cosine', 'self_loops': True, 'use_snp_selection': False}. Best is trial 85 with value: 0.30546169084105435.
[I 2025-12-08 20:58:38,378] Trial 129 finished with value: 0.2998480975280634 and parameters: {'model_type': 'graphsage', 'hidden_dims': '[128, 64]', 'dropout': 0.4941698195804987, 'batch_norm': False, 'sage_aggr': 'mean', 'sage_normalize': False, 'sage_project': False, 'lr': 1.1654359713080075e-05, 'weight_decay': 7.014919759531262e-07, 'epochs': 193, 'loss': 'mse', 'optimizer': 'adam', 'graph_mode': 'cutoff', 'cutoff': 0.5509235500076359, 'grm_norm': 'cosine_then_gcn', 'self_loops': True, 'use_snp_selection': True, 'num_snps': 34801}. Best is trial 85 with value: 0.30546169084105435.
[I 2025-12-08 20:59:58,822] Trial 130 finished with value: 0.29869770761256603 and parameters: {'model_type': 'graphsage', 'hidden_dims': '[128, 64]', 'dropout': 0.5074284780229275, 'batch_norm': False, 'sage_aggr': 'mean', 'sage_normalize': False, 'sage_project': False, 'lr': 1.3778329509693452e-05, 'weight_decay': 9.68345467839909e-07, 'epochs': 292, 'loss': 'mse', 'optimizer': 'adam', 'graph_mode': 'cutoff', 'cutoff': 0.5717260468535691, 'grm_norm': 'cosine_then_gcn', 'self_loops': True, 'use_snp_selection': True, 'num_snps': 42137}. Best is trial 85 with value: 0.30546169084105435.
[I 2025-12-08 21:00:57,105] Trial 131 finished with value: 0.2972913141018051 and parameters: {'model_type': 'graphsage', 'hidden_dims': '[128, 64]', 'dropout': 0.4691044839554325, 'batch_norm': False, 'sage_aggr': 'mean', 'sage_normalize': False, 'sage_project': False, 'lr': 1.6174420451241926e-05, 'weight_decay': 1.4832934520550212e-06, 'epochs': 205, 'loss': 'mse', 'optimizer': 'adam', 'graph_mode': 'cutoff', 'cutoff': 0.5317753342728799, 'grm_norm': 'cosine_then_gcn', 'self_loops': True, 'use_snp_selection': True, 'num_snps': 32857}. Best is trial 85 with value: 0.30546169084105435.
[I 2025-12-08 21:01:52,913] Trial 132 finished with value: 0.3006887510873269 and parameters: {'model_type': 'graphsage', 'hidden_dims': '[128, 64]', 'dropout': 0.47570541160046076, 'batch_norm': False, 'sage_aggr': 'mean', 'sage_normalize': False, 'sage_project': False, 'lr': 1.468613288662087e-05, 'weight_decay': 1.2293993315295722e-06, 'epochs': 187, 'loss': 'mse', 'optimizer': 'adam', 'graph_mode': 'cutoff', 'cutoff': 0.5971386475614883, 'grm_norm': 'cosine_then_gcn', 'self_loops': True, 'use_snp_selection': True, 'num_snps': 37419}. Best is trial 85 with value: 0.30546169084105435.
[I 2025-12-08 21:03:05,576] Trial 133 finished with value: 0.29122302913476106 and parameters: {'model_type': 'graphsage', 'hidden_dims': '[128, 64]', 'dropout': 0.47999637819823276, 'batch_norm': False, 'sage_aggr': 'mean', 'sage_normalize': False, 'sage_project': False, 'lr': 2.0270393197763205e-05, 'weight_decay': 1.2085252673731816e-06, 'epochs': 187, 'loss': 'mse', 'optimizer': 'adam', 'graph_mode': 'cutoff', 'cutoff': 0.5094912861277812, 'grm_norm': 'cosine_then_gcn', 'self_loops': True, 'use_snp_selection': True, 'num_snps': 39162}. Best is trial 85 with value: 0.30546169084105435.
[I 2025-12-08 21:04:00,285] Trial 134 finished with value: 0.29839484448744213 and parameters: {'model_type': 'graphsage', 'hidden_dims': '[128, 64]', 'dropout': 0.4510384250756441, 'batch_norm': False, 'sage_aggr': 'mean', 'sage_normalize': False, 'sage_project': False, 'lr': 1.1214953917926298e-05, 'weight_decay': 8.995938473598427e-07, 'epochs': 174, 'loss': 'mse', 'optimizer': 'adam', 'graph_mode': 'cutoff', 'cutoff': 0.5648348805332605, 'grm_norm': 'cosine_then_gcn', 'self_loops': True, 'use_snp_selection': True, 'num_snps': 37227}. Best is trial 85 with value: 0.30546169084105435.
[I 2025-12-08 21:05:14,172] Trial 135 finished with value: 0.29463745963142135 and parameters: {'model_type': 'graphsage', 'hidden_dims': '[128, 64]', 'dropout': 0.5188460363658858, 'batch_norm': False, 'sage_aggr': 'mean', 'sage_normalize': False, 'sage_project': False, 'lr': 1.0044706180847686e-05, 'weight_decay': 1.5336071723259758e-06, 'epochs': 231, 'loss': 'mse', 'optimizer': 'adam', 'graph_mode': 'cutoff', 'cutoff': 0.5969364548141218, 'grm_norm': 'cosine_then_gcn', 'self_loops': True, 'use_snp_selection': True, 'num_snps': 43752}. Best is trial 85 with value: 0.30546169084105435.
[I 2025-12-08 21:06:41,903] Trial 136 finished with value: 0.2975126190596807 and parameters: {'model_type': 'graphsage', 'hidden_dims': '[256, 128]', 'dropout': 0.5455721520733959, 'batch_norm': False, 'sage_aggr': 'mean', 'sage_normalize': False, 'sage_project': False, 'lr': 2.6258254503336708e-05, 'weight_decay': 5.807451526944882e-07, 'epochs': 273, 'loss': 'mse', 'optimizer': 'adam', 'graph_mode': 'cutoff', 'cutoff': 0.5443224436376861, 'grm_norm': 'cosine_then_gcn', 'self_loops': True, 'use_snp_selection': True, 'num_snps': 35757}. Best is trial 85 with value: 0.30546169084105435.
[I 2025-12-08 21:07:52,173] Trial 137 finished with value: 0.16291432055252714 and parameters: {'model_type': 'graphsage', 'hidden_dims': '[128, 64]', 'dropout': 0.4882967521258828, 'batch_norm': False, 'sage_aggr': 'mean', 'sage_normalize': False, 'sage_project': False, 'lr': 0.00027334307683071107, 'weight_decay': 2.0140095728006775e-06, 'epochs': 217, 'loss': 'mse', 'optimizer': 'adam', 'graph_mode': 'cutoff', 'cutoff': 0.5264874747919629, 'grm_norm': 'cosine_then_gcn', 'self_loops': False, 'use_snp_selection': True, 'num_snps': 37987}. Best is trial 85 with value: 0.30546169084105435.
[I 2025-12-08 21:09:36,682] Trial 138 finished with value: 0.292385514840021 and parameters: {'model_type': 'graphsage', 'hidden_dims': '[128, 64]', 'dropout': 0.5332345242980217, 'batch_norm': False, 'sage_aggr': 'mean', 'sage_normalize': False, 'sage_project': False, 'lr': 1.358825812439238e-05, 'weight_decay': 8.951650158141183e-06, 'epochs': 162, 'loss': 'mse', 'optimizer': 'adam', 'graph_mode': 'cutoff', 'cutoff': 0.47836448130632203, 'grm_norm': 'cosine_then_gcn', 'self_loops': True, 'use_snp_selection': True, 'num_snps': 48644}. Best is trial 85 with value: 0.30546169084105435.
[I 2025-12-08 21:10:34,952] Trial 139 finished with value: 0.30087369825010024 and parameters: {'model_type': 'graphsage', 'hidden_dims': '[128, 64]', 'dropout': 0.4323307643729805, 'batch_norm': False, 'sage_aggr': 'mean', 'sage_normalize': False, 'sage_project': False, 'lr': 1.7645990281994066e-05, 'weight_decay': 6.826255049471239e-07, 'epochs': 180, 'loss': 'mse', 'optimizer': 'adam', 'graph_mode': 'cutoff', 'cutoff': 0.6184241359465614, 'grm_norm': 'cosine_then_gcn', 'self_loops': True, 'use_snp_selection': True, 'num_snps': 40810}. Best is trial 85 with value: 0.30546169084105435.
[I 2025-12-08 21:11:36,438] Trial 140 finished with value: 0.28173771680567483 and parameters: {'model_type': 'graphsage', 'hidden_dims': '[128, 64]', 'dropout': 0.49486182481499985, 'batch_norm': False, 'sage_aggr': 'mean', 'sage_normalize': False, 'sage_project': False, 'lr': 2.252480243761893e-05, 'weight_decay': 6.858918854372957e-07, 'epochs': 179, 'loss': 'mae', 'optimizer': 'adam', 'graph_mode': 'cutoff', 'cutoff': 0.6151130160975108, 'grm_norm': 'cosine_then_gcn', 'self_loops': True, 'use_snp_selection': True, 'num_snps': 41564}. Best is trial 85 with value: 0.30546169084105435.
[I 2025-12-08 21:12:33,228] Trial 141 finished with value: 0.3107020514662844 and parameters: {'model_type': 'graphsage', 'hidden_dims': '[128, 64]', 'dropout': 0.4402294447338479, 'batch_norm': False, 'sage_aggr': 'mean', 'sage_normalize': False, 'sage_project': False, 'lr': 1.7296579300430808e-05, 'weight_decay': 8.27760419414054e-07, 'epochs': 171, 'loss': 'mse', 'optimizer': 'adam', 'graph_mode': 'cutoff', 'cutoff': 0.5740675559407559, 'grm_norm': 'cosine_then_gcn', 'self_loops': True, 'use_snp_selection': True, 'num_snps': 38798}. Best is trial 141 with value: 0.3107020514662844.
[I 2025-12-08 21:13:38,556] Trial 142 finished with value: 0.29721735767576074 and parameters: {'model_type': 'graphsage', 'hidden_dims': '[128, 64]', 'dropout': 0.4204086852387033, 'batch_norm': False, 'sage_aggr': 'mean', 'sage_normalize': False, 'sage_project': False, 'lr': 1.7420290441742846e-05, 'weight_decay': 9.882398588208127e-07, 'epochs': 185, 'loss': 'mse', 'optimizer': 'adam', 'graph_mode': 'cutoff', 'cutoff': 0.5792424991499202, 'grm_norm': 'cosine_then_gcn', 'self_loops': True, 'use_snp_selection': True, 'num_snps': 43694}. Best is trial 141 with value: 0.3107020514662844.
[I 2025-12-08 21:14:35,364] Trial 143 finished with value: 0.30035846339458894 and parameters: {'model_type': 'graphsage', 'hidden_dims': '[128, 64]', 'dropout': 0.4704606469018738, 'batch_norm': False, 'sage_aggr': 'mean', 'sage_normalize': False, 'sage_project': False, 'lr': 1.4944906522009314e-05, 'weight_decay': 1.3318919318898472e-06, 'epochs': 172, 'loss': 'mse', 'optimizer': 'adam', 'graph_mode': 'cutoff', 'cutoff': 0.6247829109290122, 'grm_norm': 'cosine_then_gcn', 'self_loops': True, 'use_snp_selection': True, 'num_snps': 40047}. Best is trial 141 with value: 0.3107020514662844.
[I 2025-12-08 21:15:32,749] Trial 144 finished with value: 0.2968220577746079 and parameters: {'model_type': 'graphsage', 'hidden_dims': '[128, 64]', 'dropout': 0.4305044126463815, 'batch_norm': False, 'sage_aggr': 'mean', 'sage_normalize': False, 'sage_project': False, 'lr': 1.7713704811063e-05, 'weight_decay': 1.1358876658528555e-06, 'epochs': 193, 'loss': 'mse', 'optimizer': 'adam', 'graph_mode': 'cutoff', 'cutoff': 0.6049902983923212, 'grm_norm': 'cosine_then_gcn', 'self_loops': True, 'use_snp_selection': True, 'num_snps': 36762}. Best is trial 141 with value: 0.3107020514662844.
[I 2025-12-08 21:16:34,331] Trial 145 finished with value: 0.3013474978750542 and parameters: {'model_type': 'graphsage', 'hidden_dims': '[128, 64]', 'dropout': 0.4380274409832357, 'batch_norm': False, 'sage_aggr': 'mean', 'sage_normalize': False, 'sage_project': False, 'lr': 1.2921270847085616e-05, 'weight_decay': 7.527806617067683e-07, 'epochs': 206, 'loss': 'mse', 'optimizer': 'adam', 'graph_mode': 'cutoff', 'cutoff': 0.5593609432265754, 'grm_norm': 'cosine_then_gcn', 'self_loops': True, 'use_snp_selection': True, 'num_snps': 38567}. Best is trial 141 with value: 0.3107020514662844.
