[I 2025-12-08 11:04:19,479] Trial 37 finished with value: 0.32810928524572697 and parameters: {'model_type': 'graphsage', 'hidden_dims': '[256, 128]', 'dropout': 0.13812964220754878, 'batch_norm': False, 'sage_aggr': 'mean', 'sage_normalize': False, 'sage_project': False, 'lr': 0.000300847607676769, 'weight_decay': 0.00015530413915868166, 'epochs': 58, 'loss': 'mae', 'optimizer': 'adam', 'graph_mode': 'cutoff', 'cutoff': 0.7518879206570337, 'grm_norm': 'none', 'self_loops': True, 'use_snp_selection': False}. Best is trial 35 with value: 0.36078329692315847.
[I 2025-12-08 11:04:46,813] Trial 38 finished with value: 0.33812669064330825 and parameters: {'model_type': 'graphsage', 'hidden_dims': '[256, 128]', 'dropout': 0.15533112732629112, 'batch_norm': True, 'sage_aggr': 'mean', 'sage_normalize': True, 'sage_project': False, 'lr': 0.000551580494843094, 'weight_decay': 1.3115748325890035e-07, 'epochs': 80, 'loss': 'mae', 'optimizer': 'adam', 'graph_mode': 'cutoff', 'cutoff': 0.8231698578737415, 'grm_norm': 'none', 'self_loops': True, 'use_snp_selection': False}. Best is trial 35 with value: 0.36078329692315847.
[I 2025-12-08 11:05:09,381] Trial 39 finished with value: 0.32782519692501616 and parameters: {'model_type': 'graphsage', 'hidden_dims': '[256, 128]', 'dropout': 0.1021446448715639, 'batch_norm': False, 'sage_aggr': 'mean', 'sage_normalize': False, 'sage_project': False, 'lr': 0.00019661694458845548, 'weight_decay': 0.0003580220243322852, 'epochs': 57, 'loss': 'mae', 'optimizer': 'adam', 'graph_mode': 'cutoff', 'cutoff': 0.612260527303609, 'grm_norm': 'none', 'self_loops': True, 'use_snp_selection': False}. Best is trial 35 with value: 0.36078329692315847.
[I 2025-12-08 11:05:29,691] Trial 40 finished with value: 0.3218786181873902 and parameters: {'model_type': 'graphsage', 'hidden_dims': '[128, 64]', 'dropout': 0.18426884263350793, 'batch_norm': True, 'sage_aggr': 'mean', 'sage_normalize': False, 'sage_project': False, 'lr': 0.0001155648216410352, 'weight_decay': 1.9181496998445933e-05, 'epochs': 83, 'loss': 'mae', 'optimizer': 'adam', 'graph_mode': 'cutoff', 'cutoff': 0.7237168897611324, 'grm_norm': 'none', 'self_loops': True, 'use_snp_selection': False}. Best is trial 35 with value: 0.36078329692315847.
[I 2025-12-08 11:06:01,250] Trial 41 finished with value: 0.3487515173234189 and parameters: {'model_type': 'graphsage', 'hidden_dims': '[256, 128]', 'dropout': 0.12661288079093153, 'batch_norm': False, 'sage_aggr': 'mean', 'sage_normalize': False, 'sage_project': False, 'lr': 6.404913987732367e-05, 'weight_decay': 0.00010360931226156814, 'epochs': 99, 'loss': 'mae', 'optimizer': 'adam', 'graph_mode': 'cutoff', 'cutoff': 0.647210146132537, 'grm_norm': 'none', 'self_loops': True, 'use_snp_selection': False}. Best is trial 35 with value: 0.36078329692315847.
[I 2025-12-08 11:06:39,054] Trial 42 finished with value: 0.3527368675979295 and parameters: {'model_type': 'graphsage', 'hidden_dims': '[256, 128]', 'dropout': 0.1056468318581595, 'batch_norm': False, 'sage_aggr': 'mean', 'sage_normalize': False, 'sage_project': False, 'lr': 9.415745132758728e-05, 'weight_decay': 5.200180121635392e-05, 'epochs': 129, 'loss': 'mae', 'optimizer': 'adam', 'graph_mode': 'cutoff', 'cutoff': 0.6995444205430535, 'grm_norm': 'none', 'self_loops': True, 'use_snp_selection': False}. Best is trial 35 with value: 0.36078329692315847.
[I 2025-12-08 11:07:16,074] Trial 43 finished with value: 0.34576233569267584 and parameters: {'model_type': 'graphsage', 'hidden_dims': '[256, 128]', 'dropout': 0.1531409106753081, 'batch_norm': False, 'sage_aggr': 'mean', 'sage_normalize': False, 'sage_project': False, 'lr': 0.00010336563179694512, 'weight_decay': 0.000585196450477742, 'epochs': 126, 'loss': 'mae', 'optimizer': 'adam', 'graph_mode': 'cutoff', 'cutoff': 0.8003799221273631, 'grm_norm': 'none', 'self_loops': True, 'use_snp_selection': False}. Best is trial 35 with value: 0.36078329692315847.
[I 2025-12-08 11:07:39,570] Trial 44 finished with value: 0.3383461495084632 and parameters: {'model_type': 'graphsage', 'hidden_dims': '[256, 128]', 'dropout': 0.1006332673332481, 'batch_norm': False, 'sage_aggr': 'mean', 'sage_normalize': False, 'sage_project': False, 'lr': 0.00015320230421066885, 'weight_decay': 5.521952931789506e-05, 'epochs': 62, 'loss': 'mae', 'optimizer': 'adam', 'graph_mode': 'cutoff', 'cutoff': 0.7174053139946485, 'grm_norm': 'none', 'self_loops': True, 'use_snp_selection': False}. Best is trial 35 with value: 0.36078329692315847.
[I 2025-12-08 11:08:14,784] Trial 45 finished with value: 0.3032542745550657 and parameters: {'model_type': 'graphsage', 'hidden_dims': '[256, 128, 64]', 'dropout': 0.19547390992615812, 'batch_norm': False, 'sage_aggr': 'mean', 'sage_normalize': True, 'sage_project': False, 'lr': 4.4072076511148966e-05, 'weight_decay': 4.4562413973700336e-05, 'epochs': 109, 'loss': 'mae', 'optimizer': 'adam', 'graph_mode': 'cutoff', 'cutoff': 0.5548721044080974, 'grm_norm': 'none', 'self_loops': True, 'use_snp_selection': False}. Best is trial 35 with value: 0.36078329692315847.
[I 2025-12-08 11:08:54,314] Trial 46 finished with value: 0.3495968023251933 and parameters: {'model_type': 'graphsage', 'hidden_dims': '[256, 128]', 'dropout': 0.15654749358946488, 'batch_norm': False, 'sage_aggr': 'mean', 'sage_normalize': False, 'sage_project': False, 'lr': 0.0004138604527908373, 'weight_decay': 0.0001536339194917404, 'epochs': 137, 'loss': 'mae', 'optimizer': 'adam', 'graph_mode': 'cutoff', 'cutoff': 0.6969334146225311, 'grm_norm': 'none', 'self_loops': True, 'use_snp_selection': False}. Best is trial 35 with value: 0.36078329692315847.
[I 2025-12-08 11:10:05,716] Trial 47 finished with value: 0.3488648297954997 and parameters: {'model_type': 'graphsage', 'hidden_dims': '[512, 64]', 'dropout': 0.12574549431802082, 'batch_norm': False, 'sage_aggr': 'mean', 'sage_normalize': False, 'sage_project': False, 'lr': 1.624796127462485e-05, 'weight_decay': 2.9345049850307037e-07, 'epochs': 154, 'loss': 'mae', 'optimizer': 'adam', 'graph_mode': 'cutoff', 'cutoff': 0.7780771738363337, 'grm_norm': 'none', 'self_loops': True, 'use_snp_selection': False}. Best is trial 35 with value: 0.36078329692315847.
[I 2025-12-08 11:10:54,022] Trial 48 finished with value: 0.3374384766256321 and parameters: {'model_type': 'graphsage', 'hidden_dims': '[256, 128]', 'dropout': 0.13334563216905063, 'batch_norm': True, 'sage_aggr': 'mean', 'sage_normalize': False, 'sage_project': False, 'lr': 0.0002572838300457167, 'weight_decay': 8.272470650160917e-05, 'epochs': 172, 'loss': 'mae', 'optimizer': 'adam', 'graph_mode': 'cutoff', 'cutoff': 0.6118753070601817, 'grm_norm': 'cosine_then_gcn', 'self_loops': True, 'use_snp_selection': False}. Best is trial 35 with value: 0.36078329692315847.
[I 2025-12-08 11:11:21,599] Trial 49 finished with value: 0.3152181309091492 and parameters: {'model_type': 'graphsage', 'hidden_dims': '[256, 128]', 'dropout': 0.23331482004206933, 'batch_norm': False, 'sage_aggr': 'mean', 'sage_normalize': True, 'sage_project': False, 'lr': 8.333128565948303e-05, 'weight_decay': 2.0810700668503363e-05, 'epochs': 81, 'loss': 'mae', 'optimizer': 'adam', 'graph_mode': 'cutoff', 'cutoff': 0.862943028748539, 'grm_norm': 'none', 'self_loops': True, 'use_snp_selection': False}. Best is trial 35 with value: 0.36078329692315847.
[I 2025-12-08 11:11:47,774] Trial 50 finished with value: 0.0 and parameters: {'model_type': 'graphsage', 'hidden_dims': '[128, 64]', 'dropout': 0.16260328392737924, 'batch_norm': False, 'sage_aggr': 'mean', 'sage_normalize': False, 'sage_project': False, 'lr': 0.008758834825604554, 'weight_decay': 5.9919372020029886e-06, 'epochs': 118, 'loss': 'mae', 'optimizer': 'adam', 'graph_mode': 'cutoff', 'cutoff': 0.5654756166307724, 'grm_norm': 'none', 'self_loops': True, 'use_snp_selection': False}. Best is trial 35 with value: 0.36078329692315847.
[I 2025-12-08 11:12:18,918] Trial 51 finished with value: 0.35276368968920674 and parameters: {'model_type': 'graphsage', 'hidden_dims': '[256, 128]', 'dropout': 0.11880969548373002, 'batch_norm': False, 'sage_aggr': 'mean', 'sage_normalize': False, 'sage_project': False, 'lr': 6.626331375707434e-05, 'weight_decay': 9.232234005599932e-05, 'epochs': 98, 'loss': 'mae', 'optimizer': 'adam', 'graph_mode': 'cutoff', 'cutoff': 0.7053182347075179, 'grm_norm': 'none', 'self_loops': True, 'use_snp_selection': False}. Best is trial 35 with value: 0.36078329692315847.
[I 2025-12-08 11:12:51,368] Trial 52 finished with value: 0.3514823076491765 and parameters: {'model_type': 'graphsage', 'hidden_dims': '[256, 128]', 'dropout': 0.12121902075137338, 'batch_norm': False, 'sage_aggr': 'mean', 'sage_normalize': False, 'sage_project': False, 'lr': 5.3884046401585415e-05, 'weight_decay': 0.00021151124615372954, 'epochs': 104, 'loss': 'mae', 'optimizer': 'adam', 'graph_mode': 'cutoff', 'cutoff': 0.7013126631712027, 'grm_norm': 'none', 'self_loops': True, 'use_snp_selection': False}. Best is trial 35 with value: 0.36078329692315847.
[I 2025-12-08 11:13:11,997] Trial 53 finished with value: 0.34025594890309924 and parameters: {'model_type': 'graphsage', 'hidden_dims': '[256, 128]', 'dropout': 0.19206172156674495, 'batch_norm': False, 'sage_aggr': 'mean', 'sage_normalize': False, 'sage_project': False, 'lr': 0.00014589967846998026, 'weight_decay': 3.727349934468218e-05, 'epochs': 49, 'loss': 'mae', 'optimizer': 'adam', 'graph_mode': 'cutoff', 'cutoff': 0.7638767281146063, 'grm_norm': 'none', 'self_loops': True, 'use_snp_selection': False}. Best is trial 35 with value: 0.36078329692315847.
[I 2025-12-08 11:13:37,537] Trial 54 finished with value: 0.3611266995749033 and parameters: {'model_type': 'graphsage', 'hidden_dims': '[256, 128]', 'dropout': 0.1441441121634222, 'batch_norm': False, 'sage_aggr': 'mean', 'sage_normalize': False, 'sage_project': False, 'lr': 9.858124596531639e-05, 'weight_decay': 7.933800374105994e-05, 'epochs': 71, 'loss': 'mae', 'optimizer': 'adam', 'graph_mode': 'cutoff', 'cutoff': 0.6273371750779947, 'grm_norm': 'none', 'self_loops': True, 'use_snp_selection': False}. Best is trial 54 with value: 0.3611266995749033.
[I 2025-12-08 11:14:04,132] Trial 55 finished with value: 0.3462129448201684 and parameters: {'model_type': 'graphsage', 'hidden_dims': '[256, 128]', 'dropout': 0.21847355700717944, 'batch_norm': False, 'sage_aggr': 'mean', 'sage_normalize': False, 'sage_project': False, 'lr': 3.7431696452268274e-05, 'weight_decay': 0.0005667074923969936, 'epochs': 72, 'loss': 'mae', 'optimizer': 'adam', 'graph_mode': 'cutoff', 'cutoff': 0.6382538489093312, 'grm_norm': 'cosine_then_gcn', 'self_loops': True, 'use_snp_selection': False}. Best is trial 54 with value: 0.3611266995749033.
[I 2025-12-08 11:14:50,281] Trial 56 finished with value: 0.320545480428252 and parameters: {'model_type': 'graphsage', 'hidden_dims': '[512, 64]', 'dropout': 0.15252271632504852, 'batch_norm': False, 'sage_aggr': 'mean', 'sage_normalize': False, 'sage_project': False, 'lr': 7.326723696112797e-05, 'weight_decay': 8.452983106776424e-05, 'epochs': 87, 'loss': 'mae', 'optimizer': 'adam', 'graph_mode': 'cutoff', 'cutoff': 0.5905435106620242, 'grm_norm': 'none', 'self_loops': True, 'use_snp_selection': False}. Best is trial 54 with value: 0.3611266995749033.
[I 2025-12-08 11:15:14,920] Trial 57 finished with value: 0.34214074157557645 and parameters: {'model_type': 'graphsage', 'hidden_dims': '[256, 128, 64]', 'dropout': 0.13810552704093473, 'batch_norm': False, 'sage_aggr': 'mean', 'sage_normalize': False, 'sage_project': False, 'lr': 0.0001788166536139702, 'weight_decay': 0.00014143727706432424, 'epochs': 66, 'loss': 'mae', 'optimizer': 'adam', 'graph_mode': 'cutoff', 'cutoff': 0.6221232570675591, 'grm_norm': 'none', 'self_loops': True, 'use_snp_selection': False}. Best is trial 54 with value: 0.3611266995749033.
[I 2025-12-08 11:15:36,030] Trial 58 finished with value: 0.31779587723345154 and parameters: {'model_type': 'graphsage', 'hidden_dims': '[256, 128]', 'dropout': 0.17038810749674171, 'batch_norm': False, 'sage_aggr': 'mean', 'sage_normalize': False, 'sage_project': False, 'lr': 0.00011455987934716225, 'weight_decay': 0.0003006287786364247, 'epochs': 51, 'loss': 'mae', 'optimizer': 'adam', 'graph_mode': 'cutoff', 'cutoff': 0.674280894699318, 'grm_norm': 'none', 'self_loops': True, 'use_snp_selection': False}. Best is trial 54 with value: 0.3611266995749033.
[I 2025-12-08 11:16:33,129] Trial 59 finished with value: 0.2631871009887006 and parameters: {'model_type': 'graphsage', 'hidden_dims': '[512, 256]', 'dropout': 0.5283066668330714, 'batch_norm': False, 'sage_aggr': 'mean', 'sage_normalize': False, 'sage_project': False, 'lr': 0.00023388208768325254, 'weight_decay': 0.0004094884773160361, 'epochs': 114, 'loss': 'mae', 'optimizer': 'adam', 'graph_mode': 'cutoff', 'cutoff': 0.7840383472991267, 'grm_norm': 'cosine_then_gcn', 'self_loops': True, 'use_snp_selection': False}. Best is trial 54 with value: 0.3611266995749033.
[I 2025-12-08 11:17:03,154] Trial 60 finished with value: 0.35104045538382483 and parameters: {'model_type': 'graphsage', 'hidden_dims': '[256, 128]', 'dropout': 0.12222224810602145, 'batch_norm': False, 'sage_aggr': 'mean', 'sage_normalize': False, 'sage_project': False, 'lr': 3.6792518314300506e-05, 'weight_decay': 0.00022191012530702953, 'epochs': 93, 'loss': 'mae', 'optimizer': 'adam', 'graph_mode': 'cutoff', 'cutoff': 0.7450082447627351, 'grm_norm': 'gcn', 'self_loops': False, 'use_snp_selection': False}. Best is trial 54 with value: 0.3611266995749033.
[I 2025-12-08 11:17:42,093] Trial 61 finished with value: 0.34787329599736716 and parameters: {'model_type': 'graphsage', 'hidden_dims': '[256, 128]', 'dropout': 0.10114260770565583, 'batch_norm': False, 'sage_aggr': 'mean', 'sage_normalize': False, 'sage_project': False, 'lr': 9.520808144091055e-05, 'weight_decay': 7.414190914207672e-05, 'epochs': 134, 'loss': 'mae', 'optimizer': 'adam', 'graph_mode': 'cutoff', 'cutoff': 0.668700507073068, 'grm_norm': 'none', 'self_loops': True, 'use_snp_selection': False}. Best is trial 54 with value: 0.3611266995749033.
[I 2025-12-08 11:18:08,315] Trial 62 finished with value: 0.3504623526280762 and parameters: {'model_type': 'graphsage', 'hidden_dims': '[256, 128]', 'dropout': 0.11692598809178545, 'batch_norm': False, 'sage_aggr': 'mean', 'sage_normalize': False, 'sage_project': False, 'lr': 5.178979743747614e-05, 'weight_decay': 4.045673921820047e-05, 'epochs': 75, 'loss': 'mae', 'optimizer': 'adam', 'graph_mode': 'cutoff', 'cutoff': 0.710634620270868, 'grm_norm': 'none', 'self_loops': True, 'use_snp_selection': False}. Best is trial 54 with value: 0.3611266995749033.
[I 2025-12-08 11:18:40,762] Trial 63 finished with value: 0.34794115321093266 and parameters: {'model_type': 'graphsage', 'hidden_dims': '[256, 128]', 'dropout': 0.14690873701673685, 'batch_norm': False, 'sage_aggr': 'mean', 'sage_normalize': False, 'sage_project': False, 'lr': 8.022195972708561e-05, 'weight_decay': 0.00011754863209022733, 'epochs': 104, 'loss': 'mae', 'optimizer': 'adam', 'graph_mode': 'cutoff', 'cutoff': 0.690802042345614, 'grm_norm': 'none', 'self_loops': True, 'use_snp_selection': False}. Best is trial 54 with value: 0.3611266995749033.
[I 2025-12-08 11:19:09,952] Trial 64 finished with value: 0.07609446025417668 and parameters: {'model_type': 'graphsage', 'hidden_dims': '[256, 128]', 'dropout': 0.17664750900108625, 'batch_norm': False, 'sage_aggr': 'mean', 'sage_normalize': False, 'sage_project': False, 'lr': 0.0033484319814467978, 'weight_decay': 4.9332058287601e-05, 'epochs': 86, 'loss': 'mae', 'optimizer': 'adam', 'graph_mode': 'cutoff', 'cutoff': 0.5817019508168277, 'grm_norm': 'none', 'self_loops': True, 'use_snp_selection': False}. Best is trial 54 with value: 0.3611266995749033.
[I 2025-12-08 11:20:44,367] Trial 65 finished with value: 0.3486224578100038 and parameters: {'model_type': 'graphsage', 'hidden_dims': '[256, 128]', 'dropout': 0.13656118021037728, 'batch_norm': False, 'sage_aggr': 'mean', 'sage_normalize': False, 'sage_project': False, 'lr': 0.00010026839157710746, 'weight_decay': 0.0001677461865856952, 'epochs': 125, 'loss': 'mae', 'optimizer': 'adam', 'graph_mode': 'knn', 'knn_k': 10, 'weighted_edges': True, 'symmetrize_mode': 'union', 'self_loops': True, 'use_snp_selection': False}. Best is trial 54 with value: 0.3611266995749033.
[I 2025-12-08 11:21:18,264] Trial 66 finished with value: 0.3332776899089652 and parameters: {'model_type': 'graphsage', 'hidden_dims': '[256, 128]', 'dropout': 0.20544455616729376, 'batch_norm': False, 'sage_aggr': 'mean', 'sage_normalize': False, 'sage_project': False, 'lr': 0.00012898984114822918, 'weight_decay': 2.7101451631684264e-05, 'epochs': 98, 'loss': 'mse', 'optimizer': 'adam', 'graph_mode': 'cutoff', 'cutoff': 0.5208956032313019, 'grm_norm': 'none', 'self_loops': True, 'use_snp_selection': False}. Best is trial 54 with value: 0.3611266995749033.
[I 2025-12-08 11:21:48,373] Trial 67 finished with value: 0.31414605360408465 and parameters: {'model_type': 'graphsage', 'hidden_dims': '[128, 64]', 'dropout': 0.11104775182526189, 'batch_norm': False, 'sage_aggr': 'mean', 'sage_normalize': True, 'sage_project': False, 'lr': 0.00016069926056188954, 'weight_decay': 8.15360327285925e-05, 'epochs': 148, 'loss': 'mae', 'optimizer': 'adam', 'graph_mode': 'cutoff', 'cutoff': 0.62607811264058, 'grm_norm': 'none', 'self_loops': True, 'use_snp_selection': False}. Best is trial 54 with value: 0.3611266995749033.
[I 2025-12-08 11:22:13,632] Trial 68 finished with value: 0.34267249164621294 and parameters: {'model_type': 'graphsage', 'hidden_dims': '[256, 128]', 'dropout': 0.16228072681727215, 'batch_norm': True, 'sage_aggr': 'mean', 'sage_normalize': False, 'sage_project': False, 'lr': 6.302715896243251e-05, 'weight_decay': 0.00025832991932753284, 'epochs': 70, 'loss': 'mae', 'optimizer': 'adam', 'graph_mode': 'cutoff', 'cutoff': 0.8276693211351056, 'grm_norm': 'gcn', 'self_loops': False, 'use_snp_selection': False}. Best is trial 54 with value: 0.3611266995749033.
[I 2025-12-08 11:23:16,682] Trial 69 finished with value: 0.180900325034431 and parameters: {'model_type': 'graphsage', 'hidden_dims': '[512, 64]', 'dropout': 0.1451382220939418, 'batch_norm': False, 'sage_aggr': 'mean', 'sage_normalize': False, 'sage_project': False, 'lr': 0.00037372736127899356, 'weight_decay': 6.543524782161612e-05, 'epochs': 130, 'loss': 'mae', 'optimizer': 'adam', 'graph_mode': 'cutoff', 'cutoff': 0.7336063844202196, 'grm_norm': 'cosine', 'self_loops': True, 'use_snp_selection': False}. Best is trial 54 with value: 0.3611266995749033.
[I 2025-12-08 11:25:23,874] Trial 70 finished with value: 0.35388507581467404 and parameters: {'model_type': 'graphsage', 'hidden_dims': '[512, 256]', 'dropout': 0.18489807920670573, 'batch_norm': False, 'sage_aggr': 'mean', 'sage_normalize': False, 'sage_project': False, 'lr': 4.6302870875670316e-05, 'weight_decay': 0.0001049309082166955, 'epochs': 203, 'loss': 'mse', 'optimizer': 'adam', 'graph_mode': 'knn', 'knn_k': 5, 'weighted_edges': True, 'symmetrize_mode': 'union', 'self_loops': True, 'use_snp_selection': False}. Best is trial 54 with value: 0.3611266995749033.
[I 2025-12-08 11:27:31,513] Trial 71 finished with value: 0.3551945857206171 and parameters: {'model_type': 'graphsage', 'hidden_dims': '[512, 256]', 'dropout': 0.12325078591934331, 'batch_norm': False, 'sage_aggr': 'mean', 'sage_normalize': False, 'sage_project': False, 'lr': 4.473262621449396e-05, 'weight_decay': 0.00013046426700274275, 'epochs': 204, 'loss': 'mse', 'optimizer': 'adam', 'graph_mode': 'knn', 'knn_k': 5, 'weighted_edges': True, 'symmetrize_mode': 'union', 'self_loops': True, 'use_snp_selection': False}. Best is trial 54 with value: 0.3611266995749033.
[I 2025-12-08 11:29:40,259] Trial 72 finished with value: 0.349516074725452 and parameters: {'model_type': 'graphsage', 'hidden_dims': '[512, 256]', 'dropout': 0.18823045507882402, 'batch_norm': False, 'sage_aggr': 'mean', 'sage_normalize': False, 'sage_project': False, 'lr': 3.040363717140361e-05, 'weight_decay': 0.00012169886470838446, 'epochs': 206, 'loss': 'mse', 'optimizer': 'adam', 'graph_mode': 'knn', 'knn_k': 5, 'weighted_edges': True, 'symmetrize_mode': 'union', 'self_loops': True, 'use_snp_selection': False}. Best is trial 54 with value: 0.3611266995749033.
[I 2025-12-08 11:31:57,535] Trial 73 finished with value: 0.36148264649527473 and parameters: {'model_type': 'graphsage', 'hidden_dims': '[512, 256]', 'dropout': 0.12542922542638812, 'batch_norm': False, 'sage_aggr': 'mean', 'sage_normalize': False, 'sage_project': False, 'lr': 5.314804759754882e-05, 'weight_decay': 9.504578472503782e-05, 'epochs': 187, 'loss': 'mse', 'optimizer': 'adam', 'graph_mode': 'knn', 'knn_k': 6, 'weighted_edges': True, 'symmetrize_mode': 'union', 'self_loops': True, 'use_snp_selection': False}. Best is trial 73 with value: 0.36148264649527473.
[I 2025-12-08 11:34:14,828] Trial 74 finished with value: 0.35625211856355155 and parameters: {'model_type': 'graphsage', 'hidden_dims': '[512, 256]', 'dropout': 0.13060587852944774, 'batch_norm': False, 'sage_aggr': 'mean', 'sage_normalize': False, 'sage_project': False, 'lr': 2.2219418677221068e-05, 'weight_decay': 0.0001968424751299146, 'epochs': 187, 'loss': 'mse', 'optimizer': 'adam', 'graph_mode': 'knn', 'knn_k': 6, 'weighted_edges': True, 'symmetrize_mode': 'union', 'self_loops': True, 'use_snp_selection': False}. Best is trial 73 with value: 0.36148264649527473.
