[I 2025-12-09 18:36:40,405] Trial 84 finished with value: 0.29091121583059676 and parameters: {'model_type': 'graphsage', 'hidden_dims': '[512, 128]', 'dropout': 0.37123583661621135, 'batch_norm': True, 'sage_aggr': 'mean', 'sage_normalize': True, 'sage_project': False, 'lr': 9.13823881691908e-05, 'weight_decay': 0.00027262768557095624, 'epochs': 336, 'loss': 'mse', 'optimizer': 'adam', 'graph_mode': 'cutoff', 'cutoff': 0.34355567288019734, 'grm_norm': 'gcn', 'self_loops': False, 'use_snp_selection': True, 'num_snps': 15947}. Best is trial 71 with value: 0.2956582821015444.
[I 2025-12-09 18:37:37,219] Trial 85 finished with value: 0.27366633804938456 and parameters: {'model_type': 'graphsage', 'hidden_dims': '[128, 64]', 'dropout': 0.3733453344863931, 'batch_norm': True, 'sage_aggr': 'mean', 'sage_normalize': True, 'sage_project': False, 'lr': 8.547402016081117e-05, 'weight_decay': 4.4898517340829385e-05, 'epochs': 335, 'loss': 'mse', 'optimizer': 'adam', 'graph_mode': 'cutoff', 'cutoff': 0.3430927747610317, 'grm_norm': 'gcn', 'self_loops': False, 'use_snp_selection': True, 'num_snps': 18139}. Best is trial 71 with value: 0.2956582821015444.
[I 2025-12-09 18:38:51,591] Trial 86 finished with value: 0.28676344813521587 and parameters: {'model_type': 'graphsage', 'hidden_dims': '[512, 128]', 'dropout': 0.34862753073894365, 'batch_norm': True, 'sage_aggr': 'mean', 'sage_normalize': True, 'sage_project': False, 'lr': 5.363398175757886e-05, 'weight_decay': 0.0002245043620949278, 'epochs': 344, 'loss': 'mse', 'optimizer': 'adam', 'graph_mode': 'cutoff', 'cutoff': 0.2650397295253203, 'grm_norm': 'gcn', 'self_loops': False, 'use_snp_selection': True, 'num_snps': 12517}. Best is trial 71 with value: 0.2956582821015444.
[I 2025-12-09 18:40:08,248] Trial 87 finished with value: 0.2878017123846357 and parameters: {'model_type': 'graphsage', 'hidden_dims': '[512, 128]', 'dropout': 0.42719682089010425, 'batch_norm': True, 'sage_aggr': 'mean', 'sage_normalize': True, 'sage_project': False, 'lr': 0.00015578541768534692, 'weight_decay': 2.3579880312995326e-05, 'epochs': 329, 'loss': 'mse', 'optimizer': 'adam', 'graph_mode': 'cutoff', 'cutoff': 0.3238567042922807, 'grm_norm': 'gcn', 'self_loops': False, 'use_snp_selection': True, 'num_snps': 15653}. Best is trial 71 with value: 0.2956582821015444.
[I 2025-12-09 18:40:39,650] Trial 88 finished with value: 0.26823676438940974 and parameters: {'model_type': 'graphsage', 'hidden_dims': '[512, 64]', 'dropout': 0.4488412018294126, 'batch_norm': True, 'sage_aggr': 'mean', 'sage_normalize': True, 'sage_project': False, 'lr': 0.00010139938567210254, 'weight_decay': 0.0004404619935421483, 'epochs': 47, 'loss': 'mse', 'optimizer': 'adam', 'graph_mode': 'cutoff', 'cutoff': 0.36929289623382466, 'grm_norm': 'gcn', 'self_loops': False, 'use_snp_selection': True, 'num_snps': 8350}. Best is trial 71 with value: 0.2956582821015444.
[I 2025-12-09 18:42:11,982] Trial 89 finished with value: 0.28235047405493435 and parameters: {'model_type': 'graphsage', 'hidden_dims': '[512, 128]', 'dropout': 0.33911386800494847, 'batch_norm': True, 'sage_aggr': 'mean', 'sage_normalize': True, 'sage_project': False, 'lr': 0.0001949629862094114, 'weight_decay': 7.402884449619339e-07, 'epochs': 293, 'loss': 'mse', 'optimizer': 'adam', 'graph_mode': 'cutoff', 'cutoff': 0.3951792771925077, 'grm_norm': 'gcn', 'self_loops': False, 'use_snp_selection': True, 'num_snps': 23703}. Best is trial 71 with value: 0.2956582821015444.
[I 2025-12-09 18:43:32,242] Trial 90 finished with value: 0.2844033123364961 and parameters: {'model_type': 'graphsage', 'hidden_dims': '[512, 128]', 'dropout': 0.31411273816432606, 'batch_norm': True, 'sage_aggr': 'mean', 'sage_normalize': True, 'sage_project': False, 'lr': 8.131297699712105e-05, 'weight_decay': 0.0005955554244634529, 'epochs': 268, 'loss': 'mse', 'optimizer': 'adam', 'graph_mode': 'knn', 'knn_k': 10, 'weighted_edges': False, 'symmetrize_mode': 'mutual', 'self_loops': False, 'use_snp_selection': True, 'num_snps': 17681}. Best is trial 71 with value: 0.2956582821015444.
[I 2025-12-09 18:45:43,658] Trial 91 finished with value: 0.28457869272102243 and parameters: {'model_type': 'graphsage', 'hidden_dims': '[512, 128]', 'dropout': 0.4176939216125853, 'batch_norm': True, 'sage_aggr': 'mean', 'sage_normalize': True, 'sage_project': False, 'lr': 0.0001245406849325328, 'weight_decay': 1.110075889748696e-06, 'epochs': 318, 'loss': 'mse', 'optimizer': 'adam', 'graph_mode': 'cutoff', 'cutoff': 0.4285968876259049, 'grm_norm': 'gcn', 'self_loops': False, 'use_snp_selection': True, 'num_snps': 32419}. Best is trial 71 with value: 0.2956582821015444.
[I 2025-12-09 18:47:36,442] Trial 92 finished with value: 0.2928211097925885 and parameters: {'model_type': 'graphsage', 'hidden_dims': '[512, 128]', 'dropout': 0.3943128212178942, 'batch_norm': True, 'sage_aggr': 'mean', 'sage_normalize': True, 'sage_project': False, 'lr': 0.00010486695168647153, 'weight_decay': 0.00012885013160159436, 'epochs': 341, 'loss': 'mse', 'optimizer': 'adam', 'graph_mode': 'cutoff', 'cutoff': 0.4870927376910904, 'grm_norm': 'gcn', 'self_loops': False, 'use_snp_selection': True, 'num_snps': 27258}. Best is trial 71 with value: 0.2956582821015444.
[I 2025-12-09 18:48:37,512] Trial 93 finished with value: 0.284230466300352 and parameters: {'model_type': 'graphsage', 'hidden_dims': '[512, 128]', 'dropout': 0.37414198337227644, 'batch_norm': True, 'sage_aggr': 'mean', 'sage_normalize': True, 'sage_project': False, 'lr': 3.394265611753314e-05, 'weight_decay': 0.00012010703230431358, 'epochs': 341, 'loss': 'mse', 'optimizer': 'adam', 'graph_mode': 'cutoff', 'cutoff': 0.567500802122777, 'grm_norm': 'gcn', 'self_loops': False, 'use_snp_selection': True, 'num_snps': 12640}. Best is trial 71 with value: 0.2956582821015444.
[I 2025-12-09 18:50:41,796] Trial 94 finished with value: 0.2928569963111159 and parameters: {'model_type': 'graphsage', 'hidden_dims': '[512, 128]', 'dropout': 0.2965756208195678, 'batch_norm': True, 'sage_aggr': 'mean', 'sage_normalize': True, 'sage_project': False, 'lr': 0.00013000855127783277, 'weight_decay': 5.566961789790365e-06, 'epochs': 310, 'loss': 'mse', 'optimizer': 'adam', 'graph_mode': 'cutoff', 'cutoff': 0.5005901602988617, 'grm_norm': 'gcn', 'self_loops': False, 'use_snp_selection': True, 'num_snps': 32811}. Best is trial 71 with value: 0.2956582821015444.
[I 2025-12-09 18:53:10,458] Trial 95 finished with value: 0.29160701974758185 and parameters: {'model_type': 'graphsage', 'hidden_dims': '[512, 128]', 'dropout': 0.3603800610216198, 'batch_norm': True, 'sage_aggr': 'mean', 'sage_normalize': True, 'sage_project': False, 'lr': 0.000132067594470345, 'weight_decay': 0.00035806904064495873, 'epochs': 308, 'loss': 'mse', 'optimizer': 'adam', 'graph_mode': 'cutoff', 'cutoff': 0.5001743123839505, 'grm_norm': 'gcn', 'self_loops': False, 'use_snp_selection': True, 'num_snps': 39464}. Best is trial 71 with value: 0.2956582821015444.
[I 2025-12-09 18:55:39,705] Trial 96 finished with value: 0.29287956960279937 and parameters: {'model_type': 'graphsage', 'hidden_dims': '[512, 128]', 'dropout': 0.29642273982529194, 'batch_norm': True, 'sage_aggr': 'mean', 'sage_normalize': True, 'sage_project': False, 'lr': 0.0001359349386585643, 'weight_decay': 0.0009759998142286514, 'epochs': 309, 'loss': 'mse', 'optimizer': 'adam', 'graph_mode': 'cutoff', 'cutoff': 0.501280776287095, 'grm_norm': 'gcn', 'self_loops': False, 'use_snp_selection': True, 'num_snps': 40201}. Best is trial 71 with value: 0.2956582821015444.
[I 2025-12-09 18:57:31,401] Trial 97 finished with value: 0.2872813046908804 and parameters: {'model_type': 'graphsage', 'hidden_dims': '[128, 64]', 'dropout': 0.2939764662856517, 'batch_norm': True, 'sage_aggr': 'mean', 'sage_normalize': True, 'sage_project': False, 'lr': 0.00013528290781829422, 'weight_decay': 0.00082254867421467, 'epochs': 305, 'loss': 'mse', 'optimizer': 'adam', 'graph_mode': 'cutoff', 'cutoff': 0.4500595035869139, 'grm_norm': 'gcn', 'self_loops': False, 'use_snp_selection': True, 'num_snps': 42117}. Best is trial 71 with value: 0.2956582821015444.
[I 2025-12-09 18:59:45,928] Trial 98 finished with value: 0.2879636129281572 and parameters: {'model_type': 'graphsage', 'hidden_dims': '[512, 128]', 'dropout': 0.33752185137904167, 'batch_norm': True, 'sage_aggr': 'mean', 'sage_normalize': True, 'sage_project': False, 'lr': 0.00021321018103460706, 'weight_decay': 0.0003893942575634725, 'epochs': 311, 'loss': 'mse', 'optimizer': 'adam', 'graph_mode': 'cutoff', 'cutoff': 0.5064091210448689, 'grm_norm': 'cosine_then_gcn', 'self_loops': False, 'use_snp_selection': True, 'num_snps': 38406}. Best is trial 71 with value: 0.2956582821015444.
[I 2025-12-09 19:01:51,493] Trial 99 finished with value: 0.29235259188490625 and parameters: {'model_type': 'graphsage', 'hidden_dims': '[512, 128]', 'dropout': 0.3025094450655454, 'batch_norm': True, 'sage_aggr': 'mean', 'sage_normalize': True, 'sage_project': False, 'lr': 7.695555565696011e-05, 'weight_decay': 1.3301768335532484e-05, 'epochs': 254, 'loss': 'mse', 'optimizer': 'adam', 'graph_mode': 'cutoff', 'cutoff': 0.5557806134859776, 'grm_norm': 'gcn', 'self_loops': False, 'use_snp_selection': True, 'num_snps': 43947}. Best is trial 71 with value: 0.2956582821015444.
[I 2025-12-09 19:04:26,514] Trial 100 finished with value: 0.29142571674635515 and parameters: {'model_type': 'graphsage', 'hidden_dims': '[512, 128]', 'dropout': 0.30137652650872426, 'batch_norm': True, 'sage_aggr': 'mean', 'sage_normalize': False, 'sage_project': False, 'lr': 0.008635570433144878, 'weight_decay': 1.504116329203839e-05, 'epochs': 323, 'loss': 'mse', 'optimizer': 'adam', 'graph_mode': 'cutoff', 'cutoff': 0.5508009856049123, 'grm_norm': 'gcn', 'self_loops': False, 'use_snp_selection': True, 'num_snps': 45523}. Best is trial 71 with value: 0.2956582821015444.
[I 2025-12-09 19:06:38,005] Trial 101 finished with value: 0.29260568132786735 and parameters: {'model_type': 'graphsage', 'hidden_dims': '[512, 128]', 'dropout': 0.294252071740798, 'batch_norm': True, 'sage_aggr': 'mean', 'sage_normalize': False, 'sage_project': False, 'lr': 0.00562827946950219, 'weight_decay': 1.915792675525439e-05, 'epochs': 252, 'loss': 'mse', 'optimizer': 'adam', 'graph_mode': 'cutoff', 'cutoff': 0.5565824403963204, 'grm_norm': 'gcn', 'self_loops': False, 'use_snp_selection': True, 'num_snps': 46756}. Best is trial 71 with value: 0.2956582821015444.
[I 2025-12-09 19:09:27,926] Trial 102 finished with value: 0.29099110310532783 and parameters: {'model_type': 'graphsage', 'hidden_dims': '[512, 128]', 'dropout': 0.2878840599611093, 'batch_norm': True, 'sage_aggr': 'mean', 'sage_normalize': False, 'sage_project': False, 'lr': 0.002898866020940608, 'weight_decay': 4.318297789241672e-06, 'epochs': 265, 'loss': 'mse', 'optimizer': 'adam', 'graph_mode': 'cutoff', 'cutoff': 0.4979330875843331, 'grm_norm': 'gcn', 'self_loops': False, 'use_snp_selection': True, 'num_snps': 50620}. Best is trial 71 with value: 0.2956582821015444.
[I 2025-12-09 19:11:43,771] Trial 103 finished with value: 0.28984085370908874 and parameters: {'model_type': 'graphsage', 'hidden_dims': '[512, 64]', 'dropout': 0.2703916360368879, 'batch_norm': True, 'sage_aggr': 'mean', 'sage_normalize': False, 'sage_project': False, 'lr': 7.430013205013443e-05, 'weight_decay': 5.756605953510864e-06, 'epochs': 250, 'loss': 'mse', 'optimizer': 'adam', 'graph_mode': 'cutoff', 'cutoff': 0.531221909999028, 'grm_norm': 'gcn', 'self_loops': False, 'use_snp_selection': True, 'num_snps': 47247}. Best is trial 71 with value: 0.2956582821015444.
[I 2025-12-09 19:14:03,614] Trial 104 finished with value: 0.2905665064238614 and parameters: {'model_type': 'graphsage', 'hidden_dims': '[512, 128]', 'dropout': 0.3050726721799598, 'batch_norm': True, 'sage_aggr': 'mean', 'sage_normalize': False, 'sage_project': False, 'lr': 4.4653100297823704e-05, 'weight_decay': 1.0615778734185273e-05, 'epochs': 330, 'loss': 'mse', 'optimizer': 'adam', 'graph_mode': 'cutoff', 'cutoff': 0.582836581322054, 'grm_norm': 'gcn', 'self_loops': False, 'use_snp_selection': True, 'num_snps': 41732}. Best is trial 71 with value: 0.2956582821015444.
[I 2025-12-09 19:16:28,708] Trial 105 finished with value: 0.29308336217616776 and parameters: {'model_type': 'graphsage', 'hidden_dims': '[512, 128]', 'dropout': 0.25941869641099957, 'batch_norm': True, 'sage_aggr': 'mean', 'sage_normalize': False, 'sage_project': False, 'lr': 5.918104024814043e-05, 'weight_decay': 0.0007285530170213233, 'epochs': 277, 'loss': 'mse', 'optimizer': 'adam', 'graph_mode': 'cutoff', 'cutoff': 0.552182054902671, 'grm_norm': 'gcn', 'self_loops': False, 'use_snp_selection': True, 'num_snps': 48574}. Best is trial 71 with value: 0.2956582821015444.
[I 2025-12-09 19:18:52,050] Trial 106 finished with value: 0.24183045675623985 and parameters: {'model_type': 'graphsage', 'hidden_dims': '[512, 128]', 'dropout': 0.3582775036869707, 'batch_norm': True, 'sage_aggr': 'mean', 'sage_normalize': False, 'sage_project': False, 'lr': 0.0050502203854519674, 'weight_decay': 0.0009916671035355255, 'epochs': 275, 'loss': 'mse', 'optimizer': 'adam', 'graph_mode': 'cutoff', 'cutoff': 0.5525303084089979, 'grm_norm': 'gcn', 'self_loops': False, 'use_snp_selection': True, 'num_snps': 48058}. Best is trial 71 with value: 0.2956582821015444.
[I 2025-12-09 19:22:10,869] Trial 107 finished with value: 0.2847033582823561 and parameters: {'model_type': 'graphsage', 'hidden_dims': '[512, 128]', 'dropout': 0.26285836528455203, 'batch_norm': False, 'sage_aggr': 'mean', 'sage_normalize': False, 'sage_project': False, 'lr': 0.00012222934449357541, 'weight_decay': 0.0007529518114962097, 'epochs': 291, 'loss': 'mse', 'optimizer': 'adam', 'graph_mode': 'cutoff', 'cutoff': 0.4811396148471972, 'grm_norm': 'gcn', 'self_loops': False, 'use_snp_selection': True, 'num_snps': 54558}. Best is trial 71 with value: 0.2956582821015444.
[I 2025-12-09 19:24:29,206] Trial 108 finished with value: 0.2888593614568774 and parameters: {'model_type': 'graphsage', 'hidden_dims': '[512, 128]', 'dropout': 0.29711889702470895, 'batch_norm': True, 'sage_aggr': 'mean', 'sage_normalize': False, 'sage_project': False, 'lr': 5.6505399310536766e-05, 'weight_decay': 0.0005734732197275942, 'epochs': 319, 'loss': 'mse', 'optimizer': 'adam', 'graph_mode': 'cutoff', 'cutoff': 0.5879539876595398, 'grm_norm': 'gcn', 'self_loops': False, 'use_snp_selection': True, 'num_snps': 42643}. Best is trial 71 with value: 0.2956582821015444.
[I 2025-12-09 19:28:30,013] Trial 109 finished with value: 0.26399290649887563 and parameters: {'model_type': 'graphsage', 'hidden_dims': '[512, 128]', 'dropout': 0.2906661314597417, 'batch_norm': True, 'sage_aggr': 'mean', 'sage_normalize': False, 'sage_project': False, 'lr': 6.271352503944704e-05, 'weight_decay': 0.000367432289571206, 'epochs': 254, 'loss': 'mse', 'optimizer': 'adam', 'graph_mode': 'knn', 'knn_k': 5, 'weighted_edges': True, 'symmetrize_mode': 'union', 'self_loops': False, 'use_snp_selection': True, 'num_snps': 51188}. Best is trial 71 with value: 0.2956582821015444.
[I 2025-12-09 19:30:29,090] Trial 110 finished with value: 0.29604572497846465 and parameters: {'model_type': 'graphsage', 'hidden_dims': '[512, 128]', 'dropout': 0.23662082926390993, 'batch_norm': True, 'sage_aggr': 'mean', 'sage_normalize': False, 'sage_project': False, 'lr': 3.460272026080072e-05, 'weight_decay': 5.879211756580576e-05, 'epochs': 307, 'loss': 'mse', 'optimizer': 'adam', 'graph_mode': 'cutoff', 'cutoff': 0.5693211274521683, 'grm_norm': 'gcn', 'self_loops': False, 'use_snp_selection': True, 'num_snps': 37198}. Best is trial 110 with value: 0.29604572497846465.
[I 2025-12-09 19:32:29,812] Trial 111 finished with value: 0.2953012531943594 and parameters: {'model_type': 'graphsage', 'hidden_dims': '[512, 128]', 'dropout': 0.2547447746562653, 'batch_norm': True, 'sage_aggr': 'mean', 'sage_normalize': False, 'sage_project': False, 'lr': 2.967101848499005e-05, 'weight_decay': 0.00010798098824083886, 'epochs': 279, 'loss': 'mse', 'optimizer': 'adam', 'graph_mode': 'cutoff', 'cutoff': 0.5657580734749245, 'grm_norm': 'gcn', 'self_loops': False, 'use_snp_selection': True, 'num_snps': 39874}. Best is trial 110 with value: 0.29604572497846465.
[I 2025-12-09 19:34:18,042] Trial 112 finished with value: 0.2901604974784976 and parameters: {'model_type': 'graphsage', 'hidden_dims': '[512, 128]', 'dropout': 0.234978495105512, 'batch_norm': True, 'sage_aggr': 'mean', 'sage_normalize': False, 'sage_project': False, 'lr': 2.9042061255128134e-05, 'weight_decay': 5.4641780491394856e-05, 'epochs': 280, 'loss': 'mse', 'optimizer': 'adam', 'graph_mode': 'cutoff', 'cutoff': 0.570967672021769, 'grm_norm': 'gcn', 'self_loops': False, 'use_snp_selection': True, 'num_snps': 35755}. Best is trial 110 with value: 0.29604572497846465.
[I 2025-12-09 19:36:09,488] Trial 113 finished with value: 0.29183437080735214 and parameters: {'model_type': 'graphsage', 'hidden_dims': '[512, 128]', 'dropout': 0.24991747503579315, 'batch_norm': True, 'sage_aggr': 'mean', 'sage_normalize': False, 'sage_project': False, 'lr': 1.6003361003188052e-05, 'weight_decay': 0.00011837059154303833, 'epochs': 260, 'loss': 'mse', 'optimizer': 'adam', 'graph_mode': 'cutoff', 'cutoff': 0.5383102005825199, 'grm_norm': 'gcn', 'self_loops': False, 'use_snp_selection': True, 'num_snps': 37876}. Best is trial 110 with value: 0.29604572497846465.
[I 2025-12-09 19:38:21,610] Trial 114 finished with value: 0.295559899860191 and parameters: {'model_type': 'graphsage', 'hidden_dims': '[512, 128]', 'dropout': 0.27324732899804977, 'batch_norm': True, 'sage_aggr': 'mean', 'sage_normalize': False, 'sage_project': False, 'lr': 2.162092931838294e-05, 'weight_decay': 3.51603851439795e-05, 'epochs': 274, 'loss': 'mse', 'optimizer': 'adam', 'graph_mode': 'cutoff', 'cutoff': 0.5519095969313162, 'grm_norm': 'cosine_then_gcn', 'self_loops': False, 'use_snp_selection': True, 'num_snps': 44617}. Best is trial 110 with value: 0.29604572497846465.
[I 2025-12-09 19:40:30,335] Trial 115 finished with value: 0.29179850274159447 and parameters: {'model_type': 'graphsage', 'hidden_dims': '[512, 128]', 'dropout': 0.2672400802496844, 'batch_norm': True, 'sage_aggr': 'mean', 'sage_normalize': False, 'sage_project': False, 'lr': 2.2212386384368606e-05, 'weight_decay': 3.1234825468073425e-05, 'epochs': 273, 'loss': 'mse', 'optimizer': 'adam', 'graph_mode': 'cutoff', 'cutoff': 0.5599301679514483, 'grm_norm': 'cosine_then_gcn', 'self_loops': False, 'use_snp_selection': True, 'num_snps': 44371}. Best is trial 110 with value: 0.29604572497846465.
[I 2025-12-09 19:41:02,595] Trial 116 finished with value: 0.2463078749265951 and parameters: {'model_type': 'graphsage', 'hidden_dims': '[512, 128]', 'dropout': 0.27652724222289454, 'batch_norm': True, 'sage_aggr': 'mean', 'sage_normalize': False, 'sage_project': False, 'lr': 3.518039726387196e-05, 'weight_decay': 2.4271603925269455e-05, 'epochs': 241, 'loss': 'mse', 'optimizer': 'adam', 'graph_mode': 'cutoff', 'cutoff': 0.5431126130685581, 'grm_norm': 'cosine_then_gcn', 'self_loops': False, 'use_snp_selection': True, 'num_snps': 2435}. Best is trial 110 with value: 0.29604572497846465.
[I 2025-12-09 19:43:14,788] Trial 117 finished with value: 0.28931305427913284 and parameters: {'model_type': 'graphsage', 'hidden_dims': '[512, 128]', 'dropout': 0.2587783708636582, 'batch_norm': True, 'sage_aggr': 'mean', 'sage_normalize': False, 'sage_project': False, 'lr': 1.8465193534891275e-05, 'weight_decay': 3.9121308066626564e-05, 'epochs': 268, 'loss': 'mse', 'optimizer': 'adam', 'graph_mode': 'cutoff', 'cutoff': 0.5934157821895402, 'grm_norm': 'cosine_then_gcn', 'self_loops': False, 'use_snp_selection': True, 'num_snps': 46956}. Best is trial 110 with value: 0.29604572497846465.
[I 2025-12-09 19:44:30,360] Trial 118 finished with value: 0.27327293237557343 and parameters: {'model_type': 'graphsage', 'hidden_dims': '[128, 64]', 'dropout': 0.2282101618406182, 'batch_norm': True, 'sage_aggr': 'mean', 'sage_normalize': False, 'sage_project': False, 'lr': 1.3779706975610002e-05, 'weight_decay': 6.663739130825834e-05, 'epochs': 294, 'loss': 'mse', 'optimizer': 'adam', 'graph_mode': 'cutoff', 'cutoff': 0.5207853060664369, 'grm_norm': 'cosine_then_gcn', 'self_loops': False, 'use_snp_selection': True, 'num_snps': 40151}. Best is trial 110 with value: 0.29604572497846465.
[I 2025-12-09 19:46:02,219] Trial 119 finished with value: 0.2856660572845955 and parameters: {'model_type': 'graphsage', 'hidden_dims': '[512, 128]', 'dropout': 0.2500198737310781, 'batch_norm': True, 'sage_aggr': 'mean', 'sage_normalize': False, 'sage_project': False, 'lr': 3.3688162505889076e-05, 'weight_decay': 1.7969290632950178e-05, 'epochs': 231, 'loss': 'mse', 'optimizer': 'adam', 'graph_mode': 'cutoff', 'cutoff': 0.5703079042504892, 'grm_norm': 'gcn', 'self_loops': False, 'use_snp_selection': True, 'num_snps': 34277}. Best is trial 110 with value: 0.29604572497846465.
[I 2025-12-09 19:48:10,729] Trial 120 finished with value: 0.2864570266159937 and parameters: {'model_type': 'graphsage', 'hidden_dims': '[512, 128]', 'dropout': 0.27627521250675663, 'batch_norm': True, 'sage_aggr': 'mean', 'sage_normalize': False, 'sage_project': False, 'lr': 2.434437465169374e-05, 'weight_decay': 5.316439834369768e-05, 'epochs': 282, 'loss': 'mse', 'optimizer': 'adam', 'graph_mode': 'cutoff', 'cutoff': 0.616037527894435, 'grm_norm': 'gcn', 'self_loops': False, 'use_snp_selection': True, 'num_snps': 43693}. Best is trial 110 with value: 0.29604572497846465.
