[I 2025-12-10 06:25:07,181] Trial 141 finished with value: 0.30611867056142517 and parameters: {'model_type': 'graphsage', 'hidden_dims': '[512, 128]', 'dropout': 0.1298386619068622, 'batch_norm': False, 'sage_aggr': 'max', 'sage_normalize': False, 'sage_project': False, 'lr': 1.2944650021498562e-05, 'weight_decay': 1.4665730010769075e-07, 'epochs': 241, 'loss': 'mse', 'optimizer': 'adam', 'graph_mode': 'cutoff', 'cutoff': 0.4615660333568803, 'grm_norm': 'gcn', 'self_loops': True, 'use_snp_selection': True, 'num_snps': 7269}. Best is trial 107 with value: 0.3107321665790005.
[I 2025-12-10 06:26:08,204] Trial 142 finished with value: 0.3108553635977116 and parameters: {'model_type': 'graphsage', 'hidden_dims': '[512, 128]', 'dropout': 0.13368092170635665, 'batch_norm': False, 'sage_aggr': 'max', 'sage_normalize': False, 'sage_project': False, 'lr': 1.401967762372116e-05, 'weight_decay': 1.7896941445936962e-07, 'epochs': 242, 'loss': 'mse', 'optimizer': 'adam', 'graph_mode': 'cutoff', 'cutoff': 0.4564554978117475, 'grm_norm': 'gcn', 'self_loops': True, 'use_snp_selection': True, 'num_snps': 12452}. Best is trial 142 with value: 0.3108553635977116.
[I 2025-12-10 06:27:15,888] Trial 143 finished with value: 0.30002760988666805 and parameters: {'model_type': 'graphsage', 'hidden_dims': '[512, 128]', 'dropout': 0.15977724297617968, 'batch_norm': False, 'sage_aggr': 'max', 'sage_normalize': False, 'sage_project': False, 'lr': 1.4195602752627753e-05, 'weight_decay': 1.3714673971133404e-07, 'epochs': 242, 'loss': 'mse', 'optimizer': 'adam', 'graph_mode': 'cutoff', 'cutoff': 0.46192485495453073, 'grm_norm': 'gcn', 'self_loops': True, 'use_snp_selection': True, 'num_snps': 13749}. Best is trial 142 with value: 0.3108553635977116.
[I 2025-12-10 06:27:59,421] Trial 144 finished with value: 0.3049712542446422 and parameters: {'model_type': 'graphsage', 'hidden_dims': '[512, 64]', 'dropout': 0.13354011768383667, 'batch_norm': False, 'sage_aggr': 'max', 'sage_normalize': False, 'sage_project': False, 'lr': 1.0020789476807098e-05, 'weight_decay': 1.967587856438539e-07, 'epochs': 224, 'loss': 'mse', 'optimizer': 'adam', 'graph_mode': 'cutoff', 'cutoff': 0.48846534391210045, 'grm_norm': 'gcn', 'self_loops': True, 'use_snp_selection': True, 'num_snps': 7750}. Best is trial 142 with value: 0.3108553635977116.
[I 2025-12-10 06:28:50,780] Trial 145 finished with value: 0.3077076456872872 and parameters: {'model_type': 'graphsage', 'hidden_dims': '[512, 128]', 'dropout': 0.15089966190036963, 'batch_norm': False, 'sage_aggr': 'max', 'sage_normalize': False, 'sage_project': False, 'lr': 1.744679227080225e-05, 'weight_decay': 2.3098061011372813e-07, 'epochs': 206, 'loss': 'mse', 'optimizer': 'adam', 'graph_mode': 'cutoff', 'cutoff': 0.4450032299992588, 'grm_norm': 'gcn', 'self_loops': True, 'use_snp_selection': True, 'num_snps': 10821}. Best is trial 142 with value: 0.3108553635977116.
[I 2025-12-10 06:29:23,870] Trial 146 finished with value: 0.29990264373363573 and parameters: {'model_type': 'graphsage', 'hidden_dims': '[512, 256]', 'dropout': 0.1754714242818025, 'batch_norm': False, 'sage_aggr': 'max', 'sage_normalize': False, 'sage_project': False, 'lr': 2.7857046486452265e-05, 'weight_decay': 2.3410537827770246e-07, 'epochs': 190, 'loss': 'mse', 'optimizer': 'adam', 'graph_mode': 'cutoff', 'cutoff': 0.44455281309113864, 'grm_norm': 'gcn', 'self_loops': True, 'use_snp_selection': True, 'num_snps': 4012}. Best is trial 142 with value: 0.3108553635977116.
[I 2025-12-10 06:30:03,380] Trial 147 finished with value: 0.2835777280226105 and parameters: {'model_type': 'graphsage', 'hidden_dims': '[256, 128, 64]', 'dropout': 0.14915088325175235, 'batch_norm': False, 'sage_aggr': 'max', 'sage_normalize': False, 'sage_project': False, 'lr': 1.8064696610278456e-05, 'weight_decay': 1.4282833604144555e-07, 'epochs': 206, 'loss': 'mse', 'optimizer': 'adam', 'graph_mode': 'cutoff', 'cutoff': 0.5080594866536028, 'grm_norm': 'gcn', 'self_loops': True, 'use_snp_selection': True, 'num_snps': 10728}. Best is trial 142 with value: 0.3108553635977116.
[I 2025-12-10 06:30:41,861] Trial 148 finished with value: 0.29957422830731933 and parameters: {'model_type': 'graphsage', 'hidden_dims': '[512, 128]', 'dropout': 0.18750227005579895, 'batch_norm': False, 'sage_aggr': 'max', 'sage_normalize': False, 'sage_project': False, 'lr': 2.402243391903495e-05, 'weight_decay': 1.1842337185784863e-07, 'epochs': 208, 'loss': 'mse', 'optimizer': 'adam', 'graph_mode': 'cutoff', 'cutoff': 0.4578557974471115, 'grm_norm': 'gcn', 'self_loops': True, 'use_snp_selection': True, 'num_snps': 6159}. Best is trial 142 with value: 0.3108553635977116.
[I 2025-12-10 06:34:35,184] Trial 149 finished with value: 0.3082315773891128 and parameters: {'model_type': 'graphsage', 'hidden_dims': '[512, 128]', 'dropout': 0.15435719280528704, 'batch_norm': False, 'sage_aggr': 'mean', 'sage_normalize': False, 'sage_project': False, 'lr': 1.6608750823367808e-05, 'weight_decay': 7.4378820483628796e-06, 'epochs': 219, 'loss': 'mse', 'optimizer': 'adam', 'graph_mode': 'cutoff', 'cutoff': 0.434282065408461, 'grm_norm': 'gcn', 'self_loops': True, 'use_snp_selection': True, 'num_snps': 53437}. Best is trial 142 with value: 0.3108553635977116.
[I 2025-12-10 06:36:24,264] Trial 0 finished with value: 0.24030727498761953 and parameters: {'model_type': 'graphsage', 'hidden_dims': '[128, 64]', 'dropout': 0.199031432379812, 'batch_norm': True, 'sage_aggr': 'max', 'sage_normalize': True, 'sage_project': False, 'lr': 0.00034401453323286885, 'weight_decay': 0.00017802616915745114, 'epochs': 230, 'loss': 'mse', 'optimizer': 'adam', 'graph_mode': 'knn', 'knn_k': 6, 'weighted_edges': True, 'symmetrize_mode': 'mutual', 'self_loops': True, 'use_snp_selection': False}. Best is trial 0 with value: 0.24030727498761953.
[I 2025-12-10 06:38:28,950] Trial 1 finished with value: 0.2764275150982215 and parameters: {'model_type': 'graphsage', 'hidden_dims': '[512, 128]', 'dropout': 0.2503500283181017, 'batch_norm': False, 'sage_aggr': 'max', 'sage_normalize': False, 'sage_project': False, 'lr': 3.952233718592099e-05, 'weight_decay': 0.00026754769258252603, 'epochs': 149, 'loss': 'mse', 'optimizer': 'adam', 'graph_mode': 'knn', 'knn_k': 2, 'weighted_edges': False, 'symmetrize_mode': 'mutual', 'self_loops': True, 'use_snp_selection': True, 'num_snps': 49915}. Best is trial 1 with value: 0.2764275150982215.
[I 2025-12-10 06:40:06,321] Trial 2 finished with value: 0.27458887387336456 and parameters: {'model_type': 'graphsage', 'hidden_dims': '[512, 256]', 'dropout': 0.2785908793172681, 'batch_norm': False, 'sage_aggr': 'max', 'sage_normalize': False, 'sage_project': False, 'lr': 8.806039223165805e-05, 'weight_decay': 3.5153176302760294e-05, 'epochs': 147, 'loss': 'mae', 'optimizer': 'adam', 'graph_mode': 'cutoff', 'cutoff': 0.4922564006874869, 'grm_norm': 'gcn', 'self_loops': False, 'use_snp_selection': True, 'num_snps': 34340}. Best is trial 1 with value: 0.2764275150982215.
[I 2025-12-10 06:41:42,723] Trial 3 finished with value: 0.24293120188356387 and parameters: {'model_type': 'graphsage', 'hidden_dims': '[256, 128, 64]', 'dropout': 0.3475243154412272, 'batch_norm': True, 'sage_aggr': 'max', 'sage_normalize': False, 'sage_project': False, 'lr': 1.6006331996938085e-05, 'weight_decay': 7.213121225589906e-06, 'epochs': 283, 'loss': 'mse', 'optimizer': 'adam', 'graph_mode': 'cutoff', 'cutoff': 0.5942334791449215, 'grm_norm': 'none', 'self_loops': True, 'use_snp_selection': False}. Best is trial 1 with value: 0.2764275150982215.
[I 2025-12-10 06:42:23,079] Trial 4 finished with value: 0.2473842134740889 and parameters: {'model_type': 'graphsage', 'hidden_dims': '[128, 64]', 'dropout': 0.3348926467202472, 'batch_norm': True, 'sage_aggr': 'max', 'sage_normalize': False, 'sage_project': False, 'lr': 0.0004238630400638802, 'weight_decay': 8.074086040046576e-07, 'epochs': 158, 'loss': 'mae', 'optimizer': 'adam', 'graph_mode': 'knn', 'knn_k': 1, 'weighted_edges': False, 'symmetrize_mode': 'mutual', 'self_loops': False, 'use_snp_selection': True, 'num_snps': 26850}. Best is trial 1 with value: 0.2764275150982215.
[I 2025-12-10 06:44:58,337] Trial 5 finished with value: 0.24507392498110508 and parameters: {'model_type': 'graphsage', 'hidden_dims': '[512, 64]', 'dropout': 0.14505336736221927, 'batch_norm': True, 'sage_aggr': 'mean', 'sage_normalize': True, 'sage_project': False, 'lr': 1.2962030165732234e-05, 'weight_decay': 1.326598071105465e-07, 'epochs': 180, 'loss': 'mse', 'optimizer': 'adam', 'graph_mode': 'knn', 'knn_k': 9, 'weighted_edges': True, 'symmetrize_mode': 'mutual', 'self_loops': False, 'use_snp_selection': False}. Best is trial 1 with value: 0.2764275150982215.
[I 2025-12-10 06:45:53,636] Trial 6 finished with value: 0.2583919210714821 and parameters: {'model_type': 'graphsage', 'hidden_dims': '[256, 128, 64]', 'dropout': 0.10731743755162496, 'batch_norm': True, 'sage_aggr': 'mean', 'sage_normalize': False, 'sage_project': False, 'lr': 1.922990426933137e-05, 'weight_decay': 7.30001060446905e-05, 'epochs': 63, 'loss': 'mae', 'optimizer': 'adam', 'graph_mode': 'cutoff', 'cutoff': 0.7624978434202536, 'grm_norm': 'none', 'self_loops': True, 'use_snp_selection': True, 'num_snps': 50106}. Best is trial 1 with value: 0.2764275150982215.
[I 2025-12-10 06:48:32,660] Trial 7 finished with value: 0.2602580943656549 and parameters: {'model_type': 'graphsage', 'hidden_dims': '[512, 64]', 'dropout': 0.2585007811528941, 'batch_norm': True, 'sage_aggr': 'max', 'sage_normalize': True, 'sage_project': False, 'lr': 5.921425508303391e-05, 'weight_decay': 0.0004511561961144237, 'epochs': 182, 'loss': 'mae', 'optimizer': 'adam', 'graph_mode': 'knn', 'knn_k': 9, 'weighted_edges': True, 'symmetrize_mode': 'union', 'self_loops': False, 'use_snp_selection': True, 'num_snps': 23903}. Best is trial 1 with value: 0.2764275150982215.
[I 2025-12-10 06:49:13,537] Trial 8 finished with value: 0.20449222434965422 and parameters: {'model_type': 'graphsage', 'hidden_dims': '[512, 256]', 'dropout': 0.3061380386767003, 'batch_norm': False, 'sage_aggr': 'mean', 'sage_normalize': True, 'sage_project': False, 'lr': 0.000698401460570184, 'weight_decay': 2.965560055460244e-06, 'epochs': 289, 'loss': 'mae', 'optimizer': 'adam', 'graph_mode': 'knn', 'knn_k': 7, 'weighted_edges': False, 'symmetrize_mode': 'mutual', 'self_loops': True, 'use_snp_selection': True, 'num_snps': 4710}. Best is trial 1 with value: 0.2764275150982215.
[I 2025-12-10 06:55:00,143] Trial 9 finished with value: 0.273977700011812 and parameters: {'model_type': 'graphsage', 'hidden_dims': '[512, 128]', 'dropout': 0.1733844071393634, 'batch_norm': False, 'sage_aggr': 'mean', 'sage_normalize': True, 'sage_project': False, 'lr': 0.0004269677918501597, 'weight_decay': 2.2439779626249696e-06, 'epochs': 319, 'loss': 'mse', 'optimizer': 'adam', 'graph_mode': 'cutoff', 'cutoff': 0.24117565767129295, 'grm_norm': 'cosine_then_gcn', 'self_loops': True, 'use_snp_selection': False}. Best is trial 1 with value: 0.2764275150982215.
[I 2025-12-10 06:56:37,678] Trial 10 finished with value: 0.0 and parameters: {'model_type': 'graphsage', 'hidden_dims': '[512, 128]', 'dropout': 0.5365714961141473, 'batch_norm': False, 'sage_aggr': 'max', 'sage_normalize': False, 'sage_project': False, 'lr': 0.0060050040216813455, 'weight_decay': 0.0009536725175322669, 'epochs': 77, 'loss': 'mse', 'optimizer': 'adam', 'graph_mode': 'knn', 'knn_k': 1, 'weighted_edges': False, 'symmetrize_mode': 'union', 'self_loops': True, 'use_snp_selection': True, 'num_snps': 56869}. Best is trial 1 with value: 0.2764275150982215.
[I 2025-12-10 06:58:51,312] Trial 11 finished with value: 0.26068074781023165 and parameters: {'model_type': 'graphsage', 'hidden_dims': '[512, 256]', 'dropout': 0.4460200598462328, 'batch_norm': False, 'sage_aggr': 'max', 'sage_normalize': False, 'sage_project': False, 'lr': 7.530654417271752e-05, 'weight_decay': 3.337083767692119e-05, 'epochs': 122, 'loss': 'mae', 'optimizer': 'adam', 'graph_mode': 'cutoff', 'cutoff': 0.3489998807678978, 'grm_norm': 'gcn', 'self_loops': False, 'use_snp_selection': True, 'num_snps': 42056}. Best is trial 1 with value: 0.2764275150982215.
[I 2025-12-10 06:59:54,644] Trial 12 finished with value: 0.27020337893461444 and parameters: {'model_type': 'graphsage', 'hidden_dims': '[256, 128]', 'dropout': 0.2490067964043116, 'batch_norm': False, 'sage_aggr': 'max', 'sage_normalize': False, 'sage_project': False, 'lr': 8.816195883637583e-05, 'weight_decay': 2.737551210455884e-05, 'epochs': 114, 'loss': 'mae', 'optimizer': 'adam', 'graph_mode': 'cutoff', 'cutoff': 0.5206024458939927, 'grm_norm': 'cosine', 'self_loops': False, 'use_snp_selection': True, 'num_snps': 39092}. Best is trial 1 with value: 0.2764275150982215.
[I 2025-12-10 07:02:13,010] Trial 13 finished with value: 0.29412675134907346 and parameters: {'model_type': 'graphsage', 'hidden_dims': '[512, 256]', 'dropout': 0.4608586563939124, 'batch_norm': False, 'sage_aggr': 'max', 'sage_normalize': False, 'sage_project': False, 'lr': 0.00012586985041155037, 'weight_decay': 0.00011926072016900266, 'epochs': 223, 'loss': 'mse', 'optimizer': 'adam', 'graph_mode': 'cutoff', 'cutoff': 0.5105648593757639, 'grm_norm': 'gcn', 'self_loops': False, 'use_snp_selection': True, 'num_snps': 36810}. Best is trial 13 with value: 0.29412675134907346.
[I 2025-12-10 07:05:35,321] Trial 14 finished with value: 0.20206768396560076 and parameters: {'model_type': 'graphsage', 'hidden_dims': '[512, 128]', 'dropout': 0.4483048564714998, 'batch_norm': False, 'sage_aggr': 'max', 'sage_normalize': False, 'sage_project': False, 'lr': 0.00015809858243784908, 'weight_decay': 0.00020766862519105273, 'epochs': 240, 'loss': 'mse', 'optimizer': 'adam', 'graph_mode': 'knn', 'knn_k': 3, 'weighted_edges': False, 'symmetrize_mode': 'mutual', 'self_loops': True, 'use_snp_selection': True, 'num_snps': 50546}. Best is trial 13 with value: 0.29412675134907346.
[I 2025-12-10 07:06:18,029] Trial 15 finished with value: 0.2457616128849688 and parameters: {'model_type': 'graphsage', 'hidden_dims': '[256, 128]', 'dropout': 0.41656724566348174, 'batch_norm': False, 'sage_aggr': 'max', 'sage_normalize': False, 'sage_project': False, 'lr': 0.001140050652126762, 'weight_decay': 0.00013588196896766432, 'epochs': 227, 'loss': 'mse', 'optimizer': 'adam', 'graph_mode': 'cutoff', 'cutoff': 0.7732092081242897, 'grm_norm': 'gcn', 'self_loops': False, 'use_snp_selection': True, 'num_snps': 15396}. Best is trial 13 with value: 0.29412675134907346.
[I 2025-12-10 07:09:58,898] Trial 16 finished with value: 0.28366952462010836 and parameters: {'model_type': 'graphsage', 'hidden_dims': '[512, 256]', 'dropout': 0.5938724975079561, 'batch_norm': False, 'sage_aggr': 'max', 'sage_normalize': False, 'sage_project': False, 'lr': 4.038866340895696e-05, 'weight_decay': 0.0008475119096092616, 'epochs': 212, 'loss': 'mse', 'optimizer': 'adam', 'graph_mode': 'knn', 'knn_k': 4, 'weighted_edges': False, 'symmetrize_mode': 'union', 'self_loops': False, 'use_snp_selection': True, 'num_snps': 45490}. Best is trial 13 with value: 0.29412675134907346.
[I 2025-12-10 07:12:11,198] Trial 17 finished with value: 0.04762172632517422 and parameters: {'model_type': 'graphsage', 'hidden_dims': '[512, 256]', 'dropout': 0.5603028972651437, 'batch_norm': False, 'sage_aggr': 'max', 'sage_normalize': False, 'sage_project': False, 'lr': 0.0023016021987376425, 'weight_decay': 0.0006700889100816627, 'epochs': 262, 'loss': 'mse', 'optimizer': 'adam', 'graph_mode': 'cutoff', 'cutoff': 0.8937392655886813, 'grm_norm': 'cosine', 'self_loops': False, 'use_snp_selection': True, 'num_snps': 40649}. Best is trial 13 with value: 0.29412675134907346.
[I 2025-12-10 07:16:16,613] Trial 18 finished with value: 0.2791306582752989 and parameters: {'model_type': 'graphsage', 'hidden_dims': '[512, 256]', 'dropout': 0.5991392959003051, 'batch_norm': False, 'sage_aggr': 'mean', 'sage_normalize': False, 'sage_project': False, 'lr': 0.00018083942267939533, 'weight_decay': 7.740631936156516e-05, 'epochs': 333, 'loss': 'mse', 'optimizer': 'adam', 'graph_mode': 'knn', 'knn_k': 4, 'weighted_edges': False, 'symmetrize_mode': 'union', 'self_loops': False, 'use_snp_selection': False}. Best is trial 13 with value: 0.29412675134907346.
[I 2025-12-10 07:18:23,118] Trial 19 finished with value: 0.2991266517976424 and parameters: {'model_type': 'graphsage', 'hidden_dims': '[512, 256]', 'dropout': 0.5115741551918986, 'batch_norm': False, 'sage_aggr': 'max', 'sage_normalize': False, 'sage_project': False, 'lr': 3.4039723321811725e-05, 'weight_decay': 1.45220363775765e-05, 'epochs': 201, 'loss': 'mse', 'optimizer': 'adam', 'graph_mode': 'cutoff', 'cutoff': 0.40336129009098626, 'grm_norm': 'cosine_then_gcn', 'self_loops': False, 'use_snp_selection': True, 'num_snps': 30979}. Best is trial 19 with value: 0.2991266517976424.
[I 2025-12-10 07:19:39,306] Trial 20 finished with value: 0.2930221223445907 and parameters: {'model_type': 'graphsage', 'hidden_dims': '[512, 256]', 'dropout': 0.49659119939071084, 'batch_norm': False, 'sage_aggr': 'max', 'sage_normalize': False, 'sage_project': False, 'lr': 2.532368661095327e-05, 'weight_decay': 1.3039970521685725e-05, 'epochs': 203, 'loss': 'mse', 'optimizer': 'adam', 'graph_mode': 'cutoff', 'cutoff': 0.40843882174211543, 'grm_norm': 'cosine_then_gcn', 'self_loops': False, 'use_snp_selection': True, 'num_snps': 19494}. Best is trial 19 with value: 0.2991266517976424.
[I 2025-12-10 07:20:51,053] Trial 21 finished with value: 0.29155677744984304 and parameters: {'model_type': 'graphsage', 'hidden_dims': '[512, 256]', 'dropout': 0.5011167061988546, 'batch_norm': False, 'sage_aggr': 'max', 'sage_normalize': False, 'sage_project': False, 'lr': 2.609002114437433e-05, 'weight_decay': 1.0965962335011194e-05, 'epochs': 195, 'loss': 'mse', 'optimizer': 'adam', 'graph_mode': 'cutoff', 'cutoff': 0.4102010375792842, 'grm_norm': 'cosine_then_gcn', 'self_loops': False, 'use_snp_selection': True, 'num_snps': 18212}. Best is trial 19 with value: 0.2991266517976424.
[I 2025-12-10 07:23:03,486] Trial 22 finished with value: 0.2689318490403353 and parameters: {'model_type': 'graphsage', 'hidden_dims': '[512, 256]', 'dropout': 0.4992948404354714, 'batch_norm': False, 'sage_aggr': 'max', 'sage_normalize': False, 'sage_project': False, 'lr': 0.0001644810963866176, 'weight_decay': 1.6291726462085397e-05, 'epochs': 201, 'loss': 'mse', 'optimizer': 'adam', 'graph_mode': 'cutoff', 'cutoff': 0.36784293202289364, 'grm_norm': 'cosine_then_gcn', 'self_loops': False, 'use_snp_selection': True, 'num_snps': 30850}. Best is trial 19 with value: 0.2991266517976424.
[I 2025-12-10 07:24:13,035] Trial 23 finished with value: 0.285080387243163 and parameters: {'model_type': 'graphsage', 'hidden_dims': '[512, 256]', 'dropout': 0.4009247048398337, 'batch_norm': False, 'sage_aggr': 'max', 'sage_normalize': False, 'sage_project': False, 'lr': 1.0253105634418964e-05, 'weight_decay': 5.5511971268011765e-06, 'epochs': 250, 'loss': 'mse', 'optimizer': 'adam', 'graph_mode': 'cutoff', 'cutoff': 0.5914042548651866, 'grm_norm': 'cosine_then_gcn', 'self_loops': False, 'use_snp_selection': True, 'num_snps': 18327}. Best is trial 19 with value: 0.2991266517976424.
[I 2025-12-10 07:24:57,652] Trial 24 finished with value: 0.2972765387718558 and parameters: {'model_type': 'graphsage', 'hidden_dims': '[512, 256]', 'dropout': 0.48865596467079897, 'batch_norm': False, 'sage_aggr': 'max', 'sage_normalize': False, 'sage_project': False, 'lr': 3.0879488945942376e-05, 'weight_decay': 5.524925706969623e-07, 'epochs': 168, 'loss': 'mse', 'optimizer': 'adam', 'graph_mode': 'cutoff', 'cutoff': 0.4480191821253193, 'grm_norm': 'cosine_then_gcn', 'self_loops': False, 'use_snp_selection': True, 'num_snps': 10269}. Best is trial 19 with value: 0.2991266517976424.
[I 2025-12-10 07:25:28,717] Trial 25 finished with value: 0.28251503860550325 and parameters: {'model_type': 'graphsage', 'hidden_dims': '[512, 256]', 'dropout': 0.39143480443644035, 'batch_norm': False, 'sage_aggr': 'max', 'sage_normalize': False, 'sage_project': False, 'lr': 4.0620488617844835e-05, 'weight_decay': 6.065351777232607e-07, 'epochs': 118, 'loss': 'mse', 'optimizer': 'adam', 'graph_mode': 'cutoff', 'cutoff': 0.23919676197393366, 'grm_norm': 'gcn', 'self_loops': False, 'use_snp_selection': True, 'num_snps': 3603}. Best is trial 19 with value: 0.2991266517976424.
[I 2025-12-10 07:26:41,277] Trial 26 finished with value: 0.22703762321405802 and parameters: {'model_type': 'graphsage', 'hidden_dims': '[256, 128, 64]', 'dropout': 0.45906826903316755, 'batch_norm': False, 'sage_aggr': 'mean', 'sage_normalize': True, 'sage_project': False, 'lr': 0.00014080007375589758, 'weight_decay': 1.120912135143584e-07, 'epochs': 167, 'loss': 'mse', 'optimizer': 'adam', 'graph_mode': 'cutoff', 'cutoff': 0.4832925673953179, 'grm_norm': 'cosine_then_gcn', 'self_loops': False, 'use_snp_selection': False}. Best is trial 19 with value: 0.2991266517976424.
[I 2025-12-10 07:27:46,464] Trial 27 finished with value: 0.2803797968281533 and parameters: {'model_type': 'graphsage', 'hidden_dims': '[128, 64]', 'dropout': 0.5252274242938215, 'batch_norm': False, 'sage_aggr': 'max', 'sage_normalize': False, 'sage_project': False, 'lr': 5.7514500449241724e-05, 'weight_decay': 6.598004017673308e-07, 'epochs': 282, 'loss': 'mse', 'optimizer': 'adam', 'graph_mode': 'cutoff', 'cutoff': 0.6466512579379482, 'grm_norm': 'cosine_then_gcn', 'self_loops': False, 'use_snp_selection': True, 'num_snps': 35790}. Best is trial 19 with value: 0.2991266517976424.
