[I 2025-12-09 04:06:10,973] Trial 8 finished with value: 0.2483112227075313 and parameters: {'model_type': 'graphsage', 'hidden_dims': '[512, 256]', 'dropout': 0.3061380386767003, 'batch_norm': False, 'sage_aggr': 'mean', 'sage_normalize': True, 'sage_project': False, 'lr': 0.000698401460570184, 'weight_decay': 2.965560055460244e-06, 'epochs': 289, 'loss': 'mae', 'optimizer': 'adam', 'graph_mode': 'knn', 'knn_k': 7, 'weighted_edges': False, 'symmetrize_mode': 'mutual', 'self_loops': True, 'use_snp_selection': True, 'num_snps': 4710}. Best is trial 3 with value: 0.2871675609741687.
[I 2025-12-09 04:10:03,735] Trial 9 finished with value: 0.2738557196349384 and parameters: {'model_type': 'graphsage', 'hidden_dims': '[512, 128]', 'dropout': 0.1733844071393634, 'batch_norm': False, 'sage_aggr': 'mean', 'sage_normalize': True, 'sage_project': False, 'lr': 0.0004269677918501597, 'weight_decay': 2.2439779626249696e-06, 'epochs': 319, 'loss': 'mse', 'optimizer': 'adam', 'graph_mode': 'cutoff', 'cutoff': 0.24117565767129295, 'grm_norm': 'cosine_then_gcn', 'self_loops': True, 'use_snp_selection': False}. Best is trial 3 with value: 0.2871675609741687.
[I 2025-12-09 04:11:14,477] Trial 10 finished with value: 0.28302174874395136 and parameters: {'model_type': 'graphsage', 'hidden_dims': '[256, 128, 64]', 'dropout': 0.5062131504581071, 'batch_norm': True, 'sage_aggr': 'max', 'sage_normalize': False, 'sage_project': False, 'lr': 0.0060050040216813455, 'weight_decay': 1.5886244399072472e-05, 'epochs': 258, 'loss': 'mse', 'optimizer': 'adam', 'graph_mode': 'cutoff', 'cutoff': 0.6388703494956212, 'grm_norm': 'none', 'self_loops': True, 'use_snp_selection': False}. Best is trial 3 with value: 0.2871675609741687.
[I 2025-12-09 04:11:34,186] Trial 11 finished with value: 0.26542103324826677 and parameters: {'model_type': 'graphsage', 'hidden_dims': '[256, 128, 64]', 'dropout': 0.4501982574362273, 'batch_norm': True, 'sage_aggr': 'mean', 'sage_normalize': False, 'sage_project': False, 'lr': 1.3538700143256056e-05, 'weight_decay': 5.0909600573764416e-05, 'epochs': 40, 'loss': 'mae', 'optimizer': 'adam', 'graph_mode': 'cutoff', 'cutoff': 0.844982265939556, 'grm_norm': 'none', 'self_loops': True, 'use_snp_selection': False}. Best is trial 3 with value: 0.2871675609741687.
[I 2025-12-09 04:12:32,558] Trial 12 finished with value: 0.2883839610468896 and parameters: {'model_type': 'graphsage', 'hidden_dims': '[256, 128, 64]', 'dropout': 0.41797846692127566, 'batch_norm': True, 'sage_aggr': 'mean', 'sage_normalize': False, 'sage_project': False, 'lr': 2.4632363990850973e-05, 'weight_decay': 6.372026470830696e-06, 'epochs': 58, 'loss': 'mse', 'optimizer': 'adam', 'graph_mode': 'cutoff', 'cutoff': 0.718044549257282, 'grm_norm': 'none', 'self_loops': True, 'use_snp_selection': True, 'num_snps': 58048}. Best is trial 12 with value: 0.2883839610468896.
[I 2025-12-09 04:13:05,223] Trial 13 finished with value: 0.2869237924493107 and parameters: {'model_type': 'graphsage', 'hidden_dims': '[256, 128]', 'dropout': 0.3986867341009237, 'batch_norm': True, 'sage_aggr': 'mean', 'sage_normalize': False, 'sage_project': False, 'lr': 0.00011318551535492545, 'weight_decay': 6.089474254075332e-06, 'epochs': 90, 'loss': 'mse', 'optimizer': 'adam', 'graph_mode': 'cutoff', 'cutoff': 0.5458035937339568, 'grm_norm': 'cosine', 'self_loops': True, 'use_snp_selection': False}. Best is trial 12 with value: 0.2883839610468896.
[I 2025-12-09 04:15:21,620] Trial 14 finished with value: 0.28405346898611394 and parameters: {'model_type': 'graphsage', 'hidden_dims': '[256, 128, 64]', 'dropout': 0.562241052916242, 'batch_norm': True, 'sage_aggr': 'max', 'sage_normalize': False, 'sage_project': False, 'lr': 0.0019344536690281374, 'weight_decay': 6.474464225279604e-07, 'epochs': 347, 'loss': 'mse', 'optimizer': 'adam', 'graph_mode': 'cutoff', 'cutoff': 0.64858033626645, 'grm_norm': 'none', 'self_loops': True, 'use_snp_selection': True, 'num_snps': 58471}. Best is trial 12 with value: 0.2883839610468896.
[I 2025-12-09 04:16:05,609] Trial 15 finished with value: 0.278594860288026 and parameters: {'model_type': 'graphsage', 'hidden_dims': '[256, 128, 64]', 'dropout': 0.39883980068548075, 'batch_norm': True, 'sage_aggr': 'mean', 'sage_normalize': False, 'sage_project': False, 'lr': 3.355267778322486e-05, 'weight_decay': 1.125786116611557e-05, 'epochs': 111, 'loss': 'mse', 'optimizer': 'adam', 'graph_mode': 'cutoff', 'cutoff': 0.3999211194571512, 'grm_norm': 'none', 'self_loops': True, 'use_snp_selection': False}. Best is trial 12 with value: 0.2883839610468896.
[I 2025-12-09 04:17:10,695] Trial 16 finished with value: 0.28569753122928476 and parameters: {'model_type': 'graphsage', 'hidden_dims': '[256, 128]', 'dropout': 0.38972932269140576, 'batch_norm': True, 'sage_aggr': 'mean', 'sage_normalize': False, 'sage_project': False, 'lr': 0.00015184516038711652, 'weight_decay': 1.286756677436222e-06, 'epochs': 234, 'loss': 'mse', 'optimizer': 'adam', 'graph_mode': 'cutoff', 'cutoff': 0.7020042033887095, 'grm_norm': 'cosine', 'self_loops': True, 'use_snp_selection': False}. Best is trial 12 with value: 0.2883839610468896.
[I 2025-12-09 04:18:33,948] Trial 17 finished with value: 0.28500314251726155 and parameters: {'model_type': 'graphsage', 'hidden_dims': '[256, 128, 64]', 'dropout': 0.4721955585236313, 'batch_norm': True, 'sage_aggr': 'max', 'sage_normalize': False, 'sage_project': False, 'lr': 2.709058866506579e-05, 'weight_decay': 1.8785934779016615e-07, 'epochs': 277, 'loss': 'mse', 'optimizer': 'adam', 'graph_mode': 'cutoff', 'cutoff': 0.8893390523318501, 'grm_norm': 'gcn', 'self_loops': True, 'use_snp_selection': True, 'num_snps': 40173}. Best is trial 12 with value: 0.2883839610468896.
[I 2025-12-09 04:19:47,514] Trial 18 finished with value: 0.2827375586266196 and parameters: {'model_type': 'graphsage', 'hidden_dims': '[256, 128, 64]', 'dropout': 0.5673331643426158, 'batch_norm': False, 'sage_aggr': 'mean', 'sage_normalize': False, 'sage_project': False, 'lr': 1.0674445767255566e-05, 'weight_decay': 5.4980640990494805e-06, 'epochs': 217, 'loss': 'mse', 'optimizer': 'adam', 'graph_mode': 'cutoff', 'cutoff': 0.4374457117695836, 'grm_norm': 'cosine_then_gcn', 'self_loops': False, 'use_snp_selection': False}. Best is trial 12 with value: 0.2883839610468896.
[I 2025-12-09 04:20:22,690] Trial 19 finished with value: 0.281650109404708 and parameters: {'model_type': 'graphsage', 'hidden_dims': '[256, 128, 64]', 'dropout': 0.35184853380465997, 'batch_norm': True, 'sage_aggr': 'max', 'sage_normalize': False, 'sage_project': False, 'lr': 0.00016242111625595757, 'weight_decay': 4.200862739100648e-07, 'epochs': 120, 'loss': 'mse', 'optimizer': 'adam', 'graph_mode': 'cutoff', 'cutoff': 0.7515654067450412, 'grm_norm': 'none', 'self_loops': True, 'use_snp_selection': True, 'num_snps': 12285}. Best is trial 12 with value: 0.2883839610468896.
[I 2025-12-09 04:21:18,572] Trial 20 finished with value: 0.29259622689900605 and parameters: {'model_type': 'graphsage', 'hidden_dims': '[128, 64]', 'dropout': 0.4498987258004865, 'batch_norm': True, 'sage_aggr': 'mean', 'sage_normalize': False, 'sage_project': False, 'lr': 6.162249460928106e-05, 'weight_decay': 1.729299374657186e-05, 'epochs': 310, 'loss': 'mse', 'optimizer': 'adam', 'graph_mode': 'cutoff', 'cutoff': 0.5822207676958602, 'grm_norm': 'none', 'self_loops': True, 'use_snp_selection': False}. Best is trial 20 with value: 0.29259622689900605.
[I 2025-12-09 04:22:13,741] Trial 21 finished with value: 0.2868271774431756 and parameters: {'model_type': 'graphsage', 'hidden_dims': '[128, 64]', 'dropout': 0.45884290369518943, 'batch_norm': True, 'sage_aggr': 'mean', 'sage_normalize': False, 'sage_project': False, 'lr': 6.403580034964713e-05, 'weight_decay': 2.168176580765254e-05, 'epochs': 308, 'loss': 'mse', 'optimizer': 'adam', 'graph_mode': 'cutoff', 'cutoff': 0.5947012075583544, 'grm_norm': 'none', 'self_loops': True, 'use_snp_selection': False}. Best is trial 20 with value: 0.29259622689900605.
[I 2025-12-09 04:23:16,127] Trial 22 finished with value: 0.2850633378496526 and parameters: {'model_type': 'graphsage', 'hidden_dims': '[128, 64]', 'dropout': 0.5278079498988268, 'batch_norm': True, 'sage_aggr': 'mean', 'sage_normalize': False, 'sage_project': False, 'lr': 2.2133384262703264e-05, 'weight_decay': 5.985193974736728e-06, 'epochs': 332, 'loss': 'mse', 'optimizer': 'adam', 'graph_mode': 'cutoff', 'cutoff': 0.5458399672463173, 'grm_norm': 'none', 'self_loops': True, 'use_snp_selection': False}. Best is trial 20 with value: 0.29259622689900605.
[I 2025-12-09 04:24:04,447] Trial 23 finished with value: 0.2856674906532778 and parameters: {'model_type': 'graphsage', 'hidden_dims': '[128, 64]', 'dropout': 0.42653309212542556, 'batch_norm': True, 'sage_aggr': 'mean', 'sage_normalize': False, 'sage_project': False, 'lr': 5.4002231350604834e-05, 'weight_decay': 0.00011775740285263639, 'epochs': 273, 'loss': 'mse', 'optimizer': 'adam', 'graph_mode': 'cutoff', 'cutoff': 0.7003044825370424, 'grm_norm': 'none', 'self_loops': True, 'use_snp_selection': False}. Best is trial 20 with value: 0.29259622689900605.
[I 2025-12-09 04:26:31,548] Trial 24 finished with value: 0.28334154466885453 and parameters: {'model_type': 'graphsage', 'hidden_dims': '[512, 256]', 'dropout': 0.35531592924021604, 'batch_norm': True, 'sage_aggr': 'mean', 'sage_normalize': False, 'sage_project': False, 'lr': 2.7741518045016448e-05, 'weight_decay': 2.3978583154513207e-05, 'epochs': 256, 'loss': 'mse', 'optimizer': 'adam', 'graph_mode': 'cutoff', 'cutoff': 0.32273729723872746, 'grm_norm': 'none', 'self_loops': True, 'use_snp_selection': False}. Best is trial 20 with value: 0.29259622689900605.
[I 2025-12-09 04:28:50,559] Trial 25 finished with value: 0.28743524935773496 and parameters: {'model_type': 'graphsage', 'hidden_dims': '[512, 128]', 'dropout': 0.4900136544772989, 'batch_norm': True, 'sage_aggr': 'mean', 'sage_normalize': False, 'sage_project': False, 'lr': 0.0001707743272756013, 'weight_decay': 3.197683279797519e-06, 'epochs': 300, 'loss': 'mse', 'optimizer': 'adam', 'graph_mode': 'cutoff', 'cutoff': 0.8009843407462824, 'grm_norm': 'cosine', 'self_loops': True, 'use_snp_selection': False}. Best is trial 20 with value: 0.29259622689900605.
[I 2025-12-09 04:31:48,706] Trial 26 finished with value: 0.29085531330625564 and parameters: {'model_type': 'graphsage', 'hidden_dims': '[512, 128]', 'dropout': 0.49929308448647525, 'batch_norm': True, 'sage_aggr': 'mean', 'sage_normalize': True, 'sage_project': False, 'lr': 0.00018336463268987907, 'weight_decay': 2.4428739366637946e-06, 'epochs': 306, 'loss': 'mse', 'optimizer': 'adam', 'graph_mode': 'cutoff', 'cutoff': 0.7992880739320616, 'grm_norm': 'cosine', 'self_loops': True, 'use_snp_selection': True, 'num_snps': 58812}. Best is trial 20 with value: 0.29259622689900605.
[I 2025-12-09 04:35:09,171] Trial 27 finished with value: 0.2878313696196046 and parameters: {'model_type': 'graphsage', 'hidden_dims': '[512, 128]', 'dropout': 0.5952273873894229, 'batch_norm': False, 'sage_aggr': 'mean', 'sage_normalize': True, 'sage_project': False, 'lr': 0.0010299837783030177, 'weight_decay': 1.4937463612812352e-06, 'epochs': 350, 'loss': 'mse', 'optimizer': 'adam', 'graph_mode': 'cutoff', 'cutoff': 0.7262725074833234, 'grm_norm': 'cosine', 'self_loops': False, 'use_snp_selection': True, 'num_snps': 59748}. Best is trial 20 with value: 0.29259622689900605.
[I 2025-12-09 04:37:36,022] Trial 28 finished with value: 0.28860835437162846 and parameters: {'model_type': 'graphsage', 'hidden_dims': '[512, 128]', 'dropout': 0.5303032838468332, 'batch_norm': True, 'sage_aggr': 'mean', 'sage_normalize': True, 'sage_project': False, 'lr': 0.00023198632104867102, 'weight_decay': 1.3130542805847108e-05, 'epochs': 320, 'loss': 'mse', 'optimizer': 'adam', 'graph_mode': 'cutoff', 'cutoff': 0.8113774221051154, 'grm_norm': 'cosine', 'self_loops': True, 'use_snp_selection': True, 'num_snps': 46283}. Best is trial 20 with value: 0.29259622689900605.
[I 2025-12-09 04:41:41,783] Trial 29 finished with value: 0.27885685677450117 and parameters: {'model_type': 'graphsage', 'hidden_dims': '[512, 128]', 'dropout': 0.5295116328494738, 'batch_norm': True, 'sage_aggr': 'mean', 'sage_normalize': True, 'sage_project': False, 'lr': 0.00020429886512176584, 'weight_decay': 0.00011098001828420623, 'epochs': 322, 'loss': 'mse', 'optimizer': 'adam', 'graph_mode': 'knn', 'knn_k': 4, 'weighted_edges': True, 'symmetrize_mode': 'union', 'self_loops': True, 'use_snp_selection': True, 'num_snps': 44932}. Best is trial 20 with value: 0.29259622689900605.
[I 2025-12-09 04:43:44,696] Trial 30 finished with value: 0.2857088236256089 and parameters: {'model_type': 'graphsage', 'hidden_dims': '[512, 128]', 'dropout': 0.5237514586547387, 'batch_norm': True, 'sage_aggr': 'mean', 'sage_normalize': True, 'sage_project': False, 'lr': 0.00022474343867660184, 'weight_decay': 1.2910130371547061e-05, 'epochs': 226, 'loss': 'mse', 'optimizer': 'adam', 'graph_mode': 'cutoff', 'cutoff': 0.8261499189650389, 'grm_norm': 'cosine', 'self_loops': True, 'use_snp_selection': True, 'num_snps': 49124}. Best is trial 20 with value: 0.29259622689900605.
[I 2025-12-09 04:46:31,749] Trial 31 finished with value: 0.29152673378150107 and parameters: {'model_type': 'graphsage', 'hidden_dims': '[512, 128]', 'dropout': 0.42815862097005586, 'batch_norm': True, 'sage_aggr': 'mean', 'sage_normalize': True, 'sage_project': False, 'lr': 9.097509337765018e-05, 'weight_decay': 4.131635987562997e-05, 'epochs': 302, 'loss': 'mse', 'optimizer': 'adam', 'graph_mode': 'cutoff', 'cutoff': 0.8733587939449229, 'grm_norm': 'cosine', 'self_loops': True, 'use_snp_selection': True, 'num_snps': 55827}. Best is trial 20 with value: 0.29259622689900605.
[I 2025-12-09 04:49:14,250] Trial 32 finished with value: 0.29206170154388367 and parameters: {'model_type': 'graphsage', 'hidden_dims': '[512, 128]', 'dropout': 0.44057630883356824, 'batch_norm': True, 'sage_aggr': 'mean', 'sage_normalize': True, 'sage_project': False, 'lr': 0.00032098658948791464, 'weight_decay': 3.062441060246826e-05, 'epochs': 307, 'loss': 'mse', 'optimizer': 'adam', 'graph_mode': 'cutoff', 'cutoff': 0.8789355815500389, 'grm_norm': 'cosine', 'self_loops': True, 'use_snp_selection': True, 'num_snps': 52943}. Best is trial 20 with value: 0.29259622689900605.
[I 2025-12-09 04:51:35,005] Trial 33 finished with value: 0.28885511165524536 and parameters: {'model_type': 'graphsage', 'hidden_dims': '[512, 128]', 'dropout': 0.43737834164821404, 'batch_norm': True, 'sage_aggr': 'mean', 'sage_normalize': True, 'sage_project': False, 'lr': 9.888739742612626e-05, 'weight_decay': 0.0009709528483568254, 'epochs': 253, 'loss': 'mse', 'optimizer': 'adam', 'graph_mode': 'cutoff', 'cutoff': 0.8966731166764152, 'grm_norm': 'cosine', 'self_loops': True, 'use_snp_selection': True, 'num_snps': 53494}. Best is trial 20 with value: 0.29259622689900605.
[I 2025-12-09 04:53:36,584] Trial 34 finished with value: 0.2780349063656373 and parameters: {'model_type': 'graphsage', 'hidden_dims': '[512, 128]', 'dropout': 0.47667065998145125, 'batch_norm': False, 'sage_aggr': 'mean', 'sage_normalize': True, 'sage_project': False, 'lr': 0.0007074084022335506, 'weight_decay': 4.236648792552926e-05, 'epochs': 296, 'loss': 'mse', 'optimizer': 'adam', 'graph_mode': 'cutoff', 'cutoff': 0.86612014810906, 'grm_norm': 'cosine', 'self_loops': True, 'use_snp_selection': True, 'num_snps': 39728}. Best is trial 20 with value: 0.29259622689900605.
[I 2025-12-09 04:58:48,137] Trial 35 finished with value: 0.2801141744954861 and parameters: {'model_type': 'graphsage', 'hidden_dims': '[512, 128]', 'dropout': 0.37764418267144423, 'batch_norm': True, 'sage_aggr': 'mean', 'sage_normalize': True, 'sage_project': False, 'lr': 0.0003841803587896005, 'weight_decay': 0.0002994345252019774, 'epochs': 334, 'loss': 'mse', 'optimizer': 'adam', 'graph_mode': 'knn', 'knn_k': 4, 'weighted_edges': False, 'symmetrize_mode': 'union', 'self_loops': True, 'use_snp_selection': True, 'num_snps': 54547}. Best is trial 20 with value: 0.29259622689900605.
[I 2025-12-09 04:59:52,151] Trial 36 finished with value: 0.2771467735094756 and parameters: {'model_type': 'graphsage', 'hidden_dims': '[128, 64]', 'dropout': 0.4967037561409881, 'batch_norm': True, 'sage_aggr': 'mean', 'sage_normalize': True, 'sage_project': False, 'lr': 8.021081764073528e-05, 'weight_decay': 3.277505717309279e-05, 'epochs': 205, 'loss': 'mae', 'optimizer': 'adam', 'graph_mode': 'cutoff', 'cutoff': 0.7962065812208721, 'grm_norm': 'cosine', 'self_loops': False, 'use_snp_selection': True, 'num_snps': 43010}. Best is trial 20 with value: 0.29259622689900605.
[I 2025-12-09 05:02:35,753] Trial 37 finished with value: 0.2891902450954871 and parameters: {'model_type': 'graphsage', 'hidden_dims': '[512, 64]', 'dropout': 0.43231317039123957, 'batch_norm': True, 'sage_aggr': 'mean', 'sage_normalize': True, 'sage_project': False, 'lr': 0.00011472666161741797, 'weight_decay': 6.830905772253209e-05, 'epochs': 307, 'loss': 'mse', 'optimizer': 'adam', 'graph_mode': 'cutoff', 'cutoff': 0.8579316064283098, 'grm_norm': 'cosine', 'self_loops': True, 'use_snp_selection': True, 'num_snps': 54658}. Best is trial 20 with value: 0.29259622689900605.
[I 2025-12-09 05:04:26,352] Trial 38 finished with value: 0.24645308664294135 and parameters: {'model_type': 'graphsage', 'hidden_dims': '[512, 128]', 'dropout': 0.30029729197037885, 'batch_norm': False, 'sage_aggr': 'mean', 'sage_normalize': True, 'sage_project': False, 'lr': 0.000277300568075032, 'weight_decay': 0.0001630423932813769, 'epochs': 242, 'loss': 'mae', 'optimizer': 'adam', 'graph_mode': 'knn', 'knn_k': 3, 'weighted_edges': True, 'symmetrize_mode': 'union', 'self_loops': False, 'use_snp_selection': True, 'num_snps': 31162}. Best is trial 20 with value: 0.29259622689900605.
[I 2025-12-09 05:05:47,679] Trial 39 finished with value: 0.27782751007354395 and parameters: {'model_type': 'graphsage', 'hidden_dims': '[128, 64]', 'dropout': 0.4582408024140307, 'batch_norm': True, 'sage_aggr': 'mean', 'sage_normalize': True, 'sage_project': False, 'lr': 4.7478660541864446e-05, 'weight_decay': 2.9110884018572572e-05, 'epochs': 276, 'loss': 'mse', 'optimizer': 'adam', 'graph_mode': 'cutoff', 'cutoff': 0.4860238767949327, 'grm_norm': 'gcn', 'self_loops': True, 'use_snp_selection': True, 'num_snps': 36642}. Best is trial 20 with value: 0.29259622689900605.
[I 2025-12-09 05:07:36,711] Trial 40 finished with value: 0.27258052007159383 and parameters: {'model_type': 'graphsage', 'hidden_dims': '[256, 128]', 'dropout': 0.37364760882230624, 'batch_norm': True, 'sage_aggr': 'mean', 'sage_normalize': True, 'sage_project': False, 'lr': 0.0005356454767809245, 'weight_decay': 3.6538659499761956e-06, 'epochs': 286, 'loss': 'mae', 'optimizer': 'adam', 'graph_mode': 'knn', 'knn_k': 10, 'weighted_edges': False, 'symmetrize_mode': 'union', 'self_loops': True, 'use_snp_selection': True, 'num_snps': 19757}. Best is trial 20 with value: 0.29259622689900605.
[I 2025-12-09 05:10:17,500] Trial 41 finished with value: 0.2910902227173072 and parameters: {'model_type': 'graphsage', 'hidden_dims': '[512, 64]', 'dropout': 0.41225239102221584, 'batch_norm': True, 'sage_aggr': 'mean', 'sage_normalize': True, 'sage_project': False, 'lr': 0.00011769903013780059, 'weight_decay': 7.689552557440563e-05, 'epochs': 302, 'loss': 'mse', 'optimizer': 'adam', 'graph_mode': 'cutoff', 'cutoff': 0.8966718512019797, 'grm_norm': 'cosine', 'self_loops': True, 'use_snp_selection': True, 'num_snps': 54189}. Best is trial 20 with value: 0.29259622689900605.
[I 2025-12-09 05:13:07,729] Trial 42 finished with value: 0.2897432713942869 and parameters: {'model_type': 'graphsage', 'hidden_dims': '[512, 64]', 'dropout': 0.40877501362198587, 'batch_norm': True, 'sage_aggr': 'mean', 'sage_normalize': True, 'sage_project': False, 'lr': 0.0001263930173948539, 'weight_decay': 7.033013702264723e-05, 'epochs': 331, 'loss': 'mse', 'optimizer': 'adam', 'graph_mode': 'cutoff', 'cutoff': 0.893041337488976, 'grm_norm': 'cosine', 'self_loops': True, 'use_snp_selection': True, 'num_snps': 53536}. Best is trial 20 with value: 0.29259622689900605.
[I 2025-12-09 05:15:49,629] Trial 43 finished with value: 0.28918302961589964 and parameters: {'model_type': 'graphsage', 'hidden_dims': '[512, 64]', 'dropout': 0.4738993951083775, 'batch_norm': True, 'sage_aggr': 'mean', 'sage_normalize': True, 'sage_project': False, 'lr': 6.884464904511946e-05, 'weight_decay': 1.89470865087382e-05, 'epochs': 265, 'loss': 'mse', 'optimizer': 'adam', 'graph_mode': 'cutoff', 'cutoff': 0.7834567464262755, 'grm_norm': 'cosine', 'self_loops': True, 'use_snp_selection': True, 'num_snps': 59436}. Best is trial 20 with value: 0.29259622689900605.
[I 2025-12-09 05:18:21,023] Trial 44 finished with value: 0.290429169416223 and parameters: {'model_type': 'graphsage', 'hidden_dims': '[512, 64]', 'dropout': 0.31753315227070317, 'batch_norm': True, 'sage_aggr': 'mean', 'sage_normalize': True, 'sage_project': False, 'lr': 0.00034737436443887666, 'weight_decay': 4.9087885938431685e-05, 'epochs': 305, 'loss': 'mse', 'optimizer': 'adam', 'graph_mode': 'cutoff', 'cutoff': 0.8431567748586686, 'grm_norm': 'cosine', 'self_loops': True, 'use_snp_selection': True, 'num_snps': 49812}. Best is trial 20 with value: 0.29259622689900605.
[I 2025-12-09 05:20:58,403] Trial 45 finished with value: 0.2943558146606595 and parameters: {'model_type': 'graphsage', 'hidden_dims': '[512, 256]', 'dropout': 0.2073605855535144, 'batch_norm': True, 'sage_aggr': 'max', 'sage_normalize': True, 'sage_project': False, 'lr': 4.1250147870681404e-05, 'weight_decay': 8.667031330624429e-06, 'epochs': 288, 'loss': 'mse', 'optimizer': 'adam', 'graph_mode': 'cutoff', 'cutoff': 0.8355345076808961, 'grm_norm': 'cosine_then_gcn', 'self_loops': True, 'use_snp_selection': True, 'num_snps': 54849}. Best is trial 45 with value: 0.2943558146606595.
