[I 2025-12-09 08:06:20,051] Trial 33 finished with value: 0.2924666365095188 and parameters: {'model_type': 'graphsage', 'hidden_dims': '[512, 64]', 'dropout': 0.2992970549984788, 'batch_norm': False, 'sage_aggr': 'max', 'sage_normalize': False, 'sage_project': False, 'lr': 5.4024275995928934e-05, 'weight_decay': 9.847633645507743e-05, 'epochs': 196, 'loss': 'mae', 'optimizer': 'adam', 'graph_mode': 'knn', 'knn_k': 10, 'weighted_edges': True, 'symmetrize_mode': 'union', 'self_loops': False, 'use_snp_selection': True, 'num_snps': 27378}. Best is trial 16 with value: 0.3695824095459899.
[I 2025-12-09 08:09:38,601] Trial 34 finished with value: 0.3700476819227149 and parameters: {'model_type': 'graphsage', 'hidden_dims': '[512, 256]', 'dropout': 0.18705509414927268, 'batch_norm': False, 'sage_aggr': 'max', 'sage_normalize': False, 'sage_project': False, 'lr': 3.190526039930764e-05, 'weight_decay': 0.0002669660359747912, 'epochs': 223, 'loss': 'mse', 'optimizer': 'adam', 'graph_mode': 'knn', 'knn_k': 8, 'weighted_edges': True, 'symmetrize_mode': 'union', 'self_loops': True, 'use_snp_selection': True, 'num_snps': 36420}. Best is trial 34 with value: 0.3700476819227149.
[I 2025-12-09 08:13:41,987] Trial 35 finished with value: 0.35652085975835307 and parameters: {'model_type': 'graphsage', 'hidden_dims': '[512, 256]', 'dropout': 0.17327815202734115, 'batch_norm': False, 'sage_aggr': 'max', 'sage_normalize': False, 'sage_project': False, 'lr': 2.7470284266443473e-05, 'weight_decay': 3.8786199274965945e-05, 'epochs': 224, 'loss': 'mse', 'optimizer': 'adam', 'graph_mode': 'knn', 'knn_k': 7, 'weighted_edges': True, 'symmetrize_mode': 'union', 'self_loops': True, 'use_snp_selection': True, 'num_snps': 47339}. Best is trial 34 with value: 0.3700476819227149.
[I 2025-12-09 08:15:39,884] Trial 36 finished with value: 0.3538250745202153 and parameters: {'model_type': 'graphsage', 'hidden_dims': '[512, 256]', 'dropout': 0.13778283732204022, 'batch_norm': False, 'sage_aggr': 'max', 'sage_normalize': False, 'sage_project': False, 'lr': 2.147151734289944e-05, 'weight_decay': 0.00023591685505275247, 'epochs': 153, 'loss': 'mse', 'optimizer': 'adam', 'graph_mode': 'knn', 'knn_k': 5, 'weighted_edges': True, 'symmetrize_mode': 'union', 'self_loops': True, 'use_snp_selection': True, 'num_snps': 35757}. Best is trial 34 with value: 0.3700476819227149.
[I 2025-12-09 08:17:39,654] Trial 37 finished with value: 0.2024349585888005 and parameters: {'model_type': 'graphsage', 'hidden_dims': '[512, 256]', 'dropout': 0.2026473693389481, 'batch_norm': False, 'sage_aggr': 'max', 'sage_normalize': False, 'sage_project': False, 'lr': 0.00042521009518979737, 'weight_decay': 5.226016137238107e-06, 'epochs': 278, 'loss': 'mse', 'optimizer': 'adam', 'graph_mode': 'cutoff', 'cutoff': 0.8945493234971968, 'grm_norm': 'cosine_then_gcn', 'self_loops': True, 'use_snp_selection': False}. Best is trial 34 with value: 0.3700476819227149.
[I 2025-12-09 08:22:47,947] Trial 38 finished with value: 0.3271727924072159 and parameters: {'model_type': 'graphsage', 'hidden_dims': '[256, 128, 64]', 'dropout': 0.3400100445567421, 'batch_norm': False, 'sage_aggr': 'mean', 'sage_normalize': False, 'sage_project': False, 'lr': 0.0002467773326694892, 'weight_decay': 1.2772287459499418e-05, 'epochs': 347, 'loss': 'mse', 'optimizer': 'adam', 'graph_mode': 'knn', 'knn_k': 8, 'weighted_edges': True, 'symmetrize_mode': 'union', 'self_loops': True, 'use_snp_selection': True, 'num_snps': 45399}. Best is trial 34 with value: 0.3700476819227149.
[I 2025-12-09 08:24:19,518] Trial 39 finished with value: 0.36656525191492473 and parameters: {'model_type': 'graphsage', 'hidden_dims': '[512, 128]', 'dropout': 0.23461063322102535, 'batch_norm': False, 'sage_aggr': 'max', 'sage_normalize': False, 'sage_project': False, 'lr': 1.235520495984842e-05, 'weight_decay': 1.5046873254181599e-06, 'epochs': 138, 'loss': 'mse', 'optimizer': 'adam', 'graph_mode': 'cutoff', 'cutoff': 0.3718370032066165, 'grm_norm': 'cosine_then_gcn', 'self_loops': True, 'use_snp_selection': True, 'num_snps': 40193}. Best is trial 34 with value: 0.3700476819227149.
[I 2025-12-09 08:26:11,672] Trial 40 finished with value: 0.3191111437838722 and parameters: {'model_type': 'graphsage', 'hidden_dims': '[512, 128]', 'dropout': 0.1042655935320195, 'batch_norm': False, 'sage_aggr': 'max', 'sage_normalize': False, 'sage_project': False, 'lr': 1.0140802298746769e-05, 'weight_decay': 4.914257108931296e-07, 'epochs': 137, 'loss': 'mse', 'optimizer': 'adam', 'graph_mode': 'knn', 'knn_k': 6, 'weighted_edges': False, 'symmetrize_mode': 'union', 'self_loops': True, 'use_snp_selection': False}. Best is trial 34 with value: 0.3700476819227149.
[I 2025-12-09 08:27:55,558] Trial 41 finished with value: 0.37098553949101976 and parameters: {'model_type': 'graphsage', 'hidden_dims': '[512, 128]', 'dropout': 0.2347994666178765, 'batch_norm': False, 'sage_aggr': 'max', 'sage_normalize': False, 'sage_project': False, 'lr': 2.1235172769526562e-05, 'weight_decay': 1.977174657032247e-07, 'epochs': 164, 'loss': 'mse', 'optimizer': 'adam', 'graph_mode': 'cutoff', 'cutoff': 0.37378770072630935, 'grm_norm': 'cosine_then_gcn', 'self_loops': True, 'use_snp_selection': True, 'num_snps': 41663}. Best is trial 41 with value: 0.37098553949101976.
[I 2025-12-09 08:30:05,355] Trial 42 finished with value: 0.3641519016663718 and parameters: {'model_type': 'graphsage', 'hidden_dims': '[512, 128]', 'dropout': 0.2401279106623926, 'batch_norm': False, 'sage_aggr': 'max', 'sage_normalize': False, 'sage_project': False, 'lr': 1.618483632848212e-05, 'weight_decay': 1.1947756608959956e-07, 'epochs': 209, 'loss': 'mse', 'optimizer': 'adam', 'graph_mode': 'cutoff', 'cutoff': 0.3184117853618651, 'grm_norm': 'cosine_then_gcn', 'self_loops': True, 'use_snp_selection': True, 'num_snps': 41913}. Best is trial 41 with value: 0.37098553949101976.
[I 2025-12-09 08:31:38,397] Trial 43 finished with value: 0.3706815254646263 and parameters: {'model_type': 'graphsage', 'hidden_dims': '[512, 128]', 'dropout': 0.14612409362068027, 'batch_norm': False, 'sage_aggr': 'max', 'sage_normalize': False, 'sage_project': False, 'lr': 2.5028950816412076e-05, 'weight_decay': 2.79435613831514e-07, 'epochs': 184, 'loss': 'mse', 'optimizer': 'adam', 'graph_mode': 'cutoff', 'cutoff': 0.43534860294176964, 'grm_norm': 'cosine_then_gcn', 'self_loops': True, 'use_snp_selection': True, 'num_snps': 35579}. Best is trial 41 with value: 0.37098553949101976.
[I 2025-12-09 08:33:10,242] Trial 44 finished with value: 0.36538595011928277 and parameters: {'model_type': 'graphsage', 'hidden_dims': '[512, 128]', 'dropout': 0.14065668566081319, 'batch_norm': False, 'sage_aggr': 'mean', 'sage_normalize': False, 'sage_project': False, 'lr': 1.0460935380055233e-05, 'weight_decay': 2.3473024746386127e-07, 'epochs': 191, 'loss': 'mse', 'optimizer': 'adam', 'graph_mode': 'cutoff', 'cutoff': 0.425338433014077, 'grm_norm': 'cosine_then_gcn', 'self_loops': True, 'use_snp_selection': True, 'num_snps': 35608}. Best is trial 41 with value: 0.37098553949101976.
[I 2025-12-09 08:35:42,361] Trial 45 finished with value: 0.36612732300315853 and parameters: {'model_type': 'graphsage', 'hidden_dims': '[512, 128]', 'dropout': 0.1878611726451337, 'batch_norm': False, 'sage_aggr': 'max', 'sage_normalize': False, 'sage_project': False, 'lr': 2.523654463635603e-05, 'weight_decay': 1.3184886194129964e-06, 'epochs': 234, 'loss': 'mse', 'optimizer': 'adam', 'graph_mode': 'cutoff', 'cutoff': 0.4402986665988261, 'grm_norm': 'cosine_then_gcn', 'self_loops': True, 'use_snp_selection': True, 'num_snps': 51220}. Best is trial 41 with value: 0.37098553949101976.
[I 2025-12-09 08:37:59,016] Trial 46 finished with value: 0.3639816339612839 and parameters: {'model_type': 'graphsage', 'hidden_dims': '[512, 128]', 'dropout': 0.1485199675763136, 'batch_norm': False, 'sage_aggr': 'max', 'sage_normalize': False, 'sage_project': False, 'lr': 1.5078418088590883e-05, 'weight_decay': 2.2115217360715604e-07, 'epochs': 177, 'loss': 'mse', 'optimizer': 'adam', 'graph_mode': 'cutoff', 'cutoff': 0.29788157113999464, 'grm_norm': 'cosine_then_gcn', 'self_loops': True, 'use_snp_selection': True, 'num_snps': 45200}. Best is trial 41 with value: 0.37098553949101976.
[I 2025-12-09 08:39:23,008] Trial 47 finished with value: 0.3669383413666427 and parameters: {'model_type': 'graphsage', 'hidden_dims': '[512, 128]', 'dropout': 0.21801372108982697, 'batch_norm': False, 'sage_aggr': 'max', 'sage_normalize': False, 'sage_project': False, 'lr': 4.4823225913481926e-05, 'weight_decay': 2.9082036078428034e-07, 'epochs': 210, 'loss': 'mse', 'optimizer': 'adam', 'graph_mode': 'cutoff', 'cutoff': 0.4521902788671198, 'grm_norm': 'cosine_then_gcn', 'self_loops': True, 'use_snp_selection': True, 'num_snps': 28280}. Best is trial 41 with value: 0.37098553949101976.
[I 2025-12-09 08:41:02,609] Trial 48 finished with value: 0.35616255434052696 and parameters: {'model_type': 'graphsage', 'hidden_dims': '[512, 128]', 'dropout': 0.2167543893271761, 'batch_norm': False, 'sage_aggr': 'max', 'sage_normalize': False, 'sage_project': False, 'lr': 3.604663260050929e-05, 'weight_decay': 2.4957853918203155e-07, 'epochs': 247, 'loss': 'mse', 'optimizer': 'adam', 'graph_mode': 'cutoff', 'cutoff': 0.428481806041302, 'grm_norm': 'none', 'self_loops': True, 'use_snp_selection': True, 'num_snps': 30003}. Best is trial 41 with value: 0.37098553949101976.
[I 2025-12-09 08:42:15,535] Trial 49 finished with value: 0.3413893913204862 and parameters: {'model_type': 'graphsage', 'hidden_dims': '[512, 128]', 'dropout': 0.15754732326098292, 'batch_norm': False, 'sage_aggr': 'mean', 'sage_normalize': False, 'sage_project': False, 'lr': 8.99841721904672e-05, 'weight_decay': 4.4531655305229196e-07, 'epochs': 214, 'loss': 'mse', 'optimizer': 'adam', 'graph_mode': 'cutoff', 'cutoff': 0.590178793250246, 'grm_norm': 'cosine', 'self_loops': True, 'use_snp_selection': True, 'num_snps': 28335}. Best is trial 41 with value: 0.37098553949101976.
[I 2025-12-09 08:44:26,113] Trial 50 finished with value: 0.363280021319706 and parameters: {'model_type': 'graphsage', 'hidden_dims': '[512, 128]', 'dropout': 0.1948127273540201, 'batch_norm': False, 'sage_aggr': 'max', 'sage_normalize': False, 'sage_project': False, 'lr': 4.3806902292489084e-05, 'weight_decay': 1.813039357890475e-07, 'epochs': 221, 'loss': 'mse', 'optimizer': 'adam', 'graph_mode': 'cutoff', 'cutoff': 0.2759354082087194, 'grm_norm': 'cosine_then_gcn', 'self_loops': True, 'use_snp_selection': True, 'num_snps': 33472}. Best is trial 41 with value: 0.37098553949101976.
[I 2025-12-09 08:46:07,437] Trial 51 finished with value: 0.36781220553885585 and parameters: {'model_type': 'graphsage', 'hidden_dims': '[512, 128]', 'dropout': 0.24805362527103153, 'batch_norm': False, 'sage_aggr': 'max', 'sage_normalize': False, 'sage_project': False, 'lr': 1.819029447942174e-05, 'weight_decay': 1.1519013865509861e-06, 'epochs': 190, 'loss': 'mse', 'optimizer': 'adam', 'graph_mode': 'cutoff', 'cutoff': 0.4663605226780041, 'grm_norm': 'cosine_then_gcn', 'self_loops': True, 'use_snp_selection': True, 'num_snps': 38614}. Best is trial 41 with value: 0.37098553949101976.
[I 2025-12-09 08:47:40,257] Trial 52 finished with value: 0.3618931048576751 and parameters: {'model_type': 'graphsage', 'hidden_dims': '[512, 128]', 'dropout': 0.13039999130290175, 'batch_norm': False, 'sage_aggr': 'max', 'sage_normalize': False, 'sage_project': False, 'lr': 1.9936087218859363e-05, 'weight_decay': 3.484417175804165e-07, 'epochs': 189, 'loss': 'mse', 'optimizer': 'adam', 'graph_mode': 'cutoff', 'cutoff': 0.47093781902109977, 'grm_norm': 'cosine_then_gcn', 'self_loops': True, 'use_snp_selection': True, 'num_snps': 35641}. Best is trial 41 with value: 0.37098553949101976.
[I 2025-12-09 08:49:12,322] Trial 53 finished with value: 0.3516817211807701 and parameters: {'model_type': 'graphsage', 'hidden_dims': '[512, 128]', 'dropout': 0.2662930740977659, 'batch_norm': False, 'sage_aggr': 'max', 'sage_normalize': False, 'sage_project': False, 'lr': 2.439464409008611e-05, 'weight_decay': 1.4337988445803146e-07, 'epochs': 267, 'loss': 'mse', 'optimizer': 'adam', 'graph_mode': 'cutoff', 'cutoff': 0.5704097240877984, 'grm_norm': 'cosine_then_gcn', 'self_loops': True, 'use_snp_selection': True, 'num_snps': 31907}. Best is trial 41 with value: 0.37098553949101976.
[I 2025-12-09 08:50:36,759] Trial 54 finished with value: 0.3689583931159076 and parameters: {'model_type': 'graphsage', 'hidden_dims': '[128, 64]', 'dropout': 0.12281632894034583, 'batch_norm': False, 'sage_aggr': 'max', 'sage_normalize': False, 'sage_project': False, 'lr': 7.222266298596593e-05, 'weight_decay': 8.663549597151174e-07, 'epochs': 196, 'loss': 'mse', 'optimizer': 'adam', 'graph_mode': 'cutoff', 'cutoff': 0.4158157471683548, 'grm_norm': 'cosine_then_gcn', 'self_loops': True, 'use_snp_selection': True, 'num_snps': 43395}. Best is trial 41 with value: 0.37098553949101976.
[I 2025-12-09 08:52:02,373] Trial 55 finished with value: 0.3726311659269051 and parameters: {'model_type': 'graphsage', 'hidden_dims': '[128, 64]', 'dropout': 0.11294725732471103, 'batch_norm': False, 'sage_aggr': 'max', 'sage_normalize': False, 'sage_project': False, 'lr': 8.096092717266167e-05, 'weight_decay': 7.660951684134994e-07, 'epochs': 200, 'loss': 'mse', 'optimizer': 'adam', 'graph_mode': 'cutoff', 'cutoff': 0.39655893139550324, 'grm_norm': 'cosine_then_gcn', 'self_loops': True, 'use_snp_selection': True, 'num_snps': 42832}. Best is trial 55 with value: 0.3726311659269051.
[I 2025-12-09 08:53:42,137] Trial 56 finished with value: 0.36395562422835387 and parameters: {'model_type': 'graphsage', 'hidden_dims': '[128, 64]', 'dropout': 0.12043304569599768, 'batch_norm': False, 'sage_aggr': 'max', 'sage_normalize': False, 'sage_project': False, 'lr': 7.65483429314681e-05, 'weight_decay': 8.933058902530556e-07, 'epochs': 199, 'loss': 'mse', 'optimizer': 'adam', 'graph_mode': 'cutoff', 'cutoff': 0.408153350043745, 'grm_norm': 'cosine_then_gcn', 'self_loops': True, 'use_snp_selection': True, 'num_snps': 52456}. Best is trial 55 with value: 0.3726311659269051.
[I 2025-12-09 08:54:33,121] Trial 57 finished with value: 0.31233782508177227 and parameters: {'model_type': 'graphsage', 'hidden_dims': '[128, 64]', 'dropout': 0.10046523453031139, 'batch_norm': True, 'sage_aggr': 'max', 'sage_normalize': False, 'sage_project': False, 'lr': 6.655318971304543e-05, 'weight_decay': 1.9671827712488962e-06, 'epochs': 177, 'loss': 'mse', 'optimizer': 'adam', 'graph_mode': 'cutoff', 'cutoff': 0.33982215305390173, 'grm_norm': 'cosine_then_gcn', 'self_loops': True, 'use_snp_selection': False}. Best is trial 55 with value: 0.3726311659269051.
[I 2025-12-09 08:55:45,436] Trial 58 finished with value: 0.36025568193292073 and parameters: {'model_type': 'graphsage', 'hidden_dims': '[128, 64]', 'dropout': 0.12110052784526519, 'batch_norm': False, 'sage_aggr': 'max', 'sage_normalize': False, 'sage_project': False, 'lr': 0.00012402207522097192, 'weight_decay': 6.887771786917073e-07, 'epochs': 237, 'loss': 'mse', 'optimizer': 'adam', 'graph_mode': 'cutoff', 'cutoff': 0.5152838906882647, 'grm_norm': 'cosine', 'self_loops': True, 'use_snp_selection': True, 'num_snps': 43984}. Best is trial 55 with value: 0.3726311659269051.
[I 2025-12-09 08:57:34,896] Trial 59 finished with value: 0.32503452199799615 and parameters: {'model_type': 'graphsage', 'hidden_dims': '[128, 64]', 'dropout': 0.15995009049118059, 'batch_norm': False, 'sage_aggr': 'mean', 'sage_normalize': True, 'sage_project': False, 'lr': 0.009128545921208427, 'weight_decay': 3.7017969140342177e-07, 'epochs': 160, 'loss': 'mse', 'optimizer': 'adam', 'graph_mode': 'cutoff', 'cutoff': 0.27438732397058707, 'grm_norm': 'none', 'self_loops': True, 'use_snp_selection': True, 'num_snps': 48222}. Best is trial 55 with value: 0.3726311659269051.
[I 2025-12-09 08:58:46,857] Trial 60 finished with value: 0.3399316969459784 and parameters: {'model_type': 'graphsage', 'hidden_dims': '[128, 64]', 'dropout': 0.18698175965719374, 'batch_norm': False, 'sage_aggr': 'max', 'sage_normalize': False, 'sage_project': False, 'lr': 3.187260630014418e-05, 'weight_decay': 3.604845486851037e-06, 'epochs': 296, 'loss': 'mse', 'optimizer': 'adam', 'graph_mode': 'cutoff', 'cutoff': 0.6268381079832874, 'grm_norm': 'gcn', 'self_loops': True, 'use_snp_selection': True, 'num_snps': 43218}. Best is trial 55 with value: 0.3726311659269051.
[I 2025-12-09 08:59:56,330] Trial 61 finished with value: 0.36420732715083576 and parameters: {'model_type': 'graphsage', 'hidden_dims': '[128, 64]', 'dropout': 0.16135589068672646, 'batch_norm': False, 'sage_aggr': 'max', 'sage_normalize': False, 'sage_project': False, 'lr': 1.616907075703125e-05, 'weight_decay': 9.613923739566625e-07, 'epochs': 184, 'loss': 'mse', 'optimizer': 'adam', 'graph_mode': 'cutoff', 'cutoff': 0.4764309408659464, 'grm_norm': 'cosine_then_gcn', 'self_loops': True, 'use_snp_selection': True, 'num_snps': 37714}. Best is trial 55 with value: 0.3726311659269051.
[I 2025-12-09 09:01:24,042] Trial 62 finished with value: 0.3680310381252124 and parameters: {'model_type': 'graphsage', 'hidden_dims': '[256, 128]', 'dropout': 0.11988447403597385, 'batch_norm': False, 'sage_aggr': 'max', 'sage_normalize': False, 'sage_project': False, 'lr': 4.907548516384017e-05, 'weight_decay': 1.0866875487653748e-06, 'epochs': 202, 'loss': 'mse', 'optimizer': 'adam', 'graph_mode': 'cutoff', 'cutoff': 0.39750521394836086, 'grm_norm': 'cosine_then_gcn', 'self_loops': True, 'use_snp_selection': True, 'num_snps': 38010}. Best is trial 55 with value: 0.3726311659269051.
[I 2025-12-09 09:03:23,140] Trial 63 finished with value: 0.36075916125753194 and parameters: {'model_type': 'graphsage', 'hidden_dims': '[256, 128]', 'dropout': 0.11842489602643926, 'batch_norm': False, 'sage_aggr': 'max', 'sage_normalize': False, 'sage_project': False, 'lr': 4.6406110706795804e-05, 'weight_decay': 0.0005263682700961344, 'epochs': 203, 'loss': 'mse', 'optimizer': 'adam', 'graph_mode': 'cutoff', 'cutoff': 0.403227578389487, 'grm_norm': 'cosine_then_gcn', 'self_loops': True, 'use_snp_selection': True, 'num_snps': 53883}. Best is trial 55 with value: 0.3726311659269051.
[I 2025-12-09 09:05:31,356] Trial 64 finished with value: 0.3509880183476103 and parameters: {'model_type': 'graphsage', 'hidden_dims': '[256, 128]', 'dropout': 0.17947358298827498, 'batch_norm': False, 'sage_aggr': 'max', 'sage_normalize': False, 'sage_project': False, 'lr': 0.00010833652314624315, 'weight_decay': 6.208233551913684e-07, 'epochs': 223, 'loss': 'mse', 'optimizer': 'adam', 'graph_mode': 'cutoff', 'cutoff': 0.3339310028081796, 'grm_norm': 'none', 'self_loops': True, 'use_snp_selection': True, 'num_snps': 46631}. Best is trial 55 with value: 0.3726311659269051.
[I 2025-12-09 09:07:01,089] Trial 65 finished with value: 0.36423332347853965 and parameters: {'model_type': 'graphsage', 'hidden_dims': '[256, 128]', 'dropout': 0.13130846101878366, 'batch_norm': False, 'sage_aggr': 'max', 'sage_normalize': False, 'sage_project': False, 'lr': 7.752278866964398e-05, 'weight_decay': 1.7478134483648954e-07, 'epochs': 175, 'loss': 'mse', 'optimizer': 'adam', 'graph_mode': 'cutoff', 'cutoff': 0.3781103657925096, 'grm_norm': 'cosine_then_gcn', 'self_loops': True, 'use_snp_selection': True, 'num_snps': 42486}. Best is trial 55 with value: 0.3726311659269051.
[I 2025-12-09 09:07:58,880] Trial 66 finished with value: 0.35758190128379963 and parameters: {'model_type': 'graphsage', 'hidden_dims': '[256, 128]', 'dropout': 0.15219739894815235, 'batch_norm': True, 'sage_aggr': 'max', 'sage_normalize': False, 'sage_project': False, 'lr': 0.00015013299715348715, 'weight_decay': 3.3448481427493536e-07, 'epochs': 146, 'loss': 'mse', 'optimizer': 'adam', 'graph_mode': 'cutoff', 'cutoff': 0.5434684488138416, 'grm_norm': 'cosine_then_gcn', 'self_loops': True, 'use_snp_selection': True, 'num_snps': 36878}. Best is trial 55 with value: 0.3726311659269051.
[I 2025-12-09 09:09:20,800] Trial 67 finished with value: 0.35991946643415773 and parameters: {'model_type': 'graphsage', 'hidden_dims': '[256, 128, 64]', 'dropout': 0.11590456002805027, 'batch_norm': False, 'sage_aggr': 'max', 'sage_normalize': False, 'sage_project': False, 'lr': 9.706073871055462e-05, 'weight_decay': 1.0326617836416362e-07, 'epochs': 218, 'loss': 'mse', 'optimizer': 'adam', 'graph_mode': 'cutoff', 'cutoff': 0.3975545390921391, 'grm_norm': 'cosine_then_gcn', 'self_loops': True, 'use_snp_selection': True, 'num_snps': 34192}. Best is trial 55 with value: 0.3726311659269051.
[I 2025-12-09 09:10:24,674] Trial 68 finished with value: 0.3360746150948778 and parameters: {'model_type': 'graphsage', 'hidden_dims': '[128, 64]', 'dropout': 0.1730193897555878, 'batch_norm': False, 'sage_aggr': 'max', 'sage_normalize': True, 'sage_project': False, 'lr': 5.449489635687706e-05, 'weight_decay': 1.808074700923837e-06, 'epochs': 247, 'loss': 'mse', 'optimizer': 'adam', 'graph_mode': 'knn', 'knn_k': 4, 'weighted_edges': False, 'symmetrize_mode': 'mutual', 'self_loops': True, 'use_snp_selection': False}. Best is trial 55 with value: 0.3726311659269051.
[I 2025-12-09 09:11:39,642] Trial 69 finished with value: 0.35293523402118765 and parameters: {'model_type': 'graphsage', 'hidden_dims': '[256, 128]', 'dropout': 0.19939765604030962, 'batch_norm': False, 'sage_aggr': 'max', 'sage_normalize': False, 'sage_project': False, 'lr': 3.503327787423337e-05, 'weight_decay': 9.556346753088439e-05, 'epochs': 159, 'loss': 'mse', 'optimizer': 'adam', 'graph_mode': 'cutoff', 'cutoff': 0.49237532566859676, 'grm_norm': 'gcn', 'self_loops': True, 'use_snp_selection': True, 'num_snps': 40663}. Best is trial 55 with value: 0.3726311659269051.
