[I 2025-12-09 05:32:50,138] Trial 117 finished with value: 0.29634625487517346 and parameters: {'model_type': 'graphsage', 'hidden_dims': '[512, 256]', 'dropout': 0.5098115335259399, 'batch_norm': False, 'sage_aggr': 'mean', 'sage_normalize': True, 'sage_project': False, 'lr': 0.0056440751024422085, 'weight_decay': 1.0593799828429283e-07, 'epochs': 339, 'loss': 'mse', 'optimizer': 'adam', 'graph_mode': 'cutoff', 'cutoff': 0.41955819890882795, 'grm_norm': 'cosine_then_gcn', 'self_loops': True, 'use_snp_selection': False}. Best is trial 82 with value: 0.3095226162433806.
[I 2025-12-09 05:37:04,846] Trial 118 finished with value: 0.29050619910928777 and parameters: {'model_type': 'graphsage', 'hidden_dims': '[512, 256]', 'dropout': 0.46202203121722984, 'batch_norm': True, 'sage_aggr': 'mean', 'sage_normalize': True, 'sage_project': False, 'lr': 0.003263035546948083, 'weight_decay': 2.504184596127117e-07, 'epochs': 305, 'loss': 'mae', 'optimizer': 'adam', 'graph_mode': 'knn', 'knn_k': 10, 'weighted_edges': False, 'symmetrize_mode': 'mutual', 'self_loops': True, 'use_snp_selection': False}. Best is trial 82 with value: 0.3095226162433806.
[I 2025-12-09 05:40:36,663] Trial 119 finished with value: 0.29646688192158777 and parameters: {'model_type': 'graphsage', 'hidden_dims': '[512, 256]', 'dropout': 0.4703278998697496, 'batch_norm': False, 'sage_aggr': 'mean', 'sage_normalize': True, 'sage_project': False, 'lr': 0.003946272219072147, 'weight_decay': 5.370479630860359e-07, 'epochs': 317, 'loss': 'mse', 'optimizer': 'adam', 'graph_mode': 'cutoff', 'cutoff': 0.3377581336814739, 'grm_norm': 'cosine_then_gcn', 'self_loops': True, 'use_snp_selection': False}. Best is trial 82 with value: 0.3095226162433806.
[I 2025-12-09 05:43:58,569] Trial 120 finished with value: 0.3063858122251437 and parameters: {'model_type': 'graphsage', 'hidden_dims': '[512, 256]', 'dropout': 0.4350196736217814, 'batch_norm': False, 'sage_aggr': 'mean', 'sage_normalize': True, 'sage_project': False, 'lr': 0.0024553120808041657, 'weight_decay': 1.5418947999219552e-07, 'epochs': 261, 'loss': 'mse', 'optimizer': 'adam', 'graph_mode': 'cutoff', 'cutoff': 0.29252412908467135, 'grm_norm': 'cosine_then_gcn', 'self_loops': True, 'use_snp_selection': True, 'num_snps': 39873}. Best is trial 82 with value: 0.3095226162433806.
[I 2025-12-09 05:46:52,931] Trial 121 finished with value: 0.3032520307249847 and parameters: {'model_type': 'graphsage', 'hidden_dims': '[512, 256]', 'dropout': 0.4376794116167143, 'batch_norm': False, 'sage_aggr': 'mean', 'sage_normalize': True, 'sage_project': False, 'lr': 0.0025005670616466574, 'weight_decay': 1.5323227520472172e-07, 'epochs': 217, 'loss': 'mse', 'optimizer': 'adam', 'graph_mode': 'cutoff', 'cutoff': 0.2921320196417391, 'grm_norm': 'cosine_then_gcn', 'self_loops': True, 'use_snp_selection': True, 'num_snps': 41172}. Best is trial 82 with value: 0.3095226162433806.
[I 2025-12-09 05:50:18,777] Trial 122 finished with value: 0.30175515126407965 and parameters: {'model_type': 'graphsage', 'hidden_dims': '[512, 256]', 'dropout': 0.4108991021888256, 'batch_norm': False, 'sage_aggr': 'mean', 'sage_normalize': True, 'sage_project': False, 'lr': 0.0028912769368923596, 'weight_decay': 6.606218670813867e-07, 'epochs': 296, 'loss': 'mse', 'optimizer': 'adam', 'graph_mode': 'cutoff', 'cutoff': 0.32105381978926123, 'grm_norm': 'cosine_then_gcn', 'self_loops': True, 'use_snp_selection': True, 'num_snps': 40987}. Best is trial 82 with value: 0.3095226162433806.
[I 2025-12-09 05:52:33,204] Trial 123 finished with value: 0.30153976298180074 and parameters: {'model_type': 'graphsage', 'hidden_dims': '[512, 256]', 'dropout': 0.48855129964203003, 'batch_norm': False, 'sage_aggr': 'mean', 'sage_normalize': True, 'sage_project': False, 'lr': 0.004710694932607025, 'weight_decay': 1.8623083620596203e-07, 'epochs': 264, 'loss': 'mse', 'optimizer': 'adam', 'graph_mode': 'cutoff', 'cutoff': 0.3076885210621162, 'grm_norm': 'cosine_then_gcn', 'self_loops': True, 'use_snp_selection': True, 'num_snps': 29116}. Best is trial 82 with value: 0.3095226162433806.
[I 2025-12-09 05:57:18,542] Trial 124 finished with value: 0.29661073676148353 and parameters: {'model_type': 'graphsage', 'hidden_dims': '[512, 256]', 'dropout': 0.4458944844958281, 'batch_norm': False, 'sage_aggr': 'mean', 'sage_normalize': True, 'sage_project': False, 'lr': 0.002201241706992586, 'weight_decay': 3.227820612109902e-07, 'epochs': 327, 'loss': 'mse', 'optimizer': 'adam', 'graph_mode': 'cutoff', 'cutoff': 0.348566787665449, 'grm_norm': 'gcn', 'self_loops': True, 'use_snp_selection': True, 'num_snps': 51758}. Best is trial 82 with value: 0.3095226162433806.
[I 2025-12-09 06:00:00,587] Trial 125 finished with value: 0.30010529039442196 and parameters: {'model_type': 'graphsage', 'hidden_dims': '[512, 256]', 'dropout': 0.42996309429192064, 'batch_norm': False, 'sage_aggr': 'mean', 'sage_normalize': True, 'sage_project': False, 'lr': 0.003242910689456893, 'weight_decay': 1.2822411740945157e-07, 'epochs': 344, 'loss': 'mse', 'optimizer': 'adam', 'graph_mode': 'cutoff', 'cutoff': 0.3970968847529362, 'grm_norm': 'cosine_then_gcn', 'self_loops': True, 'use_snp_selection': True, 'num_snps': 35456}. Best is trial 82 with value: 0.3095226162433806.
[I 2025-12-09 06:02:33,358] Trial 126 finished with value: 0.30400855205658817 and parameters: {'model_type': 'graphsage', 'hidden_dims': '[512, 256]', 'dropout': 0.39876005362883876, 'batch_norm': False, 'sage_aggr': 'mean', 'sage_normalize': True, 'sage_project': False, 'lr': 0.006638777717592669, 'weight_decay': 2.489887929454595e-07, 'epochs': 288, 'loss': 'mse', 'optimizer': 'adam', 'graph_mode': 'cutoff', 'cutoff': 0.6746604351936739, 'grm_norm': 'cosine_then_gcn', 'self_loops': False, 'use_snp_selection': False}. Best is trial 82 with value: 0.3095226162433806.
[I 2025-12-09 06:07:24,282] Trial 127 finished with value: 0.2945525242778968 and parameters: {'model_type': 'graphsage', 'hidden_dims': '[512, 256]', 'dropout': 0.42047529164533165, 'batch_norm': False, 'sage_aggr': 'mean', 'sage_normalize': True, 'sage_project': False, 'lr': 0.003950969327535835, 'weight_decay': 4.2549986872885665e-07, 'epochs': 336, 'loss': 'mse', 'optimizer': 'adam', 'graph_mode': 'cutoff', 'cutoff': 0.271618970721779, 'grm_norm': 'cosine_then_gcn', 'self_loops': True, 'use_snp_selection': False}. Best is trial 82 with value: 0.3095226162433806.
[I 2025-12-09 06:10:06,660] Trial 128 finished with value: 0.0 and parameters: {'model_type': 'graphsage', 'hidden_dims': '[512, 256]', 'dropout': 0.49917110586846786, 'batch_norm': False, 'sage_aggr': 'mean', 'sage_normalize': False, 'sage_project': False, 'lr': 0.005280427255954014, 'weight_decay': 7.889379805937936e-07, 'epochs': 240, 'loss': 'mse', 'optimizer': 'adam', 'graph_mode': 'cutoff', 'cutoff': 0.3329978611889072, 'grm_norm': 'cosine', 'self_loops': True, 'use_snp_selection': False}. Best is trial 82 with value: 0.3095226162433806.
[I 2025-12-09 06:12:34,729] Trial 129 finished with value: 0.27621194374409364 and parameters: {'model_type': 'graphsage', 'hidden_dims': '[512, 64]', 'dropout': 0.45011294439337124, 'batch_norm': False, 'sage_aggr': 'mean', 'sage_normalize': True, 'sage_project': False, 'lr': 0.002446459825959546, 'weight_decay': 1.0014812105022786e-07, 'epochs': 181, 'loss': 'mse', 'optimizer': 'adam', 'graph_mode': 'cutoff', 'cutoff': 0.29182084617154114, 'grm_norm': 'cosine_then_gcn', 'self_loops': True, 'use_snp_selection': False}. Best is trial 82 with value: 0.3095226162433806.
[I 2025-12-09 06:13:59,054] Trial 130 finished with value: 0.2924193780030245 and parameters: {'model_type': 'graphsage', 'hidden_dims': '[512, 256]', 'dropout': 0.41002735552743025, 'batch_norm': False, 'sage_aggr': 'max', 'sage_normalize': True, 'sage_project': False, 'lr': 0.0034160091519190887, 'weight_decay': 1.4309868907654185e-07, 'epochs': 201, 'loss': 'mse', 'optimizer': 'adam', 'graph_mode': 'cutoff', 'cutoff': 0.2824129198216153, 'grm_norm': 'cosine_then_gcn', 'self_loops': True, 'use_snp_selection': True, 'num_snps': 20982}. Best is trial 82 with value: 0.3095226162433806.
[I 2025-12-09 06:17:33,933] Trial 131 finished with value: 0.2962255943624549 and parameters: {'model_type': 'graphsage', 'hidden_dims': '[128, 64]', 'dropout': 0.3968316411516867, 'batch_norm': False, 'sage_aggr': 'mean', 'sage_normalize': True, 'sage_project': False, 'lr': 0.0020687328014103662, 'weight_decay': 1.9088625492860804e-07, 'epochs': 319, 'loss': 'mse', 'optimizer': 'adam', 'graph_mode': 'cutoff', 'cutoff': 0.22890809287337174, 'grm_norm': 'cosine_then_gcn', 'self_loops': True, 'use_snp_selection': False}. Best is trial 82 with value: 0.3095226162433806.
[I 2025-12-09 06:22:39,306] Trial 132 finished with value: 0.3036037157505891 and parameters: {'model_type': 'graphsage', 'hidden_dims': '[512, 256]', 'dropout': 0.43514927628137945, 'batch_norm': False, 'sage_aggr': 'mean', 'sage_normalize': True, 'sage_project': False, 'lr': 0.002770439471150504, 'weight_decay': 3.551734109086739e-07, 'epochs': 323, 'loss': 'mse', 'optimizer': 'adam', 'graph_mode': 'cutoff', 'cutoff': 0.2491542135905131, 'grm_norm': 'cosine_then_gcn', 'self_loops': True, 'use_snp_selection': False}. Best is trial 82 with value: 0.3095226162433806.
[I 2025-12-09 06:27:13,865] Trial 133 finished with value: 0.30710114012041134 and parameters: {'model_type': 'graphsage', 'hidden_dims': '[512, 256]', 'dropout': 0.382282120566961, 'batch_norm': False, 'sage_aggr': 'mean', 'sage_normalize': True, 'sage_project': False, 'lr': 0.0017839663609138445, 'weight_decay': 2.262881327146464e-07, 'epochs': 312, 'loss': 'mse', 'optimizer': 'adam', 'graph_mode': 'cutoff', 'cutoff': 0.2675219013716285, 'grm_norm': 'cosine_then_gcn', 'self_loops': True, 'use_snp_selection': False}. Best is trial 82 with value: 0.3095226162433806.
[I 2025-12-09 06:31:12,494] Trial 134 finished with value: 0.2926227041337751 and parameters: {'model_type': 'graphsage', 'hidden_dims': '[512, 256]', 'dropout': 0.37694792894673174, 'batch_norm': False, 'sage_aggr': 'mean', 'sage_normalize': True, 'sage_project': False, 'lr': 0.004192841123420479, 'weight_decay': 2.5193362400301964e-07, 'epochs': 309, 'loss': 'mse', 'optimizer': 'adam', 'graph_mode': 'cutoff', 'cutoff': 0.30637577616154643, 'grm_norm': 'cosine_then_gcn', 'self_loops': True, 'use_snp_selection': False}. Best is trial 82 with value: 0.3095226162433806.
[I 2025-12-09 06:35:27,745] Trial 135 finished with value: 0.30361324388703237 and parameters: {'model_type': 'graphsage', 'hidden_dims': '[512, 256]', 'dropout': 0.4795266822811949, 'batch_norm': False, 'sage_aggr': 'mean', 'sage_normalize': True, 'sage_project': False, 'lr': 0.0015012301437880697, 'weight_decay': 9.802473920584958e-07, 'epochs': 301, 'loss': 'mse', 'optimizer': 'adam', 'graph_mode': 'cutoff', 'cutoff': 0.2780486943528291, 'grm_norm': 'cosine_then_gcn', 'self_loops': True, 'use_snp_selection': False}. Best is trial 82 with value: 0.3095226162433806.
[I 2025-12-09 06:40:06,065] Trial 136 finished with value: 0.3014814927834629 and parameters: {'model_type': 'graphsage', 'hidden_dims': '[512, 256]', 'dropout': 0.42027183913060023, 'batch_norm': False, 'sage_aggr': 'mean', 'sage_normalize': True, 'sage_project': False, 'lr': 0.0017964053650806118, 'weight_decay': 5.044945614554978e-07, 'epochs': 315, 'loss': 'mse', 'optimizer': 'adam', 'graph_mode': 'cutoff', 'cutoff': 0.2666039490608629, 'grm_norm': 'cosine_then_gcn', 'self_loops': True, 'use_snp_selection': False}. Best is trial 82 with value: 0.3095226162433806.
[I 2025-12-09 06:42:20,668] Trial 137 finished with value: 0.2936292608867219 and parameters: {'model_type': 'graphsage', 'hidden_dims': '[256, 128, 64]', 'dropout': 0.4048205560723736, 'batch_norm': False, 'sage_aggr': 'mean', 'sage_normalize': True, 'sage_project': False, 'lr': 0.002244972764961804, 'weight_decay': 2.0800675443897543e-07, 'epochs': 330, 'loss': 'mse', 'optimizer': 'adam', 'graph_mode': 'cutoff', 'cutoff': 0.36610513183387117, 'grm_norm': 'cosine_then_gcn', 'self_loops': True, 'use_snp_selection': False}. Best is trial 82 with value: 0.3095226162433806.
[I 2025-12-09 06:47:10,234] Trial 138 finished with value: 0.289773046516202 and parameters: {'model_type': 'graphsage', 'hidden_dims': '[512, 256]', 'dropout': 0.465589344632375, 'batch_norm': False, 'sage_aggr': 'mean', 'sage_normalize': True, 'sage_project': False, 'lr': 0.0029502233253921382, 'weight_decay': 1.1848638711247422e-07, 'epochs': 349, 'loss': 'mae', 'optimizer': 'adam', 'graph_mode': 'knn', 'knn_k': 5, 'weighted_edges': True, 'symmetrize_mode': 'union', 'self_loops': True, 'use_snp_selection': False}. Best is trial 82 with value: 0.3095226162433806.
[I 2025-12-09 06:51:12,504] Trial 139 finished with value: 0.3094016229411518 and parameters: {'model_type': 'graphsage', 'hidden_dims': '[512, 256]', 'dropout': 0.45583369133409135, 'batch_norm': False, 'sage_aggr': 'mean', 'sage_normalize': True, 'sage_project': False, 'lr': 0.003521304638766816, 'weight_decay': 1.5036869380558372e-07, 'epochs': 306, 'loss': 'mse', 'optimizer': 'adam', 'graph_mode': 'cutoff', 'cutoff': 0.29808722623252154, 'grm_norm': 'cosine_then_gcn', 'self_loops': True, 'use_snp_selection': False}. Best is trial 82 with value: 0.3095226162433806.
[I 2025-12-09 06:55:52,507] Trial 140 finished with value: 0.30127182912940464 and parameters: {'model_type': 'graphsage', 'hidden_dims': '[512, 256]', 'dropout': 0.45189332351324807, 'batch_norm': True, 'sage_aggr': 'mean', 'sage_normalize': True, 'sage_project': False, 'lr': 0.0034556352256301832, 'weight_decay': 2.946833559634372e-07, 'epochs': 337, 'loss': 'mse', 'optimizer': 'adam', 'graph_mode': 'cutoff', 'cutoff': 0.29610045890858006, 'grm_norm': 'none', 'self_loops': True, 'use_snp_selection': False}. Best is trial 82 with value: 0.3095226162433806.
[I 2025-12-09 06:57:51,832] Trial 141 finished with value: 0.27726094430789366 and parameters: {'model_type': 'graphsage', 'hidden_dims': '[512, 256]', 'dropout': 0.44217776549225457, 'batch_norm': False, 'sage_aggr': 'mean', 'sage_normalize': True, 'sage_project': False, 'lr': 0.0046913003632245796, 'weight_decay': 1.6604246978894478e-07, 'epochs': 172, 'loss': 'mse', 'optimizer': 'adam', 'graph_mode': 'cutoff', 'cutoff': 0.3261630155314687, 'grm_norm': 'cosine_then_gcn', 'self_loops': True, 'use_snp_selection': False}. Best is trial 82 with value: 0.3095226162433806.
[I 2025-12-09 07:01:43,846] Trial 142 finished with value: 0.3018692907532107 and parameters: {'model_type': 'graphsage', 'hidden_dims': '[512, 256]', 'dropout': 0.4292335714345659, 'batch_norm': False, 'sage_aggr': 'mean', 'sage_normalize': True, 'sage_project': False, 'lr': 0.002584115922112574, 'weight_decay': 1.3611609825650017e-07, 'epochs': 306, 'loss': 'mse', 'optimizer': 'adam', 'graph_mode': 'cutoff', 'cutoff': 0.3134547318669491, 'grm_norm': 'cosine_then_gcn', 'self_loops': True, 'use_snp_selection': False}. Best is trial 82 with value: 0.3095226162433806.
[I 2025-12-09 07:05:57,058] Trial 143 finished with value: 0.30281290439188024 and parameters: {'model_type': 'graphsage', 'hidden_dims': '[512, 256]', 'dropout': 0.4154563628864808, 'batch_norm': False, 'sage_aggr': 'mean', 'sage_normalize': True, 'sage_project': False, 'lr': 0.0037084268392654877, 'weight_decay': 1.5473241454357665e-07, 'epochs': 313, 'loss': 'mse', 'optimizer': 'adam', 'graph_mode': 'cutoff', 'cutoff': 0.29109368771128363, 'grm_norm': 'cosine_then_gcn', 'self_loops': True, 'use_snp_selection': False}. Best is trial 82 with value: 0.3095226162433806.
[I 2025-12-09 07:09:31,345] Trial 144 finished with value: 0.29374858470678733 and parameters: {'model_type': 'graphsage', 'hidden_dims': '[512, 256]', 'dropout': 0.5207315576326293, 'batch_norm': False, 'sage_aggr': 'mean', 'sage_normalize': True, 'sage_project': False, 'lr': 0.005864676287603948, 'weight_decay': 2.1345890475892813e-07, 'epochs': 322, 'loss': 'mse', 'optimizer': 'adam', 'graph_mode': 'cutoff', 'cutoff': 0.34062654461187564, 'grm_norm': 'cosine_then_gcn', 'self_loops': True, 'use_snp_selection': False}. Best is trial 82 with value: 0.3095226162433806.
[I 2025-12-09 07:13:45,130] Trial 145 finished with value: 0.28002952400942704 and parameters: {'model_type': 'graphsage', 'hidden_dims': '[512, 64]', 'dropout': 0.17756611944325912, 'batch_norm': False, 'sage_aggr': 'mean', 'sage_normalize': True, 'sage_project': False, 'lr': 0.004338195958134489, 'weight_decay': 6.525101833379676e-07, 'epochs': 295, 'loss': 'mse', 'optimizer': 'adam', 'graph_mode': 'cutoff', 'cutoff': 0.2735015979382871, 'grm_norm': 'cosine_then_gcn', 'self_loops': True, 'use_snp_selection': False}. Best is trial 82 with value: 0.3095226162433806.
[I 2025-12-09 07:17:55,868] Trial 146 finished with value: 0.3021804243665298 and parameters: {'model_type': 'graphsage', 'hidden_dims': '[512, 256]', 'dropout': 0.24681690609859167, 'batch_norm': False, 'sage_aggr': 'mean', 'sage_normalize': True, 'sage_project': False, 'lr': 0.0019953860617972674, 'weight_decay': 4.0667706167532763e-07, 'epochs': 329, 'loss': 'mse', 'optimizer': 'adam', 'graph_mode': 'cutoff', 'cutoff': 0.311032105813209, 'grm_norm': 'cosine_then_gcn', 'self_loops': True, 'use_snp_selection': False}. Best is trial 82 with value: 0.3095226162433806.
[I 2025-12-09 07:22:37,291] Trial 147 finished with value: 0.30561703502587767 and parameters: {'model_type': 'graphsage', 'hidden_dims': '[512, 256]', 'dropout': 0.3866899296201993, 'batch_norm': False, 'sage_aggr': 'mean', 'sage_normalize': True, 'sage_project': False, 'lr': 0.002972859159413311, 'weight_decay': 1.4657747231014353e-06, 'epochs': 315, 'loss': 'mse', 'optimizer': 'adam', 'graph_mode': 'cutoff', 'cutoff': 0.2635400086072526, 'grm_norm': 'cosine_then_gcn', 'self_loops': False, 'use_snp_selection': False}. Best is trial 82 with value: 0.3095226162433806.
[I 2025-12-09 07:28:11,139] Trial 148 finished with value: 0.30101026709301737 and parameters: {'model_type': 'graphsage', 'hidden_dims': '[512, 256]', 'dropout': 0.381908079069836, 'batch_norm': False, 'sage_aggr': 'mean', 'sage_normalize': True, 'sage_project': False, 'lr': 0.0024819176245532383, 'weight_decay': 1.8712734448050743e-06, 'epochs': 342, 'loss': 'mse', 'optimizer': 'adam', 'graph_mode': 'cutoff', 'cutoff': 0.24086580233096722, 'grm_norm': 'cosine_then_gcn', 'self_loops': False, 'use_snp_selection': False}. Best is trial 82 with value: 0.3095226162433806.
[I 2025-12-09 07:34:03,525] Trial 149 finished with value: 0.001745420391745317 and parameters: {'model_type': 'graphsage', 'hidden_dims': '[512, 256]', 'dropout': 0.40229045828144616, 'batch_norm': False, 'sage_aggr': 'mean', 'sage_normalize': False, 'sage_project': False, 'lr': 0.0029026160772688903, 'weight_decay': 1.2395084912527849e-06, 'epochs': 317, 'loss': 'mse', 'optimizer': 'adam', 'graph_mode': 'cutoff', 'cutoff': 0.21095283552481794, 'grm_norm': 'cosine_then_gcn', 'self_loops': False, 'use_snp_selection': False}. Best is trial 82 with value: 0.3095226162433806.
[I 2025-12-09 07:36:02,913] Trial 0 finished with value: 0.2537439700424137 and parameters: {'model_type': 'graphsage', 'hidden_dims': '[128, 64]', 'dropout': 0.199031432379812, 'batch_norm': True, 'sage_aggr': 'max', 'sage_normalize': True, 'sage_project': False, 'lr': 0.00034401453323286885, 'weight_decay': 0.00017802616915745114, 'epochs': 230, 'loss': 'mse', 'optimizer': 'adam', 'graph_mode': 'knn', 'knn_k': 6, 'weighted_edges': True, 'symmetrize_mode': 'mutual', 'self_loops': True, 'use_snp_selection': False}. Best is trial 0 with value: 0.2537439700424137.
[I 2025-12-09 07:37:36,764] Trial 1 finished with value: 0.28121851008658444 and parameters: {'model_type': 'graphsage', 'hidden_dims': '[512, 128]', 'dropout': 0.2503500283181017, 'batch_norm': False, 'sage_aggr': 'max', 'sage_normalize': False, 'sage_project': False, 'lr': 3.952233718592099e-05, 'weight_decay': 0.00026754769258252603, 'epochs': 149, 'loss': 'mse', 'optimizer': 'adam', 'graph_mode': 'knn', 'knn_k': 2, 'weighted_edges': False, 'symmetrize_mode': 'mutual', 'self_loops': True, 'use_snp_selection': True, 'num_snps': 49915}. Best is trial 1 with value: 0.28121851008658444.
[I 2025-12-09 07:38:49,354] Trial 2 finished with value: 0.28321521610225425 and parameters: {'model_type': 'graphsage', 'hidden_dims': '[512, 256]', 'dropout': 0.2785908793172681, 'batch_norm': False, 'sage_aggr': 'max', 'sage_normalize': False, 'sage_project': False, 'lr': 8.806039223165805e-05, 'weight_decay': 3.5153176302760294e-05, 'epochs': 147, 'loss': 'mae', 'optimizer': 'adam', 'graph_mode': 'cutoff', 'cutoff': 0.4922564006874869, 'grm_norm': 'gcn', 'self_loops': False, 'use_snp_selection': True, 'num_snps': 34340}. Best is trial 2 with value: 0.28321521610225425.
[I 2025-12-09 07:40:14,553] Trial 3 finished with value: 0.2752394527303407 and parameters: {'model_type': 'graphsage', 'hidden_dims': '[256, 128, 64]', 'dropout': 0.3475243154412272, 'batch_norm': True, 'sage_aggr': 'max', 'sage_normalize': False, 'sage_project': False, 'lr': 1.6006331996938085e-05, 'weight_decay': 7.213121225589906e-06, 'epochs': 283, 'loss': 'mse', 'optimizer': 'adam', 'graph_mode': 'cutoff', 'cutoff': 0.5942334791449215, 'grm_norm': 'none', 'self_loops': True, 'use_snp_selection': False}. Best is trial 2 with value: 0.28321521610225425.
[I 2025-12-09 07:40:37,681] Trial 4 finished with value: 0.27208803662236913 and parameters: {'model_type': 'graphsage', 'hidden_dims': '[128, 64]', 'dropout': 0.3348926467202472, 'batch_norm': True, 'sage_aggr': 'max', 'sage_normalize': False, 'sage_project': False, 'lr': 0.0004238630400638802, 'weight_decay': 8.074086040046576e-07, 'epochs': 158, 'loss': 'mae', 'optimizer': 'adam', 'graph_mode': 'knn', 'knn_k': 1, 'weighted_edges': False, 'symmetrize_mode': 'mutual', 'self_loops': False, 'use_snp_selection': True, 'num_snps': 26850}. Best is trial 2 with value: 0.28321521610225425.
