[I 2025-12-10 02:27:08,815] Trial 30 finished with value: 0.12513497260205453 and parameters: {'model_type': 'graphsage', 'hidden_dims': '[512, 64]', 'dropout': 0.36691690880815475, 'batch_norm': False, 'sage_aggr': 'max', 'sage_normalize': False, 'sage_project': False, 'lr': 0.00025825562842596945, 'weight_decay': 0.00029220788904458627, 'epochs': 130, 'loss': 'mae', 'optimizer': 'adam', 'graph_mode': 'knn', 'knn_k': 6, 'weighted_edges': False, 'symmetrize_mode': 'union', 'self_loops': False, 'use_snp_selection': True, 'num_snps': 29592}. Best is trial 2 with value: 0.36641705962504983.
[I 2025-12-10 02:27:51,882] Trial 31 finished with value: 0.3324419302464276 and parameters: {'model_type': 'graphsage', 'hidden_dims': '[512, 256]', 'dropout': 0.31997480127383027, 'batch_norm': True, 'sage_aggr': 'max', 'sage_normalize': True, 'sage_project': False, 'lr': 6.225957544125461e-05, 'weight_decay': 4.560174372447534e-06, 'epochs': 200, 'loss': 'mse', 'optimizer': 'adam', 'graph_mode': 'cutoff', 'cutoff': 0.3615171657945805, 'grm_norm': 'gcn', 'self_loops': True, 'use_snp_selection': True, 'num_snps': 13203}. Best is trial 2 with value: 0.36641705962504983.
[I 2025-12-10 02:28:29,601] Trial 32 finished with value: 0.3555799942875086 and parameters: {'model_type': 'graphsage', 'hidden_dims': '[512, 256]', 'dropout': 0.273821439673764, 'batch_norm': True, 'sage_aggr': 'max', 'sage_normalize': True, 'sage_project': False, 'lr': 0.00030469215309872355, 'weight_decay': 7.294064965434441e-06, 'epochs': 230, 'loss': 'mse', 'optimizer': 'adam', 'graph_mode': 'cutoff', 'cutoff': 0.4807783647712402, 'grm_norm': 'gcn', 'self_loops': True, 'use_snp_selection': True, 'num_snps': 10557}. Best is trial 2 with value: 0.36641705962504983.
[I 2025-12-10 02:29:38,481] Trial 33 finished with value: 0.34116974748380846 and parameters: {'model_type': 'graphsage', 'hidden_dims': '[512, 256]', 'dropout': 0.20827609119382362, 'batch_norm': True, 'sage_aggr': 'max', 'sage_normalize': True, 'sage_project': False, 'lr': 0.0003804184936013542, 'weight_decay': 3.2763706281141296e-07, 'epochs': 229, 'loss': 'mse', 'optimizer': 'adam', 'graph_mode': 'cutoff', 'cutoff': 0.504582831471258, 'grm_norm': 'gcn', 'self_loops': True, 'use_snp_selection': True, 'num_snps': 24099}. Best is trial 2 with value: 0.36641705962504983.
[I 2025-12-10 02:32:00,435] Trial 34 finished with value: 0.32055257905918355 and parameters: {'model_type': 'graphsage', 'hidden_dims': '[512, 256]', 'dropout': 0.2785594368635954, 'batch_norm': True, 'sage_aggr': 'max', 'sage_normalize': True, 'sage_project': False, 'lr': 0.0006404309415357444, 'weight_decay': 1.7014526415377147e-05, 'epochs': 265, 'loss': 'mse', 'optimizer': 'adam', 'graph_mode': 'cutoff', 'cutoff': 0.6721574027301782, 'grm_norm': 'gcn', 'self_loops': True, 'use_snp_selection': False}. Best is trial 2 with value: 0.36641705962504983.
[I 2025-12-10 02:32:36,370] Trial 35 finished with value: 0.2568389620830161 and parameters: {'model_type': 'graphsage', 'hidden_dims': '[256, 128, 64]', 'dropout': 0.1850295150705964, 'batch_norm': True, 'sage_aggr': 'max', 'sage_normalize': True, 'sage_project': False, 'lr': 1.7520321486621258e-05, 'weight_decay': 2.1548503415903676e-06, 'epochs': 184, 'loss': 'mse', 'optimizer': 'adam', 'graph_mode': 'cutoff', 'cutoff': 0.5235369921956189, 'grm_norm': 'none', 'self_loops': True, 'use_snp_selection': True, 'num_snps': 21125}. Best is trial 2 with value: 0.36641705962504983.
[I 2025-12-10 02:32:47,202] Trial 36 finished with value: 0.30335857193908183 and parameters: {'model_type': 'graphsage', 'hidden_dims': '[128, 64]', 'dropout': 0.11407025455659794, 'batch_norm': True, 'sage_aggr': 'mean', 'sage_normalize': False, 'sage_project': False, 'lr': 3.316775487164815e-05, 'weight_decay': 5.95885223243279e-06, 'epochs': 159, 'loss': 'mse', 'optimizer': 'adam', 'graph_mode': 'cutoff', 'cutoff': 0.42762536977119264, 'grm_norm': 'cosine_then_gcn', 'self_loops': True, 'use_snp_selection': True, 'num_snps': 2810}. Best is trial 2 with value: 0.36641705962504983.
[I 2025-12-10 02:33:17,823] Trial 37 finished with value: 0.34017155606288646 and parameters: {'model_type': 'graphsage', 'hidden_dims': '[512, 64]', 'dropout': 0.2563934045845026, 'batch_norm': True, 'sage_aggr': 'max', 'sage_normalize': True, 'sage_project': False, 'lr': 0.0023499569569908787, 'weight_decay': 8.332862843613843e-07, 'epochs': 172, 'loss': 'mae', 'optimizer': 'adam', 'graph_mode': 'knn', 'knn_k': 5, 'weighted_edges': True, 'symmetrize_mode': 'mutual', 'self_loops': False, 'use_snp_selection': True, 'num_snps': 11159}. Best is trial 2 with value: 0.36641705962504983.
[I 2025-12-10 02:34:42,151] Trial 38 finished with value: 0.30811518453774966 and parameters: {'model_type': 'graphsage', 'hidden_dims': '[512, 256]', 'dropout': 0.341857799569111, 'batch_norm': True, 'sage_aggr': 'mean', 'sage_normalize': True, 'sage_project': False, 'lr': 0.0001355356411742713, 'weight_decay': 9.052532016277689e-07, 'epochs': 152, 'loss': 'mse', 'optimizer': 'adam', 'graph_mode': 'cutoff', 'cutoff': 0.5823661067531569, 'grm_norm': 'cosine', 'self_loops': True, 'use_snp_selection': False}. Best is trial 2 with value: 0.36641705962504983.
[I 2025-12-10 02:35:33,944] Trial 39 finished with value: 0.2486765568740356 and parameters: {'model_type': 'graphsage', 'hidden_dims': '[256, 128, 64]', 'dropout': 0.1587896614311162, 'batch_norm': True, 'sage_aggr': 'max', 'sage_normalize': False, 'sage_project': False, 'lr': 1.6715262601401705e-05, 'weight_decay': 4.387639187860886e-05, 'epochs': 294, 'loss': 'mae', 'optimizer': 'adam', 'graph_mode': 'knn', 'knn_k': 2, 'weighted_edges': True, 'symmetrize_mode': 'mutual', 'self_loops': False, 'use_snp_selection': True, 'num_snps': 26596}. Best is trial 2 with value: 0.36641705962504983.
[I 2025-12-10 02:36:36,625] Trial 40 finished with value: 0.3554597690267911 and parameters: {'model_type': 'graphsage', 'hidden_dims': '[512, 128]', 'dropout': 0.25918131660596133, 'batch_norm': False, 'sage_aggr': 'max', 'sage_normalize': True, 'sage_project': False, 'lr': 0.0005852546116627568, 'weight_decay': 0.0005629653226081553, 'epochs': 242, 'loss': 'mse', 'optimizer': 'adam', 'graph_mode': 'cutoff', 'cutoff': 0.44542181936754605, 'grm_norm': 'gcn', 'self_loops': True, 'use_snp_selection': True, 'num_snps': 18598}. Best is trial 2 with value: 0.36641705962504983.
[I 2025-12-10 02:37:37,169] Trial 41 finished with value: 0.3514535255762366 and parameters: {'model_type': 'graphsage', 'hidden_dims': '[512, 128]', 'dropout': 0.30528700434799083, 'batch_norm': False, 'sage_aggr': 'max', 'sage_normalize': True, 'sage_project': False, 'lr': 0.0005644937124298208, 'weight_decay': 0.0006789021340616935, 'epochs': 241, 'loss': 'mse', 'optimizer': 'adam', 'graph_mode': 'cutoff', 'cutoff': 0.4515656584232673, 'grm_norm': 'gcn', 'self_loops': True, 'use_snp_selection': True, 'num_snps': 18086}. Best is trial 2 with value: 0.36641705962504983.
[I 2025-12-10 02:38:18,820] Trial 42 finished with value: 0.3311650249362003 and parameters: {'model_type': 'graphsage', 'hidden_dims': '[512, 128]', 'dropout': 0.25656461884367116, 'batch_norm': False, 'sage_aggr': 'max', 'sage_normalize': True, 'sage_project': False, 'lr': 0.0010278407979502201, 'weight_decay': 0.0004499841092657012, 'epochs': 271, 'loss': 'mse', 'optimizer': 'adam', 'graph_mode': 'cutoff', 'cutoff': 0.30747665782843026, 'grm_norm': 'gcn', 'self_loops': True, 'use_snp_selection': True, 'num_snps': 8264}. Best is trial 2 with value: 0.36641705962504983.
[I 2025-12-10 02:39:18,174] Trial 43 finished with value: 0.350145529521971 and parameters: {'model_type': 'graphsage', 'hidden_dims': '[512, 128]', 'dropout': 0.24138982185638624, 'batch_norm': False, 'sage_aggr': 'max', 'sage_normalize': True, 'sage_project': False, 'lr': 0.0003281624130931888, 'weight_decay': 0.00010648254218492501, 'epochs': 188, 'loss': 'mse', 'optimizer': 'adam', 'graph_mode': 'cutoff', 'cutoff': 0.541814629685247, 'grm_norm': 'gcn', 'self_loops': True, 'use_snp_selection': True, 'num_snps': 26892}. Best is trial 2 with value: 0.36641705962504983.
[I 2025-12-10 02:40:26,389] Trial 44 finished with value: 0.32824392561551446 and parameters: {'model_type': 'graphsage', 'hidden_dims': '[512, 128]', 'dropout': 0.27789046043667115, 'batch_norm': False, 'sage_aggr': 'max', 'sage_normalize': True, 'sage_project': False, 'lr': 0.005902392892440137, 'weight_decay': 0.0006015344273036056, 'epochs': 245, 'loss': 'mse', 'optimizer': 'adam', 'graph_mode': 'cutoff', 'cutoff': 0.44811550114872284, 'grm_norm': 'gcn', 'self_loops': True, 'use_snp_selection': True, 'num_snps': 20413}. Best is trial 2 with value: 0.36641705962504983.
[I 2025-12-10 02:42:23,616] Trial 45 finished with value: 0.3140062919035378 and parameters: {'model_type': 'graphsage', 'hidden_dims': '[512, 64]', 'dropout': 0.21320972032292212, 'batch_norm': False, 'sage_aggr': 'max', 'sage_normalize': False, 'sage_project': False, 'lr': 9.016031914074567e-05, 'weight_decay': 0.0002785754032461165, 'epochs': 216, 'loss': 'mse', 'optimizer': 'adam', 'graph_mode': 'cutoff', 'cutoff': 0.6530925738553307, 'grm_norm': 'gcn', 'self_loops': True, 'use_snp_selection': True, 'num_snps': 53478}. Best is trial 2 with value: 0.36641705962504983.
[I 2025-12-10 02:43:00,329] Trial 46 finished with value: 0.35200611615505106 and parameters: {'model_type': 'graphsage', 'hidden_dims': '[256, 128]', 'dropout': 0.3204467796225254, 'batch_norm': False, 'sage_aggr': 'mean', 'sage_normalize': True, 'sage_project': False, 'lr': 5.035213968607872e-05, 'weight_decay': 7.786082082271352e-06, 'epochs': 98, 'loss': 'mae', 'optimizer': 'adam', 'graph_mode': 'cutoff', 'cutoff': 0.3171218972484585, 'grm_norm': 'gcn', 'self_loops': False, 'use_snp_selection': True, 'num_snps': 24550}. Best is trial 2 with value: 0.36641705962504983.
[I 2025-12-10 02:43:28,690] Trial 47 finished with value: 0.35071645445962596 and parameters: {'model_type': 'graphsage', 'hidden_dims': '[256, 128]', 'dropout': 0.3662829142399192, 'batch_norm': False, 'sage_aggr': 'mean', 'sage_normalize': True, 'sage_project': False, 'lr': 5.421515882178209e-05, 'weight_decay': 8.764799895632982e-06, 'epochs': 71, 'loss': 'mae', 'optimizer': 'adam', 'graph_mode': 'cutoff', 'cutoff': 0.3274449603074826, 'grm_norm': 'gcn', 'self_loops': False, 'use_snp_selection': True, 'num_snps': 24073}. Best is trial 2 with value: 0.36641705962504983.
[I 2025-12-10 02:45:17,286] Trial 48 finished with value: 0.3440220703619027 and parameters: {'model_type': 'graphsage', 'hidden_dims': '[256, 128]', 'dropout': 0.32236235748015174, 'batch_norm': False, 'sage_aggr': 'mean', 'sage_normalize': True, 'sage_project': False, 'lr': 0.0002644198650852311, 'weight_decay': 3.135426323542697e-06, 'epochs': 105, 'loss': 'mae', 'optimizer': 'adam', 'graph_mode': 'cutoff', 'cutoff': 0.20828991341349706, 'grm_norm': 'gcn', 'self_loops': False, 'use_snp_selection': True, 'num_snps': 33392}. Best is trial 2 with value: 0.36641705962504983.
[I 2025-12-10 02:45:39,676] Trial 49 finished with value: 0.3487547679946045 and parameters: {'model_type': 'graphsage', 'hidden_dims': '[256, 128]', 'dropout': 0.29921661591086, 'batch_norm': False, 'sage_aggr': 'mean', 'sage_normalize': True, 'sage_project': False, 'lr': 0.0004307546362760493, 'weight_decay': 2.2571393058595198e-05, 'epochs': 99, 'loss': 'mae', 'optimizer': 'adam', 'graph_mode': 'cutoff', 'cutoff': 0.4000784145146919, 'grm_norm': 'gcn', 'self_loops': False, 'use_snp_selection': True, 'num_snps': 16665}. Best is trial 2 with value: 0.36641705962504983.
[I 2025-12-10 02:46:15,164] Trial 50 finished with value: 0.33308354657758715 and parameters: {'model_type': 'graphsage', 'hidden_dims': '[256, 128]', 'dropout': 0.27458696956838546, 'batch_norm': True, 'sage_aggr': 'mean', 'sage_normalize': True, 'sage_project': False, 'lr': 0.0009637695596551257, 'weight_decay': 1.3772454395532746e-06, 'epochs': 87, 'loss': 'mae', 'optimizer': 'adam', 'graph_mode': 'cutoff', 'cutoff': 0.48498297204458657, 'grm_norm': 'gcn', 'self_loops': False, 'use_snp_selection': False}. Best is trial 2 with value: 0.36641705962504983.
[I 2025-12-10 02:47:20,964] Trial 51 finished with value: 0.36654936026024404 and parameters: {'model_type': 'graphsage', 'hidden_dims': '[512, 256]', 'dropout': 0.2533525480639581, 'batch_norm': False, 'sage_aggr': 'mean', 'sage_normalize': False, 'sage_project': False, 'lr': 4.6677253833038546e-05, 'weight_decay': 7.943136892628513e-06, 'epochs': 120, 'loss': 'mae', 'optimizer': 'adam', 'graph_mode': 'cutoff', 'cutoff': 0.29637557420309646, 'grm_norm': 'none', 'self_loops': False, 'use_snp_selection': True, 'num_snps': 27574}. Best is trial 51 with value: 0.36654936026024404.
[I 2025-12-10 02:48:22,934] Trial 52 finished with value: 0.36533595241020256 and parameters: {'model_type': 'graphsage', 'hidden_dims': '[512, 256]', 'dropout': 0.2317639403288519, 'batch_norm': False, 'sage_aggr': 'mean', 'sage_normalize': False, 'sage_project': False, 'lr': 4.211161335369899e-05, 'weight_decay': 1.1486447788286807e-05, 'epochs': 125, 'loss': 'mae', 'optimizer': 'adam', 'graph_mode': 'cutoff', 'cutoff': 0.3013222762814073, 'grm_norm': 'none', 'self_loops': False, 'use_snp_selection': True, 'num_snps': 27345}. Best is trial 51 with value: 0.36654936026024404.
[I 2025-12-10 02:49:50,451] Trial 53 finished with value: 0.3646337708891005 and parameters: {'model_type': 'graphsage', 'hidden_dims': '[512, 256]', 'dropout': 0.23039470581322993, 'batch_norm': False, 'sage_aggr': 'mean', 'sage_normalize': False, 'sage_project': False, 'lr': 2.284505718389796e-05, 'weight_decay': 1.2108831402989213e-05, 'epochs': 132, 'loss': 'mae', 'optimizer': 'adam', 'graph_mode': 'cutoff', 'cutoff': 0.2806304230571812, 'grm_norm': 'none', 'self_loops': False, 'use_snp_selection': True, 'num_snps': 29121}. Best is trial 51 with value: 0.36654936026024404.
[I 2025-12-10 02:51:34,201] Trial 54 finished with value: 0.36042656063896616 and parameters: {'model_type': 'graphsage', 'hidden_dims': '[512, 256]', 'dropout': 0.18325191360855497, 'batch_norm': False, 'sage_aggr': 'mean', 'sage_normalize': False, 'sage_project': False, 'lr': 2.5842307422134493e-05, 'weight_decay': 1.0886064233653343e-05, 'epochs': 123, 'loss': 'mae', 'optimizer': 'adam', 'graph_mode': 'cutoff', 'cutoff': 0.29895659778927697, 'grm_norm': 'none', 'self_loops': False, 'use_snp_selection': True, 'num_snps': 39215}. Best is trial 51 with value: 0.36654936026024404.
[I 2025-12-10 02:53:28,191] Trial 55 finished with value: 0.3649499810827697 and parameters: {'model_type': 'graphsage', 'hidden_dims': '[512, 256]', 'dropout': 0.1817987400349099, 'batch_norm': False, 'sage_aggr': 'mean', 'sage_normalize': False, 'sage_project': False, 'lr': 1.2212103662099393e-05, 'weight_decay': 1.2995055908581032e-05, 'epochs': 123, 'loss': 'mae', 'optimizer': 'adam', 'graph_mode': 'cutoff', 'cutoff': 0.27610548258832046, 'grm_norm': 'none', 'self_loops': False, 'use_snp_selection': True, 'num_snps': 38841}. Best is trial 51 with value: 0.36654936026024404.
[I 2025-12-10 02:55:21,595] Trial 56 finished with value: 0.36553024059709127 and parameters: {'model_type': 'graphsage', 'hidden_dims': '[512, 256]', 'dropout': 0.13680638614325724, 'batch_norm': False, 'sage_aggr': 'mean', 'sage_normalize': False, 'sage_project': False, 'lr': 2.1970640217194703e-05, 'weight_decay': 1.090764216316659e-05, 'epochs': 123, 'loss': 'mae', 'optimizer': 'adam', 'graph_mode': 'cutoff', 'cutoff': 0.2722022215072377, 'grm_norm': 'none', 'self_loops': False, 'use_snp_selection': True, 'num_snps': 38686}. Best is trial 51 with value: 0.36654936026024404.
[I 2025-12-10 02:57:28,033] Trial 57 finished with value: 0.36396776469945 and parameters: {'model_type': 'graphsage', 'hidden_dims': '[512, 256]', 'dropout': 0.11865955369156878, 'batch_norm': False, 'sage_aggr': 'mean', 'sage_normalize': False, 'sage_project': False, 'lr': 1.0577533736228351e-05, 'weight_decay': 1.587795219323965e-05, 'epochs': 125, 'loss': 'mae', 'optimizer': 'adam', 'graph_mode': 'cutoff', 'cutoff': 0.2636976925603376, 'grm_norm': 'none', 'self_loops': False, 'use_snp_selection': True, 'num_snps': 38187}. Best is trial 51 with value: 0.36654936026024404.
[I 2025-12-10 02:59:01,020] Trial 58 finished with value: 0.3468427740976857 and parameters: {'model_type': 'graphsage', 'hidden_dims': '[512, 256]', 'dropout': 0.16544585028765654, 'batch_norm': False, 'sage_aggr': 'mean', 'sage_normalize': False, 'sage_project': False, 'lr': 1.2815145871931362e-05, 'weight_decay': 4.334130388009054e-05, 'epochs': 54, 'loss': 'mae', 'optimizer': 'adam', 'graph_mode': 'cutoff', 'cutoff': 0.20199586453883012, 'grm_norm': 'none', 'self_loops': False, 'use_snp_selection': True, 'num_snps': 42637}. Best is trial 51 with value: 0.36654936026024404.
[I 2025-12-10 03:00:07,490] Trial 59 finished with value: 0.3591409711861398 and parameters: {'model_type': 'graphsage', 'hidden_dims': '[512, 256]', 'dropout': 0.1245301427670708, 'batch_norm': False, 'sage_aggr': 'mean', 'sage_normalize': False, 'sage_project': False, 'lr': 2.0712138860464405e-05, 'weight_decay': 2.2965837645797486e-05, 'epochs': 81, 'loss': 'mae', 'optimizer': 'adam', 'graph_mode': 'cutoff', 'cutoff': 0.26971280563402145, 'grm_norm': 'none', 'self_loops': False, 'use_snp_selection': True, 'num_snps': 31453}. Best is trial 51 with value: 0.36654936026024404.
[I 2025-12-10 03:01:17,407] Trial 60 finished with value: 0.36437866726241086 and parameters: {'model_type': 'graphsage', 'hidden_dims': '[512, 256]', 'dropout': 0.22801460659572823, 'batch_norm': False, 'sage_aggr': 'mean', 'sage_normalize': False, 'sage_project': False, 'lr': 3.412043291516753e-05, 'weight_decay': 1.2614917926242874e-05, 'epochs': 149, 'loss': 'mae', 'optimizer': 'adam', 'graph_mode': 'cutoff', 'cutoff': 0.3453312622177165, 'grm_norm': 'none', 'self_loops': False, 'use_snp_selection': True, 'num_snps': 28277}. Best is trial 51 with value: 0.36654936026024404.
[I 2025-12-10 03:02:22,105] Trial 61 finished with value: 0.37066613095512746 and parameters: {'model_type': 'graphsage', 'hidden_dims': '[512, 256]', 'dropout': 0.13715174771038494, 'batch_norm': False, 'sage_aggr': 'mean', 'sage_normalize': False, 'sage_project': False, 'lr': 3.278524368718783e-05, 'weight_decay': 1.3389292199779236e-05, 'epochs': 136, 'loss': 'mae', 'optimizer': 'adam', 'graph_mode': 'cutoff', 'cutoff': 0.34164779119982325, 'grm_norm': 'none', 'self_loops': False, 'use_snp_selection': True, 'num_snps': 28218}. Best is trial 61 with value: 0.37066613095512746.
[I 2025-12-10 03:04:16,762] Trial 62 finished with value: 0.36560053674825366 and parameters: {'model_type': 'graphsage', 'hidden_dims': '[512, 256]', 'dropout': 0.13642437785441439, 'batch_norm': False, 'sage_aggr': 'mean', 'sage_normalize': False, 'sage_project': False, 'lr': 1.4596340307223211e-05, 'weight_decay': 3.699594578602071e-06, 'epochs': 116, 'loss': 'mae', 'optimizer': 'adam', 'graph_mode': 'cutoff', 'cutoff': 0.2331557019591105, 'grm_norm': 'none', 'self_loops': False, 'use_snp_selection': True, 'num_snps': 32661}. Best is trial 61 with value: 0.37066613095512746.
[I 2025-12-10 03:06:13,504] Trial 63 finished with value: 0.36567073895878316 and parameters: {'model_type': 'graphsage', 'hidden_dims': '[512, 256]', 'dropout': 0.12990708171611245, 'batch_norm': False, 'sage_aggr': 'mean', 'sage_normalize': False, 'sage_project': False, 'lr': 1.2689579811174884e-05, 'weight_decay': 3.5236664207686565e-06, 'epochs': 116, 'loss': 'mae', 'optimizer': 'adam', 'graph_mode': 'cutoff', 'cutoff': 0.22907090763260743, 'grm_norm': 'none', 'self_loops': False, 'use_snp_selection': True, 'num_snps': 32635}. Best is trial 61 with value: 0.37066613095512746.
[I 2025-12-10 03:08:15,728] Trial 64 finished with value: 0.3695656496465277 and parameters: {'model_type': 'graphsage', 'hidden_dims': '[512, 256]', 'dropout': 0.13686072737909188, 'batch_norm': False, 'sage_aggr': 'mean', 'sage_normalize': False, 'sage_project': False, 'lr': 1.4932037972189929e-05, 'weight_decay': 2.8760083040403723e-06, 'epochs': 113, 'loss': 'mae', 'optimizer': 'adam', 'graph_mode': 'cutoff', 'cutoff': 0.21334880116656088, 'grm_norm': 'none', 'self_loops': False, 'use_snp_selection': True, 'num_snps': 33222}. Best is trial 61 with value: 0.37066613095512746.
[I 2025-12-10 03:10:10,449] Trial 65 finished with value: 0.3677801421370785 and parameters: {'model_type': 'graphsage', 'hidden_dims': '[512, 256]', 'dropout': 0.13595723542868204, 'batch_norm': False, 'sage_aggr': 'mean', 'sage_normalize': False, 'sage_project': False, 'lr': 1.9205454030926865e-05, 'weight_decay': 3.432534519450695e-06, 'epochs': 112, 'loss': 'mae', 'optimizer': 'adam', 'graph_mode': 'cutoff', 'cutoff': 0.2279049701442698, 'grm_norm': 'none', 'self_loops': False, 'use_snp_selection': True, 'num_snps': 33268}. Best is trial 61 with value: 0.37066613095512746.
[I 2025-12-10 03:11:55,049] Trial 66 finished with value: 0.3635806331203269 and parameters: {'model_type': 'graphsage', 'hidden_dims': '[512, 256]', 'dropout': 0.10288905303715978, 'batch_norm': False, 'sage_aggr': 'mean', 'sage_normalize': False, 'sage_project': False, 'lr': 1.464445329573132e-05, 'weight_decay': 3.3789577152389164e-06, 'epochs': 107, 'loss': 'mae', 'optimizer': 'adam', 'graph_mode': 'cutoff', 'cutoff': 0.23087302441813395, 'grm_norm': 'none', 'self_loops': False, 'use_snp_selection': True, 'num_snps': 33193}. Best is trial 61 with value: 0.37066613095512746.
