[I 2025-12-08 22:15:42,252] Trial 80 finished with value: 0.2110776606601068 and parameters: {'model_type': 'graphsage', 'hidden_dims': '[256, 128, 64]', 'dropout': 0.4848297527188388, 'batch_norm': True, 'sage_aggr': 'mean', 'sage_normalize': True, 'sage_project': False, 'lr': 0.008527553989240745, 'weight_decay': 4.251698710907154e-07, 'epochs': 44, 'loss': 'mae', 'optimizer': 'adam', 'graph_mode': 'knn', 'knn_k': 1, 'weighted_edges': True, 'symmetrize_mode': 'union', 'self_loops': True, 'use_snp_selection': False}. Best is trial 79 with value: 0.29785602291757357.
[I 2025-12-08 22:16:05,389] Trial 81 finished with value: 0.2833534794254545 and parameters: {'model_type': 'graphsage', 'hidden_dims': '[256, 128, 64]', 'dropout': 0.513591128258263, 'batch_norm': True, 'sage_aggr': 'mean', 'sage_normalize': False, 'sage_project': False, 'lr': 0.00219691302750731, 'weight_decay': 2.9414087818418045e-07, 'epochs': 41, 'loss': 'mse', 'optimizer': 'adam', 'graph_mode': 'cutoff', 'cutoff': 0.4671994220234187, 'grm_norm': 'cosine_then_gcn', 'self_loops': True, 'use_snp_selection': False}. Best is trial 79 with value: 0.29785602291757357.
[I 2025-12-08 22:16:34,149] Trial 82 finished with value: 0.28086328541873823 and parameters: {'model_type': 'graphsage', 'hidden_dims': '[256, 128, 64]', 'dropout': 0.41573025039895123, 'batch_norm': True, 'sage_aggr': 'mean', 'sage_normalize': False, 'sage_project': False, 'lr': 0.0037581280907169694, 'weight_decay': 1.6317602786001108e-07, 'epochs': 73, 'loss': 'mse', 'optimizer': 'adam', 'graph_mode': 'cutoff', 'cutoff': 0.5517600435411742, 'grm_norm': 'cosine_then_gcn', 'self_loops': True, 'use_snp_selection': False}. Best is trial 79 with value: 0.29785602291757357.
[I 2025-12-08 22:17:00,356] Trial 83 finished with value: 0.28903463670852814 and parameters: {'model_type': 'graphsage', 'hidden_dims': '[256, 128, 64]', 'dropout': 0.5301283207347088, 'batch_norm': True, 'sage_aggr': 'mean', 'sage_normalize': False, 'sage_project': False, 'lr': 0.0023310226175525858, 'weight_decay': 1.0103400632427924e-07, 'epochs': 60, 'loss': 'mse', 'optimizer': 'adam', 'graph_mode': 'cutoff', 'cutoff': 0.5194717117723722, 'grm_norm': 'cosine_then_gcn', 'self_loops': True, 'use_snp_selection': False}. Best is trial 79 with value: 0.29785602291757357.
[I 2025-12-08 22:17:27,475] Trial 84 finished with value: 0.2795174686755185 and parameters: {'model_type': 'graphsage', 'hidden_dims': '[256, 128, 64]', 'dropout': 0.5612756767894703, 'batch_norm': True, 'sage_aggr': 'mean', 'sage_normalize': False, 'sage_project': False, 'lr': 0.005448045761680961, 'weight_decay': 2.166607169447913e-07, 'epochs': 49, 'loss': 'mse', 'optimizer': 'adam', 'graph_mode': 'cutoff', 'cutoff': 0.3241484707104135, 'grm_norm': 'cosine_then_gcn', 'self_loops': True, 'use_snp_selection': False}. Best is trial 79 with value: 0.29785602291757357.
[I 2025-12-08 22:17:58,820] Trial 85 finished with value: 0.28740265807407617 and parameters: {'model_type': 'graphsage', 'hidden_dims': '[256, 128, 64]', 'dropout': 0.5017695493334354, 'batch_norm': True, 'sage_aggr': 'mean', 'sage_normalize': False, 'sage_project': False, 'lr': 0.0030722389707325496, 'weight_decay': 1.3327270375898756e-07, 'epochs': 84, 'loss': 'mse', 'optimizer': 'adam', 'graph_mode': 'cutoff', 'cutoff': 0.5557707785204306, 'grm_norm': 'cosine_then_gcn', 'self_loops': True, 'use_snp_selection': False}. Best is trial 79 with value: 0.29785602291757357.
[I 2025-12-08 22:18:30,189] Trial 86 finished with value: 0.28820321056051135 and parameters: {'model_type': 'graphsage', 'hidden_dims': '[256, 128, 64]', 'dropout': 0.5357137650266702, 'batch_norm': True, 'sage_aggr': 'mean', 'sage_normalize': False, 'sage_project': False, 'lr': 0.0044331707730208125, 'weight_decay': 4.652110600426319e-07, 'epochs': 69, 'loss': 'mse', 'optimizer': 'adam', 'graph_mode': 'cutoff', 'cutoff': 0.4385434400500201, 'grm_norm': 'cosine_then_gcn', 'self_loops': True, 'use_snp_selection': False}. Best is trial 79 with value: 0.29785602291757357.
[I 2025-12-08 22:18:51,620] Trial 87 finished with value: 0.0045883035554662825 and parameters: {'model_type': 'graphsage', 'hidden_dims': '[128, 64]', 'dropout': 0.366975433812013, 'batch_norm': False, 'sage_aggr': 'mean', 'sage_normalize': False, 'sage_project': False, 'lr': 0.0012063230283055062, 'weight_decay': 3.262203773803741e-07, 'epochs': 58, 'loss': 'mse', 'optimizer': 'adam', 'graph_mode': 'cutoff', 'cutoff': 0.40135689115238765, 'grm_norm': 'none', 'self_loops': False, 'use_snp_selection': False}. Best is trial 79 with value: 0.29785602291757357.
[I 2025-12-08 22:19:25,049] Trial 88 finished with value: 0.2942124049780212 and parameters: {'model_type': 'graphsage', 'hidden_dims': '[256, 128, 64]', 'dropout': 0.5543195781976568, 'batch_norm': True, 'sage_aggr': 'mean', 'sage_normalize': False, 'sage_project': False, 'lr': 0.0033422522400892293, 'weight_decay': 2.2331036150246356e-07, 'epochs': 77, 'loss': 'mse', 'optimizer': 'adam', 'graph_mode': 'cutoff', 'cutoff': 0.469662671000502, 'grm_norm': 'cosine_then_gcn', 'self_loops': True, 'use_snp_selection': False}. Best is trial 79 with value: 0.29785602291757357.
[I 2025-12-08 22:20:30,638] Trial 89 finished with value: 0.29379778310315646 and parameters: {'model_type': 'graphsage', 'hidden_dims': '[512, 256]', 'dropout': 0.5589705031907851, 'batch_norm': True, 'sage_aggr': 'mean', 'sage_normalize': False, 'sage_project': False, 'lr': 0.0016232650293601205, 'weight_decay': 7.237723286648083e-07, 'epochs': 111, 'loss': 'mse', 'optimizer': 'adam', 'graph_mode': 'cutoff', 'cutoff': 0.48329459922365164, 'grm_norm': 'cosine_then_gcn', 'self_loops': True, 'use_snp_selection': False}. Best is trial 79 with value: 0.29785602291757357.
[I 2025-12-08 22:21:36,400] Trial 90 finished with value: 0.29127956188298876 and parameters: {'model_type': 'graphsage', 'hidden_dims': '[512, 256]', 'dropout': 0.13057184547262662, 'batch_norm': True, 'sage_aggr': 'mean', 'sage_normalize': False, 'sage_project': False, 'lr': 0.001651098053935149, 'weight_decay': 2.286278611736132e-07, 'epochs': 110, 'loss': 'mse', 'optimizer': 'adam', 'graph_mode': 'cutoff', 'cutoff': 0.4649222361024492, 'grm_norm': 'cosine_then_gcn', 'self_loops': True, 'use_snp_selection': False}. Best is trial 79 with value: 0.29785602291757357.
[I 2025-12-08 22:22:34,592] Trial 91 finished with value: 0.2964064740562549 and parameters: {'model_type': 'graphsage', 'hidden_dims': '[512, 256]', 'dropout': 0.5541567797544908, 'batch_norm': True, 'sage_aggr': 'mean', 'sage_normalize': False, 'sage_project': False, 'lr': 0.001973992296128201, 'weight_decay': 6.513007143839861e-07, 'epochs': 95, 'loss': 'mse', 'optimizer': 'adam', 'graph_mode': 'cutoff', 'cutoff': 0.483008562500503, 'grm_norm': 'cosine_then_gcn', 'self_loops': True, 'use_snp_selection': False}. Best is trial 79 with value: 0.29785602291757357.
[I 2025-12-08 22:23:32,744] Trial 92 finished with value: 0.29059904653059143 and parameters: {'model_type': 'graphsage', 'hidden_dims': '[512, 256]', 'dropout': 0.5481408682048518, 'batch_norm': True, 'sage_aggr': 'mean', 'sage_normalize': False, 'sage_project': False, 'lr': 0.0008608457315755885, 'weight_decay': 9.753354681002336e-07, 'epochs': 95, 'loss': 'mse', 'optimizer': 'adam', 'graph_mode': 'cutoff', 'cutoff': 0.48290062701486314, 'grm_norm': 'cosine_then_gcn', 'self_loops': True, 'use_snp_selection': False}. Best is trial 79 with value: 0.29785602291757357.
[I 2025-12-08 22:24:23,776] Trial 93 finished with value: 0.29237877973774057 and parameters: {'model_type': 'graphsage', 'hidden_dims': '[512, 256]', 'dropout': 0.5597619233908465, 'batch_norm': True, 'sage_aggr': 'mean', 'sage_normalize': False, 'sage_project': False, 'lr': 0.0015180768263752642, 'weight_decay': 6.590255606780212e-07, 'epochs': 78, 'loss': 'mse', 'optimizer': 'adam', 'graph_mode': 'cutoff', 'cutoff': 0.41176564834296553, 'grm_norm': 'cosine_then_gcn', 'self_loops': True, 'use_snp_selection': False}. Best is trial 79 with value: 0.29785602291757357.
[I 2025-12-08 22:25:22,469] Trial 94 finished with value: 0.2868981581372795 and parameters: {'model_type': 'graphsage', 'hidden_dims': '[512, 128]', 'dropout': 0.5158656755467467, 'batch_norm': True, 'sage_aggr': 'mean', 'sage_normalize': False, 'sage_project': False, 'lr': 0.0019031762718819975, 'weight_decay': 1.862906187176178e-06, 'epochs': 102, 'loss': 'mse', 'optimizer': 'adam', 'graph_mode': 'cutoff', 'cutoff': 0.5072429475572631, 'grm_norm': 'cosine_then_gcn', 'self_loops': True, 'use_snp_selection': False}. Best is trial 79 with value: 0.29785602291757357.
[I 2025-12-08 22:25:57,801] Trial 95 finished with value: 0.29026318116124206 and parameters: {'model_type': 'graphsage', 'hidden_dims': '[512, 256]', 'dropout': 0.5542832328208228, 'batch_norm': True, 'sage_aggr': 'mean', 'sage_normalize': False, 'sage_project': False, 'lr': 0.0037220484054072476, 'weight_decay': 3.585850335199621e-07, 'epochs': 46, 'loss': 'mse', 'optimizer': 'adam', 'graph_mode': 'cutoff', 'cutoff': 0.4509163912130218, 'grm_norm': 'cosine_then_gcn', 'self_loops': True, 'use_snp_selection': False}. Best is trial 79 with value: 0.29785602291757357.
[I 2025-12-08 22:27:13,353] Trial 96 finished with value: 0.2900055632583973 and parameters: {'model_type': 'graphsage', 'hidden_dims': '[512, 256]', 'dropout': 0.5662257386488128, 'batch_norm': True, 'sage_aggr': 'mean', 'sage_normalize': False, 'sage_project': False, 'lr': 0.005621102190849767, 'weight_decay': 6.77942446263703e-07, 'epochs': 128, 'loss': 'mse', 'optimizer': 'adam', 'graph_mode': 'cutoff', 'cutoff': 0.38914964656276396, 'grm_norm': 'cosine_then_gcn', 'self_loops': True, 'use_snp_selection': False}. Best is trial 79 with value: 0.29785602291757357.
[I 2025-12-08 22:28:15,105] Trial 97 finished with value: 0.2785978909374828 and parameters: {'model_type': 'graphsage', 'hidden_dims': '[512, 256]', 'dropout': 0.5848736490326031, 'batch_norm': True, 'sage_aggr': 'mean', 'sage_normalize': False, 'sage_project': False, 'lr': 0.0025202300153372784, 'weight_decay': 5.097149391602285e-07, 'epochs': 84, 'loss': 'mse', 'optimizer': 'adam', 'graph_mode': 'knn', 'knn_k': 8, 'weighted_edges': False, 'symmetrize_mode': 'mutual', 'self_loops': True, 'use_snp_selection': False}. Best is trial 79 with value: 0.29785602291757357.
[I 2025-12-08 22:28:55,451] Trial 98 finished with value: 0.24701224762124538 and parameters: {'model_type': 'graphsage', 'hidden_dims': '[512, 256]', 'dropout': 0.21671756516017185, 'batch_norm': True, 'sage_aggr': 'mean', 'sage_normalize': True, 'sage_project': False, 'lr': 0.0074875129826312385, 'weight_decay': 2.757509687114102e-07, 'epochs': 56, 'loss': 'mae', 'optimizer': 'adam', 'graph_mode': 'cutoff', 'cutoff': 0.42839005419934706, 'grm_norm': 'cosine_then_gcn', 'self_loops': True, 'use_snp_selection': False}. Best is trial 79 with value: 0.29785602291757357.
[I 2025-12-08 22:29:13,650] Trial 99 finished with value: 0.28775340726477266 and parameters: {'model_type': 'graphsage', 'hidden_dims': '[128, 64]', 'dropout': 0.5858225808723666, 'batch_norm': True, 'sage_aggr': 'mean', 'sage_normalize': False, 'sage_project': False, 'lr': 0.004801183820249443, 'weight_decay': 4.877068389427403e-07, 'epochs': 40, 'loss': 'mse', 'optimizer': 'adam', 'graph_mode': 'cutoff', 'cutoff': 0.4768917032213804, 'grm_norm': 'cosine_then_gcn', 'self_loops': True, 'use_snp_selection': False}. Best is trial 79 with value: 0.29785602291757357.
[I 2025-12-08 22:30:20,862] Trial 100 finished with value: 0.2944172528105541 and parameters: {'model_type': 'graphsage', 'hidden_dims': '[512, 256]', 'dropout': 0.5435820775248319, 'batch_norm': True, 'sage_aggr': 'mean', 'sage_normalize': False, 'sage_project': False, 'lr': 0.0029133644530782753, 'weight_decay': 1.0098381264977628e-06, 'epochs': 118, 'loss': 'mse', 'optimizer': 'adam', 'graph_mode': 'cutoff', 'cutoff': 0.5023785201633413, 'grm_norm': 'none', 'self_loops': True, 'use_snp_selection': False}. Best is trial 79 with value: 0.29785602291757357.
[I 2025-12-08 22:31:31,798] Trial 101 finished with value: 0.29340062260412664 and parameters: {'model_type': 'graphsage', 'hidden_dims': '[512, 256]', 'dropout': 0.539303420619432, 'batch_norm': True, 'sage_aggr': 'mean', 'sage_normalize': False, 'sage_project': False, 'lr': 0.0029537078374921636, 'weight_decay': 3.523444040052585e-07, 'epochs': 121, 'loss': 'mse', 'optimizer': 'adam', 'graph_mode': 'cutoff', 'cutoff': 0.45391775943980694, 'grm_norm': 'none', 'self_loops': True, 'use_snp_selection': False}. Best is trial 79 with value: 0.29785602291757357.
[I 2025-12-08 22:32:39,562] Trial 102 finished with value: 0.28712326677031963 and parameters: {'model_type': 'graphsage', 'hidden_dims': '[512, 256]', 'dropout': 0.4962135107137403, 'batch_norm': True, 'sage_aggr': 'mean', 'sage_normalize': False, 'sage_project': False, 'lr': 0.003151978288304527, 'weight_decay': 1.029816411284296e-06, 'epochs': 114, 'loss': 'mse', 'optimizer': 'adam', 'graph_mode': 'cutoff', 'cutoff': 0.43933081953128894, 'grm_norm': 'none', 'self_loops': True, 'use_snp_selection': False}. Best is trial 79 with value: 0.29785602291757357.
[I 2025-12-08 22:33:27,476] Trial 103 finished with value: 0.28791282782139355 and parameters: {'model_type': 'graphsage', 'hidden_dims': '[512, 256]', 'dropout': 0.5428999937069393, 'batch_norm': True, 'sage_aggr': 'mean', 'sage_normalize': False, 'sage_project': False, 'lr': 0.0025577602137023415, 'weight_decay': 5.886647964632061e-07, 'epochs': 77, 'loss': 'mse', 'optimizer': 'adam', 'graph_mode': 'cutoff', 'cutoff': 0.5046238683144253, 'grm_norm': 'none', 'self_loops': True, 'use_snp_selection': False}. Best is trial 79 with value: 0.29785602291757357.
[I 2025-12-08 22:34:29,181] Trial 104 finished with value: 0.28623493632339436 and parameters: {'model_type': 'graphsage', 'hidden_dims': '[512, 256]', 'dropout': 0.5543199953718525, 'batch_norm': True, 'sage_aggr': 'mean', 'sage_normalize': False, 'sage_project': False, 'lr': 0.0041075728845697, 'weight_decay': 7.764798664130515e-07, 'epochs': 92, 'loss': 'mse', 'optimizer': 'adam', 'graph_mode': 'cutoff', 'cutoff': 0.3093364252569974, 'grm_norm': 'none', 'self_loops': True, 'use_snp_selection': False}. Best is trial 79 with value: 0.29785602291757357.
[I 2025-12-08 22:35:26,261] Trial 105 finished with value: 0.2835160452661538 and parameters: {'model_type': 'graphsage', 'hidden_dims': '[512, 128]', 'dropout': 0.5237643321518325, 'batch_norm': True, 'sage_aggr': 'mean', 'sage_normalize': False, 'sage_project': False, 'lr': 0.006294221456979472, 'weight_decay': 4.10861324913168e-07, 'epochs': 104, 'loss': 'mse', 'optimizer': 'adam', 'graph_mode': 'cutoff', 'cutoff': 0.573544381329094, 'grm_norm': 'cosine_then_gcn', 'self_loops': True, 'use_snp_selection': False}. Best is trial 79 with value: 0.29785602291757357.
[I 2025-12-08 22:35:55,031] Trial 106 finished with value: -0.009720262609096357 and parameters: {'model_type': 'graphsage', 'hidden_dims': '[256, 128, 64]', 'dropout': 0.5665031533400511, 'batch_norm': False, 'sage_aggr': 'mean', 'sage_normalize': False, 'sage_project': False, 'lr': 0.003595687309502568, 'weight_decay': 1.5589137288863023e-06, 'epochs': 63, 'loss': 'mse', 'optimizer': 'adam', 'graph_mode': 'cutoff', 'cutoff': 0.4787475691671489, 'grm_norm': 'cosine_then_gcn', 'self_loops': False, 'use_snp_selection': False}. Best is trial 79 with value: 0.29785602291757357.
[I 2025-12-08 22:36:57,196] Trial 107 finished with value: 0.28740876818325767 and parameters: {'model_type': 'graphsage', 'hidden_dims': '[512, 256]', 'dropout': 0.5103013626038339, 'batch_norm': True, 'sage_aggr': 'mean', 'sage_normalize': False, 'sage_project': False, 'lr': 0.0018832660335467045, 'weight_decay': 2.128237446770245e-07, 'epochs': 117, 'loss': 'mse', 'optimizer': 'adam', 'graph_mode': 'cutoff', 'cutoff': 0.6216142023943025, 'grm_norm': 'cosine_then_gcn', 'self_loops': True, 'use_snp_selection': False}. Best is trial 79 with value: 0.29785602291757357.
[I 2025-12-08 22:37:21,473] Trial 108 finished with value: 0.2847982210664858 and parameters: {'model_type': 'graphsage', 'hidden_dims': '[256, 128, 64]', 'dropout': 0.5763108876335078, 'batch_norm': True, 'sage_aggr': 'mean', 'sage_normalize': False, 'sage_project': False, 'lr': 0.0014188503823559166, 'weight_decay': 3.045247912934494e-07, 'epochs': 50, 'loss': 'mse', 'optimizer': 'adam', 'graph_mode': 'cutoff', 'cutoff': 0.5044070979536108, 'grm_norm': 'cosine_then_gcn', 'self_loops': True, 'use_snp_selection': False}. Best is trial 79 with value: 0.29785602291757357.
[I 2025-12-08 22:37:57,882] Trial 109 finished with value: 0.29435368528853 and parameters: {'model_type': 'graphsage', 'hidden_dims': '[256, 128, 64]', 'dropout': 0.47217202090818494, 'batch_norm': True, 'sage_aggr': 'mean', 'sage_normalize': False, 'sage_project': False, 'lr': 0.0020267370633002472, 'weight_decay': 1.0430767180453242e-06, 'epochs': 86, 'loss': 'mse', 'optimizer': 'adam', 'graph_mode': 'cutoff', 'cutoff': 0.3810553003167106, 'grm_norm': 'none', 'self_loops': True, 'use_snp_selection': False}. Best is trial 79 with value: 0.29785602291757357.
[I 2025-12-08 22:38:52,854] Trial 110 finished with value: 0.28979641221915775 and parameters: {'model_type': 'graphsage', 'hidden_dims': '[512, 256]', 'dropout': 0.4692518609807983, 'batch_norm': True, 'sage_aggr': 'mean', 'sage_normalize': False, 'sage_project': False, 'lr': 0.0011285506830841089, 'weight_decay': 1.1960138176258643e-06, 'epochs': 86, 'loss': 'mse', 'optimizer': 'adam', 'graph_mode': 'cutoff', 'cutoff': 0.36940103395992135, 'grm_norm': 'none', 'self_loops': True, 'use_snp_selection': False}. Best is trial 79 with value: 0.29785602291757357.
[I 2025-12-08 22:39:31,952] Trial 111 finished with value: 0.29182374580143927 and parameters: {'model_type': 'graphsage', 'hidden_dims': '[256, 128, 64]', 'dropout': 0.4843757312149032, 'batch_norm': True, 'sage_aggr': 'mean', 'sage_normalize': False, 'sage_project': False, 'lr': 0.0021250204544623784, 'weight_decay': 8.781917269059216e-07, 'epochs': 96, 'loss': 'mse', 'optimizer': 'adam', 'graph_mode': 'cutoff', 'cutoff': 0.41587813679817603, 'grm_norm': 'none', 'self_loops': True, 'use_snp_selection': False}. Best is trial 79 with value: 0.29785602291757357.
[I 2025-12-08 22:39:59,302] Trial 112 finished with value: 0.2849861492813348 and parameters: {'model_type': 'graphsage', 'hidden_dims': '[256, 128, 64]', 'dropout': 0.5404426748702938, 'batch_norm': True, 'sage_aggr': 'mean', 'sage_normalize': False, 'sage_project': False, 'lr': 0.0024727948064242884, 'weight_decay': 2.906305923888987e-06, 'epochs': 53, 'loss': 'mse', 'optimizer': 'adam', 'graph_mode': 'cutoff', 'cutoff': 0.34109881255638586, 'grm_norm': 'none', 'self_loops': True, 'use_snp_selection': False}. Best is trial 79 with value: 0.29785602291757357.
[I 2025-12-08 22:40:49,415] Trial 113 finished with value: 0.29097764471759335 and parameters: {'model_type': 'graphsage', 'hidden_dims': '[256, 128, 64]', 'dropout': 0.4508196884528341, 'batch_norm': True, 'sage_aggr': 'mean', 'sage_normalize': False, 'sage_project': False, 'lr': 0.0031236263810498228, 'weight_decay': 1.688241746917923e-06, 'epochs': 131, 'loss': 'mse', 'optimizer': 'adam', 'graph_mode': 'cutoff', 'cutoff': 0.38707125001922066, 'grm_norm': 'none', 'self_loops': True, 'use_snp_selection': False}. Best is trial 79 with value: 0.29785602291757357.
[I 2025-12-08 22:41:22,558] Trial 114 finished with value: 0.2905340246461671 and parameters: {'model_type': 'graphsage', 'hidden_dims': '[256, 128, 64]', 'dropout': 0.5182722411767917, 'batch_norm': True, 'sage_aggr': 'mean', 'sage_normalize': False, 'sage_project': False, 'lr': 0.004981290351579966, 'weight_decay': 2.4547776215413086e-07, 'epochs': 76, 'loss': 'mse', 'optimizer': 'adam', 'graph_mode': 'cutoff', 'cutoff': 0.46812467323768336, 'grm_norm': 'cosine_then_gcn', 'self_loops': True, 'use_snp_selection': False}. Best is trial 79 with value: 0.29785602291757357.
[I 2025-12-08 22:41:52,675] Trial 115 finished with value: 0.2800181978117185 and parameters: {'model_type': 'graphsage', 'hidden_dims': '[256, 128, 64]', 'dropout': 0.5534239546436955, 'batch_norm': True, 'sage_aggr': 'mean', 'sage_normalize': False, 'sage_project': False, 'lr': 0.0039772625858679285, 'weight_decay': 2.4366441365701282e-06, 'epochs': 65, 'loss': 'mse', 'optimizer': 'adam', 'graph_mode': 'cutoff', 'cutoff': 0.44827478948854044, 'grm_norm': 'cosine_then_gcn', 'self_loops': True, 'use_snp_selection': False}. Best is trial 79 with value: 0.29785602291757357.
[I 2025-12-08 22:43:40,630] Trial 116 finished with value: 0.27615310168683277 and parameters: {'model_type': 'graphsage', 'hidden_dims': '[256, 128, 64]', 'dropout': 0.4991106987537789, 'batch_norm': True, 'sage_aggr': 'mean', 'sage_normalize': True, 'sage_project': False, 'lr': 0.0028596742683822947, 'weight_decay': 5.705362608871682e-07, 'epochs': 136, 'loss': 'mse', 'optimizer': 'adam', 'graph_mode': 'knn', 'knn_k': 10, 'weighted_edges': True, 'symmetrize_mode': 'union', 'self_loops': True, 'use_snp_selection': False}. Best is trial 79 with value: 0.29785602291757357.
[I 2025-12-08 22:44:09,185] Trial 117 finished with value: 0.285802019993351 and parameters: {'model_type': 'graphsage', 'hidden_dims': '[128, 64]', 'dropout': 0.4354047457271503, 'batch_norm': True, 'sage_aggr': 'mean', 'sage_normalize': False, 'sage_project': False, 'lr': 0.0016116753272311822, 'weight_decay': 1.9718906246128596e-07, 'epochs': 99, 'loss': 'mae', 'optimizer': 'adam', 'graph_mode': 'cutoff', 'cutoff': 0.49262854805276557, 'grm_norm': 'cosine_then_gcn', 'self_loops': True, 'use_snp_selection': False}. Best is trial 79 with value: 0.29785602291757357.
