[I 2025-12-08 23:38:47,625] Trial 3 finished with value: 0.27206936924841857 and parameters: {'model_type': 'graphsage', 'hidden_dims': '[256, 128, 64]', 'dropout': 0.3475243154412272, 'batch_norm': True, 'sage_aggr': 'max', 'sage_normalize': False, 'sage_project': False, 'lr': 1.6006331996938085e-05, 'weight_decay': 7.213121225589906e-06, 'epochs': 283, 'loss': 'mse', 'optimizer': 'adam', 'graph_mode': 'cutoff', 'cutoff': 0.5942334791449215, 'grm_norm': 'none', 'self_loops': True, 'use_snp_selection': False}. Best is trial 2 with value: 0.2886336702034972.
[I 2025-12-08 23:39:10,767] Trial 4 finished with value: 0.27666956056805503 and parameters: {'model_type': 'graphsage', 'hidden_dims': '[128, 64]', 'dropout': 0.3348926467202472, 'batch_norm': True, 'sage_aggr': 'max', 'sage_normalize': False, 'sage_project': False, 'lr': 0.0004238630400638802, 'weight_decay': 8.074086040046576e-07, 'epochs': 158, 'loss': 'mae', 'optimizer': 'adam', 'graph_mode': 'knn', 'knn_k': 1, 'weighted_edges': False, 'symmetrize_mode': 'mutual', 'self_loops': False, 'use_snp_selection': True, 'num_snps': 26850}. Best is trial 2 with value: 0.2886336702034972.
[I 2025-12-08 23:41:29,792] Trial 5 finished with value: 0.2767413944969726 and parameters: {'model_type': 'graphsage', 'hidden_dims': '[512, 64]', 'dropout': 0.14505336736221927, 'batch_norm': True, 'sage_aggr': 'mean', 'sage_normalize': True, 'sage_project': False, 'lr': 1.2962030165732234e-05, 'weight_decay': 1.326598071105465e-07, 'epochs': 180, 'loss': 'mse', 'optimizer': 'adam', 'graph_mode': 'knn', 'knn_k': 9, 'weighted_edges': True, 'symmetrize_mode': 'mutual', 'self_loops': False, 'use_snp_selection': False}. Best is trial 2 with value: 0.2886336702034972.
[I 2025-12-08 23:42:03,392] Trial 6 finished with value: 0.28995289087763904 and parameters: {'model_type': 'graphsage', 'hidden_dims': '[256, 128, 64]', 'dropout': 0.10731743755162496, 'batch_norm': True, 'sage_aggr': 'mean', 'sage_normalize': False, 'sage_project': False, 'lr': 1.922990426933137e-05, 'weight_decay': 7.30001060446905e-05, 'epochs': 63, 'loss': 'mae', 'optimizer': 'adam', 'graph_mode': 'cutoff', 'cutoff': 0.7624978434202536, 'grm_norm': 'none', 'self_loops': True, 'use_snp_selection': True, 'num_snps': 50106}. Best is trial 6 with value: 0.28995289087763904.
[I 2025-12-08 23:44:04,584] Trial 7 finished with value: 0.2637590880648603 and parameters: {'model_type': 'graphsage', 'hidden_dims': '[512, 64]', 'dropout': 0.2585007811528941, 'batch_norm': True, 'sage_aggr': 'max', 'sage_normalize': True, 'sage_project': False, 'lr': 5.921425508303391e-05, 'weight_decay': 0.0004511561961144237, 'epochs': 182, 'loss': 'mae', 'optimizer': 'adam', 'graph_mode': 'knn', 'knn_k': 9, 'weighted_edges': True, 'symmetrize_mode': 'union', 'self_loops': False, 'use_snp_selection': True, 'num_snps': 23903}. Best is trial 6 with value: 0.28995289087763904.
[I 2025-12-08 23:44:30,822] Trial 8 finished with value: 0.24045149386731293 and parameters: {'model_type': 'graphsage', 'hidden_dims': '[512, 256]', 'dropout': 0.3061380386767003, 'batch_norm': False, 'sage_aggr': 'mean', 'sage_normalize': True, 'sage_project': False, 'lr': 0.000698401460570184, 'weight_decay': 2.965560055460244e-06, 'epochs': 289, 'loss': 'mae', 'optimizer': 'adam', 'graph_mode': 'knn', 'knn_k': 7, 'weighted_edges': False, 'symmetrize_mode': 'mutual', 'self_loops': True, 'use_snp_selection': True, 'num_snps': 4710}. Best is trial 6 with value: 0.28995289087763904.
[I 2025-12-08 23:49:41,595] Trial 9 finished with value: 0.2940184151694189 and parameters: {'model_type': 'graphsage', 'hidden_dims': '[512, 128]', 'dropout': 0.1733844071393634, 'batch_norm': False, 'sage_aggr': 'mean', 'sage_normalize': True, 'sage_project': False, 'lr': 0.0004269677918501597, 'weight_decay': 2.2439779626249696e-06, 'epochs': 319, 'loss': 'mse', 'optimizer': 'adam', 'graph_mode': 'cutoff', 'cutoff': 0.24117565767129295, 'grm_norm': 'cosine_then_gcn', 'self_loops': True, 'use_snp_selection': False}. Best is trial 9 with value: 0.2940184151694189.
[I 2025-12-08 23:55:11,643] Trial 10 finished with value: 0.29307299818239363 and parameters: {'model_type': 'graphsage', 'hidden_dims': '[512, 128]', 'dropout': 0.5365714961141473, 'batch_norm': False, 'sage_aggr': 'mean', 'sage_normalize': True, 'sage_project': False, 'lr': 0.004737327072203749, 'weight_decay': 7.303103160282385e-07, 'epochs': 299, 'loss': 'mse', 'optimizer': 'adam', 'graph_mode': 'cutoff', 'cutoff': 0.21281628365523453, 'grm_norm': 'cosine_then_gcn', 'self_loops': True, 'use_snp_selection': False}. Best is trial 9 with value: 0.2940184151694189.
[I 2025-12-09 00:01:19,312] Trial 11 finished with value: 0.27869518912312347 and parameters: {'model_type': 'graphsage', 'hidden_dims': '[512, 128]', 'dropout': 0.5154800957818386, 'batch_norm': False, 'sage_aggr': 'mean', 'sage_normalize': True, 'sage_project': False, 'lr': 0.006674532614550016, 'weight_decay': 6.544345930867686e-07, 'epochs': 335, 'loss': 'mse', 'optimizer': 'adam', 'graph_mode': 'cutoff', 'cutoff': 0.21348952516572178, 'grm_norm': 'cosine_then_gcn', 'self_loops': True, 'use_snp_selection': False}. Best is trial 9 with value: 0.2940184151694189.
[I 2025-12-09 00:07:38,498] Trial 12 finished with value: 0.29612484329496197 and parameters: {'model_type': 'graphsage', 'hidden_dims': '[512, 128]', 'dropout': 0.49488375368548476, 'batch_norm': False, 'sage_aggr': 'mean', 'sage_normalize': True, 'sage_project': False, 'lr': 0.003802842966026102, 'weight_decay': 9.156985192829673e-07, 'epochs': 344, 'loss': 'mse', 'optimizer': 'adam', 'graph_mode': 'cutoff', 'cutoff': 0.21242241803866538, 'grm_norm': 'cosine_then_gcn', 'self_loops': True, 'use_snp_selection': False}. Best is trial 12 with value: 0.29612484329496197.
[I 2025-12-09 00:09:54,436] Trial 13 finished with value: 0.2977064860096447 and parameters: {'model_type': 'graphsage', 'hidden_dims': '[256, 128]', 'dropout': 0.4333322659330895, 'batch_norm': False, 'sage_aggr': 'mean', 'sage_normalize': True, 'sage_project': False, 'lr': 0.0016227502622377062, 'weight_decay': 3.7056484460517325e-06, 'epochs': 339, 'loss': 'mse', 'optimizer': 'adam', 'graph_mode': 'cutoff', 'cutoff': 0.38034063628338033, 'grm_norm': 'cosine_then_gcn', 'self_loops': True, 'use_snp_selection': False}. Best is trial 13 with value: 0.2977064860096447.
[I 2025-12-09 00:11:32,699] Trial 14 finished with value: 0.29541146581693734 and parameters: {'model_type': 'graphsage', 'hidden_dims': '[256, 128]', 'dropout': 0.4434163309768403, 'batch_norm': False, 'sage_aggr': 'mean', 'sage_normalize': True, 'sage_project': False, 'lr': 0.0017523346364436024, 'weight_decay': 1.0275636300399289e-07, 'epochs': 248, 'loss': 'mse', 'optimizer': 'adam', 'graph_mode': 'cutoff', 'cutoff': 0.41206637181711203, 'grm_norm': 'cosine', 'self_loops': True, 'use_snp_selection': False}. Best is trial 13 with value: 0.2977064860096447.
[I 2025-12-09 00:13:51,847] Trial 15 finished with value: 0.30117429860128964 and parameters: {'model_type': 'graphsage', 'hidden_dims': '[256, 128]', 'dropout': 0.4333470818492372, 'batch_norm': False, 'sage_aggr': 'mean', 'sage_normalize': True, 'sage_project': False, 'lr': 0.001968301125166922, 'weight_decay': 2.4480221808497912e-05, 'epochs': 341, 'loss': 'mse', 'optimizer': 'adam', 'graph_mode': 'cutoff', 'cutoff': 0.3609099042183447, 'grm_norm': 'cosine_then_gcn', 'self_loops': True, 'use_snp_selection': False}. Best is trial 15 with value: 0.30117429860128964.
[I 2025-12-09 00:15:29,954] Trial 16 finished with value: 0.29924482146308345 and parameters: {'model_type': 'graphsage', 'hidden_dims': '[256, 128]', 'dropout': 0.41664306625062125, 'batch_norm': False, 'sage_aggr': 'mean', 'sage_normalize': True, 'sage_project': False, 'lr': 0.0021201509332054555, 'weight_decay': 2.095970675796574e-05, 'epochs': 247, 'loss': 'mse', 'optimizer': 'adam', 'graph_mode': 'cutoff', 'cutoff': 0.40678247596512945, 'grm_norm': 'cosine_then_gcn', 'self_loops': True, 'use_snp_selection': False}. Best is trial 15 with value: 0.30117429860128964.
[I 2025-12-09 00:16:39,512] Trial 17 finished with value: 0.2938407463033097 and parameters: {'model_type': 'graphsage', 'hidden_dims': '[256, 128]', 'dropout': 0.5936973532540364, 'batch_norm': False, 'sage_aggr': 'mean', 'sage_normalize': True, 'sage_project': False, 'lr': 0.0013461533115555048, 'weight_decay': 2.34219346526549e-05, 'epochs': 236, 'loss': 'mse', 'optimizer': 'adam', 'graph_mode': 'cutoff', 'cutoff': 0.6349690136441454, 'grm_norm': 'gcn', 'self_loops': True, 'use_snp_selection': False}. Best is trial 15 with value: 0.30117429860128964.
[I 2025-12-09 00:17:21,575] Trial 18 finished with value: 0.25672781400727246 and parameters: {'model_type': 'graphsage', 'hidden_dims': '[256, 128]', 'dropout': 0.4147429185499536, 'batch_norm': False, 'sage_aggr': 'mean', 'sage_normalize': True, 'sage_project': False, 'lr': 0.00015445580382806746, 'weight_decay': 1.422629798375523e-05, 'epochs': 98, 'loss': 'mse', 'optimizer': 'adam', 'graph_mode': 'cutoff', 'cutoff': 0.36993105466035314, 'grm_norm': 'cosine', 'self_loops': False, 'use_snp_selection': False}. Best is trial 15 with value: 0.30117429860128964.
[I 2025-12-09 00:19:01,241] Trial 19 finished with value: 0.29254403042612565 and parameters: {'model_type': 'graphsage', 'hidden_dims': '[256, 128]', 'dropout': 0.3899778563017159, 'batch_norm': False, 'sage_aggr': 'mean', 'sage_normalize': True, 'sage_project': False, 'lr': 0.002801378072468052, 'weight_decay': 7.592030665997785e-05, 'epochs': 271, 'loss': 'mse', 'optimizer': 'adam', 'graph_mode': 'cutoff', 'cutoff': 0.48911958722940174, 'grm_norm': 'cosine_then_gcn', 'self_loops': True, 'use_snp_selection': False}. Best is trial 15 with value: 0.30117429860128964.
[I 2025-12-09 00:20:34,976] Trial 20 finished with value: 0.23685557995068734 and parameters: {'model_type': 'graphsage', 'hidden_dims': '[256, 128]', 'dropout': 0.4774315604310892, 'batch_norm': False, 'sage_aggr': 'mean', 'sage_normalize': True, 'sage_project': False, 'lr': 0.008630482654590122, 'weight_decay': 7.200011951510634e-05, 'epochs': 211, 'loss': 'mse', 'optimizer': 'adam', 'graph_mode': 'cutoff', 'cutoff': 0.3244359480171399, 'grm_norm': 'cosine_then_gcn', 'self_loops': True, 'use_snp_selection': False}. Best is trial 15 with value: 0.30117429860128964.
[I 2025-12-09 00:22:40,675] Trial 21 finished with value: 0.29767781137714466 and parameters: {'model_type': 'graphsage', 'hidden_dims': '[256, 128]', 'dropout': 0.40010999896336136, 'batch_norm': False, 'sage_aggr': 'mean', 'sage_normalize': True, 'sage_project': False, 'lr': 0.0011444013185785346, 'weight_decay': 6.272982667153686e-06, 'epochs': 322, 'loss': 'mse', 'optimizer': 'adam', 'graph_mode': 'cutoff', 'cutoff': 0.42263769169934207, 'grm_norm': 'cosine_then_gcn', 'self_loops': True, 'use_snp_selection': False}. Best is trial 15 with value: 0.30117429860128964.
[I 2025-12-09 00:25:06,344] Trial 22 finished with value: 0.3041329662341845 and parameters: {'model_type': 'graphsage', 'hidden_dims': '[256, 128]', 'dropout': 0.45349159005502077, 'batch_norm': False, 'sage_aggr': 'mean', 'sage_normalize': True, 'sage_project': False, 'lr': 0.002353183151262404, 'weight_decay': 3.403498581725721e-06, 'epochs': 346, 'loss': 'mse', 'optimizer': 'adam', 'graph_mode': 'cutoff', 'cutoff': 0.34135577580206683, 'grm_norm': 'cosine_then_gcn', 'self_loops': True, 'use_snp_selection': False}. Best is trial 22 with value: 0.3041329662341845.
[I 2025-12-09 00:26:36,545] Trial 23 finished with value: 0.2876002405160613 and parameters: {'model_type': 'graphsage', 'hidden_dims': '[256, 128]', 'dropout': 0.5658399310161752, 'batch_norm': False, 'sage_aggr': 'mean', 'sage_normalize': True, 'sage_project': False, 'lr': 0.0027141116903987104, 'weight_decay': 1.2334451262200844e-05, 'epochs': 258, 'loss': 'mse', 'optimizer': 'adam', 'graph_mode': 'cutoff', 'cutoff': 0.4985501335813225, 'grm_norm': 'cosine_then_gcn', 'self_loops': True, 'use_snp_selection': False}. Best is trial 22 with value: 0.3041329662341845.
[I 2025-12-09 00:29:24,697] Trial 24 finished with value: 0.3001816026863703 and parameters: {'model_type': 'graphsage', 'hidden_dims': '[256, 128]', 'dropout': 0.4665968118223398, 'batch_norm': False, 'sage_aggr': 'mean', 'sage_normalize': True, 'sage_project': False, 'lr': 0.0007885567118652199, 'weight_decay': 3.0306723264385826e-05, 'epochs': 308, 'loss': 'mse', 'optimizer': 'adam', 'graph_mode': 'cutoff', 'cutoff': 0.2984567277542274, 'grm_norm': 'cosine_then_gcn', 'self_loops': True, 'use_snp_selection': False}. Best is trial 22 with value: 0.3041329662341845.
[I 2025-12-09 00:31:46,398] Trial 25 finished with value: 0.3019203865367691 and parameters: {'model_type': 'graphsage', 'hidden_dims': '[256, 128]', 'dropout': 0.4760449324496737, 'batch_norm': False, 'sage_aggr': 'mean', 'sage_normalize': True, 'sage_project': False, 'lr': 0.0007987908504473678, 'weight_decay': 4.419410203768292e-05, 'epochs': 319, 'loss': 'mse', 'optimizer': 'adam', 'graph_mode': 'cutoff', 'cutoff': 0.3199550470343424, 'grm_norm': 'cosine', 'self_loops': True, 'use_snp_selection': False}. Best is trial 22 with value: 0.3041329662341845.
[I 2025-12-09 00:34:53,408] Trial 26 finished with value: 0.292816597509921 and parameters: {'model_type': 'graphsage', 'hidden_dims': '[256, 128]', 'dropout': 0.3752901255251362, 'batch_norm': False, 'sage_aggr': 'mean', 'sage_normalize': False, 'sage_project': False, 'lr': 0.00018261035730288063, 'weight_decay': 0.0007737902801798462, 'epochs': 345, 'loss': 'mae', 'optimizer': 'adam', 'graph_mode': 'cutoff', 'cutoff': 0.29898661712330266, 'grm_norm': 'cosine', 'self_loops': False, 'use_snp_selection': False}. Best is trial 22 with value: 0.3041329662341845.
[I 2025-12-09 00:35:49,840] Trial 27 finished with value: 0.2937636005996043 and parameters: {'model_type': 'graphsage', 'hidden_dims': '[128, 64]', 'dropout': 0.5315887643117994, 'batch_norm': False, 'sage_aggr': 'mean', 'sage_normalize': True, 'sage_project': False, 'lr': 0.00075744438876741, 'weight_decay': 5.1079515105789643e-05, 'epochs': 316, 'loss': 'mse', 'optimizer': 'adam', 'graph_mode': 'cutoff', 'cutoff': 0.876594208572298, 'grm_norm': 'cosine', 'self_loops': True, 'use_snp_selection': False}. Best is trial 22 with value: 0.3041329662341845.
[I 2025-12-09 00:38:49,010] Trial 28 finished with value: 0.27397989053086275 and parameters: {'model_type': 'graphsage', 'hidden_dims': '[256, 128, 64]', 'dropout': 0.4581930285991578, 'batch_norm': False, 'sage_aggr': 'mean', 'sage_normalize': True, 'sage_project': False, 'lr': 0.00020895104889108495, 'weight_decay': 0.0001951745149464472, 'epochs': 349, 'loss': 'mse', 'optimizer': 'adam', 'graph_mode': 'cutoff', 'cutoff': 0.31407794493595054, 'grm_norm': 'cosine', 'self_loops': True, 'use_snp_selection': False}. Best is trial 22 with value: 0.3041329662341845.
[I 2025-12-09 00:41:24,876] Trial 29 finished with value: 0.2693787789178333 and parameters: {'model_type': 'graphsage', 'hidden_dims': '[512, 256]', 'dropout': 0.5055981892874649, 'batch_norm': True, 'sage_aggr': 'max', 'sage_normalize': True, 'sage_project': False, 'lr': 0.004345421959342964, 'weight_decay': 0.00013380553949703008, 'epochs': 218, 'loss': 'mse', 'optimizer': 'adam', 'graph_mode': 'knn', 'knn_k': 3, 'weighted_edges': False, 'symmetrize_mode': 'union', 'self_loops': True, 'use_snp_selection': False}. Best is trial 22 with value: 0.3041329662341845.
[I 2025-12-09 00:43:55,249] Trial 30 finished with value: 0.27234639932369836 and parameters: {'model_type': 'graphsage', 'hidden_dims': '[512, 64]', 'dropout': 0.3674841121018191, 'batch_norm': False, 'sage_aggr': 'mean', 'sage_normalize': True, 'sage_project': False, 'lr': 0.0003258551492237266, 'weight_decay': 2.911609246389196e-07, 'epochs': 273, 'loss': 'mse', 'optimizer': 'adam', 'graph_mode': 'cutoff', 'cutoff': 0.5578082010081278, 'grm_norm': 'gcn', 'self_loops': True, 'use_snp_selection': False}. Best is trial 22 with value: 0.3041329662341845.
[I 2025-12-09 00:47:07,873] Trial 31 finished with value: 0.298586826969338 and parameters: {'model_type': 'graphsage', 'hidden_dims': '[256, 128]', 'dropout': 0.46728666449664913, 'batch_norm': False, 'sage_aggr': 'mean', 'sage_normalize': True, 'sage_project': False, 'lr': 0.0008221078714946507, 'weight_decay': 3.131291690499223e-05, 'epochs': 309, 'loss': 'mse', 'optimizer': 'adam', 'graph_mode': 'cutoff', 'cutoff': 0.28291661803409085, 'grm_norm': 'none', 'self_loops': True, 'use_snp_selection': False}. Best is trial 22 with value: 0.3041329662341845.
[I 2025-12-09 00:49:14,178] Trial 32 finished with value: 0.292845322145307 and parameters: {'model_type': 'graphsage', 'hidden_dims': '[256, 128]', 'dropout': 0.5576005609241229, 'batch_norm': False, 'sage_aggr': 'mean', 'sage_normalize': True, 'sage_project': False, 'lr': 0.0006183058709267879, 'weight_decay': 6.71602216840677e-06, 'epochs': 304, 'loss': 'mse', 'optimizer': 'adam', 'graph_mode': 'cutoff', 'cutoff': 0.3500182484483156, 'grm_norm': 'cosine_then_gcn', 'self_loops': True, 'use_snp_selection': False}. Best is trial 22 with value: 0.3041329662341845.
[I 2025-12-09 00:52:37,215] Trial 33 finished with value: 0.29175529496277125 and parameters: {'model_type': 'graphsage', 'hidden_dims': '[256, 128]', 'dropout': 0.4823728829658307, 'batch_norm': False, 'sage_aggr': 'mean', 'sage_normalize': True, 'sage_project': False, 'lr': 0.0011191444336115127, 'weight_decay': 0.00012960139476650838, 'epochs': 328, 'loss': 'mse', 'optimizer': 'adam', 'graph_mode': 'cutoff', 'cutoff': 0.272442981074644, 'grm_norm': 'cosine', 'self_loops': True, 'use_snp_selection': False}. Best is trial 22 with value: 0.3041329662341845.
[I 2025-12-09 00:52:49,842] Trial 34 finished with value: 0.2707840194096846 and parameters: {'model_type': 'graphsage', 'hidden_dims': '[128, 64]', 'dropout': 0.4395683403065872, 'batch_norm': False, 'sage_aggr': 'max', 'sage_normalize': False, 'sage_project': False, 'lr': 0.002266837429222979, 'weight_decay': 1.6951352472635053e-06, 'epochs': 287, 'loss': 'mse', 'optimizer': 'adam', 'graph_mode': 'cutoff', 'cutoff': 0.4321298944604832, 'grm_norm': 'cosine_then_gcn', 'self_loops': True, 'use_snp_selection': True, 'num_snps': 2241}. Best is trial 22 with value: 0.3041329662341845.
[I 2025-12-09 00:55:45,170] Trial 35 finished with value: 0.012070387626566897 and parameters: {'model_type': 'graphsage', 'hidden_dims': '[256, 128]', 'dropout': 0.34673083542414135, 'batch_norm': False, 'sage_aggr': 'max', 'sage_normalize': False, 'sage_project': False, 'lr': 0.0005188420236878501, 'weight_decay': 1.3636181014021034e-05, 'epochs': 302, 'loss': 'mse', 'optimizer': 'adam', 'graph_mode': 'knn', 'knn_k': 4, 'weighted_edges': True, 'symmetrize_mode': 'union', 'self_loops': True, 'use_snp_selection': False}. Best is trial 22 with value: 0.3041329662341845.
[I 2025-12-09 01:02:16,333] Trial 36 finished with value: 0.27341137074419114 and parameters: {'model_type': 'graphsage', 'hidden_dims': '[256, 128]', 'dropout': 0.31376456405915326, 'batch_norm': True, 'sage_aggr': 'mean', 'sage_normalize': True, 'sage_project': False, 'lr': 0.0002491831078694867, 'weight_decay': 3.936908012568814e-05, 'epochs': 321, 'loss': 'mae', 'optimizer': 'adam', 'graph_mode': 'cutoff', 'cutoff': 0.2662474402236738, 'grm_norm': 'cosine_then_gcn', 'self_loops': False, 'use_snp_selection': True, 'num_snps': 59922}. Best is trial 22 with value: 0.3041329662341845.
[I 2025-12-09 01:04:11,165] Trial 37 finished with value: 0.2758094510915038 and parameters: {'model_type': 'graphsage', 'hidden_dims': '[256, 128, 64]', 'dropout': 0.46759384268705373, 'batch_norm': False, 'sage_aggr': 'mean', 'sage_normalize': False, 'sage_project': False, 'lr': 0.00011299691918550381, 'weight_decay': 4.704314520273628e-06, 'epochs': 266, 'loss': 'mse', 'optimizer': 'adam', 'graph_mode': 'cutoff', 'cutoff': 0.3330009021325767, 'grm_norm': 'cosine', 'self_loops': True, 'use_snp_selection': False}. Best is trial 22 with value: 0.3041329662341845.
[I 2025-12-09 01:06:39,807] Trial 38 finished with value: 0.2657050449020456 and parameters: {'model_type': 'graphsage', 'hidden_dims': '[512, 256]', 'dropout': 0.4253674472598626, 'batch_norm': True, 'sage_aggr': 'max', 'sage_normalize': True, 'sage_project': False, 'lr': 0.000967406604605906, 'weight_decay': 2.1042614820608693e-05, 'epochs': 119, 'loss': 'mae', 'optimizer': 'adam', 'graph_mode': 'knn', 'knn_k': 10, 'weighted_edges': True, 'symmetrize_mode': 'union', 'self_loops': False, 'use_snp_selection': False}. Best is trial 22 with value: 0.3041329662341845.
[I 2025-12-09 01:07:36,400] Trial 39 finished with value: 0.296035794576209 and parameters: {'model_type': 'graphsage', 'hidden_dims': '[512, 64]', 'dropout': 0.513457257317048, 'batch_norm': False, 'sage_aggr': 'mean', 'sage_normalize': True, 'sage_project': False, 'lr': 0.0031614964084165195, 'weight_decay': 0.00024356095591461142, 'epochs': 296, 'loss': 'mse', 'optimizer': 'adam', 'graph_mode': 'cutoff', 'cutoff': 0.4501391520969522, 'grm_norm': 'gcn', 'self_loops': True, 'use_snp_selection': True, 'num_snps': 15197}. Best is trial 22 with value: 0.3041329662341845.
[I 2025-12-09 01:10:23,041] Trial 40 finished with value: 0.2946154305818972 and parameters: {'model_type': 'graphsage', 'hidden_dims': '[128, 64]', 'dropout': 0.38364373066512564, 'batch_norm': True, 'sage_aggr': 'mean', 'sage_normalize': False, 'sage_project': False, 'lr': 0.00587644888920745, 'weight_decay': 1.0615088045120337e-05, 'epochs': 281, 'loss': 'mae', 'optimizer': 'adam', 'graph_mode': 'knn', 'knn_k': 7, 'weighted_edges': False, 'symmetrize_mode': 'union', 'self_loops': True, 'use_snp_selection': False}. Best is trial 22 with value: 0.3041329662341845.
