[I 2025-12-09 15:37:19,770] Trial 44 finished with value: 0.29492199650865103 and parameters: {'model_type': 'graphsage', 'hidden_dims': '[256, 128]', 'dropout': 0.3624129501293124, 'batch_norm': True, 'sage_aggr': 'max', 'sage_normalize': False, 'sage_project': False, 'lr': 0.0011784925146990743, 'weight_decay': 1.5568852726917862e-06, 'epochs': 71, 'loss': 'mse', 'optimizer': 'adam', 'graph_mode': 'cutoff', 'cutoff': 0.7625616642852885, 'grm_norm': 'cosine', 'self_loops': True, 'use_snp_selection': False}. Best is trial 37 with value: 0.30141857550670126.
[I 2025-12-09 15:38:04,282] Trial 45 finished with value: 0.278987058367306 and parameters: {'model_type': 'graphsage', 'hidden_dims': '[256, 128]', 'dropout': 0.2611361178181355, 'batch_norm': True, 'sage_aggr': 'mean', 'sage_normalize': True, 'sage_project': False, 'lr': 0.00040080357655689915, 'weight_decay': 1.2156798344769955e-05, 'epochs': 56, 'loss': 'mse', 'optimizer': 'adam', 'graph_mode': 'cutoff', 'cutoff': 0.7834800037505288, 'grm_norm': 'cosine_then_gcn', 'self_loops': True, 'use_snp_selection': True, 'num_snps': 34750}. Best is trial 37 with value: 0.30141857550670126.
[I 2025-12-09 15:38:53,474] Trial 46 finished with value: -0.0073420788885200025 and parameters: {'model_type': 'graphsage', 'hidden_dims': '[512, 256]', 'dropout': 0.519440115239021, 'batch_norm': False, 'sage_aggr': 'max', 'sage_normalize': False, 'sage_project': False, 'lr': 0.0050379975192524065, 'weight_decay': 2.861887589270135e-07, 'epochs': 80, 'loss': 'mse', 'optimizer': 'adam', 'graph_mode': 'cutoff', 'cutoff': 0.49873704002463987, 'grm_norm': 'cosine', 'self_loops': False, 'use_snp_selection': False}. Best is trial 37 with value: 0.30141857550670126.
[I 2025-12-09 15:40:31,253] Trial 47 finished with value: 0.2933040457586552 and parameters: {'model_type': 'graphsage', 'hidden_dims': '[512, 128]', 'dropout': 0.4220531061755298, 'batch_norm': True, 'sage_aggr': 'max', 'sage_normalize': False, 'sage_project': False, 'lr': 0.0005741250225260977, 'weight_decay': 5.644750337326253e-06, 'epochs': 201, 'loss': 'mse', 'optimizer': 'adam', 'graph_mode': 'cutoff', 'cutoff': 0.5909323078634764, 'grm_norm': 'cosine_then_gcn', 'self_loops': True, 'use_snp_selection': False}. Best is trial 37 with value: 0.30141857550670126.
[I 2025-12-09 15:41:13,687] Trial 48 finished with value: 0.26100447823301304 and parameters: {'model_type': 'graphsage', 'hidden_dims': '[256, 128]', 'dropout': 0.4574204140380468, 'batch_norm': True, 'sage_aggr': 'max', 'sage_normalize': False, 'sage_project': False, 'lr': 0.001589585870936737, 'weight_decay': 0.00047849450787071997, 'epochs': 95, 'loss': 'mse', 'optimizer': 'adam', 'graph_mode': 'knn', 'knn_k': 4, 'weighted_edges': False, 'symmetrize_mode': 'mutual', 'self_loops': True, 'use_snp_selection': False}. Best is trial 37 with value: 0.30141857550670126.
[I 2025-12-09 15:42:20,751] Trial 49 finished with value: 0.268988319213992 and parameters: {'model_type': 'graphsage', 'hidden_dims': '[256, 128, 64]', 'dropout': 0.4921414308790377, 'batch_norm': True, 'sage_aggr': 'mean', 'sage_normalize': True, 'sage_project': False, 'lr': 0.007555051131374553, 'weight_decay': 3.69336382177606e-05, 'epochs': 40, 'loss': 'mae', 'optimizer': 'adam', 'graph_mode': 'cutoff', 'cutoff': 0.23111430063253985, 'grm_norm': 'none', 'self_loops': True, 'use_snp_selection': True, 'num_snps': 43660}. Best is trial 37 with value: 0.30141857550670126.
[I 2025-12-09 15:43:02,172] Trial 50 finished with value: 0.2961156372233099 and parameters: {'model_type': 'graphsage', 'hidden_dims': '[512, 64]', 'dropout': 0.22459767857006127, 'batch_norm': True, 'sage_aggr': 'max', 'sage_normalize': False, 'sage_project': False, 'lr': 0.0008448613052203423, 'weight_decay': 0.0009656539778159482, 'epochs': 68, 'loss': 'mse', 'optimizer': 'adam', 'graph_mode': 'cutoff', 'cutoff': 0.7387262297632564, 'grm_norm': 'cosine', 'self_loops': True, 'use_snp_selection': False}. Best is trial 37 with value: 0.30141857550670126.
[I 2025-12-09 15:43:28,074] Trial 51 finished with value: 0.29466370745255616 and parameters: {'model_type': 'graphsage', 'hidden_dims': '[256, 128]', 'dropout': 0.4151864928258718, 'batch_norm': True, 'sage_aggr': 'max', 'sage_normalize': False, 'sage_project': False, 'lr': 0.0012311049546804653, 'weight_decay': 0.0006579794625866148, 'epochs': 64, 'loss': 'mse', 'optimizer': 'adam', 'graph_mode': 'cutoff', 'cutoff': 0.8391746360772074, 'grm_norm': 'cosine', 'self_loops': True, 'use_snp_selection': False}. Best is trial 37 with value: 0.30141857550670126.
[I 2025-12-09 15:44:05,297] Trial 52 finished with value: 0.29272116877365884 and parameters: {'model_type': 'graphsage', 'hidden_dims': '[256, 128]', 'dropout': 0.44353290529884304, 'batch_norm': True, 'sage_aggr': 'max', 'sage_normalize': False, 'sage_project': False, 'lr': 2.715164838610726e-05, 'weight_decay': 0.000714422265729468, 'epochs': 114, 'loss': 'mse', 'optimizer': 'adam', 'graph_mode': 'cutoff', 'cutoff': 0.8643028905866927, 'grm_norm': 'cosine', 'self_loops': True, 'use_snp_selection': False}. Best is trial 37 with value: 0.30141857550670126.
[I 2025-12-09 15:44:28,796] Trial 53 finished with value: 0.29520868074081974 and parameters: {'model_type': 'graphsage', 'hidden_dims': '[256, 128]', 'dropout': 0.4256079252299347, 'batch_norm': True, 'sage_aggr': 'max', 'sage_normalize': False, 'sage_project': False, 'lr': 0.002426874328167434, 'weight_decay': 0.0003822029614562545, 'epochs': 53, 'loss': 'mse', 'optimizer': 'adam', 'graph_mode': 'cutoff', 'cutoff': 0.6653387268066373, 'grm_norm': 'cosine', 'self_loops': True, 'use_snp_selection': False}. Best is trial 37 with value: 0.30141857550670126.
[I 2025-12-09 15:44:55,632] Trial 54 finished with value: 0.28871215450431703 and parameters: {'model_type': 'graphsage', 'hidden_dims': '[256, 128]', 'dropout': 0.39606038489348855, 'batch_norm': True, 'sage_aggr': 'max', 'sage_normalize': False, 'sage_project': False, 'lr': 0.001128697395792579, 'weight_decay': 2.3386988932616203e-05, 'epochs': 72, 'loss': 'mse', 'optimizer': 'adam', 'graph_mode': 'cutoff', 'cutoff': 0.8286258146545054, 'grm_norm': 'none', 'self_loops': True, 'use_snp_selection': False}. Best is trial 37 with value: 0.30141857550670126.
[I 2025-12-09 15:45:18,815] Trial 55 finished with value: 0.2946416405450333 and parameters: {'model_type': 'graphsage', 'hidden_dims': '[256, 128]', 'dropout': 0.3826924303050994, 'batch_norm': True, 'sage_aggr': 'max', 'sage_normalize': False, 'sage_project': False, 'lr': 0.0042273478039166965, 'weight_decay': 0.00018105641900212767, 'epochs': 52, 'loss': 'mse', 'optimizer': 'adam', 'graph_mode': 'cutoff', 'cutoff': 0.8817702335448273, 'grm_norm': 'cosine', 'self_loops': True, 'use_snp_selection': False}. Best is trial 37 with value: 0.30141857550670126.
[I 2025-12-09 15:47:30,843] Trial 56 finished with value: 0.25752261063116205 and parameters: {'model_type': 'graphsage', 'hidden_dims': '[256, 128]', 'dropout': 0.3482427858364901, 'batch_norm': True, 'sage_aggr': 'max', 'sage_normalize': False, 'sage_project': False, 'lr': 0.0022921463752239284, 'weight_decay': 8.824920727245272e-05, 'epochs': 298, 'loss': 'mse', 'optimizer': 'adam', 'graph_mode': 'cutoff', 'cutoff': 0.2806304230571812, 'grm_norm': 'cosine', 'self_loops': False, 'use_snp_selection': False}. Best is trial 37 with value: 0.30141857550670126.
[I 2025-12-09 15:48:04,998] Trial 57 finished with value: 0.062126380539934266 and parameters: {'model_type': 'graphsage', 'hidden_dims': '[256, 128, 64]', 'dropout': 0.43744258214931425, 'batch_norm': False, 'sage_aggr': 'max', 'sage_normalize': False, 'sage_project': False, 'lr': 0.003106478170886727, 'weight_decay': 0.00043806941942587204, 'epochs': 107, 'loss': 'mse', 'optimizer': 'adam', 'graph_mode': 'cutoff', 'cutoff': 0.786290648319186, 'grm_norm': 'gcn', 'self_loops': True, 'use_snp_selection': False}. Best is trial 37 with value: 0.30141857550670126.
[I 2025-12-09 15:48:36,970] Trial 58 finished with value: 0.29031453315855593 and parameters: {'model_type': 'graphsage', 'hidden_dims': '[256, 128]', 'dropout': 0.3145501158542025, 'batch_norm': True, 'sage_aggr': 'mean', 'sage_normalize': False, 'sage_project': False, 'lr': 0.001862165297006203, 'weight_decay': 0.0006568627771108283, 'epochs': 90, 'loss': 'mse', 'optimizer': 'adam', 'graph_mode': 'cutoff', 'cutoff': 0.8719239877439886, 'grm_norm': 'cosine', 'self_loops': True, 'use_snp_selection': False}. Best is trial 37 with value: 0.30141857550670126.
[I 2025-12-09 15:48:57,326] Trial 59 finished with value: 0.29601048128459195 and parameters: {'model_type': 'graphsage', 'hidden_dims': '[256, 128]', 'dropout': 0.46551346454322484, 'batch_norm': True, 'sage_aggr': 'max', 'sage_normalize': False, 'sage_project': False, 'lr': 0.00048821050113388167, 'weight_decay': 1.6022512228755021e-06, 'epochs': 40, 'loss': 'mse', 'optimizer': 'adam', 'graph_mode': 'cutoff', 'cutoff': 0.8987831067556913, 'grm_norm': 'cosine_then_gcn', 'self_loops': True, 'use_snp_selection': False}. Best is trial 37 with value: 0.30141857550670126.
[I 2025-12-09 15:50:07,931] Trial 60 finished with value: 0.29289326131418336 and parameters: {'model_type': 'graphsage', 'hidden_dims': '[512, 256]', 'dropout': 0.504169955831432, 'batch_norm': True, 'sage_aggr': 'max', 'sage_normalize': True, 'sage_project': False, 'lr': 0.000735451859275774, 'weight_decay': 0.00028703434264865715, 'epochs': 138, 'loss': 'mse', 'optimizer': 'adam', 'graph_mode': 'cutoff', 'cutoff': 0.8122717064227402, 'grm_norm': 'cosine', 'self_loops': True, 'use_snp_selection': False}. Best is trial 37 with value: 0.30141857550670126.
[I 2025-12-09 15:50:36,442] Trial 61 finished with value: 0.2974162078040106 and parameters: {'model_type': 'graphsage', 'hidden_dims': '[256, 128]', 'dropout': 0.4347989017033719, 'batch_norm': True, 'sage_aggr': 'max', 'sage_normalize': False, 'sage_project': False, 'lr': 0.0016913116856847714, 'weight_decay': 0.0005444327691887435, 'epochs': 76, 'loss': 'mse', 'optimizer': 'adam', 'graph_mode': 'cutoff', 'cutoff': 0.8339943482183269, 'grm_norm': 'cosine', 'self_loops': True, 'use_snp_selection': False}. Best is trial 37 with value: 0.30141857550670126.
[I 2025-12-09 15:51:02,238] Trial 62 finished with value: 0.2968032281321623 and parameters: {'model_type': 'graphsage', 'hidden_dims': '[256, 128]', 'dropout': 0.4077712882161679, 'batch_norm': True, 'sage_aggr': 'max', 'sage_normalize': False, 'sage_project': False, 'lr': 0.0018625242736708587, 'weight_decay': 0.0007747241837658677, 'epochs': 64, 'loss': 'mse', 'optimizer': 'adam', 'graph_mode': 'cutoff', 'cutoff': 0.8348613698236662, 'grm_norm': 'cosine', 'self_loops': True, 'use_snp_selection': False}. Best is trial 37 with value: 0.30141857550670126.
[I 2025-12-09 15:51:25,086] Trial 63 finished with value: 0.29470793636307646 and parameters: {'model_type': 'graphsage', 'hidden_dims': '[256, 128]', 'dropout': 0.4889224042354129, 'batch_norm': True, 'sage_aggr': 'max', 'sage_normalize': False, 'sage_project': False, 'lr': 0.001100102890851209, 'weight_decay': 0.000402137250052161, 'epochs': 51, 'loss': 'mse', 'optimizer': 'adam', 'graph_mode': 'cutoff', 'cutoff': 0.771107756856233, 'grm_norm': 'cosine', 'self_loops': True, 'use_snp_selection': False}. Best is trial 37 with value: 0.30141857550670126.
[I 2025-12-09 15:51:53,139] Trial 64 finished with value: 0.30122137416730776 and parameters: {'model_type': 'graphsage', 'hidden_dims': '[256, 128]', 'dropout': 0.5294065588224115, 'batch_norm': True, 'sage_aggr': 'max', 'sage_normalize': False, 'sage_project': False, 'lr': 0.0009225632119937669, 'weight_decay': 0.0009595431011669454, 'epochs': 78, 'loss': 'mse', 'optimizer': 'adam', 'graph_mode': 'cutoff', 'cutoff': 0.7295850477284096, 'grm_norm': 'none', 'self_loops': True, 'use_snp_selection': False}. Best is trial 37 with value: 0.30141857550670126.
[I 2025-12-09 15:52:13,885] Trial 65 finished with value: 0.2931463387883037 and parameters: {'model_type': 'graphsage', 'hidden_dims': '[128, 64]', 'dropout': 0.5482793015598156, 'batch_norm': True, 'sage_aggr': 'max', 'sage_normalize': False, 'sage_project': False, 'lr': 0.0003100283408107265, 'weight_decay': 0.00020069041337194752, 'epochs': 83, 'loss': 'mse', 'optimizer': 'adam', 'graph_mode': 'cutoff', 'cutoff': 0.7321565251981996, 'grm_norm': 'none', 'self_loops': True, 'use_snp_selection': False}. Best is trial 37 with value: 0.30141857550670126.
[I 2025-12-09 15:52:39,055] Trial 66 finished with value: 0.3018537110689449 and parameters: {'model_type': 'graphsage', 'hidden_dims': '[256, 128]', 'dropout': 0.5285790525063291, 'batch_norm': True, 'sage_aggr': 'max', 'sage_normalize': False, 'sage_project': False, 'lr': 0.0013394715389898214, 'weight_decay': 0.0009329093279724225, 'epochs': 65, 'loss': 'mse', 'optimizer': 'adam', 'graph_mode': 'cutoff', 'cutoff': 0.6824236538789835, 'grm_norm': 'none', 'self_loops': True, 'use_snp_selection': False}. Best is trial 66 with value: 0.3018537110689449.
[I 2025-12-09 15:53:39,597] Trial 67 finished with value: 0.2489905187211212 and parameters: {'model_type': 'graphsage', 'hidden_dims': '[256, 128]', 'dropout': 0.5751343673623267, 'batch_norm': True, 'sage_aggr': 'max', 'sage_normalize': False, 'sage_project': False, 'lr': 0.004236263963999216, 'weight_decay': 0.0008979957989758877, 'epochs': 94, 'loss': 'mae', 'optimizer': 'adam', 'graph_mode': 'knn', 'knn_k': 5, 'weighted_edges': True, 'symmetrize_mode': 'union', 'self_loops': True, 'use_snp_selection': False}. Best is trial 66 with value: 0.3018537110689449.
[I 2025-12-09 15:54:14,984] Trial 68 finished with value: 0.0 and parameters: {'model_type': 'graphsage', 'hidden_dims': '[512, 64]', 'dropout': 0.5255516809763668, 'batch_norm': False, 'sage_aggr': 'max', 'sage_normalize': False, 'sage_project': False, 'lr': 0.0029146186993472194, 'weight_decay': 0.00034303269625065105, 'epochs': 51, 'loss': 'mse', 'optimizer': 'adam', 'graph_mode': 'cutoff', 'cutoff': 0.6220977828294676, 'grm_norm': 'none', 'self_loops': False, 'use_snp_selection': True, 'num_snps': 15208}. Best is trial 66 with value: 0.3018537110689449.
[I 2025-12-09 15:54:52,522] Trial 69 finished with value: 0.2972645088685816 and parameters: {'model_type': 'graphsage', 'hidden_dims': '[512, 128]', 'dropout': 0.5658320202611736, 'batch_norm': True, 'sage_aggr': 'max', 'sage_normalize': False, 'sage_project': False, 'lr': 0.007369166642177744, 'weight_decay': 0.0004999392755263995, 'epochs': 61, 'loss': 'mse', 'optimizer': 'adam', 'graph_mode': 'cutoff', 'cutoff': 0.6803934615346542, 'grm_norm': 'none', 'self_loops': True, 'use_snp_selection': False}. Best is trial 66 with value: 0.3018537110689449.
[I 2025-12-09 15:55:27,754] Trial 70 finished with value: 0.2912051237717986 and parameters: {'model_type': 'graphsage', 'hidden_dims': '[256, 128]', 'dropout': 0.504181547942539, 'batch_norm': True, 'sage_aggr': 'mean', 'sage_normalize': False, 'sage_project': False, 'lr': 0.0009818633408594875, 'weight_decay': 0.0009895047682016835, 'epochs': 109, 'loss': 'mse', 'optimizer': 'adam', 'graph_mode': 'cutoff', 'cutoff': 0.752489331663967, 'grm_norm': 'none', 'self_loops': True, 'use_snp_selection': False}. Best is trial 66 with value: 0.3018537110689449.
[I 2025-12-09 15:55:53,972] Trial 71 finished with value: 0.296939198492143 and parameters: {'model_type': 'graphsage', 'hidden_dims': '[256, 128]', 'dropout': 0.28848986320753744, 'batch_norm': True, 'sage_aggr': 'max', 'sage_normalize': False, 'sage_project': False, 'lr': 0.0012718472273628844, 'weight_decay': 0.0007138595727365653, 'epochs': 70, 'loss': 'mse', 'optimizer': 'adam', 'graph_mode': 'cutoff', 'cutoff': 0.7194034641969869, 'grm_norm': 'none', 'self_loops': True, 'use_snp_selection': False}. Best is trial 66 with value: 0.3018537110689449.
[I 2025-12-09 15:56:13,294] Trial 72 finished with value: 0.30009927458253405 and parameters: {'model_type': 'graphsage', 'hidden_dims': '[256, 128]', 'dropout': 0.5307471245051605, 'batch_norm': True, 'sage_aggr': 'max', 'sage_normalize': False, 'sage_project': False, 'lr': 0.0007716570720836079, 'weight_decay': 0.0005997784481449473, 'epochs': 40, 'loss': 'mse', 'optimizer': 'adam', 'graph_mode': 'cutoff', 'cutoff': 0.7910690405351812, 'grm_norm': 'none', 'self_loops': True, 'use_snp_selection': False}. Best is trial 66 with value: 0.3018537110689449.
[I 2025-12-09 15:56:34,006] Trial 73 finished with value: 0.29742812517218775 and parameters: {'model_type': 'graphsage', 'hidden_dims': '[256, 128]', 'dropout': 0.5334428488825874, 'batch_norm': True, 'sage_aggr': 'max', 'sage_normalize': False, 'sage_project': False, 'lr': 0.0008240650172050856, 'weight_decay': 0.00027663192736420626, 'epochs': 46, 'loss': 'mse', 'optimizer': 'adam', 'graph_mode': 'cutoff', 'cutoff': 0.7800326162703143, 'grm_norm': 'none', 'self_loops': True, 'use_snp_selection': False}. Best is trial 66 with value: 0.3018537110689449.
[I 2025-12-09 15:57:33,564] Trial 74 finished with value: 0.2936903953218385 and parameters: {'model_type': 'graphsage', 'hidden_dims': '[256, 128]', 'dropout': 0.5542567726729897, 'batch_norm': True, 'sage_aggr': 'max', 'sage_normalize': False, 'sage_project': False, 'lr': 0.0022255431518882485, 'weight_decay': 0.0005488405891445443, 'epochs': 216, 'loss': 'mse', 'optimizer': 'adam', 'graph_mode': 'cutoff', 'cutoff': 0.6810132094312092, 'grm_norm': 'none', 'self_loops': True, 'use_snp_selection': False}. Best is trial 66 with value: 0.3018537110689449.
[I 2025-12-09 15:58:05,798] Trial 75 finished with value: 0.30033241468699046 and parameters: {'model_type': 'graphsage', 'hidden_dims': '[512, 256]', 'dropout': 0.59163269406296, 'batch_norm': True, 'sage_aggr': 'max', 'sage_normalize': False, 'sage_project': False, 'lr': 0.0006913019527402155, 'weight_decay': 0.00015267877057869222, 'epochs': 48, 'loss': 'mse', 'optimizer': 'adam', 'graph_mode': 'cutoff', 'cutoff': 0.8010547817481549, 'grm_norm': 'none', 'self_loops': True, 'use_snp_selection': False}. Best is trial 66 with value: 0.3018537110689449.
[I 2025-12-09 15:58:37,594] Trial 76 finished with value: 0.29866082738669936 and parameters: {'model_type': 'graphsage', 'hidden_dims': '[512, 256]', 'dropout': 0.5960677995031529, 'batch_norm': True, 'sage_aggr': 'max', 'sage_normalize': False, 'sage_project': False, 'lr': 0.0006600585501825483, 'weight_decay': 0.0001437346847623931, 'epochs': 47, 'loss': 'mse', 'optimizer': 'adam', 'graph_mode': 'cutoff', 'cutoff': 0.7373645171533508, 'grm_norm': 'none', 'self_loops': True, 'use_snp_selection': False}. Best is trial 66 with value: 0.3018537110689449.
[I 2025-12-09 15:59:06,696] Trial 77 finished with value: 0.30631818426543256 and parameters: {'model_type': 'graphsage', 'hidden_dims': '[512, 256]', 'dropout': 0.5796873686635414, 'batch_norm': True, 'sage_aggr': 'max', 'sage_normalize': False, 'sage_project': False, 'lr': 0.0004162404818341663, 'weight_decay': 9.783178638614909e-05, 'epochs': 40, 'loss': 'mse', 'optimizer': 'adam', 'graph_mode': 'cutoff', 'cutoff': 0.6258070540783304, 'grm_norm': 'none', 'self_loops': True, 'use_snp_selection': False}. Best is trial 77 with value: 0.30631818426543256.
[I 2025-12-09 16:01:21,732] Trial 78 finished with value: 0.2649418062125556 and parameters: {'model_type': 'graphsage', 'hidden_dims': '[512, 256]', 'dropout': 0.5804646124102203, 'batch_norm': True, 'sage_aggr': 'max', 'sage_normalize': True, 'sage_project': False, 'lr': 0.00040502041662851643, 'weight_decay': 8.23199766182923e-05, 'epochs': 259, 'loss': 'mae', 'optimizer': 'adam', 'graph_mode': 'knn', 'knn_k': 1, 'weighted_edges': True, 'symmetrize_mode': 'union', 'self_loops': True, 'use_snp_selection': False}. Best is trial 77 with value: 0.30631818426543256.
[I 2025-12-09 16:01:58,789] Trial 79 finished with value: 0.29834985445783324 and parameters: {'model_type': 'graphsage', 'hidden_dims': '[512, 256]', 'dropout': 0.5679155476873423, 'batch_norm': True, 'sage_aggr': 'max', 'sage_normalize': False, 'sage_project': False, 'lr': 0.0005111193774437334, 'weight_decay': 0.00010011352643217145, 'epochs': 59, 'loss': 'mse', 'optimizer': 'adam', 'graph_mode': 'cutoff', 'cutoff': 0.643339735582691, 'grm_norm': 'none', 'self_loops': True, 'use_snp_selection': False}. Best is trial 77 with value: 0.30631818426543256.
[I 2025-12-09 16:02:36,135] Trial 80 finished with value: 0.2817292793484528 and parameters: {'model_type': 'graphsage', 'hidden_dims': '[512, 256]', 'dropout': 0.5917955050338947, 'batch_norm': False, 'sage_aggr': 'max', 'sage_normalize': False, 'sage_project': False, 'lr': 0.0001468422711107134, 'weight_decay': 6.80124257859441e-05, 'epochs': 58, 'loss': 'mse', 'optimizer': 'adam', 'graph_mode': 'cutoff', 'cutoff': 0.610626874684642, 'grm_norm': 'cosine_then_gcn', 'self_loops': False, 'use_snp_selection': True, 'num_snps': 15494}. Best is trial 77 with value: 0.30631818426543256.
[I 2025-12-09 16:03:04,916] Trial 81 finished with value: 0.2943281967088307 and parameters: {'model_type': 'graphsage', 'hidden_dims': '[512, 256]', 'dropout': 0.5367376139900693, 'batch_norm': True, 'sage_aggr': 'max', 'sage_normalize': False, 'sage_project': False, 'lr': 0.0002422673715036514, 'weight_decay': 0.00022316037873639145, 'epochs': 40, 'loss': 'mse', 'optimizer': 'adam', 'graph_mode': 'cutoff', 'cutoff': 0.8035321371312067, 'grm_norm': 'none', 'self_loops': True, 'use_snp_selection': False}. Best is trial 77 with value: 0.30631818426543256.
