[I 2025-12-08 19:43:54,629] Trial 72 finished with value: 0.29101330728330527 and parameters: {'model_type': 'graphsage', 'hidden_dims': '[512, 256]', 'dropout': 0.32991913094849, 'batch_norm': False, 'sage_aggr': 'mean', 'sage_normalize': False, 'sage_project': False, 'lr': 1.9344168667002206e-05, 'weight_decay': 1.8240262764145325e-07, 'epochs': 106, 'loss': 'mse', 'optimizer': 'adam', 'graph_mode': 'cutoff', 'cutoff': 0.44708113751111744, 'grm_norm': 'cosine_then_gcn', 'self_loops': True, 'use_snp_selection': True, 'num_snps': 33273}. Best is trial 48 with value: 0.30295324895326753.
[I 2025-12-08 19:44:19,503] Trial 73 finished with value: 0.2698663911331501 and parameters: {'model_type': 'graphsage', 'hidden_dims': '[512, 256]', 'dropout': 0.39882030250736406, 'batch_norm': False, 'sage_aggr': 'mean', 'sage_normalize': False, 'sage_project': False, 'lr': 6.860763999501861e-05, 'weight_decay': 1.0032995276265435e-07, 'epochs': 145, 'loss': 'mse', 'optimizer': 'adam', 'graph_mode': 'cutoff', 'cutoff': 0.5932164573121077, 'grm_norm': 'cosine_then_gcn', 'self_loops': True, 'use_snp_selection': True, 'num_snps': 2367}. Best is trial 48 with value: 0.30295324895326753.
[I 2025-12-08 19:46:36,288] Trial 74 finished with value: 0.2914507504512645 and parameters: {'model_type': 'graphsage', 'hidden_dims': '[512, 256]', 'dropout': 0.3479237827761531, 'batch_norm': False, 'sage_aggr': 'mean', 'sage_normalize': False, 'sage_project': False, 'lr': 1.1885548484515813e-05, 'weight_decay': 3.5270577795621864e-07, 'epochs': 193, 'loss': 'mse', 'optimizer': 'adam', 'graph_mode': 'knn', 'knn_k': 10, 'weighted_edges': True, 'symmetrize_mode': 'union', 'self_loops': True, 'use_snp_selection': True, 'num_snps': 20180}. Best is trial 48 with value: 0.30295324895326753.
[I 2025-12-08 19:47:27,541] Trial 75 finished with value: 0.296714000257136 and parameters: {'model_type': 'graphsage', 'hidden_dims': '[512, 256]', 'dropout': 0.4753353688229953, 'batch_norm': False, 'sage_aggr': 'mean', 'sage_normalize': False, 'sage_project': False, 'lr': 3.208518168579808e-05, 'weight_decay': 9.054267457254104e-07, 'epochs': 73, 'loss': 'mse', 'optimizer': 'adam', 'graph_mode': 'cutoff', 'cutoff': 0.674243892811361, 'grm_norm': 'cosine_then_gcn', 'self_loops': True, 'use_snp_selection': True, 'num_snps': 30543}. Best is trial 48 with value: 0.30295324895326753.
[I 2025-12-08 19:47:58,452] Trial 76 finished with value: 0.057862881500378494 and parameters: {'model_type': 'graphsage', 'hidden_dims': '[512, 256]', 'dropout': 0.5056601891763048, 'batch_norm': False, 'sage_aggr': 'max', 'sage_normalize': False, 'sage_project': False, 'lr': 0.00116371806410002, 'weight_decay': 2.4054558947736845e-07, 'epochs': 44, 'loss': 'mse', 'optimizer': 'adam', 'graph_mode': 'cutoff', 'cutoff': 0.7383457719929087, 'grm_norm': 'none', 'self_loops': True, 'use_snp_selection': False}. Best is trial 48 with value: 0.30295324895326753.
[I 2025-12-08 19:48:35,939] Trial 77 finished with value: 0.29187883038419965 and parameters: {'model_type': 'graphsage', 'hidden_dims': '[256, 128, 64]', 'dropout': 0.40217949105775247, 'batch_norm': False, 'sage_aggr': 'mean', 'sage_normalize': False, 'sage_project': False, 'lr': 3.9215978247916113e-05, 'weight_decay': 2.328093840521586e-06, 'epochs': 59, 'loss': 'mse', 'optimizer': 'adam', 'graph_mode': 'cutoff', 'cutoff': 0.6903317287181604, 'grm_norm': 'cosine', 'self_loops': True, 'use_snp_selection': True, 'num_snps': 27295}. Best is trial 48 with value: 0.30295324895326753.
[I 2025-12-08 19:49:34,912] Trial 78 finished with value: 0.3047149189941173 and parameters: {'model_type': 'graphsage', 'hidden_dims': '[128, 64]', 'dropout': 0.5219425328079355, 'batch_norm': False, 'sage_aggr': 'mean', 'sage_normalize': False, 'sage_project': False, 'lr': 2.0908801425841574e-05, 'weight_decay': 5.708262807157086e-07, 'epochs': 133, 'loss': 'mse', 'optimizer': 'adam', 'graph_mode': 'cutoff', 'cutoff': 0.5392806179261131, 'grm_norm': 'cosine_then_gcn', 'self_loops': True, 'use_snp_selection': True, 'num_snps': 42573}. Best is trial 78 with value: 0.3047149189941173.
[I 2025-12-08 19:50:39,028] Trial 79 finished with value: 0.2778091352144697 and parameters: {'model_type': 'graphsage', 'hidden_dims': '[128, 64]', 'dropout': 0.5195302809404483, 'batch_norm': False, 'sage_aggr': 'mean', 'sage_normalize': False, 'sage_project': False, 'lr': 5.149983849960781e-05, 'weight_decay': 5.922208498992775e-07, 'epochs': 129, 'loss': 'mse', 'optimizer': 'adam', 'graph_mode': 'cutoff', 'cutoff': 0.5407700065139998, 'grm_norm': 'none', 'self_loops': False, 'use_snp_selection': True, 'num_snps': 44880}. Best is trial 78 with value: 0.3047149189941173.
[I 2025-12-08 19:53:17,486] Trial 80 finished with value: 0.28950886269484155 and parameters: {'model_type': 'graphsage', 'hidden_dims': '[128, 64]', 'dropout': 0.5972011729949749, 'batch_norm': False, 'sage_aggr': 'mean', 'sage_normalize': False, 'sage_project': False, 'lr': 2.1095417916464453e-05, 'weight_decay': 0.0007507821494591072, 'epochs': 212, 'loss': 'mse', 'optimizer': 'adam', 'graph_mode': 'knn', 'knn_k': 5, 'weighted_edges': True, 'symmetrize_mode': 'union', 'self_loops': True, 'use_snp_selection': True, 'num_snps': 38046}. Best is trial 78 with value: 0.3047149189941173.
[I 2025-12-08 19:54:10,507] Trial 81 finished with value: 0.2939470059782318 and parameters: {'model_type': 'graphsage', 'hidden_dims': '[128, 64]', 'dropout': 0.5331034154313566, 'batch_norm': False, 'sage_aggr': 'mean', 'sage_normalize': False, 'sage_project': False, 'lr': 1.659839625657876e-05, 'weight_decay': 2.8129722537164286e-07, 'epochs': 144, 'loss': 'mse', 'optimizer': 'adam', 'graph_mode': 'cutoff', 'cutoff': 0.6504227841157227, 'grm_norm': 'cosine_then_gcn', 'self_loops': True, 'use_snp_selection': True, 'num_snps': 40993}. Best is trial 78 with value: 0.3047149189941173.
[I 2025-12-08 19:55:19,878] Trial 82 finished with value: 0.29656367659892535 and parameters: {'model_type': 'graphsage', 'hidden_dims': '[128, 64]', 'dropout': 0.4854050325684305, 'batch_norm': False, 'sage_aggr': 'mean', 'sage_normalize': False, 'sage_project': False, 'lr': 2.5761952908198786e-05, 'weight_decay': 4.6174517297107295e-07, 'epochs': 120, 'loss': 'mse', 'optimizer': 'adam', 'graph_mode': 'cutoff', 'cutoff': 0.5065967074318823, 'grm_norm': 'cosine_then_gcn', 'self_loops': True, 'use_snp_selection': True, 'num_snps': 46505}. Best is trial 78 with value: 0.3047149189941173.
[I 2025-12-08 19:56:12,840] Trial 83 finished with value: 0.29721009638664697 and parameters: {'model_type': 'graphsage', 'hidden_dims': '[128, 64]', 'dropout': 0.46351638780216114, 'batch_norm': False, 'sage_aggr': 'mean', 'sage_normalize': False, 'sage_project': False, 'lr': 1.365859137034885e-05, 'weight_decay': 1.3880326735601718e-07, 'epochs': 199, 'loss': 'mse', 'optimizer': 'adam', 'graph_mode': 'cutoff', 'cutoff': 0.5970808931372306, 'grm_norm': 'cosine_then_gcn', 'self_loops': True, 'use_snp_selection': True, 'num_snps': 33804}. Best is trial 78 with value: 0.3047149189941173.
[I 2025-12-08 19:57:09,765] Trial 84 finished with value: 0.3005516569991255 and parameters: {'model_type': 'graphsage', 'hidden_dims': '[128, 64]', 'dropout': 0.459879133882899, 'batch_norm': False, 'sage_aggr': 'mean', 'sage_normalize': False, 'sage_project': False, 'lr': 1.12783022651084e-05, 'weight_decay': 1.897719500185742e-07, 'epochs': 198, 'loss': 'mse', 'optimizer': 'adam', 'graph_mode': 'cutoff', 'cutoff': 0.5500799669696181, 'grm_norm': 'cosine_then_gcn', 'self_loops': True, 'use_snp_selection': True, 'num_snps': 35193}. Best is trial 78 with value: 0.3047149189941173.
[I 2025-12-08 19:58:05,360] Trial 85 finished with value: 0.30546169084105435 and parameters: {'model_type': 'graphsage', 'hidden_dims': '[128, 64]', 'dropout': 0.4643338420127792, 'batch_norm': False, 'sage_aggr': 'mean', 'sage_normalize': False, 'sage_project': False, 'lr': 1.1044309825503408e-05, 'weight_decay': 1.335506065216437e-06, 'epochs': 184, 'loss': 'mse', 'optimizer': 'adam', 'graph_mode': 'cutoff', 'cutoff': 0.5517194519555502, 'grm_norm': 'cosine_then_gcn', 'self_loops': True, 'use_snp_selection': True, 'num_snps': 35373}. Best is trial 85 with value: 0.30546169084105435.
[I 2025-12-08 19:59:05,549] Trial 86 finished with value: 0.28606189025626716 and parameters: {'model_type': 'graphsage', 'hidden_dims': '[128, 64]', 'dropout': 0.431533723615824, 'batch_norm': False, 'sage_aggr': 'mean', 'sage_normalize': True, 'sage_project': False, 'lr': 1.17752033431167e-05, 'weight_decay': 1.6075265985482728e-06, 'epochs': 155, 'loss': 'mse', 'optimizer': 'adam', 'graph_mode': 'cutoff', 'cutoff': 0.5541147012487473, 'grm_norm': 'cosine_then_gcn', 'self_loops': True, 'use_snp_selection': True, 'num_snps': 42210}. Best is trial 85 with value: 0.30546169084105435.
[I 2025-12-08 20:00:01,350] Trial 87 finished with value: 0.28959792545145213 and parameters: {'model_type': 'graphsage', 'hidden_dims': '[128, 64]', 'dropout': 0.49862023554538715, 'batch_norm': False, 'sage_aggr': 'mean', 'sage_normalize': False, 'sage_project': False, 'lr': 1.611223212337138e-05, 'weight_decay': 1.175359421276862e-06, 'epochs': 183, 'loss': 'mse', 'optimizer': 'adam', 'graph_mode': 'cutoff', 'cutoff': 0.4769677896461281, 'grm_norm': 'cosine_then_gcn', 'self_loops': True, 'use_snp_selection': False}. Best is trial 85 with value: 0.30546169084105435.
[I 2025-12-08 20:01:34,105] Trial 88 finished with value: 0.2960595832832024 and parameters: {'model_type': 'graphsage', 'hidden_dims': '[128, 64]', 'dropout': 0.46941661284001585, 'batch_norm': False, 'sage_aggr': 'mean', 'sage_normalize': False, 'sage_project': False, 'lr': 2.0958548038913233e-05, 'weight_decay': 3.787758992313276e-07, 'epochs': 165, 'loss': 'mse', 'optimizer': 'adam', 'graph_mode': 'cutoff', 'cutoff': 0.3596686724495018, 'grm_norm': 'cosine_then_gcn', 'self_loops': True, 'use_snp_selection': True, 'num_snps': 36574}. Best is trial 85 with value: 0.30546169084105435.
[I 2025-12-08 20:03:33,812] Trial 89 finished with value: 0.29403010901902527 and parameters: {'model_type': 'graphsage', 'hidden_dims': '[512, 64]', 'dropout': 0.44650774578656593, 'batch_norm': False, 'sage_aggr': 'mean', 'sage_normalize': False, 'sage_project': False, 'lr': 1.1501832954356492e-05, 'weight_decay': 5.985891439400221e-07, 'epochs': 257, 'loss': 'mse', 'optimizer': 'adam', 'graph_mode': 'cutoff', 'cutoff': 0.5182392798083286, 'grm_norm': 'cosine', 'self_loops': True, 'use_snp_selection': True, 'num_snps': 34275}. Best is trial 85 with value: 0.30546169084105435.
[I 2025-12-08 20:04:56,058] Trial 90 finished with value: 0.2951591923907543 and parameters: {'model_type': 'graphsage', 'hidden_dims': '[128, 64]', 'dropout': 0.49060498827013205, 'batch_norm': False, 'sage_aggr': 'mean', 'sage_normalize': False, 'sage_project': False, 'lr': 1.0248683607439941e-05, 'weight_decay': 8.813666521502141e-07, 'epochs': 137, 'loss': 'mse', 'optimizer': 'adam', 'graph_mode': 'cutoff', 'cutoff': 0.43310585453629347, 'grm_norm': 'none', 'self_loops': True, 'use_snp_selection': True, 'num_snps': 38240}. Best is trial 85 with value: 0.30546169084105435.
[I 2025-12-08 20:05:48,787] Trial 91 finished with value: 0.30046975091631 and parameters: {'model_type': 'graphsage', 'hidden_dims': '[128, 64]', 'dropout': 0.4625713691443236, 'batch_norm': False, 'sage_aggr': 'mean', 'sage_normalize': False, 'sage_project': False, 'lr': 1.5267248311440337e-05, 'weight_decay': 4.4530083340746626e-07, 'epochs': 199, 'loss': 'mse', 'optimizer': 'adam', 'graph_mode': 'cutoff', 'cutoff': 0.5879200671697273, 'grm_norm': 'cosine_then_gcn', 'self_loops': True, 'use_snp_selection': True, 'num_snps': 32884}. Best is trial 85 with value: 0.30546169084105435.
[I 2025-12-08 20:06:46,595] Trial 92 finished with value: 0.3007002550378809 and parameters: {'model_type': 'graphsage', 'hidden_dims': '[128, 64]', 'dropout': 0.4772624335913094, 'batch_norm': False, 'sage_aggr': 'mean', 'sage_normalize': False, 'sage_project': False, 'lr': 1.4371942928425013e-05, 'weight_decay': 1.3126002352703672e-06, 'epochs': 215, 'loss': 'mse', 'optimizer': 'adam', 'graph_mode': 'cutoff', 'cutoff': 0.5418984218333374, 'grm_norm': 'cosine_then_gcn', 'self_loops': True, 'use_snp_selection': True, 'num_snps': 32039}. Best is trial 85 with value: 0.30546169084105435.
[I 2025-12-08 20:07:45,691] Trial 93 finished with value: 0.29831597024426887 and parameters: {'model_type': 'graphsage', 'hidden_dims': '[128, 64]', 'dropout': 0.46032040314958766, 'batch_norm': False, 'sage_aggr': 'mean', 'sage_normalize': False, 'sage_project': False, 'lr': 2.4300874115504837e-05, 'weight_decay': 4.972144002976958e-07, 'epochs': 223, 'loss': 'mse', 'optimizer': 'adam', 'graph_mode': 'cutoff', 'cutoff': 0.5372802171274453, 'grm_norm': 'cosine_then_gcn', 'self_loops': True, 'use_snp_selection': True, 'num_snps': 32157}. Best is trial 85 with value: 0.30546169084105435.
[I 2025-12-08 20:08:44,159] Trial 94 finished with value: 0.29773576921183936 and parameters: {'model_type': 'graphsage', 'hidden_dims': '[128, 64]', 'dropout': 0.4455798628129549, 'batch_norm': False, 'sage_aggr': 'mean', 'sage_normalize': False, 'sage_project': False, 'lr': 1.5526219784530118e-05, 'weight_decay': 2.3464192390691955e-06, 'epochs': 231, 'loss': 'mse', 'optimizer': 'adam', 'graph_mode': 'cutoff', 'cutoff': 0.5458255923185769, 'grm_norm': 'cosine_then_gcn', 'self_loops': True, 'use_snp_selection': True, 'num_snps': 32582}. Best is trial 85 with value: 0.30546169084105435.
[I 2025-12-08 20:09:35,768] Trial 95 finished with value: 0.30398219725218434 and parameters: {'model_type': 'graphsage', 'hidden_dims': '[128, 64]', 'dropout': 0.5143848490575947, 'batch_norm': False, 'sage_aggr': 'mean', 'sage_normalize': False, 'sage_project': False, 'lr': 1.446467438136014e-05, 'weight_decay': 4.779620930436834e-07, 'epochs': 217, 'loss': 'mse', 'optimizer': 'adam', 'graph_mode': 'cutoff', 'cutoff': 0.572049370219319, 'grm_norm': 'cosine_then_gcn', 'self_loops': True, 'use_snp_selection': True, 'num_snps': 28898}. Best is trial 85 with value: 0.30546169084105435.
[I 2025-12-08 20:10:24,316] Trial 96 finished with value: 0.29612424247105246 and parameters: {'model_type': 'graphsage', 'hidden_dims': '[128, 64]', 'dropout': 0.5182748806911427, 'batch_norm': False, 'sage_aggr': 'mean', 'sage_normalize': False, 'sage_project': False, 'lr': 1.4209946171833847e-05, 'weight_decay': 6.489170237130125e-07, 'epochs': 206, 'loss': 'mse', 'optimizer': 'adam', 'graph_mode': 'cutoff', 'cutoff': 0.5769939625631824, 'grm_norm': 'cosine_then_gcn', 'self_loops': False, 'use_snp_selection': True, 'num_snps': 28118}. Best is trial 85 with value: 0.30546169084105435.
[I 2025-12-08 20:11:23,811] Trial 97 finished with value: 0.29895893138993135 and parameters: {'model_type': 'graphsage', 'hidden_dims': '[128, 64]', 'dropout': 0.546707713666525, 'batch_norm': False, 'sage_aggr': 'mean', 'sage_normalize': False, 'sage_project': False, 'lr': 1.0083597446519649e-05, 'weight_decay': 1.2503099245739221e-06, 'epochs': 238, 'loss': 'mse', 'optimizer': 'adam', 'graph_mode': 'cutoff', 'cutoff': 0.6108367594837086, 'grm_norm': 'cosine_then_gcn', 'self_loops': True, 'use_snp_selection': True, 'num_snps': 35504}. Best is trial 85 with value: 0.30546169084105435.
[I 2025-12-08 20:12:30,105] Trial 98 finished with value: 0.2993129325256566 and parameters: {'model_type': 'graphsage', 'hidden_dims': '[128, 64]', 'dropout': 0.5495074454741123, 'batch_norm': False, 'sage_aggr': 'mean', 'sage_normalize': False, 'sage_project': False, 'lr': 1.0142296480364185e-05, 'weight_decay': 1.3598376203971017e-06, 'epochs': 279, 'loss': 'mse', 'optimizer': 'adam', 'graph_mode': 'cutoff', 'cutoff': 0.5643222082963836, 'grm_norm': 'cosine_then_gcn', 'self_loops': True, 'use_snp_selection': True, 'num_snps': 35222}. Best is trial 85 with value: 0.30546169084105435.
[I 2025-12-08 20:13:31,877] Trial 99 finished with value: 0.2993727326651817 and parameters: {'model_type': 'graphsage', 'hidden_dims': '[128, 64]', 'dropout': 0.5728493416792082, 'batch_norm': False, 'sage_aggr': 'mean', 'sage_normalize': False, 'sage_project': False, 'lr': 1.2999609977920478e-05, 'weight_decay': 3.4125634721010114e-06, 'epochs': 304, 'loss': 'mse', 'optimizer': 'adam', 'graph_mode': 'cutoff', 'cutoff': 0.5652724124787158, 'grm_norm': 'cosine_then_gcn', 'self_loops': True, 'use_snp_selection': True, 'num_snps': 29260}. Best is trial 85 with value: 0.30546169084105435.
[I 2025-12-08 20:17:45,704] Trial 100 finished with value: 0.28378768185917025 and parameters: {'model_type': 'graphsage', 'hidden_dims': '[128, 64]', 'dropout': 0.5755984556909957, 'batch_norm': False, 'sage_aggr': 'mean', 'sage_normalize': True, 'sage_project': False, 'lr': 1.7657660836110663e-05, 'weight_decay': 3.29729081121848e-06, 'epochs': 292, 'loss': 'mse', 'optimizer': 'adam', 'graph_mode': 'knn', 'knn_k': 10, 'weighted_edges': True, 'symmetrize_mode': 'union', 'self_loops': True, 'use_snp_selection': True, 'num_snps': 28546}. Best is trial 85 with value: 0.30546169084105435.
[I 2025-12-08 20:18:30,284] Trial 101 finished with value: 0.2906626925997328 and parameters: {'model_type': 'graphsage', 'hidden_dims': '[128, 64]', 'dropout': 0.5621275273267734, 'batch_norm': False, 'sage_aggr': 'mean', 'sage_normalize': False, 'sage_project': False, 'lr': 1.3230530523765547e-05, 'weight_decay': 6.462015197580617e-06, 'epochs': 214, 'loss': 'mse', 'optimizer': 'adam', 'graph_mode': 'cutoff', 'cutoff': 0.5754513983999395, 'grm_norm': 'cosine_then_gcn', 'self_loops': True, 'use_snp_selection': True, 'num_snps': 23912}. Best is trial 85 with value: 0.30546169084105435.
[I 2025-12-08 20:19:34,508] Trial 102 finished with value: 0.303740027500136 and parameters: {'model_type': 'graphsage', 'hidden_dims': '[128, 64]', 'dropout': 0.5889432201652812, 'batch_norm': False, 'sage_aggr': 'mean', 'sage_normalize': False, 'sage_project': False, 'lr': 1.1448330399767422e-05, 'weight_decay': 2.072743346135462e-06, 'epochs': 318, 'loss': 'mse', 'optimizer': 'adam', 'graph_mode': 'cutoff', 'cutoff': 0.5583036779460578, 'grm_norm': 'cosine_then_gcn', 'self_loops': True, 'use_snp_selection': True, 'num_snps': 29948}. Best is trial 85 with value: 0.30546169084105435.
[I 2025-12-08 20:20:40,237] Trial 103 finished with value: 0.29968246124511083 and parameters: {'model_type': 'graphsage', 'hidden_dims': '[128, 64]', 'dropout': 0.5893787297753263, 'batch_norm': False, 'sage_aggr': 'mean', 'sage_normalize': False, 'sage_project': False, 'lr': 1.1587186368492864e-05, 'weight_decay': 1.8191361695923258e-06, 'epochs': 312, 'loss': 'mse', 'optimizer': 'adam', 'graph_mode': 'cutoff', 'cutoff': 0.5548876435891669, 'grm_norm': 'cosine_then_gcn', 'self_loops': True, 'use_snp_selection': True, 'num_snps': 30082}. Best is trial 85 with value: 0.30546169084105435.
[I 2025-12-08 20:21:49,114] Trial 104 finished with value: 0.29206835961441036 and parameters: {'model_type': 'graphsage', 'hidden_dims': '[128, 64]', 'dropout': 0.5889246564865444, 'batch_norm': False, 'sage_aggr': 'mean', 'sage_normalize': False, 'sage_project': False, 'lr': 1.5194016520769384e-05, 'weight_decay': 1.883246953085475e-06, 'epochs': 320, 'loss': 'mse', 'optimizer': 'adam', 'graph_mode': 'cutoff', 'cutoff': 0.5271127920674672, 'grm_norm': 'cosine_then_gcn', 'self_loops': True, 'use_snp_selection': True, 'num_snps': 29498}. Best is trial 85 with value: 0.30546169084105435.
[I 2025-12-08 20:22:46,195] Trial 105 finished with value: 0.2944580317229441 and parameters: {'model_type': 'graphsage', 'hidden_dims': '[128, 64]', 'dropout': 0.5867793655154163, 'batch_norm': False, 'sage_aggr': 'mean', 'sage_normalize': False, 'sage_project': False, 'lr': 1.2028425246376373e-05, 'weight_decay': 3.5190952630958483e-06, 'epochs': 301, 'loss': 'mse', 'optimizer': 'adam', 'graph_mode': 'cutoff', 'cutoff': 0.5542863972722544, 'grm_norm': 'cosine_then_gcn', 'self_loops': True, 'use_snp_selection': True, 'num_snps': 26762}. Best is trial 85 with value: 0.30546169084105435.
[I 2025-12-08 20:23:52,038] Trial 106 finished with value: 0.2571084340259136 and parameters: {'model_type': 'graphsage', 'hidden_dims': '[128, 64]', 'dropout': 0.5644451097179116, 'batch_norm': True, 'sage_aggr': 'mean', 'sage_normalize': False, 'sage_project': False, 'lr': 1.9291656556078505e-05, 'weight_decay': 5.314530931451584e-06, 'epochs': 350, 'loss': 'mae', 'optimizer': 'adam', 'graph_mode': 'cutoff', 'cutoff': 0.6050690496398483, 'grm_norm': 'cosine_then_gcn', 'self_loops': True, 'use_snp_selection': True, 'num_snps': 30366}. Best is trial 85 with value: 0.30546169084105435.
[I 2025-12-08 20:25:00,160] Trial 107 finished with value: 0.29266816579427224 and parameters: {'model_type': 'graphsage', 'hidden_dims': '[128, 64]', 'dropout': 0.567517279329766, 'batch_norm': False, 'sage_aggr': 'mean', 'sage_normalize': False, 'sage_project': False, 'lr': 1.350753279703708e-05, 'weight_decay': 2.2792971299398656e-06, 'epochs': 338, 'loss': 'mse', 'optimizer': 'adam', 'graph_mode': 'cutoff', 'cutoff': 0.5873156095127071, 'grm_norm': 'cosine_then_gcn', 'self_loops': True, 'use_snp_selection': False}. Best is trial 85 with value: 0.30546169084105435.
[I 2025-12-08 20:25:57,139] Trial 108 finished with value: 0.29418554464616375 and parameters: {'model_type': 'graphsage', 'hidden_dims': '[128, 64]', 'dropout': 0.5797442321743517, 'batch_norm': False, 'sage_aggr': 'mean', 'sage_normalize': False, 'sage_project': False, 'lr': 1.1257008244064674e-05, 'weight_decay': 1.870841394000398e-06, 'epochs': 316, 'loss': 'mse', 'optimizer': 'adam', 'graph_mode': 'cutoff', 'cutoff': 0.519778103981696, 'grm_norm': 'cosine_then_gcn', 'self_loops': True, 'use_snp_selection': True, 'num_snps': 24396}. Best is trial 85 with value: 0.30546169084105435.
