[I 2025-12-08 15:06:05,625] Trial 5 finished with value: 0.27353542904698935 and parameters: {'model_type': 'graphsage', 'hidden_dims': '[512, 64]', 'dropout': 0.14505336736221927, 'batch_norm': True, 'sage_aggr': 'mean', 'sage_normalize': True, 'sage_project': False, 'lr': 1.2962030165732234e-05, 'weight_decay': 1.326598071105465e-07, 'epochs': 180, 'loss': 'mse', 'optimizer': 'adam', 'graph_mode': 'knn', 'knn_k': 9, 'weighted_edges': True, 'symmetrize_mode': 'mutual', 'self_loops': False, 'use_snp_selection': False}. Best is trial 3 with value: 0.28067659626174124.
[I 2025-12-08 15:06:58,528] Trial 6 finished with value: 0.29385005209827275 and parameters: {'model_type': 'graphsage', 'hidden_dims': '[256, 128, 64]', 'dropout': 0.10731743755162496, 'batch_norm': True, 'sage_aggr': 'mean', 'sage_normalize': False, 'sage_project': False, 'lr': 1.922990426933137e-05, 'weight_decay': 7.30001060446905e-05, 'epochs': 63, 'loss': 'mae', 'optimizer': 'adam', 'graph_mode': 'cutoff', 'cutoff': 0.7624978434202536, 'grm_norm': 'none', 'self_loops': True, 'use_snp_selection': True, 'num_snps': 50106}. Best is trial 6 with value: 0.29385005209827275.
[I 2025-12-08 15:08:50,836] Trial 7 finished with value: 0.2898267886725895 and parameters: {'model_type': 'graphsage', 'hidden_dims': '[512, 64]', 'dropout': 0.2585007811528941, 'batch_norm': True, 'sage_aggr': 'max', 'sage_normalize': True, 'sage_project': False, 'lr': 5.921425508303391e-05, 'weight_decay': 0.0004511561961144237, 'epochs': 182, 'loss': 'mae', 'optimizer': 'adam', 'graph_mode': 'knn', 'knn_k': 9, 'weighted_edges': True, 'symmetrize_mode': 'union', 'self_loops': False, 'use_snp_selection': True, 'num_snps': 23903}. Best is trial 6 with value: 0.29385005209827275.
[I 2025-12-08 15:09:32,404] Trial 8 finished with value: 0.25209454986016205 and parameters: {'model_type': 'graphsage', 'hidden_dims': '[512, 256]', 'dropout': 0.3061380386767003, 'batch_norm': False, 'sage_aggr': 'mean', 'sage_normalize': True, 'sage_project': False, 'lr': 0.000698401460570184, 'weight_decay': 2.965560055460244e-06, 'epochs': 289, 'loss': 'mae', 'optimizer': 'adam', 'graph_mode': 'knn', 'knn_k': 7, 'weighted_edges': False, 'symmetrize_mode': 'mutual', 'self_loops': True, 'use_snp_selection': True, 'num_snps': 4710}. Best is trial 6 with value: 0.29385005209827275.
[I 2025-12-08 15:13:11,471] Trial 9 finished with value: 0.28321337173295424 and parameters: {'model_type': 'graphsage', 'hidden_dims': '[512, 128]', 'dropout': 0.1733844071393634, 'batch_norm': False, 'sage_aggr': 'mean', 'sage_normalize': True, 'sage_project': False, 'lr': 0.0004269677918501597, 'weight_decay': 2.2439779626249696e-06, 'epochs': 319, 'loss': 'mse', 'optimizer': 'adam', 'graph_mode': 'cutoff', 'cutoff': 0.24117565767129295, 'grm_norm': 'cosine_then_gcn', 'self_loops': True, 'use_snp_selection': False}. Best is trial 6 with value: 0.29385005209827275.
[I 2025-12-08 15:14:06,403] Trial 10 finished with value: 0.29572268213791963 and parameters: {'model_type': 'graphsage', 'hidden_dims': '[256, 128, 64]', 'dropout': 0.5365714961141473, 'batch_norm': True, 'sage_aggr': 'mean', 'sage_normalize': False, 'sage_project': False, 'lr': 0.0060050040216813455, 'weight_decay': 4.9377500793081834e-05, 'epochs': 46, 'loss': 'mae', 'optimizer': 'adam', 'graph_mode': 'cutoff', 'cutoff': 0.8579871888501912, 'grm_norm': 'none', 'self_loops': True, 'use_snp_selection': True, 'num_snps': 59927}. Best is trial 10 with value: 0.29572268213791963.
[I 2025-12-08 15:15:00,133] Trial 11 finished with value: 0.28961236501837984 and parameters: {'model_type': 'graphsage', 'hidden_dims': '[256, 128, 64]', 'dropout': 0.5437810742461437, 'batch_norm': True, 'sage_aggr': 'mean', 'sage_normalize': False, 'sage_project': False, 'lr': 0.008000655871733665, 'weight_decay': 4.2521929457206324e-05, 'epochs': 47, 'loss': 'mae', 'optimizer': 'adam', 'graph_mode': 'cutoff', 'cutoff': 0.897550071387144, 'grm_norm': 'none', 'self_loops': True, 'use_snp_selection': True, 'num_snps': 57688}. Best is trial 10 with value: 0.29572268213791963.
[I 2025-12-08 15:15:47,349] Trial 12 finished with value: 0.29839904117281985 and parameters: {'model_type': 'graphsage', 'hidden_dims': '[256, 128, 64]', 'dropout': 0.4921208650038426, 'batch_norm': True, 'sage_aggr': 'mean', 'sage_normalize': False, 'sage_project': False, 'lr': 0.008796549023736102, 'weight_decay': 3.9327931719627325e-05, 'epochs': 41, 'loss': 'mae', 'optimizer': 'adam', 'graph_mode': 'cutoff', 'cutoff': 0.875858815737441, 'grm_norm': 'none', 'self_loops': True, 'use_snp_selection': True, 'num_snps': 47351}. Best is trial 12 with value: 0.29839904117281985.
[I 2025-12-08 15:16:55,103] Trial 13 finished with value: 0.29171916385574487 and parameters: {'model_type': 'graphsage', 'hidden_dims': '[256, 128]', 'dropout': 0.5237804302263875, 'batch_norm': True, 'sage_aggr': 'mean', 'sage_normalize': False, 'sage_project': False, 'lr': 0.008283626979251458, 'weight_decay': 2.207819306969384e-05, 'epochs': 96, 'loss': 'mae', 'optimizer': 'adam', 'graph_mode': 'cutoff', 'cutoff': 0.8958185940217869, 'grm_norm': 'cosine', 'self_loops': True, 'use_snp_selection': True, 'num_snps': 59441}. Best is trial 12 with value: 0.29839904117281985.
[I 2025-12-08 15:17:47,871] Trial 14 finished with value: 0.2796732430874641 and parameters: {'model_type': 'graphsage', 'hidden_dims': '[256, 128, 64]', 'dropout': 0.44099154398585816, 'batch_norm': True, 'sage_aggr': 'mean', 'sage_normalize': False, 'sage_project': False, 'lr': 0.0022584522186862204, 'weight_decay': 0.0009038765422009597, 'epochs': 101, 'loss': 'mae', 'optimizer': 'adam', 'graph_mode': 'cutoff', 'cutoff': 0.6777772434939535, 'grm_norm': 'none', 'self_loops': True, 'use_snp_selection': True, 'num_snps': 40832}. Best is trial 12 with value: 0.29839904117281985.
[I 2025-12-08 15:18:45,012] Trial 15 finished with value: 0.2984702963711428 and parameters: {'model_type': 'graphsage', 'hidden_dims': '[256, 128, 64]', 'dropout': 0.4521449922991649, 'batch_norm': True, 'sage_aggr': 'mean', 'sage_normalize': False, 'sage_project': False, 'lr': 0.0025728547238951945, 'weight_decay': 1.089998542568318e-05, 'epochs': 99, 'loss': 'mae', 'optimizer': 'adam', 'graph_mode': 'cutoff', 'cutoff': 0.7694950832084768, 'grm_norm': 'none', 'self_loops': True, 'use_snp_selection': True, 'num_snps': 46894}. Best is trial 15 with value: 0.2984702963711428.
[I 2025-12-08 15:19:39,682] Trial 16 finished with value: 0.2972225827221375 and parameters: {'model_type': 'graphsage', 'hidden_dims': '[256, 128]', 'dropout': 0.4334411227544116, 'batch_norm': True, 'sage_aggr': 'mean', 'sage_normalize': False, 'sage_project': False, 'lr': 0.0020040615235403995, 'weight_decay': 7.491891531625316e-06, 'epochs': 98, 'loss': 'mae', 'optimizer': 'adam', 'graph_mode': 'cutoff', 'cutoff': 0.7424650066019534, 'grm_norm': 'cosine', 'self_loops': True, 'use_snp_selection': True, 'num_snps': 42562}. Best is trial 15 with value: 0.2984702963711428.
[I 2025-12-08 15:20:30,214] Trial 17 finished with value: 0.2819223833132293 and parameters: {'model_type': 'graphsage', 'hidden_dims': '[256, 128, 64]', 'dropout': 0.4293742980557455, 'batch_norm': True, 'sage_aggr': 'mean', 'sage_normalize': False, 'sage_project': False, 'lr': 0.0027426150880501417, 'weight_decay': 3.5305730150149095e-07, 'epochs': 226, 'loss': 'mae', 'optimizer': 'adam', 'graph_mode': 'cutoff', 'cutoff': 0.47136873750689057, 'grm_norm': 'gcn', 'self_loops': True, 'use_snp_selection': True, 'num_snps': 18242}. Best is trial 15 with value: 0.2984702963711428.
[I 2025-12-08 15:20:58,728] Trial 18 finished with value: 0.0056651284517449454 and parameters: {'model_type': 'graphsage', 'hidden_dims': '[256, 128, 64]', 'dropout': 0.4814779547689651, 'batch_norm': False, 'sage_aggr': 'mean', 'sage_normalize': False, 'sage_project': False, 'lr': 0.0009311119232309363, 'weight_decay': 1.444323069850804e-05, 'epochs': 81, 'loss': 'mae', 'optimizer': 'adam', 'graph_mode': 'cutoff', 'cutoff': 0.7557936915826282, 'grm_norm': 'cosine_then_gcn', 'self_loops': False, 'use_snp_selection': False}. Best is trial 15 with value: 0.2984702963711428.
[I 2025-12-08 15:21:59,212] Trial 19 finished with value: 0.29142609877302206 and parameters: {'model_type': 'graphsage', 'hidden_dims': '[256, 128, 64]', 'dropout': 0.572180664826032, 'batch_norm': True, 'sage_aggr': 'mean', 'sage_normalize': False, 'sage_project': False, 'lr': 0.00360025248813731, 'weight_decay': 0.00013227904481259267, 'epochs': 118, 'loss': 'mae', 'optimizer': 'adam', 'graph_mode': 'cutoff', 'cutoff': 0.6046092089295697, 'grm_norm': 'none', 'self_loops': True, 'use_snp_selection': True, 'num_snps': 45306}. Best is trial 15 with value: 0.2984702963711428.
[I 2025-12-08 15:23:21,258] Trial 20 finished with value: 0.29429035163186484 and parameters: {'model_type': 'graphsage', 'hidden_dims': '[512, 256]', 'dropout': 0.3886879767980967, 'batch_norm': True, 'sage_aggr': 'mean', 'sage_normalize': False, 'sage_project': False, 'lr': 0.0012582090480562653, 'weight_decay': 2.830438169255119e-06, 'epochs': 125, 'loss': 'mae', 'optimizer': 'adam', 'graph_mode': 'cutoff', 'cutoff': 0.32625163922070954, 'grm_norm': 'none', 'self_loops': True, 'use_snp_selection': True, 'num_snps': 36101}. Best is trial 15 with value: 0.2984702963711428.
[I 2025-12-08 15:24:13,039] Trial 21 finished with value: 0.30014416995292537 and parameters: {'model_type': 'graphsage', 'hidden_dims': '[256, 128]', 'dropout': 0.46537480012369725, 'batch_norm': True, 'sage_aggr': 'mean', 'sage_normalize': False, 'sage_project': False, 'lr': 0.001685343009415535, 'weight_decay': 7.781441963079528e-06, 'epochs': 75, 'loss': 'mae', 'optimizer': 'adam', 'graph_mode': 'cutoff', 'cutoff': 0.7709240738162724, 'grm_norm': 'cosine', 'self_loops': True, 'use_snp_selection': True, 'num_snps': 43209}. Best is trial 21 with value: 0.30014416995292537.
[I 2025-12-08 15:25:06,730] Trial 22 finished with value: 0.29578770339155225 and parameters: {'model_type': 'graphsage', 'hidden_dims': '[256, 128]', 'dropout': 0.4873307903715965, 'batch_norm': True, 'sage_aggr': 'mean', 'sage_normalize': False, 'sage_project': False, 'lr': 0.004393292994426163, 'weight_decay': 7.853095749923502e-06, 'epochs': 72, 'loss': 'mae', 'optimizer': 'adam', 'graph_mode': 'cutoff', 'cutoff': 0.8137999339397464, 'grm_norm': 'cosine', 'self_loops': True, 'use_snp_selection': True, 'num_snps': 46984}. Best is trial 21 with value: 0.30014416995292537.
[I 2025-12-08 15:25:58,003] Trial 23 finished with value: 0.293826120598501 and parameters: {'model_type': 'graphsage', 'hidden_dims': '[256, 128]', 'dropout': 0.3942186477590663, 'batch_norm': True, 'sage_aggr': 'mean', 'sage_normalize': False, 'sage_project': False, 'lr': 0.0014561516010055588, 'weight_decay': 1.7810899900396538e-05, 'epochs': 43, 'loss': 'mae', 'optimizer': 'adam', 'graph_mode': 'cutoff', 'cutoff': 0.6639981608761355, 'grm_norm': 'cosine', 'self_loops': True, 'use_snp_selection': True, 'num_snps': 52737}. Best is trial 21 with value: 0.30014416995292537.
[I 2025-12-08 15:26:54,726] Trial 24 finished with value: 0.29217170939161685 and parameters: {'model_type': 'graphsage', 'hidden_dims': '[256, 128]', 'dropout': 0.4910835010705162, 'batch_norm': True, 'sage_aggr': 'mean', 'sage_normalize': False, 'sage_project': False, 'lr': 0.00016189603080345296, 'weight_decay': 1.3348137996106327e-06, 'epochs': 124, 'loss': 'mae', 'optimizer': 'adam', 'graph_mode': 'cutoff', 'cutoff': 0.8055954268099843, 'grm_norm': 'cosine', 'self_loops': True, 'use_snp_selection': True, 'num_snps': 40604}. Best is trial 21 with value: 0.30014416995292537.
[I 2025-12-08 15:27:48,088] Trial 25 finished with value: 0.2956142294631709 and parameters: {'model_type': 'graphsage', 'hidden_dims': '[512, 64]', 'dropout': 0.5928111222721166, 'batch_norm': True, 'sage_aggr': 'mean', 'sage_normalize': False, 'sage_project': False, 'lr': 0.004604202302719846, 'weight_decay': 4.797601541642166e-06, 'epochs': 73, 'loss': 'mae', 'optimizer': 'adam', 'graph_mode': 'cutoff', 'cutoff': 0.7105437115575134, 'grm_norm': 'none', 'self_loops': True, 'use_snp_selection': True, 'num_snps': 35632}. Best is trial 21 with value: 0.30014416995292537.
[I 2025-12-08 15:28:05,994] Trial 26 finished with value: 0.2923458942717974 and parameters: {'model_type': 'graphsage', 'hidden_dims': '[128, 64]', 'dropout': 0.392458937646733, 'batch_norm': True, 'sage_aggr': 'mean', 'sage_normalize': True, 'sage_project': False, 'lr': 0.009686602999706032, 'weight_decay': 2.3196666905253626e-05, 'epochs': 65, 'loss': 'mse', 'optimizer': 'adam', 'graph_mode': 'cutoff', 'cutoff': 0.8187667049740426, 'grm_norm': 'gcn', 'self_loops': True, 'use_snp_selection': False}. Best is trial 21 with value: 0.30014416995292537.
[I 2025-12-08 15:30:07,822] Trial 27 finished with value: 0.11887202294091477 and parameters: {'model_type': 'graphsage', 'hidden_dims': '[512, 128]', 'dropout': 0.4662048381112657, 'batch_norm': False, 'sage_aggr': 'mean', 'sage_normalize': False, 'sage_project': False, 'lr': 0.0007545641789862118, 'weight_decay': 0.00011150937210472796, 'epochs': 225, 'loss': 'mae', 'optimizer': 'adam', 'graph_mode': 'cutoff', 'cutoff': 0.6374409729992119, 'grm_norm': 'cosine_then_gcn', 'self_loops': False, 'use_snp_selection': True, 'num_snps': 52932}. Best is trial 21 with value: 0.30014416995292537.
[I 2025-12-08 15:30:54,504] Trial 28 finished with value: 0.29173851602726436 and parameters: {'model_type': 'graphsage', 'hidden_dims': '[256, 128]', 'dropout': 0.5218991670523058, 'batch_norm': True, 'sage_aggr': 'mean', 'sage_normalize': False, 'sage_project': False, 'lr': 0.0032427083331018694, 'weight_decay': 8.03301540441375e-07, 'epochs': 90, 'loss': 'mae', 'optimizer': 'adam', 'graph_mode': 'cutoff', 'cutoff': 0.5104313008850836, 'grm_norm': 'cosine', 'self_loops': True, 'use_snp_selection': True, 'num_snps': 29947}. Best is trial 21 with value: 0.30014416995292537.
[I 2025-12-08 15:31:40,406] Trial 29 finished with value: 0.2609311163726071 and parameters: {'model_type': 'graphsage', 'hidden_dims': '[128, 64]', 'dropout': 0.45788657487584333, 'batch_norm': True, 'sage_aggr': 'max', 'sage_normalize': True, 'sage_project': False, 'lr': 0.0002904481891852104, 'weight_decay': 1.0002403796543779e-05, 'epochs': 114, 'loss': 'mse', 'optimizer': 'adam', 'graph_mode': 'knn', 'knn_k': 4, 'weighted_edges': True, 'symmetrize_mode': 'union', 'self_loops': True, 'use_snp_selection': False}. Best is trial 21 with value: 0.30014416995292537.
[I 2025-12-08 15:32:31,681] Trial 30 finished with value: 0.2875299040657776 and parameters: {'model_type': 'graphsage', 'hidden_dims': '[256, 128, 64]', 'dropout': 0.4085549638101932, 'batch_norm': True, 'sage_aggr': 'mean', 'sage_normalize': False, 'sage_project': False, 'lr': 0.0016305549811796232, 'weight_decay': 7.029799250975507e-05, 'epochs': 40, 'loss': 'mae', 'optimizer': 'adam', 'graph_mode': 'cutoff', 'cutoff': 0.39902970605386545, 'grm_norm': 'none', 'self_loops': True, 'use_snp_selection': True, 'num_snps': 45170}. Best is trial 21 with value: 0.30014416995292537.
[I 2025-12-08 15:33:25,760] Trial 31 finished with value: 0.2970108208337737 and parameters: {'model_type': 'graphsage', 'hidden_dims': '[256, 128]', 'dropout': 0.42993633448623225, 'batch_norm': True, 'sage_aggr': 'mean', 'sage_normalize': False, 'sage_project': False, 'lr': 0.002154736474262871, 'weight_decay': 5.355428265148839e-06, 'epochs': 98, 'loss': 'mae', 'optimizer': 'adam', 'graph_mode': 'cutoff', 'cutoff': 0.7385967419168936, 'grm_norm': 'cosine', 'self_loops': True, 'use_snp_selection': True, 'num_snps': 41394}. Best is trial 21 with value: 0.30014416995292537.
[I 2025-12-08 15:34:26,038] Trial 32 finished with value: 0.29773931976885076 and parameters: {'model_type': 'graphsage', 'hidden_dims': '[256, 128]', 'dropout': 0.5083792969481615, 'batch_norm': True, 'sage_aggr': 'mean', 'sage_normalize': False, 'sage_project': False, 'lr': 0.005869705157525284, 'weight_decay': 1.1943649062685106e-05, 'epochs': 137, 'loss': 'mae', 'optimizer': 'adam', 'graph_mode': 'cutoff', 'cutoff': 0.7933157916596165, 'grm_norm': 'cosine', 'self_loops': True, 'use_snp_selection': True, 'num_snps': 42020}. Best is trial 21 with value: 0.30014416995292537.
[I 2025-12-08 15:35:23,956] Trial 33 finished with value: 0.2949202753732257 and parameters: {'model_type': 'graphsage', 'hidden_dims': '[256, 128]', 'dropout': 0.5038819602248393, 'batch_norm': True, 'sage_aggr': 'mean', 'sage_normalize': False, 'sage_project': False, 'lr': 0.0063853672237421475, 'weight_decay': 1.2702104283556108e-05, 'epochs': 144, 'loss': 'mae', 'optimizer': 'adam', 'graph_mode': 'cutoff', 'cutoff': 0.8327880822886841, 'grm_norm': 'cosine', 'self_loops': True, 'use_snp_selection': True, 'num_snps': 38038}. Best is trial 21 with value: 0.30014416995292537.
[I 2025-12-08 15:36:34,937] Trial 34 finished with value: -0.050294836426690324 and parameters: {'model_type': 'graphsage', 'hidden_dims': '[256, 128]', 'dropout': 0.5680431080914236, 'batch_norm': False, 'sage_aggr': 'max', 'sage_normalize': False, 'sage_project': False, 'lr': 0.005062359936903491, 'weight_decay': 2.575169648586752e-05, 'epochs': 140, 'loss': 'mse', 'optimizer': 'adam', 'graph_mode': 'cutoff', 'cutoff': 0.8577506074568892, 'grm_norm': 'cosine', 'self_loops': True, 'use_snp_selection': True, 'num_snps': 54065}. Best is trial 21 with value: 0.30014416995292537.
[I 2025-12-08 15:38:00,922] Trial 35 finished with value: 0.2915403112424147 and parameters: {'model_type': 'graphsage', 'hidden_dims': '[512, 128]', 'dropout': 0.3668768586223585, 'batch_norm': True, 'sage_aggr': 'max', 'sage_normalize': False, 'sage_project': False, 'lr': 0.0032381376886348183, 'weight_decay': 0.00025883375696826024, 'epochs': 66, 'loss': 'mae', 'optimizer': 'adam', 'graph_mode': 'knn', 'knn_k': 4, 'weighted_edges': False, 'symmetrize_mode': 'union', 'self_loops': True, 'use_snp_selection': True, 'num_snps': 48232}. Best is trial 21 with value: 0.30014416995292537.
[I 2025-12-08 15:38:55,759] Trial 36 finished with value: 0.2976952921051393 and parameters: {'model_type': 'graphsage', 'hidden_dims': '[256, 128, 64]', 'dropout': 0.5612264290894738, 'batch_norm': True, 'sage_aggr': 'mean', 'sage_normalize': False, 'sage_project': False, 'lr': 0.009371060287301848, 'weight_decay': 4.3127184763983764e-06, 'epochs': 159, 'loss': 'mae', 'optimizer': 'adam', 'graph_mode': 'cutoff', 'cutoff': 0.7870080781151572, 'grm_norm': 'cosine', 'self_loops': False, 'use_snp_selection': True, 'num_snps': 31651}. Best is trial 21 with value: 0.30014416995292537.
[I 2025-12-08 15:40:18,896] Trial 37 finished with value: 0.29628797288589287 and parameters: {'model_type': 'graphsage', 'hidden_dims': '[512, 256]', 'dropout': 0.5075076860253162, 'batch_norm': True, 'sage_aggr': 'mean', 'sage_normalize': False, 'sage_project': False, 'lr': 0.001115409628646352, 'weight_decay': 4.148261119418586e-05, 'epochs': 181, 'loss': 'mse', 'optimizer': 'adam', 'graph_mode': 'cutoff', 'cutoff': 0.7034533118673771, 'grm_norm': 'none', 'self_loops': True, 'use_snp_selection': False}. Best is trial 21 with value: 0.30014416995292537.
[I 2025-12-08 15:44:11,273] Trial 38 finished with value: 0.19081646915620837 and parameters: {'model_type': 'graphsage', 'hidden_dims': '[512, 64]', 'dropout': 0.32259992450180686, 'batch_norm': False, 'sage_aggr': 'max', 'sage_normalize': True, 'sage_project': False, 'lr': 0.004832977743597458, 'weight_decay': 2.953501491036215e-05, 'epochs': 159, 'loss': 'mae', 'optimizer': 'adam', 'graph_mode': 'knn', 'knn_k': 10, 'weighted_edges': True, 'symmetrize_mode': 'union', 'self_loops': False, 'use_snp_selection': True, 'num_snps': 49970}. Best is trial 21 with value: 0.30014416995292537.
[I 2025-12-08 15:45:10,456] Trial 39 finished with value: 0.28417540127005203 and parameters: {'model_type': 'graphsage', 'hidden_dims': '[128, 64]', 'dropout': 0.5999514189348136, 'batch_norm': True, 'sage_aggr': 'mean', 'sage_normalize': False, 'sage_project': False, 'lr': 2.847774091998119e-05, 'weight_decay': 7.54983838602527e-05, 'epochs': 202, 'loss': 'mae', 'optimizer': 'adam', 'graph_mode': 'cutoff', 'cutoff': 0.8643245786497875, 'grm_norm': 'gcn', 'self_loops': True, 'use_snp_selection': True, 'num_snps': 44312}. Best is trial 21 with value: 0.30014416995292537.
[I 2025-12-08 15:46:05,328] Trial 40 finished with value: 0.28489946226021284 and parameters: {'model_type': 'graphsage', 'hidden_dims': '[256, 128, 64]', 'dropout': 0.46500479754397384, 'batch_norm': True, 'sage_aggr': 'mean', 'sage_normalize': False, 'sage_project': False, 'lr': 0.0005347607039107834, 'weight_decay': 1.5699954837475324e-06, 'epochs': 134, 'loss': 'mae', 'optimizer': 'adam', 'graph_mode': 'knn', 'knn_k': 3, 'weighted_edges': False, 'symmetrize_mode': 'union', 'self_loops': True, 'use_snp_selection': False}. Best is trial 21 with value: 0.30014416995292537.
[I 2025-12-08 15:47:04,265] Trial 41 finished with value: 0.29201717595481946 and parameters: {'model_type': 'graphsage', 'hidden_dims': '[256, 128, 64]', 'dropout': 0.5509790348430347, 'batch_norm': True, 'sage_aggr': 'mean', 'sage_normalize': False, 'sage_project': False, 'lr': 0.007360573682599641, 'weight_decay': 4.391995980299675e-06, 'epochs': 194, 'loss': 'mae', 'optimizer': 'adam', 'graph_mode': 'cutoff', 'cutoff': 0.7935818431645727, 'grm_norm': 'cosine', 'self_loops': False, 'use_snp_selection': True, 'num_snps': 31825}. Best is trial 21 with value: 0.30014416995292537.
