[I 2025-12-09 23:01:43,276] Trial 10 finished with value: 0.29310922324362426 and parameters: {'model_type': 'graphsage', 'hidden_dims': '[512, 128]', 'dropout': 0.5365714961141473, 'batch_norm': False, 'sage_aggr': 'mean', 'sage_normalize': True, 'sage_project': False, 'lr': 0.004737327072203749, 'weight_decay': 7.303103160282385e-07, 'epochs': 299, 'loss': 'mse', 'optimizer': 'adam', 'graph_mode': 'cutoff', 'cutoff': 0.21281628365523453, 'grm_norm': 'cosine_then_gcn', 'self_loops': True, 'use_snp_selection': False}. Best is trial 9 with value: 0.2950397642164374.
[I 2025-12-09 23:07:50,982] Trial 11 finished with value: 0.284972480795144 and parameters: {'model_type': 'graphsage', 'hidden_dims': '[512, 128]', 'dropout': 0.5154800957818386, 'batch_norm': False, 'sage_aggr': 'mean', 'sage_normalize': True, 'sage_project': False, 'lr': 0.006674532614550016, 'weight_decay': 6.544345930867686e-07, 'epochs': 335, 'loss': 'mse', 'optimizer': 'adam', 'graph_mode': 'cutoff', 'cutoff': 0.21348952516572178, 'grm_norm': 'cosine_then_gcn', 'self_loops': True, 'use_snp_selection': False}. Best is trial 9 with value: 0.2950397642164374.
[I 2025-12-09 23:14:10,274] Trial 12 finished with value: 0.3020753083087553 and parameters: {'model_type': 'graphsage', 'hidden_dims': '[512, 128]', 'dropout': 0.49488375368548476, 'batch_norm': False, 'sage_aggr': 'mean', 'sage_normalize': True, 'sage_project': False, 'lr': 0.003802842966026102, 'weight_decay': 9.156985192829673e-07, 'epochs': 344, 'loss': 'mse', 'optimizer': 'adam', 'graph_mode': 'cutoff', 'cutoff': 0.21242241803866538, 'grm_norm': 'cosine_then_gcn', 'self_loops': True, 'use_snp_selection': False}. Best is trial 12 with value: 0.3020753083087553.
[I 2025-12-09 23:16:26,172] Trial 13 finished with value: 0.3036275457667702 and parameters: {'model_type': 'graphsage', 'hidden_dims': '[256, 128]', 'dropout': 0.4333322659330895, 'batch_norm': False, 'sage_aggr': 'mean', 'sage_normalize': True, 'sage_project': False, 'lr': 0.0016227502622377062, 'weight_decay': 3.7056484460517325e-06, 'epochs': 339, 'loss': 'mse', 'optimizer': 'adam', 'graph_mode': 'cutoff', 'cutoff': 0.38034063628338033, 'grm_norm': 'cosine_then_gcn', 'self_loops': True, 'use_snp_selection': False}. Best is trial 13 with value: 0.3036275457667702.
[I 2025-12-09 23:18:04,265] Trial 14 finished with value: 0.29932764379175125 and parameters: {'model_type': 'graphsage', 'hidden_dims': '[256, 128]', 'dropout': 0.4434163309768403, 'batch_norm': False, 'sage_aggr': 'mean', 'sage_normalize': True, 'sage_project': False, 'lr': 0.0017523346364436024, 'weight_decay': 1.0275636300399289e-07, 'epochs': 248, 'loss': 'mse', 'optimizer': 'adam', 'graph_mode': 'cutoff', 'cutoff': 0.41206637181711203, 'grm_norm': 'cosine', 'self_loops': True, 'use_snp_selection': False}. Best is trial 13 with value: 0.3036275457667702.
[I 2025-12-09 23:20:23,381] Trial 15 finished with value: 0.2955294181987299 and parameters: {'model_type': 'graphsage', 'hidden_dims': '[256, 128]', 'dropout': 0.4333470818492372, 'batch_norm': False, 'sage_aggr': 'mean', 'sage_normalize': True, 'sage_project': False, 'lr': 0.001968301125166922, 'weight_decay': 2.4480221808497912e-05, 'epochs': 341, 'loss': 'mse', 'optimizer': 'adam', 'graph_mode': 'cutoff', 'cutoff': 0.3609099042183447, 'grm_norm': 'cosine_then_gcn', 'self_loops': True, 'use_snp_selection': False}. Best is trial 13 with value: 0.3036275457667702.
[I 2025-12-09 23:22:04,456] Trial 16 finished with value: 0.29976311199110894 and parameters: {'model_type': 'graphsage', 'hidden_dims': '[256, 128]', 'dropout': 0.43107252250139183, 'batch_norm': False, 'sage_aggr': 'mean', 'sage_normalize': True, 'sage_project': False, 'lr': 0.001882876743710732, 'weight_decay': 6.4391847107238955e-06, 'epochs': 247, 'loss': 'mse', 'optimizer': 'adam', 'graph_mode': 'cutoff', 'cutoff': 0.36680972073876117, 'grm_norm': 'cosine_then_gcn', 'self_loops': True, 'use_snp_selection': False}. Best is trial 13 with value: 0.3036275457667702.
[I 2025-12-09 23:22:30,460] Trial 17 finished with value: 0.25691189371273726 and parameters: {'model_type': 'graphsage', 'hidden_dims': '[256, 128]', 'dropout': 0.5966679844006109, 'batch_norm': False, 'sage_aggr': 'mean', 'sage_normalize': True, 'sage_project': False, 'lr': 0.009368739521118843, 'weight_decay': 3.019156654015594e-07, 'epochs': 82, 'loss': 'mse', 'optimizer': 'adam', 'graph_mode': 'cutoff', 'cutoff': 0.6349690136441453, 'grm_norm': 'gcn', 'self_loops': True, 'use_snp_selection': False}. Best is trial 13 with value: 0.3036275457667702.
[I 2025-12-09 23:26:30,003] Trial 18 finished with value: 0.2894921311266817 and parameters: {'model_type': 'graphsage', 'hidden_dims': '[512, 128]', 'dropout': 0.39041786493072445, 'batch_norm': False, 'sage_aggr': 'mean', 'sage_normalize': True, 'sage_project': False, 'lr': 0.003795300583821109, 'weight_decay': 2.0564422243412808e-06, 'epochs': 350, 'loss': 'mse', 'optimizer': 'adam', 'graph_mode': 'cutoff', 'cutoff': 0.32034494041629513, 'grm_norm': 'cosine', 'self_loops': False, 'use_snp_selection': False}. Best is trial 13 with value: 0.3036275457667702.
[I 2025-12-09 23:28:10,248] Trial 19 finished with value: 0.29536524615020904 and parameters: {'model_type': 'graphsage', 'hidden_dims': '[256, 128]', 'dropout': 0.5006446154935325, 'batch_norm': False, 'sage_aggr': 'mean', 'sage_normalize': True, 'sage_project': False, 'lr': 0.0010000507683422663, 'weight_decay': 1.5430343355310594e-05, 'epochs': 268, 'loss': 'mse', 'optimizer': 'adam', 'graph_mode': 'cutoff', 'cutoff': 0.48424822050186717, 'grm_norm': 'cosine_then_gcn', 'self_loops': True, 'use_snp_selection': False}. Best is trial 13 with value: 0.3036275457667702.
[I 2025-12-09 23:30:03,672] Trial 20 finished with value: 0.25914862387825977 and parameters: {'model_type': 'graphsage', 'hidden_dims': '[256, 128, 64]', 'dropout': 0.5917958271045238, 'batch_norm': False, 'sage_aggr': 'mean', 'sage_normalize': True, 'sage_project': False, 'lr': 0.0033275072057936325, 'weight_decay': 4.082515829845669e-06, 'epochs': 215, 'loss': 'mse', 'optimizer': 'adam', 'graph_mode': 'cutoff', 'cutoff': 0.31027561338462034, 'grm_norm': 'cosine_then_gcn', 'self_loops': True, 'use_snp_selection': False}. Best is trial 13 with value: 0.3036275457667702.
[I 2025-12-09 23:32:08,042] Trial 21 finished with value: 0.30345780329349936 and parameters: {'model_type': 'graphsage', 'hidden_dims': '[256, 128]', 'dropout': 0.4540184348968537, 'batch_norm': False, 'sage_aggr': 'mean', 'sage_normalize': True, 'sage_project': False, 'lr': 0.001422516859064925, 'weight_decay': 8.538191975409846e-06, 'epochs': 318, 'loss': 'mse', 'optimizer': 'adam', 'graph_mode': 'cutoff', 'cutoff': 0.41830162948427146, 'grm_norm': 'cosine_then_gcn', 'self_loops': True, 'use_snp_selection': False}. Best is trial 13 with value: 0.3036275457667702.
[I 2025-12-09 23:34:11,042] Trial 22 finished with value: 0.2659319141432385 and parameters: {'model_type': 'graphsage', 'hidden_dims': '[256, 128]', 'dropout': 0.4732012125685949, 'batch_norm': False, 'sage_aggr': 'mean', 'sage_normalize': True, 'sage_project': False, 'lr': 0.0001792474373804354, 'weight_decay': 1.4987098112306895e-06, 'epochs': 319, 'loss': 'mse', 'optimizer': 'adam', 'graph_mode': 'cutoff', 'cutoff': 0.4466308304028839, 'grm_norm': 'cosine_then_gcn', 'self_loops': True, 'use_snp_selection': False}. Best is trial 13 with value: 0.3036275457667702.
[I 2025-12-09 23:35:41,547] Trial 23 finished with value: 0.30489724577903476 and parameters: {'model_type': 'graphsage', 'hidden_dims': '[256, 128]', 'dropout': 0.3998640441242598, 'batch_norm': False, 'sage_aggr': 'mean', 'sage_normalize': True, 'sage_project': False, 'lr': 0.0009813654121661715, 'weight_decay': 1.2334451262200844e-05, 'epochs': 316, 'loss': 'mse', 'optimizer': 'adam', 'graph_mode': 'cutoff', 'cutoff': 0.8738175268256746, 'grm_norm': 'cosine_then_gcn', 'self_loops': True, 'use_snp_selection': False}. Best is trial 23 with value: 0.30489724577903476.
[I 2025-12-09 23:37:10,946] Trial 24 finished with value: 0.30525598837278367 and parameters: {'model_type': 'graphsage', 'hidden_dims': '[256, 128]', 'dropout': 0.39010989169709404, 'batch_norm': False, 'sage_aggr': 'mean', 'sage_normalize': True, 'sage_project': False, 'lr': 0.0009505349923006207, 'weight_decay': 4.9669549731451056e-05, 'epochs': 312, 'loss': 'mse', 'optimizer': 'adam', 'graph_mode': 'cutoff', 'cutoff': 0.8390716066193666, 'grm_norm': 'cosine_then_gcn', 'self_loops': True, 'use_snp_selection': False}. Best is trial 24 with value: 0.30525598837278367.
[I 2025-12-09 23:38:29,267] Trial 25 finished with value: 0.2859067786034328 and parameters: {'model_type': 'graphsage', 'hidden_dims': '[256, 128]', 'dropout': 0.3885518341039618, 'batch_norm': False, 'sage_aggr': 'mean', 'sage_normalize': True, 'sage_project': False, 'lr': 0.00016130879579664796, 'weight_decay': 7.320883603843861e-05, 'epochs': 272, 'loss': 'mse', 'optimizer': 'adam', 'graph_mode': 'cutoff', 'cutoff': 0.8990189208482937, 'grm_norm': 'cosine', 'self_loops': True, 'use_snp_selection': False}. Best is trial 24 with value: 0.30525598837278367.
[I 2025-12-09 23:39:59,380] Trial 26 finished with value: 0.0 and parameters: {'model_type': 'graphsage', 'hidden_dims': '[256, 128]', 'dropout': 0.39059867632458467, 'batch_norm': False, 'sage_aggr': 'mean', 'sage_normalize': False, 'sage_project': False, 'lr': 0.0007738822949843542, 'weight_decay': 6.136381705354906e-05, 'epochs': 316, 'loss': 'mae', 'optimizer': 'adam', 'graph_mode': 'cutoff', 'cutoff': 0.8487346187565034, 'grm_norm': 'none', 'self_loops': False, 'use_snp_selection': False}. Best is trial 24 with value: 0.30525598837278367.
[I 2025-12-09 23:41:25,652] Trial 27 finished with value: 0.30484489194610853 and parameters: {'model_type': 'graphsage', 'hidden_dims': '[256, 128]', 'dropout': 0.3751377832597941, 'batch_norm': False, 'sage_aggr': 'mean', 'sage_normalize': True, 'sage_project': False, 'lr': 0.0006162752624855374, 'weight_decay': 2.344781638360841e-05, 'epochs': 300, 'loss': 'mse', 'optimizer': 'adam', 'graph_mode': 'cutoff', 'cutoff': 0.7294064237281941, 'grm_norm': 'gcn', 'self_loops': True, 'use_snp_selection': False}. Best is trial 24 with value: 0.30525598837278367.
[I 2025-12-09 23:42:52,408] Trial 28 finished with value: 0.28736482354478504 and parameters: {'model_type': 'graphsage', 'hidden_dims': '[256, 128]', 'dropout': 0.37535015966744156, 'batch_norm': False, 'sage_aggr': 'mean', 'sage_normalize': True, 'sage_project': False, 'lr': 0.00020895104889108495, 'weight_decay': 1.913655225765577e-05, 'epochs': 302, 'loss': 'mse', 'optimizer': 'adam', 'graph_mode': 'cutoff', 'cutoff': 0.7425156917153712, 'grm_norm': 'gcn', 'self_loops': True, 'use_snp_selection': False}. Best is trial 24 with value: 0.30525598837278367.
[I 2025-12-09 23:44:11,978] Trial 29 finished with value: 0.24825424052611736 and parameters: {'model_type': 'graphsage', 'hidden_dims': '[128, 64]', 'dropout': 0.31716319255311964, 'batch_norm': True, 'sage_aggr': 'max', 'sage_normalize': True, 'sage_project': False, 'lr': 0.0002982967456922558, 'weight_decay': 0.00014286304764552516, 'epochs': 223, 'loss': 'mse', 'optimizer': 'adam', 'graph_mode': 'knn', 'knn_k': 3, 'weighted_edges': False, 'symmetrize_mode': 'union', 'self_loops': True, 'use_snp_selection': False}. Best is trial 24 with value: 0.30525598837278367.
[I 2025-12-09 23:46:28,252] Trial 30 finished with value: 0.29806944026865306 and parameters: {'model_type': 'graphsage', 'hidden_dims': '[512, 64]', 'dropout': 0.2133446930172241, 'batch_norm': False, 'sage_aggr': 'mean', 'sage_normalize': True, 'sage_project': False, 'lr': 0.0006350169266226114, 'weight_decay': 3.9844176386330455e-05, 'epochs': 257, 'loss': 'mse', 'optimizer': 'adam', 'graph_mode': 'cutoff', 'cutoff': 0.7793177407169124, 'grm_norm': 'gcn', 'self_loops': True, 'use_snp_selection': False}. Best is trial 24 with value: 0.30525598837278367.
[I 2025-12-09 23:47:55,390] Trial 31 finished with value: 0.30814656067376867 and parameters: {'model_type': 'graphsage', 'hidden_dims': '[256, 128]', 'dropout': 0.41015720583769516, 'batch_norm': False, 'sage_aggr': 'mean', 'sage_normalize': True, 'sage_project': False, 'lr': 0.001088749991547278, 'weight_decay': 1.2748530616144731e-05, 'epochs': 302, 'loss': 'mse', 'optimizer': 'adam', 'graph_mode': 'cutoff', 'cutoff': 0.6979481333546935, 'grm_norm': 'gcn', 'self_loops': True, 'use_snp_selection': False}. Best is trial 31 with value: 0.30814656067376867.
[I 2025-12-09 23:49:20,317] Trial 32 finished with value: 0.3010944565752559 and parameters: {'model_type': 'graphsage', 'hidden_dims': '[256, 128]', 'dropout': 0.36691690880815475, 'batch_norm': False, 'sage_aggr': 'mean', 'sage_normalize': True, 'sage_project': False, 'lr': 0.0010491599695281047, 'weight_decay': 0.0001530594574076946, 'epochs': 294, 'loss': 'mse', 'optimizer': 'adam', 'graph_mode': 'cutoff', 'cutoff': 0.690544111381469, 'grm_norm': 'gcn', 'self_loops': True, 'use_snp_selection': False}. Best is trial 31 with value: 0.30814656067376867.
[I 2025-12-09 23:50:24,931] Trial 33 finished with value: 0.2917806780921587 and parameters: {'model_type': 'graphsage', 'hidden_dims': '[512, 256]', 'dropout': 0.4127681248408296, 'batch_norm': False, 'sage_aggr': 'mean', 'sage_normalize': True, 'sage_project': False, 'lr': 0.0005477446503595701, 'weight_decay': 1.4185465569444622e-05, 'epochs': 117, 'loss': 'mse', 'optimizer': 'adam', 'graph_mode': 'cutoff', 'cutoff': 0.8308908395002441, 'grm_norm': 'gcn', 'self_loops': True, 'use_snp_selection': False}. Best is trial 31 with value: 0.30814656067376867.
[I 2025-12-09 23:50:37,035] Trial 34 finished with value: 0.2548365085076009 and parameters: {'model_type': 'graphsage', 'hidden_dims': '[256, 128]', 'dropout': 0.2978292398241704, 'batch_norm': False, 'sage_aggr': 'max', 'sage_normalize': False, 'sage_project': False, 'lr': 0.002582504955554232, 'weight_decay': 3.6315698611965885e-05, 'epochs': 276, 'loss': 'mse', 'optimizer': 'adam', 'graph_mode': 'cutoff', 'cutoff': 0.6941468297079518, 'grm_norm': 'gcn', 'self_loops': True, 'use_snp_selection': True, 'num_snps': 2241}. Best is trial 31 with value: 0.30814656067376867.
[I 2025-12-09 23:52:27,092] Trial 35 finished with value: -0.006301312635601117 and parameters: {'model_type': 'graphsage', 'hidden_dims': '[128, 64]', 'dropout': 0.33617031982890083, 'batch_norm': False, 'sage_aggr': 'max', 'sage_normalize': False, 'sage_project': False, 'lr': 0.0011590551289299706, 'weight_decay': 0.0009415015467824612, 'epochs': 232, 'loss': 'mse', 'optimizer': 'adam', 'graph_mode': 'knn', 'knn_k': 4, 'weighted_edges': True, 'symmetrize_mode': 'union', 'self_loops': True, 'use_snp_selection': False}. Best is trial 31 with value: 0.30814656067376867.
[I 2025-12-09 23:54:24,936] Trial 36 finished with value: 0.27605118764285186 and parameters: {'model_type': 'graphsage', 'hidden_dims': '[256, 128]', 'dropout': 0.3542092043671679, 'batch_norm': True, 'sage_aggr': 'mean', 'sage_normalize': True, 'sage_project': False, 'lr': 0.00033025287614624806, 'weight_decay': 1.0859824391941416e-05, 'epochs': 306, 'loss': 'mae', 'optimizer': 'adam', 'graph_mode': 'cutoff', 'cutoff': 0.8932405283352259, 'grm_norm': 'gcn', 'self_loops': False, 'use_snp_selection': True, 'num_snps': 59922}. Best is trial 31 with value: 0.30814656067376867.
[I 2025-12-09 23:55:23,472] Trial 37 finished with value: 0.2967925729166 and parameters: {'model_type': 'graphsage', 'hidden_dims': '[256, 128, 64]', 'dropout': 0.4088353422488015, 'batch_norm': False, 'sage_aggr': 'mean', 'sage_normalize': False, 'sage_project': False, 'lr': 0.00011299691918550381, 'weight_decay': 5.840713441346661e-06, 'epochs': 201, 'loss': 'mse', 'optimizer': 'adam', 'graph_mode': 'cutoff', 'cutoff': 0.8188067972211753, 'grm_norm': 'gcn', 'self_loops': True, 'use_snp_selection': False}. Best is trial 31 with value: 0.30814656067376867.
[I 2025-12-10 00:01:06,076] Trial 38 finished with value: 0.25345075185465704 and parameters: {'model_type': 'graphsage', 'hidden_dims': '[512, 256]', 'dropout': 0.261636843644529, 'batch_norm': True, 'sage_aggr': 'max', 'sage_normalize': True, 'sage_project': False, 'lr': 0.0005025607289934201, 'weight_decay': 2.858387252736626e-05, 'epochs': 282, 'loss': 'mae', 'optimizer': 'adam', 'graph_mode': 'knn', 'knn_k': 10, 'weighted_edges': True, 'symmetrize_mode': 'union', 'self_loops': False, 'use_snp_selection': False}. Best is trial 31 with value: 0.30814656067376867.
[I 2025-12-10 00:01:57,172] Trial 39 finished with value: 0.30132590155555083 and parameters: {'model_type': 'graphsage', 'hidden_dims': '[512, 64]', 'dropout': 0.5520174348552119, 'batch_norm': False, 'sage_aggr': 'mean', 'sage_normalize': True, 'sage_project': False, 'lr': 0.000904818329866517, 'weight_decay': 9.447149573181235e-05, 'epochs': 327, 'loss': 'mse', 'optimizer': 'adam', 'graph_mode': 'cutoff', 'cutoff': 0.7077261045413443, 'grm_norm': 'gcn', 'self_loops': True, 'use_snp_selection': True, 'num_snps': 15197}. Best is trial 31 with value: 0.30814656067376867.
[I 2025-12-10 00:04:59,329] Trial 40 finished with value: 0.30109992822469556 and parameters: {'model_type': 'graphsage', 'hidden_dims': '[256, 128]', 'dropout': 0.4711303171107635, 'batch_norm': True, 'sage_aggr': 'mean', 'sage_normalize': False, 'sage_project': False, 'lr': 0.00025603571171959255, 'weight_decay': 0.0003585253539684886, 'epochs': 259, 'loss': 'mae', 'optimizer': 'adam', 'graph_mode': 'knn', 'knn_k': 7, 'weighted_edges': False, 'symmetrize_mode': 'union', 'self_loops': True, 'use_snp_selection': False}. Best is trial 31 with value: 0.30814656067376867.
[I 2025-12-10 00:06:41,005] Trial 41 finished with value: 0.2891584684975327 and parameters: {'model_type': 'graphsage', 'hidden_dims': '[256, 128]', 'dropout': 0.42098550003116064, 'batch_norm': False, 'sage_aggr': 'mean', 'sage_normalize': True, 'sage_project': False, 'lr': 0.0012690357123284523, 'weight_decay': 4.396314532777817e-06, 'epochs': 332, 'loss': 'mse', 'optimizer': 'adam', 'graph_mode': 'cutoff', 'cutoff': 0.5343515814394966, 'grm_norm': 'cosine_then_gcn', 'self_loops': True, 'use_snp_selection': False}. Best is trial 31 with value: 0.30814656067376867.
[I 2025-12-10 00:08:09,190] Trial 42 finished with value: 0.30872225963632116 and parameters: {'model_type': 'graphsage', 'hidden_dims': '[256, 128]', 'dropout': 0.35503702878900084, 'batch_norm': False, 'sage_aggr': 'mean', 'sage_normalize': True, 'sage_project': False, 'lr': 0.002716420530615033, 'weight_decay': 1.1433345668097762e-05, 'epochs': 306, 'loss': 'mse', 'optimizer': 'adam', 'graph_mode': 'cutoff', 'cutoff': 0.6350060449024512, 'grm_norm': 'cosine_then_gcn', 'self_loops': True, 'use_snp_selection': False}. Best is trial 42 with value: 0.30872225963632116.
[I 2025-12-10 00:09:33,631] Trial 43 finished with value: 0.30003676600880136 and parameters: {'model_type': 'graphsage', 'hidden_dims': '[256, 128]', 'dropout': 0.33193354494451793, 'batch_norm': False, 'sage_aggr': 'mean', 'sage_normalize': True, 'sage_project': False, 'lr': 0.0023931855117610788, 'weight_decay': 1.1468798967996563e-05, 'epochs': 289, 'loss': 'mse', 'optimizer': 'adam', 'graph_mode': 'cutoff', 'cutoff': 0.6381803555121512, 'grm_norm': 'none', 'self_loops': True, 'use_snp_selection': False}. Best is trial 42 with value: 0.30872225963632116.
[I 2025-12-10 00:10:30,026] Trial 44 finished with value: 0.296162592231047 and parameters: {'model_type': 'graphsage', 'hidden_dims': '[128, 64]', 'dropout': 0.3520102791380793, 'batch_norm': False, 'sage_aggr': 'mean', 'sage_normalize': True, 'sage_project': False, 'lr': 0.0006677409761039567, 'weight_decay': 4.637264151261353e-05, 'epochs': 307, 'loss': 'mse', 'optimizer': 'adam', 'graph_mode': 'cutoff', 'cutoff': 0.5939171834019392, 'grm_norm': 'cosine_then_gcn', 'self_loops': True, 'use_snp_selection': False}. Best is trial 42 with value: 0.30872225963632116.
[I 2025-12-10 00:11:10,764] Trial 45 finished with value: 0.28074087849139817 and parameters: {'model_type': 'graphsage', 'hidden_dims': '[256, 128]', 'dropout': 0.2878003991915263, 'batch_norm': False, 'sage_aggr': 'mean', 'sage_normalize': True, 'sage_project': False, 'lr': 0.00040080357655689915, 'weight_decay': 2.0341177317625007e-05, 'epochs': 162, 'loss': 'mse', 'optimizer': 'adam', 'graph_mode': 'cutoff', 'cutoff': 0.7831474443251886, 'grm_norm': 'gcn', 'self_loops': True, 'use_snp_selection': True, 'num_snps': 34750}. Best is trial 42 with value: 0.30872225963632116.
[I 2025-12-10 00:12:32,909] Trial 46 finished with value: 0.3056242602311435 and parameters: {'model_type': 'graphsage', 'hidden_dims': '[256, 128]', 'dropout': 0.322883601085685, 'batch_norm': False, 'sage_aggr': 'max', 'sage_normalize': True, 'sage_project': False, 'lr': 0.005401593793153496, 'weight_decay': 8.728001262841135e-06, 'epochs': 288, 'loss': 'mse', 'optimizer': 'adam', 'graph_mode': 'cutoff', 'cutoff': 0.7322869954624939, 'grm_norm': 'none', 'self_loops': False, 'use_snp_selection': False}. Best is trial 42 with value: 0.30872225963632116.
[I 2025-12-10 00:13:42,815] Trial 47 finished with value: 0.2078564952612984 and parameters: {'model_type': 'graphsage', 'hidden_dims': '[256, 128, 64]', 'dropout': 0.23533659733887527, 'batch_norm': False, 'sage_aggr': 'max', 'sage_normalize': True, 'sage_project': False, 'lr': 0.005733795774313719, 'weight_decay': 8.289569303740012e-06, 'epochs': 239, 'loss': 'mse', 'optimizer': 'adam', 'graph_mode': 'cutoff', 'cutoff': 0.6628636597395492, 'grm_norm': 'none', 'self_loops': False, 'use_snp_selection': False}. Best is trial 42 with value: 0.30872225963632116.
