[I 2025-12-08 19:06:15,847] Trial 35 finished with value: 0.2971616866260612 and parameters: {'model_type': 'graphsage', 'hidden_dims': '[128, 64]', 'dropout': 0.5290061961666925, 'batch_norm': False, 'sage_aggr': 'mean', 'sage_normalize': False, 'sage_project': False, 'lr': 1.2729344706106403e-05, 'weight_decay': 1.84452928774402e-07, 'epochs': 192, 'loss': 'mse', 'optimizer': 'adam', 'graph_mode': 'cutoff', 'cutoff': 0.684727511512986, 'grm_norm': 'gcn', 'self_loops': True, 'use_snp_selection': True, 'num_snps': 17087}. Best is trial 30 with value: 0.2990360154495376.
[I 2025-12-08 19:06:48,809] Trial 36 finished with value: 0.2934515771942485 and parameters: {'model_type': 'graphsage', 'hidden_dims': '[128, 64]', 'dropout': 0.5275932849425057, 'batch_norm': True, 'sage_aggr': 'mean', 'sage_normalize': False, 'sage_project': False, 'lr': 1.369514149422701e-05, 'weight_decay': 2.1745368430908095e-07, 'epochs': 167, 'loss': 'mae', 'optimizer': 'adam', 'graph_mode': 'cutoff', 'cutoff': 0.6831242964339389, 'grm_norm': 'gcn', 'self_loops': True, 'use_snp_selection': True, 'num_snps': 15000}. Best is trial 30 with value: 0.2990360154495376.
[I 2025-12-08 19:07:29,509] Trial 37 finished with value: 0.2837607438856068 and parameters: {'model_type': 'graphsage', 'hidden_dims': '[128, 64]', 'dropout': 0.5116840667590254, 'batch_norm': True, 'sage_aggr': 'mean', 'sage_normalize': False, 'sage_project': False, 'lr': 1.2157009562706584e-05, 'weight_decay': 2.0420445004474056e-07, 'epochs': 190, 'loss': 'mae', 'optimizer': 'adam', 'graph_mode': 'cutoff', 'cutoff': 0.6578985038630708, 'grm_norm': 'gcn', 'self_loops': True, 'use_snp_selection': True, 'num_snps': 22244}. Best is trial 30 with value: 0.2990360154495376.
[I 2025-12-08 19:08:14,071] Trial 38 finished with value: 0.2911137970824587 and parameters: {'model_type': 'graphsage', 'hidden_dims': '[128, 64]', 'dropout': 0.563885700931635, 'batch_norm': True, 'sage_aggr': 'mean', 'sage_normalize': False, 'sage_project': False, 'lr': 1.5627165970778816e-05, 'weight_decay': 6.356409830060701e-07, 'epochs': 159, 'loss': 'mae', 'optimizer': 'adam', 'graph_mode': 'cutoff', 'cutoff': 0.7095424293839261, 'grm_norm': 'gcn', 'self_loops': True, 'use_snp_selection': True, 'num_snps': 29002}. Best is trial 30 with value: 0.2990360154495376.
[I 2025-12-08 19:08:59,453] Trial 39 finished with value: 0.2724482080691772 and parameters: {'model_type': 'graphsage', 'hidden_dims': '[128, 64]', 'dropout': 0.5105070873029794, 'batch_norm': True, 'sage_aggr': 'mean', 'sage_normalize': False, 'sage_project': False, 'lr': 1.0377374390963192e-05, 'weight_decay': 4.971930063463445e-06, 'epochs': 249, 'loss': 'mae', 'optimizer': 'adam', 'graph_mode': 'cutoff', 'cutoff': 0.5295569005131371, 'grm_norm': 'gcn', 'self_loops': True, 'use_snp_selection': True, 'num_snps': 19166}. Best is trial 30 with value: 0.2990360154495376.
[I 2025-12-08 19:09:30,015] Trial 40 finished with value: 0.2428029805239902 and parameters: {'model_type': 'graphsage', 'hidden_dims': '[128, 64]', 'dropout': 0.500817695074233, 'batch_norm': True, 'sage_aggr': 'mean', 'sage_normalize': False, 'sage_project': False, 'lr': 5.2005705138028616e-05, 'weight_decay': 2.0932078691681088e-07, 'epochs': 223, 'loss': 'mae', 'optimizer': 'adam', 'graph_mode': 'cutoff', 'cutoff': 0.6125045237542688, 'grm_norm': 'gcn', 'self_loops': True, 'use_snp_selection': True, 'num_snps': 9885}. Best is trial 30 with value: 0.2990360154495376.
[I 2025-12-08 19:10:01,514] Trial 41 finished with value: 0.26684736797443825 and parameters: {'model_type': 'graphsage', 'hidden_dims': '[128, 64]', 'dropout': 0.5552456563638672, 'batch_norm': True, 'sage_aggr': 'mean', 'sage_normalize': False, 'sage_project': False, 'lr': 1.8261314451046585e-05, 'weight_decay': 1.7346994409033678e-06, 'epochs': 170, 'loss': 'mae', 'optimizer': 'adam', 'graph_mode': 'cutoff', 'cutoff': 0.708449688524926, 'grm_norm': 'gcn', 'self_loops': True, 'use_snp_selection': True, 'num_snps': 13480}. Best is trial 30 with value: 0.2990360154495376.
[I 2025-12-08 19:10:32,035] Trial 42 finished with value: 0.2873912870284367 and parameters: {'model_type': 'graphsage', 'hidden_dims': '[128, 64]', 'dropout': 0.5732969156094087, 'batch_norm': True, 'sage_aggr': 'mean', 'sage_normalize': False, 'sage_project': False, 'lr': 1.548451290411921e-05, 'weight_decay': 8.117322422422457e-07, 'epochs': 188, 'loss': 'mae', 'optimizer': 'adam', 'graph_mode': 'cutoff', 'cutoff': 0.8034510059584017, 'grm_norm': 'gcn', 'self_loops': True, 'use_snp_selection': True, 'num_snps': 11616}. Best is trial 30 with value: 0.2990360154495376.
[I 2025-12-08 19:11:06,520] Trial 43 finished with value: 0.28949478739038925 and parameters: {'model_type': 'graphsage', 'hidden_dims': '[128, 64]', 'dropout': 0.5287420795671234, 'batch_norm': True, 'sage_aggr': 'mean', 'sage_normalize': False, 'sage_project': False, 'lr': 2.2570233436900028e-05, 'weight_decay': 5.113153891538247e-07, 'epochs': 153, 'loss': 'mae', 'optimizer': 'adam', 'graph_mode': 'cutoff', 'cutoff': 0.7188737986177044, 'grm_norm': 'gcn', 'self_loops': True, 'use_snp_selection': True, 'num_snps': 18086}. Best is trial 30 with value: 0.2990360154495376.
[I 2025-12-08 19:11:55,189] Trial 44 finished with value: 0.2948243049825747 and parameters: {'model_type': 'graphsage', 'hidden_dims': '[128, 64]', 'dropout': 0.4896613493054854, 'batch_norm': False, 'sage_aggr': 'mean', 'sage_normalize': False, 'sage_project': False, 'lr': 1.4125495865138194e-05, 'weight_decay': 3.0205761520850433e-07, 'epochs': 177, 'loss': 'mse', 'optimizer': 'adam', 'graph_mode': 'cutoff', 'cutoff': 0.8020012975270644, 'grm_norm': 'gcn', 'self_loops': True, 'use_snp_selection': True, 'num_snps': 31803}. Best is trial 30 with value: 0.2990360154495376.
[I 2025-12-08 19:12:40,169] Trial 45 finished with value: 0.29635301784689655 and parameters: {'model_type': 'graphsage', 'hidden_dims': '[128, 64]', 'dropout': 0.48246316096603337, 'batch_norm': False, 'sage_aggr': 'mean', 'sage_normalize': False, 'sage_project': False, 'lr': 2.8105112022105364e-05, 'weight_decay': 1.7640606704604215e-07, 'epochs': 127, 'loss': 'mse', 'optimizer': 'adam', 'graph_mode': 'cutoff', 'cutoff': 0.5993446836206252, 'grm_norm': 'gcn', 'self_loops': True, 'use_snp_selection': True, 'num_snps': 32403}. Best is trial 30 with value: 0.2990360154495376.
[I 2025-12-08 19:13:25,274] Trial 46 finished with value: 0.2989154097492276 and parameters: {'model_type': 'graphsage', 'hidden_dims': '[128, 64]', 'dropout': 0.4875193702773587, 'batch_norm': False, 'sage_aggr': 'mean', 'sage_normalize': False, 'sage_project': False, 'lr': 5.0458890411951436e-05, 'weight_decay': 3.184165051044777e-07, 'epochs': 126, 'loss': 'mse', 'optimizer': 'adam', 'graph_mode': 'cutoff', 'cutoff': 0.5928626569642316, 'grm_norm': 'none', 'self_loops': True, 'use_snp_selection': True, 'num_snps': 31979}. Best is trial 30 with value: 0.2990360154495376.
[I 2025-12-08 19:14:13,320] Trial 47 finished with value: 0.2622034003852781 and parameters: {'model_type': 'graphsage', 'hidden_dims': '[256, 128, 64]', 'dropout': 0.44298797930096506, 'batch_norm': False, 'sage_aggr': 'mean', 'sage_normalize': True, 'sage_project': False, 'lr': 4.738337526206039e-05, 'weight_decay': 1.5932975646260453e-07, 'epochs': 82, 'loss': 'mse', 'optimizer': 'adam', 'graph_mode': 'cutoff', 'cutoff': 0.5816206649769374, 'grm_norm': 'none', 'self_loops': True, 'use_snp_selection': True, 'num_snps': 35194}. Best is trial 30 with value: 0.2990360154495376.
[I 2025-12-08 19:15:29,898] Trial 48 finished with value: 0.30295324895326753 and parameters: {'model_type': 'graphsage', 'hidden_dims': '[512, 256]', 'dropout': 0.48499410487925765, 'batch_norm': False, 'sage_aggr': 'mean', 'sage_normalize': False, 'sage_project': False, 'lr': 6.497214082500061e-05, 'weight_decay': 3.5476897674308473e-07, 'epochs': 128, 'loss': 'mse', 'optimizer': 'adam', 'graph_mode': 'cutoff', 'cutoff': 0.5090008744257606, 'grm_norm': 'none', 'self_loops': True, 'use_snp_selection': True, 'num_snps': 31184}. Best is trial 48 with value: 0.30295324895326753.
[I 2025-12-08 19:16:38,782] Trial 49 finished with value: 0.29769384966001905 and parameters: {'model_type': 'graphsage', 'hidden_dims': '[512, 256]', 'dropout': 0.47952405690877775, 'batch_norm': False, 'sage_aggr': 'mean', 'sage_normalize': False, 'sage_project': False, 'lr': 7.642978490438648e-05, 'weight_decay': 9.574489619907537e-07, 'epochs': 132, 'loss': 'mse', 'optimizer': 'adam', 'graph_mode': 'cutoff', 'cutoff': 0.5054110860260314, 'grm_norm': 'none', 'self_loops': True, 'use_snp_selection': True, 'num_snps': 25905}. Best is trial 48 with value: 0.30295324895326753.
[I 2025-12-08 19:17:44,884] Trial 50 finished with value: 0.2654344427407317 and parameters: {'model_type': 'graphsage', 'hidden_dims': '[512, 256]', 'dropout': 0.4382470679953884, 'batch_norm': False, 'sage_aggr': 'mean', 'sage_normalize': True, 'sage_project': False, 'lr': 8.107804586429633e-05, 'weight_decay': 1.1309224695351304e-06, 'epochs': 100, 'loss': 'mse', 'optimizer': 'adam', 'graph_mode': 'cutoff', 'cutoff': 0.4877587643612369, 'grm_norm': 'none', 'self_loops': True, 'use_snp_selection': True, 'num_snps': 28148}. Best is trial 48 with value: 0.30295324895326753.
[I 2025-12-08 19:18:59,430] Trial 51 finished with value: 0.2958450971409121 and parameters: {'model_type': 'graphsage', 'hidden_dims': '[512, 256]', 'dropout': 0.46556117570461525, 'batch_norm': False, 'sage_aggr': 'mean', 'sage_normalize': False, 'sage_project': False, 'lr': 6.179459379625708e-05, 'weight_decay': 1.5220057725316428e-07, 'epochs': 118, 'loss': 'mse', 'optimizer': 'adam', 'graph_mode': 'cutoff', 'cutoff': 0.5215508912152557, 'grm_norm': 'none', 'self_loops': True, 'use_snp_selection': True, 'num_snps': 32984}. Best is trial 48 with value: 0.30295324895326753.
[I 2025-12-08 19:20:08,952] Trial 52 finished with value: 0.28603740913495257 and parameters: {'model_type': 'graphsage', 'hidden_dims': '[512, 256]', 'dropout': 0.45583921179170245, 'batch_norm': False, 'sage_aggr': 'mean', 'sage_normalize': False, 'sage_project': False, 'lr': 9.129404197219313e-05, 'weight_decay': 7.242918471354714e-07, 'epochs': 133, 'loss': 'mse', 'optimizer': 'adam', 'graph_mode': 'cutoff', 'cutoff': 0.46658793743146676, 'grm_norm': 'none', 'self_loops': True, 'use_snp_selection': True, 'num_snps': 24896}. Best is trial 48 with value: 0.30295324895326753.
[I 2025-12-08 19:20:59,401] Trial 53 finished with value: 0.3002712312543383 and parameters: {'model_type': 'graphsage', 'hidden_dims': '[512, 256]', 'dropout': 0.48449088990040345, 'batch_norm': False, 'sage_aggr': 'mean', 'sage_normalize': False, 'sage_project': False, 'lr': 3.001607270445221e-05, 'weight_decay': 2.9658084320968005e-07, 'epochs': 74, 'loss': 'mse', 'optimizer': 'adam', 'graph_mode': 'cutoff', 'cutoff': 0.6089322631940957, 'grm_norm': 'none', 'self_loops': True, 'use_snp_selection': True, 'num_snps': 29101}. Best is trial 48 with value: 0.30295324895326753.
[I 2025-12-08 19:21:47,444] Trial 54 finished with value: 0.2679266865701111 and parameters: {'model_type': 'graphsage', 'hidden_dims': '[512, 256]', 'dropout': 0.41482833052371976, 'batch_norm': False, 'sage_aggr': 'mean', 'sage_normalize': False, 'sage_project': False, 'lr': 0.00021271142001909563, 'weight_decay': 2.888984918032223e-07, 'epochs': 69, 'loss': 'mse', 'optimizer': 'adam', 'graph_mode': 'cutoff', 'cutoff': 0.3994342641632629, 'grm_norm': 'none', 'self_loops': True, 'use_snp_selection': True, 'num_snps': 22307}. Best is trial 48 with value: 0.30295324895326753.
[I 2025-12-08 19:22:54,640] Trial 55 finished with value: 0.25478517500176995 and parameters: {'model_type': 'graphsage', 'hidden_dims': '[512, 256]', 'dropout': 0.49239764656218526, 'batch_norm': False, 'sage_aggr': 'mean', 'sage_normalize': False, 'sage_project': False, 'lr': 0.0003897412693052486, 'weight_decay': 1.0853507889106905e-05, 'epochs': 93, 'loss': 'mse', 'optimizer': 'adam', 'graph_mode': 'cutoff', 'cutoff': 0.5614336557236839, 'grm_norm': 'none', 'self_loops': True, 'use_snp_selection': True, 'num_snps': 37055}. Best is trial 48 with value: 0.30295324895326753.
[I 2025-12-08 19:23:46,718] Trial 56 finished with value: 0.2706812556821002 and parameters: {'model_type': 'graphsage', 'hidden_dims': '[512, 256]', 'dropout': 0.5113140086581935, 'batch_norm': False, 'sage_aggr': 'mean', 'sage_normalize': False, 'sage_project': False, 'lr': 3.732532476337342e-05, 'weight_decay': 9.79832505803365e-07, 'epochs': 50, 'loss': 'mse', 'optimizer': 'adam', 'graph_mode': 'cutoff', 'cutoff': 0.457345026583333, 'grm_norm': 'none', 'self_loops': True, 'use_snp_selection': True, 'num_snps': 29430}. Best is trial 48 with value: 0.30295324895326753.
[I 2025-12-08 19:24:39,131] Trial 57 finished with value: 0.2742966794166029 and parameters: {'model_type': 'graphsage', 'hidden_dims': '[512, 256]', 'dropout': 0.4218090138639942, 'batch_norm': False, 'sage_aggr': 'mean', 'sage_normalize': True, 'sage_project': False, 'lr': 0.0005807407133664262, 'weight_decay': 4.025146287941714e-07, 'epochs': 87, 'loss': 'mse', 'optimizer': 'adam', 'graph_mode': 'cutoff', 'cutoff': 0.5347029407246631, 'grm_norm': 'none', 'self_loops': True, 'use_snp_selection': True, 'num_snps': 25957}. Best is trial 48 with value: 0.30295324895326753.
[I 2025-12-08 19:25:52,022] Trial 58 finished with value: 0.13356455945796522 and parameters: {'model_type': 'graphsage', 'hidden_dims': '[512, 64]', 'dropout': 0.4554353763816719, 'batch_norm': False, 'sage_aggr': 'mean', 'sage_normalize': False, 'sage_project': False, 'lr': 0.00011316162208909731, 'weight_decay': 4.129455844023282e-06, 'epochs': 101, 'loss': 'mse', 'optimizer': 'adam', 'graph_mode': 'cutoff', 'cutoff': 0.6189374829144998, 'grm_norm': 'none', 'self_loops': True, 'use_snp_selection': True, 'num_snps': 39622}. Best is trial 48 with value: 0.30295324895326753.
[I 2025-12-08 19:28:13,115] Trial 59 finished with value: 0.2900510895367988 and parameters: {'model_type': 'graphsage', 'hidden_dims': '[512, 256]', 'dropout': 0.4769545253836113, 'batch_norm': False, 'sage_aggr': 'mean', 'sage_normalize': False, 'sage_project': False, 'lr': 6.227194097166307e-05, 'weight_decay': 2.2169659720750574e-05, 'epochs': 139, 'loss': 'mse', 'optimizer': 'adam', 'graph_mode': 'cutoff', 'cutoff': 0.29828293112907217, 'grm_norm': 'none', 'self_loops': True, 'use_snp_selection': True, 'num_snps': 35789}. Best is trial 48 with value: 0.30295324895326753.
[I 2025-12-08 19:29:15,421] Trial 60 finished with value: 0.29692416095296015 and parameters: {'model_type': 'graphsage', 'hidden_dims': '[512, 256]', 'dropout': 0.3668899914555093, 'batch_norm': False, 'sage_aggr': 'max', 'sage_normalize': False, 'sage_project': False, 'lr': 4.402502723410735e-05, 'weight_decay': 1.2395477680138847e-07, 'epochs': 115, 'loss': 'mse', 'optimizer': 'adam', 'graph_mode': 'cutoff', 'cutoff': 0.63775316798081, 'grm_norm': 'cosine_then_gcn', 'self_loops': True, 'use_snp_selection': True, 'num_snps': 29845}. Best is trial 48 with value: 0.30295324895326753.
[I 2025-12-08 19:30:05,662] Trial 61 finished with value: 0.2970563668663952 and parameters: {'model_type': 'graphsage', 'hidden_dims': '[512, 256]', 'dropout': 0.3669219817279257, 'batch_norm': False, 'sage_aggr': 'max', 'sage_normalize': False, 'sage_project': False, 'lr': 3.0474989196934966e-05, 'weight_decay': 1.3072818303723613e-07, 'epochs': 68, 'loss': 'mse', 'optimizer': 'adam', 'graph_mode': 'cutoff', 'cutoff': 0.6252426021980454, 'grm_norm': 'cosine_then_gcn', 'self_loops': True, 'use_snp_selection': True, 'num_snps': 30829}. Best is trial 48 with value: 0.30295324895326753.
[I 2025-12-08 19:30:47,498] Trial 62 finished with value: 0.28839189159452044 and parameters: {'model_type': 'graphsage', 'hidden_dims': '[512, 256]', 'dropout': 0.5214414199146769, 'batch_norm': False, 'sage_aggr': 'max', 'sage_normalize': False, 'sage_project': False, 'lr': 2.8895208373867467e-05, 'weight_decay': 3.494528328230836e-07, 'epochs': 63, 'loss': 'mse', 'optimizer': 'adam', 'graph_mode': 'cutoff', 'cutoff': 0.5788083723645445, 'grm_norm': 'cosine_then_gcn', 'self_loops': True, 'use_snp_selection': True, 'num_snps': 22531}. Best is trial 48 with value: 0.30295324895326753.
[I 2025-12-08 19:31:36,144] Trial 63 finished with value: 0.28893240211587057 and parameters: {'model_type': 'graphsage', 'hidden_dims': '[512, 256]', 'dropout': 0.5553736972446675, 'batch_norm': False, 'sage_aggr': 'max', 'sage_normalize': False, 'sage_project': False, 'lr': 3.4441657627636914e-05, 'weight_decay': 2.3456738416764947e-07, 'epochs': 72, 'loss': 'mse', 'optimizer': 'adam', 'graph_mode': 'cutoff', 'cutoff': 0.551721498048916, 'grm_norm': 'cosine_then_gcn', 'self_loops': True, 'use_snp_selection': True, 'num_snps': 27488}. Best is trial 48 with value: 0.30295324895326753.
[I 2025-12-08 19:32:21,470] Trial 64 finished with value: 0.2190811064692698 and parameters: {'model_type': 'graphsage', 'hidden_dims': '[256, 128]', 'dropout': 0.49673133838196054, 'batch_norm': False, 'sage_aggr': 'max', 'sage_normalize': False, 'sage_project': False, 'lr': 5.489381165620881e-05, 'weight_decay': 5.887925523895494e-07, 'epochs': 50, 'loss': 'mse', 'optimizer': 'adam', 'graph_mode': 'cutoff', 'cutoff': 0.5053254696353956, 'grm_norm': 'none', 'self_loops': True, 'use_snp_selection': True, 'num_snps': 34422}. Best is trial 48 with value: 0.30295324895326753.
[I 2025-12-08 19:34:51,811] Trial 65 finished with value: 0.23598228260309426 and parameters: {'model_type': 'graphsage', 'hidden_dims': '[512, 256]', 'dropout': 0.45307635186433926, 'batch_norm': False, 'sage_aggr': 'max', 'sage_normalize': False, 'sage_project': False, 'lr': 3.0632845452119095e-05, 'weight_decay': 1.1736105816737992e-07, 'epochs': 123, 'loss': 'mse', 'optimizer': 'adam', 'graph_mode': 'knn', 'knn_k': 8, 'weighted_edges': True, 'symmetrize_mode': 'union', 'self_loops': True, 'use_snp_selection': True, 'num_snps': 30958}. Best is trial 48 with value: 0.30295324895326753.
[I 2025-12-08 19:35:28,557] Trial 66 finished with value: 0.28227831606221454 and parameters: {'model_type': 'graphsage', 'hidden_dims': '[256, 128, 64]', 'dropout': 0.4240178856110209, 'batch_norm': False, 'sage_aggr': 'max', 'sage_normalize': False, 'sage_project': False, 'lr': 1.8137976216687585e-05, 'weight_decay': 3.106563849347674e-07, 'epochs': 58, 'loss': 'mse', 'optimizer': 'adam', 'graph_mode': 'cutoff', 'cutoff': 0.5685039909127577, 'grm_norm': 'cosine_then_gcn', 'self_loops': True, 'use_snp_selection': True, 'num_snps': 25417}. Best is trial 48 with value: 0.30295324895326753.
[I 2025-12-08 19:36:36,125] Trial 67 finished with value: 0.26784319358646413 and parameters: {'model_type': 'graphsage', 'hidden_dims': '[512, 256]', 'dropout': 0.1131036190131395, 'batch_norm': False, 'sage_aggr': 'mean', 'sage_normalize': True, 'sage_project': False, 'lr': 7.626348181249841e-05, 'weight_decay': 1.431411632636592e-07, 'epochs': 106, 'loss': 'mse', 'optimizer': 'adam', 'graph_mode': 'cutoff', 'cutoff': 0.6291661543057641, 'grm_norm': 'none', 'self_loops': True, 'use_snp_selection': False}. Best is trial 48 with value: 0.30295324895326753.
[I 2025-12-08 19:38:59,697] Trial 68 finished with value: 0.26976366120785455 and parameters: {'model_type': 'graphsage', 'hidden_dims': '[512, 64]', 'dropout': 0.5454893288084579, 'batch_norm': False, 'sage_aggr': 'mean', 'sage_normalize': False, 'sage_project': False, 'lr': 0.00010922183884194285, 'weight_decay': 4.539285324995088e-07, 'epochs': 158, 'loss': 'mse', 'optimizer': 'adam', 'graph_mode': 'cutoff', 'cutoff': 0.4208585444410086, 'grm_norm': 'none', 'self_loops': True, 'use_snp_selection': True, 'num_snps': 42426}. Best is trial 48 with value: 0.30295324895326753.
[I 2025-12-08 19:40:17,658] Trial 69 finished with value: 0.29821541233372567 and parameters: {'model_type': 'graphsage', 'hidden_dims': '[512, 256]', 'dropout': 0.4009230751205937, 'batch_norm': False, 'sage_aggr': 'mean', 'sage_normalize': False, 'sage_project': False, 'lr': 2.574729482081136e-05, 'weight_decay': 2.4757166483560265e-07, 'epochs': 83, 'loss': 'mse', 'optimizer': 'adam', 'graph_mode': 'cutoff', 'cutoff': 0.48799105124285935, 'grm_norm': 'cosine_then_gcn', 'self_loops': True, 'use_snp_selection': True, 'num_snps': 38247}. Best is trial 48 with value: 0.30295324895326753.
[I 2025-12-08 19:41:28,211] Trial 70 finished with value: 0.28827222091465465 and parameters: {'model_type': 'graphsage', 'hidden_dims': '[256, 128]', 'dropout': 0.3917308205451849, 'batch_norm': False, 'sage_aggr': 'mean', 'sage_normalize': False, 'sage_project': False, 'lr': 4.434877693036543e-05, 'weight_decay': 7.170395627114345e-07, 'epochs': 90, 'loss': 'mse', 'optimizer': 'adam', 'graph_mode': 'cutoff', 'cutoff': 0.4812817328259352, 'grm_norm': 'none', 'self_loops': False, 'use_snp_selection': True, 'num_snps': 39415}. Best is trial 48 with value: 0.30295324895326753.
[I 2025-12-08 19:42:34,079] Trial 71 finished with value: 0.2898342724881016 and parameters: {'model_type': 'graphsage', 'hidden_dims': '[512, 256]', 'dropout': 0.37305990126572086, 'batch_norm': False, 'sage_aggr': 'mean', 'sage_normalize': False, 'sage_project': False, 'lr': 2.552685345553375e-05, 'weight_decay': 2.305677541979777e-07, 'epochs': 80, 'loss': 'mse', 'optimizer': 'adam', 'graph_mode': 'cutoff', 'cutoff': 0.5076495354147815, 'grm_norm': 'cosine_then_gcn', 'self_loops': True, 'use_snp_selection': True, 'num_snps': 37203}. Best is trial 48 with value: 0.30295324895326753.
