Running from this directory: /cluster/work/simennes/Project_thesis/Project_thesis
Name of job: sage_w_ind
ID of job: 23696745
The job was run on these nodes: idun-07-08
[I 2025-12-08 10:17:31,643] Trial 0 finished with value: 0.2727961971199118 and parameters: {'model_type': 'graphsage', 'hidden_dims': '[128, 64]', 'dropout': 0.199031432379812, 'batch_norm': True, 'sage_aggr': 'max', 'sage_normalize': True, 'sage_project': False, 'lr': 0.00034401453323286885, 'weight_decay': 0.00017802616915745114, 'epochs': 230, 'loss': 'mse', 'optimizer': 'adam', 'graph_mode': 'knn', 'knn_k': 6, 'weighted_edges': True, 'symmetrize_mode': 'mutual', 'self_loops': True, 'use_snp_selection': False}. Best is trial 0 with value: 0.2727961971199118.
[I 2025-12-08 10:19:11,696] Trial 1 finished with value: 0.2746514001744662 and parameters: {'model_type': 'graphsage', 'hidden_dims': '[512, 128]', 'dropout': 0.2503500283181017, 'batch_norm': False, 'sage_aggr': 'max', 'sage_normalize': False, 'sage_project': False, 'lr': 3.952233718592099e-05, 'weight_decay': 0.00026754769258252603, 'epochs': 149, 'loss': 'mse', 'optimizer': 'adam', 'graph_mode': 'knn', 'knn_k': 2, 'weighted_edges': False, 'symmetrize_mode': 'mutual', 'self_loops': True, 'use_snp_selection': True, 'num_snps': 49915}. Best is trial 1 with value: 0.2746514001744662.
[I 2025-12-08 10:20:28,399] Trial 2 finished with value: 0.29274149916555076 and parameters: {'model_type': 'graphsage', 'hidden_dims': '[512, 256]', 'dropout': 0.2785908793172681, 'batch_norm': False, 'sage_aggr': 'max', 'sage_normalize': False, 'sage_project': False, 'lr': 8.806039223165805e-05, 'weight_decay': 3.5153176302760294e-05, 'epochs': 147, 'loss': 'mae', 'optimizer': 'adam', 'graph_mode': 'cutoff', 'cutoff': 0.4922564006874869, 'grm_norm': 'gcn', 'self_loops': False, 'use_snp_selection': True, 'num_snps': 34340}. Best is trial 2 with value: 0.29274149916555076.
[I 2025-12-08 10:21:41,752] Trial 3 finished with value: 0.2969640085194233 and parameters: {'model_type': 'graphsage', 'hidden_dims': '[256, 128, 64]', 'dropout': 0.3475243154412272, 'batch_norm': True, 'sage_aggr': 'max', 'sage_normalize': False, 'sage_project': False, 'lr': 1.6006331996938085e-05, 'weight_decay': 7.213121225589906e-06, 'epochs': 283, 'loss': 'mse', 'optimizer': 'adam', 'graph_mode': 'cutoff', 'cutoff': 0.5942334791449215, 'grm_norm': 'none', 'self_loops': True, 'use_snp_selection': False}. Best is trial 3 with value: 0.2969640085194233.
[I 2025-12-08 10:22:24,569] Trial 4 finished with value: 0.27708380004864097 and parameters: {'model_type': 'graphsage', 'hidden_dims': '[128, 64]', 'dropout': 0.3348926467202472, 'batch_norm': True, 'sage_aggr': 'max', 'sage_normalize': False, 'sage_project': False, 'lr': 0.0004238630400638802, 'weight_decay': 8.074086040046576e-07, 'epochs': 158, 'loss': 'mae', 'optimizer': 'adam', 'graph_mode': 'knn', 'knn_k': 1, 'weighted_edges': False, 'symmetrize_mode': 'mutual', 'self_loops': False, 'use_snp_selection': True, 'num_snps': 26850}. Best is trial 3 with value: 0.2969640085194233.
[I 2025-12-08 10:24:12,239] Trial 5 finished with value: 0.27075362173970674 and parameters: {'model_type': 'graphsage', 'hidden_dims': '[512, 64]', 'dropout': 0.14505336736221927, 'batch_norm': True, 'sage_aggr': 'mean', 'sage_normalize': True, 'sage_project': False, 'lr': 1.2962030165732234e-05, 'weight_decay': 1.326598071105465e-07, 'epochs': 180, 'loss': 'mse', 'optimizer': 'adam', 'graph_mode': 'knn', 'knn_k': 9, 'weighted_edges': True, 'symmetrize_mode': 'mutual', 'self_loops': False, 'use_snp_selection': False}. Best is trial 3 with value: 0.2969640085194233.
[I 2025-12-08 10:25:05,577] Trial 6 finished with value: 0.29070729272557727 and parameters: {'model_type': 'graphsage', 'hidden_dims': '[256, 128, 64]', 'dropout': 0.10731743755162496, 'batch_norm': True, 'sage_aggr': 'mean', 'sage_normalize': False, 'sage_project': False, 'lr': 1.922990426933137e-05, 'weight_decay': 7.30001060446905e-05, 'epochs': 63, 'loss': 'mae', 'optimizer': 'adam', 'graph_mode': 'cutoff', 'cutoff': 0.7624978434202536, 'grm_norm': 'none', 'self_loops': True, 'use_snp_selection': True, 'num_snps': 50106}. Best is trial 3 with value: 0.2969640085194233.
[I 2025-12-08 10:26:59,702] Trial 7 finished with value: 0.2854517794329159 and parameters: {'model_type': 'graphsage', 'hidden_dims': '[512, 64]', 'dropout': 0.2585007811528941, 'batch_norm': True, 'sage_aggr': 'max', 'sage_normalize': True, 'sage_project': False, 'lr': 5.921425508303391e-05, 'weight_decay': 0.0004511561961144237, 'epochs': 182, 'loss': 'mae', 'optimizer': 'adam', 'graph_mode': 'knn', 'knn_k': 9, 'weighted_edges': True, 'symmetrize_mode': 'union', 'self_loops': False, 'use_snp_selection': True, 'num_snps': 23903}. Best is trial 3 with value: 0.2969640085194233.
[I 2025-12-08 10:27:41,569] Trial 8 finished with value: 0.2663132677087997 and parameters: {'model_type': 'graphsage', 'hidden_dims': '[512, 256]', 'dropout': 0.3061380386767003, 'batch_norm': False, 'sage_aggr': 'mean', 'sage_normalize': True, 'sage_project': False, 'lr': 0.000698401460570184, 'weight_decay': 2.965560055460244e-06, 'epochs': 289, 'loss': 'mae', 'optimizer': 'adam', 'graph_mode': 'knn', 'knn_k': 7, 'weighted_edges': False, 'symmetrize_mode': 'mutual', 'self_loops': True, 'use_snp_selection': True, 'num_snps': 4710}. Best is trial 3 with value: 0.2969640085194233.
[I 2025-12-08 10:31:20,485] Trial 9 finished with value: 0.2931710025366997 and parameters: {'model_type': 'graphsage', 'hidden_dims': '[512, 128]', 'dropout': 0.1733844071393634, 'batch_norm': False, 'sage_aggr': 'mean', 'sage_normalize': True, 'sage_project': False, 'lr': 0.0004269677918501597, 'weight_decay': 2.2439779626249696e-06, 'epochs': 319, 'loss': 'mse', 'optimizer': 'adam', 'graph_mode': 'cutoff', 'cutoff': 0.24117565767129295, 'grm_norm': 'cosine_then_gcn', 'self_loops': True, 'use_snp_selection': False}. Best is trial 3 with value: 0.2969640085194233.
[I 2025-12-08 10:32:27,107] Trial 10 finished with value: 0.29405103973603985 and parameters: {'model_type': 'graphsage', 'hidden_dims': '[256, 128, 64]', 'dropout': 0.5062131504581071, 'batch_norm': True, 'sage_aggr': 'max', 'sage_normalize': False, 'sage_project': False, 'lr': 0.0060050040216813455, 'weight_decay': 1.5886244399072472e-05, 'epochs': 258, 'loss': 'mse', 'optimizer': 'adam', 'graph_mode': 'cutoff', 'cutoff': 0.6388703494956212, 'grm_norm': 'none', 'self_loops': True, 'use_snp_selection': False}. Best is trial 3 with value: 0.2969640085194233.
[I 2025-12-08 10:33:32,125] Trial 11 finished with value: 0.2984021637490811 and parameters: {'model_type': 'graphsage', 'hidden_dims': '[256, 128, 64]', 'dropout': 0.49488119581970164, 'batch_norm': True, 'sage_aggr': 'max', 'sage_normalize': False, 'sage_project': False, 'lr': 0.006753264773209739, 'weight_decay': 1.623283721491421e-05, 'epochs': 251, 'loss': 'mse', 'optimizer': 'adam', 'graph_mode': 'cutoff', 'cutoff': 0.6423124990838213, 'grm_norm': 'none', 'self_loops': True, 'use_snp_selection': False}. Best is trial 11 with value: 0.2984021637490811.
[I 2025-12-08 10:35:05,838] Trial 12 finished with value: 0.28875693462655644 and parameters: {'model_type': 'graphsage', 'hidden_dims': '[256, 128, 64]', 'dropout': 0.4543297147807155, 'batch_norm': True, 'sage_aggr': 'max', 'sage_normalize': False, 'sage_project': False, 'lr': 0.00923224194542078, 'weight_decay': 6.372026470830696e-06, 'epochs': 339, 'loss': 'mse', 'optimizer': 'adam', 'graph_mode': 'cutoff', 'cutoff': 0.5310605659707277, 'grm_norm': 'none', 'self_loops': True, 'use_snp_selection': False}. Best is trial 11 with value: 0.2984021637490811.
[I 2025-12-08 10:36:07,739] Trial 13 finished with value: 0.3005032851718225 and parameters: {'model_type': 'graphsage', 'hidden_dims': '[256, 128]', 'dropout': 0.4126000400326648, 'batch_norm': True, 'sage_aggr': 'max', 'sage_normalize': False, 'sage_project': False, 'lr': 0.0014626888081117136, 'weight_decay': 1.8022830822385886e-05, 'epochs': 238, 'loss': 'mse', 'optimizer': 'adam', 'graph_mode': 'cutoff', 'cutoff': 0.8525230707343452, 'grm_norm': 'cosine', 'self_loops': True, 'use_snp_selection': False}. Best is trial 13 with value: 0.3005032851718225.
[I 2025-12-08 10:37:08,141] Trial 14 finished with value: 0.30091737045666145 and parameters: {'model_type': 'graphsage', 'hidden_dims': '[256, 128]', 'dropout': 0.5894939275658014, 'batch_norm': True, 'sage_aggr': 'max', 'sage_normalize': False, 'sage_project': False, 'lr': 0.0022320930487654787, 'weight_decay': 3.63105722085073e-05, 'epochs': 231, 'loss': 'mse', 'optimizer': 'adam', 'graph_mode': 'cutoff', 'cutoff': 0.8923190952193389, 'grm_norm': 'cosine', 'self_loops': True, 'use_snp_selection': False}. Best is trial 14 with value: 0.30091737045666145.
[I 2025-12-08 10:38:07,298] Trial 15 finished with value: 0.2977368209869757 and parameters: {'model_type': 'graphsage', 'hidden_dims': '[256, 128]', 'dropout': 0.5943596774663533, 'batch_norm': True, 'sage_aggr': 'max', 'sage_normalize': False, 'sage_project': False, 'lr': 0.0014342593302532757, 'weight_decay': 6.736701315093234e-05, 'epochs': 226, 'loss': 'mse', 'optimizer': 'adam', 'graph_mode': 'cutoff', 'cutoff': 0.8973313329898638, 'grm_norm': 'cosine', 'self_loops': True, 'use_snp_selection': False}. Best is trial 14 with value: 0.30091737045666145.
[I 2025-12-08 10:38:39,754] Trial 16 finished with value: 0.3060229729813973 and parameters: {'model_type': 'graphsage', 'hidden_dims': '[256, 128]', 'dropout': 0.4196890238882004, 'batch_norm': True, 'sage_aggr': 'max', 'sage_normalize': False, 'sage_project': False, 'lr': 0.002253787426726829, 'weight_decay': 6.067807278806825e-07, 'epochs': 100, 'loss': 'mse', 'optimizer': 'adam', 'graph_mode': 'cutoff', 'cutoff': 0.8813702497064646, 'grm_norm': 'cosine', 'self_loops': True, 'use_snp_selection': False}. Best is trial 16 with value: 0.3060229729813973.
[I 2025-12-08 10:39:09,240] Trial 17 finished with value: 0.3005952971498976 and parameters: {'model_type': 'graphsage', 'hidden_dims': '[256, 128]', 'dropout': 0.5978943628902124, 'batch_norm': True, 'sage_aggr': 'max', 'sage_normalize': False, 'sage_project': False, 'lr': 0.0027147074403831434, 'weight_decay': 2.1541063593182258e-07, 'epochs': 86, 'loss': 'mse', 'optimizer': 'adam', 'graph_mode': 'cutoff', 'cutoff': 0.7722481542302042, 'grm_norm': 'cosine', 'self_loops': True, 'use_snp_selection': False}. Best is trial 16 with value: 0.3060229729813973.
[I 2025-12-08 10:39:43,186] Trial 18 finished with value: 0.2761571354035932 and parameters: {'model_type': 'graphsage', 'hidden_dims': '[256, 128]', 'dropout': 0.4055262512494565, 'batch_norm': False, 'sage_aggr': 'mean', 'sage_normalize': False, 'sage_project': False, 'lr': 0.00014213392295929616, 'weight_decay': 4.633582806060578e-07, 'epochs': 107, 'loss': 'mse', 'optimizer': 'adam', 'graph_mode': 'cutoff', 'cutoff': 0.7724368669481646, 'grm_norm': 'cosine', 'self_loops': False, 'use_snp_selection': False}. Best is trial 16 with value: 0.3060229729813973.
[I 2025-12-08 10:40:06,377] Trial 19 finished with value: 0.27900033627827014 and parameters: {'model_type': 'graphsage', 'hidden_dims': '[256, 128]', 'dropout': 0.5381131792190541, 'batch_norm': True, 'sage_aggr': 'max', 'sage_normalize': False, 'sage_project': False, 'lr': 0.0028923548845266656, 'weight_decay': 9.884244821116265e-07, 'epochs': 40, 'loss': 'mse', 'optimizer': 'adam', 'graph_mode': 'cutoff', 'cutoff': 0.3808597080540289, 'grm_norm': 'cosine', 'self_loops': True, 'use_snp_selection': False}. Best is trial 16 with value: 0.3060229729813973.
[I 2025-12-08 10:40:41,783] Trial 20 finished with value: 0.29924174348161114 and parameters: {'model_type': 'graphsage', 'hidden_dims': '[256, 128]', 'dropout': 0.401957428024705, 'batch_norm': True, 'sage_aggr': 'max', 'sage_normalize': False, 'sage_project': False, 'lr': 0.0011214198858209737, 'weight_decay': 2.6360328655230953e-06, 'epochs': 114, 'loss': 'mse', 'optimizer': 'adam', 'graph_mode': 'cutoff', 'cutoff': 0.8891622009917817, 'grm_norm': 'cosine_then_gcn', 'self_loops': True, 'use_snp_selection': False}. Best is trial 16 with value: 0.3060229729813973.
[I 2025-12-08 10:41:13,889] Trial 21 finished with value: 0.29729576063568836 and parameters: {'model_type': 'graphsage', 'hidden_dims': '[256, 128]', 'dropout': 0.5894921519408661, 'batch_norm': True, 'sage_aggr': 'max', 'sage_normalize': False, 'sage_project': False, 'lr': 0.0035582068337962976, 'weight_decay': 1.1797958835457795e-07, 'epochs': 98, 'loss': 'mse', 'optimizer': 'adam', 'graph_mode': 'cutoff', 'cutoff': 0.7499517309345806, 'grm_norm': 'cosine', 'self_loops': True, 'use_snp_selection': False}. Best is trial 16 with value: 0.3060229729813973.
[I 2025-12-08 10:41:39,652] Trial 22 finished with value: 0.30409092429576834 and parameters: {'model_type': 'graphsage', 'hidden_dims': '[256, 128]', 'dropout': 0.5528272752391019, 'batch_norm': True, 'sage_aggr': 'max', 'sage_normalize': False, 'sage_project': False, 'lr': 0.0030141688202991565, 'weight_decay': 2.834981933483606e-07, 'epochs': 68, 'loss': 'mse', 'optimizer': 'adam', 'graph_mode': 'cutoff', 'cutoff': 0.8025622478007326, 'grm_norm': 'cosine', 'self_loops': True, 'use_snp_selection': False}. Best is trial 16 with value: 0.3060229729813973.
[I 2025-12-08 10:42:05,006] Trial 23 finished with value: 0.30436980084627335 and parameters: {'model_type': 'graphsage', 'hidden_dims': '[256, 128]', 'dropout': 0.539510712785434, 'batch_norm': True, 'sage_aggr': 'max', 'sage_normalize': False, 'sage_project': False, 'lr': 0.0037509491722531397, 'weight_decay': 3.464323895206319e-07, 'epochs': 66, 'loss': 'mse', 'optimizer': 'adam', 'graph_mode': 'cutoff', 'cutoff': 0.8310686868045859, 'grm_norm': 'cosine', 'self_loops': True, 'use_snp_selection': False}. Best is trial 16 with value: 0.3060229729813973.
[I 2025-12-08 10:42:23,909] Trial 24 finished with value: 0.3066631291679926 and parameters: {'model_type': 'graphsage', 'hidden_dims': '[256, 128]', 'dropout': 0.5349569049577456, 'batch_norm': True, 'sage_aggr': 'max', 'sage_normalize': False, 'sage_project': False, 'lr': 0.0046488049953169585, 'weight_decay': 3.413019136012814e-07, 'epochs': 40, 'loss': 'mse', 'optimizer': 'adam', 'graph_mode': 'cutoff', 'cutoff': 0.7041528784155486, 'grm_norm': 'gcn', 'self_loops': True, 'use_snp_selection': False}. Best is trial 24 with value: 0.3066631291679926.
[I 2025-12-08 10:42:44,071] Trial 25 finished with value: 0.30786536984361546 and parameters: {'model_type': 'graphsage', 'hidden_dims': '[256, 128]', 'dropout': 0.4553934890419157, 'batch_norm': True, 'sage_aggr': 'max', 'sage_normalize': False, 'sage_project': False, 'lr': 0.0048059230550510125, 'weight_decay': 9.4499009545324e-07, 'epochs': 46, 'loss': 'mse', 'optimizer': 'adam', 'graph_mode': 'cutoff', 'cutoff': 0.6977624756871201, 'grm_norm': 'gcn', 'self_loops': True, 'use_snp_selection': False}. Best is trial 25 with value: 0.30786536984361546.
[I 2025-12-08 10:43:03,285] Trial 26 finished with value: 0.29610854083713034 and parameters: {'model_type': 'graphsage', 'hidden_dims': '[256, 128]', 'dropout': 0.4555754329639341, 'batch_norm': True, 'sage_aggr': 'mean', 'sage_normalize': True, 'sage_project': False, 'lr': 0.005266352330030839, 'weight_decay': 9.976164041698341e-07, 'epochs': 41, 'loss': 'mse', 'optimizer': 'adam', 'graph_mode': 'cutoff', 'cutoff': 0.7034046047766005, 'grm_norm': 'gcn', 'self_loops': True, 'use_snp_selection': False}. Best is trial 25 with value: 0.30786536984361546.
[I 2025-12-08 10:43:28,193] Trial 27 finished with value: 0.0 and parameters: {'model_type': 'graphsage', 'hidden_dims': '[128, 64]', 'dropout': 0.446664483157747, 'batch_norm': False, 'sage_aggr': 'max', 'sage_normalize': False, 'sage_project': False, 'lr': 0.0009662381012757366, 'weight_decay': 6.366497551888611e-07, 'epochs': 120, 'loss': 'mae', 'optimizer': 'adam', 'graph_mode': 'cutoff', 'cutoff': 0.6960444352939253, 'grm_norm': 'gcn', 'self_loops': False, 'use_snp_selection': False}. Best is trial 25 with value: 0.30786536984361546.
[I 2025-12-08 10:44:13,789] Trial 28 finished with value: 0.27696692764073644 and parameters: {'model_type': 'graphsage', 'hidden_dims': '[512, 64]', 'dropout': 0.4907687769594799, 'batch_norm': True, 'sage_aggr': 'max', 'sage_normalize': False, 'sage_project': False, 'lr': 0.00963695743016646, 'weight_decay': 1.3198532221246663e-06, 'epochs': 74, 'loss': 'mse', 'optimizer': 'adam', 'graph_mode': 'cutoff', 'cutoff': 0.4930996925518264, 'grm_norm': 'gcn', 'self_loops': True, 'use_snp_selection': False}. Best is trial 25 with value: 0.30786536984361546.
[I 2025-12-08 10:44:49,565] Trial 29 finished with value: 0.29470240829036864 and parameters: {'model_type': 'graphsage', 'hidden_dims': '[512, 256]', 'dropout': 0.3819414070976902, 'batch_norm': True, 'sage_aggr': 'max', 'sage_normalize': True, 'sage_project': False, 'lr': 0.0018876369914125023, 'weight_decay': 4.358056202240853e-06, 'epochs': 41, 'loss': 'mse', 'optimizer': 'adam', 'graph_mode': 'knn', 'knn_k': 3, 'weighted_edges': False, 'symmetrize_mode': 'union', 'self_loops': True, 'use_snp_selection': False}. Best is trial 25 with value: 0.30786536984361546.
[I 2025-12-08 10:45:51,584] Trial 30 finished with value: 0.29454205070160144 and parameters: {'model_type': 'graphsage', 'hidden_dims': '[512, 128]', 'dropout': 0.43694580979517594, 'batch_norm': True, 'sage_aggr': 'max', 'sage_normalize': False, 'sage_project': False, 'lr': 0.00021744012628968274, 'weight_decay': 1.6140440848608677e-06, 'epochs': 127, 'loss': 'mse', 'optimizer': 'adam', 'graph_mode': 'cutoff', 'cutoff': 0.6391637944390031, 'grm_norm': 'gcn', 'self_loops': True, 'use_snp_selection': False}. Best is trial 25 with value: 0.30786536984361546.
[I 2025-12-08 10:46:19,637] Trial 31 finished with value: 0.3034167582508217 and parameters: {'model_type': 'graphsage', 'hidden_dims': '[256, 128]', 'dropout': 0.5292781537303197, 'batch_norm': True, 'sage_aggr': 'max', 'sage_normalize': False, 'sage_project': False, 'lr': 0.005117110370333285, 'weight_decay': 2.6844004216756104e-07, 'epochs': 84, 'loss': 'mse', 'optimizer': 'adam', 'graph_mode': 'cutoff', 'cutoff': 0.801826345686197, 'grm_norm': 'gcn', 'self_loops': True, 'use_snp_selection': False}. Best is trial 25 with value: 0.30786536984361546.
[I 2025-12-08 10:46:41,376] Trial 32 finished with value: 0.3015251746247321 and parameters: {'model_type': 'graphsage', 'hidden_dims': '[256, 128]', 'dropout': 0.4756481229091801, 'batch_norm': True, 'sage_aggr': 'max', 'sage_normalize': False, 'sage_project': False, 'lr': 0.00409874947341175, 'weight_decay': 4.4863058464877024e-07, 'epochs': 54, 'loss': 'mse', 'optimizer': 'adam', 'graph_mode': 'cutoff', 'cutoff': 0.8360383224987887, 'grm_norm': 'gcn', 'self_loops': True, 'use_snp_selection': False}. Best is trial 25 with value: 0.30786536984361546.
[I 2025-12-08 10:47:11,048] Trial 33 finished with value: 0.2975769528019291 and parameters: {'model_type': 'graphsage', 'hidden_dims': '[256, 128]', 'dropout': 0.5446815108523324, 'batch_norm': True, 'sage_aggr': 'max', 'sage_normalize': False, 'sage_project': False, 'lr': 0.0008373922090840215, 'weight_decay': 3.7029503675739994e-07, 'epochs': 91, 'loss': 'mse', 'optimizer': 'adam', 'graph_mode': 'cutoff', 'cutoff': 0.7059645905993265, 'grm_norm': 'gcn', 'self_loops': True, 'use_snp_selection': False}. Best is trial 25 with value: 0.30786536984361546.
[I 2025-12-08 10:47:38,483] Trial 34 finished with value: 0.26739631739291286 and parameters: {'model_type': 'graphsage', 'hidden_dims': '[128, 64]', 'dropout': 0.3803045455774877, 'batch_norm': False, 'sage_aggr': 'max', 'sage_normalize': False, 'sage_project': False, 'lr': 0.0018832716075675429, 'weight_decay': 2.0563478717292945e-07, 'epochs': 57, 'loss': 'mse', 'optimizer': 'adam', 'graph_mode': 'cutoff', 'cutoff': 0.8256059456021083, 'grm_norm': 'cosine_then_gcn', 'self_loops': True, 'use_snp_selection': True, 'num_snps': 2241}. Best is trial 25 with value: 0.30786536984361546.
[I 2025-12-08 10:48:49,020] Trial 35 finished with value: 0.27348571384681064 and parameters: {'model_type': 'graphsage', 'hidden_dims': '[256, 128]', 'dropout': 0.5094904826528561, 'batch_norm': True, 'sage_aggr': 'max', 'sage_normalize': False, 'sage_project': False, 'lr': 0.0006422662207290048, 'weight_decay': 6.040928206931511e-07, 'epochs': 150, 'loss': 'mse', 'optimizer': 'adam', 'graph_mode': 'knn', 'knn_k': 4, 'weighted_edges': True, 'symmetrize_mode': 'union', 'self_loops': True, 'use_snp_selection': False}. Best is trial 25 with value: 0.30786536984361546.
[I 2025-12-08 10:50:06,442] Trial 36 finished with value: 0.30634408483248443 and parameters: {'model_type': 'graphsage', 'hidden_dims': '[512, 128]', 'dropout': 0.5569914321974664, 'batch_norm': True, 'sage_aggr': 'max', 'sage_normalize': False, 'sage_project': False, 'lr': 0.007671295268227215, 'weight_decay': 1.1696480753185106e-07, 'epochs': 79, 'loss': 'mae', 'optimizer': 'adam', 'graph_mode': 'cutoff', 'cutoff': 0.7274794000675717, 'grm_norm': 'gcn', 'self_loops': False, 'use_snp_selection': True, 'num_snps': 59922}. Best is trial 25 with value: 0.30786536984361546.
[I 2025-12-08 10:51:48,644] Trial 37 finished with value: 0.30625618438809854 and parameters: {'model_type': 'graphsage', 'hidden_dims': '[512, 128]', 'dropout': 0.5595322835865111, 'batch_norm': True, 'sage_aggr': 'max', 'sage_normalize': False, 'sage_project': False, 'lr': 0.007194885914718511, 'weight_decay': 1.4597958008880685e-07, 'epochs': 139, 'loss': 'mae', 'optimizer': 'adam', 'graph_mode': 'cutoff', 'cutoff': 0.5718624923522575, 'grm_norm': 'gcn', 'self_loops': False, 'use_snp_selection': True, 'num_snps': 58281}. Best is trial 25 with value: 0.30786536984361546.
