[I 2025-12-06 20:21:01,191] Trial 105 finished with value: 0.24278785809251485 and parameters: {'model_type': 'graphsage', 'hidden_dims': '[512, 64]', 'dropout': 0.1409372937306556, 'batch_norm': False, 'sage_aggr': 'max', 'sage_normalize': False, 'sage_project': False, 'lr': 0.00011445975368648171, 'weight_decay': 0.00036770173797491003, 'epochs': 124, 'loss': 'mae', 'optimizer': 'adam', 'graph_mode': 'cutoff', 'cutoff': 0.7808016500874381, 'grm_norm': 'cosine_then_gcn', 'self_loops': False, 'use_snp_selection': True, 'num_snps': 15984, 'graphsage_batch_size': 64}. Best is trial 72 with value: 0.2620694885940754.
[I 2025-12-06 20:21:53,435] Trial 106 finished with value: 0.25109590885284366 and parameters: {'model_type': 'graphsage', 'hidden_dims': '[512, 64]', 'dropout': 0.10952345752554188, 'batch_norm': True, 'sage_aggr': 'max', 'sage_normalize': False, 'sage_project': False, 'lr': 4.469737264818304e-05, 'weight_decay': 3.305577696271634e-06, 'epochs': 183, 'loss': 'mae', 'optimizer': 'adam', 'graph_mode': 'cutoff', 'cutoff': 0.8953506080299523, 'grm_norm': 'gcn', 'self_loops': False, 'use_snp_selection': True, 'num_snps': 20914, 'graphsage_batch_size': 512}. Best is trial 72 with value: 0.2620694885940754.
[I 2025-12-06 20:22:25,175] Trial 107 finished with value: 0.24372862330729594 and parameters: {'model_type': 'graphsage', 'hidden_dims': '[512, 64]', 'dropout': 0.15178070684152117, 'batch_norm': False, 'sage_aggr': 'max', 'sage_normalize': False, 'sage_project': False, 'lr': 0.00021375295651402467, 'weight_decay': 0.00027748676856067714, 'epochs': 87, 'loss': 'mae', 'optimizer': 'adam', 'graph_mode': 'cutoff', 'cutoff': 0.8746727427325608, 'grm_norm': 'gcn', 'self_loops': False, 'use_snp_selection': True, 'num_snps': 18141, 'graphsage_batch_size': 64}. Best is trial 72 with value: 0.2620694885940754.
[I 2025-12-06 20:22:56,636] Trial 108 finished with value: 0.21511661046152408 and parameters: {'model_type': 'graphsage', 'hidden_dims': '[512, 64]', 'dropout': 0.13276078471462427, 'batch_norm': False, 'sage_aggr': 'max', 'sage_normalize': False, 'sage_project': False, 'lr': 0.00018760702113050342, 'weight_decay': 0.000148577298061003, 'epochs': 109, 'loss': 'mae', 'optimizer': 'adam', 'graph_mode': 'knn', 'knn_k': 2, 'weighted_edges': False, 'symmetrize_mode': 'mutual', 'self_loops': False, 'use_snp_selection': True, 'num_snps': 13707, 'graphsage_batch_size': 512}. Best is trial 72 with value: 0.2620694885940754.
[I 2025-12-06 20:23:52,888] Trial 109 finished with value: 0.2211112962780482 and parameters: {'model_type': 'graphsage', 'hidden_dims': '[512, 128]', 'dropout': 0.5721527507727554, 'batch_norm': False, 'sage_aggr': 'max', 'sage_normalize': True, 'sage_project': False, 'lr': 6.247585568398442e-05, 'weight_decay': 0.0006306300936966042, 'epochs': 173, 'loss': 'mae', 'optimizer': 'adam', 'graph_mode': 'cutoff', 'cutoff': 0.8305005051554385, 'grm_norm': 'cosine', 'self_loops': False, 'use_snp_selection': True, 'num_snps': 23775, 'graphsage_batch_size': 8}. Best is trial 72 with value: 0.2620694885940754.
[I 2025-12-06 20:24:50,333] Trial 110 finished with value: 0.25621481970956733 and parameters: {'model_type': 'graphsage', 'hidden_dims': '[512, 64]', 'dropout': 0.10106026067184473, 'batch_norm': False, 'sage_aggr': 'max', 'sage_normalize': False, 'sage_project': False, 'lr': 0.0002473707106573735, 'weight_decay': 7.007330756961351e-05, 'epochs': 150, 'loss': 'mae', 'optimizer': 'adam', 'graph_mode': 'cutoff', 'cutoff': 0.8112000343717828, 'grm_norm': 'gcn', 'self_loops': False, 'use_snp_selection': True, 'num_snps': 28051, 'graphsage_batch_size': 64}. Best is trial 72 with value: 0.2620694885940754.
[I 2025-12-06 20:25:46,507] Trial 111 finished with value: 0.2531875453295051 and parameters: {'model_type': 'graphsage', 'hidden_dims': '[512, 64]', 'dropout': 0.10087101554940507, 'batch_norm': False, 'sage_aggr': 'max', 'sage_normalize': False, 'sage_project': False, 'lr': 0.0002392848629795422, 'weight_decay': 0.00025147502874149435, 'epochs': 148, 'loss': 'mae', 'optimizer': 'adam', 'graph_mode': 'cutoff', 'cutoff': 0.7931966605341942, 'grm_norm': 'gcn', 'self_loops': False, 'use_snp_selection': True, 'num_snps': 27480, 'graphsage_batch_size': 64}. Best is trial 72 with value: 0.2620694885940754.
[I 2025-12-06 20:26:36,165] Trial 112 finished with value: 0.2484384844644691 and parameters: {'model_type': 'graphsage', 'hidden_dims': '[512, 64]', 'dropout': 0.12369511118048442, 'batch_norm': False, 'sage_aggr': 'max', 'sage_normalize': False, 'sage_project': False, 'lr': 0.00013528604321831904, 'weight_decay': 0.0001815767683770981, 'epochs': 159, 'loss': 'mae', 'optimizer': 'adam', 'graph_mode': 'cutoff', 'cutoff': 0.821258736630455, 'grm_norm': 'gcn', 'self_loops': False, 'use_snp_selection': True, 'num_snps': 22414, 'graphsage_batch_size': 64}. Best is trial 72 with value: 0.2620694885940754.
[I 2025-12-06 20:27:25,199] Trial 113 finished with value: 0.24878128516844336 and parameters: {'model_type': 'graphsage', 'hidden_dims': '[512, 64]', 'dropout': 0.11669850867649768, 'batch_norm': False, 'sage_aggr': 'max', 'sage_normalize': False, 'sage_project': False, 'lr': 0.0003004318484405889, 'weight_decay': 7.417714977601794e-05, 'epochs': 132, 'loss': 'mae', 'optimizer': 'adam', 'graph_mode': 'cutoff', 'cutoff': 0.8476300404214531, 'grm_norm': 'gcn', 'self_loops': False, 'use_snp_selection': True, 'num_snps': 25156, 'graphsage_batch_size': 64}. Best is trial 72 with value: 0.2620694885940754.
[I 2025-12-06 20:28:16,032] Trial 114 finished with value: 0.218655531011839 and parameters: {'model_type': 'graphsage', 'hidden_dims': '[512, 64]', 'dropout': 0.13969266135314995, 'batch_norm': False, 'sage_aggr': 'max', 'sage_normalize': False, 'sage_project': False, 'lr': 0.0004845148585900813, 'weight_decay': 0.0004358934904078382, 'epochs': 118, 'loss': 'mae', 'optimizer': 'adam', 'graph_mode': 'cutoff', 'cutoff': 0.8127200028570541, 'grm_norm': 'gcn', 'self_loops': False, 'use_snp_selection': True, 'num_snps': 29223, 'graphsage_batch_size': 64}. Best is trial 72 with value: 0.2620694885940754.
[I 2025-12-06 20:29:00,886] Trial 115 finished with value: 0.2214369200164111 and parameters: {'model_type': 'graphsage', 'hidden_dims': '[512, 64]', 'dropout': 0.10831581278972309, 'batch_norm': False, 'sage_aggr': 'max', 'sage_normalize': False, 'sage_project': False, 'lr': 0.0005942724811749118, 'weight_decay': 6.261443442177238e-05, 'epochs': 152, 'loss': 'mae', 'optimizer': 'adam', 'graph_mode': 'cutoff', 'cutoff': 0.8597185222289065, 'grm_norm': 'gcn', 'self_loops': False, 'use_snp_selection': True, 'num_snps': 20352, 'graphsage_batch_size': 512}. Best is trial 72 with value: 0.2620694885940754.
[I 2025-12-06 20:29:29,538] Trial 116 finished with value: 0.24373381803039673 and parameters: {'model_type': 'graphsage', 'hidden_dims': '[128, 64]', 'dropout': 0.16242873950814102, 'batch_norm': False, 'sage_aggr': 'max', 'sage_normalize': False, 'sage_project': False, 'lr': 0.0001907325289184431, 'weight_decay': 9.930585309900397e-05, 'epochs': 94, 'loss': 'mae', 'optimizer': 'adam', 'graph_mode': 'cutoff', 'cutoff': 0.739799691574404, 'grm_norm': 'gcn', 'self_loops': False, 'use_snp_selection': True, 'num_snps': 31263, 'graphsage_batch_size': 128}. Best is trial 72 with value: 0.2620694885940754.
[I 2025-12-06 20:30:10,861] Trial 117 finished with value: 0.2504512970580138 and parameters: {'model_type': 'graphsage', 'hidden_dims': '[512, 64]', 'dropout': 0.12993527609811156, 'batch_norm': False, 'sage_aggr': 'max', 'sage_normalize': False, 'sage_project': False, 'lr': 0.00026035961601673414, 'weight_decay': 3.194744066991031e-05, 'epochs': 104, 'loss': 'mae', 'optimizer': 'adam', 'graph_mode': 'cutoff', 'cutoff': 0.762027875692804, 'grm_norm': 'gcn', 'self_loops': False, 'use_snp_selection': True, 'num_snps': 23963, 'graphsage_batch_size': 32}. Best is trial 72 with value: 0.2620694885940754.
[I 2025-12-06 20:30:56,600] Trial 118 finished with value: 0.2511017289305008 and parameters: {'model_type': 'graphsage', 'hidden_dims': '[512, 64]', 'dropout': 0.1499898355183035, 'batch_norm': False, 'sage_aggr': 'max', 'sage_normalize': False, 'sage_project': False, 'lr': 0.0001067050099546717, 'weight_decay': 0.0007240692210744308, 'epochs': 141, 'loss': 'mae', 'optimizer': 'adam', 'graph_mode': 'cutoff', 'cutoff': 0.8999818389979511, 'grm_norm': 'cosine_then_gcn', 'self_loops': False, 'use_snp_selection': True, 'num_snps': 21632, 'graphsage_batch_size': 512}. Best is trial 72 with value: 0.2620694885940754.
[I 2025-12-06 20:31:30,865] Trial 119 finished with value: 0.23575954913477615 and parameters: {'model_type': 'graphsage', 'hidden_dims': '[256, 128]', 'dropout': 0.10083359736239392, 'batch_norm': False, 'sage_aggr': 'max', 'sage_normalize': False, 'sage_project': False, 'lr': 0.00040370926452952034, 'weight_decay': 2.0157257717522372e-05, 'epochs': 111, 'loss': 'mse', 'optimizer': 'adam', 'graph_mode': 'cutoff', 'cutoff': 0.6537554184328223, 'grm_norm': 'gcn', 'self_loops': False, 'use_snp_selection': True, 'num_snps': 26307, 'graphsage_batch_size': 64}. Best is trial 72 with value: 0.2620694885940754.
[I 2025-12-06 20:31:59,400] Trial 120 finished with value: 0.238255762600342 and parameters: {'model_type': 'graphsage', 'hidden_dims': '[512, 64]', 'dropout': 0.1164201388804473, 'batch_norm': False, 'sage_aggr': 'max', 'sage_normalize': False, 'sage_project': False, 'lr': 0.00016064326326254712, 'weight_decay': 0.0003296551482052541, 'epochs': 69, 'loss': 'mae', 'optimizer': 'adam', 'graph_mode': 'cutoff', 'cutoff': 0.8745644103774315, 'grm_norm': 'gcn', 'self_loops': False, 'use_snp_selection': True, 'num_snps': 17632, 'graphsage_batch_size': 256}. Best is trial 72 with value: 0.2620694885940754.
[I 2025-12-06 20:32:40,783] Trial 121 finished with value: 0.2633200643440919 and parameters: {'model_type': 'graphsage', 'hidden_dims': '[512, 64]', 'dropout': 0.11592444242009332, 'batch_norm': False, 'sage_aggr': 'max', 'sage_normalize': False, 'sage_project': False, 'lr': 0.00010025066874616378, 'weight_decay': 0.000527511348136664, 'epochs': 114, 'loss': 'mae', 'optimizer': 'adam', 'graph_mode': 'cutoff', 'cutoff': 0.8447568911838439, 'grm_norm': 'gcn', 'self_loops': False, 'use_snp_selection': True, 'num_snps': 22466, 'graphsage_batch_size': 512}. Best is trial 121 with value: 0.2633200643440919.
[I 2025-12-06 20:33:21,976] Trial 122 finished with value: 0.2560504091015227 and parameters: {'model_type': 'graphsage', 'hidden_dims': '[512, 64]', 'dropout': 0.1270982172271802, 'batch_norm': False, 'sage_aggr': 'max', 'sage_normalize': False, 'sage_project': False, 'lr': 0.00013445375340100465, 'weight_decay': 0.0005169876854698856, 'epochs': 116, 'loss': 'mae', 'optimizer': 'adam', 'graph_mode': 'cutoff', 'cutoff': 0.8344179292585854, 'grm_norm': 'gcn', 'self_loops': False, 'use_snp_selection': True, 'num_snps': 22103, 'graphsage_batch_size': 512}. Best is trial 121 with value: 0.2633200643440919.
[I 2025-12-06 20:34:04,093] Trial 123 finished with value: 0.253553036762997 and parameters: {'model_type': 'graphsage', 'hidden_dims': '[512, 64]', 'dropout': 0.12326304190222562, 'batch_norm': False, 'sage_aggr': 'max', 'sage_normalize': False, 'sage_project': False, 'lr': 0.00013863181105218774, 'weight_decay': 1.3459345583753758e-05, 'epochs': 114, 'loss': 'mae', 'optimizer': 'adam', 'graph_mode': 'cutoff', 'cutoff': 0.8370670021312356, 'grm_norm': 'gcn', 'self_loops': False, 'use_snp_selection': True, 'num_snps': 22620, 'graphsage_batch_size': 512}. Best is trial 121 with value: 0.2633200643440919.
[I 2025-12-06 20:34:50,291] Trial 124 finished with value: 0.2528837398333503 and parameters: {'model_type': 'graphsage', 'hidden_dims': '[512, 64]', 'dropout': 0.13630646783722966, 'batch_norm': False, 'sage_aggr': 'max', 'sage_normalize': False, 'sage_project': False, 'lr': 0.00011851577758973442, 'weight_decay': 0.0005149140413872201, 'epochs': 123, 'loss': 'mae', 'optimizer': 'adam', 'graph_mode': 'cutoff', 'cutoff': 0.7872345946458432, 'grm_norm': 'gcn', 'self_loops': False, 'use_snp_selection': True, 'num_snps': 24415, 'graphsage_batch_size': 512}. Best is trial 121 with value: 0.2633200643440919.
[I 2025-12-06 20:35:35,713] Trial 125 finished with value: 0.24565874069378585 and parameters: {'model_type': 'graphsage', 'hidden_dims': '[512, 64]', 'dropout': 0.1495619556018081, 'batch_norm': False, 'sage_aggr': 'max', 'sage_normalize': False, 'sage_project': False, 'lr': 6.853723026627669e-05, 'weight_decay': 0.0008238304450826543, 'epochs': 100, 'loss': 'mae', 'optimizer': 'adam', 'graph_mode': 'cutoff', 'cutoff': 0.8247215064447593, 'grm_norm': 'gcn', 'self_loops': False, 'use_snp_selection': True, 'num_snps': 28324, 'graphsage_batch_size': 512}. Best is trial 121 with value: 0.2633200643440919.
[I 2025-12-06 20:36:11,988] Trial 126 finished with value: 0.23975821202504669 and parameters: {'model_type': 'graphsage', 'hidden_dims': '[512, 64]', 'dropout': 0.11119573283504157, 'batch_norm': True, 'sage_aggr': 'max', 'sage_normalize': False, 'sage_project': False, 'lr': 8.941518776401523e-05, 'weight_decay': 0.0005928162490889317, 'epochs': 105, 'loss': 'mae', 'optimizer': 'adam', 'graph_mode': 'cutoff', 'cutoff': 0.8057341598840109, 'grm_norm': 'gcn', 'self_loops': False, 'use_snp_selection': True, 'num_snps': 19419, 'graphsage_batch_size': 64}. Best is trial 121 with value: 0.2633200643440919.
[I 2025-12-06 20:36:53,024] Trial 127 finished with value: 0.26027433880865225 and parameters: {'model_type': 'graphsage', 'hidden_dims': '[512, 128]', 'dropout': 0.12848119348664513, 'batch_norm': False, 'sage_aggr': 'max', 'sage_normalize': False, 'sage_project': False, 'lr': 0.00016295575629612715, 'weight_decay': 0.00043162622356585794, 'epochs': 118, 'loss': 'mae', 'optimizer': 'adam', 'graph_mode': 'cutoff', 'cutoff': 0.845625414894914, 'grm_norm': 'gcn', 'self_loops': False, 'use_snp_selection': True, 'num_snps': 21448, 'graphsage_batch_size': 512}. Best is trial 121 with value: 0.2633200643440919.
[I 2025-12-06 20:37:32,506] Trial 128 finished with value: 0.25160030478444584 and parameters: {'model_type': 'graphsage', 'hidden_dims': '[512, 128]', 'dropout': 0.5092611461942826, 'batch_norm': False, 'sage_aggr': 'max', 'sage_normalize': False, 'sage_project': False, 'lr': 0.00020735782720532082, 'weight_decay': 0.0004149474069523537, 'epochs': 110, 'loss': 'mae', 'optimizer': 'adam', 'graph_mode': 'cutoff', 'cutoff': 0.8408541212506212, 'grm_norm': 'gcn', 'self_loops': False, 'use_snp_selection': True, 'num_snps': 21310, 'graphsage_batch_size': 512}. Best is trial 121 with value: 0.2633200643440919.
[I 2025-12-06 20:38:25,732] Trial 129 finished with value: 0.2259297946604975 and parameters: {'model_type': 'graphsage', 'hidden_dims': '[512, 128]', 'dropout': 0.12418787321945832, 'batch_norm': False, 'sage_aggr': 'max', 'sage_normalize': False, 'sage_project': False, 'lr': 0.0002444063024789959, 'weight_decay': 0.0005311990389977604, 'epochs': 130, 'loss': 'mae', 'optimizer': 'adam', 'graph_mode': 'knn', 'knn_k': 5, 'weighted_edges': False, 'symmetrize_mode': 'mutual', 'self_loops': False, 'use_snp_selection': True, 'num_snps': 22868, 'graphsage_batch_size': 64}. Best is trial 121 with value: 0.2633200643440919.
[I 2025-12-06 20:39:24,656] Trial 130 finished with value: 0.21279734474725517 and parameters: {'model_type': 'graphsage', 'hidden_dims': '[512, 128]', 'dropout': 0.16111542025052972, 'batch_norm': False, 'sage_aggr': 'max', 'sage_normalize': True, 'sage_project': False, 'lr': 0.0003295478606435404, 'weight_decay': 0.0007771242841091302, 'epochs': 121, 'loss': 'mae', 'optimizer': 'adam', 'graph_mode': 'cutoff', 'cutoff': 0.3664620677422958, 'grm_norm': 'gcn', 'self_loops': False, 'use_snp_selection': True, 'num_snps': 25251, 'graphsage_batch_size': 8}. Best is trial 121 with value: 0.2633200643440919.
[I 2025-12-06 20:40:05,762] Trial 131 finished with value: 0.25034079410784627 and parameters: {'model_type': 'graphsage', 'hidden_dims': '[512, 128]', 'dropout': 0.13852298171539973, 'batch_norm': False, 'sage_aggr': 'max', 'sage_normalize': False, 'sage_project': False, 'lr': 0.0001773912252181288, 'weight_decay': 0.00034081475135174015, 'epochs': 117, 'loss': 'mae', 'optimizer': 'adam', 'graph_mode': 'cutoff', 'cutoff': 0.8823095403279236, 'grm_norm': 'gcn', 'self_loops': False, 'use_snp_selection': True, 'num_snps': 21705, 'graphsage_batch_size': 512}. Best is trial 121 with value: 0.2633200643440919.
[I 2025-12-06 20:40:42,090] Trial 132 finished with value: 0.2525090569032274 and parameters: {'model_type': 'graphsage', 'hidden_dims': '[256, 128, 64]', 'dropout': 0.12810726295812874, 'batch_norm': False, 'sage_aggr': 'max', 'sage_normalize': False, 'sage_project': False, 'lr': 0.00015535390528133376, 'weight_decay': 0.0006259831521078753, 'epochs': 125, 'loss': 'mae', 'optimizer': 'adam', 'graph_mode': 'cutoff', 'cutoff': 0.8537788744117728, 'grm_norm': 'gcn', 'self_loops': False, 'use_snp_selection': True, 'num_snps': 26446, 'graphsage_batch_size': 512}. Best is trial 121 with value: 0.2633200643440919.
[I 2025-12-06 20:41:30,637] Trial 133 finished with value: 0.253948740379574 and parameters: {'model_type': 'graphsage', 'hidden_dims': '[512, 64]', 'dropout': 0.11015890481416585, 'batch_norm': False, 'sage_aggr': 'max', 'sage_normalize': False, 'sage_project': False, 'lr': 0.0001260925051130841, 'weight_decay': 0.0004820345826306998, 'epochs': 138, 'loss': 'mae', 'optimizer': 'adam', 'graph_mode': 'cutoff', 'cutoff': 0.8154087635537828, 'grm_norm': 'gcn', 'self_loops': False, 'use_snp_selection': True, 'num_snps': 24058, 'graphsage_batch_size': 512}. Best is trial 121 with value: 0.2633200643440919.
[I 2025-12-06 20:42:07,609] Trial 134 finished with value: 0.2462403948486469 and parameters: {'model_type': 'graphsage', 'hidden_dims': '[512, 128]', 'dropout': 0.11939461358060326, 'batch_norm': False, 'sage_aggr': 'max', 'sage_normalize': False, 'sage_project': False, 'lr': 0.00013991293594775093, 'weight_decay': 0.0003917415179982109, 'epochs': 106, 'loss': 'mae', 'optimizer': 'adam', 'graph_mode': 'cutoff', 'cutoff': 0.7975088762402955, 'grm_norm': 'gcn', 'self_loops': False, 'use_snp_selection': True, 'num_snps': 19560, 'graphsage_batch_size': 512}. Best is trial 121 with value: 0.2633200643440919.
[I 2025-12-06 20:42:43,635] Trial 135 finished with value: 0.2589077805982992 and parameters: {'model_type': 'graphsage', 'hidden_dims': '[512, 64]', 'dropout': 0.13611686025983608, 'batch_norm': False, 'sage_aggr': 'max', 'sage_normalize': False, 'sage_project': False, 'lr': 0.00020494618790129865, 'weight_decay': 0.00023308877856296762, 'epochs': 97, 'loss': 'mae', 'optimizer': 'adam', 'graph_mode': 'cutoff', 'cutoff': 0.774178863027898, 'grm_norm': 'gcn', 'self_loops': False, 'use_snp_selection': True, 'num_snps': 20600, 'graphsage_batch_size': 64}. Best is trial 121 with value: 0.2633200643440919.
[I 2025-12-06 20:43:01,713] Trial 136 finished with value: 0.21263063144813396 and parameters: {'model_type': 'graphsage', 'hidden_dims': '[512, 64]', 'dropout': 0.14892220435878914, 'batch_norm': False, 'sage_aggr': 'max', 'sage_normalize': False, 'sage_project': False, 'lr': 0.00022367282514401787, 'weight_decay': 0.0008332052272323661, 'epochs': 96, 'loss': 'mae', 'optimizer': 'adam', 'graph_mode': 'cutoff', 'cutoff': 0.7834735281100609, 'grm_norm': 'gcn', 'self_loops': False, 'use_snp_selection': True, 'num_snps': 3671, 'graphsage_batch_size': 64}. Best is trial 121 with value: 0.2633200643440919.
[I 2025-12-06 20:43:44,814] Trial 137 finished with value: 0.23078510369302974 and parameters: {'model_type': 'graphsage', 'hidden_dims': '[512, 64]', 'dropout': 0.3171145259172353, 'batch_norm': False, 'sage_aggr': 'max', 'sage_normalize': False, 'sage_project': False, 'lr': 0.00028944756046037724, 'weight_decay': 0.00028938362460511404, 'epochs': 164, 'loss': 'mae', 'optimizer': 'adam', 'graph_mode': 'cutoff', 'cutoff': 0.8284046560809949, 'grm_norm': 'gcn', 'self_loops': False, 'use_snp_selection': True, 'num_snps': 16777, 'graphsage_batch_size': 64}. Best is trial 121 with value: 0.2633200643440919.
[I 2025-12-06 20:44:23,513] Trial 138 finished with value: 0.25234560684091234 and parameters: {'model_type': 'graphsage', 'hidden_dims': '[512, 64]', 'dropout': 0.13065435973311773, 'batch_norm': False, 'sage_aggr': 'max', 'sage_normalize': False, 'sage_project': False, 'lr': 0.00019778643795563373, 'weight_decay': 0.0006971521192716865, 'epochs': 113, 'loss': 'mae', 'optimizer': 'adam', 'graph_mode': 'cutoff', 'cutoff': 0.773655914963579, 'grm_norm': 'gcn', 'self_loops': False, 'use_snp_selection': True, 'num_snps': 20539, 'graphsage_batch_size': 64}. Best is trial 121 with value: 0.2633200643440919.
[I 2025-12-06 20:45:02,433] Trial 139 finished with value: 0.22834831735673636 and parameters: {'model_type': 'graphsage', 'hidden_dims': '[512, 128]', 'dropout': 0.11062418913392415, 'batch_norm': False, 'sage_aggr': 'max', 'sage_normalize': False, 'sage_project': False, 'lr': 2.0714818108471717e-06, 'weight_decay': 0.0009573255795729584, 'epochs': 100, 'loss': 'mae', 'optimizer': 'adam', 'graph_mode': 'cutoff', 'cutoff': 0.6113059469905672, 'grm_norm': 'cosine_then_gcn', 'self_loops': False, 'use_snp_selection': True, 'num_snps': 22410, 'graphsage_batch_size': 64}. Best is trial 121 with value: 0.2633200643440919.
