[I 2025-12-09 03:25:23,469] Trial 51 finished with value: 0.3182447785919754 and parameters: {'model_type': 'graphsage', 'hidden_dims': '[512, 128]', 'dropout': 0.41249032382145745, 'batch_norm': True, 'sage_aggr': 'mean', 'sage_normalize': True, 'sage_project': False, 'lr': 0.006665748482851934, 'weight_decay': 1.0969089332340868e-05, 'epochs': 191, 'loss': 'mse', 'optimizer': 'adam', 'graph_mode': 'cutoff', 'cutoff': 0.8366768607074568, 'grm_norm': 'cosine', 'self_loops': False, 'use_snp_selection': False}. Best is trial 25 with value: 0.3188787143064953.
[I 2025-12-09 03:26:57,529] Trial 52 finished with value: 0.31723020046958367 and parameters: {'model_type': 'graphsage', 'hidden_dims': '[512, 128]', 'dropout': 0.38625090750674984, 'batch_norm': True, 'sage_aggr': 'mean', 'sage_normalize': True, 'sage_project': False, 'lr': 0.006925088947802079, 'weight_decay': 8.842477169448767e-06, 'epochs': 207, 'loss': 'mse', 'optimizer': 'adam', 'graph_mode': 'cutoff', 'cutoff': 0.7918407532816776, 'grm_norm': 'cosine', 'self_loops': False, 'use_snp_selection': False}. Best is trial 25 with value: 0.3188787143064953.
[I 2025-12-09 03:27:59,145] Trial 53 finished with value: 0.3086806988373675 and parameters: {'model_type': 'graphsage', 'hidden_dims': '[512, 128]', 'dropout': 0.3916490981412082, 'batch_norm': True, 'sage_aggr': 'mean', 'sage_normalize': True, 'sage_project': False, 'lr': 0.007400657005837538, 'weight_decay': 9.002268951965943e-06, 'epochs': 124, 'loss': 'mse', 'optimizer': 'adam', 'graph_mode': 'cutoff', 'cutoff': 0.7436422058512404, 'grm_norm': 'cosine', 'self_loops': False, 'use_snp_selection': False}. Best is trial 25 with value: 0.3188787143064953.
[I 2025-12-09 03:29:17,523] Trial 54 finished with value: 0.31642409541840955 and parameters: {'model_type': 'graphsage', 'hidden_dims': '[512, 128]', 'dropout': 0.36090804900462703, 'batch_norm': True, 'sage_aggr': 'mean', 'sage_normalize': True, 'sage_project': False, 'lr': 0.0037428804941888032, 'weight_decay': 4.3802101461333985e-06, 'epochs': 167, 'loss': 'mse', 'optimizer': 'adam', 'graph_mode': 'cutoff', 'cutoff': 0.7899659105879471, 'grm_norm': 'cosine', 'self_loops': False, 'use_snp_selection': False}. Best is trial 25 with value: 0.3188787143064953.
[I 2025-12-09 03:30:58,874] Trial 55 finished with value: 0.2357483010233851 and parameters: {'model_type': 'graphsage', 'hidden_dims': '[256, 128, 64]', 'dropout': 0.3778660506277668, 'batch_norm': True, 'sage_aggr': 'max', 'sage_normalize': True, 'sage_project': False, 'lr': 0.007506974632605595, 'weight_decay': 0.0005799101116341439, 'epochs': 293, 'loss': 'mse', 'optimizer': 'adam', 'graph_mode': 'knn', 'knn_k': 2, 'weighted_edges': False, 'symmetrize_mode': 'union', 'self_loops': True, 'use_snp_selection': False}. Best is trial 25 with value: 0.3188787143064953.
[I 2025-12-09 03:31:32,108] Trial 56 finished with value: 0.2757486140199647 and parameters: {'model_type': 'graphsage', 'hidden_dims': '[512, 128]', 'dropout': 0.34652165733321444, 'batch_norm': True, 'sage_aggr': 'mean', 'sage_normalize': False, 'sage_project': False, 'lr': 0.004092993873131839, 'weight_decay': 2.906733542230378e-05, 'epochs': 189, 'loss': 'mse', 'optimizer': 'adam', 'graph_mode': 'cutoff', 'cutoff': 0.8556129332762133, 'grm_norm': 'cosine', 'self_loops': False, 'use_snp_selection': True, 'num_snps': 4210}. Best is trial 25 with value: 0.3188787143064953.
[I 2025-12-09 03:32:13,300] Trial 57 finished with value: 0.31237803445852136 and parameters: {'model_type': 'graphsage', 'hidden_dims': '[512, 64]', 'dropout': 0.4353587460750753, 'batch_norm': True, 'sage_aggr': 'max', 'sage_normalize': True, 'sage_project': False, 'lr': 0.0026543265551218767, 'weight_decay': 2.0095691435096803e-05, 'epochs': 72, 'loss': 'mse', 'optimizer': 'adam', 'graph_mode': 'cutoff', 'cutoff': 0.6299396137202344, 'grm_norm': 'cosine', 'self_loops': False, 'use_snp_selection': False}. Best is trial 25 with value: 0.3188787143064953.
[I 2025-12-09 03:33:20,383] Trial 58 finished with value: 0.2335069220988933 and parameters: {'model_type': 'graphsage', 'hidden_dims': '[256, 128]', 'dropout': 0.49280644461010137, 'batch_norm': False, 'sage_aggr': 'mean', 'sage_normalize': True, 'sage_project': False, 'lr': 0.006778742621088747, 'weight_decay': 0.00011668041615437058, 'epochs': 264, 'loss': 'mae', 'optimizer': 'adam', 'graph_mode': 'cutoff', 'cutoff': 0.7393670763107565, 'grm_norm': 'none', 'self_loops': False, 'use_snp_selection': False}. Best is trial 25 with value: 0.3188787143064953.
[I 2025-12-09 03:34:16,344] Trial 59 finished with value: 0.2942211617943712 and parameters: {'model_type': 'graphsage', 'hidden_dims': '[256, 128]', 'dropout': 0.296273750245702, 'batch_norm': True, 'sage_aggr': 'max', 'sage_normalize': True, 'sage_project': False, 'lr': 0.004940422780188679, 'weight_decay': 7.456237813947039e-05, 'epochs': 146, 'loss': 'mse', 'optimizer': 'adam', 'graph_mode': 'cutoff', 'cutoff': 0.3521420859463843, 'grm_norm': 'cosine_then_gcn', 'self_loops': False, 'use_snp_selection': False}. Best is trial 25 with value: 0.3188787143064953.
[I 2025-12-09 03:36:45,120] Trial 60 finished with value: 0.31721766639385285 and parameters: {'model_type': 'graphsage', 'hidden_dims': '[512, 128]', 'dropout': 0.4570389793517639, 'batch_norm': True, 'sage_aggr': 'mean', 'sage_normalize': True, 'sage_project': False, 'lr': 0.0017786349480771674, 'weight_decay': 2.9273715444323974e-06, 'epochs': 348, 'loss': 'mse', 'optimizer': 'adam', 'graph_mode': 'cutoff', 'cutoff': 0.7123976716031688, 'grm_norm': 'gcn', 'self_loops': False, 'use_snp_selection': False}. Best is trial 25 with value: 0.3188787143064953.
[I 2025-12-09 03:39:10,336] Trial 61 finished with value: 0.317435699478552 and parameters: {'model_type': 'graphsage', 'hidden_dims': '[512, 128]', 'dropout': 0.4641747056184622, 'batch_norm': True, 'sage_aggr': 'mean', 'sage_normalize': True, 'sage_project': False, 'lr': 0.0018712389167683658, 'weight_decay': 8.190384198857412e-06, 'epochs': 338, 'loss': 'mse', 'optimizer': 'adam', 'graph_mode': 'cutoff', 'cutoff': 0.6702767197428752, 'grm_norm': 'gcn', 'self_loops': False, 'use_snp_selection': False}. Best is trial 25 with value: 0.3188787143064953.
[I 2025-12-09 03:41:39,958] Trial 62 finished with value: 0.3123217945632236 and parameters: {'model_type': 'graphsage', 'hidden_dims': '[512, 128]', 'dropout': 0.45801222948160364, 'batch_norm': True, 'sage_aggr': 'mean', 'sage_normalize': True, 'sage_project': False, 'lr': 0.0018865330904017574, 'weight_decay': 7.552063791462092e-07, 'epochs': 349, 'loss': 'mse', 'optimizer': 'adam', 'graph_mode': 'cutoff', 'cutoff': 0.6633093657617901, 'grm_norm': 'gcn', 'self_loops': False, 'use_snp_selection': False}. Best is trial 25 with value: 0.3188787143064953.
[I 2025-12-09 03:43:57,130] Trial 63 finished with value: 0.31425652809976157 and parameters: {'model_type': 'graphsage', 'hidden_dims': '[512, 128]', 'dropout': 0.41147020097936554, 'batch_norm': True, 'sage_aggr': 'mean', 'sage_normalize': True, 'sage_project': False, 'lr': 0.0029001951064349103, 'weight_decay': 2.2729746859962523e-06, 'epochs': 318, 'loss': 'mse', 'optimizer': 'adam', 'graph_mode': 'cutoff', 'cutoff': 0.7174869039734957, 'grm_norm': 'gcn', 'self_loops': False, 'use_snp_selection': False}. Best is trial 25 with value: 0.3188787143064953.
[I 2025-12-09 03:46:25,332] Trial 64 finished with value: 0.3207850829272738 and parameters: {'model_type': 'graphsage', 'hidden_dims': '[512, 128]', 'dropout': 0.3952342895252766, 'batch_norm': True, 'sage_aggr': 'mean', 'sage_normalize': True, 'sage_project': False, 'lr': 0.00903525339034544, 'weight_decay': 2.947897805101377e-06, 'epochs': 347, 'loss': 'mse', 'optimizer': 'adam', 'graph_mode': 'cutoff', 'cutoff': 0.7535465097109537, 'grm_norm': 'gcn', 'self_loops': False, 'use_snp_selection': False}. Best is trial 64 with value: 0.3207850829272738.
[I 2025-12-09 03:47:50,660] Trial 65 finished with value: 0.3115112373370733 and parameters: {'model_type': 'graphsage', 'hidden_dims': '[256, 128]', 'dropout': 0.43403301496906505, 'batch_norm': True, 'sage_aggr': 'mean', 'sage_normalize': True, 'sage_project': False, 'lr': 0.009672784854387396, 'weight_decay': 3.0894089549951266e-06, 'epochs': 347, 'loss': 'mse', 'optimizer': 'adam', 'graph_mode': 'cutoff', 'cutoff': 0.7941620899539326, 'grm_norm': 'gcn', 'self_loops': False, 'use_snp_selection': False}. Best is trial 64 with value: 0.3207850829272738.
[I 2025-12-09 03:48:42,167] Trial 66 finished with value: 0.3171378940967521 and parameters: {'model_type': 'graphsage', 'hidden_dims': '[128, 64]', 'dropout': 0.39339838759042595, 'batch_norm': True, 'sage_aggr': 'max', 'sage_normalize': True, 'sage_project': False, 'lr': 0.002181720860754313, 'weight_decay': 1.2117774608991561e-06, 'epochs': 322, 'loss': 'mse', 'optimizer': 'adam', 'graph_mode': 'cutoff', 'cutoff': 0.7590513847346926, 'grm_norm': 'gcn', 'self_loops': False, 'use_snp_selection': False}. Best is trial 64 with value: 0.3207850829272738.
[I 2025-12-09 03:51:06,565] Trial 67 finished with value: 0.3169245320117295 and parameters: {'model_type': 'graphsage', 'hidden_dims': '[512, 128]', 'dropout': 0.46173368483906135, 'batch_norm': True, 'sage_aggr': 'mean', 'sage_normalize': True, 'sage_project': False, 'lr': 0.004767225743710806, 'weight_decay': 3.5086295649086388e-06, 'epochs': 337, 'loss': 'mse', 'optimizer': 'adam', 'graph_mode': 'cutoff', 'cutoff': 0.7200487499784294, 'grm_norm': 'gcn', 'self_loops': False, 'use_snp_selection': False}. Best is trial 64 with value: 0.3207850829272738.
[I 2025-12-09 03:53:06,534] Trial 68 finished with value: 0.28484590290223333 and parameters: {'model_type': 'graphsage', 'hidden_dims': '[256, 128, 64]', 'dropout': 0.371677605262963, 'batch_norm': True, 'sage_aggr': 'max', 'sage_normalize': False, 'sage_project': False, 'lr': 0.006526401184881323, 'weight_decay': 5.451275587928722e-06, 'epochs': 313, 'loss': 'mse', 'optimizer': 'adam', 'graph_mode': 'knn', 'knn_k': 6, 'weighted_edges': True, 'symmetrize_mode': 'mutual', 'self_loops': True, 'use_snp_selection': False}. Best is trial 64 with value: 0.3207850829272738.
[I 2025-12-09 03:54:33,251] Trial 69 finished with value: 0.3024244126391283 and parameters: {'model_type': 'graphsage', 'hidden_dims': '[256, 128]', 'dropout': 0.480729783565152, 'batch_norm': False, 'sage_aggr': 'mean', 'sage_normalize': True, 'sage_project': False, 'lr': 0.001506781774433153, 'weight_decay': 2.4145651944793053e-06, 'epochs': 331, 'loss': 'mse', 'optimizer': 'adam', 'graph_mode': 'cutoff', 'cutoff': 0.8539258606765353, 'grm_norm': 'gcn', 'self_loops': False, 'use_snp_selection': True, 'num_snps': 40971}. Best is trial 64 with value: 0.3207850829272738.
[I 2025-12-09 03:55:21,487] Trial 70 finished with value: 0.30425553667341776 and parameters: {'model_type': 'graphsage', 'hidden_dims': '[512, 256]', 'dropout': 0.1131036190131395, 'batch_norm': True, 'sage_aggr': 'mean', 'sage_normalize': True, 'sage_project': False, 'lr': 0.0031748076883915746, 'weight_decay': 7.39138186458112e-06, 'epochs': 92, 'loss': 'mse', 'optimizer': 'adam', 'graph_mode': 'cutoff', 'cutoff': 0.8733726382920373, 'grm_norm': 'gcn', 'self_loops': False, 'use_snp_selection': False}. Best is trial 64 with value: 0.3207850829272738.
[I 2025-12-09 03:56:14,330] Trial 71 finished with value: 0.3130259108667784 and parameters: {'model_type': 'graphsage', 'hidden_dims': '[128, 64]', 'dropout': 0.39232598123565654, 'batch_norm': True, 'sage_aggr': 'max', 'sage_normalize': True, 'sage_project': False, 'lr': 0.002286489184671609, 'weight_decay': 1.0043997309338627e-06, 'epochs': 332, 'loss': 'mse', 'optimizer': 'adam', 'graph_mode': 'cutoff', 'cutoff': 0.7442062835932018, 'grm_norm': 'gcn', 'self_loops': False, 'use_snp_selection': False}. Best is trial 64 with value: 0.3207850829272738.
[I 2025-12-09 03:57:04,139] Trial 72 finished with value: 0.31422320946519855 and parameters: {'model_type': 'graphsage', 'hidden_dims': '[128, 64]', 'dropout': 0.31337163255331707, 'batch_norm': True, 'sage_aggr': 'max', 'sage_normalize': True, 'sage_project': False, 'lr': 0.0008345393530783602, 'weight_decay': 1.7534377166732049e-06, 'epochs': 309, 'loss': 'mse', 'optimizer': 'adam', 'graph_mode': 'cutoff', 'cutoff': 0.7664897540578611, 'grm_norm': 'gcn', 'self_loops': False, 'use_snp_selection': False}. Best is trial 64 with value: 0.3207850829272738.
[I 2025-12-09 03:57:57,813] Trial 73 finished with value: 0.31094041209494355 and parameters: {'model_type': 'graphsage', 'hidden_dims': '[128, 64]', 'dropout': 0.4445113563388967, 'batch_norm': True, 'sage_aggr': 'max', 'sage_normalize': True, 'sage_project': False, 'lr': 0.008576843522937697, 'weight_decay': 3.423066121736124e-07, 'epochs': 339, 'loss': 'mse', 'optimizer': 'adam', 'graph_mode': 'cutoff', 'cutoff': 0.8030647448192682, 'grm_norm': 'gcn', 'self_loops': False, 'use_snp_selection': False}. Best is trial 64 with value: 0.3207850829272738.
[I 2025-12-09 03:58:49,771] Trial 74 finished with value: 0.31588211537368444 and parameters: {'model_type': 'graphsage', 'hidden_dims': '[128, 64]', 'dropout': 0.42244250096851754, 'batch_norm': True, 'sage_aggr': 'max', 'sage_normalize': True, 'sage_project': False, 'lr': 0.001785769030399883, 'weight_decay': 5.754980510316382e-07, 'epochs': 319, 'loss': 'mse', 'optimizer': 'adam', 'graph_mode': 'cutoff', 'cutoff': 0.7594466588476997, 'grm_norm': 'cosine_then_gcn', 'self_loops': False, 'use_snp_selection': False}. Best is trial 64 with value: 0.3207850829272738.
[I 2025-12-09 04:01:08,863] Trial 75 finished with value: 0.31324577870943376 and parameters: {'model_type': 'graphsage', 'hidden_dims': '[512, 128]', 'dropout': 0.39873733963355273, 'batch_norm': True, 'sage_aggr': 'max', 'sage_normalize': True, 'sage_project': False, 'lr': 0.004125632230906435, 'weight_decay': 8.54037911572162e-06, 'epochs': 323, 'loss': 'mse', 'optimizer': 'adam', 'graph_mode': 'cutoff', 'cutoff': 0.6442288276502706, 'grm_norm': 'gcn', 'self_loops': False, 'use_snp_selection': False}. Best is trial 64 with value: 0.3207850829272738.
[I 2025-12-09 04:03:18,975] Trial 76 finished with value: 0.3146809831017849 and parameters: {'model_type': 'graphsage', 'hidden_dims': '[512, 64]', 'dropout': 0.45060856496430896, 'batch_norm': True, 'sage_aggr': 'max', 'sage_normalize': True, 'sage_project': False, 'lr': 0.005588959902287396, 'weight_decay': 1.665668254686908e-06, 'epochs': 303, 'loss': 'mse', 'optimizer': 'adam', 'graph_mode': 'cutoff', 'cutoff': 0.8116300362658665, 'grm_norm': 'gcn', 'self_loops': False, 'use_snp_selection': False}. Best is trial 64 with value: 0.3207850829272738.
[I 2025-12-09 04:04:40,812] Trial 77 finished with value: 0.3024266842585415 and parameters: {'model_type': 'graphsage', 'hidden_dims': '[256, 128]', 'dropout': 0.340073047255587, 'batch_norm': True, 'sage_aggr': 'mean', 'sage_normalize': True, 'sage_project': False, 'lr': 0.0013591785881945963, 'weight_decay': 1.26442956536846e-06, 'epochs': 327, 'loss': 'mae', 'optimizer': 'adam', 'graph_mode': 'cutoff', 'cutoff': 0.7091938048938837, 'grm_norm': 'cosine_then_gcn', 'self_loops': False, 'use_snp_selection': False}. Best is trial 64 with value: 0.3207850829272738.
[I 2025-12-09 04:07:05,836] Trial 78 finished with value: 0.3172084370556142 and parameters: {'model_type': 'graphsage', 'hidden_dims': '[512, 128]', 'dropout': 0.3861962541945021, 'batch_norm': True, 'sage_aggr': 'max', 'sage_normalize': True, 'sage_project': False, 'lr': 0.002345254491757668, 'weight_decay': 5.495090952360008e-06, 'epochs': 341, 'loss': 'mse', 'optimizer': 'adam', 'graph_mode': 'cutoff', 'cutoff': 0.8412473418271109, 'grm_norm': 'gcn', 'self_loops': False, 'use_snp_selection': False}. Best is trial 64 with value: 0.3207850829272738.
[I 2025-12-09 04:09:32,786] Trial 79 finished with value: 0.31442239421223384 and parameters: {'model_type': 'graphsage', 'hidden_dims': '[512, 128]', 'dropout': 0.509212774034171, 'batch_norm': True, 'sage_aggr': 'mean', 'sage_normalize': True, 'sage_project': False, 'lr': 0.005926664410210955, 'weight_decay': 5.109071032390663e-06, 'epochs': 344, 'loss': 'mse', 'optimizer': 'adam', 'graph_mode': 'cutoff', 'cutoff': 0.8367266975782253, 'grm_norm': 'gcn', 'self_loops': False, 'use_snp_selection': False}. Best is trial 64 with value: 0.3207850829272738.
[I 2025-12-09 04:12:27,108] Trial 80 finished with value: 0.3106277419353787 and parameters: {'model_type': 'graphsage', 'hidden_dims': '[512, 128]', 'dropout': 0.38180776956490614, 'batch_norm': True, 'sage_aggr': 'mean', 'sage_normalize': True, 'sage_project': False, 'lr': 0.008915259941101457, 'weight_decay': 5.745318219970155e-06, 'epochs': 284, 'loss': 'mse', 'optimizer': 'adam', 'graph_mode': 'knn', 'knn_k': 5, 'weighted_edges': False, 'symmetrize_mode': 'union', 'self_loops': True, 'use_snp_selection': False}. Best is trial 64 with value: 0.3207850829272738.
[I 2025-12-09 04:14:51,869] Trial 81 finished with value: 0.3159240493136979 and parameters: {'model_type': 'graphsage', 'hidden_dims': '[512, 128]', 'dropout': 0.41666002386883916, 'batch_norm': True, 'sage_aggr': 'max', 'sage_normalize': True, 'sage_project': False, 'lr': 0.0024215512551539324, 'weight_decay': 2.706503050822861e-06, 'epochs': 340, 'loss': 'mse', 'optimizer': 'adam', 'graph_mode': 'cutoff', 'cutoff': 0.8729527070103262, 'grm_norm': 'gcn', 'self_loops': False, 'use_snp_selection': False}. Best is trial 64 with value: 0.3207850829272738.
[I 2025-12-09 04:15:27,020] Trial 82 finished with value: 0.3181040202880377 and parameters: {'model_type': 'graphsage', 'hidden_dims': '[512, 128]', 'dropout': 0.4647413201977287, 'batch_norm': True, 'sage_aggr': 'max', 'sage_normalize': True, 'sage_project': False, 'lr': 0.004486979759404467, 'weight_decay': 3.1980236725034734e-06, 'epochs': 59, 'loss': 'mse', 'optimizer': 'adam', 'graph_mode': 'cutoff', 'cutoff': 0.7818350126387641, 'grm_norm': 'gcn', 'self_loops': False, 'use_snp_selection': False}. Best is trial 64 with value: 0.3207850829272738.
[I 2025-12-09 04:16:20,852] Trial 83 finished with value: 0.31414886396715525 and parameters: {'model_type': 'graphsage', 'hidden_dims': '[512, 128]', 'dropout': 0.46547160632317375, 'batch_norm': True, 'sage_aggr': 'max', 'sage_normalize': True, 'sage_project': False, 'lr': 0.004318560495249688, 'weight_decay': 3.652538907175697e-06, 'epochs': 107, 'loss': 'mse', 'optimizer': 'adam', 'graph_mode': 'cutoff', 'cutoff': 0.7853224211029612, 'grm_norm': 'gcn', 'self_loops': False, 'use_snp_selection': False}. Best is trial 64 with value: 0.3207850829272738.
[I 2025-12-09 04:17:02,592] Trial 84 finished with value: 0.31393950518151903 and parameters: {'model_type': 'graphsage', 'hidden_dims': '[512, 128]', 'dropout': 0.4852416221134366, 'batch_norm': True, 'sage_aggr': 'max', 'sage_normalize': True, 'sage_project': False, 'lr': 0.003637502649148299, 'weight_decay': 1.1961848404867155e-05, 'epochs': 76, 'loss': 'mse', 'optimizer': 'adam', 'graph_mode': 'cutoff', 'cutoff': 0.8986496798834298, 'grm_norm': 'gcn', 'self_loops': False, 'use_snp_selection': False}. Best is trial 64 with value: 0.3207850829272738.
[I 2025-12-09 04:17:35,610] Trial 85 finished with value: 0.29743214305655935 and parameters: {'model_type': 'graphsage', 'hidden_dims': '[512, 128]', 'dropout': 0.43226224686222176, 'batch_norm': True, 'sage_aggr': 'max', 'sage_normalize': True, 'sage_project': False, 'lr': 0.007883778139279072, 'weight_decay': 9.022126606331407e-06, 'epochs': 51, 'loss': 'mse', 'optimizer': 'adam', 'graph_mode': 'cutoff', 'cutoff': 0.8382257671063874, 'grm_norm': 'cosine_then_gcn', 'self_loops': False, 'use_snp_selection': False}. Best is trial 64 with value: 0.3207850829272738.
[I 2025-12-09 04:18:35,590] Trial 86 finished with value: 0.2986626890732734 and parameters: {'model_type': 'graphsage', 'hidden_dims': '[512, 128]', 'dropout': 0.4450665235816415, 'batch_norm': False, 'sage_aggr': 'max', 'sage_normalize': True, 'sage_project': False, 'lr': 0.003076871904066926, 'weight_decay': 1.6317255598200926e-05, 'epochs': 123, 'loss': 'mse', 'optimizer': 'adam', 'graph_mode': 'cutoff', 'cutoff': 0.8159915508979856, 'grm_norm': 'gcn', 'self_loops': False, 'use_snp_selection': False}. Best is trial 64 with value: 0.3207850829272738.
[I 2025-12-09 04:19:12,934] Trial 87 finished with value: 0.3021787119200886 and parameters: {'model_type': 'graphsage', 'hidden_dims': '[512, 128]', 'dropout': 0.46952842253782706, 'batch_norm': True, 'sage_aggr': 'mean', 'sage_normalize': False, 'sage_project': False, 'lr': 0.005101020523660028, 'weight_decay': 3.0989461919744445e-06, 'epochs': 66, 'loss': 'mse', 'optimizer': 'adam', 'graph_mode': 'cutoff', 'cutoff': 0.87926593813747, 'grm_norm': 'gcn', 'self_loops': False, 'use_snp_selection': True, 'num_snps': 16295}. Best is trial 64 with value: 0.3207850829272738.
[I 2025-12-09 04:20:32,206] Trial 88 finished with value: 0.31224506791799184 and parameters: {'model_type': 'graphsage', 'hidden_dims': '[512, 128]', 'dropout': 0.3621578266652828, 'batch_norm': True, 'sage_aggr': 'max', 'sage_normalize': True, 'sage_project': False, 'lr': 0.006548196827486746, 'weight_decay': 0.00023194532887062382, 'epochs': 170, 'loss': 'mse', 'optimizer': 'adam', 'graph_mode': 'cutoff', 'cutoff': 0.8455603106567915, 'grm_norm': 'cosine_then_gcn', 'self_loops': False, 'use_snp_selection': False}. Best is trial 64 with value: 0.3207850829272738.
