[I 2025-12-08 17:56:49,949] Trial 5 finished with value: 0.2779840084292653 and parameters: {'model_type': 'graphsage', 'hidden_dims': '[512, 64]', 'dropout': 0.14505336736221927, 'batch_norm': True, 'sage_aggr': 'mean', 'sage_normalize': True, 'sage_project': False, 'lr': 1.2962030165732234e-05, 'weight_decay': 1.326598071105465e-07, 'epochs': 180, 'loss': 'mse', 'optimizer': 'adam', 'graph_mode': 'knn', 'knn_k': 9, 'weighted_edges': True, 'symmetrize_mode': 'mutual', 'self_loops': False, 'use_snp_selection': False}. Best is trial 3 with value: 0.29717962944102083.
[I 2025-12-08 17:57:43,173] Trial 6 finished with value: 0.2907996212532372 and parameters: {'model_type': 'graphsage', 'hidden_dims': '[256, 128, 64]', 'dropout': 0.10731743755162496, 'batch_norm': True, 'sage_aggr': 'mean', 'sage_normalize': False, 'sage_project': False, 'lr': 1.922990426933137e-05, 'weight_decay': 7.30001060446905e-05, 'epochs': 63, 'loss': 'mae', 'optimizer': 'adam', 'graph_mode': 'cutoff', 'cutoff': 0.7624978434202536, 'grm_norm': 'none', 'self_loops': True, 'use_snp_selection': True, 'num_snps': 50106}. Best is trial 3 with value: 0.29717962944102083.
[I 2025-12-08 17:59:38,285] Trial 7 finished with value: 0.28624983975196533 and parameters: {'model_type': 'graphsage', 'hidden_dims': '[512, 64]', 'dropout': 0.2585007811528941, 'batch_norm': True, 'sage_aggr': 'max', 'sage_normalize': True, 'sage_project': False, 'lr': 5.921425508303391e-05, 'weight_decay': 0.0004511561961144237, 'epochs': 182, 'loss': 'mae', 'optimizer': 'adam', 'graph_mode': 'knn', 'knn_k': 9, 'weighted_edges': True, 'symmetrize_mode': 'union', 'self_loops': False, 'use_snp_selection': True, 'num_snps': 23903}. Best is trial 3 with value: 0.29717962944102083.
[I 2025-12-08 18:00:20,125] Trial 8 finished with value: 0.2635008615662366 and parameters: {'model_type': 'graphsage', 'hidden_dims': '[512, 256]', 'dropout': 0.3061380386767003, 'batch_norm': False, 'sage_aggr': 'mean', 'sage_normalize': True, 'sage_project': False, 'lr': 0.000698401460570184, 'weight_decay': 2.965560055460244e-06, 'epochs': 289, 'loss': 'mae', 'optimizer': 'adam', 'graph_mode': 'knn', 'knn_k': 7, 'weighted_edges': False, 'symmetrize_mode': 'mutual', 'self_loops': True, 'use_snp_selection': True, 'num_snps': 4710}. Best is trial 3 with value: 0.29717962944102083.
[I 2025-12-08 18:03:58,265] Trial 9 finished with value: 0.29662658773449896 and parameters: {'model_type': 'graphsage', 'hidden_dims': '[512, 128]', 'dropout': 0.1733844071393634, 'batch_norm': False, 'sage_aggr': 'mean', 'sage_normalize': True, 'sage_project': False, 'lr': 0.0004269677918501597, 'weight_decay': 2.2439779626249696e-06, 'epochs': 319, 'loss': 'mse', 'optimizer': 'adam', 'graph_mode': 'cutoff', 'cutoff': 0.24117565767129295, 'grm_norm': 'cosine_then_gcn', 'self_loops': True, 'use_snp_selection': False}. Best is trial 3 with value: 0.29717962944102083.
[I 2025-12-08 18:05:04,706] Trial 10 finished with value: 0.2960886787340507 and parameters: {'model_type': 'graphsage', 'hidden_dims': '[256, 128, 64]', 'dropout': 0.5062131504581071, 'batch_norm': True, 'sage_aggr': 'max', 'sage_normalize': False, 'sage_project': False, 'lr': 0.0060050040216813455, 'weight_decay': 1.5886244399072472e-05, 'epochs': 258, 'loss': 'mse', 'optimizer': 'adam', 'graph_mode': 'cutoff', 'cutoff': 0.6388703494956212, 'grm_norm': 'none', 'self_loops': True, 'use_snp_selection': False}. Best is trial 3 with value: 0.29717962944102083.
[I 2025-12-08 18:09:08,724] Trial 11 finished with value: 0.2971466211546809 and parameters: {'model_type': 'graphsage', 'hidden_dims': '[512, 128]', 'dropout': 0.4501982574362273, 'batch_norm': False, 'sage_aggr': 'mean', 'sage_normalize': True, 'sage_project': False, 'lr': 0.001954403550457137, 'weight_decay': 3.1089956258459618e-06, 'epochs': 340, 'loss': 'mse', 'optimizer': 'adam', 'graph_mode': 'cutoff', 'cutoff': 0.22423238384038807, 'grm_norm': 'cosine_then_gcn', 'self_loops': True, 'use_snp_selection': False}. Best is trial 3 with value: 0.29717962944102083.
[I 2025-12-08 18:10:56,313] Trial 12 finished with value: 0.300543960493207 and parameters: {'model_type': 'graphsage', 'hidden_dims': '[256, 128]', 'dropout': 0.45056085137293955, 'batch_norm': False, 'sage_aggr': 'mean', 'sage_normalize': True, 'sage_project': False, 'lr': 0.0038028429660261023, 'weight_decay': 6.372026470830696e-06, 'epochs': 347, 'loss': 'mse', 'optimizer': 'adam', 'graph_mode': 'cutoff', 'cutoff': 0.3969215433583027, 'grm_norm': 'cosine', 'self_loops': True, 'use_snp_selection': False}. Best is trial 12 with value: 0.300543960493207.
[I 2025-12-08 18:12:19,936] Trial 13 finished with value: -0.013766267570579947 and parameters: {'model_type': 'graphsage', 'hidden_dims': '[256, 128]', 'dropout': 0.4145198714010831, 'batch_norm': False, 'sage_aggr': 'mean', 'sage_normalize': False, 'sage_project': False, 'lr': 0.009275936594161257, 'weight_decay': 1.0145988427477464e-05, 'epochs': 294, 'loss': 'mse', 'optimizer': 'adam', 'graph_mode': 'cutoff', 'cutoff': 0.4988063465751651, 'grm_norm': 'cosine', 'self_loops': True, 'use_snp_selection': False}. Best is trial 12 with value: 0.300543960493207.
[I 2025-12-08 18:14:14,451] Trial 14 finished with value: 0.29272397060487443 and parameters: {'model_type': 'graphsage', 'hidden_dims': '[256, 128]', 'dropout': 0.5815362475260375, 'batch_norm': True, 'sage_aggr': 'max', 'sage_normalize': False, 'sage_project': False, 'lr': 0.001856830722907636, 'weight_decay': 5.732655810822652e-07, 'epochs': 348, 'loss': 'mse', 'optimizer': 'adam', 'graph_mode': 'cutoff', 'cutoff': 0.38353142660006384, 'grm_norm': 'cosine', 'self_loops': True, 'use_snp_selection': False}. Best is trial 12 with value: 0.300543960493207.
[I 2025-12-08 18:15:17,513] Trial 15 finished with value: 0.270133362750273 and parameters: {'model_type': 'graphsage', 'hidden_dims': '[256, 128]', 'dropout': 0.39245293310246443, 'batch_norm': False, 'sage_aggr': 'mean', 'sage_normalize': True, 'sage_project': False, 'lr': 0.00011913083078675243, 'weight_decay': 2.6631608878877618e-05, 'epochs': 241, 'loss': 'mse', 'optimizer': 'adam', 'graph_mode': 'cutoff', 'cutoff': 0.6724829004395092, 'grm_norm': 'cosine', 'self_loops': True, 'use_snp_selection': False}. Best is trial 12 with value: 0.300543960493207.
[I 2025-12-08 18:16:52,875] Trial 16 finished with value: 0.0 and parameters: {'model_type': 'graphsage', 'hidden_dims': '[256, 128, 64]', 'dropout': 0.48798155958903217, 'batch_norm': False, 'sage_aggr': 'max', 'sage_normalize': False, 'sage_project': False, 'lr': 0.002337626668720967, 'weight_decay': 5.6502360736040865e-06, 'epochs': 292, 'loss': 'mse', 'optimizer': 'adam', 'graph_mode': 'cutoff', 'cutoff': 0.43198139357372706, 'grm_norm': 'none', 'self_loops': True, 'use_snp_selection': False}. Best is trial 12 with value: 0.300543960493207.
[I 2025-12-08 18:17:20,692] Trial 17 finished with value: 0.29896010114235666 and parameters: {'model_type': 'graphsage', 'hidden_dims': '[256, 128]', 'dropout': 0.3770566809927346, 'batch_norm': True, 'sage_aggr': 'mean', 'sage_normalize': True, 'sage_project': False, 'lr': 0.00016869951012262287, 'weight_decay': 6.417555187021338e-07, 'epochs': 82, 'loss': 'mse', 'optimizer': 'adam', 'graph_mode': 'cutoff', 'cutoff': 0.8811737457687434, 'grm_norm': 'gcn', 'self_loops': True, 'use_snp_selection': False}. Best is trial 12 with value: 0.300543960493207.
[I 2025-12-08 18:17:44,214] Trial 18 finished with value: 0.2969221897458284 and parameters: {'model_type': 'graphsage', 'hidden_dims': '[256, 128]', 'dropout': 0.5627998404527484, 'batch_norm': True, 'sage_aggr': 'mean', 'sage_normalize': True, 'sage_project': False, 'lr': 0.00018134509781648193, 'weight_decay': 1.088034890829557e-07, 'epochs': 62, 'loss': 'mse', 'optimizer': 'adam', 'graph_mode': 'cutoff', 'cutoff': 0.8969895854832463, 'grm_norm': 'gcn', 'self_loops': False, 'use_snp_selection': False}. Best is trial 12 with value: 0.300543960493207.
[I 2025-12-08 18:18:23,886] Trial 19 finished with value: 0.2759955598914513 and parameters: {'model_type': 'graphsage', 'hidden_dims': '[256, 128]', 'dropout': 0.39465048502780875, 'batch_norm': False, 'sage_aggr': 'mean', 'sage_normalize': True, 'sage_project': False, 'lr': 0.0008516967444202582, 'weight_decay': 5.72970554457094e-07, 'epochs': 101, 'loss': 'mse', 'optimizer': 'adam', 'graph_mode': 'cutoff', 'cutoff': 0.36158487603647665, 'grm_norm': 'gcn', 'self_loops': True, 'use_snp_selection': False}. Best is trial 12 with value: 0.300543960493207.
[I 2025-12-08 18:18:56,977] Trial 20 finished with value: 0.2901859237934486 and parameters: {'model_type': 'graphsage', 'hidden_dims': '[256, 128]', 'dropout': 0.5032298233369006, 'batch_norm': False, 'sage_aggr': 'mean', 'sage_normalize': True, 'sage_project': False, 'lr': 0.003748434012913006, 'weight_decay': 1.1580977576614146e-06, 'epochs': 102, 'loss': 'mse', 'optimizer': 'adam', 'graph_mode': 'cutoff', 'cutoff': 0.818490924702199, 'grm_norm': 'cosine', 'self_loops': True, 'use_snp_selection': False}. Best is trial 12 with value: 0.300543960493207.
[I 2025-12-08 18:19:54,622] Trial 21 finished with value: 0.2971948207206751 and parameters: {'model_type': 'graphsage', 'hidden_dims': '[256, 128, 64]', 'dropout': 0.3542863094491655, 'batch_norm': True, 'sage_aggr': 'mean', 'sage_normalize': True, 'sage_project': False, 'lr': 2.336077217528726e-05, 'weight_decay': 6.42710958976235e-06, 'epochs': 214, 'loss': 'mse', 'optimizer': 'adam', 'graph_mode': 'cutoff', 'cutoff': 0.6159252210032479, 'grm_norm': 'gcn', 'self_loops': True, 'use_snp_selection': False}. Best is trial 12 with value: 0.300543960493207.
[I 2025-12-08 18:20:51,358] Trial 22 finished with value: 0.29876722575700565 and parameters: {'model_type': 'graphsage', 'hidden_dims': '[256, 128]', 'dropout': 0.4250140871490006, 'batch_norm': True, 'sage_aggr': 'mean', 'sage_normalize': True, 'sage_project': False, 'lr': 3.193869940152672e-05, 'weight_decay': 2.6211180308920934e-07, 'epochs': 215, 'loss': 'mse', 'optimizer': 'adam', 'graph_mode': 'cutoff', 'cutoff': 0.7237542470166393, 'grm_norm': 'gcn', 'self_loops': True, 'use_snp_selection': False}. Best is trial 12 with value: 0.300543960493207.
[I 2025-12-08 18:21:24,473] Trial 23 finished with value: 0.29808829913762447 and parameters: {'model_type': 'graphsage', 'hidden_dims': '[256, 128]', 'dropout': 0.45489865608831603, 'batch_norm': True, 'sage_aggr': 'mean', 'sage_normalize': True, 'sage_project': False, 'lr': 0.00015470167973841004, 'weight_decay': 3.464323895206319e-07, 'epochs': 106, 'loss': 'mse', 'optimizer': 'adam', 'graph_mode': 'cutoff', 'cutoff': 0.7826826137709497, 'grm_norm': 'gcn', 'self_loops': True, 'use_snp_selection': False}. Best is trial 12 with value: 0.300543960493207.
[I 2025-12-08 18:21:43,625] Trial 24 finished with value: 0.2959691128534151 and parameters: {'model_type': 'graphsage', 'hidden_dims': '[256, 128]', 'dropout': 0.4366416748205378, 'batch_norm': True, 'sage_aggr': 'mean', 'sage_normalize': True, 'sage_project': False, 'lr': 4.552735566412479e-05, 'weight_decay': 1.9400737948100775e-07, 'epochs': 41, 'loss': 'mse', 'optimizer': 'adam', 'graph_mode': 'cutoff', 'cutoff': 0.7138028663456966, 'grm_norm': 'gcn', 'self_loops': True, 'use_snp_selection': False}. Best is trial 12 with value: 0.300543960493207.
[I 2025-12-08 18:22:20,564] Trial 25 finished with value: 0.3024842387304095 and parameters: {'model_type': 'graphsage', 'hidden_dims': '[256, 128]', 'dropout': 0.3803071492192019, 'batch_norm': True, 'sage_aggr': 'mean', 'sage_normalize': True, 'sage_project': False, 'lr': 0.0002086584857511446, 'weight_decay': 2.8420709208629965e-07, 'epochs': 124, 'loss': 'mse', 'optimizer': 'adam', 'graph_mode': 'cutoff', 'cutoff': 0.8989584788414543, 'grm_norm': 'gcn', 'self_loops': True, 'use_snp_selection': False}. Best is trial 25 with value: 0.3024842387304095.
[I 2025-12-08 18:22:57,880] Trial 26 finished with value: 0.30177319934732016 and parameters: {'model_type': 'graphsage', 'hidden_dims': '[256, 128]', 'dropout': 0.3710100582376871, 'batch_norm': True, 'sage_aggr': 'mean', 'sage_normalize': True, 'sage_project': False, 'lr': 0.00022259276617680557, 'weight_decay': 1.594795498848534e-06, 'epochs': 121, 'loss': 'mse', 'optimizer': 'adam', 'graph_mode': 'cutoff', 'cutoff': 0.8782042878925869, 'grm_norm': 'cosine', 'self_loops': True, 'use_snp_selection': False}. Best is trial 25 with value: 0.3024842387304095.
[I 2025-12-08 18:23:36,272] Trial 27 finished with value: 0.295634715966154 and parameters: {'model_type': 'graphsage', 'hidden_dims': '[256, 128]', 'dropout': 0.5315887643117994, 'batch_norm': True, 'sage_aggr': 'mean', 'sage_normalize': True, 'sage_project': False, 'lr': 0.0009126975183395609, 'weight_decay': 1.6146197496954476e-06, 'epochs': 126, 'loss': 'mae', 'optimizer': 'adam', 'graph_mode': 'cutoff', 'cutoff': 0.8367224905267698, 'grm_norm': 'cosine', 'self_loops': False, 'use_snp_selection': False}. Best is trial 25 with value: 0.3024842387304095.
[I 2025-12-08 18:24:13,409] Trial 28 finished with value: 0.2639110745393789 and parameters: {'model_type': 'graphsage', 'hidden_dims': '[128, 64]', 'dropout': 0.3041667300207728, 'batch_norm': False, 'sage_aggr': 'mean', 'sage_normalize': True, 'sage_project': False, 'lr': 0.0002461334150133666, 'weight_decay': 3.7479891399539197e-06, 'epochs': 130, 'loss': 'mse', 'optimizer': 'adam', 'graph_mode': 'cutoff', 'cutoff': 0.34535563630920185, 'grm_norm': 'cosine', 'self_loops': True, 'use_snp_selection': False}. Best is trial 25 with value: 0.3024842387304095.
[I 2025-12-08 18:26:00,982] Trial 29 finished with value: 0.3014242059555008 and parameters: {'model_type': 'graphsage', 'hidden_dims': '[512, 256]', 'dropout': 0.46595636914924243, 'batch_norm': True, 'sage_aggr': 'mean', 'sage_normalize': True, 'sage_project': False, 'lr': 0.00027362399860581595, 'weight_decay': 7.874407945982016e-05, 'epochs': 188, 'loss': 'mse', 'optimizer': 'adam', 'graph_mode': 'knn', 'knn_k': 3, 'weighted_edges': False, 'symmetrize_mode': 'union', 'self_loops': True, 'use_snp_selection': False}. Best is trial 25 with value: 0.3024842387304095.
[I 2025-12-08 18:27:43,532] Trial 30 finished with value: 0.29440177779806326 and parameters: {'model_type': 'graphsage', 'hidden_dims': '[512, 256]', 'dropout': 0.21297688839842024, 'batch_norm': True, 'sage_aggr': 'mean', 'sage_normalize': True, 'sage_project': False, 'lr': 0.0002742543914563315, 'weight_decay': 9.666988532358212e-05, 'epochs': 178, 'loss': 'mse', 'optimizer': 'adam', 'graph_mode': 'knn', 'knn_k': 3, 'weighted_edges': False, 'symmetrize_mode': 'union', 'self_loops': True, 'use_snp_selection': False}. Best is trial 25 with value: 0.3024842387304095.
[I 2025-12-08 18:29:48,598] Trial 31 finished with value: 0.29508749300619447 and parameters: {'model_type': 'graphsage', 'hidden_dims': '[512, 256]', 'dropout': 0.47866688435804156, 'batch_norm': True, 'sage_aggr': 'mean', 'sage_normalize': True, 'sage_project': False, 'lr': 8.4677253411872e-05, 'weight_decay': 2.023307042268497e-05, 'epochs': 209, 'loss': 'mse', 'optimizer': 'adam', 'graph_mode': 'knn', 'knn_k': 4, 'weighted_edges': False, 'symmetrize_mode': 'union', 'self_loops': True, 'use_snp_selection': False}. Best is trial 25 with value: 0.3024842387304095.
[I 2025-12-08 18:31:27,105] Trial 32 finished with value: 0.30193255352320075 and parameters: {'model_type': 'graphsage', 'hidden_dims': '[512, 256]', 'dropout': 0.4647285114341881, 'batch_norm': True, 'sage_aggr': 'mean', 'sage_normalize': True, 'sage_project': False, 'lr': 0.000595225986977958, 'weight_decay': 0.0001539700395559135, 'epochs': 159, 'loss': 'mse', 'optimizer': 'adam', 'graph_mode': 'knn', 'knn_k': 4, 'weighted_edges': False, 'symmetrize_mode': 'union', 'self_loops': True, 'use_snp_selection': False}. Best is trial 25 with value: 0.3024842387304095.
[I 2025-12-08 18:32:59,208] Trial 33 finished with value: 0.2973116708830741 and parameters: {'model_type': 'graphsage', 'hidden_dims': '[512, 256]', 'dropout': 0.5369659749813747, 'batch_norm': True, 'sage_aggr': 'mean', 'sage_normalize': True, 'sage_project': False, 'lr': 0.0005362477668236336, 'weight_decay': 0.0008811206253147814, 'epochs': 147, 'loss': 'mse', 'optimizer': 'adam', 'graph_mode': 'knn', 'knn_k': 4, 'weighted_edges': False, 'symmetrize_mode': 'union', 'self_loops': True, 'use_snp_selection': False}. Best is trial 25 with value: 0.3024842387304095.
[I 2025-12-08 18:36:06,570] Trial 34 finished with value: 0.30167844293097645 and parameters: {'model_type': 'graphsage', 'hidden_dims': '[512, 256]', 'dropout': 0.3825572118539246, 'batch_norm': True, 'sage_aggr': 'mean', 'sage_normalize': True, 'sage_project': False, 'lr': 0.001234003647265411, 'weight_decay': 0.00018092566511922325, 'epochs': 160, 'loss': 'mse', 'optimizer': 'adam', 'graph_mode': 'knn', 'knn_k': 5, 'weighted_edges': False, 'symmetrize_mode': 'union', 'self_loops': True, 'use_snp_selection': True, 'num_snps': 58870}. Best is trial 25 with value: 0.3024842387304095.
[I 2025-12-08 18:39:40,106] Trial 35 finished with value: 0.29855305087159717 and parameters: {'model_type': 'graphsage', 'hidden_dims': '[512, 256]', 'dropout': 0.3203969054323639, 'batch_norm': True, 'sage_aggr': 'mean', 'sage_normalize': True, 'sage_project': False, 'lr': 0.0011592781079182452, 'weight_decay': 0.0002112847444734008, 'epochs': 162, 'loss': 'mse', 'optimizer': 'adam', 'graph_mode': 'knn', 'knn_k': 6, 'weighted_edges': False, 'symmetrize_mode': 'union', 'self_loops': True, 'use_snp_selection': True, 'num_snps': 58973}. Best is trial 25 with value: 0.3024842387304095.
[I 2025-12-08 18:41:20,585] Trial 36 finished with value: 0.3048852938541998 and parameters: {'model_type': 'graphsage', 'hidden_dims': '[512, 256]', 'dropout': 0.366274501131113, 'batch_norm': True, 'sage_aggr': 'mean', 'sage_normalize': True, 'sage_project': False, 'lr': 0.001317524283713493, 'weight_decay': 0.0003737280546161926, 'epochs': 130, 'loss': 'mae', 'optimizer': 'adam', 'graph_mode': 'knn', 'knn_k': 5, 'weighted_edges': False, 'symmetrize_mode': 'union', 'self_loops': False, 'use_snp_selection': True, 'num_snps': 37346}. Best is trial 36 with value: 0.3048852938541998.
[I 2025-12-08 18:41:59,480] Trial 37 finished with value: 0.2903418626381614 and parameters: {'model_type': 'graphsage', 'hidden_dims': '[128, 64]', 'dropout': 0.3534183585545077, 'batch_norm': True, 'sage_aggr': 'mean', 'sage_normalize': True, 'sage_project': False, 'lr': 0.0005342466130707329, 'weight_decay': 0.0005814233651319514, 'epochs': 126, 'loss': 'mae', 'optimizer': 'adam', 'graph_mode': 'knn', 'knn_k': 5, 'weighted_edges': False, 'symmetrize_mode': 'union', 'self_loops': False, 'use_snp_selection': True, 'num_snps': 12935}. Best is trial 36 with value: 0.3048852938541998.
[I 2025-12-08 18:44:06,943] Trial 38 finished with value: 0.2933672055395924 and parameters: {'model_type': 'graphsage', 'hidden_dims': '[512, 64]', 'dropout': 0.2793198887923488, 'batch_norm': True, 'sage_aggr': 'max', 'sage_normalize': True, 'sage_project': False, 'lr': 8.837539168255106e-05, 'weight_decay': 0.00029858689648118263, 'epochs': 138, 'loss': 'mae', 'optimizer': 'adam', 'graph_mode': 'knn', 'knn_k': 7, 'weighted_edges': True, 'symmetrize_mode': 'union', 'self_loops': False, 'use_snp_selection': True, 'num_snps': 37994}. Best is trial 36 with value: 0.3048852938541998.
[I 2025-12-08 18:46:14,567] Trial 39 finished with value: 0.29927339399403297 and parameters: {'model_type': 'graphsage', 'hidden_dims': '[512, 256]', 'dropout': 0.36130510639107855, 'batch_norm': True, 'sage_aggr': 'mean', 'sage_normalize': True, 'sage_project': False, 'lr': 0.0003727098625316105, 'weight_decay': 4.670943153358254e-05, 'epochs': 114, 'loss': 'mae', 'optimizer': 'adam', 'graph_mode': 'knn', 'knn_k': 8, 'weighted_edges': False, 'symmetrize_mode': 'union', 'self_loops': False, 'use_snp_selection': True, 'num_snps': 42455}. Best is trial 36 with value: 0.3048852938541998.
[I 2025-12-08 18:46:58,978] Trial 40 finished with value: 0.2993532932876178 and parameters: {'model_type': 'graphsage', 'hidden_dims': '[512, 128]', 'dropout': 0.4083623910470345, 'batch_norm': True, 'sage_aggr': 'mean', 'sage_normalize': False, 'sage_project': False, 'lr': 0.0013268839809976035, 'weight_decay': 0.0003937705006539062, 'epochs': 76, 'loss': 'mae', 'optimizer': 'adam', 'graph_mode': 'knn', 'knn_k': 4, 'weighted_edges': False, 'symmetrize_mode': 'union', 'self_loops': False, 'use_snp_selection': True, 'num_snps': 18120}. Best is trial 36 with value: 0.3048852938541998.
[I 2025-12-08 18:49:48,998] Trial 41 finished with value: 0.29032177502751183 and parameters: {'model_type': 'graphsage', 'hidden_dims': '[512, 256]', 'dropout': 0.38552573219821185, 'batch_norm': True, 'sage_aggr': 'mean', 'sage_normalize': True, 'sage_project': False, 'lr': 0.0006232634929716139, 'weight_decay': 0.0001255411700573043, 'epochs': 160, 'loss': 'mae', 'optimizer': 'adam', 'graph_mode': 'knn', 'knn_k': 5, 'weighted_edges': False, 'symmetrize_mode': 'union', 'self_loops': False, 'use_snp_selection': True, 'num_snps': 57100}. Best is trial 36 with value: 0.3048852938541998.
[I 2025-12-08 18:52:05,189] Trial 42 finished with value: 0.29940963480942334 and parameters: {'model_type': 'graphsage', 'hidden_dims': '[512, 256]', 'dropout': 0.33175545125381656, 'batch_norm': True, 'sage_aggr': 'mean', 'sage_normalize': True, 'sage_project': False, 'lr': 0.001459494901433151, 'weight_decay': 0.00015338044544787176, 'epochs': 168, 'loss': 'mae', 'optimizer': 'adam', 'graph_mode': 'knn', 'knn_k': 5, 'weighted_edges': False, 'symmetrize_mode': 'union', 'self_loops': False, 'use_snp_selection': True, 'num_snps': 43440}. Best is trial 36 with value: 0.3048852938541998.
