[I 2025-12-10 08:44:42,836] Trial 126 finished with value: 0.31617949821183383 and parameters: {'model_type': 'graphsage', 'hidden_dims': '[512, 128]', 'dropout': 0.12411956609329558, 'batch_norm': True, 'sage_aggr': 'mean', 'sage_normalize': True, 'sage_project': False, 'lr': 0.004493214252468286, 'weight_decay': 9.823333781117242e-05, 'epochs': 300, 'loss': 'mse', 'optimizer': 'adam', 'graph_mode': 'knn', 'knn_k': 5, 'weighted_edges': False, 'symmetrize_mode': 'union', 'self_loops': True, 'use_snp_selection': True, 'num_snps': 54394}. Best is trial 124 with value: 0.3171584343467778.
[I 2025-12-10 08:49:44,038] Trial 127 finished with value: 0.3129761589754828 and parameters: {'model_type': 'graphsage', 'hidden_dims': '[512, 128]', 'dropout': 0.10514430187705842, 'batch_norm': True, 'sage_aggr': 'mean', 'sage_normalize': True, 'sage_project': False, 'lr': 0.006471580664432963, 'weight_decay': 0.00010282037999576873, 'epochs': 299, 'loss': 'mse', 'optimizer': 'adam', 'graph_mode': 'knn', 'knn_k': 4, 'weighted_edges': False, 'symmetrize_mode': 'union', 'self_loops': True, 'use_snp_selection': True, 'num_snps': 52990}. Best is trial 124 with value: 0.3171584343467778.
[I 2025-12-10 08:54:44,231] Trial 128 finished with value: 0.31356682863575036 and parameters: {'model_type': 'graphsage', 'hidden_dims': '[512, 128]', 'dropout': 0.10540692347801225, 'batch_norm': True, 'sage_aggr': 'mean', 'sage_normalize': True, 'sage_project': False, 'lr': 0.00792402874184542, 'weight_decay': 0.00010747870453028729, 'epochs': 301, 'loss': 'mse', 'optimizer': 'adam', 'graph_mode': 'knn', 'knn_k': 4, 'weighted_edges': False, 'symmetrize_mode': 'union', 'self_loops': True, 'use_snp_selection': True, 'num_snps': 54657}. Best is trial 124 with value: 0.3171584343467778.
[I 2025-12-10 08:59:50,186] Trial 129 finished with value: 0.3142044262362776 and parameters: {'model_type': 'graphsage', 'hidden_dims': '[512, 128]', 'dropout': 0.1035162097891446, 'batch_norm': True, 'sage_aggr': 'mean', 'sage_normalize': True, 'sage_project': False, 'lr': 0.008137722813196968, 'weight_decay': 9.523744104619263e-05, 'epochs': 301, 'loss': 'mse', 'optimizer': 'adam', 'graph_mode': 'knn', 'knn_k': 4, 'weighted_edges': False, 'symmetrize_mode': 'union', 'self_loops': True, 'use_snp_selection': True, 'num_snps': 54372}. Best is trial 124 with value: 0.3171584343467778.
[I 2025-12-10 09:05:10,125] Trial 130 finished with value: 0.2924910748335365 and parameters: {'model_type': 'graphsage', 'hidden_dims': '[512, 128]', 'dropout': 0.10135512612257463, 'batch_norm': True, 'sage_aggr': 'max', 'sage_normalize': True, 'sage_project': False, 'lr': 0.008141812343248754, 'weight_decay': 8.779903038761554e-05, 'epochs': 302, 'loss': 'mse', 'optimizer': 'adam', 'graph_mode': 'knn', 'knn_k': 4, 'weighted_edges': False, 'symmetrize_mode': 'union', 'self_loops': True, 'use_snp_selection': True, 'num_snps': 55175}. Best is trial 124 with value: 0.3171584343467778.
[I 2025-12-10 09:10:20,744] Trial 131 finished with value: 0.30966930601889286 and parameters: {'model_type': 'graphsage', 'hidden_dims': '[512, 128]', 'dropout': 0.11936323595171802, 'batch_norm': True, 'sage_aggr': 'mean', 'sage_normalize': True, 'sage_project': False, 'lr': 0.006305533348549522, 'weight_decay': 9.227500441706064e-05, 'epochs': 314, 'loss': 'mse', 'optimizer': 'adam', 'graph_mode': 'knn', 'knn_k': 4, 'weighted_edges': False, 'symmetrize_mode': 'union', 'self_loops': True, 'use_snp_selection': True, 'num_snps': 53521}. Best is trial 124 with value: 0.3171584343467778.
[I 2025-12-10 09:15:14,502] Trial 132 finished with value: 0.29371379460046476 and parameters: {'model_type': 'graphsage', 'hidden_dims': '[512, 128]', 'dropout': 0.13131184407180582, 'batch_norm': True, 'sage_aggr': 'mean', 'sage_normalize': True, 'sage_project': False, 'lr': 0.008608976733754414, 'weight_decay': 0.00023385587340131591, 'epochs': 299, 'loss': 'mse', 'optimizer': 'adam', 'graph_mode': 'knn', 'knn_k': 4, 'weighted_edges': False, 'symmetrize_mode': 'union', 'self_loops': True, 'use_snp_selection': True, 'num_snps': 53493}. Best is trial 124 with value: 0.3171584343467778.
[I 2025-12-10 09:19:51,858] Trial 133 finished with value: 0.3170276107727935 and parameters: {'model_type': 'graphsage', 'hidden_dims': '[512, 128]', 'dropout': 0.11796270689759313, 'batch_norm': True, 'sage_aggr': 'mean', 'sage_normalize': True, 'sage_project': False, 'lr': 0.004539796811018607, 'weight_decay': 0.00010720522344128159, 'epochs': 320, 'loss': 'mse', 'optimizer': 'adam', 'graph_mode': 'knn', 'knn_k': 4, 'weighted_edges': False, 'symmetrize_mode': 'union', 'self_loops': True, 'use_snp_selection': True, 'num_snps': 46696}. Best is trial 124 with value: 0.3171584343467778.
[I 2025-12-10 09:24:16,522] Trial 134 finished with value: 0.31448393217536036 and parameters: {'model_type': 'graphsage', 'hidden_dims': '[512, 128]', 'dropout': 0.11413586370256168, 'batch_norm': True, 'sage_aggr': 'mean', 'sage_normalize': True, 'sage_project': False, 'lr': 0.007074534852986387, 'weight_decay': 0.00011060216684299062, 'epochs': 319, 'loss': 'mse', 'optimizer': 'adam', 'graph_mode': 'knn', 'knn_k': 4, 'weighted_edges': False, 'symmetrize_mode': 'union', 'self_loops': True, 'use_snp_selection': True, 'num_snps': 45759}. Best is trial 124 with value: 0.3171584343467778.
[I 2025-12-10 09:28:39,542] Trial 135 finished with value: 0.30753622248678514 and parameters: {'model_type': 'graphsage', 'hidden_dims': '[512, 128]', 'dropout': 0.11361367683660975, 'batch_norm': True, 'sage_aggr': 'mean', 'sage_normalize': True, 'sage_project': False, 'lr': 0.0070089904960095924, 'weight_decay': 0.00012657468363588007, 'epochs': 320, 'loss': 'mse', 'optimizer': 'adam', 'graph_mode': 'knn', 'knn_k': 4, 'weighted_edges': False, 'symmetrize_mode': 'union', 'self_loops': True, 'use_snp_selection': True, 'num_snps': 46212}. Best is trial 124 with value: 0.3171584343467778.
[I 2025-12-10 09:33:46,695] Trial 136 finished with value: 0.29488676182973983 and parameters: {'model_type': 'graphsage', 'hidden_dims': '[512, 128]', 'dropout': 0.1591690859318944, 'batch_norm': True, 'sage_aggr': 'mean', 'sage_normalize': True, 'sage_project': False, 'lr': 0.0043933365738249375, 'weight_decay': 0.00029431421399906825, 'epochs': 305, 'loss': 'mse', 'optimizer': 'adam', 'graph_mode': 'knn', 'knn_k': 4, 'weighted_edges': False, 'symmetrize_mode': 'union', 'self_loops': True, 'use_snp_selection': True, 'num_snps': 53432}. Best is trial 124 with value: 0.3171584343467778.
[I 2025-12-10 09:37:58,960] Trial 137 finished with value: 0.3043386330318481 and parameters: {'model_type': 'graphsage', 'hidden_dims': '[512, 128]', 'dropout': 0.12607641792299562, 'batch_norm': True, 'sage_aggr': 'mean', 'sage_normalize': True, 'sage_project': False, 'lr': 0.006070751006519496, 'weight_decay': 0.0001020927254119351, 'epochs': 328, 'loss': 'mse', 'optimizer': 'adam', 'graph_mode': 'knn', 'knn_k': 3, 'weighted_edges': False, 'symmetrize_mode': 'union', 'self_loops': True, 'use_snp_selection': True, 'num_snps': 46658}. Best is trial 124 with value: 0.3171584343467778.
[I 2025-12-10 09:43:17,621] Trial 138 finished with value: 0.31457192977622145 and parameters: {'model_type': 'graphsage', 'hidden_dims': '[512, 128]', 'dropout': 0.16768360304730554, 'batch_norm': True, 'sage_aggr': 'mean', 'sage_normalize': True, 'sage_project': False, 'lr': 0.007725132555745389, 'weight_decay': 6.656043824683934e-05, 'epochs': 309, 'loss': 'mse', 'optimizer': 'adam', 'graph_mode': 'knn', 'knn_k': 4, 'weighted_edges': False, 'symmetrize_mode': 'union', 'self_loops': True, 'use_snp_selection': True, 'num_snps': 56256}. Best is trial 124 with value: 0.3171584343467778.
[I 2025-12-10 09:48:44,599] Trial 139 finished with value: 0.2867368693938263 and parameters: {'model_type': 'graphsage', 'hidden_dims': '[512, 128]', 'dropout': 0.17106903609782706, 'batch_norm': True, 'sage_aggr': 'mean', 'sage_normalize': True, 'sage_project': False, 'lr': 0.0076514266765016015, 'weight_decay': 6.689038554211042e-05, 'epochs': 311, 'loss': 'mae', 'optimizer': 'adam', 'graph_mode': 'knn', 'knn_k': 4, 'weighted_edges': False, 'symmetrize_mode': 'union', 'self_loops': True, 'use_snp_selection': True, 'num_snps': 56219}. Best is trial 124 with value: 0.3171584343467778.
[I 2025-12-10 09:52:47,667] Trial 140 finished with value: 0.28805198403993265 and parameters: {'model_type': 'graphsage', 'hidden_dims': '[512, 128]', 'dropout': 0.20446805712818977, 'batch_norm': True, 'sage_aggr': 'mean', 'sage_normalize': True, 'sage_project': False, 'lr': 0.009318683786996483, 'weight_decay': 0.00038268766638287725, 'epochs': 318, 'loss': 'mse', 'optimizer': 'adam', 'graph_mode': 'knn', 'knn_k': 5, 'weighted_edges': False, 'symmetrize_mode': 'mutual', 'self_loops': True, 'use_snp_selection': True, 'num_snps': 51280}. Best is trial 124 with value: 0.3171584343467778.
[I 2025-12-10 09:58:10,859] Trial 141 finished with value: 0.3029851613086815 and parameters: {'model_type': 'graphsage', 'hidden_dims': '[512, 128]', 'dropout': 0.13398572990294744, 'batch_norm': True, 'sage_aggr': 'mean', 'sage_normalize': True, 'sage_project': False, 'lr': 0.006466419963120064, 'weight_decay': 0.0001813074590814771, 'epochs': 301, 'loss': 'mse', 'optimizer': 'adam', 'graph_mode': 'knn', 'knn_k': 4, 'weighted_edges': False, 'symmetrize_mode': 'union', 'self_loops': True, 'use_snp_selection': True, 'num_snps': 56735}. Best is trial 124 with value: 0.3171584343467778.
[I 2025-12-10 10:02:59,125] Trial 142 finished with value: 0.312505669519979 and parameters: {'model_type': 'graphsage', 'hidden_dims': '[512, 128]', 'dropout': 0.10932739058130196, 'batch_norm': True, 'sage_aggr': 'mean', 'sage_normalize': True, 'sage_project': False, 'lr': 0.004827771751547712, 'weight_decay': 0.00012420725274903558, 'epochs': 306, 'loss': 'mse', 'optimizer': 'adam', 'graph_mode': 'knn', 'knn_k': 4, 'weighted_edges': False, 'symmetrize_mode': 'union', 'self_loops': True, 'use_snp_selection': True, 'num_snps': 50359}. Best is trial 124 with value: 0.3171584343467778.
[I 2025-12-10 10:08:31,476] Trial 143 finished with value: 0.30716484803709093 and parameters: {'model_type': 'graphsage', 'hidden_dims': '[512, 128]', 'dropout': 0.11018138333110708, 'batch_norm': True, 'sage_aggr': 'mean', 'sage_normalize': True, 'sage_project': False, 'lr': 0.005197337317266555, 'weight_decay': 0.00013394969354565733, 'epochs': 309, 'loss': 'mse', 'optimizer': 'adam', 'graph_mode': 'knn', 'knn_k': 5, 'weighted_edges': False, 'symmetrize_mode': 'union', 'self_loops': True, 'use_snp_selection': True, 'num_snps': 50397}. Best is trial 124 with value: 0.3171584343467778.
[I 2025-12-10 10:12:34,743] Trial 144 finished with value: 0.314513090432271 and parameters: {'model_type': 'graphsage', 'hidden_dims': '[512, 128]', 'dropout': 0.102906683252316, 'batch_norm': True, 'sage_aggr': 'mean', 'sage_normalize': True, 'sage_project': False, 'lr': 0.004532545087648186, 'weight_decay': 0.00010423115549197246, 'epochs': 296, 'loss': 'mse', 'optimizer': 'adam', 'graph_mode': 'knn', 'knn_k': 4, 'weighted_edges': False, 'symmetrize_mode': 'union', 'self_loops': True, 'use_snp_selection': True, 'num_snps': 45767}. Best is trial 124 with value: 0.3171584343467778.
[I 2025-12-10 10:17:14,086] Trial 145 finished with value: 0.3105418279541423 and parameters: {'model_type': 'graphsage', 'hidden_dims': '[512, 128]', 'dropout': 0.12216659444067383, 'batch_norm': True, 'sage_aggr': 'mean', 'sage_normalize': True, 'sage_project': False, 'lr': 0.005603917812870003, 'weight_decay': 0.00010652582669264793, 'epochs': 343, 'loss': 'mse', 'optimizer': 'adam', 'graph_mode': 'knn', 'knn_k': 4, 'weighted_edges': False, 'symmetrize_mode': 'union', 'self_loops': True, 'use_snp_selection': True, 'num_snps': 44526}. Best is trial 124 with value: 0.3171584343467778.
[I 2025-12-10 10:21:45,512] Trial 146 finished with value: 0.3039156107309514 and parameters: {'model_type': 'graphsage', 'hidden_dims': '[512, 128]', 'dropout': 0.10136112291849159, 'batch_norm': True, 'sage_aggr': 'mean', 'sage_normalize': True, 'sage_project': False, 'lr': 0.0046633197476271095, 'weight_decay': 7.744699284697e-05, 'epochs': 297, 'loss': 'mse', 'optimizer': 'adam', 'graph_mode': 'knn', 'knn_k': 4, 'weighted_edges': False, 'symmetrize_mode': 'union', 'self_loops': True, 'use_snp_selection': True, 'num_snps': 49303}. Best is trial 124 with value: 0.3171584343467778.
[I 2025-12-10 10:27:08,525] Trial 147 finished with value: 0.3128250607609097 and parameters: {'model_type': 'graphsage', 'hidden_dims': '[512, 128]', 'dropout': 0.1661575510305984, 'batch_norm': True, 'sage_aggr': 'mean', 'sage_normalize': True, 'sage_project': False, 'lr': 0.00773070840142218, 'weight_decay': 0.0001637893440830757, 'epochs': 289, 'loss': 'mse', 'optimizer': 'adam', 'graph_mode': 'knn', 'knn_k': 5, 'weighted_edges': False, 'symmetrize_mode': 'union', 'self_loops': True, 'use_snp_selection': True, 'num_snps': 52592}. Best is trial 124 with value: 0.3171584343467778.
[I 2025-12-10 10:31:20,020] Trial 148 finished with value: 0.30986712027195207 and parameters: {'model_type': 'graphsage', 'hidden_dims': '[512, 128]', 'dropout': 0.1384607119719296, 'batch_norm': True, 'sage_aggr': 'mean', 'sage_normalize': True, 'sage_project': False, 'lr': 0.00791799481933277, 'weight_decay': 5.941642848089872e-05, 'epochs': 289, 'loss': 'mse', 'optimizer': 'adam', 'graph_mode': 'knn', 'knn_k': 3, 'weighted_edges': False, 'symmetrize_mode': 'union', 'self_loops': True, 'use_snp_selection': True, 'num_snps': 52264}. Best is trial 124 with value: 0.3171584343467778.
[I 2025-12-10 10:36:20,848] Trial 149 finished with value: 0.2816662386311782 and parameters: {'model_type': 'graphsage', 'hidden_dims': '[512, 128]', 'dropout': 0.11527360399776215, 'batch_norm': True, 'sage_aggr': 'mean', 'sage_normalize': True, 'sage_project': False, 'lr': 0.007072599089722184, 'weight_decay': 0.00017283604814898694, 'epochs': 321, 'loss': 'mse', 'optimizer': 'adam', 'graph_mode': 'knn', 'knn_k': 4, 'weighted_edges': False, 'symmetrize_mode': 'union', 'self_loops': False, 'use_snp_selection': True, 'num_snps': 55603}. Best is trial 124 with value: 0.3171584343467778.
