[I 2025-12-06 14:32:09,933] Trial 120 finished with value: 0.20314115306986036 and parameters: {'model_type': 'graphsage', 'hidden_dims': '[512, 128]', 'dropout': 0.1354660494959176, 'batch_norm': False, 'sage_aggr': 'max', 'sage_normalize': False, 'sage_project': False, 'lr': 4.5401237231687116e-05, 'weight_decay': 8.748756055933243e-05, 'epochs': 99, 'loss': 'mae', 'optimizer': 'adam', 'graph_mode': 'cutoff', 'cutoff': 0.21692433112445686, 'grm_norm': 'none', 'self_loops': False, 'use_snp_selection': True, 'num_snps': 44138, 'graphsage_batch_size': 512}. Best is trial 85 with value: 0.2431809407916649.
[I 2025-12-06 14:33:22,171] Trial 121 finished with value: 0.23598293775923965 and parameters: {'model_type': 'graphsage', 'hidden_dims': '[512, 128]', 'dropout': 0.1448943616747852, 'batch_norm': True, 'sage_aggr': 'max', 'sage_normalize': False, 'sage_project': False, 'lr': 8.23980682528372e-05, 'weight_decay': 1.872744345628442e-05, 'epochs': 130, 'loss': 'mae', 'optimizer': 'adam', 'graph_mode': 'cutoff', 'cutoff': 0.5844242620870965, 'grm_norm': 'gcn', 'self_loops': False, 'use_snp_selection': True, 'num_snps': 40150, 'graphsage_batch_size': 512}. Best is trial 85 with value: 0.2431809407916649.
[I 2025-12-06 14:34:33,457] Trial 122 finished with value: 0.22540629136045282 and parameters: {'model_type': 'graphsage', 'hidden_dims': '[512, 128]', 'dropout': 0.11399583058379907, 'batch_norm': True, 'sage_aggr': 'max', 'sage_normalize': False, 'sage_project': False, 'lr': 5.7795367290886485e-05, 'weight_decay': 1.88002947134266e-05, 'epochs': 130, 'loss': 'mae', 'optimizer': 'adam', 'graph_mode': 'cutoff', 'cutoff': 0.6201145538393978, 'grm_norm': 'gcn', 'self_loops': False, 'use_snp_selection': True, 'num_snps': 40210, 'graphsage_batch_size': 512}. Best is trial 85 with value: 0.2431809407916649.
[I 2025-12-06 14:35:53,943] Trial 123 finished with value: 0.212734468843442 and parameters: {'model_type': 'graphsage', 'hidden_dims': '[512, 128]', 'dropout': 0.17041052214138347, 'batch_norm': True, 'sage_aggr': 'max', 'sage_normalize': False, 'sage_project': False, 'lr': 9.417836018679653e-05, 'weight_decay': 2.4113710471227075e-05, 'epochs': 117, 'loss': 'mae', 'optimizer': 'adam', 'graph_mode': 'cutoff', 'cutoff': 0.5403487335483477, 'grm_norm': 'gcn', 'self_loops': False, 'use_snp_selection': True, 'num_snps': 46086, 'graphsage_batch_size': 256}. Best is trial 85 with value: 0.2431809407916649.
[I 2025-12-06 14:37:12,187] Trial 124 finished with value: 0.22548888266851166 and parameters: {'model_type': 'graphsage', 'hidden_dims': '[512, 128]', 'dropout': 0.12495862737910002, 'batch_norm': True, 'sage_aggr': 'max', 'sage_normalize': False, 'sage_project': False, 'lr': 8.230341490221046e-05, 'weight_decay': 4.909993756835203e-05, 'epochs': 137, 'loss': 'mae', 'optimizer': 'adam', 'graph_mode': 'cutoff', 'cutoff': 0.5772718001816056, 'grm_norm': 'gcn', 'self_loops': False, 'use_snp_selection': True, 'num_snps': 42069, 'graphsage_batch_size': 512}. Best is trial 85 with value: 0.2431809407916649.
[I 2025-12-06 14:38:14,963] Trial 125 finished with value: 0.2134662463562007 and parameters: {'model_type': 'graphsage', 'hidden_dims': '[512, 128]', 'dropout': 0.1537571495158716, 'batch_norm': True, 'sage_aggr': 'max', 'sage_normalize': False, 'sage_project': False, 'lr': 4.423677395169625e-05, 'weight_decay': 1.4606040027307251e-05, 'epochs': 109, 'loss': 'mae', 'optimizer': 'adam', 'graph_mode': 'cutoff', 'cutoff': 0.5976688492304298, 'grm_norm': 'none', 'self_loops': False, 'use_snp_selection': True, 'num_snps': 38655, 'graphsage_batch_size': 64}. Best is trial 85 with value: 0.2431809407916649.
[I 2025-12-06 14:39:18,936] Trial 126 finished with value: 0.22436361088162443 and parameters: {'model_type': 'graphsage', 'hidden_dims': '[512, 128]', 'dropout': 0.14515140900805207, 'batch_norm': True, 'sage_aggr': 'max', 'sage_normalize': False, 'sage_project': False, 'lr': 2.9657888578166448e-05, 'weight_decay': 6.983036387858014e-05, 'epochs': 123, 'loss': 'mae', 'optimizer': 'adam', 'graph_mode': 'cutoff', 'cutoff': 0.5497808766608597, 'grm_norm': 'cosine', 'self_loops': False, 'use_snp_selection': True, 'num_snps': 35486, 'graphsage_batch_size': 512}. Best is trial 85 with value: 0.2431809407916649.
[I 2025-12-06 14:40:38,890] Trial 127 finished with value: 0.23141239640054181 and parameters: {'model_type': 'graphsage', 'hidden_dims': '[512, 128]', 'dropout': 0.11037036932490168, 'batch_norm': True, 'sage_aggr': 'max', 'sage_normalize': False, 'sage_project': False, 'lr': 3.77179480242621e-05, 'weight_decay': 3.27773460592379e-05, 'epochs': 142, 'loss': 'mae', 'optimizer': 'adam', 'graph_mode': 'cutoff', 'cutoff': 0.6134175812103267, 'grm_norm': 'gcn', 'self_loops': False, 'use_snp_selection': True, 'num_snps': 42772, 'graphsage_batch_size': 512}. Best is trial 85 with value: 0.2431809407916649.
[I 2025-12-06 14:42:03,399] Trial 128 finished with value: 0.22954710500640285 and parameters: {'model_type': 'graphsage', 'hidden_dims': '[512, 128]', 'dropout': 0.13136507471259548, 'batch_norm': True, 'sage_aggr': 'max', 'sage_normalize': False, 'sage_project': False, 'lr': 5.1959278570411105e-05, 'weight_decay': 2.743771489793948e-05, 'epochs': 135, 'loss': 'mae', 'optimizer': 'adam', 'graph_mode': 'cutoff', 'cutoff': 0.5767724766500741, 'grm_norm': 'none', 'self_loops': False, 'use_snp_selection': True, 'num_snps': 45954, 'graphsage_batch_size': 512}. Best is trial 85 with value: 0.2431809407916649.
[I 2025-12-06 14:43:50,964] Trial 129 finished with value: 0.19477390814786555 and parameters: {'model_type': 'graphsage', 'hidden_dims': '[512, 128]', 'dropout': 0.15613037263216925, 'batch_norm': True, 'sage_aggr': 'max', 'sage_normalize': False, 'sage_project': False, 'lr': 0.00011281186418707547, 'weight_decay': 1.2669721616116944e-05, 'epochs': 138, 'loss': 'mae', 'optimizer': 'adam', 'graph_mode': 'knn', 'knn_k': 4, 'weighted_edges': False, 'symmetrize_mode': 'union', 'self_loops': False, 'use_snp_selection': True, 'num_snps': 40364, 'graphsage_batch_size': 512}. Best is trial 85 with value: 0.2431809407916649.
[I 2025-12-06 14:45:05,484] Trial 130 finished with value: 0.21732004983410338 and parameters: {'model_type': 'graphsage', 'hidden_dims': '[512, 128]', 'dropout': 0.1922285922602038, 'batch_norm': True, 'sage_aggr': 'max', 'sage_normalize': False, 'sage_project': False, 'lr': 8.410778937430271e-05, 'weight_decay': 4.300519070750121e-05, 'epochs': 144, 'loss': 'mae', 'optimizer': 'adam', 'graph_mode': 'cutoff', 'cutoff': 0.5331117766227453, 'grm_norm': 'none', 'self_loops': False, 'use_snp_selection': True, 'num_snps': 36858, 'graphsage_batch_size': 512}. Best is trial 85 with value: 0.2431809407916649.
[I 2025-12-06 14:46:14,281] Trial 131 finished with value: 0.23767246745916645 and parameters: {'model_type': 'graphsage', 'hidden_dims': '[512, 128]', 'dropout': 0.14054544076815711, 'batch_norm': True, 'sage_aggr': 'max', 'sage_normalize': False, 'sage_project': False, 'lr': 7.269329066572313e-05, 'weight_decay': 1.6889933197967808e-05, 'epochs': 128, 'loss': 'mae', 'optimizer': 'adam', 'graph_mode': 'cutoff', 'cutoff': 0.5888728267124814, 'grm_norm': 'gcn', 'self_loops': False, 'use_snp_selection': True, 'num_snps': 38221, 'graphsage_batch_size': 512}. Best is trial 85 with value: 0.2431809407916649.
[I 2025-12-06 14:47:24,233] Trial 132 finished with value: 0.22307423918461158 and parameters: {'model_type': 'graphsage', 'hidden_dims': '[512, 128]', 'dropout': 0.12019386221576278, 'batch_norm': True, 'sage_aggr': 'max', 'sage_normalize': False, 'sage_project': False, 'lr': 6.150119971681651e-05, 'weight_decay': 2.02694988520226e-05, 'epochs': 130, 'loss': 'mae', 'optimizer': 'adam', 'graph_mode': 'cutoff', 'cutoff': 0.5992575574092078, 'grm_norm': 'gcn', 'self_loops': False, 'use_snp_selection': True, 'num_snps': 38915, 'graphsage_batch_size': 512}. Best is trial 85 with value: 0.2431809407916649.
[I 2025-12-06 14:48:23,341] Trial 133 finished with value: 0.23640442541773288 and parameters: {'model_type': 'graphsage', 'hidden_dims': '[512, 128]', 'dropout': 0.13809889905850756, 'batch_norm': True, 'sage_aggr': 'max', 'sage_normalize': False, 'sage_project': False, 'lr': 4.658858568238526e-05, 'weight_decay': 1.471405128950538e-05, 'epochs': 127, 'loss': 'mae', 'optimizer': 'adam', 'graph_mode': 'cutoff', 'cutoff': 0.6232005485390996, 'grm_norm': 'gcn', 'self_loops': False, 'use_snp_selection': True, 'num_snps': 32322, 'graphsage_batch_size': 512}. Best is trial 85 with value: 0.2431809407916649.
[I 2025-12-06 14:50:29,924] Trial 134 finished with value: 0.18906992281243634 and parameters: {'model_type': 'graphsage', 'hidden_dims': '[512, 128]', 'dropout': 0.16553401013100427, 'batch_norm': True, 'sage_aggr': 'max', 'sage_normalize': False, 'sage_project': False, 'lr': 7.398996085632236e-05, 'weight_decay': 1.4741861152287429e-05, 'epochs': 128, 'loss': 'mae', 'optimizer': 'adam', 'graph_mode': 'cutoff', 'cutoff': 0.2459790711854304, 'grm_norm': 'gcn', 'self_loops': False, 'use_snp_selection': True, 'num_snps': 33809, 'graphsage_batch_size': 512}. Best is trial 85 with value: 0.2431809407916649.
[I 2025-12-06 14:51:24,724] Trial 135 finished with value: 0.23150633359331882 and parameters: {'model_type': 'graphsage', 'hidden_dims': '[512, 128]', 'dropout': 0.14914927243740408, 'batch_norm': True, 'sage_aggr': 'max', 'sage_normalize': False, 'sage_project': False, 'lr': 4.497326733867071e-05, 'weight_decay': 9.049974895658993e-06, 'epochs': 118, 'loss': 'mae', 'optimizer': 'adam', 'graph_mode': 'cutoff', 'cutoff': 0.6212529633173622, 'grm_norm': 'gcn', 'self_loops': False, 'use_snp_selection': True, 'num_snps': 31117, 'graphsage_batch_size': 512}. Best is trial 85 with value: 0.2431809407916649.
[I 2025-12-06 14:52:15,862] Trial 136 finished with value: 0.21954329794274355 and parameters: {'model_type': 'graphsage', 'hidden_dims': '[512, 128]', 'dropout': 0.1263060455668468, 'batch_norm': True, 'sage_aggr': 'max', 'sage_normalize': False, 'sage_project': False, 'lr': 3.2518359509396526e-05, 'weight_decay': 1.2457842558737665e-05, 'epochs': 113, 'loss': 'mae', 'optimizer': 'adam', 'graph_mode': 'cutoff', 'cutoff': 0.5635603104736472, 'grm_norm': 'gcn', 'self_loops': False, 'use_snp_selection': True, 'num_snps': 28736, 'graphsage_batch_size': 512}. Best is trial 85 with value: 0.2431809407916649.
[I 2025-12-06 14:53:29,827] Trial 137 finished with value: 0.21758837551766982 and parameters: {'model_type': 'graphsage', 'hidden_dims': '[512, 128]', 'dropout': 0.1750660762391888, 'batch_norm': True, 'sage_aggr': 'max', 'sage_normalize': False, 'sage_project': False, 'lr': 2.413988528717398e-05, 'weight_decay': 1.657431350917326e-05, 'epochs': 134, 'loss': 'mae', 'optimizer': 'adam', 'graph_mode': 'cutoff', 'cutoff': 0.630048561295946, 'grm_norm': 'gcn', 'self_loops': False, 'use_snp_selection': True, 'num_snps': 41052, 'graphsage_batch_size': 128}. Best is trial 85 with value: 0.2431809407916649.
[I 2025-12-06 14:54:45,450] Trial 138 finished with value: 0.2344170017466373 and parameters: {'model_type': 'graphsage', 'hidden_dims': '[512, 128]', 'dropout': 0.10930930023979157, 'batch_norm': True, 'sage_aggr': 'max', 'sage_normalize': False, 'sage_project': False, 'lr': 3.6613220215743166e-05, 'weight_decay': 3.4558959627948655e-05, 'epochs': 122, 'loss': 'mae', 'optimizer': 'adam', 'graph_mode': 'cutoff', 'cutoff': 0.5873017707323692, 'grm_norm': 'gcn', 'self_loops': False, 'use_snp_selection': True, 'num_snps': 44795, 'graphsage_batch_size': 512}. Best is trial 85 with value: 0.2431809407916649.
[I 2025-12-06 14:55:42,880] Trial 139 finished with value: 0.22794737207749396 and parameters: {'model_type': 'graphsage', 'hidden_dims': '[512, 128]', 'dropout': 0.13569445123178253, 'batch_norm': True, 'sage_aggr': 'max', 'sage_normalize': False, 'sage_project': False, 'lr': 5.366745719326326e-05, 'weight_decay': 5.830234086183544e-05, 'epochs': 126, 'loss': 'mae', 'optimizer': 'adam', 'graph_mode': 'cutoff', 'cutoff': 0.6586372381815551, 'grm_norm': 'gcn', 'self_loops': False, 'use_snp_selection': True, 'num_snps': 31721, 'graphsage_batch_size': 512}. Best is trial 85 with value: 0.2431809407916649.
[I 2025-12-06 14:56:55,799] Trial 140 finished with value: 0.23119109632448356 and parameters: {'model_type': 'graphsage', 'hidden_dims': '[512, 128]', 'dropout': 0.15549514141449067, 'batch_norm': True, 'sage_aggr': 'max', 'sage_normalize': False, 'sage_project': False, 'lr': 4.751436265365749e-05, 'weight_decay': 2.7596549591368087e-05, 'epochs': 149, 'loss': 'mae', 'optimizer': 'adam', 'graph_mode': 'cutoff', 'cutoff': 0.5564498961019013, 'grm_norm': 'gcn', 'self_loops': False, 'use_snp_selection': True, 'num_snps': 35492, 'graphsage_batch_size': 512}. Best is trial 85 with value: 0.2431809407916649.
[I 2025-12-06 14:58:07,667] Trial 141 finished with value: 0.21654783909775627 and parameters: {'model_type': 'graphsage', 'hidden_dims': '[512, 128]', 'dropout': 0.14205906300345114, 'batch_norm': True, 'sage_aggr': 'max', 'sage_normalize': False, 'sage_project': False, 'lr': 5.971306175866792e-05, 'weight_decay': 2.2821178396590456e-05, 'epochs': 140, 'loss': 'mae', 'optimizer': 'adam', 'graph_mode': 'cutoff', 'cutoff': 0.6038051255380177, 'grm_norm': 'none', 'self_loops': False, 'use_snp_selection': True, 'num_snps': 38039, 'graphsage_batch_size': 512}. Best is trial 85 with value: 0.2431809407916649.
[I 2025-12-06 14:59:15,161] Trial 142 finished with value: 0.22821873602303958 and parameters: {'model_type': 'graphsage', 'hidden_dims': '[512, 128]', 'dropout': 0.12051694159568502, 'batch_norm': True, 'sage_aggr': 'max', 'sage_normalize': False, 'sage_project': False, 'lr': 6.875012140870662e-05, 'weight_decay': 1.9001273482444095e-05, 'epochs': 133, 'loss': 'mae', 'optimizer': 'adam', 'graph_mode': 'cutoff', 'cutoff': 0.614101624832759, 'grm_norm': 'none', 'self_loops': False, 'use_snp_selection': True, 'num_snps': 36606, 'graphsage_batch_size': 512}. Best is trial 85 with value: 0.2431809407916649.
[I 2025-12-06 15:00:29,003] Trial 143 finished with value: 0.23425122567782664 and parameters: {'model_type': 'graphsage', 'hidden_dims': '[512, 128]', 'dropout': 0.13437342844389796, 'batch_norm': True, 'sage_aggr': 'max', 'sage_normalize': False, 'sage_project': False, 'lr': 4.148403535814828e-05, 'weight_decay': 1.4922794548779188e-05, 'epochs': 137, 'loss': 'mae', 'optimizer': 'adam', 'graph_mode': 'cutoff', 'cutoff': 0.5864012596403833, 'grm_norm': 'none', 'self_loops': False, 'use_snp_selection': True, 'num_snps': 39457, 'graphsage_batch_size': 512}. Best is trial 85 with value: 0.2431809407916649.
[I 2025-12-06 15:01:48,526] Trial 144 finished with value: 0.2429236673568796 and parameters: {'model_type': 'graphsage', 'hidden_dims': '[512, 128]', 'dropout': 0.14818077622267342, 'batch_norm': True, 'sage_aggr': 'max', 'sage_normalize': False, 'sage_project': False, 'lr': 7.72609492322111e-05, 'weight_decay': 1.1427157293275709e-05, 'epochs': 142, 'loss': 'mae', 'optimizer': 'adam', 'graph_mode': 'cutoff', 'cutoff': 0.6488325421714836, 'grm_norm': 'none', 'self_loops': False, 'use_snp_selection': True, 'num_snps': 42934, 'graphsage_batch_size': 512}. Best is trial 85 with value: 0.2431809407916649.
[I 2025-12-06 15:03:08,801] Trial 145 finished with value: 0.22476708153919897 and parameters: {'model_type': 'graphsage', 'hidden_dims': '[512, 128]', 'dropout': 0.15192078135546186, 'batch_norm': True, 'sage_aggr': 'max', 'sage_normalize': False, 'sage_project': False, 'lr': 7.865896459430495e-05, 'weight_decay': 1.107351973878231e-05, 'epochs': 145, 'loss': 'mae', 'optimizer': 'adam', 'graph_mode': 'cutoff', 'cutoff': 0.6386345209953187, 'grm_norm': 'none', 'self_loops': False, 'use_snp_selection': True, 'num_snps': 42492, 'graphsage_batch_size': 256}. Best is trial 85 with value: 0.2431809407916649.
[I 2025-12-06 15:04:39,626] Trial 146 finished with value: 0.2236813255564812 and parameters: {'model_type': 'graphsage', 'hidden_dims': '[512, 128]', 'dropout': 0.1613650418950978, 'batch_norm': True, 'sage_aggr': 'max', 'sage_normalize': False, 'sage_project': False, 'lr': 9.733138881045822e-05, 'weight_decay': 8.99601200793873e-06, 'epochs': 152, 'loss': 'mae', 'optimizer': 'adam', 'graph_mode': 'cutoff', 'cutoff': 0.6515467738895419, 'grm_norm': 'none', 'self_loops': False, 'use_snp_selection': True, 'num_snps': 47303, 'graphsage_batch_size': 512}. Best is trial 85 with value: 0.2431809407916649.
[I 2025-12-06 15:05:40,400] Trial 147 finished with value: 0.23366456838968838 and parameters: {'model_type': 'graphsage', 'hidden_dims': '[512, 128]', 'dropout': 0.18387639270715958, 'batch_norm': False, 'sage_aggr': 'max', 'sage_normalize': False, 'sage_project': False, 'lr': 0.00011837808034552133, 'weight_decay': 1.3568749138951638e-05, 'epochs': 130, 'loss': 'mae', 'optimizer': 'adam', 'graph_mode': 'cutoff', 'cutoff': 0.6238714693466715, 'grm_norm': 'none', 'self_loops': False, 'use_snp_selection': True, 'num_snps': 32821, 'graphsage_batch_size': 512}. Best is trial 85 with value: 0.2431809407916649.
[I 2025-12-06 15:07:04,518] Trial 148 finished with value: 0.21822737521529115 and parameters: {'model_type': 'graphsage', 'hidden_dims': '[512, 128]', 'dropout': 0.12424167528265581, 'batch_norm': True, 'sage_aggr': 'max', 'sage_normalize': False, 'sage_project': False, 'lr': 5.0763083903659006e-05, 'weight_decay': 6.253129985528383e-06, 'epochs': 143, 'loss': 'mae', 'optimizer': 'adam', 'graph_mode': 'cutoff', 'cutoff': 0.5740600690639646, 'grm_norm': 'gcn', 'self_loops': False, 'use_snp_selection': True, 'num_snps': 44062, 'graphsage_batch_size': 64}. Best is trial 85 with value: 0.2431809407916649.
[I 2025-12-06 15:08:06,101] Trial 149 finished with value: 0.22404922569950392 and parameters: {'model_type': 'graphsage', 'hidden_dims': '[512, 128]', 'dropout': 0.1700147677597862, 'batch_norm': True, 'sage_aggr': 'max', 'sage_normalize': False, 'sage_project': False, 'lr': 2.846562933789418e-05, 'weight_decay': 1.6718738354482177e-05, 'epochs': 125, 'loss': 'mae', 'optimizer': 'adam', 'graph_mode': 'cutoff', 'cutoff': 0.6692851712732244, 'grm_norm': 'none', 'self_loops': False, 'use_snp_selection': True, 'num_snps': 34644, 'graphsage_batch_size': 512}. Best is trial 85 with value: 0.2431809407916649.
[I 2025-12-06 15:09:14,384] Trial 0 finished with value: 0.19347588828957613 and parameters: {'model_type': 'graphsage', 'hidden_dims': '[128, 64]', 'dropout': 0.199031432379812, 'batch_norm': True, 'sage_aggr': 'max', 'sage_normalize': False, 'sage_project': False, 'lr': 3.4401453323286906e-05, 'weight_decay': 0.00017802616915745114, 'epochs': 169, 'loss': 'mse', 'optimizer': 'adam', 'graph_mode': 'knn', 'knn_k': 6, 'weighted_edges': True, 'symmetrize_mode': 'mutual', 'self_loops': False, 'use_snp_selection': False, 'graphsage_batch_size': 256}. Best is trial 0 with value: 0.19347588828957613.
[I 2025-12-06 15:10:17,877] Trial 1 finished with value: 0.2253125310140069 and parameters: {'model_type': 'graphsage', 'hidden_dims': '[512, 128]', 'dropout': 0.3737930779596218, 'batch_norm': True, 'sage_aggr': 'mean', 'sage_normalize': False, 'sage_project': False, 'lr': 0.0004485485309869717, 'weight_decay': 2.0046868950224612e-06, 'epochs': 74, 'loss': 'mse', 'optimizer': 'adam', 'graph_mode': 'knn', 'knn_k': 4, 'weighted_edges': True, 'symmetrize_mode': 'union', 'self_loops': False, 'use_snp_selection': False, 'graphsage_batch_size': 8}. Best is trial 1 with value: 0.2253125310140069.
[I 2025-12-06 15:11:02,682] Trial 2 finished with value: 0.20483313971743627 and parameters: {'model_type': 'graphsage', 'hidden_dims': '[256, 128]', 'dropout': 0.2731735750400165, 'batch_norm': False, 'sage_aggr': 'max', 'sage_normalize': True, 'sage_project': False, 'lr': 3.4705625989073525e-05, 'weight_decay': 2.4623319020131338e-05, 'epochs': 95, 'loss': 'mse', 'optimizer': 'adam', 'graph_mode': 'knn', 'knn_k': 6, 'weighted_edges': False, 'symmetrize_mode': 'mutual', 'self_loops': False, 'use_snp_selection': True, 'num_snps': 30713, 'graphsage_batch_size': 8}. Best is trial 1 with value: 0.2253125310140069.
[I 2025-12-06 15:12:03,684] Trial 3 finished with value: 0.21128326485627014 and parameters: {'model_type': 'graphsage', 'hidden_dims': '[256, 128]', 'dropout': 0.3815953422463725, 'batch_norm': False, 'sage_aggr': 'mean', 'sage_normalize': True, 'sage_project': False, 'lr': 2.1095572616816696e-06, 'weight_decay': 5.195307220037778e-07, 'epochs': 226, 'loss': 'mse', 'optimizer': 'adam', 'graph_mode': 'knn', 'knn_k': 8, 'weighted_edges': True, 'symmetrize_mode': 'union', 'self_loops': False, 'use_snp_selection': True, 'num_snps': 16419, 'graphsage_batch_size': 128}. Best is trial 1 with value: 0.2253125310140069.
[I 2025-12-06 15:14:06,486] Trial 4 finished with value: 0.19125337995535183 and parameters: {'model_type': 'graphsage', 'hidden_dims': '[256, 128]', 'dropout': 0.3920979142653378, 'batch_norm': True, 'sage_aggr': 'max', 'sage_normalize': True, 'sage_project': False, 'lr': 3.15214685884738e-06, 'weight_decay': 1.0663862019069792e-05, 'epochs': 212, 'loss': 'mae', 'optimizer': 'adam', 'graph_mode': 'cutoff', 'cutoff': 0.33867046005138823, 'grm_norm': 'gcn', 'self_loops': False, 'use_snp_selection': False, 'graphsage_batch_size': 512}. Best is trial 1 with value: 0.2253125310140069.
[I 2025-12-06 15:14:32,983] Trial 5 finished with value: 0.21350645767537965 and parameters: {'model_type': 'graphsage', 'hidden_dims': '[256, 128]', 'dropout': 0.32925710311863654, 'batch_norm': True, 'sage_aggr': 'mean', 'sage_normalize': True, 'sage_project': False, 'lr': 0.00016905333078305474, 'weight_decay': 6.711044850912148e-06, 'epochs': 127, 'loss': 'mae', 'optimizer': 'adam', 'graph_mode': 'cutoff', 'cutoff': 0.253959783091227, 'grm_norm': 'cosine_then_gcn', 'self_loops': False, 'use_snp_selection': True, 'num_snps': 7419, 'graphsage_batch_size': 64}. Best is trial 1 with value: 0.2253125310140069.
