[I 2025-12-09 07:44:26,625] Trial 32 finished with value: 0.17153159620533237 and parameters: {'model_type': 'graphsage', 'hidden_dims': '[512, 128]', 'dropout': 0.36889759096349306, 'batch_norm': False, 'sage_aggr': 'max', 'sage_normalize': False, 'sage_project': False, 'lr': 0.000283456313462043, 'weight_decay': 1.7076067161926242e-05, 'epochs': 246, 'loss': 'mae', 'optimizer': 'adam', 'graph_mode': 'knn', 'knn_k': 7, 'weighted_edges': True, 'symmetrize_mode': 'union', 'self_loops': False, 'use_snp_selection': True, 'num_snps': 29993}. Best is trial 16 with value: 0.3710601030766384.
[I 2025-12-09 07:48:17,432] Trial 33 finished with value: 0.3531241229522607 and parameters: {'model_type': 'graphsage', 'hidden_dims': '[512, 128]', 'dropout': 0.18563487837242842, 'batch_norm': False, 'sage_aggr': 'max', 'sage_normalize': False, 'sage_project': False, 'lr': 4.674544269211229e-05, 'weight_decay': 4.536234653658673e-06, 'epochs': 156, 'loss': 'mae', 'optimizer': 'adam', 'graph_mode': 'knn', 'knn_k': 10, 'weighted_edges': True, 'symmetrize_mode': 'union', 'self_loops': False, 'use_snp_selection': True, 'num_snps': 42727}. Best is trial 16 with value: 0.3710601030766384.
[I 2025-12-09 07:51:25,068] Trial 34 finished with value: 0.37797906009348187 and parameters: {'model_type': 'graphsage', 'hidden_dims': '[512, 128]', 'dropout': 0.26626131205403747, 'batch_norm': False, 'sage_aggr': 'max', 'sage_normalize': False, 'sage_project': False, 'lr': 2.4985745363033907e-05, 'weight_decay': 4.78370127104906e-05, 'epochs': 275, 'loss': 'mse', 'optimizer': 'adam', 'graph_mode': 'knn', 'knn_k': 8, 'weighted_edges': True, 'symmetrize_mode': 'union', 'self_loops': True, 'use_snp_selection': True, 'num_snps': 26017}. Best is trial 34 with value: 0.37797906009348187.
[I 2025-12-09 07:54:50,226] Trial 35 finished with value: 0.3836273050545894 and parameters: {'model_type': 'graphsage', 'hidden_dims': '[512, 128]', 'dropout': 0.26056820105902256, 'batch_norm': False, 'sage_aggr': 'max', 'sage_normalize': False, 'sage_project': False, 'lr': 2.6453960407632002e-05, 'weight_decay': 0.00015714575066719128, 'epochs': 281, 'loss': 'mse', 'optimizer': 'adam', 'graph_mode': 'knn', 'knn_k': 9, 'weighted_edges': True, 'symmetrize_mode': 'union', 'self_loops': True, 'use_snp_selection': True, 'num_snps': 25574}. Best is trial 35 with value: 0.3836273050545894.
[I 2025-12-09 08:00:02,670] Trial 36 finished with value: 0.36204790743942417 and parameters: {'model_type': 'graphsage', 'hidden_dims': '[512, 128]', 'dropout': 0.32780804132752456, 'batch_norm': False, 'sage_aggr': 'max', 'sage_normalize': False, 'sage_project': False, 'lr': 1.1494785093440913e-05, 'weight_decay': 0.00014957807138284583, 'epochs': 300, 'loss': 'mse', 'optimizer': 'adam', 'graph_mode': 'knn', 'knn_k': 7, 'weighted_edges': True, 'symmetrize_mode': 'union', 'self_loops': True, 'use_snp_selection': False}. Best is trial 35 with value: 0.3836273050545894.
[I 2025-12-09 08:02:10,704] Trial 37 finished with value: 0.3602834957626487 and parameters: {'model_type': 'graphsage', 'hidden_dims': '[512, 128]', 'dropout': 0.14179329296580392, 'batch_norm': False, 'sage_aggr': 'mean', 'sage_normalize': False, 'sage_project': False, 'lr': 2.21621362744619e-05, 'weight_decay': 1.573807272847972e-07, 'epochs': 272, 'loss': 'mse', 'optimizer': 'adam', 'graph_mode': 'knn', 'knn_k': 5, 'weighted_edges': True, 'symmetrize_mode': 'union', 'self_loops': True, 'use_snp_selection': True, 'num_snps': 28022}. Best is trial 35 with value: 0.3836273050545894.
[I 2025-12-09 08:05:42,108] Trial 38 finished with value: 0.34536727970645675 and parameters: {'model_type': 'graphsage', 'hidden_dims': '[256, 128, 64]', 'dropout': 0.2753077542344109, 'batch_norm': False, 'sage_aggr': 'max', 'sage_normalize': False, 'sage_project': False, 'lr': 3.127001267790517e-05, 'weight_decay': 4.713287254964909e-05, 'epochs': 316, 'loss': 'mse', 'optimizer': 'adam', 'graph_mode': 'cutoff', 'cutoff': 0.31234157497767534, 'grm_norm': 'cosine_then_gcn', 'self_loops': True, 'use_snp_selection': True, 'num_snps': 44341}. Best is trial 35 with value: 0.3836273050545894.
[I 2025-12-09 08:09:39,522] Trial 39 finished with value: 0.3621836099810993 and parameters: {'model_type': 'graphsage', 'hidden_dims': '[512, 128]', 'dropout': 0.21450654852845344, 'batch_norm': False, 'sage_aggr': 'max', 'sage_normalize': False, 'sage_project': False, 'lr': 1.4828362864401254e-05, 'weight_decay': 0.0002812541142099925, 'epochs': 273, 'loss': 'mse', 'optimizer': 'adam', 'graph_mode': 'knn', 'knn_k': 9, 'weighted_edges': False, 'symmetrize_mode': 'mutual', 'self_loops': True, 'use_snp_selection': False}. Best is trial 35 with value: 0.3836273050545894.
[I 2025-12-09 08:10:41,594] Trial 40 finished with value: 0.3488915929351318 and parameters: {'model_type': 'graphsage', 'hidden_dims': '[512, 128]', 'dropout': 0.1406004340810711, 'batch_norm': False, 'sage_aggr': 'mean', 'sage_normalize': False, 'sage_project': False, 'lr': 1.0106724967911113e-05, 'weight_decay': 4.914257108931296e-07, 'epochs': 309, 'loss': 'mse', 'optimizer': 'adam', 'graph_mode': 'cutoff', 'cutoff': 0.49556739707230035, 'grm_norm': 'none', 'self_loops': True, 'use_snp_selection': True, 'num_snps': 16927}. Best is trial 35 with value: 0.3836273050545894.
[I 2025-12-09 08:12:21,241] Trial 41 finished with value: 0.3516929542311217 and parameters: {'model_type': 'graphsage', 'hidden_dims': '[128, 64]', 'dropout': 0.258556295341202, 'batch_norm': True, 'sage_aggr': 'max', 'sage_normalize': False, 'sage_project': False, 'lr': 2.748552863283685e-05, 'weight_decay': 0.00010118552207693922, 'epochs': 190, 'loss': 'mse', 'optimizer': 'adam', 'graph_mode': 'knn', 'knn_k': 9, 'weighted_edges': True, 'symmetrize_mode': 'union', 'self_loops': True, 'use_snp_selection': True, 'num_snps': 24860}. Best is trial 35 with value: 0.3836273050545894.
[I 2025-12-09 08:15:29,462] Trial 42 finished with value: 0.3163098282436801 and parameters: {'model_type': 'graphsage', 'hidden_dims': '[512, 64]', 'dropout': 0.2483309275875285, 'batch_norm': False, 'sage_aggr': 'max', 'sage_normalize': False, 'sage_project': False, 'lr': 8.153315538139354e-05, 'weight_decay': 0.000990376221161516, 'epochs': 219, 'loss': 'mse', 'optimizer': 'adam', 'graph_mode': 'knn', 'knn_k': 10, 'weighted_edges': True, 'symmetrize_mode': 'union', 'self_loops': True, 'use_snp_selection': True, 'num_snps': 27024}. Best is trial 35 with value: 0.3836273050545894.
[I 2025-12-09 08:17:36,597] Trial 43 finished with value: 0.3780711321945917 and parameters: {'model_type': 'graphsage', 'hidden_dims': '[512, 256]', 'dropout': 0.17102274256773575, 'batch_norm': True, 'sage_aggr': 'max', 'sage_normalize': True, 'sage_project': False, 'lr': 4.407207651114896e-05, 'weight_decay': 0.00045855759138557604, 'epochs': 238, 'loss': 'mse', 'optimizer': 'adam', 'graph_mode': 'knn', 'knn_k': 8, 'weighted_edges': True, 'symmetrize_mode': 'union', 'self_loops': True, 'use_snp_selection': True, 'num_snps': 22475}. Best is trial 35 with value: 0.3836273050545894.
[I 2025-12-09 08:19:06,968] Trial 44 finished with value: 0.35274227020553084 and parameters: {'model_type': 'graphsage', 'hidden_dims': '[512, 256]', 'dropout': 0.15970858924599488, 'batch_norm': True, 'sage_aggr': 'max', 'sage_normalize': False, 'sage_project': False, 'lr': 1.755697147533847e-05, 'weight_decay': 0.00024856852105524323, 'epochs': 245, 'loss': 'mse', 'optimizer': 'adam', 'graph_mode': 'knn', 'knn_k': 6, 'weighted_edges': True, 'symmetrize_mode': 'union', 'self_loops': True, 'use_snp_selection': True, 'num_snps': 18561}. Best is trial 35 with value: 0.3836273050545894.
[I 2025-12-09 08:23:36,535] Trial 45 finished with value: 0.3613406902659729 and parameters: {'model_type': 'graphsage', 'hidden_dims': '[512, 256]', 'dropout': 0.18919053923156365, 'batch_norm': False, 'sage_aggr': 'max', 'sage_normalize': True, 'sage_project': False, 'lr': 4.607986572580492e-05, 'weight_decay': 6.41019084813118e-05, 'epochs': 279, 'loss': 'mse', 'optimizer': 'adam', 'graph_mode': 'knn', 'knn_k': 8, 'weighted_edges': True, 'symmetrize_mode': 'union', 'self_loops': True, 'use_snp_selection': True, 'num_snps': 32929}. Best is trial 35 with value: 0.3836273050545894.
[I 2025-12-09 08:24:19,315] Trial 46 finished with value: 0.36864645069830104 and parameters: {'model_type': 'graphsage', 'hidden_dims': '[512, 256]', 'dropout': 0.10833002845095943, 'batch_norm': False, 'sage_aggr': 'max', 'sage_normalize': False, 'sage_project': False, 'lr': 0.00047737559642687294, 'weight_decay': 3.088251976701224e-05, 'epochs': 289, 'loss': 'mse', 'optimizer': 'adam', 'graph_mode': 'knn', 'knn_k': 7, 'weighted_edges': True, 'symmetrize_mode': 'mutual', 'self_loops': True, 'use_snp_selection': True, 'num_snps': 8670}. Best is trial 35 with value: 0.3836273050545894.
[I 2025-12-09 08:25:35,632] Trial 47 finished with value: 0.32058325164513357 and parameters: {'model_type': 'graphsage', 'hidden_dims': '[512, 256]', 'dropout': 0.312599143308301, 'batch_norm': True, 'sage_aggr': 'max', 'sage_normalize': True, 'sage_project': False, 'lr': 4.1954318933553976e-05, 'weight_decay': 0.0005947851279011089, 'epochs': 330, 'loss': 'mse', 'optimizer': 'adam', 'graph_mode': 'cutoff', 'cutoff': 0.6711531566210868, 'grm_norm': 'cosine', 'self_loops': True, 'use_snp_selection': True, 'num_snps': 23230}. Best is trial 35 with value: 0.3836273050545894.
[I 2025-12-09 08:29:53,860] Trial 48 finished with value: 0.36744316244272157 and parameters: {'model_type': 'graphsage', 'hidden_dims': '[256, 128]', 'dropout': 0.2214769959516066, 'batch_norm': False, 'sage_aggr': 'mean', 'sage_normalize': False, 'sage_project': False, 'lr': 2.220759328905421e-05, 'weight_decay': 0.0001168929287683107, 'epochs': 266, 'loss': 'mse', 'optimizer': 'adam', 'graph_mode': 'knn', 'knn_k': 8, 'weighted_edges': True, 'symmetrize_mode': 'union', 'self_loops': True, 'use_snp_selection': True, 'num_snps': 40102}. Best is trial 35 with value: 0.3836273050545894.
[I 2025-12-09 08:31:14,214] Trial 49 finished with value: 0.35308831600007623 and parameters: {'model_type': 'graphsage', 'hidden_dims': '[256, 128, 64]', 'dropout': 0.28168202473231996, 'batch_norm': False, 'sage_aggr': 'max', 'sage_normalize': False, 'sage_project': False, 'lr': 7.383631765793669e-05, 'weight_decay': 0.00018905432573036645, 'epochs': 238, 'loss': 'mse', 'optimizer': 'adam', 'graph_mode': 'cutoff', 'cutoff': 0.3635802500471632, 'grm_norm': 'gcn', 'self_loops': True, 'use_snp_selection': True, 'num_snps': 26483}. Best is trial 35 with value: 0.3836273050545894.
[I 2025-12-09 08:34:39,964] Trial 50 finished with value: 0.2927191401223815 and parameters: {'model_type': 'graphsage', 'hidden_dims': '[512, 256]', 'dropout': 0.34711086156069043, 'batch_norm': True, 'sage_aggr': 'max', 'sage_normalize': True, 'sage_project': False, 'lr': 0.000138578637822456, 'weight_decay': 2.1931901497023377e-05, 'epochs': 290, 'loss': 'mse', 'optimizer': 'adam', 'graph_mode': 'knn', 'knn_k': 6, 'weighted_edges': False, 'symmetrize_mode': 'mutual', 'self_loops': True, 'use_snp_selection': False}. Best is trial 35 with value: 0.3836273050545894.
[I 2025-12-09 08:35:17,450] Trial 51 finished with value: 0.3624164128149951 and parameters: {'model_type': 'graphsage', 'hidden_dims': '[512, 256]', 'dropout': 0.10239584771286751, 'batch_norm': False, 'sage_aggr': 'max', 'sage_normalize': False, 'sage_project': False, 'lr': 0.00044844867533420875, 'weight_decay': 3.3269922165971124e-05, 'epochs': 290, 'loss': 'mse', 'optimizer': 'adam', 'graph_mode': 'knn', 'knn_k': 7, 'weighted_edges': True, 'symmetrize_mode': 'mutual', 'self_loops': True, 'use_snp_selection': True, 'num_snps': 7177}. Best is trial 35 with value: 0.3836273050545894.
[I 2025-12-09 08:36:09,621] Trial 52 finished with value: 0.3574131910113515 and parameters: {'model_type': 'graphsage', 'hidden_dims': '[512, 256]', 'dropout': 0.11942543847408806, 'batch_norm': False, 'sage_aggr': 'max', 'sage_normalize': False, 'sage_project': False, 'lr': 0.0005389348621585936, 'weight_decay': 1.519219133556681e-05, 'epochs': 298, 'loss': 'mse', 'optimizer': 'adam', 'graph_mode': 'knn', 'knn_k': 7, 'weighted_edges': True, 'symmetrize_mode': 'mutual', 'self_loops': True, 'use_snp_selection': True, 'num_snps': 10831}. Best is trial 35 with value: 0.3836273050545894.
[I 2025-12-09 08:36:42,429] Trial 53 finished with value: 0.354356872193497 and parameters: {'model_type': 'graphsage', 'hidden_dims': '[512, 256]', 'dropout': 0.16992356814464799, 'batch_norm': False, 'sage_aggr': 'max', 'sage_normalize': False, 'sage_project': False, 'lr': 9.65076888211911e-05, 'weight_decay': 4.1790272704234714e-05, 'epochs': 256, 'loss': 'mse', 'optimizer': 'adam', 'graph_mode': 'knn', 'knn_k': 8, 'weighted_edges': True, 'symmetrize_mode': 'mutual', 'self_loops': True, 'use_snp_selection': True, 'num_snps': 6480}. Best is trial 35 with value: 0.3836273050545894.
[I 2025-12-09 08:37:20,564] Trial 54 finished with value: 0.3610695793385318 and parameters: {'model_type': 'graphsage', 'hidden_dims': '[512, 256]', 'dropout': 0.13573936807754033, 'batch_norm': False, 'sage_aggr': 'max', 'sage_normalize': False, 'sage_project': False, 'lr': 0.00025940181784308956, 'weight_decay': 6.937370675078005e-05, 'epochs': 165, 'loss': 'mse', 'optimizer': 'adam', 'graph_mode': 'knn', 'knn_k': 9, 'weighted_edges': True, 'symmetrize_mode': 'mutual', 'self_loops': True, 'use_snp_selection': True, 'num_snps': 11951}. Best is trial 35 with value: 0.3836273050545894.
[I 2025-12-09 08:38:00,939] Trial 55 finished with value: 0.04243972603459291 and parameters: {'model_type': 'graphsage', 'hidden_dims': '[512, 256]', 'dropout': 0.12545308664530466, 'batch_norm': False, 'sage_aggr': 'max', 'sage_normalize': False, 'sage_project': False, 'lr': 0.008591258697358658, 'weight_decay': 5.807378974051988e-06, 'epochs': 141, 'loss': 'mse', 'optimizer': 'adam', 'graph_mode': 'knn', 'knn_k': 1, 'weighted_edges': True, 'symmetrize_mode': 'mutual', 'self_loops': True, 'use_snp_selection': True, 'num_snps': 22706}. Best is trial 35 with value: 0.3836273050545894.
[I 2025-12-09 08:38:33,724] Trial 56 finished with value: 0.0014026592948540584 and parameters: {'model_type': 'graphsage', 'hidden_dims': '[512, 128]', 'dropout': 0.15889317924690385, 'batch_norm': False, 'sage_aggr': 'max', 'sage_normalize': False, 'sage_project': False, 'lr': 0.00163852797040819, 'weight_decay': 2.38480941139572e-05, 'epochs': 99, 'loss': 'mse', 'optimizer': 'adam', 'graph_mode': 'knn', 'knn_k': 7, 'weighted_edges': True, 'symmetrize_mode': 'mutual', 'self_loops': True, 'use_snp_selection': True, 'num_snps': 17111}. Best is trial 35 with value: 0.3836273050545894.
[I 2025-12-09 08:39:59,837] Trial 57 finished with value: 0.36395222981202946 and parameters: {'model_type': 'graphsage', 'hidden_dims': '[512, 256]', 'dropout': 0.23613528110446033, 'batch_norm': False, 'sage_aggr': 'max', 'sage_normalize': False, 'sage_project': False, 'lr': 0.00016687659535473615, 'weight_decay': 0.0003310573454310018, 'epochs': 206, 'loss': 'mse', 'optimizer': 'adam', 'graph_mode': 'cutoff', 'cutoff': 0.49249749841564755, 'grm_norm': 'gcn', 'self_loops': True, 'use_snp_selection': True, 'num_snps': 31079}. Best is trial 35 with value: 0.3836273050545894.
[I 2025-12-09 08:40:35,608] Trial 58 finished with value: 0.3415410851655222 and parameters: {'model_type': 'graphsage', 'hidden_dims': '[512, 256]', 'dropout': 0.19478963615980277, 'batch_norm': False, 'sage_aggr': 'mean', 'sage_normalize': True, 'sage_project': False, 'lr': 1.4235276158298654e-05, 'weight_decay': 9.443048966694199e-06, 'epochs': 330, 'loss': 'mse', 'optimizer': 'adam', 'graph_mode': 'knn', 'knn_k': 9, 'weighted_edges': False, 'symmetrize_mode': 'union', 'self_loops': True, 'use_snp_selection': True, 'num_snps': 4663}. Best is trial 35 with value: 0.3836273050545894.
[I 2025-12-09 08:40:49,863] Trial 59 finished with value: 0.33566258673579374 and parameters: {'model_type': 'graphsage', 'hidden_dims': '[256, 128]', 'dropout': 0.29578754972386523, 'batch_norm': True, 'sage_aggr': 'max', 'sage_normalize': False, 'sage_project': False, 'lr': 2.6988355750549624e-05, 'weight_decay': 7.795618516182771e-05, 'epochs': 218, 'loss': 'mse', 'optimizer': 'adam', 'graph_mode': 'knn', 'knn_k': 8, 'weighted_edges': True, 'symmetrize_mode': 'mutual', 'self_loops': True, 'use_snp_selection': True, 'num_snps': 2170}. Best is trial 35 with value: 0.3836273050545894.
[I 2025-12-09 08:41:40,452] Trial 60 finished with value: 0.3355122582026491 and parameters: {'model_type': 'graphsage', 'hidden_dims': '[512, 128]', 'dropout': 0.3911701587517671, 'batch_norm': False, 'sage_aggr': 'max', 'sage_normalize': True, 'sage_project': False, 'lr': 0.0003728144738504093, 'weight_decay': 1.230586041790905e-05, 'epochs': 179, 'loss': 'mse', 'optimizer': 'adam', 'graph_mode': 'cutoff', 'cutoff': 0.7179614593589383, 'grm_norm': 'cosine', 'self_loops': True, 'use_snp_selection': True, 'num_snps': 25658}. Best is trial 35 with value: 0.3836273050545894.
[I 2025-12-09 08:46:00,691] Trial 61 finished with value: 0.36388447565234655 and parameters: {'model_type': 'graphsage', 'hidden_dims': '[256, 128]', 'dropout': 0.22067712516315557, 'batch_norm': False, 'sage_aggr': 'mean', 'sage_normalize': False, 'sage_project': False, 'lr': 2.0638943319269348e-05, 'weight_decay': 0.00014002324867270525, 'epochs': 273, 'loss': 'mse', 'optimizer': 'adam', 'graph_mode': 'knn', 'knn_k': 8, 'weighted_edges': True, 'symmetrize_mode': 'union', 'self_loops': True, 'use_snp_selection': True, 'num_snps': 40014}. Best is trial 35 with value: 0.3836273050545894.
[I 2025-12-09 08:50:01,393] Trial 62 finished with value: 0.3681629781041624 and parameters: {'model_type': 'graphsage', 'hidden_dims': '[256, 128]', 'dropout': 0.26148814075228183, 'batch_norm': False, 'sage_aggr': 'mean', 'sage_normalize': False, 'sage_project': False, 'lr': 5.500346380212114e-05, 'weight_decay': 0.00011376876518565151, 'epochs': 261, 'loss': 'mse', 'optimizer': 'adam', 'graph_mode': 'knn', 'knn_k': 8, 'weighted_edges': True, 'symmetrize_mode': 'union', 'self_loops': True, 'use_snp_selection': True, 'num_snps': 38510}. Best is trial 35 with value: 0.3836273050545894.
[I 2025-12-09 08:55:17,713] Trial 63 finished with value: 0.3757534211297009 and parameters: {'model_type': 'graphsage', 'hidden_dims': '[256, 128]', 'dropout': 0.43532175451450517, 'batch_norm': False, 'sage_aggr': 'mean', 'sage_normalize': False, 'sage_project': False, 'lr': 5.96875573199041e-05, 'weight_decay': 3.511529856775851e-05, 'epochs': 235, 'loss': 'mse', 'optimizer': 'adam', 'graph_mode': 'knn', 'knn_k': 9, 'weighted_edges': True, 'symmetrize_mode': 'union', 'self_loops': True, 'use_snp_selection': True, 'num_snps': 49120}. Best is trial 35 with value: 0.3836273050545894.
[I 2025-12-09 09:00:51,971] Trial 64 finished with value: 0.29417022235299084 and parameters: {'model_type': 'graphsage', 'hidden_dims': '[256, 128]', 'dropout': 0.4298577343074208, 'batch_norm': False, 'sage_aggr': 'mean', 'sage_normalize': False, 'sage_project': False, 'lr': 6.572643595615547e-05, 'weight_decay': 6.039548608747972e-05, 'epochs': 238, 'loss': 'mae', 'optimizer': 'adam', 'graph_mode': 'knn', 'knn_k': 9, 'weighted_edges': True, 'symmetrize_mode': 'union', 'self_loops': True, 'use_snp_selection': True, 'num_snps': 50380}. Best is trial 35 with value: 0.3836273050545894.
[I 2025-12-09 09:06:20,236] Trial 65 finished with value: 0.3781675563649377 and parameters: {'model_type': 'graphsage', 'hidden_dims': '[128, 64]', 'dropout': 0.4048052175722394, 'batch_norm': False, 'sage_aggr': 'mean', 'sage_normalize': False, 'sage_project': False, 'lr': 3.4573919983270665e-05, 'weight_decay': 3.222524335397662e-05, 'epochs': 233, 'loss': 'mse', 'optimizer': 'adam', 'graph_mode': 'knn', 'knn_k': 10, 'weighted_edges': True, 'symmetrize_mode': 'union', 'self_loops': False, 'use_snp_selection': True, 'num_snps': 53017}. Best is trial 35 with value: 0.3836273050545894.
[I 2025-12-09 09:11:41,098] Trial 66 finished with value: 0.36033701496742543 and parameters: {'model_type': 'graphsage', 'hidden_dims': '[128, 64]', 'dropout': 0.4888878243583457, 'batch_norm': False, 'sage_aggr': 'mean', 'sage_normalize': False, 'sage_project': False, 'lr': 3.499948488163137e-05, 'weight_decay': 1.9310676491238905e-05, 'epochs': 224, 'loss': 'mae', 'optimizer': 'adam', 'graph_mode': 'knn', 'knn_k': 10, 'weighted_edges': True, 'symmetrize_mode': 'union', 'self_loops': False, 'use_snp_selection': True, 'num_snps': 53939}. Best is trial 35 with value: 0.3836273050545894.
[I 2025-12-09 09:14:10,177] Trial 67 finished with value: 0.31204579586776277 and parameters: {'model_type': 'graphsage', 'hidden_dims': '[128, 64]', 'dropout': 0.45581921974367606, 'batch_norm': True, 'sage_aggr': 'mean', 'sage_normalize': False, 'sage_project': False, 'lr': 9.666228294182338e-05, 'weight_decay': 3.7313767686231255e-05, 'epochs': 198, 'loss': 'mse', 'optimizer': 'adam', 'graph_mode': 'knn', 'knn_k': 10, 'weighted_edges': True, 'symmetrize_mode': 'union', 'self_loops': False, 'use_snp_selection': False}. Best is trial 35 with value: 0.3836273050545894.
[I 2025-12-09 09:15:19,149] Trial 68 finished with value: 0.3274577696047033 and parameters: {'model_type': 'graphsage', 'hidden_dims': '[128, 64]', 'dropout': 0.41706524069446665, 'batch_norm': False, 'sage_aggr': 'mean', 'sage_normalize': True, 'sage_project': False, 'lr': 4.985293563026029e-05, 'weight_decay': 8.776908532161065e-05, 'epochs': 213, 'loss': 'mae', 'optimizer': 'adam', 'graph_mode': 'cutoff', 'cutoff': 0.5873946176102358, 'grm_norm': 'none', 'self_loops': False, 'use_snp_selection': True, 'num_snps': 58845}. Best is trial 35 with value: 0.3836273050545894.
