[I 2025-12-09 15:59:06,130] Trial 105 finished with value: 0.3741025339666786 and parameters: {'model_type': 'graphsage', 'hidden_dims': '[128, 64]', 'dropout': 0.3142949855007289, 'batch_norm': False, 'sage_aggr': 'mean', 'sage_normalize': False, 'sage_project': False, 'lr': 0.00020738793460107314, 'weight_decay': 0.00032470497259752757, 'epochs': 159, 'loss': 'mae', 'optimizer': 'adam', 'graph_mode': 'knn', 'knn_k': 9, 'weighted_edges': True, 'symmetrize_mode': 'union', 'self_loops': True, 'use_snp_selection': True, 'num_snps': 24142}. Best is trial 89 with value: 0.3741045796063055.
[I 2025-12-09 16:00:00,682] Trial 106 finished with value: 0.35936518597039974 and parameters: {'model_type': 'graphsage', 'hidden_dims': '[128, 64]', 'dropout': 0.32894953126710513, 'batch_norm': False, 'sage_aggr': 'mean', 'sage_normalize': False, 'sage_project': False, 'lr': 0.00019592236612933024, 'weight_decay': 0.00014556721051799888, 'epochs': 138, 'loss': 'mae', 'optimizer': 'adam', 'graph_mode': 'knn', 'knn_k': 9, 'weighted_edges': True, 'symmetrize_mode': 'mutual', 'self_loops': True, 'use_snp_selection': True, 'num_snps': 23374}. Best is trial 89 with value: 0.3741045796063055.
[I 2025-12-09 16:01:03,573] Trial 107 finished with value: 0.36277775328678186 and parameters: {'model_type': 'graphsage', 'hidden_dims': '[128, 64]', 'dropout': 0.28365234733774075, 'batch_norm': False, 'sage_aggr': 'mean', 'sage_normalize': False, 'sage_project': False, 'lr': 0.00013339775784710053, 'weight_decay': 0.00032871322633076333, 'epochs': 146, 'loss': 'mae', 'optimizer': 'adam', 'graph_mode': 'knn', 'knn_k': 8, 'weighted_edges': True, 'symmetrize_mode': 'union', 'self_loops': True, 'use_snp_selection': True, 'num_snps': 20336}. Best is trial 89 with value: 0.3741045796063055.
[I 2025-12-09 16:02:43,329] Trial 108 finished with value: 0.3681153902800815 and parameters: {'model_type': 'graphsage', 'hidden_dims': '[256, 128]', 'dropout': 0.3162903525746741, 'batch_norm': False, 'sage_aggr': 'mean', 'sage_normalize': False, 'sage_project': False, 'lr': 0.00040200364289008585, 'weight_decay': 0.00010376312249613109, 'epochs': 139, 'loss': 'mae', 'optimizer': 'adam', 'graph_mode': 'knn', 'knn_k': 9, 'weighted_edges': True, 'symmetrize_mode': 'union', 'self_loops': True, 'use_snp_selection': True, 'num_snps': 31571}. Best is trial 89 with value: 0.3741045796063055.
[I 2025-12-09 16:03:33,346] Trial 109 finished with value: 0.2873382134947483 and parameters: {'model_type': 'graphsage', 'hidden_dims': '[256, 128]', 'dropout': 0.5906960687560325, 'batch_norm': False, 'sage_aggr': 'mean', 'sage_normalize': False, 'sage_project': False, 'lr': 0.0005481353669819628, 'weight_decay': 0.0001907389155152777, 'epochs': 129, 'loss': 'mse', 'optimizer': 'adam', 'graph_mode': 'knn', 'knn_k': 9, 'weighted_edges': False, 'symmetrize_mode': 'union', 'self_loops': True, 'use_snp_selection': True, 'num_snps': 15156}. Best is trial 89 with value: 0.3741045796063055.
[I 2025-12-09 16:05:25,298] Trial 110 finished with value: 0.330206582517554 and parameters: {'model_type': 'graphsage', 'hidden_dims': '[256, 128]', 'dropout': 0.32124329507795074, 'batch_norm': True, 'sage_aggr': 'mean', 'sage_normalize': False, 'sage_project': False, 'lr': 0.0004264842485348079, 'weight_decay': 0.00010036406530159944, 'epochs': 161, 'loss': 'mae', 'optimizer': 'adam', 'graph_mode': 'knn', 'knn_k': 8, 'weighted_edges': True, 'symmetrize_mode': 'union', 'self_loops': True, 'use_snp_selection': True, 'num_snps': 31317}. Best is trial 89 with value: 0.3741045796063055.
[I 2025-12-09 16:06:49,447] Trial 111 finished with value: 0.3719508435157947 and parameters: {'model_type': 'graphsage', 'hidden_dims': '[256, 128]', 'dropout': 0.3013126241142675, 'batch_norm': False, 'sage_aggr': 'mean', 'sage_normalize': False, 'sage_project': False, 'lr': 0.0003666580912901163, 'weight_decay': 0.00013295064120491315, 'epochs': 150, 'loss': 'mae', 'optimizer': 'adam', 'graph_mode': 'knn', 'knn_k': 9, 'weighted_edges': True, 'symmetrize_mode': 'union', 'self_loops': True, 'use_snp_selection': True, 'num_snps': 27371}. Best is trial 89 with value: 0.3741045796063055.
[I 2025-12-09 16:07:59,925] Trial 112 finished with value: 0.3521030495656236 and parameters: {'model_type': 'graphsage', 'hidden_dims': '[256, 128]', 'dropout': 0.29939257332773017, 'batch_norm': False, 'sage_aggr': 'mean', 'sage_normalize': False, 'sage_project': False, 'lr': 0.0003438866642159499, 'weight_decay': 0.0002288109968559942, 'epochs': 187, 'loss': 'mae', 'optimizer': 'adam', 'graph_mode': 'knn', 'knn_k': 9, 'weighted_edges': True, 'symmetrize_mode': 'union', 'self_loops': True, 'use_snp_selection': True, 'num_snps': 18527}. Best is trial 89 with value: 0.3741045796063055.
[I 2025-12-09 16:09:15,684] Trial 113 finished with value: 0.3596714997196944 and parameters: {'model_type': 'graphsage', 'hidden_dims': '[256, 128]', 'dropout': 0.26579132727802735, 'batch_norm': False, 'sage_aggr': 'mean', 'sage_normalize': False, 'sage_project': False, 'lr': 0.000738180154436547, 'weight_decay': 0.0001245016340583494, 'epochs': 179, 'loss': 'mae', 'optimizer': 'adam', 'graph_mode': 'knn', 'knn_k': 8, 'weighted_edges': True, 'symmetrize_mode': 'mutual', 'self_loops': True, 'use_snp_selection': True, 'num_snps': 27790}. Best is trial 89 with value: 0.3741045796063055.
[I 2025-12-09 16:10:26,458] Trial 114 finished with value: 0.36340950957676343 and parameters: {'model_type': 'graphsage', 'hidden_dims': '[256, 128]', 'dropout': 0.334442553198966, 'batch_norm': False, 'sage_aggr': 'mean', 'sage_normalize': False, 'sage_project': False, 'lr': 0.0005594089604189755, 'weight_decay': 0.00031890370054018374, 'epochs': 149, 'loss': 'mae', 'optimizer': 'adam', 'graph_mode': 'knn', 'knn_k': 9, 'weighted_edges': True, 'symmetrize_mode': 'union', 'self_loops': True, 'use_snp_selection': True, 'num_snps': 21305}. Best is trial 89 with value: 0.3741045796063055.
[I 2025-12-09 16:12:13,039] Trial 115 finished with value: 0.3616331050309079 and parameters: {'model_type': 'graphsage', 'hidden_dims': '[256, 128]', 'dropout': 0.35124392524493014, 'batch_norm': False, 'sage_aggr': 'mean', 'sage_normalize': False, 'sage_project': False, 'lr': 0.00037669980931442383, 'weight_decay': 0.00043182338395227385, 'epochs': 142, 'loss': 'mae', 'optimizer': 'adam', 'graph_mode': 'knn', 'knn_k': 9, 'weighted_edges': True, 'symmetrize_mode': 'union', 'self_loops': True, 'use_snp_selection': True, 'num_snps': 34637}. Best is trial 89 with value: 0.3741045796063055.
[I 2025-12-09 16:13:23,029] Trial 116 finished with value: 0.33155236124036935 and parameters: {'model_type': 'graphsage', 'hidden_dims': '[256, 128, 64]', 'dropout': 0.31856674648846084, 'batch_norm': False, 'sage_aggr': 'mean', 'sage_normalize': True, 'sage_project': False, 'lr': 0.0001849006669028346, 'weight_decay': 0.00011009649111214182, 'epochs': 108, 'loss': 'mae', 'optimizer': 'adam', 'graph_mode': 'knn', 'knn_k': 8, 'weighted_edges': True, 'symmetrize_mode': 'union', 'self_loops': True, 'use_snp_selection': True, 'num_snps': 24297}. Best is trial 89 with value: 0.3741045796063055.
[I 2025-12-09 16:14:35,469] Trial 117 finished with value: 0.3502782113509619 and parameters: {'model_type': 'graphsage', 'hidden_dims': '[128, 64]', 'dropout': 0.2795028549687746, 'batch_norm': False, 'sage_aggr': 'mean', 'sage_normalize': False, 'sage_project': False, 'lr': 0.00029851616908222736, 'weight_decay': 7.78110399738809e-05, 'epochs': 115, 'loss': 'mae', 'optimizer': 'adam', 'graph_mode': 'knn', 'knn_k': 9, 'weighted_edges': False, 'symmetrize_mode': 'union', 'self_loops': True, 'use_snp_selection': False}. Best is trial 89 with value: 0.3741045796063055.
[I 2025-12-09 16:16:33,133] Trial 118 finished with value: 0.37144730884847776 and parameters: {'model_type': 'graphsage', 'hidden_dims': '[256, 128]', 'dropout': 0.2934856446309088, 'batch_norm': False, 'sage_aggr': 'mean', 'sage_normalize': False, 'sage_project': False, 'lr': 0.0001488075876620164, 'weight_decay': 0.00013809877138217422, 'epochs': 165, 'loss': 'mae', 'optimizer': 'adam', 'graph_mode': 'knn', 'knn_k': 9, 'weighted_edges': True, 'symmetrize_mode': 'union', 'self_loops': True, 'use_snp_selection': True, 'num_snps': 30868}. Best is trial 89 with value: 0.3741045796063055.
[I 2025-12-09 16:17:40,172] Trial 119 finished with value: 0.3653358130847344 and parameters: {'model_type': 'graphsage', 'hidden_dims': '[128, 64]', 'dropout': 0.2958897961599053, 'batch_norm': False, 'sage_aggr': 'mean', 'sage_normalize': False, 'sage_project': False, 'lr': 0.00022756929494591334, 'weight_decay': 0.00014837126004034053, 'epochs': 166, 'loss': 'mae', 'optimizer': 'adam', 'graph_mode': 'knn', 'knn_k': 8, 'weighted_edges': True, 'symmetrize_mode': 'union', 'self_loops': True, 'use_snp_selection': True, 'num_snps': 22083}. Best is trial 89 with value: 0.3741045796063055.
[I 2025-12-09 16:19:26,880] Trial 120 finished with value: 0.3679355991002946 and parameters: {'model_type': 'graphsage', 'hidden_dims': '[128, 64]', 'dropout': 0.26572625076081385, 'batch_norm': False, 'sage_aggr': 'mean', 'sage_normalize': False, 'sage_project': False, 'lr': 0.00014371681321350034, 'weight_decay': 0.00017859587016763723, 'epochs': 154, 'loss': 'mae', 'optimizer': 'adam', 'graph_mode': 'knn', 'knn_k': 10, 'weighted_edges': True, 'symmetrize_mode': 'union', 'self_loops': True, 'use_snp_selection': True, 'num_snps': 28918}. Best is trial 89 with value: 0.3741045796063055.
[I 2025-12-09 16:21:40,719] Trial 121 finished with value: 0.37144617222153675 and parameters: {'model_type': 'graphsage', 'hidden_dims': '[256, 128]', 'dropout': 0.3134653570106668, 'batch_norm': False, 'sage_aggr': 'mean', 'sage_normalize': False, 'sage_project': False, 'lr': 8.959752210112411e-05, 'weight_decay': 0.00010397613481852537, 'epochs': 193, 'loss': 'mae', 'optimizer': 'adam', 'graph_mode': 'knn', 'knn_k': 9, 'weighted_edges': True, 'symmetrize_mode': 'union', 'self_loops': True, 'use_snp_selection': True, 'num_snps': 30552}. Best is trial 89 with value: 0.3741045796063055.
[I 2025-12-09 16:23:46,639] Trial 122 finished with value: 0.3724718316281655 and parameters: {'model_type': 'graphsage', 'hidden_dims': '[256, 128]', 'dropout': 0.281668396120378, 'batch_norm': False, 'sage_aggr': 'mean', 'sage_normalize': False, 'sage_project': False, 'lr': 9.441808113180996e-05, 'weight_decay': 3.927380037950801e-05, 'epochs': 175, 'loss': 'mae', 'optimizer': 'adam', 'graph_mode': 'knn', 'knn_k': 9, 'weighted_edges': True, 'symmetrize_mode': 'union', 'self_loops': True, 'use_snp_selection': True, 'num_snps': 30894}. Best is trial 89 with value: 0.3741045796063055.
[I 2025-12-09 16:25:54,247] Trial 123 finished with value: 0.3658570490722454 and parameters: {'model_type': 'graphsage', 'hidden_dims': '[256, 128]', 'dropout': 0.2781600448261065, 'batch_norm': False, 'sage_aggr': 'mean', 'sage_normalize': False, 'sage_project': False, 'lr': 8.995272565638171e-05, 'weight_decay': 4.0153175880895405e-05, 'epochs': 199, 'loss': 'mae', 'optimizer': 'adam', 'graph_mode': 'knn', 'knn_k': 9, 'weighted_edges': True, 'symmetrize_mode': 'union', 'self_loops': True, 'use_snp_selection': True, 'num_snps': 31153}. Best is trial 89 with value: 0.3741045796063055.
[I 2025-12-09 16:28:05,544] Trial 124 finished with value: 0.366206040328705 and parameters: {'model_type': 'graphsage', 'hidden_dims': '[256, 128]', 'dropout': 0.28923123151627217, 'batch_norm': False, 'sage_aggr': 'mean', 'sage_normalize': False, 'sage_project': False, 'lr': 0.00010301372029197315, 'weight_decay': 6.893900550541451e-05, 'epochs': 190, 'loss': 'mae', 'optimizer': 'adam', 'graph_mode': 'knn', 'knn_k': 8, 'weighted_edges': True, 'symmetrize_mode': 'union', 'self_loops': True, 'use_snp_selection': True, 'num_snps': 33516}. Best is trial 89 with value: 0.3741045796063055.
[I 2025-12-09 16:29:53,921] Trial 125 finished with value: 0.36564692245054536 and parameters: {'model_type': 'graphsage', 'hidden_dims': '[256, 128]', 'dropout': 0.2993639549729258, 'batch_norm': False, 'sage_aggr': 'mean', 'sage_normalize': False, 'sage_project': False, 'lr': 0.00011240280007646336, 'weight_decay': 0.00013140795828929473, 'epochs': 158, 'loss': 'mae', 'optimizer': 'adam', 'graph_mode': 'knn', 'knn_k': 9, 'weighted_edges': True, 'symmetrize_mode': 'union', 'self_loops': True, 'use_snp_selection': True, 'num_snps': 30367}. Best is trial 89 with value: 0.3741045796063055.
[I 2025-12-09 16:31:11,058] Trial 126 finished with value: 0.3672192204162953 and parameters: {'model_type': 'graphsage', 'hidden_dims': '[256, 128]', 'dropout': 0.2591154502430734, 'batch_norm': False, 'sage_aggr': 'mean', 'sage_normalize': False, 'sage_project': False, 'lr': 5.683659541055676e-05, 'weight_decay': 4.9399182714477716e-05, 'epochs': 176, 'loss': 'mae', 'optimizer': 'adam', 'graph_mode': 'knn', 'knn_k': 10, 'weighted_edges': True, 'symmetrize_mode': 'mutual', 'self_loops': True, 'use_snp_selection': True, 'num_snps': 27428}. Best is trial 89 with value: 0.3741045796063055.
[I 2025-12-09 16:33:33,960] Trial 127 finished with value: 0.36799965762419495 and parameters: {'model_type': 'graphsage', 'hidden_dims': '[256, 128]', 'dropout': 0.23391030416892053, 'batch_norm': False, 'sage_aggr': 'mean', 'sage_normalize': False, 'sage_project': False, 'lr': 9.296980395970241e-05, 'weight_decay': 0.0002206006323584316, 'epochs': 193, 'loss': 'mae', 'optimizer': 'adam', 'graph_mode': 'knn', 'knn_k': 9, 'weighted_edges': True, 'symmetrize_mode': 'union', 'self_loops': True, 'use_snp_selection': True, 'num_snps': 35518}. Best is trial 89 with value: 0.3741045796063055.
[I 2025-12-09 16:34:39,699] Trial 128 finished with value: 0.3649071469884106 and parameters: {'model_type': 'graphsage', 'hidden_dims': '[256, 128]', 'dropout': 0.30515527134371506, 'batch_norm': False, 'sage_aggr': 'mean', 'sage_normalize': False, 'sage_project': False, 'lr': 0.00015724749899925203, 'weight_decay': 8.831756532767874e-05, 'epochs': 182, 'loss': 'mae', 'optimizer': 'adam', 'graph_mode': 'knn', 'knn_k': 2, 'weighted_edges': True, 'symmetrize_mode': 'union', 'self_loops': True, 'use_snp_selection': True, 'num_snps': 28594}. Best is trial 89 with value: 0.3741045796063055.
[I 2025-12-09 16:36:15,607] Trial 129 finished with value: 0.36803010601385544 and parameters: {'model_type': 'graphsage', 'hidden_dims': '[256, 128]', 'dropout': 0.28411849426844393, 'batch_norm': False, 'sage_aggr': 'mean', 'sage_normalize': False, 'sage_project': False, 'lr': 0.00012535542552502858, 'weight_decay': 3.752175661376801e-05, 'epochs': 149, 'loss': 'mae', 'optimizer': 'adam', 'graph_mode': 'knn', 'knn_k': 7, 'weighted_edges': False, 'symmetrize_mode': 'union', 'self_loops': True, 'use_snp_selection': True, 'num_snps': 32243}. Best is trial 89 with value: 0.3741045796063055.
[I 2025-12-09 16:38:00,351] Trial 130 finished with value: 0.34583070803278854 and parameters: {'model_type': 'graphsage', 'hidden_dims': '[256, 128, 64]', 'dropout': 0.33682814889250134, 'batch_norm': False, 'sage_aggr': 'mean', 'sage_normalize': False, 'sage_project': False, 'lr': 7.893985596823967e-05, 'weight_decay': 9.868962701036429e-05, 'epochs': 208, 'loss': 'mse', 'optimizer': 'adam', 'graph_mode': 'knn', 'knn_k': 8, 'weighted_edges': True, 'symmetrize_mode': 'union', 'self_loops': True, 'use_snp_selection': True, 'num_snps': 25895}. Best is trial 89 with value: 0.3741045796063055.
[I 2025-12-09 16:39:04,631] Trial 131 finished with value: 0.3649738836950458 and parameters: {'model_type': 'graphsage', 'hidden_dims': '[128, 64]', 'dropout': 0.3275473102528133, 'batch_norm': False, 'sage_aggr': 'mean', 'sage_normalize': False, 'sage_project': False, 'lr': 0.00020712102417779152, 'weight_decay': 0.0002857817893434113, 'epochs': 172, 'loss': 'mae', 'optimizer': 'adam', 'graph_mode': 'knn', 'knn_k': 9, 'weighted_edges': True, 'symmetrize_mode': 'union', 'self_loops': True, 'use_snp_selection': True, 'num_snps': 19702}. Best is trial 89 with value: 0.3741045796063055.
[I 2025-12-09 16:40:30,819] Trial 132 finished with value: 0.36657353682824523 and parameters: {'model_type': 'graphsage', 'hidden_dims': '[256, 128]', 'dropout': 0.3119168221060692, 'batch_norm': False, 'sage_aggr': 'mean', 'sage_normalize': False, 'sage_project': False, 'lr': 0.00017181007379385397, 'weight_decay': 0.0007514544353676908, 'epochs': 162, 'loss': 'mae', 'optimizer': 'adam', 'graph_mode': 'knn', 'knn_k': 9, 'weighted_edges': True, 'symmetrize_mode': 'union', 'self_loops': True, 'use_snp_selection': True, 'num_snps': 23309}. Best is trial 89 with value: 0.3741045796063055.
[I 2025-12-09 16:42:37,560] Trial 133 finished with value: 0.36353383650374166 and parameters: {'model_type': 'graphsage', 'hidden_dims': '[512, 64]', 'dropout': 0.34704725970068184, 'batch_norm': False, 'sage_aggr': 'mean', 'sage_normalize': False, 'sage_project': False, 'lr': 6.622893973867054e-05, 'weight_decay': 0.00016744583253237497, 'epochs': 168, 'loss': 'mae', 'optimizer': 'adam', 'graph_mode': 'knn', 'knn_k': 9, 'weighted_edges': True, 'symmetrize_mode': 'union', 'self_loops': True, 'use_snp_selection': True, 'num_snps': 29519}. Best is trial 89 with value: 0.3741045796063055.
[I 2025-12-09 16:43:53,444] Trial 134 finished with value: 0.3709978294541868 and parameters: {'model_type': 'graphsage', 'hidden_dims': '[128, 64]', 'dropout': 0.2532380679058819, 'batch_norm': False, 'sage_aggr': 'mean', 'sage_normalize': False, 'sage_project': False, 'lr': 0.00014111137590858917, 'weight_decay': 0.0004899781571407969, 'epochs': 145, 'loss': 'mae', 'optimizer': 'adam', 'graph_mode': 'knn', 'knn_k': 9, 'weighted_edges': True, 'symmetrize_mode': 'union', 'self_loops': True, 'use_snp_selection': True, 'num_snps': 27232}. Best is trial 89 with value: 0.3741045796063055.
[I 2025-12-09 16:45:14,410] Trial 135 finished with value: 0.3607014489264115 and parameters: {'model_type': 'graphsage', 'hidden_dims': '[128, 64]', 'dropout': 0.27463293620082985, 'batch_norm': False, 'sage_aggr': 'mean', 'sage_normalize': False, 'sage_project': False, 'lr': 0.00010181737021286315, 'weight_decay': 0.0004917249730473687, 'epochs': 125, 'loss': 'mae', 'optimizer': 'adam', 'graph_mode': 'knn', 'knn_k': 10, 'weighted_edges': True, 'symmetrize_mode': 'union', 'self_loops': True, 'use_snp_selection': True, 'num_snps': 26972}. Best is trial 89 with value: 0.3741045796063055.
[I 2025-12-09 16:46:56,841] Trial 136 finished with value: 0.36790283827762515 and parameters: {'model_type': 'graphsage', 'hidden_dims': '[256, 128]', 'dropout': 0.2534807322072736, 'batch_norm': False, 'sage_aggr': 'mean', 'sage_normalize': False, 'sage_project': False, 'lr': 0.00014031711337077402, 'weight_decay': 6.572850898488216e-05, 'epochs': 132, 'loss': 'mae', 'optimizer': 'adam', 'graph_mode': 'knn', 'knn_k': 10, 'weighted_edges': True, 'symmetrize_mode': 'union', 'self_loops': True, 'use_snp_selection': True, 'num_snps': 30133}. Best is trial 89 with value: 0.3741045796063055.
[I 2025-12-09 16:48:29,617] Trial 137 finished with value: 0.3516267303836652 and parameters: {'model_type': 'graphsage', 'hidden_dims': '[512, 256]', 'dropout': 0.2677466816116048, 'batch_norm': True, 'sage_aggr': 'mean', 'sage_normalize': True, 'sage_project': False, 'lr': 8.69726953044164e-05, 'weight_decay': 0.00013027542481357013, 'epochs': 146, 'loss': 'mae', 'optimizer': 'adam', 'graph_mode': 'knn', 'knn_k': 8, 'weighted_edges': True, 'symmetrize_mode': 'union', 'self_loops': True, 'use_snp_selection': True, 'num_snps': 24701}. Best is trial 89 with value: 0.3741045796063055.
[I 2025-12-09 16:49:54,920] Trial 138 finished with value: 0.05530896097632545 and parameters: {'model_type': 'graphsage', 'hidden_dims': '[128, 64]', 'dropout': 0.2912557800839434, 'batch_norm': False, 'sage_aggr': 'mean', 'sage_normalize': False, 'sage_project': False, 'lr': 0.009004654242420184, 'weight_decay': 7.831860893259917e-05, 'epochs': 139, 'loss': 'mae', 'optimizer': 'adam', 'graph_mode': 'knn', 'knn_k': 9, 'weighted_edges': True, 'symmetrize_mode': 'union', 'self_loops': True, 'use_snp_selection': False}. Best is trial 89 with value: 0.3741045796063055.
[I 2025-12-09 16:51:23,985] Trial 139 finished with value: 0.36785558215604197 and parameters: {'model_type': 'graphsage', 'hidden_dims': '[512, 64]', 'dropout': 0.3022734816191349, 'batch_norm': False, 'sage_aggr': 'mean', 'sage_normalize': False, 'sage_project': False, 'lr': 7.05380031166781e-05, 'weight_decay': 0.0007010297243794972, 'epochs': 156, 'loss': 'mae', 'optimizer': 'adam', 'graph_mode': 'knn', 'knn_k': 6, 'weighted_edges': True, 'symmetrize_mode': 'union', 'self_loops': True, 'use_snp_selection': True, 'num_snps': 26909}. Best is trial 89 with value: 0.3741045796063055.
[I 2025-12-09 16:53:12,926] Trial 140 finished with value: 0.3674872123316734 and parameters: {'model_type': 'graphsage', 'hidden_dims': '[256, 128]', 'dropout': 0.2532284327859252, 'batch_norm': False, 'sage_aggr': 'mean', 'sage_normalize': False, 'sage_project': False, 'lr': 0.00011255964360835242, 'weight_decay': 0.000384133959519619, 'epochs': 130, 'loss': 'mae', 'optimizer': 'adam', 'graph_mode': 'knn', 'knn_k': 9, 'weighted_edges': True, 'symmetrize_mode': 'union', 'self_loops': True, 'use_snp_selection': True, 'num_snps': 33415}. Best is trial 89 with value: 0.3741045796063055.
[I 2025-12-09 16:54:44,879] Trial 141 finished with value: 0.36422598860723976 and parameters: {'model_type': 'graphsage', 'hidden_dims': '[128, 64]', 'dropout': 0.21307372982221937, 'batch_norm': False, 'sage_aggr': 'mean', 'sage_normalize': False, 'sage_project': False, 'lr': 0.00024166920119783638, 'weight_decay': 0.00025533377265950534, 'epochs': 174, 'loss': 'mae', 'optimizer': 'adam', 'graph_mode': 'knn', 'knn_k': 9, 'weighted_edges': True, 'symmetrize_mode': 'union', 'self_loops': True, 'use_snp_selection': True, 'num_snps': 28160}. Best is trial 89 with value: 0.3741045796063055.
