[I 2025-12-08 19:49:03,103] Trial 119 finished with value: 0.3054773965948018 and parameters: {'model_type': 'graphsage', 'hidden_dims': '[512, 128]', 'dropout': 0.5360931381896108, 'batch_norm': True, 'sage_aggr': 'max', 'sage_normalize': False, 'sage_project': False, 'lr': 0.006505499137762446, 'weight_decay': 1.6168398406393242e-05, 'epochs': 46, 'loss': 'mse', 'optimizer': 'adam', 'graph_mode': 'cutoff', 'cutoff': 0.6264787169811002, 'grm_norm': 'cosine_then_gcn', 'self_loops': False, 'use_snp_selection': False}. Best is trial 88 with value: 0.3112859159478406.
[I 2025-12-08 19:49:33,749] Trial 120 finished with value: 0.30772168765037117 and parameters: {'model_type': 'graphsage', 'hidden_dims': '[512, 128]', 'dropout': 0.5222589245039402, 'batch_norm': True, 'sage_aggr': 'max', 'sage_normalize': False, 'sage_project': False, 'lr': 0.0035500137594784223, 'weight_decay': 1.1289088734682784e-05, 'epochs': 45, 'loss': 'mae', 'optimizer': 'adam', 'graph_mode': 'cutoff', 'cutoff': 0.6701970046580559, 'grm_norm': 'cosine_then_gcn', 'self_loops': False, 'use_snp_selection': False}. Best is trial 88 with value: 0.3112859159478406.
[I 2025-12-08 19:50:10,042] Trial 121 finished with value: 0.3051413911519257 and parameters: {'model_type': 'graphsage', 'hidden_dims': '[512, 128]', 'dropout': 0.583808170475986, 'batch_norm': True, 'sage_aggr': 'max', 'sage_normalize': False, 'sage_project': False, 'lr': 0.009014684368831759, 'weight_decay': 8.332189139038825e-06, 'epochs': 59, 'loss': 'mse', 'optimizer': 'adam', 'graph_mode': 'cutoff', 'cutoff': 0.6003233263760573, 'grm_norm': 'cosine_then_gcn', 'self_loops': False, 'use_snp_selection': False}. Best is trial 88 with value: 0.3112859159478406.
[I 2025-12-08 19:50:43,470] Trial 122 finished with value: 0.30869039061555303 and parameters: {'model_type': 'graphsage', 'hidden_dims': '[512, 128]', 'dropout': 0.554083099309869, 'batch_norm': True, 'sage_aggr': 'max', 'sage_normalize': False, 'sage_project': False, 'lr': 0.005607660962790417, 'weight_decay': 6.379953611827479e-06, 'epochs': 52, 'loss': 'mse', 'optimizer': 'adam', 'graph_mode': 'cutoff', 'cutoff': 0.6482488198130733, 'grm_norm': 'cosine_then_gcn', 'self_loops': False, 'use_snp_selection': False}. Best is trial 88 with value: 0.3112859159478406.
[I 2025-12-08 19:51:16,535] Trial 123 finished with value: 0.3090768857226673 and parameters: {'model_type': 'graphsage', 'hidden_dims': '[512, 128]', 'dropout': 0.570363018650753, 'batch_norm': True, 'sage_aggr': 'max', 'sage_normalize': False, 'sage_project': False, 'lr': 0.005096501612938273, 'weight_decay': 5.150030911470085e-06, 'epochs': 51, 'loss': 'mse', 'optimizer': 'adam', 'graph_mode': 'cutoff', 'cutoff': 0.6477655252396728, 'grm_norm': 'cosine_then_gcn', 'self_loops': False, 'use_snp_selection': False}. Best is trial 88 with value: 0.3112859159478406.
[I 2025-12-08 19:51:50,019] Trial 124 finished with value: 0.30672966286465475 and parameters: {'model_type': 'graphsage', 'hidden_dims': '[512, 128]', 'dropout': 0.5776805591366266, 'batch_norm': True, 'sage_aggr': 'max', 'sage_normalize': False, 'sage_project': False, 'lr': 0.005005581763043829, 'weight_decay': 5.341127970326978e-06, 'epochs': 52, 'loss': 'mse', 'optimizer': 'adam', 'graph_mode': 'cutoff', 'cutoff': 0.629022478994511, 'grm_norm': 'cosine_then_gcn', 'self_loops': False, 'use_snp_selection': False}. Best is trial 88 with value: 0.3112859159478406.
[I 2025-12-08 19:52:40,490] Trial 125 finished with value: 0.2553554055651085 and parameters: {'model_type': 'graphsage', 'hidden_dims': '[512, 128]', 'dropout': 0.5425555146963369, 'batch_norm': True, 'sage_aggr': 'max', 'sage_normalize': False, 'sage_project': False, 'lr': 0.005713518763234178, 'weight_decay': 4.286848670952333e-06, 'epochs': 64, 'loss': 'mse', 'optimizer': 'adam', 'graph_mode': 'cutoff', 'cutoff': 0.26594791366944737, 'grm_norm': 'cosine_then_gcn', 'self_loops': False, 'use_snp_selection': False}. Best is trial 88 with value: 0.3112859159478406.
[I 2025-12-08 19:53:09,204] Trial 126 finished with value: 0.30838766062140904 and parameters: {'model_type': 'graphsage', 'hidden_dims': '[512, 128]', 'dropout': 0.5630390267214204, 'batch_norm': True, 'sage_aggr': 'max', 'sage_normalize': False, 'sage_project': False, 'lr': 0.004098668141870969, 'weight_decay': 1.3606597345424313e-05, 'epochs': 40, 'loss': 'mse', 'optimizer': 'adam', 'graph_mode': 'cutoff', 'cutoff': 0.6625787021498725, 'grm_norm': 'cosine_then_gcn', 'self_loops': False, 'use_snp_selection': False}. Best is trial 88 with value: 0.3112859159478406.
[I 2025-12-08 19:53:51,329] Trial 127 finished with value: 0.3074616895583418 and parameters: {'model_type': 'graphsage', 'hidden_dims': '[512, 128]', 'dropout': 0.585485658203061, 'batch_norm': True, 'sage_aggr': 'max', 'sage_normalize': False, 'sage_project': False, 'lr': 0.0074854908752180595, 'weight_decay': 2.5234377331585834e-06, 'epochs': 77, 'loss': 'mse', 'optimizer': 'adam', 'graph_mode': 'cutoff', 'cutoff': 0.678722159850258, 'grm_norm': 'none', 'self_loops': False, 'use_snp_selection': False}. Best is trial 88 with value: 0.3112859159478406.
[I 2025-12-08 19:54:24,389] Trial 128 finished with value: 0.30887421088455247 and parameters: {'model_type': 'graphsage', 'hidden_dims': '[512, 128]', 'dropout': 0.5519739380023374, 'batch_norm': True, 'sage_aggr': 'max', 'sage_normalize': False, 'sage_project': False, 'lr': 0.005006943937259129, 'weight_decay': 2.1645342614667957e-05, 'epochs': 51, 'loss': 'mse', 'optimizer': 'adam', 'graph_mode': 'cutoff', 'cutoff': 0.6418479586360121, 'grm_norm': 'cosine', 'self_loops': False, 'use_snp_selection': False}. Best is trial 88 with value: 0.3112859159478406.
[I 2025-12-08 19:55:05,185] Trial 129 finished with value: 0.3098945249885075 and parameters: {'model_type': 'graphsage', 'hidden_dims': '[512, 128]', 'dropout': 0.5529536130117585, 'batch_norm': True, 'sage_aggr': 'max', 'sage_normalize': False, 'sage_project': False, 'lr': 0.004894794630275195, 'weight_decay': 6.457030881321718e-06, 'epochs': 71, 'loss': 'mse', 'optimizer': 'adam', 'graph_mode': 'cutoff', 'cutoff': 0.6377840620954793, 'grm_norm': 'cosine', 'self_loops': False, 'use_snp_selection': False}. Best is trial 88 with value: 0.3112859159478406.
[I 2025-12-08 19:55:54,255] Trial 130 finished with value: 0.3062647681861835 and parameters: {'model_type': 'graphsage', 'hidden_dims': '[512, 128]', 'dropout': 0.5706823540152979, 'batch_norm': True, 'sage_aggr': 'max', 'sage_normalize': False, 'sage_project': False, 'lr': 0.002318373435246021, 'weight_decay': 4.190340880759418e-05, 'epochs': 92, 'loss': 'mse', 'optimizer': 'adam', 'graph_mode': 'cutoff', 'cutoff': 0.6215939546854857, 'grm_norm': 'cosine', 'self_loops': False, 'use_snp_selection': False}. Best is trial 88 with value: 0.3112859159478406.
[I 2025-12-08 19:56:28,836] Trial 131 finished with value: 0.3133100644371326 and parameters: {'model_type': 'graphsage', 'hidden_dims': '[512, 128]', 'dropout': 0.5979118252183117, 'batch_norm': True, 'sage_aggr': 'max', 'sage_normalize': False, 'sage_project': False, 'lr': 0.004980895068622718, 'weight_decay': 5.789369932875176e-06, 'epochs': 55, 'loss': 'mse', 'optimizer': 'adam', 'graph_mode': 'cutoff', 'cutoff': 0.6472803677871246, 'grm_norm': 'cosine', 'self_loops': False, 'use_snp_selection': False}. Best is trial 131 with value: 0.3133100644371326.
[I 2025-12-08 19:57:09,891] Trial 132 finished with value: 0.30688215957984377 and parameters: {'model_type': 'graphsage', 'hidden_dims': '[512, 128]', 'dropout': 0.5897742201164977, 'batch_norm': True, 'sage_aggr': 'max', 'sage_normalize': False, 'sage_project': False, 'lr': 0.004936953504454958, 'weight_decay': 2.985486481124514e-05, 'epochs': 71, 'loss': 'mse', 'optimizer': 'adam', 'graph_mode': 'cutoff', 'cutoff': 0.5853988587157464, 'grm_norm': 'cosine', 'self_loops': False, 'use_snp_selection': False}. Best is trial 131 with value: 0.3133100644371326.
[I 2025-12-08 19:57:47,286] Trial 133 finished with value: 0.3057943054037413 and parameters: {'model_type': 'graphsage', 'hidden_dims': '[512, 128]', 'dropout': 0.5578310959311751, 'batch_norm': True, 'sage_aggr': 'max', 'sage_normalize': False, 'sage_project': False, 'lr': 0.004325475004341148, 'weight_decay': 5.0880596125389426e-06, 'epochs': 62, 'loss': 'mse', 'optimizer': 'adam', 'graph_mode': 'cutoff', 'cutoff': 0.6068868484359151, 'grm_norm': 'cosine', 'self_loops': False, 'use_snp_selection': False}. Best is trial 131 with value: 0.3133100644371326.
[I 2025-12-08 19:58:22,648] Trial 134 finished with value: 0.3082131544783304 and parameters: {'model_type': 'graphsage', 'hidden_dims': '[512, 128]', 'dropout': 0.5718810469265967, 'batch_norm': True, 'sage_aggr': 'max', 'sage_normalize': False, 'sage_project': False, 'lr': 0.006432616362483145, 'weight_decay': 3.484449289653929e-06, 'epochs': 57, 'loss': 'mse', 'optimizer': 'adam', 'graph_mode': 'cutoff', 'cutoff': 0.637049585616072, 'grm_norm': 'cosine', 'self_loops': False, 'use_snp_selection': False}. Best is trial 131 with value: 0.3133100644371326.
[I 2025-12-08 19:58:54,842] Trial 135 finished with value: 0.3040771443009129 and parameters: {'model_type': 'graphsage', 'hidden_dims': '[512, 128]', 'dropout': 0.5421074013424082, 'batch_norm': True, 'sage_aggr': 'max', 'sage_normalize': False, 'sage_project': False, 'lr': 0.003264698952769809, 'weight_decay': 6.846576624361685e-06, 'epochs': 49, 'loss': 'mse', 'optimizer': 'adam', 'graph_mode': 'cutoff', 'cutoff': 0.6776810109692444, 'grm_norm': 'cosine', 'self_loops': False, 'use_snp_selection': False}. Best is trial 131 with value: 0.3133100644371326.
[I 2025-12-08 19:59:33,606] Trial 136 finished with value: 0.3076330086987578 and parameters: {'model_type': 'graphsage', 'hidden_dims': '[512, 128]', 'dropout': 0.5316530672821106, 'batch_norm': True, 'sage_aggr': 'max', 'sage_normalize': False, 'sage_project': False, 'lr': 0.003771104798877848, 'weight_decay': 3.495115404255023e-06, 'epochs': 66, 'loss': 'mse', 'optimizer': 'adam', 'graph_mode': 'cutoff', 'cutoff': 0.829268876972481, 'grm_norm': 'cosine', 'self_loops': False, 'use_snp_selection': False}. Best is trial 131 with value: 0.3133100644371326.
[I 2025-12-08 20:00:18,707] Trial 137 finished with value: 0.0 and parameters: {'model_type': 'graphsage', 'hidden_dims': '[512, 128]', 'dropout': 0.5778402449179753, 'batch_norm': False, 'sage_aggr': 'max', 'sage_normalize': False, 'sage_project': False, 'lr': 0.009991874320470575, 'weight_decay': 2.035225421509418e-05, 'epochs': 82, 'loss': 'mse', 'optimizer': 'adam', 'graph_mode': 'cutoff', 'cutoff': 0.560857933771605, 'grm_norm': 'cosine', 'self_loops': False, 'use_snp_selection': False}. Best is trial 131 with value: 0.3133100644371326.
[I 2025-12-08 20:00:39,317] Trial 138 finished with value: 0.290980284039443 and parameters: {'model_type': 'graphsage', 'hidden_dims': '[256, 128, 64]', 'dropout': 0.5980596106133907, 'batch_norm': True, 'sage_aggr': 'max', 'sage_normalize': False, 'sage_project': False, 'lr': 0.004958560168624297, 'weight_decay': 1.1954143135935021e-05, 'epochs': 41, 'loss': 'mse', 'optimizer': 'adam', 'graph_mode': 'cutoff', 'cutoff': 0.5399744496792296, 'grm_norm': 'cosine', 'self_loops': False, 'use_snp_selection': False}. Best is trial 131 with value: 0.3133100644371326.
[I 2025-12-08 20:01:13,925] Trial 139 finished with value: 0.3108237208853307 and parameters: {'model_type': 'graphsage', 'hidden_dims': '[512, 128]', 'dropout': 0.5478396204744558, 'batch_norm': True, 'sage_aggr': 'max', 'sage_normalize': False, 'sage_project': False, 'lr': 0.007093816349514625, 'weight_decay': 5.884095044285987e-06, 'epochs': 55, 'loss': 'mse', 'optimizer': 'adam', 'graph_mode': 'cutoff', 'cutoff': 0.6427992326115715, 'grm_norm': 'cosine', 'self_loops': False, 'use_snp_selection': False}. Best is trial 131 with value: 0.3133100644371326.
[I 2025-12-08 20:01:33,797] Trial 140 finished with value: 0.3055415147205639 and parameters: {'model_type': 'graphsage', 'hidden_dims': '[128, 64]', 'dropout': 0.5329804084549108, 'batch_norm': True, 'sage_aggr': 'max', 'sage_normalize': False, 'sage_project': False, 'lr': 0.007068846261455173, 'weight_decay': 1.923340094586353e-05, 'epochs': 74, 'loss': 'mae', 'optimizer': 'adam', 'graph_mode': 'cutoff', 'cutoff': 0.7971468466862331, 'grm_norm': 'cosine', 'self_loops': False, 'use_snp_selection': False}. Best is trial 131 with value: 0.3133100644371326.
[I 2025-12-08 20:02:08,971] Trial 141 finished with value: 0.30268893264087204 and parameters: {'model_type': 'graphsage', 'hidden_dims': '[512, 128]', 'dropout': 0.5573126529478493, 'batch_norm': True, 'sage_aggr': 'max', 'sage_normalize': False, 'sage_project': False, 'lr': 0.005739362200341338, 'weight_decay': 8.80066942201821e-06, 'epochs': 56, 'loss': 'mse', 'optimizer': 'adam', 'graph_mode': 'cutoff', 'cutoff': 0.6444176758125079, 'grm_norm': 'cosine', 'self_loops': False, 'use_snp_selection': False}. Best is trial 131 with value: 0.3133100644371326.
[I 2025-12-08 20:02:41,710] Trial 142 finished with value: 0.30837410340206145 and parameters: {'model_type': 'graphsage', 'hidden_dims': '[512, 128]', 'dropout': 0.5418477333750407, 'batch_norm': True, 'sage_aggr': 'max', 'sage_normalize': False, 'sage_project': False, 'lr': 0.0075819759997126, 'weight_decay': 4.228406711167999e-06, 'epochs': 50, 'loss': 'mse', 'optimizer': 'adam', 'graph_mode': 'cutoff', 'cutoff': 0.6862637144891459, 'grm_norm': 'cosine', 'self_loops': False, 'use_snp_selection': False}. Best is trial 131 with value: 0.3133100644371326.
[I 2025-12-08 20:03:19,408] Trial 143 finished with value: 0.3135844423276103 and parameters: {'model_type': 'graphsage', 'hidden_dims': '[512, 128]', 'dropout': 0.5265984835592583, 'batch_norm': True, 'sage_aggr': 'max', 'sage_normalize': False, 'sage_project': False, 'lr': 0.006128020906637369, 'weight_decay': 5.744206454204083e-06, 'epochs': 63, 'loss': 'mse', 'optimizer': 'adam', 'graph_mode': 'cutoff', 'cutoff': 0.6533717660363065, 'grm_norm': 'cosine', 'self_loops': False, 'use_snp_selection': False}. Best is trial 143 with value: 0.3135844423276103.
[I 2025-12-08 20:03:57,443] Trial 144 finished with value: 0.30674386894852107 and parameters: {'model_type': 'graphsage', 'hidden_dims': '[512, 128]', 'dropout': 0.5259374183698026, 'batch_norm': True, 'sage_aggr': 'max', 'sage_normalize': False, 'sage_project': False, 'lr': 0.00863534222653077, 'weight_decay': 5.45187662209954e-06, 'epochs': 64, 'loss': 'mse', 'optimizer': 'adam', 'graph_mode': 'cutoff', 'cutoff': 0.6617188795802784, 'grm_norm': 'cosine', 'self_loops': False, 'use_snp_selection': False}. Best is trial 143 with value: 0.3135844423276103.
[I 2025-12-08 20:04:32,770] Trial 145 finished with value: 0.3049009195184539 and parameters: {'model_type': 'graphsage', 'hidden_dims': '[512, 128]', 'dropout': 0.5074340594537522, 'batch_norm': True, 'sage_aggr': 'max', 'sage_normalize': False, 'sage_project': False, 'lr': 0.006789962353677413, 'weight_decay': 5.9202408890787055e-06, 'epochs': 57, 'loss': 'mse', 'optimizer': 'adam', 'graph_mode': 'cutoff', 'cutoff': 0.6172777914517409, 'grm_norm': 'cosine', 'self_loops': False, 'use_snp_selection': False}. Best is trial 143 with value: 0.3135844423276103.
[I 2025-12-08 20:05:13,019] Trial 146 finished with value: 0.30866794233597084 and parameters: {'model_type': 'graphsage', 'hidden_dims': '[512, 128]', 'dropout': 0.5474245933888873, 'batch_norm': True, 'sage_aggr': 'max', 'sage_normalize': False, 'sage_project': False, 'lr': 0.0044201259288737535, 'weight_decay': 9.543142399118454e-06, 'epochs': 69, 'loss': 'mse', 'optimizer': 'adam', 'graph_mode': 'cutoff', 'cutoff': 0.5784188255847557, 'grm_norm': 'cosine', 'self_loops': False, 'use_snp_selection': False}. Best is trial 143 with value: 0.3135844423276103.
[I 2025-12-08 20:05:41,764] Trial 147 finished with value: 0.30261689403420217 and parameters: {'model_type': 'graphsage', 'hidden_dims': '[512, 64]', 'dropout': 0.5317781621859448, 'batch_norm': True, 'sage_aggr': 'max', 'sage_normalize': False, 'sage_project': False, 'lr': 0.006164880486620797, 'weight_decay': 1.3770505970912847e-05, 'epochs': 40, 'loss': 'mse', 'optimizer': 'adam', 'graph_mode': 'cutoff', 'cutoff': 0.6008733588207772, 'grm_norm': 'cosine', 'self_loops': False, 'use_snp_selection': False}. Best is trial 143 with value: 0.3135844423276103.
[I 2025-12-08 20:06:17,591] Trial 148 finished with value: 0.29876856882008973 and parameters: {'model_type': 'graphsage', 'hidden_dims': '[512, 128]', 'dropout': 0.5150206950938446, 'batch_norm': True, 'sage_aggr': 'max', 'sage_normalize': False, 'sage_project': False, 'lr': 5.365226293542521e-05, 'weight_decay': 2.8919676581969832e-06, 'epochs': 61, 'loss': 'mse', 'optimizer': 'adam', 'graph_mode': 'cutoff', 'cutoff': 0.697697903479, 'grm_norm': 'gcn', 'self_loops': False, 'use_snp_selection': False}. Best is trial 143 with value: 0.3135844423276103.
[I 2025-12-08 20:06:50,874] Trial 149 finished with value: 0.30766451975580705 and parameters: {'model_type': 'graphsage', 'hidden_dims': '[512, 128]', 'dropout': 0.5979062209446987, 'batch_norm': True, 'sage_aggr': 'max', 'sage_normalize': False, 'sage_project': False, 'lr': 0.005225713851781591, 'weight_decay': 7.5799434533639286e-06, 'epochs': 52, 'loss': 'mse', 'optimizer': 'adam', 'graph_mode': 'cutoff', 'cutoff': 0.7221911003928245, 'grm_norm': 'cosine', 'self_loops': False, 'use_snp_selection': False}. Best is trial 143 with value: 0.3135844423276103.
[I 2025-12-08 20:08:10,595] Trial 0 finished with value: 0.2845010167701627 and parameters: {'model_type': 'graphsage', 'hidden_dims': '[128, 64]', 'dropout': 0.199031432379812, 'batch_norm': True, 'sage_aggr': 'max', 'sage_normalize': True, 'sage_project': False, 'lr': 0.00034401453323286885, 'weight_decay': 0.00017802616915745114, 'epochs': 230, 'loss': 'mse', 'optimizer': 'adam', 'graph_mode': 'knn', 'knn_k': 6, 'weighted_edges': True, 'symmetrize_mode': 'mutual', 'self_loops': True, 'use_snp_selection': False}. Best is trial 0 with value: 0.2845010167701627.
[I 2025-12-08 20:09:50,432] Trial 1 finished with value: 0.2747519604821231 and parameters: {'model_type': 'graphsage', 'hidden_dims': '[512, 128]', 'dropout': 0.2503500283181017, 'batch_norm': False, 'sage_aggr': 'max', 'sage_normalize': False, 'sage_project': False, 'lr': 3.952233718592099e-05, 'weight_decay': 0.00026754769258252603, 'epochs': 149, 'loss': 'mse', 'optimizer': 'adam', 'graph_mode': 'knn', 'knn_k': 2, 'weighted_edges': False, 'symmetrize_mode': 'mutual', 'self_loops': True, 'use_snp_selection': True, 'num_snps': 49915}. Best is trial 0 with value: 0.2845010167701627.
[I 2025-12-08 20:11:07,185] Trial 2 finished with value: 0.2846440221512812 and parameters: {'model_type': 'graphsage', 'hidden_dims': '[512, 256]', 'dropout': 0.2785908793172681, 'batch_norm': False, 'sage_aggr': 'max', 'sage_normalize': False, 'sage_project': False, 'lr': 8.806039223165805e-05, 'weight_decay': 3.5153176302760294e-05, 'epochs': 147, 'loss': 'mae', 'optimizer': 'adam', 'graph_mode': 'cutoff', 'cutoff': 0.4922564006874869, 'grm_norm': 'gcn', 'self_loops': False, 'use_snp_selection': True, 'num_snps': 34340}. Best is trial 2 with value: 0.2846440221512812.
[I 2025-12-08 20:12:20,303] Trial 3 finished with value: 0.29048460003446486 and parameters: {'model_type': 'graphsage', 'hidden_dims': '[256, 128, 64]', 'dropout': 0.3475243154412272, 'batch_norm': True, 'sage_aggr': 'max', 'sage_normalize': False, 'sage_project': False, 'lr': 1.6006331996938085e-05, 'weight_decay': 7.213121225589906e-06, 'epochs': 283, 'loss': 'mse', 'optimizer': 'adam', 'graph_mode': 'cutoff', 'cutoff': 0.5942334791449215, 'grm_norm': 'none', 'self_loops': True, 'use_snp_selection': False}. Best is trial 3 with value: 0.29048460003446486.
[I 2025-12-08 20:13:03,074] Trial 4 finished with value: 0.27402706675486704 and parameters: {'model_type': 'graphsage', 'hidden_dims': '[128, 64]', 'dropout': 0.3348926467202472, 'batch_norm': True, 'sage_aggr': 'max', 'sage_normalize': False, 'sage_project': False, 'lr': 0.0004238630400638802, 'weight_decay': 8.074086040046576e-07, 'epochs': 158, 'loss': 'mae', 'optimizer': 'adam', 'graph_mode': 'knn', 'knn_k': 1, 'weighted_edges': False, 'symmetrize_mode': 'mutual', 'self_loops': False, 'use_snp_selection': True, 'num_snps': 26850}. Best is trial 3 with value: 0.29048460003446486.
[I 2025-12-08 20:14:50,740] Trial 5 finished with value: 0.27067383676015255 and parameters: {'model_type': 'graphsage', 'hidden_dims': '[512, 64]', 'dropout': 0.14505336736221927, 'batch_norm': True, 'sage_aggr': 'mean', 'sage_normalize': True, 'sage_project': False, 'lr': 1.2962030165732234e-05, 'weight_decay': 1.326598071105465e-07, 'epochs': 180, 'loss': 'mse', 'optimizer': 'adam', 'graph_mode': 'knn', 'knn_k': 9, 'weighted_edges': True, 'symmetrize_mode': 'mutual', 'self_loops': False, 'use_snp_selection': False}. Best is trial 3 with value: 0.29048460003446486.
[I 2025-12-08 20:15:43,742] Trial 6 finished with value: 0.29563558083383656 and parameters: {'model_type': 'graphsage', 'hidden_dims': '[256, 128, 64]', 'dropout': 0.10731743755162496, 'batch_norm': True, 'sage_aggr': 'mean', 'sage_normalize': False, 'sage_project': False, 'lr': 1.922990426933137e-05, 'weight_decay': 7.30001060446905e-05, 'epochs': 63, 'loss': 'mae', 'optimizer': 'adam', 'graph_mode': 'cutoff', 'cutoff': 0.7624978434202536, 'grm_norm': 'none', 'self_loops': True, 'use_snp_selection': True, 'num_snps': 50106}. Best is trial 6 with value: 0.29563558083383656.
