[I 2025-12-08 19:39:26,119] Trial 116 finished with value: 0.26698616880516185 and parameters: {'model_type': 'graphsage', 'hidden_dims': '[512, 128]', 'dropout': 0.10601694620480975, 'batch_norm': False, 'sage_aggr': 'mean', 'sage_normalize': True, 'sage_project': False, 'lr': 3.4485242311059434e-05, 'weight_decay': 2.53345296580082e-06, 'epochs': 341, 'loss': 'mse', 'optimizer': 'adam', 'graph_mode': 'cutoff', 'cutoff': 0.7333917696908507, 'grm_norm': 'cosine_then_gcn', 'self_loops': True, 'use_snp_selection': False}. Best is trial 80 with value: 0.30126905497371104.
[I 2025-12-08 19:41:56,294] Trial 117 finished with value: 0.2893541863632521 and parameters: {'model_type': 'graphsage', 'hidden_dims': '[512, 128]', 'dropout': 0.1172753481073217, 'batch_norm': True, 'sage_aggr': 'mean', 'sage_normalize': True, 'sage_project': False, 'lr': 2.1926516248219524e-05, 'weight_decay': 8.612377428987225e-06, 'epochs': 325, 'loss': 'mse', 'optimizer': 'adam', 'graph_mode': 'cutoff', 'cutoff': 0.7718900920137166, 'grm_norm': 'cosine_then_gcn', 'self_loops': True, 'use_snp_selection': False}. Best is trial 80 with value: 0.30126905497371104.
[I 2025-12-08 19:43:48,617] Trial 118 finished with value: 0.29478120955694226 and parameters: {'model_type': 'graphsage', 'hidden_dims': '[256, 128]', 'dropout': 0.12091190345955377, 'batch_norm': True, 'sage_aggr': 'mean', 'sage_normalize': True, 'sage_project': False, 'lr': 3.93589471742295e-05, 'weight_decay': 1.7203544294423922e-05, 'epochs': 342, 'loss': 'mse', 'optimizer': 'adam', 'graph_mode': 'cutoff', 'cutoff': 0.4244769455606347, 'grm_norm': 'cosine_then_gcn', 'self_loops': True, 'use_snp_selection': False}. Best is trial 80 with value: 0.30126905497371104.
[I 2025-12-08 19:45:19,131] Trial 119 finished with value: 0.2944818175396254 and parameters: {'model_type': 'graphsage', 'hidden_dims': '[256, 128]', 'dropout': 0.14373352912907356, 'batch_norm': True, 'sage_aggr': 'max', 'sage_normalize': True, 'sage_project': False, 'lr': 3.245733163316435e-05, 'weight_decay': 3.281458564106458e-06, 'epochs': 344, 'loss': 'mse', 'optimizer': 'adam', 'graph_mode': 'cutoff', 'cutoff': 0.7016292055647897, 'grm_norm': 'cosine_then_gcn', 'self_loops': True, 'use_snp_selection': False}. Best is trial 80 with value: 0.30126905497371104.
[I 2025-12-08 19:47:19,624] Trial 120 finished with value: 0.2801591875127085 and parameters: {'model_type': 'graphsage', 'hidden_dims': '[256, 128]', 'dropout': 0.1085779960612488, 'batch_norm': True, 'sage_aggr': 'mean', 'sage_normalize': True, 'sage_project': False, 'lr': 1.7372582841960996e-05, 'weight_decay': 4.5033747416722415e-06, 'epochs': 319, 'loss': 'mse', 'optimizer': 'adam', 'graph_mode': 'knn', 'knn_k': 6, 'weighted_edges': True, 'symmetrize_mode': 'mutual', 'self_loops': True, 'use_snp_selection': False}. Best is trial 80 with value: 0.30126905497371104.
[I 2025-12-08 19:49:19,644] Trial 121 finished with value: 0.293219200942785 and parameters: {'model_type': 'graphsage', 'hidden_dims': '[256, 128]', 'dropout': 0.13304892795324025, 'batch_norm': True, 'sage_aggr': 'mean', 'sage_normalize': False, 'sage_project': False, 'lr': 4.6021652226873644e-05, 'weight_decay': 1.915258870383936e-06, 'epochs': 295, 'loss': 'mse', 'optimizer': 'adam', 'graph_mode': 'cutoff', 'cutoff': 0.8272972730740075, 'grm_norm': 'gcn', 'self_loops': False, 'use_snp_selection': True, 'num_snps': 58461}. Best is trial 80 with value: 0.30126905497371104.
[I 2025-12-08 19:51:55,572] Trial 122 finished with value: 0.3004888516091387 and parameters: {'model_type': 'graphsage', 'hidden_dims': '[512, 128]', 'dropout': 0.12359573116894991, 'batch_norm': True, 'sage_aggr': 'mean', 'sage_normalize': False, 'sage_project': False, 'lr': 2.6252269554657074e-05, 'weight_decay': 1.2227255821526184e-06, 'epochs': 338, 'loss': 'mse', 'optimizer': 'adam', 'graph_mode': 'cutoff', 'cutoff': 0.8804981913103953, 'grm_norm': 'gcn', 'self_loops': False, 'use_snp_selection': True, 'num_snps': 47557}. Best is trial 80 with value: 0.30126905497371104.
[I 2025-12-08 19:54:30,680] Trial 123 finished with value: 0.3011448146904631 and parameters: {'model_type': 'graphsage', 'hidden_dims': '[512, 128]', 'dropout': 0.1231023354939146, 'batch_norm': True, 'sage_aggr': 'mean', 'sage_normalize': True, 'sage_project': False, 'lr': 2.659262181415873e-05, 'weight_decay': 1.8308985094223517e-06, 'epochs': 338, 'loss': 'mse', 'optimizer': 'adam', 'graph_mode': 'cutoff', 'cutoff': 0.798885953730246, 'grm_norm': 'gcn', 'self_loops': False, 'use_snp_selection': False}. Best is trial 80 with value: 0.30126905497371104.
[I 2025-12-08 19:55:22,801] Trial 124 finished with value: 0.28542126845525584 and parameters: {'model_type': 'graphsage', 'hidden_dims': '[512, 128]', 'dropout': 0.1573740509292874, 'batch_norm': True, 'sage_aggr': 'mean', 'sage_normalize': False, 'sage_project': False, 'lr': 2.3614837465356995e-05, 'weight_decay': 5.683647974332857e-05, 'epochs': 336, 'loss': 'mse', 'optimizer': 'adam', 'graph_mode': 'cutoff', 'cutoff': 0.8438256970167775, 'grm_norm': 'cosine_then_gcn', 'self_loops': False, 'use_snp_selection': True, 'num_snps': 9551}. Best is trial 80 with value: 0.30126905497371104.
[I 2025-12-08 19:56:49,975] Trial 125 finished with value: 0.2951564453877484 and parameters: {'model_type': 'graphsage', 'hidden_dims': '[256, 128]', 'dropout': 0.12026961192368256, 'batch_norm': True, 'sage_aggr': 'mean', 'sage_normalize': True, 'sage_project': False, 'lr': 2.5631586863221538e-05, 'weight_decay': 5.652995430661019e-07, 'epochs': 331, 'loss': 'mse', 'optimizer': 'adam', 'graph_mode': 'cutoff', 'cutoff': 0.7951772712995986, 'grm_norm': 'gcn', 'self_loops': True, 'use_snp_selection': False}. Best is trial 80 with value: 0.30126905497371104.
[I 2025-12-08 19:59:30,258] Trial 126 finished with value: 0.2901372474895762 and parameters: {'model_type': 'graphsage', 'hidden_dims': '[512, 128]', 'dropout': 0.14154130960607061, 'batch_norm': True, 'sage_aggr': 'mean', 'sage_normalize': False, 'sage_project': False, 'lr': 1.5219398105473273e-05, 'weight_decay': 2.793728998642218e-06, 'epochs': 349, 'loss': 'mse', 'optimizer': 'adam', 'graph_mode': 'cutoff', 'cutoff': 0.8550002604176111, 'grm_norm': 'none', 'self_loops': False, 'use_snp_selection': True, 'num_snps': 47369}. Best is trial 80 with value: 0.30126905497371104.
[I 2025-12-08 20:02:22,381] Trial 127 finished with value: 0.2931355019616495 and parameters: {'model_type': 'graphsage', 'hidden_dims': '[512, 256]', 'dropout': 0.17650923176608802, 'batch_norm': True, 'sage_aggr': 'mean', 'sage_normalize': False, 'sage_project': False, 'lr': 2.7519141037926697e-05, 'weight_decay': 1.9452069390790586e-06, 'epochs': 341, 'loss': 'mse', 'optimizer': 'adam', 'graph_mode': 'cutoff', 'cutoff': 0.8155260712259034, 'grm_norm': 'cosine', 'self_loops': False, 'use_snp_selection': True, 'num_snps': 55299}. Best is trial 80 with value: 0.30126905497371104.
[I 2025-12-08 20:04:52,655] Trial 128 finished with value: 0.2994465699730895 and parameters: {'model_type': 'graphsage', 'hidden_dims': '[512, 128]', 'dropout': 0.13377534397415466, 'batch_norm': True, 'sage_aggr': 'mean', 'sage_normalize': True, 'sage_project': False, 'lr': 3.796950323610462e-05, 'weight_decay': 9.996587069512005e-07, 'epochs': 328, 'loss': 'mse', 'optimizer': 'adam', 'graph_mode': 'cutoff', 'cutoff': 0.8959811698294575, 'grm_norm': 'gcn', 'self_loops': False, 'use_snp_selection': False}. Best is trial 80 with value: 0.30126905497371104.
[I 2025-12-08 20:07:18,198] Trial 129 finished with value: 0.30318542807592097 and parameters: {'model_type': 'graphsage', 'hidden_dims': '[512, 128]', 'dropout': 0.1492983304422014, 'batch_norm': True, 'sage_aggr': 'mean', 'sage_normalize': True, 'sage_project': False, 'lr': 3.9861863740205454e-05, 'weight_decay': 0.00014634258418957626, 'epochs': 317, 'loss': 'mse', 'optimizer': 'adam', 'graph_mode': 'cutoff', 'cutoff': 0.8942730838611942, 'grm_norm': 'gcn', 'self_loops': False, 'use_snp_selection': False}. Best is trial 129 with value: 0.30318542807592097.
[I 2025-12-08 20:09:45,086] Trial 130 finished with value: 0.2963273747047559 and parameters: {'model_type': 'graphsage', 'hidden_dims': '[512, 128]', 'dropout': 0.16834516079047557, 'batch_norm': True, 'sage_aggr': 'mean', 'sage_normalize': True, 'sage_project': False, 'lr': 3.846447820510278e-05, 'weight_decay': 0.0009662388328537952, 'epochs': 318, 'loss': 'mse', 'optimizer': 'adam', 'graph_mode': 'cutoff', 'cutoff': 0.8965472291477308, 'grm_norm': 'cosine', 'self_loops': False, 'use_snp_selection': False}. Best is trial 129 with value: 0.30318542807592097.
[I 2025-12-08 20:12:15,268] Trial 131 finished with value: 0.2989668704085585 and parameters: {'model_type': 'graphsage', 'hidden_dims': '[512, 128]', 'dropout': 0.15020430371026292, 'batch_norm': True, 'sage_aggr': 'mean', 'sage_normalize': True, 'sage_project': False, 'lr': 4.29020808020246e-05, 'weight_decay': 0.00011585392522278333, 'epochs': 328, 'loss': 'mse', 'optimizer': 'adam', 'graph_mode': 'cutoff', 'cutoff': 0.8836728074354792, 'grm_norm': 'gcn', 'self_loops': False, 'use_snp_selection': False}. Best is trial 129 with value: 0.30318542807592097.
[I 2025-12-08 20:14:45,419] Trial 132 finished with value: 0.29650236109354833 and parameters: {'model_type': 'graphsage', 'hidden_dims': '[512, 128]', 'dropout': 0.152254833309587, 'batch_norm': True, 'sage_aggr': 'mean', 'sage_normalize': True, 'sage_project': False, 'lr': 2.8731162950938634e-05, 'weight_decay': 0.0001369809092939375, 'epochs': 328, 'loss': 'mse', 'optimizer': 'adam', 'graph_mode': 'cutoff', 'cutoff': 0.8821552458260573, 'grm_norm': 'gcn', 'self_loops': False, 'use_snp_selection': False}. Best is trial 129 with value: 0.30318542807592097.
[I 2025-12-08 20:17:20,082] Trial 133 finished with value: 0.29310245053696826 and parameters: {'model_type': 'graphsage', 'hidden_dims': '[512, 128]', 'dropout': 0.13699509242270871, 'batch_norm': True, 'sage_aggr': 'mean', 'sage_normalize': True, 'sage_project': False, 'lr': 1.900590473601997e-05, 'weight_decay': 0.00012395988410030722, 'epochs': 338, 'loss': 'mse', 'optimizer': 'adam', 'graph_mode': 'cutoff', 'cutoff': 0.8960240553890577, 'grm_norm': 'gcn', 'self_loops': False, 'use_snp_selection': False}. Best is trial 129 with value: 0.30318542807592097.
[I 2025-12-08 20:19:45,192] Trial 134 finished with value: 0.296311411762159 and parameters: {'model_type': 'graphsage', 'hidden_dims': '[512, 128]', 'dropout': 0.1836609862678611, 'batch_norm': True, 'sage_aggr': 'mean', 'sage_normalize': True, 'sage_project': False, 'lr': 3.688680940265636e-05, 'weight_decay': 0.0002601615006678075, 'epochs': 315, 'loss': 'mse', 'optimizer': 'adam', 'graph_mode': 'cutoff', 'cutoff': 0.8823945316326058, 'grm_norm': 'gcn', 'self_loops': False, 'use_snp_selection': False}. Best is trial 129 with value: 0.30318542807592097.
[I 2025-12-08 20:22:07,054] Trial 135 finished with value: 0.2882314744299973 and parameters: {'model_type': 'graphsage', 'hidden_dims': '[512, 128]', 'dropout': 0.41086789444874994, 'batch_norm': True, 'sage_aggr': 'mean', 'sage_normalize': True, 'sage_project': False, 'lr': 3.096308059015173e-05, 'weight_decay': 1.0423433196956608e-06, 'epochs': 307, 'loss': 'mse', 'optimizer': 'adam', 'graph_mode': 'cutoff', 'cutoff': 0.8666504182561426, 'grm_norm': 'gcn', 'self_loops': False, 'use_snp_selection': False}. Best is trial 129 with value: 0.30318542807592097.
[I 2025-12-08 20:24:35,890] Trial 136 finished with value: 0.2928715994872726 and parameters: {'model_type': 'graphsage', 'hidden_dims': '[512, 128]', 'dropout': 0.1608658296914507, 'batch_norm': True, 'sage_aggr': 'mean', 'sage_normalize': True, 'sage_project': False, 'lr': 2.2736923237850584e-05, 'weight_decay': 0.00019518211696725981, 'epochs': 324, 'loss': 'mse', 'optimizer': 'adam', 'graph_mode': 'cutoff', 'cutoff': 0.8379883368439068, 'grm_norm': 'gcn', 'self_loops': False, 'use_snp_selection': False}. Best is trial 129 with value: 0.30318542807592097.
[I 2025-12-08 20:27:36,838] Trial 137 finished with value: 0.25641770286751786 and parameters: {'model_type': 'graphsage', 'hidden_dims': '[512, 128]', 'dropout': 0.10107756617659377, 'batch_norm': False, 'sage_aggr': 'mean', 'sage_normalize': True, 'sage_project': False, 'lr': 4.50050564831995e-05, 'weight_decay': 7.788368090668653e-05, 'epochs': 349, 'loss': 'mse', 'optimizer': 'adam', 'graph_mode': 'cutoff', 'cutoff': 0.46757470004985746, 'grm_norm': 'gcn', 'self_loops': False, 'use_snp_selection': False}. Best is trial 129 with value: 0.30318542807592097.
[I 2025-12-08 20:28:54,144] Trial 138 finished with value: 0.284025058662154 and parameters: {'model_type': 'graphsage', 'hidden_dims': '[128, 64]', 'dropout': 0.14691565194858125, 'batch_norm': True, 'sage_aggr': 'mean', 'sage_normalize': True, 'sage_project': False, 'lr': 4.184983672029594e-05, 'weight_decay': 9.341350188968921e-05, 'epochs': 330, 'loss': 'mse', 'optimizer': 'adam', 'graph_mode': 'cutoff', 'cutoff': 0.4388253849799686, 'grm_norm': 'cosine', 'self_loops': True, 'use_snp_selection': False}. Best is trial 129 with value: 0.30318542807592097.
[I 2025-12-08 20:31:14,647] Trial 139 finished with value: 0.2997485742617384 and parameters: {'model_type': 'graphsage', 'hidden_dims': '[512, 128]', 'dropout': 0.11498319228773643, 'batch_norm': True, 'sage_aggr': 'mean', 'sage_normalize': True, 'sage_project': False, 'lr': 3.3582622510759085e-05, 'weight_decay': 3.2858344315901497e-07, 'epochs': 304, 'loss': 'mse', 'optimizer': 'adam', 'graph_mode': 'cutoff', 'cutoff': 0.7822766037939156, 'grm_norm': 'gcn', 'self_loops': False, 'use_snp_selection': False}. Best is trial 129 with value: 0.30318542807592097.
[I 2025-12-08 20:33:49,147] Trial 140 finished with value: 0.3003713450793549 and parameters: {'model_type': 'graphsage', 'hidden_dims': '[512, 128]', 'dropout': 0.1360432961093276, 'batch_norm': True, 'sage_aggr': 'mean', 'sage_normalize': True, 'sage_project': False, 'lr': 3.4418523994514135e-05, 'weight_decay': 3.107841213699329e-07, 'epochs': 337, 'loss': 'mse', 'optimizer': 'adam', 'graph_mode': 'cutoff', 'cutoff': 0.7837850632129271, 'grm_norm': 'gcn', 'self_loops': False, 'use_snp_selection': False}. Best is trial 129 with value: 0.30318542807592097.
[I 2025-12-08 20:36:23,647] Trial 141 finished with value: 0.29904481366237834 and parameters: {'model_type': 'graphsage', 'hidden_dims': '[512, 128]', 'dropout': 0.13137920421417068, 'batch_norm': True, 'sage_aggr': 'mean', 'sage_normalize': True, 'sage_project': False, 'lr': 3.552891570589618e-05, 'weight_decay': 2.6942685205882756e-07, 'epochs': 337, 'loss': 'mse', 'optimizer': 'adam', 'graph_mode': 'cutoff', 'cutoff': 0.7807359889132828, 'grm_norm': 'gcn', 'self_loops': False, 'use_snp_selection': False}. Best is trial 129 with value: 0.30318542807592097.
[I 2025-12-08 20:38:58,449] Trial 142 finished with value: 0.2961238347367135 and parameters: {'model_type': 'graphsage', 'hidden_dims': '[512, 128]', 'dropout': 0.11246371208769587, 'batch_norm': True, 'sage_aggr': 'mean', 'sage_normalize': True, 'sage_project': False, 'lr': 2.9205060050188172e-05, 'weight_decay': 2.606866524154133e-07, 'epochs': 338, 'loss': 'mse', 'optimizer': 'adam', 'graph_mode': 'cutoff', 'cutoff': 0.8244339928366297, 'grm_norm': 'gcn', 'self_loops': False, 'use_snp_selection': False}. Best is trial 129 with value: 0.30318542807592097.
[I 2025-12-08 20:41:26,168] Trial 143 finished with value: 0.2909722937598579 and parameters: {'model_type': 'graphsage', 'hidden_dims': '[512, 128]', 'dropout': 0.3066067489520404, 'batch_norm': True, 'sage_aggr': 'mean', 'sage_normalize': True, 'sage_project': False, 'lr': 2.6417828888222956e-05, 'weight_decay': 3.80510434632122e-07, 'epochs': 321, 'loss': 'mse', 'optimizer': 'adam', 'graph_mode': 'cutoff', 'cutoff': 0.7806464907262797, 'grm_norm': 'gcn', 'self_loops': False, 'use_snp_selection': False}. Best is trial 129 with value: 0.30318542807592097.
[I 2025-12-08 20:44:03,916] Trial 144 finished with value: 0.2948625806080185 and parameters: {'model_type': 'graphsage', 'hidden_dims': '[512, 128]', 'dropout': 0.1361340327036864, 'batch_norm': True, 'sage_aggr': 'mean', 'sage_normalize': True, 'sage_project': False, 'lr': 3.349046167206621e-05, 'weight_decay': 5.662255388540545e-07, 'epochs': 345, 'loss': 'mse', 'optimizer': 'adam', 'graph_mode': 'cutoff', 'cutoff': 0.7587736314175706, 'grm_norm': 'gcn', 'self_loops': False, 'use_snp_selection': False}. Best is trial 129 with value: 0.30318542807592097.
[I 2025-12-08 20:46:28,865] Trial 145 finished with value: 0.2963709314081597 and parameters: {'model_type': 'graphsage', 'hidden_dims': '[512, 128]', 'dropout': 0.1424039160394103, 'batch_norm': True, 'sage_aggr': 'mean', 'sage_normalize': True, 'sage_project': False, 'lr': 3.930528522107475e-05, 'weight_decay': 2.1046359780883932e-07, 'epochs': 314, 'loss': 'mse', 'optimizer': 'adam', 'graph_mode': 'cutoff', 'cutoff': 0.7366617480631881, 'grm_norm': 'gcn', 'self_loops': False, 'use_snp_selection': False}. Best is trial 129 with value: 0.30318542807592097.
[I 2025-12-08 20:48:48,916] Trial 146 finished with value: 0.2982023616184667 and parameters: {'model_type': 'graphsage', 'hidden_dims': '[512, 128]', 'dropout': 0.11335524466449967, 'batch_norm': True, 'sage_aggr': 'max', 'sage_normalize': True, 'sage_project': False, 'lr': 2.2272493459179462e-05, 'weight_decay': 3.1323459167912496e-07, 'epochs': 304, 'loss': 'mse', 'optimizer': 'adam', 'graph_mode': 'cutoff', 'cutoff': 0.7777476941660885, 'grm_norm': 'gcn', 'self_loops': False, 'use_snp_selection': False}. Best is trial 129 with value: 0.30318542807592097.
[I 2025-12-08 20:50:17,885] Trial 147 finished with value: 0.2786973472530313 and parameters: {'model_type': 'graphsage', 'hidden_dims': '[256, 128, 64]', 'dropout': 0.1628422741570753, 'batch_norm': True, 'sage_aggr': 'mean', 'sage_normalize': True, 'sage_project': False, 'lr': 3.157155529899321e-05, 'weight_decay': 1.577477194839906e-07, 'epochs': 335, 'loss': 'mse', 'optimizer': 'adam', 'graph_mode': 'cutoff', 'cutoff': 0.81116132569033, 'grm_norm': 'gcn', 'self_loops': False, 'use_snp_selection': False}. Best is trial 129 with value: 0.30318542807592097.
[I 2025-12-08 20:53:25,531] Trial 148 finished with value: 0.2656071799423902 and parameters: {'model_type': 'graphsage', 'hidden_dims': '[512, 128]', 'dropout': 0.15269532740527933, 'batch_norm': True, 'sage_aggr': 'mean', 'sage_normalize': True, 'sage_project': False, 'lr': 1.209431640200832e-05, 'weight_decay': 6.548208998742527e-07, 'epochs': 320, 'loss': 'mse', 'optimizer': 'adam', 'graph_mode': 'knn', 'knn_k': 4, 'weighted_edges': False, 'symmetrize_mode': 'union', 'self_loops': False, 'use_snp_selection': False}. Best is trial 129 with value: 0.30318542807592097.
[I 2025-12-08 20:56:02,071] Trial 149 finished with value: 0.29771433730130126 and parameters: {'model_type': 'graphsage', 'hidden_dims': '[512, 128]', 'dropout': 0.13289417433708303, 'batch_norm': True, 'sage_aggr': 'mean', 'sage_normalize': True, 'sage_project': False, 'lr': 5.9879325202640845e-05, 'weight_decay': 8.295751932093328e-07, 'epochs': 342, 'loss': 'mse', 'optimizer': 'adam', 'graph_mode': 'cutoff', 'cutoff': 0.8580328836675462, 'grm_norm': 'gcn', 'self_loops': False, 'use_snp_selection': False}. Best is trial 129 with value: 0.30318542807592097.
[I 2025-12-08 20:57:52,752] Trial 0 finished with value: 0.25508566404282484 and parameters: {'model_type': 'graphsage', 'hidden_dims': '[128, 64]', 'dropout': 0.199031432379812, 'batch_norm': True, 'sage_aggr': 'max', 'sage_normalize': True, 'sage_project': False, 'lr': 0.00034401453323286885, 'weight_decay': 0.00017802616915745114, 'epochs': 230, 'loss': 'mse', 'optimizer': 'adam', 'graph_mode': 'knn', 'knn_k': 6, 'weighted_edges': True, 'symmetrize_mode': 'mutual', 'self_loops': True, 'use_snp_selection': False}. Best is trial 0 with value: 0.25508566404282484.
[I 2025-12-08 20:59:38,868] Trial 1 finished with value: 0.2772012364731059 and parameters: {'model_type': 'graphsage', 'hidden_dims': '[512, 128]', 'dropout': 0.2503500283181017, 'batch_norm': False, 'sage_aggr': 'max', 'sage_normalize': False, 'sage_project': False, 'lr': 3.952233718592099e-05, 'weight_decay': 0.00026754769258252603, 'epochs': 149, 'loss': 'mse', 'optimizer': 'adam', 'graph_mode': 'knn', 'knn_k': 2, 'weighted_edges': False, 'symmetrize_mode': 'mutual', 'self_loops': True, 'use_snp_selection': True, 'num_snps': 49915}. Best is trial 1 with value: 0.2772012364731059.
[I 2025-12-08 21:00:59,902] Trial 2 finished with value: 0.26529815727393163 and parameters: {'model_type': 'graphsage', 'hidden_dims': '[512, 256]', 'dropout': 0.2785908793172681, 'batch_norm': False, 'sage_aggr': 'max', 'sage_normalize': False, 'sage_project': False, 'lr': 8.806039223165805e-05, 'weight_decay': 3.5153176302760294e-05, 'epochs': 147, 'loss': 'mae', 'optimizer': 'adam', 'graph_mode': 'cutoff', 'cutoff': 0.4922564006874869, 'grm_norm': 'gcn', 'self_loops': False, 'use_snp_selection': True, 'num_snps': 34340}. Best is trial 1 with value: 0.2772012364731059.
[I 2025-12-08 21:02:18,282] Trial 3 finished with value: 0.2773280311555321 and parameters: {'model_type': 'graphsage', 'hidden_dims': '[256, 128, 64]', 'dropout': 0.3475243154412272, 'batch_norm': True, 'sage_aggr': 'max', 'sage_normalize': False, 'sage_project': False, 'lr': 1.6006331996938085e-05, 'weight_decay': 7.213121225589906e-06, 'epochs': 283, 'loss': 'mse', 'optimizer': 'adam', 'graph_mode': 'cutoff', 'cutoff': 0.5942334791449215, 'grm_norm': 'none', 'self_loops': True, 'use_snp_selection': False}. Best is trial 3 with value: 0.2773280311555321.
