[I 2025-12-06 04:43:57,226] Trial 103 finished with value: 0.23300423074123966 and parameters: {'model_type': 'graphsage', 'hidden_dims': '[512, 64]', 'dropout': 0.2980269385299272, 'batch_norm': False, 'sage_aggr': 'max', 'sage_normalize': False, 'sage_project': False, 'lr': 2.7872574566144886e-05, 'weight_decay': 1.3822432054379289e-05, 'epochs': 220, 'loss': 'mae', 'optimizer': 'adam', 'graph_mode': 'cutoff', 'cutoff': 0.2813319408247675, 'grm_norm': 'cosine', 'self_loops': False, 'use_snp_selection': True, 'num_snps': 31738, 'graphsage_batch_size': 16}. Best is trial 72 with value: 0.24785014245637355.
[I 2025-12-06 04:45:03,213] Trial 104 finished with value: 0.2232557944611233 and parameters: {'model_type': 'graphsage', 'hidden_dims': '[512, 64]', 'dropout': 0.3258989518634049, 'batch_norm': False, 'sage_aggr': 'max', 'sage_normalize': False, 'sage_project': False, 'lr': 4.079711816569079e-05, 'weight_decay': 3.7634456389584794e-05, 'epochs': 222, 'loss': 'mae', 'optimizer': 'adam', 'graph_mode': 'cutoff', 'cutoff': 0.3727596187302341, 'grm_norm': 'cosine', 'self_loops': False, 'use_snp_selection': True, 'num_snps': 24697, 'graphsage_batch_size': 16}. Best is trial 72 with value: 0.24785014245637355.
[I 2025-12-06 04:46:37,925] Trial 105 finished with value: 0.22881904424501878 and parameters: {'model_type': 'graphsage', 'hidden_dims': '[512, 64]', 'dropout': 0.31687233273192905, 'batch_norm': False, 'sage_aggr': 'max', 'sage_normalize': False, 'sage_project': False, 'lr': 3.386811815135251e-05, 'weight_decay': 2.474169468737399e-05, 'epochs': 211, 'loss': 'mae', 'optimizer': 'adam', 'graph_mode': 'cutoff', 'cutoff': 0.33787284033734166, 'grm_norm': 'cosine', 'self_loops': False, 'use_snp_selection': True, 'num_snps': 36956, 'graphsage_batch_size': 16}. Best is trial 72 with value: 0.24785014245637355.
[I 2025-12-06 04:48:07,168] Trial 106 finished with value: 0.19818498538091345 and parameters: {'model_type': 'graphsage', 'hidden_dims': '[512, 64]', 'dropout': 0.28228070568919283, 'batch_norm': True, 'sage_aggr': 'max', 'sage_normalize': False, 'sage_project': False, 'lr': 2.293639237542886e-05, 'weight_decay': 9.316812111756344e-06, 'epochs': 197, 'loss': 'mae', 'optimizer': 'adam', 'graph_mode': 'cutoff', 'cutoff': 0.2720450726063773, 'grm_norm': 'cosine', 'self_loops': False, 'use_snp_selection': True, 'num_snps': 28803, 'graphsage_batch_size': 16}. Best is trial 72 with value: 0.24785014245637355.
[I 2025-12-06 04:50:46,878] Trial 107 finished with value: 0.21915149858362565 and parameters: {'model_type': 'graphsage', 'hidden_dims': '[512, 64]', 'dropout': 0.3509831305285117, 'batch_norm': False, 'sage_aggr': 'max', 'sage_normalize': False, 'sage_project': False, 'lr': 1.912005302995991e-05, 'weight_decay': 1.4237000581428744e-05, 'epochs': 218, 'loss': 'mae', 'optimizer': 'adam', 'graph_mode': 'cutoff', 'cutoff': 0.2520780198809386, 'grm_norm': 'cosine', 'self_loops': False, 'use_snp_selection': True, 'num_snps': 41993, 'graphsage_batch_size': 16}. Best is trial 72 with value: 0.24785014245637355.
[I 2025-12-06 04:51:38,291] Trial 108 finished with value: 0.2092205909612071 and parameters: {'model_type': 'graphsage', 'hidden_dims': '[512, 64]', 'dropout': 0.2651909544421255, 'batch_norm': False, 'sage_aggr': 'max', 'sage_normalize': False, 'sage_project': False, 'lr': 2.788949615974292e-05, 'weight_decay': 1.8631439902367488e-05, 'epochs': 224, 'loss': 'mae', 'optimizer': 'adam', 'graph_mode': 'knn', 'knn_k': 5, 'weighted_edges': True, 'symmetrize_mode': 'union', 'self_loops': False, 'use_snp_selection': True, 'num_snps': 16029, 'graphsage_batch_size': 16}. Best is trial 72 with value: 0.24785014245637355.
[I 2025-12-06 04:52:42,823] Trial 109 finished with value: 0.1899448994085615 and parameters: {'model_type': 'graphsage', 'hidden_dims': '[256, 128]', 'dropout': 0.3504748408670069, 'batch_norm': False, 'sage_aggr': 'max', 'sage_normalize': True, 'sage_project': False, 'lr': 1.8195700467543186e-05, 'weight_decay': 7.540630262366994e-05, 'epochs': 234, 'loss': 'mae', 'optimizer': 'adam', 'graph_mode': 'cutoff', 'cutoff': 0.29595541281553245, 'grm_norm': 'cosine', 'self_loops': False, 'use_snp_selection': True, 'num_snps': 26640, 'graphsage_batch_size': 8}. Best is trial 72 with value: 0.24785014245637355.
[I 2025-12-06 04:54:31,869] Trial 110 finished with value: 0.2329204710673009 and parameters: {'model_type': 'graphsage', 'hidden_dims': '[512, 64]', 'dropout': 0.28000083799436076, 'batch_norm': False, 'sage_aggr': 'max', 'sage_normalize': False, 'sage_project': False, 'lr': 1.2456665554871954e-05, 'weight_decay': 9.588117935790811e-05, 'epochs': 247, 'loss': 'mae', 'optimizer': 'adam', 'graph_mode': 'cutoff', 'cutoff': 0.3171960247866766, 'grm_norm': 'cosine', 'self_loops': False, 'use_snp_selection': True, 'num_snps': 35494, 'graphsage_batch_size': 256}. Best is trial 72 with value: 0.24785014245637355.
[I 2025-12-06 04:55:38,079] Trial 111 finished with value: 0.2016913798573845 and parameters: {'model_type': 'graphsage', 'hidden_dims': '[512, 64]', 'dropout': 0.24714484454147642, 'batch_norm': False, 'sage_aggr': 'max', 'sage_normalize': False, 'sage_project': False, 'lr': 6.916375577648995e-06, 'weight_decay': 0.00011793787336104389, 'epochs': 230, 'loss': 'mae', 'optimizer': 'adam', 'graph_mode': 'cutoff', 'cutoff': 0.30084327698374974, 'grm_norm': 'cosine', 'self_loops': False, 'use_snp_selection': True, 'num_snps': 20798, 'graphsage_batch_size': 16}. Best is trial 72 with value: 0.24785014245637355.
[I 2025-12-06 04:56:15,242] Trial 112 finished with value: 0.21446728998225667 and parameters: {'model_type': 'graphsage', 'hidden_dims': '[512, 64]', 'dropout': 0.38228168096838655, 'batch_norm': False, 'sage_aggr': 'max', 'sage_normalize': False, 'sage_project': False, 'lr': 5.586198349997413e-06, 'weight_decay': 5.104495466049366e-05, 'epochs': 209, 'loss': 'mae', 'optimizer': 'adam', 'graph_mode': 'cutoff', 'cutoff': 0.3518238821023245, 'grm_norm': 'gcn', 'self_loops': False, 'use_snp_selection': True, 'num_snps': 11927, 'graphsage_batch_size': 512}. Best is trial 72 with value: 0.24785014245637355.
[I 2025-12-06 04:58:09,747] Trial 113 finished with value: 0.2004012391709306 and parameters: {'model_type': 'graphsage', 'hidden_dims': '[256, 128, 64]', 'dropout': 0.30771201272620724, 'batch_norm': False, 'sage_aggr': 'max', 'sage_normalize': False, 'sage_project': False, 'lr': 9.218407834260445e-06, 'weight_decay': 3.987788242052071e-05, 'epochs': 203, 'loss': 'mae', 'optimizer': 'adam', 'graph_mode': 'cutoff', 'cutoff': 0.27906374808568535, 'grm_norm': 'cosine', 'self_loops': False, 'use_snp_selection': True, 'num_snps': 41526, 'graphsage_batch_size': 16}. Best is trial 72 with value: 0.24785014245637355.
[I 2025-12-06 04:59:31,116] Trial 114 finished with value: 0.21280193508613424 and parameters: {'model_type': 'graphsage', 'hidden_dims': '[128, 64]', 'dropout': 0.2900900808287868, 'batch_norm': False, 'sage_aggr': 'max', 'sage_normalize': False, 'sage_project': False, 'lr': 1.5207703780244875e-05, 'weight_decay': 2.5972616010816167e-05, 'epochs': 224, 'loss': 'mae', 'optimizer': 'adam', 'graph_mode': 'cutoff', 'cutoff': 0.2436795876234309, 'grm_norm': 'cosine', 'self_loops': False, 'use_snp_selection': True, 'num_snps': 28797, 'graphsage_batch_size': 16}. Best is trial 72 with value: 0.24785014245637355.
[I 2025-12-06 05:01:56,150] Trial 115 finished with value: 0.22340521054847867 and parameters: {'model_type': 'graphsage', 'hidden_dims': '[512, 64]', 'dropout': 0.33562342788969507, 'batch_norm': False, 'sage_aggr': 'max', 'sage_normalize': False, 'sage_project': False, 'lr': 1.1090489619296516e-05, 'weight_decay': 0.0002630277441579654, 'epochs': 217, 'loss': 'mae', 'optimizer': 'adam', 'graph_mode': 'cutoff', 'cutoff': 0.31173589121673456, 'grm_norm': 'cosine', 'self_loops': False, 'use_snp_selection': True, 'num_snps': 47620, 'graphsage_batch_size': 64}. Best is trial 72 with value: 0.24785014245637355.
[I 2025-12-06 05:03:27,631] Trial 116 finished with value: 0.23273430186115354 and parameters: {'model_type': 'graphsage', 'hidden_dims': '[256, 128]', 'dropout': 0.1469703071878582, 'batch_norm': False, 'sage_aggr': 'max', 'sage_normalize': False, 'sage_project': False, 'lr': 5.522129345758608e-05, 'weight_decay': 5.630384148287323e-05, 'epochs': 236, 'loss': 'mae', 'optimizer': 'adam', 'graph_mode': 'cutoff', 'cutoff': 0.2660713893667469, 'grm_norm': 'cosine', 'self_loops': False, 'use_snp_selection': True, 'num_snps': 31865, 'graphsage_batch_size': 16}. Best is trial 72 with value: 0.24785014245637355.
[I 2025-12-06 05:04:29,578] Trial 117 finished with value: 0.2276795472941049 and parameters: {'model_type': 'graphsage', 'hidden_dims': '[512, 64]', 'dropout': 0.2166575475283529, 'batch_norm': False, 'sage_aggr': 'max', 'sage_normalize': False, 'sage_project': False, 'lr': 6.888627187082557e-06, 'weight_decay': 7.326913262194175e-06, 'epochs': 241, 'loss': 'mae', 'optimizer': 'adam', 'graph_mode': 'cutoff', 'cutoff': 0.32541993883875253, 'grm_norm': 'cosine', 'self_loops': False, 'use_snp_selection': True, 'num_snps': 20075, 'graphsage_batch_size': 8}. Best is trial 72 with value: 0.24785014245637355.
[I 2025-12-06 05:06:33,368] Trial 118 finished with value: 0.22544568748206087 and parameters: {'model_type': 'graphsage', 'hidden_dims': '[512, 64]', 'dropout': 0.36212029548406555, 'batch_norm': False, 'sage_aggr': 'max', 'sage_normalize': False, 'sage_project': False, 'lr': 5.7383084794042496e-06, 'weight_decay': 6.956620913568569e-05, 'epochs': 174, 'loss': 'mae', 'optimizer': 'adam', 'graph_mode': 'cutoff', 'cutoff': 0.2880034992472958, 'grm_norm': 'gcn', 'self_loops': False, 'use_snp_selection': False, 'graphsage_batch_size': 16}. Best is trial 72 with value: 0.24785014245637355.
[I 2025-12-06 05:08:57,350] Trial 119 finished with value: 0.2242933019616638 and parameters: {'model_type': 'graphsage', 'hidden_dims': '[512, 128]', 'dropout': 0.2653152889844413, 'batch_norm': False, 'sage_aggr': 'mean', 'sage_normalize': False, 'sage_project': False, 'lr': 8.568208203543248e-06, 'weight_decay': 8.361707099794577e-05, 'epochs': 233, 'loss': 'mse', 'optimizer': 'adam', 'graph_mode': 'cutoff', 'cutoff': 0.3009960173008516, 'grm_norm': 'none', 'self_loops': False, 'use_snp_selection': False, 'graphsage_batch_size': 128}. Best is trial 72 with value: 0.24785014245637355.
[I 2025-12-06 05:10:59,630] Trial 120 finished with value: 0.22644732988403593 and parameters: {'model_type': 'graphsage', 'hidden_dims': '[512, 64]', 'dropout': 0.10079628856430316, 'batch_norm': False, 'sage_aggr': 'mean', 'sage_normalize': False, 'sage_project': False, 'lr': 1.6411979647920022e-05, 'weight_decay': 0.00014905669081767214, 'epochs': 229, 'loss': 'mae', 'optimizer': 'adam', 'graph_mode': 'cutoff', 'cutoff': 0.3797473650281059, 'grm_norm': 'cosine_then_gcn', 'self_loops': False, 'use_snp_selection': False, 'graphsage_batch_size': 16}. Best is trial 72 with value: 0.24785014245637355.
[I 2025-12-06 05:13:21,595] Trial 121 finished with value: 0.22995221271097366 and parameters: {'model_type': 'graphsage', 'hidden_dims': '[512, 64]', 'dropout': 0.13855375509777287, 'batch_norm': False, 'sage_aggr': 'max', 'sage_normalize': False, 'sage_project': False, 'lr': 1.4476830595408102e-05, 'weight_decay': 4.531388871083319e-05, 'epochs': 241, 'loss': 'mae', 'optimizer': 'adam', 'graph_mode': 'cutoff', 'cutoff': 0.33677712964143486, 'grm_norm': 'cosine', 'self_loops': False, 'use_snp_selection': False, 'graphsage_batch_size': 16}. Best is trial 72 with value: 0.24785014245637355.
[I 2025-12-06 05:15:39,755] Trial 122 finished with value: 0.24415990399626192 and parameters: {'model_type': 'graphsage', 'hidden_dims': '[512, 64]', 'dropout': 0.16494585814063206, 'batch_norm': False, 'sage_aggr': 'max', 'sage_normalize': False, 'sage_project': False, 'lr': 2.2463126184593368e-05, 'weight_decay': 3.3746050918480646e-05, 'epochs': 226, 'loss': 'mae', 'optimizer': 'adam', 'graph_mode': 'cutoff', 'cutoff': 0.32052253442369993, 'grm_norm': 'cosine', 'self_loops': False, 'use_snp_selection': False, 'graphsage_batch_size': 16}. Best is trial 72 with value: 0.24785014245637355.
[I 2025-12-06 05:17:47,510] Trial 123 finished with value: 0.22797440263936175 and parameters: {'model_type': 'graphsage', 'hidden_dims': '[512, 64]', 'dropout': 0.1939298391372887, 'batch_norm': False, 'sage_aggr': 'max', 'sage_normalize': False, 'sage_project': False, 'lr': 2.1631410236434907e-05, 'weight_decay': 3.268571727089312e-05, 'epochs': 219, 'loss': 'mae', 'optimizer': 'adam', 'graph_mode': 'cutoff', 'cutoff': 0.3467437346281678, 'grm_norm': 'cosine', 'self_loops': False, 'use_snp_selection': False, 'graphsage_batch_size': 256}. Best is trial 72 with value: 0.24785014245637355.
[I 2025-12-06 05:19:55,533] Trial 124 finished with value: 0.21224412374113868 and parameters: {'model_type': 'graphsage', 'hidden_dims': '[512, 64]', 'dropout': 0.4146597203066411, 'batch_norm': False, 'sage_aggr': 'max', 'sage_normalize': False, 'sage_project': False, 'lr': 3.316066994201916e-05, 'weight_decay': 1.225567471876836e-05, 'epochs': 224, 'loss': 'mae', 'optimizer': 'adam', 'graph_mode': 'cutoff', 'cutoff': 0.3616805454393789, 'grm_norm': 'cosine', 'self_loops': False, 'use_snp_selection': False, 'graphsage_batch_size': 16}. Best is trial 72 with value: 0.24785014245637355.
[I 2025-12-06 05:21:26,244] Trial 125 finished with value: 0.21489465101586475 and parameters: {'model_type': 'graphsage', 'hidden_dims': '[256, 128, 64]', 'dropout': 0.16702747483338326, 'batch_norm': False, 'sage_aggr': 'max', 'sage_normalize': False, 'sage_project': False, 'lr': 2.4228663309523707e-05, 'weight_decay': 2.2584914671977803e-05, 'epochs': 212, 'loss': 'mae', 'optimizer': 'adam', 'graph_mode': 'cutoff', 'cutoff': 0.31352932021826296, 'grm_norm': 'cosine', 'self_loops': False, 'use_snp_selection': False, 'graphsage_batch_size': 16}. Best is trial 72 with value: 0.24785014245637355.
[I 2025-12-06 05:24:00,959] Trial 126 finished with value: 0.20262400027675298 and parameters: {'model_type': 'graphsage', 'hidden_dims': '[512, 128]', 'dropout': 0.23068657659948633, 'batch_norm': True, 'sage_aggr': 'mean', 'sage_normalize': False, 'sage_project': False, 'lr': 7.644626018626008e-06, 'weight_decay': 0.00010769388298038525, 'epochs': 230, 'loss': 'mae', 'optimizer': 'adam', 'graph_mode': 'cutoff', 'cutoff': 0.25763911285864927, 'grm_norm': 'cosine_then_gcn', 'self_loops': False, 'use_snp_selection': False, 'graphsage_batch_size': 128}. Best is trial 72 with value: 0.24785014245637355.
[I 2025-12-06 05:26:44,440] Trial 127 finished with value: 0.2378256308999962 and parameters: {'model_type': 'graphsage', 'hidden_dims': '[512, 64]', 'dropout': 0.15105017453204966, 'batch_norm': False, 'sage_aggr': 'max', 'sage_normalize': False, 'sage_project': False, 'lr': 3.951554336910601e-05, 'weight_decay': 0.00019108136042909286, 'epochs': 235, 'loss': 'mae', 'optimizer': 'adam', 'graph_mode': 'cutoff', 'cutoff': 0.27564910411204807, 'grm_norm': 'cosine', 'self_loops': False, 'use_snp_selection': False, 'graphsage_batch_size': 512}. Best is trial 72 with value: 0.24785014245637355.
[I 2025-12-06 05:29:32,753] Trial 128 finished with value: 0.21157407995003036 and parameters: {'model_type': 'graphsage', 'hidden_dims': '[512, 64]', 'dropout': 0.17950086627063613, 'batch_norm': False, 'sage_aggr': 'max', 'sage_normalize': False, 'sage_project': False, 'lr': 6.697554729082507e-05, 'weight_decay': 1.7058616205034906e-05, 'epochs': 235, 'loss': 'mae', 'optimizer': 'adam', 'graph_mode': 'knn', 'knn_k': 7, 'weighted_edges': True, 'symmetrize_mode': 'union', 'self_loops': False, 'use_snp_selection': False, 'graphsage_batch_size': 512}. Best is trial 72 with value: 0.24785014245637355.
[I 2025-12-06 05:31:05,310] Trial 129 finished with value: 0.17799224104624609 and parameters: {'model_type': 'graphsage', 'hidden_dims': '[512, 64]', 'dropout': 0.20228660452238195, 'batch_norm': False, 'sage_aggr': 'max', 'sage_normalize': True, 'sage_project': False, 'lr': 3.619372747692847e-05, 'weight_decay': 0.00020928671724356357, 'epochs': 250, 'loss': 'mae', 'optimizer': 'adam', 'graph_mode': 'cutoff', 'cutoff': 0.5017686775353816, 'grm_norm': 'cosine', 'self_loops': False, 'use_snp_selection': True, 'num_snps': 38861, 'graphsage_batch_size': 512}. Best is trial 72 with value: 0.24785014245637355.
[I 2025-12-06 05:33:59,227] Trial 130 finished with value: 0.21830069988685702 and parameters: {'model_type': 'graphsage', 'hidden_dims': '[512, 64]', 'dropout': 0.15085823436091667, 'batch_norm': False, 'sage_aggr': 'max', 'sage_normalize': False, 'sage_project': False, 'lr': 2.6945333083508136e-05, 'weight_decay': 0.0007974133183973817, 'epochs': 199, 'loss': 'mae', 'optimizer': 'adam', 'graph_mode': 'cutoff', 'cutoff': 0.21747559220024226, 'grm_norm': 'cosine', 'self_loops': False, 'use_snp_selection': False, 'graphsage_batch_size': 512}. Best is trial 72 with value: 0.24785014245637355.
[I 2025-12-06 05:36:47,447] Trial 131 finished with value: 0.23173177360939157 and parameters: {'model_type': 'graphsage', 'hidden_dims': '[512, 64]', 'dropout': 0.1584656884045215, 'batch_norm': False, 'sage_aggr': 'max', 'sage_normalize': False, 'sage_project': False, 'lr': 4.3661064816287145e-05, 'weight_decay': 0.0001788282574217183, 'epochs': 245, 'loss': 'mae', 'optimizer': 'adam', 'graph_mode': 'cutoff', 'cutoff': 0.27889993246650874, 'grm_norm': 'cosine', 'self_loops': False, 'use_snp_selection': False, 'graphsage_batch_size': 512}. Best is trial 72 with value: 0.24785014245637355.
[I 2025-12-06 05:39:02,668] Trial 132 finished with value: 0.23487623072421476 and parameters: {'model_type': 'graphsage', 'hidden_dims': '[512, 128]', 'dropout': 0.12462748091954093, 'batch_norm': False, 'sage_aggr': 'mean', 'sage_normalize': False, 'sage_project': False, 'lr': 1.2051291143532045e-05, 'weight_decay': 0.00032849735876657306, 'epochs': 227, 'loss': 'mae', 'optimizer': 'adam', 'graph_mode': 'cutoff', 'cutoff': 0.300495600542969, 'grm_norm': 'cosine', 'self_loops': False, 'use_snp_selection': False, 'graphsage_batch_size': 128}. Best is trial 72 with value: 0.24785014245637355.
[I 2025-12-06 05:40:34,370] Trial 133 finished with value: 0.223268146348454 and parameters: {'model_type': 'graphsage', 'hidden_dims': '[128, 64]', 'dropout': 0.1496413532216384, 'batch_norm': False, 'sage_aggr': 'max', 'sage_normalize': False, 'sage_project': False, 'lr': 3.963680594609654e-05, 'weight_decay': 6.472459403656012e-05, 'epochs': 220, 'loss': 'mae', 'optimizer': 'adam', 'graph_mode': 'cutoff', 'cutoff': 0.26523572941924883, 'grm_norm': 'cosine_then_gcn', 'self_loops': False, 'use_snp_selection': False, 'graphsage_batch_size': 16}. Best is trial 72 with value: 0.24785014245637355.
[I 2025-12-06 05:42:12,136] Trial 134 finished with value: 0.2192438136662084 and parameters: {'model_type': 'graphsage', 'hidden_dims': '[512, 128]', 'dropout': 0.17173964787752646, 'batch_norm': False, 'sage_aggr': 'mean', 'sage_normalize': False, 'sage_project': False, 'lr': 9.835525962170064e-06, 'weight_decay': 2.904978631037238e-05, 'epochs': 216, 'loss': 'mae', 'optimizer': 'adam', 'graph_mode': 'cutoff', 'cutoff': 0.6923601356172397, 'grm_norm': 'none', 'self_loops': False, 'use_snp_selection': False, 'graphsage_batch_size': 128}. Best is trial 72 with value: 0.24785014245637355.
[I 2025-12-06 05:44:18,637] Trial 135 finished with value: 0.23134302128522083 and parameters: {'model_type': 'graphsage', 'hidden_dims': '[512, 64]', 'dropout': 0.13783620677521524, 'batch_norm': False, 'sage_aggr': 'max', 'sage_normalize': False, 'sage_project': False, 'lr': 2.0112419150527803e-05, 'weight_decay': 4.6220321670213484e-05, 'epochs': 207, 'loss': 'mae', 'optimizer': 'adam', 'graph_mode': 'cutoff', 'cutoff': 0.3236503038871029, 'grm_norm': 'cosine', 'self_loops': False, 'use_snp_selection': False, 'graphsage_batch_size': 16}. Best is trial 72 with value: 0.24785014245637355.
[I 2025-12-06 05:46:59,776] Trial 136 finished with value: 0.24197247568590022 and parameters: {'model_type': 'graphsage', 'hidden_dims': '[512, 64]', 'dropout': 0.11706677164329624, 'batch_norm': False, 'sage_aggr': 'mean', 'sage_normalize': False, 'sage_project': False, 'lr': 3.094950572815225e-05, 'weight_decay': 0.00025153468763024586, 'epochs': 225, 'loss': 'mae', 'optimizer': 'adam', 'graph_mode': 'cutoff', 'cutoff': 0.23850421798122196, 'grm_norm': 'cosine_then_gcn', 'self_loops': False, 'use_snp_selection': False, 'graphsage_batch_size': 64}. Best is trial 72 with value: 0.24785014245637355.
[I 2025-12-06 05:49:53,912] Trial 137 finished with value: 0.22939791605780582 and parameters: {'model_type': 'graphsage', 'hidden_dims': '[512, 64]', 'dropout': 0.11535380733807446, 'batch_norm': False, 'sage_aggr': 'mean', 'sage_normalize': False, 'sage_project': False, 'lr': 5.2875624073015105e-05, 'weight_decay': 0.00024185360758390118, 'epochs': 236, 'loss': 'mae', 'optimizer': 'adam', 'graph_mode': 'cutoff', 'cutoff': 0.22875941468419975, 'grm_norm': 'cosine_then_gcn', 'self_loops': False, 'use_snp_selection': False, 'graphsage_batch_size': 64}. Best is trial 72 with value: 0.24785014245637355.
[I 2025-12-06 05:51:19,222] Trial 138 finished with value: 0.09759000507725336 and parameters: {'model_type': 'graphsage', 'hidden_dims': '[512, 64]', 'dropout': 0.3197401620301956, 'batch_norm': False, 'sage_aggr': 'max', 'sage_normalize': False, 'sage_project': False, 'lr': 3.0667136362018455e-05, 'weight_decay': 0.000403469835000456, 'epochs': 104, 'loss': 'mae', 'optimizer': 'adam', 'graph_mode': 'cutoff', 'cutoff': 0.24966184024908167, 'grm_norm': 'cosine', 'self_loops': False, 'use_snp_selection': False, 'graphsage_batch_size': 64}. Best is trial 72 with value: 0.24785014245637355.
