[I 2025-12-09 07:42:56,556] Trial 5 finished with value: 0.26111908900897374 and parameters: {'model_type': 'graphsage', 'hidden_dims': '[512, 64]', 'dropout': 0.14505336736221927, 'batch_norm': True, 'sage_aggr': 'mean', 'sage_normalize': True, 'sage_project': False, 'lr': 1.2962030165732234e-05, 'weight_decay': 1.326598071105465e-07, 'epochs': 180, 'loss': 'mse', 'optimizer': 'adam', 'graph_mode': 'knn', 'knn_k': 9, 'weighted_edges': True, 'symmetrize_mode': 'mutual', 'self_loops': False, 'use_snp_selection': False}. Best is trial 2 with value: 0.28321521610225425.
[I 2025-12-09 07:43:30,078] Trial 6 finished with value: 0.28728008944127725 and parameters: {'model_type': 'graphsage', 'hidden_dims': '[256, 128, 64]', 'dropout': 0.10731743755162496, 'batch_norm': True, 'sage_aggr': 'mean', 'sage_normalize': False, 'sage_project': False, 'lr': 1.922990426933137e-05, 'weight_decay': 7.30001060446905e-05, 'epochs': 63, 'loss': 'mae', 'optimizer': 'adam', 'graph_mode': 'cutoff', 'cutoff': 0.7624978434202536, 'grm_norm': 'none', 'self_loops': True, 'use_snp_selection': True, 'num_snps': 50106}. Best is trial 6 with value: 0.28728008944127725.
[I 2025-12-09 07:45:31,417] Trial 7 finished with value: 0.25876152737625685 and parameters: {'model_type': 'graphsage', 'hidden_dims': '[512, 64]', 'dropout': 0.2585007811528941, 'batch_norm': True, 'sage_aggr': 'max', 'sage_normalize': True, 'sage_project': False, 'lr': 5.921425508303391e-05, 'weight_decay': 0.0004511561961144237, 'epochs': 182, 'loss': 'mae', 'optimizer': 'adam', 'graph_mode': 'knn', 'knn_k': 9, 'weighted_edges': True, 'symmetrize_mode': 'union', 'self_loops': False, 'use_snp_selection': True, 'num_snps': 23903}. Best is trial 6 with value: 0.28728008944127725.
[I 2025-12-09 07:45:57,370] Trial 8 finished with value: 0.23886352239973663 and parameters: {'model_type': 'graphsage', 'hidden_dims': '[512, 256]', 'dropout': 0.3061380386767003, 'batch_norm': False, 'sage_aggr': 'mean', 'sage_normalize': True, 'sage_project': False, 'lr': 0.000698401460570184, 'weight_decay': 2.965560055460244e-06, 'epochs': 289, 'loss': 'mae', 'optimizer': 'adam', 'graph_mode': 'knn', 'knn_k': 7, 'weighted_edges': False, 'symmetrize_mode': 'mutual', 'self_loops': True, 'use_snp_selection': True, 'num_snps': 4710}. Best is trial 6 with value: 0.28728008944127725.
[I 2025-12-09 07:51:08,048] Trial 9 finished with value: 0.29576653983582435 and parameters: {'model_type': 'graphsage', 'hidden_dims': '[512, 128]', 'dropout': 0.1733844071393634, 'batch_norm': False, 'sage_aggr': 'mean', 'sage_normalize': True, 'sage_project': False, 'lr': 0.0004269677918501597, 'weight_decay': 2.2439779626249696e-06, 'epochs': 319, 'loss': 'mse', 'optimizer': 'adam', 'graph_mode': 'cutoff', 'cutoff': 0.24117565767129295, 'grm_norm': 'cosine_then_gcn', 'self_loops': True, 'use_snp_selection': False}. Best is trial 9 with value: 0.29576653983582435.
[I 2025-12-09 07:56:37,951] Trial 10 finished with value: 0.2977378599019984 and parameters: {'model_type': 'graphsage', 'hidden_dims': '[512, 128]', 'dropout': 0.5365714961141473, 'batch_norm': False, 'sage_aggr': 'mean', 'sage_normalize': True, 'sage_project': False, 'lr': 0.004737327072203749, 'weight_decay': 7.303103160282385e-07, 'epochs': 299, 'loss': 'mse', 'optimizer': 'adam', 'graph_mode': 'cutoff', 'cutoff': 0.21281628365523453, 'grm_norm': 'cosine_then_gcn', 'self_loops': True, 'use_snp_selection': False}. Best is trial 10 with value: 0.2977378599019984.
[I 2025-12-09 08:02:45,506] Trial 11 finished with value: 0.2800585764606855 and parameters: {'model_type': 'graphsage', 'hidden_dims': '[512, 128]', 'dropout': 0.5154800957818386, 'batch_norm': False, 'sage_aggr': 'mean', 'sage_normalize': True, 'sage_project': False, 'lr': 0.006674532614550016, 'weight_decay': 6.544345930867686e-07, 'epochs': 335, 'loss': 'mse', 'optimizer': 'adam', 'graph_mode': 'cutoff', 'cutoff': 0.21348952516572178, 'grm_norm': 'cosine_then_gcn', 'self_loops': True, 'use_snp_selection': False}. Best is trial 10 with value: 0.2977378599019984.
[I 2025-12-09 08:09:04,683] Trial 12 finished with value: 0.287521600525045 and parameters: {'model_type': 'graphsage', 'hidden_dims': '[512, 128]', 'dropout': 0.49488375368548476, 'batch_norm': False, 'sage_aggr': 'mean', 'sage_normalize': True, 'sage_project': False, 'lr': 0.003802842966026102, 'weight_decay': 9.156985192829673e-07, 'epochs': 344, 'loss': 'mse', 'optimizer': 'adam', 'graph_mode': 'cutoff', 'cutoff': 0.21242241803866538, 'grm_norm': 'cosine_then_gcn', 'self_loops': True, 'use_snp_selection': False}. Best is trial 10 with value: 0.2977378599019984.
[I 2025-12-09 08:10:48,123] Trial 13 finished with value: 0.2962586785798346 and parameters: {'model_type': 'graphsage', 'hidden_dims': '[256, 128]', 'dropout': 0.42850806636201955, 'batch_norm': False, 'sage_aggr': 'mean', 'sage_normalize': True, 'sage_project': False, 'lr': 0.001630795915191733, 'weight_decay': 1.8431992240252396e-07, 'epochs': 256, 'loss': 'mse', 'optimizer': 'adam', 'graph_mode': 'cutoff', 'cutoff': 0.3805357334664356, 'grm_norm': 'cosine_then_gcn', 'self_loops': True, 'use_snp_selection': False}. Best is trial 10 with value: 0.2977378599019984.
[I 2025-12-09 08:12:19,798] Trial 14 finished with value: 0.2881628104529245 and parameters: {'model_type': 'graphsage', 'hidden_dims': '[256, 128]', 'dropout': 0.5925682347605283, 'batch_norm': False, 'sage_aggr': 'mean', 'sage_normalize': True, 'sage_project': False, 'lr': 0.0018683051933736658, 'weight_decay': 1.0245277391400134e-07, 'epochs': 231, 'loss': 'mse', 'optimizer': 'adam', 'graph_mode': 'cutoff', 'cutoff': 0.41220157776779326, 'grm_norm': 'cosine', 'self_loops': True, 'use_snp_selection': False}. Best is trial 10 with value: 0.2977378599019984.
[I 2025-12-09 08:14:01,197] Trial 15 finished with value: 0.2882563056389279 and parameters: {'model_type': 'graphsage', 'hidden_dims': '[256, 128]', 'dropout': 0.45124593177947864, 'batch_norm': False, 'sage_aggr': 'mean', 'sage_normalize': True, 'sage_project': False, 'lr': 0.001441527891067108, 'weight_decay': 2.459733050150243e-07, 'epochs': 246, 'loss': 'mse', 'optimizer': 'adam', 'graph_mode': 'cutoff', 'cutoff': 0.36109263431063254, 'grm_norm': 'cosine_then_gcn', 'self_loops': True, 'use_snp_selection': False}. Best is trial 10 with value: 0.2977378599019984.
[I 2025-12-09 08:15:54,472] Trial 16 finished with value: 0.29157705572125125 and parameters: {'model_type': 'graphsage', 'hidden_dims': '[256, 128]', 'dropout': 0.41283606725782557, 'batch_norm': False, 'sage_aggr': 'mean', 'sage_normalize': True, 'sage_project': False, 'lr': 0.009478916388343642, 'weight_decay': 3.2324185917373333e-07, 'epochs': 278, 'loss': 'mse', 'optimizer': 'adam', 'graph_mode': 'cutoff', 'cutoff': 0.3669963431983635, 'grm_norm': 'cosine_then_gcn', 'self_loops': True, 'use_snp_selection': False}. Best is trial 10 with value: 0.2977378599019984.
[I 2025-12-09 08:16:20,453] Trial 17 finished with value: 0.27977907031638277 and parameters: {'model_type': 'graphsage', 'hidden_dims': '[256, 128]', 'dropout': 0.5976742720657872, 'batch_norm': False, 'sage_aggr': 'mean', 'sage_normalize': True, 'sage_project': False, 'lr': 0.0023478353936738743, 'weight_decay': 1.4367014574915746e-05, 'epochs': 82, 'loss': 'mse', 'optimizer': 'adam', 'graph_mode': 'cutoff', 'cutoff': 0.6349690136441453, 'grm_norm': 'gcn', 'self_loops': True, 'use_snp_selection': False}. Best is trial 10 with value: 0.2977378599019984.
[I 2025-12-09 08:19:12,314] Trial 18 finished with value: 0.2737531215374877 and parameters: {'model_type': 'graphsage', 'hidden_dims': '[512, 128]', 'dropout': 0.4241138214261155, 'batch_norm': False, 'sage_aggr': 'mean', 'sage_normalize': True, 'sage_project': False, 'lr': 0.00013463108107189325, 'weight_decay': 2.992619733387227e-06, 'epochs': 249, 'loss': 'mse', 'optimizer': 'adam', 'graph_mode': 'cutoff', 'cutoff': 0.32034494041629513, 'grm_norm': 'cosine', 'self_loops': False, 'use_snp_selection': False}. Best is trial 10 with value: 0.2977378599019984.
[I 2025-12-09 08:21:08,505] Trial 19 finished with value: 0.2950435752555396 and parameters: {'model_type': 'graphsage', 'hidden_dims': '[256, 128]', 'dropout': 0.5306353492676107, 'batch_norm': False, 'sage_aggr': 'mean', 'sage_normalize': True, 'sage_project': False, 'lr': 0.0010036193140238428, 'weight_decay': 3.400616013453446e-07, 'epochs': 312, 'loss': 'mse', 'optimizer': 'adam', 'graph_mode': 'cutoff', 'cutoff': 0.48424822050186717, 'grm_norm': 'cosine_then_gcn', 'self_loops': True, 'use_snp_selection': False}. Best is trial 10 with value: 0.2977378599019984.
[I 2025-12-09 08:23:02,434] Trial 20 finished with value: 0.2599126596756546 and parameters: {'model_type': 'graphsage', 'hidden_dims': '[256, 128, 64]', 'dropout': 0.3820761822862554, 'batch_norm': False, 'sage_aggr': 'mean', 'sage_normalize': True, 'sage_project': False, 'lr': 0.003643786204815565, 'weight_decay': 1.4317273899262764e-06, 'epochs': 216, 'loss': 'mse', 'optimizer': 'adam', 'graph_mode': 'cutoff', 'cutoff': 0.3103741989499146, 'grm_norm': 'cosine_then_gcn', 'self_loops': True, 'use_snp_selection': False}. Best is trial 10 with value: 0.2977378599019984.
[I 2025-12-09 08:28:10,467] Trial 21 finished with value: 0.2885602308733747 and parameters: {'model_type': 'graphsage', 'hidden_dims': '[512, 128]', 'dropout': 0.4633272464526744, 'batch_norm': False, 'sage_aggr': 'mean', 'sage_normalize': True, 'sage_project': False, 'lr': 0.0002228962161698053, 'weight_decay': 2.277190540648854e-06, 'epochs': 311, 'loss': 'mse', 'optimizer': 'adam', 'graph_mode': 'cutoff', 'cutoff': 0.23690764459360258, 'grm_norm': 'cosine_then_gcn', 'self_loops': True, 'use_snp_selection': False}. Best is trial 10 with value: 0.2977378599019984.
[I 2025-12-09 08:31:49,187] Trial 22 finished with value: 0.3007267795960453 and parameters: {'model_type': 'graphsage', 'hidden_dims': '[512, 128]', 'dropout': 0.5355098572108682, 'batch_norm': False, 'sage_aggr': 'mean', 'sage_normalize': True, 'sage_project': False, 'lr': 0.0006742770606323465, 'weight_decay': 7.530438239356288e-06, 'epochs': 264, 'loss': 'mse', 'optimizer': 'adam', 'graph_mode': 'cutoff', 'cutoff': 0.2845061235772891, 'grm_norm': 'cosine_then_gcn', 'self_loops': True, 'use_snp_selection': False}. Best is trial 22 with value: 0.3007267795960453.
[I 2025-12-09 08:34:37,495] Trial 23 finished with value: 0.2911951690232729 and parameters: {'model_type': 'graphsage', 'hidden_dims': '[512, 128]', 'dropout': 0.5485519496091174, 'batch_norm': False, 'sage_aggr': 'mean', 'sage_normalize': True, 'sage_project': False, 'lr': 0.0007706441265252498, 'weight_decay': 1.2334451262200844e-05, 'epochs': 265, 'loss': 'mse', 'optimizer': 'adam', 'graph_mode': 'cutoff', 'cutoff': 0.42422485004921506, 'grm_norm': 'cosine_then_gcn', 'self_loops': True, 'use_snp_selection': False}. Best is trial 22 with value: 0.3007267795960453.
[I 2025-12-09 08:37:20,804] Trial 24 finished with value: 0.24856440067025937 and parameters: {'model_type': 'graphsage', 'hidden_dims': '[512, 128]', 'dropout': 0.5588602787343864, 'batch_norm': False, 'sage_aggr': 'mean', 'sage_normalize': True, 'sage_project': False, 'lr': 0.004197963341282963, 'weight_decay': 5.365400659331467e-06, 'epochs': 201, 'loss': 'mse', 'optimizer': 'adam', 'graph_mode': 'cutoff', 'cutoff': 0.29288383135420853, 'grm_norm': 'cosine_then_gcn', 'self_loops': True, 'use_snp_selection': False}. Best is trial 22 with value: 0.3007267795960453.
[I 2025-12-09 08:38:12,084] Trial 25 finished with value: 0.3076883833138432 and parameters: {'model_type': 'graphsage', 'hidden_dims': '[128, 64]', 'dropout': 0.48277155386195714, 'batch_norm': False, 'sage_aggr': 'mean', 'sage_normalize': True, 'sage_project': False, 'lr': 0.0012895586390384048, 'weight_decay': 2.356319086595103e-05, 'epochs': 286, 'loss': 'mse', 'optimizer': 'adam', 'graph_mode': 'cutoff', 'cutoff': 0.8662038893997943, 'grm_norm': 'cosine', 'self_loops': True, 'use_snp_selection': False}. Best is trial 25 with value: 0.3076883833138432.
[I 2025-12-09 08:39:03,805] Trial 26 finished with value: 0.0 and parameters: {'model_type': 'graphsage', 'hidden_dims': '[128, 64]', 'dropout': 0.4975528753796066, 'batch_norm': False, 'sage_aggr': 'mean', 'sage_normalize': False, 'sage_project': False, 'lr': 0.0010080192391073025, 'weight_decay': 3.167332885898526e-05, 'epochs': 290, 'loss': 'mae', 'optimizer': 'adam', 'graph_mode': 'cutoff', 'cutoff': 0.8487218762855279, 'grm_norm': 'cosine', 'self_loops': False, 'use_snp_selection': False}. Best is trial 25 with value: 0.3076883833138432.
[I 2025-12-09 08:39:58,273] Trial 27 finished with value: 0.3028766580844843 and parameters: {'model_type': 'graphsage', 'hidden_dims': '[128, 64]', 'dropout': 0.4814992254857392, 'batch_norm': False, 'sage_aggr': 'mean', 'sage_normalize': True, 'sage_project': False, 'lr': 0.002988725762840112, 'weight_decay': 2.2954641231441108e-05, 'epochs': 304, 'loss': 'mse', 'optimizer': 'adam', 'graph_mode': 'cutoff', 'cutoff': 0.7020726985991392, 'grm_norm': 'cosine', 'self_loops': True, 'use_snp_selection': False}. Best is trial 25 with value: 0.3076883833138432.
[I 2025-12-09 08:41:00,505] Trial 28 finished with value: 0.28106243361305017 and parameters: {'model_type': 'graphsage', 'hidden_dims': '[128, 64]', 'dropout': 0.4805821284195061, 'batch_norm': False, 'sage_aggr': 'mean', 'sage_normalize': True, 'sage_project': False, 'lr': 0.00020895104889108495, 'weight_decay': 3.250347514424996e-05, 'epochs': 349, 'loss': 'mse', 'optimizer': 'adam', 'graph_mode': 'cutoff', 'cutoff': 0.6941592886647734, 'grm_norm': 'cosine', 'self_loops': True, 'use_snp_selection': False}. Best is trial 25 with value: 0.3076883833138432.
[I 2025-12-09 08:42:22,070] Trial 29 finished with value: 0.2573979251110469 and parameters: {'model_type': 'graphsage', 'hidden_dims': '[128, 64]', 'dropout': 0.3819414070976902, 'batch_norm': True, 'sage_aggr': 'max', 'sage_normalize': True, 'sage_project': False, 'lr': 0.0025073565171830244, 'weight_decay': 0.00010659787531815988, 'epochs': 229, 'loss': 'mse', 'optimizer': 'adam', 'graph_mode': 'knn', 'knn_k': 3, 'weighted_edges': False, 'symmetrize_mode': 'union', 'self_loops': True, 'use_snp_selection': False}. Best is trial 25 with value: 0.3076883833138432.
[I 2025-12-09 08:43:20,242] Trial 30 finished with value: 0.3061404621964182 and parameters: {'model_type': 'graphsage', 'hidden_dims': '[128, 64]', 'dropout': 0.5684069389351838, 'batch_norm': False, 'sage_aggr': 'mean', 'sage_normalize': True, 'sage_project': False, 'lr': 0.0006353561302408887, 'weight_decay': 2.0283083822786103e-05, 'epochs': 326, 'loss': 'mse', 'optimizer': 'adam', 'graph_mode': 'cutoff', 'cutoff': 0.8796243579036237, 'grm_norm': 'cosine', 'self_loops': True, 'use_snp_selection': False}. Best is trial 25 with value: 0.3076883833138432.
[I 2025-12-09 08:44:19,313] Trial 31 finished with value: 0.29854445285125 and parameters: {'model_type': 'graphsage', 'hidden_dims': '[128, 64]', 'dropout': 0.5760288703348591, 'batch_norm': False, 'sage_aggr': 'mean', 'sage_normalize': True, 'sage_project': False, 'lr': 0.0005622718561600486, 'weight_decay': 1.9589790657030873e-05, 'epochs': 330, 'loss': 'mse', 'optimizer': 'adam', 'graph_mode': 'cutoff', 'cutoff': 0.8944993013854019, 'grm_norm': 'cosine', 'self_loops': True, 'use_snp_selection': False}. Best is trial 25 with value: 0.3076883833138432.
[I 2025-12-09 08:45:13,899] Trial 32 finished with value: 0.28678998570250724 and parameters: {'model_type': 'graphsage', 'hidden_dims': '[128, 64]', 'dropout': 0.5174226543081228, 'batch_norm': False, 'sage_aggr': 'mean', 'sage_normalize': True, 'sage_project': False, 'lr': 0.0002826606240928832, 'weight_decay': 7.828655062687758e-05, 'epochs': 305, 'loss': 'mse', 'optimizer': 'adam', 'graph_mode': 'cutoff', 'cutoff': 0.7848220797375689, 'grm_norm': 'cosine', 'self_loops': True, 'use_snp_selection': False}. Best is trial 25 with value: 0.3076883833138432.
[I 2025-12-09 08:46:02,784] Trial 33 finished with value: 0.29809754982591713 and parameters: {'model_type': 'graphsage', 'hidden_dims': '[128, 64]', 'dropout': 0.566872534678044, 'batch_norm': False, 'sage_aggr': 'mean', 'sage_normalize': True, 'sage_project': False, 'lr': 0.0011583750328079125, 'weight_decay': 5.437545670957169e-06, 'epochs': 272, 'loss': 'mse', 'optimizer': 'adam', 'graph_mode': 'cutoff', 'cutoff': 0.80085842166334, 'grm_norm': 'cosine', 'self_loops': True, 'use_snp_selection': False}. Best is trial 25 with value: 0.3076883833138432.
[I 2025-12-09 08:46:13,967] Trial 34 finished with value: 0.24807904709138792 and parameters: {'model_type': 'graphsage', 'hidden_dims': '[128, 64]', 'dropout': 0.46496903188962335, 'batch_norm': False, 'sage_aggr': 'max', 'sage_normalize': False, 'sage_project': False, 'lr': 0.000593223720414135, 'weight_decay': 2.3769612096852403e-05, 'epochs': 322, 'loss': 'mse', 'optimizer': 'adam', 'graph_mode': 'cutoff', 'cutoff': 0.6908797267965145, 'grm_norm': 'cosine', 'self_loops': True, 'use_snp_selection': True, 'num_snps': 2241}. Best is trial 25 with value: 0.3076883833138432.
[I 2025-12-09 08:47:49,249] Trial 35 finished with value: 0.008359601373765204 and parameters: {'model_type': 'graphsage', 'hidden_dims': '[512, 256]', 'dropout': 0.5033353228799031, 'batch_norm': False, 'sage_aggr': 'max', 'sage_normalize': False, 'sage_project': False, 'lr': 0.00255178029094683, 'weight_decay': 5.0618318769653694e-05, 'epochs': 111, 'loss': 'mse', 'optimizer': 'adam', 'graph_mode': 'knn', 'knn_k': 4, 'weighted_edges': True, 'symmetrize_mode': 'union', 'self_loops': True, 'use_snp_selection': False}. Best is trial 25 with value: 0.3076883833138432.
[I 2025-12-09 08:49:07,054] Trial 36 finished with value: 0.27686349072319477 and parameters: {'model_type': 'graphsage', 'hidden_dims': '[128, 64]', 'dropout': 0.38182316799999827, 'batch_norm': True, 'sage_aggr': 'mean', 'sage_normalize': True, 'sage_project': False, 'lr': 0.00013061648790183318, 'weight_decay': 0.00017207030648516922, 'epochs': 274, 'loss': 'mae', 'optimizer': 'adam', 'graph_mode': 'cutoff', 'cutoff': 0.8935655208773523, 'grm_norm': 'cosine', 'self_loops': False, 'use_snp_selection': True, 'num_snps': 59922}. Best is trial 25 with value: 0.3076883833138432.
[I 2025-12-09 08:49:50,065] Trial 37 finished with value: 0.051227252267463844 and parameters: {'model_type': 'graphsage', 'hidden_dims': '[128, 64]', 'dropout': 0.44528392591187677, 'batch_norm': False, 'sage_aggr': 'mean', 'sage_normalize': False, 'sage_project': False, 'lr': 0.0004307325102593638, 'weight_decay': 8.403696935211147e-06, 'epochs': 239, 'loss': 'mse', 'optimizer': 'adam', 'graph_mode': 'cutoff', 'cutoff': 0.7314470282432433, 'grm_norm': 'cosine', 'self_loops': True, 'use_snp_selection': False}. Best is trial 25 with value: 0.3076883833138432.
[I 2025-12-09 08:55:50,715] Trial 38 finished with value: 0.2602681180047418 and parameters: {'model_type': 'graphsage', 'hidden_dims': '[512, 64]', 'dropout': 0.544551833800296, 'batch_norm': True, 'sage_aggr': 'max', 'sage_normalize': True, 'sage_project': False, 'lr': 0.0009519252069215701, 'weight_decay': 1.7563327390810393e-05, 'epochs': 298, 'loss': 'mae', 'optimizer': 'adam', 'graph_mode': 'knn', 'knn_k': 10, 'weighted_edges': True, 'symmetrize_mode': 'union', 'self_loops': False, 'use_snp_selection': False}. Best is trial 25 with value: 0.3076883833138432.
[I 2025-12-09 08:56:10,803] Trial 39 finished with value: 0.2720647420860475 and parameters: {'model_type': 'graphsage', 'hidden_dims': '[128, 64]', 'dropout': 0.48300641859952975, 'batch_norm': False, 'sage_aggr': 'mean', 'sage_normalize': True, 'sage_project': False, 'lr': 2.6451524405790403e-05, 'weight_decay': 0.0008076915742574946, 'epochs': 214, 'loss': 'mse', 'optimizer': 'adam', 'graph_mode': 'cutoff', 'cutoff': 0.8426852296927108, 'grm_norm': 'gcn', 'self_loops': True, 'use_snp_selection': True, 'num_snps': 15197}. Best is trial 25 with value: 0.3076883833138432.
[I 2025-12-09 09:00:00,293] Trial 40 finished with value: 0.3006556671980309 and parameters: {'model_type': 'graphsage', 'hidden_dims': '[256, 128, 64]', 'dropout': 0.31477134330457357, 'batch_norm': True, 'sage_aggr': 'mean', 'sage_normalize': False, 'sage_project': False, 'lr': 0.0003300904279824187, 'weight_decay': 0.00022365271446673048, 'epochs': 327, 'loss': 'mae', 'optimizer': 'adam', 'graph_mode': 'knn', 'knn_k': 7, 'weighted_edges': False, 'symmetrize_mode': 'union', 'self_loops': True, 'use_snp_selection': False}. Best is trial 25 with value: 0.3076883833138432.
[I 2025-12-09 09:03:51,177] Trial 41 finished with value: 0.29391021545767904 and parameters: {'model_type': 'graphsage', 'hidden_dims': '[256, 128, 64]', 'dropout': 0.3112009451642912, 'batch_norm': True, 'sage_aggr': 'mean', 'sage_normalize': False, 'sage_project': False, 'lr': 0.00039149568407276594, 'weight_decay': 0.0002915807267152336, 'epochs': 329, 'loss': 'mae', 'optimizer': 'adam', 'graph_mode': 'knn', 'knn_k': 7, 'weighted_edges': False, 'symmetrize_mode': 'union', 'self_loops': True, 'use_snp_selection': False}. Best is trial 25 with value: 0.3076883833138432.
[I 2025-12-09 09:07:16,624] Trial 42 finished with value: 0.2939820950843264 and parameters: {'model_type': 'graphsage', 'hidden_dims': '[256, 128, 64]', 'dropout': 0.25207491990168246, 'batch_norm': True, 'sage_aggr': 'mean', 'sage_normalize': False, 'sage_project': False, 'lr': 0.00029400156233974525, 'weight_decay': 5.44872578761179e-05, 'epochs': 350, 'loss': 'mae', 'optimizer': 'adam', 'graph_mode': 'knn', 'knn_k': 5, 'weighted_edges': False, 'symmetrize_mode': 'union', 'self_loops': True, 'use_snp_selection': False}. Best is trial 25 with value: 0.3076883833138432.
