[I 2025-12-08 20:49:45,672] Trial 5 finished with value: 0.2761254179661029 and parameters: {'model_type': 'graphsage', 'hidden_dims': '[512, 64]', 'dropout': 0.14505336736221927, 'batch_norm': True, 'sage_aggr': 'mean', 'sage_normalize': True, 'sage_project': False, 'lr': 1.2962030165732234e-05, 'weight_decay': 1.326598071105465e-07, 'epochs': 180, 'loss': 'mse', 'optimizer': 'adam', 'graph_mode': 'knn', 'knn_k': 9, 'weighted_edges': True, 'symmetrize_mode': 'mutual', 'self_loops': False, 'use_snp_selection': False}. Best is trial 1 with value: 0.2860477189896274.
[I 2025-12-08 20:50:19,114] Trial 6 finished with value: 0.28255966773072927 and parameters: {'model_type': 'graphsage', 'hidden_dims': '[256, 128, 64]', 'dropout': 0.10731743755162496, 'batch_norm': True, 'sage_aggr': 'mean', 'sage_normalize': False, 'sage_project': False, 'lr': 1.922990426933137e-05, 'weight_decay': 7.30001060446905e-05, 'epochs': 63, 'loss': 'mae', 'optimizer': 'adam', 'graph_mode': 'cutoff', 'cutoff': 0.7624978434202536, 'grm_norm': 'none', 'self_loops': True, 'use_snp_selection': True, 'num_snps': 50106}. Best is trial 1 with value: 0.2860477189896274.
[I 2025-12-08 20:52:20,369] Trial 7 finished with value: 0.23590498270885743 and parameters: {'model_type': 'graphsage', 'hidden_dims': '[512, 64]', 'dropout': 0.2585007811528941, 'batch_norm': True, 'sage_aggr': 'max', 'sage_normalize': True, 'sage_project': False, 'lr': 5.921425508303391e-05, 'weight_decay': 0.0004511561961144237, 'epochs': 182, 'loss': 'mae', 'optimizer': 'adam', 'graph_mode': 'knn', 'knn_k': 9, 'weighted_edges': True, 'symmetrize_mode': 'union', 'self_loops': False, 'use_snp_selection': True, 'num_snps': 23903}. Best is trial 1 with value: 0.2860477189896274.
[I 2025-12-08 20:52:46,313] Trial 8 finished with value: 0.2405013243217867 and parameters: {'model_type': 'graphsage', 'hidden_dims': '[512, 256]', 'dropout': 0.3061380386767003, 'batch_norm': False, 'sage_aggr': 'mean', 'sage_normalize': True, 'sage_project': False, 'lr': 0.000698401460570184, 'weight_decay': 2.965560055460244e-06, 'epochs': 289, 'loss': 'mae', 'optimizer': 'adam', 'graph_mode': 'knn', 'knn_k': 7, 'weighted_edges': False, 'symmetrize_mode': 'mutual', 'self_loops': True, 'use_snp_selection': True, 'num_snps': 4710}. Best is trial 1 with value: 0.2860477189896274.
[I 2025-12-08 20:57:57,183] Trial 9 finished with value: 0.2769663051971837 and parameters: {'model_type': 'graphsage', 'hidden_dims': '[512, 128]', 'dropout': 0.1733844071393634, 'batch_norm': False, 'sage_aggr': 'mean', 'sage_normalize': True, 'sage_project': False, 'lr': 0.0004269677918501597, 'weight_decay': 2.2439779626249696e-06, 'epochs': 319, 'loss': 'mse', 'optimizer': 'adam', 'graph_mode': 'cutoff', 'cutoff': 0.24117565767129295, 'grm_norm': 'cosine_then_gcn', 'self_loops': True, 'use_snp_selection': False}. Best is trial 1 with value: 0.2860477189896274.
[I 2025-12-08 20:59:06,349] Trial 10 finished with value: 0.0 and parameters: {'model_type': 'graphsage', 'hidden_dims': '[512, 128]', 'dropout': 0.5365714961141473, 'batch_norm': False, 'sage_aggr': 'max', 'sage_normalize': False, 'sage_project': False, 'lr': 0.006005004021681345, 'weight_decay': 0.0009536725175322642, 'epochs': 77, 'loss': 'mse', 'optimizer': 'adam', 'graph_mode': 'knn', 'knn_k': 1, 'weighted_edges': False, 'symmetrize_mode': 'union', 'self_loops': True, 'use_snp_selection': True, 'num_snps': 56869}. Best is trial 1 with value: 0.2860477189896274.
[I 2025-12-08 20:59:35,756] Trial 11 finished with value: 0.2593967858466506 and parameters: {'model_type': 'graphsage', 'hidden_dims': '[256, 128]', 'dropout': 0.10344600881777158, 'batch_norm': False, 'sage_aggr': 'mean', 'sage_normalize': False, 'sage_project': False, 'lr': 5.417054969366551e-05, 'weight_decay': 5.515647476876964e-05, 'epochs': 41, 'loss': 'mae', 'optimizer': 'adam', 'graph_mode': 'cutoff', 'cutoff': 0.8557972809788285, 'grm_norm': 'none', 'self_loops': True, 'use_snp_selection': True, 'num_snps': 56175}. Best is trial 1 with value: 0.2860477189896274.
[I 2025-12-08 21:00:13,570] Trial 12 finished with value: 0.293065517324265 and parameters: {'model_type': 'graphsage', 'hidden_dims': '[256, 128, 64]', 'dropout': 0.413190516416286, 'batch_norm': False, 'sage_aggr': 'mean', 'sage_normalize': False, 'sage_project': False, 'lr': 2.999588108145663e-05, 'weight_decay': 8.636141739991599e-05, 'epochs': 99, 'loss': 'mae', 'optimizer': 'adam', 'graph_mode': 'cutoff', 'cutoff': 0.8981200386963422, 'grm_norm': 'cosine', 'self_loops': True, 'use_snp_selection': True, 'num_snps': 44458}. Best is trial 12 with value: 0.293065517324265.
[I 2025-12-08 21:01:06,309] Trial 13 finished with value: 0.2942640644315707 and parameters: {'model_type': 'graphsage', 'hidden_dims': '[512, 128]', 'dropout': 0.4608586563939124, 'batch_norm': False, 'sage_aggr': 'mean', 'sage_normalize': False, 'sage_project': False, 'lr': 0.00012586985041155037, 'weight_decay': 0.00020675425013633384, 'epochs': 111, 'loss': 'mse', 'optimizer': 'adam', 'graph_mode': 'cutoff', 'cutoff': 0.6633238280227164, 'grm_norm': 'cosine', 'self_loops': True, 'use_snp_selection': True, 'num_snps': 40155}. Best is trial 13 with value: 0.2942640644315707.
[I 2025-12-08 21:01:40,092] Trial 14 finished with value: 0.2966202606141993 and parameters: {'model_type': 'graphsage', 'hidden_dims': '[256, 128, 64]', 'dropout': 0.4483048564714998, 'batch_norm': False, 'sage_aggr': 'mean', 'sage_normalize': False, 'sage_project': False, 'lr': 0.00014303984893143204, 'weight_decay': 1.6594311791152085e-05, 'epochs': 108, 'loss': 'mse', 'optimizer': 'adam', 'graph_mode': 'cutoff', 'cutoff': 0.683934184103342, 'grm_norm': 'cosine', 'self_loops': True, 'use_snp_selection': True, 'num_snps': 37535}. Best is trial 14 with value: 0.2966202606141993.
[I 2025-12-08 21:02:15,174] Trial 15 finished with value: 0.2972428332656283 and parameters: {'model_type': 'graphsage', 'hidden_dims': '[256, 128]', 'dropout': 0.4541287574083598, 'batch_norm': False, 'sage_aggr': 'mean', 'sage_normalize': False, 'sage_project': False, 'lr': 0.00015737037943479147, 'weight_decay': 1.8088820072766307e-05, 'epochs': 112, 'loss': 'mse', 'optimizer': 'adam', 'graph_mode': 'cutoff', 'cutoff': 0.6394052962807231, 'grm_norm': 'cosine', 'self_loops': True, 'use_snp_selection': True, 'num_snps': 36915}. Best is trial 15 with value: 0.2972428332656283.
[I 2025-12-08 21:02:40,753] Trial 16 finished with value: 0.19305873696551878 and parameters: {'model_type': 'graphsage', 'hidden_dims': '[256, 128]', 'dropout': 0.5334412250472652, 'batch_norm': False, 'sage_aggr': 'mean', 'sage_normalize': False, 'sage_project': False, 'lr': 0.001440877309608138, 'weight_decay': 1.3518809403992406e-05, 'epochs': 121, 'loss': 'mse', 'optimizer': 'adam', 'graph_mode': 'cutoff', 'cutoff': 0.4167182008163355, 'grm_norm': 'cosine', 'self_loops': True, 'use_snp_selection': True, 'num_snps': 17495}. Best is trial 15 with value: 0.2972428332656283.
[I 2025-12-08 21:03:32,433] Trial 17 finished with value: 0.2860817414999034 and parameters: {'model_type': 'graphsage', 'hidden_dims': '[256, 128]', 'dropout': 0.43097228245832264, 'batch_norm': False, 'sage_aggr': 'mean', 'sage_normalize': False, 'sage_project': False, 'lr': 0.0001594291914395071, 'weight_decay': 1.2838062130870603e-05, 'epochs': 225, 'loss': 'mse', 'optimizer': 'adam', 'graph_mode': 'cutoff', 'cutoff': 0.6927352852412798, 'grm_norm': 'cosine', 'self_loops': True, 'use_snp_selection': True, 'num_snps': 35106}. Best is trial 15 with value: 0.2972428332656283.
[I 2025-12-08 21:04:01,310] Trial 18 finished with value: 0.023126722582408145 and parameters: {'model_type': 'graphsage', 'hidden_dims': '[256, 128, 64]', 'dropout': 0.5961628983756851, 'batch_norm': False, 'sage_aggr': 'mean', 'sage_normalize': False, 'sage_project': False, 'lr': 0.0015233671363614164, 'weight_decay': 8.796426579983007e-07, 'epochs': 82, 'loss': 'mse', 'optimizer': 'adam', 'graph_mode': 'cutoff', 'cutoff': 0.5111393177602112, 'grm_norm': 'cosine', 'self_loops': False, 'use_snp_selection': False}. Best is trial 15 with value: 0.2972428332656283.
[I 2025-12-08 21:04:31,617] Trial 19 finished with value: 0.2847266427416063 and parameters: {'model_type': 'graphsage', 'hidden_dims': '[256, 128]', 'dropout': 0.47517642160594564, 'batch_norm': False, 'sage_aggr': 'mean', 'sage_normalize': False, 'sage_project': False, 'lr': 0.00016837014206977138, 'weight_decay': 3.009832231607682e-05, 'epochs': 227, 'loss': 'mse', 'optimizer': 'adam', 'graph_mode': 'cutoff', 'cutoff': 0.7360809773422808, 'grm_norm': 'gcn', 'self_loops': True, 'use_snp_selection': True, 'num_snps': 17861}. Best is trial 15 with value: 0.2972428332656283.
[I 2025-12-08 21:05:37,936] Trial 20 finished with value: 0.09048342338252842 and parameters: {'model_type': 'graphsage', 'hidden_dims': '[256, 128]', 'dropout': 0.4034369929153414, 'batch_norm': False, 'sage_aggr': 'mean', 'sage_normalize': False, 'sage_project': False, 'lr': 0.000892424244718523, 'weight_decay': 4.840793141197857e-06, 'epochs': 120, 'loss': 'mse', 'optimizer': 'adam', 'graph_mode': 'cutoff', 'cutoff': 0.37475846429943116, 'grm_norm': 'cosine_then_gcn', 'self_loops': True, 'use_snp_selection': True, 'num_snps': 40820}. Best is trial 15 with value: 0.2972428332656283.
[I 2025-12-08 21:06:33,378] Trial 21 finished with value: 0.3038298765701165 and parameters: {'model_type': 'graphsage', 'hidden_dims': '[512, 128]', 'dropout': 0.4753604034506461, 'batch_norm': False, 'sage_aggr': 'mean', 'sage_normalize': False, 'sage_project': False, 'lr': 0.00013266291915109836, 'weight_decay': 1.4936070905047793e-05, 'epochs': 122, 'loss': 'mse', 'optimizer': 'adam', 'graph_mode': 'cutoff', 'cutoff': 0.6381133163106227, 'grm_norm': 'cosine', 'self_loops': True, 'use_snp_selection': True, 'num_snps': 38686}. Best is trial 21 with value: 0.3038298765701165.
[I 2025-12-08 21:06:53,421] Trial 22 finished with value: 0.278352302496375 and parameters: {'model_type': 'graphsage', 'hidden_dims': '[256, 128, 64]', 'dropout': 0.5033659919290278, 'batch_norm': False, 'sage_aggr': 'mean', 'sage_normalize': False, 'sage_project': False, 'lr': 0.00022490798996873721, 'weight_decay': 1.5845702594564056e-05, 'epochs': 43, 'loss': 'mse', 'optimizer': 'adam', 'graph_mode': 'cutoff', 'cutoff': 0.6023295160786329, 'grm_norm': 'cosine', 'self_loops': True, 'use_snp_selection': True, 'num_snps': 31031}. Best is trial 21 with value: 0.3038298765701165.
[I 2025-12-08 21:07:52,550] Trial 23 finished with value: 0.2987308650868874 and parameters: {'model_type': 'graphsage', 'hidden_dims': '[512, 128]', 'dropout': 0.3860899406757413, 'batch_norm': False, 'sage_aggr': 'mean', 'sage_normalize': False, 'sage_project': False, 'lr': 8.853804936329736e-05, 'weight_decay': 2.586868496607508e-05, 'epochs': 134, 'loss': 'mse', 'optimizer': 'adam', 'graph_mode': 'cutoff', 'cutoff': 0.6335689060790254, 'grm_norm': 'cosine', 'self_loops': True, 'use_snp_selection': True, 'num_snps': 39274}. Best is trial 21 with value: 0.3038298765701165.
[I 2025-12-08 21:09:16,387] Trial 24 finished with value: 0.29404093462383746 and parameters: {'model_type': 'graphsage', 'hidden_dims': '[512, 128]', 'dropout': 0.3885518341039618, 'batch_norm': False, 'sage_aggr': 'mean', 'sage_normalize': False, 'sage_project': False, 'lr': 7.088273573315367e-05, 'weight_decay': 3.401550258374574e-05, 'epochs': 159, 'loss': 'mse', 'optimizer': 'adam', 'graph_mode': 'cutoff', 'cutoff': 0.5897936889597828, 'grm_norm': 'cosine', 'self_loops': True, 'use_snp_selection': True, 'num_snps': 47001}. Best is trial 21 with value: 0.3038298765701165.
[I 2025-12-08 21:10:01,362] Trial 25 finished with value: 0.2941448686685261 and parameters: {'model_type': 'graphsage', 'hidden_dims': '[512, 128]', 'dropout': 0.510952685698527, 'batch_norm': False, 'sage_aggr': 'mean', 'sage_normalize': False, 'sage_project': False, 'lr': 3.201804509244546e-05, 'weight_decay': 1.6615591730492077e-06, 'epochs': 138, 'loss': 'mse', 'optimizer': 'adam', 'graph_mode': 'cutoff', 'cutoff': 0.7535597264367275, 'grm_norm': 'cosine', 'self_loops': True, 'use_snp_selection': True, 'num_snps': 28367}. Best is trial 21 with value: 0.3038298765701165.
[I 2025-12-08 21:11:54,068] Trial 26 finished with value: 0.2571605673052922 and parameters: {'model_type': 'graphsage', 'hidden_dims': '[512, 128]', 'dropout': 0.3709839603566887, 'batch_norm': False, 'sage_aggr': 'mean', 'sage_normalize': True, 'sage_project': False, 'lr': 9.291541120866464e-05, 'weight_decay': 7.325875790443668e-06, 'epochs': 203, 'loss': 'mse', 'optimizer': 'adam', 'graph_mode': 'cutoff', 'cutoff': 0.5352276914405364, 'grm_norm': 'cosine', 'self_loops': False, 'use_snp_selection': False}. Best is trial 21 with value: 0.3038298765701165.
[I 2025-12-08 21:12:41,109] Trial 27 finished with value: 0.23811293538719802 and parameters: {'model_type': 'graphsage', 'hidden_dims': '[512, 128]', 'dropout': 0.5632780680961539, 'batch_norm': False, 'sage_aggr': 'mean', 'sage_normalize': False, 'sage_project': False, 'lr': 0.00027506286653497167, 'weight_decay': 0.0001070155065049086, 'epochs': 85, 'loss': 'mse', 'optimizer': 'adam', 'graph_mode': 'cutoff', 'cutoff': 0.8100643884641932, 'grm_norm': 'cosine_then_gcn', 'self_loops': True, 'use_snp_selection': True, 'num_snps': 43128}. Best is trial 21 with value: 0.3038298765701165.
[I 2025-12-08 21:13:29,776] Trial 28 finished with value: 0.016234261076068995 and parameters: {'model_type': 'graphsage', 'hidden_dims': '[512, 256]', 'dropout': 0.4795356876093086, 'batch_norm': False, 'sage_aggr': 'mean', 'sage_normalize': False, 'sage_project': False, 'lr': 0.0037763287684630005, 'weight_decay': 2.608309182159131e-05, 'epochs': 130, 'loss': 'mse', 'optimizer': 'adam', 'graph_mode': 'cutoff', 'cutoff': 0.6392629020204765, 'grm_norm': 'gcn', 'self_loops': True, 'use_snp_selection': True, 'num_snps': 31786}. Best is trial 21 with value: 0.3038298765701165.
[I 2025-12-08 21:14:25,162] Trial 29 finished with value: 0.2505886164744783 and parameters: {'model_type': 'graphsage', 'hidden_dims': '[128, 64]', 'dropout': 0.4327506156082369, 'batch_norm': True, 'sage_aggr': 'mean', 'sage_normalize': True, 'sage_project': False, 'lr': 0.0003009168048740307, 'weight_decay': 2.473209940888773e-07, 'epochs': 198, 'loss': 'mse', 'optimizer': 'adam', 'graph_mode': 'cutoff', 'cutoff': 0.46328576871512633, 'grm_norm': 'cosine', 'self_loops': True, 'use_snp_selection': False}. Best is trial 21 with value: 0.3038298765701165.
[I 2025-12-08 21:15:04,931] Trial 30 finished with value: 0.1769059963368595 and parameters: {'model_type': 'graphsage', 'hidden_dims': '[512, 64]', 'dropout': 0.36966607707408916, 'batch_norm': False, 'sage_aggr': 'mean', 'sage_normalize': False, 'sage_project': False, 'lr': 0.0006720673103663843, 'weight_decay': 3.848759486541372e-06, 'epochs': 167, 'loss': 'mse', 'optimizer': 'adam', 'graph_mode': 'cutoff', 'cutoff': 0.5689561016586284, 'grm_norm': 'cosine', 'self_loops': True, 'use_snp_selection': True, 'num_snps': 20191}. Best is trial 21 with value: 0.3038298765701165.
[I 2025-12-08 21:15:30,180] Trial 31 finished with value: 0.29778588370600423 and parameters: {'model_type': 'graphsage', 'hidden_dims': '[128, 64]', 'dropout': 0.44830694661700793, 'batch_norm': False, 'sage_aggr': 'mean', 'sage_normalize': False, 'sage_project': False, 'lr': 0.00012414773211943963, 'weight_decay': 9.121270157739517e-06, 'epochs': 98, 'loss': 'mse', 'optimizer': 'adam', 'graph_mode': 'cutoff', 'cutoff': 0.6941773039857753, 'grm_norm': 'cosine', 'self_loops': True, 'use_snp_selection': True, 'num_snps': 37735}. Best is trial 21 with value: 0.3038298765701165.
[I 2025-12-08 21:15:55,392] Trial 32 finished with value: 0.2928363727216647 and parameters: {'model_type': 'graphsage', 'hidden_dims': '[128, 64]', 'dropout': 0.5019164771167983, 'batch_norm': False, 'sage_aggr': 'mean', 'sage_normalize': False, 'sage_project': False, 'lr': 9.779064680884468e-05, 'weight_decay': 7.271745505369076e-06, 'epochs': 95, 'loss': 'mse', 'optimizer': 'adam', 'graph_mode': 'cutoff', 'cutoff': 0.6532891132140316, 'grm_norm': 'cosine', 'self_loops': True, 'use_snp_selection': True, 'num_snps': 38101}. Best is trial 21 with value: 0.3038298765701165.
[I 2025-12-08 21:16:15,734] Trial 33 finished with value: 0.2844047362989974 and parameters: {'model_type': 'graphsage', 'hidden_dims': '[128, 64]', 'dropout': 0.31791738454611834, 'batch_norm': False, 'sage_aggr': 'mean', 'sage_normalize': False, 'sage_project': False, 'lr': 4.5026666287774e-05, 'weight_decay': 5.2572055690007826e-05, 'epochs': 63, 'loss': 'mse', 'optimizer': 'adam', 'graph_mode': 'cutoff', 'cutoff': 0.7051381760952852, 'grm_norm': 'cosine', 'self_loops': True, 'use_snp_selection': True, 'num_snps': 34797}. Best is trial 21 with value: 0.3038298765701165.
[I 2025-12-08 21:17:26,014] Trial 34 finished with value: 0.2519390876654757 and parameters: {'model_type': 'graphsage', 'hidden_dims': '[512, 128]', 'dropout': 0.4170004184202872, 'batch_norm': False, 'sage_aggr': 'max', 'sage_normalize': False, 'sage_project': False, 'lr': 0.00020501182718494443, 'weight_decay': 2.2793952903796702e-05, 'epochs': 136, 'loss': 'mse', 'optimizer': 'adam', 'graph_mode': 'cutoff', 'cutoff': 0.6307478444059818, 'grm_norm': 'cosine', 'self_loops': True, 'use_snp_selection': True, 'num_snps': 45673}. Best is trial 21 with value: 0.3038298765701165.
[I 2025-12-08 21:19:22,357] Trial 35 finished with value: 0.17265774954341934 and parameters: {'model_type': 'graphsage', 'hidden_dims': '[128, 64]', 'dropout': 0.4599973067135542, 'batch_norm': False, 'sage_aggr': 'max', 'sage_normalize': False, 'sage_project': False, 'lr': 0.0001070875758588115, 'weight_decay': 8.200757876020036e-06, 'epochs': 147, 'loss': 'mse', 'optimizer': 'adam', 'graph_mode': 'knn', 'knn_k': 4, 'weighted_edges': True, 'symmetrize_mode': 'union', 'self_loops': True, 'use_snp_selection': True, 'num_snps': 51286}. Best is trial 21 with value: 0.3038298765701165.
[I 2025-12-08 21:19:44,706] Trial 36 finished with value: 0.28403805614716326 and parameters: {'model_type': 'graphsage', 'hidden_dims': '[128, 64]', 'dropout': 0.3794546074489725, 'batch_norm': True, 'sage_aggr': 'mean', 'sage_normalize': False, 'sage_project': False, 'lr': 2.3438599626528364e-05, 'weight_decay': 0.00014611337104255087, 'epochs': 61, 'loss': 'mse', 'optimizer': 'adam', 'graph_mode': 'cutoff', 'cutoff': 0.8076899993088958, 'grm_norm': 'cosine', 'self_loops': False, 'use_snp_selection': True, 'num_snps': 40398}. Best is trial 21 with value: 0.3038298765701165.
[I 2025-12-08 21:21:03,075] Trial 37 finished with value: 0.04790133900668477 and parameters: {'model_type': 'graphsage', 'hidden_dims': '[256, 128]', 'dropout': 0.5518048224575903, 'batch_norm': False, 'sage_aggr': 'mean', 'sage_normalize': False, 'sage_project': False, 'lr': 0.00041018360799303645, 'weight_decay': 4.413156089727367e-05, 'epochs': 257, 'loss': 'mse', 'optimizer': 'adam', 'graph_mode': 'cutoff', 'cutoff': 0.5412485766833108, 'grm_norm': 'cosine', 'self_loops': True, 'use_snp_selection': False}. Best is trial 21 with value: 0.3038298765701165.
[I 2025-12-08 21:22:54,570] Trial 38 finished with value: 0.2378680368857787 and parameters: {'model_type': 'graphsage', 'hidden_dims': '[512, 256]', 'dropout': 0.33863034370877, 'batch_norm': True, 'sage_aggr': 'max', 'sage_normalize': True, 'sage_project': False, 'lr': 6.34067510468038e-05, 'weight_decay': 5.583398318011065e-06, 'epochs': 103, 'loss': 'mae', 'optimizer': 'adam', 'graph_mode': 'knn', 'knn_k': 4, 'weighted_edges': True, 'symmetrize_mode': 'union', 'self_loops': False, 'use_snp_selection': True, 'num_snps': 52506}. Best is trial 21 with value: 0.3038298765701165.
[I 2025-12-08 21:24:23,407] Trial 39 finished with value: 0.2959971966017735 and parameters: {'model_type': 'graphsage', 'hidden_dims': '[512, 128]', 'dropout': 0.2279697196118436, 'batch_norm': False, 'sage_aggr': 'mean', 'sage_normalize': False, 'sage_project': False, 'lr': 7.783993267171857e-05, 'weight_decay': 1.6069164064870099e-06, 'epochs': 170, 'loss': 'mse', 'optimizer': 'adam', 'graph_mode': 'cutoff', 'cutoff': 0.4707020223944103, 'grm_norm': 'gcn', 'self_loops': True, 'use_snp_selection': True, 'num_snps': 36899}. Best is trial 21 with value: 0.3038298765701165.
[I 2025-12-08 21:26:47,919] Trial 40 finished with value: 0.277625004233977 and parameters: {'model_type': 'graphsage', 'hidden_dims': '[512, 64]', 'dropout': 0.28136907103590564, 'batch_norm': True, 'sage_aggr': 'mean', 'sage_normalize': False, 'sage_project': False, 'lr': 3.36404998326834e-05, 'weight_decay': 9.269041697583588e-06, 'epochs': 123, 'loss': 'mae', 'optimizer': 'adam', 'graph_mode': 'knn', 'knn_k': 10, 'weighted_edges': False, 'symmetrize_mode': 'union', 'self_loops': True, 'use_snp_selection': False}. Best is trial 21 with value: 0.3038298765701165.
[I 2025-12-08 21:27:21,203] Trial 41 finished with value: 0.3018294010898293 and parameters: {'model_type': 'graphsage', 'hidden_dims': '[256, 128, 64]', 'dropout': 0.44500983865878385, 'batch_norm': False, 'sage_aggr': 'mean', 'sage_normalize': False, 'sage_project': False, 'lr': 0.00013597452300554875, 'weight_decay': 1.8567037978807755e-05, 'epochs': 94, 'loss': 'mse', 'optimizer': 'adam', 'graph_mode': 'cutoff', 'cutoff': 0.6937910483216266, 'grm_norm': 'cosine', 'self_loops': True, 'use_snp_selection': True, 'num_snps': 38711}. Best is trial 21 with value: 0.3038298765701165.
