[I 2025-12-10 03:13:58,939] Trial 67 finished with value: 0.36147519163098707 and parameters: {'model_type': 'graphsage', 'hidden_dims': '[512, 256]', 'dropout': 0.1393989777711951, 'batch_norm': False, 'sage_aggr': 'mean', 'sage_normalize': False, 'sage_project': False, 'lr': 1.5559037255565367e-05, 'weight_decay': 1.9539271841236905e-06, 'epochs': 113, 'loss': 'mae', 'optimizer': 'adam', 'graph_mode': 'cutoff', 'cutoff': 0.23346835195637147, 'grm_norm': 'none', 'self_loops': False, 'use_snp_selection': False}. Best is trial 61 with value: 0.37066613095512746.
[I 2025-12-10 03:16:34,607] Trial 68 finished with value: 0.36346033234238884 and parameters: {'model_type': 'graphsage', 'hidden_dims': '[512, 256]', 'dropout': 0.13415567077428028, 'batch_norm': False, 'sage_aggr': 'mean', 'sage_normalize': False, 'sage_project': False, 'lr': 2.8879181859441432e-05, 'weight_decay': 1.370712518196898e-06, 'epochs': 142, 'loss': 'mae', 'optimizer': 'adam', 'graph_mode': 'cutoff', 'cutoff': 0.23093982796691936, 'grm_norm': 'none', 'self_loops': False, 'use_snp_selection': True, 'num_snps': 36141}. Best is trial 61 with value: 0.37066613095512746.
[I 2025-12-10 03:18:10,259] Trial 69 finished with value: 0.3609556132082788 and parameters: {'model_type': 'graphsage', 'hidden_dims': '[512, 256]', 'dropout': 0.1507612378686777, 'batch_norm': False, 'sage_aggr': 'mean', 'sage_normalize': False, 'sage_project': False, 'lr': 1.862656348498193e-05, 'weight_decay': 4.08646294597775e-06, 'epochs': 85, 'loss': 'mae', 'optimizer': 'adam', 'graph_mode': 'cutoff', 'cutoff': 0.21023837972103693, 'grm_norm': 'none', 'self_loops': False, 'use_snp_selection': True, 'num_snps': 31885}. Best is trial 61 with value: 0.37066613095512746.
[I 2025-12-10 03:19:04,133] Trial 70 finished with value: 0.36218765142824455 and parameters: {'model_type': 'graphsage', 'hidden_dims': '[512, 256]', 'dropout': 0.10693510290903246, 'batch_norm': False, 'sage_aggr': 'mean', 'sage_normalize': False, 'sage_project': False, 'lr': 3.3239909311179425e-05, 'weight_decay': 5.733640181364093e-06, 'epochs': 137, 'loss': 'mae', 'optimizer': 'adam', 'graph_mode': 'cutoff', 'cutoff': 0.833921602187012, 'grm_norm': 'none', 'self_loops': False, 'use_snp_selection': True, 'num_snps': 35290}. Best is trial 61 with value: 0.37066613095512746.
[I 2025-12-10 03:21:26,218] Trial 71 finished with value: 0.3693616248149055 and parameters: {'model_type': 'graphsage', 'hidden_dims': '[512, 256]', 'dropout': 0.13391129920145653, 'batch_norm': False, 'sage_aggr': 'mean', 'sage_normalize': False, 'sage_project': False, 'lr': 1.934826968978156e-05, 'weight_decay': 1.4551323597341434e-06, 'epochs': 116, 'loss': 'mae', 'optimizer': 'adam', 'graph_mode': 'cutoff', 'cutoff': 0.24800992569683528, 'grm_norm': 'none', 'self_loops': False, 'use_snp_selection': True, 'num_snps': 42194}. Best is trial 61 with value: 0.37066613095512746.
[I 2025-12-10 03:23:58,480] Trial 72 finished with value: 0.36532251569283397 and parameters: {'model_type': 'graphsage', 'hidden_dims': '[512, 256]', 'dropout': 0.16724640151006515, 'batch_norm': False, 'sage_aggr': 'mean', 'sage_normalize': False, 'sage_project': False, 'lr': 1.140915192915583e-05, 'weight_decay': 1.4374695085722346e-06, 'epochs': 114, 'loss': 'mae', 'optimizer': 'adam', 'graph_mode': 'cutoff', 'cutoff': 0.2463665280289184, 'grm_norm': 'none', 'self_loops': False, 'use_snp_selection': True, 'num_snps': 45102}. Best is trial 61 with value: 0.37066613095512746.
[I 2025-12-10 03:25:21,956] Trial 73 finished with value: 0.35461998314784454 and parameters: {'model_type': 'graphsage', 'hidden_dims': '[512, 256]', 'dropout': 0.12662782709796228, 'batch_norm': False, 'sage_aggr': 'mean', 'sage_normalize': False, 'sage_project': False, 'lr': 1.3941431061179001e-05, 'weight_decay': 4.5655529118046537e-07, 'epochs': 64, 'loss': 'mae', 'optimizer': 'adam', 'graph_mode': 'cutoff', 'cutoff': 0.23830762752150694, 'grm_norm': 'cosine_then_gcn', 'self_loops': False, 'use_snp_selection': True, 'num_snps': 41657}. Best is trial 61 with value: 0.37066613095512746.
[I 2025-12-10 03:26:16,963] Trial 74 finished with value: 0.36997547130924413 and parameters: {'model_type': 'graphsage', 'hidden_dims': '[512, 256]', 'dropout': 0.1983086994524652, 'batch_norm': False, 'sage_aggr': 'mean', 'sage_normalize': False, 'sage_project': False, 'lr': 2.0063800334227426e-05, 'weight_decay': 2.120387889606004e-06, 'epochs': 96, 'loss': 'mae', 'optimizer': 'adam', 'graph_mode': 'cutoff', 'cutoff': 0.38527479166636724, 'grm_norm': 'none', 'self_loops': False, 'use_snp_selection': True, 'num_snps': 31879}. Best is trial 61 with value: 0.37066613095512746.
[I 2025-12-10 03:27:08,551] Trial 75 finished with value: 0.3649063477839391 and parameters: {'model_type': 'graphsage', 'hidden_dims': '[512, 256]', 'dropout': 0.19995850941173177, 'batch_norm': False, 'sage_aggr': 'mean', 'sage_normalize': False, 'sage_project': False, 'lr': 6.825286381495546e-05, 'weight_decay': 1.978914397349045e-06, 'epochs': 94, 'loss': 'mae', 'optimizer': 'adam', 'graph_mode': 'cutoff', 'cutoff': 0.3456100149825926, 'grm_norm': 'cosine', 'self_loops': False, 'use_snp_selection': True, 'num_snps': 30117}. Best is trial 61 with value: 0.37066613095512746.
[I 2025-12-10 03:27:50,175] Trial 76 finished with value: 0.372289751334577 and parameters: {'model_type': 'graphsage', 'hidden_dims': '[128, 64]', 'dropout': 0.15024202896036756, 'batch_norm': False, 'sage_aggr': 'mean', 'sage_normalize': False, 'sage_project': False, 'lr': 2.8864317370887363e-05, 'weight_decay': 1.611907825032977e-06, 'epochs': 104, 'loss': 'mae', 'optimizer': 'adam', 'graph_mode': 'cutoff', 'cutoff': 0.39796371422001187, 'grm_norm': 'none', 'self_loops': False, 'use_snp_selection': True, 'num_snps': 37006}. Best is trial 76 with value: 0.372289751334577.
[I 2025-12-10 03:28:35,702] Trial 77 finished with value: 0.3707971406588081 and parameters: {'model_type': 'graphsage', 'hidden_dims': '[128, 64]', 'dropout': 0.1507410816516721, 'batch_norm': False, 'sage_aggr': 'mean', 'sage_normalize': False, 'sage_project': False, 'lr': 3.720213619829163e-05, 'weight_decay': 5.207389812834248e-07, 'epochs': 102, 'loss': 'mae', 'optimizer': 'adam', 'graph_mode': 'cutoff', 'cutoff': 0.39816454492812586, 'grm_norm': 'none', 'self_loops': False, 'use_snp_selection': True, 'num_snps': 37382}. Best is trial 76 with value: 0.372289751334577.
[I 2025-12-10 03:29:23,144] Trial 78 finished with value: 0.36179536385541483 and parameters: {'model_type': 'graphsage', 'hidden_dims': '[128, 64]', 'dropout': 0.1516164111950634, 'batch_norm': False, 'sage_aggr': 'mean', 'sage_normalize': False, 'sage_project': False, 'lr': 3.7286190445143015e-05, 'weight_decay': 4.383482183206408e-07, 'epochs': 75, 'loss': 'mae', 'optimizer': 'adam', 'graph_mode': 'cutoff', 'cutoff': 0.3876392476361396, 'grm_norm': 'none', 'self_loops': False, 'use_snp_selection': True, 'num_snps': 45501}. Best is trial 76 with value: 0.372289751334577.
[I 2025-12-10 03:29:55,561] Trial 79 finished with value: 0.35860166687673106 and parameters: {'model_type': 'graphsage', 'hidden_dims': '[128, 64]', 'dropout': 0.1724903681190182, 'batch_norm': False, 'sage_aggr': 'mean', 'sage_normalize': False, 'sage_project': False, 'lr': 2.927063564747757e-05, 'weight_decay': 1.2181785266077213e-07, 'epochs': 103, 'loss': 'mae', 'optimizer': 'adam', 'graph_mode': 'cutoff', 'cutoff': 0.4044909296655323, 'grm_norm': 'none', 'self_loops': False, 'use_snp_selection': False}. Best is trial 76 with value: 0.372289751334577.
[I 2025-12-10 03:30:40,055] Trial 80 finished with value: 0.3657470823645764 and parameters: {'model_type': 'graphsage', 'hidden_dims': '[128, 64]', 'dropout': 0.15790257089146606, 'batch_norm': False, 'sage_aggr': 'mean', 'sage_normalize': False, 'sage_project': False, 'lr': 2.7473239423657555e-05, 'weight_decay': 1.095840548043398e-06, 'epochs': 91, 'loss': 'mae', 'optimizer': 'adam', 'graph_mode': 'cutoff', 'cutoff': 0.37101101503470807, 'grm_norm': 'none', 'self_loops': False, 'use_snp_selection': True, 'num_snps': 37263}. Best is trial 76 with value: 0.372289751334577.
[I 2025-12-10 03:31:44,456] Trial 81 finished with value: 0.3726085055474445 and parameters: {'model_type': 'graphsage', 'hidden_dims': '[128, 64]', 'dropout': 0.10048332380905659, 'batch_norm': False, 'sage_aggr': 'mean', 'sage_normalize': False, 'sage_project': False, 'lr': 1.9596417859335438e-05, 'weight_decay': 1.906433911128157e-07, 'epochs': 146, 'loss': 'mae', 'optimizer': 'adam', 'graph_mode': 'cutoff', 'cutoff': 0.3320147848434208, 'grm_norm': 'none', 'self_loops': False, 'use_snp_selection': True, 'num_snps': 34963}. Best is trial 81 with value: 0.3726085055474445.
[I 2025-12-10 03:33:15,960] Trial 82 finished with value: 0.36847110651280357 and parameters: {'model_type': 'graphsage', 'hidden_dims': '[128, 64]', 'dropout': 0.11593921322860892, 'batch_norm': False, 'sage_aggr': 'mean', 'sage_normalize': False, 'sage_project': False, 'lr': 1.9567485515136315e-05, 'weight_decay': 6.210720743481273e-07, 'epochs': 173, 'loss': 'mae', 'optimizer': 'adam', 'graph_mode': 'cutoff', 'cutoff': 0.3361379677521544, 'grm_norm': 'none', 'self_loops': False, 'use_snp_selection': True, 'num_snps': 40738}. Best is trial 81 with value: 0.3726085055474445.
[I 2025-12-10 03:34:31,250] Trial 83 finished with value: 0.3658888211891568 and parameters: {'model_type': 'graphsage', 'hidden_dims': '[128, 64]', 'dropout': 0.11380914641973199, 'batch_norm': False, 'sage_aggr': 'mean', 'sage_normalize': False, 'sage_project': False, 'lr': 2.2075867722703418e-05, 'weight_decay': 2.1545134966603043e-07, 'epochs': 153, 'loss': 'mae', 'optimizer': 'adam', 'graph_mode': 'cutoff', 'cutoff': 0.3420732379164318, 'grm_norm': 'none', 'self_loops': False, 'use_snp_selection': True, 'num_snps': 41111}. Best is trial 81 with value: 0.3726085055474445.
[I 2025-12-10 03:35:30,546] Trial 84 finished with value: 0.36536889982462284 and parameters: {'model_type': 'graphsage', 'hidden_dims': '[128, 64]', 'dropout': 0.10227346612181322, 'batch_norm': False, 'sage_aggr': 'mean', 'sage_normalize': False, 'sage_project': False, 'lr': 1.9180885380554546e-05, 'weight_decay': 4.877326720819903e-07, 'epochs': 174, 'loss': 'mae', 'optimizer': 'adam', 'graph_mode': 'cutoff', 'cutoff': 0.4241044177033488, 'grm_norm': 'none', 'self_loops': False, 'use_snp_selection': True, 'num_snps': 35294}. Best is trial 81 with value: 0.3726085055474445.
[I 2025-12-10 03:36:44,812] Trial 85 finished with value: 0.36497606697610924 and parameters: {'model_type': 'graphsage', 'hidden_dims': '[128, 64]', 'dropout': 0.14464255241212295, 'batch_norm': False, 'sage_aggr': 'mean', 'sage_normalize': False, 'sage_project': False, 'lr': 1.6180555373485493e-05, 'weight_decay': 1.756203198501372e-07, 'epochs': 131, 'loss': 'mae', 'optimizer': 'adam', 'graph_mode': 'cutoff', 'cutoff': 0.3811849578486091, 'grm_norm': 'none', 'self_loops': False, 'use_snp_selection': True, 'num_snps': 47257}. Best is trial 81 with value: 0.3726085055474445.
[I 2025-12-10 03:37:45,704] Trial 86 finished with value: 0.363435045287532 and parameters: {'model_type': 'graphsage', 'hidden_dims': '[128, 64]', 'dropout': 0.1970633448171184, 'batch_norm': False, 'sage_aggr': 'mean', 'sage_normalize': False, 'sage_project': False, 'lr': 1.8151859959932142e-05, 'weight_decay': 6.551826864764184e-07, 'epochs': 145, 'loss': 'mae', 'optimizer': 'adam', 'graph_mode': 'cutoff', 'cutoff': 0.3353319407627333, 'grm_norm': 'cosine_then_gcn', 'self_loops': False, 'use_snp_selection': True, 'num_snps': 36782}. Best is trial 81 with value: 0.3726085055474445.
[I 2025-12-10 03:38:38,191] Trial 87 finished with value: 0.36567032345245654 and parameters: {'model_type': 'graphsage', 'hidden_dims': '[128, 64]', 'dropout': 0.11964385039234868, 'batch_norm': False, 'sage_aggr': 'mean', 'sage_normalize': False, 'sage_project': False, 'lr': 2.476873246238203e-05, 'weight_decay': 2.544959718836008e-06, 'epochs': 164, 'loss': 'mae', 'optimizer': 'adam', 'graph_mode': 'cutoff', 'cutoff': 0.35952448954700045, 'grm_norm': 'cosine', 'self_loops': False, 'use_snp_selection': True, 'num_snps': 34406}. Best is trial 81 with value: 0.3726085055474445.
[I 2025-12-10 03:40:07,737] Trial 88 finished with value: 0.3628767952853043 and parameters: {'model_type': 'graphsage', 'hidden_dims': '[128, 64]', 'dropout': 0.10035886593961024, 'batch_norm': False, 'sage_aggr': 'mean', 'sage_normalize': False, 'sage_project': False, 'lr': 3.2527728567576985e-05, 'weight_decay': 3.3925791464748166e-07, 'epochs': 157, 'loss': 'mae', 'optimizer': 'adam', 'graph_mode': 'cutoff', 'cutoff': 0.3199770276061779, 'grm_norm': 'none', 'self_loops': False, 'use_snp_selection': True, 'num_snps': 40528}. Best is trial 81 with value: 0.3726085055474445.
[I 2025-12-10 03:40:57,536] Trial 89 finished with value: 0.3575722278810044 and parameters: {'model_type': 'graphsage', 'hidden_dims': '[128, 64]', 'dropout': 0.5922024503583095, 'batch_norm': False, 'sage_aggr': 'mean', 'sage_normalize': False, 'sage_project': False, 'lr': 1.962719413903767e-05, 'weight_decay': 6.004981168422914e-07, 'epochs': 102, 'loss': 'mae', 'optimizer': 'adam', 'graph_mode': 'cutoff', 'cutoff': 0.46542828425481697, 'grm_norm': 'none', 'self_loops': False, 'use_snp_selection': True, 'num_snps': 43379}. Best is trial 81 with value: 0.3726085055474445.
[I 2025-12-10 03:41:40,116] Trial 90 finished with value: 0.3706299391008618 and parameters: {'model_type': 'graphsage', 'hidden_dims': '[128, 64]', 'dropout': 0.14634112651759928, 'batch_norm': False, 'sage_aggr': 'mean', 'sage_normalize': False, 'sage_project': False, 'lr': 3.9284843140200986e-05, 'weight_decay': 1.0709404742118894e-06, 'epochs': 135, 'loss': 'mae', 'optimizer': 'adam', 'graph_mode': 'cutoff', 'cutoff': 0.4183212919323763, 'grm_norm': 'none', 'self_loops': False, 'use_snp_selection': True, 'num_snps': 30818}. Best is trial 81 with value: 0.3726085055474445.
[I 2025-12-10 03:42:13,202] Trial 91 finished with value: 0.3736181645924715 and parameters: {'model_type': 'graphsage', 'hidden_dims': '[128, 64]', 'dropout': 0.14383692230279843, 'batch_norm': False, 'sage_aggr': 'mean', 'sage_normalize': False, 'sage_project': False, 'lr': 5.884131482417387e-05, 'weight_decay': 1.1486866178629722e-06, 'epochs': 95, 'loss': 'mae', 'optimizer': 'adam', 'graph_mode': 'cutoff', 'cutoff': 0.42429494359052516, 'grm_norm': 'none', 'self_loops': False, 'use_snp_selection': True, 'num_snps': 30789}. Best is trial 91 with value: 0.3736181645924715.
[I 2025-12-10 03:42:55,041] Trial 92 finished with value: 0.37235361688533836 and parameters: {'model_type': 'graphsage', 'hidden_dims': '[128, 64]', 'dropout': 0.17825594353128849, 'batch_norm': False, 'sage_aggr': 'mean', 'sage_normalize': False, 'sage_project': False, 'lr': 3.988581724767769e-05, 'weight_decay': 9.282273377017234e-07, 'epochs': 135, 'loss': 'mae', 'optimizer': 'adam', 'graph_mode': 'cutoff', 'cutoff': 0.4058838807139407, 'grm_norm': 'none', 'self_loops': False, 'use_snp_selection': True, 'num_snps': 30755}. Best is trial 91 with value: 0.3736181645924715.
[I 2025-12-10 03:43:30,128] Trial 93 finished with value: 0.3677664577915981 and parameters: {'model_type': 'graphsage', 'hidden_dims': '[128, 64]', 'dropout': 0.176591337720147, 'batch_norm': False, 'sage_aggr': 'mean', 'sage_normalize': False, 'sage_project': False, 'lr': 5.874132658475541e-05, 'weight_decay': 1.0369031040711196e-06, 'epochs': 94, 'loss': 'mae', 'optimizer': 'adam', 'graph_mode': 'cutoff', 'cutoff': 0.38916319108883723, 'grm_norm': 'none', 'self_loops': False, 'use_snp_selection': True, 'num_snps': 30582}. Best is trial 91 with value: 0.3736181645924715.
[I 2025-12-10 03:44:02,726] Trial 94 finished with value: 0.36510257615116526 and parameters: {'model_type': 'graphsage', 'hidden_dims': '[128, 64]', 'dropout': 0.16191123447599326, 'batch_norm': False, 'sage_aggr': 'mean', 'sage_normalize': False, 'sage_project': False, 'lr': 7.805265379231234e-05, 'weight_decay': 1.7519396754969728e-06, 'epochs': 139, 'loss': 'mae', 'optimizer': 'adam', 'graph_mode': 'cutoff', 'cutoff': 0.4165740281295054, 'grm_norm': 'none', 'self_loops': False, 'use_snp_selection': True, 'num_snps': 25487}. Best is trial 91 with value: 0.3736181645924715.
[I 2025-12-10 03:44:33,364] Trial 95 finished with value: 0.36324344112602897 and parameters: {'model_type': 'graphsage', 'hidden_dims': '[128, 64]', 'dropout': 0.18901461292678085, 'batch_norm': False, 'sage_aggr': 'mean', 'sage_normalize': False, 'sage_project': False, 'lr': 4.420657160454353e-05, 'weight_decay': 1.155482817707476e-06, 'epochs': 134, 'loss': 'mae', 'optimizer': 'adam', 'graph_mode': 'cutoff', 'cutoff': 0.5084904662281278, 'grm_norm': 'none', 'self_loops': False, 'use_snp_selection': True, 'num_snps': 28714}. Best is trial 91 with value: 0.3736181645924715.
[I 2025-12-10 03:45:11,113] Trial 96 finished with value: 0.3646456301037543 and parameters: {'model_type': 'graphsage', 'hidden_dims': '[256, 128, 64]', 'dropout': 0.1474916409874411, 'batch_norm': False, 'sage_aggr': 'mean', 'sage_normalize': False, 'sage_project': False, 'lr': 3.774695883584588e-05, 'weight_decay': 2.4539449346368825e-06, 'epochs': 82, 'loss': 'mae', 'optimizer': 'adam', 'graph_mode': 'cutoff', 'cutoff': 0.43867292979736305, 'grm_norm': 'none', 'self_loops': False, 'use_snp_selection': True, 'num_snps': 34611}. Best is trial 91 with value: 0.3736181645924715.
[I 2025-12-10 03:45:42,768] Trial 97 finished with value: 0.35323573798292196 and parameters: {'model_type': 'graphsage', 'hidden_dims': '[128, 64]', 'dropout': 0.2103814977793264, 'batch_norm': False, 'sage_aggr': 'mean', 'sage_normalize': False, 'sage_project': False, 'lr': 5.045955990396315e-05, 'weight_decay': 7.183560258653551e-07, 'epochs': 107, 'loss': 'mae', 'optimizer': 'adam', 'graph_mode': 'cutoff', 'cutoff': 0.4670805421304367, 'grm_norm': 'none', 'self_loops': False, 'use_snp_selection': False}. Best is trial 91 with value: 0.3736181645924715.
[I 2025-12-10 03:46:03,067] Trial 98 finished with value: 0.3657880064568997 and parameters: {'model_type': 'graphsage', 'hidden_dims': '[128, 64]', 'dropout': 0.1704956688458582, 'batch_norm': False, 'sage_aggr': 'mean', 'sage_normalize': False, 'sage_project': False, 'lr': 0.00011338337204648464, 'weight_decay': 1.5905295239525308e-06, 'epochs': 72, 'loss': 'mae', 'optimizer': 'adam', 'graph_mode': 'cutoff', 'cutoff': 0.4093108846247399, 'grm_norm': 'none', 'self_loops': False, 'use_snp_selection': True, 'num_snps': 22422}. Best is trial 91 with value: 0.3736181645924715.
[I 2025-12-10 03:46:28,830] Trial 99 finished with value: 0.35280163112905416 and parameters: {'model_type': 'graphsage', 'hidden_dims': '[128, 64]', 'dropout': 0.44148350025088356, 'batch_norm': False, 'sage_aggr': 'mean', 'sage_normalize': False, 'sage_project': False, 'lr': 2.9665373480857248e-05, 'weight_decay': 8.926710523140503e-07, 'epochs': 54, 'loss': 'mae', 'optimizer': 'adam', 'graph_mode': 'cutoff', 'cutoff': 0.3679091966551739, 'grm_norm': 'cosine_then_gcn', 'self_loops': False, 'use_snp_selection': True, 'num_snps': 30836}. Best is trial 91 with value: 0.3736181645924715.
[I 2025-12-10 03:47:07,444] Trial 100 finished with value: 0.37045563397913883 and parameters: {'model_type': 'graphsage', 'hidden_dims': '[128, 64]', 'dropout': 0.15788585234736918, 'batch_norm': False, 'sage_aggr': 'mean', 'sage_normalize': False, 'sage_project': False, 'lr': 3.8679249917298926e-05, 'weight_decay': 3.2940548705151683e-07, 'epochs': 130, 'loss': 'mae', 'optimizer': 'adam', 'graph_mode': 'cutoff', 'cutoff': 0.4337184592983021, 'grm_norm': 'none', 'self_loops': False, 'use_snp_selection': True, 'num_snps': 36856}. Best is trial 91 with value: 0.3736181645924715.
[I 2025-12-10 03:47:56,563] Trial 101 finished with value: 0.3700167360088277 and parameters: {'model_type': 'graphsage', 'hidden_dims': '[128, 64]', 'dropout': 0.15470116511461918, 'batch_norm': False, 'sage_aggr': 'mean', 'sage_normalize': False, 'sage_project': False, 'lr': 4.004285369051227e-05, 'weight_decay': 2.4766947334465626e-07, 'epochs': 130, 'loss': 'mae', 'optimizer': 'adam', 'graph_mode': 'cutoff', 'cutoff': 0.43127783625376614, 'grm_norm': 'none', 'self_loops': False, 'use_snp_selection': True, 'num_snps': 36909}. Best is trial 91 with value: 0.3736181645924715.
[I 2025-12-10 03:48:48,513] Trial 102 finished with value: 0.3693302081686784 and parameters: {'model_type': 'graphsage', 'hidden_dims': '[128, 64]', 'dropout': 0.15467713428778024, 'batch_norm': False, 'sage_aggr': 'mean', 'sage_normalize': False, 'sage_project': False, 'lr': 4.018972822166009e-05, 'weight_decay': 2.4834455051025826e-07, 'epochs': 130, 'loss': 'mae', 'optimizer': 'adam', 'graph_mode': 'cutoff', 'cutoff': 0.4327122803892827, 'grm_norm': 'none', 'self_loops': False, 'use_snp_selection': True, 'num_snps': 37346}. Best is trial 91 with value: 0.3736181645924715.
[I 2025-12-10 03:49:22,768] Trial 103 finished with value: 0.370153543974455 and parameters: {'model_type': 'graphsage', 'hidden_dims': '[128, 64]', 'dropout': 0.1446449369877108, 'batch_norm': False, 'sage_aggr': 'mean', 'sage_normalize': False, 'sage_project': False, 'lr': 5.6426776399830824e-05, 'weight_decay': 3.255415192481915e-07, 'epochs': 99, 'loss': 'mae', 'optimizer': 'adam', 'graph_mode': 'cutoff', 'cutoff': 0.4620801890309913, 'grm_norm': 'none', 'self_loops': False, 'use_snp_selection': True, 'num_snps': 31712}. Best is trial 91 with value: 0.3736181645924715.
