[I 2025-12-09 18:24:32,731] Trial 8 finished with value: 0.2389672366005151 and parameters: {'model_type': 'graphsage', 'hidden_dims': '[512, 256]', 'dropout': 0.3061380386767003, 'batch_norm': False, 'sage_aggr': 'mean', 'sage_normalize': True, 'sage_project': False, 'lr': 0.000698401460570184, 'weight_decay': 2.965560055460244e-06, 'epochs': 289, 'loss': 'mae', 'optimizer': 'adam', 'graph_mode': 'knn', 'knn_k': 7, 'weighted_edges': False, 'symmetrize_mode': 'mutual', 'self_loops': True, 'use_snp_selection': True, 'num_snps': 4710}. Best is trial 3 with value: 0.2843882828657205.
[I 2025-12-09 18:29:43,494] Trial 9 finished with value: 0.2914103832414464 and parameters: {'model_type': 'graphsage', 'hidden_dims': '[512, 128]', 'dropout': 0.1733844071393634, 'batch_norm': False, 'sage_aggr': 'mean', 'sage_normalize': True, 'sage_project': False, 'lr': 0.0004269677918501597, 'weight_decay': 2.2439779626249696e-06, 'epochs': 319, 'loss': 'mse', 'optimizer': 'adam', 'graph_mode': 'cutoff', 'cutoff': 0.24117565767129295, 'grm_norm': 'cosine_then_gcn', 'self_loops': True, 'use_snp_selection': False}. Best is trial 9 with value: 0.2914103832414464.
[I 2025-12-09 18:35:13,685] Trial 10 finished with value: 0.2864589356695817 and parameters: {'model_type': 'graphsage', 'hidden_dims': '[512, 128]', 'dropout': 0.5365714961141473, 'batch_norm': False, 'sage_aggr': 'mean', 'sage_normalize': True, 'sage_project': False, 'lr': 0.004737327072203749, 'weight_decay': 7.303103160282385e-07, 'epochs': 299, 'loss': 'mse', 'optimizer': 'adam', 'graph_mode': 'cutoff', 'cutoff': 0.21281628365523453, 'grm_norm': 'cosine_then_gcn', 'self_loops': True, 'use_snp_selection': False}. Best is trial 9 with value: 0.2914103832414464.
[I 2025-12-09 18:41:21,397] Trial 11 finished with value: 0.2846589658787918 and parameters: {'model_type': 'graphsage', 'hidden_dims': '[512, 128]', 'dropout': 0.5154800957818386, 'batch_norm': False, 'sage_aggr': 'mean', 'sage_normalize': True, 'sage_project': False, 'lr': 0.006674532614550016, 'weight_decay': 6.544345930867686e-07, 'epochs': 335, 'loss': 'mse', 'optimizer': 'adam', 'graph_mode': 'cutoff', 'cutoff': 0.21348952516572178, 'grm_norm': 'cosine_then_gcn', 'self_loops': True, 'use_snp_selection': False}. Best is trial 9 with value: 0.2914103832414464.
[I 2025-12-09 18:47:40,854] Trial 12 finished with value: 0.2695926258064596 and parameters: {'model_type': 'graphsage', 'hidden_dims': '[512, 128]', 'dropout': 0.49488375368548476, 'batch_norm': False, 'sage_aggr': 'mean', 'sage_normalize': True, 'sage_project': False, 'lr': 0.003802842966026102, 'weight_decay': 9.156985192829673e-07, 'epochs': 344, 'loss': 'mse', 'optimizer': 'adam', 'graph_mode': 'cutoff', 'cutoff': 0.21242241803866538, 'grm_norm': 'cosine_then_gcn', 'self_loops': True, 'use_snp_selection': False}. Best is trial 9 with value: 0.2914103832414464.
[I 2025-12-09 18:49:24,292] Trial 13 finished with value: 0.29976726043049917 and parameters: {'model_type': 'graphsage', 'hidden_dims': '[256, 128]', 'dropout': 0.42850806636201955, 'batch_norm': False, 'sage_aggr': 'mean', 'sage_normalize': True, 'sage_project': False, 'lr': 0.001630795915191733, 'weight_decay': 1.8431992240252396e-07, 'epochs': 256, 'loss': 'mse', 'optimizer': 'adam', 'graph_mode': 'cutoff', 'cutoff': 0.3805357334664356, 'grm_norm': 'cosine_then_gcn', 'self_loops': True, 'use_snp_selection': False}. Best is trial 13 with value: 0.29976726043049917.
[I 2025-12-09 18:50:56,749] Trial 14 finished with value: 0.29669902779381296 and parameters: {'model_type': 'graphsage', 'hidden_dims': '[256, 128]', 'dropout': 0.4599163501058063, 'batch_norm': False, 'sage_aggr': 'mean', 'sage_normalize': True, 'sage_project': False, 'lr': 0.0012695736149434058, 'weight_decay': 1.043726242663563e-07, 'epochs': 233, 'loss': 'mse', 'optimizer': 'adam', 'graph_mode': 'cutoff', 'cutoff': 0.41220157776779326, 'grm_norm': 'cosine', 'self_loops': True, 'use_snp_selection': False}. Best is trial 13 with value: 0.29976726043049917.
[I 2025-12-09 18:52:30,637] Trial 15 finished with value: 0.29696750610058237 and parameters: {'model_type': 'graphsage', 'hidden_dims': '[256, 128]', 'dropout': 0.4335332531358569, 'batch_norm': False, 'sage_aggr': 'mean', 'sage_normalize': True, 'sage_project': False, 'lr': 0.00154372256139604, 'weight_decay': 1.1309360523290365e-07, 'epochs': 240, 'loss': 'mse', 'optimizer': 'adam', 'graph_mode': 'cutoff', 'cutoff': 0.4354075990476878, 'grm_norm': 'cosine', 'self_loops': True, 'use_snp_selection': False}. Best is trial 13 with value: 0.29976726043049917.
[I 2025-12-09 18:54:06,658] Trial 16 finished with value: 0.30419973445131443 and parameters: {'model_type': 'graphsage', 'hidden_dims': '[256, 128]', 'dropout': 0.41678865567788825, 'batch_norm': False, 'sage_aggr': 'mean', 'sage_normalize': True, 'sage_project': False, 'lr': 0.001823681623625099, 'weight_decay': 2.5317525629715773e-07, 'epochs': 245, 'loss': 'mse', 'optimizer': 'adam', 'graph_mode': 'cutoff', 'cutoff': 0.4303030401684673, 'grm_norm': 'cosine', 'self_loops': True, 'use_snp_selection': False}. Best is trial 16 with value: 0.30419973445131443.
[I 2025-12-09 18:55:21,797] Trial 17 finished with value: 0.3013800520011304 and parameters: {'model_type': 'graphsage', 'hidden_dims': '[256, 128]', 'dropout': 0.5933361725388493, 'batch_norm': False, 'sage_aggr': 'mean', 'sage_normalize': True, 'sage_project': False, 'lr': 0.002414366007049477, 'weight_decay': 3.0344324683504875e-07, 'epochs': 259, 'loss': 'mse', 'optimizer': 'adam', 'graph_mode': 'cutoff', 'cutoff': 0.6349690136441454, 'grm_norm': 'cosine', 'self_loops': True, 'use_snp_selection': False}. Best is trial 16 with value: 0.30419973445131443.
[I 2025-12-09 18:55:52,014] Trial 18 finished with value: 0.27459707219684726 and parameters: {'model_type': 'graphsage', 'hidden_dims': '[256, 128]', 'dropout': 0.5777451011741039, 'batch_norm': False, 'sage_aggr': 'mean', 'sage_normalize': True, 'sage_project': False, 'lr': 0.0001622751873953207, 'weight_decay': 1.6910131133960935e-05, 'epochs': 98, 'loss': 'mse', 'optimizer': 'adam', 'graph_mode': 'cutoff', 'cutoff': 0.6517868013013509, 'grm_norm': 'cosine', 'self_loops': False, 'use_snp_selection': False}. Best is trial 16 with value: 0.30419973445131443.
[I 2025-12-09 18:56:50,378] Trial 19 finished with value: 0.3001979682962096 and parameters: {'model_type': 'graphsage', 'hidden_dims': '[256, 128]', 'dropout': 0.5983845185816884, 'batch_norm': False, 'sage_aggr': 'mean', 'sage_normalize': True, 'sage_project': False, 'lr': 0.002995427995161927, 'weight_decay': 3.8672752687614245e-07, 'epochs': 200, 'loss': 'mse', 'optimizer': 'adam', 'graph_mode': 'cutoff', 'cutoff': 0.7949672759507791, 'grm_norm': 'cosine', 'self_loops': True, 'use_snp_selection': False}. Best is trial 16 with value: 0.30419973445131443.
[I 2025-12-09 18:57:52,747] Trial 20 finished with value: 0.297741312131067 and parameters: {'model_type': 'graphsage', 'hidden_dims': '[256, 128]', 'dropout': 0.421733235613309, 'batch_norm': False, 'sage_aggr': 'mean', 'sage_normalize': True, 'sage_project': False, 'lr': 0.008733904913483147, 'weight_decay': 2.959409471353724e-06, 'epochs': 214, 'loss': 'mse', 'optimizer': 'adam', 'graph_mode': 'cutoff', 'cutoff': 0.6796341940466378, 'grm_norm': 'cosine', 'self_loops': True, 'use_snp_selection': False}. Best is trial 16 with value: 0.30419973445131443.
[I 2025-12-09 18:59:08,842] Trial 21 finished with value: 0.30178773816489074 and parameters: {'model_type': 'graphsage', 'hidden_dims': '[256, 128]', 'dropout': 0.5895309301498186, 'batch_norm': False, 'sage_aggr': 'mean', 'sage_normalize': True, 'sage_project': False, 'lr': 0.0037471781118568583, 'weight_decay': 3.767922736207558e-07, 'epochs': 264, 'loss': 'mse', 'optimizer': 'adam', 'graph_mode': 'cutoff', 'cutoff': 0.882941063598197, 'grm_norm': 'cosine', 'self_loops': True, 'use_snp_selection': False}. Best is trial 16 with value: 0.30419973445131443.
[I 2025-12-09 19:00:24,659] Trial 22 finished with value: 0.3113074478251863 and parameters: {'model_type': 'graphsage', 'hidden_dims': '[256, 128]', 'dropout': 0.5580516434684137, 'batch_norm': False, 'sage_aggr': 'mean', 'sage_normalize': True, 'sage_project': False, 'lr': 0.0026910388276127147, 'weight_decay': 3.123546621573868e-07, 'epochs': 263, 'loss': 'mse', 'optimizer': 'adam', 'graph_mode': 'cutoff', 'cutoff': 0.8620775576113657, 'grm_norm': 'cosine', 'self_loops': True, 'use_snp_selection': False}. Best is trial 22 with value: 0.3113074478251863.
[I 2025-12-09 19:01:42,705] Trial 23 finished with value: 0.3030513011701483 and parameters: {'model_type': 'graphsage', 'hidden_dims': '[256, 128]', 'dropout': 0.5484826599977048, 'batch_norm': False, 'sage_aggr': 'mean', 'sage_normalize': True, 'sage_project': False, 'lr': 0.0007462802446728955, 'weight_decay': 1.618600985186351e-06, 'epochs': 271, 'loss': 'mse', 'optimizer': 'adam', 'graph_mode': 'cutoff', 'cutoff': 0.8850046678715444, 'grm_norm': 'cosine', 'self_loops': True, 'use_snp_selection': False}. Best is trial 22 with value: 0.3113074478251863.
[I 2025-12-09 19:03:12,570] Trial 24 finished with value: 0.30106103210455853 and parameters: {'model_type': 'graphsage', 'hidden_dims': '[256, 128]', 'dropout': 0.393010676052594, 'batch_norm': False, 'sage_aggr': 'mean', 'sage_normalize': True, 'sage_project': False, 'lr': 0.0007661035910308635, 'weight_decay': 1.8744305368280232e-06, 'epochs': 314, 'loss': 'mse', 'optimizer': 'adam', 'graph_mode': 'cutoff', 'cutoff': 0.8390716066193666, 'grm_norm': 'gcn', 'self_loops': True, 'use_snp_selection': False}. Best is trial 22 with value: 0.3113074478251863.
[I 2025-12-09 19:04:30,880] Trial 25 finished with value: 0.2810656898847764 and parameters: {'model_type': 'graphsage', 'hidden_dims': '[256, 128]', 'dropout': 0.5290351368821324, 'batch_norm': False, 'sage_aggr': 'mean', 'sage_normalize': True, 'sage_project': False, 'lr': 0.00018700595302504656, 'weight_decay': 5.39099972545471e-06, 'epochs': 272, 'loss': 'mse', 'optimizer': 'adam', 'graph_mode': 'cutoff', 'cutoff': 0.897995724673775, 'grm_norm': 'cosine', 'self_loops': True, 'use_snp_selection': False}. Best is trial 22 with value: 0.3113074478251863.
[I 2025-12-09 19:05:32,361] Trial 26 finished with value: 0.0 and parameters: {'model_type': 'graphsage', 'hidden_dims': '[256, 128]', 'dropout': 0.4752909422123094, 'batch_norm': False, 'sage_aggr': 'mean', 'sage_normalize': False, 'sage_project': False, 'lr': 0.0011366626881225068, 'weight_decay': 2.5657612571905586e-07, 'epochs': 212, 'loss': 'mae', 'optimizer': 'adam', 'graph_mode': 'cutoff', 'cutoff': 0.7478235488452359, 'grm_norm': 'cosine', 'self_loops': False, 'use_snp_selection': False}. Best is trial 22 with value: 0.3113074478251863.
[I 2025-12-09 19:07:32,338] Trial 27 finished with value: 0.28824043574274355 and parameters: {'model_type': 'graphsage', 'hidden_dims': '[128, 64]', 'dropout': 0.5484718607503778, 'batch_norm': False, 'sage_aggr': 'mean', 'sage_normalize': True, 'sage_project': False, 'lr': 0.0007110137643492506, 'weight_decay': 1.2280043236135422e-06, 'epochs': 303, 'loss': 'mse', 'optimizer': 'adam', 'graph_mode': 'cutoff', 'cutoff': 0.3189869162129644, 'grm_norm': 'cosine', 'self_loops': True, 'use_snp_selection': False}. Best is trial 22 with value: 0.3113074478251863.
[I 2025-12-09 19:08:51,527] Trial 28 finished with value: 0.27079088760605713 and parameters: {'model_type': 'graphsage', 'hidden_dims': '[256, 128, 64]', 'dropout': 0.38914093291673163, 'batch_norm': False, 'sage_aggr': 'mean', 'sage_normalize': True, 'sage_project': False, 'lr': 0.002405853120000937, 'weight_decay': 1.3306776402477956e-05, 'epochs': 245, 'loss': 'mse', 'optimizer': 'adam', 'graph_mode': 'cutoff', 'cutoff': 0.5406218973130273, 'grm_norm': 'gcn', 'self_loops': True, 'use_snp_selection': False}. Best is trial 22 with value: 0.3113074478251863.
[I 2025-12-09 19:11:29,510] Trial 29 finished with value: 0.2803665263310685 and parameters: {'model_type': 'graphsage', 'hidden_dims': '[512, 256]', 'dropout': 0.5577063159111871, 'batch_norm': True, 'sage_aggr': 'max', 'sage_normalize': True, 'sage_project': False, 'lr': 0.0008548921317935167, 'weight_decay': 4.226533771664385e-07, 'epochs': 221, 'loss': 'mse', 'optimizer': 'adam', 'graph_mode': 'knn', 'knn_k': 3, 'weighted_edges': False, 'symmetrize_mode': 'union', 'self_loops': True, 'use_snp_selection': False}. Best is trial 22 with value: 0.3113074478251863.
[I 2025-12-09 19:13:55,513] Trial 30 finished with value: 0.27979075565569345 and parameters: {'model_type': 'graphsage', 'hidden_dims': '[512, 64]', 'dropout': 0.48961501569131094, 'batch_norm': False, 'sage_aggr': 'mean', 'sage_normalize': True, 'sage_project': False, 'lr': 0.00022448491582869205, 'weight_decay': 1.5185568461640401e-06, 'epochs': 276, 'loss': 'mse', 'optimizer': 'adam', 'graph_mode': 'cutoff', 'cutoff': 0.8278938259847122, 'grm_norm': 'none', 'self_loops': True, 'use_snp_selection': False}. Best is trial 22 with value: 0.3113074478251863.
[I 2025-12-09 19:15:11,664] Trial 31 finished with value: 0.30842342271706413 and parameters: {'model_type': 'graphsage', 'hidden_dims': '[256, 128]', 'dropout': 0.5683853617089973, 'batch_norm': False, 'sage_aggr': 'mean', 'sage_normalize': True, 'sage_project': False, 'lr': 0.005517109845114452, 'weight_decay': 5.321890534609805e-07, 'epochs': 264, 'loss': 'mse', 'optimizer': 'adam', 'graph_mode': 'cutoff', 'cutoff': 0.8962826098843893, 'grm_norm': 'cosine', 'self_loops': True, 'use_snp_selection': False}. Best is trial 22 with value: 0.3113074478251863.
[I 2025-12-09 19:16:23,101] Trial 32 finished with value: 0.30707705217279335 and parameters: {'model_type': 'graphsage', 'hidden_dims': '[256, 128]', 'dropout': 0.5123123515636299, 'batch_norm': False, 'sage_aggr': 'mean', 'sage_normalize': True, 'sage_project': False, 'lr': 0.008106823810330505, 'weight_decay': 2.024250792083814e-07, 'epochs': 247, 'loss': 'mse', 'optimizer': 'adam', 'graph_mode': 'cutoff', 'cutoff': 0.727147685340632, 'grm_norm': 'cosine', 'self_loops': True, 'use_snp_selection': False}. Best is trial 22 with value: 0.3113074478251863.
[I 2025-12-09 19:17:33,465] Trial 33 finished with value: 0.30963542942867306 and parameters: {'model_type': 'graphsage', 'hidden_dims': '[256, 128]', 'dropout': 0.5101761210550579, 'batch_norm': False, 'sage_aggr': 'mean', 'sage_normalize': True, 'sage_project': False, 'lr': 0.00971914662637978, 'weight_decay': 2.1767321529355216e-07, 'epochs': 243, 'loss': 'mse', 'optimizer': 'adam', 'graph_mode': 'cutoff', 'cutoff': 0.7171430227949801, 'grm_norm': 'cosine', 'self_loops': True, 'use_snp_selection': False}. Best is trial 22 with value: 0.3113074478251863.
[I 2025-12-09 19:17:43,493] Trial 34 finished with value: 0.1584797952118735 and parameters: {'model_type': 'graphsage', 'hidden_dims': '[128, 64]', 'dropout': 0.5004966403360175, 'batch_norm': False, 'sage_aggr': 'max', 'sage_normalize': False, 'sage_project': False, 'lr': 0.009020491186683435, 'weight_decay': 5.445005111886281e-07, 'epochs': 193, 'loss': 'mse', 'optimizer': 'adam', 'graph_mode': 'cutoff', 'cutoff': 0.7182839274177857, 'grm_norm': 'cosine', 'self_loops': True, 'use_snp_selection': True, 'num_snps': 2241}. Best is trial 22 with value: 0.3113074478251863.
[I 2025-12-09 19:19:57,439] Trial 35 finished with value: 0.011492498625440765 and parameters: {'model_type': 'graphsage', 'hidden_dims': '[256, 128]', 'dropout': 0.4578603970455654, 'batch_norm': False, 'sage_aggr': 'max', 'sage_normalize': False, 'sage_project': False, 'lr': 0.006262691767824765, 'weight_decay': 1.7001941042608858e-07, 'epochs': 229, 'loss': 'mse', 'optimizer': 'adam', 'graph_mode': 'knn', 'knn_k': 4, 'weighted_edges': True, 'symmetrize_mode': 'union', 'self_loops': True, 'use_snp_selection': False}. Best is trial 22 with value: 0.3113074478251863.
[I 2025-12-09 19:21:06,721] Trial 36 finished with value: 0.3038249178538409 and parameters: {'model_type': 'graphsage', 'hidden_dims': '[256, 128]', 'dropout': 0.5670244460383065, 'batch_norm': True, 'sage_aggr': 'mean', 'sage_normalize': True, 'sage_project': False, 'lr': 0.00577065554471715, 'weight_decay': 2.1284724479517877e-07, 'epochs': 156, 'loss': 'mae', 'optimizer': 'adam', 'graph_mode': 'cutoff', 'cutoff': 0.8223246659983444, 'grm_norm': 'cosine', 'self_loops': False, 'use_snp_selection': True, 'num_snps': 59922}. Best is trial 22 with value: 0.3113074478251863.
[I 2025-12-09 19:22:32,299] Trial 37 finished with value: -0.0013283754689430495 and parameters: {'model_type': 'graphsage', 'hidden_dims': '[256, 128, 64]', 'dropout': 0.5201699648772462, 'batch_norm': False, 'sage_aggr': 'mean', 'sage_normalize': False, 'sage_project': False, 'lr': 0.009917244675711976, 'weight_decay': 4.568367503790046e-05, 'epochs': 298, 'loss': 'mse', 'optimizer': 'adam', 'graph_mode': 'cutoff', 'cutoff': 0.7091168940456426, 'grm_norm': 'cosine', 'self_loops': True, 'use_snp_selection': False}. Best is trial 22 with value: 0.3113074478251863.
[I 2025-12-09 19:26:03,934] Trial 38 finished with value: 0.2626032194936467 and parameters: {'model_type': 'graphsage', 'hidden_dims': '[512, 256]', 'dropout': 0.3629213627825921, 'batch_norm': True, 'sage_aggr': 'max', 'sage_normalize': True, 'sage_project': False, 'lr': 0.004141055041534632, 'weight_decay': 0.00014144043448895884, 'epochs': 172, 'loss': 'mae', 'optimizer': 'adam', 'graph_mode': 'knn', 'knn_k': 10, 'weighted_edges': True, 'symmetrize_mode': 'union', 'self_loops': False, 'use_snp_selection': False}. Best is trial 22 with value: 0.3113074478251863.
[I 2025-12-09 19:26:49,650] Trial 39 finished with value: 0.2628473361147329 and parameters: {'model_type': 'graphsage', 'hidden_dims': '[512, 64]', 'dropout': 0.46454139598180233, 'batch_norm': False, 'sage_aggr': 'mean', 'sage_normalize': True, 'sage_project': False, 'lr': 0.006633796978869281, 'weight_decay': 0.0008076915742574946, 'epochs': 284, 'loss': 'mse', 'optimizer': 'adam', 'graph_mode': 'cutoff', 'cutoff': 0.7625391727668802, 'grm_norm': 'gcn', 'self_loops': True, 'use_snp_selection': True, 'num_snps': 15197}. Best is trial 22 with value: 0.3113074478251863.
[I 2025-12-09 19:28:14,696] Trial 40 finished with value: 0.30510747111287617 and parameters: {'model_type': 'graphsage', 'hidden_dims': '[128, 64]', 'dropout': 0.5131715534591443, 'batch_norm': True, 'sage_aggr': 'mean', 'sage_normalize': False, 'sage_project': False, 'lr': 0.0022558060417729323, 'weight_decay': 1.0636609442133528e-06, 'epochs': 140, 'loss': 'mae', 'optimizer': 'adam', 'graph_mode': 'knn', 'knn_k': 7, 'weighted_edges': False, 'symmetrize_mode': 'union', 'self_loops': True, 'use_snp_selection': False}. Best is trial 22 with value: 0.3113074478251863.
[I 2025-12-09 19:29:32,213] Trial 41 finished with value: 0.3042260973950672 and parameters: {'model_type': 'graphsage', 'hidden_dims': '[128, 64]', 'dropout': 0.5130681033001265, 'batch_norm': True, 'sage_aggr': 'mean', 'sage_normalize': False, 'sage_project': False, 'lr': 0.0023332507473608948, 'weight_decay': 9.570126903571031e-07, 'epochs': 127, 'loss': 'mae', 'optimizer': 'adam', 'graph_mode': 'knn', 'knn_k': 7, 'weighted_edges': False, 'symmetrize_mode': 'union', 'self_loops': True, 'use_snp_selection': False}. Best is trial 22 with value: 0.3113074478251863.
[I 2025-12-09 19:30:38,718] Trial 42 finished with value: 0.3013650695492734 and parameters: {'model_type': 'graphsage', 'hidden_dims': '[128, 64]', 'dropout': 0.5687314577038827, 'batch_norm': True, 'sage_aggr': 'mean', 'sage_normalize': False, 'sage_project': False, 'lr': 0.004923634510278827, 'weight_decay': 5.911860133976556e-07, 'epochs': 135, 'loss': 'mae', 'optimizer': 'adam', 'graph_mode': 'knn', 'knn_k': 5, 'weighted_edges': False, 'symmetrize_mode': 'union', 'self_loops': True, 'use_snp_selection': False}. Best is trial 22 with value: 0.3113074478251863.
[I 2025-12-09 19:31:10,311] Trial 43 finished with value: 0.2888048736345312 and parameters: {'model_type': 'graphsage', 'hidden_dims': '[128, 64]', 'dropout': 0.5364342092810547, 'batch_norm': True, 'sage_aggr': 'mean', 'sage_normalize': False, 'sage_project': False, 'lr': 0.0032547140542688742, 'weight_decay': 1.5323559084410285e-07, 'epochs': 43, 'loss': 'mae', 'optimizer': 'adam', 'graph_mode': 'knn', 'knn_k': 8, 'weighted_edges': False, 'symmetrize_mode': 'union', 'self_loops': True, 'use_snp_selection': False}. Best is trial 22 with value: 0.3113074478251863.
[I 2025-12-09 19:32:11,854] Trial 44 finished with value: 0.2976998927208362 and parameters: {'model_type': 'graphsage', 'hidden_dims': '[256, 128]', 'dropout': 0.48067051940055777, 'batch_norm': True, 'sage_aggr': 'mean', 'sage_normalize': False, 'sage_project': False, 'lr': 0.007299917387134506, 'weight_decay': 4.604380532790516e-07, 'epochs': 100, 'loss': 'mae', 'optimizer': 'adam', 'graph_mode': 'knn', 'knn_k': 5, 'weighted_edges': False, 'symmetrize_mode': 'union', 'self_loops': True, 'use_snp_selection': False}. Best is trial 22 with value: 0.3113074478251863.
[I 2025-12-09 19:35:13,588] Trial 45 finished with value: 0.30313506328348794 and parameters: {'model_type': 'graphsage', 'hidden_dims': '[128, 64]', 'dropout': 0.2191032206202982, 'batch_norm': True, 'sage_aggr': 'mean', 'sage_normalize': False, 'sage_project': False, 'lr': 3.2172075567230224e-05, 'weight_decay': 6.1813431305219374e-06, 'epochs': 202, 'loss': 'mae', 'optimizer': 'adam', 'graph_mode': 'knn', 'knn_k': 7, 'weighted_edges': False, 'symmetrize_mode': 'union', 'self_loops': True, 'use_snp_selection': True, 'num_snps': 44150}. Best is trial 22 with value: 0.3113074478251863.
