[I 2025-12-09 21:02:50,215] Trial 68 finished with value: 0.3356822515613122 and parameters: {'model_type': 'graphsage', 'hidden_dims': '[512, 256]', 'dropout': 0.4937898426186641, 'batch_norm': False, 'sage_aggr': 'max', 'sage_normalize': True, 'sage_project': False, 'lr': 1.5575195483529177e-05, 'weight_decay': 0.0005648211177168448, 'epochs': 170, 'loss': 'mae', 'optimizer': 'adam', 'graph_mode': 'cutoff', 'cutoff': 0.5863348153824289, 'grm_norm': 'none', 'self_loops': False, 'use_snp_selection': False}. Best is trial 63 with value: 0.3744651287832118.
[I 2025-12-09 21:04:30,058] Trial 69 finished with value: 0.3403633115969848 and parameters: {'model_type': 'graphsage', 'hidden_dims': '[512, 256]', 'dropout': 0.43802509771261666, 'batch_norm': False, 'sage_aggr': 'max', 'sage_normalize': False, 'sage_project': False, 'lr': 2.3645876885784397e-05, 'weight_decay': 0.00010530317089332893, 'epochs': 278, 'loss': 'mse', 'optimizer': 'adam', 'graph_mode': 'cutoff', 'cutoff': 0.6338752365373982, 'grm_norm': 'none', 'self_loops': False, 'use_snp_selection': True, 'num_snps': 36021}. Best is trial 63 with value: 0.3744651287832118.
[I 2025-12-09 21:05:09,517] Trial 70 finished with value: 0.3546524920206508 and parameters: {'model_type': 'graphsage', 'hidden_dims': '[512, 128]', 'dropout': 0.4073256237613452, 'batch_norm': False, 'sage_aggr': 'mean', 'sage_normalize': False, 'sage_project': False, 'lr': 6.339861466847812e-05, 'weight_decay': 0.0009634682965414065, 'epochs': 129, 'loss': 'mae', 'optimizer': 'adam', 'graph_mode': 'cutoff', 'cutoff': 0.5043837597869679, 'grm_norm': 'gcn', 'self_loops': False, 'use_snp_selection': True, 'num_snps': 11952}. Best is trial 63 with value: 0.3744651287832118.
[I 2025-12-09 21:06:47,109] Trial 71 finished with value: 0.3681366802513107 and parameters: {'model_type': 'graphsage', 'hidden_dims': '[512, 256]', 'dropout': 0.320961950307011, 'batch_norm': False, 'sage_aggr': 'max', 'sage_normalize': False, 'sage_project': False, 'lr': 1.0444357047804868e-05, 'weight_decay': 0.00024324846234301156, 'epochs': 209, 'loss': 'mae', 'optimizer': 'adam', 'graph_mode': 'cutoff', 'cutoff': 0.5729900668545754, 'grm_norm': 'none', 'self_loops': False, 'use_snp_selection': True, 'num_snps': 42119}. Best is trial 63 with value: 0.3744651287832118.
[I 2025-12-09 21:08:29,501] Trial 72 finished with value: 0.36282880724595457 and parameters: {'model_type': 'graphsage', 'hidden_dims': '[512, 256]', 'dropout': 0.32093626020350297, 'batch_norm': False, 'sage_aggr': 'max', 'sage_normalize': False, 'sage_project': False, 'lr': 1.0070443551543834e-05, 'weight_decay': 0.00015521508623198536, 'epochs': 226, 'loss': 'mae', 'optimizer': 'adam', 'graph_mode': 'cutoff', 'cutoff': 0.6051601817136608, 'grm_norm': 'none', 'self_loops': False, 'use_snp_selection': True, 'num_snps': 42898}. Best is trial 63 with value: 0.3744651287832118.
[I 2025-12-09 21:10:11,176] Trial 73 finished with value: 0.36327028579169973 and parameters: {'model_type': 'graphsage', 'hidden_dims': '[512, 256]', 'dropout': 0.34623045287509435, 'batch_norm': False, 'sage_aggr': 'max', 'sage_normalize': False, 'sage_project': False, 'lr': 1.695681248268173e-05, 'weight_decay': 0.00023650043712309315, 'epochs': 242, 'loss': 'mae', 'optimizer': 'adam', 'graph_mode': 'cutoff', 'cutoff': 0.5609629813158148, 'grm_norm': 'none', 'self_loops': False, 'use_snp_selection': True, 'num_snps': 38670}. Best is trial 63 with value: 0.3744651287832118.
[I 2025-12-09 21:11:13,282] Trial 74 finished with value: 0.368947261894737 and parameters: {'model_type': 'graphsage', 'hidden_dims': '[128, 64]', 'dropout': 0.38617716364354326, 'batch_norm': False, 'sage_aggr': 'max', 'sage_normalize': False, 'sage_project': False, 'lr': 1.356164418013822e-05, 'weight_decay': 0.000329723073070998, 'epochs': 212, 'loss': 'mae', 'optimizer': 'adam', 'graph_mode': 'cutoff', 'cutoff': 0.7019922766072368, 'grm_norm': 'none', 'self_loops': False, 'use_snp_selection': True, 'num_snps': 45619}. Best is trial 63 with value: 0.3744651287832118.
[I 2025-12-09 21:12:15,205] Trial 75 finished with value: 0.36506847854443325 and parameters: {'model_type': 'graphsage', 'hidden_dims': '[128, 64]', 'dropout': 0.4583981025904793, 'batch_norm': False, 'sage_aggr': 'max', 'sage_normalize': False, 'sage_project': False, 'lr': 1.3823676722086011e-05, 'weight_decay': 0.00033338688158199433, 'epochs': 207, 'loss': 'mae', 'optimizer': 'adam', 'graph_mode': 'cutoff', 'cutoff': 0.6589286585477091, 'grm_norm': 'none', 'self_loops': False, 'use_snp_selection': True, 'num_snps': 45330}. Best is trial 63 with value: 0.3744651287832118.
[I 2025-12-09 21:13:46,312] Trial 76 finished with value: 0.35273027729259127 and parameters: {'model_type': 'graphsage', 'hidden_dims': '[128, 64]', 'dropout': 0.38528190904207676, 'batch_norm': False, 'sage_aggr': 'max', 'sage_normalize': False, 'sage_project': False, 'lr': 1.1855636145155402e-05, 'weight_decay': 0.0005481855841870268, 'epochs': 253, 'loss': 'mae', 'optimizer': 'adam', 'graph_mode': 'cutoff', 'cutoff': 0.4245479472140352, 'grm_norm': 'cosine_then_gcn', 'self_loops': False, 'use_snp_selection': True, 'num_snps': 40880}. Best is trial 63 with value: 0.3744651287832118.
[I 2025-12-09 21:15:02,970] Trial 77 finished with value: 0.3694000860236417 and parameters: {'model_type': 'graphsage', 'hidden_dims': '[128, 64]', 'dropout': 0.4104025070946076, 'batch_norm': False, 'sage_aggr': 'max', 'sage_normalize': False, 'sage_project': False, 'lr': 1.4944960929626594e-05, 'weight_decay': 0.0007319101507633953, 'epochs': 234, 'loss': 'mae', 'optimizer': 'adam', 'graph_mode': 'cutoff', 'cutoff': 0.5193665408502854, 'grm_norm': 'none', 'self_loops': False, 'use_snp_selection': True, 'num_snps': 42693}. Best is trial 63 with value: 0.3744651287832118.
[I 2025-12-09 21:16:02,106] Trial 78 finished with value: 0.327339461990642 and parameters: {'model_type': 'graphsage', 'hidden_dims': '[128, 64]', 'dropout': 0.4295782317728667, 'batch_norm': False, 'sage_aggr': 'max', 'sage_normalize': False, 'sage_project': False, 'lr': 1.4606025411130386e-05, 'weight_decay': 0.00045327089180213445, 'epochs': 234, 'loss': 'mae', 'optimizer': 'adam', 'graph_mode': 'knn', 'knn_k': 1, 'weighted_edges': False, 'symmetrize_mode': 'mutual', 'self_loops': False, 'use_snp_selection': True, 'num_snps': 43028}. Best is trial 63 with value: 0.3744651287832118.
[I 2025-12-09 21:17:37,203] Trial 79 finished with value: 0.3294101514363293 and parameters: {'model_type': 'graphsage', 'hidden_dims': '[128, 64]', 'dropout': 0.41085302724503975, 'batch_norm': True, 'sage_aggr': 'max', 'sage_normalize': False, 'sage_project': False, 'lr': 2.4020498930917726e-05, 'weight_decay': 0.000315786971487238, 'epochs': 267, 'loss': 'mae', 'optimizer': 'adam', 'graph_mode': 'cutoff', 'cutoff': 0.5021747760463657, 'grm_norm': 'none', 'self_loops': True, 'use_snp_selection': True, 'num_snps': 46534}. Best is trial 63 with value: 0.3744651287832118.
[I 2025-12-09 21:18:30,675] Trial 80 finished with value: 0.36123258621088783 and parameters: {'model_type': 'graphsage', 'hidden_dims': '[128, 64]', 'dropout': 0.3691959491682491, 'batch_norm': False, 'sage_aggr': 'max', 'sage_normalize': False, 'sage_project': False, 'lr': 1.1966791713731865e-05, 'weight_decay': 0.0007507821494591072, 'epochs': 193, 'loss': 'mae', 'optimizer': 'adam', 'graph_mode': 'cutoff', 'cutoff': 0.5322954324314274, 'grm_norm': 'none', 'self_loops': False, 'use_snp_selection': True, 'num_snps': 31998}. Best is trial 63 with value: 0.3744651287832118.
[I 2025-12-09 21:19:27,720] Trial 81 finished with value: 0.36575259184270387 and parameters: {'model_type': 'graphsage', 'hidden_dims': '[128, 64]', 'dropout': 0.3894513014186487, 'batch_norm': False, 'sage_aggr': 'max', 'sage_normalize': False, 'sage_project': False, 'lr': 1.661480078779053e-05, 'weight_decay': 0.0007026111542237889, 'epochs': 219, 'loss': 'mae', 'optimizer': 'adam', 'graph_mode': 'cutoff', 'cutoff': 0.6988395833462729, 'grm_norm': 'none', 'self_loops': False, 'use_snp_selection': True, 'num_snps': 39256}. Best is trial 63 with value: 0.3744651287832118.
[I 2025-12-09 21:21:08,148] Trial 82 finished with value: 0.3365401494808201 and parameters: {'model_type': 'graphsage', 'hidden_dims': '[256, 128, 64]', 'dropout': 0.3981924820856081, 'batch_norm': False, 'sage_aggr': 'max', 'sage_normalize': False, 'sage_project': False, 'lr': 2.0108743284702794e-05, 'weight_decay': 0.0005070780632475303, 'epochs': 229, 'loss': 'mae', 'optimizer': 'adam', 'graph_mode': 'cutoff', 'cutoff': 0.4768647548997157, 'grm_norm': 'cosine', 'self_loops': False, 'use_snp_selection': True, 'num_snps': 44262}. Best is trial 63 with value: 0.3744651287832118.
[I 2025-12-09 21:22:39,287] Trial 83 finished with value: 0.3584786822709785 and parameters: {'model_type': 'graphsage', 'hidden_dims': '[512, 256]', 'dropout': 0.42969706195796337, 'batch_norm': False, 'sage_aggr': 'max', 'sage_normalize': False, 'sage_project': False, 'lr': 3.4088917305473635e-05, 'weight_decay': 0.00022557909164298964, 'epochs': 176, 'loss': 'mae', 'optimizer': 'adam', 'graph_mode': 'cutoff', 'cutoff': 0.5698606402192042, 'grm_norm': 'none', 'self_loops': False, 'use_snp_selection': True, 'num_snps': 41511}. Best is trial 63 with value: 0.3744651287832118.
[I 2025-12-09 21:23:53,448] Trial 84 finished with value: 0.36708700163664654 and parameters: {'model_type': 'graphsage', 'hidden_dims': '[128, 64]', 'dropout': 0.3618882287174305, 'batch_norm': False, 'sage_aggr': 'max', 'sage_normalize': False, 'sage_project': False, 'lr': 1.3903962880157574e-05, 'weight_decay': 0.0009778285828867396, 'epochs': 208, 'loss': 'mae', 'optimizer': 'adam', 'graph_mode': 'cutoff', 'cutoff': 0.5187477575479992, 'grm_norm': 'cosine', 'self_loops': False, 'use_snp_selection': True, 'num_snps': 47939}. Best is trial 63 with value: 0.3744651287832118.
[I 2025-12-09 21:24:50,147] Trial 85 finished with value: 0.36387153884084295 and parameters: {'model_type': 'graphsage', 'hidden_dims': '[512, 256]', 'dropout': 0.40914021271610346, 'batch_norm': False, 'sage_aggr': 'max', 'sage_normalize': False, 'sage_project': False, 'lr': 1.0060901233073465e-05, 'weight_decay': 0.0003846147558620167, 'epochs': 92, 'loss': 'mae', 'optimizer': 'adam', 'graph_mode': 'cutoff', 'cutoff': 0.6122560472623586, 'grm_norm': 'none', 'self_loops': False, 'use_snp_selection': True, 'num_snps': 34722}. Best is trial 63 with value: 0.3744651287832118.
[I 2025-12-09 21:26:38,593] Trial 86 finished with value: 0.32688070146227294 and parameters: {'model_type': 'graphsage', 'hidden_dims': '[512, 256]', 'dropout': 0.4824461138821796, 'batch_norm': False, 'sage_aggr': 'max', 'sage_normalize': True, 'sage_project': False, 'lr': 1.664174718141195e-05, 'weight_decay': 0.00011793735148020675, 'epochs': 242, 'loss': 'mae', 'optimizer': 'adam', 'graph_mode': 'cutoff', 'cutoff': 0.5846461997897447, 'grm_norm': 'cosine', 'self_loops': False, 'use_snp_selection': False}. Best is trial 63 with value: 0.3744651287832118.
[I 2025-12-09 21:28:50,117] Trial 87 finished with value: 0.3533398157150962 and parameters: {'model_type': 'graphsage', 'hidden_dims': '[512, 256]', 'dropout': 0.44666745512832906, 'batch_norm': False, 'sage_aggr': 'max', 'sage_normalize': False, 'sage_project': False, 'lr': 2.877278601326105e-05, 'weight_decay': 3.890057470608359e-06, 'epochs': 312, 'loss': 'mae', 'optimizer': 'adam', 'graph_mode': 'cutoff', 'cutoff': 0.6377600650655973, 'grm_norm': 'none', 'self_loops': False, 'use_snp_selection': True, 'num_snps': 45329}. Best is trial 63 with value: 0.3744651287832118.
[I 2025-12-09 21:30:26,100] Trial 88 finished with value: 0.3434527060558552 and parameters: {'model_type': 'graphsage', 'hidden_dims': '[128, 64]', 'dropout': 0.326853772246454, 'batch_norm': False, 'sage_aggr': 'max', 'sage_normalize': False, 'sage_project': False, 'lr': 2.0335308523938372e-05, 'weight_decay': 0.0006452735919508017, 'epochs': 224, 'loss': 'mse', 'optimizer': 'adam', 'graph_mode': 'cutoff', 'cutoff': 0.3140647672755117, 'grm_norm': 'cosine', 'self_loops': False, 'use_snp_selection': True, 'num_snps': 37988}. Best is trial 63 with value: 0.3744651287832118.
[I 2025-12-09 21:31:34,509] Trial 89 finished with value: 0.3623732536286933 and parameters: {'model_type': 'graphsage', 'hidden_dims': '[512, 256]', 'dropout': 0.29708464897048564, 'batch_norm': False, 'sage_aggr': 'mean', 'sage_normalize': False, 'sage_project': False, 'lr': 1.1890701916712238e-05, 'weight_decay': 5.197914965433583e-07, 'epochs': 109, 'loss': 'mae', 'optimizer': 'adam', 'graph_mode': 'cutoff', 'cutoff': 0.7487742605510287, 'grm_norm': 'gcn', 'self_loops': False, 'use_snp_selection': True, 'num_snps': 42830}. Best is trial 63 with value: 0.3744651287832118.
[I 2025-12-09 21:33:05,081] Trial 90 finished with value: 0.25391411796781416 and parameters: {'model_type': 'graphsage', 'hidden_dims': '[256, 128]', 'dropout': 0.3783972677925586, 'batch_norm': True, 'sage_aggr': 'max', 'sage_normalize': False, 'sage_project': False, 'lr': 1.4255286794756414e-05, 'weight_decay': 0.0002737425446015457, 'epochs': 73, 'loss': 'mae', 'optimizer': 'adam', 'graph_mode': 'knn', 'knn_k': 8, 'weighted_edges': True, 'symmetrize_mode': 'union', 'self_loops': True, 'use_snp_selection': True, 'num_snps': 40375}. Best is trial 63 with value: 0.3744651287832118.
[I 2025-12-09 21:34:37,082] Trial 91 finished with value: 0.36488567747583484 and parameters: {'model_type': 'graphsage', 'hidden_dims': '[512, 128]', 'dropout': 0.34918049711256244, 'batch_norm': False, 'sage_aggr': 'max', 'sage_normalize': False, 'sage_project': False, 'lr': 2.44546472841272e-05, 'weight_decay': 0.00020145858094618003, 'epochs': 162, 'loss': 'mae', 'optimizer': 'adam', 'graph_mode': 'cutoff', 'cutoff': 0.6833241765857148, 'grm_norm': 'none', 'self_loops': False, 'use_snp_selection': True, 'num_snps': 48860}. Best is trial 63 with value: 0.3744651287832118.
[I 2025-12-09 21:36:17,539] Trial 92 finished with value: 0.36112583870287807 and parameters: {'model_type': 'graphsage', 'hidden_dims': '[512, 256]', 'dropout': 0.34004640661858376, 'batch_norm': False, 'sage_aggr': 'max', 'sage_normalize': False, 'sage_project': False, 'lr': 1.8464916349289686e-05, 'weight_decay': 0.0001466835686349756, 'epochs': 200, 'loss': 'mae', 'optimizer': 'adam', 'graph_mode': 'cutoff', 'cutoff': 0.7140185765406105, 'grm_norm': 'none', 'self_loops': False, 'use_snp_selection': True, 'num_snps': 46824}. Best is trial 63 with value: 0.3744651287832118.
[I 2025-12-09 21:37:19,679] Trial 93 finished with value: 0.3662789552226112 and parameters: {'model_type': 'graphsage', 'hidden_dims': '[256, 128, 64]', 'dropout': 0.35831971230324455, 'batch_norm': False, 'sage_aggr': 'max', 'sage_normalize': False, 'sage_project': False, 'lr': 1.9400701417590606e-05, 'weight_decay': 8.077194999267115e-05, 'epochs': 114, 'loss': 'mae', 'optimizer': 'adam', 'graph_mode': 'cutoff', 'cutoff': 0.7382111424840331, 'grm_norm': 'none', 'self_loops': False, 'use_snp_selection': True, 'num_snps': 50815}. Best is trial 63 with value: 0.3744651287832118.
[I 2025-12-09 21:38:53,183] Trial 94 finished with value: 0.3626543313071773 and parameters: {'model_type': 'graphsage', 'hidden_dims': '[512, 256]', 'dropout': 0.31092400107097173, 'batch_norm': False, 'sage_aggr': 'max', 'sage_normalize': False, 'sage_project': False, 'lr': 1.1799319790553401e-05, 'weight_decay': 0.0003519299448048534, 'epochs': 146, 'loss': 'mae', 'optimizer': 'adam', 'graph_mode': 'cutoff', 'cutoff': 0.6539303533813985, 'grm_norm': 'none', 'self_loops': False, 'use_snp_selection': True, 'num_snps': 53117}. Best is trial 63 with value: 0.3744651287832118.
[I 2025-12-09 21:39:53,591] Trial 95 finished with value: 0.361969110992254 and parameters: {'model_type': 'graphsage', 'hidden_dims': '[128, 64]', 'dropout': 0.42301338453090537, 'batch_norm': False, 'sage_aggr': 'max', 'sage_normalize': False, 'sage_project': False, 'lr': 3.749806727537081e-05, 'weight_decay': 1.0881453610049926e-05, 'epochs': 178, 'loss': 'mae', 'optimizer': 'adam', 'graph_mode': 'cutoff', 'cutoff': 0.550973523051039, 'grm_norm': 'cosine', 'self_loops': False, 'use_snp_selection': True, 'num_snps': 44459}. Best is trial 63 with value: 0.3744651287832118.
[I 2025-12-09 21:41:30,989] Trial 96 finished with value: 0.35895201903117113 and parameters: {'model_type': 'graphsage', 'hidden_dims': '[512, 256]', 'dropout': 0.3963721735710816, 'batch_norm': False, 'sage_aggr': 'max', 'sage_normalize': False, 'sage_project': False, 'lr': 1.4418305193179756e-05, 'weight_decay': 0.00018120441261240366, 'epochs': 188, 'loss': 'mae', 'optimizer': 'adam', 'graph_mode': 'cutoff', 'cutoff': 0.7106867687364639, 'grm_norm': 'cosine_then_gcn', 'self_loops': False, 'use_snp_selection': True, 'num_snps': 46127}. Best is trial 63 with value: 0.3744651287832118.
[I 2025-12-09 21:42:39,196] Trial 97 finished with value: 0.36909791422965615 and parameters: {'model_type': 'graphsage', 'hidden_dims': '[512, 256]', 'dropout': 0.4641136735226927, 'batch_norm': False, 'sage_aggr': 'max', 'sage_normalize': False, 'sage_project': False, 'lr': 1.7470184088076075e-05, 'weight_decay': 0.0004599629018468347, 'epochs': 89, 'loss': 'mae', 'optimizer': 'adam', 'graph_mode': 'cutoff', 'cutoff': 0.79036107316496, 'grm_norm': 'none', 'self_loops': False, 'use_snp_selection': True, 'num_snps': 48561}. Best is trial 63 with value: 0.3744651287832118.
[I 2025-12-09 21:43:42,346] Trial 98 finished with value: 0.19626948250323656 and parameters: {'model_type': 'graphsage', 'hidden_dims': '[512, 256]', 'dropout': 0.5393955483905916, 'batch_norm': False, 'sage_aggr': 'max', 'sage_normalize': False, 'sage_project': False, 'lr': 0.0026895706591349667, 'weight_decay': 0.0005551275442010466, 'epochs': 88, 'loss': 'mae', 'optimizer': 'adam', 'graph_mode': 'cutoff', 'cutoff': 0.8733759502983672, 'grm_norm': 'cosine', 'self_loops': False, 'use_snp_selection': True, 'num_snps': 42302}. Best is trial 63 with value: 0.3744651287832118.
[I 2025-12-09 21:45:26,037] Trial 99 finished with value: 0.32554290298470767 and parameters: {'model_type': 'graphsage', 'hidden_dims': '[512, 256]', 'dropout': 0.46287569652736316, 'batch_norm': False, 'sage_aggr': 'max', 'sage_normalize': True, 'sage_project': False, 'lr': 2.2211022692600943e-05, 'weight_decay': 0.0008049737876580343, 'epochs': 236, 'loss': 'mae', 'optimizer': 'adam', 'graph_mode': 'cutoff', 'cutoff': 0.8267965651591047, 'grm_norm': 'none', 'self_loops': False, 'use_snp_selection': False}. Best is trial 63 with value: 0.3744651287832118.
[I 2025-12-09 21:46:41,484] Trial 100 finished with value: 0.3632704599751224 and parameters: {'model_type': 'graphsage', 'hidden_dims': '[512, 256]', 'dropout': 0.44671614893437406, 'batch_norm': False, 'sage_aggr': 'max', 'sage_normalize': False, 'sage_project': False, 'lr': 1.1404157376789155e-05, 'weight_decay': 0.0002847800177694918, 'epochs': 97, 'loss': 'mae', 'optimizer': 'adam', 'graph_mode': 'cutoff', 'cutoff': 0.8041006909447523, 'grm_norm': 'cosine', 'self_loops': False, 'use_snp_selection': True, 'num_snps': 51909}. Best is trial 63 with value: 0.3744651287832118.
[I 2025-12-09 21:48:10,079] Trial 101 finished with value: 0.36777741635632005 and parameters: {'model_type': 'graphsage', 'hidden_dims': '[512, 256]', 'dropout': 0.3702351974474523, 'batch_norm': False, 'sage_aggr': 'max', 'sage_normalize': False, 'sage_project': False, 'lr': 1.7178009380646224e-05, 'weight_decay': 0.00043681966372141384, 'epochs': 157, 'loss': 'mae', 'optimizer': 'adam', 'graph_mode': 'cutoff', 'cutoff': 0.7639497730792006, 'grm_norm': 'none', 'self_loops': False, 'use_snp_selection': True, 'num_snps': 48069}. Best is trial 63 with value: 0.3744651287832118.
[I 2025-12-09 21:49:28,707] Trial 102 finished with value: 0.36345238031564103 and parameters: {'model_type': 'graphsage', 'hidden_dims': '[512, 256]', 'dropout': 0.41256662957765394, 'batch_norm': False, 'sage_aggr': 'max', 'sage_normalize': False, 'sage_project': False, 'lr': 1.5707601581475248e-05, 'weight_decay': 0.00041934006260778244, 'epochs': 125, 'loss': 'mae', 'optimizer': 'adam', 'graph_mode': 'cutoff', 'cutoff': 0.7757268799326502, 'grm_norm': 'none', 'self_loops': False, 'use_snp_selection': True, 'num_snps': 48148}. Best is trial 63 with value: 0.3744651287832118.
[I 2025-12-09 21:50:36,041] Trial 103 finished with value: 0.3613606399289143 and parameters: {'model_type': 'graphsage', 'hidden_dims': '[512, 256]', 'dropout': 0.3698841692175313, 'batch_norm': False, 'sage_aggr': 'max', 'sage_normalize': False, 'sage_project': False, 'lr': 2.8511070008028615e-05, 'weight_decay': 0.0006552836553650441, 'epochs': 100, 'loss': 'mae', 'optimizer': 'adam', 'graph_mode': 'cutoff', 'cutoff': 0.7591072239072705, 'grm_norm': 'none', 'self_loops': False, 'use_snp_selection': True, 'num_snps': 44120}. Best is trial 63 with value: 0.3744651287832118.
[I 2025-12-09 21:51:05,200] Trial 104 finished with value: 0.33057169533312025 and parameters: {'model_type': 'graphsage', 'hidden_dims': '[512, 256]', 'dropout': 0.4369049771916058, 'batch_norm': False, 'sage_aggr': 'max', 'sage_normalize': False, 'sage_project': False, 'lr': 1.7331685521313574e-05, 'weight_decay': 0.0005071796170813098, 'epochs': 214, 'loss': 'mae', 'optimizer': 'adam', 'graph_mode': 'cutoff', 'cutoff': 0.7940052448234962, 'grm_norm': 'none', 'self_loops': False, 'use_snp_selection': True, 'num_snps': 2042}. Best is trial 63 with value: 0.3744651287832118.
