[I 2025-12-09 01:12:35,822] Trial 36 finished with value: 0.35433149676259923 and parameters: {'model_type': 'graphsage', 'hidden_dims': '[256, 128, 64]', 'dropout': 0.33332471467577074, 'batch_norm': False, 'sage_aggr': 'max', 'sage_normalize': False, 'sage_project': False, 'lr': 1.1303604364128458e-05, 'weight_decay': 8.870402892160817e-06, 'epochs': 317, 'loss': 'mse', 'optimizer': 'adam', 'graph_mode': 'cutoff', 'cutoff': 0.45180378822040246, 'grm_norm': 'gcn', 'self_loops': False, 'use_snp_selection': False}. Best is trial 2 with value: 0.37149077614042453.
[I 2025-12-09 01:14:53,246] Trial 37 finished with value: 0.34788258704740593 and parameters: {'model_type': 'graphsage', 'hidden_dims': '[512, 64]', 'dropout': 0.23233132466626666, 'batch_norm': True, 'sage_aggr': 'mean', 'sage_normalize': False, 'sage_project': False, 'lr': 0.00011768970227005086, 'weight_decay': 5.411224766082342e-07, 'epochs': 277, 'loss': 'mae', 'optimizer': 'adam', 'graph_mode': 'knn', 'knn_k': 4, 'weighted_edges': True, 'symmetrize_mode': 'union', 'self_loops': True, 'use_snp_selection': True, 'num_snps': 30256}. Best is trial 2 with value: 0.37149077614042453.
[I 2025-12-09 01:15:27,606] Trial 38 finished with value: 0.34668890708212796 and parameters: {'model_type': 'graphsage', 'hidden_dims': '[128, 64]', 'dropout': 0.10558175783008011, 'batch_norm': False, 'sage_aggr': 'max', 'sage_normalize': True, 'sage_project': False, 'lr': 1.6245012289983367e-05, 'weight_decay': 5.586463352241494e-05, 'epochs': 175, 'loss': 'mae', 'optimizer': 'adam', 'graph_mode': 'cutoff', 'cutoff': 0.6180641920126083, 'grm_norm': 'cosine', 'self_loops': False, 'use_snp_selection': True, 'num_snps': 11745}. Best is trial 2 with value: 0.37149077614042453.
[I 2025-12-09 01:18:45,786] Trial 39 finished with value: 0.3271499759664166 and parameters: {'model_type': 'graphsage', 'hidden_dims': '[512, 128]', 'dropout': 0.25698304455737886, 'batch_norm': True, 'sage_aggr': 'max', 'sage_normalize': False, 'sage_project': False, 'lr': 0.00037303164526664574, 'weight_decay': 9.006536805233195e-05, 'epochs': 197, 'loss': 'mae', 'optimizer': 'adam', 'graph_mode': 'knn', 'knn_k': 10, 'weighted_edges': False, 'symmetrize_mode': 'union', 'self_loops': True, 'use_snp_selection': False}. Best is trial 2 with value: 0.37149077614042453.
[I 2025-12-09 01:21:03,939] Trial 40 finished with value: 0.35290747303682474 and parameters: {'model_type': 'graphsage', 'hidden_dims': '[512, 256]', 'dropout': 0.41622680597568296, 'batch_norm': False, 'sage_aggr': 'mean', 'sage_normalize': True, 'sage_project': False, 'lr': 0.0005700582335468757, 'weight_decay': 0.00021991122227677185, 'epochs': 244, 'loss': 'mse', 'optimizer': 'adam', 'graph_mode': 'cutoff', 'cutoff': 0.531151976689702, 'grm_norm': 'none', 'self_loops': False, 'use_snp_selection': True, 'num_snps': 54658}. Best is trial 2 with value: 0.37149077614042453.
[I 2025-12-09 01:22:59,779] Trial 41 finished with value: 0.36823427645730655 and parameters: {'model_type': 'graphsage', 'hidden_dims': '[512, 128]', 'dropout': 0.17773258770789888, 'batch_norm': False, 'sage_aggr': 'max', 'sage_normalize': False, 'sage_project': False, 'lr': 4.677678555161209e-05, 'weight_decay': 0.00011134430510918782, 'epochs': 234, 'loss': 'mae', 'optimizer': 'adam', 'graph_mode': 'cutoff', 'cutoff': 0.3007650960760405, 'grm_norm': 'gcn', 'self_loops': False, 'use_snp_selection': True, 'num_snps': 30744}. Best is trial 2 with value: 0.37149077614042453.
[I 2025-12-09 01:24:49,212] Trial 42 finished with value: 0.37346390195074486 and parameters: {'model_type': 'graphsage', 'hidden_dims': '[512, 128]', 'dropout': 0.1526310919635266, 'batch_norm': False, 'sage_aggr': 'max', 'sage_normalize': False, 'sage_project': False, 'lr': 4.5479924896784536e-05, 'weight_decay': 0.00032530872439129105, 'epochs': 234, 'loss': 'mae', 'optimizer': 'adam', 'graph_mode': 'cutoff', 'cutoff': 0.366168190109343, 'grm_norm': 'gcn', 'self_loops': False, 'use_snp_selection': True, 'num_snps': 34364}. Best is trial 42 with value: 0.37346390195074486.
[I 2025-12-09 01:27:12,541] Trial 43 finished with value: 0.37086832771469735 and parameters: {'model_type': 'graphsage', 'hidden_dims': '[512, 128]', 'dropout': 0.13607236276289839, 'batch_norm': False, 'sage_aggr': 'max', 'sage_normalize': False, 'sage_project': False, 'lr': 7.373435791143479e-05, 'weight_decay': 0.0003764161586554759, 'epochs': 294, 'loss': 'mae', 'optimizer': 'adam', 'graph_mode': 'cutoff', 'cutoff': 0.31993695553712453, 'grm_norm': 'gcn', 'self_loops': False, 'use_snp_selection': True, 'num_snps': 34772}. Best is trial 42 with value: 0.37346390195074486.
[I 2025-12-09 01:29:47,368] Trial 44 finished with value: 0.367441951667565 and parameters: {'model_type': 'graphsage', 'hidden_dims': '[512, 128]', 'dropout': 0.132491983748389, 'batch_norm': False, 'sage_aggr': 'max', 'sage_normalize': False, 'sage_project': False, 'lr': 7.766295567752204e-05, 'weight_decay': 0.0006136239020764307, 'epochs': 295, 'loss': 'mae', 'optimizer': 'adam', 'graph_mode': 'cutoff', 'cutoff': 0.30868026045273195, 'grm_norm': 'gcn', 'self_loops': False, 'use_snp_selection': True, 'num_snps': 35113}. Best is trial 42 with value: 0.37346390195074486.
[I 2025-12-09 01:31:27,753] Trial 45 finished with value: 0.35618599558320485 and parameters: {'model_type': 'graphsage', 'hidden_dims': '[256, 128, 64]', 'dropout': 0.1698606019315813, 'batch_norm': False, 'sage_aggr': 'max', 'sage_normalize': False, 'sage_project': False, 'lr': 2.0583062900270295e-05, 'weight_decay': 0.0004487043790675772, 'epochs': 309, 'loss': 'mae', 'optimizer': 'adam', 'graph_mode': 'cutoff', 'cutoff': 0.36507221897307346, 'grm_norm': 'gcn', 'self_loops': False, 'use_snp_selection': True, 'num_snps': 30146}. Best is trial 42 with value: 0.37346390195074486.
[I 2025-12-09 01:33:33,211] Trial 46 finished with value: 0.3616413443126244 and parameters: {'model_type': 'graphsage', 'hidden_dims': '[512, 128]', 'dropout': 0.15163223654879657, 'batch_norm': False, 'sage_aggr': 'max', 'sage_normalize': False, 'sage_project': False, 'lr': 3.4898141821074934e-05, 'weight_decay': 0.0003245651483683134, 'epochs': 274, 'loss': 'mae', 'optimizer': 'adam', 'graph_mode': 'knn', 'knn_k': 4, 'weighted_edges': True, 'symmetrize_mode': 'mutual', 'self_loops': True, 'use_snp_selection': True, 'num_snps': 34140}. Best is trial 42 with value: 0.37346390195074486.
[I 2025-12-09 01:36:48,699] Trial 47 finished with value: 0.30974561860532324 and parameters: {'model_type': 'graphsage', 'hidden_dims': '[256, 128]', 'dropout': 0.17958644470683033, 'batch_norm': True, 'sage_aggr': 'max', 'sage_normalize': False, 'sage_project': False, 'lr': 1.5447523328378187e-05, 'weight_decay': 0.00021519091633791408, 'epochs': 346, 'loss': 'mse', 'optimizer': 'adam', 'graph_mode': 'cutoff', 'cutoff': 0.26385848369282644, 'grm_norm': 'gcn', 'self_loops': False, 'use_snp_selection': True, 'num_snps': 39428}. Best is trial 42 with value: 0.37346390195074486.
[I 2025-12-09 01:38:33,915] Trial 48 finished with value: 0.35211306250091357 and parameters: {'model_type': 'graphsage', 'hidden_dims': '[512, 256]', 'dropout': 0.10236226067354505, 'batch_norm': False, 'sage_aggr': 'mean', 'sage_normalize': True, 'sage_project': False, 'lr': 0.00011840395839244552, 'weight_decay': 0.0006062706785600592, 'epochs': 302, 'loss': 'mae', 'optimizer': 'adam', 'graph_mode': 'cutoff', 'cutoff': 0.3918790204648132, 'grm_norm': 'none', 'self_loops': False, 'use_snp_selection': True, 'num_snps': 27872}. Best is trial 42 with value: 0.37346390195074486.
[I 2025-12-09 01:40:01,977] Trial 49 finished with value: 0.367092297031456 and parameters: {'model_type': 'graphsage', 'hidden_dims': '[512, 64]', 'dropout': 0.12701960999357287, 'batch_norm': False, 'sage_aggr': 'max', 'sage_normalize': False, 'sage_project': False, 'lr': 7.867312230144841e-05, 'weight_decay': 5.001569995347663e-05, 'epochs': 255, 'loss': 'mae', 'optimizer': 'adam', 'graph_mode': 'cutoff', 'cutoff': 0.31701218409601917, 'grm_norm': 'gcn', 'self_loops': False, 'use_snp_selection': True, 'num_snps': 21931}. Best is trial 42 with value: 0.37346390195074486.
[I 2025-12-09 01:42:47,083] Trial 50 finished with value: 0.36814795379364174 and parameters: {'model_type': 'graphsage', 'hidden_dims': '[512, 128]', 'dropout': 0.2099865464762258, 'batch_norm': False, 'sage_aggr': 'max', 'sage_normalize': False, 'sage_project': False, 'lr': 2.7026114666675845e-05, 'weight_decay': 0.00028439463302215524, 'epochs': 328, 'loss': 'mae', 'optimizer': 'adam', 'graph_mode': 'cutoff', 'cutoff': 0.403621975081327, 'grm_norm': 'cosine_then_gcn', 'self_loops': False, 'use_snp_selection': False}. Best is trial 42 with value: 0.37346390195074486.
[I 2025-12-09 01:45:22,122] Trial 51 finished with value: 0.3653187703604909 and parameters: {'model_type': 'graphsage', 'hidden_dims': '[512, 128]', 'dropout': 0.2150210464199801, 'batch_norm': False, 'sage_aggr': 'max', 'sage_normalize': False, 'sage_project': False, 'lr': 1.0091710374159628e-05, 'weight_decay': 0.0003786093492067706, 'epochs': 316, 'loss': 'mae', 'optimizer': 'adam', 'graph_mode': 'cutoff', 'cutoff': 0.48127119395579143, 'grm_norm': 'cosine_then_gcn', 'self_loops': False, 'use_snp_selection': False}. Best is trial 42 with value: 0.37346390195074486.
[I 2025-12-09 01:47:46,982] Trial 52 finished with value: 0.37206225210080657 and parameters: {'model_type': 'graphsage', 'hidden_dims': '[512, 128]', 'dropout': 0.19534362337919023, 'batch_norm': False, 'sage_aggr': 'max', 'sage_normalize': False, 'sage_project': False, 'lr': 3.041512751466617e-05, 'weight_decay': 0.00017296572907049234, 'epochs': 283, 'loss': 'mae', 'optimizer': 'adam', 'graph_mode': 'cutoff', 'cutoff': 0.3927308171253142, 'grm_norm': 'cosine_then_gcn', 'self_loops': False, 'use_snp_selection': False}. Best is trial 42 with value: 0.37346390195074486.
[I 2025-12-09 01:50:12,834] Trial 53 finished with value: 0.3648822450678382 and parameters: {'model_type': 'graphsage', 'hidden_dims': '[512, 128]', 'dropout': 0.1871251820518584, 'batch_norm': False, 'sage_aggr': 'max', 'sage_normalize': False, 'sage_project': False, 'lr': 4.184130271474125e-05, 'weight_decay': 0.00017524293939797107, 'epochs': 279, 'loss': 'mae', 'optimizer': 'adam', 'graph_mode': 'cutoff', 'cutoff': 0.3575504773084785, 'grm_norm': 'cosine_then_gcn', 'self_loops': False, 'use_snp_selection': False}. Best is trial 42 with value: 0.37346390195074486.
[I 2025-12-09 01:52:40,022] Trial 54 finished with value: 0.3491791516505438 and parameters: {'model_type': 'graphsage', 'hidden_dims': '[512, 128]', 'dropout': 0.15164883812307667, 'batch_norm': False, 'sage_aggr': 'max', 'sage_normalize': False, 'sage_project': False, 'lr': 1.830327660045588e-05, 'weight_decay': 0.0005854848472559143, 'epochs': 242, 'loss': 'mae', 'optimizer': 'adam', 'graph_mode': 'cutoff', 'cutoff': 0.27885481192907646, 'grm_norm': 'cosine_then_gcn', 'self_loops': False, 'use_snp_selection': False}. Best is trial 42 with value: 0.37346390195074486.
[I 2025-12-09 01:55:15,581] Trial 55 finished with value: 0.3556586656369345 and parameters: {'model_type': 'graphsage', 'hidden_dims': '[512, 256]', 'dropout': 0.12312510601292971, 'batch_norm': False, 'sage_aggr': 'max', 'sage_normalize': False, 'sage_project': False, 'lr': 6.267979837285027e-05, 'weight_decay': 1.2173289457998933e-07, 'epochs': 288, 'loss': 'mae', 'optimizer': 'adam', 'graph_mode': 'cutoff', 'cutoff': 0.3395646443742746, 'grm_norm': 'gcn', 'self_loops': False, 'use_snp_selection': False}. Best is trial 42 with value: 0.37346390195074486.
[I 2025-12-09 01:58:51,834] Trial 56 finished with value: 0.3757564664956564 and parameters: {'model_type': 'graphsage', 'hidden_dims': '[512, 128]', 'dropout': 0.1679542427380969, 'batch_norm': False, 'sage_aggr': 'max', 'sage_normalize': False, 'sage_project': False, 'lr': 4.5352009467664874e-05, 'weight_decay': 9.603107203445294e-05, 'epochs': 266, 'loss': 'mae', 'optimizer': 'adam', 'graph_mode': 'knn', 'knn_k': 7, 'weighted_edges': False, 'symmetrize_mode': 'union', 'self_loops': False, 'use_snp_selection': True, 'num_snps': 41048}. Best is trial 56 with value: 0.3757564664956564.
[I 2025-12-09 02:02:41,618] Trial 57 finished with value: 0.37210369181415703 and parameters: {'model_type': 'graphsage', 'hidden_dims': '[512, 128]', 'dropout': 0.15726012927615973, 'batch_norm': False, 'sage_aggr': 'max', 'sage_normalize': False, 'sage_project': False, 'lr': 2.51111694011813e-05, 'weight_decay': 9.684251945175806e-05, 'epochs': 266, 'loss': 'mae', 'optimizer': 'adam', 'graph_mode': 'knn', 'knn_k': 7, 'weighted_edges': False, 'symmetrize_mode': 'union', 'self_loops': True, 'use_snp_selection': True, 'num_snps': 41195}. Best is trial 56 with value: 0.3757564664956564.
[I 2025-12-09 02:06:06,972] Trial 58 finished with value: 0.3645178730648756 and parameters: {'model_type': 'graphsage', 'hidden_dims': '[256, 128]', 'dropout': 0.1622916887490481, 'batch_norm': False, 'sage_aggr': 'max', 'sage_normalize': False, 'sage_project': False, 'lr': 2.5662617275215964e-05, 'weight_decay': 4.225570396610089e-05, 'epochs': 269, 'loss': 'mse', 'optimizer': 'adam', 'graph_mode': 'knn', 'knn_k': 7, 'weighted_edges': False, 'symmetrize_mode': 'union', 'self_loops': True, 'use_snp_selection': True, 'num_snps': 41341}. Best is trial 56 with value: 0.3757564664956564.
[I 2025-12-09 02:08:03,638] Trial 59 finished with value: 0.3566817561769882 and parameters: {'model_type': 'graphsage', 'hidden_dims': '[512, 128]', 'dropout': 0.24830596576582564, 'batch_norm': False, 'sage_aggr': 'mean', 'sage_normalize': False, 'sage_project': False, 'lr': 3.4638959215841274e-05, 'weight_decay': 9.684790382195046e-05, 'epochs': 138, 'loss': 'mae', 'optimizer': 'adam', 'graph_mode': 'knn', 'knn_k': 8, 'weighted_edges': False, 'symmetrize_mode': 'union', 'self_loops': True, 'use_snp_selection': False}. Best is trial 56 with value: 0.3757564664956564.
[I 2025-12-09 02:12:53,560] Trial 60 finished with value: 0.3736494799610951 and parameters: {'model_type': 'graphsage', 'hidden_dims': '[512, 256]', 'dropout': 0.14252254198499126, 'batch_norm': False, 'sage_aggr': 'max', 'sage_normalize': False, 'sage_project': False, 'lr': 4.921382863896211e-05, 'weight_decay': 2.036494699016618e-05, 'epochs': 300, 'loss': 'mae', 'optimizer': 'adam', 'graph_mode': 'knn', 'knn_k': 6, 'weighted_edges': False, 'symmetrize_mode': 'union', 'self_loops': True, 'use_snp_selection': True, 'num_snps': 48095}. Best is trial 56 with value: 0.3757564664956564.
[I 2025-12-09 02:17:39,640] Trial 61 finished with value: 0.3791757429495376 and parameters: {'model_type': 'graphsage', 'hidden_dims': '[512, 256]', 'dropout': 0.1467498398978, 'batch_norm': False, 'sage_aggr': 'max', 'sage_normalize': False, 'sage_project': False, 'lr': 7.162698857886992e-05, 'weight_decay': 1.3593684424356074e-05, 'epochs': 302, 'loss': 'mae', 'optimizer': 'adam', 'graph_mode': 'knn', 'knn_k': 6, 'weighted_edges': False, 'symmetrize_mode': 'union', 'self_loops': True, 'use_snp_selection': True, 'num_snps': 47332}. Best is trial 61 with value: 0.3791757429495376.
[I 2025-12-09 02:22:46,400] Trial 62 finished with value: 0.3762932437270178 and parameters: {'model_type': 'graphsage', 'hidden_dims': '[512, 256]', 'dropout': 0.19350188544184044, 'batch_norm': False, 'sage_aggr': 'max', 'sage_normalize': False, 'sage_project': False, 'lr': 9.643015291975144e-05, 'weight_decay': 5.403708415123251e-06, 'epochs': 307, 'loss': 'mae', 'optimizer': 'adam', 'graph_mode': 'knn', 'knn_k': 6, 'weighted_edges': False, 'symmetrize_mode': 'union', 'self_loops': True, 'use_snp_selection': True, 'num_snps': 49544}. Best is trial 61 with value: 0.3791757429495376.
[I 2025-12-09 02:27:53,405] Trial 63 finished with value: 0.36927142002104263 and parameters: {'model_type': 'graphsage', 'hidden_dims': '[512, 256]', 'dropout': 0.19196642868424338, 'batch_norm': False, 'sage_aggr': 'max', 'sage_normalize': False, 'sage_project': False, 'lr': 0.00010404658781467695, 'weight_decay': 5.3590682887604e-06, 'epochs': 325, 'loss': 'mae', 'optimizer': 'adam', 'graph_mode': 'knn', 'knn_k': 6, 'weighted_edges': False, 'symmetrize_mode': 'union', 'self_loops': True, 'use_snp_selection': True, 'num_snps': 47694}. Best is trial 61 with value: 0.3791757429495376.
[I 2025-12-09 02:33:18,689] Trial 64 finished with value: 0.37014641856154273 and parameters: {'model_type': 'graphsage', 'hidden_dims': '[512, 256]', 'dropout': 0.15642444694402297, 'batch_norm': False, 'sage_aggr': 'max', 'sage_normalize': False, 'sage_project': False, 'lr': 4.923521601999606e-05, 'weight_decay': 1.5026477005323575e-06, 'epochs': 303, 'loss': 'mae', 'optimizer': 'adam', 'graph_mode': 'knn', 'knn_k': 7, 'weighted_edges': False, 'symmetrize_mode': 'union', 'self_loops': True, 'use_snp_selection': True, 'num_snps': 48691}. Best is trial 61 with value: 0.3791757429495376.
[I 2025-12-09 02:37:25,393] Trial 65 finished with value: 0.3754795977077988 and parameters: {'model_type': 'graphsage', 'hidden_dims': '[512, 256]', 'dropout': 0.16909815318777724, 'batch_norm': False, 'sage_aggr': 'max', 'sage_normalize': False, 'sage_project': False, 'lr': 3.3309650925999654e-05, 'weight_decay': 2.2594844121232962e-05, 'epochs': 251, 'loss': 'mae', 'optimizer': 'adam', 'graph_mode': 'knn', 'knn_k': 5, 'weighted_edges': False, 'symmetrize_mode': 'union', 'self_loops': True, 'use_snp_selection': True, 'num_snps': 51839}. Best is trial 61 with value: 0.3791757429495376.
[I 2025-12-09 02:41:37,229] Trial 66 finished with value: 0.36838588418609625 and parameters: {'model_type': 'graphsage', 'hidden_dims': '[512, 256]', 'dropout': 0.1719098520670242, 'batch_norm': False, 'sage_aggr': 'max', 'sage_normalize': False, 'sage_project': False, 'lr': 0.0001406938418978855, 'weight_decay': 2.2610013616630002e-05, 'epochs': 254, 'loss': 'mae', 'optimizer': 'adam', 'graph_mode': 'knn', 'knn_k': 5, 'weighted_edges': False, 'symmetrize_mode': 'union', 'self_loops': True, 'use_snp_selection': True, 'num_snps': 51810}. Best is trial 61 with value: 0.3791757429495376.
[I 2025-12-09 02:45:49,374] Trial 67 finished with value: 0.3788998270293199 and parameters: {'model_type': 'graphsage', 'hidden_dims': '[512, 256]', 'dropout': 0.15115111499604955, 'batch_norm': False, 'sage_aggr': 'max', 'sage_normalize': False, 'sage_project': False, 'lr': 7.03619224135421e-05, 'weight_decay': 1.3309447695356806e-05, 'epochs': 308, 'loss': 'mae', 'optimizer': 'adam', 'graph_mode': 'knn', 'knn_k': 5, 'weighted_edges': False, 'symmetrize_mode': 'union', 'self_loops': True, 'use_snp_selection': True, 'num_snps': 45795}. Best is trial 61 with value: 0.3791757429495376.
[I 2025-12-09 02:50:20,498] Trial 68 finished with value: 0.35811808190956923 and parameters: {'model_type': 'graphsage', 'hidden_dims': '[512, 256]', 'dropout': 0.13807638771852407, 'batch_norm': True, 'sage_aggr': 'max', 'sage_normalize': True, 'sage_project': False, 'lr': 0.0002287393665163346, 'weight_decay': 6.2190386252023374e-06, 'epochs': 334, 'loss': 'mae', 'optimizer': 'adam', 'graph_mode': 'knn', 'knn_k': 5, 'weighted_edges': False, 'symmetrize_mode': 'union', 'self_loops': True, 'use_snp_selection': True, 'num_snps': 46153}. Best is trial 61 with value: 0.3791757429495376.
[I 2025-12-09 02:55:56,783] Trial 69 finished with value: 0.3599191718018421 and parameters: {'model_type': 'graphsage', 'hidden_dims': '[512, 256]', 'dropout': 0.1158982427021753, 'batch_norm': False, 'sage_aggr': 'max', 'sage_normalize': False, 'sage_project': False, 'lr': 6.702440347445793e-05, 'weight_decay': 3.344833545206115e-06, 'epochs': 308, 'loss': 'mae', 'optimizer': 'adam', 'graph_mode': 'knn', 'knn_k': 6, 'weighted_edges': False, 'symmetrize_mode': 'union', 'self_loops': True, 'use_snp_selection': True, 'num_snps': 54832}. Best is trial 61 with value: 0.3791757429495376.
[I 2025-12-09 03:01:07,363] Trial 70 finished with value: 0.35919458283009037 and parameters: {'model_type': 'graphsage', 'hidden_dims': '[512, 256]', 'dropout': 0.14465528660572433, 'batch_norm': False, 'sage_aggr': 'max', 'sage_normalize': False, 'sage_project': False, 'lr': 9.87301142633799e-05, 'weight_decay': 9.434144534540611e-06, 'epochs': 344, 'loss': 'mae', 'optimizer': 'adam', 'graph_mode': 'knn', 'knn_k': 5, 'weighted_edges': False, 'symmetrize_mode': 'union', 'self_loops': True, 'use_snp_selection': True, 'num_snps': 49482}. Best is trial 61 with value: 0.3791757429495376.
[I 2025-12-09 03:05:14,760] Trial 71 finished with value: 0.3776573739486388 and parameters: {'model_type': 'graphsage', 'hidden_dims': '[512, 256]', 'dropout': 0.17372501358969306, 'batch_norm': False, 'sage_aggr': 'max', 'sage_normalize': False, 'sage_project': False, 'lr': 4.063101371669157e-05, 'weight_decay': 1.1743994814908045e-05, 'epochs': 248, 'loss': 'mae', 'optimizer': 'adam', 'graph_mode': 'knn', 'knn_k': 7, 'weighted_edges': False, 'symmetrize_mode': 'union', 'self_loops': True, 'use_snp_selection': True, 'num_snps': 43801}. Best is trial 61 with value: 0.3791757429495376.
[I 2025-12-09 03:08:51,956] Trial 72 finished with value: 0.38017846584785514 and parameters: {'model_type': 'graphsage', 'hidden_dims': '[512, 256]', 'dropout': 0.22272552257379508, 'batch_norm': False, 'sage_aggr': 'max', 'sage_normalize': False, 'sage_project': False, 'lr': 5.220435733417376e-05, 'weight_decay': 1.3590925757445914e-05, 'epochs': 231, 'loss': 'mae', 'optimizer': 'adam', 'graph_mode': 'knn', 'knn_k': 6, 'weighted_edges': False, 'symmetrize_mode': 'union', 'self_loops': True, 'use_snp_selection': True, 'num_snps': 43787}. Best is trial 72 with value: 0.38017846584785514.
