[I 2025-12-09 21:20:44,010] Trial 107 finished with value: 0.30355454337966675 and parameters: {'model_type': 'graphsage', 'hidden_dims': '[512, 64]', 'dropout': 0.22208258366774825, 'batch_norm': False, 'sage_aggr': 'max', 'sage_normalize': False, 'sage_project': False, 'lr': 1.8902122428661426e-05, 'weight_decay': 2.5280701853159604e-05, 'epochs': 84, 'loss': 'mse', 'optimizer': 'adam', 'graph_mode': 'cutoff', 'cutoff': 0.4334854181154379, 'grm_norm': 'cosine_then_gcn', 'self_loops': False, 'use_snp_selection': True, 'num_snps': 24261}. Best is trial 102 with value: 0.30628442229414143.
[I 2025-12-09 21:21:41,782] Trial 108 finished with value: 0.2966980144470046 and parameters: {'model_type': 'graphsage', 'hidden_dims': '[512, 64]', 'dropout': 0.1877968846149722, 'batch_norm': False, 'sage_aggr': 'max', 'sage_normalize': False, 'sage_project': False, 'lr': 1.9570102060831077e-05, 'weight_decay': 2.2878831385018772e-05, 'epochs': 84, 'loss': 'mse', 'optimizer': 'adam', 'graph_mode': 'cutoff', 'cutoff': 0.36471544518451765, 'grm_norm': 'cosine_then_gcn', 'self_loops': False, 'use_snp_selection': True, 'num_snps': 24054}. Best is trial 102 with value: 0.30628442229414143.
[I 2025-12-09 21:22:20,725] Trial 109 finished with value: 0.2971024293372887 and parameters: {'model_type': 'graphsage', 'hidden_dims': '[512, 64]', 'dropout': 0.20519845306879483, 'batch_norm': False, 'sage_aggr': 'mean', 'sage_normalize': False, 'sage_project': False, 'lr': 1.1635291111930199e-05, 'weight_decay': 1.3921677211618344e-05, 'epochs': 63, 'loss': 'mse', 'optimizer': 'adam', 'graph_mode': 'cutoff', 'cutoff': 0.4122809444385832, 'grm_norm': 'cosine_then_gcn', 'self_loops': False, 'use_snp_selection': True, 'num_snps': 17510}. Best is trial 102 with value: 0.30628442229414143.
[I 2025-12-09 21:23:15,634] Trial 110 finished with value: 0.28657449242637095 and parameters: {'model_type': 'graphsage', 'hidden_dims': '[512, 64]', 'dropout': 0.12104507793592012, 'batch_norm': False, 'sage_aggr': 'max', 'sage_normalize': False, 'sage_project': False, 'lr': 1.330136502148847e-05, 'weight_decay': 3.339567030802513e-05, 'epochs': 112, 'loss': 'mae', 'optimizer': 'adam', 'graph_mode': 'cutoff', 'cutoff': 0.3485387510171358, 'grm_norm': 'cosine_then_gcn', 'self_loops': False, 'use_snp_selection': True, 'num_snps': 19053}. Best is trial 102 with value: 0.30628442229414143.
[I 2025-12-09 21:24:22,722] Trial 111 finished with value: 0.30024688601873345 and parameters: {'model_type': 'graphsage', 'hidden_dims': '[512, 64]', 'dropout': 0.22163070658661918, 'batch_norm': False, 'sage_aggr': 'max', 'sage_normalize': False, 'sage_project': False, 'lr': 2.1350753628092522e-05, 'weight_decay': 7.558673994664399e-06, 'epochs': 119, 'loss': 'mse', 'optimizer': 'adam', 'graph_mode': 'cutoff', 'cutoff': 0.4133869615887208, 'grm_norm': 'cosine_then_gcn', 'self_loops': False, 'use_snp_selection': True, 'num_snps': 24222}. Best is trial 102 with value: 0.30628442229414143.
[I 2025-12-09 21:25:28,266] Trial 112 finished with value: 0.3013184328189309 and parameters: {'model_type': 'graphsage', 'hidden_dims': '[512, 64]', 'dropout': 0.22490391372953827, 'batch_norm': False, 'sage_aggr': 'max', 'sage_normalize': False, 'sage_project': False, 'lr': 1.544504661419859e-05, 'weight_decay': 3.620068434094552e-05, 'epochs': 98, 'loss': 'mse', 'optimizer': 'adam', 'graph_mode': 'cutoff', 'cutoff': 0.43599605367446886, 'grm_norm': 'cosine_then_gcn', 'self_loops': False, 'use_snp_selection': True, 'num_snps': 26940}. Best is trial 102 with value: 0.30628442229414143.
[I 2025-12-09 21:26:23,497] Trial 113 finished with value: 0.2940513743572245 and parameters: {'model_type': 'graphsage', 'hidden_dims': '[512, 64]', 'dropout': 0.26664924856371974, 'batch_norm': False, 'sage_aggr': 'max', 'sage_normalize': False, 'sage_project': False, 'lr': 1.531597039809693e-05, 'weight_decay': 1.8520444662125977e-05, 'epochs': 71, 'loss': 'mse', 'optimizer': 'adam', 'graph_mode': 'cutoff', 'cutoff': 0.4442462107732225, 'grm_norm': 'cosine_then_gcn', 'self_loops': False, 'use_snp_selection': True, 'num_snps': 26822}. Best is trial 102 with value: 0.30628442229414143.
[I 2025-12-09 21:27:24,074] Trial 114 finished with value: 0.28986488362188056 and parameters: {'model_type': 'graphsage', 'hidden_dims': '[512, 64]', 'dropout': 0.17081525820709195, 'batch_norm': False, 'sage_aggr': 'max', 'sage_normalize': False, 'sage_project': False, 'lr': 1.839949752636186e-05, 'weight_decay': 2.7649313592738256e-05, 'epochs': 96, 'loss': 'mse', 'optimizer': 'adam', 'graph_mode': 'cutoff', 'cutoff': 0.5229172298728536, 'grm_norm': 'cosine_then_gcn', 'self_loops': False, 'use_snp_selection': True, 'num_snps': 30997}. Best is trial 102 with value: 0.30628442229414143.
[I 2025-12-09 21:28:35,716] Trial 115 finished with value: 0.298506479465943 and parameters: {'model_type': 'graphsage', 'hidden_dims': '[512, 64]', 'dropout': 0.16590727379668094, 'batch_norm': False, 'sage_aggr': 'max', 'sage_normalize': False, 'sage_project': False, 'lr': 1.1727398629838894e-05, 'weight_decay': 1.919434249474208e-05, 'epochs': 110, 'loss': 'mse', 'optimizer': 'adam', 'graph_mode': 'cutoff', 'cutoff': 0.3958938674826262, 'grm_norm': 'cosine_then_gcn', 'self_loops': False, 'use_snp_selection': True, 'num_snps': 26415}. Best is trial 102 with value: 0.30628442229414143.
[I 2025-12-09 21:29:18,735] Trial 116 finished with value: 0.2891844980403727 and parameters: {'model_type': 'graphsage', 'hidden_dims': '[512, 64]', 'dropout': 0.2322751940173951, 'batch_norm': False, 'sage_aggr': 'max', 'sage_normalize': False, 'sage_project': False, 'lr': 1.3964419347535992e-05, 'weight_decay': 1.2551280306618122e-05, 'epochs': 78, 'loss': 'mse', 'optimizer': 'adam', 'graph_mode': 'cutoff', 'cutoff': 0.6026052095584162, 'grm_norm': 'cosine', 'self_loops': False, 'use_snp_selection': True, 'num_snps': 21484}. Best is trial 102 with value: 0.30628442229414143.
[I 2025-12-09 21:30:27,295] Trial 117 finished with value: 0.2839292849225691 and parameters: {'model_type': 'graphsage', 'hidden_dims': '[512, 64]', 'dropout': 0.25798077977570094, 'batch_norm': False, 'sage_aggr': 'max', 'sage_normalize': True, 'sage_project': False, 'lr': 1.702533431477071e-05, 'weight_decay': 3.623628698055572e-05, 'epochs': 99, 'loss': 'mse', 'optimizer': 'adam', 'graph_mode': 'cutoff', 'cutoff': 0.46116693115321694, 'grm_norm': 'cosine_then_gcn', 'self_loops': False, 'use_snp_selection': True, 'num_snps': 28178}. Best is trial 102 with value: 0.30628442229414143.
[I 2025-12-09 21:31:38,708] Trial 118 finished with value: 0.2556932121415456 and parameters: {'model_type': 'graphsage', 'hidden_dims': '[512, 64]', 'dropout': 0.2819099464766147, 'batch_norm': True, 'sage_aggr': 'max', 'sage_normalize': False, 'sage_project': False, 'lr': 2.3486284887188406e-05, 'weight_decay': 2.134596158350145e-05, 'epochs': 91, 'loss': 'mse', 'optimizer': 'adam', 'graph_mode': 'cutoff', 'cutoff': 0.43377000849850367, 'grm_norm': 'cosine_then_gcn', 'self_loops': False, 'use_snp_selection': True, 'num_snps': 29419}. Best is trial 102 with value: 0.30628442229414143.
[I 2025-12-09 21:33:03,492] Trial 119 finished with value: 0.27164501381264816 and parameters: {'model_type': 'graphsage', 'hidden_dims': '[512, 64]', 'dropout': 0.2904912911487569, 'batch_norm': False, 'sage_aggr': 'max', 'sage_normalize': False, 'sage_project': False, 'lr': 1.0413928063827734e-05, 'weight_decay': 5.204421239876426e-05, 'epochs': 106, 'loss': 'mse', 'optimizer': 'adam', 'graph_mode': 'cutoff', 'cutoff': 0.3613798526518928, 'grm_norm': 'cosine_then_gcn', 'self_loops': False, 'use_snp_selection': False}. Best is trial 102 with value: 0.30628442229414143.
[I 2025-12-09 21:34:13,366] Trial 120 finished with value: 0.3013205682387109 and parameters: {'model_type': 'graphsage', 'hidden_dims': '[512, 64]', 'dropout': 0.21666542505997233, 'batch_norm': False, 'sage_aggr': 'max', 'sage_normalize': False, 'sage_project': False, 'lr': 1.9955066309291745e-05, 'weight_decay': 2.763793416092688e-05, 'epochs': 134, 'loss': 'mse', 'optimizer': 'adam', 'graph_mode': 'cutoff', 'cutoff': 0.3969647170846344, 'grm_norm': 'gcn', 'self_loops': False, 'use_snp_selection': True, 'num_snps': 22703}. Best is trial 102 with value: 0.30628442229414143.
[I 2025-12-09 21:35:24,426] Trial 121 finished with value: 0.30582977120357163 and parameters: {'model_type': 'graphsage', 'hidden_dims': '[512, 64]', 'dropout': 0.2143713478670665, 'batch_norm': False, 'sage_aggr': 'max', 'sage_normalize': False, 'sage_project': False, 'lr': 2.006111436365852e-05, 'weight_decay': 2.9103118630894278e-05, 'epochs': 145, 'loss': 'mse', 'optimizer': 'adam', 'graph_mode': 'cutoff', 'cutoff': 0.391431244205571, 'grm_norm': 'gcn', 'self_loops': False, 'use_snp_selection': True, 'num_snps': 22137}. Best is trial 102 with value: 0.30628442229414143.
[I 2025-12-09 21:36:45,364] Trial 122 finished with value: 0.30762353460187775 and parameters: {'model_type': 'graphsage', 'hidden_dims': '[512, 64]', 'dropout': 0.21473471751194362, 'batch_norm': False, 'sage_aggr': 'max', 'sage_normalize': False, 'sage_project': False, 'lr': 2.0323306244687407e-05, 'weight_decay': 2.6680647145464233e-05, 'epochs': 145, 'loss': 'mse', 'optimizer': 'adam', 'graph_mode': 'cutoff', 'cutoff': 0.37965749628045037, 'grm_norm': 'gcn', 'self_loops': False, 'use_snp_selection': True, 'num_snps': 24607}. Best is trial 122 with value: 0.30762353460187775.
[I 2025-12-09 21:38:11,930] Trial 123 finished with value: 0.29921689916013705 and parameters: {'model_type': 'graphsage', 'hidden_dims': '[512, 64]', 'dropout': 0.1918120265899706, 'batch_norm': False, 'sage_aggr': 'max', 'sage_normalize': False, 'sage_project': False, 'lr': 2.2333937682370133e-05, 'weight_decay': 2.8106251416625828e-05, 'epochs': 145, 'loss': 'mse', 'optimizer': 'adam', 'graph_mode': 'cutoff', 'cutoff': 0.31888885378289217, 'grm_norm': 'gcn', 'self_loops': False, 'use_snp_selection': True, 'num_snps': 22788}. Best is trial 122 with value: 0.30762353460187775.
[I 2025-12-09 21:39:27,809] Trial 124 finished with value: 0.3019501313534222 and parameters: {'model_type': 'graphsage', 'hidden_dims': '[512, 64]', 'dropout': 0.21121380074231613, 'batch_norm': False, 'sage_aggr': 'max', 'sage_normalize': False, 'sage_project': False, 'lr': 1.9534027596553152e-05, 'weight_decay': 1.7523376557085844e-05, 'epochs': 133, 'loss': 'mse', 'optimizer': 'adam', 'graph_mode': 'cutoff', 'cutoff': 0.3757939192333761, 'grm_norm': 'gcn', 'self_loops': False, 'use_snp_selection': True, 'num_snps': 24264}. Best is trial 122 with value: 0.30762353460187775.
[I 2025-12-09 21:40:50,370] Trial 125 finished with value: 0.3003902373364887 and parameters: {'model_type': 'graphsage', 'hidden_dims': '[512, 64]', 'dropout': 0.20638547423418174, 'batch_norm': False, 'sage_aggr': 'max', 'sage_normalize': False, 'sage_project': False, 'lr': 2.4752825847067306e-05, 'weight_decay': 1.1734870746973072e-05, 'epochs': 145, 'loss': 'mse', 'optimizer': 'adam', 'graph_mode': 'cutoff', 'cutoff': 0.3681013713578748, 'grm_norm': 'gcn', 'self_loops': False, 'use_snp_selection': True, 'num_snps': 24513}. Best is trial 122 with value: 0.30762353460187775.
[I 2025-12-09 21:41:53,016] Trial 126 finished with value: 0.29964064414432773 and parameters: {'model_type': 'graphsage', 'hidden_dims': '[512, 64]', 'dropout': 0.1856750515403396, 'batch_norm': False, 'sage_aggr': 'max', 'sage_normalize': False, 'sage_project': False, 'lr': 1.784830732932137e-05, 'weight_decay': 1.5556492458760492e-05, 'epochs': 135, 'loss': 'mse', 'optimizer': 'adam', 'graph_mode': 'cutoff', 'cutoff': 0.3429086149364442, 'grm_norm': 'gcn', 'self_loops': False, 'use_snp_selection': True, 'num_snps': 19402}. Best is trial 122 with value: 0.30762353460187775.
[I 2025-12-09 21:42:40,910] Trial 127 finished with value: 0.0 and parameters: {'model_type': 'graphsage', 'hidden_dims': '[512, 64]', 'dropout': 0.16138925920751468, 'batch_norm': False, 'sage_aggr': 'max', 'sage_normalize': False, 'sage_project': False, 'lr': 0.0036619770224357905, 'weight_decay': 1.6434402481746406e-05, 'epochs': 117, 'loss': 'mse', 'optimizer': 'adam', 'graph_mode': 'cutoff', 'cutoff': 0.38517096334562434, 'grm_norm': 'gcn', 'self_loops': False, 'use_snp_selection': True, 'num_snps': 15498}. Best is trial 122 with value: 0.30762353460187775.
[I 2025-12-09 21:44:18,740] Trial 128 finished with value: 0.29406055157244015 and parameters: {'model_type': 'graphsage', 'hidden_dims': '[512, 64]', 'dropout': 0.24167996938362057, 'batch_norm': False, 'sage_aggr': 'max', 'sage_normalize': False, 'sage_project': False, 'lr': 2.6965684391620182e-05, 'weight_decay': 2.17246363691194e-05, 'epochs': 129, 'loss': 'mse', 'optimizer': 'adam', 'graph_mode': 'cutoff', 'cutoff': 0.29938988939853156, 'grm_norm': 'gcn', 'self_loops': False, 'use_snp_selection': True, 'num_snps': 25464}. Best is trial 122 with value: 0.30762353460187775.
[I 2025-12-09 21:45:21,837] Trial 129 finished with value: 0.29857469925230534 and parameters: {'model_type': 'graphsage', 'hidden_dims': '[512, 64]', 'dropout': 0.23080430010111022, 'batch_norm': False, 'sage_aggr': 'max', 'sage_normalize': False, 'sage_project': False, 'lr': 2.0707588458614356e-05, 'weight_decay': 4.348409181679817e-05, 'epochs': 151, 'loss': 'mse', 'optimizer': 'adam', 'graph_mode': 'cutoff', 'cutoff': 0.484595909670111, 'grm_norm': 'gcn', 'self_loops': False, 'use_snp_selection': True, 'num_snps': 20282}. Best is trial 122 with value: 0.30762353460187775.
[I 2025-12-09 21:46:24,967] Trial 130 finished with value: 0.29269312970949335 and parameters: {'model_type': 'graphsage', 'hidden_dims': '[512, 64]', 'dropout': 0.19904131873748312, 'batch_norm': False, 'sage_aggr': 'mean', 'sage_normalize': False, 'sage_project': False, 'lr': 1.2539541383020883e-05, 'weight_decay': 9.796220844633732e-06, 'epochs': 139, 'loss': 'mse', 'optimizer': 'adam', 'graph_mode': 'cutoff', 'cutoff': 0.429863743058818, 'grm_norm': 'cosine', 'self_loops': False, 'use_snp_selection': True, 'num_snps': 21545}. Best is trial 122 with value: 0.30762353460187775.
[I 2025-12-09 21:47:34,258] Trial 131 finished with value: 0.2977164504499704 and parameters: {'model_type': 'graphsage', 'hidden_dims': '[512, 64]', 'dropout': 0.2144342260650592, 'batch_norm': False, 'sage_aggr': 'max', 'sage_normalize': False, 'sage_project': False, 'lr': 1.9181743547606567e-05, 'weight_decay': 2.6986556077881633e-05, 'epochs': 134, 'loss': 'mse', 'optimizer': 'adam', 'graph_mode': 'cutoff', 'cutoff': 0.39971732865695253, 'grm_norm': 'gcn', 'self_loops': False, 'use_snp_selection': True, 'num_snps': 22820}. Best is trial 122 with value: 0.30762353460187775.
[I 2025-12-09 21:48:46,511] Trial 132 finished with value: 0.3038383637769254 and parameters: {'model_type': 'graphsage', 'hidden_dims': '[512, 64]', 'dropout': 0.2169008223224846, 'batch_norm': False, 'sage_aggr': 'max', 'sage_normalize': False, 'sage_project': False, 'lr': 1.9526030291965804e-05, 'weight_decay': 2.9718540925293668e-05, 'epochs': 120, 'loss': 'mse', 'optimizer': 'adam', 'graph_mode': 'cutoff', 'cutoff': 0.3799925405496973, 'grm_norm': 'gcn', 'self_loops': False, 'use_snp_selection': True, 'num_snps': 24360}. Best is trial 122 with value: 0.30762353460187775.
[I 2025-12-09 21:49:55,163] Trial 133 finished with value: 0.30226668349802843 and parameters: {'model_type': 'graphsage', 'hidden_dims': '[512, 64]', 'dropout': 0.25262482783489276, 'batch_norm': False, 'sage_aggr': 'max', 'sage_normalize': False, 'sage_project': False, 'lr': 2.387206729713406e-05, 'weight_decay': 3.0513776545546854e-05, 'epochs': 116, 'loss': 'mse', 'optimizer': 'adam', 'graph_mode': 'cutoff', 'cutoff': 0.37731444975994044, 'grm_norm': 'gcn', 'self_loops': False, 'use_snp_selection': True, 'num_snps': 23985}. Best is trial 122 with value: 0.30762353460187775.
[I 2025-12-09 21:51:15,302] Trial 134 finished with value: 0.29837850974521907 and parameters: {'model_type': 'graphsage', 'hidden_dims': '[512, 64]', 'dropout': 0.20463657379026642, 'batch_norm': False, 'sage_aggr': 'max', 'sage_normalize': False, 'sage_project': False, 'lr': 3.1794060048607716e-05, 'weight_decay': 3.1174960899304404e-05, 'epochs': 121, 'loss': 'mse', 'optimizer': 'adam', 'graph_mode': 'cutoff', 'cutoff': 0.3727282336056552, 'grm_norm': 'gcn', 'self_loops': False, 'use_snp_selection': True, 'num_snps': 25906}. Best is trial 122 with value: 0.30762353460187775.
[I 2025-12-09 21:52:31,847] Trial 135 finished with value: 0.2884999945555112 and parameters: {'model_type': 'graphsage', 'hidden_dims': '[512, 64]', 'dropout': 0.22091091900598764, 'batch_norm': False, 'sage_aggr': 'max', 'sage_normalize': False, 'sage_project': False, 'lr': 2.4053191061470212e-05, 'weight_decay': 4.097830982813856e-05, 'epochs': 109, 'loss': 'mse', 'optimizer': 'adam', 'graph_mode': 'cutoff', 'cutoff': 0.3214145785868183, 'grm_norm': 'gcn', 'self_loops': False, 'use_snp_selection': True, 'num_snps': 24511}. Best is trial 122 with value: 0.30762353460187775.
[I 2025-12-09 21:53:53,928] Trial 136 finished with value: 0.3010991653904316 and parameters: {'model_type': 'graphsage', 'hidden_dims': '[512, 64]', 'dropout': 0.234961097322596, 'batch_norm': False, 'sage_aggr': 'max', 'sage_normalize': False, 'sage_project': False, 'lr': 1.7444233566521112e-05, 'weight_decay': 5.5296920288530874e-05, 'epochs': 115, 'loss': 'mse', 'optimizer': 'adam', 'graph_mode': 'cutoff', 'cutoff': 0.35356911598986335, 'grm_norm': 'gcn', 'self_loops': False, 'use_snp_selection': True, 'num_snps': 27779}. Best is trial 122 with value: 0.30762353460187775.
[I 2025-12-09 21:55:11,748] Trial 137 finished with value: 0.2876813661000444 and parameters: {'model_type': 'graphsage', 'hidden_dims': '[512, 64]', 'dropout': 0.25454656002867626, 'batch_norm': False, 'sage_aggr': 'max', 'sage_normalize': False, 'sage_project': False, 'lr': 2.6839577351126104e-05, 'weight_decay': 2.2845685285709898e-05, 'epochs': 144, 'loss': 'mae', 'optimizer': 'adam', 'graph_mode': 'cutoff', 'cutoff': 0.3838086577217863, 'grm_norm': 'gcn', 'self_loops': False, 'use_snp_selection': True, 'num_snps': 23490}. Best is trial 122 with value: 0.30762353460187775.
[I 2025-12-09 21:56:54,818] Trial 138 finished with value: -0.007057235859348647 and parameters: {'model_type': 'graphsage', 'hidden_dims': '[512, 64]', 'dropout': 0.17894806794776935, 'batch_norm': False, 'sage_aggr': 'max', 'sage_normalize': False, 'sage_project': False, 'lr': 0.0013195935720521897, 'weight_decay': 9.050006472367514e-06, 'epochs': 57, 'loss': 'mse', 'optimizer': 'adam', 'graph_mode': 'cutoff', 'cutoff': 0.4029847313599842, 'grm_norm': 'gcn', 'self_loops': False, 'use_snp_selection': True, 'num_snps': 59570}. Best is trial 122 with value: 0.30762353460187775.
[I 2025-12-09 21:57:55,997] Trial 139 finished with value: 0.23832206181971122 and parameters: {'model_type': 'graphsage', 'hidden_dims': '[512, 64]', 'dropout': 0.1910962868497101, 'batch_norm': True, 'sage_aggr': 'max', 'sage_normalize': False, 'sage_project': False, 'lr': 1.3765911928436376e-05, 'weight_decay': 1.4496045241214137e-05, 'epochs': 121, 'loss': 'mse', 'optimizer': 'adam', 'graph_mode': 'cutoff', 'cutoff': 0.4160869538735745, 'grm_norm': 'gcn', 'self_loops': False, 'use_snp_selection': True, 'num_snps': 20843}. Best is trial 122 with value: 0.30762353460187775.
[I 2025-12-09 21:59:56,344] Trial 140 finished with value: 0.2766918751649647 and parameters: {'model_type': 'graphsage', 'hidden_dims': '[512, 64]', 'dropout': 0.230051765924467, 'batch_norm': False, 'sage_aggr': 'max', 'sage_normalize': True, 'sage_project': False, 'lr': 1.5802295895683056e-05, 'weight_decay': 6.258600204750483e-05, 'epochs': 151, 'loss': 'mse', 'optimizer': 'adam', 'graph_mode': 'cutoff', 'cutoff': 0.37737410870634247, 'grm_norm': 'gcn', 'self_loops': False, 'use_snp_selection': False}. Best is trial 122 with value: 0.30762353460187775.
[I 2025-12-09 22:00:43,406] Trial 141 finished with value: 0.29679191300841495 and parameters: {'model_type': 'graphsage', 'hidden_dims': '[256, 128, 64]', 'dropout': 0.24648157133407017, 'batch_norm': False, 'sage_aggr': 'max', 'sage_normalize': False, 'sage_project': False, 'lr': 2.2422846520110584e-05, 'weight_decay': 3.2294241505769274e-05, 'epochs': 129, 'loss': 'mse', 'optimizer': 'adam', 'graph_mode': 'cutoff', 'cutoff': 0.45639336605506975, 'grm_norm': 'none', 'self_loops': False, 'use_snp_selection': True, 'num_snps': 19352}. Best is trial 122 with value: 0.30762353460187775.
[I 2025-12-09 22:01:51,295] Trial 142 finished with value: 0.3062096213073774 and parameters: {'model_type': 'graphsage', 'hidden_dims': '[512, 128]', 'dropout': 0.21006510690685531, 'batch_norm': False, 'sage_aggr': 'max', 'sage_normalize': False, 'sage_project': False, 'lr': 1.955069326556435e-05, 'weight_decay': 1.9264051698605124e-05, 'epochs': 114, 'loss': 'mse', 'optimizer': 'adam', 'graph_mode': 'cutoff', 'cutoff': 0.433070891640806, 'grm_norm': 'none', 'self_loops': False, 'use_snp_selection': True, 'num_snps': 24822}. Best is trial 122 with value: 0.30762353460187775.
[I 2025-12-09 22:02:57,277] Trial 143 finished with value: 0.29953839766957074 and parameters: {'model_type': 'graphsage', 'hidden_dims': '[512, 128]', 'dropout': 0.21305996756211706, 'batch_norm': False, 'sage_aggr': 'max', 'sage_normalize': False, 'sage_project': False, 'lr': 2.922913647515071e-05, 'weight_decay': 1.8067078763692307e-05, 'epochs': 104, 'loss': 'mse', 'optimizer': 'adam', 'graph_mode': 'cutoff', 'cutoff': 0.4280518470662248, 'grm_norm': 'none', 'self_loops': False, 'use_snp_selection': True, 'num_snps': 25010}. Best is trial 122 with value: 0.30762353460187775.
