[I 2025-12-09 19:50:44,942] Trial 121 finished with value: 0.2853708574631203 and parameters: {'model_type': 'graphsage', 'hidden_dims': '[512, 128]', 'dropout': 0.30555264784220815, 'batch_norm': True, 'sage_aggr': 'mean', 'sage_normalize': False, 'sage_project': False, 'lr': 1.957754401725309e-05, 'weight_decay': 7.835200275512054e-05, 'epochs': 304, 'loss': 'mse', 'optimizer': 'adam', 'graph_mode': 'cutoff', 'cutoff': 0.489025897905468, 'grm_norm': 'gcn', 'self_loops': False, 'use_snp_selection': True, 'num_snps': 40435}. Best is trial 110 with value: 0.29604572497846465.
[I 2025-12-09 19:52:59,005] Trial 122 finished with value: 0.28798911597957005 and parameters: {'model_type': 'graphsage', 'hidden_dims': '[512, 128]', 'dropout': 0.284261747087256, 'batch_norm': True, 'sage_aggr': 'mean', 'sage_normalize': False, 'sage_project': False, 'lr': 4.771318311494978e-05, 'weight_decay': 9.193066888576711e-05, 'epochs': 315, 'loss': 'mse', 'optimizer': 'adam', 'graph_mode': 'cutoff', 'cutoff': 0.5087203216328374, 'grm_norm': 'gcn', 'self_loops': False, 'use_snp_selection': True, 'num_snps': 36751}. Best is trial 110 with value: 0.29604572497846465.
[I 2025-12-09 19:55:35,292] Trial 123 finished with value: 0.2917151958010111 and parameters: {'model_type': 'graphsage', 'hidden_dims': '[512, 128]', 'dropout': 0.21151210185316324, 'batch_norm': True, 'sage_aggr': 'mean', 'sage_normalize': False, 'sage_project': False, 'lr': 7.719354567919808e-05, 'weight_decay': 1.1081775771582521e-05, 'epochs': 258, 'loss': 'mse', 'optimizer': 'adam', 'graph_mode': 'cutoff', 'cutoff': 0.46039978163350515, 'grm_norm': 'gcn', 'self_loops': False, 'use_snp_selection': True, 'num_snps': 45359}. Best is trial 110 with value: 0.29604572497846465.
[I 2025-12-09 19:57:53,240] Trial 124 finished with value: 0.28846133961486164 and parameters: {'model_type': 'graphsage', 'hidden_dims': '[512, 128]', 'dropout': 0.3278722526190667, 'batch_norm': True, 'sage_aggr': 'mean', 'sage_normalize': False, 'sage_project': False, 'lr': 0.00014960711498036074, 'weight_decay': 0.00015891767916513067, 'epochs': 248, 'loss': 'mse', 'optimizer': 'adam', 'graph_mode': 'cutoff', 'cutoff': 0.5513145103632037, 'grm_norm': 'gcn', 'self_loops': False, 'use_snp_selection': True, 'num_snps': 48897}. Best is trial 110 with value: 0.29604572497846465.
[I 2025-12-09 19:59:20,994] Trial 125 finished with value: 0.2892964137910099 and parameters: {'model_type': 'graphsage', 'hidden_dims': '[512, 128]', 'dropout': 0.2590872926000813, 'batch_norm': True, 'sage_aggr': 'mean', 'sage_normalize': False, 'sage_project': False, 'lr': 2.6000684127739358e-05, 'weight_decay': 1.767933493655852e-05, 'epochs': 287, 'loss': 'mse', 'optimizer': 'adam', 'graph_mode': 'cutoff', 'cutoff': 0.5297210122116474, 'grm_norm': 'gcn', 'self_loops': False, 'use_snp_selection': True, 'num_snps': 25633}. Best is trial 110 with value: 0.29604572497846465.
[I 2025-12-09 20:00:58,677] Trial 126 finished with value: 0.27477638528226445 and parameters: {'model_type': 'graphsage', 'hidden_dims': '[512, 64]', 'dropout': 0.41251243965507034, 'batch_norm': False, 'sage_aggr': 'mean', 'sage_normalize': False, 'sage_project': False, 'lr': 6.608111274601521e-05, 'weight_decay': 4.189410886015504e-05, 'epochs': 276, 'loss': 'mse', 'optimizer': 'adam', 'graph_mode': 'cutoff', 'cutoff': 0.5821808454532423, 'grm_norm': 'gcn', 'self_loops': False, 'use_snp_selection': True, 'num_snps': 32107}. Best is trial 110 with value: 0.29604572497846465.
[I 2025-12-09 20:03:24,678] Trial 127 finished with value: 0.28339892075170336 and parameters: {'model_type': 'graphsage', 'hidden_dims': '[512, 128]', 'dropout': 0.34403279884820365, 'batch_norm': True, 'sage_aggr': 'mean', 'sage_normalize': False, 'sage_project': False, 'lr': 0.00010289026855266935, 'weight_decay': 2.2671845651257363e-05, 'epochs': 255, 'loss': 'mse', 'optimizer': 'adam', 'graph_mode': 'cutoff', 'cutoff': 0.563708675001169, 'grm_norm': 'cosine_then_gcn', 'self_loops': False, 'use_snp_selection': True, 'num_snps': 52540}. Best is trial 110 with value: 0.29604572497846465.
[I 2025-12-09 20:04:05,364] Trial 128 finished with value: 0.2703999500940227 and parameters: {'model_type': 'graphsage', 'hidden_dims': '[256, 128]', 'dropout': 0.5519499190642265, 'batch_norm': True, 'sage_aggr': 'mean', 'sage_normalize': False, 'sage_project': False, 'lr': 3.667254561194169e-05, 'weight_decay': 3.139905509217029e-05, 'epochs': 300, 'loss': 'mse', 'optimizer': 'adam', 'graph_mode': 'cutoff', 'cutoff': 0.6018351165082249, 'grm_norm': 'gcn', 'self_loops': False, 'use_snp_selection': True, 'num_snps': 10029}. Best is trial 110 with value: 0.29604572497846465.
[I 2025-12-09 20:06:29,948] Trial 129 finished with value: 0.2873971848577906 and parameters: {'model_type': 'graphsage', 'hidden_dims': '[512, 128]', 'dropout': 0.2412325745046167, 'batch_norm': True, 'sage_aggr': 'mean', 'sage_normalize': False, 'sage_project': False, 'lr': 3.019717557455392e-05, 'weight_decay': 1.2515083832011379e-05, 'epochs': 266, 'loss': 'mse', 'optimizer': 'adam', 'graph_mode': 'cutoff', 'cutoff': 0.519067406139244, 'grm_norm': 'gcn', 'self_loops': False, 'use_snp_selection': True, 'num_snps': 46009}. Best is trial 110 with value: 0.29604572497846465.
[I 2025-12-09 20:08:53,563] Trial 130 finished with value: 0.27380656280331184 and parameters: {'model_type': 'graphsage', 'hidden_dims': '[512, 128]', 'dropout': 0.31284379900074716, 'batch_norm': True, 'sage_aggr': 'mean', 'sage_normalize': True, 'sage_project': False, 'lr': 8.365585171636222e-05, 'weight_decay': 0.00010789193432164437, 'epochs': 328, 'loss': 'mse', 'optimizer': 'adam', 'graph_mode': 'knn', 'knn_k': 3, 'weighted_edges': True, 'symmetrize_mode': 'mutual', 'self_loops': False, 'use_snp_selection': True, 'num_snps': 40867}. Best is trial 110 with value: 0.29604572497846465.
[I 2025-12-09 20:10:35,670] Trial 131 finished with value: 0.29402515785625033 and parameters: {'model_type': 'graphsage', 'hidden_dims': '[512, 128]', 'dropout': 0.2526693613103168, 'batch_norm': True, 'sage_aggr': 'mean', 'sage_normalize': False, 'sage_project': False, 'lr': 1.708169038413994e-05, 'weight_decay': 0.0001270084785067128, 'epochs': 241, 'loss': 'mse', 'optimizer': 'adam', 'graph_mode': 'cutoff', 'cutoff': 0.5457302332206196, 'grm_norm': 'gcn', 'self_loops': False, 'use_snp_selection': True, 'num_snps': 36468}. Best is trial 110 with value: 0.29604572497846465.
[I 2025-12-09 20:12:13,621] Trial 132 finished with value: 0.2820318184532365 and parameters: {'model_type': 'graphsage', 'hidden_dims': '[512, 128]', 'dropout': 0.23017110776254893, 'batch_norm': True, 'sage_aggr': 'mean', 'sage_normalize': False, 'sage_project': False, 'lr': 2.0706580255418975e-05, 'weight_decay': 0.00023446455585810836, 'epochs': 242, 'loss': 'mse', 'optimizer': 'adam', 'graph_mode': 'cutoff', 'cutoff': 0.5439027940921346, 'grm_norm': 'gcn', 'self_loops': False, 'use_snp_selection': True, 'num_snps': 34670}. Best is trial 110 with value: 0.29604572497846465.
[I 2025-12-09 20:14:04,162] Trial 133 finished with value: 0.2757909433651982 and parameters: {'model_type': 'graphsage', 'hidden_dims': '[512, 128]', 'dropout': 0.27067251953335464, 'batch_norm': True, 'sage_aggr': 'mean', 'sage_normalize': False, 'sage_project': False, 'lr': 1.0979795790335664e-05, 'weight_decay': 8.460859215906084e-06, 'epochs': 216, 'loss': 'mse', 'optimizer': 'adam', 'graph_mode': 'cutoff', 'cutoff': 0.49010285804816733, 'grm_norm': 'gcn', 'self_loops': False, 'use_snp_selection': True, 'num_snps': 37570}. Best is trial 110 with value: 0.29604572497846465.
[I 2025-12-09 20:15:24,357] Trial 134 finished with value: 0.28379100401238494 and parameters: {'model_type': 'graphsage', 'hidden_dims': '[512, 128]', 'dropout': 0.29502021430537523, 'batch_norm': True, 'sage_aggr': 'mean', 'sage_normalize': False, 'sage_project': False, 'lr': 9.458201751976673e-05, 'weight_decay': 0.0002059238774158599, 'epochs': 309, 'loss': 'mse', 'optimizer': 'adam', 'graph_mode': 'cutoff', 'cutoff': 0.5090828746138338, 'grm_norm': 'gcn', 'self_loops': False, 'use_snp_selection': True, 'num_snps': 20978}. Best is trial 110 with value: 0.29604572497846465.
[I 2025-12-09 20:17:25,820] Trial 135 finished with value: 0.28443134864259834 and parameters: {'model_type': 'graphsage', 'hidden_dims': '[512, 128]', 'dropout': 0.2550087675337868, 'batch_norm': True, 'sage_aggr': 'mean', 'sage_normalize': False, 'sage_project': False, 'lr': 1.6182137518574712e-05, 'weight_decay': 0.000139039987111193, 'epochs': 237, 'loss': 'mse', 'optimizer': 'adam', 'graph_mode': 'cutoff', 'cutoff': 0.5356370369569093, 'grm_norm': 'none', 'self_loops': False, 'use_snp_selection': True, 'num_snps': 43391}. Best is trial 110 with value: 0.29604572497846465.
[I 2025-12-09 20:18:59,552] Trial 136 finished with value: 0.27786955675576647 and parameters: {'model_type': 'graphsage', 'hidden_dims': '[512, 128]', 'dropout': 0.44372004224367545, 'batch_norm': True, 'sage_aggr': 'mean', 'sage_normalize': True, 'sage_project': False, 'lr': 1.4119111060892948e-05, 'weight_decay': 9.237587061754459e-05, 'epochs': 291, 'loss': 'mse', 'optimizer': 'adam', 'graph_mode': 'cutoff', 'cutoff': 0.6286907322552417, 'grm_norm': 'gcn', 'self_loops': False, 'use_snp_selection': True, 'num_snps': 29372}. Best is trial 110 with value: 0.29604572497846465.
[I 2025-12-09 20:20:30,422] Trial 137 finished with value: 0.2926348447454424 and parameters: {'model_type': 'graphsage', 'hidden_dims': '[512, 128]', 'dropout': 0.24498786046108617, 'batch_norm': True, 'sage_aggr': 'mean', 'sage_normalize': False, 'sage_project': False, 'lr': 5.08953201249751e-05, 'weight_decay': 0.0007230360659612799, 'epochs': 230, 'loss': 'mae', 'optimizer': 'adam', 'graph_mode': 'cutoff', 'cutoff': 0.5774455757180424, 'grm_norm': 'gcn', 'self_loops': False, 'use_snp_selection': True, 'num_snps': 33505}. Best is trial 110 with value: 0.29604572497846465.
[I 2025-12-09 20:21:56,906] Trial 138 finished with value: 0.2903129439507589 and parameters: {'model_type': 'graphsage', 'hidden_dims': '[512, 128]', 'dropout': 0.2454484745934732, 'batch_norm': True, 'sage_aggr': 'mean', 'sage_normalize': False, 'sage_project': False, 'lr': 4.242112586366672e-05, 'weight_decay': 0.0005449795646883622, 'epochs': 230, 'loss': 'mae', 'optimizer': 'adam', 'graph_mode': 'cutoff', 'cutoff': 0.5593900440186733, 'grm_norm': 'gcn', 'self_loops': False, 'use_snp_selection': True, 'num_snps': 31057}. Best is trial 110 with value: 0.29604572497846465.
[I 2025-12-09 20:23:26,056] Trial 139 finished with value: 0.2811737887482078 and parameters: {'model_type': 'graphsage', 'hidden_dims': '[512, 128]', 'dropout': 0.19815790954126586, 'batch_norm': True, 'sage_aggr': 'mean', 'sage_normalize': False, 'sage_project': False, 'lr': 0.001368547869653754, 'weight_decay': 0.0008094101242586011, 'epochs': 223, 'loss': 'mae', 'optimizer': 'adam', 'graph_mode': 'cutoff', 'cutoff': 0.578089931052931, 'grm_norm': 'gcn', 'self_loops': False, 'use_snp_selection': True, 'num_snps': 33529}. Best is trial 110 with value: 0.29604572497846465.
[I 2025-12-09 20:25:08,056] Trial 140 finished with value: 0.29000406378972027 and parameters: {'model_type': 'graphsage', 'hidden_dims': '[512, 128]', 'dropout': 0.22364586854223473, 'batch_norm': True, 'sage_aggr': 'mean', 'sage_normalize': False, 'sage_project': False, 'lr': 5.087743817057829e-05, 'weight_decay': 0.0001822975898193697, 'epochs': 247, 'loss': 'mae', 'optimizer': 'adam', 'graph_mode': 'cutoff', 'cutoff': 0.5965735146765019, 'grm_norm': 'gcn', 'self_loops': False, 'use_snp_selection': True, 'num_snps': 36834}. Best is trial 110 with value: 0.29604572497846465.
[I 2025-12-09 20:26:02,485] Trial 141 finished with value: 0.2901440331978857 and parameters: {'model_type': 'graphsage', 'hidden_dims': '[512, 128]', 'dropout': 0.2805476999437388, 'batch_norm': True, 'sage_aggr': 'mean', 'sage_normalize': False, 'sage_project': False, 'lr': 6.031936618353511e-05, 'weight_decay': 4.7165091326258133e-05, 'epochs': 236, 'loss': 'mae', 'optimizer': 'adam', 'graph_mode': 'cutoff', 'cutoff': 0.5270969957788806, 'grm_norm': 'gcn', 'self_loops': False, 'use_snp_selection': True, 'num_snps': 13934}. Best is trial 110 with value: 0.29604572497846465.
[I 2025-12-09 20:28:01,281] Trial 142 finished with value: 0.28464216769851464 and parameters: {'model_type': 'graphsage', 'hidden_dims': '[512, 128]', 'dropout': 0.2888787854054757, 'batch_norm': True, 'sage_aggr': 'mean', 'sage_normalize': True, 'sage_project': False, 'lr': 0.00011628991445983323, 'weight_decay': 0.0002815480881103711, 'epochs': 317, 'loss': 'mae', 'optimizer': 'adam', 'graph_mode': 'cutoff', 'cutoff': 0.5547483886649366, 'grm_norm': 'gcn', 'self_loops': False, 'use_snp_selection': True, 'num_snps': 35794}. Best is trial 110 with value: 0.29604572497846465.
[I 2025-12-09 20:30:21,413] Trial 143 finished with value: 0.28906071738474176 and parameters: {'model_type': 'graphsage', 'hidden_dims': '[512, 128]', 'dropout': 0.23551777028494122, 'batch_norm': True, 'sage_aggr': 'mean', 'sage_normalize': False, 'sage_project': False, 'lr': 7.288498390742869e-05, 'weight_decay': 0.0006817831100219488, 'epochs': 338, 'loss': 'mse', 'optimizer': 'adam', 'graph_mode': 'cutoff', 'cutoff': 0.4391398343806588, 'grm_norm': 'gcn', 'self_loops': False, 'use_snp_selection': True, 'num_snps': 32768}. Best is trial 110 with value: 0.29604572497846465.
[I 2025-12-09 20:31:53,846] Trial 144 finished with value: 0.2803053745885011 and parameters: {'model_type': 'graphsage', 'hidden_dims': '[512, 128]', 'dropout': 0.256692658784725, 'batch_norm': True, 'sage_aggr': 'mean', 'sage_normalize': True, 'sage_project': False, 'lr': 1.762281319359043e-05, 'weight_decay': 0.0004659529720120525, 'epochs': 254, 'loss': 'mse', 'optimizer': 'adam', 'graph_mode': 'cutoff', 'cutoff': 0.5428144646726192, 'grm_norm': 'gcn', 'self_loops': False, 'use_snp_selection': True, 'num_snps': 30715}. Best is trial 110 with value: 0.29604572497846465.
[I 2025-12-09 20:32:55,554] Trial 145 finished with value: 0.28574750394997206 and parameters: {'model_type': 'graphsage', 'hidden_dims': '[512, 128]', 'dropout': 0.4338650206038198, 'batch_norm': True, 'sage_aggr': 'mean', 'sage_normalize': True, 'sage_project': False, 'lr': 2.7326138279985355e-05, 'weight_decay': 7.190080139001869e-05, 'epochs': 262, 'loss': 'mse', 'optimizer': 'adam', 'graph_mode': 'cutoff', 'cutoff': 0.5747171501236834, 'grm_norm': 'gcn', 'self_loops': False, 'use_snp_selection': True, 'num_snps': 16908}. Best is trial 110 with value: 0.29604572497846465.
[I 2025-12-09 20:33:46,339] Trial 146 finished with value: 0.28019362236966294 and parameters: {'model_type': 'graphsage', 'hidden_dims': '[128, 64]', 'dropout': 0.2649751640504724, 'batch_norm': True, 'sage_aggr': 'mean', 'sage_normalize': False, 'sage_project': False, 'lr': 3.8616714956048924e-05, 'weight_decay': 2.107742815343578e-06, 'epochs': 88, 'loss': 'mse', 'optimizer': 'adam', 'graph_mode': 'cutoff', 'cutoff': 0.5114746418882731, 'grm_norm': 'gcn', 'self_loops': False, 'use_snp_selection': True, 'num_snps': 39184}. Best is trial 110 with value: 0.29604572497846465.
[I 2025-12-09 20:35:28,727] Trial 147 finished with value: 0.26106772376293225 and parameters: {'model_type': 'graphsage', 'hidden_dims': '[512, 128]', 'dropout': 0.33243682464782986, 'batch_norm': False, 'sage_aggr': 'mean', 'sage_normalize': True, 'sage_project': False, 'lr': 2.2492732022716973e-05, 'weight_decay': 1.3969581305922963e-05, 'epochs': 280, 'loss': 'mae', 'optimizer': 'adam', 'graph_mode': 'cutoff', 'cutoff': 0.46544808581517305, 'grm_norm': 'cosine_then_gcn', 'self_loops': False, 'use_snp_selection': True, 'num_snps': 27740}. Best is trial 110 with value: 0.29604572497846465.
[I 2025-12-09 20:37:51,404] Trial 148 finished with value: 0.2863306760840823 and parameters: {'model_type': 'graphsage', 'hidden_dims': '[512, 128]', 'dropout': 0.3054671528640144, 'batch_norm': True, 'sage_aggr': 'mean', 'sage_normalize': False, 'sage_project': False, 'lr': 4.9174764165194576e-05, 'weight_decay': 2.8609530039749714e-06, 'epochs': 350, 'loss': 'mse', 'optimizer': 'adam', 'graph_mode': 'cutoff', 'cutoff': 0.6113104059458572, 'grm_norm': 'gcn', 'self_loops': False, 'use_snp_selection': True, 'num_snps': 41288}. Best is trial 110 with value: 0.29604572497846465.
[I 2025-12-09 20:38:39,441] Trial 149 finished with value: 0.26641351174200895 and parameters: {'model_type': 'graphsage', 'hidden_dims': '[512, 128]', 'dropout': 0.37778583240114916, 'batch_norm': True, 'sage_aggr': 'mean', 'sage_normalize': True, 'sage_project': False, 'lr': 8.39549677828547e-05, 'weight_decay': 6.34575236217879e-05, 'epochs': 323, 'loss': 'mse', 'optimizer': 'adam', 'graph_mode': 'cutoff', 'cutoff': 0.48894456577630985, 'grm_norm': 'gcn', 'self_loops': False, 'use_snp_selection': True, 'num_snps': 7486}. Best is trial 110 with value: 0.29604572497846465.
