[I 2025-12-09 09:12:47,863] Trial 70 finished with value: 0.34384757697610363 and parameters: {'model_type': 'graphsage', 'hidden_dims': '[128, 64]', 'dropout': 0.14000136715282255, 'batch_norm': False, 'sage_aggr': 'max', 'sage_normalize': False, 'sage_project': False, 'lr': 2.73507677212139e-05, 'weight_decay': 5.100258406034969e-07, 'epochs': 168, 'loss': 'mse', 'optimizer': 'adam', 'graph_mode': 'knn', 'knn_k': 3, 'weighted_edges': True, 'symmetrize_mode': 'mutual', 'self_loops': True, 'use_snp_selection': True, 'num_snps': 39444}. Best is trial 55 with value: 0.3726311659269051.
[I 2025-12-09 09:14:31,533] Trial 71 finished with value: 0.3688877089894393 and parameters: {'model_type': 'graphsage', 'hidden_dims': '[512, 64]', 'dropout': 0.25870935202632955, 'batch_norm': False, 'sage_aggr': 'max', 'sage_normalize': False, 'sage_project': False, 'lr': 2.0186559903550088e-05, 'weight_decay': 0.0003275503878985943, 'epochs': 192, 'loss': 'mse', 'optimizer': 'adam', 'graph_mode': 'cutoff', 'cutoff': 0.45596241064552245, 'grm_norm': 'cosine_then_gcn', 'self_loops': True, 'use_snp_selection': True, 'num_snps': 38423}. Best is trial 55 with value: 0.3726311659269051.
[I 2025-12-09 09:15:58,749] Trial 72 finished with value: 0.36785083794616413 and parameters: {'model_type': 'graphsage', 'hidden_dims': '[512, 64]', 'dropout': 0.21023297375210562, 'batch_norm': False, 'sage_aggr': 'max', 'sage_normalize': False, 'sage_project': False, 'lr': 2.174672293821065e-05, 'weight_decay': 0.00033452233742931904, 'epochs': 200, 'loss': 'mse', 'optimizer': 'adam', 'graph_mode': 'cutoff', 'cutoff': 0.4364770629234308, 'grm_norm': 'cosine_then_gcn', 'self_loops': True, 'use_snp_selection': True, 'num_snps': 30702}. Best is trial 55 with value: 0.3726311659269051.
[I 2025-12-09 09:17:55,238] Trial 73 finished with value: 0.3738299533348847 and parameters: {'model_type': 'graphsage', 'hidden_dims': '[512, 64]', 'dropout': 0.3096753504945654, 'batch_norm': False, 'sage_aggr': 'max', 'sage_normalize': False, 'sage_project': False, 'lr': 1.2854955184291654e-05, 'weight_decay': 0.0005910111199549869, 'epochs': 183, 'loss': 'mse', 'optimizer': 'adam', 'graph_mode': 'cutoff', 'cutoff': 0.3706743618516958, 'grm_norm': 'cosine_then_gcn', 'self_loops': True, 'use_snp_selection': True, 'num_snps': 44012}. Best is trial 73 with value: 0.3738299533348847.
[I 2025-12-09 09:20:07,175] Trial 74 finished with value: 0.36255908241218887 and parameters: {'model_type': 'graphsage', 'hidden_dims': '[512, 64]', 'dropout': 0.3167396413019297, 'batch_norm': False, 'sage_aggr': 'max', 'sage_normalize': False, 'sage_project': False, 'lr': 1.535356287685193e-05, 'weight_decay': 0.0007169588106907764, 'epochs': 188, 'loss': 'mse', 'optimizer': 'adam', 'graph_mode': 'cutoff', 'cutoff': 0.3101791902971242, 'grm_norm': 'cosine_then_gcn', 'self_loops': True, 'use_snp_selection': True, 'num_snps': 44285}. Best is trial 73 with value: 0.3738299533348847.
[I 2025-12-09 09:22:15,607] Trial 75 finished with value: 0.3619326269787839 and parameters: {'model_type': 'graphsage', 'hidden_dims': '[512, 64]', 'dropout': 0.28774674186326565, 'batch_norm': False, 'sage_aggr': 'max', 'sage_normalize': False, 'sage_project': False, 'lr': 3.0239244665714517e-05, 'weight_decay': 0.00025991131228905116, 'epochs': 183, 'loss': 'mse', 'optimizer': 'adam', 'graph_mode': 'cutoff', 'cutoff': 0.35933781355989836, 'grm_norm': 'cosine_then_gcn', 'self_loops': True, 'use_snp_selection': True, 'num_snps': 48105}. Best is trial 73 with value: 0.3738299533348847.
[I 2025-12-09 09:23:58,536] Trial 76 finished with value: 0.2919284699570019 and parameters: {'model_type': 'graphsage', 'hidden_dims': '[512, 64]', 'dropout': 0.26976760944402844, 'batch_norm': False, 'sage_aggr': 'max', 'sage_normalize': False, 'sage_project': False, 'lr': 3.815399048703292e-05, 'weight_decay': 0.00040454855045370694, 'epochs': 150, 'loss': 'mse', 'optimizer': 'adam', 'graph_mode': 'knn', 'knn_k': 5, 'weighted_edges': False, 'symmetrize_mode': 'mutual', 'self_loops': True, 'use_snp_selection': True, 'num_snps': 41321}. Best is trial 73 with value: 0.3738299533348847.
[I 2025-12-09 09:24:32,378] Trial 77 finished with value: 0.30877238832124954 and parameters: {'model_type': 'graphsage', 'hidden_dims': '[512, 64]', 'dropout': 0.32608454639997186, 'batch_norm': True, 'sage_aggr': 'mean', 'sage_normalize': False, 'sage_project': False, 'lr': 1.2057106769862613e-05, 'weight_decay': 0.0009479902517280942, 'epochs': 230, 'loss': 'mse', 'optimizer': 'adam', 'graph_mode': 'cutoff', 'cutoff': 0.2565822978839305, 'grm_norm': 'cosine', 'self_loops': True, 'use_snp_selection': True, 'num_snps': 2807}. Best is trial 73 with value: 0.3738299533348847.
[I 2025-12-09 09:25:34,675] Trial 78 finished with value: 0.30863053588279193 and parameters: {'model_type': 'graphsage', 'hidden_dims': '[512, 64]', 'dropout': 0.28435568140725426, 'batch_norm': False, 'sage_aggr': 'max', 'sage_normalize': True, 'sage_project': False, 'lr': 0.0005366826933470757, 'weight_decay': 0.0006006553789701385, 'epochs': 124, 'loss': 'mse', 'optimizer': 'adam', 'graph_mode': 'knn', 'knn_k': 6, 'weighted_edges': True, 'symmetrize_mode': 'mutual', 'self_loops': True, 'use_snp_selection': True, 'num_snps': 23959}. Best is trial 73 with value: 0.3738299533348847.
[I 2025-12-09 09:26:58,843] Trial 79 finished with value: 0.3579899773228917 and parameters: {'model_type': 'graphsage', 'hidden_dims': '[512, 256]', 'dropout': 0.2254580806156089, 'batch_norm': False, 'sage_aggr': 'max', 'sage_normalize': False, 'sage_project': False, 'lr': 2.334335276355605e-05, 'weight_decay': 0.00013848437366300117, 'epochs': 163, 'loss': 'mse', 'optimizer': 'adam', 'graph_mode': 'cutoff', 'cutoff': 0.4988955583583068, 'grm_norm': 'gcn', 'self_loops': True, 'use_snp_selection': False}. Best is trial 73 with value: 0.3738299533348847.
[I 2025-12-09 09:28:34,110] Trial 80 finished with value: 0.3702626004255588 and parameters: {'model_type': 'graphsage', 'hidden_dims': '[512, 64]', 'dropout': 0.36066150294257815, 'batch_norm': False, 'sage_aggr': 'max', 'sage_normalize': False, 'sage_project': False, 'lr': 1.3046064504663865e-05, 'weight_decay': 0.00021160568904972666, 'epochs': 172, 'loss': 'mae', 'optimizer': 'adam', 'graph_mode': 'cutoff', 'cutoff': 0.5379363016950732, 'grm_norm': 'cosine_then_gcn', 'self_loops': True, 'use_snp_selection': True, 'num_snps': 46159}. Best is trial 73 with value: 0.3738299533348847.
[I 2025-12-09 09:30:25,020] Trial 81 finished with value: 0.37246213418375335 and parameters: {'model_type': 'graphsage', 'hidden_dims': '[512, 64]', 'dropout': 0.3537499100051341, 'batch_norm': False, 'sage_aggr': 'max', 'sage_normalize': False, 'sage_project': False, 'lr': 1.3348182489222206e-05, 'weight_decay': 0.0003352096994605902, 'epochs': 194, 'loss': 'mae', 'optimizer': 'adam', 'graph_mode': 'cutoff', 'cutoff': 0.5251391368298723, 'grm_norm': 'cosine_then_gcn', 'self_loops': True, 'use_snp_selection': True, 'num_snps': 49146}. Best is trial 73 with value: 0.3738299533348847.
[I 2025-12-09 09:32:00,347] Trial 82 finished with value: 0.37329003530146787 and parameters: {'model_type': 'graphsage', 'hidden_dims': '[512, 64]', 'dropout': 0.3481803534711296, 'batch_norm': False, 'sage_aggr': 'max', 'sage_normalize': False, 'sage_project': False, 'lr': 1.2615274146136929e-05, 'weight_decay': 0.0001662528512283028, 'epochs': 170, 'loss': 'mae', 'optimizer': 'adam', 'graph_mode': 'cutoff', 'cutoff': 0.5442109566243384, 'grm_norm': 'cosine_then_gcn', 'self_loops': True, 'use_snp_selection': True, 'num_snps': 46046}. Best is trial 73 with value: 0.3738299533348847.
[I 2025-12-09 09:33:38,179] Trial 83 finished with value: 0.3738688269470022 and parameters: {'model_type': 'graphsage', 'hidden_dims': '[512, 64]', 'dropout': 0.3657414560016506, 'batch_norm': False, 'sage_aggr': 'max', 'sage_normalize': False, 'sage_project': False, 'lr': 1.3201376318187972e-05, 'weight_decay': 0.00015162823672428986, 'epochs': 174, 'loss': 'mae', 'optimizer': 'adam', 'graph_mode': 'cutoff', 'cutoff': 0.6344952268472125, 'grm_norm': 'cosine_then_gcn', 'self_loops': True, 'use_snp_selection': True, 'num_snps': 49728}. Best is trial 83 with value: 0.3738688269470022.
[I 2025-12-09 09:35:22,901] Trial 84 finished with value: 0.37298114439311364 and parameters: {'model_type': 'graphsage', 'hidden_dims': '[512, 64]', 'dropout': 0.3559196795424359, 'batch_norm': False, 'sage_aggr': 'max', 'sage_normalize': False, 'sage_project': False, 'lr': 1.3278955474950564e-05, 'weight_decay': 0.0001614354015115943, 'epochs': 172, 'loss': 'mae', 'optimizer': 'adam', 'graph_mode': 'cutoff', 'cutoff': 0.6816900839509359, 'grm_norm': 'cosine_then_gcn', 'self_loops': True, 'use_snp_selection': True, 'num_snps': 54767}. Best is trial 83 with value: 0.3738688269470022.
[I 2025-12-09 09:37:02,404] Trial 85 finished with value: 0.37114414541023644 and parameters: {'model_type': 'graphsage', 'hidden_dims': '[512, 64]', 'dropout': 0.35570909177549664, 'batch_norm': False, 'sage_aggr': 'max', 'sage_normalize': False, 'sage_project': False, 'lr': 1.329893518142651e-05, 'weight_decay': 0.00019468425306756325, 'epochs': 174, 'loss': 'mae', 'optimizer': 'adam', 'graph_mode': 'cutoff', 'cutoff': 0.6883806058776094, 'grm_norm': 'cosine_then_gcn', 'self_loops': True, 'use_snp_selection': True, 'num_snps': 50864}. Best is trial 83 with value: 0.3738688269470022.
[I 2025-12-09 09:38:44,282] Trial 86 finished with value: 0.3709557495407222 and parameters: {'model_type': 'graphsage', 'hidden_dims': '[512, 64]', 'dropout': 0.4107630315854543, 'batch_norm': False, 'sage_aggr': 'max', 'sage_normalize': False, 'sage_project': False, 'lr': 1.3356778568586574e-05, 'weight_decay': 0.00016429621194150086, 'epochs': 154, 'loss': 'mae', 'optimizer': 'adam', 'graph_mode': 'cutoff', 'cutoff': 0.7013920906102334, 'grm_norm': 'cosine_then_gcn', 'self_loops': True, 'use_snp_selection': True, 'num_snps': 56803}. Best is trial 83 with value: 0.3738688269470022.
[I 2025-12-09 09:40:19,176] Trial 87 finished with value: 0.37032006899013165 and parameters: {'model_type': 'graphsage', 'hidden_dims': '[512, 64]', 'dropout': 0.40978721388018824, 'batch_norm': False, 'sage_aggr': 'max', 'sage_normalize': False, 'sage_project': False, 'lr': 1.3480718418298038e-05, 'weight_decay': 0.00015239201479135415, 'epochs': 141, 'loss': 'mae', 'optimizer': 'adam', 'graph_mode': 'cutoff', 'cutoff': 0.711701033137972, 'grm_norm': 'cosine_then_gcn', 'self_loops': True, 'use_snp_selection': True, 'num_snps': 56344}. Best is trial 83 with value: 0.3738688269470022.
[I 2025-12-09 09:41:57,388] Trial 88 finished with value: 0.3742191336867854 and parameters: {'model_type': 'graphsage', 'hidden_dims': '[512, 64]', 'dropout': 0.3506555118006545, 'batch_norm': False, 'sage_aggr': 'max', 'sage_normalize': False, 'sage_project': False, 'lr': 1.0945157013197306e-05, 'weight_decay': 9.66788742165832e-05, 'epochs': 152, 'loss': 'mae', 'optimizer': 'adam', 'graph_mode': 'cutoff', 'cutoff': 0.6880798885302095, 'grm_norm': 'cosine_then_gcn', 'self_loops': True, 'use_snp_selection': True, 'num_snps': 55181}. Best is trial 88 with value: 0.3742191336867854.
[I 2025-12-09 09:43:17,519] Trial 89 finished with value: 0.3711240488920868 and parameters: {'model_type': 'graphsage', 'hidden_dims': '[512, 64]', 'dropout': 0.3650835502659698, 'batch_norm': False, 'sage_aggr': 'max', 'sage_normalize': False, 'sage_project': False, 'lr': 1.0402996842761622e-05, 'weight_decay': 9.235957001156928e-05, 'epochs': 117, 'loss': 'mae', 'optimizer': 'adam', 'graph_mode': 'cutoff', 'cutoff': 0.6661722460873621, 'grm_norm': 'cosine_then_gcn', 'self_loops': True, 'use_snp_selection': True, 'num_snps': 49743}. Best is trial 88 with value: 0.3742191336867854.
[I 2025-12-09 09:44:28,261] Trial 90 finished with value: 0.35724088549875654 and parameters: {'model_type': 'graphsage', 'hidden_dims': '[512, 64]', 'dropout': 0.358538068792929, 'batch_norm': True, 'sage_aggr': 'mean', 'sage_normalize': False, 'sage_project': False, 'lr': 1.0077902341675543e-05, 'weight_decay': 8.455938140588896e-05, 'epochs': 88, 'loss': 'mae', 'optimizer': 'adam', 'graph_mode': 'cutoff', 'cutoff': 0.6735770906944625, 'grm_norm': 'cosine_then_gcn', 'self_loops': True, 'use_snp_selection': True, 'num_snps': 49683}. Best is trial 88 with value: 0.3742191336867854.
[I 2025-12-09 09:46:08,890] Trial 91 finished with value: 0.3695110892935832 and parameters: {'model_type': 'graphsage', 'hidden_dims': '[512, 64]', 'dropout': 0.3935615244561333, 'batch_norm': False, 'sage_aggr': 'max', 'sage_normalize': False, 'sage_project': False, 'lr': 1.7804527734055685e-05, 'weight_decay': 7.133825533439723e-05, 'epochs': 166, 'loss': 'mae', 'optimizer': 'adam', 'graph_mode': 'cutoff', 'cutoff': 0.7348649512142397, 'grm_norm': 'cosine_then_gcn', 'self_loops': True, 'use_snp_selection': True, 'num_snps': 53079}. Best is trial 88 with value: 0.3742191336867854.
[I 2025-12-09 09:47:35,437] Trial 92 finished with value: 0.3719440704655027 and parameters: {'model_type': 'graphsage', 'hidden_dims': '[512, 64]', 'dropout': 0.3485476289326303, 'batch_norm': False, 'sage_aggr': 'max', 'sage_normalize': False, 'sage_project': False, 'lr': 1.0634665296955161e-05, 'weight_decay': 0.00010397417954907705, 'epochs': 120, 'loss': 'mae', 'optimizer': 'adam', 'graph_mode': 'cutoff', 'cutoff': 0.6409297607012859, 'grm_norm': 'cosine_then_gcn', 'self_loops': True, 'use_snp_selection': True, 'num_snps': 54793}. Best is trial 88 with value: 0.3742191336867854.
[I 2025-12-09 09:49:08,192] Trial 93 finished with value: 0.3684796321599285 and parameters: {'model_type': 'graphsage', 'hidden_dims': '[512, 64]', 'dropout': 0.3511938098062179, 'batch_norm': False, 'sage_aggr': 'max', 'sage_normalize': False, 'sage_project': False, 'lr': 1.145991478959223e-05, 'weight_decay': 0.00011288213474771926, 'epochs': 119, 'loss': 'mae', 'optimizer': 'adam', 'graph_mode': 'cutoff', 'cutoff': 0.639195727156643, 'grm_norm': 'cosine_then_gcn', 'self_loops': True, 'use_snp_selection': True, 'num_snps': 59352}. Best is trial 88 with value: 0.3742191336867854.
[I 2025-12-09 09:50:37,836] Trial 94 finished with value: 0.3732933081532943 and parameters: {'model_type': 'graphsage', 'hidden_dims': '[512, 64]', 'dropout': 0.36715721128086104, 'batch_norm': False, 'sage_aggr': 'max', 'sage_normalize': False, 'sage_project': False, 'lr': 1.5152353274426644e-05, 'weight_decay': 4.833160226439425e-05, 'epochs': 128, 'loss': 'mae', 'optimizer': 'adam', 'graph_mode': 'cutoff', 'cutoff': 0.6660775517247054, 'grm_norm': 'cosine_then_gcn', 'self_loops': True, 'use_snp_selection': True, 'num_snps': 55129}. Best is trial 88 with value: 0.3742191336867854.
[I 2025-12-09 09:51:56,048] Trial 95 finished with value: 0.3738992122557164 and parameters: {'model_type': 'graphsage', 'hidden_dims': '[512, 64]', 'dropout': 0.3776290134486651, 'batch_norm': False, 'sage_aggr': 'max', 'sage_normalize': False, 'sage_project': False, 'lr': 1.5021964420452753e-05, 'weight_decay': 2.650768000219669e-05, 'epochs': 100, 'loss': 'mae', 'optimizer': 'adam', 'graph_mode': 'cutoff', 'cutoff': 0.8165440126020823, 'grm_norm': 'cosine_then_gcn', 'self_loops': True, 'use_snp_selection': True, 'num_snps': 54179}. Best is trial 88 with value: 0.3742191336867854.
[I 2025-12-09 09:53:16,503] Trial 96 finished with value: 0.3648904901365613 and parameters: {'model_type': 'graphsage', 'hidden_dims': '[512, 64]', 'dropout': 0.3722740250796893, 'batch_norm': False, 'sage_aggr': 'max', 'sage_normalize': False, 'sage_project': False, 'lr': 1.7850004765131534e-05, 'weight_decay': 2.7739132660909998e-05, 'epochs': 105, 'loss': 'mae', 'optimizer': 'adam', 'graph_mode': 'cutoff', 'cutoff': 0.8122257216649462, 'grm_norm': 'cosine_then_gcn', 'self_loops': True, 'use_snp_selection': True, 'num_snps': 54677}. Best is trial 88 with value: 0.3742191336867854.
[I 2025-12-09 09:54:30,712] Trial 97 finished with value: 0.3533375029305643 and parameters: {'model_type': 'graphsage', 'hidden_dims': '[512, 64]', 'dropout': 0.39457296702619254, 'batch_norm': False, 'sage_aggr': 'max', 'sage_normalize': True, 'sage_project': False, 'lr': 1.4945544628645798e-05, 'weight_decay': 5.8023204372265595e-05, 'epochs': 83, 'loss': 'mae', 'optimizer': 'adam', 'graph_mode': 'cutoff', 'cutoff': 0.6082662014627723, 'grm_norm': 'cosine_then_gcn', 'self_loops': True, 'use_snp_selection': True, 'num_snps': 55165}. Best is trial 88 with value: 0.3742191336867854.
[I 2025-12-09 09:55:21,310] Trial 98 finished with value: 0.3704676705587812 and parameters: {'model_type': 'graphsage', 'hidden_dims': '[512, 64]', 'dropout': 0.34197128214466754, 'batch_norm': False, 'sage_aggr': 'max', 'sage_normalize': False, 'sage_project': False, 'lr': 1.70872488978136e-05, 'weight_decay': 2.61486233908416e-05, 'epochs': 98, 'loss': 'mae', 'optimizer': 'adam', 'graph_mode': 'cutoff', 'cutoff': 0.7904605381256096, 'grm_norm': 'cosine_then_gcn', 'self_loops': True, 'use_snp_selection': False}. Best is trial 88 with value: 0.3742191336867854.
[I 2025-12-09 09:56:52,082] Trial 99 finished with value: 0.37436760407066083 and parameters: {'model_type': 'graphsage', 'hidden_dims': '[512, 64]', 'dropout': 0.3255427525161959, 'batch_norm': False, 'sage_aggr': 'max', 'sage_normalize': False, 'sage_project': False, 'lr': 1.1261420294591107e-05, 'weight_decay': 3.795066373132219e-05, 'epochs': 109, 'loss': 'mae', 'optimizer': 'adam', 'graph_mode': 'cutoff', 'cutoff': 0.5828092528695007, 'grm_norm': 'cosine_then_gcn', 'self_loops': True, 'use_snp_selection': True, 'num_snps': 59921}. Best is trial 99 with value: 0.37436760407066083.
[I 2025-12-09 09:58:31,129] Trial 100 finished with value: 0.3739692889598231 and parameters: {'model_type': 'graphsage', 'hidden_dims': '[512, 64]', 'dropout': 0.4248473619204519, 'batch_norm': False, 'sage_aggr': 'max', 'sage_normalize': False, 'sage_project': False, 'lr': 1.3976155345491617e-05, 'weight_decay': 4.704733467797388e-05, 'epochs': 130, 'loss': 'mae', 'optimizer': 'adam', 'graph_mode': 'cutoff', 'cutoff': 0.5704761271478357, 'grm_norm': 'cosine_then_gcn', 'self_loops': True, 'use_snp_selection': True, 'num_snps': 59209}. Best is trial 99 with value: 0.37436760407066083.
[I 2025-12-09 10:00:10,210] Trial 101 finished with value: 0.3720547617123295 and parameters: {'model_type': 'graphsage', 'hidden_dims': '[512, 64]', 'dropout': 0.4417583069997957, 'batch_norm': False, 'sage_aggr': 'max', 'sage_normalize': False, 'sage_project': False, 'lr': 1.1804711161662307e-05, 'weight_decay': 3.917146695119025e-05, 'epochs': 128, 'loss': 'mae', 'optimizer': 'adam', 'graph_mode': 'cutoff', 'cutoff': 0.5631836912066844, 'grm_norm': 'cosine_then_gcn', 'self_loops': True, 'use_snp_selection': True, 'num_snps': 59259}. Best is trial 99 with value: 0.37436760407066083.
[I 2025-12-09 10:01:35,654] Trial 102 finished with value: 0.370108236075786 and parameters: {'model_type': 'graphsage', 'hidden_dims': '[512, 64]', 'dropout': 0.3280455938028218, 'batch_norm': False, 'sage_aggr': 'max', 'sage_normalize': False, 'sage_project': False, 'lr': 1.4572883878858317e-05, 'weight_decay': 1.4799558817985436e-05, 'epochs': 105, 'loss': 'mae', 'optimizer': 'adam', 'graph_mode': 'cutoff', 'cutoff': 0.5985053786928818, 'grm_norm': 'cosine_then_gcn', 'self_loops': True, 'use_snp_selection': True, 'num_snps': 57389}. Best is trial 99 with value: 0.37436760407066083.
[I 2025-12-09 10:03:06,535] Trial 103 finished with value: 0.3695684489786076 and parameters: {'model_type': 'graphsage', 'hidden_dims': '[512, 64]', 'dropout': 0.5102242791652516, 'batch_norm': False, 'sage_aggr': 'max', 'sage_normalize': False, 'sage_project': False, 'lr': 1.8584668358149075e-05, 'weight_decay': 1.8429377144841828e-05, 'epochs': 139, 'loss': 'mae', 'optimizer': 'adam', 'graph_mode': 'cutoff', 'cutoff': 0.7421177178427474, 'grm_norm': 'cosine_then_gcn', 'self_loops': True, 'use_snp_selection': True, 'num_snps': 52439}. Best is trial 99 with value: 0.37436760407066083.
[I 2025-12-09 10:04:35,848] Trial 104 finished with value: 0.36298669479985735 and parameters: {'model_type': 'graphsage', 'hidden_dims': '[512, 64]', 'dropout': 0.4385614702550564, 'batch_norm': False, 'sage_aggr': 'max', 'sage_normalize': False, 'sage_project': False, 'lr': 1.415839979365457e-05, 'weight_decay': 4.208951143239615e-05, 'epochs': 110, 'loss': 'mae', 'optimizer': 'adam', 'graph_mode': 'cutoff', 'cutoff': 0.5789293366478693, 'grm_norm': 'none', 'self_loops': True, 'use_snp_selection': True, 'num_snps': 58678}. Best is trial 99 with value: 0.37436760407066083.
[I 2025-12-09 10:05:45,474] Trial 105 finished with value: 0.36866975232140664 and parameters: {'model_type': 'graphsage', 'hidden_dims': '[512, 64]', 'dropout': 0.3903128662186319, 'batch_norm': False, 'sage_aggr': 'max', 'sage_normalize': False, 'sage_project': False, 'lr': 1.1750505140067275e-05, 'weight_decay': 5.4018548391590686e-05, 'epochs': 70, 'loss': 'mae', 'optimizer': 'adam', 'graph_mode': 'cutoff', 'cutoff': 0.8649544263728701, 'grm_norm': 'cosine_then_gcn', 'self_loops': True, 'use_snp_selection': True, 'num_snps': 56007}. Best is trial 99 with value: 0.37436760407066083.
[I 2025-12-09 10:07:25,382] Trial 106 finished with value: 0.3692485973952213 and parameters: {'model_type': 'graphsage', 'hidden_dims': '[512, 64]', 'dropout': 0.31478041073245494, 'batch_norm': False, 'sage_aggr': 'max', 'sage_normalize': False, 'sage_project': False, 'lr': 1.5892748882498914e-05, 'weight_decay': 9.413944631405108e-06, 'epochs': 133, 'loss': 'mae', 'optimizer': 'adam', 'graph_mode': 'cutoff', 'cutoff': 0.66410375003283, 'grm_norm': 'cosine_then_gcn', 'self_loops': True, 'use_snp_selection': True, 'num_snps': 59909}. Best is trial 99 with value: 0.37436760407066083.
