[I 2025-12-09 17:11:40,872] Trial 105 finished with value: 0.3637081844380549 and parameters: {'model_type': 'graphsage', 'hidden_dims': '[256, 128, 64]', 'dropout': 0.1441619038048364, 'batch_norm': False, 'sage_aggr': 'max', 'sage_normalize': False, 'sage_project': False, 'lr': 3.808389936571707e-05, 'weight_decay': 3.1676664597334305e-05, 'epochs': 222, 'loss': 'mse', 'optimizer': 'adam', 'graph_mode': 'cutoff', 'cutoff': 0.41652394360251016, 'grm_norm': 'cosine', 'self_loops': False, 'use_snp_selection': True, 'num_snps': 36734}. Best is trial 62 with value: 0.38241543888456686.
[I 2025-12-09 17:14:41,955] Trial 106 finished with value: 0.37843623373214685 and parameters: {'model_type': 'graphsage', 'hidden_dims': '[512, 128]', 'dropout': 0.12261886480376287, 'batch_norm': False, 'sage_aggr': 'max', 'sage_normalize': False, 'sage_project': False, 'lr': 4.145767270255796e-05, 'weight_decay': 1.0349877402329998e-07, 'epochs': 248, 'loss': 'mse', 'optimizer': 'adam', 'graph_mode': 'cutoff', 'cutoff': 0.38476875473655964, 'grm_norm': 'cosine', 'self_loops': False, 'use_snp_selection': True, 'num_snps': 44567}. Best is trial 62 with value: 0.38241543888456686.
[I 2025-12-09 17:15:50,662] Trial 107 finished with value: 0.2417836604722671 and parameters: {'model_type': 'graphsage', 'hidden_dims': '[512, 128]', 'dropout': 0.10126003478081898, 'batch_norm': False, 'sage_aggr': 'max', 'sage_normalize': False, 'sage_project': False, 'lr': 0.0003973757870966068, 'weight_decay': 2.1847394856382285e-07, 'epochs': 199, 'loss': 'mse', 'optimizer': 'adam', 'graph_mode': 'cutoff', 'cutoff': 0.38640694667924, 'grm_norm': 'cosine', 'self_loops': False, 'use_snp_selection': True, 'num_snps': 23532}. Best is trial 62 with value: 0.38241543888456686.
[I 2025-12-09 17:18:48,473] Trial 108 finished with value: 0.3774162296521032 and parameters: {'model_type': 'graphsage', 'hidden_dims': '[512, 128]', 'dropout': 0.11969348008782979, 'batch_norm': False, 'sage_aggr': 'max', 'sage_normalize': False, 'sage_project': False, 'lr': 2.558553911358351e-05, 'weight_decay': 6.952328854744494e-06, 'epochs': 246, 'loss': 'mse', 'optimizer': 'adam', 'graph_mode': 'cutoff', 'cutoff': 0.4766295976393061, 'grm_norm': 'cosine', 'self_loops': False, 'use_snp_selection': True, 'num_snps': 48015}. Best is trial 62 with value: 0.38241543888456686.
[I 2025-12-09 17:22:07,994] Trial 109 finished with value: 0.36866255592390007 and parameters: {'model_type': 'graphsage', 'hidden_dims': '[512, 128]', 'dropout': 0.1370427035370548, 'batch_norm': False, 'sage_aggr': 'mean', 'sage_normalize': False, 'sage_project': False, 'lr': 1.4138788997826961e-05, 'weight_decay': 1.1640786865525195e-05, 'epochs': 232, 'loss': 'mse', 'optimizer': 'adam', 'graph_mode': 'knn', 'knn_k': 5, 'weighted_edges': True, 'symmetrize_mode': 'union', 'self_loops': False, 'use_snp_selection': True, 'num_snps': 44501}. Best is trial 62 with value: 0.38241543888456686.
[I 2025-12-09 17:23:35,825] Trial 110 finished with value: 0.3637513554315615 and parameters: {'model_type': 'graphsage', 'hidden_dims': '[512, 128]', 'dropout': 0.16153885720648634, 'batch_norm': False, 'sage_aggr': 'max', 'sage_normalize': False, 'sage_project': False, 'lr': 1.9085894563090742e-05, 'weight_decay': 1.731974890954464e-07, 'epochs': 236, 'loss': 'mse', 'optimizer': 'adam', 'graph_mode': 'cutoff', 'cutoff': 0.5124932401460985, 'grm_norm': 'cosine_then_gcn', 'self_loops': False, 'use_snp_selection': True, 'num_snps': 33025}. Best is trial 62 with value: 0.38241543888456686.
[I 2025-12-09 17:26:28,829] Trial 111 finished with value: 0.37555890860068586 and parameters: {'model_type': 'graphsage', 'hidden_dims': '[512, 64]', 'dropout': 0.12590347673472194, 'batch_norm': False, 'sage_aggr': 'max', 'sage_normalize': False, 'sage_project': False, 'lr': 4.2654367657007054e-05, 'weight_decay': 1.3628451018567306e-07, 'epochs': 246, 'loss': 'mse', 'optimizer': 'adam', 'graph_mode': 'cutoff', 'cutoff': 0.4353119034519488, 'grm_norm': 'cosine', 'self_loops': False, 'use_snp_selection': True, 'num_snps': 45737}. Best is trial 62 with value: 0.38241543888456686.
[I 2025-12-09 17:28:58,780] Trial 112 finished with value: 0.3742439940694884 and parameters: {'model_type': 'graphsage', 'hidden_dims': '[512, 128]', 'dropout': 0.11015029362061009, 'batch_norm': False, 'sage_aggr': 'max', 'sage_normalize': False, 'sage_project': False, 'lr': 5.294906403932312e-05, 'weight_decay': 3.285456365789058e-05, 'epochs': 256, 'loss': 'mse', 'optimizer': 'adam', 'graph_mode': 'cutoff', 'cutoff': 0.4175846080245318, 'grm_norm': 'cosine', 'self_loops': False, 'use_snp_selection': True, 'num_snps': 38423}. Best is trial 62 with value: 0.38241543888456686.
[I 2025-12-09 17:31:06,795] Trial 113 finished with value: 0.38010601232850283 and parameters: {'model_type': 'graphsage', 'hidden_dims': '[512, 128]', 'dropout': 0.1422960128591476, 'batch_norm': False, 'sage_aggr': 'max', 'sage_normalize': False, 'sage_project': False, 'lr': 3.89664237872764e-05, 'weight_decay': 1.2466185312499284e-05, 'epochs': 227, 'loss': 'mse', 'optimizer': 'adam', 'graph_mode': 'cutoff', 'cutoff': 0.3899266520669672, 'grm_norm': 'cosine', 'self_loops': False, 'use_snp_selection': True, 'num_snps': 35912}. Best is trial 62 with value: 0.38241543888456686.
[I 2025-12-09 17:33:06,181] Trial 114 finished with value: 0.38014340665736895 and parameters: {'model_type': 'graphsage', 'hidden_dims': '[512, 128]', 'dropout': 0.1476663695922571, 'batch_norm': False, 'sage_aggr': 'max', 'sage_normalize': False, 'sage_project': False, 'lr': 2.4423332526923196e-05, 'weight_decay': 1.2895904950416726e-05, 'epochs': 218, 'loss': 'mse', 'optimizer': 'adam', 'graph_mode': 'cutoff', 'cutoff': 0.395131772915826, 'grm_norm': 'cosine', 'self_loops': False, 'use_snp_selection': True, 'num_snps': 35374}. Best is trial 62 with value: 0.38241543888456686.
[I 2025-12-09 17:34:58,049] Trial 115 finished with value: 0.3789011623414825 and parameters: {'model_type': 'graphsage', 'hidden_dims': '[512, 128]', 'dropout': 0.1478882009762353, 'batch_norm': False, 'sage_aggr': 'max', 'sage_normalize': False, 'sage_project': False, 'lr': 2.7862746967003654e-05, 'weight_decay': 1.2829784630170873e-05, 'epochs': 214, 'loss': 'mse', 'optimizer': 'adam', 'graph_mode': 'cutoff', 'cutoff': 0.40000041317431545, 'grm_norm': 'cosine', 'self_loops': False, 'use_snp_selection': True, 'num_snps': 35451}. Best is trial 62 with value: 0.38241543888456686.
[I 2025-12-09 17:36:51,654] Trial 116 finished with value: 0.3809527511369004 and parameters: {'model_type': 'graphsage', 'hidden_dims': '[512, 128]', 'dropout': 0.1414181667286811, 'batch_norm': False, 'sage_aggr': 'max', 'sage_normalize': False, 'sage_project': False, 'lr': 2.453093836880377e-05, 'weight_decay': 1.1670616209075392e-05, 'epochs': 214, 'loss': 'mse', 'optimizer': 'adam', 'graph_mode': 'cutoff', 'cutoff': 0.3998424706455428, 'grm_norm': 'cosine', 'self_loops': False, 'use_snp_selection': True, 'num_snps': 35864}. Best is trial 62 with value: 0.38241543888456686.
[I 2025-12-09 17:38:48,915] Trial 117 finished with value: 0.3681414224689984 and parameters: {'model_type': 'graphsage', 'hidden_dims': '[512, 128]', 'dropout': 0.14711258825498635, 'batch_norm': True, 'sage_aggr': 'max', 'sage_normalize': True, 'sage_project': False, 'lr': 0.0026172412480868893, 'weight_decay': 1.2550123648017555e-05, 'epochs': 215, 'loss': 'mse', 'optimizer': 'adam', 'graph_mode': 'cutoff', 'cutoff': 0.39776963567074597, 'grm_norm': 'cosine', 'self_loops': False, 'use_snp_selection': True, 'num_snps': 35525}. Best is trial 62 with value: 0.38241543888456686.
[I 2025-12-09 17:41:05,594] Trial 118 finished with value: 0.3661296219633085 and parameters: {'model_type': 'graphsage', 'hidden_dims': '[512, 128]', 'dropout': 0.44065545529616135, 'batch_norm': False, 'sage_aggr': 'max', 'sage_normalize': False, 'sage_project': False, 'lr': 2.5078914409051085e-05, 'weight_decay': 2.1869018676843313e-05, 'epochs': 204, 'loss': 'mse', 'optimizer': 'adam', 'graph_mode': 'cutoff', 'cutoff': 0.45215031964394925, 'grm_norm': 'cosine', 'self_loops': False, 'use_snp_selection': False}. Best is trial 62 with value: 0.38241543888456686.
[I 2025-12-09 17:43:07,652] Trial 119 finished with value: 0.37573298453548226 and parameters: {'model_type': 'graphsage', 'hidden_dims': '[512, 128]', 'dropout': 0.15809096298411257, 'batch_norm': False, 'sage_aggr': 'max', 'sage_normalize': False, 'sage_project': False, 'lr': 2.9913216121541307e-05, 'weight_decay': 1.0495007209225528e-05, 'epochs': 220, 'loss': 'mse', 'optimizer': 'adam', 'graph_mode': 'cutoff', 'cutoff': 0.3457076752751921, 'grm_norm': 'cosine', 'self_loops': False, 'use_snp_selection': True, 'num_snps': 33628}. Best is trial 62 with value: 0.38241543888456686.
[I 2025-12-09 17:44:46,222] Trial 120 finished with value: 0.3827198341723822 and parameters: {'model_type': 'graphsage', 'hidden_dims': '[512, 128]', 'dropout': 0.18798089332200202, 'batch_norm': False, 'sage_aggr': 'max', 'sage_normalize': False, 'sage_project': False, 'lr': 2.2150337168443826e-05, 'weight_decay': 1.8403320953357915e-05, 'epochs': 211, 'loss': 'mse', 'optimizer': 'adam', 'graph_mode': 'cutoff', 'cutoff': 0.40357893783141857, 'grm_norm': 'gcn', 'self_loops': False, 'use_snp_selection': True, 'num_snps': 31114}. Best is trial 120 with value: 0.3827198341723822.
[I 2025-12-09 17:46:36,273] Trial 121 finished with value: 0.379157625062135 and parameters: {'model_type': 'graphsage', 'hidden_dims': '[512, 128]', 'dropout': 0.1838062199336893, 'batch_norm': False, 'sage_aggr': 'max', 'sage_normalize': False, 'sage_project': False, 'lr': 2.2224432784207857e-05, 'weight_decay': 1.7553532536090728e-05, 'epochs': 227, 'loss': 'mse', 'optimizer': 'adam', 'graph_mode': 'cutoff', 'cutoff': 0.40742806381460295, 'grm_norm': 'gcn', 'self_loops': False, 'use_snp_selection': True, 'num_snps': 30871}. Best is trial 120 with value: 0.3827198341723822.
[I 2025-12-09 17:48:29,609] Trial 122 finished with value: 0.38123294205358765 and parameters: {'model_type': 'graphsage', 'hidden_dims': '[512, 128]', 'dropout': 0.18603561986764325, 'batch_norm': False, 'sage_aggr': 'max', 'sage_normalize': False, 'sage_project': False, 'lr': 2.2108831184248557e-05, 'weight_decay': 1.807012029535283e-05, 'epochs': 225, 'loss': 'mse', 'optimizer': 'adam', 'graph_mode': 'cutoff', 'cutoff': 0.40674263127638727, 'grm_norm': 'gcn', 'self_loops': False, 'use_snp_selection': True, 'num_snps': 31982}. Best is trial 120 with value: 0.3827198341723822.
[I 2025-12-09 17:50:21,409] Trial 123 finished with value: 0.37944763258130687 and parameters: {'model_type': 'graphsage', 'hidden_dims': '[512, 128]', 'dropout': 0.18250925856538697, 'batch_norm': False, 'sage_aggr': 'max', 'sage_normalize': False, 'sage_project': False, 'lr': 2.1495966943579832e-05, 'weight_decay': 1.805828674560384e-05, 'epochs': 226, 'loss': 'mse', 'optimizer': 'adam', 'graph_mode': 'cutoff', 'cutoff': 0.3920862060446749, 'grm_norm': 'gcn', 'self_loops': False, 'use_snp_selection': True, 'num_snps': 31287}. Best is trial 120 with value: 0.3827198341723822.
[I 2025-12-09 17:52:19,735] Trial 124 finished with value: 0.3743100796413267 and parameters: {'model_type': 'graphsage', 'hidden_dims': '[512, 128]', 'dropout': 0.18395811861690992, 'batch_norm': False, 'sage_aggr': 'max', 'sage_normalize': False, 'sage_project': False, 'lr': 2.0984180718197654e-05, 'weight_decay': 1.8226488684179e-05, 'epochs': 224, 'loss': 'mse', 'optimizer': 'adam', 'graph_mode': 'cutoff', 'cutoff': 0.37191011907637, 'grm_norm': 'gcn', 'self_loops': False, 'use_snp_selection': True, 'num_snps': 31255}. Best is trial 120 with value: 0.3827198341723822.
[I 2025-12-09 17:54:19,240] Trial 125 finished with value: 0.36926610395578197 and parameters: {'model_type': 'graphsage', 'hidden_dims': '[512, 128]', 'dropout': 0.17454316547187584, 'batch_norm': False, 'sage_aggr': 'max', 'sage_normalize': False, 'sage_project': False, 'lr': 1.53112384445437e-05, 'weight_decay': 9.237038084839191e-06, 'epochs': 207, 'loss': 'mse', 'optimizer': 'adam', 'graph_mode': 'cutoff', 'cutoff': 0.3215229732807437, 'grm_norm': 'gcn', 'self_loops': False, 'use_snp_selection': True, 'num_snps': 30247}. Best is trial 120 with value: 0.3827198341723822.
[I 2025-12-09 17:56:08,587] Trial 126 finished with value: 0.37827425899434397 and parameters: {'model_type': 'graphsage', 'hidden_dims': '[512, 128]', 'dropout': 0.19870489330332214, 'batch_norm': False, 'sage_aggr': 'max', 'sage_normalize': False, 'sage_project': False, 'lr': 2.3067160065482713e-05, 'weight_decay': 1.5160027663780352e-05, 'epochs': 228, 'loss': 'mse', 'optimizer': 'adam', 'graph_mode': 'cutoff', 'cutoff': 0.39639688108492627, 'grm_norm': 'gcn', 'self_loops': False, 'use_snp_selection': True, 'num_snps': 31508}. Best is trial 120 with value: 0.3827198341723822.
[I 2025-12-09 17:57:43,383] Trial 127 finished with value: 0.3801138009992735 and parameters: {'model_type': 'graphsage', 'hidden_dims': '[512, 128]', 'dropout': 0.16272468191622402, 'batch_norm': False, 'sage_aggr': 'max', 'sage_normalize': False, 'sage_project': False, 'lr': 1.958605330198844e-05, 'weight_decay': 2.130388800451969e-05, 'epochs': 202, 'loss': 'mse', 'optimizer': 'adam', 'graph_mode': 'cutoff', 'cutoff': 0.40931062375054766, 'grm_norm': 'gcn', 'self_loops': False, 'use_snp_selection': True, 'num_snps': 29777}. Best is trial 120 with value: 0.3827198341723822.
[I 2025-12-09 17:59:14,118] Trial 128 finished with value: 0.37621068229199156 and parameters: {'model_type': 'graphsage', 'hidden_dims': '[512, 128]', 'dropout': 0.1695615586408811, 'batch_norm': False, 'sage_aggr': 'max', 'sage_normalize': False, 'sage_project': False, 'lr': 3.479960714436901e-05, 'weight_decay': 2.4805762417317238e-05, 'epochs': 200, 'loss': 'mse', 'optimizer': 'adam', 'graph_mode': 'cutoff', 'cutoff': 0.3668120228068252, 'grm_norm': 'gcn', 'self_loops': False, 'use_snp_selection': True, 'num_snps': 27553}. Best is trial 120 with value: 0.3827198341723822.
[I 2025-12-09 18:00:37,570] Trial 129 finished with value: 0.3630972328740944 and parameters: {'model_type': 'graphsage', 'hidden_dims': '[512, 128]', 'dropout': 0.13746334404757268, 'batch_norm': False, 'sage_aggr': 'max', 'sage_normalize': False, 'sage_project': False, 'lr': 1.1004457273737122e-05, 'weight_decay': 4.025758186754252e-05, 'epochs': 193, 'loss': 'mse', 'optimizer': 'adam', 'graph_mode': 'knn', 'knn_k': 3, 'weighted_edges': True, 'symmetrize_mode': 'union', 'self_loops': False, 'use_snp_selection': True, 'num_snps': 28871}. Best is trial 120 with value: 0.3827198341723822.
[I 2025-12-09 18:01:56,064] Trial 130 finished with value: 0.36238473627500156 and parameters: {'model_type': 'graphsage', 'hidden_dims': '[512, 128]', 'dropout': 0.16484798282899293, 'batch_norm': False, 'sage_aggr': 'mean', 'sage_normalize': False, 'sage_project': False, 'lr': 1.8962665475452334e-05, 'weight_decay': 2.1757956913171218e-05, 'epochs': 211, 'loss': 'mse', 'optimizer': 'adam', 'graph_mode': 'cutoff', 'cutoff': 0.44285598882106914, 'grm_norm': 'gcn', 'self_loops': False, 'use_snp_selection': True, 'num_snps': 26486}. Best is trial 120 with value: 0.3827198341723822.
[I 2025-12-09 18:03:50,935] Trial 131 finished with value: 0.3756955669672671 and parameters: {'model_type': 'graphsage', 'hidden_dims': '[512, 128]', 'dropout': 0.1860836083007434, 'batch_norm': False, 'sage_aggr': 'max', 'sage_normalize': False, 'sage_project': False, 'lr': 2.3254780254746265e-05, 'weight_decay': 1.784866859107946e-05, 'epochs': 226, 'loss': 'mse', 'optimizer': 'adam', 'graph_mode': 'cutoff', 'cutoff': 0.40693206183342406, 'grm_norm': 'gcn', 'self_loops': False, 'use_snp_selection': True, 'num_snps': 32056}. Best is trial 120 with value: 0.3827198341723822.
[I 2025-12-09 18:05:11,271] Trial 132 finished with value: 0.3505347074326594 and parameters: {'model_type': 'graphsage', 'hidden_dims': '[512, 128]', 'dropout': 0.15858604433657575, 'batch_norm': False, 'sage_aggr': 'max', 'sage_normalize': False, 'sage_project': False, 'lr': 1.6608721392819407e-05, 'weight_decay': 1.0857660800551989e-05, 'epochs': 218, 'loss': 'mse', 'optimizer': 'adam', 'graph_mode': 'cutoff', 'cutoff': 0.6972687769820891, 'grm_norm': 'gcn', 'self_loops': False, 'use_snp_selection': True, 'num_snps': 36394}. Best is trial 120 with value: 0.3827198341723822.
[I 2025-12-09 18:07:04,719] Trial 133 finished with value: 0.3798706958060051 and parameters: {'model_type': 'graphsage', 'hidden_dims': '[512, 128]', 'dropout': 0.1805333860544023, 'batch_norm': False, 'sage_aggr': 'max', 'sage_normalize': False, 'sage_project': False, 'lr': 2.211383566376027e-05, 'weight_decay': 1.619938933455288e-05, 'epochs': 234, 'loss': 'mse', 'optimizer': 'adam', 'graph_mode': 'cutoff', 'cutoff': 0.3866777007150615, 'grm_norm': 'gcn', 'self_loops': False, 'use_snp_selection': True, 'num_snps': 30040}. Best is trial 120 with value: 0.3827198341723822.
[I 2025-12-09 18:08:47,947] Trial 134 finished with value: 0.3812393038528296 and parameters: {'model_type': 'graphsage', 'hidden_dims': '[512, 128]', 'dropout': 0.20842124347723923, 'batch_norm': False, 'sage_aggr': 'max', 'sage_normalize': False, 'sage_project': False, 'lr': 2.0197733004490916e-05, 'weight_decay': 7.4647036725241716e-06, 'epochs': 237, 'loss': 'mse', 'optimizer': 'adam', 'graph_mode': 'cutoff', 'cutoff': 0.39340211835907346, 'grm_norm': 'gcn', 'self_loops': False, 'use_snp_selection': True, 'num_snps': 28620}. Best is trial 120 with value: 0.3827198341723822.
[I 2025-12-09 18:10:31,149] Trial 135 finished with value: 0.3811763747324702 and parameters: {'model_type': 'graphsage', 'hidden_dims': '[512, 128]', 'dropout': 0.17364219738548287, 'batch_norm': False, 'sage_aggr': 'max', 'sage_normalize': False, 'sage_project': False, 'lr': 1.404330126383582e-05, 'weight_decay': 6.7407841236050916e-06, 'epochs': 237, 'loss': 'mse', 'optimizer': 'adam', 'graph_mode': 'cutoff', 'cutoff': 0.38474011163302185, 'grm_norm': 'gcn', 'self_loops': False, 'use_snp_selection': True, 'num_snps': 28297}. Best is trial 120 with value: 0.3827198341723822.
[I 2025-12-09 18:12:02,230] Trial 136 finished with value: 0.3715245148068223 and parameters: {'model_type': 'graphsage', 'hidden_dims': '[512, 128]', 'dropout': 0.20798584432001888, 'batch_norm': False, 'sage_aggr': 'max', 'sage_normalize': False, 'sage_project': False, 'lr': 1.534859927180702e-05, 'weight_decay': 7.64651641485844e-06, 'epochs': 189, 'loss': 'mse', 'optimizer': 'adam', 'graph_mode': 'cutoff', 'cutoff': 0.3500161813002431, 'grm_norm': 'gcn', 'self_loops': False, 'use_snp_selection': True, 'num_snps': 28270}. Best is trial 120 with value: 0.3827198341723822.
[I 2025-12-09 18:13:55,899] Trial 137 finished with value: 0.3808350713912444 and parameters: {'model_type': 'graphsage', 'hidden_dims': '[512, 128]', 'dropout': 0.17421339662016322, 'batch_norm': False, 'sage_aggr': 'max', 'sage_normalize': False, 'sage_project': False, 'lr': 1.2865759225312686e-05, 'weight_decay': 6.577828604583282e-06, 'epochs': 236, 'loss': 'mse', 'optimizer': 'adam', 'graph_mode': 'cutoff', 'cutoff': 0.37723220209702923, 'grm_norm': 'gcn', 'self_loops': False, 'use_snp_selection': True, 'num_snps': 29521}. Best is trial 120 with value: 0.3827198341723822.
[I 2025-12-09 18:15:55,155] Trial 138 finished with value: 0.3603831474667384 and parameters: {'model_type': 'graphsage', 'hidden_dims': '[512, 128]', 'dropout': 0.2232687324452437, 'batch_norm': False, 'sage_aggr': 'max', 'sage_normalize': True, 'sage_project': False, 'lr': 1.272169189723274e-05, 'weight_decay': 5.977501865684491e-06, 'epochs': 243, 'loss': 'mse', 'optimizer': 'adam', 'graph_mode': 'cutoff', 'cutoff': 0.38123225438355324, 'grm_norm': 'gcn', 'self_loops': False, 'use_snp_selection': True, 'num_snps': 29863}. Best is trial 120 with value: 0.3827198341723822.
[I 2025-12-09 18:17:06,941] Trial 139 finished with value: 0.33477341830584184 and parameters: {'model_type': 'graphsage', 'hidden_dims': '[512, 128]', 'dropout': 0.2029498395639657, 'batch_norm': True, 'sage_aggr': 'max', 'sage_normalize': False, 'sage_project': False, 'lr': 1.0845666424815658e-05, 'weight_decay': 1.3907189026181366e-05, 'epochs': 205, 'loss': 'mse', 'optimizer': 'adam', 'graph_mode': 'cutoff', 'cutoff': 0.4650894937241703, 'grm_norm': 'gcn', 'self_loops': False, 'use_snp_selection': True, 'num_snps': 24707}. Best is trial 120 with value: 0.3827198341723822.
[I 2025-12-09 18:19:54,475] Trial 140 finished with value: 0.37493554179936367 and parameters: {'model_type': 'graphsage', 'hidden_dims': '[512, 256]', 'dropout': 0.19360112725917505, 'batch_norm': False, 'sage_aggr': 'max', 'sage_normalize': False, 'sage_project': False, 'lr': 1.7992202397049543e-05, 'weight_decay': 7.417005962764286e-06, 'epochs': 235, 'loss': 'mse', 'optimizer': 'adam', 'graph_mode': 'cutoff', 'cutoff': 0.36824335833407146, 'grm_norm': 'gcn', 'self_loops': False, 'use_snp_selection': False}. Best is trial 120 with value: 0.3827198341723822.
[I 2025-12-09 18:21:49,512] Trial 141 finished with value: 0.37954330696721494 and parameters: {'model_type': 'graphsage', 'hidden_dims': '[512, 128]', 'dropout': 0.17365280032876837, 'batch_norm': False, 'sage_aggr': 'max', 'sage_normalize': False, 'sage_project': False, 'lr': 1.5034085331026028e-05, 'weight_decay': 4.374437075421635e-06, 'epochs': 219, 'loss': 'mse', 'optimizer': 'adam', 'graph_mode': 'cutoff', 'cutoff': 0.3892249398775058, 'grm_norm': 'gcn', 'self_loops': False, 'use_snp_selection': True, 'num_snps': 34479}. Best is trial 120 with value: 0.3827198341723822.
