[I 2025-12-06 09:18:25,276] Trial 19 finished with value: 0.22264005015541502 and parameters: {'model_type': 'graphsage', 'hidden_dims': '[128, 64]', 'dropout': 0.42759917174788054, 'batch_norm': True, 'sage_aggr': 'mean', 'sage_normalize': False, 'sage_project': False, 'lr': 1.5320723507291966e-05, 'weight_decay': 1.004249014641976e-07, 'epochs': 187, 'loss': 'mae', 'optimizer': 'adam', 'graph_mode': 'cutoff', 'cutoff': 0.7797698181086729, 'grm_norm': 'gcn', 'self_loops': False, 'use_snp_selection': False, 'graphsage_batch_size': 32}. Best is trial 19 with value: 0.22264005015541502.
[I 2025-12-06 09:19:08,378] Trial 20 finished with value: 0.1970298059421971 and parameters: {'model_type': 'graphsage', 'hidden_dims': '[128, 64]', 'dropout': 0.32014303269460315, 'batch_norm': True, 'sage_aggr': 'mean', 'sage_normalize': False, 'sage_project': False, 'lr': 1.6418360674108304e-05, 'weight_decay': 1.0539304248422403e-07, 'epochs': 180, 'loss': 'mae', 'optimizer': 'adam', 'graph_mode': 'cutoff', 'cutoff': 0.5414037555100982, 'grm_norm': 'gcn', 'self_loops': False, 'use_snp_selection': False, 'graphsage_batch_size': 256}. Best is trial 19 with value: 0.22264005015541502.
[I 2025-12-06 09:19:51,504] Trial 21 finished with value: 0.19757712535432997 and parameters: {'model_type': 'graphsage', 'hidden_dims': '[128, 64]', 'dropout': 0.4225382233387566, 'batch_norm': True, 'sage_aggr': 'mean', 'sage_normalize': False, 'sage_project': False, 'lr': 7.849186454679803e-05, 'weight_decay': 3.4466044378897925e-07, 'epochs': 205, 'loss': 'mae', 'optimizer': 'adam', 'graph_mode': 'cutoff', 'cutoff': 0.78780572170878, 'grm_norm': 'gcn', 'self_loops': False, 'use_snp_selection': False, 'graphsage_batch_size': 32}. Best is trial 19 with value: 0.22264005015541502.
[I 2025-12-06 09:20:38,827] Trial 22 finished with value: 0.19101156549214443 and parameters: {'model_type': 'graphsage', 'hidden_dims': '[128, 64]', 'dropout': 0.5184362272507079, 'batch_norm': True, 'sage_aggr': 'mean', 'sage_normalize': False, 'sage_project': False, 'lr': 2.1369585426069683e-05, 'weight_decay': 4.284020945654957e-06, 'epochs': 226, 'loss': 'mae', 'optimizer': 'adam', 'graph_mode': 'cutoff', 'cutoff': 0.7662440230658447, 'grm_norm': 'cosine', 'self_loops': False, 'use_snp_selection': False, 'graphsage_batch_size': 32}. Best is trial 19 with value: 0.22264005015541502.
[I 2025-12-06 09:21:47,307] Trial 23 finished with value: 0.2083676677610724 and parameters: {'model_type': 'graphsage', 'hidden_dims': '[256, 128, 64]', 'dropout': 0.4320668471369436, 'batch_norm': True, 'sage_aggr': 'mean', 'sage_normalize': False, 'sage_project': False, 'lr': 0.000270392455514283, 'weight_decay': 2.8285856619586093e-07, 'epochs': 195, 'loss': 'mae', 'optimizer': 'adam', 'graph_mode': 'cutoff', 'cutoff': 0.6231229414017784, 'grm_norm': 'gcn', 'self_loops': False, 'use_snp_selection': False, 'graphsage_batch_size': 32}. Best is trial 19 with value: 0.22264005015541502.
[I 2025-12-06 09:22:40,575] Trial 24 finished with value: 0.2005478730171652 and parameters: {'model_type': 'graphsage', 'hidden_dims': '[256, 128, 64]', 'dropout': 0.4739826639903519, 'batch_norm': True, 'sage_aggr': 'mean', 'sage_normalize': False, 'sage_project': False, 'lr': 0.00012185125405278892, 'weight_decay': 1.0569625691054925e-06, 'epochs': 150, 'loss': 'mae', 'optimizer': 'adam', 'graph_mode': 'cutoff', 'cutoff': 0.8245137693620204, 'grm_norm': 'none', 'self_loops': False, 'use_snp_selection': False, 'graphsage_batch_size': 32}. Best is trial 19 with value: 0.22264005015541502.
[I 2025-12-06 09:23:30,308] Trial 25 finished with value: 0.20716785285253567 and parameters: {'model_type': 'graphsage', 'hidden_dims': '[128, 64]', 'dropout': 0.42590612286366447, 'batch_norm': True, 'sage_aggr': 'mean', 'sage_normalize': False, 'sage_project': False, 'lr': 5.509214827203986e-05, 'weight_decay': 0.00022275046080081357, 'epochs': 229, 'loss': 'mae', 'optimizer': 'adam', 'graph_mode': 'cutoff', 'cutoff': 0.6027143110502403, 'grm_norm': 'none', 'self_loops': False, 'use_snp_selection': False, 'graphsage_batch_size': 512}. Best is trial 19 with value: 0.22264005015541502.
[I 2025-12-06 09:24:33,539] Trial 26 finished with value: 0.1824454348678421 and parameters: {'model_type': 'graphsage', 'hidden_dims': '[256, 128, 64]', 'dropout': 0.5270360802302516, 'batch_norm': True, 'sage_aggr': 'max', 'sage_normalize': False, 'sage_project': False, 'lr': 9.84281855198312e-06, 'weight_decay': 6.084359867775956e-05, 'epochs': 183, 'loss': 'mse', 'optimizer': 'adam', 'graph_mode': 'cutoff', 'cutoff': 0.7347803975089463, 'grm_norm': 'gcn', 'self_loops': False, 'use_snp_selection': False, 'graphsage_batch_size': 32}. Best is trial 19 with value: 0.22264005015541502.
[I 2025-12-06 09:26:16,095] Trial 27 finished with value: 0.21098817755714533 and parameters: {'model_type': 'graphsage', 'hidden_dims': '[512, 256]', 'dropout': 0.45135013706215904, 'batch_norm': True, 'sage_aggr': 'mean', 'sage_normalize': False, 'sage_project': False, 'lr': 2.91855756022761e-05, 'weight_decay': 2.0043928569913463e-07, 'epochs': 173, 'loss': 'mae', 'optimizer': 'adam', 'graph_mode': 'cutoff', 'cutoff': 0.8227745255969104, 'grm_norm': 'none', 'self_loops': False, 'use_snp_selection': False, 'graphsage_batch_size': 32}. Best is trial 19 with value: 0.22264005015541502.
[I 2025-12-06 09:28:16,434] Trial 28 finished with value: 0.20602999081559284 and parameters: {'model_type': 'graphsage', 'hidden_dims': '[512, 256]', 'dropout': 0.3244500587991029, 'batch_norm': True, 'sage_aggr': 'mean', 'sage_normalize': False, 'sage_project': False, 'lr': 2.416222498311717e-05, 'weight_decay': 2.2098510630294406e-07, 'epochs': 173, 'loss': 'mae', 'optimizer': 'adam', 'graph_mode': 'cutoff', 'cutoff': 0.4569276929212784, 'grm_norm': 'cosine_then_gcn', 'self_loops': False, 'use_snp_selection': False, 'graphsage_batch_size': 32}. Best is trial 19 with value: 0.22264005015541502.
[I 2025-12-06 09:29:45,839] Trial 29 finished with value: 0.1977088391002316 and parameters: {'model_type': 'graphsage', 'hidden_dims': '[512, 256]', 'dropout': 0.36414333240227054, 'batch_norm': True, 'sage_aggr': 'max', 'sage_normalize': False, 'sage_project': False, 'lr': 4.4213791016544324e-05, 'weight_decay': 1.8251161563526713e-07, 'epochs': 148, 'loss': 'mse', 'optimizer': 'adam', 'graph_mode': 'cutoff', 'cutoff': 0.6961996044083654, 'grm_norm': 'cosine', 'self_loops': False, 'use_snp_selection': False, 'graphsage_batch_size': 256}. Best is trial 19 with value: 0.22264005015541502.
[I 2025-12-06 09:31:24,112] Trial 30 finished with value: 0.20092921255037752 and parameters: {'model_type': 'graphsage', 'hidden_dims': '[512, 256]', 'dropout': 0.5521206099315873, 'batch_norm': True, 'sage_aggr': 'mean', 'sage_normalize': False, 'sage_project': False, 'lr': 1.14521349165477e-05, 'weight_decay': 7.747188769271626e-07, 'epochs': 165, 'loss': 'mae', 'optimizer': 'adam', 'graph_mode': 'cutoff', 'cutoff': 0.8417013098559905, 'grm_norm': 'gcn', 'self_loops': False, 'use_snp_selection': False, 'graphsage_batch_size': 16}. Best is trial 19 with value: 0.22264005015541502.
[I 2025-12-06 09:32:06,264] Trial 31 finished with value: 0.19656363490240003 and parameters: {'model_type': 'graphsage', 'hidden_dims': '[128, 64]', 'dropout': 0.44590946856511954, 'batch_norm': True, 'sage_aggr': 'mean', 'sage_normalize': False, 'sage_project': False, 'lr': 0.00010715516597803573, 'weight_decay': 1.0515112980541093e-07, 'epochs': 200, 'loss': 'mae', 'optimizer': 'adam', 'graph_mode': 'cutoff', 'cutoff': 0.799954187851481, 'grm_norm': 'none', 'self_loops': False, 'use_snp_selection': False, 'graphsage_batch_size': 32}. Best is trial 19 with value: 0.22264005015541502.
[I 2025-12-06 09:34:10,189] Trial 32 finished with value: 0.20705099828686185 and parameters: {'model_type': 'graphsage', 'hidden_dims': '[512, 64]', 'dropout': 0.4011799832192838, 'batch_norm': True, 'sage_aggr': 'mean', 'sage_normalize': False, 'sage_project': False, 'lr': 2.8897110800725587e-05, 'weight_decay': 1.5399101543750746e-05, 'epochs': 214, 'loss': 'mae', 'optimizer': 'adam', 'graph_mode': 'cutoff', 'cutoff': 0.7951527684624443, 'grm_norm': 'none', 'self_loops': False, 'use_snp_selection': False, 'graphsage_batch_size': 32}. Best is trial 19 with value: 0.22264005015541502.
[I 2025-12-06 09:35:53,771] Trial 33 finished with value: 0.19555257820258626 and parameters: {'model_type': 'graphsage', 'hidden_dims': '[512, 256]', 'dropout': 0.4614091691574086, 'batch_norm': True, 'sage_aggr': 'mean', 'sage_normalize': False, 'sage_project': False, 'lr': 3.7198007574291304e-05, 'weight_decay': 1.7008845816985419e-06, 'epochs': 175, 'loss': 'mae', 'optimizer': 'adam', 'graph_mode': 'cutoff', 'cutoff': 0.8628540833741892, 'grm_norm': 'none', 'self_loops': False, 'use_snp_selection': False, 'graphsage_batch_size': 32}. Best is trial 19 with value: 0.22264005015541502.
[I 2025-12-06 09:36:20,917] Trial 34 finished with value: 0.1910974561649303 and parameters: {'model_type': 'graphsage', 'hidden_dims': '[128, 64]', 'dropout': 0.4908815432212923, 'batch_norm': True, 'sage_aggr': 'mean', 'sage_normalize': False, 'sage_project': False, 'lr': 0.00026785901763640477, 'weight_decay': 4.4295661876697754e-07, 'epochs': 117, 'loss': 'mse', 'optimizer': 'adam', 'graph_mode': 'cutoff', 'cutoff': 0.7454033001034978, 'grm_norm': 'none', 'self_loops': False, 'use_snp_selection': False, 'graphsage_batch_size': 8}. Best is trial 19 with value: 0.22264005015541502.
[I 2025-12-06 09:37:17,066] Trial 35 finished with value: 0.2002933447063897 and parameters: {'model_type': 'graphsage', 'hidden_dims': '[256, 128, 64]', 'dropout': 0.4035923525453283, 'batch_norm': True, 'sage_aggr': 'mean', 'sage_normalize': False, 'sage_project': False, 'lr': 9.810644701288165e-05, 'weight_decay': 4.68571031633824e-06, 'epochs': 156, 'loss': 'mae', 'optimizer': 'adam', 'graph_mode': 'cutoff', 'cutoff': 0.628536212658012, 'grm_norm': 'none', 'self_loops': False, 'use_snp_selection': False, 'graphsage_batch_size': 512}. Best is trial 19 with value: 0.22264005015541502.
[I 2025-12-06 09:39:28,849] Trial 36 finished with value: 0.12358909592499215 and parameters: {'model_type': 'graphsage', 'hidden_dims': '[512, 128]', 'dropout': 0.35521708624235904, 'batch_norm': True, 'sage_aggr': 'max', 'sage_normalize': False, 'sage_project': False, 'lr': 3.9195785274117345e-06, 'weight_decay': 2.2798972393266483e-06, 'epochs': 219, 'loss': 'mse', 'optimizer': 'adam', 'graph_mode': 'knn', 'knn_k': 1, 'weighted_edges': False, 'symmetrize_mode': 'union', 'self_loops': False, 'use_snp_selection': False, 'graphsage_batch_size': 64}. Best is trial 19 with value: 0.22264005015541502.
[I 2025-12-06 09:40:56,253] Trial 37 finished with value: 0.19198808216012625 and parameters: {'model_type': 'graphsage', 'hidden_dims': '[256, 128]', 'dropout': 0.3883820327709932, 'batch_norm': True, 'sage_aggr': 'mean', 'sage_normalize': True, 'sage_project': False, 'lr': 4.567346002442053e-05, 'weight_decay': 1.6939180756829415e-07, 'epochs': 194, 'loss': 'mae', 'optimizer': 'adam', 'graph_mode': 'cutoff', 'cutoff': 0.8962130726731048, 'grm_norm': 'none', 'self_loops': False, 'use_snp_selection': True, 'num_snps': 59893, 'graphsage_batch_size': 256}. Best is trial 19 with value: 0.22264005015541502.
[I 2025-12-06 09:43:44,877] Trial 38 finished with value: 0.11352584230343002 and parameters: {'model_type': 'graphsage', 'hidden_dims': '[256, 128, 64]', 'dropout': 0.1926704647551926, 'batch_norm': False, 'sage_aggr': 'max', 'sage_normalize': False, 'sage_project': False, 'lr': 0.00026103602503492723, 'weight_decay': 1.5961460177843824e-05, 'epochs': 168, 'loss': 'mae', 'optimizer': 'adam', 'graph_mode': 'knn', 'knn_k': 10, 'weighted_edges': False, 'symmetrize_mode': 'union', 'self_loops': False, 'use_snp_selection': False, 'graphsage_batch_size': 32}. Best is trial 19 with value: 0.22264005015541502.
[I 2025-12-06 09:44:31,761] Trial 39 finished with value: 0.21093029351782913 and parameters: {'model_type': 'graphsage', 'hidden_dims': '[512, 64]', 'dropout': 0.45052206473292056, 'batch_norm': True, 'sage_aggr': 'mean', 'sage_normalize': True, 'sage_project': False, 'lr': 1.7024045499402845e-05, 'weight_decay': 0.0002596757427158642, 'epochs': 140, 'loss': 'mse', 'optimizer': 'adam', 'graph_mode': 'cutoff', 'cutoff': 0.6979084407197624, 'grm_norm': 'gcn', 'self_loops': False, 'use_snp_selection': True, 'num_snps': 23196, 'graphsage_batch_size': 8}. Best is trial 19 with value: 0.22264005015541502.
[I 2025-12-06 09:45:17,333] Trial 40 finished with value: 0.1800301338537195 and parameters: {'model_type': 'graphsage', 'hidden_dims': '[512, 64]', 'dropout': 0.5012424627340398, 'batch_norm': True, 'sage_aggr': 'mean', 'sage_normalize': True, 'sage_project': False, 'lr': 2.301458422147669e-05, 'weight_decay': 0.0003092005182999767, 'epochs': 139, 'loss': 'mse', 'optimizer': 'adam', 'graph_mode': 'knn', 'knn_k': 1, 'weighted_edges': False, 'symmetrize_mode': 'union', 'self_loops': False, 'use_snp_selection': True, 'num_snps': 21664, 'graphsage_batch_size': 8}. Best is trial 19 with value: 0.22264005015541502.
[I 2025-12-06 09:46:03,382] Trial 41 finished with value: 0.19405543868091846 and parameters: {'model_type': 'graphsage', 'hidden_dims': '[512, 64]', 'dropout': 0.45380549183946384, 'batch_norm': True, 'sage_aggr': 'mean', 'sage_normalize': True, 'sage_project': False, 'lr': 1.0277937592470182e-05, 'weight_decay': 0.00010658522028627759, 'epochs': 99, 'loss': 'mse', 'optimizer': 'adam', 'graph_mode': 'cutoff', 'cutoff': 0.7128336763604985, 'grm_norm': 'gcn', 'self_loops': False, 'use_snp_selection': True, 'num_snps': 30174, 'graphsage_batch_size': 8}. Best is trial 19 with value: 0.22264005015541502.
[I 2025-12-06 09:46:47,638] Trial 42 finished with value: 0.20827310845073285 and parameters: {'model_type': 'graphsage', 'hidden_dims': '[512, 64]', 'dropout': 0.4205210649115059, 'batch_norm': True, 'sage_aggr': 'mean', 'sage_normalize': True, 'sage_project': False, 'lr': 1.740634452312703e-05, 'weight_decay': 0.000458080394005453, 'epochs': 187, 'loss': 'mse', 'optimizer': 'adam', 'graph_mode': 'cutoff', 'cutoff': 0.7639931114185475, 'grm_norm': 'gcn', 'self_loops': False, 'use_snp_selection': True, 'num_snps': 16820, 'graphsage_batch_size': 8}. Best is trial 19 with value: 0.22264005015541502.
[I 2025-12-06 09:47:27,070] Trial 43 finished with value: 0.1888145202376488 and parameters: {'model_type': 'graphsage', 'hidden_dims': '[256, 128]', 'dropout': 0.4867579562639293, 'batch_norm': True, 'sage_aggr': 'mean', 'sage_normalize': True, 'sage_project': False, 'lr': 3.507825689639242e-05, 'weight_decay': 0.0008706461541689116, 'epochs': 83, 'loss': 'mse', 'optimizer': 'adam', 'graph_mode': 'cutoff', 'cutoff': 0.824295579064126, 'grm_norm': 'gcn', 'self_loops': False, 'use_snp_selection': True, 'num_snps': 41649, 'graphsage_batch_size': 8}. Best is trial 19 with value: 0.22264005015541502.
[I 2025-12-06 09:48:15,793] Trial 44 finished with value: 0.17699508640352618 and parameters: {'model_type': 'graphsage', 'hidden_dims': '[512, 64]', 'dropout': 0.5762882720349453, 'batch_norm': False, 'sage_aggr': 'mean', 'sage_normalize': True, 'sage_project': False, 'lr': 3.087573231525264e-05, 'weight_decay': 0.0001827532975085203, 'epochs': 117, 'loss': 'mse', 'optimizer': 'adam', 'graph_mode': 'cutoff', 'cutoff': 0.3923971572252091, 'grm_norm': 'gcn', 'self_loops': False, 'use_snp_selection': True, 'num_snps': 22772, 'graphsage_batch_size': 128}. Best is trial 19 with value: 0.22264005015541502.
[I 2025-12-06 09:48:45,128] Trial 45 finished with value: 0.1808783843543555 and parameters: {'model_type': 'graphsage', 'hidden_dims': '[512, 128]', 'dropout': 0.37604191376295065, 'batch_norm': True, 'sage_aggr': 'mean', 'sage_normalize': True, 'sage_project': False, 'lr': 7.550416796741022e-06, 'weight_decay': 4.7186706244697833e-05, 'epochs': 161, 'loss': 'mae', 'optimizer': 'adam', 'graph_mode': 'cutoff', 'cutoff': 0.5908447387142348, 'grm_norm': 'cosine_then_gcn', 'self_loops': False, 'use_snp_selection': True, 'num_snps': 8899, 'graphsage_batch_size': 64}. Best is trial 19 with value: 0.22264005015541502.
[I 2025-12-06 09:50:22,128] Trial 46 finished with value: 0.15435279307319755 and parameters: {'model_type': 'graphsage', 'hidden_dims': '[512, 256]', 'dropout': 0.4548938216192698, 'batch_norm': True, 'sage_aggr': 'max', 'sage_normalize': False, 'sage_project': False, 'lr': 1.0723833370436655e-06, 'weight_decay': 0.0005379273040959282, 'epochs': 239, 'loss': 'mae', 'optimizer': 'adam', 'graph_mode': 'cutoff', 'cutoff': 0.8126115967753774, 'grm_norm': 'gcn', 'self_loops': False, 'use_snp_selection': True, 'num_snps': 36525, 'graphsage_batch_size': 512}. Best is trial 19 with value: 0.22264005015541502.
[I 2025-12-06 09:51:53,146] Trial 47 finished with value: 0.17213931260498183 and parameters: {'model_type': 'graphsage', 'hidden_dims': '[512, 64]', 'dropout': 0.5312597969049755, 'batch_norm': False, 'sage_aggr': 'mean', 'sage_normalize': True, 'sage_project': False, 'lr': 3.3625738770223386e-06, 'weight_decay': 0.0001284513836995364, 'epochs': 142, 'loss': 'mse', 'optimizer': 'adam', 'graph_mode': 'knn', 'knn_k': 3, 'weighted_edges': True, 'symmetrize_mode': 'mutual', 'self_loops': False, 'use_snp_selection': False, 'graphsage_batch_size': 32}. Best is trial 19 with value: 0.22264005015541502.
[I 2025-12-06 09:52:55,354] Trial 48 finished with value: 0.2041369931107174 and parameters: {'model_type': 'graphsage', 'hidden_dims': '[256, 128, 64]', 'dropout': 0.4027794369860071, 'batch_norm': True, 'sage_aggr': 'mean', 'sage_normalize': False, 'sage_project': False, 'lr': 4.788086109338255e-06, 'weight_decay': 0.0003033632199735305, 'epochs': 177, 'loss': 'mae', 'optimizer': 'adam', 'graph_mode': 'cutoff', 'cutoff': 0.6516299434385656, 'grm_norm': 'cosine_then_gcn', 'self_loops': False, 'use_snp_selection': False, 'graphsage_batch_size': 16}. Best is trial 19 with value: 0.22264005015541502.
[I 2025-12-06 09:53:09,565] Trial 49 finished with value: 0.2074021027845633 and parameters: {'model_type': 'graphsage', 'hidden_dims': '[128, 64]', 'dropout': 0.33524750644973367, 'batch_norm': True, 'sage_aggr': 'mean', 'sage_normalize': False, 'sage_project': False, 'lr': 0.00042178774794845075, 'weight_decay': 7.220860043329147e-06, 'epochs': 46, 'loss': 'mae', 'optimizer': 'adam', 'graph_mode': 'cutoff', 'cutoff': 0.7057941245694315, 'grm_norm': 'none', 'self_loops': False, 'use_snp_selection': False, 'graphsage_batch_size': 32}. Best is trial 19 with value: 0.22264005015541502.
[I 2025-12-06 09:54:10,173] Trial 50 finished with value: 0.20026245465182407 and parameters: {'model_type': 'graphsage', 'hidden_dims': '[256, 128]', 'dropout': 0.4802256740579714, 'batch_norm': True, 'sage_aggr': 'mean', 'sage_normalize': True, 'sage_project': False, 'lr': 6.306007841593563e-05, 'weight_decay': 2.252444790245147e-05, 'epochs': 128, 'loss': 'mae', 'optimizer': 'adam', 'graph_mode': 'cutoff', 'cutoff': 0.8744630771268298, 'grm_norm': 'cosine', 'self_loops': False, 'use_snp_selection': True, 'num_snps': 56060, 'graphsage_batch_size': 128}. Best is trial 19 with value: 0.22264005015541502.
[I 2025-12-06 09:55:14,122] Trial 51 finished with value: 0.21237745451105092 and parameters: {'model_type': 'graphsage', 'hidden_dims': '[256, 128, 64]', 'dropout': 0.5109483752001437, 'batch_norm': True, 'sage_aggr': 'mean', 'sage_normalize': False, 'sage_project': False, 'lr': 8.942606301626691e-05, 'weight_decay': 0.0008273436817002784, 'epochs': 183, 'loss': 'mae', 'optimizer': 'adam', 'graph_mode': 'cutoff', 'cutoff': 0.6737367252150043, 'grm_norm': 'none', 'self_loops': False, 'use_snp_selection': False, 'graphsage_batch_size': 32}. Best is trial 19 with value: 0.22264005015541502.
[I 2025-12-06 09:56:23,393] Trial 52 finished with value: 0.2055382039764791 and parameters: {'model_type': 'graphsage', 'hidden_dims': '[256, 128, 64]', 'dropout': 0.5098241222159894, 'batch_norm': True, 'sage_aggr': 'mean', 'sage_normalize': False, 'sage_project': False, 'lr': 0.00019870650796082433, 'weight_decay': 0.0003310523018181703, 'epochs': 202, 'loss': 'mae', 'optimizer': 'adam', 'graph_mode': 'cutoff', 'cutoff': 0.7634703399787386, 'grm_norm': 'none', 'self_loops': False, 'use_snp_selection': False, 'graphsage_batch_size': 32}. Best is trial 19 with value: 0.22264005015541502.
[I 2025-12-06 09:57:29,457] Trial 53 finished with value: 0.20937464415705181 and parameters: {'model_type': 'graphsage', 'hidden_dims': '[256, 128, 64]', 'dropout': 0.4392194584993278, 'batch_norm': True, 'sage_aggr': 'mean', 'sage_normalize': False, 'sage_project': False, 'lr': 9.116416910864511e-05, 'weight_decay': 0.0005772044449397508, 'epochs': 190, 'loss': 'mae', 'optimizer': 'adam', 'graph_mode': 'cutoff', 'cutoff': 0.6818835750908397, 'grm_norm': 'none', 'self_loops': False, 'use_snp_selection': False, 'graphsage_batch_size': 32}. Best is trial 19 with value: 0.22264005015541502.
[I 2025-12-06 09:58:24,701] Trial 54 finished with value: 0.2105358552825986 and parameters: {'model_type': 'graphsage', 'hidden_dims': '[256, 128, 64]', 'dropout': 0.4319565981924265, 'batch_norm': True, 'sage_aggr': 'mean', 'sage_normalize': False, 'sage_project': False, 'lr': 8.37938685959314e-05, 'weight_decay': 0.0006117920459709695, 'epochs': 154, 'loss': 'mae', 'optimizer': 'adam', 'graph_mode': 'cutoff', 'cutoff': 0.6460653673955787, 'grm_norm': 'none', 'self_loops': False, 'use_snp_selection': False, 'graphsage_batch_size': 32}. Best is trial 19 with value: 0.22264005015541502.
