[I 2025-12-09 06:29:43,712] Trial 72 finished with value: 0.29208405174803553 and parameters: {'model_type': 'graphsage', 'hidden_dims': '[512, 128]', 'dropout': 0.2061611092959224, 'batch_norm': False, 'sage_aggr': 'max', 'sage_normalize': False, 'sage_project': False, 'lr': 3.402797072753742e-05, 'weight_decay': 2.8269839357667737e-06, 'epochs': 206, 'loss': 'mse', 'optimizer': 'adam', 'graph_mode': 'cutoff', 'cutoff': 0.5975599103664857, 'grm_norm': 'none', 'self_loops': False, 'use_snp_selection': False}. Best is trial 60 with value: 0.29498166171326784.
[I 2025-12-09 06:31:29,129] Trial 73 finished with value: 0.2873449874967483 and parameters: {'model_type': 'graphsage', 'hidden_dims': '[512, 64]', 'dropout': 0.15706910374144592, 'batch_norm': False, 'sage_aggr': 'mean', 'sage_normalize': False, 'sage_project': False, 'lr': 1.9837244064109573e-05, 'weight_decay': 3.4939574387218336e-05, 'epochs': 176, 'loss': 'mse', 'optimizer': 'adam', 'graph_mode': 'cutoff', 'cutoff': 0.636789542619423, 'grm_norm': 'none', 'self_loops': False, 'use_snp_selection': False}. Best is trial 60 with value: 0.29498166171326784.
[I 2025-12-09 06:32:29,783] Trial 74 finished with value: 0.29334922295302923 and parameters: {'model_type': 'graphsage', 'hidden_dims': '[256, 128]', 'dropout': 0.22369638079794152, 'batch_norm': False, 'sage_aggr': 'mean', 'sage_normalize': False, 'sage_project': False, 'lr': 2.602850633071826e-05, 'weight_decay': 1.531173396036146e-05, 'epochs': 167, 'loss': 'mse', 'optimizer': 'adam', 'graph_mode': 'cutoff', 'cutoff': 0.5183079690259712, 'grm_norm': 'cosine_then_gcn', 'self_loops': False, 'use_snp_selection': False}. Best is trial 60 with value: 0.29498166171326784.
[I 2025-12-09 06:33:23,095] Trial 75 finished with value: 0.28641984946056437 and parameters: {'model_type': 'graphsage', 'hidden_dims': '[512, 64]', 'dropout': 0.18148871506070885, 'batch_norm': False, 'sage_aggr': 'mean', 'sage_normalize': False, 'sage_project': False, 'lr': 1.2541625136517856e-05, 'weight_decay': 2.3779192225548363e-05, 'epochs': 197, 'loss': 'mse', 'optimizer': 'adam', 'graph_mode': 'cutoff', 'cutoff': 0.3493574963658547, 'grm_norm': 'none', 'self_loops': False, 'use_snp_selection': True, 'num_snps': 12255}. Best is trial 60 with value: 0.29498166171326784.
[I 2025-12-09 06:34:35,359] Trial 76 finished with value: 0.2903374043404973 and parameters: {'model_type': 'graphsage', 'hidden_dims': '[128, 64]', 'dropout': 0.21036707257073897, 'batch_norm': False, 'sage_aggr': 'mean', 'sage_normalize': False, 'sage_project': False, 'lr': 4.7545622794355936e-05, 'weight_decay': 5.578693858014472e-05, 'epochs': 222, 'loss': 'mse', 'optimizer': 'adam', 'graph_mode': 'cutoff', 'cutoff': 0.4165191406261902, 'grm_norm': 'none', 'self_loops': False, 'use_snp_selection': False}. Best is trial 60 with value: 0.29498166171326784.
[I 2025-12-09 06:36:47,752] Trial 77 finished with value: 0.2902693860451198 and parameters: {'model_type': 'graphsage', 'hidden_dims': '[512, 128]', 'dropout': 0.1332414450936403, 'batch_norm': False, 'sage_aggr': 'max', 'sage_normalize': False, 'sage_project': False, 'lr': 1.9778308828666693e-05, 'weight_decay': 0.00016822497040330588, 'epochs': 184, 'loss': 'mse', 'optimizer': 'adam', 'graph_mode': 'cutoff', 'cutoff': 0.48604544539971273, 'grm_norm': 'gcn', 'self_loops': False, 'use_snp_selection': False}. Best is trial 60 with value: 0.29498166171326784.
[I 2025-12-09 06:38:18,293] Trial 78 finished with value: 0.24655455736116388 and parameters: {'model_type': 'graphsage', 'hidden_dims': '[512, 64]', 'dropout': 0.24796570274262558, 'batch_norm': False, 'sage_aggr': 'mean', 'sage_normalize': False, 'sage_project': False, 'lr': 9.819455660899716e-05, 'weight_decay': 7.048509451281116e-06, 'epochs': 146, 'loss': 'mse', 'optimizer': 'adam', 'graph_mode': 'cutoff', 'cutoff': 0.5386710761008543, 'grm_norm': 'cosine_then_gcn', 'self_loops': True, 'use_snp_selection': False}. Best is trial 60 with value: 0.29498166171326784.
[I 2025-12-09 06:39:26,402] Trial 79 finished with value: 0.2638663236246598 and parameters: {'model_type': 'graphsage', 'hidden_dims': '[256, 128, 64]', 'dropout': 0.16385236501051703, 'batch_norm': False, 'sage_aggr': 'mean', 'sage_normalize': True, 'sage_project': False, 'lr': 1.2782248032633117e-05, 'weight_decay': 1.1681101522710691e-05, 'epochs': 137, 'loss': 'mse', 'optimizer': 'adam', 'graph_mode': 'cutoff', 'cutoff': 0.36340764187313224, 'grm_norm': 'none', 'self_loops': False, 'use_snp_selection': False}. Best is trial 60 with value: 0.29498166171326784.
[I 2025-12-09 06:42:21,616] Trial 80 finished with value: 0.2641578123070001 and parameters: {'model_type': 'graphsage', 'hidden_dims': '[512, 64]', 'dropout': 0.11701362102996307, 'batch_norm': True, 'sage_aggr': 'mean', 'sage_normalize': False, 'sage_project': False, 'lr': 5.75010960119707e-05, 'weight_decay': 1.599313496411148e-06, 'epochs': 240, 'loss': 'mse', 'optimizer': 'adam', 'graph_mode': 'cutoff', 'cutoff': 0.3999716470651748, 'grm_norm': 'none', 'self_loops': False, 'use_snp_selection': False}. Best is trial 60 with value: 0.29498166171326784.
[I 2025-12-09 06:44:16,908] Trial 81 finished with value: 0.29639479171058924 and parameters: {'model_type': 'graphsage', 'hidden_dims': '[512, 256]', 'dropout': 0.18385118550355536, 'batch_norm': False, 'sage_aggr': 'mean', 'sage_normalize': False, 'sage_project': False, 'lr': 1.823370779639247e-05, 'weight_decay': 1.6862421734058888e-05, 'epochs': 161, 'loss': 'mse', 'optimizer': 'adam', 'graph_mode': 'cutoff', 'cutoff': 0.43312863917435573, 'grm_norm': 'cosine', 'self_loops': False, 'use_snp_selection': False}. Best is trial 81 with value: 0.29639479171058924.
[I 2025-12-09 06:46:18,651] Trial 82 finished with value: 0.2937562576114641 and parameters: {'model_type': 'graphsage', 'hidden_dims': '[512, 256]', 'dropout': 0.19463935144754982, 'batch_norm': False, 'sage_aggr': 'mean', 'sage_normalize': False, 'sage_project': False, 'lr': 2.108894510630164e-05, 'weight_decay': 0.00010179541861527973, 'epochs': 172, 'loss': 'mse', 'optimizer': 'adam', 'graph_mode': 'cutoff', 'cutoff': 0.4466443960488169, 'grm_norm': 'cosine', 'self_loops': False, 'use_snp_selection': False}. Best is trial 81 with value: 0.29639479171058924.
[I 2025-12-09 06:48:36,861] Trial 83 finished with value: 0.2919876516378048 and parameters: {'model_type': 'graphsage', 'hidden_dims': '[512, 128]', 'dropout': 0.19820708378395543, 'batch_norm': False, 'sage_aggr': 'mean', 'sage_normalize': False, 'sage_project': False, 'lr': 1.4575155502626777e-05, 'weight_decay': 0.00010240337616488256, 'epochs': 196, 'loss': 'mse', 'optimizer': 'adam', 'graph_mode': 'cutoff', 'cutoff': 0.44329066666120187, 'grm_norm': 'cosine', 'self_loops': False, 'use_snp_selection': False}. Best is trial 81 with value: 0.29639479171058924.
[I 2025-12-09 06:50:38,048] Trial 84 finished with value: 0.2895438395075706 and parameters: {'model_type': 'graphsage', 'hidden_dims': '[512, 64]', 'dropout': 0.17380423225543623, 'batch_norm': False, 'sage_aggr': 'mean', 'sage_normalize': False, 'sage_project': False, 'lr': 1.9150593312620694e-05, 'weight_decay': 7.25785411189444e-05, 'epochs': 173, 'loss': 'mse', 'optimizer': 'adam', 'graph_mode': 'cutoff', 'cutoff': 0.4729368917724487, 'grm_norm': 'cosine', 'self_loops': False, 'use_snp_selection': False}. Best is trial 81 with value: 0.29639479171058924.
[I 2025-12-09 06:52:17,609] Trial 85 finished with value: 0.29494672331147376 and parameters: {'model_type': 'graphsage', 'hidden_dims': '[512, 256]', 'dropout': 0.15247537587604165, 'batch_norm': False, 'sage_aggr': 'mean', 'sage_normalize': False, 'sage_project': False, 'lr': 2.650933009108895e-05, 'weight_decay': 1.6229063987115594e-05, 'epochs': 149, 'loss': 'mse', 'optimizer': 'adam', 'graph_mode': 'cutoff', 'cutoff': 0.49962547201478946, 'grm_norm': 'cosine', 'self_loops': False, 'use_snp_selection': False}. Best is trial 81 with value: 0.29639479171058924.
[I 2025-12-09 06:54:05,544] Trial 86 finished with value: 0.27237882437633765 and parameters: {'model_type': 'graphsage', 'hidden_dims': '[512, 256]', 'dropout': 0.15368901296828152, 'batch_norm': False, 'sage_aggr': 'mean', 'sage_normalize': False, 'sage_project': False, 'lr': 2.7201933722812796e-05, 'weight_decay': 4.0290668275234116e-05, 'epochs': 165, 'loss': 'mae', 'optimizer': 'adam', 'graph_mode': 'cutoff', 'cutoff': 0.5032729050201005, 'grm_norm': 'cosine', 'self_loops': False, 'use_snp_selection': False}. Best is trial 81 with value: 0.29639479171058924.
[I 2025-12-09 06:54:32,220] Trial 87 finished with value: 0.2801079954322906 and parameters: {'model_type': 'graphsage', 'hidden_dims': '[512, 256]', 'dropout': 0.2333779931973788, 'batch_norm': False, 'sage_aggr': 'mean', 'sage_normalize': False, 'sage_project': False, 'lr': 4.311591848894372e-05, 'weight_decay': 1.7066926782361204e-05, 'epochs': 147, 'loss': 'mse', 'optimizer': 'adam', 'graph_mode': 'cutoff', 'cutoff': 0.4124444098224741, 'grm_norm': 'cosine', 'self_loops': False, 'use_snp_selection': True, 'num_snps': 3024}. Best is trial 81 with value: 0.29639479171058924.
[I 2025-12-09 06:56:44,719] Trial 88 finished with value: 0.2901338113855977 and parameters: {'model_type': 'graphsage', 'hidden_dims': '[512, 256]', 'dropout': 0.18890653867370213, 'batch_norm': False, 'sage_aggr': 'mean', 'sage_normalize': False, 'sage_project': False, 'lr': 3.416461894088718e-05, 'weight_decay': 2.4557622196393463e-05, 'epochs': 187, 'loss': 'mse', 'optimizer': 'adam', 'graph_mode': 'cutoff', 'cutoff': 0.449835312554832, 'grm_norm': 'gcn', 'self_loops': False, 'use_snp_selection': False}. Best is trial 81 with value: 0.29639479171058924.
[I 2025-12-09 06:58:19,166] Trial 89 finished with value: 0.26367997291920686 and parameters: {'model_type': 'graphsage', 'hidden_dims': '[512, 256]', 'dropout': 0.17500307102734217, 'batch_norm': False, 'sage_aggr': 'max', 'sage_normalize': False, 'sage_project': False, 'lr': 0.00025071516745041377, 'weight_decay': 3.225156815052381e-05, 'epochs': 155, 'loss': 'mse', 'optimizer': 'adam', 'graph_mode': 'cutoff', 'cutoff': 0.5652858730828123, 'grm_norm': 'cosine', 'self_loops': False, 'use_snp_selection': False}. Best is trial 81 with value: 0.29639479171058924.
[I 2025-12-09 07:00:21,594] Trial 90 finished with value: 0.28511093460828063 and parameters: {'model_type': 'graphsage', 'hidden_dims': '[512, 256]', 'dropout': 0.20005524538620997, 'batch_norm': False, 'sage_aggr': 'mean', 'sage_normalize': False, 'sage_project': False, 'lr': 7.165126239916633e-05, 'weight_decay': 1.452596396041229e-05, 'epochs': 209, 'loss': 'mse', 'optimizer': 'adam', 'graph_mode': 'cutoff', 'cutoff': 0.8980164448425347, 'grm_norm': 'cosine', 'self_loops': False, 'use_snp_selection': False}. Best is trial 81 with value: 0.29639479171058924.
[I 2025-12-09 07:02:14,928] Trial 91 finished with value: 0.2953304510494953 and parameters: {'model_type': 'graphsage', 'hidden_dims': '[512, 64]', 'dropout': 0.1367001379838623, 'batch_norm': False, 'sage_aggr': 'mean', 'sage_normalize': False, 'sage_project': False, 'lr': 1.6940937989863153e-05, 'weight_decay': 8.305321265450358e-06, 'epochs': 162, 'loss': 'mse', 'optimizer': 'adam', 'graph_mode': 'cutoff', 'cutoff': 0.4800178196694648, 'grm_norm': 'cosine', 'self_loops': False, 'use_snp_selection': False}. Best is trial 81 with value: 0.29639479171058924.
[I 2025-12-09 07:03:30,460] Trial 92 finished with value: 0.29297695753086817 and parameters: {'model_type': 'graphsage', 'hidden_dims': '[256, 128]', 'dropout': 0.15067921513370558, 'batch_norm': False, 'sage_aggr': 'mean', 'sage_normalize': False, 'sage_project': False, 'lr': 2.4413811707134977e-05, 'weight_decay': 9.513859393910509e-06, 'epochs': 178, 'loss': 'mse', 'optimizer': 'adam', 'graph_mode': 'cutoff', 'cutoff': 0.483606720553825, 'grm_norm': 'cosine', 'self_loops': False, 'use_snp_selection': False}. Best is trial 81 with value: 0.29639479171058924.
[I 2025-12-09 07:05:12,494] Trial 93 finished with value: 0.28912743042620764 and parameters: {'model_type': 'graphsage', 'hidden_dims': '[512, 64]', 'dropout': 0.12648472025243238, 'batch_norm': False, 'sage_aggr': 'mean', 'sage_normalize': False, 'sage_project': False, 'lr': 1.1795817313864158e-05, 'weight_decay': 4.528894326765649e-06, 'epochs': 161, 'loss': 'mse', 'optimizer': 'adam', 'graph_mode': 'cutoff', 'cutoff': 0.5207798425175657, 'grm_norm': 'cosine', 'self_loops': False, 'use_snp_selection': False}. Best is trial 81 with value: 0.29639479171058924.
[I 2025-12-09 07:06:59,670] Trial 94 finished with value: 0.29326362885655255 and parameters: {'model_type': 'graphsage', 'hidden_dims': '[512, 256]', 'dropout': 0.14287420366465986, 'batch_norm': False, 'sage_aggr': 'mean', 'sage_normalize': False, 'sage_project': False, 'lr': 1.6367876325422503e-05, 'weight_decay': 6.028452851822081e-05, 'epochs': 149, 'loss': 'mse', 'optimizer': 'adam', 'graph_mode': 'cutoff', 'cutoff': 0.432730232298497, 'grm_norm': 'cosine', 'self_loops': False, 'use_snp_selection': False}. Best is trial 81 with value: 0.29639479171058924.
[I 2025-12-09 07:07:43,658] Trial 95 finished with value: 0.2900604996876911 and parameters: {'model_type': 'graphsage', 'hidden_dims': '[128, 64]', 'dropout': 0.16035229947453508, 'batch_norm': False, 'sage_aggr': 'mean', 'sage_normalize': False, 'sage_project': False, 'lr': 2.0868692739557674e-05, 'weight_decay': 1.955330776057715e-05, 'epochs': 138, 'loss': 'mse', 'optimizer': 'adam', 'graph_mode': 'cutoff', 'cutoff': 0.46475731609311877, 'grm_norm': 'cosine', 'self_loops': False, 'use_snp_selection': False}. Best is trial 81 with value: 0.29639479171058924.
[I 2025-12-09 07:09:34,866] Trial 96 finished with value: 0.2895229685925574 and parameters: {'model_type': 'graphsage', 'hidden_dims': '[512, 64]', 'dropout': 0.1134733101046411, 'batch_norm': False, 'sage_aggr': 'mean', 'sage_normalize': False, 'sage_project': False, 'lr': 2.988070599736111e-05, 'weight_decay': 8.27142713261951e-06, 'epochs': 172, 'loss': 'mse', 'optimizer': 'adam', 'graph_mode': 'cutoff', 'cutoff': 0.5055278892863149, 'grm_norm': 'cosine', 'self_loops': False, 'use_snp_selection': False}. Best is trial 81 with value: 0.29639479171058924.
[I 2025-12-09 07:11:48,896] Trial 97 finished with value: 0.2742384121519333 and parameters: {'model_type': 'graphsage', 'hidden_dims': '[512, 128]', 'dropout': 0.2106199250751653, 'batch_norm': False, 'sage_aggr': 'mean', 'sage_normalize': True, 'sage_project': False, 'lr': 1.4199957967474392e-05, 'weight_decay': 1.2322084510686885e-05, 'epochs': 184, 'loss': 'mse', 'optimizer': 'adam', 'graph_mode': 'cutoff', 'cutoff': 0.4075088232410902, 'grm_norm': 'cosine', 'self_loops': True, 'use_snp_selection': False}. Best is trial 81 with value: 0.29639479171058924.
[I 2025-12-09 07:12:47,482] Trial 98 finished with value: 0.2822034643646195 and parameters: {'model_type': 'graphsage', 'hidden_dims': '[256, 128, 64]', 'dropout': 0.1785614038120376, 'batch_norm': True, 'sage_aggr': 'mean', 'sage_normalize': False, 'sage_project': False, 'lr': 0.0013807171068020707, 'weight_decay': 9.87372978522915e-05, 'epochs': 163, 'loss': 'mse', 'optimizer': 'adam', 'graph_mode': 'cutoff', 'cutoff': 0.5402075597112806, 'grm_norm': 'cosine_then_gcn', 'self_loops': False, 'use_snp_selection': False}. Best is trial 81 with value: 0.29639479171058924.
[I 2025-12-09 07:14:39,791] Trial 99 finished with value: 0.2793605917357072 and parameters: {'model_type': 'graphsage', 'hidden_dims': '[512, 256]', 'dropout': 0.2261665871422657, 'batch_norm': False, 'sage_aggr': 'mean', 'sage_normalize': False, 'sage_project': False, 'lr': 2.2090860987645708e-05, 'weight_decay': 5.642989732982812e-06, 'epochs': 190, 'loss': 'mae', 'optimizer': 'adam', 'graph_mode': 'cutoff', 'cutoff': 0.830019235372488, 'grm_norm': 'none', 'self_loops': False, 'use_snp_selection': False}. Best is trial 81 with value: 0.29639479171058924.
[I 2025-12-09 07:16:35,723] Trial 100 finished with value: 0.06000398530110882 and parameters: {'model_type': 'graphsage', 'hidden_dims': '[512, 64]', 'dropout': 0.24875079322940094, 'batch_norm': False, 'sage_aggr': 'mean', 'sage_normalize': False, 'sage_project': False, 'lr': 0.0028600570542666845, 'weight_decay': 5.0517608194548615e-05, 'epochs': 152, 'loss': 'mse', 'optimizer': 'adam', 'graph_mode': 'cutoff', 'cutoff': 0.32732922868435943, 'grm_norm': 'cosine', 'self_loops': False, 'use_snp_selection': False}. Best is trial 81 with value: 0.29639479171058924.
[I 2025-12-09 07:18:18,391] Trial 101 finished with value: 0.29377652427812334 and parameters: {'model_type': 'graphsage', 'hidden_dims': '[512, 64]', 'dropout': 0.13206503527444097, 'batch_norm': False, 'sage_aggr': 'mean', 'sage_normalize': False, 'sage_project': False, 'lr': 1.782127432815296e-05, 'weight_decay': 3.3244534183620955e-06, 'epochs': 139, 'loss': 'mse', 'optimizer': 'adam', 'graph_mode': 'cutoff', 'cutoff': 0.3735145009871667, 'grm_norm': 'cosine', 'self_loops': False, 'use_snp_selection': False}. Best is trial 81 with value: 0.29639479171058924.
[I 2025-12-09 07:20:04,266] Trial 102 finished with value: 0.29410104330930664 and parameters: {'model_type': 'graphsage', 'hidden_dims': '[512, 64]', 'dropout': 0.142023145257802, 'batch_norm': False, 'sage_aggr': 'mean', 'sage_normalize': False, 'sage_project': False, 'lr': 1.7375818360036585e-05, 'weight_decay': 2.6080478670910327e-06, 'epochs': 144, 'loss': 'mse', 'optimizer': 'adam', 'graph_mode': 'cutoff', 'cutoff': 0.37677280914267997, 'grm_norm': 'cosine', 'self_loops': False, 'use_snp_selection': False}. Best is trial 81 with value: 0.29639479171058924.
[I 2025-12-09 07:21:48,230] Trial 103 finished with value: 0.2914565353076625 and parameters: {'model_type': 'graphsage', 'hidden_dims': '[512, 64]', 'dropout': 0.13211051037933072, 'batch_norm': False, 'sage_aggr': 'mean', 'sage_normalize': False, 'sage_project': False, 'lr': 1.533474977749847e-05, 'weight_decay': 2.047280213171156e-06, 'epochs': 139, 'loss': 'mse', 'optimizer': 'adam', 'graph_mode': 'cutoff', 'cutoff': 0.35824962021505363, 'grm_norm': 'cosine', 'self_loops': False, 'use_snp_selection': False}. Best is trial 81 with value: 0.29639479171058924.
[I 2025-12-09 07:23:34,694] Trial 104 finished with value: 0.2972057447495283 and parameters: {'model_type': 'graphsage', 'hidden_dims': '[512, 64]', 'dropout': 0.10138013955239106, 'batch_norm': False, 'sage_aggr': 'mean', 'sage_normalize': False, 'sage_project': False, 'lr': 1.122434819125868e-05, 'weight_decay': 3.7966347100984114e-06, 'epochs': 144, 'loss': 'mse', 'optimizer': 'adam', 'graph_mode': 'cutoff', 'cutoff': 0.3751480638534418, 'grm_norm': 'cosine', 'self_loops': False, 'use_snp_selection': False}. Best is trial 104 with value: 0.2972057447495283.
[I 2025-12-09 07:25:23,555] Trial 105 finished with value: 0.2873748336394336 and parameters: {'model_type': 'graphsage', 'hidden_dims': '[512, 64]', 'dropout': 0.14540906330927972, 'batch_norm': False, 'sage_aggr': 'mean', 'sage_normalize': False, 'sage_project': False, 'lr': 1.0041867020731583e-05, 'weight_decay': 3.981851072406055e-06, 'epochs': 124, 'loss': 'mse', 'optimizer': 'adam', 'graph_mode': 'cutoff', 'cutoff': 0.309677562787815, 'grm_norm': 'cosine', 'self_loops': False, 'use_snp_selection': False}. Best is trial 104 with value: 0.2972057447495283.
[I 2025-12-09 07:27:25,001] Trial 106 finished with value: 0.2955929366085951 and parameters: {'model_type': 'graphsage', 'hidden_dims': '[512, 64]', 'dropout': 0.12135962492209412, 'batch_norm': False, 'sage_aggr': 'max', 'sage_normalize': False, 'sage_project': False, 'lr': 1.1967483413209174e-05, 'weight_decay': 2.515794213330982e-06, 'epochs': 157, 'loss': 'mse', 'optimizer': 'adam', 'graph_mode': 'cutoff', 'cutoff': 0.39072355564679406, 'grm_norm': 'none', 'self_loops': False, 'use_snp_selection': False}. Best is trial 104 with value: 0.2972057447495283.
[I 2025-12-09 07:28:59,577] Trial 107 finished with value: 0.2959866524923019 and parameters: {'model_type': 'graphsage', 'hidden_dims': '[512, 64]', 'dropout': 0.11357932926181055, 'batch_norm': False, 'sage_aggr': 'max', 'sage_normalize': False, 'sage_project': False, 'lr': 1.2453179596766305e-05, 'weight_decay': 8.274947689091997e-07, 'epochs': 158, 'loss': 'mse', 'optimizer': 'adam', 'graph_mode': 'cutoff', 'cutoff': 0.39637290660753227, 'grm_norm': 'gcn', 'self_loops': False, 'use_snp_selection': True, 'num_snps': 27728}. Best is trial 104 with value: 0.2972057447495283.
[I 2025-12-09 07:30:39,535] Trial 108 finished with value: 0.2951716288222762 and parameters: {'model_type': 'graphsage', 'hidden_dims': '[512, 64]', 'dropout': 0.10395287337258063, 'batch_norm': False, 'sage_aggr': 'max', 'sage_normalize': False, 'sage_project': False, 'lr': 1.1931128930490026e-05, 'weight_decay': 4.7269375339597926e-07, 'epochs': 147, 'loss': 'mse', 'optimizer': 'adam', 'graph_mode': 'cutoff', 'cutoff': 0.3251828338780003, 'grm_norm': 'gcn', 'self_loops': False, 'use_snp_selection': True, 'num_snps': 27971}. Best is trial 104 with value: 0.2972057447495283.
[I 2025-12-09 07:32:32,466] Trial 109 finished with value: 0.28674066956197086 and parameters: {'model_type': 'graphsage', 'hidden_dims': '[512, 64]', 'dropout': 0.10144192612124993, 'batch_norm': False, 'sage_aggr': 'max', 'sage_normalize': False, 'sage_project': False, 'lr': 1.0867991854503836e-05, 'weight_decay': 4.95286832293537e-07, 'epochs': 117, 'loss': 'mse', 'optimizer': 'adam', 'graph_mode': 'cutoff', 'cutoff': 0.2815437209617704, 'grm_norm': 'gcn', 'self_loops': False, 'use_snp_selection': True, 'num_snps': 28746}. Best is trial 104 with value: 0.2972057447495283.
