[I 2025-12-06 00:39:40,001] Trial 38 finished with value: 0.1550971761315052 and parameters: {'model_type': 'graphsage', 'hidden_dims': '[256, 128]', 'dropout': 0.3008628443473965, 'batch_norm': False, 'sage_aggr': 'max', 'sage_normalize': False, 'sage_project': False, 'lr': 1.0889258301622254e-06, 'weight_decay': 7.966948796174944e-05, 'epochs': 173, 'loss': 'mae', 'optimizer': 'adam', 'graph_mode': 'knn', 'knn_k': 10, 'weighted_edges': False, 'symmetrize_mode': 'union', 'self_loops': False, 'use_snp_selection': True, 'num_snps': 21346, 'graphsage_batch_size': 32}. Best is trial 31 with value: 0.25692529611074544.
[I 2025-12-06 00:40:23,645] Trial 39 finished with value: 0.24468898472052092 and parameters: {'model_type': 'graphsage', 'hidden_dims': '[512, 128]', 'dropout': 0.1627200564381878, 'batch_norm': True, 'sage_aggr': 'mean', 'sage_normalize': False, 'sage_project': False, 'lr': 6.147183509880556e-05, 'weight_decay': 0.00036070262275522447, 'epochs': 236, 'loss': 'mse', 'optimizer': 'adam', 'graph_mode': 'cutoff', 'cutoff': 0.5509533334929653, 'grm_norm': 'gcn', 'self_loops': False, 'use_snp_selection': True, 'num_snps': 14597, 'graphsage_batch_size': 8}. Best is trial 31 with value: 0.25692529611074544.
[I 2025-12-06 00:41:36,710] Trial 40 finished with value: 0.2147106504042287 and parameters: {'model_type': 'graphsage', 'hidden_dims': '[512, 256]', 'dropout': 0.23003707676358826, 'batch_norm': True, 'sage_aggr': 'mean', 'sage_normalize': False, 'sage_project': False, 'lr': 0.0006376199749788896, 'weight_decay': 1.5143333739320125e-07, 'epochs': 216, 'loss': 'mae', 'optimizer': 'adam', 'graph_mode': 'knn', 'knn_k': 1, 'weighted_edges': False, 'symmetrize_mode': 'union', 'self_loops': False, 'use_snp_selection': True, 'num_snps': 30314, 'graphsage_batch_size': 32}. Best is trial 31 with value: 0.25692529611074544.
[I 2025-12-06 00:42:04,221] Trial 41 finished with value: 0.2512005583959498 and parameters: {'model_type': 'graphsage', 'hidden_dims': '[128, 64]', 'dropout': 0.10548532302915206, 'batch_norm': True, 'sage_aggr': 'mean', 'sage_normalize': False, 'sage_project': False, 'lr': 0.00020280467260587644, 'weight_decay': 2.479653482093936e-07, 'epochs': 157, 'loss': 'mae', 'optimizer': 'adam', 'graph_mode': 'cutoff', 'cutoff': 0.8017060199230142, 'grm_norm': 'gcn', 'self_loops': False, 'use_snp_selection': True, 'num_snps': 26392, 'graphsage_batch_size': 32}. Best is trial 31 with value: 0.25692529611074544.
[I 2025-12-06 00:42:29,803] Trial 42 finished with value: 0.2422095305776643 and parameters: {'model_type': 'graphsage', 'hidden_dims': '[128, 64]', 'dropout': 0.12337890832487194, 'batch_norm': True, 'sage_aggr': 'mean', 'sage_normalize': False, 'sage_project': False, 'lr': 0.00023908739953139345, 'weight_decay': 5.255420272602996e-06, 'epochs': 150, 'loss': 'mae', 'optimizer': 'adam', 'graph_mode': 'cutoff', 'cutoff': 0.8506047294309593, 'grm_norm': 'gcn', 'self_loops': False, 'use_snp_selection': True, 'num_snps': 23990, 'graphsage_batch_size': 32}. Best is trial 31 with value: 0.25692529611074544.
[I 2025-12-06 00:42:52,870] Trial 43 finished with value: 0.25655510689192995 and parameters: {'model_type': 'graphsage', 'hidden_dims': '[128, 64]', 'dropout': 0.1331690957559313, 'batch_norm': True, 'sage_aggr': 'mean', 'sage_normalize': False, 'sage_project': False, 'lr': 0.00045398271522357884, 'weight_decay': 3.1070595496128906e-07, 'epochs': 164, 'loss': 'mae', 'optimizer': 'adam', 'graph_mode': 'cutoff', 'cutoff': 0.7493595709579669, 'grm_norm': 'gcn', 'self_loops': False, 'use_snp_selection': True, 'num_snps': 17473, 'graphsage_batch_size': 32}. Best is trial 31 with value: 0.25692529611074544.
[I 2025-12-06 00:43:16,311] Trial 44 finished with value: 0.24917328965429214 and parameters: {'model_type': 'graphsage', 'hidden_dims': '[128, 64]', 'dropout': 0.16399276015563446, 'batch_norm': False, 'sage_aggr': 'mean', 'sage_normalize': False, 'sage_project': False, 'lr': 0.00044575165729804204, 'weight_decay': 1.026517952525481e-07, 'epochs': 170, 'loss': 'mae', 'optimizer': 'adam', 'graph_mode': 'cutoff', 'cutoff': 0.6576626325482052, 'grm_norm': 'gcn', 'self_loops': False, 'use_snp_selection': True, 'num_snps': 17422, 'graphsage_batch_size': 128}. Best is trial 31 with value: 0.25692529611074544.
[I 2025-12-06 00:43:39,380] Trial 45 finished with value: 0.23709293726642894 and parameters: {'model_type': 'graphsage', 'hidden_dims': '[512, 64]', 'dropout': 0.2508972812063458, 'batch_norm': True, 'sage_aggr': 'mean', 'sage_normalize': False, 'sage_project': False, 'lr': 0.0007128354792848494, 'weight_decay': 5.917795810390658e-07, 'epochs': 117, 'loss': 'mae', 'optimizer': 'adam', 'graph_mode': 'cutoff', 'cutoff': 0.7391367690945008, 'grm_norm': 'cosine_then_gcn', 'self_loops': False, 'use_snp_selection': True, 'num_snps': 9009, 'graphsage_batch_size': 64}. Best is trial 31 with value: 0.25692529611074544.
[I 2025-12-06 00:44:13,150] Trial 46 finished with value: 0.2486903579737708 and parameters: {'model_type': 'graphsage', 'hidden_dims': '[256, 128]', 'dropout': 0.3598226112055484, 'batch_norm': True, 'sage_aggr': 'max', 'sage_normalize': False, 'sage_project': False, 'lr': 0.00045135436931920765, 'weight_decay': 1.354672969484366e-06, 'epochs': 196, 'loss': 'mae', 'optimizer': 'adam', 'graph_mode': 'cutoff', 'cutoff': 0.39601336746521665, 'grm_norm': 'gcn', 'self_loops': False, 'use_snp_selection': True, 'num_snps': 12798, 'graphsage_batch_size': 512}. Best is trial 31 with value: 0.25692529611074544.
[I 2025-12-06 00:44:51,126] Trial 47 finished with value: 0.2311373667393905 and parameters: {'model_type': 'graphsage', 'hidden_dims': '[512, 128]', 'dropout': 0.3989971885992706, 'batch_norm': False, 'sage_aggr': 'mean', 'sage_normalize': False, 'sage_project': False, 'lr': 0.0001319456374184093, 'weight_decay': 2.950769193340189e-07, 'epochs': 139, 'loss': 'mae', 'optimizer': 'adam', 'graph_mode': 'knn', 'knn_k': 3, 'weighted_edges': True, 'symmetrize_mode': 'mutual', 'self_loops': False, 'use_snp_selection': True, 'num_snps': 18108, 'graphsage_batch_size': 32}. Best is trial 31 with value: 0.25692529611074544.
[I 2025-12-06 00:45:07,572] Trial 48 finished with value: 0.20006257305190028 and parameters: {'model_type': 'graphsage', 'hidden_dims': '[128, 64]', 'dropout': 0.2071207039670935, 'batch_norm': True, 'sage_aggr': 'mean', 'sage_normalize': True, 'sage_project': False, 'lr': 0.00029939986830809865, 'weight_decay': 1.655061025603067e-07, 'epochs': 178, 'loss': 'mae', 'optimizer': 'adam', 'graph_mode': 'cutoff', 'cutoff': 0.8691365932387289, 'grm_norm': 'gcn', 'self_loops': False, 'use_snp_selection': True, 'num_snps': 4345, 'graphsage_batch_size': 16}. Best is trial 31 with value: 0.25692529611074544.
[I 2025-12-06 00:45:38,526] Trial 49 finished with value: 0.2303613191643648 and parameters: {'model_type': 'graphsage', 'hidden_dims': '[128, 64]', 'dropout': 0.13158219384653003, 'batch_norm': True, 'sage_aggr': 'mean', 'sage_normalize': False, 'sage_project': False, 'lr': 0.0001742209401230097, 'weight_decay': 7.432125872958481e-07, 'epochs': 73, 'loss': 'mae', 'optimizer': 'adam', 'graph_mode': 'cutoff', 'cutoff': 0.2992229769347044, 'grm_norm': 'cosine_then_gcn', 'self_loops': False, 'use_snp_selection': False, 'graphsage_batch_size': 32}. Best is trial 31 with value: 0.25692529611074544.
[I 2025-12-06 00:46:53,177] Trial 50 finished with value: 0.22813999851903013 and parameters: {'model_type': 'graphsage', 'hidden_dims': '[512, 256]', 'dropout': 0.2860902673129399, 'batch_norm': True, 'sage_aggr': 'mean', 'sage_normalize': False, 'sage_project': False, 'lr': 1.0043819783972485e-05, 'weight_decay': 1.748975707521384e-05, 'epochs': 208, 'loss': 'mse', 'optimizer': 'adam', 'graph_mode': 'cutoff', 'cutoff': 0.6833807110030419, 'grm_norm': 'gcn', 'self_loops': False, 'use_snp_selection': True, 'num_snps': 33135, 'graphsage_batch_size': 128}. Best is trial 31 with value: 0.25692529611074544.
[I 2025-12-06 00:47:18,660] Trial 51 finished with value: 0.250568642774042 and parameters: {'model_type': 'graphsage', 'hidden_dims': '[128, 64]', 'dropout': 0.17635658652600672, 'batch_norm': True, 'sage_aggr': 'mean', 'sage_normalize': False, 'sage_project': False, 'lr': 0.0002032902101389505, 'weight_decay': 2.8999097335526065e-07, 'epochs': 163, 'loss': 'mae', 'optimizer': 'adam', 'graph_mode': 'cutoff', 'cutoff': 0.7954392164239434, 'grm_norm': 'gcn', 'self_loops': False, 'use_snp_selection': True, 'num_snps': 21405, 'graphsage_batch_size': 32}. Best is trial 31 with value: 0.25692529611074544.
[I 2025-12-06 00:47:46,618] Trial 52 finished with value: 0.24093552501678217 and parameters: {'model_type': 'graphsage', 'hidden_dims': '[128, 64]', 'dropout': 0.10387912223697315, 'batch_norm': True, 'sage_aggr': 'mean', 'sage_normalize': False, 'sage_project': False, 'lr': 0.0004299059273867403, 'weight_decay': 3.980742764475383e-07, 'epochs': 161, 'loss': 'mae', 'optimizer': 'adam', 'graph_mode': 'cutoff', 'cutoff': 0.7576209962228591, 'grm_norm': 'gcn', 'self_loops': False, 'use_snp_selection': True, 'num_snps': 26498, 'graphsage_batch_size': 32}. Best is trial 31 with value: 0.25692529611074544.
[I 2025-12-06 00:48:07,609] Trial 53 finished with value: 0.26101890808151457 and parameters: {'model_type': 'graphsage', 'hidden_dims': '[128, 64]', 'dropout': 0.13409443090782294, 'batch_norm': True, 'sage_aggr': 'mean', 'sage_normalize': False, 'sage_project': False, 'lr': 8.676434806925233e-05, 'weight_decay': 1.5417304506538294e-07, 'epochs': 129, 'loss': 'mae', 'optimizer': 'adam', 'graph_mode': 'cutoff', 'cutoff': 0.7107175816325757, 'grm_norm': 'none', 'self_loops': False, 'use_snp_selection': True, 'num_snps': 16551, 'graphsage_batch_size': 32}. Best is trial 53 with value: 0.26101890808151457.
[I 2025-12-06 00:48:28,657] Trial 54 finished with value: 0.24630730833956097 and parameters: {'model_type': 'graphsage', 'hidden_dims': '[128, 64]', 'dropout': 0.1407665687316481, 'batch_norm': True, 'sage_aggr': 'mean', 'sage_normalize': True, 'sage_project': False, 'lr': 7.998367727905888e-05, 'weight_decay': 0.0008717439125876374, 'epochs': 135, 'loss': 'mae', 'optimizer': 'adam', 'graph_mode': 'cutoff', 'cutoff': 0.7091327038012185, 'grm_norm': 'none', 'self_loops': False, 'use_snp_selection': True, 'num_snps': 15671, 'graphsage_batch_size': 32}. Best is trial 53 with value: 0.26101890808151457.
[I 2025-12-06 00:48:44,210] Trial 55 finished with value: 0.20876575480381399 and parameters: {'model_type': 'graphsage', 'hidden_dims': '[128, 64]', 'dropout': 0.21229629085291585, 'batch_norm': False, 'sage_aggr': 'mean', 'sage_normalize': False, 'sage_project': False, 'lr': 0.00013582631235654227, 'weight_decay': 1.6037017312069676e-07, 'epochs': 123, 'loss': 'mae', 'optimizer': 'adam', 'graph_mode': 'cutoff', 'cutoff': 0.6368130580734084, 'grm_norm': 'none', 'self_loops': False, 'use_snp_selection': True, 'num_snps': 6676, 'graphsage_batch_size': 32}. Best is trial 53 with value: 0.26101890808151457.
[I 2025-12-06 00:50:22,992] Trial 56 finished with value: 0.24131535476464272 and parameters: {'model_type': 'graphsage', 'hidden_dims': '[512, 64]', 'dropout': 0.3448477012980804, 'batch_norm': True, 'sage_aggr': 'mean', 'sage_normalize': False, 'sage_project': False, 'lr': 4.523204393746411e-05, 'weight_decay': 4.6023916719548567e-07, 'epochs': 184, 'loss': 'mae', 'optimizer': 'adam', 'graph_mode': 'cutoff', 'cutoff': 0.7487218647201602, 'grm_norm': 'none', 'self_loops': False, 'use_snp_selection': False, 'graphsage_batch_size': 8}. Best is trial 53 with value: 0.26101890808151457.
[I 2025-12-06 00:50:45,845] Trial 57 finished with value: 0.24649937377252046 and parameters: {'model_type': 'graphsage', 'hidden_dims': '[256, 128]', 'dropout': 0.24794691306023317, 'batch_norm': True, 'sage_aggr': 'mean', 'sage_normalize': False, 'sage_project': False, 'lr': 0.0007145217502491758, 'weight_decay': 1.1887350099131043e-07, 'epochs': 87, 'loss': 'mae', 'optimizer': 'adam', 'graph_mode': 'cutoff', 'cutoff': 0.8736942781931212, 'grm_norm': 'none', 'self_loops': False, 'use_snp_selection': True, 'num_snps': 18472, 'graphsage_batch_size': 32}. Best is trial 53 with value: 0.26101890808151457.
[I 2025-12-06 00:51:10,399] Trial 58 finished with value: 0.20140944046246512 and parameters: {'model_type': 'graphsage', 'hidden_dims': '[128, 64]', 'dropout': 0.16412526552669124, 'batch_norm': True, 'sage_aggr': 'mean', 'sage_normalize': True, 'sage_project': False, 'lr': 8.753807197424894e-05, 'weight_decay': 1.477992658768294e-07, 'epochs': 146, 'loss': 'mae', 'optimizer': 'adam', 'graph_mode': 'knn', 'knn_k': 10, 'weighted_edges': True, 'symmetrize_mode': 'mutual', 'self_loops': False, 'use_snp_selection': True, 'num_snps': 10888, 'graphsage_batch_size': 32}. Best is trial 53 with value: 0.26101890808151457.
[I 2025-12-06 00:51:56,237] Trial 59 finished with value: 0.24735608775194473 and parameters: {'model_type': 'graphsage', 'hidden_dims': '[512, 128]', 'dropout': 0.12187443761154122, 'batch_norm': True, 'sage_aggr': 'max', 'sage_normalize': False, 'sage_project': False, 'lr': 0.00032674965628173435, 'weight_decay': 2.5976981503161214e-07, 'epochs': 245, 'loss': 'mae', 'optimizer': 'adam', 'graph_mode': 'cutoff', 'cutoff': 0.7004058922716794, 'grm_norm': 'none', 'self_loops': False, 'use_snp_selection': True, 'num_snps': 15481, 'graphsage_batch_size': 64}. Best is trial 53 with value: 0.26101890808151457.
[I 2025-12-06 00:52:35,752] Trial 60 finished with value: 0.2287803293374076 and parameters: {'model_type': 'graphsage', 'hidden_dims': '[128, 64]', 'dropout': 0.19953593648262669, 'batch_norm': True, 'sage_aggr': 'mean', 'sage_normalize': False, 'sage_project': False, 'lr': 3.13045903278372e-05, 'weight_decay': 2.104236206226048e-06, 'epochs': 192, 'loss': 'mae', 'optimizer': 'adam', 'graph_mode': 'cutoff', 'cutoff': 0.5902722238655657, 'grm_norm': 'cosine', 'self_loops': False, 'use_snp_selection': False, 'graphsage_batch_size': 256}. Best is trial 53 with value: 0.26101890808151457.
[I 2025-12-06 00:52:59,908] Trial 61 finished with value: 0.24761894889098346 and parameters: {'model_type': 'graphsage', 'hidden_dims': '[128, 64]', 'dropout': 0.11529710382561953, 'batch_norm': True, 'sage_aggr': 'mean', 'sage_normalize': False, 'sage_project': False, 'lr': 0.000508980487265971, 'weight_decay': 2.1484688053972228e-07, 'epochs': 131, 'loss': 'mae', 'optimizer': 'adam', 'graph_mode': 'cutoff', 'cutoff': 0.8047331952335224, 'grm_norm': 'gcn', 'self_loops': False, 'use_snp_selection': True, 'num_snps': 23034, 'graphsage_batch_size': 32}. Best is trial 53 with value: 0.26101890808151457.
[I 2025-12-06 00:53:25,369] Trial 62 finished with value: 0.24512098293994353 and parameters: {'model_type': 'graphsage', 'hidden_dims': '[128, 64]', 'dropout': 0.13594462296887339, 'batch_norm': True, 'sage_aggr': 'mean', 'sage_normalize': False, 'sage_project': False, 'lr': 0.00021935443911714719, 'weight_decay': 3.872897918525509e-07, 'epochs': 164, 'loss': 'mae', 'optimizer': 'adam', 'graph_mode': 'cutoff', 'cutoff': 0.7713161352782021, 'grm_norm': 'gcn', 'self_loops': False, 'use_snp_selection': True, 'num_snps': 21153, 'graphsage_batch_size': 32}. Best is trial 53 with value: 0.26101890808151457.
[I 2025-12-06 00:54:01,246] Trial 63 finished with value: 0.235491705998699 and parameters: {'model_type': 'graphsage', 'hidden_dims': '[128, 64]', 'dropout': 0.1749897517455533, 'batch_norm': True, 'sage_aggr': 'mean', 'sage_normalize': False, 'sage_project': False, 'lr': 0.0003498157411672389, 'weight_decay': 2.3471748297157344e-07, 'epochs': 155, 'loss': 'mae', 'optimizer': 'adam', 'graph_mode': 'cutoff', 'cutoff': 0.8121650237575117, 'grm_norm': 'gcn', 'self_loops': False, 'use_snp_selection': True, 'num_snps': 40236, 'graphsage_batch_size': 32}. Best is trial 53 with value: 0.26101890808151457.
[I 2025-12-06 00:54:28,329] Trial 64 finished with value: 0.26098303487073177 and parameters: {'model_type': 'graphsage', 'hidden_dims': '[128, 64]', 'dropout': 0.15042046487558086, 'batch_norm': True, 'sage_aggr': 'mean', 'sage_normalize': False, 'sage_project': False, 'lr': 0.000170184266264933, 'weight_decay': 1.4155132169946307e-07, 'epochs': 222, 'loss': 'mae', 'optimizer': 'adam', 'graph_mode': 'cutoff', 'cutoff': 0.7340766761572324, 'grm_norm': 'gcn', 'self_loops': False, 'use_snp_selection': True, 'num_snps': 18934, 'graphsage_batch_size': 32}. Best is trial 53 with value: 0.26101890808151457.
[I 2025-12-06 00:54:55,743] Trial 65 finished with value: 0.25517996514146885 and parameters: {'model_type': 'graphsage', 'hidden_dims': '[128, 64]', 'dropout': 0.1520592883555884, 'batch_norm': True, 'sage_aggr': 'mean', 'sage_normalize': False, 'sage_project': False, 'lr': 0.00013817151608095258, 'weight_decay': 1.3166199180996774e-07, 'epochs': 224, 'loss': 'mae', 'optimizer': 'adam', 'graph_mode': 'cutoff', 'cutoff': 0.7284647205841208, 'grm_norm': 'none', 'self_loops': False, 'use_snp_selection': True, 'num_snps': 19178, 'graphsage_batch_size': 32}. Best is trial 53 with value: 0.26101890808151457.
[I 2025-12-06 00:55:24,169] Trial 66 finished with value: 0.2564527637205384 and parameters: {'model_type': 'graphsage', 'hidden_dims': '[128, 64]', 'dropout': 0.15444059967672888, 'batch_norm': True, 'sage_aggr': 'mean', 'sage_normalize': False, 'sage_project': False, 'lr': 0.00014920627430763236, 'weight_decay': 3.570208008574334e-07, 'epochs': 234, 'loss': 'mae', 'optimizer': 'adam', 'graph_mode': 'cutoff', 'cutoff': 0.668194610725708, 'grm_norm': 'none', 'self_loops': False, 'use_snp_selection': True, 'num_snps': 19572, 'graphsage_batch_size': 16}. Best is trial 53 with value: 0.26101890808151457.
[I 2025-12-06 00:56:33,602] Trial 67 finished with value: 0.25531794270330643 and parameters: {'model_type': 'graphsage', 'hidden_dims': '[512, 256]', 'dropout': 0.15250304335808115, 'batch_norm': True, 'sage_aggr': 'mean', 'sage_normalize': False, 'sage_project': False, 'lr': 0.0001306792920915734, 'weight_decay': 1.3452432598660765e-07, 'epochs': 223, 'loss': 'mae', 'optimizer': 'adam', 'graph_mode': 'cutoff', 'cutoff': 0.6635524466221889, 'grm_norm': 'none', 'self_loops': False, 'use_snp_selection': True, 'num_snps': 28770, 'graphsage_batch_size': 16}. Best is trial 53 with value: 0.26101890808151457.
[I 2025-12-06 00:57:32,335] Trial 68 finished with value: 0.2520670559471265 and parameters: {'model_type': 'graphsage', 'hidden_dims': '[512, 256]', 'dropout': 0.15775228800287844, 'batch_norm': False, 'sage_aggr': 'mean', 'sage_normalize': False, 'sage_project': False, 'lr': 0.000151925592942642, 'weight_decay': 1.554851822066499e-07, 'epochs': 222, 'loss': 'mae', 'optimizer': 'adam', 'graph_mode': 'cutoff', 'cutoff': 0.6777016988488678, 'grm_norm': 'none', 'self_loops': False, 'use_snp_selection': True, 'num_snps': 23486, 'graphsage_batch_size': 16}. Best is trial 53 with value: 0.26101890808151457.
[I 2025-12-06 00:58:43,836] Trial 69 finished with value: 0.2507079553007388 and parameters: {'model_type': 'graphsage', 'hidden_dims': '[512, 256]', 'dropout': 0.18408367953503546, 'batch_norm': True, 'sage_aggr': 'mean', 'sage_normalize': True, 'sage_project': False, 'lr': 4.6429582273001054e-05, 'weight_decay': 1.3252120124476146e-07, 'epochs': 234, 'loss': 'mae', 'optimizer': 'adam', 'graph_mode': 'cutoff', 'cutoff': 0.6375520361514615, 'grm_norm': 'none', 'self_loops': False, 'use_snp_selection': True, 'num_snps': 28059, 'graphsage_batch_size': 16}. Best is trial 53 with value: 0.26101890808151457.
[I 2025-12-06 00:59:24,773] Trial 70 finished with value: 0.2480785661765525 and parameters: {'model_type': 'graphsage', 'hidden_dims': '[512, 256]', 'dropout': 0.13523838011939976, 'batch_norm': True, 'sage_aggr': 'mean', 'sage_normalize': False, 'sage_project': False, 'lr': 8.573915814464269e-05, 'weight_decay': 3.527631396203412e-07, 'epochs': 241, 'loss': 'mse', 'optimizer': 'adam', 'graph_mode': 'cutoff', 'cutoff': 0.7291991261784676, 'grm_norm': 'none', 'self_loops': False, 'use_snp_selection': True, 'num_snps': 13382, 'graphsage_batch_size': 16}. Best is trial 53 with value: 0.26101890808151457.
[I 2025-12-06 01:00:17,631] Trial 71 finished with value: 0.24600942827188374 and parameters: {'model_type': 'graphsage', 'hidden_dims': '[512, 256]', 'dropout': 0.15102973775379497, 'batch_norm': True, 'sage_aggr': 'mean', 'sage_normalize': False, 'sage_project': False, 'lr': 0.00011747941128076353, 'weight_decay': 1.8037212542000962e-07, 'epochs': 228, 'loss': 'mae', 'optimizer': 'adam', 'graph_mode': 'cutoff', 'cutoff': 0.5495269925341576, 'grm_norm': 'none', 'self_loops': False, 'use_snp_selection': True, 'num_snps': 19258, 'graphsage_batch_size': 16}. Best is trial 53 with value: 0.26101890808151457.
[I 2025-12-06 01:00:43,388] Trial 72 finished with value: 0.26049125692685016 and parameters: {'model_type': 'graphsage', 'hidden_dims': '[128, 64]', 'dropout': 0.19297681058760635, 'batch_norm': True, 'sage_aggr': 'mean', 'sage_normalize': False, 'sage_project': False, 'lr': 0.000178427420411613, 'weight_decay': 4.960094104771101e-07, 'epochs': 221, 'loss': 'mae', 'optimizer': 'adam', 'graph_mode': 'cutoff', 'cutoff': 0.6667330443282652, 'grm_norm': 'none', 'self_loops': False, 'use_snp_selection': True, 'num_snps': 16894, 'graphsage_batch_size': 16}. Best is trial 53 with value: 0.26101890808151457.
[I 2025-12-06 01:01:11,165] Trial 73 finished with value: 0.2633764749247482 and parameters: {'model_type': 'graphsage', 'hidden_dims': '[128, 64]', 'dropout': 0.12378394120155128, 'batch_norm': True, 'sage_aggr': 'mean', 'sage_normalize': False, 'sage_project': False, 'lr': 0.0001825093885652228, 'weight_decay': 4.91878688017926e-07, 'epochs': 248, 'loss': 'mae', 'optimizer': 'adam', 'graph_mode': 'cutoff', 'cutoff': 0.6061773387483763, 'grm_norm': 'none', 'self_loops': False, 'use_snp_selection': True, 'num_snps': 16936, 'graphsage_batch_size': 16}. Best is trial 73 with value: 0.2633764749247482.
