[I 2025-12-09 10:08:58,124] Trial 107 finished with value: 0.37180762269358103 and parameters: {'model_type': 'graphsage', 'hidden_dims': '[512, 64]', 'dropout': 0.3710074795696953, 'batch_norm': False, 'sage_aggr': 'max', 'sage_normalize': False, 'sage_project': False, 'lr': 2.0864467467634686e-05, 'weight_decay': 7.26093784075372e-05, 'epochs': 145, 'loss': 'mae', 'optimizer': 'adam', 'graph_mode': 'cutoff', 'cutoff': 0.604344633577177, 'grm_norm': 'cosine', 'self_loops': True, 'use_snp_selection': True, 'num_snps': 52028}. Best is trial 99 with value: 0.37436760407066083.
[I 2025-12-09 10:10:23,017] Trial 108 finished with value: 0.3726464373619852 and parameters: {'model_type': 'graphsage', 'hidden_dims': '[256, 128, 64]', 'dropout': 0.38464199420244083, 'batch_norm': False, 'sage_aggr': 'max', 'sage_normalize': False, 'sage_project': False, 'lr': 1.002242607834427e-05, 'weight_decay': 2.9226140000313088e-05, 'epochs': 155, 'loss': 'mae', 'optimizer': 'adam', 'graph_mode': 'cutoff', 'cutoff': 0.5269849624260801, 'grm_norm': 'cosine_then_gcn', 'self_loops': True, 'use_snp_selection': True, 'num_snps': 57656}. Best is trial 99 with value: 0.37436760407066083.
[I 2025-12-09 10:11:42,878] Trial 109 finished with value: 0.3744722917140021 and parameters: {'model_type': 'graphsage', 'hidden_dims': '[256, 128, 64]', 'dropout': 0.42747312616729194, 'batch_norm': False, 'sage_aggr': 'mean', 'sage_normalize': False, 'sage_project': False, 'lr': 1.1522496797605235e-05, 'weight_decay': 3.054389968995112e-05, 'epochs': 155, 'loss': 'mae', 'optimizer': 'adam', 'graph_mode': 'cutoff', 'cutoff': 0.622825276879265, 'grm_norm': 'cosine_then_gcn', 'self_loops': True, 'use_snp_selection': True, 'num_snps': 57772}. Best is trial 109 with value: 0.3744722917140021.
[I 2025-12-09 10:13:04,595] Trial 110 finished with value: 0.05595790660597535 and parameters: {'model_type': 'graphsage', 'hidden_dims': '[256, 128, 64]', 'dropout': 0.42673818494240456, 'batch_norm': False, 'sage_aggr': 'mean', 'sage_normalize': False, 'sage_project': False, 'lr': 0.0026656289730481336, 'weight_decay': 3.1131394116867116e-05, 'epochs': 156, 'loss': 'mae', 'optimizer': 'adam', 'graph_mode': 'cutoff', 'cutoff': 0.5565065390569944, 'grm_norm': 'cosine_then_gcn', 'self_loops': True, 'use_snp_selection': True, 'num_snps': 57851}. Best is trial 109 with value: 0.3744722917140021.
[I 2025-12-09 10:14:09,876] Trial 111 finished with value: 0.3733251131939281 and parameters: {'model_type': 'graphsage', 'hidden_dims': '[256, 128, 64]', 'dropout': 0.4034175022000073, 'batch_norm': False, 'sage_aggr': 'mean', 'sage_normalize': False, 'sage_project': False, 'lr': 1.1505737573331432e-05, 'weight_decay': 2.106043741504814e-05, 'epochs': 112, 'loss': 'mae', 'optimizer': 'adam', 'graph_mode': 'cutoff', 'cutoff': 0.6158447735159359, 'grm_norm': 'cosine_then_gcn', 'self_loops': True, 'use_snp_selection': True, 'num_snps': 53665}. Best is trial 109 with value: 0.3744722917140021.
[I 2025-12-09 10:15:15,558] Trial 112 finished with value: 0.3699100950078916 and parameters: {'model_type': 'graphsage', 'hidden_dims': '[256, 128, 64]', 'dropout': 0.48320160006016866, 'batch_norm': False, 'sage_aggr': 'mean', 'sage_normalize': False, 'sage_project': False, 'lr': 1.168213617111634e-05, 'weight_decay': 1.845044684757824e-05, 'epochs': 113, 'loss': 'mae', 'optimizer': 'adam', 'graph_mode': 'cutoff', 'cutoff': 0.6314168776411708, 'grm_norm': 'cosine_then_gcn', 'self_loops': True, 'use_snp_selection': True, 'num_snps': 53647}. Best is trial 109 with value: 0.3744722917140021.
[I 2025-12-09 10:16:28,962] Trial 113 finished with value: 0.37381244125898627 and parameters: {'model_type': 'graphsage', 'hidden_dims': '[256, 128, 64]', 'dropout': 0.3998580294319849, 'batch_norm': False, 'sage_aggr': 'mean', 'sage_normalize': False, 'sage_project': False, 'lr': 1.0523993027204994e-05, 'weight_decay': 2.2673670922936936e-05, 'epochs': 130, 'loss': 'mae', 'optimizer': 'adam', 'graph_mode': 'cutoff', 'cutoff': 0.617493919912342, 'grm_norm': 'cosine_then_gcn', 'self_loops': True, 'use_snp_selection': True, 'num_snps': 57967}. Best is trial 109 with value: 0.3744722917140021.
[I 2025-12-09 10:17:38,189] Trial 114 finished with value: 0.371568484657948 and parameters: {'model_type': 'graphsage', 'hidden_dims': '[256, 128, 64]', 'dropout': 0.40504247808442756, 'batch_norm': False, 'sage_aggr': 'mean', 'sage_normalize': False, 'sage_project': False, 'lr': 1.6779198325904137e-05, 'weight_decay': 4.604636913298466e-05, 'epochs': 126, 'loss': 'mae', 'optimizer': 'adam', 'graph_mode': 'cutoff', 'cutoff': 0.6178321508489402, 'grm_norm': 'cosine_then_gcn', 'self_loops': True, 'use_snp_selection': True, 'num_snps': 55158}. Best is trial 109 with value: 0.3744722917140021.
[I 2025-12-09 10:18:38,652] Trial 115 finished with value: 0.3695557184634607 and parameters: {'model_type': 'graphsage', 'hidden_dims': '[256, 128, 64]', 'dropout': 0.42855353040801, 'batch_norm': False, 'sage_aggr': 'mean', 'sage_normalize': False, 'sage_project': False, 'lr': 1.1760547923011283e-05, 'weight_decay': 3.317730759402128e-05, 'epochs': 96, 'loss': 'mae', 'optimizer': 'adam', 'graph_mode': 'cutoff', 'cutoff': 0.6496495936897523, 'grm_norm': 'cosine_then_gcn', 'self_loops': True, 'use_snp_selection': True, 'num_snps': 51259}. Best is trial 109 with value: 0.3744722917140021.
[I 2025-12-09 10:19:50,003] Trial 116 finished with value: 0.33004751897426277 and parameters: {'model_type': 'graphsage', 'hidden_dims': '[256, 128, 64]', 'dropout': 0.4026268491673436, 'batch_norm': True, 'sage_aggr': 'mean', 'sage_normalize': False, 'sage_project': False, 'lr': 1.4658383554019894e-05, 'weight_decay': 1.143615345039365e-05, 'epochs': 132, 'loss': 'mae', 'optimizer': 'adam', 'graph_mode': 'cutoff', 'cutoff': 0.5779136706163207, 'grm_norm': 'cosine_then_gcn', 'self_loops': True, 'use_snp_selection': True, 'num_snps': 56048}. Best is trial 109 with value: 0.3744722917140021.
[I 2025-12-09 10:21:01,181] Trial 117 finished with value: 0.3704625166512602 and parameters: {'model_type': 'graphsage', 'hidden_dims': '[256, 128, 64]', 'dropout': 0.4219950862987152, 'batch_norm': False, 'sage_aggr': 'mean', 'sage_normalize': False, 'sage_project': False, 'lr': 1.9487929234940454e-05, 'weight_decay': 2.167851233431857e-05, 'epochs': 142, 'loss': 'mae', 'optimizer': 'adam', 'graph_mode': 'cutoff', 'cutoff': 0.6513042217741754, 'grm_norm': 'gcn', 'self_loops': True, 'use_snp_selection': True, 'num_snps': 53869}. Best is trial 109 with value: 0.3744722917140021.
[I 2025-12-09 10:22:20,622] Trial 118 finished with value: 0.32258053602616804 and parameters: {'model_type': 'graphsage', 'hidden_dims': '[256, 128, 64]', 'dropout': 0.33484576395280624, 'batch_norm': False, 'sage_aggr': 'mean', 'sage_normalize': True, 'sage_project': False, 'lr': 1.2591001427158457e-05, 'weight_decay': 2.3450121543624023e-05, 'epochs': 149, 'loss': 'mae', 'optimizer': 'adam', 'graph_mode': 'cutoff', 'cutoff': 0.5895246048948257, 'grm_norm': 'none', 'self_loops': True, 'use_snp_selection': True, 'num_snps': 58579}. Best is trial 109 with value: 0.3744722917140021.
[I 2025-12-09 10:22:49,245] Trial 119 finished with value: 0.3636779756841463 and parameters: {'model_type': 'graphsage', 'hidden_dims': '[256, 128, 64]', 'dropout': 0.37528289276629534, 'batch_norm': False, 'sage_aggr': 'mean', 'sage_normalize': False, 'sage_project': False, 'lr': 2.6864384999204533e-05, 'weight_decay': 4.6826665096841034e-05, 'epochs': 81, 'loss': 'mae', 'optimizer': 'adam', 'graph_mode': 'cutoff', 'cutoff': 0.620573434819194, 'grm_norm': 'cosine_then_gcn', 'self_loops': True, 'use_snp_selection': False}. Best is trial 109 with value: 0.3744722917140021.
[I 2025-12-09 10:25:05,243] Trial 120 finished with value: 0.322462833673376 and parameters: {'model_type': 'graphsage', 'hidden_dims': '[256, 128, 64]', 'dropout': 0.4646802673831021, 'batch_norm': False, 'sage_aggr': 'mean', 'sage_normalize': False, 'sage_project': False, 'lr': 2.2758235528901163e-05, 'weight_decay': 3.883999977791696e-05, 'epochs': 96, 'loss': 'mae', 'optimizer': 'adam', 'graph_mode': 'cutoff', 'cutoff': 0.20483824010248958, 'grm_norm': 'cosine_then_gcn', 'self_loops': True, 'use_snp_selection': True, 'num_snps': 57386}. Best is trial 109 with value: 0.3744722917140021.
[I 2025-12-09 10:26:23,258] Trial 121 finished with value: 0.37114434234982846 and parameters: {'model_type': 'graphsage', 'hidden_dims': '[256, 128, 64]', 'dropout': 0.38034328798778566, 'batch_norm': False, 'sage_aggr': 'mean', 'sage_normalize': False, 'sage_project': False, 'lr': 1.0256854220286563e-05, 'weight_decay': 2.0598802683388156e-05, 'epochs': 153, 'loss': 'mae', 'optimizer': 'adam', 'graph_mode': 'cutoff', 'cutoff': 0.676323754954948, 'grm_norm': 'cosine_then_gcn', 'self_loops': True, 'use_snp_selection': True, 'num_snps': 57980}. Best is trial 109 with value: 0.3744722917140021.
[I 2025-12-09 10:27:40,511] Trial 122 finished with value: 0.3708729599497168 and parameters: {'model_type': 'graphsage', 'hidden_dims': '[256, 128, 64]', 'dropout': 0.3865326667184752, 'batch_norm': False, 'sage_aggr': 'mean', 'sage_normalize': False, 'sage_project': False, 'lr': 1.0092361749973763e-05, 'weight_decay': 3.0855336372742074e-05, 'epochs': 122, 'loss': 'mae', 'optimizer': 'adam', 'graph_mode': 'cutoff', 'cutoff': 0.5401779054544821, 'grm_norm': 'cosine_then_gcn', 'self_loops': True, 'use_snp_selection': True, 'num_snps': 59888}. Best is trial 109 with value: 0.3744722917140021.
[I 2025-12-09 10:28:52,028] Trial 123 finished with value: 0.3662800705273068 and parameters: {'model_type': 'graphsage', 'hidden_dims': '[256, 128, 64]', 'dropout': 0.3056089210629254, 'batch_norm': False, 'sage_aggr': 'mean', 'sage_normalize': False, 'sage_project': False, 'lr': 1.5953936497573714e-05, 'weight_decay': 6.398471063543322e-05, 'epochs': 136, 'loss': 'mae', 'optimizer': 'adam', 'graph_mode': 'cutoff', 'cutoff': 0.6921545410830799, 'grm_norm': 'cosine_then_gcn', 'self_loops': True, 'use_snp_selection': True, 'num_snps': 56051}. Best is trial 109 with value: 0.3744722917140021.
[I 2025-12-09 10:30:14,817] Trial 124 finished with value: 0.3700783119655963 and parameters: {'model_type': 'graphsage', 'hidden_dims': '[512, 64]', 'dropout': 0.4010368636590873, 'batch_norm': False, 'sage_aggr': 'mean', 'sage_normalize': False, 'sage_project': False, 'lr': 1.3815121855326692e-05, 'weight_decay': 1.4669252821129991e-05, 'epochs': 103, 'loss': 'mae', 'optimizer': 'adam', 'graph_mode': 'cutoff', 'cutoff': 0.7177377208971777, 'grm_norm': 'cosine_then_gcn', 'self_loops': True, 'use_snp_selection': True, 'num_snps': 56907}. Best is trial 109 with value: 0.3744722917140021.
[I 2025-12-09 10:31:20,160] Trial 125 finished with value: 0.3711309948282708 and parameters: {'model_type': 'graphsage', 'hidden_dims': '[256, 128, 64]', 'dropout': 0.341099153893487, 'batch_norm': False, 'sage_aggr': 'mean', 'sage_normalize': False, 'sage_project': False, 'lr': 1.2001613363071699e-05, 'weight_decay': 7.675706861227605e-05, 'epochs': 113, 'loss': 'mae', 'optimizer': 'adam', 'graph_mode': 'cutoff', 'cutoff': 0.6131276635319324, 'grm_norm': 'cosine_then_gcn', 'self_loops': True, 'use_snp_selection': True, 'num_snps': 54550}. Best is trial 109 with value: 0.3744722917140021.
[I 2025-12-09 10:32:57,524] Trial 126 finished with value: 0.3690742176572555 and parameters: {'model_type': 'graphsage', 'hidden_dims': '[512, 64]', 'dropout': 0.31805547818348184, 'batch_norm': False, 'sage_aggr': 'mean', 'sage_normalize': False, 'sage_project': False, 'lr': 1.8530291648334474e-05, 'weight_decay': 3.431951835405377e-05, 'epochs': 163, 'loss': 'mae', 'optimizer': 'adam', 'graph_mode': 'cutoff', 'cutoff': 0.5843118615668125, 'grm_norm': 'cosine_then_gcn', 'self_loops': True, 'use_snp_selection': True, 'num_snps': 50992}. Best is trial 109 with value: 0.3744722917140021.
[I 2025-12-09 10:34:46,381] Trial 127 finished with value: 0.37722961628928964 and parameters: {'model_type': 'graphsage', 'hidden_dims': '[512, 64]', 'dropout': 0.41756491969669296, 'batch_norm': False, 'sage_aggr': 'max', 'sage_normalize': False, 'sage_project': False, 'lr': 1.1561009259328406e-05, 'weight_decay': 0.00012231249553393853, 'epochs': 178, 'loss': 'mae', 'optimizer': 'adam', 'graph_mode': 'cutoff', 'cutoff': 0.5621593190886516, 'grm_norm': 'cosine_then_gcn', 'self_loops': True, 'use_snp_selection': True, 'num_snps': 52531}. Best is trial 127 with value: 0.37722961628928964.
[I 2025-12-09 10:36:34,515] Trial 128 finished with value: 0.3689331922374411 and parameters: {'model_type': 'graphsage', 'hidden_dims': '[512, 64]', 'dropout': 0.44481153684323027, 'batch_norm': False, 'sage_aggr': 'max', 'sage_normalize': False, 'sage_project': False, 'lr': 1.5088657381038855e-05, 'weight_decay': 0.00012474354384681767, 'epochs': 180, 'loss': 'mae', 'optimizer': 'adam', 'graph_mode': 'cutoff', 'cutoff': 0.5639739543594122, 'grm_norm': 'cosine', 'self_loops': True, 'use_snp_selection': True, 'num_snps': 53038}. Best is trial 127 with value: 0.37722961628928964.
[I 2025-12-09 10:38:16,297] Trial 129 finished with value: 0.3723500772688936 and parameters: {'model_type': 'graphsage', 'hidden_dims': '[512, 64]', 'dropout': 0.3668449354477206, 'batch_norm': False, 'sage_aggr': 'max', 'sage_normalize': False, 'sage_project': False, 'lr': 1.2724895874215602e-05, 'weight_decay': 0.00016338790774861824, 'epochs': 172, 'loss': 'mae', 'optimizer': 'adam', 'graph_mode': 'cutoff', 'cutoff': 0.6576770840766297, 'grm_norm': 'cosine_then_gcn', 'self_loops': True, 'use_snp_selection': True, 'num_snps': 52073}. Best is trial 127 with value: 0.37722961628928964.
[I 2025-12-09 10:39:37,342] Trial 130 finished with value: 0.3744901225099596 and parameters: {'model_type': 'graphsage', 'hidden_dims': '[512, 64]', 'dropout': 0.4340769745626292, 'batch_norm': False, 'sage_aggr': 'max', 'sage_normalize': False, 'sage_project': False, 'lr': 1.1496109084684763e-05, 'weight_decay': 0.00023255515363890315, 'epochs': 128, 'loss': 'mae', 'optimizer': 'adam', 'graph_mode': 'cutoff', 'cutoff': 0.8302228138655827, 'grm_norm': 'cosine_then_gcn', 'self_loops': False, 'use_snp_selection': True, 'num_snps': 48553}. Best is trial 127 with value: 0.37722961628928964.
[I 2025-12-09 10:41:04,466] Trial 131 finished with value: 0.3739508729148212 and parameters: {'model_type': 'graphsage', 'hidden_dims': '[512, 64]', 'dropout': 0.4162244801022718, 'batch_norm': False, 'sage_aggr': 'max', 'sage_normalize': False, 'sage_project': False, 'lr': 1.1459883584385539e-05, 'weight_decay': 0.00022412787471495554, 'epochs': 146, 'loss': 'mae', 'optimizer': 'adam', 'graph_mode': 'cutoff', 'cutoff': 0.8313369759865464, 'grm_norm': 'cosine_then_gcn', 'self_loops': False, 'use_snp_selection': True, 'num_snps': 48323}. Best is trial 127 with value: 0.37722961628928964.
[I 2025-12-09 10:42:25,372] Trial 132 finished with value: 0.37177370219315664 and parameters: {'model_type': 'graphsage', 'hidden_dims': '[512, 64]', 'dropout': 0.43130706376449063, 'batch_norm': False, 'sage_aggr': 'max', 'sage_normalize': False, 'sage_project': False, 'lr': 1.6683271036036977e-05, 'weight_decay': 0.0004392000867634173, 'epochs': 129, 'loss': 'mae', 'optimizer': 'adam', 'graph_mode': 'cutoff', 'cutoff': 0.8287966999284256, 'grm_norm': 'cosine_then_gcn', 'self_loops': False, 'use_snp_selection': True, 'num_snps': 48216}. Best is trial 127 with value: 0.37722961628928964.
[I 2025-12-09 10:43:43,819] Trial 133 finished with value: 0.3774656313951767 and parameters: {'model_type': 'graphsage', 'hidden_dims': '[512, 64]', 'dropout': 0.4535464626744964, 'batch_norm': False, 'sage_aggr': 'max', 'sage_normalize': False, 'sage_project': False, 'lr': 1.1105998633475917e-05, 'weight_decay': 5.2237829677903625e-05, 'epochs': 123, 'loss': 'mae', 'optimizer': 'adam', 'graph_mode': 'cutoff', 'cutoff': 0.8605747941759543, 'grm_norm': 'cosine_then_gcn', 'self_loops': False, 'use_snp_selection': True, 'num_snps': 47215}. Best is trial 133 with value: 0.3774656313951767.
[I 2025-12-09 10:45:00,303] Trial 134 finished with value: 0.3701353227972396 and parameters: {'model_type': 'graphsage', 'hidden_dims': '[512, 64]', 'dropout': 0.4542502183775295, 'batch_norm': False, 'sage_aggr': 'max', 'sage_normalize': False, 'sage_project': False, 'lr': 1.1345665208534848e-05, 'weight_decay': 5.046889760534959e-05, 'epochs': 115, 'loss': 'mae', 'optimizer': 'adam', 'graph_mode': 'cutoff', 'cutoff': 0.8585797268331753, 'grm_norm': 'cosine_then_gcn', 'self_loops': False, 'use_snp_selection': True, 'num_snps': 47586}. Best is trial 133 with value: 0.3774656313951767.
[I 2025-12-09 10:46:22,255] Trial 135 finished with value: 0.37162103045691863 and parameters: {'model_type': 'graphsage', 'hidden_dims': '[512, 64]', 'dropout': 0.4741269173054041, 'batch_norm': False, 'sage_aggr': 'max', 'sage_normalize': False, 'sage_project': False, 'lr': 1.1010751009956541e-05, 'weight_decay': 0.00025231915370711744, 'epochs': 124, 'loss': 'mae', 'optimizer': 'adam', 'graph_mode': 'cutoff', 'cutoff': 0.8425041312605258, 'grm_norm': 'cosine_then_gcn', 'self_loops': False, 'use_snp_selection': True, 'num_snps': 50022}. Best is trial 133 with value: 0.3774656313951767.
[I 2025-12-09 10:47:53,912] Trial 136 finished with value: 0.3540758579463305 and parameters: {'model_type': 'graphsage', 'hidden_dims': '[512, 64]', 'dropout': 0.41744324062491234, 'batch_norm': True, 'sage_aggr': 'max', 'sage_normalize': False, 'sage_project': False, 'lr': 1.4452597854745643e-05, 'weight_decay': 6.26076246369336e-05, 'epochs': 145, 'loss': 'mae', 'optimizer': 'adam', 'graph_mode': 'cutoff', 'cutoff': 0.8978592615123788, 'grm_norm': 'cosine_then_gcn', 'self_loops': False, 'use_snp_selection': True, 'num_snps': 51342}. Best is trial 133 with value: 0.3774656313951767.
[I 2025-12-09 10:49:05,197] Trial 137 finished with value: 0.37664578335160603 and parameters: {'model_type': 'graphsage', 'hidden_dims': '[512, 64]', 'dropout': 0.4555114240033389, 'batch_norm': False, 'sage_aggr': 'max', 'sage_normalize': False, 'sage_project': False, 'lr': 1.0079237772229123e-05, 'weight_decay': 0.00013102775175954966, 'epochs': 110, 'loss': 'mae', 'optimizer': 'adam', 'graph_mode': 'cutoff', 'cutoff': 0.8789485222205228, 'grm_norm': 'gcn', 'self_loops': False, 'use_snp_selection': True, 'num_snps': 45258}. Best is trial 133 with value: 0.3774656313951767.
[I 2025-12-09 10:50:13,421] Trial 138 finished with value: 0.3778850360492746 and parameters: {'model_type': 'graphsage', 'hidden_dims': '[512, 64]', 'dropout': 0.4929867059001436, 'batch_norm': False, 'sage_aggr': 'max', 'sage_normalize': False, 'sage_project': False, 'lr': 1.1244116706639384e-05, 'weight_decay': 9.281755253878441e-05, 'epochs': 92, 'loss': 'mae', 'optimizer': 'adam', 'graph_mode': 'cutoff', 'cutoff': 0.8698707746850409, 'grm_norm': 'gcn', 'self_loops': False, 'use_snp_selection': True, 'num_snps': 47252}. Best is trial 138 with value: 0.3778850360492746.
[I 2025-12-09 10:51:18,042] Trial 139 finished with value: 0.3516959309995299 and parameters: {'model_type': 'graphsage', 'hidden_dims': '[512, 64]', 'dropout': 0.4846203260396715, 'batch_norm': False, 'sage_aggr': 'max', 'sage_normalize': True, 'sage_project': False, 'lr': 1.033481896990251e-05, 'weight_decay': 0.00012193889427911812, 'epochs': 75, 'loss': 'mae', 'optimizer': 'adam', 'graph_mode': 'cutoff', 'cutoff': 0.8606463226312266, 'grm_norm': 'gcn', 'self_loops': False, 'use_snp_selection': True, 'num_snps': 48725}. Best is trial 138 with value: 0.3778850360492746.
[I 2025-12-09 10:52:09,885] Trial 140 finished with value: 0.3677410020243605 and parameters: {'model_type': 'graphsage', 'hidden_dims': '[512, 64]', 'dropout': 0.4522101289068796, 'batch_norm': False, 'sage_aggr': 'max', 'sage_normalize': False, 'sage_project': False, 'lr': 1.0031731070017496e-05, 'weight_decay': 0.0002247811140550223, 'epochs': 104, 'loss': 'mae', 'optimizer': 'adam', 'graph_mode': 'cutoff', 'cutoff': 0.799483436066217, 'grm_norm': 'gcn', 'self_loops': False, 'use_snp_selection': False}. Best is trial 138 with value: 0.3778850360492746.
[I 2025-12-09 10:53:17,699] Trial 141 finished with value: 0.3736673685718516 and parameters: {'model_type': 'graphsage', 'hidden_dims': '[512, 64]', 'dropout': 0.5196925824335417, 'batch_norm': False, 'sage_aggr': 'max', 'sage_normalize': False, 'sage_project': False, 'lr': 1.2072737326492012e-05, 'weight_decay': 8.996752705768684e-05, 'epochs': 92, 'loss': 'mae', 'optimizer': 'adam', 'graph_mode': 'cutoff', 'cutoff': 0.8779072687442923, 'grm_norm': 'gcn', 'self_loops': False, 'use_snp_selection': True, 'num_snps': 46914}. Best is trial 138 with value: 0.3778850360492746.
[I 2025-12-09 10:54:22,531] Trial 142 finished with value: 0.3673257344649926 and parameters: {'model_type': 'graphsage', 'hidden_dims': '[512, 64]', 'dropout': 0.5284068535553154, 'batch_norm': False, 'sage_aggr': 'max', 'sage_normalize': False, 'sage_project': False, 'lr': 1.2798133214630082e-05, 'weight_decay': 9.113927849081866e-05, 'epochs': 82, 'loss': 'mae', 'optimizer': 'adam', 'graph_mode': 'cutoff', 'cutoff': 0.8821196197960731, 'grm_norm': 'gcn', 'self_loops': False, 'use_snp_selection': True, 'num_snps': 46898}. Best is trial 138 with value: 0.3778850360492746.
[I 2025-12-09 10:55:27,220] Trial 143 finished with value: 0.36593173139604473 and parameters: {'model_type': 'graphsage', 'hidden_dims': '[512, 64]', 'dropout': 0.569546491026202, 'batch_norm': False, 'sage_aggr': 'max', 'sage_normalize': False, 'sage_project': False, 'lr': 1.7407610134840157e-05, 'weight_decay': 0.00013146251853136782, 'epochs': 88, 'loss': 'mae', 'optimizer': 'adam', 'graph_mode': 'cutoff', 'cutoff': 0.876656623205114, 'grm_norm': 'gcn', 'self_loops': False, 'use_snp_selection': True, 'num_snps': 45126}. Best is trial 138 with value: 0.3778850360492746.
