[I 2025-12-09 15:47:33,068] Trial 68 finished with value: 0.3575993408229586 and parameters: {'model_type': 'graphsage', 'hidden_dims': '[512, 128]', 'dropout': 0.17871684422726966, 'batch_norm': True, 'sage_aggr': 'max', 'sage_normalize': False, 'sage_project': False, 'lr': 5.009229185109551e-05, 'weight_decay': 9.062097172825693e-07, 'epochs': 307, 'loss': 'mse', 'optimizer': 'adam', 'graph_mode': 'cutoff', 'cutoff': 0.37839402485640405, 'grm_norm': 'none', 'self_loops': False, 'use_snp_selection': False}. Best is trial 62 with value: 0.38241543888456686.
[I 2025-12-09 15:50:08,074] Trial 69 finished with value: 0.36871811300728885 and parameters: {'model_type': 'graphsage', 'hidden_dims': '[512, 128]', 'dropout': 0.11357065718659129, 'batch_norm': False, 'sage_aggr': 'max', 'sage_normalize': False, 'sage_project': False, 'lr': 1.7440615436235735e-05, 'weight_decay': 6.515355457079531e-06, 'epochs': 253, 'loss': 'mse', 'optimizer': 'adam', 'graph_mode': 'cutoff', 'cutoff': 0.30827598776465276, 'grm_norm': 'gcn', 'self_loops': False, 'use_snp_selection': True, 'num_snps': 30611}. Best is trial 62 with value: 0.38241543888456686.
[I 2025-12-09 15:51:45,832] Trial 70 finished with value: 0.36198410331073994 and parameters: {'model_type': 'graphsage', 'hidden_dims': '[512, 128]', 'dropout': 0.2005723046122423, 'batch_norm': False, 'sage_aggr': 'max', 'sage_normalize': False, 'sage_project': False, 'lr': 1.2912897492742123e-05, 'weight_decay': 1.3436567390650657e-06, 'epochs': 229, 'loss': 'mse', 'optimizer': 'adam', 'graph_mode': 'cutoff', 'cutoff': 0.526224762991261, 'grm_norm': 'cosine', 'self_loops': False, 'use_snp_selection': True, 'num_snps': 39345}. Best is trial 62 with value: 0.38241543888456686.
[I 2025-12-09 15:53:15,366] Trial 71 finished with value: 0.380253098512787 and parameters: {'model_type': 'graphsage', 'hidden_dims': '[512, 128]', 'dropout': 0.15301798780419468, 'batch_norm': False, 'sage_aggr': 'max', 'sage_normalize': False, 'sage_project': False, 'lr': 2.9685573927267186e-05, 'weight_decay': 1.0561006693369201e-05, 'epochs': 233, 'loss': 'mse', 'optimizer': 'adam', 'graph_mode': 'cutoff', 'cutoff': 0.4039817924408942, 'grm_norm': 'cosine', 'self_loops': False, 'use_snp_selection': True, 'num_snps': 26167}. Best is trial 62 with value: 0.38241543888456686.
[I 2025-12-09 15:54:48,868] Trial 72 finished with value: 0.37973757752069653 and parameters: {'model_type': 'graphsage', 'hidden_dims': '[512, 128]', 'dropout': 0.11692260820114049, 'batch_norm': False, 'sage_aggr': 'max', 'sage_normalize': False, 'sage_project': False, 'lr': 2.9265755268320197e-05, 'weight_decay': 2.574082368266985e-06, 'epochs': 234, 'loss': 'mse', 'optimizer': 'adam', 'graph_mode': 'cutoff', 'cutoff': 0.35406986993890266, 'grm_norm': 'cosine', 'self_loops': False, 'use_snp_selection': True, 'num_snps': 27060}. Best is trial 62 with value: 0.38241543888456686.
[I 2025-12-09 15:56:50,553] Trial 73 finished with value: 0.380532494925096 and parameters: {'model_type': 'graphsage', 'hidden_dims': '[512, 128]', 'dropout': 0.15497673558522626, 'batch_norm': False, 'sage_aggr': 'max', 'sage_normalize': False, 'sage_project': False, 'lr': 3.0244635080787594e-05, 'weight_decay': 2.6187458703757885e-06, 'epochs': 270, 'loss': 'mse', 'optimizer': 'adam', 'graph_mode': 'cutoff', 'cutoff': 0.424094512269434, 'grm_norm': 'cosine', 'self_loops': False, 'use_snp_selection': True, 'num_snps': 36862}. Best is trial 62 with value: 0.38241543888456686.
[I 2025-12-09 15:58:34,257] Trial 74 finished with value: 0.3773476045492523 and parameters: {'model_type': 'graphsage', 'hidden_dims': '[512, 128]', 'dropout': 0.1543399162641624, 'batch_norm': False, 'sage_aggr': 'max', 'sage_normalize': False, 'sage_project': False, 'lr': 3.164258105336007e-05, 'weight_decay': 2.6086761372932024e-06, 'epochs': 270, 'loss': 'mse', 'optimizer': 'adam', 'graph_mode': 'cutoff', 'cutoff': 0.35826316759316323, 'grm_norm': 'cosine', 'self_loops': False, 'use_snp_selection': True, 'num_snps': 25710}. Best is trial 62 with value: 0.38241543888456686.
[I 2025-12-09 16:00:20,632] Trial 75 finished with value: 0.335305785454886 and parameters: {'model_type': 'graphsage', 'hidden_dims': '[512, 128]', 'dropout': 0.1627527381638679, 'batch_norm': False, 'sage_aggr': 'max', 'sage_normalize': False, 'sage_project': False, 'lr': 2.2624396582921077e-05, 'weight_decay': 2.622918839527404e-06, 'epochs': 297, 'loss': 'mse', 'optimizer': 'adam', 'graph_mode': 'cutoff', 'cutoff': 0.7544799850878806, 'grm_norm': 'cosine', 'self_loops': False, 'use_snp_selection': True, 'num_snps': 36922}. Best is trial 62 with value: 0.38241543888456686.
[I 2025-12-09 16:03:09,120] Trial 76 finished with value: 0.3754458065968432 and parameters: {'model_type': 'graphsage', 'hidden_dims': '[512, 128]', 'dropout': 0.23819127220731345, 'batch_norm': False, 'sage_aggr': 'max', 'sage_normalize': False, 'sage_project': False, 'lr': 1.3506297549863818e-05, 'weight_decay': 4.6481603663806534e-07, 'epochs': 274, 'loss': 'mse', 'optimizer': 'adam', 'graph_mode': 'cutoff', 'cutoff': 0.2503837248482414, 'grm_norm': 'cosine', 'self_loops': False, 'use_snp_selection': True, 'num_snps': 25844}. Best is trial 62 with value: 0.38241543888456686.
[I 2025-12-09 16:05:19,709] Trial 77 finished with value: 0.3701883523206094 and parameters: {'model_type': 'graphsage', 'hidden_dims': '[512, 128]', 'dropout': 0.19677287620554207, 'batch_norm': False, 'sage_aggr': 'max', 'sage_normalize': False, 'sage_project': False, 'lr': 2.901230412496605e-05, 'weight_decay': 3.6553159722866295e-06, 'epochs': 268, 'loss': 'mse', 'optimizer': 'adam', 'graph_mode': 'knn', 'knn_k': 4, 'weighted_edges': True, 'symmetrize_mode': 'union', 'self_loops': False, 'use_snp_selection': True, 'num_snps': 29495}. Best is trial 62 with value: 0.38241543888456686.
[I 2025-12-09 16:07:20,712] Trial 78 finished with value: 0.36206231942409517 and parameters: {'model_type': 'graphsage', 'hidden_dims': '[512, 128]', 'dropout': 0.26319855647601764, 'batch_norm': False, 'sage_aggr': 'mean', 'sage_normalize': False, 'sage_project': False, 'lr': 5.915616799268254e-05, 'weight_decay': 6.043066945412146e-07, 'epochs': 249, 'loss': 'mse', 'optimizer': 'adam', 'graph_mode': 'cutoff', 'cutoff': 0.3511952096426045, 'grm_norm': 'cosine', 'self_loops': False, 'use_snp_selection': True, 'num_snps': 32044}. Best is trial 62 with value: 0.38241543888456686.
[I 2025-12-09 16:10:47,538] Trial 79 finished with value: 0.37780427004683587 and parameters: {'model_type': 'graphsage', 'hidden_dims': '[512, 128]', 'dropout': 0.2146370936329016, 'batch_norm': False, 'sage_aggr': 'max', 'sage_normalize': False, 'sage_project': False, 'lr': 1.70266660455746e-05, 'weight_decay': 1.8447053015177228e-06, 'epochs': 282, 'loss': 'mse', 'optimizer': 'adam', 'graph_mode': 'cutoff', 'cutoff': 0.3746668069455534, 'grm_norm': 'cosine_then_gcn', 'self_loops': False, 'use_snp_selection': True, 'num_snps': 44758}. Best is trial 62 with value: 0.38241543888456686.
[I 2025-12-09 16:14:48,753] Trial 80 finished with value: 0.3421645422500368 and parameters: {'model_type': 'graphsage', 'hidden_dims': '[512, 128]', 'dropout': 0.304436510016927, 'batch_norm': True, 'sage_aggr': 'max', 'sage_normalize': True, 'sage_project': False, 'lr': 0.00927402245350831, 'weight_decay': 1.7237493333308202e-06, 'epochs': 293, 'loss': 'mse', 'optimizer': 'adam', 'graph_mode': 'cutoff', 'cutoff': 0.3096539690558825, 'grm_norm': 'cosine_then_gcn', 'self_loops': False, 'use_snp_selection': False}. Best is trial 62 with value: 0.38241543888456686.
[I 2025-12-09 16:18:58,717] Trial 81 finished with value: 0.3767412602752449 and parameters: {'model_type': 'graphsage', 'hidden_dims': '[512, 128]', 'dropout': 0.1550821581274366, 'batch_norm': False, 'sage_aggr': 'max', 'sage_normalize': False, 'sage_project': False, 'lr': 1.690706380856797e-05, 'weight_decay': 2.3631237246195296e-06, 'epochs': 281, 'loss': 'mse', 'optimizer': 'adam', 'graph_mode': 'cutoff', 'cutoff': 0.37239382118674735, 'grm_norm': 'cosine_then_gcn', 'self_loops': False, 'use_snp_selection': True, 'num_snps': 53901}. Best is trial 62 with value: 0.38241543888456686.
[I 2025-12-09 16:22:25,249] Trial 82 finished with value: 0.3712786792516283 and parameters: {'model_type': 'graphsage', 'hidden_dims': '[512, 128]', 'dropout': 0.13083966052640644, 'batch_norm': False, 'sage_aggr': 'max', 'sage_normalize': False, 'sage_project': False, 'lr': 2.8806461448834725e-05, 'weight_decay': 5.415056794407373e-06, 'epochs': 262, 'loss': 'mse', 'optimizer': 'adam', 'graph_mode': 'cutoff', 'cutoff': 0.3355965986233371, 'grm_norm': 'cosine_then_gcn', 'self_loops': False, 'use_snp_selection': True, 'num_snps': 44775}. Best is trial 62 with value: 0.38241543888456686.
[I 2025-12-09 16:24:06,943] Trial 83 finished with value: 0.37259588661358994 and parameters: {'model_type': 'graphsage', 'hidden_dims': '[512, 128]', 'dropout': 0.2162275395044626, 'batch_norm': False, 'sage_aggr': 'max', 'sage_normalize': False, 'sage_project': False, 'lr': 4.698985550190684e-05, 'weight_decay': 1.1309180862145272e-06, 'epochs': 258, 'loss': 'mse', 'optimizer': 'adam', 'graph_mode': 'cutoff', 'cutoff': 0.4263083297219097, 'grm_norm': 'cosine_then_gcn', 'self_loops': False, 'use_snp_selection': True, 'num_snps': 27906}. Best is trial 62 with value: 0.38241543888456686.
[I 2025-12-09 16:25:57,630] Trial 84 finished with value: 0.3727892381499537 and parameters: {'model_type': 'graphsage', 'hidden_dims': '[512, 128]', 'dropout': 0.1823512326650639, 'batch_norm': False, 'sage_aggr': 'max', 'sage_normalize': False, 'sage_project': False, 'lr': 2.202552283512507e-05, 'weight_decay': 3.1152581149721994e-06, 'epochs': 320, 'loss': 'mse', 'optimizer': 'adam', 'graph_mode': 'cutoff', 'cutoff': 0.3829679982391724, 'grm_norm': 'cosine', 'self_loops': False, 'use_snp_selection': True, 'num_snps': 25486}. Best is trial 62 with value: 0.38241543888456686.
[I 2025-12-09 16:29:49,382] Trial 85 finished with value: 0.365435564328483 and parameters: {'model_type': 'graphsage', 'hidden_dims': '[512, 256]', 'dropout': 0.1397776531302339, 'batch_norm': False, 'sage_aggr': 'max', 'sage_normalize': False, 'sage_project': False, 'lr': 3.330673780703528e-05, 'weight_decay': 3.714787001718232e-06, 'epochs': 216, 'loss': 'mse', 'optimizer': 'adam', 'graph_mode': 'cutoff', 'cutoff': 0.25363512755451645, 'grm_norm': 'cosine', 'self_loops': False, 'use_snp_selection': True, 'num_snps': 39478}. Best is trial 62 with value: 0.38241543888456686.
[I 2025-12-09 16:33:42,028] Trial 86 finished with value: 0.3739453226409529 and parameters: {'model_type': 'graphsage', 'hidden_dims': '[512, 128]', 'dropout': 0.14812591274038875, 'batch_norm': False, 'sage_aggr': 'max', 'sage_normalize': False, 'sage_project': False, 'lr': 1.233378250027586e-05, 'weight_decay': 2.0822860204127715e-06, 'epochs': 268, 'loss': 'mse', 'optimizer': 'adam', 'graph_mode': 'cutoff', 'cutoff': 0.358661173097572, 'grm_norm': 'cosine', 'self_loops': False, 'use_snp_selection': True, 'num_snps': 52604}. Best is trial 62 with value: 0.38241543888456686.
[I 2025-12-09 16:35:24,159] Trial 87 finished with value: 0.37767700161589735 and parameters: {'model_type': 'graphsage', 'hidden_dims': '[128, 64]', 'dropout': 0.12638593956450173, 'batch_norm': False, 'sage_aggr': 'max', 'sage_normalize': False, 'sage_project': False, 'lr': 4.121139474724357e-05, 'weight_decay': 1.5132898989128401e-05, 'epochs': 285, 'loss': 'mse', 'optimizer': 'adam', 'graph_mode': 'cutoff', 'cutoff': 0.42890893818195014, 'grm_norm': 'cosine', 'self_loops': False, 'use_snp_selection': True, 'num_snps': 41119}. Best is trial 62 with value: 0.38241543888456686.
[I 2025-12-09 16:37:28,487] Trial 88 finished with value: 0.37844775904341243 and parameters: {'model_type': 'graphsage', 'hidden_dims': '[128, 64]', 'dropout': 0.19238429381550173, 'batch_norm': False, 'sage_aggr': 'max', 'sage_normalize': False, 'sage_project': False, 'lr': 2.6368978186297535e-05, 'weight_decay': 1.4191431597955326e-06, 'epochs': 300, 'loss': 'mse', 'optimizer': 'adam', 'graph_mode': 'cutoff', 'cutoff': 0.4263406545944154, 'grm_norm': 'none', 'self_loops': False, 'use_snp_selection': True, 'num_snps': 40677}. Best is trial 62 with value: 0.38241543888456686.
[I 2025-12-09 16:39:56,243] Trial 89 finished with value: 0.3697036933669215 and parameters: {'model_type': 'graphsage', 'hidden_dims': '[128, 64]', 'dropout': 0.16860773508155966, 'batch_norm': False, 'sage_aggr': 'max', 'sage_normalize': False, 'sage_project': False, 'lr': 1.9187436691768427e-05, 'weight_decay': 1.3514293657163296e-06, 'epochs': 334, 'loss': 'mse', 'optimizer': 'adam', 'graph_mode': 'cutoff', 'cutoff': 0.4370749707537548, 'grm_norm': 'none', 'self_loops': False, 'use_snp_selection': True, 'num_snps': 43739}. Best is trial 62 with value: 0.38241543888456686.
[I 2025-12-09 16:43:08,476] Trial 90 finished with value: 0.3598087451938781 and parameters: {'model_type': 'graphsage', 'hidden_dims': '[128, 64]', 'dropout': 0.1904120063152959, 'batch_norm': False, 'sage_aggr': 'mean', 'sage_normalize': False, 'sage_project': False, 'lr': 4.046348358434005e-05, 'weight_decay': 8.121688016730751e-07, 'epochs': 288, 'loss': 'mse', 'optimizer': 'adam', 'graph_mode': 'knn', 'knn_k': 10, 'weighted_edges': False, 'symmetrize_mode': 'mutual', 'self_loops': False, 'use_snp_selection': True, 'num_snps': 48071}. Best is trial 62 with value: 0.38241543888456686.
[I 2025-12-09 16:44:58,607] Trial 91 finished with value: 0.3763181241109875 and parameters: {'model_type': 'graphsage', 'hidden_dims': '[128, 64]', 'dropout': 0.13512560086620282, 'batch_norm': False, 'sage_aggr': 'max', 'sage_normalize': False, 'sage_project': False, 'lr': 2.7818951093404947e-05, 'weight_decay': 1.5052680974454886e-05, 'epochs': 297, 'loss': 'mse', 'optimizer': 'adam', 'graph_mode': 'cutoff', 'cutoff': 0.46576970950897767, 'grm_norm': 'none', 'self_loops': False, 'use_snp_selection': True, 'num_snps': 40911}. Best is trial 62 with value: 0.38241543888456686.
[I 2025-12-09 16:47:03,337] Trial 92 finished with value: 0.37307357027306276 and parameters: {'model_type': 'graphsage', 'hidden_dims': '[128, 64]', 'dropout': 0.2055586551640044, 'batch_norm': False, 'sage_aggr': 'max', 'sage_normalize': False, 'sage_project': False, 'lr': 2.232164957123417e-05, 'weight_decay': 1.0603189618849253e-05, 'epochs': 305, 'loss': 'mse', 'optimizer': 'adam', 'graph_mode': 'cutoff', 'cutoff': 0.42817308806106347, 'grm_norm': 'none', 'self_loops': False, 'use_snp_selection': True, 'num_snps': 40673}. Best is trial 62 with value: 0.38241543888456686.
[I 2025-12-09 16:49:27,178] Trial 93 finished with value: 0.3710016220125398 and parameters: {'model_type': 'graphsage', 'hidden_dims': '[128, 64]', 'dropout': 0.12504356293450344, 'batch_norm': False, 'sage_aggr': 'max', 'sage_normalize': False, 'sage_project': False, 'lr': 1.5323291849888537e-05, 'weight_decay': 1.6210461726081373e-06, 'epochs': 283, 'loss': 'mse', 'optimizer': 'adam', 'graph_mode': 'cutoff', 'cutoff': 0.36166709130691815, 'grm_norm': 'none', 'self_loops': False, 'use_snp_selection': True, 'num_snps': 43044}. Best is trial 62 with value: 0.38241543888456686.
[I 2025-12-09 16:51:04,987] Trial 94 finished with value: 0.35523627859785395 and parameters: {'model_type': 'graphsage', 'hidden_dims': '[128, 64]', 'dropout': 0.15093501800061204, 'batch_norm': False, 'sage_aggr': 'max', 'sage_normalize': False, 'sage_project': False, 'lr': 3.55344721818477e-05, 'weight_decay': 1.0880145656903746e-06, 'epochs': 320, 'loss': 'mse', 'optimizer': 'adam', 'graph_mode': 'cutoff', 'cutoff': 0.4947321562782268, 'grm_norm': 'gcn', 'self_loops': False, 'use_snp_selection': True, 'num_snps': 37808}. Best is trial 62 with value: 0.38241543888456686.
[I 2025-12-09 16:53:43,953] Trial 95 finished with value: 0.34398816761327583 and parameters: {'model_type': 'graphsage', 'hidden_dims': '[256, 128, 64]', 'dropout': 0.589395200837992, 'batch_norm': False, 'sage_aggr': 'max', 'sage_normalize': False, 'sage_project': False, 'lr': 2.6375322361858782e-05, 'weight_decay': 5.716731151690811e-06, 'epochs': 275, 'loss': 'mse', 'optimizer': 'adam', 'graph_mode': 'cutoff', 'cutoff': 0.38873075299910476, 'grm_norm': 'cosine', 'self_loops': False, 'use_snp_selection': True, 'num_snps': 46441}. Best is trial 62 with value: 0.38241543888456686.
[I 2025-12-09 16:56:18,637] Trial 96 finished with value: 0.37500749985394205 and parameters: {'model_type': 'graphsage', 'hidden_dims': '[512, 64]', 'dropout': 0.17529513382635856, 'batch_norm': False, 'sage_aggr': 'max', 'sage_normalize': False, 'sage_project': False, 'lr': 6.319679325829076e-05, 'weight_decay': 2.4266043061232547e-06, 'epochs': 313, 'loss': 'mse', 'optimizer': 'adam', 'graph_mode': 'cutoff', 'cutoff': 0.4111422535523488, 'grm_norm': 'cosine_then_gcn', 'self_loops': False, 'use_snp_selection': True, 'num_snps': 34242}. Best is trial 62 with value: 0.38241543888456686.
[I 2025-12-09 16:57:04,283] Trial 97 finished with value: 0.34183456458589995 and parameters: {'model_type': 'graphsage', 'hidden_dims': '[128, 64]', 'dropout': 0.13348912758850884, 'batch_norm': False, 'sage_aggr': 'max', 'sage_normalize': True, 'sage_project': False, 'lr': 4.772841354257321e-05, 'weight_decay': 1.934456426605502e-06, 'epochs': 246, 'loss': 'mse', 'optimizer': 'adam', 'graph_mode': 'cutoff', 'cutoff': 0.3306459716559974, 'grm_norm': 'cosine', 'self_loops': False, 'use_snp_selection': True, 'num_snps': 19667}. Best is trial 62 with value: 0.38241543888456686.
[I 2025-12-09 17:00:21,981] Trial 98 finished with value: 0.33426851194002916 and parameters: {'model_type': 'graphsage', 'hidden_dims': '[512, 256]', 'dropout': 0.16631592353799768, 'batch_norm': True, 'sage_aggr': 'max', 'sage_normalize': False, 'sage_project': False, 'lr': 1.1794341296953412e-05, 'weight_decay': 6.389044729030475e-07, 'epochs': 232, 'loss': 'mse', 'optimizer': 'adam', 'graph_mode': 'cutoff', 'cutoff': 0.30132567973126645, 'grm_norm': 'cosine', 'self_loops': False, 'use_snp_selection': False}. Best is trial 62 with value: 0.38241543888456686.
[I 2025-12-09 17:01:12,112] Trial 99 finished with value: 0.37052690586205195 and parameters: {'model_type': 'graphsage', 'hidden_dims': '[128, 64]', 'dropout': 0.2313264620307528, 'batch_norm': False, 'sage_aggr': 'max', 'sage_normalize': False, 'sage_project': False, 'lr': 8.44558473164836e-05, 'weight_decay': 4.3715303342176025e-06, 'epochs': 256, 'loss': 'mse', 'optimizer': 'adam', 'graph_mode': 'cutoff', 'cutoff': 0.37784079862066494, 'grm_norm': 'none', 'self_loops': False, 'use_snp_selection': True, 'num_snps': 21889}. Best is trial 62 with value: 0.38241543888456686.
[I 2025-12-09 17:04:25,945] Trial 100 finished with value: 0.3581305694593314 and parameters: {'model_type': 'graphsage', 'hidden_dims': '[512, 128]', 'dropout': 0.5629767129906131, 'batch_norm': False, 'sage_aggr': 'max', 'sage_normalize': False, 'sage_project': False, 'lr': 1.771973667951515e-05, 'weight_decay': 3.059261330025279e-06, 'epochs': 298, 'loss': 'mse', 'optimizer': 'adam', 'graph_mode': 'cutoff', 'cutoff': 0.35254915863637964, 'grm_norm': 'cosine', 'self_loops': False, 'use_snp_selection': True, 'num_snps': 41078}. Best is trial 62 with value: 0.38241543888456686.
[I 2025-12-09 17:06:18,392] Trial 101 finished with value: 0.37571191769310885 and parameters: {'model_type': 'graphsage', 'hidden_dims': '[512, 128]', 'dropout': 0.10809848579071044, 'batch_norm': False, 'sage_aggr': 'max', 'sage_normalize': False, 'sage_project': False, 'lr': 3.222241538979309e-05, 'weight_decay': 1.7096175024831092e-05, 'epochs': 269, 'loss': 'mse', 'optimizer': 'adam', 'graph_mode': 'cutoff', 'cutoff': 0.4397306242321401, 'grm_norm': 'cosine', 'self_loops': False, 'use_snp_selection': True, 'num_snps': 29137}. Best is trial 62 with value: 0.38241543888456686.
[I 2025-12-09 17:07:47,506] Trial 102 finished with value: 0.3802578279274994 and parameters: {'model_type': 'graphsage', 'hidden_dims': '[512, 128]', 'dropout': 0.12202333477879825, 'batch_norm': False, 'sage_aggr': 'max', 'sage_normalize': False, 'sage_project': False, 'lr': 2.0887978611550673e-05, 'weight_decay': 1.2254361096412428e-05, 'epochs': 233, 'loss': 'mse', 'optimizer': 'adam', 'graph_mode': 'cutoff', 'cutoff': 0.40783766295331847, 'grm_norm': 'cosine', 'self_loops': False, 'use_snp_selection': True, 'num_snps': 26236}. Best is trial 62 with value: 0.38241543888456686.
[I 2025-12-09 17:09:03,629] Trial 103 finished with value: 0.37828900679477084 and parameters: {'model_type': 'graphsage', 'hidden_dims': '[512, 128]', 'dropout': 0.1214851179479249, 'batch_norm': False, 'sage_aggr': 'max', 'sage_normalize': False, 'sage_project': False, 'lr': 3.9761558164845e-05, 'weight_decay': 2.9808116323961683e-05, 'epochs': 232, 'loss': 'mse', 'optimizer': 'adam', 'graph_mode': 'cutoff', 'cutoff': 0.4172444387955474, 'grm_norm': 'cosine', 'self_loops': False, 'use_snp_selection': True, 'num_snps': 23474}. Best is trial 62 with value: 0.38241543888456686.
[I 2025-12-09 17:10:09,111] Trial 104 finished with value: 0.37417657472587756 and parameters: {'model_type': 'graphsage', 'hidden_dims': '[512, 128]', 'dropout': 0.12382057455424159, 'batch_norm': False, 'sage_aggr': 'max', 'sage_normalize': False, 'sage_project': False, 'lr': 2.077433714204093e-05, 'weight_decay': 2.3477645991008277e-05, 'epochs': 210, 'loss': 'mse', 'optimizer': 'adam', 'graph_mode': 'cutoff', 'cutoff': 0.45857777473329653, 'grm_norm': 'cosine', 'self_loops': False, 'use_snp_selection': True, 'num_snps': 22835}. Best is trial 62 with value: 0.38241543888456686.
