[I 2025-12-08 23:21:29,716] Trial 6 finished with value: 0.271198722078471 and parameters: {'model_type': 'graphsage', 'hidden_dims': '[256, 128, 64]', 'dropout': 0.10731743755162496, 'batch_norm': True, 'sage_aggr': 'mean', 'sage_normalize': False, 'sage_project': False, 'lr': 1.922990426933137e-05, 'weight_decay': 7.30001060446905e-05, 'epochs': 63, 'loss': 'mae', 'optimizer': 'adam', 'graph_mode': 'cutoff', 'cutoff': 0.7624978434202536, 'grm_norm': 'none', 'self_loops': True, 'use_snp_selection': True, 'num_snps': 50106}. Best is trial 1 with value: 0.2761576922004835.
[I 2025-12-08 23:23:30,472] Trial 7 finished with value: 0.25629646711155185 and parameters: {'model_type': 'graphsage', 'hidden_dims': '[512, 64]', 'dropout': 0.2585007811528941, 'batch_norm': True, 'sage_aggr': 'max', 'sage_normalize': True, 'sage_project': False, 'lr': 5.921425508303391e-05, 'weight_decay': 0.0004511561961144237, 'epochs': 182, 'loss': 'mae', 'optimizer': 'adam', 'graph_mode': 'knn', 'knn_k': 9, 'weighted_edges': True, 'symmetrize_mode': 'union', 'self_loops': False, 'use_snp_selection': True, 'num_snps': 23903}. Best is trial 1 with value: 0.2761576922004835.
[I 2025-12-08 23:24:13,403] Trial 8 finished with value: 0.23671193735924967 and parameters: {'model_type': 'graphsage', 'hidden_dims': '[512, 256]', 'dropout': 0.3061380386767003, 'batch_norm': False, 'sage_aggr': 'mean', 'sage_normalize': True, 'sage_project': False, 'lr': 0.000698401460570184, 'weight_decay': 2.965560055460244e-06, 'epochs': 289, 'loss': 'mae', 'optimizer': 'adam', 'graph_mode': 'knn', 'knn_k': 7, 'weighted_edges': False, 'symmetrize_mode': 'mutual', 'self_loops': True, 'use_snp_selection': True, 'num_snps': 4710}. Best is trial 1 with value: 0.2761576922004835.
[I 2025-12-08 23:28:05,515] Trial 9 finished with value: 0.2734420210696696 and parameters: {'model_type': 'graphsage', 'hidden_dims': '[512, 128]', 'dropout': 0.1733844071393634, 'batch_norm': False, 'sage_aggr': 'mean', 'sage_normalize': True, 'sage_project': False, 'lr': 0.0004269677918501597, 'weight_decay': 2.2439779626249696e-06, 'epochs': 319, 'loss': 'mse', 'optimizer': 'adam', 'graph_mode': 'cutoff', 'cutoff': 0.24117565767129295, 'grm_norm': 'cosine_then_gcn', 'self_loops': True, 'use_snp_selection': False}. Best is trial 1 with value: 0.2761576922004835.
[I 2025-12-08 23:29:31,654] Trial 10 finished with value: 0.0 and parameters: {'model_type': 'graphsage', 'hidden_dims': '[512, 128]', 'dropout': 0.5365714961141473, 'batch_norm': False, 'sage_aggr': 'max', 'sage_normalize': False, 'sage_project': False, 'lr': 0.0060050040216813455, 'weight_decay': 0.0009536725175322669, 'epochs': 77, 'loss': 'mse', 'optimizer': 'adam', 'graph_mode': 'knn', 'knn_k': 1, 'weighted_edges': False, 'symmetrize_mode': 'union', 'self_loops': True, 'use_snp_selection': True, 'num_snps': 56869}. Best is trial 1 with value: 0.2761576922004835.
[I 2025-12-08 23:33:05,271] Trial 11 finished with value: 0.2780430305053469 and parameters: {'model_type': 'graphsage', 'hidden_dims': '[512, 128]', 'dropout': 0.4692039945166981, 'batch_norm': False, 'sage_aggr': 'mean', 'sage_normalize': True, 'sage_project': False, 'lr': 0.0021948045573939607, 'weight_decay': 9.598224492823857e-07, 'epochs': 331, 'loss': 'mse', 'optimizer': 'adam', 'graph_mode': 'cutoff', 'cutoff': 0.2559065280746914, 'grm_norm': 'cosine_then_gcn', 'self_loops': True, 'use_snp_selection': False}. Best is trial 11 with value: 0.2780430305053469.
[I 2025-12-08 23:37:41,465] Trial 12 finished with value: 0.2708340200298261 and parameters: {'model_type': 'graphsage', 'hidden_dims': '[512, 128]', 'dropout': 0.46932769003488417, 'batch_norm': False, 'sage_aggr': 'mean', 'sage_normalize': True, 'sage_project': False, 'lr': 0.002108574938852795, 'weight_decay': 3.844183429113118e-07, 'epochs': 347, 'loss': 'mse', 'optimizer': 'adam', 'graph_mode': 'cutoff', 'cutoff': 0.21195285844611061, 'grm_norm': 'cosine_then_gcn', 'self_loops': True, 'use_snp_selection': False}. Best is trial 11 with value: 0.2780430305053469.
[I 2025-12-08 23:38:21,087] Trial 13 finished with value: 0.19267056775015412 and parameters: {'model_type': 'graphsage', 'hidden_dims': '[256, 128]', 'dropout': 0.47165571743021933, 'batch_norm': False, 'sage_aggr': 'mean', 'sage_normalize': False, 'sage_project': False, 'lr': 0.00010208530016110478, 'weight_decay': 2.8243087739363708e-05, 'epochs': 99, 'loss': 'mse', 'optimizer': 'adam', 'graph_mode': 'cutoff', 'cutoff': 0.4318039662615697, 'grm_norm': 'cosine', 'self_loops': True, 'use_snp_selection': False}. Best is trial 11 with value: 0.2780430305053469.
[I 2025-12-08 23:40:41,290] Trial 14 finished with value: 0.0 and parameters: {'model_type': 'graphsage', 'hidden_dims': '[512, 128]', 'dropout': 0.4355578990170137, 'batch_norm': False, 'sage_aggr': 'max', 'sage_normalize': False, 'sage_project': False, 'lr': 0.00946458676109481, 'weight_decay': 1.3558207967037549e-05, 'epochs': 237, 'loss': 'mse', 'optimizer': 'adam', 'graph_mode': 'knn', 'knn_k': 3, 'weighted_edges': False, 'symmetrize_mode': 'mutual', 'self_loops': True, 'use_snp_selection': True, 'num_snps': 44167}. Best is trial 11 with value: 0.2780430305053469.
[I 2025-12-08 23:41:56,266] Trial 15 finished with value: 0.24680025190127575 and parameters: {'model_type': 'graphsage', 'hidden_dims': '[512, 128]', 'dropout': 0.5838495493128881, 'batch_norm': False, 'sage_aggr': 'mean', 'sage_normalize': True, 'sage_project': False, 'lr': 0.001423385039074978, 'weight_decay': 7.321160944213961e-07, 'epochs': 126, 'loss': 'mse', 'optimizer': 'adam', 'graph_mode': 'cutoff', 'cutoff': 0.3717639182212347, 'grm_norm': 'cosine_then_gcn', 'self_loops': True, 'use_snp_selection': False}. Best is trial 11 with value: 0.2780430305053469.
[I 2025-12-08 23:45:48,324] Trial 16 finished with value: 0.21505615316362697 and parameters: {'model_type': 'graphsage', 'hidden_dims': '[256, 128]', 'dropout': 0.4140247491437248, 'batch_norm': False, 'sage_aggr': 'max', 'sage_normalize': True, 'sage_project': False, 'lr': 0.003617480999440673, 'weight_decay': 0.00014295064133217937, 'epochs': 242, 'loss': 'mse', 'optimizer': 'adam', 'graph_mode': 'knn', 'knn_k': 4, 'weighted_edges': False, 'symmetrize_mode': 'union', 'self_loops': True, 'use_snp_selection': True, 'num_snps': 59604}. Best is trial 11 with value: 0.2780430305053469.
[I 2025-12-08 23:47:25,883] Trial 17 finished with value: 0.2808327398605716 and parameters: {'model_type': 'graphsage', 'hidden_dims': '[512, 128]', 'dropout': 0.3925805939221347, 'batch_norm': False, 'sage_aggr': 'mean', 'sage_normalize': False, 'sage_project': False, 'lr': 3.9150102079594556e-05, 'weight_decay': 1.0174199044142654e-07, 'epochs': 209, 'loss': 'mse', 'optimizer': 'adam', 'graph_mode': 'cutoff', 'cutoff': 0.8612500664986729, 'grm_norm': 'cosine', 'self_loops': True, 'use_snp_selection': False}. Best is trial 17 with value: 0.2808327398605716.
[I 2025-12-08 23:49:38,386] Trial 18 finished with value: 0.2514983734526674 and parameters: {'model_type': 'graphsage', 'hidden_dims': '[512, 128]', 'dropout': 0.3962225416711206, 'batch_norm': False, 'sage_aggr': 'mean', 'sage_normalize': True, 'sage_project': False, 'lr': 0.00011986251109590532, 'weight_decay': 1.021997228159545e-07, 'epochs': 285, 'loss': 'mse', 'optimizer': 'adam', 'graph_mode': 'cutoff', 'cutoff': 0.836088916356094, 'grm_norm': 'cosine', 'self_loops': False, 'use_snp_selection': False}. Best is trial 17 with value: 0.2808327398605716.
[I 2025-12-08 23:51:15,297] Trial 19 finished with value: 0.012353091101606118 and parameters: {'model_type': 'graphsage', 'hidden_dims': '[512, 128]', 'dropout': 0.5181056566659079, 'batch_norm': False, 'sage_aggr': 'mean', 'sage_normalize': False, 'sage_project': False, 'lr': 0.0009276126178989387, 'weight_decay': 2.7172185042400107e-07, 'epochs': 207, 'loss': 'mse', 'optimizer': 'adam', 'graph_mode': 'cutoff', 'cutoff': 0.6509177373611086, 'grm_norm': 'cosine', 'self_loops': True, 'use_snp_selection': False}. Best is trial 17 with value: 0.2808327398605716.
[I 2025-12-08 23:52:12,257] Trial 20 finished with value: 0.0 and parameters: {'model_type': 'graphsage', 'hidden_dims': '[128, 64]', 'dropout': 0.5995327024092587, 'batch_norm': False, 'sage_aggr': 'mean', 'sage_normalize': False, 'sage_project': False, 'lr': 0.00016827040726292308, 'weight_decay': 1.9384620757992513e-06, 'epochs': 347, 'loss': 'mse', 'optimizer': 'adam', 'graph_mode': 'cutoff', 'cutoff': 0.8857889554492647, 'grm_norm': 'gcn', 'self_loops': True, 'use_snp_selection': False}. Best is trial 17 with value: 0.2808327398605716.
[I 2025-12-08 23:53:12,523] Trial 21 finished with value: 0.27626331573987406 and parameters: {'model_type': 'graphsage', 'hidden_dims': '[512, 128]', 'dropout': 0.23090703697841608, 'batch_norm': False, 'sage_aggr': 'mean', 'sage_normalize': False, 'sage_project': False, 'lr': 4.765034026591523e-05, 'weight_decay': 6.784223807012272e-06, 'epochs': 116, 'loss': 'mse', 'optimizer': 'adam', 'graph_mode': 'cutoff', 'cutoff': 0.7133073074806517, 'grm_norm': 'cosine_then_gcn', 'self_loops': True, 'use_snp_selection': False}. Best is trial 17 with value: 0.2808327398605716.
[I 2025-12-08 23:53:43,196] Trial 22 finished with value: 0.24796891018307304 and parameters: {'model_type': 'graphsage', 'hidden_dims': '[512, 128]', 'dropout': 0.3930042080864913, 'batch_norm': False, 'sage_aggr': 'mean', 'sage_normalize': False, 'sage_project': False, 'lr': 3.188507794364717e-05, 'weight_decay': 6.7509343910716225e-06, 'epochs': 43, 'loss': 'mse', 'optimizer': 'adam', 'graph_mode': 'cutoff', 'cutoff': 0.7237840514333981, 'grm_norm': 'cosine_then_gcn', 'self_loops': True, 'use_snp_selection': False}. Best is trial 17 with value: 0.2808327398605716.
[I 2025-12-08 23:54:41,891] Trial 23 finished with value: 0.17077742555564845 and parameters: {'model_type': 'graphsage', 'hidden_dims': '[512, 128]', 'dropout': 0.4714884074029567, 'batch_norm': False, 'sage_aggr': 'mean', 'sage_normalize': False, 'sage_project': False, 'lr': 0.00020732986538689546, 'weight_decay': 8.242776784500232e-07, 'epochs': 113, 'loss': 'mse', 'optimizer': 'adam', 'graph_mode': 'cutoff', 'cutoff': 0.7808440590950052, 'grm_norm': 'cosine_then_gcn', 'self_loops': True, 'use_snp_selection': False}. Best is trial 17 with value: 0.2808327398605716.
[I 2025-12-08 23:56:21,999] Trial 24 finished with value: 0.28057189527237897 and parameters: {'model_type': 'graphsage', 'hidden_dims': '[512, 128]', 'dropout': 0.5235263285490408, 'batch_norm': False, 'sage_aggr': 'mean', 'sage_normalize': False, 'sage_project': False, 'lr': 3.103805683000427e-05, 'weight_decay': 3.3009621926956386e-07, 'epochs': 215, 'loss': 'mse', 'optimizer': 'adam', 'graph_mode': 'cutoff', 'cutoff': 0.6652195436130806, 'grm_norm': 'cosine', 'self_loops': True, 'use_snp_selection': False}. Best is trial 17 with value: 0.2808327398605716.
[I 2025-12-08 23:57:55,632] Trial 25 finished with value: 0.27461044075215646 and parameters: {'model_type': 'graphsage', 'hidden_dims': '[256, 128]', 'dropout': 0.53398711810427, 'batch_norm': False, 'sage_aggr': 'mean', 'sage_normalize': False, 'sage_project': False, 'lr': 2.9768686929088993e-05, 'weight_decay': 2.540655971027378e-07, 'epochs': 263, 'loss': 'mse', 'optimizer': 'adam', 'graph_mode': 'cutoff', 'cutoff': 0.32925358612215594, 'grm_norm': 'cosine', 'self_loops': True, 'use_snp_selection': False}. Best is trial 17 with value: 0.2808327398605716.
[I 2025-12-08 23:58:57,637] Trial 26 finished with value: 0.23694202182090499 and parameters: {'model_type': 'graphsage', 'hidden_dims': '[256, 128, 64]', 'dropout': 0.5110192126943228, 'batch_norm': False, 'sage_aggr': 'mean', 'sage_normalize': True, 'sage_project': False, 'lr': 2.34650359777336e-05, 'weight_decay': 3.9580351305923304e-07, 'epochs': 211, 'loss': 'mse', 'optimizer': 'adam', 'graph_mode': 'cutoff', 'cutoff': 0.5584743379075096, 'grm_norm': 'cosine', 'self_loops': True, 'use_snp_selection': False}. Best is trial 17 with value: 0.2808327398605716.
[I 2025-12-09 00:01:22,098] Trial 27 finished with value: 0.28514130695671636 and parameters: {'model_type': 'graphsage', 'hidden_dims': '[512, 64]', 'dropout': 0.37312762763094126, 'batch_norm': False, 'sage_aggr': 'mean', 'sage_normalize': False, 'sage_project': False, 'lr': 1.079757629882776e-05, 'weight_decay': 1.6506662269942616e-07, 'epochs': 319, 'loss': 'mae', 'optimizer': 'adam', 'graph_mode': 'cutoff', 'cutoff': 0.6353037502888171, 'grm_norm': 'cosine', 'self_loops': False, 'use_snp_selection': False}. Best is trial 27 with value: 0.28514130695671636.
[I 2025-12-09 00:03:40,599] Trial 28 finished with value: 0.28703305183772615 and parameters: {'model_type': 'graphsage', 'hidden_dims': '[512, 64]', 'dropout': 0.3762497302109112, 'batch_norm': False, 'sage_aggr': 'mean', 'sage_normalize': False, 'sage_project': False, 'lr': 1.4257962016494217e-05, 'weight_decay': 1.6480834074381835e-07, 'epochs': 305, 'loss': 'mae', 'optimizer': 'adam', 'graph_mode': 'cutoff', 'cutoff': 0.6124065374116122, 'grm_norm': 'cosine', 'self_loops': False, 'use_snp_selection': False}. Best is trial 28 with value: 0.28703305183772615.
[I 2025-12-09 00:05:48,815] Trial 29 finished with value: 0.27727058233050283 and parameters: {'model_type': 'graphsage', 'hidden_dims': '[512, 64]', 'dropout': 0.3750328512927807, 'batch_norm': True, 'sage_aggr': 'mean', 'sage_normalize': False, 'sage_project': False, 'lr': 1.003324138382218e-05, 'weight_decay': 1.4628957022260237e-07, 'epochs': 250, 'loss': 'mae', 'optimizer': 'adam', 'graph_mode': 'cutoff', 'cutoff': 0.4963689096103435, 'grm_norm': 'cosine', 'self_loops': False, 'use_snp_selection': False}. Best is trial 28 with value: 0.28703305183772615.
[I 2025-12-09 00:08:07,587] Trial 30 finished with value: 0.285080558438073 and parameters: {'model_type': 'graphsage', 'hidden_dims': '[512, 64]', 'dropout': 0.3082701467614979, 'batch_norm': False, 'sage_aggr': 'mean', 'sage_normalize': False, 'sage_project': False, 'lr': 1.0158148596492163e-05, 'weight_decay': 1.744121259243676e-07, 'epochs': 305, 'loss': 'mae', 'optimizer': 'adam', 'graph_mode': 'cutoff', 'cutoff': 0.6207510053115338, 'grm_norm': 'cosine', 'self_loops': False, 'use_snp_selection': False}. Best is trial 28 with value: 0.28703305183772615.
[I 2025-12-09 00:10:28,881] Trial 31 finished with value: 0.2871956790107179 and parameters: {'model_type': 'graphsage', 'hidden_dims': '[512, 64]', 'dropout': 0.3161802932454789, 'batch_norm': False, 'sage_aggr': 'mean', 'sage_normalize': False, 'sage_project': False, 'lr': 1.0035967710289446e-05, 'weight_decay': 2.0013214944156605e-07, 'epochs': 311, 'loss': 'mae', 'optimizer': 'adam', 'graph_mode': 'cutoff', 'cutoff': 0.6190412668013204, 'grm_norm': 'cosine', 'self_loops': False, 'use_snp_selection': False}. Best is trial 31 with value: 0.2871956790107179.
[I 2025-12-09 00:12:48,885] Trial 32 finished with value: 0.28493600273860337 and parameters: {'model_type': 'graphsage', 'hidden_dims': '[512, 64]', 'dropout': 0.3081063515671979, 'batch_norm': False, 'sage_aggr': 'mean', 'sage_normalize': False, 'sage_project': False, 'lr': 1.1040564683353343e-05, 'weight_decay': 2.0242739963437525e-07, 'epochs': 308, 'loss': 'mae', 'optimizer': 'adam', 'graph_mode': 'cutoff', 'cutoff': 0.6160320639437786, 'grm_norm': 'cosine', 'self_loops': False, 'use_snp_selection': False}. Best is trial 31 with value: 0.2871956790107179.
[I 2025-12-09 00:15:11,995] Trial 33 finished with value: 0.2841415344036145 and parameters: {'model_type': 'graphsage', 'hidden_dims': '[512, 64]', 'dropout': 0.31181478368776616, 'batch_norm': False, 'sage_aggr': 'mean', 'sage_normalize': False, 'sage_project': False, 'lr': 1.7846980083866825e-05, 'weight_decay': 5.335446508522851e-07, 'epochs': 308, 'loss': 'mae', 'optimizer': 'adam', 'graph_mode': 'cutoff', 'cutoff': 0.5283967116434699, 'grm_norm': 'cosine', 'self_loops': False, 'use_snp_selection': False}. Best is trial 31 with value: 0.2871956790107179.
[I 2025-12-09 00:17:10,190] Trial 34 finished with value: 0.2844884013330004 and parameters: {'model_type': 'graphsage', 'hidden_dims': '[512, 64]', 'dropout': 0.35777173552642844, 'batch_norm': False, 'sage_aggr': 'mean', 'sage_normalize': False, 'sage_project': False, 'lr': 6.24737465863321e-05, 'weight_decay': 1.9661370747096952e-07, 'epochs': 259, 'loss': 'mae', 'optimizer': 'adam', 'graph_mode': 'cutoff', 'cutoff': 0.6605426136236044, 'grm_norm': 'cosine', 'self_loops': False, 'use_snp_selection': False}. Best is trial 31 with value: 0.2871956790107179.
[I 2025-12-09 00:19:28,849] Trial 35 finished with value: 0.2816989680283609 and parameters: {'model_type': 'graphsage', 'hidden_dims': '[512, 64]', 'dropout': 0.21872899561286185, 'batch_norm': False, 'sage_aggr': 'mean', 'sage_normalize': False, 'sage_project': False, 'lr': 1.6824676635937062e-05, 'weight_decay': 1.6171256841947089e-06, 'epochs': 305, 'loss': 'mae', 'optimizer': 'adam', 'graph_mode': 'cutoff', 'cutoff': 0.5933344117963919, 'grm_norm': 'cosine', 'self_loops': False, 'use_snp_selection': False}. Best is trial 31 with value: 0.2871956790107179.
[I 2025-12-09 00:21:37,045] Trial 36 finished with value: 0.27843040770754823 and parameters: {'model_type': 'graphsage', 'hidden_dims': '[512, 64]', 'dropout': 0.2856461926364682, 'batch_norm': True, 'sage_aggr': 'mean', 'sage_normalize': False, 'sage_project': False, 'lr': 1.2736154520728115e-05, 'weight_decay': 1.6518455415309224e-07, 'epochs': 275, 'loss': 'mae', 'optimizer': 'adam', 'graph_mode': 'cutoff', 'cutoff': 0.6994926641640576, 'grm_norm': 'cosine', 'self_loops': False, 'use_snp_selection': False}. Best is trial 31 with value: 0.2871956790107179.
[I 2025-12-09 00:24:07,640] Trial 37 finished with value: 0.28108173352994287 and parameters: {'model_type': 'graphsage', 'hidden_dims': '[512, 64]', 'dropout': 0.34966402762926374, 'batch_norm': False, 'sage_aggr': 'mean', 'sage_normalize': False, 'sage_project': False, 'lr': 2.1826279928552154e-05, 'weight_decay': 1.4777264219191867e-06, 'epochs': 324, 'loss': 'mae', 'optimizer': 'adam', 'graph_mode': 'cutoff', 'cutoff': 0.5424638521755806, 'grm_norm': 'none', 'self_loops': False, 'use_snp_selection': False}. Best is trial 31 with value: 0.2871956790107179.
[I 2025-12-09 00:26:25,016] Trial 38 finished with value: 0.273042556926094 and parameters: {'model_type': 'graphsage', 'hidden_dims': '[512, 64]', 'dropout': 0.2717561136207706, 'batch_norm': True, 'sage_aggr': 'max', 'sage_normalize': False, 'sage_project': False, 'lr': 1.0304482861283126e-05, 'weight_decay': 5.365875389629587e-07, 'epochs': 297, 'loss': 'mae', 'optimizer': 'adam', 'graph_mode': 'cutoff', 'cutoff': 0.6275437797035791, 'grm_norm': 'gcn', 'self_loops': False, 'use_snp_selection': False}. Best is trial 31 with value: 0.2871956790107179.
[I 2025-12-09 00:29:13,722] Trial 39 finished with value: 0.28273593233635586 and parameters: {'model_type': 'graphsage', 'hidden_dims': '[512, 256]', 'dropout': 0.3302369010138901, 'batch_norm': False, 'sage_aggr': 'mean', 'sage_normalize': False, 'sage_project': False, 'lr': 1.64114440177101e-05, 'weight_decay': 5.36156664016146e-07, 'epochs': 334, 'loss': 'mae', 'optimizer': 'adam', 'graph_mode': 'cutoff', 'cutoff': 0.4827990826070134, 'grm_norm': 'gcn', 'self_loops': False, 'use_snp_selection': False}. Best is trial 31 with value: 0.2871956790107179.
[I 2025-12-09 00:33:23,059] Trial 40 finished with value: 0.265238073201522 and parameters: {'model_type': 'graphsage', 'hidden_dims': '[512, 64]', 'dropout': 0.4405639017532176, 'batch_norm': True, 'sage_aggr': 'mean', 'sage_normalize': False, 'sage_project': False, 'lr': 6.970888851925347e-05, 'weight_decay': 1.063660944213353e-06, 'epochs': 273, 'loss': 'mae', 'optimizer': 'adam', 'graph_mode': 'knn', 'knn_k': 10, 'weighted_edges': True, 'symmetrize_mode': 'union', 'self_loops': False, 'use_snp_selection': False}. Best is trial 31 with value: 0.2871956790107179.
[I 2025-12-09 00:35:44,324] Trial 41 finished with value: 0.2796683443989748 and parameters: {'model_type': 'graphsage', 'hidden_dims': '[512, 64]', 'dropout': 0.3095443576252179, 'batch_norm': False, 'sage_aggr': 'mean', 'sage_normalize': False, 'sage_project': False, 'lr': 1.018913243285643e-05, 'weight_decay': 1.9568405178116274e-07, 'epochs': 310, 'loss': 'mae', 'optimizer': 'adam', 'graph_mode': 'cutoff', 'cutoff': 0.6033321226961554, 'grm_norm': 'cosine', 'self_loops': False, 'use_snp_selection': False}. Best is trial 31 with value: 0.2871956790107179.
[I 2025-12-09 00:37:59,599] Trial 42 finished with value: 0.2841398811279546 and parameters: {'model_type': 'graphsage', 'hidden_dims': '[512, 64]', 'dropout': 0.29627052205848, 'batch_norm': False, 'sage_aggr': 'mean', 'sage_normalize': False, 'sage_project': False, 'lr': 1.4193801307169314e-05, 'weight_decay': 2.3811431121507262e-07, 'epochs': 294, 'loss': 'mae', 'optimizer': 'adam', 'graph_mode': 'cutoff', 'cutoff': 0.571942719217056, 'grm_norm': 'cosine', 'self_loops': False, 'use_snp_selection': False}. Best is trial 31 with value: 0.2871956790107179.
[I 2025-12-09 00:40:22,873] Trial 43 finished with value: 0.2791763140616984 and parameters: {'model_type': 'graphsage', 'hidden_dims': '[512, 64]', 'dropout': 0.2502011969457289, 'batch_norm': False, 'sage_aggr': 'mean', 'sage_normalize': False, 'sage_project': False, 'lr': 2.415061804773112e-05, 'weight_decay': 1.3889311204268292e-07, 'epochs': 319, 'loss': 'mae', 'optimizer': 'adam', 'graph_mode': 'cutoff', 'cutoff': 0.6453397234567746, 'grm_norm': 'cosine', 'self_loops': False, 'use_snp_selection': False}. Best is trial 31 with value: 0.2871956790107179.
