[I 2025-12-10 03:49:54,731] Trial 104 finished with value: 0.3662756602529854 and parameters: {'model_type': 'graphsage', 'hidden_dims': '[128, 64]', 'dropout': 0.17894559768754828, 'batch_norm': False, 'sage_aggr': 'mean', 'sage_normalize': False, 'sage_project': False, 'lr': 5.928936695096716e-05, 'weight_decay': 3.1642770723788934e-07, 'epochs': 101, 'loss': 'mae', 'optimizer': 'adam', 'graph_mode': 'cutoff', 'cutoff': 0.47326269627532336, 'grm_norm': 'none', 'self_loops': False, 'use_snp_selection': True, 'num_snps': 29210}. Best is trial 91 with value: 0.3736181645924715.
[I 2025-12-10 03:50:28,522] Trial 105 finished with value: 0.371868714649369 and parameters: {'model_type': 'graphsage', 'hidden_dims': '[128, 64]', 'dropout': 0.1980738365108076, 'batch_norm': False, 'sage_aggr': 'mean', 'sage_normalize': False, 'sage_project': False, 'lr': 7.70622170012181e-05, 'weight_decay': 1.5156406813964357e-07, 'epochs': 90, 'loss': 'mae', 'optimizer': 'adam', 'graph_mode': 'cutoff', 'cutoff': 0.3992266057840016, 'grm_norm': 'cosine', 'self_loops': False, 'use_snp_selection': True, 'num_snps': 31715}. Best is trial 91 with value: 0.3736181645924715.
[I 2025-12-10 03:50:52,880] Trial 106 finished with value: 0.3708229841809401 and parameters: {'model_type': 'graphsage', 'hidden_dims': '[128, 64]', 'dropout': 0.145610552823329, 'batch_norm': False, 'sage_aggr': 'mean', 'sage_normalize': False, 'sage_project': False, 'lr': 7.352174796594458e-05, 'weight_decay': 1.4892327987527003e-07, 'epochs': 88, 'loss': 'mae', 'optimizer': 'adam', 'graph_mode': 'cutoff', 'cutoff': 0.45063437097447395, 'grm_norm': 'cosine', 'self_loops': False, 'use_snp_selection': True, 'num_snps': 25449}. Best is trial 91 with value: 0.3736181645924715.
[I 2025-12-10 03:51:12,703] Trial 107 finished with value: 0.3650528218294319 and parameters: {'model_type': 'graphsage', 'hidden_dims': '[128, 64]', 'dropout': 0.14524364314146643, 'batch_norm': False, 'sage_aggr': 'mean', 'sage_normalize': False, 'sage_project': False, 'lr': 8.021465134350127e-05, 'weight_decay': 1.6856715776645234e-07, 'epochs': 89, 'loss': 'mae', 'optimizer': 'adam', 'graph_mode': 'cutoff', 'cutoff': 0.5031548624569165, 'grm_norm': 'cosine', 'self_loops': False, 'use_snp_selection': True, 'num_snps': 22152}. Best is trial 91 with value: 0.3736181645924715.
[I 2025-12-10 03:51:51,135] Trial 108 finished with value: 0.3621338154310707 and parameters: {'model_type': 'graphsage', 'hidden_dims': '[128, 64]', 'dropout': 0.16415926353349886, 'batch_norm': False, 'sage_aggr': 'mean', 'sage_normalize': False, 'sage_project': False, 'lr': 6.790723685700323e-05, 'weight_decay': 1.010322253659411e-07, 'epochs': 80, 'loss': 'mae', 'optimizer': 'adam', 'graph_mode': 'knn', 'knn_k': 7, 'weighted_edges': False, 'symmetrize_mode': 'union', 'self_loops': False, 'use_snp_selection': True, 'num_snps': 25710}. Best is trial 91 with value: 0.3736181645924715.
[I 2025-12-10 03:52:28,327] Trial 109 finished with value: 0.36761078042756645 and parameters: {'model_type': 'graphsage', 'hidden_dims': '[128, 64]', 'dropout': 0.12501688301763278, 'batch_norm': False, 'sage_aggr': 'mean', 'sage_normalize': False, 'sage_project': False, 'lr': 0.00010094725942056938, 'weight_decay': 1.6089263792325055e-07, 'epochs': 147, 'loss': 'mae', 'optimizer': 'adam', 'graph_mode': 'cutoff', 'cutoff': 0.460204061235713, 'grm_norm': 'cosine', 'self_loops': False, 'use_snp_selection': True, 'num_snps': 28059}. Best is trial 91 with value: 0.3736181645924715.
[I 2025-12-10 03:52:55,201] Trial 110 finished with value: 0.36256728011858874 and parameters: {'model_type': 'graphsage', 'hidden_dims': '[128, 64]', 'dropout': 0.18818856160926, 'batch_norm': False, 'sage_aggr': 'mean', 'sage_normalize': False, 'sage_project': False, 'lr': 0.00014917090184362003, 'weight_decay': 1.32821261269941e-07, 'epochs': 69, 'loss': 'mae', 'optimizer': 'adam', 'graph_mode': 'cutoff', 'cutoff': 0.4021485485511, 'grm_norm': 'cosine', 'self_loops': False, 'use_snp_selection': True, 'num_snps': 29825}. Best is trial 91 with value: 0.3736181645924715.
[I 2025-12-10 03:53:38,931] Trial 111 finished with value: 0.3716551890553733 and parameters: {'model_type': 'graphsage', 'hidden_dims': '[128, 64]', 'dropout': 0.1580593194140718, 'batch_norm': False, 'sage_aggr': 'mean', 'sage_normalize': False, 'sage_project': False, 'lr': 5.12193452676393e-05, 'weight_decay': 2.516490314450611e-07, 'epochs': 129, 'loss': 'mae', 'optimizer': 'adam', 'graph_mode': 'cutoff', 'cutoff': 0.4475194313455209, 'grm_norm': 'cosine', 'self_loops': False, 'use_snp_selection': True, 'num_snps': 35583}. Best is trial 91 with value: 0.3736181645924715.
[I 2025-12-10 03:54:20,117] Trial 112 finished with value: 0.3666768695730809 and parameters: {'model_type': 'graphsage', 'hidden_dims': '[128, 64]', 'dropout': 0.11203181313027827, 'batch_norm': False, 'sage_aggr': 'mean', 'sage_normalize': False, 'sage_project': False, 'lr': 4.5991004322787686e-05, 'weight_decay': 3.8169158223402625e-07, 'epochs': 106, 'loss': 'mae', 'optimizer': 'adam', 'graph_mode': 'cutoff', 'cutoff': 0.4510219897283428, 'grm_norm': 'cosine', 'self_loops': False, 'use_snp_selection': True, 'num_snps': 35706}. Best is trial 91 with value: 0.3736181645924715.
[I 2025-12-10 03:54:58,995] Trial 113 finished with value: 0.36398218197825594 and parameters: {'model_type': 'graphsage', 'hidden_dims': '[128, 64]', 'dropout': 0.1717992819892284, 'batch_norm': False, 'sage_aggr': 'mean', 'sage_normalize': False, 'sage_project': False, 'lr': 5.377748838615151e-05, 'weight_decay': 2.4841752649672836e-07, 'epochs': 120, 'loss': 'mae', 'optimizer': 'adam', 'graph_mode': 'cutoff', 'cutoff': 0.4872049886562487, 'grm_norm': 'cosine', 'self_loops': False, 'use_snp_selection': True, 'num_snps': 34232}. Best is trial 91 with value: 0.3736181645924715.
[I 2025-12-10 03:55:25,059] Trial 114 finished with value: 0.3719072731277099 and parameters: {'model_type': 'graphsage', 'hidden_dims': '[128, 64]', 'dropout': 0.12827531243392437, 'batch_norm': False, 'sage_aggr': 'mean', 'sage_normalize': False, 'sage_project': False, 'lr': 9.463984897043559e-05, 'weight_decay': 1.348498787359158e-07, 'epochs': 88, 'loss': 'mae', 'optimizer': 'adam', 'graph_mode': 'cutoff', 'cutoff': 0.4135875862858343, 'grm_norm': 'cosine', 'self_loops': False, 'use_snp_selection': True, 'num_snps': 26310}. Best is trial 91 with value: 0.3736181645924715.
[I 2025-12-10 03:55:44,224] Trial 115 finished with value: 0.3727950706078357 and parameters: {'model_type': 'graphsage', 'hidden_dims': '[128, 64]', 'dropout': 0.12496475762539959, 'batch_norm': False, 'sage_aggr': 'mean', 'sage_normalize': False, 'sage_project': False, 'lr': 8.76833766870231e-05, 'weight_decay': 2.0387666618637292e-07, 'epochs': 78, 'loss': 'mae', 'optimizer': 'adam', 'graph_mode': 'cutoff', 'cutoff': 0.5399099711493488, 'grm_norm': 'cosine', 'self_loops': False, 'use_snp_selection': True, 'num_snps': 26604}. Best is trial 91 with value: 0.3736181645924715.
[I 2025-12-10 03:56:00,540] Trial 116 finished with value: 0.3716910304062101 and parameters: {'model_type': 'graphsage', 'hidden_dims': '[128, 64]', 'dropout': 0.12534121285896405, 'batch_norm': False, 'sage_aggr': 'mean', 'sage_normalize': False, 'sage_project': False, 'lr': 0.00013166819796796075, 'weight_decay': 2.125038800360741e-07, 'epochs': 56, 'loss': 'mae', 'optimizer': 'adam', 'graph_mode': 'cutoff', 'cutoff': 0.6163436802709957, 'grm_norm': 'cosine', 'self_loops': False, 'use_snp_selection': True, 'num_snps': 25238}. Best is trial 91 with value: 0.3736181645924715.
[I 2025-12-10 03:56:11,077] Trial 117 finished with value: 0.28701058648271094 and parameters: {'model_type': 'graphsage', 'hidden_dims': '[128, 64]', 'dropout': 0.12024009788957721, 'batch_norm': False, 'sage_aggr': 'mean', 'sage_normalize': False, 'sage_project': False, 'lr': 9.835974961639778e-05, 'weight_decay': 1.3586197782026975e-07, 'epochs': 47, 'loss': 'mae', 'optimizer': 'adam', 'graph_mode': 'cutoff', 'cutoff': 0.6279747657189124, 'grm_norm': 'cosine', 'self_loops': False, 'use_snp_selection': False}. Best is trial 91 with value: 0.3736181645924715.
[I 2025-12-10 03:56:28,312] Trial 118 finished with value: 0.3703878756242876 and parameters: {'model_type': 'graphsage', 'hidden_dims': '[128, 64]', 'dropout': 0.1286101425359379, 'batch_norm': False, 'sage_aggr': 'mean', 'sage_normalize': False, 'sage_project': False, 'lr': 0.00017390700334316047, 'weight_decay': 2.07411919169861e-07, 'epochs': 62, 'loss': 'mae', 'optimizer': 'adam', 'graph_mode': 'cutoff', 'cutoff': 0.5776522477095367, 'grm_norm': 'cosine', 'self_loops': False, 'use_snp_selection': True, 'num_snps': 25961}. Best is trial 91 with value: 0.3736181645924715.
[I 2025-12-10 03:56:44,424] Trial 119 finished with value: 0.3690723863499159 and parameters: {'model_type': 'graphsage', 'hidden_dims': '[128, 64]', 'dropout': 0.10953121653878078, 'batch_norm': False, 'sage_aggr': 'mean', 'sage_normalize': False, 'sage_project': False, 'lr': 0.0001328205027059153, 'weight_decay': 1.0072496824768068e-07, 'epochs': 63, 'loss': 'mae', 'optimizer': 'adam', 'graph_mode': 'cutoff', 'cutoff': 0.7063417304920001, 'grm_norm': 'cosine', 'self_loops': False, 'use_snp_selection': True, 'num_snps': 23370}. Best is trial 91 with value: 0.3736181645924715.
[I 2025-12-10 03:57:04,471] Trial 120 finished with value: 0.3739007645808877 and parameters: {'model_type': 'graphsage', 'hidden_dims': '[256, 128, 64]', 'dropout': 0.13239753159776382, 'batch_norm': False, 'sage_aggr': 'mean', 'sage_normalize': False, 'sage_project': False, 'lr': 7.955282020568389e-05, 'weight_decay': 1.9818287820518725e-07, 'epochs': 53, 'loss': 'mae', 'optimizer': 'adam', 'graph_mode': 'cutoff', 'cutoff': 0.5329040375304285, 'grm_norm': 'cosine', 'self_loops': False, 'use_snp_selection': True, 'num_snps': 26846}. Best is trial 120 with value: 0.3739007645808877.
[I 2025-12-10 03:57:22,070] Trial 121 finished with value: 0.3640804565204535 and parameters: {'model_type': 'graphsage', 'hidden_dims': '[256, 128, 64]', 'dropout': 0.12358107454871184, 'batch_norm': False, 'sage_aggr': 'mean', 'sage_normalize': False, 'sage_project': False, 'lr': 8.698330810861699e-05, 'weight_decay': 1.8232683272285221e-07, 'epochs': 41, 'loss': 'mae', 'optimizer': 'adam', 'graph_mode': 'cutoff', 'cutoff': 0.5489822425955745, 'grm_norm': 'cosine', 'self_loops': False, 'use_snp_selection': True, 'num_snps': 25068}. Best is trial 120 with value: 0.3739007645808877.
[I 2025-12-10 03:57:42,779] Trial 122 finished with value: 0.37013864779105804 and parameters: {'model_type': 'graphsage', 'hidden_dims': '[256, 128, 64]', 'dropout': 0.13113523594077486, 'batch_norm': False, 'sage_aggr': 'mean', 'sage_normalize': False, 'sage_project': False, 'lr': 7.323551780145987e-05, 'weight_decay': 1.4806610357291408e-07, 'epochs': 57, 'loss': 'mae', 'optimizer': 'adam', 'graph_mode': 'cutoff', 'cutoff': 0.5328127803692423, 'grm_norm': 'cosine', 'self_loops': False, 'use_snp_selection': True, 'num_snps': 27020}. Best is trial 120 with value: 0.3739007645808877.
[I 2025-12-10 03:58:01,820] Trial 123 finished with value: 0.37386774616296503 and parameters: {'model_type': 'graphsage', 'hidden_dims': '[256, 128, 64]', 'dropout': 0.14004978586774366, 'batch_norm': False, 'sage_aggr': 'mean', 'sage_normalize': False, 'sage_project': False, 'lr': 0.00010752949264522994, 'weight_decay': 2.756663130228299e-07, 'epochs': 48, 'loss': 'mae', 'optimizer': 'adam', 'graph_mode': 'cutoff', 'cutoff': 0.5674463209511773, 'grm_norm': 'cosine', 'self_loops': False, 'use_snp_selection': True, 'num_snps': 26794}. Best is trial 120 with value: 0.3739007645808877.
[I 2025-12-10 03:58:22,385] Trial 124 finished with value: 0.3635812599624832 and parameters: {'model_type': 'graphsage', 'hidden_dims': '[256, 128, 64]', 'dropout': 0.11211463393334882, 'batch_norm': False, 'sage_aggr': 'mean', 'sage_normalize': False, 'sage_project': False, 'lr': 0.00010830964223063842, 'weight_decay': 2.8314566926917336e-07, 'epochs': 77, 'loss': 'mae', 'optimizer': 'adam', 'graph_mode': 'cutoff', 'cutoff': 0.5823183016871674, 'grm_norm': 'cosine', 'self_loops': False, 'use_snp_selection': True, 'num_snps': 22812}. Best is trial 120 with value: 0.3739007645808877.
[I 2025-12-10 03:58:41,574] Trial 125 finished with value: 0.3672039976817684 and parameters: {'model_type': 'graphsage', 'hidden_dims': '[256, 128, 64]', 'dropout': 0.16304921388904192, 'batch_norm': False, 'sage_aggr': 'mean', 'sage_normalize': False, 'sage_project': False, 'lr': 0.00013275524973996653, 'weight_decay': 2.213336027352588e-07, 'epochs': 50, 'loss': 'mae', 'optimizer': 'adam', 'graph_mode': 'cutoff', 'cutoff': 0.5674453512945348, 'grm_norm': 'cosine', 'self_loops': False, 'use_snp_selection': True, 'num_snps': 26549}. Best is trial 120 with value: 0.3739007645808877.
[I 2025-12-10 03:59:00,311] Trial 126 finished with value: 0.3629895852650068 and parameters: {'model_type': 'graphsage', 'hidden_dims': '[256, 128, 64]', 'dropout': 0.5006846204464354, 'batch_norm': False, 'sage_aggr': 'mean', 'sage_normalize': False, 'sage_project': False, 'lr': 9.2688222207024e-05, 'weight_decay': 1.8945319385605796e-07, 'epochs': 68, 'loss': 'mae', 'optimizer': 'adam', 'graph_mode': 'cutoff', 'cutoff': 0.6089504649351654, 'grm_norm': 'cosine', 'self_loops': False, 'use_snp_selection': True, 'num_snps': 21145}. Best is trial 120 with value: 0.3739007645808877.
[I 2025-12-10 03:59:48,263] Trial 127 finished with value: 0.3648997985290835 and parameters: {'model_type': 'graphsage', 'hidden_dims': '[256, 128, 64]', 'dropout': 0.1443902217677671, 'batch_norm': False, 'sage_aggr': 'mean', 'sage_normalize': False, 'sage_project': False, 'lr': 6.548473005882154e-05, 'weight_decay': 5.182051873363842e-07, 'epochs': 88, 'loss': 'mae', 'optimizer': 'adam', 'graph_mode': 'knn', 'knn_k': 8, 'weighted_edges': False, 'symmetrize_mode': 'union', 'self_loops': False, 'use_snp_selection': True, 'num_snps': 24447}. Best is trial 120 with value: 0.3739007645808877.
[I 2025-12-10 04:00:02,604] Trial 128 finished with value: 0.3686061004463417 and parameters: {'model_type': 'graphsage', 'hidden_dims': '[128, 64]', 'dropout': 0.12714761053814708, 'batch_norm': False, 'sage_aggr': 'mean', 'sage_normalize': False, 'sage_project': False, 'lr': 8.187928272169007e-05, 'weight_decay': 1.2623062082483932e-07, 'epochs': 46, 'loss': 'mae', 'optimizer': 'adam', 'graph_mode': 'cutoff', 'cutoff': 0.5186367475208963, 'grm_norm': 'cosine', 'self_loops': False, 'use_snp_selection': True, 'num_snps': 19506}. Best is trial 120 with value: 0.3739007645808877.
[I 2025-12-10 04:00:29,911] Trial 129 finished with value: 0.37044200831782476 and parameters: {'model_type': 'graphsage', 'hidden_dims': '[512, 64]', 'dropout': 0.10063484863497701, 'batch_norm': False, 'sage_aggr': 'mean', 'sage_normalize': False, 'sage_project': False, 'lr': 0.00012041133447744513, 'weight_decay': 4.092092119157953e-07, 'epochs': 60, 'loss': 'mae', 'optimizer': 'adam', 'graph_mode': 'cutoff', 'cutoff': 0.6005808067638275, 'grm_norm': 'cosine', 'self_loops': False, 'use_snp_selection': True, 'num_snps': 27732}. Best is trial 120 with value: 0.3739007645808877.
[I 2025-12-10 04:00:50,365] Trial 130 finished with value: 0.37552947316161644 and parameters: {'model_type': 'graphsage', 'hidden_dims': '[128, 64]', 'dropout': 0.17846662909318628, 'batch_norm': False, 'sage_aggr': 'mean', 'sage_normalize': False, 'sage_project': False, 'lr': 0.00015952612432174873, 'weight_decay': 2.715130423487597e-07, 'epochs': 75, 'loss': 'mae', 'optimizer': 'adam', 'graph_mode': 'cutoff', 'cutoff': 0.6576211879876019, 'grm_norm': 'cosine', 'self_loops': False, 'use_snp_selection': True, 'num_snps': 32375}. Best is trial 130 with value: 0.37552947316161644.
[I 2025-12-10 04:01:07,719] Trial 131 finished with value: 0.3571558916051417 and parameters: {'model_type': 'graphsage', 'hidden_dims': '[128, 64]', 'dropout': 0.17788325212832495, 'batch_norm': False, 'sage_aggr': 'mean', 'sage_normalize': False, 'sage_project': False, 'lr': 0.00017590793285293202, 'weight_decay': 2.6519478318981124e-07, 'epochs': 51, 'loss': 'mae', 'optimizer': 'adam', 'graph_mode': 'cutoff', 'cutoff': 0.6418715031089266, 'grm_norm': 'cosine', 'self_loops': False, 'use_snp_selection': True, 'num_snps': 29420}. Best is trial 130 with value: 0.37552947316161644.
[I 2025-12-10 04:01:32,119] Trial 132 finished with value: 0.37916936401711226 and parameters: {'model_type': 'graphsage', 'hidden_dims': '[128, 64]', 'dropout': 0.13838844685503882, 'batch_norm': False, 'sage_aggr': 'mean', 'sage_normalize': False, 'sage_project': False, 'lr': 0.00020991434698386865, 'weight_decay': 1.1776051413827449e-07, 'epochs': 76, 'loss': 'mae', 'optimizer': 'adam', 'graph_mode': 'cutoff', 'cutoff': 0.564831934508057, 'grm_norm': 'cosine', 'self_loops': False, 'use_snp_selection': True, 'num_snps': 39561}. Best is trial 132 with value: 0.37916936401711226.
[I 2025-12-10 04:01:55,495] Trial 133 finished with value: 0.36631596697814645 and parameters: {'model_type': 'graphsage', 'hidden_dims': '[128, 64]', 'dropout': 0.13638220271040769, 'batch_norm': False, 'sage_aggr': 'mean', 'sage_normalize': False, 'sage_project': False, 'lr': 0.0001574091307276604, 'weight_decay': 1.9819656463141104e-07, 'epochs': 75, 'loss': 'mae', 'optimizer': 'adam', 'graph_mode': 'cutoff', 'cutoff': 0.7114821901912797, 'grm_norm': 'cosine', 'self_loops': False, 'use_snp_selection': True, 'num_snps': 39664}. Best is trial 132 with value: 0.37916936401711226.
[I 2025-12-10 04:02:16,809] Trial 134 finished with value: 0.3701351932724054 and parameters: {'model_type': 'graphsage', 'hidden_dims': '[128, 64]', 'dropout': 0.11510543441529889, 'batch_norm': False, 'sage_aggr': 'mean', 'sage_normalize': False, 'sage_project': False, 'lr': 0.0001258285263111341, 'weight_decay': 1.1951849638347235e-07, 'epochs': 80, 'loss': 'mae', 'optimizer': 'adam', 'graph_mode': 'cutoff', 'cutoff': 0.5690290637066472, 'grm_norm': 'cosine', 'self_loops': False, 'use_snp_selection': True, 'num_snps': 31912}. Best is trial 132 with value: 0.37916936401711226.
[I 2025-12-10 04:02:36,824] Trial 135 finished with value: 0.37193398716870973 and parameters: {'model_type': 'graphsage', 'hidden_dims': '[128, 64]', 'dropout': 0.206008897356371, 'batch_norm': False, 'sage_aggr': 'mean', 'sage_normalize': False, 'sage_project': False, 'lr': 0.00022967581303901682, 'weight_decay': 1.5485337550083176e-07, 'epochs': 66, 'loss': 'mae', 'optimizer': 'adam', 'graph_mode': 'cutoff', 'cutoff': 0.6640779102933002, 'grm_norm': 'cosine', 'self_loops': False, 'use_snp_selection': True, 'num_snps': 33565}. Best is trial 132 with value: 0.37916936401711226.
[I 2025-12-10 04:02:54,374] Trial 136 finished with value: 0.32725621241565117 and parameters: {'model_type': 'graphsage', 'hidden_dims': '[128, 64]', 'dropout': 0.1927422026949661, 'batch_norm': False, 'sage_aggr': 'mean', 'sage_normalize': False, 'sage_project': False, 'lr': 0.00023612206416211414, 'weight_decay': 1.0008261105643814e-07, 'epochs': 40, 'loss': 'mae', 'optimizer': 'adam', 'graph_mode': 'cutoff', 'cutoff': 0.674724666754809, 'grm_norm': 'cosine', 'self_loops': False, 'use_snp_selection': True, 'num_snps': 33772}. Best is trial 132 with value: 0.37916936401711226.
[I 2025-12-10 04:03:18,516] Trial 137 finished with value: 0.3710292105571693 and parameters: {'model_type': 'graphsage', 'hidden_dims': '[256, 128, 64]', 'dropout': 0.205427920248521, 'batch_norm': False, 'sage_aggr': 'mean', 'sage_normalize': False, 'sage_project': False, 'lr': 0.0002093505358128271, 'weight_decay': 2.2662550011070577e-07, 'epochs': 67, 'loss': 'mae', 'optimizer': 'adam', 'graph_mode': 'cutoff', 'cutoff': 0.6190293095526904, 'grm_norm': 'cosine', 'self_loops': False, 'use_snp_selection': True, 'num_snps': 32509}. Best is trial 132 with value: 0.37916936401711226.
[I 2025-12-10 04:03:30,726] Trial 138 finished with value: 0.2778618743484801 and parameters: {'model_type': 'graphsage', 'hidden_dims': '[128, 64]', 'dropout': 0.22306644457691585, 'batch_norm': False, 'sage_aggr': 'mean', 'sage_normalize': False, 'sage_project': False, 'lr': 0.0002919274276774761, 'weight_decay': 1.5209902580200582e-07, 'epochs': 57, 'loss': 'mae', 'optimizer': 'adam', 'graph_mode': 'cutoff', 'cutoff': 0.671077490939979, 'grm_norm': 'cosine', 'self_loops': False, 'use_snp_selection': False}. Best is trial 132 with value: 0.37916936401711226.
[I 2025-12-10 04:03:54,012] Trial 139 finished with value: 0.3698101870180226 and parameters: {'model_type': 'graphsage', 'hidden_dims': '[128, 64]', 'dropout': 0.21525088745797064, 'batch_norm': False, 'sage_aggr': 'mean', 'sage_normalize': False, 'sage_project': False, 'lr': 0.00022809502051690384, 'weight_decay': 2.8829480704850213e-07, 'epochs': 72, 'loss': 'mae', 'optimizer': 'adam', 'graph_mode': 'cutoff', 'cutoff': 0.5573558999141613, 'grm_norm': 'cosine', 'self_loops': False, 'use_snp_selection': True, 'num_snps': 38138}. Best is trial 132 with value: 0.37916936401711226.
[I 2025-12-10 04:04:16,781] Trial 140 finished with value: 0.3306542561590493 and parameters: {'model_type': 'graphsage', 'hidden_dims': '[128, 64]', 'dropout': 0.16748531050263707, 'batch_norm': True, 'sage_aggr': 'mean', 'sage_normalize': False, 'sage_project': False, 'lr': 0.00015260842331647593, 'weight_decay': 1.841770180690275e-07, 'epochs': 84, 'loss': 'mae', 'optimizer': 'adam', 'graph_mode': 'cutoff', 'cutoff': 0.6597217470263859, 'grm_norm': 'cosine', 'self_loops': False, 'use_snp_selection': True, 'num_snps': 35521}. Best is trial 132 with value: 0.37916936401711226.
