[I 2025-12-09 13:59:44,903] Trial 80 finished with value: 0.2780823018176181 and parameters: {'model_type': 'graphsage', 'hidden_dims': '[256, 128, 64]', 'dropout': 0.5495370144687081, 'batch_norm': True, 'sage_aggr': 'mean', 'sage_normalize': False, 'sage_project': False, 'lr': 0.005901660460726123, 'weight_decay': 4.320423793044558e-05, 'epochs': 86, 'loss': 'mae', 'optimizer': 'adam', 'graph_mode': 'cutoff', 'cutoff': 0.8574695522092798, 'grm_norm': 'none', 'self_loops': True, 'use_snp_selection': True, 'num_snps': 12286}. Best is trial 42 with value: 0.2969538400699926.
[I 2025-12-09 14:00:39,688] Trial 81 finished with value: 0.29132475977786965 and parameters: {'model_type': 'graphsage', 'hidden_dims': '[256, 128]', 'dropout': 0.5243877400934233, 'batch_norm': True, 'sage_aggr': 'max', 'sage_normalize': False, 'sage_project': False, 'lr': 0.0019121102895587293, 'weight_decay': 4.421695678814786e-05, 'epochs': 53, 'loss': 'mae', 'optimizer': 'adam', 'graph_mode': 'cutoff', 'cutoff': 0.665004876473834, 'grm_norm': 'cosine', 'self_loops': True, 'use_snp_selection': True, 'num_snps': 53966}. Best is trial 42 with value: 0.2969538400699926.
[I 2025-12-09 14:01:33,590] Trial 82 finished with value: 0.28651756280914514 and parameters: {'model_type': 'graphsage', 'hidden_dims': '[256, 128]', 'dropout': 0.5167010301142796, 'batch_norm': True, 'sage_aggr': 'max', 'sage_normalize': False, 'sage_project': False, 'lr': 0.008028586219174426, 'weight_decay': 5.068348170316717e-05, 'epochs': 58, 'loss': 'mae', 'optimizer': 'adam', 'graph_mode': 'cutoff', 'cutoff': 0.7170162112649883, 'grm_norm': 'cosine', 'self_loops': True, 'use_snp_selection': True, 'num_snps': 49804}. Best is trial 42 with value: 0.2969538400699926.
[I 2025-12-09 14:02:25,638] Trial 83 finished with value: 0.28987732419614587 and parameters: {'model_type': 'graphsage', 'hidden_dims': '[256, 128]', 'dropout': 0.5394258686831355, 'batch_norm': True, 'sage_aggr': 'max', 'sage_normalize': False, 'sage_project': False, 'lr': 0.004179399755767656, 'weight_decay': 2.9213587249509237e-05, 'epochs': 41, 'loss': 'mae', 'optimizer': 'adam', 'graph_mode': 'cutoff', 'cutoff': 0.8150401075658644, 'grm_norm': 'cosine', 'self_loops': True, 'use_snp_selection': True, 'num_snps': 54525}. Best is trial 42 with value: 0.2969538400699926.
[I 2025-12-09 14:03:28,421] Trial 84 finished with value: 0.29050566132132594 and parameters: {'model_type': 'graphsage', 'hidden_dims': '[256, 128]', 'dropout': 0.5656667744631945, 'batch_norm': True, 'sage_aggr': 'max', 'sage_normalize': False, 'sage_project': False, 'lr': 0.0019507556229596081, 'weight_decay': 1.2855405237550193e-05, 'epochs': 68, 'loss': 'mae', 'optimizer': 'adam', 'graph_mode': 'cutoff', 'cutoff': 0.6393324042667908, 'grm_norm': 'cosine', 'self_loops': True, 'use_snp_selection': True, 'num_snps': 59885}. Best is trial 42 with value: 0.2969538400699926.
[I 2025-12-09 14:04:28,772] Trial 85 finished with value: 0.2867465900113937 and parameters: {'model_type': 'graphsage', 'hidden_dims': '[256, 128]', 'dropout': 0.49386239871025006, 'batch_norm': True, 'sage_aggr': 'max', 'sage_normalize': False, 'sage_project': False, 'lr': 0.006642910370066658, 'weight_decay': 1.9693058111082054e-05, 'epochs': 79, 'loss': 'mae', 'optimizer': 'adam', 'graph_mode': 'cutoff', 'cutoff': 0.5795164972843863, 'grm_norm': 'none', 'self_loops': True, 'use_snp_selection': True, 'num_snps': 51903}. Best is trial 42 with value: 0.2969538400699926.
[I 2025-12-09 14:05:54,621] Trial 86 finished with value: 0.08189060037722377 and parameters: {'model_type': 'graphsage', 'hidden_dims': '[256, 128, 64]', 'dropout': 0.2605105144993777, 'batch_norm': False, 'sage_aggr': 'max', 'sage_normalize': False, 'sage_project': False, 'lr': 0.0028304108078338755, 'weight_decay': 0.0003098575142412921, 'epochs': 159, 'loss': 'mae', 'optimizer': 'adam', 'graph_mode': 'cutoff', 'cutoff': 0.5726266958667501, 'grm_norm': 'none', 'self_loops': False, 'use_snp_selection': True, 'num_snps': 57076}. Best is trial 42 with value: 0.2969538400699926.
[I 2025-12-09 14:06:50,216] Trial 87 finished with value: 0.27728960390530777 and parameters: {'model_type': 'graphsage', 'hidden_dims': '[256, 128, 64]', 'dropout': 0.18084563464466819, 'batch_norm': True, 'sage_aggr': 'mean', 'sage_normalize': False, 'sage_project': False, 'lr': 0.0013843188327194267, 'weight_decay': 0.00011406033727824703, 'epochs': 56, 'loss': 'mse', 'optimizer': 'adam', 'graph_mode': 'cutoff', 'cutoff': 0.5029810995742285, 'grm_norm': 'cosine', 'self_loops': True, 'use_snp_selection': True, 'num_snps': 48227}. Best is trial 42 with value: 0.2969538400699926.
[I 2025-12-09 14:09:03,750] Trial 88 finished with value: 0.27749676258773 and parameters: {'model_type': 'graphsage', 'hidden_dims': '[512, 256]', 'dropout': 0.46190191667433156, 'batch_norm': True, 'sage_aggr': 'mean', 'sage_normalize': False, 'sage_project': False, 'lr': 0.008607736158882323, 'weight_decay': 7.237247987564964e-05, 'epochs': 297, 'loss': 'mae', 'optimizer': 'adam', 'graph_mode': 'cutoff', 'cutoff': 0.7027066254725334, 'grm_norm': 'none', 'self_loops': True, 'use_snp_selection': True, 'num_snps': 44511}. Best is trial 42 with value: 0.2969538400699926.
[I 2025-12-09 14:11:23,665] Trial 89 finished with value: 0.2763487131265679 and parameters: {'model_type': 'graphsage', 'hidden_dims': '[512, 128]', 'dropout': 0.5766456716616142, 'batch_norm': True, 'sage_aggr': 'mean', 'sage_normalize': False, 'sage_project': False, 'lr': 0.0025101454660502475, 'weight_decay': 0.00015895599639017486, 'epochs': 249, 'loss': 'mae', 'optimizer': 'adam', 'graph_mode': 'cutoff', 'cutoff': 0.8810983357343857, 'grm_norm': 'gcn', 'self_loops': True, 'use_snp_selection': True, 'num_snps': 55237}. Best is trial 42 with value: 0.2969538400699926.
[I 2025-12-09 14:12:16,572] Trial 90 finished with value: 0.294323936826706 and parameters: {'model_type': 'graphsage', 'hidden_dims': '[256, 128, 64]', 'dropout': 0.531783388993436, 'batch_norm': True, 'sage_aggr': 'mean', 'sage_normalize': False, 'sage_project': False, 'lr': 0.0038852192774022627, 'weight_decay': 3.239686515896092e-05, 'epochs': 49, 'loss': 'mae', 'optimizer': 'adam', 'graph_mode': 'cutoff', 'cutoff': 0.7676094103894875, 'grm_norm': 'none', 'self_loops': True, 'use_snp_selection': True, 'num_snps': 52825}. Best is trial 42 with value: 0.2969538400699926.
[I 2025-12-09 14:13:12,305] Trial 91 finished with value: 0.2902650729767281 and parameters: {'model_type': 'graphsage', 'hidden_dims': '[256, 128, 64]', 'dropout': 0.5318848382322824, 'batch_norm': True, 'sage_aggr': 'mean', 'sage_normalize': False, 'sage_project': False, 'lr': 0.00388870082670253, 'weight_decay': 3.0223733010769143e-05, 'epochs': 49, 'loss': 'mae', 'optimizer': 'adam', 'graph_mode': 'cutoff', 'cutoff': 0.8355410287120025, 'grm_norm': 'none', 'self_loops': True, 'use_snp_selection': True, 'num_snps': 58424}. Best is trial 42 with value: 0.2969538400699926.
[I 2025-12-09 14:14:08,666] Trial 92 finished with value: 0.29519695335357865 and parameters: {'model_type': 'graphsage', 'hidden_dims': '[256, 128, 64]', 'dropout': 0.5552207773358253, 'batch_norm': True, 'sage_aggr': 'mean', 'sage_normalize': False, 'sage_project': False, 'lr': 0.004760470582844238, 'weight_decay': 4.1809779435416273e-05, 'epochs': 63, 'loss': 'mae', 'optimizer': 'adam', 'graph_mode': 'cutoff', 'cutoff': 0.660980841965054, 'grm_norm': 'none', 'self_loops': True, 'use_snp_selection': True, 'num_snps': 53343}. Best is trial 42 with value: 0.2969538400699926.
[I 2025-12-09 14:15:04,921] Trial 93 finished with value: 0.2849121475461339 and parameters: {'model_type': 'graphsage', 'hidden_dims': '[256, 128, 64]', 'dropout': 0.5481195791966785, 'batch_norm': True, 'sage_aggr': 'mean', 'sage_normalize': False, 'sage_project': False, 'lr': 0.0047674500647311045, 'weight_decay': 9.143422698723312e-05, 'epochs': 66, 'loss': 'mae', 'optimizer': 'adam', 'graph_mode': 'cutoff', 'cutoff': 0.7895928245378262, 'grm_norm': 'none', 'self_loops': True, 'use_snp_selection': True, 'num_snps': 51729}. Best is trial 42 with value: 0.2969538400699926.
[I 2025-12-09 14:16:01,001] Trial 94 finished with value: 0.2921224829449474 and parameters: {'model_type': 'graphsage', 'hidden_dims': '[256, 128, 64]', 'dropout': 0.565540271662126, 'batch_norm': True, 'sage_aggr': 'mean', 'sage_normalize': False, 'sage_project': False, 'lr': 0.006006574189684209, 'weight_decay': 1.5845652580127877e-05, 'epochs': 71, 'loss': 'mae', 'optimizer': 'adam', 'graph_mode': 'cutoff', 'cutoff': 0.8537637488863161, 'grm_norm': 'none', 'self_loops': True, 'use_snp_selection': True, 'num_snps': 49811}. Best is trial 42 with value: 0.2969538400699926.
[I 2025-12-09 14:17:04,593] Trial 95 finished with value: 0.29380682602002334 and parameters: {'model_type': 'graphsage', 'hidden_dims': '[256, 128, 64]', 'dropout': 0.5623690674564519, 'batch_norm': True, 'sage_aggr': 'mean', 'sage_normalize': False, 'sage_project': False, 'lr': 0.005826421261530911, 'weight_decay': 1.6408269615715007e-05, 'epochs': 87, 'loss': 'mae', 'optimizer': 'adam', 'graph_mode': 'cutoff', 'cutoff': 0.7696534653614038, 'grm_norm': 'none', 'self_loops': True, 'use_snp_selection': True, 'num_snps': 56404}. Best is trial 42 with value: 0.2969538400699926.
[I 2025-12-09 14:18:03,148] Trial 96 finished with value: 0.2917039095012363 and parameters: {'model_type': 'graphsage', 'hidden_dims': '[256, 128, 64]', 'dropout': 0.5615381315583127, 'batch_norm': True, 'sage_aggr': 'mean', 'sage_normalize': False, 'sage_project': False, 'lr': 0.003223699031100104, 'weight_decay': 1.0435619366121558e-05, 'epochs': 86, 'loss': 'mae', 'optimizer': 'adam', 'graph_mode': 'cutoff', 'cutoff': 0.765387022047802, 'grm_norm': 'none', 'self_loops': True, 'use_snp_selection': True, 'num_snps': 49079}. Best is trial 42 with value: 0.2969538400699926.
[I 2025-12-09 14:21:05,828] Trial 97 finished with value: 0.271330164031352 and parameters: {'model_type': 'graphsage', 'hidden_dims': '[256, 128, 64]', 'dropout': 0.5967518461733263, 'batch_norm': True, 'sage_aggr': 'mean', 'sage_normalize': True, 'sage_project': False, 'lr': 0.005238196262705853, 'weight_decay': 1.532026595813762e-05, 'epochs': 129, 'loss': 'mae', 'optimizer': 'adam', 'graph_mode': 'knn', 'knn_k': 8, 'weighted_edges': False, 'symmetrize_mode': 'union', 'self_loops': True, 'use_snp_selection': True, 'num_snps': 52892}. Best is trial 42 with value: 0.2969538400699926.
[I 2025-12-09 14:21:38,268] Trial 98 finished with value: 0.29330890826464995 and parameters: {'model_type': 'graphsage', 'hidden_dims': '[256, 128, 64]', 'dropout': 0.5804517251569425, 'batch_norm': True, 'sage_aggr': 'mean', 'sage_normalize': False, 'sage_project': False, 'lr': 0.006837969791740686, 'weight_decay': 7.45570408160965e-06, 'epochs': 95, 'loss': 'mae', 'optimizer': 'adam', 'graph_mode': 'cutoff', 'cutoff': 0.7026494966624641, 'grm_norm': 'none', 'self_loops': True, 'use_snp_selection': False}. Best is trial 42 with value: 0.2969538400699926.
[I 2025-12-09 14:22:05,422] Trial 99 finished with value: 0.2854770747086197 and parameters: {'model_type': 'graphsage', 'hidden_dims': '[256, 128, 64]', 'dropout': 0.5687261386373765, 'batch_norm': True, 'sage_aggr': 'mean', 'sage_normalize': False, 'sage_project': False, 'lr': 0.007434979267843564, 'weight_decay': 4.727477094591573e-06, 'epochs': 72, 'loss': 'mae', 'optimizer': 'adam', 'graph_mode': 'cutoff', 'cutoff': 0.7489994154909555, 'grm_norm': 'none', 'self_loops': True, 'use_snp_selection': False}. Best is trial 42 with value: 0.2969538400699926.
[I 2025-12-09 14:22:38,255] Trial 100 finished with value: 0.0020613289663540496 and parameters: {'model_type': 'graphsage', 'hidden_dims': '[256, 128, 64]', 'dropout': 0.5812423411799549, 'batch_norm': False, 'sage_aggr': 'mean', 'sage_normalize': False, 'sage_project': False, 'lr': 0.004492566789223613, 'weight_decay': 7.27134739470714e-06, 'epochs': 100, 'loss': 'mae', 'optimizer': 'adam', 'graph_mode': 'cutoff', 'cutoff': 0.7033953008617235, 'grm_norm': 'none', 'self_loops': False, 'use_snp_selection': False}. Best is trial 42 with value: 0.2969538400699926.
[I 2025-12-09 14:23:10,697] Trial 101 finished with value: 0.291500964232111 and parameters: {'model_type': 'graphsage', 'hidden_dims': '[256, 128, 64]', 'dropout': 0.5597703587703121, 'batch_norm': True, 'sage_aggr': 'mean', 'sage_normalize': False, 'sage_project': False, 'lr': 0.006348381619343442, 'weight_decay': 1.7332736992547637e-05, 'epochs': 94, 'loss': 'mae', 'optimizer': 'adam', 'graph_mode': 'cutoff', 'cutoff': 0.6424898496904763, 'grm_norm': 'none', 'self_loops': True, 'use_snp_selection': False}. Best is trial 42 with value: 0.2969538400699926.
[I 2025-12-09 14:23:40,083] Trial 102 finished with value: 0.289025570251052 and parameters: {'model_type': 'graphsage', 'hidden_dims': '[256, 128, 64]', 'dropout': 0.5886018314224134, 'batch_norm': True, 'sage_aggr': 'mean', 'sage_normalize': False, 'sage_project': False, 'lr': 0.00556354147154178, 'weight_decay': 5.687815983123101e-06, 'epochs': 80, 'loss': 'mae', 'optimizer': 'adam', 'graph_mode': 'cutoff', 'cutoff': 0.6906759645018746, 'grm_norm': 'none', 'self_loops': True, 'use_snp_selection': False}. Best is trial 42 with value: 0.2969538400699926.
[I 2025-12-09 14:24:11,131] Trial 103 finished with value: 0.28951079258963297 and parameters: {'model_type': 'graphsage', 'hidden_dims': '[256, 128, 64]', 'dropout': 0.5426770755208757, 'batch_norm': True, 'sage_aggr': 'mean', 'sage_normalize': False, 'sage_project': False, 'lr': 0.0035581113730119985, 'weight_decay': 8.319017954230772e-06, 'epochs': 88, 'loss': 'mae', 'optimizer': 'adam', 'graph_mode': 'cutoff', 'cutoff': 0.7277557466969455, 'grm_norm': 'none', 'self_loops': True, 'use_snp_selection': False}. Best is trial 42 with value: 0.2969538400699926.
[I 2025-12-09 14:25:21,639] Trial 104 finished with value: 0.29289208979768777 and parameters: {'model_type': 'graphsage', 'hidden_dims': '[256, 128, 64]', 'dropout': 0.5731299110031753, 'batch_norm': True, 'sage_aggr': 'mean', 'sage_normalize': False, 'sage_project': False, 'lr': 0.007019748241129194, 'weight_decay': 2.3771142367575008e-05, 'epochs': 112, 'loss': 'mae', 'optimizer': 'adam', 'graph_mode': 'cutoff', 'cutoff': 0.6681311318796602, 'grm_norm': 'none', 'self_loops': True, 'use_snp_selection': True, 'num_snps': 56145}. Best is trial 42 with value: 0.2969538400699926.
[I 2025-12-09 14:26:07,922] Trial 105 finished with value: 0.2897683217859591 and parameters: {'model_type': 'graphsage', 'hidden_dims': '[256, 128, 64]', 'dropout': 0.5747627384402887, 'batch_norm': True, 'sage_aggr': 'mean', 'sage_normalize': False, 'sage_project': False, 'lr': 0.007390895527001206, 'weight_decay': 2.4285640235228943e-05, 'epochs': 114, 'loss': 'mae', 'optimizer': 'adam', 'graph_mode': 'cutoff', 'cutoff': 0.7982438167516783, 'grm_norm': 'none', 'self_loops': True, 'use_snp_selection': True, 'num_snps': 26970}. Best is trial 42 with value: 0.2969538400699926.
[I 2025-12-09 14:27:18,346] Trial 106 finished with value: 0.2888151648332578 and parameters: {'model_type': 'graphsage', 'hidden_dims': '[256, 128, 64]', 'dropout': 0.5989045670158475, 'batch_norm': True, 'sage_aggr': 'mean', 'sage_normalize': False, 'sage_project': False, 'lr': 0.008769570709528877, 'weight_decay': 2.2203562828096277e-05, 'epochs': 107, 'loss': 'mae', 'optimizer': 'adam', 'graph_mode': 'cutoff', 'cutoff': 0.8584207582299785, 'grm_norm': 'cosine_then_gcn', 'self_loops': True, 'use_snp_selection': True, 'num_snps': 56282}. Best is trial 42 with value: 0.2969538400699926.
[I 2025-12-09 14:27:42,960] Trial 107 finished with value: 0.2923636010361893 and parameters: {'model_type': 'graphsage', 'hidden_dims': '[256, 128, 64]', 'dropout': 0.5861938991280164, 'batch_norm': True, 'sage_aggr': 'mean', 'sage_normalize': False, 'sage_project': False, 'lr': 0.004588265916395721, 'weight_decay': 9.125598727775068e-06, 'epochs': 61, 'loss': 'mse', 'optimizer': 'adam', 'graph_mode': 'cutoff', 'cutoff': 0.7747419140432843, 'grm_norm': 'none', 'self_loops': True, 'use_snp_selection': False}. Best is trial 42 with value: 0.2969538400699926.
[I 2025-12-09 14:28:07,630] Trial 108 finished with value: 0.29471774505155696 and parameters: {'model_type': 'graphsage', 'hidden_dims': '[256, 128, 64]', 'dropout': 0.5828909618573825, 'batch_norm': True, 'sage_aggr': 'mean', 'sage_normalize': False, 'sage_project': False, 'lr': 0.004693865173765673, 'weight_decay': 5.97699559953803e-06, 'epochs': 62, 'loss': 'mse', 'optimizer': 'adam', 'graph_mode': 'cutoff', 'cutoff': 0.7728869446896807, 'grm_norm': 'none', 'self_loops': True, 'use_snp_selection': False}. Best is trial 42 with value: 0.2969538400699926.
[I 2025-12-09 14:28:28,688] Trial 109 finished with value: 0.2896614073548613 and parameters: {'model_type': 'graphsage', 'hidden_dims': '[256, 128, 64]', 'dropout': 0.5867360000359747, 'batch_norm': True, 'sage_aggr': 'mean', 'sage_normalize': False, 'sage_project': False, 'lr': 0.004192593275614712, 'weight_decay': 6.270230902124688e-06, 'epochs': 46, 'loss': 'mse', 'optimizer': 'adam', 'graph_mode': 'cutoff', 'cutoff': 0.7423515549522892, 'grm_norm': 'none', 'self_loops': True, 'use_snp_selection': False}. Best is trial 42 with value: 0.2969538400699926.
[I 2025-12-09 14:28:52,695] Trial 110 finished with value: 0.2898573602855299 and parameters: {'model_type': 'graphsage', 'hidden_dims': '[256, 128, 64]', 'dropout': 0.5774789348319453, 'batch_norm': True, 'sage_aggr': 'mean', 'sage_normalize': False, 'sage_project': False, 'lr': 0.00011375737421118034, 'weight_decay': 9.157874369515809e-06, 'epochs': 59, 'loss': 'mse', 'optimizer': 'adam', 'graph_mode': 'cutoff', 'cutoff': 0.7680711867897102, 'grm_norm': 'none', 'self_loops': True, 'use_snp_selection': False}. Best is trial 42 with value: 0.2969538400699926.
[I 2025-12-09 14:29:17,732] Trial 111 finished with value: 0.29619904087841264 and parameters: {'model_type': 'graphsage', 'hidden_dims': '[256, 128, 64]', 'dropout': 0.556342581571838, 'batch_norm': True, 'sage_aggr': 'mean', 'sage_normalize': False, 'sage_project': False, 'lr': 0.004606210974742103, 'weight_decay': 3.7015418147526353e-06, 'epochs': 63, 'loss': 'mse', 'optimizer': 'adam', 'graph_mode': 'cutoff', 'cutoff': 0.6754921270900396, 'grm_norm': 'none', 'self_loops': True, 'use_snp_selection': False}. Best is trial 42 with value: 0.2969538400699926.
[I 2025-12-09 14:29:42,775] Trial 112 finished with value: 0.2818648783300862 and parameters: {'model_type': 'graphsage', 'hidden_dims': '[256, 128, 64]', 'dropout': 0.37480808776950114, 'batch_norm': True, 'sage_aggr': 'mean', 'sage_normalize': False, 'sage_project': False, 'lr': 0.0030640697569918017, 'weight_decay': 1.964212422181048e-06, 'epochs': 63, 'loss': 'mse', 'optimizer': 'adam', 'graph_mode': 'cutoff', 'cutoff': 0.6673350095691061, 'grm_norm': 'none', 'self_loops': True, 'use_snp_selection': False}. Best is trial 42 with value: 0.2969538400699926.
[I 2025-12-09 14:30:11,557] Trial 113 finished with value: 0.2828375669144846 and parameters: {'model_type': 'graphsage', 'hidden_dims': '[256, 128, 64]', 'dropout': 0.5584487694281475, 'batch_norm': True, 'sage_aggr': 'mean', 'sage_normalize': False, 'sage_project': False, 'lr': 2.0680943917749785e-05, 'weight_decay': 3.5074076588530292e-06, 'epochs': 79, 'loss': 'mse', 'optimizer': 'adam', 'graph_mode': 'cutoff', 'cutoff': 0.6790807226869701, 'grm_norm': 'none', 'self_loops': True, 'use_snp_selection': False}. Best is trial 42 with value: 0.2969538400699926.
[I 2025-12-09 14:30:36,660] Trial 114 finished with value: 0.2903536792347673 and parameters: {'model_type': 'graphsage', 'hidden_dims': '[256, 128, 64]', 'dropout': 0.5885929824923669, 'batch_norm': True, 'sage_aggr': 'mean', 'sage_normalize': False, 'sage_project': False, 'lr': 0.00034832773544814883, 'weight_decay': 3.4325772669906045e-06, 'epochs': 63, 'loss': 'mse', 'optimizer': 'adam', 'graph_mode': 'cutoff', 'cutoff': 0.7021239576976751, 'grm_norm': 'none', 'self_loops': True, 'use_snp_selection': False}. Best is trial 42 with value: 0.2969538400699926.
[I 2025-12-09 14:30:58,441] Trial 115 finished with value: 0.29043947946787024 and parameters: {'model_type': 'graphsage', 'hidden_dims': '[256, 128, 64]', 'dropout': 0.5704743509510329, 'batch_norm': True, 'sage_aggr': 'mean', 'sage_normalize': False, 'sage_project': False, 'lr': 0.006676220825537942, 'weight_decay': 2.7162913541615456e-06, 'epochs': 48, 'loss': 'mse', 'optimizer': 'adam', 'graph_mode': 'cutoff', 'cutoff': 0.6159438427207842, 'grm_norm': 'none', 'self_loops': True, 'use_snp_selection': False}. Best is trial 42 with value: 0.2969538400699926.
[I 2025-12-09 14:31:31,513] Trial 116 finished with value: 0.281414426701446 and parameters: {'model_type': 'graphsage', 'hidden_dims': '[256, 128, 64]', 'dropout': 0.537765520028494, 'batch_norm': True, 'sage_aggr': 'mean', 'sage_normalize': True, 'sage_project': False, 'lr': 0.0023299421708203754, 'weight_decay': 1.1929921498444767e-05, 'epochs': 97, 'loss': 'mse', 'optimizer': 'adam', 'graph_mode': 'cutoff', 'cutoff': 0.7279136753781891, 'grm_norm': 'none', 'self_loops': True, 'use_snp_selection': False}. Best is trial 42 with value: 0.2969538400699926.
[I 2025-12-09 14:32:23,537] Trial 117 finished with value: 0.2574549427287757 and parameters: {'model_type': 'graphsage', 'hidden_dims': '[256, 128, 64]', 'dropout': 0.5996511378457349, 'batch_norm': True, 'sage_aggr': 'mean', 'sage_normalize': False, 'sage_project': False, 'lr': 4.1823128978305184e-05, 'weight_decay': 9.73432856291854e-06, 'epochs': 56, 'loss': 'mse', 'optimizer': 'adam', 'graph_mode': 'knn', 'knn_k': 10, 'weighted_edges': False, 'symmetrize_mode': 'union', 'self_loops': True, 'use_snp_selection': False}. Best is trial 42 with value: 0.2969538400699926.
