[I 2025-12-09 05:28:32,308] Trial 110 finished with value: 0.3744171772782794 and parameters: {'model_type': 'graphsage', 'hidden_dims': '[512, 256]', 'dropout': 0.12397121659020593, 'batch_norm': False, 'sage_aggr': 'max', 'sage_normalize': False, 'sage_project': False, 'lr': 7.329306338730614e-05, 'weight_decay': 2.857841041419726e-06, 'epochs': 189, 'loss': 'mae', 'optimizer': 'adam', 'graph_mode': 'knn', 'knn_k': 6, 'weighted_edges': True, 'symmetrize_mode': 'union', 'self_loops': True, 'use_snp_selection': True, 'num_snps': 45798}. Best is trial 72 with value: 0.38017846584785514.
[I 2025-12-09 05:31:36,777] Trial 111 finished with value: 0.37417507481196655 and parameters: {'model_type': 'graphsage', 'hidden_dims': '[512, 256]', 'dropout': 0.15476253290300873, 'batch_norm': False, 'sage_aggr': 'max', 'sage_normalize': False, 'sage_project': False, 'lr': 4.372079226620889e-05, 'weight_decay': 2.175716753651606e-06, 'epochs': 224, 'loss': 'mae', 'optimizer': 'adam', 'graph_mode': 'knn', 'knn_k': 5, 'weighted_edges': False, 'symmetrize_mode': 'union', 'self_loops': True, 'use_snp_selection': True, 'num_snps': 43348}. Best is trial 72 with value: 0.38017846584785514.
[I 2025-12-09 05:34:19,325] Trial 112 finished with value: 0.3820700771316968 and parameters: {'model_type': 'graphsage', 'hidden_dims': '[512, 256]', 'dropout': 0.17560458831184877, 'batch_norm': False, 'sage_aggr': 'max', 'sage_normalize': False, 'sage_project': False, 'lr': 5.8128107795747456e-05, 'weight_decay': 1.2058304873006655e-06, 'epochs': 198, 'loss': 'mae', 'optimizer': 'adam', 'graph_mode': 'knn', 'knn_k': 6, 'weighted_edges': False, 'symmetrize_mode': 'union', 'self_loops': True, 'use_snp_selection': True, 'num_snps': 38515}. Best is trial 112 with value: 0.3820700771316968.
[I 2025-12-09 05:36:48,891] Trial 113 finished with value: 0.3804410540645831 and parameters: {'model_type': 'graphsage', 'hidden_dims': '[512, 256]', 'dropout': 0.11341403000000651, 'batch_norm': False, 'sage_aggr': 'max', 'sage_normalize': False, 'sage_project': False, 'lr': 5.5628411632555756e-05, 'weight_decay': 8.058523357759131e-07, 'epochs': 181, 'loss': 'mae', 'optimizer': 'adam', 'graph_mode': 'knn', 'knn_k': 6, 'weighted_edges': False, 'symmetrize_mode': 'union', 'self_loops': True, 'use_snp_selection': True, 'num_snps': 38542}. Best is trial 112 with value: 0.3820700771316968.
[I 2025-12-09 05:39:08,340] Trial 114 finished with value: 0.37128788192564033 and parameters: {'model_type': 'graphsage', 'hidden_dims': '[512, 256]', 'dropout': 0.1357772517879141, 'batch_norm': False, 'sage_aggr': 'max', 'sage_normalize': False, 'sage_project': False, 'lr': 5.992797099833737e-05, 'weight_decay': 6.527879542143994e-07, 'epochs': 166, 'loss': 'mae', 'optimizer': 'adam', 'graph_mode': 'knn', 'knn_k': 6, 'weighted_edges': False, 'symmetrize_mode': 'union', 'self_loops': True, 'use_snp_selection': True, 'num_snps': 38564}. Best is trial 112 with value: 0.3820700771316968.
[I 2025-12-09 05:41:33,216] Trial 115 finished with value: 0.37380462671517595 and parameters: {'model_type': 'graphsage', 'hidden_dims': '[512, 256]', 'dropout': 0.10839559603380981, 'batch_norm': False, 'sage_aggr': 'max', 'sage_normalize': False, 'sage_project': False, 'lr': 5.152738548523374e-05, 'weight_decay': 9.020313817158134e-07, 'epochs': 181, 'loss': 'mae', 'optimizer': 'adam', 'graph_mode': 'knn', 'knn_k': 6, 'weighted_edges': False, 'symmetrize_mode': 'union', 'self_loops': True, 'use_snp_selection': True, 'num_snps': 37152}. Best is trial 112 with value: 0.3820700771316968.
[I 2025-12-09 05:43:54,047] Trial 116 finished with value: 0.3547200285872805 and parameters: {'model_type': 'graphsage', 'hidden_dims': '[512, 256]', 'dropout': 0.12314498420008951, 'batch_norm': False, 'sage_aggr': 'max', 'sage_normalize': True, 'sage_project': False, 'lr': 8.780439821638646e-05, 'weight_decay': 1.5154869664687096e-06, 'epochs': 201, 'loss': 'mae', 'optimizer': 'adam', 'graph_mode': 'knn', 'knn_k': 6, 'weighted_edges': False, 'symmetrize_mode': 'union', 'self_loops': True, 'use_snp_selection': True, 'num_snps': 32043}. Best is trial 112 with value: 0.3820700771316968.
[I 2025-12-09 05:46:26,228] Trial 117 finished with value: 0.32616806159335765 and parameters: {'model_type': 'graphsage', 'hidden_dims': '[512, 256]', 'dropout': 0.505598575222589, 'batch_norm': True, 'sage_aggr': 'max', 'sage_normalize': False, 'sage_project': False, 'lr': 6.912480940953995e-05, 'weight_decay': 1.9461219264935621e-07, 'epochs': 196, 'loss': 'mae', 'optimizer': 'adam', 'graph_mode': 'knn', 'knn_k': 6, 'weighted_edges': False, 'symmetrize_mode': 'union', 'self_loops': True, 'use_snp_selection': True, 'num_snps': 36104}. Best is trial 112 with value: 0.3820700771316968.
[I 2025-12-09 05:47:00,437] Trial 118 finished with value: 0.34308262249588434 and parameters: {'model_type': 'graphsage', 'hidden_dims': '[512, 256]', 'dropout': 0.1000294351139946, 'batch_norm': False, 'sage_aggr': 'max', 'sage_normalize': False, 'sage_project': False, 'lr': 6.0546766251320464e-05, 'weight_decay': 1.2268345617212875e-06, 'epochs': 176, 'loss': 'mae', 'optimizer': 'adam', 'graph_mode': 'knn', 'knn_k': 6, 'weighted_edges': False, 'symmetrize_mode': 'union', 'self_loops': True, 'use_snp_selection': True, 'num_snps': 2342}. Best is trial 112 with value: 0.3820700771316968.
[I 2025-12-09 05:49:04,915] Trial 119 finished with value: 0.3381247194415148 and parameters: {'model_type': 'graphsage', 'hidden_dims': '[512, 256]', 'dropout': 0.3508901759439783, 'batch_norm': False, 'sage_aggr': 'max', 'sage_normalize': False, 'sage_project': False, 'lr': 0.00010123834546556339, 'weight_decay': 4.0983992366649127e-07, 'epochs': 148, 'loss': 'mae', 'optimizer': 'adam', 'graph_mode': 'knn', 'knn_k': 5, 'weighted_edges': False, 'symmetrize_mode': 'union', 'self_loops': True, 'use_snp_selection': True, 'num_snps': 41143}. Best is trial 112 with value: 0.3820700771316968.
[I 2025-12-09 05:51:58,112] Trial 120 finished with value: 0.3785189461497761 and parameters: {'model_type': 'graphsage', 'hidden_dims': '[512, 256]', 'dropout': 0.11547726159427567, 'batch_norm': False, 'sage_aggr': 'max', 'sage_normalize': False, 'sage_project': False, 'lr': 3.958438663114598e-05, 'weight_decay': 3.02408185747199e-06, 'epochs': 205, 'loss': 'mae', 'optimizer': 'adam', 'graph_mode': 'knn', 'knn_k': 6, 'weighted_edges': False, 'symmetrize_mode': 'union', 'self_loops': True, 'use_snp_selection': True, 'num_snps': 38954}. Best is trial 112 with value: 0.3820700771316968.
[I 2025-12-09 05:54:52,061] Trial 121 finished with value: 0.38210278205127163 and parameters: {'model_type': 'graphsage', 'hidden_dims': '[512, 256]', 'dropout': 0.11492766601400164, 'batch_norm': False, 'sage_aggr': 'max', 'sage_normalize': False, 'sage_project': False, 'lr': 4.091181020134148e-05, 'weight_decay': 1.0612090922474046e-06, 'epochs': 206, 'loss': 'mae', 'optimizer': 'adam', 'graph_mode': 'knn', 'knn_k': 6, 'weighted_edges': False, 'symmetrize_mode': 'union', 'self_loops': True, 'use_snp_selection': True, 'num_snps': 39312}. Best is trial 121 with value: 0.38210278205127163.
[I 2025-12-09 05:57:32,459] Trial 122 finished with value: 0.37734265350542723 and parameters: {'model_type': 'graphsage', 'hidden_dims': '[512, 256]', 'dropout': 0.11130160405156633, 'batch_norm': False, 'sage_aggr': 'max', 'sage_normalize': False, 'sage_project': False, 'lr': 3.936709129156949e-05, 'weight_decay': 9.924915400022305e-07, 'epochs': 201, 'loss': 'mae', 'optimizer': 'adam', 'graph_mode': 'knn', 'knn_k': 6, 'weighted_edges': False, 'symmetrize_mode': 'union', 'self_loops': True, 'use_snp_selection': True, 'num_snps': 37907}. Best is trial 121 with value: 0.38210278205127163.
[I 2025-12-09 06:00:15,241] Trial 123 finished with value: 0.37326437019318365 and parameters: {'model_type': 'graphsage', 'hidden_dims': '[512, 256]', 'dropout': 0.11388839026069238, 'batch_norm': False, 'sage_aggr': 'max', 'sage_normalize': False, 'sage_project': False, 'lr': 2.8052607302088787e-05, 'weight_decay': 8.804507412798954e-07, 'epochs': 201, 'loss': 'mae', 'optimizer': 'adam', 'graph_mode': 'knn', 'knn_k': 6, 'weighted_edges': False, 'symmetrize_mode': 'union', 'self_loops': True, 'use_snp_selection': True, 'num_snps': 38110}. Best is trial 121 with value: 0.38210278205127163.
[I 2025-12-09 06:02:58,865] Trial 124 finished with value: 0.3738243910241031 and parameters: {'model_type': 'graphsage', 'hidden_dims': '[512, 256]', 'dropout': 0.10961166835160902, 'batch_norm': False, 'sage_aggr': 'max', 'sage_normalize': False, 'sage_project': False, 'lr': 3.463194786326358e-05, 'weight_decay': 1.0480038143642619e-06, 'epochs': 211, 'loss': 'mae', 'optimizer': 'adam', 'graph_mode': 'knn', 'knn_k': 7, 'weighted_edges': False, 'symmetrize_mode': 'union', 'self_loops': True, 'use_snp_selection': True, 'num_snps': 35506}. Best is trial 121 with value: 0.38210278205127163.
[I 2025-12-09 06:05:22,546] Trial 125 finished with value: 0.36839748615744844 and parameters: {'model_type': 'graphsage', 'hidden_dims': '[256, 128]', 'dropout': 0.12836276668957927, 'batch_norm': False, 'sage_aggr': 'max', 'sage_normalize': False, 'sage_project': False, 'lr': 4.1292685735165554e-05, 'weight_decay': 3.9581991876250814e-07, 'epochs': 184, 'loss': 'mae', 'optimizer': 'adam', 'graph_mode': 'knn', 'knn_k': 6, 'weighted_edges': False, 'symmetrize_mode': 'union', 'self_loops': True, 'use_snp_selection': True, 'num_snps': 40097}. Best is trial 121 with value: 0.38210278205127163.
[I 2025-12-09 06:08:03,015] Trial 126 finished with value: 0.3696435416870398 and parameters: {'model_type': 'graphsage', 'hidden_dims': '[512, 256]', 'dropout': 0.10029511544049739, 'batch_norm': False, 'sage_aggr': 'max', 'sage_normalize': False, 'sage_project': False, 'lr': 5.024267573866332e-05, 'weight_decay': 5.307019343228792e-07, 'epochs': 192, 'loss': 'mae', 'optimizer': 'adam', 'graph_mode': 'knn', 'knn_k': 6, 'weighted_edges': False, 'symmetrize_mode': 'union', 'self_loops': True, 'use_snp_selection': True, 'num_snps': 38856}. Best is trial 121 with value: 0.38210278205127163.
[I 2025-12-09 06:10:03,664] Trial 127 finished with value: 0.36504222194367797 and parameters: {'model_type': 'graphsage', 'hidden_dims': '[512, 256]', 'dropout': 0.14629985479704788, 'batch_norm': False, 'sage_aggr': 'max', 'sage_normalize': False, 'sage_project': False, 'lr': 3.774343938068187e-05, 'weight_decay': 6.448038202990051e-07, 'epochs': 215, 'loss': 'mae', 'optimizer': 'adam', 'graph_mode': 'knn', 'knn_k': 7, 'weighted_edges': False, 'symmetrize_mode': 'mutual', 'self_loops': True, 'use_snp_selection': True, 'num_snps': 34363}. Best is trial 121 with value: 0.38210278205127163.
[I 2025-12-09 06:12:44,006] Trial 128 finished with value: 0.3702066520671138 and parameters: {'model_type': 'graphsage', 'hidden_dims': '[512, 256]', 'dropout': 0.11844870452532746, 'batch_norm': False, 'sage_aggr': 'max', 'sage_normalize': False, 'sage_project': False, 'lr': 5.4426149855046446e-05, 'weight_decay': 1.521972047967773e-06, 'epochs': 169, 'loss': 'mae', 'optimizer': 'adam', 'graph_mode': 'knn', 'knn_k': 6, 'weighted_edges': False, 'symmetrize_mode': 'union', 'self_loops': True, 'use_snp_selection': True, 'num_snps': 42331}. Best is trial 121 with value: 0.38210278205127163.
[I 2025-12-09 06:14:35,218] Trial 129 finished with value: 0.3709684061426339 and parameters: {'model_type': 'graphsage', 'hidden_dims': '[128, 64]', 'dropout': 0.11700398766142649, 'batch_norm': False, 'sage_aggr': 'mean', 'sage_normalize': False, 'sage_project': False, 'lr': 2.3315738590264665e-05, 'weight_decay': 1.1009188984742938e-06, 'epochs': 207, 'loss': 'mse', 'optimizer': 'adam', 'graph_mode': 'knn', 'knn_k': 6, 'weighted_edges': False, 'symmetrize_mode': 'union', 'self_loops': True, 'use_snp_selection': True, 'num_snps': 33676}. Best is trial 121 with value: 0.38210278205127163.
[I 2025-12-09 06:17:15,393] Trial 130 finished with value: 0.3752799014823946 and parameters: {'model_type': 'graphsage', 'hidden_dims': '[512, 256]', 'dropout': 0.12670682405053135, 'batch_norm': False, 'sage_aggr': 'max', 'sage_normalize': False, 'sage_project': False, 'lr': 4.5705477273277794e-05, 'weight_decay': 2.6143634919585255e-06, 'epochs': 201, 'loss': 'mae', 'optimizer': 'adam', 'graph_mode': 'knn', 'knn_k': 5, 'weighted_edges': False, 'symmetrize_mode': 'union', 'self_loops': True, 'use_snp_selection': True, 'num_snps': 40452}. Best is trial 121 with value: 0.38210278205127163.
[I 2025-12-09 06:19:44,931] Trial 131 finished with value: 0.37405261851418947 and parameters: {'model_type': 'graphsage', 'hidden_dims': '[512, 256]', 'dropout': 0.13958779125357945, 'batch_norm': False, 'sage_aggr': 'max', 'sage_normalize': False, 'sage_project': False, 'lr': 6.864934388190196e-05, 'weight_decay': 1.7886930505799852e-06, 'epochs': 205, 'loss': 'mae', 'optimizer': 'adam', 'graph_mode': 'knn', 'knn_k': 5, 'weighted_edges': False, 'symmetrize_mode': 'union', 'self_loops': True, 'use_snp_selection': True, 'num_snps': 38557}. Best is trial 121 with value: 0.38210278205127163.
[I 2025-12-09 06:22:42,853] Trial 132 finished with value: 0.37449150523662283 and parameters: {'model_type': 'graphsage', 'hidden_dims': '[512, 256]', 'dropout': 0.14699878282668627, 'batch_norm': False, 'sage_aggr': 'max', 'sage_normalize': False, 'sage_project': False, 'lr': 3.99813606203992e-05, 'weight_decay': 3.407895791397297e-06, 'epochs': 224, 'loss': 'mae', 'optimizer': 'adam', 'graph_mode': 'knn', 'knn_k': 5, 'weighted_edges': False, 'symmetrize_mode': 'union', 'self_loops': True, 'use_snp_selection': True, 'num_snps': 41892}. Best is trial 121 with value: 0.38210278205127163.
[I 2025-12-09 06:25:48,647] Trial 133 finished with value: 0.36806665477249123 and parameters: {'model_type': 'graphsage', 'hidden_dims': '[512, 256]', 'dropout': 0.1606126584990244, 'batch_norm': False, 'sage_aggr': 'max', 'sage_normalize': False, 'sage_project': False, 'lr': 3.270492406078391e-05, 'weight_decay': 7.61971561031892e-07, 'epochs': 188, 'loss': 'mae', 'optimizer': 'adam', 'graph_mode': 'knn', 'knn_k': 6, 'weighted_edges': False, 'symmetrize_mode': 'union', 'self_loops': True, 'use_snp_selection': True, 'num_snps': 44742}. Best is trial 121 with value: 0.38210278205127163.
[I 2025-12-09 06:28:53,688] Trial 134 finished with value: 0.37249411009265115 and parameters: {'model_type': 'graphsage', 'hidden_dims': '[512, 256]', 'dropout': 0.1392604559324397, 'batch_norm': False, 'sage_aggr': 'max', 'sage_normalize': False, 'sage_project': False, 'lr': 6.116682371683057e-05, 'weight_decay': 1.2176739365299841e-05, 'epochs': 198, 'loss': 'mae', 'optimizer': 'adam', 'graph_mode': 'knn', 'knn_k': 6, 'weighted_edges': False, 'symmetrize_mode': 'union', 'self_loops': True, 'use_snp_selection': True, 'num_snps': 43160}. Best is trial 121 with value: 0.38210278205127163.
[I 2025-12-09 06:31:22,312] Trial 135 finished with value: 0.3710688044545097 and parameters: {'model_type': 'graphsage', 'hidden_dims': '[512, 256]', 'dropout': 0.17912234475826924, 'batch_norm': False, 'sage_aggr': 'max', 'sage_normalize': False, 'sage_project': False, 'lr': 7.816748954431498e-05, 'weight_decay': 9.427641898183744e-06, 'epochs': 216, 'loss': 'mae', 'optimizer': 'adam', 'graph_mode': 'knn', 'knn_k': 5, 'weighted_edges': False, 'symmetrize_mode': 'union', 'self_loops': True, 'use_snp_selection': True, 'num_snps': 37052}. Best is trial 121 with value: 0.38210278205127163.
[I 2025-12-09 06:33:57,774] Trial 136 finished with value: 0.3720894719317308 and parameters: {'model_type': 'graphsage', 'hidden_dims': '[512, 256]', 'dropout': 0.13104449933298287, 'batch_norm': False, 'sage_aggr': 'max', 'sage_normalize': False, 'sage_project': False, 'lr': 1.8173389805945637e-05, 'weight_decay': 1.2179862692625515e-06, 'epochs': 178, 'loss': 'mae', 'optimizer': 'adam', 'graph_mode': 'knn', 'knn_k': 6, 'weighted_edges': True, 'symmetrize_mode': 'union', 'self_loops': True, 'use_snp_selection': True, 'num_snps': 39469}. Best is trial 121 with value: 0.38210278205127163.
[I 2025-12-09 06:34:52,072] Trial 137 finished with value: 0.32851011952134673 and parameters: {'model_type': 'graphsage', 'hidden_dims': '[256, 128, 64]', 'dropout': 0.10791275172836692, 'batch_norm': True, 'sage_aggr': 'max', 'sage_normalize': True, 'sage_project': False, 'lr': 4.693194162236666e-05, 'weight_decay': 2.034607095140832e-05, 'epochs': 162, 'loss': 'mae', 'optimizer': 'adam', 'graph_mode': 'knn', 'knn_k': 1, 'weighted_edges': False, 'symmetrize_mode': 'union', 'self_loops': True, 'use_snp_selection': False}. Best is trial 121 with value: 0.38210278205127163.
[I 2025-12-09 06:38:41,984] Trial 138 finished with value: 0.3685834035207154 and parameters: {'model_type': 'graphsage', 'hidden_dims': '[512, 256]', 'dropout': 0.15314091890463655, 'batch_norm': False, 'sage_aggr': 'max', 'sage_normalize': False, 'sage_project': False, 'lr': 5.485629342605074e-05, 'weight_decay': 3.558808058477189e-07, 'epochs': 210, 'loss': 'mae', 'optimizer': 'adam', 'graph_mode': 'knn', 'knn_k': 7, 'weighted_edges': False, 'symmetrize_mode': 'union', 'self_loops': True, 'use_snp_selection': True, 'num_snps': 46639}. Best is trial 121 with value: 0.38210278205127163.
[I 2025-12-09 06:41:31,348] Trial 139 finished with value: 0.33750901612508305 and parameters: {'model_type': 'graphsage', 'hidden_dims': '[512, 64]', 'dropout': 0.17215645394594617, 'batch_norm': False, 'sage_aggr': 'max', 'sage_normalize': False, 'sage_project': False, 'lr': 2.9215189686741673e-05, 'weight_decay': 1.5051114143529593e-05, 'epochs': 193, 'loss': 'mae', 'optimizer': 'adam', 'graph_mode': 'knn', 'knn_k': 4, 'weighted_edges': False, 'symmetrize_mode': 'union', 'self_loops': True, 'use_snp_selection': True, 'num_snps': 48360}. Best is trial 121 with value: 0.38210278205127163.
[I 2025-12-09 06:44:49,390] Trial 140 finished with value: 0.37617788082278864 and parameters: {'model_type': 'graphsage', 'hidden_dims': '[512, 256]', 'dropout': 0.1163320320084361, 'batch_norm': False, 'sage_aggr': 'max', 'sage_normalize': False, 'sage_project': False, 'lr': 6.603605189848402e-05, 'weight_decay': 7.969965498856528e-06, 'epochs': 235, 'loss': 'mae', 'optimizer': 'adam', 'graph_mode': 'knn', 'knn_k': 5, 'weighted_edges': False, 'symmetrize_mode': 'union', 'self_loops': True, 'use_snp_selection': True, 'num_snps': 43809}. Best is trial 121 with value: 0.38210278205127163.
[I 2025-12-09 06:49:07,757] Trial 141 finished with value: 0.37460812627266854 and parameters: {'model_type': 'graphsage', 'hidden_dims': '[512, 256]', 'dropout': 0.19401651938641415, 'batch_norm': False, 'sage_aggr': 'max', 'sage_normalize': False, 'sage_project': False, 'lr': 8.368415287490126e-05, 'weight_decay': 1.074981726417571e-05, 'epochs': 311, 'loss': 'mae', 'optimizer': 'adam', 'graph_mode': 'knn', 'knn_k': 6, 'weighted_edges': False, 'symmetrize_mode': 'union', 'self_loops': True, 'use_snp_selection': True, 'num_snps': 41557}. Best is trial 121 with value: 0.38210278205127163.
[I 2025-12-09 06:52:08,961] Trial 142 finished with value: 0.3664803706467285 and parameters: {'model_type': 'graphsage', 'hidden_dims': '[512, 256]', 'dropout': 0.2052913719144807, 'batch_norm': False, 'sage_aggr': 'max', 'sage_normalize': False, 'sage_project': False, 'lr': 9.897575183502672e-05, 'weight_decay': 6.305876476378939e-06, 'epochs': 185, 'loss': 'mae', 'optimizer': 'adam', 'graph_mode': 'knn', 'knn_k': 6, 'weighted_edges': False, 'symmetrize_mode': 'union', 'self_loops': True, 'use_snp_selection': True, 'num_snps': 45768}. Best is trial 121 with value: 0.38210278205127163.
[I 2025-12-09 06:55:15,229] Trial 143 finished with value: 0.3763837502582215 and parameters: {'model_type': 'graphsage', 'hidden_dims': '[512, 256]', 'dropout': 0.18184446651060596, 'batch_norm': False, 'sage_aggr': 'max', 'sage_normalize': False, 'sage_project': False, 'lr': 3.8523596292747584e-05, 'weight_decay': 4.8474975765233235e-06, 'epochs': 244, 'loss': 'mae', 'optimizer': 'adam', 'graph_mode': 'knn', 'knn_k': 6, 'weighted_edges': False, 'symmetrize_mode': 'union', 'self_loops': True, 'use_snp_selection': True, 'num_snps': 37900}. Best is trial 121 with value: 0.38210278205127163.
[I 2025-12-09 06:58:28,153] Trial 144 finished with value: 0.3716965093947124 and parameters: {'model_type': 'graphsage', 'hidden_dims': '[512, 256]', 'dropout': 0.15856020988978753, 'batch_norm': False, 'sage_aggr': 'max', 'sage_normalize': False, 'sage_project': False, 'lr': 4.147647077795585e-05, 'weight_decay': 3.7114972499264643e-06, 'epochs': 242, 'loss': 'mae', 'optimizer': 'adam', 'graph_mode': 'knn', 'knn_k': 6, 'weighted_edges': False, 'symmetrize_mode': 'union', 'self_loops': True, 'use_snp_selection': True, 'num_snps': 37512}. Best is trial 121 with value: 0.38210278205127163.
[I 2025-12-09 07:02:47,733] Trial 145 finished with value: 0.3790817661036094 and parameters: {'model_type': 'graphsage', 'hidden_dims': '[512, 256]', 'dropout': 0.1804543315728199, 'batch_norm': False, 'sage_aggr': 'max', 'sage_normalize': False, 'sage_project': False, 'lr': 5.297835199339962e-05, 'weight_decay': 2.467874018403293e-06, 'epochs': 222, 'loss': 'mae', 'optimizer': 'adam', 'graph_mode': 'knn', 'knn_k': 10, 'weighted_edges': False, 'symmetrize_mode': 'union', 'self_loops': True, 'use_snp_selection': True, 'num_snps': 40106}. Best is trial 121 with value: 0.38210278205127163.
