[I 2025-12-09 14:36:09,104] Trial 81 finished with value: 0.3124749285897204 and parameters: {'model_type': 'graphsage', 'hidden_dims': '[512, 64]', 'dropout': 0.48913450376144113, 'batch_norm': True, 'sage_aggr': 'max', 'sage_normalize': False, 'sage_project': False, 'lr': 0.006540553259830273, 'weight_decay': 3.4312465857948415e-06, 'epochs': 331, 'loss': 'mse', 'optimizer': 'adam', 'graph_mode': 'cutoff', 'cutoff': 0.7911961034521722, 'grm_norm': 'cosine_then_gcn', 'self_loops': True, 'use_snp_selection': False}. Best is trial 50 with value: 0.31796609177250984.
[I 2025-12-09 14:38:15,840] Trial 82 finished with value: 0.31007641408405845 and parameters: {'model_type': 'graphsage', 'hidden_dims': '[512, 64]', 'dropout': 0.5092156225135377, 'batch_norm': True, 'sage_aggr': 'max', 'sage_normalize': False, 'sage_project': False, 'lr': 0.002955661110671789, 'weight_decay': 3.374355071948839e-05, 'epochs': 240, 'loss': 'mse', 'optimizer': 'adam', 'graph_mode': 'cutoff', 'cutoff': 0.7233522492681405, 'grm_norm': 'cosine_then_gcn', 'self_loops': True, 'use_snp_selection': False}. Best is trial 50 with value: 0.31796609177250984.
[I 2025-12-09 14:40:05,081] Trial 83 finished with value: 0.3109022111659228 and parameters: {'model_type': 'graphsage', 'hidden_dims': '[512, 64]', 'dropout': 0.45914987729312307, 'batch_norm': True, 'sage_aggr': 'max', 'sage_normalize': False, 'sage_project': False, 'lr': 0.003625071000291655, 'weight_decay': 5.5221128087970195e-05, 'epochs': 206, 'loss': 'mse', 'optimizer': 'adam', 'graph_mode': 'cutoff', 'cutoff': 0.8386917565255242, 'grm_norm': 'cosine_then_gcn', 'self_loops': True, 'use_snp_selection': False}. Best is trial 50 with value: 0.31796609177250984.
[I 2025-12-09 14:42:28,203] Trial 84 finished with value: 0.3087247758247539 and parameters: {'model_type': 'graphsage', 'hidden_dims': '[512, 128]', 'dropout': 0.564439329969402, 'batch_norm': True, 'sage_aggr': 'max', 'sage_normalize': False, 'sage_project': False, 'lr': 0.004943963417794923, 'weight_decay': 7.832441096481082e-05, 'epochs': 272, 'loss': 'mse', 'optimizer': 'adam', 'graph_mode': 'cutoff', 'cutoff': 0.8673415997633166, 'grm_norm': 'cosine_then_gcn', 'self_loops': True, 'use_snp_selection': False}. Best is trial 50 with value: 0.31796609177250984.
[I 2025-12-09 14:45:08,841] Trial 85 finished with value: 0.3069474947527182 and parameters: {'model_type': 'graphsage', 'hidden_dims': '[512, 64]', 'dropout': 0.44387888882966237, 'batch_norm': True, 'sage_aggr': 'max', 'sage_normalize': False, 'sage_project': False, 'lr': 0.0040589260370849384, 'weight_decay': 8.91102325796703e-06, 'epochs': 307, 'loss': 'mse', 'optimizer': 'adam', 'graph_mode': 'cutoff', 'cutoff': 0.8020065012137382, 'grm_norm': 'cosine_then_gcn', 'self_loops': True, 'use_snp_selection': False}. Best is trial 50 with value: 0.31796609177250984.
[I 2025-12-09 14:47:59,595] Trial 86 finished with value: 0.31232788675092743 and parameters: {'model_type': 'graphsage', 'hidden_dims': '[512, 64]', 'dropout': 0.4266410000207203, 'batch_norm': True, 'sage_aggr': 'max', 'sage_normalize': False, 'sage_project': False, 'lr': 0.005751267664156146, 'weight_decay': 3.567700653169934e-05, 'epochs': 292, 'loss': 'mse', 'optimizer': 'adam', 'graph_mode': 'cutoff', 'cutoff': 0.882940764363894, 'grm_norm': 'cosine_then_gcn', 'self_loops': True, 'use_snp_selection': True, 'num_snps': 58998}. Best is trial 50 with value: 0.31796609177250984.
[I 2025-12-09 14:49:01,632] Trial 87 finished with value: 0.0 and parameters: {'model_type': 'graphsage', 'hidden_dims': '[512, 64]', 'dropout': 0.4839243991644566, 'batch_norm': False, 'sage_aggr': 'max', 'sage_normalize': False, 'sage_project': False, 'lr': 0.006948286794952791, 'weight_decay': 1.372231270016871e-05, 'epochs': 113, 'loss': 'mse', 'optimizer': 'adam', 'graph_mode': 'cutoff', 'cutoff': 0.681934502966724, 'grm_norm': 'cosine_then_gcn', 'self_loops': False, 'use_snp_selection': False}. Best is trial 50 with value: 0.31796609177250984.
[I 2025-12-09 14:49:37,891] Trial 88 finished with value: 0.3138039148154677 and parameters: {'model_type': 'graphsage', 'hidden_dims': '[256, 128, 64]', 'dropout': 0.4964549892957624, 'batch_norm': True, 'sage_aggr': 'max', 'sage_normalize': False, 'sage_project': False, 'lr': 0.008212884632779336, 'weight_decay': 4.125843421515131e-06, 'epochs': 121, 'loss': 'mse', 'optimizer': 'adam', 'graph_mode': 'cutoff', 'cutoff': 0.8166186000431487, 'grm_norm': 'cosine', 'self_loops': True, 'use_snp_selection': False}. Best is trial 50 with value: 0.31796609177250984.
[I 2025-12-09 14:50:17,482] Trial 89 finished with value: 0.3098318391626291 and parameters: {'model_type': 'graphsage', 'hidden_dims': '[512, 64]', 'dropout': 0.3559220641890881, 'batch_norm': True, 'sage_aggr': 'max', 'sage_normalize': False, 'sage_project': False, 'lr': 0.00190946795019067, 'weight_decay': 9.260071570261355e-05, 'epochs': 69, 'loss': 'mse', 'optimizer': 'adam', 'graph_mode': 'cutoff', 'cutoff': 0.7664293007896924, 'grm_norm': 'cosine_then_gcn', 'self_loops': True, 'use_snp_selection': False}. Best is trial 50 with value: 0.31796609177250984.
[I 2025-12-09 14:51:04,407] Trial 90 finished with value: 0.30745756468103347 and parameters: {'model_type': 'graphsage', 'hidden_dims': '[512, 64]', 'dropout': 0.5398461832058505, 'batch_norm': True, 'sage_aggr': 'mean', 'sage_normalize': False, 'sage_project': False, 'lr': 0.0027261816997772715, 'weight_decay': 2.379710958962616e-06, 'epochs': 82, 'loss': 'mse', 'optimizer': 'adam', 'graph_mode': 'cutoff', 'cutoff': 0.5827875681311518, 'grm_norm': 'cosine_then_gcn', 'self_loops': True, 'use_snp_selection': False}. Best is trial 50 with value: 0.31796609177250984.
[I 2025-12-09 14:51:40,927] Trial 91 finished with value: 0.31346749173799837 and parameters: {'model_type': 'graphsage', 'hidden_dims': '[256, 128, 64]', 'dropout': 0.46889879665391, 'batch_norm': True, 'sage_aggr': 'max', 'sage_normalize': False, 'sage_project': False, 'lr': 0.00850203284273619, 'weight_decay': 4.42462158787261e-06, 'epochs': 122, 'loss': 'mse', 'optimizer': 'adam', 'graph_mode': 'cutoff', 'cutoff': 0.8176032222382056, 'grm_norm': 'cosine', 'self_loops': True, 'use_snp_selection': False}. Best is trial 50 with value: 0.31796609177250984.
[I 2025-12-09 14:51:57,375] Trial 92 finished with value: 0.31059191321840923 and parameters: {'model_type': 'graphsage', 'hidden_dims': '[256, 128, 64]', 'dropout': 0.5020017211473937, 'batch_norm': True, 'sage_aggr': 'max', 'sage_normalize': False, 'sage_project': False, 'lr': 0.005557116750151876, 'weight_decay': 6.528752091490574e-06, 'epochs': 49, 'loss': 'mse', 'optimizer': 'adam', 'graph_mode': 'cutoff', 'cutoff': 0.7821779658817269, 'grm_norm': 'cosine', 'self_loops': True, 'use_snp_selection': False}. Best is trial 50 with value: 0.31796609177250984.
[I 2025-12-09 14:52:41,611] Trial 93 finished with value: 0.3110688442339334 and parameters: {'model_type': 'graphsage', 'hidden_dims': '[256, 128, 64]', 'dropout': 0.5102597701253075, 'batch_norm': True, 'sage_aggr': 'max', 'sage_normalize': False, 'sage_project': False, 'lr': 0.006953248280166988, 'weight_decay': 2.817219511698395e-05, 'epochs': 150, 'loss': 'mse', 'optimizer': 'adam', 'graph_mode': 'cutoff', 'cutoff': 0.8541527674672823, 'grm_norm': 'cosine', 'self_loops': True, 'use_snp_selection': False}. Best is trial 50 with value: 0.31796609177250984.
[I 2025-12-09 14:53:12,098] Trial 94 finished with value: 0.3149676665864966 and parameters: {'model_type': 'graphsage', 'hidden_dims': '[256, 128, 64]', 'dropout': 0.4832392704125134, 'batch_norm': True, 'sage_aggr': 'max', 'sage_normalize': False, 'sage_project': False, 'lr': 0.008574070784292476, 'weight_decay': 3.6586539133514105e-06, 'epochs': 100, 'loss': 'mse', 'optimizer': 'adam', 'graph_mode': 'cutoff', 'cutoff': 0.8360815386348375, 'grm_norm': 'cosine', 'self_loops': True, 'use_snp_selection': False}. Best is trial 50 with value: 0.31796609177250984.
[I 2025-12-09 14:54:05,288] Trial 95 finished with value: 0.3145972343978477 and parameters: {'model_type': 'graphsage', 'hidden_dims': '[512, 64]', 'dropout': 0.44631493710283404, 'batch_norm': True, 'sage_aggr': 'max', 'sage_normalize': False, 'sage_project': False, 'lr': 0.004818103513548661, 'weight_decay': 6.04626503282053e-05, 'epochs': 96, 'loss': 'mse', 'optimizer': 'adam', 'graph_mode': 'cutoff', 'cutoff': 0.8373022305528158, 'grm_norm': 'gcn', 'self_loops': True, 'use_snp_selection': False}. Best is trial 50 with value: 0.31796609177250984.
[I 2025-12-09 14:55:04,014] Trial 96 finished with value: 0.308343964508207 and parameters: {'model_type': 'graphsage', 'hidden_dims': '[512, 64]', 'dropout': 0.48202856234835834, 'batch_norm': True, 'sage_aggr': 'max', 'sage_normalize': False, 'sage_project': False, 'lr': 0.0042190248568019575, 'weight_decay': 1.739470547608058e-06, 'epochs': 107, 'loss': 'mse', 'optimizer': 'adam', 'graph_mode': 'cutoff', 'cutoff': 0.8814450634009572, 'grm_norm': 'gcn', 'self_loops': True, 'use_snp_selection': False}. Best is trial 50 with value: 0.31796609177250984.
[I 2025-12-09 14:56:20,526] Trial 97 finished with value: 0.25798660484099534 and parameters: {'model_type': 'graphsage', 'hidden_dims': '[128, 64]', 'dropout': 0.4454980528140799, 'batch_norm': True, 'sage_aggr': 'max', 'sage_normalize': True, 'sage_project': False, 'lr': 0.0049220301885115544, 'weight_decay': 1.0701245778267055e-05, 'epochs': 98, 'loss': 'mae', 'optimizer': 'adam', 'graph_mode': 'knn', 'knn_k': 8, 'weighted_edges': False, 'symmetrize_mode': 'union', 'self_loops': True, 'use_snp_selection': False}. Best is trial 50 with value: 0.31796609177250984.
[I 2025-12-09 14:56:59,977] Trial 98 finished with value: 0.3139290801330744 and parameters: {'model_type': 'graphsage', 'hidden_dims': '[512, 64]', 'dropout': 0.517333165792683, 'batch_norm': True, 'sage_aggr': 'max', 'sage_normalize': False, 'sage_project': False, 'lr': 0.008840476723123667, 'weight_decay': 2.4130701637429577e-06, 'epochs': 69, 'loss': 'mse', 'optimizer': 'adam', 'graph_mode': 'cutoff', 'cutoff': 0.8474298143309127, 'grm_norm': 'gcn', 'self_loops': True, 'use_snp_selection': False}. Best is trial 50 with value: 0.31796609177250984.
[I 2025-12-09 14:57:19,628] Trial 99 finished with value: 0.3059026658614119 and parameters: {'model_type': 'graphsage', 'hidden_dims': '[512, 256]', 'dropout': 0.4636832214346517, 'batch_norm': True, 'sage_aggr': 'max', 'sage_normalize': False, 'sage_project': False, 'lr': 0.006406381774103103, 'weight_decay': 3.515287853864825e-06, 'epochs': 86, 'loss': 'mse', 'optimizer': 'adam', 'graph_mode': 'cutoff', 'cutoff': 0.8995934116954718, 'grm_norm': 'gcn', 'self_loops': True, 'use_snp_selection': True, 'num_snps': 13096}. Best is trial 50 with value: 0.31796609177250984.
[I 2025-12-09 14:58:09,380] Trial 100 finished with value: 0.16117226548957933 and parameters: {'model_type': 'graphsage', 'hidden_dims': '[512, 64]', 'dropout': 0.5548389537474325, 'batch_norm': False, 'sage_aggr': 'max', 'sage_normalize': False, 'sage_project': False, 'lr': 1.2843713735967391e-05, 'weight_decay': 7.890770495742477e-06, 'epochs': 74, 'loss': 'mse', 'optimizer': 'adam', 'graph_mode': 'cutoff', 'cutoff': 0.4988041592168415, 'grm_norm': 'gcn', 'self_loops': False, 'use_snp_selection': False}. Best is trial 50 with value: 0.31796609177250984.
[I 2025-12-09 14:59:01,719] Trial 101 finished with value: 0.310903176082454 and parameters: {'model_type': 'graphsage', 'hidden_dims': '[512, 64]', 'dropout': 0.47669710259824216, 'batch_norm': True, 'sage_aggr': 'max', 'sage_normalize': False, 'sage_project': False, 'lr': 0.0037580151453978795, 'weight_decay': 4.855680231214895e-05, 'epochs': 94, 'loss': 'mse', 'optimizer': 'adam', 'graph_mode': 'cutoff', 'cutoff': 0.8333605066812506, 'grm_norm': 'cosine', 'self_loops': True, 'use_snp_selection': False}. Best is trial 50 with value: 0.31796609177250984.
[I 2025-12-09 14:59:51,463] Trial 102 finished with value: 0.31629456498144526 and parameters: {'model_type': 'graphsage', 'hidden_dims': '[512, 64]', 'dropout': 0.4074737442305528, 'batch_norm': True, 'sage_aggr': 'max', 'sage_normalize': False, 'sage_project': False, 'lr': 0.007260810426798884, 'weight_decay': 6.43546813918205e-05, 'epochs': 89, 'loss': 'mse', 'optimizer': 'adam', 'graph_mode': 'cutoff', 'cutoff': 0.7966838733506182, 'grm_norm': 'cosine_then_gcn', 'self_loops': True, 'use_snp_selection': False}. Best is trial 50 with value: 0.31796609177250984.
[I 2025-12-09 15:00:28,490] Trial 103 finished with value: 0.3124875039987175 and parameters: {'model_type': 'graphsage', 'hidden_dims': '[512, 64]', 'dropout': 0.34030027980685595, 'batch_norm': True, 'sage_aggr': 'max', 'sage_normalize': False, 'sage_project': False, 'lr': 0.007658381169566803, 'weight_decay': 6.564735095020366e-05, 'epochs': 64, 'loss': 'mse', 'optimizer': 'adam', 'graph_mode': 'cutoff', 'cutoff': 0.8679411055553996, 'grm_norm': 'cosine_then_gcn', 'self_loops': True, 'use_snp_selection': False}. Best is trial 50 with value: 0.31796609177250984.
[I 2025-12-09 15:01:38,589] Trial 104 finished with value: 0.3149255545864787 and parameters: {'model_type': 'graphsage', 'hidden_dims': '[512, 64]', 'dropout': 0.4109025324838454, 'batch_norm': True, 'sage_aggr': 'max', 'sage_normalize': False, 'sage_project': False, 'lr': 0.009902387529590936, 'weight_decay': 5.508549544143668e-06, 'epochs': 129, 'loss': 'mse', 'optimizer': 'adam', 'graph_mode': 'cutoff', 'cutoff': 0.8097218898212577, 'grm_norm': 'cosine', 'self_loops': True, 'use_snp_selection': False}. Best is trial 50 with value: 0.31796609177250984.
[I 2025-12-09 15:02:48,171] Trial 105 finished with value: 0.3154624081548484 and parameters: {'model_type': 'graphsage', 'hidden_dims': '[512, 64]', 'dropout': 0.417236458486341, 'batch_norm': True, 'sage_aggr': 'max', 'sage_normalize': False, 'sage_project': False, 'lr': 0.005501660399843153, 'weight_decay': 5.8896238943582365e-06, 'epochs': 128, 'loss': 'mse', 'optimizer': 'adam', 'graph_mode': 'cutoff', 'cutoff': 0.8292957223198869, 'grm_norm': 'cosine', 'self_loops': True, 'use_snp_selection': False}. Best is trial 50 with value: 0.31796609177250984.
[I 2025-12-09 15:03:27,749] Trial 106 finished with value: 0.31053510793333416 and parameters: {'model_type': 'graphsage', 'hidden_dims': '[256, 128, 64]', 'dropout': 0.41039055511515565, 'batch_norm': True, 'sage_aggr': 'max', 'sage_normalize': False, 'sage_project': False, 'lr': 0.005614695505760388, 'weight_decay': 5.2366539916254015e-06, 'epochs': 133, 'loss': 'mse', 'optimizer': 'adam', 'graph_mode': 'cutoff', 'cutoff': 0.8297677902830142, 'grm_norm': 'cosine', 'self_loops': True, 'use_snp_selection': False}. Best is trial 50 with value: 0.31796609177250984.
[I 2025-12-09 15:04:35,811] Trial 107 finished with value: 0.3150162100016411 and parameters: {'model_type': 'graphsage', 'hidden_dims': '[512, 64]', 'dropout': 0.42626660248328885, 'batch_norm': True, 'sage_aggr': 'max', 'sage_normalize': False, 'sage_project': False, 'lr': 0.0044365820538805716, 'weight_decay': 2.950722267783974e-06, 'epochs': 125, 'loss': 'mse', 'optimizer': 'adam', 'graph_mode': 'cutoff', 'cutoff': 0.8549555240011208, 'grm_norm': 'cosine', 'self_loops': True, 'use_snp_selection': False}. Best is trial 50 with value: 0.31796609177250984.
[I 2025-12-09 15:05:56,390] Trial 108 finished with value: 0.3095202436044885 and parameters: {'model_type': 'graphsage', 'hidden_dims': '[512, 128]', 'dropout': 0.42083963647696504, 'batch_norm': True, 'sage_aggr': 'max', 'sage_normalize': False, 'sage_project': False, 'lr': 0.004574613670527498, 'weight_decay': 3.2668723378164783e-06, 'epochs': 149, 'loss': 'mse', 'optimizer': 'adam', 'graph_mode': 'cutoff', 'cutoff': 0.8624498194999265, 'grm_norm': 'cosine', 'self_loops': True, 'use_snp_selection': False}. Best is trial 50 with value: 0.31796609177250984.
[I 2025-12-09 15:07:06,882] Trial 109 finished with value: 0.3098403715456741 and parameters: {'model_type': 'graphsage', 'hidden_dims': '[512, 64]', 'dropout': 0.37774475801208435, 'batch_norm': True, 'sage_aggr': 'mean', 'sage_normalize': False, 'sage_project': False, 'lr': 2.9194505504354923e-05, 'weight_decay': 1.2700883665625077e-06, 'epochs': 129, 'loss': 'mse', 'optimizer': 'adam', 'graph_mode': 'cutoff', 'cutoff': 0.751971480521402, 'grm_norm': 'cosine', 'self_loops': True, 'use_snp_selection': False}. Best is trial 50 with value: 0.31796609177250984.
[I 2025-12-09 15:08:08,384] Trial 110 finished with value: 0.2946115561510054 and parameters: {'model_type': 'graphsage', 'hidden_dims': '[512, 64]', 'dropout': 0.4300949767087065, 'batch_norm': True, 'sage_aggr': 'max', 'sage_normalize': False, 'sage_project': False, 'lr': 1.0051205212777255e-05, 'weight_decay': 0.00017371854124363732, 'epochs': 112, 'loss': 'mse', 'optimizer': 'adam', 'graph_mode': 'cutoff', 'cutoff': 0.8105992439028681, 'grm_norm': 'cosine', 'self_loops': True, 'use_snp_selection': False}. Best is trial 50 with value: 0.31796609177250984.
[I 2025-12-09 15:09:16,985] Trial 111 finished with value: 0.3122692152205603 and parameters: {'model_type': 'graphsage', 'hidden_dims': '[512, 64]', 'dropout': 0.43985418428279366, 'batch_norm': True, 'sage_aggr': 'max', 'sage_normalize': False, 'sage_project': False, 'lr': 0.005857573542269667, 'weight_decay': 5.262226958504506e-06, 'epochs': 126, 'loss': 'mse', 'optimizer': 'adam', 'graph_mode': 'cutoff', 'cutoff': 0.8489779739919031, 'grm_norm': 'cosine', 'self_loops': True, 'use_snp_selection': False}. Best is trial 50 with value: 0.31796609177250984.
[I 2025-12-09 15:10:15,983] Trial 112 finished with value: 0.30872962874335225 and parameters: {'model_type': 'graphsage', 'hidden_dims': '[512, 64]', 'dropout': 0.4520952103248477, 'batch_norm': True, 'sage_aggr': 'max', 'sage_normalize': False, 'sage_project': False, 'lr': 0.0033926121071655223, 'weight_decay': 2.614788881402068e-06, 'epochs': 107, 'loss': 'mse', 'optimizer': 'adam', 'graph_mode': 'cutoff', 'cutoff': 0.8362397975073642, 'grm_norm': 'cosine', 'self_loops': True, 'use_snp_selection': False}. Best is trial 50 with value: 0.31796609177250984.
[I 2025-12-09 15:11:31,771] Trial 113 finished with value: 0.3162639957333869 and parameters: {'model_type': 'graphsage', 'hidden_dims': '[512, 64]', 'dropout': 0.4068926640367685, 'batch_norm': True, 'sage_aggr': 'max', 'sage_normalize': False, 'sage_project': False, 'lr': 0.0031415291608779517, 'weight_decay': 4.389075762000229e-06, 'epochs': 140, 'loss': 'mse', 'optimizer': 'adam', 'graph_mode': 'cutoff', 'cutoff': 0.885386573720034, 'grm_norm': 'cosine', 'self_loops': True, 'use_snp_selection': False}. Best is trial 50 with value: 0.31796609177250984.
[I 2025-12-09 15:12:46,542] Trial 114 finished with value: 0.3161898150554955 and parameters: {'model_type': 'graphsage', 'hidden_dims': '[512, 64]', 'dropout': 0.3826718137921845, 'batch_norm': True, 'sage_aggr': 'max', 'sage_normalize': False, 'sage_project': False, 'lr': 0.006533395347975159, 'weight_decay': 1.9472237030030195e-06, 'epochs': 138, 'loss': 'mse', 'optimizer': 'adam', 'graph_mode': 'cutoff', 'cutoff': 0.8806158955698685, 'grm_norm': 'cosine', 'self_loops': True, 'use_snp_selection': False}. Best is trial 50 with value: 0.31796609177250984.
[I 2025-12-09 15:14:11,358] Trial 115 finished with value: 0.3077057518072803 and parameters: {'model_type': 'graphsage', 'hidden_dims': '[512, 64]', 'dropout': 0.38464199420244083, 'batch_norm': True, 'sage_aggr': 'max', 'sage_normalize': False, 'sage_project': False, 'lr': 0.007236180086934564, 'weight_decay': 2.0920574402387143e-06, 'epochs': 157, 'loss': 'mse', 'optimizer': 'adam', 'graph_mode': 'cutoff', 'cutoff': 0.8877420615491214, 'grm_norm': 'cosine', 'self_loops': True, 'use_snp_selection': False}. Best is trial 50 with value: 0.31796609177250984.
[I 2025-12-09 15:15:25,909] Trial 116 finished with value: 0.31338157748409096 and parameters: {'model_type': 'graphsage', 'hidden_dims': '[512, 64]', 'dropout': 0.4075392259108279, 'batch_norm': True, 'sage_aggr': 'max', 'sage_normalize': False, 'sage_project': False, 'lr': 0.004535084066954419, 'weight_decay': 6.169892283876439e-07, 'epochs': 137, 'loss': 'mse', 'optimizer': 'adam', 'graph_mode': 'cutoff', 'cutoff': 0.874766746510098, 'grm_norm': 'cosine', 'self_loops': True, 'use_snp_selection': False}. Best is trial 50 with value: 0.31796609177250984.
[I 2025-12-09 15:18:59,420] Trial 117 finished with value: 0.2694616653501869 and parameters: {'model_type': 'graphsage', 'hidden_dims': '[512, 64]', 'dropout': 0.394689761986506, 'batch_norm': True, 'sage_aggr': 'max', 'sage_normalize': True, 'sage_project': False, 'lr': 0.008642330014472847, 'weight_decay': 1.463687581996333e-06, 'epochs': 165, 'loss': 'mae', 'optimizer': 'adam', 'graph_mode': 'knn', 'knn_k': 10, 'weighted_edges': True, 'symmetrize_mode': 'union', 'self_loops': True, 'use_snp_selection': False}. Best is trial 50 with value: 0.31796609177250984.
[I 2025-12-09 15:20:18,791] Trial 118 finished with value: 0.3110705382789155 and parameters: {'model_type': 'graphsage', 'hidden_dims': '[512, 64]', 'dropout': 0.3715981258411453, 'batch_norm': True, 'sage_aggr': 'max', 'sage_normalize': False, 'sage_project': False, 'lr': 0.005043939640364596, 'weight_decay': 6.887016315897929e-06, 'epochs': 147, 'loss': 'mse', 'optimizer': 'adam', 'graph_mode': 'cutoff', 'cutoff': 0.7828422019218999, 'grm_norm': 'cosine', 'self_loops': True, 'use_snp_selection': False}. Best is trial 50 with value: 0.31796609177250984.
