[I 2025-12-10 02:13:47,741] Trial 30 finished with value: 0.3010450074477723 and parameters: {'model_type': 'graphsage', 'hidden_dims': '[256, 128]', 'dropout': 0.1822504125490253, 'batch_norm': False, 'sage_aggr': 'max', 'sage_normalize': False, 'sage_project': False, 'lr': 2.009507156809444e-05, 'weight_decay': 1.9311228862081734e-07, 'epochs': 298, 'loss': 'mse', 'optimizer': 'adam', 'graph_mode': 'cutoff', 'cutoff': 0.2089481027828336, 'grm_norm': 'none', 'self_loops': False, 'use_snp_selection': True, 'num_snps': 28493}. Best is trial 28 with value: 0.30732090388868005.
[I 2025-12-10 02:18:27,479] Trial 31 finished with value: 0.30722077612308907 and parameters: {'model_type': 'graphsage', 'hidden_dims': '[256, 128]', 'dropout': 0.18221798744491627, 'batch_norm': False, 'sage_aggr': 'max', 'sage_normalize': False, 'sage_project': False, 'lr': 2.188981854316431e-05, 'weight_decay': 2.3145356050695303e-07, 'epochs': 307, 'loss': 'mse', 'optimizer': 'adam', 'graph_mode': 'cutoff', 'cutoff': 0.20906922924885776, 'grm_norm': 'none', 'self_loops': False, 'use_snp_selection': True, 'num_snps': 28014}. Best is trial 28 with value: 0.30732090388868005.
[I 2025-12-10 02:20:27,538] Trial 32 finished with value: 0.29411483609609246 and parameters: {'model_type': 'graphsage', 'hidden_dims': '[256, 128]', 'dropout': 0.13405551687723716, 'batch_norm': False, 'sage_aggr': 'max', 'sage_normalize': False, 'sage_project': False, 'lr': 2.1937854752992137e-05, 'weight_decay': 8.054968824877167e-07, 'epochs': 267, 'loss': 'mse', 'optimizer': 'adam', 'graph_mode': 'cutoff', 'cutoff': 0.27006319020415, 'grm_norm': 'none', 'self_loops': False, 'use_snp_selection': True, 'num_snps': 20623}. Best is trial 28 with value: 0.30732090388868005.
[I 2025-12-10 02:24:17,204] Trial 33 finished with value: 0.2892495262176117 and parameters: {'model_type': 'graphsage', 'hidden_dims': '[256, 128]', 'dropout': 0.14995667503073296, 'batch_norm': False, 'sage_aggr': 'max', 'sage_normalize': False, 'sage_project': False, 'lr': 1.0163055762106198e-05, 'weight_decay': 3.6859595083413076e-07, 'epochs': 312, 'loss': 'mse', 'optimizer': 'adam', 'graph_mode': 'cutoff', 'cutoff': 0.2740355120004001, 'grm_norm': 'none', 'self_loops': False, 'use_snp_selection': True, 'num_snps': 29919}. Best is trial 28 with value: 0.30732090388868005.
[I 2025-12-10 02:26:14,997] Trial 34 finished with value: 0.2925212201068944 and parameters: {'model_type': 'graphsage', 'hidden_dims': '[256, 128, 64]', 'dropout': 0.10284199105052144, 'batch_norm': False, 'sage_aggr': 'max', 'sage_normalize': False, 'sage_project': False, 'lr': 2.3878801778498578e-05, 'weight_decay': 1.674844935772976e-06, 'epochs': 349, 'loss': 'mse', 'optimizer': 'adam', 'graph_mode': 'cutoff', 'cutoff': 0.20571050227168952, 'grm_norm': 'cosine', 'self_loops': False, 'use_snp_selection': True, 'num_snps': 13662}. Best is trial 28 with value: 0.30732090388868005.
[I 2025-12-10 02:27:28,897] Trial 35 finished with value: 0.30496169216698515 and parameters: {'model_type': 'graphsage', 'hidden_dims': '[128, 64]', 'dropout': 0.18429324236012923, 'batch_norm': False, 'sage_aggr': 'max', 'sage_normalize': False, 'sage_project': False, 'lr': 1.560652602291785e-05, 'weight_decay': 2.2070512762325343e-07, 'epochs': 265, 'loss': 'mse', 'optimizer': 'adam', 'graph_mode': 'cutoff', 'cutoff': 0.4154258279965024, 'grm_norm': 'gcn', 'self_loops': False, 'use_snp_selection': True, 'num_snps': 22736}. Best is trial 28 with value: 0.30732090388868005.
[I 2025-12-10 02:30:09,276] Trial 36 finished with value: 0.2696669257273589 and parameters: {'model_type': 'graphsage', 'hidden_dims': '[512, 256]', 'dropout': 0.20220018814586266, 'batch_norm': True, 'sage_aggr': 'max', 'sage_normalize': False, 'sage_project': False, 'lr': 1.613807038361441e-05, 'weight_decay': 1.1338370167208389e-06, 'epochs': 251, 'loss': 'mse', 'optimizer': 'adam', 'graph_mode': 'cutoff', 'cutoff': 0.31527496464513943, 'grm_norm': 'none', 'self_loops': False, 'use_snp_selection': True, 'num_snps': 26087}. Best is trial 28 with value: 0.30732090388868005.
[I 2025-12-10 02:34:19,317] Trial 37 finished with value: 0.28473279826138276 and parameters: {'model_type': 'graphsage', 'hidden_dims': '[256, 128]', 'dropout': 0.12374954655134501, 'batch_norm': False, 'sage_aggr': 'max', 'sage_normalize': False, 'sage_project': False, 'lr': 5.301482863511267e-05, 'weight_decay': 4.106542412414657e-07, 'epochs': 277, 'loss': 'mse', 'optimizer': 'adam', 'graph_mode': 'cutoff', 'cutoff': 0.2507735371646711, 'grm_norm': 'gcn', 'self_loops': False, 'use_snp_selection': False}. Best is trial 28 with value: 0.30732090388868005.
[I 2025-12-10 02:36:56,453] Trial 38 finished with value: 0.24927037870130314 and parameters: {'model_type': 'graphsage', 'hidden_dims': '[256, 128, 64]', 'dropout': 0.30175038476006716, 'batch_norm': True, 'sage_aggr': 'mean', 'sage_normalize': True, 'sage_project': False, 'lr': 1.0083236091606073e-05, 'weight_decay': 1.9368287352582087e-07, 'epochs': 304, 'loss': 'mse', 'optimizer': 'adam', 'graph_mode': 'cutoff', 'cutoff': 0.35695012846390467, 'grm_norm': 'gcn', 'self_loops': False, 'use_snp_selection': True, 'num_snps': 31254}. Best is trial 28 with value: 0.30732090388868005.
[I 2025-12-10 02:38:17,072] Trial 39 finished with value: 0.0 and parameters: {'model_type': 'graphsage', 'hidden_dims': '[512, 64]', 'dropout': 0.1558860919913296, 'batch_norm': False, 'sage_aggr': 'max', 'sage_normalize': False, 'sage_project': False, 'lr': 0.007572975208756009, 'weight_decay': 3.8139529378336177e-06, 'epochs': 214, 'loss': 'mse', 'optimizer': 'adam', 'graph_mode': 'cutoff', 'cutoff': 0.29778010386086307, 'grm_norm': 'none', 'self_loops': False, 'use_snp_selection': True, 'num_snps': 16403}. Best is trial 28 with value: 0.30732090388868005.
[I 2025-12-10 02:41:47,623] Trial 40 finished with value: 0.2880283823793187 and parameters: {'model_type': 'graphsage', 'hidden_dims': '[512, 256]', 'dropout': 0.14097927984272285, 'batch_norm': True, 'sage_aggr': 'max', 'sage_normalize': False, 'sage_project': False, 'lr': 2.2895153537400482e-05, 'weight_decay': 1.0636251268541741e-07, 'epochs': 284, 'loss': 'mse', 'optimizer': 'adam', 'graph_mode': 'cutoff', 'cutoff': 0.45906582019933956, 'grm_norm': 'gcn', 'self_loops': False, 'use_snp_selection': False}. Best is trial 28 with value: 0.30732090388868005.
[I 2025-12-10 02:42:47,982] Trial 41 finished with value: 0.2997272750472194 and parameters: {'model_type': 'graphsage', 'hidden_dims': '[128, 64]', 'dropout': 0.19581359117207073, 'batch_norm': False, 'sage_aggr': 'max', 'sage_normalize': False, 'sage_project': False, 'lr': 1.5982149989003223e-05, 'weight_decay': 2.2228207876327017e-07, 'epochs': 261, 'loss': 'mse', 'optimizer': 'adam', 'graph_mode': 'cutoff', 'cutoff': 0.4240231078997576, 'grm_norm': 'gcn', 'self_loops': False, 'use_snp_selection': True, 'num_snps': 20122}. Best is trial 28 with value: 0.30732090388868005.
[I 2025-12-10 02:44:57,639] Trial 42 finished with value: 0.29192804122007815 and parameters: {'model_type': 'graphsage', 'hidden_dims': '[128, 64]', 'dropout': 0.18182931424444743, 'batch_norm': False, 'sage_aggr': 'max', 'sage_normalize': False, 'sage_project': False, 'lr': 1.5561513128931593e-05, 'weight_decay': 6.966600821484239e-07, 'epochs': 241, 'loss': 'mse', 'optimizer': 'adam', 'graph_mode': 'cutoff', 'cutoff': 0.24192790634028782, 'grm_norm': 'gcn', 'self_loops': False, 'use_snp_selection': True, 'num_snps': 23099}. Best is trial 28 with value: 0.30732090388868005.
[I 2025-12-10 02:46:42,763] Trial 43 finished with value: 0.2990068353023804 and parameters: {'model_type': 'graphsage', 'hidden_dims': '[128, 64]', 'dropout': 0.2295803977075656, 'batch_norm': False, 'sage_aggr': 'max', 'sage_normalize': False, 'sage_project': False, 'lr': 1.2994071090936543e-05, 'weight_decay': 2.447287718563892e-07, 'epochs': 329, 'loss': 'mse', 'optimizer': 'adam', 'graph_mode': 'cutoff', 'cutoff': 0.3824175470821555, 'grm_norm': 'gcn', 'self_loops': False, 'use_snp_selection': True, 'num_snps': 31594}. Best is trial 28 with value: 0.30732090388868005.
[I 2025-12-10 02:47:28,248] Trial 44 finished with value: 0.2880026742464352 and parameters: {'model_type': 'graphsage', 'hidden_dims': '[128, 64]', 'dropout': 0.10173611420464582, 'batch_norm': False, 'sage_aggr': 'mean', 'sage_normalize': False, 'sage_project': False, 'lr': 2.7531058333931494e-05, 'weight_decay': 1.2805491939368374e-06, 'epochs': 184, 'loss': 'mse', 'optimizer': 'adam', 'graph_mode': 'cutoff', 'cutoff': 0.5703219085923056, 'grm_norm': 'gcn', 'self_loops': False, 'use_snp_selection': True, 'num_snps': 26342}. Best is trial 28 with value: 0.30732090388868005.
[I 2025-12-10 02:48:18,343] Trial 45 finished with value: 0.2591520004342444 and parameters: {'model_type': 'graphsage', 'hidden_dims': '[128, 64]', 'dropout': 0.1651810729045453, 'batch_norm': False, 'sage_aggr': 'max', 'sage_normalize': True, 'sage_project': False, 'lr': 6.330589009966934e-05, 'weight_decay': 1.3682401584715456e-07, 'epochs': 278, 'loss': 'mse', 'optimizer': 'adam', 'graph_mode': 'cutoff', 'cutoff': 0.6184610021546542, 'grm_norm': 'none', 'self_loops': False, 'use_snp_selection': True, 'num_snps': 23342}. Best is trial 28 with value: 0.30732090388868005.
[I 2025-12-10 02:53:06,966] Trial 46 finished with value: 0.2930712955054632 and parameters: {'model_type': 'graphsage', 'hidden_dims': '[512, 256]', 'dropout': 0.13629487612676805, 'batch_norm': False, 'sage_aggr': 'max', 'sage_normalize': False, 'sage_project': False, 'lr': 3.7970600940561335e-05, 'weight_decay': 5.180436825761102e-07, 'epochs': 296, 'loss': 'mse', 'optimizer': 'adam', 'graph_mode': 'knn', 'knn_k': 10, 'weighted_edges': True, 'symmetrize_mode': 'union', 'self_loops': False, 'use_snp_selection': True, 'num_snps': 27808}. Best is trial 28 with value: 0.30732090388868005.
[I 2025-12-10 02:54:37,844] Trial 47 finished with value: 0.29223906605125805 and parameters: {'model_type': 'graphsage', 'hidden_dims': '[256, 128, 64]', 'dropout': 0.2487782321156029, 'batch_norm': False, 'sage_aggr': 'max', 'sage_normalize': False, 'sage_project': False, 'lr': 1.797820446194198e-05, 'weight_decay': 2.9700881466988154e-07, 'epochs': 236, 'loss': 'mse', 'optimizer': 'adam', 'graph_mode': 'cutoff', 'cutoff': 0.20169179067285695, 'grm_norm': 'cosine_then_gcn', 'self_loops': False, 'use_snp_selection': True, 'num_snps': 11864}. Best is trial 28 with value: 0.30732090388868005.
[I 2025-12-10 02:55:23,589] Trial 48 finished with value: 0.28203215702558004 and parameters: {'model_type': 'graphsage', 'hidden_dims': '[256, 128]', 'dropout': 0.30302915421519794, 'batch_norm': True, 'sage_aggr': 'max', 'sage_normalize': False, 'sage_project': False, 'lr': 1.3143342091225147e-05, 'weight_decay': 1.634613070293575e-07, 'epochs': 257, 'loss': 'mse', 'optimizer': 'adam', 'graph_mode': 'cutoff', 'cutoff': 0.3310016759708994, 'grm_norm': 'cosine', 'self_loops': False, 'use_snp_selection': True, 'num_snps': 9328}. Best is trial 28 with value: 0.30732090388868005.
[I 2025-12-10 02:57:08,530] Trial 49 finished with value: 0.2714166973381594 and parameters: {'model_type': 'graphsage', 'hidden_dims': '[512, 256]', 'dropout': 0.19379277639255818, 'batch_norm': False, 'sage_aggr': 'mean', 'sage_normalize': True, 'sage_project': False, 'lr': 4.7130143849500085e-05, 'weight_decay': 4.7312317953021386e-07, 'epochs': 169, 'loss': 'mse', 'optimizer': 'adam', 'graph_mode': 'cutoff', 'cutoff': 0.6745982025548227, 'grm_norm': 'gcn', 'self_loops': False, 'use_snp_selection': True, 'num_snps': 42750}. Best is trial 28 with value: 0.30732090388868005.
[I 2025-12-10 03:01:18,359] Trial 50 finished with value: 0.15056854193600394 and parameters: {'model_type': 'graphsage', 'hidden_dims': '[512, 64]', 'dropout': 0.11987697114123169, 'batch_norm': False, 'sage_aggr': 'max', 'sage_normalize': False, 'sage_project': False, 'lr': 0.0002765460038076855, 'weight_decay': 9.0262529753452e-07, 'epochs': 220, 'loss': 'mae', 'optimizer': 'adam', 'graph_mode': 'knn', 'knn_k': 7, 'weighted_edges': True, 'symmetrize_mode': 'union', 'self_loops': True, 'use_snp_selection': True, 'num_snps': 35509}. Best is trial 28 with value: 0.30732090388868005.
[I 2025-12-10 03:06:22,382] Trial 51 finished with value: 0.30331467144913704 and parameters: {'model_type': 'graphsage', 'hidden_dims': '[256, 128]', 'dropout': 0.17866775086766523, 'batch_norm': False, 'sage_aggr': 'max', 'sage_normalize': False, 'sage_project': False, 'lr': 2.0485919525039805e-05, 'weight_decay': 1.7396030555586373e-07, 'epochs': 302, 'loss': 'mse', 'optimizer': 'adam', 'graph_mode': 'cutoff', 'cutoff': 0.22568839628221238, 'grm_norm': 'none', 'self_loops': False, 'use_snp_selection': True, 'num_snps': 29302}. Best is trial 28 with value: 0.30732090388868005.
[I 2025-12-10 03:10:20,637] Trial 52 finished with value: -0.007131029427272673 and parameters: {'model_type': 'graphsage', 'hidden_dims': '[256, 128]', 'dropout': 0.1714906437095441, 'batch_norm': False, 'sage_aggr': 'max', 'sage_normalize': False, 'sage_project': False, 'lr': 0.0029944582808642734, 'weight_decay': 2.555532225339314e-07, 'epochs': 317, 'loss': 'mse', 'optimizer': 'adam', 'graph_mode': 'cutoff', 'cutoff': 0.23706442750107334, 'grm_norm': 'none', 'self_loops': False, 'use_snp_selection': True, 'num_snps': 25790}. Best is trial 28 with value: 0.30732090388868005.
[I 2025-12-10 03:14:14,068] Trial 53 finished with value: 0.2964069592181489 and parameters: {'model_type': 'graphsage', 'hidden_dims': '[256, 128]', 'dropout': 0.14849034875708403, 'batch_norm': False, 'sage_aggr': 'max', 'sage_normalize': False, 'sage_project': False, 'lr': 2.528536373878022e-05, 'weight_decay': 1.4705409902129396e-07, 'epochs': 272, 'loss': 'mse', 'optimizer': 'adam', 'graph_mode': 'cutoff', 'cutoff': 0.25394364731358265, 'grm_norm': 'none', 'self_loops': False, 'use_snp_selection': True, 'num_snps': 31638}. Best is trial 28 with value: 0.30732090388868005.
[I 2025-12-10 03:16:31,230] Trial 54 finished with value: 0.2914342819685542 and parameters: {'model_type': 'graphsage', 'hidden_dims': '[256, 128]', 'dropout': 0.2146632066612745, 'batch_norm': False, 'sage_aggr': 'max', 'sage_normalize': False, 'sage_project': False, 'lr': 1.3474728516042267e-05, 'weight_decay': 1.0090788838020107e-07, 'epochs': 292, 'loss': 'mse', 'optimizer': 'adam', 'graph_mode': 'cutoff', 'cutoff': 0.2891473518323156, 'grm_norm': 'none', 'self_loops': False, 'use_snp_selection': True, 'num_snps': 22672}. Best is trial 28 with value: 0.30732090388868005.
[I 2025-12-10 03:21:58,747] Trial 55 finished with value: 0.2938857790116664 and parameters: {'model_type': 'graphsage', 'hidden_dims': '[512, 256]', 'dropout': 0.2683019010422864, 'batch_norm': False, 'sage_aggr': 'max', 'sage_normalize': False, 'sage_project': False, 'lr': 1.8864473279113346e-05, 'weight_decay': 3.2305856521204884e-07, 'epochs': 330, 'loss': 'mse', 'optimizer': 'adam', 'graph_mode': 'cutoff', 'cutoff': 0.23385206533733366, 'grm_norm': 'gcn', 'self_loops': False, 'use_snp_selection': True, 'num_snps': 28441}. Best is trial 28 with value: 0.30732090388868005.
[I 2025-12-10 03:22:51,928] Trial 56 finished with value: 0.29047489014270406 and parameters: {'model_type': 'graphsage', 'hidden_dims': '[256, 128]', 'dropout': 0.2359950556684176, 'batch_norm': False, 'sage_aggr': 'max', 'sage_normalize': False, 'sage_project': False, 'lr': 3.718452281460507e-05, 'weight_decay': 5.526870953335321e-07, 'epochs': 230, 'loss': 'mse', 'optimizer': 'adam', 'graph_mode': 'cutoff', 'cutoff': 0.5277727100247439, 'grm_norm': 'none', 'self_loops': False, 'use_snp_selection': True, 'num_snps': 18168}. Best is trial 28 with value: 0.30732090388868005.
[I 2025-12-10 03:27:50,021] Trial 57 finished with value: 0.2827200965007366 and parameters: {'model_type': 'graphsage', 'hidden_dims': '[512, 256]', 'dropout': 0.17989760005857225, 'batch_norm': False, 'sage_aggr': 'max', 'sage_normalize': False, 'sage_project': False, 'lr': 6.861696396597896e-05, 'weight_decay': 1.6530099970680966e-07, 'epochs': 308, 'loss': 'mse', 'optimizer': 'adam', 'graph_mode': 'knn', 'knn_k': 5, 'weighted_edges': True, 'symmetrize_mode': 'union', 'self_loops': True, 'use_snp_selection': False}. Best is trial 28 with value: 0.30732090388868005.
[I 2025-12-10 03:29:55,640] Trial 58 finished with value: 0.29369685260599354 and parameters: {'model_type': 'graphsage', 'hidden_dims': '[512, 128]', 'dropout': 0.3408590023076873, 'batch_norm': False, 'sage_aggr': 'max', 'sage_normalize': False, 'sage_project': False, 'lr': 1.218505779052267e-05, 'weight_decay': 2.0600740973946427e-06, 'epochs': 288, 'loss': 'mae', 'optimizer': 'adam', 'graph_mode': 'cutoff', 'cutoff': 0.4612061096043677, 'grm_norm': 'cosine_then_gcn', 'self_loops': False, 'use_snp_selection': True, 'num_snps': 24989}. Best is trial 28 with value: 0.30732090388868005.
[I 2025-12-10 03:32:32,551] Trial 59 finished with value: 0.2981604333650317 and parameters: {'model_type': 'graphsage', 'hidden_dims': '[128, 64]', 'dropout': 0.12401719512835291, 'batch_norm': False, 'sage_aggr': 'mean', 'sage_normalize': False, 'sage_project': False, 'lr': 2.9871118628323526e-05, 'weight_decay': 2.3564613911632223e-07, 'epochs': 350, 'loss': 'mse', 'optimizer': 'adam', 'graph_mode': 'cutoff', 'cutoff': 0.36902124306998113, 'grm_norm': 'gcn', 'self_loops': False, 'use_snp_selection': True, 'num_snps': 33678}. Best is trial 28 with value: 0.30732090388868005.
[I 2025-12-10 03:36:39,297] Trial 60 finished with value: 0.014750123375422433 and parameters: {'model_type': 'graphsage', 'hidden_dims': '[512, 256]', 'dropout': 0.15695265022358726, 'batch_norm': False, 'sage_aggr': 'max', 'sage_normalize': False, 'sage_project': False, 'lr': 0.0008427082884538246, 'weight_decay': 3.844447193977301e-07, 'epochs': 247, 'loss': 'mse', 'optimizer': 'adam', 'graph_mode': 'cutoff', 'cutoff': 0.31008883024343475, 'grm_norm': 'cosine', 'self_loops': False, 'use_snp_selection': True, 'num_snps': 41151}. Best is trial 28 with value: 0.30732090388868005.
[I 2025-12-10 03:42:10,473] Trial 61 finished with value: 0.30115558012948346 and parameters: {'model_type': 'graphsage', 'hidden_dims': '[256, 128]', 'dropout': 0.18447647962810348, 'batch_norm': False, 'sage_aggr': 'max', 'sage_normalize': False, 'sage_project': False, 'lr': 2.0626637471409507e-05, 'weight_decay': 1.8966626627963362e-07, 'epochs': 304, 'loss': 'mse', 'optimizer': 'adam', 'graph_mode': 'cutoff', 'cutoff': 0.20279943973817202, 'grm_norm': 'none', 'self_loops': False, 'use_snp_selection': True, 'num_snps': 28477}. Best is trial 28 with value: 0.30732090388868005.
[I 2025-12-10 03:45:40,547] Trial 62 finished with value: 0.2975919972869571 and parameters: {'model_type': 'graphsage', 'hidden_dims': '[256, 128]', 'dropout': 0.20975344072395585, 'batch_norm': False, 'sage_aggr': 'max', 'sage_normalize': False, 'sage_project': False, 'lr': 1.90440783417358e-05, 'weight_decay': 1.3134697859483378e-07, 'epochs': 205, 'loss': 'mse', 'optimizer': 'adam', 'graph_mode': 'cutoff', 'cutoff': 0.23266710380784264, 'grm_norm': 'none', 'self_loops': False, 'use_snp_selection': True, 'num_snps': 29801}. Best is trial 28 with value: 0.30732090388868005.
[I 2025-12-10 03:50:55,570] Trial 63 finished with value: 0.29468282384169353 and parameters: {'model_type': 'graphsage', 'hidden_dims': '[256, 128]', 'dropout': 0.19003812240437482, 'batch_norm': False, 'sage_aggr': 'max', 'sage_normalize': False, 'sage_project': False, 'lr': 1.5068483916573138e-05, 'weight_decay': 2.821102054754728e-07, 'epochs': 323, 'loss': 'mse', 'optimizer': 'adam', 'graph_mode': 'cutoff', 'cutoff': 0.2634074010977446, 'grm_norm': 'none', 'self_loops': False, 'use_snp_selection': True, 'num_snps': 36356}. Best is trial 28 with value: 0.30732090388868005.
[I 2025-12-10 03:54:53,254] Trial 64 finished with value: 0.3010987206503425 and parameters: {'model_type': 'graphsage', 'hidden_dims': '[256, 128]', 'dropout': 0.1381173642076587, 'batch_norm': False, 'sage_aggr': 'max', 'sage_normalize': False, 'sage_project': False, 'lr': 2.29366060405238e-05, 'weight_decay': 6.160955047555507e-07, 'epochs': 302, 'loss': 'mse', 'optimizer': 'adam', 'graph_mode': 'cutoff', 'cutoff': 0.20167575196109988, 'grm_norm': 'gcn', 'self_loops': False, 'use_snp_selection': True, 'num_snps': 22352}. Best is trial 28 with value: 0.30732090388868005.
[I 2025-12-10 03:59:32,139] Trial 65 finished with value: 0.29452765242731627 and parameters: {'model_type': 'graphsage', 'hidden_dims': '[256, 128]', 'dropout': 0.16294062308401028, 'batch_norm': False, 'sage_aggr': 'max', 'sage_normalize': False, 'sage_project': False, 'lr': 9.334252517122736e-05, 'weight_decay': 1.873578442470615e-07, 'epochs': 273, 'loss': 'mse', 'optimizer': 'adam', 'graph_mode': 'cutoff', 'cutoff': 0.23242128186977148, 'grm_norm': 'none', 'self_loops': False, 'use_snp_selection': True, 'num_snps': 32228}. Best is trial 28 with value: 0.30732090388868005.
[I 2025-12-10 04:03:15,354] Trial 66 finished with value: 0.2865989154745216 and parameters: {'model_type': 'graphsage', 'hidden_dims': '[512, 256]', 'dropout': 0.11057098921180239, 'batch_norm': False, 'sage_aggr': 'max', 'sage_normalize': False, 'sage_project': False, 'lr': 1.119377504497014e-05, 'weight_decay': 4.15655458832606e-07, 'epochs': 124, 'loss': 'mse', 'optimizer': 'adam', 'graph_mode': 'cutoff', 'cutoff': 0.27980320208034803, 'grm_norm': 'gcn', 'self_loops': True, 'use_snp_selection': True, 'num_snps': 53074}. Best is trial 28 with value: 0.30732090388868005.
