[I 2025-12-06 19:55:46,783] Trial 69 finished with value: 0.2570897440984866 and parameters: {'model_type': 'graphsage', 'hidden_dims': '[512, 64]', 'dropout': 0.10012944341413846, 'batch_norm': False, 'sage_aggr': 'max', 'sage_normalize': False, 'sage_project': False, 'lr': 0.0002193079411973979, 'weight_decay': 0.00031427349999597833, 'epochs': 119, 'loss': 'mae', 'optimizer': 'adam', 'graph_mode': 'cutoff', 'cutoff': 0.8033876556839954, 'grm_norm': 'gcn', 'self_loops': False, 'use_snp_selection': True, 'num_snps': 22971, 'graphsage_batch_size': 64}. Best is trial 54 with value: 0.2578505795866901.
[I 2025-12-06 19:56:36,845] Trial 70 finished with value: 0.21072888723474933 and parameters: {'model_type': 'graphsage', 'hidden_dims': '[512, 64]', 'dropout': 0.10594345385176947, 'batch_norm': False, 'sage_aggr': 'max', 'sage_normalize': False, 'sage_project': False, 'lr': 0.0005629036435346876, 'weight_decay': 0.0003322060087464837, 'epochs': 97, 'loss': 'mae', 'optimizer': 'adam', 'graph_mode': 'cutoff', 'cutoff': 0.608295748051628, 'grm_norm': 'gcn', 'self_loops': False, 'use_snp_selection': True, 'num_snps': 32149, 'graphsage_batch_size': 64}. Best is trial 54 with value: 0.2578505795866901.
[I 2025-12-06 19:57:20,880] Trial 71 finished with value: 0.2507512435022473 and parameters: {'model_type': 'graphsage', 'hidden_dims': '[512, 64]', 'dropout': 0.12112069618294574, 'batch_norm': False, 'sage_aggr': 'max', 'sage_normalize': False, 'sage_project': False, 'lr': 0.00022433178393429192, 'weight_decay': 0.0008850986190162563, 'epochs': 119, 'loss': 'mae', 'optimizer': 'adam', 'graph_mode': 'cutoff', 'cutoff': 0.7962370487416133, 'grm_norm': 'gcn', 'self_loops': False, 'use_snp_selection': True, 'num_snps': 23416, 'graphsage_batch_size': 64}. Best is trial 54 with value: 0.2578505795866901.
[I 2025-12-06 19:58:03,821] Trial 72 finished with value: 0.2620694885940754 and parameters: {'model_type': 'graphsage', 'hidden_dims': '[512, 64]', 'dropout': 0.11631501066103032, 'batch_norm': False, 'sage_aggr': 'max', 'sage_normalize': False, 'sage_project': False, 'lr': 0.00024929991950613814, 'weight_decay': 0.0009111667467541484, 'epochs': 107, 'loss': 'mae', 'optimizer': 'adam', 'graph_mode': 'cutoff', 'cutoff': 0.7972493009216963, 'grm_norm': 'gcn', 'self_loops': False, 'use_snp_selection': True, 'num_snps': 24470, 'graphsage_batch_size': 64}. Best is trial 72 with value: 0.2620694885940754.
[I 2025-12-06 19:58:46,264] Trial 73 finished with value: 0.23854415119588324 and parameters: {'model_type': 'graphsage', 'hidden_dims': '[512, 64]', 'dropout': 0.112169254577951, 'batch_norm': False, 'sage_aggr': 'max', 'sage_normalize': False, 'sage_project': False, 'lr': 0.00042519226737124165, 'weight_decay': 0.00023489897706515883, 'epochs': 89, 'loss': 'mae', 'optimizer': 'adam', 'graph_mode': 'cutoff', 'cutoff': 0.8684560567628354, 'grm_norm': 'gcn', 'self_loops': False, 'use_snp_selection': True, 'num_snps': 27923, 'graphsage_batch_size': 64}. Best is trial 72 with value: 0.2620694885940754.
[I 2025-12-06 19:59:25,060] Trial 74 finished with value: 0.24962847414164865 and parameters: {'model_type': 'graphsage', 'hidden_dims': '[512, 64]', 'dropout': 0.16026382919210908, 'batch_norm': False, 'sage_aggr': 'max', 'sage_normalize': False, 'sage_project': False, 'lr': 0.0001503355157857394, 'weight_decay': 0.0009989504413660793, 'epochs': 102, 'loss': 'mae', 'optimizer': 'adam', 'graph_mode': 'cutoff', 'cutoff': 0.6952174059361512, 'grm_norm': 'gcn', 'self_loops': False, 'use_snp_selection': True, 'num_snps': 21907, 'graphsage_batch_size': 64}. Best is trial 72 with value: 0.2620694885940754.
[I 2025-12-06 19:59:52,574] Trial 75 finished with value: 0.2219273629681302 and parameters: {'model_type': 'graphsage', 'hidden_dims': '[512, 64]', 'dropout': 0.13152289634429246, 'batch_norm': False, 'sage_aggr': 'max', 'sage_normalize': False, 'sage_project': False, 'lr': 0.0002772497553913351, 'weight_decay': 0.0003168235785307082, 'epochs': 74, 'loss': 'mse', 'optimizer': 'adam', 'graph_mode': 'cutoff', 'cutoff': 0.8086648660159732, 'grm_norm': 'gcn', 'self_loops': False, 'use_snp_selection': True, 'num_snps': 15384, 'graphsage_batch_size': 64}. Best is trial 72 with value: 0.2620694885940754.
[I 2025-12-06 20:00:22,083] Trial 76 finished with value: 0.23579792784935374 and parameters: {'model_type': 'graphsage', 'hidden_dims': '[128, 64]', 'dropout': 0.10021480014808988, 'batch_norm': True, 'sage_aggr': 'max', 'sage_normalize': False, 'sage_project': False, 'lr': 0.00030079064251448373, 'weight_decay': 0.0006542750599956487, 'epochs': 135, 'loss': 'mae', 'optimizer': 'adam', 'graph_mode': 'cutoff', 'cutoff': 0.7400908909212066, 'grm_norm': 'cosine_then_gcn', 'self_loops': False, 'use_snp_selection': True, 'num_snps': 25296, 'graphsage_batch_size': 64}. Best is trial 72 with value: 0.2620694885940754.
[I 2025-12-06 20:01:16,800] Trial 77 finished with value: -0.00020943879921692804 and parameters: {'model_type': 'graphsage', 'hidden_dims': '[512, 64]', 'dropout': 0.42076089620486734, 'batch_norm': False, 'sage_aggr': 'max', 'sage_normalize': False, 'sage_project': False, 'lr': 0.0009589782684160122, 'weight_decay': 0.00012622060283136352, 'epochs': 116, 'loss': 'mae', 'optimizer': 'adam', 'graph_mode': 'cutoff', 'cutoff': 0.508983269484482, 'grm_norm': 'gcn', 'self_loops': False, 'use_snp_selection': True, 'num_snps': 29105, 'graphsage_batch_size': 8}. Best is trial 72 with value: 0.2620694885940754.
[I 2025-12-06 20:02:50,282] Trial 78 finished with value: 0.09645333978330035 and parameters: {'model_type': 'graphsage', 'hidden_dims': '[512, 64]', 'dropout': 0.1873468523347379, 'batch_norm': False, 'sage_aggr': 'max', 'sage_normalize': False, 'sage_project': False, 'lr': 0.0004243408471345672, 'weight_decay': 0.00022115601277795336, 'epochs': 106, 'loss': 'mae', 'optimizer': 'adam', 'graph_mode': 'knn', 'knn_k': 8, 'weighted_edges': False, 'symmetrize_mode': 'union', 'self_loops': False, 'use_snp_selection': True, 'num_snps': 32350, 'graphsage_batch_size': 128}. Best is trial 72 with value: 0.2620694885940754.
[I 2025-12-06 20:03:26,566] Trial 79 finished with value: 0.2038319319742738 and parameters: {'model_type': 'graphsage', 'hidden_dims': '[512, 64]', 'dropout': 0.1716156394452249, 'batch_norm': False, 'sage_aggr': 'max', 'sage_normalize': True, 'sage_project': False, 'lr': 0.0001249251811299528, 'weight_decay': 0.000464525123876026, 'epochs': 92, 'loss': 'mae', 'optimizer': 'adam', 'graph_mode': 'cutoff', 'cutoff': 0.8679112835117293, 'grm_norm': 'cosine', 'self_loops': False, 'use_snp_selection': True, 'num_snps': 20761, 'graphsage_batch_size': 256}. Best is trial 72 with value: 0.2620694885940754.
[I 2025-12-06 20:03:53,149] Trial 80 finished with value: 0.23676849209742765 and parameters: {'model_type': 'graphsage', 'hidden_dims': '[256, 128]', 'dropout': 0.12007966250963437, 'batch_norm': False, 'sage_aggr': 'max', 'sage_normalize': False, 'sage_project': False, 'lr': 0.00021724534243209738, 'weight_decay': 0.00037715238360464795, 'epochs': 128, 'loss': 'mae', 'optimizer': 'adam', 'graph_mode': 'cutoff', 'cutoff': 0.8320843444124987, 'grm_norm': 'gcn', 'self_loops': False, 'use_snp_selection': True, 'num_snps': 15211, 'graphsage_batch_size': 64}. Best is trial 72 with value: 0.2620694885940754.
[I 2025-12-06 20:04:36,320] Trial 81 finished with value: 0.2474581646762458 and parameters: {'model_type': 'graphsage', 'hidden_dims': '[512, 64]', 'dropout': 0.12575075149124587, 'batch_norm': False, 'sage_aggr': 'max', 'sage_normalize': False, 'sage_project': False, 'lr': 0.00023697676006361262, 'weight_decay': 0.0009101839144569423, 'epochs': 115, 'loss': 'mae', 'optimizer': 'adam', 'graph_mode': 'cutoff', 'cutoff': 0.7800228337708393, 'grm_norm': 'gcn', 'self_loops': False, 'use_snp_selection': True, 'num_snps': 23442, 'graphsage_batch_size': 64}. Best is trial 72 with value: 0.2620694885940754.
[I 2025-12-06 20:05:16,803] Trial 82 finished with value: 0.2610374676456769 and parameters: {'model_type': 'graphsage', 'hidden_dims': '[512, 64]', 'dropout': 0.15391277784843493, 'batch_norm': False, 'sage_aggr': 'max', 'sage_normalize': False, 'sage_project': False, 'lr': 0.0001592293889054776, 'weight_decay': 0.0005656459878753195, 'epochs': 103, 'loss': 'mae', 'optimizer': 'adam', 'graph_mode': 'cutoff', 'cutoff': 0.7898489672719083, 'grm_norm': 'gcn', 'self_loops': False, 'use_snp_selection': True, 'num_snps': 23253, 'graphsage_batch_size': 64}. Best is trial 72 with value: 0.2620694885940754.
[I 2025-12-06 20:06:06,646] Trial 83 finished with value: 0.21790658928135218 and parameters: {'model_type': 'graphsage', 'hidden_dims': '[512, 64]', 'dropout': 0.15609927073880486, 'batch_norm': False, 'sage_aggr': 'max', 'sage_normalize': False, 'sage_project': False, 'lr': 0.00016422666318976996, 'weight_decay': 0.0005340551562719072, 'epochs': 99, 'loss': 'mae', 'optimizer': 'adam', 'graph_mode': 'cutoff', 'cutoff': 0.4226166904316224, 'grm_norm': 'gcn', 'self_loops': False, 'use_snp_selection': True, 'num_snps': 25279, 'graphsage_batch_size': 64}. Best is trial 72 with value: 0.2620694885940754.
[I 2025-12-06 20:06:56,840] Trial 84 finished with value: 0.2599170229297729 and parameters: {'model_type': 'graphsage', 'hidden_dims': '[512, 64]', 'dropout': 0.13488289879810472, 'batch_norm': False, 'sage_aggr': 'max', 'sage_normalize': False, 'sage_project': False, 'lr': 8.156539569082818e-05, 'weight_decay': 0.0002607215532409096, 'epochs': 172, 'loss': 'mae', 'optimizer': 'adam', 'graph_mode': 'cutoff', 'cutoff': 0.8720418577079644, 'grm_norm': 'gcn', 'self_loops': False, 'use_snp_selection': True, 'num_snps': 20998, 'graphsage_batch_size': 64}. Best is trial 72 with value: 0.2620694885940754.
[I 2025-12-06 20:07:37,261] Trial 85 finished with value: 0.25189200614891927 and parameters: {'model_type': 'graphsage', 'hidden_dims': '[512, 128]', 'dropout': 0.135017735978838, 'batch_norm': False, 'sage_aggr': 'max', 'sage_normalize': False, 'sage_project': False, 'lr': 8.556544994462419e-05, 'weight_decay': 0.0006967532419571833, 'epochs': 113, 'loss': 'mae', 'optimizer': 'adam', 'graph_mode': 'cutoff', 'cutoff': 0.8027842755691371, 'grm_norm': 'gcn', 'self_loops': False, 'use_snp_selection': True, 'num_snps': 21872, 'graphsage_batch_size': 64}. Best is trial 72 with value: 0.2620694885940754.
[I 2025-12-06 20:08:10,466] Trial 86 finished with value: 0.23951416007978604 and parameters: {'model_type': 'graphsage', 'hidden_dims': '[256, 128, 64]', 'dropout': 0.10870728829247756, 'batch_norm': False, 'sage_aggr': 'max', 'sage_normalize': False, 'sage_project': False, 'lr': 7.447543077669457e-05, 'weight_decay': 0.00029228738003090276, 'epochs': 102, 'loss': 'mse', 'optimizer': 'adam', 'graph_mode': 'cutoff', 'cutoff': 0.8371948433599861, 'grm_norm': 'gcn', 'self_loops': False, 'use_snp_selection': True, 'num_snps': 26196, 'graphsage_batch_size': 64}. Best is trial 72 with value: 0.2620694885940754.
[I 2025-12-06 20:08:45,678] Trial 87 finished with value: 0.24439433713113812 and parameters: {'model_type': 'graphsage', 'hidden_dims': '[512, 64]', 'dropout': 0.3444251953227294, 'batch_norm': True, 'sage_aggr': 'max', 'sage_normalize': False, 'sage_project': False, 'lr': 0.00012031249898923972, 'weight_decay': 0.00024390084584496036, 'epochs': 76, 'loss': 'mae', 'optimizer': 'adam', 'graph_mode': 'cutoff', 'cutoff': 0.8771855670123841, 'grm_norm': 'gcn', 'self_loops': False, 'use_snp_selection': True, 'num_snps': 23277, 'graphsage_batch_size': 64}. Best is trial 72 with value: 0.2620694885940754.
[I 2025-12-06 20:09:12,513] Trial 88 finished with value: 0.24026392773806107 and parameters: {'model_type': 'graphsage', 'hidden_dims': '[512, 64]', 'dropout': 0.10096429848433727, 'batch_norm': False, 'sage_aggr': 'max', 'sage_normalize': False, 'sage_project': False, 'lr': 6.0884850171034845e-05, 'weight_decay': 0.0004525495875644701, 'epochs': 61, 'loss': 'mae', 'optimizer': 'adam', 'graph_mode': 'cutoff', 'cutoff': 0.7536956525700316, 'grm_norm': 'gcn', 'self_loops': False, 'use_snp_selection': True, 'num_snps': 16984, 'graphsage_batch_size': 64}. Best is trial 72 with value: 0.2620694885940754.
[I 2025-12-06 20:10:14,558] Trial 89 finished with value: 0.2498189299935715 and parameters: {'model_type': 'graphsage', 'hidden_dims': '[512, 64]', 'dropout': 0.19323386594048086, 'batch_norm': False, 'sage_aggr': 'max', 'sage_normalize': False, 'sage_project': False, 'lr': 0.00016414560420720066, 'weight_decay': 0.0006097241819250939, 'epochs': 156, 'loss': 'mae', 'optimizer': 'adam', 'graph_mode': 'cutoff', 'cutoff': 0.8197737348949333, 'grm_norm': 'gcn', 'self_loops': False, 'use_snp_selection': True, 'num_snps': 30035, 'graphsage_batch_size': 128}. Best is trial 72 with value: 0.2620694885940754.
[I 2025-12-06 20:10:58,368] Trial 90 finished with value: 0.21487696700032116 and parameters: {'model_type': 'graphsage', 'hidden_dims': '[128, 64]', 'dropout': 0.13437684631225136, 'batch_norm': False, 'sage_aggr': 'max', 'sage_normalize': False, 'sage_project': False, 'lr': 8.937943090692078e-05, 'weight_decay': 0.00037655609264648847, 'epochs': 143, 'loss': 'mae', 'optimizer': 'adam', 'graph_mode': 'knn', 'knn_k': 3, 'weighted_edges': True, 'symmetrize_mode': 'union', 'self_loops': False, 'use_snp_selection': True, 'num_snps': 27225, 'graphsage_batch_size': 64}. Best is trial 72 with value: 0.2620694885940754.
[I 2025-12-06 20:11:37,792] Trial 91 finished with value: 0.257399421830485 and parameters: {'model_type': 'graphsage', 'hidden_dims': '[512, 128]', 'dropout': 0.1379539211523669, 'batch_norm': False, 'sage_aggr': 'max', 'sage_normalize': False, 'sage_project': False, 'lr': 7.841410144043865e-05, 'weight_decay': 0.0007771635829510115, 'epochs': 110, 'loss': 'mae', 'optimizer': 'adam', 'graph_mode': 'cutoff', 'cutoff': 0.7953315326600434, 'grm_norm': 'gcn', 'self_loops': False, 'use_snp_selection': True, 'num_snps': 21295, 'graphsage_batch_size': 64}. Best is trial 72 with value: 0.2620694885940754.
[I 2025-12-06 20:12:16,492] Trial 92 finished with value: 0.2512679038141913 and parameters: {'model_type': 'graphsage', 'hidden_dims': '[512, 128]', 'dropout': 0.11364149661731815, 'batch_norm': False, 'sage_aggr': 'max', 'sage_normalize': False, 'sage_project': False, 'lr': 0.00012260915071440605, 'weight_decay': 0.0007408216050292888, 'epochs': 108, 'loss': 'mae', 'optimizer': 'adam', 'graph_mode': 'cutoff', 'cutoff': 0.7922001197573226, 'grm_norm': 'gcn', 'self_loops': False, 'use_snp_selection': True, 'num_snps': 20944, 'graphsage_batch_size': 64}. Best is trial 72 with value: 0.2620694885940754.
[I 2025-12-06 20:12:54,240] Trial 93 finished with value: 0.24945935917382484 and parameters: {'model_type': 'graphsage', 'hidden_dims': '[512, 128]', 'dropout': 0.1236585172785506, 'batch_norm': False, 'sage_aggr': 'max', 'sage_normalize': False, 'sage_project': False, 'lr': 0.00014495470997718754, 'weight_decay': 0.00021296822827047559, 'epochs': 122, 'loss': 'mae', 'optimizer': 'adam', 'graph_mode': 'cutoff', 'cutoff': 0.8370005467552464, 'grm_norm': 'gcn', 'self_loops': False, 'use_snp_selection': True, 'num_snps': 18442, 'graphsage_batch_size': 64}. Best is trial 72 with value: 0.2620694885940754.
[I 2025-12-06 20:13:32,369] Trial 94 finished with value: 0.2555527711347883 and parameters: {'model_type': 'graphsage', 'hidden_dims': '[512, 128]', 'dropout': 0.1696598812617036, 'batch_norm': False, 'sage_aggr': 'max', 'sage_normalize': False, 'sage_project': False, 'lr': 6.462774857670545e-05, 'weight_decay': 0.0002847721240296089, 'epochs': 89, 'loss': 'mae', 'optimizer': 'adam', 'graph_mode': 'cutoff', 'cutoff': 0.8766008015242092, 'grm_norm': 'cosine_then_gcn', 'self_loops': False, 'use_snp_selection': True, 'num_snps': 23134, 'graphsage_batch_size': 8}. Best is trial 72 with value: 0.2620694885940754.
[I 2025-12-06 20:14:10,989] Trial 95 finished with value: 0.2458093989791939 and parameters: {'model_type': 'graphsage', 'hidden_dims': '[512, 128]', 'dropout': 0.17052575018259825, 'batch_norm': False, 'sage_aggr': 'max', 'sage_normalize': False, 'sage_project': False, 'lr': 6.047495310636258e-05, 'weight_decay': 0.00048634978948064635, 'epochs': 92, 'loss': 'mae', 'optimizer': 'adam', 'graph_mode': 'cutoff', 'cutoff': 0.8848378238757457, 'grm_norm': 'cosine_then_gcn', 'self_loops': False, 'use_snp_selection': True, 'num_snps': 22998, 'graphsage_batch_size': 8}. Best is trial 72 with value: 0.2620694885940754.
[I 2025-12-06 20:14:56,782] Trial 96 finished with value: 0.23430709877291567 and parameters: {'model_type': 'graphsage', 'hidden_dims': '[512, 128]', 'dropout': 0.2064296472206953, 'batch_norm': False, 'sage_aggr': 'max', 'sage_normalize': True, 'sage_project': False, 'lr': 3.997196335399618e-05, 'weight_decay': 0.00031683061799059564, 'epochs': 105, 'loss': 'mae', 'optimizer': 'adam', 'graph_mode': 'cutoff', 'cutoff': 0.7688383266425606, 'grm_norm': 'cosine_then_gcn', 'self_loops': False, 'use_snp_selection': True, 'num_snps': 26261, 'graphsage_batch_size': 8}. Best is trial 72 with value: 0.2620694885940754.
[I 2025-12-06 20:15:32,380] Trial 97 finished with value: 0.2513187667469522 and parameters: {'model_type': 'graphsage', 'hidden_dims': '[512, 128]', 'dropout': 0.15593749824590256, 'batch_norm': False, 'sage_aggr': 'max', 'sage_normalize': False, 'sage_project': False, 'lr': 7.397794433784897e-05, 'weight_decay': 0.00013377562941821686, 'epochs': 83, 'loss': 'mae', 'optimizer': 'adam', 'graph_mode': 'cutoff', 'cutoff': 0.8447246411828517, 'grm_norm': 'cosine_then_gcn', 'self_loops': False, 'use_snp_selection': True, 'num_snps': 22290, 'graphsage_batch_size': 8}. Best is trial 72 with value: 0.2620694885940754.
[I 2025-12-06 20:15:55,760] Trial 98 finished with value: 0.24223055076095812 and parameters: {'model_type': 'graphsage', 'hidden_dims': '[512, 128]', 'dropout': 0.14031838578546574, 'batch_norm': False, 'sage_aggr': 'max', 'sage_normalize': False, 'sage_project': False, 'lr': 5.294699566106991e-05, 'weight_decay': 0.000794922173326919, 'epochs': 79, 'loss': 'mae', 'optimizer': 'adam', 'graph_mode': 'cutoff', 'cutoff': 0.7176233595479171, 'grm_norm': 'cosine', 'self_loops': False, 'use_snp_selection': True, 'num_snps': 9430, 'graphsage_batch_size': 256}. Best is trial 72 with value: 0.2620694885940754.
[I 2025-12-06 20:16:40,484] Trial 99 finished with value: 0.2339459413480741 and parameters: {'model_type': 'graphsage', 'hidden_dims': '[256, 128]', 'dropout': 0.1497791079649477, 'batch_norm': False, 'sage_aggr': 'max', 'sage_normalize': False, 'sage_project': False, 'lr': 0.00033701647758161915, 'weight_decay': 0.0005724687771209522, 'epochs': 134, 'loss': 'mse', 'optimizer': 'adam', 'graph_mode': 'cutoff', 'cutoff': 0.804547477725259, 'grm_norm': 'gcn', 'self_loops': False, 'use_snp_selection': True, 'num_snps': 35031, 'graphsage_batch_size': 32}. Best is trial 72 with value: 0.2620694885940754.
[I 2025-12-06 20:17:13,639] Trial 100 finished with value: 0.24289602526121595 and parameters: {'model_type': 'graphsage', 'hidden_dims': '[512, 128]', 'dropout': 0.18116019627749788, 'batch_norm': False, 'sage_aggr': 'max', 'sage_normalize': False, 'sage_project': False, 'lr': 3.120107363721899e-05, 'weight_decay': 0.0004331659722594227, 'epochs': 90, 'loss': 'mae', 'optimizer': 'adam', 'graph_mode': 'cutoff', 'cutoff': 0.8804879140767063, 'grm_norm': 'cosine_then_gcn', 'self_loops': False, 'use_snp_selection': True, 'num_snps': 18453, 'graphsage_batch_size': 8}. Best is trial 72 with value: 0.2620694885940754.
[I 2025-12-06 20:17:51,198] Trial 101 finished with value: 0.2532142830649735 and parameters: {'model_type': 'graphsage', 'hidden_dims': '[512, 64]', 'dropout': 0.11140491739075255, 'batch_norm': False, 'sage_aggr': 'max', 'sage_normalize': False, 'sage_project': False, 'lr': 0.00010487840934434792, 'weight_decay': 0.0002753032028927698, 'epochs': 113, 'loss': 'mae', 'optimizer': 'adam', 'graph_mode': 'cutoff', 'cutoff': 0.8490307950973839, 'grm_norm': 'gcn', 'self_loops': False, 'use_snp_selection': True, 'num_snps': 19710, 'graphsage_batch_size': 512}. Best is trial 72 with value: 0.2620694885940754.
[I 2025-12-06 20:19:07,645] Trial 102 finished with value: 0.23889293385785887 and parameters: {'model_type': 'graphsage', 'hidden_dims': '[512, 64]', 'dropout': 0.12846516511311776, 'batch_norm': False, 'sage_aggr': 'max', 'sage_normalize': False, 'sage_project': False, 'lr': 9.398981199708383e-05, 'weight_decay': 0.0001970158476661681, 'epochs': 100, 'loss': 'mae', 'optimizer': 'adam', 'graph_mode': 'cutoff', 'cutoff': 0.867226070606013, 'grm_norm': 'gcn', 'self_loops': False, 'use_snp_selection': True, 'num_snps': 54966, 'graphsage_batch_size': 64}. Best is trial 72 with value: 0.2620694885940754.
[I 2025-12-06 20:19:42,580] Trial 103 finished with value: 0.25321000181169084 and parameters: {'model_type': 'graphsage', 'hidden_dims': '[512, 64]', 'dropout': 0.1666256667808483, 'batch_norm': False, 'sage_aggr': 'max', 'sage_normalize': False, 'sage_project': False, 'lr': 0.0001548675082530746, 'weight_decay': 0.0009927615502048168, 'epochs': 95, 'loss': 'mae', 'optimizer': 'adam', 'graph_mode': 'cutoff', 'cutoff': 0.8155211602730347, 'grm_norm': 'gcn', 'self_loops': False, 'use_snp_selection': True, 'num_snps': 19892, 'graphsage_batch_size': 512}. Best is trial 72 with value: 0.2620694885940754.
[I 2025-12-06 20:20:25,607] Trial 104 finished with value: 0.24636632333470648 and parameters: {'model_type': 'graphsage', 'hidden_dims': '[256, 128, 64]', 'dropout': 0.11820297371520465, 'batch_norm': False, 'sage_aggr': 'max', 'sage_normalize': False, 'sage_project': False, 'lr': 7.91561404679079e-05, 'weight_decay': 0.00010677669665939342, 'epochs': 187, 'loss': 'mae', 'optimizer': 'adam', 'graph_mode': 'cutoff', 'cutoff': 0.8541703725653663, 'grm_norm': 'gcn', 'self_loops': False, 'use_snp_selection': True, 'num_snps': 24908, 'graphsage_batch_size': 512}. Best is trial 72 with value: 0.2620694885940754.
