[I 2025-12-08 18:14:59,645] Trial 78 finished with value: 0.2967121732306245 and parameters: {'model_type': 'graphsage', 'hidden_dims': '[512, 128]', 'dropout': 0.12935078530956917, 'batch_norm': True, 'sage_aggr': 'mean', 'sage_normalize': False, 'sage_project': False, 'lr': 4.945757698766525e-05, 'weight_decay': 1.2529887383076681e-06, 'epochs': 277, 'loss': 'mse', 'optimizer': 'adam', 'graph_mode': 'cutoff', 'cutoff': 0.8756054902039581, 'grm_norm': 'gcn', 'self_loops': False, 'use_snp_selection': True, 'num_snps': 49532}. Best is trial 52 with value: 0.3010667019795393.
[I 2025-12-08 18:17:25,708] Trial 79 finished with value: 0.2972659578244586 and parameters: {'model_type': 'graphsage', 'hidden_dims': '[512, 128]', 'dropout': 0.12825191812951023, 'batch_norm': True, 'sage_aggr': 'mean', 'sage_normalize': False, 'sage_project': False, 'lr': 4.946942946385298e-05, 'weight_decay': 1.2514669448438957e-06, 'epochs': 268, 'loss': 'mse', 'optimizer': 'adam', 'graph_mode': 'cutoff', 'cutoff': 0.8555503600894775, 'grm_norm': 'gcn', 'self_loops': False, 'use_snp_selection': True, 'num_snps': 53987}. Best is trial 52 with value: 0.3010667019795393.
[I 2025-12-08 18:19:49,197] Trial 80 finished with value: 0.30126905497371104 and parameters: {'model_type': 'graphsage', 'hidden_dims': '[512, 128]', 'dropout': 0.11646108823581859, 'batch_norm': True, 'sage_aggr': 'mean', 'sage_normalize': True, 'sage_project': False, 'lr': 2.7182411197641297e-05, 'weight_decay': 1.230819369689472e-06, 'epochs': 312, 'loss': 'mse', 'optimizer': 'adam', 'graph_mode': 'cutoff', 'cutoff': 0.8347356483890718, 'grm_norm': 'gcn', 'self_loops': False, 'use_snp_selection': False}. Best is trial 80 with value: 0.30126905497371104.
[I 2025-12-08 18:22:16,162] Trial 81 finished with value: 0.29296782961177864 and parameters: {'model_type': 'graphsage', 'hidden_dims': '[512, 128]', 'dropout': 0.11469691461450092, 'batch_norm': True, 'sage_aggr': 'mean', 'sage_normalize': True, 'sage_project': False, 'lr': 2.3681295730926583e-05, 'weight_decay': 1.0876464173888598e-06, 'epochs': 321, 'loss': 'mse', 'optimizer': 'adam', 'graph_mode': 'cutoff', 'cutoff': 0.893927995781531, 'grm_norm': 'gcn', 'self_loops': False, 'use_snp_selection': False}. Best is trial 80 with value: 0.30126905497371104.
[I 2025-12-08 18:24:38,105] Trial 82 finished with value: 0.29172272691375145 and parameters: {'model_type': 'graphsage', 'hidden_dims': '[512, 128]', 'dropout': 0.12826995049561213, 'batch_norm': True, 'sage_aggr': 'mean', 'sage_normalize': True, 'sage_project': False, 'lr': 2.7567661152526135e-05, 'weight_decay': 1.2064188100554888e-06, 'epochs': 309, 'loss': 'mse', 'optimizer': 'adam', 'graph_mode': 'cutoff', 'cutoff': 0.8535680824107239, 'grm_norm': 'gcn', 'self_loops': False, 'use_snp_selection': False}. Best is trial 80 with value: 0.30126905497371104.
[I 2025-12-08 18:26:43,519] Trial 83 finished with value: 0.2961796936827992 and parameters: {'model_type': 'graphsage', 'hidden_dims': '[512, 128]', 'dropout': 0.11433222207582272, 'batch_norm': True, 'sage_aggr': 'mean', 'sage_normalize': True, 'sage_project': False, 'lr': 4.818906232948319e-05, 'weight_decay': 1.4564555181634775e-06, 'epochs': 269, 'loss': 'mse', 'optimizer': 'adam', 'graph_mode': 'cutoff', 'cutoff': 0.7812661309877024, 'grm_norm': 'gcn', 'self_loops': False, 'use_snp_selection': False}. Best is trial 80 with value: 0.30126905497371104.
[I 2025-12-08 18:28:51,037] Trial 84 finished with value: 0.29679457931368997 and parameters: {'model_type': 'graphsage', 'hidden_dims': '[512, 128]', 'dropout': 0.10640134795601909, 'batch_norm': True, 'sage_aggr': 'mean', 'sage_normalize': True, 'sage_project': False, 'lr': 3.3468909269717176e-05, 'weight_decay': 1.5998944122263393e-06, 'epochs': 274, 'loss': 'mse', 'optimizer': 'adam', 'graph_mode': 'cutoff', 'cutoff': 0.7639052059388638, 'grm_norm': 'gcn', 'self_loops': False, 'use_snp_selection': False}. Best is trial 80 with value: 0.30126905497371104.
[I 2025-12-08 18:30:58,631] Trial 85 finished with value: 0.29483588722580295 and parameters: {'model_type': 'graphsage', 'hidden_dims': '[512, 128]', 'dropout': 0.10150863329046109, 'batch_norm': True, 'sage_aggr': 'mean', 'sage_normalize': True, 'sage_project': False, 'lr': 3.0371929707275498e-05, 'weight_decay': 2.6860979672472594e-06, 'epochs': 274, 'loss': 'mse', 'optimizer': 'adam', 'graph_mode': 'cutoff', 'cutoff': 0.7213477497766719, 'grm_norm': 'gcn', 'self_loops': False, 'use_snp_selection': False}. Best is trial 80 with value: 0.30126905497371104.
[I 2025-12-08 18:33:30,643] Trial 86 finished with value: 0.29271664650892737 and parameters: {'model_type': 'graphsage', 'hidden_dims': '[512, 128]', 'dropout': 0.13846880047957938, 'batch_norm': True, 'sage_aggr': 'max', 'sage_normalize': True, 'sage_project': False, 'lr': 4.851892854867813e-05, 'weight_decay': 3.942870951736972e-06, 'epochs': 333, 'loss': 'mse', 'optimizer': 'adam', 'graph_mode': 'cutoff', 'cutoff': 0.8476312954389387, 'grm_norm': 'gcn', 'self_loops': False, 'use_snp_selection': False}. Best is trial 80 with value: 0.30126905497371104.
[I 2025-12-08 18:34:44,053] Trial 87 finished with value: 0.28583559463361813 and parameters: {'model_type': 'graphsage', 'hidden_dims': '[256, 128, 64]', 'dropout': 0.15553286891300852, 'batch_norm': True, 'sage_aggr': 'mean', 'sage_normalize': True, 'sage_project': False, 'lr': 3.615393341068397e-05, 'weight_decay': 2.1080935055852102e-06, 'epochs': 270, 'loss': 'mse', 'optimizer': 'adam', 'graph_mode': 'cutoff', 'cutoff': 0.8854999870850975, 'grm_norm': 'gcn', 'self_loops': False, 'use_snp_selection': False}. Best is trial 80 with value: 0.30126905497371104.
[I 2025-12-08 18:37:03,074] Trial 88 finished with value: 0.28646759899698154 and parameters: {'model_type': 'graphsage', 'hidden_dims': '[512, 128]', 'dropout': 0.5985831748875248, 'batch_norm': True, 'sage_aggr': 'mean', 'sage_normalize': True, 'sage_project': False, 'lr': 1.9627630432693683e-05, 'weight_decay': 1.4873766582723198e-06, 'epochs': 301, 'loss': 'mse', 'optimizer': 'adam', 'graph_mode': 'cutoff', 'cutoff': 0.8724052709433023, 'grm_norm': 'gcn', 'self_loops': False, 'use_snp_selection': False}. Best is trial 80 with value: 0.30126905497371104.
[I 2025-12-08 18:39:39,960] Trial 89 finished with value: 0.2876061546411801 and parameters: {'model_type': 'graphsage', 'hidden_dims': '[512, 128]', 'dropout': 0.10020071885555537, 'batch_norm': True, 'sage_aggr': 'mean', 'sage_normalize': True, 'sage_project': False, 'lr': 4.7258697090302874e-05, 'weight_decay': 5.065557762037858e-06, 'epochs': 247, 'loss': 'mse', 'optimizer': 'adam', 'graph_mode': 'knn', 'knn_k': 5, 'weighted_edges': True, 'symmetrize_mode': 'union', 'self_loops': False, 'use_snp_selection': False}. Best is trial 80 with value: 0.30126905497371104.
[I 2025-12-08 18:41:40,617] Trial 90 finished with value: 0.2966493553066474 and parameters: {'model_type': 'graphsage', 'hidden_dims': '[512, 128]', 'dropout': 0.13797856034065772, 'batch_norm': True, 'sage_aggr': 'mean', 'sage_normalize': True, 'sage_project': False, 'lr': 2.070377114898579e-05, 'weight_decay': 2.3260918572471524e-06, 'epochs': 257, 'loss': 'mse', 'optimizer': 'adam', 'graph_mode': 'cutoff', 'cutoff': 0.7599174966031671, 'grm_norm': 'gcn', 'self_loops': False, 'use_snp_selection': False}. Best is trial 80 with value: 0.30126905497371104.
[I 2025-12-08 18:43:52,038] Trial 91 finished with value: 0.2907031963270956 and parameters: {'model_type': 'graphsage', 'hidden_dims': '[512, 128]', 'dropout': 0.1405465635392979, 'batch_norm': True, 'sage_aggr': 'mean', 'sage_normalize': True, 'sage_project': False, 'lr': 1.4859590999395145e-05, 'weight_decay': 7.755462535724398e-07, 'epochs': 283, 'loss': 'mse', 'optimizer': 'adam', 'graph_mode': 'cutoff', 'cutoff': 0.7714088777376065, 'grm_norm': 'gcn', 'self_loops': False, 'use_snp_selection': False}. Best is trial 80 with value: 0.30126905497371104.
[I 2025-12-08 18:45:56,541] Trial 92 finished with value: 0.29603272113110163 and parameters: {'model_type': 'graphsage', 'hidden_dims': '[512, 128]', 'dropout': 0.11034184181911653, 'batch_norm': True, 'sage_aggr': 'mean', 'sage_normalize': True, 'sage_project': False, 'lr': 1.0919002657918903e-05, 'weight_decay': 1.7340869166185261e-06, 'epochs': 267, 'loss': 'mse', 'optimizer': 'adam', 'graph_mode': 'cutoff', 'cutoff': 0.8331627409448735, 'grm_norm': 'gcn', 'self_loops': False, 'use_snp_selection': False}. Best is trial 80 with value: 0.30126905497371104.
[I 2025-12-08 18:47:57,461] Trial 93 finished with value: 0.2957643283008608 and parameters: {'model_type': 'graphsage', 'hidden_dims': '[512, 128]', 'dropout': 0.12643847213052856, 'batch_norm': True, 'sage_aggr': 'mean', 'sage_normalize': True, 'sage_project': False, 'lr': 3.158831568891351e-05, 'weight_decay': 2.2833053657948067e-06, 'epochs': 258, 'loss': 'mse', 'optimizer': 'adam', 'graph_mode': 'cutoff', 'cutoff': 0.7237409883115216, 'grm_norm': 'gcn', 'self_loops': False, 'use_snp_selection': False}. Best is trial 80 with value: 0.30126905497371104.
[I 2025-12-08 18:49:49,802] Trial 94 finished with value: 0.29483622546840427 and parameters: {'model_type': 'graphsage', 'hidden_dims': '[512, 128]', 'dropout': 0.1626909184963827, 'batch_norm': True, 'sage_aggr': 'mean', 'sage_normalize': True, 'sage_project': False, 'lr': 2.0604868852320637e-05, 'weight_decay': 9.645255779547069e-07, 'epochs': 238, 'loss': 'mse', 'optimizer': 'adam', 'graph_mode': 'cutoff', 'cutoff': 0.7476991272562713, 'grm_norm': 'gcn', 'self_loops': False, 'use_snp_selection': False}. Best is trial 80 with value: 0.30126905497371104.
[I 2025-12-08 18:52:02,224] Trial 95 finished with value: 0.2966557716802134 and parameters: {'model_type': 'graphsage', 'hidden_dims': '[512, 128]', 'dropout': 0.1965137029614083, 'batch_norm': True, 'sage_aggr': 'mean', 'sage_normalize': True, 'sage_project': False, 'lr': 5.452437273952196e-05, 'weight_decay': 1.3952562522928188e-06, 'epochs': 283, 'loss': 'mse', 'optimizer': 'adam', 'graph_mode': 'cutoff', 'cutoff': 0.6582845475785845, 'grm_norm': 'gcn', 'self_loops': False, 'use_snp_selection': False}. Best is trial 80 with value: 0.30126905497371104.
[I 2025-12-08 18:54:21,021] Trial 96 finished with value: 0.29913324773156186 and parameters: {'model_type': 'graphsage', 'hidden_dims': '[512, 128]', 'dropout': 0.19031140372323613, 'batch_norm': True, 'sage_aggr': 'mean', 'sage_normalize': True, 'sage_project': False, 'lr': 5.584833652074217e-05, 'weight_decay': 3.5435607670950493e-06, 'epochs': 299, 'loss': 'mse', 'optimizer': 'adam', 'graph_mode': 'cutoff', 'cutoff': 0.6913570054198742, 'grm_norm': 'gcn', 'self_loops': True, 'use_snp_selection': False}. Best is trial 80 with value: 0.30126905497371104.
[I 2025-12-08 18:55:45,973] Trial 97 finished with value: 0.24361506884122847 and parameters: {'model_type': 'graphsage', 'hidden_dims': '[256, 128, 64]', 'dropout': 0.2030339550928162, 'batch_norm': False, 'sage_aggr': 'mean', 'sage_normalize': True, 'sage_project': False, 'lr': 6.70131654514691e-05, 'weight_decay': 3.7411802616877134e-06, 'epochs': 316, 'loss': 'mse', 'optimizer': 'adam', 'graph_mode': 'cutoff', 'cutoff': 0.6453639303919511, 'grm_norm': 'gcn', 'self_loops': True, 'use_snp_selection': False}. Best is trial 80 with value: 0.30126905497371104.
[I 2025-12-08 18:57:57,718] Trial 98 finished with value: 0.29646400134707396 and parameters: {'model_type': 'graphsage', 'hidden_dims': '[512, 128]', 'dropout': 0.1922453644764771, 'batch_norm': True, 'sage_aggr': 'mean', 'sage_normalize': True, 'sage_project': False, 'lr': 5.7214230842318566e-05, 'weight_decay': 8.241605567212816e-06, 'epochs': 283, 'loss': 'mse', 'optimizer': 'adam', 'graph_mode': 'cutoff', 'cutoff': 0.7021626524813677, 'grm_norm': 'gcn', 'self_loops': True, 'use_snp_selection': False}. Best is trial 80 with value: 0.30126905497371104.
[I 2025-12-08 18:59:16,953] Trial 99 finished with value: 0.2929759275591179 and parameters: {'model_type': 'graphsage', 'hidden_dims': '[256, 128]', 'dropout': 0.15873274288550682, 'batch_norm': True, 'sage_aggr': 'max', 'sage_normalize': True, 'sage_project': False, 'lr': 7.969015847443879e-05, 'weight_decay': 0.00028423046085177185, 'epochs': 297, 'loss': 'mse', 'optimizer': 'adam', 'graph_mode': 'cutoff', 'cutoff': 0.6819574579324121, 'grm_norm': 'gcn', 'self_loops': True, 'use_snp_selection': False}. Best is trial 80 with value: 0.30126905497371104.
[I 2025-12-08 19:01:48,394] Trial 100 finished with value: 0.29571094576938883 and parameters: {'model_type': 'graphsage', 'hidden_dims': '[512, 128]', 'dropout': 0.22788221630729855, 'batch_norm': True, 'sage_aggr': 'mean', 'sage_normalize': True, 'sage_project': False, 'lr': 4.139091005903131e-05, 'weight_decay': 5.722252674956508e-06, 'epochs': 323, 'loss': 'mse', 'optimizer': 'adam', 'graph_mode': 'cutoff', 'cutoff': 0.5608778247042056, 'grm_norm': 'cosine_then_gcn', 'self_loops': True, 'use_snp_selection': False}. Best is trial 80 with value: 0.30126905497371104.
[I 2025-12-08 19:04:11,526] Trial 101 finished with value: 0.295784552284723 and parameters: {'model_type': 'graphsage', 'hidden_dims': '[512, 128]', 'dropout': 0.13702958850559077, 'batch_norm': True, 'sage_aggr': 'mean', 'sage_normalize': True, 'sage_project': False, 'lr': 1.6852309004854748e-05, 'weight_decay': 2.5755414536959545e-06, 'epochs': 310, 'loss': 'mse', 'optimizer': 'adam', 'graph_mode': 'cutoff', 'cutoff': 0.7489928789181027, 'grm_norm': 'gcn', 'self_loops': True, 'use_snp_selection': False}. Best is trial 80 with value: 0.30126905497371104.
[I 2025-12-08 19:06:12,910] Trial 102 finished with value: 0.2903488197265829 and parameters: {'model_type': 'graphsage', 'hidden_dims': '[512, 128]', 'dropout': 0.1497430541340284, 'batch_norm': True, 'sage_aggr': 'mean', 'sage_normalize': True, 'sage_project': False, 'lr': 3.0714097879846614e-05, 'weight_decay': 1.2064225878748037e-06, 'epochs': 258, 'loss': 'mse', 'optimizer': 'adam', 'graph_mode': 'cutoff', 'cutoff': 0.8677928826503455, 'grm_norm': 'gcn', 'self_loops': False, 'use_snp_selection': False}. Best is trial 80 with value: 0.30126905497371104.
[I 2025-12-08 19:08:30,980] Trial 103 finished with value: 0.29624503714691264 and parameters: {'model_type': 'graphsage', 'hidden_dims': '[512, 128]', 'dropout': 0.1695767339868096, 'batch_norm': True, 'sage_aggr': 'mean', 'sage_normalize': True, 'sage_project': False, 'lr': 2.4514809541274635e-05, 'weight_decay': 7.173846876315019e-07, 'epochs': 296, 'loss': 'mse', 'optimizer': 'adam', 'graph_mode': 'cutoff', 'cutoff': 0.6424894649341787, 'grm_norm': 'gcn', 'self_loops': False, 'use_snp_selection': False}. Best is trial 80 with value: 0.30126905497371104.
[I 2025-12-08 19:10:41,829] Trial 104 finished with value: 0.28351456531991037 and parameters: {'model_type': 'graphsage', 'hidden_dims': '[512, 128]', 'dropout': 0.5679168490658013, 'batch_norm': True, 'sage_aggr': 'mean', 'sage_normalize': True, 'sage_project': False, 'lr': 5.535881051847636e-05, 'weight_decay': 1.904276689551028e-06, 'epochs': 281, 'loss': 'mse', 'optimizer': 'adam', 'graph_mode': 'cutoff', 'cutoff': 0.840930888572242, 'grm_norm': 'gcn', 'self_loops': False, 'use_snp_selection': False}. Best is trial 80 with value: 0.30126905497371104.
[I 2025-12-08 19:13:13,434] Trial 105 finished with value: 0.29870530623137853 and parameters: {'model_type': 'graphsage', 'hidden_dims': '[512, 128]', 'dropout': 0.12715407828270342, 'batch_norm': True, 'sage_aggr': 'mean', 'sage_normalize': True, 'sage_project': False, 'lr': 3.5165994283317944e-05, 'weight_decay': 3.1474090127650992e-06, 'epochs': 330, 'loss': 'mse', 'optimizer': 'adam', 'graph_mode': 'cutoff', 'cutoff': 0.798381062954018, 'grm_norm': 'gcn', 'self_loops': True, 'use_snp_selection': False}. Best is trial 80 with value: 0.30126905497371104.
[I 2025-12-08 19:17:09,723] Trial 106 finished with value: 0.27758496205167005 and parameters: {'model_type': 'graphsage', 'hidden_dims': '[512, 128]', 'dropout': 0.46662513176696074, 'batch_norm': True, 'sage_aggr': 'mean', 'sage_normalize': True, 'sage_project': False, 'lr': 3.628071816611301e-05, 'weight_decay': 3.6666934346599895e-06, 'epochs': 333, 'loss': 'mse', 'optimizer': 'adam', 'graph_mode': 'knn', 'knn_k': 10, 'weighted_edges': False, 'symmetrize_mode': 'mutual', 'self_loops': True, 'use_snp_selection': False}. Best is trial 80 with value: 0.30126905497371104.
[I 2025-12-08 19:19:48,530] Trial 107 finished with value: 0.2955754524928336 and parameters: {'model_type': 'graphsage', 'hidden_dims': '[512, 128]', 'dropout': 0.12497061986561848, 'batch_norm': True, 'sage_aggr': 'mean', 'sage_normalize': True, 'sage_project': False, 'lr': 4.259786331506004e-05, 'weight_decay': 1.1436343853406652e-05, 'epochs': 347, 'loss': 'mse', 'optimizer': 'adam', 'graph_mode': 'cutoff', 'cutoff': 0.7926659021035063, 'grm_norm': 'gcn', 'self_loops': True, 'use_snp_selection': False}. Best is trial 80 with value: 0.30126905497371104.
[I 2025-12-08 19:22:48,764] Trial 108 finished with value: 0.29101549531258275 and parameters: {'model_type': 'graphsage', 'hidden_dims': '[512, 128]', 'dropout': 0.149961943772866, 'batch_norm': True, 'sage_aggr': 'mean', 'sage_normalize': True, 'sage_project': False, 'lr': 8.02582131013855e-05, 'weight_decay': 1.5439201149612554e-06, 'epochs': 337, 'loss': 'mse', 'optimizer': 'adam', 'graph_mode': 'cutoff', 'cutoff': 0.3851846020396318, 'grm_norm': 'gcn', 'self_loops': True, 'use_snp_selection': False}. Best is trial 80 with value: 0.30126905497371104.
[I 2025-12-08 19:24:12,442] Trial 109 finished with value: 0.2823250693099407 and parameters: {'model_type': 'graphsage', 'hidden_dims': '[256, 128, 64]', 'dropout': 0.3284563304244899, 'batch_norm': True, 'sage_aggr': 'mean', 'sage_normalize': True, 'sage_project': False, 'lr': 6.532769597956718e-05, 'weight_decay': 1.0388041204790704e-06, 'epochs': 313, 'loss': 'mse', 'optimizer': 'adam', 'graph_mode': 'cutoff', 'cutoff': 0.8270738913658574, 'grm_norm': 'gcn', 'self_loops': True, 'use_snp_selection': False}. Best is trial 80 with value: 0.30126905497371104.
[I 2025-12-08 19:26:44,184] Trial 110 finished with value: 0.28612767507611114 and parameters: {'model_type': 'graphsage', 'hidden_dims': '[512, 128]', 'dropout': 0.3669959103161033, 'batch_norm': True, 'sage_aggr': 'mean', 'sage_normalize': False, 'sage_project': False, 'lr': 5.399225100767314e-05, 'weight_decay': 8.571994196356262e-07, 'epochs': 306, 'loss': 'mse', 'optimizer': 'adam', 'graph_mode': 'cutoff', 'cutoff': 0.8662665142125118, 'grm_norm': 'gcn', 'self_loops': True, 'use_snp_selection': True, 'num_snps': 49415}. Best is trial 80 with value: 0.30126905497371104.
[I 2025-12-08 19:29:13,377] Trial 111 finished with value: 0.30063743697423534 and parameters: {'model_type': 'graphsage', 'hidden_dims': '[512, 128]', 'dropout': 0.13578311897302683, 'batch_norm': True, 'sage_aggr': 'mean', 'sage_normalize': True, 'sage_project': False, 'lr': 2.6753717631614716e-05, 'weight_decay': 2.360601874068701e-06, 'epochs': 324, 'loss': 'mse', 'optimizer': 'adam', 'graph_mode': 'cutoff', 'cutoff': 0.8038343136919344, 'grm_norm': 'gcn', 'self_loops': False, 'use_snp_selection': False}. Best is trial 80 with value: 0.30126905497371104.
[I 2025-12-08 19:31:49,887] Trial 112 finished with value: 0.3006013054901514 and parameters: {'model_type': 'graphsage', 'hidden_dims': '[512, 128]', 'dropout': 0.10815284726357946, 'batch_norm': True, 'sage_aggr': 'mean', 'sage_normalize': True, 'sage_project': False, 'lr': 2.762023685764591e-05, 'weight_decay': 2.959476691730184e-06, 'epochs': 341, 'loss': 'mse', 'optimizer': 'adam', 'graph_mode': 'cutoff', 'cutoff': 0.7975733931720131, 'grm_norm': 'gcn', 'self_loops': False, 'use_snp_selection': False}. Best is trial 80 with value: 0.30126905497371104.
[I 2025-12-08 19:34:21,579] Trial 113 finished with value: 0.2957415225216512 and parameters: {'model_type': 'graphsage', 'hidden_dims': '[512, 128]', 'dropout': 0.10966355543085438, 'batch_norm': True, 'sage_aggr': 'mean', 'sage_normalize': True, 'sage_project': False, 'lr': 2.8672090711630725e-05, 'weight_decay': 3.2192694607735922e-06, 'epochs': 330, 'loss': 'mse', 'optimizer': 'adam', 'graph_mode': 'cutoff', 'cutoff': 0.8109263595974647, 'grm_norm': 'gcn', 'self_loops': False, 'use_snp_selection': False}. Best is trial 80 with value: 0.30126905497371104.
[I 2025-12-08 19:35:17,833] Trial 114 finished with value: 0.28420915728834456 and parameters: {'model_type': 'graphsage', 'hidden_dims': '[128, 64]', 'dropout': 0.12895485838997267, 'batch_norm': True, 'sage_aggr': 'mean', 'sage_normalize': True, 'sage_project': False, 'lr': 2.6286230064311547e-05, 'weight_decay': 5.477635902086679e-06, 'epochs': 326, 'loss': 'mse', 'optimizer': 'adam', 'graph_mode': 'cutoff', 'cutoff': 0.8007236851050569, 'grm_norm': 'gcn', 'self_loops': False, 'use_snp_selection': False}. Best is trial 80 with value: 0.30126905497371104.
[I 2025-12-08 19:36:49,311] Trial 115 finished with value: 0.2990631526439303 and parameters: {'model_type': 'graphsage', 'hidden_dims': '[256, 128]', 'dropout': 0.10990338673728038, 'batch_norm': True, 'sage_aggr': 'mean', 'sage_normalize': True, 'sage_project': False, 'lr': 3.8329782848514656e-05, 'weight_decay': 2.0404513462934525e-06, 'epochs': 345, 'loss': 'mse', 'optimizer': 'adam', 'graph_mode': 'cutoff', 'cutoff': 0.7732198893690337, 'grm_norm': 'cosine_then_gcn', 'self_loops': True, 'use_snp_selection': False}. Best is trial 80 with value: 0.30126905497371104.
