[I 2025-12-09 17:50:18,547] Trial 29 finished with value: 0.3532021778473159 and parameters: {'model_type': 'graphsage', 'hidden_dims': '[256, 128]', 'dropout': 0.17526317919829532, 'batch_norm': True, 'sage_aggr': 'mean', 'sage_normalize': True, 'sage_project': False, 'lr': 0.00026767754259748524, 'weight_decay': 0.00022377867210766894, 'epochs': 203, 'loss': 'mse', 'optimizer': 'adam', 'graph_mode': 'knn', 'knn_k': 7, 'weighted_edges': False, 'symmetrize_mode': 'mutual', 'self_loops': True, 'use_snp_selection': False}. Best is trial 27 with value: 0.36507967818294274.
[I 2025-12-09 17:50:48,737] Trial 30 finished with value: 0.36755621295480023 and parameters: {'model_type': 'graphsage', 'hidden_dims': '[256, 128]', 'dropout': 0.11524293032802316, 'batch_norm': False, 'sage_aggr': 'mean', 'sage_normalize': False, 'sage_project': False, 'lr': 2.735628209372298e-05, 'weight_decay': 0.00011034960661046287, 'epochs': 94, 'loss': 'mae', 'optimizer': 'adam', 'graph_mode': 'cutoff', 'cutoff': 0.682853845593401, 'grm_norm': 'none', 'self_loops': True, 'use_snp_selection': False}. Best is trial 30 with value: 0.36755621295480023.
[I 2025-12-09 17:51:18,475] Trial 31 finished with value: 0.3672372001423992 and parameters: {'model_type': 'graphsage', 'hidden_dims': '[256, 128]', 'dropout': 0.10010372220929255, 'batch_norm': False, 'sage_aggr': 'mean', 'sage_normalize': False, 'sage_project': False, 'lr': 2.7525639658946824e-05, 'weight_decay': 9.219115759321947e-05, 'epochs': 92, 'loss': 'mae', 'optimizer': 'adam', 'graph_mode': 'cutoff', 'cutoff': 0.6994511023912805, 'grm_norm': 'none', 'self_loops': True, 'use_snp_selection': False}. Best is trial 30 with value: 0.36755621295480023.
[I 2025-12-09 17:51:47,685] Trial 32 finished with value: 0.35971553369777004 and parameters: {'model_type': 'graphsage', 'hidden_dims': '[256, 128]', 'dropout': 0.11018754833546296, 'batch_norm': False, 'sage_aggr': 'mean', 'sage_normalize': False, 'sage_project': False, 'lr': 2.424128754482025e-05, 'weight_decay': 0.00010502577608318673, 'epochs': 89, 'loss': 'mae', 'optimizer': 'adam', 'graph_mode': 'cutoff', 'cutoff': 0.674519676829218, 'grm_norm': 'none', 'self_loops': True, 'use_snp_selection': False}. Best is trial 30 with value: 0.36755621295480023.
[I 2025-12-09 17:52:06,956] Trial 33 finished with value: 0.3127045413597114 and parameters: {'model_type': 'graphsage', 'hidden_dims': '[256, 128]', 'dropout': 0.13616219207395894, 'batch_norm': False, 'sage_aggr': 'mean', 'sage_normalize': False, 'sage_project': False, 'lr': 1.7429582066725414e-05, 'weight_decay': 1.759739635250487e-05, 'epochs': 43, 'loss': 'mae', 'optimizer': 'adam', 'graph_mode': 'cutoff', 'cutoff': 0.7088973151054567, 'grm_norm': 'none', 'self_loops': True, 'use_snp_selection': False}. Best is trial 30 with value: 0.36755621295480023.
[I 2025-12-09 17:52:36,799] Trial 34 finished with value: 0.370882090965899 and parameters: {'model_type': 'graphsage', 'hidden_dims': '[256, 128]', 'dropout': 0.14345130163750988, 'batch_norm': False, 'sage_aggr': 'mean', 'sage_normalize': False, 'sage_project': False, 'lr': 3.149991207946235e-05, 'weight_decay': 7.293231149046942e-06, 'epochs': 93, 'loss': 'mae', 'optimizer': 'adam', 'graph_mode': 'cutoff', 'cutoff': 0.8948419090282107, 'grm_norm': 'none', 'self_loops': True, 'use_snp_selection': False}. Best is trial 34 with value: 0.370882090965899.
[I 2025-12-09 17:53:00,297] Trial 35 finished with value: 0.35600382725252155 and parameters: {'model_type': 'graphsage', 'hidden_dims': '[256, 128]', 'dropout': 0.12710689189877553, 'batch_norm': False, 'sage_aggr': 'mean', 'sage_normalize': False, 'sage_project': False, 'lr': 3.368826229526631e-05, 'weight_decay': 8.079314299869737e-06, 'epochs': 63, 'loss': 'mae', 'optimizer': 'adam', 'graph_mode': 'cutoff', 'cutoff': 0.8373856020933637, 'grm_norm': 'none', 'self_loops': True, 'use_snp_selection': False}. Best is trial 34 with value: 0.370882090965899.
[I 2025-12-09 17:53:30,690] Trial 36 finished with value: 0.33760097825870794 and parameters: {'model_type': 'graphsage', 'hidden_dims': '[256, 128]', 'dropout': 0.16179739761819217, 'batch_norm': True, 'sage_aggr': 'mean', 'sage_normalize': False, 'sage_project': False, 'lr': 1.3714856647980924e-05, 'weight_decay': 1.5908219824704457e-06, 'epochs': 95, 'loss': 'mae', 'optimizer': 'adam', 'graph_mode': 'cutoff', 'cutoff': 0.8897316191640794, 'grm_norm': 'none', 'self_loops': True, 'use_snp_selection': False}. Best is trial 34 with value: 0.370882090965899.
[I 2025-12-09 17:53:53,554] Trial 37 finished with value: 0.33509057333904896 and parameters: {'model_type': 'graphsage', 'hidden_dims': '[256, 128]', 'dropout': 0.10296237257921553, 'batch_norm': False, 'sage_aggr': 'mean', 'sage_normalize': False, 'sage_project': False, 'lr': 5.300423028769331e-05, 'weight_decay': 5.0023031600390855e-06, 'epochs': 57, 'loss': 'mae', 'optimizer': 'adam', 'graph_mode': 'cutoff', 'cutoff': 0.7409265702242646, 'grm_norm': 'none', 'self_loops': True, 'use_snp_selection': False}. Best is trial 34 with value: 0.370882090965899.
[I 2025-12-09 17:54:21,388] Trial 38 finished with value: 0.31997937209836064 and parameters: {'model_type': 'graphsage', 'hidden_dims': '[256, 128]', 'dropout': 0.1437092143809605, 'batch_norm': True, 'sage_aggr': 'mean', 'sage_normalize': True, 'sage_project': False, 'lr': 1.0141243915525906e-05, 'weight_decay': 4.7429049628872827e-07, 'epochs': 81, 'loss': 'mae', 'optimizer': 'adam', 'graph_mode': 'cutoff', 'cutoff': 0.6212891501126816, 'grm_norm': 'none', 'self_loops': True, 'use_snp_selection': False}. Best is trial 34 with value: 0.370882090965899.
[I 2025-12-09 17:54:54,005] Trial 39 finished with value: 0.36797291646195346 and parameters: {'model_type': 'graphsage', 'hidden_dims': '[256, 128]', 'dropout': 0.22806770262347725, 'batch_norm': False, 'sage_aggr': 'mean', 'sage_normalize': False, 'sage_project': False, 'lr': 1.5496960411339363e-05, 'weight_decay': 4.529913495119039e-05, 'epochs': 106, 'loss': 'mae', 'optimizer': 'adam', 'graph_mode': 'cutoff', 'cutoff': 0.796108213233571, 'grm_norm': 'none', 'self_loops': True, 'use_snp_selection': False}. Best is trial 34 with value: 0.370882090965899.
[I 2025-12-09 17:55:16,770] Trial 40 finished with value: 0.34721947428401095 and parameters: {'model_type': 'graphsage', 'hidden_dims': '[128, 64]', 'dropout': 0.19954780735907995, 'batch_norm': True, 'sage_aggr': 'mean', 'sage_normalize': False, 'sage_project': False, 'lr': 1.7354302765593375e-05, 'weight_decay': 4.639643024230119e-05, 'epochs': 103, 'loss': 'mae', 'optimizer': 'adam', 'graph_mode': 'cutoff', 'cutoff': 0.8034479578937446, 'grm_norm': 'none', 'self_loops': True, 'use_snp_selection': False}. Best is trial 34 with value: 0.370882090965899.
[I 2025-12-09 17:55:53,438] Trial 41 finished with value: 0.360073332900846 and parameters: {'model_type': 'graphsage', 'hidden_dims': '[256, 128]', 'dropout': 0.1902716180109218, 'batch_norm': False, 'sage_aggr': 'mean', 'sage_normalize': False, 'sage_project': False, 'lr': 2.4548711678615595e-05, 'weight_decay': 0.0001440278114915807, 'epochs': 125, 'loss': 'mae', 'optimizer': 'adam', 'graph_mode': 'cutoff', 'cutoff': 0.8970837698027878, 'grm_norm': 'none', 'self_loops': True, 'use_snp_selection': False}. Best is trial 34 with value: 0.370882090965899.
[I 2025-12-09 17:56:18,029] Trial 42 finished with value: 0.3619933389689759 and parameters: {'model_type': 'graphsage', 'hidden_dims': '[256, 128]', 'dropout': 0.23713309383942133, 'batch_norm': False, 'sage_aggr': 'mean', 'sage_normalize': False, 'sage_project': False, 'lr': 1.474610096698031e-05, 'weight_decay': 2.0169856754003825e-05, 'epochs': 68, 'loss': 'mae', 'optimizer': 'adam', 'graph_mode': 'cutoff', 'cutoff': 0.7469480733842737, 'grm_norm': 'none', 'self_loops': True, 'use_snp_selection': False}. Best is trial 34 with value: 0.370882090965899.
[I 2025-12-09 17:56:45,799] Trial 43 finished with value: 0.35479117884955425 and parameters: {'model_type': 'graphsage', 'hidden_dims': '[256, 128]', 'dropout': 0.15482173851022027, 'batch_norm': False, 'sage_aggr': 'mean', 'sage_normalize': False, 'sage_project': False, 'lr': 3.897658326337738e-05, 'weight_decay': 6.935648585451681e-06, 'epochs': 83, 'loss': 'mae', 'optimizer': 'adam', 'graph_mode': 'cutoff', 'cutoff': 0.8419799396207676, 'grm_norm': 'none', 'self_loops': True, 'use_snp_selection': False}. Best is trial 34 with value: 0.370882090965899.
[I 2025-12-09 17:57:20,238] Trial 44 finished with value: 0.3636911100763149 and parameters: {'model_type': 'graphsage', 'hidden_dims': '[256, 128]', 'dropout': 0.12380849203067029, 'batch_norm': False, 'sage_aggr': 'mean', 'sage_normalize': False, 'sage_project': False, 'lr': 2.057547772727774e-05, 'weight_decay': 4.9452949590660594e-05, 'epochs': 113, 'loss': 'mae', 'optimizer': 'adam', 'graph_mode': 'cutoff', 'cutoff': 0.6468372699929477, 'grm_norm': 'none', 'self_loops': True, 'use_snp_selection': False}. Best is trial 34 with value: 0.370882090965899.
[I 2025-12-09 17:57:58,821] Trial 45 finished with value: 0.306446038845028 and parameters: {'model_type': 'graphsage', 'hidden_dims': '[256, 128, 64]', 'dropout': 0.22395693472709782, 'batch_norm': False, 'sage_aggr': 'mean', 'sage_normalize': True, 'sage_project': False, 'lr': 8.499824718872926e-05, 'weight_decay': 0.00011577151340852935, 'epochs': 132, 'loss': 'mae', 'optimizer': 'adam', 'graph_mode': 'cutoff', 'cutoff': 0.7782467854920471, 'grm_norm': 'none', 'self_loops': True, 'use_snp_selection': False}. Best is trial 34 with value: 0.370882090965899.
[I 2025-12-09 17:58:30,049] Trial 46 finished with value: 0.36284207986448175 and parameters: {'model_type': 'graphsage', 'hidden_dims': '[256, 128]', 'dropout': 0.10160377943601996, 'batch_norm': False, 'sage_aggr': 'mean', 'sage_normalize': False, 'sage_project': False, 'lr': 6.196123704172795e-05, 'weight_decay': 0.00041709146910762804, 'epochs': 99, 'loss': 'mae', 'optimizer': 'adam', 'graph_mode': 'cutoff', 'cutoff': 0.7174711998471386, 'grm_norm': 'none', 'self_loops': True, 'use_snp_selection': False}. Best is trial 34 with value: 0.370882090965899.
[I 2025-12-09 17:59:10,311] Trial 47 finished with value: 0.0 and parameters: {'model_type': 'graphsage', 'hidden_dims': '[512, 64]', 'dropout': 0.18047916829911875, 'batch_norm': False, 'sage_aggr': 'mean', 'sage_normalize': False, 'sage_project': False, 'lr': 0.007249328096975659, 'weight_decay': 8.676277054482167e-05, 'epochs': 72, 'loss': 'mae', 'optimizer': 'adam', 'graph_mode': 'cutoff', 'cutoff': 0.5789751316046591, 'grm_norm': 'none', 'self_loops': True, 'use_snp_selection': False}. Best is trial 34 with value: 0.370882090965899.
[I 2025-12-09 17:59:32,579] Trial 48 finished with value: 0.33609610366297166 and parameters: {'model_type': 'graphsage', 'hidden_dims': '[256, 128]', 'dropout': 0.15053258458674526, 'batch_norm': True, 'sage_aggr': 'mean', 'sage_normalize': False, 'sage_project': False, 'lr': 1.2722810863060473e-05, 'weight_decay': 2.2158798272603792e-06, 'epochs': 52, 'loss': 'mae', 'optimizer': 'adam', 'graph_mode': 'cutoff', 'cutoff': 0.8441910002670973, 'grm_norm': 'cosine_then_gcn', 'self_loops': True, 'use_snp_selection': False}. Best is trial 34 with value: 0.370882090965899.
[I 2025-12-09 18:00:08,178] Trial 49 finished with value: 0.33435385299552955 and parameters: {'model_type': 'graphsage', 'hidden_dims': '[256, 128]', 'dropout': 0.2703831164693362, 'batch_norm': False, 'sage_aggr': 'mean', 'sage_normalize': True, 'sage_project': False, 'lr': 2.7592217544057752e-05, 'weight_decay': 4.317210391441533e-05, 'epochs': 118, 'loss': 'mae', 'optimizer': 'adam', 'graph_mode': 'cutoff', 'cutoff': 0.6912591319572935, 'grm_norm': 'none', 'self_loops': True, 'use_snp_selection': False}. Best is trial 34 with value: 0.370882090965899.
[I 2025-12-09 18:00:40,722] Trial 50 finished with value: 0.3548944433770976 and parameters: {'model_type': 'graphsage', 'hidden_dims': '[128, 64]', 'dropout': 0.12381349498108711, 'batch_norm': False, 'sage_aggr': 'mean', 'sage_normalize': False, 'sage_project': False, 'lr': 1.8339957269841634e-05, 'weight_decay': 1.7836693372634668e-05, 'epochs': 177, 'loss': 'mae', 'optimizer': 'adam', 'graph_mode': 'cutoff', 'cutoff': 0.7874029903276951, 'grm_norm': 'none', 'self_loops': True, 'use_snp_selection': False}. Best is trial 34 with value: 0.370882090965899.
[I 2025-12-09 18:01:14,403] Trial 51 finished with value: 0.36878880304253403 and parameters: {'model_type': 'graphsage', 'hidden_dims': '[256, 128]', 'dropout': 0.12532803687659305, 'batch_norm': False, 'sage_aggr': 'mean', 'sage_normalize': False, 'sage_project': False, 'lr': 4.32750930790027e-05, 'weight_decay': 4.598153489562787e-05, 'epochs': 110, 'loss': 'mae', 'optimizer': 'adam', 'graph_mode': 'cutoff', 'cutoff': 0.6761268962649808, 'grm_norm': 'none', 'self_loops': True, 'use_snp_selection': False}. Best is trial 34 with value: 0.370882090965899.
[I 2025-12-09 18:01:46,986] Trial 52 finished with value: 0.3684349307676825 and parameters: {'model_type': 'graphsage', 'hidden_dims': '[256, 128]', 'dropout': 0.13356113243407336, 'batch_norm': False, 'sage_aggr': 'mean', 'sage_normalize': False, 'sage_project': False, 'lr': 4.420932741753243e-05, 'weight_decay': 2.781839211028865e-05, 'epochs': 104, 'loss': 'mae', 'optimizer': 'adam', 'graph_mode': 'cutoff', 'cutoff': 0.6324633149460378, 'grm_norm': 'none', 'self_loops': True, 'use_snp_selection': False}. Best is trial 34 with value: 0.370882090965899.
[I 2025-12-09 18:02:13,738] Trial 53 finished with value: 0.3557998584780768 and parameters: {'model_type': 'graphsage', 'hidden_dims': '[256, 128]', 'dropout': 0.12285936349155571, 'batch_norm': False, 'sage_aggr': 'mean', 'sage_normalize': False, 'sage_project': False, 'lr': 4.5774510145110494e-05, 'weight_decay': 2.993332808460616e-05, 'epochs': 77, 'loss': 'mae', 'optimizer': 'adam', 'graph_mode': 'cutoff', 'cutoff': 0.6309370158146668, 'grm_norm': 'none', 'self_loops': True, 'use_snp_selection': False}. Best is trial 34 with value: 0.370882090965899.
[I 2025-12-09 18:03:42,004] Trial 54 finished with value: 0.20326946036448051 and parameters: {'model_type': 'graphsage', 'hidden_dims': '[256, 128]', 'dropout': 0.16411703810748648, 'batch_norm': False, 'sage_aggr': 'mean', 'sage_normalize': False, 'sage_project': False, 'lr': 0.004383291708879353, 'weight_decay': 6.390111878078243e-05, 'epochs': 332, 'loss': 'mae', 'optimizer': 'adam', 'graph_mode': 'cutoff', 'cutoff': 0.5328172114175145, 'grm_norm': 'none', 'self_loops': True, 'use_snp_selection': False}. Best is trial 34 with value: 0.370882090965899.
[I 2025-12-09 18:04:15,326] Trial 55 finished with value: 0.368924077715196 and parameters: {'model_type': 'graphsage', 'hidden_dims': '[256, 128]', 'dropout': 0.14522622700791546, 'batch_norm': False, 'sage_aggr': 'mean', 'sage_normalize': False, 'sage_project': False, 'lr': 2.9250784234499595e-05, 'weight_decay': 0.0001535832847786757, 'epochs': 104, 'loss': 'mae', 'optimizer': 'adam', 'graph_mode': 'cutoff', 'cutoff': 0.6574740307109644, 'grm_norm': 'cosine_then_gcn', 'self_loops': True, 'use_snp_selection': False}. Best is trial 34 with value: 0.370882090965899.
[I 2025-12-09 18:05:09,798] Trial 56 finished with value: 0.32365352224565413 and parameters: {'model_type': 'graphsage', 'hidden_dims': '[512, 64]', 'dropout': 0.1948838566376165, 'batch_norm': False, 'sage_aggr': 'mean', 'sage_normalize': False, 'sage_project': False, 'lr': 9.974385595413118e-05, 'weight_decay': 0.00019606206353613606, 'epochs': 106, 'loss': 'mae', 'optimizer': 'adam', 'graph_mode': 'cutoff', 'cutoff': 0.5618367436788548, 'grm_norm': 'cosine_then_gcn', 'self_loops': True, 'use_snp_selection': False}. Best is trial 34 with value: 0.370882090965899.
[I 2025-12-09 18:05:53,537] Trial 57 finished with value: 0.3559707465208772 and parameters: {'model_type': 'graphsage', 'hidden_dims': '[256, 128, 64]', 'dropout': 0.14606177716962734, 'batch_norm': False, 'sage_aggr': 'mean', 'sage_normalize': False, 'sage_project': False, 'lr': 6.843670120394904e-05, 'weight_decay': 0.00029960914571554884, 'epochs': 152, 'loss': 'mae', 'optimizer': 'adam', 'graph_mode': 'cutoff', 'cutoff': 0.6520640003387758, 'grm_norm': 'cosine_then_gcn', 'self_loops': True, 'use_snp_selection': False}. Best is trial 34 with value: 0.370882090965899.
[I 2025-12-09 18:06:29,246] Trial 58 finished with value: 0.3624572378321519 and parameters: {'model_type': 'graphsage', 'hidden_dims': '[256, 128]', 'dropout': 0.13576784478912243, 'batch_norm': False, 'sage_aggr': 'mean', 'sage_normalize': False, 'sage_project': False, 'lr': 5.229422710961099e-05, 'weight_decay': 0.00015160043387883485, 'epochs': 114, 'loss': 'mae', 'optimizer': 'adam', 'graph_mode': 'cutoff', 'cutoff': 0.5941202599071207, 'grm_norm': 'cosine_then_gcn', 'self_loops': True, 'use_snp_selection': False}. Best is trial 34 with value: 0.370882090965899.
[I 2025-12-09 18:07:35,170] Trial 59 finished with value: 0.36628982461477616 and parameters: {'model_type': 'graphsage', 'hidden_dims': '[512, 256]', 'dropout': 0.2028876620051167, 'batch_norm': False, 'sage_aggr': 'mean', 'sage_normalize': False, 'sage_project': False, 'lr': 3.429581077509506e-05, 'weight_decay': 1.5177799487294912e-05, 'epochs': 137, 'loss': 'mae', 'optimizer': 'adam', 'graph_mode': 'cutoff', 'cutoff': 0.7375608814616992, 'grm_norm': 'cosine_then_gcn', 'self_loops': True, 'use_snp_selection': False}. Best is trial 34 with value: 0.370882090965899.
[I 2025-12-09 18:09:01,235] Trial 60 finished with value: 0.35720673286838167 and parameters: {'model_type': 'graphsage', 'hidden_dims': '[256, 128]', 'dropout': 0.16328201987596183, 'batch_norm': False, 'sage_aggr': 'mean', 'sage_normalize': False, 'sage_project': False, 'lr': 0.000443421364527477, 'weight_decay': 1.035287735258506e-07, 'epochs': 293, 'loss': 'mae', 'optimizer': 'adam', 'graph_mode': 'cutoff', 'cutoff': 0.49420250558396417, 'grm_norm': 'gcn', 'self_loops': False, 'use_snp_selection': False}. Best is trial 34 with value: 0.370882090965899.
[I 2025-12-09 18:09:30,474] Trial 61 finished with value: 0.3697118495616115 and parameters: {'model_type': 'graphsage', 'hidden_dims': '[256, 128]', 'dropout': 0.1012046645992424, 'batch_norm': False, 'sage_aggr': 'mean', 'sage_normalize': False, 'sage_project': False, 'lr': 2.5526992498219375e-05, 'weight_decay': 8.259278169656796e-05, 'epochs': 88, 'loss': 'mae', 'optimizer': 'adam', 'graph_mode': 'cutoff', 'cutoff': 0.6205343747564824, 'grm_norm': 'none', 'self_loops': True, 'use_snp_selection': False}. Best is trial 34 with value: 0.370882090965899.
[I 2025-12-09 18:09:59,100] Trial 62 finished with value: 0.35743962668925156 and parameters: {'model_type': 'graphsage', 'hidden_dims': '[256, 128]', 'dropout': 0.11634180229756222, 'batch_norm': False, 'sage_aggr': 'mean', 'sage_normalize': False, 'sage_project': False, 'lr': 2.3182642285580755e-05, 'weight_decay': 0.0006111515417118155, 'epochs': 85, 'loss': 'mae', 'optimizer': 'adam', 'graph_mode': 'cutoff', 'cutoff': 0.6155239656984934, 'grm_norm': 'none', 'self_loops': True, 'use_snp_selection': False}. Best is trial 34 with value: 0.370882090965899.
[I 2025-12-09 18:10:31,122] Trial 63 finished with value: 0.36897866334831003 and parameters: {'model_type': 'graphsage', 'hidden_dims': '[256, 128]', 'dropout': 0.13673156874115047, 'batch_norm': False, 'sage_aggr': 'mean', 'sage_normalize': False, 'sage_project': False, 'lr': 1.3671857876223382e-05, 'weight_decay': 2.8093634655241572e-05, 'epochs': 98, 'loss': 'mae', 'optimizer': 'adam', 'graph_mode': 'cutoff', 'cutoff': 0.6667038335995434, 'grm_norm': 'cosine_then_gcn', 'self_loops': True, 'use_snp_selection': False}. Best is trial 34 with value: 0.370882090965899.
[I 2025-12-09 18:10:53,631] Trial 64 finished with value: 0.3505555848239365 and parameters: {'model_type': 'graphsage', 'hidden_dims': '[256, 128]', 'dropout': 0.13869119783054734, 'batch_norm': False, 'sage_aggr': 'mean', 'sage_normalize': False, 'sage_project': False, 'lr': 1.2838139281516907e-05, 'weight_decay': 2.2811372513768725e-05, 'epochs': 53, 'loss': 'mae', 'optimizer': 'adam', 'graph_mode': 'cutoff', 'cutoff': 0.6462849269233106, 'grm_norm': 'cosine_then_gcn', 'self_loops': True, 'use_snp_selection': False}. Best is trial 34 with value: 0.370882090965899.
[I 2025-12-09 18:12:13,923] Trial 65 finished with value: 0.35227506203824727 and parameters: {'model_type': 'graphsage', 'hidden_dims': '[256, 128]', 'dropout': 0.18443412774349932, 'batch_norm': False, 'sage_aggr': 'mean', 'sage_normalize': False, 'sage_project': False, 'lr': 1.5709227236735205e-05, 'weight_decay': 3.7431071994394375e-05, 'epochs': 103, 'loss': 'mae', 'optimizer': 'adam', 'graph_mode': 'knn', 'knn_k': 10, 'weighted_edges': True, 'symmetrize_mode': 'union', 'self_loops': True, 'use_snp_selection': False}. Best is trial 34 with value: 0.370882090965899.
[I 2025-12-09 18:12:54,250] Trial 66 finished with value: 0.3724803529459689 and parameters: {'model_type': 'graphsage', 'hidden_dims': '[256, 128]', 'dropout': 0.2406016668332567, 'batch_norm': False, 'sage_aggr': 'mean', 'sage_normalize': False, 'sage_project': False, 'lr': 2.0339582541370275e-05, 'weight_decay': 5.6053163190909814e-05, 'epochs': 133, 'loss': 'mse', 'optimizer': 'adam', 'graph_mode': 'cutoff', 'cutoff': 0.5602143760555081, 'grm_norm': 'cosine_then_gcn', 'self_loops': True, 'use_snp_selection': False}. Best is trial 66 with value: 0.3724803529459689.
