[I 2025-12-10 06:44:11,135] Trial 88 finished with value: 0.2992968278776179 and parameters: {'model_type': 'graphsage', 'hidden_dims': '[128, 64]', 'dropout': 0.4470527880425182, 'batch_norm': True, 'sage_aggr': 'mean', 'sage_normalize': False, 'sage_project': False, 'lr': 0.0006728896863466586, 'weight_decay': 6.699946214093212e-06, 'epochs': 293, 'loss': 'mse', 'optimizer': 'adam', 'graph_mode': 'knn', 'knn_k': 10, 'weighted_edges': True, 'symmetrize_mode': 'union', 'self_loops': True, 'use_snp_selection': False}. Best is trial 48 with value: 0.31165090555774844.
[I 2025-12-10 06:45:11,734] Trial 89 finished with value: 0.26112161582775073 and parameters: {'model_type': 'graphsage', 'hidden_dims': '[256, 128, 64]', 'dropout': 0.5810070853231466, 'batch_norm': True, 'sage_aggr': 'max', 'sage_normalize': False, 'sage_project': False, 'lr': 0.002125291703670038, 'weight_decay': 7.94535410199407e-07, 'epochs': 99, 'loss': 'mse', 'optimizer': 'adam', 'graph_mode': 'knn', 'knn_k': 4, 'weighted_edges': False, 'symmetrize_mode': 'union', 'self_loops': True, 'use_snp_selection': False}. Best is trial 48 with value: 0.31165090555774844.
[I 2025-12-10 06:47:26,494] Trial 90 finished with value: 0.3072560895683211 and parameters: {'model_type': 'graphsage', 'hidden_dims': '[512, 128]', 'dropout': 0.5558125333682751, 'batch_norm': True, 'sage_aggr': 'mean', 'sage_normalize': False, 'sage_project': False, 'lr': 0.007460668746752197, 'weight_decay': 1.0834588466809839e-06, 'epochs': 122, 'loss': 'mse', 'optimizer': 'adam', 'graph_mode': 'knn', 'knn_k': 9, 'weighted_edges': False, 'symmetrize_mode': 'union', 'self_loops': True, 'use_snp_selection': False}. Best is trial 48 with value: 0.31165090555774844.
[I 2025-12-10 06:51:57,403] Trial 91 finished with value: 0.307873659753762 and parameters: {'model_type': 'graphsage', 'hidden_dims': '[512, 128]', 'dropout': 0.48411668582497297, 'batch_norm': True, 'sage_aggr': 'mean', 'sage_normalize': False, 'sage_project': False, 'lr': 0.0010221669454876284, 'weight_decay': 1.3076221048858743e-07, 'epochs': 327, 'loss': 'mse', 'optimizer': 'adam', 'graph_mode': 'knn', 'knn_k': 5, 'weighted_edges': False, 'symmetrize_mode': 'union', 'self_loops': True, 'use_snp_selection': False}. Best is trial 48 with value: 0.31165090555774844.
[I 2025-12-10 06:55:13,907] Trial 92 finished with value: 0.30794691190344303 and parameters: {'model_type': 'graphsage', 'hidden_dims': '[512, 128]', 'dropout': 0.4269718765862164, 'batch_norm': True, 'sage_aggr': 'mean', 'sage_normalize': False, 'sage_project': False, 'lr': 0.0014135811849800837, 'weight_decay': 2.164954348875147e-07, 'epochs': 253, 'loss': 'mse', 'optimizer': 'adam', 'graph_mode': 'knn', 'knn_k': 4, 'weighted_edges': False, 'symmetrize_mode': 'union', 'self_loops': True, 'use_snp_selection': False}. Best is trial 48 with value: 0.31165090555774844.
[I 2025-12-10 06:58:10,043] Trial 93 finished with value: 0.3099831665273537 and parameters: {'model_type': 'graphsage', 'hidden_dims': '[512, 128]', 'dropout': 0.42575706901027993, 'batch_norm': True, 'sage_aggr': 'mean', 'sage_normalize': False, 'sage_project': False, 'lr': 0.0015069940841984592, 'weight_decay': 2.2465554329036028e-07, 'epochs': 226, 'loss': 'mse', 'optimizer': 'adam', 'graph_mode': 'knn', 'knn_k': 4, 'weighted_edges': False, 'symmetrize_mode': 'union', 'self_loops': True, 'use_snp_selection': False}. Best is trial 48 with value: 0.31165090555774844.
[I 2025-12-10 07:01:05,769] Trial 94 finished with value: 0.30580314358641036 and parameters: {'model_type': 'graphsage', 'hidden_dims': '[512, 256]', 'dropout': 0.4273992026259402, 'batch_norm': True, 'sage_aggr': 'mean', 'sage_normalize': False, 'sage_project': False, 'lr': 0.0014016102494228205, 'weight_decay': 2.0137780239606389e-07, 'epochs': 225, 'loss': 'mse', 'optimizer': 'adam', 'graph_mode': 'knn', 'knn_k': 4, 'weighted_edges': False, 'symmetrize_mode': 'union', 'self_loops': True, 'use_snp_selection': False}. Best is trial 48 with value: 0.31165090555774844.
[I 2025-12-10 07:03:54,438] Trial 95 finished with value: 0.30459729920199347 and parameters: {'model_type': 'graphsage', 'hidden_dims': '[512, 128]', 'dropout': 0.3868119785853544, 'batch_norm': True, 'sage_aggr': 'mean', 'sage_normalize': False, 'sage_project': False, 'lr': 0.0005390301989952524, 'weight_decay': 4.285271981035721e-07, 'epochs': 252, 'loss': 'mse', 'optimizer': 'adam', 'graph_mode': 'knn', 'knn_k': 3, 'weighted_edges': False, 'symmetrize_mode': 'union', 'self_loops': True, 'use_snp_selection': False}. Best is trial 48 with value: 0.31165090555774844.
[I 2025-12-10 07:05:27,024] Trial 96 finished with value: 0.2984256784466415 and parameters: {'model_type': 'graphsage', 'hidden_dims': '[256, 128]', 'dropout': 0.35159022044875, 'batch_norm': True, 'sage_aggr': 'mean', 'sage_normalize': False, 'sage_project': False, 'lr': 0.0007879147722427307, 'weight_decay': 2.4535213208388396e-07, 'epochs': 242, 'loss': 'mse', 'optimizer': 'adam', 'graph_mode': 'knn', 'knn_k': 2, 'weighted_edges': False, 'symmetrize_mode': 'union', 'self_loops': True, 'use_snp_selection': False}. Best is trial 48 with value: 0.31165090555774844.
[I 2025-12-10 07:08:52,970] Trial 97 finished with value: 0.0 and parameters: {'model_type': 'graphsage', 'hidden_dims': '[512, 128]', 'dropout': 0.46818990233521113, 'batch_norm': False, 'sage_aggr': 'mean', 'sage_normalize': False, 'sage_project': False, 'lr': 0.0015053966820795014, 'weight_decay': 9.634883807572769e-06, 'epochs': 228, 'loss': 'mae', 'optimizer': 'adam', 'graph_mode': 'cutoff', 'cutoff': 0.27323462497815787, 'grm_norm': 'gcn', 'self_loops': True, 'use_snp_selection': False}. Best is trial 48 with value: 0.31165090555774844.
[I 2025-12-10 07:11:33,814] Trial 98 finished with value: 0.31051815273135525 and parameters: {'model_type': 'graphsage', 'hidden_dims': '[512, 64]', 'dropout': 0.40474647284436116, 'batch_norm': True, 'sage_aggr': 'mean', 'sage_normalize': False, 'sage_project': False, 'lr': 0.002797175356943508, 'weight_decay': 2.0257985708682162e-06, 'epochs': 206, 'loss': 'mse', 'optimizer': 'adam', 'graph_mode': 'knn', 'knn_k': 4, 'weighted_edges': False, 'symmetrize_mode': 'union', 'self_loops': True, 'use_snp_selection': False}. Best is trial 48 with value: 0.31165090555774844.
[I 2025-12-10 07:12:20,319] Trial 99 finished with value: 0.30442914278912764 and parameters: {'model_type': 'graphsage', 'hidden_dims': '[512, 64]', 'dropout': 0.4430015016507226, 'batch_norm': True, 'sage_aggr': 'mean', 'sage_normalize': False, 'sage_project': False, 'lr': 0.0027591460504372647, 'weight_decay': 2.199457916763366e-06, 'epochs': 210, 'loss': 'mse', 'optimizer': 'adam', 'graph_mode': 'knn', 'knn_k': 4, 'weighted_edges': False, 'symmetrize_mode': 'union', 'self_loops': True, 'use_snp_selection': True, 'num_snps': 14690}. Best is trial 48 with value: 0.31165090555774844.
[I 2025-12-10 07:15:16,939] Trial 100 finished with value: 0.0 and parameters: {'model_type': 'graphsage', 'hidden_dims': '[512, 64]', 'dropout': 0.3650827389369028, 'batch_norm': False, 'sage_aggr': 'mean', 'sage_normalize': False, 'sage_project': False, 'lr': 0.005165246069804265, 'weight_decay': 1.6771622630557661e-06, 'epochs': 187, 'loss': 'mse', 'optimizer': 'adam', 'graph_mode': 'cutoff', 'cutoff': 0.2625608085432002, 'grm_norm': 'none', 'self_loops': False, 'use_snp_selection': False}. Best is trial 48 with value: 0.31165090555774844.
[I 2025-12-10 07:17:56,279] Trial 101 finished with value: 0.3000306661565846 and parameters: {'model_type': 'graphsage', 'hidden_dims': '[512, 64]', 'dropout': 0.4030740358120165, 'batch_norm': True, 'sage_aggr': 'mean', 'sage_normalize': False, 'sage_project': False, 'lr': 0.001163887434196483, 'weight_decay': 5.490224187928745e-07, 'epochs': 204, 'loss': 'mse', 'optimizer': 'adam', 'graph_mode': 'knn', 'knn_k': 4, 'weighted_edges': False, 'symmetrize_mode': 'union', 'self_loops': True, 'use_snp_selection': False}. Best is trial 48 with value: 0.31165090555774844.
[I 2025-12-10 07:20:23,909] Trial 102 finished with value: 0.3043438749869166 and parameters: {'model_type': 'graphsage', 'hidden_dims': '[512, 64]', 'dropout': 0.4066818888512417, 'batch_norm': True, 'sage_aggr': 'mean', 'sage_normalize': False, 'sage_project': False, 'lr': 0.0020771471313952216, 'weight_decay': 3.0442623621595898e-06, 'epochs': 220, 'loss': 'mse', 'optimizer': 'adam', 'graph_mode': 'knn', 'knn_k': 3, 'weighted_edges': False, 'symmetrize_mode': 'union', 'self_loops': True, 'use_snp_selection': False}. Best is trial 48 with value: 0.31165090555774844.
[I 2025-12-10 07:21:59,469] Trial 103 finished with value: 0.3023861891955108 and parameters: {'model_type': 'graphsage', 'hidden_dims': '[256, 128]', 'dropout': 0.4287396952310024, 'batch_norm': True, 'sage_aggr': 'mean', 'sage_normalize': False, 'sage_project': False, 'lr': 0.0009878246958961066, 'weight_decay': 1.6417202836982953e-07, 'epochs': 177, 'loss': 'mse', 'optimizer': 'adam', 'graph_mode': 'knn', 'knn_k': 4, 'weighted_edges': False, 'symmetrize_mode': 'union', 'self_loops': True, 'use_snp_selection': False}. Best is trial 48 with value: 0.31165090555774844.
[I 2025-12-10 07:24:16,611] Trial 104 finished with value: 0.3062594234630328 and parameters: {'model_type': 'graphsage', 'hidden_dims': '[512, 128]', 'dropout': 0.4140676509740512, 'batch_norm': True, 'sage_aggr': 'mean', 'sage_normalize': False, 'sage_project': False, 'lr': 0.003135605272003631, 'weight_decay': 2.5575963314476715e-06, 'epochs': 162, 'loss': 'mse', 'optimizer': 'adam', 'graph_mode': 'knn', 'knn_k': 5, 'weighted_edges': False, 'symmetrize_mode': 'union', 'self_loops': True, 'use_snp_selection': False}. Best is trial 48 with value: 0.31165090555774844.
[I 2025-12-10 07:27:14,330] Trial 105 finished with value: 0.3013237867660351 and parameters: {'model_type': 'graphsage', 'hidden_dims': '[512, 128]', 'dropout': 0.39224729322848856, 'batch_norm': True, 'sage_aggr': 'mean', 'sage_normalize': False, 'sage_project': False, 'lr': 0.002326802423998519, 'weight_decay': 3.621009052199171e-06, 'epochs': 266, 'loss': 'mse', 'optimizer': 'adam', 'graph_mode': 'knn', 'knn_k': 3, 'weighted_edges': False, 'symmetrize_mode': 'union', 'self_loops': True, 'use_snp_selection': False}. Best is trial 48 with value: 0.31165090555774844.
[I 2025-12-10 07:29:19,356] Trial 106 finished with value: 0.30451590302010423 and parameters: {'model_type': 'graphsage', 'hidden_dims': '[256, 128]', 'dropout': 0.37393234325330943, 'batch_norm': True, 'sage_aggr': 'mean', 'sage_normalize': False, 'sage_project': False, 'lr': 0.0013816080886570002, 'weight_decay': 9.059123307922042e-07, 'epochs': 234, 'loss': 'mse', 'optimizer': 'adam', 'graph_mode': 'knn', 'knn_k': 4, 'weighted_edges': False, 'symmetrize_mode': 'union', 'self_loops': True, 'use_snp_selection': False}. Best is trial 48 with value: 0.31165090555774844.
[I 2025-12-10 07:32:53,008] Trial 107 finished with value: 0.30996687299325265 and parameters: {'model_type': 'graphsage', 'hidden_dims': '[512, 128]', 'dropout': 0.42990846518683723, 'batch_norm': True, 'sage_aggr': 'mean', 'sage_normalize': True, 'sage_project': False, 'lr': 0.003809457249875846, 'weight_decay': 3.7642354259404185e-07, 'epochs': 256, 'loss': 'mse', 'optimizer': 'adam', 'graph_mode': 'knn', 'knn_k': 5, 'weighted_edges': False, 'symmetrize_mode': 'union', 'self_loops': True, 'use_snp_selection': False}. Best is trial 48 with value: 0.31165090555774844.
[I 2025-12-10 07:33:28,706] Trial 108 finished with value: 0.3074806152269637 and parameters: {'model_type': 'graphsage', 'hidden_dims': '[128, 64]', 'dropout': 0.46314429521338224, 'batch_norm': False, 'sage_aggr': 'max', 'sage_normalize': True, 'sage_project': False, 'lr': 0.0038793928740716195, 'weight_decay': 6.887531090858158e-07, 'epochs': 199, 'loss': 'mse', 'optimizer': 'adam', 'graph_mode': 'cutoff', 'cutoff': 0.7925969697742076, 'grm_norm': 'gcn', 'self_loops': True, 'use_snp_selection': False}. Best is trial 48 with value: 0.31165090555774844.
[I 2025-12-10 07:36:34,214] Trial 109 finished with value: 0.30735414120788823 and parameters: {'model_type': 'graphsage', 'hidden_dims': '[512, 64]', 'dropout': 0.4455053637269935, 'batch_norm': True, 'sage_aggr': 'mean', 'sage_normalize': True, 'sage_project': False, 'lr': 0.004779009018757564, 'weight_decay': 4.41135622026752e-07, 'epochs': 290, 'loss': 'mse', 'optimizer': 'adam', 'graph_mode': 'knn', 'knn_k': 5, 'weighted_edges': True, 'symmetrize_mode': 'mutual', 'self_loops': True, 'use_snp_selection': False}. Best is trial 48 with value: 0.31165090555774844.
[I 2025-12-10 07:40:08,639] Trial 110 finished with value: 0.30772990432246816 and parameters: {'model_type': 'graphsage', 'hidden_dims': '[512, 128]', 'dropout': 0.4520102248627329, 'batch_norm': True, 'sage_aggr': 'mean', 'sage_normalize': True, 'sage_project': False, 'lr': 0.005813090831654449, 'weight_decay': 3.656490117419567e-07, 'epochs': 240, 'loss': 'mae', 'optimizer': 'adam', 'graph_mode': 'knn', 'knn_k': 6, 'weighted_edges': False, 'symmetrize_mode': 'union', 'self_loops': True, 'use_snp_selection': False}. Best is trial 48 with value: 0.31165090555774844.
[I 2025-12-10 07:43:43,130] Trial 111 finished with value: 0.30936137271711905 and parameters: {'model_type': 'graphsage', 'hidden_dims': '[512, 128]', 'dropout': 0.4269279442468843, 'batch_norm': True, 'sage_aggr': 'mean', 'sage_normalize': True, 'sage_project': False, 'lr': 0.0016074814364414418, 'weight_decay': 2.7906214962663876e-07, 'epochs': 257, 'loss': 'mse', 'optimizer': 'adam', 'graph_mode': 'knn', 'knn_k': 5, 'weighted_edges': False, 'symmetrize_mode': 'union', 'self_loops': True, 'use_snp_selection': False}. Best is trial 48 with value: 0.31165090555774844.
[I 2025-12-10 07:47:19,222] Trial 112 finished with value: 0.3077057914613075 and parameters: {'model_type': 'graphsage', 'hidden_dims': '[512, 128]', 'dropout': 0.4261683210953334, 'batch_norm': True, 'sage_aggr': 'mean', 'sage_normalize': True, 'sage_project': False, 'lr': 0.002651175581256408, 'weight_decay': 2.682117846324866e-07, 'epochs': 259, 'loss': 'mse', 'optimizer': 'adam', 'graph_mode': 'knn', 'knn_k': 5, 'weighted_edges': False, 'symmetrize_mode': 'union', 'self_loops': True, 'use_snp_selection': False}. Best is trial 48 with value: 0.31165090555774844.
[I 2025-12-10 07:51:20,611] Trial 113 finished with value: 0.3081426546308904 and parameters: {'model_type': 'graphsage', 'hidden_dims': '[512, 128]', 'dropout': 0.23648472296815326, 'batch_norm': True, 'sage_aggr': 'mean', 'sage_normalize': True, 'sage_project': False, 'lr': 0.0016507760989658972, 'weight_decay': 4.6127861723927804e-05, 'epochs': 271, 'loss': 'mse', 'optimizer': 'adam', 'graph_mode': 'knn', 'knn_k': 6, 'weighted_edges': False, 'symmetrize_mode': 'union', 'self_loops': True, 'use_snp_selection': False}. Best is trial 48 with value: 0.31165090555774844.
[I 2025-12-10 07:52:29,187] Trial 114 finished with value: 0.3009906913343231 and parameters: {'model_type': 'graphsage', 'hidden_dims': '[512, 128]', 'dropout': 0.23427181650180226, 'batch_norm': True, 'sage_aggr': 'mean', 'sage_normalize': True, 'sage_project': False, 'lr': 0.009686892296125647, 'weight_decay': 1.7198929412603377e-05, 'epochs': 72, 'loss': 'mse', 'optimizer': 'adam', 'graph_mode': 'knn', 'knn_k': 6, 'weighted_edges': False, 'symmetrize_mode': 'union', 'self_loops': True, 'use_snp_selection': False}. Best is trial 48 with value: 0.31165090555774844.
[I 2025-12-10 07:56:17,467] Trial 115 finished with value: 0.30968732543664235 and parameters: {'model_type': 'graphsage', 'hidden_dims': '[512, 128]', 'dropout': 0.18574924440216822, 'batch_norm': True, 'sage_aggr': 'mean', 'sage_normalize': True, 'sage_project': False, 'lr': 0.001716940123007878, 'weight_decay': 5.617468955787001e-05, 'epochs': 274, 'loss': 'mse', 'optimizer': 'adam', 'graph_mode': 'knn', 'knn_k': 5, 'weighted_edges': False, 'symmetrize_mode': 'union', 'self_loops': True, 'use_snp_selection': False}. Best is trial 48 with value: 0.31165090555774844.
[I 2025-12-10 08:00:08,225] Trial 116 finished with value: 0.317085446151319 and parameters: {'model_type': 'graphsage', 'hidden_dims': '[512, 128]', 'dropout': 0.3823518748077041, 'batch_norm': True, 'sage_aggr': 'mean', 'sage_normalize': True, 'sage_project': False, 'lr': 0.0035071392467757156, 'weight_decay': 8.973872165493725e-05, 'epochs': 277, 'loss': 'mse', 'optimizer': 'adam', 'graph_mode': 'knn', 'knn_k': 5, 'weighted_edges': False, 'symmetrize_mode': 'union', 'self_loops': True, 'use_snp_selection': False}. Best is trial 116 with value: 0.317085446151319.
[I 2025-12-10 08:03:59,004] Trial 117 finished with value: 0.3098983807169091 and parameters: {'model_type': 'graphsage', 'hidden_dims': '[512, 128]', 'dropout': 0.18552669363615962, 'batch_norm': True, 'sage_aggr': 'mean', 'sage_normalize': True, 'sage_project': False, 'lr': 0.0033595952153962004, 'weight_decay': 0.00015103242931055607, 'epochs': 277, 'loss': 'mse', 'optimizer': 'adam', 'graph_mode': 'knn', 'knn_k': 5, 'weighted_edges': False, 'symmetrize_mode': 'union', 'self_loops': True, 'use_snp_selection': False}. Best is trial 116 with value: 0.317085446151319.
[I 2025-12-10 08:07:53,764] Trial 118 finished with value: 0.31636114315258956 and parameters: {'model_type': 'graphsage', 'hidden_dims': '[512, 128]', 'dropout': 0.15802510778208892, 'batch_norm': True, 'sage_aggr': 'mean', 'sage_normalize': True, 'sage_project': False, 'lr': 0.0033943446884188155, 'weight_decay': 0.00017384206092965605, 'epochs': 282, 'loss': 'mse', 'optimizer': 'adam', 'graph_mode': 'knn', 'knn_k': 5, 'weighted_edges': False, 'symmetrize_mode': 'union', 'self_loops': True, 'use_snp_selection': False}. Best is trial 116 with value: 0.317085446151319.
[I 2025-12-10 08:11:59,808] Trial 119 finished with value: 0.3151413281523311 and parameters: {'model_type': 'graphsage', 'hidden_dims': '[512, 128]', 'dropout': 0.18994360673085048, 'batch_norm': True, 'sage_aggr': 'mean', 'sage_normalize': True, 'sage_project': False, 'lr': 0.00353801835561142, 'weight_decay': 0.0002182216501959969, 'epochs': 278, 'loss': 'mse', 'optimizer': 'adam', 'graph_mode': 'knn', 'knn_k': 5, 'weighted_edges': False, 'symmetrize_mode': 'union', 'self_loops': True, 'use_snp_selection': True, 'num_snps': 42963}. Best is trial 116 with value: 0.317085446151319.
[I 2025-12-10 08:15:48,460] Trial 120 finished with value: 0.3039684814919278 and parameters: {'model_type': 'graphsage', 'hidden_dims': '[512, 128]', 'dropout': 0.18285129069300587, 'batch_norm': True, 'sage_aggr': 'mean', 'sage_normalize': True, 'sage_project': False, 'lr': 0.003456990086204619, 'weight_decay': 0.00020251257137476628, 'epochs': 278, 'loss': 'mse', 'optimizer': 'adam', 'graph_mode': 'knn', 'knn_k': 5, 'weighted_edges': False, 'symmetrize_mode': 'union', 'self_loops': False, 'use_snp_selection': True, 'num_snps': 43314}. Best is trial 116 with value: 0.317085446151319.
[I 2025-12-10 08:19:42,349] Trial 121 finished with value: 0.31240886186412115 and parameters: {'model_type': 'graphsage', 'hidden_dims': '[512, 128]', 'dropout': 0.15924886770541444, 'batch_norm': True, 'sage_aggr': 'mean', 'sage_normalize': True, 'sage_project': False, 'lr': 0.004194633766324968, 'weight_decay': 0.00012686084959542273, 'epochs': 301, 'loss': 'mse', 'optimizer': 'adam', 'graph_mode': 'knn', 'knn_k': 5, 'weighted_edges': False, 'symmetrize_mode': 'union', 'self_loops': True, 'use_snp_selection': True, 'num_snps': 41453}. Best is trial 116 with value: 0.317085446151319.
[I 2025-12-10 08:23:35,081] Trial 122 finished with value: 0.30360362846062366 and parameters: {'model_type': 'graphsage', 'hidden_dims': '[512, 128]', 'dropout': 0.1465385596596993, 'batch_norm': True, 'sage_aggr': 'mean', 'sage_normalize': True, 'sage_project': False, 'lr': 0.002991921189842565, 'weight_decay': 0.00030909958826556236, 'epochs': 284, 'loss': 'mse', 'optimizer': 'adam', 'graph_mode': 'knn', 'knn_k': 5, 'weighted_edges': False, 'symmetrize_mode': 'union', 'self_loops': True, 'use_snp_selection': True, 'num_snps': 41052}. Best is trial 116 with value: 0.317085446151319.
[I 2025-12-10 08:28:15,445] Trial 123 finished with value: 0.3095192145181268 and parameters: {'model_type': 'graphsage', 'hidden_dims': '[512, 128]', 'dropout': 0.1540860302857494, 'batch_norm': True, 'sage_aggr': 'mean', 'sage_normalize': True, 'sage_project': False, 'lr': 0.004125492726900787, 'weight_decay': 0.00011721069304080871, 'epochs': 287, 'loss': 'mse', 'optimizer': 'adam', 'graph_mode': 'knn', 'knn_k': 5, 'weighted_edges': False, 'symmetrize_mode': 'union', 'self_loops': True, 'use_snp_selection': True, 'num_snps': 48203}. Best is trial 116 with value: 0.317085446151319.
[I 2025-12-10 08:33:17,336] Trial 124 finished with value: 0.3171584343467778 and parameters: {'model_type': 'graphsage', 'hidden_dims': '[512, 128]', 'dropout': 0.1545423892051331, 'batch_norm': True, 'sage_aggr': 'mean', 'sage_normalize': True, 'sage_project': False, 'lr': 0.004300132201491419, 'weight_decay': 0.00011203339828840709, 'epochs': 301, 'loss': 'mse', 'optimizer': 'adam', 'graph_mode': 'knn', 'knn_k': 5, 'weighted_edges': False, 'symmetrize_mode': 'union', 'self_loops': True, 'use_snp_selection': True, 'num_snps': 49216}. Best is trial 124 with value: 0.3171584343467778.
[I 2025-12-10 08:39:01,332] Trial 125 finished with value: 0.3142014296152075 and parameters: {'model_type': 'graphsage', 'hidden_dims': '[512, 128]', 'dropout': 0.19322534703057093, 'batch_norm': True, 'sage_aggr': 'mean', 'sage_normalize': True, 'sage_project': False, 'lr': 0.004342242094829631, 'weight_decay': 0.00011795499582333809, 'epochs': 300, 'loss': 'mse', 'optimizer': 'adam', 'graph_mode': 'knn', 'knn_k': 5, 'weighted_edges': False, 'symmetrize_mode': 'union', 'self_loops': True, 'use_snp_selection': True, 'num_snps': 54423}. Best is trial 124 with value: 0.3171584343467778.
