[I 2025-12-09 02:00:01,296] Trial 125 finished with value: 0.31307886253674894 and parameters: {'model_type': 'graphsage', 'hidden_dims': '[512, 64]', 'dropout': 0.40558944593282703, 'batch_norm': True, 'sage_aggr': 'max', 'sage_normalize': True, 'sage_project': False, 'lr': 0.00284585447911698, 'weight_decay': 4.6000167975247325e-06, 'epochs': 82, 'loss': 'mse', 'optimizer': 'adam', 'graph_mode': 'cutoff', 'cutoff': 0.7962634171100774, 'grm_norm': 'cosine', 'self_loops': True, 'use_snp_selection': False}. Best is trial 82 with value: 0.31716674889826163.
[I 2025-12-09 02:00:52,814] Trial 126 finished with value: 0.30795870369673184 and parameters: {'model_type': 'graphsage', 'hidden_dims': '[512, 256]', 'dropout': 0.38546977761686174, 'batch_norm': True, 'sage_aggr': 'mean', 'sage_normalize': True, 'sage_project': False, 'lr': 0.006812414815369109, 'weight_decay': 1.8173039332763462e-07, 'epochs': 98, 'loss': 'mae', 'optimizer': 'adam', 'graph_mode': 'cutoff', 'cutoff': 0.8187125938634204, 'grm_norm': 'cosine', 'self_loops': True, 'use_snp_selection': False}. Best is trial 82 with value: 0.31716674889826163.
[I 2025-12-09 02:01:17,771] Trial 127 finished with value: 0.31302649639621893 and parameters: {'model_type': 'graphsage', 'hidden_dims': '[256, 128]', 'dropout': 0.4329992526894478, 'batch_norm': True, 'sage_aggr': 'mean', 'sage_normalize': True, 'sage_project': False, 'lr': 0.005819849920136721, 'weight_decay': 3.7551064388741894e-06, 'epochs': 64, 'loss': 'mse', 'optimizer': 'adam', 'graph_mode': 'cutoff', 'cutoff': 0.8643303065204747, 'grm_norm': 'cosine', 'self_loops': True, 'use_snp_selection': False}. Best is trial 82 with value: 0.31716674889826163.
[I 2025-12-09 02:02:41,656] Trial 128 finished with value: 0.30370949472626524 and parameters: {'model_type': 'graphsage', 'hidden_dims': '[512, 128]', 'dropout': 0.5235620028290752, 'batch_norm': True, 'sage_aggr': 'mean', 'sage_normalize': True, 'sage_project': False, 'lr': 0.008931973425346905, 'weight_decay': 3.023032321500808e-07, 'epochs': 124, 'loss': 'mse', 'optimizer': 'adam', 'graph_mode': 'knn', 'knn_k': 5, 'weighted_edges': False, 'symmetrize_mode': 'union', 'self_loops': True, 'use_snp_selection': False}. Best is trial 82 with value: 0.31716674889826163.
[I 2025-12-09 02:03:34,259] Trial 129 finished with value: 0.3036278730519173 and parameters: {'model_type': 'graphsage', 'hidden_dims': '[256, 128]', 'dropout': 0.39643713379797474, 'batch_norm': True, 'sage_aggr': 'mean', 'sage_normalize': True, 'sage_project': False, 'lr': 0.004918319230140431, 'weight_decay': 2.234566394058855e-06, 'epochs': 78, 'loss': 'mse', 'optimizer': 'adam', 'graph_mode': 'cutoff', 'cutoff': 0.20972663274464481, 'grm_norm': 'cosine', 'self_loops': True, 'use_snp_selection': False}. Best is trial 82 with value: 0.31716674889826163.
[I 2025-12-09 02:04:31,403] Trial 130 finished with value: 0.3110209728934293 and parameters: {'model_type': 'graphsage', 'hidden_dims': '[512, 64]', 'dropout': 0.5539400561729725, 'batch_norm': True, 'sage_aggr': 'mean', 'sage_normalize': True, 'sage_project': False, 'lr': 0.0035797559126578885, 'weight_decay': 5.557793115813048e-06, 'epochs': 113, 'loss': 'mse', 'optimizer': 'adam', 'graph_mode': 'cutoff', 'cutoff': 0.8314154981072481, 'grm_norm': 'cosine', 'self_loops': True, 'use_snp_selection': False}. Best is trial 82 with value: 0.31716674889826163.
[I 2025-12-09 02:05:07,106] Trial 131 finished with value: 0.311114975581221 and parameters: {'model_type': 'graphsage', 'hidden_dims': '[512, 64]', 'dropout': 0.4996048174844382, 'batch_norm': True, 'sage_aggr': 'mean', 'sage_normalize': True, 'sage_project': False, 'lr': 0.0036676662279627264, 'weight_decay': 2.7782948234983146e-07, 'epochs': 58, 'loss': 'mse', 'optimizer': 'adam', 'graph_mode': 'cutoff', 'cutoff': 0.7995054159115167, 'grm_norm': 'cosine', 'self_loops': True, 'use_snp_selection': False}. Best is trial 82 with value: 0.31716674889826163.
[I 2025-12-09 02:05:38,097] Trial 132 finished with value: 0.3007420986144963 and parameters: {'model_type': 'graphsage', 'hidden_dims': '[512, 64]', 'dropout': 0.5088302870185416, 'batch_norm': True, 'sage_aggr': 'mean', 'sage_normalize': True, 'sage_project': False, 'lr': 0.004364356718122381, 'weight_decay': 1.5591930963632304e-07, 'epochs': 46, 'loss': 'mse', 'optimizer': 'adam', 'graph_mode': 'cutoff', 'cutoff': 0.7740996232753689, 'grm_norm': 'cosine', 'self_loops': True, 'use_snp_selection': False}. Best is trial 82 with value: 0.31716674889826163.
[I 2025-12-09 02:06:15,352] Trial 133 finished with value: 0.3067433189588814 and parameters: {'model_type': 'graphsage', 'hidden_dims': '[512, 64]', 'dropout': 0.5114091218786414, 'batch_norm': True, 'sage_aggr': 'mean', 'sage_normalize': True, 'sage_project': False, 'lr': 0.0032425825239791152, 'weight_decay': 0.000675588628762608, 'epochs': 62, 'loss': 'mse', 'optimizer': 'adam', 'graph_mode': 'cutoff', 'cutoff': 0.8478583608726282, 'grm_norm': 'cosine', 'self_loops': True, 'use_snp_selection': False}. Best is trial 82 with value: 0.31716674889826163.
[I 2025-12-09 02:06:55,707] Trial 134 finished with value: 0.30718315555739706 and parameters: {'model_type': 'graphsage', 'hidden_dims': '[512, 64]', 'dropout': 0.4175989026863117, 'batch_norm': True, 'sage_aggr': 'mean', 'sage_normalize': True, 'sage_project': False, 'lr': 0.0006814764287211667, 'weight_decay': 9.137818996860254e-07, 'epochs': 70, 'loss': 'mse', 'optimizer': 'adam', 'graph_mode': 'cutoff', 'cutoff': 0.7603715053942883, 'grm_norm': 'cosine', 'self_loops': True, 'use_snp_selection': False}. Best is trial 82 with value: 0.31716674889826163.
[I 2025-12-09 02:07:43,084] Trial 135 finished with value: 0.31636371705787647 and parameters: {'model_type': 'graphsage', 'hidden_dims': '[512, 64]', 'dropout': 0.5341736975537715, 'batch_norm': True, 'sage_aggr': 'mean', 'sage_normalize': True, 'sage_project': False, 'lr': 0.006297238422122577, 'weight_decay': 5.868229681177055e-07, 'epochs': 88, 'loss': 'mse', 'optimizer': 'adam', 'graph_mode': 'cutoff', 'cutoff': 0.8008763963798945, 'grm_norm': 'cosine', 'self_loops': True, 'use_snp_selection': False}. Best is trial 82 with value: 0.31716674889826163.
[I 2025-12-09 02:08:13,649] Trial 136 finished with value: 0.3104249372648618 and parameters: {'model_type': 'graphsage', 'hidden_dims': '[256, 128]', 'dropout': 0.5339803951905944, 'batch_norm': True, 'sage_aggr': 'mean', 'sage_normalize': True, 'sage_project': False, 'lr': 0.009940212861944738, 'weight_decay': 5.654989330488677e-07, 'epochs': 90, 'loss': 'mse', 'optimizer': 'adam', 'graph_mode': 'cutoff', 'cutoff': 0.8274741228730281, 'grm_norm': 'cosine', 'self_loops': True, 'use_snp_selection': False}. Best is trial 82 with value: 0.31716674889826163.
[I 2025-12-09 02:08:59,933] Trial 137 finished with value: 0.3110412827639751 and parameters: {'model_type': 'graphsage', 'hidden_dims': '[512, 64]', 'dropout': 0.5687711576097615, 'batch_norm': True, 'sage_aggr': 'mean', 'sage_normalize': True, 'sage_project': False, 'lr': 0.006115506166130332, 'weight_decay': 1.6675084103301988e-06, 'epochs': 85, 'loss': 'mse', 'optimizer': 'adam', 'graph_mode': 'cutoff', 'cutoff': 0.7355026940000777, 'grm_norm': 'cosine', 'self_loops': True, 'use_snp_selection': False}. Best is trial 82 with value: 0.31716674889826163.
[I 2025-12-09 02:09:50,821] Trial 138 finished with value: 0.2870056434973085 and parameters: {'model_type': 'graphsage', 'hidden_dims': '[512, 128]', 'dropout': 0.28314596669709935, 'batch_norm': False, 'sage_aggr': 'mean', 'sage_normalize': True, 'sage_project': False, 'lr': 0.005141865995762593, 'weight_decay': 1.0511427737587086e-05, 'epochs': 97, 'loss': 'mse', 'optimizer': 'adam', 'graph_mode': 'cutoff', 'cutoff': 0.5704898183500754, 'grm_norm': 'gcn', 'self_loops': False, 'use_snp_selection': False}. Best is trial 82 with value: 0.31716674889826163.
[I 2025-12-09 02:10:17,936] Trial 139 finished with value: 0.31004551156107807 and parameters: {'model_type': 'graphsage', 'hidden_dims': '[256, 128]', 'dropout': 0.521426116821378, 'batch_norm': True, 'sage_aggr': 'mean', 'sage_normalize': True, 'sage_project': False, 'lr': 0.007555973481479838, 'weight_decay': 6.988553622363044e-07, 'epochs': 74, 'loss': 'mse', 'optimizer': 'adam', 'graph_mode': 'cutoff', 'cutoff': 0.6549738163846891, 'grm_norm': 'cosine', 'self_loops': True, 'use_snp_selection': False}. Best is trial 82 with value: 0.31716674889826163.
[I 2025-12-09 02:10:53,269] Trial 140 finished with value: 0.29022073663614617 and parameters: {'model_type': 'graphsage', 'hidden_dims': '[512, 64]', 'dropout': 0.3538709037336744, 'batch_norm': True, 'sage_aggr': 'mean', 'sage_normalize': True, 'sage_project': False, 'lr': 0.0063645503424214515, 'weight_decay': 6.812275687417847e-06, 'epochs': 104, 'loss': 'mse', 'optimizer': 'adam', 'graph_mode': 'cutoff', 'cutoff': 0.8092948500130117, 'grm_norm': 'cosine', 'self_loops': True, 'use_snp_selection': True, 'num_snps': 9540}. Best is trial 82 with value: 0.31716674889826163.
[I 2025-12-09 02:12:14,196] Trial 141 finished with value: 0.31383536824131375 and parameters: {'model_type': 'graphsage', 'hidden_dims': '[512, 64]', 'dropout': 0.4867192641972748, 'batch_norm': True, 'sage_aggr': 'mean', 'sage_normalize': True, 'sage_project': False, 'lr': 0.003981563615057492, 'weight_decay': 3.3151581041340437e-07, 'epochs': 173, 'loss': 'mse', 'optimizer': 'adam', 'graph_mode': 'cutoff', 'cutoff': 0.7929505527520063, 'grm_norm': 'cosine', 'self_loops': True, 'use_snp_selection': False}. Best is trial 82 with value: 0.31716674889826163.
[I 2025-12-09 02:12:57,796] Trial 142 finished with value: 0.31412814066448796 and parameters: {'model_type': 'graphsage', 'hidden_dims': '[512, 64]', 'dropout': 0.5037017257162297, 'batch_norm': True, 'sage_aggr': 'mean', 'sage_normalize': True, 'sage_project': False, 'lr': 0.005189282505110202, 'weight_decay': 2.0533365225528942e-07, 'epochs': 78, 'loss': 'mse', 'optimizer': 'adam', 'graph_mode': 'cutoff', 'cutoff': 0.7866548681830365, 'grm_norm': 'cosine', 'self_loops': True, 'use_snp_selection': False}. Best is trial 82 with value: 0.31716674889826163.
[I 2025-12-09 02:13:41,798] Trial 143 finished with value: 0.31468987606989496 and parameters: {'model_type': 'graphsage', 'hidden_dims': '[512, 64]', 'dropout': 0.5363073051176157, 'batch_norm': True, 'sage_aggr': 'mean', 'sage_normalize': True, 'sage_project': False, 'lr': 0.005442291829424616, 'weight_decay': 2.38733602251019e-07, 'epochs': 79, 'loss': 'mse', 'optimizer': 'adam', 'graph_mode': 'cutoff', 'cutoff': 0.6867283286211496, 'grm_norm': 'cosine', 'self_loops': True, 'use_snp_selection': False}. Best is trial 82 with value: 0.31716674889826163.
[I 2025-12-09 02:14:25,376] Trial 144 finished with value: 0.3103181580367772 and parameters: {'model_type': 'graphsage', 'hidden_dims': '[512, 64]', 'dropout': 0.558921904300601, 'batch_norm': True, 'sage_aggr': 'mean', 'sage_normalize': True, 'sage_project': False, 'lr': 0.00818313577884694, 'weight_decay': 2.228301239418636e-07, 'epochs': 78, 'loss': 'mse', 'optimizer': 'adam', 'graph_mode': 'cutoff', 'cutoff': 0.6839611509514868, 'grm_norm': 'cosine', 'self_loops': True, 'use_snp_selection': False}. Best is trial 82 with value: 0.31716674889826163.
[I 2025-12-09 02:15:12,473] Trial 145 finished with value: 0.314436981144312 and parameters: {'model_type': 'graphsage', 'hidden_dims': '[512, 64]', 'dropout': 0.5431659749206251, 'batch_norm': True, 'sage_aggr': 'mean', 'sage_normalize': True, 'sage_project': False, 'lr': 0.005746252028478801, 'weight_decay': 1.885541403889347e-07, 'epochs': 87, 'loss': 'mse', 'optimizer': 'adam', 'graph_mode': 'cutoff', 'cutoff': 0.7247889589802479, 'grm_norm': 'cosine', 'self_loops': True, 'use_snp_selection': False}. Best is trial 82 with value: 0.31716674889826163.
[I 2025-12-09 02:15:59,957] Trial 146 finished with value: 0.3134231505162196 and parameters: {'model_type': 'graphsage', 'hidden_dims': '[512, 64]', 'dropout': 0.5378962718532982, 'batch_norm': True, 'sage_aggr': 'mean', 'sage_normalize': True, 'sage_project': False, 'lr': 0.005596613715505729, 'weight_decay': 1.0087605813993566e-07, 'epochs': 88, 'loss': 'mse', 'optimizer': 'adam', 'graph_mode': 'cutoff', 'cutoff': 0.7231191614183934, 'grm_norm': 'cosine', 'self_loops': True, 'use_snp_selection': False}. Best is trial 82 with value: 0.31716674889826163.
[I 2025-12-09 02:16:45,242] Trial 147 finished with value: 0.3131970005207815 and parameters: {'model_type': 'graphsage', 'hidden_dims': '[512, 64]', 'dropout': 0.54716522779437, 'batch_norm': True, 'sage_aggr': 'max', 'sage_normalize': False, 'sage_project': False, 'lr': 0.007075276854036991, 'weight_decay': 1.7101202102603493e-07, 'epochs': 83, 'loss': 'mse', 'optimizer': 'adam', 'graph_mode': 'cutoff', 'cutoff': 0.7826401231738334, 'grm_norm': 'cosine', 'self_loops': True, 'use_snp_selection': False}. Best is trial 82 with value: 0.31716674889826163.
[I 2025-12-09 02:17:34,313] Trial 148 finished with value: 0.30765809748280437 and parameters: {'model_type': 'graphsage', 'hidden_dims': '[512, 64]', 'dropout': 0.526359805626364, 'batch_norm': True, 'sage_aggr': 'mean', 'sage_normalize': True, 'sage_project': False, 'lr': 0.0064506277881899, 'weight_decay': 1.9693461299596652e-07, 'epochs': 92, 'loss': 'mae', 'optimizer': 'adam', 'graph_mode': 'cutoff', 'cutoff': 0.7518322601511682, 'grm_norm': 'cosine_then_gcn', 'self_loops': True, 'use_snp_selection': False}. Best is trial 82 with value: 0.31716674889826163.
[I 2025-12-09 02:18:13,116] Trial 149 finished with value: 0.31153430780986807 and parameters: {'model_type': 'graphsage', 'hidden_dims': '[512, 64]', 'dropout': 0.5177047144454526, 'batch_norm': True, 'sage_aggr': 'mean', 'sage_normalize': True, 'sage_project': False, 'lr': 0.004555239759040427, 'weight_decay': 4.3686601283354157e-07, 'epochs': 68, 'loss': 'mse', 'optimizer': 'adam', 'graph_mode': 'cutoff', 'cutoff': 0.697012755097114, 'grm_norm': 'none', 'self_loops': True, 'use_snp_selection': False}. Best is trial 82 with value: 0.31716674889826163.
[I 2025-12-09 02:19:36,167] Trial 0 finished with value: 0.2894618246785872 and parameters: {'model_type': 'graphsage', 'hidden_dims': '[128, 64]', 'dropout': 0.199031432379812, 'batch_norm': True, 'sage_aggr': 'max', 'sage_normalize': True, 'sage_project': False, 'lr': 0.00034401453323286885, 'weight_decay': 0.00017802616915745114, 'epochs': 230, 'loss': 'mse', 'optimizer': 'adam', 'graph_mode': 'knn', 'knn_k': 6, 'weighted_edges': True, 'symmetrize_mode': 'mutual', 'self_loops': True, 'use_snp_selection': False}. Best is trial 0 with value: 0.2894618246785872.
[I 2025-12-09 02:21:15,499] Trial 1 finished with value: 0.2878659404483078 and parameters: {'model_type': 'graphsage', 'hidden_dims': '[512, 128]', 'dropout': 0.2503500283181017, 'batch_norm': False, 'sage_aggr': 'max', 'sage_normalize': False, 'sage_project': False, 'lr': 3.952233718592099e-05, 'weight_decay': 0.00026754769258252603, 'epochs': 149, 'loss': 'mse', 'optimizer': 'adam', 'graph_mode': 'knn', 'knn_k': 2, 'weighted_edges': False, 'symmetrize_mode': 'mutual', 'self_loops': True, 'use_snp_selection': True, 'num_snps': 49915}. Best is trial 0 with value: 0.2894618246785872.
[I 2025-12-09 02:22:31,997] Trial 2 finished with value: 0.2922644128225721 and parameters: {'model_type': 'graphsage', 'hidden_dims': '[512, 256]', 'dropout': 0.2785908793172681, 'batch_norm': False, 'sage_aggr': 'max', 'sage_normalize': False, 'sage_project': False, 'lr': 8.806039223165805e-05, 'weight_decay': 3.5153176302760294e-05, 'epochs': 147, 'loss': 'mae', 'optimizer': 'adam', 'graph_mode': 'cutoff', 'cutoff': 0.4922564006874869, 'grm_norm': 'gcn', 'self_loops': False, 'use_snp_selection': True, 'num_snps': 34340}. Best is trial 2 with value: 0.2922644128225721.
[I 2025-12-09 02:23:45,262] Trial 3 finished with value: 0.30839802174506414 and parameters: {'model_type': 'graphsage', 'hidden_dims': '[256, 128, 64]', 'dropout': 0.3475243154412272, 'batch_norm': True, 'sage_aggr': 'max', 'sage_normalize': False, 'sage_project': False, 'lr': 1.6006331996938085e-05, 'weight_decay': 7.213121225589906e-06, 'epochs': 283, 'loss': 'mse', 'optimizer': 'adam', 'graph_mode': 'cutoff', 'cutoff': 0.5942334791449215, 'grm_norm': 'none', 'self_loops': True, 'use_snp_selection': False}. Best is trial 3 with value: 0.30839802174506414.
[I 2025-12-09 02:24:27,763] Trial 4 finished with value: 0.2733589444811447 and parameters: {'model_type': 'graphsage', 'hidden_dims': '[128, 64]', 'dropout': 0.3348926467202472, 'batch_norm': True, 'sage_aggr': 'max', 'sage_normalize': False, 'sage_project': False, 'lr': 0.0004238630400638802, 'weight_decay': 8.074086040046576e-07, 'epochs': 158, 'loss': 'mae', 'optimizer': 'adam', 'graph_mode': 'knn', 'knn_k': 1, 'weighted_edges': False, 'symmetrize_mode': 'mutual', 'self_loops': False, 'use_snp_selection': True, 'num_snps': 26850}. Best is trial 3 with value: 0.30839802174506414.
[I 2025-12-09 02:26:15,526] Trial 5 finished with value: 0.28235706761862506 and parameters: {'model_type': 'graphsage', 'hidden_dims': '[512, 64]', 'dropout': 0.14505336736221927, 'batch_norm': True, 'sage_aggr': 'mean', 'sage_normalize': True, 'sage_project': False, 'lr': 1.2962030165732234e-05, 'weight_decay': 1.326598071105465e-07, 'epochs': 180, 'loss': 'mse', 'optimizer': 'adam', 'graph_mode': 'knn', 'knn_k': 9, 'weighted_edges': True, 'symmetrize_mode': 'mutual', 'self_loops': False, 'use_snp_selection': False}. Best is trial 3 with value: 0.30839802174506414.
[I 2025-12-09 02:27:08,616] Trial 6 finished with value: 0.2943439552731423 and parameters: {'model_type': 'graphsage', 'hidden_dims': '[256, 128, 64]', 'dropout': 0.10731743755162496, 'batch_norm': True, 'sage_aggr': 'mean', 'sage_normalize': False, 'sage_project': False, 'lr': 1.922990426933137e-05, 'weight_decay': 7.30001060446905e-05, 'epochs': 63, 'loss': 'mae', 'optimizer': 'adam', 'graph_mode': 'cutoff', 'cutoff': 0.7624978434202536, 'grm_norm': 'none', 'self_loops': True, 'use_snp_selection': True, 'num_snps': 50106}. Best is trial 3 with value: 0.30839802174506414.
[I 2025-12-09 02:29:00,715] Trial 7 finished with value: 0.30812961706904696 and parameters: {'model_type': 'graphsage', 'hidden_dims': '[512, 64]', 'dropout': 0.2585007811528941, 'batch_norm': True, 'sage_aggr': 'max', 'sage_normalize': True, 'sage_project': False, 'lr': 5.921425508303391e-05, 'weight_decay': 0.0004511561961144237, 'epochs': 182, 'loss': 'mae', 'optimizer': 'adam', 'graph_mode': 'knn', 'knn_k': 9, 'weighted_edges': True, 'symmetrize_mode': 'union', 'self_loops': False, 'use_snp_selection': True, 'num_snps': 23903}. Best is trial 3 with value: 0.30839802174506414.
[I 2025-12-09 02:29:42,500] Trial 8 finished with value: 0.26401133700448 and parameters: {'model_type': 'graphsage', 'hidden_dims': '[512, 256]', 'dropout': 0.3061380386767003, 'batch_norm': False, 'sage_aggr': 'mean', 'sage_normalize': True, 'sage_project': False, 'lr': 0.000698401460570184, 'weight_decay': 2.965560055460244e-06, 'epochs': 289, 'loss': 'mae', 'optimizer': 'adam', 'graph_mode': 'knn', 'knn_k': 7, 'weighted_edges': False, 'symmetrize_mode': 'mutual', 'self_loops': True, 'use_snp_selection': True, 'num_snps': 4710}. Best is trial 3 with value: 0.30839802174506414.
[I 2025-12-09 02:33:21,048] Trial 9 finished with value: 0.294942240002197 and parameters: {'model_type': 'graphsage', 'hidden_dims': '[512, 128]', 'dropout': 0.1733844071393634, 'batch_norm': False, 'sage_aggr': 'mean', 'sage_normalize': True, 'sage_project': False, 'lr': 0.0004269677918501597, 'weight_decay': 2.2439779626249696e-06, 'epochs': 319, 'loss': 'mse', 'optimizer': 'adam', 'graph_mode': 'cutoff', 'cutoff': 0.24117565767129295, 'grm_norm': 'cosine_then_gcn', 'self_loops': True, 'use_snp_selection': False}. Best is trial 3 with value: 0.30839802174506414.
[I 2025-12-09 02:34:27,708] Trial 10 finished with value: 0.3074043844607498 and parameters: {'model_type': 'graphsage', 'hidden_dims': '[256, 128, 64]', 'dropout': 0.5062131504581071, 'batch_norm': True, 'sage_aggr': 'max', 'sage_normalize': False, 'sage_project': False, 'lr': 0.0060050040216813455, 'weight_decay': 1.5886244399072472e-05, 'epochs': 258, 'loss': 'mse', 'optimizer': 'adam', 'graph_mode': 'cutoff', 'cutoff': 0.6388703494956212, 'grm_norm': 'none', 'self_loops': True, 'use_snp_selection': False}. Best is trial 3 with value: 0.30839802174506414.
[I 2025-12-09 02:35:43,597] Trial 11 finished with value: 0.2811297500495108 and parameters: {'model_type': 'graphsage', 'hidden_dims': '[256, 128]', 'dropout': 0.4364908761004652, 'batch_norm': True, 'sage_aggr': 'max', 'sage_normalize': True, 'sage_project': False, 'lr': 6.504783644634876e-05, 'weight_decay': 0.000742735395471688, 'epochs': 224, 'loss': 'mae', 'optimizer': 'adam', 'graph_mode': 'cutoff', 'cutoff': 0.4323326075199111, 'grm_norm': 'cosine', 'self_loops': False, 'use_snp_selection': False}. Best is trial 3 with value: 0.30839802174506414.
[I 2025-12-09 02:37:20,493] Trial 12 finished with value: 0.30566630418918217 and parameters: {'model_type': 'graphsage', 'hidden_dims': '[512, 64]', 'dropout': 0.4060765838939504, 'batch_norm': True, 'sage_aggr': 'max', 'sage_normalize': True, 'sage_project': False, 'lr': 0.00010429585788584186, 'weight_decay': 6.400043463515846e-06, 'epochs': 334, 'loss': 'mse', 'optimizer': 'adam', 'graph_mode': 'knn', 'knn_k': 10, 'weighted_edges': True, 'symmetrize_mode': 'union', 'self_loops': False, 'use_snp_selection': True, 'num_snps': 13096}. Best is trial 3 with value: 0.30839802174506414.
