[I 2025-12-09 08:55:12,152] Trial 7 finished with value: 0.2591097758009296 and parameters: {'model_type': 'graphsage', 'hidden_dims': '[512, 64]', 'dropout': 0.2585007811528941, 'batch_norm': True, 'sage_aggr': 'max', 'sage_normalize': True, 'sage_project': False, 'lr': 5.921425508303391e-05, 'weight_decay': 0.0004511561961144237, 'epochs': 182, 'loss': 'mae', 'optimizer': 'adam', 'graph_mode': 'knn', 'knn_k': 9, 'weighted_edges': True, 'symmetrize_mode': 'union', 'self_loops': False, 'use_snp_selection': True, 'num_snps': 23903}. Best is trial 2 with value: 0.28298274318703115.
[I 2025-12-09 08:55:55,254] Trial 8 finished with value: 0.2438764918867034 and parameters: {'model_type': 'graphsage', 'hidden_dims': '[512, 256]', 'dropout': 0.3061380386767003, 'batch_norm': False, 'sage_aggr': 'mean', 'sage_normalize': True, 'sage_project': False, 'lr': 0.000698401460570184, 'weight_decay': 2.965560055460244e-06, 'epochs': 289, 'loss': 'mae', 'optimizer': 'adam', 'graph_mode': 'knn', 'knn_k': 7, 'weighted_edges': False, 'symmetrize_mode': 'mutual', 'self_loops': True, 'use_snp_selection': True, 'num_snps': 4710}. Best is trial 2 with value: 0.28298274318703115.
[I 2025-12-09 08:59:47,639] Trial 9 finished with value: 0.2779387555360363 and parameters: {'model_type': 'graphsage', 'hidden_dims': '[512, 128]', 'dropout': 0.1733844071393634, 'batch_norm': False, 'sage_aggr': 'mean', 'sage_normalize': True, 'sage_project': False, 'lr': 0.0004269677918501597, 'weight_decay': 2.2439779626249696e-06, 'epochs': 319, 'loss': 'mse', 'optimizer': 'adam', 'graph_mode': 'cutoff', 'cutoff': 0.24117565767129295, 'grm_norm': 'cosine_then_gcn', 'self_loops': True, 'use_snp_selection': False}. Best is trial 2 with value: 0.28298274318703115.
[I 2025-12-09 09:00:54,534] Trial 10 finished with value: 0.0 and parameters: {'model_type': 'graphsage', 'hidden_dims': '[512, 256]', 'dropout': 0.46773351022590026, 'batch_norm': False, 'sage_aggr': 'max', 'sage_normalize': False, 'sage_project': False, 'lr': 0.0060050040216813455, 'weight_decay': 3.194347401809951e-05, 'epochs': 76, 'loss': 'mae', 'optimizer': 'adam', 'graph_mode': 'cutoff', 'cutoff': 0.36538426242387784, 'grm_norm': 'gcn', 'self_loops': False, 'use_snp_selection': True, 'num_snps': 36724}. Best is trial 2 with value: 0.28298274318703115.
[I 2025-12-09 09:05:06,947] Trial 11 finished with value: 0.2653090327349779 and parameters: {'model_type': 'graphsage', 'hidden_dims': '[512, 128]', 'dropout': 0.4926018175562089, 'batch_norm': False, 'sage_aggr': 'mean', 'sage_normalize': True, 'sage_project': False, 'lr': 0.00014329243697702685, 'weight_decay': 1.722110956047924e-06, 'epochs': 348, 'loss': 'mse', 'optimizer': 'adam', 'graph_mode': 'cutoff', 'cutoff': 0.2414787267843555, 'grm_norm': 'cosine_then_gcn', 'self_loops': False, 'use_snp_selection': False}. Best is trial 2 with value: 0.28298274318703115.
[I 2025-12-09 09:05:49,736] Trial 12 finished with value: 0.10390568094872962 and parameters: {'model_type': 'graphsage', 'hidden_dims': '[256, 128]', 'dropout': 0.43023986054505536, 'batch_norm': False, 'sage_aggr': 'mean', 'sage_normalize': False, 'sage_project': False, 'lr': 0.0015819635574112379, 'weight_decay': 1.8695700928243635e-05, 'epochs': 111, 'loss': 'mae', 'optimizer': 'adam', 'graph_mode': 'cutoff', 'cutoff': 0.4539392500583933, 'grm_norm': 'cosine', 'self_loops': True, 'use_snp_selection': False}. Best is trial 2 with value: 0.28298274318703115.
[I 2025-12-09 09:09:02,093] Trial 13 finished with value: 0.2606743474611898 and parameters: {'model_type': 'graphsage', 'hidden_dims': '[512, 128]', 'dropout': 0.20624866782415616, 'batch_norm': False, 'sage_aggr': 'mean', 'sage_normalize': True, 'sage_project': False, 'lr': 0.00011409016483231961, 'weight_decay': 3.631683101615644e-07, 'epochs': 236, 'loss': 'mse', 'optimizer': 'adam', 'graph_mode': 'cutoff', 'cutoff': 0.2113408832569374, 'grm_norm': 'cosine_then_gcn', 'self_loops': False, 'use_snp_selection': False}. Best is trial 2 with value: 0.28298274318703115.
[I 2025-12-09 09:09:40,476] Trial 14 finished with value: 0.27089369336345887 and parameters: {'model_type': 'graphsage', 'hidden_dims': '[512, 256]', 'dropout': 0.41414455041432496, 'batch_norm': False, 'sage_aggr': 'max', 'sage_normalize': False, 'sage_project': False, 'lr': 0.0012297848507367218, 'weight_decay': 5.909449006231032e-06, 'epochs': 112, 'loss': 'mae', 'optimizer': 'adam', 'graph_mode': 'cutoff', 'cutoff': 0.5913889507252488, 'grm_norm': 'gcn', 'self_loops': True, 'use_snp_selection': True, 'num_snps': 11562}. Best is trial 2 with value: 0.28298274318703115.
[I 2025-12-09 09:11:09,549] Trial 15 finished with value: 0.25635324195896436 and parameters: {'model_type': 'graphsage', 'hidden_dims': '[256, 128]', 'dropout': 0.5886866495246754, 'batch_norm': False, 'sage_aggr': 'mean', 'sage_normalize': True, 'sage_project': False, 'lr': 0.00015629493379297512, 'weight_decay': 5.5844131462578395e-05, 'epochs': 337, 'loss': 'mse', 'optimizer': 'adam', 'graph_mode': 'cutoff', 'cutoff': 0.8475038865168296, 'grm_norm': 'cosine_then_gcn', 'self_loops': False, 'use_snp_selection': False}. Best is trial 2 with value: 0.28298274318703115.
[I 2025-12-09 09:13:18,106] Trial 16 finished with value: 0.12088620752815556 and parameters: {'model_type': 'graphsage', 'hidden_dims': '[512, 128]', 'dropout': 0.18943770059413456, 'batch_norm': False, 'sage_aggr': 'mean', 'sage_normalize': True, 'sage_project': False, 'lr': 0.0027314205297835513, 'weight_decay': 1.4201866955300369e-05, 'epochs': 234, 'loss': 'mae', 'optimizer': 'adam', 'graph_mode': 'cutoff', 'cutoff': 0.38219712814047724, 'grm_norm': 'gcn', 'self_loops': False, 'use_snp_selection': False}. Best is trial 2 with value: 0.28298274318703115.
[I 2025-12-09 09:15:13,815] Trial 17 finished with value: 0.2627234209134964 and parameters: {'model_type': 'graphsage', 'hidden_dims': '[512, 256]', 'dropout': 0.2770922804913839, 'batch_norm': False, 'sage_aggr': 'max', 'sage_normalize': False, 'sage_project': False, 'lr': 5.669900756680493e-05, 'weight_decay': 0.0009434791891988082, 'epochs': 294, 'loss': 'mse', 'optimizer': 'adam', 'graph_mode': 'cutoff', 'cutoff': 0.6908055822673191, 'grm_norm': 'cosine', 'self_loops': True, 'use_snp_selection': True, 'num_snps': 38468}. Best is trial 2 with value: 0.28298274318703115.
[I 2025-12-09 09:16:20,509] Trial 18 finished with value: 0.24686429414794747 and parameters: {'model_type': 'graphsage', 'hidden_dims': '[512, 128]', 'dropout': 0.115364333546502, 'batch_norm': False, 'sage_aggr': 'mean', 'sage_normalize': False, 'sage_project': False, 'lr': 0.00024707839333948655, 'weight_decay': 1.6988644288561655e-06, 'epochs': 116, 'loss': 'mae', 'optimizer': 'adam', 'graph_mode': 'cutoff', 'cutoff': 0.45563243052713936, 'grm_norm': 'gcn', 'self_loops': True, 'use_snp_selection': False}. Best is trial 2 with value: 0.28298274318703115.
[I 2025-12-09 09:17:34,853] Trial 19 finished with value: 0.2425383966896552 and parameters: {'model_type': 'graphsage', 'hidden_dims': '[512, 256]', 'dropout': 0.17313653901223688, 'batch_norm': False, 'sage_aggr': 'max', 'sage_normalize': True, 'sage_project': False, 'lr': 0.0005914958479580547, 'weight_decay': 4.3240624116999746e-07, 'epochs': 40, 'loss': 'mse', 'optimizer': 'adam', 'graph_mode': 'cutoff', 'cutoff': 0.3085556998654671, 'grm_norm': 'cosine_then_gcn', 'self_loops': False, 'use_snp_selection': True, 'num_snps': 56339}. Best is trial 2 with value: 0.28298274318703115.
[I 2025-12-09 09:18:24,042] Trial 20 finished with value: 0.23060126506520762 and parameters: {'model_type': 'graphsage', 'hidden_dims': '[128, 64]', 'dropout': 0.38969496280185484, 'batch_norm': False, 'sage_aggr': 'mean', 'sage_normalize': True, 'sage_project': False, 'lr': 0.008080214429654266, 'weight_decay': 3.913283335827769e-06, 'epochs': 215, 'loss': 'mae', 'optimizer': 'adam', 'graph_mode': 'cutoff', 'cutoff': 0.5001995434253449, 'grm_norm': 'gcn', 'self_loops': True, 'use_snp_selection': False}. Best is trial 2 with value: 0.28298274318703115.
[I 2025-12-09 09:19:39,625] Trial 21 finished with value: 0.27793270589652025 and parameters: {'model_type': 'graphsage', 'hidden_dims': '[256, 128, 64]', 'dropout': 0.3384736973111182, 'batch_norm': True, 'sage_aggr': 'max', 'sage_normalize': False, 'sage_project': False, 'lr': 2.081134113161995e-05, 'weight_decay': 8.019635028697118e-06, 'epochs': 275, 'loss': 'mse', 'optimizer': 'adam', 'graph_mode': 'cutoff', 'cutoff': 0.606781528166679, 'grm_norm': 'none', 'self_loops': True, 'use_snp_selection': False}. Best is trial 2 with value: 0.28298274318703115.
[I 2025-12-09 09:21:04,167] Trial 22 finished with value: 0.2790171903825134 and parameters: {'model_type': 'graphsage', 'hidden_dims': '[256, 128, 64]', 'dropout': 0.2337849635501907, 'batch_norm': True, 'sage_aggr': 'max', 'sage_normalize': False, 'sage_project': False, 'lr': 3.2032821063176095e-05, 'weight_decay': 1.222363769169734e-05, 'epochs': 318, 'loss': 'mse', 'optimizer': 'adam', 'graph_mode': 'cutoff', 'cutoff': 0.6612712758294658, 'grm_norm': 'none', 'self_loops': True, 'use_snp_selection': False}. Best is trial 2 with value: 0.28298274318703115.
[I 2025-12-09 09:22:25,104] Trial 23 finished with value: 0.2734518288875797 and parameters: {'model_type': 'graphsage', 'hidden_dims': '[256, 128, 64]', 'dropout': 0.23065686778736058, 'batch_norm': True, 'sage_aggr': 'max', 'sage_normalize': False, 'sage_project': False, 'lr': 8.146052764895949e-05, 'weight_decay': 8.535206135366625e-05, 'epochs': 303, 'loss': 'mse', 'optimizer': 'adam', 'graph_mode': 'cutoff', 'cutoff': 0.6788907858754398, 'grm_norm': 'none', 'self_loops': True, 'use_snp_selection': False}. Best is trial 2 with value: 0.28298274318703115.
[I 2025-12-09 09:23:49,484] Trial 24 finished with value: 0.27502849490319664 and parameters: {'model_type': 'graphsage', 'hidden_dims': '[256, 128, 64]', 'dropout': 0.2863899485819795, 'batch_norm': True, 'sage_aggr': 'max', 'sage_normalize': False, 'sage_project': False, 'lr': 3.236601465158931e-05, 'weight_decay': 2.384926720166691e-05, 'epochs': 317, 'loss': 'mse', 'optimizer': 'adam', 'graph_mode': 'cutoff', 'cutoff': 0.7004785566901904, 'grm_norm': 'cosine_then_gcn', 'self_loops': True, 'use_snp_selection': False}. Best is trial 2 with value: 0.28298274318703115.
[I 2025-12-09 09:24:58,521] Trial 25 finished with value: 0.2655556653975147 and parameters: {'model_type': 'graphsage', 'hidden_dims': '[256, 128]', 'dropout': 0.16255463667774223, 'batch_norm': False, 'sage_aggr': 'max', 'sage_normalize': False, 'sage_project': False, 'lr': 3.205655222209532e-05, 'weight_decay': 4.4299703687350805e-05, 'epochs': 262, 'loss': 'mse', 'optimizer': 'adam', 'graph_mode': 'cutoff', 'cutoff': 0.8833190340981499, 'grm_norm': 'none', 'self_loops': True, 'use_snp_selection': False}. Best is trial 2 with value: 0.28298274318703115.
[I 2025-12-09 09:26:12,016] Trial 26 finished with value: 0.26691054559312277 and parameters: {'model_type': 'graphsage', 'hidden_dims': '[512, 64]', 'dropout': 0.2270100243778756, 'batch_norm': True, 'sage_aggr': 'max', 'sage_normalize': False, 'sage_project': False, 'lr': 0.00023654525670727355, 'weight_decay': 1.2099836155778508e-05, 'epochs': 319, 'loss': 'mse', 'optimizer': 'adam', 'graph_mode': 'cutoff', 'cutoff': 0.5205676299943981, 'grm_norm': 'cosine', 'self_loops': False, 'use_snp_selection': True, 'num_snps': 18093}. Best is trial 2 with value: 0.28298274318703115.
[I 2025-12-09 09:28:09,572] Trial 27 finished with value: 0.2732007523356086 and parameters: {'model_type': 'graphsage', 'hidden_dims': '[512, 256]', 'dropout': 0.1501018444271975, 'batch_norm': False, 'sage_aggr': 'max', 'sage_normalize': False, 'sage_project': False, 'lr': 9.721038543246201e-05, 'weight_decay': 1.9573766726811565e-06, 'epochs': 259, 'loss': 'mse', 'optimizer': 'adam', 'graph_mode': 'cutoff', 'cutoff': 0.7718502023109917, 'grm_norm': 'none', 'self_loops': True, 'use_snp_selection': False}. Best is trial 2 with value: 0.28298274318703115.
[I 2025-12-09 09:30:30,750] Trial 28 finished with value: 0.281636068785538 and parameters: {'model_type': 'graphsage', 'hidden_dims': '[512, 128]', 'dropout': 0.3070538302356778, 'batch_norm': True, 'sage_aggr': 'mean', 'sage_normalize': True, 'sage_project': False, 'lr': 0.0001702142288579236, 'weight_decay': 0.00013324775153523578, 'epochs': 204, 'loss': 'mae', 'optimizer': 'adam', 'graph_mode': 'cutoff', 'cutoff': 0.2880843313362003, 'grm_norm': 'gcn', 'self_loops': False, 'use_snp_selection': True, 'num_snps': 37285}. Best is trial 2 with value: 0.28298274318703115.
[I 2025-12-09 09:31:46,433] Trial 29 finished with value: 0.2129533715220479 and parameters: {'model_type': 'graphsage', 'hidden_dims': '[128, 64]', 'dropout': 0.2945892566525694, 'batch_norm': True, 'sage_aggr': 'max', 'sage_normalize': True, 'sage_project': False, 'lr': 1.0424457790839495e-05, 'weight_decay': 0.00011400137880444859, 'epochs': 150, 'loss': 'mae', 'optimizer': 'adam', 'graph_mode': 'knn', 'knn_k': 3, 'weighted_edges': True, 'symmetrize_mode': 'union', 'self_loops': False, 'use_snp_selection': True, 'num_snps': 37237}. Best is trial 2 with value: 0.28298274318703115.
[I 2025-12-09 09:33:55,616] Trial 30 finished with value: 0.2671186883483453 and parameters: {'model_type': 'graphsage', 'hidden_dims': '[256, 128, 64]', 'dropout': 0.3800567019324721, 'batch_norm': True, 'sage_aggr': 'max', 'sage_normalize': False, 'sage_project': False, 'lr': 0.00019065421090925058, 'weight_decay': 0.00016495127211271085, 'epochs': 207, 'loss': 'mae', 'optimizer': 'adam', 'graph_mode': 'cutoff', 'cutoff': 0.3360989079600678, 'grm_norm': 'gcn', 'self_loops': False, 'use_snp_selection': True, 'num_snps': 46025}. Best is trial 2 with value: 0.28298274318703115.
[I 2025-12-09 09:35:34,642] Trial 31 finished with value: 0.2818388893842501 and parameters: {'model_type': 'graphsage', 'hidden_dims': '[512, 128]', 'dropout': 0.2123734286895555, 'batch_norm': True, 'sage_aggr': 'mean', 'sage_normalize': True, 'sage_project': False, 'lr': 0.00033656573563147483, 'weight_decay': 0.0002596515086271138, 'epochs': 134, 'loss': 'mae', 'optimizer': 'adam', 'graph_mode': 'cutoff', 'cutoff': 0.252582416776669, 'grm_norm': 'gcn', 'self_loops': False, 'use_snp_selection': True, 'num_snps': 30255}. Best is trial 2 with value: 0.28298274318703115.
[I 2025-12-09 09:36:52,571] Trial 32 finished with value: 0.29189045781402256 and parameters: {'model_type': 'graphsage', 'hidden_dims': '[512, 128]', 'dropout': 0.24867214428953893, 'batch_norm': True, 'sage_aggr': 'mean', 'sage_normalize': True, 'sage_project': False, 'lr': 5.900457773265838e-05, 'weight_decay': 0.00022354747909432345, 'epochs': 132, 'loss': 'mae', 'optimizer': 'adam', 'graph_mode': 'cutoff', 'cutoff': 0.4218364183593274, 'grm_norm': 'gcn', 'self_loops': False, 'use_snp_selection': True, 'num_snps': 34325}. Best is trial 32 with value: 0.29189045781402256.
[I 2025-12-09 09:38:22,879] Trial 33 finished with value: 0.27340190310877766 and parameters: {'model_type': 'graphsage', 'hidden_dims': '[512, 128]', 'dropout': 0.3127056642163181, 'batch_norm': True, 'sage_aggr': 'mean', 'sage_normalize': True, 'sage_project': False, 'lr': 5.5293268994277286e-05, 'weight_decay': 0.0003232216749518883, 'epochs': 132, 'loss': 'mae', 'optimizer': 'adam', 'graph_mode': 'cutoff', 'cutoff': 0.28610360831963333, 'grm_norm': 'gcn', 'self_loops': False, 'use_snp_selection': True, 'num_snps': 32172}. Best is trial 32 with value: 0.29189045781402256.
[I 2025-12-09 09:39:58,984] Trial 34 finished with value: 0.2751703228901414 and parameters: {'model_type': 'graphsage', 'hidden_dims': '[512, 128]', 'dropout': 0.2639450377697792, 'batch_norm': True, 'sage_aggr': 'mean', 'sage_normalize': True, 'sage_project': False, 'lr': 0.0003421692356376881, 'weight_decay': 0.000702604676954342, 'epochs': 167, 'loss': 'mae', 'optimizer': 'adam', 'graph_mode': 'knn', 'knn_k': 4, 'weighted_edges': False, 'symmetrize_mode': 'union', 'self_loops': False, 'use_snp_selection': True, 'num_snps': 29988}. Best is trial 32 with value: 0.29189045781402256.
[I 2025-12-09 09:41:16,709] Trial 35 finished with value: 0.285290410244537 and parameters: {'model_type': 'graphsage', 'hidden_dims': '[512, 128]', 'dropout': 0.20824441341504826, 'batch_norm': True, 'sage_aggr': 'mean', 'sage_normalize': True, 'sage_project': False, 'lr': 8.488558611566207e-05, 'weight_decay': 0.00015710823781255867, 'epochs': 95, 'loss': 'mae', 'optimizer': 'adam', 'graph_mode': 'cutoff', 'cutoff': 0.4287110042850026, 'grm_norm': 'gcn', 'self_loops': False, 'use_snp_selection': True, 'num_snps': 41838}. Best is trial 32 with value: 0.29189045781402256.
[I 2025-12-09 09:42:35,617] Trial 36 finished with value: 0.2960321170656044 and parameters: {'model_type': 'graphsage', 'hidden_dims': '[512, 128]', 'dropout': 0.19568313088466122, 'batch_norm': True, 'sage_aggr': 'mean', 'sage_normalize': True, 'sage_project': False, 'lr': 8.705144581853952e-05, 'weight_decay': 0.0002184190914808763, 'epochs': 96, 'loss': 'mae', 'optimizer': 'adam', 'graph_mode': 'cutoff', 'cutoff': 0.4133611565086981, 'grm_norm': 'gcn', 'self_loops': False, 'use_snp_selection': True, 'num_snps': 41777}. Best is trial 36 with value: 0.2960321170656044.
[I 2025-12-09 09:44:34,666] Trial 37 finished with value: 0.27199590881566726 and parameters: {'model_type': 'graphsage', 'hidden_dims': '[512, 128]', 'dropout': 0.13996814243411987, 'batch_norm': True, 'sage_aggr': 'mean', 'sage_normalize': True, 'sage_project': False, 'lr': 8.424580032017565e-05, 'weight_decay': 0.00022096705524734923, 'epochs': 73, 'loss': 'mae', 'optimizer': 'adam', 'graph_mode': 'knn', 'knn_k': 10, 'weighted_edges': True, 'symmetrize_mode': 'union', 'self_loops': False, 'use_snp_selection': True, 'num_snps': 43601}. Best is trial 36 with value: 0.2960321170656044.
[I 2025-12-09 09:45:59,046] Trial 38 finished with value: 0.2882644851240622 and parameters: {'model_type': 'graphsage', 'hidden_dims': '[512, 128]', 'dropout': 0.25617732239014596, 'batch_norm': True, 'sage_aggr': 'mean', 'sage_normalize': True, 'sage_project': False, 'lr': 2.3990802570231646e-05, 'weight_decay': 0.00044917224764142333, 'epochs': 96, 'loss': 'mae', 'optimizer': 'adam', 'graph_mode': 'cutoff', 'cutoff': 0.4304805245561101, 'grm_norm': 'gcn', 'self_loops': False, 'use_snp_selection': True, 'num_snps': 45074}. Best is trial 36 with value: 0.2960321170656044.
[I 2025-12-09 09:47:20,838] Trial 39 finished with value: 0.27997769773304626 and parameters: {'model_type': 'graphsage', 'hidden_dims': '[512, 128]', 'dropout': 0.24465373000347612, 'batch_norm': True, 'sage_aggr': 'mean', 'sage_normalize': True, 'sage_project': False, 'lr': 4.838769797070395e-05, 'weight_decay': 0.00048236253661513206, 'epochs': 93, 'loss': 'mae', 'optimizer': 'adam', 'graph_mode': 'cutoff', 'cutoff': 0.4197762623803302, 'grm_norm': 'gcn', 'self_loops': False, 'use_snp_selection': True, 'num_snps': 44312}. Best is trial 36 with value: 0.2960321170656044.
[I 2025-12-09 09:48:30,231] Trial 40 finished with value: 0.2592714268407725 and parameters: {'model_type': 'graphsage', 'hidden_dims': '[512, 128]', 'dropout': 0.1921010105589468, 'batch_norm': True, 'sage_aggr': 'mean', 'sage_normalize': True, 'sage_project': False, 'lr': 1.5555892850969536e-05, 'weight_decay': 0.0004947787916932299, 'epochs': 46, 'loss': 'mae', 'optimizer': 'adam', 'graph_mode': 'knn', 'knn_k': 5, 'weighted_edges': False, 'symmetrize_mode': 'union', 'self_loops': False, 'use_snp_selection': True, 'num_snps': 42059}. Best is trial 36 with value: 0.2960321170656044.
[I 2025-12-09 09:49:59,329] Trial 41 finished with value: 0.2850134884459422 and parameters: {'model_type': 'graphsage', 'hidden_dims': '[512, 128]', 'dropout': 0.2573458400461868, 'batch_norm': True, 'sage_aggr': 'mean', 'sage_normalize': True, 'sage_project': False, 'lr': 2.4367830382214293e-05, 'weight_decay': 8.876263347454199e-05, 'epochs': 94, 'loss': 'mae', 'optimizer': 'adam', 'graph_mode': 'cutoff', 'cutoff': 0.4180379495470357, 'grm_norm': 'gcn', 'self_loops': False, 'use_snp_selection': True, 'num_snps': 49634}. Best is trial 36 with value: 0.2960321170656044.
[I 2025-12-09 09:51:35,252] Trial 42 finished with value: 0.29363426052757075 and parameters: {'model_type': 'graphsage', 'hidden_dims': '[512, 128]', 'dropout': 0.260400557897751, 'batch_norm': True, 'sage_aggr': 'mean', 'sage_normalize': True, 'sage_project': False, 'lr': 2.4622132249797026e-05, 'weight_decay': 8.773654543598886e-05, 'epochs': 90, 'loss': 'mae', 'optimizer': 'adam', 'graph_mode': 'cutoff', 'cutoff': 0.41830187882632175, 'grm_norm': 'gcn', 'self_loops': False, 'use_snp_selection': True, 'num_snps': 55075}. Best is trial 36 with value: 0.2960321170656044.
[I 2025-12-09 09:53:13,611] Trial 43 finished with value: 0.29417294432013985 and parameters: {'model_type': 'graphsage', 'hidden_dims': '[512, 128]', 'dropout': 0.21320068670677203, 'batch_norm': True, 'sage_aggr': 'mean', 'sage_normalize': True, 'sage_project': False, 'lr': 4.169277799325837e-05, 'weight_decay': 0.00034118259467806546, 'epochs': 89, 'loss': 'mae', 'optimizer': 'adam', 'graph_mode': 'cutoff', 'cutoff': 0.4530442622825957, 'grm_norm': 'gcn', 'self_loops': False, 'use_snp_selection': True, 'num_snps': 57411}. Best is trial 36 with value: 0.2960321170656044.
[I 2025-12-09 09:54:44,051] Trial 44 finished with value: 0.289958903309509 and parameters: {'model_type': 'graphsage', 'hidden_dims': '[512, 128]', 'dropout': 0.12427455465766869, 'batch_norm': True, 'sage_aggr': 'mean', 'sage_normalize': True, 'sage_project': False, 'lr': 4.1185909967049363e-05, 'weight_decay': 0.0003557345723188173, 'epochs': 66, 'loss': 'mae', 'optimizer': 'adam', 'graph_mode': 'cutoff', 'cutoff': 0.3703695478667623, 'grm_norm': 'gcn', 'self_loops': False, 'use_snp_selection': True, 'num_snps': 59824}. Best is trial 36 with value: 0.2960321170656044.
