[I 2025-12-08 16:18:24,074] Trial 79 finished with value: 0.24987399299818341 and parameters: {'model_type': 'graphsage', 'hidden_dims': '[512, 256]', 'dropout': 0.4701075448721551, 'batch_norm': True, 'sage_aggr': 'max', 'sage_normalize': True, 'sage_project': False, 'lr': 0.009772240553558473, 'weight_decay': 3.823124800825555e-06, 'epochs': 199, 'loss': 'mse', 'optimizer': 'adam', 'graph_mode': 'knn', 'knn_k': 1, 'weighted_edges': True, 'symmetrize_mode': 'mutual', 'self_loops': False, 'use_snp_selection': False}. Best is trial 74 with value: 0.3021457282627437.
[I 2025-12-08 16:19:11,097] Trial 80 finished with value: 0.2953498443525978 and parameters: {'model_type': 'graphsage', 'hidden_dims': '[128, 64]', 'dropout': 0.5726154763339458, 'batch_norm': True, 'sage_aggr': 'max', 'sage_normalize': False, 'sage_project': False, 'lr': 0.003598664841862876, 'weight_decay': 4.2450518401300543e-07, 'epochs': 150, 'loss': 'mse', 'optimizer': 'adam', 'graph_mode': 'cutoff', 'cutoff': 0.8304565161924301, 'grm_norm': 'none', 'self_loops': False, 'use_snp_selection': True, 'num_snps': 34173}. Best is trial 74 with value: 0.3021457282627437.
[I 2025-12-08 16:19:53,906] Trial 81 finished with value: 0.2957097529971382 and parameters: {'model_type': 'graphsage', 'hidden_dims': '[128, 64]', 'dropout': 0.4482025016887338, 'batch_norm': True, 'sage_aggr': 'max', 'sage_normalize': False, 'sage_project': False, 'lr': 0.006724860193272564, 'weight_decay': 2.1317881945128042e-07, 'epochs': 64, 'loss': 'mse', 'optimizer': 'adam', 'graph_mode': 'cutoff', 'cutoff': 0.8577832108339923, 'grm_norm': 'none', 'self_loops': False, 'use_snp_selection': True, 'num_snps': 39697}. Best is trial 74 with value: 0.3021457282627437.
[I 2025-12-08 16:20:39,669] Trial 82 finished with value: 0.30013928996373596 and parameters: {'model_type': 'graphsage', 'hidden_dims': '[128, 64]', 'dropout': 0.3996079603619028, 'batch_norm': True, 'sage_aggr': 'max', 'sage_normalize': False, 'sage_project': False, 'lr': 0.008270420889011072, 'weight_decay': 1.317500032950946e-06, 'epochs': 79, 'loss': 'mse', 'optimizer': 'adam', 'graph_mode': 'cutoff', 'cutoff': 0.8726438621357796, 'grm_norm': 'none', 'self_loops': False, 'use_snp_selection': True, 'num_snps': 41596}. Best is trial 74 with value: 0.3021457282627437.
[I 2025-12-08 16:21:25,657] Trial 83 finished with value: 0.29434066134607784 and parameters: {'model_type': 'graphsage', 'hidden_dims': '[128, 64]', 'dropout': 0.38647676728700486, 'batch_norm': True, 'sage_aggr': 'max', 'sage_normalize': False, 'sage_project': False, 'lr': 0.005293503413658656, 'weight_decay': 1.4364309455065018e-06, 'epochs': 81, 'loss': 'mse', 'optimizer': 'adam', 'graph_mode': 'cutoff', 'cutoff': 0.821115824909208, 'grm_norm': 'none', 'self_loops': False, 'use_snp_selection': True, 'num_snps': 41634}. Best is trial 74 with value: 0.3021457282627437.
[I 2025-12-08 16:22:19,139] Trial 84 finished with value: 0.28466618719361847 and parameters: {'model_type': 'graphsage', 'hidden_dims': '[512, 128]', 'dropout': 0.39728604021412456, 'batch_norm': True, 'sage_aggr': 'max', 'sage_normalize': False, 'sage_project': False, 'lr': 1.127830226510838e-05, 'weight_decay': 2.543643180940358e-06, 'epochs': 51, 'loss': 'mse', 'optimizer': 'adam', 'graph_mode': 'cutoff', 'cutoff': 0.8786639002243565, 'grm_norm': 'none', 'self_loops': False, 'use_snp_selection': True, 'num_snps': 42866}. Best is trial 74 with value: 0.3021457282627437.
[I 2025-12-08 16:23:35,480] Trial 85 finished with value: 0.30118955952647647 and parameters: {'model_type': 'graphsage', 'hidden_dims': '[512, 64]', 'dropout': 0.5349846807116705, 'batch_norm': True, 'sage_aggr': 'max', 'sage_normalize': False, 'sage_project': False, 'lr': 0.006393098372000674, 'weight_decay': 1.4386529366208773e-07, 'epochs': 125, 'loss': 'mse', 'optimizer': 'adam', 'graph_mode': 'cutoff', 'cutoff': 0.7965926076477993, 'grm_norm': 'cosine', 'self_loops': False, 'use_snp_selection': True, 'num_snps': 44775}. Best is trial 74 with value: 0.3021457282627437.
[I 2025-12-08 16:24:56,018] Trial 86 finished with value: 0.3006278942447965 and parameters: {'model_type': 'graphsage', 'hidden_dims': '[512, 64]', 'dropout': 0.5261675964808377, 'batch_norm': True, 'sage_aggr': 'max', 'sage_normalize': False, 'sage_project': False, 'lr': 0.006719998714677982, 'weight_decay': 1.21458145216385e-07, 'epochs': 123, 'loss': 'mse', 'optimizer': 'adam', 'graph_mode': 'cutoff', 'cutoff': 0.8029579580956131, 'grm_norm': 'cosine', 'self_loops': False, 'use_snp_selection': True, 'num_snps': 48606}. Best is trial 74 with value: 0.3021457282627437.
[I 2025-12-08 16:26:20,016] Trial 87 finished with value: 0.29551913875836444 and parameters: {'model_type': 'graphsage', 'hidden_dims': '[512, 64]', 'dropout': 0.5018772049361858, 'batch_norm': True, 'sage_aggr': 'max', 'sage_normalize': False, 'sage_project': False, 'lr': 0.004262757204065317, 'weight_decay': 1.1255570325903555e-07, 'epochs': 122, 'loss': 'mse', 'optimizer': 'adam', 'graph_mode': 'cutoff', 'cutoff': 0.8006598774734173, 'grm_norm': 'cosine', 'self_loops': False, 'use_snp_selection': True, 'num_snps': 51091}. Best is trial 74 with value: 0.3021457282627437.
[I 2025-12-08 16:27:41,654] Trial 88 finished with value: 0.0 and parameters: {'model_type': 'graphsage', 'hidden_dims': '[512, 64]', 'dropout': 0.5299301771176779, 'batch_norm': False, 'sage_aggr': 'max', 'sage_normalize': False, 'sage_project': False, 'lr': 0.006580000424965815, 'weight_decay': 3.4612136784284735e-07, 'epochs': 130, 'loss': 'mse', 'optimizer': 'adam', 'graph_mode': 'cutoff', 'cutoff': 0.8372096835057372, 'grm_norm': 'cosine', 'self_loops': False, 'use_snp_selection': True, 'num_snps': 48179}. Best is trial 74 with value: 0.3021457282627437.
[I 2025-12-08 16:28:54,420] Trial 89 finished with value: 0.3008916528957913 and parameters: {'model_type': 'graphsage', 'hidden_dims': '[512, 64]', 'dropout': 0.5468937702231281, 'batch_norm': True, 'sage_aggr': 'max', 'sage_normalize': False, 'sage_project': False, 'lr': 0.005676896472862431, 'weight_decay': 1.7264179116451685e-07, 'epochs': 107, 'loss': 'mse', 'optimizer': 'adam', 'graph_mode': 'cutoff', 'cutoff': 0.766337373351209, 'grm_norm': 'cosine', 'self_loops': False, 'use_snp_selection': True, 'num_snps': 45596}. Best is trial 74 with value: 0.3021457282627437.
[I 2025-12-08 16:30:07,319] Trial 90 finished with value: 0.29937418730092424 and parameters: {'model_type': 'graphsage', 'hidden_dims': '[512, 64]', 'dropout': 0.5467394256187131, 'batch_norm': True, 'sage_aggr': 'max', 'sage_normalize': False, 'sage_project': False, 'lr': 0.0013788689391063078, 'weight_decay': 1.605425269154122e-07, 'epochs': 107, 'loss': 'mse', 'optimizer': 'adam', 'graph_mode': 'cutoff', 'cutoff': 0.7334873237240694, 'grm_norm': 'cosine', 'self_loops': False, 'use_snp_selection': True, 'num_snps': 45825}. Best is trial 74 with value: 0.3021457282627437.
[I 2025-12-08 16:31:19,743] Trial 91 finished with value: 0.3040003758189352 and parameters: {'model_type': 'graphsage', 'hidden_dims': '[512, 64]', 'dropout': 0.5106007587540554, 'batch_norm': True, 'sage_aggr': 'max', 'sage_normalize': False, 'sage_project': False, 'lr': 0.0057872944564770785, 'weight_decay': 1.1898806753068366e-07, 'epochs': 112, 'loss': 'mse', 'optimizer': 'adam', 'graph_mode': 'cutoff', 'cutoff': 0.7608415627970275, 'grm_norm': 'cosine', 'self_loops': False, 'use_snp_selection': True, 'num_snps': 44098}. Best is trial 91 with value: 0.3040003758189352.
[I 2025-12-08 16:32:31,529] Trial 92 finished with value: 0.29889362124886193 and parameters: {'model_type': 'graphsage', 'hidden_dims': '[512, 64]', 'dropout': 0.5186640003143286, 'batch_norm': True, 'sage_aggr': 'max', 'sage_normalize': False, 'sage_project': False, 'lr': 0.005258820992359792, 'weight_decay': 1.3567787503397436e-07, 'epochs': 96, 'loss': 'mse', 'optimizer': 'adam', 'graph_mode': 'cutoff', 'cutoff': 0.751006698432953, 'grm_norm': 'cosine', 'self_loops': False, 'use_snp_selection': True, 'num_snps': 47690}. Best is trial 91 with value: 0.3040003758189352.
[I 2025-12-08 16:33:44,038] Trial 93 finished with value: 0.29826787232184176 and parameters: {'model_type': 'graphsage', 'hidden_dims': '[512, 64]', 'dropout': 0.5306254515805475, 'batch_norm': True, 'sage_aggr': 'max', 'sage_normalize': False, 'sage_project': False, 'lr': 0.002532139456664473, 'weight_decay': 2.0884848904991493e-07, 'epochs': 112, 'loss': 'mse', 'optimizer': 'adam', 'graph_mode': 'cutoff', 'cutoff': 0.7669490225006095, 'grm_norm': 'cosine', 'self_loops': False, 'use_snp_selection': True, 'num_snps': 44295}. Best is trial 91 with value: 0.3040003758189352.
[I 2025-12-08 16:34:51,706] Trial 94 finished with value: 0.29741964021528267 and parameters: {'model_type': 'graphsage', 'hidden_dims': '[512, 64]', 'dropout': 0.55621609892444, 'batch_norm': True, 'sage_aggr': 'max', 'sage_normalize': False, 'sage_project': False, 'lr': 0.003972940639730361, 'weight_decay': 1.0074022358489487e-07, 'epochs': 88, 'loss': 'mse', 'optimizer': 'adam', 'graph_mode': 'cutoff', 'cutoff': 0.7936230985928543, 'grm_norm': 'cosine', 'self_loops': False, 'use_snp_selection': True, 'num_snps': 46005}. Best is trial 91 with value: 0.3040003758189352.
[I 2025-12-08 16:35:59,908] Trial 95 finished with value: 0.2971199749630164 and parameters: {'model_type': 'graphsage', 'hidden_dims': '[512, 64]', 'dropout': 0.5117956162638598, 'batch_norm': True, 'sage_aggr': 'max', 'sage_normalize': False, 'sage_project': False, 'lr': 0.0063104950973800564, 'weight_decay': 1.3370818707625828e-07, 'epochs': 78, 'loss': 'mse', 'optimizer': 'adam', 'graph_mode': 'cutoff', 'cutoff': 0.6801935344963566, 'grm_norm': 'cosine', 'self_loops': False, 'use_snp_selection': True, 'num_snps': 49702}. Best is trial 91 with value: 0.3040003758189352.
[I 2025-12-08 16:37:16,694] Trial 96 finished with value: 0.29395259476685487 and parameters: {'model_type': 'graphsage', 'hidden_dims': '[512, 64]', 'dropout': 0.4928139596201898, 'batch_norm': True, 'sage_aggr': 'max', 'sage_normalize': False, 'sage_project': False, 'lr': 0.0009835690824075496, 'weight_decay': 2.5540925870259937e-07, 'epochs': 99, 'loss': 'mse', 'optimizer': 'adam', 'graph_mode': 'cutoff', 'cutoff': 0.7294553389959114, 'grm_norm': 'cosine', 'self_loops': False, 'use_snp_selection': True, 'num_snps': 51426}. Best is trial 91 with value: 0.3040003758189352.
[I 2025-12-08 16:41:37,519] Trial 97 finished with value: 0.2839794850906627 and parameters: {'model_type': 'graphsage', 'hidden_dims': '[512, 64]', 'dropout': 0.5379958840107445, 'batch_norm': True, 'sage_aggr': 'max', 'sage_normalize': True, 'sage_project': False, 'lr': 0.004672045754326712, 'weight_decay': 1.804708472844147e-07, 'epochs': 258, 'loss': 'mse', 'optimizer': 'adam', 'graph_mode': 'knn', 'knn_k': 8, 'weighted_edges': False, 'symmetrize_mode': 'union', 'self_loops': False, 'use_snp_selection': True, 'num_snps': 43650}. Best is trial 91 with value: 0.3040003758189352.
[I 2025-12-08 16:42:44,992] Trial 98 finished with value: 0.30131716127517405 and parameters: {'model_type': 'graphsage', 'hidden_dims': '[512, 64]', 'dropout': 0.5893818384505156, 'batch_norm': True, 'sage_aggr': 'max', 'sage_normalize': False, 'sage_project': False, 'lr': 0.0030330241405303045, 'weight_decay': 1.343266531799023e-07, 'epochs': 140, 'loss': 'mse', 'optimizer': 'adam', 'graph_mode': 'cutoff', 'cutoff': 0.8112640358843601, 'grm_norm': 'cosine', 'self_loops': False, 'use_snp_selection': False}. Best is trial 91 with value: 0.3040003758189352.
[I 2025-12-08 16:43:53,700] Trial 99 finished with value: 0.2994699438862176 and parameters: {'model_type': 'graphsage', 'hidden_dims': '[512, 64]', 'dropout': 0.5455280898696879, 'batch_norm': True, 'sage_aggr': 'max', 'sage_normalize': False, 'sage_project': False, 'lr': 0.002025888154157818, 'weight_decay': 1.2122982846889403e-07, 'epochs': 143, 'loss': 'mse', 'optimizer': 'adam', 'graph_mode': 'cutoff', 'cutoff': 0.7681043082387151, 'grm_norm': 'cosine', 'self_loops': False, 'use_snp_selection': False}. Best is trial 91 with value: 0.3040003758189352.
[I 2025-12-08 16:44:51,135] Trial 100 finished with value: 0.0 and parameters: {'model_type': 'graphsage', 'hidden_dims': '[512, 64]', 'dropout': 0.5931659635039036, 'batch_norm': False, 'sage_aggr': 'max', 'sage_normalize': False, 'sage_project': False, 'lr': 0.00308429510213278, 'weight_decay': 1.4409159457788293e-07, 'epochs': 116, 'loss': 'mse', 'optimizer': 'adam', 'graph_mode': 'cutoff', 'cutoff': 0.6253754890139118, 'grm_norm': 'cosine', 'self_loops': False, 'use_snp_selection': False}. Best is trial 91 with value: 0.3040003758189352.
[I 2025-12-08 16:45:46,975] Trial 101 finished with value: 0.3013358047073763 and parameters: {'model_type': 'graphsage', 'hidden_dims': '[512, 64]', 'dropout': 0.5832958334410534, 'batch_norm': True, 'sage_aggr': 'max', 'sage_normalize': False, 'sage_project': False, 'lr': 0.006857230156851238, 'weight_decay': 3.4352037157392715e-07, 'epochs': 110, 'loss': 'mse', 'optimizer': 'adam', 'graph_mode': 'cutoff', 'cutoff': 0.8139303405915957, 'grm_norm': 'cosine', 'self_loops': False, 'use_snp_selection': False}. Best is trial 91 with value: 0.3040003758189352.
[I 2025-12-08 16:46:51,697] Trial 102 finished with value: 0.2996065434579088 and parameters: {'model_type': 'graphsage', 'hidden_dims': '[512, 64]', 'dropout': 0.5885391981263944, 'batch_norm': True, 'sage_aggr': 'max', 'sage_normalize': False, 'sage_project': False, 'lr': 0.005677730957743746, 'weight_decay': 3.26340155250037e-07, 'epochs': 133, 'loss': 'mse', 'optimizer': 'adam', 'graph_mode': 'cutoff', 'cutoff': 0.8077213950341358, 'grm_norm': 'cosine', 'self_loops': False, 'use_snp_selection': False}. Best is trial 91 with value: 0.3040003758189352.
[I 2025-12-08 16:47:53,857] Trial 103 finished with value: 0.30071920793061846 and parameters: {'model_type': 'graphsage', 'hidden_dims': '[512, 64]', 'dropout': 0.5742479157578345, 'batch_norm': True, 'sage_aggr': 'max', 'sage_normalize': False, 'sage_project': False, 'lr': 0.003654479097707595, 'weight_decay': 1.9825750162058233e-07, 'epochs': 126, 'loss': 'mse', 'optimizer': 'adam', 'graph_mode': 'cutoff', 'cutoff': 0.757024133331358, 'grm_norm': 'cosine', 'self_loops': False, 'use_snp_selection': False}. Best is trial 91 with value: 0.3040003758189352.
[I 2025-12-08 16:48:55,887] Trial 104 finished with value: 0.3012921630809354 and parameters: {'model_type': 'graphsage', 'hidden_dims': '[512, 64]', 'dropout': 0.5731299110031753, 'batch_norm': True, 'sage_aggr': 'max', 'sage_normalize': False, 'sage_project': False, 'lr': 0.003651014121436407, 'weight_decay': 1.8504592148251018e-07, 'epochs': 126, 'loss': 'mse', 'optimizer': 'adam', 'graph_mode': 'cutoff', 'cutoff': 0.7871768516633023, 'grm_norm': 'cosine', 'self_loops': False, 'use_snp_selection': False}. Best is trial 91 with value: 0.3040003758189352.
[I 2025-12-08 16:49:59,031] Trial 105 finished with value: 0.29849304103155283 and parameters: {'model_type': 'graphsage', 'hidden_dims': '[512, 64]', 'dropout': 0.5780959843260028, 'batch_norm': True, 'sage_aggr': 'max', 'sage_normalize': False, 'sage_project': False, 'lr': 0.002795919729337163, 'weight_decay': 1.8861263801660098e-07, 'epochs': 129, 'loss': 'mse', 'optimizer': 'adam', 'graph_mode': 'cutoff', 'cutoff': 0.788601550794384, 'grm_norm': 'cosine', 'self_loops': False, 'use_snp_selection': False}. Best is trial 91 with value: 0.3040003758189352.
[I 2025-12-08 16:51:06,033] Trial 106 finished with value: 0.3011103494200461 and parameters: {'model_type': 'graphsage', 'hidden_dims': '[512, 64]', 'dropout': 0.5626083757320903, 'batch_norm': True, 'sage_aggr': 'max', 'sage_normalize': False, 'sage_project': False, 'lr': 0.0036857248051890986, 'weight_decay': 2.5823555441926964e-07, 'epochs': 139, 'loss': 'mse', 'optimizer': 'adam', 'graph_mode': 'cutoff', 'cutoff': 0.7596361492047563, 'grm_norm': 'cosine', 'self_loops': False, 'use_snp_selection': False}. Best is trial 91 with value: 0.3040003758189352.
[I 2025-12-08 16:52:17,325] Trial 107 finished with value: 0.3002844262394439 and parameters: {'model_type': 'graphsage', 'hidden_dims': '[512, 64]', 'dropout': 0.5642041986319858, 'batch_norm': True, 'sage_aggr': 'max', 'sage_normalize': False, 'sage_project': False, 'lr': 0.0036878506348681605, 'weight_decay': 2.402483644757063e-07, 'epochs': 150, 'loss': 'mse', 'optimizer': 'adam', 'graph_mode': 'cutoff', 'cutoff': 0.7114825060759674, 'grm_norm': 'cosine', 'self_loops': False, 'use_snp_selection': False}. Best is trial 91 with value: 0.3040003758189352.
[I 2025-12-08 16:53:25,912] Trial 108 finished with value: 0.3025632470258006 and parameters: {'model_type': 'graphsage', 'hidden_dims': '[512, 64]', 'dropout': 0.5721527507727554, 'batch_norm': True, 'sage_aggr': 'max', 'sage_normalize': False, 'sage_project': False, 'lr': 0.0032820765314139112, 'weight_decay': 4.132226310818274e-07, 'epochs': 143, 'loss': 'mse', 'optimizer': 'adam', 'graph_mode': 'cutoff', 'cutoff': 0.7484898916486232, 'grm_norm': 'cosine', 'self_loops': False, 'use_snp_selection': False}. Best is trial 91 with value: 0.3040003758189352.
[I 2025-12-08 16:54:32,979] Trial 109 finished with value: 0.2945975403746784 and parameters: {'model_type': 'graphsage', 'hidden_dims': '[512, 64]', 'dropout': 0.5975632570819154, 'batch_norm': True, 'sage_aggr': 'max', 'sage_normalize': False, 'sage_project': False, 'lr': 0.0032264652648336203, 'weight_decay': 4.086495259601009e-07, 'epochs': 139, 'loss': 'mse', 'optimizer': 'adam', 'graph_mode': 'cutoff', 'cutoff': 0.6927912962795217, 'grm_norm': 'cosine', 'self_loops': False, 'use_snp_selection': False}. Best is trial 91 with value: 0.3040003758189352.
[I 2025-12-08 16:55:54,434] Trial 110 finished with value: 0.29523300271124625 and parameters: {'model_type': 'graphsage', 'hidden_dims': '[512, 64]', 'dropout': 0.586158114447098, 'batch_norm': True, 'sage_aggr': 'max', 'sage_normalize': False, 'sage_project': False, 'lr': 0.002261291320076195, 'weight_decay': 2.840027959997443e-07, 'epochs': 176, 'loss': 'mse', 'optimizer': 'adam', 'graph_mode': 'cutoff', 'cutoff': 0.7204096963267489, 'grm_norm': 'cosine', 'self_loops': False, 'use_snp_selection': False}. Best is trial 91 with value: 0.3040003758189352.
[I 2025-12-08 16:57:08,150] Trial 111 finished with value: 0.29944930448210805 and parameters: {'model_type': 'graphsage', 'hidden_dims': '[512, 64]', 'dropout': 0.5603915854915905, 'batch_norm': True, 'sage_aggr': 'max', 'sage_normalize': False, 'sage_project': False, 'lr': 0.004265726585378437, 'weight_decay': 1.6888169189469076e-07, 'epochs': 156, 'loss': 'mse', 'optimizer': 'adam', 'graph_mode': 'cutoff', 'cutoff': 0.7586440011508299, 'grm_norm': 'cosine', 'self_loops': False, 'use_snp_selection': False}. Best is trial 91 with value: 0.3040003758189352.
[I 2025-12-08 16:58:03,947] Trial 112 finished with value: 0.29326608516178077 and parameters: {'model_type': 'graphsage', 'hidden_dims': '[512, 64]', 'dropout': 0.5713915378792834, 'batch_norm': True, 'sage_aggr': 'max', 'sage_normalize': False, 'sage_project': False, 'lr': 0.0016551060847917244, 'weight_decay': 2.1811663128398998e-07, 'epochs': 110, 'loss': 'mse', 'optimizer': 'adam', 'graph_mode': 'cutoff', 'cutoff': 0.7421039134759243, 'grm_norm': 'cosine', 'self_loops': False, 'use_snp_selection': False}. Best is trial 91 with value: 0.3040003758189352.
[I 2025-12-08 16:59:02,858] Trial 113 finished with value: 0.2991729161114948 and parameters: {'model_type': 'graphsage', 'hidden_dims': '[512, 64]', 'dropout': 0.5741094003131613, 'batch_norm': True, 'sage_aggr': 'max', 'sage_normalize': False, 'sage_project': False, 'lr': 0.0026906431355945702, 'weight_decay': 4.0299236222494837e-07, 'epochs': 118, 'loss': 'mse', 'optimizer': 'adam', 'graph_mode': 'cutoff', 'cutoff': 0.7742776326332906, 'grm_norm': 'cosine', 'self_loops': False, 'use_snp_selection': False}. Best is trial 91 with value: 0.3040003758189352.
[I 2025-12-08 17:00:08,014] Trial 114 finished with value: 0.30154568733729537 and parameters: {'model_type': 'graphsage', 'hidden_dims': '[512, 64]', 'dropout': 0.552626150197044, 'batch_norm': True, 'sage_aggr': 'max', 'sage_normalize': False, 'sage_project': False, 'lr': 0.004937146108064172, 'weight_decay': 1.480110173096035e-07, 'epochs': 134, 'loss': 'mse', 'optimizer': 'adam', 'graph_mode': 'cutoff', 'cutoff': 0.8260280997577022, 'grm_norm': 'cosine', 'self_loops': False, 'use_snp_selection': False}. Best is trial 91 with value: 0.3040003758189352.
[I 2025-12-08 17:01:13,906] Trial 115 finished with value: 0.2987827883085537 and parameters: {'model_type': 'graphsage', 'hidden_dims': '[512, 64]', 'dropout': 0.552450879299507, 'batch_norm': True, 'sage_aggr': 'max', 'sage_normalize': False, 'sage_project': False, 'lr': 0.004981439685663102, 'weight_decay': 1.364991881415265e-07, 'epochs': 136, 'loss': 'mse', 'optimizer': 'adam', 'graph_mode': 'cutoff', 'cutoff': 0.8218741899561113, 'grm_norm': 'cosine', 'self_loops': False, 'use_snp_selection': False}. Best is trial 91 with value: 0.3040003758189352.
[I 2025-12-08 17:02:27,114] Trial 116 finished with value: 0.29287306601122925 and parameters: {'model_type': 'graphsage', 'hidden_dims': '[512, 64]', 'dropout': 0.5420967663258791, 'batch_norm': True, 'sage_aggr': 'max', 'sage_normalize': False, 'sage_project': False, 'lr': 3.2595688724491773e-05, 'weight_decay': 3.119204416526243e-07, 'epochs': 155, 'loss': 'mse', 'optimizer': 'adam', 'graph_mode': 'cutoff', 'cutoff': 0.8455709142506638, 'grm_norm': 'cosine', 'self_loops': False, 'use_snp_selection': False}. Best is trial 91 with value: 0.3040003758189352.
