[I 2025-12-09 00:37:14,018] Trial 36 finished with value: 0.36851431929781936 and parameters: {'model_type': 'graphsage', 'hidden_dims': '[512, 128]', 'dropout': 0.3685517606586749, 'batch_norm': True, 'sage_aggr': 'max', 'sage_normalize': False, 'sage_project': False, 'lr': 0.00030404218200855, 'weight_decay': 0.00043625939089118166, 'epochs': 80, 'loss': 'mae', 'optimizer': 'adam', 'graph_mode': 'knn', 'knn_k': 8, 'weighted_edges': False, 'symmetrize_mode': 'union', 'self_loops': False, 'use_snp_selection': True, 'num_snps': 33844}. Best is trial 24 with value: 0.38209159045993885.
[I 2025-12-09 00:38:05,707] Trial 37 finished with value: 0.3440612219203213 and parameters: {'model_type': 'graphsage', 'hidden_dims': '[128, 64]', 'dropout': 0.42095332554336656, 'batch_norm': True, 'sage_aggr': 'max', 'sage_normalize': False, 'sage_project': False, 'lr': 0.0020799373857565318, 'weight_decay': 0.0001974918283096447, 'epochs': 61, 'loss': 'mse', 'optimizer': 'adam', 'graph_mode': 'knn', 'knn_k': 9, 'weighted_edges': False, 'symmetrize_mode': 'union', 'self_loops': False, 'use_snp_selection': False}. Best is trial 24 with value: 0.38209159045993885.
[I 2025-12-09 00:38:33,831] Trial 38 finished with value: 0.33261859184030723 and parameters: {'model_type': 'graphsage', 'hidden_dims': '[512, 128]', 'dropout': 0.3318321152500229, 'batch_norm': True, 'sage_aggr': 'mean', 'sage_normalize': False, 'sage_project': False, 'lr': 0.0007835092130316956, 'weight_decay': 9.80523794819979e-05, 'epochs': 135, 'loss': 'mae', 'optimizer': 'adam', 'graph_mode': 'knn', 'knn_k': 6, 'weighted_edges': False, 'symmetrize_mode': 'union', 'self_loops': True, 'use_snp_selection': True, 'num_snps': 9852}. Best is trial 24 with value: 0.38209159045993885.
[I 2025-12-09 00:39:26,192] Trial 39 finished with value: 0.3687886137243857 and parameters: {'model_type': 'graphsage', 'hidden_dims': '[256, 128]', 'dropout': 0.47509926599168567, 'batch_norm': True, 'sage_aggr': 'max', 'sage_normalize': False, 'sage_project': False, 'lr': 0.0010515592226699997, 'weight_decay': 4.608281113382188e-05, 'epochs': 61, 'loss': 'mae', 'optimizer': 'adam', 'graph_mode': 'knn', 'knn_k': 10, 'weighted_edges': False, 'symmetrize_mode': 'union', 'self_loops': False, 'use_snp_selection': True, 'num_snps': 26397}. Best is trial 24 with value: 0.38209159045993885.
[I 2025-12-09 00:40:42,064] Trial 40 finished with value: 0.319588486987592 and parameters: {'model_type': 'graphsage', 'hidden_dims': '[256, 128, 64]', 'dropout': 0.3516530558450199, 'batch_norm': True, 'sage_aggr': 'max', 'sage_normalize': False, 'sage_project': False, 'lr': 0.0003876520561668363, 'weight_decay': 0.0005560969077661669, 'epochs': 159, 'loss': 'mae', 'optimizer': 'adam', 'graph_mode': 'knn', 'knn_k': 6, 'weighted_edges': False, 'symmetrize_mode': 'mutual', 'self_loops': True, 'use_snp_selection': False}. Best is trial 24 with value: 0.38209159045993885.
[I 2025-12-09 00:41:03,677] Trial 41 finished with value: 0.36180350240681264 and parameters: {'model_type': 'graphsage', 'hidden_dims': '[512, 128]', 'dropout': 0.3139149357002608, 'batch_norm': True, 'sage_aggr': 'max', 'sage_normalize': False, 'sage_project': False, 'lr': 0.00024277216264802944, 'weight_decay': 6.538967951392345e-05, 'epochs': 53, 'loss': 'mae', 'optimizer': 'adam', 'graph_mode': 'knn', 'knn_k': 8, 'weighted_edges': False, 'symmetrize_mode': 'union', 'self_loops': False, 'use_snp_selection': True, 'num_snps': 11795}. Best is trial 24 with value: 0.38209159045993885.
[I 2025-12-09 00:41:19,303] Trial 42 finished with value: 0.35807071349074543 and parameters: {'model_type': 'graphsage', 'hidden_dims': '[512, 128]', 'dropout': 0.19728040285507106, 'batch_norm': True, 'sage_aggr': 'max', 'sage_normalize': False, 'sage_project': False, 'lr': 0.0005392392255640127, 'weight_decay': 1.9586810451245555e-05, 'epochs': 82, 'loss': 'mae', 'optimizer': 'adam', 'graph_mode': 'knn', 'knn_k': 8, 'weighted_edges': False, 'symmetrize_mode': 'union', 'self_loops': False, 'use_snp_selection': True, 'num_snps': 4259}. Best is trial 24 with value: 0.38209159045993885.
[I 2025-12-09 00:41:45,789] Trial 43 finished with value: 0.36182901011052426 and parameters: {'model_type': 'graphsage', 'hidden_dims': '[512, 128]', 'dropout': 0.2797091875449722, 'batch_norm': True, 'sage_aggr': 'max', 'sage_normalize': False, 'sage_project': False, 'lr': 0.0021155701800327415, 'weight_decay': 8.227888071055751e-06, 'epochs': 54, 'loss': 'mae', 'optimizer': 'adam', 'graph_mode': 'knn', 'knn_k': 7, 'weighted_edges': False, 'symmetrize_mode': 'union', 'self_loops': False, 'use_snp_selection': True, 'num_snps': 17100}. Best is trial 24 with value: 0.38209159045993885.
[I 2025-12-09 00:42:20,684] Trial 44 finished with value: 0.35885586097435096 and parameters: {'model_type': 'graphsage', 'hidden_dims': '[512, 128]', 'dropout': 0.22829924940579888, 'batch_norm': True, 'sage_aggr': 'mean', 'sage_normalize': False, 'sage_project': False, 'lr': 0.00028565481338685476, 'weight_decay': 4.714455273525438e-05, 'epochs': 40, 'loss': 'mae', 'optimizer': 'adam', 'graph_mode': 'knn', 'knn_k': 9, 'weighted_edges': False, 'symmetrize_mode': 'mutual', 'self_loops': False, 'use_snp_selection': True, 'num_snps': 32766}. Best is trial 24 with value: 0.38209159045993885.
[I 2025-12-09 00:43:12,775] Trial 45 finished with value: 0.3526255553935306 and parameters: {'model_type': 'graphsage', 'hidden_dims': '[512, 128]', 'dropout': 0.3896100678224531, 'batch_norm': True, 'sage_aggr': 'max', 'sage_normalize': False, 'sage_project': False, 'lr': 5.834774140213578e-05, 'weight_decay': 0.00026765890324822035, 'epochs': 76, 'loss': 'mae', 'optimizer': 'adam', 'graph_mode': 'knn', 'knn_k': 8, 'weighted_edges': False, 'symmetrize_mode': 'union', 'self_loops': False, 'use_snp_selection': True, 'num_snps': 23586}. Best is trial 24 with value: 0.38209159045993885.
[I 2025-12-09 00:43:31,851] Trial 46 finished with value: 0.34104955196642217 and parameters: {'model_type': 'graphsage', 'hidden_dims': '[128, 64]', 'dropout': 0.34243427028554235, 'batch_norm': True, 'sage_aggr': 'max', 'sage_normalize': False, 'sage_project': False, 'lr': 0.000531153854576847, 'weight_decay': 0.0001036507161987011, 'epochs': 99, 'loss': 'mse', 'optimizer': 'adam', 'graph_mode': 'knn', 'knn_k': 9, 'weighted_edges': False, 'symmetrize_mode': 'mutual', 'self_loops': False, 'use_snp_selection': True, 'num_snps': 11817}. Best is trial 24 with value: 0.38209159045993885.
[I 2025-12-09 00:44:47,518] Trial 47 finished with value: 0.33806626105222154 and parameters: {'model_type': 'graphsage', 'hidden_dims': '[512, 128]', 'dropout': 0.2307797556705368, 'batch_norm': True, 'sage_aggr': 'max', 'sage_normalize': False, 'sage_project': False, 'lr': 0.00011061787541052807, 'weight_decay': 0.0003949527287223112, 'epochs': 67, 'loss': 'mae', 'optimizer': 'adam', 'graph_mode': 'knn', 'knn_k': 5, 'weighted_edges': False, 'symmetrize_mode': 'union', 'self_loops': False, 'use_snp_selection': True, 'num_snps': 45515}. Best is trial 24 with value: 0.38209159045993885.
[I 2025-12-09 00:45:25,079] Trial 48 finished with value: 0.37369067375948056 and parameters: {'model_type': 'graphsage', 'hidden_dims': '[256, 128]', 'dropout': 0.4457983442503356, 'batch_norm': True, 'sage_aggr': 'max', 'sage_normalize': False, 'sage_project': False, 'lr': 0.0028328203984028994, 'weight_decay': 1.336978911053695e-07, 'epochs': 55, 'loss': 'mae', 'optimizer': 'adam', 'graph_mode': 'knn', 'knn_k': 7, 'weighted_edges': False, 'symmetrize_mode': 'union', 'self_loops': False, 'use_snp_selection': True, 'num_snps': 26104}. Best is trial 24 with value: 0.38209159045993885.
[I 2025-12-09 00:45:58,304] Trial 49 finished with value: 0.35327128315778 and parameters: {'model_type': 'graphsage', 'hidden_dims': '[256, 128]', 'dropout': 0.4448670763381676, 'batch_norm': True, 'sage_aggr': 'mean', 'sage_normalize': False, 'sage_project': False, 'lr': 0.00397589409348218, 'weight_decay': 1.730854943670218e-07, 'epochs': 86, 'loss': 'mae', 'optimizer': 'adam', 'graph_mode': 'knn', 'knn_k': 7, 'weighted_edges': True, 'symmetrize_mode': 'mutual', 'self_loops': True, 'use_snp_selection': True, 'num_snps': 25476}. Best is trial 24 with value: 0.38209159045993885.
[I 2025-12-09 00:50:13,533] Trial 50 finished with value: 0.3322240413568459 and parameters: {'model_type': 'graphsage', 'hidden_dims': '[256, 128]', 'dropout': 0.5164972720157659, 'batch_norm': False, 'sage_aggr': 'max', 'sage_normalize': True, 'sage_project': False, 'lr': 0.0017290259673168596, 'weight_decay': 1.5241631721969442e-06, 'epochs': 283, 'loss': 'mae', 'optimizer': 'adam', 'graph_mode': 'cutoff', 'cutoff': 0.21560613968174253, 'grm_norm': 'cosine_then_gcn', 'self_loops': False, 'use_snp_selection': True, 'num_snps': 31957}. Best is trial 24 with value: 0.38209159045993885.
[I 2025-12-09 00:50:47,111] Trial 51 finished with value: 0.3878042477665546 and parameters: {'model_type': 'graphsage', 'hidden_dims': '[256, 128]', 'dropout': 0.4233834725376336, 'batch_norm': True, 'sage_aggr': 'max', 'sage_normalize': False, 'sage_project': False, 'lr': 0.002974779212742331, 'weight_decay': 2.8082961626756176e-07, 'epochs': 54, 'loss': 'mae', 'optimizer': 'adam', 'graph_mode': 'knn', 'knn_k': 8, 'weighted_edges': False, 'symmetrize_mode': 'union', 'self_loops': False, 'use_snp_selection': True, 'num_snps': 21808}. Best is trial 51 with value: 0.3878042477665546.
[I 2025-12-09 00:51:20,358] Trial 52 finished with value: 0.38508348504570417 and parameters: {'model_type': 'graphsage', 'hidden_dims': '[256, 128]', 'dropout': 0.4224749799307414, 'batch_norm': True, 'sage_aggr': 'max', 'sage_normalize': False, 'sage_project': False, 'lr': 0.0029242658148212384, 'weight_decay': 2.1456875034384645e-07, 'epochs': 55, 'loss': 'mae', 'optimizer': 'adam', 'graph_mode': 'knn', 'knn_k': 9, 'weighted_edges': False, 'symmetrize_mode': 'union', 'self_loops': False, 'use_snp_selection': True, 'num_snps': 22066}. Best is trial 51 with value: 0.3878042477665546.
[I 2025-12-09 00:52:04,141] Trial 53 finished with value: 0.3782442699481597 and parameters: {'model_type': 'graphsage', 'hidden_dims': '[256, 128]', 'dropout': 0.4651750246314684, 'batch_norm': True, 'sage_aggr': 'max', 'sage_normalize': False, 'sage_project': False, 'lr': 0.0030996866485848485, 'weight_decay': 2.4308390813206145e-07, 'epochs': 63, 'loss': 'mae', 'optimizer': 'adam', 'graph_mode': 'knn', 'knn_k': 9, 'weighted_edges': False, 'symmetrize_mode': 'union', 'self_loops': False, 'use_snp_selection': True, 'num_snps': 27333}. Best is trial 51 with value: 0.3878042477665546.
[I 2025-12-09 00:53:15,717] Trial 54 finished with value: 0.37027821371176445 and parameters: {'model_type': 'graphsage', 'hidden_dims': '[256, 128]', 'dropout': 0.46279505054908887, 'batch_norm': True, 'sage_aggr': 'max', 'sage_normalize': False, 'sage_project': False, 'lr': 0.0032218214530114037, 'weight_decay': 2.134183159722568e-07, 'epochs': 115, 'loss': 'mae', 'optimizer': 'adam', 'graph_mode': 'knn', 'knn_k': 10, 'weighted_edges': False, 'symmetrize_mode': 'union', 'self_loops': False, 'use_snp_selection': True, 'num_snps': 22896}. Best is trial 51 with value: 0.3878042477665546.
[I 2025-12-09 00:53:35,027] Trial 55 finished with value: 0.32530140569908206 and parameters: {'model_type': 'graphsage', 'hidden_dims': '[256, 128]', 'dropout': 0.41069697705507013, 'batch_norm': True, 'sage_aggr': 'max', 'sage_normalize': False, 'sage_project': False, 'lr': 0.005200375273331709, 'weight_decay': 4.35121713095853e-07, 'epochs': 67, 'loss': 'mae', 'optimizer': 'adam', 'graph_mode': 'knn', 'knn_k': 1, 'weighted_edges': True, 'symmetrize_mode': 'union', 'self_loops': False, 'use_snp_selection': True, 'num_snps': 21257}. Best is trial 51 with value: 0.3878042477665546.
[I 2025-12-09 00:54:41,678] Trial 56 finished with value: 0.2848191777654506 and parameters: {'model_type': 'graphsage', 'hidden_dims': '[256, 128]', 'dropout': 0.4519786714211723, 'batch_norm': False, 'sage_aggr': 'max', 'sage_normalize': True, 'sage_project': False, 'lr': 0.0027130206278394003, 'weight_decay': 1.0493735267877602e-07, 'epochs': 57, 'loss': 'mae', 'optimizer': 'adam', 'graph_mode': 'knn', 'knn_k': 9, 'weighted_edges': False, 'symmetrize_mode': 'union', 'self_loops': False, 'use_snp_selection': True, 'num_snps': 36573}. Best is trial 51 with value: 0.3878042477665546.
[I 2025-12-09 00:55:32,599] Trial 57 finished with value: 0.35989910265551645 and parameters: {'model_type': 'graphsage', 'hidden_dims': '[256, 128]', 'dropout': 0.4294174791490251, 'batch_norm': True, 'sage_aggr': 'max', 'sage_normalize': False, 'sage_project': False, 'lr': 0.008127665660726908, 'weight_decay': 3.3604899582656964e-07, 'epochs': 173, 'loss': 'mae', 'optimizer': 'adam', 'graph_mode': 'cutoff', 'cutoff': 0.889073543245168, 'grm_norm': 'cosine', 'self_loops': False, 'use_snp_selection': False}. Best is trial 51 with value: 0.3878042477665546.
[I 2025-12-09 00:56:25,101] Trial 58 finished with value: 0.3669754768969416 and parameters: {'model_type': 'graphsage', 'hidden_dims': '[256, 128]', 'dropout': 0.4725711701397326, 'batch_norm': True, 'sage_aggr': 'max', 'sage_normalize': False, 'sage_project': False, 'lr': 0.004156785072424846, 'weight_decay': 2.779829584779714e-07, 'epochs': 89, 'loss': 'mae', 'optimizer': 'adam', 'graph_mode': 'knn', 'knn_k': 7, 'weighted_edges': False, 'symmetrize_mode': 'union', 'self_loops': False, 'use_snp_selection': True, 'num_snps': 26059}. Best is trial 51 with value: 0.3878042477665546.
[I 2025-12-09 00:57:12,155] Trial 59 finished with value: 0.33160324007275055 and parameters: {'model_type': 'graphsage', 'hidden_dims': '[256, 128]', 'dropout': 0.3789731050124985, 'batch_norm': True, 'sage_aggr': 'mean', 'sage_normalize': False, 'sage_project': False, 'lr': 0.0024677202601858504, 'weight_decay': 8.495347253461883e-07, 'epochs': 127, 'loss': 'mse', 'optimizer': 'adam', 'graph_mode': 'knn', 'knn_k': 10, 'weighted_edges': True, 'symmetrize_mode': 'union', 'self_loops': False, 'use_snp_selection': True, 'num_snps': 17528}. Best is trial 51 with value: 0.3878042477665546.
[I 2025-12-09 00:58:20,893] Trial 60 finished with value: 0.2961186048139096 and parameters: {'model_type': 'graphsage', 'hidden_dims': '[256, 128]', 'dropout': 0.3594066440355128, 'batch_norm': False, 'sage_aggr': 'max', 'sage_normalize': True, 'sage_project': False, 'lr': 0.005735127688427769, 'weight_decay': 1.4579035914907903e-07, 'epochs': 107, 'loss': 'mae', 'optimizer': 'adam', 'graph_mode': 'knn', 'knn_k': 9, 'weighted_edges': False, 'symmetrize_mode': 'union', 'self_loops': False, 'use_snp_selection': True, 'num_snps': 27915}. Best is trial 51 with value: 0.3878042477665546.
[I 2025-12-09 00:59:10,003] Trial 61 finished with value: 0.3794164754490006 and parameters: {'model_type': 'graphsage', 'hidden_dims': '[256, 128]', 'dropout': 0.4920957870521596, 'batch_norm': True, 'sage_aggr': 'max', 'sage_normalize': False, 'sage_project': False, 'lr': 0.0011752773235354297, 'weight_decay': 2.188509565977523e-07, 'epochs': 52, 'loss': 'mae', 'optimizer': 'adam', 'graph_mode': 'knn', 'knn_k': 9, 'weighted_edges': False, 'symmetrize_mode': 'union', 'self_loops': False, 'use_snp_selection': True, 'num_snps': 28956}. Best is trial 51 with value: 0.3878042477665546.
[I 2025-12-09 00:59:53,855] Trial 62 finished with value: 0.36650846839499585 and parameters: {'model_type': 'graphsage', 'hidden_dims': '[256, 128]', 'dropout': 0.5623981574920667, 'batch_norm': True, 'sage_aggr': 'max', 'sage_normalize': False, 'sage_project': False, 'lr': 0.000985818602952661, 'weight_decay': 4.201724643591078e-07, 'epochs': 74, 'loss': 'mae', 'optimizer': 'adam', 'graph_mode': 'knn', 'knn_k': 8, 'weighted_edges': False, 'symmetrize_mode': 'union', 'self_loops': False, 'use_snp_selection': True, 'num_snps': 24534}. Best is trial 51 with value: 0.3878042477665546.
[I 2025-12-09 01:00:53,669] Trial 63 finished with value: 0.37246639500662326 and parameters: {'model_type': 'graphsage', 'hidden_dims': '[256, 128]', 'dropout': 0.48322135364065744, 'batch_norm': True, 'sage_aggr': 'max', 'sage_normalize': False, 'sage_project': False, 'lr': 0.0035126227384795826, 'weight_decay': 1.0220374927626949e-07, 'epochs': 51, 'loss': 'mae', 'optimizer': 'adam', 'graph_mode': 'knn', 'knn_k': 9, 'weighted_edges': False, 'symmetrize_mode': 'union', 'self_loops': False, 'use_snp_selection': True, 'num_snps': 35604}. Best is trial 51 with value: 0.3878042477665546.
[I 2025-12-09 01:01:28,865] Trial 64 finished with value: 0.3751127488750797 and parameters: {'model_type': 'graphsage', 'hidden_dims': '[256, 128]', 'dropout': 0.44299769324162774, 'batch_norm': True, 'sage_aggr': 'max', 'sage_normalize': False, 'sage_project': False, 'lr': 0.0012097389667526084, 'weight_decay': 2.2198398921427413e-07, 'epochs': 63, 'loss': 'mae', 'optimizer': 'adam', 'graph_mode': 'knn', 'knn_k': 8, 'weighted_edges': False, 'symmetrize_mode': 'union', 'self_loops': False, 'use_snp_selection': True, 'num_snps': 22024}. Best is trial 51 with value: 0.3878042477665546.
[I 2025-12-09 01:01:53,477] Trial 65 finished with value: 0.3570634975631712 and parameters: {'model_type': 'graphsage', 'hidden_dims': '[256, 128]', 'dropout': 0.4155261882797313, 'batch_norm': True, 'sage_aggr': 'max', 'sage_normalize': False, 'sage_project': False, 'lr': 0.0018531108437237571, 'weight_decay': 6.794693140168605e-07, 'epochs': 67, 'loss': 'mae', 'optimizer': 'adam', 'graph_mode': 'cutoff', 'cutoff': 0.3509578461551483, 'grm_norm': 'none', 'self_loops': False, 'use_snp_selection': True, 'num_snps': 21308}. Best is trial 51 with value: 0.3878042477665546.
[I 2025-12-09 01:02:53,548] Trial 66 finished with value: 0.37607726842333994 and parameters: {'model_type': 'graphsage', 'hidden_dims': '[256, 128]', 'dropout': 0.5281817554624918, 'batch_norm': True, 'sage_aggr': 'max', 'sage_normalize': False, 'sage_project': False, 'lr': 0.0012232344164704281, 'weight_decay': 2.3207975705316044e-07, 'epochs': 78, 'loss': 'mae', 'optimizer': 'adam', 'graph_mode': 'knn', 'knn_k': 8, 'weighted_edges': False, 'symmetrize_mode': 'union', 'self_loops': False, 'use_snp_selection': True, 'num_snps': 30692}. Best is trial 51 with value: 0.3878042477665546.
[I 2025-12-09 01:04:25,814] Trial 67 finished with value: 0.37437936290170515 and parameters: {'model_type': 'graphsage', 'hidden_dims': '[512, 256]', 'dropout': 0.5738320527531369, 'batch_norm': True, 'sage_aggr': 'max', 'sage_normalize': False, 'sage_project': False, 'lr': 0.0006926243331820368, 'weight_decay': 8.832927492231907e-07, 'epochs': 93, 'loss': 'mae', 'optimizer': 'adam', 'graph_mode': 'knn', 'knn_k': 9, 'weighted_edges': False, 'symmetrize_mode': 'union', 'self_loops': False, 'use_snp_selection': True, 'num_snps': 31276}. Best is trial 51 with value: 0.3878042477665546.
[I 2025-12-09 01:08:28,479] Trial 68 finished with value: 0.34666954616660317 and parameters: {'model_type': 'graphsage', 'hidden_dims': '[512, 64]', 'dropout': 0.533363563500371, 'batch_norm': True, 'sage_aggr': 'max', 'sage_normalize': False, 'sage_project': False, 'lr': 0.0008602653444138752, 'weight_decay': 1.189535251310836e-06, 'epochs': 267, 'loss': 'mae', 'optimizer': 'adam', 'graph_mode': 'knn', 'knn_k': 10, 'weighted_edges': False, 'symmetrize_mode': 'mutual', 'self_loops': True, 'use_snp_selection': False}. Best is trial 51 with value: 0.3878042477665546.
[I 2025-12-09 01:09:49,897] Trial 69 finished with value: 0.3479778292298915 and parameters: {'model_type': 'graphsage', 'hidden_dims': '[256, 128, 64]', 'dropout': 0.3901463728607665, 'batch_norm': True, 'sage_aggr': 'max', 'sage_normalize': False, 'sage_project': False, 'lr': 0.0013869963537336708, 'weight_decay': 3.843300920300847e-06, 'epochs': 74, 'loss': 'mae', 'optimizer': 'adam', 'graph_mode': 'knn', 'knn_k': 8, 'weighted_edges': False, 'symmetrize_mode': 'union', 'self_loops': False, 'use_snp_selection': True, 'num_snps': 38928}. Best is trial 51 with value: 0.3878042477665546.
[I 2025-12-09 01:13:23,409] Trial 70 finished with value: 0.36214140868093003 and parameters: {'model_type': 'graphsage', 'hidden_dims': '[256, 128]', 'dropout': 0.4929248099450572, 'batch_norm': True, 'sage_aggr': 'max', 'sage_normalize': False, 'sage_project': False, 'lr': 0.0022267812530607717, 'weight_decay': 5.218421807814236e-07, 'epochs': 303, 'loss': 'mse', 'optimizer': 'adam', 'graph_mode': 'knn', 'knn_k': 9, 'weighted_edges': True, 'symmetrize_mode': 'union', 'self_loops': False, 'use_snp_selection': True, 'num_snps': 28699}. Best is trial 51 with value: 0.3878042477665546.
[I 2025-12-09 01:13:57,018] Trial 71 finished with value: 0.3792831145565582 and parameters: {'model_type': 'graphsage', 'hidden_dims': '[256, 128]', 'dropout': 0.5199599318550941, 'batch_norm': True, 'sage_aggr': 'max', 'sage_normalize': False, 'sage_project': False, 'lr': 0.0011428078749840323, 'weight_decay': 2.439453094806957e-07, 'epochs': 48, 'loss': 'mae', 'optimizer': 'adam', 'graph_mode': 'knn', 'knn_k': 8, 'weighted_edges': False, 'symmetrize_mode': 'union', 'self_loops': False, 'use_snp_selection': True, 'num_snps': 23216}. Best is trial 51 with value: 0.3878042477665546.
[I 2025-12-09 01:14:15,474] Trial 72 finished with value: 0.3512664792598278 and parameters: {'model_type': 'graphsage', 'hidden_dims': '[256, 128]', 'dropout': 0.5322951549843266, 'batch_norm': True, 'sage_aggr': 'max', 'sage_normalize': False, 'sage_project': False, 'lr': 0.0011907318196359394, 'weight_decay': 2.669752733761674e-07, 'epochs': 48, 'loss': 'mae', 'optimizer': 'adam', 'graph_mode': 'knn', 'knn_k': 3, 'weighted_edges': False, 'symmetrize_mode': 'union', 'self_loops': False, 'use_snp_selection': True, 'num_snps': 19094}. Best is trial 51 with value: 0.3878042477665546.
