[I 2025-12-09 07:34:12,758] Trial 110 finished with value: 0.28292490108922647 and parameters: {'model_type': 'graphsage', 'hidden_dims': '[512, 64]', 'dropout': 0.11164853396166717, 'batch_norm': False, 'sage_aggr': 'max', 'sage_normalize': False, 'sage_project': False, 'lr': 1.1536616371071066e-05, 'weight_decay': 3.6125738314433783e-07, 'epochs': 133, 'loss': 'mse', 'optimizer': 'adam', 'graph_mode': 'cutoff', 'cutoff': 0.24530959316576667, 'grm_norm': 'gcn', 'self_loops': False, 'use_snp_selection': True, 'num_snps': 20712}. Best is trial 104 with value: 0.2972057447495283.
[I 2025-12-09 07:36:12,629] Trial 111 finished with value: 0.29705290325922196 and parameters: {'model_type': 'graphsage', 'hidden_dims': '[512, 64]', 'dropout': 0.12100216191972497, 'batch_norm': False, 'sage_aggr': 'max', 'sage_normalize': False, 'sage_project': False, 'lr': 1.3935098984616673e-05, 'weight_decay': 8.972427112568932e-07, 'epochs': 149, 'loss': 'mse', 'optimizer': 'adam', 'graph_mode': 'cutoff', 'cutoff': 0.32265434917485336, 'grm_norm': 'gcn', 'self_loops': False, 'use_snp_selection': True, 'num_snps': 29998}. Best is trial 104 with value: 0.2972057447495283.
[I 2025-12-09 07:38:12,788] Trial 112 finished with value: 0.29604312985357073 and parameters: {'model_type': 'graphsage', 'hidden_dims': '[512, 64]', 'dropout': 0.12450561390393522, 'batch_norm': False, 'sage_aggr': 'max', 'sage_normalize': False, 'sage_project': False, 'lr': 1.3480285310549656e-05, 'weight_decay': 9.809932771051916e-07, 'epochs': 150, 'loss': 'mse', 'optimizer': 'adam', 'graph_mode': 'cutoff', 'cutoff': 0.3273411567767838, 'grm_norm': 'gcn', 'self_loops': False, 'use_snp_selection': True, 'num_snps': 31188}. Best is trial 104 with value: 0.2972057447495283.
[I 2025-12-09 07:40:16,267] Trial 113 finished with value: 0.2904627105229779 and parameters: {'model_type': 'graphsage', 'hidden_dims': '[512, 64]', 'dropout': 0.1243861720931086, 'batch_norm': False, 'sage_aggr': 'max', 'sage_normalize': False, 'sage_project': False, 'lr': 1.3720106469473024e-05, 'weight_decay': 8.596590193886169e-07, 'epochs': 156, 'loss': 'mse', 'optimizer': 'adam', 'graph_mode': 'cutoff', 'cutoff': 0.32413889342415736, 'grm_norm': 'gcn', 'self_loops': False, 'use_snp_selection': True, 'num_snps': 30745}. Best is trial 104 with value: 0.2972057447495283.
[I 2025-12-09 07:41:53,395] Trial 114 finished with value: 0.28915066414409984 and parameters: {'model_type': 'graphsage', 'hidden_dims': '[512, 64]', 'dropout': 0.10729726927659089, 'batch_norm': False, 'sage_aggr': 'max', 'sage_normalize': False, 'sage_project': False, 'lr': 1.1362407743522032e-05, 'weight_decay': 2.332737247331282e-07, 'epochs': 150, 'loss': 'mse', 'optimizer': 'adam', 'graph_mode': 'cutoff', 'cutoff': 0.3440992324838938, 'grm_norm': 'gcn', 'self_loops': False, 'use_snp_selection': True, 'num_snps': 25924}. Best is trial 104 with value: 0.2972057447495283.
[I 2025-12-09 07:44:42,015] Trial 115 finished with value: 0.2926919646288571 and parameters: {'model_type': 'graphsage', 'hidden_dims': '[512, 64]', 'dropout': 0.12714332243730703, 'batch_norm': False, 'sage_aggr': 'max', 'sage_normalize': False, 'sage_project': False, 'lr': 1.420838094351918e-05, 'weight_decay': 8.891814306611714e-07, 'epochs': 157, 'loss': 'mse', 'optimizer': 'adam', 'graph_mode': 'cutoff', 'cutoff': 0.26303752612416087, 'grm_norm': 'gcn', 'self_loops': False, 'use_snp_selection': True, 'num_snps': 31449}. Best is trial 104 with value: 0.2972057447495283.
[I 2025-12-09 07:46:05,941] Trial 116 finished with value: 0.2942504765246833 and parameters: {'model_type': 'graphsage', 'hidden_dims': '[512, 64]', 'dropout': 0.11206798997660408, 'batch_norm': False, 'sage_aggr': 'max', 'sage_normalize': False, 'sage_project': False, 'lr': 1.0101933317883761e-05, 'weight_decay': 6.66238423356993e-07, 'epochs': 144, 'loss': 'mse', 'optimizer': 'adam', 'graph_mode': 'cutoff', 'cutoff': 0.3152929363978678, 'grm_norm': 'gcn', 'self_loops': False, 'use_snp_selection': True, 'num_snps': 22004}. Best is trial 104 with value: 0.2972057447495283.
[I 2025-12-09 07:48:04,612] Trial 117 finished with value: 0.1778452135552979 and parameters: {'model_type': 'graphsage', 'hidden_dims': '[512, 64]', 'dropout': 0.1201410909345901, 'batch_norm': True, 'sage_aggr': 'max', 'sage_normalize': True, 'sage_project': False, 'lr': 1.1721535000519604e-05, 'weight_decay': 1.1160742714299782e-06, 'epochs': 344, 'loss': 'mse', 'optimizer': 'adam', 'graph_mode': 'cutoff', 'cutoff': 0.298196361915924, 'grm_norm': 'gcn', 'self_loops': True, 'use_snp_selection': True, 'num_snps': 17083}. Best is trial 104 with value: 0.2972057447495283.
[I 2025-12-09 07:51:16,342] Trial 118 finished with value: 0.2635484784924563 and parameters: {'model_type': 'graphsage', 'hidden_dims': '[512, 64]', 'dropout': 0.15670457837042812, 'batch_norm': False, 'sage_aggr': 'max', 'sage_normalize': False, 'sage_project': False, 'lr': 2.480489483333019e-05, 'weight_decay': 3.8559358270666834e-07, 'epochs': 132, 'loss': 'mse', 'optimizer': 'adam', 'graph_mode': 'cutoff', 'cutoff': 0.21166846316141313, 'grm_norm': 'gcn', 'self_loops': False, 'use_snp_selection': True, 'num_snps': 31741}. Best is trial 104 with value: 0.2972057447495283.
[I 2025-12-09 07:53:23,977] Trial 119 finished with value: 0.2720555074361422 and parameters: {'model_type': 'graphsage', 'hidden_dims': '[512, 64]', 'dropout': 0.10510045057125826, 'batch_norm': False, 'sage_aggr': 'max', 'sage_normalize': False, 'sage_project': False, 'lr': 1.8520066189376397e-05, 'weight_decay': 6.604498774765103e-07, 'epochs': 151, 'loss': 'mae', 'optimizer': 'adam', 'graph_mode': 'cutoff', 'cutoff': 0.4275594851111446, 'grm_norm': 'gcn', 'self_loops': False, 'use_snp_selection': True, 'num_snps': 38314}. Best is trial 104 with value: 0.2972057447495283.
[I 2025-12-09 07:55:07,657] Trial 120 finished with value: 0.2926901697042195 and parameters: {'model_type': 'graphsage', 'hidden_dims': '[512, 64]', 'dropout': 0.10047371122073502, 'batch_norm': False, 'sage_aggr': 'max', 'sage_normalize': False, 'sage_project': False, 'lr': 1.4671176803961714e-05, 'weight_decay': 1.8640568156482837e-06, 'epochs': 166, 'loss': 'mse', 'optimizer': 'adam', 'graph_mode': 'cutoff', 'cutoff': 0.34018067284780973, 'grm_norm': 'gcn', 'self_loops': False, 'use_snp_selection': True, 'num_snps': 25837}. Best is trial 104 with value: 0.2972057447495283.
[I 2025-12-09 07:56:29,880] Trial 121 finished with value: 0.28872123625236606 and parameters: {'model_type': 'graphsage', 'hidden_dims': '[512, 64]', 'dropout': 0.11220433561447186, 'batch_norm': False, 'sage_aggr': 'max', 'sage_normalize': False, 'sage_project': False, 'lr': 1.242148983602434e-05, 'weight_decay': 1.092519503797372e-06, 'epochs': 143, 'loss': 'mse', 'optimizer': 'adam', 'graph_mode': 'cutoff', 'cutoff': 0.3146935104736322, 'grm_norm': 'gcn', 'self_loops': False, 'use_snp_selection': True, 'num_snps': 21580}. Best is trial 104 with value: 0.2972057447495283.
[I 2025-12-09 07:58:13,184] Trial 122 finished with value: 0.2949340961188114 and parameters: {'model_type': 'graphsage', 'hidden_dims': '[512, 64]', 'dropout': 0.1375093396967325, 'batch_norm': False, 'sage_aggr': 'max', 'sage_normalize': False, 'sage_project': False, 'lr': 1.0416378773496019e-05, 'weight_decay': 6.905122305728773e-07, 'epochs': 145, 'loss': 'mse', 'optimizer': 'adam', 'graph_mode': 'cutoff', 'cutoff': 0.36348650848389874, 'grm_norm': 'gcn', 'self_loops': False, 'use_snp_selection': True, 'num_snps': 29067}. Best is trial 104 with value: 0.2972057447495283.
[I 2025-12-09 07:59:51,556] Trial 123 finished with value: 0.298910545580802 and parameters: {'model_type': 'graphsage', 'hidden_dims': '[512, 64]', 'dropout': 0.13693738880754527, 'batch_norm': False, 'sage_aggr': 'max', 'sage_normalize': False, 'sage_project': False, 'lr': 1.521137875937979e-05, 'weight_decay': 3.6615616361439873e-07, 'epochs': 158, 'loss': 'mse', 'optimizer': 'adam', 'graph_mode': 'cutoff', 'cutoff': 0.39377145202139563, 'grm_norm': 'gcn', 'self_loops': False, 'use_snp_selection': True, 'num_snps': 28355}. Best is trial 123 with value: 0.298910545580802.
[I 2025-12-09 08:01:31,174] Trial 124 finished with value: 0.2969001795005885 and parameters: {'model_type': 'graphsage', 'hidden_dims': '[512, 64]', 'dropout': 0.14082414457516806, 'batch_norm': False, 'sage_aggr': 'max', 'sage_normalize': False, 'sage_project': False, 'lr': 1.3318918025680258e-05, 'weight_decay': 2.800625604992843e-07, 'epochs': 159, 'loss': 'mse', 'optimizer': 'adam', 'graph_mode': 'cutoff', 'cutoff': 0.396275206053131, 'grm_norm': 'gcn', 'self_loops': False, 'use_snp_selection': True, 'num_snps': 28491}. Best is trial 123 with value: 0.298910545580802.
[I 2025-12-09 08:03:04,919] Trial 125 finished with value: 0.29868942913431235 and parameters: {'model_type': 'graphsage', 'hidden_dims': '[512, 64]', 'dropout': 0.1360741294463475, 'batch_norm': False, 'sage_aggr': 'max', 'sage_normalize': False, 'sage_project': False, 'lr': 1.549707258117826e-05, 'weight_decay': 2.381470581295032e-07, 'epochs': 129, 'loss': 'mse', 'optimizer': 'adam', 'graph_mode': 'cutoff', 'cutoff': 0.3933637100409576, 'grm_norm': 'gcn', 'self_loops': False, 'use_snp_selection': True, 'num_snps': 30085}. Best is trial 123 with value: 0.298910545580802.
[I 2025-12-09 08:04:46,889] Trial 126 finished with value: 0.2929114825514171 and parameters: {'model_type': 'graphsage', 'hidden_dims': '[512, 64]', 'dropout': 0.1250425361195803, 'batch_norm': False, 'sage_aggr': 'max', 'sage_normalize': False, 'sage_project': False, 'lr': 1.5703353557560343e-05, 'weight_decay': 1.5254131155135517e-07, 'epochs': 128, 'loss': 'mse', 'optimizer': 'adam', 'graph_mode': 'cutoff', 'cutoff': 0.3959559258519193, 'grm_norm': 'gcn', 'self_loops': False, 'use_snp_selection': True, 'num_snps': 33867}. Best is trial 123 with value: 0.298910545580802.
[I 2025-12-09 08:05:57,754] Trial 127 finished with value: 0.2929216340205757 and parameters: {'model_type': 'graphsage', 'hidden_dims': '[512, 64]', 'dropout': 0.13692115514859657, 'batch_norm': False, 'sage_aggr': 'max', 'sage_normalize': False, 'sage_project': False, 'lr': 1.2995277022389233e-05, 'weight_decay': 2.444069012693912e-07, 'epochs': 107, 'loss': 'mse', 'optimizer': 'adam', 'graph_mode': 'cutoff', 'cutoff': 0.39692215280040916, 'grm_norm': 'gcn', 'self_loops': False, 'use_snp_selection': True, 'num_snps': 27095}. Best is trial 123 with value: 0.298910545580802.
[I 2025-12-09 08:07:08,801] Trial 128 finished with value: 0.2968259446987571 and parameters: {'model_type': 'graphsage', 'hidden_dims': '[512, 64]', 'dropout': 0.14813998691345145, 'batch_norm': False, 'sage_aggr': 'max', 'sage_normalize': False, 'sage_project': False, 'lr': 1.844733141678477e-05, 'weight_decay': 2.66652806872488e-07, 'epochs': 119, 'loss': 'mse', 'optimizer': 'adam', 'graph_mode': 'cutoff', 'cutoff': 0.4234400547560387, 'grm_norm': 'gcn', 'self_loops': False, 'use_snp_selection': True, 'num_snps': 25097}. Best is trial 123 with value: 0.298910545580802.
[I 2025-12-09 08:08:24,183] Trial 129 finished with value: 0.29468234629031337 and parameters: {'model_type': 'graphsage', 'hidden_dims': '[512, 64]', 'dropout': 0.12327429713724733, 'batch_norm': False, 'sage_aggr': 'max', 'sage_normalize': False, 'sage_project': False, 'lr': 1.801976485337002e-05, 'weight_decay': 3.173870531439466e-07, 'epochs': 119, 'loss': 'mse', 'optimizer': 'adam', 'graph_mode': 'cutoff', 'cutoff': 0.3626899558312589, 'grm_norm': 'gcn', 'self_loops': False, 'use_snp_selection': True, 'num_snps': 24707}. Best is trial 123 with value: 0.298910545580802.
[I 2025-12-09 08:09:50,818] Trial 130 finished with value: 0.2994990148839727 and parameters: {'model_type': 'graphsage', 'hidden_dims': '[512, 64]', 'dropout': 0.5519499190642265, 'batch_norm': False, 'sage_aggr': 'max', 'sage_normalize': False, 'sage_project': False, 'lr': 1.4926270543601184e-05, 'weight_decay': 1.9194378901550866e-07, 'epochs': 136, 'loss': 'mse', 'optimizer': 'adam', 'graph_mode': 'cutoff', 'cutoff': 0.4170727007748317, 'grm_norm': 'gcn', 'self_loops': False, 'use_snp_selection': True, 'num_snps': 28229}. Best is trial 130 with value: 0.2994990148839727.
[I 2025-12-09 08:11:23,889] Trial 131 finished with value: 0.29285126474873324 and parameters: {'model_type': 'graphsage', 'hidden_dims': '[512, 64]', 'dropout': 0.41743453740233677, 'batch_norm': False, 'sage_aggr': 'max', 'sage_normalize': False, 'sage_project': False, 'lr': 1.548577879437293e-05, 'weight_decay': 1.7763645639927834e-07, 'epochs': 133, 'loss': 'mse', 'optimizer': 'adam', 'graph_mode': 'cutoff', 'cutoff': 0.4173832146891351, 'grm_norm': 'gcn', 'self_loops': False, 'use_snp_selection': True, 'num_snps': 29603}. Best is trial 130 with value: 0.2994990148839727.
[I 2025-12-09 08:12:33,937] Trial 132 finished with value: 0.2875225414548215 and parameters: {'model_type': 'graphsage', 'hidden_dims': '[512, 64]', 'dropout': 0.3591755841455554, 'batch_norm': False, 'sage_aggr': 'max', 'sage_normalize': False, 'sage_project': False, 'lr': 1.3242532748987935e-05, 'weight_decay': 2.2928291857231184e-07, 'epochs': 96, 'loss': 'mse', 'optimizer': 'adam', 'graph_mode': 'cutoff', 'cutoff': 0.38588251997981243, 'grm_norm': 'gcn', 'self_loops': False, 'use_snp_selection': True, 'num_snps': 28110}. Best is trial 130 with value: 0.2994990148839727.
[I 2025-12-09 08:14:02,502] Trial 133 finished with value: 0.22761823551138055 and parameters: {'model_type': 'graphsage', 'hidden_dims': '[512, 64]', 'dropout': 0.564112064098554, 'batch_norm': False, 'sage_aggr': 'max', 'sage_normalize': False, 'sage_project': False, 'lr': 1.9766135070953825e-05, 'weight_decay': 5.367967657397058e-07, 'epochs': 113, 'loss': 'mse', 'optimizer': 'adam', 'graph_mode': 'cutoff', 'cutoff': 0.43440926110590683, 'grm_norm': 'gcn', 'self_loops': False, 'use_snp_selection': True, 'num_snps': 32684}. Best is trial 130 with value: 0.2994990148839727.
[I 2025-12-09 08:15:11,909] Trial 134 finished with value: 0.3015473146121664 and parameters: {'model_type': 'graphsage', 'hidden_dims': '[512, 64]', 'dropout': 0.14426408974951105, 'batch_norm': False, 'sage_aggr': 'max', 'sage_normalize': False, 'sage_project': False, 'lr': 1.1993888324453044e-05, 'weight_decay': 2.9607182065942083e-07, 'epochs': 125, 'loss': 'mse', 'optimizer': 'adam', 'graph_mode': 'cutoff', 'cutoff': 0.4134737318035521, 'grm_norm': 'gcn', 'self_loops': False, 'use_snp_selection': True, 'num_snps': 23714}. Best is trial 134 with value: 0.3015473146121664.
[I 2025-12-09 08:16:21,030] Trial 135 finished with value: 0.2867284062437393 and parameters: {'model_type': 'graphsage', 'hidden_dims': '[512, 64]', 'dropout': 0.4519052394214821, 'batch_norm': False, 'sage_aggr': 'max', 'sage_normalize': False, 'sage_project': False, 'lr': 1.2433448059285953e-05, 'weight_decay': 2.980813219268993e-07, 'epochs': 125, 'loss': 'mse', 'optimizer': 'adam', 'graph_mode': 'cutoff', 'cutoff': 0.40958046509942797, 'grm_norm': 'gcn', 'self_loops': False, 'use_snp_selection': True, 'num_snps': 23956}. Best is trial 134 with value: 0.3015473146121664.
[I 2025-12-09 08:17:44,961] Trial 136 finished with value: 0.29223068323567186 and parameters: {'model_type': 'graphsage', 'hidden_dims': '[512, 64]', 'dropout': 0.5144824139100901, 'batch_norm': False, 'sage_aggr': 'max', 'sage_normalize': False, 'sage_project': False, 'lr': 1.0020918643101529e-05, 'weight_decay': 1.9783477730526547e-07, 'epochs': 136, 'loss': 'mse', 'optimizer': 'adam', 'graph_mode': 'cutoff', 'cutoff': 0.37388579841146724, 'grm_norm': 'gcn', 'self_loops': False, 'use_snp_selection': True, 'num_snps': 27024}. Best is trial 134 with value: 0.3015473146121664.
[I 2025-12-09 08:19:29,588] Trial 137 finished with value: 0.29456679919937995 and parameters: {'model_type': 'graphsage', 'hidden_dims': '[512, 64]', 'dropout': 0.1458167786572816, 'batch_norm': False, 'sage_aggr': 'max', 'sage_normalize': False, 'sage_project': False, 'lr': 1.567824918626561e-05, 'weight_decay': 1.2069360207577514e-07, 'epochs': 121, 'loss': 'mse', 'optimizer': 'adam', 'graph_mode': 'cutoff', 'cutoff': 0.39265573670052323, 'grm_norm': 'gcn', 'self_loops': False, 'use_snp_selection': True, 'num_snps': 35897}. Best is trial 134 with value: 0.3015473146121664.
[I 2025-12-09 08:20:39,184] Trial 138 finished with value: 0.2907400671868894 and parameters: {'model_type': 'graphsage', 'hidden_dims': '[512, 64]', 'dropout': 0.11771749111863442, 'batch_norm': False, 'sage_aggr': 'max', 'sage_normalize': False, 'sage_project': False, 'lr': 1.1635742088609085e-05, 'weight_decay': 4.5482879465784456e-07, 'epochs': 105, 'loss': 'mse', 'optimizer': 'adam', 'graph_mode': 'cutoff', 'cutoff': 0.33781427802655095, 'grm_norm': 'gcn', 'self_loops': False, 'use_snp_selection': True, 'num_snps': 23973}. Best is trial 134 with value: 0.3015473146121664.
[I 2025-12-09 08:22:04,704] Trial 139 finished with value: 0.2552876368793596 and parameters: {'model_type': 'graphsage', 'hidden_dims': '[256, 128]', 'dropout': 0.4722338338818245, 'batch_norm': True, 'sage_aggr': 'max', 'sage_normalize': False, 'sage_project': False, 'lr': 1.4054224112791603e-05, 'weight_decay': 2.871259490457226e-07, 'epochs': 157, 'loss': 'mse', 'optimizer': 'adam', 'graph_mode': 'cutoff', 'cutoff': 0.4221424595630184, 'grm_norm': 'gcn', 'self_loops': False, 'use_snp_selection': True, 'num_snps': 30711}. Best is trial 134 with value: 0.3015473146121664.
[I 2025-12-09 08:23:10,755] Trial 140 finished with value: 0.27942243343031536 and parameters: {'model_type': 'graphsage', 'hidden_dims': '[512, 64]', 'dropout': 0.13585619354698517, 'batch_norm': False, 'sage_aggr': 'max', 'sage_normalize': True, 'sage_project': False, 'lr': 1.779363710404811e-05, 'weight_decay': 4.2340110434774845e-07, 'epochs': 82, 'loss': 'mse', 'optimizer': 'adam', 'graph_mode': 'cutoff', 'cutoff': 0.35151413682090155, 'grm_norm': 'gcn', 'self_loops': True, 'use_snp_selection': True, 'num_snps': 27977}. Best is trial 134 with value: 0.3015473146121664.
[I 2025-12-09 08:24:41,111] Trial 141 finished with value: 0.29891101954619 and parameters: {'model_type': 'graphsage', 'hidden_dims': '[512, 64]', 'dropout': 0.10018121528893804, 'batch_norm': False, 'sage_aggr': 'max', 'sage_normalize': False, 'sage_project': False, 'lr': 2.197814649444822e-05, 'weight_decay': 3.310422971446829e-07, 'epochs': 166, 'loss': 'mse', 'optimizer': 'adam', 'graph_mode': 'cutoff', 'cutoff': 0.4566345783147552, 'grm_norm': 'gcn', 'self_loops': False, 'use_snp_selection': True, 'num_snps': 25977}. Best is trial 134 with value: 0.3015473146121664.
[I 2025-12-09 08:26:12,785] Trial 142 finished with value: 0.2999760678707832 and parameters: {'model_type': 'graphsage', 'hidden_dims': '[512, 64]', 'dropout': 0.10965142869534687, 'batch_norm': False, 'sage_aggr': 'max', 'sage_normalize': False, 'sage_project': False, 'lr': 1.5879479037037656e-05, 'weight_decay': 1.711947609309972e-07, 'epochs': 169, 'loss': 'mse', 'optimizer': 'adam', 'graph_mode': 'cutoff', 'cutoff': 0.4396387403090463, 'grm_norm': 'gcn', 'self_loops': False, 'use_snp_selection': True, 'num_snps': 25733}. Best is trial 134 with value: 0.3015473146121664.
[I 2025-12-09 08:27:31,948] Trial 143 finished with value: 0.2969759154341135 and parameters: {'model_type': 'graphsage', 'hidden_dims': '[512, 64]', 'dropout': 0.32462905503528616, 'batch_norm': False, 'sage_aggr': 'max', 'sage_normalize': False, 'sage_project': False, 'lr': 2.0232751084953464e-05, 'weight_decay': 1.764456531307033e-07, 'epochs': 171, 'loss': 'mse', 'optimizer': 'adam', 'graph_mode': 'cutoff', 'cutoff': 0.4548357805267536, 'grm_norm': 'gcn', 'self_loops': False, 'use_snp_selection': True, 'num_snps': 24578}. Best is trial 134 with value: 0.3015473146121664.
[I 2025-12-09 08:28:54,796] Trial 144 finished with value: 0.291982769464436 and parameters: {'model_type': 'graphsage', 'hidden_dims': '[512, 64]', 'dropout': 0.39547946710656107, 'batch_norm': False, 'sage_aggr': 'max', 'sage_normalize': False, 'sage_project': False, 'lr': 2.1831103396231005e-05, 'weight_decay': 1.511788194305232e-07, 'epochs': 169, 'loss': 'mse', 'optimizer': 'adam', 'graph_mode': 'cutoff', 'cutoff': 0.4538833807869294, 'grm_norm': 'gcn', 'self_loops': False, 'use_snp_selection': True, 'num_snps': 24171}. Best is trial 134 with value: 0.3015473146121664.
[I 2025-12-09 08:29:50,146] Trial 145 finished with value: 0.2908401435924831 and parameters: {'model_type': 'graphsage', 'hidden_dims': '[128, 64]', 'dropout': 0.28349893062277715, 'batch_norm': False, 'sage_aggr': 'max', 'sage_normalize': False, 'sage_project': False, 'lr': 2.0202754766412233e-05, 'weight_decay': 1.0098567984383588e-07, 'epochs': 175, 'loss': 'mse', 'optimizer': 'adam', 'graph_mode': 'cutoff', 'cutoff': 0.441381229060135, 'grm_norm': 'gcn', 'self_loops': False, 'use_snp_selection': True, 'num_snps': 22829}. Best is trial 134 with value: 0.3015473146121664.
[I 2025-12-09 08:31:21,593] Trial 146 finished with value: 0.27099241683177344 and parameters: {'model_type': 'graphsage', 'hidden_dims': '[512, 64]', 'dropout': 0.11813555696104366, 'batch_norm': False, 'sage_aggr': 'max', 'sage_normalize': False, 'sage_project': False, 'lr': 1.459333358017656e-05, 'weight_decay': 2.087792199093844e-07, 'epochs': 154, 'loss': 'mae', 'optimizer': 'adam', 'graph_mode': 'cutoff', 'cutoff': 0.4056222538173888, 'grm_norm': 'gcn', 'self_loops': False, 'use_snp_selection': True, 'num_snps': 26807}. Best is trial 134 with value: 0.3015473146121664.
