[I 2025-12-08 17:04:04,850] Trial 117 finished with value: 0.2685908490104346 and parameters: {'model_type': 'graphsage', 'hidden_dims': '[512, 64]', 'dropout': 0.5597581112452971, 'batch_norm': True, 'sage_aggr': 'max', 'sage_normalize': True, 'sage_project': False, 'lr': 0.0003852900639334454, 'weight_decay': 1.0234213761566349e-07, 'epochs': 144, 'loss': 'mse', 'optimizer': 'adam', 'graph_mode': 'knn', 'knn_k': 10, 'weighted_edges': True, 'symmetrize_mode': 'mutual', 'self_loops': False, 'use_snp_selection': False}. Best is trial 91 with value: 0.3040003758189352.
[I 2025-12-08 17:05:11,492] Trial 118 finished with value: 0.3016360457179206 and parameters: {'model_type': 'graphsage', 'hidden_dims': '[512, 64]', 'dropout': 0.5843574116694664, 'batch_norm': True, 'sage_aggr': 'max', 'sage_normalize': False, 'sage_project': False, 'lr': 0.005911536348282618, 'weight_decay': 1.5719657039850846e-07, 'epochs': 138, 'loss': 'mse', 'optimizer': 'adam', 'graph_mode': 'cutoff', 'cutoff': 0.7876046034447693, 'grm_norm': 'cosine', 'self_loops': False, 'use_snp_selection': False}. Best is trial 91 with value: 0.3040003758189352.
[I 2025-12-08 17:06:16,742] Trial 119 finished with value: 0.2994540328296462 and parameters: {'model_type': 'graphsage', 'hidden_dims': '[512, 64]', 'dropout': 0.5983418840585093, 'batch_norm': True, 'sage_aggr': 'max', 'sage_normalize': False, 'sage_project': False, 'lr': 0.004176825089108633, 'weight_decay': 1.567806067223141e-07, 'epochs': 137, 'loss': 'mse', 'optimizer': 'adam', 'graph_mode': 'cutoff', 'cutoff': 0.8208218607564473, 'grm_norm': 'gcn', 'self_loops': False, 'use_snp_selection': False}. Best is trial 91 with value: 0.3040003758189352.
[I 2025-12-08 17:07:36,188] Trial 120 finished with value: 0.2998434611108755 and parameters: {'model_type': 'graphsage', 'hidden_dims': '[512, 64]', 'dropout': 0.5848099495670466, 'batch_norm': True, 'sage_aggr': 'max', 'sage_normalize': False, 'sage_project': False, 'lr': 0.005519410471772695, 'weight_decay': 2.55409003106934e-07, 'epochs': 171, 'loss': 'mse', 'optimizer': 'adam', 'graph_mode': 'cutoff', 'cutoff': 0.7838715481519724, 'grm_norm': 'cosine', 'self_loops': False, 'use_snp_selection': False}. Best is trial 91 with value: 0.3040003758189352.
[I 2025-12-08 17:08:45,243] Trial 121 finished with value: 0.2768617434717311 and parameters: {'model_type': 'graphsage', 'hidden_dims': '[512, 64]', 'dropout': 0.5636447282976117, 'batch_norm': True, 'sage_aggr': 'max', 'sage_normalize': False, 'sage_project': False, 'lr': 0.007140189379304181, 'weight_decay': 1.8834821625114453e-07, 'epochs': 104, 'loss': 'mse', 'optimizer': 'adam', 'graph_mode': 'cutoff', 'cutoff': 0.2942520013440541, 'grm_norm': 'cosine', 'self_loops': False, 'use_snp_selection': False}. Best is trial 91 with value: 0.3040003758189352.
[I 2025-12-08 17:10:11,250] Trial 122 finished with value: 0.30138370160124267 and parameters: {'model_type': 'graphsage', 'hidden_dims': '[512, 64]', 'dropout': 0.5514249537759203, 'batch_norm': True, 'sage_aggr': 'max', 'sage_normalize': False, 'sage_project': False, 'lr': 0.006092033124289986, 'weight_decay': 4.87418140348125e-07, 'epochs': 188, 'loss': 'mse', 'optimizer': 'adam', 'graph_mode': 'cutoff', 'cutoff': 0.7952430680250328, 'grm_norm': 'cosine', 'self_loops': False, 'use_snp_selection': False}. Best is trial 91 with value: 0.3040003758189352.
[I 2025-12-08 17:11:27,985] Trial 123 finished with value: 0.30172755244655514 and parameters: {'model_type': 'graphsage', 'hidden_dims': '[512, 64]', 'dropout': 0.547710981678559, 'batch_norm': True, 'sage_aggr': 'max', 'sage_normalize': False, 'sage_project': False, 'lr': 0.0031712318313616593, 'weight_decay': 3.62286433178866e-07, 'epochs': 164, 'loss': 'mse', 'optimizer': 'adam', 'graph_mode': 'cutoff', 'cutoff': 0.7923730371950599, 'grm_norm': 'cosine', 'self_loops': False, 'use_snp_selection': False}. Best is trial 91 with value: 0.3040003758189352.
[I 2025-12-08 17:12:38,111] Trial 124 finished with value: 0.30043486775135614 and parameters: {'model_type': 'graphsage', 'hidden_dims': '[512, 64]', 'dropout': 0.587326097250913, 'batch_norm': True, 'sage_aggr': 'max', 'sage_normalize': False, 'sage_project': False, 'lr': 0.0035277068363103454, 'weight_decay': 5.99475983670481e-07, 'epochs': 147, 'loss': 'mse', 'optimizer': 'adam', 'graph_mode': 'cutoff', 'cutoff': 0.7931194090523122, 'grm_norm': 'cosine_then_gcn', 'self_loops': False, 'use_snp_selection': False}. Best is trial 91 with value: 0.3040003758189352.
[I 2025-12-08 17:13:51,397] Trial 125 finished with value: 0.2978331112765001 and parameters: {'model_type': 'graphsage', 'hidden_dims': '[512, 64]', 'dropout': 0.5379433079045776, 'batch_norm': True, 'sage_aggr': 'max', 'sage_normalize': False, 'sage_project': False, 'lr': 0.0024779787429577735, 'weight_decay': 4.85180993515129e-07, 'epochs': 155, 'loss': 'mse', 'optimizer': 'adam', 'graph_mode': 'cutoff', 'cutoff': 0.8311144112130742, 'grm_norm': 'cosine', 'self_loops': False, 'use_snp_selection': False}. Best is trial 91 with value: 0.3040003758189352.
[I 2025-12-08 17:15:20,803] Trial 126 finished with value: 0.29297705154514875 and parameters: {'model_type': 'graphsage', 'hidden_dims': '[512, 256]', 'dropout': 0.5533126478583159, 'batch_norm': True, 'sage_aggr': 'max', 'sage_normalize': False, 'sage_project': False, 'lr': 0.0019059475463486485, 'weight_decay': 0.0006308607798164085, 'epochs': 196, 'loss': 'mse', 'optimizer': 'adam', 'graph_mode': 'cutoff', 'cutoff': 0.8135928659686682, 'grm_norm': 'cosine', 'self_loops': False, 'use_snp_selection': False}. Best is trial 91 with value: 0.3040003758189352.
[I 2025-12-08 17:16:45,015] Trial 127 finished with value: 0.0 and parameters: {'model_type': 'graphsage', 'hidden_dims': '[512, 64]', 'dropout': 0.5747632957779975, 'batch_norm': False, 'sage_aggr': 'max', 'sage_normalize': False, 'sage_project': False, 'lr': 0.004714862021675841, 'weight_decay': 3.582663264061855e-07, 'epochs': 187, 'loss': 'mse', 'optimizer': 'adam', 'graph_mode': 'cutoff', 'cutoff': 0.842514429077245, 'grm_norm': 'cosine', 'self_loops': False, 'use_snp_selection': False}. Best is trial 91 with value: 0.3040003758189352.
[I 2025-12-08 17:18:19,185] Trial 128 finished with value: 0.29079058673154323 and parameters: {'model_type': 'graphsage', 'hidden_dims': '[512, 128]', 'dropout': 0.5320696822647083, 'batch_norm': True, 'sage_aggr': 'max', 'sage_normalize': False, 'sage_project': False, 'lr': 0.002886325854318393, 'weight_decay': 2.3819295016405366e-07, 'epochs': 205, 'loss': 'mse', 'optimizer': 'adam', 'graph_mode': 'cutoff', 'cutoff': 0.57027642839886, 'grm_norm': 'cosine', 'self_loops': False, 'use_snp_selection': False}. Best is trial 91 with value: 0.3040003758189352.
[I 2025-12-08 17:19:52,949] Trial 129 finished with value: 0.2982940872191605 and parameters: {'model_type': 'graphsage', 'hidden_dims': '[512, 64]', 'dropout': 0.566818575008511, 'batch_norm': True, 'sage_aggr': 'max', 'sage_normalize': False, 'sage_project': False, 'lr': 0.0034178766222188054, 'weight_decay': 7.380532293122102e-07, 'epochs': 208, 'loss': 'mse', 'optimizer': 'adam', 'graph_mode': 'cutoff', 'cutoff': 0.80590330449322, 'grm_norm': 'cosine', 'self_loops': False, 'use_snp_selection': False}. Best is trial 91 with value: 0.3040003758189352.
[I 2025-12-08 17:21:24,574] Trial 130 finished with value: 0.2889287238355344 and parameters: {'model_type': 'graphsage', 'hidden_dims': '[512, 64]', 'dropout': 0.5150843530523549, 'batch_norm': True, 'sage_aggr': 'max', 'sage_normalize': False, 'sage_project': False, 'lr': 0.004139794232986976, 'weight_decay': 3.4449066537907134e-07, 'epochs': 173, 'loss': 'mse', 'optimizer': 'adam', 'graph_mode': 'cutoff', 'cutoff': 0.48322360401308684, 'grm_norm': 'cosine', 'self_loops': False, 'use_snp_selection': False}. Best is trial 91 with value: 0.3040003758189352.
[I 2025-12-08 17:22:41,753] Trial 131 finished with value: 0.3014887413487177 and parameters: {'model_type': 'graphsage', 'hidden_dims': '[512, 64]', 'dropout': 0.5493935215258758, 'batch_norm': True, 'sage_aggr': 'max', 'sage_normalize': False, 'sage_project': False, 'lr': 0.005738743746618483, 'weight_decay': 1.550825367836351e-07, 'epochs': 165, 'loss': 'mse', 'optimizer': 'adam', 'graph_mode': 'cutoff', 'cutoff': 0.7673756354723916, 'grm_norm': 'cosine', 'self_loops': False, 'use_snp_selection': False}. Best is trial 91 with value: 0.3040003758189352.
[I 2025-12-08 17:23:59,276] Trial 132 finished with value: 0.30186329980158944 and parameters: {'model_type': 'graphsage', 'hidden_dims': '[512, 64]', 'dropout': 0.5817812489200249, 'batch_norm': True, 'sage_aggr': 'max', 'sage_normalize': False, 'sage_project': False, 'lr': 0.006199463997575893, 'weight_decay': 1.2435156012714618e-07, 'epochs': 166, 'loss': 'mse', 'optimizer': 'adam', 'graph_mode': 'cutoff', 'cutoff': 0.7491463635100604, 'grm_norm': 'cosine', 'self_loops': False, 'use_snp_selection': False}. Best is trial 91 with value: 0.3040003758189352.
[I 2025-12-08 17:25:15,302] Trial 133 finished with value: 0.303701318553011 and parameters: {'model_type': 'graphsage', 'hidden_dims': '[512, 64]', 'dropout': 0.5819407282606734, 'batch_norm': True, 'sage_aggr': 'max', 'sage_normalize': False, 'sage_project': False, 'lr': 0.00618695000591679, 'weight_decay': 1.2944773787978356e-07, 'epochs': 162, 'loss': 'mse', 'optimizer': 'adam', 'graph_mode': 'cutoff', 'cutoff': 0.7844831131073938, 'grm_norm': 'cosine', 'self_loops': False, 'use_snp_selection': False}. Best is trial 91 with value: 0.3040003758189352.
[I 2025-12-08 17:26:31,642] Trial 134 finished with value: 0.2998835856392898 and parameters: {'model_type': 'graphsage', 'hidden_dims': '[512, 64]', 'dropout': 0.5827666807314278, 'batch_norm': True, 'sage_aggr': 'max', 'sage_normalize': False, 'sage_project': False, 'lr': 0.004924030497549195, 'weight_decay': 1.3511339317296272e-07, 'epochs': 163, 'loss': 'mse', 'optimizer': 'adam', 'graph_mode': 'cutoff', 'cutoff': 0.7450459336763737, 'grm_norm': 'cosine', 'self_loops': False, 'use_snp_selection': False}. Best is trial 91 with value: 0.3040003758189352.
[I 2025-12-08 17:27:48,035] Trial 135 finished with value: 0.3005689864781589 and parameters: {'model_type': 'graphsage', 'hidden_dims': '[512, 64]', 'dropout': 0.5918613221492235, 'batch_norm': True, 'sage_aggr': 'max', 'sage_normalize': False, 'sage_project': False, 'lr': 0.007094548206973245, 'weight_decay': 1.1510452234121332e-07, 'epochs': 163, 'loss': 'mse', 'optimizer': 'adam', 'graph_mode': 'cutoff', 'cutoff': 0.7894459147614865, 'grm_norm': 'cosine', 'self_loops': False, 'use_snp_selection': False}. Best is trial 91 with value: 0.3040003758189352.
[I 2025-12-08 17:29:10,575] Trial 136 finished with value: 0.29863198543717784 and parameters: {'model_type': 'graphsage', 'hidden_dims': '[512, 64]', 'dropout': 0.5990223196864926, 'batch_norm': True, 'sage_aggr': 'max', 'sage_normalize': False, 'sage_project': False, 'lr': 0.006149944159187012, 'weight_decay': 1.0434682747435664e-07, 'epochs': 181, 'loss': 'mse', 'optimizer': 'adam', 'graph_mode': 'cutoff', 'cutoff': 0.7833221533987653, 'grm_norm': 'gcn', 'self_loops': False, 'use_snp_selection': False}. Best is trial 91 with value: 0.3040003758189352.
[I 2025-12-08 17:30:39,991] Trial 137 finished with value: 0.29067615012843206 and parameters: {'model_type': 'graphsage', 'hidden_dims': '[512, 64]', 'dropout': 0.5820340631683193, 'batch_norm': True, 'sage_aggr': 'max', 'sage_normalize': False, 'sage_project': False, 'lr': 0.008452745329832288, 'weight_decay': 2.0410821517023316e-07, 'epochs': 186, 'loss': 'mse', 'optimizer': 'adam', 'graph_mode': 'cutoff', 'cutoff': 0.5199039292399289, 'grm_norm': 'cosine', 'self_loops': False, 'use_snp_selection': False}. Best is trial 91 with value: 0.3040003758189352.
[I 2025-12-08 17:31:55,510] Trial 138 finished with value: 0.2996184562957377 and parameters: {'model_type': 'graphsage', 'hidden_dims': '[512, 64]', 'dropout': 0.5521467571156835, 'batch_norm': True, 'sage_aggr': 'max', 'sage_normalize': False, 'sage_project': False, 'lr': 0.005351537108241339, 'weight_decay': 1.621599572188304e-07, 'epochs': 161, 'loss': 'mse', 'optimizer': 'adam', 'graph_mode': 'cutoff', 'cutoff': 0.7249887060720296, 'grm_norm': 'cosine', 'self_loops': False, 'use_snp_selection': False}. Best is trial 91 with value: 0.3040003758189352.
[I 2025-12-08 17:33:37,505] Trial 139 finished with value: 0.275446661389495 and parameters: {'model_type': 'graphsage', 'hidden_dims': '[512, 64]', 'dropout': 0.5719364917772163, 'batch_norm': True, 'sage_aggr': 'max', 'sage_normalize': True, 'sage_project': False, 'lr': 0.0044577984710164895, 'weight_decay': 2.925994521476378e-07, 'epochs': 152, 'loss': 'mse', 'optimizer': 'adam', 'graph_mode': 'knn', 'knn_k': 5, 'weighted_edges': False, 'symmetrize_mode': 'union', 'self_loops': False, 'use_snp_selection': False}. Best is trial 91 with value: 0.3040003758189352.
[I 2025-12-08 17:34:55,681] Trial 140 finished with value: 0.29056824940845827 and parameters: {'model_type': 'graphsage', 'hidden_dims': '[512, 64]', 'dropout': 0.23712956307210648, 'batch_norm': True, 'sage_aggr': 'max', 'sage_normalize': False, 'sage_project': False, 'lr': 0.000696609862574132, 'weight_decay': 1.2646348117262313e-07, 'epochs': 168, 'loss': 'mse', 'optimizer': 'adam', 'graph_mode': 'cutoff', 'cutoff': 0.7744991597819925, 'grm_norm': 'cosine_then_gcn', 'self_loops': False, 'use_snp_selection': False}. Best is trial 91 with value: 0.3040003758189352.
[I 2025-12-08 17:36:22,407] Trial 141 finished with value: 0.30201144159921584 and parameters: {'model_type': 'graphsage', 'hidden_dims': '[512, 64]', 'dropout': 0.5450751108948888, 'batch_norm': True, 'sage_aggr': 'max', 'sage_normalize': False, 'sage_project': False, 'lr': 0.0063695220832713575, 'weight_decay': 1.579542152006735e-07, 'epochs': 190, 'loss': 'mse', 'optimizer': 'adam', 'graph_mode': 'cutoff', 'cutoff': 0.7992400724621355, 'grm_norm': 'cosine', 'self_loops': False, 'use_snp_selection': False}. Best is trial 91 with value: 0.3040003758189352.
[I 2025-12-08 17:37:49,513] Trial 142 finished with value: 0.30056935116879113 and parameters: {'model_type': 'graphsage', 'hidden_dims': '[512, 64]', 'dropout': 0.5472030653550874, 'batch_norm': True, 'sage_aggr': 'max', 'sage_normalize': False, 'sage_project': False, 'lr': 0.006205709219973624, 'weight_decay': 1.5760896824563999e-07, 'epochs': 191, 'loss': 'mse', 'optimizer': 'adam', 'graph_mode': 'cutoff', 'cutoff': 0.8194412509173146, 'grm_norm': 'cosine', 'self_loops': False, 'use_snp_selection': False}. Best is trial 91 with value: 0.3040003758189352.
[I 2025-12-08 17:39:10,780] Trial 143 finished with value: 0.29930494351465303 and parameters: {'model_type': 'graphsage', 'hidden_dims': '[512, 64]', 'dropout': 0.5786075753691715, 'batch_norm': True, 'sage_aggr': 'max', 'sage_normalize': False, 'sage_project': False, 'lr': 0.007515304721375807, 'weight_decay': 2.1423132949340215e-07, 'epochs': 176, 'loss': 'mse', 'optimizer': 'adam', 'graph_mode': 'cutoff', 'cutoff': 0.8321197977479501, 'grm_norm': 'cosine', 'self_loops': False, 'use_snp_selection': False}. Best is trial 91 with value: 0.3040003758189352.
[I 2025-12-08 17:40:32,866] Trial 144 finished with value: 0.3014084608057417 and parameters: {'model_type': 'graphsage', 'hidden_dims': '[512, 64]', 'dropout': 0.5570474688693031, 'batch_norm': True, 'sage_aggr': 'max', 'sage_normalize': False, 'sage_project': False, 'lr': 0.005069149857503396, 'weight_decay': 1.2229552847078277e-07, 'epochs': 178, 'loss': 'mse', 'optimizer': 'adam', 'graph_mode': 'cutoff', 'cutoff': 0.8056196471676127, 'grm_norm': 'cosine', 'self_loops': False, 'use_snp_selection': False}. Best is trial 91 with value: 0.3040003758189352.
[I 2025-12-08 17:42:11,617] Trial 145 finished with value: 0.30331741805112233 and parameters: {'model_type': 'graphsage', 'hidden_dims': '[512, 256]', 'dropout': 0.5217881829215872, 'batch_norm': True, 'sage_aggr': 'max', 'sage_normalize': False, 'sage_project': False, 'lr': 0.0055462031973000665, 'weight_decay': 1.1887135949201364e-07, 'epochs': 220, 'loss': 'mse', 'optimizer': 'adam', 'graph_mode': 'cutoff', 'cutoff': 0.8060765482946814, 'grm_norm': 'cosine', 'self_loops': False, 'use_snp_selection': False}. Best is trial 91 with value: 0.3040003758189352.
[I 2025-12-08 17:43:49,985] Trial 146 finished with value: 0.3006191771859015 and parameters: {'model_type': 'graphsage', 'hidden_dims': '[512, 64]', 'dropout': 0.5019818179550044, 'batch_norm': True, 'sage_aggr': 'max', 'sage_normalize': False, 'sage_project': False, 'lr': 0.005795254351202065, 'weight_decay': 1.1580093497876909e-07, 'epochs': 220, 'loss': 'mse', 'optimizer': 'adam', 'graph_mode': 'cutoff', 'cutoff': 0.8569275734989379, 'grm_norm': 'cosine', 'self_loops': False, 'use_snp_selection': False}. Best is trial 91 with value: 0.3040003758189352.
[I 2025-12-08 17:45:40,852] Trial 147 finished with value: 0.3003647765970788 and parameters: {'model_type': 'graphsage', 'hidden_dims': '[512, 256]', 'dropout': 0.5265770327897912, 'batch_norm': True, 'sage_aggr': 'max', 'sage_normalize': False, 'sage_project': False, 'lr': 0.0069696024903827215, 'weight_decay': 1.025452582990967e-07, 'epochs': 251, 'loss': 'mse', 'optimizer': 'adam', 'graph_mode': 'cutoff', 'cutoff': 0.7471499951949065, 'grm_norm': 'cosine', 'self_loops': False, 'use_snp_selection': False}. Best is trial 91 with value: 0.3040003758189352.
[I 2025-12-08 17:47:14,484] Trial 148 finished with value: 0.0 and parameters: {'model_type': 'graphsage', 'hidden_dims': '[512, 256]', 'dropout': 0.5190627568896627, 'batch_norm': False, 'sage_aggr': 'max', 'sage_normalize': False, 'sage_project': False, 'lr': 0.008800892661464763, 'weight_decay': 1.5460762634983935e-07, 'epochs': 211, 'loss': 'mse', 'optimizer': 'adam', 'graph_mode': 'cutoff', 'cutoff': 0.7697016199767027, 'grm_norm': 'cosine', 'self_loops': False, 'use_snp_selection': False}. Best is trial 91 with value: 0.3040003758189352.
[I 2025-12-08 17:48:40,354] Trial 149 finished with value: 0.29949551611514075 and parameters: {'model_type': 'graphsage', 'hidden_dims': '[512, 256]', 'dropout': 0.5440514778095422, 'batch_norm': True, 'sage_aggr': 'max', 'sage_normalize': False, 'sage_project': False, 'lr': 0.004927811287340555, 'weight_decay': 2.3141751727061129e-07, 'epochs': 187, 'loss': 'mse', 'optimizer': 'adam', 'graph_mode': 'cutoff', 'cutoff': 0.7982703439871359, 'grm_norm': 'cosine', 'self_loops': False, 'use_snp_selection': False}. Best is trial 91 with value: 0.3040003758189352.
[I 2025-12-08 17:50:08,571] Trial 0 finished with value: 0.27007038777797776 and parameters: {'model_type': 'graphsage', 'hidden_dims': '[128, 64]', 'dropout': 0.199031432379812, 'batch_norm': True, 'sage_aggr': 'max', 'sage_normalize': True, 'sage_project': False, 'lr': 0.00034401453323286885, 'weight_decay': 0.00017802616915745114, 'epochs': 230, 'loss': 'mse', 'optimizer': 'adam', 'graph_mode': 'knn', 'knn_k': 6, 'weighted_edges': True, 'symmetrize_mode': 'mutual', 'self_loops': True, 'use_snp_selection': False}. Best is trial 0 with value: 0.27007038777797776.
[I 2025-12-08 17:51:48,638] Trial 1 finished with value: 0.2702135333878334 and parameters: {'model_type': 'graphsage', 'hidden_dims': '[512, 128]', 'dropout': 0.2503500283181017, 'batch_norm': False, 'sage_aggr': 'max', 'sage_normalize': False, 'sage_project': False, 'lr': 3.952233718592099e-05, 'weight_decay': 0.00026754769258252603, 'epochs': 149, 'loss': 'mse', 'optimizer': 'adam', 'graph_mode': 'knn', 'knn_k': 2, 'weighted_edges': False, 'symmetrize_mode': 'mutual', 'self_loops': True, 'use_snp_selection': True, 'num_snps': 49915}. Best is trial 1 with value: 0.2702135333878334.
[I 2025-12-08 17:53:05,854] Trial 2 finished with value: 0.2869451204049505 and parameters: {'model_type': 'graphsage', 'hidden_dims': '[512, 256]', 'dropout': 0.2785908793172681, 'batch_norm': False, 'sage_aggr': 'max', 'sage_normalize': False, 'sage_project': False, 'lr': 8.806039223165805e-05, 'weight_decay': 3.5153176302760294e-05, 'epochs': 147, 'loss': 'mae', 'optimizer': 'adam', 'graph_mode': 'cutoff', 'cutoff': 0.4922564006874869, 'grm_norm': 'gcn', 'self_loops': False, 'use_snp_selection': True, 'num_snps': 34340}. Best is trial 2 with value: 0.2869451204049505.
[I 2025-12-08 17:54:19,190] Trial 3 finished with value: 0.29717962944102083 and parameters: {'model_type': 'graphsage', 'hidden_dims': '[256, 128, 64]', 'dropout': 0.3475243154412272, 'batch_norm': True, 'sage_aggr': 'max', 'sage_normalize': False, 'sage_project': False, 'lr': 1.6006331996938085e-05, 'weight_decay': 7.213121225589906e-06, 'epochs': 283, 'loss': 'mse', 'optimizer': 'adam', 'graph_mode': 'cutoff', 'cutoff': 0.5942334791449215, 'grm_norm': 'none', 'self_loops': True, 'use_snp_selection': False}. Best is trial 3 with value: 0.29717962944102083.
[I 2025-12-08 17:55:02,070] Trial 4 finished with value: 0.2820143063834066 and parameters: {'model_type': 'graphsage', 'hidden_dims': '[128, 64]', 'dropout': 0.3348926467202472, 'batch_norm': True, 'sage_aggr': 'max', 'sage_normalize': False, 'sage_project': False, 'lr': 0.0004238630400638802, 'weight_decay': 8.074086040046576e-07, 'epochs': 158, 'loss': 'mae', 'optimizer': 'adam', 'graph_mode': 'knn', 'knn_k': 1, 'weighted_edges': False, 'symmetrize_mode': 'mutual', 'self_loops': False, 'use_snp_selection': True, 'num_snps': 26850}. Best is trial 3 with value: 0.29717962944102083.
