[I 2025-12-05 16:08:33,322] Trial 70 finished with value: 0.24650990051486027 and parameters: {'model_type': 'graphsage', 'hidden_dims': '[128, 64]', 'dropout': 0.5864560102983443, 'batch_norm': True, 'sage_aggr': 'max', 'sage_normalize': True, 'sage_project': False, 'lr': 0.00046367743149226055, 'weight_decay': 5.58039168763111e-07, 'epochs': 197, 'loss': 'mse', 'optimizer': 'adam', 'graph_mode': 'cutoff', 'cutoff': 0.5624698085720732, 'grm_norm': 'cosine', 'self_loops': False, 'use_snp_selection': True, 'num_snps': 25308, 'graphsage_batch_size': 32}. Best is trial 43 with value: 0.2714390357744548.
[I 2025-12-05 16:09:13,659] Trial 71 finished with value: 0.2674954984338717 and parameters: {'model_type': 'graphsage', 'hidden_dims': '[128, 64]', 'dropout': 0.544072652603575, 'batch_norm': True, 'sage_aggr': 'mean', 'sage_normalize': True, 'sage_project': False, 'lr': 0.0007750054063135333, 'weight_decay': 3.089162328588786e-07, 'epochs': 204, 'loss': 'mse', 'optimizer': 'adam', 'graph_mode': 'cutoff', 'cutoff': 0.43205382831922606, 'grm_norm': 'cosine', 'self_loops': False, 'use_snp_selection': True, 'num_snps': 20523, 'graphsage_batch_size': 32}. Best is trial 43 with value: 0.2714390357744548.
[I 2025-12-05 16:09:54,973] Trial 72 finished with value: 0.25898559895320866 and parameters: {'model_type': 'graphsage', 'hidden_dims': '[128, 64]', 'dropout': 0.563333375285243, 'batch_norm': True, 'sage_aggr': 'mean', 'sage_normalize': True, 'sage_project': False, 'lr': 0.0006559724794407407, 'weight_decay': 2.859351171828202e-07, 'epochs': 201, 'loss': 'mse', 'optimizer': 'adam', 'graph_mode': 'cutoff', 'cutoff': 0.4360778268187805, 'grm_norm': 'cosine', 'self_loops': False, 'use_snp_selection': True, 'num_snps': 21558, 'graphsage_batch_size': 32}. Best is trial 43 with value: 0.2714390357744548.
[I 2025-12-05 16:11:06,785] Trial 73 finished with value: 0.24815534783398435 and parameters: {'model_type': 'graphsage', 'hidden_dims': '[128, 64]', 'dropout': 0.5440835787087622, 'batch_norm': True, 'sage_aggr': 'mean', 'sage_normalize': True, 'sage_project': False, 'lr': 0.000776844562409853, 'weight_decay': 1.9103790761575706e-07, 'epochs': 210, 'loss': 'mse', 'optimizer': 'adam', 'graph_mode': 'cutoff', 'cutoff': 0.38592750874615145, 'grm_norm': 'cosine', 'self_loops': False, 'use_snp_selection': True, 'num_snps': 37039, 'graphsage_batch_size': 32}. Best is trial 43 with value: 0.2714390357744548.
[I 2025-12-05 16:11:43,070] Trial 74 finished with value: 0.23840423814427983 and parameters: {'model_type': 'graphsage', 'hidden_dims': '[128, 64]', 'dropout': 0.29803725796264074, 'batch_norm': True, 'sage_aggr': 'mean', 'sage_normalize': True, 'sage_project': False, 'lr': 0.000394558578349519, 'weight_decay': 8.195560758802216e-07, 'epochs': 228, 'loss': 'mse', 'optimizer': 'adam', 'graph_mode': 'cutoff', 'cutoff': 0.49974202209548185, 'grm_norm': 'cosine', 'self_loops': False, 'use_snp_selection': True, 'num_snps': 18998, 'graphsage_batch_size': 32}. Best is trial 43 with value: 0.2714390357744548.
[I 2025-12-05 16:12:18,439] Trial 75 finished with value: 0.2630913566408874 and parameters: {'model_type': 'graphsage', 'hidden_dims': '[128, 64]', 'dropout': 0.5109667259268328, 'batch_norm': True, 'sage_aggr': 'mean', 'sage_normalize': True, 'sage_project': False, 'lr': 0.000996126236317443, 'weight_decay': 3.3319044334467756e-07, 'epochs': 192, 'loss': 'mse', 'optimizer': 'adam', 'graph_mode': 'cutoff', 'cutoff': 0.3529773390913012, 'grm_norm': 'cosine', 'self_loops': False, 'use_snp_selection': True, 'num_snps': 15621, 'graphsage_batch_size': 32}. Best is trial 43 with value: 0.2714390357744548.
[I 2025-12-05 16:14:10,340] Trial 76 finished with value: 0.2279855963154104 and parameters: {'model_type': 'graphsage', 'hidden_dims': '[128, 64]', 'dropout': 0.5883122966080244, 'batch_norm': True, 'sage_aggr': 'mean', 'sage_normalize': True, 'sage_project': False, 'lr': 0.0006127961549664235, 'weight_decay': 1.7878665828915254e-06, 'epochs': 185, 'loss': 'mse', 'optimizer': 'adam', 'graph_mode': 'knn', 'knn_k': 8, 'weighted_edges': False, 'symmetrize_mode': 'union', 'self_loops': False, 'use_snp_selection': False, 'graphsage_batch_size': 32}. Best is trial 43 with value: 0.2714390357744548.
[I 2025-12-05 16:15:33,281] Trial 77 finished with value: 0.2640321464405301 and parameters: {'model_type': 'graphsage', 'hidden_dims': '[512, 64]', 'dropout': 0.5335985999974985, 'batch_norm': True, 'sage_aggr': 'mean', 'sage_normalize': True, 'sage_project': False, 'lr': 0.0008072656273976585, 'weight_decay': 2.2497366743441823e-07, 'epochs': 204, 'loss': 'mse', 'optimizer': 'adam', 'graph_mode': 'cutoff', 'cutoff': 0.42952916307918765, 'grm_norm': 'cosine', 'self_loops': False, 'use_snp_selection': True, 'num_snps': 26705, 'graphsage_batch_size': 128}. Best is trial 43 with value: 0.2714390357744548.
[I 2025-12-05 16:16:53,494] Trial 78 finished with value: 0.2680565499478485 and parameters: {'model_type': 'graphsage', 'hidden_dims': '[256, 128]', 'dropout': 0.5488411100358457, 'batch_norm': True, 'sage_aggr': 'mean', 'sage_normalize': True, 'sage_project': False, 'lr': 0.0005406730361370165, 'weight_decay': 4.7666367795408074e-07, 'epochs': 220, 'loss': 'mse', 'optimizer': 'adam', 'graph_mode': 'cutoff', 'cutoff': 0.3019800175992755, 'grm_norm': 'gcn', 'self_loops': False, 'use_snp_selection': True, 'num_snps': 24965, 'graphsage_batch_size': 8}. Best is trial 43 with value: 0.2714390357744548.
[I 2025-12-05 16:19:08,415] Trial 79 finished with value: 0.2274411537553787 and parameters: {'model_type': 'graphsage', 'hidden_dims': '[256, 128]', 'dropout': 0.5489697463442094, 'batch_norm': False, 'sage_aggr': 'mean', 'sage_normalize': True, 'sage_project': False, 'lr': 0.00023781922488277362, 'weight_decay': 5.493555456720785e-07, 'epochs': 235, 'loss': 'mse', 'optimizer': 'adam', 'graph_mode': 'cutoff', 'cutoff': 0.27180077764762833, 'grm_norm': 'gcn', 'self_loops': False, 'use_snp_selection': True, 'num_snps': 31835, 'graphsage_batch_size': 8}. Best is trial 43 with value: 0.2714390357744548.
[I 2025-12-05 16:20:57,197] Trial 80 finished with value: 0.24244197588964625 and parameters: {'model_type': 'graphsage', 'hidden_dims': '[256, 128]', 'dropout': 0.24019819533173242, 'batch_norm': True, 'sage_aggr': 'mean', 'sage_normalize': False, 'sage_project': False, 'lr': 0.0005322859730794725, 'weight_decay': 1.1202426554331915e-07, 'epochs': 221, 'loss': 'mse', 'optimizer': 'adam', 'graph_mode': 'cutoff', 'cutoff': 0.22414174205460827, 'grm_norm': 'gcn', 'self_loops': False, 'use_snp_selection': True, 'num_snps': 24220, 'graphsage_batch_size': 8}. Best is trial 43 with value: 0.2714390357744548.
[I 2025-12-05 16:21:42,466] Trial 81 finished with value: 0.26541726735851395 and parameters: {'model_type': 'graphsage', 'hidden_dims': '[128, 64]', 'dropout': 0.5650264263726772, 'batch_norm': True, 'sage_aggr': 'mean', 'sage_normalize': True, 'sage_project': False, 'lr': 0.0006416713798626721, 'weight_decay': 4.4495810736352986e-07, 'epochs': 212, 'loss': 'mse', 'optimizer': 'adam', 'graph_mode': 'cutoff', 'cutoff': 0.40035923290494635, 'grm_norm': 'gcn', 'self_loops': False, 'use_snp_selection': True, 'num_snps': 22372, 'graphsage_batch_size': 8}. Best is trial 43 with value: 0.2714390357744548.
[I 2025-12-05 16:22:48,307] Trial 82 finished with value: 0.2550538597729436 and parameters: {'model_type': 'graphsage', 'hidden_dims': '[256, 128]', 'dropout': 0.5269710332288555, 'batch_norm': True, 'sage_aggr': 'mean', 'sage_normalize': True, 'sage_project': False, 'lr': 0.00039665055941034576, 'weight_decay': 6.649531875322161e-07, 'epochs': 242, 'loss': 'mse', 'optimizer': 'adam', 'graph_mode': 'cutoff', 'cutoff': 0.30196852433427873, 'grm_norm': 'gcn', 'self_loops': False, 'use_snp_selection': True, 'num_snps': 20010, 'graphsage_batch_size': 8}. Best is trial 43 with value: 0.2714390357744548.
[I 2025-12-05 16:23:59,349] Trial 83 finished with value: 0.2619448969989901 and parameters: {'model_type': 'graphsage', 'hidden_dims': '[256, 128]', 'dropout': 0.5735377430073363, 'batch_norm': True, 'sage_aggr': 'mean', 'sage_normalize': True, 'sage_project': False, 'lr': 0.0004980346240395059, 'weight_decay': 2.6689672086874325e-07, 'epochs': 205, 'loss': 'mse', 'optimizer': 'adam', 'graph_mode': 'cutoff', 'cutoff': 0.3722078297290957, 'grm_norm': 'gcn', 'self_loops': False, 'use_snp_selection': True, 'num_snps': 28189, 'graphsage_batch_size': 256}. Best is trial 43 with value: 0.2714390357744548.
[I 2025-12-05 16:24:55,083] Trial 84 finished with value: 0.25428105107338456 and parameters: {'model_type': 'graphsage', 'hidden_dims': '[512, 128]', 'dropout': 0.4986021766947591, 'batch_norm': True, 'sage_aggr': 'mean', 'sage_normalize': True, 'sage_project': False, 'lr': 0.0008539921944779555, 'weight_decay': 1.123621716501863e-06, 'epochs': 196, 'loss': 'mse', 'optimizer': 'adam', 'graph_mode': 'cutoff', 'cutoff': 0.4743149581141327, 'grm_norm': 'gcn', 'self_loops': False, 'use_snp_selection': True, 'num_snps': 17522, 'graphsage_batch_size': 32}. Best is trial 43 with value: 0.2714390357744548.
[I 2025-12-05 16:25:46,385] Trial 85 finished with value: 0.25413211824864784 and parameters: {'model_type': 'graphsage', 'hidden_dims': '[256, 128, 64]', 'dropout': 0.5926178817610471, 'batch_norm': True, 'sage_aggr': 'mean', 'sage_normalize': True, 'sage_project': False, 'lr': 0.000298196536011083, 'weight_decay': 1.557170215434959e-07, 'epochs': 225, 'loss': 'mse', 'optimizer': 'adam', 'graph_mode': 'cutoff', 'cutoff': 0.6010998023295916, 'grm_norm': 'gcn', 'self_loops': False, 'use_snp_selection': True, 'num_snps': 25168, 'graphsage_batch_size': 16}. Best is trial 43 with value: 0.2714390357744548.
[I 2025-12-05 16:26:32,735] Trial 86 finished with value: 0.25168134480702575 and parameters: {'model_type': 'graphsage', 'hidden_dims': '[512, 256]', 'dropout': 0.5497334187478512, 'batch_norm': True, 'sage_aggr': 'mean', 'sage_normalize': True, 'sage_project': False, 'lr': 0.0007142509698905206, 'weight_decay': 3.603365772928219e-07, 'epochs': 217, 'loss': 'mae', 'optimizer': 'adam', 'graph_mode': 'cutoff', 'cutoff': 0.45499599917058137, 'grm_norm': 'cosine', 'self_loops': False, 'use_snp_selection': True, 'num_snps': 11779, 'graphsage_batch_size': 64}. Best is trial 43 with value: 0.2714390357744548.
[I 2025-12-05 16:29:34,969] Trial 87 finished with value: 0.2272723528930948 and parameters: {'model_type': 'graphsage', 'hidden_dims': '[256, 128]', 'dropout': 0.4781288695335462, 'batch_norm': True, 'sage_aggr': 'max', 'sage_normalize': True, 'sage_project': False, 'lr': 0.0005635840652547972, 'weight_decay': 2.0477570961591814e-07, 'epochs': 181, 'loss': 'mae', 'optimizer': 'adam', 'graph_mode': 'cutoff', 'cutoff': 0.3359288825959914, 'grm_norm': 'gcn', 'self_loops': False, 'use_snp_selection': True, 'num_snps': 59595, 'graphsage_batch_size': 64}. Best is trial 43 with value: 0.2714390357744548.
[I 2025-12-05 16:30:51,723] Trial 88 finished with value: 0.19831212174144827 and parameters: {'model_type': 'graphsage', 'hidden_dims': '[512, 256]', 'dropout': 0.525354118412, 'batch_norm': True, 'sage_aggr': 'mean', 'sage_normalize': True, 'sage_project': False, 'lr': 0.00018166454973072272, 'weight_decay': 1.3917188232541661e-06, 'epochs': 114, 'loss': 'mse', 'optimizer': 'adam', 'graph_mode': 'knn', 'knn_k': 2, 'weighted_edges': False, 'symmetrize_mode': 'mutual', 'self_loops': False, 'use_snp_selection': False, 'graphsage_batch_size': 64}. Best is trial 43 with value: 0.2714390357744548.
[I 2025-12-05 16:31:59,040] Trial 89 finished with value: 0.24019552761962276 and parameters: {'model_type': 'graphsage', 'hidden_dims': '[512, 64]', 'dropout': 0.5784943647658409, 'batch_norm': True, 'sage_aggr': 'mean', 'sage_normalize': True, 'sage_project': False, 'lr': 0.0008630338927816754, 'weight_decay': 4.725691935791228e-07, 'epochs': 188, 'loss': 'mae', 'optimizer': 'adam', 'graph_mode': 'cutoff', 'cutoff': 0.5403520735369017, 'grm_norm': 'gcn', 'self_loops': False, 'use_snp_selection': True, 'num_snps': 26557, 'graphsage_batch_size': 512}. Best is trial 43 with value: 0.2714390357744548.
[I 2025-12-05 16:32:58,995] Trial 90 finished with value: 0.23179488379708774 and parameters: {'model_type': 'graphsage', 'hidden_dims': '[512, 256]', 'dropout': 0.37101916030273163, 'batch_norm': False, 'sage_aggr': 'mean', 'sage_normalize': True, 'sage_project': False, 'lr': 0.0003501844165342277, 'weight_decay': 8.659212752222163e-07, 'epochs': 200, 'loss': 'mae', 'optimizer': 'adam', 'graph_mode': 'cutoff', 'cutoff': 0.5059031487469536, 'grm_norm': 'gcn', 'self_loops': False, 'use_snp_selection': True, 'num_snps': 20568, 'graphsage_batch_size': 8}. Best is trial 43 with value: 0.2714390357744548.
[I 2025-12-05 16:33:43,692] Trial 91 finished with value: 0.2622834934292277 and parameters: {'model_type': 'graphsage', 'hidden_dims': '[128, 64]', 'dropout': 0.5602517707606968, 'batch_norm': True, 'sage_aggr': 'mean', 'sage_normalize': True, 'sage_project': False, 'lr': 0.0006501836607172276, 'weight_decay': 4.242556117071434e-07, 'epochs': 212, 'loss': 'mse', 'optimizer': 'adam', 'graph_mode': 'cutoff', 'cutoff': 0.40029518830333793, 'grm_norm': 'gcn', 'self_loops': False, 'use_snp_selection': True, 'num_snps': 22464, 'graphsage_batch_size': 8}. Best is trial 43 with value: 0.2714390357744548.
[I 2025-12-05 16:34:29,522] Trial 92 finished with value: 0.2522447140153415 and parameters: {'model_type': 'graphsage', 'hidden_dims': '[128, 64]', 'dropout': 0.5659223630447168, 'batch_norm': True, 'sage_aggr': 'mean', 'sage_normalize': True, 'sage_project': False, 'lr': 3.913369951356574e-05, 'weight_decay': 6.934132486373705e-07, 'epochs': 214, 'loss': 'mse', 'optimizer': 'adam', 'graph_mode': 'cutoff', 'cutoff': 0.41778481876202134, 'grm_norm': 'gcn', 'self_loops': False, 'use_snp_selection': True, 'num_snps': 22954, 'graphsage_batch_size': 8}. Best is trial 43 with value: 0.2714390357744548.
[I 2025-12-05 16:35:17,229] Trial 93 finished with value: 0.26770097985248636 and parameters: {'model_type': 'graphsage', 'hidden_dims': '[128, 64]', 'dropout': 0.5416233203564352, 'batch_norm': True, 'sage_aggr': 'mean', 'sage_normalize': True, 'sage_project': False, 'lr': 0.0004507363366548879, 'weight_decay': 3.2149315543405125e-07, 'epochs': 208, 'loss': 'mse', 'optimizer': 'adam', 'graph_mode': 'cutoff', 'cutoff': 0.4364826618312362, 'grm_norm': 'gcn', 'self_loops': False, 'use_snp_selection': True, 'num_snps': 24824, 'graphsage_batch_size': 8}. Best is trial 43 with value: 0.2714390357744548.
[I 2025-12-05 16:36:12,067] Trial 94 finished with value: 0.261847100397377 and parameters: {'model_type': 'graphsage', 'hidden_dims': '[128, 64]', 'dropout': 0.5111599613431732, 'batch_norm': True, 'sage_aggr': 'mean', 'sage_normalize': True, 'sage_project': False, 'lr': 0.0004735696982500482, 'weight_decay': 2.9642377011689576e-07, 'epochs': 195, 'loss': 'mse', 'optimizer': 'adam', 'graph_mode': 'cutoff', 'cutoff': 0.4443763649953123, 'grm_norm': 'gcn', 'self_loops': False, 'use_snp_selection': True, 'num_snps': 29548, 'graphsage_batch_size': 8}. Best is trial 43 with value: 0.2714390357744548.
[I 2025-12-05 16:36:57,113] Trial 95 finished with value: 0.2591216314617682 and parameters: {'model_type': 'graphsage', 'hidden_dims': '[128, 64]', 'dropout': 0.5353946353521984, 'batch_norm': True, 'sage_aggr': 'mean', 'sage_normalize': True, 'sage_project': False, 'lr': 0.00040856193178798005, 'weight_decay': 2.3858684749318215e-07, 'epochs': 207, 'loss': 'mse', 'optimizer': 'adam', 'graph_mode': 'cutoff', 'cutoff': 0.4839029202785518, 'grm_norm': 'gcn', 'self_loops': False, 'use_snp_selection': True, 'num_snps': 25100, 'graphsage_batch_size': 64}. Best is trial 43 with value: 0.2714390357744548.
[I 2025-12-05 16:37:43,620] Trial 96 finished with value: 0.24982665126180978 and parameters: {'model_type': 'graphsage', 'hidden_dims': '[512, 256]', 'dropout': 0.16440722404339408, 'batch_norm': True, 'sage_aggr': 'mean', 'sage_normalize': True, 'sage_project': False, 'lr': 0.0008886204464533151, 'weight_decay': 1.2415469567593088e-07, 'epochs': 176, 'loss': 'mae', 'optimizer': 'adam', 'graph_mode': 'cutoff', 'cutoff': 0.42876273807649284, 'grm_norm': 'none', 'self_loops': False, 'use_snp_selection': True, 'num_snps': 14356, 'graphsage_batch_size': 64}. Best is trial 43 with value: 0.2714390357744548.
[I 2025-12-05 16:38:41,531] Trial 97 finished with value: 0.2564332635644173 and parameters: {'model_type': 'graphsage', 'hidden_dims': '[512, 256]', 'dropout': 0.5465246109835857, 'batch_norm': True, 'sage_aggr': 'mean', 'sage_normalize': True, 'sage_project': False, 'lr': 0.0007100254112959985, 'weight_decay': 5.836212543223806e-07, 'epochs': 202, 'loss': 'mse', 'optimizer': 'adam', 'graph_mode': 'cutoff', 'cutoff': 0.37271491206556456, 'grm_norm': 'cosine', 'self_loops': False, 'use_snp_selection': True, 'num_snps': 17038, 'graphsage_batch_size': 128}. Best is trial 43 with value: 0.2714390357744548.
[I 2025-12-05 16:39:44,501] Trial 98 finished with value: 0.26138216887835464 and parameters: {'model_type': 'graphsage', 'hidden_dims': '[512, 128]', 'dropout': 0.5910009209204198, 'batch_norm': True, 'sage_aggr': 'mean', 'sage_normalize': False, 'sage_project': False, 'lr': 0.000521442580090507, 'weight_decay': 2.1609141627744615e-06, 'epochs': 222, 'loss': 'mae', 'optimizer': 'adam', 'graph_mode': 'cutoff', 'cutoff': 0.4641312705483427, 'grm_norm': 'gcn', 'self_loops': False, 'use_snp_selection': True, 'num_snps': 18688, 'graphsage_batch_size': 32}. Best is trial 43 with value: 0.2714390357744548.
[I 2025-12-05 16:41:09,384] Trial 99 finished with value: 0.24132932799901555 and parameters: {'model_type': 'graphsage', 'hidden_dims': '[128, 64]', 'dropout': 0.5163626673640248, 'batch_norm': True, 'sage_aggr': 'max', 'sage_normalize': True, 'sage_project': False, 'lr': 0.000598185051982964, 'weight_decay': 1.5351337943935065e-07, 'epochs': 150, 'loss': 'mae', 'optimizer': 'adam', 'graph_mode': 'cutoff', 'cutoff': 0.4160359984749531, 'grm_norm': 'gcn', 'self_loops': False, 'use_snp_selection': True, 'num_snps': 46969, 'graphsage_batch_size': 64}. Best is trial 43 with value: 0.2714390357744548.
[I 2025-12-05 16:41:52,442] Trial 100 finished with value: 0.23983986274176253 and parameters: {'model_type': 'graphsage', 'hidden_dims': '[512, 256]', 'dropout': 0.5578459398289701, 'batch_norm': True, 'sage_aggr': 'mean', 'sage_normalize': True, 'sage_project': False, 'lr': 0.0003197439076293241, 'weight_decay': 1.1823941885835752e-06, 'epochs': 87, 'loss': 'mae', 'optimizer': 'adam', 'graph_mode': 'knn', 'knn_k': 4, 'weighted_edges': True, 'symmetrize_mode': 'union', 'self_loops': False, 'use_snp_selection': True, 'num_snps': 20771, 'graphsage_batch_size': 64}. Best is trial 43 with value: 0.2714390357744548.
[I 2025-12-05 16:42:38,162] Trial 101 finished with value: 0.2642266251339398 and parameters: {'model_type': 'graphsage', 'hidden_dims': '[128, 64]', 'dropout': 0.564728945557932, 'batch_norm': True, 'sage_aggr': 'mean', 'sage_normalize': True, 'sage_project': False, 'lr': 0.0006467959728660262, 'weight_decay': 3.932301614822871e-07, 'epochs': 212, 'loss': 'mse', 'optimizer': 'adam', 'graph_mode': 'cutoff', 'cutoff': 0.3894211527182414, 'grm_norm': 'gcn', 'self_loops': False, 'use_snp_selection': True, 'num_snps': 22273, 'graphsage_batch_size': 8}. Best is trial 43 with value: 0.2714390357744548.
[I 2025-12-05 16:43:21,767] Trial 102 finished with value: 0.2734579670807161 and parameters: {'model_type': 'graphsage', 'hidden_dims': '[128, 64]', 'dropout': 0.5807524707096084, 'batch_norm': True, 'sage_aggr': 'mean', 'sage_normalize': True, 'sage_project': False, 'lr': 0.0008498913337441585, 'weight_decay': 4.865141311267153e-07, 'epochs': 191, 'loss': 'mse', 'optimizer': 'adam', 'graph_mode': 'cutoff', 'cutoff': 0.4458591516949867, 'grm_norm': 'gcn', 'self_loops': False, 'use_snp_selection': True, 'num_snps': 24332, 'graphsage_batch_size': 8}. Best is trial 102 with value: 0.2734579670807161.
[I 2025-12-05 16:44:06,250] Trial 103 finished with value: 0.25846315092278205 and parameters: {'model_type': 'graphsage', 'hidden_dims': '[128, 64]', 'dropout': 0.5815275614149995, 'batch_norm': True, 'sage_aggr': 'mean', 'sage_normalize': True, 'sage_project': False, 'lr': 0.0008691414375154157, 'weight_decay': 3.200026634448965e-07, 'epochs': 191, 'loss': 'mse', 'optimizer': 'adam', 'graph_mode': 'cutoff', 'cutoff': 0.4898854856747072, 'grm_norm': 'gcn', 'self_loops': False, 'use_snp_selection': True, 'num_snps': 26997, 'graphsage_batch_size': 8}. Best is trial 102 with value: 0.2734579670807161.
[I 2025-12-05 16:44:50,590] Trial 104 finished with value: 0.26337337528368276 and parameters: {'model_type': 'graphsage', 'hidden_dims': '[128, 64]', 'dropout': 0.5408448954993433, 'batch_norm': True, 'sage_aggr': 'mean', 'sage_normalize': True, 'sage_project': False, 'lr': 0.0007545186546267057, 'weight_decay': 5.171421771525788e-07, 'epochs': 186, 'loss': 'mse', 'optimizer': 'adam', 'graph_mode': 'cutoff', 'cutoff': 0.44380244655692747, 'grm_norm': 'gcn', 'self_loops': False, 'use_snp_selection': True, 'num_snps': 25045, 'graphsage_batch_size': 8}. Best is trial 102 with value: 0.2734579670807161.
[I 2025-12-05 16:45:37,791] Trial 105 finished with value: 0.24246778870616423 and parameters: {'model_type': 'graphsage', 'hidden_dims': '[256, 128, 64]', 'dropout': 0.5966790057356801, 'batch_norm': True, 'sage_aggr': 'mean', 'sage_normalize': True, 'sage_project': False, 'lr': 0.0009701774561592346, 'weight_decay': 1.8860054181484309e-07, 'epochs': 196, 'loss': 'mse', 'optimizer': 'adam', 'graph_mode': 'cutoff', 'cutoff': 0.5188804581441532, 'grm_norm': 'gcn', 'self_loops': False, 'use_snp_selection': True, 'num_snps': 24117, 'graphsage_batch_size': 8}. Best is trial 102 with value: 0.2734579670807161.
