[I 2025-12-08 11:39:37,536] Trial 76 finished with value: 0.30050331285699966 and parameters: {'model_type': 'graphsage', 'hidden_dims': '[512, 128]', 'dropout': 0.48515458201930917, 'batch_norm': True, 'sage_aggr': 'max', 'sage_normalize': True, 'sage_project': False, 'lr': 0.00012695825275171318, 'weight_decay': 2.511538044755908e-05, 'epochs': 100, 'loss': 'mse', 'optimizer': 'adam', 'graph_mode': 'cutoff', 'cutoff': 0.813173178076229, 'grm_norm': 'gcn', 'self_loops': True, 'use_snp_selection': False}. Best is trial 75 with value: 0.3128906257260532.
[I 2025-12-08 11:40:14,348] Trial 77 finished with value: 0.30692423412868497 and parameters: {'model_type': 'graphsage', 'hidden_dims': '[512, 128]', 'dropout': 0.5956778663020293, 'batch_norm': True, 'sage_aggr': 'max', 'sage_normalize': True, 'sage_project': False, 'lr': 0.008209421999067539, 'weight_decay': 5.382971700457722e-05, 'epochs': 63, 'loss': 'mse', 'optimizer': 'adam', 'graph_mode': 'cutoff', 'cutoff': 0.862661572908325, 'grm_norm': 'gcn', 'self_loops': True, 'use_snp_selection': False}. Best is trial 75 with value: 0.3128906257260532.
[I 2025-12-08 11:40:49,108] Trial 78 finished with value: 0.3043025824618443 and parameters: {'model_type': 'graphsage', 'hidden_dims': '[512, 128]', 'dropout': 0.5934304596803652, 'batch_norm': True, 'sage_aggr': 'max', 'sage_normalize': True, 'sage_project': False, 'lr': 0.008003125605435299, 'weight_decay': 6.826533780397115e-05, 'epochs': 58, 'loss': 'mse', 'optimizer': 'adam', 'graph_mode': 'cutoff', 'cutoff': 0.7946405271355438, 'grm_norm': 'gcn', 'self_loops': True, 'use_snp_selection': False}. Best is trial 75 with value: 0.3128906257260532.
[I 2025-12-08 11:41:29,319] Trial 79 finished with value: 0.30295956044635675 and parameters: {'model_type': 'graphsage', 'hidden_dims': '[512, 128]', 'dropout': 0.5629060465172312, 'batch_norm': True, 'sage_aggr': 'max', 'sage_normalize': True, 'sage_project': False, 'lr': 0.00797283895510957, 'weight_decay': 4.23683603726803e-05, 'epochs': 72, 'loss': 'mse', 'optimizer': 'adam', 'graph_mode': 'cutoff', 'cutoff': 0.8498833261804273, 'grm_norm': 'gcn', 'self_loops': True, 'use_snp_selection': False}. Best is trial 75 with value: 0.3128906257260532.
[I 2025-12-08 11:42:13,494] Trial 80 finished with value: 0.2765570492960415 and parameters: {'model_type': 'graphsage', 'hidden_dims': '[512, 128]', 'dropout': 0.5857795230100918, 'batch_norm': False, 'sage_aggr': 'max', 'sage_normalize': True, 'sage_project': False, 'lr': 0.0031348143235915144, 'weight_decay': 1.2883735594037802e-05, 'epochs': 82, 'loss': 'mse', 'optimizer': 'adam', 'graph_mode': 'cutoff', 'cutoff': 0.7270584988185024, 'grm_norm': 'gcn', 'self_loops': True, 'use_snp_selection': False}. Best is trial 75 with value: 0.3128906257260532.
[I 2025-12-08 11:42:44,789] Trial 81 finished with value: 0.2944512882359347 and parameters: {'model_type': 'graphsage', 'hidden_dims': '[512, 128]', 'dropout': 0.5035547800857888, 'batch_norm': True, 'sage_aggr': 'max', 'sage_normalize': True, 'sage_project': False, 'lr': 0.0097992389136901, 'weight_decay': 2.568272239576985e-05, 'epochs': 49, 'loss': 'mse', 'optimizer': 'adam', 'graph_mode': 'cutoff', 'cutoff': 0.7700297045755609, 'grm_norm': 'gcn', 'self_loops': True, 'use_snp_selection': False}. Best is trial 75 with value: 0.3128906257260532.
[I 2025-12-08 11:43:33,087] Trial 82 finished with value: 0.29994663751994743 and parameters: {'model_type': 'graphsage', 'hidden_dims': '[512, 64]', 'dropout': 0.2827183648618533, 'batch_norm': True, 'sage_aggr': 'max', 'sage_normalize': True, 'sage_project': False, 'lr': 0.00552564320874933, 'weight_decay': 9.043227983605692e-05, 'epochs': 93, 'loss': 'mse', 'optimizer': 'adam', 'graph_mode': 'cutoff', 'cutoff': 0.8744220436443405, 'grm_norm': 'gcn', 'self_loops': True, 'use_snp_selection': False}. Best is trial 75 with value: 0.3128906257260532.
[I 2025-12-08 11:43:56,565] Trial 83 finished with value: 0.2994665861332217 and parameters: {'model_type': 'graphsage', 'hidden_dims': '[256, 128]', 'dropout': 0.5474516075247066, 'batch_norm': True, 'sage_aggr': 'max', 'sage_normalize': True, 'sage_project': False, 'lr': 0.0066641894827316195, 'weight_decay': 4.679388905133885e-05, 'epochs': 62, 'loss': 'mse', 'optimizer': 'adam', 'graph_mode': 'cutoff', 'cutoff': 0.8294897024839806, 'grm_norm': 'gcn', 'self_loops': True, 'use_snp_selection': False}. Best is trial 75 with value: 0.3128906257260532.
[I 2025-12-08 11:44:27,018] Trial 84 finished with value: 0.2951539641349573 and parameters: {'model_type': 'graphsage', 'hidden_dims': '[512, 128]', 'dropout': 0.4309569106401628, 'batch_norm': True, 'sage_aggr': 'max', 'sage_normalize': True, 'sage_project': False, 'lr': 0.004564258978188426, 'weight_decay': 0.00010212815794876958, 'epochs': 47, 'loss': 'mse', 'optimizer': 'adam', 'graph_mode': 'cutoff', 'cutoff': 0.8661737245400946, 'grm_norm': 'gcn', 'self_loops': True, 'use_snp_selection': False}. Best is trial 75 with value: 0.3128906257260532.
[I 2025-12-08 11:44:55,150] Trial 85 finished with value: 0.29889308721562136 and parameters: {'model_type': 'graphsage', 'hidden_dims': '[256, 128, 64]', 'dropout': 0.5959420443637286, 'batch_norm': True, 'sage_aggr': 'max', 'sage_normalize': True, 'sage_project': False, 'lr': 0.007882944261564447, 'weight_decay': 3.6012930550176548e-06, 'epochs': 83, 'loss': 'mse', 'optimizer': 'adam', 'graph_mode': 'cutoff', 'cutoff': 0.8107254272711263, 'grm_norm': 'gcn', 'self_loops': True, 'use_snp_selection': False}. Best is trial 75 with value: 0.3128906257260532.
[I 2025-12-08 11:45:35,552] Trial 86 finished with value: 0.3075942491275211 and parameters: {'model_type': 'graphsage', 'hidden_dims': '[512, 128]', 'dropout': 0.571100526562723, 'batch_norm': True, 'sage_aggr': 'max', 'sage_normalize': True, 'sage_project': False, 'lr': 0.005704313345644951, 'weight_decay': 2.8800944844425967e-05, 'epochs': 72, 'loss': 'mse', 'optimizer': 'adam', 'graph_mode': 'cutoff', 'cutoff': 0.7819984811683875, 'grm_norm': 'gcn', 'self_loops': True, 'use_snp_selection': False}. Best is trial 75 with value: 0.3128906257260532.
[I 2025-12-08 11:46:15,806] Trial 87 finished with value: 0.30271035376188404 and parameters: {'model_type': 'graphsage', 'hidden_dims': '[512, 128]', 'dropout': 0.5691732682675058, 'batch_norm': True, 'sage_aggr': 'max', 'sage_normalize': True, 'sage_project': False, 'lr': 0.0057808861134483564, 'weight_decay': 5.448148680941449e-05, 'epochs': 72, 'loss': 'mse', 'optimizer': 'adam', 'graph_mode': 'cutoff', 'cutoff': 0.7784256117831327, 'grm_norm': 'gcn', 'self_loops': True, 'use_snp_selection': False}. Best is trial 75 with value: 0.3128906257260532.
[I 2025-12-08 11:46:50,757] Trial 88 finished with value: 0.3050274119435968 and parameters: {'model_type': 'graphsage', 'hidden_dims': '[512, 128]', 'dropout': 0.5551901009677511, 'batch_norm': True, 'sage_aggr': 'mean', 'sage_normalize': True, 'sage_project': False, 'lr': 0.008609094438802228, 'weight_decay': 3.0052503240284642e-05, 'epochs': 58, 'loss': 'mse', 'optimizer': 'adam', 'graph_mode': 'cutoff', 'cutoff': 0.7484635484445151, 'grm_norm': 'gcn', 'self_loops': True, 'use_snp_selection': False}. Best is trial 75 with value: 0.3128906257260532.
[I 2025-12-08 11:47:28,255] Trial 89 finished with value: 0.31323712514652646 and parameters: {'model_type': 'graphsage', 'hidden_dims': '[512, 128]', 'dropout': 0.5803556783217604, 'batch_norm': True, 'sage_aggr': 'max', 'sage_normalize': True, 'sage_project': False, 'lr': 0.0068008003964908055, 'weight_decay': 1.5937781521944738e-05, 'epochs': 65, 'loss': 'mse', 'optimizer': 'adam', 'graph_mode': 'cutoff', 'cutoff': 0.8295966236352704, 'grm_norm': 'gcn', 'self_loops': True, 'use_snp_selection': False}. Best is trial 89 with value: 0.31323712514652646.
[I 2025-12-08 11:47:56,121] Trial 90 finished with value: 0.29762537813532247 and parameters: {'model_type': 'graphsage', 'hidden_dims': '[512, 128]', 'dropout': 0.5816416342014606, 'batch_norm': True, 'sage_aggr': 'max', 'sage_normalize': True, 'sage_project': False, 'lr': 0.0030909391036215025, 'weight_decay': 1.8837143690596303e-05, 'epochs': 40, 'loss': 'mse', 'optimizer': 'adam', 'graph_mode': 'cutoff', 'cutoff': 0.8392748171739233, 'grm_norm': 'gcn', 'self_loops': True, 'use_snp_selection': False}. Best is trial 89 with value: 0.31323712514652646.
[I 2025-12-08 11:48:34,453] Trial 91 finished with value: 0.3059047007346489 and parameters: {'model_type': 'graphsage', 'hidden_dims': '[512, 128]', 'dropout': 0.5326537277056719, 'batch_norm': True, 'sage_aggr': 'max', 'sage_normalize': True, 'sage_project': False, 'lr': 0.006270157105513426, 'weight_decay': 2.016812102847413e-05, 'epochs': 67, 'loss': 'mse', 'optimizer': 'adam', 'graph_mode': 'cutoff', 'cutoff': 0.7167226548505519, 'grm_norm': 'gcn', 'self_loops': True, 'use_snp_selection': False}. Best is trial 89 with value: 0.31323712514652646.
[I 2025-12-08 11:49:06,550] Trial 92 finished with value: 0.2985189407623239 and parameters: {'model_type': 'graphsage', 'hidden_dims': '[512, 128]', 'dropout': 0.5109283939037528, 'batch_norm': True, 'sage_aggr': 'max', 'sage_normalize': True, 'sage_project': False, 'lr': 0.007118129824925424, 'weight_decay': 3.754712375058106e-05, 'epochs': 51, 'loss': 'mse', 'optimizer': 'adam', 'graph_mode': 'cutoff', 'cutoff': 0.816709570974721, 'grm_norm': 'gcn', 'self_loops': True, 'use_snp_selection': False}. Best is trial 89 with value: 0.31323712514652646.
[I 2025-12-08 11:49:50,383] Trial 93 finished with value: 0.3019762052558344 and parameters: {'model_type': 'graphsage', 'hidden_dims': '[512, 128]', 'dropout': 0.5983107892729815, 'batch_norm': True, 'sage_aggr': 'max', 'sage_normalize': True, 'sage_project': False, 'lr': 0.009933259334792915, 'weight_decay': 1.3274488568517757e-05, 'epochs': 81, 'loss': 'mse', 'optimizer': 'adam', 'graph_mode': 'cutoff', 'cutoff': 0.68747114436881, 'grm_norm': 'gcn', 'self_loops': True, 'use_snp_selection': False}. Best is trial 89 with value: 0.31323712514652646.
[I 2025-12-08 11:50:25,950] Trial 94 finished with value: 0.3048235495354311 and parameters: {'model_type': 'graphsage', 'hidden_dims': '[512, 128]', 'dropout': 0.5604222684060981, 'batch_norm': True, 'sage_aggr': 'max', 'sage_normalize': True, 'sage_project': False, 'lr': 0.004822995149434666, 'weight_decay': 1.2589386986058738e-05, 'epochs': 60, 'loss': 'mse', 'optimizer': 'adam', 'graph_mode': 'cutoff', 'cutoff': 0.7901516086893268, 'grm_norm': 'gcn', 'self_loops': True, 'use_snp_selection': False}. Best is trial 89 with value: 0.31323712514652646.
[I 2025-12-08 11:51:15,486] Trial 95 finished with value: 0.2981807863784944 and parameters: {'model_type': 'graphsage', 'hidden_dims': '[512, 128]', 'dropout': 0.5774750619452816, 'batch_norm': True, 'sage_aggr': 'max', 'sage_normalize': True, 'sage_project': False, 'lr': 0.00545343314253257, 'weight_decay': 0.0001257251650942743, 'epochs': 95, 'loss': 'mse', 'optimizer': 'adam', 'graph_mode': 'cutoff', 'cutoff': 0.6581073466558941, 'grm_norm': 'gcn', 'self_loops': True, 'use_snp_selection': False}. Best is trial 89 with value: 0.31323712514652646.
[I 2025-12-08 11:51:35,713] Trial 96 finished with value: 0.3060928517844849 and parameters: {'model_type': 'graphsage', 'hidden_dims': '[128, 64]', 'dropout': 0.5400286085639536, 'batch_norm': True, 'sage_aggr': 'max', 'sage_normalize': True, 'sage_project': False, 'lr': 0.007036166658160545, 'weight_decay': 8.350175396676175e-06, 'epochs': 76, 'loss': 'mse', 'optimizer': 'adam', 'graph_mode': 'cutoff', 'cutoff': 0.7590937370559192, 'grm_norm': 'cosine_then_gcn', 'self_loops': True, 'use_snp_selection': False}. Best is trial 89 with value: 0.31323712514652646.
[I 2025-12-08 11:52:22,213] Trial 97 finished with value: 0.30268669372052137 and parameters: {'model_type': 'graphsage', 'hidden_dims': '[512, 128]', 'dropout': 0.5711202365369735, 'batch_norm': True, 'sage_aggr': 'max', 'sage_normalize': True, 'sage_project': False, 'lr': 0.0039371979668166805, 'weight_decay': 5.4362420436481696e-05, 'epochs': 88, 'loss': 'mse', 'optimizer': 'adam', 'graph_mode': 'cutoff', 'cutoff': 0.8495613673323149, 'grm_norm': 'gcn', 'self_loops': True, 'use_snp_selection': False}. Best is trial 89 with value: 0.31323712514652646.
[I 2025-12-08 11:53:16,518] Trial 98 finished with value: 0.30076577576257923 and parameters: {'model_type': 'graphsage', 'hidden_dims': '[512, 128]', 'dropout': 0.5299189670630138, 'batch_norm': True, 'sage_aggr': 'max', 'sage_normalize': True, 'sage_project': False, 'lr': 4.144759422354746e-05, 'weight_decay': 6.699333679422088e-06, 'epochs': 108, 'loss': 'mse', 'optimizer': 'adam', 'graph_mode': 'cutoff', 'cutoff': 0.7191626432990958, 'grm_norm': 'none', 'self_loops': True, 'use_snp_selection': False}. Best is trial 89 with value: 0.31323712514652646.
[I 2025-12-08 11:53:54,390] Trial 99 finished with value: 0.25626915674300493 and parameters: {'model_type': 'graphsage', 'hidden_dims': '[512, 128]', 'dropout': 0.554922091229603, 'batch_norm': False, 'sage_aggr': 'max', 'sage_normalize': True, 'sage_project': False, 'lr': 0.008695872254662649, 'weight_decay': 3.017508150512824e-05, 'epochs': 66, 'loss': 'mse', 'optimizer': 'adam', 'graph_mode': 'cutoff', 'cutoff': 0.8023842322173562, 'grm_norm': 'gcn', 'self_loops': True, 'use_snp_selection': False}. Best is trial 89 with value: 0.31323712514652646.
[I 2025-12-08 11:54:34,079] Trial 100 finished with value: 0.28483227686480206 and parameters: {'model_type': 'graphsage', 'hidden_dims': '[512, 64]', 'dropout': 0.5164017238088442, 'batch_norm': True, 'sage_aggr': 'max', 'sage_normalize': False, 'sage_project': False, 'lr': 0.003436426803614354, 'weight_decay': 1.2244371134167413e-07, 'epochs': 54, 'loss': 'mse', 'optimizer': 'adam', 'graph_mode': 'cutoff', 'cutoff': 0.33771398935214175, 'grm_norm': 'gcn', 'self_loops': True, 'use_snp_selection': False}. Best is trial 89 with value: 0.31323712514652646.
[I 2025-12-08 11:54:54,055] Trial 101 finished with value: 0.299677859628363 and parameters: {'model_type': 'graphsage', 'hidden_dims': '[128, 64]', 'dropout': 0.5426344333672706, 'batch_norm': True, 'sage_aggr': 'max', 'sage_normalize': True, 'sage_project': False, 'lr': 0.007204481451188127, 'weight_decay': 1.585938304245702e-05, 'epochs': 74, 'loss': 'mse', 'optimizer': 'adam', 'graph_mode': 'cutoff', 'cutoff': 0.766926023614543, 'grm_norm': 'cosine_then_gcn', 'self_loops': True, 'use_snp_selection': False}. Best is trial 89 with value: 0.31323712514652646.
[I 2025-12-08 11:55:10,555] Trial 102 finished with value: 0.2957666948345194 and parameters: {'model_type': 'graphsage', 'hidden_dims': '[128, 64]', 'dropout': 0.5876816624005583, 'batch_norm': True, 'sage_aggr': 'max', 'sage_normalize': True, 'sage_project': False, 'lr': 0.006161310776311925, 'weight_decay': 8.60684854150534e-06, 'epochs': 47, 'loss': 'mse', 'optimizer': 'adam', 'graph_mode': 'cutoff', 'cutoff': 0.7627632279617316, 'grm_norm': 'cosine_then_gcn', 'self_loops': True, 'use_snp_selection': False}. Best is trial 89 with value: 0.31323712514652646.
[I 2025-12-08 11:55:30,649] Trial 103 finished with value: 0.305145141949661 and parameters: {'model_type': 'graphsage', 'hidden_dims': '[128, 64]', 'dropout': 0.5416497839730907, 'batch_norm': True, 'sage_aggr': 'max', 'sage_normalize': True, 'sage_project': False, 'lr': 0.004960606344992225, 'weight_decay': 2.3429411288370517e-05, 'epochs': 75, 'loss': 'mse', 'optimizer': 'adam', 'graph_mode': 'cutoff', 'cutoff': 0.7387454469802056, 'grm_norm': 'cosine_then_gcn', 'self_loops': True, 'use_snp_selection': False}. Best is trial 89 with value: 0.31323712514652646.
[I 2025-12-08 11:56:24,992] Trial 104 finished with value: 0.30643339707574263 and parameters: {'model_type': 'graphsage', 'hidden_dims': '[128, 64]', 'dropout': 0.5669670485151573, 'batch_norm': True, 'sage_aggr': 'max', 'sage_normalize': True, 'sage_project': False, 'lr': 0.008635407928338243, 'weight_decay': 4.991949057737709e-06, 'epochs': 339, 'loss': 'mse', 'optimizer': 'adam', 'graph_mode': 'cutoff', 'cutoff': 0.8853822172504805, 'grm_norm': 'cosine_then_gcn', 'self_loops': True, 'use_snp_selection': False}. Best is trial 89 with value: 0.31323712514652646.
[I 2025-12-08 11:57:14,676] Trial 105 finished with value: 0.29902411987090727 and parameters: {'model_type': 'graphsage', 'hidden_dims': '[128, 64]', 'dropout': 0.5675376441162452, 'batch_norm': True, 'sage_aggr': 'max', 'sage_normalize': True, 'sage_project': False, 'lr': 0.008620216455740346, 'weight_decay': 2.4632746995672545e-07, 'epochs': 310, 'loss': 'mse', 'optimizer': 'adam', 'graph_mode': 'cutoff', 'cutoff': 0.8829644007432611, 'grm_norm': 'gcn', 'self_loops': True, 'use_snp_selection': False}. Best is trial 89 with value: 0.31323712514652646.
[I 2025-12-08 11:58:37,732] Trial 106 finished with value: 0.3002380523302598 and parameters: {'model_type': 'graphsage', 'hidden_dims': '[256, 128, 64]', 'dropout': 0.5847291817773363, 'batch_norm': True, 'sage_aggr': 'mean', 'sage_normalize': False, 'sage_project': False, 'lr': 0.0042219746787343065, 'weight_decay': 5.398274022867195e-06, 'epochs': 333, 'loss': 'mse', 'optimizer': 'adam', 'graph_mode': 'cutoff', 'cutoff': 0.842052472457199, 'grm_norm': 'cosine_then_gcn', 'self_loops': True, 'use_snp_selection': False}. Best is trial 89 with value: 0.31323712514652646.
[I 2025-12-08 12:00:38,167] Trial 107 finished with value: 0.3043137143911154 and parameters: {'model_type': 'graphsage', 'hidden_dims': '[512, 128]', 'dropout': 0.5546783016132144, 'batch_norm': True, 'sage_aggr': 'max', 'sage_normalize': True, 'sage_project': False, 'lr': 0.000389044630232358, 'weight_decay': 4.2009636552059895e-07, 'epochs': 278, 'loss': 'mse', 'optimizer': 'adam', 'graph_mode': 'cutoff', 'cutoff': 0.8244120976931159, 'grm_norm': 'none', 'self_loops': True, 'use_snp_selection': False}. Best is trial 89 with value: 0.31323712514652646.
[I 2025-12-08 12:01:14,136] Trial 108 finished with value: 0.29964551965482417 and parameters: {'model_type': 'graphsage', 'hidden_dims': '[128, 64]', 'dropout': 0.5994476698015835, 'batch_norm': True, 'sage_aggr': 'max', 'sage_normalize': False, 'sage_project': False, 'lr': 0.008775059913642571, 'weight_decay': 2.6076826478227497e-06, 'epochs': 205, 'loss': 'mse', 'optimizer': 'adam', 'graph_mode': 'cutoff', 'cutoff': 0.8878611282633138, 'grm_norm': 'gcn', 'self_loops': True, 'use_snp_selection': False}. Best is trial 89 with value: 0.31323712514652646.
[I 2025-12-08 12:02:11,380] Trial 109 finished with value: 0.30092043343946806 and parameters: {'model_type': 'graphsage', 'hidden_dims': '[256, 128]', 'dropout': 0.18253661094081688, 'batch_norm': True, 'sage_aggr': 'max', 'sage_normalize': True, 'sage_project': False, 'lr': 0.007094507910496461, 'weight_decay': 1.8238209224382543e-06, 'epochs': 221, 'loss': 'mse', 'optimizer': 'adam', 'graph_mode': 'cutoff', 'cutoff': 0.8584532277424227, 'grm_norm': 'gcn', 'self_loops': True, 'use_snp_selection': False}. Best is trial 89 with value: 0.31323712514652646.
[I 2025-12-08 12:04:39,503] Trial 110 finished with value: 0.30421169326342146 and parameters: {'model_type': 'graphsage', 'hidden_dims': '[512, 128]', 'dropout': 0.4858663989672791, 'batch_norm': True, 'sage_aggr': 'max', 'sage_normalize': False, 'sage_project': False, 'lr': 0.005805763547511961, 'weight_decay': 1.1898960794825056e-06, 'epochs': 350, 'loss': 'mse', 'optimizer': 'adam', 'graph_mode': 'cutoff', 'cutoff': 0.8024490816763271, 'grm_norm': 'gcn', 'self_loops': True, 'use_snp_selection': False}. Best is trial 89 with value: 0.31323712514652646.
[I 2025-12-08 12:05:12,814] Trial 111 finished with value: 0.3083749164790829 and parameters: {'model_type': 'graphsage', 'hidden_dims': '[128, 64]', 'dropout': 0.5304013705888686, 'batch_norm': True, 'sage_aggr': 'max', 'sage_normalize': True, 'sage_project': False, 'lr': 0.007475339553438288, 'weight_decay': 1.0495221921164905e-05, 'epochs': 177, 'loss': 'mse', 'optimizer': 'adam', 'graph_mode': 'cutoff', 'cutoff': 0.7442604963833708, 'grm_norm': 'cosine_then_gcn', 'self_loops': True, 'use_snp_selection': False}. Best is trial 89 with value: 0.31323712514652646.
[I 2025-12-08 12:05:47,491] Trial 112 finished with value: 0.3047468084478633 and parameters: {'model_type': 'graphsage', 'hidden_dims': '[128, 64]', 'dropout': 0.525362488920794, 'batch_norm': True, 'sage_aggr': 'max', 'sage_normalize': True, 'sage_project': False, 'lr': 0.005069538470349926, 'weight_decay': 1.0966184164483271e-05, 'epochs': 187, 'loss': 'mse', 'optimizer': 'adam', 'graph_mode': 'cutoff', 'cutoff': 0.711877806534969, 'grm_norm': 'cosine_then_gcn', 'self_loops': True, 'use_snp_selection': False}. Best is trial 89 with value: 0.31323712514652646.
[I 2025-12-08 12:06:20,667] Trial 113 finished with value: 0.30493901381206484 and parameters: {'model_type': 'graphsage', 'hidden_dims': '[128, 64]', 'dropout': 0.5121083884111779, 'batch_norm': True, 'sage_aggr': 'max', 'sage_normalize': True, 'sage_project': False, 'lr': 0.0076326452227472984, 'weight_decay': 1.7730734529766177e-07, 'epochs': 176, 'loss': 'mse', 'optimizer': 'adam', 'graph_mode': 'cutoff', 'cutoff': 0.7427711007619046, 'grm_norm': 'cosine_then_gcn', 'self_loops': True, 'use_snp_selection': False}. Best is trial 89 with value: 0.31323712514652646.
[I 2025-12-08 12:07:02,481] Trial 114 finished with value: 0.3043720312792391 and parameters: {'model_type': 'graphsage', 'hidden_dims': '[128, 64]', 'dropout': 0.5747950509424651, 'batch_norm': True, 'sage_aggr': 'max', 'sage_normalize': True, 'sage_project': False, 'lr': 0.006275996310496031, 'weight_decay': 3.3613801310144607e-06, 'epochs': 243, 'loss': 'mse', 'optimizer': 'adam', 'graph_mode': 'cutoff', 'cutoff': 0.7856288498078869, 'grm_norm': 'cosine_then_gcn', 'self_loops': True, 'use_snp_selection': False}. Best is trial 89 with value: 0.31323712514652646.
