[I 2025-12-05 19:25:49,876] Trial 133 finished with value: 0.24502144798060704 and parameters: {'model_type': 'graphsage', 'hidden_dims': '[512, 64]', 'dropout': 0.15129226125458695, 'batch_norm': True, 'sage_aggr': 'mean', 'sage_normalize': True, 'sage_project': False, 'lr': 0.00012734021672016212, 'weight_decay': 1.953508727244325e-07, 'epochs': 235, 'loss': 'mae', 'optimizer': 'adam', 'graph_mode': 'cutoff', 'cutoff': 0.5631378580745017, 'grm_norm': 'cosine_then_gcn', 'self_loops': False, 'use_snp_selection': True, 'num_snps': 13160, 'graphsage_batch_size': 32}. Best is trial 123 with value: 0.2545287758683708.
[I 2025-12-05 19:26:36,333] Trial 134 finished with value: 0.24296467763839336 and parameters: {'model_type': 'graphsage', 'hidden_dims': '[512, 64]', 'dropout': 0.1637600858983446, 'batch_norm': True, 'sage_aggr': 'mean', 'sage_normalize': True, 'sage_project': False, 'lr': 0.00018606113821494224, 'weight_decay': 1.9897355074690558e-07, 'epochs': 234, 'loss': 'mae', 'optimizer': 'adam', 'graph_mode': 'cutoff', 'cutoff': 0.5608919867805411, 'grm_norm': 'cosine_then_gcn', 'self_loops': False, 'use_snp_selection': True, 'num_snps': 13056, 'graphsage_batch_size': 32}. Best is trial 123 with value: 0.2545287758683708.
[I 2025-12-05 19:27:18,739] Trial 135 finished with value: 0.24088898431247804 and parameters: {'model_type': 'graphsage', 'hidden_dims': '[512, 64]', 'dropout': 0.1086040105282983, 'batch_norm': True, 'sage_aggr': 'mean', 'sage_normalize': True, 'sage_project': False, 'lr': 9.238986908689322e-05, 'weight_decay': 3.12448750520075e-07, 'epochs': 228, 'loss': 'mae', 'optimizer': 'adam', 'graph_mode': 'cutoff', 'cutoff': 0.6275843530171497, 'grm_norm': 'cosine_then_gcn', 'self_loops': False, 'use_snp_selection': True, 'num_snps': 11949, 'graphsage_batch_size': 32}. Best is trial 123 with value: 0.2545287758683708.
[I 2025-12-05 19:28:07,686] Trial 136 finished with value: 0.24006040196052547 and parameters: {'model_type': 'graphsage', 'hidden_dims': '[512, 64]', 'dropout': 0.1540554238911976, 'batch_norm': True, 'sage_aggr': 'mean', 'sage_normalize': True, 'sage_project': False, 'lr': 0.00015929064855654552, 'weight_decay': 1.4739039335589415e-07, 'epochs': 223, 'loss': 'mae', 'optimizer': 'adam', 'graph_mode': 'cutoff', 'cutoff': 0.49547333284741624, 'grm_norm': 'cosine_then_gcn', 'self_loops': False, 'use_snp_selection': True, 'num_snps': 13480, 'graphsage_batch_size': 32}. Best is trial 123 with value: 0.2545287758683708.
[I 2025-12-05 19:28:49,006] Trial 137 finished with value: 0.23715990554424066 and parameters: {'model_type': 'graphsage', 'hidden_dims': '[512, 64]', 'dropout': 0.14937778187766554, 'batch_norm': True, 'sage_aggr': 'mean', 'sage_normalize': True, 'sage_project': False, 'lr': 0.00012860462292013517, 'weight_decay': 2.196616331979227e-07, 'epochs': 237, 'loss': 'mae', 'optimizer': 'adam', 'graph_mode': 'cutoff', 'cutoff': 0.5319315700409601, 'grm_norm': 'cosine_then_gcn', 'self_loops': False, 'use_snp_selection': True, 'num_snps': 10438, 'graphsage_batch_size': 32}. Best is trial 123 with value: 0.2545287758683708.
[I 2025-12-05 19:29:27,137] Trial 138 finished with value: 0.2433773363273864 and parameters: {'model_type': 'graphsage', 'hidden_dims': '[512, 64]', 'dropout': 0.1293909539131646, 'batch_norm': True, 'sage_aggr': 'mean', 'sage_normalize': True, 'sage_project': False, 'lr': 6.192124419278011e-05, 'weight_decay': 1.6761142471220858e-07, 'epochs': 242, 'loss': 'mae', 'optimizer': 'adam', 'graph_mode': 'cutoff', 'cutoff': 0.5915363183021078, 'grm_norm': 'cosine_then_gcn', 'self_loops': False, 'use_snp_selection': True, 'num_snps': 9235, 'graphsage_batch_size': 32}. Best is trial 123 with value: 0.2545287758683708.
[I 2025-12-05 19:30:19,871] Trial 139 finished with value: 0.24622221151858667 and parameters: {'model_type': 'graphsage', 'hidden_dims': '[512, 64]', 'dropout': 0.1872010251203154, 'batch_norm': True, 'sage_aggr': 'mean', 'sage_normalize': True, 'sage_project': False, 'lr': 7.779747928688e-05, 'weight_decay': 1.3221900525738506e-07, 'epochs': 234, 'loss': 'mae', 'optimizer': 'adam', 'graph_mode': 'cutoff', 'cutoff': 0.4704628207297296, 'grm_norm': 'cosine_then_gcn', 'self_loops': False, 'use_snp_selection': True, 'num_snps': 13496, 'graphsage_batch_size': 32}. Best is trial 123 with value: 0.2545287758683708.
[I 2025-12-05 19:31:08,934] Trial 140 finished with value: 0.2311396287610683 and parameters: {'model_type': 'graphsage', 'hidden_dims': '[512, 64]', 'dropout': 0.1838705728647833, 'batch_norm': True, 'sage_aggr': 'mean', 'sage_normalize': True, 'sage_project': False, 'lr': 7.239928618167608e-05, 'weight_decay': 1.3278598810069437e-07, 'epochs': 234, 'loss': 'mae', 'optimizer': 'adam', 'graph_mode': 'cutoff', 'cutoff': 0.4794772092947692, 'grm_norm': 'cosine_then_gcn', 'self_loops': False, 'use_snp_selection': True, 'num_snps': 12147, 'graphsage_batch_size': 8}. Best is trial 123 with value: 0.2545287758683708.
[I 2025-12-05 19:31:58,653] Trial 141 finished with value: 0.23838238002975717 and parameters: {'model_type': 'graphsage', 'hidden_dims': '[512, 64]', 'dropout': 0.1896656977693004, 'batch_norm': True, 'sage_aggr': 'mean', 'sage_normalize': True, 'sage_project': False, 'lr': 4.0793935661103596e-05, 'weight_decay': 1.9047038013478686e-07, 'epochs': 239, 'loss': 'mae', 'optimizer': 'adam', 'graph_mode': 'cutoff', 'cutoff': 0.5530781902465101, 'grm_norm': 'cosine_then_gcn', 'self_loops': False, 'use_snp_selection': True, 'num_snps': 14104, 'graphsage_batch_size': 32}. Best is trial 123 with value: 0.2545287758683708.
[I 2025-12-05 19:35:13,080] Trial 142 finished with value: 0.23388457940362387 and parameters: {'model_type': 'graphsage', 'hidden_dims': '[512, 64]', 'dropout': 0.16443025406152453, 'batch_norm': True, 'sage_aggr': 'mean', 'sage_normalize': True, 'sage_project': False, 'lr': 8.344345559298544e-05, 'weight_decay': 1.3048200973037732e-07, 'epochs': 229, 'loss': 'mae', 'optimizer': 'adam', 'graph_mode': 'cutoff', 'cutoff': 0.4393984224446846, 'grm_norm': 'cosine_then_gcn', 'self_loops': False, 'use_snp_selection': True, 'num_snps': 54685, 'graphsage_batch_size': 32}. Best is trial 123 with value: 0.2545287758683708.
[I 2025-12-05 19:35:55,395] Trial 143 finished with value: 0.2462871379751698 and parameters: {'model_type': 'graphsage', 'hidden_dims': '[512, 64]', 'dropout': 0.2106091722982531, 'batch_norm': True, 'sage_aggr': 'mean', 'sage_normalize': True, 'sage_project': False, 'lr': 9.936244504150465e-05, 'weight_decay': 2.4171650444728114e-07, 'epochs': 242, 'loss': 'mae', 'optimizer': 'adam', 'graph_mode': 'cutoff', 'cutoff': 0.562964118317604, 'grm_norm': 'cosine_then_gcn', 'self_loops': False, 'use_snp_selection': True, 'num_snps': 10878, 'graphsage_batch_size': 32}. Best is trial 123 with value: 0.2545287758683708.
[I 2025-12-05 19:36:35,648] Trial 144 finished with value: 0.24372825996727468 and parameters: {'model_type': 'graphsage', 'hidden_dims': '[512, 64]', 'dropout': 0.20616404382394887, 'batch_norm': True, 'sage_aggr': 'mean', 'sage_normalize': True, 'sage_project': False, 'lr': 9.536299180701695e-05, 'weight_decay': 2.3594596433418567e-07, 'epochs': 224, 'loss': 'mae', 'optimizer': 'adam', 'graph_mode': 'cutoff', 'cutoff': 0.5743894519299522, 'grm_norm': 'cosine_then_gcn', 'self_loops': False, 'use_snp_selection': True, 'num_snps': 10883, 'graphsage_batch_size': 64}. Best is trial 123 with value: 0.2545287758683708.
[I 2025-12-05 19:37:10,232] Trial 145 finished with value: 0.23788828827577407 and parameters: {'model_type': 'graphsage', 'hidden_dims': '[512, 64]', 'dropout': 0.11132868822268015, 'batch_norm': True, 'sage_aggr': 'mean', 'sage_normalize': True, 'sage_project': False, 'lr': 0.00013667308595796858, 'weight_decay': 2.889521316193424e-07, 'epochs': 234, 'loss': 'mae', 'optimizer': 'adam', 'graph_mode': 'cutoff', 'cutoff': 0.37057043729049555, 'grm_norm': 'cosine_then_gcn', 'self_loops': False, 'use_snp_selection': True, 'num_snps': 6419, 'graphsage_batch_size': 32}. Best is trial 123 with value: 0.2545287758683708.
[I 2025-12-05 19:37:36,619] Trial 146 finished with value: 0.21843975126077297 and parameters: {'model_type': 'graphsage', 'hidden_dims': '[512, 64]', 'dropout': 0.10096301298319812, 'batch_norm': True, 'sage_aggr': 'mean', 'sage_normalize': True, 'sage_project': False, 'lr': 7.020789786420387e-05, 'weight_decay': 5.009034614769266e-07, 'epochs': 241, 'loss': 'mae', 'optimizer': 'adam', 'graph_mode': 'cutoff', 'cutoff': 0.5400727917369406, 'grm_norm': 'none', 'self_loops': False, 'use_snp_selection': True, 'num_snps': 4286, 'graphsage_batch_size': 32}. Best is trial 123 with value: 0.2545287758683708.
[I 2025-12-05 19:38:14,123] Trial 147 finished with value: 0.24032614512834125 and parameters: {'model_type': 'graphsage', 'hidden_dims': '[512, 128]', 'dropout': 0.12079858988702917, 'batch_norm': True, 'sage_aggr': 'mean', 'sage_normalize': True, 'sage_project': False, 'lr': 0.00010260150491406011, 'weight_decay': 1.6438425940372972e-07, 'epochs': 230, 'loss': 'mae', 'optimizer': 'adam', 'graph_mode': 'cutoff', 'cutoff': 0.6341606818202551, 'grm_norm': 'cosine_then_gcn', 'self_loops': False, 'use_snp_selection': True, 'num_snps': 9405, 'graphsage_batch_size': 32}. Best is trial 123 with value: 0.2545287758683708.
[I 2025-12-05 19:39:00,877] Trial 148 finished with value: 0.24771313950195376 and parameters: {'model_type': 'graphsage', 'hidden_dims': '[512, 64]', 'dropout': 0.17073671848332142, 'batch_norm': True, 'sage_aggr': 'mean', 'sage_normalize': True, 'sage_project': False, 'lr': 0.00015820072098067617, 'weight_decay': 1.9821072077833018e-07, 'epochs': 236, 'loss': 'mae', 'optimizer': 'adam', 'graph_mode': 'cutoff', 'cutoff': 0.5899200243278296, 'grm_norm': 'cosine_then_gcn', 'self_loops': False, 'use_snp_selection': True, 'num_snps': 13364, 'graphsage_batch_size': 32}. Best is trial 123 with value: 0.2545287758683708.
[I 2025-12-05 19:39:47,098] Trial 149 finished with value: 0.24596653810403163 and parameters: {'model_type': 'graphsage', 'hidden_dims': '[512, 64]', 'dropout': 0.16099318618696112, 'batch_norm': True, 'sage_aggr': 'mean', 'sage_normalize': True, 'sage_project': False, 'lr': 0.00015877351705310735, 'weight_decay': 3.315486154209574e-07, 'epochs': 236, 'loss': 'mae', 'optimizer': 'adam', 'graph_mode': 'cutoff', 'cutoff': 0.5909607883149294, 'grm_norm': 'cosine_then_gcn', 'self_loops': False, 'use_snp_selection': True, 'num_snps': 13043, 'graphsage_batch_size': 32}. Best is trial 123 with value: 0.2545287758683708.
[I 2025-12-05 19:40:49,997] Trial 0 finished with value: 0.1258491712384034 and parameters: {'model_type': 'graphsage', 'hidden_dims': '[128, 64]', 'dropout': 0.199031432379812, 'batch_norm': True, 'sage_aggr': 'max', 'sage_normalize': False, 'sage_project': False, 'lr': 3.4401453323286906e-05, 'weight_decay': 0.00017802616915745114, 'epochs': 169, 'loss': 'mse', 'optimizer': 'adam', 'graph_mode': 'knn', 'knn_k': 6, 'weighted_edges': True, 'symmetrize_mode': 'mutual', 'self_loops': False, 'use_snp_selection': False, 'graphsage_batch_size': 256}. Best is trial 0 with value: 0.1258491712384034.
[I 2025-12-05 19:41:51,317] Trial 1 finished with value: 0.18507934000218723 and parameters: {'model_type': 'graphsage', 'hidden_dims': '[512, 128]', 'dropout': 0.3737930779596218, 'batch_norm': True, 'sage_aggr': 'mean', 'sage_normalize': False, 'sage_project': False, 'lr': 0.0004485485309869717, 'weight_decay': 2.0046868950224612e-06, 'epochs': 74, 'loss': 'mse', 'optimizer': 'adam', 'graph_mode': 'knn', 'knn_k': 4, 'weighted_edges': True, 'symmetrize_mode': 'union', 'self_loops': False, 'use_snp_selection': False, 'graphsage_batch_size': 8}. Best is trial 1 with value: 0.18507934000218723.
[I 2025-12-05 19:42:34,325] Trial 2 finished with value: 0.17910185593014089 and parameters: {'model_type': 'graphsage', 'hidden_dims': '[256, 128]', 'dropout': 0.2731735750400165, 'batch_norm': False, 'sage_aggr': 'max', 'sage_normalize': True, 'sage_project': False, 'lr': 3.4705625989073525e-05, 'weight_decay': 2.4623319020131338e-05, 'epochs': 95, 'loss': 'mse', 'optimizer': 'adam', 'graph_mode': 'knn', 'knn_k': 6, 'weighted_edges': False, 'symmetrize_mode': 'mutual', 'self_loops': False, 'use_snp_selection': True, 'num_snps': 30713, 'graphsage_batch_size': 8}. Best is trial 1 with value: 0.18507934000218723.
[I 2025-12-05 19:43:33,209] Trial 3 finished with value: 0.18207884586622605 and parameters: {'model_type': 'graphsage', 'hidden_dims': '[256, 128]', 'dropout': 0.3815953422463725, 'batch_norm': False, 'sage_aggr': 'mean', 'sage_normalize': True, 'sage_project': False, 'lr': 2.1095572616816696e-06, 'weight_decay': 5.195307220037778e-07, 'epochs': 226, 'loss': 'mse', 'optimizer': 'adam', 'graph_mode': 'knn', 'knn_k': 8, 'weighted_edges': True, 'symmetrize_mode': 'union', 'self_loops': False, 'use_snp_selection': True, 'num_snps': 16419, 'graphsage_batch_size': 128}. Best is trial 1 with value: 0.18507934000218723.
[I 2025-12-05 19:45:32,124] Trial 4 finished with value: 0.16064473164454163 and parameters: {'model_type': 'graphsage', 'hidden_dims': '[256, 128]', 'dropout': 0.3920979142653378, 'batch_norm': True, 'sage_aggr': 'max', 'sage_normalize': True, 'sage_project': False, 'lr': 3.15214685884738e-06, 'weight_decay': 1.0663862019069792e-05, 'epochs': 212, 'loss': 'mae', 'optimizer': 'adam', 'graph_mode': 'cutoff', 'cutoff': 0.33867046005138823, 'grm_norm': 'gcn', 'self_loops': False, 'use_snp_selection': False, 'graphsage_batch_size': 512}. Best is trial 1 with value: 0.18507934000218723.
[I 2025-12-05 19:45:57,942] Trial 5 finished with value: 0.18397272255611133 and parameters: {'model_type': 'graphsage', 'hidden_dims': '[256, 128]', 'dropout': 0.32925710311863654, 'batch_norm': True, 'sage_aggr': 'mean', 'sage_normalize': True, 'sage_project': False, 'lr': 0.00016905333078305474, 'weight_decay': 6.711044850912148e-06, 'epochs': 127, 'loss': 'mae', 'optimizer': 'adam', 'graph_mode': 'cutoff', 'cutoff': 0.253959783091227, 'grm_norm': 'cosine_then_gcn', 'self_loops': False, 'use_snp_selection': True, 'num_snps': 7419, 'graphsage_batch_size': 64}. Best is trial 1 with value: 0.18507934000218723.
[I 2025-12-05 19:48:01,058] Trial 6 finished with value: 0.1137156747024926 and parameters: {'model_type': 'graphsage', 'hidden_dims': '[512, 64]', 'dropout': 0.2585007811528941, 'batch_norm': True, 'sage_aggr': 'max', 'sage_normalize': False, 'sage_project': False, 'lr': 5.921425508303395e-06, 'weight_decay': 0.0004511561961144237, 'epochs': 136, 'loss': 'mae', 'optimizer': 'adam', 'graph_mode': 'knn', 'knn_k': 9, 'weighted_edges': True, 'symmetrize_mode': 'union', 'self_loops': False, 'use_snp_selection': True, 'num_snps': 34427, 'graphsage_batch_size': 128}. Best is trial 1 with value: 0.18507934000218723.
[I 2025-12-05 19:50:02,371] Trial 7 finished with value: 0.15041146596458735 and parameters: {'model_type': 'graphsage', 'hidden_dims': '[512, 128]', 'dropout': 0.5944584870981006, 'batch_norm': False, 'sage_aggr': 'max', 'sage_normalize': True, 'sage_project': False, 'lr': 7.3241868695773595e-06, 'weight_decay': 1.2565521754060153e-06, 'epochs': 166, 'loss': 'mse', 'optimizer': 'adam', 'graph_mode': 'knn', 'knn_k': 5, 'weighted_edges': False, 'symmetrize_mode': 'mutual', 'self_loops': False, 'use_snp_selection': True, 'num_snps': 50019, 'graphsage_batch_size': 8}. Best is trial 1 with value: 0.18507934000218723.
[I 2025-12-05 19:51:26,390] Trial 8 finished with value: 0.11577269438221349 and parameters: {'model_type': 'graphsage', 'hidden_dims': '[512, 64]', 'dropout': 0.5703535192416116, 'batch_norm': False, 'sage_aggr': 'mean', 'sage_normalize': False, 'sage_project': False, 'lr': 1.823510325310572e-06, 'weight_decay': 0.00013672790135428885, 'epochs': 104, 'loss': 'mae', 'optimizer': 'adam', 'graph_mode': 'knn', 'knn_k': 7, 'weighted_edges': True, 'symmetrize_mode': 'mutual', 'self_loops': False, 'use_snp_selection': True, 'num_snps': 45923, 'graphsage_batch_size': 128}. Best is trial 1 with value: 0.18507934000218723.
[I 2025-12-05 19:53:57,223] Trial 9 finished with value: 0.1878549488204658 and parameters: {'model_type': 'graphsage', 'hidden_dims': '[512, 128]', 'dropout': 0.27261839493092876, 'batch_norm': False, 'sage_aggr': 'mean', 'sage_normalize': False, 'sage_project': False, 'lr': 5.88603310717523e-06, 'weight_decay': 1.0998339923223823e-05, 'epochs': 249, 'loss': 'mae', 'optimizer': 'adam', 'graph_mode': 'knn', 'knn_k': 3, 'weighted_edges': False, 'symmetrize_mode': 'mutual', 'self_loops': False, 'use_snp_selection': False, 'graphsage_batch_size': 128}. Best is trial 9 with value: 0.1878549488204658.
[I 2025-12-05 19:55:52,541] Trial 10 finished with value: 0.2138774181514703 and parameters: {'model_type': 'graphsage', 'hidden_dims': '[512, 256]', 'dropout': 0.11372025982957354, 'batch_norm': False, 'sage_aggr': 'mean', 'sage_normalize': False, 'sage_project': False, 'lr': 1.320954302422749e-05, 'weight_decay': 1.2257443862615642e-07, 'epochs': 197, 'loss': 'mae', 'optimizer': 'adam', 'graph_mode': 'cutoff', 'cutoff': 0.8339492830671671, 'grm_norm': 'none', 'self_loops': False, 'use_snp_selection': False, 'graphsage_batch_size': 32}. Best is trial 10 with value: 0.2138774181514703.
[I 2025-12-05 19:58:11,846] Trial 11 finished with value: 0.20568261905777888 and parameters: {'model_type': 'graphsage', 'hidden_dims': '[512, 256]', 'dropout': 0.10222657792332025, 'batch_norm': False, 'sage_aggr': 'mean', 'sage_normalize': False, 'sage_project': False, 'lr': 1.3209655691727925e-05, 'weight_decay': 1.3081036432574914e-07, 'epochs': 242, 'loss': 'mae', 'optimizer': 'adam', 'graph_mode': 'cutoff', 'cutoff': 0.8841591475995373, 'grm_norm': 'none', 'self_loops': False, 'use_snp_selection': False, 'graphsage_batch_size': 32}. Best is trial 10 with value: 0.2138774181514703.
[I 2025-12-05 20:00:07,608] Trial 12 finished with value: 0.20040357859554564 and parameters: {'model_type': 'graphsage', 'hidden_dims': '[512, 256]', 'dropout': 0.11848165151157439, 'batch_norm': False, 'sage_aggr': 'mean', 'sage_normalize': False, 'sage_project': False, 'lr': 1.6135806111022914e-05, 'weight_decay': 1.0539977805680418e-07, 'epochs': 198, 'loss': 'mae', 'optimizer': 'adam', 'graph_mode': 'cutoff', 'cutoff': 0.8999975932582684, 'grm_norm': 'none', 'self_loops': False, 'use_snp_selection': False, 'graphsage_batch_size': 32}. Best is trial 10 with value: 0.2138774181514703.
[I 2025-12-05 20:02:26,933] Trial 13 finished with value: 0.20673293675831936 and parameters: {'model_type': 'graphsage', 'hidden_dims': '[512, 256]', 'dropout': 0.1014849784128569, 'batch_norm': False, 'sage_aggr': 'mean', 'sage_normalize': False, 'sage_project': False, 'lr': 0.00014626888081117106, 'weight_decay': 1.6949045911870694e-07, 'epochs': 242, 'loss': 'mae', 'optimizer': 'adam', 'graph_mode': 'cutoff', 'cutoff': 0.8886799317984508, 'grm_norm': 'none', 'self_loops': False, 'use_snp_selection': False, 'graphsage_batch_size': 32}. Best is trial 10 with value: 0.2138774181514703.
[I 2025-12-05 20:03:32,391] Trial 14 finished with value: 0.20054252082562787 and parameters: {'model_type': 'graphsage', 'hidden_dims': '[256, 128, 64]', 'dropout': 0.17358397456854202, 'batch_norm': False, 'sage_aggr': 'mean', 'sage_normalize': False, 'sage_project': False, 'lr': 0.00011116018577506711, 'weight_decay': 4.4114649605173185e-07, 'epochs': 191, 'loss': 'mae', 'optimizer': 'adam', 'graph_mode': 'cutoff', 'cutoff': 0.6752188856300831, 'grm_norm': 'cosine', 'self_loops': False, 'use_snp_selection': False, 'graphsage_batch_size': 32}. Best is trial 10 with value: 0.2138774181514703.
[I 2025-12-05 20:04:05,070] Trial 15 finished with value: 0.019263760431720945 and parameters: {'model_type': 'graphsage', 'hidden_dims': '[512, 256]', 'dropout': 0.46689080254430726, 'batch_norm': False, 'sage_aggr': 'mean', 'sage_normalize': False, 'sage_project': False, 'lr': 0.0008000134635777176, 'weight_decay': 3.939158144371285e-07, 'epochs': 42, 'loss': 'mae', 'optimizer': 'adam', 'graph_mode': 'cutoff', 'cutoff': 0.7001405380378066, 'grm_norm': 'none', 'self_loops': False, 'use_snp_selection': False, 'graphsage_batch_size': 16}. Best is trial 10 with value: 0.2138774181514703.
[I 2025-12-05 20:05:50,125] Trial 16 finished with value: 0.20679916755662942 and parameters: {'model_type': 'graphsage', 'hidden_dims': '[512, 256]', 'dropout': 0.18280759082559803, 'batch_norm': False, 'sage_aggr': 'mean', 'sage_normalize': False, 'sage_project': False, 'lr': 7.020797354346516e-05, 'weight_decay': 2.8545258671888946e-06, 'epochs': 177, 'loss': 'mae', 'optimizer': 'adam', 'graph_mode': 'cutoff', 'cutoff': 0.7509148358755057, 'grm_norm': 'none', 'self_loops': False, 'use_snp_selection': False, 'graphsage_batch_size': 32}. Best is trial 10 with value: 0.2138774181514703.
[I 2025-12-05 20:07:29,300] Trial 17 finished with value: 0.2004269038267486 and parameters: {'model_type': 'graphsage', 'hidden_dims': '[512, 256]', 'dropout': 0.18516121820787293, 'batch_norm': False, 'sage_aggr': 'mean', 'sage_normalize': False, 'sage_project': False, 'lr': 7.719013528163218e-05, 'weight_decay': 2.736647479934756e-06, 'epochs': 166, 'loss': 'mae', 'optimizer': 'adam', 'graph_mode': 'cutoff', 'cutoff': 0.6883077054368831, 'grm_norm': 'none', 'self_loops': False, 'use_snp_selection': False, 'graphsage_batch_size': 32}. Best is trial 10 with value: 0.2138774181514703.
