[I 2025-12-09 01:45:30,776] Trial 110 finished with value: 0.27302262366822444 and parameters: {'model_type': 'graphsage', 'hidden_dims': '[512, 64]', 'dropout': 0.31304051293275387, 'batch_norm': False, 'sage_aggr': 'max', 'sage_normalize': False, 'sage_project': False, 'lr': 2.1440837318603743e-05, 'weight_decay': 8.550601254497228e-07, 'epochs': 173, 'loss': 'mae', 'optimizer': 'adam', 'graph_mode': 'cutoff', 'cutoff': 0.39355421297072296, 'grm_norm': 'cosine_then_gcn', 'self_loops': True, 'use_snp_selection': True, 'num_snps': 47445}. Best is trial 104 with value: 0.3013232731544343.
[I 2025-12-09 01:48:51,368] Trial 111 finished with value: 0.2922171698260555 and parameters: {'model_type': 'graphsage', 'hidden_dims': '[512, 64]', 'dropout': 0.3274718266672182, 'batch_norm': False, 'sage_aggr': 'max', 'sage_normalize': False, 'sage_project': False, 'lr': 3.410655191647023e-05, 'weight_decay': 7.394682544219914e-07, 'epochs': 273, 'loss': 'mse', 'optimizer': 'adam', 'graph_mode': 'cutoff', 'cutoff': 0.4695474895633547, 'grm_norm': 'cosine_then_gcn', 'self_loops': True, 'use_snp_selection': True, 'num_snps': 40136}. Best is trial 104 with value: 0.3013232731544343.
[I 2025-12-09 01:51:43,070] Trial 112 finished with value: 0.29629224981908553 and parameters: {'model_type': 'graphsage', 'hidden_dims': '[512, 64]', 'dropout': 0.2977679754429629, 'batch_norm': False, 'sage_aggr': 'max', 'sage_normalize': False, 'sage_project': False, 'lr': 1.918254550881965e-05, 'weight_decay': 9.653701185962607e-07, 'epochs': 251, 'loss': 'mse', 'optimizer': 'adam', 'graph_mode': 'cutoff', 'cutoff': 0.45193346791934, 'grm_norm': 'cosine_then_gcn', 'self_loops': True, 'use_snp_selection': True, 'num_snps': 36522}. Best is trial 104 with value: 0.3013232731544343.
[I 2025-12-09 01:55:50,574] Trial 113 finished with value: 0.28960976955406725 and parameters: {'model_type': 'graphsage', 'hidden_dims': '[512, 64]', 'dropout': 0.2681962081531807, 'batch_norm': False, 'sage_aggr': 'max', 'sage_normalize': False, 'sage_project': False, 'lr': 3.083089854386753e-05, 'weight_decay': 1.1239467248360768e-06, 'epochs': 258, 'loss': 'mse', 'optimizer': 'adam', 'graph_mode': 'cutoff', 'cutoff': 0.416312671450566, 'grm_norm': 'cosine_then_gcn', 'self_loops': True, 'use_snp_selection': True, 'num_snps': 49029}. Best is trial 104 with value: 0.3013232731544343.
[I 2025-12-09 01:57:52,787] Trial 114 finished with value: 0.290628202672928 and parameters: {'model_type': 'graphsage', 'hidden_dims': '[512, 64]', 'dropout': 0.28856217084501334, 'batch_norm': False, 'sage_aggr': 'max', 'sage_normalize': False, 'sage_project': False, 'lr': 2.4521946280112666e-05, 'weight_decay': 3.127306603620453e-07, 'epochs': 235, 'loss': 'mse', 'optimizer': 'adam', 'graph_mode': 'cutoff', 'cutoff': 0.4935617245330606, 'grm_norm': 'cosine_then_gcn', 'self_loops': True, 'use_snp_selection': True, 'num_snps': 29517}. Best is trial 104 with value: 0.3013232731544343.
[I 2025-12-09 02:01:16,627] Trial 115 finished with value: 0.30014903911923996 and parameters: {'model_type': 'graphsage', 'hidden_dims': '[512, 64]', 'dropout': 0.2555468675608675, 'batch_norm': False, 'sage_aggr': 'max', 'sage_normalize': False, 'sage_project': False, 'lr': 1.4265291374641594e-05, 'weight_decay': 1.4702215387250449e-06, 'epochs': 247, 'loss': 'mse', 'optimizer': 'adam', 'graph_mode': 'cutoff', 'cutoff': 0.43852547519670415, 'grm_norm': 'cosine_then_gcn', 'self_loops': True, 'use_snp_selection': True, 'num_snps': 42857}. Best is trial 104 with value: 0.3013232731544343.
[I 2025-12-09 02:04:55,758] Trial 116 finished with value: 0.2785441696892339 and parameters: {'model_type': 'graphsage', 'hidden_dims': '[512, 64]', 'dropout': 0.27727032707172267, 'batch_norm': True, 'sage_aggr': 'max', 'sage_normalize': False, 'sage_project': False, 'lr': 1.961470722555257e-05, 'weight_decay': 1.5266219107044235e-06, 'epochs': 266, 'loss': 'mse', 'optimizer': 'adam', 'graph_mode': 'cutoff', 'cutoff': 0.4357518753490744, 'grm_norm': 'cosine_then_gcn', 'self_loops': True, 'use_snp_selection': True, 'num_snps': 42887}. Best is trial 104 with value: 0.3013232731544343.
[I 2025-12-09 02:09:31,368] Trial 117 finished with value: 0.2975277433970313 and parameters: {'model_type': 'graphsage', 'hidden_dims': '[512, 64]', 'dropout': 0.35439136098207413, 'batch_norm': False, 'sage_aggr': 'max', 'sage_normalize': False, 'sage_project': False, 'lr': 1.4813180883848229e-05, 'weight_decay': 4.3228704335578775e-07, 'epochs': 273, 'loss': 'mse', 'optimizer': 'adam', 'graph_mode': 'cutoff', 'cutoff': 0.39540355289801266, 'grm_norm': 'cosine_then_gcn', 'self_loops': True, 'use_snp_selection': True, 'num_snps': 50945}. Best is trial 104 with value: 0.3013232731544343.
[I 2025-12-09 02:12:52,551] Trial 118 finished with value: 0.00338508657495354 and parameters: {'model_type': 'graphsage', 'hidden_dims': '[512, 64]', 'dropout': 0.25630648836207204, 'batch_norm': False, 'sage_aggr': 'max', 'sage_normalize': False, 'sage_project': False, 'lr': 0.00048364239858287493, 'weight_decay': 1.8999718145305876e-07, 'epochs': 287, 'loss': 'mse', 'optimizer': 'adam', 'graph_mode': 'cutoff', 'cutoff': 0.42253032253644895, 'grm_norm': 'cosine_then_gcn', 'self_loops': False, 'use_snp_selection': True, 'num_snps': 37890}. Best is trial 104 with value: 0.3013232731544343.
[I 2025-12-09 02:16:18,493] Trial 119 finished with value: 0.27886788070681945 and parameters: {'model_type': 'graphsage', 'hidden_dims': '[512, 64]', 'dropout': 0.3161992669253331, 'batch_norm': False, 'sage_aggr': 'max', 'sage_normalize': False, 'sage_project': False, 'lr': 3.9103749413209435e-05, 'weight_decay': 5.933889669330876e-07, 'epochs': 241, 'loss': 'mse', 'optimizer': 'adam', 'graph_mode': 'cutoff', 'cutoff': 0.46222520690594654, 'grm_norm': 'cosine_then_gcn', 'self_loops': True, 'use_snp_selection': True, 'num_snps': 44619}. Best is trial 104 with value: 0.3013232731544343.
[I 2025-12-09 02:20:22,641] Trial 120 finished with value: 0.2974350125344366 and parameters: {'model_type': 'graphsage', 'hidden_dims': '[512, 256]', 'dropout': 0.29056537777557, 'batch_norm': False, 'sage_aggr': 'max', 'sage_normalize': False, 'sage_project': False, 'lr': 2.8751644460764715e-05, 'weight_decay': 1.3429673441550593e-06, 'epochs': 229, 'loss': 'mse', 'optimizer': 'adam', 'graph_mode': 'cutoff', 'cutoff': 0.43987208985495657, 'grm_norm': 'cosine_then_gcn', 'self_loops': True, 'use_snp_selection': True, 'num_snps': 54647}. Best is trial 104 with value: 0.3013232731544343.
[I 2025-12-09 02:24:41,682] Trial 121 finished with value: 0.30172067444668105 and parameters: {'model_type': 'graphsage', 'hidden_dims': '[512, 64]', 'dropout': 0.357433506673126, 'batch_norm': False, 'sage_aggr': 'max', 'sage_normalize': False, 'sage_project': False, 'lr': 1.192143935866708e-05, 'weight_decay': 8.84387102011416e-07, 'epochs': 272, 'loss': 'mse', 'optimizer': 'adam', 'graph_mode': 'cutoff', 'cutoff': 0.39158118424013405, 'grm_norm': 'cosine_then_gcn', 'self_loops': True, 'use_snp_selection': True, 'num_snps': 48637}. Best is trial 121 with value: 0.30172067444668105.
[I 2025-12-09 02:28:55,185] Trial 122 finished with value: 0.296389243448862 and parameters: {'model_type': 'graphsage', 'hidden_dims': '[512, 64]', 'dropout': 0.3595887812974016, 'batch_norm': False, 'sage_aggr': 'max', 'sage_normalize': False, 'sage_project': False, 'lr': 1.2182737751420282e-05, 'weight_decay': 1.9023671545636628e-06, 'epochs': 251, 'loss': 'mse', 'optimizer': 'adam', 'graph_mode': 'cutoff', 'cutoff': 0.3673172319553801, 'grm_norm': 'cosine_then_gcn', 'self_loops': True, 'use_snp_selection': True, 'num_snps': 49668}. Best is trial 121 with value: 0.30172067444668105.
[I 2025-12-09 02:33:00,663] Trial 123 finished with value: 0.2973542066738249 and parameters: {'model_type': 'graphsage', 'hidden_dims': '[512, 64]', 'dropout': 0.3899199123151112, 'batch_norm': False, 'sage_aggr': 'max', 'sage_normalize': False, 'sage_project': False, 'lr': 1.737284804655864e-05, 'weight_decay': 9.066126383492716e-07, 'epochs': 264, 'loss': 'mse', 'optimizer': 'adam', 'graph_mode': 'cutoff', 'cutoff': 0.41246422686834117, 'grm_norm': 'cosine_then_gcn', 'self_loops': True, 'use_snp_selection': True, 'num_snps': 47776}. Best is trial 121 with value: 0.30172067444668105.
[I 2025-12-09 02:37:00,400] Trial 124 finished with value: 0.29506784916846424 and parameters: {'model_type': 'graphsage', 'hidden_dims': '[512, 64]', 'dropout': 0.33443804499211566, 'batch_norm': False, 'sage_aggr': 'max', 'sage_normalize': False, 'sage_project': False, 'lr': 2.1084925519722276e-05, 'weight_decay': 1.0652451891317012e-06, 'epochs': 270, 'loss': 'mse', 'optimizer': 'adam', 'graph_mode': 'cutoff', 'cutoff': 0.3525174518860953, 'grm_norm': 'cosine_then_gcn', 'self_loops': True, 'use_snp_selection': True, 'num_snps': 42435}. Best is trial 121 with value: 0.30172067444668105.
[I 2025-12-09 02:41:10,905] Trial 125 finished with value: 0.294158928621019 and parameters: {'model_type': 'graphsage', 'hidden_dims': '[512, 64]', 'dropout': 0.25973648566840923, 'batch_norm': False, 'sage_aggr': 'max', 'sage_normalize': False, 'sage_project': False, 'lr': 1.1540885566209052e-05, 'weight_decay': 7.145302508348287e-07, 'epochs': 278, 'loss': 'mse', 'optimizer': 'adam', 'graph_mode': 'cutoff', 'cutoff': 0.38588243220717633, 'grm_norm': 'cosine_then_gcn', 'self_loops': True, 'use_snp_selection': True, 'num_snps': 45901}. Best is trial 121 with value: 0.30172067444668105.
[I 2025-12-09 02:43:02,836] Trial 126 finished with value: 0.2824184029683642 and parameters: {'model_type': 'graphsage', 'hidden_dims': '[512, 128]', 'dropout': 0.3769023308452366, 'batch_norm': False, 'sage_aggr': 'max', 'sage_normalize': False, 'sage_project': False, 'lr': 1.3138374037925057e-05, 'weight_decay': 1.8005971041251934e-06, 'epochs': 183, 'loss': 'mse', 'optimizer': 'adam', 'graph_mode': 'cutoff', 'cutoff': 0.5085237895019822, 'grm_norm': 'cosine_then_gcn', 'self_loops': True, 'use_snp_selection': True, 'num_snps': 38503}. Best is trial 121 with value: 0.30172067444668105.
[I 2025-12-09 02:47:27,068] Trial 127 finished with value: 0.29996795734209386 and parameters: {'model_type': 'graphsage', 'hidden_dims': '[512, 64]', 'dropout': 0.24346619792652732, 'batch_norm': False, 'sage_aggr': 'max', 'sage_normalize': False, 'sage_project': False, 'lr': 1.549091188859739e-05, 'weight_decay': 3.0772072208333825e-06, 'epochs': 256, 'loss': 'mse', 'optimizer': 'adam', 'graph_mode': 'cutoff', 'cutoff': 0.4454039151800745, 'grm_norm': 'cosine', 'self_loops': True, 'use_snp_selection': True, 'num_snps': 53366}. Best is trial 121 with value: 0.30172067444668105.
[I 2025-12-09 02:51:43,642] Trial 128 finished with value: 0.2938130789180344 and parameters: {'model_type': 'graphsage', 'hidden_dims': '[512, 64]', 'dropout': 0.22809722768187565, 'batch_norm': False, 'sage_aggr': 'max', 'sage_normalize': False, 'sage_project': False, 'lr': 2.590838932706485e-05, 'weight_decay': 3.2526379771989143e-06, 'epochs': 257, 'loss': 'mse', 'optimizer': 'adam', 'graph_mode': 'cutoff', 'cutoff': 0.47643647832637437, 'grm_norm': 'cosine', 'self_loops': True, 'use_snp_selection': True, 'num_snps': 52997}. Best is trial 121 with value: 0.30172067444668105.
[I 2025-12-09 02:56:31,136] Trial 129 finished with value: 0.2657268158898408 and parameters: {'model_type': 'graphsage', 'hidden_dims': '[512, 64]', 'dropout': 0.2419771454869479, 'batch_norm': False, 'sage_aggr': 'max', 'sage_normalize': True, 'sage_project': False, 'lr': 1.6046345557331595e-05, 'weight_decay': 4.563601808481288e-06, 'epochs': 246, 'loss': 'mse', 'optimizer': 'adam', 'graph_mode': 'cutoff', 'cutoff': 0.44639129081521306, 'grm_norm': 'cosine', 'self_loops': True, 'use_snp_selection': True, 'num_snps': 59731}. Best is trial 121 with value: 0.30172067444668105.
[I 2025-12-09 03:01:52,546] Trial 130 finished with value: 0.2941476722042228 and parameters: {'model_type': 'graphsage', 'hidden_dims': '[512, 64]', 'dropout': 0.564700154758663, 'batch_norm': False, 'sage_aggr': 'max', 'sage_normalize': False, 'sage_project': False, 'lr': 1.929640732035992e-05, 'weight_decay': 2.7508495222050293e-06, 'epochs': 286, 'loss': 'mse', 'optimizer': 'adam', 'graph_mode': 'cutoff', 'cutoff': 0.41444524610582417, 'grm_norm': 'cosine', 'self_loops': True, 'use_snp_selection': True, 'num_snps': 57171}. Best is trial 121 with value: 0.30172067444668105.
[I 2025-12-09 03:05:41,225] Trial 131 finished with value: 0.293383498756553 and parameters: {'model_type': 'graphsage', 'hidden_dims': '[512, 64]', 'dropout': 0.2520954216738071, 'batch_norm': False, 'sage_aggr': 'max', 'sage_normalize': False, 'sage_project': False, 'lr': 1.3896768427490084e-05, 'weight_decay': 1.3814222133213512e-06, 'epochs': 261, 'loss': 'mse', 'optimizer': 'adam', 'graph_mode': 'cutoff', 'cutoff': 0.42790118207808553, 'grm_norm': 'cosine', 'self_loops': True, 'use_snp_selection': True, 'num_snps': 45149}. Best is trial 121 with value: 0.30172067444668105.
[I 2025-12-09 03:07:54,447] Trial 132 finished with value: 0.2949393039757452 and parameters: {'model_type': 'graphsage', 'hidden_dims': '[256, 128]', 'dropout': 0.26822871950914423, 'batch_norm': False, 'sage_aggr': 'max', 'sage_normalize': False, 'sage_project': False, 'lr': 1.5955956889813485e-05, 'weight_decay': 2.3989055894710052e-06, 'epochs': 165, 'loss': 'mse', 'optimizer': 'adam', 'graph_mode': 'cutoff', 'cutoff': 0.45680839431539655, 'grm_norm': 'cosine_then_gcn', 'self_loops': True, 'use_snp_selection': True, 'num_snps': 49147}. Best is trial 121 with value: 0.30172067444668105.
[I 2025-12-09 03:10:35,284] Trial 133 finished with value: 0.29782386629738067 and parameters: {'model_type': 'graphsage', 'hidden_dims': '[512, 64]', 'dropout': 0.3036806539925379, 'batch_norm': False, 'sage_aggr': 'max', 'sage_normalize': False, 'sage_project': False, 'lr': 1.1169638109059471e-05, 'weight_decay': 3.737898054667776e-06, 'epochs': 239, 'loss': 'mse', 'optimizer': 'adam', 'graph_mode': 'cutoff', 'cutoff': 0.4003933497479111, 'grm_norm': 'none', 'self_loops': True, 'use_snp_selection': True, 'num_snps': 41471}. Best is trial 121 with value: 0.30172067444668105.
[I 2025-12-09 03:13:58,531] Trial 134 finished with value: 0.07563787506572014 and parameters: {'model_type': 'graphsage', 'hidden_dims': '[512, 64]', 'dropout': 0.2164821079897004, 'batch_norm': False, 'sage_aggr': 'max', 'sage_normalize': False, 'sage_project': False, 'lr': 0.00020694507578104273, 'weight_decay': 3.6922432956204207e-06, 'epochs': 238, 'loss': 'mse', 'optimizer': 'adam', 'graph_mode': 'cutoff', 'cutoff': 0.39625953445181666, 'grm_norm': 'none', 'self_loops': True, 'use_snp_selection': True, 'num_snps': 41933}. Best is trial 121 with value: 0.30172067444668105.
[I 2025-12-09 03:17:57,287] Trial 135 finished with value: 0.3033334111480429 and parameters: {'model_type': 'graphsage', 'hidden_dims': '[512, 64]', 'dropout': 0.19811524409477724, 'batch_norm': False, 'sage_aggr': 'max', 'sage_normalize': False, 'sage_project': False, 'lr': 1.2630678268209502e-05, 'weight_decay': 3.6080889010268853e-06, 'epochs': 252, 'loss': 'mse', 'optimizer': 'adam', 'graph_mode': 'cutoff', 'cutoff': 0.37141560180873184, 'grm_norm': 'none', 'self_loops': True, 'use_snp_selection': True, 'num_snps': 44451}. Best is trial 135 with value: 0.3033334111480429.
[I 2025-12-09 03:22:37,977] Trial 136 finished with value: 0.0 and parameters: {'model_type': 'graphsage', 'hidden_dims': '[512, 64]', 'dropout': 0.1922821079368417, 'batch_norm': False, 'sage_aggr': 'max', 'sage_normalize': False, 'sage_project': False, 'lr': 0.0016120919984510805, 'weight_decay': 7.593873982561476e-06, 'epochs': 295, 'loss': 'mse', 'optimizer': 'adam', 'graph_mode': 'cutoff', 'cutoff': 0.37053153968323177, 'grm_norm': 'none', 'self_loops': True, 'use_snp_selection': True, 'num_snps': 45194}. Best is trial 135 with value: 0.3033334111480429.
[I 2025-12-09 03:26:53,758] Trial 137 finished with value: 0.270589022559941 and parameters: {'model_type': 'graphsage', 'hidden_dims': '[512, 64]', 'dropout': 0.37291682712009644, 'batch_norm': False, 'sage_aggr': 'max', 'sage_normalize': False, 'sage_project': False, 'lr': 1.1514451259618802e-05, 'weight_decay': 4.407563918497917e-06, 'epochs': 255, 'loss': 'mae', 'optimizer': 'adam', 'graph_mode': 'cutoff', 'cutoff': 0.38235050020706507, 'grm_norm': 'none', 'self_loops': True, 'use_snp_selection': True, 'num_snps': 47443}. Best is trial 135 with value: 0.3033334111480429.
[I 2025-12-09 03:30:43,289] Trial 138 finished with value: 0.2610727969309064 and parameters: {'model_type': 'graphsage', 'hidden_dims': '[512, 64]', 'dropout': 0.2019861950297033, 'batch_norm': True, 'sage_aggr': 'max', 'sage_normalize': False, 'sage_project': False, 'lr': 1.8021809765741334e-05, 'weight_decay': 3.5259166468853e-06, 'epochs': 232, 'loss': 'mse', 'optimizer': 'adam', 'graph_mode': 'cutoff', 'cutoff': 0.35549145255454045, 'grm_norm': 'none', 'self_loops': True, 'use_snp_selection': True, 'num_snps': 43929}. Best is trial 135 with value: 0.3033334111480429.
[I 2025-12-09 03:33:41,199] Trial 139 finished with value: 0.29814617143218924 and parameters: {'model_type': 'graphsage', 'hidden_dims': '[256, 128]', 'dropout': 0.1851840168021423, 'batch_norm': False, 'sage_aggr': 'max', 'sage_normalize': False, 'sage_project': False, 'lr': 2.293939319985429e-05, 'weight_decay': 5.778346172810275e-07, 'epochs': 276, 'loss': 'mse', 'optimizer': 'adam', 'graph_mode': 'cutoff', 'cutoff': 0.4137290797529242, 'grm_norm': 'none', 'self_loops': False, 'use_snp_selection': True, 'num_snps': 40420}. Best is trial 135 with value: 0.3033334111480429.
[I 2025-12-09 03:36:37,520] Trial 140 finished with value: 0.2943525312659058 and parameters: {'model_type': 'graphsage', 'hidden_dims': '[256, 128]', 'dropout': 0.19923624684075827, 'batch_norm': False, 'sage_aggr': 'max', 'sage_normalize': False, 'sage_project': False, 'lr': 2.3032836310391916e-05, 'weight_decay': 5.735374957531847e-07, 'epochs': 275, 'loss': 'mse', 'optimizer': 'adam', 'graph_mode': 'cutoff', 'cutoff': 0.40724268052927676, 'grm_norm': 'none', 'self_loops': False, 'use_snp_selection': True, 'num_snps': 41296}. Best is trial 135 with value: 0.3033334111480429.
[I 2025-12-09 03:39:33,960] Trial 141 finished with value: 0.29802479141323945 and parameters: {'model_type': 'graphsage', 'hidden_dims': '[256, 128]', 'dropout': 0.16495733495420117, 'batch_norm': False, 'sage_aggr': 'max', 'sage_normalize': False, 'sage_project': False, 'lr': 1.2479960425405357e-05, 'weight_decay': 3.5864540427266007e-07, 'epochs': 270, 'loss': 'mse', 'optimizer': 'adam', 'graph_mode': 'cutoff', 'cutoff': 0.3981108359093477, 'grm_norm': 'none', 'self_loops': False, 'use_snp_selection': True, 'num_snps': 40179}. Best is trial 135 with value: 0.3033334111480429.
[I 2025-12-09 03:42:24,728] Trial 142 finished with value: 0.29478266604953257 and parameters: {'model_type': 'graphsage', 'hidden_dims': '[256, 128]', 'dropout': 0.1784647690361912, 'batch_norm': False, 'sage_aggr': 'max', 'sage_normalize': False, 'sage_project': False, 'lr': 1.2081207249630599e-05, 'weight_decay': 3.745169971455631e-07, 'epochs': 266, 'loss': 'mse', 'optimizer': 'adam', 'graph_mode': 'cutoff', 'cutoff': 0.3916310103681615, 'grm_norm': 'none', 'self_loops': False, 'use_snp_selection': True, 'num_snps': 39854}. Best is trial 135 with value: 0.3033334111480429.
[I 2025-12-09 03:46:09,439] Trial 143 finished with value: 0.2976666601004557 and parameters: {'model_type': 'graphsage', 'hidden_dims': '[256, 128]', 'dropout': 0.15732060664579992, 'batch_norm': False, 'sage_aggr': 'max', 'sage_normalize': False, 'sage_project': False, 'lr': 2.136937911752985e-05, 'weight_decay': 3.251637380009344e-07, 'epochs': 281, 'loss': 'mse', 'optimizer': 'adam', 'graph_mode': 'cutoff', 'cutoff': 0.34600789379865005, 'grm_norm': 'none', 'self_loops': False, 'use_snp_selection': True, 'num_snps': 43857}. Best is trial 135 with value: 0.3033334111480429.
[I 2025-12-09 03:49:03,415] Trial 144 finished with value: 0.30023175953937503 and parameters: {'model_type': 'graphsage', 'hidden_dims': '[256, 128]', 'dropout': 0.16316384622570523, 'batch_norm': False, 'sage_aggr': 'max', 'sage_normalize': False, 'sage_project': False, 'lr': 1.691555697461903e-05, 'weight_decay': 5.520554860148751e-07, 'epochs': 272, 'loss': 'mse', 'optimizer': 'adam', 'graph_mode': 'cutoff', 'cutoff': 0.3805900745278248, 'grm_norm': 'none', 'self_loops': False, 'use_snp_selection': True, 'num_snps': 39040}. Best is trial 135 with value: 0.3033334111480429.
[I 2025-12-09 03:52:04,952] Trial 145 finished with value: 0.29960233968970346 and parameters: {'model_type': 'graphsage', 'hidden_dims': '[256, 128]', 'dropout': 0.14484464669013178, 'batch_norm': False, 'sage_aggr': 'max', 'sage_normalize': False, 'sage_project': False, 'lr': 1.6443005421172844e-05, 'weight_decay': 4.3957735831509284e-07, 'epochs': 271, 'loss': 'mse', 'optimizer': 'adam', 'graph_mode': 'cutoff', 'cutoff': 0.3705632565485798, 'grm_norm': 'none', 'self_loops': False, 'use_snp_selection': True, 'num_snps': 39347}. Best is trial 135 with value: 0.3033334111480429.
[I 2025-12-09 03:55:03,124] Trial 146 finished with value: 0.29295650271122364 and parameters: {'model_type': 'graphsage', 'hidden_dims': '[256, 128]', 'dropout': 0.11926412436520273, 'batch_norm': False, 'sage_aggr': 'max', 'sage_normalize': False, 'sage_project': False, 'lr': 1.854800755714508e-05, 'weight_decay': 2.5340264089493216e-07, 'epochs': 277, 'loss': 'mse', 'optimizer': 'adam', 'graph_mode': 'cutoff', 'cutoff': 0.33347726419380974, 'grm_norm': 'none', 'self_loops': False, 'use_snp_selection': True, 'num_snps': 35513}. Best is trial 135 with value: 0.3033334111480429.
