[I 2025-12-10 08:12:21,491] Trial 65 finished with value: 0.29272823074333615 and parameters: {'model_type': 'graphsage', 'hidden_dims': '[128, 64]', 'dropout': 0.5302862628723578, 'batch_norm': False, 'sage_aggr': 'max', 'sage_normalize': False, 'sage_project': False, 'lr': 1.57564473975746e-05, 'weight_decay': 3.150647105834902e-06, 'epochs': 201, 'loss': 'mse', 'optimizer': 'adam', 'graph_mode': 'cutoff', 'cutoff': 0.37007851343251585, 'grm_norm': 'cosine_then_gcn', 'self_loops': False, 'use_snp_selection': True, 'num_snps': 20189}. Best is trial 35 with value: 0.3015295099119898.
[I 2025-12-10 08:13:06,781] Trial 66 finished with value: 0.296961952123985 and parameters: {'model_type': 'graphsage', 'hidden_dims': '[512, 256]', 'dropout': 0.4888448422018771, 'batch_norm': False, 'sage_aggr': 'max', 'sage_normalize': False, 'sage_project': False, 'lr': 4.402228424951221e-05, 'weight_decay': 1.334304402640092e-05, 'epochs': 163, 'loss': 'mse', 'optimizer': 'adam', 'graph_mode': 'cutoff', 'cutoff': 0.3994864183745348, 'grm_norm': 'cosine_then_gcn', 'self_loops': False, 'use_snp_selection': True, 'num_snps': 10611}. Best is trial 35 with value: 0.3015295099119898.
[I 2025-12-10 08:13:38,667] Trial 67 finished with value: 0.23819249919407567 and parameters: {'model_type': 'graphsage', 'hidden_dims': '[256, 128, 64]', 'dropout': 0.4543391997428288, 'batch_norm': True, 'sage_aggr': 'max', 'sage_normalize': True, 'sage_project': False, 'lr': 7.599898892782697e-05, 'weight_decay': 9.28313493860228e-05, 'epochs': 236, 'loss': 'mae', 'optimizer': 'adam', 'graph_mode': 'cutoff', 'cutoff': 0.4679143037287319, 'grm_norm': 'cosine', 'self_loops': False, 'use_snp_selection': True, 'num_snps': 4484}. Best is trial 35 with value: 0.3015295099119898.
[I 2025-12-10 08:17:17,363] Trial 68 finished with value: 0.28110112098149587 and parameters: {'model_type': 'graphsage', 'hidden_dims': '[512, 256]', 'dropout': 0.3505050879305923, 'batch_norm': False, 'sage_aggr': 'max', 'sage_normalize': False, 'sage_project': False, 'lr': 1.0060790862842785e-05, 'weight_decay': 2.3772979616175544e-05, 'epochs': 180, 'loss': 'mse', 'optimizer': 'adam', 'graph_mode': 'knn', 'knn_k': 8, 'weighted_edges': True, 'symmetrize_mode': 'union', 'self_loops': True, 'use_snp_selection': False}. Best is trial 35 with value: 0.3015295099119898.
[I 2025-12-10 08:19:05,582] Trial 69 finished with value: 0.2853848693652723 and parameters: {'model_type': 'graphsage', 'hidden_dims': '[512, 128]', 'dropout': 0.5879562120646379, 'batch_norm': False, 'sage_aggr': 'max', 'sage_normalize': False, 'sage_project': False, 'lr': 2.407591673741915e-05, 'weight_decay': 9.970375670513551e-06, 'epochs': 220, 'loss': 'mse', 'optimizer': 'adam', 'graph_mode': 'cutoff', 'cutoff': 0.8982154358987493, 'grm_norm': 'none', 'self_loops': False, 'use_snp_selection': True, 'num_snps': 37864}. Best is trial 35 with value: 0.3015295099119898.
[I 2025-12-10 08:22:24,145] Trial 70 finished with value: 0.01885595411782487 and parameters: {'model_type': 'graphsage', 'hidden_dims': '[512, 64]', 'dropout': 0.5464102231435781, 'batch_norm': False, 'sage_aggr': 'max', 'sage_normalize': False, 'sage_project': False, 'lr': 0.00010563192130208542, 'weight_decay': 4.130899648463359e-05, 'epochs': 168, 'loss': 'mse', 'optimizer': 'adam', 'graph_mode': 'cutoff', 'cutoff': 0.4234461955552272, 'grm_norm': 'gcn', 'self_loops': False, 'use_snp_selection': True, 'num_snps': 55497}. Best is trial 35 with value: 0.3015295099119898.
[I 2025-12-10 08:23:06,826] Trial 71 finished with value: 0.2929732681261727 and parameters: {'model_type': 'graphsage', 'hidden_dims': '[512, 256]', 'dropout': 0.4869889880587624, 'batch_norm': False, 'sage_aggr': 'max', 'sage_normalize': False, 'sage_project': False, 'lr': 4.6199986934455916e-05, 'weight_decay': 1.540403389451939e-05, 'epochs': 156, 'loss': 'mse', 'optimizer': 'adam', 'graph_mode': 'cutoff', 'cutoff': 0.4034782396154162, 'grm_norm': 'cosine_then_gcn', 'self_loops': False, 'use_snp_selection': True, 'num_snps': 9791}. Best is trial 35 with value: 0.3015295099119898.
[I 2025-12-10 08:23:53,495] Trial 72 finished with value: 0.2949162636371011 and parameters: {'model_type': 'graphsage', 'hidden_dims': '[512, 256]', 'dropout': 0.46942721392880216, 'batch_norm': False, 'sage_aggr': 'max', 'sage_normalize': False, 'sage_project': False, 'lr': 1.8901934811130672e-05, 'weight_decay': 4.285151982682876e-06, 'epochs': 162, 'loss': 'mse', 'optimizer': 'adam', 'graph_mode': 'cutoff', 'cutoff': 0.35020738737348006, 'grm_norm': 'cosine_then_gcn', 'self_loops': False, 'use_snp_selection': True, 'num_snps': 10578}. Best is trial 35 with value: 0.3015295099119898.
[I 2025-12-10 08:25:01,725] Trial 73 finished with value: 0.29493567408633004 and parameters: {'model_type': 'graphsage', 'hidden_dims': '[512, 256]', 'dropout': 0.43980472565829226, 'batch_norm': False, 'sage_aggr': 'max', 'sage_normalize': False, 'sage_project': False, 'lr': 3.167609953306859e-05, 'weight_decay': 1.7150340519814064e-05, 'epochs': 186, 'loss': 'mse', 'optimizer': 'adam', 'graph_mode': 'cutoff', 'cutoff': 0.39151842852836927, 'grm_norm': 'cosine_then_gcn', 'self_loops': False, 'use_snp_selection': True, 'num_snps': 17843}. Best is trial 35 with value: 0.3015295099119898.
[I 2025-12-10 08:26:02,560] Trial 74 finished with value: 0.29116274834203537 and parameters: {'model_type': 'graphsage', 'hidden_dims': '[512, 256]', 'dropout': 0.5052195756583726, 'batch_norm': False, 'sage_aggr': 'max', 'sage_normalize': False, 'sage_project': False, 'lr': 1.388494373070874e-05, 'weight_decay': 7.756001337703967e-06, 'epochs': 205, 'loss': 'mse', 'optimizer': 'adam', 'graph_mode': 'cutoff', 'cutoff': 0.31349087172367496, 'grm_norm': 'cosine_then_gcn', 'self_loops': False, 'use_snp_selection': True, 'num_snps': 12474}. Best is trial 35 with value: 0.3015295099119898.
[I 2025-12-10 08:26:51,480] Trial 75 finished with value: 0.2958547381868451 and parameters: {'model_type': 'graphsage', 'hidden_dims': '[512, 256]', 'dropout': 0.5668005059441407, 'batch_norm': False, 'sage_aggr': 'max', 'sage_normalize': False, 'sage_project': False, 'lr': 1.720332118711053e-05, 'weight_decay': 2.801314993394908e-05, 'epochs': 146, 'loss': 'mse', 'optimizer': 'adam', 'graph_mode': 'cutoff', 'cutoff': 0.43892928799632924, 'grm_norm': 'cosine_then_gcn', 'self_loops': False, 'use_snp_selection': True, 'num_snps': 13642}. Best is trial 35 with value: 0.3015295099119898.
[I 2025-12-10 08:27:33,728] Trial 76 finished with value: 0.2804796179433811 and parameters: {'model_type': 'graphsage', 'hidden_dims': '[512, 256]', 'dropout': 0.5212098992074845, 'batch_norm': False, 'sage_aggr': 'mean', 'sage_normalize': False, 'sage_project': False, 'lr': 3.928524944682087e-05, 'weight_decay': 0.0001049266817300017, 'epochs': 174, 'loss': 'mse', 'optimizer': 'adam', 'graph_mode': 'cutoff', 'cutoff': 0.558269112997967, 'grm_norm': 'cosine_then_gcn', 'self_loops': False, 'use_snp_selection': True, 'num_snps': 11231}. Best is trial 35 with value: 0.3015295099119898.
[I 2025-12-10 08:28:05,596] Trial 77 finished with value: 0.27384462457212333 and parameters: {'model_type': 'graphsage', 'hidden_dims': '[512, 256]', 'dropout': 0.49689840893637627, 'batch_norm': False, 'sage_aggr': 'max', 'sage_normalize': False, 'sage_project': False, 'lr': 2.8034504070738644e-05, 'weight_decay': 0.00015930012675753825, 'epochs': 130, 'loss': 'mse', 'optimizer': 'adam', 'graph_mode': 'cutoff', 'cutoff': 0.8511178814306282, 'grm_norm': 'cosine', 'self_loops': False, 'use_snp_selection': True, 'num_snps': 7326}. Best is trial 35 with value: 0.3015295099119898.
[I 2025-12-10 08:30:12,222] Trial 78 finished with value: 0.22734471824929256 and parameters: {'model_type': 'graphsage', 'hidden_dims': '[128, 64]', 'dropout': 0.5335455393267448, 'batch_norm': True, 'sage_aggr': 'max', 'sage_normalize': True, 'sage_project': False, 'lr': 5.6018304083004936e-05, 'weight_decay': 1.3332500177720514e-05, 'epochs': 349, 'loss': 'mse', 'optimizer': 'adam', 'graph_mode': 'cutoff', 'cutoff': 0.36977916938276356, 'grm_norm': 'cosine_then_gcn', 'self_loops': False, 'use_snp_selection': False}. Best is trial 35 with value: 0.3015295099119898.
[I 2025-12-10 08:31:46,703] Trial 79 finished with value: 0.2743609018798297 and parameters: {'model_type': 'graphsage', 'hidden_dims': '[256, 128]', 'dropout': 0.5596122441863127, 'batch_norm': False, 'sage_aggr': 'max', 'sage_normalize': False, 'sage_project': False, 'lr': 2.1823886584743487e-05, 'weight_decay': 1.0179859888867518e-05, 'epochs': 194, 'loss': 'mae', 'optimizer': 'adam', 'graph_mode': 'cutoff', 'cutoff': 0.4077079732566199, 'grm_norm': 'cosine', 'self_loops': True, 'use_snp_selection': True, 'num_snps': 29724}. Best is trial 35 with value: 0.3015295099119898.
[I 2025-12-10 08:33:37,334] Trial 80 finished with value: 0.27046459153741553 and parameters: {'model_type': 'graphsage', 'hidden_dims': '[512, 256]', 'dropout': 0.4138703423942316, 'batch_norm': False, 'sage_aggr': 'max', 'sage_normalize': False, 'sage_project': False, 'lr': 1.2273925805730021e-05, 'weight_decay': 4.607212548225565e-05, 'epochs': 112, 'loss': 'mse', 'optimizer': 'adam', 'graph_mode': 'knn', 'knn_k': 10, 'weighted_edges': True, 'symmetrize_mode': 'mutual', 'self_loops': False, 'use_snp_selection': True, 'num_snps': 34740}. Best is trial 35 with value: 0.3015295099119898.
[I 2025-12-10 08:34:30,729] Trial 81 finished with value: 0.2954774051280728 and parameters: {'model_type': 'graphsage', 'hidden_dims': '[512, 256]', 'dropout': 0.5136258508866729, 'batch_norm': False, 'sage_aggr': 'max', 'sage_normalize': False, 'sage_project': False, 'lr': 2.2965800915858683e-05, 'weight_decay': 1.986217602993544e-05, 'epochs': 211, 'loss': 'mse', 'optimizer': 'adam', 'graph_mode': 'cutoff', 'cutoff': 0.4185121860067605, 'grm_norm': 'cosine_then_gcn', 'self_loops': False, 'use_snp_selection': True, 'num_snps': 11316}. Best is trial 35 with value: 0.3015295099119898.
[I 2025-12-10 08:35:43,828] Trial 82 finished with value: 0.2885115276767859 and parameters: {'model_type': 'graphsage', 'hidden_dims': '[512, 256]', 'dropout': 0.49885729835326376, 'batch_norm': False, 'sage_aggr': 'max', 'sage_normalize': False, 'sage_project': False, 'lr': 0.00021390479313388165, 'weight_decay': 5.801253155163901e-05, 'epochs': 250, 'loss': 'mse', 'optimizer': 'adam', 'graph_mode': 'cutoff', 'cutoff': 0.33112106084342957, 'grm_norm': 'cosine_then_gcn', 'self_loops': False, 'use_snp_selection': True, 'num_snps': 14511}. Best is trial 35 with value: 0.3015295099119898.
[I 2025-12-10 08:38:44,165] Trial 83 finished with value: 0.28800525452860376 and parameters: {'model_type': 'graphsage', 'hidden_dims': '[512, 256]', 'dropout': 0.48839942848474294, 'batch_norm': False, 'sage_aggr': 'max', 'sage_normalize': False, 'sage_project': False, 'lr': 1.6112978924149262e-05, 'weight_decay': 1.6949421243699404e-05, 'epochs': 215, 'loss': 'mse', 'optimizer': 'adam', 'graph_mode': 'cutoff', 'cutoff': 0.47318354877692753, 'grm_norm': 'cosine_then_gcn', 'self_loops': False, 'use_snp_selection': True, 'num_snps': 43335}. Best is trial 35 with value: 0.3015295099119898.
[I 2025-12-10 08:40:01,928] Trial 84 finished with value: 0.2900885556097886 and parameters: {'model_type': 'graphsage', 'hidden_dims': '[512, 256]', 'dropout': 0.5806436844913863, 'batch_norm': False, 'sage_aggr': 'max', 'sage_normalize': False, 'sage_project': False, 'lr': 2.0761640564428567e-05, 'weight_decay': 3.577277141041291e-05, 'epochs': 226, 'loss': 'mse', 'optimizer': 'adam', 'graph_mode': 'cutoff', 'cutoff': 0.3601478264984166, 'grm_norm': 'cosine_then_gcn', 'self_loops': False, 'use_snp_selection': True, 'num_snps': 16564}. Best is trial 35 with value: 0.3015295099119898.
[I 2025-12-10 08:40:48,299] Trial 85 finished with value: 0.2887043876543538 and parameters: {'model_type': 'graphsage', 'hidden_dims': '[512, 256]', 'dropout': 0.5423435730969912, 'batch_norm': False, 'sage_aggr': 'max', 'sage_normalize': False, 'sage_project': False, 'lr': 3.717904177782894e-05, 'weight_decay': 2.4557622196393463e-05, 'epochs': 182, 'loss': 'mse', 'optimizer': 'adam', 'graph_mode': 'cutoff', 'cutoff': 0.2946433137461426, 'grm_norm': 'cosine', 'self_loops': False, 'use_snp_selection': True, 'num_snps': 8328}. Best is trial 35 with value: 0.3015295099119898.
[I 2025-12-10 08:41:39,606] Trial 86 finished with value: 0.2852744929361889 and parameters: {'model_type': 'graphsage', 'hidden_dims': '[256, 128, 64]', 'dropout': 0.46719231916726567, 'batch_norm': False, 'sage_aggr': 'max', 'sage_normalize': False, 'sage_project': False, 'lr': 2.8308624740027676e-05, 'weight_decay': 5.322449339567981e-06, 'epochs': 153, 'loss': 'mse', 'optimizer': 'adam', 'graph_mode': 'cutoff', 'cutoff': 0.4003054161007088, 'grm_norm': 'cosine_then_gcn', 'self_loops': False, 'use_snp_selection': True, 'num_snps': 18971}. Best is trial 35 with value: 0.3015295099119898.
[I 2025-12-10 08:42:43,219] Trial 87 finished with value: 0.2855131100578093 and parameters: {'model_type': 'graphsage', 'hidden_dims': '[512, 256]', 'dropout': 0.5213281583219732, 'batch_norm': False, 'sage_aggr': 'mean', 'sage_normalize': False, 'sage_project': False, 'lr': 1.2003252623488479e-05, 'weight_decay': 8.929108802291352e-06, 'epochs': 169, 'loss': 'mse', 'optimizer': 'adam', 'graph_mode': 'cutoff', 'cutoff': 0.5183337939862283, 'grm_norm': 'cosine', 'self_loops': False, 'use_snp_selection': True, 'num_snps': 21784}. Best is trial 35 with value: 0.3015295099119898.
[I 2025-12-10 08:44:20,056] Trial 88 finished with value: 0.0 and parameters: {'model_type': 'graphsage', 'hidden_dims': '[512, 64]', 'dropout': 0.599261204968926, 'batch_norm': False, 'sage_aggr': 'max', 'sage_normalize': False, 'sage_project': False, 'lr': 0.0017446772814460455, 'weight_decay': 1.2074937761458616e-05, 'epochs': 191, 'loss': 'mse', 'optimizer': 'adam', 'graph_mode': 'cutoff', 'cutoff': 0.4431390548199688, 'grm_norm': 'none', 'self_loops': False, 'use_snp_selection': True, 'num_snps': 25319}. Best is trial 35 with value: 0.3015295099119898.
[I 2025-12-10 08:44:55,593] Trial 89 finished with value: 0.27970576515623274 and parameters: {'model_type': 'graphsage', 'hidden_dims': '[512, 256]', 'dropout': 0.5547884207565461, 'batch_norm': True, 'sage_aggr': 'max', 'sage_normalize': True, 'sage_project': False, 'lr': 1.4143991578456e-05, 'weight_decay': 2.08138014382665e-05, 'epochs': 161, 'loss': 'mse', 'optimizer': 'adam', 'graph_mode': 'cutoff', 'cutoff': 0.374321449444842, 'grm_norm': 'gcn', 'self_loops': False, 'use_snp_selection': True, 'num_snps': 5758}. Best is trial 35 with value: 0.3015295099119898.
[I 2025-12-10 08:47:13,922] Trial 90 finished with value: 0.26081829546915675 and parameters: {'model_type': 'graphsage', 'hidden_dims': '[512, 128]', 'dropout': 0.5736924522547355, 'batch_norm': False, 'sage_aggr': 'max', 'sage_normalize': False, 'sage_project': False, 'lr': 1.7680571090182092e-05, 'weight_decay': 2.001049925502939e-07, 'epochs': 199, 'loss': 'mae', 'optimizer': 'adam', 'graph_mode': 'cutoff', 'cutoff': 0.49080124751014353, 'grm_norm': 'cosine', 'self_loops': False, 'use_snp_selection': False}. Best is trial 35 with value: 0.3015295099119898.
[I 2025-12-10 08:49:17,047] Trial 91 finished with value: 0.28997806018061045 and parameters: {'model_type': 'graphsage', 'hidden_dims': '[512, 256]', 'dropout': 0.5706529105043233, 'batch_norm': False, 'sage_aggr': 'max', 'sage_normalize': False, 'sage_project': False, 'lr': 1.5879415440060216e-05, 'weight_decay': 4.568849792176656e-05, 'epochs': 179, 'loss': 'mse', 'optimizer': 'adam', 'graph_mode': 'cutoff', 'cutoff': 0.4018728463054961, 'grm_norm': 'cosine', 'self_loops': False, 'use_snp_selection': True, 'num_snps': 33355}. Best is trial 35 with value: 0.3015295099119898.
[I 2025-12-10 08:51:10,241] Trial 92 finished with value: 0.2925589692637303 and parameters: {'model_type': 'graphsage', 'hidden_dims': '[512, 256]', 'dropout': 0.5877622749337418, 'batch_norm': False, 'sage_aggr': 'max', 'sage_normalize': False, 'sage_project': False, 'lr': 1.3865907112456054e-05, 'weight_decay': 8.228155065868442e-05, 'epochs': 183, 'loss': 'mse', 'optimizer': 'adam', 'graph_mode': 'cutoff', 'cutoff': 0.3850352974857363, 'grm_norm': 'cosine', 'self_loops': False, 'use_snp_selection': True, 'num_snps': 28930}. Best is trial 35 with value: 0.3015295099119898.
[I 2025-12-10 08:52:10,512] Trial 93 finished with value: 0.29574907027270325 and parameters: {'model_type': 'graphsage', 'hidden_dims': '[512, 256]', 'dropout': 0.5432935940931469, 'batch_norm': False, 'sage_aggr': 'max', 'sage_normalize': False, 'sage_project': False, 'lr': 1.1039797710146598e-05, 'weight_decay': 5.319661438344515e-05, 'epochs': 206, 'loss': 'mse', 'optimizer': 'adam', 'graph_mode': 'cutoff', 'cutoff': 0.34024029467922845, 'grm_norm': 'cosine', 'self_loops': False, 'use_snp_selection': True, 'num_snps': 13103}. Best is trial 35 with value: 0.3015295099119898.
[I 2025-12-10 08:53:45,451] Trial 94 finished with value: 0.29852021739299983 and parameters: {'model_type': 'graphsage', 'hidden_dims': '[512, 256]', 'dropout': 0.28030581290297063, 'batch_norm': False, 'sage_aggr': 'max', 'sage_normalize': False, 'sage_project': False, 'lr': 4.542166744071997e-05, 'weight_decay': 0.0002923290405896214, 'epochs': 175, 'loss': 'mse', 'optimizer': 'adam', 'graph_mode': 'cutoff', 'cutoff': 0.4186614064904359, 'grm_norm': 'cosine', 'self_loops': False, 'use_snp_selection': True, 'num_snps': 27254}. Best is trial 35 with value: 0.3015295099119898.
[I 2025-12-10 08:54:39,590] Trial 95 finished with value: 0.29492522101615315 and parameters: {'model_type': 'graphsage', 'hidden_dims': '[512, 256]', 'dropout': 0.21571997845190516, 'batch_norm': False, 'sage_aggr': 'max', 'sage_normalize': False, 'sage_project': False, 'lr': 4.633991150381093e-05, 'weight_decay': 0.00032338547008749625, 'epochs': 166, 'loss': 'mse', 'optimizer': 'adam', 'graph_mode': 'cutoff', 'cutoff': 0.43086928048588735, 'grm_norm': 'cosine', 'self_loops': False, 'use_snp_selection': True, 'num_snps': 14505}. Best is trial 35 with value: 0.3015295099119898.
[I 2025-12-10 08:56:02,364] Trial 96 finished with value: 0.3011097072457893 and parameters: {'model_type': 'graphsage', 'hidden_dims': '[512, 256]', 'dropout': 0.27262320141072566, 'batch_norm': False, 'sage_aggr': 'max', 'sage_normalize': False, 'sage_project': False, 'lr': 2.50155804091314e-05, 'weight_decay': 2.364321881417573e-06, 'epochs': 140, 'loss': 'mse', 'optimizer': 'adam', 'graph_mode': 'cutoff', 'cutoff': 0.41199071338601967, 'grm_norm': 'cosine', 'self_loops': True, 'use_snp_selection': True, 'num_snps': 26550}. Best is trial 35 with value: 0.3015295099119898.
[I 2025-12-10 08:57:22,511] Trial 97 finished with value: 0.11462053939654879 and parameters: {'model_type': 'graphsage', 'hidden_dims': '[512, 256]', 'dropout': 0.20510539388411198, 'batch_norm': False, 'sage_aggr': 'max', 'sage_normalize': False, 'sage_project': False, 'lr': 0.00041227095855809787, 'weight_decay': 0.0005948101541371694, 'epochs': 140, 'loss': 'mse', 'optimizer': 'adam', 'graph_mode': 'cutoff', 'cutoff': 0.4572099020324432, 'grm_norm': 'cosine', 'self_loops': True, 'use_snp_selection': True, 'num_snps': 27220}. Best is trial 35 with value: 0.3015295099119898.
[I 2025-12-10 08:59:52,427] Trial 98 finished with value: 0.28078193742689 and parameters: {'model_type': 'graphsage', 'hidden_dims': '[512, 256]', 'dropout': 0.2843494736241849, 'batch_norm': False, 'sage_aggr': 'max', 'sage_normalize': False, 'sage_project': False, 'lr': 6.183063289878336e-05, 'weight_decay': 2.09546503357079e-06, 'epochs': 150, 'loss': 'mse', 'optimizer': 'adam', 'graph_mode': 'knn', 'knn_k': 6, 'weighted_edges': False, 'symmetrize_mode': 'union', 'self_loops': True, 'use_snp_selection': True, 'num_snps': 30850}. Best is trial 35 with value: 0.3015295099119898.
[I 2025-12-10 09:01:34,376] Trial 99 finished with value: 0.2941051411539778 and parameters: {'model_type': 'graphsage', 'hidden_dims': '[512, 256]', 'dropout': 0.2995658092045888, 'batch_norm': False, 'sage_aggr': 'max', 'sage_normalize': False, 'sage_project': False, 'lr': 2.6252529008365845e-05, 'weight_decay': 3.7313161215482103e-07, 'epochs': 176, 'loss': 'mse', 'optimizer': 'adam', 'graph_mode': 'cutoff', 'cutoff': 0.35691447966460166, 'grm_norm': 'cosine', 'self_loops': True, 'use_snp_selection': True, 'num_snps': 25973}. Best is trial 35 with value: 0.3015295099119898.
[I 2025-12-10 09:02:31,078] Trial 100 finished with value: 0.2912066754767722 and parameters: {'model_type': 'graphsage', 'hidden_dims': '[256, 128]', 'dropout': 0.2294889357042858, 'batch_norm': False, 'sage_aggr': 'mean', 'sage_normalize': False, 'sage_project': False, 'lr': 8.067491030422808e-05, 'weight_decay': 6.888779739806159e-06, 'epochs': 128, 'loss': 'mse', 'optimizer': 'adam', 'graph_mode': 'cutoff', 'cutoff': 0.32453300363879, 'grm_norm': 'cosine', 'self_loops': True, 'use_snp_selection': True, 'num_snps': 23037}. Best is trial 35 with value: 0.3015295099119898.
[I 2025-12-10 09:03:22,525] Trial 101 finished with value: 0.29593517322534946 and parameters: {'model_type': 'graphsage', 'hidden_dims': '[512, 256]', 'dropout': 0.2573269257069113, 'batch_norm': False, 'sage_aggr': 'max', 'sage_normalize': False, 'sage_project': False, 'lr': 2.3240016196183905e-05, 'weight_decay': 4.479079854546999e-06, 'epochs': 189, 'loss': 'mse', 'optimizer': 'adam', 'graph_mode': 'cutoff', 'cutoff': 0.41712866094383055, 'grm_norm': 'cosine', 'self_loops': True, 'use_snp_selection': True, 'num_snps': 11798}. Best is trial 35 with value: 0.3015295099119898.
