[I 2025-12-06 07:31:36,811] Trial 61 finished with value: 0.23168780393048122 and parameters: {'model_type': 'graphsage', 'hidden_dims': '[512, 64]', 'dropout': 0.2648049890652391, 'batch_norm': True, 'sage_aggr': 'max', 'sage_normalize': False, 'sage_project': False, 'lr': 0.00012191988260229424, 'weight_decay': 0.0003015712532913505, 'epochs': 130, 'loss': 'mae', 'optimizer': 'adam', 'graph_mode': 'cutoff', 'cutoff': 0.4135256382388774, 'grm_norm': 'gcn', 'self_loops': False, 'use_snp_selection': True, 'num_snps': 27687, 'graphsage_batch_size': 8}. Best is trial 55 with value: 0.2351501566550843.
[I 2025-12-06 07:32:03,786] Trial 62 finished with value: 0.197931176209219 and parameters: {'model_type': 'graphsage', 'hidden_dims': '[512, 64]', 'dropout': 0.26162357041419254, 'batch_norm': True, 'sage_aggr': 'max', 'sage_normalize': False, 'sage_project': False, 'lr': 0.00012113862395936315, 'weight_decay': 0.00020613268225363018, 'epochs': 45, 'loss': 'mae', 'optimizer': 'adam', 'graph_mode': 'cutoff', 'cutoff': 0.41732903190860954, 'grm_norm': 'gcn', 'self_loops': False, 'use_snp_selection': True, 'num_snps': 18806, 'graphsage_batch_size': 8}. Best is trial 55 with value: 0.2351501566550843.
[I 2025-12-06 07:33:04,759] Trial 63 finished with value: 0.21446518153505717 and parameters: {'model_type': 'graphsage', 'hidden_dims': '[512, 64]', 'dropout': 0.20184632526478774, 'batch_norm': True, 'sage_aggr': 'max', 'sage_normalize': False, 'sage_project': False, 'lr': 5.0370040976863694e-05, 'weight_decay': 0.00014435384316262311, 'epochs': 131, 'loss': 'mae', 'optimizer': 'adam', 'graph_mode': 'cutoff', 'cutoff': 0.419170280741492, 'grm_norm': 'gcn', 'self_loops': False, 'use_snp_selection': True, 'num_snps': 27022, 'graphsage_batch_size': 128}. Best is trial 55 with value: 0.2351501566550843.
[I 2025-12-06 07:34:14,041] Trial 64 finished with value: 0.20475498956212762 and parameters: {'model_type': 'graphsage', 'hidden_dims': '[512, 64]', 'dropout': 0.296729295979279, 'batch_norm': True, 'sage_aggr': 'max', 'sage_normalize': False, 'sage_project': False, 'lr': 0.00020890054715196692, 'weight_decay': 0.00026766926982357, 'epochs': 115, 'loss': 'mae', 'optimizer': 'adam', 'graph_mode': 'cutoff', 'cutoff': 0.3084517350181221, 'grm_norm': 'gcn', 'self_loops': False, 'use_snp_selection': True, 'num_snps': 28262, 'graphsage_batch_size': 8}. Best is trial 55 with value: 0.2351501566550843.
[I 2025-12-06 07:35:29,409] Trial 65 finished with value: 0.21059730664379575 and parameters: {'model_type': 'graphsage', 'hidden_dims': '[512, 64]', 'dropout': 0.21792077070365, 'batch_norm': True, 'sage_aggr': 'max', 'sage_normalize': False, 'sage_project': False, 'lr': 0.00012045816905957147, 'weight_decay': 0.0005536123027872181, 'epochs': 104, 'loss': 'mae', 'optimizer': 'adam', 'graph_mode': 'cutoff', 'cutoff': 0.21813161615703525, 'grm_norm': 'gcn', 'self_loops': False, 'use_snp_selection': True, 'num_snps': 23961, 'graphsage_batch_size': 8}. Best is trial 55 with value: 0.2351501566550843.
[I 2025-12-06 07:36:27,697] Trial 66 finished with value: 0.18196525589636464 and parameters: {'model_type': 'graphsage', 'hidden_dims': '[512, 64]', 'dropout': 0.18412655175005307, 'batch_norm': True, 'sage_aggr': 'max', 'sage_normalize': False, 'sage_project': False, 'lr': 2.6340703773704456e-05, 'weight_decay': 0.00010165953667127847, 'epochs': 122, 'loss': 'mae', 'optimizer': 'adam', 'graph_mode': 'cutoff', 'cutoff': 0.5041635676392698, 'grm_norm': 'gcn', 'self_loops': False, 'use_snp_selection': True, 'num_snps': 31185, 'graphsage_batch_size': 8}. Best is trial 55 with value: 0.2351501566550843.
[I 2025-12-06 07:37:40,103] Trial 67 finished with value: 0.21277830525247624 and parameters: {'model_type': 'graphsage', 'hidden_dims': '[512, 64]', 'dropout': 0.267555469882121, 'batch_norm': True, 'sage_aggr': 'max', 'sage_normalize': False, 'sage_project': False, 'lr': 9.486906100081355e-05, 'weight_decay': 0.0003396123091181936, 'epochs': 96, 'loss': 'mae', 'optimizer': 'adam', 'graph_mode': 'cutoff', 'cutoff': 0.46089944802912236, 'grm_norm': 'cosine_then_gcn', 'self_loops': False, 'use_snp_selection': False, 'graphsage_batch_size': 8}. Best is trial 55 with value: 0.2351501566550843.
[I 2025-12-06 07:38:18,000] Trial 68 finished with value: 0.17510301314220172 and parameters: {'model_type': 'graphsage', 'hidden_dims': '[512, 128]', 'dropout': 0.10684521815788817, 'batch_norm': True, 'sage_aggr': 'max', 'sage_normalize': False, 'sage_project': False, 'lr': 2.2491806706951137e-05, 'weight_decay': 6.576821881826094e-05, 'epochs': 136, 'loss': 'mae', 'optimizer': 'adam', 'graph_mode': 'cutoff', 'cutoff': 0.3942066782943066, 'grm_norm': 'gcn', 'self_loops': False, 'use_snp_selection': True, 'num_snps': 13624, 'graphsage_batch_size': 8}. Best is trial 55 with value: 0.2351501566550843.
[I 2025-12-06 07:38:52,371] Trial 69 finished with value: 0.20106926626803617 and parameters: {'model_type': 'graphsage', 'hidden_dims': '[256, 128, 64]', 'dropout': 0.14816608310155377, 'batch_norm': True, 'sage_aggr': 'max', 'sage_normalize': False, 'sage_project': False, 'lr': 6.987588563540777e-05, 'weight_decay': 0.0006530877636316606, 'epochs': 78, 'loss': 'mae', 'optimizer': 'adam', 'graph_mode': 'cutoff', 'cutoff': 0.4329797691375844, 'grm_norm': 'gcn', 'self_loops': False, 'use_snp_selection': True, 'num_snps': 25863, 'graphsage_batch_size': 8}. Best is trial 55 with value: 0.2351501566550843.
[I 2025-12-06 07:39:38,009] Trial 70 finished with value: 0.2186884668677073 and parameters: {'model_type': 'graphsage', 'hidden_dims': '[512, 64]', 'dropout': 0.24896534578876728, 'batch_norm': True, 'sage_aggr': 'max', 'sage_normalize': False, 'sage_project': False, 'lr': 4.180949949543685e-05, 'weight_decay': 0.0002137616997749546, 'epochs': 58, 'loss': 'mae', 'optimizer': 'adam', 'graph_mode': 'cutoff', 'cutoff': 0.3844475285455068, 'grm_norm': 'cosine', 'self_loops': False, 'use_snp_selection': True, 'num_snps': 34246, 'graphsage_batch_size': 8}. Best is trial 55 with value: 0.2351501566550843.
[I 2025-12-06 07:40:45,747] Trial 71 finished with value: 0.22139095905068315 and parameters: {'model_type': 'graphsage', 'hidden_dims': '[512, 64]', 'dropout': 0.2932030820167846, 'batch_norm': True, 'sage_aggr': 'max', 'sage_normalize': False, 'sage_project': False, 'lr': 0.00013413893507371714, 'weight_decay': 0.0003442799900030629, 'epochs': 108, 'loss': 'mae', 'optimizer': 'adam', 'graph_mode': 'cutoff', 'cutoff': 0.34416137990903306, 'grm_norm': 'gcn', 'self_loops': False, 'use_snp_selection': True, 'num_snps': 32330, 'graphsage_batch_size': 8}. Best is trial 55 with value: 0.2351501566550843.
[I 2025-12-06 07:41:50,487] Trial 72 finished with value: 0.22428155387420917 and parameters: {'model_type': 'graphsage', 'hidden_dims': '[512, 64]', 'dropout': 0.32779919279677855, 'batch_norm': True, 'sage_aggr': 'max', 'sage_normalize': False, 'sage_project': False, 'lr': 0.00018426341737464694, 'weight_decay': 0.00025680870464513155, 'epochs': 121, 'loss': 'mae', 'optimizer': 'adam', 'graph_mode': 'cutoff', 'cutoff': 0.36314944832317564, 'grm_norm': 'gcn', 'self_loops': False, 'use_snp_selection': True, 'num_snps': 28761, 'graphsage_batch_size': 8}. Best is trial 55 with value: 0.2351501566550843.
[I 2025-12-06 07:43:02,750] Trial 73 finished with value: 0.208630258095614 and parameters: {'model_type': 'graphsage', 'hidden_dims': '[512, 64]', 'dropout': 0.34826971429988984, 'batch_norm': True, 'sage_aggr': 'max', 'sage_normalize': False, 'sage_project': False, 'lr': 0.00010127376872630855, 'weight_decay': 0.00014699903594853119, 'epochs': 100, 'loss': 'mae', 'optimizer': 'adam', 'graph_mode': 'cutoff', 'cutoff': 0.30667539411338895, 'grm_norm': 'gcn', 'self_loops': False, 'use_snp_selection': True, 'num_snps': 33169, 'graphsage_batch_size': 128}. Best is trial 55 with value: 0.2351501566550843.
[I 2025-12-06 07:43:35,164] Trial 74 finished with value: 0.21239302030727103 and parameters: {'model_type': 'graphsage', 'hidden_dims': '[128, 64]', 'dropout': 0.2765162246444117, 'batch_norm': True, 'sage_aggr': 'max', 'sage_normalize': False, 'sage_project': False, 'lr': 0.00024574750217659164, 'weight_decay': 0.0003973997487909407, 'epochs': 141, 'loss': 'mae', 'optimizer': 'adam', 'graph_mode': 'cutoff', 'cutoff': 0.4812458324414264, 'grm_norm': 'gcn', 'self_loops': False, 'use_snp_selection': True, 'num_snps': 21067, 'graphsage_batch_size': 8}. Best is trial 55 with value: 0.2351501566550843.
[I 2025-12-06 07:44:19,690] Trial 75 finished with value: 0.21159142152061733 and parameters: {'model_type': 'graphsage', 'hidden_dims': '[512, 64]', 'dropout': 0.30349947600484084, 'batch_norm': True, 'sage_aggr': 'max', 'sage_normalize': False, 'sage_project': False, 'lr': 5.414155385948404e-05, 'weight_decay': 0.0001026238957279323, 'epochs': 91, 'loss': 'mse', 'optimizer': 'adam', 'graph_mode': 'cutoff', 'cutoff': 0.4171208772185039, 'grm_norm': 'gcn', 'self_loops': False, 'use_snp_selection': True, 'num_snps': 24393, 'graphsage_batch_size': 8}. Best is trial 55 with value: 0.2351501566550843.
[I 2025-12-06 07:45:03,105] Trial 76 finished with value: 0.21144418397572218 and parameters: {'model_type': 'graphsage', 'hidden_dims': '[512, 64]', 'dropout': 0.22834698870821935, 'batch_norm': True, 'sage_aggr': 'max', 'sage_normalize': False, 'sage_project': False, 'lr': 0.00013752033507409352, 'weight_decay': 0.000653974564621231, 'epochs': 67, 'loss': 'mae', 'optimizer': 'adam', 'graph_mode': 'cutoff', 'cutoff': 0.47858492837952077, 'grm_norm': 'cosine_then_gcn', 'self_loops': False, 'use_snp_selection': True, 'num_snps': 30619, 'graphsage_batch_size': 16}. Best is trial 55 with value: 0.2351501566550843.
[I 2025-12-06 07:46:07,702] Trial 77 finished with value: 0.2211617449660722 and parameters: {'model_type': 'graphsage', 'hidden_dims': '[512, 64]', 'dropout': 0.2556440077326393, 'batch_norm': True, 'sage_aggr': 'max', 'sage_normalize': False, 'sage_project': False, 'lr': 0.0001773839714037195, 'weight_decay': 0.0002579798787081132, 'epochs': 113, 'loss': 'mae', 'optimizer': 'adam', 'graph_mode': 'cutoff', 'cutoff': 0.32379165182445424, 'grm_norm': 'gcn', 'self_loops': False, 'use_snp_selection': True, 'num_snps': 28052, 'graphsage_batch_size': 8}. Best is trial 55 with value: 0.2351501566550843.
[I 2025-12-06 07:47:15,899] Trial 78 finished with value: 0.17367920716645094 and parameters: {'model_type': 'graphsage', 'hidden_dims': '[512, 64]', 'dropout': 0.2800464408960528, 'batch_norm': True, 'sage_aggr': 'max', 'sage_normalize': False, 'sage_project': False, 'lr': 8.141272256539627e-05, 'weight_decay': 0.00017382850097228344, 'epochs': 129, 'loss': 'mae', 'optimizer': 'adam', 'graph_mode': 'knn', 'knn_k': 2, 'weighted_edges': False, 'symmetrize_mode': 'union', 'self_loops': False, 'use_snp_selection': True, 'num_snps': 35300, 'graphsage_batch_size': 64}. Best is trial 55 with value: 0.2351501566550843.
[I 2025-12-06 07:47:54,709] Trial 79 finished with value: 0.17143037810909623 and parameters: {'model_type': 'graphsage', 'hidden_dims': '[256, 128, 64]', 'dropout': 0.3277048617565994, 'batch_norm': False, 'sage_aggr': 'max', 'sage_normalize': False, 'sage_project': False, 'lr': 6.108082850832835e-05, 'weight_decay': 4.3101021695122335e-05, 'epochs': 77, 'loss': 'mae', 'optimizer': 'adam', 'graph_mode': 'cutoff', 'cutoff': 0.44240895239924716, 'grm_norm': 'gcn', 'self_loops': False, 'use_snp_selection': True, 'num_snps': 30983, 'graphsage_batch_size': 8}. Best is trial 55 with value: 0.2351501566550843.
[I 2025-12-06 07:49:07,790] Trial 80 finished with value: 0.20795483626527692 and parameters: {'model_type': 'graphsage', 'hidden_dims': '[512, 64]', 'dropout': 0.2698625451009544, 'batch_norm': True, 'sage_aggr': 'max', 'sage_normalize': False, 'sage_project': False, 'lr': 0.00011541708860951035, 'weight_decay': 0.0007507821494591071, 'epochs': 90, 'loss': 'mae', 'optimizer': 'adam', 'graph_mode': 'cutoff', 'cutoff': 0.3697812351645417, 'grm_norm': 'gcn', 'self_loops': False, 'use_snp_selection': False, 'graphsage_batch_size': 8}. Best is trial 55 with value: 0.2351501566550843.
[I 2025-12-06 07:50:13,706] Trial 81 finished with value: 0.23078977282815435 and parameters: {'model_type': 'graphsage', 'hidden_dims': '[512, 64]', 'dropout': 0.3375743855130428, 'batch_norm': True, 'sage_aggr': 'max', 'sage_normalize': False, 'sage_project': False, 'lr': 0.00016617176439216985, 'weight_decay': 0.00026903348024435726, 'epochs': 122, 'loss': 'mae', 'optimizer': 'adam', 'graph_mode': 'cutoff', 'cutoff': 0.3613748714108735, 'grm_norm': 'gcn', 'self_loops': False, 'use_snp_selection': True, 'num_snps': 28822, 'graphsage_batch_size': 8}. Best is trial 55 with value: 0.2351501566550843.
[I 2025-12-06 07:51:08,135] Trial 82 finished with value: 0.22046420573442632 and parameters: {'model_type': 'graphsage', 'hidden_dims': '[512, 64]', 'dropout': 0.30752118908071524, 'batch_norm': True, 'sage_aggr': 'max', 'sage_normalize': False, 'sage_project': False, 'lr': 8.863890127251368e-05, 'weight_decay': 0.0003119482064343594, 'epochs': 118, 'loss': 'mae', 'optimizer': 'adam', 'graph_mode': 'cutoff', 'cutoff': 0.3966398932696541, 'grm_norm': 'gcn', 'self_loops': False, 'use_snp_selection': True, 'num_snps': 25283, 'graphsage_batch_size': 8}. Best is trial 55 with value: 0.2351501566550843.
[I 2025-12-06 07:52:20,902] Trial 83 finished with value: 0.2168088006651745 and parameters: {'model_type': 'graphsage', 'hidden_dims': '[512, 64]', 'dropout': 0.34189527815594706, 'batch_norm': True, 'sage_aggr': 'max', 'sage_normalize': False, 'sage_project': False, 'lr': 0.00015976842002594113, 'weight_decay': 0.0004123528090251772, 'epochs': 144, 'loss': 'mae', 'optimizer': 'adam', 'graph_mode': 'cutoff', 'cutoff': 0.2784665173876222, 'grm_norm': 'gcn', 'self_loops': False, 'use_snp_selection': True, 'num_snps': 22950, 'graphsage_batch_size': 8}. Best is trial 55 with value: 0.2351501566550843.
[I 2025-12-06 07:53:39,103] Trial 84 finished with value: 0.2256673259358199 and parameters: {'model_type': 'graphsage', 'hidden_dims': '[512, 64]', 'dropout': 0.2883552667923447, 'batch_norm': True, 'sage_aggr': 'max', 'sage_normalize': False, 'sage_project': False, 'lr': 0.00010532910507050161, 'weight_decay': 0.00017095781672709132, 'epochs': 133, 'loss': 'mae', 'optimizer': 'adam', 'graph_mode': 'cutoff', 'cutoff': 0.35932852549155475, 'grm_norm': 'gcn', 'self_loops': False, 'use_snp_selection': True, 'num_snps': 31974, 'graphsage_batch_size': 8}. Best is trial 55 with value: 0.2351501566550843.
[I 2025-12-06 07:54:19,323] Trial 85 finished with value: 0.20272234578806372 and parameters: {'model_type': 'graphsage', 'hidden_dims': '[128, 64]', 'dropout': 0.2887937284581929, 'batch_norm': True, 'sage_aggr': 'max', 'sage_normalize': False, 'sage_project': False, 'lr': 7.270731762473095e-05, 'weight_decay': 0.0001842931642702689, 'epochs': 126, 'loss': 'mae', 'optimizer': 'adam', 'graph_mode': 'cutoff', 'cutoff': 0.4187091112318637, 'grm_norm': 'cosine', 'self_loops': False, 'use_snp_selection': True, 'num_snps': 28097, 'graphsage_batch_size': 8}. Best is trial 55 with value: 0.2351501566550843.
[I 2025-12-06 07:55:30,492] Trial 86 finished with value: 0.2235287984249848 and parameters: {'model_type': 'graphsage', 'hidden_dims': '[512, 64]', 'dropout': 0.24336012512832222, 'batch_norm': True, 'sage_aggr': 'max', 'sage_normalize': False, 'sage_project': False, 'lr': 0.00011399892958840442, 'weight_decay': 0.00012324353264932185, 'epochs': 131, 'loss': 'mse', 'optimizer': 'adam', 'graph_mode': 'cutoff', 'cutoff': 0.3798550530285769, 'grm_norm': 'gcn', 'self_loops': False, 'use_snp_selection': True, 'num_snps': 30962, 'graphsage_batch_size': 8}. Best is trial 55 with value: 0.2351501566550843.
[I 2025-12-06 07:56:23,242] Trial 87 finished with value: 0.16281474206753568 and parameters: {'model_type': 'graphsage', 'hidden_dims': '[512, 128]', 'dropout': 0.21983475678872416, 'batch_norm': True, 'sage_aggr': 'max', 'sage_normalize': False, 'sage_project': False, 'lr': 3.918640635687188e-06, 'weight_decay': 0.0005679170744916278, 'epochs': 110, 'loss': 'mae', 'optimizer': 'adam', 'graph_mode': 'cutoff', 'cutoff': 0.43404893650610704, 'grm_norm': 'gcn', 'self_loops': False, 'use_snp_selection': True, 'num_snps': 26251, 'graphsage_batch_size': 128}. Best is trial 55 with value: 0.2351501566550843.
[I 2025-12-06 07:57:20,791] Trial 88 finished with value: 0.2232125845441469 and parameters: {'model_type': 'graphsage', 'hidden_dims': '[512, 64]', 'dropout': 0.26769013722925517, 'batch_norm': True, 'sage_aggr': 'max', 'sage_normalize': False, 'sage_project': False, 'lr': 0.000226580080780031, 'weight_decay': 8.272133193902914e-05, 'epochs': 151, 'loss': 'mae', 'optimizer': 'adam', 'graph_mode': 'cutoff', 'cutoff': 0.3140647672755117, 'grm_norm': 'gcn', 'self_loops': False, 'use_snp_selection': True, 'num_snps': 19329, 'graphsage_batch_size': 16}. Best is trial 55 with value: 0.2351501566550843.
[I 2025-12-06 07:58:24,479] Trial 89 finished with value: 0.21958794620001126 and parameters: {'model_type': 'graphsage', 'hidden_dims': '[512, 64]', 'dropout': 0.29997500224262963, 'batch_norm': True, 'sage_aggr': 'max', 'sage_normalize': False, 'sage_project': False, 'lr': 0.00018831399235987235, 'weight_decay': 0.00016026344464321527, 'epochs': 103, 'loss': 'mae', 'optimizer': 'adam', 'graph_mode': 'cutoff', 'cutoff': 0.40367067818888897, 'grm_norm': 'cosine_then_gcn', 'self_loops': False, 'use_snp_selection': True, 'num_snps': 34481, 'graphsage_batch_size': 8}. Best is trial 55 with value: 0.2351501566550843.
[I 2025-12-06 08:00:06,169] Trial 90 finished with value: 0.18164485562362742 and parameters: {'model_type': 'graphsage', 'hidden_dims': '[512, 64]', 'dropout': 0.3880828366965541, 'batch_norm': True, 'sage_aggr': 'max', 'sage_normalize': False, 'sage_project': False, 'lr': 0.00010101597301231603, 'weight_decay': 4.0744630012723626e-05, 'epochs': 134, 'loss': 'mae', 'optimizer': 'adam', 'graph_mode': 'knn', 'knn_k': 8, 'weighted_edges': True, 'symmetrize_mode': 'union', 'self_loops': False, 'use_snp_selection': True, 'num_snps': 29033, 'graphsage_batch_size': 8}. Best is trial 55 with value: 0.2351501566550843.
[I 2025-12-06 08:01:22,662] Trial 91 finished with value: 0.21974355563058814 and parameters: {'model_type': 'graphsage', 'hidden_dims': '[512, 64]', 'dropout': 0.31309905735083715, 'batch_norm': True, 'sage_aggr': 'max', 'sage_normalize': False, 'sage_project': False, 'lr': 0.00014560178301899305, 'weight_decay': 0.0002964081973168612, 'epochs': 127, 'loss': 'mae', 'optimizer': 'adam', 'graph_mode': 'cutoff', 'cutoff': 0.3569585494965488, 'grm_norm': 'gcn', 'self_loops': False, 'use_snp_selection': True, 'num_snps': 32508, 'graphsage_batch_size': 8}. Best is trial 55 with value: 0.2351501566550843.
[I 2025-12-06 08:02:07,415] Trial 92 finished with value: 0.2341818662022077 and parameters: {'model_type': 'graphsage', 'hidden_dims': '[512, 64]', 'dropout': 0.32381142184308, 'batch_norm': True, 'sage_aggr': 'max', 'sage_normalize': False, 'sage_project': False, 'lr': 0.000131779557109022, 'weight_decay': 0.0002254431072348534, 'epochs': 59, 'loss': 'mae', 'optimizer': 'adam', 'graph_mode': 'cutoff', 'cutoff': 0.3378102544198358, 'grm_norm': 'gcn', 'self_loops': False, 'use_snp_selection': True, 'num_snps': 29909, 'graphsage_batch_size': 8}. Best is trial 55 with value: 0.2351501566550843.
[I 2025-12-06 08:02:46,121] Trial 93 finished with value: 0.21695985919190863 and parameters: {'model_type': 'graphsage', 'hidden_dims': '[512, 64]', 'dropout': 0.35972135056214716, 'batch_norm': True, 'sage_aggr': 'max', 'sage_normalize': False, 'sage_project': False, 'lr': 8.466955356732113e-05, 'weight_decay': 0.00044573958723000487, 'epochs': 43, 'loss': 'mae', 'optimizer': 'adam', 'graph_mode': 'cutoff', 'cutoff': 0.32807344454364545, 'grm_norm': 'gcn', 'self_loops': False, 'use_snp_selection': True, 'num_snps': 30116, 'graphsage_batch_size': 8}. Best is trial 55 with value: 0.2351501566550843.
[I 2025-12-06 08:03:24,810] Trial 94 finished with value: 0.19294469346198312 and parameters: {'model_type': 'graphsage', 'hidden_dims': '[512, 64]', 'dropout': 0.33124271112387244, 'batch_norm': True, 'sage_aggr': 'max', 'sage_normalize': False, 'sage_project': False, 'lr': 3.708931715304741e-05, 'weight_decay': 0.00022884915553196596, 'epochs': 54, 'loss': 'mae', 'optimizer': 'adam', 'graph_mode': 'cutoff', 'cutoff': 0.2845949401689801, 'grm_norm': 'gcn', 'self_loops': False, 'use_snp_selection': True, 'num_snps': 23204, 'graphsage_batch_size': 8}. Best is trial 55 with value: 0.2351501566550843.
[I 2025-12-06 08:04:17,368] Trial 95 finished with value: 0.09217596183355267 and parameters: {'model_type': 'graphsage', 'hidden_dims': '[512, 64]', 'dropout': 0.28161094590104824, 'batch_norm': False, 'sage_aggr': 'max', 'sage_normalize': False, 'sage_project': False, 'lr': 0.00030450566529504974, 'weight_decay': 0.0008234448839245737, 'epochs': 96, 'loss': 'mae', 'optimizer': 'adam', 'graph_mode': 'cutoff', 'cutoff': 0.3780049228593318, 'grm_norm': 'gcn', 'self_loops': False, 'use_snp_selection': True, 'num_snps': 27589, 'graphsage_batch_size': 64}. Best is trial 55 with value: 0.2351501566550843.
[I 2025-12-06 08:04:56,573] Trial 96 finished with value: 0.20142249420854014 and parameters: {'model_type': 'graphsage', 'hidden_dims': '[512, 64]', 'dropout': 0.2596005679754689, 'batch_norm': True, 'sage_aggr': 'max', 'sage_normalize': False, 'sage_project': False, 'lr': 6.392947650672545e-05, 'weight_decay': 0.00011714672329300195, 'epochs': 63, 'loss': 'mae', 'optimizer': 'adam', 'graph_mode': 'cutoff', 'cutoff': 0.3564071966186177, 'grm_norm': 'gcn', 'self_loops': False, 'use_snp_selection': True, 'num_snps': 25317, 'graphsage_batch_size': 8}. Best is trial 55 with value: 0.2351501566550843.
