[I 2025-12-09 21:47:07,172] Trial 122 finished with value: 0.30893298682573583 and parameters: {'model_type': 'graphsage', 'hidden_dims': '[512, 256]', 'dropout': 0.5611901845879612, 'batch_norm': False, 'sage_aggr': 'mean', 'sage_normalize': True, 'sage_project': False, 'lr': 0.003715833311527625, 'weight_decay': 7.941197596707796e-07, 'epochs': 244, 'loss': 'mse', 'optimizer': 'adam', 'graph_mode': 'cutoff', 'cutoff': 0.8087730149433924, 'grm_norm': 'none', 'self_loops': False, 'use_snp_selection': False}. Best is trial 59 with value: 0.31197841542309374.
[I 2025-12-09 21:49:18,862] Trial 123 finished with value: 0.3071920775185149 and parameters: {'model_type': 'graphsage', 'hidden_dims': '[512, 256]', 'dropout': 0.5598295136805052, 'batch_norm': False, 'sage_aggr': 'mean', 'sage_normalize': True, 'sage_project': False, 'lr': 0.004275684802195085, 'weight_decay': 6.763870282265183e-07, 'epochs': 247, 'loss': 'mse', 'optimizer': 'adam', 'graph_mode': 'cutoff', 'cutoff': 0.8031618734144583, 'grm_norm': 'none', 'self_loops': False, 'use_snp_selection': False}. Best is trial 59 with value: 0.31197841542309374.
[I 2025-12-09 21:52:19,944] Trial 124 finished with value: 0.3058596515815847 and parameters: {'model_type': 'graphsage', 'hidden_dims': '[512, 256]', 'dropout': 0.4939582220666456, 'batch_norm': False, 'sage_aggr': 'mean', 'sage_normalize': True, 'sage_project': False, 'lr': 0.0016151260601161167, 'weight_decay': 5.320386971102028e-07, 'epochs': 343, 'loss': 'mse', 'optimizer': 'adam', 'graph_mode': 'cutoff', 'cutoff': 0.810232530078545, 'grm_norm': 'none', 'self_loops': False, 'use_snp_selection': False}. Best is trial 59 with value: 0.31197841542309374.
[I 2025-12-09 21:54:41,059] Trial 125 finished with value: 0.31060879504739847 and parameters: {'model_type': 'graphsage', 'hidden_dims': '[512, 256]', 'dropout': 0.5411275383865091, 'batch_norm': False, 'sage_aggr': 'mean', 'sage_normalize': True, 'sage_project': False, 'lr': 0.006638844046553562, 'weight_decay': 2.382896679728937e-07, 'epochs': 265, 'loss': 'mse', 'optimizer': 'adam', 'graph_mode': 'cutoff', 'cutoff': 0.7527024786848153, 'grm_norm': 'none', 'self_loops': False, 'use_snp_selection': False}. Best is trial 59 with value: 0.31197841542309374.
[I 2025-12-09 21:56:56,830] Trial 126 finished with value: 0.3022629005314052 and parameters: {'model_type': 'graphsage', 'hidden_dims': '[512, 64]', 'dropout': 0.5236553709671782, 'batch_norm': False, 'sage_aggr': 'mean', 'sage_normalize': True, 'sage_project': False, 'lr': 0.006402065520077936, 'weight_decay': 2.5502111104890913e-07, 'epochs': 256, 'loss': 'mse', 'optimizer': 'adam', 'graph_mode': 'cutoff', 'cutoff': 0.761304661363387, 'grm_norm': 'cosine_then_gcn', 'self_loops': True, 'use_snp_selection': False}. Best is trial 59 with value: 0.31197841542309374.
[I 2025-12-09 21:59:23,034] Trial 127 finished with value: 0.3055788997422503 and parameters: {'model_type': 'graphsage', 'hidden_dims': '[512, 256]', 'dropout': 0.5045779728445564, 'batch_norm': False, 'sage_aggr': 'mean', 'sage_normalize': True, 'sage_project': False, 'lr': 0.007581922402847786, 'weight_decay': 1.9373049415334528e-07, 'epochs': 275, 'loss': 'mse', 'optimizer': 'adam', 'graph_mode': 'cutoff', 'cutoff': 0.7264726090282885, 'grm_norm': 'cosine', 'self_loops': False, 'use_snp_selection': False}. Best is trial 59 with value: 0.31197841542309374.
[I 2025-12-09 22:00:38,734] Trial 128 finished with value: 0.29650267875785874 and parameters: {'model_type': 'graphsage', 'hidden_dims': '[256, 128]', 'dropout': 0.4806183973994792, 'batch_norm': False, 'sage_aggr': 'max', 'sage_normalize': True, 'sage_project': False, 'lr': 0.008513588173676222, 'weight_decay': 3.201074637227159e-07, 'epochs': 263, 'loss': 'mae', 'optimizer': 'adam', 'graph_mode': 'cutoff', 'cutoff': 0.6954314800135525, 'grm_norm': 'none', 'self_loops': True, 'use_snp_selection': False}. Best is trial 59 with value: 0.31197841542309374.
[I 2025-12-09 22:01:54,463] Trial 129 finished with value: 0.2822396293878736 and parameters: {'model_type': 'graphsage', 'hidden_dims': '[512, 256]', 'dropout': 0.5390234813342123, 'batch_norm': True, 'sage_aggr': 'mean', 'sage_normalize': True, 'sage_project': False, 'lr': 0.004894688687661898, 'weight_decay': 1.537422012878697e-07, 'epochs': 130, 'loss': 'mse', 'optimizer': 'adam', 'graph_mode': 'knn', 'knn_k': 3, 'weighted_edges': True, 'symmetrize_mode': 'mutual', 'self_loops': False, 'use_snp_selection': False}. Best is trial 59 with value: 0.31197841542309374.
[I 2025-12-09 22:04:37,730] Trial 130 finished with value: 0.30459390109421575 and parameters: {'model_type': 'graphsage', 'hidden_dims': '[512, 128]', 'dropout': 0.5500801884765342, 'batch_norm': False, 'sage_aggr': 'mean', 'sage_normalize': True, 'sage_project': False, 'lr': 0.006161818749205382, 'weight_decay': 1.1831860997906666e-07, 'epochs': 309, 'loss': 'mse', 'optimizer': 'adam', 'graph_mode': 'cutoff', 'cutoff': 0.755153502121931, 'grm_norm': 'none', 'self_loops': True, 'use_snp_selection': False}. Best is trial 59 with value: 0.31197841542309374.
[I 2025-12-09 22:06:48,405] Trial 131 finished with value: 0.3109874924708912 and parameters: {'model_type': 'graphsage', 'hidden_dims': '[512, 256]', 'dropout': 0.5722745302533742, 'batch_norm': False, 'sage_aggr': 'mean', 'sage_normalize': True, 'sage_project': False, 'lr': 0.00369542554237192, 'weight_decay': 2.411531014838552e-07, 'epochs': 245, 'loss': 'mse', 'optimizer': 'adam', 'graph_mode': 'cutoff', 'cutoff': 0.7741040450801473, 'grm_norm': 'none', 'self_loops': False, 'use_snp_selection': False}. Best is trial 59 with value: 0.31197841542309374.
[I 2025-12-09 22:09:03,724] Trial 132 finished with value: 0.306277571941458 and parameters: {'model_type': 'graphsage', 'hidden_dims': '[512, 256]', 'dropout': 0.5997257398817887, 'batch_norm': False, 'sage_aggr': 'mean', 'sage_normalize': True, 'sage_project': False, 'lr': 0.002041451347084569, 'weight_decay': 2.3816160230156792e-07, 'epochs': 254, 'loss': 'mse', 'optimizer': 'adam', 'graph_mode': 'cutoff', 'cutoff': 0.7851706811866028, 'grm_norm': 'none', 'self_loops': False, 'use_snp_selection': False}. Best is trial 59 with value: 0.31197841542309374.
[I 2025-12-09 22:11:25,842] Trial 133 finished with value: 0.3069895518994411 and parameters: {'model_type': 'graphsage', 'hidden_dims': '[512, 256]', 'dropout': 0.5703190224979251, 'batch_norm': False, 'sage_aggr': 'mean', 'sage_normalize': True, 'sage_project': False, 'lr': 0.00313986845996005, 'weight_decay': 1.7728919626675946e-07, 'epochs': 267, 'loss': 'mse', 'optimizer': 'adam', 'graph_mode': 'cutoff', 'cutoff': 0.7408590506545205, 'grm_norm': 'none', 'self_loops': False, 'use_snp_selection': False}. Best is trial 59 with value: 0.31197841542309374.
[I 2025-12-09 22:13:06,007] Trial 134 finished with value: 0.30596980411086916 and parameters: {'model_type': 'graphsage', 'hidden_dims': '[512, 256]', 'dropout': 0.5155554381728038, 'batch_norm': False, 'sage_aggr': 'mean', 'sage_normalize': True, 'sage_project': False, 'lr': 0.002249731789660691, 'weight_decay': 1.4286837650688696e-07, 'epochs': 186, 'loss': 'mse', 'optimizer': 'adam', 'graph_mode': 'cutoff', 'cutoff': 0.7727689902202758, 'grm_norm': 'none', 'self_loops': False, 'use_snp_selection': False}. Best is trial 59 with value: 0.31197841542309374.
[I 2025-12-09 22:15:42,984] Trial 135 finished with value: 0.3041055078281797 and parameters: {'model_type': 'graphsage', 'hidden_dims': '[512, 256]', 'dropout': 0.5310321993319693, 'batch_norm': False, 'sage_aggr': 'mean', 'sage_normalize': True, 'sage_project': False, 'lr': 0.004547877695586217, 'weight_decay': 2.828624084199686e-07, 'epochs': 296, 'loss': 'mse', 'optimizer': 'adam', 'graph_mode': 'cutoff', 'cutoff': 0.8957477680509998, 'grm_norm': 'cosine', 'self_loops': False, 'use_snp_selection': False}. Best is trial 59 with value: 0.31197841542309374.
[I 2025-12-09 22:16:51,245] Trial 136 finished with value: 0.29871149198919367 and parameters: {'model_type': 'graphsage', 'hidden_dims': '[256, 128]', 'dropout': 0.5844272230271033, 'batch_norm': False, 'sage_aggr': 'mean', 'sage_normalize': True, 'sage_project': False, 'lr': 0.0018440156049355856, 'weight_decay': 3.423594544222022e-07, 'epochs': 236, 'loss': 'mse', 'optimizer': 'adam', 'graph_mode': 'cutoff', 'cutoff': 0.8246233710279206, 'grm_norm': 'none', 'self_loops': False, 'use_snp_selection': False}. Best is trial 59 with value: 0.31197841542309374.
[I 2025-12-09 22:18:12,443] Trial 137 finished with value: 0.3077428332454588 and parameters: {'model_type': 'graphsage', 'hidden_dims': '[512, 256]', 'dropout': 0.5667765055688428, 'batch_norm': False, 'sage_aggr': 'mean', 'sage_normalize': True, 'sage_project': False, 'lr': 0.002798311613493784, 'weight_decay': 1.9971391626079877e-07, 'epochs': 149, 'loss': 'mse', 'optimizer': 'adam', 'graph_mode': 'cutoff', 'cutoff': 0.7935776022740845, 'grm_norm': 'gcn', 'self_loops': True, 'use_snp_selection': False}. Best is trial 59 with value: 0.31197841542309374.
[I 2025-12-09 22:18:47,072] Trial 138 finished with value: 0.28108942934632203 and parameters: {'model_type': 'graphsage', 'hidden_dims': '[512, 256]', 'dropout': 0.5445239603835459, 'batch_norm': False, 'sage_aggr': 'mean', 'sage_normalize': True, 'sage_project': False, 'lr': 0.0013007031852698082, 'weight_decay': 4.081320656012957e-07, 'epochs': 247, 'loss': 'mse', 'optimizer': 'adam', 'graph_mode': 'cutoff', 'cutoff': 0.349627526448301, 'grm_norm': 'none', 'self_loops': False, 'use_snp_selection': True, 'num_snps': 8641}. Best is trial 59 with value: 0.31197841542309374.
[I 2025-12-09 22:20:07,333] Trial 139 finished with value: 0.30845274155365143 and parameters: {'model_type': 'graphsage', 'hidden_dims': '[256, 128]', 'dropout': 0.5765455398839179, 'batch_norm': False, 'sage_aggr': 'max', 'sage_normalize': True, 'sage_project': False, 'lr': 0.003979029324454105, 'weight_decay': 2.1512402874246176e-07, 'epochs': 282, 'loss': 'mse', 'optimizer': 'adam', 'graph_mode': 'cutoff', 'cutoff': 0.847825186089546, 'grm_norm': 'cosine', 'self_loops': True, 'use_snp_selection': False}. Best is trial 59 with value: 0.31197841542309374.
[I 2025-12-09 22:21:40,070] Trial 140 finished with value: 0.2956349458113435 and parameters: {'model_type': 'graphsage', 'hidden_dims': '[512, 256]', 'dropout': 0.5545867112319469, 'batch_norm': False, 'sage_aggr': 'mean', 'sage_normalize': True, 'sage_project': False, 'lr': 0.002552059485958446, 'weight_decay': 1.0827330002451132e-07, 'epochs': 158, 'loss': 'mse', 'optimizer': 'adam', 'graph_mode': 'cutoff', 'cutoff': 0.527359634762851, 'grm_norm': 'none', 'self_loops': False, 'use_snp_selection': False}. Best is trial 59 with value: 0.31197841542309374.
[I 2025-12-09 22:23:50,756] Trial 141 finished with value: 0.3087721332871942 and parameters: {'model_type': 'graphsage', 'hidden_dims': '[512, 256]', 'dropout': 0.5635430014838141, 'batch_norm': False, 'sage_aggr': 'mean', 'sage_normalize': True, 'sage_project': False, 'lr': 0.0037382615269544255, 'weight_decay': 1.1555437834672258e-06, 'epochs': 245, 'loss': 'mse', 'optimizer': 'adam', 'graph_mode': 'cutoff', 'cutoff': 0.7770448649226604, 'grm_norm': 'none', 'self_loops': False, 'use_snp_selection': False}. Best is trial 59 with value: 0.31197841542309374.
[I 2025-12-09 22:25:59,447] Trial 142 finished with value: 0.31390390617178887 and parameters: {'model_type': 'graphsage', 'hidden_dims': '[512, 256]', 'dropout': 0.5390474036887554, 'batch_norm': False, 'sage_aggr': 'mean', 'sage_normalize': True, 'sage_project': False, 'lr': 0.0067235979205543485, 'weight_decay': 8.782911770464306e-07, 'epochs': 241, 'loss': 'mse', 'optimizer': 'adam', 'graph_mode': 'cutoff', 'cutoff': 0.7504463142346708, 'grm_norm': 'none', 'self_loops': False, 'use_snp_selection': False}. Best is trial 142 with value: 0.31390390617178887.
[I 2025-12-09 22:27:55,769] Trial 143 finished with value: 0.30047283786041956 and parameters: {'model_type': 'graphsage', 'hidden_dims': '[512, 256]', 'dropout': 0.5337772464462482, 'batch_norm': False, 'sage_aggr': 'mean', 'sage_normalize': True, 'sage_project': False, 'lr': 0.006981792406790341, 'weight_decay': 2.662289645070508e-07, 'epochs': 217, 'loss': 'mse', 'optimizer': 'adam', 'graph_mode': 'cutoff', 'cutoff': 0.7514718126104594, 'grm_norm': 'none', 'self_loops': False, 'use_snp_selection': False}. Best is trial 142 with value: 0.31390390617178887.
[I 2025-12-09 22:30:15,580] Trial 144 finished with value: 0.3125362293812145 and parameters: {'model_type': 'graphsage', 'hidden_dims': '[512, 256]', 'dropout': 0.5212626084805798, 'batch_norm': False, 'sage_aggr': 'mean', 'sage_normalize': True, 'sage_project': False, 'lr': 0.005334135722726651, 'weight_decay': 1.6775085530596485e-07, 'epochs': 262, 'loss': 'mse', 'optimizer': 'adam', 'graph_mode': 'cutoff', 'cutoff': 0.7101101768907829, 'grm_norm': 'none', 'self_loops': False, 'use_snp_selection': False}. Best is trial 142 with value: 0.31390390617178887.
[I 2025-12-09 22:32:34,868] Trial 145 finished with value: 0.3099423897296611 and parameters: {'model_type': 'graphsage', 'hidden_dims': '[512, 256]', 'dropout': 0.4975854763741187, 'batch_norm': False, 'sage_aggr': 'mean', 'sage_normalize': True, 'sage_project': False, 'lr': 0.005283998702140178, 'weight_decay': 1.6612544282249962e-07, 'epochs': 261, 'loss': 'mse', 'optimizer': 'adam', 'graph_mode': 'cutoff', 'cutoff': 0.7066824505594616, 'grm_norm': 'none', 'self_loops': False, 'use_snp_selection': False}. Best is trial 142 with value: 0.31390390617178887.
[I 2025-12-09 22:34:52,895] Trial 146 finished with value: 0.30435203010228207 and parameters: {'model_type': 'graphsage', 'hidden_dims': '[512, 128]', 'dropout': 0.49592030407241855, 'batch_norm': False, 'sage_aggr': 'mean', 'sage_normalize': True, 'sage_project': False, 'lr': 0.005311961170488624, 'weight_decay': 1.6851710440730093e-07, 'epochs': 259, 'loss': 'mse', 'optimizer': 'adam', 'graph_mode': 'cutoff', 'cutoff': 0.6814632087086603, 'grm_norm': 'none', 'self_loops': False, 'use_snp_selection': False}. Best is trial 142 with value: 0.31390390617178887.
[I 2025-12-09 22:37:16,945] Trial 147 finished with value: 0.0 and parameters: {'model_type': 'graphsage', 'hidden_dims': '[512, 256]', 'dropout': 0.506666236397153, 'batch_norm': False, 'sage_aggr': 'mean', 'sage_normalize': False, 'sage_project': False, 'lr': 0.009973751992552717, 'weight_decay': 2.3773624922527035e-07, 'epochs': 271, 'loss': 'mse', 'optimizer': 'adam', 'graph_mode': 'cutoff', 'cutoff': 0.7046312622637927, 'grm_norm': 'none', 'self_loops': False, 'use_snp_selection': False}. Best is trial 142 with value: 0.31390390617178887.
[I 2025-12-09 22:38:04,662] Trial 148 finished with value: 0.2998711833343944 and parameters: {'model_type': 'graphsage', 'hidden_dims': '[128, 64]', 'dropout': 0.48141685409542156, 'batch_norm': False, 'sage_aggr': 'mean', 'sage_normalize': True, 'sage_project': False, 'lr': 0.005858711329374392, 'weight_decay': 1.6268839143398161e-07, 'epochs': 264, 'loss': 'mse', 'optimizer': 'adam', 'graph_mode': 'cutoff', 'cutoff': 0.7230759195709234, 'grm_norm': 'none', 'self_loops': False, 'use_snp_selection': False}. Best is trial 142 with value: 0.31390390617178887.
[I 2025-12-09 22:39:18,482] Trial 149 finished with value: 0.1835397774007686 and parameters: {'model_type': 'graphsage', 'hidden_dims': '[256, 128, 64]', 'dropout': 0.46500285909500116, 'batch_norm': False, 'sage_aggr': 'mean', 'sage_normalize': True, 'sage_project': False, 'lr': 0.007863925139940109, 'weight_decay': 1.9731456085037278e-07, 'epochs': 254, 'loss': 'mse', 'optimizer': 'adam', 'graph_mode': 'cutoff', 'cutoff': 0.7407844524043493, 'grm_norm': 'none', 'self_loops': False, 'use_snp_selection': False}. Best is trial 142 with value: 0.31390390617178887.
[I 2025-12-09 22:41:05,673] Trial 0 finished with value: 0.25538102696411746 and parameters: {'model_type': 'graphsage', 'hidden_dims': '[128, 64]', 'dropout': 0.199031432379812, 'batch_norm': True, 'sage_aggr': 'max', 'sage_normalize': True, 'sage_project': False, 'lr': 0.00034401453323286885, 'weight_decay': 0.00017802616915745114, 'epochs': 230, 'loss': 'mse', 'optimizer': 'adam', 'graph_mode': 'knn', 'knn_k': 6, 'weighted_edges': True, 'symmetrize_mode': 'mutual', 'self_loops': True, 'use_snp_selection': False}. Best is trial 0 with value: 0.25538102696411746.
[I 2025-12-09 22:42:40,201] Trial 1 finished with value: 0.2802004571032081 and parameters: {'model_type': 'graphsage', 'hidden_dims': '[512, 128]', 'dropout': 0.2503500283181017, 'batch_norm': False, 'sage_aggr': 'max', 'sage_normalize': False, 'sage_project': False, 'lr': 3.952233718592099e-05, 'weight_decay': 0.00026754769258252603, 'epochs': 149, 'loss': 'mse', 'optimizer': 'adam', 'graph_mode': 'knn', 'knn_k': 2, 'weighted_edges': False, 'symmetrize_mode': 'mutual', 'self_loops': True, 'use_snp_selection': True, 'num_snps': 49915}. Best is trial 1 with value: 0.2802004571032081.
[I 2025-12-09 22:43:53,153] Trial 2 finished with value: 0.28717924308704906 and parameters: {'model_type': 'graphsage', 'hidden_dims': '[512, 256]', 'dropout': 0.2785908793172681, 'batch_norm': False, 'sage_aggr': 'max', 'sage_normalize': False, 'sage_project': False, 'lr': 8.806039223165805e-05, 'weight_decay': 3.5153176302760294e-05, 'epochs': 147, 'loss': 'mae', 'optimizer': 'adam', 'graph_mode': 'cutoff', 'cutoff': 0.4922564006874869, 'grm_norm': 'gcn', 'self_loops': False, 'use_snp_selection': True, 'num_snps': 34340}. Best is trial 2 with value: 0.28717924308704906.
[I 2025-12-09 22:45:18,465] Trial 3 finished with value: 0.28361212846992856 and parameters: {'model_type': 'graphsage', 'hidden_dims': '[256, 128, 64]', 'dropout': 0.3475243154412272, 'batch_norm': True, 'sage_aggr': 'max', 'sage_normalize': False, 'sage_project': False, 'lr': 1.6006331996938085e-05, 'weight_decay': 7.213121225589906e-06, 'epochs': 283, 'loss': 'mse', 'optimizer': 'adam', 'graph_mode': 'cutoff', 'cutoff': 0.5942334791449215, 'grm_norm': 'none', 'self_loops': True, 'use_snp_selection': False}. Best is trial 2 with value: 0.28717924308704906.
[I 2025-12-09 22:45:41,911] Trial 4 finished with value: 0.2700079918991899 and parameters: {'model_type': 'graphsage', 'hidden_dims': '[128, 64]', 'dropout': 0.3348926467202472, 'batch_norm': True, 'sage_aggr': 'max', 'sage_normalize': False, 'sage_project': False, 'lr': 0.0004238630400638802, 'weight_decay': 8.074086040046576e-07, 'epochs': 158, 'loss': 'mae', 'optimizer': 'adam', 'graph_mode': 'knn', 'knn_k': 1, 'weighted_edges': False, 'symmetrize_mode': 'mutual', 'self_loops': False, 'use_snp_selection': True, 'num_snps': 26850}. Best is trial 2 with value: 0.28717924308704906.
[I 2025-12-09 22:48:00,957] Trial 5 finished with value: 0.27010593939427974 and parameters: {'model_type': 'graphsage', 'hidden_dims': '[512, 64]', 'dropout': 0.14505336736221927, 'batch_norm': True, 'sage_aggr': 'mean', 'sage_normalize': True, 'sage_project': False, 'lr': 1.2962030165732234e-05, 'weight_decay': 1.326598071105465e-07, 'epochs': 180, 'loss': 'mse', 'optimizer': 'adam', 'graph_mode': 'knn', 'knn_k': 9, 'weighted_edges': True, 'symmetrize_mode': 'mutual', 'self_loops': False, 'use_snp_selection': False}. Best is trial 2 with value: 0.28717924308704906.
[I 2025-12-09 22:48:34,888] Trial 6 finished with value: 0.26357170277317593 and parameters: {'model_type': 'graphsage', 'hidden_dims': '[256, 128, 64]', 'dropout': 0.10731743755162496, 'batch_norm': True, 'sage_aggr': 'mean', 'sage_normalize': False, 'sage_project': False, 'lr': 1.922990426933137e-05, 'weight_decay': 7.30001060446905e-05, 'epochs': 63, 'loss': 'mae', 'optimizer': 'adam', 'graph_mode': 'cutoff', 'cutoff': 0.7624978434202536, 'grm_norm': 'none', 'self_loops': True, 'use_snp_selection': True, 'num_snps': 50106}. Best is trial 2 with value: 0.28717924308704906.
[I 2025-12-09 22:50:36,116] Trial 7 finished with value: 0.24725392902315058 and parameters: {'model_type': 'graphsage', 'hidden_dims': '[512, 64]', 'dropout': 0.2585007811528941, 'batch_norm': True, 'sage_aggr': 'max', 'sage_normalize': True, 'sage_project': False, 'lr': 5.921425508303391e-05, 'weight_decay': 0.0004511561961144237, 'epochs': 182, 'loss': 'mae', 'optimizer': 'adam', 'graph_mode': 'knn', 'knn_k': 9, 'weighted_edges': True, 'symmetrize_mode': 'union', 'self_loops': False, 'use_snp_selection': True, 'num_snps': 23903}. Best is trial 2 with value: 0.28717924308704906.
[I 2025-12-09 22:51:02,443] Trial 8 finished with value: 0.2552593175566388 and parameters: {'model_type': 'graphsage', 'hidden_dims': '[512, 256]', 'dropout': 0.3061380386767003, 'batch_norm': False, 'sage_aggr': 'mean', 'sage_normalize': True, 'sage_project': False, 'lr': 0.000698401460570184, 'weight_decay': 2.965560055460244e-06, 'epochs': 289, 'loss': 'mae', 'optimizer': 'adam', 'graph_mode': 'knn', 'knn_k': 7, 'weighted_edges': False, 'symmetrize_mode': 'mutual', 'self_loops': True, 'use_snp_selection': True, 'num_snps': 4710}. Best is trial 2 with value: 0.28717924308704906.
[I 2025-12-09 22:56:13,238] Trial 9 finished with value: 0.2950397642164374 and parameters: {'model_type': 'graphsage', 'hidden_dims': '[512, 128]', 'dropout': 0.1733844071393634, 'batch_norm': False, 'sage_aggr': 'mean', 'sage_normalize': True, 'sage_project': False, 'lr': 0.0004269677918501597, 'weight_decay': 2.2439779626249696e-06, 'epochs': 319, 'loss': 'mse', 'optimizer': 'adam', 'graph_mode': 'cutoff', 'cutoff': 0.24117565767129295, 'grm_norm': 'cosine_then_gcn', 'self_loops': True, 'use_snp_selection': False}. Best is trial 9 with value: 0.2950397642164374.
