[I 2025-12-09 10:45:29,658] Trial 94 finished with value: 0.30516504036006353 and parameters: {'model_type': 'graphsage', 'hidden_dims': '[128, 64]', 'dropout': 0.5371183221298168, 'batch_norm': True, 'sage_aggr': 'mean', 'sage_normalize': True, 'sage_project': False, 'lr': 0.00010783460525957066, 'weight_decay': 2.2880154831625414e-05, 'epochs': 169, 'loss': 'mse', 'optimizer': 'adam', 'graph_mode': 'cutoff', 'cutoff': 0.7239065191086753, 'grm_norm': 'cosine', 'self_loops': False, 'use_snp_selection': False}. Best is trial 30 with value: 0.3184890102856323.
[I 2025-12-09 10:46:09,684] Trial 95 finished with value: 0.3064223090396535 and parameters: {'model_type': 'graphsage', 'hidden_dims': '[128, 64]', 'dropout': 0.5688004227153921, 'batch_norm': True, 'sage_aggr': 'mean', 'sage_normalize': True, 'sage_project': False, 'lr': 0.007259706506775039, 'weight_decay': 3.362849737456134e-05, 'epochs': 224, 'loss': 'mse', 'optimizer': 'adam', 'graph_mode': 'cutoff', 'cutoff': 0.6924477255723287, 'grm_norm': 'cosine_then_gcn', 'self_loops': False, 'use_snp_selection': False}. Best is trial 30 with value: 0.3184890102856323.
[I 2025-12-09 10:47:37,264] Trial 96 finished with value: 0.30682331253627954 and parameters: {'model_type': 'graphsage', 'hidden_dims': '[128, 64]', 'dropout': 0.515147151565994, 'batch_norm': True, 'sage_aggr': 'mean', 'sage_normalize': True, 'sage_project': False, 'lr': 0.005629088904135781, 'weight_decay': 4.309204590965275e-05, 'epochs': 157, 'loss': 'mse', 'optimizer': 'adam', 'graph_mode': 'knn', 'knn_k': 8, 'weighted_edges': True, 'symmetrize_mode': 'union', 'self_loops': True, 'use_snp_selection': False}. Best is trial 30 with value: 0.3184890102856323.
[I 2025-12-09 10:49:05,362] Trial 97 finished with value: 0.3102977780212421 and parameters: {'model_type': 'graphsage', 'hidden_dims': '[512, 128]', 'dropout': 0.5904631878963768, 'batch_norm': True, 'sage_aggr': 'mean', 'sage_normalize': True, 'sage_project': False, 'lr': 0.0036487764820959502, 'weight_decay': 6.331735261442399e-05, 'epochs': 194, 'loss': 'mse', 'optimizer': 'adam', 'graph_mode': 'cutoff', 'cutoff': 0.8261101859331911, 'grm_norm': 'none', 'self_loops': True, 'use_snp_selection': False}. Best is trial 30 with value: 0.3184890102856323.
[I 2025-12-09 10:50:41,709] Trial 98 finished with value: 0.316793270865794 and parameters: {'model_type': 'graphsage', 'hidden_dims': '[512, 256]', 'dropout': 0.5529159041623735, 'batch_norm': True, 'sage_aggr': 'mean', 'sage_normalize': True, 'sage_project': False, 'lr': 0.008637052870420889, 'weight_decay': 6.330246300959909e-07, 'epochs': 212, 'loss': 'mse', 'optimizer': 'adam', 'graph_mode': 'cutoff', 'cutoff': 0.8857281598574839, 'grm_norm': 'cosine_then_gcn', 'self_loops': False, 'use_snp_selection': False}. Best is trial 30 with value: 0.3184890102856323.
[I 2025-12-09 10:52:17,105] Trial 99 finished with value: 0.3046399584933115 and parameters: {'model_type': 'graphsage', 'hidden_dims': '[512, 256]', 'dropout': 0.5305603817307175, 'batch_norm': False, 'sage_aggr': 'mean', 'sage_normalize': True, 'sage_project': False, 'lr': 0.008315594259838886, 'weight_decay': 6.657825936349351e-07, 'epochs': 210, 'loss': 'mse', 'optimizer': 'adam', 'graph_mode': 'cutoff', 'cutoff': 0.8945157829371316, 'grm_norm': 'cosine_then_gcn', 'self_loops': False, 'use_snp_selection': False}. Best is trial 30 with value: 0.3184890102856323.
[I 2025-12-09 10:52:56,301] Trial 100 finished with value: 0.2983659173714623 and parameters: {'model_type': 'graphsage', 'hidden_dims': '[512, 256]', 'dropout': 0.5520133788506056, 'batch_norm': True, 'sage_aggr': 'mean', 'sage_normalize': True, 'sage_project': False, 'lr': 0.004703139157100171, 'weight_decay': 3.873340651978686e-06, 'epochs': 127, 'loss': 'mse', 'optimizer': 'adam', 'graph_mode': 'cutoff', 'cutoff': 0.8788174103714491, 'grm_norm': 'cosine_then_gcn', 'self_loops': False, 'use_snp_selection': True, 'num_snps': 11286}. Best is trial 30 with value: 0.3184890102856323.
[I 2025-12-09 10:54:34,522] Trial 101 finished with value: 0.3117718681453864 and parameters: {'model_type': 'graphsage', 'hidden_dims': '[512, 256]', 'dropout': 0.5634878705707151, 'batch_norm': True, 'sage_aggr': 'mean', 'sage_normalize': True, 'sage_project': False, 'lr': 0.006555913241633851, 'weight_decay': 4.244718900835678e-07, 'epochs': 217, 'loss': 'mse', 'optimizer': 'adam', 'graph_mode': 'cutoff', 'cutoff': 0.8409726914616827, 'grm_norm': 'cosine_then_gcn', 'self_loops': False, 'use_snp_selection': False}. Best is trial 30 with value: 0.3184890102856323.
[I 2025-12-09 10:56:07,734] Trial 102 finished with value: 0.31190414730080357 and parameters: {'model_type': 'graphsage', 'hidden_dims': '[512, 256]', 'dropout': 0.5458696702628653, 'batch_norm': True, 'sage_aggr': 'mean', 'sage_normalize': True, 'sage_project': False, 'lr': 0.008632165013650753, 'weight_decay': 1.235261761019864e-06, 'epochs': 204, 'loss': 'mse', 'optimizer': 'adam', 'graph_mode': 'cutoff', 'cutoff': 0.7431642692441895, 'grm_norm': 'cosine_then_gcn', 'self_loops': False, 'use_snp_selection': False}. Best is trial 30 with value: 0.3184890102856323.
[I 2025-12-09 10:57:53,982] Trial 103 finished with value: 0.31276972493795163 and parameters: {'model_type': 'graphsage', 'hidden_dims': '[512, 128]', 'dropout': 0.57477322273044, 'batch_norm': True, 'sage_aggr': 'mean', 'sage_normalize': True, 'sage_project': False, 'lr': 0.00516903217271994, 'weight_decay': 8.663997228218865e-07, 'epochs': 238, 'loss': 'mse', 'optimizer': 'adam', 'graph_mode': 'cutoff', 'cutoff': 0.8060252381240158, 'grm_norm': 'cosine_then_gcn', 'self_loops': False, 'use_snp_selection': False}. Best is trial 30 with value: 0.3184890102856323.
[I 2025-12-09 10:58:40,393] Trial 104 finished with value: 0.3152746731637629 and parameters: {'model_type': 'graphsage', 'hidden_dims': '[512, 128]', 'dropout': 0.5240810803372423, 'batch_norm': True, 'sage_aggr': 'mean', 'sage_normalize': True, 'sage_project': False, 'lr': 0.009917526185238305, 'weight_decay': 1.8398626647150674e-06, 'epochs': 85, 'loss': 'mse', 'optimizer': 'adam', 'graph_mode': 'cutoff', 'cutoff': 0.7681970083900512, 'grm_norm': 'cosine_then_gcn', 'self_loops': True, 'use_snp_selection': False}. Best is trial 30 with value: 0.3184890102856323.
[I 2025-12-09 10:59:26,397] Trial 105 finished with value: 0.3102271508890281 and parameters: {'model_type': 'graphsage', 'hidden_dims': '[512, 128]', 'dropout': 0.4941459535573679, 'batch_norm': True, 'sage_aggr': 'mean', 'sage_normalize': True, 'sage_project': False, 'lr': 0.00914265399067623, 'weight_decay': 1.8282475213385354e-06, 'epochs': 84, 'loss': 'mse', 'optimizer': 'adam', 'graph_mode': 'cutoff', 'cutoff': 0.7700011935662604, 'grm_norm': 'cosine_then_gcn', 'self_loops': True, 'use_snp_selection': False}. Best is trial 30 with value: 0.3184890102856323.
[I 2025-12-09 10:59:58,773] Trial 106 finished with value: 0.30758202286977043 and parameters: {'model_type': 'graphsage', 'hidden_dims': '[256, 128, 64]', 'dropout': 0.5263063027291406, 'batch_norm': True, 'sage_aggr': 'mean', 'sage_normalize': False, 'sage_project': False, 'lr': 0.007152056817905181, 'weight_decay': 2.7362740574301926e-06, 'epochs': 98, 'loss': 'mse', 'optimizer': 'adam', 'graph_mode': 'cutoff', 'cutoff': 0.7840955500153296, 'grm_norm': 'cosine_then_gcn', 'self_loops': False, 'use_snp_selection': False}. Best is trial 30 with value: 0.3184890102856323.
[I 2025-12-09 11:00:17,894] Trial 107 finished with value: 0.29972338515339125 and parameters: {'model_type': 'graphsage', 'hidden_dims': '[128, 64]', 'dropout': 0.5075496115374809, 'batch_norm': True, 'sage_aggr': 'max', 'sage_normalize': True, 'sage_project': False, 'lr': 0.0058547268771791516, 'weight_decay': 0.0005537768447915709, 'epochs': 68, 'loss': 'mae', 'optimizer': 'adam', 'graph_mode': 'cutoff', 'cutoff': 0.7927175966184117, 'grm_norm': 'cosine_then_gcn', 'self_loops': True, 'use_snp_selection': False}. Best is trial 30 with value: 0.3184890102856323.
[I 2025-12-09 11:01:13,645] Trial 108 finished with value: 0.3057925707755438 and parameters: {'model_type': 'graphsage', 'hidden_dims': '[512, 128]', 'dropout': 0.19757199707381473, 'batch_norm': True, 'sage_aggr': 'mean', 'sage_normalize': True, 'sage_project': False, 'lr': 0.007741791623140556, 'weight_decay': 1.5665528469764657e-06, 'epochs': 109, 'loss': 'mse', 'optimizer': 'adam', 'graph_mode': 'cutoff', 'cutoff': 0.8166816733320712, 'grm_norm': 'cosine_then_gcn', 'self_loops': True, 'use_snp_selection': False}. Best is trial 30 with value: 0.3184890102856323.
[I 2025-12-09 11:01:59,775] Trial 109 finished with value: 0.3146003491019533 and parameters: {'model_type': 'graphsage', 'hidden_dims': '[512, 256]', 'dropout': 0.517914947254965, 'batch_norm': True, 'sage_aggr': 'mean', 'sage_normalize': True, 'sage_project': False, 'lr': 0.009700477550455045, 'weight_decay': 5.82009368072874e-07, 'epochs': 84, 'loss': 'mse', 'optimizer': 'adam', 'graph_mode': 'cutoff', 'cutoff': 0.7064752792837655, 'grm_norm': 'cosine_then_gcn', 'self_loops': True, 'use_snp_selection': False}. Best is trial 30 with value: 0.3184890102856323.
[I 2025-12-09 11:04:40,201] Trial 110 finished with value: 0.31219680606213573 and parameters: {'model_type': 'graphsage', 'hidden_dims': '[512, 128]', 'dropout': 0.556770774093433, 'batch_norm': True, 'sage_aggr': 'mean', 'sage_normalize': True, 'sage_project': False, 'lr': 0.007068983715303132, 'weight_decay': 4.8562214895382595e-06, 'epochs': 181, 'loss': 'mse', 'optimizer': 'adam', 'graph_mode': 'knn', 'knn_k': 10, 'weighted_edges': True, 'symmetrize_mode': 'union', 'self_loops': False, 'use_snp_selection': False}. Best is trial 30 with value: 0.3184890102856323.
[I 2025-12-09 11:06:09,138] Trial 111 finished with value: 0.31087494536293764 and parameters: {'model_type': 'graphsage', 'hidden_dims': '[512, 128]', 'dropout': 0.5876376774959727, 'batch_norm': True, 'sage_aggr': 'mean', 'sage_normalize': True, 'sage_project': False, 'lr': 0.004423223159899475, 'weight_decay': 9.299942818111969e-07, 'epochs': 196, 'loss': 'mse', 'optimizer': 'adam', 'graph_mode': 'cutoff', 'cutoff': 0.7352457139952867, 'grm_norm': 'none', 'self_loops': True, 'use_snp_selection': False}. Best is trial 30 with value: 0.3184890102856323.
[I 2025-12-09 11:07:51,881] Trial 112 finished with value: 0.31584418815225423 and parameters: {'model_type': 'graphsage', 'hidden_dims': '[512, 128]', 'dropout': 0.5390616465583478, 'batch_norm': True, 'sage_aggr': 'mean', 'sage_normalize': True, 'sage_project': False, 'lr': 0.002862788396749704, 'weight_decay': 2.431888753168878e-06, 'epochs': 229, 'loss': 'mse', 'optimizer': 'adam', 'graph_mode': 'cutoff', 'cutoff': 0.7574164020319791, 'grm_norm': 'cosine', 'self_loops': True, 'use_snp_selection': False}. Best is trial 30 with value: 0.3184890102856323.
[I 2025-12-09 11:09:41,273] Trial 113 finished with value: 0.3116111926962579 and parameters: {'model_type': 'graphsage', 'hidden_dims': '[512, 128]', 'dropout': 0.5400409865181934, 'batch_norm': True, 'sage_aggr': 'mean', 'sage_normalize': True, 'sage_project': False, 'lr': 0.00294193136895266, 'weight_decay': 2.8568268200527183e-06, 'epochs': 246, 'loss': 'mse', 'optimizer': 'adam', 'graph_mode': 'cutoff', 'cutoff': 0.7650034862271814, 'grm_norm': 'cosine', 'self_loops': True, 'use_snp_selection': False}. Best is trial 30 with value: 0.3184890102856323.
[I 2025-12-09 11:11:22,422] Trial 114 finished with value: 0.31583720975227775 and parameters: {'model_type': 'graphsage', 'hidden_dims': '[512, 128]', 'dropout': 0.5296094849516932, 'batch_norm': True, 'sage_aggr': 'mean', 'sage_normalize': True, 'sage_project': False, 'lr': 0.006465770303456167, 'weight_decay': 2.233143848253622e-06, 'epochs': 225, 'loss': 'mse', 'optimizer': 'adam', 'graph_mode': 'cutoff', 'cutoff': 0.7537244841897055, 'grm_norm': 'cosine', 'self_loops': True, 'use_snp_selection': False}. Best is trial 30 with value: 0.3184890102856323.
[I 2025-12-09 11:13:14,122] Trial 115 finished with value: 0.3166860622866839 and parameters: {'model_type': 'graphsage', 'hidden_dims': '[512, 128]', 'dropout': 0.4949649244164796, 'batch_norm': True, 'sage_aggr': 'mean', 'sage_normalize': True, 'sage_project': False, 'lr': 0.006140952518830423, 'weight_decay': 2.1869885405501783e-06, 'epochs': 252, 'loss': 'mse', 'optimizer': 'adam', 'graph_mode': 'cutoff', 'cutoff': 0.7224500491337675, 'grm_norm': 'cosine', 'self_loops': True, 'use_snp_selection': False}. Best is trial 30 with value: 0.3184890102856323.
[I 2025-12-09 11:15:08,003] Trial 116 finished with value: 0.312912303811517 and parameters: {'model_type': 'graphsage', 'hidden_dims': '[512, 64]', 'dropout': 0.4763124242763754, 'batch_norm': True, 'sage_aggr': 'mean', 'sage_normalize': True, 'sage_project': False, 'lr': 0.006218861103620854, 'weight_decay': 3.3475226863879314e-06, 'epochs': 258, 'loss': 'mse', 'optimizer': 'adam', 'graph_mode': 'cutoff', 'cutoff': 0.7490555376651893, 'grm_norm': 'cosine', 'self_loops': True, 'use_snp_selection': False}. Best is trial 30 with value: 0.3184890102856323.
[I 2025-12-09 11:16:51,885] Trial 117 finished with value: 0.3136321903351503 and parameters: {'model_type': 'graphsage', 'hidden_dims': '[512, 128]', 'dropout': 0.505523677100285, 'batch_norm': True, 'sage_aggr': 'mean', 'sage_normalize': True, 'sage_project': False, 'lr': 0.0043001141277894, 'weight_decay': 2.3895553120144195e-06, 'epochs': 232, 'loss': 'mse', 'optimizer': 'adam', 'graph_mode': 'cutoff', 'cutoff': 0.7239376433577002, 'grm_norm': 'cosine', 'self_loops': True, 'use_snp_selection': False}. Best is trial 30 with value: 0.3184890102856323.
[I 2025-12-09 11:18:32,256] Trial 118 finished with value: 0.3095111614211787 and parameters: {'model_type': 'graphsage', 'hidden_dims': '[512, 128]', 'dropout': 0.49780214935592615, 'batch_norm': True, 'sage_aggr': 'mean', 'sage_normalize': True, 'sage_project': False, 'lr': 0.004867550599909167, 'weight_decay': 1.5447603723519274e-06, 'epochs': 223, 'loss': 'mse', 'optimizer': 'adam', 'graph_mode': 'cutoff', 'cutoff': 0.6665284094117865, 'grm_norm': 'cosine', 'self_loops': True, 'use_snp_selection': False}. Best is trial 30 with value: 0.3184890102856323.
[I 2025-12-09 11:19:53,004] Trial 119 finished with value: 0.2958468779921525 and parameters: {'model_type': 'graphsage', 'hidden_dims': '[256, 128]', 'dropout': 0.46692864264668166, 'batch_norm': False, 'sage_aggr': 'mean', 'sage_normalize': True, 'sage_project': False, 'lr': 0.005774966065300647, 'weight_decay': 1.0111841016442604e-06, 'epochs': 252, 'loss': 'mse', 'optimizer': 'adam', 'graph_mode': 'cutoff', 'cutoff': 0.40704431540542185, 'grm_norm': 'cosine', 'self_loops': True, 'use_snp_selection': False}. Best is trial 30 with value: 0.3184890102856323.
[I 2025-12-09 11:20:44,626] Trial 120 finished with value: 0.2959558216871775 and parameters: {'model_type': 'graphsage', 'hidden_dims': '[512, 128]', 'dropout': 0.4476524406327074, 'batch_norm': True, 'sage_aggr': 'mean', 'sage_normalize': False, 'sage_project': False, 'lr': 0.0006264696207740955, 'weight_decay': 2.2176270342723746e-06, 'epochs': 268, 'loss': 'mse', 'optimizer': 'adam', 'graph_mode': 'cutoff', 'cutoff': 0.6939579445125269, 'grm_norm': 'cosine', 'self_loops': False, 'use_snp_selection': True, 'num_snps': 12598}. Best is trial 30 with value: 0.3184890102856323.
[I 2025-12-09 11:22:27,609] Trial 121 finished with value: 0.3099603588513132 and parameters: {'model_type': 'graphsage', 'hidden_dims': '[512, 128]', 'dropout': 0.5464164153440683, 'batch_norm': True, 'sage_aggr': 'mean', 'sage_normalize': True, 'sage_project': False, 'lr': 0.008710837468471648, 'weight_decay': 1.971530734651497e-06, 'epochs': 230, 'loss': 'mse', 'optimizer': 'adam', 'graph_mode': 'cutoff', 'cutoff': 0.7592895479021026, 'grm_norm': 'cosine', 'self_loops': True, 'use_snp_selection': False}. Best is trial 30 with value: 0.3184890102856323.
[I 2025-12-09 11:24:15,261] Trial 122 finished with value: 0.3115429369600816 and parameters: {'model_type': 'graphsage', 'hidden_dims': '[512, 128]', 'dropout': 0.5241056631327252, 'batch_norm': True, 'sage_aggr': 'mean', 'sage_normalize': True, 'sage_project': False, 'lr': 0.006778291086338869, 'weight_decay': 1.3714211615871684e-06, 'epochs': 242, 'loss': 'mse', 'optimizer': 'adam', 'graph_mode': 'cutoff', 'cutoff': 0.7738176514702801, 'grm_norm': 'cosine', 'self_loops': True, 'use_snp_selection': False}. Best is trial 30 with value: 0.3184890102856323.
[I 2025-12-09 11:26:16,675] Trial 123 finished with value: 0.3089723120364147 and parameters: {'model_type': 'graphsage', 'hidden_dims': '[512, 128]', 'dropout': 0.5678175347591233, 'batch_norm': True, 'sage_aggr': 'mean', 'sage_normalize': True, 'sage_project': False, 'lr': 0.009967419243675205, 'weight_decay': 8.77113254120642e-05, 'epochs': 277, 'loss': 'mse', 'optimizer': 'adam', 'graph_mode': 'cutoff', 'cutoff': 0.7991819219453209, 'grm_norm': 'cosine', 'self_loops': True, 'use_snp_selection': False}. Best is trial 30 with value: 0.3184890102856323.
[I 2025-12-09 11:27:34,676] Trial 124 finished with value: 0.3106140338186094 and parameters: {'model_type': 'graphsage', 'hidden_dims': '[512, 128]', 'dropout': 0.5339405669310057, 'batch_norm': True, 'sage_aggr': 'mean', 'sage_normalize': True, 'sage_project': False, 'lr': 0.005510645507727394, 'weight_decay': 6.770604201714709e-07, 'epochs': 166, 'loss': 'mse', 'optimizer': 'adam', 'graph_mode': 'cutoff', 'cutoff': 0.7511984669745886, 'grm_norm': 'cosine', 'self_loops': True, 'use_snp_selection': False}. Best is trial 30 with value: 0.3184890102856323.
[I 2025-12-09 11:29:43,611] Trial 125 finished with value: 0.3098033044243348 and parameters: {'model_type': 'graphsage', 'hidden_dims': '[512, 128]', 'dropout': 0.5146067609161671, 'batch_norm': True, 'sage_aggr': 'mean', 'sage_normalize': True, 'sage_project': False, 'lr': 0.007862449563040327, 'weight_decay': 1.1354059257064627e-06, 'epochs': 296, 'loss': 'mse', 'optimizer': 'adam', 'graph_mode': 'cutoff', 'cutoff': 0.7072355613300341, 'grm_norm': 'cosine', 'self_loops': True, 'use_snp_selection': False}. Best is trial 30 with value: 0.3184890102856323.
[I 2025-12-09 11:30:17,700] Trial 126 finished with value: 0.3135438157419516 and parameters: {'model_type': 'graphsage', 'hidden_dims': '[512, 128]', 'dropout': 0.5557384465670245, 'batch_norm': True, 'sage_aggr': 'mean', 'sage_normalize': True, 'sage_project': False, 'lr': 0.004013427404645164, 'weight_decay': 3.9908792252664856e-06, 'epochs': 56, 'loss': 'mse', 'optimizer': 'adam', 'graph_mode': 'cutoff', 'cutoff': 0.7186196857347389, 'grm_norm': 'gcn', 'self_loops': True, 'use_snp_selection': False}. Best is trial 30 with value: 0.3184890102856323.
[I 2025-12-09 11:31:16,899] Trial 127 finished with value: 0.30398081082992545 and parameters: {'model_type': 'graphsage', 'hidden_dims': '[512, 64]', 'dropout': 0.4868146626788498, 'batch_norm': True, 'sage_aggr': 'mean', 'sage_normalize': True, 'sage_project': False, 'lr': 0.006558091991511607, 'weight_decay': 2.5043692201899677e-06, 'epochs': 118, 'loss': 'mae', 'optimizer': 'adam', 'graph_mode': 'cutoff', 'cutoff': 0.8285900392232582, 'grm_norm': 'cosine', 'self_loops': True, 'use_snp_selection': False}. Best is trial 30 with value: 0.3184890102856323.
[I 2025-12-09 11:31:45,996] Trial 128 finished with value: 0.315234147299026 and parameters: {'model_type': 'graphsage', 'hidden_dims': '[128, 64]', 'dropout': 0.5396238864986704, 'batch_norm': True, 'sage_aggr': 'max', 'sage_normalize': True, 'sage_project': False, 'lr': 0.005028790476723961, 'weight_decay': 6.9459862198506914e-06, 'epochs': 145, 'loss': 'mse', 'optimizer': 'adam', 'graph_mode': 'cutoff', 'cutoff': 0.8076871382947508, 'grm_norm': 'cosine_then_gcn', 'self_loops': False, 'use_snp_selection': False}. Best is trial 30 with value: 0.3184890102856323.
[I 2025-12-09 11:32:34,322] Trial 129 finished with value: 0.31080934337143884 and parameters: {'model_type': 'graphsage', 'hidden_dims': '[512, 128]', 'dropout': 0.5713555588788971, 'batch_norm': True, 'sage_aggr': 'mean', 'sage_normalize': True, 'sage_project': False, 'lr': 0.0032971506680327983, 'weight_decay': 3.3038528037550022e-06, 'epochs': 90, 'loss': 'mse', 'optimizer': 'adam', 'graph_mode': 'cutoff', 'cutoff': 0.7379188750502796, 'grm_norm': 'cosine_then_gcn', 'self_loops': True, 'use_snp_selection': False}. Best is trial 30 with value: 0.3184890102856323.
[I 2025-12-09 11:34:16,073] Trial 130 finished with value: 0.31212639297016775 and parameters: {'model_type': 'graphsage', 'hidden_dims': '[512, 128]', 'dropout': 0.49773278104963387, 'batch_norm': True, 'sage_aggr': 'mean', 'sage_normalize': True, 'sage_project': False, 'lr': 0.008614123863958108, 'weight_decay': 1.732918182207291e-06, 'epochs': 227, 'loss': 'mse', 'optimizer': 'adam', 'graph_mode': 'cutoff', 'cutoff': 0.7826161151751374, 'grm_norm': 'cosine', 'self_loops': True, 'use_snp_selection': False}. Best is trial 30 with value: 0.3184890102856323.
[I 2025-12-09 11:35:47,689] Trial 131 finished with value: 0.31181533036350645 and parameters: {'model_type': 'graphsage', 'hidden_dims': '[512, 128]', 'dropout': 0.5239051392443156, 'batch_norm': True, 'sage_aggr': 'mean', 'sage_normalize': True, 'sage_project': False, 'lr': 0.007645364218988153, 'weight_decay': 5.213850925857324e-06, 'epochs': 201, 'loss': 'mse', 'optimizer': 'adam', 'graph_mode': 'cutoff', 'cutoff': 0.7711471801510629, 'grm_norm': 'cosine_then_gcn', 'self_loops': True, 'use_snp_selection': False}. Best is trial 30 with value: 0.3184890102856323.
