[I 2025-12-10 04:06:29,035] Trial 67 finished with value: 0.2655872238918428 and parameters: {'model_type': 'graphsage', 'hidden_dims': '[512, 64]', 'dropout': 0.22485677841105162, 'batch_norm': True, 'sage_aggr': 'max', 'sage_normalize': True, 'sage_project': False, 'lr': 4.024755394668832e-05, 'weight_decay': 9.956705885710746e-07, 'epochs': 257, 'loss': 'mae', 'optimizer': 'adam', 'graph_mode': 'cutoff', 'cutoff': 0.42737551108407534, 'grm_norm': 'none', 'self_loops': False, 'use_snp_selection': False}. Best is trial 28 with value: 0.30732090388868005.
[I 2025-12-10 04:10:20,421] Trial 68 finished with value: 0.2891249320194719 and parameters: {'model_type': 'graphsage', 'hidden_dims': '[256, 128]', 'dropout': 0.24545083627253966, 'batch_norm': False, 'sage_aggr': 'max', 'sage_normalize': False, 'sage_project': False, 'lr': 3.0187730567805976e-05, 'weight_decay': 1.2974245212016753e-07, 'epochs': 285, 'loss': 'mse', 'optimizer': 'adam', 'graph_mode': 'knn', 'knn_k': 8, 'weighted_edges': True, 'symmetrize_mode': 'union', 'self_loops': False, 'use_snp_selection': True, 'num_snps': 28761}. Best is trial 28 with value: 0.30732090388868005.
[I 2025-12-10 04:11:53,274] Trial 69 finished with value: 0.2732380656004416 and parameters: {'model_type': 'graphsage', 'hidden_dims': '[512, 128]', 'dropout': 0.17488929790774568, 'batch_norm': False, 'sage_aggr': 'max', 'sage_normalize': False, 'sage_project': False, 'lr': 1.883914873425882e-05, 'weight_decay': 1.981674476384367e-07, 'epochs': 335, 'loss': 'mse', 'optimizer': 'adam', 'graph_mode': 'cutoff', 'cutoff': 0.8982154358987493, 'grm_norm': 'gcn', 'self_loops': False, 'use_snp_selection': True, 'num_snps': 21259}. Best is trial 28 with value: 0.30732090388868005.
[I 2025-12-10 04:14:00,255] Trial 70 finished with value: 0.28581922166842133 and parameters: {'model_type': 'graphsage', 'hidden_dims': '[512, 256]', 'dropout': 0.5728576775388807, 'batch_norm': False, 'sage_aggr': 'max', 'sage_normalize': False, 'sage_project': False, 'lr': 1.3804602727010044e-05, 'weight_decay': 5.030795344988826e-06, 'epochs': 339, 'loss': 'mse', 'optimizer': 'adam', 'graph_mode': 'cutoff', 'cutoff': 0.4980224868314059, 'grm_norm': 'none', 'self_loops': False, 'use_snp_selection': True, 'num_snps': 24470}. Best is trial 28 with value: 0.30732090388868005.
[I 2025-12-10 04:18:57,202] Trial 71 finished with value: 0.30136884832837857 and parameters: {'model_type': 'graphsage', 'hidden_dims': '[256, 128]', 'dropout': 0.136024005833788, 'batch_norm': False, 'sage_aggr': 'max', 'sage_normalize': False, 'sage_project': False, 'lr': 2.2678124553992546e-05, 'weight_decay': 7.49502655864784e-07, 'epochs': 302, 'loss': 'mse', 'optimizer': 'adam', 'graph_mode': 'cutoff', 'cutoff': 0.20143301396488072, 'grm_norm': 'gcn', 'self_loops': False, 'use_snp_selection': True, 'num_snps': 27127}. Best is trial 28 with value: 0.30732090388868005.
[I 2025-12-10 04:23:43,879] Trial 72 finished with value: 0.2961291191031353 and parameters: {'model_type': 'graphsage', 'hidden_dims': '[256, 128]', 'dropout': 0.12627618021020315, 'batch_norm': False, 'sage_aggr': 'max', 'sage_normalize': False, 'sage_project': False, 'lr': 1.002212345880168e-05, 'weight_decay': 3.4392771353925024e-07, 'epochs': 311, 'loss': 'mse', 'optimizer': 'adam', 'graph_mode': 'cutoff', 'cutoff': 0.21757232271323532, 'grm_norm': 'gcn', 'self_loops': False, 'use_snp_selection': True, 'num_snps': 26906}. Best is trial 28 with value: 0.30732090388868005.
[I 2025-12-10 04:27:16,786] Trial 73 finished with value: 0.2930968504437164 and parameters: {'model_type': 'graphsage', 'hidden_dims': '[256, 128]', 'dropout': 0.150284377591048, 'batch_norm': False, 'sage_aggr': 'max', 'sage_normalize': False, 'sage_project': False, 'lr': 2.314691601109827e-05, 'weight_decay': 2.5479824443004134e-07, 'epochs': 268, 'loss': 'mse', 'optimizer': 'adam', 'graph_mode': 'cutoff', 'cutoff': 0.2616090879779596, 'grm_norm': 'gcn', 'self_loops': False, 'use_snp_selection': True, 'num_snps': 29365}. Best is trial 28 with value: 0.30732090388868005.
[I 2025-12-10 04:30:32,005] Trial 74 finished with value: 0.29179822335488226 and parameters: {'model_type': 'graphsage', 'hidden_dims': '[256, 128, 64]', 'dropout': 0.2031662373168499, 'batch_norm': False, 'sage_aggr': 'max', 'sage_normalize': False, 'sage_project': False, 'lr': 1.7922122796208805e-05, 'weight_decay': 1.947915141949363e-05, 'epochs': 317, 'loss': 'mse', 'optimizer': 'adam', 'graph_mode': 'cutoff', 'cutoff': 0.33124205213093283, 'grm_norm': 'gcn', 'self_loops': False, 'use_snp_selection': True, 'num_snps': 33745}. Best is trial 28 with value: 0.30732090388868005.
[I 2025-12-10 04:33:14,836] Trial 75 finished with value: 0.29481693402069153 and parameters: {'model_type': 'graphsage', 'hidden_dims': '[256, 128]', 'dropout': 0.3715196582548686, 'batch_norm': False, 'sage_aggr': 'max', 'sage_normalize': False, 'sage_project': False, 'lr': 4.730080310547879e-05, 'weight_decay': 1.2852599295002394e-07, 'epochs': 301, 'loss': 'mse', 'optimizer': 'adam', 'graph_mode': 'cutoff', 'cutoff': 0.22027452034293826, 'grm_norm': 'gcn', 'self_loops': False, 'use_snp_selection': True, 'num_snps': 18908}. Best is trial 28 with value: 0.30732090388868005.
[I 2025-12-10 04:35:09,859] Trial 76 finished with value: 0.2885305586621781 and parameters: {'model_type': 'graphsage', 'hidden_dims': '[128, 64]', 'dropout': 0.11055871211500676, 'batch_norm': False, 'sage_aggr': 'mean', 'sage_normalize': False, 'sage_project': False, 'lr': 1.6098118202496487e-05, 'weight_decay': 6.3896086315903e-07, 'epochs': 280, 'loss': 'mse', 'optimizer': 'adam', 'graph_mode': 'cutoff', 'cutoff': 0.28754728044388134, 'grm_norm': 'cosine_then_gcn', 'self_loops': False, 'use_snp_selection': True, 'num_snps': 24856}. Best is trial 28 with value: 0.30732090388868005.
[I 2025-12-10 04:36:53,660] Trial 77 finished with value: 0.28492459775276313 and parameters: {'model_type': 'graphsage', 'hidden_dims': '[512, 256]', 'dropout': 0.18723646349385376, 'batch_norm': True, 'sage_aggr': 'max', 'sage_normalize': False, 'sage_project': False, 'lr': 2.6991267213320152e-05, 'weight_decay': 1.339265883433267e-06, 'epochs': 293, 'loss': 'mse', 'optimizer': 'adam', 'graph_mode': 'cutoff', 'cutoff': 0.8511178814306282, 'grm_norm': 'gcn', 'self_loops': False, 'use_snp_selection': True, 'num_snps': 27301}. Best is trial 28 with value: 0.30732090388868005.
[I 2025-12-10 04:39:39,191] Trial 78 finished with value: 0.26856657240689313 and parameters: {'model_type': 'graphsage', 'hidden_dims': '[256, 128]', 'dropout': 0.13559078863825236, 'batch_norm': False, 'sage_aggr': 'max', 'sage_normalize': True, 'sage_project': False, 'lr': 3.3087649342923564e-05, 'weight_decay': 1.7692185978747999e-07, 'epochs': 190, 'loss': 'mse', 'optimizer': 'adam', 'graph_mode': 'cutoff', 'cutoff': 0.2514351074367097, 'grm_norm': 'cosine', 'self_loops': True, 'use_snp_selection': False}. Best is trial 28 with value: 0.30732090388868005.
[I 2025-12-10 04:46:23,872] Trial 79 finished with value: 0.29735983330812876 and parameters: {'model_type': 'graphsage', 'hidden_dims': '[512, 256]', 'dropout': 0.2877067427578523, 'batch_norm': False, 'sage_aggr': 'max', 'sage_normalize': False, 'sage_project': False, 'lr': 1.2059286233303584e-05, 'weight_decay': 4.540893919719444e-07, 'epochs': 237, 'loss': 'mae', 'optimizer': 'adam', 'graph_mode': 'cutoff', 'cutoff': 0.200291922068777, 'grm_norm': 'gcn', 'self_loops': False, 'use_snp_selection': True, 'num_snps': 38089}. Best is trial 28 with value: 0.30732090388868005.
[I 2025-12-10 04:48:23,006] Trial 80 finished with value: 0.2771972396227371 and parameters: {'model_type': 'graphsage', 'hidden_dims': '[256, 128]', 'dropout': 0.16800179842262752, 'batch_norm': False, 'sage_aggr': 'max', 'sage_normalize': False, 'sage_project': False, 'lr': 2.228447692245843e-05, 'weight_decay': 7.518266473689118e-07, 'epochs': 323, 'loss': 'mse', 'optimizer': 'adam', 'graph_mode': 'knn', 'knn_k': 5, 'weighted_edges': True, 'symmetrize_mode': 'mutual', 'self_loops': False, 'use_snp_selection': True, 'num_snps': 29996}. Best is trial 28 with value: 0.30732090388868005.
[I 2025-12-10 04:51:34,429] Trial 81 finished with value: 0.29869473487999637 and parameters: {'model_type': 'graphsage', 'hidden_dims': '[256, 128]', 'dropout': 0.14229720928368275, 'batch_norm': False, 'sage_aggr': 'max', 'sage_normalize': False, 'sage_project': False, 'lr': 2.149011620799408e-05, 'weight_decay': 6.245582686068194e-07, 'epochs': 301, 'loss': 'mse', 'optimizer': 'adam', 'graph_mode': 'cutoff', 'cutoff': 0.20020635539328885, 'grm_norm': 'gcn', 'self_loops': False, 'use_snp_selection': True, 'num_snps': 22177}. Best is trial 28 with value: 0.30732090388868005.
[I 2025-12-10 04:53:41,591] Trial 82 finished with value: 0.29957845448605847 and parameters: {'model_type': 'graphsage', 'hidden_dims': '[256, 128]', 'dropout': 0.13087737242954312, 'batch_norm': False, 'sage_aggr': 'max', 'sage_normalize': False, 'sage_project': False, 'lr': 2.6337321129063044e-05, 'weight_decay': 2.918509678392627e-07, 'epochs': 313, 'loss': 'mse', 'optimizer': 'adam', 'graph_mode': 'cutoff', 'cutoff': 0.22132774444083364, 'grm_norm': 'gcn', 'self_loops': False, 'use_snp_selection': True, 'num_snps': 17464}. Best is trial 28 with value: 0.30732090388868005.
[I 2025-12-10 04:56:40,026] Trial 83 finished with value: 0.29625972323314376 and parameters: {'model_type': 'graphsage', 'hidden_dims': '[256, 128]', 'dropout': 0.15704385153389422, 'batch_norm': False, 'sage_aggr': 'max', 'sage_normalize': False, 'sage_project': False, 'lr': 1.6325159042134243e-05, 'weight_decay': 2.1892227543495255e-07, 'epochs': 341, 'loss': 'mse', 'optimizer': 'adam', 'graph_mode': 'cutoff', 'cutoff': 0.26538049419043097, 'grm_norm': 'gcn', 'self_loops': False, 'use_snp_selection': True, 'num_snps': 21592}. Best is trial 28 with value: 0.30732090388868005.
[I 2025-12-10 04:59:55,145] Trial 84 finished with value: 0.29966313745018314 and parameters: {'model_type': 'graphsage', 'hidden_dims': '[256, 128]', 'dropout': 0.1470116943918833, 'batch_norm': False, 'sage_aggr': 'max', 'sage_normalize': False, 'sage_project': False, 'lr': 1.403256727394977e-05, 'weight_decay': 3.711825084867595e-07, 'epochs': 264, 'loss': 'mse', 'optimizer': 'adam', 'graph_mode': 'cutoff', 'cutoff': 0.22497819239721625, 'grm_norm': 'gcn', 'self_loops': False, 'use_snp_selection': True, 'num_snps': 23793}. Best is trial 28 with value: 0.30732090388868005.
[I 2025-12-10 05:04:20,842] Trial 85 finished with value: 0.2958582861593039 and parameters: {'model_type': 'graphsage', 'hidden_dims': '[128, 64]', 'dropout': 0.19725902825685404, 'batch_norm': False, 'sage_aggr': 'max', 'sage_normalize': False, 'sage_project': False, 'lr': 1.1632554805250842e-05, 'weight_decay': 1.0578475787879516e-07, 'epochs': 306, 'loss': 'mse', 'optimizer': 'adam', 'graph_mode': 'cutoff', 'cutoff': 0.2522685270673383, 'grm_norm': 'none', 'self_loops': False, 'use_snp_selection': True, 'num_snps': 32419}. Best is trial 28 with value: 0.30732090388868005.
[I 2025-12-10 05:06:42,764] Trial 86 finished with value: 0.2985925346775886 and parameters: {'model_type': 'graphsage', 'hidden_dims': '[256, 128]', 'dropout': 0.11147112749478078, 'batch_norm': False, 'sage_aggr': 'max', 'sage_normalize': False, 'sage_project': False, 'lr': 2.0718473587085926e-05, 'weight_decay': 5.365398399359782e-07, 'epochs': 253, 'loss': 'mse', 'optimizer': 'adam', 'graph_mode': 'cutoff', 'cutoff': 0.30035060627730553, 'grm_norm': 'gcn', 'self_loops': False, 'use_snp_selection': True, 'num_snps': 26932}. Best is trial 28 with value: 0.30732090388868005.
[I 2025-12-10 05:16:39,450] Trial 87 finished with value: 0.06832281860468101 and parameters: {'model_type': 'graphsage', 'hidden_dims': '[512, 256]', 'dropout': 0.17544271500309705, 'batch_norm': False, 'sage_aggr': 'max', 'sage_normalize': False, 'sage_project': False, 'lr': 0.0004976752718426375, 'weight_decay': 1.5994767259097264e-07, 'epochs': 294, 'loss': 'mse', 'optimizer': 'adam', 'graph_mode': 'cutoff', 'cutoff': 0.2016626795163474, 'grm_norm': 'gcn', 'self_loops': False, 'use_snp_selection': True, 'num_snps': 44738}. Best is trial 28 with value: 0.30732090388868005.
[I 2025-12-10 05:22:21,625] Trial 88 finished with value: 0.28993856538514295 and parameters: {'model_type': 'graphsage', 'hidden_dims': '[512, 64]', 'dropout': 0.22117743325790884, 'batch_norm': False, 'sage_aggr': 'mean', 'sage_normalize': False, 'sage_project': False, 'lr': 5.356474105175565e-05, 'weight_decay': 3.040985899123547e-07, 'epochs': 286, 'loss': 'mse', 'optimizer': 'adam', 'graph_mode': 'cutoff', 'cutoff': 0.24157306679698504, 'grm_norm': 'none', 'self_loops': False, 'use_snp_selection': True, 'num_snps': 35446}. Best is trial 28 with value: 0.30732090388868005.
[I 2025-12-10 05:25:00,978] Trial 89 finished with value: 0.24087838954757584 and parameters: {'model_type': 'graphsage', 'hidden_dims': '[256, 128]', 'dropout': 0.1378462515866469, 'batch_norm': True, 'sage_aggr': 'max', 'sage_normalize': True, 'sage_project': False, 'lr': 3.531634410311415e-05, 'weight_decay': 2.2376031824447536e-07, 'epochs': 134, 'loss': 'mse', 'optimizer': 'adam', 'graph_mode': 'cutoff', 'cutoff': 0.22345593979081596, 'grm_norm': 'gcn', 'self_loops': False, 'use_snp_selection': True, 'num_snps': 30527}. Best is trial 28 with value: 0.30732090388868005.
[I 2025-12-10 05:26:12,805] Trial 90 finished with value: 0.2910201432116982 and parameters: {'model_type': 'graphsage', 'hidden_dims': '[256, 128, 64]', 'dropout': 0.16040947960581525, 'batch_norm': False, 'sage_aggr': 'max', 'sage_normalize': False, 'sage_project': False, 'lr': 2.4811650777437513e-05, 'weight_decay': 4.3147463557285915e-07, 'epochs': 221, 'loss': 'mse', 'optimizer': 'adam', 'graph_mode': 'cutoff', 'cutoff': 0.6946839891956145, 'grm_norm': 'none', 'self_loops': False, 'use_snp_selection': False}. Best is trial 28 with value: 0.30732090388868005.
[I 2025-12-10 05:30:37,405] Trial 91 finished with value: 0.30175013472497414 and parameters: {'model_type': 'graphsage', 'hidden_dims': '[256, 128]', 'dropout': 0.3225821371707288, 'batch_norm': False, 'sage_aggr': 'max', 'sage_normalize': False, 'sage_project': False, 'lr': 1.7313550242557645e-05, 'weight_decay': 2.01525298167363e-07, 'epochs': 300, 'loss': 'mse', 'optimizer': 'adam', 'graph_mode': 'cutoff', 'cutoff': 0.21311656523085706, 'grm_norm': 'none', 'self_loops': False, 'use_snp_selection': True, 'num_snps': 27700}. Best is trial 28 with value: 0.30732090388868005.
[I 2025-12-10 05:33:59,984] Trial 92 finished with value: 0.2938993439064578 and parameters: {'model_type': 'graphsage', 'hidden_dims': '[256, 128]', 'dropout': 0.43031710089328606, 'batch_norm': False, 'sage_aggr': 'max', 'sage_normalize': False, 'sage_project': False, 'lr': 1.7191675169685482e-05, 'weight_decay': 1.436242117483281e-07, 'epochs': 324, 'loss': 'mse', 'optimizer': 'adam', 'graph_mode': 'cutoff', 'cutoff': 0.27457265229250793, 'grm_norm': 'none', 'self_loops': False, 'use_snp_selection': True, 'num_snps': 25753}. Best is trial 28 with value: 0.30732090388868005.
[I 2025-12-10 05:37:43,683] Trial 93 finished with value: 0.2923779358252543 and parameters: {'model_type': 'graphsage', 'hidden_dims': '[256, 128]', 'dropout': 0.47187697790040034, 'batch_norm': False, 'sage_aggr': 'max', 'sage_normalize': False, 'sage_project': False, 'lr': 1.4087356725664711e-05, 'weight_decay': 5.319661438344515e-05, 'epochs': 305, 'loss': 'mse', 'optimizer': 'adam', 'graph_mode': 'cutoff', 'cutoff': 0.24129284993882, 'grm_norm': 'none', 'self_loops': False, 'use_snp_selection': True, 'num_snps': 27518}. Best is trial 28 with value: 0.30732090388868005.
[I 2025-12-10 05:40:39,582] Trial 94 finished with value: 0.30191567027862987 and parameters: {'model_type': 'graphsage', 'hidden_dims': '[256, 128]', 'dropout': 0.11481441217605669, 'batch_norm': False, 'sage_aggr': 'max', 'sage_normalize': False, 'sage_project': False, 'lr': 2.0803733483541225e-05, 'weight_decay': 2.5655214077156177e-07, 'epochs': 276, 'loss': 'mse', 'optimizer': 'adam', 'graph_mode': 'cutoff', 'cutoff': 0.21597702634109014, 'grm_norm': 'none', 'self_loops': False, 'use_snp_selection': True, 'num_snps': 20005}. Best is trial 28 with value: 0.30732090388868005.
[I 2025-12-10 05:41:59,274] Trial 95 finished with value: 0.009639252166369688 and parameters: {'model_type': 'graphsage', 'hidden_dims': '[512, 256]', 'dropout': 0.31656223828608193, 'batch_norm': False, 'sage_aggr': 'max', 'sage_normalize': False, 'sage_project': False, 'lr': 0.0026432624493729294, 'weight_decay': 2.591010149642754e-07, 'epochs': 275, 'loss': 'mse', 'optimizer': 'adam', 'graph_mode': 'cutoff', 'cutoff': 0.5523972252828572, 'grm_norm': 'none', 'self_loops': False, 'use_snp_selection': True, 'num_snps': 19707}. Best is trial 28 with value: 0.30732090388868005.
[I 2025-12-10 05:43:11,641] Trial 96 finished with value: 0.3022966213045349 and parameters: {'model_type': 'graphsage', 'hidden_dims': '[512, 128]', 'dropout': 0.10198520293111878, 'batch_norm': False, 'sage_aggr': 'max', 'sage_normalize': False, 'sage_project': False, 'lr': 1.0812512237950396e-05, 'weight_decay': 1.9787175172655141e-07, 'epochs': 244, 'loss': 'mse', 'optimizer': 'adam', 'graph_mode': 'cutoff', 'cutoff': 0.4042073126879179, 'grm_norm': 'none', 'self_loops': True, 'use_snp_selection': True, 'num_snps': 15170}. Best is trial 28 with value: 0.30732090388868005.
[I 2025-12-10 05:44:26,070] Trial 97 finished with value: 0.29519938723426903 and parameters: {'model_type': 'graphsage', 'hidden_dims': '[512, 128]', 'dropout': 0.10284954883669205, 'batch_norm': False, 'sage_aggr': 'max', 'sage_normalize': False, 'sage_project': False, 'lr': 1.1268891476087314e-05, 'weight_decay': 1.2509293213812877e-07, 'epochs': 244, 'loss': 'mae', 'optimizer': 'adam', 'graph_mode': 'cutoff', 'cutoff': 0.38469328791216484, 'grm_norm': 'none', 'self_loops': True, 'use_snp_selection': True, 'num_snps': 15517}. Best is trial 28 with value: 0.30732090388868005.
[I 2025-12-10 05:46:04,619] Trial 98 finished with value: 0.2875853576355649 and parameters: {'model_type': 'graphsage', 'hidden_dims': '[512, 128]', 'dropout': 0.11534349111740669, 'batch_norm': False, 'sage_aggr': 'max', 'sage_normalize': False, 'sage_project': False, 'lr': 1.004838581993594e-05, 'weight_decay': 3.4168572629966606e-07, 'epochs': 227, 'loss': 'mse', 'optimizer': 'adam', 'graph_mode': 'knn', 'knn_k': 10, 'weighted_edges': False, 'symmetrize_mode': 'union', 'self_loops': True, 'use_snp_selection': True, 'num_snps': 14297}. Best is trial 28 with value: 0.30732090388868005.
[I 2025-12-10 05:47:28,220] Trial 99 finished with value: 0.304931136859187 and parameters: {'model_type': 'graphsage', 'hidden_dims': '[512, 128]', 'dropout': 0.12288528543067073, 'batch_norm': False, 'sage_aggr': 'max', 'sage_normalize': False, 'sage_project': False, 'lr': 1.5287798207919305e-05, 'weight_decay': 2.1549077367384439e-07, 'epochs': 259, 'loss': 'mse', 'optimizer': 'adam', 'graph_mode': 'cutoff', 'cutoff': 0.4141970937590488, 'grm_norm': 'none', 'self_loops': True, 'use_snp_selection': True, 'num_snps': 17338}. Best is trial 28 with value: 0.30732090388868005.
[I 2025-12-10 05:48:34,872] Trial 100 finished with value: 0.30351473509074944 and parameters: {'model_type': 'graphsage', 'hidden_dims': '[512, 128]', 'dropout': 0.10240430700770553, 'batch_norm': False, 'sage_aggr': 'max', 'sage_normalize': False, 'sage_project': False, 'lr': 1.441480770345773e-05, 'weight_decay': 1.6980746990889895e-07, 'epochs': 258, 'loss': 'mse', 'optimizer': 'adam', 'graph_mode': 'cutoff', 'cutoff': 0.4097749307872628, 'grm_norm': 'none', 'self_loops': True, 'use_snp_selection': True, 'num_snps': 13047}. Best is trial 28 with value: 0.30732090388868005.
[I 2025-12-10 05:49:33,133] Trial 101 finished with value: 0.30615860522350613 and parameters: {'model_type': 'graphsage', 'hidden_dims': '[512, 128]', 'dropout': 0.10224658844612032, 'batch_norm': False, 'sage_aggr': 'max', 'sage_normalize': False, 'sage_project': False, 'lr': 1.2789725670273662e-05, 'weight_decay': 2.0956376232621742e-07, 'epochs': 253, 'loss': 'mse', 'optimizer': 'adam', 'graph_mode': 'cutoff', 'cutoff': 0.4270562348398051, 'grm_norm': 'none', 'self_loops': True, 'use_snp_selection': True, 'num_snps': 10749}. Best is trial 28 with value: 0.30732090388868005.
[I 2025-12-10 05:50:26,401] Trial 102 finished with value: 0.3060477534856643 and parameters: {'model_type': 'graphsage', 'hidden_dims': '[512, 128]', 'dropout': 0.10103355791739288, 'batch_norm': False, 'sage_aggr': 'max', 'sage_normalize': False, 'sage_project': False, 'lr': 1.4868497007230072e-05, 'weight_decay': 1.6662285286143575e-07, 'epochs': 254, 'loss': 'mse', 'optimizer': 'adam', 'graph_mode': 'cutoff', 'cutoff': 0.4410123308051565, 'grm_norm': 'none', 'self_loops': True, 'use_snp_selection': True, 'num_snps': 9514}. Best is trial 28 with value: 0.30732090388868005.
[I 2025-12-10 05:51:11,977] Trial 103 finished with value: 0.30513031798357976 and parameters: {'model_type': 'graphsage', 'hidden_dims': '[512, 128]', 'dropout': 0.10362032846359595, 'batch_norm': False, 'sage_aggr': 'max', 'sage_normalize': False, 'sage_project': False, 'lr': 1.2784260554654388e-05, 'weight_decay': 1.544926584211791e-07, 'epochs': 252, 'loss': 'mse', 'optimizer': 'adam', 'graph_mode': 'cutoff', 'cutoff': 0.4275849614097087, 'grm_norm': 'none', 'self_loops': True, 'use_snp_selection': True, 'num_snps': 7062}. Best is trial 28 with value: 0.30732090388868005.
