[I 2025-12-09 14:22:16,809] Trial 96 finished with value: 0.3171841041887872 and parameters: {'model_type': 'graphsage', 'hidden_dims': '[256, 128]', 'dropout': 0.4315776445551587, 'batch_norm': True, 'sage_aggr': 'mean', 'sage_normalize': True, 'sage_project': False, 'lr': 0.008654676808649307, 'weight_decay': 1.9571472767866745e-06, 'epochs': 263, 'loss': 'mse', 'optimizer': 'adam', 'graph_mode': 'cutoff', 'cutoff': 0.7532166085906288, 'grm_norm': 'cosine_then_gcn', 'self_loops': True, 'use_snp_selection': False}. Best is trial 90 with value: 0.31856955560620687.
[I 2025-12-09 14:23:25,274] Trial 97 finished with value: 0.31424457838167297 and parameters: {'model_type': 'graphsage', 'hidden_dims': '[256, 128]', 'dropout': 0.4100224648404336, 'batch_norm': True, 'sage_aggr': 'mean', 'sage_normalize': True, 'sage_project': False, 'lr': 0.004064741411954559, 'weight_decay': 1.9240573732005378e-06, 'epochs': 266, 'loss': 'mse', 'optimizer': 'adam', 'graph_mode': 'cutoff', 'cutoff': 0.754738284044075, 'grm_norm': 'cosine_then_gcn', 'self_loops': True, 'use_snp_selection': False}. Best is trial 90 with value: 0.31856955560620687.
[I 2025-12-09 14:24:28,136] Trial 98 finished with value: 0.31836626286397846 and parameters: {'model_type': 'graphsage', 'hidden_dims': '[256, 128]', 'dropout': 0.42829695226910564, 'batch_norm': True, 'sage_aggr': 'mean', 'sage_normalize': True, 'sage_project': False, 'lr': 0.00274201379100088, 'weight_decay': 2.2010612285915982e-06, 'epochs': 240, 'loss': 'mse', 'optimizer': 'adam', 'graph_mode': 'cutoff', 'cutoff': 0.8973608813548897, 'grm_norm': 'cosine_then_gcn', 'self_loops': True, 'use_snp_selection': False}. Best is trial 90 with value: 0.31856955560620687.
[I 2025-12-09 14:25:31,210] Trial 99 finished with value: 0.315943682672228 and parameters: {'model_type': 'graphsage', 'hidden_dims': '[256, 128]', 'dropout': 0.399728936401966, 'batch_norm': True, 'sage_aggr': 'mean', 'sage_normalize': True, 'sage_project': False, 'lr': 0.0007397794433784898, 'weight_decay': 8.241774519725556e-07, 'epochs': 241, 'loss': 'mse', 'optimizer': 'adam', 'graph_mode': 'cutoff', 'cutoff': 0.8949976547764107, 'grm_norm': 'cosine_then_gcn', 'self_loops': True, 'use_snp_selection': False}. Best is trial 90 with value: 0.31856955560620687.
[I 2025-12-09 14:26:32,845] Trial 100 finished with value: 0.31325558931320346 and parameters: {'model_type': 'graphsage', 'hidden_dims': '[256, 128]', 'dropout': 0.4252135668203696, 'batch_norm': False, 'sage_aggr': 'mean', 'sage_normalize': True, 'sage_project': False, 'lr': 0.0009570865482806143, 'weight_decay': 7.851645852449267e-07, 'epochs': 235, 'loss': 'mse', 'optimizer': 'adam', 'graph_mode': 'cutoff', 'cutoff': 0.8949733162273248, 'grm_norm': 'cosine_then_gcn', 'self_loops': False, 'use_snp_selection': False}. Best is trial 90 with value: 0.31856955560620687.
[I 2025-12-09 14:27:32,239] Trial 101 finished with value: 0.3158846909264291 and parameters: {'model_type': 'graphsage', 'hidden_dims': '[256, 128]', 'dropout': 0.39728663436424544, 'batch_norm': True, 'sage_aggr': 'mean', 'sage_normalize': True, 'sage_project': False, 'lr': 0.0007060847645373522, 'weight_decay': 1.4087861005438607e-06, 'epochs': 224, 'loss': 'mse', 'optimizer': 'adam', 'graph_mode': 'cutoff', 'cutoff': 0.8725649277847761, 'grm_norm': 'cosine_then_gcn', 'self_loops': True, 'use_snp_selection': False}. Best is trial 90 with value: 0.31856955560620687.
[I 2025-12-09 14:28:37,440] Trial 102 finished with value: 0.31657258925977855 and parameters: {'model_type': 'graphsage', 'hidden_dims': '[256, 128]', 'dropout': 0.3976060905499851, 'batch_norm': True, 'sage_aggr': 'mean', 'sage_normalize': True, 'sage_project': False, 'lr': 0.0015207136947855482, 'weight_decay': 5.341325823728669e-07, 'epochs': 251, 'loss': 'mse', 'optimizer': 'adam', 'graph_mode': 'cutoff', 'cutoff': 0.8623595193958054, 'grm_norm': 'cosine_then_gcn', 'self_loops': True, 'use_snp_selection': False}. Best is trial 90 with value: 0.31856955560620687.
[I 2025-12-09 14:29:42,419] Trial 103 finished with value: 0.3129211107464914 and parameters: {'model_type': 'graphsage', 'hidden_dims': '[256, 128]', 'dropout': 0.39801403019329645, 'batch_norm': True, 'sage_aggr': 'mean', 'sage_normalize': True, 'sage_project': False, 'lr': 0.0005914829431382181, 'weight_decay': 4.889814843085158e-07, 'epochs': 250, 'loss': 'mse', 'optimizer': 'adam', 'graph_mode': 'cutoff', 'cutoff': 0.8630697830444413, 'grm_norm': 'cosine_then_gcn', 'self_loops': True, 'use_snp_selection': False}. Best is trial 90 with value: 0.31856955560620687.
[I 2025-12-09 14:30:45,545] Trial 104 finished with value: 0.3160507175686975 and parameters: {'model_type': 'graphsage', 'hidden_dims': '[256, 128]', 'dropout': 0.41543664520641393, 'batch_norm': True, 'sage_aggr': 'mean', 'sage_normalize': True, 'sage_project': False, 'lr': 0.0014795410822620542, 'weight_decay': 1.034641390499329e-06, 'epochs': 241, 'loss': 'mse', 'optimizer': 'adam', 'graph_mode': 'cutoff', 'cutoff': 0.8392283389185092, 'grm_norm': 'cosine_then_gcn', 'self_loops': True, 'use_snp_selection': False}. Best is trial 90 with value: 0.31856955560620687.
[I 2025-12-09 14:31:48,650] Trial 105 finished with value: 0.31641892751554385 and parameters: {'model_type': 'graphsage', 'hidden_dims': '[256, 128]', 'dropout': 0.3819527349863667, 'batch_norm': True, 'sage_aggr': 'mean', 'sage_normalize': True, 'sage_project': False, 'lr': 0.0013851931885128178, 'weight_decay': 1.2208341966657492e-06, 'epochs': 241, 'loss': 'mse', 'optimizer': 'adam', 'graph_mode': 'cutoff', 'cutoff': 0.8985041615553732, 'grm_norm': 'cosine_then_gcn', 'self_loops': True, 'use_snp_selection': False}. Best is trial 90 with value: 0.31856955560620687.
[I 2025-12-09 14:32:51,752] Trial 106 finished with value: 0.31704938668005866 and parameters: {'model_type': 'graphsage', 'hidden_dims': '[256, 128]', 'dropout': 0.41518733593151774, 'batch_norm': True, 'sage_aggr': 'mean', 'sage_normalize': True, 'sage_project': False, 'lr': 0.0014935359562828735, 'weight_decay': 1.0119203407370054e-06, 'epochs': 241, 'loss': 'mse', 'optimizer': 'adam', 'graph_mode': 'cutoff', 'cutoff': 0.8818394237531993, 'grm_norm': 'cosine_then_gcn', 'self_loops': True, 'use_snp_selection': False}. Best is trial 90 with value: 0.31856955560620687.
[I 2025-12-09 14:33:59,727] Trial 107 finished with value: 0.3157455980795686 and parameters: {'model_type': 'graphsage', 'hidden_dims': '[256, 128]', 'dropout': 0.41505833915598034, 'batch_norm': True, 'sage_aggr': 'mean', 'sage_normalize': True, 'sage_project': False, 'lr': 0.001514641161369554, 'weight_decay': 5.80741250542408e-07, 'epochs': 264, 'loss': 'mse', 'optimizer': 'adam', 'graph_mode': 'cutoff', 'cutoff': 0.8393910681776073, 'grm_norm': 'cosine_then_gcn', 'self_loops': True, 'use_snp_selection': False}. Best is trial 90 with value: 0.31856955560620687.
[I 2025-12-09 14:35:01,621] Trial 108 finished with value: 0.3178460977947676 and parameters: {'model_type': 'graphsage', 'hidden_dims': '[256, 128]', 'dropout': 0.38035477433098813, 'batch_norm': True, 'sage_aggr': 'mean', 'sage_normalize': True, 'sage_project': False, 'lr': 0.0011466049793002586, 'weight_decay': 9.178332081172232e-07, 'epochs': 241, 'loss': 'mse', 'optimizer': 'adam', 'graph_mode': 'cutoff', 'cutoff': 0.8982814505080586, 'grm_norm': 'gcn', 'self_loops': True, 'use_snp_selection': False}. Best is trial 90 with value: 0.31856955560620687.
[I 2025-12-09 14:36:21,685] Trial 109 finished with value: 0.3120498223068044 and parameters: {'model_type': 'graphsage', 'hidden_dims': '[256, 128]', 'dropout': 0.37613728847405026, 'batch_norm': True, 'sage_aggr': 'max', 'sage_normalize': True, 'sage_project': False, 'lr': 0.0012481024893308621, 'weight_decay': 1.0877150938743673e-06, 'epochs': 238, 'loss': 'mse', 'optimizer': 'adam', 'graph_mode': 'cutoff', 'cutoff': 0.8531138032723138, 'grm_norm': 'gcn', 'self_loops': True, 'use_snp_selection': True, 'num_snps': 45871}. Best is trial 90 with value: 0.31856955560620687.
[I 2025-12-09 14:37:25,966] Trial 110 finished with value: 0.31507820591910385 and parameters: {'model_type': 'graphsage', 'hidden_dims': '[256, 128]', 'dropout': 0.3774455234899141, 'batch_norm': True, 'sage_aggr': 'mean', 'sage_normalize': True, 'sage_project': False, 'lr': 0.0015870696466803516, 'weight_decay': 2.7404977487853238e-06, 'epochs': 252, 'loss': 'mse', 'optimizer': 'adam', 'graph_mode': 'cutoff', 'cutoff': 0.888023126654194, 'grm_norm': 'gcn', 'self_loops': True, 'use_snp_selection': False}. Best is trial 90 with value: 0.31856955560620687.
[I 2025-12-09 14:38:28,323] Trial 111 finished with value: 0.3123491491919824 and parameters: {'model_type': 'graphsage', 'hidden_dims': '[256, 128]', 'dropout': 0.35617434865636727, 'batch_norm': True, 'sage_aggr': 'mean', 'sage_normalize': True, 'sage_project': False, 'lr': 0.0010587767317104006, 'weight_decay': 3.525743611074306e-07, 'epochs': 243, 'loss': 'mse', 'optimizer': 'adam', 'graph_mode': 'cutoff', 'cutoff': 0.8965279523777163, 'grm_norm': 'gcn', 'self_loops': True, 'use_snp_selection': False}. Best is trial 90 with value: 0.31856955560620687.
[I 2025-12-09 14:39:30,272] Trial 112 finished with value: 0.3181180327565161 and parameters: {'model_type': 'graphsage', 'hidden_dims': '[256, 128]', 'dropout': 0.40449993549147045, 'batch_norm': True, 'sage_aggr': 'mean', 'sage_normalize': True, 'sage_project': False, 'lr': 0.0019076873740081737, 'weight_decay': 9.135362403811128e-07, 'epochs': 241, 'loss': 'mse', 'optimizer': 'adam', 'graph_mode': 'cutoff', 'cutoff': 0.829255246638402, 'grm_norm': 'gcn', 'self_loops': True, 'use_snp_selection': False}. Best is trial 90 with value: 0.31856955560620687.
[I 2025-12-09 14:40:29,842] Trial 113 finished with value: 0.3162234530118715 and parameters: {'model_type': 'graphsage', 'hidden_dims': '[256, 128]', 'dropout': 0.3844433875054496, 'batch_norm': True, 'sage_aggr': 'mean', 'sage_normalize': True, 'sage_project': False, 'lr': 0.0019654530974923122, 'weight_decay': 9.070823207950027e-07, 'epochs': 230, 'loss': 'mse', 'optimizer': 'adam', 'graph_mode': 'cutoff', 'cutoff': 0.8173074276213348, 'grm_norm': 'gcn', 'self_loops': True, 'use_snp_selection': False}. Best is trial 90 with value: 0.31856955560620687.
[I 2025-12-09 14:41:29,850] Trial 114 finished with value: 0.3196654869303589 and parameters: {'model_type': 'graphsage', 'hidden_dims': '[256, 128]', 'dropout': 0.3874100950986382, 'batch_norm': True, 'sage_aggr': 'mean', 'sage_normalize': True, 'sage_project': False, 'lr': 0.0018228274753120022, 'weight_decay': 4.826159186055726e-07, 'epochs': 232, 'loss': 'mse', 'optimizer': 'adam', 'graph_mode': 'cutoff', 'cutoff': 0.8153741204032625, 'grm_norm': 'gcn', 'self_loops': True, 'use_snp_selection': False}. Best is trial 114 with value: 0.3196654869303589.
[I 2025-12-09 14:42:35,266] Trial 115 finished with value: 0.3148221697829877 and parameters: {'model_type': 'graphsage', 'hidden_dims': '[256, 128]', 'dropout': 0.4465019637157085, 'batch_norm': True, 'sage_aggr': 'mean', 'sage_normalize': True, 'sage_project': False, 'lr': 0.0022682696514477866, 'weight_decay': 3.8689935444702364e-07, 'epochs': 257, 'loss': 'mse', 'optimizer': 'adam', 'graph_mode': 'cutoff', 'cutoff': 0.7939414137912189, 'grm_norm': 'gcn', 'self_loops': True, 'use_snp_selection': False}. Best is trial 114 with value: 0.3196654869303589.
[I 2025-12-09 14:43:35,460] Trial 116 finished with value: 0.3120093632812345 and parameters: {'model_type': 'graphsage', 'hidden_dims': '[256, 128]', 'dropout': 0.4329948853081191, 'batch_norm': True, 'sage_aggr': 'mean', 'sage_normalize': True, 'sage_project': False, 'lr': 0.002613913721958376, 'weight_decay': 5.515329539115391e-07, 'epochs': 233, 'loss': 'mse', 'optimizer': 'adam', 'graph_mode': 'cutoff', 'cutoff': 0.8654092396272746, 'grm_norm': 'gcn', 'self_loops': True, 'use_snp_selection': False}. Best is trial 114 with value: 0.3196654869303589.
[I 2025-12-09 14:44:32,090] Trial 117 finished with value: 0.31835260358450707 and parameters: {'model_type': 'graphsage', 'hidden_dims': '[256, 128]', 'dropout': 0.4099679212521392, 'batch_norm': True, 'sage_aggr': 'mean', 'sage_normalize': True, 'sage_project': False, 'lr': 0.00166248183851773, 'weight_decay': 2.634877784863581e-07, 'epochs': 216, 'loss': 'mse', 'optimizer': 'adam', 'graph_mode': 'cutoff', 'cutoff': 0.8274236887985429, 'grm_norm': 'gcn', 'self_loops': True, 'use_snp_selection': False}. Best is trial 114 with value: 0.3196654869303589.
[I 2025-12-09 14:45:28,860] Trial 118 finished with value: 0.31738019088231184 and parameters: {'model_type': 'graphsage', 'hidden_dims': '[256, 128]', 'dropout': 0.40889346188606246, 'batch_norm': True, 'sage_aggr': 'mean', 'sage_normalize': True, 'sage_project': False, 'lr': 0.0017249495090531032, 'weight_decay': 1.990784824731052e-07, 'epochs': 217, 'loss': 'mse', 'optimizer': 'adam', 'graph_mode': 'cutoff', 'cutoff': 0.8245115390952151, 'grm_norm': 'gcn', 'self_loops': True, 'use_snp_selection': False}. Best is trial 114 with value: 0.3196654869303589.
[I 2025-12-09 14:46:23,310] Trial 119 finished with value: 0.31493313997539635 and parameters: {'model_type': 'graphsage', 'hidden_dims': '[256, 128]', 'dropout': 0.40901713351818253, 'batch_norm': True, 'sage_aggr': 'mean', 'sage_normalize': True, 'sage_project': False, 'lr': 0.0017209016070215087, 'weight_decay': 1.9963930777650367e-07, 'epochs': 206, 'loss': 'mse', 'optimizer': 'adam', 'graph_mode': 'cutoff', 'cutoff': 0.831856868761831, 'grm_norm': 'gcn', 'self_loops': True, 'use_snp_selection': False}. Best is trial 114 with value: 0.3196654869303589.
[I 2025-12-09 14:47:20,201] Trial 120 finished with value: 0.3091968045850537 and parameters: {'model_type': 'graphsage', 'hidden_dims': '[256, 128]', 'dropout': 0.4204784002178637, 'batch_norm': False, 'sage_aggr': 'mean', 'sage_normalize': True, 'sage_project': False, 'lr': 0.0018160914410473646, 'weight_decay': 2.6916191796024713e-07, 'epochs': 218, 'loss': 'mse', 'optimizer': 'adam', 'graph_mode': 'cutoff', 'cutoff': 0.8275665214790748, 'grm_norm': 'gcn', 'self_loops': False, 'use_snp_selection': False}. Best is trial 114 with value: 0.3196654869303589.
[I 2025-12-09 14:48:15,759] Trial 121 finished with value: 0.3177998859461531 and parameters: {'model_type': 'graphsage', 'hidden_dims': '[256, 128]', 'dropout': 0.4063175719982026, 'batch_norm': True, 'sage_aggr': 'mean', 'sage_normalize': True, 'sage_project': False, 'lr': 0.001142766334655296, 'weight_decay': 1.8020761354925552e-07, 'epochs': 211, 'loss': 'mse', 'optimizer': 'adam', 'graph_mode': 'cutoff', 'cutoff': 0.7771001550463851, 'grm_norm': 'gcn', 'self_loops': True, 'use_snp_selection': False}. Best is trial 114 with value: 0.3196654869303589.
[I 2025-12-09 14:49:11,075] Trial 122 finished with value: 0.3155135294560802 and parameters: {'model_type': 'graphsage', 'hidden_dims': '[256, 128]', 'dropout': 0.393762940887351, 'batch_norm': True, 'sage_aggr': 'mean', 'sage_normalize': True, 'sage_project': False, 'lr': 0.0011896832332081745, 'weight_decay': 1.7979075076848302e-07, 'epochs': 210, 'loss': 'mse', 'optimizer': 'adam', 'graph_mode': 'cutoff', 'cutoff': 0.7683446959575342, 'grm_norm': 'gcn', 'self_loops': True, 'use_snp_selection': False}. Best is trial 114 with value: 0.3196654869303589.
[I 2025-12-09 14:50:20,209] Trial 123 finished with value: 0.3148762216549439 and parameters: {'model_type': 'graphsage', 'hidden_dims': '[256, 128]', 'dropout': 0.4051463287202274, 'batch_norm': True, 'sage_aggr': 'mean', 'sage_normalize': True, 'sage_project': False, 'lr': 0.0008161975020431791, 'weight_decay': 2.2539521140648173e-07, 'epochs': 249, 'loss': 'mse', 'optimizer': 'adam', 'graph_mode': 'cutoff', 'cutoff': 0.8554796545322735, 'grm_norm': 'gcn', 'self_loops': True, 'use_snp_selection': False}. Best is trial 114 with value: 0.3196654869303589.
[I 2025-12-09 14:51:16,105] Trial 124 finished with value: 0.3147216253140039 and parameters: {'model_type': 'graphsage', 'hidden_dims': '[256, 128]', 'dropout': 0.45167185508255214, 'batch_norm': True, 'sage_aggr': 'mean', 'sage_normalize': True, 'sage_project': False, 'lr': 0.0009317931838711052, 'weight_decay': 1.4199845862218786e-07, 'epochs': 213, 'loss': 'mse', 'optimizer': 'adam', 'graph_mode': 'cutoff', 'cutoff': 0.806703500366872, 'grm_norm': 'gcn', 'self_loops': True, 'use_snp_selection': False}. Best is trial 114 with value: 0.3196654869303589.
[I 2025-12-09 14:52:24,517] Trial 125 finished with value: 0.31654642844279557 and parameters: {'model_type': 'graphsage', 'hidden_dims': '[256, 128]', 'dropout': 0.3713829827350944, 'batch_norm': True, 'sage_aggr': 'mean', 'sage_normalize': True, 'sage_project': False, 'lr': 0.0010638478347817953, 'weight_decay': 4.5625817591289477e-07, 'epochs': 271, 'loss': 'mse', 'optimizer': 'adam', 'graph_mode': 'cutoff', 'cutoff': 0.7913932758786644, 'grm_norm': 'gcn', 'self_loops': True, 'use_snp_selection': False}. Best is trial 114 with value: 0.3196654869303589.
[I 2025-12-09 14:53:24,318] Trial 126 finished with value: 0.3193569909450203 and parameters: {'model_type': 'graphsage', 'hidden_dims': '[256, 128]', 'dropout': 0.43696728976925114, 'batch_norm': True, 'sage_aggr': 'mean', 'sage_normalize': True, 'sage_project': False, 'lr': 0.002680773411785221, 'weight_decay': 7.210856690235362e-07, 'epochs': 231, 'loss': 'mse', 'optimizer': 'adam', 'graph_mode': 'cutoff', 'cutoff': 0.876281355084596, 'grm_norm': 'gcn', 'self_loops': True, 'use_snp_selection': False}. Best is trial 114 with value: 0.3196654869303589.
[I 2025-12-09 14:54:24,741] Trial 127 finished with value: 0.31650297133378597 and parameters: {'model_type': 'graphsage', 'hidden_dims': '[256, 128]', 'dropout': 0.43657783416847135, 'batch_norm': True, 'sage_aggr': 'mean', 'sage_normalize': True, 'sage_project': False, 'lr': 0.002860665940938846, 'weight_decay': 1.0567784019293054e-07, 'epochs': 234, 'loss': 'mse', 'optimizer': 'adam', 'graph_mode': 'cutoff', 'cutoff': 0.8808658626398036, 'grm_norm': 'gcn', 'self_loops': True, 'use_snp_selection': False}. Best is trial 114 with value: 0.3196654869303589.
[I 2025-12-09 14:55:21,898] Trial 128 finished with value: 0.31195328601646233 and parameters: {'model_type': 'graphsage', 'hidden_dims': '[256, 128, 64]', 'dropout': 0.4262373681029048, 'batch_norm': True, 'sage_aggr': 'mean', 'sage_normalize': True, 'sage_project': False, 'lr': 0.00235279538388606, 'weight_decay': 6.468198015528558e-07, 'epochs': 217, 'loss': 'mse', 'optimizer': 'adam', 'graph_mode': 'cutoff', 'cutoff': 0.7796581268367416, 'grm_norm': 'gcn', 'self_loops': True, 'use_snp_selection': False}. Best is trial 114 with value: 0.3196654869303589.
[I 2025-12-09 14:56:53,690] Trial 129 finished with value: 0.31414051610143756 and parameters: {'model_type': 'graphsage', 'hidden_dims': '[512, 128]', 'dropout': 0.4112877169636142, 'batch_norm': True, 'sage_aggr': 'max', 'sage_normalize': True, 'sage_project': False, 'lr': 0.002106584884612004, 'weight_decay': 3.7156959159728232e-06, 'epochs': 205, 'loss': 'mse', 'optimizer': 'adam', 'graph_mode': 'cutoff', 'cutoff': 0.8251250317624745, 'grm_norm': 'gcn', 'self_loops': True, 'use_snp_selection': False}. Best is trial 114 with value: 0.3196654869303589.
[I 2025-12-09 14:57:41,967] Trial 130 finished with value: 0.30542123414026834 and parameters: {'model_type': 'graphsage', 'hidden_dims': '[256, 128]', 'dropout': 0.4585136469919797, 'batch_norm': True, 'sage_aggr': 'mean', 'sage_normalize': True, 'sage_project': False, 'lr': 0.0019619486995158418, 'weight_decay': 1.6335716638060195e-06, 'epochs': 231, 'loss': 'mse', 'optimizer': 'adam', 'graph_mode': 'cutoff', 'cutoff': 0.8473778645927386, 'grm_norm': 'gcn', 'self_loops': True, 'use_snp_selection': True, 'num_snps': 20684}. Best is trial 114 with value: 0.3196654869303589.
[I 2025-12-09 14:58:46,297] Trial 131 finished with value: 0.31438839664288454 and parameters: {'model_type': 'graphsage', 'hidden_dims': '[256, 128]', 'dropout': 0.3899502806633949, 'batch_norm': True, 'sage_aggr': 'mean', 'sage_normalize': True, 'sage_project': False, 'lr': 0.002699326195206648, 'weight_decay': 1.5217823252719902e-07, 'epochs': 252, 'loss': 'mse', 'optimizer': 'adam', 'graph_mode': 'cutoff', 'cutoff': 0.8709879936423899, 'grm_norm': 'gcn', 'self_loops': True, 'use_snp_selection': False}. Best is trial 114 with value: 0.3196654869303589.
[I 2025-12-09 14:59:54,589] Trial 132 finished with value: 0.3180622447273463 and parameters: {'model_type': 'graphsage', 'hidden_dims': '[256, 128]', 'dropout': 0.4305411339338991, 'batch_norm': True, 'sage_aggr': 'mean', 'sage_normalize': True, 'sage_project': False, 'lr': 0.001655517401400335, 'weight_decay': 2.83085358712801e-07, 'epochs': 262, 'loss': 'mse', 'optimizer': 'adam', 'graph_mode': 'cutoff', 'cutoff': 0.8035502535607438, 'grm_norm': 'cosine', 'self_loops': True, 'use_snp_selection': False}. Best is trial 114 with value: 0.3196654869303589.
[I 2025-12-09 15:01:01,851] Trial 133 finished with value: 0.31847273899912276 and parameters: {'model_type': 'graphsage', 'hidden_dims': '[256, 128]', 'dropout': 0.4329765437289539, 'batch_norm': True, 'sage_aggr': 'mean', 'sage_normalize': True, 'sage_project': False, 'lr': 0.0016605837136553323, 'weight_decay': 3.085107875699654e-07, 'epochs': 260, 'loss': 'mse', 'optimizer': 'adam', 'graph_mode': 'cutoff', 'cutoff': 0.8054173602974988, 'grm_norm': 'cosine', 'self_loops': True, 'use_snp_selection': False}. Best is trial 114 with value: 0.3196654869303589.
