[I 2025-12-09 16:56:35,825] Trial 44 finished with value: 0.30205278135486113 and parameters: {'model_type': 'graphsage', 'hidden_dims': '[512, 64]', 'dropout': 0.36837815449673106, 'batch_norm': True, 'sage_aggr': 'max', 'sage_normalize': False, 'sage_project': False, 'lr': 0.0002930781042966657, 'weight_decay': 0.0006256302592867471, 'epochs': 162, 'loss': 'mae', 'optimizer': 'adam', 'graph_mode': 'cutoff', 'cutoff': 0.6385065656894915, 'grm_norm': 'gcn', 'self_loops': False, 'use_snp_selection': True, 'num_snps': 53674}. Best is trial 33 with value: 0.3182853363930097.
[I 2025-12-09 16:57:21,894] Trial 45 finished with value: 0.31126544876733997 and parameters: {'model_type': 'graphsage', 'hidden_dims': '[128, 64]', 'dropout': 0.4642447740302005, 'batch_norm': True, 'sage_aggr': 'max', 'sage_normalize': False, 'sage_project': False, 'lr': 0.0005175266174549589, 'weight_decay': 3.0019608963610002e-05, 'epochs': 195, 'loss': 'mae', 'optimizer': 'adam', 'graph_mode': 'cutoff', 'cutoff': 0.7839205559310419, 'grm_norm': 'gcn', 'self_loops': False, 'use_snp_selection': True, 'num_snps': 46837}. Best is trial 33 with value: 0.3182853363930097.
[I 2025-12-09 16:58:01,042] Trial 46 finished with value: 0.3137706818462448 and parameters: {'model_type': 'graphsage', 'hidden_dims': '[256, 128, 64]', 'dropout': 0.5615064007291038, 'batch_norm': True, 'sage_aggr': 'max', 'sage_normalize': False, 'sage_project': False, 'lr': 0.001287334955493172, 'weight_decay': 2.422616374730296e-07, 'epochs': 134, 'loss': 'mae', 'optimizer': 'adam', 'graph_mode': 'cutoff', 'cutoff': 0.8600777331740326, 'grm_norm': 'gcn', 'self_loops': False, 'use_snp_selection': True, 'num_snps': 38432}. Best is trial 33 with value: 0.3182853363930097.
[I 2025-12-09 16:58:45,846] Trial 47 finished with value: 0.23184697365367452 and parameters: {'model_type': 'graphsage', 'hidden_dims': '[256, 128, 64]', 'dropout': 0.5666079086199445, 'batch_norm': False, 'sage_aggr': 'max', 'sage_normalize': True, 'sage_project': False, 'lr': 0.0013452541443210971, 'weight_decay': 2.3252000419028382e-07, 'epochs': 108, 'loss': 'mae', 'optimizer': 'adam', 'graph_mode': 'cutoff', 'cutoff': 0.47389411807483334, 'grm_norm': 'gcn', 'self_loops': False, 'use_snp_selection': True, 'num_snps': 31840}. Best is trial 33 with value: 0.3182853363930097.
[I 2025-12-09 16:59:58,001] Trial 48 finished with value: 0.25552995493401104 and parameters: {'model_type': 'graphsage', 'hidden_dims': '[256, 128, 64]', 'dropout': 0.549818574702583, 'batch_norm': True, 'sage_aggr': 'max', 'sage_normalize': False, 'sage_project': False, 'lr': 0.0019645839974363325, 'weight_decay': 8.228764017698013e-05, 'epochs': 134, 'loss': 'mse', 'optimizer': 'adam', 'graph_mode': 'knn', 'knn_k': 7, 'weighted_edges': True, 'symmetrize_mode': 'mutual', 'self_loops': False, 'use_snp_selection': True, 'num_snps': 38716}. Best is trial 33 with value: 0.3182853363930097.
[I 2025-12-09 17:00:11,943] Trial 49 finished with value: 0.3131914268829504 and parameters: {'model_type': 'graphsage', 'hidden_dims': '[256, 128, 64]', 'dropout': 0.49611285863397664, 'batch_norm': True, 'sage_aggr': 'mean', 'sage_normalize': False, 'sage_project': False, 'lr': 0.001080047394377151, 'weight_decay': 4.278176914444287e-07, 'epochs': 40, 'loss': 'mae', 'optimizer': 'adam', 'graph_mode': 'cutoff', 'cutoff': 0.7717938011295571, 'grm_norm': 'gcn', 'self_loops': False, 'use_snp_selection': False}. Best is trial 33 with value: 0.3182853363930097.
[I 2025-12-09 17:00:30,430] Trial 50 finished with value: 0.2678845535808659 and parameters: {'model_type': 'graphsage', 'hidden_dims': '[256, 128, 64]', 'dropout': 0.5801509060437897, 'batch_norm': False, 'sage_aggr': 'max', 'sage_normalize': True, 'sage_project': False, 'lr': 2.7151648386107264e-05, 'weight_decay': 2.1974707835605155e-07, 'epochs': 59, 'loss': 'mae', 'optimizer': 'adam', 'graph_mode': 'cutoff', 'cutoff': 0.8542455889324327, 'grm_norm': 'gcn', 'self_loops': False, 'use_snp_selection': True, 'num_snps': 23758}. Best is trial 33 with value: 0.3182853363930097.
[I 2025-12-09 17:01:33,346] Trial 51 finished with value: 0.31015373353617526 and parameters: {'model_type': 'graphsage', 'hidden_dims': '[256, 128]', 'dropout': 0.5296154245435054, 'batch_norm': True, 'sage_aggr': 'max', 'sage_normalize': False, 'sage_project': False, 'lr': 0.0008267399326025637, 'weight_decay': 0.0002858231676484926, 'epochs': 175, 'loss': 'mae', 'optimizer': 'adam', 'graph_mode': 'cutoff', 'cutoff': 0.8530677559190274, 'grm_norm': 'gcn', 'self_loops': False, 'use_snp_selection': True, 'num_snps': 50740}. Best is trial 33 with value: 0.3182853363930097.
[I 2025-12-09 17:02:18,916] Trial 52 finished with value: 0.30950290930203905 and parameters: {'model_type': 'graphsage', 'hidden_dims': '[256, 128]', 'dropout': 0.3157334721024442, 'batch_norm': True, 'sage_aggr': 'max', 'sage_normalize': False, 'sage_project': False, 'lr': 0.00036111282460225423, 'weight_decay': 0.00013712099414518538, 'epochs': 152, 'loss': 'mae', 'optimizer': 'adam', 'graph_mode': 'cutoff', 'cutoff': 0.8068902305241554, 'grm_norm': 'gcn', 'self_loops': False, 'use_snp_selection': True, 'num_snps': 40545}. Best is trial 33 with value: 0.3182853363930097.
[I 2025-12-09 17:03:47,251] Trial 53 finished with value: 0.3016299985967006 and parameters: {'model_type': 'graphsage', 'hidden_dims': '[512, 64]', 'dropout': 0.5403000623323939, 'batch_norm': True, 'sage_aggr': 'max', 'sage_normalize': False, 'sage_project': False, 'lr': 0.0016264900876905386, 'weight_decay': 0.0006222643858184611, 'epochs': 258, 'loss': 'mae', 'optimizer': 'adam', 'graph_mode': 'cutoff', 'cutoff': 0.8443513355004713, 'grm_norm': 'cosine', 'self_loops': False, 'use_snp_selection': True, 'num_snps': 35381}. Best is trial 33 with value: 0.3182853363930097.
[I 2025-12-09 17:04:49,939] Trial 54 finished with value: 0.3123245366322358 and parameters: {'model_type': 'graphsage', 'hidden_dims': '[512, 256]', 'dropout': 0.5096345859833225, 'batch_norm': True, 'sage_aggr': 'max', 'sage_normalize': False, 'sage_project': False, 'lr': 9.551375222783114e-05, 'weight_decay': 5.680783231081909e-05, 'epochs': 117, 'loss': 'mse', 'optimizer': 'adam', 'graph_mode': 'cutoff', 'cutoff': 0.7389894697503268, 'grm_norm': 'gcn', 'self_loops': False, 'use_snp_selection': True, 'num_snps': 46250}. Best is trial 33 with value: 0.3182853363930097.
[I 2025-12-09 17:06:06,102] Trial 55 finished with value: 0.31478984739931937 and parameters: {'model_type': 'graphsage', 'hidden_dims': '[256, 128, 64]', 'dropout': 0.5673878029707812, 'batch_norm': True, 'sage_aggr': 'mean', 'sage_normalize': False, 'sage_project': False, 'lr': 0.0023619079068623572, 'weight_decay': 1.4073816616636142e-06, 'epochs': 193, 'loss': 'mae', 'optimizer': 'adam', 'graph_mode': 'cutoff', 'cutoff': 0.788448381078619, 'grm_norm': 'gcn', 'self_loops': False, 'use_snp_selection': True, 'num_snps': 56863}. Best is trial 33 with value: 0.3182853363930097.
[I 2025-12-09 17:07:04,291] Trial 56 finished with value: 0.29579228237654487 and parameters: {'model_type': 'graphsage', 'hidden_dims': '[256, 128, 64]', 'dropout': 0.5753617034235347, 'batch_norm': True, 'sage_aggr': 'mean', 'sage_normalize': False, 'sage_project': False, 'lr': 0.002451717207202178, 'weight_decay': 1.2459491116947895e-06, 'epochs': 196, 'loss': 'mae', 'optimizer': 'adam', 'graph_mode': 'cutoff', 'cutoff': 0.6446265308411875, 'grm_norm': 'gcn', 'self_loops': False, 'use_snp_selection': False}. Best is trial 33 with value: 0.3182853363930097.
[I 2025-12-09 17:08:45,988] Trial 57 finished with value: 0.20976647766061732 and parameters: {'model_type': 'graphsage', 'hidden_dims': '[256, 128, 64]', 'dropout': 0.22761908681602178, 'batch_norm': False, 'sage_aggr': 'mean', 'sage_normalize': True, 'sage_project': False, 'lr': 0.0024149818933299214, 'weight_decay': 1.7367029764393397e-07, 'epochs': 90, 'loss': 'mae', 'optimizer': 'adam', 'graph_mode': 'cutoff', 'cutoff': 0.301075931932581, 'grm_norm': 'none', 'self_loops': False, 'use_snp_selection': True, 'num_snps': 56647}. Best is trial 33 with value: 0.3182853363930097.
[I 2025-12-09 17:09:23,958] Trial 58 finished with value: 0.3139692311010485 and parameters: {'model_type': 'graphsage', 'hidden_dims': '[256, 128, 64]', 'dropout': 0.48327390577285556, 'batch_norm': True, 'sage_aggr': 'mean', 'sage_normalize': False, 'sage_project': False, 'lr': 0.006372676447053222, 'weight_decay': 2.0617750870912918e-06, 'epochs': 78, 'loss': 'mse', 'optimizer': 'adam', 'graph_mode': 'cutoff', 'cutoff': 0.7842576606368024, 'grm_norm': 'cosine', 'self_loops': True, 'use_snp_selection': True, 'num_snps': 51063}. Best is trial 33 with value: 0.3182853363930097.
[I 2025-12-09 17:10:01,312] Trial 59 finished with value: 0.312578792272996 and parameters: {'model_type': 'graphsage', 'hidden_dims': '[256, 128]', 'dropout': 0.4272620847217005, 'batch_norm': True, 'sage_aggr': 'mean', 'sage_normalize': False, 'sage_project': False, 'lr': 0.004590894375806139, 'weight_decay': 1.4987596059925802e-06, 'epochs': 76, 'loss': 'mse', 'optimizer': 'adam', 'graph_mode': 'cutoff', 'cutoff': 0.7908127522942324, 'grm_norm': 'none', 'self_loops': True, 'use_snp_selection': True, 'num_snps': 51513}. Best is trial 33 with value: 0.3182853363930097.
[I 2025-12-09 17:10:20,408] Trial 60 finished with value: 0.3143044587370515 and parameters: {'model_type': 'graphsage', 'hidden_dims': '[256, 128, 64]', 'dropout': 0.4842155943523417, 'batch_norm': True, 'sage_aggr': 'mean', 'sage_normalize': False, 'sage_project': False, 'lr': 0.00412553207975889, 'weight_decay': 8.838105995307704e-07, 'epochs': 58, 'loss': 'mse', 'optimizer': 'adam', 'graph_mode': 'cutoff', 'cutoff': 0.7251582092914192, 'grm_norm': 'cosine', 'self_loops': True, 'use_snp_selection': False}. Best is trial 33 with value: 0.3182853363930097.
[I 2025-12-09 17:10:37,610] Trial 61 finished with value: 0.3154845319297974 and parameters: {'model_type': 'graphsage', 'hidden_dims': '[256, 128, 64]', 'dropout': 0.4820932612196751, 'batch_norm': True, 'sage_aggr': 'mean', 'sage_normalize': False, 'sage_project': False, 'lr': 0.005594151569310199, 'weight_decay': 1.8676224037886065e-06, 'epochs': 51, 'loss': 'mse', 'optimizer': 'adam', 'graph_mode': 'cutoff', 'cutoff': 0.6635541915406054, 'grm_norm': 'cosine', 'self_loops': True, 'use_snp_selection': False}. Best is trial 33 with value: 0.3182853363930097.
[I 2025-12-09 17:10:55,627] Trial 62 finished with value: 0.32429274467006397 and parameters: {'model_type': 'graphsage', 'hidden_dims': '[256, 128, 64]', 'dropout': 0.45195538550332526, 'batch_norm': True, 'sage_aggr': 'mean', 'sage_normalize': False, 'sage_project': False, 'lr': 0.006551440361848901, 'weight_decay': 8.150406266493423e-07, 'epochs': 54, 'loss': 'mse', 'optimizer': 'adam', 'graph_mode': 'cutoff', 'cutoff': 0.6728862504490372, 'grm_norm': 'cosine', 'self_loops': True, 'use_snp_selection': False}. Best is trial 62 with value: 0.32429274467006397.
[I 2025-12-09 17:11:11,711] Trial 63 finished with value: 0.31895164451187485 and parameters: {'model_type': 'graphsage', 'hidden_dims': '[256, 128, 64]', 'dropout': 0.4487677566618697, 'batch_norm': True, 'sage_aggr': 'mean', 'sage_normalize': False, 'sage_project': False, 'lr': 0.0063609648097845565, 'weight_decay': 2.070105987144777e-06, 'epochs': 47, 'loss': 'mse', 'optimizer': 'adam', 'graph_mode': 'cutoff', 'cutoff': 0.678809615568822, 'grm_norm': 'cosine', 'self_loops': True, 'use_snp_selection': False}. Best is trial 62 with value: 0.32429274467006397.
[I 2025-12-09 17:11:29,406] Trial 64 finished with value: 0.3173494182254478 and parameters: {'model_type': 'graphsage', 'hidden_dims': '[256, 128]', 'dropout': 0.43572692027097987, 'batch_norm': True, 'sage_aggr': 'mean', 'sage_normalize': False, 'sage_project': False, 'lr': 0.0057784115872205975, 'weight_decay': 7.712912796015672e-06, 'epochs': 53, 'loss': 'mse', 'optimizer': 'adam', 'graph_mode': 'cutoff', 'cutoff': 0.6704772100341679, 'grm_norm': 'cosine', 'self_loops': True, 'use_snp_selection': False}. Best is trial 62 with value: 0.32429274467006397.
[I 2025-12-09 17:11:51,220] Trial 65 finished with value: 0.31068666070185164 and parameters: {'model_type': 'graphsage', 'hidden_dims': '[256, 128]', 'dropout': 0.4492702695815945, 'batch_norm': True, 'sage_aggr': 'mean', 'sage_normalize': False, 'sage_project': False, 'lr': 0.007016196049751755, 'weight_decay': 2.3320881961209882e-05, 'epochs': 67, 'loss': 'mse', 'optimizer': 'adam', 'graph_mode': 'cutoff', 'cutoff': 0.5995747938322791, 'grm_norm': 'cosine', 'self_loops': True, 'use_snp_selection': False}. Best is trial 62 with value: 0.32429274467006397.
[I 2025-12-09 17:12:07,230] Trial 66 finished with value: 0.3172042097741973 and parameters: {'model_type': 'graphsage', 'hidden_dims': '[256, 128]', 'dropout': 0.3962481191402928, 'batch_norm': True, 'sage_aggr': 'mean', 'sage_normalize': False, 'sage_project': False, 'lr': 0.006566795687293018, 'weight_decay': 6.563273057150688e-06, 'epochs': 47, 'loss': 'mse', 'optimizer': 'adam', 'graph_mode': 'cutoff', 'cutoff': 0.7071351128072256, 'grm_norm': 'cosine', 'self_loops': True, 'use_snp_selection': False}. Best is trial 62 with value: 0.32429274467006397.
[I 2025-12-09 17:12:23,034] Trial 67 finished with value: 0.31013880561587115 and parameters: {'model_type': 'graphsage', 'hidden_dims': '[256, 128]', 'dropout': 0.3892648693366191, 'batch_norm': True, 'sage_aggr': 'mean', 'sage_normalize': True, 'sage_project': False, 'lr': 0.0069579435083386015, 'weight_decay': 8.65079119835204e-06, 'epochs': 46, 'loss': 'mse', 'optimizer': 'adam', 'graph_mode': 'cutoff', 'cutoff': 0.6763704781340286, 'grm_norm': 'cosine', 'self_loops': True, 'use_snp_selection': False}. Best is trial 62 with value: 0.32429274467006397.
[I 2025-12-09 17:12:51,886] Trial 68 finished with value: -0.009171452966205284 and parameters: {'model_type': 'graphsage', 'hidden_dims': '[256, 128]', 'dropout': 0.4507824511666771, 'batch_norm': False, 'sage_aggr': 'mean', 'sage_normalize': False, 'sage_project': False, 'lr': 0.004167413480757887, 'weight_decay': 3.018174725195645e-06, 'epochs': 69, 'loss': 'mse', 'optimizer': 'adam', 'graph_mode': 'knn', 'knn_k': 2, 'weighted_edges': False, 'symmetrize_mode': 'union', 'self_loops': True, 'use_snp_selection': False}. Best is trial 62 with value: 0.32429274467006397.
[I 2025-12-09 17:13:18,126] Trial 69 finished with value: 0.31816780518395127 and parameters: {'model_type': 'graphsage', 'hidden_dims': '[256, 128]', 'dropout': 0.42487852305816787, 'batch_norm': True, 'sage_aggr': 'mean', 'sage_normalize': False, 'sage_project': False, 'lr': 0.005985032631746513, 'weight_decay': 6.334208653753598e-07, 'epochs': 84, 'loss': 'mse', 'optimizer': 'adam', 'graph_mode': 'cutoff', 'cutoff': 0.7065823626047486, 'grm_norm': 'cosine', 'self_loops': True, 'use_snp_selection': False}. Best is trial 62 with value: 0.32429274467006397.
[I 2025-12-09 17:14:15,441] Trial 70 finished with value: 0.3057627148311672 and parameters: {'model_type': 'graphsage', 'hidden_dims': '[512, 128]', 'dropout': 0.3503737260464591, 'batch_norm': True, 'sage_aggr': 'mean', 'sage_normalize': False, 'sage_project': False, 'lr': 0.00592042834304198, 'weight_decay': 6.5903060885559275e-06, 'epochs': 101, 'loss': 'mse', 'optimizer': 'adam', 'graph_mode': 'cutoff', 'cutoff': 0.5643548313605005, 'grm_norm': 'cosine', 'self_loops': True, 'use_snp_selection': False}. Best is trial 62 with value: 0.32429274467006397.
[I 2025-12-09 17:14:32,284] Trial 71 finished with value: 0.31233568548290264 and parameters: {'model_type': 'graphsage', 'hidden_dims': '[256, 128]', 'dropout': 0.4085108360407905, 'batch_norm': True, 'sage_aggr': 'mean', 'sage_normalize': False, 'sage_project': False, 'lr': 0.003517451930463283, 'weight_decay': 5.521396897980499e-07, 'epochs': 50, 'loss': 'mse', 'optimizer': 'adam', 'graph_mode': 'cutoff', 'cutoff': 0.7082038377299307, 'grm_norm': 'cosine', 'self_loops': True, 'use_snp_selection': False}. Best is trial 62 with value: 0.32429274467006397.
[I 2025-12-09 17:14:59,139] Trial 72 finished with value: 0.318097495247292 and parameters: {'model_type': 'graphsage', 'hidden_dims': '[256, 128]', 'dropout': 0.4331260222730769, 'batch_norm': True, 'sage_aggr': 'mean', 'sage_normalize': False, 'sage_project': False, 'lr': 0.007251780984444558, 'weight_decay': 3.6626215907686395e-07, 'epochs': 86, 'loss': 'mse', 'optimizer': 'adam', 'graph_mode': 'cutoff', 'cutoff': 0.6582313182968369, 'grm_norm': 'cosine', 'self_loops': True, 'use_snp_selection': False}. Best is trial 62 with value: 0.32429274467006397.
[I 2025-12-09 17:15:28,236] Trial 73 finished with value: 0.2995258874475025 and parameters: {'model_type': 'graphsage', 'hidden_dims': '[256, 128]', 'dropout': 0.4320680825452634, 'batch_norm': True, 'sage_aggr': 'mean', 'sage_normalize': False, 'sage_project': False, 'lr': 0.007688384664764172, 'weight_decay': 3.526962857401708e-07, 'epochs': 84, 'loss': 'mse', 'optimizer': 'adam', 'graph_mode': 'cutoff', 'cutoff': 0.5149889950355384, 'grm_norm': 'cosine', 'self_loops': True, 'use_snp_selection': False}. Best is trial 62 with value: 0.32429274467006397.
[I 2025-12-09 17:15:56,349] Trial 74 finished with value: 0.31521635277808724 and parameters: {'model_type': 'graphsage', 'hidden_dims': '[256, 128]', 'dropout': 0.3812694748942989, 'batch_norm': True, 'sage_aggr': 'mean', 'sage_normalize': False, 'sage_project': False, 'lr': 0.005402614353368054, 'weight_decay': 8.265107373080634e-07, 'epochs': 90, 'loss': 'mse', 'optimizer': 'adam', 'graph_mode': 'cutoff', 'cutoff': 0.6233594553654958, 'grm_norm': 'cosine', 'self_loops': True, 'use_snp_selection': False}. Best is trial 62 with value: 0.32429274467006397.
[I 2025-12-09 17:16:19,316] Trial 75 finished with value: 0.32204795782675255 and parameters: {'model_type': 'graphsage', 'hidden_dims': '[256, 128]', 'dropout': 0.4005369734247465, 'batch_norm': True, 'sage_aggr': 'mean', 'sage_normalize': False, 'sage_project': False, 'lr': 0.009182383362951569, 'weight_decay': 6.258857830143468e-07, 'epochs': 72, 'loss': 'mse', 'optimizer': 'adam', 'graph_mode': 'cutoff', 'cutoff': 0.6649915993686393, 'grm_norm': 'cosine', 'self_loops': True, 'use_snp_selection': False}. Best is trial 62 with value: 0.32429274467006397.
[I 2025-12-09 17:16:34,787] Trial 76 finished with value: 0.3095586257819113 and parameters: {'model_type': 'graphsage', 'hidden_dims': '[256, 128]', 'dropout': 0.4096980949062362, 'batch_norm': True, 'sage_aggr': 'mean', 'sage_normalize': False, 'sage_project': False, 'lr': 0.009966794590066882, 'weight_decay': 3.3968185204518114e-07, 'epochs': 45, 'loss': 'mse', 'optimizer': 'adam', 'graph_mode': 'cutoff', 'cutoff': 0.6589286585477091, 'grm_norm': 'cosine', 'self_loops': True, 'use_snp_selection': False}. Best is trial 62 with value: 0.32429274467006397.
[I 2025-12-09 17:17:04,891] Trial 77 finished with value: 0.31457810465636304 and parameters: {'model_type': 'graphsage', 'hidden_dims': '[256, 128]', 'dropout': 0.35468959968141517, 'batch_norm': True, 'sage_aggr': 'mean', 'sage_normalize': False, 'sage_project': False, 'lr': 0.007920837743149544, 'weight_decay': 5.762522705712321e-07, 'epochs': 98, 'loss': 'mse', 'optimizer': 'adam', 'graph_mode': 'cutoff', 'cutoff': 0.6951000293025149, 'grm_norm': 'cosine', 'self_loops': True, 'use_snp_selection': False}. Best is trial 62 with value: 0.32429274467006397.
[I 2025-12-09 17:17:20,619] Trial 78 finished with value: 0.302354799877384 and parameters: {'model_type': 'graphsage', 'hidden_dims': '[128, 64]', 'dropout': 0.33306312181018005, 'batch_norm': True, 'sage_aggr': 'mean', 'sage_normalize': False, 'sage_project': False, 'lr': 0.003731404653149373, 'weight_decay': 4.1241977462018474e-06, 'epochs': 76, 'loss': 'mse', 'optimizer': 'adam', 'graph_mode': 'cutoff', 'cutoff': 0.5836085011278078, 'grm_norm': 'cosine', 'self_loops': True, 'use_snp_selection': False}. Best is trial 62 with value: 0.32429274467006397.
[I 2025-12-09 17:17:40,252] Trial 79 finished with value: 0.318262107826782 and parameters: {'model_type': 'graphsage', 'hidden_dims': '[256, 128]', 'dropout': 0.42185264254004406, 'batch_norm': True, 'sage_aggr': 'mean', 'sage_normalize': False, 'sage_project': False, 'lr': 0.006348318285858362, 'weight_decay': 6.604995635286269e-07, 'epochs': 60, 'loss': 'mse', 'optimizer': 'adam', 'graph_mode': 'cutoff', 'cutoff': 0.6638420837792794, 'grm_norm': 'cosine', 'self_loops': True, 'use_snp_selection': False}. Best is trial 62 with value: 0.32429274467006397.
[I 2025-12-09 17:18:15,718] Trial 80 finished with value: 0.30394836008156406 and parameters: {'model_type': 'graphsage', 'hidden_dims': '[256, 128]', 'dropout': 0.448819654585644, 'batch_norm': True, 'sage_aggr': 'mean', 'sage_normalize': False, 'sage_project': False, 'lr': 0.004842576345214761, 'weight_decay': 1.019061951441455e-06, 'epochs': 61, 'loss': 'mse', 'optimizer': 'adam', 'graph_mode': 'knn', 'knn_k': 8, 'weighted_edges': False, 'symmetrize_mode': 'mutual', 'self_loops': True, 'use_snp_selection': False}. Best is trial 62 with value: 0.32429274467006397.
[I 2025-12-09 17:18:33,225] Trial 81 finished with value: 0.31749417622334136 and parameters: {'model_type': 'graphsage', 'hidden_dims': '[256, 128]', 'dropout': 0.3936165463412039, 'batch_norm': True, 'sage_aggr': 'mean', 'sage_normalize': False, 'sage_project': False, 'lr': 0.0062087565670936274, 'weight_decay': 6.842559128023495e-07, 'epochs': 52, 'loss': 'mse', 'optimizer': 'adam', 'graph_mode': 'cutoff', 'cutoff': 0.6143813437732298, 'grm_norm': 'cosine', 'self_loops': True, 'use_snp_selection': False}. Best is trial 62 with value: 0.32429274467006397.
