[I 2025-12-08 15:01:45,857] Trial 3 finished with value: 0.2768615395301376 and parameters: {'model_type': 'graphsage', 'hidden_dims': '[256, 128, 64]', 'dropout': 0.3475243154412272, 'batch_norm': True, 'sage_aggr': 'max', 'sage_normalize': False, 'sage_project': False, 'lr': 1.6006331996938085e-05, 'weight_decay': 7.213121225589906e-06, 'epochs': 283, 'loss': 'mse', 'optimizer': 'adam', 'graph_mode': 'cutoff', 'cutoff': 0.5942334791449215, 'grm_norm': 'none', 'self_loops': True, 'use_snp_selection': False}. Best is trial 2 with value: 0.29111523234812586.
[I 2025-12-08 15:02:08,761] Trial 4 finished with value: 0.27236860963546816 and parameters: {'model_type': 'graphsage', 'hidden_dims': '[128, 64]', 'dropout': 0.3348926467202472, 'batch_norm': True, 'sage_aggr': 'max', 'sage_normalize': False, 'sage_project': False, 'lr': 0.0004238630400638802, 'weight_decay': 8.074086040046576e-07, 'epochs': 158, 'loss': 'mae', 'optimizer': 'adam', 'graph_mode': 'knn', 'knn_k': 1, 'weighted_edges': False, 'symmetrize_mode': 'mutual', 'self_loops': False, 'use_snp_selection': True, 'num_snps': 26850}. Best is trial 2 with value: 0.29111523234812586.
[I 2025-12-08 15:04:27,900] Trial 5 finished with value: 0.24599606809872182 and parameters: {'model_type': 'graphsage', 'hidden_dims': '[512, 64]', 'dropout': 0.14505336736221927, 'batch_norm': True, 'sage_aggr': 'mean', 'sage_normalize': True, 'sage_project': False, 'lr': 1.2962030165732234e-05, 'weight_decay': 1.326598071105465e-07, 'epochs': 180, 'loss': 'mse', 'optimizer': 'adam', 'graph_mode': 'knn', 'knn_k': 9, 'weighted_edges': True, 'symmetrize_mode': 'mutual', 'self_loops': False, 'use_snp_selection': False}. Best is trial 2 with value: 0.29111523234812586.
[I 2025-12-08 15:05:01,335] Trial 6 finished with value: 0.2770947025928002 and parameters: {'model_type': 'graphsage', 'hidden_dims': '[256, 128, 64]', 'dropout': 0.10731743755162496, 'batch_norm': True, 'sage_aggr': 'mean', 'sage_normalize': False, 'sage_project': False, 'lr': 1.922990426933137e-05, 'weight_decay': 7.30001060446905e-05, 'epochs': 63, 'loss': 'mae', 'optimizer': 'adam', 'graph_mode': 'cutoff', 'cutoff': 0.7624978434202536, 'grm_norm': 'none', 'self_loops': True, 'use_snp_selection': True, 'num_snps': 50106}. Best is trial 2 with value: 0.29111523234812586.
[I 2025-12-08 15:07:02,641] Trial 7 finished with value: 0.25775266690466403 and parameters: {'model_type': 'graphsage', 'hidden_dims': '[512, 64]', 'dropout': 0.2585007811528941, 'batch_norm': True, 'sage_aggr': 'max', 'sage_normalize': True, 'sage_project': False, 'lr': 5.921425508303391e-05, 'weight_decay': 0.0004511561961144237, 'epochs': 182, 'loss': 'mae', 'optimizer': 'adam', 'graph_mode': 'knn', 'knn_k': 9, 'weighted_edges': True, 'symmetrize_mode': 'union', 'self_loops': False, 'use_snp_selection': True, 'num_snps': 23903}. Best is trial 2 with value: 0.29111523234812586.
[I 2025-12-08 15:07:28,431] Trial 8 finished with value: 0.2517186035084136 and parameters: {'model_type': 'graphsage', 'hidden_dims': '[512, 256]', 'dropout': 0.3061380386767003, 'batch_norm': False, 'sage_aggr': 'mean', 'sage_normalize': True, 'sage_project': False, 'lr': 0.000698401460570184, 'weight_decay': 2.965560055460244e-06, 'epochs': 289, 'loss': 'mae', 'optimizer': 'adam', 'graph_mode': 'knn', 'knn_k': 7, 'weighted_edges': False, 'symmetrize_mode': 'mutual', 'self_loops': True, 'use_snp_selection': True, 'num_snps': 4710}. Best is trial 2 with value: 0.29111523234812586.
[I 2025-12-08 15:12:39,342] Trial 9 finished with value: 0.293435617605865 and parameters: {'model_type': 'graphsage', 'hidden_dims': '[512, 128]', 'dropout': 0.1733844071393634, 'batch_norm': False, 'sage_aggr': 'mean', 'sage_normalize': True, 'sage_project': False, 'lr': 0.0004269677918501597, 'weight_decay': 2.2439779626249696e-06, 'epochs': 319, 'loss': 'mse', 'optimizer': 'adam', 'graph_mode': 'cutoff', 'cutoff': 0.24117565767129295, 'grm_norm': 'cosine_then_gcn', 'self_loops': True, 'use_snp_selection': False}. Best is trial 9 with value: 0.293435617605865.
[I 2025-12-08 15:18:09,431] Trial 10 finished with value: 0.28704554764581924 and parameters: {'model_type': 'graphsage', 'hidden_dims': '[512, 128]', 'dropout': 0.5365714961141473, 'batch_norm': False, 'sage_aggr': 'mean', 'sage_normalize': True, 'sage_project': False, 'lr': 0.004737327072203749, 'weight_decay': 7.303103160282385e-07, 'epochs': 299, 'loss': 'mse', 'optimizer': 'adam', 'graph_mode': 'cutoff', 'cutoff': 0.21281628365523453, 'grm_norm': 'cosine_then_gcn', 'self_loops': True, 'use_snp_selection': False}. Best is trial 9 with value: 0.293435617605865.
[I 2025-12-08 15:19:47,736] Trial 11 finished with value: 0.2543518328556441 and parameters: {'model_type': 'graphsage', 'hidden_dims': '[512, 256]', 'dropout': 0.45019825743622743, 'batch_norm': False, 'sage_aggr': 'mean', 'sage_normalize': False, 'sage_project': False, 'lr': 0.00012276813591288835, 'weight_decay': 3.05795292129246e-05, 'epochs': 84, 'loss': 'mae', 'optimizer': 'adam', 'graph_mode': 'cutoff', 'cutoff': 0.2206548494774421, 'grm_norm': 'gcn', 'self_loops': False, 'use_snp_selection': False}. Best is trial 9 with value: 0.293435617605865.
[I 2025-12-08 15:22:04,067] Trial 12 finished with value: 0.2995595946880477 and parameters: {'model_type': 'graphsage', 'hidden_dims': '[256, 128]', 'dropout': 0.41797846692127566, 'batch_norm': False, 'sage_aggr': 'mean', 'sage_normalize': True, 'sage_project': False, 'lr': 0.0022837890872382006, 'weight_decay': 3.20003530689193e-05, 'epochs': 345, 'loss': 'mse', 'optimizer': 'adam', 'graph_mode': 'cutoff', 'cutoff': 0.43536697823689796, 'grm_norm': 'gcn', 'self_loops': False, 'use_snp_selection': False}. Best is trial 12 with value: 0.2995595946880477.
[I 2025-12-08 15:24:17,265] Trial 13 finished with value: 0.3123866227334652 and parameters: {'model_type': 'graphsage', 'hidden_dims': '[256, 128]', 'dropout': 0.4545638174017462, 'batch_norm': False, 'sage_aggr': 'mean', 'sage_normalize': True, 'sage_project': False, 'lr': 0.001583542738730006, 'weight_decay': 6.677182369807324e-06, 'epochs': 339, 'loss': 'mse', 'optimizer': 'adam', 'graph_mode': 'cutoff', 'cutoff': 0.4122967965041634, 'grm_norm': 'cosine_then_gcn', 'self_loops': False, 'use_snp_selection': False}. Best is trial 13 with value: 0.3123866227334652.
[I 2025-12-08 15:26:31,487] Trial 14 finished with value: 0.3084876275446363 and parameters: {'model_type': 'graphsage', 'hidden_dims': '[256, 128]', 'dropout': 0.45447940156789357, 'batch_norm': False, 'sage_aggr': 'mean', 'sage_normalize': True, 'sage_project': False, 'lr': 0.002437116555617164, 'weight_decay': 2.1603924127457897e-05, 'epochs': 348, 'loss': 'mse', 'optimizer': 'adam', 'graph_mode': 'cutoff', 'cutoff': 0.4448716104052916, 'grm_norm': 'cosine', 'self_loops': False, 'use_snp_selection': False}. Best is trial 13 with value: 0.3123866227334652.
[I 2025-12-08 15:28:08,524] Trial 15 finished with value: 0.2954632624119157 and parameters: {'model_type': 'graphsage', 'hidden_dims': '[256, 128]', 'dropout': 0.5875479730928564, 'batch_norm': False, 'sage_aggr': 'mean', 'sage_normalize': True, 'sage_project': False, 'lr': 0.0015136756327981176, 'weight_decay': 8.659516836890932e-06, 'epochs': 242, 'loss': 'mse', 'optimizer': 'adam', 'graph_mode': 'cutoff', 'cutoff': 0.3988678726771449, 'grm_norm': 'cosine', 'self_loops': False, 'use_snp_selection': False}. Best is trial 13 with value: 0.3123866227334652.
[I 2025-12-08 15:29:48,649] Trial 16 finished with value: 0.2743244854950447 and parameters: {'model_type': 'graphsage', 'hidden_dims': '[256, 128]', 'dropout': 0.4337768631587977, 'batch_norm': False, 'sage_aggr': 'mean', 'sage_normalize': True, 'sage_project': False, 'lr': 0.009604592115591302, 'weight_decay': 1.3309170793713164e-05, 'epochs': 348, 'loss': 'mse', 'optimizer': 'adam', 'graph_mode': 'cutoff', 'cutoff': 0.6388073261129936, 'grm_norm': 'cosine', 'self_loops': False, 'use_snp_selection': False}. Best is trial 13 with value: 0.3123866227334652.
[I 2025-12-08 15:31:32,389] Trial 17 finished with value: 0.2988285328405039 and parameters: {'model_type': 'graphsage', 'hidden_dims': '[256, 128]', 'dropout': 0.493903570442887, 'batch_norm': False, 'sage_aggr': 'mean', 'sage_normalize': True, 'sage_project': False, 'lr': 0.0012210053697620502, 'weight_decay': 2.716129568521984e-06, 'epochs': 252, 'loss': 'mse', 'optimizer': 'adam', 'graph_mode': 'cutoff', 'cutoff': 0.36318197199977853, 'grm_norm': 'cosine_then_gcn', 'self_loops': False, 'use_snp_selection': False}. Best is trial 13 with value: 0.3123866227334652.
[I 2025-12-08 15:33:04,520] Trial 18 finished with value: 0.267102137149254 and parameters: {'model_type': 'graphsage', 'hidden_dims': '[256, 128]', 'dropout': 0.40711330927975026, 'batch_norm': False, 'sage_aggr': 'mean', 'sage_normalize': True, 'sage_project': False, 'lr': 0.003795300583821109, 'weight_decay': 0.0008446575259033112, 'epochs': 321, 'loss': 'mse', 'optimizer': 'adam', 'graph_mode': 'cutoff', 'cutoff': 0.865195964721174, 'grm_norm': 'cosine', 'self_loops': False, 'use_snp_selection': False}. Best is trial 13 with value: 0.3123866227334652.
[I 2025-12-08 15:35:21,839] Trial 19 finished with value: 0.250501354921412 and parameters: {'model_type': 'graphsage', 'hidden_dims': '[256, 128]', 'dropout': 0.5006119904375436, 'batch_norm': False, 'sage_aggr': 'mean', 'sage_normalize': True, 'sage_project': False, 'lr': 0.006484054158999695, 'weight_decay': 7.592030665997785e-05, 'epochs': 270, 'loss': 'mse', 'optimizer': 'adam', 'graph_mode': 'cutoff', 'cutoff': 0.31791155227129714, 'grm_norm': 'cosine_then_gcn', 'self_loops': False, 'use_snp_selection': False}. Best is trial 13 with value: 0.3123866227334652.
[I 2025-12-08 15:36:35,541] Trial 20 finished with value: 0.29676861133697646 and parameters: {'model_type': 'graphsage', 'hidden_dims': '[256, 128]', 'dropout': 0.3818648089440701, 'batch_norm': False, 'sage_aggr': 'mean', 'sage_normalize': True, 'sage_project': False, 'lr': 0.002101251437787005, 'weight_decay': 1.9205566622201635e-07, 'epochs': 217, 'loss': 'mse', 'optimizer': 'adam', 'graph_mode': 'cutoff', 'cutoff': 0.5053604700747787, 'grm_norm': 'cosine', 'self_loops': False, 'use_snp_selection': False}. Best is trial 13 with value: 0.3123866227334652.
[I 2025-12-08 15:38:51,509] Trial 21 finished with value: 0.3006795849805814 and parameters: {'model_type': 'graphsage', 'hidden_dims': '[256, 128]', 'dropout': 0.4540184348968537, 'batch_norm': False, 'sage_aggr': 'mean', 'sage_normalize': True, 'sage_project': False, 'lr': 0.00286797791741059, 'weight_decay': 2.1113911902345383e-05, 'epochs': 343, 'loss': 'mse', 'optimizer': 'adam', 'graph_mode': 'cutoff', 'cutoff': 0.43022696981986774, 'grm_norm': 'gcn', 'self_loops': False, 'use_snp_selection': False}. Best is trial 13 with value: 0.3123866227334652.
[I 2025-12-08 15:40:56,175] Trial 22 finished with value: 0.3076732471496967 and parameters: {'model_type': 'graphsage', 'hidden_dims': '[256, 128]', 'dropout': 0.4799079855610013, 'batch_norm': False, 'sage_aggr': 'mean', 'sage_normalize': True, 'sage_project': False, 'lr': 0.0008706202635295335, 'weight_decay': 1.1304114738707875e-05, 'epochs': 320, 'loss': 'mse', 'optimizer': 'adam', 'graph_mode': 'cutoff', 'cutoff': 0.4580924735022355, 'grm_norm': 'gcn', 'self_loops': False, 'use_snp_selection': False}. Best is trial 13 with value: 0.3123866227334652.
[I 2025-12-08 15:42:31,837] Trial 23 finished with value: 0.29558903240218715 and parameters: {'model_type': 'graphsage', 'hidden_dims': '[256, 128]', 'dropout': 0.5800989793704572, 'batch_norm': False, 'sage_aggr': 'mean', 'sage_normalize': True, 'sage_project': False, 'lr': 0.0008130354019624769, 'weight_decay': 7.707914712354329e-06, 'epochs': 316, 'loss': 'mse', 'optimizer': 'adam', 'graph_mode': 'cutoff', 'cutoff': 0.5472572614427962, 'grm_norm': 'cosine', 'self_loops': False, 'use_snp_selection': False}. Best is trial 13 with value: 0.3123866227334652.
[I 2025-12-08 15:44:01,661] Trial 24 finished with value: 0.3046943136974641 and parameters: {'model_type': 'graphsage', 'hidden_dims': '[256, 128]', 'dropout': 0.4991381114057162, 'batch_norm': False, 'sage_aggr': 'mean', 'sage_normalize': True, 'sage_project': False, 'lr': 0.0007343776120036983, 'weight_decay': 8.127114728388985e-05, 'epochs': 312, 'loss': 'mse', 'optimizer': 'adam', 'graph_mode': 'cutoff', 'cutoff': 0.6816242108308406, 'grm_norm': 'cosine_then_gcn', 'self_loops': False, 'use_snp_selection': False}. Best is trial 13 with value: 0.3123866227334652.
[I 2025-12-08 15:45:57,402] Trial 25 finished with value: 0.27914083870465045 and parameters: {'model_type': 'graphsage', 'hidden_dims': '[256, 128]', 'dropout': 0.3885518341039618, 'batch_norm': False, 'sage_aggr': 'mean', 'sage_normalize': True, 'sage_project': False, 'lr': 0.00016130879579664796, 'weight_decay': 3.742221122324236e-06, 'epochs': 268, 'loss': 'mse', 'optimizer': 'adam', 'graph_mode': 'cutoff', 'cutoff': 0.35490812379973596, 'grm_norm': 'gcn', 'self_loops': False, 'use_snp_selection': False}. Best is trial 13 with value: 0.3123866227334652.
[I 2025-12-08 15:48:04,635] Trial 26 finished with value: 0.2553614304622759 and parameters: {'model_type': 'graphsage', 'hidden_dims': '[256, 128, 64]', 'dropout': 0.5372450771392142, 'batch_norm': False, 'sage_aggr': 'mean', 'sage_normalize': True, 'sage_project': False, 'lr': 0.00022259276617680557, 'weight_decay': 9.976164041698343e-07, 'epochs': 330, 'loss': 'mse', 'optimizer': 'adam', 'graph_mode': 'cutoff', 'cutoff': 0.4759042571471765, 'grm_norm': 'none', 'self_loops': False, 'use_snp_selection': False}. Best is trial 13 with value: 0.3123866227334652.
[I 2025-12-08 15:50:19,061] Trial 27 finished with value: 0.2977014683286682 and parameters: {'model_type': 'graphsage', 'hidden_dims': '[128, 64]', 'dropout': 0.47545374448894606, 'batch_norm': False, 'sage_aggr': 'mean', 'sage_normalize': True, 'sage_project': False, 'lr': 0.0013101652427958176, 'weight_decay': 1.5766400852304967e-05, 'epochs': 297, 'loss': 'mse', 'optimizer': 'adam', 'graph_mode': 'cutoff', 'cutoff': 0.30676847558107334, 'grm_norm': 'gcn', 'self_loops': False, 'use_snp_selection': False}. Best is trial 13 with value: 0.3123866227334652.
[I 2025-12-08 15:53:27,749] Trial 28 finished with value: 0.2964154422854939 and parameters: {'model_type': 'graphsage', 'hidden_dims': '[512, 64]', 'dropout': 0.5402718387406477, 'batch_norm': False, 'sage_aggr': 'mean', 'sage_normalize': True, 'sage_project': False, 'lr': 0.0009440312527866538, 'weight_decay': 5.540444776644907e-06, 'epochs': 349, 'loss': 'mse', 'optimizer': 'adam', 'graph_mode': 'cutoff', 'cutoff': 0.5508780750330627, 'grm_norm': 'cosine_then_gcn', 'self_loops': False, 'use_snp_selection': False}. Best is trial 13 with value: 0.3123866227334652.
[I 2025-12-08 15:54:36,373] Trial 29 finished with value: 0.247390360927323 and parameters: {'model_type': 'graphsage', 'hidden_dims': '[128, 64]', 'dropout': 0.3720217446113325, 'batch_norm': True, 'sage_aggr': 'max', 'sage_normalize': True, 'sage_project': False, 'lr': 0.0005030603055955822, 'weight_decay': 1.6636339088223458e-06, 'epochs': 218, 'loss': 'mse', 'optimizer': 'adam', 'graph_mode': 'knn', 'knn_k': 3, 'weighted_edges': False, 'symmetrize_mode': 'union', 'self_loops': False, 'use_snp_selection': False}. Best is trial 13 with value: 0.3123866227334652.
[I 2025-12-08 15:57:03,581] Trial 30 finished with value: 0.2999398655286809 and parameters: {'model_type': 'graphsage', 'hidden_dims': '[256, 128]', 'dropout': 0.4681067139401326, 'batch_norm': False, 'sage_aggr': 'mean', 'sage_normalize': True, 'sage_project': False, 'lr': 0.0017072396714517923, 'weight_decay': 0.0001478864795300378, 'epochs': 257, 'loss': 'mse', 'optimizer': 'adam', 'graph_mode': 'cutoff', 'cutoff': 0.2894085119939228, 'grm_norm': 'cosine', 'self_loops': False, 'use_snp_selection': False}. Best is trial 13 with value: 0.3123866227334652.
[I 2025-12-08 15:58:33,114] Trial 31 finished with value: 0.2997525663359716 and parameters: {'model_type': 'graphsage', 'hidden_dims': '[256, 128]', 'dropout': 0.5045476991529234, 'batch_norm': False, 'sage_aggr': 'mean', 'sage_normalize': True, 'sage_project': False, 'lr': 0.0006765074787584651, 'weight_decay': 7.704915391187546e-05, 'epochs': 311, 'loss': 'mse', 'optimizer': 'adam', 'graph_mode': 'cutoff', 'cutoff': 0.6793521424619868, 'grm_norm': 'cosine_then_gcn', 'self_loops': False, 'use_snp_selection': False}. Best is trial 13 with value: 0.3123866227334652.
[I 2025-12-08 16:00:06,944] Trial 32 finished with value: 0.29889142298159266 and parameters: {'model_type': 'graphsage', 'hidden_dims': '[256, 128]', 'dropout': 0.5174226543081228, 'batch_norm': False, 'sage_aggr': 'mean', 'sage_normalize': True, 'sage_project': False, 'lr': 0.0002687499460802781, 'weight_decay': 0.0001617571360376703, 'epochs': 327, 'loss': 'mse', 'optimizer': 'adam', 'graph_mode': 'cutoff', 'cutoff': 0.7227643281015173, 'grm_norm': 'cosine_then_gcn', 'self_loops': False, 'use_snp_selection': False}. Best is trial 13 with value: 0.3123866227334652.
[I 2025-12-08 16:02:03,547] Trial 33 finished with value: 0.2683852586637944 and parameters: {'model_type': 'graphsage', 'hidden_dims': '[256, 128]', 'dropout': 0.4309423120353467, 'batch_norm': False, 'sage_aggr': 'mean', 'sage_normalize': True, 'sage_project': False, 'lr': 0.00468394877399768, 'weight_decay': 4.1740719065044125e-05, 'epochs': 299, 'loss': 'mse', 'optimizer': 'adam', 'graph_mode': 'cutoff', 'cutoff': 0.431691159250069, 'grm_norm': 'cosine_then_gcn', 'self_loops': False, 'use_snp_selection': False}. Best is trial 13 with value: 0.3123866227334652.
[I 2025-12-08 16:02:14,754] Trial 34 finished with value: 0.07896057965524185 and parameters: {'model_type': 'graphsage', 'hidden_dims': '[512, 128]', 'dropout': 0.5625913619557461, 'batch_norm': False, 'sage_aggr': 'max', 'sage_normalize': False, 'sage_project': False, 'lr': 0.003352624411141803, 'weight_decay': 1.777052943123616e-05, 'epochs': 117, 'loss': 'mse', 'optimizer': 'adam', 'graph_mode': 'cutoff', 'cutoff': 0.5512912324086086, 'grm_norm': 'cosine_then_gcn', 'self_loops': True, 'use_snp_selection': True, 'num_snps': 2241}. Best is trial 13 with value: 0.3123866227334652.
[I 2025-12-08 16:04:50,195] Trial 35 finished with value: 0.0029265171758441596 and parameters: {'model_type': 'graphsage', 'hidden_dims': '[256, 128]', 'dropout': 0.4782574781636015, 'batch_norm': False, 'sage_aggr': 'max', 'sage_normalize': False, 'sage_project': False, 'lr': 0.0010668450823451677, 'weight_decay': 4.882043452870815e-06, 'epochs': 329, 'loss': 'mse', 'optimizer': 'adam', 'graph_mode': 'knn', 'knn_k': 4, 'weighted_edges': True, 'symmetrize_mode': 'union', 'self_loops': False, 'use_snp_selection': False}. Best is trial 13 with value: 0.3123866227334652.
[I 2025-12-08 16:07:37,962] Trial 36 finished with value: 0.27718458178358174 and parameters: {'model_type': 'graphsage', 'hidden_dims': '[512, 256]', 'dropout': 0.32627115404158735, 'batch_norm': True, 'sage_aggr': 'mean', 'sage_normalize': True, 'sage_project': False, 'lr': 0.0005438667097504571, 'weight_decay': 5.256889264886326e-05, 'epochs': 275, 'loss': 'mae', 'optimizer': 'adam', 'graph_mode': 'cutoff', 'cutoff': 0.6204493872068373, 'grm_norm': 'cosine_then_gcn', 'self_loops': False, 'use_snp_selection': True, 'num_snps': 59922}. Best is trial 13 with value: 0.3123866227334652.
[I 2025-12-08 16:09:05,019] Trial 37 finished with value: 0.011729483393475525 and parameters: {'model_type': 'graphsage', 'hidden_dims': '[256, 128, 64]', 'dropout': 0.4041904821975513, 'batch_norm': False, 'sage_aggr': 'mean', 'sage_normalize': False, 'sage_project': False, 'lr': 0.0003638052469072975, 'weight_decay': 0.00024960159851659264, 'epochs': 303, 'loss': 'mse', 'optimizer': 'adam', 'graph_mode': 'cutoff', 'cutoff': 0.8242690134799524, 'grm_norm': 'gcn', 'self_loops': False, 'use_snp_selection': False}. Best is trial 13 with value: 0.3123866227334652.
[I 2025-12-08 16:16:07,279] Trial 38 finished with value: 0.27862556690642215 and parameters: {'model_type': 'graphsage', 'hidden_dims': '[512, 64]', 'dropout': 0.3629213627825921, 'batch_norm': True, 'sage_aggr': 'max', 'sage_normalize': True, 'sage_project': False, 'lr': 0.002164430362250685, 'weight_decay': 0.00010211897939740186, 'epochs': 332, 'loss': 'mae', 'optimizer': 'adam', 'graph_mode': 'knn', 'knn_k': 10, 'weighted_edges': True, 'symmetrize_mode': 'union', 'self_loops': True, 'use_snp_selection': False}. Best is trial 13 with value: 0.3123866227334652.
[I 2025-12-08 16:16:37,662] Trial 39 finished with value: 0.27411307708023314 and parameters: {'model_type': 'graphsage', 'hidden_dims': '[128, 64]', 'dropout': 0.44652564855526145, 'batch_norm': False, 'sage_aggr': 'mean', 'sage_normalize': True, 'sage_project': False, 'lr': 2.6451524405790403e-05, 'weight_decay': 9.925102947940609e-06, 'epochs': 288, 'loss': 'mse', 'optimizer': 'adam', 'graph_mode': 'cutoff', 'cutoff': 0.4890243384869062, 'grm_norm': 'cosine', 'self_loops': False, 'use_snp_selection': True, 'num_snps': 15197}. Best is trial 13 with value: 0.3123866227334652.
[I 2025-12-08 16:19:22,307] Trial 40 finished with value: 0.29970776049292575 and parameters: {'model_type': 'graphsage', 'hidden_dims': '[256, 128]', 'dropout': 0.5538815462798902, 'batch_norm': True, 'sage_aggr': 'mean', 'sage_normalize': False, 'sage_project': False, 'lr': 0.0007293444948779628, 'weight_decay': 2.5409598632243548e-05, 'epochs': 233, 'loss': 'mae', 'optimizer': 'adam', 'graph_mode': 'knn', 'knn_k': 7, 'weighted_edges': False, 'symmetrize_mode': 'union', 'self_loops': True, 'use_snp_selection': False}. Best is trial 13 with value: 0.3123866227334652.
