[I 2025-12-09 20:41:13,101] Trial 84 finished with value: 0.3095978120446066 and parameters: {'model_type': 'graphsage', 'hidden_dims': '[512, 256]', 'dropout': 0.5751817178258657, 'batch_norm': False, 'sage_aggr': 'mean', 'sage_normalize': True, 'sage_project': False, 'lr': 0.0019007547760188906, 'weight_decay': 1.7824353189740646e-07, 'epochs': 254, 'loss': 'mse', 'optimizer': 'adam', 'graph_mode': 'cutoff', 'cutoff': 0.7584235133793488, 'grm_norm': 'none', 'self_loops': False, 'use_snp_selection': False}. Best is trial 59 with value: 0.31197841542309374.
[I 2025-12-09 20:43:27,484] Trial 85 finished with value: 0.3109706023880558 and parameters: {'model_type': 'graphsage', 'hidden_dims': '[512, 128]', 'dropout': 0.5715774554548777, 'batch_norm': False, 'sage_aggr': 'mean', 'sage_normalize': True, 'sage_project': False, 'lr': 0.0018712715639262875, 'weight_decay': 1.7065163871142509e-07, 'epochs': 253, 'loss': 'mse', 'optimizer': 'adam', 'graph_mode': 'cutoff', 'cutoff': 0.7766404062657731, 'grm_norm': 'cosine', 'self_loops': False, 'use_snp_selection': False}. Best is trial 59 with value: 0.31197841542309374.
[I 2025-12-09 20:46:06,695] Trial 86 finished with value: 0.3080517044380525 and parameters: {'model_type': 'graphsage', 'hidden_dims': '[512, 128]', 'dropout': 0.5686595641744746, 'batch_norm': False, 'sage_aggr': 'mean', 'sage_normalize': True, 'sage_project': False, 'lr': 0.0013241520507754358, 'weight_decay': 1.7309305118475308e-07, 'epochs': 268, 'loss': 'mse', 'optimizer': 'adam', 'graph_mode': 'cutoff', 'cutoff': 0.7779614147622098, 'grm_norm': 'cosine', 'self_loops': False, 'use_snp_selection': True, 'num_snps': 59012}. Best is trial 59 with value: 0.31197841542309374.
[I 2025-12-09 20:48:33,965] Trial 87 finished with value: 0.293360292673507 and parameters: {'model_type': 'graphsage', 'hidden_dims': '[512, 128]', 'dropout': 0.5723734856768473, 'batch_norm': False, 'sage_aggr': 'mean', 'sage_normalize': True, 'sage_project': False, 'lr': 0.00026215695108344316, 'weight_decay': 1.2813327283309908e-07, 'epochs': 278, 'loss': 'mse', 'optimizer': 'adam', 'graph_mode': 'cutoff', 'cutoff': 0.7595858401018325, 'grm_norm': 'none', 'self_loops': False, 'use_snp_selection': False}. Best is trial 59 with value: 0.31197841542309374.
[I 2025-12-09 20:50:47,873] Trial 88 finished with value: 0.2863678852006632 and parameters: {'model_type': 'graphsage', 'hidden_dims': '[512, 128]', 'dropout': 0.549673496867046, 'batch_norm': False, 'sage_aggr': 'mean', 'sage_normalize': True, 'sage_project': False, 'lr': 1.1278302265108379e-05, 'weight_decay': 2.3531824311542338e-07, 'epochs': 252, 'loss': 'mse', 'optimizer': 'adam', 'graph_mode': 'cutoff', 'cutoff': 0.7365248586257831, 'grm_norm': 'cosine', 'self_loops': False, 'use_snp_selection': False}. Best is trial 59 with value: 0.31197841542309374.
[I 2025-12-09 20:52:12,105] Trial 89 finished with value: 0.3112562349421019 and parameters: {'model_type': 'graphsage', 'hidden_dims': '[256, 128]', 'dropout': 0.46897702855582596, 'batch_norm': False, 'sage_aggr': 'max', 'sage_normalize': True, 'sage_project': False, 'lr': 0.002001395394974318, 'weight_decay': 1.55623898588234e-07, 'epochs': 296, 'loss': 'mse', 'optimizer': 'adam', 'graph_mode': 'cutoff', 'cutoff': 0.7666307281175462, 'grm_norm': 'none', 'self_loops': False, 'use_snp_selection': False}. Best is trial 59 with value: 0.31197841542309374.
[I 2025-12-09 20:53:35,401] Trial 90 finished with value: 0.30402166682472664 and parameters: {'model_type': 'graphsage', 'hidden_dims': '[256, 128]', 'dropout': 0.4687437424887619, 'batch_norm': False, 'sage_aggr': 'max', 'sage_normalize': True, 'sage_project': False, 'lr': 0.001142625642632501, 'weight_decay': 1.5409955744193287e-07, 'epochs': 291, 'loss': 'mse', 'optimizer': 'adam', 'graph_mode': 'cutoff', 'cutoff': 0.7071487795747097, 'grm_norm': 'gcn', 'self_loops': False, 'use_snp_selection': False}. Best is trial 59 with value: 0.31197841542309374.
[I 2025-12-09 20:55:03,731] Trial 91 finished with value: 0.3085111821568497 and parameters: {'model_type': 'graphsage', 'hidden_dims': '[256, 128]', 'dropout': 0.5024023996558065, 'batch_norm': False, 'sage_aggr': 'max', 'sage_normalize': True, 'sage_project': False, 'lr': 0.0017981109456513189, 'weight_decay': 1.822115827061368e-07, 'epochs': 311, 'loss': 'mse', 'optimizer': 'adam', 'graph_mode': 'cutoff', 'cutoff': 0.7661267242930178, 'grm_norm': 'none', 'self_loops': False, 'use_snp_selection': False}. Best is trial 59 with value: 0.31197841542309374.
[I 2025-12-09 20:56:18,779] Trial 92 finished with value: 0.30702045982805226 and parameters: {'model_type': 'graphsage', 'hidden_dims': '[256, 128]', 'dropout': 0.43785259987419156, 'batch_norm': False, 'sage_aggr': 'max', 'sage_normalize': True, 'sage_project': False, 'lr': 0.002151111223984558, 'weight_decay': 2.679981492115064e-07, 'epochs': 263, 'loss': 'mse', 'optimizer': 'adam', 'graph_mode': 'cutoff', 'cutoff': 0.8028450850883667, 'grm_norm': 'none', 'self_loops': False, 'use_snp_selection': False}. Best is trial 59 with value: 0.31197841542309374.
[I 2025-12-09 21:00:20,727] Trial 93 finished with value: 0.2787753160908502 and parameters: {'model_type': 'graphsage', 'hidden_dims': '[256, 128]', 'dropout': 0.48583832679399236, 'batch_norm': False, 'sage_aggr': 'max', 'sage_normalize': True, 'sage_project': False, 'lr': 0.0019323984855228364, 'weight_decay': 3.6331918257738324e-07, 'epochs': 290, 'loss': 'mse', 'optimizer': 'adam', 'graph_mode': 'cutoff', 'cutoff': 0.2506633375737483, 'grm_norm': 'none', 'self_loops': False, 'use_snp_selection': False}. Best is trial 59 with value: 0.31197841542309374.
[I 2025-12-09 21:03:12,258] Trial 94 finished with value: 0.307204325102554 and parameters: {'model_type': 'graphsage', 'hidden_dims': '[512, 128]', 'dropout': 0.527316857110553, 'batch_norm': False, 'sage_aggr': 'max', 'sage_normalize': True, 'sage_project': False, 'lr': 0.001585143195190117, 'weight_decay': 1.2840271566552095e-07, 'epochs': 326, 'loss': 'mse', 'optimizer': 'adam', 'graph_mode': 'cutoff', 'cutoff': 0.7238803002315671, 'grm_norm': 'none', 'self_loops': False, 'use_snp_selection': False}. Best is trial 59 with value: 0.31197841542309374.
[I 2025-12-09 21:04:26,694] Trial 95 finished with value: 0.30570385767997516 and parameters: {'model_type': 'graphsage', 'hidden_dims': '[256, 128]', 'dropout': 0.5606285098165328, 'batch_norm': False, 'sage_aggr': 'mean', 'sage_normalize': True, 'sage_project': False, 'lr': 0.002542200930033176, 'weight_decay': 1.0038121091886932e-07, 'epochs': 258, 'loss': 'mse', 'optimizer': 'adam', 'graph_mode': 'cutoff', 'cutoff': 0.793490868362196, 'grm_norm': 'cosine', 'self_loops': False, 'use_snp_selection': False}. Best is trial 59 with value: 0.31197841542309374.
[I 2025-12-09 21:05:47,486] Trial 96 finished with value: 0.30410008108381625 and parameters: {'model_type': 'graphsage', 'hidden_dims': '[256, 128]', 'dropout': 0.5085243218205513, 'batch_norm': False, 'sage_aggr': 'mean', 'sage_normalize': True, 'sage_project': False, 'lr': 0.005806871183360142, 'weight_decay': 1.8919841102341433e-07, 'epochs': 278, 'loss': 'mse', 'optimizer': 'adam', 'graph_mode': 'cutoff', 'cutoff': 0.6659289408304441, 'grm_norm': 'none', 'self_loops': False, 'use_snp_selection': False}. Best is trial 59 with value: 0.31197841542309374.
[I 2025-12-09 21:07:59,804] Trial 97 finished with value: 0.2965340634799387 and parameters: {'model_type': 'graphsage', 'hidden_dims': '[512, 128]', 'dropout': 0.17645266463428272, 'batch_norm': False, 'sage_aggr': 'max', 'sage_normalize': True, 'sage_project': False, 'lr': 0.0006244444423618429, 'weight_decay': 5.445091002956646e-07, 'epochs': 250, 'loss': 'mse', 'optimizer': 'adam', 'graph_mode': 'cutoff', 'cutoff': 0.8806809858231641, 'grm_norm': 'cosine', 'self_loops': False, 'use_snp_selection': False}. Best is trial 59 with value: 0.31197841542309374.
[I 2025-12-09 21:08:27,824] Trial 98 finished with value: 0.2866994994143949 and parameters: {'model_type': 'graphsage', 'hidden_dims': '[256, 128, 64]', 'dropout': 0.5910062463337917, 'batch_norm': False, 'sage_aggr': 'mean', 'sage_normalize': True, 'sage_project': False, 'lr': 0.0013459508968016209, 'weight_decay': 2.913907306930426e-07, 'epochs': 240, 'loss': 'mse', 'optimizer': 'adam', 'graph_mode': 'cutoff', 'cutoff': 0.754380414612489, 'grm_norm': 'none', 'self_loops': False, 'use_snp_selection': True, 'num_snps': 14934}. Best is trial 59 with value: 0.31197841542309374.
[I 2025-12-09 21:11:07,201] Trial 99 finished with value: 0.3070449855154372 and parameters: {'model_type': 'graphsage', 'hidden_dims': '[512, 64]', 'dropout': 0.3258285238444455, 'batch_norm': False, 'sage_aggr': 'mean', 'sage_normalize': True, 'sage_project': False, 'lr': 0.008685738923827804, 'weight_decay': 3.8667111344286797e-07, 'epochs': 302, 'loss': 'mse', 'optimizer': 'adam', 'graph_mode': 'cutoff', 'cutoff': 0.7758721725828694, 'grm_norm': 'none', 'self_loops': True, 'use_snp_selection': False}. Best is trial 59 with value: 0.31197841542309374.
[I 2025-12-09 21:12:28,581] Trial 100 finished with value: 0.30376037946141504 and parameters: {'model_type': 'graphsage', 'hidden_dims': '[256, 128]', 'dropout': 0.5767227909400673, 'batch_norm': False, 'sage_aggr': 'mean', 'sage_normalize': True, 'sage_project': False, 'lr': 0.004931505919506022, 'weight_decay': 1.555725666239562e-07, 'epochs': 283, 'loss': 'mse', 'optimizer': 'adam', 'graph_mode': 'cutoff', 'cutoff': 0.8026104993224198, 'grm_norm': 'cosine', 'self_loops': True, 'use_snp_selection': False}. Best is trial 59 with value: 0.31197841542309374.
[I 2025-12-09 21:14:00,688] Trial 101 finished with value: 0.29865568416401966 and parameters: {'model_type': 'graphsage', 'hidden_dims': '[512, 256]', 'dropout': 0.5390405873157119, 'batch_norm': False, 'sage_aggr': 'mean', 'sage_normalize': True, 'sage_project': False, 'lr': 0.0031113906069959014, 'weight_decay': 2.473907550330296e-07, 'epochs': 170, 'loss': 'mse', 'optimizer': 'adam', 'graph_mode': 'cutoff', 'cutoff': 0.8555663088590715, 'grm_norm': 'cosine', 'self_loops': True, 'use_snp_selection': False}. Best is trial 59 with value: 0.31197841542309374.
[I 2025-12-09 21:15:27,622] Trial 102 finished with value: 0.29247294783906785 and parameters: {'model_type': 'graphsage', 'hidden_dims': '[512, 256]', 'dropout': 0.5456858846267433, 'batch_norm': False, 'sage_aggr': 'mean', 'sage_normalize': True, 'sage_project': False, 'lr': 0.002339385280682419, 'weight_decay': 2.2398769625202755e-07, 'epochs': 160, 'loss': 'mse', 'optimizer': 'adam', 'graph_mode': 'cutoff', 'cutoff': 0.818246955688037, 'grm_norm': 'cosine', 'self_loops': True, 'use_snp_selection': False}. Best is trial 59 with value: 0.31197841542309374.
[I 2025-12-09 21:17:19,799] Trial 103 finished with value: 0.30919795869739514 and parameters: {'model_type': 'graphsage', 'hidden_dims': '[512, 256]', 'dropout': 0.5195616108747894, 'batch_norm': False, 'sage_aggr': 'mean', 'sage_normalize': True, 'sage_project': False, 'lr': 0.001958330467040955, 'weight_decay': 1.30998680345576e-07, 'epochs': 209, 'loss': 'mse', 'optimizer': 'adam', 'graph_mode': 'cutoff', 'cutoff': 0.8457133306690394, 'grm_norm': 'cosine', 'self_loops': True, 'use_snp_selection': False}. Best is trial 59 with value: 0.31197841542309374.
[I 2025-12-09 21:19:10,430] Trial 104 finished with value: 0.30546025783899367 and parameters: {'model_type': 'graphsage', 'hidden_dims': '[512, 256]', 'dropout': 0.49086714028329786, 'batch_norm': False, 'sage_aggr': 'mean', 'sage_normalize': True, 'sage_project': False, 'lr': 0.000943139194136288, 'weight_decay': 1.4390359131187924e-07, 'epochs': 206, 'loss': 'mse', 'optimizer': 'adam', 'graph_mode': 'cutoff', 'cutoff': 0.8408503782120937, 'grm_norm': 'cosine', 'self_loops': True, 'use_snp_selection': False}. Best is trial 59 with value: 0.31197841542309374.
[I 2025-12-09 21:21:13,893] Trial 105 finished with value: 0.2949838972405262 and parameters: {'model_type': 'graphsage', 'hidden_dims': '[512, 256]', 'dropout': 0.5175602820123933, 'batch_norm': False, 'sage_aggr': 'mean', 'sage_normalize': True, 'sage_project': False, 'lr': 0.0019327925902214757, 'weight_decay': 1.1899430520037586e-07, 'epochs': 231, 'loss': 'mse', 'optimizer': 'adam', 'graph_mode': 'cutoff', 'cutoff': 0.8795510804835014, 'grm_norm': 'cosine_then_gcn', 'self_loops': True, 'use_snp_selection': False}. Best is trial 59 with value: 0.31197841542309374.
[I 2025-12-09 21:22:54,773] Trial 106 finished with value: 0.30074201742755313 and parameters: {'model_type': 'graphsage', 'hidden_dims': '[512, 256]', 'dropout': 0.4735389372803532, 'batch_norm': False, 'sage_aggr': 'mean', 'sage_normalize': True, 'sage_project': False, 'lr': 0.0011296000575636773, 'weight_decay': 0.00012345861139752916, 'epochs': 187, 'loss': 'mse', 'optimizer': 'adam', 'graph_mode': 'cutoff', 'cutoff': 0.7696957772522461, 'grm_norm': 'cosine', 'self_loops': True, 'use_snp_selection': False}. Best is trial 59 with value: 0.31197841542309374.
[I 2025-12-09 21:24:48,843] Trial 107 finished with value: 0.003472328253749296 and parameters: {'model_type': 'graphsage', 'hidden_dims': '[512, 256]', 'dropout': 0.2618477520850522, 'batch_norm': False, 'sage_aggr': 'mean', 'sage_normalize': False, 'sage_project': False, 'lr': 0.004066182045294576, 'weight_decay': 1.8264039053631269e-07, 'epochs': 213, 'loss': 'mse', 'optimizer': 'adam', 'graph_mode': 'cutoff', 'cutoff': 0.713986017652267, 'grm_norm': 'none', 'self_loops': True, 'use_snp_selection': False}. Best is trial 59 with value: 0.31197841542309374.
[I 2025-12-09 21:26:03,570] Trial 108 finished with value: 0.28091377248620336 and parameters: {'model_type': 'graphsage', 'hidden_dims': '[256, 128]', 'dropout': 0.5339035245626066, 'batch_norm': False, 'sage_aggr': 'mean', 'sage_normalize': True, 'sage_project': False, 'lr': 1.691948767700549e-05, 'weight_decay': 3.1411282843187075e-07, 'epochs': 259, 'loss': 'mse', 'optimizer': 'adam', 'graph_mode': 'cutoff', 'cutoff': 0.7926429245232341, 'grm_norm': 'none', 'self_loops': True, 'use_snp_selection': False}. Best is trial 59 with value: 0.31197841542309374.
[I 2025-12-09 21:27:55,243] Trial 109 finished with value: 0.30555061008146334 and parameters: {'model_type': 'graphsage', 'hidden_dims': '[512, 256]', 'dropout': 0.5565337947503995, 'batch_norm': False, 'sage_aggr': 'mean', 'sage_normalize': True, 'sage_project': False, 'lr': 0.007266179427879203, 'weight_decay': 2.1137450075475507e-07, 'epochs': 208, 'loss': 'mse', 'optimizer': 'adam', 'graph_mode': 'cutoff', 'cutoff': 0.8156924148835785, 'grm_norm': 'cosine', 'self_loops': False, 'use_snp_selection': False}. Best is trial 59 with value: 0.31197841542309374.
[I 2025-12-09 21:30:06,624] Trial 110 finished with value: 0.27920948679419305 and parameters: {'model_type': 'graphsage', 'hidden_dims': '[512, 128]', 'dropout': 0.36993741869623364, 'batch_norm': True, 'sage_aggr': 'max', 'sage_normalize': True, 'sage_project': False, 'lr': 0.0015066449337692042, 'weight_decay': 1.4012782905497473e-07, 'epochs': 238, 'loss': 'mae', 'optimizer': 'adam', 'graph_mode': 'knn', 'knn_k': 1, 'weighted_edges': True, 'symmetrize_mode': 'mutual', 'self_loops': True, 'use_snp_selection': False}. Best is trial 59 with value: 0.31197841542309374.
[I 2025-12-09 21:31:25,839] Trial 111 finished with value: 0.3036603992914118 and parameters: {'model_type': 'graphsage', 'hidden_dims': '[512, 256]', 'dropout': 0.5479416677001918, 'batch_norm': False, 'sage_aggr': 'mean', 'sage_normalize': True, 'sage_project': False, 'lr': 0.0028907071559905245, 'weight_decay': 4.6244617181835844e-07, 'epochs': 145, 'loss': 'mse', 'optimizer': 'adam', 'graph_mode': 'cutoff', 'cutoff': 0.8575284767711955, 'grm_norm': 'cosine', 'self_loops': True, 'use_snp_selection': False}. Best is trial 59 with value: 0.31197841542309374.
[I 2025-12-09 21:32:52,078] Trial 112 finished with value: 0.3036142289710022 and parameters: {'model_type': 'graphsage', 'hidden_dims': '[512, 256]', 'dropout': 0.5653943930121647, 'batch_norm': False, 'sage_aggr': 'mean', 'sage_normalize': True, 'sage_project': False, 'lr': 0.00253174860585304, 'weight_decay': 3.611330088550829e-07, 'epochs': 154, 'loss': 'mse', 'optimizer': 'adam', 'graph_mode': 'cutoff', 'cutoff': 0.547744506185462, 'grm_norm': 'cosine', 'self_loops': True, 'use_snp_selection': False}. Best is trial 59 with value: 0.31197841542309374.
[I 2025-12-09 21:34:20,568] Trial 113 finished with value: 0.306857930636561 and parameters: {'model_type': 'graphsage', 'hidden_dims': '[512, 256]', 'dropout': 0.5088256799720927, 'batch_norm': False, 'sage_aggr': 'mean', 'sage_normalize': True, 'sage_project': False, 'lr': 0.002069974622010279, 'weight_decay': 2.820317536967212e-07, 'epochs': 163, 'loss': 'mse', 'optimizer': 'adam', 'graph_mode': 'cutoff', 'cutoff': 0.8463188921790888, 'grm_norm': 'cosine', 'self_loops': True, 'use_snp_selection': False}. Best is trial 59 with value: 0.31197841542309374.
[I 2025-12-09 21:35:57,138] Trial 114 finished with value: 0.30241433507777593 and parameters: {'model_type': 'graphsage', 'hidden_dims': '[512, 256]', 'dropout': 0.520464879272497, 'batch_norm': False, 'sage_aggr': 'mean', 'sage_normalize': True, 'sage_project': False, 'lr': 0.0030355529043235396, 'weight_decay': 1.671211291554365e-07, 'epochs': 179, 'loss': 'mse', 'optimizer': 'adam', 'graph_mode': 'cutoff', 'cutoff': 0.8853228223162273, 'grm_norm': 'gcn', 'self_loops': True, 'use_snp_selection': False}. Best is trial 59 with value: 0.31197841542309374.
[I 2025-12-09 21:37:40,416] Trial 115 finished with value: 0.30128873328712646 and parameters: {'model_type': 'graphsage', 'hidden_dims': '[512, 256]', 'dropout': 0.584206050119077, 'batch_norm': False, 'sage_aggr': 'mean', 'sage_normalize': True, 'sage_project': False, 'lr': 0.0017096348775348866, 'weight_decay': 1.1743908181510243e-07, 'epochs': 192, 'loss': 'mse', 'optimizer': 'adam', 'graph_mode': 'cutoff', 'cutoff': 0.8427371239058783, 'grm_norm': 'none', 'self_loops': True, 'use_snp_selection': False}. Best is trial 59 with value: 0.31197841542309374.
[I 2025-12-09 21:38:58,572] Trial 116 finished with value: 0.2952722168215199 and parameters: {'model_type': 'graphsage', 'hidden_dims': '[256, 128, 64]', 'dropout': 0.5310516594693009, 'batch_norm': False, 'sage_aggr': 'mean', 'sage_normalize': True, 'sage_project': False, 'lr': 0.002468941378965605, 'weight_decay': 6.0825697559938e-07, 'epochs': 270, 'loss': 'mse', 'optimizer': 'adam', 'graph_mode': 'cutoff', 'cutoff': 0.8217906980897433, 'grm_norm': 'cosine', 'self_loops': True, 'use_snp_selection': False}. Best is trial 59 with value: 0.31197841542309374.
[I 2025-12-09 21:39:55,429] Trial 117 finished with value: 0.27731054366386926 and parameters: {'model_type': 'graphsage', 'hidden_dims': '[512, 256]', 'dropout': 0.5750838279661256, 'batch_norm': False, 'sage_aggr': 'mean', 'sage_normalize': True, 'sage_project': False, 'lr': 5.135990931765338e-05, 'weight_decay': 3.562371984783854e-06, 'epochs': 226, 'loss': 'mse', 'optimizer': 'adam', 'graph_mode': 'cutoff', 'cutoff': 0.7426332752316902, 'grm_norm': 'none', 'self_loops': True, 'use_snp_selection': True, 'num_snps': 24004}. Best is trial 59 with value: 0.31197841542309374.
[I 2025-12-09 21:40:33,413] Trial 118 finished with value: 0.2877654211379725 and parameters: {'model_type': 'graphsage', 'hidden_dims': '[128, 64]', 'dropout': 0.5945199406163839, 'batch_norm': False, 'sage_aggr': 'mean', 'sage_normalize': True, 'sage_project': False, 'lr': 0.009538977245492634, 'weight_decay': 2.1901167691260798e-07, 'epochs': 198, 'loss': 'mse', 'optimizer': 'adam', 'graph_mode': 'cutoff', 'cutoff': 0.570569177131239, 'grm_norm': 'cosine', 'self_loops': False, 'use_snp_selection': False}. Best is trial 59 with value: 0.31197841542309374.
[I 2025-12-09 21:41:22,504] Trial 119 finished with value: 0.3051295246992383 and parameters: {'model_type': 'graphsage', 'hidden_dims': '[256, 128]', 'dropout': 0.4578776990008443, 'batch_norm': False, 'sage_aggr': 'mean', 'sage_normalize': True, 'sage_project': False, 'lr': 0.0035029731265545116, 'weight_decay': 4.32680986533151e-07, 'epochs': 167, 'loss': 'mse', 'optimizer': 'adam', 'graph_mode': 'cutoff', 'cutoff': 0.8675699603740945, 'grm_norm': 'none', 'self_loops': True, 'use_snp_selection': False}. Best is trial 59 with value: 0.31197841542309374.
[I 2025-12-09 21:42:56,307] Trial 120 finished with value: 0.29314762081119017 and parameters: {'model_type': 'graphsage', 'hidden_dims': '[512, 256]', 'dropout': 0.5464095242244915, 'batch_norm': False, 'sage_aggr': 'mean', 'sage_normalize': False, 'sage_project': False, 'lr': 0.00012926067348383304, 'weight_decay': 0.0003087886973592688, 'epochs': 174, 'loss': 'mse', 'optimizer': 'adam', 'graph_mode': 'cutoff', 'cutoff': 0.7850709763692505, 'grm_norm': 'gcn', 'self_loops': False, 'use_snp_selection': False}. Best is trial 59 with value: 0.31197841542309374.
[I 2025-12-09 21:44:57,096] Trial 121 finished with value: 0.3057429316525001 and parameters: {'model_type': 'graphsage', 'hidden_dims': '[512, 256]', 'dropout': 0.5804276794063901, 'batch_norm': False, 'sage_aggr': 'mean', 'sage_normalize': True, 'sage_project': False, 'lr': 0.005395900308096721, 'weight_decay': 9.97833818676959e-07, 'epochs': 226, 'loss': 'mse', 'optimizer': 'adam', 'graph_mode': 'cutoff', 'cutoff': 0.8348940776763892, 'grm_norm': 'none', 'self_loops': False, 'use_snp_selection': False}. Best is trial 59 with value: 0.31197841542309374.
