[I 2025-12-09 12:35:42,664] Trial 6 finished with value: 0.28640988245141485 and parameters: {'model_type': 'graphsage', 'hidden_dims': '[256, 128, 64]', 'dropout': 0.10731743755162496, 'batch_norm': True, 'sage_aggr': 'mean', 'sage_normalize': False, 'sage_project': False, 'lr': 1.922990426933137e-05, 'weight_decay': 7.30001060446905e-05, 'epochs': 63, 'loss': 'mae', 'optimizer': 'adam', 'graph_mode': 'cutoff', 'cutoff': 0.7624978434202536, 'grm_norm': 'none', 'self_loops': True, 'use_snp_selection': True, 'num_snps': 50106}. Best is trial 6 with value: 0.28640988245141485.
[I 2025-12-09 12:37:44,093] Trial 7 finished with value: 0.2542040602368143 and parameters: {'model_type': 'graphsage', 'hidden_dims': '[512, 64]', 'dropout': 0.2585007811528941, 'batch_norm': True, 'sage_aggr': 'max', 'sage_normalize': True, 'sage_project': False, 'lr': 5.921425508303391e-05, 'weight_decay': 0.0004511561961144237, 'epochs': 182, 'loss': 'mae', 'optimizer': 'adam', 'graph_mode': 'knn', 'knn_k': 9, 'weighted_edges': True, 'symmetrize_mode': 'union', 'self_loops': False, 'use_snp_selection': True, 'num_snps': 23903}. Best is trial 6 with value: 0.28640988245141485.
[I 2025-12-09 12:38:26,885] Trial 8 finished with value: 0.24033225097292496 and parameters: {'model_type': 'graphsage', 'hidden_dims': '[512, 256]', 'dropout': 0.3061380386767003, 'batch_norm': False, 'sage_aggr': 'mean', 'sage_normalize': True, 'sage_project': False, 'lr': 0.000698401460570184, 'weight_decay': 2.965560055460244e-06, 'epochs': 289, 'loss': 'mae', 'optimizer': 'adam', 'graph_mode': 'knn', 'knn_k': 7, 'weighted_edges': False, 'symmetrize_mode': 'mutual', 'self_loops': True, 'use_snp_selection': True, 'num_snps': 4710}. Best is trial 6 with value: 0.28640988245141485.
[I 2025-12-09 12:42:20,436] Trial 9 finished with value: 0.2784741220369771 and parameters: {'model_type': 'graphsage', 'hidden_dims': '[512, 128]', 'dropout': 0.1733844071393634, 'batch_norm': False, 'sage_aggr': 'mean', 'sage_normalize': True, 'sage_project': False, 'lr': 0.0004269677918501597, 'weight_decay': 2.2439779626249696e-06, 'epochs': 319, 'loss': 'mse', 'optimizer': 'adam', 'graph_mode': 'cutoff', 'cutoff': 0.24117565767129295, 'grm_norm': 'cosine_then_gcn', 'self_loops': True, 'use_snp_selection': False}. Best is trial 6 with value: 0.28640988245141485.
[I 2025-12-09 12:43:16,549] Trial 10 finished with value: 0.28864244549662077 and parameters: {'model_type': 'graphsage', 'hidden_dims': '[256, 128, 64]', 'dropout': 0.5365714961141473, 'batch_norm': True, 'sage_aggr': 'mean', 'sage_normalize': False, 'sage_project': False, 'lr': 0.0060050040216813455, 'weight_decay': 4.9377500793081834e-05, 'epochs': 46, 'loss': 'mae', 'optimizer': 'adam', 'graph_mode': 'cutoff', 'cutoff': 0.8579871888501912, 'grm_norm': 'none', 'self_loops': True, 'use_snp_selection': True, 'num_snps': 59927}. Best is trial 10 with value: 0.28864244549662077.
[I 2025-12-09 12:44:11,439] Trial 11 finished with value: 0.286308632712826 and parameters: {'model_type': 'graphsage', 'hidden_dims': '[256, 128, 64]', 'dropout': 0.5437810742461437, 'batch_norm': True, 'sage_aggr': 'mean', 'sage_normalize': False, 'sage_project': False, 'lr': 0.008000655871733665, 'weight_decay': 4.2521929457206324e-05, 'epochs': 47, 'loss': 'mae', 'optimizer': 'adam', 'graph_mode': 'cutoff', 'cutoff': 0.897550071387144, 'grm_norm': 'none', 'self_loops': True, 'use_snp_selection': True, 'num_snps': 57688}. Best is trial 10 with value: 0.28864244549662077.
[I 2025-12-09 12:44:59,295] Trial 12 finished with value: 0.2915263941124868 and parameters: {'model_type': 'graphsage', 'hidden_dims': '[256, 128, 64]', 'dropout': 0.4921208650038426, 'batch_norm': True, 'sage_aggr': 'mean', 'sage_normalize': False, 'sage_project': False, 'lr': 0.008796549023736102, 'weight_decay': 3.9327931719627325e-05, 'epochs': 41, 'loss': 'mae', 'optimizer': 'adam', 'graph_mode': 'cutoff', 'cutoff': 0.875858815737441, 'grm_norm': 'none', 'self_loops': True, 'use_snp_selection': True, 'num_snps': 47351}. Best is trial 12 with value: 0.2915263941124868.
[I 2025-12-09 12:46:08,929] Trial 13 finished with value: 0.2875447040978423 and parameters: {'model_type': 'graphsage', 'hidden_dims': '[256, 128]', 'dropout': 0.5237804302263875, 'batch_norm': True, 'sage_aggr': 'mean', 'sage_normalize': False, 'sage_project': False, 'lr': 0.008283626979251458, 'weight_decay': 2.207819306969384e-05, 'epochs': 96, 'loss': 'mae', 'optimizer': 'adam', 'graph_mode': 'cutoff', 'cutoff': 0.8958185940217869, 'grm_norm': 'cosine', 'self_loops': True, 'use_snp_selection': True, 'num_snps': 59441}. Best is trial 12 with value: 0.2915263941124868.
[I 2025-12-09 12:47:02,961] Trial 14 finished with value: 0.2785728605308468 and parameters: {'model_type': 'graphsage', 'hidden_dims': '[256, 128, 64]', 'dropout': 0.44099154398585816, 'batch_norm': True, 'sage_aggr': 'mean', 'sage_normalize': False, 'sage_project': False, 'lr': 0.0022584522186862204, 'weight_decay': 0.0009038765422009597, 'epochs': 101, 'loss': 'mae', 'optimizer': 'adam', 'graph_mode': 'cutoff', 'cutoff': 0.6777772434939535, 'grm_norm': 'none', 'self_loops': True, 'use_snp_selection': True, 'num_snps': 40832}. Best is trial 12 with value: 0.2915263941124868.
[I 2025-12-09 12:48:01,965] Trial 15 finished with value: 0.28915820190389635 and parameters: {'model_type': 'graphsage', 'hidden_dims': '[256, 128, 64]', 'dropout': 0.4521449922991649, 'batch_norm': True, 'sage_aggr': 'mean', 'sage_normalize': False, 'sage_project': False, 'lr': 0.0025728547238951945, 'weight_decay': 1.089998542568318e-05, 'epochs': 99, 'loss': 'mae', 'optimizer': 'adam', 'graph_mode': 'cutoff', 'cutoff': 0.7694950832084768, 'grm_norm': 'none', 'self_loops': True, 'use_snp_selection': True, 'num_snps': 46894}. Best is trial 12 with value: 0.2915263941124868.
[I 2025-12-09 12:48:58,140] Trial 16 finished with value: 0.2835187883337572 and parameters: {'model_type': 'graphsage', 'hidden_dims': '[256, 128]', 'dropout': 0.4334411227544116, 'batch_norm': True, 'sage_aggr': 'mean', 'sage_normalize': False, 'sage_project': False, 'lr': 0.0020040615235403995, 'weight_decay': 7.491891531625316e-06, 'epochs': 98, 'loss': 'mae', 'optimizer': 'adam', 'graph_mode': 'cutoff', 'cutoff': 0.7424650066019534, 'grm_norm': 'cosine', 'self_loops': True, 'use_snp_selection': True, 'num_snps': 42562}. Best is trial 12 with value: 0.2915263941124868.
[I 2025-12-09 12:49:50,286] Trial 17 finished with value: 0.27888060167750484 and parameters: {'model_type': 'graphsage', 'hidden_dims': '[256, 128, 64]', 'dropout': 0.4293742980557455, 'batch_norm': True, 'sage_aggr': 'mean', 'sage_normalize': False, 'sage_project': False, 'lr': 0.0027426150880501417, 'weight_decay': 3.5305730150149095e-07, 'epochs': 226, 'loss': 'mae', 'optimizer': 'adam', 'graph_mode': 'cutoff', 'cutoff': 0.47136873750689057, 'grm_norm': 'gcn', 'self_loops': True, 'use_snp_selection': True, 'num_snps': 18242}. Best is trial 12 with value: 0.2915263941124868.
[I 2025-12-09 12:50:19,588] Trial 18 finished with value: 0.0 and parameters: {'model_type': 'graphsage', 'hidden_dims': '[256, 128, 64]', 'dropout': 0.4814779547689651, 'batch_norm': False, 'sage_aggr': 'mean', 'sage_normalize': False, 'sage_project': False, 'lr': 0.0009311119232309363, 'weight_decay': 1.444323069850804e-05, 'epochs': 81, 'loss': 'mae', 'optimizer': 'adam', 'graph_mode': 'cutoff', 'cutoff': 0.7557936915826282, 'grm_norm': 'cosine_then_gcn', 'self_loops': False, 'use_snp_selection': False}. Best is trial 12 with value: 0.2915263941124868.
[I 2025-12-09 12:51:22,512] Trial 19 finished with value: 0.2777783311304636 and parameters: {'model_type': 'graphsage', 'hidden_dims': '[256, 128, 64]', 'dropout': 0.572180664826032, 'batch_norm': True, 'sage_aggr': 'mean', 'sage_normalize': False, 'sage_project': False, 'lr': 0.00360025248813731, 'weight_decay': 0.00013227904481259267, 'epochs': 118, 'loss': 'mae', 'optimizer': 'adam', 'graph_mode': 'cutoff', 'cutoff': 0.6046092089295697, 'grm_norm': 'none', 'self_loops': True, 'use_snp_selection': True, 'num_snps': 45306}. Best is trial 12 with value: 0.2915263941124868.
[I 2025-12-09 12:52:51,394] Trial 20 finished with value: 0.2808680508767328 and parameters: {'model_type': 'graphsage', 'hidden_dims': '[512, 256]', 'dropout': 0.3886879767980967, 'batch_norm': True, 'sage_aggr': 'mean', 'sage_normalize': False, 'sage_project': False, 'lr': 0.0012582090480562653, 'weight_decay': 2.830438169255119e-06, 'epochs': 125, 'loss': 'mae', 'optimizer': 'adam', 'graph_mode': 'cutoff', 'cutoff': 0.32625163922070954, 'grm_norm': 'none', 'self_loops': True, 'use_snp_selection': True, 'num_snps': 36101}. Best is trial 12 with value: 0.2915263941124868.
[I 2025-12-09 12:53:42,569] Trial 21 finished with value: 0.283866660302536 and parameters: {'model_type': 'graphsage', 'hidden_dims': '[256, 128, 64]', 'dropout': 0.5953766632885211, 'batch_norm': True, 'sage_aggr': 'mean', 'sage_normalize': False, 'sage_project': False, 'lr': 0.004950183216555032, 'weight_decay': 5.981731184054269e-05, 'epochs': 42, 'loss': 'mae', 'optimizer': 'adam', 'graph_mode': 'cutoff', 'cutoff': 0.8267214394196276, 'grm_norm': 'none', 'self_loops': True, 'use_snp_selection': True, 'num_snps': 52834}. Best is trial 12 with value: 0.2915263941124868.
[I 2025-12-09 12:54:44,228] Trial 22 finished with value: 0.28973623756994094 and parameters: {'model_type': 'graphsage', 'hidden_dims': '[256, 128, 64]', 'dropout': 0.4940162684391427, 'batch_norm': True, 'sage_aggr': 'mean', 'sage_normalize': False, 'sage_project': False, 'lr': 0.009315374204909778, 'weight_decay': 1.4009698324895506e-05, 'epochs': 67, 'loss': 'mae', 'optimizer': 'adam', 'graph_mode': 'cutoff', 'cutoff': 0.8196252416975303, 'grm_norm': 'none', 'self_loops': True, 'use_snp_selection': True, 'num_snps': 59917}. Best is trial 12 with value: 0.2915263941124868.
[I 2025-12-09 12:55:41,256] Trial 23 finished with value: 0.28666996078828577 and parameters: {'model_type': 'graphsage', 'hidden_dims': '[256, 128, 64]', 'dropout': 0.4911091035287355, 'batch_norm': True, 'sage_aggr': 'mean', 'sage_normalize': False, 'sage_project': False, 'lr': 0.009563450733401594, 'weight_decay': 1.2103631609958964e-05, 'epochs': 67, 'loss': 'mae', 'optimizer': 'adam', 'graph_mode': 'cutoff', 'cutoff': 0.7987797844591287, 'grm_norm': 'none', 'self_loops': True, 'use_snp_selection': True, 'num_snps': 52658}. Best is trial 12 with value: 0.2915263941124868.
[I 2025-12-09 12:56:35,150] Trial 24 finished with value: 0.2874119114184897 and parameters: {'model_type': 'graphsage', 'hidden_dims': '[256, 128, 64]', 'dropout': 0.393436423556579, 'batch_norm': True, 'sage_aggr': 'mean', 'sage_normalize': False, 'sage_project': False, 'lr': 0.004294589794124965, 'weight_decay': 5.36641987478192e-06, 'epochs': 75, 'loss': 'mae', 'optimizer': 'adam', 'graph_mode': 'cutoff', 'cutoff': 0.6879247334320697, 'grm_norm': 'none', 'self_loops': True, 'use_snp_selection': True, 'num_snps': 45883}. Best is trial 12 with value: 0.2915263941124868.
[I 2025-12-09 12:57:44,456] Trial 25 finished with value: 0.2812056245710898 and parameters: {'model_type': 'graphsage', 'hidden_dims': '[512, 64]', 'dropout': 0.4846081689045239, 'batch_norm': True, 'sage_aggr': 'mean', 'sage_normalize': False, 'sage_project': False, 'lr': 0.000155724584656741, 'weight_decay': 1.946435004658572e-05, 'epochs': 122, 'loss': 'mae', 'optimizer': 'adam', 'graph_mode': 'cutoff', 'cutoff': 0.823282933677381, 'grm_norm': 'cosine', 'self_loops': True, 'use_snp_selection': True, 'num_snps': 37370}. Best is trial 12 with value: 0.2915263941124868.
[I 2025-12-09 12:58:05,393] Trial 26 finished with value: 0.27792878856959924 and parameters: {'model_type': 'graphsage', 'hidden_dims': '[128, 64]', 'dropout': 0.392458937646733, 'batch_norm': True, 'sage_aggr': 'mean', 'sage_normalize': True, 'sage_project': False, 'lr': 0.0012041568935991951, 'weight_decay': 1.0559621156581787e-06, 'epochs': 82, 'loss': 'mse', 'optimizer': 'adam', 'graph_mode': 'cutoff', 'cutoff': 0.6855271605431852, 'grm_norm': 'gcn', 'self_loops': True, 'use_snp_selection': False}. Best is trial 12 with value: 0.2915263941124868.
[I 2025-12-09 13:00:14,425] Trial 27 finished with value: 0.0 and parameters: {'model_type': 'graphsage', 'hidden_dims': '[512, 128]', 'dropout': 0.4635083176997839, 'batch_norm': False, 'sage_aggr': 'mean', 'sage_normalize': False, 'sage_project': False, 'lr': 0.0020808998531230936, 'weight_decay': 0.00011150937210472796, 'epochs': 225, 'loss': 'mae', 'optimizer': 'adam', 'graph_mode': 'cutoff', 'cutoff': 0.7244673261579762, 'grm_norm': 'cosine_then_gcn', 'self_loops': False, 'use_snp_selection': True, 'num_snps': 54068}. Best is trial 12 with value: 0.2915263941124868.
[I 2025-12-09 13:01:02,389] Trial 28 finished with value: 0.2878165357738428 and parameters: {'model_type': 'graphsage', 'hidden_dims': '[256, 128]', 'dropout': 0.5218991670523058, 'batch_norm': True, 'sage_aggr': 'mean', 'sage_normalize': False, 'sage_project': False, 'lr': 0.0057182359797631685, 'weight_decay': 2.20028087972432e-05, 'epochs': 41, 'loss': 'mae', 'optimizer': 'adam', 'graph_mode': 'cutoff', 'cutoff': 0.6235951929216456, 'grm_norm': 'none', 'self_loops': True, 'use_snp_selection': True, 'num_snps': 47060}. Best is trial 12 with value: 0.2915263941124868.
[I 2025-12-09 13:01:48,691] Trial 29 finished with value: 0.20691607658461603 and parameters: {'model_type': 'graphsage', 'hidden_dims': '[128, 64]', 'dropout': 0.5635330179220248, 'batch_norm': True, 'sage_aggr': 'max', 'sage_normalize': True, 'sage_project': False, 'lr': 0.003303278409713539, 'weight_decay': 4.69933612249197e-06, 'epochs': 110, 'loss': 'mse', 'optimizer': 'adam', 'graph_mode': 'knn', 'knn_k': 4, 'weighted_edges': True, 'symmetrize_mode': 'union', 'self_loops': True, 'use_snp_selection': False}. Best is trial 12 with value: 0.2915263941124868.
[I 2025-12-09 13:02:39,371] Trial 30 finished with value: 0.28504893323337666 and parameters: {'model_type': 'graphsage', 'hidden_dims': '[256, 128, 64]', 'dropout': 0.5042754035436569, 'batch_norm': True, 'sage_aggr': 'mean', 'sage_normalize': False, 'sage_project': False, 'lr': 0.00018933476915207803, 'weight_decay': 0.00023436853656734843, 'epochs': 135, 'loss': 'mae', 'optimizer': 'adam', 'graph_mode': 'cutoff', 'cutoff': 0.8079651204025741, 'grm_norm': 'none', 'self_loops': True, 'use_snp_selection': True, 'num_snps': 30389}. Best is trial 12 with value: 0.2915263941124868.
[I 2025-12-09 13:03:39,208] Trial 31 finished with value: 0.29171311552261125 and parameters: {'model_type': 'graphsage', 'hidden_dims': '[256, 128, 64]', 'dropout': 0.5514846247870913, 'batch_norm': True, 'sage_aggr': 'mean', 'sage_normalize': False, 'sage_project': False, 'lr': 0.005960262415031374, 'weight_decay': 3.5797615237164115e-05, 'epochs': 62, 'loss': 'mae', 'optimizer': 'adam', 'graph_mode': 'cutoff', 'cutoff': 0.8564936066735266, 'grm_norm': 'none', 'self_loops': True, 'use_snp_selection': True, 'num_snps': 59945}. Best is trial 31 with value: 0.29171311552261125.
[I 2025-12-09 13:04:37,061] Trial 32 finished with value: 0.28768663800962213 and parameters: {'model_type': 'graphsage', 'hidden_dims': '[256, 128, 64]', 'dropout': 0.45815387313311184, 'batch_norm': True, 'sage_aggr': 'mean', 'sage_normalize': False, 'sage_project': False, 'lr': 0.008564394572437302, 'weight_decay': 2.7302413957920968e-05, 'epochs': 64, 'loss': 'mae', 'optimizer': 'adam', 'graph_mode': 'cutoff', 'cutoff': 0.8632403515800727, 'grm_norm': 'none', 'self_loops': True, 'use_snp_selection': True, 'num_snps': 55611}. Best is trial 31 with value: 0.29171311552261125.
[I 2025-12-09 13:05:40,555] Trial 33 finished with value: 0.28848390154661063 and parameters: {'model_type': 'graphsage', 'hidden_dims': '[256, 128, 64]', 'dropout': 0.5946921747783818, 'batch_norm': True, 'sage_aggr': 'mean', 'sage_normalize': False, 'sage_project': False, 'lr': 0.005367469162906615, 'weight_decay': 9.563270502965832e-05, 'epochs': 85, 'loss': 'mae', 'optimizer': 'adam', 'graph_mode': 'cutoff', 'cutoff': 0.7925619438238191, 'grm_norm': 'none', 'self_loops': True, 'use_snp_selection': True, 'num_snps': 55980}. Best is trial 31 with value: 0.29171311552261125.
[I 2025-12-09 13:06:33,489] Trial 34 finished with value: -0.0273572059468004 and parameters: {'model_type': 'graphsage', 'hidden_dims': '[256, 128, 64]', 'dropout': 0.41111683024410833, 'batch_norm': False, 'sage_aggr': 'max', 'sage_normalize': False, 'sage_project': False, 'lr': 0.001568097182378424, 'weight_decay': 1.4239473685637927e-05, 'epochs': 59, 'loss': 'mse', 'optimizer': 'adam', 'graph_mode': 'cutoff', 'cutoff': 0.8992000065317037, 'grm_norm': 'none', 'self_loops': True, 'use_snp_selection': True, 'num_snps': 49769}. Best is trial 31 with value: 0.29171311552261125.
[I 2025-12-09 13:08:42,163] Trial 35 finished with value: 0.2724564408250557 and parameters: {'model_type': 'graphsage', 'hidden_dims': '[512, 128]', 'dropout': 0.5567247958032752, 'batch_norm': True, 'sage_aggr': 'max', 'sage_normalize': False, 'sage_project': False, 'lr': 0.003484353731959266, 'weight_decay': 1.0857389729532683e-05, 'epochs': 147, 'loss': 'mae', 'optimizer': 'adam', 'graph_mode': 'knn', 'knn_k': 4, 'weighted_edges': False, 'symmetrize_mode': 'union', 'self_loops': True, 'use_snp_selection': True, 'num_snps': 40316}. Best is trial 31 with value: 0.29171311552261125.
[I 2025-12-09 13:10:04,418] Trial 36 finished with value: 0.28279859257145273 and parameters: {'model_type': 'graphsage', 'hidden_dims': '[512, 256]', 'dropout': 0.46593370664834277, 'batch_norm': True, 'sage_aggr': 'mean', 'sage_normalize': False, 'sage_project': False, 'lr': 0.009395349592756697, 'weight_decay': 3.8786199274965945e-05, 'epochs': 94, 'loss': 'mae', 'optimizer': 'adam', 'graph_mode': 'cutoff', 'cutoff': 0.8483931113564521, 'grm_norm': 'none', 'self_loops': False, 'use_snp_selection': True, 'num_snps': 56294}. Best is trial 31 with value: 0.29171311552261125.
[I 2025-12-09 13:11:14,216] Trial 37 finished with value: 0.2853995611962065 and parameters: {'model_type': 'graphsage', 'hidden_dims': '[256, 128, 64]', 'dropout': 0.5075076860253162, 'batch_norm': True, 'sage_aggr': 'mean', 'sage_normalize': False, 'sage_project': False, 'lr': 0.00653688314074992, 'weight_decay': 1.581431171109205e-06, 'epochs': 257, 'loss': 'mse', 'optimizer': 'adam', 'graph_mode': 'cutoff', 'cutoff': 0.785542981915669, 'grm_norm': 'none', 'self_loops': True, 'use_snp_selection': False}. Best is trial 31 with value: 0.29171311552261125.
[I 2025-12-09 13:15:44,132] Trial 38 finished with value: 0.19525609016794382 and parameters: {'model_type': 'graphsage', 'hidden_dims': '[512, 64]', 'dropout': 0.3561197205496971, 'batch_norm': False, 'sage_aggr': 'max', 'sage_normalize': True, 'sage_project': False, 'lr': 0.0006820803598987672, 'weight_decay': 7.067461646624828e-06, 'epochs': 171, 'loss': 'mae', 'optimizer': 'adam', 'graph_mode': 'knn', 'knn_k': 10, 'weighted_edges': True, 'symmetrize_mode': 'union', 'self_loops': False, 'use_snp_selection': True, 'num_snps': 49421}. Best is trial 31 with value: 0.29171311552261125.
[I 2025-12-09 13:17:11,943] Trial 39 finished with value: 0.2710017491227462 and parameters: {'model_type': 'graphsage', 'hidden_dims': '[128, 64]', 'dropout': 0.22796971961184365, 'batch_norm': True, 'sage_aggr': 'mean', 'sage_normalize': False, 'sage_project': False, 'lr': 2.847774091998119e-05, 'weight_decay': 0.00016133555126369005, 'epochs': 202, 'loss': 'mae', 'optimizer': 'adam', 'graph_mode': 'cutoff', 'cutoff': 0.46717469842905707, 'grm_norm': 'gcn', 'self_loops': True, 'use_snp_selection': True, 'num_snps': 43968}. Best is trial 31 with value: 0.29171311552261125.
[I 2025-12-09 13:17:43,564] Trial 40 finished with value: 0.2708359260985033 and parameters: {'model_type': 'graphsage', 'hidden_dims': '[256, 128, 64]', 'dropout': 0.3549738844219236, 'batch_norm': True, 'sage_aggr': 'mean', 'sage_normalize': False, 'sage_project': False, 'lr': 0.0028306340216192718, 'weight_decay': 6.445975627412986e-05, 'epochs': 57, 'loss': 'mae', 'optimizer': 'adam', 'graph_mode': 'knn', 'knn_k': 3, 'weighted_edges': False, 'symmetrize_mode': 'union', 'self_loops': True, 'use_snp_selection': False}. Best is trial 31 with value: 0.29171311552261125.
[I 2025-12-09 13:18:37,426] Trial 41 finished with value: 0.28379304607261896 and parameters: {'model_type': 'graphsage', 'hidden_dims': '[256, 128, 64]', 'dropout': 0.5402936596233147, 'batch_norm': True, 'sage_aggr': 'mean', 'sage_normalize': False, 'sage_project': False, 'lr': 0.006195854990066851, 'weight_decay': 4.311806435193001e-05, 'epochs': 40, 'loss': 'mae', 'optimizer': 'adam', 'graph_mode': 'cutoff', 'cutoff': 0.8415606497391261, 'grm_norm': 'none', 'self_loops': True, 'use_snp_selection': True, 'num_snps': 59006}. Best is trial 31 with value: 0.29171311552261125.
[I 2025-12-09 13:19:31,579] Trial 42 finished with value: 0.2969538400699926 and parameters: {'model_type': 'graphsage', 'hidden_dims': '[256, 128, 64]', 'dropout': 0.5276905874708159, 'batch_norm': True, 'sage_aggr': 'mean', 'sage_normalize': False, 'sage_project': False, 'lr': 0.004464170120019339, 'weight_decay': 3.741209225809258e-05, 'epochs': 57, 'loss': 'mae', 'optimizer': 'adam', 'graph_mode': 'cutoff', 'cutoff': 0.8584574862831452, 'grm_norm': 'none', 'self_loops': True, 'use_snp_selection': True, 'num_snps': 52101}. Best is trial 42 with value: 0.2969538400699926.
