[I 2025-12-06 06:48:41,403] Trial 25 finished with value: 0.2172289101407733 and parameters: {'model_type': 'graphsage', 'hidden_dims': '[512, 256]', 'dropout': 0.5054529203593504, 'batch_norm': True, 'sage_aggr': 'mean', 'sage_normalize': True, 'sage_project': False, 'lr': 5.986951459840628e-05, 'weight_decay': 5.680429955596334e-07, 'epochs': 205, 'loss': 'mae', 'optimizer': 'adam', 'graph_mode': 'cutoff', 'cutoff': 0.7732248081418903, 'grm_norm': 'none', 'self_loops': False, 'use_snp_selection': True, 'num_snps': 39494, 'graphsage_batch_size': 256}. Best is trial 20 with value: 0.22070891377468463.
[I 2025-12-06 06:50:47,050] Trial 26 finished with value: 0.2093551528333255 and parameters: {'model_type': 'graphsage', 'hidden_dims': '[512, 256]', 'dropout': 0.5997143520224814, 'batch_norm': True, 'sage_aggr': 'max', 'sage_normalize': True, 'sage_project': False, 'lr': 0.0005718330006003868, 'weight_decay': 2.578140797795216e-07, 'epochs': 232, 'loss': 'mse', 'optimizer': 'adam', 'graph_mode': 'cutoff', 'cutoff': 0.5826862432393988, 'grm_norm': 'none', 'self_loops': False, 'use_snp_selection': True, 'num_snps': 48815, 'graphsage_batch_size': 256}. Best is trial 20 with value: 0.22070891377468463.
[I 2025-12-06 06:52:10,177] Trial 27 finished with value: 0.21740758745933647 and parameters: {'model_type': 'graphsage', 'hidden_dims': '[512, 256]', 'dropout': 0.43468132292775424, 'batch_norm': True, 'sage_aggr': 'mean', 'sage_normalize': True, 'sage_project': False, 'lr': 0.00033263078688963406, 'weight_decay': 2.2726015114493602e-07, 'epochs': 181, 'loss': 'mae', 'optimizer': 'adam', 'graph_mode': 'cutoff', 'cutoff': 0.8939600769316367, 'grm_norm': 'gcn', 'self_loops': False, 'use_snp_selection': True, 'num_snps': 40136, 'graphsage_batch_size': 16}. Best is trial 20 with value: 0.22070891377468463.
[I 2025-12-06 06:53:44,280] Trial 28 finished with value: 0.20387907319435783 and parameters: {'model_type': 'graphsage', 'hidden_dims': '[512, 256]', 'dropout': 0.5618236931925369, 'batch_norm': True, 'sage_aggr': 'mean', 'sage_normalize': True, 'sage_project': False, 'lr': 1.7513652352820383e-05, 'weight_decay': 8.28456637052756e-07, 'epochs': 197, 'loss': 'mae', 'optimizer': 'adam', 'graph_mode': 'cutoff', 'cutoff': 0.44992968813664325, 'grm_norm': 'cosine', 'self_loops': False, 'use_snp_selection': True, 'num_snps': 33700, 'graphsage_batch_size': 512}. Best is trial 20 with value: 0.22070891377468463.
[I 2025-12-06 06:54:39,583] Trial 29 finished with value: 0.19812340375594248 and parameters: {'model_type': 'graphsage', 'hidden_dims': '[128, 64]', 'dropout': 0.5076393466796999, 'batch_norm': True, 'sage_aggr': 'max', 'sage_normalize': True, 'sage_project': False, 'lr': 5.7850023045579534e-05, 'weight_decay': 2.778859268186977e-06, 'epochs': 181, 'loss': 'mse', 'optimizer': 'adam', 'graph_mode': 'cutoff', 'cutoff': 0.732060681654957, 'grm_norm': 'none', 'self_loops': False, 'use_snp_selection': True, 'num_snps': 55730, 'graphsage_batch_size': 256}. Best is trial 20 with value: 0.22070891377468463.
[I 2025-12-06 06:55:58,542] Trial 30 finished with value: 0.22094249026483262 and parameters: {'model_type': 'graphsage', 'hidden_dims': '[512, 256]', 'dropout': 0.5016359360736721, 'batch_norm': True, 'sage_aggr': 'mean', 'sage_normalize': True, 'sage_project': False, 'lr': 0.0006939614545090063, 'weight_decay': 9.413911037017427e-07, 'epochs': 151, 'loss': 'mae', 'optimizer': 'adam', 'graph_mode': 'cutoff', 'cutoff': 0.8240850233711129, 'grm_norm': 'none', 'self_loops': False, 'use_snp_selection': True, 'num_snps': 43652, 'graphsage_batch_size': 32}. Best is trial 30 with value: 0.22094249026483262.
[I 2025-12-06 06:57:16,750] Trial 31 finished with value: 0.2172810635945602 and parameters: {'model_type': 'graphsage', 'hidden_dims': '[512, 256]', 'dropout': 0.5116341328426653, 'batch_norm': True, 'sage_aggr': 'mean', 'sage_normalize': True, 'sage_project': False, 'lr': 0.0006447537694568918, 'weight_decay': 1.0297267621777824e-06, 'epochs': 146, 'loss': 'mae', 'optimizer': 'adam', 'graph_mode': 'cutoff', 'cutoff': 0.8353700020105642, 'grm_norm': 'none', 'self_loops': False, 'use_snp_selection': True, 'num_snps': 44258, 'graphsage_batch_size': 32}. Best is trial 30 with value: 0.22094249026483262.
[I 2025-12-06 06:58:33,123] Trial 32 finished with value: 0.2154571537525319 and parameters: {'model_type': 'graphsage', 'hidden_dims': '[512, 256]', 'dropout': 0.4247192658360541, 'batch_norm': True, 'sage_aggr': 'mean', 'sage_normalize': True, 'sage_project': False, 'lr': 0.00037072398894743495, 'weight_decay': 3.530306374194859e-07, 'epochs': 174, 'loss': 'mae', 'optimizer': 'adam', 'graph_mode': 'cutoff', 'cutoff': 0.7394032402446976, 'grm_norm': 'none', 'self_loops': False, 'use_snp_selection': True, 'num_snps': 37393, 'graphsage_batch_size': 32}. Best is trial 30 with value: 0.22094249026483262.
[I 2025-12-06 06:59:53,228] Trial 33 finished with value: 0.2155987571355748 and parameters: {'model_type': 'graphsage', 'hidden_dims': '[512, 256]', 'dropout': 0.5589079239939182, 'batch_norm': True, 'sage_aggr': 'mean', 'sage_normalize': True, 'sage_project': False, 'lr': 0.0009471126584419797, 'weight_decay': 2.3754373996865833e-06, 'epochs': 152, 'loss': 'mae', 'optimizer': 'adam', 'graph_mode': 'cutoff', 'cutoff': 0.7858363311700691, 'grm_norm': 'none', 'self_loops': False, 'use_snp_selection': True, 'num_snps': 44166, 'graphsage_batch_size': 32}. Best is trial 30 with value: 0.22094249026483262.
[I 2025-12-06 07:00:47,615] Trial 34 finished with value: 0.2167510052406738 and parameters: {'model_type': 'graphsage', 'hidden_dims': '[128, 64]', 'dropout': 0.4955904776720402, 'batch_norm': True, 'sage_aggr': 'mean', 'sage_normalize': True, 'sage_project': False, 'lr': 0.0005880639921619275, 'weight_decay': 7.254368869561005e-07, 'epochs': 203, 'loss': 'mse', 'optimizer': 'adam', 'graph_mode': 'cutoff', 'cutoff': 0.6981561786406946, 'grm_norm': 'none', 'self_loops': False, 'use_snp_selection': True, 'num_snps': 50926, 'graphsage_batch_size': 256}. Best is trial 30 with value: 0.22094249026483262.
[I 2025-12-06 07:02:56,106] Trial 35 finished with value: 0.21408282978603738 and parameters: {'model_type': 'graphsage', 'hidden_dims': '[512, 64]', 'dropout': 0.4034019145518663, 'batch_norm': True, 'sage_aggr': 'mean', 'sage_normalize': True, 'sage_project': False, 'lr': 0.0002025729107302685, 'weight_decay': 1.8870326852721087e-07, 'epochs': 220, 'loss': 'mae', 'optimizer': 'adam', 'graph_mode': 'cutoff', 'cutoff': 0.5902285166534301, 'grm_norm': 'none', 'self_loops': False, 'use_snp_selection': False, 'graphsage_batch_size': 256}. Best is trial 30 with value: 0.22094249026483262.
[I 2025-12-06 07:04:02,466] Trial 36 finished with value: 0.18117508362255 and parameters: {'model_type': 'graphsage', 'hidden_dims': '[512, 256]', 'dropout': 0.5708944090393434, 'batch_norm': True, 'sage_aggr': 'max', 'sage_normalize': False, 'sage_project': False, 'lr': 0.00033083706126974845, 'weight_decay': 5.275781045603213e-07, 'epochs': 171, 'loss': 'mse', 'optimizer': 'adam', 'graph_mode': 'knn', 'knn_k': 1, 'weighted_edges': False, 'symmetrize_mode': 'union', 'self_loops': False, 'use_snp_selection': True, 'num_snps': 29991, 'graphsage_batch_size': 8}. Best is trial 30 with value: 0.22094249026483262.
[I 2025-12-06 07:04:38,240] Trial 37 finished with value: 0.21952880863482177 and parameters: {'model_type': 'graphsage', 'hidden_dims': '[256, 128]', 'dropout': 0.37159174375881776, 'batch_norm': True, 'sage_aggr': 'mean', 'sage_normalize': True, 'sage_project': False, 'lr': 0.000616364883983907, 'weight_decay': 1.624820798026632e-06, 'epochs': 84, 'loss': 'mae', 'optimizer': 'adam', 'graph_mode': 'cutoff', 'cutoff': 0.6147710237053154, 'grm_norm': 'gcn', 'self_loops': False, 'use_snp_selection': True, 'num_snps': 37196, 'graphsage_batch_size': 512}. Best is trial 30 with value: 0.22094249026483262.
[I 2025-12-06 07:05:50,818] Trial 38 finished with value: 0.2060675469383836 and parameters: {'model_type': 'graphsage', 'hidden_dims': '[256, 128]', 'dropout': 0.35940792422136963, 'batch_norm': True, 'sage_aggr': 'max', 'sage_normalize': True, 'sage_project': False, 'lr': 0.00043044156368299454, 'weight_decay': 1.1755419330788422e-05, 'epochs': 87, 'loss': 'mae', 'optimizer': 'adam', 'graph_mode': 'knn', 'knn_k': 10, 'weighted_edges': False, 'symmetrize_mode': 'union', 'self_loops': False, 'use_snp_selection': True, 'num_snps': 29719, 'graphsage_batch_size': 512}. Best is trial 30 with value: 0.22094249026483262.
[I 2025-12-06 07:06:15,227] Trial 39 finished with value: 0.19302036782623128 and parameters: {'model_type': 'graphsage', 'hidden_dims': '[256, 128]', 'dropout': 0.2317057587929682, 'batch_norm': True, 'sage_aggr': 'mean', 'sage_normalize': True, 'sage_project': False, 'lr': 2.843002953120068e-05, 'weight_decay': 1.8661848971706411e-06, 'epochs': 56, 'loss': 'mse', 'optimizer': 'adam', 'graph_mode': 'cutoff', 'cutoff': 0.6037409672418781, 'grm_norm': 'gcn', 'self_loops': False, 'use_snp_selection': False, 'graphsage_batch_size': 512}. Best is trial 30 with value: 0.22094249026483262.
[I 2025-12-06 07:06:46,455] Trial 40 finished with value: 0.1908618298716602 and parameters: {'model_type': 'graphsage', 'hidden_dims': '[256, 128]', 'dropout': 0.3981324493842444, 'batch_norm': True, 'sage_aggr': 'mean', 'sage_normalize': False, 'sage_project': False, 'lr': 0.0006367557366523422, 'weight_decay': 1.7575495475992277e-05, 'epochs': 68, 'loss': 'mae', 'optimizer': 'adam', 'graph_mode': 'knn', 'knn_k': 1, 'weighted_edges': True, 'symmetrize_mode': 'mutual', 'self_loops': False, 'use_snp_selection': True, 'num_snps': 35036, 'graphsage_batch_size': 512}. Best is trial 30 with value: 0.22094249026483262.
[I 2025-12-06 07:07:37,132] Trial 41 finished with value: 0.15370829538485015 and parameters: {'model_type': 'graphsage', 'hidden_dims': '[256, 128]', 'dropout': 0.4879365063854201, 'batch_norm': True, 'sage_aggr': 'mean', 'sage_normalize': True, 'sage_project': False, 'lr': 1.038305655631295e-06, 'weight_decay': 1.3680595019351776e-06, 'epochs': 138, 'loss': 'mae', 'optimizer': 'adam', 'graph_mode': 'cutoff', 'cutoff': 0.6225013285310401, 'grm_norm': 'gcn', 'self_loops': False, 'use_snp_selection': True, 'num_snps': 42480, 'graphsage_batch_size': 32}. Best is trial 30 with value: 0.22094249026483262.
[I 2025-12-06 07:09:11,159] Trial 42 finished with value: 0.22040437366543317 and parameters: {'model_type': 'graphsage', 'hidden_dims': '[512, 64]', 'dropout': 0.4483790548219128, 'batch_norm': True, 'sage_aggr': 'mean', 'sage_normalize': True, 'sage_project': False, 'lr': 0.0005532657327979313, 'weight_decay': 0.0009868045209927576, 'epochs': 235, 'loss': 'mae', 'optimizer': 'adam', 'graph_mode': 'cutoff', 'cutoff': 0.7460862901348735, 'grm_norm': 'gcn', 'self_loops': False, 'use_snp_selection': True, 'num_snps': 36971, 'graphsage_batch_size': 256}. Best is trial 30 with value: 0.22094249026483262.
[I 2025-12-06 07:11:06,851] Trial 43 finished with value: 0.21668681761250053 and parameters: {'model_type': 'graphsage', 'hidden_dims': '[512, 64]', 'dropout': 0.44452480767717767, 'batch_norm': True, 'sage_aggr': 'mean', 'sage_normalize': True, 'sage_project': False, 'lr': 0.0002693911137657303, 'weight_decay': 6.371200620769931e-05, 'epochs': 233, 'loss': 'mae', 'optimizer': 'adam', 'graph_mode': 'cutoff', 'cutoff': 0.8456581710993765, 'grm_norm': 'gcn', 'self_loops': False, 'use_snp_selection': True, 'num_snps': 46851, 'graphsage_batch_size': 512}. Best is trial 30 with value: 0.22094249026483262.
[I 2025-12-06 07:12:41,682] Trial 44 finished with value: 0.20101529379579217 and parameters: {'model_type': 'graphsage', 'hidden_dims': '[512, 64]', 'dropout': 0.36344974266880986, 'batch_norm': False, 'sage_aggr': 'mean', 'sage_normalize': True, 'sage_project': False, 'lr': 0.0005550449669250547, 'weight_decay': 0.0006868379673540415, 'epochs': 240, 'loss': 'mae', 'optimizer': 'adam', 'graph_mode': 'cutoff', 'cutoff': 0.7555807122738469, 'grm_norm': 'gcn', 'self_loops': False, 'use_snp_selection': True, 'num_snps': 36646, 'graphsage_batch_size': 16}. Best is trial 30 with value: 0.22094249026483262.
[I 2025-12-06 07:13:34,384] Trial 45 finished with value: 0.21998827469603371 and parameters: {'model_type': 'graphsage', 'hidden_dims': '[512, 64]', 'dropout': 0.31957035287509844, 'batch_norm': True, 'sage_aggr': 'mean', 'sage_normalize': True, 'sage_project': False, 'lr': 0.00015265139414333333, 'weight_decay': 0.00020476002593669868, 'epochs': 84, 'loss': 'mae', 'optimizer': 'adam', 'graph_mode': 'cutoff', 'cutoff': 0.3716010012435589, 'grm_norm': 'gcn', 'self_loops': False, 'use_snp_selection': True, 'num_snps': 32162, 'graphsage_batch_size': 8}. Best is trial 30 with value: 0.22094249026483262.
[I 2025-12-06 07:15:31,018] Trial 46 finished with value: 0.22449864053632065 and parameters: {'model_type': 'graphsage', 'hidden_dims': '[512, 64]', 'dropout': 0.3151590989362305, 'batch_norm': True, 'sage_aggr': 'max', 'sage_normalize': False, 'sage_project': False, 'lr': 0.0001413524527899212, 'weight_decay': 0.00031252910611034726, 'epochs': 209, 'loss': 'mae', 'optimizer': 'adam', 'graph_mode': 'cutoff', 'cutoff': 0.3495022938297342, 'grm_norm': 'gcn', 'self_loops': False, 'use_snp_selection': True, 'num_snps': 32813, 'graphsage_batch_size': 8}. Best is trial 46 with value: 0.22449864053632065.
[I 2025-12-06 07:18:07,085] Trial 47 finished with value: 0.15432947365588462 and parameters: {'model_type': 'graphsage', 'hidden_dims': '[512, 64]', 'dropout': 0.30880124871539255, 'batch_norm': False, 'sage_aggr': 'max', 'sage_normalize': False, 'sage_project': False, 'lr': 6.774998086104208e-05, 'weight_decay': 0.00026585558860154934, 'epochs': 223, 'loss': 'mae', 'optimizer': 'adam', 'graph_mode': 'knn', 'knn_k': 3, 'weighted_edges': False, 'symmetrize_mode': 'union', 'self_loops': False, 'use_snp_selection': False, 'graphsage_batch_size': 8}. Best is trial 46 with value: 0.22449864053632065.
[I 2025-12-06 07:19:40,222] Trial 48 finished with value: 0.2196917740931886 and parameters: {'model_type': 'graphsage', 'hidden_dims': '[512, 64]', 'dropout': 0.31547791556395327, 'batch_norm': True, 'sage_aggr': 'max', 'sage_normalize': False, 'sage_project': False, 'lr': 0.0001537338289817579, 'weight_decay': 0.000900586914541359, 'epochs': 210, 'loss': 'mae', 'optimizer': 'adam', 'graph_mode': 'cutoff', 'cutoff': 0.33407644499768124, 'grm_norm': 'gcn', 'self_loops': False, 'use_snp_selection': True, 'num_snps': 26282, 'graphsage_batch_size': 8}. Best is trial 46 with value: 0.22449864053632065.
[I 2025-12-06 07:20:51,780] Trial 49 finished with value: 0.2336269145666891 and parameters: {'model_type': 'graphsage', 'hidden_dims': '[512, 64]', 'dropout': 0.24063633789879998, 'batch_norm': True, 'sage_aggr': 'max', 'sage_normalize': False, 'sage_project': False, 'lr': 8.22291830244241e-05, 'weight_decay': 0.00019175170570906994, 'epochs': 121, 'loss': 'mae', 'optimizer': 'adam', 'graph_mode': 'cutoff', 'cutoff': 0.37479517819444386, 'grm_norm': 'gcn', 'self_loops': False, 'use_snp_selection': True, 'num_snps': 32263, 'graphsage_batch_size': 8}. Best is trial 49 with value: 0.2336269145666891.
[I 2025-12-06 07:22:29,675] Trial 50 finished with value: 0.14217311963585916 and parameters: {'model_type': 'graphsage', 'hidden_dims': '[512, 64]', 'dropout': 0.20463784003342037, 'batch_norm': False, 'sage_aggr': 'max', 'sage_normalize': False, 'sage_project': False, 'lr': 4.406714898563504e-05, 'weight_decay': 9.977384045122964e-05, 'epochs': 122, 'loss': 'mse', 'optimizer': 'adam', 'graph_mode': 'cutoff', 'cutoff': 0.3488372284111093, 'grm_norm': 'gcn', 'self_loops': False, 'use_snp_selection': False, 'graphsage_batch_size': 8}. Best is trial 49 with value: 0.2336269145666891.
[I 2025-12-06 07:23:15,017] Trial 51 finished with value: 0.23195525081713858 and parameters: {'model_type': 'graphsage', 'hidden_dims': '[512, 64]', 'dropout': 0.29879498125356724, 'batch_norm': True, 'sage_aggr': 'max', 'sage_normalize': False, 'sage_project': False, 'lr': 9.472494006886991e-05, 'weight_decay': 0.0002914570551053062, 'epochs': 70, 'loss': 'mae', 'optimizer': 'adam', 'graph_mode': 'cutoff', 'cutoff': 0.38461461255086316, 'grm_norm': 'gcn', 'self_loops': False, 'use_snp_selection': True, 'num_snps': 29027, 'graphsage_batch_size': 8}. Best is trial 49 with value: 0.2336269145666891.
[I 2025-12-06 07:24:11,789] Trial 52 finished with value: 0.22363544823312947 and parameters: {'model_type': 'graphsage', 'hidden_dims': '[512, 64]', 'dropout': 0.2827917301578427, 'batch_norm': True, 'sage_aggr': 'max', 'sage_normalize': False, 'sage_project': False, 'lr': 8.449040239839747e-05, 'weight_decay': 0.00037422001029217415, 'epochs': 101, 'loss': 'mae', 'optimizer': 'adam', 'graph_mode': 'cutoff', 'cutoff': 0.39790563437709203, 'grm_norm': 'gcn', 'self_loops': False, 'use_snp_selection': True, 'num_snps': 29409, 'graphsage_batch_size': 8}. Best is trial 49 with value: 0.2336269145666891.
[I 2025-12-06 07:25:05,314] Trial 53 finished with value: 0.22557407637717644 and parameters: {'model_type': 'graphsage', 'hidden_dims': '[512, 64]', 'dropout': 0.28398050730413904, 'batch_norm': True, 'sage_aggr': 'max', 'sage_normalize': False, 'sage_project': False, 'lr': 9.368619684396342e-05, 'weight_decay': 0.00040115606830471524, 'epochs': 104, 'loss': 'mae', 'optimizer': 'adam', 'graph_mode': 'cutoff', 'cutoff': 0.4070317245353342, 'grm_norm': 'gcn', 'self_loops': False, 'use_snp_selection': True, 'num_snps': 27326, 'graphsage_batch_size': 8}. Best is trial 49 with value: 0.2336269145666891.
[I 2025-12-06 07:26:01,808] Trial 54 finished with value: 0.22739328271959822 and parameters: {'model_type': 'graphsage', 'hidden_dims': '[512, 64]', 'dropout': 0.2885585490770422, 'batch_norm': True, 'sage_aggr': 'max', 'sage_normalize': False, 'sage_project': False, 'lr': 9.097988818274055e-05, 'weight_decay': 0.00034245221786813004, 'epochs': 103, 'loss': 'mae', 'optimizer': 'adam', 'graph_mode': 'cutoff', 'cutoff': 0.40926483651615925, 'grm_norm': 'gcn', 'self_loops': False, 'use_snp_selection': True, 'num_snps': 29215, 'graphsage_batch_size': 8}. Best is trial 49 with value: 0.2336269145666891.
[I 2025-12-06 07:26:57,632] Trial 55 finished with value: 0.2351501566550843 and parameters: {'model_type': 'graphsage', 'hidden_dims': '[512, 64]', 'dropout': 0.2903798488192241, 'batch_norm': True, 'sage_aggr': 'max', 'sage_normalize': False, 'sage_project': False, 'lr': 8.542288689856785e-05, 'weight_decay': 0.0004085969834286076, 'epochs': 105, 'loss': 'mae', 'optimizer': 'adam', 'graph_mode': 'cutoff', 'cutoff': 0.41394604069156027, 'grm_norm': 'gcn', 'self_loops': False, 'use_snp_selection': True, 'num_snps': 28201, 'graphsage_batch_size': 8}. Best is trial 55 with value: 0.2351501566550843.
[I 2025-12-06 07:27:52,641] Trial 56 finished with value: 0.19248167182475845 and parameters: {'model_type': 'graphsage', 'hidden_dims': '[512, 64]', 'dropout': 0.23881252195353342, 'batch_norm': True, 'sage_aggr': 'max', 'sage_normalize': False, 'sage_project': False, 'lr': 3.148177532252165e-05, 'weight_decay': 0.000479577453460934, 'epochs': 109, 'loss': 'mae', 'optimizer': 'adam', 'graph_mode': 'cutoff', 'cutoff': 0.28221431187226076, 'grm_norm': 'gcn', 'self_loops': False, 'use_snp_selection': True, 'num_snps': 21737, 'graphsage_batch_size': 8}. Best is trial 55 with value: 0.2351501566550843.
[I 2025-12-06 07:28:36,200] Trial 57 finished with value: 0.2272661269575055 and parameters: {'model_type': 'graphsage', 'hidden_dims': '[512, 64]', 'dropout': 0.29411554721035205, 'batch_norm': True, 'sage_aggr': 'max', 'sage_normalize': False, 'sage_project': False, 'lr': 0.00011825988608251833, 'weight_decay': 0.000121503723432822, 'epochs': 72, 'loss': 'mae', 'optimizer': 'adam', 'graph_mode': 'cutoff', 'cutoff': 0.4351807909725722, 'grm_norm': 'gcn', 'self_loops': False, 'use_snp_selection': True, 'num_snps': 27794, 'graphsage_batch_size': 8}. Best is trial 55 with value: 0.2351501566550843.
[I 2025-12-06 07:29:22,273] Trial 58 finished with value: 0.19711131111317134 and parameters: {'model_type': 'graphsage', 'hidden_dims': '[512, 64]', 'dropout': 0.29165754694122825, 'batch_norm': True, 'sage_aggr': 'max', 'sage_normalize': False, 'sage_project': False, 'lr': 9.39294434894445e-05, 'weight_decay': 0.00013074934558616205, 'epochs': 66, 'loss': 'mae', 'optimizer': 'adam', 'graph_mode': 'knn', 'knn_k': 10, 'weighted_edges': True, 'symmetrize_mode': 'mutual', 'self_loops': False, 'use_snp_selection': True, 'num_snps': 27143, 'graphsage_batch_size': 8}. Best is trial 55 with value: 0.2351501566550843.
[I 2025-12-06 07:30:04,867] Trial 59 finished with value: 0.1803689058630893 and parameters: {'model_type': 'graphsage', 'hidden_dims': '[512, 128]', 'dropout': 0.24971085881830807, 'batch_norm': False, 'sage_aggr': 'max', 'sage_normalize': False, 'sage_project': False, 'lr': 7.616281426380518e-05, 'weight_decay': 6.824167078843981e-05, 'epochs': 94, 'loss': 'mae', 'optimizer': 'adam', 'graph_mode': 'cutoff', 'cutoff': 0.4593567974721454, 'grm_norm': 'gcn', 'self_loops': False, 'use_snp_selection': True, 'num_snps': 22950, 'graphsage_batch_size': 8}. Best is trial 55 with value: 0.2351501566550843.
[I 2025-12-06 07:30:33,040] Trial 60 finished with value: 0.18364523921086245 and parameters: {'model_type': 'graphsage', 'hidden_dims': '[512, 64]', 'dropout': 0.3402485678171918, 'batch_norm': True, 'sage_aggr': 'max', 'sage_normalize': False, 'sage_project': False, 'lr': 4.3057465682503055e-05, 'weight_decay': 0.0005065094917359502, 'epochs': 75, 'loss': 'mae', 'optimizer': 'adam', 'graph_mode': 'cutoff', 'cutoff': 0.5231099043487047, 'grm_norm': 'cosine', 'self_loops': False, 'use_snp_selection': True, 'num_snps': 16105, 'graphsage_batch_size': 8}. Best is trial 55 with value: 0.2351501566550843.
