[I 2025-12-09 23:50:51,372] Trial 69 finished with value: 0.2803034822766387 and parameters: {'model_type': 'graphsage', 'hidden_dims': '[256, 128]', 'dropout': 0.3803262696114429, 'batch_norm': False, 'sage_aggr': 'mean', 'sage_normalize': False, 'sage_project': False, 'lr': 1.996676722484669e-05, 'weight_decay': 1.8385166346296435e-07, 'epochs': 299, 'loss': 'mse', 'optimizer': 'adam', 'graph_mode': 'cutoff', 'cutoff': 0.3437003681444144, 'grm_norm': 'none', 'self_loops': False, 'use_snp_selection': True, 'num_snps': 8330}. Best is trial 44 with value: 0.2987332707245484.
[I 2025-12-09 23:51:55,613] Trial 70 finished with value: 0.28532191427469156 and parameters: {'model_type': 'graphsage', 'hidden_dims': '[256, 128]', 'dropout': 0.10684521815788817, 'batch_norm': False, 'sage_aggr': 'mean', 'sage_normalize': False, 'sage_project': False, 'lr': 5.0614250712814835e-05, 'weight_decay': 0.00015708561542065615, 'epochs': 199, 'loss': 'mse', 'optimizer': 'adam', 'graph_mode': 'cutoff', 'cutoff': 0.8623179661349761, 'grm_norm': 'cosine', 'self_loops': False, 'use_snp_selection': False}. Best is trial 44 with value: 0.2987332707245484.
[I 2025-12-09 23:52:31,880] Trial 71 finished with value: 0.29254562965112973 and parameters: {'model_type': 'graphsage', 'hidden_dims': '[128, 64]', 'dropout': 0.40792102406615094, 'batch_norm': False, 'sage_aggr': 'mean', 'sage_normalize': False, 'sage_project': False, 'lr': 1.2970236281379788e-05, 'weight_decay': 2.720572908686311e-07, 'epochs': 173, 'loss': 'mse', 'optimizer': 'adam', 'graph_mode': 'cutoff', 'cutoff': 0.6571704037058036, 'grm_norm': 'cosine', 'self_loops': False, 'use_snp_selection': False}. Best is trial 44 with value: 0.2987332707245484.
[I 2025-12-09 23:53:04,149] Trial 72 finished with value: 0.30053048884180517 and parameters: {'model_type': 'graphsage', 'hidden_dims': '[128, 64]', 'dropout': 0.4160705390568174, 'batch_norm': False, 'sage_aggr': 'mean', 'sage_normalize': False, 'sage_project': False, 'lr': 1.5020081562324474e-05, 'weight_decay': 3.217736240876503e-07, 'epochs': 150, 'loss': 'mse', 'optimizer': 'adam', 'graph_mode': 'cutoff', 'cutoff': 0.6171984327892807, 'grm_norm': 'cosine', 'self_loops': False, 'use_snp_selection': False}. Best is trial 72 with value: 0.30053048884180517.
[I 2025-12-09 23:54:35,557] Trial 73 finished with value: 0.29366589835983453 and parameters: {'model_type': 'graphsage', 'hidden_dims': '[512, 64]', 'dropout': 0.4395611203197257, 'batch_norm': False, 'sage_aggr': 'mean', 'sage_normalize': False, 'sage_project': False, 'lr': 1.6005172092240662e-05, 'weight_decay': 1.8807053022036853e-05, 'epochs': 151, 'loss': 'mse', 'optimizer': 'adam', 'graph_mode': 'cutoff', 'cutoff': 0.6067467862559606, 'grm_norm': 'cosine', 'self_loops': False, 'use_snp_selection': False}. Best is trial 72 with value: 0.30053048884180517.
[I 2025-12-09 23:56:33,530] Trial 74 finished with value: 0.2800252893187211 and parameters: {'model_type': 'graphsage', 'hidden_dims': '[512, 128]', 'dropout': 0.5088177154350315, 'batch_norm': False, 'sage_aggr': 'mean', 'sage_normalize': False, 'sage_project': False, 'lr': 2.440503347281897e-05, 'weight_decay': 5.816055453661013e-07, 'epochs': 194, 'loss': 'mse', 'optimizer': 'adam', 'graph_mode': 'cutoff', 'cutoff': 0.5701236693006178, 'grm_norm': 'gcn', 'self_loops': False, 'use_snp_selection': False}. Best is trial 72 with value: 0.30053048884180517.
[I 2025-12-09 23:57:10,325] Trial 75 finished with value: 0.2952237109152472 and parameters: {'model_type': 'graphsage', 'hidden_dims': '[128, 64]', 'dropout': 0.3546367420822898, 'batch_norm': False, 'sage_aggr': 'mean', 'sage_normalize': False, 'sage_project': False, 'lr': 1.0075625703590981e-05, 'weight_decay': 7.316971641441116e-06, 'epochs': 161, 'loss': 'mse', 'optimizer': 'adam', 'graph_mode': 'cutoff', 'cutoff': 0.5422715661965032, 'grm_norm': 'cosine', 'self_loops': False, 'use_snp_selection': False}. Best is trial 72 with value: 0.30053048884180517.
[I 2025-12-09 23:57:44,645] Trial 76 finished with value: 0.29098201630367015 and parameters: {'model_type': 'graphsage', 'hidden_dims': '[128, 64]', 'dropout': 0.3525330821412923, 'batch_norm': False, 'sage_aggr': 'max', 'sage_normalize': False, 'sage_project': False, 'lr': 1.0147262849343243e-05, 'weight_decay': 7.525290503443323e-06, 'epochs': 163, 'loss': 'mse', 'optimizer': 'adam', 'graph_mode': 'cutoff', 'cutoff': 0.6190693047870007, 'grm_norm': 'cosine', 'self_loops': False, 'use_snp_selection': False}. Best is trial 72 with value: 0.30053048884180517.
[I 2025-12-09 23:58:55,404] Trial 77 finished with value: 0.29519052425469045 and parameters: {'model_type': 'graphsage', 'hidden_dims': '[128, 64]', 'dropout': 0.48440227672989833, 'batch_norm': False, 'sage_aggr': 'mean', 'sage_normalize': False, 'sage_project': False, 'lr': 2.0128318328105735e-05, 'weight_decay': 3.51157759967131e-07, 'epochs': 153, 'loss': 'mse', 'optimizer': 'adam', 'graph_mode': 'cutoff', 'cutoff': 0.7817264597720347, 'grm_norm': 'cosine', 'self_loops': False, 'use_snp_selection': True, 'num_snps': 55778}. Best is trial 72 with value: 0.30053048884180517.
[I 2025-12-10 00:02:30,988] Trial 78 finished with value: 0.2620537786579034 and parameters: {'model_type': 'graphsage', 'hidden_dims': '[128, 64]', 'dropout': 0.48842331280823453, 'batch_norm': False, 'sage_aggr': 'mean', 'sage_normalize': True, 'sage_project': False, 'lr': 3.215274822051714e-05, 'weight_decay': 0.00040538678975205085, 'epochs': 116, 'loss': 'mse', 'optimizer': 'adam', 'graph_mode': 'knn', 'knn_k': 8, 'weighted_edges': True, 'symmetrize_mode': 'union', 'self_loops': False, 'use_snp_selection': True, 'num_snps': 59977}. Best is trial 72 with value: 0.30053048884180517.
[I 2025-12-10 00:03:38,008] Trial 79 finished with value: 0.27780935949516977 and parameters: {'model_type': 'graphsage', 'hidden_dims': '[128, 64]', 'dropout': 0.30071816032556287, 'batch_norm': True, 'sage_aggr': 'mean', 'sage_normalize': False, 'sage_project': False, 'lr': 1.920284068747733e-05, 'weight_decay': 3.282535400316697e-07, 'epochs': 150, 'loss': 'mae', 'optimizer': 'adam', 'graph_mode': 'cutoff', 'cutoff': 0.7762047749257023, 'grm_norm': 'cosine_then_gcn', 'self_loops': True, 'use_snp_selection': True, 'num_snps': 54317}. Best is trial 72 with value: 0.30053048884180517.
[I 2025-12-10 00:04:41,687] Trial 80 finished with value: -0.0038462139591210927 and parameters: {'model_type': 'graphsage', 'hidden_dims': '[128, 64]', 'dropout': 0.461757372352392, 'batch_norm': False, 'sage_aggr': 'max', 'sage_normalize': False, 'sage_project': False, 'lr': 0.009577072853366163, 'weight_decay': 2.091208445918206e-07, 'epochs': 137, 'loss': 'mse', 'optimizer': 'adam', 'graph_mode': 'cutoff', 'cutoff': 0.7461106185181228, 'grm_norm': 'cosine', 'self_loops': False, 'use_snp_selection': True, 'num_snps': 54440}. Best is trial 72 with value: 0.30053048884180517.
[I 2025-12-10 00:05:44,739] Trial 81 finished with value: 0.2945150939300534 and parameters: {'model_type': 'graphsage', 'hidden_dims': '[128, 64]', 'dropout': 0.42213866493742586, 'batch_norm': False, 'sage_aggr': 'mean', 'sage_normalize': False, 'sage_project': False, 'lr': 1.1713962122231035e-05, 'weight_decay': 5.5892167170705894e-05, 'epochs': 176, 'loss': 'mse', 'optimizer': 'adam', 'graph_mode': 'cutoff', 'cutoff': 0.7810418639727202, 'grm_norm': 'cosine', 'self_loops': False, 'use_snp_selection': True, 'num_snps': 45702}. Best is trial 72 with value: 0.30053048884180517.
[I 2025-12-10 00:06:54,607] Trial 82 finished with value: 0.2902517225935588 and parameters: {'model_type': 'graphsage', 'hidden_dims': '[128, 64]', 'dropout': 0.47148562669455657, 'batch_norm': False, 'sage_aggr': 'mean', 'sage_normalize': False, 'sage_project': False, 'lr': 1.533201271140878e-05, 'weight_decay': 3.7305614666622913e-07, 'epochs': 161, 'loss': 'mse', 'optimizer': 'adam', 'graph_mode': 'cutoff', 'cutoff': 0.8345136287576713, 'grm_norm': 'cosine', 'self_loops': False, 'use_snp_selection': True, 'num_snps': 54017}. Best is trial 72 with value: 0.30053048884180517.
[I 2025-12-10 00:07:26,008] Trial 83 finished with value: 0.2948826375264179 and parameters: {'model_type': 'graphsage', 'hidden_dims': '[128, 64]', 'dropout': 0.5084778519212828, 'batch_norm': False, 'sage_aggr': 'mean', 'sage_normalize': False, 'sage_project': False, 'lr': 2.249217448697717e-05, 'weight_decay': 6.565523196954068e-07, 'epochs': 149, 'loss': 'mse', 'optimizer': 'adam', 'graph_mode': 'cutoff', 'cutoff': 0.724891084694433, 'grm_norm': 'cosine', 'self_loops': False, 'use_snp_selection': False}. Best is trial 72 with value: 0.30053048884180517.
[I 2025-12-10 00:08:15,932] Trial 84 finished with value: 0.3006039356320881 and parameters: {'model_type': 'graphsage', 'hidden_dims': '[128, 64]', 'dropout': 0.36242177826351224, 'batch_norm': False, 'sage_aggr': 'mean', 'sage_normalize': False, 'sage_project': False, 'lr': 1.6748242899965264e-05, 'weight_decay': 5.187156862427791e-06, 'epochs': 119, 'loss': 'mse', 'optimizer': 'adam', 'graph_mode': 'cutoff', 'cutoff': 0.5840074919551546, 'grm_norm': 'cosine', 'self_loops': False, 'use_snp_selection': True, 'num_snps': 41467}. Best is trial 84 with value: 0.3006039356320881.
[I 2025-12-10 00:09:04,831] Trial 85 finished with value: 0.2953108095593746 and parameters: {'model_type': 'graphsage', 'hidden_dims': '[128, 64]', 'dropout': 0.2838442864836344, 'batch_norm': False, 'sage_aggr': 'mean', 'sage_normalize': False, 'sage_project': False, 'lr': 3.97739358287303e-05, 'weight_decay': 1.0089785565492155e-05, 'epochs': 103, 'loss': 'mse', 'optimizer': 'adam', 'graph_mode': 'cutoff', 'cutoff': 0.5811646884808876, 'grm_norm': 'gcn', 'self_loops': False, 'use_snp_selection': True, 'num_snps': 40812}. Best is trial 84 with value: 0.3006039356320881.
[I 2025-12-10 00:09:44,410] Trial 86 finished with value: 0.29706025696167365 and parameters: {'model_type': 'graphsage', 'hidden_dims': '[128, 64]', 'dropout': 0.2435611760836035, 'batch_norm': False, 'sage_aggr': 'mean', 'sage_normalize': False, 'sage_project': False, 'lr': 4.078408349929184e-05, 'weight_decay': 1.4020899548901979e-05, 'epochs': 85, 'loss': 'mse', 'optimizer': 'adam', 'graph_mode': 'cutoff', 'cutoff': 0.5785959736552055, 'grm_norm': 'gcn', 'self_loops': False, 'use_snp_selection': True, 'num_snps': 30902}. Best is trial 84 with value: 0.3006039356320881.
[I 2025-12-10 00:10:22,138] Trial 87 finished with value: 0.29692999420391003 and parameters: {'model_type': 'graphsage', 'hidden_dims': '[128, 64]', 'dropout': 0.21092024207285476, 'batch_norm': False, 'sage_aggr': 'mean', 'sage_normalize': False, 'sage_project': False, 'lr': 3.671267949577315e-05, 'weight_decay': 5.430892143150801e-06, 'epochs': 71, 'loss': 'mse', 'optimizer': 'adam', 'graph_mode': 'cutoff', 'cutoff': 0.5729049975041682, 'grm_norm': 'gcn', 'self_loops': False, 'use_snp_selection': True, 'num_snps': 30531}. Best is trial 84 with value: 0.3006039356320881.
[I 2025-12-10 00:10:56,549] Trial 88 finished with value: 0.29911959127372506 and parameters: {'model_type': 'graphsage', 'hidden_dims': '[128, 64]', 'dropout': 0.19050042509381435, 'batch_norm': False, 'sage_aggr': 'mean', 'sage_normalize': False, 'sage_project': False, 'lr': 5.7629371657082524e-05, 'weight_decay': 9.682023789481759e-05, 'epochs': 61, 'loss': 'mse', 'optimizer': 'adam', 'graph_mode': 'cutoff', 'cutoff': 0.6984243988451894, 'grm_norm': 'gcn', 'self_loops': False, 'use_snp_selection': True, 'num_snps': 28581}. Best is trial 84 with value: 0.3006039356320881.
[I 2025-12-10 00:11:31,674] Trial 89 finished with value: 0.2861989311915401 and parameters: {'model_type': 'graphsage', 'hidden_dims': '[128, 64]', 'dropout': 0.22030387042140034, 'batch_norm': False, 'sage_aggr': 'mean', 'sage_normalize': False, 'sage_project': False, 'lr': 5.1871623105034175e-05, 'weight_decay': 9.740197439665546e-05, 'epochs': 58, 'loss': 'mse', 'optimizer': 'adam', 'graph_mode': 'cutoff', 'cutoff': 0.6984136120808475, 'grm_norm': 'gcn', 'self_loops': False, 'use_snp_selection': True, 'num_snps': 30515}. Best is trial 84 with value: 0.3006039356320881.
[I 2025-12-10 00:12:08,619] Trial 90 finished with value: 0.28538201303481925 and parameters: {'model_type': 'graphsage', 'hidden_dims': '[256, 128, 64]', 'dropout': 0.15690027448433816, 'batch_norm': False, 'sage_aggr': 'max', 'sage_normalize': False, 'sage_project': False, 'lr': 0.00011996180881520101, 'weight_decay': 3.748655529694845e-05, 'epochs': 81, 'loss': 'mse', 'optimizer': 'adam', 'graph_mode': 'cutoff', 'cutoff': 0.6377185361414167, 'grm_norm': 'gcn', 'self_loops': False, 'use_snp_selection': True, 'num_snps': 22790}. Best is trial 84 with value: 0.3006039356320881.
[I 2025-12-10 00:12:41,785] Trial 91 finished with value: 0.29711684009382633 and parameters: {'model_type': 'graphsage', 'hidden_dims': '[128, 64]', 'dropout': 0.19718457369909886, 'batch_norm': False, 'sage_aggr': 'mean', 'sage_normalize': False, 'sage_project': False, 'lr': 2.7359173709277e-05, 'weight_decay': 5.415991517316735e-06, 'epochs': 68, 'loss': 'mse', 'optimizer': 'adam', 'graph_mode': 'cutoff', 'cutoff': 0.6672469181932457, 'grm_norm': 'gcn', 'self_loops': False, 'use_snp_selection': True, 'num_snps': 25295}. Best is trial 84 with value: 0.3006039356320881.
[I 2025-12-10 00:13:14,863] Trial 92 finished with value: 0.2978060633999358 and parameters: {'model_type': 'graphsage', 'hidden_dims': '[128, 64]', 'dropout': 0.18287176205049893, 'batch_norm': False, 'sage_aggr': 'mean', 'sage_normalize': False, 'sage_project': False, 'lr': 2.7520904158903937e-05, 'weight_decay': 4.802709423357462e-06, 'epochs': 66, 'loss': 'mse', 'optimizer': 'adam', 'graph_mode': 'cutoff', 'cutoff': 0.668465788852633, 'grm_norm': 'gcn', 'self_loops': False, 'use_snp_selection': True, 'num_snps': 25521}. Best is trial 84 with value: 0.3006039356320881.
[I 2025-12-10 00:13:48,155] Trial 93 finished with value: 0.2922544045433011 and parameters: {'model_type': 'graphsage', 'hidden_dims': '[128, 64]', 'dropout': 0.19286637508553972, 'batch_norm': False, 'sage_aggr': 'mean', 'sage_normalize': False, 'sage_project': False, 'lr': 5.895138026688083e-05, 'weight_decay': 4.7371923314160604e-06, 'epochs': 63, 'loss': 'mse', 'optimizer': 'adam', 'graph_mode': 'cutoff', 'cutoff': 0.6618335789188386, 'grm_norm': 'gcn', 'self_loops': False, 'use_snp_selection': True, 'num_snps': 26234}. Best is trial 84 with value: 0.3006039356320881.
[I 2025-12-10 00:14:22,553] Trial 94 finished with value: 0.27776606296033385 and parameters: {'model_type': 'graphsage', 'hidden_dims': '[128, 64]', 'dropout': 0.2062359658800358, 'batch_norm': False, 'sage_aggr': 'mean', 'sage_normalize': False, 'sage_project': False, 'lr': 4.30289073892467e-05, 'weight_decay': 3.539775882857853e-06, 'epochs': 40, 'loss': 'mse', 'optimizer': 'adam', 'graph_mode': 'cutoff', 'cutoff': 0.6191692659054042, 'grm_norm': 'gcn', 'self_loops': False, 'use_snp_selection': True, 'num_snps': 31924}. Best is trial 84 with value: 0.3006039356320881.
[I 2025-12-10 00:14:59,370] Trial 95 finished with value: 0.2996920438761478 and parameters: {'model_type': 'graphsage', 'hidden_dims': '[128, 64]', 'dropout': 0.13409519179202573, 'batch_norm': False, 'sage_aggr': 'mean', 'sage_normalize': False, 'sage_project': False, 'lr': 3.032985945740348e-05, 'weight_decay': 5.864467518887483e-06, 'epochs': 73, 'loss': 'mse', 'optimizer': 'adam', 'graph_mode': 'cutoff', 'cutoff': 0.5875783140701025, 'grm_norm': 'gcn', 'self_loops': False, 'use_snp_selection': True, 'num_snps': 29139}. Best is trial 84 with value: 0.3006039356320881.
[I 2025-12-10 00:15:38,280] Trial 96 finished with value: 0.2917978513873539 and parameters: {'model_type': 'graphsage', 'hidden_dims': '[128, 64]', 'dropout': 0.12739069726042157, 'batch_norm': False, 'sage_aggr': 'mean', 'sage_normalize': False, 'sage_project': False, 'lr': 8.21725752626048e-05, 'weight_decay': 1.6551316997392967e-05, 'epochs': 94, 'loss': 'mse', 'optimizer': 'adam', 'graph_mode': 'cutoff', 'cutoff': 0.5860141737605482, 'grm_norm': 'gcn', 'self_loops': False, 'use_snp_selection': True, 'num_snps': 28895}. Best is trial 84 with value: 0.3006039356320881.
[I 2025-12-10 00:16:34,196] Trial 97 finished with value: 0.2746105768701621 and parameters: {'model_type': 'graphsage', 'hidden_dims': '[512, 256]', 'dropout': 0.18390541205850724, 'batch_norm': True, 'sage_aggr': 'mean', 'sage_normalize': True, 'sage_project': False, 'lr': 2.6495991086520587e-05, 'weight_decay': 5.100081749746989e-06, 'epochs': 71, 'loss': 'mse', 'optimizer': 'adam', 'graph_mode': 'knn', 'knn_k': 10, 'weighted_edges': False, 'symmetrize_mode': 'mutual', 'self_loops': True, 'use_snp_selection': True, 'num_snps': 24582}. Best is trial 84 with value: 0.3006039356320881.
[I 2025-12-10 00:17:04,330] Trial 98 finished with value: 0.2871764756013821 and parameters: {'model_type': 'graphsage', 'hidden_dims': '[128, 64]', 'dropout': 0.16693761442647279, 'batch_norm': False, 'sage_aggr': 'mean', 'sage_normalize': False, 'sage_project': False, 'lr': 3.6149791369386094e-05, 'weight_decay': 2.888314315471011e-06, 'epochs': 57, 'loss': 'mae', 'optimizer': 'adam', 'graph_mode': 'cutoff', 'cutoff': 0.6329940157666524, 'grm_norm': 'gcn', 'self_loops': False, 'use_snp_selection': True, 'num_snps': 20814}. Best is trial 84 with value: 0.3006039356320881.
[I 2025-12-10 00:17:44,540] Trial 99 finished with value: 0.29016530880253033 and parameters: {'model_type': 'graphsage', 'hidden_dims': '[128, 64]', 'dropout': 0.2541571535945013, 'batch_norm': False, 'sage_aggr': 'mean', 'sage_normalize': False, 'sage_project': False, 'lr': 2.7651146666934836e-05, 'weight_decay': 6.0415470283194445e-06, 'epochs': 76, 'loss': 'mse', 'optimizer': 'adam', 'graph_mode': 'cutoff', 'cutoff': 0.699248376615476, 'grm_norm': 'gcn', 'self_loops': False, 'use_snp_selection': True, 'num_snps': 35970}. Best is trial 84 with value: 0.3006039356320881.
[I 2025-12-10 00:18:19,481] Trial 100 finished with value: 0.2934472322730251 and parameters: {'model_type': 'graphsage', 'hidden_dims': '[128, 64]', 'dropout': 0.13349624341348934, 'batch_norm': False, 'sage_aggr': 'mean', 'sage_normalize': False, 'sage_project': False, 'lr': 3.247287772935187e-05, 'weight_decay': 1.0170511108348174e-05, 'epochs': 50, 'loss': 'mse', 'optimizer': 'adam', 'graph_mode': 'cutoff', 'cutoff': 0.5958904106689865, 'grm_norm': 'gcn', 'self_loops': False, 'use_snp_selection': True, 'num_snps': 30288}. Best is trial 84 with value: 0.3006039356320881.
[I 2025-12-10 00:18:52,997] Trial 101 finished with value: 0.29990671802864355 and parameters: {'model_type': 'graphsage', 'hidden_dims': '[128, 64]', 'dropout': 0.22317477573131553, 'batch_norm': False, 'sage_aggr': 'mean', 'sage_normalize': False, 'sage_project': False, 'lr': 2.2441080883309657e-05, 'weight_decay': 2.3157522506376486e-05, 'epochs': 69, 'loss': 'mse', 'optimizer': 'adam', 'graph_mode': 'cutoff', 'cutoff': 0.6648455533373145, 'grm_norm': 'gcn', 'self_loops': False, 'use_snp_selection': True, 'num_snps': 25774}. Best is trial 84 with value: 0.3006039356320881.
[I 2025-12-10 00:19:29,801] Trial 102 finished with value: 0.29092928569960186 and parameters: {'model_type': 'graphsage', 'hidden_dims': '[128, 64]', 'dropout': 0.23870964937699082, 'batch_norm': False, 'sage_aggr': 'mean', 'sage_normalize': False, 'sage_project': False, 'lr': 6.054648548371347e-05, 'weight_decay': 2.4438209674837387e-05, 'epochs': 91, 'loss': 'mse', 'optimizer': 'adam', 'graph_mode': 'cutoff', 'cutoff': 0.6739479823238218, 'grm_norm': 'gcn', 'self_loops': False, 'use_snp_selection': True, 'num_snps': 27932}. Best is trial 84 with value: 0.3006039356320881.
[I 2025-12-10 00:20:03,205] Trial 103 finished with value: 0.3005413122877242 and parameters: {'model_type': 'graphsage', 'hidden_dims': '[128, 64]', 'dropout': 0.21414164651063916, 'batch_norm': False, 'sage_aggr': 'mean', 'sage_normalize': False, 'sage_project': False, 'lr': 2.4051176846183294e-05, 'weight_decay': 8.504705207900038e-06, 'epochs': 68, 'loss': 'mse', 'optimizer': 'adam', 'graph_mode': 'cutoff', 'cutoff': 0.6460347522477139, 'grm_norm': 'gcn', 'self_loops': False, 'use_snp_selection': True, 'num_snps': 25611}. Best is trial 84 with value: 0.3006039356320881.
[I 2025-12-10 00:20:32,267] Trial 104 finished with value: 0.2992528430066895 and parameters: {'model_type': 'graphsage', 'hidden_dims': '[128, 64]', 'dropout': 0.18106860760292626, 'batch_norm': False, 'sage_aggr': 'mean', 'sage_normalize': False, 'sage_project': False, 'lr': 3.1012738737179434e-05, 'weight_decay': 1.4352590253765438e-05, 'epochs': 67, 'loss': 'mse', 'optimizer': 'adam', 'graph_mode': 'cutoff', 'cutoff': 0.6402821751296699, 'grm_norm': 'gcn', 'self_loops': False, 'use_snp_selection': True, 'num_snps': 17631}. Best is trial 84 with value: 0.3006039356320881.
[I 2025-12-10 00:20:59,628] Trial 105 finished with value: 0.2940653063946476 and parameters: {'model_type': 'graphsage', 'hidden_dims': '[128, 64]', 'dropout': 0.17196631386904426, 'batch_norm': False, 'sage_aggr': 'mean', 'sage_normalize': False, 'sage_project': False, 'lr': 3.0769420299733164e-05, 'weight_decay': 2.3574378261109926e-05, 'epochs': 48, 'loss': 'mse', 'optimizer': 'adam', 'graph_mode': 'cutoff', 'cutoff': 0.6417159938621162, 'grm_norm': 'gcn', 'self_loops': False, 'use_snp_selection': True, 'num_snps': 16361}. Best is trial 84 with value: 0.3006039356320881.
