[I 2025-12-10 00:17:08,482] Trial 48 finished with value: 0.25766506029413205 and parameters: {'model_type': 'graphsage', 'hidden_dims': '[512, 256]', 'dropout': 0.31422403165828394, 'batch_norm': True, 'sage_aggr': 'max', 'sage_normalize': True, 'sage_project': False, 'lr': 0.007308695619003067, 'weight_decay': 2.612250846434224e-06, 'epochs': 285, 'loss': 'mse', 'optimizer': 'adam', 'graph_mode': 'knn', 'knn_k': 4, 'weighted_edges': False, 'symmetrize_mode': 'union', 'self_loops': False, 'use_snp_selection': False}. Best is trial 42 with value: 0.30872225963632116.
[I 2025-12-10 00:18:28,131] Trial 49 finished with value: 0.2882877705143765 and parameters: {'model_type': 'graphsage', 'hidden_dims': '[256, 128]', 'dropout': 0.46401221251509955, 'batch_norm': False, 'sage_aggr': 'max', 'sage_normalize': True, 'sage_project': False, 'lr': 0.0027785992912582815, 'weight_decay': 6.198047538145017e-06, 'epochs': 262, 'loss': 'mae', 'optimizer': 'adam', 'graph_mode': 'cutoff', 'cutoff': 0.5835952158946708, 'grm_norm': 'none', 'self_loops': False, 'use_snp_selection': True, 'num_snps': 43660}. Best is trial 42 with value: 0.30872225963632116.
[I 2025-12-10 00:21:18,325] Trial 50 finished with value: 0.26889058380270175 and parameters: {'model_type': 'graphsage', 'hidden_dims': '[512, 64]', 'dropout': 0.40534248232774606, 'batch_norm': False, 'sage_aggr': 'max', 'sage_normalize': True, 'sage_project': False, 'lr': 0.004788046122671467, 'weight_decay': 1.3461282038497099e-05, 'epochs': 325, 'loss': 'mse', 'optimizer': 'adam', 'graph_mode': 'cutoff', 'cutoff': 0.8605719959262146, 'grm_norm': 'none', 'self_loops': False, 'use_snp_selection': False}. Best is trial 42 with value: 0.30872225963632116.
[I 2025-12-10 00:22:45,416] Trial 51 finished with value: 0.3055106309867286 and parameters: {'model_type': 'graphsage', 'hidden_dims': '[256, 128]', 'dropout': 0.3681177107018431, 'batch_norm': False, 'sage_aggr': 'max', 'sage_normalize': True, 'sage_project': False, 'lr': 0.0021786387104085004, 'weight_decay': 2.7453659027390808e-05, 'epochs': 307, 'loss': 'mse', 'optimizer': 'adam', 'graph_mode': 'cutoff', 'cutoff': 0.7468078649810272, 'grm_norm': 'cosine_then_gcn', 'self_loops': False, 'use_snp_selection': False}. Best is trial 42 with value: 0.30872225963632116.
[I 2025-12-10 00:24:12,745] Trial 52 finished with value: 0.2867815463825708 and parameters: {'model_type': 'graphsage', 'hidden_dims': '[256, 128]', 'dropout': 0.3565532847582058, 'batch_norm': False, 'sage_aggr': 'max', 'sage_normalize': True, 'sage_project': False, 'lr': 2.7151648386107264e-05, 'weight_decay': 5.0580240621656884e-05, 'epochs': 308, 'loss': 'mse', 'optimizer': 'adam', 'graph_mode': 'cutoff', 'cutoff': 0.8054402643652423, 'grm_norm': 'cosine_then_gcn', 'self_loops': False, 'use_snp_selection': False}. Best is trial 42 with value: 0.30872225963632116.
[I 2025-12-10 00:25:48,602] Trial 53 finished with value: 0.30474308096662817 and parameters: {'model_type': 'graphsage', 'hidden_dims': '[256, 128]', 'dropout': 0.3342383952916344, 'batch_norm': False, 'sage_aggr': 'max', 'sage_normalize': True, 'sage_project': False, 'lr': 0.0019560016516670217, 'weight_decay': 2.7878758797875576e-05, 'epochs': 339, 'loss': 'mse', 'optimizer': 'adam', 'graph_mode': 'cutoff', 'cutoff': 0.7595812049766899, 'grm_norm': 'cosine_then_gcn', 'self_loops': False, 'use_snp_selection': False}. Best is trial 42 with value: 0.30872225963632116.
[I 2025-12-10 00:27:11,922] Trial 54 finished with value: 0.30474082961896254 and parameters: {'model_type': 'graphsage', 'hidden_dims': '[256, 128]', 'dropout': 0.2736355809814869, 'batch_norm': False, 'sage_aggr': 'max', 'sage_normalize': True, 'sage_project': False, 'lr': 0.0031504653144479432, 'weight_decay': 9.019315197298602e-05, 'epochs': 292, 'loss': 'mse', 'optimizer': 'adam', 'graph_mode': 'cutoff', 'cutoff': 0.6551301498859229, 'grm_norm': 'cosine_then_gcn', 'self_loops': False, 'use_snp_selection': False}. Best is trial 42 with value: 0.30872225963632116.
[I 2025-12-10 00:28:50,742] Trial 55 finished with value: 0.3039822731409628 and parameters: {'model_type': 'graphsage', 'hidden_dims': '[256, 128]', 'dropout': 0.3936102789986558, 'batch_norm': False, 'sage_aggr': 'max', 'sage_normalize': True, 'sage_project': False, 'lr': 0.001580819574564151, 'weight_decay': 1.8089242713507457e-05, 'epochs': 350, 'loss': 'mse', 'optimizer': 'adam', 'graph_mode': 'cutoff', 'cutoff': 0.8028885888871113, 'grm_norm': 'cosine_then_gcn', 'self_loops': False, 'use_snp_selection': False}. Best is trial 42 with value: 0.30872225963632116.
[I 2025-12-10 00:31:36,739] Trial 56 finished with value: 0.20033269871256162 and parameters: {'model_type': 'graphsage', 'hidden_dims': '[512, 128]', 'dropout': 0.44422243614788415, 'batch_norm': False, 'sage_aggr': 'max', 'sage_normalize': True, 'sage_project': False, 'lr': 0.009233123400397647, 'weight_decay': 9.62358529178144e-06, 'epochs': 316, 'loss': 'mse', 'optimizer': 'adam', 'graph_mode': 'cutoff', 'cutoff': 0.7213102226316431, 'grm_norm': 'cosine_then_gcn', 'self_loops': False, 'use_snp_selection': False}. Best is trial 42 with value: 0.30872225963632116.
[I 2025-12-10 00:32:55,301] Trial 57 finished with value: 0.3093132447656798 and parameters: {'model_type': 'graphsage', 'hidden_dims': '[256, 128]', 'dropout': 0.376167819797394, 'batch_norm': False, 'sage_aggr': 'max', 'sage_normalize': True, 'sage_project': False, 'lr': 0.0040081138460202215, 'weight_decay': 4.916549341735629e-06, 'epochs': 276, 'loss': 'mse', 'optimizer': 'adam', 'graph_mode': 'cutoff', 'cutoff': 0.869326268087636, 'grm_norm': 'cosine', 'self_loops': False, 'use_snp_selection': False}. Best is trial 57 with value: 0.3093132447656798.
[I 2025-12-10 00:34:14,793] Trial 58 finished with value: 0.3070499722868549 and parameters: {'model_type': 'graphsage', 'hidden_dims': '[256, 128]', 'dropout': 0.37162084968475273, 'batch_norm': False, 'sage_aggr': 'max', 'sage_normalize': True, 'sage_project': False, 'lr': 0.0043854175577765185, 'weight_decay': 4.499692515534043e-06, 'epochs': 279, 'loss': 'mse', 'optimizer': 'adam', 'graph_mode': 'cutoff', 'cutoff': 0.7458263928885489, 'grm_norm': 'cosine', 'self_loops': False, 'use_snp_selection': False}. Best is trial 57 with value: 0.3093132447656798.
[I 2025-12-10 00:35:35,903] Trial 59 finished with value: 0.006114449595874075 and parameters: {'model_type': 'graphsage', 'hidden_dims': '[256, 128]', 'dropout': 0.36443743448225285, 'batch_norm': False, 'sage_aggr': 'max', 'sage_normalize': False, 'sage_project': False, 'lr': 0.004490716531541246, 'weight_decay': 1.5648740936957376e-06, 'epochs': 273, 'loss': 'mse', 'optimizer': 'adam', 'graph_mode': 'cutoff', 'cutoff': 0.5672912931373953, 'grm_norm': 'cosine', 'self_loops': False, 'use_snp_selection': False}. Best is trial 57 with value: 0.3093132447656798.
[I 2025-12-10 00:36:48,263] Trial 60 finished with value: 0.29588314657184606 and parameters: {'model_type': 'graphsage', 'hidden_dims': '[256, 128]', 'dropout': 0.30409908537914326, 'batch_norm': False, 'sage_aggr': 'max', 'sage_normalize': True, 'sage_project': False, 'lr': 0.006817827883311815, 'weight_decay': 5.183304180099303e-06, 'epochs': 250, 'loss': 'mse', 'optimizer': 'adam', 'graph_mode': 'cutoff', 'cutoff': 0.6176847555239162, 'grm_norm': 'cosine', 'self_loops': False, 'use_snp_selection': False}. Best is trial 57 with value: 0.3093132447656798.
[I 2025-12-10 00:38:07,949] Trial 61 finished with value: 0.308484688976565 and parameters: {'model_type': 'graphsage', 'hidden_dims': '[256, 128]', 'dropout': 0.3789991074038832, 'batch_norm': False, 'sage_aggr': 'max', 'sage_normalize': True, 'sage_project': False, 'lr': 0.003924905214275726, 'weight_decay': 3.225784695956008e-06, 'epochs': 280, 'loss': 'mse', 'optimizer': 'adam', 'graph_mode': 'cutoff', 'cutoff': 0.7533583693972196, 'grm_norm': 'cosine', 'self_loops': False, 'use_snp_selection': False}. Best is trial 57 with value: 0.3093132447656798.
[I 2025-12-10 00:39:27,832] Trial 62 finished with value: 0.30589012830071033 and parameters: {'model_type': 'graphsage', 'hidden_dims': '[256, 128]', 'dropout': 0.32707044843884187, 'batch_norm': False, 'sage_aggr': 'max', 'sage_normalize': True, 'sage_project': False, 'lr': 0.003867013418199801, 'weight_decay': 3.0799242286511826e-06, 'epochs': 280, 'loss': 'mse', 'optimizer': 'adam', 'graph_mode': 'cutoff', 'cutoff': 0.6781855510357685, 'grm_norm': 'cosine', 'self_loops': False, 'use_snp_selection': False}. Best is trial 57 with value: 0.3093132447656798.
[I 2025-12-10 00:40:47,424] Trial 63 finished with value: 0.3074709356072079 and parameters: {'model_type': 'graphsage', 'hidden_dims': '[256, 128]', 'dropout': 0.3210899548021883, 'batch_norm': False, 'sage_aggr': 'max', 'sage_normalize': True, 'sage_project': False, 'lr': 0.004059421935961175, 'weight_decay': 1.1028915369596096e-06, 'epochs': 279, 'loss': 'mse', 'optimizer': 'adam', 'graph_mode': 'cutoff', 'cutoff': 0.6798286796958664, 'grm_norm': 'cosine', 'self_loops': False, 'use_snp_selection': False}. Best is trial 57 with value: 0.3093132447656798.
[I 2025-12-10 00:42:03,469] Trial 64 finished with value: 0.3039347999167541 and parameters: {'model_type': 'graphsage', 'hidden_dims': '[256, 128]', 'dropout': 0.3363375460643348, 'batch_norm': False, 'sage_aggr': 'max', 'sage_normalize': True, 'sage_project': False, 'lr': 0.003820375066662792, 'weight_decay': 1.0057927926940072e-06, 'epochs': 266, 'loss': 'mse', 'optimizer': 'adam', 'graph_mode': 'cutoff', 'cutoff': 0.6736090767700089, 'grm_norm': 'cosine', 'self_loops': False, 'use_snp_selection': False}. Best is trial 57 with value: 0.3093132447656798.
[I 2025-12-10 00:43:30,760] Trial 65 finished with value: 0.27769161329707376 and parameters: {'model_type': 'graphsage', 'hidden_dims': '[256, 128, 64]', 'dropout': 0.42646457330028714, 'batch_norm': False, 'sage_aggr': 'max', 'sage_normalize': True, 'sage_project': False, 'lr': 0.0036070140605311695, 'weight_decay': 3.7383663256419613e-07, 'epochs': 279, 'loss': 'mse', 'optimizer': 'adam', 'graph_mode': 'cutoff', 'cutoff': 0.5366969056040427, 'grm_norm': 'cosine', 'self_loops': False, 'use_snp_selection': False}. Best is trial 57 with value: 0.3093132447656798.
[I 2025-12-10 00:45:39,529] Trial 66 finished with value: 0.3047510029067745 and parameters: {'model_type': 'graphsage', 'hidden_dims': '[512, 128]', 'dropout': 0.10970737880322579, 'batch_norm': False, 'sage_aggr': 'max', 'sage_normalize': True, 'sage_project': False, 'lr': 0.008235286169262413, 'weight_decay': 3.1338857357793777e-06, 'epochs': 242, 'loss': 'mse', 'optimizer': 'adam', 'graph_mode': 'cutoff', 'cutoff': 0.6300972639408841, 'grm_norm': 'cosine', 'self_loops': False, 'use_snp_selection': False}. Best is trial 57 with value: 0.3093132447656798.
[I 2025-12-10 00:46:39,604] Trial 67 finished with value: 0.30835535179897855 and parameters: {'model_type': 'graphsage', 'hidden_dims': '[256, 128]', 'dropout': 0.3797686707756331, 'batch_norm': False, 'sage_aggr': 'max', 'sage_normalize': True, 'sage_project': False, 'lr': 0.005683816571901386, 'weight_decay': 1.9523326572126016e-06, 'epochs': 208, 'loss': 'mse', 'optimizer': 'adam', 'graph_mode': 'cutoff', 'cutoff': 0.6851271070139816, 'grm_norm': 'cosine', 'self_loops': False, 'use_snp_selection': False}. Best is trial 57 with value: 0.3093132447656798.
[I 2025-12-10 00:47:15,130] Trial 68 finished with value: 0.2542991975332956 and parameters: {'model_type': 'graphsage', 'hidden_dims': '[128, 64]', 'dropout': 0.38431228469289913, 'batch_norm': True, 'sage_aggr': 'max', 'sage_normalize': True, 'sage_project': False, 'lr': 0.006103421028140441, 'weight_decay': 1.6092199685849095e-06, 'epochs': 123, 'loss': 'mae', 'optimizer': 'adam', 'graph_mode': 'knn', 'knn_k': 5, 'weighted_edges': True, 'symmetrize_mode': 'mutual', 'self_loops': False, 'use_snp_selection': False}. Best is trial 57 with value: 0.3093132447656798.
[I 2025-12-10 00:48:13,451] Trial 69 finished with value: 0.3035549961548073 and parameters: {'model_type': 'graphsage', 'hidden_dims': '[256, 128]', 'dropout': 0.34597283761110814, 'batch_norm': False, 'sage_aggr': 'max', 'sage_normalize': True, 'sage_project': False, 'lr': 0.0030728568983898587, 'weight_decay': 5.023515565483031e-07, 'epochs': 202, 'loss': 'mse', 'optimizer': 'adam', 'graph_mode': 'cutoff', 'cutoff': 0.780129660917969, 'grm_norm': 'cosine', 'self_loops': False, 'use_snp_selection': False}. Best is trial 57 with value: 0.3093132447656798.
[I 2025-12-10 00:48:27,470] Trial 70 finished with value: 0.2818221506595599 and parameters: {'model_type': 'graphsage', 'hidden_dims': '[256, 128]', 'dropout': 0.4430538398277505, 'batch_norm': False, 'sage_aggr': 'max', 'sage_normalize': True, 'sage_project': False, 'lr': 0.004720782006478237, 'weight_decay': 1.0958256895707052e-06, 'epochs': 43, 'loss': 'mse', 'optimizer': 'adam', 'graph_mode': 'cutoff', 'cutoff': 0.7078512479207759, 'grm_norm': 'cosine', 'self_loops': False, 'use_snp_selection': True, 'num_snps': 15839}. Best is trial 57 with value: 0.3093132447656798.
[I 2025-12-10 00:49:51,763] Trial 71 finished with value: 0.31284303337172253 and parameters: {'model_type': 'graphsage', 'hidden_dims': '[256, 128]', 'dropout': 0.38049514048267585, 'batch_norm': False, 'sage_aggr': 'max', 'sage_normalize': True, 'sage_project': False, 'lr': 0.004060497612115634, 'weight_decay': 2.0941938597987987e-06, 'epochs': 296, 'loss': 'mse', 'optimizer': 'adam', 'graph_mode': 'cutoff', 'cutoff': 0.6769549069206272, 'grm_norm': 'cosine', 'self_loops': False, 'use_snp_selection': False}. Best is trial 71 with value: 0.31284303337172253.
[I 2025-12-10 00:50:45,710] Trial 72 finished with value: 0.3101983503496148 and parameters: {'model_type': 'graphsage', 'hidden_dims': '[256, 128]', 'dropout': 0.37945385571760604, 'batch_norm': False, 'sage_aggr': 'max', 'sage_normalize': True, 'sage_project': False, 'lr': 0.002641845275706443, 'weight_decay': 2.166648216966954e-06, 'epochs': 185, 'loss': 'mse', 'optimizer': 'adam', 'graph_mode': 'cutoff', 'cutoff': 0.6462405373961462, 'grm_norm': 'cosine', 'self_loops': False, 'use_snp_selection': False}. Best is trial 71 with value: 0.31284303337172253.
[I 2025-12-10 00:51:38,978] Trial 73 finished with value: 0.2999966774006328 and parameters: {'model_type': 'graphsage', 'hidden_dims': '[256, 128]', 'dropout': 0.4144554461119228, 'batch_norm': False, 'sage_aggr': 'max', 'sage_normalize': True, 'sage_project': False, 'lr': 0.002175984043577, 'weight_decay': 1.712542123916178e-06, 'epochs': 181, 'loss': 'mse', 'optimizer': 'adam', 'graph_mode': 'cutoff', 'cutoff': 0.6150440755873838, 'grm_norm': 'cosine', 'self_loops': False, 'use_snp_selection': False}. Best is trial 71 with value: 0.31284303337172253.
[I 2025-12-10 00:52:25,925] Trial 74 finished with value: 0.30827921559158367 and parameters: {'model_type': 'graphsage', 'hidden_dims': '[256, 128]', 'dropout': 0.40300850226894036, 'batch_norm': False, 'sage_aggr': 'max', 'sage_normalize': True, 'sage_project': False, 'lr': 0.002866456266595484, 'weight_decay': 1.0956783037225895e-06, 'epochs': 160, 'loss': 'mse', 'optimizer': 'adam', 'graph_mode': 'cutoff', 'cutoff': 0.6672396048724761, 'grm_norm': 'cosine', 'self_loops': False, 'use_snp_selection': False}. Best is trial 71 with value: 0.31284303337172253.
[I 2025-12-10 00:53:55,698] Trial 75 finished with value: 0.30385220910138494 and parameters: {'model_type': 'graphsage', 'hidden_dims': '[512, 256]', 'dropout': 0.3780332397382074, 'batch_norm': False, 'sage_aggr': 'max', 'sage_normalize': True, 'sage_project': False, 'lr': 0.002605050849860455, 'weight_decay': 2.094366776561798e-06, 'epochs': 166, 'loss': 'mse', 'optimizer': 'adam', 'graph_mode': 'cutoff', 'cutoff': 0.6557119922386526, 'grm_norm': 'cosine', 'self_loops': False, 'use_snp_selection': False}. Best is trial 71 with value: 0.31284303337172253.
[I 2025-12-10 00:55:10,601] Trial 76 finished with value: 0.0 and parameters: {'model_type': 'graphsage', 'hidden_dims': '[512, 64]', 'dropout': 0.4866199668784199, 'batch_norm': False, 'sage_aggr': 'max', 'sage_normalize': False, 'sage_project': False, 'lr': 0.0015376190518012701, 'weight_decay': 1.9797733926651514e-07, 'epochs': 138, 'loss': 'mse', 'optimizer': 'adam', 'graph_mode': 'cutoff', 'cutoff': 0.6463593248234942, 'grm_norm': 'cosine', 'self_loops': False, 'use_snp_selection': False}. Best is trial 71 with value: 0.31284303337172253.
[I 2025-12-10 00:56:01,561] Trial 77 finished with value: 0.3108149456540555 and parameters: {'model_type': 'graphsage', 'hidden_dims': '[256, 128]', 'dropout': 0.39454578058130707, 'batch_norm': False, 'sage_aggr': 'max', 'sage_normalize': True, 'sage_project': False, 'lr': 0.0030719410656611583, 'weight_decay': 5.82257231985178e-07, 'epochs': 175, 'loss': 'mse', 'optimizer': 'adam', 'graph_mode': 'cutoff', 'cutoff': 0.7116909635622349, 'grm_norm': 'cosine', 'self_loops': False, 'use_snp_selection': False}. Best is trial 71 with value: 0.31284303337172253.
[I 2025-12-10 00:57:12,208] Trial 78 finished with value: 0.284866392621309 and parameters: {'model_type': 'graphsage', 'hidden_dims': '[256, 128]', 'dropout': 0.39895195309588277, 'batch_norm': False, 'sage_aggr': 'max', 'sage_normalize': True, 'sage_project': False, 'lr': 0.0030606756503243383, 'weight_decay': 6.057889666983058e-07, 'epochs': 190, 'loss': 'mse', 'optimizer': 'adam', 'graph_mode': 'cutoff', 'cutoff': 0.49828924195564767, 'grm_norm': 'cosine', 'self_loops': False, 'use_snp_selection': False}. Best is trial 71 with value: 0.31284303337172253.
[I 2025-12-10 00:58:02,746] Trial 79 finished with value: 0.29475299782234426 and parameters: {'model_type': 'graphsage', 'hidden_dims': '[256, 128]', 'dropout': 0.34510263641190814, 'batch_norm': False, 'sage_aggr': 'max', 'sage_normalize': True, 'sage_project': False, 'lr': 0.005441772210086313, 'weight_decay': 3.6023621272466894e-06, 'epochs': 171, 'loss': 'mse', 'optimizer': 'adam', 'graph_mode': 'cutoff', 'cutoff': 0.6120999936048217, 'grm_norm': 'cosine', 'self_loops': False, 'use_snp_selection': False}. Best is trial 71 with value: 0.31284303337172253.
[I 2025-12-10 00:58:59,431] Trial 80 finished with value: 0.2527476860193455 and parameters: {'model_type': 'graphsage', 'hidden_dims': '[256, 128]', 'dropout': 0.43516784569430844, 'batch_norm': True, 'sage_aggr': 'max', 'sage_normalize': True, 'sage_project': False, 'lr': 0.00790162134620837, 'weight_decay': 7.719858978380683e-07, 'epochs': 212, 'loss': 'mae', 'optimizer': 'adam', 'graph_mode': 'knn', 'knn_k': 1, 'weighted_edges': True, 'symmetrize_mode': 'mutual', 'self_loops': False, 'use_snp_selection': False}. Best is trial 71 with value: 0.31284303337172253.
[I 2025-12-10 00:59:41,648] Trial 81 finished with value: 0.303056316546233 and parameters: {'model_type': 'graphsage', 'hidden_dims': '[256, 128]', 'dropout': 0.41887157166568245, 'batch_norm': False, 'sage_aggr': 'max', 'sage_normalize': True, 'sage_project': False, 'lr': 0.0027093514549456953, 'weight_decay': 2.3376082661399197e-06, 'epochs': 143, 'loss': 'mse', 'optimizer': 'adam', 'graph_mode': 'cutoff', 'cutoff': 0.6944994809928389, 'grm_norm': 'cosine', 'self_loops': False, 'use_snp_selection': False}. Best is trial 71 with value: 0.31284303337172253.
[I 2025-12-10 01:00:36,704] Trial 82 finished with value: 0.3089493147780257 and parameters: {'model_type': 'graphsage', 'hidden_dims': '[256, 128]', 'dropout': 0.4034323690585263, 'batch_norm': False, 'sage_aggr': 'max', 'sage_normalize': True, 'sage_project': False, 'lr': 0.0018387960266409255, 'weight_decay': 4.3270428255368805e-07, 'epochs': 190, 'loss': 'mse', 'optimizer': 'adam', 'graph_mode': 'cutoff', 'cutoff': 0.7104948181947573, 'grm_norm': 'cosine', 'self_loops': False, 'use_snp_selection': False}. Best is trial 71 with value: 0.31284303337172253.
[I 2025-12-10 01:01:31,470] Trial 83 finished with value: 0.3084123628796673 and parameters: {'model_type': 'graphsage', 'hidden_dims': '[256, 128]', 'dropout': 0.3829253052234703, 'batch_norm': False, 'sage_aggr': 'max', 'sage_normalize': True, 'sage_project': False, 'lr': 0.001822260353529013, 'weight_decay': 4.2027901772661767e-07, 'epochs': 189, 'loss': 'mse', 'optimizer': 'adam', 'graph_mode': 'cutoff', 'cutoff': 0.7182951797608932, 'grm_norm': 'cosine', 'self_loops': False, 'use_snp_selection': False}. Best is trial 71 with value: 0.31284303337172253.
[I 2025-12-10 01:02:27,071] Trial 84 finished with value: 0.3068916183021565 and parameters: {'model_type': 'graphsage', 'hidden_dims': '[256, 128]', 'dropout': 0.36042670133071014, 'batch_norm': False, 'sage_aggr': 'max', 'sage_normalize': True, 'sage_project': False, 'lr': 0.0018353092000393185, 'weight_decay': 4.140955888951377e-07, 'epochs': 192, 'loss': 'mse', 'optimizer': 'adam', 'graph_mode': 'cutoff', 'cutoff': 0.7183927265088397, 'grm_norm': 'cosine', 'self_loops': False, 'use_snp_selection': False}. Best is trial 71 with value: 0.31284303337172253.
[I 2025-12-10 01:03:29,231] Trial 85 finished with value: 0.2870154104140515 and parameters: {'model_type': 'graphsage', 'hidden_dims': '[256, 128]', 'dropout': 0.3855292398011827, 'batch_norm': False, 'sage_aggr': 'max', 'sage_normalize': True, 'sage_project': False, 'lr': 0.009929230779193774, 'weight_decay': 1.9608329575844493e-07, 'epochs': 216, 'loss': 'mse', 'optimizer': 'adam', 'graph_mode': 'cutoff', 'cutoff': 0.7334820839457524, 'grm_norm': 'cosine', 'self_loops': False, 'use_snp_selection': False}. Best is trial 71 with value: 0.31284303337172253.
