[I 2025-12-09 11:48:28,294] Trial 31 finished with value: 0.34435343527042006 and parameters: {'model_type': 'graphsage', 'hidden_dims': '[256, 128, 64]', 'dropout': 0.3694508721487548, 'batch_norm': False, 'sage_aggr': 'max', 'sage_normalize': False, 'sage_project': False, 'lr': 6.273167936929298e-05, 'weight_decay': 1.2137911878616557e-05, 'epochs': 125, 'loss': 'mae', 'optimizer': 'adam', 'graph_mode': 'cutoff', 'cutoff': 0.5101317223362056, 'grm_norm': 'gcn', 'self_loops': False, 'use_snp_selection': True, 'num_snps': 36987}. Best is trial 2 with value: 0.36255218638588504.
[I 2025-12-09 11:49:20,614] Trial 32 finished with value: 0.3479460791535621 and parameters: {'model_type': 'graphsage', 'hidden_dims': '[256, 128, 64]', 'dropout': 0.5126549428056805, 'batch_norm': False, 'sage_aggr': 'max', 'sage_normalize': False, 'sage_project': False, 'lr': 4.612751451702983e-05, 'weight_decay': 1.6682404761699693e-05, 'epochs': 98, 'loss': 'mae', 'optimizer': 'adam', 'graph_mode': 'cutoff', 'cutoff': 0.5314703829965904, 'grm_norm': 'gcn', 'self_loops': False, 'use_snp_selection': True, 'num_snps': 36282}. Best is trial 2 with value: 0.36255218638588504.
[I 2025-12-09 11:50:47,024] Trial 33 finished with value: 0.3389341107929827 and parameters: {'model_type': 'graphsage', 'hidden_dims': '[256, 128, 64]', 'dropout': 0.3825813730725954, 'batch_norm': False, 'sage_aggr': 'max', 'sage_normalize': False, 'sage_project': False, 'lr': 0.00010323542081305241, 'weight_decay': 4.3860066933099815e-06, 'epochs': 161, 'loss': 'mae', 'optimizer': 'adam', 'graph_mode': 'cutoff', 'cutoff': 0.4562573507217629, 'grm_norm': 'gcn', 'self_loops': False, 'use_snp_selection': True, 'num_snps': 46238}. Best is trial 2 with value: 0.36255218638588504.
[I 2025-12-09 11:52:04,774] Trial 34 finished with value: 0.3215125631263439 and parameters: {'model_type': 'graphsage', 'hidden_dims': '[256, 128, 64]', 'dropout': 0.35119824237353614, 'batch_norm': False, 'sage_aggr': 'max', 'sage_normalize': False, 'sage_project': False, 'lr': 2.1103779385479353e-05, 'weight_decay': 1.5124930572449865e-06, 'epochs': 142, 'loss': 'mse', 'optimizer': 'adam', 'graph_mode': 'knn', 'knn_k': 4, 'weighted_edges': False, 'symmetrize_mode': 'union', 'self_loops': True, 'use_snp_selection': True, 'num_snps': 29627}. Best is trial 2 with value: 0.36255218638588504.
[I 2025-12-09 11:53:44,627] Trial 35 finished with value: 0.3404593577566609 and parameters: {'model_type': 'graphsage', 'hidden_dims': '[512, 128]', 'dropout': 0.44341308286446063, 'batch_norm': True, 'sage_aggr': 'max', 'sage_normalize': False, 'sage_project': False, 'lr': 0.00013972733231728925, 'weight_decay': 1.4445304569491712e-05, 'epochs': 153, 'loss': 'mae', 'optimizer': 'adam', 'graph_mode': 'cutoff', 'cutoff': 0.3580064422502649, 'grm_norm': 'gcn', 'self_loops': False, 'use_snp_selection': True, 'num_snps': 39667}. Best is trial 2 with value: 0.36255218638588504.
[I 2025-12-09 11:54:35,449] Trial 36 finished with value: 0.02813806521876499 and parameters: {'model_type': 'graphsage', 'hidden_dims': '[256, 128, 64]', 'dropout': 0.12940797213705535, 'batch_norm': False, 'sage_aggr': 'max', 'sage_normalize': False, 'sage_project': False, 'lr': 0.00038749110674356565, 'weight_decay': 5.505834464183204e-05, 'epochs': 187, 'loss': 'mse', 'optimizer': 'adam', 'graph_mode': 'cutoff', 'cutoff': 0.6557064052506579, 'grm_norm': 'cosine', 'self_loops': False, 'use_snp_selection': False}. Best is trial 2 with value: 0.36255218638588504.
[I 2025-12-09 11:55:41,427] Trial 37 finished with value: 0.34613236909655604 and parameters: {'model_type': 'graphsage', 'hidden_dims': '[512, 64]', 'dropout': 0.23233132466626666, 'batch_norm': True, 'sage_aggr': 'mean', 'sage_normalize': False, 'sage_project': False, 'lr': 1.4865860134313344e-05, 'weight_decay': 0.0003259012448420259, 'epochs': 125, 'loss': 'mae', 'optimizer': 'adam', 'graph_mode': 'knn', 'knn_k': 4, 'weighted_edges': True, 'symmetrize_mode': 'union', 'self_loops': True, 'use_snp_selection': True, 'num_snps': 24894}. Best is trial 2 with value: 0.36255218638588504.
[I 2025-12-09 11:56:32,414] Trial 38 finished with value: 0.3260098126955485 and parameters: {'model_type': 'graphsage', 'hidden_dims': '[128, 64]', 'dropout': 0.2686063894249134, 'batch_norm': False, 'sage_aggr': 'max', 'sage_normalize': True, 'sage_project': False, 'lr': 3.7852049536040264e-05, 'weight_decay': 5.387290538215233e-06, 'epochs': 170, 'loss': 'mae', 'optimizer': 'adam', 'graph_mode': 'cutoff', 'cutoff': 0.5584486026325926, 'grm_norm': 'gcn', 'self_loops': False, 'use_snp_selection': True, 'num_snps': 34478}. Best is trial 2 with value: 0.36255218638588504.
[I 2025-12-09 11:57:23,029] Trial 39 finished with value: 0.3062427850643771 and parameters: {'model_type': 'graphsage', 'hidden_dims': '[512, 256]', 'dropout': 0.3358937110479459, 'batch_norm': True, 'sage_aggr': 'max', 'sage_normalize': False, 'sage_project': False, 'lr': 6.573855181690064e-05, 'weight_decay': 8.752528327628989e-07, 'epochs': 70, 'loss': 'mae', 'optimizer': 'adam', 'graph_mode': 'knn', 'knn_k': 3, 'weighted_edges': False, 'symmetrize_mode': 'union', 'self_loops': True, 'use_snp_selection': False}. Best is trial 2 with value: 0.36255218638588504.
[I 2025-12-09 11:58:56,183] Trial 40 finished with value: 0.3365368693282188 and parameters: {'model_type': 'graphsage', 'hidden_dims': '[256, 128, 64]', 'dropout': 0.5493502144806721, 'batch_norm': False, 'sage_aggr': 'mean', 'sage_normalize': True, 'sage_project': False, 'lr': 0.000675011729216242, 'weight_decay': 0.00011159676680130238, 'epochs': 251, 'loss': 'mse', 'optimizer': 'adam', 'graph_mode': 'cutoff', 'cutoff': 0.5944418823929607, 'grm_norm': 'none', 'self_loops': False, 'use_snp_selection': True, 'num_snps': 51287}. Best is trial 2 with value: 0.36255218638588504.
[I 2025-12-09 11:59:30,811] Trial 41 finished with value: 0.27155754645863556 and parameters: {'model_type': 'graphsage', 'hidden_dims': '[128, 64]', 'dropout': 0.2549120411374238, 'batch_norm': False, 'sage_aggr': 'max', 'sage_normalize': False, 'sage_project': False, 'lr': 0.0002739406936854861, 'weight_decay': 5.751772677060389e-05, 'epochs': 176, 'loss': 'mse', 'optimizer': 'adam', 'graph_mode': 'cutoff', 'cutoff': 0.5623948434133124, 'grm_norm': 'gcn', 'self_loops': True, 'use_snp_selection': False}. Best is trial 2 with value: 0.36255218638588504.
[I 2025-12-09 12:00:21,733] Trial 42 finished with value: 0.14139212109794716 and parameters: {'model_type': 'graphsage', 'hidden_dims': '[128, 64]', 'dropout': 0.27601823734614556, 'batch_norm': False, 'sage_aggr': 'max', 'sage_normalize': False, 'sage_project': False, 'lr': 0.0005843929379890193, 'weight_decay': 0.0002603026444443099, 'epochs': 190, 'loss': 'mse', 'optimizer': 'adam', 'graph_mode': 'cutoff', 'cutoff': 0.388961193771459, 'grm_norm': 'gcn', 'self_loops': True, 'use_snp_selection': False}. Best is trial 2 with value: 0.36255218638588504.
[I 2025-12-09 12:00:57,833] Trial 43 finished with value: 0.15813363909791403 and parameters: {'model_type': 'graphsage', 'hidden_dims': '[128, 64]', 'dropout': 0.30782220329069376, 'batch_norm': False, 'sage_aggr': 'max', 'sage_normalize': False, 'sage_project': False, 'lr': 0.00023973352130715985, 'weight_decay': 1.79186636143756e-05, 'epochs': 97, 'loss': 'mse', 'optimizer': 'adam', 'graph_mode': 'cutoff', 'cutoff': 0.30588921821432763, 'grm_norm': 'gcn', 'self_loops': True, 'use_snp_selection': False}. Best is trial 2 with value: 0.36255218638588504.
[I 2025-12-09 12:01:37,734] Trial 44 finished with value: 0.3466087094552985 and parameters: {'model_type': 'graphsage', 'hidden_dims': '[128, 64]', 'dropout': 0.19282481066480212, 'batch_norm': False, 'sage_aggr': 'max', 'sage_normalize': False, 'sage_project': False, 'lr': 0.00012190907131853863, 'weight_decay': 3.690854824480788e-05, 'epochs': 150, 'loss': 'mse', 'optimizer': 'adam', 'graph_mode': 'cutoff', 'cutoff': 0.4571910094995398, 'grm_norm': 'none', 'self_loops': True, 'use_snp_selection': False}. Best is trial 2 with value: 0.36255218638588504.
[I 2025-12-09 12:03:33,927] Trial 45 finished with value: 0.1568389908908956 and parameters: {'model_type': 'graphsage', 'hidden_dims': '[512, 64]', 'dropout': 0.2437784435679504, 'batch_norm': False, 'sage_aggr': 'max', 'sage_normalize': False, 'sage_project': False, 'lr': 0.00034406745772944743, 'weight_decay': 0.0006762447001091262, 'epochs': 270, 'loss': 'mse', 'optimizer': 'adam', 'graph_mode': 'cutoff', 'cutoff': 0.71573470729956, 'grm_norm': 'cosine_then_gcn', 'self_loops': True, 'use_snp_selection': False}. Best is trial 2 with value: 0.36255218638588504.
[I 2025-12-09 12:04:34,441] Trial 46 finished with value: 0.3365003790847959 and parameters: {'model_type': 'graphsage', 'hidden_dims': '[256, 128]', 'dropout': 0.35329313584434496, 'batch_norm': True, 'sage_aggr': 'max', 'sage_normalize': True, 'sage_project': False, 'lr': 6.764044780253409e-05, 'weight_decay': 6.685409843497193e-05, 'epochs': 213, 'loss': 'mae', 'optimizer': 'adam', 'graph_mode': 'knn', 'knn_k': 6, 'weighted_edges': False, 'symmetrize_mode': 'mutual', 'self_loops': True, 'use_snp_selection': True, 'num_snps': 19754}. Best is trial 2 with value: 0.36255218638588504.
[I 2025-12-09 12:05:35,835] Trial 47 finished with value: 0.04973866226483932 and parameters: {'model_type': 'graphsage', 'hidden_dims': '[512, 128]', 'dropout': 0.28522106506737943, 'batch_norm': False, 'sage_aggr': 'max', 'sage_normalize': False, 'sage_project': False, 'lr': 0.0010474842986761242, 'weight_decay': 7.786082082271352e-06, 'epochs': 129, 'loss': 'mse', 'optimizer': 'adam', 'graph_mode': 'cutoff', 'cutoff': 0.8095076876484899, 'grm_norm': 'gcn', 'self_loops': False, 'use_snp_selection': False}. Best is trial 2 with value: 0.36255218638588504.
[I 2025-12-09 12:07:44,892] Trial 48 finished with value: 0.1826788520866322 and parameters: {'model_type': 'graphsage', 'hidden_dims': '[512, 256]', 'dropout': 0.3192363272361353, 'batch_norm': False, 'sage_aggr': 'mean', 'sage_normalize': False, 'sage_project': False, 'lr': 0.003454251855439759, 'weight_decay': 2.139630432882536e-05, 'epochs': 176, 'loss': 'mae', 'optimizer': 'adam', 'graph_mode': 'cutoff', 'cutoff': 0.29488311922473714, 'grm_norm': 'gcn', 'self_loops': False, 'use_snp_selection': True, 'num_snps': 42202}. Best is trial 2 with value: 0.36255218638588504.
[I 2025-12-09 12:08:58,247] Trial 49 finished with value: 0.33239620788777413 and parameters: {'model_type': 'graphsage', 'hidden_dims': '[512, 64]', 'dropout': 0.21757681699779982, 'batch_norm': False, 'sage_aggr': 'max', 'sage_normalize': True, 'sage_project': False, 'lr': 0.00016348170974977825, 'weight_decay': 1.0725606244705044e-05, 'epochs': 105, 'loss': 'mae', 'optimizer': 'adam', 'graph_mode': 'cutoff', 'cutoff': 0.6311299975722708, 'grm_norm': 'cosine', 'self_loops': False, 'use_snp_selection': True, 'num_snps': 46685}. Best is trial 2 with value: 0.36255218638588504.
[I 2025-12-09 12:09:43,898] Trial 50 finished with value: 0.33871846718491755 and parameters: {'model_type': 'graphsage', 'hidden_dims': '[512, 256]', 'dropout': 0.26058989026917195, 'batch_norm': True, 'sage_aggr': 'max', 'sage_normalize': False, 'sage_project': False, 'lr': 4.5924295681151495e-05, 'weight_decay': 0.0006856200617245702, 'epochs': 55, 'loss': 'mae', 'optimizer': 'adam', 'graph_mode': 'cutoff', 'cutoff': 0.5685282027612932, 'grm_norm': 'gcn', 'self_loops': True, 'use_snp_selection': True, 'num_snps': 29744}. Best is trial 2 with value: 0.36255218638588504.
[I 2025-12-09 12:10:53,670] Trial 51 finished with value: 0.3570732107272162 and parameters: {'model_type': 'graphsage', 'hidden_dims': '[512, 256]', 'dropout': 0.3958641945497971, 'batch_norm': False, 'sage_aggr': 'max', 'sage_normalize': False, 'sage_project': False, 'lr': 7.747629574531635e-05, 'weight_decay': 0.0009230084526343099, 'epochs': 122, 'loss': 'mae', 'optimizer': 'adam', 'graph_mode': 'cutoff', 'cutoff': 0.8910197742300661, 'grm_norm': 'cosine', 'self_loops': False, 'use_snp_selection': True, 'num_snps': 40459}. Best is trial 2 with value: 0.36255218638588504.
[I 2025-12-09 12:11:49,568] Trial 52 finished with value: 0.35973821416012614 and parameters: {'model_type': 'graphsage', 'hidden_dims': '[512, 256]', 'dropout': 0.41856867614502097, 'batch_norm': False, 'sage_aggr': 'max', 'sage_normalize': False, 'sage_project': False, 'lr': 0.00016776049796122993, 'weight_decay': 0.0005094597159390425, 'epochs': 85, 'loss': 'mae', 'optimizer': 'adam', 'graph_mode': 'cutoff', 'cutoff': 0.8581140472656601, 'grm_norm': 'cosine', 'self_loops': False, 'use_snp_selection': True, 'num_snps': 35219}. Best is trial 2 with value: 0.36255218638588504.
[I 2025-12-09 12:12:43,760] Trial 53 finished with value: 0.3591420360933367 and parameters: {'model_type': 'graphsage', 'hidden_dims': '[512, 256]', 'dropout': 0.43146588804961467, 'batch_norm': False, 'sage_aggr': 'max', 'sage_normalize': False, 'sage_project': False, 'lr': 0.00018314217283521239, 'weight_decay': 0.00022666902682825726, 'epochs': 79, 'loss': 'mae', 'optimizer': 'adam', 'graph_mode': 'cutoff', 'cutoff': 0.8145309794586858, 'grm_norm': 'cosine', 'self_loops': False, 'use_snp_selection': True, 'num_snps': 34657}. Best is trial 2 with value: 0.36255218638588504.
[I 2025-12-09 12:13:39,755] Trial 54 finished with value: 0.35571197586556963 and parameters: {'model_type': 'graphsage', 'hidden_dims': '[512, 256]', 'dropout': 0.4827303304261844, 'batch_norm': False, 'sage_aggr': 'max', 'sage_normalize': False, 'sage_project': False, 'lr': 0.00017453698547621342, 'weight_decay': 0.0003795014131579193, 'epochs': 84, 'loss': 'mae', 'optimizer': 'adam', 'graph_mode': 'cutoff', 'cutoff': 0.8163496902501536, 'grm_norm': 'cosine', 'self_loops': False, 'use_snp_selection': True, 'num_snps': 35611}. Best is trial 2 with value: 0.36255218638588504.
[I 2025-12-09 12:14:24,401] Trial 55 finished with value: 0.36292899594999783 and parameters: {'model_type': 'graphsage', 'hidden_dims': '[512, 256]', 'dropout': 0.43305851576933796, 'batch_norm': False, 'sage_aggr': 'max', 'sage_normalize': False, 'sage_project': False, 'lr': 9.418610587972388e-05, 'weight_decay': 0.00021421874867193745, 'epochs': 59, 'loss': 'mae', 'optimizer': 'adam', 'graph_mode': 'cutoff', 'cutoff': 0.8033883023535138, 'grm_norm': 'cosine', 'self_loops': False, 'use_snp_selection': True, 'num_snps': 27186}. Best is trial 55 with value: 0.36292899594999783.
[I 2025-12-09 12:15:20,333] Trial 56 finished with value: 0.15598981454053387 and parameters: {'model_type': 'graphsage', 'hidden_dims': '[512, 256]', 'dropout': 0.42637910197245515, 'batch_norm': False, 'sage_aggr': 'max', 'sage_normalize': False, 'sage_project': False, 'lr': 0.00012407107234815423, 'weight_decay': 0.0002053276909765247, 'epochs': 46, 'loss': 'mae', 'optimizer': 'adam', 'graph_mode': 'knn', 'knn_k': 8, 'weighted_edges': True, 'symmetrize_mode': 'union', 'self_loops': False, 'use_snp_selection': True, 'num_snps': 25858}. Best is trial 55 with value: 0.36292899594999783.
[I 2025-12-09 12:16:02,076] Trial 57 finished with value: 0.35933212344114634 and parameters: {'model_type': 'graphsage', 'hidden_dims': '[512, 256]', 'dropout': 0.4461661875011636, 'batch_norm': False, 'sage_aggr': 'max', 'sage_normalize': False, 'sage_project': False, 'lr': 8.194991765523065e-05, 'weight_decay': 0.0005305893740018843, 'epochs': 67, 'loss': 'mae', 'optimizer': 'adam', 'graph_mode': 'cutoff', 'cutoff': 0.8471793641178383, 'grm_norm': 'cosine', 'self_loops': False, 'use_snp_selection': True, 'num_snps': 21451}. Best is trial 55 with value: 0.36292899594999783.
[I 2025-12-09 12:16:42,013] Trial 58 finished with value: 0.36256459897092674 and parameters: {'model_type': 'graphsage', 'hidden_dims': '[512, 256]', 'dropout': 0.4617897134422591, 'batch_norm': False, 'sage_aggr': 'mean', 'sage_normalize': False, 'sage_project': False, 'lr': 8.773239851801772e-05, 'weight_decay': 0.0005631390175427798, 'epochs': 57, 'loss': 'mae', 'optimizer': 'adam', 'graph_mode': 'cutoff', 'cutoff': 0.8503469228256467, 'grm_norm': 'cosine', 'self_loops': False, 'use_snp_selection': True, 'num_snps': 20717}. Best is trial 55 with value: 0.36292899594999783.
[I 2025-12-09 12:17:23,147] Trial 59 finished with value: 0.35933926909107916 and parameters: {'model_type': 'graphsage', 'hidden_dims': '[512, 256]', 'dropout': 0.4632616382547841, 'batch_norm': False, 'sage_aggr': 'mean', 'sage_normalize': False, 'sage_project': False, 'lr': 8.990312361479833e-05, 'weight_decay': 0.0005494245071259566, 'epochs': 62, 'loss': 'mae', 'optimizer': 'adam', 'graph_mode': 'cutoff', 'cutoff': 0.8544229112698621, 'grm_norm': 'cosine', 'self_loops': False, 'use_snp_selection': True, 'num_snps': 21493}. Best is trial 55 with value: 0.36292899594999783.
[I 2025-12-09 12:17:58,416] Trial 60 finished with value: 0.3276291752220226 and parameters: {'model_type': 'graphsage', 'hidden_dims': '[512, 256]', 'dropout': 0.475937844939198, 'batch_norm': False, 'sage_aggr': 'mean', 'sage_normalize': True, 'sage_project': False, 'lr': 0.00010509605779995464, 'weight_decay': 0.0005781538158825952, 'epochs': 40, 'loss': 'mae', 'optimizer': 'adam', 'graph_mode': 'cutoff', 'cutoff': 0.7704566998450725, 'grm_norm': 'cosine', 'self_loops': False, 'use_snp_selection': True, 'num_snps': 16269}. Best is trial 55 with value: 0.36292899594999783.
[I 2025-12-09 12:18:40,657] Trial 61 finished with value: 0.36191115118186623 and parameters: {'model_type': 'graphsage', 'hidden_dims': '[512, 256]', 'dropout': 0.4518386546960548, 'batch_norm': False, 'sage_aggr': 'mean', 'sage_normalize': False, 'sage_project': False, 'lr': 8.450733563422321e-05, 'weight_decay': 0.0004773771718031707, 'epochs': 64, 'loss': 'mae', 'optimizer': 'adam', 'graph_mode': 'cutoff', 'cutoff': 0.8508013519474915, 'grm_norm': 'cosine', 'self_loops': False, 'use_snp_selection': True, 'num_snps': 22624}. Best is trial 55 with value: 0.36292899594999783.
[I 2025-12-09 12:19:21,004] Trial 62 finished with value: 0.3663672888177648 and parameters: {'model_type': 'graphsage', 'hidden_dims': '[512, 256]', 'dropout': 0.5136358104291633, 'batch_norm': False, 'sage_aggr': 'mean', 'sage_normalize': False, 'sage_project': False, 'lr': 0.00013327755240458825, 'weight_decay': 0.00014333861794478805, 'epochs': 55, 'loss': 'mae', 'optimizer': 'adam', 'graph_mode': 'cutoff', 'cutoff': 0.8542205985466041, 'grm_norm': 'cosine', 'self_loops': False, 'use_snp_selection': True, 'num_snps': 21967}. Best is trial 62 with value: 0.3663672888177648.
[I 2025-12-09 12:19:53,594] Trial 63 finished with value: 0.3519962002571285 and parameters: {'model_type': 'graphsage', 'hidden_dims': '[512, 256]', 'dropout': 0.4980117864137325, 'batch_norm': False, 'sage_aggr': 'mean', 'sage_normalize': False, 'sage_project': False, 'lr': 0.00012743251964831477, 'weight_decay': 0.00012776480594823373, 'epochs': 57, 'loss': 'mae', 'optimizer': 'adam', 'graph_mode': 'cutoff', 'cutoff': 0.7759660118966556, 'grm_norm': 'cosine', 'self_loops': False, 'use_snp_selection': True, 'num_snps': 9875}. Best is trial 62 with value: 0.3663672888177648.
[I 2025-12-09 12:20:43,762] Trial 64 finished with value: 0.3483179188009019 and parameters: {'model_type': 'graphsage', 'hidden_dims': '[512, 256]', 'dropout': 0.5194582626816825, 'batch_norm': False, 'sage_aggr': 'mean', 'sage_normalize': False, 'sage_project': False, 'lr': 0.00021127037084232308, 'weight_decay': 0.00030105546853760097, 'epochs': 92, 'loss': 'mae', 'optimizer': 'adam', 'graph_mode': 'cutoff', 'cutoff': 0.8648922950273319, 'grm_norm': 'cosine', 'self_loops': False, 'use_snp_selection': True, 'num_snps': 27182}. Best is trial 62 with value: 0.3663672888177648.
[I 2025-12-09 12:21:27,447] Trial 65 finished with value: 0.36247062157268756 and parameters: {'model_type': 'graphsage', 'hidden_dims': '[512, 256]', 'dropout': 0.40292774081636573, 'batch_norm': False, 'sage_aggr': 'mean', 'sage_normalize': False, 'sage_project': False, 'lr': 5.163610262261387e-05, 'weight_decay': 8.788514814905519e-05, 'epochs': 74, 'loss': 'mae', 'optimizer': 'adam', 'graph_mode': 'cutoff', 'cutoff': 0.7839838989915986, 'grm_norm': 'cosine', 'self_loops': False, 'use_snp_selection': True, 'num_snps': 22597}. Best is trial 62 with value: 0.3663672888177648.
[I 2025-12-09 12:22:08,639] Trial 66 finished with value: 0.3567782686286103 and parameters: {'model_type': 'graphsage', 'hidden_dims': '[512, 256]', 'dropout': 0.4039840490109545, 'batch_norm': False, 'sage_aggr': 'mean', 'sage_normalize': False, 'sage_project': False, 'lr': 4.8241824042821956e-05, 'weight_decay': 0.0001624694591730357, 'epochs': 50, 'loss': 'mae', 'optimizer': 'adam', 'graph_mode': 'cutoff', 'cutoff': 0.7400725493721577, 'grm_norm': 'cosine', 'self_loops': False, 'use_snp_selection': True, 'num_snps': 24031}. Best is trial 62 with value: 0.3663672888177648.
[I 2025-12-09 12:22:50,774] Trial 67 finished with value: 0.3574812672829521 and parameters: {'model_type': 'graphsage', 'hidden_dims': '[512, 256]', 'dropout': 0.5312124990794799, 'batch_norm': False, 'sage_aggr': 'mean', 'sage_normalize': False, 'sage_project': False, 'lr': 7.241613888305984e-05, 'weight_decay': 0.00010968965132998922, 'epochs': 71, 'loss': 'mae', 'optimizer': 'adam', 'graph_mode': 'cutoff', 'cutoff': 0.792807817114737, 'grm_norm': 'cosine', 'self_loops': False, 'use_snp_selection': True, 'num_snps': 21284}. Best is trial 62 with value: 0.3663672888177648.
