[I 2025-12-09 16:03:35,860] Trial 82 finished with value: 0.2895406603380926 and parameters: {'model_type': 'graphsage', 'hidden_dims': '[512, 256]', 'dropout': 0.5533527872879105, 'batch_norm': True, 'sage_aggr': 'max', 'sage_normalize': False, 'sage_project': False, 'lr': 1.0641329189400767e-05, 'weight_decay': 0.0001419335094216642, 'epochs': 45, 'loss': 'mse', 'optimizer': 'adam', 'graph_mode': 'cutoff', 'cutoff': 0.6967442001997045, 'grm_norm': 'none', 'self_loops': True, 'use_snp_selection': False}. Best is trial 77 with value: 0.30631818426543256.
[I 2025-12-09 16:04:21,277] Trial 83 finished with value: 0.2974443541103818 and parameters: {'model_type': 'graphsage', 'hidden_dims': '[512, 256]', 'dropout': 0.509509285022633, 'batch_norm': True, 'sage_aggr': 'max', 'sage_normalize': False, 'sage_project': False, 'lr': 0.00034765218329721356, 'weight_decay': 8.408468537270205e-06, 'epochs': 80, 'loss': 'mse', 'optimizer': 'adam', 'graph_mode': 'cutoff', 'cutoff': 0.7678850259334351, 'grm_norm': 'none', 'self_loops': True, 'use_snp_selection': False}. Best is trial 77 with value: 0.30631818426543256.
[I 2025-12-09 16:04:43,077] Trial 84 finished with value: 0.2914085863675829 and parameters: {'model_type': 'graphsage', 'hidden_dims': '[256, 128, 64]', 'dropout': 0.5857098798921517, 'batch_norm': True, 'sage_aggr': 'max', 'sage_normalize': False, 'sage_project': False, 'lr': 0.000977985179999497, 'weight_decay': 0.0003972252811090658, 'epochs': 48, 'loss': 'mse', 'optimizer': 'adam', 'graph_mode': 'cutoff', 'cutoff': 0.5769728773101228, 'grm_norm': 'none', 'self_loops': True, 'use_snp_selection': False}. Best is trial 77 with value: 0.30631818426543256.
[I 2025-12-09 16:05:22,870] Trial 85 finished with value: 0.29656804947903137 and parameters: {'model_type': 'graphsage', 'hidden_dims': '[512, 256]', 'dropout': 0.5633719114379925, 'batch_norm': True, 'sage_aggr': 'max', 'sage_normalize': False, 'sage_project': False, 'lr': 0.0006761150325164253, 'weight_decay': 0.0001598403368146955, 'epochs': 66, 'loss': 'mse', 'optimizer': 'adam', 'graph_mode': 'cutoff', 'cutoff': 0.6662445108554069, 'grm_norm': 'none', 'self_loops': True, 'use_snp_selection': False}. Best is trial 77 with value: 0.30631818426543256.
[I 2025-12-09 16:05:59,086] Trial 86 finished with value: 0.300367231325341 and parameters: {'model_type': 'graphsage', 'hidden_dims': '[512, 256]', 'dropout': 0.525533396403349, 'batch_norm': True, 'sage_aggr': 'max', 'sage_normalize': False, 'sage_project': False, 'lr': 0.0013589234004436586, 'weight_decay': 4.380577443306539e-06, 'epochs': 55, 'loss': 'mse', 'optimizer': 'adam', 'graph_mode': 'cutoff', 'cutoff': 0.7142454274275705, 'grm_norm': 'cosine_then_gcn', 'self_loops': True, 'use_snp_selection': False}. Best is trial 77 with value: 0.30631818426543256.
[I 2025-12-09 16:06:35,712] Trial 87 finished with value: 0.295617922407725 and parameters: {'model_type': 'graphsage', 'hidden_dims': '[512, 256]', 'dropout': 0.4845051746434477, 'batch_norm': True, 'sage_aggr': 'max', 'sage_normalize': False, 'sage_project': False, 'lr': 0.0014362878003133888, 'weight_decay': 3.944317013828088e-06, 'epochs': 56, 'loss': 'mse', 'optimizer': 'adam', 'graph_mode': 'cutoff', 'cutoff': 0.7171089760897312, 'grm_norm': 'cosine_then_gcn', 'self_loops': True, 'use_snp_selection': False}. Best is trial 77 with value: 0.30631818426543256.
[I 2025-12-09 16:07:20,812] Trial 88 finished with value: 0.2981756443047022 and parameters: {'model_type': 'graphsage', 'hidden_dims': '[512, 256]', 'dropout': 0.47019957510476246, 'batch_norm': True, 'sage_aggr': 'mean', 'sage_normalize': False, 'sage_project': False, 'lr': 0.00048187045890659883, 'weight_decay': 5.200093124222157e-06, 'epochs': 76, 'loss': 'mse', 'optimizer': 'adam', 'graph_mode': 'cutoff', 'cutoff': 0.7510213424318036, 'grm_norm': 'cosine_then_gcn', 'self_loops': True, 'use_snp_selection': False}. Best is trial 77 with value: 0.30631818426543256.
[I 2025-12-09 16:08:00,481] Trial 89 finished with value: 0.30044237399272805 and parameters: {'model_type': 'graphsage', 'hidden_dims': '[512, 256]', 'dropout': 0.5190901543113301, 'batch_norm': True, 'sage_aggr': 'max', 'sage_normalize': False, 'sage_project': False, 'lr': 0.0009503899442944185, 'weight_decay': 1.1932092148591323e-05, 'epochs': 63, 'loss': 'mse', 'optimizer': 'adam', 'graph_mode': 'cutoff', 'cutoff': 0.6229876031106828, 'grm_norm': 'cosine_then_gcn', 'self_loops': True, 'use_snp_selection': False}. Best is trial 77 with value: 0.30631818426543256.
[I 2025-12-09 16:09:08,256] Trial 90 finished with value: 0.24879825428459154 and parameters: {'model_type': 'graphsage', 'hidden_dims': '[512, 256]', 'dropout': 0.12993351680432752, 'batch_norm': True, 'sage_aggr': 'max', 'sage_normalize': True, 'sage_project': False, 'lr': 0.0009591566350898394, 'weight_decay': 2.1196632766399606e-05, 'epochs': 89, 'loss': 'mae', 'optimizer': 'adam', 'graph_mode': 'knn', 'knn_k': 8, 'weighted_edges': False, 'symmetrize_mode': 'mutual', 'self_loops': True, 'use_snp_selection': False}. Best is trial 77 with value: 0.30631818426543256.
[I 2025-12-09 16:09:48,930] Trial 91 finished with value: 0.26504538927587146 and parameters: {'model_type': 'graphsage', 'hidden_dims': '[512, 256]', 'dropout': 0.5220955087641033, 'batch_norm': True, 'sage_aggr': 'max', 'sage_normalize': False, 'sage_project': False, 'lr': 0.0013855224160683123, 'weight_decay': 1.13573900417855e-05, 'epochs': 61, 'loss': 'mse', 'optimizer': 'adam', 'graph_mode': 'cutoff', 'cutoff': 0.5107208130448161, 'grm_norm': 'cosine_then_gcn', 'self_loops': True, 'use_snp_selection': False}. Best is trial 77 with value: 0.30631818426543256.
[I 2025-12-09 16:10:24,015] Trial 92 finished with value: 0.2995725320376617 and parameters: {'model_type': 'graphsage', 'hidden_dims': '[512, 256]', 'dropout': 0.5457649715721372, 'batch_norm': True, 'sage_aggr': 'max', 'sage_normalize': False, 'sage_project': False, 'lr': 0.0016490276655686737, 'weight_decay': 4.9869715180616456e-05, 'epochs': 52, 'loss': 'mse', 'optimizer': 'adam', 'graph_mode': 'cutoff', 'cutoff': 0.6214154873925959, 'grm_norm': 'cosine_then_gcn', 'self_loops': True, 'use_snp_selection': False}. Best is trial 77 with value: 0.30631818426543256.
[I 2025-12-09 16:11:06,539] Trial 93 finished with value: 0.2955307799962884 and parameters: {'model_type': 'graphsage', 'hidden_dims': '[512, 256]', 'dropout': 0.4943238342001729, 'batch_norm': True, 'sage_aggr': 'max', 'sage_normalize': False, 'sage_project': False, 'lr': 0.0005462459627883614, 'weight_decay': 1.1523346436370674e-06, 'epochs': 70, 'loss': 'mse', 'optimizer': 'adam', 'graph_mode': 'cutoff', 'cutoff': 0.6515190773106297, 'grm_norm': 'cosine_then_gcn', 'self_loops': True, 'use_snp_selection': False}. Best is trial 77 with value: 0.30631818426543256.
[I 2025-12-09 16:11:39,549] Trial 94 finished with value: 0.2942515183633187 and parameters: {'model_type': 'graphsage', 'hidden_dims': '[512, 256]', 'dropout': 0.5138911922475745, 'batch_norm': True, 'sage_aggr': 'max', 'sage_normalize': False, 'sage_project': False, 'lr': 6.532765423066437e-05, 'weight_decay': 3.3747576768983547e-06, 'epochs': 46, 'loss': 'mse', 'optimizer': 'adam', 'graph_mode': 'cutoff', 'cutoff': 0.5514075304219863, 'grm_norm': 'cosine_then_gcn', 'self_loops': True, 'use_snp_selection': False}. Best is trial 77 with value: 0.30631818426543256.
[I 2025-12-09 16:12:19,760] Trial 95 finished with value: 0.29491099850763086 and parameters: {'model_type': 'graphsage', 'hidden_dims': '[512, 64]', 'dropout': 0.4578543672580934, 'batch_norm': True, 'sage_aggr': 'max', 'sage_normalize': False, 'sage_project': False, 'lr': 0.0013081529217207225, 'weight_decay': 2.1151266505275255e-06, 'epochs': 65, 'loss': 'mse', 'optimizer': 'adam', 'graph_mode': 'cutoff', 'cutoff': 0.6981126323381992, 'grm_norm': 'cosine_then_gcn', 'self_loops': True, 'use_snp_selection': False}. Best is trial 77 with value: 0.30631818426543256.
[I 2025-12-09 16:12:36,890] Trial 96 finished with value: 0.30058330011800216 and parameters: {'model_type': 'graphsage', 'hidden_dims': '[128, 64]', 'dropout': 0.5573376248041303, 'batch_norm': True, 'sage_aggr': 'max', 'sage_normalize': False, 'sage_project': False, 'lr': 0.0006054460095979054, 'weight_decay': 5.76598924582604e-06, 'epochs': 55, 'loss': 'mse', 'optimizer': 'adam', 'graph_mode': 'cutoff', 'cutoff': 0.6683576690139431, 'grm_norm': 'gcn', 'self_loops': True, 'use_snp_selection': False}. Best is trial 77 with value: 0.30631818426543256.
[I 2025-12-09 16:12:57,547] Trial 97 finished with value: 0.29274514586286304 and parameters: {'model_type': 'graphsage', 'hidden_dims': '[128, 64]', 'dropout': 0.559311014530634, 'batch_norm': True, 'sage_aggr': 'max', 'sage_normalize': False, 'sage_project': False, 'lr': 0.0006434248731343625, 'weight_decay': 5.713598759210018e-06, 'epochs': 77, 'loss': 'mse', 'optimizer': 'adam', 'graph_mode': 'cutoff', 'cutoff': 0.6024727929645066, 'grm_norm': 'gcn', 'self_loops': True, 'use_snp_selection': False}. Best is trial 77 with value: 0.30631818426543256.
[I 2025-12-09 16:14:10,217] Trial 98 finished with value: 0.29326378652435514 and parameters: {'model_type': 'graphsage', 'hidden_dims': '[128, 64]', 'dropout': 0.5996178183937162, 'batch_norm': True, 'sage_aggr': 'max', 'sage_normalize': False, 'sage_project': False, 'lr': 0.0009217299074282169, 'weight_decay': 8.096269906323195e-06, 'epochs': 167, 'loss': 'mse', 'optimizer': 'adam', 'graph_mode': 'cutoff', 'cutoff': 0.6670551679429224, 'grm_norm': 'gcn', 'self_loops': True, 'use_snp_selection': True, 'num_snps': 57524}. Best is trial 77 with value: 0.30631818426543256.
[I 2025-12-09 16:14:27,018] Trial 99 finished with value: 0.0 and parameters: {'model_type': 'graphsage', 'hidden_dims': '[128, 64]', 'dropout': 0.539989930256324, 'batch_norm': False, 'sage_aggr': 'max', 'sage_normalize': False, 'sage_project': False, 'lr': 0.0003799563482042315, 'weight_decay': 1.359875291243895e-05, 'epochs': 54, 'loss': 'mse', 'optimizer': 'adam', 'graph_mode': 'cutoff', 'cutoff': 0.6806200327550755, 'grm_norm': 'gcn', 'self_loops': False, 'use_snp_selection': False}. Best is trial 77 with value: 0.30631818426543256.
[I 2025-12-09 16:14:44,831] Trial 100 finished with value: 0.2998555397327791 and parameters: {'model_type': 'graphsage', 'hidden_dims': '[128, 64]', 'dropout': 0.576820571585073, 'batch_norm': True, 'sage_aggr': 'max', 'sage_normalize': False, 'sage_project': False, 'lr': 0.0007030089552515252, 'weight_decay': 2.564217176043957e-06, 'epochs': 59, 'loss': 'mse', 'optimizer': 'adam', 'graph_mode': 'cutoff', 'cutoff': 0.6324342436104881, 'grm_norm': 'gcn', 'self_loops': True, 'use_snp_selection': False}. Best is trial 77 with value: 0.30631818426543256.
[I 2025-12-09 16:15:18,471] Trial 101 finished with value: 0.29919205324129583 and parameters: {'model_type': 'graphsage', 'hidden_dims': '[512, 128]', 'dropout': 0.3567372912101144, 'batch_norm': True, 'sage_aggr': 'max', 'sage_normalize': False, 'sage_project': False, 'lr': 0.00044259459963173005, 'weight_decay': 4.884693637398605e-06, 'epochs': 49, 'loss': 'mse', 'optimizer': 'adam', 'graph_mode': 'cutoff', 'cutoff': 0.812231785834837, 'grm_norm': 'cosine_then_gcn', 'self_loops': True, 'use_snp_selection': False}. Best is trial 77 with value: 0.30631818426543256.
[I 2025-12-09 16:16:00,479] Trial 102 finished with value: 0.29110286917626055 and parameters: {'model_type': 'graphsage', 'hidden_dims': '[512, 256]', 'dropout': 0.3252233204950101, 'batch_norm': True, 'sage_aggr': 'max', 'sage_normalize': False, 'sage_project': False, 'lr': 0.001101661239443296, 'weight_decay': 6.784993177183503e-06, 'epochs': 69, 'loss': 'mse', 'optimizer': 'adam', 'graph_mode': 'cutoff', 'cutoff': 0.7236373135287552, 'grm_norm': 'cosine_then_gcn', 'self_loops': True, 'use_snp_selection': False}. Best is trial 77 with value: 0.30631818426543256.
[I 2025-12-09 16:16:16,554] Trial 103 finished with value: 0.30540145352469444 and parameters: {'model_type': 'graphsage', 'hidden_dims': '[128, 64]', 'dropout': 0.49864154476097006, 'batch_norm': True, 'sage_aggr': 'max', 'sage_normalize': False, 'sage_project': False, 'lr': 0.002520178676076972, 'weight_decay': 0.0007815730336802719, 'epochs': 40, 'loss': 'mse', 'optimizer': 'adam', 'graph_mode': 'cutoff', 'cutoff': 0.7078362099218558, 'grm_norm': 'cosine_then_gcn', 'self_loops': True, 'use_snp_selection': False}. Best is trial 77 with value: 0.30631818426543256.
[I 2025-12-09 16:16:38,524] Trial 104 finished with value: 0.29851190111230463 and parameters: {'model_type': 'graphsage', 'hidden_dims': '[128, 64]', 'dropout': 0.5018191935113272, 'batch_norm': True, 'sage_aggr': 'max', 'sage_normalize': False, 'sage_project': False, 'lr': 0.0020201471843414535, 'weight_decay': 0.0008659766110073587, 'epochs': 83, 'loss': 'mse', 'optimizer': 'adam', 'graph_mode': 'cutoff', 'cutoff': 0.7063860731791652, 'grm_norm': 'cosine_then_gcn', 'self_loops': True, 'use_snp_selection': False}. Best is trial 77 with value: 0.30631818426543256.
[I 2025-12-09 16:16:55,796] Trial 105 finished with value: 0.3012815242493656 and parameters: {'model_type': 'graphsage', 'hidden_dims': '[128, 64]', 'dropout': 0.5212360240681148, 'batch_norm': True, 'sage_aggr': 'max', 'sage_normalize': False, 'sage_project': False, 'lr': 0.0008015364721537573, 'weight_decay': 3.4099934516125374e-06, 'epochs': 56, 'loss': 'mse', 'optimizer': 'adam', 'graph_mode': 'cutoff', 'cutoff': 0.7532550461568879, 'grm_norm': 'gcn', 'self_loops': True, 'use_snp_selection': False}. Best is trial 77 with value: 0.30631818426543256.
[I 2025-12-09 16:17:13,157] Trial 106 finished with value: 0.30182853694240297 and parameters: {'model_type': 'graphsage', 'hidden_dims': '[128, 64]', 'dropout': 0.5221778300497433, 'batch_norm': True, 'sage_aggr': 'max', 'sage_normalize': False, 'sage_project': False, 'lr': 0.0005869589507203495, 'weight_decay': 9.293455218961073e-06, 'epochs': 56, 'loss': 'mse', 'optimizer': 'adam', 'graph_mode': 'cutoff', 'cutoff': 0.6607188605983525, 'grm_norm': 'gcn', 'self_loops': True, 'use_snp_selection': False}. Best is trial 77 with value: 0.30631818426543256.
[I 2025-12-09 16:17:37,271] Trial 107 finished with value: 0.28770499439113983 and parameters: {'model_type': 'graphsage', 'hidden_dims': '[128, 64]', 'dropout': 0.5216014740711531, 'batch_norm': True, 'sage_aggr': 'max', 'sage_normalize': False, 'sage_project': False, 'lr': 0.0005980874340249273, 'weight_decay': 1.0182749128591108e-05, 'epochs': 97, 'loss': 'mse', 'optimizer': 'adam', 'graph_mode': 'cutoff', 'cutoff': 0.5746306025860811, 'grm_norm': 'gcn', 'self_loops': True, 'use_snp_selection': False}. Best is trial 77 with value: 0.30631818426543256.
[I 2025-12-09 16:17:55,713] Trial 108 finished with value: 0.29673798002243007 and parameters: {'model_type': 'graphsage', 'hidden_dims': '[128, 64]', 'dropout': 0.5445771614701895, 'batch_norm': True, 'sage_aggr': 'max', 'sage_normalize': False, 'sage_project': False, 'lr': 0.00029838484210558314, 'weight_decay': 1.6138477776721788e-05, 'epochs': 64, 'loss': 'mse', 'optimizer': 'adam', 'graph_mode': 'cutoff', 'cutoff': 0.666852141550129, 'grm_norm': 'gcn', 'self_loops': True, 'use_snp_selection': False}. Best is trial 77 with value: 0.30631818426543256.
[I 2025-12-09 16:18:12,815] Trial 109 finished with value: 0.2975118019080196 and parameters: {'model_type': 'graphsage', 'hidden_dims': '[128, 64]', 'dropout': 0.5263437262169063, 'batch_norm': True, 'sage_aggr': 'mean', 'sage_normalize': False, 'sage_project': False, 'lr': 0.0007679343693853626, 'weight_decay': 2.8497319446531403e-05, 'epochs': 54, 'loss': 'mse', 'optimizer': 'adam', 'graph_mode': 'cutoff', 'cutoff': 0.6404055785297457, 'grm_norm': 'gcn', 'self_loops': True, 'use_snp_selection': False}. Best is trial 77 with value: 0.30631818426543256.
[I 2025-12-09 16:18:28,711] Trial 110 finished with value: 0.30316722330363444 and parameters: {'model_type': 'graphsage', 'hidden_dims': '[128, 64]', 'dropout': 0.5654420180752958, 'batch_norm': True, 'sage_aggr': 'max', 'sage_normalize': False, 'sage_project': False, 'lr': 0.0004546620471990918, 'weight_decay': 3.5711937185637107e-06, 'epochs': 47, 'loss': 'mse', 'optimizer': 'adam', 'graph_mode': 'cutoff', 'cutoff': 0.6593942589503509, 'grm_norm': 'gcn', 'self_loops': True, 'use_snp_selection': False}. Best is trial 77 with value: 0.30631818426543256.
[I 2025-12-09 16:18:44,681] Trial 111 finished with value: 0.3009795050482548 and parameters: {'model_type': 'graphsage', 'hidden_dims': '[128, 64]', 'dropout': 0.5739611023163196, 'batch_norm': True, 'sage_aggr': 'max', 'sage_normalize': False, 'sage_project': False, 'lr': 0.00044749696105446943, 'weight_decay': 3.8145440428535593e-06, 'epochs': 48, 'loss': 'mse', 'optimizer': 'adam', 'graph_mode': 'cutoff', 'cutoff': 0.6888008961521452, 'grm_norm': 'gcn', 'self_loops': True, 'use_snp_selection': False}. Best is trial 77 with value: 0.30631818426543256.
[I 2025-12-09 16:19:04,151] Trial 112 finished with value: 0.29124041245647253 and parameters: {'model_type': 'graphsage', 'hidden_dims': '[128, 64]', 'dropout': 0.5702607480995076, 'batch_norm': True, 'sage_aggr': 'max', 'sage_normalize': False, 'sage_project': False, 'lr': 0.0003443864787708767, 'weight_decay': 3.3802660200468037e-06, 'epochs': 73, 'loss': 'mse', 'optimizer': 'adam', 'graph_mode': 'cutoff', 'cutoff': 0.6886540284330895, 'grm_norm': 'gcn', 'self_loops': True, 'use_snp_selection': False}. Best is trial 77 with value: 0.30631818426543256.
[I 2025-12-09 16:19:21,863] Trial 113 finished with value: 0.2973187800942352 and parameters: {'model_type': 'graphsage', 'hidden_dims': '[128, 64]', 'dropout': 0.5585421545456586, 'batch_norm': True, 'sage_aggr': 'max', 'sage_normalize': False, 'sage_project': False, 'lr': 0.0004657029798433742, 'weight_decay': 6.72926818243432e-06, 'epochs': 60, 'loss': 'mse', 'optimizer': 'adam', 'graph_mode': 'cutoff', 'cutoff': 0.6636891141957917, 'grm_norm': 'gcn', 'self_loops': True, 'use_snp_selection': False}. Best is trial 77 with value: 0.30631818426543256.
[I 2025-12-09 16:19:37,557] Trial 114 finished with value: 0.3034945554040224 and parameters: {'model_type': 'graphsage', 'hidden_dims': '[128, 64]', 'dropout': 0.5154472553882087, 'batch_norm': True, 'sage_aggr': 'max', 'sage_normalize': False, 'sage_project': False, 'lr': 0.0005450877093745042, 'weight_decay': 4.022660754635704e-06, 'epochs': 45, 'loss': 'mse', 'optimizer': 'adam', 'graph_mode': 'cutoff', 'cutoff': 0.6523907390366468, 'grm_norm': 'gcn', 'self_loops': True, 'use_snp_selection': False}. Best is trial 77 with value: 0.30631818426543256.
[I 2025-12-09 16:19:53,110] Trial 115 finished with value: 0.29579637684974613 and parameters: {'model_type': 'graphsage', 'hidden_dims': '[128, 64]', 'dropout': 0.5332166078538295, 'batch_norm': True, 'sage_aggr': 'max', 'sage_normalize': False, 'sage_project': False, 'lr': 0.0002645764890387701, 'weight_decay': 3.110393558781354e-06, 'epochs': 44, 'loss': 'mse', 'optimizer': 'adam', 'graph_mode': 'cutoff', 'cutoff': 0.6314365143154407, 'grm_norm': 'gcn', 'self_loops': True, 'use_snp_selection': False}. Best is trial 77 with value: 0.30631818426543256.
[I 2025-12-09 16:20:32,469] Trial 116 finished with value: 0.17067335292710215 and parameters: {'model_type': 'graphsage', 'hidden_dims': '[128, 64]', 'dropout': 0.5130660421956836, 'batch_norm': True, 'sage_aggr': 'max', 'sage_normalize': True, 'sage_project': False, 'lr': 0.0005552962895450879, 'weight_decay': 2.725389112366836e-06, 'epochs': 40, 'loss': 'mae', 'optimizer': 'adam', 'graph_mode': 'knn', 'knn_k': 10, 'weighted_edges': True, 'symmetrize_mode': 'union', 'self_loops': True, 'use_snp_selection': False}. Best is trial 77 with value: 0.30631818426543256.
[I 2025-12-09 16:20:50,077] Trial 117 finished with value: 0.2679345567985564 and parameters: {'model_type': 'graphsage', 'hidden_dims': '[128, 64]', 'dropout': 0.49858937871966946, 'batch_norm': True, 'sage_aggr': 'max', 'sage_normalize': False, 'sage_project': False, 'lr': 0.00019637968730386638, 'weight_decay': 1.8266949854819047e-06, 'epochs': 49, 'loss': 'mse', 'optimizer': 'adam', 'graph_mode': 'cutoff', 'cutoff': 0.5309676549409387, 'grm_norm': 'gcn', 'self_loops': True, 'use_snp_selection': False}. Best is trial 77 with value: 0.30631818426543256.
[I 2025-12-09 16:21:08,701] Trial 118 finished with value: 0.2966140755491763 and parameters: {'model_type': 'graphsage', 'hidden_dims': '[128, 64]', 'dropout': 0.5821359541372151, 'batch_norm': True, 'sage_aggr': 'max', 'sage_normalize': False, 'sage_project': False, 'lr': 0.0003753941449951928, 'weight_decay': 1.1582102531631045e-06, 'epochs': 66, 'loss': 'mse', 'optimizer': 'adam', 'graph_mode': 'cutoff', 'cutoff': 0.6482885390523545, 'grm_norm': 'gcn', 'self_loops': True, 'use_snp_selection': False}. Best is trial 77 with value: 0.30631818426543256.
[I 2025-12-09 16:21:55,047] Trial 119 finished with value: 0.2866285543601449 and parameters: {'model_type': 'graphsage', 'hidden_dims': '[128, 64]', 'dropout': 0.5449665971056333, 'batch_norm': True, 'sage_aggr': 'max', 'sage_normalize': False, 'sage_project': False, 'lr': 0.0005101794197945516, 'weight_decay': 3.937748800848808e-06, 'epochs': 74, 'loss': 'mse', 'optimizer': 'adam', 'graph_mode': 'cutoff', 'cutoff': 0.5889326599651012, 'grm_norm': 'gcn', 'self_loops': False, 'use_snp_selection': True, 'num_snps': 40648}. Best is trial 77 with value: 0.30631818426543256.
