[I 2025-12-08 11:59:20,551] Trial 75 finished with value: 0.26980456633258265 and parameters: {'model_type': 'graphsage', 'hidden_dims': '[512, 128]', 'dropout': 0.3120914220939023, 'batch_norm': True, 'sage_aggr': 'mean', 'sage_normalize': True, 'sage_project': False, 'lr': 0.0020984603384222346, 'weight_decay': 2.229616626341669e-05, 'epochs': 151, 'loss': 'mse', 'optimizer': 'adam', 'graph_mode': 'knn', 'knn_k': 1, 'weighted_edges': True, 'symmetrize_mode': 'union', 'self_loops': True, 'use_snp_selection': False}. Best is trial 57 with value: 0.28025014439599605.
[I 2025-12-08 12:00:51,649] Trial 76 finished with value: 0.277957202594751 and parameters: {'model_type': 'graphsage', 'hidden_dims': '[512, 128]', 'dropout': 0.2177593081137183, 'batch_norm': True, 'sage_aggr': 'mean', 'sage_normalize': True, 'sage_project': False, 'lr': 0.0012946465543543235, 'weight_decay': 0.00016607240215282189, 'epochs': 154, 'loss': 'mse', 'optimizer': 'adam', 'graph_mode': 'cutoff', 'cutoff': 0.339432895221382, 'grm_norm': 'cosine', 'self_loops': True, 'use_snp_selection': False}. Best is trial 57 with value: 0.28025014439599605.
[I 2025-12-08 12:02:07,297] Trial 77 finished with value: 0.2705627956223683 and parameters: {'model_type': 'graphsage', 'hidden_dims': '[512, 128]', 'dropout': 0.18484329071874178, 'batch_norm': True, 'sage_aggr': 'mean', 'sage_normalize': True, 'sage_project': False, 'lr': 0.0054104258381464055, 'weight_decay': 0.00019160576818165605, 'epochs': 117, 'loss': 'mse', 'optimizer': 'adam', 'graph_mode': 'cutoff', 'cutoff': 0.30127955452333904, 'grm_norm': 'cosine', 'self_loops': True, 'use_snp_selection': False}. Best is trial 57 with value: 0.28025014439599605.
[I 2025-12-08 12:03:23,433] Trial 78 finished with value: 0.2311294447250925 and parameters: {'model_type': 'graphsage', 'hidden_dims': '[512, 128]', 'dropout': 0.13220284741433622, 'batch_norm': False, 'sage_aggr': 'mean', 'sage_normalize': True, 'sage_project': False, 'lr': 0.0012425051966866638, 'weight_decay': 8.639102125629946e-05, 'epochs': 126, 'loss': 'mse', 'optimizer': 'adam', 'graph_mode': 'cutoff', 'cutoff': 0.3471495206067863, 'grm_norm': 'cosine', 'self_loops': True, 'use_snp_selection': False}. Best is trial 57 with value: 0.28025014439599605.
[I 2025-12-08 12:04:27,553] Trial 79 finished with value: 0.2719720682114751 and parameters: {'model_type': 'graphsage', 'hidden_dims': '[512, 128]', 'dropout': 0.3620382057484877, 'batch_norm': True, 'sage_aggr': 'mean', 'sage_normalize': True, 'sage_project': False, 'lr': 0.0006791636620416199, 'weight_decay': 0.0003396330212653616, 'epochs': 103, 'loss': 'mse', 'optimizer': 'adam', 'graph_mode': 'cutoff', 'cutoff': 0.36703774273391754, 'grm_norm': 'cosine', 'self_loops': True, 'use_snp_selection': False}. Best is trial 57 with value: 0.28025014439599605.
[I 2025-12-08 12:05:55,913] Trial 80 finished with value: 0.2732916259591365 and parameters: {'model_type': 'graphsage', 'hidden_dims': '[512, 128]', 'dropout': 0.2203671234005397, 'batch_norm': True, 'sage_aggr': 'mean', 'sage_normalize': True, 'sage_project': False, 'lr': 0.00046840525815804477, 'weight_decay': 0.00015664388292714387, 'epochs': 147, 'loss': 'mse', 'optimizer': 'adam', 'graph_mode': 'cutoff', 'cutoff': 0.32602237380107807, 'grm_norm': 'cosine', 'self_loops': True, 'use_snp_selection': False}. Best is trial 57 with value: 0.28025014439599605.
[I 2025-12-08 12:07:22,827] Trial 81 finished with value: 0.2770740378201994 and parameters: {'model_type': 'graphsage', 'hidden_dims': '[512, 128]', 'dropout': 0.2442307139002376, 'batch_norm': True, 'sage_aggr': 'mean', 'sage_normalize': True, 'sage_project': False, 'lr': 0.0021422588562470374, 'weight_decay': 3.5765471605199975e-05, 'epochs': 155, 'loss': 'mse', 'optimizer': 'adam', 'graph_mode': 'cutoff', 'cutoff': 0.4807448727573341, 'grm_norm': 'cosine', 'self_loops': True, 'use_snp_selection': False}. Best is trial 57 with value: 0.28025014439599605.
[I 2025-12-08 12:09:49,614] Trial 82 finished with value: 0.2752175358434099 and parameters: {'model_type': 'graphsage', 'hidden_dims': '[512, 128]', 'dropout': 0.26726530873860527, 'batch_norm': True, 'sage_aggr': 'mean', 'sage_normalize': True, 'sage_project': False, 'lr': 0.0033411175129195673, 'weight_decay': 2.3252400565643924e-05, 'epochs': 174, 'loss': 'mse', 'optimizer': 'adam', 'graph_mode': 'cutoff', 'cutoff': 0.2082113491839692, 'grm_norm': 'cosine', 'self_loops': True, 'use_snp_selection': False}. Best is trial 57 with value: 0.28025014439599605.
[I 2025-12-08 12:11:10,469] Trial 83 finished with value: 0.27550532258949784 and parameters: {'model_type': 'graphsage', 'hidden_dims': '[512, 128]', 'dropout': 0.3223230748854218, 'batch_norm': True, 'sage_aggr': 'mean', 'sage_normalize': True, 'sage_project': False, 'lr': 0.0013335084867173326, 'weight_decay': 4.813268625101766e-05, 'epochs': 141, 'loss': 'mse', 'optimizer': 'adam', 'graph_mode': 'cutoff', 'cutoff': 0.46236226530768354, 'grm_norm': 'cosine', 'self_loops': True, 'use_snp_selection': False}. Best is trial 57 with value: 0.28025014439599605.
[I 2025-12-08 12:12:35,659] Trial 84 finished with value: 0.2757549789279415 and parameters: {'model_type': 'graphsage', 'hidden_dims': '[512, 128]', 'dropout': 0.2125046254903171, 'batch_norm': True, 'sage_aggr': 'mean', 'sage_normalize': True, 'sage_project': False, 'lr': 0.002047025285699622, 'weight_decay': 6.883647536899676e-05, 'epochs': 166, 'loss': 'mse', 'optimizer': 'adam', 'graph_mode': 'cutoff', 'cutoff': 0.53313261276135, 'grm_norm': 'cosine', 'self_loops': True, 'use_snp_selection': False}. Best is trial 57 with value: 0.28025014439599605.
[I 2025-12-08 12:14:20,650] Trial 85 finished with value: 0.27922585217741114 and parameters: {'model_type': 'graphsage', 'hidden_dims': '[512, 64]', 'dropout': 0.29194964618495656, 'batch_norm': True, 'sage_aggr': 'mean', 'sage_normalize': True, 'sage_project': False, 'lr': 0.0025355135074770076, 'weight_decay': 3.2842633149912085e-05, 'epochs': 187, 'loss': 'mse', 'optimizer': 'adam', 'graph_mode': 'cutoff', 'cutoff': 0.3869082958606651, 'grm_norm': 'cosine', 'self_loops': True, 'use_snp_selection': False}. Best is trial 57 with value: 0.28025014439599605.
[I 2025-12-08 12:16:03,726] Trial 86 finished with value: 0.27178460552240374 and parameters: {'model_type': 'graphsage', 'hidden_dims': '[512, 64]', 'dropout': 0.2992101378770396, 'batch_norm': True, 'sage_aggr': 'mean', 'sage_normalize': True, 'sage_project': False, 'lr': 0.0008822605334105133, 'weight_decay': 1.752168375919129e-05, 'epochs': 188, 'loss': 'mse', 'optimizer': 'adam', 'graph_mode': 'knn', 'knn_k': 3, 'weighted_edges': False, 'symmetrize_mode': 'mutual', 'self_loops': True, 'use_snp_selection': False}. Best is trial 57 with value: 0.28025014439599605.
[I 2025-12-08 12:18:06,072] Trial 87 finished with value: 0.26763779767169893 and parameters: {'model_type': 'graphsage', 'hidden_dims': '[512, 64]', 'dropout': 0.2858697713732054, 'batch_norm': True, 'sage_aggr': 'mean', 'sage_normalize': True, 'sage_project': False, 'lr': 0.00502828624087739, 'weight_decay': 8.441543685783478e-05, 'epochs': 221, 'loss': 'mse', 'optimizer': 'adam', 'graph_mode': 'cutoff', 'cutoff': 0.3843305030859216, 'grm_norm': 'gcn', 'self_loops': True, 'use_snp_selection': False}. Best is trial 57 with value: 0.28025014439599605.
[I 2025-12-08 12:19:52,892] Trial 88 finished with value: 0.27723852287783535 and parameters: {'model_type': 'graphsage', 'hidden_dims': '[512, 64]', 'dropout': 0.41285895208842177, 'batch_norm': True, 'sage_aggr': 'mean', 'sage_normalize': True, 'sage_project': False, 'lr': 0.0033373589056387965, 'weight_decay': 3.604439820129235e-05, 'epochs': 193, 'loss': 'mse', 'optimizer': 'adam', 'graph_mode': 'cutoff', 'cutoff': 0.42619563947150707, 'grm_norm': 'cosine', 'self_loops': True, 'use_snp_selection': False}. Best is trial 57 with value: 0.28025014439599605.
[I 2025-12-08 12:20:28,888] Trial 89 finished with value: 0.2186454366531375 and parameters: {'model_type': 'graphsage', 'hidden_dims': '[512, 64]', 'dropout': 0.3681040986890671, 'batch_norm': False, 'sage_aggr': 'mean', 'sage_normalize': True, 'sage_project': False, 'lr': 0.002615310962119568, 'weight_decay': 0.0007706807132749149, 'epochs': 179, 'loss': 'mse', 'optimizer': 'adam', 'graph_mode': 'cutoff', 'cutoff': 0.3471408124670563, 'grm_norm': 'cosine', 'self_loops': True, 'use_snp_selection': True, 'num_snps': 5103}. Best is trial 57 with value: 0.28025014439599605.
[I 2025-12-08 12:22:23,634] Trial 90 finished with value: 0.25979430951496846 and parameters: {'model_type': 'graphsage', 'hidden_dims': '[512, 256]', 'dropout': 0.38374420013868704, 'batch_norm': True, 'sage_aggr': 'max', 'sage_normalize': True, 'sage_project': False, 'lr': 0.0017575661304198211, 'weight_decay': 0.00011029014060917336, 'epochs': 201, 'loss': 'mse', 'optimizer': 'adam', 'graph_mode': 'cutoff', 'cutoff': 0.3999951138773874, 'grm_norm': 'cosine', 'self_loops': True, 'use_snp_selection': False}. Best is trial 57 with value: 0.28025014439599605.
[I 2025-12-08 12:24:07,913] Trial 91 finished with value: 0.2742095670881599 and parameters: {'model_type': 'graphsage', 'hidden_dims': '[512, 64]', 'dropout': 0.4108290810094028, 'batch_norm': True, 'sage_aggr': 'mean', 'sage_normalize': True, 'sage_project': False, 'lr': 0.003471057184418226, 'weight_decay': 3.567597887188045e-05, 'epochs': 188, 'loss': 'mse', 'optimizer': 'adam', 'graph_mode': 'cutoff', 'cutoff': 0.42494839031868054, 'grm_norm': 'cosine', 'self_loops': True, 'use_snp_selection': False}. Best is trial 57 with value: 0.28025014439599605.
[I 2025-12-08 12:25:54,757] Trial 92 finished with value: 0.27908183341404424 and parameters: {'model_type': 'graphsage', 'hidden_dims': '[512, 64]', 'dropout': 0.34451253120365977, 'batch_norm': True, 'sage_aggr': 'mean', 'sage_normalize': True, 'sage_project': False, 'lr': 0.002758481700520482, 'weight_decay': 5.203416965850213e-05, 'epochs': 194, 'loss': 'mse', 'optimizer': 'adam', 'graph_mode': 'cutoff', 'cutoff': 0.4456601656595343, 'grm_norm': 'cosine', 'self_loops': True, 'use_snp_selection': False}. Best is trial 57 with value: 0.28025014439599605.
[I 2025-12-08 12:27:40,778] Trial 93 finished with value: 0.2738400576133619 and parameters: {'model_type': 'graphsage', 'hidden_dims': '[512, 64]', 'dropout': 0.3412117800313638, 'batch_norm': True, 'sage_aggr': 'mean', 'sage_normalize': True, 'sage_project': False, 'lr': 0.001912290779199405, 'weight_decay': 1.7935274617814275e-05, 'epochs': 196, 'loss': 'mse', 'optimizer': 'adam', 'graph_mode': 'cutoff', 'cutoff': 0.48740871683453235, 'grm_norm': 'cosine', 'self_loops': True, 'use_snp_selection': False}. Best is trial 57 with value: 0.28025014439599605.
[I 2025-12-08 12:29:17,016] Trial 94 finished with value: 0.27785742739392344 and parameters: {'model_type': 'graphsage', 'hidden_dims': '[512, 128]', 'dropout': 0.30859560224160454, 'batch_norm': True, 'sage_aggr': 'mean', 'sage_normalize': True, 'sage_project': False, 'lr': 0.0025330354096780396, 'weight_decay': 5.042947349125794e-05, 'epochs': 172, 'loss': 'mse', 'optimizer': 'adam', 'graph_mode': 'cutoff', 'cutoff': 0.446648752227895, 'grm_norm': 'cosine', 'self_loops': True, 'use_snp_selection': False}. Best is trial 57 with value: 0.28025014439599605.
[I 2025-12-08 12:30:52,672] Trial 95 finished with value: 0.27726388842829425 and parameters: {'model_type': 'graphsage', 'hidden_dims': '[512, 128]', 'dropout': 0.30482644895889927, 'batch_norm': True, 'sage_aggr': 'mean', 'sage_normalize': True, 'sage_project': False, 'lr': 0.0008845483056536585, 'weight_decay': 8.76009200135804e-06, 'epochs': 171, 'loss': 'mse', 'optimizer': 'adam', 'graph_mode': 'cutoff', 'cutoff': 0.45060827242776447, 'grm_norm': 'cosine', 'self_loops': True, 'use_snp_selection': False}. Best is trial 57 with value: 0.28025014439599605.
[I 2025-12-08 12:32:02,062] Trial 96 finished with value: 0.27462406332276074 and parameters: {'model_type': 'graphsage', 'hidden_dims': '[256, 128]', 'dropout': 0.32741681226350794, 'batch_norm': True, 'sage_aggr': 'mean', 'sage_normalize': True, 'sage_project': False, 'lr': 0.0013883640435032628, 'weight_decay': 4.7151850770010556e-05, 'epochs': 227, 'loss': 'mae', 'optimizer': 'adam', 'graph_mode': 'cutoff', 'cutoff': 0.5108521758953621, 'grm_norm': 'cosine', 'self_loops': True, 'use_snp_selection': False}. Best is trial 57 with value: 0.28025014439599605.
[I 2025-12-08 12:34:15,553] Trial 97 finished with value: 0.2763087364173466 and parameters: {'model_type': 'graphsage', 'hidden_dims': '[512, 64]', 'dropout': 0.2767863683179981, 'batch_norm': True, 'sage_aggr': 'mean', 'sage_normalize': True, 'sage_project': False, 'lr': 0.002593737920953841, 'weight_decay': 2.4280302561934607e-05, 'epochs': 249, 'loss': 'mse', 'optimizer': 'adam', 'graph_mode': 'cutoff', 'cutoff': 0.438124738035108, 'grm_norm': 'cosine', 'self_loops': True, 'use_snp_selection': False}. Best is trial 57 with value: 0.28025014439599605.
[I 2025-12-08 12:35:15,492] Trial 98 finished with value: 0.26799363704764756 and parameters: {'model_type': 'graphsage', 'hidden_dims': '[256, 128, 64]', 'dropout': 0.3456112297673123, 'batch_norm': True, 'sage_aggr': 'mean', 'sage_normalize': True, 'sage_project': False, 'lr': 0.0011999774573393214, 'weight_decay': 0.0001351531037628199, 'epochs': 161, 'loss': 'mse', 'optimizer': 'adam', 'graph_mode': 'cutoff', 'cutoff': 0.38867045343009055, 'grm_norm': 'cosine', 'self_loops': True, 'use_snp_selection': False}. Best is trial 57 with value: 0.28025014439599605.
[I 2025-12-08 12:36:46,742] Trial 99 finished with value: 0.28048923033339085 and parameters: {'model_type': 'graphsage', 'hidden_dims': '[512, 128]', 'dropout': 0.31656223828608193, 'batch_norm': True, 'sage_aggr': 'mean', 'sage_normalize': True, 'sage_project': False, 'lr': 0.0018935853956423823, 'weight_decay': 5.2344385513294714e-05, 'epochs': 179, 'loss': 'mse', 'optimizer': 'adam', 'graph_mode': 'cutoff', 'cutoff': 0.5279776789570411, 'grm_norm': 'cosine', 'self_loops': True, 'use_snp_selection': False}. Best is trial 99 with value: 0.28048923033339085.
[I 2025-12-08 12:37:36,414] Trial 100 finished with value: 0.2630649176815105 and parameters: {'model_type': 'graphsage', 'hidden_dims': '[512, 128]', 'dropout': 0.26336900333764307, 'batch_norm': True, 'sage_aggr': 'mean', 'sage_normalize': True, 'sage_project': False, 'lr': 0.0010544872771455715, 'weight_decay': 0.0002095083039620869, 'epochs': 150, 'loss': 'mse', 'optimizer': 'adam', 'graph_mode': 'cutoff', 'cutoff': 0.6022296418552918, 'grm_norm': 'none', 'self_loops': True, 'use_snp_selection': True, 'num_snps': 17522}. Best is trial 99 with value: 0.28048923033339085.
[I 2025-12-08 12:39:29,414] Trial 101 finished with value: 0.28128419225328816 and parameters: {'model_type': 'graphsage', 'hidden_dims': '[512, 128]', 'dropout': 0.317446288963811, 'batch_norm': True, 'sage_aggr': 'mean', 'sage_normalize': True, 'sage_project': False, 'lr': 0.0018411535533420218, 'weight_decay': 5.5848224827437854e-05, 'epochs': 206, 'loss': 'mse', 'optimizer': 'adam', 'graph_mode': 'cutoff', 'cutoff': 0.42375771350494157, 'grm_norm': 'cosine', 'self_loops': True, 'use_snp_selection': False}. Best is trial 101 with value: 0.28128419225328816.
[I 2025-12-08 12:40:44,354] Trial 102 finished with value: 0.2769321173567543 and parameters: {'model_type': 'graphsage', 'hidden_dims': '[512, 128]', 'dropout': 0.31629454126476053, 'batch_norm': True, 'sage_aggr': 'mean', 'sage_normalize': True, 'sage_project': False, 'lr': 0.0018474899033454385, 'weight_decay': 8.850196166607789e-05, 'epochs': 141, 'loss': 'mse', 'optimizer': 'adam', 'graph_mode': 'cutoff', 'cutoff': 0.5234163285387581, 'grm_norm': 'cosine', 'self_loops': True, 'use_snp_selection': False}. Best is trial 101 with value: 0.28128419225328816.
[I 2025-12-08 12:42:24,576] Trial 103 finished with value: 0.28128692543870815 and parameters: {'model_type': 'graphsage', 'hidden_dims': '[512, 128]', 'dropout': 0.3318570373272894, 'batch_norm': True, 'sage_aggr': 'mean', 'sage_normalize': True, 'sage_project': False, 'lr': 0.0024895568111616066, 'weight_decay': 6.734340628511309e-05, 'epochs': 179, 'loss': 'mse', 'optimizer': 'adam', 'graph_mode': 'cutoff', 'cutoff': 0.4172614865634191, 'grm_norm': 'cosine', 'self_loops': True, 'use_snp_selection': False}. Best is trial 103 with value: 0.28128692543870815.
[I 2025-12-08 12:44:03,519] Trial 104 finished with value: 0.2786766732820444 and parameters: {'model_type': 'graphsage', 'hidden_dims': '[512, 128]', 'dropout': 0.3268326920061108, 'batch_norm': True, 'sage_aggr': 'mean', 'sage_normalize': True, 'sage_project': False, 'lr': 0.0015658671203871606, 'weight_decay': 5.5592399012776595e-05, 'epochs': 182, 'loss': 'mse', 'optimizer': 'adam', 'graph_mode': 'cutoff', 'cutoff': 0.491614766275601, 'grm_norm': 'gcn', 'self_loops': True, 'use_snp_selection': False}. Best is trial 103 with value: 0.28128692543870815.
[I 2025-12-08 12:45:45,217] Trial 105 finished with value: 0.2749318975457949 and parameters: {'model_type': 'graphsage', 'hidden_dims': '[512, 128]', 'dropout': 0.32803817857461914, 'batch_norm': True, 'sage_aggr': 'mean', 'sage_normalize': True, 'sage_project': False, 'lr': 0.0014802512653499746, 'weight_decay': 6.972648243241147e-05, 'epochs': 181, 'loss': 'mse', 'optimizer': 'adam', 'graph_mode': 'cutoff', 'cutoff': 0.4138162447991548, 'grm_norm': 'gcn', 'self_loops': True, 'use_snp_selection': False}. Best is trial 103 with value: 0.28128692543870815.
[I 2025-12-08 12:48:45,036] Trial 106 finished with value: 0.25970146438515973 and parameters: {'model_type': 'graphsage', 'hidden_dims': '[512, 64]', 'dropout': 0.35104745686244365, 'batch_norm': True, 'sage_aggr': 'mean', 'sage_normalize': True, 'sage_project': False, 'lr': 0.001014179964895712, 'weight_decay': 0.00012880073558015832, 'epochs': 218, 'loss': 'mse', 'optimizer': 'adam', 'graph_mode': 'knn', 'knn_k': 7, 'weighted_edges': True, 'symmetrize_mode': 'union', 'self_loops': True, 'use_snp_selection': False}. Best is trial 103 with value: 0.28128692543870815.
[I 2025-12-08 12:50:17,209] Trial 107 finished with value: 0.2563094974753054 and parameters: {'model_type': 'graphsage', 'hidden_dims': '[512, 128]', 'dropout': 0.3362079293554362, 'batch_norm': False, 'sage_aggr': 'max', 'sage_normalize': True, 'sage_project': False, 'lr': 0.001587870500133876, 'weight_decay': 5.810083646993723e-05, 'epochs': 183, 'loss': 'mse', 'optimizer': 'adam', 'graph_mode': 'cutoff', 'cutoff': 0.558572528248199, 'grm_norm': 'gcn', 'self_loops': True, 'use_snp_selection': False}. Best is trial 103 with value: 0.28128692543870815.
[I 2025-12-08 12:52:21,581] Trial 108 finished with value: 0.2683609196374023 and parameters: {'model_type': 'graphsage', 'hidden_dims': '[512, 256]', 'dropout': 0.3821915388243558, 'batch_norm': True, 'sage_aggr': 'mean', 'sage_normalize': True, 'sage_project': False, 'lr': 0.003030421825635189, 'weight_decay': 9.883966530306148e-05, 'epochs': 235, 'loss': 'mae', 'optimizer': 'adam', 'graph_mode': 'cutoff', 'cutoff': 0.4874338161690343, 'grm_norm': 'gcn', 'self_loops': True, 'use_snp_selection': False}. Best is trial 103 with value: 0.28128692543870815.
[I 2025-12-08 12:54:19,698] Trial 109 finished with value: 0.26807738283926713 and parameters: {'model_type': 'graphsage', 'hidden_dims': '[512, 128]', 'dropout': 0.39590556262349436, 'batch_norm': True, 'sage_aggr': 'mean', 'sage_normalize': True, 'sage_project': False, 'lr': 0.0007604141402758282, 'weight_decay': 4.18535405656951e-05, 'epochs': 202, 'loss': 'mse', 'optimizer': 'adam', 'graph_mode': 'cutoff', 'cutoff': 0.3289360883817527, 'grm_norm': 'gcn', 'self_loops': True, 'use_snp_selection': False}. Best is trial 103 with value: 0.28128692543870815.
[I 2025-12-08 12:55:55,267] Trial 110 finished with value: 0.2790264796824869 and parameters: {'model_type': 'graphsage', 'hidden_dims': '[512, 128]', 'dropout': 0.15985356363686767, 'batch_norm': True, 'sage_aggr': 'mean', 'sage_normalize': True, 'sage_project': False, 'lr': 0.00028271798524978517, 'weight_decay': 0.0002560626645905523, 'epochs': 178, 'loss': 'mse', 'optimizer': 'adam', 'graph_mode': 'cutoff', 'cutoff': 0.4973589769040986, 'grm_norm': 'cosine', 'self_loops': True, 'use_snp_selection': False}. Best is trial 103 with value: 0.28128692543870815.
[I 2025-12-08 12:57:37,832] Trial 111 finished with value: 0.2791820486466917 and parameters: {'model_type': 'graphsage', 'hidden_dims': '[512, 128]', 'dropout': 0.16501806179506623, 'batch_norm': True, 'sage_aggr': 'mean', 'sage_normalize': True, 'sage_project': False, 'lr': 0.00025821687264240584, 'weight_decay': 0.00025377612101847214, 'epochs': 196, 'loss': 'mse', 'optimizer': 'adam', 'graph_mode': 'cutoff', 'cutoff': 0.50246657600724, 'grm_norm': 'cosine', 'self_loops': True, 'use_snp_selection': False}. Best is trial 103 with value: 0.28128692543870815.
[I 2025-12-08 12:59:21,120] Trial 112 finished with value: 0.276139451589955 and parameters: {'model_type': 'graphsage', 'hidden_dims': '[512, 128]', 'dropout': 0.15593804247615556, 'batch_norm': True, 'sage_aggr': 'mean', 'sage_normalize': True, 'sage_project': False, 'lr': 0.00024277602743179557, 'weight_decay': 0.00033619502204818854, 'epochs': 196, 'loss': 'mse', 'optimizer': 'adam', 'graph_mode': 'cutoff', 'cutoff': 0.49916719540204435, 'grm_norm': 'cosine', 'self_loops': True, 'use_snp_selection': False}. Best is trial 103 with value: 0.28128692543870815.
