[I 2025-12-08 22:11:02,386] Trial 79 finished with value: 0.26795875264779123 and parameters: {'model_type': 'graphsage', 'hidden_dims': '[512, 128]', 'dropout': 0.42338398885810186, 'batch_norm': False, 'sage_aggr': 'max', 'sage_normalize': True, 'sage_project': False, 'lr': 2.3224524098276154e-05, 'weight_decay': 2.2664597314358814e-06, 'epochs': 134, 'loss': 'mse', 'optimizer': 'adam', 'graph_mode': 'cutoff', 'cutoff': 0.6136626265409821, 'grm_norm': 'none', 'self_loops': True, 'use_snp_selection': False}. Best is trial 44 with value: 0.3040776419673326.
[I 2025-12-08 22:11:45,727] Trial 80 finished with value: 0.29814916217382376 and parameters: {'model_type': 'graphsage', 'hidden_dims': '[256, 128]', 'dropout': 0.44254089334072516, 'batch_norm': True, 'sage_aggr': 'max', 'sage_normalize': False, 'sage_project': False, 'lr': 0.00025338204698315393, 'weight_decay': 6.161819286789872e-06, 'epochs': 79, 'loss': 'mae', 'optimizer': 'adam', 'graph_mode': 'cutoff', 'cutoff': 0.6726774702516818, 'grm_norm': 'cosine', 'self_loops': True, 'use_snp_selection': True, 'num_snps': 58325}. Best is trial 44 with value: 0.3040776419673326.
[I 2025-12-08 22:12:45,095] Trial 81 finished with value: 0.2929780198774115 and parameters: {'model_type': 'graphsage', 'hidden_dims': '[512, 128]', 'dropout': 0.40150029477614524, 'batch_norm': False, 'sage_aggr': 'mean', 'sage_normalize': False, 'sage_project': False, 'lr': 1.684987677488325e-05, 'weight_decay': 3.021813399166582e-07, 'epochs': 115, 'loss': 'mse', 'optimizer': 'adam', 'graph_mode': 'cutoff', 'cutoff': 0.8181494928565632, 'grm_norm': 'none', 'self_loops': True, 'use_snp_selection': True, 'num_snps': 44777}. Best is trial 44 with value: 0.3040776419673326.
[I 2025-12-08 22:13:50,176] Trial 82 finished with value: 0.12712541408694428 and parameters: {'model_type': 'graphsage', 'hidden_dims': '[512, 128]', 'dropout': 0.32942694180289106, 'batch_norm': False, 'sage_aggr': 'mean', 'sage_normalize': False, 'sage_project': False, 'lr': 0.0005792475766920016, 'weight_decay': 1.896944297068232e-05, 'epochs': 120, 'loss': 'mse', 'optimizer': 'adam', 'graph_mode': 'cutoff', 'cutoff': 0.8466364308824573, 'grm_norm': 'none', 'self_loops': True, 'use_snp_selection': True, 'num_snps': 47119}. Best is trial 44 with value: 0.3040776419673326.
[I 2025-12-08 22:15:16,510] Trial 83 finished with value: 0.2997548823617241 and parameters: {'model_type': 'graphsage', 'hidden_dims': '[512, 128]', 'dropout': 0.3438378695515178, 'batch_norm': False, 'sage_aggr': 'mean', 'sage_normalize': False, 'sage_project': False, 'lr': 2.020069894486438e-05, 'weight_decay': 0.0006124583252256176, 'epochs': 144, 'loss': 'mse', 'optimizer': 'adam', 'graph_mode': 'cutoff', 'cutoff': 0.57635812157309, 'grm_norm': 'none', 'self_loops': True, 'use_snp_selection': True, 'num_snps': 50703}. Best is trial 44 with value: 0.3040776419673326.
[I 2025-12-08 22:16:52,362] Trial 84 finished with value: 0.2903795638218645 and parameters: {'model_type': 'graphsage', 'hidden_dims': '[512, 128]', 'dropout': 0.47030949371528064, 'batch_norm': False, 'sage_aggr': 'mean', 'sage_normalize': False, 'sage_project': False, 'lr': 4.086403202136297e-05, 'weight_decay': 0.0006316757867761379, 'epochs': 168, 'loss': 'mse', 'optimizer': 'adam', 'graph_mode': 'cutoff', 'cutoff': 0.573717372736051, 'grm_norm': 'none', 'self_loops': True, 'use_snp_selection': True, 'num_snps': 50495}. Best is trial 44 with value: 0.3040776419673326.
[I 2025-12-08 22:17:53,622] Trial 85 finished with value: 0.13331001675742743 and parameters: {'model_type': 'graphsage', 'hidden_dims': '[512, 128]', 'dropout': 0.36292072409833864, 'batch_norm': False, 'sage_aggr': 'mean', 'sage_normalize': False, 'sage_project': False, 'lr': 0.000363791517761201, 'weight_decay': 0.000423526778134693, 'epochs': 142, 'loss': 'mse', 'optimizer': 'adam', 'graph_mode': 'cutoff', 'cutoff': 0.7009346811931705, 'grm_norm': 'cosine', 'self_loops': True, 'use_snp_selection': True, 'num_snps': 39269}. Best is trial 44 with value: 0.3040776419673326.
[I 2025-12-08 22:19:25,903] Trial 86 finished with value: 0.24456904251817524 and parameters: {'model_type': 'graphsage', 'hidden_dims': '[256, 128, 64]', 'dropout': 0.4844170194638061, 'batch_norm': False, 'sage_aggr': 'max', 'sage_normalize': False, 'sage_project': False, 'lr': 0.00016546430986643062, 'weight_decay': 0.00018739572976859145, 'epochs': 161, 'loss': 'mse', 'optimizer': 'adam', 'graph_mode': 'cutoff', 'cutoff': 0.5070883541654387, 'grm_norm': 'none', 'self_loops': True, 'use_snp_selection': True, 'num_snps': 53246}. Best is trial 44 with value: 0.3040776419673326.
[I 2025-12-08 22:20:19,751] Trial 87 finished with value: 0.29594343821630387 and parameters: {'model_type': 'graphsage', 'hidden_dims': '[512, 128]', 'dropout': 0.37628607764245703, 'batch_norm': False, 'sage_aggr': 'mean', 'sage_normalize': False, 'sage_project': False, 'lr': 1.268795061464358e-05, 'weight_decay': 1.4783278922232138e-06, 'epochs': 131, 'loss': 'mse', 'optimizer': 'adam', 'graph_mode': 'cutoff', 'cutoff': 0.5943567607629504, 'grm_norm': 'cosine', 'self_loops': True, 'use_snp_selection': True, 'num_snps': 36223}. Best is trial 44 with value: 0.3040776419673326.
[I 2025-12-08 22:21:22,308] Trial 88 finished with value: 0.2785909552065057 and parameters: {'model_type': 'graphsage', 'hidden_dims': '[512, 128]', 'dropout': 0.43332739477047594, 'batch_norm': False, 'sage_aggr': 'mean', 'sage_normalize': False, 'sage_project': False, 'lr': 2.122488424427512e-05, 'weight_decay': 0.00032606089160040427, 'epochs': 70, 'loss': 'mse', 'optimizer': 'adam', 'graph_mode': 'knn', 'knn_k': 6, 'weighted_edges': True, 'symmetrize_mode': 'mutual', 'self_loops': True, 'use_snp_selection': True, 'num_snps': 43895}. Best is trial 44 with value: 0.3040776419673326.
[I 2025-12-08 22:22:22,958] Trial 89 finished with value: 0.0 and parameters: {'model_type': 'graphsage', 'hidden_dims': '[512, 128]', 'dropout': 0.31807262670645214, 'batch_norm': False, 'sage_aggr': 'mean', 'sage_normalize': False, 'sage_project': False, 'lr': 0.007263121573794209, 'weight_decay': 9.484471013134319e-07, 'epochs': 94, 'loss': 'mse', 'optimizer': 'adam', 'graph_mode': 'cutoff', 'cutoff': 0.616894358998038, 'grm_norm': 'none', 'self_loops': True, 'use_snp_selection': True, 'num_snps': 51494}. Best is trial 44 with value: 0.3040776419673326.
[I 2025-12-08 22:22:51,164] Trial 90 finished with value: 0.2723317126582338 and parameters: {'model_type': 'graphsage', 'hidden_dims': '[512, 128]', 'dropout': 0.5565984739167061, 'batch_norm': False, 'sage_aggr': 'mean', 'sage_normalize': False, 'sage_project': False, 'lr': 0.0001082016210867051, 'weight_decay': 5.669672253458868e-05, 'epochs': 50, 'loss': 'mse', 'optimizer': 'adam', 'graph_mode': 'cutoff', 'cutoff': 0.6597570668208727, 'grm_norm': 'cosine', 'self_loops': True, 'use_snp_selection': True, 'num_snps': 33423}. Best is trial 44 with value: 0.3040776419673326.
[I 2025-12-08 22:23:55,746] Trial 91 finished with value: 0.30567232962607993 and parameters: {'model_type': 'graphsage', 'hidden_dims': '[512, 128]', 'dropout': 0.34165741872694, 'batch_norm': False, 'sage_aggr': 'mean', 'sage_normalize': False, 'sage_project': False, 'lr': 1.565719044060881e-05, 'weight_decay': 4.855729115606807e-07, 'epochs': 117, 'loss': 'mse', 'optimizer': 'adam', 'graph_mode': 'cutoff', 'cutoff': 0.772479865900283, 'grm_norm': 'none', 'self_loops': False, 'use_snp_selection': True, 'num_snps': 48162}. Best is trial 91 with value: 0.30567232962607993.
[I 2025-12-08 22:25:07,925] Trial 92 finished with value: 0.30178848191282387 and parameters: {'model_type': 'graphsage', 'hidden_dims': '[512, 128]', 'dropout': 0.3485489397865649, 'batch_norm': False, 'sage_aggr': 'mean', 'sage_normalize': False, 'sage_project': False, 'lr': 2.5454726478598284e-05, 'weight_decay': 6.299574543105843e-07, 'epochs': 100, 'loss': 'mse', 'optimizer': 'adam', 'graph_mode': 'cutoff', 'cutoff': 0.7724676517726771, 'grm_norm': 'none', 'self_loops': False, 'use_snp_selection': True, 'num_snps': 59940}. Best is trial 91 with value: 0.30567232962607993.
[I 2025-12-08 22:26:25,394] Trial 93 finished with value: 0.29874992025396346 and parameters: {'model_type': 'graphsage', 'hidden_dims': '[512, 128]', 'dropout': 0.3444847046147597, 'batch_norm': False, 'sage_aggr': 'mean', 'sage_normalize': False, 'sage_project': False, 'lr': 2.5567462964633482e-05, 'weight_decay': 4.285040975367378e-07, 'epochs': 148, 'loss': 'mse', 'optimizer': 'adam', 'graph_mode': 'cutoff', 'cutoff': 0.7704881263179951, 'grm_norm': 'none', 'self_loops': False, 'use_snp_selection': True, 'num_snps': 47725}. Best is trial 91 with value: 0.30567232962607993.
[I 2025-12-08 22:27:21,155] Trial 94 finished with value: 0.3042059812934235 and parameters: {'model_type': 'graphsage', 'hidden_dims': '[512, 128]', 'dropout': 0.29963632972076065, 'batch_norm': False, 'sage_aggr': 'mean', 'sage_normalize': False, 'sage_project': False, 'lr': 1.0139902161834016e-05, 'weight_decay': 6.191535872423367e-07, 'epochs': 101, 'loss': 'mse', 'optimizer': 'adam', 'graph_mode': 'cutoff', 'cutoff': 0.8002936447279565, 'grm_norm': 'none', 'self_loops': False, 'use_snp_selection': True, 'num_snps': 45774}. Best is trial 91 with value: 0.30567232962607993.
[I 2025-12-08 22:28:20,009] Trial 95 finished with value: 0.29964715390918906 and parameters: {'model_type': 'graphsage', 'hidden_dims': '[512, 256]', 'dropout': 0.3114786654347153, 'batch_norm': False, 'sage_aggr': 'mean', 'sage_normalize': False, 'sage_project': False, 'lr': 1.1571109391753526e-05, 'weight_decay': 7.341363823061258e-07, 'epochs': 109, 'loss': 'mse', 'optimizer': 'adam', 'graph_mode': 'cutoff', 'cutoff': 0.7990343797279881, 'grm_norm': 'none', 'self_loops': False, 'use_snp_selection': True, 'num_snps': 45794}. Best is trial 91 with value: 0.30567232962607993.
[I 2025-12-08 22:28:56,433] Trial 96 finished with value: 0.2823656430132651 and parameters: {'model_type': 'graphsage', 'hidden_dims': '[256, 128, 64]', 'dropout': 0.26705239987145757, 'batch_norm': False, 'sage_aggr': 'mean', 'sage_normalize': True, 'sage_project': False, 'lr': 1.5526830967673933e-05, 'weight_decay': 6.450311546167056e-07, 'epochs': 102, 'loss': 'mse', 'optimizer': 'adam', 'graph_mode': 'cutoff', 'cutoff': 0.7794805999374861, 'grm_norm': 'gcn', 'self_loops': False, 'use_snp_selection': True, 'num_snps': 42109}. Best is trial 91 with value: 0.30567232962607993.
[I 2025-12-08 22:30:04,913] Trial 97 finished with value: 0.2773050880199503 and parameters: {'model_type': 'graphsage', 'hidden_dims': '[512, 128]', 'dropout': 0.2959035509940801, 'batch_norm': True, 'sage_aggr': 'mean', 'sage_normalize': False, 'sage_project': False, 'lr': 1.0332694200345676e-05, 'weight_decay': 4.791129881874074e-07, 'epochs': 125, 'loss': 'mse', 'optimizer': 'adam', 'graph_mode': 'cutoff', 'cutoff': 0.7392104355762958, 'grm_norm': 'cosine', 'self_loops': False, 'use_snp_selection': False}. Best is trial 91 with value: 0.30567232962607993.
[I 2025-12-08 22:30:34,793] Trial 98 finished with value: 0.2975930203741033 and parameters: {'model_type': 'graphsage', 'hidden_dims': '[256, 128]', 'dropout': 0.32654171169077834, 'batch_norm': False, 'sage_aggr': 'mean', 'sage_normalize': False, 'sage_project': False, 'lr': 1.4755506056045374e-05, 'weight_decay': 9.328587350190136e-07, 'epochs': 81, 'loss': 'mae', 'optimizer': 'adam', 'graph_mode': 'cutoff', 'cutoff': 0.8225164431142986, 'grm_norm': 'none', 'self_loops': False, 'use_snp_selection': True, 'num_snps': 38901}. Best is trial 91 with value: 0.30567232962607993.
[I 2025-12-08 22:32:27,519] Trial 99 finished with value: 0.2877449380170586 and parameters: {'model_type': 'graphsage', 'hidden_dims': '[512, 64]', 'dropout': 0.2407876277013009, 'batch_norm': False, 'sage_aggr': 'mean', 'sage_normalize': False, 'sage_project': False, 'lr': 1.2844926375074869e-05, 'weight_decay': 5.791226988949796e-07, 'epochs': 271, 'loss': 'mse', 'optimizer': 'adam', 'graph_mode': 'cutoff', 'cutoff': 0.7141161603719396, 'grm_norm': 'cosine_then_gcn', 'self_loops': False, 'use_snp_selection': True, 'num_snps': 44236}. Best is trial 91 with value: 0.30567232962607993.
[I 2025-12-08 22:33:26,217] Trial 100 finished with value: 0.29920029491909733 and parameters: {'model_type': 'graphsage', 'hidden_dims': '[512, 128]', 'dropout': 0.2726591883455831, 'batch_norm': False, 'sage_aggr': 'mean', 'sage_normalize': False, 'sage_project': False, 'lr': 1.7174235692937584e-05, 'weight_decay': 1.393831564024784e-07, 'epochs': 100, 'loss': 'mse', 'optimizer': 'adam', 'graph_mode': 'cutoff', 'cutoff': 0.7618465921874127, 'grm_norm': 'none', 'self_loops': False, 'use_snp_selection': True, 'num_snps': 48362}. Best is trial 91 with value: 0.30567232962607993.
[I 2025-12-08 22:34:43,299] Trial 101 finished with value: 0.3013369354970673 and parameters: {'model_type': 'graphsage', 'hidden_dims': '[512, 128]', 'dropout': 0.3525191951277817, 'batch_norm': False, 'sage_aggr': 'mean', 'sage_normalize': False, 'sage_project': False, 'lr': 1.9943351814253252e-05, 'weight_decay': 0.0009300629941473038, 'epochs': 136, 'loss': 'mse', 'optimizer': 'adam', 'graph_mode': 'cutoff', 'cutoff': 0.7945317442538212, 'grm_norm': 'none', 'self_loops': False, 'use_snp_selection': True, 'num_snps': 50415}. Best is trial 91 with value: 0.30567232962607993.
[I 2025-12-08 22:35:46,451] Trial 102 finished with value: 0.298404642521565 and parameters: {'model_type': 'graphsage', 'hidden_dims': '[512, 128]', 'dropout': 0.3021937918698329, 'batch_norm': False, 'sage_aggr': 'mean', 'sage_normalize': False, 'sage_project': False, 'lr': 1.537299377482022e-05, 'weight_decay': 2.445392542206876e-07, 'epochs': 117, 'loss': 'mse', 'optimizer': 'adam', 'graph_mode': 'cutoff', 'cutoff': 0.8030086485136445, 'grm_norm': 'none', 'self_loops': False, 'use_snp_selection': True, 'num_snps': 46057}. Best is trial 91 with value: 0.30567232962607993.
[I 2025-12-08 22:37:17,941] Trial 103 finished with value: 0.30058879487949935 and parameters: {'model_type': 'graphsage', 'hidden_dims': '[512, 128]', 'dropout': 0.3610293439703323, 'batch_norm': False, 'sage_aggr': 'mean', 'sage_normalize': False, 'sage_project': False, 'lr': 1.1248034748390962e-05, 'weight_decay': 0.00012143005976616216, 'epochs': 137, 'loss': 'mse', 'optimizer': 'adam', 'graph_mode': 'cutoff', 'cutoff': 0.7880365544850706, 'grm_norm': 'none', 'self_loops': False, 'use_snp_selection': True, 'num_snps': 59822}. Best is trial 91 with value: 0.30567232962607993.
[I 2025-12-08 22:38:33,427] Trial 104 finished with value: 0.3068879314968838 and parameters: {'model_type': 'graphsage', 'hidden_dims': '[512, 128]', 'dropout': 0.364473286292116, 'batch_norm': False, 'sage_aggr': 'mean', 'sage_normalize': False, 'sage_project': False, 'lr': 3.159943584165292e-05, 'weight_decay': 1.8825601967954321e-06, 'epochs': 108, 'loss': 'mse', 'optimizer': 'adam', 'graph_mode': 'cutoff', 'cutoff': 0.7905937375145632, 'grm_norm': 'none', 'self_loops': False, 'use_snp_selection': True, 'num_snps': 59095}. Best is trial 104 with value: 0.3068879314968838.
[I 2025-12-08 22:39:45,148] Trial 105 finished with value: 0.29595579756196483 and parameters: {'model_type': 'graphsage', 'hidden_dims': '[512, 128]', 'dropout': 0.40789283033953877, 'batch_norm': False, 'sage_aggr': 'mean', 'sage_normalize': False, 'sage_project': False, 'lr': 3.2330294841927915e-05, 'weight_decay': 1.9074386569045628e-06, 'epochs': 109, 'loss': 'mse', 'optimizer': 'adam', 'graph_mode': 'cutoff', 'cutoff': 0.7473113654038904, 'grm_norm': 'cosine', 'self_loops': False, 'use_snp_selection': True, 'num_snps': 56642}. Best is trial 104 with value: 0.3068879314968838.
[I 2025-12-08 22:40:54,498] Trial 106 finished with value: 0.2978397075381712 and parameters: {'model_type': 'graphsage', 'hidden_dims': '[512, 128]', 'dropout': 0.3809308654801093, 'batch_norm': False, 'sage_aggr': 'mean', 'sage_normalize': False, 'sage_project': False, 'lr': 2.5871242734240846e-05, 'weight_decay': 3.142510481419808e-06, 'epochs': 98, 'loss': 'mse', 'optimizer': 'adam', 'graph_mode': 'cutoff', 'cutoff': 0.7683628048315705, 'grm_norm': 'none', 'self_loops': False, 'use_snp_selection': True, 'num_snps': 58730}. Best is trial 104 with value: 0.3068879314968838.
[I 2025-12-08 22:41:48,140] Trial 107 finished with value: 0.29322659094262066 and parameters: {'model_type': 'graphsage', 'hidden_dims': '[512, 128]', 'dropout': 0.3497139134437246, 'batch_norm': False, 'sage_aggr': 'mean', 'sage_normalize': False, 'sage_project': False, 'lr': 5.128636099032438e-05, 'weight_decay': 1.3031466607795832e-06, 'epochs': 87, 'loss': 'mse', 'optimizer': 'adam', 'graph_mode': 'cutoff', 'cutoff': 0.8074049652648193, 'grm_norm': 'none', 'self_loops': False, 'use_snp_selection': True, 'num_snps': 49052}. Best is trial 104 with value: 0.3068879314968838.
[I 2025-12-08 22:43:27,011] Trial 108 finished with value: 0.009581109938539093 and parameters: {'model_type': 'graphsage', 'hidden_dims': '[256, 128, 64]', 'dropout': 0.36877514706723347, 'batch_norm': False, 'sage_aggr': 'mean', 'sage_normalize': False, 'sage_project': False, 'lr': 0.002319132235263883, 'weight_decay': 1.0271990775826477e-06, 'epochs': 121, 'loss': 'mse', 'optimizer': 'adam', 'graph_mode': 'knn', 'knn_k': 8, 'weighted_edges': True, 'symmetrize_mode': 'mutual', 'self_loops': False, 'use_snp_selection': True, 'num_snps': 53156}. Best is trial 104 with value: 0.3068879314968838.
[I 2025-12-08 22:43:58,233] Trial 109 finished with value: 0.24360372424544607 and parameters: {'model_type': 'graphsage', 'hidden_dims': '[128, 64]', 'dropout': 0.3254380335854034, 'batch_norm': False, 'sage_aggr': 'mean', 'sage_normalize': False, 'sage_project': False, 'lr': 0.00014090312563331162, 'weight_decay': 3.943461856652352e-07, 'epochs': 68, 'loss': 'mse', 'optimizer': 'adam', 'graph_mode': 'cutoff', 'cutoff': 0.8726567698655289, 'grm_norm': 'cosine', 'self_loops': False, 'use_snp_selection': True, 'num_snps': 57534}. Best is trial 104 with value: 0.3068879314968838.
[I 2025-12-08 22:45:06,566] Trial 110 finished with value: 0.2794093821681803 and parameters: {'model_type': 'graphsage', 'hidden_dims': '[512, 128]', 'dropout': 0.3858500943943305, 'batch_norm': False, 'sage_aggr': 'mean', 'sage_normalize': True, 'sage_project': False, 'lr': 3.148695731425628e-05, 'weight_decay': 2.0057033006182415e-06, 'epochs': 108, 'loss': 'mse', 'optimizer': 'adam', 'graph_mode': 'cutoff', 'cutoff': 0.8494013210880279, 'grm_norm': 'none', 'self_loops': False, 'use_snp_selection': True, 'num_snps': 54304}. Best is trial 104 with value: 0.3068879314968838.
[I 2025-12-08 22:46:38,193] Trial 111 finished with value: 0.30092190115539263 and parameters: {'model_type': 'graphsage', 'hidden_dims': '[512, 128]', 'dropout': 0.35566960948842935, 'batch_norm': False, 'sage_aggr': 'mean', 'sage_normalize': False, 'sage_project': False, 'lr': 1.988203476421767e-05, 'weight_decay': 0.00013626305001507698, 'epochs': 137, 'loss': 'mse', 'optimizer': 'adam', 'graph_mode': 'cutoff', 'cutoff': 0.7921089843662753, 'grm_norm': 'none', 'self_loops': False, 'use_snp_selection': True, 'num_snps': 59940}. Best is trial 104 with value: 0.3068879314968838.
[I 2025-12-08 22:47:58,614] Trial 112 finished with value: 0.3000412727597325 and parameters: {'model_type': 'graphsage', 'hidden_dims': '[512, 128]', 'dropout': 0.35060374915494014, 'batch_norm': False, 'sage_aggr': 'mean', 'sage_normalize': False, 'sage_project': False, 'lr': 2.1998335571201325e-05, 'weight_decay': 2.5885709987069355e-06, 'epochs': 128, 'loss': 'mse', 'optimizer': 'adam', 'graph_mode': 'cutoff', 'cutoff': 0.7786409132394786, 'grm_norm': 'none', 'self_loops': False, 'use_snp_selection': True, 'num_snps': 55585}. Best is trial 104 with value: 0.3068879314968838.
[I 2025-12-08 22:48:28,232] Trial 113 finished with value: 0.2910647211801157 and parameters: {'model_type': 'graphsage', 'hidden_dims': '[512, 128]', 'dropout': 0.33588336096116156, 'batch_norm': False, 'sage_aggr': 'mean', 'sage_normalize': False, 'sage_project': False, 'lr': 1.8931854235196894e-05, 'weight_decay': 1.4021817603245337e-06, 'epochs': 216, 'loss': 'mse', 'optimizer': 'adam', 'graph_mode': 'cutoff', 'cutoff': 0.7961943214599262, 'grm_norm': 'none', 'self_loops': False, 'use_snp_selection': True, 'num_snps': 11246}. Best is trial 104 with value: 0.3068879314968838.
[I 2025-12-08 22:50:07,825] Trial 114 finished with value: 0.2984841282260858 and parameters: {'model_type': 'graphsage', 'hidden_dims': '[512, 128]', 'dropout': 0.36522380457939474, 'batch_norm': False, 'sage_aggr': 'mean', 'sage_normalize': False, 'sage_project': False, 'lr': 2.8843324999079184e-05, 'weight_decay': 4.107507401948264e-06, 'epochs': 154, 'loss': 'mse', 'optimizer': 'adam', 'graph_mode': 'cutoff', 'cutoff': 0.8146352950973591, 'grm_norm': 'none', 'self_loops': False, 'use_snp_selection': True, 'num_snps': 58996}. Best is trial 104 with value: 0.3068879314968838.
[I 2025-12-08 22:51:17,337] Trial 115 finished with value: 0.3002537689804516 and parameters: {'model_type': 'graphsage', 'hidden_dims': '[512, 128]', 'dropout': 0.5082951792736908, 'batch_norm': False, 'sage_aggr': 'mean', 'sage_normalize': False, 'sage_project': False, 'lr': 1.4691810291951663e-05, 'weight_decay': 8.189863334621947e-05, 'epochs': 114, 'loss': 'mse', 'optimizer': 'adam', 'graph_mode': 'cutoff', 'cutoff': 0.7307108190842868, 'grm_norm': 'none', 'self_loops': False, 'use_snp_selection': True, 'num_snps': 52305}. Best is trial 104 with value: 0.3068879314968838.
