[I 2025-12-10 01:04:14,134] Trial 86 finished with value: 0.30716564317176825 and parameters: {'model_type': 'graphsage', 'hidden_dims': '[256, 128]', 'dropout': 0.3779998210107902, 'batch_norm': False, 'sage_aggr': 'max', 'sage_normalize': True, 'sage_project': False, 'lr': 0.0022638610289052344, 'weight_decay': 2.698638039341957e-07, 'epochs': 153, 'loss': 'mse', 'optimizer': 'adam', 'graph_mode': 'cutoff', 'cutoff': 0.7631687869795968, 'grm_norm': 'cosine', 'self_loops': False, 'use_snp_selection': False}. Best is trial 71 with value: 0.31284303337172253.
[I 2025-12-10 01:04:31,852] Trial 87 finished with value: 0.28183679034517334 and parameters: {'model_type': 'graphsage', 'hidden_dims': '[128, 64]', 'dropout': 0.3486944840692149, 'batch_norm': False, 'sage_aggr': 'max', 'sage_normalize': True, 'sage_project': False, 'lr': 0.0012294747050169046, 'weight_decay': 2.7955257114037225e-07, 'epochs': 175, 'loss': 'mse', 'optimizer': 'adam', 'graph_mode': 'cutoff', 'cutoff': 0.7104434430102737, 'grm_norm': 'cosine', 'self_loops': False, 'use_snp_selection': True, 'num_snps': 13722}. Best is trial 71 with value: 0.31284303337172253.
[I 2025-12-10 01:05:29,737] Trial 88 finished with value: -0.015964989716504653 and parameters: {'model_type': 'graphsage', 'hidden_dims': '[256, 128, 64]', 'dropout': 0.45387492056903594, 'batch_norm': False, 'sage_aggr': 'max', 'sage_normalize': False, 'sage_project': False, 'lr': 0.0033311097945733933, 'weight_decay': 5.633893034042332e-07, 'epochs': 200, 'loss': 'mse', 'optimizer': 'adam', 'graph_mode': 'cutoff', 'cutoff': 0.7625040621441403, 'grm_norm': 'cosine', 'self_loops': False, 'use_snp_selection': False}. Best is trial 71 with value: 0.31284303337172253.
[I 2025-12-10 01:07:30,703] Trial 89 finished with value: 0.2898485185860936 and parameters: {'model_type': 'graphsage', 'hidden_dims': '[512, 128]', 'dropout': 0.3928227229375145, 'batch_norm': False, 'sage_aggr': 'max', 'sage_normalize': True, 'sage_project': False, 'lr': 0.005996304874335652, 'weight_decay': 1.2553398691354634e-06, 'epochs': 223, 'loss': 'mse', 'optimizer': 'adam', 'graph_mode': 'cutoff', 'cutoff': 0.5749403328338586, 'grm_norm': 'cosine', 'self_loops': False, 'use_snp_selection': False}. Best is trial 71 with value: 0.31284303337172253.
[I 2025-12-10 01:08:25,061] Trial 90 finished with value: 0.30269055917346266 and parameters: {'model_type': 'graphsage', 'hidden_dims': '[256, 128]', 'dropout': 0.3790968268601052, 'batch_norm': False, 'sage_aggr': 'max', 'sage_normalize': True, 'sage_project': False, 'lr': 0.0014218021824727192, 'weight_decay': 1.8266816316444198e-07, 'epochs': 186, 'loss': 'mse', 'optimizer': 'adam', 'graph_mode': 'cutoff', 'cutoff': 0.6319128477170295, 'grm_norm': 'cosine', 'self_loops': False, 'use_snp_selection': False}. Best is trial 71 with value: 0.31284303337172253.
[I 2025-12-10 01:09:10,604] Trial 91 finished with value: 0.30702838601360205 and parameters: {'model_type': 'graphsage', 'hidden_dims': '[256, 128]', 'dropout': 0.397187548500269, 'batch_norm': False, 'sage_aggr': 'max', 'sage_normalize': True, 'sage_project': False, 'lr': 0.0019531750496693968, 'weight_decay': 4.5602545334076507e-07, 'epochs': 155, 'loss': 'mse', 'optimizer': 'adam', 'graph_mode': 'cutoff', 'cutoff': 0.674884787582212, 'grm_norm': 'cosine', 'self_loops': False, 'use_snp_selection': False}. Best is trial 71 with value: 0.31284303337172253.
[I 2025-12-10 01:10:02,248] Trial 92 finished with value: 0.2769088148020735 and parameters: {'model_type': 'graphsage', 'hidden_dims': '[256, 128]', 'dropout': 0.4256677650617609, 'batch_norm': False, 'sage_aggr': 'max', 'sage_normalize': True, 'sage_project': False, 'lr': 5.7210065460050164e-05, 'weight_decay': 8.615496148198103e-07, 'epochs': 177, 'loss': 'mse', 'optimizer': 'adam', 'graph_mode': 'cutoff', 'cutoff': 0.663613729871511, 'grm_norm': 'cosine', 'self_loops': False, 'use_snp_selection': False}. Best is trial 71 with value: 0.31284303337172253.
[I 2025-12-10 01:10:40,642] Trial 93 finished with value: 0.29188529178354006 and parameters: {'model_type': 'graphsage', 'hidden_dims': '[256, 128]', 'dropout': 0.41152766234597454, 'batch_norm': False, 'sage_aggr': 'max', 'sage_normalize': True, 'sage_project': False, 'lr': 0.0028593624161116354, 'weight_decay': 1.308489847294647e-06, 'epochs': 129, 'loss': 'mse', 'optimizer': 'adam', 'graph_mode': 'cutoff', 'cutoff': 0.6882038717193433, 'grm_norm': 'cosine', 'self_loops': False, 'use_snp_selection': False}. Best is trial 71 with value: 0.31284303337172253.
[I 2025-12-10 01:11:41,449] Trial 94 finished with value: 0.3038277198601552 and parameters: {'model_type': 'graphsage', 'hidden_dims': '[256, 128]', 'dropout': 0.3666199993100689, 'batch_norm': False, 'sage_aggr': 'max', 'sage_normalize': True, 'sage_project': False, 'lr': 0.0035145079370720927, 'weight_decay': 7.011975741563705e-07, 'epochs': 207, 'loss': 'mse', 'optimizer': 'adam', 'graph_mode': 'cutoff', 'cutoff': 0.6013843745021787, 'grm_norm': 'cosine', 'self_loops': False, 'use_snp_selection': False}. Best is trial 71 with value: 0.31284303337172253.
[I 2025-12-10 01:12:30,484] Trial 95 finished with value: 0.3092958448643125 and parameters: {'model_type': 'graphsage', 'hidden_dims': '[256, 128]', 'dropout': 0.40277804698411696, 'batch_norm': False, 'sage_aggr': 'max', 'sage_normalize': True, 'sage_project': False, 'lr': 0.0023979620401838697, 'weight_decay': 7.127257988462956e-06, 'epochs': 167, 'loss': 'mse', 'optimizer': 'adam', 'graph_mode': 'cutoff', 'cutoff': 0.6441337721197706, 'grm_norm': 'cosine', 'self_loops': False, 'use_snp_selection': False}. Best is trial 71 with value: 0.31284303337172253.
[I 2025-12-10 01:14:02,432] Trial 96 finished with value: 0.2894087738286897 and parameters: {'model_type': 'graphsage', 'hidden_dims': '[512, 256]', 'dropout': 0.3608188069617101, 'batch_norm': False, 'sage_aggr': 'max', 'sage_normalize': True, 'sage_project': False, 'lr': 0.0051265051820122125, 'weight_decay': 7.791254379487078e-06, 'epochs': 170, 'loss': 'mse', 'optimizer': 'adam', 'graph_mode': 'cutoff', 'cutoff': 0.644652870409695, 'grm_norm': 'cosine', 'self_loops': False, 'use_snp_selection': False}. Best is trial 71 with value: 0.31284303337172253.
[I 2025-12-10 01:17:20,350] Trial 97 finished with value: 0.2494716621734697 and parameters: {'model_type': 'graphsage', 'hidden_dims': '[512, 64]', 'dropout': 0.3417560674793983, 'batch_norm': True, 'sage_aggr': 'max', 'sage_normalize': True, 'sage_project': False, 'lr': 0.002182388279714624, 'weight_decay': 5.1514659871513065e-06, 'epochs': 185, 'loss': 'mae', 'optimizer': 'adam', 'graph_mode': 'knn', 'knn_k': 8, 'weighted_edges': False, 'symmetrize_mode': 'union', 'self_loops': False, 'use_snp_selection': False}. Best is trial 71 with value: 0.31284303337172253.
[I 2025-12-10 01:18:17,358] Trial 98 finished with value: 0.306617077136954 and parameters: {'model_type': 'graphsage', 'hidden_dims': '[256, 128]', 'dropout': 0.3871413054430591, 'batch_norm': False, 'sage_aggr': 'max', 'sage_normalize': True, 'sage_project': False, 'lr': 0.004278940855977104, 'weight_decay': 3.5077387457552324e-07, 'epochs': 197, 'loss': 'mse', 'optimizer': 'adam', 'graph_mode': 'cutoff', 'cutoff': 0.7043322058028444, 'grm_norm': 'cosine', 'self_loops': False, 'use_snp_selection': False}. Best is trial 71 with value: 0.31284303337172253.
[I 2025-12-10 01:20:10,132] Trial 99 finished with value: 0.3106942866996534 and parameters: {'model_type': 'graphsage', 'hidden_dims': '[256, 128]', 'dropout': 0.4078401504854616, 'batch_norm': False, 'sage_aggr': 'max', 'sage_normalize': True, 'sage_project': False, 'lr': 0.0017857665142494907, 'weight_decay': 1.0450499070615948e-07, 'epochs': 296, 'loss': 'mse', 'optimizer': 'adam', 'graph_mode': 'cutoff', 'cutoff': 0.8781579404779107, 'grm_norm': 'cosine', 'self_loops': False, 'use_snp_selection': True, 'num_snps': 59498}. Best is trial 71 with value: 0.31284303337172253.
[I 2025-12-10 01:22:00,290] Trial 100 finished with value: 0.30755950151739053 and parameters: {'model_type': 'graphsage', 'hidden_dims': '[256, 128]', 'dropout': 0.43495408874998964, 'batch_norm': False, 'sage_aggr': 'max', 'sage_normalize': True, 'sage_project': False, 'lr': 0.0016765954963910367, 'weight_decay': 1.331285025776625e-07, 'epochs': 295, 'loss': 'mse', 'optimizer': 'adam', 'graph_mode': 'cutoff', 'cutoff': 0.8759126393657777, 'grm_norm': 'cosine', 'self_loops': False, 'use_snp_selection': True, 'num_snps': 58512}. Best is trial 71 with value: 0.31284303337172253.
[I 2025-12-10 01:22:57,255] Trial 101 finished with value: 0.30544618670293705 and parameters: {'model_type': 'graphsage', 'hidden_dims': '[256, 128]', 'dropout': 0.4011265094673571, 'batch_norm': False, 'sage_aggr': 'max', 'sage_normalize': True, 'sage_project': False, 'lr': 0.006648955650259787, 'weight_decay': 7.083879736658382e-06, 'epochs': 193, 'loss': 'mse', 'optimizer': 'adam', 'graph_mode': 'cutoff', 'cutoff': 0.8309477075763237, 'grm_norm': 'cosine', 'self_loops': False, 'use_snp_selection': True, 'num_snps': 43496}. Best is trial 71 with value: 0.31284303337172253.
[I 2025-12-10 01:24:35,136] Trial 102 finished with value: 0.30176937650253455 and parameters: {'model_type': 'graphsage', 'hidden_dims': '[256, 128]', 'dropout': 0.37562827321029524, 'batch_norm': False, 'sage_aggr': 'max', 'sage_normalize': True, 'sage_project': False, 'lr': 0.002361007793218795, 'weight_decay': 3.7668430637862432e-06, 'epochs': 297, 'loss': 'mse', 'optimizer': 'adam', 'graph_mode': 'cutoff', 'cutoff': 0.8648389251843988, 'grm_norm': 'cosine', 'self_loops': False, 'use_snp_selection': True, 'num_snps': 51873}. Best is trial 71 with value: 0.31284303337172253.
[I 2025-12-10 01:25:35,455] Trial 103 finished with value: 0.3082556831302523 and parameters: {'model_type': 'graphsage', 'hidden_dims': '[256, 128]', 'dropout': 0.4177405299056002, 'batch_norm': False, 'sage_aggr': 'max', 'sage_normalize': True, 'sage_project': False, 'lr': 0.0013611763138419012, 'weight_decay': 1.1018726931733972e-07, 'epochs': 228, 'loss': 'mse', 'optimizer': 'adam', 'graph_mode': 'cutoff', 'cutoff': 0.7252869596999055, 'grm_norm': 'cosine', 'self_loops': False, 'use_snp_selection': True, 'num_snps': 41100}. Best is trial 71 with value: 0.31284303337172253.
[I 2025-12-10 01:25:57,461] Trial 104 finished with value: 0.29724056154811473 and parameters: {'model_type': 'graphsage', 'hidden_dims': '[256, 128]', 'dropout': 0.35833472154384416, 'batch_norm': False, 'sage_aggr': 'max', 'sage_normalize': True, 'sage_project': False, 'lr': 0.0016998867883838155, 'weight_decay': 2.5396334549350352e-06, 'epochs': 102, 'loss': 'mse', 'optimizer': 'adam', 'graph_mode': 'cutoff', 'cutoff': 0.8007882657133509, 'grm_norm': 'cosine', 'self_loops': False, 'use_snp_selection': True, 'num_snps': 21253}. Best is trial 71 with value: 0.31284303337172253.
[I 2025-12-10 01:27:28,943] Trial 105 finished with value: 0.3064387897845416 and parameters: {'model_type': 'graphsage', 'hidden_dims': '[256, 128]', 'dropout': 0.38742463961114865, 'batch_norm': False, 'sage_aggr': 'max', 'sage_normalize': True, 'sage_project': False, 'lr': 0.003375742677575204, 'weight_decay': 1.8686958136353755e-06, 'epochs': 323, 'loss': 'mse', 'optimizer': 'adam', 'graph_mode': 'cutoff', 'cutoff': 0.8974809234345845, 'grm_norm': 'cosine', 'self_loops': False, 'use_snp_selection': False}. Best is trial 71 with value: 0.31284303337172253.
[I 2025-12-10 01:29:23,727] Trial 106 finished with value: 0.2503049411536105 and parameters: {'model_type': 'graphsage', 'hidden_dims': '[256, 128]', 'dropout': 0.40883822713111917, 'batch_norm': False, 'sage_aggr': 'max', 'sage_normalize': True, 'sage_project': False, 'lr': 0.0008962029826934285, 'weight_decay': 4.706216823421195e-06, 'epochs': 147, 'loss': 'mse', 'optimizer': 'adam', 'graph_mode': 'cutoff', 'cutoff': 0.25598081270621287, 'grm_norm': 'cosine', 'self_loops': False, 'use_snp_selection': False}. Best is trial 71 with value: 0.31284303337172253.
[I 2025-12-10 01:30:23,427] Trial 107 finished with value: 0.2980708315456901 and parameters: {'model_type': 'graphsage', 'hidden_dims': '[256, 128]', 'dropout': 0.45142508621199495, 'batch_norm': False, 'sage_aggr': 'max', 'sage_normalize': True, 'sage_project': False, 'lr': 0.0025934293075383875, 'weight_decay': 6.013112428932045e-06, 'epochs': 207, 'loss': 'mse', 'optimizer': 'adam', 'graph_mode': 'cutoff', 'cutoff': 0.749208775166329, 'grm_norm': 'cosine', 'self_loops': False, 'use_snp_selection': False}. Best is trial 71 with value: 0.31284303337172253.
[I 2025-12-10 01:31:10,962] Trial 108 finished with value: 0.12617952866676702 and parameters: {'model_type': 'graphsage', 'hidden_dims': '[256, 128]', 'dropout': 0.3722411841189649, 'batch_norm': False, 'sage_aggr': 'max', 'sage_normalize': False, 'sage_project': False, 'lr': 0.0007975080736045771, 'weight_decay': 2.422234716785497e-07, 'epochs': 163, 'loss': 'mse', 'optimizer': 'adam', 'graph_mode': 'cutoff', 'cutoff': 0.6904420922654829, 'grm_norm': 'cosine', 'self_loops': False, 'use_snp_selection': False}. Best is trial 71 with value: 0.31284303337172253.
[I 2025-12-10 01:31:53,383] Trial 109 finished with value: 0.3060206888900546 and parameters: {'model_type': 'graphsage', 'hidden_dims': '[128, 64]', 'dropout': 0.3516606710057458, 'batch_norm': False, 'sage_aggr': 'max', 'sage_normalize': True, 'sage_project': False, 'lr': 0.004950536980158012, 'weight_decay': 2.8313057050530244e-06, 'epochs': 252, 'loss': 'mse', 'optimizer': 'adam', 'graph_mode': 'cutoff', 'cutoff': 0.8436038545352087, 'grm_norm': 'cosine', 'self_loops': False, 'use_snp_selection': True, 'num_snps': 38163}. Best is trial 71 with value: 0.31284303337172253.
[I 2025-12-10 01:33:10,905] Trial 110 finished with value: 0.307630697625694 and parameters: {'model_type': 'graphsage', 'hidden_dims': '[256, 128, 64]', 'dropout': 0.39889901719832244, 'batch_norm': False, 'sage_aggr': 'max', 'sage_normalize': True, 'sage_project': False, 'lr': 0.004140118000075332, 'weight_decay': 3.5629758974584123e-06, 'epochs': 270, 'loss': 'mse', 'optimizer': 'adam', 'graph_mode': 'cutoff', 'cutoff': 0.7919302584271671, 'grm_norm': 'none', 'self_loops': False, 'use_snp_selection': False}. Best is trial 71 with value: 0.31284303337172253.
[I 2025-12-10 01:33:57,371] Trial 111 finished with value: 0.3066296960901516 and parameters: {'model_type': 'graphsage', 'hidden_dims': '[256, 128]', 'dropout': 0.40499797382069563, 'batch_norm': False, 'sage_aggr': 'max', 'sage_normalize': True, 'sage_project': False, 'lr': 0.0020047024857590993, 'weight_decay': 1.4218148487045901e-06, 'epochs': 158, 'loss': 'mse', 'optimizer': 'adam', 'graph_mode': 'cutoff', 'cutoff': 0.6648573528052032, 'grm_norm': 'cosine', 'self_loops': False, 'use_snp_selection': False}. Best is trial 71 with value: 0.31284303337172253.
[I 2025-12-10 01:34:47,201] Trial 112 finished with value: 0.3055485624721545 and parameters: {'model_type': 'graphsage', 'hidden_dims': '[256, 128]', 'dropout': 0.4234460589850829, 'batch_norm': False, 'sage_aggr': 'max', 'sage_normalize': True, 'sage_project': False, 'lr': 0.002960025049519687, 'weight_decay': 8.475952646613e-07, 'epochs': 171, 'loss': 'mse', 'optimizer': 'adam', 'graph_mode': 'cutoff', 'cutoff': 0.8819511754694028, 'grm_norm': 'cosine', 'self_loops': False, 'use_snp_selection': False}. Best is trial 71 with value: 0.31284303337172253.
[I 2025-12-10 01:35:41,734] Trial 113 finished with value: 0.3034987095521222 and parameters: {'model_type': 'graphsage', 'hidden_dims': '[256, 128]', 'dropout': 0.38112368223145476, 'batch_norm': False, 'sage_aggr': 'max', 'sage_normalize': True, 'sage_project': False, 'lr': 0.0036582191129401497, 'weight_decay': 2.0740434600609835e-06, 'epochs': 186, 'loss': 'mse', 'optimizer': 'adam', 'graph_mode': 'cutoff', 'cutoff': 0.6224218477303706, 'grm_norm': 'cosine', 'self_loops': False, 'use_snp_selection': False}. Best is trial 71 with value: 0.31284303337172253.
[I 2025-12-10 01:36:33,510] Trial 114 finished with value: 0.30357097417088735 and parameters: {'model_type': 'graphsage', 'hidden_dims': '[256, 128]', 'dropout': 0.36561328686264527, 'batch_norm': False, 'sage_aggr': 'max', 'sage_normalize': True, 'sage_project': False, 'lr': 0.002363685719368961, 'weight_decay': 5.129706594617988e-07, 'epochs': 177, 'loss': 'mse', 'optimizer': 'adam', 'graph_mode': 'cutoff', 'cutoff': 0.6446104103219392, 'grm_norm': 'cosine', 'self_loops': False, 'use_snp_selection': False}. Best is trial 71 with value: 0.31284303337172253.
[I 2025-12-10 01:38:07,482] Trial 115 finished with value: 0.2948362423775954 and parameters: {'model_type': 'graphsage', 'hidden_dims': '[256, 128]', 'dropout': 0.3941058071807644, 'batch_norm': False, 'sage_aggr': 'max', 'sage_normalize': True, 'sage_project': False, 'lr': 0.0025995652240322375, 'weight_decay': 1.2016312761623205e-06, 'epochs': 312, 'loss': 'mse', 'optimizer': 'adam', 'graph_mode': 'cutoff', 'cutoff': 0.554514371360711, 'grm_norm': 'cosine', 'self_loops': False, 'use_snp_selection': False}. Best is trial 71 with value: 0.31284303337172253.
[I 2025-12-10 01:39:33,623] Trial 116 finished with value: 0.11666401197348075 and parameters: {'model_type': 'graphsage', 'hidden_dims': '[256, 128]', 'dropout': 0.44036301873427014, 'batch_norm': False, 'sage_aggr': 'max', 'sage_normalize': True, 'sage_project': False, 'lr': 0.0031470776507967094, 'weight_decay': 9.491261706345492e-07, 'epochs': 139, 'loss': 'mae', 'optimizer': 'adam', 'graph_mode': 'knn', 'knn_k': 10, 'weighted_edges': False, 'symmetrize_mode': 'mutual', 'self_loops': False, 'use_snp_selection': False}. Best is trial 71 with value: 0.31284303337172253.
[I 2025-12-10 01:40:55,402] Trial 117 finished with value: 0.3139844326818949 and parameters: {'model_type': 'graphsage', 'hidden_dims': '[256, 128]', 'dropout': 0.4096431040989502, 'batch_norm': True, 'sage_aggr': 'max', 'sage_normalize': True, 'sage_project': False, 'lr': 0.004376794229932262, 'weight_decay': 6.466542677957283e-07, 'epochs': 287, 'loss': 'mse', 'optimizer': 'adam', 'graph_mode': 'cutoff', 'cutoff': 0.7188856323334613, 'grm_norm': 'cosine', 'self_loops': False, 'use_snp_selection': False}. Best is trial 117 with value: 0.3139844326818949.
[I 2025-12-10 01:43:33,911] Trial 118 finished with value: 0.3108704580738283 and parameters: {'model_type': 'graphsage', 'hidden_dims': '[512, 128]', 'dropout': 0.4243041915982822, 'batch_norm': True, 'sage_aggr': 'max', 'sage_normalize': True, 'sage_project': False, 'lr': 0.006357347419691092, 'weight_decay': 3.672126988456771e-07, 'epochs': 301, 'loss': 'mse', 'optimizer': 'adam', 'graph_mode': 'cutoff', 'cutoff': 0.8194831168243917, 'grm_norm': 'cosine', 'self_loops': False, 'use_snp_selection': False}. Best is trial 117 with value: 0.3139844326818949.
[I 2025-12-10 01:46:06,742] Trial 119 finished with value: 0.3143326120645303 and parameters: {'model_type': 'graphsage', 'hidden_dims': '[512, 128]', 'dropout': 0.43053534654704284, 'batch_norm': True, 'sage_aggr': 'max', 'sage_normalize': True, 'sage_project': False, 'lr': 0.008332599210320629, 'weight_decay': 3.8077874150437444e-07, 'epochs': 290, 'loss': 'mse', 'optimizer': 'adam', 'graph_mode': 'cutoff', 'cutoff': 0.8160149905442846, 'grm_norm': 'cosine_then_gcn', 'self_loops': False, 'use_snp_selection': False}. Best is trial 119 with value: 0.3143326120645303.
[I 2025-12-10 01:48:36,988] Trial 120 finished with value: 0.30777162479101594 and parameters: {'model_type': 'graphsage', 'hidden_dims': '[512, 128]', 'dropout': 0.47319336403772894, 'batch_norm': True, 'sage_aggr': 'max', 'sage_normalize': True, 'sage_project': False, 'lr': 0.008431185898673527, 'weight_decay': 2.255722228130978e-07, 'epochs': 285, 'loss': 'mse', 'optimizer': 'adam', 'graph_mode': 'cutoff', 'cutoff': 0.846280505240327, 'grm_norm': 'cosine_then_gcn', 'self_loops': False, 'use_snp_selection': False}. Best is trial 119 with value: 0.3143326120645303.
[I 2025-12-10 01:51:10,471] Trial 121 finished with value: 0.309569811999795 and parameters: {'model_type': 'graphsage', 'hidden_dims': '[512, 128]', 'dropout': 0.4613671644964386, 'batch_norm': True, 'sage_aggr': 'max', 'sage_normalize': True, 'sage_project': False, 'lr': 0.00707711982952607, 'weight_decay': 3.4162846864947974e-07, 'epochs': 291, 'loss': 'mse', 'optimizer': 'adam', 'graph_mode': 'cutoff', 'cutoff': 0.8560976142746353, 'grm_norm': 'cosine_then_gcn', 'self_loops': False, 'use_snp_selection': False}. Best is trial 119 with value: 0.3143326120645303.
[I 2025-12-10 01:53:48,965] Trial 122 finished with value: 0.31071045258616836 and parameters: {'model_type': 'graphsage', 'hidden_dims': '[512, 128]', 'dropout': 0.5099669277151773, 'batch_norm': True, 'sage_aggr': 'max', 'sage_normalize': True, 'sage_project': False, 'lr': 0.004693329422573097, 'weight_decay': 3.1875519805738926e-07, 'epochs': 301, 'loss': 'mse', 'optimizer': 'adam', 'graph_mode': 'cutoff', 'cutoff': 0.821315383384663, 'grm_norm': 'cosine_then_gcn', 'self_loops': False, 'use_snp_selection': False}. Best is trial 119 with value: 0.3143326120645303.
[I 2025-12-10 01:56:26,970] Trial 123 finished with value: 0.3126192448513724 and parameters: {'model_type': 'graphsage', 'hidden_dims': '[512, 128]', 'dropout': 0.5251803383860335, 'batch_norm': True, 'sage_aggr': 'max', 'sage_normalize': True, 'sage_project': False, 'lr': 0.006568769701857244, 'weight_decay': 3.3020368163528254e-07, 'epochs': 300, 'loss': 'mse', 'optimizer': 'adam', 'graph_mode': 'cutoff', 'cutoff': 0.8160100185414547, 'grm_norm': 'cosine_then_gcn', 'self_loops': False, 'use_snp_selection': False}. Best is trial 119 with value: 0.3143326120645303.
