[I 2025-12-05 16:47:46,601] Trial 106 finished with value: 0.25352041656560276 and parameters: {'model_type': 'graphsage', 'hidden_dims': '[512, 256]', 'dropout': 0.5731057296224932, 'batch_norm': True, 'sage_aggr': 'mean', 'sage_normalize': True, 'sage_project': False, 'lr': 0.0004459410911728981, 'weight_decay': 6.978662910156802e-07, 'epochs': 175, 'loss': 'mse', 'optimizer': 'adam', 'graph_mode': 'cutoff', 'cutoff': 0.4582783449393487, 'grm_norm': 'gcn', 'self_loops': False, 'use_snp_selection': False, 'graphsage_batch_size': 16}. Best is trial 102 with value: 0.2734579670807161.
[I 2025-12-05 16:48:43,493] Trial 107 finished with value: 0.2510572288932863 and parameters: {'model_type': 'graphsage', 'hidden_dims': '[128, 64]', 'dropout': 0.5282410170805381, 'batch_norm': True, 'sage_aggr': 'mean', 'sage_normalize': True, 'sage_project': False, 'lr': 0.0003745498237106356, 'weight_decay': 9.87181403244961e-07, 'epochs': 207, 'loss': 'mae', 'optimizer': 'adam', 'graph_mode': 'cutoff', 'cutoff': 0.435506907883662, 'grm_norm': 'cosine', 'self_loops': False, 'use_snp_selection': True, 'num_snps': 30705, 'graphsage_batch_size': 256}. Best is trial 102 with value: 0.2734579670807161.
[I 2025-12-05 16:49:46,433] Trial 108 finished with value: 0.26349402052546816 and parameters: {'model_type': 'graphsage', 'hidden_dims': '[512, 256]', 'dropout': 0.5537420620226748, 'batch_norm': True, 'sage_aggr': 'mean', 'sage_normalize': True, 'sage_project': False, 'lr': 0.0005409979196422202, 'weight_decay': 0.00027628274769811185, 'epochs': 183, 'loss': 'mae', 'optimizer': 'adam', 'graph_mode': 'cutoff', 'cutoff': 0.3485309202942316, 'grm_norm': 'cosine_then_gcn', 'self_loops': False, 'use_snp_selection': True, 'num_snps': 20139, 'graphsage_batch_size': 64}. Best is trial 102 with value: 0.2734579670807161.
[I 2025-12-05 16:50:51,779] Trial 109 finished with value: 0.2459667414087448 and parameters: {'model_type': 'graphsage', 'hidden_dims': '[256, 128]', 'dropout': 0.5870696725598538, 'batch_norm': False, 'sage_aggr': 'mean', 'sage_normalize': True, 'sage_project': False, 'lr': 0.000732620587153223, 'weight_decay': 2.5612523877008126e-07, 'epochs': 192, 'loss': 'mse', 'optimizer': 'adam', 'graph_mode': 'cutoff', 'cutoff': 0.40358252348000334, 'grm_norm': 'gcn', 'self_loops': False, 'use_snp_selection': True, 'num_snps': 28221, 'graphsage_batch_size': 32}. Best is trial 102 with value: 0.2734579670807161.
[I 2025-12-05 16:52:42,643] Trial 110 finished with value: 0.2585129046572461 and parameters: {'model_type': 'graphsage', 'hidden_dims': '[512, 256]', 'dropout': 0.4988015053575574, 'batch_norm': True, 'sage_aggr': 'mean', 'sage_normalize': True, 'sage_project': False, 'lr': 2.115336941818055e-05, 'weight_decay': 5.4641780491394856e-05, 'epochs': 236, 'loss': 'mae', 'optimizer': 'adam', 'graph_mode': 'cutoff', 'cutoff': 0.3094896745728524, 'grm_norm': 'none', 'self_loops': False, 'use_snp_selection': True, 'num_snps': 26286, 'graphsage_batch_size': 64}. Best is trial 102 with value: 0.2734579670807161.
[I 2025-12-05 16:53:27,577] Trial 111 finished with value: 0.26393643921753873 and parameters: {'model_type': 'graphsage', 'hidden_dims': '[128, 64]', 'dropout': 0.569222928364371, 'batch_norm': True, 'sage_aggr': 'mean', 'sage_normalize': True, 'sage_project': False, 'lr': 0.0006468068737829188, 'weight_decay': 3.9936155670759515e-07, 'epochs': 218, 'loss': 'mse', 'optimizer': 'adam', 'graph_mode': 'cutoff', 'cutoff': 0.4085750168940575, 'grm_norm': 'gcn', 'self_loops': False, 'use_snp_selection': True, 'num_snps': 21917, 'graphsage_batch_size': 8}. Best is trial 102 with value: 0.2734579670807161.
[I 2025-12-05 16:54:14,132] Trial 112 finished with value: 0.26441507390691465 and parameters: {'model_type': 'graphsage', 'hidden_dims': '[128, 64]', 'dropout': 0.5454859899705504, 'batch_norm': True, 'sage_aggr': 'mean', 'sage_normalize': True, 'sage_project': False, 'lr': 0.000824707247579855, 'weight_decay': 3.2064619697750272e-06, 'epochs': 199, 'loss': 'mse', 'optimizer': 'adam', 'graph_mode': 'cutoff', 'cutoff': 0.3877964360133192, 'grm_norm': 'gcn', 'self_loops': False, 'use_snp_selection': True, 'num_snps': 22981, 'graphsage_batch_size': 8}. Best is trial 102 with value: 0.2734579670807161.
[I 2025-12-05 16:54:52,208] Trial 113 finished with value: 0.25845595239884256 and parameters: {'model_type': 'graphsage', 'hidden_dims': '[128, 64]', 'dropout': 0.561531693431571, 'batch_norm': True, 'sage_aggr': 'mean', 'sage_normalize': True, 'sage_project': False, 'lr': 0.000477021046488852, 'weight_decay': 4.5903248405031573e-07, 'epochs': 209, 'loss': 'mse', 'optimizer': 'adam', 'graph_mode': 'cutoff', 'cutoff': 0.42676001050823725, 'grm_norm': 'gcn', 'self_loops': False, 'use_snp_selection': True, 'num_snps': 17945, 'graphsage_batch_size': 8}. Best is trial 102 with value: 0.2734579670807161.
[I 2025-12-05 16:55:36,212] Trial 114 finished with value: 0.2465096843764875 and parameters: {'model_type': 'graphsage', 'hidden_dims': '[128, 64]', 'dropout': 0.5831403522464546, 'batch_norm': True, 'sage_aggr': 'mean', 'sage_normalize': True, 'sage_project': False, 'lr': 7.682437166234381e-05, 'weight_decay': 3.2362590877876296e-07, 'epochs': 228, 'loss': 'mse', 'optimizer': 'adam', 'graph_mode': 'cutoff', 'cutoff': 0.46467727470352854, 'grm_norm': 'gcn', 'self_loops': False, 'use_snp_selection': True, 'num_snps': 21511, 'graphsage_batch_size': 8}. Best is trial 102 with value: 0.2734579670807161.
[I 2025-12-05 16:56:10,591] Trial 115 finished with value: 0.2561001702861444 and parameters: {'model_type': 'graphsage', 'hidden_dims': '[128, 64]', 'dropout': 0.537260448165709, 'batch_norm': True, 'sage_aggr': 'mean', 'sage_normalize': True, 'sage_project': False, 'lr': 0.0009800751386628776, 'weight_decay': 6.066890610137849e-07, 'epochs': 201, 'loss': 'mse', 'optimizer': 'adam', 'graph_mode': 'cutoff', 'cutoff': 0.639257676802036, 'grm_norm': 'gcn', 'self_loops': False, 'use_snp_selection': True, 'num_snps': 24333, 'graphsage_batch_size': 8}. Best is trial 102 with value: 0.2734579670807161.
[I 2025-12-05 16:57:16,323] Trial 116 finished with value: 0.2577978145400001 and parameters: {'model_type': 'graphsage', 'hidden_dims': '[512, 256]', 'dropout': 0.5766577462289847, 'batch_norm': True, 'sage_aggr': 'mean', 'sage_normalize': False, 'sage_project': False, 'lr': 0.0006222494082567379, 'weight_decay': 8.345064519654039e-07, 'epochs': 215, 'loss': 'mse', 'optimizer': 'adam', 'graph_mode': 'cutoff', 'cutoff': 0.3663909563019098, 'grm_norm': 'cosine', 'self_loops': False, 'use_snp_selection': True, 'num_snps': 19038, 'graphsage_batch_size': 64}. Best is trial 102 with value: 0.2734579670807161.
[I 2025-12-05 16:58:00,694] Trial 117 finished with value: 0.24479559054577252 and parameters: {'model_type': 'graphsage', 'hidden_dims': '[128, 64]', 'dropout': 0.5998547501879781, 'batch_norm': True, 'sage_aggr': 'mean', 'sage_normalize': True, 'sage_project': False, 'lr': 0.0005675989697804648, 'weight_decay': 4.912565356017936e-07, 'epochs': 204, 'loss': 'mae', 'optimizer': 'adam', 'graph_mode': 'cutoff', 'cutoff': 0.2784695718836946, 'grm_norm': 'cosine_then_gcn', 'self_loops': False, 'use_snp_selection': True, 'num_snps': 15860, 'graphsage_batch_size': 512}. Best is trial 102 with value: 0.2734579670807161.
[I 2025-12-05 16:58:58,393] Trial 118 finished with value: 0.2539648009704133 and parameters: {'model_type': 'graphsage', 'hidden_dims': '[512, 256]', 'dropout': 0.5203346874948908, 'batch_norm': True, 'sage_aggr': 'mean', 'sage_normalize': True, 'sage_project': False, 'lr': 0.0007541703523939078, 'weight_decay': 2.0995924821231104e-07, 'epochs': 224, 'loss': 'mse', 'optimizer': 'adam', 'graph_mode': 'cutoff', 'cutoff': 0.8738554222663129, 'grm_norm': 'gcn', 'self_loops': False, 'use_snp_selection': True, 'num_snps': 19716, 'graphsage_batch_size': 32}. Best is trial 102 with value: 0.2734579670807161.
[I 2025-12-05 17:00:10,634] Trial 119 finished with value: 0.20877224163187483 and parameters: {'model_type': 'graphsage', 'hidden_dims': '[512, 64]', 'dropout': 0.5554102757671077, 'batch_norm': True, 'sage_aggr': 'max', 'sage_normalize': True, 'sage_project': False, 'lr': 8.18191017510959e-06, 'weight_decay': 2.818906248596491e-07, 'epochs': 180, 'loss': 'mae', 'optimizer': 'adam', 'graph_mode': 'cutoff', 'cutoff': 0.4025851901119742, 'grm_norm': 'gcn', 'self_loops': False, 'use_snp_selection': True, 'num_snps': 22973, 'graphsage_batch_size': 64}. Best is trial 102 with value: 0.2734579670807161.
[I 2025-12-05 17:01:11,786] Trial 120 finished with value: 0.22589996719006455 and parameters: {'model_type': 'graphsage', 'hidden_dims': '[256, 128]', 'dropout': 0.5665728726451044, 'batch_norm': True, 'sage_aggr': 'mean', 'sage_normalize': True, 'sage_project': False, 'lr': 0.00042453023694514244, 'weight_decay': 1.6615578183603483e-06, 'epochs': 190, 'loss': 'mse', 'optimizer': 'adam', 'graph_mode': 'knn', 'knn_k': 7, 'weighted_edges': False, 'symmetrize_mode': 'mutual', 'self_loops': False, 'use_snp_selection': True, 'num_snps': 26162, 'graphsage_batch_size': 8}. Best is trial 102 with value: 0.2734579670807161.
[I 2025-12-05 17:02:10,930] Trial 121 finished with value: 0.2617774724050765 and parameters: {'model_type': 'graphsage', 'hidden_dims': '[512, 256]', 'dropout': 0.5448481679523692, 'batch_norm': True, 'sage_aggr': 'mean', 'sage_normalize': True, 'sage_project': False, 'lr': 0.0008763320500385285, 'weight_decay': 8.130320825347502e-06, 'epochs': 166, 'loss': 'mae', 'optimizer': 'adam', 'graph_mode': 'cutoff', 'cutoff': 0.42057691731630426, 'grm_norm': 'cosine_then_gcn', 'self_loops': False, 'use_snp_selection': True, 'num_snps': 21246, 'graphsage_batch_size': 64}. Best is trial 102 with value: 0.2734579670807161.
[I 2025-12-05 17:03:23,620] Trial 122 finished with value: 0.2664376975426667 and parameters: {'model_type': 'graphsage', 'hidden_dims': '[512, 256]', 'dropout': 0.5270514887343131, 'batch_norm': True, 'sage_aggr': 'mean', 'sage_normalize': True, 'sage_project': False, 'lr': 0.0009983578252013646, 'weight_decay': 4.820468887755799e-06, 'epochs': 196, 'loss': 'mae', 'optimizer': 'adam', 'graph_mode': 'cutoff', 'cutoff': 0.44398089750139413, 'grm_norm': 'cosine_then_gcn', 'self_loops': False, 'use_snp_selection': True, 'num_snps': 24112, 'graphsage_batch_size': 64}. Best is trial 102 with value: 0.2734579670807161.
[I 2025-12-05 17:04:37,817] Trial 123 finished with value: 0.259242188076103 and parameters: {'model_type': 'graphsage', 'hidden_dims': '[512, 256]', 'dropout': 0.534277774536349, 'batch_norm': True, 'sage_aggr': 'mean', 'sage_normalize': True, 'sage_project': False, 'lr': 0.000694437704196658, 'weight_decay': 4.169498335684238e-06, 'epochs': 197, 'loss': 'mae', 'optimizer': 'adam', 'graph_mode': 'cutoff', 'cutoff': 0.4498039106239093, 'grm_norm': 'cosine_then_gcn', 'self_loops': False, 'use_snp_selection': True, 'num_snps': 24427, 'graphsage_batch_size': 64}. Best is trial 102 with value: 0.2734579670807161.
[I 2025-12-05 17:06:06,654] Trial 124 finished with value: 0.2624453072251432 and parameters: {'model_type': 'graphsage', 'hidden_dims': '[512, 256]', 'dropout': 0.5261707962485307, 'batch_norm': True, 'sage_aggr': 'mean', 'sage_normalize': True, 'sage_project': False, 'lr': 0.0008019353751919459, 'weight_decay': 5.192295608941847e-06, 'epochs': 209, 'loss': 'mae', 'optimizer': 'adam', 'graph_mode': 'cutoff', 'cutoff': 0.43717149689468443, 'grm_norm': 'cosine_then_gcn', 'self_loops': False, 'use_snp_selection': True, 'num_snps': 27678, 'graphsage_batch_size': 64}. Best is trial 102 with value: 0.2734579670807161.
[I 2025-12-05 17:07:14,369] Trial 125 finished with value: 0.2601998143471695 and parameters: {'model_type': 'graphsage', 'hidden_dims': '[512, 256]', 'dropout': 0.5078466665577248, 'batch_norm': True, 'sage_aggr': 'mean', 'sage_normalize': True, 'sage_project': False, 'lr': 0.0009910418491179567, 'weight_decay': 1.2230253044903707e-05, 'epochs': 189, 'loss': 'mae', 'optimizer': 'adam', 'graph_mode': 'cutoff', 'cutoff': 0.480781666855774, 'grm_norm': 'cosine', 'self_loops': False, 'use_snp_selection': True, 'num_snps': 23181, 'graphsage_batch_size': 64}. Best is trial 102 with value: 0.2734579670807161.
[I 2025-12-05 17:10:13,454] Trial 126 finished with value: 0.22850898708157202 and parameters: {'model_type': 'graphsage', 'hidden_dims': '[128, 64]', 'dropout': 0.5528471218072825, 'batch_norm': True, 'sage_aggr': 'mean', 'sage_normalize': True, 'sage_project': False, 'lr': 0.0005216134325299537, 'weight_decay': 0.0009810516022366815, 'epochs': 204, 'loss': 'mae', 'optimizer': 'adam', 'graph_mode': 'cutoff', 'cutoff': 0.208257713879205, 'grm_norm': 'cosine_then_gcn', 'self_loops': False, 'use_snp_selection': False, 'graphsage_batch_size': 128}. Best is trial 102 with value: 0.2734579670807161.
[I 2025-12-05 17:11:34,252] Trial 127 finished with value: 0.26514523335197615 and parameters: {'model_type': 'graphsage', 'hidden_dims': '[512, 256]', 'dropout': 0.5779169341697361, 'batch_norm': True, 'sage_aggr': 'mean', 'sage_normalize': True, 'sage_project': False, 'lr': 0.0006323893604916859, 'weight_decay': 6.418541567965448e-06, 'epochs': 195, 'loss': 'mae', 'optimizer': 'adam', 'graph_mode': 'cutoff', 'cutoff': 0.37765087726103996, 'grm_norm': 'gcn', 'self_loops': False, 'use_snp_selection': True, 'num_snps': 25632, 'graphsage_batch_size': 64}. Best is trial 102 with value: 0.2734579670807161.
[I 2025-12-05 17:13:04,171] Trial 128 finished with value: 0.26331778529622285 and parameters: {'model_type': 'graphsage', 'hidden_dims': '[512, 256]', 'dropout': 0.5596565971350111, 'batch_norm': True, 'sage_aggr': 'mean', 'sage_normalize': True, 'sage_project': False, 'lr': 0.0008498032383245095, 'weight_decay': 4.113833154432349e-07, 'epochs': 184, 'loss': 'mse', 'optimizer': 'adam', 'graph_mode': 'cutoff', 'cutoff': 0.39195575459350146, 'grm_norm': 'gcn', 'self_loops': False, 'use_snp_selection': True, 'num_snps': 29410, 'graphsage_batch_size': 32}. Best is trial 102 with value: 0.2734579670807161.
[I 2025-12-05 17:14:10,828] Trial 129 finished with value: 0.2268669830464615 and parameters: {'model_type': 'graphsage', 'hidden_dims': '[512, 128]', 'dropout': 0.5892165642192917, 'batch_norm': False, 'sage_aggr': 'mean', 'sage_normalize': True, 'sage_project': False, 'lr': 0.00024708683969761194, 'weight_decay': 2.83711944388418e-06, 'epochs': 219, 'loss': 'mae', 'optimizer': 'adam', 'graph_mode': 'cutoff', 'cutoff': 0.5047908466610429, 'grm_norm': 'gcn', 'self_loops': False, 'use_snp_selection': True, 'num_snps': 21875, 'graphsage_batch_size': 64}. Best is trial 102 with value: 0.2734579670807161.
[I 2025-12-05 17:15:25,653] Trial 130 finished with value: 0.24880370105210595 and parameters: {'model_type': 'graphsage', 'hidden_dims': '[256, 128, 64]', 'dropout': 0.43763029303602274, 'batch_norm': True, 'sage_aggr': 'mean', 'sage_normalize': True, 'sage_project': False, 'lr': 0.0007042540562670034, 'weight_decay': 3.6217080981984646e-07, 'epochs': 212, 'loss': 'mae', 'optimizer': 'adam', 'graph_mode': 'cutoff', 'cutoff': 0.24373840280155243, 'grm_norm': 'cosine', 'self_loops': False, 'use_snp_selection': True, 'num_snps': 19839, 'graphsage_batch_size': 8}. Best is trial 102 with value: 0.2734579670807161.
[I 2025-12-05 17:16:31,902] Trial 131 finished with value: 0.2612951419810387 and parameters: {'model_type': 'graphsage', 'hidden_dims': '[512, 256]', 'dropout': 0.538035940515048, 'batch_norm': True, 'sage_aggr': 'mean', 'sage_normalize': True, 'sage_project': False, 'lr': 0.0008798388409328185, 'weight_decay': 9.536488152042678e-06, 'epochs': 171, 'loss': 'mae', 'optimizer': 'adam', 'graph_mode': 'cutoff', 'cutoff': 0.4216222734200922, 'grm_norm': 'cosine_then_gcn', 'self_loops': False, 'use_snp_selection': True, 'num_snps': 23797, 'graphsage_batch_size': 64}. Best is trial 102 with value: 0.2734579670807161.
[I 2025-12-05 17:17:38,376] Trial 132 finished with value: 0.2651596121883471 and parameters: {'model_type': 'graphsage', 'hidden_dims': '[512, 256]', 'dropout': 0.5162511855470256, 'batch_norm': True, 'sage_aggr': 'mean', 'sage_normalize': True, 'sage_project': False, 'lr': 0.0005725993713581093, 'weight_decay': 5.844297567871856e-06, 'epochs': 200, 'loss': 'mae', 'optimizer': 'adam', 'graph_mode': 'cutoff', 'cutoff': 0.4690618662842171, 'grm_norm': 'cosine_then_gcn', 'self_loops': False, 'use_snp_selection': True, 'num_snps': 20772, 'graphsage_batch_size': 64}. Best is trial 102 with value: 0.2734579670807161.
[I 2025-12-05 17:18:34,871] Trial 133 finished with value: 0.2583473404443177 and parameters: {'model_type': 'graphsage', 'hidden_dims': '[512, 256]', 'dropout': 0.5478122629279786, 'batch_norm': True, 'sage_aggr': 'mean', 'sage_normalize': True, 'sage_project': False, 'lr': 0.000767061184740525, 'weight_decay': 4.4967415401967175e-06, 'epochs': 193, 'loss': 'mae', 'optimizer': 'adam', 'graph_mode': 'cutoff', 'cutoff': 0.4482610375392241, 'grm_norm': 'cosine_then_gcn', 'self_loops': False, 'use_snp_selection': True, 'num_snps': 17795, 'graphsage_batch_size': 64}. Best is trial 102 with value: 0.2734579670807161.
[I 2025-12-05 17:19:35,526] Trial 134 finished with value: 0.2561520689455642 and parameters: {'model_type': 'graphsage', 'hidden_dims': '[512, 256]', 'dropout': 0.5704189910209992, 'batch_norm': True, 'sage_aggr': 'mean', 'sage_normalize': True, 'sage_project': False, 'lr': 0.0009757660176159184, 'weight_decay': 7.434950482077668e-06, 'epochs': 179, 'loss': 'mae', 'optimizer': 'adam', 'graph_mode': 'cutoff', 'cutoff': 0.7949792375624056, 'grm_norm': 'cosine_then_gcn', 'self_loops': False, 'use_snp_selection': True, 'num_snps': 24878, 'graphsage_batch_size': 64}. Best is trial 102 with value: 0.2734579670807161.
[I 2025-12-05 17:20:19,399] Trial 135 finished with value: 0.2572453442648272 and parameters: {'model_type': 'graphsage', 'hidden_dims': '[128, 64]', 'dropout': 0.34001378500775287, 'batch_norm': True, 'sage_aggr': 'mean', 'sage_normalize': True, 'sage_project': False, 'lr': 0.0004836310313369417, 'weight_decay': 2.1718035468267804e-06, 'epochs': 205, 'loss': 'mse', 'optimizer': 'adam', 'graph_mode': 'cutoff', 'cutoff': 0.4110735014185925, 'grm_norm': 'gcn', 'self_loops': False, 'use_snp_selection': True, 'num_snps': 22458, 'graphsage_batch_size': 256}. Best is trial 102 with value: 0.2734579670807161.
[I 2025-12-05 17:21:21,287] Trial 136 finished with value: 0.26444582503420283 and parameters: {'model_type': 'graphsage', 'hidden_dims': '[512, 256]', 'dropout': 0.5335224188803366, 'batch_norm': True, 'sage_aggr': 'mean', 'sage_normalize': False, 'sage_project': False, 'lr': 0.0006742509079361358, 'weight_decay': 2.332829836460307e-07, 'epochs': 198, 'loss': 'mae', 'optimizer': 'adam', 'graph_mode': 'cutoff', 'cutoff': 0.4302573029071993, 'grm_norm': 'gcn', 'self_loops': False, 'use_snp_selection': True, 'num_snps': 19555, 'graphsage_batch_size': 16}. Best is trial 102 with value: 0.2734579670807161.
[I 2025-12-05 17:22:24,866] Trial 137 finished with value: 0.26309101548859903 and parameters: {'model_type': 'graphsage', 'hidden_dims': '[256, 128]', 'dropout': 0.55904745976663, 'batch_norm': True, 'sage_aggr': 'mean', 'sage_normalize': True, 'sage_project': False, 'lr': 0.0006138429955529918, 'weight_decay': 5.892536069560828e-07, 'epochs': 184, 'loss': 'mae', 'optimizer': 'adam', 'graph_mode': 'cutoff', 'cutoff': 0.3373333711615736, 'grm_norm': 'cosine_then_gcn', 'self_loops': False, 'use_snp_selection': True, 'num_snps': 26964, 'graphsage_batch_size': 64}. Best is trial 102 with value: 0.2734579670807161.
[I 2025-12-05 17:23:14,324] Trial 138 finished with value: 0.264288304130649 and parameters: {'model_type': 'graphsage', 'hidden_dims': '[128, 64]', 'dropout': 0.5263876452685504, 'batch_norm': True, 'sage_aggr': 'max', 'sage_normalize': True, 'sage_project': False, 'lr': 0.0008193376023096013, 'weight_decay': 7.368935738726689e-07, 'epochs': 215, 'loss': 'mse', 'optimizer': 'adam', 'graph_mode': 'cutoff', 'cutoff': 0.3961114316193879, 'grm_norm': 'none', 'self_loops': False, 'use_snp_selection': True, 'num_snps': 20725, 'graphsage_batch_size': 32}. Best is trial 102 with value: 0.2734579670807161.
[I 2025-12-05 17:24:34,229] Trial 139 finished with value: 0.26844045653377874 and parameters: {'model_type': 'graphsage', 'hidden_dims': '[512, 256]', 'dropout': 0.5452858225906125, 'batch_norm': True, 'sage_aggr': 'mean', 'sage_normalize': True, 'sage_project': False, 'lr': 0.0009893003576479703, 'weight_decay': 3.260601433385841e-06, 'epochs': 209, 'loss': 'mae', 'optimizer': 'adam', 'graph_mode': 'cutoff', 'cutoff': 0.3613512424411588, 'grm_norm': 'gcn', 'self_loops': False, 'use_snp_selection': True, 'num_snps': 23515, 'graphsage_batch_size': 8}. Best is trial 102 with value: 0.2734579670807161.
[I 2025-12-05 17:25:55,758] Trial 140 finished with value: 0.26412525338423204 and parameters: {'model_type': 'graphsage', 'hidden_dims': '[512, 256]', 'dropout': 0.5461388223050873, 'batch_norm': True, 'sage_aggr': 'mean', 'sage_normalize': True, 'sage_project': False, 'lr': 0.0009915388853385173, 'weight_decay': 2.792581300937167e-06, 'epochs': 209, 'loss': 'mse', 'optimizer': 'adam', 'graph_mode': 'cutoff', 'cutoff': 0.4550210045637107, 'grm_norm': 'gcn', 'self_loops': False, 'use_snp_selection': True, 'num_snps': 25723, 'graphsage_batch_size': 8}. Best is trial 102 with value: 0.2734579670807161.
