[I 2025-12-08 23:23:43,299] Trial 122 finished with value: 0.3088862221518508 and parameters: {'model_type': 'graphsage', 'hidden_dims': '[512, 256]', 'dropout': 0.522058580898993, 'batch_norm': True, 'sage_aggr': 'mean', 'sage_normalize': True, 'sage_project': False, 'lr': 0.005210106269303183, 'weight_decay': 8.746678366234778e-07, 'epochs': 252, 'loss': 'mse', 'optimizer': 'adam', 'graph_mode': 'cutoff', 'cutoff': 0.8097745681083106, 'grm_norm': 'cosine', 'self_loops': True, 'use_snp_selection': False}. Best is trial 97 with value: 0.3182992944876167.
[I 2025-12-08 23:25:23,020] Trial 123 finished with value: 0.31068916478439246 and parameters: {'model_type': 'graphsage', 'hidden_dims': '[512, 128]', 'dropout': 0.4764362016023253, 'batch_norm': True, 'sage_aggr': 'mean', 'sage_normalize': True, 'sage_project': False, 'lr': 0.00845762814061103, 'weight_decay': 1.1289624328932028e-06, 'epochs': 221, 'loss': 'mse', 'optimizer': 'adam', 'graph_mode': 'cutoff', 'cutoff': 0.7247074309360388, 'grm_norm': 'cosine', 'self_loops': True, 'use_snp_selection': False}. Best is trial 97 with value: 0.3182992944876167.
[I 2025-12-08 23:27:06,194] Trial 124 finished with value: 0.3133871356943341 and parameters: {'model_type': 'graphsage', 'hidden_dims': '[512, 128]', 'dropout': 0.5697119566518267, 'batch_norm': True, 'sage_aggr': 'mean', 'sage_normalize': True, 'sage_project': False, 'lr': 0.006074997743317838, 'weight_decay': 4.6517916682173957e-07, 'epochs': 230, 'loss': 'mse', 'optimizer': 'adam', 'graph_mode': 'cutoff', 'cutoff': 0.8775420640484124, 'grm_norm': 'cosine', 'self_loops': True, 'use_snp_selection': False}. Best is trial 97 with value: 0.3182992944876167.
[I 2025-12-08 23:28:06,669] Trial 125 finished with value: 0.311210406814728 and parameters: {'model_type': 'graphsage', 'hidden_dims': '[256, 128, 64]', 'dropout': 0.5735696341007399, 'batch_norm': True, 'sage_aggr': 'mean', 'sage_normalize': True, 'sage_project': False, 'lr': 0.006395294785676418, 'weight_decay': 4.678114930341372e-07, 'epochs': 232, 'loss': 'mse', 'optimizer': 'adam', 'graph_mode': 'cutoff', 'cutoff': 0.8804792792630409, 'grm_norm': 'gcn', 'self_loops': True, 'use_snp_selection': False}. Best is trial 97 with value: 0.3182992944876167.
[I 2025-12-08 23:29:53,352] Trial 126 finished with value: 0.31021764521106404 and parameters: {'model_type': 'graphsage', 'hidden_dims': '[512, 128]', 'dropout': 0.5670673892741587, 'batch_norm': True, 'sage_aggr': 'mean', 'sage_normalize': True, 'sage_project': False, 'lr': 0.0003318321163957705, 'weight_decay': 3.3369900650666444e-06, 'epochs': 239, 'loss': 'mse', 'optimizer': 'adam', 'graph_mode': 'cutoff', 'cutoff': 0.8596540772863519, 'grm_norm': 'cosine', 'self_loops': True, 'use_snp_selection': False}. Best is trial 97 with value: 0.3182992944876167.
[I 2025-12-08 23:31:43,972] Trial 127 finished with value: 0.3084116917669528 and parameters: {'model_type': 'graphsage', 'hidden_dims': '[512, 128]', 'dropout': 0.5478163934814112, 'batch_norm': True, 'sage_aggr': 'mean', 'sage_normalize': True, 'sage_project': False, 'lr': 0.005574606019614029, 'weight_decay': 6.42248975291888e-07, 'epochs': 249, 'loss': 'mse', 'optimizer': 'adam', 'graph_mode': 'cutoff', 'cutoff': 0.7728913679814223, 'grm_norm': 'cosine', 'self_loops': True, 'use_snp_selection': False}. Best is trial 97 with value: 0.3182992944876167.
[I 2025-12-08 23:33:20,732] Trial 128 finished with value: 0.3074548511662255 and parameters: {'model_type': 'graphsage', 'hidden_dims': '[512, 256]', 'dropout': 0.558542364287283, 'batch_norm': True, 'sage_aggr': 'max', 'sage_normalize': True, 'sage_project': False, 'lr': 0.004497881569030834, 'weight_decay': 2.88287566426914e-07, 'epochs': 214, 'loss': 'mse', 'optimizer': 'adam', 'graph_mode': 'cutoff', 'cutoff': 0.8477169990574126, 'grm_norm': 'cosine', 'self_loops': True, 'use_snp_selection': False}. Best is trial 97 with value: 0.3182992944876167.
[I 2025-12-08 23:35:02,755] Trial 129 finished with value: 0.3078164971583526 and parameters: {'model_type': 'graphsage', 'hidden_dims': '[512, 128]', 'dropout': 0.589521023121706, 'batch_norm': True, 'sage_aggr': 'mean', 'sage_normalize': True, 'sage_project': False, 'lr': 0.007142721577035194, 'weight_decay': 1.6478955766181524e-05, 'epochs': 230, 'loss': 'mse', 'optimizer': 'adam', 'graph_mode': 'cutoff', 'cutoff': 0.8741638307774079, 'grm_norm': 'gcn', 'self_loops': True, 'use_snp_selection': False}. Best is trial 97 with value: 0.3182992944876167.
[I 2025-12-08 23:37:01,476] Trial 130 finished with value: 0.310717895621682 and parameters: {'model_type': 'graphsage', 'hidden_dims': '[512, 64]', 'dropout': 0.4964419455099446, 'batch_norm': True, 'sage_aggr': 'mean', 'sage_normalize': True, 'sage_project': False, 'lr': 0.004931914136572908, 'weight_decay': 1.8219759270906617e-06, 'epochs': 270, 'loss': 'mse', 'optimizer': 'adam', 'graph_mode': 'cutoff', 'cutoff': 0.8197310687802221, 'grm_norm': 'cosine', 'self_loops': True, 'use_snp_selection': False}. Best is trial 97 with value: 0.3182992944876167.
[I 2025-12-08 23:38:32,939] Trial 131 finished with value: 0.31387173746439584 and parameters: {'model_type': 'graphsage', 'hidden_dims': '[512, 128]', 'dropout': 0.5342942793463492, 'batch_norm': True, 'sage_aggr': 'mean', 'sage_normalize': True, 'sage_project': False, 'lr': 0.008234589060825285, 'weight_decay': 7.341261585326415e-07, 'epochs': 200, 'loss': 'mse', 'optimizer': 'adam', 'graph_mode': 'cutoff', 'cutoff': 0.8340009590589433, 'grm_norm': 'cosine', 'self_loops': True, 'use_snp_selection': False}. Best is trial 97 with value: 0.3182992944876167.
[I 2025-12-08 23:40:26,681] Trial 132 finished with value: 0.3104562740031971 and parameters: {'model_type': 'graphsage', 'hidden_dims': '[512, 128]', 'dropout': 0.5135866444591547, 'batch_norm': True, 'sage_aggr': 'mean', 'sage_normalize': True, 'sage_project': False, 'lr': 0.006027650214100778, 'weight_decay': 1.0779605097179994e-06, 'epochs': 257, 'loss': 'mse', 'optimizer': 'adam', 'graph_mode': 'cutoff', 'cutoff': 0.8030400490144012, 'grm_norm': 'cosine', 'self_loops': True, 'use_snp_selection': False}. Best is trial 97 with value: 0.3182992944876167.
[I 2025-12-08 23:41:56,602] Trial 133 finished with value: 0.3092784992291666 and parameters: {'model_type': 'graphsage', 'hidden_dims': '[512, 128]', 'dropout': 0.5787102913861998, 'batch_norm': True, 'sage_aggr': 'mean', 'sage_normalize': True, 'sage_project': False, 'lr': 0.009889050621161547, 'weight_decay': 1.2397148710091128e-06, 'epochs': 196, 'loss': 'mse', 'optimizer': 'adam', 'graph_mode': 'cutoff', 'cutoff': 0.7867699353571691, 'grm_norm': 'cosine', 'self_loops': True, 'use_snp_selection': False}. Best is trial 97 with value: 0.3182992944876167.
[I 2025-12-08 23:43:21,319] Trial 134 finished with value: 0.30699195841376054 and parameters: {'model_type': 'graphsage', 'hidden_dims': '[512, 128]', 'dropout': 0.5439163438413886, 'batch_norm': True, 'sage_aggr': 'mean', 'sage_normalize': True, 'sage_project': False, 'lr': 0.00765863265427973, 'weight_decay': 4.101932648030245e-07, 'epochs': 179, 'loss': 'mse', 'optimizer': 'adam', 'graph_mode': 'cutoff', 'cutoff': 0.5490075968798319, 'grm_norm': 'cosine', 'self_loops': True, 'use_snp_selection': False}. Best is trial 97 with value: 0.3182992944876167.
[I 2025-12-08 23:45:07,598] Trial 135 finished with value: 0.3119395244427662 and parameters: {'model_type': 'graphsage', 'hidden_dims': '[512, 128]', 'dropout': 0.5654804269430507, 'batch_norm': True, 'sage_aggr': 'mean', 'sage_normalize': True, 'sage_project': False, 'lr': 0.006927648453758971, 'weight_decay': 1.5221793257283175e-06, 'epochs': 241, 'loss': 'mse', 'optimizer': 'adam', 'graph_mode': 'cutoff', 'cutoff': 0.8972496063073193, 'grm_norm': 'none', 'self_loops': True, 'use_snp_selection': False}. Best is trial 97 with value: 0.3182992944876167.
[I 2025-12-08 23:46:48,822] Trial 136 finished with value: 0.30947844760063503 and parameters: {'model_type': 'graphsage', 'hidden_dims': '[512, 128]', 'dropout': 0.5278759472174028, 'batch_norm': True, 'sage_aggr': 'mean', 'sage_normalize': True, 'sage_project': False, 'lr': 0.003973915797919639, 'weight_decay': 7.579889763761697e-06, 'epochs': 225, 'loss': 'mse', 'optimizer': 'adam', 'graph_mode': 'cutoff', 'cutoff': 0.8371715378660862, 'grm_norm': 'cosine', 'self_loops': True, 'use_snp_selection': False}. Best is trial 97 with value: 0.3182992944876167.
[I 2025-12-08 23:48:53,425] Trial 137 finished with value: 0.3028804613999118 and parameters: {'model_type': 'graphsage', 'hidden_dims': '[512, 128]', 'dropout': 0.5521261709048694, 'batch_norm': True, 'sage_aggr': 'mean', 'sage_normalize': True, 'sage_project': False, 'lr': 0.005668806549789347, 'weight_decay': 6.177904414601366e-07, 'epochs': 209, 'loss': 'mse', 'optimizer': 'adam', 'graph_mode': 'knn', 'knn_k': 8, 'weighted_edges': True, 'symmetrize_mode': 'mutual', 'self_loops': True, 'use_snp_selection': False}. Best is trial 97 with value: 0.3182992944876167.
[I 2025-12-08 23:50:21,267] Trial 138 finished with value: 0.3046768717179887 and parameters: {'model_type': 'graphsage', 'hidden_dims': '[512, 128]', 'dropout': 0.5753246757554572, 'batch_norm': True, 'sage_aggr': 'mean', 'sage_normalize': True, 'sage_project': False, 'lr': 0.009998258930287385, 'weight_decay': 4.520105890263507e-06, 'epochs': 190, 'loss': 'mse', 'optimizer': 'adam', 'graph_mode': 'cutoff', 'cutoff': 0.7641935423348897, 'grm_norm': 'cosine', 'self_loops': True, 'use_snp_selection': False}. Best is trial 97 with value: 0.3182992944876167.
[I 2025-12-08 23:51:15,698] Trial 139 finished with value: 0.30598503690441703 and parameters: {'model_type': 'graphsage', 'hidden_dims': '[256, 128, 64]', 'dropout': 0.5924264701095983, 'batch_norm': True, 'sage_aggr': 'mean', 'sage_normalize': True, 'sage_project': False, 'lr': 0.00044730646061684026, 'weight_decay': 8.564268974297542e-07, 'epochs': 199, 'loss': 'mse', 'optimizer': 'adam', 'graph_mode': 'cutoff', 'cutoff': 0.8265468247889585, 'grm_norm': 'cosine', 'self_loops': True, 'use_snp_selection': False}. Best is trial 97 with value: 0.3182992944876167.
[I 2025-12-08 23:53:16,809] Trial 140 finished with value: 0.3029630137914262 and parameters: {'model_type': 'graphsage', 'hidden_dims': '[512, 128]', 'dropout': 0.5115327976767887, 'batch_norm': True, 'sage_aggr': 'mean', 'sage_normalize': True, 'sage_project': False, 'lr': 0.008531219254039336, 'weight_decay': 1.0072664276327769e-07, 'epochs': 220, 'loss': 'mse', 'optimizer': 'adam', 'graph_mode': 'cutoff', 'cutoff': 0.3083730692512471, 'grm_norm': 'cosine', 'self_loops': True, 'use_snp_selection': False}. Best is trial 97 with value: 0.3182992944876167.
[I 2025-12-08 23:54:50,175] Trial 141 finished with value: 0.31248091660530786 and parameters: {'model_type': 'graphsage', 'hidden_dims': '[512, 128]', 'dropout': 0.5385979718760082, 'batch_norm': True, 'sage_aggr': 'mean', 'sage_normalize': True, 'sage_project': False, 'lr': 0.008426204230545254, 'weight_decay': 7.364699846815581e-07, 'epochs': 205, 'loss': 'mse', 'optimizer': 'adam', 'graph_mode': 'cutoff', 'cutoff': 0.7944793907387535, 'grm_norm': 'cosine', 'self_loops': True, 'use_snp_selection': False}. Best is trial 97 with value: 0.3182992944876167.
[I 2025-12-08 23:56:27,067] Trial 142 finished with value: 0.3090784569790145 and parameters: {'model_type': 'graphsage', 'hidden_dims': '[512, 128]', 'dropout': 0.5299643466448043, 'batch_norm': True, 'sage_aggr': 'mean', 'sage_normalize': True, 'sage_project': False, 'lr': 0.007351250681534169, 'weight_decay': 2.181888020068347e-06, 'epochs': 214, 'loss': 'mse', 'optimizer': 'adam', 'graph_mode': 'cutoff', 'cutoff': 0.835187827775034, 'grm_norm': 'cosine', 'self_loops': True, 'use_snp_selection': False}. Best is trial 97 with value: 0.3182992944876167.
[I 2025-12-08 23:57:59,288] Trial 143 finished with value: 0.31170323866390737 and parameters: {'model_type': 'graphsage', 'hidden_dims': '[512, 128]', 'dropout': 0.5355030708559795, 'batch_norm': True, 'sage_aggr': 'mean', 'sage_normalize': True, 'sage_project': False, 'lr': 0.006400746182579593, 'weight_decay': 4.348499154742315e-07, 'epochs': 202, 'loss': 'mse', 'optimizer': 'adam', 'graph_mode': 'cutoff', 'cutoff': 0.8137605574665879, 'grm_norm': 'cosine', 'self_loops': True, 'use_snp_selection': False}. Best is trial 97 with value: 0.3182992944876167.
[I 2025-12-08 23:59:48,747] Trial 144 finished with value: 0.3074173447588211 and parameters: {'model_type': 'graphsage', 'hidden_dims': '[512, 128]', 'dropout': 0.521876320071169, 'batch_norm': True, 'sage_aggr': 'mean', 'sage_normalize': True, 'sage_project': False, 'lr': 0.00859288754170263, 'weight_decay': 7.054061335402469e-07, 'epochs': 246, 'loss': 'mse', 'optimizer': 'adam', 'graph_mode': 'cutoff', 'cutoff': 0.8531943486108947, 'grm_norm': 'cosine', 'self_loops': True, 'use_snp_selection': False}. Best is trial 97 with value: 0.3182992944876167.
[I 2025-12-09 00:00:37,079] Trial 145 finished with value: 0.30998442523080627 and parameters: {'model_type': 'graphsage', 'hidden_dims': '[256, 128]', 'dropout': 0.5591428909970503, 'batch_norm': True, 'sage_aggr': 'mean', 'sage_normalize': True, 'sage_project': False, 'lr': 0.00762596821520905, 'weight_decay': 5.264032263102907e-07, 'epochs': 172, 'loss': 'mse', 'optimizer': 'adam', 'graph_mode': 'cutoff', 'cutoff': 0.8728340787520127, 'grm_norm': 'cosine', 'self_loops': True, 'use_snp_selection': False}. Best is trial 97 with value: 0.3182992944876167.
[I 2025-12-09 00:02:20,211] Trial 146 finished with value: 0.3075950295183893 and parameters: {'model_type': 'graphsage', 'hidden_dims': '[512, 128]', 'dropout': 0.5827281788359978, 'batch_norm': False, 'sage_aggr': 'mean', 'sage_normalize': True, 'sage_project': False, 'lr': 0.005084368081292872, 'weight_decay': 1.0727718542615465e-06, 'epochs': 233, 'loss': 'mse', 'optimizer': 'adam', 'graph_mode': 'cutoff', 'cutoff': 0.7806007264321547, 'grm_norm': 'gcn', 'self_loops': False, 'use_snp_selection': False}. Best is trial 97 with value: 0.3182992944876167.
[I 2025-12-09 00:03:49,198] Trial 147 finished with value: 0.3106235952003327 and parameters: {'model_type': 'graphsage', 'hidden_dims': '[512, 256]', 'dropout': 0.5699004256315957, 'batch_norm': True, 'sage_aggr': 'mean', 'sage_normalize': True, 'sage_project': False, 'lr': 0.006287143824902511, 'weight_decay': 3.4098500930222595e-06, 'epochs': 193, 'loss': 'mse', 'optimizer': 'adam', 'graph_mode': 'cutoff', 'cutoff': 0.7495215296669263, 'grm_norm': 'cosine', 'self_loops': True, 'use_snp_selection': False}. Best is trial 97 with value: 0.3182992944876167.
[I 2025-12-09 00:05:13,207] Trial 148 finished with value: 0.31586851408134675 and parameters: {'model_type': 'graphsage', 'hidden_dims': '[512, 128]', 'dropout': 0.5987156846838914, 'batch_norm': True, 'sage_aggr': 'mean', 'sage_normalize': True, 'sage_project': False, 'lr': 0.008916825397421604, 'weight_decay': 5.976696238256219e-06, 'epochs': 181, 'loss': 'mse', 'optimizer': 'adam', 'graph_mode': 'cutoff', 'cutoff': 0.8246474482515243, 'grm_norm': 'cosine', 'self_loops': True, 'use_snp_selection': False}. Best is trial 97 with value: 0.3182992944876167.
[I 2025-12-09 00:06:37,960] Trial 149 finished with value: 0.31138463224610635 and parameters: {'model_type': 'graphsage', 'hidden_dims': '[512, 128]', 'dropout': 0.5906546517119019, 'batch_norm': True, 'sage_aggr': 'mean', 'sage_normalize': True, 'sage_project': False, 'lr': 0.004338298292836769, 'weight_decay': 5.926922854799127e-06, 'epochs': 183, 'loss': 'mse', 'optimizer': 'adam', 'graph_mode': 'cutoff', 'cutoff': 0.8050707306649436, 'grm_norm': 'cosine', 'self_loops': True, 'use_snp_selection': False}. Best is trial 97 with value: 0.3182992944876167.
[I 2025-12-09 00:08:04,690] Trial 0 finished with value: 0.2796654394038788 and parameters: {'model_type': 'graphsage', 'hidden_dims': '[128, 64]', 'dropout': 0.199031432379812, 'batch_norm': True, 'sage_aggr': 'max', 'sage_normalize': True, 'sage_project': False, 'lr': 0.00034401453323286885, 'weight_decay': 0.00017802616915745114, 'epochs': 230, 'loss': 'mse', 'optimizer': 'adam', 'graph_mode': 'knn', 'knn_k': 6, 'weighted_edges': True, 'symmetrize_mode': 'mutual', 'self_loops': True, 'use_snp_selection': False}. Best is trial 0 with value: 0.2796654394038788.
[I 2025-12-09 00:09:44,478] Trial 1 finished with value: 0.26874021700470807 and parameters: {'model_type': 'graphsage', 'hidden_dims': '[512, 128]', 'dropout': 0.2503500283181017, 'batch_norm': False, 'sage_aggr': 'max', 'sage_normalize': False, 'sage_project': False, 'lr': 3.952233718592099e-05, 'weight_decay': 0.00026754769258252603, 'epochs': 149, 'loss': 'mse', 'optimizer': 'adam', 'graph_mode': 'knn', 'knn_k': 2, 'weighted_edges': False, 'symmetrize_mode': 'mutual', 'self_loops': True, 'use_snp_selection': True, 'num_snps': 49915}. Best is trial 0 with value: 0.2796654394038788.
[I 2025-12-09 00:11:00,747] Trial 2 finished with value: 0.28664442156600883 and parameters: {'model_type': 'graphsage', 'hidden_dims': '[512, 256]', 'dropout': 0.2785908793172681, 'batch_norm': False, 'sage_aggr': 'max', 'sage_normalize': False, 'sage_project': False, 'lr': 8.806039223165805e-05, 'weight_decay': 3.5153176302760294e-05, 'epochs': 147, 'loss': 'mae', 'optimizer': 'adam', 'graph_mode': 'cutoff', 'cutoff': 0.4922564006874869, 'grm_norm': 'gcn', 'self_loops': False, 'use_snp_selection': True, 'num_snps': 34340}. Best is trial 2 with value: 0.28664442156600883.
[I 2025-12-09 00:12:13,821] Trial 3 finished with value: 0.2964054493420929 and parameters: {'model_type': 'graphsage', 'hidden_dims': '[256, 128, 64]', 'dropout': 0.3475243154412272, 'batch_norm': True, 'sage_aggr': 'max', 'sage_normalize': False, 'sage_project': False, 'lr': 1.6006331996938085e-05, 'weight_decay': 7.213121225589906e-06, 'epochs': 283, 'loss': 'mse', 'optimizer': 'adam', 'graph_mode': 'cutoff', 'cutoff': 0.5942334791449215, 'grm_norm': 'none', 'self_loops': True, 'use_snp_selection': False}. Best is trial 3 with value: 0.2964054493420929.
[I 2025-12-09 00:12:56,049] Trial 4 finished with value: 0.26709681798439083 and parameters: {'model_type': 'graphsage', 'hidden_dims': '[128, 64]', 'dropout': 0.3348926467202472, 'batch_norm': True, 'sage_aggr': 'max', 'sage_normalize': False, 'sage_project': False, 'lr': 0.0004238630400638802, 'weight_decay': 8.074086040046576e-07, 'epochs': 158, 'loss': 'mae', 'optimizer': 'adam', 'graph_mode': 'knn', 'knn_k': 1, 'weighted_edges': False, 'symmetrize_mode': 'mutual', 'self_loops': False, 'use_snp_selection': True, 'num_snps': 26850}. Best is trial 3 with value: 0.2964054493420929.
[I 2025-12-09 00:14:43,663] Trial 5 finished with value: 0.281718202390839 and parameters: {'model_type': 'graphsage', 'hidden_dims': '[512, 64]', 'dropout': 0.14505336736221927, 'batch_norm': True, 'sage_aggr': 'mean', 'sage_normalize': True, 'sage_project': False, 'lr': 1.2962030165732234e-05, 'weight_decay': 1.326598071105465e-07, 'epochs': 180, 'loss': 'mse', 'optimizer': 'adam', 'graph_mode': 'knn', 'knn_k': 9, 'weighted_edges': True, 'symmetrize_mode': 'mutual', 'self_loops': False, 'use_snp_selection': False}. Best is trial 3 with value: 0.2964054493420929.
[I 2025-12-09 00:15:36,488] Trial 6 finished with value: 0.2982613559937381 and parameters: {'model_type': 'graphsage', 'hidden_dims': '[256, 128, 64]', 'dropout': 0.10731743755162496, 'batch_norm': True, 'sage_aggr': 'mean', 'sage_normalize': False, 'sage_project': False, 'lr': 1.922990426933137e-05, 'weight_decay': 7.30001060446905e-05, 'epochs': 63, 'loss': 'mae', 'optimizer': 'adam', 'graph_mode': 'cutoff', 'cutoff': 0.7624978434202536, 'grm_norm': 'none', 'self_loops': True, 'use_snp_selection': True, 'num_snps': 50106}. Best is trial 6 with value: 0.2982613559937381.
[I 2025-12-09 00:17:30,013] Trial 7 finished with value: 0.28469319892472345 and parameters: {'model_type': 'graphsage', 'hidden_dims': '[512, 64]', 'dropout': 0.2585007811528941, 'batch_norm': True, 'sage_aggr': 'max', 'sage_normalize': True, 'sage_project': False, 'lr': 5.921425508303391e-05, 'weight_decay': 0.0004511561961144237, 'epochs': 182, 'loss': 'mae', 'optimizer': 'adam', 'graph_mode': 'knn', 'knn_k': 9, 'weighted_edges': True, 'symmetrize_mode': 'union', 'self_loops': False, 'use_snp_selection': True, 'num_snps': 23903}. Best is trial 6 with value: 0.2982613559937381.
[I 2025-12-09 00:18:11,525] Trial 8 finished with value: 0.27411481876210286 and parameters: {'model_type': 'graphsage', 'hidden_dims': '[512, 256]', 'dropout': 0.3061380386767003, 'batch_norm': False, 'sage_aggr': 'mean', 'sage_normalize': True, 'sage_project': False, 'lr': 0.000698401460570184, 'weight_decay': 2.965560055460244e-06, 'epochs': 289, 'loss': 'mae', 'optimizer': 'adam', 'graph_mode': 'knn', 'knn_k': 7, 'weighted_edges': False, 'symmetrize_mode': 'mutual', 'self_loops': True, 'use_snp_selection': True, 'num_snps': 4710}. Best is trial 6 with value: 0.2982613559937381.
[I 2025-12-09 00:21:49,678] Trial 9 finished with value: 0.29267908486914207 and parameters: {'model_type': 'graphsage', 'hidden_dims': '[512, 128]', 'dropout': 0.1733844071393634, 'batch_norm': False, 'sage_aggr': 'mean', 'sage_normalize': True, 'sage_project': False, 'lr': 0.0004269677918501597, 'weight_decay': 2.2439779626249696e-06, 'epochs': 319, 'loss': 'mse', 'optimizer': 'adam', 'graph_mode': 'cutoff', 'cutoff': 0.24117565767129295, 'grm_norm': 'cosine_then_gcn', 'self_loops': True, 'use_snp_selection': False}. Best is trial 6 with value: 0.2982613559937381.
