[I 2025-12-09 06:50:05,389] Trial 83 finished with value: 0.2841243448119576 and parameters: {'model_type': 'graphsage', 'hidden_dims': '[512, 256]', 'dropout': 0.15869608443921368, 'batch_norm': True, 'sage_aggr': 'max', 'sage_normalize': False, 'sage_project': False, 'lr': 1.6750626612804874e-05, 'weight_decay': 6.975046266435535e-07, 'epochs': 190, 'loss': 'mae', 'optimizer': 'adam', 'graph_mode': 'cutoff', 'cutoff': 0.653095178274833, 'grm_norm': 'cosine_then_gcn', 'self_loops': False, 'use_snp_selection': True, 'num_snps': 48726}. Best is trial 78 with value: 0.30253482888050814.
[I 2025-12-09 06:52:17,293] Trial 84 finished with value: 0.2894114899903767 and parameters: {'model_type': 'graphsage', 'hidden_dims': '[512, 256]', 'dropout': 0.21018932707816293, 'batch_norm': True, 'sage_aggr': 'max', 'sage_normalize': False, 'sage_project': False, 'lr': 2.1161841851117188e-05, 'weight_decay': 2.2081334909790026e-06, 'epochs': 213, 'loss': 'mae', 'optimizer': 'adam', 'graph_mode': 'cutoff', 'cutoff': 0.5540696512872058, 'grm_norm': 'cosine_then_gcn', 'self_loops': False, 'use_snp_selection': True, 'num_snps': 54756}. Best is trial 78 with value: 0.30253482888050814.
[I 2025-12-09 06:53:28,935] Trial 85 finished with value: 0.2851557208868612 and parameters: {'model_type': 'graphsage', 'hidden_dims': '[256, 128, 64]', 'dropout': 0.17782886519264363, 'batch_norm': True, 'sage_aggr': 'max', 'sage_normalize': False, 'sage_project': False, 'lr': 3.062700609000515e-05, 'weight_decay': 4.029784682699895e-06, 'epochs': 158, 'loss': 'mae', 'optimizer': 'adam', 'graph_mode': 'cutoff', 'cutoff': 0.6095458624387535, 'grm_norm': 'gcn', 'self_loops': False, 'use_snp_selection': True, 'num_snps': 46335}. Best is trial 78 with value: 0.30253482888050814.
[I 2025-12-09 06:55:25,527] Trial 86 finished with value: 0.29574989501778187 and parameters: {'model_type': 'graphsage', 'hidden_dims': '[512, 256]', 'dropout': 0.22866923397205355, 'batch_norm': True, 'sage_aggr': 'max', 'sage_normalize': False, 'sage_project': False, 'lr': 2.3882256467530928e-05, 'weight_decay': 2.900461317479133e-06, 'epochs': 169, 'loss': 'mae', 'optimizer': 'adam', 'graph_mode': 'cutoff', 'cutoff': 0.6426611562643527, 'grm_norm': 'cosine_then_gcn', 'self_loops': False, 'use_snp_selection': True, 'num_snps': 57999}. Best is trial 78 with value: 0.30253482888050814.
[I 2025-12-09 06:57:23,765] Trial 87 finished with value: 0.27592019941009926 and parameters: {'model_type': 'graphsage', 'hidden_dims': '[512, 256]', 'dropout': 0.22583937304390186, 'batch_norm': False, 'sage_aggr': 'max', 'sage_normalize': False, 'sage_project': False, 'lr': 4.0658786057618555e-05, 'weight_decay': 3.4471262429255323e-06, 'epochs': 172, 'loss': 'mae', 'optimizer': 'adam', 'graph_mode': 'cutoff', 'cutoff': 0.6470513077837519, 'grm_norm': 'cosine_then_gcn', 'self_loops': False, 'use_snp_selection': True, 'num_snps': 58824}. Best is trial 78 with value: 0.30253482888050814.
[I 2025-12-09 06:59:40,250] Trial 88 finished with value: 0.2853883367241244 and parameters: {'model_type': 'graphsage', 'hidden_dims': '[512, 256]', 'dropout': 0.2888973370541372, 'batch_norm': True, 'sage_aggr': 'max', 'sage_normalize': False, 'sage_project': False, 'lr': 1.2264718461927453e-05, 'weight_decay': 1.832977208546203e-06, 'epochs': 227, 'loss': 'mae', 'optimizer': 'adam', 'graph_mode': 'cutoff', 'cutoff': 0.6991196975712879, 'grm_norm': 'cosine_then_gcn', 'self_loops': False, 'use_snp_selection': True, 'num_snps': 55734}. Best is trial 78 with value: 0.30253482888050814.
[I 2025-12-09 07:01:48,429] Trial 89 finished with value: 0.28844430275901023 and parameters: {'model_type': 'graphsage', 'hidden_dims': '[512, 256]', 'dropout': 0.26005231568531717, 'batch_norm': True, 'sage_aggr': 'max', 'sage_normalize': False, 'sage_project': False, 'lr': 1.6025742592103504e-05, 'weight_decay': 1.2000383177175992e-05, 'epochs': 190, 'loss': 'mae', 'optimizer': 'adam', 'graph_mode': 'cutoff', 'cutoff': 0.5902242486054268, 'grm_norm': 'cosine_then_gcn', 'self_loops': False, 'use_snp_selection': True, 'num_snps': 58076}. Best is trial 78 with value: 0.30253482888050814.
[I 2025-12-09 07:03:20,557] Trial 90 finished with value: 0.29536167260027535 and parameters: {'model_type': 'graphsage', 'hidden_dims': '[512, 256]', 'dropout': 0.23366139177903678, 'batch_norm': True, 'sage_aggr': 'max', 'sage_normalize': False, 'sage_project': False, 'lr': 2.2813665955084033e-05, 'weight_decay': 2.7570867133723068e-06, 'epochs': 126, 'loss': 'mae', 'optimizer': 'adam', 'graph_mode': 'cutoff', 'cutoff': 0.6405176143351294, 'grm_norm': 'cosine_then_gcn', 'self_loops': False, 'use_snp_selection': True, 'num_snps': 53144}. Best is trial 78 with value: 0.30253482888050814.
[I 2025-12-09 07:04:55,150] Trial 91 finished with value: 0.290079727310419 and parameters: {'model_type': 'graphsage', 'hidden_dims': '[512, 256]', 'dropout': 0.2301850545691607, 'batch_norm': True, 'sage_aggr': 'max', 'sage_normalize': False, 'sage_project': False, 'lr': 2.0507783758809113e-05, 'weight_decay': 2.688275834066263e-06, 'epochs': 131, 'loss': 'mae', 'optimizer': 'adam', 'graph_mode': 'cutoff', 'cutoff': 0.6420056437336216, 'grm_norm': 'cosine_then_gcn', 'self_loops': False, 'use_snp_selection': True, 'num_snps': 54248}. Best is trial 78 with value: 0.30253482888050814.
[I 2025-12-09 07:06:34,439] Trial 92 finished with value: 0.2922159575367013 and parameters: {'model_type': 'graphsage', 'hidden_dims': '[512, 256]', 'dropout': 0.20285931748152308, 'batch_norm': True, 'sage_aggr': 'max', 'sage_normalize': False, 'sage_project': False, 'lr': 2.409323275468865e-05, 'weight_decay': 7.070366138408063e-06, 'epochs': 159, 'loss': 'mae', 'optimizer': 'adam', 'graph_mode': 'cutoff', 'cutoff': 0.6188503972343925, 'grm_norm': 'cosine_then_gcn', 'self_loops': False, 'use_snp_selection': True, 'num_snps': 49637}. Best is trial 78 with value: 0.30253482888050814.
[I 2025-12-09 07:07:56,146] Trial 93 finished with value: 0.29462232808285677 and parameters: {'model_type': 'graphsage', 'hidden_dims': '[512, 256]', 'dropout': 0.18376212987897522, 'batch_norm': True, 'sage_aggr': 'max', 'sage_normalize': False, 'sage_project': False, 'lr': 3.687693967196003e-05, 'weight_decay': 3.175021864081189e-06, 'epochs': 94, 'loss': 'mae', 'optimizer': 'adam', 'graph_mode': 'cutoff', 'cutoff': 0.5361285078458945, 'grm_norm': 'cosine_then_gcn', 'self_loops': False, 'use_snp_selection': True, 'num_snps': 52639}. Best is trial 78 with value: 0.30253482888050814.
[I 2025-12-09 07:08:54,230] Trial 94 finished with value: 0.27759549472222833 and parameters: {'model_type': 'graphsage', 'hidden_dims': '[128, 64]', 'dropout': 0.1842291927937486, 'batch_norm': True, 'sage_aggr': 'max', 'sage_normalize': False, 'sage_project': False, 'lr': 1.4554901129771705e-05, 'weight_decay': 3.1761200397113488e-06, 'epochs': 92, 'loss': 'mae', 'optimizer': 'adam', 'graph_mode': 'cutoff', 'cutoff': 0.5297941022442159, 'grm_norm': 'cosine_then_gcn', 'self_loops': False, 'use_snp_selection': True, 'num_snps': 51893}. Best is trial 78 with value: 0.30253482888050814.
[I 2025-12-09 07:10:24,285] Trial 95 finished with value: 0.295086954706827 and parameters: {'model_type': 'graphsage', 'hidden_dims': '[512, 256]', 'dropout': 0.23649963055542728, 'batch_norm': True, 'sage_aggr': 'max', 'sage_normalize': False, 'sage_project': False, 'lr': 5.496765588640718e-05, 'weight_decay': 5.289830564551846e-06, 'epochs': 120, 'loss': 'mae', 'optimizer': 'adam', 'graph_mode': 'cutoff', 'cutoff': 0.6853565834194403, 'grm_norm': 'cosine_then_gcn', 'self_loops': False, 'use_snp_selection': True, 'num_snps': 53362}. Best is trial 78 with value: 0.30253482888050814.
[I 2025-12-09 07:11:40,225] Trial 96 finished with value: 0.29206880866816454 and parameters: {'model_type': 'graphsage', 'hidden_dims': '[512, 256]', 'dropout': 0.2387617423945253, 'batch_norm': True, 'sage_aggr': 'max', 'sage_normalize': False, 'sage_project': False, 'lr': 2.420801773279738e-05, 'weight_decay': 5.324907546840802e-06, 'epochs': 73, 'loss': 'mae', 'optimizer': 'adam', 'graph_mode': 'cutoff', 'cutoff': 0.6789405973590801, 'grm_norm': 'cosine_then_gcn', 'self_loops': False, 'use_snp_selection': True, 'num_snps': 57659}. Best is trial 78 with value: 0.30253482888050814.
[I 2025-12-09 07:13:02,410] Trial 97 finished with value: 0.26398006857341716 and parameters: {'model_type': 'graphsage', 'hidden_dims': '[512, 256]', 'dropout': 0.2714066459924836, 'batch_norm': True, 'sage_aggr': 'max', 'sage_normalize': False, 'sage_project': False, 'lr': 5.258798411916547e-05, 'weight_decay': 2.2743878453937895e-06, 'epochs': 123, 'loss': 'mae', 'optimizer': 'adam', 'graph_mode': 'knn', 'knn_k': 8, 'weighted_edges': True, 'symmetrize_mode': 'mutual', 'self_loops': False, 'use_snp_selection': True, 'num_snps': 30000}. Best is trial 78 with value: 0.30253482888050814.
[I 2025-12-09 07:13:39,938] Trial 98 finished with value: 0.2876434342506 and parameters: {'model_type': 'graphsage', 'hidden_dims': '[256, 128, 64]', 'dropout': 0.21858651614152494, 'batch_norm': True, 'sage_aggr': 'max', 'sage_normalize': False, 'sage_project': False, 'lr': 7.099283162303477e-05, 'weight_decay': 3.886379841686122e-06, 'epochs': 104, 'loss': 'mae', 'optimizer': 'adam', 'graph_mode': 'cutoff', 'cutoff': 0.7150598174209443, 'grm_norm': 'cosine_then_gcn', 'self_loops': False, 'use_snp_selection': True, 'num_snps': 16052}. Best is trial 78 with value: 0.30253482888050814.
[I 2025-12-09 07:14:57,873] Trial 99 finished with value: 0.28149042495928106 and parameters: {'model_type': 'graphsage', 'hidden_dims': '[256, 128]', 'dropout': 0.25612538416481, 'batch_norm': True, 'sage_aggr': 'max', 'sage_normalize': False, 'sage_project': False, 'lr': 1.7799786869364314e-05, 'weight_decay': 1.4392306116195566e-06, 'epochs': 148, 'loss': 'mae', 'optimizer': 'adam', 'graph_mode': 'cutoff', 'cutoff': 0.6589063370961223, 'grm_norm': 'none', 'self_loops': False, 'use_snp_selection': True, 'num_snps': 55453}. Best is trial 78 with value: 0.30253482888050814.
[I 2025-12-09 07:17:01,576] Trial 100 finished with value: 0.29352888493278073 and parameters: {'model_type': 'graphsage', 'hidden_dims': '[512, 256]', 'dropout': 0.31888380200672783, 'batch_norm': True, 'sage_aggr': 'max', 'sage_normalize': False, 'sage_project': False, 'lr': 3.470095576652985e-05, 'weight_decay': 1.4804234190840412e-05, 'epochs': 174, 'loss': 'mae', 'optimizer': 'adam', 'graph_mode': 'cutoff', 'cutoff': 0.5858218542591861, 'grm_norm': 'cosine_then_gcn', 'self_loops': False, 'use_snp_selection': True, 'num_snps': 59681}. Best is trial 78 with value: 0.30253482888050814.
[I 2025-12-09 07:18:25,711] Trial 101 finished with value: 0.2923390758730569 and parameters: {'model_type': 'graphsage', 'hidden_dims': '[512, 256]', 'dropout': 0.1931502032657352, 'batch_norm': True, 'sage_aggr': 'max', 'sage_normalize': False, 'sage_project': False, 'lr': 4.7918956896962313e-05, 'weight_decay': 2.86371229192344e-06, 'epochs': 106, 'loss': 'mae', 'optimizer': 'adam', 'graph_mode': 'cutoff', 'cutoff': 0.6325137853504478, 'grm_norm': 'cosine_then_gcn', 'self_loops': False, 'use_snp_selection': True, 'num_snps': 53056}. Best is trial 78 with value: 0.30253482888050814.
[I 2025-12-09 07:19:37,930] Trial 102 finished with value: 0.2964681176317828 and parameters: {'model_type': 'graphsage', 'hidden_dims': '[512, 256]', 'dropout': 0.22133638968495029, 'batch_norm': True, 'sage_aggr': 'max', 'sage_normalize': False, 'sage_project': False, 'lr': 3.7182026344933793e-05, 'weight_decay': 1.8773822543491135e-06, 'epochs': 81, 'loss': 'mae', 'optimizer': 'adam', 'graph_mode': 'cutoff', 'cutoff': 0.6063388667890562, 'grm_norm': 'cosine_then_gcn', 'self_loops': False, 'use_snp_selection': True, 'num_snps': 50568}. Best is trial 78 with value: 0.30253482888050814.
[I 2025-12-09 07:20:37,220] Trial 103 finished with value: 0.285833647750876 and parameters: {'model_type': 'graphsage', 'hidden_dims': '[512, 256]', 'dropout': 0.2401115239076621, 'batch_norm': True, 'sage_aggr': 'max', 'sage_normalize': False, 'sage_project': False, 'lr': 2.6744341486831458e-05, 'weight_decay': 4.301831373305454e-06, 'epochs': 47, 'loss': 'mae', 'optimizer': 'adam', 'graph_mode': 'cutoff', 'cutoff': 0.6095211479382524, 'grm_norm': 'cosine_then_gcn', 'self_loops': False, 'use_snp_selection': True, 'num_snps': 49299}. Best is trial 78 with value: 0.30253482888050814.
[I 2025-12-09 07:21:43,236] Trial 104 finished with value: 0.2958382505999345 and parameters: {'model_type': 'graphsage', 'hidden_dims': '[512, 256]', 'dropout': 0.22304815769664496, 'batch_norm': True, 'sage_aggr': 'max', 'sage_normalize': False, 'sage_project': False, 'lr': 2.1374658051242246e-05, 'weight_decay': 1.9233763277262595e-06, 'epochs': 72, 'loss': 'mae', 'optimizer': 'adam', 'graph_mode': 'cutoff', 'cutoff': 0.6810255988805558, 'grm_norm': 'cosine_then_gcn', 'self_loops': False, 'use_snp_selection': True, 'num_snps': 47313}. Best is trial 78 with value: 0.30253482888050814.
[I 2025-12-09 07:22:45,611] Trial 105 finished with value: 0.290602388548005 and parameters: {'model_type': 'graphsage', 'hidden_dims': '[512, 256]', 'dropout': 0.22029746814473497, 'batch_norm': True, 'sage_aggr': 'max', 'sage_normalize': False, 'sage_project': False, 'lr': 1.943992814091289e-05, 'weight_decay': 1.917761928900601e-06, 'epochs': 62, 'loss': 'mae', 'optimizer': 'adam', 'graph_mode': 'cutoff', 'cutoff': 0.7108922924806047, 'grm_norm': 'cosine_then_gcn', 'self_loops': False, 'use_snp_selection': True, 'num_snps': 47232}. Best is trial 78 with value: 0.30253482888050814.
[I 2025-12-09 07:23:55,638] Trial 106 finished with value: 0.27250055531064704 and parameters: {'model_type': 'graphsage', 'hidden_dims': '[512, 256]', 'dropout': 0.2187357417165564, 'batch_norm': False, 'sage_aggr': 'max', 'sage_normalize': False, 'sage_project': False, 'lr': 2.2097162256314455e-05, 'weight_decay': 1.4457317813887906e-06, 'epochs': 75, 'loss': 'mae', 'optimizer': 'adam', 'graph_mode': 'cutoff', 'cutoff': 0.7420935142640404, 'grm_norm': 'cosine_then_gcn', 'self_loops': False, 'use_snp_selection': True, 'num_snps': 50638}. Best is trial 78 with value: 0.30253482888050814.
[I 2025-12-09 07:25:14,122] Trial 107 finished with value: 0.2923485938762106 and parameters: {'model_type': 'graphsage', 'hidden_dims': '[512, 64]', 'dropout': 0.1656743150308121, 'batch_norm': True, 'sage_aggr': 'max', 'sage_normalize': False, 'sage_project': False, 'lr': 2.9852686796271613e-05, 'weight_decay': 2.5374170053119248e-06, 'epochs': 80, 'loss': 'mae', 'optimizer': 'adam', 'graph_mode': 'cutoff', 'cutoff': 0.5724669100967401, 'grm_norm': 'cosine_then_gcn', 'self_loops': False, 'use_snp_selection': True, 'num_snps': 56703}. Best is trial 78 with value: 0.30253482888050814.
[I 2025-12-09 07:26:14,147] Trial 108 finished with value: 0.2800531334245709 and parameters: {'model_type': 'graphsage', 'hidden_dims': '[512, 256]', 'dropout': 0.2769224105267895, 'batch_norm': True, 'sage_aggr': 'max', 'sage_normalize': False, 'sage_project': False, 'lr': 1.1715202483819024e-05, 'weight_decay': 1.132387782358789e-06, 'epochs': 69, 'loss': 'mae', 'optimizer': 'adam', 'graph_mode': 'cutoff', 'cutoff': 0.6227443688183805, 'grm_norm': 'cosine_then_gcn', 'self_loops': False, 'use_snp_selection': True, 'num_snps': 41866}. Best is trial 78 with value: 0.30253482888050814.
[I 2025-12-09 07:28:30,169] Trial 109 finished with value: 0.2973557862783047 and parameters: {'model_type': 'graphsage', 'hidden_dims': '[512, 256]', 'dropout': 0.14586340945720166, 'batch_norm': True, 'sage_aggr': 'max', 'sage_normalize': False, 'sage_project': False, 'lr': 1.4860270488386812e-05, 'weight_decay': 1.739691952890267e-06, 'epochs': 296, 'loss': 'mae', 'optimizer': 'adam', 'graph_mode': 'cutoff', 'cutoff': 0.6589539933311582, 'grm_norm': 'cosine_then_gcn', 'self_loops': False, 'use_snp_selection': False}. Best is trial 78 with value: 0.30253482888050814.
[I 2025-12-09 07:30:40,263] Trial 110 finished with value: 0.2944325878910645 and parameters: {'model_type': 'graphsage', 'hidden_dims': '[512, 256]', 'dropout': 0.1528837285857805, 'batch_norm': True, 'sage_aggr': 'max', 'sage_normalize': False, 'sage_project': False, 'lr': 1.438191051509723e-05, 'weight_decay': 7.663182458147873e-07, 'epochs': 279, 'loss': 'mae', 'optimizer': 'adam', 'graph_mode': 'cutoff', 'cutoff': 0.6584623766342086, 'grm_norm': 'cosine_then_gcn', 'self_loops': False, 'use_snp_selection': False}. Best is trial 78 with value: 0.30253482888050814.
[I 2025-12-09 07:32:59,132] Trial 111 finished with value: 0.29682695180221436 and parameters: {'model_type': 'graphsage', 'hidden_dims': '[512, 256]', 'dropout': 0.14601172023513942, 'batch_norm': True, 'sage_aggr': 'max', 'sage_normalize': False, 'sage_project': False, 'lr': 1.7110518387868242e-05, 'weight_decay': 1.733762438438441e-06, 'epochs': 297, 'loss': 'mae', 'optimizer': 'adam', 'graph_mode': 'cutoff', 'cutoff': 0.5980797441319464, 'grm_norm': 'cosine_then_gcn', 'self_loops': False, 'use_snp_selection': False}. Best is trial 78 with value: 0.30253482888050814.
[I 2025-12-09 07:35:23,365] Trial 112 finished with value: 0.29575150454436044 and parameters: {'model_type': 'graphsage', 'hidden_dims': '[512, 256]', 'dropout': 0.10479897788841575, 'batch_norm': True, 'sage_aggr': 'max', 'sage_normalize': False, 'sage_project': False, 'lr': 1.718592164927244e-05, 'weight_decay': 1.7736530127153704e-06, 'epochs': 310, 'loss': 'mae', 'optimizer': 'adam', 'graph_mode': 'cutoff', 'cutoff': 0.5929083026007571, 'grm_norm': 'cosine_then_gcn', 'self_loops': False, 'use_snp_selection': False}. Best is trial 78 with value: 0.30253482888050814.
[I 2025-12-09 07:37:49,780] Trial 113 finished with value: 0.2956288943611174 and parameters: {'model_type': 'graphsage', 'hidden_dims': '[512, 256]', 'dropout': 0.11032744999967724, 'batch_norm': True, 'sage_aggr': 'max', 'sage_normalize': False, 'sage_project': False, 'lr': 1.664907072629506e-05, 'weight_decay': 1.7011811044915702e-06, 'epochs': 315, 'loss': 'mae', 'optimizer': 'adam', 'graph_mode': 'cutoff', 'cutoff': 0.594473156536394, 'grm_norm': 'cosine_then_gcn', 'self_loops': False, 'use_snp_selection': False}. Best is trial 78 with value: 0.30253482888050814.
[I 2025-12-09 07:40:06,969] Trial 114 finished with value: 0.29323366672486395 and parameters: {'model_type': 'graphsage', 'hidden_dims': '[512, 256]', 'dropout': 0.13782666746921107, 'batch_norm': True, 'sage_aggr': 'max', 'sage_normalize': False, 'sage_project': False, 'lr': 1.921275135883703e-05, 'weight_decay': 1.3028840563660891e-06, 'epochs': 294, 'loss': 'mae', 'optimizer': 'adam', 'graph_mode': 'cutoff', 'cutoff': 0.6150165409743902, 'grm_norm': 'cosine_then_gcn', 'self_loops': False, 'use_snp_selection': False}. Best is trial 78 with value: 0.30253482888050814.
[I 2025-12-09 07:42:36,492] Trial 115 finished with value: 0.29321979181796365 and parameters: {'model_type': 'graphsage', 'hidden_dims': '[512, 256]', 'dropout': 0.11413826628209281, 'batch_norm': True, 'sage_aggr': 'max', 'sage_normalize': False, 'sage_project': False, 'lr': 1.0073675224094463e-05, 'weight_decay': 2.026079235970901e-06, 'epochs': 324, 'loss': 'mae', 'optimizer': 'adam', 'graph_mode': 'cutoff', 'cutoff': 0.6434915313130132, 'grm_norm': 'cosine_then_gcn', 'self_loops': False, 'use_snp_selection': False}. Best is trial 78 with value: 0.30253482888050814.
[I 2025-12-09 07:44:56,356] Trial 116 finished with value: 0.29474268204527926 and parameters: {'model_type': 'graphsage', 'hidden_dims': '[512, 256]', 'dropout': 0.14563832699672102, 'batch_norm': True, 'sage_aggr': 'max', 'sage_normalize': False, 'sage_project': False, 'lr': 1.3308263674590788e-05, 'weight_decay': 1.5938739811850331e-06, 'epochs': 298, 'loss': 'mae', 'optimizer': 'adam', 'graph_mode': 'cutoff', 'cutoff': 0.6007246522718467, 'grm_norm': 'none', 'self_loops': False, 'use_snp_selection': False}. Best is trial 78 with value: 0.30253482888050814.
[I 2025-12-09 07:45:21,976] Trial 117 finished with value: 0.17929627540248963 and parameters: {'model_type': 'graphsage', 'hidden_dims': '[128, 64]', 'dropout': 0.16975950470739232, 'batch_norm': True, 'sage_aggr': 'max', 'sage_normalize': False, 'sage_project': False, 'lr': 2.6030765876357396e-05, 'weight_decay': 1.0179504692645382e-06, 'epochs': 42, 'loss': 'mae', 'optimizer': 'adam', 'graph_mode': 'knn', 'knn_k': 10, 'weighted_edges': True, 'symmetrize_mode': 'mutual', 'self_loops': False, 'use_snp_selection': False}. Best is trial 78 with value: 0.30253482888050814.
[I 2025-12-09 07:46:10,949] Trial 118 finished with value: 0.29108525415181147 and parameters: {'model_type': 'graphsage', 'hidden_dims': '[512, 256]', 'dropout': 0.14500887636297288, 'batch_norm': True, 'sage_aggr': 'max', 'sage_normalize': False, 'sage_project': False, 'lr': 1.64214304485502e-05, 'weight_decay': 5.684712538566647e-07, 'epochs': 85, 'loss': 'mae', 'optimizer': 'adam', 'graph_mode': 'cutoff', 'cutoff': 0.6636833276228553, 'grm_norm': 'cosine_then_gcn', 'self_loops': False, 'use_snp_selection': False}. Best is trial 78 with value: 0.30253482888050814.
[I 2025-12-09 07:48:36,455] Trial 119 finished with value: 0.2949747344446428 and parameters: {'model_type': 'graphsage', 'hidden_dims': '[512, 256]', 'dropout': 0.13435463457606733, 'batch_norm': True, 'sage_aggr': 'max', 'sage_normalize': False, 'sage_project': False, 'lr': 3.429395679135239e-05, 'weight_decay': 2.1932094804217717e-06, 'epochs': 310, 'loss': 'mae', 'optimizer': 'adam', 'graph_mode': 'cutoff', 'cutoff': 0.5708087014619906, 'grm_norm': 'cosine_then_gcn', 'self_loops': False, 'use_snp_selection': False}. Best is trial 78 with value: 0.30253482888050814.
