[I 2025-12-08 13:53:47,269] Trial 74 finished with value: 0.2861891316204972 and parameters: {'model_type': 'graphsage', 'hidden_dims': '[512, 256]', 'dropout': 0.2454600690495114, 'batch_norm': False, 'sage_aggr': 'max', 'sage_normalize': False, 'sage_project': False, 'lr': 1.602774947297143e-05, 'weight_decay': 1.288209376685996e-07, 'epochs': 177, 'loss': 'mse', 'optimizer': 'adam', 'graph_mode': 'cutoff', 'cutoff': 0.4040660876178532, 'grm_norm': 'none', 'self_loops': False, 'use_snp_selection': True, 'num_snps': 55201}. Best is trial 64 with value: 0.2869477674964106.
[I 2025-12-08 13:54:27,184] Trial 75 finished with value: 0.28291286640466823 and parameters: {'model_type': 'graphsage', 'hidden_dims': '[512, 256]', 'dropout': 0.2733285075360261, 'batch_norm': False, 'sage_aggr': 'max', 'sage_normalize': False, 'sage_project': False, 'lr': 1.6962352968270593e-05, 'weight_decay': 1.3592431786629975e-07, 'epochs': 147, 'loss': 'mse', 'optimizer': 'adam', 'graph_mode': 'cutoff', 'cutoff': 0.4014644924273234, 'grm_norm': 'none', 'self_loops': False, 'use_snp_selection': True, 'num_snps': 8904}. Best is trial 64 with value: 0.2869477674964106.
[I 2025-12-08 13:58:25,164] Trial 76 finished with value: 0.27797480946234604 and parameters: {'model_type': 'graphsage', 'hidden_dims': '[512, 256]', 'dropout': 0.2154995584432217, 'batch_norm': False, 'sage_aggr': 'max', 'sage_normalize': False, 'sage_project': False, 'lr': 2.3427164764060032e-05, 'weight_decay': 2.2387739636100057e-07, 'epochs': 221, 'loss': 'mse', 'optimizer': 'adam', 'graph_mode': 'cutoff', 'cutoff': 0.46654394858445475, 'grm_norm': 'none', 'self_loops': False, 'use_snp_selection': True, 'num_snps': 55430}. Best is trial 64 with value: 0.2869477674964106.
[I 2025-12-08 14:00:47,949] Trial 77 finished with value: 0.28832115134996583 and parameters: {'model_type': 'graphsage', 'hidden_dims': '[512, 256]', 'dropout': 0.24150876121280374, 'batch_norm': False, 'sage_aggr': 'max', 'sage_normalize': False, 'sage_project': False, 'lr': 4.0770268874866224e-05, 'weight_decay': 1.6884790724747503e-05, 'epochs': 184, 'loss': 'mse', 'optimizer': 'adam', 'graph_mode': 'cutoff', 'cutoff': 0.522561163795182, 'grm_norm': 'none', 'self_loops': False, 'use_snp_selection': True, 'num_snps': 55299}. Best is trial 77 with value: 0.28832115134996583.
[I 2025-12-08 14:03:09,472] Trial 78 finished with value: 0.27013366896773866 and parameters: {'model_type': 'graphsage', 'hidden_dims': '[512, 256]', 'dropout': 0.24005860555532285, 'batch_norm': False, 'sage_aggr': 'mean', 'sage_normalize': False, 'sage_project': False, 'lr': 4.022165665158551e-05, 'weight_decay': 1.521350435209068e-05, 'epochs': 193, 'loss': 'mse', 'optimizer': 'adam', 'graph_mode': 'cutoff', 'cutoff': 0.5700772465701965, 'grm_norm': 'cosine_then_gcn', 'self_loops': True, 'use_snp_selection': True, 'num_snps': 52436}. Best is trial 77 with value: 0.28832115134996583.
[I 2025-12-08 14:04:19,735] Trial 79 finished with value: 0.2714297399932045 and parameters: {'model_type': 'graphsage', 'hidden_dims': '[512, 128]', 'dropout': 0.19256596301197798, 'batch_norm': False, 'sage_aggr': 'max', 'sage_normalize': False, 'sage_project': False, 'lr': 1.291660014545707e-05, 'weight_decay': 2.1854251965901537e-05, 'epochs': 185, 'loss': 'mae', 'optimizer': 'adam', 'graph_mode': 'cutoff', 'cutoff': 0.53422106290882, 'grm_norm': 'none', 'self_loops': False, 'use_snp_selection': True, 'num_snps': 22442}. Best is trial 77 with value: 0.28832115134996583.
[I 2025-12-08 14:05:30,055] Trial 80 finished with value: 0.2352220074346897 and parameters: {'model_type': 'graphsage', 'hidden_dims': '[256, 128, 64]', 'dropout': 0.16140690166734128, 'batch_norm': True, 'sage_aggr': 'max', 'sage_normalize': True, 'sage_project': False, 'lr': 3.161059595081122e-05, 'weight_decay': 3.9727866978677056e-05, 'epochs': 213, 'loss': 'mse', 'optimizer': 'adam', 'graph_mode': 'cutoff', 'cutoff': 0.8347356483890718, 'grm_norm': 'cosine', 'self_loops': False, 'use_snp_selection': False}. Best is trial 77 with value: 0.28832115134996583.
[I 2025-12-08 14:08:17,226] Trial 81 finished with value: 0.28061718171010075 and parameters: {'model_type': 'graphsage', 'hidden_dims': '[512, 256]', 'dropout': 0.2977783753511158, 'batch_norm': False, 'sage_aggr': 'max', 'sage_normalize': False, 'sage_project': False, 'lr': 1.5663314004379846e-05, 'weight_decay': 6.575698642734919e-06, 'epochs': 173, 'loss': 'mse', 'optimizer': 'adam', 'graph_mode': 'cutoff', 'cutoff': 0.515016808613945, 'grm_norm': 'none', 'self_loops': False, 'use_snp_selection': True, 'num_snps': 54985}. Best is trial 77 with value: 0.28832115134996583.
[I 2025-12-08 14:12:38,148] Trial 82 finished with value: 0.2837139884143394 and parameters: {'model_type': 'graphsage', 'hidden_dims': '[512, 256]', 'dropout': 0.22100829049507603, 'batch_norm': False, 'sage_aggr': 'max', 'sage_normalize': False, 'sage_project': False, 'lr': 1.2064757869296066e-05, 'weight_decay': 1.8851725222532705e-07, 'epochs': 227, 'loss': 'mse', 'optimizer': 'adam', 'graph_mode': 'cutoff', 'cutoff': 0.48859054417043385, 'grm_norm': 'none', 'self_loops': False, 'use_snp_selection': True, 'num_snps': 59895}. Best is trial 77 with value: 0.28832115134996583.
[I 2025-12-08 14:15:11,443] Trial 83 finished with value: 0.2664676966640589 and parameters: {'model_type': 'graphsage', 'hidden_dims': '[512, 256]', 'dropout': 0.21801119425519636, 'batch_norm': False, 'sage_aggr': 'max', 'sage_normalize': False, 'sage_project': False, 'lr': 1.1714710333940031e-05, 'weight_decay': 1.6651139039326404e-07, 'epochs': 204, 'loss': 'mse', 'optimizer': 'adam', 'graph_mode': 'cutoff', 'cutoff': 0.6046738322119638, 'grm_norm': 'none', 'self_loops': False, 'use_snp_selection': True, 'num_snps': 54507}. Best is trial 77 with value: 0.28832115134996583.
[I 2025-12-08 14:19:37,810] Trial 84 finished with value: 0.2847875838501722 and parameters: {'model_type': 'graphsage', 'hidden_dims': '[512, 256]', 'dropout': 0.24579893144445938, 'batch_norm': False, 'sage_aggr': 'max', 'sage_normalize': False, 'sage_project': False, 'lr': 2.080104475537565e-05, 'weight_decay': 5.123684810672372e-05, 'epochs': 226, 'loss': 'mse', 'optimizer': 'adam', 'graph_mode': 'cutoff', 'cutoff': 0.40928837843915333, 'grm_norm': 'none', 'self_loops': False, 'use_snp_selection': True, 'num_snps': 56580}. Best is trial 77 with value: 0.28832115134996583.
[I 2025-12-08 14:23:23,550] Trial 85 finished with value: 0.28062375491089414 and parameters: {'model_type': 'graphsage', 'hidden_dims': '[512, 256]', 'dropout': 0.24202224377215775, 'batch_norm': False, 'sage_aggr': 'max', 'sage_normalize': False, 'sage_project': False, 'lr': 2.0140410233116046e-05, 'weight_decay': 0.00016449641407189253, 'epochs': 194, 'loss': 'mse', 'optimizer': 'adam', 'graph_mode': 'cutoff', 'cutoff': 0.35568133115415324, 'grm_norm': 'none', 'self_loops': False, 'use_snp_selection': True, 'num_snps': 50066}. Best is trial 77 with value: 0.28832115134996583.
[I 2025-12-08 14:26:57,534] Trial 86 finished with value: 0.2819153900840299 and parameters: {'model_type': 'graphsage', 'hidden_dims': '[512, 256]', 'dropout': 0.2654670529162929, 'batch_norm': False, 'sage_aggr': 'max', 'sage_normalize': False, 'sage_project': False, 'lr': 2.3888583700471528e-05, 'weight_decay': 1.728849979568535e-05, 'epochs': 182, 'loss': 'mse', 'optimizer': 'adam', 'graph_mode': 'cutoff', 'cutoff': 0.44006942677988653, 'grm_norm': 'none', 'self_loops': False, 'use_snp_selection': True, 'num_snps': 56413}. Best is trial 77 with value: 0.28832115134996583.
[I 2025-12-08 14:32:30,684] Trial 87 finished with value: 0.2675126056590354 and parameters: {'model_type': 'graphsage', 'hidden_dims': '[512, 256]', 'dropout': 0.20335730273101787, 'batch_norm': False, 'sage_aggr': 'max', 'sage_normalize': False, 'sage_project': False, 'lr': 2.6833015608237476e-05, 'weight_decay': 5.116479801493358e-05, 'epochs': 245, 'loss': 'mse', 'optimizer': 'adam', 'graph_mode': 'knn', 'knn_k': 5, 'weighted_edges': False, 'symmetrize_mode': 'union', 'self_loops': False, 'use_snp_selection': True, 'num_snps': 53628}. Best is trial 77 with value: 0.28832115134996583.
[I 2025-12-08 14:36:56,069] Trial 88 finished with value: 0.2759247282365348 and parameters: {'model_type': 'graphsage', 'hidden_dims': '[512, 256]', 'dropout': 0.3247196258384859, 'batch_norm': False, 'sage_aggr': 'max', 'sage_normalize': False, 'sage_project': False, 'lr': 1.9905758118424578e-05, 'weight_decay': 0.00010870300884056158, 'epochs': 217, 'loss': 'mse', 'optimizer': 'adam', 'graph_mode': 'cutoff', 'cutoff': 0.4091008134419767, 'grm_norm': 'none', 'self_loops': False, 'use_snp_selection': True, 'num_snps': 57899}. Best is trial 77 with value: 0.28832115134996583.
[I 2025-12-08 14:39:54,914] Trial 89 finished with value: 0.27627298407723766 and parameters: {'model_type': 'graphsage', 'hidden_dims': '[256, 128]', 'dropout': 0.3036436171243449, 'batch_norm': False, 'sage_aggr': 'max', 'sage_normalize': False, 'sage_project': False, 'lr': 5.182512601701581e-05, 'weight_decay': 7.1726475642649095e-06, 'epochs': 207, 'loss': 'mse', 'optimizer': 'adam', 'graph_mode': 'cutoff', 'cutoff': 0.3757189928436575, 'grm_norm': 'none', 'self_loops': False, 'use_snp_selection': True, 'num_snps': 47714}. Best is trial 77 with value: 0.28832115134996583.
[I 2025-12-08 14:42:16,649] Trial 90 finished with value: 0.26943865864464334 and parameters: {'model_type': 'graphsage', 'hidden_dims': '[512, 256]', 'dropout': 0.27627053839288684, 'batch_norm': False, 'sage_aggr': 'mean', 'sage_normalize': False, 'sage_project': False, 'lr': 3.711267563536187e-05, 'weight_decay': 1.2933365198134955e-07, 'epochs': 197, 'loss': 'mse', 'optimizer': 'adam', 'graph_mode': 'cutoff', 'cutoff': 0.6946839891956144, 'grm_norm': 'none', 'self_loops': False, 'use_snp_selection': True, 'num_snps': 52803}. Best is trial 77 with value: 0.28832115134996583.
[I 2025-12-08 14:46:35,112] Trial 91 finished with value: 0.2806216511552318 and parameters: {'model_type': 'graphsage', 'hidden_dims': '[512, 256]', 'dropout': 0.22063733739911276, 'batch_norm': False, 'sage_aggr': 'max', 'sage_normalize': False, 'sage_project': False, 'lr': 1.1906820252972985e-05, 'weight_decay': 1.9472446592319512e-07, 'epochs': 234, 'loss': 'mse', 'optimizer': 'adam', 'graph_mode': 'cutoff', 'cutoff': 0.4846767972709035, 'grm_norm': 'none', 'self_loops': False, 'use_snp_selection': True, 'num_snps': 57738}. Best is trial 77 with value: 0.28832115134996583.
[I 2025-12-08 14:50:50,946] Trial 92 finished with value: 0.28292220449896044 and parameters: {'model_type': 'graphsage', 'hidden_dims': '[512, 256]', 'dropout': 0.25241754956528023, 'batch_norm': False, 'sage_aggr': 'max', 'sage_normalize': False, 'sage_project': False, 'lr': 1.4467349442320358e-05, 'weight_decay': 4.3015975874981263e-07, 'epochs': 223, 'loss': 'mse', 'optimizer': 'adam', 'graph_mode': 'cutoff', 'cutoff': 0.40991945996833373, 'grm_norm': 'none', 'self_loops': False, 'use_snp_selection': True, 'num_snps': 56193}. Best is trial 77 with value: 0.28832115134996583.
[I 2025-12-08 14:54:24,808] Trial 93 finished with value: 0.28282629694186856 and parameters: {'model_type': 'graphsage', 'hidden_dims': '[512, 256]', 'dropout': 0.18309877043860842, 'batch_norm': False, 'sage_aggr': 'max', 'sage_normalize': False, 'sage_project': False, 'lr': 1.696449828390774e-05, 'weight_decay': 5.9984679728105575e-05, 'epochs': 228, 'loss': 'mse', 'optimizer': 'adam', 'graph_mode': 'cutoff', 'cutoff': 0.5243098697722589, 'grm_norm': 'none', 'self_loops': False, 'use_snp_selection': True, 'num_snps': 58535}. Best is trial 77 with value: 0.28832115134996583.
[I 2025-12-08 14:57:37,501] Trial 94 finished with value: 0.28207388927651256 and parameters: {'model_type': 'graphsage', 'hidden_dims': '[512, 256]', 'dropout': 0.22767662335471797, 'batch_norm': False, 'sage_aggr': 'max', 'sage_normalize': False, 'sage_project': False, 'lr': 1.145654127823637e-05, 'weight_decay': 1.091743875332881e-05, 'epochs': 179, 'loss': 'mse', 'optimizer': 'adam', 'graph_mode': 'cutoff', 'cutoff': 0.46160531521536147, 'grm_norm': 'cosine_then_gcn', 'self_loops': False, 'use_snp_selection': True, 'num_snps': 54464}. Best is trial 77 with value: 0.28832115134996583.
[I 2025-12-08 15:02:04,666] Trial 95 finished with value: 0.2790471849427948 and parameters: {'model_type': 'graphsage', 'hidden_dims': '[512, 256]', 'dropout': 0.26247490148167496, 'batch_norm': False, 'sage_aggr': 'max', 'sage_normalize': False, 'sage_project': False, 'lr': 1.340838604504129e-05, 'weight_decay': 2.534533603573334e-07, 'epochs': 244, 'loss': 'mse', 'optimizer': 'adam', 'graph_mode': 'cutoff', 'cutoff': 0.49614653165833467, 'grm_norm': 'none', 'self_loops': False, 'use_snp_selection': True, 'num_snps': 59803}. Best is trial 77 with value: 0.28832115134996583.
[I 2025-12-08 15:05:27,634] Trial 96 finished with value: 0.2764353131086796 and parameters: {'model_type': 'graphsage', 'hidden_dims': '[512, 64]', 'dropout': 0.23853992077903088, 'batch_norm': False, 'sage_aggr': 'max', 'sage_normalize': False, 'sage_project': False, 'lr': 2.1354439854697762e-05, 'weight_decay': 1.228840455839634e-07, 'epochs': 172, 'loss': 'mse', 'optimizer': 'adam', 'graph_mode': 'cutoff', 'cutoff': 0.4405682449242298, 'grm_norm': 'none', 'self_loops': False, 'use_snp_selection': True, 'num_snps': 56015}. Best is trial 77 with value: 0.28832115134996583.
[I 2025-12-08 15:09:03,577] Trial 97 finished with value: 0.25025439266036176 and parameters: {'model_type': 'graphsage', 'hidden_dims': '[512, 256]', 'dropout': 0.291529292701827, 'batch_norm': False, 'sage_aggr': 'max', 'sage_normalize': True, 'sage_project': False, 'lr': 1.6955079727649697e-05, 'weight_decay': 0.0003518240853732727, 'epochs': 200, 'loss': 'mse', 'optimizer': 'adam', 'graph_mode': 'cutoff', 'cutoff': 0.3962527112440149, 'grm_norm': 'none', 'self_loops': True, 'use_snp_selection': True, 'num_snps': 49443}. Best is trial 77 with value: 0.28832115134996583.
[I 2025-12-08 15:11:15,181] Trial 98 finished with value: 0.23419298658114962 and parameters: {'model_type': 'graphsage', 'hidden_dims': '[512, 256]', 'dropout': 0.20648728430496013, 'batch_norm': True, 'sage_aggr': 'max', 'sage_normalize': False, 'sage_project': False, 'lr': 1.1463482455569461e-05, 'weight_decay': 2.024820260848666e-07, 'epochs': 160, 'loss': 'mse', 'optimizer': 'adam', 'graph_mode': 'cutoff', 'cutoff': 0.33086813807292714, 'grm_norm': 'cosine', 'self_loops': False, 'use_snp_selection': False}. Best is trial 77 with value: 0.28832115134996583.
[I 2025-12-08 15:14:42,058] Trial 99 finished with value: 0.18727628295321588 and parameters: {'model_type': 'graphsage', 'hidden_dims': '[512, 128]', 'dropout': 0.3151331486242527, 'batch_norm': False, 'sage_aggr': 'max', 'sage_normalize': False, 'sage_project': False, 'lr': 0.00022913528053555198, 'weight_decay': 9.416582840878077e-05, 'epochs': 187, 'loss': 'mae', 'optimizer': 'adam', 'graph_mode': 'cutoff', 'cutoff': 0.42788427594012096, 'grm_norm': 'none', 'self_loops': False, 'use_snp_selection': True, 'num_snps': 52081}. Best is trial 77 with value: 0.28832115134996583.
[I 2025-12-08 15:18:56,652] Trial 100 finished with value: 0.24914264922801738 and parameters: {'model_type': 'graphsage', 'hidden_dims': '[256, 128, 64]', 'dropout': 0.2436712729407758, 'batch_norm': False, 'sage_aggr': 'max', 'sage_normalize': False, 'sage_project': False, 'lr': 1.431514634975127e-05, 'weight_decay': 5.380830506010763e-06, 'epochs': 213, 'loss': 'mse', 'optimizer': 'adam', 'graph_mode': 'knn', 'knn_k': 10, 'weighted_edges': True, 'symmetrize_mode': 'mutual', 'self_loops': False, 'use_snp_selection': True, 'num_snps': 53720}. Best is trial 77 with value: 0.28832115134996583.
[I 2025-12-08 15:22:18,682] Trial 101 finished with value: 0.28102192860234015 and parameters: {'model_type': 'graphsage', 'hidden_dims': '[512, 256]', 'dropout': 0.28164914366200056, 'batch_norm': False, 'sage_aggr': 'max', 'sage_normalize': False, 'sage_project': False, 'lr': 1.5578460479031742e-05, 'weight_decay': 3.0822579031695605e-07, 'epochs': 165, 'loss': 'mse', 'optimizer': 'adam', 'graph_mode': 'cutoff', 'cutoff': 0.46376206980534357, 'grm_norm': 'none', 'self_loops': False, 'use_snp_selection': True, 'num_snps': 58645}. Best is trial 77 with value: 0.28832115134996583.
[I 2025-12-08 15:25:26,925] Trial 102 finished with value: 0.2783217108210595 and parameters: {'model_type': 'graphsage', 'hidden_dims': '[512, 256]', 'dropout': 0.3412976507729807, 'batch_norm': False, 'sage_aggr': 'max', 'sage_normalize': False, 'sage_project': False, 'lr': 1.8963860435706945e-05, 'weight_decay': 1.506816232228959e-07, 'epochs': 147, 'loss': 'mse', 'optimizer': 'adam', 'graph_mode': 'cutoff', 'cutoff': 0.47676726120067753, 'grm_norm': 'none', 'self_loops': False, 'use_snp_selection': True, 'num_snps': 59886}. Best is trial 77 with value: 0.28832115134996583.
[I 2025-12-08 15:28:51,178] Trial 103 finished with value: 0.2814243335367644 and parameters: {'model_type': 'graphsage', 'hidden_dims': '[512, 256]', 'dropout': 0.26680202954204624, 'batch_norm': False, 'sage_aggr': 'max', 'sage_normalize': False, 'sage_project': False, 'lr': 2.810714331066507e-05, 'weight_decay': 3.3836952887302665e-07, 'epochs': 170, 'loss': 'mse', 'optimizer': 'adam', 'graph_mode': 'cutoff', 'cutoff': 0.4453884309935062, 'grm_norm': 'none', 'self_loops': False, 'use_snp_selection': True, 'num_snps': 56819}. Best is trial 77 with value: 0.28832115134996583.
[I 2025-12-08 15:33:44,643] Trial 104 finished with value: 0.09251701328218966 and parameters: {'model_type': 'graphsage', 'hidden_dims': '[512, 256]', 'dropout': 0.22307877241059618, 'batch_norm': False, 'sage_aggr': 'max', 'sage_normalize': False, 'sage_project': False, 'lr': 0.0003594240250347332, 'weight_decay': 2.8847319491917165e-07, 'epochs': 180, 'loss': 'mse', 'optimizer': 'adam', 'graph_mode': 'cutoff', 'cutoff': 0.20051756598907755, 'grm_norm': 'none', 'self_loops': False, 'use_snp_selection': True, 'num_snps': 35425}. Best is trial 77 with value: 0.28832115134996583.
[I 2025-12-08 15:37:05,269] Trial 105 finished with value: 0.28567909737740316 and parameters: {'model_type': 'graphsage', 'hidden_dims': '[512, 256]', 'dropout': 0.25131762048745815, 'batch_norm': False, 'sage_aggr': 'max', 'sage_normalize': False, 'sage_project': False, 'lr': 1.0124811974288164e-05, 'weight_decay': 4.4198970755170485e-07, 'epochs': 193, 'loss': 'mse', 'optimizer': 'adam', 'graph_mode': 'cutoff', 'cutoff': 0.4974749552052665, 'grm_norm': 'none', 'self_loops': False, 'use_snp_selection': True, 'num_snps': 55529}. Best is trial 77 with value: 0.28832115134996583.
[I 2025-12-08 15:40:08,023] Trial 106 finished with value: 0.28014404341176213 and parameters: {'model_type': 'graphsage', 'hidden_dims': '[512, 256]', 'dropout': 0.20974407760686747, 'batch_norm': False, 'sage_aggr': 'max', 'sage_normalize': False, 'sage_project': False, 'lr': 1.0261276827149295e-05, 'weight_decay': 4.6787340097376874e-07, 'epochs': 192, 'loss': 'mse', 'optimizer': 'adam', 'graph_mode': 'cutoff', 'cutoff': 0.5144434492355193, 'grm_norm': 'none', 'self_loops': False, 'use_snp_selection': True, 'num_snps': 55431}. Best is trial 77 with value: 0.28832115134996583.
[I 2025-12-08 15:43:48,229] Trial 107 finished with value: 0.2801355495605589 and parameters: {'model_type': 'graphsage', 'hidden_dims': '[512, 256]', 'dropout': 0.2557477262341472, 'batch_norm': False, 'sage_aggr': 'max', 'sage_normalize': False, 'sage_project': False, 'lr': 1.2374146736750167e-05, 'weight_decay': 6.141111940740293e-07, 'epochs': 206, 'loss': 'mse', 'optimizer': 'adam', 'graph_mode': 'cutoff', 'cutoff': 0.49352562960310536, 'grm_norm': 'none', 'self_loops': False, 'use_snp_selection': True, 'num_snps': 56961}. Best is trial 77 with value: 0.28832115134996583.
[I 2025-12-08 15:46:32,666] Trial 108 finished with value: 0.2655931885721767 and parameters: {'model_type': 'graphsage', 'hidden_dims': '[512, 256]', 'dropout': 0.19462014703465597, 'batch_norm': False, 'sage_aggr': 'max', 'sage_normalize': False, 'sage_project': False, 'lr': 1.329541296808997e-05, 'weight_decay': 1.8669487429474487e-07, 'epochs': 225, 'loss': 'mse', 'optimizer': 'adam', 'graph_mode': 'cutoff', 'cutoff': 0.5554435620656962, 'grm_norm': 'none', 'self_loops': False, 'use_snp_selection': True, 'num_snps': 50882}. Best is trial 77 with value: 0.28832115134996583.
[I 2025-12-08 15:50:59,403] Trial 109 finished with value: 0.19583527064432676 and parameters: {'model_type': 'graphsage', 'hidden_dims': '[512, 256]', 'dropout': 0.2505422907511221, 'batch_norm': False, 'sage_aggr': 'mean', 'sage_normalize': False, 'sage_project': False, 'lr': 0.0010333600306712738, 'weight_decay': 0.0007395094313435865, 'epochs': 232, 'loss': 'mse', 'optimizer': 'adam', 'graph_mode': 'cutoff', 'cutoff': 0.4249315269469393, 'grm_norm': 'none', 'self_loops': False, 'use_snp_selection': True, 'num_snps': 58442}. Best is trial 77 with value: 0.28832115134996583.
[I 2025-12-08 15:54:09,094] Trial 110 finished with value: 0.27811191044382266 and parameters: {'model_type': 'graphsage', 'hidden_dims': '[256, 128]', 'dropout': 0.23293750929612655, 'batch_norm': False, 'sage_aggr': 'max', 'sage_normalize': False, 'sage_project': False, 'lr': 1.7950713893677584e-05, 'weight_decay': 2.3361572780123995e-07, 'epochs': 201, 'loss': 'mse', 'optimizer': 'adam', 'graph_mode': 'cutoff', 'cutoff': 0.36497638411870714, 'grm_norm': 'cosine_then_gcn', 'self_loops': False, 'use_snp_selection': True, 'num_snps': 54058}. Best is trial 77 with value: 0.28832115134996583.
