[I 2025-12-09 15:21:53,824] Trial 119 finished with value: 0.311993052701943 and parameters: {'model_type': 'graphsage', 'hidden_dims': '[512, 64]', 'dropout': 0.38378956659537156, 'batch_norm': True, 'sage_aggr': 'max', 'sage_normalize': False, 'sage_project': False, 'lr': 0.0029797959105359786, 'weight_decay': 2.8489250865188586e-06, 'epochs': 178, 'loss': 'mse', 'optimizer': 'adam', 'graph_mode': 'cutoff', 'cutoff': 0.8586675065685372, 'grm_norm': 'cosine', 'self_loops': True, 'use_snp_selection': False}. Best is trial 50 with value: 0.31796609177250984.
[I 2025-12-09 15:23:12,920] Trial 120 finished with value: 0.3126455779178119 and parameters: {'model_type': 'graphsage', 'hidden_dims': '[512, 256]', 'dropout': 0.40526317258254574, 'batch_norm': True, 'sage_aggr': 'max', 'sage_normalize': False, 'sage_project': False, 'lr': 0.0038970823058154117, 'weight_decay': 0.0001231418421783842, 'epochs': 192, 'loss': 'mse', 'optimizer': 'adam', 'graph_mode': 'cutoff', 'cutoff': 0.8893248355522136, 'grm_norm': 'cosine', 'self_loops': False, 'use_snp_selection': True, 'num_snps': 39873}. Best is trial 50 with value: 0.31796609177250984.
[I 2025-12-09 15:24:08,757] Trial 121 finished with value: 0.3160696300539845 and parameters: {'model_type': 'graphsage', 'hidden_dims': '[512, 64]', 'dropout': 0.4247489518259723, 'batch_norm': True, 'sage_aggr': 'max', 'sage_normalize': False, 'sage_project': False, 'lr': 0.0063306980397211336, 'weight_decay': 4.012094290619952e-06, 'epochs': 101, 'loss': 'mse', 'optimizer': 'adam', 'graph_mode': 'cutoff', 'cutoff': 0.826391227605423, 'grm_norm': 'cosine', 'self_loops': True, 'use_snp_selection': False}. Best is trial 50 with value: 0.31796609177250984.
[I 2025-12-09 15:25:12,745] Trial 122 finished with value: 0.3159300251105876 and parameters: {'model_type': 'graphsage', 'hidden_dims': '[512, 64]', 'dropout': 0.3638611819384767, 'batch_norm': True, 'sage_aggr': 'max', 'sage_normalize': False, 'sage_project': False, 'lr': 0.006673074442951343, 'weight_decay': 3.2781473418695307e-06, 'epochs': 117, 'loss': 'mse', 'optimizer': 'adam', 'graph_mode': 'cutoff', 'cutoff': 0.8255820618251155, 'grm_norm': 'cosine', 'self_loops': True, 'use_snp_selection': False}. Best is trial 50 with value: 0.31796609177250984.
[I 2025-12-09 15:26:09,626] Trial 123 finished with value: 0.3153433258667123 and parameters: {'model_type': 'graphsage', 'hidden_dims': '[512, 64]', 'dropout': 0.3637545604482157, 'batch_norm': True, 'sage_aggr': 'max', 'sage_normalize': False, 'sage_project': False, 'lr': 0.006414054083937564, 'weight_decay': 3.7305383785206874e-06, 'epochs': 103, 'loss': 'mse', 'optimizer': 'adam', 'graph_mode': 'cutoff', 'cutoff': 0.8243461547446733, 'grm_norm': 'cosine', 'self_loops': True, 'use_snp_selection': False}. Best is trial 50 with value: 0.31796609177250984.
[I 2025-12-09 15:27:06,014] Trial 124 finished with value: 0.3128119311170856 and parameters: {'model_type': 'graphsage', 'hidden_dims': '[512, 64]', 'dropout': 0.36031980822676973, 'batch_norm': True, 'sage_aggr': 'max', 'sage_normalize': False, 'sage_project': False, 'lr': 0.006356874195914095, 'weight_decay': 9.487776557967737e-07, 'epochs': 102, 'loss': 'mse', 'optimizer': 'adam', 'graph_mode': 'cutoff', 'cutoff': 0.8586233723469741, 'grm_norm': 'cosine', 'self_loops': True, 'use_snp_selection': False}. Best is trial 50 with value: 0.31796609177250984.
[I 2025-12-09 15:28:11,089] Trial 125 finished with value: 0.30772885491367946 and parameters: {'model_type': 'graphsage', 'hidden_dims': '[512, 64]', 'dropout': 0.32202863806963183, 'batch_norm': True, 'sage_aggr': 'max', 'sage_normalize': False, 'sage_project': False, 'lr': 0.007034152094940974, 'weight_decay': 2.0553377280949436e-06, 'epochs': 119, 'loss': 'mse', 'optimizer': 'adam', 'graph_mode': 'cutoff', 'cutoff': 0.7989481143176393, 'grm_norm': 'cosine', 'self_loops': True, 'use_snp_selection': False}. Best is trial 50 with value: 0.31796609177250984.
[I 2025-12-09 15:30:04,963] Trial 126 finished with value: 0.0 and parameters: {'model_type': 'graphsage', 'hidden_dims': '[512, 64]', 'dropout': 0.36341095377669663, 'batch_norm': False, 'sage_aggr': 'max', 'sage_normalize': False, 'sage_project': False, 'lr': 0.005395639225838065, 'weight_decay': 2.9945111008601115e-06, 'epochs': 215, 'loss': 'mse', 'optimizer': 'adam', 'graph_mode': 'cutoff', 'cutoff': 0.8214992555415368, 'grm_norm': 'cosine', 'self_loops': True, 'use_snp_selection': False}. Best is trial 50 with value: 0.31796609177250984.
[I 2025-12-09 15:31:10,357] Trial 127 finished with value: 0.30846001949458784 and parameters: {'model_type': 'graphsage', 'hidden_dims': '[256, 128, 64]', 'dropout': 0.3287152665365788, 'batch_norm': True, 'sage_aggr': 'max', 'sage_normalize': False, 'sage_project': False, 'lr': 0.007820685177103312, 'weight_decay': 4.70590359487167e-06, 'epochs': 227, 'loss': 'mse', 'optimizer': 'adam', 'graph_mode': 'cutoff', 'cutoff': 0.8305618823565517, 'grm_norm': 'cosine', 'self_loops': True, 'use_snp_selection': False}. Best is trial 50 with value: 0.31796609177250984.
[I 2025-12-09 15:31:31,557] Trial 128 finished with value: 0.30398547150214206 and parameters: {'model_type': 'graphsage', 'hidden_dims': '[128, 64]', 'dropout': 0.34480374214135534, 'batch_norm': True, 'sage_aggr': 'max', 'sage_normalize': False, 'sage_project': False, 'lr': 0.006388157801300517, 'weight_decay': 3.6922115885530914e-06, 'epochs': 113, 'loss': 'mse', 'optimizer': 'adam', 'graph_mode': 'cutoff', 'cutoff': 0.870408898433526, 'grm_norm': 'cosine', 'self_loops': True, 'use_snp_selection': False}. Best is trial 50 with value: 0.31796609177250984.
[I 2025-12-09 15:32:47,785] Trial 129 finished with value: 0.3132654106733358 and parameters: {'model_type': 'graphsage', 'hidden_dims': '[512, 64]', 'dropout': 0.4229841787433831, 'batch_norm': True, 'sage_aggr': 'max', 'sage_normalize': False, 'sage_project': False, 'lr': 0.008745376146385599, 'weight_decay': 5.6926030895565566e-06, 'epochs': 141, 'loss': 'mse', 'optimizer': 'adam', 'graph_mode': 'cutoff', 'cutoff': 0.844193972075305, 'grm_norm': 'cosine', 'self_loops': True, 'use_snp_selection': False}. Best is trial 50 with value: 0.31796609177250984.
[I 2025-12-09 15:33:57,035] Trial 130 finished with value: 0.31423516474707114 and parameters: {'model_type': 'graphsage', 'hidden_dims': '[512, 64]', 'dropout': 0.39993873521762646, 'batch_norm': True, 'sage_aggr': 'mean', 'sage_normalize': False, 'sage_project': False, 'lr': 0.003865041984959587, 'weight_decay': 3.961041607807791e-06, 'epochs': 127, 'loss': 'mse', 'optimizer': 'adam', 'graph_mode': 'cutoff', 'cutoff': 0.8065765032375518, 'grm_norm': 'none', 'self_loops': True, 'use_snp_selection': False}. Best is trial 50 with value: 0.31796609177250984.
[I 2025-12-09 15:34:51,404] Trial 131 finished with value: 0.3023819551828152 and parameters: {'model_type': 'graphsage', 'hidden_dims': '[512, 64]', 'dropout': 0.4152056818079669, 'batch_norm': True, 'sage_aggr': 'max', 'sage_normalize': False, 'sage_project': False, 'lr': 0.004610806564107423, 'weight_decay': 2.5601501206144165e-06, 'epochs': 98, 'loss': 'mse', 'optimizer': 'adam', 'graph_mode': 'cutoff', 'cutoff': 0.821643001005317, 'grm_norm': 'cosine', 'self_loops': True, 'use_snp_selection': False}. Best is trial 50 with value: 0.31796609177250984.
[I 2025-12-09 15:35:55,440] Trial 132 finished with value: 0.30458639049533914 and parameters: {'model_type': 'graphsage', 'hidden_dims': '[512, 64]', 'dropout': 0.3849683859579035, 'batch_norm': True, 'sage_aggr': 'max', 'sage_normalize': False, 'sage_project': False, 'lr': 0.000556233937527148, 'weight_decay': 3.3230461687185143e-06, 'epochs': 117, 'loss': 'mse', 'optimizer': 'adam', 'graph_mode': 'cutoff', 'cutoff': 0.7920683240160499, 'grm_norm': 'cosine', 'self_loops': True, 'use_snp_selection': False}. Best is trial 50 with value: 0.31796609177250984.
[I 2025-12-09 15:37:08,858] Trial 133 finished with value: 0.27955386281883443 and parameters: {'model_type': 'graphsage', 'hidden_dims': '[512, 64]', 'dropout': 0.43445270134397546, 'batch_norm': True, 'sage_aggr': 'max', 'sage_normalize': False, 'sage_project': False, 'lr': 0.005435247520064126, 'weight_decay': 8.686406290365995e-06, 'epochs': 105, 'loss': 'mse', 'optimizer': 'adam', 'graph_mode': 'cutoff', 'cutoff': 0.40740539164664447, 'grm_norm': 'cosine', 'self_loops': True, 'use_snp_selection': False}. Best is trial 50 with value: 0.31796609177250984.
[I 2025-12-09 15:37:57,428] Trial 134 finished with value: 0.30273836728637604 and parameters: {'model_type': 'graphsage', 'hidden_dims': '[512, 64]', 'dropout': 0.3089388786362507, 'batch_norm': True, 'sage_aggr': 'max', 'sage_normalize': False, 'sage_project': False, 'lr': 0.0002920597172315996, 'weight_decay': 2.090846297304905e-06, 'epochs': 87, 'loss': 'mse', 'optimizer': 'adam', 'graph_mode': 'cutoff', 'cutoff': 0.8816982881762867, 'grm_norm': 'gcn', 'self_loops': True, 'use_snp_selection': False}. Best is trial 50 with value: 0.31796609177250984.
[I 2025-12-09 15:40:19,265] Trial 135 finished with value: 0.2715045949640883 and parameters: {'model_type': 'graphsage', 'hidden_dims': '[512, 64]', 'dropout': 0.3745900195849745, 'batch_norm': True, 'sage_aggr': 'max', 'sage_normalize': False, 'sage_project': False, 'lr': 0.006950296776300195, 'weight_decay': 1.5176618018660566e-06, 'epochs': 115, 'loss': 'mse', 'optimizer': 'adam', 'graph_mode': 'cutoff', 'cutoff': 0.21877492368077572, 'grm_norm': 'cosine', 'self_loops': True, 'use_snp_selection': False}. Best is trial 50 with value: 0.31796609177250984.
[I 2025-12-09 15:41:32,008] Trial 136 finished with value: 0.31553467552815506 and parameters: {'model_type': 'graphsage', 'hidden_dims': '[512, 128]', 'dropout': 0.3906869395656069, 'batch_norm': True, 'sage_aggr': 'max', 'sage_normalize': False, 'sage_project': False, 'lr': 0.009935744439881019, 'weight_decay': 4.111558169568863e-06, 'epochs': 134, 'loss': 'mse', 'optimizer': 'adam', 'graph_mode': 'cutoff', 'cutoff': 0.8131642950922648, 'grm_norm': 'cosine', 'self_loops': True, 'use_snp_selection': False}. Best is trial 50 with value: 0.31796609177250984.
[I 2025-12-09 15:42:44,749] Trial 137 finished with value: 0.3153812522662629 and parameters: {'model_type': 'graphsage', 'hidden_dims': '[512, 128]', 'dropout': 0.39570480823016485, 'batch_norm': True, 'sage_aggr': 'max', 'sage_normalize': False, 'sage_project': False, 'lr': 0.00948194480848011, 'weight_decay': 8.608307205568665e-05, 'epochs': 134, 'loss': 'mse', 'optimizer': 'adam', 'graph_mode': 'cutoff', 'cutoff': 0.7746962333549632, 'grm_norm': 'cosine', 'self_loops': True, 'use_snp_selection': False}. Best is trial 50 with value: 0.31796609177250984.
[I 2025-12-09 15:43:59,024] Trial 138 finished with value: 0.31722730332823923 and parameters: {'model_type': 'graphsage', 'hidden_dims': '[512, 128]', 'dropout': 0.39384379234474926, 'batch_norm': True, 'sage_aggr': 'max', 'sage_normalize': False, 'sage_project': False, 'lr': 0.008183267625936496, 'weight_decay': 6.609968604949262e-06, 'epochs': 137, 'loss': 'mse', 'optimizer': 'adam', 'graph_mode': 'cutoff', 'cutoff': 0.7785855726957888, 'grm_norm': 'cosine', 'self_loops': True, 'use_snp_selection': False}. Best is trial 50 with value: 0.31796609177250984.
[I 2025-12-09 15:45:12,991] Trial 139 finished with value: 0.29552770938713746 and parameters: {'model_type': 'graphsage', 'hidden_dims': '[512, 128]', 'dropout': 0.35343293675959925, 'batch_norm': True, 'sage_aggr': 'max', 'sage_normalize': True, 'sage_project': False, 'lr': 0.007885883328682546, 'weight_decay': 8.775991440289612e-05, 'epochs': 136, 'loss': 'mae', 'optimizer': 'adam', 'graph_mode': 'cutoff', 'cutoff': 0.7714507014427041, 'grm_norm': 'cosine', 'self_loops': True, 'use_snp_selection': False}. Best is trial 50 with value: 0.31796609177250984.
[I 2025-12-09 15:46:51,660] Trial 140 finished with value: 0.27660647251546905 and parameters: {'model_type': 'graphsage', 'hidden_dims': '[512, 128]', 'dropout': 0.38963079271935297, 'batch_norm': True, 'sage_aggr': 'max', 'sage_normalize': False, 'sage_project': False, 'lr': 0.008863769767839175, 'weight_decay': 7.164495196759742e-06, 'epochs': 143, 'loss': 'mse', 'optimizer': 'adam', 'graph_mode': 'knn', 'knn_k': 5, 'weighted_edges': False, 'symmetrize_mode': 'mutual', 'self_loops': True, 'use_snp_selection': False}. Best is trial 50 with value: 0.31796609177250984.
[I 2025-12-09 15:48:01,364] Trial 141 finished with value: 0.312568890747922 and parameters: {'model_type': 'graphsage', 'hidden_dims': '[512, 128]', 'dropout': 0.39998420154055203, 'batch_norm': True, 'sage_aggr': 'max', 'sage_normalize': False, 'sage_project': False, 'lr': 0.009983716114425153, 'weight_decay': 6.161240324027123e-06, 'epochs': 128, 'loss': 'mse', 'optimizer': 'adam', 'graph_mode': 'cutoff', 'cutoff': 0.7813950677762022, 'grm_norm': 'cosine', 'self_loops': True, 'use_snp_selection': False}. Best is trial 50 with value: 0.31796609177250984.
[I 2025-12-09 15:49:24,287] Trial 142 finished with value: 0.3162873167927637 and parameters: {'model_type': 'graphsage', 'hidden_dims': '[512, 128]', 'dropout': 0.37611646830897494, 'batch_norm': True, 'sage_aggr': 'max', 'sage_normalize': False, 'sage_project': False, 'lr': 0.007689556817646403, 'weight_decay': 4.161826755145125e-06, 'epochs': 154, 'loss': 'mse', 'optimizer': 'adam', 'graph_mode': 'cutoff', 'cutoff': 0.8051826608182997, 'grm_norm': 'cosine', 'self_loops': True, 'use_snp_selection': False}. Best is trial 50 with value: 0.31796609177250984.
[I 2025-12-09 15:50:47,232] Trial 143 finished with value: 0.31270694515361935 and parameters: {'model_type': 'graphsage', 'hidden_dims': '[512, 128]', 'dropout': 0.3709124992254916, 'batch_norm': True, 'sage_aggr': 'max', 'sage_normalize': False, 'sage_project': False, 'lr': 0.006258175065479533, 'weight_decay': 4.042051246185399e-06, 'epochs': 154, 'loss': 'mse', 'optimizer': 'adam', 'graph_mode': 'cutoff', 'cutoff': 0.7589010069910493, 'grm_norm': 'cosine', 'self_loops': True, 'use_snp_selection': False}. Best is trial 50 with value: 0.31796609177250984.
[I 2025-12-09 15:52:16,825] Trial 144 finished with value: 0.31531697250703405 and parameters: {'model_type': 'graphsage', 'hidden_dims': '[512, 128]', 'dropout': 0.3798139616661364, 'batch_norm': True, 'sage_aggr': 'max', 'sage_normalize': False, 'sage_project': False, 'lr': 0.0076853043651036995, 'weight_decay': 4.510172411572324e-06, 'epochs': 167, 'loss': 'mse', 'optimizer': 'adam', 'graph_mode': 'cutoff', 'cutoff': 0.7956230007773196, 'grm_norm': 'cosine', 'self_loops': True, 'use_snp_selection': False}. Best is trial 50 with value: 0.31796609177250984.
[I 2025-12-09 15:53:46,940] Trial 145 finished with value: 0.3124426544951343 and parameters: {'model_type': 'graphsage', 'hidden_dims': '[512, 128]', 'dropout': 0.3612803801558876, 'batch_norm': True, 'sage_aggr': 'max', 'sage_normalize': False, 'sage_project': False, 'lr': 0.007613120361988293, 'weight_decay': 4.41067798783568e-06, 'epochs': 168, 'loss': 'mse', 'optimizer': 'adam', 'graph_mode': 'cutoff', 'cutoff': 0.798436100652006, 'grm_norm': 'cosine', 'self_loops': True, 'use_snp_selection': False}. Best is trial 50 with value: 0.31796609177250984.
[I 2025-12-09 15:55:03,261] Trial 146 finished with value: 0.3102498079482569 and parameters: {'model_type': 'graphsage', 'hidden_dims': '[512, 128]', 'dropout': 0.37914641294955237, 'batch_norm': True, 'sage_aggr': 'max', 'sage_normalize': False, 'sage_project': False, 'lr': 0.006020707141684702, 'weight_decay': 2.7523115193229426e-06, 'epochs': 141, 'loss': 'mse', 'optimizer': 'adam', 'graph_mode': 'cutoff', 'cutoff': 0.7303049437828779, 'grm_norm': 'cosine', 'self_loops': True, 'use_snp_selection': False}. Best is trial 50 with value: 0.31796609177250984.
[I 2025-12-09 15:55:44,275] Trial 147 finished with value: 0.30838101116636446 and parameters: {'model_type': 'graphsage', 'hidden_dims': '[512, 128]', 'dropout': 0.3901517863128056, 'batch_norm': True, 'sage_aggr': 'max', 'sage_normalize': False, 'sage_project': False, 'lr': 0.00756515522489577, 'weight_decay': 4.915222512932461e-06, 'epochs': 152, 'loss': 'mse', 'optimizer': 'adam', 'graph_mode': 'cutoff', 'cutoff': 0.7777340874178892, 'grm_norm': 'cosine', 'self_loops': True, 'use_snp_selection': True, 'num_snps': 23068}. Best is trial 50 with value: 0.31796609177250984.
[I 2025-12-09 15:57:49,766] Trial 148 finished with value: 0.0 and parameters: {'model_type': 'graphsage', 'hidden_dims': '[512, 128]', 'dropout': 0.34542537234977466, 'batch_norm': False, 'sage_aggr': 'max', 'sage_normalize': False, 'sage_project': False, 'lr': 0.006598289583191712, 'weight_decay': 0.00010490630418735384, 'epochs': 145, 'loss': 'mse', 'optimizer': 'adam', 'graph_mode': 'cutoff', 'cutoff': 0.2989465884477903, 'grm_norm': 'cosine', 'self_loops': False, 'use_snp_selection': False}. Best is trial 50 with value: 0.31796609177250984.
[I 2025-12-09 15:59:17,292] Trial 149 finished with value: 0.31332753748103687 and parameters: {'model_type': 'graphsage', 'hidden_dims': '[512, 128]', 'dropout': 0.367746019019541, 'batch_norm': True, 'sage_aggr': 'max', 'sage_normalize': False, 'sage_project': False, 'lr': 0.005517265812563558, 'weight_decay': 9.47302886061248e-06, 'epochs': 163, 'loss': 'mse', 'optimizer': 'adam', 'graph_mode': 'cutoff', 'cutoff': 0.852958590200712, 'grm_norm': 'cosine', 'self_loops': True, 'use_snp_selection': False}. Best is trial 50 with value: 0.31796609177250984.
[I 2025-12-09 16:00:49,497] Trial 0 finished with value: 0.25300722485252863 and parameters: {'model_type': 'graphsage', 'hidden_dims': '[128, 64]', 'dropout': 0.199031432379812, 'batch_norm': True, 'sage_aggr': 'max', 'sage_normalize': True, 'sage_project': False, 'lr': 0.00034401453323286885, 'weight_decay': 0.00017802616915745114, 'epochs': 230, 'loss': 'mse', 'optimizer': 'adam', 'graph_mode': 'knn', 'knn_k': 6, 'weighted_edges': True, 'symmetrize_mode': 'mutual', 'self_loops': True, 'use_snp_selection': False}. Best is trial 0 with value: 0.25300722485252863.
[I 2025-12-09 16:02:23,505] Trial 1 finished with value: 0.28239075811469133 and parameters: {'model_type': 'graphsage', 'hidden_dims': '[512, 128]', 'dropout': 0.2503500283181017, 'batch_norm': False, 'sage_aggr': 'max', 'sage_normalize': False, 'sage_project': False, 'lr': 3.952233718592099e-05, 'weight_decay': 0.00026754769258252603, 'epochs': 149, 'loss': 'mse', 'optimizer': 'adam', 'graph_mode': 'knn', 'knn_k': 2, 'weighted_edges': False, 'symmetrize_mode': 'mutual', 'self_loops': True, 'use_snp_selection': True, 'num_snps': 49915}. Best is trial 1 with value: 0.28239075811469133.
[I 2025-12-09 16:03:36,048] Trial 2 finished with value: 0.2874802847958235 and parameters: {'model_type': 'graphsage', 'hidden_dims': '[512, 256]', 'dropout': 0.2785908793172681, 'batch_norm': False, 'sage_aggr': 'max', 'sage_normalize': False, 'sage_project': False, 'lr': 8.806039223165805e-05, 'weight_decay': 3.5153176302760294e-05, 'epochs': 147, 'loss': 'mae', 'optimizer': 'adam', 'graph_mode': 'cutoff', 'cutoff': 0.4922564006874869, 'grm_norm': 'gcn', 'self_loops': False, 'use_snp_selection': True, 'num_snps': 34340}. Best is trial 2 with value: 0.2874802847958235.
[I 2025-12-09 16:05:01,320] Trial 3 finished with value: 0.27895960750420495 and parameters: {'model_type': 'graphsage', 'hidden_dims': '[256, 128, 64]', 'dropout': 0.3475243154412272, 'batch_norm': True, 'sage_aggr': 'max', 'sage_normalize': False, 'sage_project': False, 'lr': 1.6006331996938085e-05, 'weight_decay': 7.213121225589906e-06, 'epochs': 283, 'loss': 'mse', 'optimizer': 'adam', 'graph_mode': 'cutoff', 'cutoff': 0.5942334791449215, 'grm_norm': 'none', 'self_loops': True, 'use_snp_selection': False}. Best is trial 2 with value: 0.2874802847958235.
[I 2025-12-09 16:05:24,395] Trial 4 finished with value: 0.2678530554507473 and parameters: {'model_type': 'graphsage', 'hidden_dims': '[128, 64]', 'dropout': 0.3348926467202472, 'batch_norm': True, 'sage_aggr': 'max', 'sage_normalize': False, 'sage_project': False, 'lr': 0.0004238630400638802, 'weight_decay': 8.074086040046576e-07, 'epochs': 158, 'loss': 'mae', 'optimizer': 'adam', 'graph_mode': 'knn', 'knn_k': 1, 'weighted_edges': False, 'symmetrize_mode': 'mutual', 'self_loops': False, 'use_snp_selection': True, 'num_snps': 26850}. Best is trial 2 with value: 0.2874802847958235.
[I 2025-12-09 16:07:43,342] Trial 5 finished with value: 0.24318432824633734 and parameters: {'model_type': 'graphsage', 'hidden_dims': '[512, 64]', 'dropout': 0.14505336736221927, 'batch_norm': True, 'sage_aggr': 'mean', 'sage_normalize': True, 'sage_project': False, 'lr': 1.2962030165732234e-05, 'weight_decay': 1.326598071105465e-07, 'epochs': 180, 'loss': 'mse', 'optimizer': 'adam', 'graph_mode': 'knn', 'knn_k': 9, 'weighted_edges': True, 'symmetrize_mode': 'mutual', 'self_loops': False, 'use_snp_selection': False}. Best is trial 2 with value: 0.2874802847958235.
[I 2025-12-09 16:08:16,914] Trial 6 finished with value: 0.2895681430968783 and parameters: {'model_type': 'graphsage', 'hidden_dims': '[256, 128, 64]', 'dropout': 0.10731743755162496, 'batch_norm': True, 'sage_aggr': 'mean', 'sage_normalize': False, 'sage_project': False, 'lr': 1.922990426933137e-05, 'weight_decay': 7.30001060446905e-05, 'epochs': 63, 'loss': 'mae', 'optimizer': 'adam', 'graph_mode': 'cutoff', 'cutoff': 0.7624978434202536, 'grm_norm': 'none', 'self_loops': True, 'use_snp_selection': True, 'num_snps': 50106}. Best is trial 6 with value: 0.2895681430968783.
