[I 2025-12-08 13:37:29,652] Trial 114 finished with value: 0.30510698027554917 and parameters: {'model_type': 'graphsage', 'hidden_dims': '[512, 128]', 'dropout': 0.5189601738251175, 'batch_norm': True, 'sage_aggr': 'mean', 'sage_normalize': True, 'sage_project': False, 'lr': 0.006421019606744234, 'weight_decay': 1.8874383679968635e-05, 'epochs': 260, 'loss': 'mae', 'optimizer': 'adam', 'graph_mode': 'cutoff', 'cutoff': 0.7285970018075266, 'grm_norm': 'cosine', 'self_loops': False, 'use_snp_selection': False}. Best is trial 49 with value: 0.3080013377654483.
[I 2025-12-08 13:39:46,790] Trial 115 finished with value: 0.30247884711470857 and parameters: {'model_type': 'graphsage', 'hidden_dims': '[512, 128]', 'dropout': 0.5119342819572518, 'batch_norm': True, 'sage_aggr': 'mean', 'sage_normalize': True, 'sage_project': False, 'lr': 0.006519271582153256, 'weight_decay': 1.8592994821190108e-05, 'epochs': 258, 'loss': 'mae', 'optimizer': 'adam', 'graph_mode': 'cutoff', 'cutoff': 0.7387313614514512, 'grm_norm': 'cosine', 'self_loops': False, 'use_snp_selection': False}. Best is trial 49 with value: 0.3080013377654483.
[I 2025-12-08 13:42:15,364] Trial 116 finished with value: 0.30473256085421474 and parameters: {'model_type': 'graphsage', 'hidden_dims': '[512, 64]', 'dropout': 0.5020101031953531, 'batch_norm': True, 'sage_aggr': 'mean', 'sage_normalize': True, 'sage_project': False, 'lr': 0.0073878798086878, 'weight_decay': 3.752812321232435e-05, 'epochs': 281, 'loss': 'mae', 'optimizer': 'adam', 'graph_mode': 'cutoff', 'cutoff': 0.8875830903077652, 'grm_norm': 'none', 'self_loops': False, 'use_snp_selection': False}. Best is trial 49 with value: 0.3080013377654483.
[I 2025-12-08 13:44:44,449] Trial 117 finished with value: 0.3025901155592879 and parameters: {'model_type': 'graphsage', 'hidden_dims': '[512, 64]', 'dropout': 0.4918141805617807, 'batch_norm': True, 'sage_aggr': 'mean', 'sage_normalize': True, 'sage_project': False, 'lr': 0.007996892239100708, 'weight_decay': 5.58985283209623e-05, 'epochs': 282, 'loss': 'mae', 'optimizer': 'adam', 'graph_mode': 'cutoff', 'cutoff': 0.8678716646131471, 'grm_norm': 'none', 'self_loops': False, 'use_snp_selection': False}. Best is trial 49 with value: 0.3080013377654483.
[I 2025-12-08 13:47:18,555] Trial 118 finished with value: 0.306642745265869 and parameters: {'model_type': 'graphsage', 'hidden_dims': '[512, 64]', 'dropout': 0.5242262510762365, 'batch_norm': True, 'sage_aggr': 'mean', 'sage_normalize': True, 'sage_project': False, 'lr': 0.005998459685110189, 'weight_decay': 3.3901888563618686e-05, 'epochs': 292, 'loss': 'mae', 'optimizer': 'adam', 'graph_mode': 'cutoff', 'cutoff': 0.88957694371963, 'grm_norm': 'none', 'self_loops': False, 'use_snp_selection': False}. Best is trial 49 with value: 0.3080013377654483.
[I 2025-12-08 13:48:13,359] Trial 119 finished with value: 0.0 and parameters: {'model_type': 'graphsage', 'hidden_dims': '[512, 64]', 'dropout': 0.5029968533478307, 'batch_norm': False, 'sage_aggr': 'mean', 'sage_normalize': False, 'sage_project': False, 'lr': 0.005388236861971202, 'weight_decay': 3.504081050311925e-05, 'epochs': 264, 'loss': 'mse', 'optimizer': 'adam', 'graph_mode': 'cutoff', 'cutoff': 0.8867784910130168, 'grm_norm': 'none', 'self_loops': False, 'use_snp_selection': True, 'num_snps': 20354}. Best is trial 49 with value: 0.3080013377654483.
[I 2025-12-08 13:50:40,201] Trial 120 finished with value: 0.29901675037335795 and parameters: {'model_type': 'graphsage', 'hidden_dims': '[512, 64]', 'dropout': 0.5238861961015112, 'batch_norm': True, 'sage_aggr': 'max', 'sage_normalize': True, 'sage_project': False, 'lr': 0.005970614894232857, 'weight_decay': 4.037921377180518e-05, 'epochs': 275, 'loss': 'mae', 'optimizer': 'adam', 'graph_mode': 'cutoff', 'cutoff': 0.8870776887585687, 'grm_norm': 'none', 'self_loops': False, 'use_snp_selection': False}. Best is trial 49 with value: 0.3080013377654483.
[I 2025-12-08 13:53:17,935] Trial 121 finished with value: 0.30379584434266105 and parameters: {'model_type': 'graphsage', 'hidden_dims': '[512, 64]', 'dropout': 0.5542745486330192, 'batch_norm': True, 'sage_aggr': 'mean', 'sage_normalize': True, 'sage_project': False, 'lr': 0.0072718082589873344, 'weight_decay': 2.5084872869364752e-05, 'epochs': 299, 'loss': 'mae', 'optimizer': 'adam', 'graph_mode': 'cutoff', 'cutoff': 0.8653943523413962, 'grm_norm': 'none', 'self_loops': False, 'use_snp_selection': False}. Best is trial 49 with value: 0.3080013377654483.
[I 2025-12-08 13:55:50,668] Trial 122 finished with value: 0.3037246802653058 and parameters: {'model_type': 'graphsage', 'hidden_dims': '[512, 64]', 'dropout': 0.5408060190190187, 'batch_norm': True, 'sage_aggr': 'mean', 'sage_normalize': True, 'sage_project': False, 'lr': 0.007049794230042383, 'weight_decay': 3.0330355187955978e-05, 'epochs': 289, 'loss': 'mae', 'optimizer': 'adam', 'graph_mode': 'cutoff', 'cutoff': 0.8492670080672499, 'grm_norm': 'none', 'self_loops': False, 'use_snp_selection': False}. Best is trial 49 with value: 0.3080013377654483.
[I 2025-12-08 13:58:32,639] Trial 123 finished with value: 0.30724146359581056 and parameters: {'model_type': 'graphsage', 'hidden_dims': '[512, 64]', 'dropout': 0.5217508554425769, 'batch_norm': True, 'sage_aggr': 'mean', 'sage_normalize': True, 'sage_project': False, 'lr': 0.009371934311651193, 'weight_decay': 2.066054932422563e-05, 'epochs': 307, 'loss': 'mae', 'optimizer': 'adam', 'graph_mode': 'cutoff', 'cutoff': 0.8383124046999422, 'grm_norm': 'none', 'self_loops': False, 'use_snp_selection': False}. Best is trial 49 with value: 0.3080013377654483.
[I 2025-12-08 14:01:13,478] Trial 124 finished with value: 0.2972202956194149 and parameters: {'model_type': 'graphsage', 'hidden_dims': '[512, 64]', 'dropout': 0.4819272181031004, 'batch_norm': True, 'sage_aggr': 'mean', 'sage_normalize': True, 'sage_project': False, 'lr': 0.008535897664625015, 'weight_decay': 2.1140298579988226e-05, 'epochs': 305, 'loss': 'mae', 'optimizer': 'adam', 'graph_mode': 'cutoff', 'cutoff': 0.8998199308340616, 'grm_norm': 'none', 'self_loops': False, 'use_snp_selection': False}. Best is trial 49 with value: 0.3080013377654483.
[I 2025-12-08 14:03:28,762] Trial 125 finished with value: 0.30683652736928635 and parameters: {'model_type': 'graphsage', 'hidden_dims': '[512, 64]', 'dropout': 0.525204222987373, 'batch_norm': True, 'sage_aggr': 'mean', 'sage_normalize': True, 'sage_project': False, 'lr': 0.004821470154824926, 'weight_decay': 4.729492143090736e-05, 'epochs': 255, 'loss': 'mae', 'optimizer': 'adam', 'graph_mode': 'cutoff', 'cutoff': 0.8371806927231938, 'grm_norm': 'none', 'self_loops': False, 'use_snp_selection': False}. Best is trial 49 with value: 0.3080013377654483.
[I 2025-12-08 14:05:28,654] Trial 126 finished with value: 0.30244283175409825 and parameters: {'model_type': 'graphsage', 'hidden_dims': '[512, 64]', 'dropout': 0.5044363144656306, 'batch_norm': True, 'sage_aggr': 'mean', 'sage_normalize': True, 'sage_project': False, 'lr': 0.004908488401310531, 'weight_decay': 4.733832874658361e-05, 'epochs': 225, 'loss': 'mae', 'optimizer': 'adam', 'graph_mode': 'cutoff', 'cutoff': 0.8404840674332099, 'grm_norm': 'none', 'self_loops': False, 'use_snp_selection': False}. Best is trial 49 with value: 0.3080013377654483.
[I 2025-12-08 14:07:43,471] Trial 127 finished with value: 0.2905553521803876 and parameters: {'model_type': 'graphsage', 'hidden_dims': '[512, 64]', 'dropout': 0.5195905362743501, 'batch_norm': True, 'sage_aggr': 'mean', 'sage_normalize': True, 'sage_project': False, 'lr': 0.006315637581372305, 'weight_decay': 8.800167973233384e-05, 'epochs': 254, 'loss': 'mae', 'optimizer': 'adam', 'graph_mode': 'cutoff', 'cutoff': 0.8032877405267331, 'grm_norm': 'none', 'self_loops': False, 'use_snp_selection': False}. Best is trial 49 with value: 0.3080013377654483.
[I 2025-12-08 14:10:11,242] Trial 128 finished with value: 0.2860598210436047 and parameters: {'model_type': 'graphsage', 'hidden_dims': '[512, 128]', 'dropout': 0.5417921667769275, 'batch_norm': True, 'sage_aggr': 'mean', 'sage_normalize': True, 'sage_project': False, 'lr': 0.009674776788991112, 'weight_decay': 6.93628919493957e-05, 'epochs': 279, 'loss': 'mae', 'optimizer': 'adam', 'graph_mode': 'cutoff', 'cutoff': 0.8812166497117194, 'grm_norm': 'none', 'self_loops': False, 'use_snp_selection': False}. Best is trial 49 with value: 0.3080013377654483.
[I 2025-12-08 14:12:35,732] Trial 129 finished with value: 0.3061605223495969 and parameters: {'model_type': 'graphsage', 'hidden_dims': '[512, 64]', 'dropout': 0.5620112708801125, 'batch_norm': True, 'sage_aggr': 'mean', 'sage_normalize': True, 'sage_project': False, 'lr': 0.005678916861473667, 'weight_decay': 3.5027557507965786e-05, 'epochs': 273, 'loss': 'mae', 'optimizer': 'adam', 'graph_mode': 'cutoff', 'cutoff': 0.8575537562534084, 'grm_norm': 'none', 'self_loops': True, 'use_snp_selection': False}. Best is trial 49 with value: 0.3080013377654483.
[I 2025-12-08 14:13:53,728] Trial 130 finished with value: 0.3000342159651319 and parameters: {'model_type': 'graphsage', 'hidden_dims': '[256, 128, 64]', 'dropout': 0.5626166886375866, 'batch_norm': True, 'sage_aggr': 'mean', 'sage_normalize': True, 'sage_project': False, 'lr': 0.0039414396679691936, 'weight_decay': 0.00013617388606583457, 'epochs': 269, 'loss': 'mse', 'optimizer': 'adam', 'graph_mode': 'cutoff', 'cutoff': 0.8273016424571416, 'grm_norm': 'none', 'self_loops': True, 'use_snp_selection': False}. Best is trial 49 with value: 0.3080013377654483.
[I 2025-12-08 14:16:11,559] Trial 131 finished with value: 0.3050324256987586 and parameters: {'model_type': 'graphsage', 'hidden_dims': '[512, 64]', 'dropout': 0.5271942324596071, 'batch_norm': True, 'sage_aggr': 'mean', 'sage_normalize': True, 'sage_project': False, 'lr': 0.005694363097420995, 'weight_decay': 3.3556903533934935e-05, 'epochs': 260, 'loss': 'mae', 'optimizer': 'adam', 'graph_mode': 'cutoff', 'cutoff': 0.8525405593415313, 'grm_norm': 'none', 'self_loops': True, 'use_snp_selection': False}. Best is trial 49 with value: 0.3080013377654483.
[I 2025-12-08 14:18:29,386] Trial 132 finished with value: 0.30721381893252503 and parameters: {'model_type': 'graphsage', 'hidden_dims': '[512, 64]', 'dropout': 0.529564934989255, 'batch_norm': True, 'sage_aggr': 'mean', 'sage_normalize': True, 'sage_project': False, 'lr': 0.005301090816402837, 'weight_decay': 2.0272354127027007e-05, 'epochs': 260, 'loss': 'mae', 'optimizer': 'adam', 'graph_mode': 'cutoff', 'cutoff': 0.8541678389361785, 'grm_norm': 'none', 'self_loops': True, 'use_snp_selection': False}. Best is trial 49 with value: 0.3080013377654483.
[I 2025-12-08 14:20:46,223] Trial 133 finished with value: 0.3076649707999377 and parameters: {'model_type': 'graphsage', 'hidden_dims': '[512, 64]', 'dropout': 0.5308152081273244, 'batch_norm': True, 'sage_aggr': 'mean', 'sage_normalize': True, 'sage_project': False, 'lr': 0.00569250856298453, 'weight_decay': 2.0403498043432177e-05, 'epochs': 258, 'loss': 'mae', 'optimizer': 'adam', 'graph_mode': 'cutoff', 'cutoff': 0.8648990915474429, 'grm_norm': 'none', 'self_loops': True, 'use_snp_selection': False}. Best is trial 49 with value: 0.3080013377654483.
[I 2025-12-08 14:22:56,918] Trial 134 finished with value: 0.30934294609705376 and parameters: {'model_type': 'graphsage', 'hidden_dims': '[512, 64]', 'dropout': 0.5313601005987088, 'batch_norm': True, 'sage_aggr': 'mean', 'sage_normalize': True, 'sage_project': False, 'lr': 0.005222523187632829, 'weight_decay': 1.9416677050640648e-05, 'epochs': 246, 'loss': 'mae', 'optimizer': 'adam', 'graph_mode': 'cutoff', 'cutoff': 0.859572126919388, 'grm_norm': 'none', 'self_loops': True, 'use_snp_selection': False}. Best is trial 134 with value: 0.30934294609705376.
[I 2025-12-08 14:25:06,511] Trial 135 finished with value: 0.30576530673283775 and parameters: {'model_type': 'graphsage', 'hidden_dims': '[512, 64]', 'dropout': 0.5133778255657473, 'batch_norm': True, 'sage_aggr': 'mean', 'sage_normalize': True, 'sage_project': False, 'lr': 0.004952670150076736, 'weight_decay': 1.8844321066954203e-05, 'epochs': 244, 'loss': 'mae', 'optimizer': 'adam', 'graph_mode': 'cutoff', 'cutoff': 0.8705700122263487, 'grm_norm': 'none', 'self_loops': True, 'use_snp_selection': False}. Best is trial 134 with value: 0.30934294609705376.
[I 2025-12-08 14:27:17,665] Trial 136 finished with value: 0.30344805525021606 and parameters: {'model_type': 'graphsage', 'hidden_dims': '[512, 64]', 'dropout': 0.5335221153329599, 'batch_norm': True, 'sage_aggr': 'mean', 'sage_normalize': True, 'sage_project': False, 'lr': 0.004560172895048821, 'weight_decay': 1.5634611580359373e-05, 'epochs': 247, 'loss': 'mae', 'optimizer': 'adam', 'graph_mode': 'cutoff', 'cutoff': 0.8680240990479781, 'grm_norm': 'none', 'self_loops': True, 'use_snp_selection': False}. Best is trial 134 with value: 0.30934294609705376.
[I 2025-12-08 14:29:25,211] Trial 137 finished with value: 0.3047720256566633 and parameters: {'model_type': 'graphsage', 'hidden_dims': '[512, 64]', 'dropout': 0.4589628396304865, 'batch_norm': True, 'sage_aggr': 'max', 'sage_normalize': True, 'sage_project': False, 'lr': 0.00523821116600748, 'weight_decay': 1.3131794108221882e-05, 'epochs': 241, 'loss': 'mae', 'optimizer': 'adam', 'graph_mode': 'cutoff', 'cutoff': 0.8421941337151747, 'grm_norm': 'none', 'self_loops': True, 'use_snp_selection': False}. Best is trial 134 with value: 0.30934294609705376.
[I 2025-12-08 14:33:38,082] Trial 138 finished with value: 0.28915453539684527 and parameters: {'model_type': 'graphsage', 'hidden_dims': '[512, 64]', 'dropout': 0.3232363113876602, 'batch_norm': True, 'sage_aggr': 'mean', 'sage_normalize': True, 'sage_project': False, 'lr': 0.0035929560374053705, 'weight_decay': 2.3394222310677347e-05, 'epochs': 251, 'loss': 'mae', 'optimizer': 'adam', 'graph_mode': 'knn', 'knn_k': 8, 'weighted_edges': False, 'symmetrize_mode': 'union', 'self_loops': True, 'use_snp_selection': False}. Best is trial 134 with value: 0.30934294609705376.
[I 2025-12-08 14:35:39,512] Trial 139 finished with value: 0.30305489640707506 and parameters: {'model_type': 'graphsage', 'hidden_dims': '[512, 64]', 'dropout': 0.5137127555157837, 'batch_norm': True, 'sage_aggr': 'mean', 'sage_normalize': True, 'sage_project': False, 'lr': 0.0045205680640939706, 'weight_decay': 2.668985445058312e-05, 'epochs': 228, 'loss': 'mae', 'optimizer': 'adam', 'graph_mode': 'cutoff', 'cutoff': 0.8729099597541143, 'grm_norm': 'none', 'self_loops': True, 'use_snp_selection': False}. Best is trial 134 with value: 0.30934294609705376.
[I 2025-12-08 14:38:00,085] Trial 140 finished with value: 0.3053396709198749 and parameters: {'model_type': 'graphsage', 'hidden_dims': '[512, 64]', 'dropout': 0.5674157227472786, 'batch_norm': True, 'sage_aggr': 'mean', 'sage_normalize': True, 'sage_project': False, 'lr': 0.00522625062315059, 'weight_decay': 1.048625122841933e-05, 'epochs': 234, 'loss': 'mae', 'optimizer': 'adam', 'graph_mode': 'cutoff', 'cutoff': 0.8589514259013605, 'grm_norm': 'none', 'self_loops': True, 'use_snp_selection': False}. Best is trial 134 with value: 0.30934294609705376.
[I 2025-12-08 14:40:06,255] Trial 141 finished with value: 0.31095716943054386 and parameters: {'model_type': 'graphsage', 'hidden_dims': '[512, 64]', 'dropout': 0.5714707330929277, 'batch_norm': True, 'sage_aggr': 'mean', 'sage_normalize': True, 'sage_project': False, 'lr': 0.005887331614066615, 'weight_decay': 1.034700976576079e-05, 'epochs': 237, 'loss': 'mae', 'optimizer': 'adam', 'graph_mode': 'cutoff', 'cutoff': 0.8286472298717851, 'grm_norm': 'none', 'self_loops': True, 'use_snp_selection': False}. Best is trial 141 with value: 0.31095716943054386.
[I 2025-12-08 14:42:21,583] Trial 142 finished with value: 0.2775150058424206 and parameters: {'model_type': 'graphsage', 'hidden_dims': '[512, 64]', 'dropout': 0.5591054537260903, 'batch_norm': True, 'sage_aggr': 'mean', 'sage_normalize': True, 'sage_project': False, 'lr': 0.0003478895806853011, 'weight_decay': 1.922689140461943e-05, 'epochs': 255, 'loss': 'mae', 'optimizer': 'adam', 'graph_mode': 'cutoff', 'cutoff': 0.8306451422684984, 'grm_norm': 'none', 'self_loops': True, 'use_snp_selection': False}. Best is trial 141 with value: 0.31095716943054386.
[I 2025-12-08 14:44:30,329] Trial 143 finished with value: 0.30852174246133457 and parameters: {'model_type': 'graphsage', 'hidden_dims': '[512, 64]', 'dropout': 0.5470446864012605, 'batch_norm': True, 'sage_aggr': 'mean', 'sage_normalize': True, 'sage_project': False, 'lr': 0.006048681823610347, 'weight_decay': 1.4500092995613799e-05, 'epochs': 242, 'loss': 'mae', 'optimizer': 'adam', 'graph_mode': 'cutoff', 'cutoff': 0.808883142783783, 'grm_norm': 'none', 'self_loops': True, 'use_snp_selection': False}. Best is trial 141 with value: 0.31095716943054386.
[I 2025-12-08 14:46:37,986] Trial 144 finished with value: 0.30593017563935726 and parameters: {'model_type': 'graphsage', 'hidden_dims': '[512, 64]', 'dropout': 0.5460471972154214, 'batch_norm': True, 'sage_aggr': 'mean', 'sage_normalize': True, 'sage_project': False, 'lr': 0.004085597002307496, 'weight_decay': 1.4535313718707566e-05, 'epochs': 240, 'loss': 'mae', 'optimizer': 'adam', 'graph_mode': 'cutoff', 'cutoff': 0.8126724027415915, 'grm_norm': 'none', 'self_loops': True, 'use_snp_selection': False}. Best is trial 141 with value: 0.31095716943054386.
[I 2025-12-08 14:48:41,046] Trial 145 finished with value: 0.30923506405697887 and parameters: {'model_type': 'graphsage', 'hidden_dims': '[512, 64]', 'dropout': 0.5493724046307366, 'batch_norm': True, 'sage_aggr': 'mean', 'sage_normalize': True, 'sage_project': False, 'lr': 0.005706417180572433, 'weight_decay': 1.3816007918476116e-05, 'epochs': 231, 'loss': 'mae', 'optimizer': 'adam', 'graph_mode': 'cutoff', 'cutoff': 0.8154576228571252, 'grm_norm': 'none', 'self_loops': True, 'use_snp_selection': False}. Best is trial 141 with value: 0.31095716943054386.
[I 2025-12-08 14:50:38,672] Trial 146 finished with value: 0.3073627128870945 and parameters: {'model_type': 'graphsage', 'hidden_dims': '[512, 64]', 'dropout': 0.5717695496604847, 'batch_norm': True, 'sage_aggr': 'mean', 'sage_normalize': False, 'sage_project': False, 'lr': 0.00559094405678263, 'weight_decay': 1.5946602823770525e-05, 'epochs': 221, 'loss': 'mse', 'optimizer': 'adam', 'graph_mode': 'cutoff', 'cutoff': 0.7937183598921738, 'grm_norm': 'none', 'self_loops': True, 'use_snp_selection': False}. Best is trial 141 with value: 0.31095716943054386.
[I 2025-12-08 14:52:35,847] Trial 147 finished with value: 0.0 and parameters: {'model_type': 'graphsage', 'hidden_dims': '[512, 64]', 'dropout': 0.5703391788439235, 'batch_norm': False, 'sage_aggr': 'max', 'sage_normalize': False, 'sage_project': False, 'lr': 0.007980978056750337, 'weight_decay': 1.2827698180237241e-05, 'epochs': 221, 'loss': 'mse', 'optimizer': 'adam', 'graph_mode': 'cutoff', 'cutoff': 0.8020565727505942, 'grm_norm': 'none', 'self_loops': True, 'use_snp_selection': False}. Best is trial 141 with value: 0.31095716943054386.
[I 2025-12-08 14:53:41,910] Trial 148 finished with value: 0.26651981636934446 and parameters: {'model_type': 'graphsage', 'hidden_dims': '[512, 64]', 'dropout': 0.5802976185314757, 'batch_norm': True, 'sage_aggr': 'mean', 'sage_normalize': False, 'sage_project': False, 'lr': 0.00010468862339727067, 'weight_decay': 8.556985025179798e-06, 'epochs': 213, 'loss': 'mse', 'optimizer': 'adam', 'graph_mode': 'cutoff', 'cutoff': 0.794374413414326, 'grm_norm': 'none', 'self_loops': True, 'use_snp_selection': True, 'num_snps': 30534}. Best is trial 141 with value: 0.31095716943054386.
[I 2025-12-08 14:55:47,226] Trial 149 finished with value: 0.30544192973757095 and parameters: {'model_type': 'graphsage', 'hidden_dims': '[512, 64]', 'dropout': 0.5299766401215658, 'batch_norm': True, 'sage_aggr': 'mean', 'sage_normalize': False, 'sage_project': False, 'lr': 0.005992573215311093, 'weight_decay': 1.689947649187126e-05, 'epochs': 236, 'loss': 'mse', 'optimizer': 'adam', 'graph_mode': 'cutoff', 'cutoff': 0.8178180031787385, 'grm_norm': 'none', 'self_loops': True, 'use_snp_selection': False}. Best is trial 141 with value: 0.31095716943054386.
[I 2025-12-08 14:57:34,155] Trial 0 finished with value: 0.2352449935597897 and parameters: {'model_type': 'graphsage', 'hidden_dims': '[128, 64]', 'dropout': 0.199031432379812, 'batch_norm': True, 'sage_aggr': 'max', 'sage_normalize': True, 'sage_project': False, 'lr': 0.00034401453323286885, 'weight_decay': 0.00017802616915745114, 'epochs': 230, 'loss': 'mse', 'optimizer': 'adam', 'graph_mode': 'knn', 'knn_k': 6, 'weighted_edges': True, 'symmetrize_mode': 'mutual', 'self_loops': True, 'use_snp_selection': False}. Best is trial 0 with value: 0.2352449935597897.
[I 2025-12-08 14:59:07,954] Trial 1 finished with value: 0.28583581369782507 and parameters: {'model_type': 'graphsage', 'hidden_dims': '[512, 128]', 'dropout': 0.2503500283181017, 'batch_norm': False, 'sage_aggr': 'max', 'sage_normalize': False, 'sage_project': False, 'lr': 3.952233718592099e-05, 'weight_decay': 0.00026754769258252603, 'epochs': 149, 'loss': 'mse', 'optimizer': 'adam', 'graph_mode': 'knn', 'knn_k': 2, 'weighted_edges': False, 'symmetrize_mode': 'mutual', 'self_loops': True, 'use_snp_selection': True, 'num_snps': 49915}. Best is trial 1 with value: 0.28583581369782507.
[I 2025-12-08 15:00:20,362] Trial 2 finished with value: 0.29111523234812586 and parameters: {'model_type': 'graphsage', 'hidden_dims': '[512, 256]', 'dropout': 0.2785908793172681, 'batch_norm': False, 'sage_aggr': 'max', 'sage_normalize': False, 'sage_project': False, 'lr': 8.806039223165805e-05, 'weight_decay': 3.5153176302760294e-05, 'epochs': 147, 'loss': 'mae', 'optimizer': 'adam', 'graph_mode': 'cutoff', 'cutoff': 0.4922564006874869, 'grm_norm': 'gcn', 'self_loops': False, 'use_snp_selection': True, 'num_snps': 34340}. Best is trial 2 with value: 0.29111523234812586.
