[I 2025-12-06 15:16:42,566] Trial 6 finished with value: 0.14307548177953927 and parameters: {'model_type': 'graphsage', 'hidden_dims': '[512, 64]', 'dropout': 0.2585007811528941, 'batch_norm': True, 'sage_aggr': 'max', 'sage_normalize': False, 'sage_project': False, 'lr': 5.921425508303395e-06, 'weight_decay': 0.0004511561961144237, 'epochs': 136, 'loss': 'mae', 'optimizer': 'adam', 'graph_mode': 'knn', 'knn_k': 9, 'weighted_edges': True, 'symmetrize_mode': 'union', 'self_loops': False, 'use_snp_selection': True, 'num_snps': 34427, 'graphsage_batch_size': 128}. Best is trial 1 with value: 0.2253125310140069.
[I 2025-12-06 15:18:49,492] Trial 7 finished with value: 0.2034253578653355 and parameters: {'model_type': 'graphsage', 'hidden_dims': '[512, 128]', 'dropout': 0.5944584870981006, 'batch_norm': False, 'sage_aggr': 'max', 'sage_normalize': True, 'sage_project': False, 'lr': 7.3241868695773595e-06, 'weight_decay': 1.2565521754060153e-06, 'epochs': 166, 'loss': 'mse', 'optimizer': 'adam', 'graph_mode': 'knn', 'knn_k': 5, 'weighted_edges': False, 'symmetrize_mode': 'mutual', 'self_loops': False, 'use_snp_selection': True, 'num_snps': 50019, 'graphsage_batch_size': 8}. Best is trial 1 with value: 0.2253125310140069.
[I 2025-12-06 15:20:17,239] Trial 8 finished with value: 0.18119921683375032 and parameters: {'model_type': 'graphsage', 'hidden_dims': '[512, 64]', 'dropout': 0.5703535192416116, 'batch_norm': False, 'sage_aggr': 'mean', 'sage_normalize': False, 'sage_project': False, 'lr': 1.823510325310572e-06, 'weight_decay': 0.00013672790135428885, 'epochs': 104, 'loss': 'mae', 'optimizer': 'adam', 'graph_mode': 'knn', 'knn_k': 7, 'weighted_edges': True, 'symmetrize_mode': 'mutual', 'self_loops': False, 'use_snp_selection': True, 'num_snps': 45923, 'graphsage_batch_size': 128}. Best is trial 1 with value: 0.2253125310140069.
[I 2025-12-06 15:22:53,271] Trial 9 finished with value: 0.24506369589305016 and parameters: {'model_type': 'graphsage', 'hidden_dims': '[512, 128]', 'dropout': 0.27261839493092876, 'batch_norm': False, 'sage_aggr': 'mean', 'sage_normalize': False, 'sage_project': False, 'lr': 5.88603310717523e-06, 'weight_decay': 1.0998339923223823e-05, 'epochs': 249, 'loss': 'mae', 'optimizer': 'adam', 'graph_mode': 'knn', 'knn_k': 3, 'weighted_edges': False, 'symmetrize_mode': 'mutual', 'self_loops': False, 'use_snp_selection': False, 'graphsage_batch_size': 128}. Best is trial 9 with value: 0.24506369589305016.
[I 2025-12-06 15:24:52,471] Trial 10 finished with value: 0.22663730881171587 and parameters: {'model_type': 'graphsage', 'hidden_dims': '[512, 256]', 'dropout': 0.11372025982957354, 'batch_norm': False, 'sage_aggr': 'mean', 'sage_normalize': False, 'sage_project': False, 'lr': 1.320954302422749e-05, 'weight_decay': 1.2257443862615642e-07, 'epochs': 197, 'loss': 'mae', 'optimizer': 'adam', 'graph_mode': 'cutoff', 'cutoff': 0.8339492830671671, 'grm_norm': 'none', 'self_loops': False, 'use_snp_selection': False, 'graphsage_batch_size': 32}. Best is trial 9 with value: 0.24506369589305016.
[I 2025-12-06 15:27:16,469] Trial 11 finished with value: 0.23271002843886474 and parameters: {'model_type': 'graphsage', 'hidden_dims': '[512, 256]', 'dropout': 0.10222657792332025, 'batch_norm': False, 'sage_aggr': 'mean', 'sage_normalize': False, 'sage_project': False, 'lr': 1.3209655691727925e-05, 'weight_decay': 1.3081036432574914e-07, 'epochs': 242, 'loss': 'mae', 'optimizer': 'adam', 'graph_mode': 'cutoff', 'cutoff': 0.8841591475995373, 'grm_norm': 'none', 'self_loops': False, 'use_snp_selection': False, 'graphsage_batch_size': 32}. Best is trial 9 with value: 0.24506369589305016.
[I 2025-12-06 15:29:43,215] Trial 12 finished with value: 0.22511837379435393 and parameters: {'model_type': 'graphsage', 'hidden_dims': '[512, 256]', 'dropout': 0.12075505276198942, 'batch_norm': False, 'sage_aggr': 'mean', 'sage_normalize': False, 'sage_project': False, 'lr': 1.6135806111022914e-05, 'weight_decay': 3.9236479104850236e-05, 'epochs': 247, 'loss': 'mae', 'optimizer': 'adam', 'graph_mode': 'cutoff', 'cutoff': 0.8999922387503135, 'grm_norm': 'none', 'self_loops': False, 'use_snp_selection': False, 'graphsage_batch_size': 16}. Best is trial 9 with value: 0.24506369589305016.
[I 2025-12-06 15:31:06,444] Trial 13 finished with value: 0.22153900713824348 and parameters: {'model_type': 'graphsage', 'hidden_dims': '[256, 128, 64]', 'dropout': 0.47758369914374393, 'batch_norm': False, 'sage_aggr': 'mean', 'sage_normalize': False, 'sage_project': False, 'lr': 0.00014626888081117106, 'weight_decay': 1.8431992240252396e-07, 'epochs': 237, 'loss': 'mae', 'optimizer': 'adam', 'graph_mode': 'cutoff', 'cutoff': 0.6026154383669975, 'grm_norm': 'cosine', 'self_loops': False, 'use_snp_selection': False, 'graphsage_batch_size': 32}. Best is trial 9 with value: 0.24506369589305016.
[I 2025-12-06 15:33:02,993] Trial 14 finished with value: 0.2353239683649529 and parameters: {'model_type': 'graphsage', 'hidden_dims': '[512, 256]', 'dropout': 0.1912660407102787, 'batch_norm': False, 'sage_aggr': 'mean', 'sage_normalize': False, 'sage_project': False, 'lr': 1.0753471288205987e-06, 'weight_decay': 4.768836637177804e-06, 'epochs': 190, 'loss': 'mae', 'optimizer': 'adam', 'graph_mode': 'cutoff', 'cutoff': 0.6337473737887289, 'grm_norm': 'none', 'self_loops': False, 'use_snp_selection': False, 'graphsage_batch_size': 32}. Best is trial 9 with value: 0.24506369589305016.
[I 2025-12-06 15:35:00,033] Trial 15 finished with value: 0.22435036556832647 and parameters: {'model_type': 'graphsage', 'hidden_dims': '[512, 128]', 'dropout': 0.19430533399154346, 'batch_norm': False, 'sage_aggr': 'mean', 'sage_normalize': False, 'sage_project': False, 'lr': 1.1552849555817424e-06, 'weight_decay': 3.222651619217792e-06, 'epochs': 189, 'loss': 'mae', 'optimizer': 'adam', 'graph_mode': 'cutoff', 'cutoff': 0.5856353722304515, 'grm_norm': 'gcn', 'self_loops': False, 'use_snp_selection': False, 'graphsage_batch_size': 256}. Best is trial 9 with value: 0.24506369589305016.
[I 2025-12-06 15:36:18,137] Trial 16 finished with value: 0.2073911154877393 and parameters: {'model_type': 'graphsage', 'hidden_dims': '[256, 128, 64]', 'dropout': 0.18695724051515106, 'batch_norm': False, 'sage_aggr': 'mean', 'sage_normalize': False, 'sage_project': False, 'lr': 1.0932545399555981e-06, 'weight_decay': 3.28711872594583e-05, 'epochs': 169, 'loss': 'mae', 'optimizer': 'adam', 'graph_mode': 'cutoff', 'cutoff': 0.4687734716396823, 'grm_norm': 'cosine_then_gcn', 'self_loops': False, 'use_snp_selection': False, 'graphsage_batch_size': 16}. Best is trial 9 with value: 0.24506369589305016.
[I 2025-12-06 15:36:59,865] Trial 17 finished with value: 0.17124197450699766 and parameters: {'model_type': 'graphsage', 'hidden_dims': '[128, 64]', 'dropout': 0.2739338904158908, 'batch_norm': False, 'sage_aggr': 'mean', 'sage_normalize': False, 'sage_project': False, 'lr': 4.558649580263107e-06, 'weight_decay': 8.60164792599315e-06, 'epochs': 210, 'loss': 'mae', 'optimizer': 'adam', 'graph_mode': 'knn', 'knn_k': 1, 'weighted_edges': False, 'symmetrize_mode': 'mutual', 'self_loops': False, 'use_snp_selection': False, 'graphsage_batch_size': 64}. Best is trial 9 with value: 0.24506369589305016.
[I 2025-12-06 15:38:53,469] Trial 18 finished with value: 0.20805696622284492 and parameters: {'model_type': 'graphsage', 'hidden_dims': '[512, 256]', 'dropout': 0.4540259744825027, 'batch_norm': False, 'sage_aggr': 'mean', 'sage_normalize': False, 'sage_project': False, 'lr': 2.9490801869800245e-06, 'weight_decay': 5.718830643120285e-07, 'epochs': 183, 'loss': 'mae', 'optimizer': 'adam', 'graph_mode': 'knn', 'knn_k': 2, 'weighted_edges': False, 'symmetrize_mode': 'mutual', 'self_loops': False, 'use_snp_selection': False, 'graphsage_batch_size': 512}. Best is trial 9 with value: 0.24506369589305016.
[I 2025-12-06 15:41:04,967] Trial 19 finished with value: 0.2287379439222374 and parameters: {'model_type': 'graphsage', 'hidden_dims': '[512, 128]', 'dropout': 0.32926432824599444, 'batch_norm': False, 'sage_aggr': 'mean', 'sage_normalize': False, 'sage_project': False, 'lr': 1.0031850713966547e-06, 'weight_decay': 0.00010257250880341867, 'epochs': 219, 'loss': 'mae', 'optimizer': 'adam', 'graph_mode': 'cutoff', 'cutoff': 0.705916671355068, 'grm_norm': 'cosine', 'self_loops': False, 'use_snp_selection': False, 'graphsage_batch_size': 128}. Best is trial 9 with value: 0.24506369589305016.
[I 2025-12-06 15:41:55,800] Trial 20 finished with value: 0.18368317029401568 and parameters: {'model_type': 'graphsage', 'hidden_dims': '[512, 256]', 'dropout': 0.23118533206800315, 'batch_norm': False, 'sage_aggr': 'mean', 'sage_normalize': False, 'sage_project': False, 'lr': 7.770789723303894e-05, 'weight_decay': 4.354327828094187e-06, 'epochs': 60, 'loss': 'mae', 'optimizer': 'adam', 'graph_mode': 'knn', 'knn_k': 3, 'weighted_edges': False, 'symmetrize_mode': 'union', 'self_loops': False, 'use_snp_selection': False, 'graphsage_batch_size': 32}. Best is trial 9 with value: 0.24506369589305016.
[I 2025-12-06 15:44:24,635] Trial 21 finished with value: 0.21862702195052566 and parameters: {'model_type': 'graphsage', 'hidden_dims': '[512, 256]', 'dropout': 0.15147793469937662, 'batch_norm': False, 'sage_aggr': 'mean', 'sage_normalize': False, 'sage_project': False, 'lr': 9.133099552426924e-06, 'weight_decay': 3.623037557744699e-07, 'epochs': 250, 'loss': 'mae', 'optimizer': 'adam', 'graph_mode': 'cutoff', 'cutoff': 0.7484817936590619, 'grm_norm': 'none', 'self_loops': False, 'use_snp_selection': False, 'graphsage_batch_size': 32}. Best is trial 9 with value: 0.24506369589305016.
[I 2025-12-06 15:47:07,979] Trial 22 finished with value: 0.2395779096173965 and parameters: {'model_type': 'graphsage', 'hidden_dims': '[512, 256]', 'dropout': 0.10149366541837598, 'batch_norm': False, 'sage_aggr': 'mean', 'sage_normalize': False, 'sage_project': False, 'lr': 1.7655228281572596e-05, 'weight_decay': 1.7981475778847858e-05, 'epochs': 229, 'loss': 'mae', 'optimizer': 'adam', 'graph_mode': 'cutoff', 'cutoff': 0.4557270864962603, 'grm_norm': 'none', 'self_loops': False, 'use_snp_selection': False, 'graphsage_batch_size': 32}. Best is trial 9 with value: 0.24506369589305016.
[I 2025-12-06 15:49:34,228] Trial 23 finished with value: 0.23840372193543255 and parameters: {'model_type': 'graphsage', 'hidden_dims': '[512, 256]', 'dropout': 0.16334484980334002, 'batch_norm': False, 'sage_aggr': 'mean', 'sage_normalize': False, 'sage_project': False, 'lr': 1.9668253311020833e-05, 'weight_decay': 1.6832733838950738e-05, 'epochs': 201, 'loss': 'mae', 'optimizer': 'adam', 'graph_mode': 'cutoff', 'cutoff': 0.4272231073716442, 'grm_norm': 'none', 'self_loops': False, 'use_snp_selection': False, 'graphsage_batch_size': 32}. Best is trial 9 with value: 0.24506369589305016.
[I 2025-12-06 15:52:14,912] Trial 24 finished with value: 0.23694665448590307 and parameters: {'model_type': 'graphsage', 'hidden_dims': '[512, 128]', 'dropout': 0.1528667400594248, 'batch_norm': False, 'sage_aggr': 'mean', 'sage_normalize': False, 'sage_project': False, 'lr': 2.387131255529445e-05, 'weight_decay': 1.4977550621451806e-05, 'epochs': 227, 'loss': 'mae', 'optimizer': 'adam', 'graph_mode': 'cutoff', 'cutoff': 0.46284967837514235, 'grm_norm': 'none', 'self_loops': False, 'use_snp_selection': False, 'graphsage_batch_size': 32}. Best is trial 9 with value: 0.24506369589305016.
[I 2025-12-06 15:54:50,620] Trial 25 finished with value: 0.23568942867806203 and parameters: {'model_type': 'graphsage', 'hidden_dims': '[512, 256]', 'dropout': 0.14917487191800213, 'batch_norm': False, 'sage_aggr': 'mean', 'sage_normalize': False, 'sage_project': False, 'lr': 6.350916063516628e-05, 'weight_decay': 5.880038979898071e-05, 'epochs': 212, 'loss': 'mae', 'optimizer': 'adam', 'graph_mode': 'cutoff', 'cutoff': 0.4037485757908826, 'grm_norm': 'none', 'self_loops': False, 'use_snp_selection': False, 'graphsage_batch_size': 128}. Best is trial 9 with value: 0.24506369589305016.
[I 2025-12-06 15:58:07,007] Trial 26 finished with value: 0.2311004095687954 and parameters: {'model_type': 'graphsage', 'hidden_dims': '[512, 64]', 'dropout': 0.23370004702575253, 'batch_norm': True, 'sage_aggr': 'max', 'sage_normalize': True, 'sage_project': False, 'lr': 5.308318512588359e-05, 'weight_decay': 1.7314066603286763e-05, 'epochs': 149, 'loss': 'mse', 'optimizer': 'adam', 'graph_mode': 'cutoff', 'cutoff': 0.23658322447954427, 'grm_norm': 'none', 'self_loops': False, 'use_snp_selection': False, 'graphsage_batch_size': 32}. Best is trial 9 with value: 0.24506369589305016.
[I 2025-12-06 15:59:18,406] Trial 27 finished with value: 0.21682297640675374 and parameters: {'model_type': 'graphsage', 'hidden_dims': '[128, 64]', 'dropout': 0.31261814447377834, 'batch_norm': False, 'sage_aggr': 'mean', 'sage_normalize': False, 'sage_project': False, 'lr': 2.0211138124625436e-05, 'weight_decay': 0.00034020115861653906, 'epochs': 232, 'loss': 'mae', 'optimizer': 'adam', 'graph_mode': 'cutoff', 'cutoff': 0.4797710686415915, 'grm_norm': 'cosine_then_gcn', 'self_loops': False, 'use_snp_selection': False, 'graphsage_batch_size': 16}. Best is trial 9 with value: 0.24506369589305016.
[I 2025-12-06 16:01:09,543] Trial 28 finished with value: 0.21402140600635294 and parameters: {'model_type': 'graphsage', 'hidden_dims': '[256, 128, 64]', 'dropout': 0.15553601281019075, 'batch_norm': False, 'sage_aggr': 'mean', 'sage_normalize': False, 'sage_project': False, 'lr': 9.410858053685494e-06, 'weight_decay': 6.428651292666124e-05, 'epochs': 203, 'loss': 'mae', 'optimizer': 'adam', 'graph_mode': 'knn', 'knn_k': 10, 'weighted_edges': False, 'symmetrize_mode': 'mutual', 'self_loops': False, 'use_snp_selection': False, 'graphsage_batch_size': 256}. Best is trial 9 with value: 0.24506369589305016.
[I 2025-12-06 16:01:45,753] Trial 29 finished with value: 0.182531539826326 and parameters: {'model_type': 'graphsage', 'hidden_dims': '[128, 64]', 'dropout': 0.2255127695114046, 'batch_norm': True, 'sage_aggr': 'max', 'sage_normalize': False, 'sage_project': False, 'lr': 3.376844707503783e-05, 'weight_decay': 1.6174309231704404e-06, 'epochs': 183, 'loss': 'mse', 'optimizer': 'adam', 'graph_mode': 'knn', 'knn_k': 1, 'weighted_edges': False, 'symmetrize_mode': 'mutual', 'self_loops': False, 'use_snp_selection': False, 'graphsage_batch_size': 64}. Best is trial 9 with value: 0.24506369589305016.
[I 2025-12-06 16:03:43,525] Trial 30 finished with value: 0.23401568183087074 and parameters: {'model_type': 'graphsage', 'hidden_dims': '[512, 128]', 'dropout': 0.29959202231632276, 'batch_norm': False, 'sage_aggr': 'mean', 'sage_normalize': False, 'sage_project': False, 'lr': 4.397890885718686e-06, 'weight_decay': 0.0001959486967874826, 'epochs': 156, 'loss': 'mae', 'optimizer': 'adam', 'graph_mode': 'cutoff', 'cutoff': 0.3709744185905062, 'grm_norm': 'cosine', 'self_loops': False, 'use_snp_selection': False, 'graphsage_batch_size': 512}. Best is trial 9 with value: 0.24506369589305016.
[I 2025-12-06 16:06:11,042] Trial 31 finished with value: 0.22283205438972797 and parameters: {'model_type': 'graphsage', 'hidden_dims': '[512, 128]', 'dropout': 0.16326239218460276, 'batch_norm': False, 'sage_aggr': 'mean', 'sage_normalize': False, 'sage_project': False, 'lr': 2.418661475965984e-05, 'weight_decay': 1.269185415999148e-05, 'epochs': 225, 'loss': 'mae', 'optimizer': 'adam', 'graph_mode': 'cutoff', 'cutoff': 0.5067341356515616, 'grm_norm': 'none', 'self_loops': False, 'use_snp_selection': False, 'graphsage_batch_size': 32}. Best is trial 9 with value: 0.24506369589305016.
[I 2025-12-06 16:08:57,770] Trial 32 finished with value: 0.23509449263348917 and parameters: {'model_type': 'graphsage', 'hidden_dims': '[512, 128]', 'dropout': 0.13378652830468513, 'batch_norm': False, 'sage_aggr': 'mean', 'sage_normalize': False, 'sage_project': False, 'lr': 4.0936179089343564e-05, 'weight_decay': 1.770337647817358e-05, 'epochs': 231, 'loss': 'mae', 'optimizer': 'adam', 'graph_mode': 'cutoff', 'cutoff': 0.42155122791100913, 'grm_norm': 'none', 'self_loops': False, 'use_snp_selection': False, 'graphsage_batch_size': 32}. Best is trial 9 with value: 0.24506369589305016.
[I 2025-12-06 16:12:13,576] Trial 33 finished with value: 0.24520186056173535 and parameters: {'model_type': 'graphsage', 'hidden_dims': '[512, 128]', 'dropout': 0.17488987841442802, 'batch_norm': False, 'sage_aggr': 'mean', 'sage_normalize': False, 'sage_project': False, 'lr': 0.00011270275078542799, 'weight_decay': 2.7789497992954837e-05, 'epochs': 239, 'loss': 'mae', 'optimizer': 'adam', 'graph_mode': 'cutoff', 'cutoff': 0.3077401471664333, 'grm_norm': 'none', 'self_loops': False, 'use_snp_selection': False, 'graphsage_batch_size': 32}. Best is trial 33 with value: 0.24520186056173535.
[I 2025-12-06 16:15:27,085] Trial 34 finished with value: 0.051754365800996995 and parameters: {'model_type': 'graphsage', 'hidden_dims': '[512, 128]', 'dropout': 0.21366016197975068, 'batch_norm': False, 'sage_aggr': 'mean', 'sage_normalize': False, 'sage_project': False, 'lr': 0.0005616542426369831, 'weight_decay': 2.8484501184018403e-05, 'epochs': 250, 'loss': 'mse', 'optimizer': 'adam', 'graph_mode': 'cutoff', 'cutoff': 0.33582673728238094, 'grm_norm': 'gcn', 'self_loops': False, 'use_snp_selection': False, 'graphsage_batch_size': 8}. Best is trial 33 with value: 0.24520186056173535.
[I 2025-12-06 16:16:36,100] Trial 35 finished with value: 0.23488499825110298 and parameters: {'model_type': 'graphsage', 'hidden_dims': '[512, 256]', 'dropout': 0.256507172243068, 'batch_norm': True, 'sage_aggr': 'mean', 'sage_normalize': True, 'sage_project': False, 'lr': 0.00030522174517193273, 'weight_decay': 5.8412684548082725e-05, 'epochs': 41, 'loss': 'mae', 'optimizer': 'adam', 'graph_mode': 'knn', 'knn_k': 4, 'weighted_edges': False, 'symmetrize_mode': 'union', 'self_loops': False, 'use_snp_selection': True, 'num_snps': 59573, 'graphsage_batch_size': 128}. Best is trial 33 with value: 0.24520186056173535.
[I 2025-12-06 16:22:02,074] Trial 36 finished with value: 0.005815310749832131 and parameters: {'model_type': 'graphsage', 'hidden_dims': '[512, 128]', 'dropout': 0.10070854953742588, 'batch_norm': False, 'sage_aggr': 'max', 'sage_normalize': False, 'sage_project': False, 'lr': 0.0009856797314608228, 'weight_decay': 7.400788762840183e-06, 'epochs': 218, 'loss': 'mse', 'optimizer': 'adam', 'graph_mode': 'cutoff', 'cutoff': 0.2048628349716828, 'grm_norm': 'none', 'self_loops': False, 'use_snp_selection': False, 'graphsage_batch_size': 32}. Best is trial 33 with value: 0.24520186056173535.
[I 2025-12-06 16:22:24,870] Trial 37 finished with value: 0.2073668311983568 and parameters: {'model_type': 'graphsage', 'hidden_dims': '[256, 128]', 'dropout': 0.1867202181983973, 'batch_norm': True, 'sage_aggr': 'mean', 'sage_normalize': True, 'sage_project': False, 'lr': 9.324207920254742e-05, 'weight_decay': 2.35040522145547e-06, 'epochs': 235, 'loss': 'mae', 'optimizer': 'adam', 'graph_mode': 'knn', 'knn_k': 3, 'weighted_edges': False, 'symmetrize_mode': 'mutual', 'self_loops': False, 'use_snp_selection': True, 'num_snps': 4166, 'graphsage_batch_size': 256}. Best is trial 33 with value: 0.24520186056173535.
[I 2025-12-06 16:25:36,425] Trial 38 finished with value: 0.2378007046860906 and parameters: {'model_type': 'graphsage', 'hidden_dims': '[512, 256]', 'dropout': 0.28398375349732713, 'batch_norm': False, 'sage_aggr': 'max', 'sage_normalize': False, 'sage_project': False, 'lr': 0.000128576928131627, 'weight_decay': 2.3038302897553145e-05, 'epochs': 204, 'loss': 'mae', 'optimizer': 'adam', 'graph_mode': 'cutoff', 'cutoff': 0.29336860398190473, 'grm_norm': 'none', 'self_loops': False, 'use_snp_selection': False, 'graphsage_batch_size': 128}. Best is trial 33 with value: 0.24520186056173535.
[I 2025-12-06 16:26:27,975] Trial 39 finished with value: 0.2149725001727735 and parameters: {'model_type': 'graphsage', 'hidden_dims': '[512, 64]', 'dropout': 0.4073610501109933, 'batch_norm': False, 'sage_aggr': 'mean', 'sage_normalize': True, 'sage_project': False, 'lr': 0.00022532783198538203, 'weight_decay': 5.404210166742482e-06, 'epochs': 125, 'loss': 'mse', 'optimizer': 'adam', 'graph_mode': 'knn', 'knn_k': 5, 'weighted_edges': False, 'symmetrize_mode': 'mutual', 'self_loops': False, 'use_snp_selection': True, 'num_snps': 23524, 'graphsage_batch_size': 8}. Best is trial 33 with value: 0.24520186056173535.
[I 2025-12-06 16:27:53,851] Trial 40 finished with value: 0.23325462556027654 and parameters: {'model_type': 'graphsage', 'hidden_dims': '[256, 128]', 'dropout': 0.36021792340492104, 'batch_norm': True, 'sage_aggr': 'mean', 'sage_normalize': False, 'sage_project': False, 'lr': 3.989740422165364e-05, 'weight_decay': 1.0015655375014088e-05, 'epochs': 220, 'loss': 'mae', 'optimizer': 'adam', 'graph_mode': 'cutoff', 'cutoff': 0.5166136693594529, 'grm_norm': 'none', 'self_loops': False, 'use_snp_selection': False, 'graphsage_batch_size': 32}. Best is trial 33 with value: 0.24520186056173535.
[I 2025-12-06 16:30:51,942] Trial 41 finished with value: 0.22713807488929727 and parameters: {'model_type': 'graphsage', 'hidden_dims': '[512, 256]', 'dropout': 0.29231418827763767, 'batch_norm': False, 'sage_aggr': 'max', 'sage_normalize': False, 'sage_project': False, 'lr': 0.00010760115525134191, 'weight_decay': 1.9645199891273614e-05, 'epochs': 199, 'loss': 'mae', 'optimizer': 'adam', 'graph_mode': 'cutoff', 'cutoff': 0.3100948706648626, 'grm_norm': 'none', 'self_loops': False, 'use_snp_selection': False, 'graphsage_batch_size': 128}. Best is trial 33 with value: 0.24520186056173535.
