[I 2025-12-08 15:44:24,059] Trial 116 finished with value: 0.21317750800693167 and parameters: {'model_type': 'graphsage', 'hidden_dims': '[256, 128]', 'dropout': 0.539315543791264, 'batch_norm': True, 'sage_aggr': 'max', 'sage_normalize': True, 'sage_project': False, 'lr': 0.0018054671379040476, 'weight_decay': 0.00013859685042390664, 'epochs': 74, 'loss': 'mae', 'optimizer': 'adam', 'graph_mode': 'knn', 'knn_k': 10, 'weighted_edges': True, 'symmetrize_mode': 'union', 'self_loops': True, 'use_snp_selection': False}. Best is trial 32 with value: 0.29775721061271626.
[I 2025-12-08 15:45:02,254] Trial 117 finished with value: 0.2892234153575508 and parameters: {'model_type': 'graphsage', 'hidden_dims': '[512, 64]', 'dropout': 0.5206424534817211, 'batch_norm': True, 'sage_aggr': 'max', 'sage_normalize': False, 'sage_project': False, 'lr': 0.0073297183527941045, 'weight_decay': 9.181600203967777e-05, 'epochs': 62, 'loss': 'mse', 'optimizer': 'adam', 'graph_mode': 'cutoff', 'cutoff': 0.7721079513805209, 'grm_norm': 'gcn', 'self_loops': True, 'use_snp_selection': False}. Best is trial 32 with value: 0.29775721061271626.
[I 2025-12-08 15:45:34,241] Trial 118 finished with value: 0.29507207794445856 and parameters: {'model_type': 'graphsage', 'hidden_dims': '[256, 128]', 'dropout': 0.5505477556508693, 'batch_norm': True, 'sage_aggr': 'max', 'sage_normalize': False, 'sage_project': False, 'lr': 0.0032998067973908168, 'weight_decay': 0.00019742503029471182, 'epochs': 95, 'loss': 'mse', 'optimizer': 'adam', 'graph_mode': 'cutoff', 'cutoff': 0.8045732713405204, 'grm_norm': 'gcn', 'self_loops': True, 'use_snp_selection': False}. Best is trial 32 with value: 0.29775721061271626.
[I 2025-12-08 15:47:03,765] Trial 119 finished with value: 0.2713398697538171 and parameters: {'model_type': 'graphsage', 'hidden_dims': '[256, 128]', 'dropout': 0.5648490471648703, 'batch_norm': True, 'sage_aggr': 'max', 'sage_normalize': False, 'sage_project': False, 'lr': 0.004328634848407259, 'weight_decay': 0.00010768828908750158, 'epochs': 224, 'loss': 'mse', 'optimizer': 'adam', 'graph_mode': 'cutoff', 'cutoff': 0.5132485572301031, 'grm_norm': 'gcn', 'self_loops': True, 'use_snp_selection': True, 'num_snps': 40648}. Best is trial 32 with value: 0.29775721061271626.
[I 2025-12-08 15:47:24,921] Trial 120 finished with value: 0.022714265525476292 and parameters: {'model_type': 'graphsage', 'hidden_dims': '[256, 128, 64]', 'dropout': 0.5250886749017044, 'batch_norm': False, 'sage_aggr': 'max', 'sage_normalize': False, 'sage_project': False, 'lr': 0.0003436320892648661, 'weight_decay': 7.338989818946322e-05, 'epochs': 49, 'loss': 'mse', 'optimizer': 'adam', 'graph_mode': 'cutoff', 'cutoff': 0.7308140147212907, 'grm_norm': 'gcn', 'self_loops': False, 'use_snp_selection': False}. Best is trial 32 with value: 0.29775721061271626.
[I 2025-12-08 15:47:59,931] Trial 121 finished with value: 0.2656599894221814 and parameters: {'model_type': 'graphsage', 'hidden_dims': '[256, 128]', 'dropout': 0.5730360806244538, 'batch_norm': True, 'sage_aggr': 'max', 'sage_normalize': False, 'sage_project': False, 'lr': 0.0025697265257721854, 'weight_decay': 0.00025054361577456284, 'epochs': 78, 'loss': 'mse', 'optimizer': 'adam', 'graph_mode': 'cutoff', 'cutoff': 0.44892607514888744, 'grm_norm': 'cosine_then_gcn', 'self_loops': True, 'use_snp_selection': False}. Best is trial 32 with value: 0.29775721061271626.
[I 2025-12-08 15:48:26,399] Trial 122 finished with value: 0.2923414597688737 and parameters: {'model_type': 'graphsage', 'hidden_dims': '[256, 128]', 'dropout': 0.5825038034585155, 'batch_norm': True, 'sage_aggr': 'max', 'sage_normalize': False, 'sage_project': False, 'lr': 0.0021265030259107797, 'weight_decay': 0.0008466449781926033, 'epochs': 71, 'loss': 'mse', 'optimizer': 'adam', 'graph_mode': 'cutoff', 'cutoff': 0.7467753616887558, 'grm_norm': 'gcn', 'self_loops': True, 'use_snp_selection': False}. Best is trial 32 with value: 0.29775721061271626.
[I 2025-12-08 15:48:47,470] Trial 123 finished with value: 0.2930536189131959 and parameters: {'model_type': 'graphsage', 'hidden_dims': '[128, 64]', 'dropout': 0.5566746919259655, 'batch_norm': True, 'sage_aggr': 'max', 'sage_normalize': False, 'sage_project': False, 'lr': 0.0015782080229899864, 'weight_decay': 0.00038709862774982743, 'epochs': 85, 'loss': 'mse', 'optimizer': 'adam', 'graph_mode': 'cutoff', 'cutoff': 0.7157919068777306, 'grm_norm': 'gcn', 'self_loops': True, 'use_snp_selection': False}. Best is trial 32 with value: 0.29775721061271626.
[I 2025-12-08 15:49:10,936] Trial 124 finished with value: 0.2923265246003994 and parameters: {'model_type': 'graphsage', 'hidden_dims': '[256, 128]', 'dropout': 0.5990185622388591, 'batch_norm': True, 'sage_aggr': 'max', 'sage_normalize': False, 'sage_project': False, 'lr': 0.001299530986844842, 'weight_decay': 0.00014590962642768834, 'epochs': 57, 'loss': 'mse', 'optimizer': 'adam', 'graph_mode': 'cutoff', 'cutoff': 0.6258911083906382, 'grm_norm': 'none', 'self_loops': True, 'use_snp_selection': False}. Best is trial 32 with value: 0.29775721061271626.
[I 2025-12-08 15:50:14,416] Trial 125 finished with value: 0.29010020205505765 and parameters: {'model_type': 'graphsage', 'hidden_dims': '[512, 256]', 'dropout': 0.5449996400605545, 'batch_norm': True, 'sage_aggr': 'max', 'sage_normalize': False, 'sage_project': False, 'lr': 0.002853909460145914, 'weight_decay': 0.00032149010526958674, 'epochs': 123, 'loss': 'mse', 'optimizer': 'adam', 'graph_mode': 'cutoff', 'cutoff': 0.7864324369745184, 'grm_norm': 'gcn', 'self_loops': True, 'use_snp_selection': False}. Best is trial 32 with value: 0.29775721061271626.
[I 2025-12-08 15:51:25,982] Trial 126 finished with value: 0.28718318979194557 and parameters: {'model_type': 'graphsage', 'hidden_dims': '[256, 128]', 'dropout': 0.5680672978526168, 'batch_norm': True, 'sage_aggr': 'max', 'sage_normalize': False, 'sage_project': False, 'lr': 0.00013460013534086896, 'weight_decay': 0.0006176734509449694, 'epochs': 268, 'loss': 'mse', 'optimizer': 'adam', 'graph_mode': 'cutoff', 'cutoff': 0.7621028479856894, 'grm_norm': 'gcn', 'self_loops': True, 'use_snp_selection': False}. Best is trial 32 with value: 0.29775721061271626.
[I 2025-12-08 15:52:49,055] Trial 127 finished with value: 0.2825146021325713 and parameters: {'model_type': 'graphsage', 'hidden_dims': '[256, 128]', 'dropout': 0.5771349222246261, 'batch_norm': True, 'sage_aggr': 'max', 'sage_normalize': False, 'sage_project': False, 'lr': 0.005212087241516817, 'weight_decay': 0.00022007373692097278, 'epochs': 318, 'loss': 'mse', 'optimizer': 'adam', 'graph_mode': 'cutoff', 'cutoff': 0.8288640358581854, 'grm_norm': 'gcn', 'self_loops': True, 'use_snp_selection': False}. Best is trial 32 with value: 0.29775721061271626.
[I 2025-12-08 15:53:34,861] Trial 128 finished with value: 0.2924146568674232 and parameters: {'model_type': 'graphsage', 'hidden_dims': '[512, 64]', 'dropout': 0.41587226840612124, 'batch_norm': True, 'sage_aggr': 'max', 'sage_normalize': False, 'sage_project': False, 'lr': 0.0007250488117595859, 'weight_decay': 0.00017483921311389888, 'epochs': 78, 'loss': 'mse', 'optimizer': 'adam', 'graph_mode': 'cutoff', 'cutoff': 0.6971443420860012, 'grm_norm': 'cosine_then_gcn', 'self_loops': True, 'use_snp_selection': False}. Best is trial 32 with value: 0.29775721061271626.
[I 2025-12-08 15:54:00,728] Trial 129 finished with value: 0.2937286912768426 and parameters: {'model_type': 'graphsage', 'hidden_dims': '[256, 128]', 'dropout': 0.5336197649971504, 'batch_norm': True, 'sage_aggr': 'mean', 'sage_normalize': False, 'sage_project': False, 'lr': 0.0018498953021385306, 'weight_decay': 9.888961418962624e-05, 'epochs': 67, 'loss': 'mse', 'optimizer': 'adam', 'graph_mode': 'cutoff', 'cutoff': 0.8135067787652873, 'grm_norm': 'gcn', 'self_loops': True, 'use_snp_selection': False}. Best is trial 32 with value: 0.29775721061271626.
[I 2025-12-08 15:54:37,512] Trial 130 finished with value: 0.2939432197203203 and parameters: {'model_type': 'graphsage', 'hidden_dims': '[256, 128]', 'dropout': 0.5563084076874253, 'batch_norm': True, 'sage_aggr': 'max', 'sage_normalize': False, 'sage_project': False, 'lr': 0.0034279328383844706, 'weight_decay': 0.00027892970838778926, 'epochs': 112, 'loss': 'mse', 'optimizer': 'adam', 'graph_mode': 'cutoff', 'cutoff': 0.8804346344094418, 'grm_norm': 'cosine', 'self_loops': True, 'use_snp_selection': False}. Best is trial 32 with value: 0.29775721061271626.
[I 2025-12-08 15:55:03,126] Trial 131 finished with value: 0.29355174317940713 and parameters: {'model_type': 'graphsage', 'hidden_dims': '[256, 128]', 'dropout': 0.5333592846438373, 'batch_norm': True, 'sage_aggr': 'max', 'sage_normalize': False, 'sage_project': False, 'lr': 0.005755308556088253, 'weight_decay': 0.00020277248677931552, 'epochs': 67, 'loss': 'mse', 'optimizer': 'adam', 'graph_mode': 'cutoff', 'cutoff': 0.8486519154657837, 'grm_norm': 'gcn', 'self_loops': True, 'use_snp_selection': False}. Best is trial 32 with value: 0.29775721061271626.
[I 2025-12-08 15:55:36,635] Trial 132 finished with value: 0.2887302631055996 and parameters: {'model_type': 'graphsage', 'hidden_dims': '[256, 128]', 'dropout': 0.5421388243143127, 'batch_norm': True, 'sage_aggr': 'max', 'sage_normalize': False, 'sage_project': False, 'lr': 0.006409054014606068, 'weight_decay': 0.00018089362645155388, 'epochs': 102, 'loss': 'mse', 'optimizer': 'adam', 'graph_mode': 'cutoff', 'cutoff': 0.8583783733808834, 'grm_norm': 'gcn', 'self_loops': True, 'use_snp_selection': False}. Best is trial 32 with value: 0.29775721061271626.
[I 2025-12-08 15:56:03,925] Trial 133 finished with value: 0.2894128202001403 and parameters: {'model_type': 'graphsage', 'hidden_dims': '[256, 128]', 'dropout': 0.5675224302530921, 'batch_norm': True, 'sage_aggr': 'max', 'sage_normalize': False, 'sage_project': False, 'lr': 0.005413868781900271, 'weight_decay': 0.00012971311770864727, 'epochs': 74, 'loss': 'mse', 'optimizer': 'adam', 'graph_mode': 'cutoff', 'cutoff': 0.77565304200275, 'grm_norm': 'gcn', 'self_loops': True, 'use_snp_selection': False}. Best is trial 32 with value: 0.29775721061271626.
[I 2025-12-08 15:56:35,393] Trial 134 finished with value: 0.2965087484944216 and parameters: {'model_type': 'graphsage', 'hidden_dims': '[256, 128]', 'dropout': 0.5850393280236829, 'batch_norm': True, 'sage_aggr': 'max', 'sage_normalize': False, 'sage_project': False, 'lr': 0.004563555545062105, 'weight_decay': 0.000518954255914785, 'epochs': 93, 'loss': 'mse', 'optimizer': 'adam', 'graph_mode': 'cutoff', 'cutoff': 0.7989050034127938, 'grm_norm': 'gcn', 'self_loops': True, 'use_snp_selection': False}. Best is trial 32 with value: 0.29775721061271626.
[I 2025-12-08 15:57:07,100] Trial 135 finished with value: 0.29544321780446786 and parameters: {'model_type': 'graphsage', 'hidden_dims': '[256, 128]', 'dropout': 0.5915646366212209, 'batch_norm': True, 'sage_aggr': 'max', 'sage_normalize': False, 'sage_project': False, 'lr': 0.0037950565111797108, 'weight_decay': 0.0005404245622996287, 'epochs': 94, 'loss': 'mse', 'optimizer': 'adam', 'graph_mode': 'cutoff', 'cutoff': 0.791446253600878, 'grm_norm': 'gcn', 'self_loops': True, 'use_snp_selection': False}. Best is trial 32 with value: 0.29775721061271626.
[I 2025-12-08 15:57:38,199] Trial 136 finished with value: 0.2927177083338543 and parameters: {'model_type': 'graphsage', 'hidden_dims': '[256, 128]', 'dropout': 0.5844726148641916, 'batch_norm': True, 'sage_aggr': 'max', 'sage_normalize': False, 'sage_project': False, 'lr': 0.00462718890732149, 'weight_decay': 0.00047494941963081237, 'epochs': 91, 'loss': 'mse', 'optimizer': 'adam', 'graph_mode': 'cutoff', 'cutoff': 0.7955190755898269, 'grm_norm': 'gcn', 'self_loops': True, 'use_snp_selection': False}. Best is trial 32 with value: 0.29775721061271626.
[I 2025-12-08 15:58:23,879] Trial 137 finished with value: 0.24293923300320266 and parameters: {'model_type': 'graphsage', 'hidden_dims': '[256, 128]', 'dropout': 0.5997437157825748, 'batch_norm': True, 'sage_aggr': 'max', 'sage_normalize': True, 'sage_project': False, 'lr': 0.0036224600022287004, 'weight_decay': 0.00037016968822817795, 'epochs': 98, 'loss': 'mse', 'optimizer': 'adam', 'graph_mode': 'knn', 'knn_k': 5, 'weighted_edges': False, 'symmetrize_mode': 'mutual', 'self_loops': True, 'use_snp_selection': False}. Best is trial 32 with value: 0.29775721061271626.
[I 2025-12-08 15:59:00,934] Trial 138 finished with value: 0.28083047389602667 and parameters: {'model_type': 'graphsage', 'hidden_dims': '[256, 128]', 'dropout': 0.5869255641261942, 'batch_norm': True, 'sage_aggr': 'max', 'sage_normalize': False, 'sage_project': False, 'lr': 0.003989626618090428, 'weight_decay': 0.0007467098103280777, 'epochs': 117, 'loss': 'mae', 'optimizer': 'adam', 'graph_mode': 'cutoff', 'cutoff': 0.8167660979174495, 'grm_norm': 'gcn', 'self_loops': True, 'use_snp_selection': False}. Best is trial 32 with value: 0.29775721061271626.
[I 2025-12-08 15:59:42,071] Trial 139 finished with value: 0.2774957806033793 and parameters: {'model_type': 'graphsage', 'hidden_dims': '[256, 128]', 'dropout': 0.5765961526177431, 'batch_norm': True, 'sage_aggr': 'max', 'sage_normalize': False, 'sage_project': False, 'lr': 0.0030162797332890295, 'weight_decay': 0.0009995273141788883, 'epochs': 105, 'loss': 'mse', 'optimizer': 'adam', 'graph_mode': 'cutoff', 'cutoff': 0.7818216273459547, 'grm_norm': 'gcn', 'self_loops': True, 'use_snp_selection': True, 'num_snps': 22109}. Best is trial 32 with value: 0.29775721061271626.
[I 2025-12-08 16:00:22,918] Trial 140 finished with value: 0.2919920909960773 and parameters: {'model_type': 'graphsage', 'hidden_dims': '[256, 128, 64]', 'dropout': 0.5601290525706021, 'batch_norm': True, 'sage_aggr': 'max', 'sage_normalize': False, 'sage_project': False, 'lr': 0.0026053501789128778, 'weight_decay': 7.107274690762605e-05, 'epochs': 134, 'loss': 'mse', 'optimizer': 'adam', 'graph_mode': 'cutoff', 'cutoff': 0.8006242080433202, 'grm_norm': 'gcn', 'self_loops': False, 'use_snp_selection': False}. Best is trial 32 with value: 0.29775721061271626.
[I 2025-12-08 16:01:11,029] Trial 141 finished with value: 0.29149463687803595 and parameters: {'model_type': 'graphsage', 'hidden_dims': '[512, 128]', 'dropout': 0.5903694323589989, 'batch_norm': True, 'sage_aggr': 'max', 'sage_normalize': False, 'sage_project': False, 'lr': 0.0021927417932200133, 'weight_decay': 0.0005593210357639966, 'epochs': 84, 'loss': 'mse', 'optimizer': 'adam', 'graph_mode': 'cutoff', 'cutoff': 0.7501461894223966, 'grm_norm': 'cosine', 'self_loops': True, 'use_snp_selection': False}. Best is trial 32 with value: 0.29775721061271626.
[I 2025-12-08 16:01:40,461] Trial 142 finished with value: 0.292914184743866 and parameters: {'model_type': 'graphsage', 'hidden_dims': '[256, 128]', 'dropout': 0.5735918830845859, 'batch_norm': True, 'sage_aggr': 'max', 'sage_normalize': False, 'sage_project': False, 'lr': 9.298855243122552e-05, 'weight_decay': 0.00040914844803114844, 'epochs': 80, 'loss': 'mse', 'optimizer': 'adam', 'graph_mode': 'cutoff', 'cutoff': 0.7665916508871924, 'grm_norm': 'cosine', 'self_loops': True, 'use_snp_selection': False}. Best is trial 32 with value: 0.29775721061271626.
[I 2025-12-08 16:02:31,458] Trial 143 finished with value: 0.2942265264284777 and parameters: {'model_type': 'graphsage', 'hidden_dims': '[512, 128]', 'dropout': 0.549387481420009, 'batch_norm': True, 'sage_aggr': 'max', 'sage_normalize': False, 'sage_project': False, 'lr': 0.004297121955955202, 'weight_decay': 3.6822660120620026e-06, 'epochs': 93, 'loss': 'mse', 'optimizer': 'adam', 'graph_mode': 'cutoff', 'cutoff': 0.730903478292024, 'grm_norm': 'none', 'self_loops': True, 'use_snp_selection': False}. Best is trial 32 with value: 0.29775721061271626.
[I 2025-12-08 16:02:50,772] Trial 144 finished with value: 0.3002692130183666 and parameters: {'model_type': 'graphsage', 'hidden_dims': '[256, 128]', 'dropout': 0.5635046743845596, 'batch_norm': True, 'sage_aggr': 'max', 'sage_normalize': False, 'sage_project': False, 'lr': 1.4701481076704894e-05, 'weight_decay': 0.0005171121868098134, 'epochs': 40, 'loss': 'mse', 'optimizer': 'adam', 'graph_mode': 'cutoff', 'cutoff': 0.7614791862761687, 'grm_norm': 'gcn', 'self_loops': True, 'use_snp_selection': False}. Best is trial 144 with value: 0.3002692130183666.
[I 2025-12-08 16:03:10,237] Trial 145 finished with value: 0.28118717519934283 and parameters: {'model_type': 'graphsage', 'hidden_dims': '[256, 128]', 'dropout': 0.5606930463016326, 'batch_norm': True, 'sage_aggr': 'max', 'sage_normalize': False, 'sage_project': False, 'lr': 1.370258768332689e-05, 'weight_decay': 0.00030688080546866387, 'epochs': 40, 'loss': 'mse', 'optimizer': 'adam', 'graph_mode': 'cutoff', 'cutoff': 0.7886666550456098, 'grm_norm': 'gcn', 'self_loops': True, 'use_snp_selection': False}. Best is trial 144 with value: 0.3002692130183666.
[I 2025-12-08 16:03:32,350] Trial 146 finished with value: 0.27624383672076197 and parameters: {'model_type': 'graphsage', 'hidden_dims': '[256, 128]', 'dropout': 0.5851922029349356, 'batch_norm': True, 'sage_aggr': 'max', 'sage_normalize': False, 'sage_project': False, 'lr': 1.2237499798134721e-05, 'weight_decay': 1.4946353470337406e-06, 'epochs': 52, 'loss': 'mse', 'optimizer': 'adam', 'graph_mode': 'cutoff', 'cutoff': 0.8233628800250719, 'grm_norm': 'gcn', 'self_loops': True, 'use_snp_selection': False}. Best is trial 144 with value: 0.3002692130183666.
[I 2025-12-08 16:03:55,534] Trial 147 finished with value: 0.2524552075740842 and parameters: {'model_type': 'graphsage', 'hidden_dims': '[256, 128]', 'dropout': 0.599653908380917, 'batch_norm': False, 'sage_aggr': 'max', 'sage_normalize': False, 'sage_project': False, 'lr': 1.5147460956866142e-05, 'weight_decay': 0.0004756778706533412, 'epochs': 58, 'loss': 'mse', 'optimizer': 'adam', 'graph_mode': 'cutoff', 'cutoff': 0.7636767892444994, 'grm_norm': 'gcn', 'self_loops': True, 'use_snp_selection': False}. Best is trial 144 with value: 0.3002692130183666.
[I 2025-12-08 16:04:27,863] Trial 148 finished with value: 0.19674555466303673 and parameters: {'model_type': 'graphsage', 'hidden_dims': '[256, 128]', 'dropout': 0.5517247504341819, 'batch_norm': True, 'sage_aggr': 'max', 'sage_normalize': False, 'sage_project': False, 'lr': 1.0254827554475251e-05, 'weight_decay': 0.0002452379422154559, 'epochs': 45, 'loss': 'mse', 'optimizer': 'adam', 'graph_mode': 'cutoff', 'cutoff': 0.26532153423843646, 'grm_norm': 'gcn', 'self_loops': True, 'use_snp_selection': False}. Best is trial 144 with value: 0.3002692130183666.
[I 2025-12-08 16:05:03,171] Trial 149 finished with value: 0.2876313669579572 and parameters: {'model_type': 'graphsage', 'hidden_dims': '[256, 128]', 'dropout': 0.5804258633217338, 'batch_norm': True, 'sage_aggr': 'max', 'sage_normalize': False, 'sage_project': False, 'lr': 1.7668526149140703e-05, 'weight_decay': 4.371395834225111e-05, 'epochs': 110, 'loss': 'mse', 'optimizer': 'adam', 'graph_mode': 'cutoff', 'cutoff': 0.8090562017377653, 'grm_norm': 'gcn', 'self_loops': True, 'use_snp_selection': False}. Best is trial 144 with value: 0.3002692130183666.
[I 2025-12-08 16:06:22,061] Trial 0 finished with value: 0.2590230162208177 and parameters: {'model_type': 'graphsage', 'hidden_dims': '[128, 64]', 'dropout': 0.199031432379812, 'batch_norm': True, 'sage_aggr': 'max', 'sage_normalize': True, 'sage_project': False, 'lr': 0.00034401453323286885, 'weight_decay': 0.00017802616915745114, 'epochs': 230, 'loss': 'mse', 'optimizer': 'adam', 'graph_mode': 'knn', 'knn_k': 6, 'weighted_edges': True, 'symmetrize_mode': 'mutual', 'self_loops': True, 'use_snp_selection': False}. Best is trial 0 with value: 0.2590230162208177.
[I 2025-12-08 16:08:07,382] Trial 1 finished with value: 0.28269492294993015 and parameters: {'model_type': 'graphsage', 'hidden_dims': '[512, 128]', 'dropout': 0.2503500283181017, 'batch_norm': False, 'sage_aggr': 'max', 'sage_normalize': False, 'sage_project': False, 'lr': 3.952233718592099e-05, 'weight_decay': 0.00026754769258252603, 'epochs': 149, 'loss': 'mse', 'optimizer': 'adam', 'graph_mode': 'knn', 'knn_k': 2, 'weighted_edges': False, 'symmetrize_mode': 'mutual', 'self_loops': True, 'use_snp_selection': True, 'num_snps': 49915}. Best is trial 1 with value: 0.28269492294993015.
[I 2025-12-08 16:09:26,900] Trial 2 finished with value: 0.2698606999040198 and parameters: {'model_type': 'graphsage', 'hidden_dims': '[512, 256]', 'dropout': 0.2785908793172681, 'batch_norm': False, 'sage_aggr': 'max', 'sage_normalize': False, 'sage_project': False, 'lr': 8.806039223165805e-05, 'weight_decay': 3.5153176302760294e-05, 'epochs': 147, 'loss': 'mae', 'optimizer': 'adam', 'graph_mode': 'cutoff', 'cutoff': 0.4922564006874869, 'grm_norm': 'gcn', 'self_loops': False, 'use_snp_selection': True, 'num_snps': 34340}. Best is trial 1 with value: 0.28269492294993015.
[I 2025-12-08 16:10:44,665] Trial 3 finished with value: 0.28068302208660045 and parameters: {'model_type': 'graphsage', 'hidden_dims': '[256, 128, 64]', 'dropout': 0.3475243154412272, 'batch_norm': True, 'sage_aggr': 'max', 'sage_normalize': False, 'sage_project': False, 'lr': 1.6006331996938085e-05, 'weight_decay': 7.213121225589906e-06, 'epochs': 283, 'loss': 'mse', 'optimizer': 'adam', 'graph_mode': 'cutoff', 'cutoff': 0.5942334791449215, 'grm_norm': 'none', 'self_loops': True, 'use_snp_selection': False}. Best is trial 1 with value: 0.28269492294993015.
