[I 2025-12-09 10:28:49,126] Trial 81 finished with value: 0.2915930340570666 and parameters: {'model_type': 'graphsage', 'hidden_dims': '[256, 128]', 'dropout': 0.4594548866585218, 'batch_norm': False, 'sage_aggr': 'mean', 'sage_normalize': True, 'sage_project': False, 'lr': 0.0038621018060795557, 'weight_decay': 3.138553723744163e-05, 'epochs': 304, 'loss': 'mse', 'optimizer': 'adam', 'graph_mode': 'cutoff', 'cutoff': 0.7615994559803884, 'grm_norm': 'gcn', 'self_loops': True, 'use_snp_selection': True, 'num_snps': 46333}. Best is trial 67 with value: 0.3096185571869391.
[I 2025-12-09 10:30:20,812] Trial 82 finished with value: 0.2980635776879181 and parameters: {'model_type': 'graphsage', 'hidden_dims': '[256, 128]', 'dropout': 0.4949356622121327, 'batch_norm': False, 'sage_aggr': 'mean', 'sage_normalize': True, 'sage_project': False, 'lr': 0.002242040455459643, 'weight_decay': 6.014058998534505e-05, 'epochs': 332, 'loss': 'mse', 'optimizer': 'adam', 'graph_mode': 'cutoff', 'cutoff': 0.6121595412468166, 'grm_norm': 'gcn', 'self_loops': True, 'use_snp_selection': True, 'num_snps': 41629}. Best is trial 67 with value: 0.3096185571869391.
[I 2025-12-09 10:32:08,924] Trial 83 finished with value: 0.3035479775161754 and parameters: {'model_type': 'graphsage', 'hidden_dims': '[256, 128]', 'dropout': 0.4302561221048445, 'batch_norm': False, 'sage_aggr': 'mean', 'sage_normalize': True, 'sage_project': False, 'lr': 0.0016549432859071325, 'weight_decay': 1.7689173991016947e-05, 'epochs': 342, 'loss': 'mse', 'optimizer': 'adam', 'graph_mode': 'cutoff', 'cutoff': 0.8155672375521753, 'grm_norm': 'gcn', 'self_loops': True, 'use_snp_selection': True, 'num_snps': 51222}. Best is trial 67 with value: 0.3096185571869391.
[I 2025-12-09 10:33:57,054] Trial 84 finished with value: 0.30475401544305053 and parameters: {'model_type': 'graphsage', 'hidden_dims': '[256, 128]', 'dropout': 0.42770775647518544, 'batch_norm': False, 'sage_aggr': 'mean', 'sage_normalize': True, 'sage_project': False, 'lr': 0.0016097864011667227, 'weight_decay': 1.1024995129777633e-05, 'epochs': 343, 'loss': 'mse', 'optimizer': 'adam', 'graph_mode': 'cutoff', 'cutoff': 0.8611192472306112, 'grm_norm': 'gcn', 'self_loops': True, 'use_snp_selection': True, 'num_snps': 51074}. Best is trial 67 with value: 0.3096185571869391.
[I 2025-12-09 10:35:42,250] Trial 85 finished with value: 0.3018910461083051 and parameters: {'model_type': 'graphsage', 'hidden_dims': '[256, 128]', 'dropout': 0.4292465360919696, 'batch_norm': False, 'sage_aggr': 'mean', 'sage_normalize': True, 'sage_project': False, 'lr': 0.0017221352617731464, 'weight_decay': 1.1561406986078539e-05, 'epochs': 341, 'loss': 'mse', 'optimizer': 'adam', 'graph_mode': 'cutoff', 'cutoff': 0.817218473783001, 'grm_norm': 'gcn', 'self_loops': True, 'use_snp_selection': True, 'num_snps': 50185}. Best is trial 67 with value: 0.3096185571869391.
[I 2025-12-09 10:37:35,346] Trial 86 finished with value: 0.30104146647177 and parameters: {'model_type': 'graphsage', 'hidden_dims': '[256, 128]', 'dropout': 0.4213983424802385, 'batch_norm': False, 'sage_aggr': 'mean', 'sage_normalize': True, 'sage_project': False, 'lr': 0.0011827516160493217, 'weight_decay': 1.7121673094495567e-05, 'epochs': 345, 'loss': 'mse', 'optimizer': 'adam', 'graph_mode': 'cutoff', 'cutoff': 0.8653309695831699, 'grm_norm': 'gcn', 'self_loops': True, 'use_snp_selection': True, 'num_snps': 52696}. Best is trial 67 with value: 0.3096185571869391.
[I 2025-12-09 10:39:18,543] Trial 87 finished with value: 0.30290157304444504 and parameters: {'model_type': 'graphsage', 'hidden_dims': '[256, 128]', 'dropout': 0.36960117094076, 'batch_norm': False, 'sage_aggr': 'mean', 'sage_normalize': True, 'sage_project': False, 'lr': 0.0014699570449334626, 'weight_decay': 6.027425168762548e-06, 'epochs': 330, 'loss': 'mse', 'optimizer': 'adam', 'graph_mode': 'cutoff', 'cutoff': 0.8666490424303418, 'grm_norm': 'gcn', 'self_loops': True, 'use_snp_selection': True, 'num_snps': 50761}. Best is trial 67 with value: 0.3096185571869391.
[I 2025-12-09 10:42:08,833] Trial 88 finished with value: 0.3078711514870768 and parameters: {'model_type': 'graphsage', 'hidden_dims': '[512, 256]', 'dropout': 0.3887604031878434, 'batch_norm': False, 'sage_aggr': 'max', 'sage_normalize': True, 'sage_project': False, 'lr': 0.0009378594601906882, 'weight_decay': 1.0062417831531177e-05, 'epochs': 321, 'loss': 'mse', 'optimizer': 'adam', 'graph_mode': 'cutoff', 'cutoff': 0.8359819447811359, 'grm_norm': 'gcn', 'self_loops': True, 'use_snp_selection': True, 'num_snps': 56187}. Best is trial 67 with value: 0.3096185571869391.
[I 2025-12-09 10:44:01,972] Trial 89 finished with value: 0.3072528100445242 and parameters: {'model_type': 'graphsage', 'hidden_dims': '[256, 128]', 'dropout': 0.39290072918918806, 'batch_norm': False, 'sage_aggr': 'mean', 'sage_normalize': True, 'sage_project': False, 'lr': 0.0010871336613573785, 'weight_decay': 1.0352964762516956e-05, 'epochs': 319, 'loss': 'mse', 'optimizer': 'adam', 'graph_mode': 'cutoff', 'cutoff': 0.8353816608045889, 'grm_norm': 'gcn', 'self_loops': True, 'use_snp_selection': True, 'num_snps': 56866}. Best is trial 67 with value: 0.3096185571869391.
[I 2025-12-09 10:46:59,359] Trial 90 finished with value: 0.302249023953153 and parameters: {'model_type': 'graphsage', 'hidden_dims': '[512, 64]', 'dropout': 0.38986224810368825, 'batch_norm': False, 'sage_aggr': 'max', 'sage_normalize': True, 'sage_project': False, 'lr': 0.00107241884840121, 'weight_decay': 9.580493958905822e-06, 'epochs': 319, 'loss': 'mse', 'optimizer': 'adam', 'graph_mode': 'cutoff', 'cutoff': 0.8451748291542871, 'grm_norm': 'gcn', 'self_loops': True, 'use_snp_selection': True, 'num_snps': 56969}. Best is trial 67 with value: 0.3096185571869391.
[I 2025-12-09 10:48:59,509] Trial 91 finished with value: 0.30415789385739994 and parameters: {'model_type': 'graphsage', 'hidden_dims': '[256, 128]', 'dropout': 0.3944449447282603, 'batch_norm': False, 'sage_aggr': 'max', 'sage_normalize': True, 'sage_project': False, 'lr': 0.000907573383265391, 'weight_decay': 1.575642474339606e-05, 'epochs': 338, 'loss': 'mse', 'optimizer': 'adam', 'graph_mode': 'cutoff', 'cutoff': 0.8115517851953377, 'grm_norm': 'gcn', 'self_loops': True, 'use_snp_selection': True, 'num_snps': 56911}. Best is trial 67 with value: 0.3096185571869391.
[I 2025-12-09 10:51:02,667] Trial 92 finished with value: 0.30675234519618916 and parameters: {'model_type': 'graphsage', 'hidden_dims': '[256, 128]', 'dropout': 0.36718963731248333, 'batch_norm': False, 'sage_aggr': 'max', 'sage_normalize': True, 'sage_project': False, 'lr': 0.0008699997753944755, 'weight_decay': 1.3381906210379973e-05, 'epochs': 350, 'loss': 'mse', 'optimizer': 'adam', 'graph_mode': 'cutoff', 'cutoff': 0.8393239008112579, 'grm_norm': 'gcn', 'self_loops': True, 'use_snp_selection': True, 'num_snps': 56723}. Best is trial 67 with value: 0.3096185571869391.
[I 2025-12-09 10:53:02,570] Trial 93 finished with value: 0.301021654471874 and parameters: {'model_type': 'graphsage', 'hidden_dims': '[256, 128]', 'dropout': 0.3364782099623794, 'batch_norm': False, 'sage_aggr': 'max', 'sage_normalize': True, 'sage_project': False, 'lr': 0.0008787612081094991, 'weight_decay': 1.2987993776919283e-05, 'epochs': 349, 'loss': 'mse', 'optimizer': 'adam', 'graph_mode': 'cutoff', 'cutoff': 0.8317945901192931, 'grm_norm': 'gcn', 'self_loops': True, 'use_snp_selection': True, 'num_snps': 56419}. Best is trial 67 with value: 0.3096185571869391.
[I 2025-12-09 10:55:06,041] Trial 94 finished with value: 0.29721762104308375 and parameters: {'model_type': 'graphsage', 'hidden_dims': '[256, 128]', 'dropout': 0.40189229632270934, 'batch_norm': False, 'sage_aggr': 'max', 'sage_normalize': True, 'sage_project': False, 'lr': 0.0005117799243805597, 'weight_decay': 6.222975970238647e-06, 'epochs': 335, 'loss': 'mse', 'optimizer': 'adam', 'graph_mode': 'cutoff', 'cutoff': 0.8792366804978339, 'grm_norm': 'gcn', 'self_loops': True, 'use_snp_selection': True, 'num_snps': 58473}. Best is trial 67 with value: 0.3096185571869391.
[I 2025-12-09 10:56:52,901] Trial 95 finished with value: 0.30583541094495337 and parameters: {'model_type': 'graphsage', 'hidden_dims': '[256, 128]', 'dropout': 0.36551199907786186, 'batch_norm': False, 'sage_aggr': 'max', 'sage_normalize': True, 'sage_project': False, 'lr': 0.001331353161948121, 'weight_decay': 9.510258366575866e-06, 'epochs': 323, 'loss': 'mse', 'optimizer': 'adam', 'graph_mode': 'cutoff', 'cutoff': 0.8497306139972793, 'grm_norm': 'gcn', 'self_loops': True, 'use_snp_selection': True, 'num_snps': 54632}. Best is trial 67 with value: 0.3096185571869391.
[I 2025-12-09 10:58:39,291] Trial 96 finished with value: 0.3100177676364182 and parameters: {'model_type': 'graphsage', 'hidden_dims': '[256, 128]', 'dropout': 0.36902087099525316, 'batch_norm': False, 'sage_aggr': 'max', 'sage_normalize': True, 'sage_project': False, 'lr': 0.0013398870684118915, 'weight_decay': 4.866458431172367e-06, 'epochs': 317, 'loss': 'mse', 'optimizer': 'adam', 'graph_mode': 'cutoff', 'cutoff': 0.8530770296376686, 'grm_norm': 'gcn', 'self_loops': True, 'use_snp_selection': True, 'num_snps': 53887}. Best is trial 96 with value: 0.3100177676364182.
[I 2025-12-09 11:00:24,850] Trial 97 finished with value: 0.3025288147171056 and parameters: {'model_type': 'graphsage', 'hidden_dims': '[256, 128]', 'dropout': 0.3652358849781433, 'batch_norm': False, 'sage_aggr': 'max', 'sage_normalize': True, 'sage_project': False, 'lr': 0.0012733527912548897, 'weight_decay': 4.6857823961580675e-06, 'epochs': 323, 'loss': 'mse', 'optimizer': 'adam', 'graph_mode': 'cutoff', 'cutoff': 0.8402759657614836, 'grm_norm': 'gcn', 'self_loops': True, 'use_snp_selection': True, 'num_snps': 54848}. Best is trial 96 with value: 0.3100177676364182.
[I 2025-12-09 11:03:30,872] Trial 98 finished with value: 0.3072558846165423 and parameters: {'model_type': 'graphsage', 'hidden_dims': '[512, 256]', 'dropout': 0.37796987873373644, 'batch_norm': False, 'sage_aggr': 'max', 'sage_normalize': True, 'sage_project': False, 'lr': 0.0007302533724022179, 'weight_decay': 3.066786033832636e-06, 'epochs': 317, 'loss': 'mse', 'optimizer': 'adam', 'graph_mode': 'cutoff', 'cutoff': 0.8812043435406673, 'grm_norm': 'none', 'self_loops': True, 'use_snp_selection': True, 'num_snps': 59755}. Best is trial 96 with value: 0.3100177676364182.
[I 2025-12-09 11:06:29,221] Trial 99 finished with value: 0.2996382791530673 and parameters: {'model_type': 'graphsage', 'hidden_dims': '[512, 256]', 'dropout': 0.3362730928448825, 'batch_norm': False, 'sage_aggr': 'max', 'sage_normalize': True, 'sage_project': False, 'lr': 0.0007954041347057106, 'weight_decay': 2.6692887989375437e-06, 'epochs': 315, 'loss': 'mse', 'optimizer': 'adam', 'graph_mode': 'cutoff', 'cutoff': 0.8943590691190112, 'grm_norm': 'none', 'self_loops': False, 'use_snp_selection': True, 'num_snps': 57602}. Best is trial 96 with value: 0.3100177676364182.
[I 2025-12-09 11:08:46,074] Trial 100 finished with value: 0.29033637140429264 and parameters: {'model_type': 'graphsage', 'hidden_dims': '[512, 256]', 'dropout': 0.3545645551091666, 'batch_norm': False, 'sage_aggr': 'max', 'sage_normalize': True, 'sage_project': False, 'lr': 0.0006230880124732428, 'weight_decay': 3.5735108860683027e-06, 'epochs': 292, 'loss': 'mse', 'optimizer': 'adam', 'graph_mode': 'cutoff', 'cutoff': 0.8745793862895889, 'grm_norm': 'none', 'self_loops': True, 'use_snp_selection': True, 'num_snps': 48026}. Best is trial 96 with value: 0.3100177676364182.
[I 2025-12-09 11:12:00,518] Trial 101 finished with value: 0.3044908638454029 and parameters: {'model_type': 'graphsage', 'hidden_dims': '[512, 256]', 'dropout': 0.37636554221275653, 'batch_norm': False, 'sage_aggr': 'max', 'sage_normalize': True, 'sage_project': False, 'lr': 0.0009569583051688707, 'weight_decay': 8.25606405272997e-06, 'epochs': 329, 'loss': 'mse', 'optimizer': 'adam', 'graph_mode': 'cutoff', 'cutoff': 0.8462465148563035, 'grm_norm': 'none', 'self_loops': True, 'use_snp_selection': True, 'num_snps': 59923}. Best is trial 96 with value: 0.3100177676364182.
[I 2025-12-09 11:14:45,903] Trial 102 finished with value: 0.30480837401432403 and parameters: {'model_type': 'graphsage', 'hidden_dims': '[512, 256]', 'dropout': 0.38713885378907975, 'batch_norm': False, 'sage_aggr': 'max', 'sage_normalize': True, 'sage_project': False, 'lr': 0.0007489244046254987, 'weight_decay': 1.659453336216788e-06, 'epochs': 315, 'loss': 'mse', 'optimizer': 'adam', 'graph_mode': 'cutoff', 'cutoff': 0.7926024397631342, 'grm_norm': 'none', 'self_loops': True, 'use_snp_selection': True, 'num_snps': 53661}. Best is trial 96 with value: 0.3100177676364182.
[I 2025-12-09 11:16:34,073] Trial 103 finished with value: 0.306657942070635 and parameters: {'model_type': 'graphsage', 'hidden_dims': '[256, 128]', 'dropout': 0.325920578597775, 'batch_norm': False, 'sage_aggr': 'max', 'sage_normalize': True, 'sage_project': False, 'lr': 0.001987965462324643, 'weight_decay': 6.506475855007494e-06, 'epochs': 321, 'loss': 'mse', 'optimizer': 'adam', 'graph_mode': 'cutoff', 'cutoff': 0.8976839783637435, 'grm_norm': 'gcn', 'self_loops': True, 'use_snp_selection': True, 'num_snps': 53308}. Best is trial 96 with value: 0.3100177676364182.
[I 2025-12-09 11:18:29,391] Trial 104 finished with value: 0.29824907137643714 and parameters: {'model_type': 'graphsage', 'hidden_dims': '[256, 128]', 'dropout': 0.32438908931699517, 'batch_norm': False, 'sage_aggr': 'max', 'sage_normalize': True, 'sage_project': False, 'lr': 0.0003787986349476382, 'weight_decay': 4.872048687898105e-06, 'epochs': 298, 'loss': 'mse', 'optimizer': 'adam', 'graph_mode': 'cutoff', 'cutoff': 0.8864953660243176, 'grm_norm': 'gcn', 'self_loops': True, 'use_snp_selection': True, 'num_snps': 59857}. Best is trial 96 with value: 0.3100177676364182.
[I 2025-12-09 11:21:25,352] Trial 105 finished with value: 0.30243688766404897 and parameters: {'model_type': 'graphsage', 'hidden_dims': '[512, 256]', 'dropout': 0.35445274325585197, 'batch_norm': False, 'sage_aggr': 'max', 'sage_normalize': True, 'sage_project': False, 'lr': 0.0013570118639512122, 'weight_decay': 3.072624374828787e-06, 'epochs': 323, 'loss': 'mse', 'optimizer': 'adam', 'graph_mode': 'cutoff', 'cutoff': 0.8979249840552377, 'grm_norm': 'gcn', 'self_loops': True, 'use_snp_selection': True, 'num_snps': 55656}. Best is trial 96 with value: 0.3100177676364182.
[I 2025-12-09 11:23:07,348] Trial 106 finished with value: 0.3010221855190829 and parameters: {'model_type': 'graphsage', 'hidden_dims': '[256, 128]', 'dropout': 0.29788080807555134, 'batch_norm': False, 'sage_aggr': 'max', 'sage_normalize': True, 'sage_project': False, 'lr': 0.001056048468635805, 'weight_decay': 9.238946634117087e-06, 'epochs': 309, 'loss': 'mse', 'optimizer': 'adam', 'graph_mode': 'cutoff', 'cutoff': 0.8542743036716544, 'grm_norm': 'none', 'self_loops': True, 'use_snp_selection': True, 'num_snps': 52293}. Best is trial 96 with value: 0.3100177676364182.
[I 2025-12-09 11:24:52,494] Trial 107 finished with value: 0.30922975483206927 and parameters: {'model_type': 'graphsage', 'hidden_dims': '[256, 128]', 'dropout': 0.37098465526632024, 'batch_norm': False, 'sage_aggr': 'max', 'sage_normalize': True, 'sage_project': False, 'lr': 0.0025075742542356744, 'weight_decay': 6.4909769390356225e-06, 'epochs': 284, 'loss': 'mse', 'optimizer': 'adam', 'graph_mode': 'cutoff', 'cutoff': 0.8329973910714116, 'grm_norm': 'gcn', 'self_loops': True, 'use_snp_selection': True, 'num_snps': 57956}. Best is trial 96 with value: 0.3100177676364182.
[I 2025-12-09 11:27:30,705] Trial 108 finished with value: 0.31056972888341744 and parameters: {'model_type': 'graphsage', 'hidden_dims': '[512, 256]', 'dropout': 0.342624188650911, 'batch_norm': False, 'sage_aggr': 'max', 'sage_normalize': True, 'sage_project': False, 'lr': 0.0027755912728402265, 'weight_decay': 6.196947549030758e-06, 'epochs': 277, 'loss': 'mse', 'optimizer': 'adam', 'graph_mode': 'cutoff', 'cutoff': 0.8281878728072245, 'grm_norm': 'cosine_then_gcn', 'self_loops': True, 'use_snp_selection': True, 'num_snps': 57849}. Best is trial 108 with value: 0.31056972888341744.
[I 2025-12-09 11:30:08,985] Trial 109 finished with value: 0.3065583358346807 and parameters: {'model_type': 'graphsage', 'hidden_dims': '[512, 256]', 'dropout': 0.34238157179946715, 'batch_norm': False, 'sage_aggr': 'max', 'sage_normalize': True, 'sage_project': False, 'lr': 0.002670371437099357, 'weight_decay': 5.994890716148621e-06, 'epochs': 277, 'loss': 'mse', 'optimizer': 'adam', 'graph_mode': 'cutoff', 'cutoff': 0.877030466287049, 'grm_norm': 'cosine_then_gcn', 'self_loops': True, 'use_snp_selection': True, 'num_snps': 57662}. Best is trial 108 with value: 0.31056972888341744.
[I 2025-12-09 11:32:29,340] Trial 110 finished with value: 0.30618543216696986 and parameters: {'model_type': 'graphsage', 'hidden_dims': '[512, 256]', 'dropout': 0.3220291295695967, 'batch_norm': False, 'sage_aggr': 'max', 'sage_normalize': True, 'sage_project': False, 'lr': 0.002754175690114829, 'weight_decay': 2.0069763157383863e-06, 'epochs': 242, 'loss': 'mse', 'optimizer': 'adam', 'graph_mode': 'cutoff', 'cutoff': 0.8295954590108867, 'grm_norm': 'cosine_then_gcn', 'self_loops': True, 'use_snp_selection': True, 'num_snps': 57254}. Best is trial 108 with value: 0.31056972888341744.
[I 2025-12-09 11:35:10,480] Trial 111 finished with value: 0.3115588534626376 and parameters: {'model_type': 'graphsage', 'hidden_dims': '[512, 256]', 'dropout': 0.3431550286091326, 'batch_norm': False, 'sage_aggr': 'max', 'sage_normalize': True, 'sage_project': False, 'lr': 0.002712207745914458, 'weight_decay': 9.598574704260586e-07, 'epochs': 280, 'loss': 'mse', 'optimizer': 'adam', 'graph_mode': 'cutoff', 'cutoff': 0.8301833030867315, 'grm_norm': 'cosine_then_gcn', 'self_loops': True, 'use_snp_selection': True, 'num_snps': 58125}. Best is trial 111 with value: 0.3115588534626376.
[I 2025-12-09 11:37:55,751] Trial 112 finished with value: 0.30851845340692613 and parameters: {'model_type': 'graphsage', 'hidden_dims': '[512, 256]', 'dropout': 0.34307841121083976, 'batch_norm': False, 'sage_aggr': 'max', 'sage_normalize': True, 'sage_project': False, 'lr': 0.0034998252825357012, 'weight_decay': 7.960327493886675e-07, 'epochs': 278, 'loss': 'mse', 'optimizer': 'adam', 'graph_mode': 'cutoff', 'cutoff': 0.8739042357264416, 'grm_norm': 'cosine_then_gcn', 'self_loops': True, 'use_snp_selection': True, 'num_snps': 59994}. Best is trial 111 with value: 0.3115588534626376.
[I 2025-12-09 11:40:44,319] Trial 113 finished with value: 0.30356926338334106 and parameters: {'model_type': 'graphsage', 'hidden_dims': '[512, 256]', 'dropout': 0.3754491565491361, 'batch_norm': False, 'sage_aggr': 'max', 'sage_normalize': True, 'sage_project': False, 'lr': 0.003697096947967607, 'weight_decay': 6.283914461419746e-07, 'epochs': 283, 'loss': 'mse', 'optimizer': 'adam', 'graph_mode': 'cutoff', 'cutoff': 0.8323984243350445, 'grm_norm': 'cosine_then_gcn', 'self_loops': True, 'use_snp_selection': True, 'num_snps': 59943}. Best is trial 111 with value: 0.3115588534626376.
[I 2025-12-09 11:43:22,263] Trial 114 finished with value: 0.3052458302627257 and parameters: {'model_type': 'graphsage', 'hidden_dims': '[512, 256]', 'dropout': 0.2874985741405646, 'batch_norm': False, 'sage_aggr': 'max', 'sage_normalize': True, 'sage_project': False, 'lr': 0.004201213545128437, 'weight_decay': 5.129656009722109e-07, 'epochs': 271, 'loss': 'mse', 'optimizer': 'adam', 'graph_mode': 'cutoff', 'cutoff': 0.8041727263209151, 'grm_norm': 'cosine_then_gcn', 'self_loops': True, 'use_snp_selection': True, 'num_snps': 58476}. Best is trial 111 with value: 0.3115588534626376.
[I 2025-12-09 11:45:57,458] Trial 115 finished with value: 0.29833230364920615 and parameters: {'model_type': 'graphsage', 'hidden_dims': '[512, 256]', 'dropout': 0.3061393153997417, 'batch_norm': False, 'sage_aggr': 'max', 'sage_normalize': True, 'sage_project': False, 'lr': 0.0019408426552293531, 'weight_decay': 1.2170697741333349e-06, 'epochs': 285, 'loss': 'mse', 'optimizer': 'adam', 'graph_mode': 'cutoff', 'cutoff': 0.8584891719251265, 'grm_norm': 'cosine_then_gcn', 'self_loops': True, 'use_snp_selection': True, 'num_snps': 56299}. Best is trial 111 with value: 0.3115588534626376.
[I 2025-12-09 11:48:32,264] Trial 116 finished with value: 0.30011439267486956 and parameters: {'model_type': 'graphsage', 'hidden_dims': '[512, 256]', 'dropout': 0.34613221114434584, 'batch_norm': False, 'sage_aggr': 'max', 'sage_normalize': True, 'sage_project': False, 'lr': 0.0033437289389370564, 'weight_decay': 2.99542573913962e-07, 'epochs': 292, 'loss': 'mse', 'optimizer': 'adam', 'graph_mode': 'cutoff', 'cutoff': 0.8988510782924426, 'grm_norm': 'cosine_then_gcn', 'self_loops': True, 'use_snp_selection': True, 'num_snps': 55227}. Best is trial 111 with value: 0.3115588534626376.
[I 2025-12-09 11:50:59,656] Trial 117 finished with value: 0.29736091689173755 and parameters: {'model_type': 'graphsage', 'hidden_dims': '[512, 256]', 'dropout': 0.35984033314374386, 'batch_norm': False, 'sage_aggr': 'max', 'sage_normalize': True, 'sage_project': False, 'lr': 0.005385323852537607, 'weight_decay': 9.21735609815456e-07, 'epochs': 252, 'loss': 'mse', 'optimizer': 'adam', 'graph_mode': 'cutoff', 'cutoff': 0.7841930079690509, 'grm_norm': 'cosine_then_gcn', 'self_loops': True, 'use_snp_selection': True, 'num_snps': 58656}. Best is trial 111 with value: 0.3115588534626376.
