Running from this directory: /cluster/work/simennes/Project_thesis/Project_thesis
Name of job: sage_t
ID of job: 23696740
The job was run on these nodes: idun-06-04
[I 2025-12-08 10:16:35,359] Trial 0 finished with value: 0.2946167568031123 and parameters: {'model_type': 'graphsage', 'hidden_dims': '[128, 64]', 'dropout': 0.199031432379812, 'batch_norm': True, 'sage_aggr': 'max', 'sage_normalize': True, 'sage_project': False, 'lr': 0.00034401453323286885, 'weight_decay': 0.00017802616915745114, 'epochs': 230, 'loss': 'mse', 'optimizer': 'adam', 'graph_mode': 'knn', 'knn_k': 6, 'weighted_edges': True, 'symmetrize_mode': 'mutual', 'self_loops': True, 'use_snp_selection': False}. Best is trial 0 with value: 0.2946167568031123.
[I 2025-12-08 10:18:08,711] Trial 1 finished with value: 0.3483107919883586 and parameters: {'model_type': 'graphsage', 'hidden_dims': '[512, 128]', 'dropout': 0.2503500283181017, 'batch_norm': False, 'sage_aggr': 'max', 'sage_normalize': False, 'sage_project': False, 'lr': 3.952233718592099e-05, 'weight_decay': 0.00026754769258252603, 'epochs': 149, 'loss': 'mse', 'optimizer': 'adam', 'graph_mode': 'knn', 'knn_k': 2, 'weighted_edges': False, 'symmetrize_mode': 'mutual', 'self_loops': True, 'use_snp_selection': True, 'num_snps': 49915}. Best is trial 1 with value: 0.3483107919883586.
[I 2025-12-08 10:19:20,931] Trial 2 finished with value: 0.3495401147968137 and parameters: {'model_type': 'graphsage', 'hidden_dims': '[512, 256]', 'dropout': 0.2785908793172681, 'batch_norm': False, 'sage_aggr': 'max', 'sage_normalize': False, 'sage_project': False, 'lr': 8.806039223165805e-05, 'weight_decay': 3.5153176302760294e-05, 'epochs': 147, 'loss': 'mae', 'optimizer': 'adam', 'graph_mode': 'cutoff', 'cutoff': 0.4922564006874869, 'grm_norm': 'gcn', 'self_loops': False, 'use_snp_selection': True, 'num_snps': 34340}. Best is trial 2 with value: 0.3495401147968137.
[I 2025-12-08 10:20:46,786] Trial 3 finished with value: 0.3050765357783058 and parameters: {'model_type': 'graphsage', 'hidden_dims': '[256, 128, 64]', 'dropout': 0.3475243154412272, 'batch_norm': True, 'sage_aggr': 'max', 'sage_normalize': False, 'sage_project': False, 'lr': 1.6006331996938085e-05, 'weight_decay': 7.213121225589906e-06, 'epochs': 283, 'loss': 'mse', 'optimizer': 'adam', 'graph_mode': 'cutoff', 'cutoff': 0.5942334791449215, 'grm_norm': 'none', 'self_loops': True, 'use_snp_selection': False}. Best is trial 2 with value: 0.3495401147968137.
[I 2025-12-08 10:21:10,110] Trial 4 finished with value: 0.2900067133659635 and parameters: {'model_type': 'graphsage', 'hidden_dims': '[128, 64]', 'dropout': 0.3348926467202472, 'batch_norm': True, 'sage_aggr': 'max', 'sage_normalize': False, 'sage_project': False, 'lr': 0.0004238630400638802, 'weight_decay': 8.074086040046576e-07, 'epochs': 158, 'loss': 'mae', 'optimizer': 'adam', 'graph_mode': 'knn', 'knn_k': 1, 'weighted_edges': False, 'symmetrize_mode': 'mutual', 'self_loops': False, 'use_snp_selection': True, 'num_snps': 26850}. Best is trial 2 with value: 0.3495401147968137.
[I 2025-12-08 10:23:30,024] Trial 5 finished with value: 0.29976271033200674 and parameters: {'model_type': 'graphsage', 'hidden_dims': '[512, 64]', 'dropout': 0.14505336736221927, 'batch_norm': True, 'sage_aggr': 'mean', 'sage_normalize': True, 'sage_project': False, 'lr': 1.2962030165732234e-05, 'weight_decay': 1.326598071105465e-07, 'epochs': 180, 'loss': 'mse', 'optimizer': 'adam', 'graph_mode': 'knn', 'knn_k': 9, 'weighted_edges': True, 'symmetrize_mode': 'mutual', 'self_loops': False, 'use_snp_selection': False}. Best is trial 2 with value: 0.3495401147968137.
[I 2025-12-08 10:24:03,586] Trial 6 finished with value: 0.325476229830293 and parameters: {'model_type': 'graphsage', 'hidden_dims': '[256, 128, 64]', 'dropout': 0.10731743755162496, 'batch_norm': True, 'sage_aggr': 'mean', 'sage_normalize': False, 'sage_project': False, 'lr': 1.922990426933137e-05, 'weight_decay': 7.30001060446905e-05, 'epochs': 63, 'loss': 'mae', 'optimizer': 'adam', 'graph_mode': 'cutoff', 'cutoff': 0.7624978434202536, 'grm_norm': 'none', 'self_loops': True, 'use_snp_selection': True, 'num_snps': 50106}. Best is trial 2 with value: 0.3495401147968137.
[I 2025-12-08 10:26:04,782] Trial 7 finished with value: 0.3454725054420337 and parameters: {'model_type': 'graphsage', 'hidden_dims': '[512, 64]', 'dropout': 0.2585007811528941, 'batch_norm': True, 'sage_aggr': 'max', 'sage_normalize': True, 'sage_project': False, 'lr': 5.921425508303391e-05, 'weight_decay': 0.0004511561961144237, 'epochs': 182, 'loss': 'mae', 'optimizer': 'adam', 'graph_mode': 'knn', 'knn_k': 9, 'weighted_edges': True, 'symmetrize_mode': 'union', 'self_loops': False, 'use_snp_selection': True, 'num_snps': 23903}. Best is trial 2 with value: 0.3495401147968137.
[I 2025-12-08 10:26:30,764] Trial 8 finished with value: 0.2818625446440383 and parameters: {'model_type': 'graphsage', 'hidden_dims': '[512, 256]', 'dropout': 0.3061380386767003, 'batch_norm': False, 'sage_aggr': 'mean', 'sage_normalize': True, 'sage_project': False, 'lr': 0.000698401460570184, 'weight_decay': 2.965560055460244e-06, 'epochs': 289, 'loss': 'mae', 'optimizer': 'adam', 'graph_mode': 'knn', 'knn_k': 7, 'weighted_edges': False, 'symmetrize_mode': 'mutual', 'self_loops': True, 'use_snp_selection': True, 'num_snps': 4710}. Best is trial 2 with value: 0.3495401147968137.
[I 2025-12-08 10:31:43,379] Trial 9 finished with value: 0.32251700335594774 and parameters: {'model_type': 'graphsage', 'hidden_dims': '[512, 128]', 'dropout': 0.1733844071393634, 'batch_norm': False, 'sage_aggr': 'mean', 'sage_normalize': True, 'sage_project': False, 'lr': 0.0004269677918501597, 'weight_decay': 2.2439779626249696e-06, 'epochs': 319, 'loss': 'mse', 'optimizer': 'adam', 'graph_mode': 'cutoff', 'cutoff': 0.24117565767129295, 'grm_norm': 'cosine_then_gcn', 'self_loops': True, 'use_snp_selection': False}. Best is trial 2 with value: 0.3495401147968137.
[I 2025-12-08 10:32:39,123] Trial 10 finished with value: 0.0 and parameters: {'model_type': 'graphsage', 'hidden_dims': '[512, 256]', 'dropout': 0.46773351022590026, 'batch_norm': False, 'sage_aggr': 'max', 'sage_normalize': False, 'sage_project': False, 'lr': 0.006005004021681345, 'weight_decay': 3.194347401809951e-05, 'epochs': 76, 'loss': 'mae', 'optimizer': 'adam', 'graph_mode': 'cutoff', 'cutoff': 0.36538426242387784, 'grm_norm': 'gcn', 'self_loops': False, 'use_snp_selection': True, 'num_snps': 36724}. Best is trial 2 with value: 0.3495401147968137.
[I 2025-12-08 10:34:26,283] Trial 11 finished with value: 0.18950808582026918 and parameters: {'model_type': 'graphsage', 'hidden_dims': '[512, 128]', 'dropout': 0.4554228059341248, 'batch_norm': False, 'sage_aggr': 'max', 'sage_normalize': False, 'sage_project': False, 'lr': 8.040010782675617e-05, 'weight_decay': 0.0005735134390673267, 'epochs': 111, 'loss': 'mse', 'optimizer': 'adam', 'graph_mode': 'cutoff', 'cutoff': 0.48934453790731597, 'grm_norm': 'gcn', 'self_loops': False, 'use_snp_selection': True, 'num_snps': 57852}. Best is trial 2 with value: 0.3495401147968137.
[I 2025-12-08 10:35:10,217] Trial 12 finished with value: 0.3040187672326886 and parameters: {'model_type': 'graphsage', 'hidden_dims': '[256, 128]', 'dropout': 0.5957621421360685, 'batch_norm': False, 'sage_aggr': 'max', 'sage_normalize': False, 'sage_project': False, 'lr': 9.196950102765017e-05, 'weight_decay': 3.0096719169839557e-05, 'epochs': 138, 'loss': 'mse', 'optimizer': 'adam', 'graph_mode': 'cutoff', 'cutoff': 0.8553984526819809, 'grm_norm': 'cosine', 'self_loops': False, 'use_snp_selection': True, 'num_snps': 42962}. Best is trial 2 with value: 0.3495401147968137.
[I 2025-12-08 10:35:57,320] Trial 13 finished with value: 0.3329416406016511 and parameters: {'model_type': 'graphsage', 'hidden_dims': '[512, 128]', 'dropout': 0.24247713976209584, 'batch_norm': False, 'sage_aggr': 'max', 'sage_normalize': False, 'sage_project': False, 'lr': 4.1593692435256383e-05, 'weight_decay': 0.0001226706842486194, 'epochs': 210, 'loss': 'mae', 'optimizer': 'adam', 'graph_mode': 'knn', 'knn_k': 1, 'weighted_edges': False, 'symmetrize_mode': 'union', 'self_loops': True, 'use_snp_selection': True, 'num_snps': 17423}. Best is trial 2 with value: 0.3495401147968137.
[I 2025-12-08 10:37:14,978] Trial 14 finished with value: 0.2840231824705002 and parameters: {'model_type': 'graphsage', 'hidden_dims': '[512, 256]', 'dropout': 0.420004136612043, 'batch_norm': False, 'sage_aggr': 'max', 'sage_normalize': False, 'sage_project': False, 'lr': 0.00011914209383103212, 'weight_decay': 0.0009898880240806222, 'epochs': 120, 'loss': 'mse', 'optimizer': 'adam', 'graph_mode': 'knn', 'knn_k': 3, 'weighted_edges': False, 'symmetrize_mode': 'mutual', 'self_loops': True, 'use_snp_selection': True, 'num_snps': 44029}. Best is trial 2 with value: 0.3495401147968137.
[I 2025-12-08 10:38:49,905] Trial 15 finished with value: 0.06086475154300488 and parameters: {'model_type': 'graphsage', 'hidden_dims': '[256, 128]', 'dropout': 0.26548128812133703, 'batch_norm': False, 'sage_aggr': 'max', 'sage_normalize': False, 'sage_project': False, 'lr': 0.0011400506521267641, 'weight_decay': 3.2519139811105935e-05, 'epochs': 243, 'loss': 'mae', 'optimizer': 'adam', 'graph_mode': 'cutoff', 'cutoff': 0.6056210517679682, 'grm_norm': 'gcn', 'self_loops': False, 'use_snp_selection': True, 'num_snps': 56944}. Best is trial 2 with value: 0.3495401147968137.
[I 2025-12-08 10:39:55,676] Trial 16 finished with value: 0.1511416548824993 and parameters: {'model_type': 'graphsage', 'hidden_dims': '[512, 256]', 'dropout': 0.40427276878002094, 'batch_norm': False, 'sage_aggr': 'max', 'sage_normalize': False, 'sage_project': False, 'lr': 0.0001503378949109947, 'weight_decay': 0.00018360671125602785, 'epochs': 92, 'loss': 'mse', 'optimizer': 'adam', 'graph_mode': 'knn', 'knn_k': 4, 'weighted_edges': False, 'symmetrize_mode': 'union', 'self_loops': False, 'use_snp_selection': True, 'num_snps': 35551}. Best is trial 2 with value: 0.3495401147968137.
[I 2025-12-08 10:40:42,104] Trial 17 finished with value: 0.25478222282494634 and parameters: {'model_type': 'graphsage', 'hidden_dims': '[512, 128]', 'dropout': 0.22021716819602044, 'batch_norm': False, 'sage_aggr': 'max', 'sage_normalize': False, 'sage_project': False, 'lr': 3.851579445299815e-05, 'weight_decay': 1.3591103086412825e-05, 'epochs': 43, 'loss': 'mae', 'optimizer': 'adam', 'graph_mode': 'cutoff', 'cutoff': 0.42979538969295905, 'grm_norm': 'cosine', 'self_loops': True, 'use_snp_selection': True, 'num_snps': 47269}. Best is trial 2 with value: 0.3495401147968137.
[I 2025-12-08 10:42:04,056] Trial 18 finished with value: -0.017010212383401682 and parameters: {'model_type': 'graphsage', 'hidden_dims': '[512, 256]', 'dropout': 0.30423031232763464, 'batch_norm': False, 'sage_aggr': 'mean', 'sage_normalize': False, 'sage_project': False, 'lr': 0.0017005019955241608, 'weight_decay': 7.043087334044379e-05, 'epochs': 141, 'loss': 'mse', 'optimizer': 'adam', 'graph_mode': 'knn', 'knn_k': 3, 'weighted_edges': False, 'symmetrize_mode': 'mutual', 'self_loops': False, 'use_snp_selection': False}. Best is trial 2 with value: 0.3495401147968137.
[I 2025-12-08 10:42:35,359] Trial 19 finished with value: 0.32816713964723776 and parameters: {'model_type': 'graphsage', 'hidden_dims': '[512, 128]', 'dropout': 0.5260554932000863, 'batch_norm': False, 'sage_aggr': 'max', 'sage_normalize': False, 'sage_project': False, 'lr': 0.00019416945668393836, 'weight_decay': 0.0002605485534678075, 'epochs': 165, 'loss': 'mae', 'optimizer': 'adam', 'graph_mode': 'cutoff', 'cutoff': 0.7066450145239649, 'grm_norm': 'cosine_then_gcn', 'self_loops': True, 'use_snp_selection': True, 'num_snps': 14932}. Best is trial 2 with value: 0.3495401147968137.
[I 2025-12-08 10:45:48,545] Trial 20 finished with value: 0.31408255369578886 and parameters: {'model_type': 'graphsage', 'hidden_dims': '[512, 64]', 'dropout': 0.3877970947555355, 'batch_norm': False, 'sage_aggr': 'max', 'sage_normalize': False, 'sage_project': False, 'lr': 2.9052813040219113e-05, 'weight_decay': 1.0647055267395334e-05, 'epochs': 213, 'loss': 'mae', 'optimizer': 'adam', 'graph_mode': 'cutoff', 'cutoff': 0.26061856443040465, 'grm_norm': 'gcn', 'self_loops': True, 'use_snp_selection': True, 'num_snps': 34219}. Best is trial 2 with value: 0.3495401147968137.
[I 2025-12-08 10:47:57,445] Trial 21 finished with value: 0.3286806026723112 and parameters: {'model_type': 'graphsage', 'hidden_dims': '[512, 64]', 'dropout': 0.27222756397839276, 'batch_norm': True, 'sage_aggr': 'max', 'sage_normalize': True, 'sage_project': False, 'lr': 4.310983628278672e-05, 'weight_decay': 0.0004027632418532001, 'epochs': 189, 'loss': 'mae', 'optimizer': 'adam', 'graph_mode': 'knn', 'knn_k': 10, 'weighted_edges': True, 'symmetrize_mode': 'union', 'self_loops': False, 'use_snp_selection': True, 'num_snps': 24000}. Best is trial 2 with value: 0.3495401147968137.
[I 2025-12-08 10:49:04,696] Trial 22 finished with value: 0.34914922928440684 and parameters: {'model_type': 'graphsage', 'hidden_dims': '[512, 64]', 'dropout': 0.29012241409306105, 'batch_norm': True, 'sage_aggr': 'max', 'sage_normalize': True, 'sage_project': False, 'lr': 8.275181061341256e-05, 'weight_decay': 0.0008673157083117881, 'epochs': 134, 'loss': 'mae', 'optimizer': 'adam', 'graph_mode': 'knn', 'knn_k': 8, 'weighted_edges': True, 'symmetrize_mode': 'union', 'self_loops': False, 'use_snp_selection': True, 'num_snps': 20615}. Best is trial 2 with value: 0.3495401147968137.
[I 2025-12-08 10:49:43,779] Trial 23 finished with value: 0.3438633090095916 and parameters: {'model_type': 'graphsage', 'hidden_dims': '[512, 64]', 'dropout': 0.30382253189750213, 'batch_norm': True, 'sage_aggr': 'max', 'sage_normalize': True, 'sage_project': False, 'lr': 0.00018625283964180626, 'weight_decay': 9.525888907301635e-05, 'epochs': 116, 'loss': 'mae', 'optimizer': 'adam', 'graph_mode': 'knn', 'knn_k': 7, 'weighted_edges': True, 'symmetrize_mode': 'union', 'self_loops': False, 'use_snp_selection': True, 'num_snps': 14885}. Best is trial 2 with value: 0.3495401147968137.
[I 2025-12-08 10:50:00,633] Trial 24 finished with value: 0.2998959342762361 and parameters: {'model_type': 'graphsage', 'hidden_dims': '[256, 128]', 'dropout': 0.1838330219330077, 'batch_norm': True, 'sage_aggr': 'max', 'sage_normalize': True, 'sage_project': False, 'lr': 2.3723701443857073e-05, 'weight_decay': 0.0007545719414322718, 'epochs': 150, 'loss': 'mae', 'optimizer': 'adam', 'graph_mode': 'knn', 'knn_k': 4, 'weighted_edges': True, 'symmetrize_mode': 'union', 'self_loops': False, 'use_snp_selection': True, 'num_snps': 5494}. Best is trial 2 with value: 0.3495401147968137.
[I 2025-12-08 10:50:52,393] Trial 25 finished with value: 0.29943149726647694 and parameters: {'model_type': 'graphsage', 'hidden_dims': '[256, 128, 64]', 'dropout': 0.34603511850629654, 'batch_norm': False, 'sage_aggr': 'max', 'sage_normalize': True, 'sage_project': False, 'lr': 6.408373032510073e-05, 'weight_decay': 0.0002827631667360426, 'epochs': 110, 'loss': 'mae', 'optimizer': 'adam', 'graph_mode': 'knn', 'knn_k': 8, 'weighted_edges': False, 'symmetrize_mode': 'mutual', 'self_loops': False, 'use_snp_selection': True, 'num_snps': 29576}. Best is trial 2 with value: 0.3495401147968137.
[I 2025-12-08 10:51:31,140] Trial 26 finished with value: 0.31973740179498933 and parameters: {'model_type': 'graphsage', 'hidden_dims': '[128, 64]', 'dropout': 0.22641025100809156, 'batch_norm': True, 'sage_aggr': 'mean', 'sage_normalize': True, 'sage_project': False, 'lr': 1.1156436169770028e-05, 'weight_decay': 5.0634343862851865e-05, 'epochs': 80, 'loss': 'mse', 'optimizer': 'adam', 'graph_mode': 'knn', 'knn_k': 5, 'weighted_edges': True, 'symmetrize_mode': 'union', 'self_loops': False, 'use_snp_selection': False}. Best is trial 2 with value: 0.3495401147968137.
[I 2025-12-08 10:52:08,533] Trial 27 finished with value: 0.3305365167489699 and parameters: {'model_type': 'graphsage', 'hidden_dims': '[512, 128]', 'dropout': 0.14287477417026567, 'batch_norm': False, 'sage_aggr': 'max', 'sage_normalize': False, 'sage_project': False, 'lr': 0.00027306925826179885, 'weight_decay': 0.0001625397114065864, 'epochs': 133, 'loss': 'mae', 'optimizer': 'adam', 'graph_mode': 'knn', 'knn_k': 2, 'weighted_edges': True, 'symmetrize_mode': 'union', 'self_loops': False, 'use_snp_selection': True, 'num_snps': 19282}. Best is trial 2 with value: 0.3495401147968137.
[I 2025-12-08 10:54:49,000] Trial 28 finished with value: 0.3212374507666568 and parameters: {'model_type': 'graphsage', 'hidden_dims': '[512, 256]', 'dropout': 0.28739656223037463, 'batch_norm': True, 'sage_aggr': 'max', 'sage_normalize': True, 'sage_project': False, 'lr': 0.00010674582853595856, 'weight_decay': 0.0009340306411883499, 'epochs': 163, 'loss': 'mse', 'optimizer': 'adam', 'graph_mode': 'cutoff', 'cutoff': 0.3706381921151087, 'grm_norm': 'gcn', 'self_loops': True, 'use_snp_selection': True, 'num_snps': 53180}. Best is trial 2 with value: 0.3495401147968137.
[I 2025-12-08 10:56:17,933] Trial 29 finished with value: 0.3131192742304086 and parameters: {'model_type': 'graphsage', 'hidden_dims': '[128, 64]', 'dropout': 0.37835799187825836, 'batch_norm': True, 'sage_aggr': 'max', 'sage_normalize': True, 'sage_project': False, 'lr': 0.0002557919037138032, 'weight_decay': 0.00022629844834044284, 'epochs': 250, 'loss': 'mse', 'optimizer': 'adam', 'graph_mode': 'knn', 'knn_k': 6, 'weighted_edges': False, 'symmetrize_mode': 'mutual', 'self_loops': True, 'use_snp_selection': False}. Best is trial 2 with value: 0.3495401147968137.
[I 2025-12-08 11:00:16,566] Trial 30 finished with value: 0.3204554900421007 and parameters: {'model_type': 'graphsage', 'hidden_dims': '[512, 64]', 'dropout': 0.23040811280045892, 'batch_norm': False, 'sage_aggr': 'max', 'sage_normalize': False, 'sage_project': False, 'lr': 5.7967765725941315e-05, 'weight_decay': 2.4102374431802537e-05, 'epochs': 205, 'loss': 'mae', 'optimizer': 'adam', 'graph_mode': 'knn', 'knn_k': 8, 'weighted_edges': False, 'symmetrize_mode': 'union', 'self_loops': False, 'use_snp_selection': True, 'num_snps': 40429}. Best is trial 2 with value: 0.3495401147968137.
[I 2025-12-08 11:02:20,693] Trial 31 finished with value: 0.33828025023321306 and parameters: {'model_type': 'graphsage', 'hidden_dims': '[512, 64]', 'dropout': 0.2580603643599642, 'batch_norm': True, 'sage_aggr': 'max', 'sage_normalize': True, 'sage_project': False, 'lr': 6.225957544125461e-05, 'weight_decay': 0.00042163716095955904, 'epochs': 177, 'loss': 'mae', 'optimizer': 'adam', 'graph_mode': 'knn', 'knn_k': 10, 'weighted_edges': True, 'symmetrize_mode': 'union', 'self_loops': False, 'use_snp_selection': True, 'num_snps': 23527}. Best is trial 2 with value: 0.3495401147968137.
[I 2025-12-08 11:04:23,820] Trial 32 finished with value: 0.3206919535543186 and parameters: {'model_type': 'graphsage', 'hidden_dims': '[512, 64]', 'dropout': 0.32716431218893355, 'batch_norm': True, 'sage_aggr': 'max', 'sage_normalize': True, 'sage_project': False, 'lr': 1.9471966246858262e-05, 'weight_decay': 0.0004366900237559251, 'epochs': 226, 'loss': 'mae', 'optimizer': 'adam', 'graph_mode': 'knn', 'knn_k': 9, 'weighted_edges': True, 'symmetrize_mode': 'union', 'self_loops': False, 'use_snp_selection': True, 'num_snps': 21126}. Best is trial 2 with value: 0.3495401147968137.
[I 2025-12-08 11:05:13,163] Trial 33 finished with value: 0.33844307838394666 and parameters: {'model_type': 'graphsage', 'hidden_dims': '[512, 64]', 'dropout': 0.20247205023086462, 'batch_norm': True, 'sage_aggr': 'max', 'sage_normalize': True, 'sage_project': False, 'lr': 3.184617484059095e-05, 'weight_decay': 0.00012464453464415567, 'epochs': 189, 'loss': 'mae', 'optimizer': 'adam', 'graph_mode': 'knn', 'knn_k': 8, 'weighted_edges': True, 'symmetrize_mode': 'union', 'self_loops': False, 'use_snp_selection': True, 'num_snps': 11752}. Best is trial 2 with value: 0.3495401147968137.
[I 2025-12-08 11:08:31,673] Trial 34 finished with value: 0.3395709296932822 and parameters: {'model_type': 'graphsage', 'hidden_dims': '[512, 64]', 'dropout': 0.3286983403699468, 'batch_norm': True, 'sage_aggr': 'max', 'sage_normalize': True, 'sage_project': False, 'lr': 0.00013414574798992424, 'weight_decay': 0.0005344653887197798, 'epochs': 172, 'loss': 'mae', 'optimizer': 'adam', 'graph_mode': 'knn', 'knn_k': 9, 'weighted_edges': True, 'symmetrize_mode': 'union', 'self_loops': False, 'use_snp_selection': False}. Best is trial 2 with value: 0.3495401147968137.
[I 2025-12-08 11:09:31,101] Trial 35 finished with value: 0.22315153002520388 and parameters: {'model_type': 'graphsage', 'hidden_dims': '[256, 128, 64]', 'dropout': 0.36026249312408914, 'batch_norm': True, 'sage_aggr': 'max', 'sage_normalize': True, 'sage_project': False, 'lr': 5.401634522609349e-05, 'weight_decay': 3.9727242693927893e-07, 'epochs': 148, 'loss': 'mae', 'optimizer': 'adam', 'graph_mode': 'knn', 'knn_k': 7, 'weighted_edges': True, 'symmetrize_mode': 'mutual', 'self_loops': False, 'use_snp_selection': True, 'num_snps': 31098}. Best is trial 2 with value: 0.3495401147968137.
[I 2025-12-08 11:10:12,030] Trial 36 finished with value: 0.3249519116284712 and parameters: {'model_type': 'graphsage', 'hidden_dims': '[128, 64]', 'dropout': 0.16558650264644845, 'batch_norm': True, 'sage_aggr': 'mean', 'sage_normalize': False, 'sage_project': False, 'lr': 0.0004175374636736739, 'weight_decay': 6.355820312909756e-06, 'epochs': 91, 'loss': 'mse', 'optimizer': 'adam', 'graph_mode': 'knn', 'knn_k': 5, 'weighted_edges': True, 'symmetrize_mode': 'union', 'self_loops': True, 'use_snp_selection': True, 'num_snps': 26275}. Best is trial 2 with value: 0.3495401147968137.
