[I 2025-12-09 13:20:27,705] Trial 43 finished with value: 0.2890710679146552 and parameters: {'model_type': 'graphsage', 'hidden_dims': '[256, 128, 64]', 'dropout': 0.5144833002028127, 'batch_norm': True, 'sage_aggr': 'mean', 'sage_normalize': False, 'sage_project': False, 'lr': 0.004151413352921355, 'weight_decay': 2.9797026428475097e-05, 'epochs': 69, 'loss': 'mae', 'optimizer': 'adam', 'graph_mode': 'cutoff', 'cutoff': 0.8589813291516821, 'grm_norm': 'none', 'self_loops': True, 'use_snp_selection': True, 'num_snps': 51387}. Best is trial 42 with value: 0.2969538400699926.
[I 2025-12-09 13:21:19,867] Trial 44 finished with value: 0.2855938788040044 and parameters: {'model_type': 'graphsage', 'hidden_dims': '[256, 128, 64]', 'dropout': 0.572644518045183, 'batch_norm': True, 'sage_aggr': 'mean', 'sage_normalize': False, 'sage_project': False, 'lr': 0.006945753366728114, 'weight_decay': 0.0003568789999256952, 'epochs': 60, 'loss': 'mae', 'optimizer': 'adam', 'graph_mode': 'cutoff', 'cutoff': 0.726129614182635, 'grm_norm': 'none', 'self_loops': True, 'use_snp_selection': True, 'num_snps': 47951}. Best is trial 42 with value: 0.2969538400699926.
[I 2025-12-09 13:22:23,553] Trial 45 finished with value: 0.27641847289006993 and parameters: {'model_type': 'graphsage', 'hidden_dims': '[256, 128, 64]', 'dropout': 0.4960616621223376, 'batch_norm': True, 'sage_aggr': 'mean', 'sage_normalize': True, 'sage_project': False, 'lr': 0.0043415040194988595, 'weight_decay': 7.832071120708438e-05, 'epochs': 84, 'loss': 'mae', 'optimizer': 'adam', 'graph_mode': 'cutoff', 'cutoff': 0.5376104458342941, 'grm_norm': 'cosine_then_gcn', 'self_loops': True, 'use_snp_selection': True, 'num_snps': 52451}. Best is trial 42 with value: 0.2969538400699926.
[I 2025-12-09 13:25:13,991] Trial 46 finished with value: 0.01001611362465334 and parameters: {'model_type': 'graphsage', 'hidden_dims': '[512, 256]', 'dropout': 0.30997961847901095, 'batch_norm': False, 'sage_aggr': 'max', 'sage_normalize': False, 'sage_project': False, 'lr': 0.00248327110298404, 'weight_decay': 3.9741874306452785e-06, 'epochs': 336, 'loss': 'mse', 'optimizer': 'adam', 'graph_mode': 'cutoff', 'cutoff': 0.7751687291647349, 'grm_norm': 'none', 'self_loops': False, 'use_snp_selection': True, 'num_snps': 55170}. Best is trial 42 with value: 0.2969538400699926.
[I 2025-12-09 13:25:56,679] Trial 47 finished with value: 0.2802800792216685 and parameters: {'model_type': 'graphsage', 'hidden_dims': '[256, 128]', 'dropout': 0.5399866941832159, 'batch_norm': True, 'sage_aggr': 'mean', 'sage_normalize': False, 'sage_project': False, 'lr': 0.0016492018499619531, 'weight_decay': 8.684250147814228e-06, 'epochs': 107, 'loss': 'mae', 'optimizer': 'adam', 'graph_mode': 'cutoff', 'cutoff': 0.41216000764712424, 'grm_norm': 'none', 'self_loops': True, 'use_snp_selection': True, 'num_snps': 20484}. Best is trial 42 with value: 0.2969538400699926.
[I 2025-12-09 13:26:29,267] Trial 48 finished with value: 0.2744699309288019 and parameters: {'model_type': 'graphsage', 'hidden_dims': '[512, 128]', 'dropout': 0.44657786986504583, 'batch_norm': True, 'sage_aggr': 'mean', 'sage_normalize': False, 'sage_project': False, 'lr': 0.00994049638707738, 'weight_decay': 1.602320776548737e-05, 'epochs': 52, 'loss': 'mae', 'optimizer': 'adam', 'graph_mode': 'knn', 'knn_k': 7, 'weighted_edges': False, 'symmetrize_mode': 'mutual', 'self_loops': True, 'use_snp_selection': True, 'num_snps': 6546}. Best is trial 42 with value: 0.2969538400699926.
[I 2025-12-09 13:27:50,221] Trial 49 finished with value: 0.26764221195199056 and parameters: {'model_type': 'graphsage', 'hidden_dims': '[256, 128, 64]', 'dropout': 0.4203027565804177, 'batch_norm': True, 'sage_aggr': 'mean', 'sage_normalize': True, 'sage_project': False, 'lr': 0.000550106433089168, 'weight_decay': 3.059166308687696e-05, 'epochs': 137, 'loss': 'mae', 'optimizer': 'adam', 'graph_mode': 'cutoff', 'cutoff': 0.8800929069808717, 'grm_norm': 'cosine', 'self_loops': True, 'use_snp_selection': True, 'num_snps': 59607}. Best is trial 42 with value: 0.2969538400699926.
[I 2025-12-09 13:28:46,110] Trial 50 finished with value: 0.283131481403304 and parameters: {'model_type': 'graphsage', 'hidden_dims': '[512, 64]', 'dropout': 0.47262063838968993, 'batch_norm': True, 'sage_aggr': 'mean', 'sage_normalize': False, 'sage_project': False, 'lr': 0.00025038641052050036, 'weight_decay': 2.1096755432524243e-05, 'epochs': 93, 'loss': 'mae', 'optimizer': 'adam', 'graph_mode': 'cutoff', 'cutoff': 0.8204024082367135, 'grm_norm': 'none', 'self_loops': True, 'use_snp_selection': True, 'num_snps': 31557}. Best is trial 42 with value: 0.2969538400699926.
[I 2025-12-09 13:29:41,501] Trial 51 finished with value: 0.29230932647996954 and parameters: {'model_type': 'graphsage', 'hidden_dims': '[256, 128, 64]', 'dropout': 0.5193676039764554, 'batch_norm': True, 'sage_aggr': 'mean', 'sage_normalize': False, 'sage_project': False, 'lr': 0.004229729721872761, 'weight_decay': 3.1609288161794856e-05, 'epochs': 64, 'loss': 'mae', 'optimizer': 'adam', 'graph_mode': 'cutoff', 'cutoff': 0.8604456105168008, 'grm_norm': 'none', 'self_loops': True, 'use_snp_selection': True, 'num_snps': 51338}. Best is trial 42 with value: 0.2969538400699926.
[I 2025-12-09 13:30:38,139] Trial 52 finished with value: 0.2922396626556453 and parameters: {'model_type': 'graphsage', 'hidden_dims': '[256, 128, 64]', 'dropout': 0.5249173339045309, 'batch_norm': True, 'sage_aggr': 'mean', 'sage_normalize': False, 'sage_project': False, 'lr': 0.004916010607454771, 'weight_decay': 4.690931011402981e-05, 'epochs': 74, 'loss': 'mae', 'optimizer': 'adam', 'graph_mode': 'cutoff', 'cutoff': 0.8616407284596121, 'grm_norm': 'none', 'self_loops': True, 'use_snp_selection': True, 'num_snps': 50124}. Best is trial 42 with value: 0.2969538400699926.
[I 2025-12-09 13:31:38,941] Trial 53 finished with value: 0.2964898939777809 and parameters: {'model_type': 'graphsage', 'hidden_dims': '[256, 128, 64]', 'dropout': 0.5309609755523094, 'batch_norm': True, 'sage_aggr': 'mean', 'sage_normalize': False, 'sage_project': False, 'lr': 0.006959992366434876, 'weight_decay': 5.032403025835566e-05, 'epochs': 74, 'loss': 'mae', 'optimizer': 'adam', 'graph_mode': 'cutoff', 'cutoff': 0.8746734207775516, 'grm_norm': 'none', 'self_loops': True, 'use_snp_selection': True, 'num_snps': 56802}. Best is trial 42 with value: 0.2969538400699926.
[I 2025-12-09 13:32:31,499] Trial 54 finished with value: 0.294474246024755 and parameters: {'model_type': 'graphsage', 'hidden_dims': '[256, 128, 64]', 'dropout': 0.5838841554890812, 'batch_norm': True, 'sage_aggr': 'mean', 'sage_normalize': False, 'sage_project': False, 'lr': 0.007066843624592701, 'weight_decay': 5.2882980775843576e-05, 'epochs': 55, 'loss': 'mae', 'optimizer': 'adam', 'graph_mode': 'cutoff', 'cutoff': 0.8999959650842675, 'grm_norm': 'none', 'self_loops': True, 'use_snp_selection': True, 'num_snps': 50197}. Best is trial 42 with value: 0.2969538400699926.
[I 2025-12-09 13:33:28,915] Trial 55 finished with value: 0.2887281967872689 and parameters: {'model_type': 'graphsage', 'hidden_dims': '[256, 128, 64]', 'dropout': 0.5797450022794219, 'batch_norm': True, 'sage_aggr': 'mean', 'sage_normalize': False, 'sage_project': False, 'lr': 7.822142135526318e-05, 'weight_decay': 5.4735574910927496e-05, 'epochs': 75, 'loss': 'mae', 'optimizer': 'adam', 'graph_mode': 'cutoff', 'cutoff': 0.895257736881696, 'grm_norm': 'none', 'self_loops': True, 'use_snp_selection': True, 'num_snps': 50717}. Best is trial 42 with value: 0.2969538400699926.
[I 2025-12-09 13:34:23,658] Trial 56 finished with value: 0.2865641888626593 and parameters: {'model_type': 'graphsage', 'hidden_dims': '[256, 128, 64]', 'dropout': 0.5524414132540532, 'batch_norm': True, 'sage_aggr': 'mean', 'sage_normalize': False, 'sage_project': False, 'lr': 0.006970022343155988, 'weight_decay': 7.98374703120306e-05, 'epochs': 52, 'loss': 'mae', 'optimizer': 'adam', 'graph_mode': 'cutoff', 'cutoff': 0.8530562061166457, 'grm_norm': 'gcn', 'self_loops': True, 'use_snp_selection': True, 'num_snps': 56179}. Best is trial 42 with value: 0.2969538400699926.
[I 2025-12-09 13:34:59,512] Trial 57 finished with value: 0.2791162762555112 and parameters: {'model_type': 'graphsage', 'hidden_dims': '[256, 128, 64]', 'dropout': 0.599455840591539, 'batch_norm': True, 'sage_aggr': 'mean', 'sage_normalize': False, 'sage_project': False, 'lr': 0.003713983765250789, 'weight_decay': 0.0002166302483922034, 'epochs': 112, 'loss': 'mae', 'optimizer': 'adam', 'graph_mode': 'cutoff', 'cutoff': 0.871425031174964, 'grm_norm': 'none', 'self_loops': False, 'use_snp_selection': False}. Best is trial 42 with value: 0.2969538400699926.
[I 2025-12-09 13:37:03,458] Trial 58 finished with value: 0.0022083216587430758 and parameters: {'model_type': 'graphsage', 'hidden_dims': '[256, 128, 64]', 'dropout': 0.529783183296801, 'batch_norm': False, 'sage_aggr': 'mean', 'sage_normalize': False, 'sage_project': False, 'lr': 0.004953140368358424, 'weight_decay': 1.0054265068694977e-07, 'epochs': 71, 'loss': 'mae', 'optimizer': 'adam', 'graph_mode': 'cutoff', 'cutoff': 0.20263568709003388, 'grm_norm': 'cosine_then_gcn', 'self_loops': True, 'use_snp_selection': True, 'num_snps': 57147}. Best is trial 42 with value: 0.2969538400699926.
[I 2025-12-09 13:37:55,064] Trial 59 finished with value: 0.28588986193375737 and parameters: {'model_type': 'graphsage', 'hidden_dims': '[256, 128, 64]', 'dropout': 0.5509077762550936, 'batch_norm': True, 'sage_aggr': 'mean', 'sage_normalize': False, 'sage_project': False, 'lr': 0.0030323066987550237, 'weight_decay': 0.00014310821865327618, 'epochs': 83, 'loss': 'mse', 'optimizer': 'adam', 'graph_mode': 'cutoff', 'cutoff': 0.8955530587769699, 'grm_norm': 'none', 'self_loops': True, 'use_snp_selection': True, 'num_snps': 41189}. Best is trial 42 with value: 0.2969538400699926.
[I 2025-12-09 13:38:49,548] Trial 60 finished with value: 0.2904015479600411 and parameters: {'model_type': 'graphsage', 'hidden_dims': '[256, 128]', 'dropout': 0.5240662945745033, 'batch_norm': True, 'sage_aggr': 'max', 'sage_normalize': False, 'sage_project': False, 'lr': 0.0017144794599851698, 'weight_decay': 5.074649521196493e-05, 'epochs': 52, 'loss': 'mae', 'optimizer': 'adam', 'graph_mode': 'cutoff', 'cutoff': 0.7572124037908028, 'grm_norm': 'cosine', 'self_loops': True, 'use_snp_selection': True, 'num_snps': 53840}. Best is trial 42 with value: 0.2969538400699926.
[I 2025-12-09 13:39:40,561] Trial 61 finished with value: 0.28943817427584 and parameters: {'model_type': 'graphsage', 'hidden_dims': '[256, 128, 64]', 'dropout': 0.5730087920669577, 'batch_norm': True, 'sage_aggr': 'mean', 'sage_normalize': False, 'sage_project': False, 'lr': 0.0074279731161399935, 'weight_decay': 3.58898046821682e-05, 'epochs': 52, 'loss': 'mae', 'optimizer': 'adam', 'graph_mode': 'cutoff', 'cutoff': 0.8483952444941616, 'grm_norm': 'none', 'self_loops': True, 'use_snp_selection': True, 'num_snps': 48828}. Best is trial 42 with value: 0.2969538400699926.
[I 2025-12-09 13:40:38,638] Trial 62 finished with value: 0.2881359467521011 and parameters: {'model_type': 'graphsage', 'hidden_dims': '[256, 128, 64]', 'dropout': 0.5818441168997364, 'batch_norm': True, 'sage_aggr': 'mean', 'sage_normalize': False, 'sage_project': False, 'lr': 0.005092208289350139, 'weight_decay': 9.617498791618636e-05, 'epochs': 74, 'loss': 'mae', 'optimizer': 'adam', 'graph_mode': 'cutoff', 'cutoff': 0.8708981886806005, 'grm_norm': 'none', 'self_loops': True, 'use_snp_selection': True, 'num_snps': 52243}. Best is trial 42 with value: 0.2969538400699926.
[I 2025-12-09 13:41:35,624] Trial 63 finished with value: 0.28373749475126503 and parameters: {'model_type': 'graphsage', 'hidden_dims': '[256, 128, 64]', 'dropout': 0.5135569151857239, 'batch_norm': True, 'sage_aggr': 'mean', 'sage_normalize': False, 'sage_project': False, 'lr': 0.007363050977056214, 'weight_decay': 2.715689323507121e-05, 'epochs': 92, 'loss': 'mae', 'optimizer': 'adam', 'graph_mode': 'cutoff', 'cutoff': 0.8337352435941137, 'grm_norm': 'none', 'self_loops': True, 'use_snp_selection': True, 'num_snps': 45734}. Best is trial 42 with value: 0.2969538400699926.
[I 2025-12-09 13:42:28,533] Trial 64 finished with value: 0.28852885761167707 and parameters: {'model_type': 'graphsage', 'hidden_dims': '[256, 128, 64]', 'dropout': 0.5350595705001393, 'batch_norm': True, 'sage_aggr': 'mean', 'sage_normalize': False, 'sage_project': False, 'lr': 0.00551427617088272, 'weight_decay': 6.79770914687921e-05, 'epochs': 40, 'loss': 'mae', 'optimizer': 'adam', 'graph_mode': 'cutoff', 'cutoff': 0.8067856653082509, 'grm_norm': 'none', 'self_loops': True, 'use_snp_selection': True, 'num_snps': 58003}. Best is trial 42 with value: 0.2969538400699926.
[I 2025-12-09 13:43:27,742] Trial 65 finished with value: 0.2878665710369954 and parameters: {'model_type': 'graphsage', 'hidden_dims': '[512, 256]', 'dropout': 0.5627195081400036, 'batch_norm': True, 'sage_aggr': 'mean', 'sage_normalize': False, 'sage_project': False, 'lr': 0.004579912195740478, 'weight_decay': 4.458856040004121e-05, 'epochs': 64, 'loss': 'mae', 'optimizer': 'adam', 'graph_mode': 'cutoff', 'cutoff': 0.8747682872241803, 'grm_norm': 'none', 'self_loops': True, 'use_snp_selection': True, 'num_snps': 43721}. Best is trial 42 with value: 0.2969538400699926.
[I 2025-12-09 13:44:52,222] Trial 66 finished with value: 0.2820949861544579 and parameters: {'model_type': 'graphsage', 'hidden_dims': '[128, 64]', 'dropout': 0.49595260306545397, 'batch_norm': True, 'sage_aggr': 'mean', 'sage_normalize': False, 'sage_project': False, 'lr': 0.0034272160619195535, 'weight_decay': 0.00011801038975236805, 'epochs': 283, 'loss': 'mae', 'optimizer': 'adam', 'graph_mode': 'cutoff', 'cutoff': 0.8294046670009425, 'grm_norm': 'none', 'self_loops': True, 'use_snp_selection': True, 'num_snps': 53966}. Best is trial 42 with value: 0.2969538400699926.
[I 2025-12-09 13:45:50,818] Trial 67 finished with value: 0.2774779976967688 and parameters: {'model_type': 'graphsage', 'hidden_dims': '[256, 128, 64]', 'dropout': 0.1131036190131395, 'batch_norm': True, 'sage_aggr': 'mean', 'sage_normalize': True, 'sage_project': False, 'lr': 0.0022668628394457518, 'weight_decay': 2.4883430886334004e-05, 'epochs': 77, 'loss': 'mae', 'optimizer': 'adam', 'graph_mode': 'cutoff', 'cutoff': 0.8955431609062993, 'grm_norm': 'none', 'self_loops': True, 'use_snp_selection': True, 'num_snps': 51051}. Best is trial 42 with value: 0.2969538400699926.
[I 2025-12-09 13:46:50,829] Trial 68 finished with value: 0.268494638943049 and parameters: {'model_type': 'graphsage', 'hidden_dims': '[256, 128, 64]', 'dropout': 0.48131716888792275, 'batch_norm': True, 'sage_aggr': 'mean', 'sage_normalize': False, 'sage_project': False, 'lr': 0.0010472457011103155, 'weight_decay': 1.751922435672273e-05, 'epochs': 101, 'loss': 'mae', 'optimizer': 'adam', 'graph_mode': 'knn', 'knn_k': 5, 'weighted_edges': True, 'symmetrize_mode': 'union', 'self_loops': True, 'use_snp_selection': False}. Best is trial 42 with value: 0.2969538400699926.
[I 2025-12-09 13:47:48,155] Trial 69 finished with value: 0.04758480659960631 and parameters: {'model_type': 'graphsage', 'hidden_dims': '[512, 128]', 'dropout': 0.5872123856849806, 'batch_norm': False, 'sage_aggr': 'mean', 'sage_normalize': False, 'sage_project': False, 'lr': 0.007854050266613987, 'weight_decay': 3.664330492059552e-05, 'epochs': 47, 'loss': 'mae', 'optimizer': 'adam', 'graph_mode': 'cutoff', 'cutoff': 0.7824352525109387, 'grm_norm': 'gcn', 'self_loops': False, 'use_snp_selection': True, 'num_snps': 47922}. Best is trial 42 with value: 0.2969538400699926.
[I 2025-12-09 13:49:10,726] Trial 70 finished with value: 0.29188816763600084 and parameters: {'model_type': 'graphsage', 'hidden_dims': '[512, 64]', 'dropout': 0.5480184733741796, 'batch_norm': True, 'sage_aggr': 'mean', 'sage_normalize': False, 'sage_project': False, 'lr': 0.0060158891821220474, 'weight_decay': 5.4848900396800014e-05, 'epochs': 88, 'loss': 'mae', 'optimizer': 'adam', 'graph_mode': 'cutoff', 'cutoff': 0.6424931288764826, 'grm_norm': 'none', 'self_loops': True, 'use_snp_selection': True, 'num_snps': 57616}. Best is trial 42 with value: 0.2969538400699926.
[I 2025-12-09 13:50:20,722] Trial 71 finished with value: 0.2898160391722494 and parameters: {'model_type': 'graphsage', 'hidden_dims': '[512, 64]', 'dropout': 0.5538913085182168, 'batch_norm': True, 'sage_aggr': 'mean', 'sage_normalize': False, 'sage_project': False, 'lr': 0.006344115580103236, 'weight_decay': 5.3474700843250543e-05, 'epochs': 62, 'loss': 'mae', 'optimizer': 'adam', 'graph_mode': 'cutoff', 'cutoff': 0.8421660419873758, 'grm_norm': 'none', 'self_loops': True, 'use_snp_selection': True, 'num_snps': 57505}. Best is trial 42 with value: 0.2969538400699926.
[I 2025-12-09 13:51:38,587] Trial 72 finished with value: 0.2819328511686249 and parameters: {'model_type': 'graphsage', 'hidden_dims': '[512, 64]', 'dropout': 0.524378353184995, 'batch_norm': True, 'sage_aggr': 'mean', 'sage_normalize': False, 'sage_project': False, 'lr': 0.004163223335618719, 'weight_decay': 7.840559333692746e-05, 'epochs': 90, 'loss': 'mae', 'optimizer': 'adam', 'graph_mode': 'cutoff', 'cutoff': 0.6236258942639477, 'grm_norm': 'none', 'self_loops': True, 'use_snp_selection': True, 'num_snps': 54176}. Best is trial 42 with value: 0.2969538400699926.
[I 2025-12-09 13:53:06,606] Trial 73 finished with value: 0.2801929469013776 and parameters: {'model_type': 'graphsage', 'hidden_dims': '[512, 64]', 'dropout': 0.5412525038792616, 'batch_norm': True, 'sage_aggr': 'mean', 'sage_normalize': False, 'sage_project': False, 'lr': 0.008350080725785877, 'weight_decay': 9.639458604700893e-05, 'epochs': 57, 'loss': 'mae', 'optimizer': 'adam', 'graph_mode': 'cutoff', 'cutoff': 0.3156222666760551, 'grm_norm': 'none', 'self_loops': True, 'use_snp_selection': True, 'num_snps': 57914}. Best is trial 42 with value: 0.2969538400699926.
[I 2025-12-09 13:54:15,397] Trial 74 finished with value: 0.28442425686151174 and parameters: {'model_type': 'graphsage', 'hidden_dims': '[512, 64]', 'dropout': 0.5081946710116344, 'batch_norm': True, 'sage_aggr': 'mean', 'sage_normalize': False, 'sage_project': False, 'lr': 0.005684368116842697, 'weight_decay': 3.5161305469345644e-05, 'epochs': 75, 'loss': 'mae', 'optimizer': 'adam', 'graph_mode': 'cutoff', 'cutoff': 0.8064625814773637, 'grm_norm': 'none', 'self_loops': True, 'use_snp_selection': True, 'num_snps': 50580}. Best is trial 42 with value: 0.2969538400699926.
[I 2025-12-09 13:55:09,107] Trial 75 finished with value: 0.2685533422429206 and parameters: {'model_type': 'graphsage', 'hidden_dims': '[256, 128, 64]', 'dropout': 0.4786373664604584, 'batch_norm': True, 'sage_aggr': 'mean', 'sage_normalize': False, 'sage_project': False, 'lr': 1.2168412390362745e-05, 'weight_decay': 3.515337930332123e-07, 'epochs': 48, 'loss': 'mae', 'optimizer': 'adam', 'graph_mode': 'cutoff', 'cutoff': 0.7413214254683728, 'grm_norm': 'cosine', 'self_loops': True, 'use_snp_selection': True, 'num_snps': 53034}. Best is trial 42 with value: 0.2969538400699926.
[I 2025-12-09 13:56:17,005] Trial 76 finished with value: 0.2846144315834992 and parameters: {'model_type': 'graphsage', 'hidden_dims': '[256, 128, 64]', 'dropout': 0.5280145714938913, 'batch_norm': True, 'sage_aggr': 'mean', 'sage_normalize': False, 'sage_project': False, 'lr': 0.002944653684990288, 'weight_decay': 0.0009023166082769812, 'epochs': 104, 'loss': 'mse', 'optimizer': 'adam', 'graph_mode': 'cutoff', 'cutoff': 0.8776534590630131, 'grm_norm': 'none', 'self_loops': True, 'use_snp_selection': True, 'num_snps': 55569}. Best is trial 42 with value: 0.2969538400699926.
[I 2025-12-09 13:57:05,873] Trial 77 finished with value: 0.28156823266291764 and parameters: {'model_type': 'graphsage', 'hidden_dims': '[256, 128, 64]', 'dropout': 0.5654669247284505, 'batch_norm': True, 'sage_aggr': 'max', 'sage_normalize': False, 'sage_project': False, 'lr': 0.009953616529662083, 'weight_decay': 0.00019219077530741366, 'epochs': 67, 'loss': 'mae', 'optimizer': 'adam', 'graph_mode': 'cutoff', 'cutoff': 0.6625497234316958, 'grm_norm': 'cosine_then_gcn', 'self_loops': True, 'use_snp_selection': True, 'num_snps': 38681}. Best is trial 42 with value: 0.2969538400699926.
[I 2025-12-09 13:58:30,105] Trial 78 finished with value: 0.2853064532580959 and parameters: {'model_type': 'graphsage', 'hidden_dims': '[512, 64]', 'dropout': 0.503045196947525, 'batch_norm': True, 'sage_aggr': 'mean', 'sage_normalize': False, 'sage_project': False, 'lr': 0.0036987643962913905, 'weight_decay': 2.2552501623247582e-05, 'epochs': 117, 'loss': 'mae', 'optimizer': 'adam', 'graph_mode': 'cutoff', 'cutoff': 0.54304720336306, 'grm_norm': 'none', 'self_loops': True, 'use_snp_selection': True, 'num_snps': 46635}. Best is trial 42 with value: 0.2969538400699926.
[I 2025-12-09 13:59:11,637] Trial 79 finished with value: 0.27822999141678123 and parameters: {'model_type': 'graphsage', 'hidden_dims': '[128, 64]', 'dropout': 0.5890106231015388, 'batch_norm': True, 'sage_aggr': 'mean', 'sage_normalize': True, 'sage_project': False, 'lr': 0.004908085567319327, 'weight_decay': 6.150715846234136e-05, 'epochs': 199, 'loss': 'mae', 'optimizer': 'adam', 'graph_mode': 'knn', 'knn_k': 1, 'weighted_edges': True, 'symmetrize_mode': 'mutual', 'self_loops': True, 'use_snp_selection': False}. Best is trial 42 with value: 0.2969538400699926.
