[I 2025-12-08 22:27:41,511] Trial 38 finished with value: 0.32851308450932326 and parameters: {'model_type': 'graphsage', 'hidden_dims': '[256, 128, 64]', 'dropout': 0.5646695466042225, 'batch_norm': True, 'sage_aggr': 'mean', 'sage_normalize': True, 'sage_project': False, 'lr': 3.6603843342729244e-05, 'weight_decay': 2.2824522613264978e-05, 'epochs': 94, 'loss': 'mae', 'optimizer': 'adam', 'graph_mode': 'cutoff', 'cutoff': 0.7921704199154103, 'grm_norm': 'cosine_then_gcn', 'self_loops': True, 'use_snp_selection': True, 'num_snps': 14449}. Best is trial 34 with value: 0.3738087047525053.
[I 2025-12-08 22:28:17,279] Trial 39 finished with value: 0.37133260035174465 and parameters: {'model_type': 'graphsage', 'hidden_dims': '[256, 128, 64]', 'dropout': 0.5123984764308012, 'batch_norm': False, 'sage_aggr': 'max', 'sage_normalize': False, 'sage_project': False, 'lr': 1.655687644958799e-05, 'weight_decay': 3.898049454107224e-06, 'epochs': 156, 'loss': 'mae', 'optimizer': 'adam', 'graph_mode': 'cutoff', 'cutoff': 0.8916347762046746, 'grm_norm': 'cosine_then_gcn', 'self_loops': True, 'use_snp_selection': True, 'num_snps': 30510}. Best is trial 34 with value: 0.3738087047525053.
[I 2025-12-08 22:29:03,647] Trial 40 finished with value: 0.3484084450530295 and parameters: {'model_type': 'graphsage', 'hidden_dims': '[256, 128, 64]', 'dropout': 0.5129902069274643, 'batch_norm': True, 'sage_aggr': 'max', 'sage_normalize': False, 'sage_project': False, 'lr': 1.6042489307689473e-05, 'weight_decay': 3.5415061452010865e-06, 'epochs': 156, 'loss': 'mae', 'optimizer': 'adam', 'graph_mode': 'cutoff', 'cutoff': 0.6742333431637382, 'grm_norm': 'cosine_then_gcn', 'self_loops': True, 'use_snp_selection': False}. Best is trial 34 with value: 0.3738087047525053.
[I 2025-12-08 22:29:42,484] Trial 41 finished with value: 0.3749288093381993 and parameters: {'model_type': 'graphsage', 'hidden_dims': '[256, 128, 64]', 'dropout': 0.5725737526624952, 'batch_norm': False, 'sage_aggr': 'max', 'sage_normalize': False, 'sage_project': False, 'lr': 1.5699330289206213e-05, 'weight_decay': 1.345935637678937e-06, 'epochs': 181, 'loss': 'mae', 'optimizer': 'adam', 'graph_mode': 'cutoff', 'cutoff': 0.8714340947849111, 'grm_norm': 'cosine_then_gcn', 'self_loops': True, 'use_snp_selection': True, 'num_snps': 30185}. Best is trial 41 with value: 0.3749288093381993.
[I 2025-12-08 22:30:26,368] Trial 42 finished with value: 0.3584048213322163 and parameters: {'model_type': 'graphsage', 'hidden_dims': '[256, 128, 64]', 'dropout': 0.5311064515854756, 'batch_norm': False, 'sage_aggr': 'max', 'sage_normalize': False, 'sage_project': False, 'lr': 2.16388809968011e-05, 'weight_decay': 1.4760687383674745e-06, 'epochs': 178, 'loss': 'mae', 'optimizer': 'adam', 'graph_mode': 'cutoff', 'cutoff': 0.5219820853160897, 'grm_norm': 'cosine_then_gcn', 'self_loops': True, 'use_snp_selection': True, 'num_snps': 31031}. Best is trial 41 with value: 0.3749288093381993.
[I 2025-12-08 22:30:59,860] Trial 43 finished with value: 0.37222197418467096 and parameters: {'model_type': 'graphsage', 'hidden_dims': '[256, 128, 64]', 'dropout': 0.5605764609878149, 'batch_norm': False, 'sage_aggr': 'max', 'sage_normalize': False, 'sage_project': False, 'lr': 1.4754709351745818e-05, 'weight_decay': 8.851054661910914e-07, 'epochs': 139, 'loss': 'mae', 'optimizer': 'adam', 'graph_mode': 'cutoff', 'cutoff': 0.8441330210316943, 'grm_norm': 'cosine_then_gcn', 'self_loops': True, 'use_snp_selection': True, 'num_snps': 31018}. Best is trial 41 with value: 0.3749288093381993.
[I 2025-12-08 22:31:27,794] Trial 44 finished with value: 0.3649176011326202 and parameters: {'model_type': 'graphsage', 'hidden_dims': '[256, 128, 64]', 'dropout': 0.5597914911334428, 'batch_norm': False, 'sage_aggr': 'mean', 'sage_normalize': False, 'sage_project': False, 'lr': 5.2662518336367634e-05, 'weight_decay': 6.269640865698577e-07, 'epochs': 135, 'loss': 'mae', 'optimizer': 'adam', 'graph_mode': 'cutoff', 'cutoff': 0.7834187845137383, 'grm_norm': 'none', 'self_loops': True, 'use_snp_selection': True, 'num_snps': 24731}. Best is trial 41 with value: 0.3749288093381993.
[I 2025-12-08 22:31:52,397] Trial 45 finished with value: 0.3112561546104929 and parameters: {'model_type': 'graphsage', 'hidden_dims': '[256, 128, 64]', 'dropout': 0.571284137650712, 'batch_norm': False, 'sage_aggr': 'max', 'sage_normalize': True, 'sage_project': False, 'lr': 6.777592369289331e-05, 'weight_decay': 1.807237198087139e-07, 'epochs': 93, 'loss': 'mae', 'optimizer': 'adam', 'graph_mode': 'cutoff', 'cutoff': 0.8367864182934268, 'grm_norm': 'none', 'self_loops': True, 'use_snp_selection': True, 'num_snps': 27086}. Best is trial 41 with value: 0.3749288093381993.
[I 2025-12-08 22:34:41,196] Trial 46 finished with value: 0.33606527574520895 and parameters: {'model_type': 'graphsage', 'hidden_dims': '[128, 64]', 'dropout': 0.5417533508651555, 'batch_norm': False, 'sage_aggr': 'max', 'sage_normalize': False, 'sage_project': False, 'lr': 1.518115101770087e-05, 'weight_decay': 9.007174131979179e-07, 'epochs': 184, 'loss': 'mae', 'optimizer': 'adam', 'graph_mode': 'knn', 'knn_k': 10, 'weighted_edges': True, 'symmetrize_mode': 'union', 'self_loops': True, 'use_snp_selection': True, 'num_snps': 32331}. Best is trial 41 with value: 0.3749288093381993.
[I 2025-12-08 22:34:56,974] Trial 47 finished with value: 0.34933023430091154 and parameters: {'model_type': 'graphsage', 'hidden_dims': '[256, 128, 64]', 'dropout': 0.5491566274466353, 'batch_norm': False, 'sage_aggr': 'max', 'sage_normalize': False, 'sage_project': False, 'lr': 0.00028447836518732836, 'weight_decay': 3.7451799678538613e-07, 'epochs': 99, 'loss': 'mae', 'optimizer': 'adam', 'graph_mode': 'cutoff', 'cutoff': 0.8395691168738828, 'grm_norm': 'cosine_then_gcn', 'self_loops': True, 'use_snp_selection': True, 'num_snps': 11858}. Best is trial 41 with value: 0.3749288093381993.
[I 2025-12-08 22:35:17,563] Trial 48 finished with value: 0.3581434753130357 and parameters: {'model_type': 'graphsage', 'hidden_dims': '[256, 128, 64]', 'dropout': 0.5766058854629218, 'batch_norm': True, 'sage_aggr': 'max', 'sage_normalize': False, 'sage_project': False, 'lr': 4.395810912602897e-05, 'weight_decay': 1.7591455672462518e-06, 'epochs': 78, 'loss': 'mse', 'optimizer': 'adam', 'graph_mode': 'cutoff', 'cutoff': 0.7377361617865398, 'grm_norm': 'gcn', 'self_loops': True, 'use_snp_selection': True, 'num_snps': 23158}. Best is trial 41 with value: 0.3749288093381993.
[I 2025-12-08 22:35:49,446] Trial 49 finished with value: 0.339153478662774 and parameters: {'model_type': 'graphsage', 'hidden_dims': '[256, 128]', 'dropout': 0.5198503725806899, 'batch_norm': False, 'sage_aggr': 'mean', 'sage_normalize': True, 'sage_project': False, 'lr': 2.4997453964013192e-05, 'weight_decay': 1.026409540798943e-05, 'epochs': 142, 'loss': 'mae', 'optimizer': 'adam', 'graph_mode': 'cutoff', 'cutoff': 0.7910816155707395, 'grm_norm': 'cosine', 'self_loops': True, 'use_snp_selection': True, 'num_snps': 27945}. Best is trial 41 with value: 0.3749288093381993.
[I 2025-12-08 22:36:55,135] Trial 50 finished with value: 0.32945146165934924 and parameters: {'model_type': 'graphsage', 'hidden_dims': '[512, 64]', 'dropout': 0.3193066708334205, 'batch_norm': False, 'sage_aggr': 'max', 'sage_normalize': False, 'sage_project': False, 'lr': 3.435663443669801e-05, 'weight_decay': 5.550658229095655e-06, 'epochs': 127, 'loss': 'mae', 'optimizer': 'adam', 'graph_mode': 'knn', 'knn_k': 7, 'weighted_edges': True, 'symmetrize_mode': 'union', 'self_loops': False, 'use_snp_selection': True, 'num_snps': 21334}. Best is trial 41 with value: 0.3749288093381993.
[I 2025-12-08 22:37:31,298] Trial 51 finished with value: 0.368674469368391 and parameters: {'model_type': 'graphsage', 'hidden_dims': '[256, 128, 64]', 'dropout': 0.47853566913817985, 'batch_norm': False, 'sage_aggr': 'max', 'sage_normalize': False, 'sage_project': False, 'lr': 1.5752811567386933e-05, 'weight_decay': 3.245920292368828e-06, 'epochs': 153, 'loss': 'mae', 'optimizer': 'adam', 'graph_mode': 'cutoff', 'cutoff': 0.8959938901428123, 'grm_norm': 'cosine_then_gcn', 'self_loops': True, 'use_snp_selection': True, 'num_snps': 31143}. Best is trial 41 with value: 0.3749288093381993.
[I 2025-12-08 22:38:03,700] Trial 52 finished with value: 0.3724513476761162 and parameters: {'model_type': 'graphsage', 'hidden_dims': '[256, 128, 64]', 'dropout': 0.5102917054179739, 'batch_norm': False, 'sage_aggr': 'max', 'sage_normalize': False, 'sage_project': False, 'lr': 1.4539354162090145e-05, 'weight_decay': 1.0008298227369026e-06, 'epochs': 169, 'loss': 'mae', 'optimizer': 'adam', 'graph_mode': 'cutoff', 'cutoff': 0.8572948499578803, 'grm_norm': 'cosine_then_gcn', 'self_loops': True, 'use_snp_selection': True, 'num_snps': 25020}. Best is trial 41 with value: 0.3749288093381993.
[I 2025-12-08 22:38:35,897] Trial 53 finished with value: 0.05317433165755262 and parameters: {'model_type': 'graphsage', 'hidden_dims': '[256, 128, 64]', 'dropout': 0.5994149313721415, 'batch_norm': False, 'sage_aggr': 'max', 'sage_normalize': False, 'sage_project': False, 'lr': 0.005445092002247451, 'weight_decay': 9.235130958898613e-07, 'epochs': 166, 'loss': 'mae', 'optimizer': 'adam', 'graph_mode': 'cutoff', 'cutoff': 0.8514843252830158, 'grm_norm': 'cosine_then_gcn', 'self_loops': True, 'use_snp_selection': True, 'num_snps': 25493}. Best is trial 41 with value: 0.3749288093381993.
[I 2025-12-08 22:39:18,376] Trial 54 finished with value: 0.35370952581595594 and parameters: {'model_type': 'graphsage', 'hidden_dims': '[256, 128, 64]', 'dropout': 0.4196480566335301, 'batch_norm': False, 'sage_aggr': 'max', 'sage_normalize': False, 'sage_project': False, 'lr': 1.4083475170731511e-05, 'weight_decay': 5.174075730964848e-07, 'epochs': 185, 'loss': 'mse', 'optimizer': 'adam', 'graph_mode': 'cutoff', 'cutoff': 0.847600254550975, 'grm_norm': 'cosine_then_gcn', 'self_loops': True, 'use_snp_selection': True, 'num_snps': 32822}. Best is trial 41 with value: 0.3749288093381993.
[I 2025-12-08 22:40:33,119] Trial 55 finished with value: 0.32847130559944293 and parameters: {'model_type': 'graphsage', 'hidden_dims': '[256, 128, 64]', 'dropout': 0.5489948892308101, 'batch_norm': False, 'sage_aggr': 'max', 'sage_normalize': False, 'sage_project': False, 'lr': 2.346357442112573e-05, 'weight_decay': 1.5886555423648072e-06, 'epochs': 173, 'loss': 'mae', 'optimizer': 'adam', 'graph_mode': 'cutoff', 'cutoff': 0.4680418489692798, 'grm_norm': 'gcn', 'self_loops': True, 'use_snp_selection': True, 'num_snps': 38095}. Best is trial 41 with value: 0.3749288093381993.
[I 2025-12-08 22:40:53,109] Trial 56 finished with value: 0.3704500706668614 and parameters: {'model_type': 'graphsage', 'hidden_dims': '[256, 128, 64]', 'dropout': 0.5261891319739423, 'batch_norm': False, 'sage_aggr': 'max', 'sage_normalize': False, 'sage_project': False, 'lr': 1.9416298397828245e-05, 'weight_decay': 2.14557259245081e-07, 'epochs': 111, 'loss': 'mae', 'optimizer': 'adam', 'graph_mode': 'cutoff', 'cutoff': 0.7624479041377095, 'grm_norm': 'cosine_then_gcn', 'self_loops': False, 'use_snp_selection': True, 'num_snps': 17076}. Best is trial 41 with value: 0.3749288093381993.
[I 2025-12-08 22:43:18,120] Trial 57 finished with value: 0.34705177302942225 and parameters: {'model_type': 'graphsage', 'hidden_dims': '[256, 128]', 'dropout': 0.20370997069425184, 'batch_norm': False, 'sage_aggr': 'max', 'sage_normalize': False, 'sage_project': False, 'lr': 3.1907134877405344e-05, 'weight_decay': 1.142400622514969e-06, 'epochs': 219, 'loss': 'mae', 'optimizer': 'adam', 'graph_mode': 'knn', 'knn_k': 5, 'weighted_edges': True, 'symmetrize_mode': 'union', 'self_loops': True, 'use_snp_selection': False}. Best is trial 41 with value: 0.3749288093381993.
[I 2025-12-08 22:43:34,038] Trial 58 finished with value: 0.3590657866291914 and parameters: {'model_type': 'graphsage', 'hidden_dims': '[256, 128, 64]', 'dropout': 0.4975050941431364, 'batch_norm': False, 'sage_aggr': 'max', 'sage_normalize': False, 'sage_project': False, 'lr': 1.2619694025963951e-05, 'weight_decay': 8.2953020777724e-05, 'epochs': 143, 'loss': 'mse', 'optimizer': 'adam', 'graph_mode': 'cutoff', 'cutoff': 0.861246422394959, 'grm_norm': 'cosine_then_gcn', 'self_loops': True, 'use_snp_selection': True, 'num_snps': 9088}. Best is trial 41 with value: 0.3749288093381993.
[I 2025-12-08 22:43:57,959] Trial 59 finished with value: 0.36583080560493014 and parameters: {'model_type': 'graphsage', 'hidden_dims': '[128, 64]', 'dropout': 0.5808667261940834, 'batch_norm': False, 'sage_aggr': 'max', 'sage_normalize': False, 'sage_project': False, 'lr': 2.7713697159479503e-05, 'weight_decay': 1.1070236087673992e-07, 'epochs': 181, 'loss': 'mae', 'optimizer': 'adam', 'graph_mode': 'cutoff', 'cutoff': 0.8086852625732824, 'grm_norm': 'cosine', 'self_loops': True, 'use_snp_selection': True, 'num_snps': 22998}. Best is trial 41 with value: 0.3749288093381993.
[I 2025-12-08 22:44:54,926] Trial 60 finished with value: 0.05227822264569761 and parameters: {'model_type': 'graphsage', 'hidden_dims': '[512, 64]', 'dropout': 0.44303083871776394, 'batch_norm': False, 'sage_aggr': 'mean', 'sage_normalize': False, 'sage_project': False, 'lr': 0.0025431669367973714, 'weight_decay': 5.008488878995544e-07, 'epochs': 189, 'loss': 'mae', 'optimizer': 'adam', 'graph_mode': 'cutoff', 'cutoff': 0.6582843487678294, 'grm_norm': 'cosine_then_gcn', 'self_loops': False, 'use_snp_selection': True, 'num_snps': 28301}. Best is trial 41 with value: 0.3749288093381993.
[I 2025-12-08 22:45:30,275] Trial 61 finished with value: 0.37190552851119174 and parameters: {'model_type': 'graphsage', 'hidden_dims': '[256, 128, 64]', 'dropout': 0.5154273687954595, 'batch_norm': False, 'sage_aggr': 'max', 'sage_normalize': False, 'sage_project': False, 'lr': 1.7961436886973335e-05, 'weight_decay': 2.6226817776261087e-06, 'epochs': 160, 'loss': 'mae', 'optimizer': 'adam', 'graph_mode': 'cutoff', 'cutoff': 0.8941168992839977, 'grm_norm': 'cosine_then_gcn', 'self_loops': True, 'use_snp_selection': True, 'num_snps': 29367}. Best is trial 41 with value: 0.3749288093381993.
[I 2025-12-08 22:46:10,039] Trial 62 finished with value: 0.37209101536384426 and parameters: {'model_type': 'graphsage', 'hidden_dims': '[256, 128, 64]', 'dropout': 0.48201489336872916, 'batch_norm': False, 'sage_aggr': 'max', 'sage_normalize': False, 'sage_project': False, 'lr': 1.3053826610884166e-05, 'weight_decay': 2.3046325197152167e-06, 'epochs': 162, 'loss': 'mae', 'optimizer': 'adam', 'graph_mode': 'cutoff', 'cutoff': 0.8991864758285341, 'grm_norm': 'cosine_then_gcn', 'self_loops': True, 'use_snp_selection': True, 'num_snps': 33814}. Best is trial 41 with value: 0.3749288093381993.
[I 2025-12-08 22:46:47,367] Trial 63 finished with value: 0.35802882102587247 and parameters: {'model_type': 'graphsage', 'hidden_dims': '[256, 128, 64]', 'dropout': 0.47473139596271197, 'batch_norm': False, 'sage_aggr': 'max', 'sage_normalize': False, 'sage_project': False, 'lr': 4.0280533514398554e-05, 'weight_decay': 2.0220443162742736e-06, 'epochs': 148, 'loss': 'mae', 'optimizer': 'adam', 'graph_mode': 'cutoff', 'cutoff': 0.89549066887588, 'grm_norm': 'cosine_then_gcn', 'self_loops': True, 'use_snp_selection': True, 'num_snps': 33669}. Best is trial 41 with value: 0.3749288093381993.
[I 2025-12-08 22:47:45,154] Trial 64 finished with value: 0.3237149455146719 and parameters: {'model_type': 'graphsage', 'hidden_dims': '[256, 128, 64]', 'dropout': 0.5375723100632257, 'batch_norm': False, 'sage_aggr': 'max', 'sage_normalize': False, 'sage_project': False, 'lr': 1.26732933453137e-05, 'weight_decay': 2.5090056880607576e-06, 'epochs': 162, 'loss': 'mae', 'optimizer': 'adam', 'graph_mode': 'cutoff', 'cutoff': 0.3295621582988216, 'grm_norm': 'cosine_then_gcn', 'self_loops': True, 'use_snp_selection': True, 'num_snps': 25941}. Best is trial 41 with value: 0.3749288093381993.
[I 2025-12-08 22:48:42,376] Trial 65 finished with value: 0.36963692668249004 and parameters: {'model_type': 'graphsage', 'hidden_dims': '[512, 256]', 'dropout': 0.5564072829347517, 'batch_norm': False, 'sage_aggr': 'max', 'sage_normalize': False, 'sage_project': False, 'lr': 1.898142478110532e-05, 'weight_decay': 1.219002291134918e-06, 'epochs': 129, 'loss': 'mae', 'optimizer': 'adam', 'graph_mode': 'cutoff', 'cutoff': 0.8701889846944192, 'grm_norm': 'cosine_then_gcn', 'self_loops': True, 'use_snp_selection': True, 'num_snps': 39518}. Best is trial 41 with value: 0.3749288093381993.
[I 2025-12-08 22:49:16,867] Trial 66 finished with value: 0.35481171766383185 and parameters: {'model_type': 'graphsage', 'hidden_dims': '[256, 128, 64]', 'dropout': 0.11057098921180239, 'batch_norm': False, 'sage_aggr': 'max', 'sage_normalize': False, 'sage_project': False, 'lr': 9.659495155927359e-05, 'weight_decay': 6.143962899398745e-06, 'epochs': 119, 'loss': 'mae', 'optimizer': 'adam', 'graph_mode': 'cutoff', 'cutoff': 0.8701862208801515, 'grm_norm': 'gcn', 'self_loops': True, 'use_snp_selection': True, 'num_snps': 35922}. Best is trial 41 with value: 0.3749288093381993.
[I 2025-12-08 22:50:01,042] Trial 67 finished with value: 0.32412650218429623 and parameters: {'model_type': 'graphsage', 'hidden_dims': '[256, 128, 64]', 'dropout': 0.4921155759799783, 'batch_norm': False, 'sage_aggr': 'max', 'sage_normalize': True, 'sage_project': False, 'lr': 2.1097303011785942e-05, 'weight_decay': 6.624375782894912e-07, 'epochs': 174, 'loss': 'mae', 'optimizer': 'adam', 'graph_mode': 'cutoff', 'cutoff': 0.558383920246678, 'grm_norm': 'cosine_then_gcn', 'self_loops': True, 'use_snp_selection': True, 'num_snps': 33620}. Best is trial 41 with value: 0.3749288093381993.
[I 2025-12-08 22:52:48,872] Trial 68 finished with value: 0.31784157546334074 and parameters: {'model_type': 'graphsage', 'hidden_dims': '[256, 128, 64]', 'dropout': 0.28360207041186786, 'batch_norm': True, 'sage_aggr': 'max', 'sage_normalize': False, 'sage_project': False, 'lr': 6.296599244772101e-05, 'weight_decay': 2.53804131736061e-06, 'epochs': 190, 'loss': 'mae', 'optimizer': 'adam', 'graph_mode': 'knn', 'knn_k': 8, 'weighted_edges': True, 'symmetrize_mode': 'union', 'self_loops': True, 'use_snp_selection': False}. Best is trial 41 with value: 0.3749288093381993.
[I 2025-12-08 22:53:24,716] Trial 69 finished with value: 0.37979444876206886 and parameters: {'model_type': 'graphsage', 'hidden_dims': '[256, 128]', 'dropout': 0.45717621365789235, 'batch_norm': False, 'sage_aggr': 'max', 'sage_normalize': False, 'sage_project': False, 'lr': 1.1907294264797665e-05, 'weight_decay': 9.49213495737153e-06, 'epochs': 103, 'loss': 'mse', 'optimizer': 'adam', 'graph_mode': 'cutoff', 'cutoff': 0.8186284914730857, 'grm_norm': 'cosine_then_gcn', 'self_loops': True, 'use_snp_selection': True, 'num_snps': 41882}. Best is trial 69 with value: 0.37979444876206886.
[I 2025-12-08 22:53:56,750] Trial 70 finished with value: 0.36301359003787564 and parameters: {'model_type': 'graphsage', 'hidden_dims': '[256, 128]', 'dropout': 0.407287182872555, 'batch_norm': False, 'sage_aggr': 'max', 'sage_normalize': False, 'sage_project': False, 'lr': 1.2877155237684885e-05, 'weight_decay': 9.608597144253993e-06, 'epochs': 82, 'loss': 'mse', 'optimizer': 'adam', 'graph_mode': 'cutoff', 'cutoff': 0.7901732141921661, 'grm_norm': 'none', 'self_loops': True, 'use_snp_selection': True, 'num_snps': 41768}. Best is trial 69 with value: 0.37979444876206886.
[I 2025-12-08 22:54:34,875] Trial 71 finished with value: 0.3688534906997206 and parameters: {'model_type': 'graphsage', 'hidden_dims': '[256, 128]', 'dropout': 0.4585394705738566, 'batch_norm': False, 'sage_aggr': 'max', 'sage_normalize': False, 'sage_project': False, 'lr': 1.276396635474357e-05, 'weight_decay': 4.3435829761196615e-06, 'epochs': 106, 'loss': 'mse', 'optimizer': 'adam', 'graph_mode': 'cutoff', 'cutoff': 0.8995914359841223, 'grm_norm': 'cosine_then_gcn', 'self_loops': True, 'use_snp_selection': True, 'num_snps': 44348}. Best is trial 69 with value: 0.37979444876206886.
[I 2025-12-08 22:54:55,817] Trial 72 finished with value: 0.35852185338092335 and parameters: {'model_type': 'graphsage', 'hidden_dims': '[256, 128]', 'dropout': 0.5273064903219427, 'batch_norm': False, 'sage_aggr': 'max', 'sage_normalize': False, 'sage_project': False, 'lr': 1.890193481113067e-05, 'weight_decay': 1.1162361413840336e-06, 'epochs': 53, 'loss': 'mse', 'optimizer': 'adam', 'graph_mode': 'cutoff', 'cutoff': 0.8230137919488393, 'grm_norm': 'cosine_then_gcn', 'self_loops': True, 'use_snp_selection': True, 'num_snps': 29663}. Best is trial 69 with value: 0.37979444876206886.
[I 2025-12-08 22:55:37,723] Trial 73 finished with value: 0.36060078992589945 and parameters: {'model_type': 'graphsage', 'hidden_dims': '[256, 128]', 'dropout': 0.5806746223716991, 'batch_norm': False, 'sage_aggr': 'max', 'sage_normalize': False, 'sage_project': False, 'lr': 2.48824356221166e-05, 'weight_decay': 1.2060611466034081e-05, 'epochs': 146, 'loss': 'mse', 'optimizer': 'adam', 'graph_mode': 'cutoff', 'cutoff': 0.8642019833927898, 'grm_norm': 'cosine_then_gcn', 'self_loops': True, 'use_snp_selection': True, 'num_snps': 39240}. Best is trial 69 with value: 0.37979444876206886.
[I 2025-12-08 22:56:12,290] Trial 74 finished with value: 0.05449695285736812 and parameters: {'model_type': 'graphsage', 'hidden_dims': '[256, 128, 64]', 'dropout': 0.48755499936227903, 'batch_norm': False, 'sage_aggr': 'max', 'sage_normalize': False, 'sage_project': False, 'lr': 0.0006600584874477113, 'weight_decay': 2.1976515506160323e-05, 'epochs': 122, 'loss': 'mse', 'optimizer': 'adam', 'graph_mode': 'cutoff', 'cutoff': 0.8711899728778285, 'grm_norm': 'cosine_then_gcn', 'self_loops': True, 'use_snp_selection': True, 'num_snps': 35183}. Best is trial 69 with value: 0.37979444876206886.
