[I 2025-12-08 22:45:09,405] Trial 118 finished with value: 0.28725059793163493 and parameters: {'model_type': 'graphsage', 'hidden_dims': '[256, 128, 64]', 'dropout': 0.5671791077897611, 'batch_norm': True, 'sage_aggr': 'mean', 'sage_normalize': False, 'sage_project': False, 'lr': 0.0007636884551126439, 'weight_decay': 1.2103012677932116e-07, 'epochs': 82, 'loss': 'mse', 'optimizer': 'adam', 'graph_mode': 'cutoff', 'cutoff': 0.5181314518019746, 'grm_norm': 'cosine_then_gcn', 'self_loops': True, 'use_snp_selection': True, 'num_snps': 47461}. Best is trial 79 with value: 0.29785602291757357.
[I 2025-12-08 22:45:37,857] Trial 119 finished with value: 0.2919338196965719 and parameters: {'model_type': 'graphsage', 'hidden_dims': '[256, 128]', 'dropout': 0.5248216978041712, 'batch_norm': True, 'sage_aggr': 'mean', 'sage_normalize': False, 'sage_project': False, 'lr': 0.002031106503432937, 'weight_decay': 4.049202940968564e-07, 'epochs': 61, 'loss': 'mse', 'optimizer': 'adam', 'graph_mode': 'cutoff', 'cutoff': 0.4222172670747562, 'grm_norm': 'none', 'self_loops': True, 'use_snp_selection': False}. Best is trial 79 with value: 0.29785602291757357.
[I 2025-12-08 22:46:12,818] Trial 120 finished with value: 0.29133707222991245 and parameters: {'model_type': 'graphsage', 'hidden_dims': '[512, 256]', 'dropout': 0.5436773789919559, 'batch_norm': True, 'sage_aggr': 'mean', 'sage_normalize': False, 'sage_project': False, 'lr': 0.004527844094575935, 'weight_decay': 1.71770538122623e-07, 'epochs': 45, 'loss': 'mse', 'optimizer': 'adam', 'graph_mode': 'cutoff', 'cutoff': 0.40378622034840944, 'grm_norm': 'cosine_then_gcn', 'self_loops': False, 'use_snp_selection': False}. Best is trial 79 with value: 0.29785602291757357.
[I 2025-12-08 22:47:22,804] Trial 121 finished with value: 0.28856542234233856 and parameters: {'model_type': 'graphsage', 'hidden_dims': '[512, 256]', 'dropout': 0.5311247907711892, 'batch_norm': True, 'sage_aggr': 'mean', 'sage_normalize': False, 'sage_project': False, 'lr': 0.0030038450983377145, 'weight_decay': 3.509088532046906e-07, 'epochs': 120, 'loss': 'mse', 'optimizer': 'adam', 'graph_mode': 'cutoff', 'cutoff': 0.4519619942861151, 'grm_norm': 'none', 'self_loops': True, 'use_snp_selection': False}. Best is trial 79 with value: 0.29785602291757357.
[I 2025-12-08 22:48:40,818] Trial 122 finished with value: 0.2879413709969093 and parameters: {'model_type': 'graphsage', 'hidden_dims': '[512, 256]', 'dropout': 0.5436617831297329, 'batch_norm': True, 'sage_aggr': 'mean', 'sage_normalize': False, 'sage_project': False, 'lr': 0.002350394533128626, 'weight_decay': 2.536506240287673e-07, 'epochs': 149, 'loss': 'mse', 'optimizer': 'adam', 'graph_mode': 'cutoff', 'cutoff': 0.5390012969652276, 'grm_norm': 'none', 'self_loops': True, 'use_snp_selection': False}. Best is trial 79 with value: 0.29785602291757357.
[I 2025-12-08 22:49:36,492] Trial 123 finished with value: 0.29004061504983253 and parameters: {'model_type': 'graphsage', 'hidden_dims': '[512, 256]', 'dropout': 0.5882806761169173, 'batch_norm': True, 'sage_aggr': 'mean', 'sage_normalize': False, 'sage_project': False, 'lr': 0.003452123978639163, 'weight_decay': 6.852304388714543e-07, 'epochs': 90, 'loss': 'mse', 'optimizer': 'adam', 'graph_mode': 'cutoff', 'cutoff': 0.46000885965191846, 'grm_norm': 'none', 'self_loops': True, 'use_snp_selection': False}. Best is trial 79 with value: 0.29785602291757357.
[I 2025-12-08 22:50:58,321] Trial 124 finished with value: 0.28482764792425985 and parameters: {'model_type': 'graphsage', 'hidden_dims': '[512, 256]', 'dropout': 0.5370388638189102, 'batch_norm': True, 'sage_aggr': 'mean', 'sage_normalize': False, 'sage_project': False, 'lr': 0.0027395668895826455, 'weight_decay': 1.0054490778529202e-06, 'epochs': 107, 'loss': 'mse', 'optimizer': 'adam', 'graph_mode': 'cutoff', 'cutoff': 0.26489674548061937, 'grm_norm': 'none', 'self_loops': True, 'use_snp_selection': False}. Best is trial 79 with value: 0.29785602291757357.
[I 2025-12-08 22:51:29,846] Trial 125 finished with value: -0.031845261954509145 and parameters: {'model_type': 'graphsage', 'hidden_dims': '[256, 128, 64]', 'dropout': 0.5079645063035865, 'batch_norm': False, 'sage_aggr': 'mean', 'sage_normalize': False, 'sage_project': False, 'lr': 0.0035387831016468123, 'weight_decay': 3.27279342155798e-07, 'epochs': 73, 'loss': 'mse', 'optimizer': 'adam', 'graph_mode': 'cutoff', 'cutoff': 0.44285560803265356, 'grm_norm': 'gcn', 'self_loops': True, 'use_snp_selection': False}. Best is trial 79 with value: 0.29785602291757357.
[I 2025-12-08 22:52:07,963] Trial 126 finished with value: 0.29320357941084574 and parameters: {'model_type': 'graphsage', 'hidden_dims': '[512, 64]', 'dropout': 0.39364883800480976, 'batch_norm': True, 'sage_aggr': 'mean', 'sage_normalize': False, 'sage_project': False, 'lr': 0.0040861607198706676, 'weight_decay': 4.871699183982969e-07, 'epochs': 54, 'loss': 'mse', 'optimizer': 'adam', 'graph_mode': 'cutoff', 'cutoff': 0.49537278437428744, 'grm_norm': 'cosine_then_gcn', 'self_loops': True, 'use_snp_selection': False}. Best is trial 79 with value: 0.29785602291757357.
[I 2025-12-08 22:53:09,228] Trial 127 finished with value: 0.2975153681905153 and parameters: {'model_type': 'graphsage', 'hidden_dims': '[512, 128]', 'dropout': 0.5579689979097774, 'batch_norm': True, 'sage_aggr': 'mean', 'sage_normalize': False, 'sage_project': False, 'lr': 0.002965278683107364, 'weight_decay': 4.0271973115520034e-07, 'epochs': 101, 'loss': 'mse', 'optimizer': 'adam', 'graph_mode': 'cutoff', 'cutoff': 0.471818830168626, 'grm_norm': 'cosine_then_gcn', 'self_loops': True, 'use_snp_selection': False}. Best is trial 79 with value: 0.29785602291757357.
[I 2025-12-08 22:54:01,790] Trial 128 finished with value: 0.28787464412297215 and parameters: {'model_type': 'graphsage', 'hidden_dims': '[512, 128]', 'dropout': 0.5583073749530216, 'batch_norm': True, 'sage_aggr': 'mean', 'sage_normalize': False, 'sage_project': False, 'lr': 0.0053774668097208425, 'weight_decay': 1.6315562811305977e-07, 'epochs': 83, 'loss': 'mse', 'optimizer': 'adam', 'graph_mode': 'cutoff', 'cutoff': 0.4749602533164221, 'grm_norm': 'cosine_then_gcn', 'self_loops': True, 'use_snp_selection': False}. Best is trial 79 with value: 0.29785602291757357.
[I 2025-12-08 22:55:08,627] Trial 129 finished with value: 0.29575163924255377 and parameters: {'model_type': 'graphsage', 'hidden_dims': '[512, 128]', 'dropout': 0.5728167503637225, 'batch_norm': True, 'sage_aggr': 'mean', 'sage_normalize': False, 'sage_project': False, 'lr': 0.0013480891403361006, 'weight_decay': 1.3201234523847825e-06, 'epochs': 110, 'loss': 'mse', 'optimizer': 'adam', 'graph_mode': 'cutoff', 'cutoff': 0.3823855662318431, 'grm_norm': 'cosine_then_gcn', 'self_loops': True, 'use_snp_selection': False}. Best is trial 79 with value: 0.29785602291757357.
[I 2025-12-08 22:56:11,957] Trial 130 finished with value: 0.28994989400142807 and parameters: {'model_type': 'graphsage', 'hidden_dims': '[512, 128]', 'dropout': 0.5814633467115364, 'batch_norm': True, 'sage_aggr': 'mean', 'sage_normalize': False, 'sage_project': False, 'lr': 0.0012860611735438412, 'weight_decay': 8.214485403951396e-07, 'epochs': 101, 'loss': 'mse', 'optimizer': 'adam', 'graph_mode': 'cutoff', 'cutoff': 0.3543807363244642, 'grm_norm': 'cosine_then_gcn', 'self_loops': True, 'use_snp_selection': False}. Best is trial 79 with value: 0.29785602291757357.
[I 2025-12-08 22:57:20,934] Trial 131 finished with value: 0.2929014392008523 and parameters: {'model_type': 'graphsage', 'hidden_dims': '[512, 128]', 'dropout': 0.5735289464524486, 'batch_norm': True, 'sage_aggr': 'mean', 'sage_normalize': False, 'sage_project': False, 'lr': 0.0017135582151369725, 'weight_decay': 1.1180483754353258e-06, 'epochs': 114, 'loss': 'mse', 'optimizer': 'adam', 'graph_mode': 'cutoff', 'cutoff': 0.37960942051802193, 'grm_norm': 'cosine_then_gcn', 'self_loops': True, 'use_snp_selection': False}. Best is trial 79 with value: 0.29785602291757357.
[I 2025-12-08 22:58:28,641] Trial 132 finished with value: 0.2936549000415237 and parameters: {'model_type': 'graphsage', 'hidden_dims': '[512, 128]', 'dropout': 0.5607552664565426, 'batch_norm': True, 'sage_aggr': 'mean', 'sage_normalize': False, 'sage_project': False, 'lr': 0.0023336121460716393, 'weight_decay': 1.3696296937495075e-06, 'epochs': 108, 'loss': 'mse', 'optimizer': 'adam', 'graph_mode': 'cutoff', 'cutoff': 0.33412550914579986, 'grm_norm': 'cosine_then_gcn', 'self_loops': True, 'use_snp_selection': False}. Best is trial 79 with value: 0.29785602291757357.
[I 2025-12-08 22:59:23,232] Trial 133 finished with value: 0.29360158101222467 and parameters: {'model_type': 'graphsage', 'hidden_dims': '[512, 128]', 'dropout': 0.5525189517574057, 'batch_norm': True, 'sage_aggr': 'mean', 'sage_normalize': False, 'sage_project': False, 'lr': 0.0021027684444099924, 'weight_decay': 4.2173175090414234e-07, 'epochs': 88, 'loss': 'mse', 'optimizer': 'adam', 'graph_mode': 'cutoff', 'cutoff': 0.484581120486026, 'grm_norm': 'cosine_then_gcn', 'self_loops': True, 'use_snp_selection': False}. Best is trial 79 with value: 0.29785602291757357.
[I 2025-12-08 22:59:55,682] Trial 134 finished with value: 0.2931611850462429 and parameters: {'model_type': 'graphsage', 'hidden_dims': '[512, 128]', 'dropout': 0.590860333458396, 'batch_norm': True, 'sage_aggr': 'mean', 'sage_normalize': False, 'sage_project': False, 'lr': 0.0005201530871792816, 'weight_decay': 6.023280749302129e-07, 'epochs': 40, 'loss': 'mse', 'optimizer': 'adam', 'graph_mode': 'cutoff', 'cutoff': 0.4285959499401657, 'grm_norm': 'cosine_then_gcn', 'self_loops': True, 'use_snp_selection': False}. Best is trial 79 with value: 0.29785602291757357.
[I 2025-12-08 23:00:50,915] Trial 135 finished with value: 0.2854369714211978 and parameters: {'model_type': 'graphsage', 'hidden_dims': '[512, 128]', 'dropout': 0.5696326876186372, 'batch_norm': True, 'sage_aggr': 'mean', 'sage_normalize': False, 'sage_project': False, 'lr': 0.0014178749771682694, 'weight_decay': 2.215858170305581e-07, 'epochs': 96, 'loss': 'mse', 'optimizer': 'adam', 'graph_mode': 'cutoff', 'cutoff': 0.514474039255269, 'grm_norm': 'cosine_then_gcn', 'self_loops': True, 'use_snp_selection': False}. Best is trial 79 with value: 0.29785602291757357.
[I 2025-12-08 23:01:21,275] Trial 136 finished with value: 0.2889604662770535 and parameters: {'model_type': 'graphsage', 'hidden_dims': '[256, 128]', 'dropout': 0.5502266201583318, 'batch_norm': True, 'sage_aggr': 'mean', 'sage_normalize': False, 'sage_project': False, 'lr': 0.0026543873511358385, 'weight_decay': 7.691212527949662e-07, 'epochs': 65, 'loss': 'mse', 'optimizer': 'adam', 'graph_mode': 'cutoff', 'cutoff': 0.4060013018518556, 'grm_norm': 'cosine_then_gcn', 'self_loops': True, 'use_snp_selection': False}. Best is trial 79 with value: 0.29785602291757357.
[I 2025-12-08 23:03:01,510] Trial 137 finished with value: 0.2784310137196832 and parameters: {'model_type': 'graphsage', 'hidden_dims': '[512, 128]', 'dropout': 0.5211625499787003, 'batch_norm': True, 'sage_aggr': 'mean', 'sage_normalize': True, 'sage_project': False, 'lr': 0.0033235830771925767, 'weight_decay': 3.9390536891086025e-06, 'epochs': 77, 'loss': 'mae', 'optimizer': 'adam', 'graph_mode': 'knn', 'knn_k': 5, 'weighted_edges': False, 'symmetrize_mode': 'mutual', 'self_loops': True, 'use_snp_selection': True, 'num_snps': 59059}. Best is trial 79 with value: 0.29785602291757357.
[I 2025-12-08 23:03:26,428] Trial 138 finished with value: 0.2840160423041023 and parameters: {'model_type': 'graphsage', 'hidden_dims': '[256, 128, 64]', 'dropout': 0.4791607360678483, 'batch_norm': True, 'sage_aggr': 'mean', 'sage_normalize': False, 'sage_project': False, 'lr': 0.0010161466275426835, 'weight_decay': 3.0660867095724883e-07, 'epochs': 58, 'loss': 'mse', 'optimizer': 'adam', 'graph_mode': 'cutoff', 'cutoff': 0.5663918125711315, 'grm_norm': 'cosine_then_gcn', 'self_loops': True, 'use_snp_selection': False}. Best is trial 79 with value: 0.29785602291757357.
[I 2025-12-08 23:03:52,820] Trial 139 finished with value: 0.29070943565905977 and parameters: {'model_type': 'graphsage', 'hidden_dims': '[256, 128]', 'dropout': 0.5328605499856276, 'batch_norm': True, 'sage_aggr': 'mean', 'sage_normalize': False, 'sage_project': False, 'lr': 0.0019180132286200661, 'weight_decay': 2.0253354172995193e-06, 'epochs': 50, 'loss': 'mse', 'optimizer': 'adam', 'graph_mode': 'cutoff', 'cutoff': 0.3602360941084794, 'grm_norm': 'cosine_then_gcn', 'self_loops': True, 'use_snp_selection': False}. Best is trial 79 with value: 0.29785602291757357.
[I 2025-12-08 23:04:26,133] Trial 140 finished with value: 0.28762116892753914 and parameters: {'model_type': 'graphsage', 'hidden_dims': '[256, 128, 64]', 'dropout': 0.566445222288505, 'batch_norm': True, 'sage_aggr': 'mean', 'sage_normalize': False, 'sage_project': False, 'lr': 0.004306463213600669, 'weight_decay': 5.285473546429678e-07, 'epochs': 92, 'loss': 'mse', 'optimizer': 'adam', 'graph_mode': 'cutoff', 'cutoff': 0.5415760970248777, 'grm_norm': 'cosine_then_gcn', 'self_loops': True, 'use_snp_selection': False}. Best is trial 79 with value: 0.29785602291757357.
[I 2025-12-08 23:05:32,802] Trial 141 finished with value: 0.2919590741291132 and parameters: {'model_type': 'graphsage', 'hidden_dims': '[512, 128]', 'dropout': 0.5549146271466986, 'batch_norm': True, 'sage_aggr': 'mean', 'sage_normalize': False, 'sage_project': False, 'lr': 0.0024416900976085318, 'weight_decay': 1.2557035532381465e-06, 'epochs': 110, 'loss': 'mse', 'optimizer': 'adam', 'graph_mode': 'cutoff', 'cutoff': 0.3782366644511594, 'grm_norm': 'cosine_then_gcn', 'self_loops': True, 'use_snp_selection': False}. Best is trial 79 with value: 0.29785602291757357.
[I 2025-12-08 23:06:38,892] Trial 142 finished with value: 0.2907405677700715 and parameters: {'model_type': 'graphsage', 'hidden_dims': '[512, 128]', 'dropout': 0.5613125746211954, 'batch_norm': True, 'sage_aggr': 'mean', 'sage_normalize': False, 'sage_project': False, 'lr': 0.0022759913181047454, 'weight_decay': 1.4653627012346147e-06, 'epochs': 104, 'loss': 'mse', 'optimizer': 'adam', 'graph_mode': 'cutoff', 'cutoff': 0.3281590365845909, 'grm_norm': 'cosine_then_gcn', 'self_loops': True, 'use_snp_selection': False}. Best is trial 79 with value: 0.29785602291757357.
[I 2025-12-08 23:07:55,157] Trial 143 finished with value: 0.2897626756565195 and parameters: {'model_type': 'graphsage', 'hidden_dims': '[512, 128]', 'dropout': 0.5755477795831079, 'batch_norm': True, 'sage_aggr': 'mean', 'sage_normalize': False, 'sage_project': False, 'lr': 0.0016460745994081366, 'weight_decay': 1.2971984812232418e-06, 'epochs': 125, 'loss': 'mse', 'optimizer': 'adam', 'graph_mode': 'cutoff', 'cutoff': 0.3336406722061354, 'grm_norm': 'cosine_then_gcn', 'self_loops': True, 'use_snp_selection': False}. Best is trial 79 with value: 0.29785602291757357.
[I 2025-12-08 23:08:58,293] Trial 144 finished with value: 0.2889018687833988 and parameters: {'model_type': 'graphsage', 'hidden_dims': '[512, 128]', 'dropout': 0.5403636207525327, 'batch_norm': True, 'sage_aggr': 'mean', 'sage_normalize': False, 'sage_project': False, 'lr': 0.00016853690537274203, 'weight_decay': 9.82913493482368e-07, 'epochs': 109, 'loss': 'mse', 'optimizer': 'adam', 'graph_mode': 'cutoff', 'cutoff': 0.4986987625151039, 'grm_norm': 'cosine_then_gcn', 'self_loops': True, 'use_snp_selection': False}. Best is trial 79 with value: 0.29785602291757357.
[I 2025-12-08 23:09:59,176] Trial 145 finished with value: 0.29338993889691894 and parameters: {'model_type': 'graphsage', 'hidden_dims': '[512, 128]', 'dropout': 0.5598826072463368, 'batch_norm': True, 'sage_aggr': 'mean', 'sage_normalize': False, 'sage_project': False, 'lr': 0.0029647835118814868, 'weight_decay': 6.670860664820184e-07, 'epochs': 100, 'loss': 'mse', 'optimizer': 'adam', 'graph_mode': 'cutoff', 'cutoff': 0.4688694026382181, 'grm_norm': 'cosine_then_gcn', 'self_loops': True, 'use_snp_selection': False}. Best is trial 79 with value: 0.29785602291757357.
[I 2025-12-08 23:10:25,929] Trial 146 finished with value: 0.2716856226858587 and parameters: {'model_type': 'graphsage', 'hidden_dims': '[256, 128, 64]', 'dropout': 0.5991562767533005, 'batch_norm': True, 'sage_aggr': 'mean', 'sage_normalize': False, 'sage_project': False, 'lr': 0.0035260279472003764, 'weight_decay': 1.743947587593942e-06, 'epochs': 47, 'loss': 'mse', 'optimizer': 'adam', 'graph_mode': 'cutoff', 'cutoff': 0.3139201788827701, 'grm_norm': 'cosine_then_gcn', 'self_loops': True, 'use_snp_selection': False}. Best is trial 79 with value: 0.29785602291757357.
[I 2025-12-08 23:10:56,812] Trial 147 finished with value: 0.25044422786073833 and parameters: {'model_type': 'graphsage', 'hidden_dims': '[256, 128]', 'dropout': 0.3309353950944217, 'batch_norm': False, 'sage_aggr': 'mean', 'sage_normalize': False, 'sage_project': False, 'lr': 5.170441958320844e-05, 'weight_decay': 2.4661818595484074e-06, 'epochs': 69, 'loss': 'mse', 'optimizer': 'adam', 'graph_mode': 'cutoff', 'cutoff': 0.43513744809424354, 'grm_norm': 'cosine_then_gcn', 'self_loops': False, 'use_snp_selection': False}. Best is trial 79 with value: 0.29785602291757357.
[I 2025-12-08 23:11:30,680] Trial 148 finished with value: 0.28547344090546145 and parameters: {'model_type': 'graphsage', 'hidden_dims': '[256, 128, 64]', 'dropout': 0.5483799785997984, 'batch_norm': True, 'sage_aggr': 'mean', 'sage_normalize': False, 'sage_project': False, 'lr': 0.0023496936774753544, 'weight_decay': 2.6906161781370775e-07, 'epochs': 80, 'loss': 'mse', 'optimizer': 'adam', 'graph_mode': 'cutoff', 'cutoff': 0.48287061824768196, 'grm_norm': 'cosine', 'self_loops': True, 'use_snp_selection': False}. Best is trial 79 with value: 0.29785602291757357.
[I 2025-12-08 23:12:16,625] Trial 149 finished with value: 0.2793354124979105 and parameters: {'model_type': 'graphsage', 'hidden_dims': '[128, 64]', 'dropout': 0.46183530490852126, 'batch_norm': True, 'sage_aggr': 'mean', 'sage_normalize': False, 'sage_project': False, 'lr': 0.0038097035081895887, 'weight_decay': 1.9727948298480606e-07, 'epochs': 131, 'loss': 'mse', 'optimizer': 'adam', 'graph_mode': 'cutoff', 'cutoff': 0.2830975790417234, 'grm_norm': 'cosine_then_gcn', 'self_loops': True, 'use_snp_selection': False}. Best is trial 79 with value: 0.29785602291757357.
[I 2025-12-08 23:13:35,998] Trial 0 finished with value: 0.25874625164842857 and parameters: {'model_type': 'graphsage', 'hidden_dims': '[128, 64]', 'dropout': 0.199031432379812, 'batch_norm': True, 'sage_aggr': 'max', 'sage_normalize': True, 'sage_project': False, 'lr': 0.00034401453323286885, 'weight_decay': 0.00017802616915745114, 'epochs': 230, 'loss': 'mse', 'optimizer': 'adam', 'graph_mode': 'knn', 'knn_k': 6, 'weighted_edges': True, 'symmetrize_mode': 'mutual', 'self_loops': True, 'use_snp_selection': False}. Best is trial 0 with value: 0.25874625164842857.
[I 2025-12-08 23:15:21,375] Trial 1 finished with value: 0.2761576922004835 and parameters: {'model_type': 'graphsage', 'hidden_dims': '[512, 128]', 'dropout': 0.2503500283181017, 'batch_norm': False, 'sage_aggr': 'max', 'sage_normalize': False, 'sage_project': False, 'lr': 3.952233718592099e-05, 'weight_decay': 0.00026754769258252603, 'epochs': 149, 'loss': 'mse', 'optimizer': 'adam', 'graph_mode': 'knn', 'knn_k': 2, 'weighted_edges': False, 'symmetrize_mode': 'mutual', 'self_loops': True, 'use_snp_selection': True, 'num_snps': 49915}. Best is trial 1 with value: 0.2761576922004835.
[I 2025-12-08 23:16:41,053] Trial 2 finished with value: 0.26371722013609056 and parameters: {'model_type': 'graphsage', 'hidden_dims': '[512, 256]', 'dropout': 0.2785908793172681, 'batch_norm': False, 'sage_aggr': 'max', 'sage_normalize': False, 'sage_project': False, 'lr': 8.806039223165805e-05, 'weight_decay': 3.5153176302760294e-05, 'epochs': 147, 'loss': 'mae', 'optimizer': 'adam', 'graph_mode': 'cutoff', 'cutoff': 0.4922564006874869, 'grm_norm': 'gcn', 'self_loops': False, 'use_snp_selection': True, 'num_snps': 34340}. Best is trial 1 with value: 0.2761576922004835.
[I 2025-12-08 23:17:58,458] Trial 3 finished with value: 0.27294211719577655 and parameters: {'model_type': 'graphsage', 'hidden_dims': '[256, 128, 64]', 'dropout': 0.3475243154412272, 'batch_norm': True, 'sage_aggr': 'max', 'sage_normalize': False, 'sage_project': False, 'lr': 1.6006331996938085e-05, 'weight_decay': 7.213121225589906e-06, 'epochs': 283, 'loss': 'mse', 'optimizer': 'adam', 'graph_mode': 'cutoff', 'cutoff': 0.5942334791449215, 'grm_norm': 'none', 'self_loops': True, 'use_snp_selection': False}. Best is trial 1 with value: 0.2761576922004835.
[I 2025-12-08 23:18:41,765] Trial 4 finished with value: 0.2637406240308042 and parameters: {'model_type': 'graphsage', 'hidden_dims': '[128, 64]', 'dropout': 0.3348926467202472, 'batch_norm': True, 'sage_aggr': 'max', 'sage_normalize': False, 'sage_project': False, 'lr': 0.0004238630400638802, 'weight_decay': 8.074086040046576e-07, 'epochs': 158, 'loss': 'mae', 'optimizer': 'adam', 'graph_mode': 'knn', 'knn_k': 1, 'weighted_edges': False, 'symmetrize_mode': 'mutual', 'self_loops': False, 'use_snp_selection': True, 'num_snps': 26850}. Best is trial 1 with value: 0.2761576922004835.
[I 2025-12-08 23:20:35,592] Trial 5 finished with value: 0.24640130897951748 and parameters: {'model_type': 'graphsage', 'hidden_dims': '[512, 64]', 'dropout': 0.14505336736221927, 'batch_norm': True, 'sage_aggr': 'mean', 'sage_normalize': True, 'sage_project': False, 'lr': 1.2962030165732234e-05, 'weight_decay': 1.326598071105465e-07, 'epochs': 180, 'loss': 'mse', 'optimizer': 'adam', 'graph_mode': 'knn', 'knn_k': 9, 'weighted_edges': True, 'symmetrize_mode': 'mutual', 'self_loops': False, 'use_snp_selection': False}. Best is trial 1 with value: 0.2761576922004835.
