[I 2025-12-09 01:14:59,983] Trial 73 finished with value: 0.3783740630792904 and parameters: {'model_type': 'graphsage', 'hidden_dims': '[256, 128]', 'dropout': 0.5112181834992632, 'batch_norm': True, 'sage_aggr': 'max', 'sage_normalize': False, 'sage_project': False, 'lr': 0.0018435904679769276, 'weight_decay': 1.8809820150218845e-07, 'epochs': 48, 'loss': 'mae', 'optimizer': 'adam', 'graph_mode': 'knn', 'knn_k': 8, 'weighted_edges': False, 'symmetrize_mode': 'union', 'self_loops': False, 'use_snp_selection': True, 'num_snps': 30514}. Best is trial 51 with value: 0.3878042477665546.
[I 2025-12-09 01:15:33,417] Trial 74 finished with value: 0.38111175047695606 and parameters: {'model_type': 'graphsage', 'hidden_dims': '[256, 128]', 'dropout': 0.5091540421051075, 'batch_norm': True, 'sage_aggr': 'max', 'sage_normalize': False, 'sage_project': False, 'lr': 0.0017805029431439004, 'weight_decay': 1.6879303050733414e-07, 'epochs': 48, 'loss': 'mae', 'optimizer': 'adam', 'graph_mode': 'knn', 'knn_k': 8, 'weighted_edges': False, 'symmetrize_mode': 'union', 'self_loops': False, 'use_snp_selection': True, 'num_snps': 24259}. Best is trial 51 with value: 0.3878042477665546.
[I 2025-12-09 01:16:06,017] Trial 75 finished with value: 0.366378193908791 and parameters: {'model_type': 'graphsage', 'hidden_dims': '[256, 128]', 'dropout': 0.4990701926801793, 'batch_norm': True, 'sage_aggr': 'max', 'sage_normalize': False, 'sage_project': False, 'lr': 0.004877168255097176, 'weight_decay': 3.4925261390354247e-07, 'epochs': 47, 'loss': 'mae', 'optimizer': 'adam', 'graph_mode': 'knn', 'knn_k': 9, 'weighted_edges': False, 'symmetrize_mode': 'union', 'self_loops': False, 'use_snp_selection': True, 'num_snps': 22958}. Best is trial 51 with value: 0.3878042477665546.
[I 2025-12-09 01:16:43,482] Trial 76 finished with value: 0.37554371881359544 and parameters: {'model_type': 'graphsage', 'hidden_dims': '[256, 128]', 'dropout': 0.5170410677506282, 'batch_norm': True, 'sage_aggr': 'max', 'sage_normalize': False, 'sage_project': False, 'lr': 0.0036486129991782227, 'weight_decay': 1.8875873060223392e-07, 'epochs': 60, 'loss': 'mae', 'optimizer': 'adam', 'graph_mode': 'knn', 'knn_k': 7, 'weighted_edges': False, 'symmetrize_mode': 'union', 'self_loops': False, 'use_snp_selection': True, 'num_snps': 24945}. Best is trial 51 with value: 0.3878042477665546.
[I 2025-12-09 01:16:59,682] Trial 77 finished with value: 0.3328027892619125 and parameters: {'model_type': 'graphsage', 'hidden_dims': '[256, 128]', 'dropout': 0.577327124156633, 'batch_norm': False, 'sage_aggr': 'mean', 'sage_normalize': True, 'sage_project': False, 'lr': 0.001784491111247253, 'weight_decay': 1.6107720520040395e-07, 'epochs': 47, 'loss': 'mae', 'optimizer': 'adam', 'graph_mode': 'cutoff', 'cutoff': 0.6965853323547048, 'grm_norm': 'cosine_then_gcn', 'self_loops': False, 'use_snp_selection': True, 'num_snps': 19887}. Best is trial 51 with value: 0.3878042477665546.
[I 2025-12-09 01:18:59,911] Trial 78 finished with value: 0.36870750292897486 and parameters: {'model_type': 'graphsage', 'hidden_dims': '[256, 128]', 'dropout': 0.46412859885432833, 'batch_norm': True, 'sage_aggr': 'max', 'sage_normalize': False, 'sage_project': False, 'lr': 0.002399862128646883, 'weight_decay': 3.220704820813435e-07, 'epochs': 204, 'loss': 'mae', 'optimizer': 'adam', 'graph_mode': 'knn', 'knn_k': 8, 'weighted_edges': False, 'symmetrize_mode': 'union', 'self_loops': False, 'use_snp_selection': True, 'num_snps': 27808}. Best is trial 51 with value: 0.3878042477665546.
[I 2025-12-09 01:20:09,712] Trial 79 finished with value: 0.32195809023572003 and parameters: {'model_type': 'graphsage', 'hidden_dims': '[256, 128]', 'dropout': 0.48142415257024507, 'batch_norm': True, 'sage_aggr': 'max', 'sage_normalize': False, 'sage_project': False, 'lr': 0.006942954401620615, 'weight_decay': 4.174928144729706e-07, 'epochs': 67, 'loss': 'mae', 'optimizer': 'adam', 'graph_mode': 'knn', 'knn_k': 10, 'weighted_edges': False, 'symmetrize_mode': 'union', 'self_loops': False, 'use_snp_selection': False}. Best is trial 51 with value: 0.3878042477665546.
[I 2025-12-09 01:20:30,507] Trial 80 finished with value: 0.3657888890256915 and parameters: {'model_type': 'graphsage', 'hidden_dims': '[128, 64]', 'dropout': 0.5512781425955061, 'batch_norm': True, 'sage_aggr': 'max', 'sage_normalize': False, 'sage_project': False, 'lr': 0.0015578400923511454, 'weight_decay': 5.80415771155613e-07, 'epochs': 40, 'loss': 'mae', 'optimizer': 'adam', 'graph_mode': 'knn', 'knn_k': 9, 'weighted_edges': False, 'symmetrize_mode': 'union', 'self_loops': True, 'use_snp_selection': True, 'num_snps': 16502}. Best is trial 51 with value: 0.3878042477665546.
[I 2025-12-09 01:21:33,473] Trial 81 finished with value: 0.3755601506663252 and parameters: {'model_type': 'graphsage', 'hidden_dims': '[512, 256]', 'dropout': 0.10508817630496436, 'batch_norm': True, 'sage_aggr': 'max', 'sage_normalize': False, 'sage_project': False, 'lr': 0.0008963944703807556, 'weight_decay': 1.2332221663521265e-07, 'epochs': 56, 'loss': 'mae', 'optimizer': 'adam', 'graph_mode': 'knn', 'knn_k': 8, 'weighted_edges': False, 'symmetrize_mode': 'union', 'self_loops': False, 'use_snp_selection': True, 'num_snps': 33410}. Best is trial 51 with value: 0.3878042477665546.
[I 2025-12-09 01:22:07,375] Trial 82 finished with value: 0.3771262852327013 and parameters: {'model_type': 'graphsage', 'hidden_dims': '[256, 128]', 'dropout': 0.514507643833758, 'batch_norm': True, 'sage_aggr': 'max', 'sage_normalize': False, 'sage_project': False, 'lr': 0.0006824510238118535, 'weight_decay': 2.6381483688464e-07, 'epochs': 48, 'loss': 'mae', 'optimizer': 'adam', 'graph_mode': 'knn', 'knn_k': 8, 'weighted_edges': False, 'symmetrize_mode': 'union', 'self_loops': False, 'use_snp_selection': True, 'num_snps': 24073}. Best is trial 51 with value: 0.3878042477665546.
[I 2025-12-09 01:23:37,135] Trial 83 finished with value: 0.35338142953297996 and parameters: {'model_type': 'graphsage', 'hidden_dims': '[256, 128]', 'dropout': 0.5118126655348904, 'batch_norm': True, 'sage_aggr': 'max', 'sage_normalize': False, 'sage_project': False, 'lr': 0.0006738198824647768, 'weight_decay': 2.661224416931301e-07, 'epochs': 47, 'loss': 'mae', 'optimizer': 'adam', 'graph_mode': 'knn', 'knn_k': 8, 'weighted_edges': False, 'symmetrize_mode': 'union', 'self_loops': False, 'use_snp_selection': True, 'num_snps': 59595}. Best is trial 51 with value: 0.3878042477665546.
[I 2025-12-09 01:24:13,807] Trial 84 finished with value: 0.3577466239280082 and parameters: {'model_type': 'graphsage', 'hidden_dims': '[256, 128]', 'dropout': 0.5406215572306147, 'batch_norm': True, 'sage_aggr': 'max', 'sage_normalize': False, 'sage_project': False, 'lr': 0.001992107316880598, 'weight_decay': 1.8743543069658323e-07, 'epochs': 60, 'loss': 'mae', 'optimizer': 'adam', 'graph_mode': 'knn', 'knn_k': 7, 'weighted_edges': False, 'symmetrize_mode': 'union', 'self_loops': False, 'use_snp_selection': True, 'num_snps': 24054}. Best is trial 51 with value: 0.3878042477665546.
[I 2025-12-09 01:24:46,671] Trial 85 finished with value: 0.3717981697324656 and parameters: {'model_type': 'graphsage', 'hidden_dims': '[256, 128]', 'dropout': 0.5213898775713932, 'batch_norm': True, 'sage_aggr': 'max', 'sage_normalize': False, 'sage_project': False, 'lr': 0.0014461477765571357, 'weight_decay': 1.2928669416154534e-07, 'epochs': 78, 'loss': 'mae', 'optimizer': 'adam', 'graph_mode': 'knn', 'knn_k': 8, 'weighted_edges': False, 'symmetrize_mode': 'union', 'self_loops': False, 'use_snp_selection': True, 'num_snps': 17981}. Best is trial 51 with value: 0.3878042477665546.
[I 2025-12-09 01:25:32,322] Trial 86 finished with value: 0.3835483890136555 and parameters: {'model_type': 'graphsage', 'hidden_dims': '[512, 64]', 'dropout': 0.4979257385818101, 'batch_norm': True, 'sage_aggr': 'max', 'sage_normalize': False, 'sage_project': False, 'lr': 0.0025792210548994405, 'weight_decay': 5.096160216630013e-07, 'epochs': 49, 'loss': 'mae', 'optimizer': 'adam', 'graph_mode': 'knn', 'knn_k': 9, 'weighted_edges': False, 'symmetrize_mode': 'union', 'self_loops': False, 'use_snp_selection': True, 'num_snps': 27015}. Best is trial 51 with value: 0.3878042477665546.
[I 2025-12-09 01:26:27,606] Trial 87 finished with value: 0.3828310598877467 and parameters: {'model_type': 'graphsage', 'hidden_dims': '[512, 64]', 'dropout': 0.45717877441522203, 'batch_norm': True, 'sage_aggr': 'max', 'sage_normalize': False, 'sage_project': False, 'lr': 0.0029554980311623023, 'weight_decay': 5.289114118280494e-07, 'epochs': 70, 'loss': 'mae', 'optimizer': 'adam', 'graph_mode': 'knn', 'knn_k': 9, 'weighted_edges': False, 'symmetrize_mode': 'union', 'self_loops': False, 'use_snp_selection': True, 'num_snps': 27197}. Best is trial 51 with value: 0.3878042477665546.
[I 2025-12-09 01:27:02,048] Trial 88 finished with value: 0.37752838230581864 and parameters: {'model_type': 'graphsage', 'hidden_dims': '[512, 64]', 'dropout': 0.4353626371138744, 'batch_norm': True, 'sage_aggr': 'max', 'sage_normalize': False, 'sage_project': False, 'lr': 0.002541073838110493, 'weight_decay': 1.7713816818696752e-06, 'epochs': 83, 'loss': 'mse', 'optimizer': 'adam', 'graph_mode': 'knn', 'knn_k': 9, 'weighted_edges': False, 'symmetrize_mode': 'union', 'self_loops': False, 'use_snp_selection': True, 'num_snps': 14970}. Best is trial 51 with value: 0.3878042477665546.
[I 2025-12-09 01:27:54,212] Trial 89 finished with value: 0.32493857227066586 and parameters: {'model_type': 'graphsage', 'hidden_dims': '[512, 64]', 'dropout': 0.5047393990899577, 'batch_norm': True, 'sage_aggr': 'max', 'sage_normalize': False, 'sage_project': False, 'lr': 1.9878664955671423e-05, 'weight_decay': 7.034638167019544e-07, 'epochs': 73, 'loss': 'mae', 'optimizer': 'adam', 'graph_mode': 'knn', 'knn_k': 10, 'weighted_edges': False, 'symmetrize_mode': 'mutual', 'self_loops': False, 'use_snp_selection': True, 'num_snps': 29752}. Best is trial 51 with value: 0.3878042477665546.
[I 2025-12-09 01:29:10,437] Trial 90 finished with value: 0.356883143751871 and parameters: {'model_type': 'graphsage', 'hidden_dims': '[512, 64]', 'dropout': 0.4571569814932715, 'batch_norm': True, 'sage_aggr': 'mean', 'sage_normalize': False, 'sage_project': False, 'lr': 0.004746442178041631, 'weight_decay': 4.879204000084062e-07, 'epochs': 102, 'loss': 'mae', 'optimizer': 'adam', 'graph_mode': 'knn', 'knn_k': 9, 'weighted_edges': False, 'symmetrize_mode': 'union', 'self_loops': False, 'use_snp_selection': True, 'num_snps': 26624}. Best is trial 51 with value: 0.3878042477665546.
[I 2025-12-09 01:30:09,934] Trial 91 finished with value: 0.38759342848426037 and parameters: {'model_type': 'graphsage', 'hidden_dims': '[512, 64]', 'dropout': 0.47964711610585953, 'batch_norm': True, 'sage_aggr': 'max', 'sage_normalize': False, 'sage_project': False, 'lr': 0.0031254320751772815, 'weight_decay': 3.698493397062109e-07, 'epochs': 63, 'loss': 'mae', 'optimizer': 'adam', 'graph_mode': 'knn', 'knn_k': 9, 'weighted_edges': False, 'symmetrize_mode': 'union', 'self_loops': False, 'use_snp_selection': True, 'num_snps': 28419}. Best is trial 51 with value: 0.3878042477665546.
[I 2025-12-09 01:30:45,716] Trial 92 finished with value: 0.38044544559589005 and parameters: {'model_type': 'graphsage', 'hidden_dims': '[512, 64]', 'dropout': 0.4907515406671545, 'batch_norm': True, 'sage_aggr': 'max', 'sage_normalize': False, 'sage_project': False, 'lr': 0.003682515625867751, 'weight_decay': 1.0279879130434975e-06, 'epochs': 55, 'loss': 'mae', 'optimizer': 'adam', 'graph_mode': 'knn', 'knn_k': 9, 'weighted_edges': False, 'symmetrize_mode': 'union', 'self_loops': False, 'use_snp_selection': True, 'num_snps': 20219}. Best is trial 51 with value: 0.3878042477665546.
[I 2025-12-09 01:31:29,257] Trial 93 finished with value: 0.38055859732009495 and parameters: {'model_type': 'graphsage', 'hidden_dims': '[512, 64]', 'dropout': 0.48620134418386823, 'batch_norm': True, 'sage_aggr': 'max', 'sage_normalize': False, 'sage_project': False, 'lr': 0.0035837132440218293, 'weight_decay': 1.0801243712353873e-06, 'epochs': 69, 'loss': 'mae', 'optimizer': 'adam', 'graph_mode': 'knn', 'knn_k': 10, 'weighted_edges': False, 'symmetrize_mode': 'union', 'self_loops': False, 'use_snp_selection': True, 'num_snps': 20248}. Best is trial 51 with value: 0.3878042477665546.
[I 2025-12-09 01:32:06,589] Trial 94 finished with value: 0.3795884874060634 and parameters: {'model_type': 'graphsage', 'hidden_dims': '[512, 64]', 'dropout': 0.48146196885573267, 'batch_norm': True, 'sage_aggr': 'max', 'sage_normalize': False, 'sage_project': False, 'lr': 0.0035558819748645015, 'weight_decay': 2.789414277460013e-06, 'epochs': 55, 'loss': 'mae', 'optimizer': 'adam', 'graph_mode': 'knn', 'knn_k': 10, 'weighted_edges': False, 'symmetrize_mode': 'union', 'self_loops': False, 'use_snp_selection': True, 'num_snps': 20320}. Best is trial 51 with value: 0.3878042477665546.
[I 2025-12-09 01:33:00,061] Trial 95 finished with value: 0.377108781574848 and parameters: {'model_type': 'graphsage', 'hidden_dims': '[512, 64]', 'dropout': 0.47735814760260875, 'batch_norm': True, 'sage_aggr': 'max', 'sage_normalize': False, 'sage_project': False, 'lr': 0.0037392533589982366, 'weight_decay': 1.046647419198274e-06, 'epochs': 89, 'loss': 'mae', 'optimizer': 'adam', 'graph_mode': 'knn', 'knn_k': 10, 'weighted_edges': True, 'symmetrize_mode': 'union', 'self_loops': False, 'use_snp_selection': True, 'num_snps': 20437}. Best is trial 51 with value: 0.3878042477665546.
[I 2025-12-09 01:33:41,018] Trial 96 finished with value: 0.27790733027164816 and parameters: {'model_type': 'graphsage', 'hidden_dims': '[512, 64]', 'dropout': 0.4548005943150732, 'batch_norm': False, 'sage_aggr': 'max', 'sage_normalize': True, 'sage_project': False, 'lr': 0.006343928595662537, 'weight_decay': 2.2419761906646385e-06, 'epochs': 69, 'loss': 'mae', 'optimizer': 'adam', 'graph_mode': 'knn', 'knn_k': 10, 'weighted_edges': False, 'symmetrize_mode': 'union', 'self_loops': False, 'use_snp_selection': True, 'num_snps': 19110}. Best is trial 51 with value: 0.3878042477665546.
[I 2025-12-09 01:34:01,797] Trial 97 finished with value: 0.3558130460235668 and parameters: {'model_type': 'graphsage', 'hidden_dims': '[512, 64]', 'dropout': 0.13998629479015215, 'batch_norm': True, 'sage_aggr': 'max', 'sage_normalize': False, 'sage_project': False, 'lr': 0.003129436662152681, 'weight_decay': 1.1896298906895387e-05, 'epochs': 58, 'loss': 'mae', 'optimizer': 'adam', 'graph_mode': 'cutoff', 'cutoff': 0.316655129672926, 'grm_norm': 'none', 'self_loops': True, 'use_snp_selection': True, 'num_snps': 13163}. Best is trial 51 with value: 0.3878042477665546.
[I 2025-12-09 01:35:25,475] Trial 98 finished with value: 0.3488634798847106 and parameters: {'model_type': 'graphsage', 'hidden_dims': '[512, 64]', 'dropout': 0.4160455295571196, 'batch_norm': True, 'sage_aggr': 'max', 'sage_normalize': False, 'sage_project': False, 'lr': 0.004242795057031335, 'weight_decay': 2.4595162632044913e-06, 'epochs': 63, 'loss': 'mae', 'optimizer': 'adam', 'graph_mode': 'knn', 'knn_k': 10, 'weighted_edges': False, 'symmetrize_mode': 'union', 'self_loops': False, 'use_snp_selection': False}. Best is trial 51 with value: 0.3878042477665546.
[I 2025-12-09 01:35:59,368] Trial 99 finished with value: 0.36177371287281984 and parameters: {'model_type': 'graphsage', 'hidden_dims': '[512, 64]', 'dropout': 0.42519681581368896, 'batch_norm': True, 'sage_aggr': 'max', 'sage_normalize': False, 'sage_project': False, 'lr': 0.005705186742188703, 'weight_decay': 1.1449501995674906e-06, 'epochs': 40, 'loss': 'mae', 'optimizer': 'adam', 'graph_mode': 'knn', 'knn_k': 10, 'weighted_edges': False, 'symmetrize_mode': 'union', 'self_loops': False, 'use_snp_selection': True, 'num_snps': 22018}. Best is trial 51 with value: 0.3878042477665546.
[I 2025-12-09 01:38:50,540] Trial 100 finished with value: 0.3758791579953994 and parameters: {'model_type': 'graphsage', 'hidden_dims': '[512, 64]', 'dropout': 0.47526014348477613, 'batch_norm': True, 'sage_aggr': 'max', 'sage_normalize': False, 'sage_project': False, 'lr': 0.008498740838064964, 'weight_decay': 1.6866445455629862e-06, 'epochs': 345, 'loss': 'mae', 'optimizer': 'adam', 'graph_mode': 'knn', 'knn_k': 10, 'weighted_edges': False, 'symmetrize_mode': 'union', 'self_loops': False, 'use_snp_selection': True, 'num_snps': 20807}. Best is trial 51 with value: 0.3878042477665546.
[I 2025-12-09 01:39:38,311] Trial 101 finished with value: 0.3913775485011878 and parameters: {'model_type': 'graphsage', 'hidden_dims': '[512, 64]', 'dropout': 0.4966785433948242, 'batch_norm': True, 'sage_aggr': 'max', 'sage_normalize': False, 'sage_project': False, 'lr': 0.002765249069386361, 'weight_decay': 3.7925196932724976e-07, 'epochs': 54, 'loss': 'mae', 'optimizer': 'adam', 'graph_mode': 'knn', 'knn_k': 9, 'weighted_edges': False, 'symmetrize_mode': 'union', 'self_loops': False, 'use_snp_selection': True, 'num_snps': 25281}. Best is trial 101 with value: 0.3913775485011878.
[I 2025-12-09 01:40:27,181] Trial 102 finished with value: 0.3893741020351681 and parameters: {'model_type': 'graphsage', 'hidden_dims': '[512, 64]', 'dropout': 0.4975319714523537, 'batch_norm': True, 'sage_aggr': 'max', 'sage_normalize': False, 'sage_project': False, 'lr': 0.0034490028095883443, 'weight_decay': 1.3754261652911097e-06, 'epochs': 55, 'loss': 'mae', 'optimizer': 'adam', 'graph_mode': 'knn', 'knn_k': 9, 'weighted_edges': False, 'symmetrize_mode': 'union', 'self_loops': False, 'use_snp_selection': True, 'num_snps': 25449}. Best is trial 101 with value: 0.3913775485011878.
[I 2025-12-09 01:41:21,330] Trial 103 finished with value: 0.3852534612267796 and parameters: {'model_type': 'graphsage', 'hidden_dims': '[512, 64]', 'dropout': 0.49481734373971686, 'batch_norm': True, 'sage_aggr': 'max', 'sage_normalize': False, 'sage_project': False, 'lr': 0.0026097416159167157, 'weight_decay': 3.526903242577655e-07, 'epochs': 71, 'loss': 'mae', 'optimizer': 'adam', 'graph_mode': 'knn', 'knn_k': 9, 'weighted_edges': False, 'symmetrize_mode': 'union', 'self_loops': False, 'use_snp_selection': True, 'num_snps': 24641}. Best is trial 101 with value: 0.3913775485011878.
[I 2025-12-09 01:42:19,049] Trial 104 finished with value: 0.3800964724826265 and parameters: {'model_type': 'graphsage', 'hidden_dims': '[512, 64]', 'dropout': 0.43779894673874153, 'batch_norm': True, 'sage_aggr': 'max', 'sage_normalize': False, 'sage_project': False, 'lr': 0.002712929280993089, 'weight_decay': 3.560816961720966e-07, 'epochs': 70, 'loss': 'mae', 'optimizer': 'adam', 'graph_mode': 'knn', 'knn_k': 9, 'weighted_edges': False, 'symmetrize_mode': 'union', 'self_loops': False, 'use_snp_selection': True, 'num_snps': 25676}. Best is trial 101 with value: 0.3913775485011878.
[I 2025-12-09 01:43:25,429] Trial 105 finished with value: 0.38320746328950195 and parameters: {'model_type': 'graphsage', 'hidden_dims': '[512, 64]', 'dropout': 0.4990307638983116, 'batch_norm': True, 'sage_aggr': 'max', 'sage_normalize': False, 'sage_project': False, 'lr': 0.0022945383009007375, 'weight_decay': 5.571059235189475e-07, 'epochs': 83, 'loss': 'mae', 'optimizer': 'adam', 'graph_mode': 'knn', 'knn_k': 9, 'weighted_edges': False, 'symmetrize_mode': 'union', 'self_loops': False, 'use_snp_selection': True, 'num_snps': 25250}. Best is trial 101 with value: 0.3913775485011878.
[I 2025-12-09 01:44:09,842] Trial 106 finished with value: 0.3568133919429489 and parameters: {'model_type': 'graphsage', 'hidden_dims': '[512, 64]', 'dropout': 0.4980904071910108, 'batch_norm': True, 'sage_aggr': 'max', 'sage_normalize': False, 'sage_project': False, 'lr': 0.0022442972661748544, 'weight_decay': 6.06204900414177e-07, 'epochs': 83, 'loss': 'mse', 'optimizer': 'adam', 'graph_mode': 'knn', 'knn_k': 9, 'weighted_edges': False, 'symmetrize_mode': 'mutual', 'self_loops': False, 'use_snp_selection': True, 'num_snps': 25039}. Best is trial 101 with value: 0.3913775485011878.
[I 2025-12-09 01:45:09,378] Trial 107 finished with value: 0.38668640555443434 and parameters: {'model_type': 'graphsage', 'hidden_dims': '[512, 64]', 'dropout': 0.4702814686012794, 'batch_norm': True, 'sage_aggr': 'max', 'sage_normalize': False, 'sage_project': False, 'lr': 0.0028306806734556106, 'weight_decay': 4.831534675903611e-07, 'epochs': 78, 'loss': 'mae', 'optimizer': 'adam', 'graph_mode': 'knn', 'knn_k': 9, 'weighted_edges': False, 'symmetrize_mode': 'union', 'self_loops': False, 'use_snp_selection': True, 'num_snps': 27325}. Best is trial 101 with value: 0.3913775485011878.
[I 2025-12-09 01:46:13,180] Trial 108 finished with value: 0.35182855211478925 and parameters: {'model_type': 'graphsage', 'hidden_dims': '[512, 64]', 'dropout': 0.4683553409112635, 'batch_norm': True, 'sage_aggr': 'mean', 'sage_normalize': False, 'sage_project': False, 'lr': 0.002788490148767864, 'weight_decay': 4.685932725579272e-07, 'epochs': 95, 'loss': 'mae', 'optimizer': 'adam', 'graph_mode': 'knn', 'knn_k': 9, 'weighted_edges': False, 'symmetrize_mode': 'union', 'self_loops': False, 'use_snp_selection': True, 'num_snps': 27176}. Best is trial 101 with value: 0.3913775485011878.
[I 2025-12-09 01:47:35,294] Trial 109 finished with value: 0.2614109798769264 and parameters: {'model_type': 'graphsage', 'hidden_dims': '[512, 64]', 'dropout': 0.45236790156724815, 'batch_norm': False, 'sage_aggr': 'max', 'sage_normalize': True, 'sage_project': False, 'lr': 0.0032152872762882807, 'weight_decay': 5.898932159189437e-06, 'epochs': 90, 'loss': 'mae', 'optimizer': 'adam', 'graph_mode': 'knn', 'knn_k': 9, 'weighted_edges': True, 'symmetrize_mode': 'union', 'self_loops': False, 'use_snp_selection': True, 'num_snps': 28607}. Best is trial 101 with value: 0.3913775485011878.
