[I 2025-12-08 13:01:04,903] Trial 113 finished with value: 0.27733523455444054 and parameters: {'model_type': 'graphsage', 'hidden_dims': '[512, 128]', 'dropout': 0.17217477475274084, 'batch_norm': True, 'sage_aggr': 'mean', 'sage_normalize': True, 'sage_project': False, 'lr': 0.0002745596716659936, 'weight_decay': 0.00027858761203901046, 'epochs': 206, 'loss': 'mse', 'optimizer': 'adam', 'graph_mode': 'cutoff', 'cutoff': 0.5190311950595075, 'grm_norm': 'cosine', 'self_loops': True, 'use_snp_selection': False}. Best is trial 103 with value: 0.28128692543870815.
[I 2025-12-08 13:02:38,452] Trial 114 finished with value: 0.2791915804195384 and parameters: {'model_type': 'graphsage', 'hidden_dims': '[512, 128]', 'dropout': 0.15165169036830092, 'batch_norm': True, 'sage_aggr': 'mean', 'sage_normalize': True, 'sage_project': False, 'lr': 0.00041586771048139425, 'weight_decay': 0.0002564826834089567, 'epochs': 185, 'loss': 'mse', 'optimizer': 'adam', 'graph_mode': 'cutoff', 'cutoff': 0.53278902873773, 'grm_norm': 'cosine', 'self_loops': True, 'use_snp_selection': False}. Best is trial 103 with value: 0.28128692543870815.
[I 2025-12-08 13:03:31,835] Trial 115 finished with value: 0.26782983813107925 and parameters: {'model_type': 'graphsage', 'hidden_dims': '[256, 128]', 'dropout': 0.17717123951592006, 'batch_norm': True, 'sage_aggr': 'mean', 'sage_normalize': True, 'sage_project': False, 'lr': 0.0004631375098819289, 'weight_decay': 0.0006767632337923438, 'epochs': 177, 'loss': 'mse', 'optimizer': 'adam', 'graph_mode': 'cutoff', 'cutoff': 0.5745027085019733, 'grm_norm': 'cosine', 'self_loops': True, 'use_snp_selection': False}. Best is trial 103 with value: 0.28128692543870815.
[I 2025-12-08 13:05:03,980] Trial 116 finished with value: 0.2745776772384162 and parameters: {'model_type': 'graphsage', 'hidden_dims': '[512, 128]', 'dropout': 0.35984630967765563, 'batch_norm': True, 'sage_aggr': 'mean', 'sage_normalize': True, 'sage_project': False, 'lr': 0.00011331596217716118, 'weight_decay': 0.00023215232566740738, 'epochs': 183, 'loss': 'mse', 'optimizer': 'adam', 'graph_mode': 'cutoff', 'cutoff': 0.5477035416690995, 'grm_norm': 'cosine', 'self_loops': True, 'use_snp_selection': False}. Best is trial 103 with value: 0.28128692543870815.
[I 2025-12-08 13:06:49,981] Trial 117 finished with value: 0.2783570336822192 and parameters: {'model_type': 'graphsage', 'hidden_dims': '[512, 128]', 'dropout': 0.10519255517751552, 'batch_norm': True, 'sage_aggr': 'mean', 'sage_normalize': True, 'sage_project': False, 'lr': 0.000334826073769588, 'weight_decay': 0.0004913698990514592, 'epochs': 194, 'loss': 'mse', 'optimizer': 'adam', 'graph_mode': 'cutoff', 'cutoff': 0.47491058190466195, 'grm_norm': 'none', 'self_loops': True, 'use_snp_selection': False}. Best is trial 103 with value: 0.28128692543870815.
[I 2025-12-08 13:07:57,824] Trial 118 finished with value: 0.2739747000555795 and parameters: {'model_type': 'graphsage', 'hidden_dims': '[256, 128, 64]', 'dropout': 0.1441345832961185, 'batch_norm': True, 'sage_aggr': 'mean', 'sage_normalize': True, 'sage_project': False, 'lr': 0.00021865693510087264, 'weight_decay': 0.0004181581361305193, 'epochs': 225, 'loss': 'mse', 'optimizer': 'adam', 'graph_mode': 'cutoff', 'cutoff': 0.5210548852983924, 'grm_norm': 'cosine', 'self_loops': True, 'use_snp_selection': False}. Best is trial 103 with value: 0.28128692543870815.
[I 2025-12-08 13:09:51,280] Trial 119 finished with value: 0.27832274323229944 and parameters: {'model_type': 'graphsage', 'hidden_dims': '[512, 128]', 'dropout': 0.1290416779673937, 'batch_norm': True, 'sage_aggr': 'mean', 'sage_normalize': True, 'sage_project': False, 'lr': 0.00028524714540808485, 'weight_decay': 0.0005983722509850634, 'epochs': 216, 'loss': 'mse', 'optimizer': 'adam', 'graph_mode': 'cutoff', 'cutoff': 0.495492967697249, 'grm_norm': 'cosine', 'self_loops': True, 'use_snp_selection': False}. Best is trial 103 with value: 0.28128692543870815.
[I 2025-12-08 13:11:36,101] Trial 120 finished with value: 0.27947239964859694 and parameters: {'model_type': 'graphsage', 'hidden_dims': '[512, 64]', 'dropout': 0.12867907077182061, 'batch_norm': True, 'sage_aggr': 'mean', 'sage_normalize': True, 'sage_project': False, 'lr': 0.00016511948856415493, 'weight_decay': 7.653134008638191e-05, 'epochs': 208, 'loss': 'mse', 'optimizer': 'adam', 'graph_mode': 'cutoff', 'cutoff': 0.5352713801506209, 'grm_norm': 'gcn', 'self_loops': True, 'use_snp_selection': False}. Best is trial 103 with value: 0.28128692543870815.
[I 2025-12-08 13:13:15,647] Trial 121 finished with value: 0.27637833016724395 and parameters: {'model_type': 'graphsage', 'hidden_dims': '[512, 64]', 'dropout': 0.12586454904324676, 'batch_norm': True, 'sage_aggr': 'mean', 'sage_normalize': True, 'sage_project': False, 'lr': 0.00038947169579337204, 'weight_decay': 7.473045652579933e-05, 'epochs': 204, 'loss': 'mse', 'optimizer': 'adam', 'graph_mode': 'cutoff', 'cutoff': 0.5968556861337121, 'grm_norm': 'gcn', 'self_loops': True, 'use_snp_selection': False}. Best is trial 103 with value: 0.28128692543870815.
[I 2025-12-08 13:14:51,096] Trial 122 finished with value: 0.27624000920456127 and parameters: {'model_type': 'graphsage', 'hidden_dims': '[512, 64]', 'dropout': 0.14521725608963026, 'batch_norm': True, 'sage_aggr': 'mean', 'sage_normalize': True, 'sage_project': False, 'lr': 0.0001723661223733437, 'weight_decay': 0.0002727007068588535, 'epochs': 186, 'loss': 'mse', 'optimizer': 'adam', 'graph_mode': 'cutoff', 'cutoff': 0.5315018404789785, 'grm_norm': 'gcn', 'self_loops': True, 'use_snp_selection': False}. Best is trial 103 with value: 0.28128692543870815.
[I 2025-12-08 13:16:34,773] Trial 123 finished with value: 0.271604952457598 and parameters: {'model_type': 'graphsage', 'hidden_dims': '[512, 64]', 'dropout': 0.1185979672259165, 'batch_norm': True, 'sage_aggr': 'mean', 'sage_normalize': True, 'sage_project': False, 'lr': 0.00017881786607054425, 'weight_decay': 5.80207421326867e-05, 'epochs': 210, 'loss': 'mse', 'optimizer': 'adam', 'graph_mode': 'cutoff', 'cutoff': 0.5589171705857066, 'grm_norm': 'gcn', 'self_loops': True, 'use_snp_selection': False}. Best is trial 103 with value: 0.28128692543870815.
[I 2025-12-08 13:18:21,856] Trial 124 finished with value: 0.2803320023621114 and parameters: {'model_type': 'graphsage', 'hidden_dims': '[512, 64]', 'dropout': 0.16171893715081212, 'batch_norm': True, 'sage_aggr': 'mean', 'sage_normalize': True, 'sage_project': False, 'lr': 0.0001369072407507562, 'weight_decay': 0.0001209032769758693, 'epochs': 196, 'loss': 'mse', 'optimizer': 'adam', 'graph_mode': 'cutoff', 'cutoff': 0.46597547073467493, 'grm_norm': 'cosine', 'self_loops': True, 'use_snp_selection': False}. Best is trial 103 with value: 0.28128692543870815.
[I 2025-12-08 13:19:04,113] Trial 125 finished with value: 0.26426345780953353 and parameters: {'model_type': 'graphsage', 'hidden_dims': '[512, 64]', 'dropout': 0.16194413070836705, 'batch_norm': True, 'sage_aggr': 'mean', 'sage_normalize': True, 'sage_project': False, 'lr': 0.00014905241703939937, 'weight_decay': 0.00013276836062763297, 'epochs': 198, 'loss': 'mse', 'optimizer': 'adam', 'graph_mode': 'cutoff', 'cutoff': 0.46426735321048457, 'grm_norm': 'cosine', 'self_loops': True, 'use_snp_selection': True, 'num_snps': 8068}. Best is trial 103 with value: 0.28128692543870815.
[I 2025-12-08 13:21:02,908] Trial 126 finished with value: 0.27482430418184634 and parameters: {'model_type': 'graphsage', 'hidden_dims': '[512, 64]', 'dropout': 0.18957877127772882, 'batch_norm': True, 'sage_aggr': 'mean', 'sage_normalize': True, 'sage_project': False, 'lr': 0.0001501367769488112, 'weight_decay': 0.00019080923525647804, 'epochs': 218, 'loss': 'mse', 'optimizer': 'adam', 'graph_mode': 'cutoff', 'cutoff': 0.4144398704220064, 'grm_norm': 'cosine', 'self_loops': True, 'use_snp_selection': False}. Best is trial 103 with value: 0.28128692543870815.
[I 2025-12-08 13:23:00,638] Trial 127 finished with value: 0.25517445123605836 and parameters: {'model_type': 'graphsage', 'hidden_dims': '[512, 64]', 'dropout': 0.15405024803710599, 'batch_norm': True, 'sage_aggr': 'max', 'sage_normalize': True, 'sage_project': False, 'lr': 9.858817544270165e-05, 'weight_decay': 0.00010674579579995493, 'epochs': 194, 'loss': 'mse', 'optimizer': 'adam', 'graph_mode': 'knn', 'knn_k': 5, 'weighted_edges': True, 'symmetrize_mode': 'mutual', 'self_loops': True, 'use_snp_selection': False}. Best is trial 103 with value: 0.28128692543870815.
[I 2025-12-08 13:24:35,246] Trial 128 finished with value: 0.27612799188187914 and parameters: {'model_type': 'graphsage', 'hidden_dims': '[512, 64]', 'dropout': 0.11393617130694855, 'batch_norm': True, 'sage_aggr': 'mean', 'sage_normalize': True, 'sage_project': False, 'lr': 0.00040394153513071497, 'weight_decay': 0.00015457176316885246, 'epochs': 165, 'loss': 'mse', 'optimizer': 'adam', 'graph_mode': 'cutoff', 'cutoff': 0.3762460905835093, 'grm_norm': 'cosine', 'self_loops': True, 'use_snp_selection': False}. Best is trial 103 with value: 0.28128692543870815.
[I 2025-12-08 13:26:17,929] Trial 129 finished with value: 0.24207072533323287 and parameters: {'model_type': 'graphsage', 'hidden_dims': '[512, 64]', 'dropout': 0.1995387153572652, 'batch_norm': False, 'sage_aggr': 'mean', 'sage_normalize': True, 'sage_project': False, 'lr': 0.0005717719405434973, 'weight_decay': 7.889508418483477e-05, 'epochs': 207, 'loss': 'mae', 'optimizer': 'adam', 'graph_mode': 'cutoff', 'cutoff': 0.5374842684042528, 'grm_norm': 'cosine', 'self_loops': True, 'use_snp_selection': False}. Best is trial 103 with value: 0.28128692543870815.
[I 2025-12-08 13:28:24,146] Trial 130 finished with value: 0.278063535166992 and parameters: {'model_type': 'graphsage', 'hidden_dims': '[512, 128]', 'dropout': 0.14108521510913752, 'batch_norm': True, 'sage_aggr': 'mean', 'sage_normalize': True, 'sage_project': False, 'lr': 0.00020508168517914747, 'weight_decay': 6.991818300769995e-05, 'epochs': 231, 'loss': 'mse', 'optimizer': 'adam', 'graph_mode': 'cutoff', 'cutoff': 0.40019462659833727, 'grm_norm': 'cosine', 'self_loops': True, 'use_snp_selection': False}. Best is trial 103 with value: 0.28128692543870815.
[I 2025-12-08 13:30:05,991] Trial 131 finished with value: 0.28359546726582063 and parameters: {'model_type': 'graphsage', 'hidden_dims': '[512, 128]', 'dropout': 0.15872211071060172, 'batch_norm': True, 'sage_aggr': 'mean', 'sage_normalize': True, 'sage_project': False, 'lr': 0.0001181194010706604, 'weight_decay': 0.0003121054250317211, 'epochs': 192, 'loss': 'mse', 'optimizer': 'adam', 'graph_mode': 'cutoff', 'cutoff': 0.5051336255421914, 'grm_norm': 'gcn', 'self_loops': True, 'use_snp_selection': False}. Best is trial 131 with value: 0.28359546726582063.
[I 2025-12-08 13:31:56,019] Trial 132 finished with value: 0.28106512661227145 and parameters: {'model_type': 'graphsage', 'hidden_dims': '[512, 128]', 'dropout': 0.1758301571467072, 'batch_norm': True, 'sage_aggr': 'mean', 'sage_normalize': True, 'sage_project': False, 'lr': 0.00013297677868273072, 'weight_decay': 0.0003236425831535176, 'epochs': 201, 'loss': 'mse', 'optimizer': 'adam', 'graph_mode': 'cutoff', 'cutoff': 0.4530945518545204, 'grm_norm': 'cosine', 'self_loops': True, 'use_snp_selection': False}. Best is trial 131 with value: 0.28359546726582063.
[I 2025-12-08 13:33:45,725] Trial 133 finished with value: 0.27037807659483787 and parameters: {'model_type': 'graphsage', 'hidden_dims': '[512, 128]', 'dropout': 0.43153185268831795, 'batch_norm': True, 'sage_aggr': 'mean', 'sage_normalize': True, 'sage_project': False, 'lr': 0.00010632049712525063, 'weight_decay': 0.00033423821803000995, 'epochs': 201, 'loss': 'mse', 'optimizer': 'adam', 'graph_mode': 'cutoff', 'cutoff': 0.4564421085510782, 'grm_norm': 'cosine', 'self_loops': True, 'use_snp_selection': False}. Best is trial 131 with value: 0.28359546726582063.
[I 2025-12-08 13:35:42,339] Trial 134 finished with value: 0.27714592883331196 and parameters: {'model_type': 'graphsage', 'hidden_dims': '[512, 128]', 'dropout': 0.16638324185133935, 'batch_norm': True, 'sage_aggr': 'mean', 'sage_normalize': True, 'sage_project': False, 'lr': 6.603578169391058e-05, 'weight_decay': 0.0004440242996034298, 'epochs': 214, 'loss': 'mse', 'optimizer': 'adam', 'graph_mode': 'cutoff', 'cutoff': 0.4337978112701426, 'grm_norm': 'cosine', 'self_loops': True, 'use_snp_selection': False}. Best is trial 131 with value: 0.28359546726582063.
[I 2025-12-08 13:37:26,808] Trial 135 finished with value: 0.28142097288935725 and parameters: {'model_type': 'graphsage', 'hidden_dims': '[512, 256]', 'dropout': 0.1865852330242629, 'batch_norm': True, 'sage_aggr': 'mean', 'sage_normalize': True, 'sage_project': False, 'lr': 0.00012559040470487207, 'weight_decay': 9.078934717215153e-05, 'epochs': 190, 'loss': 'mse', 'optimizer': 'adam', 'graph_mode': 'cutoff', 'cutoff': 0.47316185770662306, 'grm_norm': 'cosine', 'self_loops': True, 'use_snp_selection': False}. Best is trial 131 with value: 0.28359546726582063.
[I 2025-12-08 13:39:04,543] Trial 136 finished with value: 0.27618331848075495 and parameters: {'model_type': 'graphsage', 'hidden_dims': '[512, 256]', 'dropout': 0.1879700313451813, 'batch_norm': True, 'sage_aggr': 'mean', 'sage_normalize': True, 'sage_project': False, 'lr': 0.00012798061214599796, 'weight_decay': 0.000366047058722657, 'epochs': 188, 'loss': 'mse', 'optimizer': 'adam', 'graph_mode': 'cutoff', 'cutoff': 0.5095275389034803, 'grm_norm': 'cosine', 'self_loops': True, 'use_snp_selection': False}. Best is trial 131 with value: 0.28359546726582063.
[I 2025-12-08 13:41:00,300] Trial 137 finished with value: 0.27976865999008876 and parameters: {'model_type': 'graphsage', 'hidden_dims': '[512, 256]', 'dropout': 0.13813140923990527, 'batch_norm': True, 'sage_aggr': 'mean', 'sage_normalize': True, 'sage_project': False, 'lr': 8.769528918304663e-05, 'weight_decay': 0.00021729004405895283, 'epochs': 210, 'loss': 'mse', 'optimizer': 'adam', 'graph_mode': 'cutoff', 'cutoff': 0.4204208265001534, 'grm_norm': 'gcn', 'self_loops': True, 'use_snp_selection': False}. Best is trial 131 with value: 0.28359546726582063.
[I 2025-12-08 13:43:00,443] Trial 138 finished with value: 0.286811195756391 and parameters: {'model_type': 'graphsage', 'hidden_dims': '[512, 256]', 'dropout': 0.13555745196738692, 'batch_norm': True, 'sage_aggr': 'mean', 'sage_normalize': True, 'sage_project': False, 'lr': 7.477019184746412e-05, 'weight_decay': 0.000115561102326897, 'epochs': 223, 'loss': 'mse', 'optimizer': 'adam', 'graph_mode': 'cutoff', 'cutoff': 0.4748701593214047, 'grm_norm': 'gcn', 'self_loops': True, 'use_snp_selection': False}. Best is trial 138 with value: 0.286811195756391.
[I 2025-12-08 13:45:00,221] Trial 139 finished with value: 0.27617359675284303 and parameters: {'model_type': 'graphsage', 'hidden_dims': '[512, 256]', 'dropout': 0.10046461296565734, 'batch_norm': True, 'sage_aggr': 'mean', 'sage_normalize': True, 'sage_project': False, 'lr': 8.5124114105707e-05, 'weight_decay': 0.00010083894340828991, 'epochs': 223, 'loss': 'mse', 'optimizer': 'adam', 'graph_mode': 'cutoff', 'cutoff': 0.4800832205547192, 'grm_norm': 'gcn', 'self_loops': True, 'use_snp_selection': False}. Best is trial 138 with value: 0.286811195756391.
[I 2025-12-08 13:47:07,820] Trial 140 finished with value: 0.2788724394395543 and parameters: {'model_type': 'graphsage', 'hidden_dims': '[512, 256]', 'dropout': 0.11905578192813424, 'batch_norm': True, 'sage_aggr': 'mean', 'sage_normalize': True, 'sage_project': False, 'lr': 7.67329874408461e-05, 'weight_decay': 0.00016237582094892955, 'epochs': 234, 'loss': 'mse', 'optimizer': 'adam', 'graph_mode': 'cutoff', 'cutoff': 0.4206271888028897, 'grm_norm': 'gcn', 'self_loops': True, 'use_snp_selection': False}. Best is trial 138 with value: 0.286811195756391.
[I 2025-12-08 13:49:02,376] Trial 141 finished with value: 0.2864055811531194 and parameters: {'model_type': 'graphsage', 'hidden_dims': '[512, 256]', 'dropout': 0.13641637195244885, 'batch_norm': True, 'sage_aggr': 'mean', 'sage_normalize': True, 'sage_project': False, 'lr': 0.00012602557261031676, 'weight_decay': 0.00012582448143234272, 'epochs': 211, 'loss': 'mse', 'optimizer': 'adam', 'graph_mode': 'cutoff', 'cutoff': 0.47226454864496276, 'grm_norm': 'gcn', 'self_loops': True, 'use_snp_selection': False}. Best is trial 138 with value: 0.286811195756391.
[I 2025-12-08 13:50:56,956] Trial 142 finished with value: 0.2770681531046063 and parameters: {'model_type': 'graphsage', 'hidden_dims': '[512, 256]', 'dropout': 0.1433336680257901, 'batch_norm': True, 'sage_aggr': 'mean', 'sage_normalize': True, 'sage_project': False, 'lr': 0.00012465816547782473, 'weight_decay': 0.00011366713560154222, 'epochs': 211, 'loss': 'mse', 'optimizer': 'adam', 'graph_mode': 'cutoff', 'cutoff': 0.4697737470697876, 'grm_norm': 'gcn', 'self_loops': True, 'use_snp_selection': False}. Best is trial 138 with value: 0.286811195756391.
[I 2025-12-08 13:52:56,964] Trial 143 finished with value: 0.28189968264658233 and parameters: {'model_type': 'graphsage', 'hidden_dims': '[512, 256]', 'dropout': 0.124177293617519, 'batch_norm': True, 'sage_aggr': 'mean', 'sage_normalize': True, 'sage_project': False, 'lr': 5.570550492476287e-05, 'weight_decay': 0.00011997273440219692, 'epochs': 221, 'loss': 'mse', 'optimizer': 'adam', 'graph_mode': 'cutoff', 'cutoff': 0.45365984385737296, 'grm_norm': 'gcn', 'self_loops': True, 'use_snp_selection': False}. Best is trial 138 with value: 0.286811195756391.
[I 2025-12-08 13:54:56,149] Trial 144 finished with value: 0.285326112804802 and parameters: {'model_type': 'graphsage', 'hidden_dims': '[512, 256]', 'dropout': 0.12414077509464642, 'batch_norm': True, 'sage_aggr': 'mean', 'sage_normalize': True, 'sage_project': False, 'lr': 5.1089268526279485e-05, 'weight_decay': 8.876612631871754e-05, 'epochs': 219, 'loss': 'mse', 'optimizer': 'adam', 'graph_mode': 'cutoff', 'cutoff': 0.4501457827994181, 'grm_norm': 'gcn', 'self_loops': True, 'use_snp_selection': False}. Best is trial 138 with value: 0.286811195756391.
[I 2025-12-08 13:56:58,014] Trial 145 finished with value: 0.277971527006915 and parameters: {'model_type': 'graphsage', 'hidden_dims': '[512, 256]', 'dropout': 0.13536499157558105, 'batch_norm': True, 'sage_aggr': 'mean', 'sage_normalize': True, 'sage_project': False, 'lr': 4.965384635566173e-05, 'weight_decay': 0.0001900429300647786, 'epochs': 225, 'loss': 'mse', 'optimizer': 'adam', 'graph_mode': 'cutoff', 'cutoff': 0.45727650593115554, 'grm_norm': 'gcn', 'self_loops': True, 'use_snp_selection': False}. Best is trial 138 with value: 0.286811195756391.
[I 2025-12-08 13:58:57,843] Trial 146 finished with value: 0.2831616558254967 and parameters: {'model_type': 'graphsage', 'hidden_dims': '[512, 256]', 'dropout': 0.11011916141297325, 'batch_norm': True, 'sage_aggr': 'mean', 'sage_normalize': True, 'sage_project': False, 'lr': 9.094759050760334e-05, 'weight_decay': 0.00013212549674238464, 'epochs': 220, 'loss': 'mse', 'optimizer': 'adam', 'graph_mode': 'cutoff', 'cutoff': 0.4435032110341879, 'grm_norm': 'gcn', 'self_loops': True, 'use_snp_selection': False}. Best is trial 138 with value: 0.286811195756391.
[I 2025-12-08 13:59:48,902] Trial 147 finished with value: 0.2808965674703052 and parameters: {'model_type': 'graphsage', 'hidden_dims': '[512, 256]', 'dropout': 0.12740241321371454, 'batch_norm': True, 'sage_aggr': 'mean', 'sage_normalize': True, 'sage_project': False, 'lr': 6.0728053818674844e-05, 'weight_decay': 9.731124375338929e-05, 'epochs': 220, 'loss': 'mse', 'optimizer': 'adam', 'graph_mode': 'cutoff', 'cutoff': 0.43807302489038913, 'grm_norm': 'gcn', 'self_loops': True, 'use_snp_selection': True, 'num_snps': 11777}. Best is trial 138 with value: 0.286811195756391.
[I 2025-12-08 14:01:57,561] Trial 148 finished with value: 0.28279283516022674 and parameters: {'model_type': 'graphsage', 'hidden_dims': '[512, 256]', 'dropout': 0.11292572843090869, 'batch_norm': True, 'sage_aggr': 'mean', 'sage_normalize': True, 'sage_project': False, 'lr': 5.342917472627552e-05, 'weight_decay': 0.0001328926219151899, 'epochs': 238, 'loss': 'mse', 'optimizer': 'adam', 'graph_mode': 'cutoff', 'cutoff': 0.4312899488373277, 'grm_norm': 'gcn', 'self_loops': True, 'use_snp_selection': False}. Best is trial 138 with value: 0.286811195756391.
[I 2025-12-08 14:02:54,224] Trial 149 finished with value: 0.2768968767943305 and parameters: {'model_type': 'graphsage', 'hidden_dims': '[512, 256]', 'dropout': 0.109932810244139, 'batch_norm': True, 'sage_aggr': 'mean', 'sage_normalize': True, 'sage_project': False, 'lr': 5.9532025458904304e-05, 'weight_decay': 0.00011541980267570006, 'epochs': 252, 'loss': 'mse', 'optimizer': 'adam', 'graph_mode': 'knn', 'knn_k': 3, 'weighted_edges': False, 'symmetrize_mode': 'union', 'self_loops': True, 'use_snp_selection': True, 'num_snps': 10929}. Best is trial 138 with value: 0.286811195756391.
[I 2025-12-08 14:04:38,975] Trial 0 finished with value: 0.2711147550939519 and parameters: {'model_type': 'graphsage', 'hidden_dims': '[128, 64]', 'dropout': 0.199031432379812, 'batch_norm': True, 'sage_aggr': 'max', 'sage_normalize': True, 'sage_project': False, 'lr': 0.00034401453323286885, 'weight_decay': 0.00017802616915745114, 'epochs': 230, 'loss': 'mse', 'optimizer': 'adam', 'graph_mode': 'knn', 'knn_k': 6, 'weighted_edges': True, 'symmetrize_mode': 'mutual', 'self_loops': True, 'use_snp_selection': False}. Best is trial 0 with value: 0.2711147550939519.
