[I 2025-12-09 20:09:44,138] Trial 31 finished with value: 0.3726392215435892 and parameters: {'model_type': 'graphsage', 'hidden_dims': '[512, 256]', 'dropout': 0.41967674935120586, 'batch_norm': False, 'sage_aggr': 'max', 'sage_normalize': False, 'sage_project': False, 'lr': 1.4928994897398256e-05, 'weight_decay': 0.0005695337513109679, 'epochs': 103, 'loss': 'mae', 'optimizer': 'adam', 'graph_mode': 'cutoff', 'cutoff': 0.7401591816767885, 'grm_norm': 'cosine', 'self_loops': False, 'use_snp_selection': True, 'num_snps': 45297}. Best is trial 31 with value: 0.3726392215435892.
[I 2025-12-09 20:11:05,255] Trial 32 finished with value: 0.3630882170929473 and parameters: {'model_type': 'graphsage', 'hidden_dims': '[512, 256]', 'dropout': 0.44286526605463483, 'batch_norm': False, 'sage_aggr': 'max', 'sage_normalize': False, 'sage_project': False, 'lr': 3.534530066765894e-05, 'weight_decay': 0.000538365198286864, 'epochs': 136, 'loss': 'mae', 'optimizer': 'adam', 'graph_mode': 'cutoff', 'cutoff': 0.7721224420391898, 'grm_norm': 'cosine', 'self_loops': False, 'use_snp_selection': True, 'num_snps': 45431}. Best is trial 31 with value: 0.3726392215435892.
[I 2025-12-09 20:12:26,291] Trial 33 finished with value: 0.3610053160079019 and parameters: {'model_type': 'graphsage', 'hidden_dims': '[512, 256]', 'dropout': 0.42232182513326905, 'batch_norm': False, 'sage_aggr': 'max', 'sage_normalize': False, 'sage_project': False, 'lr': 1.6480605072818263e-05, 'weight_decay': 0.00022746047674818828, 'epochs': 108, 'loss': 'mae', 'optimizer': 'adam', 'graph_mode': 'cutoff', 'cutoff': 0.7678357020539768, 'grm_norm': 'cosine', 'self_loops': False, 'use_snp_selection': True, 'num_snps': 53846}. Best is trial 31 with value: 0.3726392215435892.
[I 2025-12-09 20:13:28,670] Trial 34 finished with value: 0.3454320655433872 and parameters: {'model_type': 'graphsage', 'hidden_dims': '[512, 256]', 'dropout': 0.2998291605151328, 'batch_norm': False, 'sage_aggr': 'max', 'sage_normalize': False, 'sage_project': False, 'lr': 1.5886809933745302e-05, 'weight_decay': 0.0004926813436281597, 'epochs': 66, 'loss': 'mae', 'optimizer': 'adam', 'graph_mode': 'cutoff', 'cutoff': 0.5295068838537862, 'grm_norm': 'cosine', 'self_loops': True, 'use_snp_selection': True, 'num_snps': 46460}. Best is trial 31 with value: 0.3726392215435892.
[I 2025-12-09 20:14:52,037] Trial 35 finished with value: 0.3199100160483833 and parameters: {'model_type': 'graphsage', 'hidden_dims': '[128, 64]', 'dropout': 0.3575759416657363, 'batch_norm': False, 'sage_aggr': 'max', 'sage_normalize': False, 'sage_project': False, 'lr': 7.15819444867745e-05, 'weight_decay': 1.829383271786231e-05, 'epochs': 141, 'loss': 'mae', 'optimizer': 'adam', 'graph_mode': 'knn', 'knn_k': 4, 'weighted_edges': True, 'symmetrize_mode': 'union', 'self_loops': False, 'use_snp_selection': True, 'num_snps': 40168}. Best is trial 31 with value: 0.3726392215435892.
[I 2025-12-09 20:16:20,978] Trial 36 finished with value: 0.3495584540852198 and parameters: {'model_type': 'graphsage', 'hidden_dims': '[512, 256]', 'dropout': 0.3316548512665678, 'batch_norm': True, 'sage_aggr': 'max', 'sage_normalize': False, 'sage_project': False, 'lr': 4.336070569229106e-05, 'weight_decay': 0.00013680166107944065, 'epochs': 154, 'loss': 'mae', 'optimizer': 'adam', 'graph_mode': 'cutoff', 'cutoff': 0.6574529924024538, 'grm_norm': 'cosine', 'self_loops': False, 'use_snp_selection': True, 'num_snps': 47780}. Best is trial 31 with value: 0.3726392215435892.
[I 2025-12-09 20:17:12,270] Trial 37 finished with value: 0.3649365754023023 and parameters: {'model_type': 'graphsage', 'hidden_dims': '[256, 128, 64]', 'dropout': 0.4766033163078992, 'batch_norm': False, 'sage_aggr': 'max', 'sage_normalize': False, 'sage_project': False, 'lr': 2.5423081503611525e-05, 'weight_decay': 0.0002722469717142916, 'epochs': 105, 'loss': 'mae', 'optimizer': 'adam', 'graph_mode': 'cutoff', 'cutoff': 0.7473237307114766, 'grm_norm': 'cosine', 'self_loops': False, 'use_snp_selection': True, 'num_snps': 36721}. Best is trial 31 with value: 0.3726392215435892.
[I 2025-12-09 20:21:33,122] Trial 38 finished with value: 0.29254306139490843 and parameters: {'model_type': 'graphsage', 'hidden_dims': '[512, 256]', 'dropout': 0.375783531447467, 'batch_norm': True, 'sage_aggr': 'max', 'sage_normalize': False, 'sage_project': False, 'lr': 1.4806586996198607e-05, 'weight_decay': 0.0006074656187098276, 'epochs': 203, 'loss': 'mae', 'optimizer': 'adam', 'graph_mode': 'knn', 'knn_k': 10, 'weighted_edges': True, 'symmetrize_mode': 'union', 'self_loops': True, 'use_snp_selection': True, 'num_snps': 43478}. Best is trial 31 with value: 0.3726392215435892.
[I 2025-12-09 20:22:41,871] Trial 39 finished with value: 0.36635760099000253 and parameters: {'model_type': 'graphsage', 'hidden_dims': '[512, 64]', 'dropout': 0.280666948073675, 'batch_norm': False, 'sage_aggr': 'max', 'sage_normalize': False, 'sage_project': False, 'lr': 1.8709968626179028e-05, 'weight_decay': 7.132310207515372e-05, 'epochs': 80, 'loss': 'mae', 'optimizer': 'adam', 'graph_mode': 'cutoff', 'cutoff': 0.8352370927117075, 'grm_norm': 'cosine', 'self_loops': False, 'use_snp_selection': True, 'num_snps': 50981}. Best is trial 31 with value: 0.3726392215435892.
[I 2025-12-09 20:23:28,354] Trial 40 finished with value: 0.3032966973759012 and parameters: {'model_type': 'graphsage', 'hidden_dims': '[128, 64]', 'dropout': 0.4205143043519533, 'batch_norm': True, 'sage_aggr': 'max', 'sage_normalize': False, 'sage_project': False, 'lr': 8.720705118145113e-05, 'weight_decay': 4.051895394146607e-05, 'epochs': 54, 'loss': 'mae', 'optimizer': 'adam', 'graph_mode': 'knn', 'knn_k': 3, 'weighted_edges': False, 'symmetrize_mode': 'union', 'self_loops': True, 'use_snp_selection': True, 'num_snps': 30436}. Best is trial 31 with value: 0.3726392215435892.
[I 2025-12-09 20:24:35,159] Trial 41 finished with value: 0.3582765017761934 and parameters: {'model_type': 'graphsage', 'hidden_dims': '[512, 64]', 'dropout': 0.25699456680077537, 'batch_norm': False, 'sage_aggr': 'max', 'sage_normalize': False, 'sage_project': False, 'lr': 2.099192058341354e-05, 'weight_decay': 0.00030470708648433286, 'epochs': 78, 'loss': 'mae', 'optimizer': 'adam', 'graph_mode': 'cutoff', 'cutoff': 0.8396255918536135, 'grm_norm': 'cosine', 'self_loops': False, 'use_snp_selection': True, 'num_snps': 49910}. Best is trial 31 with value: 0.3726392215435892.
[I 2025-12-09 20:25:47,064] Trial 42 finished with value: 0.3644174445196709 and parameters: {'model_type': 'graphsage', 'hidden_dims': '[512, 64]', 'dropout': 0.2908801490064928, 'batch_norm': False, 'sage_aggr': 'max', 'sage_normalize': False, 'sage_project': False, 'lr': 1.3255172609168462e-05, 'weight_decay': 8.544623469415274e-05, 'epochs': 83, 'loss': 'mae', 'optimizer': 'adam', 'graph_mode': 'cutoff', 'cutoff': 0.8056973644325511, 'grm_norm': 'cosine', 'self_loops': False, 'use_snp_selection': True, 'num_snps': 53047}. Best is trial 31 with value: 0.3726392215435892.
[I 2025-12-09 20:27:01,112] Trial 43 finished with value: 0.36185240122558227 and parameters: {'model_type': 'graphsage', 'hidden_dims': '[512, 64]', 'dropout': 0.22915202748749144, 'batch_norm': False, 'sage_aggr': 'max', 'sage_normalize': False, 'sage_project': False, 'lr': 3.5412952423187306e-05, 'weight_decay': 0.0006248168986968902, 'epochs': 130, 'loss': 'mae', 'optimizer': 'adam', 'graph_mode': 'cutoff', 'cutoff': 0.8524274012922302, 'grm_norm': 'cosine', 'self_loops': False, 'use_snp_selection': True, 'num_snps': 41460}. Best is trial 31 with value: 0.3726392215435892.
[I 2025-12-09 20:28:33,240] Trial 44 finished with value: 0.3675290103649173 and parameters: {'model_type': 'graphsage', 'hidden_dims': '[512, 64]', 'dropout': 0.3496578066296314, 'batch_norm': False, 'sage_aggr': 'max', 'sage_normalize': False, 'sage_project': False, 'lr': 1.9304998573805716e-05, 'weight_decay': 0.0001772977036074667, 'epochs': 163, 'loss': 'mae', 'optimizer': 'adam', 'graph_mode': 'cutoff', 'cutoff': 0.728899797518479, 'grm_norm': 'none', 'self_loops': False, 'use_snp_selection': True, 'num_snps': 49226}. Best is trial 31 with value: 0.3726392215435892.
[I 2025-12-09 20:30:10,338] Trial 45 finished with value: 0.36630667398485534 and parameters: {'model_type': 'graphsage', 'hidden_dims': '[512, 256]', 'dropout': 0.3491435679171242, 'batch_norm': False, 'sage_aggr': 'max', 'sage_normalize': False, 'sage_project': False, 'lr': 1.288418563848376e-05, 'weight_decay': 0.00019418584101640762, 'epochs': 170, 'loss': 'mae', 'optimizer': 'adam', 'graph_mode': 'cutoff', 'cutoff': 0.5705684642120468, 'grm_norm': 'none', 'self_loops': False, 'use_snp_selection': True, 'num_snps': 48714}. Best is trial 31 with value: 0.3726392215435892.
[I 2025-12-09 20:31:09,769] Trial 46 finished with value: 0.3549434419377486 and parameters: {'model_type': 'graphsage', 'hidden_dims': '[256, 128, 64]', 'dropout': 0.33224781329172304, 'batch_norm': False, 'sage_aggr': 'max', 'sage_normalize': False, 'sage_project': False, 'lr': 2.822692111263612e-05, 'weight_decay': 0.0006788960814232432, 'epochs': 199, 'loss': 'mae', 'optimizer': 'adam', 'graph_mode': 'cutoff', 'cutoff': 0.655265674415744, 'grm_norm': 'none', 'self_loops': False, 'use_snp_selection': True, 'num_snps': 33928}. Best is trial 31 with value: 0.3726392215435892.
[I 2025-12-09 20:32:34,035] Trial 47 finished with value: 0.3147059163971053 and parameters: {'model_type': 'graphsage', 'hidden_dims': '[512, 256]', 'dropout': 0.3834240333706106, 'batch_norm': False, 'sage_aggr': 'max', 'sage_normalize': True, 'sage_project': False, 'lr': 4.501654819825099e-05, 'weight_decay': 0.00036787935892766476, 'epochs': 186, 'loss': 'mae', 'optimizer': 'adam', 'graph_mode': 'cutoff', 'cutoff': 0.7528875544915775, 'grm_norm': 'none', 'self_loops': False, 'use_snp_selection': False}. Best is trial 31 with value: 0.3726392215435892.
[I 2025-12-09 20:34:31,558] Trial 48 finished with value: 0.30137636211344787 and parameters: {'model_type': 'graphsage', 'hidden_dims': '[256, 128]', 'dropout': 0.47282426214672646, 'batch_norm': True, 'sage_aggr': 'max', 'sage_normalize': False, 'sage_project': False, 'lr': 2.1323118761947317e-05, 'weight_decay': 1.6550610256030668e-07, 'epochs': 140, 'loss': 'mse', 'optimizer': 'adam', 'graph_mode': 'knn', 'knn_k': 7, 'weighted_edges': True, 'symmetrize_mode': 'mutual', 'self_loops': False, 'use_snp_selection': True, 'num_snps': 57274}. Best is trial 31 with value: 0.3726392215435892.
[I 2025-12-09 20:35:46,373] Trial 49 finished with value: 0.3355385971618334 and parameters: {'model_type': 'graphsage', 'hidden_dims': '[512, 64]', 'dropout': 0.42230598041667256, 'batch_norm': False, 'sage_aggr': 'mean', 'sage_normalize': False, 'sage_project': False, 'lr': 0.000215365155925117, 'weight_decay': 0.00012602129425681567, 'epochs': 165, 'loss': 'mae', 'optimizer': 'adam', 'graph_mode': 'cutoff', 'cutoff': 0.6715327959571511, 'grm_norm': 'none', 'self_loops': True, 'use_snp_selection': True, 'num_snps': 36763}. Best is trial 31 with value: 0.3726392215435892.
[I 2025-12-09 20:36:57,216] Trial 50 finished with value: 0.33723462002059207 and parameters: {'model_type': 'graphsage', 'hidden_dims': '[512, 128]', 'dropout': 0.3502107508959523, 'batch_norm': False, 'sage_aggr': 'max', 'sage_normalize': True, 'sage_project': False, 'lr': 0.0005762181151568135, 'weight_decay': 7.325113174585708e-06, 'epochs': 150, 'loss': 'mae', 'optimizer': 'adam', 'graph_mode': 'cutoff', 'cutoff': 0.6196850110482914, 'grm_norm': 'none', 'self_loops': False, 'use_snp_selection': False}. Best is trial 31 with value: 0.3726392215435892.
[I 2025-12-09 20:38:13,574] Trial 51 finished with value: 0.3635739445441162 and parameters: {'model_type': 'graphsage', 'hidden_dims': '[512, 64]', 'dropout': 0.27129489568654597, 'batch_norm': False, 'sage_aggr': 'max', 'sage_normalize': False, 'sage_project': False, 'lr': 1.803467023810661e-05, 'weight_decay': 6.0214499202314593e-05, 'epochs': 101, 'loss': 'mae', 'optimizer': 'adam', 'graph_mode': 'cutoff', 'cutoff': 0.7311254888111163, 'grm_norm': 'cosine', 'self_loops': False, 'use_snp_selection': True, 'num_snps': 51310}. Best is trial 31 with value: 0.3726392215435892.
[I 2025-12-09 20:39:26,942] Trial 52 finished with value: 0.3611306295367519 and parameters: {'model_type': 'graphsage', 'hidden_dims': '[512, 64]', 'dropout': 0.39568092018230827, 'batch_norm': False, 'sage_aggr': 'max', 'sage_normalize': False, 'sage_project': False, 'lr': 1.3504273023078758e-05, 'weight_decay': 2.320152861032363e-05, 'epochs': 117, 'loss': 'mae', 'optimizer': 'adam', 'graph_mode': 'cutoff', 'cutoff': 0.7820493040619287, 'grm_norm': 'gcn', 'self_loops': False, 'use_snp_selection': True, 'num_snps': 45334}. Best is trial 31 with value: 0.3726392215435892.
[I 2025-12-09 20:40:31,323] Trial 53 finished with value: 0.36320010429923155 and parameters: {'model_type': 'graphsage', 'hidden_dims': '[512, 64]', 'dropout': 0.2803188292107145, 'batch_norm': False, 'sage_aggr': 'max', 'sage_normalize': False, 'sage_project': False, 'lr': 1.8704842749258785e-05, 'weight_decay': 0.00017597378698922523, 'epochs': 70, 'loss': 'mae', 'optimizer': 'adam', 'graph_mode': 'cutoff', 'cutoff': 0.8166440298225416, 'grm_norm': 'cosine_then_gcn', 'self_loops': False, 'use_snp_selection': True, 'num_snps': 49715}. Best is trial 31 with value: 0.3726392215435892.
[I 2025-12-09 20:41:43,952] Trial 54 finished with value: 0.0 and parameters: {'model_type': 'graphsage', 'hidden_dims': '[512, 64]', 'dropout': 0.15979870824731296, 'batch_norm': False, 'sage_aggr': 'max', 'sage_normalize': False, 'sage_project': False, 'lr': 0.009021768784306385, 'weight_decay': 9.849650812999082e-05, 'epochs': 85, 'loss': 'mae', 'optimizer': 'adam', 'graph_mode': 'cutoff', 'cutoff': 0.8963721568621309, 'grm_norm': 'cosine', 'self_loops': False, 'use_snp_selection': True, 'num_snps': 54323}. Best is trial 31 with value: 0.3726392215435892.
[I 2025-12-09 20:42:38,114] Trial 55 finished with value: 0.35180453437978776 and parameters: {'model_type': 'graphsage', 'hidden_dims': '[512, 256]', 'dropout': 0.31145755025410926, 'batch_norm': False, 'sage_aggr': 'mean', 'sage_normalize': False, 'sage_project': False, 'lr': 1.2046070639341374e-05, 'weight_decay': 4.124781199232764e-05, 'epochs': 52, 'loss': 'mse', 'optimizer': 'adam', 'graph_mode': 'cutoff', 'cutoff': 0.7255249103685559, 'grm_norm': 'gcn', 'self_loops': False, 'use_snp_selection': True, 'num_snps': 44552}. Best is trial 31 with value: 0.3726392215435892.
[I 2025-12-09 20:43:39,039] Trial 56 finished with value: 0.0975712980901626 and parameters: {'model_type': 'graphsage', 'hidden_dims': '[512, 256]', 'dropout': 0.45892375280108416, 'batch_norm': False, 'sage_aggr': 'max', 'sage_normalize': False, 'sage_project': False, 'lr': 0.001502347170201984, 'weight_decay': 0.00031615269608399035, 'epochs': 94, 'loss': 'mae', 'optimizer': 'adam', 'graph_mode': 'cutoff', 'cutoff': 0.7838464136701272, 'grm_norm': 'cosine_then_gcn', 'self_loops': False, 'use_snp_selection': True, 'num_snps': 38280}. Best is trial 31 with value: 0.3726392215435892.
[I 2025-12-09 20:45:32,808] Trial 57 finished with value: 0.32353483516802684 and parameters: {'model_type': 'graphsage', 'hidden_dims': '[512, 256]', 'dropout': 0.43674722184518094, 'batch_norm': False, 'sage_aggr': 'max', 'sage_normalize': True, 'sage_project': False, 'lr': 3.215170783942707e-05, 'weight_decay': 0.0007329541924829535, 'epochs': 259, 'loss': 'mae', 'optimizer': 'adam', 'graph_mode': 'cutoff', 'cutoff': 0.8617135526620712, 'grm_norm': 'cosine', 'self_loops': False, 'use_snp_selection': False}. Best is trial 31 with value: 0.3726392215435892.
[I 2025-12-09 20:46:43,241] Trial 58 finished with value: 0.3610243840329875 and parameters: {'model_type': 'graphsage', 'hidden_dims': '[512, 64]', 'dropout': 0.10184403688027371, 'batch_norm': False, 'sage_aggr': 'max', 'sage_normalize': False, 'sage_project': False, 'lr': 2.2697713936052586e-05, 'weight_decay': 0.0004371391475004203, 'epochs': 120, 'loss': 'mae', 'optimizer': 'adam', 'graph_mode': 'cutoff', 'cutoff': 0.6842248876106874, 'grm_norm': 'none', 'self_loops': False, 'use_snp_selection': True, 'num_snps': 41749}. Best is trial 31 with value: 0.3726392215435892.
[I 2025-12-09 20:47:54,935] Trial 59 finished with value: 0.33406007409131544 and parameters: {'model_type': 'graphsage', 'hidden_dims': '[512, 256]', 'dropout': 0.3348601928790967, 'batch_norm': False, 'sage_aggr': 'mean', 'sage_normalize': False, 'sage_project': False, 'lr': 4.5333463828953376e-05, 'weight_decay': 6.089050646768287e-05, 'epochs': 58, 'loss': 'mse', 'optimizer': 'adam', 'graph_mode': 'cutoff', 'cutoff': 0.48305159036793033, 'grm_norm': 'cosine', 'self_loops': False, 'use_snp_selection': True, 'num_snps': 54976}. Best is trial 31 with value: 0.3726392215435892.
[I 2025-12-09 20:48:53,141] Trial 60 finished with value: 0.3654320083564918 and parameters: {'model_type': 'graphsage', 'hidden_dims': '[256, 128]', 'dropout': 0.18823315954174777, 'batch_norm': False, 'sage_aggr': 'max', 'sage_normalize': False, 'sage_project': False, 'lr': 0.00011923239462534495, 'weight_decay': 0.00016390366622060572, 'epochs': 103, 'loss': 'mae', 'optimizer': 'adam', 'graph_mode': 'cutoff', 'cutoff': 0.7200828733080172, 'grm_norm': 'cosine', 'self_loops': False, 'use_snp_selection': True, 'num_snps': 47506}. Best is trial 31 with value: 0.3726392215435892.
[I 2025-12-09 20:50:31,980] Trial 61 finished with value: 0.370054704745963 and parameters: {'model_type': 'graphsage', 'hidden_dims': '[512, 256]', 'dropout': 0.35486686982681154, 'batch_norm': False, 'sage_aggr': 'max', 'sage_normalize': False, 'sage_project': False, 'lr': 1.1437971169352556e-05, 'weight_decay': 0.00022177001861812518, 'epochs': 176, 'loss': 'mae', 'optimizer': 'adam', 'graph_mode': 'cutoff', 'cutoff': 0.5661705677054851, 'grm_norm': 'none', 'self_loops': False, 'use_snp_selection': True, 'num_snps': 48653}. Best is trial 31 with value: 0.3726392215435892.
[I 2025-12-09 20:52:27,010] Trial 62 finished with value: 0.3663966524001859 and parameters: {'model_type': 'graphsage', 'hidden_dims': '[512, 256]', 'dropout': 0.40039844861012036, 'batch_norm': False, 'sage_aggr': 'max', 'sage_normalize': False, 'sage_project': False, 'lr': 1.013553622057613e-05, 'weight_decay': 0.0002636090840138445, 'epochs': 212, 'loss': 'mae', 'optimizer': 'adam', 'graph_mode': 'cutoff', 'cutoff': 0.5505249160871629, 'grm_norm': 'none', 'self_loops': False, 'use_snp_selection': True, 'num_snps': 49659}. Best is trial 31 with value: 0.3726392215435892.
[I 2025-12-09 20:54:09,669] Trial 63 finished with value: 0.3744651287832118 and parameters: {'model_type': 'graphsage', 'hidden_dims': '[512, 256]', 'dropout': 0.4101001491290043, 'batch_norm': False, 'sage_aggr': 'max', 'sage_normalize': False, 'sage_project': False, 'lr': 1.0078907975024247e-05, 'weight_decay': 0.0002389669082059116, 'epochs': 213, 'loss': 'mae', 'optimizer': 'adam', 'graph_mode': 'cutoff', 'cutoff': 0.5585024081518861, 'grm_norm': 'none', 'self_loops': False, 'use_snp_selection': True, 'num_snps': 43033}. Best is trial 63 with value: 0.3744651287832118.
[I 2025-12-09 20:56:03,545] Trial 64 finished with value: 0.34952490915286577 and parameters: {'model_type': 'graphsage', 'hidden_dims': '[512, 256]', 'dropout': 0.3745188715850883, 'batch_norm': False, 'sage_aggr': 'max', 'sage_normalize': False, 'sage_project': False, 'lr': 1.2193965664251014e-05, 'weight_decay': 0.0004627810813332358, 'epochs': 184, 'loss': 'mae', 'optimizer': 'adam', 'graph_mode': 'cutoff', 'cutoff': 0.4466863001247646, 'grm_norm': 'none', 'self_loops': False, 'use_snp_selection': True, 'num_snps': 43706}. Best is trial 63 with value: 0.3744651287832118.
[I 2025-12-09 20:57:53,335] Trial 65 finished with value: 0.3613227618433271 and parameters: {'model_type': 'graphsage', 'hidden_dims': '[512, 256]', 'dropout': 0.41623715601773204, 'batch_norm': False, 'sage_aggr': 'max', 'sage_normalize': False, 'sage_project': False, 'lr': 1.5423006242174046e-05, 'weight_decay': 0.0008166540668757324, 'epochs': 248, 'loss': 'mae', 'optimizer': 'adam', 'graph_mode': 'cutoff', 'cutoff': 0.5315956533694265, 'grm_norm': 'none', 'self_loops': False, 'use_snp_selection': True, 'num_snps': 40216}. Best is trial 63 with value: 0.3744651287832118.
[I 2025-12-09 20:59:41,447] Trial 66 finished with value: 0.3654319410846121 and parameters: {'model_type': 'graphsage', 'hidden_dims': '[512, 256]', 'dropout': 0.36044149919628365, 'batch_norm': False, 'sage_aggr': 'max', 'sage_normalize': False, 'sage_project': False, 'lr': 2.838395241444996e-05, 'weight_decay': 0.0002251469158346736, 'epochs': 216, 'loss': 'mae', 'optimizer': 'adam', 'graph_mode': 'cutoff', 'cutoff': 0.5975657683532348, 'grm_norm': 'none', 'self_loops': False, 'use_snp_selection': True, 'num_snps': 47055}. Best is trial 63 with value: 0.3744651287832118.
[I 2025-12-09 21:01:29,097] Trial 67 finished with value: 0.25653366174945785 and parameters: {'model_type': 'graphsage', 'hidden_dims': '[512, 256]', 'dropout': 0.38367178073148284, 'batch_norm': True, 'sage_aggr': 'max', 'sage_normalize': False, 'sage_project': False, 'lr': 1.1321956286321438e-05, 'weight_decay': 0.0003803451625385796, 'epochs': 193, 'loss': 'mae', 'optimizer': 'adam', 'graph_mode': 'knn', 'knn_k': 5, 'weighted_edges': False, 'symmetrize_mode': 'union', 'self_loops': True, 'use_snp_selection': True, 'num_snps': 26399}. Best is trial 63 with value: 0.3744651287832118.
