[I 2025-12-09 08:16:03,063] Trial 130 finished with value: 0.30705416257654355 and parameters: {'model_type': 'graphsage', 'hidden_dims': '[512, 64]', 'dropout': 0.28674398175063004, 'batch_norm': True, 'sage_aggr': 'max', 'sage_normalize': False, 'sage_project': False, 'lr': 0.006453056827427233, 'weight_decay': 1.298488005815013e-05, 'epochs': 157, 'loss': 'mse', 'optimizer': 'adam', 'graph_mode': 'cutoff', 'cutoff': 0.7473596698719357, 'grm_norm': 'none', 'self_loops': True, 'use_snp_selection': False}. Best is trial 76 with value: 0.31793588769783154.
[I 2025-12-09 08:16:56,298] Trial 131 finished with value: 0.30895643407126105 and parameters: {'model_type': 'graphsage', 'hidden_dims': '[512, 64]', 'dropout': 0.5504765638167121, 'batch_norm': True, 'sage_aggr': 'max', 'sage_normalize': False, 'sage_project': False, 'lr': 0.007754348057835407, 'weight_decay': 8.084661306295815e-06, 'epochs': 106, 'loss': 'mse', 'optimizer': 'adam', 'graph_mode': 'cutoff', 'cutoff': 0.7281694651253167, 'grm_norm': 'gcn', 'self_loops': True, 'use_snp_selection': False}. Best is trial 76 with value: 0.31793588769783154.
[I 2025-12-09 08:17:37,458] Trial 132 finished with value: 0.3117577238044425 and parameters: {'model_type': 'graphsage', 'hidden_dims': '[512, 64]', 'dropout': 0.22436999999197, 'batch_norm': True, 'sage_aggr': 'max', 'sage_normalize': False, 'sage_project': False, 'lr': 0.009891694687001676, 'weight_decay': 1.1054786731949198e-05, 'epochs': 75, 'loss': 'mse', 'optimizer': 'adam', 'graph_mode': 'cutoff', 'cutoff': 0.8926915841834588, 'grm_norm': 'gcn', 'self_loops': True, 'use_snp_selection': False}. Best is trial 76 with value: 0.31793588769783154.
[I 2025-12-09 08:19:26,034] Trial 133 finished with value: 0.30762635134650546 and parameters: {'model_type': 'graphsage', 'hidden_dims': '[512, 64]', 'dropout': 0.567922229085149, 'batch_norm': True, 'sage_aggr': 'max', 'sage_normalize': False, 'sage_project': False, 'lr': 0.00018963556723052788, 'weight_decay': 7.518078524450558e-05, 'epochs': 249, 'loss': 'mse', 'optimizer': 'adam', 'graph_mode': 'cutoff', 'cutoff': 0.8457883614641654, 'grm_norm': 'gcn', 'self_loops': True, 'use_snp_selection': False}. Best is trial 76 with value: 0.31793588769783154.
[I 2025-12-09 08:21:28,729] Trial 134 finished with value: 0.298155538295222 and parameters: {'model_type': 'graphsage', 'hidden_dims': '[512, 64]', 'dropout': 0.4821733590348367, 'batch_norm': True, 'sage_aggr': 'max', 'sage_normalize': False, 'sage_project': False, 'lr': 0.005148256980919918, 'weight_decay': 1.6276954416486687e-05, 'epochs': 247, 'loss': 'mse', 'optimizer': 'adam', 'graph_mode': 'cutoff', 'cutoff': 0.4978033307340383, 'grm_norm': 'gcn', 'self_loops': True, 'use_snp_selection': False}. Best is trial 76 with value: 0.31793588769783154.
[I 2025-12-09 08:24:07,916] Trial 135 finished with value: 0.30372058992333395 and parameters: {'model_type': 'graphsage', 'hidden_dims': '[512, 64]', 'dropout': 0.3454074694063066, 'batch_norm': True, 'sage_aggr': 'max', 'sage_normalize': False, 'sage_project': False, 'lr': 0.006552007304745854, 'weight_decay': 4.657870572554698e-06, 'epochs': 275, 'loss': 'mse', 'optimizer': 'adam', 'graph_mode': 'cutoff', 'cutoff': 0.30924008892917676, 'grm_norm': 'gcn', 'self_loops': True, 'use_snp_selection': False}. Best is trial 76 with value: 0.31793588769783154.
[I 2025-12-09 08:24:45,102] Trial 136 finished with value: 0.31062271350785803 and parameters: {'model_type': 'graphsage', 'hidden_dims': '[256, 128]', 'dropout': 0.19496798033715212, 'batch_norm': True, 'sage_aggr': 'max', 'sage_normalize': False, 'sage_project': False, 'lr': 0.004460292950024741, 'weight_decay': 1.4510193848616368e-05, 'epochs': 127, 'loss': 'mse', 'optimizer': 'adam', 'graph_mode': 'cutoff', 'cutoff': 0.8052092671630008, 'grm_norm': 'gcn', 'self_loops': True, 'use_snp_selection': False}. Best is trial 76 with value: 0.31793588769783154.
[I 2025-12-09 08:27:13,691] Trial 137 finished with value: 0.2909117220599741 and parameters: {'model_type': 'graphsage', 'hidden_dims': '[512, 64]', 'dropout': 0.4635415466660476, 'batch_norm': True, 'sage_aggr': 'max', 'sage_normalize': True, 'sage_project': False, 'lr': 0.0032413930688280036, 'weight_decay': 5.859187886974649e-06, 'epochs': 271, 'loss': 'mse', 'optimizer': 'adam', 'graph_mode': 'knn', 'knn_k': 5, 'weighted_edges': False, 'symmetrize_mode': 'mutual', 'self_loops': True, 'use_snp_selection': False}. Best is trial 76 with value: 0.31793588769783154.
[I 2025-12-09 08:27:55,176] Trial 138 finished with value: 0.30937409443764385 and parameters: {'model_type': 'graphsage', 'hidden_dims': '[256, 128, 64]', 'dropout': 0.24580248590406725, 'batch_norm': True, 'sage_aggr': 'max', 'sage_normalize': False, 'sage_project': False, 'lr': 0.008622146359555341, 'weight_decay': 3.6289164127132703e-06, 'epochs': 142, 'loss': 'mae', 'optimizer': 'adam', 'graph_mode': 'cutoff', 'cutoff': 0.8268804368158992, 'grm_norm': 'cosine_then_gcn', 'self_loops': True, 'use_snp_selection': False}. Best is trial 76 with value: 0.31793588769783154.
[I 2025-12-09 08:28:45,543] Trial 139 finished with value: 0.30518392179874193 and parameters: {'model_type': 'graphsage', 'hidden_dims': '[512, 64]', 'dropout': 0.4947563703956525, 'batch_norm': True, 'sage_aggr': 'max', 'sage_normalize': False, 'sage_project': False, 'lr': 0.005753041773301945, 'weight_decay': 2.4484263505471124e-05, 'epochs': 134, 'loss': 'mse', 'optimizer': 'adam', 'graph_mode': 'cutoff', 'cutoff': 0.7680229430044692, 'grm_norm': 'gcn', 'self_loops': True, 'use_snp_selection': True, 'num_snps': 22109}. Best is trial 76 with value: 0.31793588769783154.
[I 2025-12-09 08:29:41,044] Trial 140 finished with value: 0.0 and parameters: {'model_type': 'graphsage', 'hidden_dims': '[512, 64]', 'dropout': 0.2664689476001957, 'batch_norm': False, 'sage_aggr': 'max', 'sage_normalize': False, 'sage_project': False, 'lr': 0.007200326354262657, 'weight_decay': 8.967931219622115e-06, 'epochs': 114, 'loss': 'mse', 'optimizer': 'adam', 'graph_mode': 'cutoff', 'cutoff': 0.8578558293527686, 'grm_norm': 'gcn', 'self_loops': False, 'use_snp_selection': False}. Best is trial 76 with value: 0.31793588769783154.
[I 2025-12-09 08:30:57,818] Trial 141 finished with value: 0.3132842485030855 and parameters: {'model_type': 'graphsage', 'hidden_dims': '[512, 64]', 'dropout': 0.2985653910539101, 'batch_norm': True, 'sage_aggr': 'max', 'sage_normalize': False, 'sage_project': False, 'lr': 0.0041489681803144884, 'weight_decay': 2.4206141627467426e-06, 'epochs': 167, 'loss': 'mse', 'optimizer': 'adam', 'graph_mode': 'cutoff', 'cutoff': 0.8168816251906389, 'grm_norm': 'gcn', 'self_loops': True, 'use_snp_selection': False}. Best is trial 76 with value: 0.31793588769783154.
[I 2025-12-09 08:32:13,091] Trial 142 finished with value: 0.31304995058252366 and parameters: {'model_type': 'graphsage', 'hidden_dims': '[512, 64]', 'dropout': 0.2798130525706312, 'batch_norm': True, 'sage_aggr': 'max', 'sage_normalize': False, 'sage_project': False, 'lr': 0.0038515649867990167, 'weight_decay': 1.7468819016055293e-06, 'epochs': 163, 'loss': 'mse', 'optimizer': 'adam', 'graph_mode': 'cutoff', 'cutoff': 0.7882419803894795, 'grm_norm': 'gcn', 'self_loops': True, 'use_snp_selection': False}. Best is trial 76 with value: 0.31793588769783154.
[I 2025-12-09 08:34:25,689] Trial 143 finished with value: 0.3100154184446371 and parameters: {'model_type': 'graphsage', 'hidden_dims': '[512, 64]', 'dropout': 0.5792092009519445, 'batch_norm': True, 'sage_aggr': 'max', 'sage_normalize': False, 'sage_project': False, 'lr': 0.004806459638090446, 'weight_decay': 3.000356930291209e-06, 'epochs': 311, 'loss': 'mse', 'optimizer': 'adam', 'graph_mode': 'cutoff', 'cutoff': 0.8362678297393005, 'grm_norm': 'gcn', 'self_loops': True, 'use_snp_selection': False}. Best is trial 76 with value: 0.31793588769783154.
[I 2025-12-09 08:35:45,978] Trial 144 finished with value: 0.309172392999647 and parameters: {'model_type': 'graphsage', 'hidden_dims': '[512, 64]', 'dropout': 0.17701827848484078, 'batch_norm': True, 'sage_aggr': 'max', 'sage_normalize': False, 'sage_project': False, 'lr': 0.002801764845855454, 'weight_decay': 1.0396419831571188e-06, 'epochs': 176, 'loss': 'mse', 'optimizer': 'adam', 'graph_mode': 'cutoff', 'cutoff': 0.8719344597931599, 'grm_norm': 'gcn', 'self_loops': True, 'use_snp_selection': False}. Best is trial 76 with value: 0.31793588769783154.
[I 2025-12-09 08:36:57,778] Trial 145 finished with value: 0.31262960290035763 and parameters: {'model_type': 'graphsage', 'hidden_dims': '[512, 64]', 'dropout': 0.32713010552100436, 'batch_norm': True, 'sage_aggr': 'max', 'sage_normalize': False, 'sage_project': False, 'lr': 0.006239571830658387, 'weight_decay': 2.0561772931261435e-06, 'epochs': 154, 'loss': 'mse', 'optimizer': 'adam', 'graph_mode': 'cutoff', 'cutoff': 0.8080712205042252, 'grm_norm': 'gcn', 'self_loops': True, 'use_snp_selection': False}. Best is trial 76 with value: 0.31793588769783154.
[I 2025-12-09 08:37:26,076] Trial 146 finished with value: 0.3109492424705212 and parameters: {'model_type': 'graphsage', 'hidden_dims': '[128, 64]', 'dropout': 0.3091416018302406, 'batch_norm': True, 'sage_aggr': 'max', 'sage_normalize': False, 'sage_project': False, 'lr': 0.005304521947315465, 'weight_decay': 4.860047769927905e-06, 'epochs': 146, 'loss': 'mse', 'optimizer': 'adam', 'graph_mode': 'cutoff', 'cutoff': 0.7411954149189877, 'grm_norm': 'gcn', 'self_loops': True, 'use_snp_selection': False}. Best is trial 76 with value: 0.31793588769783154.
[I 2025-12-09 08:38:49,450] Trial 147 finished with value: 0.3113667189600517 and parameters: {'model_type': 'graphsage', 'hidden_dims': '[512, 64]', 'dropout': 0.21343963862098064, 'batch_norm': True, 'sage_aggr': 'max', 'sage_normalize': False, 'sage_project': False, 'lr': 0.0074445723592248625, 'weight_decay': 3.229108006732968e-05, 'epochs': 184, 'loss': 'mse', 'optimizer': 'adam', 'graph_mode': 'cutoff', 'cutoff': 0.8515281541895766, 'grm_norm': 'gcn', 'self_loops': False, 'use_snp_selection': False}. Best is trial 76 with value: 0.31793588769783154.
[I 2025-12-09 08:39:36,455] Trial 148 finished with value: 0.30565118203459796 and parameters: {'model_type': 'graphsage', 'hidden_dims': '[256, 128]', 'dropout': 0.23295112191628586, 'batch_norm': True, 'sage_aggr': 'max', 'sage_normalize': False, 'sage_project': False, 'lr': 0.00010468862339727048, 'weight_decay': 3.292441422491326e-06, 'epochs': 173, 'loss': 'mse', 'optimizer': 'adam', 'graph_mode': 'cutoff', 'cutoff': 0.7755303773984297, 'grm_norm': 'none', 'self_loops': True, 'use_snp_selection': False}. Best is trial 76 with value: 0.31793588769783154.
[I 2025-12-09 08:40:50,794] Trial 149 finished with value: 0.31097035994885136 and parameters: {'model_type': 'graphsage', 'hidden_dims': '[512, 64]', 'dropout': 0.25787414617569787, 'batch_norm': True, 'sage_aggr': 'max', 'sage_normalize': False, 'sage_project': False, 'lr': 0.003247155303781799, 'weight_decay': 1.853868463738631e-05, 'epochs': 158, 'loss': 'mse', 'optimizer': 'adam', 'graph_mode': 'cutoff', 'cutoff': 0.8200413137405399, 'grm_norm': 'cosine_then_gcn', 'self_loops': True, 'use_snp_selection': False}. Best is trial 76 with value: 0.31793588769783154.
[I 2025-12-09 08:42:19,099] Trial 0 finished with value: 0.27920903804136443 and parameters: {'model_type': 'graphsage', 'hidden_dims': '[128, 64]', 'dropout': 0.199031432379812, 'batch_norm': True, 'sage_aggr': 'max', 'sage_normalize': True, 'sage_project': False, 'lr': 0.00034401453323286885, 'weight_decay': 0.00017802616915745114, 'epochs': 230, 'loss': 'mse', 'optimizer': 'adam', 'graph_mode': 'knn', 'knn_k': 6, 'weighted_edges': True, 'symmetrize_mode': 'mutual', 'self_loops': True, 'use_snp_selection': False}. Best is trial 0 with value: 0.27920903804136443.
[I 2025-12-09 08:43:58,311] Trial 1 finished with value: 0.27382358535799856 and parameters: {'model_type': 'graphsage', 'hidden_dims': '[512, 128]', 'dropout': 0.2503500283181017, 'batch_norm': False, 'sage_aggr': 'max', 'sage_normalize': False, 'sage_project': False, 'lr': 3.952233718592099e-05, 'weight_decay': 0.00026754769258252603, 'epochs': 149, 'loss': 'mse', 'optimizer': 'adam', 'graph_mode': 'knn', 'knn_k': 2, 'weighted_edges': False, 'symmetrize_mode': 'mutual', 'self_loops': True, 'use_snp_selection': True, 'num_snps': 49915}. Best is trial 0 with value: 0.27920903804136443.
[I 2025-12-09 08:45:14,589] Trial 2 finished with value: 0.29113381264524835 and parameters: {'model_type': 'graphsage', 'hidden_dims': '[512, 256]', 'dropout': 0.2785908793172681, 'batch_norm': False, 'sage_aggr': 'max', 'sage_normalize': False, 'sage_project': False, 'lr': 8.806039223165805e-05, 'weight_decay': 3.5153176302760294e-05, 'epochs': 147, 'loss': 'mae', 'optimizer': 'adam', 'graph_mode': 'cutoff', 'cutoff': 0.4922564006874869, 'grm_norm': 'gcn', 'self_loops': False, 'use_snp_selection': True, 'num_snps': 34340}. Best is trial 2 with value: 0.29113381264524835.
[I 2025-12-09 08:46:27,772] Trial 3 finished with value: 0.29892109109901555 and parameters: {'model_type': 'graphsage', 'hidden_dims': '[256, 128, 64]', 'dropout': 0.3475243154412272, 'batch_norm': True, 'sage_aggr': 'max', 'sage_normalize': False, 'sage_project': False, 'lr': 1.6006331996938085e-05, 'weight_decay': 7.213121225589906e-06, 'epochs': 283, 'loss': 'mse', 'optimizer': 'adam', 'graph_mode': 'cutoff', 'cutoff': 0.5942334791449215, 'grm_norm': 'none', 'self_loops': True, 'use_snp_selection': False}. Best is trial 3 with value: 0.29892109109901555.
[I 2025-12-09 08:47:10,348] Trial 4 finished with value: 0.26737598756460684 and parameters: {'model_type': 'graphsage', 'hidden_dims': '[128, 64]', 'dropout': 0.3348926467202472, 'batch_norm': True, 'sage_aggr': 'max', 'sage_normalize': False, 'sage_project': False, 'lr': 0.0004238630400638802, 'weight_decay': 8.074086040046576e-07, 'epochs': 158, 'loss': 'mae', 'optimizer': 'adam', 'graph_mode': 'knn', 'knn_k': 1, 'weighted_edges': False, 'symmetrize_mode': 'mutual', 'self_loops': False, 'use_snp_selection': True, 'num_snps': 26850}. Best is trial 3 with value: 0.29892109109901555.
[I 2025-12-09 08:48:58,031] Trial 5 finished with value: 0.27646494950779904 and parameters: {'model_type': 'graphsage', 'hidden_dims': '[512, 64]', 'dropout': 0.14505336736221927, 'batch_norm': True, 'sage_aggr': 'mean', 'sage_normalize': True, 'sage_project': False, 'lr': 1.2962030165732234e-05, 'weight_decay': 1.326598071105465e-07, 'epochs': 180, 'loss': 'mse', 'optimizer': 'adam', 'graph_mode': 'knn', 'knn_k': 9, 'weighted_edges': True, 'symmetrize_mode': 'mutual', 'self_loops': False, 'use_snp_selection': False}. Best is trial 3 with value: 0.29892109109901555.
[I 2025-12-09 08:49:51,008] Trial 6 finished with value: 0.3002832750127588 and parameters: {'model_type': 'graphsage', 'hidden_dims': '[256, 128, 64]', 'dropout': 0.10731743755162496, 'batch_norm': True, 'sage_aggr': 'mean', 'sage_normalize': False, 'sage_project': False, 'lr': 1.922990426933137e-05, 'weight_decay': 7.30001060446905e-05, 'epochs': 63, 'loss': 'mae', 'optimizer': 'adam', 'graph_mode': 'cutoff', 'cutoff': 0.7624978434202536, 'grm_norm': 'none', 'self_loops': True, 'use_snp_selection': True, 'num_snps': 50106}. Best is trial 6 with value: 0.3002832750127588.
[I 2025-12-09 08:51:43,384] Trial 7 finished with value: 0.286804222091136 and parameters: {'model_type': 'graphsage', 'hidden_dims': '[512, 64]', 'dropout': 0.2585007811528941, 'batch_norm': True, 'sage_aggr': 'max', 'sage_normalize': True, 'sage_project': False, 'lr': 5.921425508303391e-05, 'weight_decay': 0.0004511561961144237, 'epochs': 182, 'loss': 'mae', 'optimizer': 'adam', 'graph_mode': 'knn', 'knn_k': 9, 'weighted_edges': True, 'symmetrize_mode': 'union', 'self_loops': False, 'use_snp_selection': True, 'num_snps': 23903}. Best is trial 6 with value: 0.3002832750127588.
[I 2025-12-09 08:52:25,043] Trial 8 finished with value: 0.26584509325753597 and parameters: {'model_type': 'graphsage', 'hidden_dims': '[512, 256]', 'dropout': 0.3061380386767003, 'batch_norm': False, 'sage_aggr': 'mean', 'sage_normalize': True, 'sage_project': False, 'lr': 0.000698401460570184, 'weight_decay': 2.965560055460244e-06, 'epochs': 289, 'loss': 'mae', 'optimizer': 'adam', 'graph_mode': 'knn', 'knn_k': 7, 'weighted_edges': False, 'symmetrize_mode': 'mutual', 'self_loops': True, 'use_snp_selection': True, 'num_snps': 4710}. Best is trial 6 with value: 0.3002832750127588.
[I 2025-12-09 08:56:03,879] Trial 9 finished with value: 0.29408881224299266 and parameters: {'model_type': 'graphsage', 'hidden_dims': '[512, 128]', 'dropout': 0.1733844071393634, 'batch_norm': False, 'sage_aggr': 'mean', 'sage_normalize': True, 'sage_project': False, 'lr': 0.0004269677918501597, 'weight_decay': 2.2439779626249696e-06, 'epochs': 319, 'loss': 'mse', 'optimizer': 'adam', 'graph_mode': 'cutoff', 'cutoff': 0.24117565767129295, 'grm_norm': 'cosine_then_gcn', 'self_loops': True, 'use_snp_selection': False}. Best is trial 6 with value: 0.3002832750127588.
[I 2025-12-09 08:56:58,531] Trial 10 finished with value: 0.30150028382995075 and parameters: {'model_type': 'graphsage', 'hidden_dims': '[256, 128, 64]', 'dropout': 0.5365714961141473, 'batch_norm': True, 'sage_aggr': 'mean', 'sage_normalize': False, 'sage_project': False, 'lr': 0.0060050040216813455, 'weight_decay': 4.9377500793081834e-05, 'epochs': 46, 'loss': 'mae', 'optimizer': 'adam', 'graph_mode': 'cutoff', 'cutoff': 0.8579871888501912, 'grm_norm': 'none', 'self_loops': True, 'use_snp_selection': True, 'num_snps': 59927}. Best is trial 10 with value: 0.30150028382995075.
[I 2025-12-09 08:57:52,143] Trial 11 finished with value: 0.300188965987743 and parameters: {'model_type': 'graphsage', 'hidden_dims': '[256, 128, 64]', 'dropout': 0.5437810742461437, 'batch_norm': True, 'sage_aggr': 'mean', 'sage_normalize': False, 'sage_project': False, 'lr': 0.008000655871733665, 'weight_decay': 4.2521929457206324e-05, 'epochs': 47, 'loss': 'mae', 'optimizer': 'adam', 'graph_mode': 'cutoff', 'cutoff': 0.897550071387144, 'grm_norm': 'none', 'self_loops': True, 'use_snp_selection': True, 'num_snps': 57688}. Best is trial 10 with value: 0.30150028382995075.
[I 2025-12-09 08:58:39,142] Trial 12 finished with value: 0.2984420252117558 and parameters: {'model_type': 'graphsage', 'hidden_dims': '[256, 128, 64]', 'dropout': 0.4921208650038426, 'batch_norm': True, 'sage_aggr': 'mean', 'sage_normalize': False, 'sage_project': False, 'lr': 0.008796549023736102, 'weight_decay': 3.9327931719627325e-05, 'epochs': 41, 'loss': 'mae', 'optimizer': 'adam', 'graph_mode': 'cutoff', 'cutoff': 0.875858815737441, 'grm_norm': 'none', 'self_loops': True, 'use_snp_selection': True, 'num_snps': 47351}. Best is trial 10 with value: 0.30150028382995075.
[I 2025-12-09 08:59:45,993] Trial 13 finished with value: 0.30721453512023017 and parameters: {'model_type': 'graphsage', 'hidden_dims': '[256, 128]', 'dropout': 0.4531224598950059, 'batch_norm': True, 'sage_aggr': 'mean', 'sage_normalize': False, 'sage_project': False, 'lr': 0.0018867743234736779, 'weight_decay': 9.825249923480529e-05, 'epochs': 95, 'loss': 'mae', 'optimizer': 'adam', 'graph_mode': 'cutoff', 'cutoff': 0.7161701615384245, 'grm_norm': 'cosine', 'self_loops': True, 'use_snp_selection': True, 'num_snps': 59175}. Best is trial 13 with value: 0.30721453512023017.
[I 2025-12-09 09:00:53,887] Trial 14 finished with value: 0.2967722580227163 and parameters: {'model_type': 'graphsage', 'hidden_dims': '[256, 128]', 'dropout': 0.44099154398585816, 'batch_norm': True, 'sage_aggr': 'mean', 'sage_normalize': False, 'sage_project': False, 'lr': 0.0022062249231350386, 'weight_decay': 0.0009038765422009597, 'epochs': 104, 'loss': 'mae', 'optimizer': 'adam', 'graph_mode': 'cutoff', 'cutoff': 0.6836528639802814, 'grm_norm': 'cosine', 'self_loops': True, 'use_snp_selection': True, 'num_snps': 58151}. Best is trial 13 with value: 0.30721453512023017.
[I 2025-12-09 09:01:44,552] Trial 15 finished with value: 0.3100192548779145 and parameters: {'model_type': 'graphsage', 'hidden_dims': '[256, 128]', 'dropout': 0.592680978313739, 'batch_norm': True, 'sage_aggr': 'mean', 'sage_normalize': False, 'sage_project': False, 'lr': 0.0023098647528179386, 'weight_decay': 1.2745169168661226e-05, 'epochs': 104, 'loss': 'mae', 'optimizer': 'adam', 'graph_mode': 'cutoff', 'cutoff': 0.7543104848812722, 'grm_norm': 'cosine', 'self_loops': True, 'use_snp_selection': True, 'num_snps': 36478}. Best is trial 15 with value: 0.3100192548779145.
[I 2025-12-09 09:02:37,373] Trial 16 finished with value: 0.3074653345074366 and parameters: {'model_type': 'graphsage', 'hidden_dims': '[256, 128]', 'dropout': 0.5953759923762266, 'batch_norm': True, 'sage_aggr': 'mean', 'sage_normalize': False, 'sage_project': False, 'lr': 0.0018795800454544191, 'weight_decay': 8.172833436733392e-06, 'epochs': 101, 'loss': 'mae', 'optimizer': 'adam', 'graph_mode': 'cutoff', 'cutoff': 0.5102970168112307, 'grm_norm': 'cosine', 'self_loops': True, 'use_snp_selection': True, 'num_snps': 37163}. Best is trial 15 with value: 0.3100192548779145.
[I 2025-12-09 09:03:35,405] Trial 17 finished with value: 0.30217066967361833 and parameters: {'model_type': 'graphsage', 'hidden_dims': '[256, 128]', 'dropout': 0.5968415406439916, 'batch_norm': True, 'sage_aggr': 'mean', 'sage_normalize': False, 'sage_project': False, 'lr': 0.0014023242286984284, 'weight_decay': 1.2162643426055825e-05, 'epochs': 103, 'loss': 'mae', 'optimizer': 'adam', 'graph_mode': 'cutoff', 'cutoff': 0.4290204296557971, 'grm_norm': 'cosine', 'self_loops': True, 'use_snp_selection': True, 'num_snps': 36692}. Best is trial 15 with value: 0.3100192548779145.
