[I 2025-12-09 16:55:58,468] Trial 142 finished with value: 0.36361179302278873 and parameters: {'model_type': 'graphsage', 'hidden_dims': '[128, 64]', 'dropout': 0.3190899856123511, 'batch_norm': False, 'sage_aggr': 'mean', 'sage_normalize': False, 'sage_project': False, 'lr': 0.0001257620602591976, 'weight_decay': 5.0013619061980386e-05, 'epochs': 151, 'loss': 'mae', 'optimizer': 'adam', 'graph_mode': 'knn', 'knn_k': 9, 'weighted_edges': True, 'symmetrize_mode': 'union', 'self_loops': True, 'use_snp_selection': True, 'num_snps': 22403}. Best is trial 89 with value: 0.3741045796063055.
[I 2025-12-09 16:57:22,333] Trial 143 finished with value: 0.3662318463074076 and parameters: {'model_type': 'graphsage', 'hidden_dims': '[128, 64]', 'dropout': 0.30831241801788717, 'batch_norm': False, 'sage_aggr': 'mean', 'sage_normalize': False, 'sage_project': False, 'lr': 0.0001576356696640585, 'weight_decay': 0.00018921480550476488, 'epochs': 164, 'loss': 'mae', 'optimizer': 'adam', 'graph_mode': 'knn', 'knn_k': 9, 'weighted_edges': True, 'symmetrize_mode': 'union', 'self_loops': True, 'use_snp_selection': True, 'num_snps': 25553}. Best is trial 89 with value: 0.3741045796063055.
[I 2025-12-09 16:58:54,562] Trial 144 finished with value: 0.3732413650135363 and parameters: {'model_type': 'graphsage', 'hidden_dims': '[128, 64]', 'dropout': 0.3294232257005808, 'batch_norm': False, 'sage_aggr': 'mean', 'sage_normalize': False, 'sage_project': False, 'lr': 0.00018784666178621077, 'weight_decay': 0.000392585893082958, 'epochs': 184, 'loss': 'mae', 'optimizer': 'adam', 'graph_mode': 'knn', 'knn_k': 10, 'weighted_edges': True, 'symmetrize_mode': 'union', 'self_loops': True, 'use_snp_selection': True, 'num_snps': 24111}. Best is trial 89 with value: 0.3741045796063055.
[I 2025-12-09 17:00:03,359] Trial 145 finished with value: 0.36238827216118796 and parameters: {'model_type': 'graphsage', 'hidden_dims': '[128, 64]', 'dropout': 0.36168353710089346, 'batch_norm': False, 'sage_aggr': 'mean', 'sage_normalize': False, 'sage_project': False, 'lr': 0.00031313397300478964, 'weight_decay': 2.3735074197526265e-05, 'epochs': 118, 'loss': 'mae', 'optimizer': 'adam', 'graph_mode': 'knn', 'knn_k': 10, 'weighted_edges': True, 'symmetrize_mode': 'union', 'self_loops': True, 'use_snp_selection': True, 'num_snps': 24181}. Best is trial 89 with value: 0.3741045796063055.
[I 2025-12-09 17:02:03,663] Trial 146 finished with value: 0.3674142491070545 and parameters: {'model_type': 'graphsage', 'hidden_dims': '[128, 64]', 'dropout': 0.22420757597142835, 'batch_norm': False, 'sage_aggr': 'mean', 'sage_normalize': False, 'sage_project': False, 'lr': 0.00021542422523703297, 'weight_decay': 0.0005502763761817217, 'epochs': 183, 'loss': 'mae', 'optimizer': 'adam', 'graph_mode': 'knn', 'knn_k': 10, 'weighted_edges': True, 'symmetrize_mode': 'union', 'self_loops': True, 'use_snp_selection': True, 'num_snps': 30640}. Best is trial 89 with value: 0.3741045796063055.
[I 2025-12-09 17:03:19,982] Trial 147 finished with value: 0.36994055026264006 and parameters: {'model_type': 'graphsage', 'hidden_dims': '[128, 64]', 'dropout': 0.28489908817861626, 'batch_norm': False, 'sage_aggr': 'mean', 'sage_normalize': False, 'sage_project': False, 'lr': 4.741702293117096e-05, 'weight_decay': 0.00010859635287921862, 'epochs': 144, 'loss': 'mae', 'optimizer': 'adam', 'graph_mode': 'knn', 'knn_k': 10, 'weighted_edges': True, 'symmetrize_mode': 'mutual', 'self_loops': True, 'use_snp_selection': True, 'num_snps': 31958}. Best is trial 89 with value: 0.3741045796063055.
[I 2025-12-09 17:04:17,601] Trial 148 finished with value: 0.34847181544512457 and parameters: {'model_type': 'graphsage', 'hidden_dims': '[128, 64]', 'dropout': 0.2843552907598185, 'batch_norm': False, 'sage_aggr': 'mean', 'sage_normalize': False, 'sage_project': False, 'lr': 4.766023769784339e-05, 'weight_decay': 5.7591030974101943e-05, 'epochs': 85, 'loss': 'mae', 'optimizer': 'adam', 'graph_mode': 'knn', 'knn_k': 10, 'weighted_edges': True, 'symmetrize_mode': 'mutual', 'self_loops': True, 'use_snp_selection': True, 'num_snps': 29289}. Best is trial 89 with value: 0.3741045796063055.
[I 2025-12-09 17:05:34,884] Trial 149 finished with value: 0.3595008547875009 and parameters: {'model_type': 'graphsage', 'hidden_dims': '[128, 64]', 'dropout': 0.27353596672612157, 'batch_norm': False, 'sage_aggr': 'mean', 'sage_normalize': False, 'sage_project': False, 'lr': 6.446336251614375e-05, 'weight_decay': 0.0009141336078048654, 'epochs': 143, 'loss': 'mae', 'optimizer': 'adam', 'graph_mode': 'knn', 'knn_k': 10, 'weighted_edges': True, 'symmetrize_mode': 'mutual', 'self_loops': True, 'use_snp_selection': True, 'num_snps': 31987}. Best is trial 89 with value: 0.3741045796063055.
[I 2025-12-09 17:07:05,377] Trial 0 finished with value: 0.32943586572087963 and parameters: {'model_type': 'graphsage', 'hidden_dims': '[128, 64]', 'dropout': 0.199031432379812, 'batch_norm': True, 'sage_aggr': 'max', 'sage_normalize': True, 'sage_project': False, 'lr': 0.00034401453323286885, 'weight_decay': 0.00017802616915745114, 'epochs': 230, 'loss': 'mse', 'optimizer': 'adam', 'graph_mode': 'knn', 'knn_k': 6, 'weighted_edges': True, 'symmetrize_mode': 'mutual', 'self_loops': True, 'use_snp_selection': False}. Best is trial 0 with value: 0.32943586572087963.
[I 2025-12-09 17:08:44,299] Trial 1 finished with value: 0.3612718289425361 and parameters: {'model_type': 'graphsage', 'hidden_dims': '[512, 128]', 'dropout': 0.2503500283181017, 'batch_norm': False, 'sage_aggr': 'max', 'sage_normalize': False, 'sage_project': False, 'lr': 3.952233718592099e-05, 'weight_decay': 0.00026754769258252603, 'epochs': 149, 'loss': 'mse', 'optimizer': 'adam', 'graph_mode': 'knn', 'knn_k': 2, 'weighted_edges': False, 'symmetrize_mode': 'mutual', 'self_loops': True, 'use_snp_selection': True, 'num_snps': 49915}. Best is trial 1 with value: 0.3612718289425361.
[I 2025-12-09 17:10:00,471] Trial 2 finished with value: 0.3620743227333804 and parameters: {'model_type': 'graphsage', 'hidden_dims': '[512, 256]', 'dropout': 0.2785908793172681, 'batch_norm': False, 'sage_aggr': 'max', 'sage_normalize': False, 'sage_project': False, 'lr': 8.806039223165805e-05, 'weight_decay': 3.5153176302760294e-05, 'epochs': 147, 'loss': 'mae', 'optimizer': 'adam', 'graph_mode': 'cutoff', 'cutoff': 0.4922564006874869, 'grm_norm': 'gcn', 'self_loops': False, 'use_snp_selection': True, 'num_snps': 34340}. Best is trial 2 with value: 0.3620743227333804.
[I 2025-12-09 17:11:13,583] Trial 3 finished with value: 0.33983686113807493 and parameters: {'model_type': 'graphsage', 'hidden_dims': '[256, 128, 64]', 'dropout': 0.3475243154412272, 'batch_norm': True, 'sage_aggr': 'max', 'sage_normalize': False, 'sage_project': False, 'lr': 1.6006331996938085e-05, 'weight_decay': 7.213121225589906e-06, 'epochs': 283, 'loss': 'mse', 'optimizer': 'adam', 'graph_mode': 'cutoff', 'cutoff': 0.5942334791449215, 'grm_norm': 'none', 'self_loops': True, 'use_snp_selection': False}. Best is trial 2 with value: 0.3620743227333804.
[I 2025-12-09 17:11:55,785] Trial 4 finished with value: 0.3160741239652395 and parameters: {'model_type': 'graphsage', 'hidden_dims': '[128, 64]', 'dropout': 0.3348926467202472, 'batch_norm': True, 'sage_aggr': 'max', 'sage_normalize': False, 'sage_project': False, 'lr': 0.0004238630400638802, 'weight_decay': 8.074086040046576e-07, 'epochs': 158, 'loss': 'mae', 'optimizer': 'adam', 'graph_mode': 'knn', 'knn_k': 1, 'weighted_edges': False, 'symmetrize_mode': 'mutual', 'self_loops': False, 'use_snp_selection': True, 'num_snps': 26850}. Best is trial 2 with value: 0.3620743227333804.
[I 2025-12-09 17:13:43,286] Trial 5 finished with value: 0.31846876412881686 and parameters: {'model_type': 'graphsage', 'hidden_dims': '[512, 64]', 'dropout': 0.14505336736221927, 'batch_norm': True, 'sage_aggr': 'mean', 'sage_normalize': True, 'sage_project': False, 'lr': 1.2962030165732234e-05, 'weight_decay': 1.326598071105465e-07, 'epochs': 180, 'loss': 'mse', 'optimizer': 'adam', 'graph_mode': 'knn', 'knn_k': 9, 'weighted_edges': True, 'symmetrize_mode': 'mutual', 'self_loops': False, 'use_snp_selection': False}. Best is trial 2 with value: 0.3620743227333804.
[I 2025-12-09 17:14:35,880] Trial 6 finished with value: 0.33275058566238613 and parameters: {'model_type': 'graphsage', 'hidden_dims': '[256, 128, 64]', 'dropout': 0.10731743755162496, 'batch_norm': True, 'sage_aggr': 'mean', 'sage_normalize': False, 'sage_project': False, 'lr': 1.922990426933137e-05, 'weight_decay': 7.30001060446905e-05, 'epochs': 63, 'loss': 'mae', 'optimizer': 'adam', 'graph_mode': 'cutoff', 'cutoff': 0.7624978434202536, 'grm_norm': 'none', 'self_loops': True, 'use_snp_selection': True, 'num_snps': 50106}. Best is trial 2 with value: 0.3620743227333804.
[I 2025-12-09 17:16:29,884] Trial 7 finished with value: 0.3391005146774341 and parameters: {'model_type': 'graphsage', 'hidden_dims': '[512, 64]', 'dropout': 0.2585007811528941, 'batch_norm': True, 'sage_aggr': 'max', 'sage_normalize': True, 'sage_project': False, 'lr': 5.921425508303391e-05, 'weight_decay': 0.0004511561961144237, 'epochs': 182, 'loss': 'mae', 'optimizer': 'adam', 'graph_mode': 'knn', 'knn_k': 9, 'weighted_edges': True, 'symmetrize_mode': 'union', 'self_loops': False, 'use_snp_selection': True, 'num_snps': 23903}. Best is trial 2 with value: 0.3620743227333804.
[I 2025-12-09 17:17:11,227] Trial 8 finished with value: 0.31156620533281965 and parameters: {'model_type': 'graphsage', 'hidden_dims': '[512, 256]', 'dropout': 0.3061380386767003, 'batch_norm': False, 'sage_aggr': 'mean', 'sage_normalize': True, 'sage_project': False, 'lr': 0.000698401460570184, 'weight_decay': 2.965560055460244e-06, 'epochs': 289, 'loss': 'mae', 'optimizer': 'adam', 'graph_mode': 'knn', 'knn_k': 7, 'weighted_edges': False, 'symmetrize_mode': 'mutual', 'self_loops': True, 'use_snp_selection': True, 'num_snps': 4710}. Best is trial 2 with value: 0.3620743227333804.
[I 2025-12-09 17:20:49,626] Trial 9 finished with value: 0.3465831354550776 and parameters: {'model_type': 'graphsage', 'hidden_dims': '[512, 128]', 'dropout': 0.1733844071393634, 'batch_norm': False, 'sage_aggr': 'mean', 'sage_normalize': True, 'sage_project': False, 'lr': 0.0004269677918501597, 'weight_decay': 2.2439779626249696e-06, 'epochs': 319, 'loss': 'mse', 'optimizer': 'adam', 'graph_mode': 'cutoff', 'cutoff': 0.24117565767129295, 'grm_norm': 'cosine_then_gcn', 'self_loops': True, 'use_snp_selection': False}. Best is trial 2 with value: 0.3620743227333804.
[I 2025-12-09 17:21:53,504] Trial 10 finished with value: 0.0 and parameters: {'model_type': 'graphsage', 'hidden_dims': '[512, 256]', 'dropout': 0.46773351022590026, 'batch_norm': False, 'sage_aggr': 'max', 'sage_normalize': False, 'sage_project': False, 'lr': 0.0060050040216813455, 'weight_decay': 3.194347401809951e-05, 'epochs': 76, 'loss': 'mae', 'optimizer': 'adam', 'graph_mode': 'cutoff', 'cutoff': 0.36538426242387784, 'grm_norm': 'gcn', 'self_loops': False, 'use_snp_selection': True, 'num_snps': 36724}. Best is trial 2 with value: 0.3620743227333804.
[I 2025-12-09 17:23:36,564] Trial 11 finished with value: 0.21700699550360647 and parameters: {'model_type': 'graphsage', 'hidden_dims': '[512, 128]', 'dropout': 0.4554228059341249, 'batch_norm': False, 'sage_aggr': 'max', 'sage_normalize': False, 'sage_project': False, 'lr': 8.040010782675617e-05, 'weight_decay': 0.0005735134390673265, 'epochs': 111, 'loss': 'mse', 'optimizer': 'adam', 'graph_mode': 'cutoff', 'cutoff': 0.48934453790731597, 'grm_norm': 'gcn', 'self_loops': False, 'use_snp_selection': True, 'num_snps': 57852}. Best is trial 2 with value: 0.3620743227333804.
[I 2025-12-09 17:24:47,620] Trial 12 finished with value: 0.28532526618875675 and parameters: {'model_type': 'graphsage', 'hidden_dims': '[256, 128]', 'dropout': 0.5957621421360685, 'batch_norm': False, 'sage_aggr': 'max', 'sage_normalize': False, 'sage_project': False, 'lr': 9.196950102765017e-05, 'weight_decay': 3.009671916983956e-05, 'epochs': 138, 'loss': 'mse', 'optimizer': 'adam', 'graph_mode': 'knn', 'knn_k': 1, 'weighted_edges': False, 'symmetrize_mode': 'union', 'self_loops': True, 'use_snp_selection': True, 'num_snps': 41579}. Best is trial 2 with value: 0.3620743227333804.
[I 2025-12-09 17:26:29,795] Trial 13 finished with value: 0.3549723365516738 and parameters: {'model_type': 'graphsage', 'hidden_dims': '[512, 128]', 'dropout': 0.232363982604941, 'batch_norm': False, 'sage_aggr': 'max', 'sage_normalize': False, 'sage_project': False, 'lr': 4.819859523109959e-05, 'weight_decay': 0.00011926072016900266, 'epochs': 223, 'loss': 'mae', 'optimizer': 'adam', 'graph_mode': 'cutoff', 'cutoff': 0.8137943133270612, 'grm_norm': 'cosine', 'self_loops': False, 'use_snp_selection': True, 'num_snps': 44122}. Best is trial 2 with value: 0.3620743227333804.
[I 2025-12-09 17:27:17,250] Trial 14 finished with value: 0.3484279109952789 and parameters: {'model_type': 'graphsage', 'hidden_dims': '[512, 256]', 'dropout': 0.420004136612043, 'batch_norm': False, 'sage_aggr': 'max', 'sage_normalize': False, 'sage_project': False, 'lr': 0.00011914209383103213, 'weight_decay': 0.000989888024080623, 'epochs': 120, 'loss': 'mse', 'optimizer': 'adam', 'graph_mode': 'knn', 'knn_k': 3, 'weighted_edges': False, 'symmetrize_mode': 'mutual', 'self_loops': True, 'use_snp_selection': True, 'num_snps': 16713}. Best is trial 2 with value: 0.3620743227333804.
[I 2025-12-09 17:28:09,088] Trial 15 finished with value: 0.05068134361788572 and parameters: {'model_type': 'graphsage', 'hidden_dims': '[256, 128]', 'dropout': 0.26548128812133703, 'batch_norm': False, 'sage_aggr': 'max', 'sage_normalize': False, 'sage_project': False, 'lr': 0.001140050652126762, 'weight_decay': 3.2519139811105935e-05, 'epochs': 41, 'loss': 'mae', 'optimizer': 'adam', 'graph_mode': 'cutoff', 'cutoff': 0.5928979992521486, 'grm_norm': 'gcn', 'self_loops': False, 'use_snp_selection': True, 'num_snps': 56944}. Best is trial 2 with value: 0.3620743227333804.
[I 2025-12-09 17:29:20,911] Trial 16 finished with value: 0.1107689788322623 and parameters: {'model_type': 'graphsage', 'hidden_dims': '[512, 256]', 'dropout': 0.39350777114497715, 'batch_norm': False, 'sage_aggr': 'max', 'sage_normalize': False, 'sage_project': False, 'lr': 0.0001503378949109947, 'weight_decay': 0.00018360671125602785, 'epochs': 92, 'loss': 'mse', 'optimizer': 'adam', 'graph_mode': 'knn', 'knn_k': 4, 'weighted_edges': False, 'symmetrize_mode': 'union', 'self_loops': False, 'use_snp_selection': True, 'num_snps': 33164}. Best is trial 2 with value: 0.3620743227333804.
[I 2025-12-09 17:31:46,122] Trial 17 finished with value: 0.35831977790329667 and parameters: {'model_type': 'graphsage', 'hidden_dims': '[512, 128]', 'dropout': 0.2881021929685086, 'batch_norm': False, 'sage_aggr': 'max', 'sage_normalize': False, 'sage_project': False, 'lr': 3.851579445299815e-05, 'weight_decay': 1.3591103086412823e-05, 'epochs': 222, 'loss': 'mae', 'optimizer': 'adam', 'graph_mode': 'cutoff', 'cutoff': 0.42979538969295905, 'grm_norm': 'cosine', 'self_loops': True, 'use_snp_selection': True, 'num_snps': 48827}. Best is trial 2 with value: 0.3620743227333804.
[I 2025-12-09 17:32:57,569] Trial 18 finished with value: 0.008082965799568348 and parameters: {'model_type': 'graphsage', 'hidden_dims': '[512, 256]', 'dropout': 0.5268947259583335, 'batch_norm': False, 'sage_aggr': 'mean', 'sage_normalize': False, 'sage_project': False, 'lr': 0.0017005019955241487, 'weight_decay': 0.0003315106954073976, 'epochs': 141, 'loss': 'mse', 'optimizer': 'adam', 'graph_mode': 'knn', 'knn_k': 3, 'weighted_edges': False, 'symmetrize_mode': 'mutual', 'self_loops': False, 'use_snp_selection': False}. Best is trial 2 with value: 0.3620743227333804.
[I 2025-12-09 17:33:55,628] Trial 19 finished with value: 0.3375130265930261 and parameters: {'model_type': 'graphsage', 'hidden_dims': '[512, 128]', 'dropout': 0.21736591011409595, 'batch_norm': False, 'sage_aggr': 'max', 'sage_normalize': False, 'sage_project': False, 'lr': 0.00019416945668393836, 'weight_decay': 6.640367756468555e-05, 'epochs': 254, 'loss': 'mae', 'optimizer': 'adam', 'graph_mode': 'cutoff', 'cutoff': 0.6756596795285363, 'grm_norm': 'cosine_then_gcn', 'self_loops': True, 'use_snp_selection': True, 'num_snps': 17161}. Best is trial 2 with value: 0.3620743227333804.
[I 2025-12-09 17:36:08,457] Trial 20 finished with value: 0.3466914339193066 and parameters: {'model_type': 'graphsage', 'hidden_dims': '[512, 64]', 'dropout': 0.3877970947555355, 'batch_norm': False, 'sage_aggr': 'max', 'sage_normalize': False, 'sage_project': False, 'lr': 2.9052813040219113e-05, 'weight_decay': 1.0647055267395334e-05, 'epochs': 193, 'loss': 'mae', 'optimizer': 'adam', 'graph_mode': 'cutoff', 'cutoff': 0.29454734311567576, 'grm_norm': 'gcn', 'self_loops': True, 'use_snp_selection': True, 'num_snps': 38462}. Best is trial 2 with value: 0.3620743227333804.
[I 2025-12-09 17:38:35,158] Trial 21 finished with value: 0.3582124090755212 and parameters: {'model_type': 'graphsage', 'hidden_dims': '[512, 128]', 'dropout': 0.2944574799770798, 'batch_norm': False, 'sage_aggr': 'max', 'sage_normalize': False, 'sage_project': False, 'lr': 3.262023724166822e-05, 'weight_decay': 1.1756562937495471e-05, 'epochs': 227, 'loss': 'mae', 'optimizer': 'adam', 'graph_mode': 'cutoff', 'cutoff': 0.4424983461236115, 'grm_norm': 'cosine', 'self_loops': True, 'use_snp_selection': True, 'num_snps': 49446}. Best is trial 2 with value: 0.3620743227333804.
[I 2025-12-09 17:40:34,589] Trial 22 finished with value: 0.3607597916618372 and parameters: {'model_type': 'graphsage', 'hidden_dims': '[512, 128]', 'dropout': 0.2945017275526477, 'batch_norm': False, 'sage_aggr': 'max', 'sage_normalize': False, 'sage_project': False, 'lr': 4.766115685403152e-05, 'weight_decay': 4.7974144989055255e-06, 'epochs': 161, 'loss': 'mae', 'optimizer': 'adam', 'graph_mode': 'cutoff', 'cutoff': 0.40560259998274506, 'grm_norm': 'cosine', 'self_loops': True, 'use_snp_selection': True, 'num_snps': 49111}. Best is trial 2 with value: 0.3620743227333804.
[I 2025-12-09 17:42:48,352] Trial 23 finished with value: 0.2701267689584219 and parameters: {'model_type': 'graphsage', 'hidden_dims': '[512, 128]', 'dropout': 0.321368569641238, 'batch_norm': False, 'sage_aggr': 'max', 'sage_normalize': False, 'sage_project': False, 'lr': 0.0001980161923444911, 'weight_decay': 1.1596829521873898e-06, 'epochs': 162, 'loss': 'mae', 'optimizer': 'adam', 'graph_mode': 'cutoff', 'cutoff': 0.35615964347637397, 'grm_norm': 'cosine', 'self_loops': True, 'use_snp_selection': True, 'num_snps': 53352}. Best is trial 2 with value: 0.3620743227333804.
[I 2025-12-09 17:43:59,509] Trial 24 finished with value: 0.3604843217582596 and parameters: {'model_type': 'graphsage', 'hidden_dims': '[512, 128]', 'dropout': 0.25245793306419145, 'batch_norm': False, 'sage_aggr': 'max', 'sage_normalize': False, 'sage_project': False, 'lr': 2.2104451098293445e-05, 'weight_decay': 4.7266750653816393e-07, 'epochs': 108, 'loss': 'mae', 'optimizer': 'adam', 'graph_mode': 'cutoff', 'cutoff': 0.5279982242381891, 'grm_norm': 'gcn', 'self_loops': True, 'use_snp_selection': True, 'num_snps': 41950}. Best is trial 2 with value: 0.3620743227333804.
[I 2025-12-09 17:46:21,886] Trial 25 finished with value: 0.33666809609096465 and parameters: {'model_type': 'graphsage', 'hidden_dims': '[128, 64]', 'dropout': 0.17487455393255324, 'batch_norm': False, 'sage_aggr': 'max', 'sage_normalize': False, 'sage_project': False, 'lr': 1.0672870349803469e-05, 'weight_decay': 3.864524421734812e-06, 'epochs': 146, 'loss': 'mae', 'optimizer': 'adam', 'graph_mode': 'cutoff', 'cutoff': 0.20622145561126742, 'grm_norm': 'cosine', 'self_loops': True, 'use_snp_selection': True, 'num_snps': 45935}. Best is trial 2 with value: 0.3620743227333804.
[I 2025-12-09 17:47:43,377] Trial 26 finished with value: 0.34009492093802207 and parameters: {'model_type': 'graphsage', 'hidden_dims': '[256, 128, 64]', 'dropout': 0.3601068377189016, 'batch_norm': False, 'sage_aggr': 'max', 'sage_normalize': True, 'sage_project': False, 'lr': 6.780809022554441e-05, 'weight_decay': 2.3868119617303925e-05, 'epochs': 167, 'loss': 'mse', 'optimizer': 'adam', 'graph_mode': 'knn', 'knn_k': 4, 'weighted_edges': True, 'symmetrize_mode': 'union', 'self_loops': False, 'use_snp_selection': True, 'num_snps': 31856}. Best is trial 2 with value: 0.3620743227333804.
[I 2025-12-09 17:48:19,767] Trial 27 finished with value: 0.36507967818294274 and parameters: {'model_type': 'graphsage', 'hidden_dims': '[256, 128]', 'dropout': 0.28070416043189333, 'batch_norm': False, 'sage_aggr': 'mean', 'sage_normalize': False, 'sage_project': False, 'lr': 3.9048833905245884e-05, 'weight_decay': 7.320364129987815e-06, 'epochs': 123, 'loss': 'mae', 'optimizer': 'adam', 'graph_mode': 'cutoff', 'cutoff': 0.6912811562878352, 'grm_norm': 'none', 'self_loops': True, 'use_snp_selection': False}. Best is trial 27 with value: 0.36507967818294274.
[I 2025-12-09 17:48:59,103] Trial 28 finished with value: 0.3227753765773926 and parameters: {'model_type': 'graphsage', 'hidden_dims': '[256, 128]', 'dropout': 0.21040646845394917, 'batch_norm': False, 'sage_aggr': 'mean', 'sage_normalize': False, 'sage_project': False, 'lr': 0.00012789901538670924, 'weight_decay': 6.51174647476799e-05, 'epochs': 126, 'loss': 'mse', 'optimizer': 'adam', 'graph_mode': 'knn', 'knn_k': 2, 'weighted_edges': False, 'symmetrize_mode': 'mutual', 'self_loops': False, 'use_snp_selection': False}. Best is trial 27 with value: 0.36507967818294274.
