[I 2025-12-08 15:59:32,887] Trial 75 finished with value: 0.3648808237161004 and parameters: {'model_type': 'graphsage', 'hidden_dims': '[512, 256]', 'dropout': 0.4657952842190335, 'batch_norm': True, 'sage_aggr': 'max', 'sage_normalize': True, 'sage_project': False, 'lr': 0.0014037775645755182, 'weight_decay': 0.00033811766969722837, 'epochs': 85, 'loss': 'mae', 'optimizer': 'adam', 'graph_mode': 'knn', 'knn_k': 8, 'weighted_edges': True, 'symmetrize_mode': 'union', 'self_loops': False, 'use_snp_selection': True, 'num_snps': 32079}. Best is trial 61 with value: 0.37123953196455645.
[I 2025-12-08 16:01:00,840] Trial 76 finished with value: 0.3592339228092805 and parameters: {'model_type': 'graphsage', 'hidden_dims': '[512, 256]', 'dropout': 0.3977398801217631, 'batch_norm': True, 'sage_aggr': 'max', 'sage_normalize': True, 'sage_project': False, 'lr': 0.0014049228039906313, 'weight_decay': 0.00036282287497084724, 'epochs': 83, 'loss': 'mae', 'optimizer': 'adam', 'graph_mode': 'knn', 'knn_k': 8, 'weighted_edges': True, 'symmetrize_mode': 'union', 'self_loops': False, 'use_snp_selection': True, 'num_snps': 35620}. Best is trial 61 with value: 0.37123953196455645.
[I 2025-12-08 16:02:24,594] Trial 77 finished with value: 0.35160190360818355 and parameters: {'model_type': 'graphsage', 'hidden_dims': '[512, 256]', 'dropout': 0.4205750431198697, 'batch_norm': True, 'sage_aggr': 'max', 'sage_normalize': True, 'sage_project': False, 'lr': 0.002791929793678304, 'weight_decay': 0.0006636513450514637, 'epochs': 123, 'loss': 'mae', 'optimizer': 'adam', 'graph_mode': 'knn', 'knn_k': 7, 'weighted_edges': True, 'symmetrize_mode': 'union', 'self_loops': False, 'use_snp_selection': True, 'num_snps': 27964}. Best is trial 61 with value: 0.37123953196455645.
[I 2025-12-08 16:03:59,876] Trial 78 finished with value: 0.3308316662013516 and parameters: {'model_type': 'graphsage', 'hidden_dims': '[512, 256]', 'dropout': 0.43798448001822643, 'batch_norm': True, 'sage_aggr': 'max', 'sage_normalize': True, 'sage_project': False, 'lr': 0.0010946627355351765, 'weight_decay': 0.0002282238861487964, 'epochs': 92, 'loss': 'mae', 'optimizer': 'adam', 'graph_mode': 'knn', 'knn_k': 9, 'weighted_edges': True, 'symmetrize_mode': 'union', 'self_loops': True, 'use_snp_selection': False}. Best is trial 61 with value: 0.37123953196455645.
[I 2025-12-08 16:04:57,745] Trial 79 finished with value: 0.3520477512901046 and parameters: {'model_type': 'graphsage', 'hidden_dims': '[256, 128, 64]', 'dropout': 0.5018977643582734, 'batch_norm': True, 'sage_aggr': 'max', 'sage_normalize': True, 'sage_project': False, 'lr': 0.004706318710302695, 'weight_decay': 0.00034934370923586286, 'epochs': 117, 'loss': 'mae', 'optimizer': 'adam', 'graph_mode': 'knn', 'knn_k': 8, 'weighted_edges': True, 'symmetrize_mode': 'union', 'self_loops': False, 'use_snp_selection': True, 'num_snps': 18482}. Best is trial 61 with value: 0.37123953196455645.
[I 2025-12-08 16:05:49,363] Trial 80 finished with value: 0.3078176803460288 and parameters: {'model_type': 'graphsage', 'hidden_dims': '[512, 256]', 'dropout': 0.5314037811110945, 'batch_norm': False, 'sage_aggr': 'max', 'sage_normalize': True, 'sage_project': False, 'lr': 0.0005839924597099247, 'weight_decay': 0.00046991760761028374, 'epochs': 55, 'loss': 'mae', 'optimizer': 'adam', 'graph_mode': 'cutoff', 'cutoff': 0.719700078906713, 'grm_norm': 'cosine_then_gcn', 'self_loops': False, 'use_snp_selection': True, 'num_snps': 37921}. Best is trial 61 with value: 0.37123953196455645.
[I 2025-12-08 16:07:54,238] Trial 81 finished with value: 0.3675989321895065 and parameters: {'model_type': 'graphsage', 'hidden_dims': '[512, 256]', 'dropout': 0.4554112160434089, 'batch_norm': True, 'sage_aggr': 'max', 'sage_normalize': True, 'sage_project': False, 'lr': 0.0037220932813578542, 'weight_decay': 1.3325762557175265e-05, 'epochs': 110, 'loss': 'mae', 'optimizer': 'adam', 'graph_mode': 'knn', 'knn_k': 8, 'weighted_edges': True, 'symmetrize_mode': 'union', 'self_loops': False, 'use_snp_selection': True, 'num_snps': 40611}. Best is trial 61 with value: 0.37123953196455645.
[I 2025-12-08 16:10:19,718] Trial 82 finished with value: 0.3498234704492651 and parameters: {'model_type': 'graphsage', 'hidden_dims': '[512, 256]', 'dropout': 0.46290620755782225, 'batch_norm': True, 'sage_aggr': 'max', 'sage_normalize': True, 'sage_project': False, 'lr': 0.002071885794081259, 'weight_decay': 8.991374568314446e-06, 'epochs': 129, 'loss': 'mae', 'optimizer': 'adam', 'graph_mode': 'knn', 'knn_k': 8, 'weighted_edges': True, 'symmetrize_mode': 'union', 'self_loops': False, 'use_snp_selection': True, 'num_snps': 42213}. Best is trial 61 with value: 0.37123953196455645.
[I 2025-12-08 16:14:19,896] Trial 83 finished with value: 0.36257700158506256 and parameters: {'model_type': 'graphsage', 'hidden_dims': '[512, 256]', 'dropout': 0.4115610183110543, 'batch_norm': True, 'sage_aggr': 'max', 'sage_normalize': True, 'sage_project': False, 'lr': 0.0027834939242783814, 'weight_decay': 6.136936875994504e-06, 'epochs': 285, 'loss': 'mae', 'optimizer': 'adam', 'graph_mode': 'knn', 'knn_k': 7, 'weighted_edges': True, 'symmetrize_mode': 'union', 'self_loops': False, 'use_snp_selection': True, 'num_snps': 40595}. Best is trial 61 with value: 0.37123953196455645.
[I 2025-12-08 16:17:21,544] Trial 84 finished with value: 0.33934662776926694 and parameters: {'model_type': 'graphsage', 'hidden_dims': '[512, 256]', 'dropout': 0.38531373484540316, 'batch_norm': True, 'sage_aggr': 'max', 'sage_normalize': True, 'sage_project': False, 'lr': 0.005988677539363481, 'weight_decay': 1.3146502182870452e-05, 'epochs': 111, 'loss': 'mae', 'optimizer': 'adam', 'graph_mode': 'knn', 'knn_k': 9, 'weighted_edges': True, 'symmetrize_mode': 'union', 'self_loops': False, 'use_snp_selection': True, 'num_snps': 54282}. Best is trial 61 with value: 0.37123953196455645.
[I 2025-12-08 16:18:36,047] Trial 85 finished with value: 0.2599894627691574 and parameters: {'model_type': 'graphsage', 'hidden_dims': '[128, 64]', 'dropout': 0.4452967468546989, 'batch_norm': True, 'sage_aggr': 'max', 'sage_normalize': True, 'sage_project': False, 'lr': 1.1288449836298323e-05, 'weight_decay': 0.00013128540276261243, 'epochs': 95, 'loss': 'mae', 'optimizer': 'adam', 'graph_mode': 'knn', 'knn_k': 8, 'weighted_edges': True, 'symmetrize_mode': 'mutual', 'self_loops': False, 'use_snp_selection': True, 'num_snps': 45360}. Best is trial 61 with value: 0.37123953196455645.
[I 2025-12-08 16:19:43,094] Trial 86 finished with value: 0.3580793649850536 and parameters: {'model_type': 'graphsage', 'hidden_dims': '[512, 256]', 'dropout': 0.40093028563977784, 'batch_norm': True, 'sage_aggr': 'max', 'sage_normalize': False, 'sage_project': False, 'lr': 0.0017875850358688417, 'weight_decay': 2.6290852667337443e-05, 'epochs': 83, 'loss': 'mse', 'optimizer': 'adam', 'graph_mode': 'knn', 'knn_k': 6, 'weighted_edges': False, 'symmetrize_mode': 'union', 'self_loops': False, 'use_snp_selection': True, 'num_snps': 26425}. Best is trial 61 with value: 0.37123953196455645.
[I 2025-12-08 16:20:35,161] Trial 87 finished with value: 0.36091862011741915 and parameters: {'model_type': 'graphsage', 'hidden_dims': '[512, 256]', 'dropout': 0.42515535459952214, 'batch_norm': True, 'sage_aggr': 'max', 'sage_normalize': True, 'sage_project': False, 'lr': 0.004445247227212063, 'weight_decay': 0.00020444125613782048, 'epochs': 64, 'loss': 'mae', 'optimizer': 'adam', 'graph_mode': 'knn', 'knn_k': 5, 'weighted_edges': True, 'symmetrize_mode': 'union', 'self_loops': False, 'use_snp_selection': True, 'num_snps': 23662}. Best is trial 61 with value: 0.37123953196455645.
[I 2025-12-08 16:21:40,832] Trial 88 finished with value: 0.3552622348870298 and parameters: {'model_type': 'graphsage', 'hidden_dims': '[256, 128]', 'dropout': 0.3544004504522094, 'batch_norm': True, 'sage_aggr': 'mean', 'sage_normalize': True, 'sage_project': False, 'lr': 0.0025149232282309225, 'weight_decay': 8.908294138972314e-05, 'epochs': 72, 'loss': 'mae', 'optimizer': 'adam', 'graph_mode': 'knn', 'knn_k': 7, 'weighted_edges': True, 'symmetrize_mode': 'union', 'self_loops': False, 'use_snp_selection': True, 'num_snps': 32552}. Best is trial 61 with value: 0.37123953196455645.
[I 2025-12-08 16:23:02,862] Trial 89 finished with value: 0.3660515939173835 and parameters: {'model_type': 'graphsage', 'hidden_dims': '[512, 128]', 'dropout': 0.4951610585082817, 'batch_norm': True, 'sage_aggr': 'max', 'sage_normalize': True, 'sage_project': False, 'lr': 0.008553003986002939, 'weight_decay': 1.6253535801898744e-05, 'epochs': 90, 'loss': 'mae', 'optimizer': 'adam', 'graph_mode': 'knn', 'knn_k': 8, 'weighted_edges': True, 'symmetrize_mode': 'union', 'self_loops': False, 'use_snp_selection': True, 'num_snps': 28567}. Best is trial 61 with value: 0.37123953196455645.
[I 2025-12-08 16:23:57,479] Trial 90 finished with value: 0.2473918668804443 and parameters: {'model_type': 'graphsage', 'hidden_dims': '[512, 128]', 'dropout': 0.4947419267633245, 'batch_norm': True, 'sage_aggr': 'max', 'sage_normalize': True, 'sage_project': False, 'lr': 0.008250316361148735, 'weight_decay': 7.654573345733271e-06, 'epochs': 46, 'loss': 'mae', 'optimizer': 'adam', 'graph_mode': 'knn', 'knn_k': 9, 'weighted_edges': True, 'symmetrize_mode': 'union', 'self_loops': True, 'use_snp_selection': False}. Best is trial 61 with value: 0.37123953196455645.
[I 2025-12-08 16:25:21,491] Trial 91 finished with value: 0.3662272093863164 and parameters: {'model_type': 'graphsage', 'hidden_dims': '[512, 128]', 'dropout': 0.5284488778859637, 'batch_norm': True, 'sage_aggr': 'max', 'sage_normalize': True, 'sage_project': False, 'lr': 0.0033231868403898654, 'weight_decay': 1.818920404784995e-05, 'epochs': 90, 'loss': 'mae', 'optimizer': 'adam', 'graph_mode': 'knn', 'knn_k': 8, 'weighted_edges': True, 'symmetrize_mode': 'union', 'self_loops': False, 'use_snp_selection': True, 'num_snps': 29208}. Best is trial 61 with value: 0.37123953196455645.
[I 2025-12-08 16:26:57,993] Trial 92 finished with value: 0.37257134400995034 and parameters: {'model_type': 'graphsage', 'hidden_dims': '[512, 128]', 'dropout': 0.5504664719061069, 'batch_norm': True, 'sage_aggr': 'max', 'sage_normalize': True, 'sage_project': False, 'lr': 0.0056444794644588, 'weight_decay': 1.7268021440921305e-05, 'epochs': 113, 'loss': 'mae', 'optimizer': 'adam', 'graph_mode': 'knn', 'knn_k': 8, 'weighted_edges': True, 'symmetrize_mode': 'union', 'self_loops': False, 'use_snp_selection': True, 'num_snps': 29513}. Best is trial 92 with value: 0.37257134400995034.
[I 2025-12-08 16:28:23,079] Trial 93 finished with value: 0.36229049949164704 and parameters: {'model_type': 'graphsage', 'hidden_dims': '[512, 128]', 'dropout': 0.5638179807654, 'batch_norm': True, 'sage_aggr': 'max', 'sage_normalize': True, 'sage_project': False, 'lr': 0.008674471397114565, 'weight_decay': 1.3167560349491498e-05, 'epochs': 90, 'loss': 'mae', 'optimizer': 'adam', 'graph_mode': 'knn', 'knn_k': 8, 'weighted_edges': True, 'symmetrize_mode': 'union', 'self_loops': False, 'use_snp_selection': True, 'num_snps': 29033}. Best is trial 92 with value: 0.37257134400995034.
[I 2025-12-08 16:29:52,077] Trial 94 finished with value: 0.35981992186448686 and parameters: {'model_type': 'graphsage', 'hidden_dims': '[512, 128]', 'dropout': 0.5530252451735154, 'batch_norm': True, 'sage_aggr': 'max', 'sage_normalize': True, 'sage_project': False, 'lr': 0.00564984436354996, 'weight_decay': 1.7403259764413477e-05, 'epochs': 113, 'loss': 'mae', 'optimizer': 'adam', 'graph_mode': 'knn', 'knn_k': 8, 'weighted_edges': True, 'symmetrize_mode': 'union', 'self_loops': False, 'use_snp_selection': True, 'num_snps': 26667}. Best is trial 92 with value: 0.37257134400995034.
[I 2025-12-08 16:33:18,877] Trial 95 finished with value: 0.36187961780883937 and parameters: {'model_type': 'graphsage', 'hidden_dims': '[512, 128]', 'dropout': 0.58602980651348, 'batch_norm': True, 'sage_aggr': 'max', 'sage_normalize': True, 'sage_project': False, 'lr': 0.006893581848307339, 'weight_decay': 1.5982149097748694e-05, 'epochs': 298, 'loss': 'mae', 'optimizer': 'adam', 'graph_mode': 'knn', 'knn_k': 9, 'weighted_edges': True, 'symmetrize_mode': 'union', 'self_loops': False, 'use_snp_selection': True, 'num_snps': 30436}. Best is trial 92 with value: 0.37257134400995034.
[I 2025-12-08 16:34:36,275] Trial 96 finished with value: 0.3636237781399976 and parameters: {'model_type': 'graphsage', 'hidden_dims': '[512, 128]', 'dropout': 0.5134845539550199, 'batch_norm': True, 'sage_aggr': 'max', 'sage_normalize': True, 'sage_project': False, 'lr': 0.0038640043213333712, 'weight_decay': 1.130202869634758e-05, 'epochs': 100, 'loss': 'mae', 'optimizer': 'adam', 'graph_mode': 'knn', 'knn_k': 8, 'weighted_edges': True, 'symmetrize_mode': 'union', 'self_loops': False, 'use_snp_selection': True, 'num_snps': 24955}. Best is trial 92 with value: 0.37257134400995034.
[I 2025-12-08 16:35:48,293] Trial 97 finished with value: 0.3383506408272471 and parameters: {'model_type': 'graphsage', 'hidden_dims': '[512, 128]', 'dropout': 0.5321073552141049, 'batch_norm': True, 'sage_aggr': 'max', 'sage_normalize': True, 'sage_project': False, 'lr': 0.004659053945827209, 'weight_decay': 3.950216349708091e-06, 'epochs': 125, 'loss': 'mae', 'optimizer': 'adam', 'graph_mode': 'knn', 'knn_k': 4, 'weighted_edges': True, 'symmetrize_mode': 'mutual', 'self_loops': False, 'use_snp_selection': True, 'num_snps': 33466}. Best is trial 92 with value: 0.37257134400995034.
[I 2025-12-08 16:37:11,725] Trial 98 finished with value: 0.35812789131513145 and parameters: {'model_type': 'graphsage', 'hidden_dims': '[512, 128]', 'dropout': 0.5626089009484657, 'batch_norm': True, 'sage_aggr': 'max', 'sage_normalize': True, 'sage_project': False, 'lr': 0.0032740771337760252, 'weight_decay': 2.379520845584899e-05, 'epochs': 107, 'loss': 'mae', 'optimizer': 'adam', 'graph_mode': 'knn', 'knn_k': 7, 'weighted_edges': False, 'symmetrize_mode': 'union', 'self_loops': False, 'use_snp_selection': True, 'num_snps': 28389}. Best is trial 92 with value: 0.37257134400995034.
[I 2025-12-08 16:38:09,341] Trial 99 finished with value: 0.35651009680803286 and parameters: {'model_type': 'graphsage', 'hidden_dims': '[512, 128]', 'dropout': 0.5454381619173344, 'batch_norm': True, 'sage_aggr': 'max', 'sage_normalize': True, 'sage_project': False, 'lr': 0.006339941300982532, 'weight_decay': 1.8962339407654467e-05, 'epochs': 131, 'loss': 'mae', 'optimizer': 'adam', 'graph_mode': 'cutoff', 'cutoff': 0.32680329760883425, 'grm_norm': 'none', 'self_loops': False, 'use_snp_selection': True, 'num_snps': 21220}. Best is trial 92 with value: 0.37257134400995034.
[I 2025-12-08 16:39:18,359] Trial 100 finished with value: 0.0 and parameters: {'model_type': 'graphsage', 'hidden_dims': '[512, 128]', 'dropout': 0.5210665695980571, 'batch_norm': False, 'sage_aggr': 'max', 'sage_normalize': False, 'sage_project': False, 'lr': 0.008853772643811193, 'weight_decay': 4.019937235191927e-05, 'epochs': 78, 'loss': 'mse', 'optimizer': 'adam', 'graph_mode': 'knn', 'knn_k': 8, 'weighted_edges': True, 'symmetrize_mode': 'union', 'self_loops': False, 'use_snp_selection': True, 'num_snps': 25774}. Best is trial 92 with value: 0.37257134400995034.
[I 2025-12-08 16:40:05,271] Trial 101 finished with value: 0.3689810102853163 and parameters: {'model_type': 'graphsage', 'hidden_dims': '[256, 128]', 'dropout': 0.5997112948473453, 'batch_norm': True, 'sage_aggr': 'max', 'sage_normalize': True, 'sage_project': False, 'lr': 0.005145921605679308, 'weight_decay': 2.988087317437655e-05, 'epochs': 98, 'loss': 'mae', 'optimizer': 'adam', 'graph_mode': 'knn', 'knn_k': 7, 'weighted_edges': True, 'symmetrize_mode': 'union', 'self_loops': False, 'use_snp_selection': True, 'num_snps': 15769}. Best is trial 92 with value: 0.37257134400995034.
[I 2025-12-08 16:40:57,708] Trial 102 finished with value: 0.36252889632605434 and parameters: {'model_type': 'graphsage', 'hidden_dims': '[512, 128]', 'dropout': 0.5925211477021038, 'batch_norm': True, 'sage_aggr': 'max', 'sage_normalize': True, 'sage_project': False, 'lr': 0.0053881831270006075, 'weight_decay': 3.069244954244106e-05, 'epochs': 97, 'loss': 'mae', 'optimizer': 'adam', 'graph_mode': 'knn', 'knn_k': 8, 'weighted_edges': True, 'symmetrize_mode': 'union', 'self_loops': False, 'use_snp_selection': True, 'num_snps': 15481}. Best is trial 92 with value: 0.37257134400995034.
[I 2025-12-08 16:42:03,417] Trial 103 finished with value: 0.29250142246958705 and parameters: {'model_type': 'graphsage', 'hidden_dims': '[256, 128, 64]', 'dropout': 0.576479298470195, 'batch_norm': True, 'sage_aggr': 'max', 'sage_normalize': True, 'sage_project': False, 'lr': 0.004385557910600985, 'weight_decay': 1.4799431820608263e-05, 'epochs': 70, 'loss': 'mae', 'optimizer': 'adam', 'graph_mode': 'knn', 'knn_k': 7, 'weighted_edges': True, 'symmetrize_mode': 'union', 'self_loops': False, 'use_snp_selection': True, 'num_snps': 30084}. Best is trial 92 with value: 0.37257134400995034.
[I 2025-12-08 16:42:51,581] Trial 104 finished with value: 0.3690595459279714 and parameters: {'model_type': 'graphsage', 'hidden_dims': '[256, 128]', 'dropout': 0.48083938344709604, 'batch_norm': True, 'sage_aggr': 'max', 'sage_normalize': True, 'sage_project': False, 'lr': 0.007276013782073698, 'weight_decay': 2.8409701217911114e-05, 'epochs': 86, 'loss': 'mae', 'optimizer': 'adam', 'graph_mode': 'knn', 'knn_k': 8, 'weighted_edges': True, 'symmetrize_mode': 'union', 'self_loops': False, 'use_snp_selection': True, 'num_snps': 16763}. Best is trial 92 with value: 0.37257134400995034.
[I 2025-12-08 16:43:34,291] Trial 105 finished with value: 0.3736369503402452 and parameters: {'model_type': 'graphsage', 'hidden_dims': '[256, 128]', 'dropout': 0.1302182051415716, 'batch_norm': True, 'sage_aggr': 'max', 'sage_normalize': True, 'sage_project': False, 'lr': 0.007711983144990653, 'weight_decay': 8.406284928184517e-06, 'epochs': 60, 'loss': 'mae', 'optimizer': 'adam', 'graph_mode': 'knn', 'knn_k': 8, 'weighted_edges': True, 'symmetrize_mode': 'union', 'self_loops': False, 'use_snp_selection': True, 'num_snps': 16680}. Best is trial 105 with value: 0.3736369503402452.
[I 2025-12-08 16:44:14,624] Trial 106 finished with value: 0.35898259502719565 and parameters: {'model_type': 'graphsage', 'hidden_dims': '[256, 128]', 'dropout': 0.5230345458096197, 'batch_norm': True, 'sage_aggr': 'max', 'sage_normalize': True, 'sage_project': False, 'lr': 0.006409680669352815, 'weight_decay': 9.25326671888481e-06, 'epochs': 63, 'loss': 'mae', 'optimizer': 'adam', 'graph_mode': 'knn', 'knn_k': 8, 'weighted_edges': True, 'symmetrize_mode': 'union', 'self_loops': False, 'use_snp_selection': True, 'num_snps': 14078}. Best is trial 105 with value: 0.3736369503402452.
[I 2025-12-08 16:44:56,066] Trial 107 finished with value: 0.36078294942904626 and parameters: {'model_type': 'graphsage', 'hidden_dims': '[256, 128]', 'dropout': 0.598135282293256, 'batch_norm': True, 'sage_aggr': 'mean', 'sage_normalize': True, 'sage_project': False, 'lr': 0.007213005679614995, 'weight_decay': 6.943324573205074e-06, 'epochs': 59, 'loss': 'mae', 'optimizer': 'adam', 'graph_mode': 'knn', 'knn_k': 9, 'weighted_edges': True, 'symmetrize_mode': 'union', 'self_loops': False, 'use_snp_selection': True, 'num_snps': 16538}. Best is trial 105 with value: 0.3736369503402452.
[I 2025-12-08 16:45:37,865] Trial 108 finished with value: 0.34532697291949666 and parameters: {'model_type': 'graphsage', 'hidden_dims': '[256, 128]', 'dropout': 0.13681938944627953, 'batch_norm': True, 'sage_aggr': 'max', 'sage_normalize': True, 'sage_project': False, 'lr': 0.005047938884529387, 'weight_decay': 1.1690415180506787e-05, 'epochs': 46, 'loss': 'mae', 'optimizer': 'adam', 'graph_mode': 'knn', 'knn_k': 7, 'weighted_edges': True, 'symmetrize_mode': 'union', 'self_loops': False, 'use_snp_selection': True, 'num_snps': 18820}. Best is trial 105 with value: 0.3736369503402452.
[I 2025-12-08 16:46:34,096] Trial 109 finished with value: 0.34871493449530844 and parameters: {'model_type': 'graphsage', 'hidden_dims': '[256, 128]', 'dropout': 0.4816217518260217, 'batch_norm': True, 'sage_aggr': 'max', 'sage_normalize': True, 'sage_project': False, 'lr': 0.0036595766386990237, 'weight_decay': 2.9328847423279238e-05, 'epochs': 209, 'loss': 'mae', 'optimizer': 'adam', 'graph_mode': 'knn', 'knn_k': 9, 'weighted_edges': True, 'symmetrize_mode': 'union', 'self_loops': False, 'use_snp_selection': True, 'num_snps': 11440}. Best is trial 105 with value: 0.3736369503402452.
[I 2025-12-08 16:47:14,674] Trial 110 finished with value: 0.36400492341424445 and parameters: {'model_type': 'graphsage', 'hidden_dims': '[512, 64]', 'dropout': 0.574011810342022, 'batch_norm': True, 'sage_aggr': 'max', 'sage_normalize': True, 'sage_project': False, 'lr': 0.007712503178775102, 'weight_decay': 5.034458500063557e-06, 'epochs': 79, 'loss': 'mae', 'optimizer': 'adam', 'graph_mode': 'knn', 'knn_k': 8, 'weighted_edges': True, 'symmetrize_mode': 'union', 'self_loops': False, 'use_snp_selection': True, 'num_snps': 9852}. Best is trial 105 with value: 0.3736369503402452.
[I 2025-12-08 16:48:04,943] Trial 111 finished with value: 0.36744799126447575 and parameters: {'model_type': 'graphsage', 'hidden_dims': '[256, 128]', 'dropout': 0.49965074172624585, 'batch_norm': True, 'sage_aggr': 'max', 'sage_normalize': True, 'sage_project': False, 'lr': 0.00998020478590984, 'weight_decay': 2.0756725549382204e-05, 'epochs': 89, 'loss': 'mae', 'optimizer': 'adam', 'graph_mode': 'knn', 'knn_k': 8, 'weighted_edges': True, 'symmetrize_mode': 'union', 'self_loops': False, 'use_snp_selection': True, 'num_snps': 17397}. Best is trial 105 with value: 0.3736369503402452.
