[I 2025-12-05 18:59:34,566] Trial 98 finished with value: 0.24129875274596252 and parameters: {'model_type': 'graphsage', 'hidden_dims': '[512, 64]', 'dropout': 0.19614699458574994, 'batch_norm': True, 'sage_aggr': 'mean', 'sage_normalize': True, 'sage_project': False, 'lr': 0.0002260387352444081, 'weight_decay': 1.3501548688118017e-07, 'epochs': 215, 'loss': 'mae', 'optimizer': 'adam', 'graph_mode': 'cutoff', 'cutoff': 0.5790670856630435, 'grm_norm': 'cosine_then_gcn', 'self_loops': False, 'use_snp_selection': True, 'num_snps': 16388, 'graphsage_batch_size': 32}. Best is trial 96 with value: 0.24525499812586338.
[I 2025-12-05 19:00:27,152] Trial 99 finished with value: 0.23988248831808154 and parameters: {'model_type': 'graphsage', 'hidden_dims': '[512, 64]', 'dropout': 0.1574411226010166, 'batch_norm': True, 'sage_aggr': 'mean', 'sage_normalize': True, 'sage_project': False, 'lr': 0.00015384677365068618, 'weight_decay': 1.2049132691447488e-07, 'epochs': 226, 'loss': 'mae', 'optimizer': 'adam', 'graph_mode': 'cutoff', 'cutoff': 0.7009461484470472, 'grm_norm': 'cosine_then_gcn', 'self_loops': False, 'use_snp_selection': True, 'num_snps': 16577, 'graphsage_batch_size': 32}. Best is trial 96 with value: 0.24525499812586338.
[I 2025-12-05 19:01:18,724] Trial 100 finished with value: 0.23610713110803433 and parameters: {'model_type': 'graphsage', 'hidden_dims': '[512, 64]', 'dropout': 0.1002662232438741, 'batch_norm': True, 'sage_aggr': 'mean', 'sage_normalize': True, 'sage_project': False, 'lr': 0.00014074174019399342, 'weight_decay': 1.3827259455790113e-07, 'epochs': 227, 'loss': 'mae', 'optimizer': 'adam', 'graph_mode': 'cutoff', 'cutoff': 0.6577720573334115, 'grm_norm': 'cosine_then_gcn', 'self_loops': False, 'use_snp_selection': True, 'num_snps': 16122, 'graphsage_batch_size': 32}. Best is trial 96 with value: 0.24525499812586338.
[I 2025-12-05 19:02:11,825] Trial 101 finished with value: 0.2397437676703298 and parameters: {'model_type': 'graphsage', 'hidden_dims': '[512, 64]', 'dropout': 0.10590044479012327, 'batch_norm': True, 'sage_aggr': 'mean', 'sage_normalize': True, 'sage_project': False, 'lr': 0.0001413929922741945, 'weight_decay': 1.2814508513869204e-07, 'epochs': 237, 'loss': 'mae', 'optimizer': 'adam', 'graph_mode': 'cutoff', 'cutoff': 0.6608828443416277, 'grm_norm': 'cosine_then_gcn', 'self_loops': False, 'use_snp_selection': True, 'num_snps': 16166, 'graphsage_batch_size': 32}. Best is trial 96 with value: 0.24525499812586338.
[I 2025-12-05 19:03:08,659] Trial 102 finished with value: 0.24346739883967672 and parameters: {'model_type': 'graphsage', 'hidden_dims': '[512, 64]', 'dropout': 0.1320553689163316, 'batch_norm': True, 'sage_aggr': 'mean', 'sage_normalize': True, 'sage_project': False, 'lr': 0.00011622631084695935, 'weight_decay': 1.1658200339335989e-07, 'epochs': 248, 'loss': 'mae', 'optimizer': 'adam', 'graph_mode': 'cutoff', 'cutoff': 0.5826799707372395, 'grm_norm': 'cosine_then_gcn', 'self_loops': False, 'use_snp_selection': True, 'num_snps': 16886, 'graphsage_batch_size': 32}. Best is trial 96 with value: 0.24525499812586338.
[I 2025-12-05 19:04:03,958] Trial 103 finished with value: 0.24486841161723977 and parameters: {'model_type': 'graphsage', 'hidden_dims': '[512, 64]', 'dropout': 0.1351678120325531, 'batch_norm': True, 'sage_aggr': 'mean', 'sage_normalize': True, 'sage_project': False, 'lr': 0.00010981054957784618, 'weight_decay': 1.0139385092272605e-07, 'epochs': 246, 'loss': 'mae', 'optimizer': 'adam', 'graph_mode': 'cutoff', 'cutoff': 0.5683648636202234, 'grm_norm': 'cosine_then_gcn', 'self_loops': False, 'use_snp_selection': True, 'num_snps': 15225, 'graphsage_batch_size': 32}. Best is trial 96 with value: 0.24525499812586338.
[I 2025-12-05 19:04:56,881] Trial 104 finished with value: 0.24406676788006415 and parameters: {'model_type': 'graphsage', 'hidden_dims': '[512, 64]', 'dropout': 0.14063916457130118, 'batch_norm': True, 'sage_aggr': 'mean', 'sage_normalize': True, 'sage_project': False, 'lr': 0.00011137416257710387, 'weight_decay': 1.1232286697926643e-07, 'epochs': 247, 'loss': 'mae', 'optimizer': 'adam', 'graph_mode': 'cutoff', 'cutoff': 0.5597919113890045, 'grm_norm': 'cosine_then_gcn', 'self_loops': False, 'use_snp_selection': True, 'num_snps': 15163, 'graphsage_batch_size': 32}. Best is trial 96 with value: 0.24525499812586338.
[I 2025-12-05 19:05:52,329] Trial 105 finished with value: 0.2447149258505689 and parameters: {'model_type': 'graphsage', 'hidden_dims': '[512, 64]', 'dropout': 0.1422367476295808, 'batch_norm': True, 'sage_aggr': 'mean', 'sage_normalize': True, 'sage_project': False, 'lr': 0.00011937728499726525, 'weight_decay': 1.0324260876322109e-07, 'epochs': 247, 'loss': 'mae', 'optimizer': 'adam', 'graph_mode': 'cutoff', 'cutoff': 0.563405754237653, 'grm_norm': 'cosine_then_gcn', 'self_loops': False, 'use_snp_selection': True, 'num_snps': 16246, 'graphsage_batch_size': 32}. Best is trial 96 with value: 0.24525499812586338.
[I 2025-12-05 19:06:45,944] Trial 106 finished with value: 0.23944952939434755 and parameters: {'model_type': 'graphsage', 'hidden_dims': '[512, 64]', 'dropout': 0.13836918624766936, 'batch_norm': True, 'sage_aggr': 'mean', 'sage_normalize': True, 'sage_project': False, 'lr': 0.00010322129729301735, 'weight_decay': 1.0923300421371184e-07, 'epochs': 250, 'loss': 'mae', 'optimizer': 'adam', 'graph_mode': 'cutoff', 'cutoff': 0.5480872244798176, 'grm_norm': 'cosine_then_gcn', 'self_loops': False, 'use_snp_selection': True, 'num_snps': 15283, 'graphsage_batch_size': 32}. Best is trial 96 with value: 0.24525499812586338.
[I 2025-12-05 19:07:39,574] Trial 107 finished with value: 0.24130529127313963 and parameters: {'model_type': 'graphsage', 'hidden_dims': '[512, 64]', 'dropout': 0.14301816420334765, 'batch_norm': True, 'sage_aggr': 'mean', 'sage_normalize': True, 'sage_project': False, 'lr': 9.794537811727471e-05, 'weight_decay': 1.0339448261440852e-07, 'epochs': 250, 'loss': 'mae', 'optimizer': 'adam', 'graph_mode': 'cutoff', 'cutoff': 0.5417490530911027, 'grm_norm': 'cosine_then_gcn', 'self_loops': False, 'use_snp_selection': True, 'num_snps': 15177, 'graphsage_batch_size': 32}. Best is trial 96 with value: 0.24525499812586338.
[I 2025-12-05 19:08:44,020] Trial 108 finished with value: 0.22063331166127553 and parameters: {'model_type': 'graphsage', 'hidden_dims': '[512, 64]', 'dropout': 0.13767814221559313, 'batch_norm': True, 'sage_aggr': 'mean', 'sage_normalize': True, 'sage_project': False, 'lr': 0.00017145839761088268, 'weight_decay': 1.449331167931236e-07, 'epochs': 243, 'loss': 'mae', 'optimizer': 'adam', 'graph_mode': 'knn', 'knn_k': 5, 'weighted_edges': True, 'symmetrize_mode': 'union', 'self_loops': False, 'use_snp_selection': True, 'num_snps': 14548, 'graphsage_batch_size': 32}. Best is trial 96 with value: 0.24525499812586338.
[I 2025-12-05 19:09:40,399] Trial 109 finished with value: 0.22872402511917306 and parameters: {'model_type': 'graphsage', 'hidden_dims': '[512, 64]', 'dropout': 0.15565131720017655, 'batch_norm': True, 'sage_aggr': 'mean', 'sage_normalize': True, 'sage_project': False, 'lr': 0.00013745621327644787, 'weight_decay': 1.9610945833743447e-07, 'epochs': 237, 'loss': 'mae', 'optimizer': 'adam', 'graph_mode': 'cutoff', 'cutoff': 0.5216365718714688, 'grm_norm': 'cosine_then_gcn', 'self_loops': False, 'use_snp_selection': True, 'num_snps': 16783, 'graphsage_batch_size': 32}. Best is trial 96 with value: 0.24525499812586338.
[I 2025-12-05 19:10:25,654] Trial 110 finished with value: 0.24649722496420493 and parameters: {'model_type': 'graphsage', 'hidden_dims': '[512, 64]', 'dropout': 0.12417098565253434, 'batch_norm': True, 'sage_aggr': 'mean', 'sage_normalize': True, 'sage_project': False, 'lr': 8.909633506755942e-05, 'weight_decay': 1.1804558951273181e-07, 'epochs': 245, 'loss': 'mae', 'optimizer': 'adam', 'graph_mode': 'cutoff', 'cutoff': 0.592906105399522, 'grm_norm': 'cosine_then_gcn', 'self_loops': False, 'use_snp_selection': True, 'num_snps': 12119, 'graphsage_batch_size': 32}. Best is trial 110 with value: 0.24649722496420493.
[I 2025-12-05 19:11:09,710] Trial 111 finished with value: 0.24932950013245944 and parameters: {'model_type': 'graphsage', 'hidden_dims': '[512, 64]', 'dropout': 0.1265613833716216, 'batch_norm': True, 'sage_aggr': 'mean', 'sage_normalize': True, 'sage_project': False, 'lr': 6.358393482980049e-05, 'weight_decay': 1.0586431203311608e-07, 'epochs': 244, 'loss': 'mae', 'optimizer': 'adam', 'graph_mode': 'cutoff', 'cutoff': 0.5835519221548876, 'grm_norm': 'cosine_then_gcn', 'self_loops': False, 'use_snp_selection': True, 'num_snps': 11729, 'graphsage_batch_size': 32}. Best is trial 111 with value: 0.24932950013245944.
[I 2025-12-05 19:11:53,724] Trial 112 finished with value: 0.23634771996798382 and parameters: {'model_type': 'graphsage', 'hidden_dims': '[512, 64]', 'dropout': 0.12618045404897582, 'batch_norm': True, 'sage_aggr': 'mean', 'sage_normalize': True, 'sage_project': False, 'lr': 6.273895841747049e-05, 'weight_decay': 1.0245477524032212e-07, 'epochs': 246, 'loss': 'mae', 'optimizer': 'adam', 'graph_mode': 'cutoff', 'cutoff': 0.5809281647126788, 'grm_norm': 'cosine_then_gcn', 'self_loops': False, 'use_snp_selection': True, 'num_snps': 11645, 'graphsage_batch_size': 32}. Best is trial 111 with value: 0.24932950013245944.
[I 2025-12-05 19:12:32,353] Trial 113 finished with value: 0.2408043071834626 and parameters: {'model_type': 'graphsage', 'hidden_dims': '[512, 64]', 'dropout': 0.16384097476273482, 'batch_norm': True, 'sage_aggr': 'mean', 'sage_normalize': True, 'sage_project': False, 'lr': 8.84884565563414e-05, 'weight_decay': 1.644398960778384e-07, 'epochs': 238, 'loss': 'mae', 'optimizer': 'adam', 'graph_mode': 'cutoff', 'cutoff': 0.5735695051644287, 'grm_norm': 'cosine_then_gcn', 'self_loops': False, 'use_snp_selection': True, 'num_snps': 9553, 'graphsage_batch_size': 32}. Best is trial 111 with value: 0.24932950013245944.
[I 2025-12-05 19:13:10,462] Trial 114 finished with value: 0.24889474709376747 and parameters: {'model_type': 'graphsage', 'hidden_dims': '[512, 64]', 'dropout': 0.1664162474832035, 'batch_norm': True, 'sage_aggr': 'mean', 'sage_normalize': True, 'sage_project': False, 'lr': 8.518158052774574e-05, 'weight_decay': 1.642392015881536e-07, 'epochs': 233, 'loss': 'mae', 'optimizer': 'adam', 'graph_mode': 'cutoff', 'cutoff': 0.5738291879392822, 'grm_norm': 'cosine_then_gcn', 'self_loops': False, 'use_snp_selection': True, 'num_snps': 9470, 'graphsage_batch_size': 32}. Best is trial 111 with value: 0.24932950013245944.
[I 2025-12-05 19:13:47,149] Trial 115 finished with value: 0.24583004671557523 and parameters: {'model_type': 'graphsage', 'hidden_dims': '[512, 64]', 'dropout': 0.17555922338558416, 'batch_norm': True, 'sage_aggr': 'mean', 'sage_normalize': True, 'sage_project': False, 'lr': 8.525804875204491e-05, 'weight_decay': 1.6122591012715696e-07, 'epochs': 247, 'loss': 'mae', 'optimizer': 'adam', 'graph_mode': 'cutoff', 'cutoff': 0.5743724304011611, 'grm_norm': 'cosine_then_gcn', 'self_loops': False, 'use_snp_selection': True, 'num_snps': 8510, 'graphsage_batch_size': 32}. Best is trial 111 with value: 0.24932950013245944.
[I 2025-12-05 19:14:21,769] Trial 116 finished with value: 0.24422336146442536 and parameters: {'model_type': 'graphsage', 'hidden_dims': '[512, 64]', 'dropout': 0.17696148429203346, 'batch_norm': True, 'sage_aggr': 'mean', 'sage_normalize': True, 'sage_project': False, 'lr': 0.00011323479383975426, 'weight_decay': 2.489992227222138e-07, 'epochs': 245, 'loss': 'mae', 'optimizer': 'adam', 'graph_mode': 'cutoff', 'cutoff': 0.6049241206550856, 'grm_norm': 'cosine_then_gcn', 'self_loops': False, 'use_snp_selection': True, 'num_snps': 7719, 'graphsage_batch_size': 32}. Best is trial 111 with value: 0.24932950013245944.
[I 2025-12-05 19:14:58,901] Trial 117 finished with value: 0.23177025734481202 and parameters: {'model_type': 'graphsage', 'hidden_dims': '[512, 64]', 'dropout': 0.12193164156175873, 'batch_norm': True, 'sage_aggr': 'mean', 'sage_normalize': True, 'sage_project': False, 'lr': 0.00011917259879973766, 'weight_decay': 1.647346501520953e-07, 'epochs': 245, 'loss': 'mae', 'optimizer': 'adam', 'graph_mode': 'cutoff', 'cutoff': 0.48200364041599597, 'grm_norm': 'cosine_then_gcn', 'self_loops': False, 'use_snp_selection': True, 'num_snps': 7461, 'graphsage_batch_size': 32}. Best is trial 111 with value: 0.24932950013245944.
[I 2025-12-05 19:15:32,781] Trial 118 finished with value: 0.22986180876985168 and parameters: {'model_type': 'graphsage', 'hidden_dims': '[512, 64]', 'dropout': 0.17169043718950236, 'batch_norm': True, 'sage_aggr': 'mean', 'sage_normalize': True, 'sage_project': False, 'lr': 6.678862847472555e-05, 'weight_decay': 2.483933483507889e-07, 'epochs': 249, 'loss': 'mae', 'optimizer': 'adam', 'graph_mode': 'cutoff', 'cutoff': 0.6003233263760573, 'grm_norm': 'cosine_then_gcn', 'self_loops': False, 'use_snp_selection': True, 'num_snps': 7270, 'graphsage_batch_size': 32}. Best is trial 111 with value: 0.24932950013245944.
[I 2025-12-05 19:15:58,301] Trial 119 finished with value: 0.20590474055918645 and parameters: {'model_type': 'graphsage', 'hidden_dims': '[512, 64]', 'dropout': 0.1408747658101878, 'batch_norm': True, 'sage_aggr': 'mean', 'sage_normalize': True, 'sage_project': False, 'lr': 9.376201773242068e-05, 'weight_decay': 1.0084895208383868e-07, 'epochs': 233, 'loss': 'mae', 'optimizer': 'adam', 'graph_mode': 'cutoff', 'cutoff': 0.5634841780790871, 'grm_norm': 'cosine_then_gcn', 'self_loops': False, 'use_snp_selection': True, 'num_snps': 3903, 'graphsage_batch_size': 32}. Best is trial 111 with value: 0.24932950013245944.
[I 2025-12-05 19:16:40,297] Trial 120 finished with value: 0.2379679371876937 and parameters: {'model_type': 'graphsage', 'hidden_dims': '[512, 64]', 'dropout': 0.1454402204363266, 'batch_norm': True, 'sage_aggr': 'mean', 'sage_normalize': True, 'sage_project': False, 'lr': 7.667587904468506e-05, 'weight_decay': 1.88980926683558e-07, 'epochs': 250, 'loss': 'mae', 'optimizer': 'adam', 'graph_mode': 'cutoff', 'cutoff': 0.5112495791647926, 'grm_norm': 'cosine_then_gcn', 'self_loops': False, 'use_snp_selection': True, 'num_snps': 9812, 'graphsage_batch_size': 32}. Best is trial 111 with value: 0.24932950013245944.
[I 2025-12-05 19:17:24,131] Trial 121 finished with value: 0.24605861927386888 and parameters: {'model_type': 'graphsage', 'hidden_dims': '[512, 64]', 'dropout': 0.17883663820348017, 'batch_norm': True, 'sage_aggr': 'mean', 'sage_normalize': True, 'sage_project': False, 'lr': 0.00010409093004584694, 'weight_decay': 1.37773180990651e-07, 'epochs': 242, 'loss': 'mae', 'optimizer': 'adam', 'graph_mode': 'cutoff', 'cutoff': 0.6129666858252985, 'grm_norm': 'cosine_then_gcn', 'self_loops': False, 'use_snp_selection': True, 'num_snps': 11955, 'graphsage_batch_size': 32}. Best is trial 111 with value: 0.24932950013245944.
[I 2025-12-05 19:18:09,118] Trial 122 finished with value: 0.24548963614762592 and parameters: {'model_type': 'graphsage', 'hidden_dims': '[512, 64]', 'dropout': 0.12245326990300946, 'batch_norm': True, 'sage_aggr': 'mean', 'sage_normalize': True, 'sage_project': False, 'lr': 0.00010856393209701079, 'weight_decay': 2.446187397967092e-07, 'epochs': 241, 'loss': 'mae', 'optimizer': 'adam', 'graph_mode': 'cutoff', 'cutoff': 0.6144351350178123, 'grm_norm': 'cosine_then_gcn', 'self_loops': False, 'use_snp_selection': True, 'num_snps': 12246, 'graphsage_batch_size': 32}. Best is trial 111 with value: 0.24932950013245944.
[I 2025-12-05 19:18:52,123] Trial 123 finished with value: 0.2545287758683708 and parameters: {'model_type': 'graphsage', 'hidden_dims': '[512, 64]', 'dropout': 0.12817004330311427, 'batch_norm': True, 'sage_aggr': 'mean', 'sage_normalize': True, 'sage_project': False, 'lr': 0.00011198210258703835, 'weight_decay': 2.800080119091018e-07, 'epochs': 234, 'loss': 'mae', 'optimizer': 'adam', 'graph_mode': 'cutoff', 'cutoff': 0.6041540075582792, 'grm_norm': 'cosine_then_gcn', 'self_loops': False, 'use_snp_selection': True, 'num_snps': 11930, 'graphsage_batch_size': 32}. Best is trial 123 with value: 0.2545287758683708.
[I 2025-12-05 19:19:37,237] Trial 124 finished with value: 0.23920210294347194 and parameters: {'model_type': 'graphsage', 'hidden_dims': '[512, 64]', 'dropout': 0.12073891965070728, 'batch_norm': True, 'sage_aggr': 'mean', 'sage_normalize': True, 'sage_project': False, 'lr': 0.00011058448608727399, 'weight_decay': 2.8351014080147846e-07, 'epochs': 240, 'loss': 'mae', 'optimizer': 'adam', 'graph_mode': 'cutoff', 'cutoff': 0.6181244798117056, 'grm_norm': 'cosine_then_gcn', 'self_loops': False, 'use_snp_selection': True, 'num_snps': 12394, 'graphsage_batch_size': 32}. Best is trial 123 with value: 0.2545287758683708.
[I 2025-12-05 19:20:10,886] Trial 125 finished with value: 0.23777920791067508 and parameters: {'model_type': 'graphsage', 'hidden_dims': '[512, 64]', 'dropout': 0.17288951547226677, 'batch_norm': True, 'sage_aggr': 'mean', 'sage_normalize': True, 'sage_project': False, 'lr': 7.44236365601725e-05, 'weight_decay': 2.2064022040421378e-07, 'epochs': 234, 'loss': 'mae', 'optimizer': 'adam', 'graph_mode': 'cutoff', 'cutoff': 0.5987138968090209, 'grm_norm': 'cosine_then_gcn', 'self_loops': False, 'use_snp_selection': True, 'num_snps': 7669, 'graphsage_batch_size': 32}. Best is trial 123 with value: 0.2545287758683708.
[I 2025-12-05 19:20:53,007] Trial 126 finished with value: 0.2520481877125901 and parameters: {'model_type': 'graphsage', 'hidden_dims': '[512, 64]', 'dropout': 0.13072009307102492, 'batch_norm': True, 'sage_aggr': 'mean', 'sage_normalize': True, 'sage_project': False, 'lr': 0.00012824910864294456, 'weight_decay': 1.5751671189446293e-07, 'epochs': 245, 'loss': 'mae', 'optimizer': 'adam', 'graph_mode': 'cutoff', 'cutoff': 0.5613391477100951, 'grm_norm': 'cosine_then_gcn', 'self_loops': False, 'use_snp_selection': True, 'num_snps': 10658, 'graphsage_batch_size': 32}. Best is trial 123 with value: 0.2545287758683708.
[I 2025-12-05 19:21:33,430] Trial 127 finished with value: 0.2451981350349585 and parameters: {'model_type': 'graphsage', 'hidden_dims': '[512, 64]', 'dropout': 0.11210041924944304, 'batch_norm': True, 'sage_aggr': 'mean', 'sage_normalize': True, 'sage_project': False, 'lr': 0.00012687903937500444, 'weight_decay': 1.5843212601318558e-07, 'epochs': 243, 'loss': 'mae', 'optimizer': 'adam', 'graph_mode': 'cutoff', 'cutoff': 0.5639545298140384, 'grm_norm': 'cosine_then_gcn', 'self_loops': False, 'use_snp_selection': True, 'num_snps': 10228, 'graphsage_batch_size': 32}. Best is trial 123 with value: 0.2545287758683708.
[I 2025-12-05 19:22:02,611] Trial 128 finished with value: 0.21519855692541215 and parameters: {'model_type': 'graphsage', 'hidden_dims': '[512, 64]', 'dropout': 0.11333692404634321, 'batch_norm': True, 'sage_aggr': 'mean', 'sage_normalize': True, 'sage_project': False, 'lr': 5.707166543690193e-05, 'weight_decay': 4.592883007815431e-07, 'epochs': 240, 'loss': 'mae', 'optimizer': 'adam', 'graph_mode': 'cutoff', 'cutoff': 0.6408592721197237, 'grm_norm': 'cosine_then_gcn', 'self_loops': False, 'use_snp_selection': True, 'num_snps': 5542, 'graphsage_batch_size': 32}. Best is trial 123 with value: 0.2545287758683708.
[I 2025-12-05 19:22:43,597] Trial 129 finished with value: 0.2424864547516631 and parameters: {'model_type': 'graphsage', 'hidden_dims': '[512, 64]', 'dropout': 0.20967899676970347, 'batch_norm': True, 'sage_aggr': 'mean', 'sage_normalize': True, 'sage_project': False, 'lr': 0.0001735981407279915, 'weight_decay': 1.7444337322564227e-07, 'epochs': 243, 'loss': 'mae', 'optimizer': 'adam', 'graph_mode': 'cutoff', 'cutoff': 0.6119184679630029, 'grm_norm': 'cosine_then_gcn', 'self_loops': False, 'use_snp_selection': True, 'num_snps': 10372, 'graphsage_batch_size': 32}. Best is trial 123 with value: 0.2545287758683708.
[I 2025-12-05 19:23:30,070] Trial 130 finished with value: 0.23964034938818632 and parameters: {'model_type': 'graphsage', 'hidden_dims': '[512, 64]', 'dropout': 0.11589949850502117, 'batch_norm': True, 'sage_aggr': 'mean', 'sage_normalize': True, 'sage_project': False, 'lr': 8.317576735830136e-05, 'weight_decay': 2.6433878956908967e-07, 'epochs': 231, 'loss': 'mae', 'optimizer': 'adam', 'graph_mode': 'knn', 'knn_k': 7, 'weighted_edges': False, 'symmetrize_mode': 'union', 'self_loops': False, 'use_snp_selection': True, 'num_snps': 8409, 'graphsage_batch_size': 32}. Best is trial 123 with value: 0.2545287758683708.
[I 2025-12-05 19:24:14,237] Trial 131 finished with value: 0.24176284013257585 and parameters: {'model_type': 'graphsage', 'hidden_dims': '[512, 64]', 'dropout': 0.13067787988985774, 'batch_norm': True, 'sage_aggr': 'mean', 'sage_normalize': True, 'sage_project': False, 'lr': 0.00012813242067660798, 'weight_decay': 1.5145695953569417e-07, 'epochs': 245, 'loss': 'mae', 'optimizer': 'adam', 'graph_mode': 'cutoff', 'cutoff': 0.5279635350196605, 'grm_norm': 'cosine_then_gcn', 'self_loops': False, 'use_snp_selection': True, 'num_snps': 11300, 'graphsage_batch_size': 32}. Best is trial 123 with value: 0.2545287758683708.
[I 2025-12-05 19:25:03,078] Trial 132 finished with value: 0.24844090648166123 and parameters: {'model_type': 'graphsage', 'hidden_dims': '[512, 64]', 'dropout': 0.14933752904962194, 'batch_norm': True, 'sage_aggr': 'mean', 'sage_normalize': True, 'sage_project': False, 'lr': 0.00012488223357328448, 'weight_decay': 2.0346371203155633e-07, 'epochs': 235, 'loss': 'mae', 'optimizer': 'adam', 'graph_mode': 'cutoff', 'cutoff': 0.5608595799669891, 'grm_norm': 'cosine_then_gcn', 'self_loops': False, 'use_snp_selection': True, 'num_snps': 13851, 'graphsage_batch_size': 32}. Best is trial 123 with value: 0.2545287758683708.
