[I 2025-12-06 19:11:30,670] Trial 33 finished with value: 0.2343020258908461 and parameters: {'model_type': 'graphsage', 'hidden_dims': '[512, 256]', 'dropout': 0.16412223256613637, 'batch_norm': False, 'sage_aggr': 'mean', 'sage_normalize': False, 'sage_project': False, 'lr': 2.799488423523471e-05, 'weight_decay': 0.0001562750953688071, 'epochs': 205, 'loss': 'mae', 'optimizer': 'adam', 'graph_mode': 'cutoff', 'cutoff': 0.855076311662898, 'grm_norm': 'none', 'self_loops': False, 'use_snp_selection': False, 'graphsage_batch_size': 16}. Best is trial 13 with value: 0.2471062821273084.
[I 2025-12-06 19:13:30,004] Trial 34 finished with value: 0.23701682334530752 and parameters: {'model_type': 'graphsage', 'hidden_dims': '[512, 256]', 'dropout': 0.1324115716880193, 'batch_norm': False, 'sage_aggr': 'mean', 'sage_normalize': False, 'sage_project': False, 'lr': 4.9065851245117084e-05, 'weight_decay': 9.319329423332993e-05, 'epochs': 199, 'loss': 'mse', 'optimizer': 'adam', 'graph_mode': 'cutoff', 'cutoff': 0.8875823786853814, 'grm_norm': 'none', 'self_loops': False, 'use_snp_selection': False, 'graphsage_batch_size': 8}. Best is trial 13 with value: 0.2471062821273084.
[I 2025-12-06 19:15:28,901] Trial 35 finished with value: 0.23279859774856146 and parameters: {'model_type': 'graphsage', 'hidden_dims': '[512, 128]', 'dropout': 0.29316885936035386, 'batch_norm': True, 'sage_aggr': 'mean', 'sage_normalize': True, 'sage_project': False, 'lr': 0.00013279693831007977, 'weight_decay': 2.9690628606344225e-05, 'epochs': 169, 'loss': 'mae', 'optimizer': 'adam', 'graph_mode': 'cutoff', 'cutoff': 0.8160207007194787, 'grm_norm': 'none', 'self_loops': False, 'use_snp_selection': True, 'num_snps': 58379, 'graphsage_batch_size': 512}. Best is trial 13 with value: 0.2471062821273084.
[I 2025-12-06 19:17:43,306] Trial 36 finished with value: 0.19387631065816513 and parameters: {'model_type': 'graphsage', 'hidden_dims': '[512, 256]', 'dropout': 0.181940468482135, 'batch_norm': False, 'sage_aggr': 'max', 'sage_normalize': False, 'sage_project': False, 'lr': 3.3731162643514656e-05, 'weight_decay': 1.525579469651686e-06, 'epochs': 217, 'loss': 'mse', 'optimizer': 'adam', 'graph_mode': 'knn', 'knn_k': 1, 'weighted_edges': False, 'symmetrize_mode': 'union', 'self_loops': False, 'use_snp_selection': False, 'graphsage_batch_size': 16}. Best is trial 13 with value: 0.2471062821273084.
[I 2025-12-06 19:18:20,328] Trial 37 finished with value: 0.2355035001518261 and parameters: {'model_type': 'graphsage', 'hidden_dims': '[256, 128]', 'dropout': 0.24573550408993128, 'batch_norm': True, 'sage_aggr': 'mean', 'sage_normalize': True, 'sage_project': False, 'lr': 0.0006744222314802094, 'weight_decay': 1.447597410046343e-05, 'epochs': 139, 'loss': 'mae', 'optimizer': 'adam', 'graph_mode': 'cutoff', 'cutoff': 0.7194986259370901, 'grm_norm': 'none', 'self_loops': False, 'use_snp_selection': True, 'num_snps': 23077, 'graphsage_batch_size': 256}. Best is trial 13 with value: 0.2471062821273084.
[I 2025-12-06 19:23:03,381] Trial 38 finished with value: 0.23002950333209232 and parameters: {'model_type': 'graphsage', 'hidden_dims': '[512, 256]', 'dropout': 0.20499839076790252, 'batch_norm': False, 'sage_aggr': 'max', 'sage_normalize': False, 'sage_project': False, 'lr': 0.0003544641574290063, 'weight_decay': 8.917145993866623e-07, 'epochs': 223, 'loss': 'mae', 'optimizer': 'adam', 'graph_mode': 'knn', 'knn_k': 10, 'weighted_edges': False, 'symmetrize_mode': 'union', 'self_loops': False, 'use_snp_selection': False, 'graphsage_batch_size': 32}. Best is trial 13 with value: 0.2471062821273084.
[I 2025-12-06 19:23:27,748] Trial 39 finished with value: 0.1976524667401152 and parameters: {'model_type': 'graphsage', 'hidden_dims': '[512, 64]', 'dropout': 0.13148887639576115, 'batch_norm': False, 'sage_aggr': 'mean', 'sage_normalize': True, 'sage_project': False, 'lr': 8.955814122020234e-06, 'weight_decay': 0.0004895381061904592, 'epochs': 206, 'loss': 'mse', 'optimizer': 'adam', 'graph_mode': 'cutoff', 'cutoff': 0.8414453805011943, 'grm_norm': 'none', 'self_loops': False, 'use_snp_selection': True, 'num_snps': 4669, 'graphsage_batch_size': 8}. Best is trial 13 with value: 0.2471062821273084.
[I 2025-12-06 19:24:28,316] Trial 40 finished with value: 0.15777625165119658 and parameters: {'model_type': 'graphsage', 'hidden_dims': '[256, 128]', 'dropout': 0.40721269423432727, 'batch_norm': True, 'sage_aggr': 'mean', 'sage_normalize': False, 'sage_project': False, 'lr': 3.943329460982386e-06, 'weight_decay': 1.835820288815974e-07, 'epochs': 159, 'loss': 'mae', 'optimizer': 'adam', 'graph_mode': 'knn', 'knn_k': 1, 'weighted_edges': False, 'symmetrize_mode': 'union', 'self_loops': False, 'use_snp_selection': False, 'graphsage_batch_size': 16}. Best is trial 13 with value: 0.2471062821273084.
[I 2025-12-06 19:26:48,435] Trial 41 finished with value: 0.236274963037754 and parameters: {'model_type': 'graphsage', 'hidden_dims': '[512, 256]', 'dropout': 0.21580266652024366, 'batch_norm': False, 'sage_aggr': 'mean', 'sage_normalize': False, 'sage_project': False, 'lr': 5.731341501015714e-05, 'weight_decay': 0.00027655369631088587, 'epochs': 237, 'loss': 'mae', 'optimizer': 'adam', 'graph_mode': 'cutoff', 'cutoff': 0.7767553307968267, 'grm_norm': 'none', 'self_loops': False, 'use_snp_selection': False, 'graphsage_batch_size': 16}. Best is trial 13 with value: 0.2471062821273084.
[I 2025-12-06 19:29:02,163] Trial 42 finished with value: 0.23798895188565697 and parameters: {'model_type': 'graphsage', 'hidden_dims': '[512, 256]', 'dropout': 0.3653960877746037, 'batch_norm': False, 'sage_aggr': 'mean', 'sage_normalize': False, 'sage_project': False, 'lr': 8.816655704544812e-05, 'weight_decay': 0.00015216571275642962, 'epochs': 225, 'loss': 'mae', 'optimizer': 'adam', 'graph_mode': 'cutoff', 'cutoff': 0.7137915693327274, 'grm_norm': 'gcn', 'self_loops': False, 'use_snp_selection': False, 'graphsage_batch_size': 16}. Best is trial 13 with value: 0.2471062821273084.
[I 2025-12-06 19:30:57,103] Trial 43 finished with value: 0.23930360522556207 and parameters: {'model_type': 'graphsage', 'hidden_dims': '[512, 256]', 'dropout': 0.2889095906663624, 'batch_norm': False, 'sage_aggr': 'mean', 'sage_normalize': False, 'sage_project': False, 'lr': 2.3414677082828904e-05, 'weight_decay': 0.000407280010865759, 'epochs': 191, 'loss': 'mae', 'optimizer': 'adam', 'graph_mode': 'cutoff', 'cutoff': 0.7863348991832202, 'grm_norm': 'none', 'self_loops': False, 'use_snp_selection': False, 'graphsage_batch_size': 16}. Best is trial 13 with value: 0.2471062821273084.
[I 2025-12-06 19:34:23,102] Trial 44 finished with value: 0.23679395940482828 and parameters: {'model_type': 'graphsage', 'hidden_dims': '[512, 128]', 'dropout': 0.1158439423181017, 'batch_norm': False, 'sage_aggr': 'mean', 'sage_normalize': False, 'sage_project': False, 'lr': 0.00017894212765913822, 'weight_decay': 0.00011221976769726519, 'epochs': 245, 'loss': 'mae', 'optimizer': 'adam', 'graph_mode': 'cutoff', 'cutoff': 0.27428355160738205, 'grm_norm': 'none', 'self_loops': False, 'use_snp_selection': False, 'graphsage_batch_size': 128}. Best is trial 13 with value: 0.2471062821273084.
[I 2025-12-06 19:36:29,535] Trial 45 finished with value: 0.23668231036011295 and parameters: {'model_type': 'graphsage', 'hidden_dims': '[512, 256]', 'dropout': 0.2588690794756993, 'batch_norm': False, 'sage_aggr': 'mean', 'sage_normalize': False, 'sage_project': False, 'lr': 3.752948712074879e-05, 'weight_decay': 6.990317600927229e-05, 'epochs': 211, 'loss': 'mae', 'optimizer': 'adam', 'graph_mode': 'cutoff', 'cutoff': 0.8592485905128923, 'grm_norm': 'cosine_then_gcn', 'self_loops': False, 'use_snp_selection': False, 'graphsage_batch_size': 16}. Best is trial 13 with value: 0.2471062821273084.
[I 2025-12-06 19:37:56,547] Trial 46 finished with value: 0.2484864043857557 and parameters: {'model_type': 'graphsage', 'hidden_dims': '[512, 256]', 'dropout': 0.15996109476265458, 'batch_norm': False, 'sage_aggr': 'max', 'sage_normalize': False, 'sage_project': False, 'lr': 0.0001361136851962809, 'weight_decay': 0.0001938336519276833, 'epochs': 178, 'loss': 'mae', 'optimizer': 'adam', 'graph_mode': 'cutoff', 'cutoff': 0.8867965066165904, 'grm_norm': 'none', 'self_loops': False, 'use_snp_selection': True, 'num_snps': 40295, 'graphsage_batch_size': 512}. Best is trial 46 with value: 0.2484864043857557.
[I 2025-12-06 19:39:03,178] Trial 47 finished with value: 0.20350054444777674 and parameters: {'model_type': 'graphsage', 'hidden_dims': '[256, 128, 64]', 'dropout': 0.15973412947892057, 'batch_norm': False, 'sage_aggr': 'max', 'sage_normalize': True, 'sage_project': False, 'lr': 0.0002465468515957291, 'weight_decay': 6.943604826310532e-06, 'epochs': 178, 'loss': 'mae', 'optimizer': 'adam', 'graph_mode': 'knn', 'knn_k': 3, 'weighted_edges': True, 'symmetrize_mode': 'mutual', 'self_loops': False, 'use_snp_selection': True, 'num_snps': 40236, 'graphsage_batch_size': 512}. Best is trial 46 with value: 0.2484864043857557.
[I 2025-12-06 19:40:18,302] Trial 48 finished with value: 0.23196682060557774 and parameters: {'model_type': 'graphsage', 'hidden_dims': '[512, 256]', 'dropout': 0.18916660020142873, 'batch_norm': False, 'sage_aggr': 'max', 'sage_normalize': False, 'sage_project': False, 'lr': 0.00014123432635286605, 'weight_decay': 4.051155788109287e-05, 'epochs': 85, 'loss': 'mae', 'optimizer': 'adam', 'graph_mode': 'cutoff', 'cutoff': 0.8925988050462907, 'grm_norm': 'cosine', 'self_loops': False, 'use_snp_selection': True, 'num_snps': 59018, 'graphsage_batch_size': 512}. Best is trial 46 with value: 0.2484864043857557.
[I 2025-12-06 19:41:26,124] Trial 49 finished with value: 0.24878696427707858 and parameters: {'model_type': 'graphsage', 'hidden_dims': '[512, 64]', 'dropout': 0.14944988864885927, 'batch_norm': False, 'sage_aggr': 'max', 'sage_normalize': False, 'sage_project': False, 'lr': 9.958624227513221e-05, 'weight_decay': 0.00017279156366540002, 'epochs': 192, 'loss': 'mae', 'optimizer': 'adam', 'graph_mode': 'cutoff', 'cutoff': 0.8491055344645942, 'grm_norm': 'none', 'self_loops': False, 'use_snp_selection': True, 'num_snps': 28269, 'graphsage_batch_size': 512}. Best is trial 49 with value: 0.24878696427707858.
[I 2025-12-06 19:42:20,850] Trial 50 finished with value: 0.11748898483606643 and parameters: {'model_type': 'graphsage', 'hidden_dims': '[512, 64]', 'dropout': 0.15090029637324442, 'batch_norm': False, 'sage_aggr': 'max', 'sage_normalize': False, 'sage_project': False, 'lr': 0.0005401535180869059, 'weight_decay': 5.140192035861332e-05, 'epochs': 146, 'loss': 'mse', 'optimizer': 'adam', 'graph_mode': 'cutoff', 'cutoff': 0.8540532113082923, 'grm_norm': 'none', 'self_loops': False, 'use_snp_selection': True, 'num_snps': 26955, 'graphsage_batch_size': 512}. Best is trial 49 with value: 0.24878696427707858.
[I 2025-12-06 19:43:11,007] Trial 51 finished with value: 0.2490260031805581 and parameters: {'model_type': 'graphsage', 'hidden_dims': '[512, 64]', 'dropout': 0.11877117069913835, 'batch_norm': False, 'sage_aggr': 'max', 'sage_normalize': False, 'sage_project': False, 'lr': 0.00010319320163060136, 'weight_decay': 0.0001781340209993253, 'epochs': 192, 'loss': 'mae', 'optimizer': 'adam', 'graph_mode': 'cutoff', 'cutoff': 0.8564015490775742, 'grm_norm': 'none', 'self_loops': False, 'use_snp_selection': True, 'num_snps': 19153, 'graphsage_batch_size': 512}. Best is trial 51 with value: 0.2490260031805581.
[I 2025-12-06 19:44:02,659] Trial 52 finished with value: 0.25382432863900317 and parameters: {'model_type': 'graphsage', 'hidden_dims': '[512, 64]', 'dropout': 0.1010900990969116, 'batch_norm': False, 'sage_aggr': 'max', 'sage_normalize': False, 'sage_project': False, 'lr': 0.00010178675429816488, 'weight_decay': 0.00017357167651995604, 'epochs': 193, 'loss': 'mae', 'optimizer': 'adam', 'graph_mode': 'cutoff', 'cutoff': 0.8623164419996941, 'grm_norm': 'none', 'self_loops': False, 'use_snp_selection': True, 'num_snps': 19948, 'graphsage_batch_size': 512}. Best is trial 52 with value: 0.25382432863900317.
[I 2025-12-06 19:44:48,880] Trial 53 finished with value: 0.23837677737763271 and parameters: {'model_type': 'graphsage', 'hidden_dims': '[512, 64]', 'dropout': 0.11204302115966316, 'batch_norm': False, 'sage_aggr': 'max', 'sage_normalize': False, 'sage_project': False, 'lr': 0.00010358264461658527, 'weight_decay': 0.0007286666282591808, 'epochs': 194, 'loss': 'mae', 'optimizer': 'adam', 'graph_mode': 'cutoff', 'cutoff': 0.8937966475038839, 'grm_norm': 'none', 'self_loops': False, 'use_snp_selection': True, 'num_snps': 16842, 'graphsage_batch_size': 512}. Best is trial 52 with value: 0.25382432863900317.
[I 2025-12-06 19:45:36,796] Trial 54 finished with value: 0.2578505795866901 and parameters: {'model_type': 'graphsage', 'hidden_dims': '[512, 64]', 'dropout': 0.10258928801991582, 'batch_norm': False, 'sage_aggr': 'max', 'sage_normalize': False, 'sage_project': False, 'lr': 0.0001713365185250981, 'weight_decay': 7.906805202243464e-05, 'epochs': 170, 'loss': 'mae', 'optimizer': 'adam', 'graph_mode': 'cutoff', 'cutoff': 0.8670270049920701, 'grm_norm': 'none', 'self_loops': False, 'use_snp_selection': True, 'num_snps': 20232, 'graphsage_batch_size': 512}. Best is trial 54 with value: 0.2578505795866901.
[I 2025-12-06 19:46:22,663] Trial 55 finished with value: 0.24957500341896127 and parameters: {'model_type': 'graphsage', 'hidden_dims': '[512, 64]', 'dropout': 0.10161567766475178, 'batch_norm': False, 'sage_aggr': 'max', 'sage_normalize': False, 'sage_project': False, 'lr': 0.00017722275080418704, 'weight_decay': 0.00015828678316544563, 'epochs': 165, 'loss': 'mae', 'optimizer': 'adam', 'graph_mode': 'cutoff', 'cutoff': 0.8655454240537028, 'grm_norm': 'none', 'self_loops': False, 'use_snp_selection': True, 'num_snps': 19522, 'graphsage_batch_size': 512}. Best is trial 54 with value: 0.2578505795866901.
[I 2025-12-06 19:47:08,994] Trial 56 finished with value: 0.25134487837527286 and parameters: {'model_type': 'graphsage', 'hidden_dims': '[512, 64]', 'dropout': 0.14672496321528777, 'batch_norm': False, 'sage_aggr': 'max', 'sage_normalize': False, 'sage_project': False, 'lr': 0.00018416649544609272, 'weight_decay': 0.00017270067967067038, 'epochs': 171, 'loss': 'mae', 'optimizer': 'adam', 'graph_mode': 'cutoff', 'cutoff': 0.8670636563195064, 'grm_norm': 'none', 'self_loops': False, 'use_snp_selection': True, 'num_snps': 19142, 'graphsage_batch_size': 512}. Best is trial 54 with value: 0.2578505795866901.
[I 2025-12-06 19:47:46,518] Trial 57 finished with value: 0.2507389792944492 and parameters: {'model_type': 'graphsage', 'hidden_dims': '[512, 64]', 'dropout': 0.1436343213578723, 'batch_norm': False, 'sage_aggr': 'max', 'sage_normalize': False, 'sage_project': False, 'lr': 0.0002023427899248599, 'weight_decay': 8.71195357481492e-05, 'epochs': 126, 'loss': 'mae', 'optimizer': 'adam', 'graph_mode': 'cutoff', 'cutoff': 0.8317463632873879, 'grm_norm': 'gcn', 'self_loops': False, 'use_snp_selection': True, 'num_snps': 18528, 'graphsage_batch_size': 512}. Best is trial 54 with value: 0.2578505795866901.
[I 2025-12-06 19:48:45,484] Trial 58 finished with value: 0.23222802834465037 and parameters: {'model_type': 'graphsage', 'hidden_dims': '[512, 64]', 'dropout': 0.1172650154938177, 'batch_norm': False, 'sage_aggr': 'max', 'sage_normalize': False, 'sage_project': False, 'lr': 0.0002017803827049102, 'weight_decay': 8.278389246400984e-05, 'epochs': 165, 'loss': 'mae', 'optimizer': 'adam', 'graph_mode': 'knn', 'knn_k': 10, 'weighted_edges': True, 'symmetrize_mode': 'mutual', 'self_loops': False, 'use_snp_selection': True, 'num_snps': 17336, 'graphsage_batch_size': 512}. Best is trial 54 with value: 0.2578505795866901.
[I 2025-12-06 19:49:25,437] Trial 59 finished with value: 0.24549934274737145 and parameters: {'model_type': 'graphsage', 'hidden_dims': '[512, 64]', 'dropout': 0.5156874442328455, 'batch_norm': True, 'sage_aggr': 'max', 'sage_normalize': False, 'sage_project': False, 'lr': 0.0002610911966133986, 'weight_decay': 2.9937909141821682e-05, 'epochs': 120, 'loss': 'mae', 'optimizer': 'adam', 'graph_mode': 'cutoff', 'cutoff': 0.8223209958798098, 'grm_norm': 'gcn', 'self_loops': False, 'use_snp_selection': True, 'num_snps': 20476, 'graphsage_batch_size': 512}. Best is trial 54 with value: 0.2578505795866901.
[I 2025-12-06 19:50:13,986] Trial 60 finished with value: 0.19364313420095153 and parameters: {'model_type': 'graphsage', 'hidden_dims': '[512, 64]', 'dropout': 0.17743225889251002, 'batch_norm': False, 'sage_aggr': 'max', 'sage_normalize': True, 'sage_project': False, 'lr': 0.00037250723041506155, 'weight_decay': 0.0005564954135302795, 'epochs': 129, 'loss': 'mae', 'optimizer': 'adam', 'graph_mode': 'cutoff', 'cutoff': 0.21109709395550064, 'grm_norm': 'gcn', 'self_loops': False, 'use_snp_selection': True, 'num_snps': 11354, 'graphsage_batch_size': 512}. Best is trial 54 with value: 0.2578505795866901.
[I 2025-12-06 19:50:55,419] Trial 61 finished with value: 0.2540537517637208 and parameters: {'model_type': 'graphsage', 'hidden_dims': '[512, 64]', 'dropout': 0.13929706066079656, 'batch_norm': False, 'sage_aggr': 'max', 'sage_normalize': False, 'sage_project': False, 'lr': 0.0001663105087942765, 'weight_decay': 0.00021361782225334073, 'epochs': 104, 'loss': 'mae', 'optimizer': 'adam', 'graph_mode': 'cutoff', 'cutoff': 0.85810183888362, 'grm_norm': 'gcn', 'self_loops': False, 'use_snp_selection': True, 'num_snps': 23859, 'graphsage_batch_size': 512}. Best is trial 54 with value: 0.2578505795866901.
[I 2025-12-06 19:51:33,724] Trial 62 finished with value: 0.2564739796578276 and parameters: {'model_type': 'graphsage', 'hidden_dims': '[512, 64]', 'dropout': 0.12810873055671568, 'batch_norm': False, 'sage_aggr': 'max', 'sage_normalize': False, 'sage_project': False, 'lr': 0.00017312131021476925, 'weight_decay': 0.0003444848404046005, 'epochs': 105, 'loss': 'mae', 'optimizer': 'adam', 'graph_mode': 'cutoff', 'cutoff': 0.8650061229708671, 'grm_norm': 'gcn', 'self_loops': False, 'use_snp_selection': True, 'num_snps': 21224, 'graphsage_batch_size': 512}. Best is trial 54 with value: 0.2578505795866901.
[I 2025-12-06 19:52:16,958] Trial 63 finished with value: 0.24579445394995222 and parameters: {'model_type': 'graphsage', 'hidden_dims': '[512, 64]', 'dropout': 0.1346754624802515, 'batch_norm': False, 'sage_aggr': 'max', 'sage_normalize': False, 'sage_project': False, 'lr': 0.00017944230417742636, 'weight_decay': 0.0003998123714053701, 'epochs': 109, 'loss': 'mae', 'optimizer': 'adam', 'graph_mode': 'cutoff', 'cutoff': 0.8026644711182298, 'grm_norm': 'gcn', 'self_loops': False, 'use_snp_selection': True, 'num_snps': 24216, 'graphsage_batch_size': 512}. Best is trial 54 with value: 0.2578505795866901.
[I 2025-12-06 19:52:44,681] Trial 64 finished with value: 0.23764046238518058 and parameters: {'model_type': 'graphsage', 'hidden_dims': '[512, 64]', 'dropout': 0.14292002250041808, 'batch_norm': False, 'sage_aggr': 'max', 'sage_normalize': False, 'sage_project': False, 'lr': 0.0003279353658329346, 'weight_decay': 0.0003360137047097103, 'epochs': 97, 'loss': 'mae', 'optimizer': 'adam', 'graph_mode': 'cutoff', 'cutoff': 0.8997589467733778, 'grm_norm': 'gcn', 'self_loops': False, 'use_snp_selection': True, 'num_snps': 12539, 'graphsage_batch_size': 512}. Best is trial 54 with value: 0.2578505795866901.
[I 2025-12-06 19:53:24,318] Trial 65 finished with value: 0.2546292822903483 and parameters: {'model_type': 'graphsage', 'hidden_dims': '[512, 64]', 'dropout': 0.10534143611213564, 'batch_norm': False, 'sage_aggr': 'max', 'sage_normalize': False, 'sage_project': False, 'lr': 0.0004903947282507964, 'weight_decay': 0.0007184845088118102, 'epochs': 109, 'loss': 'mae', 'optimizer': 'adam', 'graph_mode': 'cutoff', 'cutoff': 0.825490482888766, 'grm_norm': 'gcn', 'self_loops': False, 'use_snp_selection': True, 'num_snps': 21816, 'graphsage_batch_size': 512}. Best is trial 54 with value: 0.2578505795866901.
[I 2025-12-06 19:53:58,596] Trial 66 finished with value: 0.18950860323941648 and parameters: {'model_type': 'graphsage', 'hidden_dims': '[512, 64]', 'dropout': 0.17321928517019683, 'batch_norm': False, 'sage_aggr': 'max', 'sage_normalize': False, 'sage_project': False, 'lr': 0.0004794444435538516, 'weight_decay': 0.000521071247130942, 'epochs': 65, 'loss': 'mae', 'optimizer': 'adam', 'graph_mode': 'cutoff', 'cutoff': 0.7703470308199614, 'grm_norm': 'gcn', 'self_loops': False, 'use_snp_selection': True, 'num_snps': 24923, 'graphsage_batch_size': 512}. Best is trial 54 with value: 0.2578505795866901.
[I 2025-12-06 19:54:28,740] Trial 67 finished with value: 0.2341041480313099 and parameters: {'model_type': 'graphsage', 'hidden_dims': '[512, 64]', 'dropout': 0.12665296468381543, 'batch_norm': False, 'sage_aggr': 'max', 'sage_normalize': False, 'sage_project': False, 'lr': 0.0007214298308591471, 'weight_decay': 0.0008051790232114912, 'epochs': 110, 'loss': 'mae', 'optimizer': 'adam', 'graph_mode': 'cutoff', 'cutoff': 0.8274938074834706, 'grm_norm': 'gcn', 'self_loops': False, 'use_snp_selection': True, 'num_snps': 13555, 'graphsage_batch_size': 512}. Best is trial 54 with value: 0.2578505795866901.
[I 2025-12-06 19:55:03,140] Trial 68 finished with value: 0.24056057423317703 and parameters: {'model_type': 'graphsage', 'hidden_dims': '[512, 64]', 'dropout': 0.14231560557528786, 'batch_norm': False, 'sage_aggr': 'max', 'sage_normalize': False, 'sage_project': False, 'lr': 0.0002914183271381013, 'weight_decay': 0.000631224741526213, 'epochs': 83, 'loss': 'mae', 'optimizer': 'adam', 'graph_mode': 'cutoff', 'cutoff': 0.7602219984637291, 'grm_norm': 'gcn', 'self_loops': False, 'use_snp_selection': True, 'num_snps': 21295, 'graphsage_batch_size': 512}. Best is trial 54 with value: 0.2578505795866901.
