[I 2025-12-09 21:52:25,550] Trial 105 finished with value: 0.3672295185366038 and parameters: {'model_type': 'graphsage', 'hidden_dims': '[512, 256]', 'dropout': 0.3947436799369421, 'batch_norm': False, 'sage_aggr': 'max', 'sage_normalize': False, 'sage_project': False, 'lr': 1.4078651811549354e-05, 'weight_decay': 0.00040981046977838024, 'epochs': 135, 'loss': 'mae', 'optimizer': 'adam', 'graph_mode': 'cutoff', 'cutoff': 0.6817419781618034, 'grm_norm': 'none', 'self_loops': False, 'use_snp_selection': True, 'num_snps': 46009}. Best is trial 63 with value: 0.3744651287832118.
[I 2025-12-09 21:53:28,016] Trial 106 finished with value: 0.35414310601093646 and parameters: {'model_type': 'graphsage', 'hidden_dims': '[512, 256]', 'dropout': 0.3797674365202796, 'batch_norm': False, 'sage_aggr': 'max', 'sage_normalize': False, 'sage_project': False, 'lr': 1.1199850731212734e-05, 'weight_decay': 0.0002422373545348237, 'epochs': 79, 'loss': 'mse', 'optimizer': 'adam', 'graph_mode': 'cutoff', 'cutoff': 0.5375482982453755, 'grm_norm': 'none', 'self_loops': False, 'use_snp_selection': True, 'num_snps': 42076}. Best is trial 63 with value: 0.3744651287832118.
[I 2025-12-09 21:55:00,777] Trial 107 finished with value: 0.3718792494289417 and parameters: {'model_type': 'graphsage', 'hidden_dims': '[512, 256]', 'dropout': 0.4256983359754329, 'batch_norm': False, 'sage_aggr': 'mean', 'sage_normalize': False, 'sage_project': False, 'lr': 1.2758016149550209e-05, 'weight_decay': 0.0008246724515791197, 'epochs': 156, 'loss': 'mae', 'optimizer': 'adam', 'graph_mode': 'cutoff', 'cutoff': 0.7645617031053913, 'grm_norm': 'cosine', 'self_loops': False, 'use_snp_selection': True, 'num_snps': 50044}. Best is trial 63 with value: 0.3744651287832118.
[I 2025-12-09 21:57:57,270] Trial 108 finished with value: 0.3663161711316578 and parameters: {'model_type': 'graphsage', 'hidden_dims': '[512, 256]', 'dropout': 0.46720229937250185, 'batch_norm': False, 'sage_aggr': 'mean', 'sage_normalize': False, 'sage_project': False, 'lr': 1.0263228539387128e-05, 'weight_decay': 0.000814674336601107, 'epochs': 206, 'loss': 'mae', 'optimizer': 'adam', 'graph_mode': 'knn', 'knn_k': 10, 'weighted_edges': True, 'symmetrize_mode': 'mutual', 'self_loops': False, 'use_snp_selection': True, 'num_snps': 49955}. Best is trial 63 with value: 0.3744651287832118.
[I 2025-12-09 21:58:46,546] Trial 109 finished with value: 0.33829771369151146 and parameters: {'model_type': 'graphsage', 'hidden_dims': '[256, 128]', 'dropout': 0.4271484667854977, 'batch_norm': True, 'sage_aggr': 'mean', 'sage_normalize': False, 'sage_project': False, 'lr': 1.2774737438891122e-05, 'weight_decay': 0.000318683708811604, 'epochs': 88, 'loss': 'mae', 'optimizer': 'adam', 'graph_mode': 'cutoff', 'cutoff': 0.7375829047648418, 'grm_norm': 'cosine', 'self_loops': True, 'use_snp_selection': True, 'num_snps': 37411}. Best is trial 63 with value: 0.3744651287832118.
[I 2025-12-09 21:59:45,222] Trial 110 finished with value: 0.0702084823398019 and parameters: {'model_type': 'graphsage', 'hidden_dims': '[128, 64]', 'dropout': 0.45017804808897355, 'batch_norm': False, 'sage_aggr': 'mean', 'sage_normalize': False, 'sage_project': False, 'lr': 0.00019909419404010433, 'weight_decay': 0.00059356456603829, 'epochs': 108, 'loss': 'mae', 'optimizer': 'adam', 'graph_mode': 'cutoff', 'cutoff': 0.5727740065304873, 'grm_norm': 'cosine', 'self_loops': False, 'use_snp_selection': True, 'num_snps': 56358}. Best is trial 63 with value: 0.3744651287832118.
[I 2025-12-09 22:01:22,581] Trial 111 finished with value: 0.36441300308312624 and parameters: {'model_type': 'graphsage', 'hidden_dims': '[512, 256]', 'dropout': 0.416670273981133, 'batch_norm': False, 'sage_aggr': 'mean', 'sage_normalize': False, 'sage_project': False, 'lr': 1.7571062374280035e-05, 'weight_decay': 0.0007840301498295148, 'epochs': 176, 'loss': 'mae', 'optimizer': 'adam', 'graph_mode': 'cutoff', 'cutoff': 0.76608990029864, 'grm_norm': 'cosine', 'self_loops': False, 'use_snp_selection': True, 'num_snps': 48350}. Best is trial 63 with value: 0.3744651287832118.
[I 2025-12-09 22:02:56,205] Trial 112 finished with value: 0.3672127919915794 and parameters: {'model_type': 'graphsage', 'hidden_dims': '[512, 256]', 'dropout': 0.4048959061003082, 'batch_norm': False, 'sage_aggr': 'mean', 'sage_normalize': False, 'sage_project': False, 'lr': 2.1967249056609586e-05, 'weight_decay': 0.0004886225027224203, 'epochs': 148, 'loss': 'mae', 'optimizer': 'adam', 'graph_mode': 'cutoff', 'cutoff': 0.6996276555275799, 'grm_norm': 'cosine', 'self_loops': False, 'use_snp_selection': True, 'num_snps': 52301}. Best is trial 63 with value: 0.3744651287832118.
[I 2025-12-09 22:04:21,406] Trial 113 finished with value: 0.3712340208842695 and parameters: {'model_type': 'graphsage', 'hidden_dims': '[512, 256]', 'dropout': 0.3886272409745805, 'batch_norm': False, 'sage_aggr': 'max', 'sage_normalize': False, 'sage_project': False, 'lr': 1.2710752944368645e-05, 'weight_decay': 0.00039966340728939386, 'epochs': 154, 'loss': 'mae', 'optimizer': 'adam', 'graph_mode': 'cutoff', 'cutoff': 0.7887314995518193, 'grm_norm': 'cosine', 'self_loops': False, 'use_snp_selection': True, 'num_snps': 45165}. Best is trial 63 with value: 0.3744651287832118.
[I 2025-12-09 22:05:33,734] Trial 114 finished with value: 0.19696566664548237 and parameters: {'model_type': 'graphsage', 'hidden_dims': '[512, 256]', 'dropout': 0.5093202611582996, 'batch_norm': False, 'sage_aggr': 'max', 'sage_normalize': False, 'sage_project': False, 'lr': 0.00040614891392857166, 'weight_decay': 0.0006448237823135377, 'epochs': 113, 'loss': 'mae', 'optimizer': 'adam', 'graph_mode': 'cutoff', 'cutoff': 0.7915425706850396, 'grm_norm': 'cosine', 'self_loops': False, 'use_snp_selection': True, 'num_snps': 44829}. Best is trial 63 with value: 0.3744651287832118.
[I 2025-12-09 22:07:00,264] Trial 115 finished with value: 0.3664133927605659 and parameters: {'model_type': 'graphsage', 'hidden_dims': '[512, 256]', 'dropout': 0.42023076316865704, 'batch_norm': False, 'sage_aggr': 'max', 'sage_normalize': False, 'sage_project': False, 'lr': 1.2946677195985976e-05, 'weight_decay': 0.00034178490153969303, 'epochs': 192, 'loss': 'mae', 'optimizer': 'adam', 'graph_mode': 'cutoff', 'cutoff': 0.8434418328538247, 'grm_norm': 'cosine', 'self_loops': False, 'use_snp_selection': True, 'num_snps': 39550}. Best is trial 63 with value: 0.3744651287832118.
[I 2025-12-09 22:07:59,133] Trial 116 finished with value: 0.35656798289729885 and parameters: {'model_type': 'graphsage', 'hidden_dims': '[512, 256]', 'dropout': 0.4844136807205188, 'batch_norm': False, 'sage_aggr': 'mean', 'sage_normalize': False, 'sage_project': False, 'lr': 1.5383132117517357e-05, 'weight_decay': 0.00026224910984169194, 'epochs': 66, 'loss': 'mae', 'optimizer': 'adam', 'graph_mode': 'cutoff', 'cutoff': 0.6664534239683707, 'grm_norm': 'cosine', 'self_loops': False, 'use_snp_selection': True, 'num_snps': 43372}. Best is trial 63 with value: 0.3744651287832118.
[I 2025-12-09 22:09:13,898] Trial 117 finished with value: 0.36733492090111125 and parameters: {'model_type': 'graphsage', 'hidden_dims': '[512, 128]', 'dropout': 0.43711360366369034, 'batch_norm': False, 'sage_aggr': 'max', 'sage_normalize': False, 'sage_project': False, 'lr': 1.0198658030522132e-05, 'weight_decay': 0.0001953687555522945, 'epochs': 122, 'loss': 'mae', 'optimizer': 'adam', 'graph_mode': 'cutoff', 'cutoff': 0.5156932290795778, 'grm_norm': 'cosine', 'self_loops': False, 'use_snp_selection': True, 'num_snps': 41216}. Best is trial 63 with value: 0.3744651287832118.
[I 2025-12-09 22:10:30,279] Trial 118 finished with value: 0.3397667044974642 and parameters: {'model_type': 'graphsage', 'hidden_dims': '[512, 256]', 'dropout': 0.38938742229121726, 'batch_norm': False, 'sage_aggr': 'max', 'sage_normalize': True, 'sage_project': False, 'lr': 1.3369759588017898e-05, 'weight_decay': 0.0009299991308362402, 'epochs': 137, 'loss': 'mae', 'optimizer': 'adam', 'graph_mode': 'cutoff', 'cutoff': 0.46401867283944853, 'grm_norm': 'cosine', 'self_loops': False, 'use_snp_selection': False}. Best is trial 63 with value: 0.3744651287832118.
[I 2025-12-09 22:11:37,791] Trial 119 finished with value: 0.36467303857282474 and parameters: {'model_type': 'graphsage', 'hidden_dims': '[128, 64]', 'dropout': 0.4033608444895669, 'batch_norm': False, 'sage_aggr': 'max', 'sage_normalize': False, 'sage_project': False, 'lr': 2.1339797506725633e-05, 'weight_decay': 0.0005283670621052005, 'epochs': 199, 'loss': 'mae', 'optimizer': 'adam', 'graph_mode': 'cutoff', 'cutoff': 0.8264714204986594, 'grm_norm': 'cosine_then_gcn', 'self_loops': False, 'use_snp_selection': True, 'num_snps': 50685}. Best is trial 63 with value: 0.3744651287832118.
[I 2025-12-09 22:12:56,162] Trial 120 finished with value: 0.35501647856674035 and parameters: {'model_type': 'graphsage', 'hidden_dims': '[256, 128, 64]', 'dropout': 0.45554867724876574, 'batch_norm': False, 'sage_aggr': 'max', 'sage_normalize': False, 'sage_project': False, 'lr': 2.575638320694361e-05, 'weight_decay': 0.0009964702472699193, 'epochs': 221, 'loss': 'mae', 'optimizer': 'adam', 'graph_mode': 'cutoff', 'cutoff': 0.7463260792652747, 'grm_norm': 'gcn', 'self_loops': False, 'use_snp_selection': True, 'num_snps': 47086}. Best is trial 63 with value: 0.3744651287832118.
[I 2025-12-09 22:14:21,052] Trial 121 finished with value: 0.36825024052776967 and parameters: {'model_type': 'graphsage', 'hidden_dims': '[512, 256]', 'dropout': 0.364660205902886, 'batch_norm': False, 'sage_aggr': 'max', 'sage_normalize': False, 'sage_project': False, 'lr': 1.7287862149519317e-05, 'weight_decay': 0.00042319047748133663, 'epochs': 154, 'loss': 'mae', 'optimizer': 'adam', 'graph_mode': 'cutoff', 'cutoff': 0.7721096403992502, 'grm_norm': 'none', 'self_loops': False, 'use_snp_selection': True, 'num_snps': 45590}. Best is trial 63 with value: 0.3744651287832118.
[I 2025-12-09 22:15:48,982] Trial 122 finished with value: 0.36153551150669727 and parameters: {'model_type': 'graphsage', 'hidden_dims': '[512, 256]', 'dropout': 0.3925218727537858, 'batch_norm': False, 'sage_aggr': 'max', 'sage_normalize': False, 'sage_project': False, 'lr': 1.1449014342671593e-05, 'weight_decay': 0.00038811686430188124, 'epochs': 170, 'loss': 'mae', 'optimizer': 'adam', 'graph_mode': 'cutoff', 'cutoff': 0.7268737772776243, 'grm_norm': 'none', 'self_loops': False, 'use_snp_selection': True, 'num_snps': 44837}. Best is trial 63 with value: 0.3744651287832118.
[I 2025-12-09 22:17:16,656] Trial 123 finished with value: 0.3628477701120588 and parameters: {'model_type': 'graphsage', 'hidden_dims': '[512, 256]', 'dropout': 0.35539622525263903, 'batch_norm': False, 'sage_aggr': 'max', 'sage_normalize': False, 'sage_project': False, 'lr': 1.4973344196085085e-05, 'weight_decay': 0.0007019988129392729, 'epochs': 155, 'loss': 'mae', 'optimizer': 'adam', 'graph_mode': 'cutoff', 'cutoff': 0.8577693760652684, 'grm_norm': 'cosine', 'self_loops': False, 'use_snp_selection': True, 'num_snps': 46051}. Best is trial 63 with value: 0.3744651287832118.
[I 2025-12-09 22:18:07,247] Trial 124 finished with value: 0.36478095751945905 and parameters: {'model_type': 'graphsage', 'hidden_dims': '[512, 256]', 'dropout': 0.3399946421096864, 'batch_norm': False, 'sage_aggr': 'max', 'sage_normalize': False, 'sage_project': False, 'lr': 1.3035769450419695e-05, 'weight_decay': 0.00047111833455138223, 'epochs': 143, 'loss': 'mae', 'optimizer': 'adam', 'graph_mode': 'cutoff', 'cutoff': 0.7954824354636827, 'grm_norm': 'none', 'self_loops': False, 'use_snp_selection': True, 'num_snps': 21008}. Best is trial 63 with value: 0.3744651287832118.
[I 2025-12-09 22:19:46,122] Trial 125 finished with value: 0.36498423861474594 and parameters: {'model_type': 'graphsage', 'hidden_dims': '[512, 256]', 'dropout': 0.38064385803644885, 'batch_norm': False, 'sage_aggr': 'max', 'sage_normalize': False, 'sage_project': False, 'lr': 1.9216112147423774e-05, 'weight_decay': 0.00031690355739778065, 'epochs': 182, 'loss': 'mae', 'optimizer': 'adam', 'graph_mode': 'cutoff', 'cutoff': 0.8141091746964375, 'grm_norm': 'none', 'self_loops': False, 'use_snp_selection': True, 'num_snps': 49298}. Best is trial 63 with value: 0.3744651287832118.
[I 2025-12-09 22:20:55,855] Trial 126 finished with value: 0.36943388718282777 and parameters: {'model_type': 'graphsage', 'hidden_dims': '[512, 256]', 'dropout': 0.3220592679780956, 'batch_norm': False, 'sage_aggr': 'max', 'sage_normalize': False, 'sage_project': False, 'lr': 1.5745163813556418e-05, 'weight_decay': 0.00021677839776884487, 'epochs': 104, 'loss': 'mse', 'optimizer': 'adam', 'graph_mode': 'cutoff', 'cutoff': 0.7812537939148955, 'grm_norm': 'cosine', 'self_loops': False, 'use_snp_selection': True, 'num_snps': 43743}. Best is trial 63 with value: 0.3744651287832118.
[I 2025-12-09 22:22:05,533] Trial 127 finished with value: 0.3617295069448312 and parameters: {'model_type': 'graphsage', 'hidden_dims': '[512, 256]', 'dropout': 0.3244457410782142, 'batch_norm': False, 'sage_aggr': 'max', 'sage_normalize': False, 'sage_project': False, 'lr': 1.5868200977378556e-05, 'weight_decay': 0.00011167213158687884, 'epochs': 104, 'loss': 'mse', 'optimizer': 'adam', 'graph_mode': 'cutoff', 'cutoff': 0.7812632005265975, 'grm_norm': 'cosine', 'self_loops': False, 'use_snp_selection': True, 'num_snps': 43723}. Best is trial 63 with value: 0.3744651287832118.
[I 2025-12-09 22:23:32,052] Trial 128 finished with value: 0.3579042033362877 and parameters: {'model_type': 'graphsage', 'hidden_dims': '[512, 256]', 'dropout': 0.30168463187305383, 'batch_norm': False, 'sage_aggr': 'max', 'sage_normalize': False, 'sage_project': False, 'lr': 1.1066242465843883e-05, 'weight_decay': 0.00022091936137089204, 'epochs': 152, 'loss': 'mse', 'optimizer': 'adam', 'graph_mode': 'cutoff', 'cutoff': 0.7722818996494129, 'grm_norm': 'none', 'self_loops': False, 'use_snp_selection': True, 'num_snps': 47141}. Best is trial 63 with value: 0.3744651287832118.
[I 2025-12-09 22:25:51,360] Trial 129 finished with value: 0.24694170311063063 and parameters: {'model_type': 'graphsage', 'hidden_dims': '[128, 64]', 'dropout': 0.3641568731658219, 'batch_norm': True, 'sage_aggr': 'max', 'sage_normalize': False, 'sage_project': False, 'lr': 1.2938947829257135e-05, 'weight_decay': 0.0002753027222978447, 'epochs': 132, 'loss': 'mse', 'optimizer': 'adam', 'graph_mode': 'knn', 'knn_k': 5, 'weighted_edges': False, 'symmetrize_mode': 'union', 'self_loops': True, 'use_snp_selection': True, 'num_snps': 59832}. Best is trial 63 with value: 0.3744651287832118.
[I 2025-12-09 22:27:14,698] Trial 130 finished with value: 0.3587529810061415 and parameters: {'model_type': 'graphsage', 'hidden_dims': '[512, 256]', 'dropout': 0.3384482617387748, 'batch_norm': False, 'sage_aggr': 'max', 'sage_normalize': False, 'sage_project': False, 'lr': 1.792168158288127e-05, 'weight_decay': 0.00016019422300716921, 'epochs': 161, 'loss': 'mse', 'optimizer': 'adam', 'graph_mode': 'cutoff', 'cutoff': 0.8262615248270834, 'grm_norm': 'cosine', 'self_loops': False, 'use_snp_selection': True, 'num_snps': 42556}. Best is trial 63 with value: 0.3744651287832118.
[I 2025-12-09 22:28:17,929] Trial 131 finished with value: 0.37031842086812855 and parameters: {'model_type': 'graphsage', 'hidden_dims': '[512, 256]', 'dropout': 0.3135209681931186, 'batch_norm': False, 'sage_aggr': 'max', 'sage_normalize': False, 'sage_project': False, 'lr': 2.5224196523752717e-05, 'weight_decay': 1.5529335577567548e-06, 'epochs': 92, 'loss': 'mse', 'optimizer': 'adam', 'graph_mode': 'cutoff', 'cutoff': 0.714730104277427, 'grm_norm': 'cosine', 'self_loops': False, 'use_snp_selection': True, 'num_snps': 40814}. Best is trial 63 with value: 0.3744651287832118.
[I 2025-12-09 22:29:22,029] Trial 132 finished with value: 0.3642161168721584 and parameters: {'model_type': 'graphsage', 'hidden_dims': '[512, 256]', 'dropout': 0.2682486684640204, 'batch_norm': False, 'sage_aggr': 'max', 'sage_normalize': False, 'sage_project': False, 'lr': 1.4756983743343475e-05, 'weight_decay': 1.7033745107342164e-06, 'epochs': 93, 'loss': 'mse', 'optimizer': 'adam', 'graph_mode': 'cutoff', 'cutoff': 0.751221488374731, 'grm_norm': 'cosine', 'self_loops': False, 'use_snp_selection': True, 'num_snps': 41183}. Best is trial 63 with value: 0.3744651287832118.
[I 2025-12-09 22:31:03,861] Trial 133 finished with value: 0.3400305905545468 and parameters: {'model_type': 'graphsage', 'hidden_dims': '[512, 256]', 'dropout': 0.31951869417369594, 'batch_norm': False, 'sage_aggr': 'max', 'sage_normalize': False, 'sage_project': False, 'lr': 2.4523973293700167e-05, 'weight_decay': 2.2527042841277227e-06, 'epochs': 211, 'loss': 'mse', 'optimizer': 'adam', 'graph_mode': 'cutoff', 'cutoff': 0.8813132729339599, 'grm_norm': 'cosine', 'self_loops': False, 'use_snp_selection': True, 'num_snps': 45549}. Best is trial 63 with value: 0.3744651287832118.
[I 2025-12-09 22:32:18,001] Trial 134 finished with value: 0.3584161635618342 and parameters: {'model_type': 'graphsage', 'hidden_dims': '[512, 256]', 'dropout': 0.31136581172413424, 'batch_norm': False, 'sage_aggr': 'max', 'sage_normalize': False, 'sage_project': False, 'lr': 2.0032269309248212e-05, 'weight_decay': 1.0049909314557805e-06, 'epochs': 120, 'loss': 'mse', 'optimizer': 'adam', 'graph_mode': 'cutoff', 'cutoff': 0.7102841073255606, 'grm_norm': 'cosine', 'self_loops': False, 'use_snp_selection': True, 'num_snps': 43654}. Best is trial 63 with value: 0.3744651287832118.
[I 2025-12-09 22:33:20,145] Trial 135 finished with value: 0.3620116005743041 and parameters: {'model_type': 'graphsage', 'hidden_dims': '[512, 256]', 'dropout': 0.32938048692280997, 'batch_norm': False, 'sage_aggr': 'max', 'sage_normalize': False, 'sage_project': False, 'lr': 1.0048092685038448e-05, 'weight_decay': 2.6966518682914834e-07, 'epochs': 83, 'loss': 'mse', 'optimizer': 'adam', 'graph_mode': 'cutoff', 'cutoff': 0.5425633059613308, 'grm_norm': 'none', 'self_loops': False, 'use_snp_selection': True, 'num_snps': 40351}. Best is trial 63 with value: 0.3744651287832118.
[I 2025-12-09 22:34:20,558] Trial 136 finished with value: 0.36681480651286424 and parameters: {'model_type': 'graphsage', 'hidden_dims': '[512, 256]', 'dropout': 0.29481882141732946, 'batch_norm': False, 'sage_aggr': 'max', 'sage_normalize': False, 'sage_project': False, 'lr': 1.3401342931486828e-05, 'weight_decay': 6.5455745761713825e-06, 'epochs': 73, 'loss': 'mse', 'optimizer': 'adam', 'graph_mode': 'cutoff', 'cutoff': 0.5588557713643307, 'grm_norm': 'cosine', 'self_loops': False, 'use_snp_selection': True, 'num_snps': 42037}. Best is trial 63 with value: 0.3744651287832118.
[I 2025-12-09 22:36:09,957] Trial 137 finished with value: 0.3407091095677785 and parameters: {'model_type': 'graphsage', 'hidden_dims': '[512, 256]', 'dropout': 0.3474421538695688, 'batch_norm': False, 'sage_aggr': 'mean', 'sage_normalize': False, 'sage_project': False, 'lr': 1.686204885993793e-05, 'weight_decay': 0.0003541149056383641, 'epochs': 229, 'loss': 'mse', 'optimizer': 'adam', 'graph_mode': 'cutoff', 'cutoff': 0.7369464120182326, 'grm_norm': 'none', 'self_loops': False, 'use_snp_selection': True, 'num_snps': 46709}. Best is trial 63 with value: 0.3744651287832118.
[I 2025-12-09 22:37:05,999] Trial 138 finished with value: 0.3707568315606943 and parameters: {'model_type': 'graphsage', 'hidden_dims': '[256, 128]', 'dropout': 0.41272302726746096, 'batch_norm': False, 'sage_aggr': 'max', 'sage_normalize': False, 'sage_project': False, 'lr': 1.1731737642856656e-05, 'weight_decay': 1.4869872077955849e-05, 'epochs': 98, 'loss': 'mae', 'optimizer': 'adam', 'graph_mode': 'cutoff', 'cutoff': 0.5939373841865702, 'grm_norm': 'cosine', 'self_loops': False, 'use_snp_selection': True, 'num_snps': 44470}. Best is trial 63 with value: 0.3744651287832118.
[I 2025-12-09 22:38:03,436] Trial 139 finished with value: 0.3705377726767805 and parameters: {'model_type': 'graphsage', 'hidden_dims': '[256, 128]', 'dropout': 0.41244168253124697, 'batch_norm': False, 'sage_aggr': 'max', 'sage_normalize': False, 'sage_project': False, 'lr': 2.216451457044727e-05, 'weight_decay': 1.1564322770201527e-07, 'epochs': 99, 'loss': 'mae', 'optimizer': 'adam', 'graph_mode': 'cutoff', 'cutoff': 0.6034565805736503, 'grm_norm': 'cosine', 'self_loops': False, 'use_snp_selection': True, 'num_snps': 44934}. Best is trial 63 with value: 0.3744651287832118.
[I 2025-12-09 22:38:35,746] Trial 140 finished with value: 0.34185654770664675 and parameters: {'model_type': 'graphsage', 'hidden_dims': '[256, 128]', 'dropout': 0.4088467073692124, 'batch_norm': False, 'sage_aggr': 'max', 'sage_normalize': True, 'sage_project': False, 'lr': 2.2057274213386046e-05, 'weight_decay': 1.1261896314499588e-07, 'epochs': 99, 'loss': 'mae', 'optimizer': 'adam', 'graph_mode': 'cutoff', 'cutoff': 0.6311205716988849, 'grm_norm': 'cosine', 'self_loops': False, 'use_snp_selection': False}. Best is trial 63 with value: 0.3744651287832118.
[I 2025-12-09 22:39:30,263] Trial 141 finished with value: 0.3623158354779617 and parameters: {'model_type': 'graphsage', 'hidden_dims': '[256, 128]', 'dropout': 0.4177027002666906, 'batch_norm': False, 'sage_aggr': 'max', 'sage_normalize': False, 'sage_project': False, 'lr': 2.9655121254730286e-05, 'weight_decay': 3.454541342242542e-07, 'epochs': 89, 'loss': 'mae', 'optimizer': 'adam', 'graph_mode': 'cutoff', 'cutoff': 0.5955263630285771, 'grm_norm': 'cosine', 'self_loops': False, 'use_snp_selection': True, 'num_snps': 44816}. Best is trial 63 with value: 0.3744651287832118.
