[I 2025-12-08 22:43:24,007] Trial 34 finished with value: 0.27478015054502236 and parameters: {'model_type': 'graphsage', 'hidden_dims': '[512, 256]', 'dropout': 0.27660847050606124, 'batch_norm': False, 'sage_aggr': 'mean', 'sage_normalize': False, 'sage_project': False, 'lr': 1.0766068369578995e-05, 'weight_decay': 9.759641952804412e-06, 'epochs': 178, 'loss': 'mae', 'optimizer': 'adam', 'graph_mode': 'cutoff', 'cutoff': 0.4180812850989635, 'grm_norm': 'cosine', 'self_loops': False, 'use_snp_selection': False}. Best is trial 33 with value: 0.29760511708967946.
[I 2025-12-08 22:44:58,282] Trial 35 finished with value: 0.26259583875770637 and parameters: {'model_type': 'graphsage', 'hidden_dims': '[512, 256]', 'dropout': 0.31008119863910755, 'batch_norm': True, 'sage_aggr': 'max', 'sage_normalize': False, 'sage_project': False, 'lr': 2.149759681137889e-05, 'weight_decay': 1.9483855627118137e-06, 'epochs': 142, 'loss': 'mse', 'optimizer': 'adam', 'graph_mode': 'cutoff', 'cutoff': 0.517669488512075, 'grm_norm': 'cosine_then_gcn', 'self_loops': True, 'use_snp_selection': False}. Best is trial 33 with value: 0.29760511708967946.
[I 2025-12-08 22:45:43,753] Trial 36 finished with value: 0.2826357897787037 and parameters: {'model_type': 'graphsage', 'hidden_dims': '[512, 256]', 'dropout': 0.2608597935995715, 'batch_norm': False, 'sage_aggr': 'mean', 'sage_normalize': False, 'sage_project': False, 'lr': 1.5231442400252322e-05, 'weight_decay': 4.145293329610709e-06, 'epochs': 155, 'loss': 'mse', 'optimizer': 'adam', 'graph_mode': 'cutoff', 'cutoff': 0.5837878679339452, 'grm_norm': 'cosine_then_gcn', 'self_loops': True, 'use_snp_selection': True, 'num_snps': 14692}. Best is trial 33 with value: 0.29760511708967946.
[I 2025-12-08 22:48:39,564] Trial 37 finished with value: 0.24563781593820572 and parameters: {'model_type': 'graphsage', 'hidden_dims': '[512, 256]', 'dropout': 0.32868894422073125, 'batch_norm': True, 'sage_aggr': 'max', 'sage_normalize': False, 'sage_project': False, 'lr': 4.8211042169073575e-05, 'weight_decay': 1.303514490753377e-06, 'epochs': 186, 'loss': 'mae', 'optimizer': 'adam', 'graph_mode': 'knn', 'knn_k': 5, 'weighted_edges': True, 'symmetrize_mode': 'union', 'self_loops': False, 'use_snp_selection': False}. Best is trial 33 with value: 0.29760511708967946.
[I 2025-12-08 22:51:05,582] Trial 38 finished with value: 0.2899642647835069 and parameters: {'model_type': 'graphsage', 'hidden_dims': '[256, 128, 64]', 'dropout': 0.16994621991883763, 'batch_norm': False, 'sage_aggr': 'mean', 'sage_normalize': False, 'sage_project': False, 'lr': 2.06104906079458e-05, 'weight_decay': 5.231511510818436e-07, 'epochs': 172, 'loss': 'mse', 'optimizer': 'adam', 'graph_mode': 'cutoff', 'cutoff': 0.40804307475684154, 'grm_norm': 'cosine_then_gcn', 'self_loops': True, 'use_snp_selection': True, 'num_snps': 51829}. Best is trial 33 with value: 0.29760511708967946.
[I 2025-12-08 22:54:01,660] Trial 39 finished with value: 0.26417711051756243 and parameters: {'model_type': 'graphsage', 'hidden_dims': '[512, 256]', 'dropout': 0.12301381709222109, 'batch_norm': True, 'sage_aggr': 'mean', 'sage_normalize': False, 'sage_project': False, 'lr': 1.0039342878063907e-05, 'weight_decay': 6.734343918220293e-05, 'epochs': 196, 'loss': 'mae', 'optimizer': 'adam', 'graph_mode': 'knn', 'knn_k': 10, 'weighted_edges': False, 'symmetrize_mode': 'mutual', 'self_loops': False, 'use_snp_selection': False}. Best is trial 33 with value: 0.29760511708967946.
[I 2025-12-08 22:56:11,701] Trial 40 finished with value: 0.22718116529980317 and parameters: {'model_type': 'graphsage', 'hidden_dims': '[512, 64]', 'dropout': 0.29844509193820234, 'batch_norm': False, 'sage_aggr': 'max', 'sage_normalize': False, 'sage_project': False, 'lr': 7.51221615000685e-05, 'weight_decay': 1.537866559259901e-07, 'epochs': 158, 'loss': 'mse', 'optimizer': 'adam', 'graph_mode': 'cutoff', 'cutoff': 0.46480836799658753, 'grm_norm': 'cosine_then_gcn', 'self_loops': True, 'use_snp_selection': True, 'num_snps': 39938}. Best is trial 33 with value: 0.29760511708967946.
[I 2025-12-08 22:58:21,432] Trial 41 finished with value: 0.2888420974640692 and parameters: {'model_type': 'graphsage', 'hidden_dims': '[512, 256]', 'dropout': 0.27129380790231683, 'batch_norm': False, 'sage_aggr': 'mean', 'sage_normalize': False, 'sage_project': False, 'lr': 2.205178292567407e-05, 'weight_decay': 1.0420510464460668e-06, 'epochs': 142, 'loss': 'mse', 'optimizer': 'adam', 'graph_mode': 'cutoff', 'cutoff': 0.2918219979203149, 'grm_norm': 'cosine_then_gcn', 'self_loops': True, 'use_snp_selection': False}. Best is trial 33 with value: 0.29760511708967946.
[I 2025-12-08 23:00:25,021] Trial 42 finished with value: 0.2946997533035597 and parameters: {'model_type': 'graphsage', 'hidden_dims': '[128, 64]', 'dropout': 0.25393137439409735, 'batch_norm': False, 'sage_aggr': 'mean', 'sage_normalize': False, 'sage_project': False, 'lr': 1.4410987323828467e-05, 'weight_decay': 2.904732054673389e-06, 'epochs': 254, 'loss': 'mse', 'optimizer': 'adam', 'graph_mode': 'cutoff', 'cutoff': 0.296988734732359, 'grm_norm': 'cosine_then_gcn', 'self_loops': True, 'use_snp_selection': False}. Best is trial 33 with value: 0.29760511708967946.
[I 2025-12-08 23:01:38,637] Trial 43 finished with value: 0.29598319983634985 and parameters: {'model_type': 'graphsage', 'hidden_dims': '[128, 64]', 'dropout': 0.24823465455243557, 'batch_norm': False, 'sage_aggr': 'mean', 'sage_normalize': False, 'sage_project': False, 'lr': 1.4231953738817283e-05, 'weight_decay': 2.23992185724398e-06, 'epochs': 224, 'loss': 'mse', 'optimizer': 'adam', 'graph_mode': 'cutoff', 'cutoff': 0.3820103056954348, 'grm_norm': 'cosine_then_gcn', 'self_loops': True, 'use_snp_selection': False}. Best is trial 33 with value: 0.29760511708967946.
[I 2025-12-08 23:03:02,572] Trial 44 finished with value: 0.2989826039814593 and parameters: {'model_type': 'graphsage', 'hidden_dims': '[128, 64]', 'dropout': 0.2355969520592823, 'batch_norm': False, 'sage_aggr': 'mean', 'sage_normalize': False, 'sage_project': False, 'lr': 1.391834800816792e-05, 'weight_decay': 2.885093802157822e-06, 'epochs': 255, 'loss': 'mse', 'optimizer': 'adam', 'graph_mode': 'cutoff', 'cutoff': 0.37295562577657193, 'grm_norm': 'cosine_then_gcn', 'self_loops': True, 'use_snp_selection': False}. Best is trial 44 with value: 0.2989826039814593.
[I 2025-12-08 23:04:21,560] Trial 45 finished with value: 0.29561844618159006 and parameters: {'model_type': 'graphsage', 'hidden_dims': '[128, 64]', 'dropout': 0.24261065934504275, 'batch_norm': False, 'sage_aggr': 'mean', 'sage_normalize': False, 'sage_project': False, 'lr': 1.5183153844689487e-05, 'weight_decay': 3.8009477260324566e-06, 'epochs': 264, 'loss': 'mse', 'optimizer': 'adam', 'graph_mode': 'cutoff', 'cutoff': 0.4857612647802374, 'grm_norm': 'gcn', 'self_loops': True, 'use_snp_selection': False}. Best is trial 44 with value: 0.2989826039814593.
[I 2025-12-08 23:05:31,769] Trial 46 finished with value: 0.28484584258307616 and parameters: {'model_type': 'graphsage', 'hidden_dims': '[128, 64]', 'dropout': 0.2008031589451031, 'batch_norm': False, 'sage_aggr': 'mean', 'sage_normalize': False, 'sage_project': False, 'lr': 1.503315144440104e-05, 'weight_decay': 1.34659412606252e-05, 'epochs': 297, 'loss': 'mse', 'optimizer': 'adam', 'graph_mode': 'cutoff', 'cutoff': 0.5388402775648482, 'grm_norm': 'gcn', 'self_loops': True, 'use_snp_selection': False}. Best is trial 44 with value: 0.2989826039814593.
[I 2025-12-08 23:06:34,618] Trial 47 finished with value: 0.2323653984328577 and parameters: {'model_type': 'graphsage', 'hidden_dims': '[128, 64]', 'dropout': 0.1588058212372756, 'batch_norm': True, 'sage_aggr': 'mean', 'sage_normalize': False, 'sage_project': False, 'lr': 1.1388326652327818e-05, 'weight_decay': 5.089338161307725e-06, 'epochs': 223, 'loss': 'mae', 'optimizer': 'adam', 'graph_mode': 'knn', 'knn_k': 2, 'weighted_edges': False, 'symmetrize_mode': 'mutual', 'self_loops': True, 'use_snp_selection': True, 'num_snps': 28841}. Best is trial 44 with value: 0.2989826039814593.
[I 2025-12-08 23:07:59,337] Trial 48 finished with value: 0.2905100520073224 and parameters: {'model_type': 'graphsage', 'hidden_dims': '[128, 64]', 'dropout': 0.2363531003685987, 'batch_norm': False, 'sage_aggr': 'max', 'sage_normalize': False, 'sage_project': False, 'lr': 4.139854426075261e-05, 'weight_decay': 3.2833191883050095e-06, 'epochs': 255, 'loss': 'mse', 'optimizer': 'adam', 'graph_mode': 'cutoff', 'cutoff': 0.47532982246910127, 'grm_norm': 'gcn', 'self_loops': True, 'use_snp_selection': False}. Best is trial 44 with value: 0.2989826039814593.
[I 2025-12-08 23:09:35,893] Trial 49 finished with value: 0.28914062944814567 and parameters: {'model_type': 'graphsage', 'hidden_dims': '[128, 64]', 'dropout': 0.1955682419918732, 'batch_norm': False, 'sage_aggr': 'mean', 'sage_normalize': False, 'sage_project': False, 'lr': 1.8418399352458118e-05, 'weight_decay': 7.2594046233249505e-06, 'epochs': 313, 'loss': 'mse', 'optimizer': 'adam', 'graph_mode': 'knn', 'knn_k': 5, 'weighted_edges': True, 'symmetrize_mode': 'union', 'self_loops': True, 'use_snp_selection': True, 'num_snps': 20492}. Best is trial 44 with value: 0.2989826039814593.
[I 2025-12-08 23:10:31,213] Trial 50 finished with value: 0.28319611948219225 and parameters: {'model_type': 'graphsage', 'hidden_dims': '[128, 64]', 'dropout': 0.14228747824158228, 'batch_norm': False, 'sage_aggr': 'mean', 'sage_normalize': False, 'sage_project': False, 'lr': 5.2398837934078103e-05, 'weight_decay': 0.0008380342762494134, 'epochs': 274, 'loss': 'mse', 'optimizer': 'adam', 'graph_mode': 'cutoff', 'cutoff': 0.6631085484781781, 'grm_norm': 'gcn', 'self_loops': False, 'use_snp_selection': False}. Best is trial 44 with value: 0.2989826039814593.
[I 2025-12-08 23:11:55,527] Trial 51 finished with value: 0.2880714515178452 and parameters: {'model_type': 'graphsage', 'hidden_dims': '[128, 64]', 'dropout': 0.252628159592171, 'batch_norm': False, 'sage_aggr': 'mean', 'sage_normalize': False, 'sage_project': False, 'lr': 1.4424451908976792e-05, 'weight_decay': 2.4851253717190365e-06, 'epochs': 250, 'loss': 'mse', 'optimizer': 'adam', 'graph_mode': 'cutoff', 'cutoff': 0.383703359122231, 'grm_norm': 'none', 'self_loops': True, 'use_snp_selection': False}. Best is trial 44 with value: 0.2989826039814593.
[I 2025-12-08 23:13:17,116] Trial 52 finished with value: 0.2944668727249959 and parameters: {'model_type': 'graphsage', 'hidden_dims': '[128, 64]', 'dropout': 0.24901229270057226, 'batch_norm': False, 'sage_aggr': 'mean', 'sage_normalize': False, 'sage_project': False, 'lr': 1.3478733290776352e-05, 'weight_decay': 2.7336110767998493e-06, 'epochs': 261, 'loss': 'mse', 'optimizer': 'adam', 'graph_mode': 'cutoff', 'cutoff': 0.4647971181800839, 'grm_norm': 'gcn', 'self_loops': True, 'use_snp_selection': False}. Best is trial 44 with value: 0.2989826039814593.
[I 2025-12-08 23:14:10,278] Trial 53 finished with value: 0.2918672406521778 and parameters: {'model_type': 'graphsage', 'hidden_dims': '[128, 64]', 'dropout': 0.28515904073314685, 'batch_norm': False, 'sage_aggr': 'mean', 'sage_normalize': False, 'sage_project': False, 'lr': 1.7438397049770132e-05, 'weight_decay': 3.881614607225398e-06, 'epochs': 235, 'loss': 'mse', 'optimizer': 'adam', 'graph_mode': 'cutoff', 'cutoff': 0.5602436118253251, 'grm_norm': 'none', 'self_loops': True, 'use_snp_selection': False}. Best is trial 44 with value: 0.2989826039814593.
[I 2025-12-08 23:16:30,273] Trial 54 finished with value: 0.29565101632591106 and parameters: {'model_type': 'graphsage', 'hidden_dims': '[128, 64]', 'dropout': 0.23208768411815733, 'batch_norm': False, 'sage_aggr': 'mean', 'sage_normalize': False, 'sage_project': False, 'lr': 1.01621991845821e-05, 'weight_decay': 2.1411506105647322e-06, 'epochs': 289, 'loss': 'mse', 'optimizer': 'adam', 'graph_mode': 'cutoff', 'cutoff': 0.3119922159204325, 'grm_norm': 'gcn', 'self_loops': True, 'use_snp_selection': False}. Best is trial 44 with value: 0.2989826039814593.
[I 2025-12-08 23:17:59,588] Trial 55 finished with value: 0.29091948683800223 and parameters: {'model_type': 'graphsage', 'hidden_dims': '[128, 64]', 'dropout': 0.2221000739003934, 'batch_norm': False, 'sage_aggr': 'mean', 'sage_normalize': False, 'sage_project': False, 'lr': 2.694718767665232e-05, 'weight_decay': 7.052707847388344e-07, 'epochs': 283, 'loss': 'mse', 'optimizer': 'adam', 'graph_mode': 'cutoff', 'cutoff': 0.44060370491309364, 'grm_norm': 'gcn', 'self_loops': True, 'use_snp_selection': False}. Best is trial 44 with value: 0.2989826039814593.
[I 2025-12-08 23:19:54,809] Trial 56 finished with value: 0.295601056036097 and parameters: {'model_type': 'graphsage', 'hidden_dims': '[128, 64]', 'dropout': 0.2044167266247634, 'batch_norm': False, 'sage_aggr': 'max', 'sage_normalize': False, 'sage_project': False, 'lr': 1.1132134789882404e-05, 'weight_decay': 9.334443718634712e-06, 'epochs': 304, 'loss': 'mse', 'optimizer': 'adam', 'graph_mode': 'cutoff', 'cutoff': 0.37246676405562695, 'grm_norm': 'gcn', 'self_loops': True, 'use_snp_selection': False}. Best is trial 44 with value: 0.2989826039814593.
[I 2025-12-08 23:21:40,315] Trial 57 finished with value: 0.2900419698051898 and parameters: {'model_type': 'graphsage', 'hidden_dims': '[128, 64]', 'dropout': 0.18148122003863065, 'batch_norm': False, 'sage_aggr': 'mean', 'sage_normalize': False, 'sage_project': False, 'lr': 1.0607240588673758e-05, 'weight_decay': 9.942957876673778e-06, 'epochs': 304, 'loss': 'mse', 'optimizer': 'adam', 'graph_mode': 'cutoff', 'cutoff': 0.36500517206163857, 'grm_norm': 'gcn', 'self_loops': True, 'use_snp_selection': False}. Best is trial 44 with value: 0.2989826039814593.
[I 2025-12-08 23:24:15,046] Trial 58 finished with value: 0.29213487555413026 and parameters: {'model_type': 'graphsage', 'hidden_dims': '[128, 64]', 'dropout': 0.2137610667296267, 'batch_norm': False, 'sage_aggr': 'max', 'sage_normalize': False, 'sage_project': False, 'lr': 2.4021388627249074e-05, 'weight_decay': 1.7501847010373905e-05, 'epochs': 319, 'loss': 'mse', 'optimizer': 'adam', 'graph_mode': 'cutoff', 'cutoff': 0.3326739891725378, 'grm_norm': 'gcn', 'self_loops': True, 'use_snp_selection': False}. Best is trial 44 with value: 0.2989826039814593.
[I 2025-12-08 23:25:51,775] Trial 59 finished with value: 0.29151026477713676 and parameters: {'model_type': 'graphsage', 'hidden_dims': '[128, 64]', 'dropout': 0.23474296348887175, 'batch_norm': False, 'sage_aggr': 'mean', 'sage_normalize': False, 'sage_project': False, 'lr': 3.683602520034391e-05, 'weight_decay': 7.093385849128464e-06, 'epochs': 290, 'loss': 'mse', 'optimizer': 'adam', 'graph_mode': 'cutoff', 'cutoff': 0.3859460105287613, 'grm_norm': 'gcn', 'self_loops': True, 'use_snp_selection': False}. Best is trial 44 with value: 0.2989826039814593.
[I 2025-12-08 23:29:16,795] Trial 60 finished with value: 0.29407440949431873 and parameters: {'model_type': 'graphsage', 'hidden_dims': '[256, 128]', 'dropout': 0.3143539012236536, 'batch_norm': False, 'sage_aggr': 'mean', 'sage_normalize': False, 'sage_project': False, 'lr': 1.8105395257753472e-05, 'weight_decay': 1.451437257190264e-06, 'epochs': 270, 'loss': 'mse', 'optimizer': 'adam', 'graph_mode': 'cutoff', 'cutoff': 0.26311158421837155, 'grm_norm': 'gcn', 'self_loops': True, 'use_snp_selection': False}. Best is trial 44 with value: 0.2989826039814593.
[I 2025-12-08 23:30:20,094] Trial 61 finished with value: 0.29110235698293446 and parameters: {'model_type': 'graphsage', 'hidden_dims': '[128, 64]', 'dropout': 0.2668162874586968, 'batch_norm': False, 'sage_aggr': 'max', 'sage_normalize': False, 'sage_project': False, 'lr': 1.2585478583922294e-05, 'weight_decay': 3.3770073883659326e-05, 'epochs': 227, 'loss': 'mse', 'optimizer': 'adam', 'graph_mode': 'cutoff', 'cutoff': 0.5008885273059995, 'grm_norm': 'cosine', 'self_loops': True, 'use_snp_selection': False}. Best is trial 44 with value: 0.2989826039814593.
[I 2025-12-08 23:32:00,263] Trial 62 finished with value: 0.2929514606027955 and parameters: {'model_type': 'graphsage', 'hidden_dims': '[256, 128, 64]', 'dropout': 0.1999596331684604, 'batch_norm': False, 'sage_aggr': 'max', 'sage_normalize': False, 'sage_project': False, 'lr': 1.2177706230321401e-05, 'weight_decay': 0.0001444000101109206, 'epochs': 210, 'loss': 'mse', 'optimizer': 'adam', 'graph_mode': 'cutoff', 'cutoff': 0.44098697591273284, 'grm_norm': 'gcn', 'self_loops': True, 'use_snp_selection': False}. Best is trial 44 with value: 0.2989826039814593.
[I 2025-12-08 23:37:35,186] Trial 63 finished with value: 0.2972657327685873 and parameters: {'model_type': 'graphsage', 'hidden_dims': '[512, 64]', 'dropout': 0.23562464467424882, 'batch_norm': False, 'sage_aggr': 'max', 'sage_normalize': False, 'sage_project': False, 'lr': 1.6488532891210534e-05, 'weight_decay': 5.4903866270773475e-06, 'epochs': 278, 'loss': 'mse', 'optimizer': 'adam', 'graph_mode': 'knn', 'knn_k': 7, 'weighted_edges': False, 'symmetrize_mode': 'mutual', 'self_loops': True, 'use_snp_selection': True, 'num_snps': 52412}. Best is trial 44 with value: 0.2989826039814593.
[I 2025-12-08 23:42:40,999] Trial 64 finished with value: 0.29215447067229516 and parameters: {'model_type': 'graphsage', 'hidden_dims': '[512, 64]', 'dropout': 0.21579452188265424, 'batch_norm': False, 'sage_aggr': 'max', 'sage_normalize': False, 'sage_project': False, 'lr': 1.8163879121713786e-05, 'weight_decay': 4.841994108603144e-06, 'epochs': 244, 'loss': 'mse', 'optimizer': 'adam', 'graph_mode': 'knn', 'knn_k': 8, 'weighted_edges': True, 'symmetrize_mode': 'union', 'self_loops': True, 'use_snp_selection': True, 'num_snps': 34847}. Best is trial 44 with value: 0.2989826039814593.
[I 2025-12-08 23:46:57,959] Trial 65 finished with value: 0.29729775468856323 and parameters: {'model_type': 'graphsage', 'hidden_dims': '[512, 64]', 'dropout': 0.237084436038095, 'batch_norm': False, 'sage_aggr': 'max', 'sage_normalize': False, 'sage_project': False, 'lr': 1.0191400654322954e-05, 'weight_decay': 2.253991956779172e-06, 'epochs': 283, 'loss': 'mse', 'optimizer': 'adam', 'graph_mode': 'cutoff', 'cutoff': 0.31898030229960467, 'grm_norm': 'gcn', 'self_loops': True, 'use_snp_selection': False}. Best is trial 44 with value: 0.2989826039814593.
[I 2025-12-08 23:52:19,185] Trial 66 finished with value: 0.23738869520447126 and parameters: {'model_type': 'graphsage', 'hidden_dims': '[512, 64]', 'dropout': 0.23688833829283487, 'batch_norm': False, 'sage_aggr': 'max', 'sage_normalize': False, 'sage_project': False, 'lr': 3.173737475054807e-05, 'weight_decay': 2.09379178675434e-06, 'epochs': 268, 'loss': 'mse', 'optimizer': 'adam', 'graph_mode': 'cutoff', 'cutoff': 0.24449853630557117, 'grm_norm': 'gcn', 'self_loops': True, 'use_snp_selection': False}. Best is trial 44 with value: 0.2989826039814593.
[I 2025-12-08 23:55:51,429] Trial 67 finished with value: 0.2925753018185053 and parameters: {'model_type': 'graphsage', 'hidden_dims': '[512, 64]', 'dropout': 0.29072708351399545, 'batch_norm': False, 'sage_aggr': 'mean', 'sage_normalize': False, 'sage_project': False, 'lr': 1.5658884025949986e-05, 'weight_decay': 1.112867528218971e-06, 'epochs': 281, 'loss': 'mse', 'optimizer': 'adam', 'graph_mode': 'knn', 'knn_k': 7, 'weighted_edges': False, 'symmetrize_mode': 'mutual', 'self_loops': True, 'use_snp_selection': False}. Best is trial 44 with value: 0.2989826039814593.
[I 2025-12-08 23:59:50,309] Trial 68 finished with value: 0.22436277057997014 and parameters: {'model_type': 'graphsage', 'hidden_dims': '[512, 64]', 'dropout': 0.1744863812473231, 'batch_norm': True, 'sage_aggr': 'max', 'sage_normalize': True, 'sage_project': False, 'lr': 2.4187623627095972e-05, 'weight_decay': 3.4871114320635012e-06, 'epochs': 261, 'loss': 'mae', 'optimizer': 'adam', 'graph_mode': 'cutoff', 'cutoff': 0.3258140210862037, 'grm_norm': 'cosine', 'self_loops': True, 'use_snp_selection': True, 'num_snps': 41002}. Best is trial 44 with value: 0.2989826039814593.
[I 2025-12-09 00:02:40,563] Trial 69 finished with value: 0.2833113863311028 and parameters: {'model_type': 'graphsage', 'hidden_dims': '[512, 64]', 'dropout': 0.3212957817346893, 'batch_norm': False, 'sage_aggr': 'mean', 'sage_normalize': False, 'sage_project': False, 'lr': 1.293033798288468e-05, 'weight_decay': 8.660181108487744e-07, 'epochs': 290, 'loss': 'mse', 'optimizer': 'adam', 'graph_mode': 'cutoff', 'cutoff': 0.6321440620353964, 'grm_norm': 'none', 'self_loops': False, 'use_snp_selection': False}. Best is trial 44 with value: 0.2989826039814593.
[I 2025-12-09 00:07:13,475] Trial 70 finished with value: 0.2947260403131519 and parameters: {'model_type': 'graphsage', 'hidden_dims': '[512, 64]', 'dropout': 0.2687370667557837, 'batch_norm': False, 'sage_aggr': 'mean', 'sage_normalize': False, 'sage_project': False, 'lr': 2.0469135013302296e-05, 'weight_decay': 1.8235263827207037e-06, 'epochs': 241, 'loss': 'mse', 'optimizer': 'adam', 'graph_mode': 'cutoff', 'cutoff': 0.22935561608210445, 'grm_norm': 'cosine_then_gcn', 'self_loops': True, 'use_snp_selection': False}. Best is trial 44 with value: 0.2989826039814593.
[I 2025-12-09 00:09:23,474] Trial 71 finished with value: 0.29528993114947666 and parameters: {'model_type': 'graphsage', 'hidden_dims': '[128, 64]', 'dropout': 0.22436161296128718, 'batch_norm': False, 'sage_aggr': 'max', 'sage_normalize': False, 'sage_project': False, 'lr': 1.007753145915284e-05, 'weight_decay': 5.3513887242316765e-06, 'epochs': 333, 'loss': 'mse', 'optimizer': 'adam', 'graph_mode': 'cutoff', 'cutoff': 0.35816653162917883, 'grm_norm': 'gcn', 'self_loops': True, 'use_snp_selection': False}. Best is trial 44 with value: 0.2989826039814593.
