[I 2025-12-09 17:19:00,263] Trial 82 finished with value: 0.3138955408036637 and parameters: {'model_type': 'graphsage', 'hidden_dims': '[256, 128]', 'dropout': 0.419196645680237, 'batch_norm': True, 'sage_aggr': 'mean', 'sage_normalize': False, 'sage_project': False, 'lr': 0.008286858369651161, 'weight_decay': 4.768476884595086e-07, 'epochs': 86, 'loss': 'mse', 'optimizer': 'adam', 'graph_mode': 'cutoff', 'cutoff': 0.6148317101448622, 'grm_norm': 'cosine', 'self_loops': True, 'use_snp_selection': False}. Best is trial 62 with value: 0.32429274467006397.
[I 2025-12-09 17:19:23,194] Trial 83 finished with value: 0.311186179371433 and parameters: {'model_type': 'graphsage', 'hidden_dims': '[256, 128]', 'dropout': 0.37209799667193144, 'batch_norm': True, 'sage_aggr': 'mean', 'sage_normalize': False, 'sage_project': False, 'lr': 0.0030408683886608266, 'weight_decay': 6.502200782765568e-07, 'epochs': 72, 'loss': 'mse', 'optimizer': 'adam', 'graph_mode': 'cutoff', 'cutoff': 0.6636626415735783, 'grm_norm': 'cosine', 'self_loops': True, 'use_snp_selection': False}. Best is trial 62 with value: 0.32429274467006397.
[I 2025-12-09 17:19:42,316] Trial 84 finished with value: 0.31922265398111954 and parameters: {'model_type': 'graphsage', 'hidden_dims': '[256, 128]', 'dropout': 0.4399733742173368, 'batch_norm': True, 'sage_aggr': 'mean', 'sage_normalize': False, 'sage_project': False, 'lr': 0.005593710171023914, 'weight_decay': 3.026216283305572e-07, 'epochs': 58, 'loss': 'mse', 'optimizer': 'adam', 'graph_mode': 'cutoff', 'cutoff': 0.6453664271419396, 'grm_norm': 'cosine', 'self_loops': True, 'use_snp_selection': False}. Best is trial 62 with value: 0.32429274467006397.
[I 2025-12-09 17:20:02,836] Trial 85 finished with value: 0.3183500983388631 and parameters: {'model_type': 'graphsage', 'hidden_dims': '[256, 128]', 'dropout': 0.46150947748338167, 'batch_norm': True, 'sage_aggr': 'mean', 'sage_normalize': False, 'sage_project': False, 'lr': 0.009407803852979771, 'weight_decay': 3.3950156075820326e-07, 'epochs': 63, 'loss': 'mse', 'optimizer': 'adam', 'graph_mode': 'cutoff', 'cutoff': 0.6415647938422228, 'grm_norm': 'cosine', 'self_loops': True, 'use_snp_selection': False}. Best is trial 62 with value: 0.32429274467006397.
[I 2025-12-09 17:20:23,632] Trial 86 finished with value: 0.3123803782151557 and parameters: {'model_type': 'graphsage', 'hidden_dims': '[256, 128]', 'dropout': 0.46085150839339994, 'batch_norm': True, 'sage_aggr': 'mean', 'sage_normalize': False, 'sage_project': False, 'lr': 0.008706847386507819, 'weight_decay': 1.0608045987120726e-07, 'epochs': 64, 'loss': 'mse', 'optimizer': 'adam', 'graph_mode': 'cutoff', 'cutoff': 0.6416298225036253, 'grm_norm': 'cosine', 'self_loops': True, 'use_snp_selection': False}. Best is trial 62 with value: 0.32429274467006397.
[I 2025-12-09 17:21:11,489] Trial 87 finished with value: 0.2889668154249132 and parameters: {'model_type': 'graphsage', 'hidden_dims': '[512, 256]', 'dropout': 0.43910287523620756, 'batch_norm': False, 'sage_aggr': 'mean', 'sage_normalize': True, 'sage_project': False, 'lr': 0.009920048952431471, 'weight_decay': 3.0740230521669115e-07, 'epochs': 83, 'loss': 'mse', 'optimizer': 'adam', 'graph_mode': 'cutoff', 'cutoff': 0.5813532669585594, 'grm_norm': 'cosine', 'self_loops': True, 'use_snp_selection': False}. Best is trial 62 with value: 0.32429274467006397.
[I 2025-12-09 17:22:06,738] Trial 88 finished with value: 0.29245048853480216 and parameters: {'model_type': 'graphsage', 'hidden_dims': '[512, 128]', 'dropout': 0.41931071314746027, 'batch_norm': True, 'sage_aggr': 'mean', 'sage_normalize': False, 'sage_project': False, 'lr': 0.004230815098008238, 'weight_decay': 1.6565210530012658e-07, 'epochs': 95, 'loss': 'mse', 'optimizer': 'adam', 'graph_mode': 'cutoff', 'cutoff': 0.5330741090485935, 'grm_norm': 'cosine', 'self_loops': True, 'use_snp_selection': False}. Best is trial 62 with value: 0.32429274467006397.
[I 2025-12-09 17:22:39,375] Trial 89 finished with value: 0.31390970254591644 and parameters: {'model_type': 'graphsage', 'hidden_dims': '[256, 128]', 'dropout': 0.28063604221106475, 'batch_norm': True, 'sage_aggr': 'mean', 'sage_normalize': False, 'sage_project': False, 'lr': 0.002825816922574639, 'weight_decay': 4.786845542643723e-07, 'epochs': 107, 'loss': 'mse', 'optimizer': 'adam', 'graph_mode': 'cutoff', 'cutoff': 0.6862414481184976, 'grm_norm': 'cosine', 'self_loops': True, 'use_snp_selection': False}. Best is trial 62 with value: 0.32429274467006397.
[I 2025-12-09 17:22:52,468] Trial 90 finished with value: 0.3143648760677345 and parameters: {'model_type': 'graphsage', 'hidden_dims': '[128, 64]', 'dropout': 0.4612722104614696, 'batch_norm': True, 'sage_aggr': 'mean', 'sage_normalize': False, 'sage_project': False, 'lr': 0.007621980692793039, 'weight_decay': 3.0589024994579413e-07, 'epochs': 63, 'loss': 'mse', 'optimizer': 'adam', 'graph_mode': 'cutoff', 'cutoff': 0.7483294199423385, 'grm_norm': 'cosine', 'self_loops': True, 'use_snp_selection': False}. Best is trial 62 with value: 0.32429274467006397.
[I 2025-12-09 17:23:06,953] Trial 91 finished with value: 0.3116742092179044 and parameters: {'model_type': 'graphsage', 'hidden_dims': '[256, 128]', 'dropout': 0.3997492758658149, 'batch_norm': True, 'sage_aggr': 'mean', 'sage_normalize': False, 'sage_project': False, 'lr': 0.00506185664341525, 'weight_decay': 7.061529675249226e-07, 'epochs': 41, 'loss': 'mse', 'optimizer': 'adam', 'graph_mode': 'cutoff', 'cutoff': 0.6230345759122142, 'grm_norm': 'cosine', 'self_loops': True, 'use_snp_selection': False}. Best is trial 62 with value: 0.32429274467006397.
[I 2025-12-09 17:23:25,433] Trial 92 finished with value: 0.31275743506211484 and parameters: {'model_type': 'graphsage', 'hidden_dims': '[256, 128]', 'dropout': 0.422555403477579, 'batch_norm': True, 'sage_aggr': 'mean', 'sage_normalize': False, 'sage_project': False, 'lr': 0.006534318753726016, 'weight_decay': 9.708259801684953e-07, 'epochs': 55, 'loss': 'mse', 'optimizer': 'adam', 'graph_mode': 'cutoff', 'cutoff': 0.6024831944193438, 'grm_norm': 'cosine', 'self_loops': True, 'use_snp_selection': False}. Best is trial 62 with value: 0.32429274467006397.
[I 2025-12-09 17:24:56,057] Trial 93 finished with value: 0.3128439387978045 and parameters: {'model_type': 'graphsage', 'hidden_dims': '[256, 128]', 'dropout': 0.4426486876334268, 'batch_norm': True, 'sage_aggr': 'mean', 'sage_normalize': False, 'sage_project': False, 'lr': 0.007173012798058826, 'weight_decay': 3.802026321525639e-07, 'epochs': 316, 'loss': 'mse', 'optimizer': 'adam', 'graph_mode': 'cutoff', 'cutoff': 0.6517042488983927, 'grm_norm': 'cosine', 'self_loops': True, 'use_snp_selection': False}. Best is trial 62 with value: 0.32429274467006397.
[I 2025-12-09 17:25:18,992] Trial 94 finished with value: 0.3186893440396062 and parameters: {'model_type': 'graphsage', 'hidden_dims': '[256, 128]', 'dropout': 0.36659756291128537, 'batch_norm': True, 'sage_aggr': 'mean', 'sage_normalize': False, 'sage_project': False, 'lr': 0.005817375926360324, 'weight_decay': 2.8082348754616186e-07, 'epochs': 72, 'loss': 'mse', 'optimizer': 'adam', 'graph_mode': 'cutoff', 'cutoff': 0.7281471865396493, 'grm_norm': 'cosine', 'self_loops': True, 'use_snp_selection': False}. Best is trial 62 with value: 0.32429274467006397.
[I 2025-12-09 17:25:43,297] Trial 95 finished with value: 0.3137619795672456 and parameters: {'model_type': 'graphsage', 'hidden_dims': '[256, 128]', 'dropout': 0.3657981983090553, 'batch_norm': True, 'sage_aggr': 'mean', 'sage_normalize': False, 'sage_project': False, 'lr': 0.003931725889623706, 'weight_decay': 1.725595609636651e-07, 'epochs': 77, 'loss': 'mse', 'optimizer': 'adam', 'graph_mode': 'cutoff', 'cutoff': 0.7236089295144367, 'grm_norm': 'cosine', 'self_loops': True, 'use_snp_selection': False}. Best is trial 62 with value: 0.32429274467006397.
[I 2025-12-09 17:26:06,797] Trial 96 finished with value: 0.3111017032375876 and parameters: {'model_type': 'graphsage', 'hidden_dims': '[256, 128]', 'dropout': 0.33573730425963627, 'batch_norm': True, 'sage_aggr': 'mean', 'sage_normalize': False, 'sage_project': False, 'lr': 0.005231044034578635, 'weight_decay': 1.4417288733041995e-07, 'epochs': 74, 'loss': 'mse', 'optimizer': 'adam', 'graph_mode': 'cutoff', 'cutoff': 0.6993906073118864, 'grm_norm': 'cosine', 'self_loops': True, 'use_snp_selection': False}. Best is trial 62 with value: 0.32429274467006397.
[I 2025-12-09 17:26:50,792] Trial 97 finished with value: 0.29440599598054973 and parameters: {'model_type': 'graphsage', 'hidden_dims': '[256, 128, 64]', 'dropout': 0.47315050907243483, 'batch_norm': True, 'sage_aggr': 'mean', 'sage_normalize': False, 'sage_project': False, 'lr': 0.008215933178382066, 'weight_decay': 2.7956939943004995e-07, 'epochs': 69, 'loss': 'mse', 'optimizer': 'adam', 'graph_mode': 'knn', 'knn_k': 5, 'weighted_edges': True, 'symmetrize_mode': 'union', 'self_loops': True, 'use_snp_selection': False}. Best is trial 62 with value: 0.32429274467006397.
[I 2025-12-09 17:27:10,528] Trial 98 finished with value: 0.31207736510306583 and parameters: {'model_type': 'graphsage', 'hidden_dims': '[256, 128]', 'dropout': 0.3812899768847463, 'batch_norm': True, 'sage_aggr': 'mean', 'sage_normalize': False, 'sage_project': False, 'lr': 0.004597962643714762, 'weight_decay': 2.586523694762118e-07, 'epochs': 61, 'loss': 'mse', 'optimizer': 'adam', 'graph_mode': 'cutoff', 'cutoff': 0.7589182043851882, 'grm_norm': 'none', 'self_loops': True, 'use_snp_selection': False}. Best is trial 62 with value: 0.32429274467006397.
[I 2025-12-09 17:27:57,717] Trial 99 finished with value: 0.3182584907715315 and parameters: {'model_type': 'graphsage', 'hidden_dims': '[512, 256]', 'dropout': 0.4100249769240703, 'batch_norm': True, 'sage_aggr': 'mean', 'sage_normalize': False, 'sage_project': False, 'lr': 0.005933572159529514, 'weight_decay': 5.14571756044938e-07, 'epochs': 83, 'loss': 'mse', 'optimizer': 'adam', 'graph_mode': 'cutoff', 'cutoff': 0.6773710975750858, 'grm_norm': 'cosine', 'self_loops': True, 'use_snp_selection': False}. Best is trial 62 with value: 0.32429274467006397.
[I 2025-12-09 17:28:55,827] Trial 100 finished with value: 0.2823539921264174 and parameters: {'model_type': 'graphsage', 'hidden_dims': '[512, 256]', 'dropout': 0.4102235981599419, 'batch_norm': False, 'sage_aggr': 'mean', 'sage_normalize': True, 'sage_project': False, 'lr': 0.009120451032159497, 'weight_decay': 2.1970929959336656e-07, 'epochs': 104, 'loss': 'mse', 'optimizer': 'adam', 'graph_mode': 'cutoff', 'cutoff': 0.6822704738100054, 'grm_norm': 'cosine', 'self_loops': True, 'use_snp_selection': False}. Best is trial 62 with value: 0.32429274467006397.
[I 2025-12-09 17:29:59,906] Trial 101 finished with value: 0.3176066870455762 and parameters: {'model_type': 'graphsage', 'hidden_dims': '[512, 256]', 'dropout': 0.4560134535546805, 'batch_norm': True, 'sage_aggr': 'mean', 'sage_normalize': False, 'sage_project': False, 'lr': 0.005699370077257967, 'weight_decay': 5.145305665448796e-07, 'epochs': 116, 'loss': 'mse', 'optimizer': 'adam', 'graph_mode': 'cutoff', 'cutoff': 0.7189617874982636, 'grm_norm': 'cosine', 'self_loops': True, 'use_snp_selection': False}. Best is trial 62 with value: 0.32429274467006397.
[I 2025-12-09 17:30:56,286] Trial 102 finished with value: 0.3172202863728818 and parameters: {'model_type': 'graphsage', 'hidden_dims': '[512, 256]', 'dropout': 0.42599147585551095, 'batch_norm': True, 'sage_aggr': 'mean', 'sage_normalize': False, 'sage_project': False, 'lr': 0.006996992909640706, 'weight_decay': 3.8636658585407236e-07, 'epochs': 92, 'loss': 'mse', 'optimizer': 'adam', 'graph_mode': 'cutoff', 'cutoff': 0.63461509549511, 'grm_norm': 'cosine', 'self_loops': True, 'use_snp_selection': False}. Best is trial 62 with value: 0.32429274467006397.
[I 2025-12-09 17:31:43,047] Trial 103 finished with value: 0.31647145537833465 and parameters: {'model_type': 'graphsage', 'hidden_dims': '[512, 256]', 'dropout': 0.13059816611737074, 'batch_norm': True, 'sage_aggr': 'mean', 'sage_normalize': False, 'sage_project': False, 'lr': 0.0047302051416311325, 'weight_decay': 7.9727963219112e-07, 'epochs': 82, 'loss': 'mse', 'optimizer': 'adam', 'graph_mode': 'cutoff', 'cutoff': 0.7401805119017975, 'grm_norm': 'cosine', 'self_loops': True, 'use_snp_selection': False}. Best is trial 62 with value: 0.32429274467006397.
[I 2025-12-09 17:32:05,431] Trial 104 finished with value: 0.31273397837239425 and parameters: {'model_type': 'graphsage', 'hidden_dims': '[256, 128]', 'dropout': 0.4392839085284049, 'batch_norm': True, 'sage_aggr': 'mean', 'sage_normalize': False, 'sage_project': False, 'lr': 0.003488156278731635, 'weight_decay': 1.7539328790779755e-06, 'epochs': 70, 'loss': 'mse', 'optimizer': 'adam', 'graph_mode': 'cutoff', 'cutoff': 0.6717492778278975, 'grm_norm': 'cosine', 'self_loops': True, 'use_snp_selection': False}. Best is trial 62 with value: 0.32429274467006397.
[I 2025-12-09 17:32:24,592] Trial 105 finished with value: 0.3133006538334648 and parameters: {'model_type': 'graphsage', 'hidden_dims': '[256, 128, 64]', 'dropout': 0.40591602909798524, 'batch_norm': True, 'sage_aggr': 'mean', 'sage_normalize': False, 'sage_project': False, 'lr': 0.006039354414927438, 'weight_decay': 4.1965264327860383e-07, 'epochs': 58, 'loss': 'mse', 'optimizer': 'adam', 'graph_mode': 'cutoff', 'cutoff': 0.6931253628502971, 'grm_norm': 'cosine', 'self_loops': True, 'use_snp_selection': False}. Best is trial 62 with value: 0.32429274467006397.
[I 2025-12-09 17:33:10,175] Trial 106 finished with value: 0.3049477921207227 and parameters: {'model_type': 'graphsage', 'hidden_dims': '[512, 128]', 'dropout': 0.3848798263968985, 'batch_norm': True, 'sage_aggr': 'mean', 'sage_normalize': False, 'sage_project': False, 'lr': 3.815765648593973e-05, 'weight_decay': 2.4981682212301193e-06, 'epochs': 80, 'loss': 'mse', 'optimizer': 'adam', 'graph_mode': 'cutoff', 'cutoff': 0.6542861599403029, 'grm_norm': 'cosine', 'self_loops': True, 'use_snp_selection': False}. Best is trial 62 with value: 0.32429274467006397.
[I 2025-12-09 17:33:37,512] Trial 107 finished with value: 0.314295717998598 and parameters: {'model_type': 'graphsage', 'hidden_dims': '[256, 128]', 'dropout': 0.4686906895042552, 'batch_norm': True, 'sage_aggr': 'mean', 'sage_normalize': False, 'sage_project': False, 'lr': 0.007730050309003299, 'weight_decay': 1.9978929056598965e-07, 'epochs': 88, 'loss': 'mse', 'optimizer': 'adam', 'graph_mode': 'cutoff', 'cutoff': 0.7220862701944794, 'grm_norm': 'cosine', 'self_loops': True, 'use_snp_selection': False}. Best is trial 62 with value: 0.32429274467006397.
[I 2025-12-09 17:33:51,637] Trial 108 finished with value: 0.3127073696215932 and parameters: {'model_type': 'graphsage', 'hidden_dims': '[256, 128]', 'dropout': 0.5083422628942902, 'batch_norm': True, 'sage_aggr': 'mean', 'sage_normalize': False, 'sage_project': False, 'lr': 0.002815323135523824, 'weight_decay': 1.1730404151906085e-06, 'epochs': 40, 'loss': 'mse', 'optimizer': 'adam', 'graph_mode': 'cutoff', 'cutoff': 0.6320339521454849, 'grm_norm': 'cosine', 'self_loops': True, 'use_snp_selection': False}. Best is trial 62 with value: 0.32429274467006397.
[I 2025-12-09 17:34:45,485] Trial 109 finished with value: 0.3190458324550398 and parameters: {'model_type': 'graphsage', 'hidden_dims': '[512, 256]', 'dropout': 0.36552211955929703, 'batch_norm': True, 'sage_aggr': 'mean', 'sage_normalize': False, 'sage_project': False, 'lr': 0.008973152893430087, 'weight_decay': 6.58872070186508e-07, 'epochs': 96, 'loss': 'mse', 'optimizer': 'adam', 'graph_mode': 'cutoff', 'cutoff': 0.7098474105699543, 'grm_norm': 'cosine_then_gcn', 'self_loops': True, 'use_snp_selection': False}. Best is trial 62 with value: 0.32429274467006397.
[I 2025-12-09 17:35:23,418] Trial 110 finished with value: 0.3110068421044093 and parameters: {'model_type': 'graphsage', 'hidden_dims': '[512, 256]', 'dropout': 0.35824518398519145, 'batch_norm': True, 'sage_aggr': 'mean', 'sage_normalize': False, 'sage_project': False, 'lr': 0.00910530565273695, 'weight_decay': 6.627981262826851e-07, 'epochs': 65, 'loss': 'mse', 'optimizer': 'adam', 'graph_mode': 'cutoff', 'cutoff': 0.7119126888569841, 'grm_norm': 'cosine_then_gcn', 'self_loops': True, 'use_snp_selection': False}. Best is trial 62 with value: 0.32429274467006397.
[I 2025-12-09 17:36:18,301] Trial 111 finished with value: 0.32037660869787726 and parameters: {'model_type': 'graphsage', 'hidden_dims': '[512, 256]', 'dropout': 0.3765048573406211, 'batch_norm': True, 'sage_aggr': 'mean', 'sage_normalize': False, 'sage_project': False, 'lr': 0.009865881749591554, 'weight_decay': 5.686662069487801e-07, 'epochs': 98, 'loss': 'mse', 'optimizer': 'adam', 'graph_mode': 'cutoff', 'cutoff': 0.680574166576265, 'grm_norm': 'cosine_then_gcn', 'self_loops': True, 'use_snp_selection': False}. Best is trial 62 with value: 0.32429274467006397.
[I 2025-12-09 17:37:12,630] Trial 112 finished with value: 0.3127076572050541 and parameters: {'model_type': 'graphsage', 'hidden_dims': '[512, 256]', 'dropout': 0.37596497547273994, 'batch_norm': True, 'sage_aggr': 'mean', 'sage_normalize': False, 'sage_project': False, 'lr': 0.008612773333639115, 'weight_decay': 1.0117814235832513e-06, 'epochs': 97, 'loss': 'mse', 'optimizer': 'adam', 'graph_mode': 'cutoff', 'cutoff': 0.6768312945058965, 'grm_norm': 'cosine_then_gcn', 'self_loops': True, 'use_snp_selection': False}. Best is trial 62 with value: 0.32429274467006397.
[I 2025-12-09 17:37:51,154] Trial 113 finished with value: 0.28787821564697946 and parameters: {'model_type': 'graphsage', 'hidden_dims': '[512, 256]', 'dropout': 0.33502403876364684, 'batch_norm': True, 'sage_aggr': 'mean', 'sage_normalize': False, 'sage_project': False, 'lr': 0.006161214561694204, 'weight_decay': 5.21072482371781e-07, 'epochs': 54, 'loss': 'mse', 'optimizer': 'adam', 'graph_mode': 'cutoff', 'cutoff': 0.40440883895643226, 'grm_norm': 'cosine_then_gcn', 'self_loops': True, 'use_snp_selection': False}. Best is trial 62 with value: 0.32429274467006397.
[I 2025-12-09 17:38:53,668] Trial 114 finished with value: 0.3181546547659801 and parameters: {'model_type': 'graphsage', 'hidden_dims': '[512, 256]', 'dropout': 0.363138990319626, 'batch_norm': True, 'sage_aggr': 'mean', 'sage_normalize': False, 'sage_project': False, 'lr': 0.009964196658470002, 'weight_decay': 8.37575049060098e-07, 'epochs': 113, 'loss': 'mse', 'optimizer': 'adam', 'graph_mode': 'cutoff', 'cutoff': 0.7487475133589196, 'grm_norm': 'cosine_then_gcn', 'self_loops': True, 'use_snp_selection': False}. Best is trial 62 with value: 0.32429274467006397.
[I 2025-12-09 17:40:01,846] Trial 115 finished with value: 0.3156029185532582 and parameters: {'model_type': 'graphsage', 'hidden_dims': '[512, 256]', 'dropout': 0.39936228362103926, 'batch_norm': True, 'sage_aggr': 'mean', 'sage_normalize': False, 'sage_project': False, 'lr': 0.005033615296749779, 'weight_decay': 5.628862505358844e-07, 'epochs': 124, 'loss': 'mse', 'optimizer': 'adam', 'graph_mode': 'cutoff', 'cutoff': 0.6989504022236537, 'grm_norm': 'cosine_then_gcn', 'self_loops': True, 'use_snp_selection': False}. Best is trial 62 with value: 0.32429274467006397.
[I 2025-12-09 17:40:45,102] Trial 116 finished with value: 0.2627133074828204 and parameters: {'model_type': 'graphsage', 'hidden_dims': '[512, 256]', 'dropout': 0.41429265840538176, 'batch_norm': True, 'sage_aggr': 'mean', 'sage_normalize': False, 'sage_project': False, 'lr': 1.3374281736697761e-05, 'weight_decay': 4.330094956743804e-07, 'epochs': 73, 'loss': 'mse', 'optimizer': 'adam', 'graph_mode': 'knn', 'knn_k': 1, 'weighted_edges': False, 'symmetrize_mode': 'mutual', 'self_loops': True, 'use_snp_selection': False}. Best is trial 62 with value: 0.32429274467006397.
[I 2025-12-09 17:41:12,712] Trial 117 finished with value: 0.3122927962685934 and parameters: {'model_type': 'graphsage', 'hidden_dims': '[512, 256]', 'dropout': 0.38951120024542163, 'batch_norm': True, 'sage_aggr': 'mean', 'sage_normalize': False, 'sage_project': False, 'lr': 0.006631283259757683, 'weight_decay': 2.849083965517576e-07, 'epochs': 45, 'loss': 'mse', 'optimizer': 'adam', 'graph_mode': 'cutoff', 'cutoff': 0.7288613003352389, 'grm_norm': 'cosine_then_gcn', 'self_loops': True, 'use_snp_selection': False}. Best is trial 62 with value: 0.32429274467006397.
[I 2025-12-09 17:41:37,667] Trial 118 finished with value: 0.29460580037376877 and parameters: {'model_type': 'graphsage', 'hidden_dims': '[256, 128, 64]', 'dropout': 0.32324185509196995, 'batch_norm': True, 'sage_aggr': 'mean', 'sage_normalize': False, 'sage_project': False, 'lr': 0.00022638945753409185, 'weight_decay': 6.062601806230258e-07, 'epochs': 79, 'loss': 'mse', 'optimizer': 'adam', 'graph_mode': 'cutoff', 'cutoff': 0.6792063821786208, 'grm_norm': 'cosine_then_gcn', 'self_loops': True, 'use_snp_selection': False}. Best is trial 62 with value: 0.32429274467006397.
[I 2025-12-09 17:42:13,398] Trial 119 finished with value: 0.2999258434611084 and parameters: {'model_type': 'graphsage', 'hidden_dims': '[512, 256]', 'dropout': 0.34573243379801744, 'batch_norm': True, 'sage_aggr': 'mean', 'sage_normalize': False, 'sage_project': False, 'lr': 0.00011663423262778506, 'weight_decay': 1.1510962404729e-06, 'epochs': 61, 'loss': 'mse', 'optimizer': 'adam', 'graph_mode': 'cutoff', 'cutoff': 0.7655978588270672, 'grm_norm': 'none', 'self_loops': True, 'use_snp_selection': False}. Best is trial 62 with value: 0.32429274467006397.
