[I 2025-12-10 04:49:52,423] Trial 50 finished with value: 0.30697656586255817 and parameters: {'model_type': 'graphsage', 'hidden_dims': '[512, 128]', 'dropout': 0.4789480867995996, 'batch_norm': True, 'sage_aggr': 'mean', 'sage_normalize': True, 'sage_project': False, 'lr': 0.001293141764137255, 'weight_decay': 1.7657250851626207e-07, 'epochs': 333, 'loss': 'mse', 'optimizer': 'adam', 'graph_mode': 'knn', 'knn_k': 4, 'weighted_edges': False, 'symmetrize_mode': 'union', 'self_loops': True, 'use_snp_selection': False}. Best is trial 48 with value: 0.31165090555774844.
[I 2025-12-10 04:54:31,639] Trial 51 finished with value: 0.30658033898008746 and parameters: {'model_type': 'graphsage', 'hidden_dims': '[512, 128]', 'dropout': 0.4711628885932409, 'batch_norm': True, 'sage_aggr': 'mean', 'sage_normalize': True, 'sage_project': False, 'lr': 0.0012109413871454725, 'weight_decay': 1.4918614963390043e-07, 'epochs': 334, 'loss': 'mse', 'optimizer': 'adam', 'graph_mode': 'knn', 'knn_k': 5, 'weighted_edges': False, 'symmetrize_mode': 'union', 'self_loops': True, 'use_snp_selection': False}. Best is trial 48 with value: 0.31165090555774844.
[I 2025-12-10 04:58:48,951] Trial 52 finished with value: 0.3058327215537458 and parameters: {'model_type': 'graphsage', 'hidden_dims': '[512, 128]', 'dropout': 0.5494945695886855, 'batch_norm': True, 'sage_aggr': 'mean', 'sage_normalize': True, 'sage_project': False, 'lr': 0.0013124341038028879, 'weight_decay': 1.663599312306294e-07, 'epochs': 333, 'loss': 'mse', 'optimizer': 'adam', 'graph_mode': 'knn', 'knn_k': 4, 'weighted_edges': False, 'symmetrize_mode': 'union', 'self_loops': True, 'use_snp_selection': False}. Best is trial 48 with value: 0.31165090555774844.
[I 2025-12-10 05:03:27,596] Trial 53 finished with value: 0.30753055299332493 and parameters: {'model_type': 'graphsage', 'hidden_dims': '[512, 128]', 'dropout': 0.48160419965492324, 'batch_norm': True, 'sage_aggr': 'mean', 'sage_normalize': True, 'sage_project': False, 'lr': 0.0011976505987288913, 'weight_decay': 1.1530740741847407e-07, 'epochs': 336, 'loss': 'mse', 'optimizer': 'adam', 'graph_mode': 'knn', 'knn_k': 5, 'weighted_edges': False, 'symmetrize_mode': 'union', 'self_loops': True, 'use_snp_selection': False}. Best is trial 48 with value: 0.31165090555774844.
[I 2025-12-10 05:07:47,554] Trial 54 finished with value: 0.27254253834310643 and parameters: {'model_type': 'graphsage', 'hidden_dims': '[512, 128]', 'dropout': 0.4789587613117765, 'batch_norm': True, 'sage_aggr': 'mean', 'sage_normalize': True, 'sage_project': False, 'lr': 4.82910312049501e-05, 'weight_decay': 1.1224581842612678e-07, 'epochs': 313, 'loss': 'mse', 'optimizer': 'adam', 'graph_mode': 'knn', 'knn_k': 5, 'weighted_edges': False, 'symmetrize_mode': 'union', 'self_loops': True, 'use_snp_selection': False}. Best is trial 48 with value: 0.31165090555774844.
[I 2025-12-10 05:11:31,682] Trial 55 finished with value: 0.2881053467121872 and parameters: {'model_type': 'graphsage', 'hidden_dims': '[512, 128]', 'dropout': 0.518927026213696, 'batch_norm': True, 'sage_aggr': 'mean', 'sage_normalize': True, 'sage_project': False, 'lr': 0.0002625011017686479, 'weight_decay': 1.0000028057196521e-07, 'epochs': 337, 'loss': 'mse', 'optimizer': 'adam', 'graph_mode': 'knn', 'knn_k': 3, 'weighted_edges': False, 'symmetrize_mode': 'union', 'self_loops': True, 'use_snp_selection': False}. Best is trial 48 with value: 0.31165090555774844.
[I 2025-12-10 05:16:41,668] Trial 56 finished with value: 0.3059409775553978 and parameters: {'model_type': 'graphsage', 'hidden_dims': '[512, 128]', 'dropout': 0.43525240210086646, 'batch_norm': True, 'sage_aggr': 'mean', 'sage_normalize': True, 'sage_project': False, 'lr': 0.0010256472755901468, 'weight_decay': 3.6344212718826304e-07, 'epochs': 350, 'loss': 'mse', 'optimizer': 'adam', 'graph_mode': 'knn', 'knn_k': 6, 'weighted_edges': False, 'symmetrize_mode': 'union', 'self_loops': True, 'use_snp_selection': False}. Best is trial 48 with value: 0.31165090555774844.
[I 2025-12-10 05:20:07,082] Trial 57 finished with value: 0.2657256627210991 and parameters: {'model_type': 'graphsage', 'hidden_dims': '[512, 128]', 'dropout': 0.45426878695956047, 'batch_norm': True, 'sage_aggr': 'mean', 'sage_normalize': True, 'sage_project': False, 'lr': 0.00011444888444601031, 'weight_decay': 2.20321269902899e-07, 'epochs': 325, 'loss': 'mse', 'optimizer': 'adam', 'graph_mode': 'knn', 'knn_k': 3, 'weighted_edges': False, 'symmetrize_mode': 'union', 'self_loops': False, 'use_snp_selection': False}. Best is trial 48 with value: 0.31165090555774844.
[I 2025-12-10 05:24:11,223] Trial 58 finished with value: 0.3088350323939678 and parameters: {'model_type': 'graphsage', 'hidden_dims': '[512, 128]', 'dropout': 0.5043810290354878, 'batch_norm': True, 'sage_aggr': 'mean', 'sage_normalize': False, 'sage_project': False, 'lr': 0.0007211837365053968, 'weight_decay': 5.702989654359924e-07, 'epochs': 294, 'loss': 'mse', 'optimizer': 'adam', 'graph_mode': 'knn', 'knn_k': 5, 'weighted_edges': False, 'symmetrize_mode': 'union', 'self_loops': True, 'use_snp_selection': False}. Best is trial 48 with value: 0.31165090555774844.
[I 2025-12-10 05:28:17,752] Trial 59 finished with value: 0.2981945830531135 and parameters: {'model_type': 'graphsage', 'hidden_dims': '[512, 128]', 'dropout': 0.5890094660958753, 'batch_norm': True, 'sage_aggr': 'mean', 'sage_normalize': False, 'sage_project': False, 'lr': 0.000471261985822186, 'weight_decay': 5.810328149256312e-07, 'epochs': 297, 'loss': 'mse', 'optimizer': 'adam', 'graph_mode': 'knn', 'knn_k': 5, 'weighted_edges': False, 'symmetrize_mode': 'union', 'self_loops': True, 'use_snp_selection': False}. Best is trial 48 with value: 0.31165090555774844.
[I 2025-12-10 05:32:11,062] Trial 60 finished with value: 0.277449710683774 and parameters: {'model_type': 'graphsage', 'hidden_dims': '[512, 128]', 'dropout': 0.5387624293194085, 'batch_norm': True, 'sage_aggr': 'max', 'sage_normalize': False, 'sage_project': False, 'lr': 0.0007774105849769404, 'weight_decay': 1.821750640514259e-07, 'epochs': 282, 'loss': 'mse', 'optimizer': 'adam', 'graph_mode': 'knn', 'knn_k': 4, 'weighted_edges': False, 'symmetrize_mode': 'union', 'self_loops': True, 'use_snp_selection': False}. Best is trial 48 with value: 0.31165090555774844.
[I 2025-12-10 05:37:01,898] Trial 61 finished with value: 0.3079103597490843 and parameters: {'model_type': 'graphsage', 'hidden_dims': '[512, 128]', 'dropout': 0.5190622375885459, 'batch_norm': True, 'sage_aggr': 'mean', 'sage_normalize': False, 'sage_project': False, 'lr': 0.0017457229136903505, 'weight_decay': 3.272331304817505e-07, 'epochs': 308, 'loss': 'mse', 'optimizer': 'adam', 'graph_mode': 'knn', 'knn_k': 7, 'weighted_edges': False, 'symmetrize_mode': 'union', 'self_loops': True, 'use_snp_selection': False}. Best is trial 48 with value: 0.31165090555774844.
[I 2025-12-10 05:41:51,743] Trial 62 finished with value: 0.3056007492328496 and parameters: {'model_type': 'graphsage', 'hidden_dims': '[512, 128]', 'dropout': 0.4914260366861066, 'batch_norm': True, 'sage_aggr': 'mean', 'sage_normalize': False, 'sage_project': False, 'lr': 0.0006699281491350348, 'weight_decay': 2.7551326713846977e-07, 'epochs': 307, 'loss': 'mse', 'optimizer': 'adam', 'graph_mode': 'knn', 'knn_k': 7, 'weighted_edges': False, 'symmetrize_mode': 'union', 'self_loops': True, 'use_snp_selection': False}. Best is trial 48 with value: 0.31165090555774844.
[I 2025-12-10 05:43:01,111] Trial 63 finished with value: 0.30565730080178033 and parameters: {'model_type': 'graphsage', 'hidden_dims': '[512, 128]', 'dropout': 0.515357525087988, 'batch_norm': True, 'sage_aggr': 'mean', 'sage_normalize': False, 'sage_project': False, 'lr': 0.0016253037727426958, 'weight_decay': 3.2796311247510935e-07, 'epochs': 73, 'loss': 'mse', 'optimizer': 'adam', 'graph_mode': 'knn', 'knn_k': 6, 'weighted_edges': False, 'symmetrize_mode': 'union', 'self_loops': True, 'use_snp_selection': False}. Best is trial 48 with value: 0.31165090555774844.
[I 2025-12-10 05:47:03,645] Trial 64 finished with value: 0.30971386422009733 and parameters: {'model_type': 'graphsage', 'hidden_dims': '[512, 128]', 'dropout': 0.5686230550501382, 'batch_norm': True, 'sage_aggr': 'mean', 'sage_normalize': False, 'sage_project': False, 'lr': 0.001007164202739472, 'weight_decay': 4.810561688993686e-07, 'epochs': 292, 'loss': 'mse', 'optimizer': 'adam', 'graph_mode': 'knn', 'knn_k': 5, 'weighted_edges': False, 'symmetrize_mode': 'union', 'self_loops': True, 'use_snp_selection': False}. Best is trial 48 with value: 0.31165090555774844.
[I 2025-12-10 05:51:07,759] Trial 65 finished with value: 0.28917127327871 and parameters: {'model_type': 'graphsage', 'hidden_dims': '[512, 128]', 'dropout': 0.5731011006564772, 'batch_norm': True, 'sage_aggr': 'mean', 'sage_normalize': False, 'sage_project': False, 'lr': 3.0353516957016835e-05, 'weight_decay': 5.218644303257722e-07, 'epochs': 294, 'loss': 'mse', 'optimizer': 'adam', 'graph_mode': 'knn', 'knn_k': 5, 'weighted_edges': False, 'symmetrize_mode': 'union', 'self_loops': True, 'use_snp_selection': False}. Best is trial 48 with value: 0.31165090555774844.
[I 2025-12-10 05:55:41,940] Trial 66 finished with value: 0.3097478276586684 and parameters: {'model_type': 'graphsage', 'hidden_dims': '[512, 128]', 'dropout': 0.5589725558113985, 'batch_norm': True, 'sage_aggr': 'mean', 'sage_normalize': False, 'sage_project': False, 'lr': 0.002823307613689551, 'weight_decay': 7.303711417556254e-07, 'epochs': 273, 'loss': 'mse', 'optimizer': 'adam', 'graph_mode': 'knn', 'knn_k': 8, 'weighted_edges': False, 'symmetrize_mode': 'union', 'self_loops': True, 'use_snp_selection': False}. Best is trial 48 with value: 0.31165090555774844.
[I 2025-12-10 06:00:02,467] Trial 67 finished with value: 0.3002650985204327 and parameters: {'model_type': 'graphsage', 'hidden_dims': '[512, 128]', 'dropout': 0.5666808617135932, 'batch_norm': True, 'sage_aggr': 'mean', 'sage_normalize': False, 'sage_project': False, 'lr': 0.0026961754831039283, 'weight_decay': 7.382032100581259e-07, 'epochs': 259, 'loss': 'mse', 'optimizer': 'adam', 'graph_mode': 'knn', 'knn_k': 8, 'weighted_edges': False, 'symmetrize_mode': 'union', 'self_loops': True, 'use_snp_selection': False}. Best is trial 48 with value: 0.31165090555774844.
[I 2025-12-10 06:04:32,448] Trial 68 finished with value: 0.30132804208239394 and parameters: {'model_type': 'graphsage', 'hidden_dims': '[512, 64]', 'dropout': 0.5492664453228688, 'batch_norm': True, 'sage_aggr': 'mean', 'sage_normalize': False, 'sage_project': False, 'lr': 0.003924876089026443, 'weight_decay': 4.732406793230454e-07, 'epochs': 269, 'loss': 'mse', 'optimizer': 'adam', 'graph_mode': 'knn', 'knn_k': 8, 'weighted_edges': False, 'symmetrize_mode': 'union', 'self_loops': True, 'use_snp_selection': False}. Best is trial 48 with value: 0.31165090555774844.
[I 2025-12-10 06:08:29,357] Trial 69 finished with value: 0.3027454568233174 and parameters: {'model_type': 'graphsage', 'hidden_dims': '[512, 128]', 'dropout': 0.5804722787000878, 'batch_norm': True, 'sage_aggr': 'mean', 'sage_normalize': False, 'sage_project': False, 'lr': 0.0019731065688956967, 'weight_decay': 2.6421166229221475e-05, 'epochs': 235, 'loss': 'mae', 'optimizer': 'adam', 'graph_mode': 'knn', 'knn_k': 8, 'weighted_edges': False, 'symmetrize_mode': 'union', 'self_loops': True, 'use_snp_selection': False}. Best is trial 48 with value: 0.31165090555774844.
[I 2025-12-10 06:09:35,398] Trial 70 finished with value: 0.2928511882945937 and parameters: {'model_type': 'graphsage', 'hidden_dims': '[512, 128]', 'dropout': 0.5365142166612795, 'batch_norm': True, 'sage_aggr': 'mean', 'sage_normalize': False, 'sage_project': False, 'lr': 0.0003593774144443287, 'weight_decay': 1.2517242016565276e-06, 'epochs': 286, 'loss': 'mse', 'optimizer': 'adam', 'graph_mode': 'knn', 'knn_k': 6, 'weighted_edges': False, 'symmetrize_mode': 'union', 'self_loops': False, 'use_snp_selection': True, 'num_snps': 14898}. Best is trial 48 with value: 0.31165090555774844.
[I 2025-12-10 06:13:46,832] Trial 71 finished with value: 0.30576963646588895 and parameters: {'model_type': 'graphsage', 'hidden_dims': '[512, 128]', 'dropout': 0.5096173494096323, 'batch_norm': True, 'sage_aggr': 'mean', 'sage_normalize': False, 'sage_project': False, 'lr': 0.0009160206046492068, 'weight_decay': 3.8101621182938054e-07, 'epochs': 303, 'loss': 'mse', 'optimizer': 'adam', 'graph_mode': 'knn', 'knn_k': 5, 'weighted_edges': False, 'symmetrize_mode': 'union', 'self_loops': True, 'use_snp_selection': False}. Best is trial 48 with value: 0.31165090555774844.
[I 2025-12-10 06:18:07,194] Trial 72 finished with value: 0.3053472047162051 and parameters: {'model_type': 'graphsage', 'hidden_dims': '[512, 128]', 'dropout': 0.5320131661758701, 'batch_norm': True, 'sage_aggr': 'mean', 'sage_normalize': False, 'sage_project': False, 'lr': 0.002454717447487767, 'weight_decay': 2.834746160626558e-07, 'epochs': 275, 'loss': 'mse', 'optimizer': 'adam', 'graph_mode': 'knn', 'knn_k': 7, 'weighted_edges': False, 'symmetrize_mode': 'union', 'self_loops': True, 'use_snp_selection': False}. Best is trial 48 with value: 0.31165090555774844.
[I 2025-12-10 06:20:51,747] Trial 73 finished with value: 0.30128154015063224 and parameters: {'model_type': 'graphsage', 'hidden_dims': '[512, 128]', 'dropout': 0.5538081137512416, 'batch_norm': True, 'sage_aggr': 'mean', 'sage_normalize': False, 'sage_project': False, 'lr': 0.0032845805878501874, 'weight_decay': 2.189042957466697e-07, 'epochs': 247, 'loss': 'mse', 'optimizer': 'adam', 'graph_mode': 'knn', 'knn_k': 6, 'weighted_edges': False, 'symmetrize_mode': 'mutual', 'self_loops': True, 'use_snp_selection': False}. Best is trial 48 with value: 0.31165090555774844.
[I 2025-12-10 06:24:12,752] Trial 74 finished with value: 0.3008259464669818 and parameters: {'model_type': 'graphsage', 'hidden_dims': '[512, 128]', 'dropout': 0.5959897220971918, 'batch_norm': True, 'sage_aggr': 'mean', 'sage_normalize': False, 'sage_project': False, 'lr': 0.0010726898546111975, 'weight_decay': 3.555638699190224e-06, 'epochs': 315, 'loss': 'mse', 'optimizer': 'adam', 'graph_mode': 'knn', 'knn_k': 5, 'weighted_edges': False, 'symmetrize_mode': 'mutual', 'self_loops': True, 'use_snp_selection': False}. Best is trial 48 with value: 0.31165090555774844.
[I 2025-12-10 06:25:21,308] Trial 75 finished with value: 0.3084198835597902 and parameters: {'model_type': 'graphsage', 'hidden_dims': '[128, 64]', 'dropout': 0.45706789917436413, 'batch_norm': True, 'sage_aggr': 'mean', 'sage_normalize': False, 'sage_project': False, 'lr': 0.0016504989772176122, 'weight_decay': 6.955983054393898e-07, 'epochs': 91, 'loss': 'mse', 'optimizer': 'adam', 'graph_mode': 'knn', 'knn_k': 9, 'weighted_edges': True, 'symmetrize_mode': 'union', 'self_loops': True, 'use_snp_selection': False}. Best is trial 48 with value: 0.31165090555774844.
[I 2025-12-10 06:26:00,338] Trial 76 finished with value: 0.2982013187825383 and parameters: {'model_type': 'graphsage', 'hidden_dims': '[128, 64]', 'dropout': 0.5082485648035423, 'batch_norm': True, 'sage_aggr': 'mean', 'sage_normalize': False, 'sage_project': False, 'lr': 0.0015357994308385096, 'weight_decay': 1.9284909055390566e-06, 'epochs': 49, 'loss': 'mse', 'optimizer': 'adam', 'graph_mode': 'knn', 'knn_k': 9, 'weighted_edges': True, 'symmetrize_mode': 'union', 'self_loops': True, 'use_snp_selection': False}. Best is trial 48 with value: 0.31165090555774844.
[I 2025-12-10 06:26:48,759] Trial 77 finished with value: 0.268477363336053 and parameters: {'model_type': 'graphsage', 'hidden_dims': '[128, 64]', 'dropout': 0.3804803545003447, 'batch_norm': True, 'sage_aggr': 'max', 'sage_normalize': False, 'sage_project': False, 'lr': 0.001834041011070669, 'weight_decay': 7.71757316199748e-07, 'epochs': 84, 'loss': 'mse', 'optimizer': 'adam', 'graph_mode': 'knn', 'knn_k': 10, 'weighted_edges': True, 'symmetrize_mode': 'mutual', 'self_loops': True, 'use_snp_selection': False}. Best is trial 48 with value: 0.31165090555774844.
[I 2025-12-10 06:27:57,350] Trial 78 finished with value: 0.3087974511417365 and parameters: {'model_type': 'graphsage', 'hidden_dims': '[128, 64]', 'dropout': 0.4520419561127454, 'batch_norm': True, 'sage_aggr': 'mean', 'sage_normalize': False, 'sage_project': False, 'lr': 0.0052294891004511495, 'weight_decay': 6.711651324292362e-07, 'epochs': 91, 'loss': 'mse', 'optimizer': 'adam', 'graph_mode': 'knn', 'knn_k': 9, 'weighted_edges': True, 'symmetrize_mode': 'union', 'self_loops': True, 'use_snp_selection': False}. Best is trial 48 with value: 0.31165090555774844.
[I 2025-12-10 06:28:45,531] Trial 79 finished with value: 0.3061022044226509 and parameters: {'model_type': 'graphsage', 'hidden_dims': '[128, 64]', 'dropout': 0.45481080015122155, 'batch_norm': True, 'sage_aggr': 'mean', 'sage_normalize': False, 'sage_project': False, 'lr': 0.005450934195134638, 'weight_decay': 6.233823472643595e-07, 'epochs': 62, 'loss': 'mae', 'optimizer': 'adam', 'graph_mode': 'knn', 'knn_k': 9, 'weighted_edges': True, 'symmetrize_mode': 'union', 'self_loops': True, 'use_snp_selection': False}. Best is trial 48 with value: 0.31165090555774844.
[I 2025-12-10 06:30:10,609] Trial 80 finished with value: 0.2818271102397929 and parameters: {'model_type': 'graphsage', 'hidden_dims': '[128, 64]', 'dropout': 0.39842356809514246, 'batch_norm': True, 'sage_aggr': 'mean', 'sage_normalize': False, 'sage_project': False, 'lr': 1.0641329189400767e-05, 'weight_decay': 1.186129089164881e-06, 'epochs': 104, 'loss': 'mse', 'optimizer': 'adam', 'graph_mode': 'knn', 'knn_k': 10, 'weighted_edges': True, 'symmetrize_mode': 'union', 'self_loops': True, 'use_snp_selection': False}. Best is trial 48 with value: 0.31165090555774844.
[I 2025-12-10 06:31:38,087] Trial 81 finished with value: 0.30288541369832794 and parameters: {'model_type': 'graphsage', 'hidden_dims': '[128, 64]', 'dropout': 0.45893252955136415, 'batch_norm': True, 'sage_aggr': 'mean', 'sage_normalize': False, 'sage_project': False, 'lr': 0.0041584701629967195, 'weight_decay': 8.925186991345246e-07, 'epochs': 131, 'loss': 'mse', 'optimizer': 'adam', 'graph_mode': 'knn', 'knn_k': 8, 'weighted_edges': True, 'symmetrize_mode': 'union', 'self_loops': True, 'use_snp_selection': False}. Best is trial 48 with value: 0.31165090555774844.
[I 2025-12-10 06:32:44,559] Trial 82 finished with value: 0.3021501780937938 and parameters: {'model_type': 'graphsage', 'hidden_dims': '[128, 64]', 'dropout': 0.4079387684537074, 'batch_norm': True, 'sage_aggr': 'mean', 'sage_normalize': False, 'sage_project': False, 'lr': 0.0029513361807949933, 'weight_decay': 4.2527744565902515e-07, 'epochs': 88, 'loss': 'mse', 'optimizer': 'adam', 'graph_mode': 'knn', 'knn_k': 9, 'weighted_edges': True, 'symmetrize_mode': 'union', 'self_loops': True, 'use_snp_selection': False}. Best is trial 48 with value: 0.31165090555774844.
[I 2025-12-10 06:33:55,259] Trial 83 finished with value: 0.3067333012122153 and parameters: {'model_type': 'graphsage', 'hidden_dims': '[128, 64]', 'dropout': 0.43831014738635465, 'batch_norm': True, 'sage_aggr': 'mean', 'sage_normalize': False, 'sage_project': False, 'lr': 0.002330779208985877, 'weight_decay': 6.48615386111311e-07, 'epochs': 94, 'loss': 'mse', 'optimizer': 'adam', 'graph_mode': 'knn', 'knn_k': 9, 'weighted_edges': True, 'symmetrize_mode': 'union', 'self_loops': True, 'use_snp_selection': False}. Best is trial 48 with value: 0.31165090555774844.
[I 2025-12-10 06:34:29,005] Trial 84 finished with value: 0.27871745426682415 and parameters: {'model_type': 'graphsage', 'hidden_dims': '[256, 128, 64]', 'dropout': 0.5315033081276946, 'batch_norm': True, 'sage_aggr': 'mean', 'sage_normalize': False, 'sage_project': False, 'lr': 0.0017979487883036658, 'weight_decay': 3.121694273279555e-07, 'epochs': 42, 'loss': 'mse', 'optimizer': 'adam', 'graph_mode': 'knn', 'knn_k': 7, 'weighted_edges': True, 'symmetrize_mode': 'union', 'self_loops': True, 'use_snp_selection': False}. Best is trial 48 with value: 0.31165090555774844.
[I 2025-12-10 06:38:02,356] Trial 85 finished with value: 0.3007775052265494 and parameters: {'model_type': 'graphsage', 'hidden_dims': '[512, 64]', 'dropout': 0.4153870882631376, 'batch_norm': True, 'sage_aggr': 'mean', 'sage_normalize': False, 'sage_project': False, 'lr': 0.0034826418174378855, 'weight_decay': 4.969142934146854e-07, 'epochs': 276, 'loss': 'mse', 'optimizer': 'adam', 'graph_mode': 'knn', 'knn_k': 8, 'weighted_edges': True, 'symmetrize_mode': 'mutual', 'self_loops': True, 'use_snp_selection': False}. Best is trial 48 with value: 0.31165090555774844.
[I 2025-12-10 06:39:28,585] Trial 86 finished with value: 0.3047939070295639 and parameters: {'model_type': 'graphsage', 'hidden_dims': '[512, 256]', 'dropout': 0.5030132517545165, 'batch_norm': True, 'sage_aggr': 'mean', 'sage_normalize': False, 'sage_project': False, 'lr': 0.007019517108241271, 'weight_decay': 0.0001471540360235146, 'epochs': 72, 'loss': 'mse', 'optimizer': 'adam', 'graph_mode': 'knn', 'knn_k': 3, 'weighted_edges': True, 'symmetrize_mode': 'union', 'self_loops': True, 'use_snp_selection': True, 'num_snps': 58680}. Best is trial 48 with value: 0.31165090555774844.
[I 2025-12-10 06:40:20,063] Trial 87 finished with value: 0.2537341137660206 and parameters: {'model_type': 'graphsage', 'hidden_dims': '[128, 64]', 'dropout': 0.14198402666705393, 'batch_norm': True, 'sage_aggr': 'mean', 'sage_normalize': False, 'sage_project': False, 'lr': 0.004645931579066334, 'weight_decay': 1.4746114326037863e-06, 'epochs': 262, 'loss': 'mse', 'optimizer': 'adam', 'graph_mode': 'knn', 'knn_k': 1, 'weighted_edges': False, 'symmetrize_mode': 'union', 'self_loops': False, 'use_snp_selection': False}. Best is trial 48 with value: 0.31165090555774844.
