[I 2025-12-05 18:05:24,542] Trial 27 finished with value: 0.21857989616954548 and parameters: {'model_type': 'graphsage', 'hidden_dims': '[128, 64]', 'dropout': 0.2211262391016685, 'batch_norm': True, 'sage_aggr': 'mean', 'sage_normalize': False, 'sage_project': False, 'lr': 0.0002573728290448526, 'weight_decay': 2.7539769889109854e-06, 'epochs': 98, 'loss': 'mse', 'optimizer': 'adam', 'graph_mode': 'cutoff', 'cutoff': 0.48783130236588995, 'grm_norm': 'cosine', 'self_loops': False, 'use_snp_selection': False, 'graphsage_batch_size': 32}. Best is trial 17 with value: 0.22503483396071927.
[I 2025-12-05 18:06:39,123] Trial 28 finished with value: 0.21121719082330231 and parameters: {'model_type': 'graphsage', 'hidden_dims': '[512, 256]', 'dropout': 0.30661780210726375, 'batch_norm': True, 'sage_aggr': 'mean', 'sage_normalize': False, 'sage_project': False, 'lr': 0.0004935825885286377, 'weight_decay': 4.002423395038972e-06, 'epochs': 111, 'loss': 'mse', 'optimizer': 'adam', 'graph_mode': 'cutoff', 'cutoff': 0.8065068494459026, 'grm_norm': 'cosine', 'self_loops': False, 'use_snp_selection': False, 'graphsage_batch_size': 16}. Best is trial 17 with value: 0.22503483396071927.
[I 2025-12-05 18:07:31,294] Trial 29 finished with value: 0.21130652976332226 and parameters: {'model_type': 'graphsage', 'hidden_dims': '[512, 64]', 'dropout': 0.15400398628815332, 'batch_norm': True, 'sage_aggr': 'max', 'sage_normalize': False, 'sage_project': False, 'lr': 2.4435625669541037e-05, 'weight_decay': 8.77527639861222e-07, 'epochs': 57, 'loss': 'mse', 'optimizer': 'adam', 'graph_mode': 'cutoff', 'cutoff': 0.4220869960560166, 'grm_norm': 'gcn', 'self_loops': False, 'use_snp_selection': False, 'graphsage_batch_size': 256}. Best is trial 17 with value: 0.22503483396071927.
[I 2025-12-05 18:07:55,827] Trial 30 finished with value: 0.22000928794303815 and parameters: {'model_type': 'graphsage', 'hidden_dims': '[128, 64]', 'dropout': 0.5606631290457001, 'batch_norm': True, 'sage_aggr': 'mean', 'sage_normalize': False, 'sage_project': False, 'lr': 7.823366291146445e-05, 'weight_decay': 2.1867017343461904e-07, 'epochs': 92, 'loss': 'mse', 'optimizer': 'adam', 'graph_mode': 'cutoff', 'cutoff': 0.5872636391675288, 'grm_norm': 'cosine_then_gcn', 'self_loops': False, 'use_snp_selection': False, 'graphsage_batch_size': 512}. Best is trial 17 with value: 0.22503483396071927.
[I 2025-12-05 18:08:30,127] Trial 31 finished with value: 0.2201904207511724 and parameters: {'model_type': 'graphsage', 'hidden_dims': '[256, 128, 64]', 'dropout': 0.41138654010860576, 'batch_norm': True, 'sage_aggr': 'mean', 'sage_normalize': False, 'sage_project': False, 'lr': 0.0006949863324175394, 'weight_decay': 3.4081994245836596e-07, 'epochs': 82, 'loss': 'mse', 'optimizer': 'adam', 'graph_mode': 'cutoff', 'cutoff': 0.7164604539191485, 'grm_norm': 'cosine', 'self_loops': False, 'use_snp_selection': False, 'graphsage_batch_size': 16}. Best is trial 17 with value: 0.22503483396071927.
[I 2025-12-05 18:09:02,608] Trial 32 finished with value: 0.22544698335038685 and parameters: {'model_type': 'graphsage', 'hidden_dims': '[256, 128, 64]', 'dropout': 0.4540134117237326, 'batch_norm': True, 'sage_aggr': 'mean', 'sage_normalize': False, 'sage_project': False, 'lr': 0.0006520853970446333, 'weight_decay': 5.261011157105743e-07, 'epochs': 76, 'loss': 'mse', 'optimizer': 'adam', 'graph_mode': 'cutoff', 'cutoff': 0.6362662007548583, 'grm_norm': 'cosine', 'self_loops': False, 'use_snp_selection': False, 'graphsage_batch_size': 16}. Best is trial 32 with value: 0.22544698335038685.
[I 2025-12-05 18:09:33,113] Trial 33 finished with value: 0.2198675122712909 and parameters: {'model_type': 'graphsage', 'hidden_dims': '[256, 128, 64]', 'dropout': 0.46195173295663006, 'batch_norm': True, 'sage_aggr': 'mean', 'sage_normalize': False, 'sage_project': False, 'lr': 0.00037216519661737303, 'weight_decay': 1.0318053130162195e-06, 'epochs': 69, 'loss': 'mse', 'optimizer': 'adam', 'graph_mode': 'cutoff', 'cutoff': 0.5968732177434225, 'grm_norm': 'cosine', 'self_loops': False, 'use_snp_selection': False, 'graphsage_batch_size': 16}. Best is trial 32 with value: 0.22544698335038685.
[I 2025-12-05 18:09:59,133] Trial 34 finished with value: 0.21175765274602462 and parameters: {'model_type': 'graphsage', 'hidden_dims': '[256, 128, 64]', 'dropout': 0.5026859114771595, 'batch_norm': True, 'sage_aggr': 'mean', 'sage_normalize': False, 'sage_project': False, 'lr': 0.0005694407015672829, 'weight_decay': 4.458908048854365e-07, 'epochs': 56, 'loss': 'mse', 'optimizer': 'adam', 'graph_mode': 'cutoff', 'cutoff': 0.6816983014245916, 'grm_norm': 'cosine', 'self_loops': False, 'use_snp_selection': False, 'graphsage_batch_size': 8}. Best is trial 32 with value: 0.22544698335038685.
[I 2025-12-05 18:10:38,385] Trial 35 finished with value: 0.08342707337906936 and parameters: {'model_type': 'graphsage', 'hidden_dims': '[256, 128, 64]', 'dropout': 0.3716894673656441, 'batch_norm': False, 'sage_aggr': 'mean', 'sage_normalize': False, 'sage_project': False, 'lr': 0.0009696811127244786, 'weight_decay': 1.6208136427955285e-07, 'epochs': 98, 'loss': 'mse', 'optimizer': 'adam', 'graph_mode': 'cutoff', 'cutoff': 0.7409208671011175, 'grm_norm': 'cosine', 'self_loops': False, 'use_snp_selection': False, 'graphsage_batch_size': 16}. Best is trial 32 with value: 0.22544698335038685.
[I 2025-12-05 18:11:33,526] Trial 36 finished with value: 0.19628408247033083 and parameters: {'model_type': 'graphsage', 'hidden_dims': '[512, 128]', 'dropout': 0.40193199025473775, 'batch_norm': True, 'sage_aggr': 'max', 'sage_normalize': False, 'sage_project': False, 'lr': 0.00022376000481829551, 'weight_decay': 2.937499007429606e-05, 'epochs': 75, 'loss': 'mse', 'optimizer': 'adam', 'graph_mode': 'knn', 'knn_k': 1, 'weighted_edges': False, 'symmetrize_mode': 'union', 'self_loops': False, 'use_snp_selection': False, 'graphsage_batch_size': 64}. Best is trial 32 with value: 0.22544698335038685.
[I 2025-12-05 18:12:42,216] Trial 37 finished with value: 0.22697653182623526 and parameters: {'model_type': 'graphsage', 'hidden_dims': '[256, 128]', 'dropout': 0.5874947623454398, 'batch_norm': True, 'sage_aggr': 'mean', 'sage_normalize': True, 'sage_project': False, 'lr': 0.00035476817128418127, 'weight_decay': 6.761661535151364e-07, 'epochs': 122, 'loss': 'mse', 'optimizer': 'adam', 'graph_mode': 'cutoff', 'cutoff': 0.8226075415395664, 'grm_norm': 'cosine', 'self_loops': False, 'use_snp_selection': True, 'num_snps': 59893, 'graphsage_batch_size': 256}. Best is trial 37 with value: 0.22697653182623526.
[I 2025-12-05 18:16:45,023] Trial 38 finished with value: 0.19413276063128393 and parameters: {'model_type': 'graphsage', 'hidden_dims': '[256, 128]', 'dropout': 0.5877992471307417, 'batch_norm': False, 'sage_aggr': 'max', 'sage_normalize': True, 'sage_project': False, 'lr': 3.5772956879395065e-05, 'weight_decay': 1.726147818303898e-06, 'epochs': 130, 'loss': 'mse', 'optimizer': 'adam', 'graph_mode': 'knn', 'knn_k': 10, 'weighted_edges': False, 'symmetrize_mode': 'union', 'self_loops': False, 'use_snp_selection': True, 'num_snps': 58260, 'graphsage_batch_size': 256}. Best is trial 37 with value: 0.22697653182623526.
[I 2025-12-05 18:17:29,128] Trial 39 finished with value: 0.2271695156676569 and parameters: {'model_type': 'graphsage', 'hidden_dims': '[256, 128]', 'dropout': 0.30608126533209007, 'batch_norm': True, 'sage_aggr': 'mean', 'sage_normalize': True, 'sage_project': False, 'lr': 0.0001814634371067093, 'weight_decay': 7.439686724167268e-07, 'epochs': 149, 'loss': 'mae', 'optimizer': 'adam', 'graph_mode': 'cutoff', 'cutoff': 0.8252731420072613, 'grm_norm': 'cosine', 'self_loops': False, 'use_snp_selection': True, 'num_snps': 29957, 'graphsage_batch_size': 256}. Best is trial 39 with value: 0.2271695156676569.
[I 2025-12-05 18:18:12,664] Trial 40 finished with value: 0.11583093023236643 and parameters: {'model_type': 'graphsage', 'hidden_dims': '[256, 128]', 'dropout': 0.2406912707124895, 'batch_norm': True, 'sage_aggr': 'mean', 'sage_normalize': True, 'sage_project': False, 'lr': 1.185111987604995e-06, 'weight_decay': 4.178343629808772e-06, 'epochs': 145, 'loss': 'mae', 'optimizer': 'adam', 'graph_mode': 'knn', 'knn_k': 1, 'weighted_edges': True, 'symmetrize_mode': 'union', 'self_loops': False, 'use_snp_selection': True, 'num_snps': 28012, 'graphsage_batch_size': 256}. Best is trial 39 with value: 0.2271695156676569.
[I 2025-12-05 18:19:14,267] Trial 41 finished with value: 0.21604777634532568 and parameters: {'model_type': 'graphsage', 'hidden_dims': '[256, 128]', 'dropout': 0.30105968478167555, 'batch_norm': True, 'sage_aggr': 'mean', 'sage_normalize': True, 'sage_project': False, 'lr': 0.00019673371211154634, 'weight_decay': 1.0663193900813828e-06, 'epochs': 175, 'loss': 'mae', 'optimizer': 'adam', 'graph_mode': 'cutoff', 'cutoff': 0.8285126693298968, 'grm_norm': 'cosine', 'self_loops': False, 'use_snp_selection': True, 'num_snps': 41977, 'graphsage_batch_size': 256}. Best is trial 39 with value: 0.2271695156676569.
[I 2025-12-05 18:19:50,106] Trial 42 finished with value: 0.22932807723290285 and parameters: {'model_type': 'graphsage', 'hidden_dims': '[256, 128]', 'dropout': 0.30785048130697934, 'batch_norm': True, 'sage_aggr': 'mean', 'sage_normalize': True, 'sage_project': False, 'lr': 0.00034888290365467107, 'weight_decay': 6.954578396789438e-07, 'epochs': 163, 'loss': 'mae', 'optimizer': 'adam', 'graph_mode': 'cutoff', 'cutoff': 0.8332433994421213, 'grm_norm': 'gcn', 'self_loops': False, 'use_snp_selection': True, 'num_snps': 20621, 'graphsage_batch_size': 256}. Best is trial 42 with value: 0.22932807723290285.
[I 2025-12-05 18:20:27,052] Trial 43 finished with value: 0.23894768683388365 and parameters: {'model_type': 'graphsage', 'hidden_dims': '[256, 128]', 'dropout': 0.3634581310333658, 'batch_norm': True, 'sage_aggr': 'mean', 'sage_normalize': True, 'sage_project': False, 'lr': 0.00034531930220454466, 'weight_decay': 6.77110726036709e-07, 'epochs': 196, 'loss': 'mae', 'optimizer': 'adam', 'graph_mode': 'cutoff', 'cutoff': 0.8391758438553742, 'grm_norm': 'gcn', 'self_loops': False, 'use_snp_selection': True, 'num_snps': 18518, 'graphsage_batch_size': 256}. Best is trial 43 with value: 0.23894768683388365.
[I 2025-12-05 18:21:06,109] Trial 44 finished with value: 0.23076685640511138 and parameters: {'model_type': 'graphsage', 'hidden_dims': '[256, 128]', 'dropout': 0.3658113834178623, 'batch_norm': True, 'sage_aggr': 'mean', 'sage_normalize': True, 'sage_project': False, 'lr': 0.0003617366322427607, 'weight_decay': 7.128652028019126e-07, 'epochs': 198, 'loss': 'mae', 'optimizer': 'adam', 'graph_mode': 'cutoff', 'cutoff': 0.8438462904636417, 'grm_norm': 'gcn', 'self_loops': False, 'use_snp_selection': True, 'num_snps': 20306, 'graphsage_batch_size': 256}. Best is trial 43 with value: 0.23894768683388365.
[I 2025-12-05 18:21:42,832] Trial 45 finished with value: 0.22265898657976604 and parameters: {'model_type': 'graphsage', 'hidden_dims': '[256, 128]', 'dropout': 0.36757073681013586, 'batch_norm': False, 'sage_aggr': 'mean', 'sage_normalize': True, 'sage_project': False, 'lr': 0.00035150533746771545, 'weight_decay': 6.84688738418324e-06, 'epochs': 195, 'loss': 'mae', 'optimizer': 'adam', 'graph_mode': 'cutoff', 'cutoff': 0.842686223037422, 'grm_norm': 'gcn', 'self_loops': False, 'use_snp_selection': True, 'num_snps': 18593, 'graphsage_batch_size': 256}. Best is trial 43 with value: 0.23894768683388365.
[I 2025-12-05 18:22:22,765] Trial 46 finished with value: 0.24263623152047006 and parameters: {'model_type': 'graphsage', 'hidden_dims': '[256, 128]', 'dropout': 0.2774878667850815, 'batch_norm': True, 'sage_aggr': 'max', 'sage_normalize': True, 'sage_project': False, 'lr': 0.00010302373975591927, 'weight_decay': 2.7735338315568304e-06, 'epochs': 201, 'loss': 'mae', 'optimizer': 'adam', 'graph_mode': 'cutoff', 'cutoff': 0.845254618495154, 'grm_norm': 'gcn', 'self_loops': False, 'use_snp_selection': True, 'num_snps': 20590, 'graphsage_batch_size': 256}. Best is trial 46 with value: 0.24263623152047006.
[I 2025-12-05 18:23:08,376] Trial 47 finished with value: 0.22070244703482178 and parameters: {'model_type': 'graphsage', 'hidden_dims': '[256, 128]', 'dropout': 0.26774975775529264, 'batch_norm': True, 'sage_aggr': 'max', 'sage_normalize': True, 'sage_project': False, 'lr': 0.00011533122862114485, 'weight_decay': 0.0009444448283458111, 'epochs': 210, 'loss': 'mae', 'optimizer': 'adam', 'graph_mode': 'knn', 'knn_k': 3, 'weighted_edges': False, 'symmetrize_mode': 'mutual', 'self_loops': False, 'use_snp_selection': True, 'num_snps': 20453, 'graphsage_batch_size': 256}. Best is trial 46 with value: 0.24263623152047006.
[I 2025-12-05 18:23:51,084] Trial 48 finished with value: 0.22796841663586553 and parameters: {'model_type': 'graphsage', 'hidden_dims': '[256, 128]', 'dropout': 0.2906001617233302, 'batch_norm': True, 'sage_aggr': 'max', 'sage_normalize': True, 'sage_project': False, 'lr': 4.616953478696998e-05, 'weight_decay': 2.4868212806477347e-06, 'epochs': 192, 'loss': 'mae', 'optimizer': 'adam', 'graph_mode': 'cutoff', 'cutoff': 0.860752667955829, 'grm_norm': 'gcn', 'self_loops': False, 'use_snp_selection': True, 'num_snps': 23485, 'graphsage_batch_size': 256}. Best is trial 46 with value: 0.24263623152047006.
[I 2025-12-05 18:24:31,882] Trial 49 finished with value: 0.22793471149781075 and parameters: {'model_type': 'graphsage', 'hidden_dims': '[256, 128]', 'dropout': 0.21017019729617414, 'batch_norm': False, 'sage_aggr': 'max', 'sage_normalize': True, 'sage_project': False, 'lr': 4.196972259362033e-05, 'weight_decay': 2.6491236259290044e-06, 'epochs': 192, 'loss': 'mae', 'optimizer': 'adam', 'graph_mode': 'cutoff', 'cutoff': 0.8519250716574344, 'grm_norm': 'gcn', 'self_loops': False, 'use_snp_selection': True, 'num_snps': 22374, 'graphsage_batch_size': 256}. Best is trial 46 with value: 0.24263623152047006.
[I 2025-12-05 18:25:05,313] Trial 50 finished with value: 0.20775453978332345 and parameters: {'model_type': 'graphsage', 'hidden_dims': '[256, 128]', 'dropout': 0.2865417812278321, 'batch_norm': True, 'sage_aggr': 'max', 'sage_normalize': True, 'sage_project': False, 'lr': 2.2409053747527925e-05, 'weight_decay': 1.5142196490278736e-06, 'epochs': 238, 'loss': 'mae', 'optimizer': 'adam', 'graph_mode': 'cutoff', 'cutoff': 0.7507535620960885, 'grm_norm': 'gcn', 'self_loops': False, 'use_snp_selection': True, 'num_snps': 12936, 'graphsage_batch_size': 256}. Best is trial 46 with value: 0.24263623152047006.
[I 2025-12-05 18:25:46,910] Trial 51 finished with value: 0.2246235816764472 and parameters: {'model_type': 'graphsage', 'hidden_dims': '[256, 128]', 'dropout': 0.18368575112218438, 'batch_norm': False, 'sage_aggr': 'max', 'sage_normalize': True, 'sage_project': False, 'lr': 5.000785470762679e-05, 'weight_decay': 2.3176167808036724e-06, 'epochs': 192, 'loss': 'mae', 'optimizer': 'adam', 'graph_mode': 'cutoff', 'cutoff': 0.8550230859136159, 'grm_norm': 'gcn', 'self_loops': False, 'use_snp_selection': True, 'num_snps': 22610, 'graphsage_batch_size': 256}. Best is trial 46 with value: 0.24263623152047006.
[I 2025-12-05 18:26:31,735] Trial 52 finished with value: 0.222128275335018 and parameters: {'model_type': 'graphsage', 'hidden_dims': '[256, 128]', 'dropout': 0.2466635294033402, 'batch_norm': False, 'sage_aggr': 'max', 'sage_normalize': True, 'sage_project': False, 'lr': 9.828139898478418e-05, 'weight_decay': 7.865135222208065e-06, 'epochs': 212, 'loss': 'mae', 'optimizer': 'adam', 'graph_mode': 'cutoff', 'cutoff': 0.8671121527516528, 'grm_norm': 'gcn', 'self_loops': False, 'use_snp_selection': True, 'num_snps': 23578, 'graphsage_batch_size': 256}. Best is trial 46 with value: 0.24263623152047006.
[I 2025-12-05 18:27:02,085] Trial 53 finished with value: 0.23022824665865152 and parameters: {'model_type': 'graphsage', 'hidden_dims': '[256, 128]', 'dropout': 0.34705959155676436, 'batch_norm': False, 'sage_aggr': 'max', 'sage_normalize': True, 'sage_project': False, 'lr': 5.175479429203015e-05, 'weight_decay': 1.3999407674008197e-05, 'epochs': 191, 'loss': 'mae', 'optimizer': 'adam', 'graph_mode': 'cutoff', 'cutoff': 0.873315286249837, 'grm_norm': 'gcn', 'self_loops': False, 'use_snp_selection': True, 'num_snps': 13429, 'graphsage_batch_size': 256}. Best is trial 46 with value: 0.24263623152047006.
[I 2025-12-05 18:27:30,325] Trial 54 finished with value: 0.2202767392962766 and parameters: {'model_type': 'graphsage', 'hidden_dims': '[256, 128]', 'dropout': 0.3555194738375077, 'batch_norm': False, 'sage_aggr': 'max', 'sage_normalize': True, 'sage_project': False, 'lr': 5.4151074436296655e-05, 'weight_decay': 2.418625449885211e-05, 'epochs': 164, 'loss': 'mae', 'optimizer': 'adam', 'graph_mode': 'cutoff', 'cutoff': 0.8894166364972167, 'grm_norm': 'gcn', 'self_loops': False, 'use_snp_selection': True, 'num_snps': 13119, 'graphsage_batch_size': 128}. Best is trial 46 with value: 0.24263623152047006.
[I 2025-12-05 18:28:00,947] Trial 55 finished with value: 0.2319589772064278 and parameters: {'model_type': 'graphsage', 'hidden_dims': '[256, 128]', 'dropout': 0.38773483130628067, 'batch_norm': False, 'sage_aggr': 'max', 'sage_normalize': True, 'sage_project': False, 'lr': 1.5424687254344488e-05, 'weight_decay': 1.2675724823969745e-05, 'epochs': 202, 'loss': 'mae', 'optimizer': 'adam', 'graph_mode': 'cutoff', 'cutoff': 0.877964223897423, 'grm_norm': 'gcn', 'self_loops': False, 'use_snp_selection': True, 'num_snps': 12918, 'graphsage_batch_size': 256}. Best is trial 46 with value: 0.24263623152047006.
[I 2025-12-05 18:28:42,480] Trial 56 finished with value: 0.20824235191008444 and parameters: {'model_type': 'graphsage', 'hidden_dims': '[256, 128]', 'dropout': 0.3898905752228753, 'batch_norm': False, 'sage_aggr': 'max', 'sage_normalize': True, 'sage_project': False, 'lr': 1.4604763754365628e-05, 'weight_decay': 1.4528326973134336e-05, 'epochs': 204, 'loss': 'mae', 'optimizer': 'adam', 'graph_mode': 'cutoff', 'cutoff': 0.3052611383124095, 'grm_norm': 'gcn', 'self_loops': False, 'use_snp_selection': True, 'num_snps': 10501, 'graphsage_batch_size': 256}. Best is trial 46 with value: 0.24263623152047006.
[I 2025-12-05 18:29:34,371] Trial 57 finished with value: 0.22144041254175417 and parameters: {'model_type': 'graphsage', 'hidden_dims': '[512, 64]', 'dropout': 0.3408671387837394, 'batch_norm': False, 'sage_aggr': 'max', 'sage_normalize': True, 'sage_project': False, 'lr': 1.2008056350047783e-05, 'weight_decay': 7.065045263981343e-05, 'epochs': 232, 'loss': 'mae', 'optimizer': 'adam', 'graph_mode': 'cutoff', 'cutoff': 0.8969459052154151, 'grm_norm': 'gcn', 'self_loops': False, 'use_snp_selection': True, 'num_snps': 16263, 'graphsage_batch_size': 8}. Best is trial 46 with value: 0.24263623152047006.
[I 2025-12-05 18:30:13,703] Trial 58 finished with value: 0.1822539470982964 and parameters: {'model_type': 'graphsage', 'hidden_dims': '[256, 128]', 'dropout': 0.42950611799960237, 'batch_norm': False, 'sage_aggr': 'max', 'sage_normalize': True, 'sage_project': False, 'lr': 2.587494141641406e-05, 'weight_decay': 1.6008993598988872e-05, 'epochs': 220, 'loss': 'mae', 'optimizer': 'adam', 'graph_mode': 'knn', 'knn_k': 10, 'weighted_edges': True, 'symmetrize_mode': 'mutual', 'self_loops': False, 'use_snp_selection': True, 'num_snps': 9363, 'graphsage_batch_size': 64}. Best is trial 46 with value: 0.24263623152047006.
[I 2025-12-05 18:30:58,497] Trial 59 finished with value: 0.22331353931199174 and parameters: {'model_type': 'graphsage', 'hidden_dims': '[512, 128]', 'dropout': 0.32276066700117667, 'batch_norm': False, 'sage_aggr': 'max', 'sage_normalize': True, 'sage_project': False, 'lr': 0.0001507790931274098, 'weight_decay': 6.294064549790833e-05, 'epochs': 183, 'loss': 'mae', 'optimizer': 'adam', 'graph_mode': 'cutoff', 'cutoff': 0.8090735596120795, 'grm_norm': 'gcn', 'self_loops': False, 'use_snp_selection': True, 'num_snps': 16078, 'graphsage_batch_size': 256}. Best is trial 46 with value: 0.24263623152047006.
[I 2025-12-05 18:31:40,177] Trial 60 finished with value: 0.2299729020427713 and parameters: {'model_type': 'graphsage', 'hidden_dims': '[256, 128]', 'dropout': 0.3803471132938309, 'batch_norm': False, 'sage_aggr': 'max', 'sage_normalize': True, 'sage_project': False, 'lr': 7.911615140610468e-06, 'weight_decay': 1.694404503366343e-05, 'epochs': 159, 'loss': 'mae', 'optimizer': 'adam', 'graph_mode': 'cutoff', 'cutoff': 0.7512674706518392, 'grm_norm': 'gcn', 'self_loops': False, 'use_snp_selection': True, 'num_snps': 26650, 'graphsage_batch_size': 256}. Best is trial 46 with value: 0.24263623152047006.
[I 2025-12-05 18:32:27,120] Trial 61 finished with value: 0.2263100821243929 and parameters: {'model_type': 'graphsage', 'hidden_dims': '[256, 128]', 'dropout': 0.38210774261178876, 'batch_norm': False, 'sage_aggr': 'max', 'sage_normalize': True, 'sage_project': False, 'lr': 6.49939249374365e-06, 'weight_decay': 1.2721466886033199e-05, 'epochs': 203, 'loss': 'mae', 'optimizer': 'adam', 'graph_mode': 'cutoff', 'cutoff': 0.8775478340227209, 'grm_norm': 'gcn', 'self_loops': False, 'use_snp_selection': True, 'num_snps': 26194, 'graphsage_batch_size': 256}. Best is trial 46 with value: 0.24263623152047006.
[I 2025-12-05 18:33:01,232] Trial 62 finished with value: 0.2151384163397309 and parameters: {'model_type': 'graphsage', 'hidden_dims': '[256, 128]', 'dropout': 0.3582480894293988, 'batch_norm': False, 'sage_aggr': 'max', 'sage_normalize': True, 'sage_project': False, 'lr': 4.411186773403743e-06, 'weight_decay': 2.4647055526413037e-05, 'epochs': 159, 'loss': 'mae', 'optimizer': 'adam', 'graph_mode': 'cutoff', 'cutoff': 0.7873063403888939, 'grm_norm': 'gcn', 'self_loops': False, 'use_snp_selection': True, 'num_snps': 19038, 'graphsage_batch_size': 256}. Best is trial 46 with value: 0.24263623152047006.
