[I 2025-12-05 20:55:46,134] Trial 54 finished with value: 0.16967540370635495 and parameters: {'model_type': 'graphsage', 'hidden_dims': '[512, 64]', 'dropout': 0.5647538310678434, 'batch_norm': True, 'sage_aggr': 'max', 'sage_normalize': True, 'sage_project': False, 'lr': 0.0008041409313846862, 'weight_decay': 3.629982278004643e-05, 'epochs': 239, 'loss': 'mae', 'optimizer': 'adam', 'graph_mode': 'cutoff', 'cutoff': 0.8595316537260614, 'grm_norm': 'gcn', 'self_loops': False, 'use_snp_selection': True, 'num_snps': 2778, 'graphsage_batch_size': 8}. Best is trial 46 with value: 0.2355210709696963.
[I 2025-12-05 20:56:34,408] Trial 55 finished with value: 0.22967574142103317 and parameters: {'model_type': 'graphsage', 'hidden_dims': '[512, 64]', 'dropout': 0.560806505725236, 'batch_norm': True, 'sage_aggr': 'max', 'sage_normalize': True, 'sage_project': False, 'lr': 0.0004038653684420596, 'weight_decay': 8.082107981578994e-05, 'epochs': 237, 'loss': 'mae', 'optimizer': 'adam', 'graph_mode': 'cutoff', 'cutoff': 0.8710897340497444, 'grm_norm': 'gcn', 'self_loops': False, 'use_snp_selection': True, 'num_snps': 15506, 'graphsage_batch_size': 8}. Best is trial 46 with value: 0.2355210709696963.
[I 2025-12-05 20:57:29,959] Trial 56 finished with value: 0.22044705367630052 and parameters: {'model_type': 'graphsage', 'hidden_dims': '[512, 64]', 'dropout': 0.5976690464270729, 'batch_norm': True, 'sage_aggr': 'max', 'sage_normalize': True, 'sage_project': False, 'lr': 0.0004949070605854691, 'weight_decay': 9.629902369737523e-05, 'epochs': 228, 'loss': 'mae', 'optimizer': 'adam', 'graph_mode': 'cutoff', 'cutoff': 0.897209227365912, 'grm_norm': 'gcn', 'self_loops': False, 'use_snp_selection': True, 'num_snps': 19629, 'graphsage_batch_size': 8}. Best is trial 46 with value: 0.2355210709696963.
[I 2025-12-05 20:58:11,048] Trial 57 finished with value: 0.2320927871529233 and parameters: {'model_type': 'graphsage', 'hidden_dims': '[512, 64]', 'dropout': 0.5598754431672952, 'batch_norm': True, 'sage_aggr': 'max', 'sage_normalize': True, 'sage_project': False, 'lr': 0.0004224499565273439, 'weight_decay': 9.940586595776562e-05, 'epochs': 243, 'loss': 'mae', 'optimizer': 'adam', 'graph_mode': 'cutoff', 'cutoff': 0.8700756665958561, 'grm_norm': 'gcn', 'self_loops': False, 'use_snp_selection': True, 'num_snps': 11764, 'graphsage_batch_size': 8}. Best is trial 46 with value: 0.2355210709696963.
[I 2025-12-05 20:58:41,822] Trial 58 finished with value: 0.20196760216503792 and parameters: {'model_type': 'graphsage', 'hidden_dims': '[512, 64]', 'dropout': 0.5722674633734959, 'batch_norm': True, 'sage_aggr': 'max', 'sage_normalize': True, 'sage_project': False, 'lr': 0.0005394265650791908, 'weight_decay': 7.929049892547595e-05, 'epochs': 68, 'loss': 'mae', 'optimizer': 'adam', 'graph_mode': 'knn', 'knn_k': 10, 'weighted_edges': True, 'symmetrize_mode': 'mutual', 'self_loops': False, 'use_snp_selection': True, 'num_snps': 13920, 'graphsage_batch_size': 128}. Best is trial 46 with value: 0.2355210709696963.
[I 2025-12-05 20:59:11,835] Trial 59 finished with value: 0.20974263617695788 and parameters: {'model_type': 'graphsage', 'hidden_dims': '[512, 64]', 'dropout': 0.5696594356786243, 'batch_norm': True, 'sage_aggr': 'max', 'sage_normalize': True, 'sage_project': False, 'lr': 0.0003352736057632735, 'weight_decay': 0.00025406996736307923, 'epochs': 245, 'loss': 'mae', 'optimizer': 'adam', 'graph_mode': 'cutoff', 'cutoff': 0.7203185538912144, 'grm_norm': 'gcn', 'self_loops': False, 'use_snp_selection': True, 'num_snps': 6514, 'graphsage_batch_size': 8}. Best is trial 46 with value: 0.2355210709696963.
[I 2025-12-05 21:00:09,006] Trial 60 finished with value: 0.22216148832368338 and parameters: {'model_type': 'graphsage', 'hidden_dims': '[512, 64]', 'dropout': 0.47710403156288284, 'batch_norm': True, 'sage_aggr': 'max', 'sage_normalize': True, 'sage_project': False, 'lr': 0.0004234506233603315, 'weight_decay': 8.895584907802285e-06, 'epochs': 232, 'loss': 'mae', 'optimizer': 'adam', 'graph_mode': 'cutoff', 'cutoff': 0.8157763811725662, 'grm_norm': 'gcn', 'self_loops': False, 'use_snp_selection': True, 'num_snps': 19999, 'graphsage_batch_size': 8}. Best is trial 46 with value: 0.2355210709696963.
[I 2025-12-05 21:00:48,687] Trial 61 finished with value: 0.2250256247321089 and parameters: {'model_type': 'graphsage', 'hidden_dims': '[512, 64]', 'dropout': 0.5446684928996222, 'batch_norm': True, 'sage_aggr': 'max', 'sage_normalize': True, 'sage_project': False, 'lr': 0.0002153528775439473, 'weight_decay': 0.00020289807513223398, 'epochs': 243, 'loss': 'mae', 'optimizer': 'adam', 'graph_mode': 'cutoff', 'cutoff': 0.8632664117233179, 'grm_norm': 'gcn', 'self_loops': False, 'use_snp_selection': True, 'num_snps': 11081, 'graphsage_batch_size': 8}. Best is trial 46 with value: 0.2355210709696963.
[I 2025-12-05 21:01:31,052] Trial 62 finished with value: 0.2317726062359306 and parameters: {'model_type': 'graphsage', 'hidden_dims': '[512, 64]', 'dropout': 0.4991195899134534, 'batch_norm': True, 'sage_aggr': 'max', 'sage_normalize': True, 'sage_project': False, 'lr': 0.0006519552598462663, 'weight_decay': 2.2767372785829004e-05, 'epochs': 222, 'loss': 'mae', 'optimizer': 'adam', 'graph_mode': 'cutoff', 'cutoff': 0.8704653978667233, 'grm_norm': 'gcn', 'self_loops': False, 'use_snp_selection': True, 'num_snps': 13481, 'graphsage_batch_size': 8}. Best is trial 46 with value: 0.2355210709696963.
[I 2025-12-05 21:02:17,262] Trial 63 finished with value: 0.23771832062188675 and parameters: {'model_type': 'graphsage', 'hidden_dims': '[512, 64]', 'dropout': 0.5015839257130904, 'batch_norm': True, 'sage_aggr': 'max', 'sage_normalize': True, 'sage_project': False, 'lr': 0.0009723186085270942, 'weight_decay': 2.4161685828441345e-05, 'epochs': 223, 'loss': 'mae', 'optimizer': 'adam', 'graph_mode': 'cutoff', 'cutoff': 0.8741418765527418, 'grm_norm': 'gcn', 'self_loops': False, 'use_snp_selection': True, 'num_snps': 15316, 'graphsage_batch_size': 8}. Best is trial 63 with value: 0.23771832062188675.
[I 2025-12-05 21:02:46,467] Trial 64 finished with value: 0.21105865994260903 and parameters: {'model_type': 'graphsage', 'hidden_dims': '[512, 64]', 'dropout': 0.5045406919203239, 'batch_norm': True, 'sage_aggr': 'max', 'sage_normalize': True, 'sage_project': False, 'lr': 0.0009564258072630269, 'weight_decay': 8.388567809521815e-05, 'epochs': 226, 'loss': 'mae', 'optimizer': 'adam', 'graph_mode': 'cutoff', 'cutoff': 0.8733645220162918, 'grm_norm': 'gcn', 'self_loops': False, 'use_snp_selection': True, 'num_snps': 6897, 'graphsage_batch_size': 8}. Best is trial 63 with value: 0.23771832062188675.
[I 2025-12-05 21:03:34,933] Trial 65 finished with value: 0.2287135738189859 and parameters: {'model_type': 'graphsage', 'hidden_dims': '[512, 128]', 'dropout': 0.5549345456394482, 'batch_norm': True, 'sage_aggr': 'max', 'sage_normalize': True, 'sage_project': False, 'lr': 0.0006293107612156215, 'weight_decay': 2.2555921157842793e-05, 'epochs': 235, 'loss': 'mae', 'optimizer': 'adam', 'graph_mode': 'cutoff', 'cutoff': 0.8305242185897374, 'grm_norm': 'gcn', 'self_loops': False, 'use_snp_selection': True, 'num_snps': 15361, 'graphsage_batch_size': 8}. Best is trial 63 with value: 0.23771832062188675.
[I 2025-12-05 21:03:58,471] Trial 66 finished with value: 0.21309689439970753 and parameters: {'model_type': 'graphsage', 'hidden_dims': '[512, 64]', 'dropout': 0.4889093887460434, 'batch_norm': True, 'sage_aggr': 'max', 'sage_normalize': True, 'sage_project': False, 'lr': 0.0003551439020112332, 'weight_decay': 6.249044382045834e-05, 'epochs': 117, 'loss': 'mae', 'optimizer': 'adam', 'graph_mode': 'cutoff', 'cutoff': 0.8003922333247805, 'grm_norm': 'gcn', 'self_loops': False, 'use_snp_selection': True, 'num_snps': 7745, 'graphsage_batch_size': 8}. Best is trial 63 with value: 0.23771832062188675.
[I 2025-12-05 21:04:38,477] Trial 67 finished with value: 0.21936530931859838 and parameters: {'model_type': 'graphsage', 'hidden_dims': '[256, 128, 64]', 'dropout': 0.5827112702180791, 'batch_norm': True, 'sage_aggr': 'max', 'sage_normalize': True, 'sage_project': False, 'lr': 0.000640284483549045, 'weight_decay': 0.00015525226344586542, 'epochs': 224, 'loss': 'mae', 'optimizer': 'adam', 'graph_mode': 'cutoff', 'cutoff': 0.8981191426183097, 'grm_norm': 'cosine_then_gcn', 'self_loops': False, 'use_snp_selection': True, 'num_snps': 19210, 'graphsage_batch_size': 256}. Best is trial 63 with value: 0.23771832062188675.
[I 2025-12-05 21:05:24,774] Trial 68 finished with value: 0.22228757343344596 and parameters: {'model_type': 'graphsage', 'hidden_dims': '[512, 64]', 'dropout': 0.45846083061866505, 'batch_norm': True, 'sage_aggr': 'max', 'sage_normalize': True, 'sage_project': False, 'lr': 0.0007109629951515698, 'weight_decay': 0.00011446995992868208, 'epochs': 250, 'loss': 'mae', 'optimizer': 'adam', 'graph_mode': 'cutoff', 'cutoff': 0.8673322455494438, 'grm_norm': 'cosine', 'self_loops': False, 'use_snp_selection': True, 'num_snps': 13675, 'graphsage_batch_size': 8}. Best is trial 63 with value: 0.23771832062188675.
[I 2025-12-05 21:05:50,756] Trial 69 finished with value: 0.20852579107087651 and parameters: {'model_type': 'graphsage', 'hidden_dims': '[512, 64]', 'dropout': 0.5218832603128198, 'batch_norm': True, 'sage_aggr': 'max', 'sage_normalize': True, 'sage_project': False, 'lr': 0.000963925045287173, 'weight_decay': 2.5941401561019816e-05, 'epochs': 232, 'loss': 'mae', 'optimizer': 'adam', 'graph_mode': 'cutoff', 'cutoff': 0.8241814422698879, 'grm_norm': 'gcn', 'self_loops': False, 'use_snp_selection': True, 'num_snps': 5105, 'graphsage_batch_size': 8}. Best is trial 63 with value: 0.23771832062188675.
[I 2025-12-05 21:06:21,979] Trial 70 finished with value: 0.22431513691745103 and parameters: {'model_type': 'graphsage', 'hidden_dims': '[128, 64]', 'dropout': 0.5525284801333011, 'batch_norm': True, 'sage_aggr': 'max', 'sage_normalize': True, 'sage_project': False, 'lr': 0.0003839386648720832, 'weight_decay': 3.5109489865182962e-06, 'epochs': 216, 'loss': 'mae', 'optimizer': 'adam', 'graph_mode': 'cutoff', 'cutoff': 0.8468257620159849, 'grm_norm': 'gcn', 'self_loops': False, 'use_snp_selection': True, 'num_snps': 21645, 'graphsage_batch_size': 512}. Best is trial 63 with value: 0.23771832062188675.
[I 2025-12-05 21:07:12,713] Trial 71 finished with value: 0.2281803746247487 and parameters: {'model_type': 'graphsage', 'hidden_dims': '[512, 64]', 'dropout': 0.5186577085809285, 'batch_norm': True, 'sage_aggr': 'max', 'sage_normalize': True, 'sage_project': False, 'lr': 0.0002661306409406946, 'weight_decay': 9.670996475864967e-06, 'epochs': 241, 'loss': 'mae', 'optimizer': 'adam', 'graph_mode': 'cutoff', 'cutoff': 0.781683523669586, 'grm_norm': 'gcn', 'self_loops': False, 'use_snp_selection': True, 'num_snps': 16237, 'graphsage_batch_size': 16}. Best is trial 63 with value: 0.23771832062188675.
[I 2025-12-05 21:07:52,866] Trial 72 finished with value: 0.20967754361896973 and parameters: {'model_type': 'graphsage', 'hidden_dims': '[512, 64]', 'dropout': 0.5794364717091134, 'batch_norm': True, 'sage_aggr': 'max', 'sage_normalize': True, 'sage_project': False, 'lr': 0.0005126579354135846, 'weight_decay': 5.528926686404916e-05, 'epochs': 221, 'loss': 'mae', 'optimizer': 'adam', 'graph_mode': 'cutoff', 'cutoff': 0.459919379407866, 'grm_norm': 'gcn', 'self_loops': False, 'use_snp_selection': True, 'num_snps': 9229, 'graphsage_batch_size': 128}. Best is trial 63 with value: 0.23771832062188675.
[I 2025-12-05 21:08:33,895] Trial 73 finished with value: 0.22830786969476874 and parameters: {'model_type': 'graphsage', 'hidden_dims': '[512, 64]', 'dropout': 0.4985347198771767, 'batch_norm': True, 'sage_aggr': 'max', 'sage_normalize': True, 'sage_project': False, 'lr': 0.00016864971432275187, 'weight_decay': 1.5685029750818664e-05, 'epochs': 214, 'loss': 'mae', 'optimizer': 'adam', 'graph_mode': 'cutoff', 'cutoff': 0.8044244062602753, 'grm_norm': 'gcn', 'self_loops': False, 'use_snp_selection': True, 'num_snps': 13162, 'graphsage_batch_size': 8}. Best is trial 63 with value: 0.23771832062188675.
[I 2025-12-05 21:09:24,579] Trial 74 finished with value: 0.22493107723874903 and parameters: {'model_type': 'graphsage', 'hidden_dims': '[512, 64]', 'dropout': 0.4518775777715125, 'batch_norm': True, 'sage_aggr': 'max', 'sage_normalize': True, 'sage_project': False, 'lr': 0.0007545582683973533, 'weight_decay': 7.388201705995607e-06, 'epochs': 230, 'loss': 'mae', 'optimizer': 'adam', 'graph_mode': 'cutoff', 'cutoff': 0.7512322322980514, 'grm_norm': 'gcn', 'self_loops': False, 'use_snp_selection': True, 'num_snps': 16464, 'graphsage_batch_size': 8}. Best is trial 63 with value: 0.23771832062188675.
[I 2025-12-05 21:10:56,181] Trial 75 finished with value: 0.2141611103448006 and parameters: {'model_type': 'graphsage', 'hidden_dims': '[512, 64]', 'dropout': 0.5470910840943517, 'batch_norm': True, 'sage_aggr': 'max', 'sage_normalize': True, 'sage_project': False, 'lr': 0.00044627338319379794, 'weight_decay': 2.2411499635375014e-05, 'epochs': 246, 'loss': 'mse', 'optimizer': 'adam', 'graph_mode': 'cutoff', 'cutoff': 0.8725079175591578, 'grm_norm': 'gcn', 'self_loops': False, 'use_snp_selection': True, 'num_snps': 33699, 'graphsage_batch_size': 8}. Best is trial 63 with value: 0.23771832062188675.
[I 2025-12-05 21:11:32,408] Trial 76 finished with value: 0.22855925759875323 and parameters: {'model_type': 'graphsage', 'hidden_dims': '[512, 128]', 'dropout': 0.4840843073166987, 'batch_norm': True, 'sage_aggr': 'max', 'sage_normalize': True, 'sage_project': False, 'lr': 0.0002877775522638273, 'weight_decay': 1.2471936452800713e-05, 'epochs': 225, 'loss': 'mae', 'optimizer': 'adam', 'graph_mode': 'cutoff', 'cutoff': 0.782964258172084, 'grm_norm': 'cosine_then_gcn', 'self_loops': False, 'use_snp_selection': True, 'num_snps': 9898, 'graphsage_batch_size': 256}. Best is trial 63 with value: 0.23771832062188675.
[I 2025-12-05 21:12:25,021] Trial 77 finished with value: 0.22847071394575552 and parameters: {'model_type': 'graphsage', 'hidden_dims': '[512, 64]', 'dropout': 0.4383229458609454, 'batch_norm': True, 'sage_aggr': 'max', 'sage_normalize': True, 'sage_project': False, 'lr': 0.00012509998018103724, 'weight_decay': 1.853694246864323e-05, 'epochs': 236, 'loss': 'mae', 'optimizer': 'adam', 'graph_mode': 'cutoff', 'cutoff': 0.8371719678422664, 'grm_norm': 'cosine', 'self_loops': False, 'use_snp_selection': True, 'num_snps': 17301, 'graphsage_batch_size': 8}. Best is trial 63 with value: 0.23771832062188675.
[I 2025-12-05 21:13:17,244] Trial 78 finished with value: 0.1776433494634704 and parameters: {'model_type': 'graphsage', 'hidden_dims': '[256, 128, 64]', 'dropout': 0.41567328024101885, 'batch_norm': True, 'sage_aggr': 'max', 'sage_normalize': True, 'sage_project': False, 'lr': 8.000225999813965e-05, 'weight_decay': 4.147955417377078e-05, 'epochs': 194, 'loss': 'mae', 'optimizer': 'adam', 'graph_mode': 'knn', 'knn_k': 8, 'weighted_edges': False, 'symmetrize_mode': 'union', 'self_loops': False, 'use_snp_selection': True, 'num_snps': 12842, 'graphsage_batch_size': 8}. Best is trial 63 with value: 0.23771832062188675.
[I 2025-12-05 21:13:49,622] Trial 79 finished with value: 0.20761271067236828 and parameters: {'model_type': 'graphsage', 'hidden_dims': '[512, 64]', 'dropout': 0.4676790424060463, 'batch_norm': True, 'sage_aggr': 'max', 'sage_normalize': True, 'sage_project': False, 'lr': 0.00020992593737404763, 'weight_decay': 0.00029557609004156245, 'epochs': 81, 'loss': 'mae', 'optimizer': 'adam', 'graph_mode': 'cutoff', 'cutoff': 0.36697748220502135, 'grm_norm': 'gcn', 'self_loops': False, 'use_snp_selection': True, 'num_snps': 15456, 'graphsage_batch_size': 512}. Best is trial 63 with value: 0.23771832062188675.
[I 2025-12-05 21:14:17,011] Trial 80 finished with value: 0.20593339591869686 and parameters: {'model_type': 'graphsage', 'hidden_dims': '[512, 64]', 'dropout': 0.5864900771654554, 'batch_norm': True, 'sage_aggr': 'max', 'sage_normalize': True, 'sage_project': False, 'lr': 0.0005845542162485575, 'weight_decay': 2.9181850744192576e-05, 'epochs': 244, 'loss': 'mae', 'optimizer': 'adam', 'graph_mode': 'cutoff', 'cutoff': 0.8799228451892698, 'grm_norm': 'gcn', 'self_loops': False, 'use_snp_selection': True, 'num_snps': 5504, 'graphsage_batch_size': 8}. Best is trial 63 with value: 0.23771832062188675.
[I 2025-12-05 21:15:04,219] Trial 81 finished with value: 0.23164095657432543 and parameters: {'model_type': 'graphsage', 'hidden_dims': '[512, 128]', 'dropout': 0.5601944558693684, 'batch_norm': True, 'sage_aggr': 'max', 'sage_normalize': True, 'sage_project': False, 'lr': 0.000593901803669546, 'weight_decay': 2.180717815869705e-05, 'epochs': 235, 'loss': 'mae', 'optimizer': 'adam', 'graph_mode': 'cutoff', 'cutoff': 0.8237793890985348, 'grm_norm': 'gcn', 'self_loops': False, 'use_snp_selection': True, 'num_snps': 14811, 'graphsage_batch_size': 8}. Best is trial 63 with value: 0.23771832062188675.
[I 2025-12-05 21:15:59,408] Trial 82 finished with value: 0.22850647653469108 and parameters: {'model_type': 'graphsage', 'hidden_dims': '[512, 128]', 'dropout': 0.560986219608206, 'batch_norm': True, 'sage_aggr': 'max', 'sage_normalize': True, 'sage_project': False, 'lr': 0.0009308221115980313, 'weight_decay': 5.7077269222362566e-05, 'epochs': 234, 'loss': 'mae', 'optimizer': 'adam', 'graph_mode': 'cutoff', 'cutoff': 0.8150687301388675, 'grm_norm': 'gcn', 'self_loops': False, 'use_snp_selection': True, 'num_snps': 19003, 'graphsage_batch_size': 8}. Best is trial 63 with value: 0.23771832062188675.
[I 2025-12-05 21:16:43,922] Trial 83 finished with value: 0.231458024817247 and parameters: {'model_type': 'graphsage', 'hidden_dims': '[512, 128]', 'dropout': 0.5395092362459433, 'batch_norm': True, 'sage_aggr': 'max', 'sage_normalize': True, 'sage_project': False, 'lr': 0.0004295065714497657, 'weight_decay': 1.1260295330067568e-05, 'epochs': 222, 'loss': 'mae', 'optimizer': 'adam', 'graph_mode': 'cutoff', 'cutoff': 0.8454468736149761, 'grm_norm': 'gcn', 'self_loops': False, 'use_snp_selection': True, 'num_snps': 14262, 'graphsage_batch_size': 16}. Best is trial 63 with value: 0.23771832062188675.
[I 2025-12-05 21:17:16,626] Trial 84 finished with value: 0.22073278523879414 and parameters: {'model_type': 'graphsage', 'hidden_dims': '[512, 128]', 'dropout': 0.5404713940005987, 'batch_norm': True, 'sage_aggr': 'max', 'sage_normalize': True, 'sage_project': False, 'lr': 0.00040398431762396833, 'weight_decay': 1.1092337920063132e-05, 'epochs': 210, 'loss': 'mae', 'optimizer': 'adam', 'graph_mode': 'cutoff', 'cutoff': 0.8436962281801687, 'grm_norm': 'gcn', 'self_loops': False, 'use_snp_selection': True, 'num_snps': 8893, 'graphsage_batch_size': 16}. Best is trial 63 with value: 0.23771832062188675.
[I 2025-12-05 21:17:55,651] Trial 85 finished with value: 0.22829266810443283 and parameters: {'model_type': 'graphsage', 'hidden_dims': '[512, 128]', 'dropout': 0.5251675069468424, 'batch_norm': True, 'sage_aggr': 'max', 'sage_normalize': True, 'sage_project': False, 'lr': 0.0003301440476779347, 'weight_decay': 1.8076253192973316e-05, 'epochs': 228, 'loss': 'mae', 'optimizer': 'adam', 'graph_mode': 'cutoff', 'cutoff': 0.8811675688257429, 'grm_norm': 'gcn', 'self_loops': False, 'use_snp_selection': True, 'num_snps': 11278, 'graphsage_batch_size': 16}. Best is trial 63 with value: 0.23771832062188675.
[I 2025-12-05 21:19:02,181] Trial 86 finished with value: 0.22163045744132415 and parameters: {'model_type': 'graphsage', 'hidden_dims': '[512, 128]', 'dropout': 0.5112017997441811, 'batch_norm': True, 'sage_aggr': 'max', 'sage_normalize': True, 'sage_project': False, 'lr': 0.000672161842850029, 'weight_decay': 2.824877441524539e-05, 'epochs': 240, 'loss': 'mse', 'optimizer': 'adam', 'graph_mode': 'cutoff', 'cutoff': 0.8516292575528966, 'grm_norm': 'gcn', 'self_loops': False, 'use_snp_selection': True, 'num_snps': 22983, 'graphsage_batch_size': 16}. Best is trial 63 with value: 0.23771832062188675.
[I 2025-12-05 21:19:50,236] Trial 87 finished with value: 0.23272507842942153 and parameters: {'model_type': 'graphsage', 'hidden_dims': '[512, 128]', 'dropout': 0.49451343142456594, 'batch_norm': True, 'sage_aggr': 'max', 'sage_normalize': True, 'sage_project': False, 'lr': 0.0004891704698144737, 'weight_decay': 7.278771930267659e-05, 'epochs': 250, 'loss': 'mae', 'optimizer': 'adam', 'graph_mode': 'cutoff', 'cutoff': 0.8244315237397922, 'grm_norm': 'gcn', 'self_loops': False, 'use_snp_selection': True, 'num_snps': 14295, 'graphsage_batch_size': 8}. Best is trial 63 with value: 0.23771832062188675.
[I 2025-12-05 21:20:34,681] Trial 88 finished with value: 0.22853897661610684 and parameters: {'model_type': 'graphsage', 'hidden_dims': '[512, 128]', 'dropout': 0.4946710487916958, 'batch_norm': True, 'sage_aggr': 'max', 'sage_normalize': True, 'sage_project': False, 'lr': 0.0004888845826984224, 'weight_decay': 6.800304658407577e-05, 'epochs': 221, 'loss': 'mae', 'optimizer': 'adam', 'graph_mode': 'cutoff', 'cutoff': 0.8220674777609972, 'grm_norm': 'gcn', 'self_loops': False, 'use_snp_selection': True, 'num_snps': 14279, 'graphsage_batch_size': 16}. Best is trial 63 with value: 0.23771832062188675.
[I 2025-12-05 21:21:29,927] Trial 89 finished with value: 0.23301066010279742 and parameters: {'model_type': 'graphsage', 'hidden_dims': '[512, 128]', 'dropout': 0.5912011853531336, 'batch_norm': True, 'sage_aggr': 'max', 'sage_normalize': True, 'sage_project': False, 'lr': 0.0005753105982713609, 'weight_decay': 0.00010069210924347625, 'epochs': 245, 'loss': 'mae', 'optimizer': 'adam', 'graph_mode': 'cutoff', 'cutoff': 0.7660707408054228, 'grm_norm': 'cosine_then_gcn', 'self_loops': False, 'use_snp_selection': True, 'num_snps': 17855, 'graphsage_batch_size': 8}. Best is trial 63 with value: 0.23771832062188675.
