[I 2025-12-06 10:44:28,843] Trial 91 finished with value: 0.1996639145787064 and parameters: {'model_type': 'graphsage', 'hidden_dims': '[512, 64]', 'dropout': 0.37540581080634366, 'batch_norm': True, 'sage_aggr': 'mean', 'sage_normalize': False, 'sage_project': False, 'lr': 0.0001017371735566635, 'weight_decay': 0.0006593647052406634, 'epochs': 159, 'loss': 'mae', 'optimizer': 'adam', 'graph_mode': 'cutoff', 'cutoff': 0.7811698073051555, 'grm_norm': 'none', 'self_loops': False, 'use_snp_selection': False, 'graphsage_batch_size': 32}. Best is trial 19 with value: 0.22264005015541502.
[I 2025-12-06 10:46:11,014] Trial 92 finished with value: 0.20177212098997527 and parameters: {'model_type': 'graphsage', 'hidden_dims': '[512, 64]', 'dropout': 0.3866755265175342, 'batch_norm': True, 'sage_aggr': 'mean', 'sage_normalize': False, 'sage_project': False, 'lr': 6.395050336479941e-05, 'weight_decay': 0.0008563503805000909, 'epochs': 173, 'loss': 'mae', 'optimizer': 'adam', 'graph_mode': 'cutoff', 'cutoff': 0.7722332703192587, 'grm_norm': 'none', 'self_loops': False, 'use_snp_selection': False, 'graphsage_batch_size': 32}. Best is trial 19 with value: 0.22264005015541502.
[I 2025-12-06 10:48:01,737] Trial 93 finished with value: 0.20661414802969272 and parameters: {'model_type': 'graphsage', 'hidden_dims': '[512, 64]', 'dropout': 0.3462224756392688, 'batch_norm': True, 'sage_aggr': 'mean', 'sage_normalize': False, 'sage_project': False, 'lr': 0.00015343706406572405, 'weight_decay': 0.0006115001198629785, 'epochs': 189, 'loss': 'mae', 'optimizer': 'adam', 'graph_mode': 'cutoff', 'cutoff': 0.7610750585386935, 'grm_norm': 'none', 'self_loops': False, 'use_snp_selection': False, 'graphsage_batch_size': 32}. Best is trial 19 with value: 0.22264005015541502.
[I 2025-12-06 10:49:43,357] Trial 94 finished with value: 0.2057755876895852 and parameters: {'model_type': 'graphsage', 'hidden_dims': '[512, 64]', 'dropout': 0.30277128015511756, 'batch_norm': True, 'sage_aggr': 'mean', 'sage_normalize': False, 'sage_project': False, 'lr': 5.195695048667608e-05, 'weight_decay': 0.000465212297208591, 'epochs': 172, 'loss': 'mae', 'optimizer': 'adam', 'graph_mode': 'cutoff', 'cutoff': 0.8161977667702736, 'grm_norm': 'none', 'self_loops': False, 'use_snp_selection': False, 'graphsage_batch_size': 32}. Best is trial 19 with value: 0.22264005015541502.
[I 2025-12-06 10:50:33,895] Trial 95 finished with value: 0.21167812169086173 and parameters: {'model_type': 'graphsage', 'hidden_dims': '[256, 128, 64]', 'dropout': 0.4364932654804608, 'batch_norm': True, 'sage_aggr': 'mean', 'sage_normalize': False, 'sage_project': False, 'lr': 5.6683227676881674e-05, 'weight_decay': 0.0007644729236786753, 'epochs': 141, 'loss': 'mae', 'optimizer': 'adam', 'graph_mode': 'cutoff', 'cutoff': 0.874328641928451, 'grm_norm': 'gcn', 'self_loops': False, 'use_snp_selection': False, 'graphsage_batch_size': 8}. Best is trial 19 with value: 0.22264005015541502.
[I 2025-12-06 10:51:14,938] Trial 96 finished with value: 0.19017944113883128 and parameters: {'model_type': 'graphsage', 'hidden_dims': '[256, 128, 64]', 'dropout': 0.43747836257902434, 'batch_norm': True, 'sage_aggr': 'mean', 'sage_normalize': False, 'sage_project': False, 'lr': 1.9538361923242137e-05, 'weight_decay': 0.0009464013330817653, 'epochs': 110, 'loss': 'mse', 'optimizer': 'adam', 'graph_mode': 'cutoff', 'cutoff': 0.8729364648863155, 'grm_norm': 'gcn', 'self_loops': False, 'use_snp_selection': False, 'graphsage_batch_size': 8}. Best is trial 19 with value: 0.22264005015541502.
[I 2025-12-06 10:51:53,616] Trial 97 finished with value: 0.1989754181550453 and parameters: {'model_type': 'graphsage', 'hidden_dims': '[256, 128, 64]', 'dropout': 0.45993486280484763, 'batch_norm': True, 'sage_aggr': 'mean', 'sage_normalize': True, 'sage_project': False, 'lr': 8.341658530919864e-05, 'weight_decay': 5.119259448429357e-06, 'epochs': 142, 'loss': 'mae', 'optimizer': 'adam', 'graph_mode': 'cutoff', 'cutoff': 0.8495732699633058, 'grm_norm': 'gcn', 'self_loops': False, 'use_snp_selection': True, 'num_snps': 27559, 'graphsage_batch_size': 8}. Best is trial 19 with value: 0.22264005015541502.
[I 2025-12-06 10:52:44,536] Trial 98 finished with value: 0.20426158834591698 and parameters: {'model_type': 'graphsage', 'hidden_dims': '[256, 128, 64]', 'dropout': 0.4227020055513077, 'batch_norm': False, 'sage_aggr': 'mean', 'sage_normalize': False, 'sage_project': False, 'lr': 1.2621943957350308e-05, 'weight_decay': 1.9338509918605592e-07, 'epochs': 143, 'loss': 'mae', 'optimizer': 'adam', 'graph_mode': 'cutoff', 'cutoff': 0.8831414825434253, 'grm_norm': 'gcn', 'self_loops': False, 'use_snp_selection': False, 'graphsage_batch_size': 8}. Best is trial 19 with value: 0.22264005015541502.
[I 2025-12-06 10:53:30,611] Trial 99 finished with value: 0.19458270665085026 and parameters: {'model_type': 'graphsage', 'hidden_dims': '[256, 128, 64]', 'dropout': 0.4484323135055944, 'batch_norm': True, 'sage_aggr': 'mean', 'sage_normalize': False, 'sage_project': False, 'lr': 3.3691099646185495e-05, 'weight_decay': 3.0052712446007775e-07, 'epochs': 124, 'loss': 'mae', 'optimizer': 'adam', 'graph_mode': 'cutoff', 'cutoff': 0.6361238604774314, 'grm_norm': 'gcn', 'self_loops': False, 'use_snp_selection': False, 'graphsage_batch_size': 8}. Best is trial 19 with value: 0.22264005015541502.
[I 2025-12-06 10:54:50,428] Trial 100 finished with value: 0.16227760459463134 and parameters: {'model_type': 'graphsage', 'hidden_dims': '[256, 128]', 'dropout': 0.4846838609322776, 'batch_norm': True, 'sage_aggr': 'max', 'sage_normalize': False, 'sage_project': False, 'lr': 0.0008695674706345902, 'weight_decay': 0.00026806354772787475, 'epochs': 131, 'loss': 'mae', 'optimizer': 'adam', 'graph_mode': 'knn', 'knn_k': 5, 'weighted_edges': False, 'symmetrize_mode': 'union', 'self_loops': False, 'use_snp_selection': False, 'graphsage_batch_size': 128}. Best is trial 19 with value: 0.22264005015541502.
[I 2025-12-06 10:55:40,060] Trial 101 finished with value: 0.2058202668025924 and parameters: {'model_type': 'graphsage', 'hidden_dims': '[256, 128, 64]', 'dropout': 0.3989973018672883, 'batch_norm': True, 'sage_aggr': 'mean', 'sage_normalize': False, 'sage_project': False, 'lr': 5.790737098437974e-05, 'weight_decay': 0.0005260489146706165, 'epochs': 138, 'loss': 'mae', 'optimizer': 'adam', 'graph_mode': 'cutoff', 'cutoff': 0.8048921160333564, 'grm_norm': 'none', 'self_loops': False, 'use_snp_selection': False, 'graphsage_batch_size': 32}. Best is trial 19 with value: 0.22264005015541502.
[I 2025-12-06 10:57:26,941] Trial 102 finished with value: 0.20619703785976795 and parameters: {'model_type': 'graphsage', 'hidden_dims': '[512, 256]', 'dropout': 0.41100469421637814, 'batch_norm': True, 'sage_aggr': 'mean', 'sage_normalize': False, 'sage_project': False, 'lr': 4.422986446076114e-05, 'weight_decay': 0.000777240958274483, 'epochs': 181, 'loss': 'mae', 'optimizer': 'adam', 'graph_mode': 'cutoff', 'cutoff': 0.7883632516645696, 'grm_norm': 'gcn', 'self_loops': False, 'use_snp_selection': False, 'graphsage_batch_size': 32}. Best is trial 19 with value: 0.22264005015541502.
[I 2025-12-06 10:58:04,505] Trial 103 finished with value: 0.20868504519940717 and parameters: {'model_type': 'graphsage', 'hidden_dims': '[128, 64]', 'dropout': 0.42943746033715224, 'batch_norm': True, 'sage_aggr': 'mean', 'sage_normalize': False, 'sage_project': False, 'lr': 1.4965198891514181e-05, 'weight_decay': 0.0004065781176803634, 'epochs': 164, 'loss': 'mae', 'optimizer': 'adam', 'graph_mode': 'cutoff', 'cutoff': 0.6869714190563067, 'grm_norm': 'none', 'self_loops': False, 'use_snp_selection': False, 'graphsage_batch_size': 32}. Best is trial 19 with value: 0.22264005015541502.
[I 2025-12-06 10:59:36,262] Trial 104 finished with value: 0.20818577637409968 and parameters: {'model_type': 'graphsage', 'hidden_dims': '[512, 128]', 'dropout': 0.38112038808366944, 'batch_norm': True, 'sage_aggr': 'mean', 'sage_normalize': False, 'sage_project': False, 'lr': 7.715117926855807e-05, 'weight_decay': 0.0006334786696980556, 'epochs': 152, 'loss': 'mae', 'optimizer': 'adam', 'graph_mode': 'cutoff', 'cutoff': 0.8998388217589667, 'grm_norm': 'cosine', 'self_loops': False, 'use_snp_selection': False, 'graphsage_batch_size': 256}. Best is trial 19 with value: 0.22264005015541502.
[I 2025-12-06 11:00:37,454] Trial 105 finished with value: 0.2030889373797277 and parameters: {'model_type': 'graphsage', 'hidden_dims': '[256, 128, 64]', 'dropout': 0.4717244358387696, 'batch_norm': True, 'sage_aggr': 'mean', 'sage_normalize': False, 'sage_project': False, 'lr': 2.4451551232685826e-05, 'weight_decay': 0.000995510915960333, 'epochs': 176, 'loss': 'mae', 'optimizer': 'adam', 'graph_mode': 'cutoff', 'cutoff': 0.8203461234249111, 'grm_norm': 'none', 'self_loops': False, 'use_snp_selection': False, 'graphsage_batch_size': 8}. Best is trial 19 with value: 0.22264005015541502.
[I 2025-12-06 11:00:56,489] Trial 106 finished with value: 0.16810723303572356 and parameters: {'model_type': 'graphsage', 'hidden_dims': '[512, 64]', 'dropout': 0.4462038075727081, 'batch_norm': True, 'sage_aggr': 'mean', 'sage_normalize': True, 'sage_project': False, 'lr': 0.00013447449772352194, 'weight_decay': 0.00020414336294282505, 'epochs': 188, 'loss': 'mae', 'optimizer': 'adam', 'graph_mode': 'cutoff', 'cutoff': 0.7350566535050465, 'grm_norm': 'gcn', 'self_loops': False, 'use_snp_selection': True, 'num_snps': 2359, 'graphsage_batch_size': 32}. Best is trial 19 with value: 0.22264005015541502.
[I 2025-12-06 11:02:05,707] Trial 107 finished with value: 0.18045717624841828 and parameters: {'model_type': 'graphsage', 'hidden_dims': '[256, 128, 64]', 'dropout': 0.3581237737357059, 'batch_norm': True, 'sage_aggr': 'mean', 'sage_normalize': False, 'sage_project': False, 'lr': 9.5566744478676e-06, 'weight_decay': 0.00035053387770962865, 'epochs': 201, 'loss': 'mse', 'optimizer': 'adam', 'graph_mode': 'cutoff', 'cutoff': 0.71477998267629, 'grm_norm': 'none', 'self_loops': False, 'use_snp_selection': False, 'graphsage_batch_size': 64}. Best is trial 19 with value: 0.22264005015541502.
[I 2025-12-06 11:02:58,516] Trial 108 finished with value: 0.1996353916994131 and parameters: {'model_type': 'graphsage', 'hidden_dims': '[256, 128, 64]', 'dropout': 0.46034568327011804, 'batch_norm': True, 'sage_aggr': 'mean', 'sage_normalize': False, 'sage_project': False, 'lr': 9.204119180046979e-05, 'weight_decay': 2.8497319446531403e-05, 'epochs': 147, 'loss': 'mae', 'optimizer': 'adam', 'graph_mode': 'cutoff', 'cutoff': 0.836500801872865, 'grm_norm': 'cosine_then_gcn', 'self_loops': False, 'use_snp_selection': False, 'graphsage_batch_size': 32}. Best is trial 19 with value: 0.22264005015541502.
[I 2025-12-06 11:04:01,451] Trial 109 finished with value: 0.21393738066907422 and parameters: {'model_type': 'graphsage', 'hidden_dims': '[512, 256]', 'dropout': 0.4145247749557732, 'batch_norm': True, 'sage_aggr': 'mean', 'sage_normalize': False, 'sage_project': False, 'lr': 0.00010815601812407638, 'weight_decay': 1.2601165297515522e-07, 'epochs': 158, 'loss': 'mae', 'optimizer': 'adam', 'graph_mode': 'cutoff', 'cutoff': 0.8551098275110148, 'grm_norm': 'none', 'self_loops': False, 'use_snp_selection': True, 'num_snps': 31142, 'graphsage_batch_size': 32}. Best is trial 19 with value: 0.22264005015541502.
[I 2025-12-06 11:05:07,050] Trial 110 finished with value: 0.21985493621021565 and parameters: {'model_type': 'graphsage', 'hidden_dims': '[512, 256]', 'dropout': 0.5006758249805283, 'batch_norm': True, 'sage_aggr': 'mean', 'sage_normalize': True, 'sage_project': False, 'lr': 0.00011406957591907606, 'weight_decay': 1.1669303662776692e-07, 'epochs': 158, 'loss': 'mae', 'optimizer': 'adam', 'graph_mode': 'cutoff', 'cutoff': 0.6484051241969999, 'grm_norm': 'none', 'self_loops': False, 'use_snp_selection': True, 'num_snps': 32346, 'graphsage_batch_size': 16}. Best is trial 19 with value: 0.22264005015541502.
[I 2025-12-06 11:06:09,181] Trial 111 finished with value: 0.21104396399991776 and parameters: {'model_type': 'graphsage', 'hidden_dims': '[512, 256]', 'dropout': 0.5414477279792355, 'batch_norm': True, 'sage_aggr': 'mean', 'sage_normalize': True, 'sage_project': False, 'lr': 0.0001783655385620205, 'weight_decay': 1.2544544672085328e-07, 'epochs': 149, 'loss': 'mae', 'optimizer': 'adam', 'graph_mode': 'cutoff', 'cutoff': 0.8589522823799243, 'grm_norm': 'none', 'self_loops': False, 'use_snp_selection': True, 'num_snps': 32108, 'graphsage_batch_size': 16}. Best is trial 19 with value: 0.22264005015541502.
[I 2025-12-06 11:07:15,867] Trial 112 finished with value: 0.20694031398382345 and parameters: {'model_type': 'graphsage', 'hidden_dims': '[512, 256]', 'dropout': 0.5541405286880942, 'batch_norm': True, 'sage_aggr': 'mean', 'sage_normalize': True, 'sage_project': False, 'lr': 0.00017701370402553227, 'weight_decay': 1.552048735484439e-07, 'epochs': 159, 'loss': 'mae', 'optimizer': 'adam', 'graph_mode': 'cutoff', 'cutoff': 0.8594036849441389, 'grm_norm': 'none', 'self_loops': False, 'use_snp_selection': True, 'num_snps': 32972, 'graphsage_batch_size': 16}. Best is trial 19 with value: 0.22264005015541502.
[I 2025-12-06 11:08:08,312] Trial 113 finished with value: 0.21271264495648934 and parameters: {'model_type': 'graphsage', 'hidden_dims': '[512, 256]', 'dropout': 0.5141323379873706, 'batch_norm': True, 'sage_aggr': 'mean', 'sage_normalize': True, 'sage_project': False, 'lr': 0.00024110428196478294, 'weight_decay': 1.1729651044493294e-07, 'epochs': 134, 'loss': 'mae', 'optimizer': 'adam', 'graph_mode': 'cutoff', 'cutoff': 0.8603979696641064, 'grm_norm': 'none', 'self_loops': False, 'use_snp_selection': True, 'num_snps': 27941, 'graphsage_batch_size': 16}. Best is trial 19 with value: 0.22264005015541502.
[I 2025-12-06 11:09:05,030] Trial 114 finished with value: 0.20963654618230843 and parameters: {'model_type': 'graphsage', 'hidden_dims': '[512, 256]', 'dropout': 0.5438451754714478, 'batch_norm': True, 'sage_aggr': 'mean', 'sage_normalize': True, 'sage_project': False, 'lr': 0.0003250780039654485, 'weight_decay': 1.1994888845858033e-07, 'epochs': 137, 'loss': 'mae', 'optimizer': 'adam', 'graph_mode': 'cutoff', 'cutoff': 0.8790021157391156, 'grm_norm': 'none', 'self_loops': False, 'use_snp_selection': True, 'num_snps': 30167, 'graphsage_batch_size': 16}. Best is trial 19 with value: 0.22264005015541502.
[I 2025-12-06 11:10:20,453] Trial 115 finished with value: 0.21359500534933035 and parameters: {'model_type': 'graphsage', 'hidden_dims': '[512, 256]', 'dropout': 0.5164713766563837, 'batch_norm': True, 'sage_aggr': 'mean', 'sage_normalize': True, 'sage_project': False, 'lr': 0.0002450632076718896, 'weight_decay': 1.0343664171426907e-07, 'epochs': 166, 'loss': 'mae', 'optimizer': 'adam', 'graph_mode': 'cutoff', 'cutoff': 0.8516747463971083, 'grm_norm': 'none', 'self_loops': False, 'use_snp_selection': True, 'num_snps': 37150, 'graphsage_batch_size': 16}. Best is trial 19 with value: 0.22264005015541502.
[I 2025-12-06 11:11:36,857] Trial 116 finished with value: 0.21145409871663362 and parameters: {'model_type': 'graphsage', 'hidden_dims': '[512, 256]', 'dropout': 0.5050232416593609, 'batch_norm': True, 'sage_aggr': 'mean', 'sage_normalize': True, 'sage_project': False, 'lr': 0.0002105244232912974, 'weight_decay': 1.120751356007591e-07, 'epochs': 166, 'loss': 'mae', 'optimizer': 'adam', 'graph_mode': 'cutoff', 'cutoff': 0.858822755139891, 'grm_norm': 'none', 'self_loops': False, 'use_snp_selection': True, 'num_snps': 37953, 'graphsage_batch_size': 16}. Best is trial 19 with value: 0.22264005015541502.
[I 2025-12-06 11:12:52,657] Trial 117 finished with value: 0.2110849783479793 and parameters: {'model_type': 'graphsage', 'hidden_dims': '[512, 256]', 'dropout': 0.515603691270313, 'batch_norm': True, 'sage_aggr': 'mean', 'sage_normalize': True, 'sage_project': False, 'lr': 0.0005219182247965468, 'weight_decay': 1.2022418097606912e-07, 'epochs': 165, 'loss': 'mae', 'optimizer': 'adam', 'graph_mode': 'cutoff', 'cutoff': 0.8614773758709979, 'grm_norm': 'none', 'self_loops': False, 'use_snp_selection': True, 'num_snps': 37851, 'graphsage_batch_size': 16}. Best is trial 19 with value: 0.22264005015541502.
[I 2025-12-06 11:14:08,458] Trial 118 finished with value: 0.20323598362921294 and parameters: {'model_type': 'graphsage', 'hidden_dims': '[512, 256]', 'dropout': 0.5129526375712651, 'batch_norm': False, 'sage_aggr': 'mean', 'sage_normalize': True, 'sage_project': False, 'lr': 0.0006861368362206479, 'weight_decay': 1.1178252873442325e-07, 'epochs': 167, 'loss': 'mae', 'optimizer': 'adam', 'graph_mode': 'cutoff', 'cutoff': 0.8921615547819047, 'grm_norm': 'none', 'self_loops': False, 'use_snp_selection': True, 'num_snps': 37500, 'graphsage_batch_size': 16}. Best is trial 19 with value: 0.22264005015541502.
[I 2025-12-06 11:15:40,099] Trial 119 finished with value: 0.2114559007075913 and parameters: {'model_type': 'graphsage', 'hidden_dims': '[512, 256]', 'dropout': 0.49793200186475434, 'batch_norm': True, 'sage_aggr': 'mean', 'sage_normalize': True, 'sage_project': False, 'lr': 0.0006298603645412753, 'weight_decay': 1.523901356376186e-07, 'epochs': 195, 'loss': 'mae', 'optimizer': 'adam', 'graph_mode': 'cutoff', 'cutoff': 0.8629726153909438, 'grm_norm': 'none', 'self_loops': False, 'use_snp_selection': True, 'num_snps': 40935, 'graphsage_batch_size': 16}. Best is trial 19 with value: 0.22264005015541502.
[I 2025-12-06 11:17:11,892] Trial 120 finished with value: 0.21482983379457835 and parameters: {'model_type': 'graphsage', 'hidden_dims': '[512, 256]', 'dropout': 0.5030386171806375, 'batch_norm': True, 'sage_aggr': 'mean', 'sage_normalize': True, 'sage_project': False, 'lr': 0.00029992571237005887, 'weight_decay': 1.5967272269192684e-07, 'epochs': 196, 'loss': 'mae', 'optimizer': 'adam', 'graph_mode': 'cutoff', 'cutoff': 0.8315489981807892, 'grm_norm': 'none', 'self_loops': False, 'use_snp_selection': True, 'num_snps': 40800, 'graphsage_batch_size': 16}. Best is trial 19 with value: 0.22264005015541502.
[I 2025-12-06 11:18:45,504] Trial 121 finished with value: 0.2078118894569462 and parameters: {'model_type': 'graphsage', 'hidden_dims': '[512, 256]', 'dropout': 0.49448503963132334, 'batch_norm': True, 'sage_aggr': 'mean', 'sage_normalize': True, 'sage_project': False, 'lr': 0.00021107128733207975, 'weight_decay': 1.533359658001128e-07, 'epochs': 194, 'loss': 'mae', 'optimizer': 'adam', 'graph_mode': 'cutoff', 'cutoff': 0.8359890811945322, 'grm_norm': 'none', 'self_loops': False, 'use_snp_selection': True, 'num_snps': 42168, 'graphsage_batch_size': 16}. Best is trial 19 with value: 0.22264005015541502.
[I 2025-12-06 11:20:09,862] Trial 122 finished with value: 0.20702325758127021 and parameters: {'model_type': 'graphsage', 'hidden_dims': '[512, 256]', 'dropout': 0.5263524280322054, 'batch_norm': True, 'sage_aggr': 'mean', 'sage_normalize': True, 'sage_project': False, 'lr': 0.00024246819754299726, 'weight_decay': 1.0244598292749618e-07, 'epochs': 205, 'loss': 'mae', 'optimizer': 'adam', 'graph_mode': 'cutoff', 'cutoff': 0.8504002634372395, 'grm_norm': 'none', 'self_loops': False, 'use_snp_selection': True, 'num_snps': 35507, 'graphsage_batch_size': 16}. Best is trial 19 with value: 0.22264005015541502.
[I 2025-12-06 11:21:40,024] Trial 123 finished with value: 0.20944556273561635 and parameters: {'model_type': 'graphsage', 'hidden_dims': '[512, 256]', 'dropout': 0.5074573354060533, 'batch_norm': True, 'sage_aggr': 'mean', 'sage_normalize': True, 'sage_project': False, 'lr': 0.0003130968634012801, 'weight_decay': 2.0479975449073967e-07, 'epochs': 185, 'loss': 'mae', 'optimizer': 'adam', 'graph_mode': 'cutoff', 'cutoff': 0.8895147389993666, 'grm_norm': 'none', 'self_loops': False, 'use_snp_selection': True, 'num_snps': 41915, 'graphsage_batch_size': 16}. Best is trial 19 with value: 0.22264005015541502.
[I 2025-12-06 11:23:25,721] Trial 124 finished with value: 0.20277414977767502 and parameters: {'model_type': 'graphsage', 'hidden_dims': '[512, 256]', 'dropout': 0.4943482933721656, 'batch_norm': True, 'sage_aggr': 'mean', 'sage_normalize': True, 'sage_project': False, 'lr': 0.00032810075895543046, 'weight_decay': 1.5983367210305585e-07, 'epochs': 200, 'loss': 'mae', 'optimizer': 'adam', 'graph_mode': 'cutoff', 'cutoff': 0.8741176997509701, 'grm_norm': 'none', 'self_loops': False, 'use_snp_selection': True, 'num_snps': 46972, 'graphsage_batch_size': 16}. Best is trial 19 with value: 0.22264005015541502.
[I 2025-12-06 11:24:51,679] Trial 125 finished with value: 0.2128334153607833 and parameters: {'model_type': 'graphsage', 'hidden_dims': '[512, 256]', 'dropout': 0.5036786529876721, 'batch_norm': True, 'sage_aggr': 'mean', 'sage_normalize': True, 'sage_project': False, 'lr': 0.0005167333210908077, 'weight_decay': 1.0045398633225865e-07, 'epochs': 220, 'loss': 'mae', 'optimizer': 'adam', 'graph_mode': 'cutoff', 'cutoff': 0.8298861931826126, 'grm_norm': 'none', 'self_loops': False, 'use_snp_selection': True, 'num_snps': 34232, 'graphsage_batch_size': 16}. Best is trial 19 with value: 0.22264005015541502.
[I 2025-12-06 11:26:18,772] Trial 126 finished with value: 0.20885285009754115 and parameters: {'model_type': 'graphsage', 'hidden_dims': '[512, 256]', 'dropout': 0.5236432466510902, 'batch_norm': True, 'sage_aggr': 'mean', 'sage_normalize': True, 'sage_project': False, 'lr': 0.0006115672231675802, 'weight_decay': 2.2875758181629365e-07, 'epochs': 219, 'loss': 'mae', 'optimizer': 'adam', 'graph_mode': 'cutoff', 'cutoff': 0.8230527281253357, 'grm_norm': 'none', 'self_loops': False, 'use_snp_selection': True, 'num_snps': 34873, 'graphsage_batch_size': 16}. Best is trial 19 with value: 0.22264005015541502.
