[I 2025-12-08 17:42:47,446] Trial 79 finished with value: 0.2905019947522361 and parameters: {'model_type': 'graphsage', 'hidden_dims': '[128, 64]', 'dropout': 0.3941461846460861, 'batch_norm': False, 'sage_aggr': 'mean', 'sage_normalize': True, 'sage_project': False, 'lr': 0.000779008077504432, 'weight_decay': 3.880704535503291e-05, 'epochs': 283, 'loss': 'mse', 'optimizer': 'adam', 'graph_mode': 'cutoff', 'cutoff': 0.4209573741939162, 'grm_norm': 'none', 'self_loops': False, 'use_snp_selection': True, 'num_snps': 15716}. Best is trial 13 with value: 0.3123866227334652.
[I 2025-12-08 17:45:26,060] Trial 80 finished with value: 0.30388013809551073 and parameters: {'model_type': 'graphsage', 'hidden_dims': '[512, 256]', 'dropout': 0.47450586227110425, 'batch_norm': False, 'sage_aggr': 'mean', 'sage_normalize': True, 'sage_project': False, 'lr': 0.0015712662456627666, 'weight_decay': 2.3732903656810746e-05, 'epochs': 265, 'loss': 'mse', 'optimizer': 'adam', 'graph_mode': 'cutoff', 'cutoff': 0.5061151286814888, 'grm_norm': 'gcn', 'self_loops': False, 'use_snp_selection': False}. Best is trial 13 with value: 0.3123866227334652.
[I 2025-12-08 17:47:42,600] Trial 81 finished with value: 0.3053048966501179 and parameters: {'model_type': 'graphsage', 'hidden_dims': '[256, 128]', 'dropout': 0.5308789192948588, 'batch_norm': False, 'sage_aggr': 'mean', 'sage_normalize': True, 'sage_project': False, 'lr': 0.0005725949714004994, 'weight_decay': 7.825822186666091e-06, 'epochs': 350, 'loss': 'mse', 'optimizer': 'adam', 'graph_mode': 'cutoff', 'cutoff': 0.44984906175839423, 'grm_norm': 'none', 'self_loops': False, 'use_snp_selection': False}. Best is trial 13 with value: 0.3123866227334652.
[I 2025-12-08 17:49:59,717] Trial 82 finished with value: 0.29954827887676344 and parameters: {'model_type': 'graphsage', 'hidden_dims': '[256, 128]', 'dropout': 0.5363031531603093, 'batch_norm': False, 'sage_aggr': 'mean', 'sage_normalize': True, 'sage_project': False, 'lr': 0.0005524309199613197, 'weight_decay': 1.2957917850459351e-05, 'epochs': 349, 'loss': 'mse', 'optimizer': 'adam', 'graph_mode': 'cutoff', 'cutoff': 0.440685102201055, 'grm_norm': 'none', 'self_loops': False, 'use_snp_selection': False}. Best is trial 13 with value: 0.3123866227334652.
[I 2025-12-08 17:52:19,263] Trial 83 finished with value: 0.2918832316613544 and parameters: {'model_type': 'graphsage', 'hidden_dims': '[256, 128]', 'dropout': 0.5810192164905387, 'batch_norm': False, 'sage_aggr': 'mean', 'sage_normalize': True, 'sage_project': False, 'lr': 0.001146294193163077, 'weight_decay': 8.408468537270205e-06, 'epochs': 343, 'loss': 'mse', 'optimizer': 'adam', 'graph_mode': 'cutoff', 'cutoff': 0.39332655115248955, 'grm_norm': 'none', 'self_loops': False, 'use_snp_selection': False}. Best is trial 13 with value: 0.3123866227334652.
[I 2025-12-08 17:53:59,333] Trial 84 finished with value: 0.2977787532601216 and parameters: {'model_type': 'graphsage', 'hidden_dims': '[256, 128]', 'dropout': 0.45866562508607783, 'batch_norm': False, 'sage_aggr': 'mean', 'sage_normalize': True, 'sage_project': False, 'lr': 0.0007415808811329916, 'weight_decay': 2.9508552632252684e-06, 'epochs': 331, 'loss': 'mse', 'optimizer': 'adam', 'graph_mode': 'cutoff', 'cutoff': 0.5744386520349297, 'grm_norm': 'none', 'self_loops': False, 'use_snp_selection': False}. Best is trial 13 with value: 0.3123866227334652.
[I 2025-12-08 17:57:57,794] Trial 85 finished with value: 0.2993046249313422 and parameters: {'model_type': 'graphsage', 'hidden_dims': '[512, 128]', 'dropout': 0.5119252901408518, 'batch_norm': False, 'sage_aggr': 'mean', 'sage_normalize': True, 'sage_project': False, 'lr': 0.0009504520466744787, 'weight_decay': 0.00021225439485244451, 'epochs': 314, 'loss': 'mse', 'optimizer': 'adam', 'graph_mode': 'cutoff', 'cutoff': 0.32885874971341716, 'grm_norm': 'none', 'self_loops': False, 'use_snp_selection': False}. Best is trial 13 with value: 0.3123866227334652.
[I 2025-12-08 17:59:54,818] Trial 86 finished with value: 0.2975801447789125 and parameters: {'model_type': 'graphsage', 'hidden_dims': '[256, 128]', 'dropout': 0.4890137095504166, 'batch_norm': False, 'sage_aggr': 'mean', 'sage_normalize': True, 'sage_project': False, 'lr': 0.0004688340909497011, 'weight_decay': 1.0480801617053462e-05, 'epochs': 321, 'loss': 'mse', 'optimizer': 'adam', 'graph_mode': 'cutoff', 'cutoff': 0.4903035459929428, 'grm_norm': 'cosine', 'self_loops': False, 'use_snp_selection': False}. Best is trial 13 with value: 0.3123866227334652.
[I 2025-12-08 18:02:37,712] Trial 87 finished with value: 0.12817220000546087 and parameters: {'model_type': 'graphsage', 'hidden_dims': '[256, 128, 64]', 'dropout': 0.5577578002791638, 'batch_norm': False, 'sage_aggr': 'max', 'sage_normalize': True, 'sage_project': False, 'lr': 0.001376644056696995, 'weight_decay': 4.6344200602801735e-06, 'epochs': 248, 'loss': 'mae', 'optimizer': 'adam', 'graph_mode': 'cutoff', 'cutoff': 0.28412373099821264, 'grm_norm': 'cosine_then_gcn', 'self_loops': True, 'use_snp_selection': False}. Best is trial 13 with value: 0.3123866227334652.
[I 2025-12-08 18:04:48,193] Trial 88 finished with value: 0.29467900459189267 and parameters: {'model_type': 'graphsage', 'hidden_dims': '[256, 128]', 'dropout': 0.4290495300629302, 'batch_norm': False, 'sage_aggr': 'mean', 'sage_normalize': True, 'sage_project': False, 'lr': 0.00044081757048912326, 'weight_decay': 2.1293294955358483e-06, 'epochs': 327, 'loss': 'mse', 'optimizer': 'adam', 'graph_mode': 'cutoff', 'cutoff': 0.42010451698474, 'grm_norm': 'gcn', 'self_loops': False, 'use_snp_selection': False}. Best is trial 13 with value: 0.3123866227334652.
[I 2025-12-08 18:05:32,952] Trial 89 finished with value: 0.28344271614211586 and parameters: {'model_type': 'graphsage', 'hidden_dims': '[256, 128]', 'dropout': 0.49895350818989104, 'batch_norm': True, 'sage_aggr': 'mean', 'sage_normalize': True, 'sage_project': False, 'lr': 0.0006565447962191452, 'weight_decay': 1.582661649858018e-05, 'epochs': 97, 'loss': 'mse', 'optimizer': 'adam', 'graph_mode': 'knn', 'knn_k': 8, 'weighted_edges': False, 'symmetrize_mode': 'mutual', 'self_loops': False, 'use_snp_selection': False}. Best is trial 13 with value: 0.3123866227334652.
[I 2025-12-08 18:08:51,796] Trial 90 finished with value: 0.05022139406271431 and parameters: {'model_type': 'graphsage', 'hidden_dims': '[512, 64]', 'dropout': 0.4759020933717186, 'batch_norm': False, 'sage_aggr': 'mean', 'sage_normalize': False, 'sage_project': False, 'lr': 0.00031616463234361526, 'weight_decay': 3.6104922095996023e-06, 'epochs': 298, 'loss': 'mse', 'optimizer': 'adam', 'graph_mode': 'cutoff', 'cutoff': 0.35817715336573885, 'grm_norm': 'none', 'self_loops': False, 'use_snp_selection': False}. Best is trial 13 with value: 0.3123866227334652.
[I 2025-12-08 18:11:01,710] Trial 91 finished with value: 0.29674750686739654 and parameters: {'model_type': 'graphsage', 'hidden_dims': '[256, 128]', 'dropout': 0.5279695206816634, 'batch_norm': False, 'sage_aggr': 'mean', 'sage_normalize': True, 'sage_project': False, 'lr': 0.001992904621053545, 'weight_decay': 6.695177964943376e-06, 'epochs': 336, 'loss': 'mse', 'optimizer': 'adam', 'graph_mode': 'cutoff', 'cutoff': 0.4654588666197415, 'grm_norm': 'none', 'self_loops': False, 'use_snp_selection': False}. Best is trial 13 with value: 0.3123866227334652.
[I 2025-12-08 18:13:14,204] Trial 92 finished with value: 0.294079747817243 and parameters: {'model_type': 'graphsage', 'hidden_dims': '[256, 128]', 'dropout': 0.533455700600858, 'batch_norm': False, 'sage_aggr': 'mean', 'sage_normalize': True, 'sage_project': False, 'lr': 0.003239700903754268, 'weight_decay': 7.598012777055477e-06, 'epochs': 339, 'loss': 'mse', 'optimizer': 'adam', 'graph_mode': 'cutoff', 'cutoff': 0.44859857543491327, 'grm_norm': 'none', 'self_loops': False, 'use_snp_selection': False}. Best is trial 13 with value: 0.3123866227334652.
[I 2025-12-08 18:14:52,320] Trial 93 finished with value: 0.2808573465690677 and parameters: {'model_type': 'graphsage', 'hidden_dims': '[256, 128]', 'dropout': 0.5473358015106298, 'batch_norm': False, 'sage_aggr': 'mean', 'sage_normalize': True, 'sage_project': False, 'lr': 0.0025011723397826875, 'weight_decay': 0.00040332547300088825, 'epochs': 344, 'loss': 'mse', 'optimizer': 'adam', 'graph_mode': 'cutoff', 'cutoff': 0.8958430820886536, 'grm_norm': 'none', 'self_loops': False, 'use_snp_selection': False}. Best is trial 13 with value: 0.3123866227334652.
[I 2025-12-08 18:17:01,485] Trial 94 finished with value: 0.306068917451619 and parameters: {'model_type': 'graphsage', 'hidden_dims': '[256, 128]', 'dropout': 0.5185835361868043, 'batch_norm': False, 'sage_aggr': 'mean', 'sage_normalize': True, 'sage_project': False, 'lr': 0.0014249091549062458, 'weight_decay': 1.1298632320806309e-05, 'epochs': 309, 'loss': 'mse', 'optimizer': 'adam', 'graph_mode': 'cutoff', 'cutoff': 0.3719608290988754, 'grm_norm': 'none', 'self_loops': False, 'use_snp_selection': False}. Best is trial 13 with value: 0.3123866227334652.
[I 2025-12-08 18:19:06,452] Trial 95 finished with value: 0.3031085147754457 and parameters: {'model_type': 'graphsage', 'hidden_dims': '[256, 128]', 'dropout': 0.5154241910411231, 'batch_norm': False, 'sage_aggr': 'mean', 'sage_normalize': True, 'sage_project': False, 'lr': 0.0015067344219353567, 'weight_decay': 1.958931528022808e-05, 'epochs': 309, 'loss': 'mse', 'optimizer': 'adam', 'graph_mode': 'cutoff', 'cutoff': 0.3727050717855142, 'grm_norm': 'cosine_then_gcn', 'self_loops': False, 'use_snp_selection': False}. Best is trial 13 with value: 0.3123866227334652.
[I 2025-12-08 18:22:19,516] Trial 96 finished with value: 0.3023898648879041 and parameters: {'model_type': 'graphsage', 'hidden_dims': '[512, 128]', 'dropout': 0.45746122109164983, 'batch_norm': False, 'sage_aggr': 'mean', 'sage_normalize': True, 'sage_project': False, 'lr': 0.001048864604591199, 'weight_decay': 1.1053847561847728e-05, 'epochs': 317, 'loss': 'mse', 'optimizer': 'adam', 'graph_mode': 'cutoff', 'cutoff': 0.41062889808766845, 'grm_norm': 'gcn', 'self_loops': False, 'use_snp_selection': True, 'num_snps': 40199}. Best is trial 13 with value: 0.3123866227334652.
[I 2025-12-08 18:24:23,035] Trial 97 finished with value: 0.30621313385486254 and parameters: {'model_type': 'graphsage', 'hidden_dims': '[256, 128]', 'dropout': 0.48221987898449337, 'batch_norm': False, 'sage_aggr': 'mean', 'sage_normalize': True, 'sage_project': False, 'lr': 0.000879845832575685, 'weight_decay': 1.2786362335634108e-05, 'epochs': 301, 'loss': 'mse', 'optimizer': 'adam', 'graph_mode': 'cutoff', 'cutoff': 0.38758455715281565, 'grm_norm': 'none', 'self_loops': False, 'use_snp_selection': False}. Best is trial 13 with value: 0.3123866227334652.
[I 2025-12-08 18:26:19,271] Trial 98 finished with value: 0.3050127142580391 and parameters: {'model_type': 'graphsage', 'hidden_dims': '[256, 128]', 'dropout': 0.44168821908836836, 'batch_norm': False, 'sage_aggr': 'mean', 'sage_normalize': True, 'sage_project': False, 'lr': 0.0008748668505980032, 'weight_decay': 2.646001221646519e-05, 'epochs': 283, 'loss': 'mse', 'optimizer': 'adam', 'graph_mode': 'cutoff', 'cutoff': 0.3883521281829168, 'grm_norm': 'none', 'self_loops': False, 'use_snp_selection': False}. Best is trial 13 with value: 0.3123866227334652.
[I 2025-12-08 18:28:16,136] Trial 99 finished with value: 0.300215926232824 and parameters: {'model_type': 'graphsage', 'hidden_dims': '[256, 128]', 'dropout': 0.47762127815584593, 'batch_norm': False, 'sage_aggr': 'mean', 'sage_normalize': True, 'sage_project': False, 'lr': 0.0005579783698030606, 'weight_decay': 1.328813770459838e-05, 'epochs': 294, 'loss': 'mse', 'optimizer': 'adam', 'graph_mode': 'cutoff', 'cutoff': 0.4299193957503468, 'grm_norm': 'none', 'self_loops': False, 'use_snp_selection': False}. Best is trial 13 with value: 0.3123866227334652.
[I 2025-12-08 18:29:57,149] Trial 100 finished with value: 0.2720476205676331 and parameters: {'model_type': 'graphsage', 'hidden_dims': '[128, 64]', 'dropout': 0.5064866924014185, 'batch_norm': False, 'sage_aggr': 'max', 'sage_normalize': True, 'sage_project': False, 'lr': 0.0011956605168857437, 'weight_decay': 5.400154482538523e-06, 'epochs': 303, 'loss': 'mse', 'optimizer': 'adam', 'graph_mode': 'cutoff', 'cutoff': 0.3966584393202921, 'grm_norm': 'none', 'self_loops': True, 'use_snp_selection': False}. Best is trial 13 with value: 0.3123866227334652.
[I 2025-12-08 18:31:55,971] Trial 101 finished with value: 0.3064357263822298 and parameters: {'model_type': 'graphsage', 'hidden_dims': '[256, 128]', 'dropout': 0.4372681889517085, 'batch_norm': False, 'sage_aggr': 'mean', 'sage_normalize': True, 'sage_project': False, 'lr': 0.0008557025356245516, 'weight_decay': 2.762342287077711e-05, 'epochs': 287, 'loss': 'mse', 'optimizer': 'adam', 'graph_mode': 'cutoff', 'cutoff': 0.380775039448768, 'grm_norm': 'none', 'self_loops': False, 'use_snp_selection': False}. Best is trial 13 with value: 0.3123866227334652.
[I 2025-12-08 18:34:18,540] Trial 102 finished with value: 0.30788133217990926 and parameters: {'model_type': 'graphsage', 'hidden_dims': '[256, 128]', 'dropout': 0.48806917331738736, 'batch_norm': False, 'sage_aggr': 'mean', 'sage_normalize': True, 'sage_project': False, 'lr': 0.0017925249850226264, 'weight_decay': 1.525366096027597e-05, 'epochs': 329, 'loss': 'mse', 'optimizer': 'adam', 'graph_mode': 'cutoff', 'cutoff': 0.34897638761818206, 'grm_norm': 'none', 'self_loops': False, 'use_snp_selection': False}. Best is trial 13 with value: 0.3123866227334652.
[I 2025-12-08 18:36:57,469] Trial 103 finished with value: 0.31089285684997536 and parameters: {'model_type': 'graphsage', 'hidden_dims': '[256, 128]', 'dropout': 0.4630499915403883, 'batch_norm': False, 'sage_aggr': 'mean', 'sage_normalize': True, 'sage_project': False, 'lr': 0.0018524998777054915, 'weight_decay': 2.9993235340004028e-05, 'epochs': 301, 'loss': 'mse', 'optimizer': 'adam', 'graph_mode': 'cutoff', 'cutoff': 0.32298077154783655, 'grm_norm': 'none', 'self_loops': False, 'use_snp_selection': False}. Best is trial 13 with value: 0.3123866227334652.
[I 2025-12-08 18:39:21,728] Trial 104 finished with value: 0.30238481345284873 and parameters: {'model_type': 'graphsage', 'hidden_dims': '[256, 128]', 'dropout': 0.46243113397315405, 'batch_norm': False, 'sage_aggr': 'mean', 'sage_normalize': True, 'sage_project': False, 'lr': 0.0019080144595537464, 'weight_decay': 2.085345181126216e-05, 'epochs': 272, 'loss': 'mse', 'optimizer': 'adam', 'graph_mode': 'cutoff', 'cutoff': 0.3223137533046797, 'grm_norm': 'none', 'self_loops': False, 'use_snp_selection': False}. Best is trial 13 with value: 0.3123866227334652.
[I 2025-12-08 18:43:24,421] Trial 105 finished with value: 0.2972845132272431 and parameters: {'model_type': 'graphsage', 'hidden_dims': '[512, 256]', 'dropout': 0.4239883249341446, 'batch_norm': False, 'sage_aggr': 'mean', 'sage_normalize': True, 'sage_project': False, 'lr': 0.0013340028096041612, 'weight_decay': 2.4971368199518467e-05, 'epochs': 291, 'loss': 'mse', 'optimizer': 'adam', 'graph_mode': 'cutoff', 'cutoff': 0.2955572814195024, 'grm_norm': 'none', 'self_loops': False, 'use_snp_selection': False}. Best is trial 13 with value: 0.3123866227334652.
[I 2025-12-08 18:46:40,307] Trial 106 finished with value: 0.29555204841784044 and parameters: {'model_type': 'graphsage', 'hidden_dims': '[256, 128]', 'dropout': 0.43820532136327395, 'batch_norm': False, 'sage_aggr': 'mean', 'sage_normalize': True, 'sage_project': False, 'lr': 0.0017506618696357566, 'weight_decay': 4.452262128056503e-05, 'epochs': 310, 'loss': 'mae', 'optimizer': 'adam', 'graph_mode': 'cutoff', 'cutoff': 0.2685107857415758, 'grm_norm': 'cosine', 'self_loops': False, 'use_snp_selection': False}. Best is trial 13 with value: 0.3123866227334652.
[I 2025-12-08 18:48:40,575] Trial 107 finished with value: 0.3081283941348302 and parameters: {'model_type': 'graphsage', 'hidden_dims': '[256, 128]', 'dropout': 0.45031495544295763, 'batch_norm': False, 'sage_aggr': 'mean', 'sage_normalize': True, 'sage_project': False, 'lr': 0.0014369963199855308, 'weight_decay': 3.40634230755682e-05, 'epochs': 286, 'loss': 'mse', 'optimizer': 'adam', 'graph_mode': 'cutoff', 'cutoff': 0.36993400250408753, 'grm_norm': 'none', 'self_loops': False, 'use_snp_selection': False}. Best is trial 13 with value: 0.3123866227334652.
[I 2025-12-08 18:51:58,320] Trial 108 finished with value: 0.2871718250048251 and parameters: {'model_type': 'graphsage', 'hidden_dims': '[512, 128]', 'dropout': 0.4175910487519257, 'batch_norm': False, 'sage_aggr': 'mean', 'sage_normalize': True, 'sage_project': False, 'lr': 0.00219763904280308, 'weight_decay': 3.770148643101967e-05, 'epochs': 288, 'loss': 'mse', 'optimizer': 'adam', 'graph_mode': 'cutoff', 'cutoff': 0.3395643052933577, 'grm_norm': 'gcn', 'self_loops': False, 'use_snp_selection': False}. Best is trial 13 with value: 0.3123866227334652.
[I 2025-12-08 18:54:42,183] Trial 109 finished with value: 0.28607044155926714 and parameters: {'model_type': 'graphsage', 'hidden_dims': '[256, 128]', 'dropout': 0.48099117153198084, 'batch_norm': True, 'sage_aggr': 'mean', 'sage_normalize': True, 'sage_project': False, 'lr': 0.0009822147052375215, 'weight_decay': 3.266257498737687e-05, 'epochs': 299, 'loss': 'mse', 'optimizer': 'adam', 'graph_mode': 'knn', 'knn_k': 10, 'weighted_edges': True, 'symmetrize_mode': 'mutual', 'self_loops': False, 'use_snp_selection': False}. Best is trial 13 with value: 0.3123866227334652.
[I 2025-12-08 18:56:43,575] Trial 110 finished with value: 0.023013580000422508 and parameters: {'model_type': 'graphsage', 'hidden_dims': '[256, 128]', 'dropout': 0.3756483235220781, 'batch_norm': False, 'sage_aggr': 'mean', 'sage_normalize': False, 'sage_project': False, 'lr': 0.0011591769048014818, 'weight_decay': 2.7924859497958807e-05, 'epochs': 280, 'loss': 'mse', 'optimizer': 'adam', 'graph_mode': 'cutoff', 'cutoff': 0.34968428979887695, 'grm_norm': 'none', 'self_loops': False, 'use_snp_selection': False}. Best is trial 13 with value: 0.3123866227334652.
[I 2025-12-08 18:58:51,582] Trial 111 finished with value: 0.30184769859288424 and parameters: {'model_type': 'graphsage', 'hidden_dims': '[256, 128]', 'dropout': 0.4521649464483425, 'batch_norm': False, 'sage_aggr': 'mean', 'sage_normalize': True, 'sage_project': False, 'lr': 0.0015097856194638893, 'weight_decay': 6.274762122666825e-05, 'epochs': 305, 'loss': 'mse', 'optimizer': 'adam', 'graph_mode': 'cutoff', 'cutoff': 0.37002745426163425, 'grm_norm': 'none', 'self_loops': False, 'use_snp_selection': False}. Best is trial 13 with value: 0.3123866227334652.
[I 2025-12-08 19:01:11,326] Trial 112 finished with value: 0.304304317572899 and parameters: {'model_type': 'graphsage', 'hidden_dims': '[256, 128]', 'dropout': 0.4700262736931573, 'batch_norm': False, 'sage_aggr': 'mean', 'sage_normalize': True, 'sage_project': False, 'lr': 0.00145525765562465, 'weight_decay': 1.7732531255509838e-05, 'epochs': 330, 'loss': 'mse', 'optimizer': 'adam', 'graph_mode': 'cutoff', 'cutoff': 0.3620821677445816, 'grm_norm': 'none', 'self_loops': False, 'use_snp_selection': False}. Best is trial 13 with value: 0.3123866227334652.
[I 2025-12-08 19:03:15,798] Trial 113 finished with value: 0.300157005681159 and parameters: {'model_type': 'graphsage', 'hidden_dims': '[256, 128]', 'dropout': 0.4907811649869886, 'batch_norm': False, 'sage_aggr': 'mean', 'sage_normalize': True, 'sage_project': False, 'lr': 0.001685196814147189, 'weight_decay': 1.3910304548302074e-05, 'epochs': 301, 'loss': 'mse', 'optimizer': 'adam', 'graph_mode': 'cutoff', 'cutoff': 0.3811012076098902, 'grm_norm': 'none', 'self_loops': False, 'use_snp_selection': False}. Best is trial 13 with value: 0.3123866227334652.
[I 2025-12-08 19:06:07,799] Trial 114 finished with value: 0.3018894038915049 and parameters: {'model_type': 'graphsage', 'hidden_dims': '[256, 128]', 'dropout': 0.4475394249972306, 'batch_norm': False, 'sage_aggr': 'mean', 'sage_normalize': True, 'sage_project': False, 'lr': 0.000791224875264211, 'weight_decay': 9.560041441258856e-06, 'epochs': 320, 'loss': 'mse', 'optimizer': 'adam', 'graph_mode': 'cutoff', 'cutoff': 0.3174851067643355, 'grm_norm': 'none', 'self_loops': False, 'use_snp_selection': False}. Best is trial 13 with value: 0.3123866227334652.
[I 2025-12-08 19:08:07,065] Trial 115 finished with value: 0.30508144235534396 and parameters: {'model_type': 'graphsage', 'hidden_dims': '[256, 128]', 'dropout': 0.4844455534687868, 'batch_norm': False, 'sage_aggr': 'mean', 'sage_normalize': True, 'sage_project': False, 'lr': 0.0011848779091346746, 'weight_decay': 1.5441493173971167e-05, 'epochs': 268, 'loss': 'mse', 'optimizer': 'adam', 'graph_mode': 'cutoff', 'cutoff': 0.33950954684708046, 'grm_norm': 'none', 'self_loops': False, 'use_snp_selection': False}. Best is trial 13 with value: 0.3123866227334652.
[I 2025-12-08 19:11:13,834] Trial 116 finished with value: 0.26171654373312647 and parameters: {'model_type': 'graphsage', 'hidden_dims': '[512, 64]', 'dropout': 0.46075520055244207, 'batch_norm': False, 'sage_aggr': 'mean', 'sage_normalize': True, 'sage_project': False, 'lr': 0.002084242451669529, 'weight_decay': 3.140172739027946e-05, 'epochs': 287, 'loss': 'mse', 'optimizer': 'adam', 'graph_mode': 'cutoff', 'cutoff': 0.3634247158873665, 'grm_norm': 'cosine', 'self_loops': False, 'use_snp_selection': False}. Best is trial 13 with value: 0.3123866227334652.
