[I 2025-12-09 15:08:49,295] Trial 68 finished with value: 0.33504353553899885 and parameters: {'model_type': 'graphsage', 'hidden_dims': '[256, 128, 64]', 'dropout': 0.2734683686743353, 'batch_norm': False, 'sage_aggr': 'max', 'sage_normalize': False, 'sage_project': False, 'lr': 1.1712453498343406e-05, 'weight_decay': 5.905953414627318e-06, 'epochs': 155, 'loss': 'mae', 'optimizer': 'adam', 'graph_mode': 'cutoff', 'cutoff': 0.3093585253910411, 'grm_norm': 'cosine', 'self_loops': True, 'use_snp_selection': True, 'num_snps': 19348}. Best is trial 42 with value: 0.37124776808108756.
[I 2025-12-09 15:09:57,867] Trial 69 finished with value: 0.2971779873117603 and parameters: {'model_type': 'graphsage', 'hidden_dims': '[128, 64]', 'dropout': 0.3439687154110223, 'batch_norm': False, 'sage_aggr': 'max', 'sage_normalize': False, 'sage_project': False, 'lr': 2.7738479819417062e-05, 'weight_decay': 8.672216911452188e-05, 'epochs': 77, 'loss': 'mae', 'optimizer': 'adam', 'graph_mode': 'cutoff', 'cutoff': 0.253946421274527, 'grm_norm': 'gcn', 'self_loops': False, 'use_snp_selection': True, 'num_snps': 37625}. Best is trial 42 with value: 0.37124776808108756.
[I 2025-12-09 15:11:28,768] Trial 70 finished with value: 0.3676152499990898 and parameters: {'model_type': 'graphsage', 'hidden_dims': '[512, 128]', 'dropout': 0.24318264661121763, 'batch_norm': False, 'sage_aggr': 'mean', 'sage_normalize': False, 'sage_project': False, 'lr': 3.70814730826785e-05, 'weight_decay': 2.984556027021249e-05, 'epochs': 120, 'loss': 'mae', 'optimizer': 'adam', 'graph_mode': 'knn', 'knn_k': 7, 'weighted_edges': True, 'symmetrize_mode': 'union', 'self_loops': True, 'use_snp_selection': True, 'num_snps': 28751}. Best is trial 42 with value: 0.37124776808108756.
[I 2025-12-09 15:13:01,068] Trial 71 finished with value: 0.3646701253408703 and parameters: {'model_type': 'graphsage', 'hidden_dims': '[512, 128]', 'dropout': 0.24660372383770027, 'batch_norm': False, 'sage_aggr': 'mean', 'sage_normalize': False, 'sage_project': False, 'lr': 3.470459656141066e-05, 'weight_decay': 3.230499748965763e-05, 'epochs': 123, 'loss': 'mae', 'optimizer': 'adam', 'graph_mode': 'knn', 'knn_k': 7, 'weighted_edges': True, 'symmetrize_mode': 'union', 'self_loops': True, 'use_snp_selection': True, 'num_snps': 29740}. Best is trial 42 with value: 0.37124776808108756.
[I 2025-12-09 15:14:24,100] Trial 72 finished with value: 0.3692865885136965 and parameters: {'model_type': 'graphsage', 'hidden_dims': '[512, 128]', 'dropout': 0.23578547352213336, 'batch_norm': False, 'sage_aggr': 'mean', 'sage_normalize': False, 'sage_project': False, 'lr': 3.778872150010701e-05, 'weight_decay': 3.120213588411767e-05, 'epochs': 103, 'loss': 'mae', 'optimizer': 'adam', 'graph_mode': 'knn', 'knn_k': 7, 'weighted_edges': True, 'symmetrize_mode': 'union', 'self_loops': True, 'use_snp_selection': True, 'num_snps': 29079}. Best is trial 42 with value: 0.37124776808108756.
[I 2025-12-09 15:15:49,597] Trial 73 finished with value: 0.3610799713326933 and parameters: {'model_type': 'graphsage', 'hidden_dims': '[512, 128]', 'dropout': 0.24016995907958527, 'batch_norm': False, 'sage_aggr': 'mean', 'sage_normalize': False, 'sage_project': False, 'lr': 3.430749605931198e-05, 'weight_decay': 3.122533671882616e-05, 'epochs': 100, 'loss': 'mae', 'optimizer': 'adam', 'graph_mode': 'knn', 'knn_k': 7, 'weighted_edges': True, 'symmetrize_mode': 'union', 'self_loops': True, 'use_snp_selection': True, 'num_snps': 30591}. Best is trial 42 with value: 0.37124776808108756.
[I 2025-12-09 15:17:19,968] Trial 74 finished with value: 0.3629421275827708 and parameters: {'model_type': 'graphsage', 'hidden_dims': '[512, 128]', 'dropout': 0.2599914243087377, 'batch_norm': False, 'sage_aggr': 'mean', 'sage_normalize': False, 'sage_project': False, 'lr': 5.184419860510219e-05, 'weight_decay': 0.00015499930427522403, 'epochs': 120, 'loss': 'mae', 'optimizer': 'adam', 'graph_mode': 'knn', 'knn_k': 7, 'weighted_edges': True, 'symmetrize_mode': 'union', 'self_loops': True, 'use_snp_selection': True, 'num_snps': 28746}. Best is trial 42 with value: 0.37124776808108756.
[I 2025-12-09 15:18:36,184] Trial 75 finished with value: 0.35668267342908344 and parameters: {'model_type': 'graphsage', 'hidden_dims': '[512, 128]', 'dropout': 0.22719798260931995, 'batch_norm': False, 'sage_aggr': 'mean', 'sage_normalize': False, 'sage_project': False, 'lr': 2.680384400469002e-05, 'weight_decay': 8.821423178500594e-05, 'epochs': 77, 'loss': 'mae', 'optimizer': 'adam', 'graph_mode': 'knn', 'knn_k': 6, 'weighted_edges': True, 'symmetrize_mode': 'union', 'self_loops': True, 'use_snp_selection': True, 'num_snps': 34055}. Best is trial 42 with value: 0.37124776808108756.
[I 2025-12-09 15:21:38,118] Trial 76 finished with value: 0.33916204639607306 and parameters: {'model_type': 'graphsage', 'hidden_dims': '[512, 128]', 'dropout': 0.20943425946063085, 'batch_norm': False, 'sage_aggr': 'mean', 'sage_normalize': False, 'sage_project': False, 'lr': 3.801817783857406e-05, 'weight_decay': 4.269813562551077e-05, 'epochs': 109, 'loss': 'mae', 'optimizer': 'adam', 'graph_mode': 'knn', 'knn_k': 8, 'weighted_edges': True, 'symmetrize_mode': 'union', 'self_loops': True, 'use_snp_selection': True, 'num_snps': 59709}. Best is trial 42 with value: 0.37124776808108756.
[I 2025-12-09 15:22:48,410] Trial 77 finished with value: 0.3351489372023587 and parameters: {'model_type': 'graphsage', 'hidden_dims': '[512, 128]', 'dropout': 0.24673543546963725, 'batch_norm': False, 'sage_aggr': 'mean', 'sage_normalize': False, 'sage_project': False, 'lr': 6.172735131700816e-05, 'weight_decay': 2.0307200336481935e-05, 'epochs': 86, 'loss': 'mae', 'optimizer': 'adam', 'graph_mode': 'knn', 'knn_k': 8, 'weighted_edges': True, 'symmetrize_mode': 'union', 'self_loops': True, 'use_snp_selection': True, 'num_snps': 25947}. Best is trial 42 with value: 0.37124776808108756.
[I 2025-12-09 15:24:19,560] Trial 78 finished with value: 0.35515443167585603 and parameters: {'model_type': 'graphsage', 'hidden_dims': '[512, 128]', 'dropout': 0.2930830782335634, 'batch_norm': False, 'sage_aggr': 'mean', 'sage_normalize': True, 'sage_project': False, 'lr': 4.62419811335968e-05, 'weight_decay': 2.8684465762412205e-05, 'epochs': 125, 'loss': 'mse', 'optimizer': 'adam', 'graph_mode': 'knn', 'knn_k': 6, 'weighted_edges': True, 'symmetrize_mode': 'union', 'self_loops': True, 'use_snp_selection': True, 'num_snps': 32202}. Best is trial 42 with value: 0.37124776808108756.
[I 2025-12-09 15:25:11,811] Trial 79 finished with value: 0.32544467360674406 and parameters: {'model_type': 'graphsage', 'hidden_dims': '[512, 128]', 'dropout': 0.194075199098869, 'batch_norm': True, 'sage_aggr': 'mean', 'sage_normalize': False, 'sage_project': False, 'lr': 1.9005845772463768e-05, 'weight_decay': 9.075042216456758e-06, 'epochs': 54, 'loss': 'mae', 'optimizer': 'adam', 'graph_mode': 'knn', 'knn_k': 7, 'weighted_edges': True, 'symmetrize_mode': 'union', 'self_loops': True, 'use_snp_selection': False}. Best is trial 42 with value: 0.37124776808108756.
[I 2025-12-09 15:26:41,353] Trial 80 finished with value: 0.0 and parameters: {'model_type': 'graphsage', 'hidden_dims': '[512, 128]', 'dropout': 0.4404163627368806, 'batch_norm': False, 'sage_aggr': 'mean', 'sage_normalize': False, 'sage_project': False, 'lr': 0.0026522974076334913, 'weight_decay': 1.5576358209893362e-05, 'epochs': 115, 'loss': 'mae', 'optimizer': 'adam', 'graph_mode': 'knn', 'knn_k': 4, 'weighted_edges': True, 'symmetrize_mode': 'union', 'self_loops': True, 'use_snp_selection': True, 'num_snps': 36280}. Best is trial 42 with value: 0.37124776808108756.
[I 2025-12-09 15:28:32,921] Trial 81 finished with value: 0.3690776018320607 and parameters: {'model_type': 'graphsage', 'hidden_dims': '[512, 128]', 'dropout': 0.27286231542776523, 'batch_norm': False, 'sage_aggr': 'mean', 'sage_normalize': False, 'sage_project': False, 'lr': 8.849932437228142e-05, 'weight_decay': 5.922718213641298e-05, 'epochs': 135, 'loss': 'mae', 'optimizer': 'adam', 'graph_mode': 'knn', 'knn_k': 9, 'weighted_edges': True, 'symmetrize_mode': 'union', 'self_loops': True, 'use_snp_selection': True, 'num_snps': 29669}. Best is trial 42 with value: 0.37124776808108756.
[I 2025-12-09 15:30:08,299] Trial 82 finished with value: 0.3667628504415495 and parameters: {'model_type': 'graphsage', 'hidden_dims': '[512, 128]', 'dropout': 0.2708282720113654, 'batch_norm': False, 'sage_aggr': 'mean', 'sage_normalize': False, 'sage_project': False, 'lr': 3.611542267197568e-05, 'weight_decay': 5.5588532269318976e-05, 'epochs': 101, 'loss': 'mae', 'optimizer': 'adam', 'graph_mode': 'knn', 'knn_k': 10, 'weighted_edges': True, 'symmetrize_mode': 'union', 'self_loops': True, 'use_snp_selection': True, 'num_snps': 29478}. Best is trial 42 with value: 0.37124776808108756.
[I 2025-12-09 15:31:53,186] Trial 83 finished with value: 0.3680134255609362 and parameters: {'model_type': 'graphsage', 'hidden_dims': '[512, 128]', 'dropout': 0.30676973939548335, 'batch_norm': False, 'sage_aggr': 'mean', 'sage_normalize': False, 'sage_project': False, 'lr': 7.390148167300606e-05, 'weight_decay': 5.9730789026782176e-05, 'epochs': 137, 'loss': 'mae', 'optimizer': 'adam', 'graph_mode': 'knn', 'knn_k': 10, 'weighted_edges': True, 'symmetrize_mode': 'union', 'self_loops': True, 'use_snp_selection': True, 'num_snps': 26644}. Best is trial 42 with value: 0.37124776808108756.
[I 2025-12-09 15:33:20,507] Trial 84 finished with value: 0.36260115456103054 and parameters: {'model_type': 'graphsage', 'hidden_dims': '[512, 128]', 'dropout': 0.27332302868295977, 'batch_norm': False, 'sage_aggr': 'mean', 'sage_normalize': False, 'sage_project': False, 'lr': 6.618331629536692e-05, 'weight_decay': 5.788431922626587e-05, 'epochs': 103, 'loss': 'mae', 'optimizer': 'adam', 'graph_mode': 'knn', 'knn_k': 10, 'weighted_edges': True, 'symmetrize_mode': 'union', 'self_loops': True, 'use_snp_selection': True, 'num_snps': 26563}. Best is trial 42 with value: 0.37124776808108756.
[I 2025-12-09 15:34:50,801] Trial 85 finished with value: 0.36987420895452056 and parameters: {'model_type': 'graphsage', 'hidden_dims': '[512, 128]', 'dropout': 0.31716514380116073, 'batch_norm': False, 'sage_aggr': 'mean', 'sage_normalize': False, 'sage_project': False, 'lr': 7.957318429362346e-05, 'weight_decay': 8.296558567234416e-05, 'epochs': 138, 'loss': 'mae', 'optimizer': 'adam', 'graph_mode': 'knn', 'knn_k': 9, 'weighted_edges': True, 'symmetrize_mode': 'union', 'self_loops': True, 'use_snp_selection': True, 'num_snps': 23583}. Best is trial 42 with value: 0.37124776808108756.
[I 2025-12-09 15:36:13,519] Trial 86 finished with value: 0.35979172639921336 and parameters: {'model_type': 'graphsage', 'hidden_dims': '[512, 128]', 'dropout': 0.3227919194186336, 'batch_norm': False, 'sage_aggr': 'mean', 'sage_normalize': False, 'sage_project': False, 'lr': 0.0001665568274478055, 'weight_decay': 8.660565147854517e-05, 'epochs': 137, 'loss': 'mae', 'optimizer': 'adam', 'graph_mode': 'knn', 'knn_k': 9, 'weighted_edges': True, 'symmetrize_mode': 'union', 'self_loops': True, 'use_snp_selection': True, 'num_snps': 22780}. Best is trial 42 with value: 0.37124776808108756.
[I 2025-12-09 15:37:25,349] Trial 87 finished with value: 0.3690723993355449 and parameters: {'model_type': 'graphsage', 'hidden_dims': '[512, 128]', 'dropout': 0.30774850573190937, 'batch_norm': False, 'sage_aggr': 'mean', 'sage_normalize': False, 'sage_project': False, 'lr': 8.711476903904132e-05, 'weight_decay': 0.0001469731603087374, 'epochs': 132, 'loss': 'mae', 'optimizer': 'adam', 'graph_mode': 'knn', 'knn_k': 9, 'weighted_edges': True, 'symmetrize_mode': 'union', 'self_loops': True, 'use_snp_selection': True, 'num_snps': 20594}. Best is trial 42 with value: 0.37124776808108756.
[I 2025-12-09 15:38:24,992] Trial 88 finished with value: 0.35765809525766773 and parameters: {'model_type': 'graphsage', 'hidden_dims': '[512, 128]', 'dropout': 0.30150574201128355, 'batch_norm': False, 'sage_aggr': 'mean', 'sage_normalize': False, 'sage_project': False, 'lr': 9.170419377017653e-05, 'weight_decay': 0.0001935922349162139, 'epochs': 133, 'loss': 'mae', 'optimizer': 'adam', 'graph_mode': 'knn', 'knn_k': 9, 'weighted_edges': True, 'symmetrize_mode': 'union', 'self_loops': True, 'use_snp_selection': True, 'num_snps': 16254}. Best is trial 42 with value: 0.37124776808108756.
[I 2025-12-09 15:39:41,624] Trial 89 finished with value: 0.3741045796063055 and parameters: {'model_type': 'graphsage', 'hidden_dims': '[128, 64]', 'dropout': 0.3046079978585891, 'batch_norm': False, 'sage_aggr': 'mean', 'sage_normalize': False, 'sage_project': False, 'lr': 7.342038369792512e-05, 'weight_decay': 0.0005912349715931447, 'epochs': 151, 'loss': 'mae', 'optimizer': 'adam', 'graph_mode': 'knn', 'knn_k': 10, 'weighted_edges': True, 'symmetrize_mode': 'union', 'self_loops': True, 'use_snp_selection': True, 'num_snps': 23679}. Best is trial 89 with value: 0.3741045796063055.
[I 2025-12-09 15:40:44,793] Trial 90 finished with value: 0.36444782171494894 and parameters: {'model_type': 'graphsage', 'hidden_dims': '[128, 64]', 'dropout': 0.323232260147048, 'batch_norm': False, 'sage_aggr': 'mean', 'sage_normalize': False, 'sage_project': False, 'lr': 8.320405574458185e-05, 'weight_decay': 0.0005795779008427052, 'epochs': 144, 'loss': 'mae', 'optimizer': 'adam', 'graph_mode': 'knn', 'knn_k': 10, 'weighted_edges': True, 'symmetrize_mode': 'union', 'self_loops': True, 'use_snp_selection': True, 'num_snps': 20086}. Best is trial 89 with value: 0.3741045796063055.
[I 2025-12-09 15:42:00,695] Trial 91 finished with value: 0.3714642939485823 and parameters: {'model_type': 'graphsage', 'hidden_dims': '[128, 64]', 'dropout': 0.30863376915392593, 'batch_norm': False, 'sage_aggr': 'mean', 'sage_normalize': False, 'sage_project': False, 'lr': 0.00010630036871353947, 'weight_decay': 0.00013459633921908824, 'epochs': 115, 'loss': 'mae', 'optimizer': 'adam', 'graph_mode': 'knn', 'knn_k': 9, 'weighted_edges': True, 'symmetrize_mode': 'union', 'self_loops': True, 'use_snp_selection': True, 'num_snps': 26702}. Best is trial 89 with value: 0.3741045796063055.
[I 2025-12-09 15:43:11,782] Trial 92 finished with value: 0.3581683230747456 and parameters: {'model_type': 'graphsage', 'hidden_dims': '[128, 64]', 'dropout': 0.3426821768275861, 'batch_norm': False, 'sage_aggr': 'mean', 'sage_normalize': False, 'sage_project': False, 'lr': 0.00010163359952983208, 'weight_decay': 0.0009109590379478898, 'epochs': 116, 'loss': 'mae', 'optimizer': 'adam', 'graph_mode': 'knn', 'knn_k': 9, 'weighted_edges': True, 'symmetrize_mode': 'union', 'self_loops': True, 'use_snp_selection': True, 'num_snps': 28071}. Best is trial 89 with value: 0.3741045796063055.
[I 2025-12-09 15:44:35,026] Trial 93 finished with value: 0.3665523100468592 and parameters: {'model_type': 'graphsage', 'hidden_dims': '[128, 64]', 'dropout': 0.3074131420301019, 'batch_norm': False, 'sage_aggr': 'mean', 'sage_normalize': False, 'sage_project': False, 'lr': 7.522988521394217e-05, 'weight_decay': 0.00021897417101446302, 'epochs': 150, 'loss': 'mae', 'optimizer': 'adam', 'graph_mode': 'knn', 'knn_k': 10, 'weighted_edges': True, 'symmetrize_mode': 'union', 'self_loops': True, 'use_snp_selection': True, 'num_snps': 24099}. Best is trial 89 with value: 0.3741045796063055.
[I 2025-12-09 15:45:53,543] Trial 94 finished with value: 0.35664109339467975 and parameters: {'model_type': 'graphsage', 'hidden_dims': '[128, 64]', 'dropout': 0.31214950831098454, 'batch_norm': False, 'sage_aggr': 'mean', 'sage_normalize': False, 'sage_project': False, 'lr': 0.0001484726538689106, 'weight_decay': 0.0003827195137022642, 'epochs': 128, 'loss': 'mae', 'optimizer': 'adam', 'graph_mode': 'knn', 'knn_k': 9, 'weighted_edges': True, 'symmetrize_mode': 'union', 'self_loops': True, 'use_snp_selection': True, 'num_snps': 26208}. Best is trial 89 with value: 0.3741045796063055.
[I 2025-12-09 15:46:46,638] Trial 95 finished with value: 0.37154278776324867 and parameters: {'model_type': 'graphsage', 'hidden_dims': '[128, 64]', 'dropout': 0.29073700692012855, 'batch_norm': False, 'sage_aggr': 'mean', 'sage_normalize': False, 'sage_project': False, 'lr': 0.0002660803900174459, 'weight_decay': 0.00013077754962076513, 'epochs': 139, 'loss': 'mae', 'optimizer': 'adam', 'graph_mode': 'knn', 'knn_k': 8, 'weighted_edges': True, 'symmetrize_mode': 'union', 'self_loops': True, 'use_snp_selection': True, 'num_snps': 17891}. Best is trial 89 with value: 0.3741045796063055.
[I 2025-12-09 15:47:32,818] Trial 96 finished with value: 0.3590078723209086 and parameters: {'model_type': 'graphsage', 'hidden_dims': '[128, 64]', 'dropout': 0.2858014826356941, 'batch_norm': False, 'sage_aggr': 'mean', 'sage_normalize': False, 'sage_project': False, 'lr': 0.00023046530994604066, 'weight_decay': 0.00012109513355921193, 'epochs': 142, 'loss': 'mse', 'optimizer': 'adam', 'graph_mode': 'knn', 'knn_k': 8, 'weighted_edges': True, 'symmetrize_mode': 'union', 'self_loops': True, 'use_snp_selection': True, 'num_snps': 14271}. Best is trial 89 with value: 0.3741045796063055.
[I 2025-12-09 15:49:05,225] Trial 97 finished with value: 0.3310554333452771 and parameters: {'model_type': 'graphsage', 'hidden_dims': '[128, 64]', 'dropout': 0.2572518260416227, 'batch_norm': True, 'sage_aggr': 'mean', 'sage_normalize': True, 'sage_project': False, 'lr': 0.0004147364731798676, 'weight_decay': 0.00015871318760120255, 'epochs': 152, 'loss': 'mae', 'optimizer': 'adam', 'graph_mode': 'knn', 'knn_k': 9, 'weighted_edges': True, 'symmetrize_mode': 'union', 'self_loops': True, 'use_snp_selection': False}. Best is trial 89 with value: 0.3741045796063055.
[I 2025-12-09 15:49:59,319] Trial 98 finished with value: 0.36470091920373837 and parameters: {'model_type': 'graphsage', 'hidden_dims': '[128, 64]', 'dropout': 0.29535777960986137, 'batch_norm': False, 'sage_aggr': 'mean', 'sage_normalize': False, 'sage_project': False, 'lr': 0.000111333331905647, 'weight_decay': 7.238373313423904e-05, 'epochs': 133, 'loss': 'mae', 'optimizer': 'adam', 'graph_mode': 'knn', 'knn_k': 8, 'weighted_edges': True, 'symmetrize_mode': 'union', 'self_loops': True, 'use_snp_selection': True, 'num_snps': 18524}. Best is trial 89 with value: 0.3741045796063055.
[I 2025-12-09 15:51:11,139] Trial 99 finished with value: 0.36870445687105113 and parameters: {'model_type': 'graphsage', 'hidden_dims': '[128, 64]', 'dropout': 0.3243355161164923, 'batch_norm': False, 'sage_aggr': 'mean', 'sage_normalize': False, 'sage_project': False, 'lr': 0.00018477501944866938, 'weight_decay': 0.00032932864316793627, 'epochs': 170, 'loss': 'mae', 'optimizer': 'adam', 'graph_mode': 'knn', 'knn_k': 9, 'weighted_edges': True, 'symmetrize_mode': 'union', 'self_loops': True, 'use_snp_selection': True, 'num_snps': 23043}. Best is trial 89 with value: 0.3741045796063055.
[I 2025-12-09 15:52:33,840] Trial 100 finished with value: 0.36647251085436927 and parameters: {'model_type': 'graphsage', 'hidden_dims': '[128, 64]', 'dropout': 0.32714345052308846, 'batch_norm': False, 'sage_aggr': 'mean', 'sage_normalize': False, 'sage_project': False, 'lr': 0.0001687171576484307, 'weight_decay': 0.0003272039218939529, 'epochs': 170, 'loss': 'mae', 'optimizer': 'adam', 'graph_mode': 'knn', 'knn_k': 9, 'weighted_edges': True, 'symmetrize_mode': 'union', 'self_loops': True, 'use_snp_selection': True, 'num_snps': 23199}. Best is trial 89 with value: 0.3741045796063055.
[I 2025-12-09 15:54:01,104] Trial 101 finished with value: 0.3679384501463411 and parameters: {'model_type': 'graphsage', 'hidden_dims': '[128, 64]', 'dropout': 0.3102728873614797, 'batch_norm': False, 'sage_aggr': 'mean', 'sage_normalize': False, 'sage_project': False, 'lr': 0.000257632199814844, 'weight_decay': 0.0005792877834745014, 'epochs': 158, 'loss': 'mae', 'optimizer': 'adam', 'graph_mode': 'knn', 'knn_k': 10, 'weighted_edges': True, 'symmetrize_mode': 'union', 'self_loops': True, 'use_snp_selection': True, 'num_snps': 25185}. Best is trial 89 with value: 0.3741045796063055.
[I 2025-12-09 15:55:25,410] Trial 102 finished with value: 0.36719420776269696 and parameters: {'model_type': 'graphsage', 'hidden_dims': '[128, 64]', 'dropout': 0.3088347261572987, 'batch_norm': False, 'sage_aggr': 'mean', 'sage_normalize': False, 'sage_project': False, 'lr': 0.0002742940611745945, 'weight_decay': 0.0007232327962625239, 'epochs': 179, 'loss': 'mae', 'optimizer': 'adam', 'graph_mode': 'knn', 'knn_k': 10, 'weighted_edges': True, 'symmetrize_mode': 'union', 'self_loops': True, 'use_snp_selection': True, 'num_snps': 21581}. Best is trial 89 with value: 0.3741045796063055.
[I 2025-12-09 15:56:51,776] Trial 103 finished with value: 0.3677681089150544 and parameters: {'model_type': 'graphsage', 'hidden_dims': '[128, 64]', 'dropout': 0.34118739178786417, 'batch_norm': False, 'sage_aggr': 'mean', 'sage_normalize': False, 'sage_project': False, 'lr': 0.000268937997744465, 'weight_decay': 0.00025583204124158106, 'epochs': 168, 'loss': 'mae', 'optimizer': 'adam', 'graph_mode': 'knn', 'knn_k': 9, 'weighted_edges': True, 'symmetrize_mode': 'union', 'self_loops': True, 'use_snp_selection': True, 'num_snps': 25339}. Best is trial 89 with value: 0.3741045796063055.
[I 2025-12-09 15:57:49,679] Trial 104 finished with value: 0.3605864234677376 and parameters: {'model_type': 'graphsage', 'hidden_dims': '[128, 64]', 'dropout': 0.29101914711722077, 'batch_norm': False, 'sage_aggr': 'mean', 'sage_normalize': False, 'sage_project': False, 'lr': 0.00012722067410781275, 'weight_decay': 0.0004615921995255751, 'epochs': 155, 'loss': 'mae', 'optimizer': 'adam', 'graph_mode': 'knn', 'knn_k': 10, 'weighted_edges': True, 'symmetrize_mode': 'union', 'self_loops': True, 'use_snp_selection': True, 'num_snps': 17218}. Best is trial 89 with value: 0.3741045796063055.
