[I 2025-12-09 20:43:36,869] Trial 70 finished with value: 0.29920739310270206 and parameters: {'model_type': 'graphsage', 'hidden_dims': '[256, 128]', 'dropout': 0.40455454084419984, 'batch_norm': False, 'sage_aggr': 'max', 'sage_normalize': False, 'sage_project': False, 'lr': 2.4836115104333726e-05, 'weight_decay': 0.00019908047752547904, 'epochs': 196, 'loss': 'mse', 'optimizer': 'adam', 'graph_mode': 'cutoff', 'cutoff': 0.37334491972685413, 'grm_norm': 'none', 'self_loops': True, 'use_snp_selection': True, 'num_snps': 20520}. Best is trial 69 with value: 0.3004994880946845.
[I 2025-12-09 20:44:36,107] Trial 71 finished with value: 0.29751421143948764 and parameters: {'model_type': 'graphsage', 'hidden_dims': '[256, 128]', 'dropout': 0.340823867789489, 'batch_norm': False, 'sage_aggr': 'max', 'sage_normalize': False, 'sage_project': False, 'lr': 2.6942998616748796e-05, 'weight_decay': 0.00017791408674495127, 'epochs': 186, 'loss': 'mse', 'optimizer': 'adam', 'graph_mode': 'cutoff', 'cutoff': 0.3922887230747655, 'grm_norm': 'none', 'self_loops': True, 'use_snp_selection': True, 'num_snps': 20296}. Best is trial 69 with value: 0.3004994880946845.
[I 2025-12-09 20:45:36,632] Trial 72 finished with value: 0.29507978022145415 and parameters: {'model_type': 'graphsage', 'hidden_dims': '[256, 128]', 'dropout': 0.34136847545868404, 'batch_norm': False, 'sage_aggr': 'max', 'sage_normalize': False, 'sage_project': False, 'lr': 2.5076439291207507e-05, 'weight_decay': 0.00017869048063023853, 'epochs': 187, 'loss': 'mse', 'optimizer': 'adam', 'graph_mode': 'cutoff', 'cutoff': 0.39646473255066794, 'grm_norm': 'none', 'self_loops': True, 'use_snp_selection': True, 'num_snps': 20541}. Best is trial 69 with value: 0.3004994880946845.
[I 2025-12-09 20:47:04,760] Trial 73 finished with value: 0.2947901078956791 and parameters: {'model_type': 'graphsage', 'hidden_dims': '[256, 128]', 'dropout': 0.4112908119816453, 'batch_norm': False, 'sage_aggr': 'max', 'sage_normalize': False, 'sage_project': False, 'lr': 3.23530991076132e-05, 'weight_decay': 0.00031096958467508273, 'epochs': 199, 'loss': 'mse', 'optimizer': 'adam', 'graph_mode': 'cutoff', 'cutoff': 0.33440814938498387, 'grm_norm': 'none', 'self_loops': True, 'use_snp_selection': True, 'num_snps': 23603}. Best is trial 69 with value: 0.3004994880946845.
[I 2025-12-09 20:48:02,918] Trial 74 finished with value: 0.30183239334450057 and parameters: {'model_type': 'graphsage', 'hidden_dims': '[256, 128]', 'dropout': 0.28207430674577383, 'batch_norm': False, 'sage_aggr': 'max', 'sage_normalize': False, 'sage_project': False, 'lr': 1.5719846024766455e-05, 'weight_decay': 0.00020305286647342644, 'epochs': 157, 'loss': 'mse', 'optimizer': 'adam', 'graph_mode': 'cutoff', 'cutoff': 0.42620703221003386, 'grm_norm': 'none', 'self_loops': True, 'use_snp_selection': True, 'num_snps': 21429}. Best is trial 74 with value: 0.30183239334450057.
[I 2025-12-09 20:49:02,268] Trial 75 finished with value: 0.29665910843675947 and parameters: {'model_type': 'graphsage', 'hidden_dims': '[256, 128]', 'dropout': 0.2693980818364905, 'batch_norm': False, 'sage_aggr': 'max', 'sage_normalize': False, 'sage_project': False, 'lr': 2.4532185515722892e-05, 'weight_decay': 4.3999517563560596e-05, 'epochs': 183, 'loss': 'mse', 'optimizer': 'adam', 'graph_mode': 'cutoff', 'cutoff': 0.44525046577169125, 'grm_norm': 'none', 'self_loops': True, 'use_snp_selection': True, 'num_snps': 21084}. Best is trial 74 with value: 0.30183239334450057.
[I 2025-12-09 20:49:54,081] Trial 76 finished with value: 0.28928960978929164 and parameters: {'model_type': 'graphsage', 'hidden_dims': '[256, 128]', 'dropout': 0.27974717848345637, 'batch_norm': False, 'sage_aggr': 'max', 'sage_normalize': False, 'sage_project': False, 'lr': 1.7224657702917478e-05, 'weight_decay': 4.707434803847207e-05, 'epochs': 162, 'loss': 'mae', 'optimizer': 'adam', 'graph_mode': 'cutoff', 'cutoff': 0.4440416142808524, 'grm_norm': 'none', 'self_loops': True, 'use_snp_selection': True, 'num_snps': 18653}. Best is trial 74 with value: 0.30183239334450057.
[I 2025-12-09 20:50:55,894] Trial 77 finished with value: 0.30093147118097996 and parameters: {'model_type': 'graphsage', 'hidden_dims': '[256, 128]', 'dropout': 0.26082462105204024, 'batch_norm': False, 'sage_aggr': 'max', 'sage_normalize': False, 'sage_project': False, 'lr': 1.4989361164968868e-05, 'weight_decay': 9.978841893482634e-05, 'epochs': 182, 'loss': 'mse', 'optimizer': 'adam', 'graph_mode': 'cutoff', 'cutoff': 0.3994208756764948, 'grm_norm': 'none', 'self_loops': False, 'use_snp_selection': True, 'num_snps': 21725}. Best is trial 74 with value: 0.30183239334450057.
[I 2025-12-09 20:51:58,495] Trial 78 finished with value: 0.29313928929063127 and parameters: {'model_type': 'graphsage', 'hidden_dims': '[256, 128]', 'dropout': 0.17832426361134474, 'batch_norm': False, 'sage_aggr': 'mean', 'sage_normalize': False, 'sage_project': False, 'lr': 1.4902125497838823e-05, 'weight_decay': 0.00016893761958340362, 'epochs': 196, 'loss': 'mse', 'optimizer': 'adam', 'graph_mode': 'cutoff', 'cutoff': 0.3805265567167443, 'grm_norm': 'none', 'self_loops': False, 'use_snp_selection': True, 'num_snps': 22130}. Best is trial 74 with value: 0.30183239334450057.
[I 2025-12-09 20:52:48,260] Trial 79 finished with value: 0.2810248395835541 and parameters: {'model_type': 'graphsage', 'hidden_dims': '[256, 128]', 'dropout': 0.30008519084907403, 'batch_norm': False, 'sage_aggr': 'max', 'sage_normalize': True, 'sage_project': False, 'lr': 2.991014265869876e-05, 'weight_decay': 0.00021574044364083993, 'epochs': 140, 'loss': 'mse', 'optimizer': 'adam', 'graph_mode': 'cutoff', 'cutoff': 0.2900599421016067, 'grm_norm': 'none', 'self_loops': False, 'use_snp_selection': True, 'num_snps': 14831}. Best is trial 74 with value: 0.30183239334450057.
[I 2025-12-09 20:55:08,841] Trial 80 finished with value: 0.2752712538514369 and parameters: {'model_type': 'graphsage', 'hidden_dims': '[512, 64]', 'dropout': 0.2123993176586665, 'batch_norm': True, 'sage_aggr': 'max', 'sage_normalize': False, 'sage_project': False, 'lr': 1.5941868204190305e-05, 'weight_decay': 9.95395671886722e-05, 'epochs': 181, 'loss': 'mse', 'optimizer': 'adam', 'graph_mode': 'cutoff', 'cutoff': 0.39633803699746384, 'grm_norm': 'none', 'self_loops': False, 'use_snp_selection': False}. Best is trial 74 with value: 0.30183239334450057.
[I 2025-12-09 20:56:11,317] Trial 81 finished with value: 0.30246629238905137 and parameters: {'model_type': 'graphsage', 'hidden_dims': '[256, 128]', 'dropout': 0.23652159748153914, 'batch_norm': False, 'sage_aggr': 'max', 'sage_normalize': False, 'sage_project': False, 'lr': 2.7679877728673977e-05, 'weight_decay': 0.00010443603758990348, 'epochs': 185, 'loss': 'mse', 'optimizer': 'adam', 'graph_mode': 'cutoff', 'cutoff': 0.4391700157431294, 'grm_norm': 'none', 'self_loops': False, 'use_snp_selection': True, 'num_snps': 21462}. Best is trial 81 with value: 0.30246629238905137.
[I 2025-12-09 20:57:24,204] Trial 82 finished with value: 0.3003808988555278 and parameters: {'model_type': 'graphsage', 'hidden_dims': '[256, 128]', 'dropout': 0.24918832268312846, 'batch_norm': False, 'sage_aggr': 'max', 'sage_normalize': False, 'sage_project': False, 'lr': 3.46906865414202e-05, 'weight_decay': 0.00014417388222623273, 'epochs': 159, 'loss': 'mse', 'optimizer': 'adam', 'graph_mode': 'cutoff', 'cutoff': 0.48032412989734496, 'grm_norm': 'none', 'self_loops': False, 'use_snp_selection': True, 'num_snps': 28418}. Best is trial 81 with value: 0.30246629238905137.
[I 2025-12-09 20:58:11,897] Trial 83 finished with value: 0.29328917233672996 and parameters: {'model_type': 'graphsage', 'hidden_dims': '[256, 128]', 'dropout': 0.235615360470454, 'batch_norm': False, 'sage_aggr': 'max', 'sage_normalize': False, 'sage_project': False, 'lr': 2.782624680971833e-05, 'weight_decay': 0.00013996380455988288, 'epochs': 156, 'loss': 'mse', 'optimizer': 'adam', 'graph_mode': 'cutoff', 'cutoff': 0.5044842290094907, 'grm_norm': 'none', 'self_loops': False, 'use_snp_selection': True, 'num_snps': 18401}. Best is trial 81 with value: 0.30246629238905137.
[I 2025-12-09 20:59:14,025] Trial 84 finished with value: 0.2989605360583596 and parameters: {'model_type': 'graphsage', 'hidden_dims': '[256, 128]', 'dropout': 0.19688362171972373, 'batch_norm': False, 'sage_aggr': 'max', 'sage_normalize': False, 'sage_project': False, 'lr': 3.5312153115873364e-05, 'weight_decay': 0.0001057802894450543, 'epochs': 167, 'loss': 'mse', 'optimizer': 'adam', 'graph_mode': 'cutoff', 'cutoff': 0.42302448704668305, 'grm_norm': 'none', 'self_loops': False, 'use_snp_selection': True, 'num_snps': 21973}. Best is trial 81 with value: 0.30246629238905137.
[I 2025-12-09 21:00:05,926] Trial 85 finished with value: 0.30048385462328875 and parameters: {'model_type': 'graphsage', 'hidden_dims': '[256, 128]', 'dropout': 0.23906633737725355, 'batch_norm': False, 'sage_aggr': 'max', 'sage_normalize': False, 'sage_project': False, 'lr': 4.2276075575553614e-05, 'weight_decay': 0.00010040584981565399, 'epochs': 126, 'loss': 'mse', 'optimizer': 'adam', 'graph_mode': 'cutoff', 'cutoff': 0.4413526807083645, 'grm_norm': 'none', 'self_loops': False, 'use_snp_selection': True, 'num_snps': 22612}. Best is trial 81 with value: 0.30246629238905137.
[I 2025-12-09 21:00:59,575] Trial 86 finished with value: 0.3025663019740078 and parameters: {'model_type': 'graphsage', 'hidden_dims': '[256, 128]', 'dropout': 0.1897047153495714, 'batch_norm': False, 'sage_aggr': 'max', 'sage_normalize': False, 'sage_project': False, 'lr': 4.124520255263746e-05, 'weight_decay': 7.316887632575833e-05, 'epochs': 130, 'loss': 'mse', 'optimizer': 'adam', 'graph_mode': 'cutoff', 'cutoff': 0.44876554244085276, 'grm_norm': 'none', 'self_loops': False, 'use_snp_selection': True, 'num_snps': 22493}. Best is trial 86 with value: 0.3025663019740078.
[I 2025-12-09 21:01:51,425] Trial 87 finished with value: 0.2967369787896359 and parameters: {'model_type': 'graphsage', 'hidden_dims': '[256, 128]', 'dropout': 0.1806342685673165, 'batch_norm': False, 'sage_aggr': 'max', 'sage_normalize': False, 'sage_project': False, 'lr': 5.098772567323369e-05, 'weight_decay': 6.417016789343763e-05, 'epochs': 122, 'loss': 'mse', 'optimizer': 'adam', 'graph_mode': 'cutoff', 'cutoff': 0.4499720583272814, 'grm_norm': 'none', 'self_loops': False, 'use_snp_selection': True, 'num_snps': 22143}. Best is trial 86 with value: 0.3025663019740078.
[I 2025-12-09 21:02:32,513] Trial 88 finished with value: 0.29675459346070576 and parameters: {'model_type': 'graphsage', 'hidden_dims': '[256, 128]', 'dropout': 0.14979319027489219, 'batch_norm': False, 'sage_aggr': 'max', 'sage_normalize': False, 'sage_project': False, 'lr': 3.333117807691127e-05, 'weight_decay': 2.4958781010545652e-05, 'epochs': 105, 'loss': 'mse', 'optimizer': 'adam', 'graph_mode': 'cutoff', 'cutoff': 0.4975913181560533, 'grm_norm': 'none', 'self_loops': False, 'use_snp_selection': True, 'num_snps': 18396}. Best is trial 86 with value: 0.3025663019740078.
[I 2025-12-09 21:03:13,249] Trial 89 finished with value: 0.29239889626894067 and parameters: {'model_type': 'graphsage', 'hidden_dims': '[256, 128]', 'dropout': 0.246804675956607, 'batch_norm': False, 'sage_aggr': 'max', 'sage_normalize': False, 'sage_project': False, 'lr': 4.347985364153298e-05, 'weight_decay': 9.398630463393569e-05, 'epochs': 129, 'loss': 'mse', 'optimizer': 'adam', 'graph_mode': 'cutoff', 'cutoff': 0.4698435784756413, 'grm_norm': 'none', 'self_loops': False, 'use_snp_selection': True, 'num_snps': 15541}. Best is trial 86 with value: 0.3025663019740078.
[I 2025-12-09 21:04:08,705] Trial 90 finished with value: 0.2933205880738812 and parameters: {'model_type': 'graphsage', 'hidden_dims': '[256, 128]', 'dropout': 0.19549225262049283, 'batch_norm': False, 'sage_aggr': 'mean', 'sage_normalize': False, 'sage_project': False, 'lr': 5.252304468613943e-05, 'weight_decay': 4.329768544021256e-05, 'epochs': 140, 'loss': 'mse', 'optimizer': 'adam', 'graph_mode': 'cutoff', 'cutoff': 0.4164268588902938, 'grm_norm': 'none', 'self_loops': False, 'use_snp_selection': True, 'num_snps': 23394}. Best is trial 86 with value: 0.3025663019740078.
[I 2025-12-09 21:05:09,774] Trial 91 finished with value: 0.2863886335680978 and parameters: {'model_type': 'graphsage', 'hidden_dims': '[256, 128]', 'dropout': 0.19978739087886715, 'batch_norm': False, 'sage_aggr': 'max', 'sage_normalize': False, 'sage_project': False, 'lr': 4.268116706122871e-05, 'weight_decay': 0.00011074552840025099, 'epochs': 164, 'loss': 'mse', 'optimizer': 'adam', 'graph_mode': 'cutoff', 'cutoff': 0.546645800997769, 'grm_norm': 'none', 'self_loops': False, 'use_snp_selection': True, 'num_snps': 29107}. Best is trial 86 with value: 0.3025663019740078.
[I 2025-12-09 21:05:56,894] Trial 92 finished with value: 0.2872393363754182 and parameters: {'model_type': 'graphsage', 'hidden_dims': '[256, 128]', 'dropout': 0.15419122520403838, 'batch_norm': False, 'sage_aggr': 'max', 'sage_normalize': False, 'sage_project': False, 'lr': 3.5532444553491524e-05, 'weight_decay': 7.614378123930349e-05, 'epochs': 153, 'loss': 'mse', 'optimizer': 'adam', 'graph_mode': 'cutoff', 'cutoff': 0.5345372336597662, 'grm_norm': 'none', 'self_loops': False, 'use_snp_selection': True, 'num_snps': 21297}. Best is trial 86 with value: 0.3025663019740078.
[I 2025-12-09 21:06:41,558] Trial 93 finished with value: 0.30161984765852035 and parameters: {'model_type': 'graphsage', 'hidden_dims': '[256, 128]', 'dropout': 0.24456703983217762, 'batch_norm': False, 'sage_aggr': 'max', 'sage_normalize': False, 'sage_project': False, 'lr': 2.020291248419905e-05, 'weight_decay': 0.0002235557260599314, 'epochs': 128, 'loss': 'mse', 'optimizer': 'adam', 'graph_mode': 'cutoff', 'cutoff': 0.43632178218396866, 'grm_norm': 'none', 'self_loops': False, 'use_snp_selection': True, 'num_snps': 17754}. Best is trial 86 with value: 0.3025663019740078.
[I 2025-12-09 21:07:23,054] Trial 94 finished with value: 0.29781100556154133 and parameters: {'model_type': 'graphsage', 'hidden_dims': '[256, 128, 64]', 'dropout': 0.23801017874935054, 'batch_norm': False, 'sage_aggr': 'max', 'sage_normalize': False, 'sage_project': False, 'lr': 1.797675612027124e-05, 'weight_decay': 0.0002340854583741609, 'epochs': 102, 'loss': 'mse', 'optimizer': 'adam', 'graph_mode': 'cutoff', 'cutoff': 0.42577321414825275, 'grm_norm': 'none', 'self_loops': False, 'use_snp_selection': True, 'num_snps': 17983}. Best is trial 86 with value: 0.3025663019740078.
[I 2025-12-09 21:08:19,053] Trial 95 finished with value: 0.3029177983161712 and parameters: {'model_type': 'graphsage', 'hidden_dims': '[512, 128]', 'dropout': 0.22242242921943192, 'batch_norm': False, 'sage_aggr': 'max', 'sage_normalize': False, 'sage_project': False, 'lr': 2.4296931560112336e-05, 'weight_decay': 5.8162581680532534e-05, 'epochs': 125, 'loss': 'mse', 'optimizer': 'adam', 'graph_mode': 'cutoff', 'cutoff': 0.46789207698631563, 'grm_norm': 'none', 'self_loops': False, 'use_snp_selection': True, 'num_snps': 19532}. Best is trial 95 with value: 0.3029177983161712.
[I 2025-12-09 21:09:05,853] Trial 96 finished with value: 0.28204767150977106 and parameters: {'model_type': 'graphsage', 'hidden_dims': '[512, 128]', 'dropout': 0.2594333606306012, 'batch_norm': False, 'sage_aggr': 'max', 'sage_normalize': False, 'sage_project': False, 'lr': 2.2280939051380502e-05, 'weight_decay': 0.00019873449497516914, 'epochs': 86, 'loss': 'mae', 'optimizer': 'adam', 'graph_mode': 'cutoff', 'cutoff': 0.47777698067131624, 'grm_norm': 'none', 'self_loops': False, 'use_snp_selection': True, 'num_snps': 19641}. Best is trial 95 with value: 0.3029177983161712.
[I 2025-12-09 21:09:52,619] Trial 97 finished with value: 0.2836102537974014 and parameters: {'model_type': 'graphsage', 'hidden_dims': '[512, 128]', 'dropout': 0.21312002175665087, 'batch_norm': False, 'sage_aggr': 'max', 'sage_normalize': True, 'sage_project': False, 'lr': 2.133832281062962e-05, 'weight_decay': 5.4715352548865136e-05, 'epochs': 141, 'loss': 'mse', 'optimizer': 'adam', 'graph_mode': 'cutoff', 'cutoff': 0.4659893311758904, 'grm_norm': 'none', 'self_loops': False, 'use_snp_selection': True, 'num_snps': 13171}. Best is trial 95 with value: 0.3029177983161712.
[I 2025-12-09 21:10:40,032] Trial 98 finished with value: 0.27653546323461176 and parameters: {'model_type': 'graphsage', 'hidden_dims': '[512, 128]', 'dropout': 0.26969915274513423, 'batch_norm': True, 'sage_aggr': 'max', 'sage_normalize': False, 'sage_project': False, 'lr': 1.1435446983848773e-05, 'weight_decay': 3.64702154478506e-05, 'epochs': 116, 'loss': 'mse', 'optimizer': 'adam', 'graph_mode': 'cutoff', 'cutoff': 0.5032701592606279, 'grm_norm': 'none', 'self_loops': False, 'use_snp_selection': True, 'num_snps': 16620}. Best is trial 95 with value: 0.3029177983161712.
[I 2025-12-09 21:12:23,915] Trial 99 finished with value: 0.29407349417102985 and parameters: {'model_type': 'graphsage', 'hidden_dims': '[512, 128]', 'dropout': 0.24683595387884452, 'batch_norm': False, 'sage_aggr': 'max', 'sage_normalize': False, 'sage_project': False, 'lr': 1.674323517391727e-05, 'weight_decay': 0.00014570784460718472, 'epochs': 132, 'loss': 'mse', 'optimizer': 'adam', 'graph_mode': 'cutoff', 'cutoff': 0.378084525858251, 'grm_norm': 'gcn', 'self_loops': False, 'use_snp_selection': False}. Best is trial 95 with value: 0.3029177983161712.
[I 2025-12-09 21:13:20,609] Trial 100 finished with value: 0.30027873763298496 and parameters: {'model_type': 'graphsage', 'hidden_dims': '[256, 128]', 'dropout': 0.2264060668027741, 'batch_norm': False, 'sage_aggr': 'max', 'sage_normalize': False, 'sage_project': False, 'lr': 2.7444340095586442e-05, 'weight_decay': 8.061860786579125e-05, 'epochs': 126, 'loss': 'mse', 'optimizer': 'adam', 'graph_mode': 'cutoff', 'cutoff': 0.41511034461317414, 'grm_norm': 'none', 'self_loops': False, 'use_snp_selection': True, 'num_snps': 23438}. Best is trial 95 with value: 0.3029177983161712.
[I 2025-12-09 21:14:18,008] Trial 101 finished with value: 0.3007088582760623 and parameters: {'model_type': 'graphsage', 'hidden_dims': '[256, 128]', 'dropout': 0.22475390148651614, 'batch_norm': False, 'sage_aggr': 'max', 'sage_normalize': False, 'sage_project': False, 'lr': 2.9067450909569602e-05, 'weight_decay': 8.279990774581107e-05, 'epochs': 124, 'loss': 'mse', 'optimizer': 'adam', 'graph_mode': 'cutoff', 'cutoff': 0.4162945330870711, 'grm_norm': 'none', 'self_loops': False, 'use_snp_selection': True, 'num_snps': 24015}. Best is trial 95 with value: 0.3029177983161712.
[I 2025-12-09 21:15:27,444] Trial 102 finished with value: 0.30628442229414143 and parameters: {'model_type': 'graphsage', 'hidden_dims': '[512, 64]', 'dropout': 0.2214921340412305, 'batch_norm': False, 'sage_aggr': 'max', 'sage_normalize': False, 'sage_project': False, 'lr': 2.916026297527404e-05, 'weight_decay': 7.087447760288709e-05, 'epochs': 128, 'loss': 'mse', 'optimizer': 'adam', 'graph_mode': 'cutoff', 'cutoff': 0.417912924642705, 'grm_norm': 'none', 'self_loops': False, 'use_snp_selection': True, 'num_snps': 23888}. Best is trial 102 with value: 0.30628442229414143.
[I 2025-12-09 21:16:32,347] Trial 103 finished with value: 0.29340754458415075 and parameters: {'model_type': 'graphsage', 'hidden_dims': '[512, 64]', 'dropout': 0.2105395430926072, 'batch_norm': False, 'sage_aggr': 'max', 'sage_normalize': False, 'sage_project': False, 'lr': 3.092908391360906e-05, 'weight_decay': 6.86190119014916e-05, 'epochs': 97, 'loss': 'mse', 'optimizer': 'adam', 'graph_mode': 'cutoff', 'cutoff': 0.4554612195139478, 'grm_norm': 'none', 'self_loops': False, 'use_snp_selection': True, 'num_snps': 27138}. Best is trial 102 with value: 0.30628442229414143.
[I 2025-12-09 21:17:40,492] Trial 104 finished with value: 0.30162501813849946 and parameters: {'model_type': 'graphsage', 'hidden_dims': '[512, 64]', 'dropout': 0.22379987852807393, 'batch_norm': False, 'sage_aggr': 'max', 'sage_normalize': False, 'sage_project': False, 'lr': 1.9508829057406653e-05, 'weight_decay': 2.3338557330704654e-05, 'epochs': 122, 'loss': 'mse', 'optimizer': 'adam', 'graph_mode': 'cutoff', 'cutoff': 0.4164671386383144, 'grm_norm': 'none', 'self_loops': False, 'use_snp_selection': True, 'num_snps': 23644}. Best is trial 102 with value: 0.30628442229414143.
[I 2025-12-09 21:18:44,673] Trial 105 finished with value: 0.30625133684121325 and parameters: {'model_type': 'graphsage', 'hidden_dims': '[512, 64]', 'dropout': 0.23164272938858035, 'batch_norm': False, 'sage_aggr': 'max', 'sage_normalize': False, 'sage_project': False, 'lr': 1.534592569769625e-05, 'weight_decay': 2.1973345784739883e-05, 'epochs': 113, 'loss': 'mse', 'optimizer': 'adam', 'graph_mode': 'cutoff', 'cutoff': 0.4109749937266125, 'grm_norm': 'cosine_then_gcn', 'self_loops': False, 'use_snp_selection': True, 'num_snps': 23901}. Best is trial 102 with value: 0.30628442229414143.
[I 2025-12-09 21:19:48,652] Trial 106 finished with value: 0.30298117784252143 and parameters: {'model_type': 'graphsage', 'hidden_dims': '[512, 64]', 'dropout': 0.2213815982444459, 'batch_norm': False, 'sage_aggr': 'max', 'sage_normalize': False, 'sage_project': False, 'lr': 1.4521004434299469e-05, 'weight_decay': 2.0483825310240024e-05, 'epochs': 112, 'loss': 'mse', 'optimizer': 'adam', 'graph_mode': 'cutoff', 'cutoff': 0.4062975656011097, 'grm_norm': 'cosine_then_gcn', 'self_loops': False, 'use_snp_selection': True, 'num_snps': 23979}. Best is trial 102 with value: 0.30628442229414143.
