[I 2025-12-08 19:19:05,557] Trial 117 finished with value: 0.2917665585939533 and parameters: {'model_type': 'graphsage', 'hidden_dims': '[256, 128, 64]', 'dropout': 0.43694077238488466, 'batch_norm': False, 'sage_aggr': 'mean', 'sage_normalize': True, 'sage_project': False, 'lr': 0.0008991206695290107, 'weight_decay': 2.1266114476729077e-05, 'epochs': 313, 'loss': 'mse', 'optimizer': 'adam', 'graph_mode': 'cutoff', 'cutoff': 0.24169567652387652, 'grm_norm': 'none', 'self_loops': False, 'use_snp_selection': True, 'num_snps': 59274}. Best is trial 13 with value: 0.3123866227334652.
[I 2025-12-08 19:20:32,929] Trial 118 finished with value: 0.2625183540511944 and parameters: {'model_type': 'graphsage', 'hidden_dims': '[256, 128]', 'dropout': 0.2166575475283529, 'batch_norm': False, 'sage_aggr': 'mean', 'sage_normalize': True, 'sage_project': False, 'lr': 0.0038896521749628887, 'weight_decay': 4.4624867758098327e-05, 'epochs': 213, 'loss': 'mse', 'optimizer': 'adam', 'graph_mode': 'cutoff', 'cutoff': 0.40157400354548883, 'grm_norm': 'gcn', 'self_loops': False, 'use_snp_selection': False}. Best is trial 13 with value: 0.3123866227334652.
[I 2025-12-08 19:22:47,721] Trial 119 finished with value: 0.3035938912331678 and parameters: {'model_type': 'graphsage', 'hidden_dims': '[256, 128]', 'dropout': 0.39907134906678815, 'batch_norm': False, 'sage_aggr': 'mean', 'sage_normalize': True, 'sage_project': False, 'lr': 0.0029984069449502625, 'weight_decay': 1.2005233290296213e-05, 'epochs': 327, 'loss': 'mse', 'optimizer': 'adam', 'graph_mode': 'cutoff', 'cutoff': 0.3815074639054649, 'grm_norm': 'none', 'self_loops': False, 'use_snp_selection': False}. Best is trial 13 with value: 0.3123866227334652.
[I 2025-12-08 19:25:42,381] Trial 120 finished with value: 0.3090239981400243 and parameters: {'model_type': 'graphsage', 'hidden_dims': '[512, 128]', 'dropout': 0.4997940573331833, 'batch_norm': False, 'sage_aggr': 'mean', 'sage_normalize': True, 'sage_project': False, 'lr': 0.0018175162661833472, 'weight_decay': 1.8195022056469187e-05, 'epochs': 258, 'loss': 'mse', 'optimizer': 'adam', 'graph_mode': 'cutoff', 'cutoff': 0.35147790523900563, 'grm_norm': 'none', 'self_loops': True, 'use_snp_selection': False}. Best is trial 13 with value: 0.3123866227334652.
[I 2025-12-08 19:28:37,548] Trial 121 finished with value: 0.28064956483238246 and parameters: {'model_type': 'graphsage', 'hidden_dims': '[512, 128]', 'dropout': 0.4954959226438004, 'batch_norm': False, 'sage_aggr': 'mean', 'sage_normalize': True, 'sage_project': False, 'lr': 0.0018196080461038613, 'weight_decay': 1.9005592148193985e-05, 'epochs': 259, 'loss': 'mse', 'optimizer': 'adam', 'graph_mode': 'cutoff', 'cutoff': 0.3525274381508697, 'grm_norm': 'none', 'self_loops': True, 'use_snp_selection': False}. Best is trial 13 with value: 0.3123866227334652.
[I 2025-12-08 19:32:23,170] Trial 122 finished with value: 0.3053495769542496 and parameters: {'model_type': 'graphsage', 'hidden_dims': '[512, 128]', 'dropout': 0.4672988972468061, 'batch_norm': False, 'sage_aggr': 'mean', 'sage_normalize': True, 'sage_project': False, 'lr': 0.0014169497254869791, 'weight_decay': 1.6093056220720875e-05, 'epochs': 296, 'loss': 'mse', 'optimizer': 'adam', 'graph_mode': 'cutoff', 'cutoff': 0.32802877326304486, 'grm_norm': 'none', 'self_loops': True, 'use_snp_selection': False}. Best is trial 13 with value: 0.3123866227334652.
[I 2025-12-08 19:34:49,953] Trial 123 finished with value: 0.29787317925338497 and parameters: {'model_type': 'graphsage', 'hidden_dims': '[512, 128]', 'dropout': 0.5004799245773525, 'batch_norm': False, 'sage_aggr': 'mean', 'sage_normalize': True, 'sage_project': False, 'lr': 0.0010689842230598343, 'weight_decay': 9.11549015051105e-06, 'epochs': 228, 'loss': 'mse', 'optimizer': 'adam', 'graph_mode': 'cutoff', 'cutoff': 0.43206922832186284, 'grm_norm': 'none', 'self_loops': True, 'use_snp_selection': False}. Best is trial 13 with value: 0.3123866227334652.
[I 2025-12-08 19:38:09,326] Trial 124 finished with value: 0.30141758695986615 and parameters: {'model_type': 'graphsage', 'hidden_dims': '[512, 128]', 'dropout': 0.5184817019164162, 'batch_norm': False, 'sage_aggr': 'mean', 'sage_normalize': True, 'sage_project': False, 'lr': 0.0022798889542725246, 'weight_decay': 6.029154040203489e-06, 'epochs': 308, 'loss': 'mse', 'optimizer': 'adam', 'graph_mode': 'cutoff', 'cutoff': 0.40015304057828033, 'grm_norm': 'none', 'self_loops': True, 'use_snp_selection': False}. Best is trial 13 with value: 0.3123866227334652.
[I 2025-12-08 19:40:20,431] Trial 125 finished with value: 0.29712857106711404 and parameters: {'model_type': 'graphsage', 'hidden_dims': '[256, 128]', 'dropout': 0.479100688207335, 'batch_norm': False, 'sage_aggr': 'mean', 'sage_normalize': True, 'sage_project': False, 'lr': 0.0013044968887518037, 'weight_decay': 5.561051484606164e-05, 'epochs': 316, 'loss': 'mse', 'optimizer': 'adam', 'graph_mode': 'cutoff', 'cutoff': 0.37774335752861765, 'grm_norm': 'gcn', 'self_loops': True, 'use_snp_selection': False}. Best is trial 13 with value: 0.3123866227334652.
[I 2025-12-08 19:42:51,869] Trial 126 finished with value: 0.2623128394564213 and parameters: {'model_type': 'graphsage', 'hidden_dims': '[256, 128]', 'dropout': 0.4535564121101621, 'batch_norm': False, 'sage_aggr': 'max', 'sage_normalize': True, 'sage_project': False, 'lr': 0.0016589966495965957, 'weight_decay': 2.421310140594959e-05, 'epochs': 252, 'loss': 'mae', 'optimizer': 'adam', 'graph_mode': 'cutoff', 'cutoff': 0.30045702121238654, 'grm_norm': 'cosine', 'self_loops': False, 'use_snp_selection': False}. Best is trial 13 with value: 0.3123866227334652.
[I 2025-12-08 19:46:25,847] Trial 127 finished with value: 0.305505429755632 and parameters: {'model_type': 'graphsage', 'hidden_dims': '[512, 128]', 'dropout': 0.48686230827505583, 'batch_norm': False, 'sage_aggr': 'mean', 'sage_normalize': True, 'sage_project': False, 'lr': 0.0007337035965718133, 'weight_decay': 1.0663290051722326e-05, 'epochs': 335, 'loss': 'mse', 'optimizer': 'adam', 'graph_mode': 'cutoff', 'cutoff': 0.4248717345073726, 'grm_norm': 'none', 'self_loops': False, 'use_snp_selection': False}. Best is trial 13 with value: 0.3123866227334652.
[I 2025-12-08 19:48:28,392] Trial 128 finished with value: 0.296224911341025 and parameters: {'model_type': 'graphsage', 'hidden_dims': '[256, 128]', 'dropout': 0.47218660441398697, 'batch_norm': False, 'sage_aggr': 'mean', 'sage_normalize': True, 'sage_project': False, 'lr': 0.002030601818802436, 'weight_decay': 9.46775390211795e-05, 'epochs': 279, 'loss': 'mse', 'optimizer': 'adam', 'graph_mode': 'cutoff', 'cutoff': 0.34466538717251877, 'grm_norm': 'none', 'self_loops': False, 'use_snp_selection': False}. Best is trial 13 with value: 0.3123866227334652.
[I 2025-12-08 19:50:36,462] Trial 129 finished with value: 0.2508909895388341 and parameters: {'model_type': 'graphsage', 'hidden_dims': '[128, 64]', 'dropout': 0.42883673450861676, 'batch_norm': True, 'sage_aggr': 'mean', 'sage_normalize': True, 'sage_project': False, 'lr': 3.438936705339848e-05, 'weight_decay': 1.0559244433431655e-07, 'epochs': 293, 'loss': 'mse', 'optimizer': 'adam', 'graph_mode': 'knn', 'knn_k': 5, 'weighted_edges': False, 'symmetrize_mode': 'union', 'self_loops': False, 'use_snp_selection': False}. Best is trial 13 with value: 0.3123866227334652.
[I 2025-12-08 19:54:09,778] Trial 130 finished with value: 0.015001787496691916 and parameters: {'model_type': 'graphsage', 'hidden_dims': '[512, 256]', 'dropout': 0.49948503550618983, 'batch_norm': False, 'sage_aggr': 'mean', 'sage_normalize': False, 'sage_project': False, 'lr': 0.0009893355574936908, 'weight_decay': 3.5280383650897815e-05, 'epochs': 343, 'loss': 'mse', 'optimizer': 'adam', 'graph_mode': 'cutoff', 'cutoff': 0.48077080128615035, 'grm_norm': 'none', 'self_loops': True, 'use_snp_selection': False}. Best is trial 13 with value: 0.3123866227334652.
[I 2025-12-08 19:56:19,371] Trial 131 finished with value: 0.3035965305956233 and parameters: {'model_type': 'graphsage', 'hidden_dims': '[256, 128]', 'dropout': 0.510393202299424, 'batch_norm': False, 'sage_aggr': 'mean', 'sage_normalize': True, 'sage_project': False, 'lr': 0.0025000252407977354, 'weight_decay': 1.2353303416094916e-05, 'epochs': 322, 'loss': 'mse', 'optimizer': 'adam', 'graph_mode': 'cutoff', 'cutoff': 0.40834665820784705, 'grm_norm': 'none', 'self_loops': False, 'use_snp_selection': False}. Best is trial 13 with value: 0.3123866227334652.
[I 2025-12-08 19:58:29,495] Trial 132 finished with value: 0.29772082061702454 and parameters: {'model_type': 'graphsage', 'hidden_dims': '[256, 128]', 'dropout': 0.5127612814427006, 'batch_norm': False, 'sage_aggr': 'mean', 'sage_normalize': True, 'sage_project': False, 'lr': 0.0026914119037498283, 'weight_decay': 1.4967056871010828e-05, 'epochs': 324, 'loss': 'mse', 'optimizer': 'adam', 'graph_mode': 'cutoff', 'cutoff': 0.4105373408414109, 'grm_norm': 'none', 'self_loops': False, 'use_snp_selection': False}. Best is trial 13 with value: 0.3123866227334652.
[I 2025-12-08 20:00:45,329] Trial 133 finished with value: 0.3050708254881479 and parameters: {'model_type': 'graphsage', 'hidden_dims': '[256, 128]', 'dropout': 0.48804647054876366, 'batch_norm': False, 'sage_aggr': 'mean', 'sage_normalize': True, 'sage_project': False, 'lr': 0.003406062565672913, 'weight_decay': 1.918606776982407e-05, 'epochs': 331, 'loss': 'mse', 'optimizer': 'adam', 'graph_mode': 'cutoff', 'cutoff': 0.3856054653921552, 'grm_norm': 'none', 'self_loops': False, 'use_snp_selection': False}. Best is trial 13 with value: 0.3123866227334652.
[I 2025-12-08 20:02:00,045] Trial 134 finished with value: 0.29295192405110304 and parameters: {'model_type': 'graphsage', 'hidden_dims': '[256, 128]', 'dropout': 0.4599275637335137, 'batch_norm': False, 'sage_aggr': 'mean', 'sage_normalize': True, 'sage_project': False, 'lr': 0.001586428853965634, 'weight_decay': 7.571291274599637e-06, 'epochs': 173, 'loss': 'mse', 'optimizer': 'adam', 'graph_mode': 'cutoff', 'cutoff': 0.36455122987946814, 'grm_norm': 'none', 'self_loops': False, 'use_snp_selection': False}. Best is trial 13 with value: 0.3123866227334652.
[I 2025-12-08 20:04:00,494] Trial 135 finished with value: 0.29300707587143787 and parameters: {'model_type': 'graphsage', 'hidden_dims': '[256, 128]', 'dropout': 0.5236989815489531, 'batch_norm': False, 'sage_aggr': 'mean', 'sage_normalize': True, 'sage_project': False, 'lr': 0.004787235364142601, 'weight_decay': 9.383371309109542e-06, 'epochs': 301, 'loss': 'mse', 'optimizer': 'adam', 'graph_mode': 'cutoff', 'cutoff': 0.4199360569361134, 'grm_norm': 'gcn', 'self_loops': False, 'use_snp_selection': False}. Best is trial 13 with value: 0.3123866227334652.
[I 2025-12-08 20:06:05,729] Trial 136 finished with value: 0.30151190708589054 and parameters: {'model_type': 'graphsage', 'hidden_dims': '[256, 128]', 'dropout': 0.47705049617356465, 'batch_norm': False, 'sage_aggr': 'mean', 'sage_normalize': True, 'sage_project': False, 'lr': 0.0013210699552749373, 'weight_decay': 1.2014471441448992e-05, 'epochs': 317, 'loss': 'mse', 'optimizer': 'adam', 'graph_mode': 'cutoff', 'cutoff': 0.43745656083594636, 'grm_norm': 'none', 'self_loops': False, 'use_snp_selection': False}. Best is trial 13 with value: 0.3123866227334652.
[I 2025-12-08 20:06:33,120] Trial 137 finished with value: 0.28739572714657885 and parameters: {'model_type': 'graphsage', 'hidden_dims': '[256, 128]', 'dropout': 0.49540968388084927, 'batch_norm': False, 'sage_aggr': 'mean', 'sage_normalize': True, 'sage_project': False, 'lr': 0.0018520661556479568, 'weight_decay': 2.7195390452684202e-05, 'epochs': 310, 'loss': 'mse', 'optimizer': 'adam', 'graph_mode': 'cutoff', 'cutoff': 0.39418656729295765, 'grm_norm': 'none', 'self_loops': False, 'use_snp_selection': True, 'num_snps': 8121}. Best is trial 13 with value: 0.3123866227334652.
[I 2025-12-08 20:09:52,595] Trial 138 finished with value: 0.3016918745984663 and parameters: {'model_type': 'graphsage', 'hidden_dims': '[256, 128]', 'dropout': 0.5054111625693474, 'batch_norm': False, 'sage_aggr': 'mean', 'sage_normalize': True, 'sage_project': False, 'lr': 0.0008505623710503065, 'weight_decay': 2.2241388179717553e-05, 'epochs': 335, 'loss': 'mse', 'optimizer': 'adam', 'graph_mode': 'cutoff', 'cutoff': 0.28016146088741395, 'grm_norm': 'cosine', 'self_loops': False, 'use_snp_selection': False}. Best is trial 13 with value: 0.3123866227334652.
[I 2025-12-08 20:11:39,462] Trial 139 finished with value: 0.29503958235540323 and parameters: {'model_type': 'graphsage', 'hidden_dims': '[256, 128, 64]', 'dropout': 0.445269405409518, 'batch_norm': False, 'sage_aggr': 'mean', 'sage_normalize': True, 'sage_project': False, 'lr': 0.001155217272181099, 'weight_decay': 1.4789530614425237e-05, 'epochs': 274, 'loss': 'mse', 'optimizer': 'adam', 'graph_mode': 'cutoff', 'cutoff': 0.4444433180421574, 'grm_norm': 'cosine_then_gcn', 'self_loops': False, 'use_snp_selection': False}. Best is trial 13 with value: 0.3123866227334652.
[I 2025-12-08 20:15:16,009] Trial 140 finished with value: 0.3060255443805725 and parameters: {'model_type': 'graphsage', 'hidden_dims': '[512, 128]', 'dropout': 0.41602009748213353, 'batch_norm': False, 'sage_aggr': 'mean', 'sage_normalize': True, 'sage_project': False, 'lr': 0.0028638124092820274, 'weight_decay': 4.053342466541739e-06, 'epochs': 286, 'loss': 'mse', 'optimizer': 'adam', 'graph_mode': 'cutoff', 'cutoff': 0.33124001373217077, 'grm_norm': 'none', 'self_loops': False, 'use_snp_selection': False}. Best is trial 13 with value: 0.3123866227334652.
[I 2025-12-08 20:19:05,203] Trial 141 finished with value: 0.29963418009109316 and parameters: {'model_type': 'graphsage', 'hidden_dims': '[512, 128]', 'dropout': 0.41667918780025903, 'batch_norm': False, 'sage_aggr': 'mean', 'sage_normalize': True, 'sage_project': False, 'lr': 0.0030648248442404842, 'weight_decay': 4.003568604750959e-06, 'epochs': 286, 'loss': 'mse', 'optimizer': 'adam', 'graph_mode': 'cutoff', 'cutoff': 0.3083730692512471, 'grm_norm': 'none', 'self_loops': False, 'use_snp_selection': False}. Best is trial 13 with value: 0.3123866227334652.
[I 2025-12-08 20:22:30,438] Trial 142 finished with value: 0.2836448975702381 and parameters: {'model_type': 'graphsage', 'hidden_dims': '[512, 128]', 'dropout': 0.4716611057776161, 'batch_norm': False, 'sage_aggr': 'mean', 'sage_normalize': True, 'sage_project': False, 'lr': 0.00013318221727731943, 'weight_decay': 5.054835510774151e-06, 'epochs': 305, 'loss': 'mse', 'optimizer': 'adam', 'graph_mode': 'cutoff', 'cutoff': 0.353424695434104, 'grm_norm': 'none', 'self_loops': False, 'use_snp_selection': False}. Best is trial 13 with value: 0.3123866227334652.
[I 2025-12-08 20:26:16,534] Trial 143 finished with value: 0.27759536373894 and parameters: {'model_type': 'graphsage', 'hidden_dims': '[512, 128]', 'dropout': 0.4087553889254129, 'batch_norm': False, 'sage_aggr': 'mean', 'sage_normalize': True, 'sage_project': False, 'lr': 0.0026481055336478715, 'weight_decay': 6.062607497665478e-06, 'epochs': 293, 'loss': 'mse', 'optimizer': 'adam', 'graph_mode': 'cutoff', 'cutoff': 0.32257567066695014, 'grm_norm': 'none', 'self_loops': False, 'use_snp_selection': False}. Best is trial 13 with value: 0.3123866227334652.
[I 2025-12-08 20:29:59,367] Trial 144 finished with value: 0.3048825544406143 and parameters: {'model_type': 'graphsage', 'hidden_dims': '[512, 128]', 'dropout': 0.4545511381388806, 'batch_norm': False, 'sage_aggr': 'mean', 'sage_normalize': True, 'sage_project': False, 'lr': 0.002259091824081549, 'weight_decay': 7.444307198442446e-06, 'epochs': 298, 'loss': 'mse', 'optimizer': 'adam', 'graph_mode': 'cutoff', 'cutoff': 0.33718269294655834, 'grm_norm': 'none', 'self_loops': False, 'use_snp_selection': False}. Best is trial 13 with value: 0.3123866227334652.
[I 2025-12-08 20:32:13,820] Trial 145 finished with value: 0.28254595269618166 and parameters: {'model_type': 'graphsage', 'hidden_dims': '[256, 128]', 'dropout': 0.4364418190520254, 'batch_norm': False, 'sage_aggr': 'mean', 'sage_normalize': True, 'sage_project': False, 'lr': 0.004290925972874507, 'weight_decay': 3.2759393924934924e-06, 'epochs': 321, 'loss': 'mse', 'optimizer': 'adam', 'graph_mode': 'cutoff', 'cutoff': 0.37010182334316066, 'grm_norm': 'gcn', 'self_loops': False, 'use_snp_selection': False}. Best is trial 13 with value: 0.3123866227334652.
[I 2025-12-08 20:34:01,689] Trial 146 finished with value: 0.28354174240226737 and parameters: {'model_type': 'graphsage', 'hidden_dims': '[256, 128]', 'dropout': 0.34570017344840387, 'batch_norm': False, 'sage_aggr': 'max', 'sage_normalize': True, 'sage_project': False, 'lr': 0.0014932714174920203, 'weight_decay': 8.716729305968787e-06, 'epochs': 240, 'loss': 'mse', 'optimizer': 'adam', 'graph_mode': 'cutoff', 'cutoff': 0.39005775672607096, 'grm_norm': 'none', 'self_loops': False, 'use_snp_selection': False}. Best is trial 13 with value: 0.3123866227334652.
[I 2025-12-08 20:37:39,132] Trial 147 finished with value: 0.2649105562062682 and parameters: {'model_type': 'graphsage', 'hidden_dims': '[512, 64]', 'dropout': 0.4621256393513892, 'batch_norm': False, 'sage_aggr': 'mean', 'sage_normalize': True, 'sage_project': False, 'lr': 0.0019539548770439665, 'weight_decay': 1.748997023234896e-05, 'epochs': 346, 'loss': 'mae', 'optimizer': 'adam', 'graph_mode': 'cutoff', 'cutoff': 0.4603957360069543, 'grm_norm': 'none', 'self_loops': False, 'use_snp_selection': False}. Best is trial 13 with value: 0.3123866227334652.
[I 2025-12-08 20:39:12,984] Trial 148 finished with value: 0.2721447744839025 and parameters: {'model_type': 'graphsage', 'hidden_dims': '[512, 128]', 'dropout': 0.4838973094839491, 'batch_norm': False, 'sage_aggr': 'mean', 'sage_normalize': True, 'sage_project': False, 'lr': 0.0017542568433049812, 'weight_decay': 1.1269140274725007e-05, 'epochs': 142, 'loss': 'mse', 'optimizer': 'adam', 'graph_mode': 'cutoff', 'cutoff': 0.41682728716328943, 'grm_norm': 'none', 'self_loops': False, 'use_snp_selection': False}. Best is trial 13 with value: 0.3123866227334652.
[I 2025-12-08 20:41:03,676] Trial 149 finished with value: 0.2884207086965336 and parameters: {'model_type': 'graphsage', 'hidden_dims': '[256, 128]', 'dropout': 0.44719065540429137, 'batch_norm': False, 'sage_aggr': 'mean', 'sage_normalize': True, 'sage_project': False, 'lr': 0.0036134787727599193, 'weight_decay': 2.463688962127426e-06, 'epochs': 266, 'loss': 'mse', 'optimizer': 'adam', 'graph_mode': 'cutoff', 'cutoff': 0.3527653794038027, 'grm_norm': 'cosine_then_gcn', 'self_loops': False, 'use_snp_selection': False}. Best is trial 13 with value: 0.3123866227334652.
[I 2025-12-08 20:42:51,819] Trial 0 finished with value: 0.23766900682716327 and parameters: {'model_type': 'graphsage', 'hidden_dims': '[128, 64]', 'dropout': 0.199031432379812, 'batch_norm': True, 'sage_aggr': 'max', 'sage_normalize': True, 'sage_project': False, 'lr': 0.00034401453323286885, 'weight_decay': 0.00017802616915745114, 'epochs': 230, 'loss': 'mse', 'optimizer': 'adam', 'graph_mode': 'knn', 'knn_k': 6, 'weighted_edges': True, 'symmetrize_mode': 'mutual', 'self_loops': True, 'use_snp_selection': False}. Best is trial 0 with value: 0.23766900682716327.
[I 2025-12-08 20:44:25,830] Trial 1 finished with value: 0.2860477189896274 and parameters: {'model_type': 'graphsage', 'hidden_dims': '[512, 128]', 'dropout': 0.2503500283181017, 'batch_norm': False, 'sage_aggr': 'max', 'sage_normalize': False, 'sage_project': False, 'lr': 3.952233718592099e-05, 'weight_decay': 0.00026754769258252603, 'epochs': 149, 'loss': 'mse', 'optimizer': 'adam', 'graph_mode': 'knn', 'knn_k': 2, 'weighted_edges': False, 'symmetrize_mode': 'mutual', 'self_loops': True, 'use_snp_selection': True, 'num_snps': 49915}. Best is trial 1 with value: 0.2860477189896274.
[I 2025-12-08 20:45:38,179] Trial 2 finished with value: 0.2824139266338082 and parameters: {'model_type': 'graphsage', 'hidden_dims': '[512, 256]', 'dropout': 0.2785908793172681, 'batch_norm': False, 'sage_aggr': 'max', 'sage_normalize': False, 'sage_project': False, 'lr': 8.806039223165805e-05, 'weight_decay': 3.5153176302760294e-05, 'epochs': 147, 'loss': 'mae', 'optimizer': 'adam', 'graph_mode': 'cutoff', 'cutoff': 0.4922564006874869, 'grm_norm': 'gcn', 'self_loops': False, 'use_snp_selection': True, 'num_snps': 34340}. Best is trial 1 with value: 0.2860477189896274.
[I 2025-12-08 20:47:03,435] Trial 3 finished with value: 0.2654277344524589 and parameters: {'model_type': 'graphsage', 'hidden_dims': '[256, 128, 64]', 'dropout': 0.3475243154412272, 'batch_norm': True, 'sage_aggr': 'max', 'sage_normalize': False, 'sage_project': False, 'lr': 1.6006331996938085e-05, 'weight_decay': 7.213121225589906e-06, 'epochs': 283, 'loss': 'mse', 'optimizer': 'adam', 'graph_mode': 'cutoff', 'cutoff': 0.5942334791449215, 'grm_norm': 'none', 'self_loops': True, 'use_snp_selection': False}. Best is trial 1 with value: 0.2860477189896274.
[I 2025-12-08 20:47:26,615] Trial 4 finished with value: 0.2556696051720528 and parameters: {'model_type': 'graphsage', 'hidden_dims': '[128, 64]', 'dropout': 0.3348926467202472, 'batch_norm': True, 'sage_aggr': 'max', 'sage_normalize': False, 'sage_project': False, 'lr': 0.0004238630400638802, 'weight_decay': 8.074086040046576e-07, 'epochs': 158, 'loss': 'mae', 'optimizer': 'adam', 'graph_mode': 'knn', 'knn_k': 1, 'weighted_edges': False, 'symmetrize_mode': 'mutual', 'self_loops': False, 'use_snp_selection': True, 'num_snps': 26850}. Best is trial 1 with value: 0.2860477189896274.
