[I 2025-12-09 04:21:01,448] Trial 89 finished with value: 0.3091300353092462 and parameters: {'model_type': 'graphsage', 'hidden_dims': '[256, 128]', 'dropout': 0.4130961144936841, 'batch_norm': True, 'sage_aggr': 'mean', 'sage_normalize': True, 'sage_project': False, 'lr': 0.009827341072974942, 'weight_decay': 6.3370893996578744e-06, 'epochs': 88, 'loss': 'mae', 'optimizer': 'adam', 'graph_mode': 'cutoff', 'cutoff': 0.732334090669297, 'grm_norm': 'none', 'self_loops': False, 'use_snp_selection': False}. Best is trial 64 with value: 0.3207850829272738.
[I 2025-12-09 04:21:37,100] Trial 90 finished with value: 0.3155025090705539 and parameters: {'model_type': 'graphsage', 'hidden_dims': '[512, 128]', 'dropout': 0.4964819254740143, 'batch_norm': True, 'sage_aggr': 'mean', 'sage_normalize': True, 'sage_project': False, 'lr': 0.0011700671519572655, 'weight_decay': 4.266330910348214e-06, 'epochs': 60, 'loss': 'mse', 'optimizer': 'adam', 'graph_mode': 'cutoff', 'cutoff': 0.7008210594340742, 'grm_norm': 'gcn', 'self_loops': False, 'use_snp_selection': False}. Best is trial 64 with value: 0.3207850829272738.
[I 2025-12-09 04:21:59,612] Trial 91 finished with value: 0.310505039156343 and parameters: {'model_type': 'graphsage', 'hidden_dims': '[128, 64]', 'dropout': 0.38720246894733024, 'batch_norm': True, 'sage_aggr': 'max', 'sage_normalize': True, 'sage_project': False, 'lr': 0.0021597489591603796, 'weight_decay': 2.011061442529094e-06, 'epochs': 101, 'loss': 'mse', 'optimizer': 'adam', 'graph_mode': 'cutoff', 'cutoff': 0.7646138820674084, 'grm_norm': 'gcn', 'self_loops': False, 'use_snp_selection': False}. Best is trial 64 with value: 0.3207850829272738.
[I 2025-12-09 04:24:27,418] Trial 92 finished with value: 0.3172050381347563 and parameters: {'model_type': 'graphsage', 'hidden_dims': '[512, 128]', 'dropout': 0.4043459052223002, 'batch_norm': True, 'sage_aggr': 'max', 'sage_normalize': True, 'sage_project': False, 'lr': 0.0015493087014043338, 'weight_decay': 1.376447199554881e-06, 'epochs': 348, 'loss': 'mse', 'optimizer': 'adam', 'graph_mode': 'cutoff', 'cutoff': 0.7847329454155143, 'grm_norm': 'gcn', 'self_loops': False, 'use_snp_selection': False}. Best is trial 64 with value: 0.3207850829272738.
[I 2025-12-09 04:26:56,210] Trial 93 finished with value: 0.31226898372667194 and parameters: {'model_type': 'graphsage', 'hidden_dims': '[512, 128]', 'dropout': 0.4222766086977072, 'batch_norm': True, 'sage_aggr': 'max', 'sage_normalize': True, 'sage_project': False, 'lr': 0.0016830709828820358, 'weight_decay': 0.00033761779636788864, 'epochs': 350, 'loss': 'mse', 'optimizer': 'adam', 'graph_mode': 'cutoff', 'cutoff': 0.7996107376008755, 'grm_norm': 'gcn', 'self_loops': False, 'use_snp_selection': False}. Best is trial 64 with value: 0.3207850829272738.
[I 2025-12-09 04:29:18,385] Trial 94 finished with value: 0.316508372788947 and parameters: {'model_type': 'graphsage', 'hidden_dims': '[512, 128]', 'dropout': 0.3728897704935037, 'batch_norm': True, 'sage_aggr': 'max', 'sage_normalize': True, 'sage_project': False, 'lr': 0.0028241590702679795, 'weight_decay': 9.840841756171307e-06, 'epochs': 333, 'loss': 'mse', 'optimizer': 'adam', 'graph_mode': 'cutoff', 'cutoff': 0.7867745943192305, 'grm_norm': 'gcn', 'self_loops': False, 'use_snp_selection': False}. Best is trial 64 with value: 0.3207850829272738.
[I 2025-12-09 04:31:44,409] Trial 95 finished with value: 0.3160727255796163 and parameters: {'model_type': 'graphsage', 'hidden_dims': '[512, 128]', 'dropout': 0.44057538227702764, 'batch_norm': True, 'sage_aggr': 'max', 'sage_normalize': True, 'sage_project': False, 'lr': 0.00744812480137123, 'weight_decay': 1.455752211962108e-06, 'epochs': 343, 'loss': 'mse', 'optimizer': 'adam', 'graph_mode': 'cutoff', 'cutoff': 0.8265247717181612, 'grm_norm': 'gcn', 'self_loops': False, 'use_snp_selection': False}. Best is trial 64 with value: 0.3207850829272738.
[I 2025-12-09 04:33:44,095] Trial 96 finished with value: 0.2973483230552345 and parameters: {'model_type': 'graphsage', 'hidden_dims': '[512, 128]', 'dropout': 0.4023802892242367, 'batch_norm': True, 'sage_aggr': 'max', 'sage_normalize': True, 'sage_project': False, 'lr': 0.0038298958607735243, 'weight_decay': 9.530366169830488e-07, 'epochs': 150, 'loss': 'mse', 'optimizer': 'adam', 'graph_mode': 'cutoff', 'cutoff': 0.23721921944009744, 'grm_norm': 'cosine', 'self_loops': False, 'use_snp_selection': False}. Best is trial 64 with value: 0.3207850829272738.
[I 2025-12-09 04:34:26,181] Trial 97 finished with value: 0.32167090191646536 and parameters: {'model_type': 'graphsage', 'hidden_dims': '[256, 128]', 'dropout': 0.4577742614422722, 'batch_norm': True, 'sage_aggr': 'mean', 'sage_normalize': True, 'sage_project': False, 'lr': 0.00612919306780413, 'weight_decay': 2.713893999711752e-06, 'epochs': 143, 'loss': 'mse', 'optimizer': 'adam', 'graph_mode': 'cutoff', 'cutoff': 0.7777026848390618, 'grm_norm': 'cosine_then_gcn', 'self_loops': False, 'use_snp_selection': False}. Best is trial 97 with value: 0.32167090191646536.
[I 2025-12-09 04:34:47,139] Trial 98 finished with value: 0.2908531345220153 and parameters: {'model_type': 'graphsage', 'hidden_dims': '[256, 128]', 'dropout': 0.5221322788714754, 'batch_norm': True, 'sage_aggr': 'mean', 'sage_normalize': True, 'sage_project': False, 'lr': 0.00615843393331915, 'weight_decay': 7.603452531959264e-06, 'epochs': 40, 'loss': 'mse', 'optimizer': 'adam', 'graph_mode': 'knn', 'knn_k': 1, 'weighted_edges': True, 'symmetrize_mode': 'mutual', 'self_loops': True, 'use_snp_selection': False}. Best is trial 97 with value: 0.32167090191646536.
[I 2025-12-09 04:36:02,776] Trial 99 finished with value: 0.0060481884003822884 and parameters: {'model_type': 'graphsage', 'hidden_dims': '[256, 128]', 'dropout': 0.47267757746336225, 'batch_norm': False, 'sage_aggr': 'mean', 'sage_normalize': False, 'sage_project': False, 'lr': 0.004781355493604899, 'weight_decay': 3.658409572087579e-06, 'epochs': 134, 'loss': 'mse', 'optimizer': 'adam', 'graph_mode': 'cutoff', 'cutoff': 0.7264219321822549, 'grm_norm': 'cosine_then_gcn', 'self_loops': False, 'use_snp_selection': True, 'num_snps': 58770}. Best is trial 97 with value: 0.32167090191646536.
[I 2025-12-09 04:36:52,422] Trial 100 finished with value: 0.3101832926351257 and parameters: {'model_type': 'graphsage', 'hidden_dims': '[256, 128]', 'dropout': 0.45682948924819167, 'batch_norm': True, 'sage_aggr': 'mean', 'sage_normalize': True, 'sage_project': False, 'lr': 0.0054279979726340345, 'weight_decay': 2.6877551101872535e-06, 'epochs': 116, 'loss': 'mse', 'optimizer': 'adam', 'graph_mode': 'cutoff', 'cutoff': 0.2901701136607516, 'grm_norm': 'cosine_then_gcn', 'self_loops': False, 'use_snp_selection': False}. Best is trial 97 with value: 0.32167090191646536.
[I 2025-12-09 04:37:34,912] Trial 101 finished with value: 0.31654318739962395 and parameters: {'model_type': 'graphsage', 'hidden_dims': '[256, 128]', 'dropout': 0.48095392042129376, 'batch_norm': True, 'sage_aggr': 'mean', 'sage_normalize': True, 'sage_project': False, 'lr': 0.0008561498170969954, 'weight_decay': 4.812189300543427e-06, 'epochs': 145, 'loss': 'mse', 'optimizer': 'adam', 'graph_mode': 'cutoff', 'cutoff': 0.7753051767436238, 'grm_norm': 'cosine_then_gcn', 'self_loops': False, 'use_snp_selection': False}. Best is trial 97 with value: 0.32167090191646536.
[I 2025-12-09 04:39:02,015] Trial 102 finished with value: 0.31354966379010224 and parameters: {'model_type': 'graphsage', 'hidden_dims': '[512, 128]', 'dropout': 0.43154224265511804, 'batch_norm': True, 'sage_aggr': 'mean', 'sage_normalize': True, 'sage_project': False, 'lr': 0.008607885290054811, 'weight_decay': 2.083702524911896e-06, 'epochs': 189, 'loss': 'mse', 'optimizer': 'adam', 'graph_mode': 'cutoff', 'cutoff': 0.7437745950533964, 'grm_norm': 'cosine_then_gcn', 'self_loops': False, 'use_snp_selection': False}. Best is trial 97 with value: 0.32167090191646536.
[I 2025-12-09 04:40:19,161] Trial 103 finished with value: 0.31379344152756933 and parameters: {'model_type': 'graphsage', 'hidden_dims': '[512, 256]', 'dropout': 0.4066205254720833, 'batch_norm': True, 'sage_aggr': 'mean', 'sage_normalize': True, 'sage_project': False, 'lr': 0.0033659754127003776, 'weight_decay': 1.382567882188388e-05, 'epochs': 163, 'loss': 'mse', 'optimizer': 'adam', 'graph_mode': 'cutoff', 'cutoff': 0.8589967975609437, 'grm_norm': 'cosine', 'self_loops': False, 'use_snp_selection': False}. Best is trial 97 with value: 0.32167090191646536.
[I 2025-12-09 04:41:39,222] Trial 104 finished with value: 0.31764929027193556 and parameters: {'model_type': 'graphsage', 'hidden_dims': '[256, 128, 64]', 'dropout': 0.457814474034366, 'batch_norm': True, 'sage_aggr': 'max', 'sage_normalize': True, 'sage_project': False, 'lr': 0.0013112283456630852, 'weight_decay': 2.513992659960058e-06, 'epochs': 325, 'loss': 'mse', 'optimizer': 'adam', 'graph_mode': 'cutoff', 'cutoff': 0.8138732201358947, 'grm_norm': 'gcn', 'self_loops': False, 'use_snp_selection': False}. Best is trial 97 with value: 0.32167090191646536.
[I 2025-12-09 04:42:11,961] Trial 105 finished with value: 0.31372537396187894 and parameters: {'model_type': 'graphsage', 'hidden_dims': '[256, 128]', 'dropout': 0.448297434321535, 'batch_norm': True, 'sage_aggr': 'mean', 'sage_normalize': True, 'sage_project': False, 'lr': 0.001281955035826705, 'weight_decay': 6.375261563153903e-06, 'epochs': 100, 'loss': 'mse', 'optimizer': 'adam', 'graph_mode': 'cutoff', 'cutoff': 0.8049048006942784, 'grm_norm': 'cosine', 'self_loops': False, 'use_snp_selection': False}. Best is trial 97 with value: 0.32167090191646536.
[I 2025-12-09 04:43:28,125] Trial 106 finished with value: 0.3166606977902745 and parameters: {'model_type': 'graphsage', 'hidden_dims': '[256, 128, 64]', 'dropout': 0.5022328456395547, 'batch_norm': True, 'sage_aggr': 'max', 'sage_normalize': True, 'sage_project': False, 'lr': 0.006960183018330399, 'weight_decay': 3.0888321405925894e-06, 'epochs': 307, 'loss': 'mse', 'optimizer': 'adam', 'graph_mode': 'cutoff', 'cutoff': 0.8249027123901991, 'grm_norm': 'none', 'self_loops': False, 'use_snp_selection': False}. Best is trial 97 with value: 0.32167090191646536.
[I 2025-12-09 04:44:49,205] Trial 107 finished with value: 0.3108329596897702 and parameters: {'model_type': 'graphsage', 'hidden_dims': '[256, 128, 64]', 'dropout': 0.4592351718398801, 'batch_norm': True, 'sage_aggr': 'mean', 'sage_normalize': True, 'sage_project': False, 'lr': 0.0009932700000306344, 'weight_decay': 4.185809122564521e-06, 'epochs': 326, 'loss': 'mse', 'optimizer': 'adam', 'graph_mode': 'cutoff', 'cutoff': 0.8469248800508768, 'grm_norm': 'gcn', 'self_loops': False, 'use_snp_selection': False}. Best is trial 97 with value: 0.32167090191646536.
[I 2025-12-09 04:45:45,154] Trial 108 finished with value: 0.3004403899898406 and parameters: {'model_type': 'graphsage', 'hidden_dims': '[256, 128, 64]', 'dropout': 0.4840561375438475, 'batch_norm': True, 'sage_aggr': 'mean', 'sage_normalize': True, 'sage_project': False, 'lr': 0.002589488707504326, 'weight_decay': 2.5618785676057694e-06, 'epochs': 206, 'loss': 'mae', 'optimizer': 'adam', 'graph_mode': 'cutoff', 'cutoff': 0.883886655524434, 'grm_norm': 'cosine_then_gcn', 'self_loops': False, 'use_snp_selection': False}. Best is trial 97 with value: 0.32167090191646536.
[I 2025-12-09 04:46:34,071] Trial 109 finished with value: 0.27562387993329657 and parameters: {'model_type': 'graphsage', 'hidden_dims': '[256, 128, 64]', 'dropout': 0.5368087310425151, 'batch_norm': True, 'sage_aggr': 'max', 'sage_normalize': True, 'sage_project': False, 'lr': 0.004291976135211268, 'weight_decay': 0.0009135560034799717, 'epochs': 175, 'loss': 'mse', 'optimizer': 'adam', 'graph_mode': 'cutoff', 'cutoff': 0.6640461057398448, 'grm_norm': 'cosine', 'self_loops': False, 'use_snp_selection': False}. Best is trial 97 with value: 0.32167090191646536.
[I 2025-12-09 04:47:35,960] Trial 110 finished with value: 0.31673557076023034 and parameters: {'model_type': 'graphsage', 'hidden_dims': '[512, 64]', 'dropout': 0.42884292261397433, 'batch_norm': True, 'sage_aggr': 'mean', 'sage_normalize': True, 'sage_project': False, 'lr': 0.005905525161645623, 'weight_decay': 1.689239793937974e-06, 'epochs': 127, 'loss': 'mse', 'optimizer': 'adam', 'graph_mode': 'cutoff', 'cutoff': 0.7020488442075098, 'grm_norm': 'gcn', 'self_loops': False, 'use_snp_selection': False}. Best is trial 97 with value: 0.32167090191646536.
[I 2025-12-09 04:49:59,661] Trial 111 finished with value: 0.3184477347994185 and parameters: {'model_type': 'graphsage', 'hidden_dims': '[512, 128]', 'dropout': 0.4680151352649289, 'batch_norm': True, 'sage_aggr': 'max', 'sage_normalize': True, 'sage_project': False, 'lr': 0.0015221734476506693, 'weight_decay': 2.2316861845725418e-06, 'epochs': 337, 'loss': 'mse', 'optimizer': 'adam', 'graph_mode': 'cutoff', 'cutoff': 0.7522843882529385, 'grm_norm': 'gcn', 'self_loops': False, 'use_snp_selection': False}. Best is trial 97 with value: 0.32167090191646536.
[I 2025-12-09 04:52:14,804] Trial 112 finished with value: 0.3184898761345184 and parameters: {'model_type': 'graphsage', 'hidden_dims': '[512, 128]', 'dropout': 0.46839562065234014, 'batch_norm': True, 'sage_aggr': 'max', 'sage_normalize': True, 'sage_project': False, 'lr': 0.0016734629709513774, 'weight_decay': 3.483665002762083e-06, 'epochs': 315, 'loss': 'mse', 'optimizer': 'adam', 'graph_mode': 'cutoff', 'cutoff': 0.8131515888328661, 'grm_norm': 'gcn', 'self_loops': False, 'use_snp_selection': False}. Best is trial 97 with value: 0.32167090191646536.
[I 2025-12-09 04:54:29,175] Trial 113 finished with value: 0.3117741224132775 and parameters: {'model_type': 'graphsage', 'hidden_dims': '[512, 128]', 'dropout': 0.4612694919921792, 'batch_norm': True, 'sage_aggr': 'max', 'sage_normalize': True, 'sage_project': False, 'lr': 0.0019943526256787944, 'weight_decay': 3.45284195407166e-06, 'epochs': 313, 'loss': 'mse', 'optimizer': 'adam', 'graph_mode': 'cutoff', 'cutoff': 0.7460529818245725, 'grm_norm': 'gcn', 'self_loops': False, 'use_snp_selection': False}. Best is trial 97 with value: 0.32167090191646536.
[I 2025-12-09 04:55:43,771] Trial 114 finished with value: 0.31149875872002325 and parameters: {'model_type': 'graphsage', 'hidden_dims': '[256, 128, 64]', 'dropout': 0.4687779462485175, 'batch_norm': True, 'sage_aggr': 'max', 'sage_normalize': True, 'sage_project': False, 'lr': 0.0016434404162537193, 'weight_decay': 2.0873253781864386e-06, 'epochs': 298, 'loss': 'mse', 'optimizer': 'adam', 'graph_mode': 'cutoff', 'cutoff': 0.7584551855341062, 'grm_norm': 'gcn', 'self_loops': False, 'use_snp_selection': False}. Best is trial 97 with value: 0.32167090191646536.
[I 2025-12-09 04:57:06,311] Trial 115 finished with value: 0.31293130124923507 and parameters: {'model_type': 'graphsage', 'hidden_dims': '[256, 128]', 'dropout': 0.49071031165527995, 'batch_norm': True, 'sage_aggr': 'max', 'sage_normalize': True, 'sage_project': False, 'lr': 0.0007245558286653562, 'weight_decay': 0.0001659149408504743, 'epochs': 338, 'loss': 'mse', 'optimizer': 'adam', 'graph_mode': 'cutoff', 'cutoff': 0.773046290447091, 'grm_norm': 'gcn', 'self_loops': False, 'use_snp_selection': False}. Best is trial 97 with value: 0.32167090191646536.
[I 2025-12-09 04:57:51,374] Trial 116 finished with value: 0.3045500692303307 and parameters: {'model_type': 'graphsage', 'hidden_dims': '[512, 128]', 'dropout': 0.18360123659080957, 'batch_norm': True, 'sage_aggr': 'max', 'sage_normalize': True, 'sage_project': False, 'lr': 0.001034235791298287, 'weight_decay': 2.4409686782043286e-06, 'epochs': 82, 'loss': 'mse', 'optimizer': 'adam', 'graph_mode': 'cutoff', 'cutoff': 0.8138186126559053, 'grm_norm': 'cosine', 'self_loops': False, 'use_snp_selection': False}. Best is trial 97 with value: 0.32167090191646536.
[I 2025-12-09 05:03:11,813] Trial 117 finished with value: 0.3035280877630462 and parameters: {'model_type': 'graphsage', 'hidden_dims': '[512, 128]', 'dropout': 0.5077867583429393, 'batch_norm': True, 'sage_aggr': 'max', 'sage_normalize': True, 'sage_project': False, 'lr': 0.008177908065706833, 'weight_decay': 1.0626166369124025e-06, 'epochs': 328, 'loss': 'mse', 'optimizer': 'adam', 'graph_mode': 'knn', 'knn_k': 10, 'weighted_edges': False, 'symmetrize_mode': 'union', 'self_loops': True, 'use_snp_selection': False}. Best is trial 97 with value: 0.32167090191646536.
[I 2025-12-09 05:04:33,153] Trial 118 finished with value: 0.16941009787816497 and parameters: {'model_type': 'graphsage', 'hidden_dims': '[256, 128]', 'dropout': 0.44783315190705714, 'batch_norm': False, 'sage_aggr': 'mean', 'sage_normalize': False, 'sage_project': False, 'lr': 0.0012680943548412185, 'weight_decay': 1.5999093237782318e-06, 'epochs': 335, 'loss': 'mse', 'optimizer': 'adam', 'graph_mode': 'cutoff', 'cutoff': 0.7222995594794304, 'grm_norm': 'gcn', 'self_loops': False, 'use_snp_selection': False}. Best is trial 97 with value: 0.32167090191646536.
[I 2025-12-09 05:05:56,563] Trial 119 finished with value: 0.3139612940117482 and parameters: {'model_type': 'graphsage', 'hidden_dims': '[512, 128]', 'dropout': 0.47530228507785377, 'batch_norm': True, 'sage_aggr': 'max', 'sage_normalize': True, 'sage_project': False, 'lr': 0.007085775157539211, 'weight_decay': 3.0285068596241188e-06, 'epochs': 143, 'loss': 'mse', 'optimizer': 'adam', 'graph_mode': 'cutoff', 'cutoff': 0.6902001586270589, 'grm_norm': 'cosine_then_gcn', 'self_loops': False, 'use_snp_selection': True, 'num_snps': 45557}. Best is trial 97 with value: 0.32167090191646536.
[I 2025-12-09 05:08:17,939] Trial 120 finished with value: 0.31330808053521875 and parameters: {'model_type': 'graphsage', 'hidden_dims': '[512, 256]', 'dropout': 0.4417174104536133, 'batch_norm': True, 'sage_aggr': 'mean', 'sage_normalize': True, 'sage_project': False, 'lr': 0.009941240239216435, 'weight_decay': 4.8692504715968615e-06, 'epochs': 315, 'loss': 'mse', 'optimizer': 'adam', 'graph_mode': 'cutoff', 'cutoff': 0.5460506810558672, 'grm_norm': 'gcn', 'self_loops': False, 'use_snp_selection': False}. Best is trial 97 with value: 0.32167090191646536.
[I 2025-12-09 05:10:44,401] Trial 121 finished with value: 0.3160156336576501 and parameters: {'model_type': 'graphsage', 'hidden_dims': '[512, 128]', 'dropout': 0.45241034297046223, 'batch_norm': True, 'sage_aggr': 'max', 'sage_normalize': True, 'sage_project': False, 'lr': 0.0019730020346658186, 'weight_decay': 5.78618921163721e-06, 'epochs': 344, 'loss': 'mse', 'optimizer': 'adam', 'graph_mode': 'cutoff', 'cutoff': 0.8617548125989779, 'grm_norm': 'gcn', 'self_loops': False, 'use_snp_selection': False}. Best is trial 97 with value: 0.32167090191646536.
[I 2025-12-09 05:13:02,430] Trial 122 finished with value: 0.31770811627172163 and parameters: {'model_type': 'graphsage', 'hidden_dims': '[512, 128]', 'dropout': 0.4672849147629447, 'batch_norm': True, 'sage_aggr': 'max', 'sage_normalize': True, 'sage_project': False, 'lr': 0.002534505155953835, 'weight_decay': 7.0100293240208885e-06, 'epochs': 322, 'loss': 'mse', 'optimizer': 'adam', 'graph_mode': 'cutoff', 'cutoff': 0.7928789095222738, 'grm_norm': 'gcn', 'self_loops': False, 'use_snp_selection': False}. Best is trial 97 with value: 0.32167090191646536.
[I 2025-12-09 05:15:21,773] Trial 123 finished with value: 0.3170484799968142 and parameters: {'model_type': 'graphsage', 'hidden_dims': '[512, 128]', 'dropout': 0.46398388529005385, 'batch_norm': True, 'sage_aggr': 'max', 'sage_normalize': True, 'sage_project': False, 'lr': 0.001424793116240415, 'weight_decay': 1.1654075079655477e-05, 'epochs': 323, 'loss': 'mse', 'optimizer': 'adam', 'graph_mode': 'cutoff', 'cutoff': 0.7990173752348892, 'grm_norm': 'gcn', 'self_loops': False, 'use_snp_selection': False}. Best is trial 97 with value: 0.32167090191646536.
[I 2025-12-09 05:17:44,006] Trial 124 finished with value: 0.31579185651748315 and parameters: {'model_type': 'graphsage', 'hidden_dims': '[512, 128]', 'dropout': 0.500927522303702, 'batch_norm': True, 'sage_aggr': 'max', 'sage_normalize': True, 'sage_project': False, 'lr': 0.00264612881681739, 'weight_decay': 7.924365408494242e-06, 'epochs': 333, 'loss': 'mse', 'optimizer': 'adam', 'graph_mode': 'cutoff', 'cutoff': 0.7527022719331365, 'grm_norm': 'gcn', 'self_loops': False, 'use_snp_selection': False}. Best is trial 97 with value: 0.32167090191646536.
[I 2025-12-09 05:19:09,624] Trial 125 finished with value: 0.3179484493686771 and parameters: {'model_type': 'graphsage', 'hidden_dims': '[512, 128]', 'dropout': 0.48827342248617844, 'batch_norm': True, 'sage_aggr': 'max', 'sage_normalize': True, 'sage_project': False, 'lr': 0.003444355165951124, 'weight_decay': 3.63568707659222e-06, 'epochs': 186, 'loss': 'mse', 'optimizer': 'adam', 'graph_mode': 'cutoff', 'cutoff': 0.7785173743966161, 'grm_norm': 'cosine', 'self_loops': False, 'use_snp_selection': False}. Best is trial 97 with value: 0.32167090191646536.
[I 2025-12-09 05:20:23,196] Trial 126 finished with value: 0.321412966071963 and parameters: {'model_type': 'graphsage', 'hidden_dims': '[512, 128]', 'dropout': 0.5138352531702187, 'batch_norm': True, 'sage_aggr': 'max', 'sage_normalize': True, 'sage_project': False, 'lr': 0.0033942400887665898, 'weight_decay': 2.0481767711460168e-05, 'epochs': 155, 'loss': 'mse', 'optimizer': 'adam', 'graph_mode': 'cutoff', 'cutoff': 0.7792208510026147, 'grm_norm': 'cosine', 'self_loops': False, 'use_snp_selection': False}. Best is trial 97 with value: 0.32167090191646536.
