[I 2025-12-08 21:50:19,644] Trial 42 finished with value: 0.2820440493672898 and parameters: {'model_type': 'graphsage', 'hidden_dims': '[512, 64]', 'dropout': 0.5417790086341321, 'batch_norm': True, 'sage_aggr': 'max', 'sage_normalize': False, 'sage_project': False, 'lr': 3.369401327947247e-05, 'weight_decay': 2.5990301791422168e-05, 'epochs': 221, 'loss': 'mse', 'optimizer': 'adam', 'graph_mode': 'cutoff', 'cutoff': 0.6759626470414879, 'grm_norm': 'gcn', 'self_loops': True, 'use_snp_selection': True, 'num_snps': 37304}. Best is trial 17 with value: 0.29045957567386166.
[I 2025-12-08 21:51:07,553] Trial 43 finished with value: 0.2793904189858524 and parameters: {'model_type': 'graphsage', 'hidden_dims': '[512, 64]', 'dropout': 0.2088432344651753, 'batch_norm': True, 'sage_aggr': 'max', 'sage_normalize': False, 'sage_project': False, 'lr': 1.1029515529485758e-05, 'weight_decay': 5.245266515553695e-05, 'epochs': 142, 'loss': 'mse', 'optimizer': 'adam', 'graph_mode': 'cutoff', 'cutoff': 0.8500838493508824, 'grm_norm': 'gcn', 'self_loops': True, 'use_snp_selection': True, 'num_snps': 17566}. Best is trial 17 with value: 0.29045957567386166.
[I 2025-12-08 21:52:00,752] Trial 44 finished with value: 0.2818325291016476 and parameters: {'model_type': 'graphsage', 'hidden_dims': '[128, 64]', 'dropout': 0.492956931698727, 'batch_norm': True, 'sage_aggr': 'mean', 'sage_normalize': False, 'sage_project': False, 'lr': 6.884464904511946e-05, 'weight_decay': 1.0264882763481146e-05, 'epochs': 122, 'loss': 'mse', 'optimizer': 'adam', 'graph_mode': 'cutoff', 'cutoff': 0.5884654291403374, 'grm_norm': 'gcn', 'self_loops': True, 'use_snp_selection': True, 'num_snps': 41766}. Best is trial 17 with value: 0.29045957567386166.
[I 2025-12-08 21:52:38,058] Trial 45 finished with value: 0.26287875358404356 and parameters: {'model_type': 'graphsage', 'hidden_dims': '[256, 128]', 'dropout': 0.57186820713062, 'batch_norm': True, 'sage_aggr': 'max', 'sage_normalize': True, 'sage_project': False, 'lr': 0.0005326702069684105, 'weight_decay': 7.209585923396179e-05, 'epochs': 194, 'loss': 'mse', 'optimizer': 'adam', 'graph_mode': 'cutoff', 'cutoff': 0.7641393933656927, 'grm_norm': 'cosine_then_gcn', 'self_loops': True, 'use_snp_selection': True, 'num_snps': 9918}. Best is trial 17 with value: 0.29045957567386166.
[I 2025-12-08 21:53:57,729] Trial 46 finished with value: 0.008139620780069773 and parameters: {'model_type': 'graphsage', 'hidden_dims': '[512, 64]', 'dropout': 0.5206477953835071, 'batch_norm': False, 'sage_aggr': 'max', 'sage_normalize': False, 'sage_project': False, 'lr': 0.0002410235703610231, 'weight_decay': 2.264113408271432e-06, 'epochs': 167, 'loss': 'mse', 'optimizer': 'adam', 'graph_mode': 'cutoff', 'cutoff': 0.855522116666908, 'grm_norm': 'cosine', 'self_loops': False, 'use_snp_selection': False}. Best is trial 17 with value: 0.29045957567386166.
[I 2025-12-08 21:55:06,152] Trial 47 finished with value: 0.2759654192460413 and parameters: {'model_type': 'graphsage', 'hidden_dims': '[512, 128]', 'dropout': 0.3189555922746666, 'batch_norm': True, 'sage_aggr': 'max', 'sage_normalize': False, 'sage_project': False, 'lr': 0.0009172841603269471, 'weight_decay': 1.795523808645808e-05, 'epochs': 242, 'loss': 'mse', 'optimizer': 'adam', 'graph_mode': 'cutoff', 'cutoff': 0.6158331216893886, 'grm_norm': 'gcn', 'self_loops': True, 'use_snp_selection': True, 'num_snps': 21970}. Best is trial 17 with value: 0.29045957567386166.
[I 2025-12-08 21:56:40,319] Trial 48 finished with value: 0.26914981079430433 and parameters: {'model_type': 'graphsage', 'hidden_dims': '[256, 128, 64]', 'dropout': 0.5974183564774334, 'batch_norm': True, 'sage_aggr': 'mean', 'sage_normalize': False, 'sage_project': False, 'lr': 0.0003557561928833637, 'weight_decay': 9.160543278152099e-06, 'epochs': 272, 'loss': 'mse', 'optimizer': 'adam', 'graph_mode': 'knn', 'knn_k': 4, 'weighted_edges': False, 'symmetrize_mode': 'mutual', 'self_loops': True, 'use_snp_selection': False}. Best is trial 17 with value: 0.29045957567386166.
[I 2025-12-08 21:58:56,740] Trial 49 finished with value: 0.26448179270165667 and parameters: {'model_type': 'graphsage', 'hidden_dims': '[512, 256]', 'dropout': 0.5057002881396833, 'batch_norm': True, 'sage_aggr': 'max', 'sage_normalize': True, 'sage_project': False, 'lr': 0.005577559326335241, 'weight_decay': 3.352606381662515e-05, 'epochs': 295, 'loss': 'mae', 'optimizer': 'adam', 'graph_mode': 'cutoff', 'cutoff': 0.6954807591744135, 'grm_norm': 'none', 'self_loops': True, 'use_snp_selection': False}. Best is trial 17 with value: 0.29045957567386166.
[I 2025-12-08 22:00:21,391] Trial 50 finished with value: 0.2821953991261688 and parameters: {'model_type': 'graphsage', 'hidden_dims': '[256, 128]', 'dropout': 0.5764043058694353, 'batch_norm': True, 'sage_aggr': 'max', 'sage_normalize': False, 'sage_project': False, 'lr': 0.007102892788748069, 'weight_decay': 0.00018545562904240265, 'epochs': 321, 'loss': 'mse', 'optimizer': 'adam', 'graph_mode': 'cutoff', 'cutoff': 0.7557599163326704, 'grm_norm': 'cosine', 'self_loops': True, 'use_snp_selection': False}. Best is trial 17 with value: 0.29045957567386166.
[I 2025-12-08 22:00:51,492] Trial 51 finished with value: 0.2858607959713327 and parameters: {'model_type': 'graphsage', 'hidden_dims': '[256, 128]', 'dropout': 0.5350674039015493, 'batch_norm': True, 'sage_aggr': 'max', 'sage_normalize': False, 'sage_project': False, 'lr': 0.005057368243796688, 'weight_decay': 5.2237298202453344e-06, 'epochs': 81, 'loss': 'mse', 'optimizer': 'adam', 'graph_mode': 'cutoff', 'cutoff': 0.7222636894126638, 'grm_norm': 'cosine_then_gcn', 'self_loops': True, 'use_snp_selection': False}. Best is trial 17 with value: 0.29045957567386166.
[I 2025-12-08 22:01:12,295] Trial 52 finished with value: 0.294942301795037 and parameters: {'model_type': 'graphsage', 'hidden_dims': '[256, 128]', 'dropout': 0.5475640372360285, 'batch_norm': True, 'sage_aggr': 'max', 'sage_normalize': False, 'sage_project': False, 'lr': 0.0040699543444589585, 'weight_decay': 3.073305940651702e-06, 'epochs': 41, 'loss': 'mse', 'optimizer': 'adam', 'graph_mode': 'cutoff', 'cutoff': 0.8046716091261708, 'grm_norm': 'cosine_then_gcn', 'self_loops': True, 'use_snp_selection': False}. Best is trial 52 with value: 0.294942301795037.
[I 2025-12-08 22:01:49,296] Trial 53 finished with value: 0.2857970922218224 and parameters: {'model_type': 'graphsage', 'hidden_dims': '[256, 128]', 'dropout': 0.5550947486195505, 'batch_norm': True, 'sage_aggr': 'max', 'sage_normalize': False, 'sage_project': False, 'lr': 0.0017964178714860596, 'weight_decay': 2.9010021970973957e-06, 'epochs': 112, 'loss': 'mse', 'optimizer': 'adam', 'graph_mode': 'cutoff', 'cutoff': 0.8006004914259218, 'grm_norm': 'cosine_then_gcn', 'self_loops': True, 'use_snp_selection': False}. Best is trial 52 with value: 0.294942301795037.
[I 2025-12-08 22:02:13,548] Trial 54 finished with value: 0.28823072585731324 and parameters: {'model_type': 'graphsage', 'hidden_dims': '[256, 128]', 'dropout': 0.5735025187106154, 'batch_norm': True, 'sage_aggr': 'max', 'sage_normalize': False, 'sage_project': False, 'lr': 0.002830182796154169, 'weight_decay': 1.3665923013073551e-06, 'epochs': 56, 'loss': 'mse', 'optimizer': 'adam', 'graph_mode': 'cutoff', 'cutoff': 0.8729175939720583, 'grm_norm': 'cosine_then_gcn', 'self_loops': True, 'use_snp_selection': False}. Best is trial 52 with value: 0.294942301795037.
[I 2025-12-08 22:02:34,163] Trial 55 finished with value: 0.2863284084897862 and parameters: {'model_type': 'graphsage', 'hidden_dims': '[256, 128]', 'dropout': 0.2776468672420356, 'batch_norm': True, 'sage_aggr': 'max', 'sage_normalize': False, 'sage_project': False, 'lr': 0.0012910830751371066, 'weight_decay': 1.2234440391561156e-06, 'epochs': 40, 'loss': 'mse', 'optimizer': 'adam', 'graph_mode': 'cutoff', 'cutoff': 0.8771254889371969, 'grm_norm': 'cosine_then_gcn', 'self_loops': True, 'use_snp_selection': False}. Best is trial 52 with value: 0.294942301795037.
[I 2025-12-08 22:02:58,639] Trial 56 finished with value: 0.2889400315112856 and parameters: {'model_type': 'graphsage', 'hidden_dims': '[256, 128]', 'dropout': 0.582296548096875, 'batch_norm': True, 'sage_aggr': 'max', 'sage_normalize': False, 'sage_project': False, 'lr': 0.002578410931304383, 'weight_decay': 5.163077209828378e-07, 'epochs': 57, 'loss': 'mse', 'optimizer': 'adam', 'graph_mode': 'cutoff', 'cutoff': 0.6577923096234931, 'grm_norm': 'cosine_then_gcn', 'self_loops': True, 'use_snp_selection': False}. Best is trial 52 with value: 0.294942301795037.
[I 2025-12-08 22:03:41,922] Trial 57 finished with value: -0.02602656856079097 and parameters: {'model_type': 'graphsage', 'hidden_dims': '[256, 128]', 'dropout': 0.5799319014147726, 'batch_norm': False, 'sage_aggr': 'max', 'sage_normalize': False, 'sage_project': False, 'lr': 0.0027364216607534417, 'weight_decay': 5.746021895398038e-07, 'epochs': 54, 'loss': 'mse', 'optimizer': 'adam', 'graph_mode': 'cutoff', 'cutoff': 0.22405160827838366, 'grm_norm': 'cosine_then_gcn', 'self_loops': False, 'use_snp_selection': False}. Best is trial 52 with value: 0.294942301795037.
[I 2025-12-08 22:04:08,038] Trial 58 finished with value: 0.28352394251266144 and parameters: {'model_type': 'graphsage', 'hidden_dims': '[256, 128]', 'dropout': 0.5984359507027078, 'batch_norm': True, 'sage_aggr': 'max', 'sage_normalize': False, 'sage_project': False, 'lr': 0.002067631044506264, 'weight_decay': 4.0699307852418884e-07, 'epochs': 64, 'loss': 'mse', 'optimizer': 'adam', 'graph_mode': 'cutoff', 'cutoff': 0.8152565129166225, 'grm_norm': 'cosine_then_gcn', 'self_loops': True, 'use_snp_selection': False}. Best is trial 52 with value: 0.294942301795037.
[I 2025-12-08 22:04:31,608] Trial 59 finished with value: 0.2910587563163346 and parameters: {'model_type': 'graphsage', 'hidden_dims': '[256, 128]', 'dropout': 0.544713213655964, 'batch_norm': True, 'sage_aggr': 'mean', 'sage_normalize': False, 'sage_project': False, 'lr': 0.0031272632852165933, 'weight_decay': 2.755102404629629e-07, 'epochs': 52, 'loss': 'mse', 'optimizer': 'adam', 'graph_mode': 'cutoff', 'cutoff': 0.6473350368034055, 'grm_norm': 'cosine_then_gcn', 'self_loops': True, 'use_snp_selection': False}. Best is trial 52 with value: 0.294942301795037.
[I 2025-12-08 22:05:03,719] Trial 60 finished with value: 0.28179958658023024 and parameters: {'model_type': 'graphsage', 'hidden_dims': '[256, 128]', 'dropout': 0.10057321925494148, 'batch_norm': True, 'sage_aggr': 'mean', 'sage_normalize': False, 'sage_project': False, 'lr': 0.001081532196810993, 'weight_decay': 2.441636508350877e-07, 'epochs': 88, 'loss': 'mse', 'optimizer': 'adam', 'graph_mode': 'cutoff', 'cutoff': 0.5787207721033588, 'grm_norm': 'cosine_then_gcn', 'self_loops': True, 'use_snp_selection': False}. Best is trial 52 with value: 0.294942301795037.
[I 2025-12-08 22:05:30,191] Trial 61 finished with value: 0.2956087090294326 and parameters: {'model_type': 'graphsage', 'hidden_dims': '[256, 128]', 'dropout': 0.5460547753809951, 'batch_norm': True, 'sage_aggr': 'mean', 'sage_normalize': False, 'sage_project': False, 'lr': 0.0032598446567085717, 'weight_decay': 2.1206923028249857e-07, 'epochs': 52, 'loss': 'mse', 'optimizer': 'adam', 'graph_mode': 'cutoff', 'cutoff': 0.45718706856211283, 'grm_norm': 'cosine_then_gcn', 'self_loops': True, 'use_snp_selection': False}. Best is trial 61 with value: 0.2956087090294326.
[I 2025-12-08 22:06:01,991] Trial 62 finished with value: 0.29474120718288593 and parameters: {'model_type': 'graphsage', 'hidden_dims': '[256, 128]', 'dropout': 0.5453510257728628, 'batch_norm': True, 'sage_aggr': 'mean', 'sage_normalize': False, 'sage_project': False, 'lr': 0.003954601391657965, 'weight_decay': 1.926674884662311e-07, 'epochs': 70, 'loss': 'mse', 'optimizer': 'adam', 'graph_mode': 'cutoff', 'cutoff': 0.44168120071733047, 'grm_norm': 'cosine_then_gcn', 'self_loops': True, 'use_snp_selection': False}. Best is trial 61 with value: 0.2956087090294326.
[I 2025-12-08 22:06:32,696] Trial 63 finished with value: 0.2845466251665177 and parameters: {'model_type': 'graphsage', 'hidden_dims': '[256, 128]', 'dropout': 0.5429524042060265, 'batch_norm': True, 'sage_aggr': 'mean', 'sage_normalize': False, 'sage_project': False, 'lr': 0.0041511057688860065, 'weight_decay': 1.5260260928184038e-07, 'epochs': 66, 'loss': 'mse', 'optimizer': 'adam', 'graph_mode': 'cutoff', 'cutoff': 0.43156077070418936, 'grm_norm': 'cosine_then_gcn', 'self_loops': True, 'use_snp_selection': False}. Best is trial 61 with value: 0.2956087090294326.
[I 2025-12-08 22:06:58,041] Trial 64 finished with value: 0.2885229009911082 and parameters: {'model_type': 'graphsage', 'hidden_dims': '[256, 128]', 'dropout': 0.5204487952173367, 'batch_norm': True, 'sage_aggr': 'mean', 'sage_normalize': False, 'sage_project': False, 'lr': 0.007575264208375767, 'weight_decay': 1.824345833042635e-07, 'epochs': 49, 'loss': 'mse', 'optimizer': 'adam', 'graph_mode': 'cutoff', 'cutoff': 0.4193292355586484, 'grm_norm': 'none', 'self_loops': True, 'use_snp_selection': False}. Best is trial 61 with value: 0.2956087090294326.
[I 2025-12-08 22:07:33,772] Trial 65 finished with value: 0.2962593081563617 and parameters: {'model_type': 'graphsage', 'hidden_dims': '[256, 128, 64]', 'dropout': 0.5486888162190412, 'batch_norm': True, 'sage_aggr': 'mean', 'sage_normalize': False, 'sage_project': False, 'lr': 0.003498853808702444, 'weight_decay': 3.0787004491017673e-07, 'epochs': 89, 'loss': 'mse', 'optimizer': 'adam', 'graph_mode': 'cutoff', 'cutoff': 0.4954063326506696, 'grm_norm': 'cosine_then_gcn', 'self_loops': True, 'use_snp_selection': False}. Best is trial 65 with value: 0.2962593081563617.
[I 2025-12-08 22:08:07,386] Trial 66 finished with value: 0.2956201241620396 and parameters: {'model_type': 'graphsage', 'hidden_dims': '[256, 128, 64]', 'dropout': 0.4806860604179731, 'batch_norm': True, 'sage_aggr': 'mean', 'sage_normalize': False, 'sage_project': False, 'lr': 0.0044578082783671745, 'weight_decay': 2.5764229502118163e-07, 'epochs': 72, 'loss': 'mse', 'optimizer': 'adam', 'graph_mode': 'cutoff', 'cutoff': 0.37718166693781296, 'grm_norm': 'cosine_then_gcn', 'self_loops': True, 'use_snp_selection': False}. Best is trial 65 with value: 0.2962593081563617.
[I 2025-12-08 22:08:40,692] Trial 67 finished with value: 0.2714100606878846 and parameters: {'model_type': 'graphsage', 'hidden_dims': '[256, 128, 64]', 'dropout': 0.49087696665136177, 'batch_norm': True, 'sage_aggr': 'mean', 'sage_normalize': True, 'sage_project': False, 'lr': 0.0035241091843731683, 'weight_decay': 2.717158153404349e-07, 'epochs': 71, 'loss': 'mse', 'optimizer': 'adam', 'graph_mode': 'cutoff', 'cutoff': 0.360922052733576, 'grm_norm': 'cosine_then_gcn', 'self_loops': True, 'use_snp_selection': False}. Best is trial 65 with value: 0.2962593081563617.
[I 2025-12-08 22:09:36,384] Trial 68 finished with value: 0.27719744979122113 and parameters: {'model_type': 'graphsage', 'hidden_dims': '[256, 128, 64]', 'dropout': 0.478014892888991, 'batch_norm': True, 'sage_aggr': 'mean', 'sage_normalize': False, 'sage_project': False, 'lr': 0.006273202902789879, 'weight_decay': 1.0587797602451059e-07, 'epochs': 91, 'loss': 'mae', 'optimizer': 'adam', 'graph_mode': 'knn', 'knn_k': 5, 'weighted_edges': True, 'symmetrize_mode': 'union', 'self_loops': True, 'use_snp_selection': False}. Best is trial 65 with value: 0.2962593081563617.
[I 2025-12-08 22:10:08,545] Trial 69 finished with value: 0.28725805173687424 and parameters: {'model_type': 'graphsage', 'hidden_dims': '[256, 128, 64]', 'dropout': 0.43546189147305825, 'batch_norm': True, 'sage_aggr': 'mean', 'sage_normalize': False, 'sage_project': False, 'lr': 0.001836931214056703, 'weight_decay': 7.540222636531224e-07, 'epochs': 75, 'loss': 'mse', 'optimizer': 'adam', 'graph_mode': 'cutoff', 'cutoff': 0.49162658685374544, 'grm_norm': 'cosine_then_gcn', 'self_loops': True, 'use_snp_selection': False}. Best is trial 65 with value: 0.2962593081563617.
[I 2025-12-08 22:10:34,195] Trial 70 finished with value: 0.0009293976411023049 and parameters: {'model_type': 'graphsage', 'hidden_dims': '[256, 128, 64]', 'dropout': 0.45728473105872025, 'batch_norm': False, 'sage_aggr': 'mean', 'sage_normalize': False, 'sage_project': False, 'lr': 0.004143509821858115, 'weight_decay': 1.8316875952136936e-07, 'epochs': 48, 'loss': 'mse', 'optimizer': 'adam', 'graph_mode': 'cutoff', 'cutoff': 0.37188726704126057, 'grm_norm': 'cosine_then_gcn', 'self_loops': False, 'use_snp_selection': False}. Best is trial 65 with value: 0.2962593081563617.
[I 2025-12-08 22:11:15,523] Trial 71 finished with value: 0.28952684844885235 and parameters: {'model_type': 'graphsage', 'hidden_dims': '[256, 128, 64]', 'dropout': 0.5505633856973583, 'batch_norm': True, 'sage_aggr': 'mean', 'sage_normalize': False, 'sage_project': False, 'lr': 0.004846989143176108, 'weight_decay': 3.366582307105991e-07, 'epochs': 107, 'loss': 'mse', 'optimizer': 'adam', 'graph_mode': 'cutoff', 'cutoff': 0.49063513873196585, 'grm_norm': 'cosine_then_gcn', 'self_loops': True, 'use_snp_selection': False}. Best is trial 65 with value: 0.2962593081563617.
[I 2025-12-08 22:11:58,382] Trial 72 finished with value: 0.2851598115303561 and parameters: {'model_type': 'graphsage', 'hidden_dims': '[256, 128, 64]', 'dropout': 0.5146698428210562, 'batch_norm': True, 'sage_aggr': 'mean', 'sage_normalize': False, 'sage_project': False, 'lr': 0.0033452112299421225, 'weight_decay': 8.823929595020556e-07, 'epochs': 88, 'loss': 'mse', 'optimizer': 'adam', 'graph_mode': 'cutoff', 'cutoff': 0.2881898791777231, 'grm_norm': 'cosine_then_gcn', 'self_loops': True, 'use_snp_selection': False}. Best is trial 65 with value: 0.2962593081563617.
[I 2025-12-08 22:12:26,691] Trial 73 finished with value: 0.2920215991756933 and parameters: {'model_type': 'graphsage', 'hidden_dims': '[256, 128, 64]', 'dropout': 0.5307451284186747, 'batch_norm': True, 'sage_aggr': 'mean', 'sage_normalize': False, 'sage_project': False, 'lr': 0.0022267359222339685, 'weight_decay': 1.4206616523005305e-07, 'epochs': 69, 'loss': 'mse', 'optimizer': 'adam', 'graph_mode': 'cutoff', 'cutoff': 0.5302392629932137, 'grm_norm': 'cosine_then_gcn', 'self_loops': True, 'use_snp_selection': False}. Best is trial 65 with value: 0.2962593081563617.
[I 2025-12-08 22:12:55,055] Trial 74 finished with value: 0.2918193525729421 and parameters: {'model_type': 'graphsage', 'hidden_dims': '[256, 128, 64]', 'dropout': 0.5295215611521147, 'batch_norm': True, 'sage_aggr': 'mean', 'sage_normalize': False, 'sage_project': False, 'lr': 0.0033529346595706578, 'weight_decay': 1.7868543903157566e-07, 'epochs': 70, 'loss': 'mse', 'optimizer': 'adam', 'graph_mode': 'cutoff', 'cutoff': 0.5348534173265559, 'grm_norm': 'cosine_then_gcn', 'self_loops': True, 'use_snp_selection': False}. Best is trial 65 with value: 0.2962593081563617.
[I 2025-12-08 22:13:23,580] Trial 75 finished with value: 0.2793023453739152 and parameters: {'model_type': 'graphsage', 'hidden_dims': '[256, 128, 64]', 'dropout': 0.5029388443930367, 'batch_norm': True, 'sage_aggr': 'mean', 'sage_normalize': False, 'sage_project': False, 'lr': 0.006411032653379699, 'weight_decay': 1.4313691084012387e-07, 'epochs': 69, 'loss': 'mse', 'optimizer': 'adam', 'graph_mode': 'cutoff', 'cutoff': 0.5189973457964709, 'grm_norm': 'cosine_then_gcn', 'self_loops': True, 'use_snp_selection': False}. Best is trial 65 with value: 0.2962593081563617.
[I 2025-12-08 22:13:48,303] Trial 76 finished with value: 0.2937233162164019 and parameters: {'model_type': 'graphsage', 'hidden_dims': '[256, 128, 64]', 'dropout': 0.5316920353658636, 'batch_norm': True, 'sage_aggr': 'mean', 'sage_normalize': False, 'sage_project': False, 'lr': 0.0032396789565655782, 'weight_decay': 1.9874900169059682e-07, 'epochs': 46, 'loss': 'mse', 'optimizer': 'adam', 'graph_mode': 'cutoff', 'cutoff': 0.44739132027196343, 'grm_norm': 'cosine_then_gcn', 'self_loops': True, 'use_snp_selection': False}. Best is trial 65 with value: 0.2962593081563617.
[I 2025-12-08 22:14:17,492] Trial 77 finished with value: 0.28955550176274075 and parameters: {'model_type': 'graphsage', 'hidden_dims': '[256, 128, 64]', 'dropout': 0.5274965578772235, 'batch_norm': True, 'sage_aggr': 'mean', 'sage_normalize': False, 'sage_project': False, 'lr': 0.0044928103135691375, 'weight_decay': 2.075170875174929e-07, 'epochs': 62, 'loss': 'mse', 'optimizer': 'adam', 'graph_mode': 'cutoff', 'cutoff': 0.4616043690014509, 'grm_norm': 'cosine_then_gcn', 'self_loops': True, 'use_snp_selection': False}. Best is trial 65 with value: 0.2962593081563617.
[I 2025-12-08 22:14:57,319] Trial 78 finished with value: 0.2891863794627557 and parameters: {'model_type': 'graphsage', 'hidden_dims': '[256, 128, 64]', 'dropout': 0.46429229446140674, 'batch_norm': True, 'sage_aggr': 'mean', 'sage_normalize': False, 'sage_project': False, 'lr': 0.0017605633946851228, 'weight_decay': 1.2475737856839207e-07, 'epochs': 96, 'loss': 'mse', 'optimizer': 'adam', 'graph_mode': 'cutoff', 'cutoff': 0.3970206346776286, 'grm_norm': 'cosine_then_gcn', 'self_loops': True, 'use_snp_selection': False}. Best is trial 65 with value: 0.2962593081563617.
[I 2025-12-08 22:15:18,416] Trial 79 finished with value: 0.29785602291757357 and parameters: {'model_type': 'graphsage', 'hidden_dims': '[256, 128, 64]', 'dropout': 0.48912441122161643, 'batch_norm': True, 'sage_aggr': 'mean', 'sage_normalize': False, 'sage_project': False, 'lr': 0.002252137674999671, 'weight_decay': 4.2648409711339974e-07, 'epochs': 41, 'loss': 'mse', 'optimizer': 'adam', 'graph_mode': 'cutoff', 'cutoff': 0.5558135637235015, 'grm_norm': 'cosine_then_gcn', 'self_loops': True, 'use_snp_selection': False}. Best is trial 79 with value: 0.29785602291757357.
