[I 2025-12-09 00:19:47,940] Trial 149 finished with value: 0.37149721882195885 and parameters: {'model_type': 'graphsage', 'hidden_dims': '[512, 128]', 'dropout': 0.34278755789836585, 'batch_norm': False, 'sage_aggr': 'mean', 'sage_normalize': False, 'sage_project': False, 'lr': 2.5293149178422294e-05, 'weight_decay': 9.3637868150811e-06, 'epochs': 97, 'loss': 'mse', 'optimizer': 'adam', 'graph_mode': 'cutoff', 'cutoff': 0.8940013312075663, 'grm_norm': 'cosine_then_gcn', 'self_loops': False, 'use_snp_selection': False}. Best is trial 145 with value: 0.3824741529048902.
[I 2025-12-09 00:21:10,055] Trial 0 finished with value: 0.3344382289506638 and parameters: {'model_type': 'graphsage', 'hidden_dims': '[128, 64]', 'dropout': 0.199031432379812, 'batch_norm': True, 'sage_aggr': 'max', 'sage_normalize': True, 'sage_project': False, 'lr': 0.00034401453323286885, 'weight_decay': 0.00017802616915745114, 'epochs': 230, 'loss': 'mse', 'optimizer': 'adam', 'graph_mode': 'knn', 'knn_k': 6, 'weighted_edges': True, 'symmetrize_mode': 'mutual', 'self_loops': True, 'use_snp_selection': False}. Best is trial 0 with value: 0.3344382289506638.
[I 2025-12-09 00:22:49,026] Trial 1 finished with value: 0.3587209664975516 and parameters: {'model_type': 'graphsage', 'hidden_dims': '[512, 128]', 'dropout': 0.2503500283181017, 'batch_norm': False, 'sage_aggr': 'max', 'sage_normalize': False, 'sage_project': False, 'lr': 3.952233718592099e-05, 'weight_decay': 0.00026754769258252603, 'epochs': 149, 'loss': 'mse', 'optimizer': 'adam', 'graph_mode': 'knn', 'knn_k': 2, 'weighted_edges': False, 'symmetrize_mode': 'mutual', 'self_loops': True, 'use_snp_selection': True, 'num_snps': 49915}. Best is trial 1 with value: 0.3587209664975516.
[I 2025-12-09 00:24:05,629] Trial 2 finished with value: 0.37149077614042453 and parameters: {'model_type': 'graphsage', 'hidden_dims': '[512, 256]', 'dropout': 0.2785908793172681, 'batch_norm': False, 'sage_aggr': 'max', 'sage_normalize': False, 'sage_project': False, 'lr': 8.806039223165805e-05, 'weight_decay': 3.5153176302760294e-05, 'epochs': 147, 'loss': 'mae', 'optimizer': 'adam', 'graph_mode': 'cutoff', 'cutoff': 0.4922564006874869, 'grm_norm': 'gcn', 'self_loops': False, 'use_snp_selection': True, 'num_snps': 34340}. Best is trial 2 with value: 0.37149077614042453.
[I 2025-12-09 00:25:18,404] Trial 3 finished with value: 0.34593807691714684 and parameters: {'model_type': 'graphsage', 'hidden_dims': '[256, 128, 64]', 'dropout': 0.3475243154412272, 'batch_norm': True, 'sage_aggr': 'max', 'sage_normalize': False, 'sage_project': False, 'lr': 1.6006331996938085e-05, 'weight_decay': 7.213121225589906e-06, 'epochs': 283, 'loss': 'mse', 'optimizer': 'adam', 'graph_mode': 'cutoff', 'cutoff': 0.5942334791449215, 'grm_norm': 'none', 'self_loops': True, 'use_snp_selection': False}. Best is trial 2 with value: 0.37149077614042453.
[I 2025-12-09 00:26:00,529] Trial 4 finished with value: 0.3151103697954127 and parameters: {'model_type': 'graphsage', 'hidden_dims': '[128, 64]', 'dropout': 0.3348926467202472, 'batch_norm': True, 'sage_aggr': 'max', 'sage_normalize': False, 'sage_project': False, 'lr': 0.0004238630400638802, 'weight_decay': 8.074086040046576e-07, 'epochs': 158, 'loss': 'mae', 'optimizer': 'adam', 'graph_mode': 'knn', 'knn_k': 1, 'weighted_edges': False, 'symmetrize_mode': 'mutual', 'self_loops': False, 'use_snp_selection': True, 'num_snps': 26850}. Best is trial 2 with value: 0.37149077614042453.
[I 2025-12-09 00:27:48,060] Trial 5 finished with value: 0.32722120210332434 and parameters: {'model_type': 'graphsage', 'hidden_dims': '[512, 64]', 'dropout': 0.14505336736221927, 'batch_norm': True, 'sage_aggr': 'mean', 'sage_normalize': True, 'sage_project': False, 'lr': 1.2962030165732234e-05, 'weight_decay': 1.326598071105465e-07, 'epochs': 180, 'loss': 'mse', 'optimizer': 'adam', 'graph_mode': 'knn', 'knn_k': 9, 'weighted_edges': True, 'symmetrize_mode': 'mutual', 'self_loops': False, 'use_snp_selection': False}. Best is trial 2 with value: 0.37149077614042453.
[I 2025-12-09 00:28:40,501] Trial 6 finished with value: 0.3298533344627176 and parameters: {'model_type': 'graphsage', 'hidden_dims': '[256, 128, 64]', 'dropout': 0.10731743755162496, 'batch_norm': True, 'sage_aggr': 'mean', 'sage_normalize': False, 'sage_project': False, 'lr': 1.922990426933137e-05, 'weight_decay': 7.30001060446905e-05, 'epochs': 63, 'loss': 'mae', 'optimizer': 'adam', 'graph_mode': 'cutoff', 'cutoff': 0.7624978434202536, 'grm_norm': 'none', 'self_loops': True, 'use_snp_selection': True, 'num_snps': 50106}. Best is trial 2 with value: 0.37149077614042453.
[I 2025-12-09 00:30:35,762] Trial 7 finished with value: 0.3477646312265407 and parameters: {'model_type': 'graphsage', 'hidden_dims': '[512, 64]', 'dropout': 0.2585007811528941, 'batch_norm': True, 'sage_aggr': 'max', 'sage_normalize': True, 'sage_project': False, 'lr': 5.921425508303391e-05, 'weight_decay': 0.0004511561961144237, 'epochs': 182, 'loss': 'mae', 'optimizer': 'adam', 'graph_mode': 'knn', 'knn_k': 9, 'weighted_edges': True, 'symmetrize_mode': 'union', 'self_loops': False, 'use_snp_selection': True, 'num_snps': 23903}. Best is trial 2 with value: 0.37149077614042453.
[I 2025-12-09 00:31:17,185] Trial 8 finished with value: 0.3123976976304676 and parameters: {'model_type': 'graphsage', 'hidden_dims': '[512, 256]', 'dropout': 0.3061380386767003, 'batch_norm': False, 'sage_aggr': 'mean', 'sage_normalize': True, 'sage_project': False, 'lr': 0.000698401460570184, 'weight_decay': 2.965560055460244e-06, 'epochs': 289, 'loss': 'mae', 'optimizer': 'adam', 'graph_mode': 'knn', 'knn_k': 7, 'weighted_edges': False, 'symmetrize_mode': 'mutual', 'self_loops': True, 'use_snp_selection': True, 'num_snps': 4710}. Best is trial 2 with value: 0.37149077614042453.
[I 2025-12-09 00:34:55,387] Trial 9 finished with value: 0.3553471919337786 and parameters: {'model_type': 'graphsage', 'hidden_dims': '[512, 128]', 'dropout': 0.1733844071393634, 'batch_norm': False, 'sage_aggr': 'mean', 'sage_normalize': True, 'sage_project': False, 'lr': 0.0004269677918501597, 'weight_decay': 2.2439779626249696e-06, 'epochs': 319, 'loss': 'mse', 'optimizer': 'adam', 'graph_mode': 'cutoff', 'cutoff': 0.24117565767129295, 'grm_norm': 'cosine_then_gcn', 'self_loops': True, 'use_snp_selection': False}. Best is trial 2 with value: 0.37149077614042453.
[I 2025-12-09 00:35:58,760] Trial 10 finished with value: 0.0 and parameters: {'model_type': 'graphsage', 'hidden_dims': '[512, 256]', 'dropout': 0.46773351022590026, 'batch_norm': False, 'sage_aggr': 'max', 'sage_normalize': False, 'sage_project': False, 'lr': 0.0060050040216813455, 'weight_decay': 3.194347401809951e-05, 'epochs': 76, 'loss': 'mae', 'optimizer': 'adam', 'graph_mode': 'cutoff', 'cutoff': 0.36538426242387784, 'grm_norm': 'gcn', 'self_loops': False, 'use_snp_selection': True, 'num_snps': 36724}. Best is trial 2 with value: 0.37149077614042453.
[I 2025-12-09 00:37:41,416] Trial 11 finished with value: 0.20380253763562547 and parameters: {'model_type': 'graphsage', 'hidden_dims': '[512, 128]', 'dropout': 0.4554228059341249, 'batch_norm': False, 'sage_aggr': 'max', 'sage_normalize': False, 'sage_project': False, 'lr': 8.040010782675617e-05, 'weight_decay': 0.0005735134390673265, 'epochs': 111, 'loss': 'mse', 'optimizer': 'adam', 'graph_mode': 'cutoff', 'cutoff': 0.48934453790731597, 'grm_norm': 'gcn', 'self_loops': False, 'use_snp_selection': True, 'num_snps': 57852}. Best is trial 2 with value: 0.37149077614042453.
[I 2025-12-09 00:38:52,606] Trial 12 finished with value: 0.285940679826579 and parameters: {'model_type': 'graphsage', 'hidden_dims': '[256, 128]', 'dropout': 0.5957621421360685, 'batch_norm': False, 'sage_aggr': 'max', 'sage_normalize': False, 'sage_project': False, 'lr': 9.196950102765017e-05, 'weight_decay': 3.009671916983956e-05, 'epochs': 138, 'loss': 'mse', 'optimizer': 'adam', 'graph_mode': 'knn', 'knn_k': 1, 'weighted_edges': False, 'symmetrize_mode': 'union', 'self_loops': True, 'use_snp_selection': True, 'num_snps': 41579}. Best is trial 2 with value: 0.37149077614042453.
[I 2025-12-09 00:40:34,879] Trial 13 finished with value: 0.3664108732375885 and parameters: {'model_type': 'graphsage', 'hidden_dims': '[512, 128]', 'dropout': 0.232363982604941, 'batch_norm': False, 'sage_aggr': 'max', 'sage_normalize': False, 'sage_project': False, 'lr': 4.819859523109959e-05, 'weight_decay': 0.00011926072016900266, 'epochs': 223, 'loss': 'mae', 'optimizer': 'adam', 'graph_mode': 'cutoff', 'cutoff': 0.8137943133270612, 'grm_norm': 'cosine', 'self_loops': False, 'use_snp_selection': True, 'num_snps': 44122}. Best is trial 2 with value: 0.37149077614042453.
[I 2025-12-09 00:41:33,430] Trial 14 finished with value: 0.34960536562080236 and parameters: {'model_type': 'graphsage', 'hidden_dims': '[512, 256]', 'dropout': 0.420004136612043, 'batch_norm': False, 'sage_aggr': 'max', 'sage_normalize': False, 'sage_project': False, 'lr': 0.00014133684867458172, 'weight_decay': 6.244336878684844e-05, 'epochs': 240, 'loss': 'mae', 'optimizer': 'adam', 'graph_mode': 'cutoff', 'cutoff': 0.889546541726153, 'grm_norm': 'cosine', 'self_loops': False, 'use_snp_selection': True, 'num_snps': 18005}. Best is trial 2 with value: 0.37149077614042453.
[I 2025-12-09 00:42:44,696] Trial 15 finished with value: 0.13958172172033714 and parameters: {'model_type': 'graphsage', 'hidden_dims': '[256, 128]', 'dropout': 0.23676193157103503, 'batch_norm': False, 'sage_aggr': 'max', 'sage_normalize': False, 'sage_project': False, 'lr': 0.0013847822027307618, 'weight_decay': 1.3652558904369231e-05, 'epochs': 253, 'loss': 'mae', 'optimizer': 'adam', 'graph_mode': 'cutoff', 'cutoff': 0.6099811810284483, 'grm_norm': 'cosine', 'self_loops': False, 'use_snp_selection': True, 'num_snps': 37829}. Best is trial 2 with value: 0.37149077614042453.
[I 2025-12-09 00:44:24,404] Trial 16 finished with value: 0.36336243591588685 and parameters: {'model_type': 'graphsage', 'hidden_dims': '[512, 128]', 'dropout': 0.41050249627484303, 'batch_norm': False, 'sage_aggr': 'max', 'sage_normalize': False, 'sage_project': False, 'lr': 0.00015946268529881528, 'weight_decay': 0.0001425603435327901, 'epochs': 209, 'loss': 'mae', 'optimizer': 'adam', 'graph_mode': 'cutoff', 'cutoff': 0.7419957812461905, 'grm_norm': 'gcn', 'self_loops': False, 'use_snp_selection': True, 'num_snps': 45577}. Best is trial 2 with value: 0.37149077614042453.
[I 2025-12-09 00:45:28,739] Trial 17 finished with value: 0.358227128914784 and parameters: {'model_type': 'graphsage', 'hidden_dims': '[512, 256]', 'dropout': 0.29039558206872257, 'batch_norm': False, 'sage_aggr': 'max', 'sage_normalize': False, 'sage_project': False, 'lr': 3.4183470010665866e-05, 'weight_decay': 0.0009011910617460991, 'epochs': 100, 'loss': 'mae', 'optimizer': 'adam', 'graph_mode': 'cutoff', 'cutoff': 0.43672077646257246, 'grm_norm': 'cosine', 'self_loops': False, 'use_snp_selection': True, 'num_snps': 32263}. Best is trial 2 with value: 0.37149077614042453.
[I 2025-12-09 00:45:59,112] Trial 18 finished with value: 0.12354670799516769 and parameters: {'model_type': 'graphsage', 'hidden_dims': '[512, 256]', 'dropout': 0.20659399060640374, 'batch_norm': False, 'sage_aggr': 'mean', 'sage_normalize': False, 'sage_project': False, 'lr': 0.0016474991744482989, 'weight_decay': 1.6629859519446434e-05, 'epochs': 45, 'loss': 'mae', 'optimizer': 'adam', 'graph_mode': 'cutoff', 'cutoff': 0.6851228139594263, 'grm_norm': 'cosine_then_gcn', 'self_loops': False, 'use_snp_selection': False}. Best is trial 2 with value: 0.37149077614042453.
[I 2025-12-09 00:48:02,130] Trial 19 finished with value: 0.36794122116294964 and parameters: {'model_type': 'graphsage', 'hidden_dims': '[512, 128]', 'dropout': 0.38725588349711804, 'batch_norm': False, 'sage_aggr': 'max', 'sage_normalize': False, 'sage_project': False, 'lr': 0.00019215243138724956, 'weight_decay': 7.466384199578085e-05, 'epochs': 202, 'loss': 'mae', 'optimizer': 'adam', 'graph_mode': 'cutoff', 'cutoff': 0.8876019425544109, 'grm_norm': 'gcn', 'self_loops': False, 'use_snp_selection': True, 'num_snps': 59751}. Best is trial 2 with value: 0.37149077614042453.
[I 2025-12-09 00:49:56,197] Trial 20 finished with value: 0.01418976110610673 and parameters: {'model_type': 'graphsage', 'hidden_dims': '[512, 64]', 'dropout': 0.5517922731680476, 'batch_norm': False, 'sage_aggr': 'max', 'sage_normalize': False, 'sage_project': False, 'lr': 0.0001817123832705127, 'weight_decay': 5.299783994951426e-06, 'epochs': 112, 'loss': 'mae', 'optimizer': 'adam', 'graph_mode': 'cutoff', 'cutoff': 0.37048989694547907, 'grm_norm': 'gcn', 'self_loops': False, 'use_snp_selection': True, 'num_snps': 58721}. Best is trial 2 with value: 0.37149077614042453.
[I 2025-12-09 00:51:42,628] Trial 21 finished with value: 0.36522481372070564 and parameters: {'model_type': 'graphsage', 'hidden_dims': '[512, 128]', 'dropout': 0.3794637538256749, 'batch_norm': False, 'sage_aggr': 'max', 'sage_normalize': False, 'sage_project': False, 'lr': 3.161316214305987e-05, 'weight_decay': 6.82984387485305e-05, 'epochs': 197, 'loss': 'mae', 'optimizer': 'adam', 'graph_mode': 'cutoff', 'cutoff': 0.8896876562345186, 'grm_norm': 'gcn', 'self_loops': False, 'use_snp_selection': True, 'num_snps': 51122}. Best is trial 2 with value: 0.37149077614042453.
[I 2025-12-09 00:52:38,362] Trial 22 finished with value: 0.35296182674312915 and parameters: {'model_type': 'graphsage', 'hidden_dims': '[512, 128]', 'dropout': 0.30227116762042755, 'batch_norm': False, 'sage_aggr': 'max', 'sage_normalize': False, 'sage_project': False, 'lr': 0.00017614186176397303, 'weight_decay': 3.180311395140039e-05, 'epochs': 212, 'loss': 'mae', 'optimizer': 'adam', 'graph_mode': 'cutoff', 'cutoff': 0.8059997509878861, 'grm_norm': 'cosine', 'self_loops': False, 'use_snp_selection': True, 'num_snps': 18524}. Best is trial 2 with value: 0.37149077614042453.
[I 2025-12-09 00:54:29,076] Trial 23 finished with value: 0.3632546214927456 and parameters: {'model_type': 'graphsage', 'hidden_dims': '[512, 128]', 'dropout': 0.3761096369372018, 'batch_norm': False, 'sage_aggr': 'max', 'sage_normalize': False, 'sage_project': False, 'lr': 5.868294808490408e-05, 'weight_decay': 0.00012607108596415242, 'epochs': 267, 'loss': 'mae', 'optimizer': 'adam', 'graph_mode': 'cutoff', 'cutoff': 0.82836301913542, 'grm_norm': 'gcn', 'self_loops': False, 'use_snp_selection': True, 'num_snps': 42965}. Best is trial 2 with value: 0.37149077614042453.
[I 2025-12-09 00:55:38,325] Trial 24 finished with value: 0.36475772627639735 and parameters: {'model_type': 'graphsage', 'hidden_dims': '[512, 128]', 'dropout': 0.2880708237041683, 'batch_norm': False, 'sage_aggr': 'max', 'sage_normalize': False, 'sage_project': False, 'lr': 9.778214258747867e-05, 'weight_decay': 0.00031931972698407064, 'epochs': 169, 'loss': 'mae', 'optimizer': 'adam', 'graph_mode': 'cutoff', 'cutoff': 0.6631201437303171, 'grm_norm': 'gcn', 'self_loops': False, 'use_snp_selection': True, 'num_snps': 32527}. Best is trial 2 with value: 0.37149077614042453.
[I 2025-12-09 00:57:41,649] Trial 25 finished with value: 0.0 and parameters: {'model_type': 'graphsage', 'hidden_dims': '[256, 128, 64]', 'dropout': 0.49649554027513854, 'batch_norm': False, 'sage_aggr': 'max', 'sage_normalize': False, 'sage_project': False, 'lr': 0.0009974040517437928, 'weight_decay': 8.693769105975563e-05, 'epochs': 337, 'loss': 'mae', 'optimizer': 'adam', 'graph_mode': 'cutoff', 'cutoff': 0.5252662985167289, 'grm_norm': 'cosine', 'self_loops': False, 'use_snp_selection': True, 'num_snps': 53781}. Best is trial 2 with value: 0.37149077614042453.
[I 2025-12-09 00:58:35,817] Trial 26 finished with value: 0.29861308174328494 and parameters: {'model_type': 'graphsage', 'hidden_dims': '[128, 64]', 'dropout': 0.22219283058381792, 'batch_norm': False, 'sage_aggr': 'max', 'sage_normalize': False, 'sage_project': False, 'lr': 0.00026591285429489707, 'weight_decay': 2.7087315687635853e-05, 'epochs': 136, 'loss': 'mae', 'optimizer': 'adam', 'graph_mode': 'cutoff', 'cutoff': 0.8997254068458653, 'grm_norm': 'gcn', 'self_loops': False, 'use_snp_selection': True, 'num_snps': 46062}. Best is trial 2 with value: 0.37149077614042453.
[I 2025-12-09 00:59:34,446] Trial 27 finished with value: 0.3342418264574516 and parameters: {'model_type': 'graphsage', 'hidden_dims': '[256, 128]', 'dropout': 0.1609262262393797, 'batch_norm': False, 'sage_aggr': 'mean', 'sage_normalize': True, 'sage_project': False, 'lr': 2.668346253309397e-05, 'weight_decay': 4.4595211848360065e-05, 'epochs': 226, 'loss': 'mae', 'optimizer': 'adam', 'graph_mode': 'cutoff', 'cutoff': 0.6973827497728038, 'grm_norm': 'none', 'self_loops': False, 'use_snp_selection': False}. Best is trial 2 with value: 0.37149077614042453.
[I 2025-12-09 01:00:57,079] Trial 28 finished with value: 0.20043993575353997 and parameters: {'model_type': 'graphsage', 'hidden_dims': '[512, 256]', 'dropout': 0.32959730482473976, 'batch_norm': False, 'sage_aggr': 'max', 'sage_normalize': False, 'sage_project': False, 'lr': 0.0037763287684630005, 'weight_decay': 0.00019229315141304918, 'epochs': 192, 'loss': 'mae', 'optimizer': 'adam', 'graph_mode': 'cutoff', 'cutoff': 0.8248994476831157, 'grm_norm': 'cosine_then_gcn', 'self_loops': False, 'use_snp_selection': True, 'num_snps': 37670}. Best is trial 2 with value: 0.37149077614042453.
[I 2025-12-09 01:01:56,495] Trial 29 finished with value: 0.3499561571942481 and parameters: {'model_type': 'graphsage', 'hidden_dims': '[128, 64]', 'dropout': 0.2705103402523758, 'batch_norm': True, 'sage_aggr': 'max', 'sage_normalize': True, 'sage_project': False, 'lr': 0.00025589064306042104, 'weight_decay': 1.6408826004291546e-05, 'epochs': 240, 'loss': 'mae', 'optimizer': 'adam', 'graph_mode': 'cutoff', 'cutoff': 0.4294772380354501, 'grm_norm': 'cosine', 'self_loops': False, 'use_snp_selection': False}. Best is trial 2 with value: 0.37149077614042453.
[I 2025-12-09 01:03:54,471] Trial 30 finished with value: 0.36628308991214953 and parameters: {'model_type': 'graphsage', 'hidden_dims': '[512, 128]', 'dropout': 0.18909024430007068, 'batch_norm': False, 'sage_aggr': 'max', 'sage_normalize': False, 'sage_project': False, 'lr': 5.4932187169945926e-05, 'weight_decay': 0.0001371405625176877, 'epochs': 219, 'loss': 'mae', 'optimizer': 'adam', 'graph_mode': 'cutoff', 'cutoff': 0.23857719521123422, 'grm_norm': 'gcn', 'self_loops': False, 'use_snp_selection': True, 'num_snps': 27129}. Best is trial 2 with value: 0.37149077614042453.
[I 2025-12-09 01:06:06,372] Trial 31 finished with value: 0.36610464431196277 and parameters: {'model_type': 'graphsage', 'hidden_dims': '[512, 128]', 'dropout': 0.20358812806993826, 'batch_norm': False, 'sage_aggr': 'max', 'sage_normalize': False, 'sage_project': False, 'lr': 6.0320232125349255e-05, 'weight_decay': 0.00013274348739800767, 'epochs': 219, 'loss': 'mae', 'optimizer': 'adam', 'graph_mode': 'cutoff', 'cutoff': 0.2033678793892992, 'grm_norm': 'gcn', 'self_loops': False, 'use_snp_selection': True, 'num_snps': 25823}. Best is trial 2 with value: 0.37149077614042453.
[I 2025-12-09 01:07:29,536] Trial 32 finished with value: 0.37034116678767887 and parameters: {'model_type': 'graphsage', 'hidden_dims': '[512, 128]', 'dropout': 0.11971517612867941, 'batch_norm': False, 'sage_aggr': 'max', 'sage_normalize': False, 'sage_project': False, 'lr': 1.0379953803372497e-05, 'weight_decay': 0.00019662439372153257, 'epochs': 261, 'loss': 'mae', 'optimizer': 'adam', 'graph_mode': 'cutoff', 'cutoff': 0.2928789938230377, 'grm_norm': 'gcn', 'self_loops': False, 'use_snp_selection': True, 'num_snps': 19815}. Best is trial 2 with value: 0.37149077614042453.
[I 2025-12-09 01:08:26,556] Trial 33 finished with value: 0.3583882740914239 and parameters: {'model_type': 'graphsage', 'hidden_dims': '[512, 128]', 'dropout': 0.11967385799853, 'batch_norm': False, 'sage_aggr': 'max', 'sage_normalize': False, 'sage_project': False, 'lr': 1.2128701397391234e-05, 'weight_decay': 0.0002511815224883003, 'epochs': 292, 'loss': 'mae', 'optimizer': 'adam', 'graph_mode': 'cutoff', 'cutoff': 0.3284623600986111, 'grm_norm': 'gcn', 'self_loops': False, 'use_snp_selection': True, 'num_snps': 10839}. Best is trial 2 with value: 0.37149077614042453.
[I 2025-12-09 01:09:43,840] Trial 34 finished with value: 0.36475027757988066 and parameters: {'model_type': 'graphsage', 'hidden_dims': '[512, 128]', 'dropout': 0.37055058248248063, 'batch_norm': False, 'sage_aggr': 'max', 'sage_normalize': False, 'sage_project': False, 'lr': 2.2647323525777727e-05, 'weight_decay': 0.0009655707657653722, 'epochs': 261, 'loss': 'mse', 'optimizer': 'adam', 'graph_mode': 'knn', 'knn_k': 4, 'weighted_edges': True, 'symmetrize_mode': 'union', 'self_loops': True, 'use_snp_selection': True, 'num_snps': 16825}. Best is trial 2 with value: 0.37149077614042453.
[I 2025-12-09 01:10:54,253] Trial 35 finished with value: 0.3530343865524842 and parameters: {'model_type': 'graphsage', 'hidden_dims': '[512, 128]', 'dropout': 0.14276769069178524, 'batch_norm': True, 'sage_aggr': 'max', 'sage_normalize': False, 'sage_project': False, 'lr': 4.227031129100849e-05, 'weight_decay': 0.00042876827202509505, 'epochs': 156, 'loss': 'mae', 'optimizer': 'adam', 'graph_mode': 'cutoff', 'cutoff': 0.28537072900345595, 'grm_norm': 'gcn', 'self_loops': False, 'use_snp_selection': True, 'num_snps': 21845}. Best is trial 2 with value: 0.37149077614042453.
