[I 2025-12-10 00:21:29,059] Trial 106 finished with value: 0.29690095089307006 and parameters: {'model_type': 'graphsage', 'hidden_dims': '[128, 64]', 'dropout': 0.18805436296298939, 'batch_norm': False, 'sage_aggr': 'mean', 'sage_normalize': False, 'sage_project': False, 'lr': 2.3839517397019976e-05, 'weight_decay': 8.66330164062457e-06, 'epochs': 71, 'loss': 'mse', 'optimizer': 'adam', 'graph_mode': 'cutoff', 'cutoff': 0.6112083766661144, 'grm_norm': 'gcn', 'self_loops': False, 'use_snp_selection': True, 'num_snps': 17792}. Best is trial 84 with value: 0.3006039356320881.
[I 2025-12-10 00:22:12,097] Trial 107 finished with value: 0.2979586047695192 and parameters: {'model_type': 'graphsage', 'hidden_dims': '[512, 128]', 'dropout': 0.15579214086180634, 'batch_norm': False, 'sage_aggr': 'mean', 'sage_normalize': False, 'sage_project': False, 'lr': 2.1766686506102895e-05, 'weight_decay': 1.2642891781605054e-05, 'epochs': 64, 'loss': 'mse', 'optimizer': 'adam', 'graph_mode': 'cutoff', 'cutoff': 0.6880190929069709, 'grm_norm': 'gcn', 'self_loops': False, 'use_snp_selection': True, 'num_snps': 25098}. Best is trial 84 with value: 0.3006039356320881.
[I 2025-12-10 00:22:41,503] Trial 108 finished with value: 0.28982162592377647 and parameters: {'model_type': 'graphsage', 'hidden_dims': '[512, 64]', 'dropout': 0.1471360637346892, 'batch_norm': False, 'sage_aggr': 'mean', 'sage_normalize': False, 'sage_project': False, 'lr': 1.7752343283508287e-05, 'weight_decay': 1.3177219931635357e-05, 'epochs': 54, 'loss': 'mse', 'optimizer': 'adam', 'graph_mode': 'cutoff', 'cutoff': 0.6892139363128751, 'grm_norm': 'gcn', 'self_loops': False, 'use_snp_selection': True, 'num_snps': 11695}. Best is trial 84 with value: 0.3006039356320881.
[I 2025-12-10 00:23:22,287] Trial 109 finished with value: 0.30135334402070546 and parameters: {'model_type': 'graphsage', 'hidden_dims': '[512, 128]', 'dropout': 0.12639428237045292, 'batch_norm': False, 'sage_aggr': 'mean', 'sage_normalize': False, 'sage_project': False, 'lr': 2.3858905811091662e-05, 'weight_decay': 3.851890289931236e-06, 'epochs': 64, 'loss': 'mse', 'optimizer': 'adam', 'graph_mode': 'cutoff', 'cutoff': 0.7141068770598304, 'grm_norm': 'gcn', 'self_loops': False, 'use_snp_selection': True, 'num_snps': 22479}. Best is trial 109 with value: 0.30135334402070546.
[I 2025-12-10 00:24:02,533] Trial 110 finished with value: 0.29547928341635477 and parameters: {'model_type': 'graphsage', 'hidden_dims': '[512, 128]', 'dropout': 0.1291440422130617, 'batch_norm': False, 'sage_aggr': 'mean', 'sage_normalize': False, 'sage_project': False, 'lr': 1.8836779657359023e-05, 'weight_decay': 3.823302903595392e-06, 'epochs': 64, 'loss': 'mse', 'optimizer': 'adam', 'graph_mode': 'cutoff', 'cutoff': 0.7177710603608928, 'grm_norm': 'gcn', 'self_loops': False, 'use_snp_selection': True, 'num_snps': 22188}. Best is trial 109 with value: 0.30135334402070546.
[I 2025-12-10 00:24:46,037] Trial 111 finished with value: 0.29655368068004034 and parameters: {'model_type': 'graphsage', 'hidden_dims': '[512, 128]', 'dropout': 0.16606317504965334, 'batch_norm': False, 'sage_aggr': 'mean', 'sage_normalize': False, 'sage_project': False, 'lr': 2.5671018922120183e-05, 'weight_decay': 1.0985701672561316e-05, 'epochs': 97, 'loss': 'mse', 'optimizer': 'adam', 'graph_mode': 'cutoff', 'cutoff': 0.6535297981308233, 'grm_norm': 'gcn', 'self_loops': False, 'use_snp_selection': True, 'num_snps': 19340}. Best is trial 109 with value: 0.30135334402070546.
[I 2025-12-10 00:25:30,799] Trial 112 finished with value: 0.2968807022183923 and parameters: {'model_type': 'graphsage', 'hidden_dims': '[512, 128]', 'dropout': 0.14205187400004282, 'batch_norm': False, 'sage_aggr': 'mean', 'sage_normalize': False, 'sage_project': False, 'lr': 2.1842338150502308e-05, 'weight_decay': 8.76153499721461e-06, 'epochs': 80, 'loss': 'mse', 'optimizer': 'adam', 'graph_mode': 'cutoff', 'cutoff': 0.7408507751110591, 'grm_norm': 'gcn', 'self_loops': False, 'use_snp_selection': True, 'num_snps': 23536}. Best is trial 109 with value: 0.30135334402070546.
[I 2025-12-10 00:26:08,381] Trial 113 finished with value: 0.28935564773333866 and parameters: {'model_type': 'graphsage', 'hidden_dims': '[512, 128]', 'dropout': 0.11328523580949947, 'batch_norm': False, 'sage_aggr': 'mean', 'sage_normalize': False, 'sage_project': False, 'lr': 1.676665456787236e-05, 'weight_decay': 1.4876510146281104e-05, 'epochs': 109, 'loss': 'mse', 'optimizer': 'adam', 'graph_mode': 'cutoff', 'cutoff': 0.6284499949714332, 'grm_norm': 'gcn', 'self_loops': False, 'use_snp_selection': True, 'num_snps': 13680}. Best is trial 109 with value: 0.30135334402070546.
[I 2025-12-10 00:26:42,840] Trial 114 finished with value: 0.29484556357370784 and parameters: {'model_type': 'graphsage', 'hidden_dims': '[256, 128, 64]', 'dropout': 0.18279984602984667, 'batch_norm': False, 'sage_aggr': 'mean', 'sage_normalize': False, 'sage_project': False, 'lr': 3.007491944060336e-05, 'weight_decay': 3.460278292613883e-06, 'epochs': 44, 'loss': 'mse', 'optimizer': 'adam', 'graph_mode': 'cutoff', 'cutoff': 0.6888417779797462, 'grm_norm': 'gcn', 'self_loops': False, 'use_snp_selection': True, 'num_snps': 26648}. Best is trial 109 with value: 0.30135334402070546.
[I 2025-12-10 00:27:21,448] Trial 115 finished with value: 0.29435346816661057 and parameters: {'model_type': 'graphsage', 'hidden_dims': '[512, 128]', 'dropout': 0.22741442332421086, 'batch_norm': False, 'sage_aggr': 'mean', 'sage_normalize': False, 'sage_project': False, 'lr': 2.231589607107601e-05, 'weight_decay': 6.5597689615432825e-06, 'epochs': 60, 'loss': 'mse', 'optimizer': 'adam', 'graph_mode': 'cutoff', 'cutoff': 0.64599768688456, 'grm_norm': 'none', 'self_loops': False, 'use_snp_selection': True, 'num_snps': 20922}. Best is trial 109 with value: 0.30135334402070546.
[I 2025-12-10 00:28:19,395] Trial 116 finished with value: 0.2992687527828632 and parameters: {'model_type': 'graphsage', 'hidden_dims': '[512, 128]', 'dropout': 0.11724538191522053, 'batch_norm': False, 'sage_aggr': 'mean', 'sage_normalize': False, 'sage_project': False, 'lr': 1.4698913097917097e-05, 'weight_decay': 8.381146991610114e-06, 'epochs': 86, 'loss': 'mse', 'optimizer': 'adam', 'graph_mode': 'cutoff', 'cutoff': 0.7073905563651133, 'grm_norm': 'gcn', 'self_loops': False, 'use_snp_selection': True, 'num_snps': 33121}. Best is trial 109 with value: 0.30135334402070546.
[I 2025-12-10 00:29:36,978] Trial 117 finished with value: 0.26678513607882 and parameters: {'model_type': 'graphsage', 'hidden_dims': '[512, 128]', 'dropout': 0.11732893979286993, 'batch_norm': True, 'sage_aggr': 'mean', 'sage_normalize': True, 'sage_project': False, 'lr': 1.8630804277984835e-05, 'weight_decay': 2.0704005008489287e-05, 'epochs': 86, 'loss': 'mse', 'optimizer': 'adam', 'graph_mode': 'knn', 'knn_k': 6, 'weighted_edges': True, 'symmetrize_mode': 'mutual', 'self_loops': True, 'use_snp_selection': True, 'num_snps': 32573}. Best is trial 109 with value: 0.30135334402070546.
[I 2025-12-10 00:30:22,693] Trial 118 finished with value: 0.2919734102543786 and parameters: {'model_type': 'graphsage', 'hidden_dims': '[512, 128]', 'dropout': 0.1539925348809455, 'batch_norm': False, 'sage_aggr': 'mean', 'sage_normalize': False, 'sage_project': False, 'lr': 4.806300470581763e-05, 'weight_decay': 3.1874706802015685e-05, 'epochs': 76, 'loss': 'mae', 'optimizer': 'adam', 'graph_mode': 'cutoff', 'cutoff': 0.6997686600777036, 'grm_norm': 'gcn', 'self_loops': False, 'use_snp_selection': True, 'num_snps': 25029}. Best is trial 109 with value: 0.30135334402070546.
[I 2025-12-10 00:31:05,014] Trial 119 finished with value: 0.2902446686950786 and parameters: {'model_type': 'graphsage', 'hidden_dims': '[512, 128]', 'dropout': 0.26771449845488393, 'batch_norm': False, 'sage_aggr': 'mean', 'sage_normalize': False, 'sage_project': False, 'lr': 1.5818415634028646e-05, 'weight_decay': 1.1776782981799362e-05, 'epochs': 52, 'loss': 'mse', 'optimizer': 'adam', 'graph_mode': 'cutoff', 'cutoff': 0.672477171567586, 'grm_norm': 'gcn', 'self_loops': False, 'use_snp_selection': True, 'num_snps': 27172}. Best is trial 109 with value: 0.30135334402070546.
[I 2025-12-10 00:31:58,700] Trial 120 finished with value: 0.0743420931670745 and parameters: {'model_type': 'graphsage', 'hidden_dims': '[512, 128]', 'dropout': 0.14134040706846246, 'batch_norm': False, 'sage_aggr': 'mean', 'sage_normalize': False, 'sage_project': False, 'lr': 0.0015078445251257972, 'weight_decay': 2.5124908194893105e-06, 'epochs': 67, 'loss': 'mse', 'optimizer': 'adam', 'graph_mode': 'cutoff', 'cutoff': 0.709675335594544, 'grm_norm': 'gcn', 'self_loops': False, 'use_snp_selection': True, 'num_snps': 35739}. Best is trial 109 with value: 0.30135334402070546.
[I 2025-12-10 00:32:42,258] Trial 121 finished with value: 0.29867183957515314 and parameters: {'model_type': 'graphsage', 'hidden_dims': '[512, 128]', 'dropout': 0.1564552814011473, 'batch_norm': False, 'sage_aggr': 'mean', 'sage_normalize': False, 'sage_project': False, 'lr': 1.441872060828514e-05, 'weight_decay': 9.393516499458262e-06, 'epochs': 78, 'loss': 'mse', 'optimizer': 'adam', 'graph_mode': 'cutoff', 'cutoff': 0.6002153157791763, 'grm_norm': 'gcn', 'self_loops': False, 'use_snp_selection': True, 'num_snps': 22260}. Best is trial 109 with value: 0.30135334402070546.
[I 2025-12-10 00:33:24,684] Trial 122 finished with value: 0.2911764716173798 and parameters: {'model_type': 'graphsage', 'hidden_dims': '[512, 128]', 'dropout': 0.15554982256369257, 'batch_norm': False, 'sage_aggr': 'mean', 'sage_normalize': False, 'sage_project': False, 'lr': 1.4894224508175233e-05, 'weight_decay': 4.191130948815841e-06, 'epochs': 76, 'loss': 'mse', 'optimizer': 'adam', 'graph_mode': 'cutoff', 'cutoff': 0.736265443393292, 'grm_norm': 'gcn', 'self_loops': False, 'use_snp_selection': True, 'num_snps': 21876}. Best is trial 109 with value: 0.30135334402070546.
[I 2025-12-10 00:34:12,079] Trial 123 finished with value: 0.2953373035310154 and parameters: {'model_type': 'graphsage', 'hidden_dims': '[512, 128]', 'dropout': 0.10003824166376418, 'batch_norm': False, 'sage_aggr': 'mean', 'sage_normalize': False, 'sage_project': False, 'lr': 1.1648526085221387e-05, 'weight_decay': 8.896506898911001e-06, 'epochs': 88, 'loss': 'mse', 'optimizer': 'adam', 'graph_mode': 'cutoff', 'cutoff': 0.6050575143939192, 'grm_norm': 'gcn', 'self_loops': False, 'use_snp_selection': True, 'num_snps': 23798}. Best is trial 109 with value: 0.30135334402070546.
[I 2025-12-10 00:35:09,709] Trial 124 finished with value: 0.2958493590078989 and parameters: {'model_type': 'graphsage', 'hidden_dims': '[512, 128]', 'dropout': 0.1795711417725061, 'batch_norm': False, 'sage_aggr': 'mean', 'sage_normalize': False, 'sage_project': False, 'lr': 2.375922455541038e-05, 'weight_decay': 6.60190432688736e-06, 'epochs': 99, 'loss': 'mse', 'optimizer': 'adam', 'graph_mode': 'cutoff', 'cutoff': 0.6254140480131626, 'grm_norm': 'gcn', 'self_loops': False, 'use_snp_selection': True, 'num_snps': 29407}. Best is trial 109 with value: 0.30135334402070546.
[I 2025-12-10 00:35:51,017] Trial 125 finished with value: 0.2928824067423985 and parameters: {'model_type': 'graphsage', 'hidden_dims': '[512, 128]', 'dropout': 0.20544663514257525, 'batch_norm': False, 'sage_aggr': 'mean', 'sage_normalize': False, 'sage_project': False, 'lr': 2.0626459139076682e-05, 'weight_decay': 7.509517792339292e-06, 'epochs': 82, 'loss': 'mse', 'optimizer': 'adam', 'graph_mode': 'cutoff', 'cutoff': 0.6882551566361051, 'grm_norm': 'cosine_then_gcn', 'self_loops': False, 'use_snp_selection': True, 'num_snps': 19580}. Best is trial 109 with value: 0.30135334402070546.
[I 2025-12-10 00:36:34,508] Trial 126 finished with value: 0.2956379374666669 and parameters: {'model_type': 'graphsage', 'hidden_dims': '[512, 128]', 'dropout': 0.11960614361110554, 'batch_norm': False, 'sage_aggr': 'mean', 'sage_normalize': False, 'sage_project': False, 'lr': 1.730064392921451e-05, 'weight_decay': 1.5810962257277043e-05, 'epochs': 61, 'loss': 'mse', 'optimizer': 'adam', 'graph_mode': 'cutoff', 'cutoff': 0.5592101883316114, 'grm_norm': 'gcn', 'self_loops': False, 'use_snp_selection': True, 'num_snps': 25501}. Best is trial 109 with value: 0.30135334402070546.
[I 2025-12-10 00:37:10,256] Trial 127 finished with value: 0.30076605206685697 and parameters: {'model_type': 'graphsage', 'hidden_dims': '[128, 64]', 'dropout': 0.21744745962226797, 'batch_norm': False, 'sage_aggr': 'mean', 'sage_normalize': False, 'sage_project': False, 'lr': 3.299485432155728e-05, 'weight_decay': 5.111200263527574e-05, 'epochs': 74, 'loss': 'mse', 'optimizer': 'adam', 'graph_mode': 'cutoff', 'cutoff': 0.6586442855056819, 'grm_norm': 'gcn', 'self_loops': False, 'use_snp_selection': True, 'num_snps': 28501}. Best is trial 109 with value: 0.30135334402070546.
[I 2025-12-10 00:38:25,258] Trial 128 finished with value: 0.29376085348999953 and parameters: {'model_type': 'graphsage', 'hidden_dims': '[512, 256]', 'dropout': 0.22066844029135027, 'batch_norm': False, 'sage_aggr': 'mean', 'sage_normalize': False, 'sage_project': False, 'lr': 3.2988774087880855e-05, 'weight_decay': 4.153691434696804e-05, 'epochs': 119, 'loss': 'mse', 'optimizer': 'adam', 'graph_mode': 'cutoff', 'cutoff': 0.6459021049484766, 'grm_norm': 'gcn', 'self_loops': False, 'use_snp_selection': True, 'num_snps': 38168}. Best is trial 109 with value: 0.30135334402070546.
[I 2025-12-10 00:39:14,064] Trial 129 finished with value: 0.28737157156230064 and parameters: {'model_type': 'graphsage', 'hidden_dims': '[512, 128]', 'dropout': 0.13447035637091675, 'batch_norm': False, 'sage_aggr': 'mean', 'sage_normalize': False, 'sage_project': False, 'lr': 3.696481647594468e-05, 'weight_decay': 5.404276048541657e-05, 'epochs': 56, 'loss': 'mse', 'optimizer': 'adam', 'graph_mode': 'cutoff', 'cutoff': 0.6554906064130086, 'grm_norm': 'gcn', 'self_loops': False, 'use_snp_selection': True, 'num_snps': 33121}. Best is trial 109 with value: 0.30135334402070546.
[I 2025-12-10 00:39:53,749] Trial 130 finished with value: 0.2940329568613329 and parameters: {'model_type': 'graphsage', 'hidden_dims': '[128, 64]', 'dropout': 0.15765476834872347, 'batch_norm': False, 'sage_aggr': 'mean', 'sage_normalize': False, 'sage_project': False, 'lr': 1.4665836103051271e-05, 'weight_decay': 6.342587632553405e-05, 'epochs': 110, 'loss': 'mse', 'optimizer': 'adam', 'graph_mode': 'cutoff', 'cutoff': 0.6127999693327923, 'grm_norm': 'gcn', 'self_loops': False, 'use_snp_selection': True, 'num_snps': 28364}. Best is trial 109 with value: 0.30135334402070546.
[I 2025-12-10 00:40:28,541] Trial 131 finished with value: 0.2948155755208548 and parameters: {'model_type': 'graphsage', 'hidden_dims': '[128, 64]', 'dropout': 0.21561043081408776, 'batch_norm': False, 'sage_aggr': 'mean', 'sage_normalize': False, 'sage_project': False, 'lr': 2.5527711544069936e-05, 'weight_decay': 1.1954478209680711e-05, 'epochs': 73, 'loss': 'mse', 'optimizer': 'adam', 'graph_mode': 'cutoff', 'cutoff': 0.6656654576769906, 'grm_norm': 'gcn', 'self_loops': False, 'use_snp_selection': True, 'num_snps': 27305}. Best is trial 109 with value: 0.30135334402070546.
[I 2025-12-10 00:41:00,721] Trial 132 finished with value: 0.2961345471527522 and parameters: {'model_type': 'graphsage', 'hidden_dims': '[128, 64]', 'dropout': 0.1706611515853805, 'batch_norm': False, 'sage_aggr': 'mean', 'sage_normalize': False, 'sage_project': False, 'lr': 2.9787273343271596e-05, 'weight_decay': 3.088182634226147e-05, 'epochs': 67, 'loss': 'mse', 'optimizer': 'adam', 'graph_mode': 'cutoff', 'cutoff': 0.7148361862911993, 'grm_norm': 'gcn', 'self_loops': False, 'use_snp_selection': True, 'num_snps': 23687}. Best is trial 109 with value: 0.30135334402070546.
[I 2025-12-10 00:41:36,681] Trial 133 finished with value: 0.2975949530254852 and parameters: {'model_type': 'graphsage', 'hidden_dims': '[128, 64]', 'dropout': 0.19220335487106502, 'batch_norm': False, 'sage_aggr': 'mean', 'sage_normalize': False, 'sage_project': False, 'lr': 2.0717824121622712e-05, 'weight_decay': 2.092041658998264e-05, 'epochs': 92, 'loss': 'mse', 'optimizer': 'adam', 'graph_mode': 'cutoff', 'cutoff': 0.6806443019555736, 'grm_norm': 'gcn', 'self_loops': False, 'use_snp_selection': True, 'num_snps': 26607}. Best is trial 109 with value: 0.30135334402070546.
[I 2025-12-10 00:42:09,592] Trial 134 finished with value: 0.28327967796753545 and parameters: {'model_type': 'graphsage', 'hidden_dims': '[128, 64]', 'dropout': 0.1487524815380814, 'batch_norm': False, 'sage_aggr': 'mean', 'sage_normalize': False, 'sage_project': False, 'lr': 4.2999133994299684e-05, 'weight_decay': 8.931594329046697e-06, 'epochs': 40, 'loss': 'mse', 'optimizer': 'adam', 'graph_mode': 'cutoff', 'cutoff': 0.6363992301282957, 'grm_norm': 'gcn', 'self_loops': False, 'use_snp_selection': True, 'num_snps': 29114}. Best is trial 109 with value: 0.30135334402070546.
[I 2025-12-10 00:42:59,008] Trial 135 finished with value: 0.2919447319424461 and parameters: {'model_type': 'graphsage', 'hidden_dims': '[128, 64]', 'dropout': 0.16419915338984606, 'batch_norm': False, 'sage_aggr': 'mean', 'sage_normalize': False, 'sage_project': False, 'lr': 2.320385578278994e-05, 'weight_decay': 4.611402308816709e-06, 'epochs': 81, 'loss': 'mse', 'optimizer': 'adam', 'graph_mode': 'cutoff', 'cutoff': 0.2831950276820105, 'grm_norm': 'gcn', 'self_loops': False, 'use_snp_selection': True, 'num_snps': 20982}. Best is trial 109 with value: 0.30135334402070546.
[I 2025-12-10 00:43:28,364] Trial 136 finished with value: 0.27292160977533486 and parameters: {'model_type': 'graphsage', 'hidden_dims': '[128, 64]', 'dropout': 0.12591472557674868, 'batch_norm': False, 'sage_aggr': 'mean', 'sage_normalize': False, 'sage_project': False, 'lr': 0.0005921771928949204, 'weight_decay': 6.184285394384276e-06, 'epochs': 64, 'loss': 'mse', 'optimizer': 'adam', 'graph_mode': 'cutoff', 'cutoff': 0.6293443440289359, 'grm_norm': 'none', 'self_loops': False, 'use_snp_selection': True, 'num_snps': 18474}. Best is trial 109 with value: 0.30135334402070546.
[I 2025-12-10 00:43:59,512] Trial 137 finished with value: 0.2717390326026038 and parameters: {'model_type': 'graphsage', 'hidden_dims': '[128, 64]', 'dropout': 0.20201533234155108, 'batch_norm': False, 'sage_aggr': 'mean', 'sage_normalize': False, 'sage_project': False, 'lr': 0.00032434771327995653, 'weight_decay': 3.207972010997248e-06, 'epochs': 48, 'loss': 'mse', 'optimizer': 'adam', 'graph_mode': 'cutoff', 'cutoff': 0.7295343615028702, 'grm_norm': 'gcn', 'self_loops': False, 'use_snp_selection': True, 'num_snps': 24682}. Best is trial 109 with value: 0.30135334402070546.
[I 2025-12-10 00:45:24,125] Trial 138 finished with value: 0.24053669646135528 and parameters: {'model_type': 'graphsage', 'hidden_dims': '[512, 64]', 'dropout': 0.18100348133812771, 'batch_norm': True, 'sage_aggr': 'mean', 'sage_normalize': True, 'sage_project': False, 'lr': 2.7563261110254786e-05, 'weight_decay': 8.884107894212253e-05, 'epochs': 77, 'loss': 'mse', 'optimizer': 'adam', 'graph_mode': 'knn', 'knn_k': 5, 'weighted_edges': False, 'symmetrize_mode': 'union', 'self_loops': True, 'use_snp_selection': True, 'num_snps': 31892}. Best is trial 109 with value: 0.30135334402070546.
[I 2025-12-10 00:45:55,224] Trial 139 finished with value: 0.26590505229234923 and parameters: {'model_type': 'graphsage', 'hidden_dims': '[128, 64]', 'dropout': 0.23464178648417736, 'batch_norm': False, 'sage_aggr': 'mean', 'sage_normalize': False, 'sage_project': False, 'lr': 0.00020381768486057243, 'weight_decay': 2.7077095988278244e-05, 'epochs': 55, 'loss': 'mae', 'optimizer': 'adam', 'graph_mode': 'cutoff', 'cutoff': 0.5995792969746685, 'grm_norm': 'gcn', 'self_loops': False, 'use_snp_selection': True, 'num_snps': 22754}. Best is trial 109 with value: 0.30135334402070546.
[I 2025-12-10 00:46:40,776] Trial 140 finished with value: 0.3009221785346175 and parameters: {'model_type': 'graphsage', 'hidden_dims': '[512, 128]', 'dropout': 0.1089317206131484, 'batch_norm': False, 'sage_aggr': 'mean', 'sage_normalize': False, 'sage_project': False, 'lr': 1.8788784805441033e-05, 'weight_decay': 1.3417622451389848e-05, 'epochs': 68, 'loss': 'mse', 'optimizer': 'adam', 'graph_mode': 'cutoff', 'cutoff': 0.592147474259232, 'grm_norm': 'gcn', 'self_loops': False, 'use_snp_selection': True, 'num_snps': 26064}. Best is trial 109 with value: 0.30135334402070546.
[I 2025-12-10 00:47:26,550] Trial 141 finished with value: 0.29748614808774065 and parameters: {'model_type': 'graphsage', 'hidden_dims': '[512, 128]', 'dropout': 0.10273718756235294, 'batch_norm': False, 'sage_aggr': 'mean', 'sage_normalize': False, 'sage_project': False, 'lr': 1.8977914826779127e-05, 'weight_decay': 1.4299078208680395e-05, 'epochs': 69, 'loss': 'mse', 'optimizer': 'adam', 'graph_mode': 'cutoff', 'cutoff': 0.7539147137064907, 'grm_norm': 'gcn', 'self_loops': False, 'use_snp_selection': True, 'num_snps': 26509}. Best is trial 109 with value: 0.30135334402070546.
[I 2025-12-10 00:48:09,689] Trial 142 finished with value: 0.3009202065746966 and parameters: {'model_type': 'graphsage', 'hidden_dims': '[512, 128]', 'dropout': 0.11320926573470412, 'batch_norm': False, 'sage_aggr': 'mean', 'sage_normalize': False, 'sage_project': False, 'lr': 1.1676481325369565e-05, 'weight_decay': 1.1233536509164402e-05, 'epochs': 61, 'loss': 'mse', 'optimizer': 'adam', 'graph_mode': 'cutoff', 'cutoff': 0.5944516895701489, 'grm_norm': 'gcn', 'self_loops': False, 'use_snp_selection': True, 'num_snps': 25504}. Best is trial 109 with value: 0.30135334402070546.
