[I 2025-12-09 19:10:08,603] Trial 29 finished with value: 0.2981765039312317 and parameters: {'model_type': 'graphsage', 'hidden_dims': '[128, 64]', 'dropout': 0.21020524080945696, 'batch_norm': True, 'sage_aggr': 'max', 'sage_normalize': True, 'sage_project': False, 'lr': 0.0002856378147387743, 'weight_decay': 1.6072642387382682e-05, 'epochs': 235, 'loss': 'mae', 'optimizer': 'adam', 'graph_mode': 'cutoff', 'cutoff': 0.4871366279456034, 'grm_norm': 'gcn', 'self_loops': True, 'use_snp_selection': False}. Best is trial 24 with value: 0.36063356262187274.
[I 2025-12-09 19:10:25,703] Trial 30 finished with value: 0.36317670499653026 and parameters: {'model_type': 'graphsage', 'hidden_dims': '[512, 128]', 'dropout': 0.18221925174156395, 'batch_norm': False, 'sage_aggr': 'max', 'sage_normalize': False, 'sage_project': False, 'lr': 2.453698199124937e-05, 'weight_decay': 5.126261911187812e-05, 'epochs': 96, 'loss': 'mae', 'optimizer': 'adam', 'graph_mode': 'cutoff', 'cutoff': 0.6467797606294696, 'grm_norm': 'none', 'self_loops': True, 'use_snp_selection': True, 'num_snps': 9298}. Best is trial 30 with value: 0.36317670499653026.
[I 2025-12-09 19:10:44,023] Trial 31 finished with value: 0.35298548112371125 and parameters: {'model_type': 'graphsage', 'hidden_dims': '[512, 128]', 'dropout': 0.17450569010765504, 'batch_norm': False, 'sage_aggr': 'max', 'sage_normalize': False, 'sage_project': False, 'lr': 2.6319530543342982e-05, 'weight_decay': 5.006198462293526e-05, 'epochs': 99, 'loss': 'mae', 'optimizer': 'adam', 'graph_mode': 'cutoff', 'cutoff': 0.643016618227507, 'grm_norm': 'none', 'self_loops': True, 'use_snp_selection': True, 'num_snps': 10246}. Best is trial 30 with value: 0.36317670499653026.
[I 2025-12-09 19:11:02,689] Trial 32 finished with value: 0.35596560713067793 and parameters: {'model_type': 'graphsage', 'hidden_dims': '[512, 128]', 'dropout': 0.1170219003743542, 'batch_norm': False, 'sage_aggr': 'max', 'sage_normalize': False, 'sage_project': False, 'lr': 6.939076409806803e-05, 'weight_decay': 9.077955691543767e-05, 'epochs': 125, 'loss': 'mae', 'optimizer': 'adam', 'graph_mode': 'cutoff', 'cutoff': 0.5332769878417909, 'grm_norm': 'none', 'self_loops': True, 'use_snp_selection': True, 'num_snps': 7754}. Best is trial 30 with value: 0.36317670499653026.
[I 2025-12-09 19:11:18,425] Trial 33 finished with value: 0.3553182279869218 and parameters: {'model_type': 'graphsage', 'hidden_dims': '[512, 128]', 'dropout': 0.10835112410105603, 'batch_norm': False, 'sage_aggr': 'max', 'sage_normalize': False, 'sage_project': False, 'lr': 6.767149700485127e-05, 'weight_decay': 0.00011063930235969442, 'epochs': 74, 'loss': 'mae', 'optimizer': 'adam', 'graph_mode': 'cutoff', 'cutoff': 0.5439017570534282, 'grm_norm': 'none', 'self_loops': True, 'use_snp_selection': True, 'num_snps': 9077}. Best is trial 30 with value: 0.36317670499653026.
[I 2025-12-09 19:11:35,806] Trial 34 finished with value: 0.3474407896600239 and parameters: {'model_type': 'graphsage', 'hidden_dims': '[512, 128]', 'dropout': 0.14445100254371748, 'batch_norm': False, 'sage_aggr': 'max', 'sage_normalize': False, 'sage_project': False, 'lr': 2.2397273732901108e-05, 'weight_decay': 0.00017672334566975952, 'epochs': 133, 'loss': 'mae', 'optimizer': 'adam', 'graph_mode': 'cutoff', 'cutoff': 0.6566506843616295, 'grm_norm': 'none', 'self_loops': True, 'use_snp_selection': True, 'num_snps': 7224}. Best is trial 30 with value: 0.36317670499653026.
[I 2025-12-09 19:11:56,923] Trial 35 finished with value: 0.3673142788824379 and parameters: {'model_type': 'graphsage', 'hidden_dims': '[512, 128]', 'dropout': 0.18060838679074925, 'batch_norm': False, 'sage_aggr': 'max', 'sage_normalize': False, 'sage_project': False, 'lr': 4.4933884771136976e-05, 'weight_decay': 5.20016173100022e-05, 'epochs': 98, 'loss': 'mae', 'optimizer': 'adam', 'graph_mode': 'cutoff', 'cutoff': 0.5532978570685068, 'grm_norm': 'none', 'self_loops': True, 'use_snp_selection': True, 'num_snps': 12479}. Best is trial 35 with value: 0.3673142788824379.
[I 2025-12-09 19:12:06,425] Trial 36 finished with value: 0.3063299996073571 and parameters: {'model_type': 'graphsage', 'hidden_dims': '[512, 128]', 'dropout': 0.18586462299326167, 'batch_norm': True, 'sage_aggr': 'max', 'sage_normalize': False, 'sage_project': False, 'lr': 3.974440792401506e-05, 'weight_decay': 4.111659095889544e-05, 'epochs': 69, 'loss': 'mae', 'optimizer': 'adam', 'graph_mode': 'cutoff', 'cutoff': 0.7784256113737162, 'grm_norm': 'none', 'self_loops': True, 'use_snp_selection': True, 'num_snps': 2041}. Best is trial 35 with value: 0.3673142788824379.
[I 2025-12-09 19:12:58,232] Trial 37 finished with value: 0.35941379820978075 and parameters: {'model_type': 'graphsage', 'hidden_dims': '[512, 128]', 'dropout': 0.22058254248435832, 'batch_norm': False, 'sage_aggr': 'max', 'sage_normalize': False, 'sage_project': False, 'lr': 1.770265079482936e-05, 'weight_decay': 2.013794063804537e-05, 'epochs': 91, 'loss': 'mae', 'optimizer': 'adam', 'graph_mode': 'cutoff', 'cutoff': 0.6303054701553905, 'grm_norm': 'none', 'self_loops': True, 'use_snp_selection': False}. Best is trial 35 with value: 0.3673142788824379.
[I 2025-12-09 19:13:15,350] Trial 38 finished with value: 0.3005101333235157 and parameters: {'model_type': 'graphsage', 'hidden_dims': '[256, 128, 64]', 'dropout': 0.14379980786819951, 'batch_norm': True, 'sage_aggr': 'mean', 'sage_normalize': True, 'sage_project': False, 'lr': 1.2073302039965466e-05, 'weight_decay': 1.573807272847972e-07, 'epochs': 40, 'loss': 'mae', 'optimizer': 'adam', 'graph_mode': 'cutoff', 'cutoff': 0.43641983401418194, 'grm_norm': 'cosine', 'self_loops': True, 'use_snp_selection': True, 'num_snps': 20388}. Best is trial 35 with value: 0.3673142788824379.
[I 2025-12-09 19:13:37,380] Trial 39 finished with value: 0.35694586481651946 and parameters: {'model_type': 'graphsage', 'hidden_dims': '[512, 128]', 'dropout': 0.23526910442340399, 'batch_norm': False, 'sage_aggr': 'max', 'sage_normalize': False, 'sage_project': False, 'lr': 0.0005035306690612161, 'weight_decay': 6.084116419327077e-06, 'epochs': 105, 'loss': 'mae', 'optimizer': 'adam', 'graph_mode': 'cutoff', 'cutoff': 0.5647707173581349, 'grm_norm': 'cosine_then_gcn', 'self_loops': True, 'use_snp_selection': True, 'num_snps': 13066}. Best is trial 35 with value: 0.3673142788824379.
[I 2025-12-09 19:15:50,106] Trial 40 finished with value: 0.3533698536825177 and parameters: {'model_type': 'graphsage', 'hidden_dims': '[512, 64]', 'dropout': 0.2810251350122717, 'batch_norm': True, 'sage_aggr': 'max', 'sage_normalize': False, 'sage_project': False, 'lr': 4.860741185203661e-05, 'weight_decay': 0.00020972727995630173, 'epochs': 198, 'loss': 'mae', 'optimizer': 'adam', 'graph_mode': 'cutoff', 'cutoff': 0.4677232093725511, 'grm_norm': 'none', 'self_loops': True, 'use_snp_selection': False}. Best is trial 35 with value: 0.3673142788824379.
[I 2025-12-09 19:16:42,174] Trial 41 finished with value: 0.36786257776117914 and parameters: {'model_type': 'graphsage', 'hidden_dims': '[512, 128]', 'dropout': 0.20023029118304295, 'batch_norm': False, 'sage_aggr': 'max', 'sage_normalize': False, 'sage_project': False, 'lr': 1.4160444067682223e-05, 'weight_decay': 1.8889264331540683e-05, 'epochs': 91, 'loss': 'mae', 'optimizer': 'adam', 'graph_mode': 'cutoff', 'cutoff': 0.6353438401060265, 'grm_norm': 'none', 'self_loops': True, 'use_snp_selection': False}. Best is trial 41 with value: 0.36786257776117914.
[I 2025-12-09 19:17:18,174] Trial 42 finished with value: 0.341602446649215 and parameters: {'model_type': 'graphsage', 'hidden_dims': '[512, 128]', 'dropout': 0.1839439052397611, 'batch_norm': False, 'sage_aggr': 'max', 'sage_normalize': False, 'sage_project': False, 'lr': 1.6435692162660427e-05, 'weight_decay': 5.211404560352291e-05, 'epochs': 61, 'loss': 'mae', 'optimizer': 'adam', 'graph_mode': 'cutoff', 'cutoff': 0.6578679021814535, 'grm_norm': 'none', 'self_loops': True, 'use_snp_selection': False}. Best is trial 41 with value: 0.36786257776117914.
[I 2025-12-09 19:18:05,802] Trial 43 finished with value: 0.3514710274122105 and parameters: {'model_type': 'graphsage', 'hidden_dims': '[512, 128]', 'dropout': 0.15578616043324361, 'batch_norm': False, 'sage_aggr': 'max', 'sage_normalize': False, 'sage_project': False, 'lr': 2.737821862688101e-05, 'weight_decay': 8.180564911712828e-06, 'epochs': 81, 'loss': 'mae', 'optimizer': 'adam', 'graph_mode': 'cutoff', 'cutoff': 0.5881186479781777, 'grm_norm': 'none', 'self_loops': True, 'use_snp_selection': False}. Best is trial 41 with value: 0.36786257776117914.
[I 2025-12-09 19:19:09,344] Trial 44 finished with value: 0.36404183800549045 and parameters: {'model_type': 'graphsage', 'hidden_dims': '[512, 128]', 'dropout': 0.200211894716096, 'batch_norm': False, 'sage_aggr': 'mean', 'sage_normalize': False, 'sage_project': False, 'lr': 1.4728651025836424e-05, 'weight_decay': 2.1528882537399048e-05, 'epochs': 107, 'loss': 'mae', 'optimizer': 'adam', 'graph_mode': 'cutoff', 'cutoff': 0.5341787455614336, 'grm_norm': 'none', 'self_loops': True, 'use_snp_selection': False}. Best is trial 41 with value: 0.36786257776117914.
[I 2025-12-09 19:20:03,681] Trial 45 finished with value: 0.3422939476982944 and parameters: {'model_type': 'graphsage', 'hidden_dims': '[512, 128]', 'dropout': 0.19667992258105638, 'batch_norm': False, 'sage_aggr': 'mean', 'sage_normalize': True, 'sage_project': False, 'lr': 1.595015740085369e-05, 'weight_decay': 2.223685571515559e-05, 'epochs': 95, 'loss': 'mae', 'optimizer': 'adam', 'graph_mode': 'cutoff', 'cutoff': 0.6084045189116986, 'grm_norm': 'none', 'self_loops': True, 'use_snp_selection': False}. Best is trial 41 with value: 0.36786257776117914.
[I 2025-12-09 19:20:15,737] Trial 46 finished with value: 0.34196298930785846 and parameters: {'model_type': 'graphsage', 'hidden_dims': '[128, 64]', 'dropout': 0.1599956419545473, 'batch_norm': False, 'sage_aggr': 'mean', 'sage_normalize': False, 'sage_project': False, 'lr': 3.171639428848139e-05, 'weight_decay': 2.3964685738862727e-06, 'epochs': 57, 'loss': 'mae', 'optimizer': 'adam', 'graph_mode': 'cutoff', 'cutoff': 0.7276654864954274, 'grm_norm': 'none', 'self_loops': True, 'use_snp_selection': False}. Best is trial 41 with value: 0.36786257776117914.
[I 2025-12-09 19:23:18,502] Trial 47 finished with value: 0.36251166208364793 and parameters: {'model_type': 'graphsage', 'hidden_dims': '[512, 128]', 'dropout': 0.24607758017879106, 'batch_norm': False, 'sage_aggr': 'mean', 'sage_normalize': False, 'sage_project': False, 'lr': 1.187749903990813e-05, 'weight_decay': 1.2083440043429781e-05, 'epochs': 156, 'loss': 'mae', 'optimizer': 'adam', 'graph_mode': 'knn', 'knn_k': 10, 'weighted_edges': True, 'symmetrize_mode': 'union', 'self_loops': True, 'use_snp_selection': False}. Best is trial 41 with value: 0.36786257776117914.
[I 2025-12-09 19:25:38,718] Trial 48 finished with value: 0.33336032200970867 and parameters: {'model_type': 'graphsage', 'hidden_dims': '[256, 128, 64]', 'dropout': 0.23964259722036188, 'batch_norm': True, 'sage_aggr': 'mean', 'sage_normalize': False, 'sage_project': False, 'lr': 1.2251906795177563e-05, 'weight_decay': 3.8075687546375597e-06, 'epochs': 151, 'loss': 'mse', 'optimizer': 'adam', 'graph_mode': 'knn', 'knn_k': 10, 'weighted_edges': True, 'symmetrize_mode': 'union', 'self_loops': True, 'use_snp_selection': False}. Best is trial 41 with value: 0.36786257776117914.
[I 2025-12-09 19:28:34,239] Trial 49 finished with value: 0.33761532830804014 and parameters: {'model_type': 'graphsage', 'hidden_dims': '[512, 128]', 'dropout': 0.13419243681943063, 'batch_norm': False, 'sage_aggr': 'mean', 'sage_normalize': True, 'sage_project': False, 'lr': 2.090064228591141e-05, 'weight_decay': 1.3351259624705032e-06, 'epochs': 182, 'loss': 'mae', 'optimizer': 'adam', 'graph_mode': 'knn', 'knn_k': 7, 'weighted_edges': True, 'symmetrize_mode': 'union', 'self_loops': True, 'use_snp_selection': False}. Best is trial 41 with value: 0.36786257776117914.
[I 2025-12-09 19:33:43,051] Trial 50 finished with value: 0.3715767468536248 and parameters: {'model_type': 'graphsage', 'hidden_dims': '[256, 128]', 'dropout': 0.2672985655235402, 'batch_norm': False, 'sage_aggr': 'mean', 'sage_normalize': False, 'sage_project': False, 'lr': 1.0097055301319295e-05, 'weight_decay': 9.631527957739614e-06, 'epochs': 344, 'loss': 'mae', 'optimizer': 'adam', 'graph_mode': 'knn', 'knn_k': 10, 'weighted_edges': True, 'symmetrize_mode': 'union', 'self_loops': True, 'use_snp_selection': False}. Best is trial 50 with value: 0.3715767468536248.
[I 2025-12-09 19:38:29,874] Trial 51 finished with value: 0.36615845150257503 and parameters: {'model_type': 'graphsage', 'hidden_dims': '[256, 128]', 'dropout': 0.2581978703832017, 'batch_norm': False, 'sage_aggr': 'mean', 'sage_normalize': False, 'sage_project': False, 'lr': 1.0525172959996621e-05, 'weight_decay': 1.4342129948160933e-05, 'epochs': 319, 'loss': 'mae', 'optimizer': 'adam', 'graph_mode': 'knn', 'knn_k': 10, 'weighted_edges': True, 'symmetrize_mode': 'union', 'self_loops': True, 'use_snp_selection': False}. Best is trial 50 with value: 0.3715767468536248.
[I 2025-12-09 19:42:46,804] Trial 52 finished with value: 0.36659964715662396 and parameters: {'model_type': 'graphsage', 'hidden_dims': '[256, 128]', 'dropout': 0.20601151821233826, 'batch_norm': False, 'sage_aggr': 'mean', 'sage_normalize': False, 'sage_project': False, 'lr': 1.4901249333650272e-05, 'weight_decay': 1.72350882656842e-05, 'epochs': 338, 'loss': 'mae', 'optimizer': 'adam', 'graph_mode': 'knn', 'knn_k': 8, 'weighted_edges': True, 'symmetrize_mode': 'union', 'self_loops': True, 'use_snp_selection': False}. Best is trial 50 with value: 0.3715767468536248.
[I 2025-12-09 19:47:11,267] Trial 53 finished with value: 0.36750747319545635 and parameters: {'model_type': 'graphsage', 'hidden_dims': '[256, 128]', 'dropout': 0.2659997894285147, 'batch_norm': False, 'sage_aggr': 'mean', 'sage_normalize': False, 'sage_project': False, 'lr': 1.0217891951739521e-05, 'weight_decay': 8.451821100322874e-06, 'epochs': 348, 'loss': 'mae', 'optimizer': 'adam', 'graph_mode': 'knn', 'knn_k': 8, 'weighted_edges': True, 'symmetrize_mode': 'union', 'self_loops': True, 'use_snp_selection': False}. Best is trial 50 with value: 0.3715767468536248.
[I 2025-12-09 19:51:37,161] Trial 54 finished with value: 0.3638726347504372 and parameters: {'model_type': 'graphsage', 'hidden_dims': '[256, 128]', 'dropout': 0.3198160803517644, 'batch_norm': False, 'sage_aggr': 'mean', 'sage_normalize': False, 'sage_project': False, 'lr': 1.0052486127809551e-05, 'weight_decay': 8.678405066030423e-06, 'epochs': 350, 'loss': 'mse', 'optimizer': 'adam', 'graph_mode': 'knn', 'knn_k': 8, 'weighted_edges': True, 'symmetrize_mode': 'union', 'self_loops': True, 'use_snp_selection': False}. Best is trial 50 with value: 0.3715767468536248.
[I 2025-12-09 19:56:24,670] Trial 55 finished with value: 0.3703432047477474 and parameters: {'model_type': 'graphsage', 'hidden_dims': '[256, 128]', 'dropout': 0.26595350771616516, 'batch_norm': False, 'sage_aggr': 'mean', 'sage_normalize': False, 'sage_project': False, 'lr': 1.997979911210068e-05, 'weight_decay': 4.916549341735629e-06, 'epochs': 347, 'loss': 'mae', 'optimizer': 'adam', 'graph_mode': 'knn', 'knn_k': 9, 'weighted_edges': True, 'symmetrize_mode': 'union', 'self_loops': True, 'use_snp_selection': False}. Best is trial 50 with value: 0.3715767468536248.
[I 2025-12-09 20:00:49,806] Trial 56 finished with value: 0.36260712655488697 and parameters: {'model_type': 'graphsage', 'hidden_dims': '[256, 128]', 'dropout': 0.2723211064761115, 'batch_norm': False, 'sage_aggr': 'mean', 'sage_normalize': False, 'sage_project': False, 'lr': 2.0655394370307377e-05, 'weight_decay': 5.207514348948001e-06, 'epochs': 350, 'loss': 'mae', 'optimizer': 'adam', 'graph_mode': 'knn', 'knn_k': 8, 'weighted_edges': True, 'symmetrize_mode': 'union', 'self_loops': True, 'use_snp_selection': False}. Best is trial 50 with value: 0.3715767468536248.
[I 2025-12-09 20:05:03,649] Trial 57 finished with value: 0.363556526832469 and parameters: {'model_type': 'graphsage', 'hidden_dims': '[256, 128]', 'dropout': 0.22653405263386495, 'batch_norm': False, 'sage_aggr': 'mean', 'sage_normalize': False, 'sage_project': False, 'lr': 3.4464173751897914e-05, 'weight_decay': 3.405211573291815e-06, 'epochs': 335, 'loss': 'mae', 'optimizer': 'adam', 'graph_mode': 'knn', 'knn_k': 8, 'weighted_edges': True, 'symmetrize_mode': 'union', 'self_loops': True, 'use_snp_selection': False}. Best is trial 50 with value: 0.3715767468536248.
[I 2025-12-09 20:08:56,197] Trial 58 finished with value: 0.36804724611708656 and parameters: {'model_type': 'graphsage', 'hidden_dims': '[256, 128]', 'dropout': 0.32328921992656834, 'batch_norm': False, 'sage_aggr': 'mean', 'sage_normalize': False, 'sage_project': False, 'lr': 1.4133138785683197e-05, 'weight_decay': 1.0340359580405855e-06, 'epochs': 280, 'loss': 'mse', 'optimizer': 'adam', 'graph_mode': 'knn', 'knn_k': 9, 'weighted_edges': True, 'symmetrize_mode': 'union', 'self_loops': True, 'use_snp_selection': False}. Best is trial 50 with value: 0.3715767468536248.
[I 2025-12-09 20:12:51,723] Trial 59 finished with value: 0.36804201674409953 and parameters: {'model_type': 'graphsage', 'hidden_dims': '[256, 128]', 'dropout': 0.37070235891203857, 'batch_norm': False, 'sage_aggr': 'mean', 'sage_normalize': False, 'sage_project': False, 'lr': 1.8252827640692143e-05, 'weight_decay': 3.0856876988812654e-07, 'epochs': 283, 'loss': 'mse', 'optimizer': 'adam', 'graph_mode': 'knn', 'knn_k': 9, 'weighted_edges': True, 'symmetrize_mode': 'union', 'self_loops': True, 'use_snp_selection': False}. Best is trial 50 with value: 0.3715767468536248.
[I 2025-12-09 20:16:28,774] Trial 60 finished with value: 0.0 and parameters: {'model_type': 'graphsage', 'hidden_dims': '[256, 128]', 'dropout': 0.3656174629180272, 'batch_norm': False, 'sage_aggr': 'mean', 'sage_normalize': False, 'sage_project': False, 'lr': 0.00718683328353379, 'weight_decay': 2.811891120600848e-07, 'epochs': 278, 'loss': 'mse', 'optimizer': 'adam', 'graph_mode': 'knn', 'knn_k': 9, 'weighted_edges': True, 'symmetrize_mode': 'union', 'self_loops': False, 'use_snp_selection': False}. Best is trial 50 with value: 0.3715767468536248.
[I 2025-12-09 20:20:35,851] Trial 61 finished with value: 0.36760415892989007 and parameters: {'model_type': 'graphsage', 'hidden_dims': '[256, 128]', 'dropout': 0.3425365820580897, 'batch_norm': False, 'sage_aggr': 'mean', 'sage_normalize': False, 'sage_project': False, 'lr': 1.8724834520988855e-05, 'weight_decay': 6.108773988971092e-07, 'epochs': 297, 'loss': 'mse', 'optimizer': 'adam', 'graph_mode': 'knn', 'knn_k': 9, 'weighted_edges': True, 'symmetrize_mode': 'union', 'self_loops': True, 'use_snp_selection': False}. Best is trial 50 with value: 0.3715767468536248.
[I 2025-12-09 20:24:39,727] Trial 62 finished with value: 0.3714509550839805 and parameters: {'model_type': 'graphsage', 'hidden_dims': '[256, 128]', 'dropout': 0.35221137368276006, 'batch_norm': False, 'sage_aggr': 'mean', 'sage_normalize': False, 'sage_project': False, 'lr': 1.8961940928435617e-05, 'weight_decay': 4.1808662901021316e-07, 'epochs': 293, 'loss': 'mse', 'optimizer': 'adam', 'graph_mode': 'knn', 'knn_k': 9, 'weighted_edges': True, 'symmetrize_mode': 'union', 'self_loops': True, 'use_snp_selection': False}. Best is trial 50 with value: 0.3715767468536248.
[I 2025-12-09 20:28:22,306] Trial 63 finished with value: 0.36993581081001237 and parameters: {'model_type': 'graphsage', 'hidden_dims': '[256, 128]', 'dropout': 0.35390263190299176, 'batch_norm': False, 'sage_aggr': 'mean', 'sage_normalize': False, 'sage_project': False, 'lr': 1.8765339670030388e-05, 'weight_decay': 4.030029779461071e-07, 'epochs': 267, 'loss': 'mse', 'optimizer': 'adam', 'graph_mode': 'knn', 'knn_k': 9, 'weighted_edges': True, 'symmetrize_mode': 'union', 'self_loops': True, 'use_snp_selection': False}. Best is trial 50 with value: 0.3715767468536248.
[I 2025-12-09 20:32:10,472] Trial 64 finished with value: 0.3692307829383156 and parameters: {'model_type': 'graphsage', 'hidden_dims': '[256, 128]', 'dropout': 0.3635357492755159, 'batch_norm': False, 'sage_aggr': 'mean', 'sage_normalize': False, 'sage_project': False, 'lr': 1.3862135995121459e-05, 'weight_decay': 5.32269556587782e-07, 'epochs': 252, 'loss': 'mse', 'optimizer': 'adam', 'graph_mode': 'knn', 'knn_k': 10, 'weighted_edges': True, 'symmetrize_mode': 'union', 'self_loops': True, 'use_snp_selection': False}. Best is trial 50 with value: 0.3715767468536248.
[I 2025-12-09 20:36:05,527] Trial 65 finished with value: 0.37245807682020304 and parameters: {'model_type': 'graphsage', 'hidden_dims': '[256, 128]', 'dropout': 0.36277056100815497, 'batch_norm': False, 'sage_aggr': 'mean', 'sage_normalize': False, 'sage_project': False, 'lr': 3.145106816220109e-05, 'weight_decay': 5.315965449505612e-07, 'epochs': 260, 'loss': 'mse', 'optimizer': 'adam', 'graph_mode': 'knn', 'knn_k': 10, 'weighted_edges': True, 'symmetrize_mode': 'union', 'self_loops': True, 'use_snp_selection': False}. Best is trial 65 with value: 0.37245807682020304.
[I 2025-12-09 20:39:55,378] Trial 66 finished with value: 0.37695463223152365 and parameters: {'model_type': 'graphsage', 'hidden_dims': '[256, 128]', 'dropout': 0.3216961378961545, 'batch_norm': False, 'sage_aggr': 'mean', 'sage_normalize': False, 'sage_project': False, 'lr': 0.0001012237869873067, 'weight_decay': 7.810288018918222e-07, 'epochs': 254, 'loss': 'mse', 'optimizer': 'adam', 'graph_mode': 'knn', 'knn_k': 10, 'weighted_edges': True, 'symmetrize_mode': 'union', 'self_loops': True, 'use_snp_selection': False}. Best is trial 66 with value: 0.37695463223152365.
