[I 2025-12-08 17:57:09,035] Trial 113 finished with value: 0.3453657366834981 and parameters: {'model_type': 'graphsage', 'hidden_dims': '[512, 256]', 'dropout': 0.18597198482440414, 'batch_norm': True, 'sage_aggr': 'mean', 'sage_normalize': False, 'sage_project': False, 'lr': 4.439729718244195e-05, 'weight_decay': 7.298642070424839e-06, 'epochs': 326, 'loss': 'mae', 'optimizer': 'adam', 'graph_mode': 'knn', 'knn_k': 10, 'weighted_edges': True, 'symmetrize_mode': 'union', 'self_loops': True, 'use_snp_selection': False}. Best is trial 45 with value: 0.35598525101604295.
[I 2025-12-08 18:03:35,208] Trial 114 finished with value: 0.3560475268590881 and parameters: {'model_type': 'graphsage', 'hidden_dims': '[512, 256]', 'dropout': 0.11494921947052673, 'batch_norm': True, 'sage_aggr': 'mean', 'sage_normalize': False, 'sage_project': False, 'lr': 2.336854945291554e-05, 'weight_decay': 5.746093034701627e-06, 'epochs': 337, 'loss': 'mae', 'optimizer': 'adam', 'graph_mode': 'knn', 'knn_k': 10, 'weighted_edges': True, 'symmetrize_mode': 'union', 'self_loops': True, 'use_snp_selection': False}. Best is trial 114 with value: 0.3560475268590881.
[I 2025-12-08 18:10:06,898] Trial 115 finished with value: 0.35470084873255725 and parameters: {'model_type': 'graphsage', 'hidden_dims': '[512, 256]', 'dropout': 0.11059841472909068, 'batch_norm': True, 'sage_aggr': 'mean', 'sage_normalize': False, 'sage_project': False, 'lr': 2.4065610879979997e-05, 'weight_decay': 1.2732595378357375e-05, 'epochs': 342, 'loss': 'mae', 'optimizer': 'adam', 'graph_mode': 'knn', 'knn_k': 10, 'weighted_edges': True, 'symmetrize_mode': 'union', 'self_loops': True, 'use_snp_selection': False}. Best is trial 114 with value: 0.3560475268590881.
[I 2025-12-08 18:14:59,394] Trial 116 finished with value: 0.32476494791279814 and parameters: {'model_type': 'graphsage', 'hidden_dims': '[512, 256]', 'dropout': 0.11181891333344171, 'batch_norm': True, 'sage_aggr': 'mean', 'sage_normalize': False, 'sage_project': False, 'lr': 1.360905358809093e-05, 'weight_decay': 2.0741932009676975e-05, 'epochs': 350, 'loss': 'mae', 'optimizer': 'adam', 'graph_mode': 'knn', 'knn_k': 10, 'weighted_edges': True, 'symmetrize_mode': 'mutual', 'self_loops': True, 'use_snp_selection': False}. Best is trial 114 with value: 0.3560475268590881.
[I 2025-12-08 18:21:27,088] Trial 117 finished with value: 0.3378751836983744 and parameters: {'model_type': 'graphsage', 'hidden_dims': '[512, 256]', 'dropout': 0.12187076192034745, 'batch_norm': True, 'sage_aggr': 'mean', 'sage_normalize': True, 'sage_project': False, 'lr': 1.725025666250175e-05, 'weight_decay': 3.3926083821076694e-05, 'epochs': 338, 'loss': 'mae', 'optimizer': 'adam', 'graph_mode': 'knn', 'knn_k': 10, 'weighted_edges': True, 'symmetrize_mode': 'union', 'self_loops': True, 'use_snp_selection': False}. Best is trial 114 with value: 0.3560475268590881.
[I 2025-12-08 18:27:27,455] Trial 118 finished with value: 0.35272662433995094 and parameters: {'model_type': 'graphsage', 'hidden_dims': '[512, 256]', 'dropout': 0.10045682416931036, 'batch_norm': True, 'sage_aggr': 'mean', 'sage_normalize': False, 'sage_project': False, 'lr': 2.509508017188915e-05, 'weight_decay': 1.0628607982896626e-05, 'epochs': 314, 'loss': 'mae', 'optimizer': 'adam', 'graph_mode': 'knn', 'knn_k': 10, 'weighted_edges': False, 'symmetrize_mode': 'union', 'self_loops': True, 'use_snp_selection': False}. Best is trial 114 with value: 0.3560475268590881.
[I 2025-12-08 18:30:38,133] Trial 119 finished with value: 0.31824805211369644 and parameters: {'model_type': 'graphsage', 'hidden_dims': '[256, 128, 64]', 'dropout': 0.11445791123849314, 'batch_norm': True, 'sage_aggr': 'mean', 'sage_normalize': False, 'sage_project': False, 'lr': 1.911593960750027e-05, 'weight_decay': 2.843993363098595e-05, 'epochs': 322, 'loss': 'mae', 'optimizer': 'adam', 'graph_mode': 'knn', 'knn_k': 5, 'weighted_edges': True, 'symmetrize_mode': 'union', 'self_loops': True, 'use_snp_selection': False}. Best is trial 114 with value: 0.3560475268590881.
[I 2025-12-08 18:34:25,832] Trial 120 finished with value: 0.3231396945499915 and parameters: {'model_type': 'graphsage', 'hidden_dims': '[512, 256]', 'dropout': 0.13237664184918002, 'batch_norm': True, 'sage_aggr': 'mean', 'sage_normalize': False, 'sage_project': False, 'lr': 3.713591589331686e-05, 'weight_decay': 1.2896808917266402e-05, 'epochs': 294, 'loss': 'mae', 'optimizer': 'adam', 'graph_mode': 'cutoff', 'cutoff': 0.32337221191468213, 'grm_norm': 'none', 'self_loops': True, 'use_snp_selection': False}. Best is trial 114 with value: 0.3560475268590881.
[I 2025-12-08 18:40:59,880] Trial 121 finished with value: 0.3548165718134536 and parameters: {'model_type': 'graphsage', 'hidden_dims': '[512, 256]', 'dropout': 0.14302625329041485, 'batch_norm': True, 'sage_aggr': 'mean', 'sage_normalize': False, 'sage_project': False, 'lr': 2.433865099481836e-05, 'weight_decay': 9.3082366600121e-06, 'epochs': 344, 'loss': 'mae', 'optimizer': 'adam', 'graph_mode': 'knn', 'knn_k': 10, 'weighted_edges': True, 'symmetrize_mode': 'union', 'self_loops': True, 'use_snp_selection': False}. Best is trial 114 with value: 0.3560475268590881.
[I 2025-12-08 18:47:30,975] Trial 122 finished with value: 0.3542521278791728 and parameters: {'model_type': 'graphsage', 'hidden_dims': '[512, 256]', 'dropout': 0.14414230945163048, 'batch_norm': True, 'sage_aggr': 'mean', 'sage_normalize': False, 'sage_project': False, 'lr': 2.3139250092262485e-05, 'weight_decay': 8.990080251967718e-06, 'epochs': 341, 'loss': 'mae', 'optimizer': 'adam', 'graph_mode': 'knn', 'knn_k': 10, 'weighted_edges': True, 'symmetrize_mode': 'union', 'self_loops': True, 'use_snp_selection': False}. Best is trial 114 with value: 0.3560475268590881.
[I 2025-12-08 18:54:04,005] Trial 123 finished with value: 0.35009833269917245 and parameters: {'model_type': 'graphsage', 'hidden_dims': '[512, 256]', 'dropout': 0.14280979567928215, 'batch_norm': True, 'sage_aggr': 'mean', 'sage_normalize': False, 'sage_project': False, 'lr': 2.492686459390716e-05, 'weight_decay': 1.3399458701938275e-05, 'epochs': 343, 'loss': 'mae', 'optimizer': 'adam', 'graph_mode': 'knn', 'knn_k': 10, 'weighted_edges': True, 'symmetrize_mode': 'union', 'self_loops': True, 'use_snp_selection': False}. Best is trial 114 with value: 0.3560475268590881.
[I 2025-12-08 19:00:30,194] Trial 124 finished with value: 0.3544103317251587 and parameters: {'model_type': 'graphsage', 'hidden_dims': '[512, 256]', 'dropout': 0.12571915979996745, 'batch_norm': True, 'sage_aggr': 'mean', 'sage_normalize': False, 'sage_project': False, 'lr': 2.066748768085209e-05, 'weight_decay': 8.622338157116627e-06, 'epochs': 337, 'loss': 'mae', 'optimizer': 'adam', 'graph_mode': 'knn', 'knn_k': 10, 'weighted_edges': True, 'symmetrize_mode': 'union', 'self_loops': True, 'use_snp_selection': False}. Best is trial 114 with value: 0.3560475268590881.
[I 2025-12-08 19:06:54,616] Trial 125 finished with value: 0.35209091278404303 and parameters: {'model_type': 'graphsage', 'hidden_dims': '[512, 256]', 'dropout': 0.12343275907176508, 'batch_norm': True, 'sage_aggr': 'mean', 'sage_normalize': False, 'sage_project': False, 'lr': 2.1536112249603382e-05, 'weight_decay': 8.915170431259097e-06, 'epochs': 336, 'loss': 'mae', 'optimizer': 'adam', 'graph_mode': 'knn', 'knn_k': 10, 'weighted_edges': True, 'symmetrize_mode': 'union', 'self_loops': True, 'use_snp_selection': False}. Best is trial 114 with value: 0.3560475268590881.
[I 2025-12-08 19:13:31,263] Trial 126 finished with value: 0.3512904899862908 and parameters: {'model_type': 'graphsage', 'hidden_dims': '[512, 256]', 'dropout': 0.15477189092210913, 'batch_norm': True, 'sage_aggr': 'mean', 'sage_normalize': False, 'sage_project': False, 'lr': 2.7955372599774303e-05, 'weight_decay': 1.6037908149672853e-05, 'epochs': 346, 'loss': 'mae', 'optimizer': 'adam', 'graph_mode': 'knn', 'knn_k': 10, 'weighted_edges': True, 'symmetrize_mode': 'union', 'self_loops': True, 'use_snp_selection': False}. Best is trial 114 with value: 0.3560475268590881.
[I 2025-12-08 19:19:58,878] Trial 127 finished with value: 0.3332218325150252 and parameters: {'model_type': 'graphsage', 'hidden_dims': '[512, 64]', 'dropout': 0.14452447853884412, 'batch_norm': True, 'sage_aggr': 'mean', 'sage_normalize': False, 'sage_project': False, 'lr': 1.4237152724970877e-05, 'weight_decay': 9.930770178904363e-06, 'epochs': 339, 'loss': 'mae', 'optimizer': 'adam', 'graph_mode': 'knn', 'knn_k': 10, 'weighted_edges': True, 'symmetrize_mode': 'union', 'self_loops': True, 'use_snp_selection': False}. Best is trial 114 with value: 0.3560475268590881.
[I 2025-12-08 19:26:39,620] Trial 128 finished with value: 0.3568899974262999 and parameters: {'model_type': 'graphsage', 'hidden_dims': '[512, 256]', 'dropout': 0.12971394954981355, 'batch_norm': True, 'sage_aggr': 'mean', 'sage_normalize': False, 'sage_project': False, 'lr': 2.3143309683149233e-05, 'weight_decay': 6.7772832239850105e-06, 'epochs': 350, 'loss': 'mae', 'optimizer': 'adam', 'graph_mode': 'knn', 'knn_k': 10, 'weighted_edges': True, 'symmetrize_mode': 'union', 'self_loops': True, 'use_snp_selection': False}. Best is trial 128 with value: 0.3568899974262999.
[I 2025-12-08 19:33:00,928] Trial 129 finished with value: 0.3476491404440913 and parameters: {'model_type': 'graphsage', 'hidden_dims': '[512, 256]', 'dropout': 0.1329076922665126, 'batch_norm': True, 'sage_aggr': 'mean', 'sage_normalize': False, 'sage_project': False, 'lr': 3.400761313751208e-05, 'weight_decay': 7.3296400346349565e-06, 'epochs': 349, 'loss': 'mse', 'optimizer': 'adam', 'graph_mode': 'knn', 'knn_k': 10, 'weighted_edges': True, 'symmetrize_mode': 'union', 'self_loops': False, 'use_snp_selection': False}. Best is trial 128 with value: 0.3568899974262999.
[I 2025-12-08 19:39:22,516] Trial 130 finished with value: 0.35525304853631123 and parameters: {'model_type': 'graphsage', 'hidden_dims': '[512, 256]', 'dropout': 0.1127705526505702, 'batch_norm': True, 'sage_aggr': 'mean', 'sage_normalize': False, 'sage_project': False, 'lr': 2.353381228886012e-05, 'weight_decay': 1.1807560171568342e-05, 'epochs': 333, 'loss': 'mae', 'optimizer': 'adam', 'graph_mode': 'knn', 'knn_k': 10, 'weighted_edges': True, 'symmetrize_mode': 'union', 'self_loops': True, 'use_snp_selection': False}. Best is trial 128 with value: 0.3568899974262999.
[I 2025-12-08 19:45:44,238] Trial 131 finished with value: 0.3515191615544001 and parameters: {'model_type': 'graphsage', 'hidden_dims': '[512, 256]', 'dropout': 0.1097330979003859, 'batch_norm': True, 'sage_aggr': 'mean', 'sage_normalize': False, 'sage_project': False, 'lr': 2.3420057382155715e-05, 'weight_decay': 1.2379031934238555e-05, 'epochs': 333, 'loss': 'mae', 'optimizer': 'adam', 'graph_mode': 'knn', 'knn_k': 10, 'weighted_edges': True, 'symmetrize_mode': 'union', 'self_loops': True, 'use_snp_selection': False}. Best is trial 128 with value: 0.3568899974262999.
[I 2025-12-08 19:52:16,653] Trial 132 finished with value: 0.34811591328984026 and parameters: {'model_type': 'graphsage', 'hidden_dims': '[512, 256]', 'dropout': 0.12098416552031947, 'batch_norm': True, 'sage_aggr': 'mean', 'sage_normalize': False, 'sage_project': False, 'lr': 1.9438251413809428e-05, 'weight_decay': 8.288833628203156e-06, 'epochs': 342, 'loss': 'mae', 'optimizer': 'adam', 'graph_mode': 'knn', 'knn_k': 10, 'weighted_edges': True, 'symmetrize_mode': 'union', 'self_loops': True, 'use_snp_selection': False}. Best is trial 128 with value: 0.3568899974262999.
[I 2025-12-08 19:58:43,160] Trial 133 finished with value: 0.35199554587361404 and parameters: {'model_type': 'graphsage', 'hidden_dims': '[512, 256]', 'dropout': 0.12698936168031627, 'batch_norm': True, 'sage_aggr': 'mean', 'sage_normalize': False, 'sage_project': False, 'lr': 2.943070943860384e-05, 'weight_decay': 5.798232284321697e-06, 'epochs': 337, 'loss': 'mae', 'optimizer': 'adam', 'graph_mode': 'knn', 'knn_k': 10, 'weighted_edges': True, 'symmetrize_mode': 'union', 'self_loops': True, 'use_snp_selection': False}. Best is trial 128 with value: 0.3568899974262999.
[I 2025-12-08 20:05:24,034] Trial 134 finished with value: 0.3576547701841141 and parameters: {'model_type': 'graphsage', 'hidden_dims': '[512, 256]', 'dropout': 0.11270765806217219, 'batch_norm': True, 'sage_aggr': 'mean', 'sage_normalize': False, 'sage_project': False, 'lr': 2.4229211632516793e-05, 'weight_decay': 1.816974607395075e-05, 'epochs': 350, 'loss': 'mae', 'optimizer': 'adam', 'graph_mode': 'knn', 'knn_k': 10, 'weighted_edges': True, 'symmetrize_mode': 'union', 'self_loops': True, 'use_snp_selection': False}. Best is trial 134 with value: 0.3576547701841141.
[I 2025-12-08 20:12:03,855] Trial 135 finished with value: 0.35104845967735065 and parameters: {'model_type': 'graphsage', 'hidden_dims': '[512, 256]', 'dropout': 0.11180443278114617, 'batch_norm': True, 'sage_aggr': 'mean', 'sage_normalize': False, 'sage_project': False, 'lr': 1.8170374943790632e-05, 'weight_decay': 1.903787650527166e-05, 'epochs': 349, 'loss': 'mae', 'optimizer': 'adam', 'graph_mode': 'knn', 'knn_k': 10, 'weighted_edges': True, 'symmetrize_mode': 'union', 'self_loops': True, 'use_snp_selection': False}. Best is trial 134 with value: 0.3576547701841141.
[I 2025-12-08 20:18:37,443] Trial 136 finished with value: 0.3556357141937358 and parameters: {'model_type': 'graphsage', 'hidden_dims': '[512, 256]', 'dropout': 0.1355404716303575, 'batch_norm': True, 'sage_aggr': 'mean', 'sage_normalize': True, 'sage_project': False, 'lr': 2.2821687308628153e-05, 'weight_decay': 4.918169261267697e-05, 'epochs': 343, 'loss': 'mae', 'optimizer': 'adam', 'graph_mode': 'knn', 'knn_k': 10, 'weighted_edges': True, 'symmetrize_mode': 'union', 'self_loops': True, 'use_snp_selection': False}. Best is trial 134 with value: 0.3576547701841141.
[I 2025-12-08 20:23:30,327] Trial 137 finished with value: 0.33398072631879605 and parameters: {'model_type': 'graphsage', 'hidden_dims': '[512, 256]', 'dropout': 0.11625828108686079, 'batch_norm': True, 'sage_aggr': 'mean', 'sage_normalize': True, 'sage_project': False, 'lr': 2.5818560066179813e-05, 'weight_decay': 4.4779599026547305e-05, 'epochs': 350, 'loss': 'mae', 'optimizer': 'adam', 'graph_mode': 'knn', 'knn_k': 10, 'weighted_edges': True, 'symmetrize_mode': 'mutual', 'self_loops': True, 'use_snp_selection': False}. Best is trial 134 with value: 0.3576547701841141.
[I 2025-12-08 20:29:49,282] Trial 138 finished with value: 0.34524444567561735 and parameters: {'model_type': 'graphsage', 'hidden_dims': '[512, 256]', 'dropout': 0.10002428147199291, 'batch_norm': True, 'sage_aggr': 'mean', 'sage_normalize': True, 'sage_project': False, 'lr': 2.1692620279152912e-05, 'weight_decay': 7.183633536632993e-05, 'epochs': 330, 'loss': 'mae', 'optimizer': 'adam', 'graph_mode': 'knn', 'knn_k': 10, 'weighted_edges': True, 'symmetrize_mode': 'union', 'self_loops': True, 'use_snp_selection': False}. Best is trial 134 with value: 0.3576547701841141.
[I 2025-12-08 20:34:20,927] Trial 139 finished with value: 0.3286679703556247 and parameters: {'model_type': 'graphsage', 'hidden_dims': '[128, 64]', 'dropout': 0.13602798447623762, 'batch_norm': True, 'sage_aggr': 'mean', 'sage_normalize': True, 'sage_project': False, 'lr': 4.106311433220343e-05, 'weight_decay': 3.941600602534712e-05, 'epochs': 343, 'loss': 'mae', 'optimizer': 'adam', 'graph_mode': 'knn', 'knn_k': 10, 'weighted_edges': True, 'symmetrize_mode': 'union', 'self_loops': True, 'use_snp_selection': False}. Best is trial 134 with value: 0.3576547701841141.
[I 2025-12-08 20:40:44,957] Trial 140 finished with value: 0.3367028279187636 and parameters: {'model_type': 'graphsage', 'hidden_dims': '[512, 128]', 'dropout': 0.12464548735918252, 'batch_norm': True, 'sage_aggr': 'mean', 'sage_normalize': True, 'sage_project': False, 'lr': 0.0005377417631125195, 'weight_decay': 2.1816308993129666e-05, 'epochs': 335, 'loss': 'mae', 'optimizer': 'adam', 'graph_mode': 'knn', 'knn_k': 10, 'weighted_edges': False, 'symmetrize_mode': 'union', 'self_loops': True, 'use_snp_selection': False}. Best is trial 134 with value: 0.3576547701841141.
[I 2025-12-08 20:47:16,295] Trial 141 finished with value: 0.3487926590052749 and parameters: {'model_type': 'graphsage', 'hidden_dims': '[512, 256]', 'dropout': 0.111404708144487, 'batch_norm': True, 'sage_aggr': 'mean', 'sage_normalize': False, 'sage_project': False, 'lr': 2.312606810578088e-05, 'weight_decay': 9.83261672115619e-05, 'epochs': 342, 'loss': 'mae', 'optimizer': 'adam', 'graph_mode': 'knn', 'knn_k': 10, 'weighted_edges': True, 'symmetrize_mode': 'union', 'self_loops': True, 'use_snp_selection': False}. Best is trial 134 with value: 0.3576547701841141.
[I 2025-12-08 20:53:44,284] Trial 142 finished with value: 0.34017791848570694 and parameters: {'model_type': 'graphsage', 'hidden_dims': '[512, 256]', 'dropout': 0.13777954273588974, 'batch_norm': True, 'sage_aggr': 'mean', 'sage_normalize': True, 'sage_project': False, 'lr': 2.907913659310959e-05, 'weight_decay': 1.4300391251442169e-05, 'epochs': 338, 'loss': 'mae', 'optimizer': 'adam', 'graph_mode': 'knn', 'knn_k': 10, 'weighted_edges': True, 'symmetrize_mode': 'union', 'self_loops': True, 'use_snp_selection': False}. Best is trial 134 with value: 0.3576547701841141.
[I 2025-12-08 21:00:01,547] Trial 143 finished with value: 0.3543043582233857 and parameters: {'model_type': 'graphsage', 'hidden_dims': '[512, 256]', 'dropout': 0.12721370330252169, 'batch_norm': True, 'sage_aggr': 'mean', 'sage_normalize': False, 'sage_project': False, 'lr': 2.064789758124929e-05, 'weight_decay': 7.269693896719299e-06, 'epochs': 329, 'loss': 'mae', 'optimizer': 'adam', 'graph_mode': 'knn', 'knn_k': 10, 'weighted_edges': True, 'symmetrize_mode': 'union', 'self_loops': True, 'use_snp_selection': False}. Best is trial 134 with value: 0.3576547701841141.
[I 2025-12-08 21:06:21,066] Trial 144 finished with value: 0.3499227148366412 and parameters: {'model_type': 'graphsage', 'hidden_dims': '[512, 256]', 'dropout': 0.12475771792520651, 'batch_norm': True, 'sage_aggr': 'mean', 'sage_normalize': False, 'sage_project': False, 'lr': 2.0130647621745397e-05, 'weight_decay': 6.776648105795394e-06, 'epochs': 331, 'loss': 'mae', 'optimizer': 'adam', 'graph_mode': 'knn', 'knn_k': 10, 'weighted_edges': True, 'symmetrize_mode': 'union', 'self_loops': True, 'use_snp_selection': False}. Best is trial 134 with value: 0.3576547701841141.
[I 2025-12-08 21:11:14,583] Trial 145 finished with value: 0.34093333611328014 and parameters: {'model_type': 'graphsage', 'hidden_dims': '[256, 128]', 'dropout': 0.15656477038471783, 'batch_norm': True, 'sage_aggr': 'mean', 'sage_normalize': False, 'sage_project': False, 'lr': 1.633237005518581e-05, 'weight_decay': 9.254742736526957e-06, 'epochs': 326, 'loss': 'mae', 'optimizer': 'adam', 'graph_mode': 'knn', 'knn_k': 10, 'weighted_edges': True, 'symmetrize_mode': 'union', 'self_loops': True, 'use_snp_selection': False}. Best is trial 134 with value: 0.3576547701841141.
[I 2025-12-08 21:17:55,263] Trial 146 finished with value: 0.3570330493667039 and parameters: {'model_type': 'graphsage', 'hidden_dims': '[512, 256]', 'dropout': 0.1109013357911818, 'batch_norm': True, 'sage_aggr': 'mean', 'sage_normalize': False, 'sage_project': False, 'lr': 2.5582302944710357e-05, 'weight_decay': 5.3943429692357496e-05, 'epochs': 350, 'loss': 'mae', 'optimizer': 'adam', 'graph_mode': 'knn', 'knn_k': 10, 'weighted_edges': True, 'symmetrize_mode': 'union', 'self_loops': True, 'use_snp_selection': False}. Best is trial 134 with value: 0.3576547701841141.
[I 2025-12-08 21:18:13,265] Trial 147 finished with value: 0.3246565884117703 and parameters: {'model_type': 'graphsage', 'hidden_dims': '[512, 256]', 'dropout': 0.13151118888231492, 'batch_norm': True, 'sage_aggr': 'mean', 'sage_normalize': True, 'sage_project': False, 'lr': 3.086068864818574e-05, 'weight_decay': 9.31401168170077e-05, 'epochs': 345, 'loss': 'mae', 'optimizer': 'adam', 'graph_mode': 'cutoff', 'cutoff': 0.6727710816511949, 'grm_norm': 'cosine', 'self_loops': True, 'use_snp_selection': True, 'num_snps': 2490}. Best is trial 134 with value: 0.3576547701841141.
[I 2025-12-08 21:24:54,116] Trial 148 finished with value: 0.35339938379885505 and parameters: {'model_type': 'graphsage', 'hidden_dims': '[512, 256]', 'dropout': 0.10764102814797052, 'batch_norm': True, 'sage_aggr': 'mean', 'sage_normalize': False, 'sage_project': False, 'lr': 2.5317396442884056e-05, 'weight_decay': 2.6029075636461857e-05, 'epochs': 350, 'loss': 'mae', 'optimizer': 'adam', 'graph_mode': 'knn', 'knn_k': 10, 'weighted_edges': True, 'symmetrize_mode': 'union', 'self_loops': True, 'use_snp_selection': False}. Best is trial 134 with value: 0.3576547701841141.
[I 2025-12-08 21:32:03,294] Trial 149 finished with value: 0.3564097357669747 and parameters: {'model_type': 'graphsage', 'hidden_dims': '[512, 256]', 'dropout': 0.10059596959593224, 'batch_norm': True, 'sage_aggr': 'max', 'sage_normalize': False, 'sage_project': False, 'lr': 3.639693893459017e-05, 'weight_decay': 1.1477625482634513e-05, 'epochs': 335, 'loss': 'mae', 'optimizer': 'adam', 'graph_mode': 'knn', 'knn_k': 10, 'weighted_edges': True, 'symmetrize_mode': 'union', 'self_loops': True, 'use_snp_selection': False}. Best is trial 134 with value: 0.3576547701841141.
[I 2025-12-08 21:34:45,663] Trial 0 finished with value: 0.32549806123563557 and parameters: {'model_type': 'graphsage', 'hidden_dims': '[128, 64]', 'dropout': 0.199031432379812, 'batch_norm': True, 'sage_aggr': 'max', 'sage_normalize': True, 'sage_project': False, 'lr': 0.00034401453323286885, 'weight_decay': 0.00017802616915745114, 'epochs': 230, 'loss': 'mse', 'optimizer': 'adam', 'graph_mode': 'knn', 'knn_k': 6, 'weighted_edges': True, 'symmetrize_mode': 'mutual', 'self_loops': True, 'use_snp_selection': False}. Best is trial 0 with value: 0.32549806123563557.
