[I 2025-12-06 01:01:38,596] Trial 74 finished with value: 0.2612532528563968 and parameters: {'model_type': 'graphsage', 'hidden_dims': '[128, 64]', 'dropout': 0.12312839767500332, 'batch_norm': True, 'sage_aggr': 'mean', 'sage_normalize': False, 'sage_project': False, 'lr': 0.0001723388259148057, 'weight_decay': 5.049076578449729e-07, 'epochs': 249, 'loss': 'mae', 'optimizer': 'adam', 'graph_mode': 'cutoff', 'cutoff': 0.6081856827385633, 'grm_norm': 'none', 'self_loops': False, 'use_snp_selection': True, 'num_snps': 16744, 'graphsage_batch_size': 16}. Best is trial 73 with value: 0.2633764749247482.
[I 2025-12-06 01:02:00,874] Trial 75 finished with value: 0.2448724873684549 and parameters: {'model_type': 'graphsage', 'hidden_dims': '[128, 64]', 'dropout': 0.12279850079396802, 'batch_norm': True, 'sage_aggr': 'mean', 'sage_normalize': False, 'sage_project': False, 'lr': 0.00018984070230056347, 'weight_decay': 1.1788166679961066e-06, 'epochs': 247, 'loss': 'mae', 'optimizer': 'adam', 'graph_mode': 'cutoff', 'cutoff': 0.6113554371208806, 'grm_norm': 'none', 'self_loops': False, 'use_snp_selection': True, 'num_snps': 10739, 'graphsage_batch_size': 16}. Best is trial 73 with value: 0.2633764749247482.
[I 2025-12-06 01:02:50,126] Trial 76 finished with value: 0.23306976287169817 and parameters: {'model_type': 'graphsage', 'hidden_dims': '[128, 64]', 'dropout': 0.11559911037631133, 'batch_norm': True, 'sage_aggr': 'mean', 'sage_normalize': False, 'sage_project': False, 'lr': 0.00026023988038042915, 'weight_decay': 6.980660107225958e-07, 'epochs': 241, 'loss': 'mae', 'optimizer': 'adam', 'graph_mode': 'cutoff', 'cutoff': 0.5885847687280881, 'grm_norm': 'none', 'self_loops': False, 'use_snp_selection': False, 'graphsage_batch_size': 16}. Best is trial 73 with value: 0.2633764749247482.
[I 2025-12-06 01:03:48,094] Trial 77 finished with value: 0.23878377589262004 and parameters: {'model_type': 'graphsage', 'hidden_dims': '[128, 64]', 'dropout': 0.17356096801794058, 'batch_norm': True, 'sage_aggr': 'max', 'sage_normalize': False, 'sage_project': False, 'lr': 0.0001665991910837928, 'weight_decay': 4.79345645782074e-07, 'epochs': 249, 'loss': 'mae', 'optimizer': 'adam', 'graph_mode': 'knn', 'knn_k': 8, 'weighted_edges': False, 'symmetrize_mode': 'union', 'self_loops': False, 'use_snp_selection': True, 'num_snps': 16161, 'graphsage_batch_size': 16}. Best is trial 73 with value: 0.2633764749247482.
[I 2025-12-06 01:04:12,833] Trial 78 finished with value: 0.23175612764867534 and parameters: {'model_type': 'graphsage', 'hidden_dims': '[128, 64]', 'dropout': 0.19380830194402426, 'batch_norm': True, 'sage_aggr': 'mean', 'sage_normalize': False, 'sage_project': False, 'lr': 9.929534672341891e-05, 'weight_decay': 5.593533712431835e-07, 'epochs': 230, 'loss': 'mae', 'optimizer': 'adam', 'graph_mode': 'cutoff', 'cutoff': 0.5503695519951938, 'grm_norm': 'none', 'self_loops': False, 'use_snp_selection': True, 'num_snps': 13816, 'graphsage_batch_size': 16}. Best is trial 73 with value: 0.2633764749247482.
[I 2025-12-06 01:04:38,027] Trial 79 finished with value: 0.22891210809336612 and parameters: {'model_type': 'graphsage', 'hidden_dims': '[256, 128, 64]', 'dropout': 0.13159780019581782, 'batch_norm': True, 'sage_aggr': 'mean', 'sage_normalize': False, 'sage_project': False, 'lr': 0.00026842941785194395, 'weight_decay': 3.7230971964625553e-06, 'epochs': 207, 'loss': 'mae', 'optimizer': 'adam', 'graph_mode': 'cutoff', 'cutoff': 0.5040406773618847, 'grm_norm': 'none', 'self_loops': False, 'use_snp_selection': True, 'num_snps': 9192, 'graphsage_batch_size': 16}. Best is trial 73 with value: 0.2633764749247482.
[I 2025-12-06 01:05:05,106] Trial 80 finished with value: 0.26326692347047465 and parameters: {'model_type': 'graphsage', 'hidden_dims': '[128, 64]', 'dropout': 0.10697515165260754, 'batch_norm': True, 'sage_aggr': 'mean', 'sage_normalize': False, 'sage_project': False, 'lr': 7.160322244770334e-05, 'weight_decay': 8.723424615865262e-07, 'epochs': 236, 'loss': 'mae', 'optimizer': 'adam', 'graph_mode': 'cutoff', 'cutoff': 0.629180201724817, 'grm_norm': 'none', 'self_loops': False, 'use_snp_selection': True, 'num_snps': 17114, 'graphsage_batch_size': 16}. Best is trial 73 with value: 0.2633764749247482.
[I 2025-12-06 01:05:31,895] Trial 81 finished with value: 0.22152854397974914 and parameters: {'model_type': 'graphsage', 'hidden_dims': '[128, 64]', 'dropout': 0.10082662528985485, 'batch_norm': True, 'sage_aggr': 'mean', 'sage_normalize': False, 'sage_project': False, 'lr': 2.272569569477535e-05, 'weight_decay': 7.963654651746611e-07, 'epochs': 238, 'loss': 'mae', 'optimizer': 'adam', 'graph_mode': 'cutoff', 'cutoff': 0.6190845277064401, 'grm_norm': 'none', 'self_loops': False, 'use_snp_selection': True, 'num_snps': 16872, 'graphsage_batch_size': 16}. Best is trial 73 with value: 0.2633764749247482.
[I 2025-12-06 01:05:56,199] Trial 82 finished with value: 0.24606626635165565 and parameters: {'model_type': 'graphsage', 'hidden_dims': '[128, 64]', 'dropout': 0.14070239389364395, 'batch_norm': True, 'sage_aggr': 'mean', 'sage_normalize': False, 'sage_project': False, 'lr': 6.983211091342836e-05, 'weight_decay': 3.502306326751051e-07, 'epochs': 219, 'loss': 'mae', 'optimizer': 'adam', 'graph_mode': 'cutoff', 'cutoff': 0.649613498498546, 'grm_norm': 'none', 'self_loops': False, 'use_snp_selection': True, 'num_snps': 14831, 'graphsage_batch_size': 16}. Best is trial 73 with value: 0.2633764749247482.
[I 2025-12-06 01:06:27,428] Trial 83 finished with value: 0.24746015083702294 and parameters: {'model_type': 'graphsage', 'hidden_dims': '[128, 64]', 'dropout': 0.12473012541647496, 'batch_norm': True, 'sage_aggr': 'mean', 'sage_normalize': False, 'sage_project': False, 'lr': 0.00010391058387225733, 'weight_decay': 1.0271600895465358e-06, 'epochs': 250, 'loss': 'mae', 'optimizer': 'adam', 'graph_mode': 'cutoff', 'cutoff': 0.5658349292512307, 'grm_norm': 'none', 'self_loops': False, 'use_snp_selection': True, 'num_snps': 20556, 'graphsage_batch_size': 16}. Best is trial 73 with value: 0.2633764749247482.
[I 2025-12-06 01:06:54,602] Trial 84 finished with value: 0.243525930985628 and parameters: {'model_type': 'graphsage', 'hidden_dims': '[128, 64]', 'dropout': 0.11532928441368848, 'batch_norm': True, 'sage_aggr': 'mean', 'sage_normalize': False, 'sage_project': False, 'lr': 5.130499935319992e-05, 'weight_decay': 4.897085700030004e-07, 'epochs': 233, 'loss': 'mae', 'optimizer': 'adam', 'graph_mode': 'cutoff', 'cutoff': 0.6867739423796697, 'grm_norm': 'cosine', 'self_loops': False, 'use_snp_selection': True, 'num_snps': 17264, 'graphsage_batch_size': 16}. Best is trial 73 with value: 0.2633764749247482.
[I 2025-12-06 01:07:27,102] Trial 85 finished with value: 0.25492712633201636 and parameters: {'model_type': 'graphsage', 'hidden_dims': '[128, 64]', 'dropout': 0.16834603818854987, 'batch_norm': True, 'sage_aggr': 'mean', 'sage_normalize': False, 'sage_project': False, 'lr': 0.00016436822117726912, 'weight_decay': 1.3112154191679143e-06, 'epochs': 242, 'loss': 'mae', 'optimizer': 'adam', 'graph_mode': 'cutoff', 'cutoff': 0.7021117477253181, 'grm_norm': 'none', 'self_loops': False, 'use_snp_selection': True, 'num_snps': 24494, 'graphsage_batch_size': 512}. Best is trial 73 with value: 0.2633764749247482.
[I 2025-12-06 01:08:03,221] Trial 86 finished with value: 0.2371015778739421 and parameters: {'model_type': 'graphsage', 'hidden_dims': '[512, 64]', 'dropout': 0.10063500111237861, 'batch_norm': False, 'sage_aggr': 'mean', 'sage_normalize': False, 'sage_project': False, 'lr': 0.00011789613625847327, 'weight_decay': 1.762486591003985e-06, 'epochs': 211, 'loss': 'mse', 'optimizer': 'adam', 'graph_mode': 'cutoff', 'cutoff': 0.6259476758143252, 'grm_norm': 'none', 'self_loops': False, 'use_snp_selection': True, 'num_snps': 12673, 'graphsage_batch_size': 16}. Best is trial 73 with value: 0.2633764749247482.
[I 2025-12-06 01:08:42,785] Trial 87 finished with value: 0.24961966673166464 and parameters: {'model_type': 'graphsage', 'hidden_dims': '[256, 128]', 'dropout': 0.14077698811296313, 'batch_norm': True, 'sage_aggr': 'mean', 'sage_normalize': False, 'sage_project': False, 'lr': 7.658105558129352e-05, 'weight_decay': 2.0542611101268594e-07, 'epochs': 229, 'loss': 'mae', 'optimizer': 'adam', 'graph_mode': 'cutoff', 'cutoff': 0.6712744287185067, 'grm_norm': 'cosine_then_gcn', 'self_loops': False, 'use_snp_selection': True, 'num_snps': 22186, 'graphsage_batch_size': 128}. Best is trial 73 with value: 0.2633764749247482.
[I 2025-12-06 01:09:15,314] Trial 88 finished with value: 0.22694016868279393 and parameters: {'model_type': 'graphsage', 'hidden_dims': '[128, 64]', 'dropout': 0.1792696915610928, 'batch_norm': True, 'sage_aggr': 'max', 'sage_normalize': True, 'sage_project': False, 'lr': 0.000183109250012491, 'weight_decay': 6.884403095587136e-07, 'epochs': 244, 'loss': 'mae', 'optimizer': 'adam', 'graph_mode': 'cutoff', 'cutoff': 0.5249656906794582, 'grm_norm': 'none', 'self_loops': False, 'use_snp_selection': True, 'num_snps': 18982, 'graphsage_batch_size': 16}. Best is trial 73 with value: 0.2633764749247482.
[I 2025-12-06 01:09:54,917] Trial 89 finished with value: 0.14446705644931618 and parameters: {'model_type': 'graphsage', 'hidden_dims': '[128, 64]', 'dropout': 0.1125709874423376, 'batch_norm': True, 'sage_aggr': 'mean', 'sage_normalize': False, 'sage_project': False, 'lr': 3.136233623410072e-06, 'weight_decay': 3.329678448953013e-07, 'epochs': 106, 'loss': 'mae', 'optimizer': 'adam', 'graph_mode': 'knn', 'knn_k': 2, 'weighted_edges': True, 'symmetrize_mode': 'mutual', 'self_loops': False, 'use_snp_selection': True, 'num_snps': 53909, 'graphsage_batch_size': 256}. Best is trial 73 with value: 0.2633764749247482.
[I 2025-12-06 01:10:39,578] Trial 90 finished with value: 0.23461117892847455 and parameters: {'model_type': 'graphsage', 'hidden_dims': '[128, 64]', 'dropout': 0.1277668788951414, 'batch_norm': True, 'sage_aggr': 'mean', 'sage_normalize': False, 'sage_project': False, 'lr': 0.0002459077275851889, 'weight_decay': 8.963378459680589e-06, 'epochs': 218, 'loss': 'mae', 'optimizer': 'adam', 'graph_mode': 'cutoff', 'cutoff': 0.6010590293107334, 'grm_norm': 'none', 'self_loops': False, 'use_snp_selection': False, 'graphsage_batch_size': 8}. Best is trial 73 with value: 0.2633764749247482.
[I 2025-12-06 01:11:23,959] Trial 91 finished with value: 0.24802133304266696 and parameters: {'model_type': 'graphsage', 'hidden_dims': '[512, 128]', 'dropout': 0.1554058981096768, 'batch_norm': True, 'sage_aggr': 'mean', 'sage_normalize': False, 'sage_project': False, 'lr': 0.00013135851229822225, 'weight_decay': 1.899908472916492e-07, 'epochs': 236, 'loss': 'mae', 'optimizer': 'adam', 'graph_mode': 'cutoff', 'cutoff': 0.6609605363996167, 'grm_norm': 'none', 'self_loops': False, 'use_snp_selection': True, 'num_snps': 15468, 'graphsage_batch_size': 16}. Best is trial 73 with value: 0.2633764749247482.
[I 2025-12-06 01:12:12,441] Trial 92 finished with value: 0.24128028649390942 and parameters: {'model_type': 'graphsage', 'hidden_dims': '[512, 256]', 'dropout': 0.15531780647136084, 'batch_norm': True, 'sage_aggr': 'mean', 'sage_normalize': False, 'sage_project': False, 'lr': 9.591855009844252e-05, 'weight_decay': 5.6090651587320815e-05, 'epochs': 225, 'loss': 'mae', 'optimizer': 'adam', 'graph_mode': 'cutoff', 'cutoff': 0.5726113439830401, 'grm_norm': 'none', 'self_loops': False, 'use_snp_selection': True, 'num_snps': 17559, 'graphsage_batch_size': 16}. Best is trial 73 with value: 0.2633764749247482.
[I 2025-12-06 01:13:00,647] Trial 93 finished with value: 0.23914233030623322 and parameters: {'model_type': 'graphsage', 'hidden_dims': '[128, 64]', 'dropout': 0.14820133522852916, 'batch_norm': True, 'sage_aggr': 'mean', 'sage_normalize': False, 'sage_project': False, 'lr': 0.00028409375190661425, 'weight_decay': 2.609074614128159e-07, 'epochs': 236, 'loss': 'mae', 'optimizer': 'adam', 'graph_mode': 'cutoff', 'cutoff': 0.6459740188948481, 'grm_norm': 'none', 'self_loops': False, 'use_snp_selection': True, 'num_snps': 42136, 'graphsage_batch_size': 16}. Best is trial 73 with value: 0.2633764749247482.
[I 2025-12-06 01:13:38,567] Trial 94 finished with value: 0.25111735128562435 and parameters: {'model_type': 'graphsage', 'hidden_dims': '[256, 128, 64]', 'dropout': 0.1961967133815007, 'batch_norm': True, 'sage_aggr': 'mean', 'sage_normalize': False, 'sage_project': False, 'lr': 0.0001555110676321734, 'weight_decay': 4.2544100710178867e-07, 'epochs': 220, 'loss': 'mae', 'optimizer': 'adam', 'graph_mode': 'cutoff', 'cutoff': 0.7217503594303245, 'grm_norm': 'none', 'self_loops': False, 'use_snp_selection': True, 'num_snps': 20773, 'graphsage_batch_size': 16}. Best is trial 73 with value: 0.2633764749247482.
[I 2025-12-06 01:14:15,328] Trial 95 finished with value: 0.2361186518828154 and parameters: {'model_type': 'graphsage', 'hidden_dims': '[128, 64]', 'dropout': 0.14267661734739578, 'batch_norm': True, 'sage_aggr': 'mean', 'sage_normalize': False, 'sage_project': False, 'lr': 5.9621081564405977e-05, 'weight_decay': 1.2718733958619466e-07, 'epochs': 212, 'loss': 'mae', 'optimizer': 'adam', 'graph_mode': 'cutoff', 'cutoff': 0.6931097622841182, 'grm_norm': 'none', 'self_loops': False, 'use_snp_selection': True, 'num_snps': 32521, 'graphsage_batch_size': 64}. Best is trial 73 with value: 0.2633764749247482.
[I 2025-12-06 01:14:36,936] Trial 96 finished with value: 0.25062187317162526 and parameters: {'model_type': 'graphsage', 'hidden_dims': '[128, 64]', 'dropout': 0.11101356839902649, 'batch_norm': True, 'sage_aggr': 'mean', 'sage_normalize': False, 'sage_project': False, 'lr': 0.00021670690893671669, 'weight_decay': 2.8361120937211865e-07, 'epochs': 204, 'loss': 'mae', 'optimizer': 'adam', 'graph_mode': 'cutoff', 'cutoff': 0.6689630033343659, 'grm_norm': 'cosine', 'self_loops': False, 'use_snp_selection': True, 'num_snps': 11921, 'graphsage_batch_size': 16}. Best is trial 73 with value: 0.2633764749247482.
[I 2025-12-06 01:14:52,960] Trial 97 finished with value: 0.23797104887255288 and parameters: {'model_type': 'graphsage', 'hidden_dims': '[128, 64]', 'dropout': 0.1677611503073406, 'batch_norm': True, 'sage_aggr': 'mean', 'sage_normalize': False, 'sage_project': False, 'lr': 0.0003966687709305893, 'weight_decay': 5.457177948185211e-07, 'epochs': 42, 'loss': 'mae', 'optimizer': 'adam', 'graph_mode': 'cutoff', 'cutoff': 0.744107998195309, 'grm_norm': 'none', 'self_loops': False, 'use_snp_selection': True, 'num_snps': 13972, 'graphsage_batch_size': 512}. Best is trial 73 with value: 0.2633764749247482.
[I 2025-12-06 01:15:45,068] Trial 98 finished with value: 0.25334740348745155 and parameters: {'model_type': 'graphsage', 'hidden_dims': '[512, 256]', 'dropout': 0.13002319589661598, 'batch_norm': True, 'sage_aggr': 'mean', 'sage_normalize': False, 'sage_project': False, 'lr': 0.0001196980005319208, 'weight_decay': 9.440995909850208e-07, 'epochs': 245, 'loss': 'mse', 'optimizer': 'adam', 'graph_mode': 'cutoff', 'cutoff': 0.6279369825797443, 'grm_norm': 'none', 'self_loops': False, 'use_snp_selection': True, 'num_snps': 18292, 'graphsage_batch_size': 16}. Best is trial 73 with value: 0.2633764749247482.
[I 2025-12-06 01:16:08,202] Trial 99 finished with value: 0.25602678004531376 and parameters: {'model_type': 'graphsage', 'hidden_dims': '[128, 64]', 'dropout': 0.18499549942258597, 'batch_norm': False, 'sage_aggr': 'mean', 'sage_normalize': False, 'sage_project': False, 'lr': 0.0001482054955774776, 'weight_decay': 3.7050342425162614e-07, 'epochs': 123, 'loss': 'mae', 'optimizer': 'adam', 'graph_mode': 'cutoff', 'cutoff': 0.7080460833143946, 'grm_norm': 'none', 'self_loops': False, 'use_snp_selection': True, 'num_snps': 22060, 'graphsage_batch_size': 128}. Best is trial 73 with value: 0.2633764749247482.
[I 2025-12-06 01:16:31,532] Trial 100 finished with value: 0.2511765461609286 and parameters: {'model_type': 'graphsage', 'hidden_dims': '[128, 64]', 'dropout': 0.21787089257910808, 'batch_norm': False, 'sage_aggr': 'mean', 'sage_normalize': False, 'sage_project': False, 'lr': 3.891600775777396e-05, 'weight_decay': 3.9618790783587094e-07, 'epochs': 120, 'loss': 'mae', 'optimizer': 'adam', 'graph_mode': 'cutoff', 'cutoff': 0.7115021999702382, 'grm_norm': 'cosine_then_gcn', 'self_loops': False, 'use_snp_selection': True, 'num_snps': 22416, 'graphsage_batch_size': 128}. Best is trial 73 with value: 0.2633764749247482.
[I 2025-12-06 01:16:57,743] Trial 101 finished with value: 0.25117450840450223 and parameters: {'model_type': 'graphsage', 'hidden_dims': '[128, 64]', 'dropout': 0.18669632747503423, 'batch_norm': False, 'sage_aggr': 'mean', 'sage_normalize': False, 'sage_project': False, 'lr': 0.00014798891081683677, 'weight_decay': 1.8289587970940133e-07, 'epochs': 148, 'loss': 'mae', 'optimizer': 'adam', 'graph_mode': 'cutoff', 'cutoff': 0.7641941885019895, 'grm_norm': 'none', 'self_loops': False, 'use_snp_selection': True, 'num_snps': 25232, 'graphsage_batch_size': 128}. Best is trial 73 with value: 0.2633764749247482.
[I 2025-12-06 01:17:22,934] Trial 102 finished with value: 0.2557211648498671 and parameters: {'model_type': 'graphsage', 'hidden_dims': '[128, 64]', 'dropout': 0.16115529717900298, 'batch_norm': False, 'sage_aggr': 'mean', 'sage_normalize': False, 'sage_project': False, 'lr': 0.00018616290294889995, 'weight_decay': 3.1825844579270104e-07, 'epochs': 109, 'loss': 'mae', 'optimizer': 'adam', 'graph_mode': 'cutoff', 'cutoff': 0.6562361435021544, 'grm_norm': 'none', 'self_loops': False, 'use_snp_selection': True, 'num_snps': 28031, 'graphsage_batch_size': 128}. Best is trial 73 with value: 0.2633764749247482.
[I 2025-12-06 01:17:44,289] Trial 103 finished with value: 0.25655569833449277 and parameters: {'model_type': 'graphsage', 'hidden_dims': '[128, 64]', 'dropout': 0.1630290464420024, 'batch_norm': False, 'sage_aggr': 'mean', 'sage_normalize': False, 'sage_project': False, 'lr': 0.00018592208213747866, 'weight_decay': 3.1712706518983885e-07, 'epochs': 110, 'loss': 'mae', 'optimizer': 'adam', 'graph_mode': 'cutoff', 'cutoff': 0.6901272138236922, 'grm_norm': 'none', 'self_loops': False, 'use_snp_selection': True, 'num_snps': 19459, 'graphsage_batch_size': 128}. Best is trial 73 with value: 0.2633764749247482.
[I 2025-12-06 01:18:07,338] Trial 104 finished with value: 0.24438560456702443 and parameters: {'model_type': 'graphsage', 'hidden_dims': '[128, 64]', 'dropout': 0.12126300495482935, 'batch_norm': False, 'sage_aggr': 'mean', 'sage_normalize': False, 'sage_project': False, 'lr': 0.00023449338108279323, 'weight_decay': 5.047884232379907e-07, 'epochs': 98, 'loss': 'mae', 'optimizer': 'adam', 'graph_mode': 'cutoff', 'cutoff': 0.7410219597847603, 'grm_norm': 'none', 'self_loops': False, 'use_snp_selection': True, 'num_snps': 20071, 'graphsage_batch_size': 128}. Best is trial 73 with value: 0.2633764749247482.
[I 2025-12-06 01:18:28,195] Trial 105 finished with value: 0.24736877285544337 and parameters: {'model_type': 'graphsage', 'hidden_dims': '[128, 64]', 'dropout': 0.20779999749815087, 'batch_norm': False, 'sage_aggr': 'mean', 'sage_normalize': False, 'sage_project': False, 'lr': 0.0003015568624319548, 'weight_decay': 2.5151839423817133e-07, 'epochs': 129, 'loss': 'mae', 'optimizer': 'adam', 'graph_mode': 'cutoff', 'cutoff': 0.6963309826998271, 'grm_norm': 'gcn', 'self_loops': False, 'use_snp_selection': True, 'num_snps': 16516, 'graphsage_batch_size': 128}. Best is trial 73 with value: 0.2633764749247482.
[I 2025-12-06 01:19:09,883] Trial 106 finished with value: 0.20363642457800274 and parameters: {'model_type': 'graphsage', 'hidden_dims': '[128, 64]', 'dropout': 0.237539791616656, 'batch_norm': False, 'sage_aggr': 'mean', 'sage_normalize': True, 'sage_project': False, 'lr': 9.51448279005426e-05, 'weight_decay': 7.785445600281478e-07, 'epochs': 116, 'loss': 'mae', 'optimizer': 'adam', 'graph_mode': 'cutoff', 'cutoff': 0.20261366095615918, 'grm_norm': 'none', 'self_loops': False, 'use_snp_selection': True, 'num_snps': 18209, 'graphsage_batch_size': 128}. Best is trial 73 with value: 0.2633764749247482.
[I 2025-12-06 01:19:42,944] Trial 107 finished with value: 0.19630436401772008 and parameters: {'model_type': 'graphsage', 'hidden_dims': '[128, 64]', 'dropout': 0.139242524317459, 'batch_norm': False, 'sage_aggr': 'max', 'sage_normalize': False, 'sage_project': False, 'lr': 7.138655845153783e-05, 'weight_decay': 6.087538029192082e-07, 'epochs': 98, 'loss': 'mae', 'optimizer': 'adam', 'graph_mode': 'knn', 'knn_k': 5, 'weighted_edges': False, 'symmetrize_mode': 'union', 'self_loops': False, 'use_snp_selection': True, 'num_snps': 22244, 'graphsage_batch_size': 128}. Best is trial 73 with value: 0.2633764749247482.
[I 2025-12-06 01:20:58,485] Trial 108 finished with value: 0.21930303472750518 and parameters: {'model_type': 'graphsage', 'hidden_dims': '[512, 64]', 'dropout': 0.1098908106362537, 'batch_norm': False, 'sage_aggr': 'mean', 'sage_normalize': False, 'sage_project': False, 'lr': 0.0002052952828877646, 'weight_decay': 3.7856532761656875e-07, 'epochs': 134, 'loss': 'mae', 'optimizer': 'adam', 'graph_mode': 'cutoff', 'cutoff': 0.6049963248650524, 'grm_norm': 'none', 'self_loops': False, 'use_snp_selection': False, 'graphsage_batch_size': 32}. Best is trial 73 with value: 0.2633764749247482.
[I 2025-12-06 01:21:18,990] Trial 109 finished with value: 0.24652840128808293 and parameters: {'model_type': 'graphsage', 'hidden_dims': '[128, 64]', 'dropout': 0.16408290883471538, 'batch_norm': False, 'sage_aggr': 'mean', 'sage_normalize': False, 'sage_project': False, 'lr': 0.00038062471951793366, 'weight_decay': 2.1322228694261406e-07, 'epochs': 122, 'loss': 'mae', 'optimizer': 'adam', 'graph_mode': 'cutoff', 'cutoff': 0.7116233542249636, 'grm_norm': 'gcn', 'self_loops': False, 'use_snp_selection': True, 'num_snps': 16625, 'graphsage_batch_size': 8}. Best is trial 73 with value: 0.2633764749247482.
