[I 2025-12-08 13:17:45,164] Trial 41 finished with value: 0.3102924268351178 and parameters: {'model_type': 'graphsage', 'hidden_dims': '[128, 64]', 'dropout': 0.2349369161432621, 'batch_norm': False, 'sage_aggr': 'max', 'sage_normalize': False, 'sage_project': False, 'lr': 1.5663508727206942e-05, 'weight_decay': 2.3697798264603728e-05, 'epochs': 194, 'loss': 'mse', 'optimizer': 'adam', 'graph_mode': 'cutoff', 'cutoff': 0.8390855477759898, 'grm_norm': 'gcn', 'self_loops': True, 'use_snp_selection': False}. Best is trial 37 with value: 0.3126492371427131.
[I 2025-12-08 13:18:45,557] Trial 42 finished with value: 0.3023857824462108 and parameters: {'model_type': 'graphsage', 'hidden_dims': '[256, 128, 64]', 'dropout': 0.3681717713752696, 'batch_norm': False, 'sage_aggr': 'max', 'sage_normalize': False, 'sage_project': False, 'lr': 2.7975674780611716e-05, 'weight_decay': 2.0930351278364178e-07, 'epochs': 238, 'loss': 'mae', 'optimizer': 'adam', 'graph_mode': 'cutoff', 'cutoff': 0.8104540466797983, 'grm_norm': 'gcn', 'self_loops': True, 'use_snp_selection': False}. Best is trial 37 with value: 0.3126492371427131.
[I 2025-12-08 13:19:53,350] Trial 43 finished with value: 0.31269697721548695 and parameters: {'model_type': 'graphsage', 'hidden_dims': '[512, 128]', 'dropout': 0.34499264697509896, 'batch_norm': False, 'sage_aggr': 'max', 'sage_normalize': False, 'sage_project': False, 'lr': 4.633901525625249e-05, 'weight_decay': 4.783047056958271e-05, 'epochs': 146, 'loss': 'mse', 'optimizer': 'adam', 'graph_mode': 'cutoff', 'cutoff': 0.7832897324503906, 'grm_norm': 'none', 'self_loops': True, 'use_snp_selection': False}. Best is trial 43 with value: 0.31269697721548695.
[I 2025-12-08 13:20:42,072] Trial 44 finished with value: 0.2967484336922739 and parameters: {'model_type': 'graphsage', 'hidden_dims': '[512, 128]', 'dropout': 0.3352313095981173, 'batch_norm': False, 'sage_aggr': 'max', 'sage_normalize': False, 'sage_project': False, 'lr': 5.131091697708002e-05, 'weight_decay': 4.6450656086634034e-05, 'epochs': 145, 'loss': 'mse', 'optimizer': 'adam', 'graph_mode': 'cutoff', 'cutoff': 0.5024922761964705, 'grm_norm': 'none', 'self_loops': True, 'use_snp_selection': True, 'num_snps': 16998}. Best is trial 43 with value: 0.31269697721548695.
[I 2025-12-08 13:21:52,818] Trial 45 finished with value: 0.2896613491098915 and parameters: {'model_type': 'graphsage', 'hidden_dims': '[512, 128]', 'dropout': 0.18462016694906347, 'batch_norm': False, 'sage_aggr': 'mean', 'sage_normalize': True, 'sage_project': False, 'lr': 6.893601285213257e-05, 'weight_decay': 0.0001169393423932949, 'epochs': 150, 'loss': 'mse', 'optimizer': 'adam', 'graph_mode': 'cutoff', 'cutoff': 0.7551203985192659, 'grm_norm': 'none', 'self_loops': True, 'use_snp_selection': False}. Best is trial 43 with value: 0.31269697721548695.
[I 2025-12-08 13:23:17,717] Trial 46 finished with value: 0.308783377699435 and parameters: {'model_type': 'graphsage', 'hidden_dims': '[512, 128]', 'dropout': 0.28135641706707326, 'batch_norm': False, 'sage_aggr': 'max', 'sage_normalize': False, 'sage_project': False, 'lr': 4.163487407883085e-05, 'weight_decay': 4.945083257545068e-05, 'epochs': 191, 'loss': 'mse', 'optimizer': 'adam', 'graph_mode': 'cutoff', 'cutoff': 0.8610665560821018, 'grm_norm': 'none', 'self_loops': True, 'use_snp_selection': False}. Best is trial 43 with value: 0.31269697721548695.
[I 2025-12-08 13:24:33,094] Trial 47 finished with value: 0.008883675953887466 and parameters: {'model_type': 'graphsage', 'hidden_dims': '[512, 64]', 'dropout': 0.2519516652348647, 'batch_norm': False, 'sage_aggr': 'max', 'sage_normalize': False, 'sage_project': False, 'lr': 0.0005934081029534971, 'weight_decay': 7.496575620518978e-06, 'epochs': 135, 'loss': 'mse', 'optimizer': 'adam', 'graph_mode': 'cutoff', 'cutoff': 0.6831717953656105, 'grm_norm': 'none', 'self_loops': True, 'use_snp_selection': True, 'num_snps': 41705}. Best is trial 43 with value: 0.31269697721548695.
[I 2025-12-08 13:25:37,393] Trial 48 finished with value: 0.25133157834070846 and parameters: {'model_type': 'graphsage', 'hidden_dims': '[512, 128]', 'dropout': 0.3182835071645368, 'batch_norm': True, 'sage_aggr': 'max', 'sage_normalize': False, 'sage_project': False, 'lr': 1.8842967542742906e-05, 'weight_decay': 1.8449010416685637e-05, 'epochs': 106, 'loss': 'mse', 'optimizer': 'adam', 'graph_mode': 'knn', 'knn_k': 4, 'weighted_edges': True, 'symmetrize_mode': 'mutual', 'self_loops': True, 'use_snp_selection': False}. Best is trial 43 with value: 0.31269697721548695.
[I 2025-12-08 13:27:18,789] Trial 49 finished with value: 0.2847300159265474 and parameters: {'model_type': 'graphsage', 'hidden_dims': '[512, 256]', 'dropout': 0.13192402908113424, 'batch_norm': False, 'sage_aggr': 'mean', 'sage_normalize': True, 'sage_project': False, 'lr': 0.00011082465858867986, 'weight_decay': 3.7438054420494046e-06, 'epochs': 181, 'loss': 'mse', 'optimizer': 'adam', 'graph_mode': 'cutoff', 'cutoff': 0.3128517080935125, 'grm_norm': 'cosine_then_gcn', 'self_loops': True, 'use_snp_selection': False}. Best is trial 43 with value: 0.31269697721548695.
[I 2025-12-08 13:27:41,142] Trial 50 finished with value: 0.30920803749037873 and parameters: {'model_type': 'graphsage', 'hidden_dims': '[128, 64]', 'dropout': 0.3555853528150751, 'batch_norm': False, 'sage_aggr': 'max', 'sage_normalize': False, 'sage_project': False, 'lr': 3.3472728959790744e-05, 'weight_decay': 0.00035195128205718634, 'epochs': 101, 'loss': 'mse', 'optimizer': 'adam', 'graph_mode': 'cutoff', 'cutoff': 0.7584407632544, 'grm_norm': 'none', 'self_loops': True, 'use_snp_selection': False}. Best is trial 43 with value: 0.31269697721548695.
[I 2025-12-08 13:28:24,999] Trial 51 finished with value: 0.3087671035677473 and parameters: {'model_type': 'graphsage', 'hidden_dims': '[128, 64]', 'dropout': 0.3748150550971451, 'batch_norm': False, 'sage_aggr': 'max', 'sage_normalize': False, 'sage_project': False, 'lr': 1.3385021829820866e-05, 'weight_decay': 5.780881696459214e-07, 'epochs': 268, 'loss': 'mae', 'optimizer': 'adam', 'graph_mode': 'cutoff', 'cutoff': 0.7960595746543768, 'grm_norm': 'gcn', 'self_loops': True, 'use_snp_selection': False}. Best is trial 43 with value: 0.31269697721548695.
[I 2025-12-08 13:28:44,734] Trial 52 finished with value: 0.248897141650979 and parameters: {'model_type': 'graphsage', 'hidden_dims': '[256, 128, 64]', 'dropout': 0.47304549243761684, 'batch_norm': False, 'sage_aggr': 'max', 'sage_normalize': False, 'sage_project': False, 'lr': 1.1589373116272381e-05, 'weight_decay': 2.230017477856857e-07, 'epochs': 45, 'loss': 'mae', 'optimizer': 'adam', 'graph_mode': 'cutoff', 'cutoff': 0.8278299074345732, 'grm_norm': 'gcn', 'self_loops': True, 'use_snp_selection': False}. Best is trial 43 with value: 0.31269697721548695.
[I 2025-12-08 13:30:30,426] Trial 53 finished with value: 0.3051064107907653 and parameters: {'model_type': 'graphsage', 'hidden_dims': '[512, 128]', 'dropout': 0.33695455199047636, 'batch_norm': False, 'sage_aggr': 'max', 'sage_normalize': False, 'sage_project': False, 'lr': 1.9995262943316874e-05, 'weight_decay': 3.157363648113643e-05, 'epochs': 243, 'loss': 'mae', 'optimizer': 'adam', 'graph_mode': 'cutoff', 'cutoff': 0.8709787722843464, 'grm_norm': 'cosine', 'self_loops': False, 'use_snp_selection': False}. Best is trial 43 with value: 0.31269697721548695.
[I 2025-12-08 13:32:03,606] Trial 54 finished with value: 0.30129858875169824 and parameters: {'model_type': 'graphsage', 'hidden_dims': '[512, 64]', 'dropout': 0.3029423773831831, 'batch_norm': False, 'sage_aggr': 'max', 'sage_normalize': False, 'sage_project': False, 'lr': 2.8675679731569746e-05, 'weight_decay': 1.0634790807767048e-06, 'epochs': 213, 'loss': 'mse', 'optimizer': 'adam', 'graph_mode': 'cutoff', 'cutoff': 0.7778075955917801, 'grm_norm': 'gcn', 'self_loops': True, 'use_snp_selection': False}. Best is trial 43 with value: 0.31269697721548695.
[I 2025-12-08 13:34:08,596] Trial 55 finished with value: 0.30166147406437577 and parameters: {'model_type': 'graphsage', 'hidden_dims': '[512, 256]', 'dropout': 0.4125334136924802, 'batch_norm': False, 'sage_aggr': 'max', 'sage_normalize': False, 'sage_project': False, 'lr': 4.833468021475433e-05, 'weight_decay': 7.006345965518239e-05, 'epochs': 295, 'loss': 'mae', 'optimizer': 'adam', 'graph_mode': 'cutoff', 'cutoff': 0.733724733715338, 'grm_norm': 'gcn', 'self_loops': False, 'use_snp_selection': False}. Best is trial 43 with value: 0.31269697721548695.
[I 2025-12-08 13:35:57,674] Trial 56 finished with value: 0.0 and parameters: {'model_type': 'graphsage', 'hidden_dims': '[256, 128]', 'dropout': 0.3475644967554399, 'batch_norm': False, 'sage_aggr': 'max', 'sage_normalize': False, 'sage_project': False, 'lr': 0.009233123400397647, 'weight_decay': 2.089722710195229e-05, 'epochs': 273, 'loss': 'mse', 'optimizer': 'adam', 'graph_mode': 'cutoff', 'cutoff': 0.8156425233725627, 'grm_norm': 'gcn', 'self_loops': False, 'use_snp_selection': True, 'num_snps': 59836}. Best is trial 43 with value: 0.31269697721548695.
[I 2025-12-08 13:36:28,690] Trial 57 finished with value: 0.2816183438108499 and parameters: {'model_type': 'graphsage', 'hidden_dims': '[128, 64]', 'dropout': 0.42714395328640387, 'batch_norm': False, 'sage_aggr': 'max', 'sage_normalize': False, 'sage_project': False, 'lr': 7.101772543844304e-05, 'weight_decay': 1.2513776699685066e-05, 'epochs': 159, 'loss': 'mae', 'optimizer': 'adam', 'graph_mode': 'cutoff', 'cutoff': 0.5986388355152237, 'grm_norm': 'none', 'self_loops': False, 'use_snp_selection': False}. Best is trial 43 with value: 0.31269697721548695.
[I 2025-12-08 13:37:31,210] Trial 58 finished with value: 0.30253086725216993 and parameters: {'model_type': 'graphsage', 'hidden_dims': '[256, 128]', 'dropout': 0.3769595436427286, 'batch_norm': False, 'sage_aggr': 'max', 'sage_normalize': False, 'sage_project': False, 'lr': 0.00016503552022184735, 'weight_decay': 8.151156977099148e-06, 'epochs': 245, 'loss': 'mse', 'optimizer': 'adam', 'graph_mode': 'cutoff', 'cutoff': 0.8964307281255649, 'grm_norm': 'cosine_then_gcn', 'self_loops': True, 'use_snp_selection': False}. Best is trial 43 with value: 0.31269697721548695.
[I 2025-12-08 13:38:17,641] Trial 59 finished with value: 0.30758278659542293 and parameters: {'model_type': 'graphsage', 'hidden_dims': '[256, 128]', 'dropout': 0.4942502946957883, 'batch_norm': False, 'sage_aggr': 'mean', 'sage_normalize': False, 'sage_project': False, 'lr': 1.8421864314085613e-05, 'weight_decay': 2.0822254539934503e-06, 'epochs': 171, 'loss': 'mae', 'optimizer': 'adam', 'graph_mode': 'cutoff', 'cutoff': 0.8603809228764542, 'grm_norm': 'gcn', 'self_loops': False, 'use_snp_selection': False}. Best is trial 43 with value: 0.31269697721548695.
[I 2025-12-08 13:38:56,624] Trial 60 finished with value: 0.3031447463399267 and parameters: {'model_type': 'graphsage', 'hidden_dims': '[128, 64]', 'dropout': 0.452975105422951, 'batch_norm': False, 'sage_aggr': 'max', 'sage_normalize': False, 'sage_project': False, 'lr': 1.2901933586800624e-05, 'weight_decay': 4.5981618165345295e-07, 'epochs': 223, 'loss': 'mse', 'optimizer': 'adam', 'graph_mode': 'cutoff', 'cutoff': 0.7101977214155413, 'grm_norm': 'cosine', 'self_loops': False, 'use_snp_selection': False}. Best is trial 43 with value: 0.31269697721548695.
[I 2025-12-08 13:39:30,615] Trial 61 finished with value: 0.3090469046274464 and parameters: {'model_type': 'graphsage', 'hidden_dims': '[128, 64]', 'dropout': 0.2368314560780119, 'batch_norm': False, 'sage_aggr': 'max', 'sage_normalize': False, 'sage_project': False, 'lr': 1.549254285284216e-05, 'weight_decay': 2.4933604166232593e-05, 'epochs': 192, 'loss': 'mse', 'optimizer': 'adam', 'graph_mode': 'cutoff', 'cutoff': 0.8400943916015651, 'grm_norm': 'gcn', 'self_loops': True, 'use_snp_selection': False}. Best is trial 43 with value: 0.31269697721548695.
[I 2025-12-08 13:40:06,565] Trial 62 finished with value: 0.3077529556817695 and parameters: {'model_type': 'graphsage', 'hidden_dims': '[128, 64]', 'dropout': 0.2682971782705128, 'batch_norm': False, 'sage_aggr': 'max', 'sage_normalize': False, 'sage_project': False, 'lr': 2.2779167171758044e-05, 'weight_decay': 6.135118240391715e-06, 'epochs': 207, 'loss': 'mse', 'optimizer': 'adam', 'graph_mode': 'cutoff', 'cutoff': 0.7793181832051587, 'grm_norm': 'gcn', 'self_loops': True, 'use_snp_selection': False}. Best is trial 43 with value: 0.31269697721548695.
[I 2025-12-08 13:40:39,877] Trial 63 finished with value: 0.31310005514374917 and parameters: {'model_type': 'graphsage', 'hidden_dims': '[128, 64]', 'dropout': 0.2372032370033352, 'batch_norm': False, 'sage_aggr': 'max', 'sage_normalize': False, 'sage_project': False, 'lr': 3.259442990780314e-05, 'weight_decay': 2.420208389641235e-05, 'epochs': 187, 'loss': 'mse', 'optimizer': 'adam', 'graph_mode': 'cutoff', 'cutoff': 0.8070201886775732, 'grm_norm': 'gcn', 'self_loops': True, 'use_snp_selection': False}. Best is trial 63 with value: 0.31310005514374917.
[I 2025-12-08 13:41:18,886] Trial 64 finished with value: 0.30594304211840023 and parameters: {'model_type': 'graphsage', 'hidden_dims': '[128, 64]', 'dropout': 0.2891725588808877, 'batch_norm': False, 'sage_aggr': 'max', 'sage_normalize': False, 'sage_project': False, 'lr': 3.2124781774351885e-05, 'weight_decay': 3.4956594574733885e-05, 'epochs': 231, 'loss': 'mse', 'optimizer': 'adam', 'graph_mode': 'cutoff', 'cutoff': 0.8041687683096017, 'grm_norm': 'gcn', 'self_loops': True, 'use_snp_selection': False}. Best is trial 63 with value: 0.31310005514374917.
[I 2025-12-08 13:42:34,482] Trial 65 finished with value: 0.2959833233109436 and parameters: {'model_type': 'graphsage', 'hidden_dims': '[256, 128]', 'dropout': 0.20567803468233004, 'batch_norm': False, 'sage_aggr': 'max', 'sage_normalize': False, 'sage_project': False, 'lr': 8.798397371893544e-05, 'weight_decay': 2.900200726550785e-06, 'epochs': 309, 'loss': 'mse', 'optimizer': 'adam', 'graph_mode': 'cutoff', 'cutoff': 0.6676780804750989, 'grm_norm': 'gcn', 'self_loops': True, 'use_snp_selection': False}. Best is trial 63 with value: 0.31310005514374917.
[I 2025-12-08 13:43:57,795] Trial 66 finished with value: 0.26995932577575565 and parameters: {'model_type': 'graphsage', 'hidden_dims': '[512, 128]', 'dropout': 0.25755202493070056, 'batch_norm': False, 'sage_aggr': 'max', 'sage_normalize': True, 'sage_project': False, 'lr': 6.21824927426707e-05, 'weight_decay': 0.00011827498144063911, 'epochs': 183, 'loss': 'mae', 'optimizer': 'adam', 'graph_mode': 'cutoff', 'cutoff': 0.8693334646288657, 'grm_norm': 'gcn', 'self_loops': False, 'use_snp_selection': False}. Best is trial 63 with value: 0.31310005514374917.
[I 2025-12-08 13:45:42,809] Trial 67 finished with value: 0.2777843332264215 and parameters: {'model_type': 'graphsage', 'hidden_dims': '[128, 64]', 'dropout': 0.3246292259112467, 'batch_norm': True, 'sage_aggr': 'max', 'sage_normalize': False, 'sage_project': False, 'lr': 4.278146745107726e-05, 'weight_decay': 1.4487248675166519e-05, 'epochs': 262, 'loss': 'mse', 'optimizer': 'adam', 'graph_mode': 'knn', 'knn_k': 5, 'weighted_edges': False, 'symmetrize_mode': 'union', 'self_loops': True, 'use_snp_selection': False}. Best is trial 63 with value: 0.31310005514374917.
[I 2025-12-08 13:46:16,020] Trial 68 finished with value: 0.25706035610215855 and parameters: {'model_type': 'graphsage', 'hidden_dims': '[256, 128, 64]', 'dropout': 0.2943229752182017, 'batch_norm': False, 'sage_aggr': 'max', 'sage_normalize': False, 'sage_project': False, 'lr': 0.0012704713329218394, 'weight_decay': 4.023908926894492e-05, 'epochs': 286, 'loss': 'mse', 'optimizer': 'adam', 'graph_mode': 'cutoff', 'cutoff': 0.7609573095833646, 'grm_norm': 'gcn', 'self_loops': False, 'use_snp_selection': True, 'num_snps': 5503}. Best is trial 63 with value: 0.31310005514374917.
[I 2025-12-08 13:48:16,721] Trial 69 finished with value: 0.29961036340199 and parameters: {'model_type': 'graphsage', 'hidden_dims': '[512, 256]', 'dropout': 0.18747835967783913, 'batch_norm': False, 'sage_aggr': 'max', 'sage_normalize': False, 'sage_project': False, 'lr': 2.35294779019887e-05, 'weight_decay': 8.018813699927775e-05, 'epochs': 250, 'loss': 'mae', 'optimizer': 'adam', 'graph_mode': 'cutoff', 'cutoff': 0.5042389585300776, 'grm_norm': 'gcn', 'self_loops': True, 'use_snp_selection': False}. Best is trial 63 with value: 0.31310005514374917.
[I 2025-12-08 13:48:46,599] Trial 70 finished with value: 0.30934536102070054 and parameters: {'model_type': 'graphsage', 'hidden_dims': '[256, 128]', 'dropout': 0.39640114368930246, 'batch_norm': False, 'sage_aggr': 'max', 'sage_normalize': False, 'sage_project': False, 'lr': 1.0100961621493575e-05, 'weight_decay': 8.328632365549702e-06, 'epochs': 93, 'loss': 'mse', 'optimizer': 'adam', 'graph_mode': 'cutoff', 'cutoff': 0.7045708945973874, 'grm_norm': 'none', 'self_loops': False, 'use_snp_selection': False}. Best is trial 63 with value: 0.31310005514374917.
[I 2025-12-08 13:49:20,982] Trial 71 finished with value: 0.307250216667769 and parameters: {'model_type': 'graphsage', 'hidden_dims': '[128, 64]', 'dropout': 0.21731813788191418, 'batch_norm': False, 'sage_aggr': 'max', 'sage_normalize': False, 'sage_project': False, 'lr': 1.5895373586266404e-05, 'weight_decay': 2.4400256218909963e-05, 'epochs': 194, 'loss': 'mse', 'optimizer': 'adam', 'graph_mode': 'cutoff', 'cutoff': 0.8373659534266092, 'grm_norm': 'gcn', 'self_loops': True, 'use_snp_selection': False}. Best is trial 63 with value: 0.31310005514374917.
[I 2025-12-08 13:50:00,056] Trial 72 finished with value: 0.30575569414231446 and parameters: {'model_type': 'graphsage', 'hidden_dims': '[128, 64]', 'dropout': 0.23705602661736888, 'batch_norm': False, 'sage_aggr': 'max', 'sage_normalize': False, 'sage_project': False, 'lr': 1.1825462058094378e-05, 'weight_decay': 6.591852745722841e-05, 'epochs': 231, 'loss': 'mse', 'optimizer': 'adam', 'graph_mode': 'cutoff', 'cutoff': 0.816101121217284, 'grm_norm': 'gcn', 'self_loops': True, 'use_snp_selection': False}. Best is trial 63 with value: 0.31310005514374917.
[I 2025-12-08 13:50:37,203] Trial 73 finished with value: 0.3076251465701136 and parameters: {'model_type': 'graphsage', 'hidden_dims': '[128, 64]', 'dropout': 0.2398148768651342, 'batch_norm': False, 'sage_aggr': 'max', 'sage_normalize': False, 'sage_project': False, 'lr': 1.7878712029594506e-05, 'weight_decay': 2.406087563803539e-05, 'epochs': 216, 'loss': 'mse', 'optimizer': 'adam', 'graph_mode': 'cutoff', 'cutoff': 0.7903673882968648, 'grm_norm': 'gcn', 'self_loops': True, 'use_snp_selection': False}. Best is trial 63 with value: 0.31310005514374917.
[I 2025-12-08 13:51:04,228] Trial 74 finished with value: 0.3140890642982352 and parameters: {'model_type': 'graphsage', 'hidden_dims': '[128, 64]', 'dropout': 0.2725351790479419, 'batch_norm': False, 'sage_aggr': 'max', 'sage_normalize': False, 'sage_project': False, 'lr': 3.686993333567703e-05, 'weight_decay': 1.5539217971419243e-05, 'epochs': 138, 'loss': 'mse', 'optimizer': 'adam', 'graph_mode': 'cutoff', 'cutoff': 0.8517972784524057, 'grm_norm': 'gcn', 'self_loops': True, 'use_snp_selection': False}. Best is trial 74 with value: 0.3140890642982352.
[I 2025-12-08 13:52:28,377] Trial 75 finished with value: 0.2413892338213594 and parameters: {'model_type': 'graphsage', 'hidden_dims': '[128, 64]', 'dropout': 0.31437980322057246, 'batch_norm': False, 'sage_aggr': 'max', 'sage_normalize': False, 'sage_project': False, 'lr': 3.824985696135269e-05, 'weight_decay': 5.185314650595183e-06, 'epochs': 134, 'loss': 'mse', 'optimizer': 'adam', 'graph_mode': 'cutoff', 'cutoff': 0.20429175192366128, 'grm_norm': 'gcn', 'self_loops': True, 'use_snp_selection': False}. Best is trial 74 with value: 0.3140890642982352.
[I 2025-12-08 13:53:39,416] Trial 76 finished with value: 0.3073706025456239 and parameters: {'model_type': 'graphsage', 'hidden_dims': '[512, 64]', 'dropout': 0.26654495435111647, 'batch_norm': False, 'sage_aggr': 'mean', 'sage_normalize': False, 'sage_project': False, 'lr': 4.806668173338438e-05, 'weight_decay': 1.6462304341151958e-07, 'epochs': 151, 'loss': 'mse', 'optimizer': 'adam', 'graph_mode': 'cutoff', 'cutoff': 0.8751964659211204, 'grm_norm': 'cosine_then_gcn', 'self_loops': True, 'use_snp_selection': False}. Best is trial 74 with value: 0.3140890642982352.
[I 2025-12-08 13:55:03,008] Trial 77 finished with value: 0.2386265957019702 and parameters: {'model_type': 'graphsage', 'hidden_dims': '[128, 64]', 'dropout': 0.15807083623383106, 'batch_norm': True, 'sage_aggr': 'max', 'sage_normalize': False, 'sage_project': False, 'lr': 3.016326220827892e-05, 'weight_decay': 1.008170754676224e-07, 'epochs': 139, 'loss': 'mae', 'optimizer': 'adam', 'graph_mode': 'knn', 'knn_k': 8, 'weighted_edges': True, 'symmetrize_mode': 'union', 'self_loops': False, 'use_snp_selection': False}. Best is trial 74 with value: 0.3140890642982352.
[I 2025-12-08 13:56:11,263] Trial 78 finished with value: 0.27741996924225887 and parameters: {'model_type': 'graphsage', 'hidden_dims': '[512, 128]', 'dropout': 0.3836423078752706, 'batch_norm': False, 'sage_aggr': 'max', 'sage_normalize': True, 'sage_project': False, 'lr': 5.966693780084274e-05, 'weight_decay': 1.526805345193135e-05, 'epochs': 118, 'loss': 'mse', 'optimizer': 'adam', 'graph_mode': 'cutoff', 'cutoff': 0.4267810807155768, 'grm_norm': 'cosine', 'self_loops': True, 'use_snp_selection': False}. Best is trial 74 with value: 0.3140890642982352.
