[I 2025-12-09 09:44:47,363] Trial 34 finished with value: 0.28170053386821453 and parameters: {'model_type': 'graphsage', 'hidden_dims': '[128, 64]', 'dropout': 0.3197755627311319, 'batch_norm': False, 'sage_aggr': 'max', 'sage_normalize': False, 'sage_project': False, 'lr': 2.0161447843650353e-05, 'weight_decay': 5.161428263135919e-05, 'epochs': 276, 'loss': 'mse', 'optimizer': 'adam', 'graph_mode': 'cutoff', 'cutoff': 0.20571050227168952, 'grm_norm': 'gcn', 'self_loops': False, 'use_snp_selection': True, 'num_snps': 8458}. Best is trial 32 with value: 0.285700800277628.
[I 2025-12-09 09:46:21,303] Trial 35 finished with value: 0.28619898453918574 and parameters: {'model_type': 'graphsage', 'hidden_dims': '[128, 64]', 'dropout': 0.3261965158173458, 'batch_norm': False, 'sage_aggr': 'max', 'sage_normalize': False, 'sage_project': False, 'lr': 1.322983939890669e-05, 'weight_decay': 4.6805067449327404e-05, 'epochs': 249, 'loss': 'mse', 'optimizer': 'adam', 'graph_mode': 'cutoff', 'cutoff': 0.2714482799051964, 'grm_norm': 'cosine', 'self_loops': False, 'use_snp_selection': True, 'num_snps': 18413}. Best is trial 35 with value: 0.28619898453918574.
[I 2025-12-09 09:47:23,462] Trial 36 finished with value: 0.2611846548133028 and parameters: {'model_type': 'graphsage', 'hidden_dims': '[128, 64]', 'dropout': 0.34683373743938406, 'batch_norm': True, 'sage_aggr': 'max', 'sage_normalize': False, 'sage_project': False, 'lr': 1.2609553750100687e-05, 'weight_decay': 0.00023230733530561475, 'epochs': 245, 'loss': 'mse', 'optimizer': 'adam', 'graph_mode': 'cutoff', 'cutoff': 0.3662895284896823, 'grm_norm': 'cosine', 'self_loops': False, 'use_snp_selection': True, 'num_snps': 19347}. Best is trial 35 with value: 0.28619898453918574.
[I 2025-12-09 09:50:05,449] Trial 37 finished with value: 0.002567039689192086 and parameters: {'model_type': 'graphsage', 'hidden_dims': '[256, 128, 64]', 'dropout': 0.21660197862487174, 'batch_norm': False, 'sage_aggr': 'max', 'sage_normalize': False, 'sage_project': False, 'lr': 0.0002773910381803035, 'weight_decay': 1.668970424799793e-05, 'epochs': 212, 'loss': 'mse', 'optimizer': 'adam', 'graph_mode': 'cutoff', 'cutoff': 0.2728068966995393, 'grm_norm': 'cosine', 'self_loops': False, 'use_snp_selection': False}. Best is trial 35 with value: 0.28619898453918574.
[I 2025-12-09 09:50:59,570] Trial 38 finished with value: 0.2610851210769902 and parameters: {'model_type': 'graphsage', 'hidden_dims': '[128, 64]', 'dropout': 0.3607540868398909, 'batch_norm': True, 'sage_aggr': 'mean', 'sage_normalize': True, 'sage_project': False, 'lr': 1.5835234358826985e-05, 'weight_decay': 1.573807272847972e-07, 'epochs': 173, 'loss': 'mse', 'optimizer': 'adam', 'graph_mode': 'cutoff', 'cutoff': 0.43587499234232374, 'grm_norm': 'cosine', 'self_loops': False, 'use_snp_selection': True, 'num_snps': 23959}. Best is trial 35 with value: 0.28619898453918574.
[I 2025-12-09 09:51:50,982] Trial 39 finished with value: 0.2767135187142572 and parameters: {'model_type': 'graphsage', 'hidden_dims': '[128, 64]', 'dropout': 0.2898938663458094, 'batch_norm': False, 'sage_aggr': 'max', 'sage_normalize': False, 'sage_project': False, 'lr': 3.269679601366984e-05, 'weight_decay': 0.00048694709826427524, 'epochs': 270, 'loss': 'mse', 'optimizer': 'adam', 'graph_mode': 'cutoff', 'cutoff': 0.33021377141161923, 'grm_norm': 'cosine', 'self_loops': False, 'use_snp_selection': True, 'num_snps': 13612}. Best is trial 35 with value: 0.28619898453918574.
[I 2025-12-09 09:55:17,063] Trial 40 finished with value: 0.23673371646833502 and parameters: {'model_type': 'graphsage', 'hidden_dims': '[256, 128, 64]', 'dropout': 0.32731199575456493, 'batch_norm': True, 'sage_aggr': 'max', 'sage_normalize': False, 'sage_project': False, 'lr': 5.436575204369022e-05, 'weight_decay': 5.3997574304018505e-06, 'epochs': 250, 'loss': 'mse', 'optimizer': 'adam', 'graph_mode': 'cutoff', 'cutoff': 0.26052084913167106, 'grm_norm': 'cosine', 'self_loops': False, 'use_snp_selection': False}. Best is trial 35 with value: 0.28619898453918574.
[I 2025-12-09 09:56:28,188] Trial 41 finished with value: 0.289349286162371 and parameters: {'model_type': 'graphsage', 'hidden_dims': '[128, 64]', 'dropout': 0.322124151502242, 'batch_norm': False, 'sage_aggr': 'max', 'sage_normalize': False, 'sage_project': False, 'lr': 1.8197174318704852e-05, 'weight_decay': 4.758136783425548e-05, 'epochs': 279, 'loss': 'mse', 'optimizer': 'adam', 'graph_mode': 'cutoff', 'cutoff': 0.20212570853673, 'grm_norm': 'gcn', 'self_loops': False, 'use_snp_selection': True, 'num_snps': 10028}. Best is trial 41 with value: 0.289349286162371.
[I 2025-12-09 09:58:04,017] Trial 42 finished with value: 0.2833648498674859 and parameters: {'model_type': 'graphsage', 'hidden_dims': '[128, 64]', 'dropout': 0.3506767759494425, 'batch_norm': False, 'sage_aggr': 'max', 'sage_normalize': False, 'sage_project': False, 'lr': 1.376243539451143e-05, 'weight_decay': 4.757567575680675e-05, 'epochs': 292, 'loss': 'mse', 'optimizer': 'adam', 'graph_mode': 'cutoff', 'cutoff': 0.2560507755044716, 'grm_norm': 'gcn', 'self_loops': False, 'use_snp_selection': True, 'num_snps': 16491}. Best is trial 41 with value: 0.289349286162371.
[I 2025-12-09 10:00:06,352] Trial 43 finished with value: 0.27404166405919916 and parameters: {'model_type': 'graphsage', 'hidden_dims': '[128, 64]', 'dropout': 0.2732295507606962, 'batch_norm': False, 'sage_aggr': 'max', 'sage_normalize': False, 'sage_project': False, 'lr': 7.373435791143479e-05, 'weight_decay': 0.0003220557324638842, 'epochs': 308, 'loss': 'mse', 'optimizer': 'adam', 'graph_mode': 'cutoff', 'cutoff': 0.3071567637435057, 'grm_norm': 'gcn', 'self_loops': False, 'use_snp_selection': True, 'num_snps': 23782}. Best is trial 41 with value: 0.289349286162371.
[I 2025-12-09 10:01:00,832] Trial 44 finished with value: 0.2806750901079033 and parameters: {'model_type': 'graphsage', 'hidden_dims': '[128, 64]', 'dropout': 0.32560772474922545, 'batch_norm': False, 'sage_aggr': 'mean', 'sage_normalize': False, 'sage_project': False, 'lr': 1.9062761157488744e-05, 'weight_decay': 1.8616976333813942e-05, 'epochs': 280, 'loss': 'mse', 'optimizer': 'adam', 'graph_mode': 'cutoff', 'cutoff': 0.24782457067574576, 'grm_norm': 'none', 'self_loops': False, 'use_snp_selection': True, 'num_snps': 10417}. Best is trial 41 with value: 0.289349286162371.
[I 2025-12-09 10:04:54,574] Trial 45 finished with value: 0.2666333047118606 and parameters: {'model_type': 'graphsage', 'hidden_dims': '[512, 64]', 'dropout': 0.41980592027844826, 'batch_norm': False, 'sage_aggr': 'max', 'sage_normalize': True, 'sage_project': False, 'lr': 1.030352429218008e-05, 'weight_decay': 0.0009955038723397343, 'epochs': 238, 'loss': 'mse', 'optimizer': 'adam', 'graph_mode': 'cutoff', 'cutoff': 0.20529716532216857, 'grm_norm': 'gcn', 'self_loops': False, 'use_snp_selection': True, 'num_snps': 27312}. Best is trial 41 with value: 0.289349286162371.
[I 2025-12-09 10:06:27,743] Trial 46 finished with value: 0.27027713981367996 and parameters: {'model_type': 'graphsage', 'hidden_dims': '[128, 64]', 'dropout': 0.1877453821944023, 'batch_norm': False, 'sage_aggr': 'max', 'sage_normalize': False, 'sage_project': False, 'lr': 3.907096889138224e-05, 'weight_decay': 5.203747154899776e-06, 'epochs': 198, 'loss': 'mse', 'optimizer': 'adam', 'graph_mode': 'knn', 'knn_k': 10, 'weighted_edges': True, 'symmetrize_mode': 'union', 'self_loops': False, 'use_snp_selection': True, 'num_snps': 17550}. Best is trial 41 with value: 0.289349286162371.
[I 2025-12-09 10:07:41,109] Trial 47 finished with value: 0.2806203502577359 and parameters: {'model_type': 'graphsage', 'hidden_dims': '[128, 64]', 'dropout': 0.37359904395556315, 'batch_norm': False, 'sage_aggr': 'max', 'sage_normalize': False, 'sage_project': False, 'lr': 2.435275295464589e-05, 'weight_decay': 5.593688411130741e-05, 'epochs': 334, 'loss': 'mse', 'optimizer': 'adam', 'graph_mode': 'cutoff', 'cutoff': 0.3716004947022986, 'grm_norm': 'cosine_then_gcn', 'self_loops': False, 'use_snp_selection': True, 'num_snps': 22117}. Best is trial 41 with value: 0.289349286162371.
[I 2025-12-09 10:08:34,974] Trial 48 finished with value: 0.24382337934960746 and parameters: {'model_type': 'graphsage', 'hidden_dims': '[256, 128, 64]', 'dropout': 0.3063016825529051, 'batch_norm': True, 'sage_aggr': 'max', 'sage_normalize': False, 'sage_project': False, 'lr': 1.631624206824464e-05, 'weight_decay': 0.0006625390913380002, 'epochs': 294, 'loss': 'mse', 'optimizer': 'adam', 'graph_mode': 'cutoff', 'cutoff': 0.24440802889823102, 'grm_norm': 'none', 'self_loops': False, 'use_snp_selection': True, 'num_snps': 6546}. Best is trial 41 with value: 0.289349286162371.
[I 2025-12-09 10:09:25,313] Trial 49 finished with value: 0.2510474101949012 and parameters: {'model_type': 'graphsage', 'hidden_dims': '[256, 128]', 'dropout': 0.2576886964405433, 'batch_norm': False, 'sage_aggr': 'mean', 'sage_normalize': True, 'sage_project': False, 'lr': 7.164046364882597e-05, 'weight_decay': 5.575558631909829e-07, 'epochs': 214, 'loss': 'mse', 'optimizer': 'adam', 'graph_mode': 'cutoff', 'cutoff': 0.30785954615197336, 'grm_norm': 'gcn', 'self_loops': False, 'use_snp_selection': True, 'num_snps': 13076}. Best is trial 41 with value: 0.289349286162371.
[I 2025-12-09 10:13:10,911] Trial 50 finished with value: 0.2702020675629555 and parameters: {'model_type': 'graphsage', 'hidden_dims': '[512, 64]', 'dropout': 0.34155853121635626, 'batch_norm': False, 'sage_aggr': 'max', 'sage_normalize': False, 'sage_project': False, 'lr': 4.486660366416466e-05, 'weight_decay': 0.00019983607381132302, 'epochs': 271, 'loss': 'mae', 'optimizer': 'adam', 'graph_mode': 'knn', 'knn_k': 7, 'weighted_edges': True, 'symmetrize_mode': 'union', 'self_loops': True, 'use_snp_selection': True, 'num_snps': 26488}. Best is trial 41 with value: 0.289349286162371.
[I 2025-12-09 10:14:36,020] Trial 51 finished with value: 0.27936409054016337 and parameters: {'model_type': 'graphsage', 'hidden_dims': '[128, 64]', 'dropout': 0.3528796768338397, 'batch_norm': False, 'sage_aggr': 'max', 'sage_normalize': False, 'sage_project': False, 'lr': 1.38977554707564e-05, 'weight_decay': 4.517271550092163e-05, 'epochs': 291, 'loss': 'mse', 'optimizer': 'adam', 'graph_mode': 'cutoff', 'cutoff': 0.26326167572834275, 'grm_norm': 'gcn', 'self_loops': False, 'use_snp_selection': True, 'num_snps': 16168}. Best is trial 41 with value: 0.289349286162371.
[I 2025-12-09 10:17:31,992] Trial 52 finished with value: 0.27637259496644917 and parameters: {'model_type': 'graphsage', 'hidden_dims': '[128, 64]', 'dropout': 0.4001210390255733, 'batch_norm': False, 'sage_aggr': 'max', 'sage_normalize': False, 'sage_project': False, 'lr': 2.924786955595866e-05, 'weight_decay': 4.2252913539267455e-05, 'epochs': 315, 'loss': 'mse', 'optimizer': 'adam', 'graph_mode': 'cutoff', 'cutoff': 0.23489960085062678, 'grm_norm': 'gcn', 'self_loops': False, 'use_snp_selection': True, 'num_snps': 21748}. Best is trial 41 with value: 0.289349286162371.
[I 2025-12-09 10:18:47,776] Trial 53 finished with value: -0.012806841115997447 and parameters: {'model_type': 'graphsage', 'hidden_dims': '[128, 64]', 'dropout': 0.29320902041513447, 'batch_norm': False, 'sage_aggr': 'max', 'sage_normalize': False, 'sage_project': False, 'lr': 0.005445092002247451, 'weight_decay': 2.062404786059792e-05, 'epochs': 282, 'loss': 'mse', 'optimizer': 'adam', 'graph_mode': 'cutoff', 'cutoff': 0.2837953228825871, 'grm_norm': 'gcn', 'self_loops': False, 'use_snp_selection': True, 'num_snps': 16895}. Best is trial 41 with value: 0.289349286162371.
[I 2025-12-09 10:19:30,449] Trial 54 finished with value: 0.2713718764884278 and parameters: {'model_type': 'graphsage', 'hidden_dims': '[128, 64]', 'dropout': 0.3683486999303009, 'batch_norm': False, 'sage_aggr': 'max', 'sage_normalize': False, 'sage_project': False, 'lr': 1.2219004832598014e-05, 'weight_decay': 0.00041625391209973184, 'epochs': 326, 'loss': 'mse', 'optimizer': 'adam', 'graph_mode': 'cutoff', 'cutoff': 0.5704097240877984, 'grm_norm': 'gcn', 'self_loops': False, 'use_snp_selection': True, 'num_snps': 14553}. Best is trial 41 with value: 0.289349286162371.
[I 2025-12-09 10:23:38,252] Trial 55 finished with value: 0.2788073286908884 and parameters: {'model_type': 'graphsage', 'hidden_dims': '[128, 64]', 'dropout': 0.4315444876286777, 'batch_norm': False, 'sage_aggr': 'max', 'sage_normalize': False, 'sage_project': False, 'lr': 1.6750544124926174e-05, 'weight_decay': 8.71195357481492e-05, 'epochs': 301, 'loss': 'mse', 'optimizer': 'adam', 'graph_mode': 'cutoff', 'cutoff': 0.24304338953617258, 'grm_norm': 'gcn', 'self_loops': False, 'use_snp_selection': True, 'num_snps': 29910}. Best is trial 41 with value: 0.289349286162371.
[I 2025-12-09 10:24:40,160] Trial 56 finished with value: 0.2730049256952424 and parameters: {'model_type': 'graphsage', 'hidden_dims': '[512, 256]', 'dropout': 0.313569372371011, 'batch_norm': False, 'sage_aggr': 'max', 'sage_normalize': False, 'sage_project': False, 'lr': 8.490668605715904e-05, 'weight_decay': 8.631374391113649e-06, 'epochs': 237, 'loss': 'mse', 'optimizer': 'adam', 'graph_mode': 'cutoff', 'cutoff': 0.3317633613088738, 'grm_norm': 'cosine', 'self_loops': False, 'use_snp_selection': True, 'num_snps': 11913}. Best is trial 41 with value: 0.289349286162371.
[I 2025-12-09 10:28:47,840] Trial 57 finished with value: 0.260945342750639 and parameters: {'model_type': 'graphsage', 'hidden_dims': '[512, 128]', 'dropout': 0.39141979246211983, 'batch_norm': False, 'sage_aggr': 'max', 'sage_normalize': False, 'sage_project': False, 'lr': 2.6077866605188707e-05, 'weight_decay': 3.215560421207221e-05, 'epochs': 255, 'loss': 'mse', 'optimizer': 'adam', 'graph_mode': 'knn', 'knn_k': 5, 'weighted_edges': True, 'symmetrize_mode': 'union', 'self_loops': True, 'use_snp_selection': False}. Best is trial 41 with value: 0.289349286162371.
[I 2025-12-09 10:32:58,749] Trial 58 finished with value: 0.27371226486235034 and parameters: {'model_type': 'graphsage', 'hidden_dims': '[128, 64]', 'dropout': 0.3358974081727655, 'batch_norm': False, 'sage_aggr': 'max', 'sage_normalize': False, 'sage_project': False, 'lr': 3.547551959357354e-05, 'weight_decay': 6.978736513664816e-05, 'epochs': 268, 'loss': 'mae', 'optimizer': 'adam', 'graph_mode': 'cutoff', 'cutoff': 0.2019278304063836, 'grm_norm': 'gcn', 'self_loops': False, 'use_snp_selection': True, 'num_snps': 25475}. Best is trial 41 with value: 0.289349286162371.
[I 2025-12-09 10:33:45,160] Trial 59 finished with value: 0.2612040070017107 and parameters: {'model_type': 'graphsage', 'hidden_dims': '[512, 256]', 'dropout': 0.2335278594718197, 'batch_norm': False, 'sage_aggr': 'mean', 'sage_normalize': False, 'sage_project': False, 'lr': 0.0002837433700139607, 'weight_decay': 0.0006179363891655273, 'epochs': 170, 'loss': 'mse', 'optimizer': 'adam', 'graph_mode': 'cutoff', 'cutoff': 0.237399128941266, 'grm_norm': 'cosine_then_gcn', 'self_loops': False, 'use_snp_selection': True, 'num_snps': 8230}. Best is trial 41 with value: 0.289349286162371.
[I 2025-12-09 10:34:29,103] Trial 60 finished with value: 0.2653803876405888 and parameters: {'model_type': 'graphsage', 'hidden_dims': '[256, 128]', 'dropout': 0.14273621226961508, 'batch_norm': False, 'sage_aggr': 'max', 'sage_normalize': False, 'sage_project': False, 'lr': 2.017551495911719e-05, 'weight_decay': 0.0003150247721712559, 'epochs': 186, 'loss': 'mse', 'optimizer': 'adam', 'graph_mode': 'cutoff', 'cutoff': 0.8695669929796743, 'grm_norm': 'gcn', 'self_loops': False, 'use_snp_selection': True, 'num_snps': 18768}. Best is trial 41 with value: 0.289349286162371.
[I 2025-12-09 10:34:59,687] Trial 61 finished with value: 0.26507680160262975 and parameters: {'model_type': 'graphsage', 'hidden_dims': '[128, 64]', 'dropout': 0.3181700832135366, 'batch_norm': False, 'sage_aggr': 'max', 'sage_normalize': False, 'sage_project': False, 'lr': 1.899952244396784e-05, 'weight_decay': 4.5151998628583115e-05, 'epochs': 278, 'loss': 'mse', 'optimizer': 'adam', 'graph_mode': 'cutoff', 'cutoff': 0.22561588192548812, 'grm_norm': 'gcn', 'self_loops': False, 'use_snp_selection': True, 'num_snps': 2233}. Best is trial 41 with value: 0.289349286162371.
[I 2025-12-09 10:35:45,944] Trial 62 finished with value: 0.27707616704347215 and parameters: {'model_type': 'graphsage', 'hidden_dims': '[128, 64]', 'dropout': 0.2792272062683242, 'batch_norm': False, 'sage_aggr': 'max', 'sage_normalize': False, 'sage_project': False, 'lr': 1.2692254119255835e-05, 'weight_decay': 6.103319360162682e-05, 'epochs': 296, 'loss': 'mse', 'optimizer': 'adam', 'graph_mode': 'cutoff', 'cutoff': 0.2708938297999519, 'grm_norm': 'gcn', 'self_loops': False, 'use_snp_selection': True, 'num_snps': 7300}. Best is trial 41 with value: 0.289349286162371.
[I 2025-12-09 10:37:04,744] Trial 63 finished with value: 0.282874018556685 and parameters: {'model_type': 'graphsage', 'hidden_dims': '[128, 64]', 'dropout': 0.3550034136497571, 'batch_norm': False, 'sage_aggr': 'max', 'sage_normalize': False, 'sage_project': False, 'lr': 4.715683290913403e-05, 'weight_decay': 0.00012236410741345288, 'epochs': 276, 'loss': 'mse', 'optimizer': 'adam', 'graph_mode': 'cutoff', 'cutoff': 0.20664058969297824, 'grm_norm': 'gcn', 'self_loops': False, 'use_snp_selection': True, 'num_snps': 11151}. Best is trial 41 with value: 0.289349286162371.
[I 2025-12-09 10:37:54,294] Trial 64 finished with value: 0.2599355399904394 and parameters: {'model_type': 'graphsage', 'hidden_dims': '[128, 64]', 'dropout': 0.41016611175602846, 'batch_norm': False, 'sage_aggr': 'max', 'sage_normalize': False, 'sage_project': False, 'lr': 0.00010061223272961297, 'weight_decay': 0.0001294387977411061, 'epochs': 261, 'loss': 'mse', 'optimizer': 'adam', 'graph_mode': 'cutoff', 'cutoff': 0.30167714176480465, 'grm_norm': 'gcn', 'self_loops': False, 'use_snp_selection': True, 'num_snps': 10855}. Best is trial 41 with value: 0.289349286162371.
[I 2025-12-09 10:39:12,974] Trial 65 finished with value: 0.27984150983120876 and parameters: {'model_type': 'graphsage', 'hidden_dims': '[128, 64]', 'dropout': 0.34955057850541865, 'batch_norm': False, 'sage_aggr': 'max', 'sage_normalize': False, 'sage_project': False, 'lr': 4.3956611806960566e-05, 'weight_decay': 0.00017879928404971636, 'epochs': 247, 'loss': 'mse', 'optimizer': 'adam', 'graph_mode': 'cutoff', 'cutoff': 0.23028415959172688, 'grm_norm': 'gcn', 'self_loops': False, 'use_snp_selection': True, 'num_snps': 14834}. Best is trial 41 with value: 0.289349286162371.
[I 2025-12-09 10:42:22,827] Trial 66 finished with value: 0.28606424481874104 and parameters: {'model_type': 'graphsage', 'hidden_dims': '[512, 256]', 'dropout': 0.38138359111444214, 'batch_norm': False, 'sage_aggr': 'max', 'sage_normalize': False, 'sage_project': False, 'lr': 6.316521394182214e-05, 'weight_decay': 2.4337194447631883e-05, 'epochs': 316, 'loss': 'mse', 'optimizer': 'adam', 'graph_mode': 'cutoff', 'cutoff': 0.2607420304066054, 'grm_norm': 'gcn', 'self_loops': True, 'use_snp_selection': True, 'num_snps': 21440}. Best is trial 41 with value: 0.289349286162371.
[I 2025-12-09 10:44:18,539] Trial 67 finished with value: 0.24964587886010942 and parameters: {'model_type': 'graphsage', 'hidden_dims': '[512, 256]', 'dropout': 0.43779498145007373, 'batch_norm': False, 'sage_aggr': 'max', 'sage_normalize': True, 'sage_project': False, 'lr': 6.399169262417688e-05, 'weight_decay': 2.779504191315479e-05, 'epochs': 317, 'loss': 'mae', 'optimizer': 'adam', 'graph_mode': 'cutoff', 'cutoff': 0.3921390700589882, 'grm_norm': 'gcn', 'self_loops': True, 'use_snp_selection': True, 'num_snps': 20939}. Best is trial 41 with value: 0.289349286162371.
[I 2025-12-09 10:46:59,760] Trial 68 finished with value: 0.24708369804700317 and parameters: {'model_type': 'graphsage', 'hidden_dims': '[512, 256]', 'dropout': 0.3770428593712687, 'batch_norm': True, 'sage_aggr': 'max', 'sage_normalize': False, 'sage_project': False, 'lr': 0.0005476709850363476, 'weight_decay': 2.3630453768972557e-05, 'epochs': 129, 'loss': 'mse', 'optimizer': 'adam', 'graph_mode': 'knn', 'knn_k': 8, 'weighted_edges': True, 'symmetrize_mode': 'union', 'self_loops': True, 'use_snp_selection': False}. Best is trial 41 with value: 0.289349286162371.
[I 2025-12-09 10:49:42,206] Trial 69 finished with value: 0.27312719286022324 and parameters: {'model_type': 'graphsage', 'hidden_dims': '[512, 256]', 'dropout': 0.29325213586813725, 'batch_norm': False, 'sage_aggr': 'max', 'sage_normalize': False, 'sage_project': False, 'lr': 0.00014105112572423067, 'weight_decay': 1.363371615313057e-05, 'epochs': 346, 'loss': 'mse', 'optimizer': 'adam', 'graph_mode': 'cutoff', 'cutoff': 0.3162286014112643, 'grm_norm': 'none', 'self_loops': True, 'use_snp_selection': True, 'num_snps': 23062}. Best is trial 41 with value: 0.289349286162371.
[I 2025-12-09 10:51:40,095] Trial 70 finished with value: 0.0 and parameters: {'model_type': 'graphsage', 'hidden_dims': '[512, 256]', 'dropout': 0.40274704366294856, 'batch_norm': False, 'sage_aggr': 'max', 'sage_normalize': False, 'sage_project': False, 'lr': 0.009234859483799545, 'weight_decay': 0.00024829666980477817, 'epochs': 330, 'loss': 'mse', 'optimizer': 'adam', 'graph_mode': 'cutoff', 'cutoff': 0.284524018805805, 'grm_norm': 'gcn', 'self_loops': True, 'use_snp_selection': True, 'num_snps': 17203}. Best is trial 41 with value: 0.289349286162371.
