[I 2025-12-09 18:54:38,618] Trial 105 finished with value: 0.3627019639518279 and parameters: {'model_type': 'graphsage', 'hidden_dims': '[128, 64]', 'dropout': 0.5960640455966683, 'batch_norm': False, 'sage_aggr': 'mean', 'sage_normalize': False, 'sage_project': False, 'lr': 1.4381889419066026e-05, 'weight_decay': 7.677315383265804e-05, 'epochs': 134, 'loss': 'mse', 'optimizer': 'adam', 'graph_mode': 'cutoff', 'cutoff': 0.5896505653748888, 'grm_norm': 'cosine_then_gcn', 'self_loops': True, 'use_snp_selection': False}. Best is trial 88 with value: 0.3731829818307439.
[I 2025-12-09 18:55:12,262] Trial 106 finished with value: 0.3730594391602312 and parameters: {'model_type': 'graphsage', 'hidden_dims': '[256, 128]', 'dropout': 0.37117544881581793, 'batch_norm': False, 'sage_aggr': 'mean', 'sage_normalize': False, 'sage_project': False, 'lr': 1.1759986435530554e-05, 'weight_decay': 0.000117333719305278, 'epochs': 100, 'loss': 'mse', 'optimizer': 'adam', 'graph_mode': 'cutoff', 'cutoff': 0.5327374333981736, 'grm_norm': 'cosine_then_gcn', 'self_loops': True, 'use_snp_selection': False}. Best is trial 88 with value: 0.3731829818307439.
[I 2025-12-09 18:56:17,234] Trial 107 finished with value: 0.36327482768347663 and parameters: {'model_type': 'graphsage', 'hidden_dims': '[512, 256]', 'dropout': 0.4048466328901252, 'batch_norm': False, 'sage_aggr': 'max', 'sage_normalize': False, 'sage_project': False, 'lr': 2.1322068081333997e-05, 'weight_decay': 0.00010881238507781938, 'epochs': 127, 'loss': 'mse', 'optimizer': 'adam', 'graph_mode': 'cutoff', 'cutoff': 0.5292171288485965, 'grm_norm': 'gcn', 'self_loops': True, 'use_snp_selection': False}. Best is trial 88 with value: 0.3731829818307439.
[I 2025-12-09 18:56:49,237] Trial 108 finished with value: 0.34150704675702315 and parameters: {'model_type': 'graphsage', 'hidden_dims': '[256, 128]', 'dropout': 0.3566661230656295, 'batch_norm': False, 'sage_aggr': 'mean', 'sage_normalize': False, 'sage_project': False, 'lr': 0.0005997785257063014, 'weight_decay': 5.236538452134698e-05, 'epochs': 80, 'loss': 'mse', 'optimizer': 'adam', 'graph_mode': 'cutoff', 'cutoff': 0.5634168924374261, 'grm_norm': 'cosine_then_gcn', 'self_loops': True, 'use_snp_selection': True, 'num_snps': 10427}. Best is trial 88 with value: 0.3731829818307439.
[I 2025-12-09 18:57:28,403] Trial 109 finished with value: 0.36560729989663265 and parameters: {'model_type': 'graphsage', 'hidden_dims': '[256, 128]', 'dropout': 0.38235264395296553, 'batch_norm': False, 'sage_aggr': 'mean', 'sage_normalize': False, 'sage_project': False, 'lr': 7.030397944311606e-05, 'weight_decay': 0.0001208247022896306, 'epochs': 111, 'loss': 'mse', 'optimizer': 'adam', 'graph_mode': 'cutoff', 'cutoff': 0.49498133590116145, 'grm_norm': 'cosine_then_gcn', 'self_loops': True, 'use_snp_selection': False}. Best is trial 88 with value: 0.3731829818307439.
[I 2025-12-09 18:58:48,882] Trial 110 finished with value: 0.3636740014268161 and parameters: {'model_type': 'graphsage', 'hidden_dims': '[256, 128]', 'dropout': 0.2383344693365959, 'batch_norm': False, 'sage_aggr': 'mean', 'sage_normalize': False, 'sage_project': False, 'lr': 1.1738445340791617e-05, 'weight_decay': 9.173811908146835e-05, 'epochs': 141, 'loss': 'mse', 'optimizer': 'adam', 'graph_mode': 'knn', 'knn_k': 6, 'weighted_edges': True, 'symmetrize_mode': 'union', 'self_loops': True, 'use_snp_selection': False}. Best is trial 88 with value: 0.3731829818307439.
[I 2025-12-09 18:59:22,658] Trial 111 finished with value: 0.3696428304629169 and parameters: {'model_type': 'graphsage', 'hidden_dims': '[256, 128]', 'dropout': 0.32328907623316777, 'batch_norm': False, 'sage_aggr': 'mean', 'sage_normalize': False, 'sage_project': False, 'lr': 1.2557131866198188e-05, 'weight_decay': 2.715115866237085e-05, 'epochs': 102, 'loss': 'mse', 'optimizer': 'adam', 'graph_mode': 'cutoff', 'cutoff': 0.5464427048891345, 'grm_norm': 'cosine_then_gcn', 'self_loops': True, 'use_snp_selection': False}. Best is trial 88 with value: 0.3731829818307439.
[I 2025-12-09 19:00:01,162] Trial 112 finished with value: 0.35895288256562224 and parameters: {'model_type': 'graphsage', 'hidden_dims': '[256, 128]', 'dropout': 0.44945505172074246, 'batch_norm': False, 'sage_aggr': 'mean', 'sage_normalize': False, 'sage_project': False, 'lr': 1.2040443228432314e-05, 'weight_decay': 1.9509969799289803e-05, 'epochs': 102, 'loss': 'mse', 'optimizer': 'adam', 'graph_mode': 'cutoff', 'cutoff': 0.45030399419646144, 'grm_norm': 'cosine_then_gcn', 'self_loops': True, 'use_snp_selection': False}. Best is trial 88 with value: 0.3731829818307439.
[I 2025-12-09 19:00:32,018] Trial 113 finished with value: 0.03815349215778292 and parameters: {'model_type': 'graphsage', 'hidden_dims': '[256, 128]', 'dropout': 0.21384445401783975, 'batch_norm': False, 'sage_aggr': 'mean', 'sage_normalize': False, 'sage_project': False, 'lr': 0.00388702237410409, 'weight_decay': 4.171183929642121e-06, 'epochs': 89, 'loss': 'mse', 'optimizer': 'adam', 'graph_mode': 'cutoff', 'cutoff': 0.5482919681675096, 'grm_norm': 'cosine_then_gcn', 'self_loops': True, 'use_snp_selection': False}. Best is trial 88 with value: 0.3731829818307439.
[I 2025-12-09 19:01:00,579] Trial 114 finished with value: 0.3679217278032152 and parameters: {'model_type': 'graphsage', 'hidden_dims': '[256, 128]', 'dropout': 0.32043377543670415, 'batch_norm': False, 'sage_aggr': 'mean', 'sage_normalize': False, 'sage_project': False, 'lr': 1.8246292617057037e-05, 'weight_decay': 4.8155763215596634e-05, 'epochs': 75, 'loss': 'mse', 'optimizer': 'adam', 'graph_mode': 'cutoff', 'cutoff': 0.5147017926532609, 'grm_norm': 'cosine_then_gcn', 'self_loops': True, 'use_snp_selection': False}. Best is trial 88 with value: 0.3731829818307439.
[I 2025-12-09 19:01:40,077] Trial 115 finished with value: 0.3725395233609308 and parameters: {'model_type': 'graphsage', 'hidden_dims': '[256, 128]', 'dropout': 0.2895074593076311, 'batch_norm': False, 'sage_aggr': 'mean', 'sage_normalize': False, 'sage_project': False, 'lr': 1.6444005061142546e-05, 'weight_decay': 6.88345744083721e-05, 'epochs': 108, 'loss': 'mse', 'optimizer': 'adam', 'graph_mode': 'cutoff', 'cutoff': 0.4820855657247644, 'grm_norm': 'cosine_then_gcn', 'self_loops': True, 'use_snp_selection': False}. Best is trial 88 with value: 0.3731829818307439.
[I 2025-12-09 19:02:19,325] Trial 116 finished with value: 0.37577726394871724 and parameters: {'model_type': 'graphsage', 'hidden_dims': '[256, 128]', 'dropout': 0.3768706409607203, 'batch_norm': False, 'sage_aggr': 'mean', 'sage_normalize': False, 'sage_project': False, 'lr': 2.7418161561448838e-05, 'weight_decay': 6.357056028785042e-05, 'epochs': 108, 'loss': 'mse', 'optimizer': 'adam', 'graph_mode': 'cutoff', 'cutoff': 0.4857956489233446, 'grm_norm': 'cosine_then_gcn', 'self_loops': True, 'use_snp_selection': False}. Best is trial 116 with value: 0.37577726394871724.
[I 2025-12-09 19:02:54,941] Trial 117 finished with value: 0.352892425333067 and parameters: {'model_type': 'graphsage', 'hidden_dims': '[256, 128]', 'dropout': 0.38326623862705234, 'batch_norm': True, 'sage_aggr': 'mean', 'sage_normalize': True, 'sage_project': False, 'lr': 2.6533611483074636e-05, 'weight_decay': 0.00012827060902044732, 'epochs': 92, 'loss': 'mse', 'optimizer': 'adam', 'graph_mode': 'cutoff', 'cutoff': 0.4794014682392145, 'grm_norm': 'cosine_then_gcn', 'self_loops': False, 'use_snp_selection': False}. Best is trial 116 with value: 0.37577726394871724.
[I 2025-12-09 19:03:35,194] Trial 118 finished with value: 0.3673029136848434 and parameters: {'model_type': 'graphsage', 'hidden_dims': '[256, 128]', 'dropout': 0.40064718902207674, 'batch_norm': False, 'sage_aggr': 'mean', 'sage_normalize': False, 'sage_project': False, 'lr': 3.952563277083418e-05, 'weight_decay': 6.624578624609839e-05, 'epochs': 121, 'loss': 'mse', 'optimizer': 'adam', 'graph_mode': 'cutoff', 'cutoff': 0.5053327568389623, 'grm_norm': 'cosine_then_gcn', 'self_loops': True, 'use_snp_selection': False}. Best is trial 116 with value: 0.37577726394871724.
[I 2025-12-09 19:04:11,077] Trial 119 finished with value: 0.3677425080276614 and parameters: {'model_type': 'graphsage', 'hidden_dims': '[256, 128]', 'dropout': 0.28462498613754517, 'batch_norm': False, 'sage_aggr': 'mean', 'sage_normalize': False, 'sage_project': False, 'lr': 2.2700947542327654e-05, 'weight_decay': 7.974668473986219e-05, 'epochs': 109, 'loss': 'mse', 'optimizer': 'adam', 'graph_mode': 'cutoff', 'cutoff': 0.5259280470324128, 'grm_norm': 'cosine_then_gcn', 'self_loops': True, 'use_snp_selection': False}. Best is trial 116 with value: 0.37577726394871724.
[I 2025-12-09 19:04:44,644] Trial 120 finished with value: 0.36487609413827543 and parameters: {'model_type': 'graphsage', 'hidden_dims': '[256, 128]', 'dropout': 0.271578892755477, 'batch_norm': False, 'sage_aggr': 'mean', 'sage_normalize': False, 'sage_project': False, 'lr': 2.8690482596510857e-05, 'weight_decay': 0.0001756020473994202, 'epochs': 84, 'loss': 'mse', 'optimizer': 'adam', 'graph_mode': 'cutoff', 'cutoff': 0.46318897899862327, 'grm_norm': 'cosine_then_gcn', 'self_loops': True, 'use_snp_selection': False}. Best is trial 116 with value: 0.37577726394871724.
[I 2025-12-09 19:05:21,700] Trial 121 finished with value: 0.3620461500055502 and parameters: {'model_type': 'graphsage', 'hidden_dims': '[256, 128]', 'dropout': 0.35340588877782914, 'batch_norm': False, 'sage_aggr': 'mean', 'sage_normalize': False, 'sage_project': False, 'lr': 1.9181158590290312e-05, 'weight_decay': 3.516266408998658e-05, 'epochs': 100, 'loss': 'mse', 'optimizer': 'adam', 'graph_mode': 'cutoff', 'cutoff': 0.48799880508303417, 'grm_norm': 'cosine_then_gcn', 'self_loops': True, 'use_snp_selection': False}. Best is trial 116 with value: 0.37577726394871724.
[I 2025-12-09 19:05:56,499] Trial 122 finished with value: 0.3639925836692345 and parameters: {'model_type': 'graphsage', 'hidden_dims': '[256, 128]', 'dropout': 0.36917676044269804, 'batch_norm': False, 'sage_aggr': 'mean', 'sage_normalize': False, 'sage_project': False, 'lr': 1.6467196758711822e-05, 'weight_decay': 5.9594203210568136e-05, 'epochs': 106, 'loss': 'mse', 'optimizer': 'adam', 'graph_mode': 'cutoff', 'cutoff': 0.5399194179623997, 'grm_norm': 'cosine_then_gcn', 'self_loops': True, 'use_snp_selection': False}. Best is trial 116 with value: 0.37577726394871724.
[I 2025-12-09 19:06:22,835] Trial 123 finished with value: 0.3678769282096502 and parameters: {'model_type': 'graphsage', 'hidden_dims': '[256, 128]', 'dropout': 0.33344963740745087, 'batch_norm': False, 'sage_aggr': 'mean', 'sage_normalize': False, 'sage_project': False, 'lr': 1.5048293648780099e-05, 'weight_decay': 4.567912795863905e-05, 'epochs': 69, 'loss': 'mse', 'optimizer': 'adam', 'graph_mode': 'cutoff', 'cutoff': 0.5638384903147375, 'grm_norm': 'cosine_then_gcn', 'self_loops': True, 'use_snp_selection': False}. Best is trial 116 with value: 0.37577726394871724.
[I 2025-12-09 19:07:08,274] Trial 124 finished with value: 0.36013526762581655 and parameters: {'model_type': 'graphsage', 'hidden_dims': '[256, 128]', 'dropout': 0.2976743921937619, 'batch_norm': False, 'sage_aggr': 'mean', 'sage_normalize': False, 'sage_project': False, 'lr': 3.282488934144325e-05, 'weight_decay': 0.00010075365565584781, 'epochs': 97, 'loss': 'mse', 'optimizer': 'adam', 'graph_mode': 'cutoff', 'cutoff': 0.27057412575632367, 'grm_norm': 'cosine_then_gcn', 'self_loops': True, 'use_snp_selection': False}. Best is trial 116 with value: 0.37577726394871724.
[I 2025-12-09 19:07:44,511] Trial 125 finished with value: 0.25854956749627833 and parameters: {'model_type': 'graphsage', 'hidden_dims': '[256, 128]', 'dropout': 0.3317404936127924, 'batch_norm': False, 'sage_aggr': 'mean', 'sage_normalize': False, 'sage_project': False, 'lr': 0.0002550517278171304, 'weight_decay': 5.555666568831688e-05, 'epochs': 88, 'loss': 'mse', 'optimizer': 'adam', 'graph_mode': 'cutoff', 'cutoff': 0.42242506214451253, 'grm_norm': 'cosine_then_gcn', 'self_loops': True, 'use_snp_selection': False}. Best is trial 116 with value: 0.37577726394871724.
[I 2025-12-09 19:08:45,382] Trial 126 finished with value: 0.37174276179977506 and parameters: {'model_type': 'graphsage', 'hidden_dims': '[512, 128]', 'dropout': 0.3711672345896829, 'batch_norm': False, 'sage_aggr': 'mean', 'sage_normalize': False, 'sage_project': False, 'lr': 2.2482730645665653e-05, 'weight_decay': 8.212302881997494e-05, 'epochs': 115, 'loss': 'mse', 'optimizer': 'adam', 'graph_mode': 'cutoff', 'cutoff': 0.502798807867064, 'grm_norm': 'cosine', 'self_loops': True, 'use_snp_selection': False}. Best is trial 116 with value: 0.37577726394871724.
[I 2025-12-09 19:09:54,410] Trial 127 finished with value: 0.27981360397036625 and parameters: {'model_type': 'graphsage', 'hidden_dims': '[512, 128]', 'dropout': 0.376115344180439, 'batch_norm': False, 'sage_aggr': 'max', 'sage_normalize': False, 'sage_project': False, 'lr': 4.98350463734904e-05, 'weight_decay': 8.52650408243119e-05, 'epochs': 129, 'loss': 'mse', 'optimizer': 'adam', 'graph_mode': 'cutoff', 'cutoff': 0.49807488212014783, 'grm_norm': 'gcn', 'self_loops': True, 'use_snp_selection': False}. Best is trial 116 with value: 0.37577726394871724.
[I 2025-12-09 19:10:47,783] Trial 128 finished with value: 0.3539869397590639 and parameters: {'model_type': 'graphsage', 'hidden_dims': '[512, 128]', 'dropout': 0.34160007660700153, 'batch_norm': False, 'sage_aggr': 'mean', 'sage_normalize': False, 'sage_project': False, 'lr': 2.4975333115120737e-05, 'weight_decay': 7.216747924825939e-05, 'epochs': 115, 'loss': 'mse', 'optimizer': 'adam', 'graph_mode': 'cutoff', 'cutoff': 0.6070453967472562, 'grm_norm': 'cosine', 'self_loops': True, 'use_snp_selection': True, 'num_snps': 26241}. Best is trial 116 with value: 0.37577726394871724.
[I 2025-12-09 19:11:55,936] Trial 129 finished with value: 0.366399528749156 and parameters: {'model_type': 'graphsage', 'hidden_dims': '[512, 128]', 'dropout': 0.422244947108099, 'batch_norm': False, 'sage_aggr': 'mean', 'sage_normalize': False, 'sage_project': False, 'lr': 2.21808919245448e-05, 'weight_decay': 0.00013726758599782752, 'epochs': 125, 'loss': 'mse', 'optimizer': 'adam', 'graph_mode': 'cutoff', 'cutoff': 0.4477165382260018, 'grm_norm': 'cosine', 'self_loops': True, 'use_snp_selection': False}. Best is trial 116 with value: 0.37577726394871724.
[I 2025-12-09 19:12:52,578] Trial 130 finished with value: 0.3645007291343738 and parameters: {'model_type': 'graphsage', 'hidden_dims': '[512, 128]', 'dropout': 0.3639100392277993, 'batch_norm': False, 'sage_aggr': 'mean', 'sage_normalize': False, 'sage_project': False, 'lr': 3.1126737572422964e-05, 'weight_decay': 4.174885779989402e-05, 'epochs': 109, 'loss': 'mse', 'optimizer': 'adam', 'graph_mode': 'cutoff', 'cutoff': 0.5232583788268221, 'grm_norm': 'cosine', 'self_loops': True, 'use_snp_selection': False}. Best is trial 116 with value: 0.37577726394871724.
[I 2025-12-09 19:13:25,207] Trial 131 finished with value: 0.36477455075593246 and parameters: {'model_type': 'graphsage', 'hidden_dims': '[256, 128]', 'dropout': 0.31795062851837064, 'batch_norm': False, 'sage_aggr': 'mean', 'sage_normalize': False, 'sage_project': False, 'lr': 1.3610083057257298e-05, 'weight_decay': 2.5965632052608042e-05, 'epochs': 101, 'loss': 'mse', 'optimizer': 'adam', 'graph_mode': 'cutoff', 'cutoff': 0.8756800950792291, 'grm_norm': 'cosine', 'self_loops': True, 'use_snp_selection': False}. Best is trial 116 with value: 0.37577726394871724.
[I 2025-12-09 19:14:30,633] Trial 132 finished with value: 0.3688944779129925 and parameters: {'model_type': 'graphsage', 'hidden_dims': '[512, 64]', 'dropout': 0.41991209031712506, 'batch_norm': False, 'sage_aggr': 'mean', 'sage_normalize': False, 'sage_project': False, 'lr': 1.9571913629267546e-05, 'weight_decay': 6.158306298728437e-05, 'epochs': 121, 'loss': 'mse', 'optimizer': 'adam', 'graph_mode': 'cutoff', 'cutoff': 0.48516199952457995, 'grm_norm': 'cosine_then_gcn', 'self_loops': True, 'use_snp_selection': False}. Best is trial 116 with value: 0.37577726394871724.
[I 2025-12-09 19:15:02,354] Trial 133 finished with value: 0.3620232452824694 and parameters: {'model_type': 'graphsage', 'hidden_dims': '[256, 128, 64]', 'dropout': 0.256600367398834, 'batch_norm': False, 'sage_aggr': 'mean', 'sage_normalize': False, 'sage_project': False, 'lr': 1.674759907745843e-05, 'weight_decay': 3.1146759755449955e-05, 'epochs': 94, 'loss': 'mse', 'optimizer': 'adam', 'graph_mode': 'cutoff', 'cutoff': 0.5794176212477984, 'grm_norm': 'cosine_then_gcn', 'self_loops': True, 'use_snp_selection': False}. Best is trial 116 with value: 0.37577726394871724.
[I 2025-12-09 19:15:36,784] Trial 134 finished with value: 0.3664855987935714 and parameters: {'model_type': 'graphsage', 'hidden_dims': '[256, 128]', 'dropout': 0.30230257429506197, 'batch_norm': False, 'sage_aggr': 'mean', 'sage_normalize': False, 'sage_project': False, 'lr': 1.246754907507937e-05, 'weight_decay': 0.00010101940628482927, 'epochs': 106, 'loss': 'mse', 'optimizer': 'adam', 'graph_mode': 'cutoff', 'cutoff': 0.5568067636269995, 'grm_norm': 'cosine_then_gcn', 'self_loops': True, 'use_snp_selection': False}. Best is trial 116 with value: 0.37577726394871724.
[I 2025-12-09 19:16:04,821] Trial 135 finished with value: 0.28212918681265353 and parameters: {'model_type': 'graphsage', 'hidden_dims': '[128, 64]', 'dropout': 0.3716714781033534, 'batch_norm': False, 'sage_aggr': 'mean', 'sage_normalize': False, 'sage_project': False, 'lr': 3.72862805074359e-05, 'weight_decay': 5.081708006892886e-05, 'epochs': 115, 'loss': 'mse', 'optimizer': 'adam', 'graph_mode': 'cutoff', 'cutoff': 0.5095100204056909, 'grm_norm': 'cosine_then_gcn', 'self_loops': True, 'use_snp_selection': False}. Best is trial 116 with value: 0.37577726394871724.
[I 2025-12-09 19:18:34,240] Trial 136 finished with value: 0.3391112827161692 and parameters: {'model_type': 'graphsage', 'hidden_dims': '[512, 128]', 'dropout': 0.22682466792912961, 'batch_norm': False, 'sage_aggr': 'mean', 'sage_normalize': False, 'sage_project': False, 'lr': 2.0701227342238883e-05, 'weight_decay': 0.00018225358118568495, 'epochs': 345, 'loss': 'mse', 'optimizer': 'adam', 'graph_mode': 'cutoff', 'cutoff': 0.5396504560217558, 'grm_norm': 'cosine', 'self_loops': True, 'use_snp_selection': False}. Best is trial 116 with value: 0.37577726394871724.
[I 2025-12-09 19:19:08,074] Trial 137 finished with value: 0.3371607252361743 and parameters: {'model_type': 'graphsage', 'hidden_dims': '[256, 128]', 'dropout': 0.24587610457241454, 'batch_norm': True, 'sage_aggr': 'mean', 'sage_normalize': True, 'sage_project': False, 'lr': 2.641907487355302e-05, 'weight_decay': 3.699868680667071e-05, 'epochs': 82, 'loss': 'mse', 'optimizer': 'adam', 'graph_mode': 'cutoff', 'cutoff': 0.46638289891085816, 'grm_norm': 'cosine_then_gcn', 'self_loops': False, 'use_snp_selection': False}. Best is trial 116 with value: 0.37577726394871724.
[I 2025-12-09 19:19:36,138] Trial 138 finished with value: 0.3591116601516743 and parameters: {'model_type': 'graphsage', 'hidden_dims': '[256, 128]', 'dropout': 0.3946428583061383, 'batch_norm': False, 'sage_aggr': 'mean', 'sage_normalize': False, 'sage_project': False, 'lr': 1.528858494884415e-05, 'weight_decay': 1.7554593924124795e-07, 'epochs': 76, 'loss': 'mse', 'optimizer': 'adam', 'graph_mode': 'cutoff', 'cutoff': 0.5300284895217171, 'grm_norm': 'none', 'self_loops': True, 'use_snp_selection': False}. Best is trial 116 with value: 0.37577726394871724.
[I 2025-12-09 19:20:06,395] Trial 139 finished with value: 0.376105414027429 and parameters: {'model_type': 'graphsage', 'hidden_dims': '[256, 128]', 'dropout': 0.20608227971931342, 'batch_norm': False, 'sage_aggr': 'mean', 'sage_normalize': False, 'sage_project': False, 'lr': 1.78788614603455e-05, 'weight_decay': 8.257197492933872e-05, 'epochs': 90, 'loss': 'mse', 'optimizer': 'adam', 'graph_mode': 'cutoff', 'cutoff': 0.8235279245569815, 'grm_norm': 'cosine_then_gcn', 'self_loops': True, 'use_snp_selection': False}. Best is trial 139 with value: 0.376105414027429.
[I 2025-12-09 19:20:36,270] Trial 140 finished with value: 0.3747280568052879 and parameters: {'model_type': 'graphsage', 'hidden_dims': '[256, 128]', 'dropout': 0.20502285446331475, 'batch_norm': False, 'sage_aggr': 'mean', 'sage_normalize': False, 'sage_project': False, 'lr': 4.3128308818740766e-05, 'weight_decay': 8.239657975784957e-05, 'epochs': 88, 'loss': 'mse', 'optimizer': 'adam', 'graph_mode': 'cutoff', 'cutoff': 0.8700715684041097, 'grm_norm': 'cosine_then_gcn', 'self_loops': True, 'use_snp_selection': False}. Best is trial 139 with value: 0.376105414027429.
[I 2025-12-09 19:21:51,206] Trial 141 finished with value: 0.337115166103516 and parameters: {'model_type': 'graphsage', 'hidden_dims': '[256, 128]', 'dropout': 0.20621441910800353, 'batch_norm': False, 'sage_aggr': 'mean', 'sage_normalize': False, 'sage_project': False, 'lr': 4.2501169392524474e-05, 'weight_decay': 8.192274128854485e-05, 'epochs': 300, 'loss': 'mse', 'optimizer': 'adam', 'graph_mode': 'cutoff', 'cutoff': 0.8656548343576919, 'grm_norm': 'cosine_then_gcn', 'self_loops': True, 'use_snp_selection': False}. Best is trial 139 with value: 0.376105414027429.
[I 2025-12-09 19:22:21,073] Trial 142 finished with value: 0.3665785688804803 and parameters: {'model_type': 'graphsage', 'hidden_dims': '[256, 128]', 'dropout': 0.218572041746111, 'batch_norm': False, 'sage_aggr': 'mean', 'sage_normalize': False, 'sage_project': False, 'lr': 2.9643981093312162e-05, 'weight_decay': 0.0001083273123998244, 'epochs': 88, 'loss': 'mse', 'optimizer': 'adam', 'graph_mode': 'cutoff', 'cutoff': 0.8666854627268497, 'grm_norm': 'cosine_then_gcn', 'self_loops': True, 'use_snp_selection': False}. Best is trial 139 with value: 0.376105414027429.
