[I 2025-12-08 21:27:46,415] Trial 42 finished with value: 0.2866523948926878 and parameters: {'model_type': 'graphsage', 'hidden_dims': '[256, 128, 64]', 'dropout': 0.4800078183528175, 'batch_norm': False, 'sage_aggr': 'mean', 'sage_normalize': False, 'sage_project': False, 'lr': 0.00020674012050750942, 'weight_decay': 1.955367176286399e-05, 'epochs': 72, 'loss': 'mse', 'optimizer': 'adam', 'graph_mode': 'cutoff', 'cutoff': 0.7224702558578077, 'grm_norm': 'cosine', 'self_loops': True, 'use_snp_selection': True, 'num_snps': 32612}. Best is trial 21 with value: 0.3038298765701165.
[I 2025-12-08 21:28:14,492] Trial 43 finished with value: 0.2854107812733621 and parameters: {'model_type': 'graphsage', 'hidden_dims': '[128, 64]', 'dropout': 0.4408235551102908, 'batch_norm': False, 'sage_aggr': 'mean', 'sage_normalize': False, 'sage_project': False, 'lr': 0.00012497655108678762, 'weight_decay': 3.564437959983376e-05, 'epochs': 92, 'loss': 'mse', 'optimizer': 'adam', 'graph_mode': 'cutoff', 'cutoff': 0.6368997197825811, 'grm_norm': 'none', 'self_loops': True, 'use_snp_selection': True, 'num_snps': 42877}. Best is trial 21 with value: 0.3038298765701165.
[I 2025-12-08 21:29:29,937] Trial 44 finished with value: 0.3040776419673326 and parameters: {'model_type': 'graphsage', 'hidden_dims': '[512, 128]', 'dropout': 0.40787187497644967, 'batch_norm': False, 'sage_aggr': 'mean', 'sage_normalize': False, 'sage_project': False, 'lr': 1.1704845663889533e-05, 'weight_decay': 3.1506354229574334e-06, 'epochs': 144, 'loss': 'mse', 'optimizer': 'adam', 'graph_mode': 'cutoff', 'cutoff': 0.7885107224100243, 'grm_norm': 'cosine', 'self_loops': True, 'use_snp_selection': True, 'num_snps': 47642}. Best is trial 44 with value: 0.3040776419673326.
[I 2025-12-08 21:30:45,293] Trial 45 finished with value: 0.28556762808273356 and parameters: {'model_type': 'graphsage', 'hidden_dims': '[512, 128]', 'dropout': 0.4046928695099891, 'batch_norm': False, 'sage_aggr': 'max', 'sage_normalize': True, 'sage_project': False, 'lr': 1.0383175744942049e-05, 'weight_decay': 2.92178916419793e-06, 'epochs': 144, 'loss': 'mse', 'optimizer': 'adam', 'graph_mode': 'cutoff', 'cutoff': 0.8022414745312548, 'grm_norm': 'cosine_then_gcn', 'self_loops': True, 'use_snp_selection': True, 'num_snps': 47422}. Best is trial 44 with value: 0.3040776419673326.
[I 2025-12-08 21:31:39,021] Trial 46 finished with value: 0.29904769081397925 and parameters: {'model_type': 'graphsage', 'hidden_dims': '[512, 128]', 'dropout': 0.3568722065260515, 'batch_norm': False, 'sage_aggr': 'mean', 'sage_normalize': False, 'sage_project': False, 'lr': 1.8390097296372607e-05, 'weight_decay': 5.638488743203599e-07, 'epochs': 184, 'loss': 'mse', 'optimizer': 'adam', 'graph_mode': 'cutoff', 'cutoff': 0.7856517120130482, 'grm_norm': 'none', 'self_loops': False, 'use_snp_selection': True, 'num_snps': 27495}. Best is trial 44 with value: 0.3040776419673326.
[I 2025-12-08 21:33:15,570] Trial 47 finished with value: 0.2908942639732731 and parameters: {'model_type': 'graphsage', 'hidden_dims': '[512, 128]', 'dropout': 0.3614702780234742, 'batch_norm': False, 'sage_aggr': 'mean', 'sage_normalize': False, 'sage_project': False, 'lr': 1.6831798071467353e-05, 'weight_decay': 5.357219393645321e-07, 'epochs': 186, 'loss': 'mae', 'optimizer': 'adam', 'graph_mode': 'knn', 'knn_k': 7, 'weighted_edges': True, 'symmetrize_mode': 'union', 'self_loops': False, 'use_snp_selection': True, 'num_snps': 27345}. Best is trial 44 with value: 0.3040776419673326.
[I 2025-12-08 21:33:36,032] Trial 48 finished with value: 0.28704043624112063 and parameters: {'model_type': 'graphsage', 'hidden_dims': '[512, 128]', 'dropout': 0.3183503436481541, 'batch_norm': True, 'sage_aggr': 'mean', 'sage_normalize': False, 'sage_project': False, 'lr': 1.248085305979062e-05, 'weight_decay': 4.973280121293856e-07, 'epochs': 207, 'loss': 'mse', 'optimizer': 'adam', 'graph_mode': 'cutoff', 'cutoff': 0.7855350462331461, 'grm_norm': 'none', 'self_loops': False, 'use_snp_selection': True, 'num_snps': 6546}. Best is trial 44 with value: 0.3040776419673326.
[I 2025-12-08 21:34:16,732] Trial 49 finished with value: 0.2810131695597405 and parameters: {'model_type': 'graphsage', 'hidden_dims': '[512, 128]', 'dropout': 0.300007193881443, 'batch_norm': False, 'sage_aggr': 'max', 'sage_normalize': True, 'sage_project': False, 'lr': 2.3786835181447444e-05, 'weight_decay': 1.6425262484558973e-07, 'epochs': 160, 'loss': 'mse', 'optimizer': 'adam', 'graph_mode': 'cutoff', 'cutoff': 0.8611133560762543, 'grm_norm': 'none', 'self_loops': False, 'use_snp_selection': True, 'num_snps': 21931}. Best is trial 44 with value: 0.3040776419673326.
[I 2025-12-08 21:37:16,559] Trial 50 finished with value: 0.2954151201178982 and parameters: {'model_type': 'graphsage', 'hidden_dims': '[512, 128]', 'dropout': 0.35610771617818365, 'batch_norm': False, 'sage_aggr': 'mean', 'sage_normalize': False, 'sage_project': False, 'lr': 1.4144109105418538e-05, 'weight_decay': 7.883504151877973e-07, 'epochs': 350, 'loss': 'mae', 'optimizer': 'adam', 'graph_mode': 'cutoff', 'cutoff': 0.7576845571299675, 'grm_norm': 'none', 'self_loops': False, 'use_snp_selection': True, 'num_snps': 54531}. Best is trial 44 with value: 0.3040776419673326.
[I 2025-12-08 21:38:05,570] Trial 51 finished with value: 0.29568947281703056 and parameters: {'model_type': 'graphsage', 'hidden_dims': '[512, 128]', 'dropout': 0.3894895702053267, 'batch_norm': False, 'sage_aggr': 'mean', 'sage_normalize': False, 'sage_project': False, 'lr': 2.3259514328238614e-05, 'weight_decay': 9.930998095449964e-06, 'epochs': 154, 'loss': 'mse', 'optimizer': 'adam', 'graph_mode': 'cutoff', 'cutoff': 0.8568257415386602, 'grm_norm': 'none', 'self_loops': False, 'use_snp_selection': True, 'num_snps': 28655}. Best is trial 44 with value: 0.3040776419673326.
[I 2025-12-08 21:39:20,041] Trial 52 finished with value: 0.2917287329855858 and parameters: {'model_type': 'graphsage', 'hidden_dims': '[256, 128, 64]', 'dropout': 0.41399609405971144, 'batch_norm': False, 'sage_aggr': 'mean', 'sage_normalize': False, 'sage_project': False, 'lr': 4.755324514522523e-05, 'weight_decay': 4.670073032814586e-06, 'epochs': 180, 'loss': 'mse', 'optimizer': 'adam', 'graph_mode': 'cutoff', 'cutoff': 0.68951307147679, 'grm_norm': 'cosine', 'self_loops': True, 'use_snp_selection': True, 'num_snps': 58870}. Best is trial 44 with value: 0.3040776419673326.
[I 2025-12-08 21:40:24,397] Trial 53 finished with value: 0.29860316144998045 and parameters: {'model_type': 'graphsage', 'hidden_dims': '[512, 128]', 'dropout': 0.4274243545523307, 'batch_norm': False, 'sage_aggr': 'mean', 'sage_normalize': False, 'sage_project': False, 'lr': 1.0665205150126291e-05, 'weight_decay': 1.7199279268666442e-06, 'epochs': 111, 'loss': 'mse', 'optimizer': 'adam', 'graph_mode': 'cutoff', 'cutoff': 0.7225693489442871, 'grm_norm': 'none', 'self_loops': True, 'use_snp_selection': True, 'num_snps': 49667}. Best is trial 44 with value: 0.3040776419673326.
[I 2025-12-08 21:41:31,545] Trial 54 finished with value: 0.3035277898271539 and parameters: {'model_type': 'graphsage', 'hidden_dims': '[512, 128]', 'dropout': 0.34213995972451744, 'batch_norm': False, 'sage_aggr': 'mean', 'sage_normalize': False, 'sage_project': False, 'lr': 1.0960930361105084e-05, 'weight_decay': 1.4708295016530026e-06, 'epochs': 115, 'loss': 'mse', 'optimizer': 'adam', 'graph_mode': 'cutoff', 'cutoff': 0.7778167762813295, 'grm_norm': 'none', 'self_loops': True, 'use_snp_selection': True, 'num_snps': 49759}. Best is trial 44 with value: 0.3040776419673326.
[I 2025-12-08 21:42:40,970] Trial 55 finished with value: 0.3013474982521349 and parameters: {'model_type': 'graphsage', 'hidden_dims': '[512, 128]', 'dropout': 0.34486746759803416, 'batch_norm': False, 'sage_aggr': 'mean', 'sage_normalize': False, 'sage_project': False, 'lr': 1.7581468743804415e-05, 'weight_decay': 3.3013911245206564e-07, 'epochs': 128, 'loss': 'mse', 'optimizer': 'adam', 'graph_mode': 'cutoff', 'cutoff': 0.7767789762621141, 'grm_norm': 'none', 'self_loops': False, 'use_snp_selection': True, 'num_snps': 47956}. Best is trial 44 with value: 0.3040776419673326.
[I 2025-12-08 21:43:47,664] Trial 56 finished with value: 0.29923285314887027 and parameters: {'model_type': 'graphsage', 'hidden_dims': '[512, 128]', 'dropout': 0.3412137332467141, 'batch_norm': False, 'sage_aggr': 'mean', 'sage_normalize': False, 'sage_project': False, 'lr': 1.8622631599039422e-05, 'weight_decay': 3.290982786291407e-07, 'epochs': 117, 'loss': 'mse', 'optimizer': 'adam', 'graph_mode': 'cutoff', 'cutoff': 0.8965612580539517, 'grm_norm': 'none', 'self_loops': False, 'use_snp_selection': True, 'num_snps': 48910}. Best is trial 44 with value: 0.3040776419673326.
[I 2025-12-08 21:44:30,969] Trial 57 finished with value: 0.28786674947974983 and parameters: {'model_type': 'graphsage', 'hidden_dims': '[256, 128, 64]', 'dropout': 0.24553772059595158, 'batch_norm': False, 'sage_aggr': 'mean', 'sage_normalize': False, 'sage_project': False, 'lr': 1.4859845654718668e-05, 'weight_decay': 2.260874651523114e-07, 'epochs': 121, 'loss': 'mse', 'optimizer': 'adam', 'graph_mode': 'knn', 'knn_k': 4, 'weighted_edges': False, 'symmetrize_mode': 'mutual', 'self_loops': False, 'use_snp_selection': False}. Best is trial 44 with value: 0.3040776419673326.
[I 2025-12-08 21:45:23,208] Trial 58 finished with value: 0.29918204983050545 and parameters: {'model_type': 'graphsage', 'hidden_dims': '[512, 128]', 'dropout': 0.3287157490075157, 'batch_norm': False, 'sage_aggr': 'mean', 'sage_normalize': False, 'sage_project': False, 'lr': 3.7541390919756417e-05, 'weight_decay': 3.318594629616334e-07, 'epochs': 86, 'loss': 'mse', 'optimizer': 'adam', 'graph_mode': 'cutoff', 'cutoff': 0.8967279190844586, 'grm_norm': 'none', 'self_loops': False, 'use_snp_selection': True, 'num_snps': 48025}. Best is trial 44 with value: 0.3040776419673326.
[I 2025-12-08 21:46:15,728] Trial 59 finished with value: 0.295547422541683 and parameters: {'model_type': 'graphsage', 'hidden_dims': '[512, 256]', 'dropout': 0.2769259752289853, 'batch_norm': False, 'sage_aggr': 'mean', 'sage_normalize': False, 'sage_project': False, 'lr': 2.0826241217216093e-05, 'weight_decay': 1.1063684493954489e-06, 'epochs': 73, 'loss': 'mse', 'optimizer': 'adam', 'graph_mode': 'cutoff', 'cutoff': 0.8403309840411775, 'grm_norm': 'none', 'self_loops': False, 'use_snp_selection': True, 'num_snps': 53897}. Best is trial 44 with value: 0.3040776419673326.
[I 2025-12-08 21:47:19,046] Trial 60 finished with value: 0.3004649394689102 and parameters: {'model_type': 'graphsage', 'hidden_dims': '[512, 128]', 'dropout': 0.29331666780227417, 'batch_norm': False, 'sage_aggr': 'mean', 'sage_normalize': False, 'sage_project': False, 'lr': 1.1877986427591131e-05, 'weight_decay': 1.2550111717725216e-07, 'epochs': 127, 'loss': 'mse', 'optimizer': 'adam', 'graph_mode': 'cutoff', 'cutoff': 0.8263638564531466, 'grm_norm': 'none', 'self_loops': False, 'use_snp_selection': True, 'num_snps': 44296}. Best is trial 44 with value: 0.3040776419673326.
[I 2025-12-08 21:48:15,178] Trial 61 finished with value: 0.29902389130229257 and parameters: {'model_type': 'graphsage', 'hidden_dims': '[512, 128]', 'dropout': 0.29578754972386523, 'batch_norm': False, 'sage_aggr': 'mean', 'sage_normalize': False, 'sage_project': False, 'lr': 2.7715283982386494e-05, 'weight_decay': 1.1621020081831425e-07, 'epochs': 112, 'loss': 'mse', 'optimizer': 'adam', 'graph_mode': 'cutoff', 'cutoff': 0.8351477781030363, 'grm_norm': 'none', 'self_loops': False, 'use_snp_selection': True, 'num_snps': 43022}. Best is trial 44 with value: 0.3040776419673326.
[I 2025-12-08 21:49:28,220] Trial 62 finished with value: 0.2972019537378655 and parameters: {'model_type': 'graphsage', 'hidden_dims': '[512, 128]', 'dropout': 0.33556091907080177, 'batch_norm': False, 'sage_aggr': 'mean', 'sage_normalize': False, 'sage_project': False, 'lr': 1.2330390651727437e-05, 'weight_decay': 1.693980247146433e-07, 'epochs': 126, 'loss': 'mse', 'optimizer': 'adam', 'graph_mode': 'cutoff', 'cutoff': 0.8811607661504395, 'grm_norm': 'none', 'self_loops': False, 'use_snp_selection': True, 'num_snps': 50275}. Best is trial 44 with value: 0.3040776419673326.
[I 2025-12-08 21:50:39,165] Trial 63 finished with value: 0.29808605344576966 and parameters: {'model_type': 'graphsage', 'hidden_dims': '[512, 128]', 'dropout': 0.2609903407527288, 'batch_norm': False, 'sage_aggr': 'mean', 'sage_normalize': False, 'sage_project': False, 'lr': 1.626186200105552e-05, 'weight_decay': 4.1440529139018957e-07, 'epochs': 140, 'loss': 'mse', 'optimizer': 'adam', 'graph_mode': 'cutoff', 'cutoff': 0.760088056002064, 'grm_norm': 'none', 'self_loops': False, 'use_snp_selection': True, 'num_snps': 45764}. Best is trial 44 with value: 0.3040776419673326.
[I 2025-12-08 21:51:13,066] Trial 64 finished with value: 0.291336930946847 and parameters: {'model_type': 'graphsage', 'hidden_dims': '[512, 128]', 'dropout': 0.19369217957566268, 'batch_norm': False, 'sage_aggr': 'mean', 'sage_normalize': False, 'sage_project': False, 'lr': 1.1556481450121873e-05, 'weight_decay': 1.0231513898549127e-07, 'epochs': 51, 'loss': 'mse', 'optimizer': 'adam', 'graph_mode': 'cutoff', 'cutoff': 0.8207575584985896, 'grm_norm': 'none', 'self_loops': False, 'use_snp_selection': True, 'num_snps': 42086}. Best is trial 44 with value: 0.3040776419673326.
[I 2025-12-08 21:51:55,906] Trial 65 finished with value: 0.298747574372981 and parameters: {'model_type': 'graphsage', 'hidden_dims': '[256, 128, 64]', 'dropout': 0.3511695458303407, 'batch_norm': False, 'sage_aggr': 'mean', 'sage_normalize': False, 'sage_project': False, 'lr': 1.8064182289445022e-05, 'weight_decay': 2.2159638985384328e-07, 'epochs': 103, 'loss': 'mse', 'optimizer': 'adam', 'graph_mode': 'cutoff', 'cutoff': 0.7762751981021587, 'grm_norm': 'none', 'self_loops': False, 'use_snp_selection': True, 'num_snps': 48847}. Best is trial 44 with value: 0.3040776419673326.
[I 2025-12-08 21:52:55,359] Trial 66 finished with value: 0.29897316092174986 and parameters: {'model_type': 'graphsage', 'hidden_dims': '[512, 64]', 'dropout': 0.3109531291074725, 'batch_norm': False, 'sage_aggr': 'mean', 'sage_normalize': False, 'sage_project': False, 'lr': 2.795348611380613e-05, 'weight_decay': 3.255849173785159e-07, 'epochs': 115, 'loss': 'mse', 'optimizer': 'adam', 'graph_mode': 'cutoff', 'cutoff': 0.8687569040679963, 'grm_norm': 'gcn', 'self_loops': False, 'use_snp_selection': True, 'num_snps': 44744}. Best is trial 44 with value: 0.3040776419673326.
[I 2025-12-08 21:57:20,278] Trial 67 finished with value: 0.2665031223344896 and parameters: {'model_type': 'graphsage', 'hidden_dims': '[512, 128]', 'dropout': 0.1327786782855246, 'batch_norm': False, 'sage_aggr': 'mean', 'sage_normalize': True, 'sage_project': False, 'lr': 1.3931860467303442e-05, 'weight_decay': 2.4142891088223133e-06, 'epochs': 132, 'loss': 'mae', 'optimizer': 'adam', 'graph_mode': 'cutoff', 'cutoff': 0.20517049434190548, 'grm_norm': 'cosine_then_gcn', 'self_loops': False, 'use_snp_selection': True, 'num_snps': 57270}. Best is trial 44 with value: 0.3040776419673326.
[I 2025-12-08 21:58:42,160] Trial 68 finished with value: 0.274052609582181 and parameters: {'model_type': 'graphsage', 'hidden_dims': '[512, 128]', 'dropout': 0.2863700091425259, 'batch_norm': True, 'sage_aggr': 'mean', 'sage_normalize': False, 'sage_project': False, 'lr': 1.0094819840240121e-05, 'weight_decay': 1.112095466935708e-06, 'epochs': 151, 'loss': 'mse', 'optimizer': 'adam', 'graph_mode': 'cutoff', 'cutoff': 0.7487491663298188, 'grm_norm': 'none', 'self_loops': True, 'use_snp_selection': False}. Best is trial 44 with value: 0.3040776419673326.
[I 2025-12-08 21:59:40,199] Trial 69 finished with value: 0.3025422774189792 and parameters: {'model_type': 'graphsage', 'hidden_dims': '[512, 128]', 'dropout': 0.4894025932144182, 'batch_norm': False, 'sage_aggr': 'max', 'sage_normalize': False, 'sage_project': False, 'lr': 4.975859519052478e-05, 'weight_decay': 7.005459862245896e-07, 'epochs': 90, 'loss': 'mse', 'optimizer': 'adam', 'graph_mode': 'cutoff', 'cutoff': 0.8401071002095599, 'grm_norm': 'none', 'self_loops': True, 'use_snp_selection': True, 'num_snps': 51685}. Best is trial 44 with value: 0.3040776419673326.
[I 2025-12-08 22:00:22,342] Trial 70 finished with value: 0.29445114009199147 and parameters: {'model_type': 'graphsage', 'hidden_dims': '[256, 128, 64]', 'dropout': 0.49532731429007865, 'batch_norm': False, 'sage_aggr': 'max', 'sage_normalize': False, 'sage_project': False, 'lr': 4.2798745767560146e-05, 'weight_decay': 7.866392877000946e-07, 'epochs': 87, 'loss': 'mse', 'optimizer': 'adam', 'graph_mode': 'cutoff', 'cutoff': 0.8336750537348089, 'grm_norm': 'none', 'self_loops': True, 'use_snp_selection': True, 'num_snps': 53439}. Best is trial 44 with value: 0.3040776419673326.
[I 2025-12-08 22:01:26,545] Trial 71 finished with value: 0.29303647543825073 and parameters: {'model_type': 'graphsage', 'hidden_dims': '[512, 128]', 'dropout': 0.5270949051845837, 'batch_norm': False, 'sage_aggr': 'max', 'sage_normalize': False, 'sage_project': False, 'lr': 6.015007254891017e-05, 'weight_decay': 3.4579340045071303e-07, 'epochs': 104, 'loss': 'mse', 'optimizer': 'adam', 'graph_mode': 'cutoff', 'cutoff': 0.8901102656351509, 'grm_norm': 'none', 'self_loops': True, 'use_snp_selection': True, 'num_snps': 51771}. Best is trial 44 with value: 0.3040776419673326.
[I 2025-12-08 22:02:14,684] Trial 72 finished with value: 0.28841538556751833 and parameters: {'model_type': 'graphsage', 'hidden_dims': '[512, 128]', 'dropout': 0.47014826057826953, 'batch_norm': False, 'sage_aggr': 'max', 'sage_normalize': False, 'sage_project': False, 'lr': 2.0125528572495694e-05, 'weight_decay': 1.7298952357117905e-07, 'epochs': 77, 'loss': 'mse', 'optimizer': 'adam', 'graph_mode': 'cutoff', 'cutoff': 0.7926376703718536, 'grm_norm': 'none', 'self_loops': True, 'use_snp_selection': True, 'num_snps': 46565}. Best is trial 44 with value: 0.3040776419673326.
[I 2025-12-08 22:04:31,325] Trial 73 finished with value: 0.18475983312696642 and parameters: {'model_type': 'graphsage', 'hidden_dims': '[512, 128]', 'dropout': 0.5198921947359162, 'batch_norm': False, 'sage_aggr': 'max', 'sage_normalize': False, 'sage_project': False, 'lr': 5.209626581957686e-05, 'weight_decay': 1.2493984305697161e-06, 'epochs': 126, 'loss': 'mse', 'optimizer': 'adam', 'graph_mode': 'cutoff', 'cutoff': 0.3156222666760551, 'grm_norm': 'none', 'self_loops': True, 'use_snp_selection': True, 'num_snps': 49444}. Best is trial 44 with value: 0.3040776419673326.
[I 2025-12-08 22:05:34,874] Trial 74 finished with value: 0.2995188308182545 and parameters: {'model_type': 'graphsage', 'hidden_dims': '[512, 128]', 'dropout': 0.3960200018765315, 'batch_norm': False, 'sage_aggr': 'max', 'sage_normalize': False, 'sage_project': False, 'lr': 3.6290202893185895e-05, 'weight_decay': 1.199664699066608e-05, 'epochs': 93, 'loss': 'mse', 'optimizer': 'adam', 'graph_mode': 'cutoff', 'cutoff': 0.668712600746262, 'grm_norm': 'none', 'self_loops': True, 'use_snp_selection': True, 'num_snps': 55087}. Best is trial 44 with value: 0.3040776419673326.
[I 2025-12-08 22:06:40,087] Trial 75 finished with value: 0.2953471571461792 and parameters: {'model_type': 'graphsage', 'hidden_dims': '[512, 128]', 'dropout': 0.3938987866188688, 'batch_norm': False, 'sage_aggr': 'max', 'sage_normalize': False, 'sage_project': False, 'lr': 3.533471279193391e-05, 'weight_decay': 3.5613635069441163e-06, 'epochs': 96, 'loss': 'mse', 'optimizer': 'adam', 'graph_mode': 'cutoff', 'cutoff': 0.7221768154402236, 'grm_norm': 'gcn', 'self_loops': True, 'use_snp_selection': True, 'num_snps': 56544}. Best is trial 44 with value: 0.3040776419673326.
[I 2025-12-08 22:07:40,582] Trial 76 finished with value: 0.2944984702481187 and parameters: {'model_type': 'graphsage', 'hidden_dims': '[512, 256]', 'dropout': 0.49369185117483505, 'batch_norm': False, 'sage_aggr': 'max', 'sage_normalize': False, 'sage_project': False, 'lr': 7.547001601004859e-05, 'weight_decay': 1.3705951516760798e-05, 'epochs': 90, 'loss': 'mse', 'optimizer': 'adam', 'graph_mode': 'cutoff', 'cutoff': 0.6713838933283734, 'grm_norm': 'cosine', 'self_loops': True, 'use_snp_selection': True, 'num_snps': 55335}. Best is trial 44 with value: 0.3040776419673326.
[I 2025-12-08 22:09:01,818] Trial 77 finished with value: 0.22795412734963913 and parameters: {'model_type': 'graphsage', 'hidden_dims': '[512, 128]', 'dropout': 0.45474701777990245, 'batch_norm': False, 'sage_aggr': 'max', 'sage_normalize': False, 'sage_project': False, 'lr': 2.8655752789176e-05, 'weight_decay': 6.613687163207272e-07, 'epochs': 106, 'loss': 'mse', 'optimizer': 'adam', 'graph_mode': 'knn', 'knn_k': 3, 'weighted_edges': False, 'symmetrize_mode': 'union', 'self_loops': True, 'use_snp_selection': True, 'num_snps': 41149}. Best is trial 44 with value: 0.3040776419673326.
[I 2025-12-08 22:09:48,064] Trial 78 finished with value: 0.29327528284553683 and parameters: {'model_type': 'graphsage', 'hidden_dims': '[512, 64]', 'dropout': 0.37456130419820055, 'batch_norm': False, 'sage_aggr': 'max', 'sage_normalize': False, 'sage_project': False, 'lr': 1.3850199597354664e-05, 'weight_decay': 1.2704902845480339e-05, 'epochs': 62, 'loss': 'mse', 'optimizer': 'adam', 'graph_mode': 'cutoff', 'cutoff': 0.7386276726542224, 'grm_norm': 'cosine_then_gcn', 'self_loops': True, 'use_snp_selection': True, 'num_snps': 51860}. Best is trial 44 with value: 0.3040776419673326.
