[I 2025-12-08 20:17:37,727] Trial 7 finished with value: 0.2939168220889402 and parameters: {'model_type': 'graphsage', 'hidden_dims': '[512, 64]', 'dropout': 0.2585007811528941, 'batch_norm': True, 'sage_aggr': 'max', 'sage_normalize': True, 'sage_project': False, 'lr': 5.921425508303391e-05, 'weight_decay': 0.0004511561961144237, 'epochs': 182, 'loss': 'mae', 'optimizer': 'adam', 'graph_mode': 'knn', 'knn_k': 9, 'weighted_edges': True, 'symmetrize_mode': 'union', 'self_loops': False, 'use_snp_selection': True, 'num_snps': 23903}. Best is trial 6 with value: 0.29563558083383656.
[I 2025-12-08 20:18:19,428] Trial 8 finished with value: 0.25896274434413924 and parameters: {'model_type': 'graphsage', 'hidden_dims': '[512, 256]', 'dropout': 0.3061380386767003, 'batch_norm': False, 'sage_aggr': 'mean', 'sage_normalize': True, 'sage_project': False, 'lr': 0.000698401460570184, 'weight_decay': 2.965560055460244e-06, 'epochs': 289, 'loss': 'mae', 'optimizer': 'adam', 'graph_mode': 'knn', 'knn_k': 7, 'weighted_edges': False, 'symmetrize_mode': 'mutual', 'self_loops': True, 'use_snp_selection': True, 'num_snps': 4710}. Best is trial 6 with value: 0.29563558083383656.
[I 2025-12-08 20:21:58,120] Trial 9 finished with value: 0.29339209714489156 and parameters: {'model_type': 'graphsage', 'hidden_dims': '[512, 128]', 'dropout': 0.1733844071393634, 'batch_norm': False, 'sage_aggr': 'mean', 'sage_normalize': True, 'sage_project': False, 'lr': 0.0004269677918501597, 'weight_decay': 2.2439779626249696e-06, 'epochs': 319, 'loss': 'mse', 'optimizer': 'adam', 'graph_mode': 'cutoff', 'cutoff': 0.24117565767129295, 'grm_norm': 'cosine_then_gcn', 'self_loops': True, 'use_snp_selection': False}. Best is trial 6 with value: 0.29563558083383656.
[I 2025-12-08 20:22:52,949] Trial 10 finished with value: 0.30341393922263843 and parameters: {'model_type': 'graphsage', 'hidden_dims': '[256, 128, 64]', 'dropout': 0.5365714961141473, 'batch_norm': True, 'sage_aggr': 'mean', 'sage_normalize': False, 'sage_project': False, 'lr': 0.0060050040216813455, 'weight_decay': 4.9377500793081834e-05, 'epochs': 46, 'loss': 'mae', 'optimizer': 'adam', 'graph_mode': 'cutoff', 'cutoff': 0.8579871888501912, 'grm_norm': 'none', 'self_loops': True, 'use_snp_selection': True, 'num_snps': 59927}. Best is trial 10 with value: 0.30341393922263843.
[I 2025-12-08 20:23:46,512] Trial 11 finished with value: 0.29356317662313014 and parameters: {'model_type': 'graphsage', 'hidden_dims': '[256, 128, 64]', 'dropout': 0.5437810742461437, 'batch_norm': True, 'sage_aggr': 'mean', 'sage_normalize': False, 'sage_project': False, 'lr': 0.008000655871733665, 'weight_decay': 4.2521929457206324e-05, 'epochs': 47, 'loss': 'mae', 'optimizer': 'adam', 'graph_mode': 'cutoff', 'cutoff': 0.897550071387144, 'grm_norm': 'none', 'self_loops': True, 'use_snp_selection': True, 'num_snps': 57688}. Best is trial 10 with value: 0.30341393922263843.
[I 2025-12-08 20:24:33,664] Trial 12 finished with value: 0.2990403339767965 and parameters: {'model_type': 'graphsage', 'hidden_dims': '[256, 128, 64]', 'dropout': 0.4921208650038426, 'batch_norm': True, 'sage_aggr': 'mean', 'sage_normalize': False, 'sage_project': False, 'lr': 0.008796549023736102, 'weight_decay': 3.9327931719627325e-05, 'epochs': 41, 'loss': 'mae', 'optimizer': 'adam', 'graph_mode': 'cutoff', 'cutoff': 0.875858815737441, 'grm_norm': 'none', 'self_loops': True, 'use_snp_selection': True, 'num_snps': 47351}. Best is trial 10 with value: 0.30341393922263843.
[I 2025-12-08 20:25:41,050] Trial 13 finished with value: 0.30267888406946897 and parameters: {'model_type': 'graphsage', 'hidden_dims': '[256, 128]', 'dropout': 0.5237804302263875, 'batch_norm': True, 'sage_aggr': 'mean', 'sage_normalize': False, 'sage_project': False, 'lr': 0.008283626979251458, 'weight_decay': 2.207819306969384e-05, 'epochs': 96, 'loss': 'mae', 'optimizer': 'adam', 'graph_mode': 'cutoff', 'cutoff': 0.8958185940217869, 'grm_norm': 'cosine', 'self_loops': True, 'use_snp_selection': True, 'num_snps': 59441}. Best is trial 10 with value: 0.30341393922263843.
[I 2025-12-08 20:26:49,057] Trial 14 finished with value: 0.31038139608682375 and parameters: {'model_type': 'graphsage', 'hidden_dims': '[256, 128]', 'dropout': 0.44099154398585816, 'batch_norm': True, 'sage_aggr': 'mean', 'sage_normalize': False, 'sage_project': False, 'lr': 0.0022584522186862204, 'weight_decay': 1.0774511659769707e-05, 'epochs': 104, 'loss': 'mae', 'optimizer': 'adam', 'graph_mode': 'cutoff', 'cutoff': 0.6777772434939535, 'grm_norm': 'cosine', 'self_loops': True, 'use_snp_selection': True, 'num_snps': 58150}. Best is trial 14 with value: 0.31038139608682375.
[I 2025-12-08 20:27:40,537] Trial 15 finished with value: 0.30688690124793344 and parameters: {'model_type': 'graphsage', 'hidden_dims': '[256, 128]', 'dropout': 0.42543181002821906, 'batch_norm': True, 'sage_aggr': 'mean', 'sage_normalize': False, 'sage_project': False, 'lr': 0.0024071554981598764, 'weight_decay': 1.0335308460801528e-05, 'epochs': 105, 'loss': 'mae', 'optimizer': 'adam', 'graph_mode': 'cutoff', 'cutoff': 0.6672876084223166, 'grm_norm': 'cosine', 'self_loops': True, 'use_snp_selection': True, 'num_snps': 36728}. Best is trial 14 with value: 0.31038139608682375.
[I 2025-12-08 20:28:32,461] Trial 16 finished with value: 0.3056229987637759 and parameters: {'model_type': 'graphsage', 'hidden_dims': '[256, 128]', 'dropout': 0.43338897415269667, 'batch_norm': True, 'sage_aggr': 'mean', 'sage_normalize': False, 'sage_project': False, 'lr': 0.0018795800454544191, 'weight_decay': 6.819351157675037e-06, 'epochs': 105, 'loss': 'mae', 'optimizer': 'adam', 'graph_mode': 'cutoff', 'cutoff': 0.6320296584184086, 'grm_norm': 'cosine', 'self_loops': True, 'use_snp_selection': True, 'num_snps': 37821}. Best is trial 14 with value: 0.31038139608682375.
[I 2025-12-08 20:29:08,824] Trial 17 finished with value: 0.28996473066364076 and parameters: {'model_type': 'graphsage', 'hidden_dims': '[256, 128]', 'dropout': 0.4197996966562858, 'batch_norm': True, 'sage_aggr': 'mean', 'sage_normalize': False, 'sage_project': False, 'lr': 0.0016852093471773962, 'weight_decay': 9.91076359328813e-07, 'epochs': 107, 'loss': 'mae', 'optimizer': 'adam', 'graph_mode': 'cutoff', 'cutoff': 0.47136873750689057, 'grm_norm': 'cosine', 'self_loops': True, 'use_snp_selection': True, 'num_snps': 12981}. Best is trial 14 with value: 0.31038139608682375.
[I 2025-12-08 20:30:07,225] Trial 18 finished with value: 0.0 and parameters: {'model_type': 'graphsage', 'hidden_dims': '[256, 128]', 'dropout': 0.4178377111819785, 'batch_norm': False, 'sage_aggr': 'mean', 'sage_normalize': False, 'sage_project': False, 'lr': 0.0024294635428274668, 'weight_decay': 1.3706685005004048e-05, 'epochs': 223, 'loss': 'mae', 'optimizer': 'adam', 'graph_mode': 'cutoff', 'cutoff': 0.7201453597243914, 'grm_norm': 'cosine', 'self_loops': False, 'use_snp_selection': False}. Best is trial 14 with value: 0.31038139608682375.
[I 2025-12-08 20:31:06,590] Trial 19 finished with value: 0.3033007849166242 and parameters: {'model_type': 'graphsage', 'hidden_dims': '[256, 128]', 'dropout': 0.43978894356132553, 'batch_norm': True, 'sage_aggr': 'mean', 'sage_normalize': False, 'sage_project': False, 'lr': 0.0008985528640495278, 'weight_decay': 1.9712304112539645e-07, 'epochs': 85, 'loss': 'mae', 'optimizer': 'adam', 'graph_mode': 'cutoff', 'cutoff': 0.3611509356409789, 'grm_norm': 'cosine', 'self_loops': True, 'use_snp_selection': True, 'num_snps': 41029}. Best is trial 14 with value: 0.31038139608682375.
[I 2025-12-08 20:31:45,496] Trial 20 finished with value: 0.29736990776495753 and parameters: {'model_type': 'graphsage', 'hidden_dims': '[256, 128]', 'dropout': 0.3808416593694362, 'batch_norm': True, 'sage_aggr': 'mean', 'sage_normalize': False, 'sage_project': False, 'lr': 0.00014422520043585706, 'weight_decay': 3.6448967796645366e-06, 'epochs': 125, 'loss': 'mae', 'optimizer': 'adam', 'graph_mode': 'cutoff', 'cutoff': 0.702380065173265, 'grm_norm': 'gcn', 'self_loops': True, 'use_snp_selection': True, 'num_snps': 18929}. Best is trial 14 with value: 0.31038139608682375.
[I 2025-12-08 20:32:39,020] Trial 21 finished with value: 0.3017753537253488 and parameters: {'model_type': 'graphsage', 'hidden_dims': '[256, 128]', 'dropout': 0.4756966994024573, 'batch_norm': True, 'sage_aggr': 'mean', 'sage_normalize': False, 'sage_project': False, 'lr': 0.002744425241911751, 'weight_decay': 7.781441963079528e-06, 'epochs': 124, 'loss': 'mae', 'optimizer': 'adam', 'graph_mode': 'cutoff', 'cutoff': 0.6141904670987309, 'grm_norm': 'cosine', 'self_loops': True, 'use_snp_selection': True, 'num_snps': 35934}. Best is trial 14 with value: 0.31038139608682375.
[I 2025-12-08 20:33:32,194] Trial 22 finished with value: 0.30522377855218996 and parameters: {'model_type': 'graphsage', 'hidden_dims': '[256, 128]', 'dropout': 0.462256385222479, 'batch_norm': True, 'sage_aggr': 'mean', 'sage_normalize': False, 'sage_project': False, 'lr': 0.003878999405726254, 'weight_decay': 1.1769252202642524e-05, 'epochs': 95, 'loss': 'mae', 'optimizer': 'adam', 'graph_mode': 'cutoff', 'cutoff': 0.6448498560068698, 'grm_norm': 'cosine', 'self_loops': True, 'use_snp_selection': True, 'num_snps': 41193}. Best is trial 14 with value: 0.31038139608682375.
[I 2025-12-08 20:34:23,170] Trial 23 finished with value: 0.2983103877765466 and parameters: {'model_type': 'graphsage', 'hidden_dims': '[256, 128]', 'dropout': 0.5804721962097877, 'batch_norm': True, 'sage_aggr': 'mean', 'sage_normalize': False, 'sage_project': False, 'lr': 0.001244086744758445, 'weight_decay': 1.1246250757284833e-06, 'epochs': 76, 'loss': 'mae', 'optimizer': 'adam', 'graph_mode': 'cutoff', 'cutoff': 0.5215044698097842, 'grm_norm': 'cosine', 'self_loops': True, 'use_snp_selection': True, 'num_snps': 40020}. Best is trial 14 with value: 0.31038139608682375.
[I 2025-12-08 20:35:13,576] Trial 24 finished with value: 0.3041733069428854 and parameters: {'model_type': 'graphsage', 'hidden_dims': '[256, 128]', 'dropout': 0.38771801372630577, 'batch_norm': True, 'sage_aggr': 'mean', 'sage_normalize': False, 'sage_project': False, 'lr': 0.003691211156150796, 'weight_decay': 3.7664611062182367e-07, 'epochs': 123, 'loss': 'mae', 'optimizer': 'adam', 'graph_mode': 'cutoff', 'cutoff': 0.7814852347864082, 'grm_norm': 'cosine_then_gcn', 'self_loops': True, 'use_snp_selection': True, 'num_snps': 31650}. Best is trial 14 with value: 0.31038139608682375.
[I 2025-12-08 20:36:30,911] Trial 25 finished with value: 0.30284440162166815 and parameters: {'model_type': 'graphsage', 'hidden_dims': '[256, 128]', 'dropout': 0.3974552745964192, 'batch_norm': True, 'sage_aggr': 'mean', 'sage_normalize': False, 'sage_project': False, 'lr': 0.00151672324785116, 'weight_decay': 4.797601541642166e-06, 'epochs': 206, 'loss': 'mae', 'optimizer': 'adam', 'graph_mode': 'cutoff', 'cutoff': 0.6742686426264597, 'grm_norm': 'cosine', 'self_loops': True, 'use_snp_selection': True, 'num_snps': 46056}. Best is trial 14 with value: 0.31038139608682375.
[I 2025-12-08 20:37:17,866] Trial 26 finished with value: 0.30667598256782214 and parameters: {'model_type': 'graphsage', 'hidden_dims': '[256, 128]', 'dropout': 0.49714596002507483, 'batch_norm': True, 'sage_aggr': 'mean', 'sage_normalize': True, 'sage_project': False, 'lr': 0.0008686134743017156, 'weight_decay': 1.8512121794417567e-05, 'epochs': 163, 'loss': 'mse', 'optimizer': 'adam', 'graph_mode': 'cutoff', 'cutoff': 0.5815424398711826, 'grm_norm': 'cosine', 'self_loops': True, 'use_snp_selection': False}. Best is trial 14 with value: 0.31038139608682375.
[I 2025-12-08 20:37:51,147] Trial 27 finished with value: 0.2645117498552073 and parameters: {'model_type': 'graphsage', 'hidden_dims': '[128, 64]', 'dropout': 0.5971388255652089, 'batch_norm': False, 'sage_aggr': 'mean', 'sage_normalize': True, 'sage_project': False, 'lr': 0.0002173084213901401, 'weight_decay': 0.00010686898785923368, 'epochs': 165, 'loss': 'mse', 'optimizer': 'adam', 'graph_mode': 'cutoff', 'cutoff': 0.554187449333718, 'grm_norm': 'cosine', 'self_loops': False, 'use_snp_selection': False}. Best is trial 14 with value: 0.31038139608682375.
[I 2025-12-08 20:39:06,361] Trial 28 finished with value: 0.30243931019524745 and parameters: {'model_type': 'graphsage', 'hidden_dims': '[512, 64]', 'dropout': 0.4928214618143622, 'batch_norm': True, 'sage_aggr': 'mean', 'sage_normalize': True, 'sage_project': False, 'lr': 0.0010938323164849605, 'weight_decay': 0.0008072906457341084, 'epochs': 139, 'loss': 'mse', 'optimizer': 'adam', 'graph_mode': 'cutoff', 'cutoff': 0.4220869960560166, 'grm_norm': 'gcn', 'self_loops': True, 'use_snp_selection': False}. Best is trial 14 with value: 0.31038139608682375.
[I 2025-12-08 20:41:41,208] Trial 29 finished with value: 0.27444787589042485 and parameters: {'model_type': 'graphsage', 'hidden_dims': '[512, 256]', 'dropout': 0.5650794212644655, 'batch_norm': True, 'sage_aggr': 'max', 'sage_normalize': True, 'sage_project': False, 'lr': 0.0006674902595083882, 'weight_decay': 1.9724276006550168e-05, 'epochs': 247, 'loss': 'mse', 'optimizer': 'adam', 'graph_mode': 'knn', 'knn_k': 4, 'weighted_edges': False, 'symmetrize_mode': 'union', 'self_loops': True, 'use_snp_selection': False}. Best is trial 14 with value: 0.31038139608682375.
[I 2025-12-08 20:43:17,321] Trial 30 finished with value: 0.31405307096775703 and parameters: {'model_type': 'graphsage', 'hidden_dims': '[512, 128]', 'dropout': 0.5056979546537501, 'batch_norm': True, 'sage_aggr': 'mean', 'sage_normalize': True, 'sage_project': False, 'lr': 0.0044820903811614915, 'weight_decay': 0.00010928067658621046, 'epochs': 212, 'loss': 'mse', 'optimizer': 'adam', 'graph_mode': 'cutoff', 'cutoff': 0.7865833755028736, 'grm_norm': 'cosine_then_gcn', 'self_loops': True, 'use_snp_selection': False}. Best is trial 30 with value: 0.31405307096775703.
[I 2025-12-08 20:45:04,006] Trial 31 finished with value: 0.30716007024807185 and parameters: {'model_type': 'graphsage', 'hidden_dims': '[512, 128]', 'dropout': 0.5022436450673492, 'batch_norm': True, 'sage_aggr': 'mean', 'sage_normalize': True, 'sage_project': False, 'lr': 0.004615050903859797, 'weight_decay': 0.00020244339937352138, 'epochs': 239, 'loss': 'mse', 'optimizer': 'adam', 'graph_mode': 'cutoff', 'cutoff': 0.7778421262743748, 'grm_norm': 'cosine_then_gcn', 'self_loops': True, 'use_snp_selection': False}. Best is trial 30 with value: 0.31405307096775703.
[I 2025-12-08 20:47:00,076] Trial 32 finished with value: 0.3083481748964315 and parameters: {'model_type': 'graphsage', 'hidden_dims': '[512, 128]', 'dropout': 0.4499964751998426, 'batch_norm': True, 'sage_aggr': 'mean', 'sage_normalize': True, 'sage_project': False, 'lr': 0.004563175070465225, 'weight_decay': 0.00019647638061115496, 'epochs': 263, 'loss': 'mse', 'optimizer': 'adam', 'graph_mode': 'cutoff', 'cutoff': 0.8021377285280737, 'grm_norm': 'cosine_then_gcn', 'self_loops': True, 'use_snp_selection': False}. Best is trial 30 with value: 0.31405307096775703.
[I 2025-12-08 20:48:53,419] Trial 33 finished with value: 0.3082356752436703 and parameters: {'model_type': 'graphsage', 'hidden_dims': '[512, 128]', 'dropout': 0.45852757157110585, 'batch_norm': True, 'sage_aggr': 'mean', 'sage_normalize': True, 'sage_project': False, 'lr': 0.004611143186107108, 'weight_decay': 0.00019787918393978057, 'epochs': 256, 'loss': 'mse', 'optimizer': 'adam', 'graph_mode': 'cutoff', 'cutoff': 0.8026767818816327, 'grm_norm': 'cosine_then_gcn', 'self_loops': True, 'use_snp_selection': False}. Best is trial 30 with value: 0.31405307096775703.
[I 2025-12-08 20:50:48,015] Trial 34 finished with value: 0.2654934290111587 and parameters: {'model_type': 'graphsage', 'hidden_dims': '[512, 128]', 'dropout': 0.46113117775562057, 'batch_norm': False, 'sage_aggr': 'max', 'sage_normalize': True, 'sage_project': False, 'lr': 0.006114246744115624, 'weight_decay': 0.00034193280824399477, 'epochs': 261, 'loss': 'mse', 'optimizer': 'adam', 'graph_mode': 'cutoff', 'cutoff': 0.7861510838703238, 'grm_norm': 'cosine_then_gcn', 'self_loops': True, 'use_snp_selection': False}. Best is trial 30 with value: 0.31405307096775703.
[I 2025-12-08 20:53:36,231] Trial 35 finished with value: 0.28809829888756744 and parameters: {'model_type': 'graphsage', 'hidden_dims': '[512, 128]', 'dropout': 0.3666438988645417, 'batch_norm': True, 'sage_aggr': 'max', 'sage_normalize': True, 'sage_project': False, 'lr': 0.003486120384790966, 'weight_decay': 0.00010038021845076462, 'epochs': 271, 'loss': 'mse', 'optimizer': 'adam', 'graph_mode': 'knn', 'knn_k': 4, 'weighted_edges': True, 'symmetrize_mode': 'union', 'self_loops': True, 'use_snp_selection': False}. Best is trial 30 with value: 0.31405307096775703.
[I 2025-12-08 20:55:15,046] Trial 36 finished with value: 0.28409746538185543 and parameters: {'model_type': 'graphsage', 'hidden_dims': '[512, 128]', 'dropout': 0.526916163664489, 'batch_norm': True, 'sage_aggr': 'mean', 'sage_normalize': True, 'sage_project': False, 'lr': 0.004905382100981495, 'weight_decay': 0.0009720880626044805, 'epochs': 219, 'loss': 'mse', 'optimizer': 'adam', 'graph_mode': 'cutoff', 'cutoff': 0.8259841866354688, 'grm_norm': 'cosine_then_gcn', 'self_loops': False, 'use_snp_selection': False}. Best is trial 30 with value: 0.31405307096775703.
[I 2025-12-08 20:57:28,347] Trial 37 finished with value: 0.3102481373005406 and parameters: {'model_type': 'graphsage', 'hidden_dims': '[512, 128]', 'dropout': 0.33699227474830784, 'batch_norm': True, 'sage_aggr': 'mean', 'sage_normalize': True, 'sage_project': False, 'lr': 0.009546547771589328, 'weight_decay': 0.00014309312817357796, 'epochs': 307, 'loss': 'mse', 'optimizer': 'adam', 'graph_mode': 'cutoff', 'cutoff': 0.8269780011592873, 'grm_norm': 'cosine_then_gcn', 'self_loops': True, 'use_snp_selection': False}. Best is trial 30 with value: 0.31405307096775703.
[I 2025-12-08 21:02:43,259] Trial 38 finished with value: 0.1075381180350093 and parameters: {'model_type': 'graphsage', 'hidden_dims': '[512, 128]', 'dropout': 0.30884648032136236, 'batch_norm': False, 'sage_aggr': 'max', 'sage_normalize': True, 'sage_project': False, 'lr': 0.009493685942611959, 'weight_decay': 9.824158137109021e-05, 'epochs': 337, 'loss': 'mse', 'optimizer': 'adam', 'graph_mode': 'knn', 'knn_k': 10, 'weighted_edges': False, 'symmetrize_mode': 'union', 'self_loops': False, 'use_snp_selection': False}. Best is trial 30 with value: 0.31405307096775703.
[I 2025-12-08 21:04:54,600] Trial 39 finished with value: 0.2183716870729832 and parameters: {'model_type': 'graphsage', 'hidden_dims': '[512, 128]', 'dropout': 0.22579905026295577, 'batch_norm': True, 'sage_aggr': 'mean', 'sage_normalize': True, 'sage_project': False, 'lr': 0.006314262851337877, 'weight_decay': 0.0005504259200744987, 'epochs': 302, 'loss': 'mse', 'optimizer': 'adam', 'graph_mode': 'cutoff', 'cutoff': 0.7385721321640819, 'grm_norm': 'cosine_then_gcn', 'self_loops': True, 'use_snp_selection': False}. Best is trial 30 with value: 0.31405307096775703.
[I 2025-12-08 21:05:51,882] Trial 40 finished with value: 0.29826031425860317 and parameters: {'model_type': 'graphsage', 'hidden_dims': '[128, 64]', 'dropout': 0.33697158722719706, 'batch_norm': True, 'sage_aggr': 'mean', 'sage_normalize': True, 'sage_project': False, 'lr': 0.0030222291564739666, 'weight_decay': 0.00015783990851240217, 'epochs': 196, 'loss': 'mse', 'optimizer': 'adam', 'graph_mode': 'knn', 'knn_k': 3, 'weighted_edges': True, 'symmetrize_mode': 'union', 'self_loops': True, 'use_snp_selection': False}. Best is trial 30 with value: 0.31405307096775703.
[I 2025-12-08 21:07:45,067] Trial 41 finished with value: 0.3076296119451256 and parameters: {'model_type': 'graphsage', 'hidden_dims': '[512, 128]', 'dropout': 0.2940376100287389, 'batch_norm': True, 'sage_aggr': 'mean', 'sage_normalize': True, 'sage_project': False, 'lr': 0.0048446691027264266, 'weight_decay': 0.00014688776152655398, 'epochs': 255, 'loss': 'mse', 'optimizer': 'adam', 'graph_mode': 'cutoff', 'cutoff': 0.8355246211534149, 'grm_norm': 'cosine_then_gcn', 'self_loops': True, 'use_snp_selection': False}. Best is trial 30 with value: 0.31405307096775703.
[I 2025-12-08 21:09:55,636] Trial 42 finished with value: 0.29439432769491136 and parameters: {'model_type': 'graphsage', 'hidden_dims': '[512, 128]', 'dropout': 0.4552083749551246, 'batch_norm': True, 'sage_aggr': 'mean', 'sage_normalize': True, 'sage_project': False, 'lr': 0.0061617441080439195, 'weight_decay': 0.000266515991560228, 'epochs': 300, 'loss': 'mse', 'optimizer': 'adam', 'graph_mode': 'cutoff', 'cutoff': 0.8190125815118914, 'grm_norm': 'cosine_then_gcn', 'self_loops': True, 'use_snp_selection': False}. Best is trial 30 with value: 0.31405307096775703.
[I 2025-12-08 21:12:25,388] Trial 43 finished with value: 0.3064636715883425 and parameters: {'model_type': 'graphsage', 'hidden_dims': '[512, 128]', 'dropout': 0.34797568482903063, 'batch_norm': True, 'sage_aggr': 'mean', 'sage_normalize': True, 'sage_project': False, 'lr': 0.00211798802934988, 'weight_decay': 6.343917869892034e-05, 'epochs': 349, 'loss': 'mse', 'optimizer': 'adam', 'graph_mode': 'cutoff', 'cutoff': 0.8125002531102112, 'grm_norm': 'cosine_then_gcn', 'self_loops': True, 'use_snp_selection': False}. Best is trial 30 with value: 0.31405307096775703.
[I 2025-12-08 21:14:26,198] Trial 44 finished with value: 0.3033888638992193 and parameters: {'model_type': 'graphsage', 'hidden_dims': '[512, 128]', 'dropout': 0.4053487944897844, 'batch_norm': True, 'sage_aggr': 'mean', 'sage_normalize': True, 'sage_project': False, 'lr': 0.003327496526882166, 'weight_decay': 0.0004266748649092607, 'epochs': 275, 'loss': 'mse', 'optimizer': 'adam', 'graph_mode': 'cutoff', 'cutoff': 0.7216965696782445, 'grm_norm': 'cosine_then_gcn', 'self_loops': True, 'use_snp_selection': False}. Best is trial 30 with value: 0.31405307096775703.
